{
  "metadata": {
    "title": "The use of 2,2-dimethylbutane (neohexane) as a probe molecule of metal catalysts",
    "authors": "; ",
    "journal": "Applied Catalysis A: General",
    "date": "1994-07-07",
    "doi": "10.1016/0926-860X(94)85106-9",
    "abstract": "",
    "uri": "https://api.elsevier.com/content/article/pii/0926860X94851069",
    "pii": "0926860X94851069"
  },
  "fulltext": {
    "full-text-retrieval-response": {
      "scopus-eid": "2-s2.0-0028767527",
      "originalText": "serial JL 271346 291210 291744 291809 31 Applied Catalysis A: General APPLIEDCATALYSISAGENERAL 2001-08-27 2001-08-27 2010-10-02T11:38:12 1-s2.0-0926860X94851069 0926-860X(94)85106-9 0926860X94851069 10.1016/0926-860X(94)85106-9 S350 S350.2 HEAD-AND-TAIL 1-s2.0-S0926860X00X01858 2024-01-01T12:21:46.509935Z 0 0 19940707 1994 2001-08-27T00:00:00Z rawtext articleinfo crossmark dco dateupdated tomb dateloaded datesearch indexeddate issuelist volumelist yearnav articletitlenorm authfirstinitialnorm authfirstsurnamenorm cid cids contenttype copyright dateloadedtxt docsubtype doctype doi eid ewtransactionid hubeid issfirst issn issnnorm itemstage itemtransactionid itemweight openaccess openarchive pg pgfirst pglast pii piinorm pubdatestart pubdatetxt pubyr sectiontitle sortorder srctitle srctitlenorm srctype volfirst volissue webpdf webpdfpagecount affil articletitle auth authfirstini authfull authkeywords authlast footnotes primabst ref alllist content subj ssids 0926-860X 0926860X 114 114 1 1 Volume 114, Issue 1 2 9 33 9 33 19940707 7 July 1994 1994-07-07 1994 Review article fla Copyright Â© 1994 Published by Elsevier B.V. USE22DIMETHYLBUTANENEOHEXANEAPROBEMOLECULEMETALCATALYSTS BURCH R TAYLOR 1925 105 H PONEC 1983 149 V BURCH 1985 149 R CATALYSISSPECIALISTPERIODICALREPORTS BURCH 1991 233 R PAAL 1982 80 Z CATALYSISSPECIALISTPERIODICALREPORTS GAULT 1981 1 F ANDERSON 1966 446 J FOGER 1979 325 K VOGELZANG 1981 33 M PAAL 1988 595 Z 1985 STEREOCHEMISTRYHETEROGENEOUSMETALCATALYSTS BURWELL 1969 289 R PRUDHOMME 1966 832 J LEBRILLA 1986 1606 C ESKINAZI 1983 118 V TAKEHARA 1992 279 D PAAL 1992 297 Z CSICSERY 1962 313 S GUISNET 1976 1657 M CHRISTOFFEL 1980 430 E FOGER 1978 318 K PAAL 1978 350 Z HETEROGENEOUSCATALYSIS BURCH 1991 315 R PAAL 1981 9 Z VOGELZANG 1988 77 M SCHEPERS 1985 82 F LECLERCQ 1977 87 G PAAL 1979 131 Z COQ 1987 93 B CLARKE 1990 2789 J SARKANY 1989 1511 A CLARKE 1988 374 J COQ 1989 4904 B COQ 1990 103 B LECLERCQ 1986 1 G BOTMAN 1981 9 M NAKAMURA 1985 399 R MACHIELS 1979 268 C KOCHLOEFL 1968 140 K PONEC 1972 645 V PAAL 1977 234 Z DEJONGSTE 1976 915 H BOTMAN 1989 467 M DENHARTOG 1989 129 A ZIMMER 1982 3573 H CLARKE 1990 370 J WANG 1985 1 T SHI 1989 421 A SUSHUMNA 1987 77 I PAAL 1973 176 Z OLFEREVA 1981 605 T BOUDART 1968 35 M SARKANY 1989 1523 A ANDERSON 1987 36 J VAARKAMP 1993 611 M DENHARTOG 1988 1100 A GARLAND 1991 440 M LIESKE 1983 8 H PAAL 1991 331 Z GARIN 1989 100 F BAIRD 1992 1431 T GLASSL 1981 397 H BURCHX1994X9 BURCHX1994X9X33 BURCHX1994X9XR BURCHX1994X9X33XR item 0926-860X(94)85106-9 0926860X94851069 1-s2.0-0926860X94851069 10.1016/0926-860X(94)85106-9 271346 2024-01-01T12:21:46.509935Z 1994-07-07 1-s2.0-0926860X94851069-main.pdf https://s3.amazonaws.com/prod-ucs-content-store-us-east/content/pii:0926860X94851069/MAIN/application/pdf/7a86faf9c231a4a392c84354f5ee30a5/main.pdf https://s3-eu-west-1.amazonaws.com/prod-ucs-content-store-eu-west/content/pii:0926860X94851069/MAIN/application/pdf/7a86faf9c231a4a392c84354f5ee30a5/main.pdf main.pdf pdf true 1787397 MAIN 25 1-s2.0-0926860X94851069-main_1.png https://s3-eu-west-1.amazonaws.com/prod-ucs-content-store-eu-west/content/pii:0926860X94851069/PREVIEW/image/png/a9d633995664d7d68749ca2f0260d2e0/main_1.png https://s3.amazonaws.com/prod-ucs-content-store-us-east/content/pii:0926860X94851069/PREVIEW/image/png/a9d633995664d7d68749ca2f0260d2e0/main_1.png main_1.png png 54932 849 656 IMAGE-WEB-PDF 1 = A ELSEVIER Applied Catalysis A: General 114 (1994) 9-33 Review The use of 2,2-dimethylbutane (neohexane) as a probe molecule of metal catalysts R. Burcha'*, Z. paalb `Catalysis Research Group, Chemistry Department, University of Reading, Whiteknights, Reading, RG6 2AD, UK nstitute of Isotopes of the Hungarian Academy of Sciences, P.O. Box 77, Budapest, H-1525, Hungary (Received 18 October 1993; revised 11 February 1994; accepted 11 February 1994) Abstract Probe molecules can be used to complement surface characterisation techniques for elucidating the nature of possible active sites in supported metal catalysts. 2,24methylbutane (neohexane) is eminently suitable for this purpose because it combines an isobutyl and an ethyl group, representing two archetypes for hydrocarbon reactions on metal catalysts. In this review a survey is given of hydrogendeuterium exchange, hydrogenolysis, and isomerization of 2,2-dimethylbutane mainly on Group 810 metals, copper, and rhenium, as well as on their various alloys. Hydrogen-deuterium exchange results are presented, and interpretations in terms of factors such as different surface morphologies are considered. For 2,2-dimethylbutane, hydrogenolysis is the main reaction on most catalysts. Isomerization is restricted to platinum, palladium, and to some extent to iridium and nickel. The relative importance of isomerisation versus hydrogenolysis has been examined and it is shown that this is critically dependent on a number of factors, such as the dispersion of the metal, alloy formation, nonmetallic promoters, etc. The patterns of hydrogenolysis products can also be very informative because of the relationship between the observed product and the mode of adsorption of the 2,2-dimethylbutane molecule on different types of surface site. The use of 2,2-dimethylbutane to probe the surface composition of bimetallic particles has been discussed and the factors which influence the product distribution have been examined. The effect of non-metallic additives (water and chlorine) on the ratio of hydrogenolysis-to-isomerization is discussed and the possible important role of the metalsupport interface (`adlineation sites') is pointed out. Keywords: Copper; Deuterium exchange; Dimethylbutane; Hydrogenolysis; Iridium; Isomerization; Neohexane; Nickel; Palladium; Platinum; Rhenium; Ruthenium *Corresponding author. 0926-860X/94/$07.00 1994 Elsevier Science B.V. All rights reserved SSD10926-86OX (94)00024-L 10 R. Burch, Z. Padl /Applied Catalysis A: General 114 (1994) 9-33 Contents 1. Metal-hydrocarbon interactions in catalysis; the importance of using probe molecules ... ........... . 14 2. 2,2-Dimethylbutane as a probe molecule . . ..... ..... ........ .... .... ......... .. .. .... .... . .. ....... . 15 3. Hydrogen-deuterium exchange of 2,2-dimethylbutane over metals .... ..... .... ... .. ... ... ... .... .... 17 4. Skeletal reactions of 2,2-dimethylbutane . . ... ... . . . . . .. .... ..... . .... ..... ... ... ... .. .. .. .. 18 5. Hydrogenolysis patterns of 2,2-dimethylbutane 21 6. Probing catalyst compositions with 2,2-dimethylbutane ... . . . ...... ... .... .... .... ... ... .... .. . 23 7. Comparison of 2,2-dimethylbutane with other probe molecules ..... ... .... .... ..... .... .. . ... ... .. 24 8. Factors influencing product distribution . ... .... ... ... . ... ........ .... .... .... .... ........ ... ....... .. 27 9. Information obtained from the use of 2,2-dimethylbutane as probe molecule ..... .. .... . . ... ... .. .. . . 34 10. Conclusion 35 Acknowledgement 36 References 36 1. Metal-hydrocarbon interactions in catalysis; the importance of using probe molecules Since the introduction of the concept of the active site by H.S. Taylor [ 1 ], there have been many attempts to identify and describe active sites on catalyst surfaces. Various methods have been used to this end, including controlled modification of the catalyst surface (e.g., by alloying the active metal with a nominally inert additive [2] ) and/or by the use of different surface science (basically ultra high vacuum) techniques. The latter methods can only occasionally be used as in situ characterisation methods and, moreover, since the introduction of the reactants may very probably change the structure and properties of the catalyst surface [3,4], there is always a considerable doubt about the applicability of such methods to real catalysts. The need to develop genuine in situ techniques for characterising metal surfaces under normal operating conditions extends beyond the purely fundamental interest in active sites. For example, it would be very valuable if methods were available which could be used to monitor changes in the nature of metal catalysts during activation (calcination, reduction), regeneration, or redispersion, all of which are treatments used on real catalysts during their normal working lives. One possible approach to this problem is to use probe molecules, or probe reactions. In principle, reactant molecules provide the most sensitive and specific probe of the surface chemistry of an active site since in the course of their adsorption, reaction and desorption, they must have been associated with the active site. If we are able to interrogate these molecules after their sojourn on the catalyst we may be able to obtain almost direct information about the nature of the active catalyst surface, as far as its catalytic properties are concerned. The exact identification of the active sites as atoms or group of atoms in a certain chemical state and/or geometry still remains an open question. As part of an on-going research programme in the laboratories of both the authors [ 3,5 ] on the characterisation of metal catalysts for hydrocarbon reactions (reforming catalysts) we have begun to attempt to utilise probe reactions to monitor changes R. Burch, Z. Padl /Applied Catalysis A: General 114 (1994) 9-33 11 in the surface chemistry of platinum and Pt/Re reforming catalysts during and after the oxychlorination treatment used industrially to revitalise these catalysts. As a result of this research it has become apparent that some of the existing views on the types of active site required for hydrocarbon reactions (skeletal rearrangements and hydrogenolysis) may be incomplete. The detailed experimental evidence to support this statement will be published elsewhere. However, in the present paper we address the more general question of the specific use of 2,2-dimethylbutane (neohexane) as a probe reactant of the surface chemistry of metallic catalysts. Metal catalyzed hydrocarbon reactions include dehydrogenation, hydrogenolysis, and isomerisation, and, provided the structure of the molecules permit it, cyclization to five-membered cyclopentane rings or to six-membered aromatic cycles is also possible [ 5 ] . The formation and opening of cyclopentane-type structures may represent one of the routes to skeletal isomers [6]. These represent a host of various reaction routes, all, with the exception of dehydrogenation, involving the rupture (and/or formation) of C-C bonds (so-called `skeletal reactions'). Ponec [ 2 ] classified the metal-hydrocarbon interactions to be (i) 2C (interaction of two neighbouring C atoms with the catalyst); (ii) 3C (interaction of the first and the last C atoms in a C3 chain fragment with the catalyst); and (iii) 5C (interaction of a five C-atom molecular fragment with the catalyst). It is obvious, that (iii) leads to so-called CS-cyclic reactions [6] whereas (i) can lead to hydrogenolysis and (ii) to either hydrogenolysis or to `bond-shift type' [7] (or `C3cyclic') [ 2 ] isomerisation. One may decide to select a model compound for which all variations are possible (e.g., n-hexane); however, if one intends to deliberately keep down the number of possible transformations, it is better to select a model hydrocarbon with limited reaction pathways. In this way, the possible role of different types of metal-hydrocarbon interaction can be assessed. Obviously, different types of metal-hydrocarbon interactions will be favoured by different reactant structures. Foger and Anderson proposed two basic modes of interaction between a hydrocarbon and a catalytically active metal surface: a `CZunit mode' and an `iso-unit mode' reaction. They called the simplest molecules whose structure only permitted one or the other type of reaction `archetypes' [ 8] . Neopentane (2,2-dimethylpropane) represents the archetype for the iso-unit type reaction. 2. 2,2-Dimethylbutane as a probe molecule Since neopentane is a very symmetrical molecule in which only 3C-type interactions are possible, this molecule does not offer a high number of variations and does not, therefore, provide much information about different types of adsorption intermediate or about small variations in catalytic properties. 2,2-dimethylbutane (neohexane), which contains just one CHZ group more offers four types of metalhydrocarbon interactions including a,6 { type (i) } and two type (ii) interactions: a Y CH neo-hexane R. Burch, Z Paal /Applied Catalysis A: General 114 (1994) 9-33 H3C ..eh ~C~ --1 1e0-pentane H 2C-CH CH3 Pt PI HaC- e s ~~ CH /c\\ 9 HzCCH i-butane or 2-memylpentane i-pentane or 2,3-dimethylbutane .Chla d.CH9 ;cue aiz --p-i-pentane or 3-methylpentm Scheme 1. Neo-hexane as a probe of surface morphology. Table 1 Products produced from a single-step conversion of 2,2-dimethylbutane due to different forms of adsorbed intermediate Interaction Activated bond Products of single-step conversion Isomerisation Hydrogenolysis ay' CZ-CS 2,3-dimethylbutane isopentane C2-C3 2-methylpentane isobutane ay C,-q 3-methylpentane isopentane a/3 C3-C4 - neopentane Only the larger fragment is shown. ay and ay', the latter interaction being able to activate either CI-C2 or C2-C3 bonds, as depicted in Scheme 1. The a(3 interaction represents a CZ-unit whereas the others lead to an iso-unit mode of reaction. These interactions, providing they involve only a single step, lead to various hydrogenolysis and isomerisation products as shown in Table 1 [ 9] . The fraction of products involving multiple transformations was, in most cases, rather low, hence the results shown characterise, indeed, reactions during one sojourn of the reactant on the surface. 2,2-Dimethylbutane represents a peculiar type of probe molecule. Although it lacks some of the finer subtleties of other molecules, like, methylcyclopentane, for example, where the ratio of ring opening products can reveal minor changes in catalyst structure, particle size, metal-support interactions or state of surface carbonization ( or carburization ) [ 10 ] , 2,2-dimethylbutane can be extremely sensitive to apparently small changes in the catalyst. It interacts either with its t-butyl or with R. Burch, Z. Padl /Applied Catalysis A: General 114 (1994) 9-33 13 its ethyl group attached to the surface and the former interaction may either lead to hydrogenolysis or to isomerisation. In certain circumstances, the change in product selectivity, e.g., from hydrogenolysis to isomerisation, can be very drastic, and in some cases rather clear effects can be obtained when 2,2-dimethylbutane is used to probe metal catalyst surfaces. 2,2-Dimethylbutane represents a product of ring opening of 1,1,3-trimethylcyclopropane, this reaction probing the stereochemical aspects of catalysis [ 11 ] . 3. Hydrogen-deuterium exchange of 2,2-dimethylbutane over metals H-D exchange represents a reaction involving the breaking and formation of CH bonds only. Since all skeletal reactions are usually preceded by loss of one or more H atoms from the reacting alkane, the study of the exchange reaction may be useful to elucidate their initial and final steps. Single exchange means the breaking and re-formation of one C-H bond, whereas multiple exchange involves several such elementary actions during one sojourn of the molecule on the surface. The propagation of multiple exchange involves usually repeated a 1i interactions [ 12] and a quaternary C atom presents an effective blocking to all of the H atoms being exchanged. That is the reason why `multiple' exchange in 2,2-dimethylbutane usually means the incorporation of up to 5 D atoms in its ethyl group. The exchange over nickel film at 0 leads to 98% monodeuterated product together with 2% d2. A platinum film at 20 resulted in 67% dl and 16% d3 product, palladium at 85 gave 31 % d, and 57% d5 product [ 13 ] . The percentage of other deuterated products was small, the maximum number of deuterium atoms being 5 in one neohexane molecule. These authors also studied the deuterium content of deuterolysis of 1,1,3-trimethylcyclopentane. The deuterium distribution was shifted toward more d2-d5 between 116 and 200 over Pt-A1203 with 2 to 4% d6 product [ 14], the overall conversion being increased simultaneously from 4 to 18%. Table 2 shows that the H-D exchange over Pt/Si02, Pd/Si02 [15] as well as over Rh/Si02 [ 16] catalysts at 75 to 110 gave d, to d5 products of various distributions which showed no systematic changes as a function of dispersion (between 11 and 108%) or of the temperature of the hydrogen pretreatment (100 to 450) following a standard oxygen pretreatment at 300. Various metals gave very different exchange patterns. The extent of exchange was much higher in the ethyl group than in the tent-butyl group over rhodium, the ratio t-bu/et varying between 0.05 and 0.17. Catalysts with medium dispersion gave the highest values. At variance with the finding of Lebrilla and Maier [ 14 ] , Eskinazi and Burwell [ 15 ] reported more H-D exchange in the tent-butyl than in the ethyl group over platinum catalysts, the t-bu/et ratio being always higher than unity over platinum catalysts. This ratio was at intermediate values over palladium, this catalyst giving certainly the highest amount of multiply exchanged species in the dl-d5 range. 14 R. Burch, Z. Padl /Applied Catalysis A: General 114 (1994) 9-33 Table 2 H-D exchange in 2,2-dimethylbutane over various catalysts (After Burwell and co-workers (15,16] ) Catalyst d, d, d3 d4 ds t-bu/et TOF' Pt/Si02 b 17-27 25-39 19-24 16-32 1.3-2.3 1.3-9 Pt/SiOz/H2/100` - 20-32 32-42 17-23 15-22 1.3-1.8 0.4-1.8 Pt/Si02/HZ/450 - 24-28 24-29 19-23 25-28 1.9-2.2 8-17 Pd/S'02 b 3-10 8-14 14-37 42-78 0.3-1.0 0.7-8.9 Pd/Si02/HZ/100 - 4-9 6-12 18-30 50-64 0.4-0.8 0.9-3.4 Pd/SiO2/H2/450 - 1r14 9-21 31-36 29-53 0.3-0.5 3.3-10 Rh/SiOZ 6-42 13-21 13-24 14-26 9-35 0.05-0.17 3.7-10 Rh/Si02/HZ/100(11%) 10 10 21 19 40 5 Rh/Si02/H,/450(108%) 44 26 15 10 5 330 Expressed as 10-2 reacted molecules per surface platinum atom per second. b d, species were not reported because of difficulties in analysis. Treated at the temperature noted in hydrogen, cooled in hydrogen. Catalyst dispersion is shown in brackets. The various exchange patterns were interpreted in terms of different surface morphologies involving, most probably, sites comprising more than one metal atom. The possible interaction of surface hydrogen with OH groups of the silica support in the rhodium catalyst with exceedingly high activity (dispersion 108%, pretreated in hydrogen at 450) was not excluded [16]. With platinum and palladium catalysts a remarkable lack of correlation of the d5 species with dispersion was observed [ 15 ] . The two possible explanations proposed involved either `extractive chemisorption', or the absence of really flat surfaces even in catalysts with relatively low dispersion. This latter model has a vague resemblance to the suggested predominance of rounded high-Miller-index faces in various supported and unsupported catalysts in the stable sintered state [ 17 ] . 4. Skeletal reactions of 2,2-dimethylbutane Csicsery and Pines [ 18 ] studied the conversion of neohexane over an `acid-free' chromia-alumina catalyst. The main products at 14% conversion were ethane plus ethene, isobutene and 3,3-dimethylbutene-1 (with selectivities of 25, 21 and 22%, respectively). The total isomerisation selectivity was about 6%, including about 0.5% dimethylbutene and 5% 2-methylpentene. These authors have formulated the `C3 cyclic' skeletal isomerisation pathway prior to the postulation of the bond shift mechanism over metal catalysts, based, mainly on the presence of ca. 0.1% 1,1,2trimethylcyclopropane in the product. Earlier studies of reactions of alkane - including also 2,2-dimethylbutane over supported metal catalysts were discussed in terms of the bifunctional mechanism attributing skeletal isomerisation to acidic centres [ 19 ] . The acid catalyzed isomerisation of 2,2-dimethylbutane involves carbocations. Three different methods of kinetic analysis of bifunctional reactions of all five hexane isomers present R. Burch, Z. PadllApplied Catalysis A: General 114 (1994) 9-33 15 simultaneously in a mixture reacting over Pt/A1203 (435, 10.5 bar, HZ/hydrocarbon ratio 20) all gave the highest relative rate constant for the reaction of 2,2 dimethylbutane to 2,3-dimethylbutane (around 4 as compared with constants below unity for methylpentane formation or fragmentation) [20]. This is in agreement with the known fact that the stability of carbenium ions decreases from tertiary toward primary ones [ 19 ] , hence the formation of 2,3-dimethylbutane (involving reaction of a secondary to tertiary carbenium ion) should be favoured. Platinum catalysts supported on various zeolites showed rather high isomerisation selectivities (15 to 98% between 200 and 310) . The amount of isomers was proportional to the acidity of the support and was, therefore, attributed to a dual function effect, i.e., to the combined interaction of metallic and acidic sites [ 21 ] . This may be a satisfactory explanation when 2,3-dimethylbutane was the only isomer formed (over 3% Pt supported on various zeolites); however, mixtures of Pt/Si02 with various zeolites resulted in the formation of other hexane isomers also, including n-hexane which must have involved a metal-catalyzed route [ 21 ] . Recent work in one of our laboratories [22] indicates that other factors, and hence alternative mechanisms, may be important. Thus, as we shall discuss later, apparently small differences in the pretreatment of even alumina-supported platinum catalysts can result in large variations in the selectivity for isomerisation (e.g., from 9 to 72%, see later, Table 9) . It now seems possible that the variation in the acidity may not be directly responsible for the enhanced isomerisation selectivity. An alternative possibility which may cause the observed changes in selectivity can be the presence of some incompletely reduced platinum in the cages of the zeolitic support. The presence of electron-deficient platinum species as shown by the ESCA spectrum of Pt-zeolites [ 21 ] seems to confirm this point. The actual ratio for various types of interaction (according to Table 1) has been calculated from product distributions over Pt, Pd, Ir and Ni catalysts (Table 3). The major skeletal reaction of neohexane over metals is hydrogenolysis. The isomerisation selectivity decreased roughly in the order Pt = Pd Ir > Ni and so did the importance of 1,3 (ay' plus ay) interactions as compared with a/3 interactions, i.e., lower isomerisation selectivities were usually concomitant with enhanced formation of neopentane (see also later). Isomerisation of 2,2-dimethylbutane seems to be restricted to platinum and palladium, and sometimes iridium and nickel. Its extent depends on the conditions and also the properties of the actual catalyst samples (see also later, Sections 6 and 8). Neohexane is also able to undergo aromatization. This reaction requires hydrogen-deficient conditions, hence the yields reported when pulses were introduced into helium carrier gas were higher than with hydrogen carrier gas. A benzene selectivity of 43% was reported at 390 over Pd black while this value was as low as 7% over Pt black at 420 (both in helium). These values dropped to 4% and 0.5 %, respectively in hydrogen carrier gas [ 25 ] . Aromatization must involve a two-step bond shift isomerization without desorption of any intermediates. This process seems to be more facilitated over palladium than over platinum, as indicated 16 R. Burch, Z Padl /Applied Catalysis A: General 114 (1994) 9-33 Table 3 Estimated importance of hydrocarbon-metal interactions and selectivities Catalyst T/ Type of interaction (%) ay' ay aG MRS,_6 S,Yd` Reference Pt black 360 53 17 9 21 9 91 [231 Pt/SiO2 (5 nm) 290 68 30 2 - 74 26 [91 EUROPT-1(60%`) fresh 230 62 35 3 - 54 46 [91 EUROPT-1, steady-state 250 51 36 13 - 42 58 [91 EUROPT-if (60%`) 290 51 22 - 27 36 64 [241 EUROPT-3r (ca. 100%`) 290 57 17 - 26 41 59 [241 Pt/TiO~ (60%e) 290 57 17 tr. 16 54 46 [241 Pd black 390 - - - - 168 78 [251 Pd/SiOz 347 35 64 2 46 54 [91 Pd/SiOZ(carbonised) 347 52 27 2 69 31 [91 Ir/Si02 224 6 - 94 0 100 [91 It black plus Si02 350 49 17 26 7 93 [ 91 Ni powder 220 9 12 76 3 0 100 [91 Ni/Si02 255 10 5 80 5 6\" 94 [271 \" Products of multiple reactions including propane, n-butane, n-pentane and n-hexane. b Isomerisation selectivity. ` Hydrogenolysis selectivity. 6%Pt/Si02. ` Metal dispersion. j Reduced at 300. 8 4% aromatics. \" Including 2% cyclic product. also by the apparent activation energies (Pd: 57; Pt: 84 kJ mol -') [ 25 ] . The Ea value over palladium was almost the same as observed for n-hexane and 3-methylpentane, pointing to a common rate determining step (which could not be the rearrangement of the carbon skeleton). In contrast, aromatization of n-hexane required a much lower Ea value on platinum (44 kJ mol'), indicating the skeletal rearrangement step (s) to be rate determining over this catalyst. Small amounts of benzene and methylcyclopentane (up to 2% selectivity) have also been reported over Ir/Si02 [26]. Under hydrogen-deficient conditions favouring benzene formation, a dehydrogenation to 3,3-dimethylbutene-1 was also observed. This is apparently another possible product of an ap interaction with insufficient hydrogen present. The amount increased when pulses were introduced in helium onto a Pt black catalyst without regeneration, with a simultaneous abrupt decrease of hydrogenolysis, while the benzene yield showed a maximum (Fig. 1) [ 23 ] . The yield of 3,3-dimethylbutene-1 was much lower than that of alkenes from 3-methylpentane or 2,3-dimethylbutane over Pd black at 390, being around 0.4% in helium, and this value decreased slowly to ca. 0.2% when the hydrogen content of the gas reached 100% [25]. R. Burch, Z Padl /Applied Catalysis A: General 114 (1994) 9-33 17 ProdUCI,% 2 ~v~ v~i d~ 1 -10 2 3 4 5 Pulse No. Fig. 1. Yields of hydrogenolysis (, Benzene ( X ) and 3,3-dimethylbutene-1 (V) from 2,2-dimethylbutane in subsequent 3 N,1 pulses introduced in a helium cagier gas onto 0.4 g Pt black catalyst; T= 360. Adapted from ref. [23]. 5. Hydrogenolysis patterns of 2,2-dimethylbutane Splitting of C-C bonds in various positions can be conveniently characterised by the reactivity factor, c) defined by Leclercq et al. [28] as being in any position actual rate of rupture co expected rate of rupture (random fission) The major skeletal reaction of neohexane over metals is hydrogenolysis. Three types of single C-C bond splitting may occur in 2,2-dimethylbutane, giving isobutane (plus ethane), isopentane (plus methane) and neopentane (plus methane) as the primary fragments (cf. Table 1 and Scheme 1) . Summing up the amounts of the larger fragments (isoC4, isoC5 and neoC5), dividing this sum by 3 and relating this value to the actual amount of fragments would give an approximate value of w in the corresponding positions. The statistical weight of the primary-toquaternary C-C bond is 3:1, i.e., the amount of isopentane produced by this sort of splitting should be divided by 3. The individual values of cu can vary from zero to 3 and their sum must be equal to 3. This procedure leaves products of multiple CC bond splitting (resulting in e.g., propane or n-butane) out of consideration and gives, therefore, numerical values different from previous calculations considering all fragments [ 28-30 ] . Selected co values are shown in Table 4. Assigning the fragments to various hydrocarbon-metal interactions has been done with the assumption that an a-/ interaction leading to isopentane is negligible as compared with formation of isobutane, as suggested by Botman et al. [ 37 ] . This procedure may slightly overestimate the ay interaction and, conversely, underestimate the ay' one; however, as 18 R. Burch, Z. Padl /Applied Catalysis A: General 114 (1994) 9-33 Table 4 Hydrogenolysis pattern of 2,2-dimethylbutane on various catalysts Catalyst T/ H_/2,2DMB w(i-C4)ay' 0)(i-C5) ay (or ay) m(neoCs)aS Ref. Pt black 360 pulse' 2.7 0.1 0.2 [231 Pt/A1203 300 10 - 2 - 0.3 - 0.8 [ 281 9% Pt/Si0= 290 18 2.3 0.4 0.3 [91 EUROPT-1 230 18 2.2 0.5 0.3 [91 EUROPT-1 (steady-state) 250 18 1.7 0.5 0.9 [91 Pt/Ti02 (red. 250) 226 50-100 1.9 0.7 0.4 [ 311 (red. 300) 290 14 2.2 0.8 0.0 [ 241 Pd/SiO2(fresh) 337 18 0.7 1.6 0.7 [91 Pd/Si02(carb) 337 18 0.6 1.8 0.6 [91 Ir-black 325 18 2.1 0.04 0.86 [91 Ir-bl (carb) 350 18 1.7 0.1 1.2 [91 Ir/Si02 224 18 0.0 0.2 2.8 [91 Ir/SiOz 222 0.8 0.65 0.2 2.15 [321 Rh/Si02 218 44 0.1 0.3 2.6 [331 Rh/Si02 220 5.3 0.0 0.08 2.9 [341 Rh/A120,(15nm) 220 5.3 0.05 0.05 2.9 [301 Rh/A12030.2nm) 220 5.3 0.1 0.1 2.8 [301 Ru/A1I03 ca.200 45 0.1 0.06 2.8 [351 Ni powd. 220 18 0.3 0.1 2.6 [91 Ni/Si02 (6 run) 255 18 0.3 0.06 2.6 [271 Ni/S102 (1 nm) 255 18 0.4 0.05 2.5 [271 Ni/SiOz 220 10 0.2 0.1 2.7 [361 Cr203-A1203 528 0 3 0.01 0.005 [ 181 50%He, 50%Hz carrier gas. pointed out by Botman et al. [ 37 ] , `this possible error does not invalidate any of the conclusions made.' The catalysts in Table 4 show a great variation as far as the preferred direction of the reaction is concerned. Platinum produces mostly the isobutane fragment (ay' interaction). Somewhat surprisingly, this is the main fragment over Mo/A1203 catalysts reduced to zerovalent molybdenum [ 38 ] . Palladium is the only metal where isopentane (ay interaction) is the preferred product. Iridium shows the largest uncertainties, depending on the method of preparation, support, and probably also on the particle size, caused, in part, also by multiple reactions. Neopentane ( a (3 interaction) is the most abundant primary product over most rhodium catalysts shown here and also over Ru/A1203, nickel or cobalt supported on silicon carbide [ 39 ] . Nickel caused demethylation of the ethyl group with a suppressed splitting of the quaternary-primary C-C bond [40]. Another study (where the calculation of rv considered also the fragments of multiple splitting) gave numerically different values but showed also a preference for the formation of isobutane on platinum, of isopentane on palladium and of neopentane over iridium and rhodium [29], in qualitative agreement with Table 4. Another splitting parameter, Mf considers the multiplicity of fragmentation by relating the amount of fragments containing more than 1 carbon atom to that of R. Burch, Z Padl /Applied Catalysis A: General 114 (1994) 9-33 19 methane [ 41 ] . If this ratio is higher than one, internal or random fission occurs, an Mf=1 indicates terminal demethylation, while Mf < 1 is observed with true multiple splitting. The values of Mf increased with increasing temperature over Ir/Si02 samples (from about Mf= 2 to M f = 7) [ 26 ] . This was taken as an evidence for the increasing role of 1,3-interactions at higher temperatures. The temperature depend ence of a modified fission parameter (Mf) excluding the amounts of isobutane plus ethane (ay' interaction) was much less pronounced. The multiplicity of fragmentation, ~ (i.e., the number of fragment molecules per molecule of neohexane split up [42]) was just above 2 over Rh/A1203 [ 30] as well as on Ru/A1203 [ 35], indicating that single rupture was the main reaction over this catalyst in spite of its high hydrogenolysis selectivity. 6. Probing catalyst compositions with 2,2-dimethylbutane Adding catalytically inactive alloying metals such as silver or gold to platinum increased the isomerisation selectivity to 94-98% as opposed to 28-52% over unalloyed platinum ( [ 9 ] , cf. also Table 3) . At the same time, the a (3 type interaction was suppressed. Less marked enhancement of isomerisation was seen with Pd-Ag. The possible importance of this finding will be discussed in Section 8. The overall activity of Pt/Si02 decreased by a factor of ca. 10 from 100% Pt to 60%Pt-40%Cu [ 37 ] ; a further increase of copper content had a considerably smaller effect. As opposed to the other additives mentioned, hydrogenolysis selectivity increased above 40% Cu content without a corresponding increase of the a/3 interaction (Table 5) . This was interpreted by assuming that Pt-Cu ensembles possessed an intrinsic catalytic activity in hydrogenolysis. Table 5 Comparison of n-hexane and 2,2-dimethylbutane reactions over various metal catalysts (After [27,37,43] Catalyst composition (%) n-hexane 2,2-dimethylbutane S<C66 Si-c Sc,clud S<C6b Silo, _(1C4) W(ICS) wneoCS) Pt100 10 65 25 25 75 2 0.5 0.5 Pt75Cu25 l0 65 25 20 80 1.7 0.9 0.4 Pt30Cu7O 55 5 40 75 25 2.5 0.4 0.1 Ptl.8Cu98.8 60 5 35 70 30 2.5 0.4 0.1 Ni (6 nm) 97 2 1 100 - 0.3 0.06 2.6` Ni (1 nm) 96 3 1 100 - 0.4 0.05 2.50 Estimating on the basis of diagrams in the original references. Temperature= 300'C for Pt-based catalysts and 256 for Ni. Selectivity to isomerisation. ` Selectivity to hydrogenolysis. Methylcyclopentane and benzene combined together. ` See also Table 4. 20 R. Burch, Z Padl /Applied Catalysis A: General 114 (1994) 9-33 The activity of Pt-Re/A1203 catalysts was higher than that of pure platinum, especially above 40% Re. In contrast with Table 3 [ 9 ] , the isomerisation selectivity reported for high dispersion Re-free Pt/A1203 was around 10-20% (see later, Table 7) and this remained so up to 50% Re content and it disappeared entirely at 60% or more rhenium [ 44 ] . A heavy carbonization of Pt-Re/A1203 catalysts decreased the activities by factors between 15 and 50. At the same time, the isomerisation selectivity was about 95% up to 40% Re, decreasing only to 40% with 60% Re content in the alloy. Most isomers were formed via ay' interaction, the extent of which decreased parallel to that of the isomerisation selectivity. The selectivity of products of multiple fragmentation also increased to about 20% at higher rhenium content. This was reflected also by the variation of Mf values [ 44 ] . Results with EUROPT-4 (0.3% Pt 0.3% Re on y-A1203, i.e., 50% Re content) indicate isomerisation selectivities up to 45% [ 45 ] , but even with this high value, neopentane formation was markedly higher than that observed with monometallic Pt/A1203 catalysts. The activity of a 90%Rh-10%Cu/Si02 catalyst was lower by a factor of 25 than that of pure Rh/Si02 [33]. No isomerisation was reported. Adding copper shifted the fragmentation pattern slightly towards isobutane formation (at 218, co= 0.17 ) with somewhat less isopentane fragment (w= 0.1) and left almost unchanged, still predominant, neopentane formation (c) = 2.7; cf. these with the corresponding values for rhodium catalysts in Table 4) . Coq et al. [ 34 ] observed more isopentane than isobutane in the range of 100% Rh to 25%Rh-75%Cu on A1203-supported catalysts, its amount increasing somewhat when more copper was present. Neopentane formation predominated with all catalyst compositions. Addition of inactive alloying components increased, in general, isomerisation ability of the catalysts studied. Copper and rhenium, however, enhanced hydrogenolysis, the fragmentation pattern remaining essentially unchanged with copper but shifting towards neopentane formation and multiple hydrogenolysis with rhenium, which is a rather active multiple splitting catalyst in its own right [ 42 ] . A peculiar additive, VOCI, has been claimed to exert a geometric influence by decreasing the possibility of multi-site reactions, including the multiple fission over rhodium. The decrease of the isomerisation selectivity on Pt/VOCl was attributed to the possibility of single-site hydrogenolysis [ 46 ] . Its effect was comparable with that of copper additive. 7. Comparison of 2,2-dimethylbutane with other probe molecules Table 5 demonstrates that essentially the same selectivity pattern was observed with n-hexane and 2,2-dimethylbutane as a function of the composition of Pt-Cu alloys [ 37,43 ] , with slightly higher actual values for hydrogenolysis of 2,2-dimethylbutane, indicating that this reaction may be favoured by the structure containing R. Burch, Z Padl /Applied Catalysis A: General 114 (1994) 9-33 L 13 1 2 3 4 5 6 p(HZ )I104Pa b 6 p(HZ)1104Pa Fig. 2. (a) Initial rate of rupture of the bond between the quaternary carbon atom and its most substituted neighbouring atom as a function of hydrogen pressure on a Pt black catalyst [47]. (b) Initial rate of rupture of the C,-C,v bonds (same reagents as Fig. 2a) [46]. a quaternary C-atom. The cumulative selectivity for nondestructive reactions from n-hexane is higher than from 2,2-dimethylbutane, although that of isomerisation proper is lower, since the common C5 cyclic surface intermediate responsible for most of the isomerisation of n-hexane can form both isomers and methylcyclopentane [5,6]. The reactions of various hydrocarbons containing quaternary C atoms have been compared over Pt black [ 47 ] . The overall reaction rates for all hydrocarbons had pronounced maxima as a function of hydrogen pressure at 330 and 10 Torr hydrocarbon pressure at p ( H2 ) 60-120 Torr. Hydrogenolysis was the predominant reaction. The rates measured at the maximum were as shown in Figs. 2a and b. One can see that the reactivity of the C-C bond splitting between the quaternary C atom and its most substituted neighbour increased considerably with increasing substitution of the latter, while the rate of demethylation generally showed an opposite trend. Clarke et al. [ 31,48 ] , in contrast, reported more trimethylbutane than isobutane from 2,2,3,3-tetramethylbutane, over Pt/Ti02reduced at both 300 and 400. The product pattern from 2,2-dimethylbutane was also different over these catalysts. 22 R. Burch, Z. Padl /Applied Catalysis A: General 114 (1994) 9-33 Table 6 Effect of alloying rhodium with copper on the reactivity of various hydrocarbons (After ref. [ 341) Catalyst T/ Reactivity, (TOFh') for: nH 2MP 2,2DMB 2,2,3,3T- MCP MB Rh/Si02 220 41 15 11 2.6 140 25%Rh75%Cu/Si02 220 0.3 0.1 0.13 0.007 0.4 (136)(150)\" (85)(370)(350)\" Values in brackets are the approximate ratio of the two preceding lines (activity on rhodium divided by activity on RhCu). The amount of trimethylbutane fragment increased from 1.4 to 27% on decreasing the metal particle size from 15 to 1.2 nm with Rh /A1203 [ 30 ] . The isomerisation selectivity of 2,2-dimethylbutane was much lower over 10%lr/Si02 than that of pentane isomers at a HZ/hydrocarbon ratio of 2, Si being 5.1, 1.2 and 0.03% for n-pentane, 2-methylbutane and 2,2-dimethylbutane, respectively [ 32 ] . The turnover frequencies (given as 10' molecules s-' g(Pt) -') for 2,2-dimethylpropane (neopentane), 2,2-dimethylbutane and 2,2,3,3-tetramethylbutane were 8.7, 19 and 15.2, respectively over a Pt/Ti02 catalyst at 300, being somewhat at variance with the sequence seen in Fig. 2, owing, maybe, to the much higher hydrogen excess used by Clarke et al. [ 31 ] . Various reactants gave rather different turnover frequencies (TOF) over Rh/ A1203, 2,2-dimethylbutane being among the less reactive hydrocarbons. The reactivity of various molecules over a 25%Rh-75%Cu catalysts did not decrease uniformly, 2,2-dimethylbutane showing the lowest extent of deactivation although even this represents a factor of nearly 100 (Table 6) [ 34 ] . The change of activity upon alloying rhodium with copper was less marked with 2,2-dimethylbutane than with methylcyclopentane (Table 6) . In addition, the selectivities also underwent more pronounced changes with the cyclic hydrocarbon. The ratio of neopentane to isopentane (being the most abundant products from neohexane) was 12 over rhodium and 4.3 over 25%Rh/75%Cu. The ratio of ring opening products (2methylpentane/n-hexane) from methylcyclopentane was as follows: 14.2 over rhodium and 2.7 over 25%Rh/75%Cu/A1203 [34]. The sequence of reactivities over Ru/A1203 of high dispersion was similar to that observed with Rh/A1203 (compare Table 6 with Table 8, see later) while 2,2dimethylbutane was nearly as reactive as other hexane isomers over ruthenium sponge [ 35 ] . Dispersion effects at the same time brought about larger changes in methylcyclopentane ring opening: the ratio 2-methylpentane/n-hexane being 8.9 over Ru with D = 0.07 and 11.2 over ruthenium with D =1 [ 35 ] . A particularly large particle size sensitivity was seen over Rh/A1203 [30] (see also Section 8). The reactivities of 2,2-dimethylbutane and 2,2,3,3-tetramethylbutane on platinum catalysts seemed to show the opposite trend to rhodium or ruthenium. It is not R. Burch, Z. Padl /Applied Catalysis A: General 114 (1994) 9-33 23 clear if this is an intrinsic property of the metals in question or is due to different catalyst treatments or reaction conditions. Methylcyclopentane was more reactive than 2,2-dimethylbutane on Pt/Ti02 catalysts reduced at different temperatures [ 31,48 ] . The dramatic switch-over of the reaction of neohexane over Pt/Ti02 from the a/3 to ay mode was accompanied by a not very pronounced change in the selectivity of methylcyclopentane ring opening, the ratio 2-methylpentane/n-hexane decreasing from 8 to 5 in the same temperature range. 8. Factors influencing product distribution The selectivities reported as typical values e.g., in Table 3 may vary considerably as a function of actual catalyst sample, its origin, previous life and the experimental conditions. Pronounced particle size effects have been reported for platinum and iridium. Platinum catalysts with particle sizes from 0.85 to 14 nn were compared in neohexane reactions [44] . The support for more disperse catalysts was alumina while medium or larger crystallites were supported on silica. Hydrogenolysis selectivity of 80 to 95% was observed with the smallest crystallites, this value dropping to 20-30% for particles of 12-14 nm. The ratio of various interactions is also shown in Table 7 the first line referring to a Pt/A1203 catalyst, the second and third lines to Pt/Si02. It was claimed [44] that the change of support brought about no apparent effects in catalytic properties. However, the high isomerisation selectivity over EUROPT-1(see, for example, Table 3) as compared with the values observed on Pt/A1203 could certainly indicate that this statement may not have a general validity. Large crystallites of Ir/Si02 had an isomerisation selectivity up to 60% whereas this value reached 30% with smaller iridium particles. A heat treatment of the former at T> 380 brought the selectivity pattern close to that of the sample with smaller crystallite size [ 26 ] . The predominant isomer was 2-methylpentane (selectivity up to 30%) . Table 7 Neohexane reactions over platinum catalysts with different particle sizes (T= 300, H2/2,2-dimethylbutane=18. After ref. [44] ) d/nm Type of interaction Selectivity Hydrogenolysis pattern ay' ay ap Sj_ (aY +ay) Shy& m(iC4) w(iCs) w(neoCs) 0.85 44 28 18\" 19 (15+4) 81 1.6 0.4 1.0 4 57 28 10\" 36 (29+7) 64 1.8 0.5 0.7 14 75 22 l\" 84 (67+17) 16 2.2 0.5 0.3 \" The values missing from 100% belong to multiple hydrogenolysis (2 to 10%). 24 R. Burch, Z. Padl /Applied Catalysis A: General 114 (1994) 9-33 Table 8 Particle size effect on the reactivity of various hydrocarbons over rhodium and ruthenium catalysts (after refs. [30,35]) Catalyst T/ Reactivity (TOF, h-') for: nH 2MP 2,2DMB 2,2,3,3TMB MCP Rh/A1203 (15 nm) 220 185 185 390 260 500 Rh/Al203 (1.2 nm) 220 38 42 35 1.3 30 (5.3)(4.4)(11)(200)(17)' Rusponge 185 350 450 420 145 - Ru/A1203 (7 185 400 170 210 22 90 Ru/A1203 (100%6) 185 15 13 6 0.5 25 (27)(13)(35)\" (44)(3.6)' Values in brackets are the approximate ratio of the two preceding lines (activity of large particle divided by activity of small particles). 6 Metal dispersion. Nickel with smaller crystallites gave somewhat more isobutane fragments than nickel with larger particles [ 27 ] . Higher temperatures also increased somewhat the ay' interaction, mostly at the expense of the ai interaction [ 27 ] . Particle size had no marked effect on the product distribution on ruthenium catalysts (hydrogenolysis mainly to neopentane), although the turnover frequency dropped considerably starting from a very low dispersion sponge to ruthenium with 105% dispersion [ 35 ] . The overall rate of reaction of 2,2-dimethylbutane showed a more marked particle size effect than hydrocarbons without a quaternary C atom over Ru /A1203 (Table 8) [ 35 ] which probably indicates the necessity of multiatom sites for its hydrogenolysis. At the same time only small changes in selectivity were observed, the main product in all cases being neopentane (compare Table 4). Similar marked particle size dependence was reported on Rh/A1203 [ 30] . When considering metal particle size effects, one has to remember that `true particle size effects' are often indistinguishable from `apparent particle size effects' induced by the support, different actual crystallite shapes, etc., which may not be reflected in the usual methods of measuring dispersion. Pretreatments in different atmospheres may change the equilibrium shape of small crystallites [49,50], hence they may expose active ensembles with different geometries. Variations in the reduction temperature can produce very pronounced selectivity changes with the same catalysts [ 22,24,45 ] . Table 9 shows selectivities obtained over a number of supported platinum and Pt-Re catalysts with dispersions between 0.6 and 1.0. Reduction of Pt/A1203 at 500 prior to experiment results in more (sometimes much more) isomerisation than after reduction at 300. No such effect is seen with EUROPT-1 where a pretreatment at 300 produces rather high amounts of isomers. A possible explanation of the higher isomerisation selectivity at higher reduction temperature can be extracted from the very detailed electron microscopy studies of Pt/A1203 [51]. Heating in oxygen at 500 (or higher temperatures) for 2 h R. Burch, Z. Padl /Applied Catalysis A: General 114 (1994) 9-33 25 Table 9 Neohexane reactions over platinum catalysts after different pretreatments (T=290, p(Hz) /p(2,2DMB) -5.3 ) Catalyst Type of interaction MR\" Selectivity Hydrogenolysis pattern Ref, ay ay ap Si_ Shy& &)(iC4) w(iC5) w(neoCs) EUROPT-1 (300b) 60 29 1 19 50 50 2.0 0.9 0.1 [221 EUROPT-I (500b) 51 28 1 20 48 52 2.1 0.8 0.1 [221 EUROPT-3 (300 52 25 11 12 5 95 2.2 0.4 0.5 [ 22 ] EUROPT-3 (500 69 21 2 7 62 38 1.8 0.9 0.3 [221 Pt/Ti02 (300 42 28 - 30 10 90 2.4 0.6 0 [241 Pt/T'02 (500b) 69 16 - 15 55 45 2.1 0.9 0 1241 Pt/Ti02 (300b)` 56 34 2 8 3 97 2.4 0.5 0.1 1311 Pt/Ti02 (400b)` 49 41 < 1 9 3 97 2.3 0.6 <0.1 [481 Pt/A1203 (3006)47 29 17 7 24 76 1.5 0.5 1.0 1221 Pt/A1203 (500d 50 31 12 7 41 59 1.3 0.7 1.0 [221 Pt/A1203 (300e 48 27 13 12 9 91 2.0 0.4 0.6 [221 Pt/A1203 (500` 45 32 11 12 23 77 1.7 0.6 0.7 [221 EUROPT-4 (300 40 34 19 7 26 74 1.3 0.5 1.2 [451 EUROPT-4 (500 53 34 12 5 44 56 1.4 0.6 1.0 [451 Indicating multiple reactions producing propane, n-butane, n-pentane, n-hexane. Repeated hydrogenolysis leading to excess methane and ethane [ 31,48] was not considered. b Reduction temperature. ` T=290,p(HZ)/p(2,2DMB) -50-100 (as specified in the original reference). 0.3% Pt catalyst prepared from chloride-free precursor. e 2.0% Pt catalyst prepared from chloride-free precursor. resulted in diminished crystallite sizes and the appearance of a diffuse halo around rounded platinum particles of about 10 nm diameter. Electron diffraction suggested the presence of Pt304and also A12Pt. Particle sizes were restored upon heating in hydrogen at 500 for 4 h (indicating that most of the surface of the visible particles had been reduced) but the diffraction rings did not disappear entirely. Although the oxidation took place at higher temperatures and longer times as compared with those applied in refs. [ 22,45 ] (oxygen treatment: 400, 2 h), the essence of the underlying phenomena may be the same. High isomerisation selectivities are generally concomitant with a high percentage of the ay' interaction. At the same time, ay interactions under these conditions generally give mainly isopentane, as indicated by its enhanced w value. This type of interaction is not particularly favourable for isomerisation: the amount of 3methylpentane is, as a rule, much lower than that of 2,3-dimethylbutane, which is the most abundant isomer. Note the rather large co value for neopentane over EUROPT-4 (0.3% Pt 0.3%Re/A1203), as compared with EUROPT-3 (0.3%Pt/ A1203), even at rather high values of isomerisation selectivity, due, most likely, to the intrinsic catalytic properties of rhenium. One may wonder if this may mean intimately mixed Pt-Re ensembles or rather isolated rhenium sites. Contradictory results have been reported for Pt/T'02 (Table 9); the different hydrogen /hydrocarbon ratio may be one reason for this difference. These variations, the marked support effect and the fact that the selectivities can be changed 26 R. Burch, Z. Padl /Applied Catalysis A: General 114 (1994) 9-33 Table 10 Hydrogen effects on the direction of splitting of 2,2-dimethylbutane (After ref. [ 321) Catalyst T/ HZ/2,2DMB m(i-C,)ay' co(i-C5) try (or ay') WneOCOag lr/A1203 200 0.8 0.6 0.1 2.3 200 1.6 0.3 0.03 2.7 200 16 0.1 0.005 2.9 reversibly between certain limits by repeated pretreatments [22] cast some doubt on whether particle size effects are the only reason for many of the selectivity changes discussed in the previous paragraphs. Variations in the hydrogen pressure changed the product distribution remarkably (see Table 10) . These results for iridium catalysts are in good agreement with the suggestions of Foger and Anderson who proposed that the `iso-unit mode' reaction exemplified by the isomerisation of neopentane is preferred with lower hydrogen pressures (i.e., with a lower abundance of surface hydrogen). Indeed, both the ay' and the ay interactions are suppressed by higher amounts of hydrogen over iridium. Just the opposite hydrogen effect can be observed with platinum [ 47 ] where the to values published were also calculated considering also all fragments, hence they are not comparable with those quoted in the present study. Increasing the H2/2,2dimethylbutane ratio from 2 to 23 led to a 30% decrease in the abundance of isobutane (the preferred product), at the same time, isopentane and neopentane formation increased by a factors of 4 to 10. Hydrogen-rich conditions obviously were favourable for the ai6 interaction. It is also possible that the product distribution reported over Pt/Ti02 catalysts reduced at 400 (which were claimed as being in the SMSI state) at temperatures in the range 200-230, which gave only neohexane as the primary splitting product along with much propane [ 48 ] , could also be attributed to a hydrogen effect enhancing multiple splitting, the hydrogen excess being between 50 and 100 (not specified more clearly by the authors). Isopentane appeared at 229, and the distribution of hydrogenolysis products resembled that shown in Table 4 for Pt/ Ti02 reduced at 250, from a reaction temperature of 260 onwards [ 48 ] . Increasing the reaction temperature increased the contribution of isobutane (ay' interaction) even further over this catalyst as well as over Pt/Ti02 reduced at 460. Up to 5% isomerisation selectivity was reported over each of those Pt/Ti02 catalysts [ 31,48 ] . Increasing the hydrogen content of the carrier gas from 0 to 20% is accompanied by a rapid drop of the benzene yield; at the same time, skeletal isomers appeared which were not present in the carrier gas [ 25,52 ] . The sum of skeletal isomers plus benzene was roughly constant from 20 to 100% hydrogen (Fig. 3). This may indicate a skeletal rearrangement mechanism involving a deeply dehydrogenated intermediate which would produce benzene in helium. With some surface hydrogen present, a slower `normal' bond shift mechanism would be operative which could R. Burch, Z. Padl /Applied Catalysis A: General 114 (1994) 9-33 27 0 to ~ 41, 1 3 2 0 50 100 e HZ Fig. 3. Yields of benzene and skeletal isomers from 2,2-dimethylbutane as a function of hydrogen abundance ( 3 Al pulses introduced into a carrier gas of various hydrogen content). Catalyst: 0.31 g Pd black, T= 390. Adapted from ref. (25]. ( x ) Benzene, (O) isomer, (*) sum benzene + isomer. result in either benzene or skeletal isomer(s) depending on the amount of hydrogen. It would be logical to assign the dehydrogenative mechanism to multiatomic sites while that resulting in skeletal isomers to single-atom sites. It is worth mentioning that increasing the hydrogen pressure suppresses the hydrogenolysis yield considerably (30% in helium and about 4% in hydrogen at 390 over Pt black) [ 23 ] . Hydrogen effects over carbon-supported platinum catalysts have also been studied [ 53 ] . The maximum yield of skeletal isomers on 20% Pt/C at 310 was when the carrier gas of a pulse system contained 55-60% hydrogen; the isomerization activity was lower by a factor of 4 than that of 3-methylpentane. Carbonaceous deposits increased isomerisation selectivity over palladium, although an opposite effect was reported in one case for platinum (see Table 3) [9]. Isomerisation selectivities were very low (0.02 to 0.13%) over 10% Ir/AI203 [ 32] . Even within these low values, isomerisation selectivity increased with the temperature and with decreasing hydrogen/ hydrocarbon ratio. Hence, Sarkany attributed isomerisation to partly carbonized iridium surfaces, as in the abovementioned case of palladium. This agrees with the conclusion of Vogelzang and Ponec [26] who proposed that the higher isomerisation activity was due to randomly distributed `C' on Ir/Si02 which was considered to be different from the carbonaceous overlayer ('coke'). The lower maximum attainable isomerisation selectivity of small iridium particles as compared with that of large ones was attributed to their hindered `carburization'. A recrystallisation of larger crystallites at higher temperatures uncovering free iridium ensembles, was given as the reason for their isomerisation selectivity dropping upon high temperature treatment [ 26] . The different particle size sensitivity of 2,2-dimethylbutane reactions over iridium and platinum was also attributed to the more difficult carbon accumulation on iridium. 28 R. Burch, Z. Padl /Applied Catalysis A: General 114 (1994) 9-33 The interplay of two additives - rhenium promoting hydrogenolysis, and carbon promoting isomerisation - has been mentioned in Section 6. Apart from the overall activity drop (due to the decrease of the number of active sites over carbonized catalysts), the effect of rhenium only becomes predominant in the rhenium-rich region [ 44 ] . It is not excluded that carbonaceous deposits playa more important role in determining the predominant reaction route than generally recognised. Individual C atoms may play a role similar to the presence of inactive alloying metal atoms [ 9 ] in breaking up large ensembles of contiguous metal atoms which may be active in catalyzing hydrogenolysis, perhaps by `tripod-like' 1,3,5-interactions [ 54] . Low temperatures generally are unfavourable for accumulation of either hydrocarbonaceous or carbonaceous deposits (the distinction is used to denote sorbed species with different degrees of dehydrogenation). Sarkany interpreted hydrogen effects in terms of hydrogen pressure regulating the amount of surface hydrocarbons [ 55 ] . Pt/Si02 at low temperatures with rather a lot of hydrogen present exhibited some unusual intrinsic multiple hydrogenolytic activity towards n-hexane. Individual clean metal atoms being present in a pool of hydrogen-covered metal surface may act as single-atom active sites [ 56] . Such centres were claimed to be more important on platinum than on other Group VIII metals [46]. Not only the outer surface of the finely divided metal particles may be covered by hydrogen after low temperature reduction (e.g., at 300) , but also a hydrogen layer may be present between small platinum particles and the support [ 57 ] . This may also contribute to their higher hydrogenolysis selectivity. As opposed to the rather pronounced isomerisation reported in Table 3, hydrogenolysis selectivities up to 95-98% together with multiple splitting (see above) have been observed over Pt/Ti02 catalyst reduced at different temperatures [ 31,48 ] . The differences between these results and those obtained over other platinum catalysts [9,44] may be rationalised in terms of the catalyst samples of Clarke et al. containing much lower amounts of surface carbon, and more surface hydrogen and/or OH groups (see later), than those of Ponec and co-workers. The Pt/Ti02 catalysts in question underwent almost no deactivation during a run of 45 min at the high hydrogen excess used and the product selectivities also remained unchanged. The lack of any surface carbonaceous deposits together with enhanced hydrogenolysis activity on hydrogen-rich surfaces may also explain why hydrogenolysis, leading mostly to neopentane, was the only reaction at lower temperatures (up to ca. 230) over iridium [ 26] . This, however, would surprisingly mean that at lower temperatures (with high hydrogen and low carbon coverages) the differences between platinum and iridium would tend to disappear i.e., the basically different selectivities of these metals would only manifest themselves in a moderately carburized state which must not be mixed up with the partially coked, more or less deactivated catalysts. Sulphur addition decreased the overall activity of a Pt-Re/A1203 catalyst by a few orders of magnitude, and at the same time increased isomerisation selectivity R. Burch, Z. Padl /Applied Catalysis A: General 114 (1994) 9-33 29 Table 11 Effect of CHZClz and H20 on the selectivity of 2,2-dimethylbutane reactions (T=290, p(HZ)/ p(2,2DMB)=5.3) Catalyst Type of interaction MR Selectivity Hydrogenolysis pattern Ref. ay' ay a/3 S Shy& m(iCb) (00C5)w(neoC5) 0.3%Pt/AIZ0352 25 11 12 5 95 2.1 0.4 0.5 [221 Same+C11202 67 25 1 7 54 46 1.9 0.9 0.2 [221 0.3%Pt/A12036 69 21 2 7 61 39 1.8 0.9 0.3 [221 Same + H20` 54 30 6 10 29 71 1.9 0.7 0.4 [ 221 EUROPT-440 37 15 8 22 78 1.5 0.6 0.9 [451 Same +CH2C12 66 28 1 5 64 36 1.9 0.9 0.2 [451 Catalyst prereduced at 300. Catalyst prereduced at 500. ` Steady-state activity. to almost 100% [58], as opposed to 10-20% observed with sulphur-free catalysts [ 44 ] . This was attributed to the acidic function of the alumina support, as corroborated by the pronounced drop of isomerisation ability upon adding a basic poison, pyridine to the catalyst. The isomerising propensity of Pts+ in sulphided catalysts may also play a role here, although this assumption has not been proved nor disproved. Chlorinated and chlorine-free catalysts did not differ qualitatively from each other [ 58] . The use of H2PtC16 as a precursor for preparing Pt-Re/A1203 catalysts resulted in about twice as active catalysts as the use of H2Pt(OH)6 [59]. The activity and the selectivity for the formation of neopentane increase with increasing platinum content with both precursors, which is at variance with the results of Botman et al. [44]. Higher isomerisation selectivity was observed over EUROrr-3 (prepared from Cl-containing precursor) after reduction at 500 than with a similar catalyst prepared from a chloride-free precursor (Table 9) . This may stress the well-known role of CI - ions in enhancing redispersion via Pts+ species [60], as discussed above in connection with oxidising treatments. Deliberate addition of chlorine, as CH2C12, during a catalytic run increased isomerisation selectivities considerably [ 22,45 ] (Table 11), with all the other concomitant features also being manifested: isomerisation selectivity increased; enhanced ay' interaction; enhanced c)(isopentane); and decreased formation of neopentane. At the same time, it was shown that the acidity of the catalyst did not increase upon introduction of CH2Cl2 so the increase in isomerisation selectivity could not be explained by a conventional bifunctional mechanism (see earlier discussion of ref. [ 21 ] ) . In any case, an acidic isomerisation should have produced 2,3-dimethylbutane while, in fact, both the yields and selectivities of all the other hexane isomers increased [ 22 ] . This effect of chlorine was reversible, and could be removed by prolonged exposure to the reactants, and could be brought about repeatedly. 30 R. Burch, Z. Padl /Applied Catalysis A: General 114 (1994) 9-33 Introducing water to Pt/ A1203 (see Table 11) has the opposite effect: it increases hydrogenolysis selectivity. This phenomenon does not occur with Pt/Si02, hence it can be attributed to a more facile hydroxylation of the A1203 support and the interaction of the newly formed OH groups in the vicinity of platinum particles with the metal. In fact, OH groups were found to be stable over Pt black catalysts after oxygen and subsequent hydrogen treatments as detected by electron spectroscopy and the samples with enhanced OH content showed a higher hydrogenolysis selectivity [ 61 ] . Detailed clarification of the phenomena concerning Cl and water effects requires further studies and will be tackled in forthcoming publications. 9. Information obtained from the use of 2,2-dimethylbutane as probe molecule Garin and Maire [ 62 ] suggested that the chemical identity (platinum versus palladium etc.) of the metal catalyst (`the electronic factor') would be most important in determining the direction of reaction of any reactant. Adopting this general theory to 2,2-dimethylbutane, it is easy to realize the actual importance of the nature of the metal in determining the primary interaction. Mainly a/3 type interactions occur with metals like Rh, Ru, Ni, Re. These metals give, consequently, mostly hydrogenolysis products, particularly 2,2-dimethylpropane (neopentane). Using the classification of Foger and Anderson [ 8 ] , `C2-unit' reactions predominate on these catalysts (Table 4) . The product composition obtained from neohexane transformation is a clear indication whether mainly ay or a /3 types of interaction prevail. It is possible sometimes to follow the switch-over of the molecule from one state to the other. The occurrence of ay (or, including also ay', i.e., the `iso-unit' [8]) type interactions is necessary for isomerization reactions: this is possible with platinum, palladium, and, to some extent, iridium and nickel. Hence, a high isomerization selectivity should be accompanied with enhanced ay and ay' type interactions: experiments indicate that the latter produces most of the isomers (Tables 8 and 9). Once the `electronic factor' determined the prevailing interaction, the `geometric factor' was assumed to decide whether degradative or nondegradative reactions (i.e. hydrogenolysis or isomerization) follow [62]. If we define the geometric factor as the actual surrounding of the active centre at the atomic level, including the arrangement of the atoms and also their chemical nature, the experience collected in the present paper would certainly confirm this suggestion. One must not forget the postulation [3,4] that there is no `inert' additive effect, i.e., a different atom included into the matrix of an active catalyst changes the geometric arrangement and the electronic surroundings. One plausible way to change the ratio of individual reactions (isomerization versus hydrogenolysis) is the introduction of additional components. Ions of the catalyst metal itself (such as Pts+ ) may represent one possible additive promoting R. Burch, Z. Padl /Applied Catalysis A: General 114 (1994) 9-33 31 isomerisation. A component with high hydrogenolysis activity (e.g., rhenium) changes not only the type of prevailing interaction but also the ratio of the abovementioned reactions, the extent of which may vary over a wide range [44,45]. Inactive metals (silver, gold), in contrast, decrease the hydrogenolysis and increase the isomerization selectivity with a considerable decrease in the overall activity. The same effect can be achieved by nonmetallic additives, such as carbon (Tables 3 and 10) , sulphur, and also chlorine (Table 11) . Copper has a peculiar effect: it enhances hydrogenolysis selectivity without a switch over to a preferential a/3 interaction, Pt-Cu ensembles having obviously an intrinsic hydrogenolysis ability, due, perhaps, to their hydrogen sorption ability [46]. The same explanation was offered for the effect of VOCI [46] which also can bind hydrogen. 10. Conclusion In conclusion, it is clear that many questions about the nature of active sites on metal catalysts still remain unanswered. Probe reactions can provide a very valuable in situ method of characterising real supported catalysts. Moreover, 2,2-dimethylbutane, because it can be adsorbed in a variety of different modes can be a very sensitive probe of the surface chemistry of metal catalysts. One important remaining question is how exactly to separate the influence of the chemical identity of the support from that of metal particle size. Indeed, platinum catalysts with rather similar (high) dispersion can have isomerisation selectivities from ca. 5 to 60% (Table 9). The scatter of data points was, indeed, rather large when particle size effects on platinum have been discussed and when results were obtained when platinum was supported on silica or alumina. Considering the rather large differences between EUROPr-1 and EURopr-3, platinum on different supports may not be directly comparable. Recent results indicate that various pretreatments (reduction temperature, etc., see Section 8) may represent an additional factor influencing selectivity values considerably. The presence of minute amounts of additives may also have a crucial influence (see the effects of carbon, chlorine, water, etc., discussed above). These may create an as yet unspecified electronic influence on the metal proper [ 21,48,63 ] which may manifest itself e.g., as the irregular catalytic activity of sites at the metal-support phase boundary (`adlineation effect' [ 64 ] ) . The higher isomerisation selectivity of catalysts with lower metal loading, i.e., containing more `adlineation sites' (see 0.3% and 2% Pt/A1203 in Table 9) may stress the importance of these sites in isomerisation (the importance of ay', ay and a/3 interactions being similar over all these samples), as also does the possible effect of oxidative redispersion of the catalytically active metal [ 51 ] . The problem of `true' bifunctionality, namely whether there is a real interplay between metallic sites and acidic sites in their immediate vicinity affecting reaction intermediates during their sojourn on the surface, still also needs to be clarified. Conventional dispersion measurements, or other, more sophisticated surface char- 32 R. Burch, Z. Padl /Applied Catalysis A: General 114 (1994) 9-33 acterisation techniques may not provide a sufficient explanation for these problems. That is the point where the use of probe molecules, to investigate the active sites proper, may prove indispensable. Knowing the few elementary regularities of metal catalyzed reactions of 2,2-dimethylbutane, this reactant seems to be a great help in solving a number of still open questions concerning metal-hydrocarbon interactions on real catalysts. Acknowledgements We are pleased to acknowledge the support of this work by the European Community (Grant ERB-CIPA-CT-92-0552) which allowed Z.P. to have an extended stay in Reading during which this paper was written. We acknowledge the assistance of Ms. Julia Evans and Mr. Adrian Emery in providing access to results prior to publication. References [ 1 ] H.S. Taylor, Proc. Royal Soc., A108 (1925) 105. [2] V. Ponec, Adv. Catal., 32 (1983) 149. [3 ] R. Burch, in G.C. Bond and G. Webb (Editors), Catalysis Specialist Periodical Reports, The Royal Society of Chemistry, London, 1985, Vol. 7, p. 149. [4] R. Burch, Catal. Today, 10 (1991) 233. [51 Z. Pail and P. TBtdnyi, in G.C. Bond and G. Webb (Editors), Catalysis Specialist Periodical Reports, The Royal Society of Chemistry, London, 1982., Vol. 5, p. 80. [ 61 F.G. Gault, Adv. Catal., 30 (1981) 1. [71 J.R. Anderson and N.R. Avery, J. Catal., 5 (1966) 446. [81 K. Foger and J.R. Anderson, J. Catal., 59 (1979) 325. [91 M.W. Vogelzang, M.J.P. Botman and V. Ponec, Faraday Disc. Chem. Soc., 72 (1981) 33. [ 101 Z. Pawl, Catal. Today, 2 (1988) 595. [ 111 M. Bartok (Editor), Stereochemistry of Heterogeneous Metal Catalysts, Wiley, Chichester, 1985. [ 121 R.L. Burwell, Accounts Chem. Res., 2 (1969) 289. [ 131 J.C. Prudhomme and F.G. Gault, Bull. Soc. Chim. Fr., (1966) 832. [ 141 C.B. Lebrilla and W.F. Maier, J. Am. Chem. Soc., 108 (1986) 1606. [ 151 V. Eskinazi and R.L. Burwell, Jr., J. Catal., 79 (1983) 118. [ 161 D.K. Takehara, J.B. Butt and R.L. Burwell, Jr., J. Catal., 133 (1992) 279. [ 171 Z. Pad1, Catal. Today, 12 (1992) 297. [ 181 S.M. Csicsery and H. Pines, J. Catal., 1 (1962) 313. [ 191 M. Guisnet, J.J. Garcia, F. Chevalier and R. Maurel, Bull. Soc. Chim. Fr., (1976) 1657. [201 E.G. Christoffel, Ind. Eng. Chem. Prod. Res. Dev., 19 (1980) 430. [ 211 K. Foger and J.R. Anderson, J. Catal., 54 (1978) 318. [ 221 R. Burch and J. Evans, unpublished results. [231 Z. Padl, M. Dobrovolszky and P. Tdt6-nyi, in D. Shopov, A. Palazov and L. Petrov (Editors), Heterogeneous Catalysis, Proc. 3rd International Symposium, Varna, 1975, Publ. House Bulg. Acad. Sci., 1978, p. 350. [ 241 R. Burch and V. Pitchon, Catal. Today, 10 (1991) 315. [ 25 ] Z. PaSI and P. Tetenyi, Appl. Catal., 1 (1981) 9. [261 M.W. Vogelzang and V. Ponec, J. Catal., 111 (1988) 77. [27] F.J. Schepers, E.H. van Broekhoven and V. Ponec, J. Catal., 96 (1985) 82. [28 ] G. Leclercq, L. Leclercq and R. Maurel, J. Catal., 50 (1977) 87. R. Burch, Z. Padl /Applied Catalysis A: General 114 (1994) 9-33 33 [29] Z. Paul and P. T6tdnyi, React. Kinet. Catal. Lett., 12 (1979) 131. [30] B. Coq and F. Figueras, J. Mol. Catal., 40 (1987) 93. [31 ] J.K.A. Clarke, R.J. Dempsey and T. Baird, J. Chem. Soc., Faraday Trans., 86 (1990) 2789. [32] A. Sdrkdny, J. Chem. Soc., Faraday Trans. 1, 85 (1989) 1511. [33] J.K.A. Clarke, K.M.G. Rooney and T. Baird, J. Catal., 111 (1988) 374. [ 34 ] B. Coq, R. Dutartre, F. Figueras and A. Rouco, J. Phys. Chem., 93 (1989) 4904. [ 35 ] B. Coq, A. Bittar and F. Figueras, Appl. Catal., 59 (1990) 103. [36] G. Leclercq, S. Pietrzik, M. Peyrovi and M. Karroua, J. Catal., 99 (1986) 1. [ 37 ] M.J.P. Botman, H.C. de Jongste and V. Ponec, J. Catal., 68 (1981) 9. [ 38 ] R. Nakamura and R.L. Burwell, Jr., J. Catal., 93 (1985) 399. [39] C.J. Machiels and R.B. Anderson, J. Catal., 58 (1979) 268. [40] K. Kochloefl and V. Bazant, J. Catal., 10 (1968) 140. [41 ] V. Ponec and W.M.H. Sachtler, Proc. 5th International Congress on Catalysis, Palm Beach, 1972, Vol. 2, p. 645. [42] Z. Padl and P. Tdt6nyi, Nature (London), 267 (1977) 234. [43] H.C. de Jongste, F.1. Kuipers and V. Ponec, Proc. 6th International Congress on Catalysis, London, 1976, Vol. 2, p. 915. [44] M.J.P. Botman, K. de Vreugd, H.W. Zandbergen, R. de Block and V. Ponec, J. Catal., 116 (1989) 467. [45] R. Burch and A. Emery, unpublished results. [46] A.1. den Hartog, A.G.T.M. Bastien and V. Ponec, J. Mol. Catal., 52 (1989) 129. [471 H. Zimmer, P. T6t6nyi and Z. Padl, J. Chem. Soc., Faraday Trans. 1, 78 (1982) 3573. [481 J.K.A. Clarke, R.J. Dempsey, T. Baird and J.J. Rooney, J. Catal., 126 (1990) 370. [491 T. Wang, C. Lee and L.D. Schmidt, Surf. Sci., 163 (1985) 181. [50] A.-C. Shi and R.I. Masel, J. Catal., 120 (1989) 421. [511 1. Sushumna and E. Ruckenstein, J. Catal., 108 (1987) 77. [52] Z. Padl and P. TBtenyi, J. Catal., 29 (1973) 176. [53] T.G. Olfer'eva, S.A. Krasavin and O.V. Bragin, Izv. Akad. Nauk SSSR, Ser. Khim., (1981) 605. [54] M. Boudart, A. W. Aldag, L. D. Ptak and J.E. Benson, J. Catal., 11 (1968) 35. [55 ] A. Sdrkdny, J. Chem. Soc., Faraday Trans., 1, 85 (1989) 1523. [561 J.B.F. Anderson, R. Burch and J.A. Cairns, J. Catal., 107 (1987) 364. [57] M. Vaarkamp, F.S. Modica, J.T. Miller and D.C. Koningsberger, J. Catal., 144 (1993) 611. [581 A.J. den Hartog, P.J.M. Rek, M.J.P. Botman, C. de Vreugd and V. Ponec, Langmuir, 4 (1988) 1100. [59] M. Garland, A. Baiker and A. Wokaun, Ind. Eng. Chem. Res., 30 (1991) 440. [601 H. Lieske, G. Lietz, H. Spindler and J. Volter, J. Catal., 81 (1983) 8. [6l 1 Z. Padl, R. Schlogl and G. Ertl, Catal. Lett., 12 (1991) 331. [621 F. Garin and G. Maire, Acc. Chem. Res., 22 (1989) 100. [631 T. Baird, E.J. Kelly, W.R. Patterson and J.J. Rooney, J. Chem. Soc. Chem. Commun., (1992) 1431. [ 641 H. Glassl, K. Hayek and R. Kramer, J. Catal., 68 (198 l) 397. APCATA 94851069 0926-860X(94)85106-9 10.1016/0926-860X(94)85106-9 Elsevier Science B.V. The use of 2,2-dimethylbutane (neohexane) as a probe molecule of metal catalysts R. Burch a 1 Z. PaÃ¡l b a Catalysis Research Group, Chemistry Department, University of Reading, Whiteknights, Reading, RG6 2AD, UK b Institute of Isotopes of the Hungarian Academy of Sciences, P.O. Box 77, Budapest, H-1525, Hungary 1 Corresponding author. Probe molecules can be used to complement surface characterisation techniques for elucidating the nature of possible active sites in supported metal catalysts. 2,2-dimethylbutane (neohexane) is eminently suitable for this purpose because it combines an isobutyl and an ethyl group, representing two archetypes for hydrocarbon reactions on metal catalysts. In this review a survey is given of hydrogen-deuterium exchange, hydrogenolysis, and isomerization of 2,2-dimethylbutane mainly on Group 8â10 metals, copper, and rhenium, as well as on their various alloys. Hydrogen-deuterium exchange results are presented, and interpretations in terms of factors such as different surface morphologies are considered. For 2,2-dimethylbutane, hydrogenolysis is the main reaction on most catalysts. Isomerization is restricted to platinum, palladium, and to some extent to iridium and nickel. The relative importance of isomerisation versus hydrogenolysis has been examined and it is shown that this is critically dependent on a number of factors, such as the dispersion of the metal, alloy formation, non-metallic promoters, etc. The patterns of hydrogenolysis products can also be very informative because of the relationship between the observed product and the mode of adsorption of the 2,2-dimethylbutane molecule on different types of surface site. The use of 2,2-dimethylbutane to probe the surface composition of bimetallic particles has been discussed and the factors which influence the product distribution have been examined. The effect of non-metallic additives (water and chlorine) on the ratio of hydrogenolysis-to-isomerization is discussed and the possible important role of the metal-support interface (âadlineation sitesâ) is pointed out. Keywords Copper Deuterium exchange Dimethylbutane Hydrogenolysis Iridium Isomerization Neohexane Nickel Palladium Platinum Rhenium Ruthenium Reference [1] Taylor H.S. Proc. Royal Soc. A108 1925 105 [2] Ponec V. Adv. Catal. 32 1983 149 [3] Burch R. Bond G.C. Webb G. Catalysis Specialist Periodical Reports 7 1985 The Royal Society of Chemistry London 149 [4] Burch R. Catal. Today 10 1991 233 [5] PaÃ¡l Z. TÃ©tÃ©nyi P. Bond G.C. Webb G. Catalysis Specialist Periodical Reports 5 1982 The Royal Society of Chemistry London 80 [6] Gault F.G. Adv. Catal. 30 1981 1 [7] Anderson J.R. Avery N.R. J. Catal. 5 1966 446 [8] Foger K. Anderson J.R. J. Catal. 59 1979 325 [9] Vogelzang M.W. Botman M.J.P. Ponec V. Faraday Disc. Chem. Soc. 72 1981 33 [10] PaÃ¡l Z. Catal. Today 2 1988 595 [11] Bartok M. Stereochemistry of Heterogeneous Metal Catalysts 1985 Wiley Chichester [12] Burwell R.L. Accounts Chem. Res. 2 1969 289 [13] Prudhomme J.C. Gault F.G. Bull. Soc. Chim. Fr. 1966 832 [14] Lebrilla C.B. Maier W.F. J. Am. Chem. Soc. 108 1986 1606 [15] Eskinazi V. Burwell R.L. Jr. J. Catal. 79 1983 118 [16] Takehara D.K. Butt J.B. Burwell R.L. Jr. J. Catal. 133 1992 279 [17] PaÃ¡l Z. Catal. Today 12 1992 297 [18] Csicsery S.M. Pines H. J. Catal. 1 1962 313 [19] Guisnet M. Garcia J.J. Chevalier F. Maurel R. Bull. Soc. Chim. Fr. 1976 1657 [20] Christoffel E.G. Ind. Eng. Chem. Prod. Res. Dev. 19 1980 430 [21] Foger K. Anderson J.R. J. Catal. 54 1978 318 [22] R. Burch and J. Evans, unpublished results. [23] PaÃ¡l Z. Dobrovolszky M. TÃ©tÃ©nyi P. Shopov D. Palazov A. Petrov L. Heterogeneous Catalysis 1978 Publ. House Bulg. Acad. Sci. 350 Proc. 3rd International Symposium, Varna, 1975 [24] Burch R. Pitchon V. Catal. Today 10 1991 315 [25] PaÃ¡l Z. TÃ©tÃ©nyi P. Appl. Catal. 1 1981 9 [26] Vogelzang M.W. Ponec V. J. Catal. 111 1988 77 [27] Schepers F.J. van Broekhoven E.H. Ponec V. J. Catal. 96 1985 82 [28] Leclercq G. Leclercq L. Maurel R. J. Catal. 50 1977 87 [29] PaÃ¡l Z. TÃ©tÃ©nyi P. React. Kinet. Catal. Lett. 12 1979 131 [30] Coq B. Figueras F. J. Mol. Catal. 40 1987 93 [31] Clarke J.K.A. Dempsey R.J. Baird T. J. Chem. Soc., Faraday Trans. 86 1990 2789 [32] SÃ¡rkÃ¡ny A. J. Chem. Soc., Faraday Trans. 1 85 1989 1511 [33] Clarke J.K.A. Rooney K.M.G. Baird T. J. Catal. 111 1988 374 [34] Coq B. Dutartre R. Figueras F. Rouco A. J. Phys. Chem. 93 1989 4904 [35] Coq B. Bittar A. Figueras F. Appl. Catal. 59 1990 103 [36] Leclercq G. Pietrzik S. Peyrovi M. Karroua M. J. Catal. 99 1986 1 [37] Botman M.J.P. de Jongste H.C. Ponec V. J. Catal. 68 1981 9 [38] Nakamura R. Burwell R.L. Jr. J. Catal. 93 1985 399 [39] Machiels C.J. Anderson R.B. J. Catal. 58 1979 268 [40] Kochloefl K. Bazant V. J. Catal. 10 1968 140 [41] Ponec V. Sachtler W.M.H. Proc. 5th International Congress on Catalysis, Palm Beach 2 1972 645 [42] PaÃ¡l Z. TÃ©tÃ©nyi P. Nature (London) 267 1977 234 [43] de Jongste H.C. Kuipers F.J. Ponec V. Proc. 6th International Congress on Catalysis, London 2 1976 915 [44] Botman M.J.P. de Vreugd K. Zandbergen H.W. de Block R. Ponec V. J. Catal. 116 1989 467 [45] R. Burch and A. Emery, unpublished results. [46] den Hartog A.J. Bastien A.G.T.M. Ponec V. J. Mol. Catal. 52 1989 129 [47] Zimmer H. TÃ©tÃ©nyi P. PaÃ¡l Z. J. Chem. Soc., Faraday Trans. 1 78 1982 3573 [48] Clarke J.K.A. Dempsey R.J. Baird T. Rooney J.J. J. Catal. 126 1990 370 [49] Wang T. Lee C. Schmidt L.D. Surf. Sci. 163 1985 1 [50] Shi A.-C. Masel R.I. J. Catal. 120 1989 421 [51] Sushumna I. Ruckenstein E. J. Catal. 108 1987 77 [52] PaÃ¡l Z. TÃ©tÃ©nyi P. J, Catal. 29 1973 176 [53] Olfer'eva T.G. Krasavin S.A. Bragin O.V. Izv. Akad. Nauk SSSR, Ser. Khim. 1981 605 [54] Boudart M. Aldag A.W. Ptak L.D. Benson J.E. J. Catal. 11 1968 35 [55] SÃ¡rkÃ¡ny A. J. Chem. Soc., Faraday Trans., 1 85 1989 1523 [56] Anderson J.B.F. Burch R. Cairns J.A. J. Catal. 107 1987 36 [57] Vaarkamp M. Modica F.S. Miller J.T. Koningsberger D.C. J. Catal. 144 1993 611 [58] den Hartog A.J. Rek P.J.M. Botman M.J.P. de Vreugd C. Ponec V. Langmuir 4 1988 1100 [59] Garland M. Baiker A. Wokaun A. Ind. Eng. Chem. Res. 30 1991 440 [60] Lieske H. Lietz G. Spindler H. Volter J. J. Catal. 81 1983 8 [61] PaÃ¡l Z. Schlogl R. Ertl G. Catal. Lett. 12 1991 331 [62] Garin F. Maire G. Acc. Chem. Res. 22 1989 100 [63] Baird T. Kelly E.J. Patterson W.R. Rooney J.J. J. Chem. Soc. Chem. Commun. 1992 1431 [64] Glassl H. Hayek K. Kramer R. J. Catal. 68 1981 397",
      "scopus-id": "0028767527",
      "coredata": {
        "eid": "1-s2.0-0926860X94851069",
        "dc:description": "Probe molecules can be used to complement surface characterisation techniques for elucidating the nature of possible active sites in supported metal catalysts. 2,2-dimethylbutane (neohexane) is eminently suitable for this purpose because it combines an isobutyl and an ethyl group, representing two archetypes for hydrocarbon reactions on metal catalysts. In this review a survey is given of hydrogen-deuterium exchange, hydrogenolysis, and isomerization of 2,2-dimethylbutane mainly on Group 8â10 metals, copper, and rhenium, as well as on their various alloys. Hydrogen-deuterium exchange results are presented, and interpretations in terms of factors such as different surface morphologies are considered. For 2,2-dimethylbutane, hydrogenolysis is the main reaction on most catalysts. Isomerization is restricted to platinum, palladium, and to some extent to iridium and nickel. The relative importance of isomerisation versus hydrogenolysis has been examined and it is shown that this is critically dependent on a number of factors, such as the dispersion of the metal, alloy formation, non-metallic promoters, etc. The patterns of hydrogenolysis products can also be very informative because of the relationship between the observed product and the mode of adsorption of the 2,2-dimethylbutane molecule on different types of surface site. The use of 2,2-dimethylbutane to probe the surface composition of bimetallic particles has been discussed and the factors which influence the product distribution have been examined. The effect of non-metallic additives (water and chlorine) on the ratio of hydrogenolysis-to-isomerization is discussed and the possible important role of the metal-support interface (âadlineation sitesâ) is pointed out.",
        "openArchiveArticle": "false",
        "prism:coverDate": "1994-07-07",
        "openaccessUserLicense": null,
        "prism:aggregationType": "Journal",
        "prism:url": "https://api.elsevier.com/content/article/pii/0926860X94851069",
        "dc:creator": [
          {
            "@_fa": "true",
            "$": "Burch, R."
          },
          {
            "@_fa": "true",
            "$": "PaÃ¡l, Z."
          }
        ],
        "link": [
          {
            "@_fa": "true",
            "@rel": "self",
            "@href": "https://api.elsevier.com/content/article/pii/0926860X94851069"
          },
          {
            "@_fa": "true",
            "@rel": "scidir",
            "@href": "https://www.sciencedirect.com/science/article/pii/0926860X94851069"
          }
        ],
        "dc:format": "application/json",
        "openaccessType": null,
        "pii": "0926-860X(94)85106-9",
        "prism:volume": "114",
        "prism:publisher": "Published by Elsevier B.V.",
        "dc:title": "The use of 2,2-dimethylbutane (neohexane) as a probe molecule of metal catalysts",
        "prism:copyright": "Copyright Â© 1994 Published by Elsevier B.V.",
        "openaccess": "0",
        "prism:issn": "0926860X",
        "prism:issueIdentifier": "1",
        "dcterms:subject": [
          {
            "@_fa": "true",
            "$": "Copper"
          },
          {
            "@_fa": "true",
            "$": "Deuterium exchange"
          },
          {
            "@_fa": "true",
            "$": "Dimethylbutane"
          },
          {
            "@_fa": "true",
            "$": "Hydrogenolysis"
          },
          {
            "@_fa": "true",
            "$": "Iridium"
          },
          {
            "@_fa": "true",
            "$": "Isomerization"
          },
          {
            "@_fa": "true",
            "$": "Neohexane"
          },
          {
            "@_fa": "true",
            "$": "Nickel"
          },
          {
            "@_fa": "true",
            "$": "Palladium"
          },
          {
            "@_fa": "true",
            "$": "Platinum"
          },
          {
            "@_fa": "true",
            "$": "Rhenium"
          },
          {
            "@_fa": "true",
            "$": "Ruthenium"
          }
        ],
        "openaccessArticle": "false",
        "prism:publicationName": "Applied Catalysis A: General",
        "prism:number": "1",
        "openaccessSponsorType": null,
        "prism:pageRange": "9-33",
        "prism:endingPage": "33",
        "pubType": "fla",
        "prism:coverDisplayDate": "7 July 1994",
        "prism:doi": "10.1016/0926-860X(94)85106-9",
        "prism:startingPage": "9",
        "dc:identifier": "doi:10.1016/0926-860X(94)85106-9",
        "openaccessSponsorName": null
      },
      "link": {
        "@rel": "abstract",
        "@href": "https://api.elsevier.com/content/abstract/scopus_id/0028767527"
      }
    }
  }
}