{
  "metadata": {
    "title": "Minimizing Co<ce:inf loc=post>x</ce:inf>Mn<ce:inf loc=post>1-x</ce:inf>O content in a Co<ce:inf loc=post>2</ce:inf>C catalyst for low CO<ce:inf loc=post>2</ce:inf> selectivity in Fischer-Tropsch synthesis to olefins",
    "authors": "; ; ",
    "journal": "Journal of Catalysis",
    "date": "2025-01-31",
    "doi": "10.1016/j.jcat.2024.115856",
    "abstract": "",
    "uri": "https://api.elsevier.com/content/article/pii/S0021951724005694",
    "pii": "S0021951724005694"
  },
  "fulltext": {
    "full-text-retrieval-response": {
      "scopus-eid": "2-s2.0-85210032380",
      "originalText": "serial JL 272561 291210 291744 291809 31 Journal of Catalysis JOURNALCATALYSIS 2024-11-23 2024-11-23 2024-11-25 2024-11-25 2024-12-02T12:58:47 1-s2.0-S0021951724005694 S0021-9517(24)00569-4 S0021951724005694 10.1016/j.jcat.2024.115856 S300 S300.1 FULL-TEXT 1-s2.0-S0021951724X00135 2024-12-02T13:37:38.552387Z 0 0 20250101 20250131 2025 2024-11-23T17:57:02.457084Z absattachment articleinfo articlenumber articletitlenorm authfirstinitialnorm authfirstsurnamenorm cid cids contenttype copyright crossmark dateloaded dateloadedtxt datesearch datesort dateupdated dco docsubtype doctype doi eid ewtransactionid hubeid indexeddate issn issnnorm itemstage itemtransactionid itemweight openaccess openarchive pg pgfirst pii piinorm pubdateend pubdatestart pubdatetxt pubyr sectiontitle sortorder srctitle srctitlenorm srctype ssids alllist content subj subheadings suppl tomb volfirst volissue volumelist webpdf webpdfpagecount yearnav figure table e-component body mmlmath acknowledge affil appendices articletitle auth authfirstini authfull authkeywords authlast grantnumber grantsponsor grantsponsorid highlightsabst primabst pubtype ref specialabst 0021-9517 00219517 true 441 441 C Volume 441 7 115856 115856 115856 202501 January 2025 2025-01-01 2025-01-31 2025 Regular Articles article fla © 2024 Elsevier Inc. All rights are reserved, including those for text and data mining, AI training, and similar technologies. MINIMIZINGCOXMN1XOCONTENTINACO2CCATALYSTFORLOWCO2SELECTIVITYINFISCHERTROPSCHSYNTHESISOLEFINS TANG Y 1 Introduction 2 Experimental 2.1 Catalyst preparation 2.2 Characterization 2.3 DFT calculation 2.4 Catalyst evaluation and probe experiments 2.4.1 Catalyst evaluation 2.4.2 WGSR probe experiments 3 Results and discussion 3.1 Catalytic performance 3.2 Structural and morphological characterization 3.2.1 XRD analysis 3.2.2 SEM analysis 3.2.3 TEM analysis 3.3 Effect of Co species on CO2 selectivity 3.3.1 H2-TPR-MS analysis 3.3.2 XPS characterization 3.3.3 XANES and EXAFS analysis 3.3.4 Catalyst performance during transformation of Co0 to Co2C 3.4 WGSR activity on Co2C and Co oxides 3.4.1 WGSR probe experiments 3.4.2 DFT calculation of H2O adsorption on Co2C and Co oxides 3.4.3 Mechanism exploration of WGSR activity on a Co2C-based catalyst 4 Conclusion CRediT authorship contribution statement Acknowledgment Appendix A Supplementary material References ZHOU 2019 3193 3228 W LI 2018 787 793 J KHODAKOV 2007 1692 1744 A ZHAI 2016 9902 9907 P CHENG 2017 475 485 Y MOTA 2015 13 22 R PENG 2017 1513 1517 W BLUMBERG 2017 2528 2539 T ROSTRUPNIELSEN 2015 5 10 J TALKHONCHEH 2015 16 25 S YU 2014 944 953 A XIE 2014 291 296 Q CHEN 2016 168 175 F PENG 2017 270 273 W AKRI 2019 M TORRESGALVIS 2013 2130 2149 H LIU 2015 3905 3909 Y LIU 2020 119287 Y WANG 2018 43578 43587 J FANG 2020 2799 2816 X LIN 2019 9554 9567 T LIU 2019 7073 7089 B RAHIMI 2011 1 17 N ZHAI 2021 3027 3051 P GALVIS 2012 835 838 H LIN 2021 1961 1971 T ZHONG 2016 84 L JIAO 2016 1065 1068 F TAN 2021 4633 4643 M ZHOU 2020 5239 5242 W GNANAMANI 2014 612 618 M BUKUR 2016 66 75 D YU 2018 420 428 X OJEDA 2010 287 297 M XU 2021 610 Y LIN 2021 T XIE 2019 J LYU 2023 122347 S LIU 2024 147927 Y ZAFARI 2017 2475 2486 R LI 2017 3622 3631 Z MESTERS 2016 223 C TIMOSHENKO 2009 920 925 J RAVEL 2005 537 541 B TANGX2025X115856 TANGX2025X115856XY 2026-11-25T00:00:00.000Z 2026-11-25T00:00:00.000Z http://creativecommons.org/licenses/by-nc-nd/4.0/ © 2024 Elsevier Inc. All rights are reserved, including those for text and data mining, AI training, and similar technologies. 2024-11-28T04:00:49.340Z http://vtw.elsevier.com/data/voc/AddOnTypes/50.7/aggregated-refined Wuhan Institute of Technology CX2022057 CX2021037 WIT Wuhan Institute of Technology http://data.elsevier.com/vocabulary/SciValFunders/501100008869 http://sws.geonames.org/1814991/ National Key R&D Program of China NKRDPC National Key Research and Development Program of China http://data.elsevier.com/vocabulary/SciValFunders/501100012166 http://sws.geonames.org/1814991/ 2022YFE0101800 Key Technologies Research and Development Program http://data.elsevier.com/vocabulary/SciValFunders/501100012165 http://sws.geonames.org/1814991 This work was supported by the National Key R&D Program of China (2022YFE0101800) and the Wuhan Institute of Technology (CX2022057, CX2021037). https://doi.org/10.15223/policy-017 https://doi.org/10.15223/policy-037 https://doi.org/10.15223/policy-012 https://doi.org/10.15223/policy-029 https://doi.org/10.15223/policy-004 item S0021-9517(24)00569-4 S0021951724005694 1-s2.0-S0021951724005694 10.1016/j.jcat.2024.115856 272561 2024-12-02T13:37:38.552387Z 2025-01-01 2025-01-31 1-s2.0-S0021951724005694-main.pdf https://s3-eu-west-1.amazonaws.com/prod-ucs-content-store-eu-west/content/pii:S0021951724005694/MAIN/application/pdf/c8850f4d4bbe6c0de9f6fb1609935a93/main.pdf main.pdf pdf true 11546647 MAIN 14 1-s2.0-S0021951724005694-main_1.png https://s3-eu-west-1.amazonaws.com/prod-ucs-content-store-eu-west/content/pii:S0021951724005694/PREVIEW/image/png/f0de3877ad2f9ba78ad949509cdc316f/main_1.png main_1.png png 58333 849 656 IMAGE-WEB-PDF 1 1-s2.0-S0021951724005694-gr12.jpg https://s3-eu-west-1.amazonaws.com/prod-ucs-content-store-eu-west/content/pii:S0021951724005694/gr12/DOWNSAMPLED/image/jpeg/930ba1e84dd99d1ff3ec58f0911e486d/gr12.jpg gr12 gr12.jpg jpg 40096 256 649 IMAGE-DOWNSAMPLED 1-s2.0-S0021951724005694-gr13.jpg https://s3-eu-west-1.amazonaws.com/prod-ucs-content-store-eu-west/content/pii:S0021951724005694/gr13/DOWNSAMPLED/image/jpeg/557805d34c50a3f76e4edd8d6b7283e2/gr13.jpg gr13 gr13.jpg jpg 44082 194 534 IMAGE-DOWNSAMPLED 1-s2.0-S0021951724005694-gr10.jpg https://s3-eu-west-1.amazonaws.com/prod-ucs-content-store-eu-west/content/pii:S0021951724005694/gr10/DOWNSAMPLED/image/jpeg/34d2f8deee7a2103cf2747ceedf39e7b/gr10.jpg gr10 gr10.jpg jpg 86410 483 622 IMAGE-DOWNSAMPLED 1-s2.0-S0021951724005694-gr1.jpg https://s3-eu-west-1.amazonaws.com/prod-ucs-content-store-eu-west/content/pii:S0021951724005694/gr1/DOWNSAMPLED/image/jpeg/ee297057d2cf981286db19a235784170/gr1.jpg gr1 gr1.jpg jpg 87324 504 628 IMAGE-DOWNSAMPLED 1-s2.0-S0021951724005694-gr2.jpg https://s3-eu-west-1.amazonaws.com/prod-ucs-content-store-eu-west/content/pii:S0021951724005694/gr2/DOWNSAMPLED/image/jpeg/937246cdc92c150a73205192ac2f5cfa/gr2.jpg gr2 gr2.jpg jpg 60745 392 671 IMAGE-DOWNSAMPLED 1-s2.0-S0021951724005694-gr11.jpg https://s3-eu-west-1.amazonaws.com/prod-ucs-content-store-eu-west/content/pii:S0021951724005694/gr11/DOWNSAMPLED/image/jpeg/4c5a37141b670f594de48649277c5521/gr11.jpg gr11 gr11.jpg jpg 50081 184 535 IMAGE-DOWNSAMPLED 1-s2.0-S0021951724005694-gr3.jpg https://s3-eu-west-1.amazonaws.com/prod-ucs-content-store-eu-west/content/pii:S0021951724005694/gr3/DOWNSAMPLED/image/jpeg/dd9b317878558a109444ab85b87f3157/gr3.jpg gr3 gr3.jpg jpg 124191 558 533 IMAGE-DOWNSAMPLED 1-s2.0-S0021951724005694-gr4.jpg https://s3-eu-west-1.amazonaws.com/prod-ucs-content-store-eu-west/content/pii:S0021951724005694/gr4/DOWNSAMPLED/image/jpeg/16b04a994c098d81b78a7c2023e490eb/gr4.jpg gr4 gr4.jpg jpg 109655 517 533 IMAGE-DOWNSAMPLED 1-s2.0-S0021951724005694-gr5.jpg https://s3-eu-west-1.amazonaws.com/prod-ucs-content-store-eu-west/content/pii:S0021951724005694/gr5/DOWNSAMPLED/image/jpeg/afb4215eef56d8b0923f3b828350e8df/gr5.jpg gr5 gr5.jpg jpg 101055 519 533 IMAGE-DOWNSAMPLED 1-s2.0-S0021951724005694-gr6.jpg https://s3-eu-west-1.amazonaws.com/prod-ucs-content-store-eu-west/content/pii:S0021951724005694/gr6/DOWNSAMPLED/image/jpeg/f9c849407db6eddc46adf25560410f1b/gr6.jpg gr6 gr6.jpg jpg 34241 218 539 IMAGE-DOWNSAMPLED 1-s2.0-S0021951724005694-gr7.jpg https://s3-eu-west-1.amazonaws.com/prod-ucs-content-store-eu-west/content/pii:S0021951724005694/gr7/DOWNSAMPLED/image/jpeg/faa187498c49d3d5f3de69c5fc7d9251/gr7.jpg gr7 gr7.jpg jpg 136871 703 535 IMAGE-DOWNSAMPLED 1-s2.0-S0021951724005694-gr8.jpg https://s3-eu-west-1.amazonaws.com/prod-ucs-content-store-eu-west/content/pii:S0021951724005694/gr8/DOWNSAMPLED/image/jpeg/ae8e88d284220b1a541e1487bdef6376/gr8.jpg gr8 gr8.jpg jpg 28350 225 535 IMAGE-DOWNSAMPLED 1-s2.0-S0021951724005694-gr9.jpg https://s3-eu-west-1.amazonaws.com/prod-ucs-content-store-eu-west/content/pii:S0021951724005694/gr9/DOWNSAMPLED/image/jpeg/85f6b42986cc3250a8ab5bd1c6726fb6/gr9.jpg gr9 gr9.jpg jpg 36073 214 535 IMAGE-DOWNSAMPLED 1-s2.0-S0021951724005694-ga1.jpg https://s3-eu-west-1.amazonaws.com/prod-ucs-content-store-eu-west/content/pii:S0021951724005694/ga1/DOWNSAMPLED/image/jpeg/3c563becafb3ec64fbb7e32a945fb552/ga1.jpg ga1 true ga1.jpg jpg 23080 245 293 IMAGE-DOWNSAMPLED 1-s2.0-S0021951724005694-gr12.sml https://s3-eu-west-1.amazonaws.com/prod-ucs-content-store-eu-west/content/pii:S0021951724005694/gr12/THUMBNAIL/image/gif/5bbb5dade87384a975342ba498e6e0c1/gr12.sml gr12 gr12.sml sml 6747 86 219 IMAGE-THUMBNAIL 1-s2.0-S0021951724005694-gr13.sml https://s3-eu-west-1.amazonaws.com/prod-ucs-content-store-eu-west/content/pii:S0021951724005694/gr13/THUMBNAIL/image/gif/ecdd1a97df0d5f31345d987d321e89dc/gr13.sml gr13 gr13.sml sml 8809 79 219 IMAGE-THUMBNAIL 1-s2.0-S0021951724005694-gr10.sml https://s3-eu-west-1.amazonaws.com/prod-ucs-content-store-eu-west/content/pii:S0021951724005694/gr10/THUMBNAIL/image/gif/2b6eaedff2cb28ffd84dc64d03229a39/gr10.sml gr10 gr10.sml sml 11684 164 211 IMAGE-THUMBNAIL 1-s2.0-S0021951724005694-gr1.sml https://s3-eu-west-1.amazonaws.com/prod-ucs-content-store-eu-west/content/pii:S0021951724005694/gr1/THUMBNAIL/image/gif/238b84cf4aca4e309b3efc2058ac7bec/gr1.sml gr1 gr1.sml sml 11610 164 204 IMAGE-THUMBNAIL 1-s2.0-S0021951724005694-gr2.sml https://s3-eu-west-1.amazonaws.com/prod-ucs-content-store-eu-west/content/pii:S0021951724005694/gr2/THUMBNAIL/image/gif/3ffb65a374b218b9009a04c12caa256c/gr2.sml gr2 gr2.sml sml 8552 128 219 IMAGE-THUMBNAIL 1-s2.0-S0021951724005694-gr11.sml https://s3-eu-west-1.amazonaws.com/prod-ucs-content-store-eu-west/content/pii:S0021951724005694/gr11/THUMBNAIL/image/gif/c87e9d98878545dc5a7b4dd8f3af3cef/gr11.sml gr11 gr11.sml sml 10230 75 219 IMAGE-THUMBNAIL 1-s2.0-S0021951724005694-gr3.sml https://s3-eu-west-1.amazonaws.com/prod-ucs-content-store-eu-west/content/pii:S0021951724005694/gr3/THUMBNAIL/image/gif/31d28069bbb08f646ecd65c37dc78695/gr3.sml gr3 gr3.sml sml 20581 163 156 IMAGE-THUMBNAIL 1-s2.0-S0021951724005694-gr4.sml https://s3-eu-west-1.amazonaws.com/prod-ucs-content-store-eu-west/content/pii:S0021951724005694/gr4/THUMBNAIL/image/gif/2b5b891a438da3b2f14e8cc5b7887e7b/gr4.sml gr4 gr4.sml sml 21614 164 169 IMAGE-THUMBNAIL 1-s2.0-S0021951724005694-gr5.sml https://s3-eu-west-1.amazonaws.com/prod-ucs-content-store-eu-west/content/pii:S0021951724005694/gr5/THUMBNAIL/image/gif/05332586a41554906b6ff510d182d29e/gr5.sml gr5 gr5.sml sml 22247 164 168 IMAGE-THUMBNAIL 1-s2.0-S0021951724005694-gr6.sml https://s3-eu-west-1.amazonaws.com/prod-ucs-content-store-eu-west/content/pii:S0021951724005694/gr6/THUMBNAIL/image/gif/07c0a7ed6db8701044e94115191d0f98/gr6.sml gr6 gr6.sml sml 6708 89 219 IMAGE-THUMBNAIL 1-s2.0-S0021951724005694-gr7.sml https://s3-eu-west-1.amazonaws.com/prod-ucs-content-store-eu-west/content/pii:S0021951724005694/gr7/THUMBNAIL/image/gif/920c80451121d776c6c6b78f1ed22edd/gr7.sml gr7 gr7.sml sml 11416 163 124 IMAGE-THUMBNAIL 1-s2.0-S0021951724005694-gr8.sml https://s3-eu-west-1.amazonaws.com/prod-ucs-content-store-eu-west/content/pii:S0021951724005694/gr8/THUMBNAIL/image/gif/0f5c54e453c33ccf14d40d6e440c474a/gr8.sml gr8 gr8.sml sml 5762 92 219 IMAGE-THUMBNAIL 1-s2.0-S0021951724005694-gr9.sml https://s3-eu-west-1.amazonaws.com/prod-ucs-content-store-eu-west/content/pii:S0021951724005608/gr9/THUMBNAIL/image/gif/fddb95f72baf05022be1dd13078a1b6c/gr9.sml gr9 gr9.sml sml 6655 87 219 IMAGE-THUMBNAIL 1-s2.0-S0021951724005694-ga1.sml https://s3-eu-west-1.amazonaws.com/prod-ucs-content-store-eu-west/content/pii:S0021951724005608/ga1/THUMBNAIL/image/gif/b5213aba483a73e15113977a7161c482/ga1.sml ga1 true ga1.sml sml 19179 164 196 IMAGE-THUMBNAIL 1-s2.0-S0021951724005694-gr12_lrg.jpg https://s3-eu-west-1.amazonaws.com/prod-ucs-content-store-eu-west/content/pii:S0021951724005694/HIGHRES/image/jpeg/94d74ec71ae9dc8fb6eb47364faa47e6/gr12_lrg.jpg gr12 gr12_lrg.jpg jpg 124137 680 1724 IMAGE-HIGH-RES 1-s2.0-S0021951724005694-gr13_lrg.jpg https://s3-eu-west-1.amazonaws.com/prod-ucs-content-store-eu-west/content/pii:S0021951724005694/HIGHRES/image/jpeg/661f18272708bb6d788313a244c94234/gr13_lrg.jpg gr13 gr13_lrg.jpg jpg 328869 857 2365 IMAGE-HIGH-RES 1-s2.0-S0021951724005694-gr10_lrg.jpg https://s3-eu-west-1.amazonaws.com/prod-ucs-content-store-eu-west/content/pii:S0021951724005694/HIGHRES/image/jpeg/cb4c03e53e45700dd66d8e1183c1bb1b/gr10_lrg.jpg gr10 gr10_lrg.jpg jpg 300409 1318 1698 IMAGE-HIGH-RES 1-s2.0-S0021951724005694-gr1_lrg.jpg https://s3-eu-west-1.amazonaws.com/prod-ucs-content-store-eu-west/content/pii:S0021951724005694/HIGHRES/image/jpeg/1b30345700be2f422b7efeaa5a8b456f/gr1_lrg.jpg gr1 gr1_lrg.jpg jpg 608759 2231 2782 IMAGE-HIGH-RES 1-s2.0-S0021951724005694-gr2_lrg.jpg https://s3-eu-west-1.amazonaws.com/prod-ucs-content-store-eu-west/content/pii:S0021951724005694/HIGHRES/image/jpeg/454c4f20852551339ddd44a3c53939fb/gr2_lrg.jpg gr2 gr2_lrg.jpg jpg 206117 1041 1783 IMAGE-HIGH-RES 1-s2.0-S0021951724005694-gr11_lrg.jpg https://s3-eu-west-1.amazonaws.com/prod-ucs-content-store-eu-west/content/pii:S0021951724005694/HIGHRES/image/jpeg/01282b5505cb0573582b9039bdbab71c/gr11_lrg.jpg gr11 gr11_lrg.jpg jpg 349166 816 2368 IMAGE-HIGH-RES 1-s2.0-S0021951724005694-gr3_lrg.jpg https://s3-eu-west-1.amazonaws.com/prod-ucs-content-store-eu-west/content/pii:S0021951724005694/HIGHRES/image/jpeg/e45f5a65e1f7819756c7ccc12f721ea8/gr3_lrg.jpg gr3 gr3_lrg.jpg jpg 898870 2474 2362 IMAGE-HIGH-RES 1-s2.0-S0021951724005694-gr4_lrg.jpg https://s3-eu-west-1.amazonaws.com/prod-ucs-content-store-eu-west/content/pii:S0021951724005694/HIGHRES/image/jpeg/4c31817f013d8781502959019381cc72/gr4_lrg.jpg gr4 gr4_lrg.jpg jpg 1294275 2293 2362 IMAGE-HIGH-RES 1-s2.0-S0021951724005694-gr5_lrg.jpg https://s3-eu-west-1.amazonaws.com/prod-ucs-content-store-eu-west/content/pii:S0021951724005694/HIGHRES/image/jpeg/8967fe6a46d6a7bcb3198bb0b8083f5c/gr5_lrg.jpg gr5 gr5_lrg.jpg jpg 1164043 2299 2362 IMAGE-HIGH-RES 1-s2.0-S0021951724005694-gr6_lrg.jpg https://s3-eu-west-1.amazonaws.com/prod-ucs-content-store-eu-west/content/pii:S0021951724005694/HIGHRES/image/jpeg/28bb67e1240f3999acbb670510357030/gr6_lrg.jpg gr6 gr6_lrg.jpg jpg 151286 687 1699 IMAGE-HIGH-RES 1-s2.0-S0021951724005694-gr7_lrg.jpg https://s3-eu-west-1.amazonaws.com/prod-ucs-content-store-eu-west/content/pii:S0021951724005608/HIGHRES/image/jpeg/56298be4f62413bb41b9970e942df9d3/gr7_lrg.jpg gr7 gr7_lrg.jpg jpg 1032109 3113 2368 IMAGE-HIGH-RES 1-s2.0-S0021951724005694-gr8_lrg.jpg https://s3-eu-west-1.amazonaws.com/prod-ucs-content-store-eu-west/content/pii:S0021951724005608/HIGHRES/image/jpeg/6cf9946d4353dcee790eca041f39595a/gr8_lrg.jpg gr8 gr8_lrg.jpg jpg 206576 994 2368 IMAGE-HIGH-RES 1-s2.0-S0021951724005694-gr9_lrg.jpg https://s3-eu-west-1.amazonaws.com/prod-ucs-content-store-eu-west/content/pii:S0021951724005608/HIGHRES/image/jpeg/7b401fc5566cf2e9373e1eaf5a01f75d/gr9_lrg.jpg gr9 gr9_lrg.jpg jpg 239461 945 2368 IMAGE-HIGH-RES 1-s2.0-S0021951724005694-ga1_lrg.jpg https://s3-eu-west-1.amazonaws.com/prod-ucs-content-store-eu-west/content/pii:S0021951724005608/HIGHRES/image/jpeg/19c11e20eb3eda9b8fa15fd1e141f88b/ga1_lrg.jpg ga1 true ga1_lrg.jpg jpg 62814 651 778 IMAGE-HIGH-RES 1-s2.0-S0021951724005694-mmc1.docx https://s3-eu-west-1.amazonaws.com/prod-ucs-content-store-eu-west/content/pii:S0021951724005694/mmc1/MAIN/application/vnd.openxmlformats-officedocument.wordprocessingml.document/7f732b0b647d9af69c8af097a3e536c0/mmc1.docx mmc1 mmc1.docx docx 27190190 APPLICATION 1-s2.0-S0021951724005694-si1.svg https://s3-eu-west-1.amazonaws.com/prod-ucs-content-store-eu-west/content/pii:S0021951724005694/image/svg+xml/fc9e12d81bbc3e15cf3243082abe33e3/si1.svg si1 si1.svg svg 19619 ALTIMG 1-s2.0-S0021951724005694-si10.svg https://s3-eu-west-1.amazonaws.com/prod-ucs-content-store-eu-west/content/pii:S0021951724005694/image/svg+xml/bd7cce9b1757d45c44f496b16d0ed21a/si10.svg si10 si10.svg svg 10538 ALTIMG 1-s2.0-S0021951724005694-si2.svg https://s3-eu-west-1.amazonaws.com/prod-ucs-content-store-eu-west/content/pii:S0021951724005694/image/svg+xml/201776f21d3134d571d5766de9717ed7/si2.svg si2 si2.svg svg 26931 ALTIMG 1-s2.0-S0021951724005694-si3.svg https://s3-eu-west-1.amazonaws.com/prod-ucs-content-store-eu-west/content/pii:S0021951724005694/image/svg+xml/5e4b34a4a9f76006d5ea6d5515b6ef87/si3.svg si3 si3.svg svg 34203 ALTIMG 1-s2.0-S0021951724005694-si4.svg https://s3-eu-west-1.amazonaws.com/prod-ucs-content-store-eu-west/content/pii:S0021951724005694/image/svg+xml/18154973204dee94595b7007d80b5669/si4.svg si4 si4.svg svg 7133 ALTIMG 1-s2.0-S0021951724005694-si5.svg https://s3-eu-west-1.amazonaws.com/prod-ucs-content-store-eu-west/content/pii:S0021951724005694/image/svg+xml/f75c8d4665a1c339416ad9c2e9a56c33/si5.svg si5 si5.svg svg 6424 ALTIMG 1-s2.0-S0021951724005694-si6.svg https://s3-eu-west-1.amazonaws.com/prod-ucs-content-store-eu-west/content/pii:S0021951724005694/image/svg+xml/75a38ec264579a614f39a890184fac07/si6.svg si6 si6.svg svg 7136 ALTIMG 1-s2.0-S0021951724005694-si7.svg https://s3-eu-west-1.amazonaws.com/prod-ucs-content-store-eu-west/content/pii:S0021951724005694/image/svg+xml/01c8aea9f5b339ad6eb87695e55849c1/si7.svg si7 si7.svg svg 6425 ALTIMG 1-s2.0-S0021951724005694-si8.svg https://s3-eu-west-1.amazonaws.com/prod-ucs-content-store-eu-west/content/pii:S0021951724005694/image/svg+xml/197075f87e831b06337b59007ba18f38/si8.svg si8 si8.svg svg 14509 ALTIMG 1-s2.0-S0021951724005694-si9.svg https://s3-eu-west-1.amazonaws.com/prod-ucs-content-store-eu-west/content/pii:S0021951724005694/image/svg+xml/b77926cdd981f3722a8d158f7d26e2ba/si9.svg si9 si9.svg svg 10233 ALTIMG YJCAT 115856 115856 S0021-9517(24)00569-4 10.1016/j.jcat.2024.115856 Elsevier Inc. Fig. 1 Performance of the prepared catalysts ((a) CO conversion and product selectivity (including CO2); (b) ASF plots of various catalyst samples; (c, d) stability test of M−Co2MnO4.5 with reaction conditions of H2/CO = 1.0, T = 240 ℃, P = 0.1 MPa, WHSV = 3000 mL g-1h−1). Fig. 2 XRD spectra for the catalyst samples prepared using the melting and co-precipitation methods at the pristine (a), reduced (b) and spent (c) states. Fig. 3 SEM images of the pristine and spent catalysts using different preparation methods ((a) pristine N-Co2MnO4.5; (b) spent N-Co2MnO4.5; (c) pristine M−Co2MnO4.5; (d) spent M−Co2MnO4.5; (e) pristine P-Co2MnO4.5; (f) spent P-Co2MnO4.5). Fig. 4 (HR)TEM images of pristine catalysts using different preparation methods ((a, b) N-Co2MnO4.5; (c, d) M−Co2MnO4.5; (e, f) P-Co2MnO4.5). Fig. 5 (HR)TEM images of spent catalysts using different preparation methods ((a, b) N-Co2MnO4.5; (c, d) M−Co2MnO4.5; (e, f) P-Co2MnO4.5). Fig. 6 H2-TPR-MS results for the catalysts ((a) TCD signal; (b) MS signal). Fig. 7 XPS spectra of the N-Co2MnO4.5, M−Co2MnO4.5 and P-Co2MnO4.5 catalysts ((a, c, e) Co 2p; (b, d, f) Mn 2p). Fig. 8 XAS results of the prepared catalysts ((a) cobalt K-edge XANES spectra; (b) k3-weighted Fourier transforms (FTs) of the normalized Co K-edge EXAFS spectra). Fig. 9 CO conversion and product selectivity during the transformation of Co0 to Co2C in the M−Co2MnO4.5 catalyst (Traps on the experimental rig were bypassed and the effluent stream from the reactor was sent to the GC directly in this experiment; reaction conditions H2/CO = 1.0, T = 240 ℃, P = 0.1 MPa, WHSV = 3000 mL g-1h−1; (a) CO conversion, CH4 and CO2 selectivity; (b) olefin/paraffin ratios). Fig. 10 Probe experiments for WGSR and CO/H2O-TPSR-MS on the Co2MnO4.5 catalysts ((a) M−Co2MnO4.5 probe experiment; (b) P-Co2MnO4.5 probe experiment; (c) CO/H2O-TPSR-MS for the spent M−Co2MnO4.5 of the spent catalyst samples; (d) CO/H2O-TPSR-MS for the spent P-Co2MnO4.5). Fig. 11 Top (above) and side (bottom) view of optimized configuration and absorption energy of H2O on the stepped-Co2C surface (a) and Co2MnO4.5 surface (b) (Co: blue sphere; C: brown sphere; O: red sphere; H: pink sphere; Na: yellow sphere; Mn: purple sphere). (For interpretation of the references to colour in this figure legend, the reader is referred to the web version of this article.) Fig. 12 FTO performance of catalysts prepared using the melting method with different levels of Na content. (a) CO conversion and product selectivity (including CO2). (b) The relative content of Co2C and CoxMn1-xO changing with Na content (Reaction conditions: H2/CO = 1.0, T = 240 ℃, P = 0.1 MPa, WHSV = 3000 mL g-1h−1). Fig. 13 Illustration of CO2 selectivity due to the differences in the active phases in Co2C-based catalysts. Table 1 Catalytic performance for the various catalysts used for the FTO reaction. Entry Catalyst H2/CO CO Conv. (%) Product Selectivity (C%) Olefin/Paraffin Ratio CO2 CH4 C2-4 = C5+ C2 C3 C4 1a N-Co2MnO4.5 1 5.8 42.6 2.3 61.7 31.8 15.1 22.5 29.9 2a N-Co2MnO4.5 2 12.5 44.2 2.4 55.7 39.0 9.6 20.5 24.7 3a M−Co2MnO4.5 1 7.7 3.8 3.5 60.5 32.8 17.0 22.2 15.5 4a M−Co2MnO4.5 2 12.4 9.6 5.8 52.7 37.5 7.6 21.6 14.9 5a P-Co2MnO4.5 1 6.4 35.3 4.2 58.4 34.2 19.4 19.1 20.1 6a P-Co2MnO4.5 2 15.5 38.9 6.3 50.0 41.1 15.1 22.5 15.6 Reaction conditions: T = 240 ℃, 0.1 MPa, WHSV = 3000 mL g-1h−1; data were collected at t = 24 h; selectivity of hydrocarbons in each carbon segment is based on the formed hydrocarbons. Research article Minimizing CoxMn1-xO content in a Co2C catalyst for low CO2 selectivity in Fischer-Tropsch synthesis to olefins Yibo Tang Writing – original draft Methodology Investigation Formal analysis Data curation a Sheng Zhan Investigation Formal analysis Data curation a Jiayin Liang Software Investigation a Yiwen Liu Investigation Formal analysis Data curation a Jiabing Chen Validation Formal analysis a Mengheng Wang Validation Methodology Formal analysis a Xinying Liu Writing – review & editing Methodology b Diane Hildebrandt Writing – review & editing Conceptualization c Xiaojun Lu Writing – review & editing Supervision Resources Funding acquisition Formal analysis Conceptualization a ⁎ a Key Laboratory for Green Chemical Process of Ministry of Education and School of Chemical Engineering and Pharmacy, Wuhan Institute of Technology, Wuhan 430205, China Key Laboratory for Green Chemical Process of Ministry of Education and School of Chemical Engineering and Pharmacy Wuhan Institute of Technology Wuhan 430205 China Key Laboratory for Green Chemical Process of Ministry of Education and School of Chemical Engineering and Pharmacy, Wuhan Institute of Technology, Wuhan 430205, China b Institute for Catalysis and Energy Solutions, University of South Africa, c/o Christiaan de Wet & Pioneer Roads, Florida, 1709, Roodepoort, Gauteng, South Africa Institute for Catalysis and Energy Solutions University of South Africa, c/o Christiaan de Wet & Pioneer Roads Florida, 1709, Roodepoort Gauteng South Africa Institute for Catalysis and Energy Solutions, University of South Africa, c/o Christiaan de Wet & Pioneer Roads, Florida, 1709, Roodepoort, Gauteng, South Africa c Department of Chemical and Biochemical Engineering, Rutgers, The State University of New Jersey, USA Department of Chemical and Biochemical Engineering Rutgers, The State University of New Jersey USA Department of Chemical and Biochemical Engineering, Rutgers, The State University of New Jersey, USA ⁎ Corresponding author. Graphical abstract The Co2C-based catalyst is a promising candidate for the Fischer-Tropsch to olefins reaction. However, it consistently exhibits high CO2 selectivity (∼40 %), and the origin of the high activity in the water–gas-shift reaction is not well-understood. In this study, Co2C catalysts constructed with the same elemental compositions but using the melting and co-precipitation methods resulted in drastic differences in CO2 selectivity − one at 3.8 % and the other at 35.3 %. A detailed structural study revealed that the presence of CoxMn1-xO instead of Co2C is responsible for the elevated CO2 selectivity. Interestingly, CoxMn1-xO alone demonstrates limited CO2 selectivity, but when promoted with Na, its WGSR activity is greatly enhanced. Conversely, the catalysts maintained consistently low CO2 selectivity even with improved Na content, as long as a high fraction of Co2C is present. This finding is important for designing Co2C-based catalysts that can achieve high olefin selectivity while minimizing undesirable CO2 emissions. Keywords Fischer-Tropsch synthesis to olefins Co2C Olefins CO2 selectivity Data availability Data will be made available on request. 1 Introduction Short-chain olefins (C2-C4 olefins) are commonly used chemical raw materials in the industry, serving as crucial components in various basic chemical products [1–4]. Conventional olefin production primarily relies on naphtha cracking. With the depletion of fossil resources and the increasing demand for olefins, non-petroleum routes have been proposed and developed to supplement the olefin production. Coal [5–7], natural gas [8–11], or biomass [12–14] serve as effective alternative feedstocks for generating short-chain olefins via syngas (a mixture of CO and H2) as an intermediate platform [15–21]. Recently, syngas conversion to olefins has attracted significant attention from both academia and industry. Among these methods, Fischer-Tropsch to olefins (FTO) is one of the favorable pathways to directly convert syngas to olefins [22–24]. In recent years, both Fe- and Co-based catalysts have made substantial progress in enhancing selectivity towards short-chain olefins [25–27].De Jong and co-workers [26] reported a Na/S-modified loaded iron-based catalyst for FTO, which has a 61 % lower olefin selectivity at a limited CO conversion (<1.0 %). Zhong et al. [28] reported that Co2C nano-prisms with (101) and (020) exposed surfaces exhibited 31.8 % CO conversion, 60.8 % lower olefin selectivity and a 5.0 % CH4 fraction during syngas reforming. Bao's group [29] used a bifunctional oxide zeolite catalyst (OX-ZEO) to convert syngas directly to low-grade olefins with up to 80 % selectivity. However, the increased olefin selectivity is accompanied by high CO2 production. If the calculation of product selectivity is based on the converted CO, the olefin selectivity decreases significantly. During the conversion of syngas to olefins, carbon dioxide is a common by-product, so it becomes important to avoid the formation of CO2. Syngas-to-olefin conversion is often accompanied by the water–gas-shift reaction (WGSR) [30–33]; therefore, inhibiting CO2 formation − by ensuring high C atom utilization − remains a key hurdle in syngas to olefin conversion [5,34]. The process of converting syngas into hydrocarbons primarily involves breaking the C-O bond to create dissociated O atoms to form H2O and/or CO2. The produced H2O may adsorb on the WGSR-active site to produce extra CO2 [35]. The H2O produced can adsorb onto reactive sites, which promotes the WGSR and generates additional CO2. Researchers have tried various approaches to mitigate CO2 formation in the FTO reaction. One effective method to achieve reduced CO2 selectivity is to modify the catalyst surface with hydrophobic promoters. For instance, Ding et al. [36] reported hydrophobic core–shell FeMn@SiO2 catalysts that suppressed the selectivity to CO2 and CH4 to below 22.5 % during the FTO reaction, while maintaining approximately 65 % olefin selectivity. Similar strategies have been employed to synthesize Co-based catalysts for FTO reaction from syngas and a Cu-based catalyst for the production of dimethyl ether (DME) [30]. Lin et al. [37] designed a silica-coated Co2C catalyst for the FTO reaction, and reported that the silica coating facilitated rapid water removal from the active site, which reduced CO2 selectivity from 45 % to about 15 % under similar CO conversion levels. Xie et al. [38] reported Na/S/Mn-modified hcp Co used for the FTO reaction, with 54 % short-chain olefin selectivity and a < 3 % CO2 fraction at 240 °C and 1 bar. However, the CO conversion was also largely sacrificed. The strategy of modifying the surface of the catalysts with hydrophobic promoters only prevents H2O from participating in the WGSR and consequently reduces CO2 selectivity, but it does not address the fundamental cause of high CO2 selectivity in the Co2C-based catalyst itself. Li's group [39] reported a Co1Mn3 oxide nanocomposite with C2 =∼C4 = selectivity of up to 65.4 % and a CO2 selectivity of 13.7 %. It was also reported that CO2 emissions could be minimized by Co0 clusters (<1 nm) being formed as active sites that could inhibit WGSR. Liu and his coworkers [40] suggested that the exclusion Co oxide in a Co2C-based catalyst derived from Co2MnO4.5 could effectively reduce CO2 selectivity. Zafari et al. [41] investigated the effect of a novel Ce and Zn double-decorated Co–Mn catalyst supported on silica for CO hydrogenation to olefins. The cyclic oxidation process of CeO2 can effectively inhibit the oxidation of Co atoms during the WGSR, which leads to lower CO2 levels. These studies reveal that suppressing the formation of Co oxides always leads to lower WGSR activity. However, there is still not a comprehensive understanding of the mechanisms that causes high WGSR activity in Co2C-based catalysts or of the crucial role played by the additive Na. In this study, we employed melting and co-precipitation methods with identical elemental compositions to obtain Co2C-based catalysts for the FTO reaction. Remarkably, the catalyst prepared via the melting method achieved very low CO2 production, whereas the co-precipitation method achieved high CO2 selectivity. The detailed characterization results show that Co-Mn does not undergo significant phase separation, leading to the limited formation of Co2C. The remaining CoxMn1-xO in the catalyst contributes to the high CO2 selectivity. The meticulous characterization done revealed that the inability of Co-Mn to undergo the significant phase separation that leads to CoxMn1-xO is the origin of high CO2 selectivity. In order to explore the intrinsic WGSR activity of the catalysts, we conducted probe experiments using identical H2O and CO partial pressure levels. Density Functional Theory (DFT) calculations were employed to validate the different adsorption energies of H2O on CoxMn1-xO and Co2C. The influence of Na on CO2 selectivity was examined comprehensively, which clarified that CoxMn1-xO itself does not exhibit high WGSR activity, but with Na promotion, its WGSR activity is strongly enhanced. Finally, the mechanism governing WGSR activity in Co2C-based catalysts is proposed. 2 Experimental 2.1 Catalyst preparation N-Co2MnO4.5 was prepared using the co-precipitation method. Co(NO3)2·6H2O and 50 wt% Mn(NO3)2 were mixed in a 2:1 M ratio of Co to Mn. This formed a 2 M solution. The precipitant (NH4)2CO3 was prepared (separately) in a solution using the same concentration. The precipitation reaction took place in a water bath at 30 °C by dropping the two solutions into a flask while stirring vigorously. The pH value was controlled at 8.0 ± 0.2. After precipitation, the resulting precipitate was aged at 60 °C for 2 h. Subsequently, the filtered-out precipitate was washed with deionized water until the pH reached 7.0. It was then dried at 110 °C for 12 h, and the resulting solid was calcined in a muffle furnace under an air atmosphere at 330 °C for 3 h, in order to obtain the unpromoted Co-Mn catalyst. To further promote the catalyst with Na, sodium carbonate was added to yield 0.40 wt% Na in the prepared Co-Mn catalyst. 20 mL deionized water was added to the mixture of the unpromoted Co-Mn catalyst and the Na precursor. After sufficient stirring, the mixture was dried in an oven at 110 °C for 12 h. The resulting solid was then subjected to further calcination in a muffle oven at 300 ℃ for 3 h under an air atmosphere to obtain N-Co2MnO4.5 catalyst. M−Co2MnO4.5 synthesis was done using the melting method. 6.01 g of glucose and 10.0 g of urea (glucose-urea mass ratio of 3:5) were melted in a 250 mL beaker at 120 ℃, with magnetic stirring at 400 rpm. When the solid glucose and urea turned into a transparent liquid after 30 min of agitation, 4.0 g of Co(NO3)2·6H2O, a 2.5 g of a 50 wt% Mn(NO3)2 aqueous solution, and 0.0226 g anhydrous Na2CO3 (for 0.4 wt% Na content in the catalyst) were added to the beaker. The newly-formed mixture was stirred and heated for another 5 h, resulting in a purple-red viscous liquid. This was then heated in an oven at 180 °C for 24 h, and the liquid transformed into a foam-like black solid. The solid was then ground and calcined in a tube furnace at 400 ℃ for 2 h using Ar as the protective gas, which yielded a solid powder. The solid was then further calcination at 300 ℃ for 3 h in a muffle oven with static air, which yielded the M−Co2MnO4.5 catalyst sample. The procedure for catalyst preparation is illustrated in Fig. S1 of the Supplemental Information. P-Co2MnO4.5 was synthesized using a co-precipitation method similar to the procedure employed for N-Co2MnO4.5, but with a 2 M Na2CO3 solution as the precipitant. The same drying procedure was applied, but the resulting sample underwent a single calcination process in a muffle furnace at 330 °C for 3 h under an air atmosphere. 2.2 Characterization A nitrogen physisorption experiment was conducted to assess the pore structure of the catalyst samples using a Micromeritics 2420 instrument. Approximately 100 mg of the sample was degassed at 200 ℃ under vacuum for 10 h before the test. The specific surface area was determined using the Brunauer-Emmett-Teller (BET) equation. The pore volume and average pore size were calculated using the Barrett-Joyner-Halenda (BJH) method. The hydrogen temperature-programmed reduction (H2-TPR) experiment was conducted using a Micromeritics Autochem-II 2920 instrument equipped with a thermal conductivity detector (TCD). The loaded sample was first degassed at 200 ℃ for 120 min and reduced under 5 % (v/v) H2/Ar gas from 50 ℃ to 800 ℃ at a rate of 10 ℃ min−1. An Agilent 7800 instrument was employed for precise analysis of the Co, Mn and Na contents in the catalyst samples using ICP-MS. X-ray diffraction (XRD) patterns were obtained using a D8 Advance X-ray Powder Diffractometer (40 kV, 40 mA) and Cu Kα radiation (λ = 1.54 Å) at a scanning rate of 2°/min. The semi-quantitative phase content was analyzed using the step scanning method with X-rays of Co Ka rays at 35° to 55°, using scanning rate of 0.2°/min and a retention time of 2 s. The phase content was calculated by the K-value method. A ZEISS Gemini SEM 300 scanning electron microscope (SEM) was used for morphological characterization and elemental mapping. It was equipped with an Aztec Energy X-Max 20 energy dispersive X-ray spectroscopy (EDX) detector. Transmission electron microscope (TEM) and high-resolution transmission electron microscope (HRTEM) measurements were taken using a JEOL JEM-2100 electron microscope and using an accelerating voltage of 200 kV. X-ray photoelectron spectroscopy (XPS) measurements were carried out on a Thermo Scientific K-Alpha, using Al Kα (hv = 1486 eV) as the radiation source. The binding energy of all spectra was calibrated by referencing the C 1 s neutral carbon peak at 284.6 eV. The XPS spectrum deconvolution was performed by using the Lorentzian-Gaussian functions after subtraction of a Shirley background. The X-ray absorption spectra (XAS), encompassing both the X-ray absorption near-edge structure (XANES) and the extended X-ray absorption fine structure (EXAFS) of the sample at the Ni K-edge, were obtained at the TLS07A1 Beamline in the National Synchrotron Radiation Research Center (NSRRC), located in Taiwan. CO/H2O temperature-programmed surface reaction (CO/H2O-TPSR) experiments were conducted using a catalyst analyzer with mass spectrometry (BELCAT II + BelMass). The process involved weighing out 50 mg of the sample and adding it to a U-tube, then subjecting it to drying and pretreatment while raising the temperature from room temperature to 300 °C at a rate of 10 °C/min. The system was then purged with He gas flow at 50 mL/min for 1 h and then cooled to 50 °C. Two gas streams − one for CO and the other for saturated water vapor − were continuously introduced to detect the CO2 signal via mass spectrometry. A ramping rate of 5 °C/min was applied from 100 °C to 260 °C, with each testing temperature being sustained for 10 min, while monitoring the CO2 effluent using a BelMass mass spectrometer (m/z = 44). 2.3 DFT calculation The Vienna ab initio simulation package (VASP) was used for the DFT calculations. The projector augmented wave (PAW) method and the Perdew-Burke-Emzerhof (PBE) semi-local exchange–correlation functionals were used for the energy evaluation. A cutoff energy of 450 eV was applied, and a convergence criterion for geometry relaxation was set, with the force acting on each atom being less than 0.05 eV/Å. Grimme’s DFT-D3 methodology was used to account for dispersion interactions. Throughout the computational process, a gamma-centered grid of 2 × 2 × 1 was used to sample the Brillouin zone. The energy threshold for defining the self-consistency of the electron density was set at 10-6 eV. To prevent interaction between neighboring images, a vacuum space of 15 Å was added along the z direction. 2.4 Catalyst evaluation and probe experiments 2.4.1 Catalyst evaluation The Fischer-Tropsch synthesis (FTS) reaction was conducted in a stainless steel fixed-bed reactor with an inner diameter of 8 mm and a length of 40 cm. The reactor was heated by a furnace equipped with three heating elements. A thermocouple situated at the center of the reactor tube was employed to measure the temperature of the catalyst bed. This temperature reading was utilized as the temperature condition for the catalyst tests. Typically, 1 g of catalyst (in powdered form) was compressed and shaped before loading it to the isothermal region of the reactor tube. The size of the loaded catalyst was 20–40 meshes. The catalyst was supported by stainless steel beads to enhance heat transfer. The catalyst was then reduced under a pure H2 flow at a rate of 3000 mL·g−1·h−1, at atmospheric pressure and at 300 ℃ for 15 h. The reactor was then cooled to 35 ℃, pressurized to 1 bar with a syngas flow (H2/CO = 1, 2) at a weight hourly space velocity (WHSV) of 3000 mL·g−1·h−1. The reaction temperature was increased to 240 ℃ at a ramping rate of 5 ℃ min−1 to initiate the reaction. After passing through a hot trap (150 ℃) and a warm trap (50 ℃), the effluent gas from the reactor was analyzed online using an Agilent 8890 N gas chromatographer equipped with two FIDs and one TCD. For each set of reaction conditions employed in the experiment, a fresh catalyst was loaded and tested. The mass balance for carbon was calculated and maintained above 97 %. Consistent reproducibility of the catalyst studied was demonstrated through repeated experiments using the same reaction conditions. The CO conversion and product selectivity were determined using the following formulas: (1) X CO = 1 - CO % out × M F R out CO % in × M F R in (2) Se l C O 2 = C O 2 % out × M F R out CO % in × M F R in × X CO (3) Se l C n H m = n × C n H m % out × M F R out r CO × 1 - S e l C O 2 Where: CO % out and CO % in represent the CO molar fractions in the outlet and inlet gases, respectively; MF R out and MF R in represent the molar flowrates of the outlet and inlet gases. The olefin to paraffin ratio (O/P) was calculated using Eq. (4): (4) O / P = C n H 2 n % out C n H 2 n + 2 % out Where: C n H 2 n % out and C n H 2 n + 2 % out represent the molar fraction of olefin and paraffin for a specific carbon number, n, in the outlet gas. 2.4.2 WGSR probe experiments Probe experiments were conducted under consistent conditions to assess the WGSR activity of the catalysts with regard to the partial pressure of H2O and CO. Following the same reduction procedure as stated in section 2.4.1, the reduced catalyst sample was operated at 240°C, 0.1 MPa, and a WHSV of 3000 mL g-1h−1 under syngas conditions (H2/CO = 1) until the FTO performance reached a steady state. The hydrogen flow was then halted, and water was introduced into the reactor using a micro flow pump (CoMtro CP-M205). The off-gas, containing CO, CO2 and H2 was analyzed on the same Agilent 8890 GC. When characterizations were required for the spent catalyst, a passivation procedure was employed before unloading the catalyst. Initially, the reactor was purged with N2 for 12 h at the reaction temperature and then cooled to room temperature. A gas mixture containing 1 % O2 (with N2 as the balance gas) was introduced to the reactor to passivate the catalyst at atmospheric pressure for 4 h. After the passivation process was complete, the catalyst was unloaded and sealed for further characterization. 3 Results and discussion 3.1 Catalytic performance The catalyst samples analyzed exhibited consistent elemental proportions (Table S1), but with differences in the preparation method used. The performance of the catalysts is shown in Table 1 and Fig. 1 . All three catalysts exhibit similar high selectivity for lower olefins under conditions of 240 °C, H2/CO = 1 and P = 0.1 MPa. The olefin selectivity for C2-C4 reaches 61.7 % for N-Co2MnO4.5, 60.5 % for M−Co2MnO4.5 and 58.4 % for P-Co2MnO4.5 when counting the hydrocarbons produced. For short-chain hydrocarbons in the C2-C4 range, olefin is overwhelmingly predominant with all three catalysts. For example, propylene constitutes over 95 % of the total C3 hydrocarbons − a highly desirable outcome for short-chain olefins. Similar hydrocarbon distributions (Fig. 1b) are also found for these catalysts. The detailed distribution of both olefins and paraffins for these three catalysts is illustrated in Figs. S2 and S3, and Table S2. Notably, N-Co2MnO4.5 demonstrates the highest selectivity (Entry 1, Table 1), perhaps due to the introduction of Na as the final step, which results in a higher Na content on the catalyst particle surface. Because of Na's strong electron effect, its catalytic activity is the lowest for the three samples. The M−Co2MnO4.5 catalyst prepared using the melting method, also exhibits high selectivity for short-chain olefins (Entry 3 and 4). More importantly, it demonstrates significantly lower CO2 selectivity than the other two catalysts under the same operating conditions and comparable CO conversions. Under an H2/CO ratio of 1:1, the CO2 selectivity is as low as 3.8 %, while the co-precipitated samples N-Co2MnO4.5 and P-Co2MnO4.5 show a CO2 selectivity as high as 42.6 % and 35.3 %, respectively. Researchers have noted the challenge of achieving both high selectivity for short-chain olefins and low CO2 selectivity with Co2C via the FTO [42]. Various methods were employed to address this challenge, primarily using hydrophobic materials to modify the catalyst surface and rapidly removing the water produced from the catalyst surface to create lower water vapor pressure, thereby achieving low WGSR activity. Correspondingly, CO2 selectivity can be reduced to about 15 % [37]. Despite the acknowledgment that high CO2 selectivity originates from high WGSR activity on the catalyst surface, the mechanism for high CO2 in the Na-promoted Co-Mn composite oxide system remains unclear, and was therefore the main focus of this work. Additionally, the catalyst obtained using the melting method demonstrated stable performance: over the measured 120 h, catalyst activity and the selectivity of each product showed no significant changes. (See Fig. 1c and 1d.). 3.2 Structural and morphological characterization 3.2.1 XRD analysis To unveil the structure–property relationship of the Co-Mn composite oxide catalysts prepared using various methods, XRD characterization was employed to determine the phases of the pristine, reduced and spent catalyst samples. As depicted in Fig. 2 , the diffraction intensity of the catalysts (31.26°, 36.82°, 44.83°, 55.77° and 59.47°) prepared using the three different methods corresponds to the characteristic peaks of Co2MnO4.5 (JCPDS#032–0297). This suggests that, despite the distinct preparation methods involved, the Co-Mn composite oxide catalysts obtained are identical in terms of phases. As indicated in Table S3, the average crystal size determined for the catalysts (using Scherrer's formula) wase 8.36 nm (N-Co2MnO4.5), 10.12 nm (M−Co2MnO4.5) and 11.63 nm (P- Co2MnO4.5). After subjecting the three catalysts to H2 reduction under identical conditions, all characteristic peaks of Co2MnO4.5 vanished. Meanwhile, differences in characteristic peaks were observed for the samples derived using the three different methods (Fig. 2b). The characteristic peaks of CoxMn1-xO at 35.95°, 41.75°, and 60.64° [42], along with a small intensity of Co0 at 44.46°, emerged for the N-Co2MnO4.5 and P- Co2MnO4.5. A pronounced peak intensity of Co0 at 44.46° appeared in the XRD spectra for the M−Co2MnO4.5 sample after reduction, while no CoxMn1-xO was identified. However, peaks for MnO were indexed at 35.63°, 41.30°, 51.45° and 59.49° (JCPDS#04–0326). The characteristic peaks of Co2C (JCPDS#89–4307) at 37.17°, 41.84°, 42.69° and 45.80° are present in all three catalyst samples after carburization and reaction, as shown in Fig. 2c. However, significant differences exist in the intensity of the Co2C peaks of the samples: the M−Co2MnO4.5 sample exhibiting much larger Co2C peak areas, which indicates a higher Co2C content. Moreover, the presence of MnO, but not CoxMn1-xO, supports the notion that more Co exists in the form of Co2C in this sample. In contrast, a weaker signal intensity of Co2C and a reduced CoxMn1-xO peak intensity is observed in the spent N-Co2MnO4.5 and P-Co2MnO4.5 samples. Notably, none of the working catalyst samples show characteristic peaks for Co0, which suggests that either cobalt exists in a non-reduced state or that cobalt clusters are too small to be detected by XRD. However, Co0 is clearly detected in the reduced M−Co2MnO4.5 sample, which indicates that the cobalt clusters are sufficiently large to be detected. Therefore, the XRD results suggest that Co0 is not present in the working catalyst samples to act as the active site, but with Co2C predominantly present in the M−Co2MnO4.5 catalyst and a mixture of Co2C and CoxMn1-xO in the N-Co2MnO4.5 and P-Co2MnO4.5 catalysts as the cobalt species. Two distinct evolution routes are evident for Co-Mn composite Co2MnO4.5 in catalysts prepared using the melting and co-precipitation methods. During the reduction stage, an apparent phase separation occurs for Co and Mn species in the M−Co2MnO4.5 catalyst prepared using the melting method. The successful liberation of Co from the Co-Mn composite structure facilitates the subsequent carburization reaction of Co, which results in a markedly high Co2C content in the spent catalyst sample. In contrast, the spinel structure remains for the Co-Mn composite oxide obtained by means of co-precipitation, and it transitions only to the partially reduced form, i.e. CoxMn1-xO. Due to the limited reduction of Co during this stage, the subsequent carburization process fails to extensively transform the Co oxide, CoxMn1-xO, fully into Co2C. The final working catalyst samples thus exhibit a significantly lower Co2C content than M−Co2MnO4.5. 3.2.2 SEM analysis The SEM images for the pristine catalyst samples are given in Fig. 3 ; the elemental mappings are provided in Fig. S4. The results illustrate a similar nanoparticle size for the three prepared catalysts after calcination, yet their morphologies exhibit distinctive features. The sample produced when using the melting method resulted in spherical nanoparticles with a uniform size and monodispersity. Even at a larger scale, the catalyst nanoparticles remain well-dispersed and show no signs of agglomeration. Conversely, the two catalysts prepared by co-precipitation exhibit a broader particle size distribution, with nano-sized particles further agglomerating to form large, blocky morphologies ranging in size from a few hundred nanometers to micrometers. Specifically, when (NH4)2CO3 was used as the precipitant, severe agglomeration occurred, which is possibly due to secondary calcination after Na impregnation. This suggests that differences in the microstructure of the catalyst during the precursor calcination process affect the morphology of the catalysts. The substantial variations in microstructure seen among the catalysts may influence their performance, particularly in terms of creating a micro-environment for reactants and products on the active sites. The particles of the three spent catalysts agglomerated and formed larger particles, which caused changes in particle size and dispersion. The increased particle size observed in all three catalysts after reaction, coupled with the XRD results above, may be due to the phase transformation of the catalyst from Co-Mn composite oxide to Co2C. However, after the reaction, the M−Co2MnO4.5 catalyst maintained its high dispersion pattern and uniform nanoparticle size. The well-dispersed nanoparticles in M−Co2MnO4.5 are a result of the preparation procedure used, as the precursors were thoroughly mixed and highly dispersed in molten glucose and urea. The subsequent urea decomposition at 180 °C sufficiently relaxed the molten syrup, which widened the space between the precursor droplets. Nanoparticles then formed from the droplets, with graphitic carbon wrappings acting as a barrier that prevented aggregation between particles during the calcination step. Following further carbon removal, the already-formed nanoparticles were uniformly dispersed and less prone to agglomeration. Therefore, the catalyst prepared using the melting method allows for control of particle size and morphology, which facilitates a refined catalyst design. The various preparation methods used resulted in variations in the surface areas of the catalysts. The surface areas and N2 adsorption–desorption isotherm curves for the three catalysts are detailed in Table S4 and Fig. S5, respectively. None of the three catalysts exhibited micropores, and the pore size distribution of the catalysts prepared using the co-precipitation method ranged from 5 to 15 nm, while that of the catalysts prepared using the melting method was 5 to 20 nm. 3.2.3 TEM analysis The HRTEM images of the pristine and spent catalyst samples are provided in Figs. 4 and 5 , respectively. Fig. 4 shows that the nanoparticle morphology of the three catalysts is predominantly spherical, with a small fraction of irregularly shaped particles. HRTEM results show lattice spacings of 4.72 Å and 2.89 Å in both the pristine N-Co2MnO4.5 and P-Co2MnO4.5 samples, which correspond to the (111) and (220) crystal facets of Co2MnO4.5. Only one lattice spacing of 4.72 Å (which corresponds to the (111) crystal facets of Co2MnO4.5) is observed in the pristine M−Co2MnO4.5 catalyst prepared using the melting method. The identified facets for all samples demonstrate Co2MnO4.5 crystals upon preparation, which aligns with the phase identification results obtained via XRD. Despite the pristine samples sharing the same phase composition, Co2MnO4.5, the catalysts that were investigated transformed into various active phases, as suggested by the HRTEM images in Fig. 5. A common characteristic for all three catalyst samples is the absence of Co2MnO4.5. This indicates it was transformed to other species during H2 reduction and carburization. In the case of M−Co2MnO4.5, Co2C is identified as the Co species with three crystalline facets identified − (101), (020) and (210) − and corresponding lattice spacings of 2.42, 2.19, and 1.98 Å, respectively. No partially reduced Co-Mn composite oxide, CoxMn1-xO, was identified. This suggests that the transformation from Co2MnO4.5 to Co0 and then to Co2C occurred to a significant extent. In contrast, CoxMn1-xO with crystalline facets of (111) and (220) was found in the spent N-Co2MnO4.5 and P-Co2MnO4.5 samples, although Co2C with a typical facet of (020) was also identified. This indicates that a considerable portion of the Co remains in the oxidized state, rather than as Co2C. Analysis of the spent M−Co2MnO4.5 sample also indicates the presence of MnO with crystalline facets of (120). This suggests that Mn was liberated from the Co2MnO4.5 structure, which supports the observation that Co was reduced to Co0. Conversely, no MnO was observed in the spent N-Co2MnO4.5 and P-Co2MnO4.5 samples where co-precipitation was applied. This confirms that the phase separation of the Co-Mn composite to form Co0 and MnO during the catalyst pretreatment stages was not achieved. The identified phases and their facets align well with the XRD analysis detailed in the previous section, and collectively indicate that the catalysts prepared using the melting and co-precipitation methods possess distinct compositions as active phases for the FTO. The data in Table 1 suggests that the significant difference in the phase composition had a limited effect on the selectivity of light olefins and the product distributions. This implies that both Na-promoted Co2C and CoxMn1-xO are active for the FTO and have high olefin selectivity. However, the CO2 selectivity is essentially affected by the phase composition, i.e. if CoxMn1-xO is primarily presented or not when the catalysts are designed in different ways. In previous studies, despite the catalysts exhibiting a significant amount of CoxMn1-xO, the researchers primarily focused on Co2C itself, due to its association with high olefin selectivity − a pivotal aspect of cobalt-based catalysts for the FTO. The experimental data and phase identification reported in this paper emphasize that both Na-promoted Co2C and CoxMn1-xO can lead to high olefin selectivity. The findings also indicate that high CO2 selectivity is closely tied to the presence of CoxMn1-xO, rather than Co2C. When the active catalyst achieves a high Co2C content, limited WGS activity is observed, which results in low CO2 selectivity. Previous studies [42,43] also attributed high CO2 selectivity in Co2C-based catalysts to the addition of Na, promoting higher WGSR activity. However, if Na plays a role in high CO2 selectivity, it appears to have a more pronounced effect on a catalyst with a higher CoxMn1-xO content rather than one with a high Co2C content, as suggested by data in this paper. 3.3 Effect of Co species on CO2 selectivity The preceding sections show that CO2 selectivity is determined by the active phases of the catalyst, with: one predominantly containing Co2C that results in low CO2 selectivity; and the other two exhibiting a mixture of CoxMn1-xO and Co2C, which leads to high CO2 selectivity. In addition, the high Co2C content is closely associated with significant liberation of Co from Co2MnO4.5 to Co0 during the reduction stage. To further understand the correlation between material surface properties and CO2 selectivity, H2-TPR-MS, XPS, XANES and EXAFS analyses were conducted for two catalysts (M−Co2MnO4.5 and P-Co2MnO4.5). These were prepared using the melting and co-precipitation methods, respectively. 3.3.1 H2-TPR-MS analysis The pristine M−Co2MnO4.5 and P-Co2MnO4.5 catalyst samples were characterized using H2-TPR-MS to analyze the catalyst reduction process and the production of H2O during reduction, as illustrated in Fig. 6 . The reduction curves for Co3O4 and Mn3O4, prepared using the melting method, are provided for reference purposes. The tail gas MS spectrometry data for M−Co2MnO4.5 and P-Co2MnO4.5 indicate that the reduction peaks of the two catalysts consumed hydrogen and generated water. The M−Co2MnO4.5 catalyst exhibits three reduction peaks (at 213 °C, 300 °C and 430 °C), while the P-Co2MnO4.5 catalyst displays two major reduction peaks at 325 °C and 458 °C. Close to the reduction peak at the low-temperature region for Mn3O4, a reduction peak emerged at 213 °C for the M−Co2MnO4.5 sample, which signifies phase separation of Co and Mn species in Co2MnO4.5. We posit that the reduction of Mn plays a pivotal role in phase separation and liberation of Co from the Co2MnO4.5 structure. The intensity of the peak at 210 °C may determine the final reduction extent of Co, which affects the Co2C fraction in the active catalyst sample. Notably, a peak was observed at the same temperature region for the P-Co2MnO4.5 sample, albeit with a milder intensity, which indicates the lesser extent of the phase separation of Co and Mn. The remaining two major reduction peaks beyond 300 °C shifted to a higher temperature in the P-Co2MnO4.5 sample, which suggests that the M−Co2MnO4.5 sample was more readily reducible. 3.3.2 XPS characterization XPS was employed to analyze the valence states of the elements in the three catalysts in their pristine, reduced, and carburized states. The complete XPS surveys of the catalysts are provided in Fig. S6. The Co 2p and Mn 2p spectra are shown in Fig. 7 and the calculated content of Co species are presented in Table S5. Given that reduced Co catalysts are prone to oxidation upon exposure to air, in-situ XPS analysis was used to examine the catalysts in a reduced state. Since the results for N-Co2MnO4.5 and P- Co2MnO4.5 are similar, the features of M−Co2MnO4.5 and P-Co2MnO4.5 will be discussed. Peaks corresponding to Co2+ (781.90 eV) and Co3+ (780.05 eV) were identified in Co 2p3/2 for the pristine catalysts prepared using both methods. According to the results shown in Table S5, the fitted peak areas suggest that the Co2+ and Co3+ content in the pristine M−Co2MnO4.5 catalyst sample was 17.4 % and 82.6 %, respectively. In the P-Co2MnO4.5 catalysts, it was 27.5 % and 72.4 %, respectively. After reduction by H2 the content of Co2+ in the M−Co2MnO4.5 catalyst decreased dramatically, and no peak of Co3+ was observed. (See Fig. 7c.) Notably, the peak of Co0 appeared at 799.89 eV with a content of 90.7 %, while the Co2+ content changed from 17.4 % to 9.3 %. This indicates that a substantial amount of Co2MnO4.5 was reduced to Co0, which is consistent with the XRD and HRTEM results provided in the previous sections. In contrast, the reduced P-Co2MnO4.5 catalyst sample contained much less Co0 (15.3 %), but a significant fraction of unreduced Co, with Co3+ at 60.13 % and Co2+ at 24.5 %. A high content in the high valence state of Co strongly suggests that the Co is still intertwined with Mn and O in the CoxMn1-xO structure. In the spent catalyst samples, the peak of Co0 disappeared in M−Co2MnO4.5, and the peak of Co2+ increased to a fraction as high as 94.3 %. Since the catalyst has been carburized and no cobalt oxides were identified, as suggested by the XRD results, the presence of Co2+ can therefore be attributed to Co2C. This indicates that a large amount of Co2C was generated after carburization and reaction. In contrast, the Co2+ content of N-Co2MnO4.5 and P-Co2MnO4.5 increased to 43.6 % and 58.4 %, respectively − see Table S5. This suggests that the amount of Co2C generated in these two catalysts was limited. Meanwhile, 56.4 % and 41.7 % of Co remained as Co3+, which indicates that a substantial fraction of CoxMn1-xO remained in both these catalysts. When Co is not freed from the Co-Mn structure, Mn is not freed either. Therefore, the variation in the valence state of Mn is a strong indication of the valence state of Co. After reduction, the valence state of Mn changes, and the Mn2+ peak appears at 640.35 eV. This suggests that Mn separates from Co-Mn composite oxides and exists in the form of MnO. Additionally, the Mn4+ content after the reaction is close to that in the reduced sample, which indicates the stable presence of MnO during the carburization process and the reaction. This is proof that Co has been successfully released from the Co-Mn composite during reduction of the catalyst, which leads to phase separation of Co2MnO4.5 into two separate crystals: MnO and Co0. However, in the two samples obtained via co-precipitation, a large fraction of Mn4+ can be observed in both the reduced and spent samples. This suggested that Co2MnO4.5 is partially reduced to CoxMn1-xO, which contains both Mn4+ and Mn2+. This further confirms that Mn has not been freed from the Co-Mn composite oxide. It also implies that transformation of the Co species into Co2C is limited, which is consistent with the phase characterization results detailed in Sections 3.2.1 and 3.2.3. 3.3.3 XANES and EXAFS analysis The XRD results suggest the presence of different phases of Co in the examined catalyst samples, while XPS analysis indicates varying valence states of Co in the active catalyst samples after carburization. However, it has been suggested that Co0 clusters on the surface of Co2C-based catalysts are crucial for achieving lower CO2 selectivity in the FTO reaction [39]. Since information about Co0 is not observable from XRD and XPS analyses, we conducted XANES and EXAFS for a more detailed analysis of the spent catalyst samples. The spectra are presented in Fig. 8 , and the calculated coordination numbers for Co with other elements, the fitting analysis of EXAFS spectra, as well as the wavelet transform (WT) analysis, are provided in Table S6 and Figs. S6 and S7, respectively. The XANES spectra in Fig. 8a reveal a gradual shift to the right in the curves, ranging from about 7709 to 7715 eV, indicating an increase in the Co valence state in both catalyst samples when compared to the Co-foil. The peaks emerging at about 7710 eV correspond to the 1 s to 3d orbital transition of Co, suggesting the presence of a centrosymmetric field due to Co2C [39,44,45]. Additionally, the surface Co on M−Co2MnO4.5 exhibits a lower valence state compared to P-Co2MnO4.5, which is consistent with the XPS results showing a higher proportion of Co3+ on the surface of P-Co2MnO4.5 and predominantly Co2+ on the surface of M−Co2MnO4.5. This observation is also consistent with the finding that Co in P-Co2MnO4.5 has a lower reduction degree compared to the M−Co2MnO4.5 catalyst. The EXAFS spectra provided in Fig. 8b further highlight the strengthening of the Co-C coordination peak at about 2.26 Å for the spent M−Co2MnO4.5 catalyst. Analysis of the EXAFS data (Fig. S7 and Table S6) suggests a coordination number of 4.1 ± 0.2 for the Co-C path in the M−Co2MnO4.5 catalyst, whereas the P-Co2MnO4.5 catalyst shows a value of 2.4 ± 0.2. Correspondingly, the coordination number of Co-O for M−Co2MnO4.5 is 1.2 ± 0.3, whereas for the P-Co2MnO4.5 catalyst, it is 2.2 ± 0.3. Both findings support the notion that the spent M−Co2MnO4.5 catalyst has a higher Co2C content. Analysis of the data also indicates the presence of Co-Co bonds in both catalyst samples, with coordination numbers of 4.1 ± 0.5 and 4.9 ± 0.6 for the M−Co2MnO4.5 and P-Co2MnO4.5 catalysts, respectively (Table S5). Given that metallic Co0 is undetectable by XRD, it likely exists in clusters, as suggested by findings in the literature [39]. The WT values (Fig. S8) also demonstrate similar strengths of Co-Co bonds on the surfaces of both catalysts, which indicate comparable levels of metallic Co contents. Therefore, the fine surface analysis of the catalysts further confirms that the primary reason for the different WGSR activities lies in the varying content of CoxMn1-xO, rather than metallic Co, in the catalyst samples. 3.3.4 Catalyst performance during transformation of Co0 to Co2C To further investigate whether the presence of metallic Co is the primary reason for the reduced WGSR activity, we examined the variation in CO2 selectivity during the transition from metallic Co0 to Co2C in the catalyst. The M−Co2MnO4.5 catalyst initially exhibited predominantly metallic Co once it was reduced by H2, which transformed into Co2C via carburization under syngas atmosphere as confirmed by the XRD and XPS results (see Figs. 2 and 7). We then monitored the dynamic phase changes during this transformation process (see Fig. S9) and recorded CO conversion, CO2 selectivity, and olefin selectivity (indicated by O/P ratios). The results are presented in Fig. 9 . Fig. S9 illustrates the transformation of the sample from metallic Co to Co2C over approximately 6 h. While we cannot precisely quantify the specific amounts of Co0 and Co2C during this 6-hour period with a finer characterization, we can ascertain that the catalyst transitions from a phase predominantly consisting of Co0 to one primarily composed of Co2C. Despite this transformation, the data in Fig. 9 suggest that the generation of Co2C from Co0 did not result in an increase in CO2 selectivity, which indicates that the formation of Co2C in this catalyst does not enhance WGSR activity. Additionally, significant changes in Co0 content did not lead to noticeable variation in catalyst activity. These results suggest that the activity and CO2 selectivity of this Na-promoted Co-Mn composite catalyst do not follow the common observation that metallic Co would provide a high catalytic activity and low CO2 selectivity. In addition, the olefin selectivity remains high when the active phase varies from Co0 to Co2C, as indicated by the olefin/paraffin ratios in Fig. 9b. This suggests that metallic Co⁰, under the promotion of Na and Mn, can also achieve high selectivity of olefins. We speculate that specific crystal planes of Co2C [28,42] are not the only factor in achieving high olefin selectivity. However, the result here does not conflict with the notion of facet effects influencing FTO performance reported in the literature. 3.4 WGSR activity on Co2C and Co oxides 3.4.1 WGSR probe experiments Despite using the same elements, the catalysts exhibited markedly different levels of CO2 selectivity. A detailed analysis of the structural and morphological aspects of the catalyst samples revealed differences in the quantity of Co2C and CoxMn1-xO in the active catalysts. Testing catalysts in reactors under various CO conversion conditions means there are variations in the H2O and CO partial pressure, which could affect the WGSR activity on the catalysts. In order to thoroughly determine the conformity of the relationship between CO2 selectivity and the active phases, WGSR probe experiments (Fig. 10 a and 10b) and CO/H2O-TPSR (Fig. 10c and 10d) were conducted using identical H2O and CO feed conditions. The catalysts prepared using the two methods exhibited similar FTO performance under a syngas atmosphere, which confirms the reproducibility of their performance. However, when switching from H2 to H2O, the WGSR activity varied significantly: the M−Co2MnO4.5 catalyst showed 17.6 % conversion and 99.2 % CO2 selectivity; the P-Co2MnO4.5 catalyst showed 65.0 % conversion and 99.0 % CO2 selectivity. Additionally, the much lower H2/CO ratio (Fig. 10a) in the off-gas of the M−Co2MnO4.5 also confirmed its lower WGSR activity. The TPSR-MS results (Fig. 10c and 10d) for both catalysts − performed at temperatures above 200 °C − indicated an enhanced CO2 signal intensity for the P-Co2MnO4.5 catalyst for the temperature range used for testing. At 240 °C, the temperature level used for the FTO experiments, the P-Co2MnO4.5 catalyst exhibited a CO2 signal intensity 2.9 times higher than that of the M−Co2MnO4.5 catalyst, which confirms that the melting method results in lower WGSR activity. With the additional data on the distinction in WGSR activity, it is evident that the active phases of the catalysts prepared using the two methods play a decisive role in determining CO2 selectivity. 3.4.2 DFT calculation of H2O adsorption on Co2C and Co oxides DFT calculations indicate that H2O exhibits much weaker adsorption on the Co2C surface than Co2MnO4.5. Since determining the atomic ratio of partially reduced CoxMn1-xO for the elements is impractical, Co2MnO4.5 was used in the calculations to simulate the adsorption energy of H2O on the surface of CoxMn1-xO. Typical Co2C crystalline facets (020) and (101), and Co2MnO4.5 facets (111) and (220), were constructed, and the simulation of H2O adsorption on these surfaces is illustrated in Fig. 11 . The promoter Na − in the form of Na2O − was incorporated in constructing the catalyst surfaces. The adsorption energies of H2O on the Co2C (020) and (101) surfaces were found to be −0.44 and −0.49 eV, respectively (Fig. 11a); for the Co2MnO4.5 (111) and (220) surfaces it was −1.25 and −1.34 eV, respectively (Fig. 11b). This indicates higher WGS activity on the Na-promoted Co2MnO4.5 surface. 3.4.3 Mechanism exploration of WGSR activity on a Co2C-based catalyst The findings provided above suggest that the heightened selectivity to CO2 observed in Co2C-based catalysts is due to the presence of CoxMn1-xO within the catalyst matrix. To delve deeper into the WGSR activity on CoxMn1-xO and explore the additional factors influencing CO2 selectivity in Co2C-based catalysts, we synthesized catalysts containing only CoxMn1-xO by excluding Na. FTO experiments were then conducted under identical conditions, as described above. The catalysts prepared using the melting and precipitation methods. In the absence of Na, the pristine catalyst samples revealed the presence of Co2MnO4.5, as indicated by the XRD spectra shown in Fig. S10. However, following reduction and carburization, neither transformed into Co2C; instead, they persisted in the form of CoxMn1-xO. Importantly, the successful reduction of Co2MnO4.5 to metallic Co and its subsequent transformation to Co2C were not influenced by the differences in the preparation methods used, but were contingent on the presence of Na. The product distribution of these catalysts typically exhibits a relatively high O/P ratio, elevated olefinic selectivity and commendable overall activity, albeit with pronounced CH4 selectivity. More importantly, when CoxMn1-xO served as the active phase, the catalyst did not exhibit high CO2 selectivity, which indicates the insignificant impact of WGS activity of CoxMn1-xO. Hence, the heightened WGSR activity observed in Na-promoted Co2C-based catalysts is determined by both the presence of CoxMn1-xO, as well as the addition of Na. We then systematically studied the Na effect on the catalysts prepared using the melting method, by varying the Na content from 0 up to 0.8 wt% (Table S7). The XRD patterns of the pristine and carburized (spent) catalyst samples are shown in Figs. S11 and S12, respectively. The CO2 selectivity, the catalyst performance, and the corresponding Co2C contents at different Na levels are given in Fig. 12 . The corresponding hydrocarbon product data are presented in Table S8 and the fine data analysis for the XRD spectra are provided in Fig. S13 and Table S9. Given that Na promotes WGSR to a different extent on Co2C and CoxMn1-xO, as discussed above, it is unsurprising that increasing the Na content from 0.4 % to 0.8 % in the catalyst prepared using the melting method resulted in sustained low CO2 selectivity levels. This outcome can be attributed to the high Co2C content in these catalyst samples, which confirms that Na does not enhance WGSR on Co2C. Conversely, with a relatively low Na content, CO2 selectivity increases in the 0.1–0.3 range, in correspondence with the increment in Na content. Close examination of the physical phases shown in Fig. 12 and Fig. S13 reveals that, in this Na content range, CoxMn1-xO content in the catalyst is higher than with a high Na content. The same study was conducted for the Co-Mn catalysts prepared by the co-precipitation method, with Na content ranging from 0.1 to 0.6 % (Table S10). The performance of these catalysts, along with the corresponding Co2C and CoxMn1-xO contents, is presented in Fig. S14. Detailed reaction data are provided in Table S11, while XRD analysis spectra and calculated phase compositions are shown in Fig. S15 and Table S12, respectively. The CO2 selectivity ranges from 21.3 % to 35.8 %, significantly higher than those observed for the catalyst samples prepared by the melting method. Correspondingly, consistently high fractions of CoxMn1-xO (26.2 %–33.8 %) are observed in these catalyst samples, similar to previous studies utilizing the same co-precipitation method for catalyst preparation [42]. Therefore, creating a structural condition conducive to easy phase separation between Co and Mn is pivotal to determining the ultimate Co2C content in the active catalyst. It is crucial to note that the elemental species and compositions used to prepare the catalysts via both methods was identical, as confirmed by the ICP results in Table S1. The characterization results also suggest that the structure is Co2MnO4.5 for the freshly prepared catalysts, and that the crystallinity and particle sizes are comparable. The primary difference that leads to this result is probably how Na interacts with the Co-Mn composite structure, as the absence of Na fails to facilitate phase separation for Co2MnO4.5 during the H2 reduction stage (Fig. S9). The melting method highly possibly enables adequate mixing of Co, Mn and Na to a homogeneous state during preparation. The well-dispersed Na, adjacent to the Co-Mn structure, facilitates easy phase separation of Co and Mn species. Given the presence of Co2C, partially reduced Co oxide, CoxMn1-xO, the promoter Na, and the interactions between them, the mechanism behind the elevated CO2 selectivity in Co2C-based catalysts is not a simple one, as other affecting factors may not be identified in this study. High CO2 selectivity, resulting from high WGSR activity, may originates from the presence of the partially reduced Co-Mn composite oxide, CoxMn1-xO, or in another word, higher Co-O coordination due to the presence of CoxMn1-xO. However, CoxMn1-xO itself (high Co-O coordination) exhibits limited WGSR activity only, while the presence of Na strongly boosts its WGSR activity, even at reduced H2O partial pressure, as lower conversion figures are obtained when Na is added. The evidence presented in this work suggests that Co2C does not exhibit obvious WGSR activity, since low CO2 selectivity is consistently observed when the catalyst has a high Co2C content (higher Co-C coordination). Additionally, Na is one of the factors that promotes WGSR activity over a Co2C-based catalyst, but its promotional effect on WGSR does not occur through Co2C, but rather through CoxMn1-xO. High CO2 selectivity is only observed when both CoxMn1-xO and Na are simultaneously present in the catalyst, i.e. the presence of either one alone does not lead to high CO2 selectivity. Similarly, even when Na is present at a higher concentration, the catalyst still exhibits lower WGSR activity, as long as the catalysts contain primarily Co2C as the active phase. Based on the differences in phase transformations during the reduction and carburization processes of the catalysts, as well as the resulted variations in WGSR activity, we propose a possible model describing the relationship between the phase evolution of Co2C-based catalysts and CO2 selectivity, as presented in Fig. 13 . 4 Conclusion This study investigates the CO2 selectivity of Co2C-based catalysts and provides insights into the potential origin of resulting in high CO2 selectivity under low-temperature FTO conditions. Na-promoted Co2C catalysts, synthesized using both the melting method and the co-precipitation method with equivalent elemental contents, demonstrate similarly high selectivity toward short-chain olefins. However, drastic differences in CO2 selectivity exhibit, with the melting method yielding 3.8 % and the co-precipitation method yielding 35.3 %. Thorough phase characterization, as the catalysts transition from pristine to reduced and carburized states, reveals that high CO2 selectivity originates from CoxMn1-xO, or high Co-O coordination, when phase separation of Co and Mn species from the Co-Mn composite structure is not achieved. However, CoxMn1-xO alone does not exhibit high WGSR activity, while the CO2 formation reaction on the surface of CoxMn1-xO is greatly accelerated with Na promotion. As the widely focused active phase, Co2C itself does not display strong WGSR activity. Close CO conversion and CO2 selectivity are observed when the Co phase transforms from Co0 to Co2C, indicating that, with Na as a promoter, both Co0 and Co2C exhibit similar catalytic performance. Increasing the Na content up to 0.8 wt% fails to elevate the CO2 selectivity of the catalysts, as long as the Co2C content is at high levels. However, catalysts with low Na contents (0.1–0.3 wt%) prepared using the melting method exhibit relatively high CO2 selectivity. This may be due to the presence of fractional CoxMn1-xO in the catalyst, as an insufficient amount of Na fails to liberate Co from the Co-Mn composite structure to a great extent, hindering its conversion to Co2C. This study explains the possible origin that drives high CO2 selectivity in Co2C-based catalysts for FTO based on the phase identification and mechanistic experiments, and offers a simple yet highly effective strategy for designing Co2C-based catalysts with low CO2 selectivity, while achieving high selectivity for short-chain olefins. CRediT authorship contribution statement Yibo Tang: Writing – original draft, Methodology, Investigation, Formal analysis, Data curation. Sheng Zhan: Investigation, Formal analysis, Data curation. Jiayin Liang: Software, Investigation. Yiwen Liu: Investigation, Formal analysis, Data curation. Jiabing Chen: Validation, Formal analysis. Mengheng Wang: Validation, Methodology, Formal analysis. Xinying Liu: Writing – review & editing, Methodology. Diane Hildebrandt: Writing – review & editing, Conceptualization. Xiaojun Lu: Writing – review & editing, Supervision, Resources, Funding acquisition, Formal analysis, Conceptualization. Declaration of competing interest The authors declare that they have no known competing financial interests or personal relationships that could have appeared to influence the work reported in this paper. Acknowledgment This work was supported by the National Key R&D Program of China (2022YFE0101800) and the Wuhan Institute of Technology (CX2022057, CX2021037). Appendix A Supplementary material Supplementary data to this article can be found online at https://doi.org/10.1016/j.jcat.2024.115856. Appendix A Supplementary material The following are the Supplementary data to this article: Supplementary Data 1 References [1] W. Zhou K. Cheng J. Kang C. Zhou V. Subramanian Q. Zhang Y. Wang New horizon in C1 chemistry - breaking the selectivity limitation in transformation of syngas and hydrogenation of CO2 into hydrocarbon chemicals and fuels Chem. Soc. Rev. 48 2019 3193 3228 10.1039/c8cs00502h W. Zhou, K. Cheng, J. Kang, C. Zhou, V. Subramanian, Q. Zhang, Y. Wang, New horizon in C1 chemistry - breaking the selectivity limitation in transformation of syngas and hydrogenation of CO2 into hydrocarbon chemicals and fuels, Chem. Soc. Rev. 48 (2019) 3193-3228, doi: 10.1039/c8cs00502h. [2] J. Li Y. He L. Tan P. Zhang X. Peng A. Oruganti G. Yang H. Abe Y. Wang N. Tsubaki Integrated tuneable synthesis of liquid fuels via Fischer-Tropsch technology Nat. Catal. 1 2018 787 793 10.1038/s41929-018-0144-z J. Li, Y. He, L. Tan, P. Zhang, X. Peng, A. Oruganti, G. Yang, H. Abe, Y. Wang, N. Tsubaki, Integrated tuneable synthesis of liquid fuels via Fischer–Tropsch technology, Nat. Catal. 1 (2018) 787-793, doi: 10.1038/s41929-018-0144-z. [3] A.Y. Khodakov W. Chu P. Fongarland Advances in the development of novel cobalt Fischer−Tropsch catalysts for synthesis of long-chain hydrocarbons and clean fuels Chem. Rev. 107 2007 1692 1744 10.1021/cr050972v A.Y. Khodakov, W. Chu, P. Fongarland, Advances in the development of novel cobalt Fischer−Tropsch catalysts for synthesis of long-chain hydrocarbons and clean fuels, Chem. Rev. 107 (2007) 1692-1744, doi: 10.1021/cr050972v. [4] P. Zhai C. Xu R. Gao X. Liu M. Li W. Li X. Fu C. Jia J. Xie M. Zhao X. Wang Y. Li Q. Zhang X. Wen D. Ma Highly tunable selectivity for syngas-derived alkenes over zinc and sodium-modulated Fe5C2 catalyst Angew. Chem. Int. Ed. 55 2016 9902 9907 10.1002/anie.201603556 P. Zhai, C. Xu, R. Gao, X. Liu, M. Li, W. Li, X. Fu, C. Jia, J. Xie, M. Zhao, X. Wang, Y. Li, Q. Zhang, X. Wen, D. Ma, Highly tunable selectivity for syngas-derived alkenes over zinc and sodium-modulated Fe5C2 catalyst, Angew. Chem. Int. Ed. 55 (2016) 9902-9907, doi: 10.1002/anie.201603556. [5] Y. Cheng J. Lin T. Wu H. Wang S. Xie Y. Pei S. Yan M. Qiao B. Zong Mg and K dual-decorated Fe-on-reduced graphene oxide for selective catalyzing CO hydrogenation to light olefins with mitigated CO2 emission and enhanced activity Appl. Catal. B-Environ. 204 2017 475 485 10.1016/j.apcatb.2016.11.058 Y. Cheng, J. Lin, T. Wu, H. Wang, S. Xie, Y. Pei, S. Yan, M. Qiao, B. Zong, Mg and K dual-decorated Fe-on-reduced graphene oxide for selective catalyzing CO hydrogenation to light olefins with mitigated CO2 emission and enhanced activity, Appl. Catal. B-Environ. 204 (2017) 475-485, doi: 10.1016/j.apcatb.2016.11.058. [6] R. Mota G. Krishnamoorthy O. Dada S.A. Benson Hydrogen rich syngas production from oxy-steam gasification of a lignite coal - a design and optimization study Appl. Therm. Eng. 90 2015 13 22 10.1016/j.applthermaleng.2015.06.081 R. Mota, G. Krishnamoorthy, O. Dada, S.A. Benson, Hydrogen rich syngas production from oxy-steam gasification of a lignite coal - a design and optimization study, Appl. Therm. Eng. 90 (2015) 13-22, doi: 10.1016/j.applthermaleng.2015.06.081. [7] W. Peng S. Ge A.G. Ebadi H. Hisoriev M.J. Esfahani Syngas production by catalytic co-gasification of coal-biomass blends in a circulating fluidized bed gasifier J. Clean Prod. 168 2017 1513 1517 10.1016/j.jclepro.2017.06.233 W. Peng, S. Ge, A.G. Ebadi, H. Hisoriev, M.J. Esfahani, Syngas production by catalytic co-gasification of coal-biomass blends in a circulating fluidized bed gasifier, J. Clean Prod. 168 (2017) 1513-1517, doi: 10.1016/j.jclepro.2017.06.233. [8] T. Blumberg T. Morosuk G. Tsatsaronis Exergy-based evaluation of methanol production from natural gas with CO2 utilization Energy 141 2017 2528 2539 10.1016/j.energy.2017.06.140 T. Blumberg, T. Morosuk, G. Tsatsaronis, Exergy-based evaluation of methanol production from natural gas with CO2 utilization, Energy 141 (2017) 2528-2539, doi: 10.1016/j.energy.2017.06.140. [9] J.R. Rostrup-Nielsen An industrial perspective on the impact of Haldor Topsoe on research and development in synthesis gas production J. Catal. 328 2015 5 10 10.1016/j.jcat.2015.04.013 J.R. Rostrup-Nielsen, An industrial perspective on the impact of Haldor Topsoe on research and development in synthesis gas production, J. Catal. 328 (2015) 5-10, doi: 10.1016/j.jcat.2015.04.013. [10] S.K. Talkhoncheh M. Haghighi Syngas production via dry reforming of methane over Ni-based nanocatalyst over various supports of clinoptilolite, ceria and alumina J. Nat. Gas Sci. Eng. 23 2015 16 25 10.1016/j.jngse.2015.01.020 S.K. Talkhoncheh, M. Haghighi, Syngas production via dry reforming of methane over Ni-based nanocatalyst over various supports of clinoptilolite, ceria and alumina, J. Nat. Gas Sci. Eng. 23 (2015) 16-25, doi: 10.1016/j.jngse.2015.01.020. [11] A.S. Yu J.M. Vohs R.J. Gorte Interfacial reactions in ceramic membrane reactors for syngas production Energy Environ. Sci. 7 2014 944 953 10.1039/c3ee43137a A.S. Yu, J.M. Vohs, R.J. Gorte, Interfacial reactions in ceramic membrane reactors for syngas production, Energy Environ. Sci. 7 (2014) 944-953, doi: 10.1039/c3ee43137a. [12] Q. Xie F.C. Borges Y. Cheng Y. Wan Y. Li X. Lin Y. Liu F. Hussain P. Chen R. Ruan Fast microwave-assisted catalytic gasification of biomass for syngas production and tar removal Bioresour. Technol. 156 2014 291 296 10.1016/j.biortech.2014.01.057 Q. Xie, F.C. Borges, Y. Cheng, Y. Wan, Y. Li, X. Lin, Y. Liu, F. Hussain, P. Chen, R. Ruan, Fast microwave-assisted catalytic gasification of biomass for syngas production and tar removal, Bioresour. Technol. 156 (2014) 291-296, doi: 10.1016/j.biortech.2014.01.057. [13] F. Chen C. Wu L. Dong A. Vassallo P.T. Williams J. Huang Characteristics and catalytic properties of Ni/CaAlOx catalyst for hydrogen-enriched syngas production from pyrolysis-steam reforming of biomass sawdust Appl. Catal. B-Environ. 183 2016 168 175 10.1016/j.apcatb.2015.10.028 F. Chen, C. Wu, L. Dong, A. Vassallo, P.T. Williams, J. Huang, Characteristics and catalytic properties of Ni/CaAlOx catalyst for hydrogen-enriched syngas production from pyrolysis-steam reforming of biomass sawdust, Appl. Catal. B-Environ. 183 (2016) 168-175, doi: 10.1016/j.apcatb.2015.10.028. [14] W.X. Peng L.S. Wang M. Mirzaee H. Ahmadi M.J. Esfahani S. Fremaux Hydrogen and syngas production by catalytic biomass gasification Energy Conv. Manag. 135 2017 270 273 10.1016/j.enconman.2016.12.056 W.X. Peng, L.S. Wang, M. Mirzaee, H. Ahmadi, M.J. Esfahani, S. Fremaux, Hydrogen and syngas production by catalytic biomass gasification, Energy Conv. Manag. 135 (2017) 270-273, doi: 10.1016/j.enconman.2016.12.056. [15] Y. Song, E. Ozdemir, S. Ramesh, A. Adishev, S. Subramanian, A. Harale, M. Albuali, B.A. Fadhel, A. Jamal, D. Moon, S.H. Choi, C.T. Yavuz, Dry reforming of methane by stable Ni-Mo nanocatalysts on single-crystalline MgO, Science 367 (2020) 777, https://doi.org /10.1126/science.aav2412. [16] M. Akri S. Zhao X. Li K. Zang A.F. Lee M.A. Isaacs W. Xi Y. Gangarajula J. Luo Y. Ren Y. Cui L. Li Y. Su X. Pan W. Wen Y. Pan K. Wilson L. Li B. Qiao H. Ishii Y. Liao A. Wang X. Wang T. Zhang Atomically dispersed nickel as coke-resistant active sites for methane dry reforming Nat. Commun. 10 2019 10.1038/s41467-019-12843-w M. Akri, S. Zhao, X. Li, K. Zang, A.F. Lee, M.A. Isaacs, W. Xi, Y. Gangarajula, J. Luo, Y. Ren, Y. Cui, L. Li, Y. Su, X. Pan, W. Wen, Y. Pan, K. Wilson, L. Li, B. Qiao, H. Ishii, Y. Liao, A. Wang, X. Wang, T. Zhang, Atomically dispersed nickel as coke-resistant active sites for methane dry reforming, Nat. Commun. 10 (2019), doi: 10.1038/s41467-019-12843-w. [17] H.M. Torres Galvis K.P. de Jong Catalysts for production of lower olefins from synthesis gas: A review Acs Catal. 3 2013 2130 2149 10.1021/cs4003436 H.M. Torres Galvis, K.P. de Jong, Catalysts for production of lower olefins from synthesis gas: A review, Acs Catal. 3 (2013) 2130-2149, doi: 10.1021/cs4003436. [18] Y. Liu J. Chen J. Bao Y. Zhang Manganese-modified Fe3O4 microsphere catalyst with effective active phase of forming light olefins from syngas Acs Catal. 5 2015 3905 3909 10.1021/acscatal.5b00492 Y. Liu, J. Chen, J. Bao, Y. Zhang, Manganese-modified Fe3O4 microsphere catalyst with effective active phase of forming light olefins from syngas, Acs Catal. 5 (2015) 3905-3909, doi: 10.1021/acscatal.5b00492. [19] Y. Liu F. Lu Y. Tang M. Liu F.F. Tao Y. Zhang Effects of initial crystal structure of Fe2O3 and Mn promoter on effective active phase for syngas to light olefin Appl. Catal. B-Environ. 278 2020 119287 10.1016/j.apcatb.2019.118219 Y. Liu, F. Lu, Y. Tang, M. Liu, F.F. Tao, Y. Zhang, Effects of initial crystal structure of Fe2O3 and Mn promoter on effective active phase for syngas to light olefin, Appl. Catal. B-Environ. 278 (2020) 119287, doi: 10.1016/j.apcatb.2019.118219. [20] J. Wang Y. Xu G. Ma J. Lin H. Wang C. Zhang M. Ding Directly converting syngas to linear α-olefins over core–shell Fe3O4@MnO2 catalysts Acs Appl. Mater. Interfaces 10 2018 43578 43587 10.1021/acsami.8b11820 J. Wang, Y. Xu, G. Ma, J. Lin, H. Wang, C. Zhang, M. Ding, Directly converting syngas to linear α-olefins over core–shell Fe3O4@MnO2 catalysts, Acs Appl. Mater. Interfaces 10 (2018) 43578-43587, doi: 10.1021/acsami.8b11820. [21] X. Fang B. Liu K. Cao P. Yang Q. Zhao F. Jiang Y. Xu R. Chen X. Liu Particle-size-dependent methane selectivity evolution in cobalt-based Fischer-Tropsch Synthesis Acs Catal. 10 2020 2799 2816 10.1021/acscatal.9b05371 X. Fang, B. Liu, K. Cao, P. Yang, Q. Zhao, F. Jiang, Y. Xu, R. Chen, X. Liu, Particle-size-dependent methane selectivity evolution in cobalt-based Fischer–Tropsch Synthesis, Acs Catal. 10 (2020) 2799-2816, doi: 10.1021/acscatal.9b05371. [22] T. Lin K. Gong C. Wang Y. An X. Wang X. Qi S. Li Y. Lu L. Zhong Y. Sun Fischer-Tropsch Synthesis to olefins: Catalytic performance and structure evolution of Co2C-based catalysts under a CO2 environment Acs Catal. 9 2019 9554 9567 10.1021/acscatal.9b02513 T. Lin, K. Gong, C. Wang, Y. An, X. Wang, X. Qi, S. Li, Y. Lu, L. Zhong, Y. Sun, Fischer-Tropsch Synthesis to olefins: Catalytic performance and structure evolution of Co2C-based catalysts under a CO2 environment, Acs Catal. 9 (2019) 9554-9567, doi: /10. 1021/acscatal.9b02513. [23] B. Liu W. Li Y. Xu Q. Lin F. Jiang X. Liu Insight into the intrinsic active site for selective production of light olefins in cobalt-catalyzed Fischer-Tropsch Synthesis Acs Catal. 9 2019 7073 7089 10.1021/acscatal.9b00352 B. Liu, W. Li, Y. Xu, Q. Lin, F. Jiang, X. Liu, Insight into the intrinsic active site for selective production of light olefins in cobalt-catalyzed Fischer–Tropsch Synthesis, Acs Catal. 9 (2019) 7073-7089, doi: 10.1021/acscatal.9b00352. [24] N. Rahimi R. Karimzadeh Catalytic cracking of hydrocarbons over modified ZSM-5 zeolites to produce light olefins: A review Appl. Catal. A-Gen. 398 2011 1 17 10.1016/j.apcata.2011.03.009 N. Rahimi, R. Karimzadeh, Catalytic cracking of hydrocarbons over modified ZSM-5 zeolites to produce light olefins: A review, Appl. Catal. A-Gen. 398 (2011) 1-17, doi: 10.1016/j.apcata.2011.03.009. [25] P. Zhai Y. Li M. Wang J. Liu Z. Cao J. Zhang Y. Xu X. Liu Y. Li Q. Zhu D. Xiao X. Wen D. Ma Development of direct conversion of syngas to unsaturated hydrocarbons based on Fischer-Tropsch route Chem 7 2021 3027 3051 10.1016/j.chempr.2021.08.019 P. Zhai, Y. Li, M. Wang, J. Liu, Z. Cao, J. Zhang, Y. Xu, X. Liu, Y. Li, Q. Zhu, D. Xiao, X. Wen, D. Ma, Development of direct conversion of syngas to unsaturated hydrocarbons based on Fischer-Tropsch route, Chem 7 (2021) 3027-3051, doi: 10.1016/j.chempr.2021.08.019. [26] H.M.T. Galvis J.H. Bitter C.B. Khare M. Ruitenbeek A.I. Dugulan K.P. de Jong Supported iron nanoparticles as catalysts for sustainable production of lower olefins Science 335 2012 835 838 10.1126/science.1215614 H.M.T. Galvis, J.H. Bitter, C.B. Khare, M. Ruitenbeek, A.I. Dugulan, K.P. de Jong, Supported iron nanoparticles as catalysts for sustainable production of lower olefins, Science 335 (2012) 835-838, doi: 10.1126/science.1215614. [27] T. Lin F. Yu Y. An T. Qin L. Li K. Gong L. Zhong Y. Sun Cobalt carbide nanocatalysts for efficient syngas conversion to value-added chemicals with high selectivity Accounts Chem. Res. 54 2021 1961 1971 10.1021/acs.accounts.0c00883 T. Lin, F. Yu, Y. An, T. Qin, L. Li, K. Gong, L. Zhong, Y. Sun, Cobalt carbide nanocatalysts for efficient syngas conversion to value-added chemicals with high selectivity, Accounts Chem. Res. 54 (2021) 1961-1971, doi: 10.1021/acs.accounts.0c00883. [28] L. Zhong F. Yu Y. An Y. Zhao Y. Sun Z. Li T. Lin Y. Lin X. Qi Y. Dai L. Gu J. Hu S. Jin Q. Shen H. Wang Cobalt carbide nanoprisms for direct production of lower olefins from syngas Nature 538 2016 84 10.1038/nature19786 L. Zhong, F. Yu, Y. An, Y. Zhao, Y. Sun, Z. Li, T. Lin, Y. Lin, X. Qi, Y. Dai, L. Gu, J. Hu, S. Jin, Q. Shen, H. Wang, Cobalt carbide nanoprisms for direct production of lower olefins from syngas, Nature 538 (2016) 84, doi: 10.1038/nature19786. [29] F. Jiao J. Li X. Pan J. Xiao H. Li H. Ma M. Wei Y. Pan Z. Zhou M. Li S. Miao J. Li Y. Zhu D. Xiao T. He J. Yang F. Qi Q. Fu X. Bao Selective conversion of syngas to light olefins Science 351 2016 1065 1068 10.1126/science.aaf1835 F. Jiao, J. Li, X. Pan, J. Xiao, H. Li, H. Ma, M. Wei, Y. Pan, Z. Zhou, M. Li, S. Miao, J. Li, Y. Zhu, D. Xiao, T. He, J. Yang, F. Qi, Q. Fu, X. Bao, Selective conversion of syngas to light olefins, Science 351 (2016) 1065-1068, doi: doi:10.1126/science.aaf1835. [30] M. Tan S. Tian T. Zhang K. Wang L. Xiao J. Liang Q. Ma G. Yang N. Tsubaki Y. Tan Probing hydrophobization of a Cu / ZnO catalyst for suppression of water-gas-shift reaction in syngas conversion Acs Catal. 11 2021 4633 4643 10.1021/acscatal.0c05585 M. Tan, S. Tian, T. Zhang, K. Wang, L. Xiao, J. Liang, Q. Ma, G. Yang, N. Tsubaki, Y. Tan, Probing hydrophobization of a Cu / ZnO catalyst for suppression of water-gas-shift reaction in syngas conversion, Acs Catal. 11 (2021) 4633-4643, doi: 10.1021/acscatal.0c05585. [31] W. Zhou C. Zhou H. Yin J. Shi G. Zhang X. Zheng X. Min Z. Zhang K. Cheng J. Kang Q. Zhang Y. Wang Direct conversion of syngas into aromatics over a bifunctional catalyst - inhibiting net CO2 release Chem. Commun. 56 2020 5239 5242 https://doi.or1g/10.1039/d\\0cc00608d W. Zhou, C. Zhou, H. Yin, J. Shi, G. Zhang, X. Zheng, X. Min, Z. Zhang, K. Cheng, J. Kang, Q. Zhang, Y. Wang, Direct conversion of syngas into aromatics over a bifunctional catalyst - inhibiting net CO2 release, Chem. Commun. 56 (2020) 5239-5242, https://doi.or1g/10.1039/d\\0cc00608d. [32] M.K. Gnanamani G. Jacobs W.D. Shafer D.E. Sparks S. Hopps G.A. Thomas B.H. Davis Low temperature water-gas-shift reaction over alkali metal promoted cobalt carbide catalysts Top. Catal. 57 2014 612 618 10.1007/s11244-013-0219-7 M.K. Gnanamani, G. Jacobs, W.D. Shafer, D.E. Sparks, S. Hopps, G.A. Thomas, B.H. Davis, Low temperature water-gas-shift reaction over alkali metal promoted cobalt carbide catalysts, Top. Catal. 57 (2014) 612-618, doi: 10.1007/s11244-013-0219-7. [33] D.B. Bukur B. Todic N. Elbashir Role of water-gas-shift reaction in Fischer-Tropsch synthesis on iron catalysts: A review Catal. Today 275 2016 66 75 10.1016/j.cattod.2015.11.005 D.B. Bukur, B. Todic, N. Elbashir, Role of water-gas-shift reaction in Fischer-Tropsch synthesis on iron catalysts: A review, Catal. Today 275 (2016) 66-75, doi: 10.1016/j.cattod.2015.11.005. [34] X. Yu J. Zhang X. Wang Q. Ma X. Gao H. Xia X. Lai S. Fan T. Zhao Fischer-Tropsch synthesis over methyl modified Fe2O3@SiO2 catalysts with low CO2 selectivity Appl. Catal. B-Environ. 232 2018 420 428 10.1016/j.apcatb.2018.03.048 X. Yu, J. Zhang, X. Wang, Q. Ma, X. Gao, H. Xia, X. Lai, S. Fan, T. Zhao, Fischer-Tropsch synthesis over methyl modified Fe2O3@SiO2 catalysts with low CO2 selectivity, Appl. Catal. B-Environ. 232 (2018) 420-428, doi: 10.1016/j.apcatb.2018.03.048. [35] M. Ojeda R. Nabar A.U. Nilekar A. Ishikawa M. Mavrikakis E. Iglesia CO activation pathways and the mechanism of Fischer-Tropsch synthesis J. Catal. 272 2010 287 297 10.1016/j.jcat.2010.04.012 M. Ojeda, R. Nabar, A.U. Nilekar, A. Ishikawa, M. Mavrikakis, E. Iglesia, CO activation pathways and the mechanism of Fischer-Tropsch synthesis, J. Catal. 272 (2010) 287-297, doi: 10.1016/j.jcat.2010.04.012. [36] Y. Xu X. Li J. Gao J. Wang G. Ma X. Wen Y. Yang Y. Li M. Ding A hydrophobic FeMn@Si catalyst increases olefins from syngas by suppressing C1 by -products Science 371 2021 610 10.1126/science.abb3649 Y. Xu, X. Li, J. Gao, J. Wang, G. Ma, X. Wen, Y. Yang, Y. Li, M. Ding, A hydrophobic FeMn@Si catalyst increases olefins from syngas by suppressing C1 by -products, Science 371 (2021) 610, doi: 10.1126/science.abb3649. [37] T. Lin P. Liu K. Gong Y. An F. Yu X. Wang L. Zhong Y. Sun Designing silica-coated CoMn-based catalyst for Fischer-Tropsch synthesis to olefins with low CO2 emission Appl. Catal. B-Environ. 299 2021 10.1016/j.apcatb.2021.120683 T. Lin, P. Liu, K. Gong, Y. An, F. Yu, X. Wang, L. Zhong, Y. Sun, Designing silica-coated CoMn-based catalyst for Fischer-Tropsch synthesis to olefins with low CO2 emission, Appl. Catal. B-Environ. 299 (2021), doi: 10.1016/j.apcatb.2021.120683. [38] J. Xie P.P. Paalanen T.W. van Deelen B.M. Weckhuysen M.J. Louwerse K.P. de Jong Promoted cobalt metal catalysts suitable for the production of lower olefins from natural gas Nat. Commun. 10 2019 10.1038/s41467-018-08019-7 J. Xie, P.P. Paalanen, T.W. van Deelen, B.M. Weckhuysen, M.J. Louwerse, K.P. de Jong, Promoted cobalt metal catalysts suitable for the production of lower olefins from natural gas, Nat. Commun. 10 (2019), doi: 10.1038/s41467-018-08019-7. [39] S. Lyu Q. Wu Z. Li Y. Zhang J. Li L. Wang Cobalt clusters decorated CoxMn1−xO nanocomposites for improving the efficiency of syngas to lower olefins with lower CO2 emission Appl. Catal. B-Environ. 325 2023 122347 10.1016/j.apcatb.2022. 122347 S. Lyu, Q. Wu, Z. Li, Y. Zhang, J. Li, L. Wang, Cobalt clusters decorated CoxMn1−xO nanocomposites for improving the efficiency of syngas to lower olefins with lower CO2 emission, Appl. Catal. B-Environ. 325 (2023) 122347, doi: 10.1016/j.apcatb.2022. 122347. [40] Y. Liu C. He X. Jiang R. Zhang X. Liu D. Hildebrandt X. Lu Fischer-Tropsch synthesis to α-Olefins with low CO2 selectivity on a Co2C catalyst Chem. Eng. J. 479 2024 147927 10.1016/j.cej.2023.147927 Y. Liu, C. He, X. Jiang, R. Zhang, X. Liu, D. Hildebrandt, X. Lu, Fischer-Tropsch synthesis to α-Olefins with low CO2 selectivity on a Co2C catalyst, Chem. Eng. J. 479 (2024) 147927, doi: 10.1016/j.cej.2023.147927. [41] R. Zafari M. Abdouss Y. Zamani A. Tavasoli An efficient catalyst for light olefins production from CO hydrogenation: Synergistic effect of Zn and Ce promoters on performance of Co–Mn/SiO2 catalyst Catal. Lett. 147 2017 2475 2486 10.1007/s10562-017-2152-z R. Zafari, M. Abdouss, Y. Zamani, A. Tavasoli, An efficient catalyst for light olefins production from CO hydrogenation: Synergistic effect of Zn and Ce promoters on performance of Co–Mn/SiO2 catalyst, Catal. Lett. 147 (2017) 2475-2486, doi: 10.1007/s10562-017-2152-z. [42] Z. Li L. Zhong F. Yu Y. An Y. Dai Y. Yang T. Lin S. Li H. Wang P. Gao Y. Sun M. He Effects of sodium on the catalytic performance of CoMn catalysts for Fischer-Tropsch to olefin reactions Acs Catal. 7 2017 3622 3631 10.1021/acscatal.6b03478 Z. Li, L. Zhong, F. Yu, Y. An, Y. Dai, Y. Yang, T. Lin, S. Li, H. Wang, P. Gao, Y. Sun, M. He, Effects of sodium on the catalytic performance of CoMn catalysts for Fischer–Tropsch to olefin reactions, Acs Catal. 7 (2017) 3622-3631, doi: 10.1021/acscatal.6b03478. [43] C. Mesters A selection of recent advances in C1 chemistry Annu. Rev. Chem. Biomol. 77 2016 223 10.1146/annurev-chembioeng-080615-034616 C. Mesters, A selection of recent advances in C1 chemistry, Annu. Rev. Chem. Biomol. 77 (2016) 223, doi: 10.1146/annurev-chembioeng-080615-034616. [44] J. Timoshenko A. Kuzmin Wavelet data analysis of EXAFS spectra Comput. Phys. Commun. 180 2009 920 925 10.1016/j.cpc.2008.12.020 J. Timoshenko, A. Kuzmin, Wavelet data analysis of EXAFS spectra, Comput. Phys. Commun. 180 (2009) 920-925. doi: doi: 10.1016/j.cpc.2008.12.020. [45] B. Ravel M. Newville ATHENA, ARTEMIS, HEPHAESTUS: data analysis for X-ray absorption spectroscopy using IFEFFIT J. Synchrot. Radiat. 12 2005 537 541 10.1107/S0909049505012719 B. Ravel, M. Newville, ATHENA, ARTEMIS, HEPHAESTUS: data analysis for X-ray absorption spectroscopy using IFEFFIT, J. Synchrot. Radiat. 12 (2005) 537-541. doi: 10.1107/S0909049505012719.",
      "scopus-id": "85210032380",
      "coredata": {
        "eid": "1-s2.0-S0021951724005694",
        "dc:description": "The Co2C-based catalyst is a promising candidate for the Fischer-Tropsch to olefins reaction. However, it consistently exhibits high CO2 selectivity (∼40 %), and the origin of the high activity in the water–gas-shift reaction is not well-understood. In this study, Co2C catalysts constructed with the same elemental compositions but using the melting and co-precipitation methods resulted in drastic differences in CO2 selectivity − one at 3.8 % and the other at 35.3 %. A detailed structural study revealed that the presence of CoxMn1-xO instead of Co2C is responsible for the elevated CO2 selectivity. Interestingly, CoxMn1-xO alone demonstrates limited CO2 selectivity, but when promoted with Na, its WGSR activity is greatly enhanced. Conversely, the catalysts maintained consistently low CO2 selectivity even with improved Na content, as long as a high fraction of Co2C is present. This finding is important for designing Co2C-based catalysts that can achieve high olefin selectivity while minimizing undesirable CO2 emissions.",
        "openArchiveArticle": "false",
        "prism:coverDate": "2025-01-31",
        "openaccessUserLicense": null,
        "prism:aggregationType": "Journal",
        "prism:url": "https://api.elsevier.com/content/article/pii/S0021951724005694",
        "dc:creator": [
          {
            "@_fa": "true",
            "$": "Tang, Yibo"
          },
          {
            "@_fa": "true",
            "$": "Zhan, Sheng"
          },
          {
            "@_fa": "true",
            "$": "Liang, Jiayin"
          },
          {
            "@_fa": "true",
            "$": "Liu, Yiwen"
          },
          {
            "@_fa": "true",
            "$": "Chen, Jiabing"
          },
          {
            "@_fa": "true",
            "$": "Wang, Mengheng"
          },
          {
            "@_fa": "true",
            "$": "Liu, Xinying"
          },
          {
            "@_fa": "true",
            "$": "Hildebrandt, Diane"
          },
          {
            "@_fa": "true",
            "$": "Lu, Xiaojun"
          }
        ],
        "link": [
          {
            "@_fa": "true",
            "@rel": "self",
            "@href": "https://api.elsevier.com/content/article/pii/S0021951724005694"
          },
          {
            "@_fa": "true",
            "@rel": "scidir",
            "@href": "https://www.sciencedirect.com/science/article/pii/S0021951724005694"
          }
        ],
        "dc:format": "application/json",
        "openaccessType": null,
        "pii": "S0021-9517(24)00569-4",
        "prism:volume": "441",
        "articleNumber": "115856",
        "prism:publisher": "Elsevier Inc. All rights are reserved, including those for text and data mining, AI training, and similar technologies.",
        "dc:title": "Minimizing CoxMn1-xO content in a Co2C catalyst for low CO2 selectivity in Fischer-Tropsch synthesis to olefins",
        "prism:copyright": "© 2024 Elsevier Inc. All rights are reserved, including those for text and data mining, AI training, and similar technologies.",
        "openaccess": "0",
        "prism:issn": "00219517",
        "dcterms:subject": [
          {
            "@_fa": "true",
            "$": "Fischer-Tropsch synthesis to olefins"
          },
          {
            "@_fa": "true",
            "$": "Co2C"
          },
          {
            "@_fa": "true",
            "$": "Olefins"
          },
          {
            "@_fa": "true",
            "$": "CO2 selectivity"
          }
        ],
        "openaccessArticle": "false",
        "prism:publicationName": "Journal of Catalysis",
        "openaccessSponsorType": null,
        "prism:pageRange": "115856",
        "pubType": "fla",
        "prism:coverDisplayDate": "January 2025",
        "prism:doi": "10.1016/j.jcat.2024.115856",
        "prism:startingPage": "115856",
        "dc:identifier": "doi:10.1016/j.jcat.2024.115856",
        "openaccessSponsorName": null
      },
      "objects": {
        "object": [
          {
            "@category": "standard",
            "@height": "256",
            "@width": "649",
            "@_fa": "true",
            "$": "https://api.elsevier.com/content/object/eid/1-s2.0-S0021951724005694-gr12.jpg?httpAccept=%2A%2F%2A",
            "@multimediatype": "JPEG image file",
            "@type": "IMAGE-DOWNSAMPLED",
            "@size": "40096",
            "@ref": "gr12",
            "@mimetype": "image/jpeg"
          },
          {
            "@category": "standard",
            "@height": "194",
            "@width": "534",
            "@_fa": "true",
            "$": "https://api.elsevier.com/content/object/eid/1-s2.0-S0021951724005694-gr13.jpg?httpAccept=%2A%2F%2A",
            "@multimediatype": "JPEG image file",
            "@type": "IMAGE-DOWNSAMPLED",
            "@size": "44082",
            "@ref": "gr13",
            "@mimetype": "image/jpeg"
          },
          {
            "@category": "standard",
            "@height": "483",
            "@width": "622",
            "@_fa": "true",
            "$": "https://api.elsevier.com/content/object/eid/1-s2.0-S0021951724005694-gr10.jpg?httpAccept=%2A%2F%2A",
            "@multimediatype": "JPEG image file",
            "@type": "IMAGE-DOWNSAMPLED",
            "@size": "86410",
            "@ref": "gr10",
            "@mimetype": "image/jpeg"
          },
          {
            "@category": "standard",
            "@height": "504",
            "@width": "628",
            "@_fa": "true",
            "$": "https://api.elsevier.com/content/object/eid/1-s2.0-S0021951724005694-gr1.jpg?httpAccept=%2A%2F%2A",
            "@multimediatype": "JPEG image file",
            "@type": "IMAGE-DOWNSAMPLED",
            "@size": "87324",
            "@ref": "gr1",
            "@mimetype": "image/jpeg"
          },
          {
            "@category": "standard",
            "@height": "392",
            "@width": "671",
            "@_fa": "true",
            "$": "https://api.elsevier.com/content/object/eid/1-s2.0-S0021951724005694-gr2.jpg?httpAccept=%2A%2F%2A",
            "@multimediatype": "JPEG image file",
            "@type": "IMAGE-DOWNSAMPLED",
            "@size": "60745",
            "@ref": "gr2",
            "@mimetype": "image/jpeg"
          },
          {
            "@category": "standard",
            "@height": "184",
            "@width": "535",
            "@_fa": "true",
            "$": "https://api.elsevier.com/content/object/eid/1-s2.0-S0021951724005694-gr11.jpg?httpAccept=%2A%2F%2A",
            "@multimediatype": "JPEG image file",
            "@type": "IMAGE-DOWNSAMPLED",
            "@size": "50081",
            "@ref": "gr11",
            "@mimetype": "image/jpeg"
          },
          {
            "@category": "standard",
            "@height": "558",
            "@width": "533",
            "@_fa": "true",
            "$": "https://api.elsevier.com/content/object/eid/1-s2.0-S0021951724005694-gr3.jpg?httpAccept=%2A%2F%2A",
            "@multimediatype": "JPEG image file",
            "@type": "IMAGE-DOWNSAMPLED",
            "@size": "124191",
            "@ref": "gr3",
            "@mimetype": "image/jpeg"
          },
          {
            "@category": "standard",
            "@height": "517",
            "@width": "533",
            "@_fa": "true",
            "$": "https://api.elsevier.com/content/object/eid/1-s2.0-S0021951724005694-gr4.jpg?httpAccept=%2A%2F%2A",
            "@multimediatype": "JPEG image file",
            "@type": "IMAGE-DOWNSAMPLED",
            "@size": "109655",
            "@ref": "gr4",
            "@mimetype": "image/jpeg"
          },
          {
            "@category": "standard",
            "@height": "519",
            "@width": "533",
            "@_fa": "true",
            "$": "https://api.elsevier.com/content/object/eid/1-s2.0-S0021951724005694-gr5.jpg?httpAccept=%2A%2F%2A",
            "@multimediatype": "JPEG image file",
            "@type": "IMAGE-DOWNSAMPLED",
            "@size": "101055",
            "@ref": "gr5",
            "@mimetype": "image/jpeg"
          },
          {
            "@category": "standard",
            "@height": "218",
            "@width": "539",
            "@_fa": "true",
            "$": "https://api.elsevier.com/content/object/eid/1-s2.0-S0021951724005694-gr6.jpg?httpAccept=%2A%2F%2A",
            "@multimediatype": "JPEG image file",
            "@type": "IMAGE-DOWNSAMPLED",
            "@size": "34241",
            "@ref": "gr6",
            "@mimetype": "image/jpeg"
          },
          {
            "@category": "standard",
            "@height": "703",
            "@width": "535",
            "@_fa": "true",
            "$": "https://api.elsevier.com/content/object/eid/1-s2.0-S0021951724005694-gr7.jpg?httpAccept=%2A%2F%2A",
            "@multimediatype": "JPEG image file",
            "@type": "IMAGE-DOWNSAMPLED",
            "@size": "136871",
            "@ref": "gr7",
            "@mimetype": "image/jpeg"
          },
          {
            "@category": "standard",
            "@height": "225",
            "@width": "535",
            "@_fa": "true",
            "$": "https://api.elsevier.com/content/object/eid/1-s2.0-S0021951724005694-gr8.jpg?httpAccept=%2A%2F%2A",
            "@multimediatype": "JPEG image file",
            "@type": "IMAGE-DOWNSAMPLED",
            "@size": "28350",
            "@ref": "gr8",
            "@mimetype": "image/jpeg"
          },
          {
            "@category": "standard",
            "@height": "214",
            "@width": "535",
            "@_fa": "true",
            "$": "https://api.elsevier.com/content/object/eid/1-s2.0-S0021951724005694-gr9.jpg?httpAccept=%2A%2F%2A",
            "@multimediatype": "JPEG image file",
            "@type": "IMAGE-DOWNSAMPLED",
            "@size": "36073",
            "@ref": "gr9",
            "@mimetype": "image/jpeg"
          },
          {
            "@category": "standard",
            "@height": "245",
            "@width": "293",
            "@_fa": "true",
            "$": "https://api.elsevier.com/content/object/eid/1-s2.0-S0021951724005694-ga1.jpg?httpAccept=%2A%2F%2A",
            "@multimediatype": "JPEG image file",
            "@type": "IMAGE-DOWNSAMPLED",
            "@size": "23080",
            "@ref": "ga1",
            "@mimetype": "image/jpeg"
          },
          {
            "@category": "thumbnail",
            "@height": "86",
            "@width": "219",
            "@_fa": "true",
            "$": "https://api.elsevier.com/content/object/eid/1-s2.0-S0021951724005694-gr12.sml?httpAccept=%2A%2F%2A",
            "@multimediatype": "GIF image file",
            "@type": "IMAGE-THUMBNAIL",
            "@size": "6747",
            "@ref": "gr12",
            "@mimetype": "image/gif"
          },
          {
            "@category": "thumbnail",
            "@height": "79",
            "@width": "219",
            "@_fa": "true",
            "$": "https://api.elsevier.com/content/object/eid/1-s2.0-S0021951724005694-gr13.sml?httpAccept=%2A%2F%2A",
            "@multimediatype": "GIF image file",
            "@type": "IMAGE-THUMBNAIL",
            "@size": "8809",
            "@ref": "gr13",
            "@mimetype": "image/gif"
          },
          {
            "@category": "thumbnail",
            "@height": "164",
            "@width": "211",
            "@_fa": "true",
            "$": "https://api.elsevier.com/content/object/eid/1-s2.0-S0021951724005694-gr10.sml?httpAccept=%2A%2F%2A",
            "@multimediatype": "GIF image file",
            "@type": "IMAGE-THUMBNAIL",
            "@size": "11684",
            "@ref": "gr10",
            "@mimetype": "image/gif"
          },
          {
            "@category": "thumbnail",
            "@height": "164",
            "@width": "204",
            "@_fa": "true",
            "$": "https://api.elsevier.com/content/object/eid/1-s2.0-S0021951724005694-gr1.sml?httpAccept=%2A%2F%2A",
            "@multimediatype": "GIF image file",
            "@type": "IMAGE-THUMBNAIL",
            "@size": "11610",
            "@ref": "gr1",
            "@mimetype": "image/gif"
          },
          {
            "@category": "thumbnail",
            "@height": "128",
            "@width": "219",
            "@_fa": "true",
            "$": "https://api.elsevier.com/content/object/eid/1-s2.0-S0021951724005694-gr2.sml?httpAccept=%2A%2F%2A",
            "@multimediatype": "GIF image file",
            "@type": "IMAGE-THUMBNAIL",
            "@size": "8552",
            "@ref": "gr2",
            "@mimetype": "image/gif"
          },
          {
            "@category": "thumbnail",
            "@height": "75",
            "@width": "219",
            "@_fa": "true",
            "$": "https://api.elsevier.com/content/object/eid/1-s2.0-S0021951724005694-gr11.sml?httpAccept=%2A%2F%2A",
            "@multimediatype": "GIF image file",
            "@type": "IMAGE-THUMBNAIL",
            "@size": "10230",
            "@ref": "gr11",
            "@mimetype": "image/gif"
          },
          {
            "@category": "thumbnail",
            "@height": "163",
            "@width": "156",
            "@_fa": "true",
            "$": "https://api.elsevier.com/content/object/eid/1-s2.0-S0021951724005694-gr3.sml?httpAccept=%2A%2F%2A",
            "@multimediatype": "GIF image file",
            "@type": "IMAGE-THUMBNAIL",
            "@size": "20581",
            "@ref": "gr3",
            "@mimetype": "image/gif"
          },
          {
            "@category": "thumbnail",
            "@height": "164",
            "@width": "169",
            "@_fa": "true",
            "$": "https://api.elsevier.com/content/object/eid/1-s2.0-S0021951724005694-gr4.sml?httpAccept=%2A%2F%2A",
            "@multimediatype": "GIF image file",
            "@type": "IMAGE-THUMBNAIL",
            "@size": "21614",
            "@ref": "gr4",
            "@mimetype": "image/gif"
          },
          {
            "@category": "thumbnail",
            "@height": "164",
            "@width": "168",
            "@_fa": "true",
            "$": "https://api.elsevier.com/content/object/eid/1-s2.0-S0021951724005694-gr5.sml?httpAccept=%2A%2F%2A",
            "@multimediatype": "GIF image file",
            "@type": "IMAGE-THUMBNAIL",
            "@size": "22247",
            "@ref": "gr5",
            "@mimetype": "image/gif"
          },
          {
            "@category": "thumbnail",
            "@height": "89",
            "@width": "219",
            "@_fa": "true",
            "$": "https://api.elsevier.com/content/object/eid/1-s2.0-S0021951724005694-gr6.sml?httpAccept=%2A%2F%2A",
            "@multimediatype": "GIF image file",
            "@type": "IMAGE-THUMBNAIL",
            "@size": "6708",
            "@ref": "gr6",
            "@mimetype": "image/gif"
          },
          {
            "@category": "thumbnail",
            "@height": "163",
            "@width": "124",
            "@_fa": "true",
            "$": "https://api.elsevier.com/content/object/eid/1-s2.0-S0021951724005694-gr7.sml?httpAccept=%2A%2F%2A",
            "@multimediatype": "GIF image file",
            "@type": "IMAGE-THUMBNAIL",
            "@size": "11416",
            "@ref": "gr7",
            "@mimetype": "image/gif"
          },
          {
            "@category": "thumbnail",
            "@height": "92",
            "@width": "219",
            "@_fa": "true",
            "$": "https://api.elsevier.com/content/object/eid/1-s2.0-S0021951724005694-gr8.sml?httpAccept=%2A%2F%2A",
            "@multimediatype": "GIF image file",
            "@type": "IMAGE-THUMBNAIL",
            "@size": "5762",
            "@ref": "gr8",
            "@mimetype": "image/gif"
          },
          {
            "@category": "thumbnail",
            "@height": "87",
            "@width": "219",
            "@_fa": "true",
            "$": "https://api.elsevier.com/content/object/eid/1-s2.0-S0021951724005694-gr9.sml?httpAccept=%2A%2F%2A",
            "@multimediatype": "GIF image file",
            "@type": "IMAGE-THUMBNAIL",
            "@size": "6655",
            "@ref": "gr9",
            "@mimetype": "image/gif"
          },
          {
            "@category": "thumbnail",
            "@height": "164",
            "@width": "196",
            "@_fa": "true",
            "$": "https://api.elsevier.com/content/object/eid/1-s2.0-S0021951724005694-ga1.sml?httpAccept=%2A%2F%2A",
            "@multimediatype": "GIF image file",
            "@type": "IMAGE-THUMBNAIL",
            "@size": "19179",
            "@ref": "ga1",
            "@mimetype": "image/gif"
          },
          {
            "@category": "high",
            "@height": "680",
            "@width": "1724",
            "@_fa": "true",
            "$": "https://api.elsevier.com/content/object/eid/1-s2.0-S0021951724005694-gr12_lrg.jpg?httpAccept=%2A%2F%2A",
            "@multimediatype": "JPEG image file",
            "@type": "IMAGE-HIGH-RES",
            "@size": "124137",
            "@ref": "gr12",
            "@mimetype": "image/jpeg"
          },
          {
            "@category": "high",
            "@height": "857",
            "@width": "2365",
            "@_fa": "true",
            "$": "https://api.elsevier.com/content/object/eid/1-s2.0-S0021951724005694-gr13_lrg.jpg?httpAccept=%2A%2F%2A",
            "@multimediatype": "JPEG image file",
            "@type": "IMAGE-HIGH-RES",
            "@size": "328869",
            "@ref": "gr13",
            "@mimetype": "image/jpeg"
          },
          {
            "@category": "high",
            "@height": "1318",
            "@width": "1698",
            "@_fa": "true",
            "$": "https://api.elsevier.com/content/object/eid/1-s2.0-S0021951724005694-gr10_lrg.jpg?httpAccept=%2A%2F%2A",
            "@multimediatype": "JPEG image file",
            "@type": "IMAGE-HIGH-RES",
            "@size": "300409",
            "@ref": "gr10",
            "@mimetype": "image/jpeg"
          },
          {
            "@category": "high",
            "@height": "2231",
            "@width": "2782",
            "@_fa": "true",
            "$": "https://api.elsevier.com/content/object/eid/1-s2.0-S0021951724005694-gr1_lrg.jpg?httpAccept=%2A%2F%2A",
            "@multimediatype": "JPEG image file",
            "@type": "IMAGE-HIGH-RES",
            "@size": "608759",
            "@ref": "gr1",
            "@mimetype": "image/jpeg"
          },
          {
            "@category": "high",
            "@height": "1041",
            "@width": "1783",
            "@_fa": "true",
            "$": "https://api.elsevier.com/content/object/eid/1-s2.0-S0021951724005694-gr2_lrg.jpg?httpAccept=%2A%2F%2A",
            "@multimediatype": "JPEG image file",
            "@type": "IMAGE-HIGH-RES",
            "@size": "206117",
            "@ref": "gr2",
            "@mimetype": "image/jpeg"
          },
          {
            "@category": "high",
            "@height": "816",
            "@width": "2368",
            "@_fa": "true",
            "$": "https://api.elsevier.com/content/object/eid/1-s2.0-S0021951724005694-gr11_lrg.jpg?httpAccept=%2A%2F%2A",
            "@multimediatype": "JPEG image file",
            "@type": "IMAGE-HIGH-RES",
            "@size": "349166",
            "@ref": "gr11",
            "@mimetype": "image/jpeg"
          },
          {
            "@category": "high",
            "@height": "2474",
            "@width": "2362",
            "@_fa": "true",
            "$": "https://api.elsevier.com/content/object/eid/1-s2.0-S0021951724005694-gr3_lrg.jpg?httpAccept=%2A%2F%2A",
            "@multimediatype": "JPEG image file",
            "@type": "IMAGE-HIGH-RES",
            "@size": "898870",
            "@ref": "gr3",
            "@mimetype": "image/jpeg"
          },
          {
            "@category": "high",
            "@height": "2293",
            "@width": "2362",
            "@_fa": "true",
            "$": "https://api.elsevier.com/content/object/eid/1-s2.0-S0021951724005694-gr4_lrg.jpg?httpAccept=%2A%2F%2A",
            "@multimediatype": "JPEG image file",
            "@type": "IMAGE-HIGH-RES",
            "@size": "1294275",
            "@ref": "gr4",
            "@mimetype": "image/jpeg"
          },
          {
            "@category": "high",
            "@height": "2299",
            "@width": "2362",
            "@_fa": "true",
            "$": "https://api.elsevier.com/content/object/eid/1-s2.0-S0021951724005694-gr5_lrg.jpg?httpAccept=%2A%2F%2A",
            "@multimediatype": "JPEG image file",
            "@type": "IMAGE-HIGH-RES",
            "@size": "1164043",
            "@ref": "gr5",
            "@mimetype": "image/jpeg"
          },
          {
            "@category": "high",
            "@height": "687",
            "@width": "1699",
            "@_fa": "true",
            "$": "https://api.elsevier.com/content/object/eid/1-s2.0-S0021951724005694-gr6_lrg.jpg?httpAccept=%2A%2F%2A",
            "@multimediatype": "JPEG image file",
            "@type": "IMAGE-HIGH-RES",
            "@size": "151286",
            "@ref": "gr6",
            "@mimetype": "image/jpeg"
          },
          {
            "@category": "high",
            "@height": "3113",
            "@width": "2368",
            "@_fa": "true",
            "$": "https://api.elsevier.com/content/object/eid/1-s2.0-S0021951724005694-gr7_lrg.jpg?httpAccept=%2A%2F%2A",
            "@multimediatype": "JPEG image file",
            "@type": "IMAGE-HIGH-RES",
            "@size": "1032109",
            "@ref": "gr7",
            "@mimetype": "image/jpeg"
          },
          {
            "@category": "high",
            "@height": "994",
            "@width": "2368",
            "@_fa": "true",
            "$": "https://api.elsevier.com/content/object/eid/1-s2.0-S0021951724005694-gr8_lrg.jpg?httpAccept=%2A%2F%2A",
            "@multimediatype": "JPEG image file",
            "@type": "IMAGE-HIGH-RES",
            "@size": "206576",
            "@ref": "gr8",
            "@mimetype": "image/jpeg"
          },
          {
            "@category": "high",
            "@height": "945",
            "@width": "2368",
            "@_fa": "true",
            "$": "https://api.elsevier.com/content/object/eid/1-s2.0-S0021951724005694-gr9_lrg.jpg?httpAccept=%2A%2F%2A",
            "@multimediatype": "JPEG image file",
            "@type": "IMAGE-HIGH-RES",
            "@size": "239461",
            "@ref": "gr9",
            "@mimetype": "image/jpeg"
          },
          {
            "@category": "high",
            "@height": "651",
            "@width": "778",
            "@_fa": "true",
            "$": "https://api.elsevier.com/content/object/eid/1-s2.0-S0021951724005694-ga1_lrg.jpg?httpAccept=%2A%2F%2A",
            "@multimediatype": "JPEG image file",
            "@type": "IMAGE-HIGH-RES",
            "@size": "62814",
            "@ref": "ga1",
            "@mimetype": "image/jpeg"
          },
          {
            "@category": "standard",
            "@_fa": "true",
            "$": "https://api.elsevier.com/content/object/eid/1-s2.0-S0021951724005694-mmc1.docx?httpAccept=%2A%2F%2A",
            "@multimediatype": "Microsoft Word file",
            "@type": "APPLICATION",
            "@size": "27190190",
            "@ref": "mmc1",
            "@mimetype": "application/word"
          },
          {
            "@category": "thumbnail",
            "@_fa": "true",
            "$": "https://api.elsevier.com/content/object/eid/1-s2.0-S0021951724005694-si1.svg?httpAccept=%2A%2F%2A",
            "@multimediatype": "Scalable Vector Graphics file",
            "@type": "ALTIMG",
            "@size": "19619",
            "@ref": "si1",
            "@mimetype": "image/svg+xml"
          },
          {
            "@category": "thumbnail",
            "@_fa": "true",
            "$": "https://api.elsevier.com/content/object/eid/1-s2.0-S0021951724005694-si10.svg?httpAccept=%2A%2F%2A",
            "@multimediatype": "Scalable Vector Graphics file",
            "@type": "ALTIMG",
            "@size": "10538",
            "@ref": "si10",
            "@mimetype": "image/svg+xml"
          },
          {
            "@category": "thumbnail",
            "@_fa": "true",
            "$": "https://api.elsevier.com/content/object/eid/1-s2.0-S0021951724005694-si2.svg?httpAccept=%2A%2F%2A",
            "@multimediatype": "Scalable Vector Graphics file",
            "@type": "ALTIMG",
            "@size": "26931",
            "@ref": "si2",
            "@mimetype": "image/svg+xml"
          },
          {
            "@category": "thumbnail",
            "@_fa": "true",
            "$": "https://api.elsevier.com/content/object/eid/1-s2.0-S0021951724005694-si3.svg?httpAccept=%2A%2F%2A",
            "@multimediatype": "Scalable Vector Graphics file",
            "@type": "ALTIMG",
            "@size": "34203",
            "@ref": "si3",
            "@mimetype": "image/svg+xml"
          },
          {
            "@category": "thumbnail",
            "@_fa": "true",
            "$": "https://api.elsevier.com/content/object/eid/1-s2.0-S0021951724005694-si4.svg?httpAccept=%2A%2F%2A",
            "@multimediatype": "Scalable Vector Graphics file",
            "@type": "ALTIMG",
            "@size": "7133",
            "@ref": "si4",
            "@mimetype": "image/svg+xml"
          },
          {
            "@category": "thumbnail",
            "@_fa": "true",
            "$": "https://api.elsevier.com/content/object/eid/1-s2.0-S0021951724005694-si5.svg?httpAccept=%2A%2F%2A",
            "@multimediatype": "Scalable Vector Graphics file",
            "@type": "ALTIMG",
            "@size": "6424",
            "@ref": "si5",
            "@mimetype": "image/svg+xml"
          },
          {
            "@category": "thumbnail",
            "@_fa": "true",
            "$": "https://api.elsevier.com/content/object/eid/1-s2.0-S0021951724005694-si6.svg?httpAccept=%2A%2F%2A",
            "@multimediatype": "Scalable Vector Graphics file",
            "@type": "ALTIMG",
            "@size": "7136",
            "@ref": "si6",
            "@mimetype": "image/svg+xml"
          },
          {
            "@category": "thumbnail",
            "@_fa": "true",
            "$": "https://api.elsevier.com/content/object/eid/1-s2.0-S0021951724005694-si7.svg?httpAccept=%2A%2F%2A",
            "@multimediatype": "Scalable Vector Graphics file",
            "@type": "ALTIMG",
            "@size": "6425",
            "@ref": "si7",
            "@mimetype": "image/svg+xml"
          },
          {
            "@category": "thumbnail",
            "@_fa": "true",
            "$": "https://api.elsevier.com/content/object/eid/1-s2.0-S0021951724005694-si8.svg?httpAccept=%2A%2F%2A",
            "@multimediatype": "Scalable Vector Graphics file",
            "@type": "ALTIMG",
            "@size": "14509",
            "@ref": "si8",
            "@mimetype": "image/svg+xml"
          },
          {
            "@category": "thumbnail",
            "@_fa": "true",
            "$": "https://api.elsevier.com/content/object/eid/1-s2.0-S0021951724005694-si9.svg?httpAccept=%2A%2F%2A",
            "@multimediatype": "Scalable Vector Graphics file",
            "@type": "ALTIMG",
            "@size": "10233",
            "@ref": "si9",
            "@mimetype": "image/svg+xml"
          }
        ]
      },
      "link": {
        "@rel": "abstract",
        "@href": "https://api.elsevier.com/content/abstract/scopus_id/85210032380"
      }
    }
  }
}