{
  "metadata": {
    "title": "Bimodal mesoporous AlMCM-41 supported NiMo catalysts for efficient hydrodesulfurization of 4,6-dimethyldibenzothiophene",
    "authors": "; ; ",
    "journal": "Journal of Catalysis",
    "date": "2024-12-31",
    "doi": "10.1016/j.jcat.2024.115799",
    "abstract": "",
    "uri": "https://api.elsevier.com/content/article/pii/S0021951724005128",
    "pii": "S0021951724005128"
  },
  "fulltext": {
    "full-text-retrieval-response": {
      "scopus-eid": "2-s2.0-85206891482",
      "originalText": "serial JL 272561 291210 291744 291809 31 Journal of Catalysis JOURNALCATALYSIS 2024-10-19 2024-10-19 2024-10-22 2024-10-22 2025-03-08T20:43:05 1-s2.0-S0021951724005128 S0021-9517(24)00512-8 S0021951724005128 10.1016/j.jcat.2024.115799 S300 S300.1 FULL-TEXT 1-s2.0-S0021951724X00123 2025-03-08T23:16:19.930864Z 0 0 20241201 20241231 2024 2024-10-19T10:51:28.581058Z absattachment articleinfo articlenumber articletitlenorm authfirstinitialnorm authfirstsurnamenorm cid cids contenttype copyright crossmark dateloaded dateloadedtxt datesearch datesort dateupdated dco docsubtype doctype doi eid ewtransactionid hubeid indexeddate issn issnnorm itemstage itemtransactionid itemweight openaccess openarchive pg pgfirst pii piinorm pubdateend pubdatestart pubdatetxt pubyr sectiontitle sortorder srctitle srctitlenorm srctype ssids alllist content subj subheadings suppl tomb volfirst volissue volumelist webpdf webpdfpagecount yearnav figure table e-component body mmlmath affil appendices articletitle auth authfirstini authfull authkeywords authlast highlightsabst primabst pubtype ref specialabst 0021-9517 00219517 true 440 440 C Volume 440 10 115799 115799 115799 202412 December 2024 2024-12-01 2024-12-31 2024 Regular Articles article fla © 2024 Elsevier Inc. All rights are reserved, including those for text and data mining, AI training, and similar technologies. BIMODALMESOPOROUSALMCM41SUPPORTEDNIMOCATALYSTSFOREFFICIENTHYDRODESULFURIZATION46DIMETHYLDIBENZOTHIOPHENE ZHANG H 1 Introduction 2 Experimental 2.1 Catalyst preparation 2.1.1 Materials 2.1.2 Preparation of supports 2.1.3 Preparation of catalysts 2.2 Characterization 2.3 HDS evaluation 3 Results and discussion 3.1 Properties of supports 3.2 Properties of catalysts 3.2.1 Oxidized catalysts 3.2.2 Sulfurized catalysts 3.3 Catalytic behavior 4 Conclusion CRediT authorship contribution statement Appendix A Supplementary data References WANG 2022 324 333 X RODRIGUEZCASTILLO 2024 114616 L SUN 2023 147514 H BAO 2024 154 170 W ZHANG 2023 145459 C ZHANG 2022 112296 H ARORA 2024 115501 S KAZAKOVA 2023 122475 M GAO 2015 269 284 D CAO 2020 125886 Z QI 2022 279 293 L MASOUMI 2023 104134 F MENDEZ 2020 118550 F ZEPEDA 2021 106599 T CAO 2014 19738 19749 Z YU 2024 654 666 K JIAO 2017 269 282 J VALENCIA 2013 137 145 D WU 2014 303 317 H YU 2017 76 87 Q PALOS 2018 142 152 R YANG 2019 68 72 L JARONIEC 1997 6267 6273 M WANG 2016 680 691 X XIAO 2021 154 161 C LI 2010 35 39 M LIU 2020 170 185 C WANG 2022 124516 B ELDEEB 2022 84 93 Z MENDEZ 2017 479 491 F LOCUS 2016 7731 7743 R NIKULSHIN 2014 152 169 P BISWAS 2011 7882 7895 P WANG 2017 52 61 X WU 2014 203 210 H KLIMOVA 2013 29 46 T ZOU 2023 115092 Y ZHANG 2024 120234 C ZHOU 2020 118428 W HAN 2017 58 66 W ZHANG 2021 110637 D ZHANG 2023 112716 P BESENBACHER 2008 86 96 F HU 2020 116701 D MEI 2022 375 386 J ZHANG 2010 273 286 D WANG 2021 111131 Y LIU 2014 16 22 Y XIAO 2023 2521 2530 C ZHANG 2018 130 142 L DING 2019 429 441 S KOBAYASHI 2017 74 83 K YU 2022 128 143 K RAMIREZ 2020 168 177 J WANG 2014 166 175 Y NA 2014 17207 17212 K LAURITSEN 2015 49 58 J ZHOU 2022 121971 W ZHANGX2024X115799 ZHANGX2024X115799XH 2026-10-22T00:00:00.000Z 2026-10-22T00:00:00.000Z http://creativecommons.org/licenses/by-nc-nd/4.0/ © 2024 Elsevier Inc. All rights are reserved, including those for text and data mining, AI training, and similar technologies. https://doi.org/10.15223/policy-017 https://doi.org/10.15223/policy-037 https://doi.org/10.15223/policy-012 https://doi.org/10.15223/policy-029 https://doi.org/10.15223/policy-004 item S0021-9517(24)00512-8 S0021951724005128 1-s2.0-S0021951724005128 10.1016/j.jcat.2024.115799 272561 2025-03-08T23:16:19.930864Z 2024-12-01 2024-12-31 1-s2.0-S0021951724005128-main.pdf https://s3-eu-west-1.amazonaws.com/prod-ucs-content-store-eu-west/content/pii:S0021951724005128/MAIN/application/pdf/1ce316ac0b323998c19aabff1df8d473/main.pdf main.pdf pdf true 11936642 MAIN 11 1-s2.0-S0021951724005128-main_1.png https://s3-eu-west-1.amazonaws.com/prod-ucs-content-store-eu-west/content/pii:S0021951724005128/PREVIEW/image/png/c49a096dff113997513b5af4f24258dd/main_1.png main_1.png png 61650 849 656 IMAGE-WEB-PDF 1 1-s2.0-S0021951724005128-gr7.jpg https://s3-eu-west-1.amazonaws.com/prod-ucs-content-store-eu-west/content/pii:S0021951724005128/gr7/DOWNSAMPLED/image/jpeg/ccf762de205414af8fa1b2b3dd479178/gr7.jpg gr7 gr7.jpg jpg 46820 211 761 IMAGE-DOWNSAMPLED 1-s2.0-S0021951724005128-gr8.jpg https://s3-eu-west-1.amazonaws.com/prod-ucs-content-store-eu-west/content/pii:S0021951724005128/gr8/DOWNSAMPLED/image/jpeg/415476179a50ff63fe81bb7f90675e0d/gr8.jpg gr8 gr8.jpg jpg 28839 295 383 IMAGE-DOWNSAMPLED 1-s2.0-S0021951724005128-gr5.jpg https://s3-eu-west-1.amazonaws.com/prod-ucs-content-store-eu-west/content/pii:S0021951724005128/gr5/DOWNSAMPLED/image/jpeg/5ab6510c51b1b63a77001e7737f8762c/gr5.jpg gr5 gr5.jpg jpg 46754 219 689 IMAGE-DOWNSAMPLED 1-s2.0-S0021951724005128-gr6.jpg https://s3-eu-west-1.amazonaws.com/prod-ucs-content-store-eu-west/content/pii:S0021951724005128/gr6/DOWNSAMPLED/image/jpeg/2297aa12954d93df35d753b614b4fb92/gr6.jpg gr6 gr6.jpg jpg 111723 565 645 IMAGE-DOWNSAMPLED 1-s2.0-S0021951724005128-gr9.jpg https://s3-eu-west-1.amazonaws.com/prod-ucs-content-store-eu-west/content/pii:S0021951724005128/gr9/DOWNSAMPLED/image/jpeg/b7d342e1f390311829b63030fa15a3b7/gr9.jpg gr9 gr9.jpg jpg 56160 201 645 IMAGE-DOWNSAMPLED 1-s2.0-S0021951724005128-gr3.jpg https://s3-eu-west-1.amazonaws.com/prod-ucs-content-store-eu-west/content/pii:S0021951724005128/gr3/DOWNSAMPLED/image/jpeg/432c2d411e2817600033b59394365b47/gr3.jpg gr3 gr3.jpg jpg 45942 276 659 IMAGE-DOWNSAMPLED 1-s2.0-S0021951724005128-gr4.jpg https://s3-eu-west-1.amazonaws.com/prod-ucs-content-store-eu-west/content/pii:S0021951724005128/gr4/DOWNSAMPLED/image/jpeg/094c8d57723a1083f4f84685c403b602/gr4.jpg gr4 gr4.jpg jpg 49166 225 689 IMAGE-DOWNSAMPLED 1-s2.0-S0021951724005128-gr1.jpg https://s3-eu-west-1.amazonaws.com/prod-ucs-content-store-eu-west/content/pii:S0021951724005128/gr1/DOWNSAMPLED/image/jpeg/2563939d4feadf1246f498b7e9970d8c/gr1.jpg gr1 gr1.jpg jpg 47297 226 791 IMAGE-DOWNSAMPLED 1-s2.0-S0021951724005128-gr2.jpg https://s3-eu-west-1.amazonaws.com/prod-ucs-content-store-eu-west/content/pii:S0021951724005128/gr2/DOWNSAMPLED/image/jpeg/018ae4f3983f8d5d8c8b8d6bcff9f56b/gr2.jpg gr2 gr2.jpg jpg 156119 374 736 IMAGE-DOWNSAMPLED 1-s2.0-S0021951724005128-gr10.jpg https://s3-eu-west-1.amazonaws.com/prod-ucs-content-store-eu-west/content/pii:S0021951724005128/gr10/DOWNSAMPLED/image/jpeg/7113aa5283a5c789800d79c728a203d8/gr10.jpg gr10 gr10.jpg jpg 62555 368 535 IMAGE-DOWNSAMPLED 1-s2.0-S0021951724005128-ga1.jpg https://s3-eu-west-1.amazonaws.com/prod-ucs-content-store-eu-west/content/pii:S0021951724005128/ga1/DOWNSAMPLED/image/jpeg/a97a91d839109a5d21fb0279e2abf9c3/ga1.jpg ga1 true ga1.jpg jpg 34792 155 500 IMAGE-DOWNSAMPLED 1-s2.0-S0021951724005128-gr7.sml https://s3-eu-west-1.amazonaws.com/prod-ucs-content-store-eu-west/content/pii:S0021951724005128/gr7/THUMBNAIL/image/gif/9cad4d6607618c1f8036dcf440376c14/gr7.sml gr7 gr7.sml sml 5584 61 219 IMAGE-THUMBNAIL 1-s2.0-S0021951724005128-gr8.sml https://s3-eu-west-1.amazonaws.com/prod-ucs-content-store-eu-west/content/pii:S0021951724005128/gr8/THUMBNAIL/image/gif/8bd503b30538d453a84d6932bc57d459/gr8.sml gr8 gr8.sml sml 8791 164 213 IMAGE-THUMBNAIL 1-s2.0-S0021951724005128-gr5.sml https://s3-eu-west-1.amazonaws.com/prod-ucs-content-store-eu-west/content/pii:S0021951724005128/gr5/THUMBNAIL/image/gif/c92265a188b795a4254acf8e02861c28/gr5.sml gr5 gr5.sml sml 7652 70 219 IMAGE-THUMBNAIL 1-s2.0-S0021951724005128-gr6.sml https://s3-eu-west-1.amazonaws.com/prod-ucs-content-store-eu-west/content/pii:S0021951724005128/gr6/THUMBNAIL/image/gif/7e95428292efba5af2ddf2d593053f5c/gr6.sml gr6 gr6.sml sml 13086 164 187 IMAGE-THUMBNAIL 1-s2.0-S0021951724005128-gr9.sml https://s3-eu-west-1.amazonaws.com/prod-ucs-content-store-eu-west/content/pii:S0021951724005128/gr9/THUMBNAIL/image/gif/0c24efcca98e78bf19a18d94fe8bd6fb/gr9.sml gr9 gr9.sml sml 10332 68 219 IMAGE-THUMBNAIL 1-s2.0-S0021951724005128-gr3.sml https://s3-eu-west-1.amazonaws.com/prod-ucs-content-store-eu-west/content/pii:S0021951724005128/gr3/THUMBNAIL/image/gif/bc40888409e2694fbae77015262a7f58/gr3.sml gr3 gr3.sml sml 7794 92 219 IMAGE-THUMBNAIL 1-s2.0-S0021951724005128-gr4.sml https://s3-eu-west-1.amazonaws.com/prod-ucs-content-store-eu-west/content/pii:S0021951724005128/gr4/THUMBNAIL/image/gif/e1e0f9207d2cc37a4849aefac510bf80/gr4.sml gr4 gr4.sml sml 7627 72 219 IMAGE-THUMBNAIL 1-s2.0-S0021951724005128-gr1.sml https://s3-eu-west-1.amazonaws.com/prod-ucs-content-store-eu-west/content/pii:S0021951724005128/gr1/THUMBNAIL/image/gif/df1c8f769fd4dee66e7831fdf3ad95fb/gr1.sml gr1 gr1.sml sml 5659 63 219 IMAGE-THUMBNAIL 1-s2.0-S0021951724005128-gr2.sml https://s3-eu-west-1.amazonaws.com/prod-ucs-content-store-eu-west/content/pii:S2214581824004439/gr2/THUMBNAIL/image/gif/e91b35fdb517539c9b83117f33f0a585/gr2.sml gr2 gr2.sml sml 18103 111 219 IMAGE-THUMBNAIL 1-s2.0-S0021951724005128-gr10.sml https://s3-eu-west-1.amazonaws.com/prod-ucs-content-store-eu-west/content/pii:S2214581824004439/gr10/THUMBNAIL/image/gif/e5ef5f287670692a4b3e8c58c2d9d74d/gr10.sml gr10 gr10.sml sml 13791 151 219 IMAGE-THUMBNAIL 1-s2.0-S0021951724005128-ga1.sml https://s3-eu-west-1.amazonaws.com/prod-ucs-content-store-eu-west/content/pii:S2214581824004439/ga1/THUMBNAIL/image/gif/bc60059f94e8dd0405bcb7908df1c676/ga1.sml ga1 true ga1.sml sml 10800 68 219 IMAGE-THUMBNAIL 1-s2.0-S0021951724005128-gr7_lrg.jpg https://s3-eu-west-1.amazonaws.com/prod-ucs-content-store-eu-west/content/pii:S0021951724005128/HIGHRES/image/jpeg/f62060e07bce0f9dba69bd0ab1ab3237/gr7_lrg.jpg gr7 gr7_lrg.jpg jpg 298970 933 3370 IMAGE-HIGH-RES 1-s2.0-S0021951724005128-gr8_lrg.jpg https://s3-eu-west-1.amazonaws.com/prod-ucs-content-store-eu-west/content/pii:S0021951724005128/HIGHRES/image/jpeg/6c743558c04c9b35f19c444e5123f3fe/gr8_lrg.jpg gr8 gr8_lrg.jpg jpg 213381 1309 1699 IMAGE-HIGH-RES 1-s2.0-S0021951724005128-gr5_lrg.jpg https://s3-eu-west-1.amazonaws.com/prod-ucs-content-store-eu-west/content/pii:S0021951724005128/HIGHRES/image/jpeg/40b383aa911ad58ad2fc65f8a7a50578/gr5_lrg.jpg gr5 gr5_lrg.jpg jpg 333397 971 3051 IMAGE-HIGH-RES 1-s2.0-S0021951724005128-gr6_lrg.jpg https://s3-eu-west-1.amazonaws.com/prod-ucs-content-store-eu-west/content/pii:S0021951724005128/HIGHRES/image/jpeg/f1928a71759a94ce14ac2b8b82db89a5/gr6_lrg.jpg gr6 gr6_lrg.jpg jpg 1399786 2502 2854 IMAGE-HIGH-RES 1-s2.0-S0021951724005128-gr9_lrg.jpg https://s3-eu-west-1.amazonaws.com/prod-ucs-content-store-eu-west/content/pii:S0021951724005128/HIGHRES/image/jpeg/6ba945972667e223b9fcb10be060e1a6/gr9_lrg.jpg gr9 gr9_lrg.jpg jpg 491951 890 2854 IMAGE-HIGH-RES 1-s2.0-S0021951724005128-gr3_lrg.jpg https://s3-eu-west-1.amazonaws.com/prod-ucs-content-store-eu-west/content/pii:S0021951724005128/HIGHRES/image/jpeg/b9f53e42aea24d173d1de57f54abf279/gr3_lrg.jpg gr3 gr3_lrg.jpg jpg 429815 1224 2919 IMAGE-HIGH-RES 1-s2.0-S0021951724005128-gr4_lrg.jpg https://s3-eu-west-1.amazonaws.com/prod-ucs-content-store-eu-west/content/pii:S0021951724005128/HIGHRES/image/jpeg/d5f1107b229b6189c06131267df731cc/gr4_lrg.jpg gr4 gr4_lrg.jpg jpg 347880 997 3051 IMAGE-HIGH-RES 1-s2.0-S0021951724005128-gr1_lrg.jpg https://s3-eu-west-1.amazonaws.com/prod-ucs-content-store-eu-west/content/pii:S0021951724005128/HIGHRES/image/jpeg/5d88fc5bc3a33681d33fb053522eeaca/gr1_lrg.jpg gr1 gr1_lrg.jpg jpg 328657 1000 3504 IMAGE-HIGH-RES 1-s2.0-S0021951724005128-gr2_lrg.jpg https://s3-eu-west-1.amazonaws.com/prod-ucs-content-store-eu-west/content/pii:S2214581824004439/HIGHRES/image/jpeg/ca1aa94d021f70b19e67ae5c8d33ce32/gr2_lrg.jpg gr2 gr2_lrg.jpg jpg 981060 1063 2093 IMAGE-HIGH-RES 1-s2.0-S0021951724005128-gr10_lrg.jpg https://s3-eu-west-1.amazonaws.com/prod-ucs-content-store-eu-west/content/pii:S2214581824004439/HIGHRES/image/jpeg/eae0a32a84b820d0bcc18f6a53819f40/gr10_lrg.jpg gr10 gr10_lrg.jpg jpg 640113 1631 2368 IMAGE-HIGH-RES 1-s2.0-S0021951724005128-ga1_lrg.jpg https://s3-eu-west-1.amazonaws.com/prod-ucs-content-store-eu-west/content/pii:S2214581824004439/HIGHRES/image/jpeg/aeef1f16ec9d2ba9ccf25ded41aeaa34/ga1_lrg.jpg ga1 true ga1_lrg.jpg jpg 365386 686 2213 IMAGE-HIGH-RES 1-s2.0-S0021951724005128-mmc1.docx https://s3-eu-west-1.amazonaws.com/prod-ucs-content-store-eu-west/content/pii:S0021951724005128/mmc1/MAIN/application/vnd.openxmlformats-officedocument.wordprocessingml.document/3ca3fdf89a12b7cc419f38a65e23ea93/mmc1.docx mmc1 mmc1.docx docx 784670 APPLICATION 1-s2.0-S0021951724005128-si1.svg https://s3-eu-west-1.amazonaws.com/prod-ucs-content-store-eu-west/content/pii:S0021951724005128/image/svg+xml/014e14ae24f375d8af84dd23e7d211e5/si1.svg si1 si1.svg svg 17604 ALTIMG 1-s2.0-S0021951724005128-si2.svg https://s3-eu-west-1.amazonaws.com/prod-ucs-content-store-eu-west/content/pii:S0021951724005128/image/svg+xml/fd5db50a6cc7cdfc206a030e8ed535be/si2.svg si2 si2.svg svg 28468 ALTIMG 1-s2.0-S0021951724005128-si3.svg https://s3-eu-west-1.amazonaws.com/prod-ucs-content-store-eu-west/content/pii:S0021951724005128/image/svg+xml/ab99396ded803a4b32571c2f0ff4ec02/si3.svg si3 si3.svg svg 13112 ALTIMG 1-s2.0-S0021951724005128-si4.svg https://s3-eu-west-1.amazonaws.com/prod-ucs-content-store-eu-west/content/pii:S0021951724005128/image/svg+xml/32ef74293a91b91647127f8455725257/si4.svg si4 si4.svg svg 12337 ALTIMG 1-s2.0-S0021951724005128-si5.svg https://s3-eu-west-1.amazonaws.com/prod-ucs-content-store-eu-west/content/pii:S0021951724005128/image/svg+xml/9fb993b84053e89ee4322d84a72318b4/si5.svg si5 si5.svg svg 12979 ALTIMG 1-s2.0-S0021951724005128-si6.svg https://s3-eu-west-1.amazonaws.com/prod-ucs-content-store-eu-west/content/pii:S0021951724005128/image/svg+xml/a31f76687cf246315b6bb0faaefde639/si6.svg si6 si6.svg svg 11222 ALTIMG 1-s2.0-S0021951724005128-si7.svg https://s3-eu-west-1.amazonaws.com/prod-ucs-content-store-eu-west/content/pii:S0021951724005128/image/svg+xml/9f26190976482870eb8e63aab0b61887/si7.svg si7 si7.svg svg 12636 ALTIMG 1-s2.0-S0021951724005128-am.pdf https://s3-eu-west-1.amazonaws.com/prod-ucs-content-store-eu-west/content/egi:100DRX0VNM9/MAIN/application/pdf/15785cba9a632c03853609c65b178719/am.pdf am am.pdf pdf false 4158849 AAM-PDF YJCAT 115799 115799 S0021-9517(24)00512-8 10.1016/j.jcat.2024.115799 Elsevier Inc. Fig. 1 (a) XRD patterns, (b) N2 adsorption–desorption isotherm, and (c) pore size distribution of the synthesized supports. Fig. 2 TEM images of the as-synthesized (a) S-AM41, (b) B-AM41, and (c) L-AM41. Fig. 3 (a) Raman spectra and (b) H2-TPR profiles of the as-synthesized oxide catalysts. Fig. 4 XPS profiles of Mo 3d for the sulfided catalysts: (a) NiMo/S-AM41, (b) NiMo/B-AM41, and (c) NiMo/L-AM41. Fig. 5 XPS profiles of Ni 2p for the sulfided catalysts: (a) NiMo/S-AM41, (b) NiMo/B-AM41, and (c) NiMo/L-AM41. Fig. 6 (a)-(c) HRTEM images, (d)-(f) stacking number, and (g) length distribution of MoS2 slabs of the synthesized catalysts. Fig. 7 (a) 4,6-DMDBT conversions over the catalysts at different temperatures, (b) lnR HDS vs 1/T curves plotted by the Arrhenius formula, and (c) 4,6-DMDBT conversions over the catalysts at different WHSVs. Fig. 8 3D dependences of TOF values in 4,6-DMDBT HDS on average length and average stacking number of MoS2 slabs in the catalysts. Fig. 9 Schematic visualization of the relationship between morphological variations in MoS2 slabs and catalytic activities. Scheme 1 Synthesis mechanism diagram of B-AM41 support. Table 1 Textural properties of prepared supports. Samples SBET (m2 g−1) VTotal (cm3 g−1) V3.2 (cm3 g−1) a V5.1 (cm3 g−1) b Pore size (nm) d 100 (nm) c a0 (nm) d Si/Al e S-AM41 905 0.97 0.97 0 3.1 4.09 4.72 15.8 B-AM41 944 1.02 0.88 0.14 3.2, 5.1 4.18 4.83 16.1 L-AM41 858 0.87 0.87 0 5.6 4.36 5.03 15.4 a The pore volume at pore size of 3.2 nm (V3.2) obtained within 0 < p/p0 < 0.4 [32]. b The pore volume at pore size of 5.1 nm (V5.1), subtraction of VTotal and V3.2. c Interplanar spacing. d lattice parameter (a0 = 2d100/√3). e Obtained by EDX spectroscopy. Table 2 H2 consumption of different catalysts at different temperature areas. Catalysts LTA (mmol/g) HTA (mmol/g) Total (mmol/g) NiMo/S-AM41 0.71 0.96 1.7 NiMo/B-AM41 0.80 0.98 1.8 NiMo/L-AM41 0.77 0.88 1.7 Table 3 XPS parameters of Mo 3d and Ni 2p of the different catalysts. Catalysts Mo distribution (ar.%) a Ni distribution (ar.%) a Mo4+ Mo5+ Mo6+ NiMoS NiSx Ni2+ NiMo/S-AM41 61 17 22 48 6 46 NiMo/B-AM41 76 8 16 65 8 25 NiMo/L-AM41 66 16 18 55 5 41 a Area percentage of the peak. Table 4 HRTEM characterization results of MoS2 slabs on the catalysts. Catalysts L av (nm) N av f e/c f Mo NiMo/S-AM41 4.8 4.2 6.0 0.25 NiMo/B-AM41 3.9 3.1 4.6 0.33 NiMo/L-AM41 3.4 3.5 3.8 0.31 Table 5 Amounts (mmol/g) and distribution of the acid sites of the catalysts. Supports 200 ℃ 350 ℃ L B L + B B/L L B L + B B/L NiMo/S-AM41 0.12 0.049 0.17 0.40 0.048 0.016 0.064 0.33 NiMo/B-AM41 0.11 0.052 0.16 0.48 0.043 0.018 0.061 0.42 NiMo/L-AM41 0.11 0.035 0.15 0.31 0.039 0.011 0.050 0.28 Table 6 Kinetic parameters of 4,6-DMDBT HDS over different catalysts. Catalysts k HDS (×10−8 mol g−1 s−1) a TOF (×10−4 s−1) b E a (kJ/mol) a NiMo/S-AM41 4.6 4.2 106 NiMo/B-AM41 10.4 7.0 87 NiMo/L-AM41 7.2 5.7 92 a Obtained at a conversion of less than 30% for 4,6-DMDBT. b Calculated at 25 ± 1.5 % 4,6-DMDBT conversion by changing the WHSVs. Table 7 Comparison of 4,6-DMDBT HDS activity over NiMo/B-AM41 with the state-of-the-art catalysts in the literature. Catalysts Feeding rate(h−1or mL h−1) Pressure (MPa) Temperature(℃) Conversion(%) TOF (×10−4 s−1) Ref. NiMo/TD-70 WHSV = 10 4.0 340 93.7 6.7 [50] CoMoS2/NTS-1 WHSV = 14.2 5.0 300 ∼99 2.0 [51] NiMo/NbAl2O3 WHSV = 5.0 4.0 350 87.9 5.0 [52] NiW/HZrYA WHSV = 5.0 4.0 280 ∼80 6.9 [3] NiMo/Al2O3P-5 Rate 10 mL h−1 2.0 240 − 1.7 [53] NiMo/ZK-W LHSV = 10 4.0 320 ∼95 6.9 [19] NiMo/Al-Y30S13 LHSV = 6.0 4.0 340 92.7 6.1 [54] NiMoKC2 − 4.0 320 − 3.9 [36] NiMo/B-AM41 WHSV = 4.0 4.0 350 99.2 7.0 This work Table 8 HDS product distributions of 4,6-DMDBT over different catalysts. Catalysts Product distribution (%) a 3,3′-DMBP 4,4′-DMBP S-product b DMBCH DMCHB C7 c iso-MIPT Total DDS d NiMo/S-AM41 14 20 6 16 11 20 14 34 NiMo/B-AM41 16 26 5 13 11 12 17 42 NiMo/L-AM41 23 33 4 11 9 14 6 56 a Product selectivity at the isoconversion of 4,6-DMDBT (50 ± 2 %). b S-product = DMTHDBT + DMHHDBT. c C7 = Toluene + Methylcyclohexane. d Total DDS = 3,3′-DMBP + 4,4′-DMBP. Research article Bimodal mesoporous AlMCM-41 supported NiMo catalysts for efficient hydrodesulfurization of 4,6-dimethyldibenzothiophene Hao Zhang Writing – original draft Validation Investigation Qing Zhang Investigation Guang-Ren Qian Supervision Conceptualization ⁎ Hong Liu Writing – review & editing Supervision ⁎ Yang Yue Validation Investigation School of Environmental and Chemical Engineering, Shanghai University, 99 Shangda Road, Shanghai 200444, PR China School of Environmental and Chemical Engineering Shanghai University 99 Shangda Road Shanghai 200444 PR China School of Environmental and Chemical Engineering, Shanghai University, 99 Shangda Road, Shanghai 200444, PR China ⁎ Corresponding authors. Graphical abstract In this research, a bimodal mesoporous AlMCM-41 (B-AM41) material was prepared and applied to support NiMo catalysts for the hydrodesulfurization (HDS) of 4,6-dimethyldibenzothiophene. Additionally, catalysts supported on smaller and larger single-pore AlMCM-41 (S-AM41 and L-AM41) were also prepared as reference catalysts. Detailed characterizations show that the proportion, stacking degree, and length of the MoS2 active phase on the different catalysts are distinct. As a result, HDS evaluation indicates that the NiMo/B-AM41 catalyst exhibited better catalytic activity with a reaction rate constant of 10.4 × 10−8 mol g−1 s−1 and a turnover frequency of 7.0 × 10−4 s−1, significantly surpassing the S-AM41 and L-AM41 supported catalysts. The superior activity of the NiMo/B-AM41 catalyst can be attributed to a high sulfidation degree that provides sufficient highly dispersed type Ⅱ MoS2 phases with minimal stacking and moderate slab length. Moreover, the bimodal mesoporous structure promotes the diffusion of 4,6-DMDBT and benefits its contact with active sites. Keywords Bimodal mesoporous AlMCM-41 NiMo catalysts Hydrodesulfurization Dispersed MoS2 phase Data availability Data will be made available on request. 1 Introduction Hydrodesulfurization (HDS) is a critical process in the petroleum industry for removing sulfur compounds from fuels to meet environmental regulations and improve fuel quality [1,2]. Among various sulfur compounds, 4,6-dimethylbiphenylthiophene (4,6-DMDBT) is particularly difficult to remove due to its high thermal stability and resistance to traditional HDS catalysts, posing challenges to deep desulfurization [3,4]. Alumina-supported Ni(Co)Mo(W)S2 active phase is a long-standing traditional HDS catalyst. However, the strong binding between the active metal and the alumina support leads to strong metal-support interaction [5,6], which hinders the high sulfidation of the active metal and the formation of highly dispersed Type-II NiMoS with high activity. With the decline in feedstock quality, traditional catalysts are unable to meet the production of clean fuels under conventional operations [7,8]. Therefore, the development of efficient HDS catalysts is of great significance for industrial deep desulfurization activities. In the past few decades, significant efforts have been devoted to develop molecular sieve materials with high surface area and appropriate mesoporous structures to promote the distribution of the loaded active phases and enhance mass transfer, thereby improving HDS performance. The materials involved primarily include molecular sieves such as SBA-15 [9], SBA-16 [10], ZSM-5 [11], TS-1 [12], MCM-41 [13], and HMS [14], etc. Among them, MCM-41 has emerged as a focal point of research due to its excellent thermal stability and two-dimensional mesoporous structure. However, pure silica MCM-41 exhibits low acidity and poor dispersion of active metals, which is not conducive to HDS reactions. Some studies have shown that doping heteroatoms such as Al, Ti, Zr, etc. into the MCM-41 framework contributes to improving the HDS performance of the corresponding catalysts. Typically, aluminum (Al) is considered a superior doping material, as Al-doped MCM-41 can simultaneously increase Lewis and Brønsted acid sites. It has been found that Lewis acids allow hydrogenation reactions, while Brønsted acids facilitate direct desulfurization pathways and isomerization reactions in HDS reactions [15–17]. In addition, the acidity of the support can alter the electronic properties of the loaded phase, thereby enhancing its catalytic activity. Therefore, the acidity of the catalyst has a significant impact on the catalytic activity and reaction selectivity. In recent years, the adjustment of pore structure has garnered significant attention due to its potential to enhance the performance of catalysts. Valencia and co-authors [18] synthesized NiMo catalysts supported on SBA-15 with different pore sizes for the HDS of dibenzothiophene, and found that catalytic activity increased with the increase of pore size within a certain range. Recently, to further enhance catalyst activity, bimodal porous materials have attracted great attention. For example, Wu et al. [19] developed a micro-mesoporous structure of ZSM-5/KIT-6, exhibiting an excellent dibenzothiophene conversion rate due to the reduction of diffusion distance. However, the addition of micro-pores not only prevents large sulfur-containing molecules from approaching the active sites in the pore center but also hinders the interior diffusion of reactants/products in the catalyst. To overcome these limitations, bimodal mesoporous (or mesoporous-macroporous) materials have been developed and have been demonstrated to contribute to the improvement of HDS performance. For example, Zhang et al. [20] prepared bimodal mesoporous ZSM-5/Al2O3 material, which demonstrated exemplary catalytic performance in the HDS of 4,6-DMDBT after loading CoMo. Besides, Palos and co-workers [21] successfully synthesized NiMoP catalysts supported on HY/Al2O3 with meso-macroporous structures, which exhibited excellent catalytic activity and stability. The above-mentioned bimodal mesoporous materials need to involve another material. Recent research has indicated that the construction of bimodal pore structures within a single material is more favorable for enhancing catalytic performance. Forinstance, Yang et al. [22] prepared a meso-macroporous Ni-Mo/Al2O3 catalyst that exhibited high catalytic activity for dibenzothiophene. They believed that the integration of this bimodal pore structure within Al2O3 further enhanced the accessibility of active sites and mass transfer performance, thereby improving the catalytic performance in HDS reactions. Based on the above, the bimodal mesoporous structure has great potential for HDS performance, which inspires us to construct the bimodal mesoporous structure in the mesoporous AlMCM-41. However, this has rarely been reported in previous reports. Herein, a two-step method was used to synthesize the bimodal mesoporous AlMCM-41 material (B-AM41), which was employed as a support for the synthesis of NiMo catalysts. Moreover, smaller and larger mono-mesoporous AlMCM-41 (S-AM41 and L-AM41) were also synthesized as reference materials. Characterization indicates the proportion and microstructure of the active phases varied over different catalysts. Consequently, the catalytic activity evaluation revealed that NiMo/B-AM41 exhibited better catalytic activity than the S-AM41 and L-AM41 supported catalysts, achieving a conversion rate of 99.2 % for 4,6-DMDBT. The excellent HDS performance of NiMo/B-AM41 is related to the high proportion and high dispersion (minimum stacking and moderate slab length) of the type II MoS2 phase, as well as the good diffusion of reactants in the bimodal hexagonal mesoporous structure. 2 Experimental 2.1 Catalyst preparation 2.1.1 Materials Tetraethyl orthosilicate (TEOS, 99 %), AlCl3·6H2O (98 %), cetyltrimethylammonium bromide (CTAB, 99 %), aqueous ammonia (28 %), ethanol (99.5 %), (NH4)6Mo7O24·4H2O (99 %), polyethylene oxide-polypropylene oxide-polyethylene oxide triblock copolymer (P123), 4,6-dimethylbiphenylthiophene (4,6-DMDBT, 97 %), decalin (98 %), and Ni(NO3)2·6H2O (98 %) were purchased from Aladdin Reagent Co., Ltd. The H2S (10 vol)/H2 mixture was purchased from Shanghai Weichuang Standard Gas Co., Ltd. 2.1.2 Preparation of supports The B-AM41 was prepared with minor modifications to reference [23]. As shown in Scheme 1 , 4.58 mmol (1.67 g) of CTAB and 5 mL of ammonia solution were sequentially added to 500 mL of water, and stirred continuously to obtain a clear solution. Then, 22.5 mmol (4.68 g) of TEOS and 1.5 mmol (0.36 g) of AlCl3·6H2O were sequentially added to the above solution. The molar ratio of SiO2: Al2O3: CTAB: ammonia in the solution was 1:0.03:0.2:1.5. After filtering and washing with deionized water, a white solid (called “primary product”) was obtained. After that, the “primary product” (0.5 g) was immersed in a basic (pH ∼ 10) ethanol solution (60 mL) containing 3 g of P123. The gel was aged in an autoclave at 100 ℃ for 2 days. Finally, the product was filtered, repeatedly washed with distilled water, dried at 120 ℃ for 3 h, and calcined at 550 ℃ in the air for 6 h. Two mono-mesopore materials were also synthesized. S-AM41 was synthesized using the “primary product” as the starting material. Specifically, the above “primary product” was dried in air at 120 ℃ for 3 h, then heated to 550 ℃ at a rate of 1 ℃ min−1, and maintained for 6 h. L-AM41 was prepared following a literature [24]. 2.1.3 Preparation of catalysts The catalysts were prepared by co-impregnation method using a mixed solution containing Mo and Ni salts. Specifically, 0.24 g (0.19 mmol) of (NH4)6Mo7O24·4H2O and 0.14 g (0.48 mmol) of Ni(NO3)2·6H2O were sequentially added to 30 mL of ultrapure water and stirred until completely dissolved. Then, 1 g of synthesized support was added to the above solution and stirred continuously for 6 h. After impregnation, the sample was dried at 100 ℃ for 12 h and then calcined in an air atmosphere at 550 ℃ for 5 h. The target loadings of active metal oxides NiO and MoO3 are 3.0 wt% and 16.0 wt%, respectively. The catalysts are labeled as NiMo/S-AM41, NiMo/B-AM41, and NiMo/L-AM41. 2.2 Characterization X-ray diffraction (XRD) measurements of the synthesized supports and catalysts were conducted on an XRD-6100 instrument operating at 40 kV and 30 mA using Cu Kα radiation (λ = 0.15 mm). During measurement, the scanning ranges of small-angle XRD (SA-XRD) and wide-angle XRD (WA-XRD) were 1.5°-8° and 10°-80°, respectively. Energy dispersive X-ray (EDX) spectroscopy of supports and catalysts was carried out on the EDX-8000 instrument. The textural properties of supports and catalysts were measured using a Micromeritics ASAP 2460. Before measurement, the sample was vacuumed at 300 ℃ for 12 h to remove impurities and subsequently backfilled with N2. Specific surface areas were calculated by the Brunauer-Emmett-Teller method (SBET), the total pore volume (VTotal) was obtained by N2 adsorption at a relative pressure of 0.98, and pore distribution was obtained from the desorption branch of the isotherms by the Barrett-Joyner-Halenda (BJH) method. Raman measurement was conducted by a Horiba LabRAM HR Evolution with a spectral resolution of 2 cm−1. The laser lines at 325 nm of a He/Cd laser were applied for catalysts. The temperature-programmed reduction of hydrogen (H2-TPR) experiment was measured on the Microtrac BELCat II temperature-programmed chemisorption instrument. Before measurement, 60 mg of sample was pretreated in Ar at 200 ℃ for 1 h, and then heated from 200 ℃ to 900 ℃ at a rate of 10 ℃ min−1 in a 40 mL min−1 H2/Ar mixture containing 8 vol% H2. X-ray photoelectron spectroscopy (XPS) measurement was implemented on a Thermo Scientific K-Alpha equipped with Al-Ka (hv = 1486.6 eV, 12.0 kV) X-ray radiation. Before testing, the catalyst sample was fully sulfurized in an H2S/H2 mixture containing 10 vol% H2S at 400 ℃ for 4 h. Then the fresh sulfurized catalyst was rapidly suspended in acetone and placed in a vacuum dryer to prevent its oxidation. For the XPS measurement, the acetone was removed, and the wet residual catalyst was quickly transferred to the analysis chamber to avoid oxidation as much as possible. Pyridine infrared (Py-IR) spectroscopy was carried out to determine the type and amount of acid for the supports and catalysts. The catalyst sample was sulfurized according to the same procedure described in XPS characterization. Before testing, the sample was purged with Ar gas for 3 h to remove impurities and then degassed in a vacuum chamber at 350 ℃ for 4 h. Afterwards, pyridine was saturated and absorbed by the samples. The adsorption system was degassed and evacuated at temperatures of 200 ℃ and 350 ℃, respectively, and the IR spectra were recorded in the range of 1700–1400 cm−1. To quantitatively compare the properties of MoS2 on different catalysts, a high-resolution transmission electron microscopy (HRTEM) experiment was carried out on an FEI Talos F200S microscope. The catalyst sample to be measured was sulfurized according to the same procedure described in XPS characterization. Before testing, the wet residual catalyst was sonicated in absolute ethanol for 20 min. At least 25 micrographs of each sample were collected to analyze the slab length and stacking number of MoS2 slabs. At least 230 slabs were selected for each image to quantitatively analyze the morphological characteristics of MoS2 slabs. The average length (L av) and average stacking number (N av) of the MoS2 slabs were calculated according to the following equations [25]: (1) L ( N ) av = ∑ i = 1 n ( n i l i ) / ∑ i = 1 n n i where li is the slab length of MoS2, ni is the number of the particles with li length or N i layers, and N i is the number of layers in the particle i. The dispersion of MoS2 (f Mo) is expressed by the following equation [26]: (2) f Mo = ( Mo edge + Mo corner ) / Mo total = ∑ i = 1 t ( 6 m i - 6 ) / ∑ i = 1 t ( 3 m i 2 - 3 m i + 1 ) Where mi is the number of Mo atoms along one side of the MoS2 slab determined by its slab length (mi = L/0.64 + 0.5). The edge/corner ratio of a MoS2 slab (f e/c) was calculated by the following equation [27]: (3) f e / c = (10 L av /3.2-3)/2 2.3 HDS evaluation The HDS reactions were implemented in a stainless steel fixed-bed reactor (inner diameter 5 mm, length 500 mm). The catalyst was directly sulfurized in an H2S/H2 mixture containing 10 vol% H2S at 400 ℃ for 4 h. 0.3 g of sulfurized catalyst diluted with 1.5 g of silicon carbide (SiC) was uniformly mixed and loaded into the reactor. The HDS experiments were performed at a constant H2 pressure of 4 MPa, a temperature of 290 − 350℃, a weight liquid hourly space velocity (WHSV) of 4–90 h−1, an H2/oil ratio of 500, and 0.5 wt% of 4,6-DMDBT in decalin. The product was analyzed using a 9890B gas chromatography equipped with a flame photometric detector (FPD) and an RB-1 capillary column (30 m × 0.25 mm × 0.25 μm) and gas chromatography-mass spectrometry (PerkinElmer Clarus 690). The conversion of 4,6-DMDBT was calculated by the following equation: (4) X = C in - C out C in × 100 % where Cin and Cout are the 4,6-DMDBT in feed oil and out oil, respectively. Before the experiment, the mass transfer resistance was verified using Weisz Prater criteria (CW-P) and Mears criteria (CM) [28]. The detailed results in the supporting information indicate that internal and external diffusion restrictions can be ignored. In addition, assuming that the HDS reactions of 4,6-DMDBT follow pseudo-first-order reaction kinetics. In this case, the HDS reaction rate (k HDS, mol g−1 s−1) and turnover frequency (TOF, s−1) were determined according to the following equations [11,29]: (5) k HDS = - M W ln ( 1 - X ) (6) TOF = F × X n × f Mo where M represents the feeding rate of 4, 6-DMDBT (mol s−1), W represents the catalyst mass (g), X is the conversion of 4, 6-DMDBT, n is the molar quantity of Mo atoms in the catalysts, and f Mo represents the dispersion of MoS2 slabs. 3 Results and discussion 3.1 Properties of supports The SA-XRD patterns of the three synthesized materials are shown in Fig. 1 a. Three peaks were observed in all materials within the range of 2° ∼ 6°, which can be attributed to the typical Bragg reflections (100), (110), and (200) of MCM-41 material, with a typical ordered hexagonal mesostructure and long-range two-dimensional arrangement of channels [13]. The different d 100 spacing values of the three supports calculated by the Bragg equation result in different a0 values (Table 1 ), which may be related to the number of Si4+ ions isomorphically replaced by Al3+ ions. N2 adsorption–desorption isotherms and pore size distribution results of the supports are presented in Fig. 1b and c, respectively. All synthesized materials exhibited reversible N2 adsorption–desorption isotherms of type IV, with H-1 hysteresis loops (Fig. 1b) [30,31], confirming the existence of the mesoporous structure of the synthesized materials. The structural properties of the supports obtained from the N2 adsorption–desorption isotherm are summarized in Table 1. The SBET and pore volume of the three supports were not significantly different. As depicted in Fig. 1c, there was a significant difference in their pore distribution. The pore size distribution curves of S-AM41 and L-AM41 both presented narrow single peaks concentrated at 3.1 nm and 5.6 nm, respectively, indicating that their pore distribution is relatively uniform. In addition to the peak at 3.2 nm, a peak at 5.1 nm was observed on B-AM41 (inset of Fig. 1c), demonstrating the presence of a bimodal mesoporous structure. To further investigate the ordered mesostructure of the synthesized supports, TEM tests were conducted, and the results are shown in Fig. 2 . As depicted in Fig. 2a and c, the measured intragranular pores of S-AM41 are approximately 2.9 nm, while those of L-AM41 is approximately 5.7 nm. For B-AM41, there are two types of measured intragranular pores, around 3.1 and 5.3 nm, respectively, which further suggest a bimodal mesoporous structure. Moreover, the measured intragranular pore sizes of the three materials are very close to the pore size values obtained from N2 physical adsorption. Combining the above results, it is inferred that the formation of large mesopore of B-AM41 occurs in the second stage, where P123 participates in the formation of micelles (Scheme 1). At this stage, the primary AlMCM-41 gel particles are soft and deformable. When immersed in a surfactant solution, primary particles aggregate around the micelles. The surface silanol groups exposed to the micelles link to the hydrophilic heads of the surfactants through hydrogen bonds, while the silanol groups from nearby particles condense around the micelles at higher temperatures. Under such conditions, larger mesopores are formed. 3.2 Properties of catalysts 3.2.1 Oxidized catalysts Fig. S1 shows the SA-XRD pattern of the calcined NiMo catalysts. The three diffraction peaks were preserved in the range of 2 − 6°, indicating that the long-range pore arrangement of all the supports did not change after Ni and Mo deposition. In addition, the specific surface area and pore volume of the corresponding catalysts are reduced compared with the supports (Table S1). The existence form of active metal oxides on the catalyst was analyzed using Raman spectroscopy, and the results are shown in Fig. 3 a. In the Raman spectra of all catalysts, four peaks appear at approximately 831, 902, 954, and 986 cm−1. The peak at 831 cm−1 is likely due to the Mo-O-Mo bonds in polymerized Mo oxide species (orthorhombic molybdenum trioxide) [10]. The peak at about 902 cm−1 belongs to tetrahedrally coordinated Mo species. Moreover, the strong peak at approximately 954 cm−1 should be assigned to the combination of octahedrally coordinated Mo oxide species and Mo8O26 4− species [10,33,34]. These species possess a weaker interaction with the support and is easily reduced in a hydrogen atmosphere, making it easy to form type II sulfide phases during the sulfurization process, which is conducive to the generation of active edges and the HDS reactions. The peak fitting results of Raman spectra of different catalysts are shown in Fig. S2. It can be observed that the NiMo/B-AM41 catalyst has a higher ratio of peak area at 954 cm−1 than other catalysts, implying its high content of octahedrally coordinated Mo and Mo8O26 4− species. Therefore, the sulfurized NiMo/B-AM41 catalyst may have a higher type II active phase. Additionally, the peak at around 986 cm−1 can be attributed to the symmetric stretching vibration of well-dispersed MoO3 phases [35]. The reducibility of active metals on catalysts was studied by H2-TPR. The H2-TPR spectra of different NiMo oxide catalysts are presented in Fig. 3b. They possess similar contours in the range of 200 ℃ to 900 ℃ and can be divided into two areas: the low-temperature area (LTA, 200–500 ℃) and the high-temperature area (HTA, 500–900 ℃). The first peak in LTA can be attributed to the step of dispersed octahedral Mo species reducing from Mo6+ to Mo4+ (Mo6+ + 6e− → Mo4+) [36,37]. The first peak in HTA can be attributed to the reduction of Mo4+ to Mo0 (Mo4+ + 4e− → Mo0) [38]. The second peak (570–630 ℃) of the three catalysts under HTA should be designated as the reduction of the slightly aggregated bulk MoO3. Compared with NiMo/S-AM41 and NiMo/L-AM41 catalysts, the two main reduction peaks of NiMo/B-AM41 catalysts shift towards lower temperatures. Generally, the lower the reduction temperature, the weaker the MSI and the easier it is to vulcanize. It should also be noted that the hydrogen consumption of NiMo/B-AM41 catalyst corresponding to the first peak in LTA is higher than that of NiMo/S-AM41 and NiMo/L-AM41 catalysts (Table 2 ), which means that NiMo/B-AM41 catalyst has more easily reducible Mo species. Therefore, the bimodal mesoporous is beneficial for weakening the interaction strength between octahedral Mo species and supports, and further increasing their proportion. 3.2.2 Sulfurized catalysts The sulfurization degree and state of active metals (Mo and Ni) in the catalyst are crucial for the HDS reactions, therefore relevant parameters are obtained utilizing XPS spectroscopy. The XPS deconvolution results of Mo 3d and Ni 2p are presented in Figs. 4 and 5 , respectively. Table 3 summarizes the relevant XPS parameters. Fig. 4 reveals that Mo exists in the form of Mo4+(MoS2) with binding energies (BEs) of 229.0 ± 0.1 eV (3d5/2) and 232.2 ± 0.2 eV (3d3/2), Mo5+ (MoOxSy) with BEs of 232.2 ± 0.1 eV (3d5/2) and 235.3 ± 0.2 eV (3d3/2), and Mo6+ (MoO3) with BEs of 230.2 ± 0.1 eV (3d5/2) and 233.4 ± 0.1 eV (3d3/2), respectively [2,39]. Additionally, the peak at 226.0 ± 0.1 eV can be attributed to S 2 s [40]. The higher the content of Mo4+ species, the higher the sulfurization degree of Mo. The proportion of Mo4+species in Table 3 increases according to the sequence of NiMo/S-AM41 < NiMo/L-AM41 < NiMo/B-AM41, suggesting the highest proportion of MoS2 species (76 %) on NiMo/B-AM41. The deconvolution results of the Ni 2p XPS spectra for different catalysts are depicted in Fig. 5. It reveals that the spectra for each catalyst are decomposed into four peaks. The peaks at 852.4 ± 0.1 eV, 853.7 ± 0.1 eV, and 856.2 ± 0.2 eV should be attributed to NiSx, NiMoS, and Ni2+, respectively [41,42]. Additionally, the Ni 2p peak around 861.4 ± 0.2 eV is due to the shake-up of oxidized Ni2+ species [40,43]. Furthermore, the peak fitting information of Ni 2p species in Table 3 indicates that the proportion of Ni-promoted MoS2 active phase (NiMoS species) follows the order NiMo/B-AM41 (65 %) > NiMo/L-AM41 (55 %) > NiMo/S-AM41 (48 %), consistent with the Mo 3d XPS ranking. The above results suggest that NiMo/B-AM41 possesses the highest proportion of MoS2 and NiMoS phases, which will provide abundant HDS active sites. The microstructure of the MoS2 slab is an important factor determining the catalytic performance of corresponding HDS catalysts, especially in the remove of high refractory sulfides with spatial hindrance. HRTEM measurement was applied to obtain the microstructure and distribution of the MoS2 slab. Representative images of different catalysts are illustrated in Fig. 6 a–c. The stacking number and length distribution of MoS2 crystal slabs with different catalysts are illustrated in Fig. 6d–f and g, respectively. On the NiMo/S-AM41 catalyst, the stacking layers of MoS2 crystal slabs are mainly concentrated in four layers (46.3 %) (Fig. 6d). For NiMo/B-AM41, the stacking layers are mainly concentrated in three layers (accounting for 40.4 %), accompanied by a higher shoulder with a stacking layer of four, accounting for 29.7 % (Fig. 6e). However, on the NiMo/L-AM41 catalyst with larger pore sizes, four-layer stacking is predominant at 39.6 %, followed by three-layer stacking at 32.7 %. In terms of slab length (Fig. 6g), the MoS2 length on the NiMo/S-AM41 catalyst is mainly concentrated in 4–6 nm, accounting for 46.1 %, while on the NiMo/B-AM41 catalyst, the slab length is concentrated in both 2–4 nm and 4–6 nm, with a similar proportion of about 31 %. In the case of NiMo/L-AM41 with larger pore sizes, the slab length of 2–4 nm dominates, accounting for 55.8 %. Therefore, the pore size has a significant impact on the stacking degree and length of MoS2 crystal slabs. For a more comprehensive comparison, the average length, average stacking, and dispersion of MoS2 slabs on different catalysts were calculated, and statistical information is listed in Table 4 . Generally speaking, lower stacking layers inhibit the production of type II NiMoS active phases, while higher stacking degrees are not conducive to the exposure of actual active sites (including corners and edges) [44]. Moreover, the appropriate length of the MoS2 slab not only facilitates the dispersion of the active phases, but also increases the accessibility of the active sites [16,45]. Table 4 reveals that the MoS2 slab on the NiMo/B-AM41 catalyst presents the lowest average stacking (3.1 layers) and a moderate slab length (3.9 nm). Therefore, the NiMo/B-AM41 catalyst shows the highest dispersion (f Mo, 0.33) of the MoS2 phase. In addition, Table 4 also illustrates that the edge/corner ratio (f e/c) of the MoS2 crystal slab decreases in the order of NiMo/S-AM41 > NiMo/B-AM41 > NiMo/L-AM4, indicating an increase in the number of corner sites. A good MoS2 phase dispersion is beneficial for improving the exposure of active edges, which benefits HDS activity. The superior dispersion of MoS2 slabs on the NiMo/B-AM41 catalyst may indicate its high overall HDS activity. It is well-known that the acidity of the catalyst significantly affects the HDS reactions. Py-IR characterization was conducted to evaluate the acid types and content of different catalysts. The IR spectra curves and distribution of acidic sites after pyridine adsorption within the range of 1700–1400 cm−1 at 200 and 350 °C are presented in Fig. S3 and Table 5 , respectively. As reported, the band at 1596 cm−1 can be attributed to the adsorption of pyridine via hydrogen bonding, while the bands at 1446, 1582, and 1621 cm−1 are associated with the adsorption of pyridine on Lewis (L) acid sites. The bands at 1546 and 1639 cm−1 are attributed to the ring vibration of pyridine ions caused by the binding of pyridine with Bronsted (B) acid sites, and the band at 1492 cm−1 is assigned to the adsorption of pyridine related to combined B and L sites [46–48]. The acid site distribution listed in Table 5 indicates that the total acidity of each catalyst is different. The highest total acidity (200 °C) is observed on NiMo/S-AM41, with a value of 0.17 mmol/g, followed by NiMo/B-AM41 and NiMo/L-AM41 with values of 0.16 mmol/g and 0.15 mmol/g, respectively. In addition, the B/L ratio of the three catalysts decreases in the order of NiMo/B-AM41 > NiMo/S-AM41 > NiMo/L-AM41. It has been reported that B acid sites have an electronic effect on adjacent metal sulfides, which can promote the formation of coordination unsaturated sites (CUS) [49], and further facilitate the cleavage of C-S bonds in the sulfides to achieve DDS reactions. Therefore, the different acidity properties of the three catalysts will produce different effects on the activity and selectivity of the 4,6-DMDBT HDS reactions. 3.3 Catalytic behavior The conversion rates of 4,6-DMDBT at different temperatures over different catalysts are presented in Fig. 7 a. It demonstrates that the conversion of 4,6-DMDBT increases in the order of NiMo/S-AM41 < NiMo/L-AM41 < NiMo/B-AM41, which does not correspond to the order of pore size but highly corresponds to the proportion of the NiMoS active phase. The overall activation energy (Ea ) for the 4,6-DMDBT HDS reactions on the three catalysts was calculated by plotting the relationship between lnk HDS and 1/T based on the Arrhenius equation: (7) ln k H D S = lnA- Ea /RT In Eq. (7), T is the temperature (K) and R is the ideal gas constant with a value of 8.314 J K−1 mol−1. The details are depicted in Fig. 7b and Table 6 and S2. It can be observed from Table 6 that the activation energy for the 4,6-DMDBT HDS reaction on the investigated catalysts decreases in the order of NiMo/S-AM41 (106 kJ/mol) > NiMo/L-AM41 (92 kJ/mol) > NiMo/B-AM41 (87 kJ/mol), opposite to the order of the overall catalytic activity of the catalysts. These results illustrate that the overall catalytic activity of the investigated catalysts increases in the same order, suggesting that the performance of the three catalysts is closely related to the proportion of the NiMoS phases formed during the sulfurization process (Table 3). The catalytic performance of the investigated catalysts was also evaluated at different WHSVs (Fig. 7c), which further indicates the superior catalytic performance of the NiMo/B-AM41 catalyst. To further compare the catalytic performance of the three catalysts, the overall reaction rate constants (k HDS) and turnover frequencies (TOF) were calculated according to equations (5) and (6), respectively, as provided in Table 6. The results demonstrate that the k HDS on the NiMo/B-AM41 catalyst is 10.4 × 10−8 mol g−1 s−1, which is approximately 2.3 times that of the NiMo/S-AM41 catalyst. However, the k HDS value decreases to 7.2 × 10−8 mol g−1 s−1 on the NiMo/L-AM41 catalyst. Regarding the TOF values of 4,6-DMDBT on the catalysts, the TOF on the NiMo/S-AM41 catalyst is only 4.2 × 10−4 s−1. On the NiMo/B-AM41 catalyst, its activity increases sharply to 7.0 × 10−4 s−1, much higher than that of the NiMo/S-AM41 catalyst. However, the TOF value decreases to 5.7 × 10−4 s−1 on the NiMo/L-AM41 catalyst. The results suggest that the 4,6-DMDBT HDS reaction activity of NiMo/B-AM41 is superior to that of NiMo/S-AM41 and NiMo/L-AM41. Furthermore, the NiMo/B-AM41 catalyst showed higher HDS activity for the TOF of 4,6-DMDBT as compared with the state-of-the-art catalysts reported in the literature (Table 7 ). The proportion and morphology of the active phases are the fundamental reasons for the different catalytic activities of the evaluated catalysts. Fig. 8 illustrates a 3D plot of the dependence of TOF values on the average stacking number (N av) and length (L av)of MoS2 slabs. It can be observed that the increase in TOF values depends on the reduction of N av. And the TOF does not solely depend on the reduction of L av, which is consistent with previous reports that an appropriate slab length is beneficial for the HDS reactions [16,45]. Catalysts with the minimum N av and moderate L av possess better catalytic activity. The shape of the dependence relationship in Fig. 8 is conditioned by the variation of the slab size with the support pore size. On the NiMo/S-AM41 catalyst with smaller pores, the highest N av and L av result in poor dispersion, thus showing the lowest TOF value. The NiMo/B-AM41 catalyst with a bimodal mesoporous structure has the lowest N av and moderate L av, resulting in the best dispersion (f Mo, 0.33) and thus demonstrating the highest TOF value, as shown by the visualization model (Fig. 9 ). However, on the NiMo/L-AM41 catalyst with larger pore diameters, a moderate N av and the minimum L av are observed, leading to reduced dispersion and thus a decrease in TOF value. Moreover, the bimodal hexagonal mesostructure of NiMo/B-AM41 exhibits the highest effective diffusion coefficient (Deff , see supporting information), indicating good mass transfer performance. These results indicate that the bimodal mesoporous structure is more conducive to the HDS reactions. The liquid products from the 4,6-DMDBT HDS reactions were collected to investigate the selectivity of the reaction pathway. In general, the HDS process of 4,6-DMDBT involves two reaction pathways. One of them is commonly referred to as direct desulfurization (DDS), which generates the primary product, dimethylbiphenyl (DMBP), by breaking the C-S bond of 4,6-DMDBT [52]. The other is hydrogenation (HYD), where one of the aromatic rings of 4,6-DMDBT is pre-hydrogenated, followed by the elimination of the sulfur atom. The typical products in this process are dimethyltetrahydrodibenzothiophene (DMTHDBT), dimethylhexahydrodibenzothiophene (DMHHDBT), followed by the desulfurization products dimethylbicyclohexyl (DMBCH) and dimethylcyclohexylbenzenes (DMCHB) [3,55]. Additionally, low-carbon products such as toluene and methylcyclohexane (C7) were also produced as cracking products. Apart from the products mentioned above, two other products, namely 4,4′-DMBP and isomerized MIPT (iso-MIPT), were detected, as listed in Table 8 . 4,4′-DMBP is produced after 4,6-DMDBT isomerizes to 3,7-DMDBT and undergoes direct desulfurization [56]. Table 8 clearly illustrates that the product selectivity for the three catalysts at approximately 50 % conversion is different. In all catalysts, 3,3′-DMBP and 4,4′-DMBP account for a large proportion of the products, indicating that desulfurization via C-S bond cleavage by hydrogenolysis is the preferred pathway. The proportion of iso-MIPT increases from 6 % for NiMo/L-AM41 to 17 % for NiMo/B-AM41, indicating that isomerization reactions are also an important pathway for 4,6-DMDBT. As reported, increasing B acidity can improve the electron efficiency of the active phase, thereby enhancing isomerization abilities [3,57]. Therefore, the increasing trend of isomeric products and the ranking of B acidity are well consistent. It is noteworthy that the total DDS proportion increases in the order of NiMo/S-AM41 < NiMo/B-AM41 < NiMo/L-AM41, suggesting that DDS activity is enhanced. However, this order does not coincide with the ranking of B acidity (NiMo/L-AM41 < NiMo/S-AM41 < NiMo/B-AM41), which is related to the morphology of the active phase and pore size. Proverbially, sulfur atoms of the reactant are more likely to adsorb onto hexagonal MoS2 corner sites [58,59]. The f e/c ratios (Table 4) on the three catalysts decrease in the order of NiMo/S-AM41 > NiMo/B-AM41 > NiMo/L-AM41, meaning that the corner sites increase in the opposite direction. In this case, direct adsorption of sulfur atoms from sulfur-containing molecules is promoted, followed by desulfurization via C–S bond hydrogenolysis. On the other hand, as the pore size increases, the spatial steric hindrance of the methyl group is greatly reduced, making it easier for the 4,6-DMDBT molecule to access the hexagonal MoS2 corner sites, thus the DDS reactions become easier on the NiMo/L-AM41 catalyst. Overall, the differences in reaction pathways on the three catalysts are the result of the comprehensive effects of active phase morphology, acidity, and pore size. 4 Conclusion In this study, a bimodal mesoporous B-AM41 material was prepared and used as a support to prepare NiMo catalysts for HDS of 4,6-DMDBT. At the same time, smaller single pore S-AM41 and larger single pore L-AM41 supported catalysts were also prepared as reference catalysts. The detailed characterization results reveal that the active metals are more evenly distributed on the B-AM41, ensuring its higher degree of vulcanization, and thus providing more type II active phases. In addition, the minimum stacking degree and the moderate slab length of MoS2 active phases ensure the wide dispersion of these active phases. Moreover, the bimodal mesostructured B-AM41 enhances the diffusion of 4,6-DMDBT and benefits its contact with active sites. As a result, the catalytic performance evaluation of 4, 6-DMDBT showed that the B-AM41 supported catalyst exhibited high HDS activity, with a reaction rate constant of 10.4 × 10−8 mol g−1 s−1 and a turnover frequency of 7.0 s−1, which is significantly superior to the S-AM41 and L-AM41 supported catalysts. CRediT authorship contribution statement Hao Zhang: Writing – original draft, Validation, Investigation. Qing Zhang: Investigation. Guang-Ren Qian: Supervision, Conceptualization. Hong Liu: Writing – review & editing, Supervision. Yang Yue: Validation, Investigation. Declaration of competing interest The authors declare that they have no known competing financial interests or personal relationships that could have appeared to influence the work reported in this paper. Appendix A Supplementary data Supplementary data to this article can be found online at https://doi.org/10.1016/j.jcat.2024.115799. Appendix A Supplementary data The following are the Supplementary data to this article: Supplementary Data 1 References [1] X. Wang C. Xiao M.H. Alabsi P. Zheng Z. Cao J. Mei Y. Shi A. Duan D. Gao K.-W. Huang C. Xu Pt-confinement catalyst with dendritic hierarchical pores on excellent sulfur-resistance for hydrodesulfurization of dibenzothiophene and 4,6-dimethyldibenzothiophene Green Energy Environ. 7 2022 324 333 10.1016/j.gee.2020.10.012 X. Wang, C. Xiao, M.H. Alabsi, P. Zheng, Z. Cao, J. Mei, Y. Shi, A. Duan, D. Gao, K.-W. Huang, C. Xu, Pt-confinement catalyst with dendritic hierarchical pores on excellent sulfur-resistance for hydrodesulfurization of dibenzothiophene and 4,6-dimethyldibenzothiophene, Green Energy Environ. 7 (2022) 324-333, doi: 10.1016/j.gee.2020.10.012. [2] L.J. Rodríguez-Castillo F.J. Méndez J.A. García-Macedo I.C. Romero-Ibarra L.A. Calzada E. Albiter F. Cancino-Trejo C.E. Santolalla-Vargas E. Gómez V. Santes Sulfured NiMo catalysts on TiO2-Nb2O5 nanocomposites for efficient hydrodesulfurization performance Catal. Today 432 2024 114616 10.1016/j.cattod.2024.114616 L.J. Rodríguez-Castillo, F.J. Méndez, J.A. García-Macedo, I.C. Romero-Ibarra, L.A. Calzada, E. Albiter, F. Cancino-Trejo, C.E. Santolalla-Vargas, E. Gómez, V. Santes, Sulfured NiMo catalysts on TiO2-Nb2O5 nanocomposites for efficient hydrodesulfurization performance, Catal. Today 432 (2024) 114616, doi: 10.1016/j.cattod.2024.114616. [3] H. Sun L. Li H. Zhang H. Yang T. Yang M. Shu Z. Zhong M. Yi B. Meng Effect of Zirconium modified Y zeolite via in situ synthesis and its regulation on the formation of excellent NiW catalyst for ultra-deep hydrodesulfurization of 4,6-DMDBT Chem. Eng. J. 478 2023 147514 10.1016/j.cej.2023.1475 H. Sun, L. Li, H. Zhang, H. Yang, T. Yang, M. Shu, Z. Zhong, M. Yi, B. Meng, Effect of Zirconium modified Y zeolite via in situ synthesis and its regulation on the formation of excellent NiW catalyst for ultra-deep hydrodesulfurization of 4,6-DMDBT, Chem. Eng. J. 478 (2023) 147514, doi: 10.1016/j.cej.2023.1475 [4] W. Bao C. Feng S. Ma D. Yan C. Zhang C. Yue C. Wang H. Guo J. Wang D. Sun Y. Liu Y. Lu Controlled construction of Co3S4@CoMoS yolk-shell sphere for efficient hydrodesulfurization promoted by hydrogen spillover effect Chinese J. Catal 57 2024 154 170 10.1016/S1872-2067(23)64573-5 W. Bao, C. Feng, S. Ma, D. Yan, C. Zhang, C. Yue, C. Wang, H. Guo, J. Wang, D. Sun, Y. Liu, Y. Lu, Controlled construction of Co3S4@CoMoS yolk-shell sphere for efficient hydrodesulfurization promoted by hydrogen spillover effect, Chinese J. Catal, 57 (2024) 154-170, doi: 10.1016/S1872-2067(23)64573-5. [5] C. Zhang W. Bao S. Ma C. Wang Y. Liu C. Liu D. Sun Y. Lu A novel ligand protection strategy based on lacunary polyoxometalate to precisely construct CoMoS active sites for hydrodesulfurization Chem. Eng. J. 473 2023 145459 10.1016/j.cej.2023.145459 C. Zhang, W. Bao, S. Ma, C. Wang, Y. Liu, C. Liu, D. Sun, Y. Lu, A novel ligand protection strategy based on lacunary polyoxometalate to precisely construct CoMoS active sites for hydrodesulfurization, Chem. Eng. J. 473 (2023) 145459, doi: 10.1016/j.cej.2023.145459. [6] H. Zhang G.-R. Qian H. Liu Simultaneous hydrodesulfurization of thiophene and benzothiophene over NiMoS catalysts supported on γ-Al2O3 composites containing ZSM-5 Micropor. Mesopor. Mat. 346 2022 112296 10.1016/j.micromeso.2022.112296 H. Zhang, G.-R. Qian, H. Liu, Simultaneous hydrodesulfurization of thiophene and benzothiophene over NiMoS catalysts supported on γ-Al2O3 composites containing ZSM-5, Micropor. Mesopor. Mat. 346 (2022) 112296, doi: 10.1016/j.micromeso.2022.112296. [7] S. Arora S.S. Rashmi Suppression of inactive sites in NiMo@amorphous alumina catalysts for hydrodesulfurization reaction: Effect of Ga doping J. Catal. 434 2024 115501 10.1016/j.jcat.2024.115501 S. Arora, Rashmi, S. Sivakumar, Suppression of inactive sites in NiMo@amorphous alumina catalysts for hydrodesulfurization reaction: Effect of Ga doping, J. Catal. 434 (2024) 115501, doi: 10.1016/j.jcat.2024.115501. [8] M.A. Kazakova Y.V. Vatutina A.G. Selyutin I.P. Prosvirin E.Y. Gerasimov O.V. Klimov A.S. Noskov M.O. Kazakov Design of improved CoMo hydrotreating catalyst via engineering of carbon nanotubes@alumina composite support Appl. Catal. B-Environ. Energy 328 2023 122475 10.1016/j.apcatb.2023.122475 M.A. Kazakova, Y.V. Vatutina, A.G. Selyutin, I.P. Prosvirin, E.Y. Gerasimov, O.V. Klimov, A.S. Noskov, M.O. Kazakov, Design of improved CoMo hydrotreating catalyst via engineering of carbon nanotubes@alumina composite support, Appl. Catal. B-Environ. Energy 328 (2023) 122475, doi: 10.1016/j.apcatb.2023.122475. [9] D. Gao A. Duan X. Zhang Z. Zhao H. E J. Li H. Wang Synthesis of NiMo catalysts supported on mesoporous Al-SBA-15 with different morphologies and their catalytic performance of DBT HDS Appl. Catal. B-Environ. Energy 165 2015 269 284 10.1016/j.apcatb.2014.10.034 D. Gao, A. Duan, X. Zhang, Z. Zhao, H. E, J. Li, H. Wang, Synthesis of NiMo catalysts supported on mesoporous Al-SBA-15 with different morphologies and their catalytic performance of DBT HDS, Appl. Catal. B-Environ. Energy 165 (2015) 269-284, https://dx.doi.org/10.1016/j.apcatb.2014.10.034. [10] Z. Cao X. Zhang R. Guo S. Ding P. Zheng J. Fan J. Mei C. Xu A. Duan Synergistic effect of acidity and active phases for NiMo catalysts on dibenzothiophene hydrodesulfurization performance Chem. Eng. J. 400 2020 125886 10.1016/j.cej.2020.125886 Z. Cao, X. Zhang, R. Guo, S. Ding, P. Zheng, J. Fan, J. Mei, C. Xu, A. Duan, Synergistic effect of acidity and active phases for NiMo catalysts on dibenzothiophene hydrodesulfurization performance, Chem. Eng. J. 400 (2020) 125886, doi: 10.1016/j.cej.2020.125886. [11] L. Qi P. Zheng Z. Zhao A. Duan C. Xu X. Wang Insights into the intrinsic kinetics for efficient hydrodesulfurization of 4,6-dimethyldibenzothiophene over mesoporous CoMoS2/ZSM-5 J. Catal. 408 2022 279 293 10.1016/j.jcat.2022.03.010 L. Qi, P. Zheng, Z. Zhao, A. Duan, C. Xu, X. Wang, Insights into the intrinsic kinetics for efficient hydrodesulfurization of 4,6-dimethyldibenzothiophene over mesoporous CoMoS2/ZSM-5, J. Catal. 408 (2022) 279-293, doi: 10.1016/j.jcat.2022.03.010. [12] F. Masoumi S. Safari R. Khoshbin R. Karimzadeh Utilization of agricultural waste (rice husk) in synthesis of TS-1 zeolite as a support for NiMo nanocatalyst employed in hydrodesulfurization of heavy oil Adv. Powder Technol. 34 2023 104134 10.1016/j.apt.2023.104134 F. Masoumi, S. Safari, R. Khoshbin, R. Karimzadeh, Utilization of agricultural waste (rice husk) in synthesis of TS-1 zeolite as a support for NiMo nanocatalyst employed in hydrodesulfurization of heavy oil, Adv. Powder Technol. 34 (2023) 104134, doi: 10.1016/j.apt.2023.104134. [13] F.J. Méndez O.E. Franco-López G. Díaz A. Gómez-Cortés X. Bokhimi T.E. Klimova On the role of niobium in nanostructured Mo/Nb-MCM-41 and NiMo/Nb-MCM-41 catalysts for hydrodesulfurization of dibenzothiophene Fuel 280 2020 118550 10.1016/j.fuel.2020.118550 F.J. Méndez, O.E. Franco-López, G. Díaz, A. Gómez-Cortés, X. Bokhimi, T.E. Klimova, On the role of niobium in nanostructured Mo/Nb-MCM-41 and NiMo/Nb-MCM-41 catalysts for hydrodesulfurization of dibenzothiophene, Fuel 280 (2020) 118550, doi: 10.1016/j.fuel.2020.118550. [14] T.A. Zepeda R.M. Navarro R. Huirache-Acuña P.J. Vazquez-Salas G. Alonso-Núñez P. Sánchez-López B. Pawelec Positive phosphorous effect during co-processing of pyrolysis bio-oils and S-content model compounds over sulfide NiMo/P/HMS-Al catalysts Fuel Process. Technol. 211 2021 106599 10.1016/j.fuproc.2020.106599 T.A. Zepeda, R.M. Navarro, R. Huirache-Acuña, P.J. Vazquez-Salas, G. Alonso-Núñez, P. Sánchez-López, B. Pawelec, Positive phosphorous effect during co-processing of pyrolysis bio-oils and S-content model compounds over sulfide NiMo/P/HMS-Al catalysts, Fuel Process. Technol. 211 (2021) 106599, doi: 10.1016/j.fuproc.2020.106599. [15] Z. Cao A. Duan Z. Zhao J. Li Y. Wei G. Jiang J. Liu A simple two-step method to synthesize the well-ordered mesoporous composite Ti-FDU-12 and its application in the hydrodesulfurization of DBT and 4,6-DMDBT J. Mater. Chem. A 2 2014 19738 19749 10.1039/c4ta03691c Z. Cao, A. Duan, Z. Zhao, J. Li, Y. Wei, G. Jiang, J. Liu, A simple two-step method to synthesize the well-ordered mesoporous composite Ti-FDU-12 and its application in the hydrodesulfurization of DBT and 4,6-DMDBT, J. Mater. Chem. A 2 (2014) 19738-19749, doi: 10.1039/c4ta03691c. [16] K. Yu W.-M. Kong Z. Zhao A.-J. Duan L. Kong X.-L. Wang Al-modified yolk-shell silica particle-supported NiMo catalysts for ultradeep hydrodesulfurization of dibenzothiophene and 4,6-dimethyldibenzothiophene: efficient accessibility of active sites and suitable acidity Petro. Sci. 21 2024 654 666 10.1016/j.petsci.2023.08.007 K. Yu, W.-M. Kong, Z. Zhao, A.-J. Duan, L. Kong, X.-L. Wang, Al-modified yolk-shell silica particle-supported NiMo catalysts for ultradeep hydrodesulfurization of dibenzothiophene and 4,6-dimethyldibenzothiophene: Efficient accessibility of active sites and suitable acidity, Petro. Sci. 21 (2024) 654-666, doi: 10.1016/j.petsci.2023.08.007. [17] J. Jiao J. Fu Y. Wei Z. Zhao A. Duan C. Xu J. Li H. Song P. Zheng X. Wang Y. Yang Y. Liu Al-modified dendritic mesoporous silica nanospheres-supported NiMo catalysts for the hydrodesulfurization of dibenzothiophene: efficient accessibility of active sites and suitable metal–support interaction J. Catal. 356 2017 269 282 10.1016/j.jcat.2017.10.003 J. Jiao, J. Fu, Y. Wei, Z. Zhao, A. Duan, C. Xu, J. Li, H. Song, P. Zheng, X. Wang, Y. Yang, Y. Liu, Al-modified dendritic mesoporous silica nanospheres-supported NiMo catalysts for the hydrodesulfurization of dibenzothiophene: Efficient accessibility of active sites and suitable metal–support interaction, J. Catal. 356 (2017) 269-282, doi: 10.1016/j.jcat.2017.10.003. [18] D. Valencia T. Klimova Citric acid loading for MoS2-based catalysts supported on SBA-15. New catalytic materials with high hydrogenolysis ability in hydrodesulfurization Appl. Catal. B-Environ. Energy 129 2013 137 145 10.1016/j.apcatb.2012.09.006 D. Valencia, T. Klimova, Citric acid loading for MoS2-based catalysts supported on SBA-15. New catalytic materials with high hydrogenolysis ability in hydrodesulfurization, Appl. Catal. B-Environ. Energy 129 (2013) 137-145, https://dx.doi.org/10.1016/j.apcatb.2012.09.006. [19] H. Wu A. Duan Z. Zhao T. Li R. Prins X. Zhou Synthesis of NiMo hydrodesulfurization catalyst supported on a composite of nano-sized ZSM-5 zeolite enwrapped with mesoporous KIT-6 material and its high isomerization selectivity J. Catal. 317 2014 303 317 10.1016/j.jcat.2014.07.002 H. Wu, A. Duan, Z. Zhao, T. Li, R. Prins, X. Zhou, Synthesis of NiMo hydrodesulfurization catalyst supported on a composite of nano-sized ZSM-5 zeolite enwrapped with mesoporous KIT-6 material and its high isomerization selectivity, J. Catal. 317 (2014) 303-317, https://dx.doi.org/10.1016/j.jcat.2014.07.002. [20] Q. Yu L. Zhang R. Guo J. Sun W. Fu T. Tang T. Tang Catalytic performance of CoMo catalysts supported on mesoporous ZSM-5 zeolite-alumina composites in the hydrodesulfurization of 4,6-dimethyldibenzothiophene Fuel Process. Technol. 159 2017 76 87 10.1016/j.fuproc.2017.01.023 Q. Yu, L. Zhang, R. Guo, J. Sun, W. Fu, T. Tang, T. Tang, Catalytic performance of CoMo catalysts supported on mesoporous ZSM-5 zeolite-alumina composites in the hydrodesulfurization of 4,6-dimethyldibenzothiophene, Fuel Process. Technol. 159 (2017) 76-87, https://dx.doi.org/10.1016/j.fuproc.2017.01.023. [21] R. Palos A. Gutiérrez J.M. Arandes J. Bilbao Catalyst used in fluid catalytic cracking (FCC) unit as a support of NiMoP catalyst for light cycle oil hydroprocessing Fuel 216 2018 142 152 10.1016/j.fuel.2017.11.148 R. Palos, A. Gutiérrez, J.M. Arandes, J. Bilbao, Catalyst used in fluid catalytic cracking (FCC) unit as a support of NiMoP catalyst for light cycle oil hydroprocessing, Fuel 216 (2018) 142-152, doi: 10.1016/j.fuel.2017.11.148. [22] L. Yang C. Peng X. Fang Z. Cheng Z. Zhou Hierarchically macro-mesoporous Ni-Mo/Al2O3 catalysts for hydrodesulfurization of dibenzothiophene Catal. Commun. 121 2019 68 72 10.1016/j.catcom.2018.12.020 L. Yang, C. Peng, X. Fang, Z. Cheng, Z. Zhou, Hierarchically macro-mesoporous Ni-Mo/Al2O3 catalysts for hydrodesulfurization of dibenzothiophene, Catal. Commun. 121 (2019) 68-72, doi: 10.1016/j.catcom.2018.12.020. [23] J.C.V.J.S. Beck, f W. J. Roth, M. E. Leonowicz, C. T. Kresge, K. D. Schmitt/ C. T-W. Chu, D. H. Olson, E. W. Sheppard, S. B. McCullen, J. B. Higgins, J. L. Schlenker, a new family of mesoporous molecular sieves prepared with liquid crystal templates, JACS, 114 (1992) 10834–10843. doi: 10.1021/ja00053a020. [24] M.K.M. Jaroniec Application of large pore MCM-41 molecular sieves to improve pore size analysis using nitrogen adsorption measurements Langmuir 13 1997 6267 6273 10.1021/la970776m M.K. M. Jaroniec, Application of Large Pore MCM-41 Molecular Sieves To Improve Pore Size Analysis Using Nitrogen Adsorption Measurements, Langmuir 13 (1997) 6267-6273, doi: 10.1021/la970776m. [25] X. Wang Z. Zhao P. Zheng Z. Chen A. Duan C. Xu J. Jiao H. Zhang Z. Cao B. Ge Synthesis of NiMo catalysts supported on mesoporous Al2O3 with different crystal forms and superior catalytic performance for the hydrodesulfurization of dibenzothiophene and 4,6-dimethyldibenzothiophene J. Catal. 344 2016 680 691 10.1016/j.jcat.2016.10.016 X. Wang, Z. Zhao, P. Zheng, Z. Chen, A. Duan, C. Xu, J. Jiao, H. Zhang, Z. Cao, B. Ge, Synthesis of NiMo catalysts supported on mesoporous Al2O3 with different crystal forms and superior catalytic performance for the hydrodesulfurization of dibenzothiophene and 4,6-dimethyldibenzothiophene, J. Catal. 344 (2016) 680-691, https://dx.doi.org/10.1016/j.jcat.2016.10.016. [26] C. Xiao P. Zheng Y. Shi D. Hu J. Mei G. Wang A. Duan G. Jiang J. Liu Phosphoric acid modified Al-TUD-1 material to enhance hydrodesulfurization activities of dibenzothiophene and FCC diesel Catal. Today 374 2021 154 161 10.1016/j.cattod.2020.12.026 C. Xiao, P. Zheng, Y. Shi, D. Hu, J. Mei, G. Wang, A. Duan, G. Jiang, J. Liu, Phosphoric acid modified Al-TUD-1 material to enhance hydrodesulfurization activities of dibenzothiophene and FCC diesel, Catal. Today 374 (2021) 154-161, doi: 10.1016/j.cattod.2020.12.026. [27] M. Li H. Li F. Jiang Y. Chu H. Nie The relation between morphology of (Co)MoS2 phases and selective hydrodesulfurization for CoMo catalysts Catal. Today 149 2010 35 39 10.1016/j.cattod.2009.03.017 M. Li, H. Li, F. Jiang, Y. Chu, H. Nie, The relation between morphology of (Co)MoS2 phases and selective hydrodesulfurization for CoMo catalysts, Catal. Today 149 (2010) 35-39, doi: 10.1016/j.cattod.2009.03.017. [28] C. Liu J. Mei G. Wang J. Chang Q. Meng D. Hu C. Xiao Y. Shi A. Duan Y. Gong Tailoring NiMoS active phases with high hydrodesulfurization activity through facilely synthesized supports with tunable mesostructure and morphology J. Catal. 387 2020 170 185 10.1016/j.jcat.2020.04.012 C. Liu, J. Mei, G. Wang, J. Chang, Q. Meng, D. Hu, C. Xiao, Y. Shi, A. Duan, Y. Gong, Tailoring NiMoS active phases with high hydrodesulfurization activity through facilely synthesized supports with tunable mesostructure and morphology, J. Catal. 387 (2020) 170-185, doi: 10.1016/j.jcat.2020.04.012. [29] B. Wang Z. Chen T. Jiang J. Yu H. Yang A. Duan C. Xu Comparison of the intraparticle diffusion of DBT and 4,6-DMDBT in HDS over different mesostructured silica-based catalysts Fuel 324 2022 124516 10.1016/j.fuel.2022.124516 B. Wang, Z. Chen, T. Jiang, J. Yu, H. Yang, A. Duan, C. Xu, Comparison of the intraparticle diffusion of DBT and 4,6-DMDBT in HDS over different mesostructured silica-based catalysts, Fuel 324 (2022) 124516, doi: 10.1016/j.fuel.2022.124516. [30] Z.M. El-Deeb W.A. Aboutaleb R.S. Mohamed A.S. Dhmees A.I. Ahmed Gasoline and diesel-like fuel production via hydrocracking of hydrotreated tire pyrolytic oil over Ni-W/MCM-41 derived from blast furnace slag J. Energy Inst. 103 2022 84 93 10.1016/j.joei.2022.05.013 Z.M. El-Deeb, W.A. Aboutaleb, R.S. Mohamed, A.S. Dhmees, A.I. Ahmed, Gasoline and diesel-like fuel production via hydrocracking of hydrotreated tire pyrolytic oil over Ni-W/MCM-41 derived from blast furnace slag, J. Energy Inst. 103 (2022) 84-93, doi: 10.1016/j.joei.2022.05.013. [31] F.J. Méndez O.E. Franco-López X. Bokhimi D.A. Solís-Casados L. Escobar-Alarcón T.E. Klimova Dibenzothiophene hydrodesulfurization with NiMo and CoMo catalysts supported on niobium-modified MCM-41 Appl. Catal. B-Environ. Energy 219 2017 479 491 10.1016/j.apcatb.2017.07.079 F.J. Méndez, O.E. Franco-López, X. Bokhimi, D.A. Solís-Casados, L. Escobar-Alarcón, T.E. Klimova, Dibenzothiophene hydrodesulfurization with NiMo and CoMo catalysts supported on niobium-modified MCM-41, Appl. Catal. B-Environ. Energy 219 (2017) 479-491, https://dx.doi.org/10.1016/j.apcatb.2017.07.079. [32] R. Locus D. Verboekend R. Zhong K. Houthoofd T. Jaumann S. Oswald L. Giebeler G. Baron B.F. Sels Enhanced acidity and accessibility in Al-MCM-41 through aluminum activation Chem. Mater. 28 2016 7731 7743 10.1021/acs.chemmater.6b02874 R. Locus, D. Verboekend, R. Zhong, K. Houthoofd, T. Jaumann, S. Oswald, L. Giebeler, G. Baron, B.F. Sels, Enhanced Acidity and Accessibility in Al-MCM-41 through Aluminum Activation, Chem. Mater. 28 (2016) 7731-7743, https://dx.doi.org/10.1021/acs.chemmater.6b02874. [33] P.A. Nikulshin D.I. Ishutenko A.A. Mozhaev K.I. Maslakov A.A. Pimerzin Effects of composition and morphology of active phase of CoMo/Al2O3 catalysts prepared using Co2Mo10–heteropolyacid and chelating agents on their catalytic properties in HDS and HYD reactions J. Catal. 312 2014 152 169 10.1016/j.jcat.2014.01.014 P.A. Nikulshin, D.I. Ishutenko, A.A. Mozhaev, K.I. Maslakov, A.A. Pimerzin, Effects of composition and morphology of active phase of CoMo/Al2O3 catalysts prepared using Co2Mo10–heteropolyacid and chelating agents on their catalytic properties in HDS and HYD reactions, J. Catal. 312 (2014) 152-169, https://dx.doi.org/10.1016/j.jcat.2014.01.014. [34] P. Biswas P. Narayanasarma C.M. Kotikalapudi A.K. Dalai J. Adjaye Characterization and activity of ZrO2 doped SBA-15 supported NiMo catalysts for HDS and HDN of bitumen derived heavy gas oil Ind. Eng. Chem. Res. 50 2011 7882 7895 10.1021/ie102429j P. Biswas, P. Narayanasarma, C.M. Kotikalapudi, A.K. Dalai, J. Adjaye, Characterization and Activity of ZrO2 Doped SBA-15 Supported NiMo Catalysts for HDS and HDN of Bitumen Derived Heavy Gas Oil, Ind. Eng. Chem. Res. 50 (2011) 7882-7895, doi: 10.1021/ie102429j. [35] X.-L. Wang Z. Zhao Z.-T. Chen J.-M. Li A.-J. Duan C.-M. Xu D.-W. Gao Z.-K. Cao P. Zheng J.-Y. Fan Effect of synthesis temperature on structure-activity-relationship over NiMo/γ-Al2O3 catalysts for the hydrodesulfurization of DBT and 4,6-DMDBT Fuel Process. Technol. 161 2017 52 61 10.1016/j.fuproc.2017.03.003 X.-l. Wang, Z. Zhao, Z.-t. Chen, J.-m. Li, A.-j. Duan, C.-m. Xu, D.-w. Gao, Z.-k. Cao, P. Zheng, J.-y. Fan, Effect of synthesis temperature on structure-activity-relationship over NiMo/γ-Al2O3 catalysts for the hydrodesulfurization of DBT and 4,6-DMDBT, Fuel Process. Technol. 161 (2017) 52-61, doi: 10.1016/j.fuproc.2017.03.003. [36] H. Wu A. Duan Z. Zhao D. Qi J. Li B. Liu G. Jiang J. Liu Y. Wei X. Zhang Preparation of NiMo/KIT-6 hydrodesulfurization catalysts with tunable sulfidation and dispersion degrees of active phase by addition of citric acid as chelating agent Fuel 130 2014 203 210 10.1016/j.fuel.2014.04.038 H. Wu, A. Duan, Z. Zhao, D. Qi, J. Li, B. Liu, G. Jiang, J. Liu, Y. Wei, X. Zhang, Preparation of NiMo/KIT-6 hydrodesulfurization catalysts with tunable sulfidation and dispersion degrees of active phase by addition of citric acid as chelating agent, Fuel 130 (2014) 203-210, doi: 10.1016/j.fuel.2014.04.038. [37] T.E. Klimova D. Valencia J.A. Mendoza-Nieto P. Hernández-Hipólito Behavior of NiMo/SBA-15 catalysts prepared with citric acid in simultaneous hydrodesulfurization of dibenzothiophene and 4,6-dimethyldibenzothiophene J. Catal. 304 2013 29 46 10.1016/j.jcat.2013.03.027 T.E. Klimova, D. Valencia, J.A. Mendoza-Nieto, P. Hernández-Hipólito, Behavior of NiMo/SBA-15 catalysts prepared with citric acid in simultaneous hydrodesulfurization of dibenzothiophene and 4,6-dimethyldibenzothiophene, J. Catal. 304 (2013) 29-46, doi: 10.1016/j.jcat.2013.03.027. [38] Y. Zou C. Xiao D. Li A. Wang D. Gao H. Shang C. Wang A. Duan C. Xu X. Wang Dendritic micro-mesoporous composites via nano-assembly strategy towards high-efficiency catalysts for hydrodesulfurization of dibenzothiophenes J. Catal. 427 2023 115092 10.1016/j.jcat.2023.08.008 Y. Zou, C. Xiao, D. Li, A. Wang, D. Gao, H. Shang, C. Wang, A. Duan, C. Xu, X. Wang, Dendritic micro-mesoporous composites via nano-assembly strategy towards high-efficiency catalysts for hydrodesulfurization of dibenzothiophenes, J. Catal. 427 (2023) 115092, doi: 10.1016/j.jcat.2023.08.008. [39] C. Zhang W. Bao C. Yue F. Sun Y. Xu D. Sun Y. Lu The regulatory role of cysteine in active phase construction of polyoxometalate-based hydrodesulfurization catalysts: reduction, chelation, and dispersion Chem. Eng. Sci. 296 2024 120234 10.1016/j.ces.2024.120234 C. Zhang, W. Bao, C. Yue, F. Sun, Y. Xu, D. Sun, Y. Lu, The regulatory role of cysteine in active phase construction of polyoxometalate-based hydrodesulfurization catalysts: Reduction, chelation, and dispersion, Chem. Eng. Sci. 296 (2024) 120234, doi: 10.1016/j.ces.2024.120234. [40] W. Zhou L. Yang L. Liu Z. Chen A. Zhou Y. Zhang X. He F. Shi Z. Zhao Synthesis of novel NiMo catalysts supported on highly ordered TiO2-Al2O3 composites and their superior catalytic performance for 4,6-dimethyldibenzothiophene hydrodesulfurization Appl. Catal. B-Environ. Energy 268 2020 118428 10.1016/j.apcatb.2019.118428 W. Zhou, L. Yang, L. Liu, Z. Chen, A. Zhou, Y. Zhang, X. He, F. Shi, Z. Zhao, Synthesis of novel NiMo catalysts supported on highly ordered TiO2-Al2O3 composites and their superior catalytic performance for 4,6-dimethyldibenzothiophene hydrodesulfurization, Appl. Catal. B-Environ. Energy 268 (2020) 118428, doi: 10.1016/j.apcatb.2019.118428. [41] W. Han H. Nie X. Long M. Li Q. Yang D. Li Effects of the support Brønsted acidity on the hydrodesulfurization and hydrodenitrogention activity of sulfided NiMo/Al2O3 catalysts Catal. Today 292 2017 58 66 10.1016/j.cattod.2016.11.049 W. Han, H. Nie, X. Long, M. Li, Q. Yang, D. Li, Effects of the support Brønsted acidity on the hydrodesulfurization and hydrodenitrogention activity of sulfided NiMo/Al2O3 catalysts, Catal. Today 292 (2017) 58-66, doi: 10.1016/j.cattod.2016.11.049. [42] D. Zhang X.-M. Liu Y.-X. Liu Z.-F. Yan Impact of γ-alumina pore structure on structure and performance of Ni-Mo/γ-Al2O3 catalyst for 4,6-dimethyldibenzothiophene desulfurization Micropor. Mesopor. Mat. 310 2021 110637 10.1016/j.micromeso.2020.110637 D. Zhang, X.-M. Liu, Y.-X. Liu, Z.-F. Yan, Impact of γ-alumina pore structure on structure and performance of Ni-Mo/γ-Al2O3 catalyst for 4,6-dimethyldibenzothiophene desulfurization, Micropor. Mesopor. Mat. 310 (2021) 110637, doi: 10.1016/j.micromeso.2020.110637. [43] P. Zhang F. Mu Y. Zhou Y. Long Q. Wei X. Liu Q. You Y. Shan W. Zhou Synthesis of highly ordered TiO2-Al2O3 and catalytic performance of its supported NiMo for HDS of 4, 6-dimethyldibenzothiophene Catal. Today 423 2023 112716 10.1016/j.cattod.2020.03.003 P. Zhang, F. Mu, Y. Zhou, Y. Long, Q. Wei, X. Liu, Q. You, Y. Shan, W. Zhou, Synthesis of highly ordered TiO2-Al2O3 and catalytic performance of its supported NiMo for HDS of 4, 6-dimethyldibenzothiophene, Catal. Today 423 (2023) 112716, doi: 10.1016/j.cattod.2020.03.003. [44] F. Besenbacher M. Brorson B.S. Clausen S. Helveg B. Hinnemann J. Kibsgaard J.V. Lauritsen P.G. Moses J.K. Nørskov H. Topsøe Recent STM, DFT and HAADF-STEM studies of sulfide-based hydrotreating catalysts: Insight into mechanistic, structural and particle size effects Catal. Today 130 2008 86 96 10.1016/j.cattod.2007.08.009 F. Besenbacher, M. Brorson, B.S. Clausen, S. Helveg, B. Hinnemann, J. Kibsgaard, J.V. Lauritsen, P.G. Moses, J.K. Nørskov, H. Topsøe, Recent STM, DFT and HAADF-STEM studies of sulfide-based hydrotreating catalysts: Insight into mechanistic, structural and particle size effects, Catal. Today 130 (2008) 86-96, doi: 10.1016/j.cattod.2007.08.009. [45] D. Hu Y. Li J. Mei G. Wang C. Xiao C. Liu Q. Meng H. Li S. Fu A. Duan High-dispersed Ni-Mo-S active phases within hierarchical pore materials by introducing the cationic protective shell during the impregnation process for hydrodesulfurization Fuel 263 2020 116701 10.1016/j.fuel.2019.116701 D. Hu, Y. Li, J. Mei, G. Wang, C. Xiao, C. Liu, Q. Meng, H. Li, S. Fu, A. Duan, High-dispersed Ni-Mo-S active phases within hierarchical pore materials by introducing the cationic protective shell during the impregnation process for hydrodesulfurization, Fuel 263 (2020) 116701, doi: 10.1016/j.fuel.2019.116701. [46] J.-L. Mei Y. Shi C.-K. Xiao A.-C. Wang A.-J. Duan X.-L. Wang Hierarchically porous Beta/SBA-16 with different silica-alumina ratios and the hydrodesulfurization performances of DBT and 4,6-DMDBT Petrol. Sci. 19 2022 375 386 10.1016/j.petsci.2021.10.003 J.-L. Mei, Y. Shi, C.-K. Xiao, A.-C. Wang, A.-J. Duan, X.-L. Wang, Hierarchically porous Beta/SBA-16 with different silica-alumina ratios and the hydrodesulfurization performances of DBT and 4,6-DMDBT, Petrol. Sci. 19 (2022) 375-386, doi: 10.1016/j.petsci.2021.10.003. [47] D. Zhang A. Duan Z. Zhao C. Xu Synthesis, characterization, and catalytic performance of NiMo catalysts supported on hierarchically porous Beta-KIT-6 material in the hydrodesulfurization of dibenzothiophene J. Catal. 274 2010 273 286 10.1016/j.jcat.2010.07.012 D. Zhang, A. Duan, Z. Zhao, C. Xu, Synthesis, characterization, and catalytic performance of NiMo catalysts supported on hierarchically porous Beta-KIT-6 material in the hydrodesulfurization of dibenzothiophene, J. Catal. 274 (2010) 273-286, doi: 10.1016/j.jcat.2010.07.012. [48] Y. Wang L. Kou J. Lu D. Han Z. Zhang H. Sun C. Dai Y. Mao Z. Yan One-step synthesis of egg-tray-like layered ordered macro-mesoporous SiO2-Al2O3 composites for enhanced hydrodesulfurization performance Micropor. Mesopor. Mat. 22 2021 111131 10.1016/j.micromeso.2021.111131 Y. Wang, L. Kou, J. Lu, D. Han, Z. Zhang, H. Sun, C. Dai, Y. Mao, Z. Yan, One-step synthesis of egg-tray-like layered ordered macro-mesoporous SiO2-Al2O3 composites for enhanced hydrodesulfurization performance, Micropor. Mesopor. Mat. 22 (2021) 111131, doi: 10.1016/j.micromeso.2021.111131. [49] Y. Liu B. Cheng K.-K. Wang G.-P. Ling J. Cai C.-L. Song G.-R. Han Study of Raman spectra for γ-Al2O3 models by using first-principles method Solid State Commun. 178 2014 16 22 10.1016/j.ssc.2013.09.030 Y. Liu, B. Cheng, K.-K. Wang, G.-P. Ling, J. Cai, C.-L. Song, G.-R. Han, Study of Raman spectra for γ-Al2O3 models by using first-principles method, Solid State Commun. 178 (2014) 16-22, doi: 10.1016/j.ssc.2013.09.030. [50] C.-K. Xiao Y.-T. Zou D.-Z. Li E.-H. Wang A.-C. Wang D.-W. Gao A.-J. Duan P. Zheng X.-L. Wang Optimization of dendritic TS-1/Silica micro–mesoporous composites for efficient hydrodesulfurization of dibenzothiophene and 4,6-dimethyldibenzothiophene Petro. Sci. 20 2023 2521 2530 10.1016/j.petsci.2023.07.004 C.-K. Xiao, Y.-T. Zou, D.-Z. Li, E.-H. Wang, A.-C. Wang, D.-W. Gao, A.-J. Duan, P. Zheng, X.-L. Wang, Optimization of dendritic TS-1/Silica micro–mesoporous composites for efficient hydrodesulfurization of dibenzothiophene and 4,6-dimethyldibenzothiophene, Petro. Sci. 20 (2023) 2521-2530, doi: 10.1016/j.petsci.2023.07.004. [51] L. Zhang Q. Dai W. Fu T. Tang P. Dong M. He Q. Chen CoMo catalyst on zeolite TS-1 nanorod assemblies with high activity in the hydrodesulfurization of 4,6-dimethyldibenzothiophene J. Catal. 359 2018 130 142 10.1016/j.jcat.2017.12.015 L. Zhang, Q. Dai, W. Fu, T. Tang, P. Dong, M. He, Q. Chen, CoMo catalyst on zeolite TS-1 nanorod assemblies with high activity in the hydrodesulfurization of 4,6-dimethyldibenzothiophene, J. Catal. 359 (2018) 130-142, doi: 10.1016/j.jcat.2017.12.015. [52] S. Ding A. Li S. Jiang Y. Zhou Q. Wei W. Zhou Y. Huang Q. Yang T. Fan Niobium modification effects on hydrodesulfurization of 4,6-DMDBT catalyzed on Ni-Mo-S active sites: a combination of experiments and theoretical study Fuel 237 2019 429 441 10.1016/j.fuel.2018.10.002 S. Ding, A. Li, S. Jiang, Y. Zhou, Q. Wei, W. Zhou, Y. Huang, Q. Yang, T. Fan, Niobium modification effects on hydrodesulfurization of 4,6-DMDBT catalyzed on Ni-Mo-S active sites: A combination of experiments and theoretical study, Fuel 237 (2019) 429-441, doi: 10.1016/j.fuel.2018.10.002. [53] K. Kobayashi M. Nagai Active sites of sulfided NiMo/Al2O3 catalysts for 4,6-dimethyldibenzothiophene hydrodesulfurization-effects of Ni and Mo components, sulfidation, citric acid and phosphate addition Catal. Today 292 2017 74 83 10.1016/j.cattod.2017.01.040 K. Kobayashi, M. Nagai, Active sites of sulfided NiMo/Al2O3 catalysts for 4,6-dimethyldibenzothiophene hydrodesulfurization-effects of Ni and Mo components, sulfidation, citric acid and phosphate addition, Catal. Today 292 (2017) 74-83, doi: 10.1016/j.cattod.2017.01.040. [54] K. Yu W. Kong Z. Zhao A. Duan L. Kong X. Wang Hydrodesulfurization of dibenzothiophene and 4,6-dimethyldibenzothiophene over NiMo supported on yolk-shell silica catalysts with adjustable shell thickness and yolk size J. Catal. 410 2022 128 143 10.1016/j.jcat.2022.04.012 K. Yu, W. Kong, Z. Zhao, A. Duan, L. Kong, X. Wang, Hydrodesulfurization of dibenzothiophene and 4,6-dimethyldibenzothiophene over NiMo supported on yolk-shell silica catalysts with adjustable shell thickness and yolk size, J. Catal. 410 (2022) 128-143, doi: 10.1016/j.jcat.2022.04.012. [55] J. Ramírez D. Romualdo-Escobar P. Castillo-Villalón A. Gutiérrez-Alejandre Improved NiMoSA catalysts: Analysis of EDTA post-treatment in the HDS of 4,6-DMDBT Catal. Today 349 2020 168 177 10.1016/j.cattod.2018.04.062 J. Ramírez, D. Romualdo-Escobar, P. Castillo-Villalón, A. Gutiérrez-Alejandre, Improved NiMoSA catalysts: Analysis of EDTA post-treatment in the HDS of 4,6-DMDBT, Catal. Today 349 (2020) 168-177, doi: 10.1016/j.cattod.2018.04.062. [56] Y. Wang B. Shen J. Li B. Feng X. Li S. Ren Q. Guo Interaction of coupled titanium and phosphorous on USY to tune hydrodesulfurization of 4,6-DMDBT and FCC LCO over NiW catalyst Fuel Process. Technol. 128 2014 166 175 10.1016/j.fuproc.2014.07.019 Y. Wang, B. Shen, J. Li, B. Feng, X. Li, S. Ren, Q. Guo, Interaction of coupled titanium and phosphorous on USY to tune hydrodesulfurization of 4,6-DMDBT and FCC LCO over NiW catalyst, Fuel Process. Technol. 128 (2014) 166-175, doi: 10.1016/j.fuproc.2014.07.019. [57] K. Na S. Alayoglu R. Ye G.A. Somorjai Effect of acidic properties of mesoporous zeolites supporting Pt nanoparticles on hydrogenative conversion of methylcyclopentane J. Am. Chem. Soc. 136 2014 17207 17212 10.1021/ja509273h K. Na, S. Alayoglu, R. Ye, G.A. Somorjai, Effect of Acidic Properties of Mesoporous Zeolites Supporting Pt Nanoparticles on Hydrogenative Conversion of Methylcyclopentane, J. Am. Chem. Soc. 136 (2014) 17207-17212, doi: 10.1021/ja509273h. [58] J.V. Lauritsen F. Besenbacher Atom-resolved scanning tunneling microscopy investigations of molecular adsorption on MoS2 and CoMoS hydrodesulfurization catalysts J. Catal. 328 2015 49 58 10.1016/j.jcat.2014.12.034 J.V. Lauritsen, F. Besenbacher, Atom-resolved scanning tunneling microscopy investigations of molecular adsorption on MoS2 and CoMoS hydrodesulfurization catalysts, J. Catal. 328 (2015) 49-58, doi: 10.1016/j.jcat.2014.12.034. [59] W. Zhou F. Fan Z. Chen A. Zhou Y. Zhang F. Yao A DFT investigation on the hydrodesulfurization mechanism of 4,6-dimethyldibenzothiophene over different Ni-Mo-S active sites via different direct desulfurization pathways Fuel 308 2022 121971 10.1016/j.fuel.2021.121971 W. Zhou, F. Fan, Z. Chen, A. Zhou, Y. Zhang, F. Yao, A DFT investigation on the hydrodesulfurization mechanism of 4,6-dimethyldibenzothiophene over different Ni-Mo-S active sites via different direct desulfurization pathways, Fuel 308 (2022) 121971, doi: 10.1016/j.fuel.2021.121971.",
      "scopus-id": "85206891482",
      "coredata": {
        "eid": "1-s2.0-S0021951724005128",
        "dc:description": "In this research, a bimodal mesoporous AlMCM-41 (B-AM41) material was prepared and applied to support NiMo catalysts for the hydrodesulfurization (HDS) of 4,6-dimethyldibenzothiophene. Additionally, catalysts supported on smaller and larger single-pore AlMCM-41 (S-AM41 and L-AM41) were also prepared as reference catalysts. Detailed characterizations show that the proportion, stacking degree, and length of the MoS2 active phase on the different catalysts are distinct. As a result, HDS evaluation indicates that the NiMo/B-AM41 catalyst exhibited better catalytic activity with a reaction rate constant of 10.4 × 10−8 mol g−1 s−1 and a turnover frequency of 7.0 × 10−4 s−1, significantly surpassing the S-AM41 and L-AM41 supported catalysts. The superior activity of the NiMo/B-AM41 catalyst can be attributed to a high sulfidation degree that provides sufficient highly dispersed type Ⅱ MoS2 phases with minimal stacking and moderate slab length. Moreover, the bimodal mesoporous structure promotes the diffusion of 4,6-DMDBT and benefits its contact with active sites.",
        "openArchiveArticle": "false",
        "prism:coverDate": "2024-12-31",
        "openaccessUserLicense": null,
        "prism:aggregationType": "Journal",
        "prism:url": "https://api.elsevier.com/content/article/pii/S0021951724005128",
        "dc:creator": [
          {
            "@_fa": "true",
            "$": "Zhang, Hao"
          },
          {
            "@_fa": "true",
            "$": "Zhang, Qing"
          },
          {
            "@_fa": "true",
            "$": "Qian, Guang-Ren"
          },
          {
            "@_fa": "true",
            "$": "Liu, Hong"
          },
          {
            "@_fa": "true",
            "$": "Yue, Yang"
          }
        ],
        "link": [
          {
            "@_fa": "true",
            "@rel": "self",
            "@href": "https://api.elsevier.com/content/article/pii/S0021951724005128"
          },
          {
            "@_fa": "true",
            "@rel": "scidir",
            "@href": "https://www.sciencedirect.com/science/article/pii/S0021951724005128"
          }
        ],
        "dc:format": "application/json",
        "openaccessType": null,
        "pii": "S0021-9517(24)00512-8",
        "prism:volume": "440",
        "articleNumber": "115799",
        "prism:publisher": "Elsevier Inc. All rights are reserved, including those for text and data mining, AI training, and similar technologies.",
        "dc:title": "Bimodal mesoporous AlMCM-41 supported NiMo catalysts for efficient hydrodesulfurization of 4,6-dimethyldibenzothiophene",
        "prism:copyright": "© 2024 Elsevier Inc. All rights are reserved, including those for text and data mining, AI training, and similar technologies.",
        "openaccess": "0",
        "prism:issn": "00219517",
        "dcterms:subject": [
          {
            "@_fa": "true",
            "$": "Bimodal mesoporous AlMCM-41"
          },
          {
            "@_fa": "true",
            "$": "NiMo catalysts"
          },
          {
            "@_fa": "true",
            "$": "Hydrodesulfurization"
          },
          {
            "@_fa": "true",
            "$": "Dispersed MoS2 phase"
          }
        ],
        "openaccessArticle": "false",
        "prism:publicationName": "Journal of Catalysis",
        "openaccessSponsorType": null,
        "prism:pageRange": "115799",
        "pubType": "fla",
        "prism:coverDisplayDate": "December 2024",
        "prism:doi": "10.1016/j.jcat.2024.115799",
        "prism:startingPage": "115799",
        "dc:identifier": "doi:10.1016/j.jcat.2024.115799",
        "openaccessSponsorName": null
      },
      "objects": {
        "object": [
          {
            "@category": "standard",
            "@height": "211",
            "@width": "761",
            "@_fa": "true",
            "$": "https://api.elsevier.com/content/object/eid/1-s2.0-S0021951724005128-gr7.jpg?httpAccept=%2A%2F%2A",
            "@multimediatype": "JPEG image file",
            "@type": "IMAGE-DOWNSAMPLED",
            "@size": "46820",
            "@ref": "gr7",
            "@mimetype": "image/jpeg"
          },
          {
            "@category": "standard",
            "@height": "295",
            "@width": "383",
            "@_fa": "true",
            "$": "https://api.elsevier.com/content/object/eid/1-s2.0-S0021951724005128-gr8.jpg?httpAccept=%2A%2F%2A",
            "@multimediatype": "JPEG image file",
            "@type": "IMAGE-DOWNSAMPLED",
            "@size": "28839",
            "@ref": "gr8",
            "@mimetype": "image/jpeg"
          },
          {
            "@category": "standard",
            "@height": "219",
            "@width": "689",
            "@_fa": "true",
            "$": "https://api.elsevier.com/content/object/eid/1-s2.0-S0021951724005128-gr5.jpg?httpAccept=%2A%2F%2A",
            "@multimediatype": "JPEG image file",
            "@type": "IMAGE-DOWNSAMPLED",
            "@size": "46754",
            "@ref": "gr5",
            "@mimetype": "image/jpeg"
          },
          {
            "@category": "standard",
            "@height": "565",
            "@width": "645",
            "@_fa": "true",
            "$": "https://api.elsevier.com/content/object/eid/1-s2.0-S0021951724005128-gr6.jpg?httpAccept=%2A%2F%2A",
            "@multimediatype": "JPEG image file",
            "@type": "IMAGE-DOWNSAMPLED",
            "@size": "111723",
            "@ref": "gr6",
            "@mimetype": "image/jpeg"
          },
          {
            "@category": "standard",
            "@height": "201",
            "@width": "645",
            "@_fa": "true",
            "$": "https://api.elsevier.com/content/object/eid/1-s2.0-S0021951724005128-gr9.jpg?httpAccept=%2A%2F%2A",
            "@multimediatype": "JPEG image file",
            "@type": "IMAGE-DOWNSAMPLED",
            "@size": "56160",
            "@ref": "gr9",
            "@mimetype": "image/jpeg"
          },
          {
            "@category": "standard",
            "@height": "276",
            "@width": "659",
            "@_fa": "true",
            "$": "https://api.elsevier.com/content/object/eid/1-s2.0-S0021951724005128-gr3.jpg?httpAccept=%2A%2F%2A",
            "@multimediatype": "JPEG image file",
            "@type": "IMAGE-DOWNSAMPLED",
            "@size": "45942",
            "@ref": "gr3",
            "@mimetype": "image/jpeg"
          },
          {
            "@category": "standard",
            "@height": "225",
            "@width": "689",
            "@_fa": "true",
            "$": "https://api.elsevier.com/content/object/eid/1-s2.0-S0021951724005128-gr4.jpg?httpAccept=%2A%2F%2A",
            "@multimediatype": "JPEG image file",
            "@type": "IMAGE-DOWNSAMPLED",
            "@size": "49166",
            "@ref": "gr4",
            "@mimetype": "image/jpeg"
          },
          {
            "@category": "standard",
            "@height": "226",
            "@width": "791",
            "@_fa": "true",
            "$": "https://api.elsevier.com/content/object/eid/1-s2.0-S0021951724005128-gr1.jpg?httpAccept=%2A%2F%2A",
            "@multimediatype": "JPEG image file",
            "@type": "IMAGE-DOWNSAMPLED",
            "@size": "47297",
            "@ref": "gr1",
            "@mimetype": "image/jpeg"
          },
          {
            "@category": "standard",
            "@height": "374",
            "@width": "736",
            "@_fa": "true",
            "$": "https://api.elsevier.com/content/object/eid/1-s2.0-S0021951724005128-gr2.jpg?httpAccept=%2A%2F%2A",
            "@multimediatype": "JPEG image file",
            "@type": "IMAGE-DOWNSAMPLED",
            "@size": "156119",
            "@ref": "gr2",
            "@mimetype": "image/jpeg"
          },
          {
            "@category": "standard",
            "@height": "368",
            "@width": "535",
            "@_fa": "true",
            "$": "https://api.elsevier.com/content/object/eid/1-s2.0-S0021951724005128-gr10.jpg?httpAccept=%2A%2F%2A",
            "@multimediatype": "JPEG image file",
            "@type": "IMAGE-DOWNSAMPLED",
            "@size": "62555",
            "@ref": "gr10",
            "@mimetype": "image/jpeg"
          },
          {
            "@category": "standard",
            "@height": "155",
            "@width": "500",
            "@_fa": "true",
            "$": "https://api.elsevier.com/content/object/eid/1-s2.0-S0021951724005128-ga1.jpg?httpAccept=%2A%2F%2A",
            "@multimediatype": "JPEG image file",
            "@type": "IMAGE-DOWNSAMPLED",
            "@size": "34792",
            "@ref": "ga1",
            "@mimetype": "image/jpeg"
          },
          {
            "@category": "thumbnail",
            "@height": "61",
            "@width": "219",
            "@_fa": "true",
            "$": "https://api.elsevier.com/content/object/eid/1-s2.0-S0021951724005128-gr7.sml?httpAccept=%2A%2F%2A",
            "@multimediatype": "GIF image file",
            "@type": "IMAGE-THUMBNAIL",
            "@size": "5584",
            "@ref": "gr7",
            "@mimetype": "image/gif"
          },
          {
            "@category": "thumbnail",
            "@height": "164",
            "@width": "213",
            "@_fa": "true",
            "$": "https://api.elsevier.com/content/object/eid/1-s2.0-S0021951724005128-gr8.sml?httpAccept=%2A%2F%2A",
            "@multimediatype": "GIF image file",
            "@type": "IMAGE-THUMBNAIL",
            "@size": "8791",
            "@ref": "gr8",
            "@mimetype": "image/gif"
          },
          {
            "@category": "thumbnail",
            "@height": "70",
            "@width": "219",
            "@_fa": "true",
            "$": "https://api.elsevier.com/content/object/eid/1-s2.0-S0021951724005128-gr5.sml?httpAccept=%2A%2F%2A",
            "@multimediatype": "GIF image file",
            "@type": "IMAGE-THUMBNAIL",
            "@size": "7652",
            "@ref": "gr5",
            "@mimetype": "image/gif"
          },
          {
            "@category": "thumbnail",
            "@height": "164",
            "@width": "187",
            "@_fa": "true",
            "$": "https://api.elsevier.com/content/object/eid/1-s2.0-S0021951724005128-gr6.sml?httpAccept=%2A%2F%2A",
            "@multimediatype": "GIF image file",
            "@type": "IMAGE-THUMBNAIL",
            "@size": "13086",
            "@ref": "gr6",
            "@mimetype": "image/gif"
          },
          {
            "@category": "thumbnail",
            "@height": "68",
            "@width": "219",
            "@_fa": "true",
            "$": "https://api.elsevier.com/content/object/eid/1-s2.0-S0021951724005128-gr9.sml?httpAccept=%2A%2F%2A",
            "@multimediatype": "GIF image file",
            "@type": "IMAGE-THUMBNAIL",
            "@size": "10332",
            "@ref": "gr9",
            "@mimetype": "image/gif"
          },
          {
            "@category": "thumbnail",
            "@height": "92",
            "@width": "219",
            "@_fa": "true",
            "$": "https://api.elsevier.com/content/object/eid/1-s2.0-S0021951724005128-gr3.sml?httpAccept=%2A%2F%2A",
            "@multimediatype": "GIF image file",
            "@type": "IMAGE-THUMBNAIL",
            "@size": "7794",
            "@ref": "gr3",
            "@mimetype": "image/gif"
          },
          {
            "@category": "thumbnail",
            "@height": "72",
            "@width": "219",
            "@_fa": "true",
            "$": "https://api.elsevier.com/content/object/eid/1-s2.0-S0021951724005128-gr4.sml?httpAccept=%2A%2F%2A",
            "@multimediatype": "GIF image file",
            "@type": "IMAGE-THUMBNAIL",
            "@size": "7627",
            "@ref": "gr4",
            "@mimetype": "image/gif"
          },
          {
            "@category": "thumbnail",
            "@height": "63",
            "@width": "219",
            "@_fa": "true",
            "$": "https://api.elsevier.com/content/object/eid/1-s2.0-S0021951724005128-gr1.sml?httpAccept=%2A%2F%2A",
            "@multimediatype": "GIF image file",
            "@type": "IMAGE-THUMBNAIL",
            "@size": "5659",
            "@ref": "gr1",
            "@mimetype": "image/gif"
          },
          {
            "@category": "thumbnail",
            "@height": "111",
            "@width": "219",
            "@_fa": "true",
            "$": "https://api.elsevier.com/content/object/eid/1-s2.0-S0021951724005128-gr2.sml?httpAccept=%2A%2F%2A",
            "@multimediatype": "GIF image file",
            "@type": "IMAGE-THUMBNAIL",
            "@size": "18103",
            "@ref": "gr2",
            "@mimetype": "image/gif"
          },
          {
            "@category": "thumbnail",
            "@height": "151",
            "@width": "219",
            "@_fa": "true",
            "$": "https://api.elsevier.com/content/object/eid/1-s2.0-S0021951724005128-gr10.sml?httpAccept=%2A%2F%2A",
            "@multimediatype": "GIF image file",
            "@type": "IMAGE-THUMBNAIL",
            "@size": "13791",
            "@ref": "gr10",
            "@mimetype": "image/gif"
          },
          {
            "@category": "thumbnail",
            "@height": "68",
            "@width": "219",
            "@_fa": "true",
            "$": "https://api.elsevier.com/content/object/eid/1-s2.0-S0021951724005128-ga1.sml?httpAccept=%2A%2F%2A",
            "@multimediatype": "GIF image file",
            "@type": "IMAGE-THUMBNAIL",
            "@size": "10800",
            "@ref": "ga1",
            "@mimetype": "image/gif"
          },
          {
            "@category": "high",
            "@height": "933",
            "@width": "3370",
            "@_fa": "true",
            "$": "https://api.elsevier.com/content/object/eid/1-s2.0-S0021951724005128-gr7_lrg.jpg?httpAccept=%2A%2F%2A",
            "@multimediatype": "JPEG image file",
            "@type": "IMAGE-HIGH-RES",
            "@size": "298970",
            "@ref": "gr7",
            "@mimetype": "image/jpeg"
          },
          {
            "@category": "high",
            "@height": "1309",
            "@width": "1699",
            "@_fa": "true",
            "$": "https://api.elsevier.com/content/object/eid/1-s2.0-S0021951724005128-gr8_lrg.jpg?httpAccept=%2A%2F%2A",
            "@multimediatype": "JPEG image file",
            "@type": "IMAGE-HIGH-RES",
            "@size": "213381",
            "@ref": "gr8",
            "@mimetype": "image/jpeg"
          },
          {
            "@category": "high",
            "@height": "971",
            "@width": "3051",
            "@_fa": "true",
            "$": "https://api.elsevier.com/content/object/eid/1-s2.0-S0021951724005128-gr5_lrg.jpg?httpAccept=%2A%2F%2A",
            "@multimediatype": "JPEG image file",
            "@type": "IMAGE-HIGH-RES",
            "@size": "333397",
            "@ref": "gr5",
            "@mimetype": "image/jpeg"
          },
          {
            "@category": "high",
            "@height": "2502",
            "@width": "2854",
            "@_fa": "true",
            "$": "https://api.elsevier.com/content/object/eid/1-s2.0-S0021951724005128-gr6_lrg.jpg?httpAccept=%2A%2F%2A",
            "@multimediatype": "JPEG image file",
            "@type": "IMAGE-HIGH-RES",
            "@size": "1399786",
            "@ref": "gr6",
            "@mimetype": "image/jpeg"
          },
          {
            "@category": "high",
            "@height": "890",
            "@width": "2854",
            "@_fa": "true",
            "$": "https://api.elsevier.com/content/object/eid/1-s2.0-S0021951724005128-gr9_lrg.jpg?httpAccept=%2A%2F%2A",
            "@multimediatype": "JPEG image file",
            "@type": "IMAGE-HIGH-RES",
            "@size": "491951",
            "@ref": "gr9",
            "@mimetype": "image/jpeg"
          },
          {
            "@category": "high",
            "@height": "1224",
            "@width": "2919",
            "@_fa": "true",
            "$": "https://api.elsevier.com/content/object/eid/1-s2.0-S0021951724005128-gr3_lrg.jpg?httpAccept=%2A%2F%2A",
            "@multimediatype": "JPEG image file",
            "@type": "IMAGE-HIGH-RES",
            "@size": "429815",
            "@ref": "gr3",
            "@mimetype": "image/jpeg"
          },
          {
            "@category": "high",
            "@height": "997",
            "@width": "3051",
            "@_fa": "true",
            "$": "https://api.elsevier.com/content/object/eid/1-s2.0-S0021951724005128-gr4_lrg.jpg?httpAccept=%2A%2F%2A",
            "@multimediatype": "JPEG image file",
            "@type": "IMAGE-HIGH-RES",
            "@size": "347880",
            "@ref": "gr4",
            "@mimetype": "image/jpeg"
          },
          {
            "@category": "high",
            "@height": "1000",
            "@width": "3504",
            "@_fa": "true",
            "$": "https://api.elsevier.com/content/object/eid/1-s2.0-S0021951724005128-gr1_lrg.jpg?httpAccept=%2A%2F%2A",
            "@multimediatype": "JPEG image file",
            "@type": "IMAGE-HIGH-RES",
            "@size": "328657",
            "@ref": "gr1",
            "@mimetype": "image/jpeg"
          },
          {
            "@category": "high",
            "@height": "1063",
            "@width": "2093",
            "@_fa": "true",
            "$": "https://api.elsevier.com/content/object/eid/1-s2.0-S0021951724005128-gr2_lrg.jpg?httpAccept=%2A%2F%2A",
            "@multimediatype": "JPEG image file",
            "@type": "IMAGE-HIGH-RES",
            "@size": "981060",
            "@ref": "gr2",
            "@mimetype": "image/jpeg"
          },
          {
            "@category": "high",
            "@height": "1631",
            "@width": "2368",
            "@_fa": "true",
            "$": "https://api.elsevier.com/content/object/eid/1-s2.0-S0021951724005128-gr10_lrg.jpg?httpAccept=%2A%2F%2A",
            "@multimediatype": "JPEG image file",
            "@type": "IMAGE-HIGH-RES",
            "@size": "640113",
            "@ref": "gr10",
            "@mimetype": "image/jpeg"
          },
          {
            "@category": "high",
            "@height": "686",
            "@width": "2213",
            "@_fa": "true",
            "$": "https://api.elsevier.com/content/object/eid/1-s2.0-S0021951724005128-ga1_lrg.jpg?httpAccept=%2A%2F%2A",
            "@multimediatype": "JPEG image file",
            "@type": "IMAGE-HIGH-RES",
            "@size": "365386",
            "@ref": "ga1",
            "@mimetype": "image/jpeg"
          },
          {
            "@category": "standard",
            "@_fa": "true",
            "$": "https://api.elsevier.com/content/object/eid/1-s2.0-S0021951724005128-mmc1.docx?httpAccept=%2A%2F%2A",
            "@multimediatype": "Microsoft Word file",
            "@type": "APPLICATION",
            "@size": "784670",
            "@ref": "mmc1",
            "@mimetype": "application/word"
          },
          {
            "@category": "thumbnail",
            "@_fa": "true",
            "$": "https://api.elsevier.com/content/object/eid/1-s2.0-S0021951724005128-si1.svg?httpAccept=%2A%2F%2A",
            "@multimediatype": "Scalable Vector Graphics file",
            "@type": "ALTIMG",
            "@size": "17604",
            "@ref": "si1",
            "@mimetype": "image/svg+xml"
          },
          {
            "@category": "thumbnail",
            "@_fa": "true",
            "$": "https://api.elsevier.com/content/object/eid/1-s2.0-S0021951724005128-si2.svg?httpAccept=%2A%2F%2A",
            "@multimediatype": "Scalable Vector Graphics file",
            "@type": "ALTIMG",
            "@size": "28468",
            "@ref": "si2",
            "@mimetype": "image/svg+xml"
          },
          {
            "@category": "thumbnail",
            "@_fa": "true",
            "$": "https://api.elsevier.com/content/object/eid/1-s2.0-S0021951724005128-si3.svg?httpAccept=%2A%2F%2A",
            "@multimediatype": "Scalable Vector Graphics file",
            "@type": "ALTIMG",
            "@size": "13112",
            "@ref": "si3",
            "@mimetype": "image/svg+xml"
          },
          {
            "@category": "thumbnail",
            "@_fa": "true",
            "$": "https://api.elsevier.com/content/object/eid/1-s2.0-S0021951724005128-si4.svg?httpAccept=%2A%2F%2A",
            "@multimediatype": "Scalable Vector Graphics file",
            "@type": "ALTIMG",
            "@size": "12337",
            "@ref": "si4",
            "@mimetype": "image/svg+xml"
          },
          {
            "@category": "thumbnail",
            "@_fa": "true",
            "$": "https://api.elsevier.com/content/object/eid/1-s2.0-S0021951724005128-si5.svg?httpAccept=%2A%2F%2A",
            "@multimediatype": "Scalable Vector Graphics file",
            "@type": "ALTIMG",
            "@size": "12979",
            "@ref": "si5",
            "@mimetype": "image/svg+xml"
          },
          {
            "@category": "thumbnail",
            "@_fa": "true",
            "$": "https://api.elsevier.com/content/object/eid/1-s2.0-S0021951724005128-si6.svg?httpAccept=%2A%2F%2A",
            "@multimediatype": "Scalable Vector Graphics file",
            "@type": "ALTIMG",
            "@size": "11222",
            "@ref": "si6",
            "@mimetype": "image/svg+xml"
          },
          {
            "@category": "thumbnail",
            "@_fa": "true",
            "$": "https://api.elsevier.com/content/object/eid/1-s2.0-S0021951724005128-si7.svg?httpAccept=%2A%2F%2A",
            "@multimediatype": "Scalable Vector Graphics file",
            "@type": "ALTIMG",
            "@size": "12636",
            "@ref": "si7",
            "@mimetype": "image/svg+xml"
          },
          {
            "@category": "standard",
            "@_fa": "true",
            "$": "https://api.elsevier.com/content/object/eid/1-s2.0-S0021951724005128-am.pdf?httpAccept=%2A%2F%2A",
            "@multimediatype": "Acrobat PDF file",
            "@type": "AAM-PDF",
            "@size": "4158849",
            "@ref": "am",
            "@mimetype": "application/pdf"
          }
        ]
      },
      "link": {
        "@rel": "abstract",
        "@href": "https://api.elsevier.com/content/abstract/scopus_id/85206891482"
      }
    }
  }
}