{
  "metadata": {
    "title": "One-step reductive amination of 5-hydroxymethylfurfural to 2,5-bis(aminomethyl)furan over a core–shell structured catalyst",
    "authors": "; ; ",
    "journal": "Journal of Catalysis",
    "date": "2024-01-31",
    "doi": "10.1016/j.jcat.2024.115291",
    "abstract": "",
    "uri": "https://api.elsevier.com/content/article/pii/S0021951724000046",
    "pii": "S0021951724000046"
  },
  "fulltext": {
    "full-text-retrieval-response": {
      "scopus-eid": "2-s2.0-85181983097",
      "originalText": "serial JL 272561 291210 291744 291809 31 Journal of Catalysis JOURNALCATALYSIS 2024-01-09 2024-01-09 2024-01-11 2024-01-11 2024-04-14T00:43:06 1-s2.0-S0021951724000046 S0021-9517(24)00004-6 S0021951724000046 10.1016/j.jcat.2024.115291 S300 S300.1 FULL-TEXT 1-s2.0-S0021951723X0013X 2024-04-14T00:41:56.825532Z 0 0 20240101 20240131 2024 2024-01-09T01:18:56.637063Z absattachment articleinfo articlenumber articletitlenorm authfirstinitialnorm authfirstsurnamenorm cid cids contenttype copyright crossmark dateloaded dateloadedtxt datesearch datesort dateupdated dco docsubtype doctype doi eid ewtransactionid hubeid indexeddate issn issnnorm itemstage itemtransactionid itemweight openaccess openarchive pg pgfirst pii piinorm pubdateend pubdatestart pubdatetxt pubyr sectiontitle sortorder srctitle srctitlenorm srctype ssids alllist content subj subheadings suppl tomb volfirst volissue volumelist webpdf webpdfpagecount yearnav figure table e-component body acknowledge affil appendices articletitle auth authfirstini authfull authkeywords authlast grantnumber grantsponsor highlightsabst orcid primabst ref specialabst 0021-9517 00219517 true 429 429 C Volume 429 82 115291 115291 115291 202401 January 2024 2024-01-01 2024-01-31 2024 Regular Articles article fla © 2024 Elsevier Inc. All rights reserved. ONESTEPREDUCTIVEAMINATION5HYDROXYMETHYLFURFURAL25BISAMINOMETHYLFURANOVERACORESHELLSTRUCTUREDCATALYST LIU P 1 Introduction 2 Experimental 2.1 Synthesis of core–shell structured catalysts 2.2 Evaluation of the catalytic performance 2.3 Catalyst characterization 3 Results and discussion 3.1 Screening of catalysts 3.2 Optimization of reaction conditions 3.3 Recycle test 3.4 Catalyst characterization 3.5 Reaction kinetic profiles 4 Conclusion CRediT authorship contribution statement Acknowledgments Appendix A Supplementary data References GONZALEZSABIN 2009 1916 1925 J PELCKMANS 2017 5303 5331 M JIN 2013 1484 1499 Y CHENG 2020 322 337 B REN 2023 1974 1982 Y XU 2022 431 436 X XIE 2020 11805 11817 S GONZALEZ 2007 1309 1314 S LE 2015 115 127 N QI 2020 6897 6901 H GUPTA 2022 10400 10440 N ZHOU 2019 2649 2656 K KOMANOYA 2017 11493 11499 T YUAN 2019 38877 38881 H WEI 2022 e202200233 Z XU 2018 2697 2701 Y PINGEN 2018 3027 3033 D WEI 2021 2308 2312 Z DAI 2021 22 32 J AN 2009 359 373 K LU 2016 7399 7409 Q MIRZAEI 2018 270 294 A GUO 2010 5379 5384 S WANG 2015 95 106 Y XIAO 2019 e1801369 M FAN 2020 6696 6699 R YANG 2020 70 79 X PEER 2013 485 497 M NAKHAEIPOUR 2018 13639 13649 A GAO 2019 51 62 S HAN 2020 8727 8735 J CORMA 2008 85 90 A JIN 2019 560 568 Z BESSON 2003 547 559 M ONEILL 2013 13808 13812 B LIU 2018 3967 3978 J YU 2020 1182 1201 Z JIA 2022 11281 11293 L LIU 2017 4129 4135 Y CHANDRA 2018 5949 5956 D RUIZ 2017 739 749 D LIU 2015 262 268 H HAN 2022 K GONG 2019 597 607 S GHOSH 2023 S YUSUF 2023 1225 1237 M PRICE 2022 358 367 C LIU 2023 7347 7357 N LV 2019 7015 7024 M LI 2023 9892 9900 G BAGUS 2022 18077 18094 P WANG 2022 8342 8349 L BURATTIN 1997 7060 7074 P ZHOU 2017 5394 5407 N LI 2020 631 641 X XIE 2022 Z LIUX2024X115291 LIUX2024X115291XP 2026-01-11T00:00:00.000Z 2026-01-11T00:00:00.000Z http://creativecommons.org/licenses/by-nc-nd/4.0/ © 2024 Elsevier Inc. All rights reserved. 2024-01-14T06:26:25.845Z http://vtw.elsevier.com/data/voc/AddOnTypes/50.7/aggregated-refined B2022202064 Hebei Province Science and Technology Support Program http://data.elsevier.com/vocabulary/SciValFunders/501100005064 http://sws.geonames.org/1814991 Foundation of Central Government Guides Local Science and Technology Development Foundation of Hebei Province biomedicine 216Z1401G Hebei Provincial Natural Science Foundation http://data.elsevier.com/vocabulary/SciValFunders/501100003787 http://sws.geonames.org/1814991 We thank the Foundation of Central Government Guides Local Science and Technology Development for financial support (Grant no. 216Z1401G ), and the Foundation of Hebei Province biomedicine (Grant no. B2022202064 ). https://doi.org/10.15223/policy-017 https://doi.org/10.15223/policy-037 https://doi.org/10.15223/policy-012 https://doi.org/10.15223/policy-029 https://doi.org/10.15223/policy-004 item S0021-9517(24)00004-6 S0021951724000046 1-s2.0-S0021951724000046 10.1016/j.jcat.2024.115291 272561 2024-04-14T00:41:56.825532Z 2024-01-01 2024-01-31 1-s2.0-S0021951724000046-main.pdf https://s3-eu-west-1.amazonaws.com/prod-ucs-content-store-eu-west/content/pii:S0021951724000046/MAIN/application/pdf/e5f5ac36b7e6f3954b60f0adb4d49142/main.pdf main.pdf pdf true 25046205 MAIN 13 1-s2.0-S0021951724000046-main_1.png https://s3-eu-west-1.amazonaws.com/prod-ucs-content-store-eu-west/content/pii:S0021951724000046/PREVIEW/image/png/c3d6eb41879fbf9ad9a372fb19f41390/main_1.png main_1.png png 59354 849 656 IMAGE-WEB-PDF 1 1-s2.0-S0021951724000046-gr9.jpg https://s3-eu-west-1.amazonaws.com/prod-ucs-content-store-eu-west/content/pii:S0021951724000046/gr9/DOWNSAMPLED/image/jpeg/507700fef8dd9e53898d5437b10389e4/gr9.jpg gr9 gr9.jpg jpg 51078 464 535 IMAGE-DOWNSAMPLED 1-s2.0-S0021951724000046-gr6.jpg https://s3-eu-west-1.amazonaws.com/prod-ucs-content-store-eu-west/content/pii:S0021951724000046/gr6/DOWNSAMPLED/image/jpeg/ebe97b99dab182c45651a826e8e25c55/gr6.jpg gr6 gr6.jpg jpg 50885 442 535 IMAGE-DOWNSAMPLED 1-s2.0-S0021951724000046-gr5.jpg https://s3-eu-west-1.amazonaws.com/prod-ucs-content-store-eu-west/content/pii:S0021951724000046/gr5/DOWNSAMPLED/image/jpeg/118ce0bbc336ac96ffbc84385f5cd92e/gr5.jpg gr5 gr5.jpg jpg 53366 401 535 IMAGE-DOWNSAMPLED 1-s2.0-S0021951724000046-gr8.jpg https://s3-eu-west-1.amazonaws.com/prod-ucs-content-store-eu-west/content/pii:S0021951724000046/gr8/DOWNSAMPLED/image/jpeg/b3deaf4881981a55c97f6e4de89dddf1/gr8.jpg gr8 gr8.jpg jpg 48596 245 644 IMAGE-DOWNSAMPLED 1-s2.0-S0021951724000046-gr7.jpg https://s3-eu-west-1.amazonaws.com/prod-ucs-content-store-eu-west/content/pii:S0021951724000046/gr7/DOWNSAMPLED/image/jpeg/6e9c4c40a0708b4c9ca1287d53e21bbc/gr7.jpg gr7 gr7.jpg jpg 66642 458 535 IMAGE-DOWNSAMPLED 1-s2.0-S0021951724000046-gr2.jpg https://s3-eu-west-1.amazonaws.com/prod-ucs-content-store-eu-west/content/pii:S0021951724000046/gr2/DOWNSAMPLED/image/jpeg/96c117b0e5fb785fdecc7a142a6e3a90/gr2.jpg gr2 gr2.jpg jpg 41875 392 535 IMAGE-DOWNSAMPLED 1-s2.0-S0021951724000046-gr14.jpg https://s3-eu-west-1.amazonaws.com/prod-ucs-content-store-eu-west/content/pii:S0021951724000046/gr14/DOWNSAMPLED/image/jpeg/1ee216bc4f9ae4d3a9b6e0c692003499/gr14.jpg gr14 gr14.jpg jpg 50058 631 602 IMAGE-DOWNSAMPLED 1-s2.0-S0021951724000046-gr1.jpg https://s3-eu-west-1.amazonaws.com/prod-ucs-content-store-eu-west/content/pii:S0021951724000046/gr1/DOWNSAMPLED/image/jpeg/80d310b60c20539aeab66fc3751f898c/gr1.jpg gr1 gr1.jpg jpg 25120 307 535 IMAGE-DOWNSAMPLED 1-s2.0-S0021951724000046-gr4.jpg https://s3-eu-west-1.amazonaws.com/prod-ucs-content-store-eu-west/content/pii:S0021951724000046/gr4/DOWNSAMPLED/image/jpeg/824dda7f99c06904642ff3efe1e7db62/gr4.jpg gr4 gr4.jpg jpg 47916 401 535 IMAGE-DOWNSAMPLED 1-s2.0-S0021951724000046-gr3.jpg https://s3-eu-west-1.amazonaws.com/prod-ucs-content-store-eu-west/content/pii:S0021951724000046/gr3/DOWNSAMPLED/image/jpeg/265da595b3899b3076fdf439b6aded3a/gr3.jpg gr3 gr3.jpg jpg 55235 401 535 IMAGE-DOWNSAMPLED 1-s2.0-S0021951724000046-gr10.jpg https://s3-eu-west-1.amazonaws.com/prod-ucs-content-store-eu-west/content/pii:S0021951724000046/gr10/DOWNSAMPLED/image/jpeg/010dcba0853271f54bd3c0e2bc2c52c5/gr10.jpg gr10 gr10.jpg jpg 83809 314 776 IMAGE-DOWNSAMPLED 1-s2.0-S0021951724000046-gr11.jpg https://s3-eu-west-1.amazonaws.com/prod-ucs-content-store-eu-west/content/pii:S0021951724000046/gr11/DOWNSAMPLED/image/jpeg/907f02bcd0c9fb95fcdc65b73969b113/gr11.jpg gr11 gr11.jpg jpg 127305 533 534 IMAGE-DOWNSAMPLED 1-s2.0-S0021951724000046-gr12.jpg https://s3-eu-west-1.amazonaws.com/prod-ucs-content-store-eu-west/content/pii:S0021951724000046/gr12/DOWNSAMPLED/image/jpeg/679979e9ba0e289ea2b6620b417a31a6/gr12.jpg gr12 gr12.jpg jpg 38789 332 383 IMAGE-DOWNSAMPLED 1-s2.0-S0021951724000046-gr13.jpg https://s3-eu-west-1.amazonaws.com/prod-ucs-content-store-eu-west/content/pii:S0021951724000046/gr13/DOWNSAMPLED/image/jpeg/4afaf50c55bb1b25e20b1476fab8eff7/gr13.jpg gr13 gr13.jpg jpg 102124 754 608 IMAGE-DOWNSAMPLED 1-s2.0-S0021951724000046-ga1.jpg https://s3-eu-west-1.amazonaws.com/prod-ucs-content-store-eu-west/content/pii:S0021951724000046/ga1/DOWNSAMPLED/image/jpeg/58c94cc18e68baa163a726024ea9c4ba/ga1.jpg ga1 true ga1.jpg jpg 13629 200 347 IMAGE-DOWNSAMPLED 1-s2.0-S0021951724000046-gr9.sml https://s3-eu-west-1.amazonaws.com/prod-ucs-content-store-eu-west/content/pii:S0021951724000046/gr9/THUMBNAIL/image/gif/90813b68b074f7b13df2fe7dc7fef909/gr9.sml gr9 gr9.sml sml 6410 164 189 IMAGE-THUMBNAIL 1-s2.0-S0021951724000046-gr6.sml https://s3-eu-west-1.amazonaws.com/prod-ucs-content-store-eu-west/content/pii:S0021951724000046/gr6/THUMBNAIL/image/gif/beff043ad84ccdec6e7ff04ac2553b4a/gr6.sml gr6 gr6.sml sml 12286 164 198 IMAGE-THUMBNAIL 1-s2.0-S0021951724000046-gr5.sml https://s3-eu-west-1.amazonaws.com/prod-ucs-content-store-eu-west/content/pii:S0021951724000046/gr5/THUMBNAIL/image/gif/2868d1b74f9342730b215162ee37dfb1/gr5.sml gr5 gr5.sml sml 12386 164 218 IMAGE-THUMBNAIL 1-s2.0-S0021951724000046-gr8.sml https://s3-eu-west-1.amazonaws.com/prod-ucs-content-store-eu-west/content/pii:S0021951724000046/gr8/THUMBNAIL/image/gif/2750132b621f029ca83e488cc968609e/gr8.sml gr8 gr8.sml sml 7403 83 219 IMAGE-THUMBNAIL 1-s2.0-S0021951724000046-gr7.sml https://s3-eu-west-1.amazonaws.com/prod-ucs-content-store-eu-west/content/pii:S0021951724000046/gr7/THUMBNAIL/image/gif/ab1f8900c4b128f4066464329c39a90a/gr7.sml gr7 gr7.sml sml 8687 164 191 IMAGE-THUMBNAIL 1-s2.0-S0021951724000046-gr2.sml https://s3-eu-west-1.amazonaws.com/prod-ucs-content-store-eu-west/content/pii:S0021951724000046/gr2/THUMBNAIL/image/gif/7cfc5a9798298b841dfac4e09aa74558/gr2.sml gr2 gr2.sml sml 8603 161 219 IMAGE-THUMBNAIL 1-s2.0-S0021951724000046-gr14.sml https://s3-eu-west-1.amazonaws.com/prod-ucs-content-store-eu-west/content/pii:S0021951724000046/gr14/THUMBNAIL/image/gif/bf76ee7c190dfe172bd3ebb4302accd4/gr14.sml gr14 gr14.sml sml 3679 163 156 IMAGE-THUMBNAIL 1-s2.0-S0021951724000046-gr1.sml https://s3-eu-west-1.amazonaws.com/prod-ucs-content-store-eu-west/content/pii:S0021951724000046/gr1/THUMBNAIL/image/gif/d1a095b3771668767fb0544e03802a89/gr1.sml gr1 gr1.sml sml 7737 126 219 IMAGE-THUMBNAIL 1-s2.0-S0021951724000046-gr4.sml https://s3-eu-west-1.amazonaws.com/prod-ucs-content-store-eu-west/content/pii:S0021951724000046/gr4/THUMBNAIL/image/gif/39f79b7a0f0b968846a8b9802aa417b9/gr4.sml gr4 gr4.sml sml 9480 164 219 IMAGE-THUMBNAIL 1-s2.0-S0021951724000046-gr3.sml https://s3-eu-west-1.amazonaws.com/prod-ucs-content-store-eu-west/content/pii:S0021951724000046/gr3/THUMBNAIL/image/gif/44e82a99fb5294c39ae8fb7f0720b30b/gr3.sml gr3 gr3.sml sml 11951 164 219 IMAGE-THUMBNAIL 1-s2.0-S0021951724000046-gr10.sml https://s3-eu-west-1.amazonaws.com/prod-ucs-content-store-eu-west/content/pii:S0021951724000046/gr10/THUMBNAIL/image/gif/0a057aaabb80448760675616f2cb068f/gr10.sml gr10 gr10.sml sml 8090 89 219 IMAGE-THUMBNAIL 1-s2.0-S0021951724000046-gr11.sml https://s3-eu-west-1.amazonaws.com/prod-ucs-content-store-eu-west/content/pii:S0021951724000046/gr11/THUMBNAIL/image/gif/d95230cc92266846d98bdca1bdfb28eb/gr11.sml gr11 gr11.sml sml 22805 164 164 IMAGE-THUMBNAIL 1-s2.0-S0021951724000046-gr12.sml https://s3-eu-west-1.amazonaws.com/prod-ucs-content-store-eu-west/content/pii:S0021951724000046/gr12/THUMBNAIL/image/gif/1e63abc3640104bbb1691bbeeecf640c/gr12.sml gr12 gr12.sml sml 8999 164 189 IMAGE-THUMBNAIL 1-s2.0-S0021951724000046-gr13.sml https://s3-eu-west-1.amazonaws.com/prod-ucs-content-store-eu-west/content/pii:S0021951724000046/gr13/THUMBNAIL/image/gif/48a558f84f56a437d7a55b6fab4b38aa/gr13.sml gr13 gr13.sml sml 7756 164 132 IMAGE-THUMBNAIL 1-s2.0-S0021951724000046-ga1.sml https://s3-eu-west-1.amazonaws.com/prod-ucs-content-store-eu-west/content/pii:S0021951724000046/ga1/THUMBNAIL/image/gif/f35ac768b5c25de891ed2252ff844605/ga1.sml ga1 true ga1.sml sml 7750 126 219 IMAGE-THUMBNAIL 1-s2.0-S0021951724000046-gr9_lrg.jpg https://s3-eu-west-1.amazonaws.com/prod-ucs-content-store-eu-west/content/pii:S0021951724000046/HIGHRES/image/jpeg/cfd3ef15cd71138333f81661a91f46fc/gr9_lrg.jpg gr9 gr9_lrg.jpg jpg 605741 2053 2368 IMAGE-HIGH-RES 1-s2.0-S0021951724000046-gr6_lrg.jpg https://s3-eu-west-1.amazonaws.com/prod-ucs-content-store-eu-west/content/pii:S0021951724000046/HIGHRES/image/jpeg/f7812de133b125507a14c2b5d4a37140/gr6_lrg.jpg gr6 gr6_lrg.jpg jpg 649103 1958 2368 IMAGE-HIGH-RES 1-s2.0-S0021951724000046-gr5_lrg.jpg https://s3-eu-west-1.amazonaws.com/prod-ucs-content-store-eu-west/content/pii:S0021951724000046/HIGHRES/image/jpeg/89c5abc3461dea3e49af13e05ca54e11/gr5_lrg.jpg gr5 gr5_lrg.jpg jpg 643678 1777 2368 IMAGE-HIGH-RES 1-s2.0-S0021951724000046-gr8_lrg.jpg https://s3-eu-west-1.amazonaws.com/prod-ucs-content-store-eu-west/content/pii:S0021951724000046/HIGHRES/image/jpeg/2417c23c5219d2898eb9db33e6fbe693/gr8_lrg.jpg gr8 gr8_lrg.jpg jpg 588155 1083 2852 IMAGE-HIGH-RES 1-s2.0-S0021951724000046-gr7_lrg.jpg https://s3-eu-west-1.amazonaws.com/prod-ucs-content-store-eu-west/content/pii:S0021951724000046/HIGHRES/image/jpeg/d67cc7cecebfd9282a89f9541be581a1/gr7_lrg.jpg gr7 gr7_lrg.jpg jpg 672320 2029 2368 IMAGE-HIGH-RES 1-s2.0-S0021951724000046-gr2_lrg.jpg https://s3-eu-west-1.amazonaws.com/prod-ucs-content-store-eu-west/content/pii:S0021951724000046/HIGHRES/image/jpeg/0de70f96fa8ca2fc9fe4532cafa9700a/gr2_lrg.jpg gr2 gr2_lrg.jpg jpg 576685 1736 2368 IMAGE-HIGH-RES 1-s2.0-S0021951724000046-gr14_lrg.jpg https://s3-eu-west-1.amazonaws.com/prod-ucs-content-store-eu-west/content/pii:S0021951724000046/HIGHRES/image/jpeg/7cafd3e61be953a087bb24b1bd907d21/gr14_lrg.jpg gr14 gr14_lrg.jpg jpg 374622 2794 2666 IMAGE-HIGH-RES 1-s2.0-S0021951724000046-gr1_lrg.jpg https://s3-eu-west-1.amazonaws.com/prod-ucs-content-store-eu-west/content/pii:S0021951724000046/HIGHRES/image/jpeg/48afd02f9cfdc1b2b1301ee671074941/gr1_lrg.jpg gr1 gr1_lrg.jpg jpg 125181 1359 2368 IMAGE-HIGH-RES 1-s2.0-S0021951724000046-gr4_lrg.jpg https://s3-eu-west-1.amazonaws.com/prod-ucs-content-store-eu-west/content/pii:S0021951724000046/HIGHRES/image/jpeg/a01700af830136dc0cd06842de2b88f2/gr4_lrg.jpg gr4 gr4_lrg.jpg jpg 621966 1775 2368 IMAGE-HIGH-RES 1-s2.0-S0021951724000046-gr3_lrg.jpg https://s3-eu-west-1.amazonaws.com/prod-ucs-content-store-eu-west/content/pii:S0021951724000046/HIGHRES/image/jpeg/8b924b5fe560aa0d10e90b2b9fb439cb/gr3_lrg.jpg gr3 gr3_lrg.jpg jpg 602418 1775 2368 IMAGE-HIGH-RES 1-s2.0-S0021951724000046-gr10_lrg.jpg https://s3-eu-west-1.amazonaws.com/prod-ucs-content-store-eu-west/content/pii:S0021951724000046/HIGHRES/image/jpeg/6ff6ab6ab2c9fff961b15d07b9152551/gr10_lrg.jpg gr10 gr10_lrg.jpg jpg 757208 1392 3437 IMAGE-HIGH-RES 1-s2.0-S0021951724000046-gr11_lrg.jpg https://s3-eu-west-1.amazonaws.com/prod-ucs-content-store-eu-west/content/pii:S0021951724000046/HIGHRES/image/jpeg/911d2541d9b17194dc0f889d678d6155/gr11_lrg.jpg gr11 gr11_lrg.jpg jpg 498328 1488 1490 IMAGE-HIGH-RES 1-s2.0-S0021951724000046-gr12_lrg.jpg https://s3-eu-west-1.amazonaws.com/prod-ucs-content-store-eu-west/content/pii:S0021951724000046/HIGHRES/image/jpeg/89e2237592cb30f12eeed0208119ad83/gr12_lrg.jpg gr12 gr12_lrg.jpg jpg 465422 1473 1699 IMAGE-HIGH-RES 1-s2.0-S0021951724000046-gr13_lrg.jpg https://s3-eu-west-1.amazonaws.com/prod-ucs-content-store-eu-west/content/pii:S0021951724000046/HIGHRES/image/jpeg/ef2fee024145873646f4d05088708230/gr13_lrg.jpg gr13 gr13_lrg.jpg jpg 674591 3337 2692 IMAGE-HIGH-RES 1-s2.0-S0021951724000046-ga1_lrg.jpg https://s3-eu-west-1.amazonaws.com/prod-ucs-content-store-eu-west/content/pii:S0021951724000046/HIGHRES/image/jpeg/24dd7aa2d6280b682d692baf87c127a5/ga1_lrg.jpg ga1 true ga1_lrg.jpg jpg 84688 886 1536 IMAGE-HIGH-RES 1-s2.0-S0021951724000046-mmc1.docx https://s3-eu-west-1.amazonaws.com/prod-ucs-content-store-eu-west/content/pii:S0021951724000046/mmc1/MAIN/application/vnd.openxmlformats-officedocument.wordprocessingml.document/21ae1e7ba3873fe034e6562f01487a48/mmc1.docx mmc1 mmc1.docx docx 380195 APPLICATION 1-s2.0-S0021951724000046-am.pdf https://s3-eu-west-1.amazonaws.com/prod-ucs-content-store-eu-west/content/egi:10K5WW5D4RF/MAIN/application/pdf/a9a07c208493525d33a5cc51bec69e71/am.pdf am am.pdf pdf false 4239901 AAM-PDF YJCAT 115291 115291 S0021-9517(24)00004-6 10.1016/j.jcat.2024.115291 Elsevier Inc. Fig. 1 Schematic diagram of substrate molecule diffusing toward active sites through pore channel. Fig. 2 Effect of reaction time on the catalytic performance of Ni@SiO2–0.2 in the reductive amination of HMF. Reaction conditions: 1 mmol HMF, 5 g NH3·H2O (25 wt%), temperature 170 ℃, 2 MPa H2, substrate: catalyst = 5:1 (mass ratio). Fig. 3 Effect of reaction temperature on the catalytic performance of Ni@SiO2–0.2 in the reductive amination of HMF. Conditions: 1 mmol HMF, 5 g NH3·H2O (25 wt%), time 14 h, 2 MPa H2, substrate: catalyst = 5:1 (mass ratio). Fig. 4 Effect of HMF to catalyst mass ratio on the reductive amination of HMF to BAF over catalyst Ni@SiO2–0.2. Reaction conditions: 1 mmol HMF, 5 g NH3·H2O (25 wt%), temperature 160 ℃, time 14 h, 2 MPa H2. Fig. 5 Effect of H2 pressure on the catalytic performance of Ni@SiO2–0.2 in the reductive amination of HMF. Reaction conditions: 1 mmol HMF, 5 g NH3·H2O (25 wt%), temperature 160 ℃, time 14 h, substrate: catalyst = 20:1 (mass ratio). Fig. 6 Recycle test of Ni@SiO2–0.2 in the reductive amination of HMF to BAF. Reaction conditions: 1 mmol HMF, substrate: catalyst = 50:1, 5 mL NH3·H2O (25 wt%), temperature 160 °C, 2 MPa H2, reaction time 14 h. Fig. 7 The XRD patterns of the samples of NiO NPs, NiO@SiO2–0.2, fresh and used Ni@SiO2–0.2 catalyst. Fig. 8 XPS spectra of the samples of fresh Ni NPs, fresh and used Ni@SiO2–0.2 catalyst. Wide scan spectra (A), fitted Ni 2p spectra (B). Fig. 9 H2-TPR profiles of NiO NPs and NiO@SiO2–0.2 catalyst. Fig. 10 N2 adsorption–desorption isotherms of the samples of fresh Ni@SiO2–x and used Ni@SiO2–0.2 catalyst. Fig. 11 TEM images of Ni@SiO2–0.2 (A, C, D, and F), Ni@SiO2–0.5 (B), and used Ni@SiO2–0.2 (E); HR-TEM image of Ni@SiO2–0.2 in (D); Elemental mapping images of Ni@SiO2–0.2 (G-L). Fig. 12 NH3-TPD curves of Ni@SiO2–x catalysts. Fig. 13 Reaction kinetic profiles for the reductive amination of HMF over Ni/SiO2 (A), Co@SiO2–0.2 (B), Ni@SiO2–0.1 (C), Ni@SiO2–0.2 (D), and Ni@SiO2–0.3 (E) catalysts. Reaction conditions: 1 mmol HMF, 5 g NH3·H2O (25 wt%), temperature 170 ℃, 2 MPa H2, time 12 h, substrate: catalyst = 5:1 (mass ratio). Scheme 1 The pathways for the formation of BAF and byproducts in the reductive amination of HMF. Table 1 The catalysis of catalysts with different Si to Ni molar ratios in the reductive amination of HMF. Entry Si: Ni a Conv. (%) Selectivity (%) BAF AMAF BHF BHTHF AMTFM BAF-N-BAF 1 0.1 99 71 6 13 0 0 7 2 0.2 99 91 8 0 0 0 0 3 0.3 99 79 20 0 0 0 0 4 0.5 99 64 35 0 0 0 0 5 1 99 20 79 0 0 0 0 Reaction conditions: 1 mmol HMF, 5 g NH3·H2O (25 wt%), temperature 170 ℃, 2 MPa H2, time 12 h, substrate: catalyst = 5:1 (mass ratio). a Molar ratio. Table 2 The catalysis of Ni@SiO2–0.2 on the reductive amination of HMF in the absence of external hydrogen. Entry H2 pressure (MPa) Conv. (%) Selectivity (%) BAF Imine 4 Imine 3 1 0 99 17 36 56 Reaction conditions: 1 mmol HMF, 5 g NH3·H2O (25 wt%), temperature 170 ℃, H2, time 12 h, substrate: catalyst = 5: 1 (mass ratio). Table 3 Pore size diameters and specific surface areas of fresh Ni@SiO2–x and used Ni@SiO2–0.2. Catalyst SBET a (m2/g) V b (cm3/g) Pore diameter c (nm) Ni@SiO2–0.1 91.64 0.15 6.44 Ni@SiO2–0.2 72.18 0.10 5.62 Ni@SiO2–0.3 65.86 0.08 4.88 Ni@SiO2–0.5 57.49 0.06 3.84 Ni@SiO2–0.2(used) 71.68 0.10 5.59 a BET surface area. b Barrett-Joyner-Halenda (BJH) cumulative desorption pore volume. c Mean pore diameter = kV/SBET. Table 4 NH3 adsorption capacity of Ni@SiO2–x catalysts. Catalyst NH3 adsorption capacity (mmol/g) Ni@SiO2–0.1 0.5160 Ni@SiO2–0.2 1.0657 Ni@SiO2–0.3 1.4891 Ni@SiO2–0.5 1.5363 One-step reductive amination of 5-hydroxymethylfurfural to 2,5-bis(aminomethyl)furan over a core–shell structured catalyst Peng Liu Conceptualization Data curation Formal analysis Investigation Methodology Writing – original draft a b Xiaolong Li Data curation Validation Methodology a b Hongyu Zhang Conceptualization Methodology Writing – review & editing a b Yuecheng Zhang Conceptualization Data curation Funding acquisition Project administration Resources Supervision Writing – review & editing a c ⁎ Jiquan Zhao Conceptualization Data curation Funding acquisition Supervision Writing – review & editing a b a School of Chemical Engineering and Technology, Hebei University of Technology, Tianjin 300131, China School of Chemical Engineering and Technology Hebei University of Technology Tianjin 300131 China School of Chemical Engineering and Technology, Hebei University of Technology, Tianjin 300131, China b Hebei Provincial Key Laboratory of Green Chemical Technology and High Efficient Energy Saving, Tianjin 300131, China Hebei Provincial Key Laboratory of Green Chemical Technology and High Efficient Energy Saving Tianjin 300131 China Hebei Provincial Key Laboratory of Green Chemical Technology and High Efficient Energy Saving, Tianjin 300131, China c National-Local Joint Engineering Laboratory for Energy Conservation of Chemical Process Integration and Resources Utilization, Hebei University of Technology, Tianjin 300130, China National-Local Joint Engineering Laboratory for Energy Conservation of Chemical Process Integration and Resources Utilization Hebei University of Technology Tianjin 300130 China National-Local Joint Engineering Laboratory for Energy Conservation of Chemical Process Integration and Resources Utilization, Hebei University of Technology, Tianjin 300130, China ⁎ Corresponding author at: School of Chemical Engineering and Technology, Hebei University of Technology, Tianjin 300131, China. School of Chemical Engineering and Technology Hebei University of Technology Tianjin 300131 China Graphical abstract 2,5-Bis(aminomethyl)furan (BAF) is a diamine that is expected to have extensive applications in organic synthesis, medicine and polymer materials such as polyamides and polyimides. BAF can be prepared by one-step reductive amination of 5-hydroxymethylfurfural (HMF), one of the platform compounds for the added-valueconversion of biomass. Due to its complex structure, the one-step catalytically reductive amination of HMF to BAF in high yield is still a challenging issue. Herein, a core–shell structured catalyst (Ni@SiO2–0.2) was developed for this reaction, and the yield of BAF reached up to 99 % with aqueous ammonia as both ammonia source and solvent due to an isolation effect of the SiO2 shell. The isolation effect can prevent direct hydrogenation of HMF and self-coupling of BAF, thereby enhancing the selectivity of the reductive amination of HMF to BAF. In addition, the textural structure, acidity and acidic sites of the SiO2 shell can be tuned by adjusting the amount of TEOS during the catalyst preparation process, thus optimizing the performance of the catalyst. The characterization results also revealed that the Ni nanoparticles in the catalyst are uniformly dispersed and encapsulated within the SiO2 shell, which can decrease the charge density on the Ni surface and enhance the adsorption of ammonia and intermediates on the Ni surface, thus enhancing the catalytic activity of the catalyst. Keywords One-step reductive amination Core-shell structure Ni@SiO2 catalyst 5-Hydroxymethylfurfural 2,5-Bis(aminomethyl)furan Data availability Data will be made available on request. 1 Introduction Diamines play a crucial role in organic synthesis and are also widely utilized as monomers or intermediates in the production of polymers, pharmaceuticals, dyes, and detergents [1,2]. Currently, the production of diamines heavily relies on fossil resources [3,4], which is faced with challenges such as resource depletion and worsening environmental pollution. By transitioning to renewable biomass-based resources, the production of diamines not only reduces our dependence on fossil resources but also expands the range of polymer materials and enhances the quality of related products, while being environmentally friendly [5,6]. However, the study on the conversion of biomass-derived molecules into valuable primary amines is still in its early stages. 2,5-Bis(aminomethyl)furan (BAF) is a diamine possessing large potential applications in organic synthesis as well as medicine, which can be prepared by catalytic amination of biomass derived 5-hydroxymethylfurfural (HMF). Its structural symmetry and the presence of a more active amino group on the furan ring make it suitable for the production of polyamides and polyimides, too [7,8]. The HMF derived polymer materials generally exhibit high mechanical strength and a low thermal expansion coefficient, making them comparable to traditional petrochemical-based products, thereby endowing them with significant applications in various industries including automobiles, aerospace, electrical and electronics, and construction. Besides, BAF can also serve as a hardener for epoxy resins. Especially, BAF is a precursor for the manufacture of 2,5-bis(aminomethyl)tetrahydrofuran (THBAF) that also finds important applications in the aforementioned fields [9,10]. The catalytic amination of HMF to BAF over various homogeneous and heterogeneous catalysts has been reported [11]. For instance, Li et al. [12] developed a two-step process to convert HMF to BAF, consisting of oxidation of HMF to 2,5-diformylfuran (DFF) and catalytically reductive of DFF in the presence of NH3 and H2 over Raney Ni. However, the yield of BAF was only 42.6 % under optimized reaction conditions. Michikazu Hara et al. [13] reported another two-step process for the synthesis of BAF from HMF over a Ru/Nb2O5 catalyst in combination with a Ru complex system. Firstly, HMF was hydrogenated to AMAF over Ru/Nb2O5 in a yield of 96 %. Then, AMAF underwent amination with [Ru(CO)ClH(PPh3)3]/Xantphos as a homogeneous catalyst system via borrowing‐hydrogen methodology to give BAF quantitatively. The excessively expensive catalyst is the fatal weakness of this process. Shi et al. [14] reported a two-stage heating, one-pot method to convert HMF to BAF over a bifunctional CuNiAlOx catalyst, which are conducting the reductive amination of aldehyde moiety at 90 ℃, then the amination of alcohol moiety at 210 ℃ in 1,4-dioxane. Only in the presence of a significant amount of alkaline as additives the conversion of HMF was 99 % and the yield of BAF reached 85.9 %. Overall, most of the protocols or catalytic systems suffer from the disadvantages of organic solvent usage [12,15,16], expensive reactants [13,17], and multiple steps [10,14,18,19]. In principle, the one-step catalytically reductive amination of HMF with ammonia using hydrogen as reductant is the most direct process to obtain BAF. Therefore, several catalysts or catalytic systems have been developed for this transformation under mild conditions, but very low yield of BAF and short lifetime of catalysts were generally observed [12,15]. Therefore, the one-step catalytically reductive amination of HMF to BAF is still a challenging task. In view of the structure of HMF, the low yield of BAF could be mainly ascribed to the direct hydrogen of HMF, being a competitive reaction with catalytic amination under the reaction conditions. In addition, the presence of unsaturated bonds including C=C and C=O in the HMF structure makes it more prone to oligomerization under the reaction conditions, which is another significant factor contributing to the low selectivity of BAF [18]. Obviously, the key to solve the above problems is to design catalysts that can prevent direct hydrogenation and oligomerization of HMF. Core-shell catalysts have gained significant attention in catalytic reactions due to their unique structural properties [20–22]. These catalysts exhibit improved activity and selectivity compared to traditional catalysts by leveraging the advantages of both the core and shell components. They demonstrate metal-support mutual synergistic effects, molecular sieve effects, spatial separation effects, and metal stabilizing effects. The curved structure of the core–shell catalyst provides distinct internal and external microenvironments [23]. The metal particles loaded inside the shell undergo more significant charge transfer than those loaded outside the shell [24,25]. The molecular sieve effect can be achieved through the adjustable shell thickness and pore structure of the core–shell catalyst. This effect controls the adsorption and diffusion of substrate molecules in the pores by manipulating the shell thickness and internal pore size [26,27]. By adjusting these structural parameters, molecules that are incompatible with the pore size are prevented from entering, while the compatible ones can easily enter, allowing for precise control of catalytic selectivity. Moreover, the molecular sieve effect also influences reaction kinetics, thereby impacting the overall reaction rate [28–31]. Another important effect is the spatial separation effect, which can be utilized in cascade reactions to simplify complex operations such as separation, purification, and concentration of intermediates [32,33]. By cleverly designing core–shell structural parameters such as shell thickness, pore size, and metal position, substrate molecules can be directed to specific positions within the shell. This promotes rapid conversion of intermediates, suppresses the formation of by-products, and enhances the selectivity and efficiency of the desired product. Long-lasting catalytic stability is a crucial requirement for achieving satisfactory catalytic performance. In metal-supported catalysts, deactivation such as poisoning, sintering, and leaching of metal particles are commonly observed [34–38]. However, by encapsulating metal particles in a core–shell structure, a metal stabilizing effect can be achieved, effectively inhibiting the aforementioned deactivation mechanisms and ensuring long-lasting catalytic stability. Liu et al. [38] successfully developed a Cu-SSZ-13@Ce0.75Zr0.25O2 core–shell catalyst using a hydrothermal method. The catalyst was subjected to treatment with H2O, SO2, and K+ with excellent tolerance. The Ce0.75Zr0.25O2 shell served as a sacrificial site, effectively capturing SO2 and forming sulfate, and subsequently capturing K+. Furthermore, the Ce0.75Zr0.25O2 shell provided additional Brønsted acid sites and enhanced the adsorption and activation of NOx. Herein, a core–shell structured catalyst (Ni@SiO2–0.2) was developed for the one-step catalytically reductive amination of HMF to BAF in high selectivity. The pore size and thickness of the SiO2 shell was optimized by adjusting the molar ratio of Si to Ni during the preparation of the catalysts, which led to the catalyst Ni@SiO2–0.2 with excellent catalytic performance owing to the isolation effect of the SiO2 shell to inhibit direct hydrogenation, self-coupling of BAF and oligomerization of HMF. 2 Experimental 2.1 Synthesis of core–shell structured catalysts Catalyst precursor was obtained by dispersing metal oxides through ultrasound, followed by hydrolysis of tetraethoxysilane (TEOS) in ammonia to form catalyst precursor. The precursor was then subjected to calcination and reduction to obtain the catalyst. The detailed processes are given in Supporting Information. The nickel-based catalysts were denoted as Ni@SiO2–x, where x represents the molar ratio of Si to Ni in the catalyst. 2.2 Evaluation of the catalytic performance The catalytic evaluation was carried out in a 15 mL stainless steel reactor, with catalyst (0.02 g), HMF (1 mmol) and aqueous ammonia (25 wt%, 5 mL). Before test, the reactor was purged with H2 for five times to replace the residual air, and charged with H2 to 2 MPa. Then the reaction was carried at 160 ℃ under stirring speed of 1500 rpm. After the reaction, the liquid product was separated from the catalyst and subjected to chromatography analysis. 2.3 Catalyst characterization The characterization instruments and processes are provided in the Supporting Information, including Brunauer-Emmett-Teller (BET), X-ray power diffraction (XRD), transmission electron microscope images (TEM), X-ray photoelectron spectroscopy (XPS), hydrogen temperature programmed reduction (H2-TPR), Ammonia Temperature Programmed Desorption (NH3-TPD), and Hydrogen Temperature Programmed Desorption (H2-TPD). 3 Results and discussion 3.1 Screening of catalysts For the aim of one-step reductive amination of HMF to BAF in high yield, several catalysts including Raney Ni, metals supported on SiO2 and activated carbon (Ni/SiO2, Ni/C, and Ru/C), and core–shell structured catalysts with different transitional metals (Fe@SiO2, Co@SiO2, Cu@SiO2, and Ni@SiO2) were prepared and evaluated in the reaction under same reaction conditions. The products were determined by LC-MS and GC–MS analysis. The analysis results disclosed that some byproducts including BHF, BHTHF, AMAF, AMTFM, and BAF-N-BAF were generated aside from the target product BAF (Fig. S1, Supporting Information). The selectivity of each product over various catalysts are shown in Table S1 (Supporting Information). In view of the literature [10,13,18], and the organic reaction principles, the formation pathways of the detected products are inferred and shown in Scheme 1 . As disclosed in literature [39–41], the reaction rate of reductive amination of furfural (C=O) is over ten times higher than that of furfuryl alcohol (C–OH) in HMF. Therefore, AMAF is firstly generated via the condensation of carbonyl with ammonia to imine 1 followed by hydrogenation of imine 1. Once the formation of AMAF, the furfuryl alcohol moiety undergoes further amination to give BAF via dehydrogenation, condensation and hydrogenation of imine 2. Meantime, AMAF undergoes direct hydrogenation of furan ring to generate byproduct AMTFM. Besides, the generated BAF can also undergoes self-coupling to form another byproduct BAF-N-BAF [42]. Simultaneously with the reductive amination reaction, the direct hydrogenation of HMF to BHF as a byproduct may take place, and further hydrogenation of BHF to generate byproduct BHTHF. In the case of without exogenous hydrogen introduced (Table 2), BAF may be generated through the second path. Initially, the carbonyl group condenses with ammonia to form imine 1. Subsequently, the alcohol moiety in imine 1 is dehydrogenated to produce imine 2. Then the carbonyl group in imine 2, condenses further with ammonia to afford imine 3. Imine 3 undergoes hydrogenation with the in-situ generated H2 to form imine 4, which is ultimately hydrogenated to BAF. The detailed transformation processes in the reductive amination of HMF over different catalysts will be discussed in the kinetic study section. As shown in Table S1 (Supporting Information), the three Ni-based catalysts without a SiO2 shell (Raney Ni, Ni/SiO2, and Ni/C) showed similar performances, and the main byproducts over the three catalysts were AMAF, BHF, and BAF-N-BAF. Besides, a small amount of BHTHF was generated over Ni/SiO2. For Ru/C with strong hydrogenation activity compared to Ni-based catalysts, the byproducts were BHF, BHTHF, AMTFM, and BAF-N-BAF. The results indicate that excessive hydrogenation activity of a catalyst is unfavorable for the reductive amination of HMF. It can also be concluded that furan ring and BAF can be respectively absorbed on the metal active sites and acidic sites of the catalysts without a SiO2 shell to undergo hydrogenation of furan ring and self-coupling of BAF affording to the corresponding byproducts. For the core–shell structured catalysts (Fe@SiO2, Co@SiO2, Cu@SiO2, and Ni@SiO2), no byproducts BHF, BHTHF, AMTFM, and BAF-N-BAF were formed, indicating the isolation effect of the SiO2 shell to prevent the adsorption of furan ring and BAF on the metal active sites and acidic sites. The Ni@SiO2 showed the best results, and the selectivity of BAF reached 91 % under the HMF conversion of 99 %. The isolation effect can be illustrated as showing in Fig. 1 . The HFM molecule approach the metal core or active center with carbonyl or hydroxyl group through diffusion along the pore channel of the SiO2 shell during the reductive amination reaction, and the appropriate pore structure does not allow the furan ring to approach the active center perpendicular to the radial direction of pore channel. On the other hand, the pore channel cannot accommodate two BAF molecules approaching each other, thus preventing the self-coupling of BAF to BAF-N-BAF. For a core–shell structured catalyst, the thickness of the shell is related to the textural structure of the catalyst, thus has a significant impact on the diffusion of substrates, intermediates, and products, and ultimately affecting the aforementioned isolation effect in the reductive amination of HMF. Therefore, several core–shell structured catalysts with different SiO2 shell thicknesses were prepared by changing the molar ratio of Si to Ni. The catalysis of the catalysts was evaluated and the results are listed in Table 1 . For all the catalysts, the conversion of HMF was 99 %. However, the selectivity of BAF changed with the Si to Ni molar ratio. The catalyst with a Si to Ni molar ratio of 0.2 showed the best result with a BAF selectivity of 91 %. For the catalysts with Si to Ni molar ratios of 0.3, 0.5, and 1, higher than 0.2, the selectivity of BAF decreased with increase in Si to Ni molar ratio. Meanwhile, AMAF as a unique byproduct was observed and its selectivity increased with increase in Si to Ni molar ratio. The results could be ascribed to the small pore diameters and surface areas of the SiO2 shells of the catalysts as shown in Fig. 10 and Table 3 from the N2 adsorption–desorption. The big Si to Ni molar ratio led to small pore diameters and large channel lengths of the SiO2 shell, hindering the diffusion of HMF to and detachment of BAF from the metal core, as well as slowing down the diffusion of AMAF with its hydroxy head to the metal core, thus resulting in the lower selectivity of BAF [43]. For the catalyst with a Si to Ni molar ratio of 0.1, the selectivity of BAF was also lower than that of the catalyst with a Si to Ni molar ratio of 0.2. Besides AMAF, two other byproducts BHF and BAF-N-BAF were also observed. It was confirmed that the excessive low Si to Ni molar ratio led to large pore diameters and short pore channels as shown in Fig. 10 and Table 3, and HMF could diffuse readily to the metal core, reducing the opportunity for condensation of carbonyl with ammonia on the acid sites of SiO2 shell, thus resulting in direct hydrogenation of HMF to BHF. In addition, the large pore volume the SiO2 shell could accommodate two BAF molecules approaching each other to undergo self-coupling over the acidic sites on the inner surfaces of the SiO2 shell, leading to a further decrease in selectivity of BAF. 3.2 Optimization of reaction conditions Next, the reaction parameters in the one-step catalytically reductive amination of HMF were optimized over the Ni@SiO2–0.2 catalyst in order to further improve the selectivity of BAF. First, the effect of reaction time on the reaction was investigated while maintaining the other parameters constant. As shown in Fig. 2 , the conversion of HMF was always 99 % in the screened range of 10–14 h. The selectivity of BAF gradually improved with the increase in reaction time due to the further reductive amination of AMAF to BAF, and reached its maximum of selectivity of 99 % in 14 h, corresponding to a yield of 98 %. Next, the impact of reaction temperature on this reaction was screened and the results are shown in Fig. 3 . As the temperature increased from 150 °C to 170 °C, the selectivity of BAF gradually increased along with the further reductive amination of AMAF to BAF, and reached its maximum of 99 % at 160–170 °C. No byproduct was observed within this temperature range. However, with the temperature increased from 170 ℃ to 190 ℃, the selectivity of BAF decreased sharply due to the hydrogenation of AMAF to AMTFM, and hydrogenation of HEM to BHF and BHTHF, as well as self-coupling of BAF to BAF-N-BAF at excessively high temperature [13]. The occurrence of side reactions might be ascribed to the partial or completely collapse of the SiO2 shell at excessively high temperature, which weakened or even eliminated the isolation effect of the SiO2 shell in the one-step reductive amination of HMF. Therefore, the optimal reaction temperature was determined to be 160 ℃. Then, the influence of catalyst dosage on the reaction was investigated by keeping other parameters constant. As shown in Fig. 4 , the conversion of HMF was always 99 %, but the selectivity of BAF varied with the change of substrate to catalyst mass ratio. When the substrate to catalyst mass ratio was lower than or equal to 10:1, the selectivity of BAF was kept constant of 99 %. However, when the substrate to catalyst mass ratio was higher than 15:1, the selectivity of BAF decreased gradually with increase in substrate to catalyst mass ratio (decrease in catalyst dosage) from 15:1, due to the insufficient conversion of intermediate AMAF to BAF at low catalyst dosage. Therefore, the optimal substrate to catalyst mass ratio was chosen as 10:1. Finally, the effect of H2 pressure on the one-step catalytically reductive amination of HMF was screened by keeping reaction temperature of 160 ℃, reaction time of 14 h and substrate to catalyst mass ratio of 20:1. As indicated in Table 2, the absence of external H2 results in a decreased yield of the BAF, with substantial amounts of imines 3 and 4 as intermediates persisting. The limited availability of H2 in the reactor impeded the conversion of imines 3 and 4 into BAF. As shown in Fig. 5 , with the increase in H2 pressure, the selectivity of BAF increased initially along with the further reductive amination of AMAF to BAF, and reached its maximum of 85 % under 2 MPa. With a further increase in H2 pressure from 2 MPa to 3 MPa, the selectivity of BAF decreased gradually due to the hydrogenation of AMAF to AMTFM, as well as hydrogenation of HEM to BHF and BHTHF at excessive high H2 pressure. No BAF self-coupling to BAF-N-BAF was observed throughout the process. Therefore, the optimal H2 pressure was determined to be 2 MPa. Based on the above experimental results, the optimal reaction parameters for the one-step reductive amination of HMF to BAF over the catalyst Ni@SiO2–0.2 were determined to be a reaction time of 14 h, a reaction temperature of 160 ℃, substrate to catalyst mass ratio of 10:1, hydrogenation pressure of 2 MPa, and using excessive aqueous ammonia as both ammonia source and solvent. Under the optimal parameters, the conversion of HMF reached 99 %, with an BAF selectivity of 99 %, corresponding to a BAF yield of 98 %, which is the best result in the one-step catalytically reductive amination of HMF to BAF up till now. 3.3 Recycle test The reusability of Ni@SiO2–0.2 for the reductive amination of HMF was evaluated under reaction conditions of a reaction temperature of 160 °C, a reaction time of 14 h, and hydrogen pressure of 2 MPa. For the sake of the reliability of the results, the substrate to catalyst mass ratio was chosen as 50:1 to control the yield of BAF about 56.4 % in the first run. After the reaction, the catalyst was readily recovered by a magnet and reused directly after washing with methanol and water. As shown in Fig. 6 , the catalyst was recycled 7 times, and the yield of BAF remained basically unchanged, indicating the excellent stability of the catalyst in catalytic run. 3.4 Catalyst characterization Fig. 7 shows the XRD patterns of the samples of NiO NPs, NiO@SiO2–0.2, fresh and used Ni@SiO2–0.2 catalyst. For the XRD patterns of NiO NPs, NiO@SiO2–0.2, the diffraction peaks representing NiO species are clearly observed [44]. For the sample of fresh Ni@SiO2–0.2, derived from reduction of NiO@SiO2–0.2, strong diffraction peaks at 2θ = 44.5, 51.9, and 76.4° ascribed to (111), (200), and (220) crystal planes of Ni (0), and very weak peaks corresponding to NiO are observed, confirming that Ni mainly exists in the form of Ni (0) in Ni@SiO2–0.2 catalyst [45,46]. No diffraction peaks representing NiO are observed in the XRD patterns of the used sample of Ni@SiO2–0.2, indicating that the residual NiO in the fresh catalyst was completely reduced to Ni (0) during catalytic run. Besides, no sharp diffraction peaks of SiO2 in the XRD patterns is observed, indicating that SiO2 in the shell of the catalysts exists in an amorphous form [47]. Compared to NiO NPs, NiO@SiO2–0.2 shows weak diffraction peaks of Ni2+, which can be attributed to the strong interaction between NiO and SiO2 shell, promoting the dispersion of NiO on the SiO2 shell or the migration of the NiO core into the SiO2 shell to form a core–shell structure [47,48]. The surface composition and chemical states of nickel of the samples of fresh Ni NPs, fresh and used Ni@SiO2–0.2 are analyzed by XPS. As shown in the wide scan XPS spectrum of the Ni@SiO2–0.2 sample (Fig. 8 A) distinct C 1s, O 1s, Ni 2p, and Si 2p peaks are observed obviously confirming the existence of C, O, Si, and Ni elements. No Si 2p peak is observed in the spectrum of Ni NPs sample. The element C comes from CO2 adsorbed on the catalyst surface in the air. The surface content of Ni determined by XPS (Table S2, Supporting Information) is much smaller than those obtained by the analysis of ICP and EDS (Tables S3 and S4, Supporting Information). The comprehensive results disclosed that the buck of Ni is not on the surface of the catalyst, indicating the successful formation of a core–shell structure of the catalyst [49]. The Ni 2p XPS spectra of the samples are shown in Fig. 8B. For the Ni@SiO2–0.2 catalyst, two peaks of Ni0 2p are observed at 870.35 eV (Ni0 2p1/2) and 852.79 eV (Ni0 2p3/2) with two respective satellite peaks at 879.61 eV and 861.01 eV, as well as two peaks appear at 873.96 eV (Ni2+ 2p1/2) and 855.66 eV (Ni2+ 2p3/2) [50,51]. The existence of Ni2+ can be ascribed to the inevitable oxidation of Ni (0) during analytic process due to the strong reducibility of Ni (0). Compared with that of Ni NPs, the Ni0 (2p1/2) of Ni@SiO2–0.2 catalyst shifts from 870.56 eV to 870.35 eV, and the Ni (2p3/2) shifts from 852.96 eV to 852.79 eV, indicating that the coating of SiO2 shell on Ni NPs reduced the binding energy of Ni (0) due to the strong interaction between the metal Ni (0) and SiO2 [43,52], and decreased the charge density on the Ni surface, thus enhancing the adsorption of ammonia and intermediates on the Ni surface, thereby enhancing its catalytic activity. Compared to that of the fresh sample of the Ni@SiO2–0.2 catalyst, the Ni 2p XPS spectrum of the used sample has no intrinsic difference, indicating its excellent stability of the Ni@SiO2–0.2 catalyst during catalytic run as disclosed by recycle test. H2-TPR experiments were conducted to get the reducibility information of NiO species and evaluate the interaction between metallic Ni and SiO2 shell. As depicted in Fig. 9 , the samples of NiO NPs and NiO@SiO2–0.2 respectively exhibit a single H2 reduction peak at 288 ℃ and 306 ℃, corresponding to the reduction of NiO to Ni. Compared with that of NiO NPs catalyst, the reduction peak of NiO of NiO@SiO2 catalyst shifted towards higher temperature (from 288 to 306 ℃) and became wider, indicating the presence of interactions between Ni and SiO2 [53]. In order to gain a better understanding of the textural structures of the catalysts, N2 adsorption–desorption was performed. As shown in Fig. 10 A and Table 3, both the specific surface areas and pore diameters decreased with the increase in Si to Ni molar ratio (increase in TEOS amount during preparation of catalysts). Compared with those of the sample of fresh Ni@SiO2–0.2, both the specific surface area and the pore diameter of the used sample changed slightly, further demonstrating the stability of the Ni@SiO2–0.2 during catalytic run. Furthermore, all the catalyst samples exhibit isotherms of type IV with an H1 hysteresis loop (Fig. 10B), indicating the presence of a mesoporous structure in the catalysts, with a relatively uniform distribution of pores. To better understand the morphology of catalysts, high-resolution transmission electron microscopy (HR-TEM) analysis was conducted. In the HR-TEM image of Ni@SiO2–0.2 (Fig. 11 D), the lattice spacing of the nanoparticles is 0.1702 nm and 0.2001 nm, corresponding to Ni (200) and Ni (111), respectively.[54] Fig. 11C is a magnified view of the image of a selected core–shell structure in Fig. 11A. The compositions of the core and the shell are Ni and SiO2, respectively, determined by elemental mapping images (11G, 11H, and 11I). As shown in Fig. 11H and 11I, which are the magnified views of Fig. 11G, the core–shell structure of the Ni@SiO2 catalyst is clearly exhibited, where the green core component is Ni, and the red shell material is SiO2. Fig. S2 shows the TEM image of Ni NPs. Compared Fig. S2 with Fig. 11A and 11B, it can be concluded that exposed metallic nanoparticles of Ni NPs are more prone to aggregation. The SiO2 shell of Ni@SiO2–0.2 or Ni@SiO2–0.5 can prevent Ni cores from aggregation, making the Ni nanoparticles as active components more evenly dispersed and stable than the naked nanoparticles of Ni NPs. From Fig. 11A and 11B, it can be concluded that the thickness of the SiO2 shell increased with an increase in TEOS amount during the preparation of the catalysts. The TEM image of the sample of the used Ni@SiO2–0.2, (Fig. 11E) shows that the particle distribution of that catalyst remains uniform after catalytic run, and no noticeable difference is observed compared to that of the fresh Ni@SiO2–0.2, which is another evidence for the stability of Ni@SiO2–0.2. As shown in Scheme 1, the condensation of carbonyl with ammonia is an elementary reaction in the reductive amination of HMF to BAF. In principle, appropriate amount acidic sites and acidity of a catalyst can facilitate the adsorption of substrates, ammonia, and imine intermediates, thereby enhancing the catalytic amination of carbonyl compounds. Excessive acidity can hinder the condensation reaction between carbonyl and NH3, inhibit desorption of ammonia and products, and lead to an increase in self-coupling of amines and oligomerization reactions [55,56]. The surface acidities of the catalysts were determined by NH3-TPD method. Fig. 12 shows the NH3-TPD curves of the Ni@SiO2–x catalysts. The catalysts exhibit two main NH3 desorption peaks within the temperature range of 50–700 °C, corresponding to the NH3 adsorbed on the weak acid sites and strong acid sites on the catalyst surfaces. As shown in Fig. 12, the desorption temperature of ammonia at the strong acid sites increased with the increase in SiO2 to Ni molar ratio, as well as the peak area corresponding to the strong acid content. Table 4 shows the NH3 adsorption capacity of the catalyst. Among all the tested Ni@SiO2–x catalysts, the Ni@SiO2–0.2 catalyst has moderate acid strength and suitable amount of acid sites, which facilitates the adsorption and desorption of reaction reactants, intermediates and BAF in the condensation step, thereby positively influencing the overall catalytic reaction to afford BAF with the highest selectivity. The Ni@SiO2–0.1 catalyst has the lowest weak acidity and acid sites, consequently, showed poor catalytic activity in the reaction. However, the Ni@SiO2–0.3 and Ni@SiO2–0.5 catalysts have excessively strong acidity and acid sites, hindering the desorption of NH3, AMAF, and BAF, thus resulting in poor catalytic performances of the catalysts in the reaction, too. 3.5 Reaction kinetic profiles According to literature, the control step of the HMF reductive amination should be the dehydrogenation of the alcohol (AMAF) to the aldehyde AFCA. In order to gain a better understanding of this process, we conducted a study on the reaction kinetics over the catalysts, and the results are shown in Fig. 13 . For the catalysts Ni/SiO2 and Ni@SiO2–0.1 (Fig. 13Aand 13C), the C=O in HMF quickly condenses with NH3 to form imine 1, which is then hydrogenated to AMAF. Once AMAF is formed, the furfuryl alcohol moiety undergoes a slow dehydrogenation process to form AFCA. Subsequently, the C=O in AFCA condenses with ammonia to generate imine 4, which undergoes hydrogenation to give BAF. Simultaneously, the furan ring in AMAF is directly hydrogenated to the by-product AMTFM. Additionally, the generated BAF can undergo self-coupling to produce another by-product BAF-N-BAF. Furthermore, during the reductive amination reaction, HMF can be directly hydrogenated to the by-product BHF, which can further undergo hydrogenation to form BHTHF. In the case of Ni@SiO2–0.1 as a catalyst, the presence of the SiO2 shell provides acidic sites to enhance the condensation of C=O with NH3, thereby inhibiting the direct hydrogenation of HMF and the self-coupling of BAF. Consequently, the selectivity towards by-products BHF, BHTHF, and BAF-N-BAF are reduced. Same as above, the condensation of C=O in HMF with NH3 over the catalysts Co@SiO2–0.2 and Ni@SiO2–0.2 (Fig. 13B and 13D) initially leads to the formation of imine 1, which is hydrogenated to produce AMAF. Once the formation of AMAF, the furfuryl alcohol portion slowly undergoes dehydrogenation to generate AFCA. The generated AFCA rapidly condenses with NH3 to form imine 2, which is subsequently hydrogenated to produce BAF. Throughout this process, no BHF, BHTHF, and BAF-N-BAF were detected, because HMF completely condenses with ammonia on the acid sites of the SiO2 shell before diffusing into the metal core, and the pore volume of the SiO2 shell cannot accommodate two BAF molecules contacting each other, thus completely suppressing the direct hydrogenation of C=O and furan rings as well as the self-coupling of BAF, finally resulting in a further increase in BAF selectivity. For the Ni@SiO2–0.3 catalyst (Fig. 13E), due to the increase in the shell thickness, the small pore size and large channels of the SiO2 shell hinder the diffusion of HMF into and AMAF from the metal core, consequently slowing down the diffusion of AMAF with its hydroxyl towards the metal core and resulting in lower BAF selectivity. Thus, the core–shell structure catalysts exhibit contrasting kinetic properties compared to the impregnated catalysts and show distinct dynamic characteristics depending on the thickness of the SiO2 shell. 4 Conclusion A core–shell structured Ni@SiO2–0.2 catalyst for the one-step catalytically reductive amination of HMF to BAF has been developed. The catalyst demonstrated excellent performance in the reaction, and the yield of BAF reached up to 99 %, which is the best results up till now. The catalyst also showed excellent stability and can be recycled 7 times without obvious loss of its activity. The excellent performance of the Ni@SiO2–0.2 catalyst can be ascribed to the isolation effect of the SiO2 due to its suitable pore structure, selectively allowing reactants (HMF and AMAF) to diffuse to the Ni active centers, preventing direct hydrogenation reactions and self-coupling of BAF. The characterization results revealed that the Ni nanoparticles in the catalyst are uniformly dispersed and encapsulated within the SiO2 shell. The SiO2 shell reduces the binding energy of Ni, decreases the charge density on the Ni surface, and enhances the adsorption of ammonia and intermediates on the Ni surface, thus enhancing its catalytic activity. The porosity and pore size of the SiO2 shell can be tuned by adjusting the amount of TEOS during the preparation to optimize the performance of the catalyst. Besides, the appropriate acidity and acidic sites on the SiO2 shell facilitate the condensation of carbonyl with ammonia to imine, which is the reason to avoid direct hydrogenation of carbonyl to alcohol such as HMF to BHF. CRediT authorship contribution statement Peng Liu: Conceptualization, Data curation, Formal analysis, Investigation, Methodology, Writing – original draft. Xiaolong Li: Data curation, Validation, Methodology. Hongyu Zhang: Conceptualization, Methodology, Writing – review & editing. Yuecheng Zhang: Conceptualization, Data curation, Funding acquisition, Project administration, Resources, Supervision, Writing – review & editing. Jiquan Zhao: Conceptualization, Data curation, Funding acquisition, Supervision, Writing – review & editing. Declaration of competing interest The authors declare that they have no known competing financial interests or personal relationships that could have appeared to influence the work reported in this paper. Acknowledgments We thank the Foundation of Central Government Guides Local Science and Technology Development for financial support (Grant no. 216Z1401G), and the Foundation of Hebei Province biomedicine (Grant no. B2022202064). Appendix A Supplementary data Supplementary data to this article can be found online at https://doi.org/10.1016/j.jcat.2024.115291. Appendix A Supplementary data The following are the Supplementary data to this article: Supplementary data 1 References [1] J. Gonzalez-Sabin F. Rebolledo V. Gotor trans-cyclopentane-1,2-diamine: the second youth of the forgotten diamine Chem. Soc. Rev. 38 7 2009 1916 1925 Gonzalez-Sabin, J.; Rebolledo, F.; Gotor, V., trans-cyclopentane-1,2-diamine: the second youth of the forgotten diamine. Chem Soc Rev 2009, 38 (7), 1916-25. [2] M. Pelckmans T. Renders S. Van de Vyver B.F. Sels Bio-based amines through sustainable heterogeneous catalysis Green Chem. 19 22 2017 5303 5331 Pelckmans, M.; Renders, T.; Van de Vyver, S.; Sels, B. F., Bio-based amines through sustainable heterogeneous catalysis. Green Chemistry 2017, 19 (22), 5303-5331. [3] Y. Jin Y. Zhu W. Zhang Development of organic porous materials through Schiff-base chemistry CrstEngComm 15 8 2013 1484 1499 Jin, Y.; Zhu, Y.; Zhang, W., Development of organic porous materials through Schiff-base chemistry. CrystEngComm 2013, 15 (8), 1484-1499. [4] B. Cheng J. Reyes Recent progress on the total syntheses of macrocyclic diamine alkaloids Nat. Prod. Rep. 37 3 2020 322 337 Cheng, B.; Reyes, J., Recent progress on the total syntheses of macrocyclic diamine alkaloids. Nat Prod Rep 2020, 37 (3), 322-337. [5] Y. Ren M. Wang Q. Yang J. Zhu Merging chiral diamine and Ni/SiO2 for heterogeneous asymmetric 1,4-addition reactions ACS Catal. 13 3 2023 1974 1982 Ren, Y.; Wang, M.; Yang, Q.; Zhu, J., Merging Chiral Diamine and Ni/SiO2 for Heterogeneous Asymmetric 1,4-Addition Reactions. ACS Catalysis 2023, 13 (3), 1974-1982. [6] X. Xu J. Lott K.A. Kelly Z. Shi Adsorption of amine compounds on the glass surface and their impact on the development of analytical method and pharmaceutical process Org. Process Res. Dev. 26 2 2022 431 436 Xu, X.; Lott, J.; Kelly, K. A.; Shi, Z., Adsorption of Amine Compounds on the Glass Surface and Their Impact on the Development of Analytical Method and Pharmaceutical Process. Organic Process Research & Development 2022, 26 (2), 431-436. [7] S. Xie C. Jia Z. Wang S.S.G. Ong M.-J. Zhu H. Lin Mechanistic insight into selective deoxygenation of l-lysine to produce biobased amines ACS Sustain. Chem. Eng. 8 31 2020 11805 11817 Xie, S.; Jia, C.; Wang, Z.; Ong, S. S. G.; Zhu, M.-j.; Lin, H., Mechanistic Insight into Selective Deoxygenation of l-Lysine to Produce Biobased Amines. ACS Sustainable Chemistry & Engineering 2020, 8 (31), 11805-11817. [8] S.J. Gonzalez V. Gotor F. Rebolledo A biocatalytic approach to synthesizing optically active orthogonally protected trans-cyclopentane-1,2-diamine derivatives J. Org. Chem. 72 4 2007 1309 1314 Gonzalez, Sabin J.; Gotor V, Rebolledo F., A biocatalytic approach to synthesizing optically active orthogonally protected trans-cyclopentane-1,2-diamine derivatives. Journal of Organic Chemistry 2007, 72 (4), 1309–1314 [9] N.-T. Le A. Byun Y. Han K.-I. Lee H. Kim Preparation of 2,5-bis(aminomethyl)furan by direct reductive amination of 2,5-diformylfuran over Nickel-Raney catalysts Green Sust. Chem. 05 03 2015 115 127 Le, N.-T.; Byun, A.; Han, Y.; Lee, K.-I.; Kim, H., Preparation of 2,5-Bis(Aminomethyl)Furan by Direct Reductive Amination of 2,5-Diformylfuran over Nickel-Raney Catalysts. Green and Sustainable Chemistry 2015, 05 (03), 115-127. [10] H. Qi F. Liu L. Zhang L. Li Y. Su J. Yang R. Hao A. Wang T. Zhang Modulating trans-imination and hydrogenation towards the highly selective production of primary diamines from dialdehydes Green Chem. 22 20 2020 6897 6901 Qi, H.; Liu, F.; Zhang, L.; Li, L.; Su, Y.; Yang, J.; Hao, R.; Wang, A.; Zhang, T., Modulating trans-imination and hydrogenation towards the highly selective production of primary diamines from dialdehydes. Green Chemistry 2020, 22 (20), 6897-6901. [11] N.K. Gupta P. Reif P. Palenicek M. Rose Toward renewable amines: recent advances in the catalytic amination of biomass-derived oxygenates ACS Catal. 12 16 2022 10400 10440 Gupta, N. K.; Reif, P.; Palenicek, P.; Rose, M., Toward Renewable Amines: Recent Advances in the Catalytic Amination of Biomass-Derived Oxygenates. ACS Catalysis 2022, 12 (16), 10400-10440. [12] K. Zhou H. Liu H. Shu S. Xiao D. Guo Y. Liu Z. Wei X. Li A comprehensive study on the reductive amination of 5-hydroxymethylfurfural into 2,5-bisaminomethylfuran over Raney Ni through DFT calculations ChemCatChem 11 11 2019 2649 2656 Zhou, K.; Liu, H.; Shu, H.; Xiao, S.; Guo, D.; Liu, Y.; Wei, Z.; Li, X., A Comprehensive Study on the Reductive Amination of 5‐Hydroxymethylfurfural into 2,5‐Bisaminomethylfuran over Raney Ni Through DFT Calculations. ChemCatChem 2019, 11 (11), 2649-2656. [13] T. Komanoya T. Kinemura Y. Kita K. Kamata M. Hara Electronic effect of ruthenium nanoparticles on efficient reductive amination of carbonyl compounds J. Am. Chem. Soc. 139 33 2017 11493 11499 Komanoya, T.; Kinemura, T.; Kita, Y.; Kamata, K.; Hara, M., Electronic Effect of Ruthenium Nanoparticles on Efficient Reductive Amination of Carbonyl Compounds. J Am Chem Soc 2017, 139 (33), 11493-11499. [14] H. Yuan B.T. Kusema Z. Yan S. Streiff F. Shi Highly selective synthesis of 2,5-bis(aminomethyl)furan via catalytic amination of 5-(hydroxymethyl)furfural with NH3 over a bifunctional catalyst RSC Adv. 9 66 2019 38877 38881 Yuan, H.; Kusema, B. T.; Yan, Z.; Streiff, S.; Shi, F., Highly selective synthesis of 2,5-bis(aminomethyl)furan via catalytic amination of 5-(hydroxymethyl)furfural with NH3 over a bifunctional catalyst. RSC Adv 2019, 9 (66), 38877-38881. [15] Z. Wei Y. Cheng H. Huang Z. Ma K. Zhou Y. Liu Reductive amination of 5-hydroxymethylfurfural to 2,5-bis(aminomethyl)furan over alumina-supported Ni-based catalytic systems ChemSusChem 15 13 2022 e202200233 Wei, Z.; Cheng, Y.; Huang, H.; Ma, Z.; Zhou, K.; Liu, Y., Reductive Amination of 5-Hydroxymethylfurfural to 2,5-Bis(aminomethyl)furan over Alumina-Supported Ni-Based Catalytic Systems. ChemSusChem 2022, 15 (13), e202200233. [16] Y. Xu X. Jia J. Ma J. Gao F. Xia X. Li J. Xu Selective synthesis of 2,5-bis(aminomethyl)furan via enhancing the catalytic dehydration–hydrogenation of 2,5-diformylfuran dioxime Green Chem. 20 12 2018 2697 2701 Xu, Y.; Jia, X.; Ma, J.; Gao, J.; Xia, F.; Li, X.; Xu, J., Selective synthesis of 2,5-bis(aminomethyl)furan via enhancing the catalytic dehydration–hydrogenation of 2,5-diformylfuran dioxime. Green Chemistry 2018, 20 (12), 2697-2701. [17] D. Pingen J.B. Schwaderer J. Walter J. Wen G. Murray D. Vogt S. Mecking Diamines for polymer materials via direct amination of lipid- and lignocellulose-based alcohols with NH3 ChemCatChem 10 14 2018 3027 3033 Pingen, D.; Schwaderer, J. B.; Walter, J.; Wen, J.; Murray, G.; Vogt, D.; Mecking, S., Diamines for Polymer Materials via Direct Amination of Lipid- and Lignocellulose-based Alcohols with NH3. ChemCatChem 2018, 10 (14), 3027-3033. [18] Z. Wei Y. Cheng K. Zhou Y. Zeng E. Yao Q. Li Y. Liu Y. Sun One-step reductive amination of 5-hydroxymethylfurfural into 2,5-bis(aminomethyl)furan over Raney Ni ChemSusChem 14 11 2021 2308 2312 Wei, Z.; Cheng, Y.; Zhou, K.; Zeng, Y.; Yao, E.; Li, Q.; Liu, Y.; Sun, Y., One-Step Reductive Amination of 5-Hydroxymethylfurfural into 2,5-Bis(aminomethyl)furan over Raney Ni. ChemSusChem 2021, 14 (11), 2308-2312. [19] J. Dai Synthesis of 2,5-diformylfuran from renewable carbohydrates and its applications: a review Green Energy Environ. 6 1 2021 22 32 Dai, J., Synthesis of 2,5-diformylfuran from renewable carbohydrates and its applications: A review. Green Energy & Environment 2021, 6 (1), 22-32. [20] K. An T. Hyeon Synthesis and biomedical applications of hollow nanostructures Nano Today 4 4 2009 359 373 An, K.; Hyeon, T., Synthesis and biomedical applications of hollow nanostructures. Nano Today 2009, 4 (4), 359-373. [21] Q. Lu F. Gao Synthesis and property studies of hollow nanostructures CrstEngComm 18 39 2016 7399 7409 Lu, Q.; Gao, F., Synthesis and property studies of hollow nanostructures. CrystEngComm 2016, 18 (39), 7399-7409. [22] A. Mirzaei J.-H. Kim H.W. Kim S.S. Kim How shell thickness can affect the gas sensing properties of nanostructured materials: survey of literature Sens. Actuat. B 258 2018 270 294 Mirzaei, A.; Kim, J.-H.; Kim, H. W.; Kim, S. S., How shell thickness can affect the gas sensing properties of nanostructured materials: Survey of literature. Sensors and Actuators B: Chemical 2018, 258, 270-294. [23] S. Guo X. Pan H. Gao Z. Yang J. Zhao X. Bao Probing the electronic effect of carbon nanotubes in catalysis: NH3 synthesis with Ru nanoparticles Chemistry 16 18 2010 5379 5384 Guo, S.; Pan, X.; Gao, H.; Yang, Z.; Zhao, J.; Bao, X., Probing the electronic effect of carbon nanotubes in catalysis: NH3 synthesis with Ru nanoparticles. Chemistry 2010, 16 (18), 5379-84. [24] Y. Wang Z. Rong Y. Wang P. Zhang Y. Wang J. Qu Ruthenium nanoparticles loaded on multiwalled carbon nanotubes for liquid-phase hydrogenation of fine chemicals: an exploration of confinement effect J. Catal. 329 2015 95 106 Wang, Y.; Rong, Z.; Wang, Y.; Zhang, P.; Wang, Y.; Qu, J., Ruthenium nanoparticles loaded on multiwalled carbon nanotubes for liquid-phase hydrogenation of fine chemicals: An exploration of confinement effect. Journal of Catalysis 2015, 329, 95-106. [25] M. Xiao Z. Wang M. Lyu B. Luo S. Wang G. Liu H.M. Cheng L. Wang Hollow nanostructures for photocatalysis: advantages and challenges Adv. Mater. 31 38 2019 e1801369 Xiao, M.; Wang, Z.; Lyu, M.; Luo, B.; Wang, S.; Liu, G.; Cheng, H. M.; Wang, L., Hollow Nanostructures for Photocatalysis: Advantages and Challenges. Adv Mater 2019, 31 (38), e1801369. [26] R. Fan Z. Hu C. Chen X. Zhu H. Zhang Y. Zhang H. Zhao G. Wang Highly dispersed nickel anchored on a N-doped carbon molecular sieve derived from metal-organic frameworks for efficient hydrodeoxygenation in the aqueous phase Chem. Commun. (Camb.) 56 49 2020 6696 6699 Fan, R.; Hu, Z.; Chen, C.; Zhu, X.; Zhang, H.; Zhang, Y.; Zhao, H.; Wang, G., Highly dispersed nickel anchored on a N-doped carbon molecular sieve derived from metal-organic frameworks for efficient hydrodeoxygenation in the aqueous phase. Chem Commun (Camb) 2020, 56 (49), 6696-6699. [27] X. Yang Y. Li P. Zhang L. Sun X. Ren H. Mi Hierarchical hollow carbon spheres: Novel synthesis strategy, pore structure engineering and application for micro-supercapacitor Carbon 157 2020 70 79 Yang, X.; Li, Y.; Zhang, P.; Sun, L.; Ren, X.; Mi, H., Hierarchical hollow carbon spheres: Novel synthesis strategy, pore structure engineering and application for micro-supercapacitor. Carbon 2020, 157, 70-79. [28] M. Peer A. Qajar B.-P.-M. Holbrook R. Rajagopalan H.C. Foley Platinum embedded within carbon nanospheres for shape selective liquid phase hydrogenation Carbon 57 2013 485 497 Peer, M.; Qajar, A.; Holbrook, B.-P. M.; Rajagopalan, R.; Foley, H. C., Platinum embedded within carbon nanospheres for shape selective liquid phase hydrogenation. Carbon 2013, 57, 485-497. [29] A. Nakhaei Pour M.R. Housaindokht S.M. Kamali Shahri Fischer-Tropsch synthesis over cobalt/CNTs catalysts: functionalized support and catalyst preparation effect on activity and kinetic parameters Ind. Eng. Chem. Res. 57 41 2018 13639 13649 Nakhaei Pour, A.; Housaindokht, M. R.; Kamali Shahri, S. M., Fischer–Tropsch Synthesis over Cobalt/CNTs Catalysts: Functionalized Support and Catalyst Preparation Effect on Activity and Kinetic Parameters. Industrial & Engineering Chemistry Research 2018, 57 (41), 13639-13649. [30] S. Gao Z. Liu S. Xu A. Zheng P. Wu B. Li X. Yuan Y. Wei Z. Liu Cavity-controlled diffusion in 8-membered ring molecular sieve catalysts for shape selective strategy J. Catal. 377 2019 51 62 Gao, S.; Liu, Z.; Xu, S.; Zheng, A.; Wu, P.; Li, B.; Yuan, X.; Wei, Y.; Liu, Z., Cavity-controlled diffusion in 8-membered ring molecular sieve catalysts for shape selective strategy. Journal of Catalysis 2019, 377, 51-62. [31] J. Han Z. Liu H. Li J. Zhong W. Zhang J. Huang A. Zheng Y. Wei Z. Liu Simultaneous evaluation of reaction and diffusion over molecular sieves for shape-selective catalysis ACS Catal. 10 15 2020 8727 8735 Han, J.; Liu, Z.; Li, H.; Zhong, J.; Zhang, W.; Huang, J.; Zheng, A.; Wei, Y.; Liu, Z., Simultaneous Evaluation of Reaction and Diffusion over Molecular Sieves for Shape-Selective Catalysis. ACS Catalysis 2020, 10 (15), 8727-8735. [32] A. Corma S.B. Hamid S. Iborra A. Velty Surfactants from biomass: a two-step cascade reaction for the synthesis of sorbitol fatty acid esters using solid acid catalysts ChemSusChem 1 1–2 2008 85 90 Corma, A.; Hamid, S. B.; Iborra, S.; Velty, A., Surfactants from biomass: a two-step cascade reaction for the synthesis of sorbitol fatty acid esters using solid acid catalysts. ChemSusChem 2008, 1 (1-2), 85-90. [33] Z. Jin X. Yi L. Wang S. Xu C. Wang Q. Wu L. Wang A. Zheng F.-S. Xiao Metal-acid interfaces enveloped in zeolite crystals for cascade biomass hydrodeoxygenation Appl. Catal. B 254 2019 560 568 Jin, Z.; Yi, X.; Wang, L.; Xu, S.; Wang, C.; Wu, Q.; Wang, L.; Zheng, A.; Xiao, F.-S., Metal-acid interfaces enveloped in zeolite crystals for cascade biomass hydrodeoxygenation. Applied Catalysis B: Environmental 2019, 254, 560-568. [34] M. Besson P. Gallezot Deactivation of metal catalysts in liquid phase organic reactions Catal. Today 81 4 2003 547 559 Besson, M.; Gallezot, P., Deactivation of metal catalysts in liquid phase organic reactions. Catalysis Today 2003, 81 (4), 547-559. [35] B.J. O'Neill D.H. Jackson A.J. Crisci C.A. Farberow F. Shi A.C. Alba-Rubio J. Lu P.J. Dietrich X. Gu C.L. Marshall P.C. Stair J.W. Elam J.T. Miller F.H. Ribeiro P.M. Voyles J. Greeley M. Mavrikakis S.L. Scott T.F. Kuech J.A. Dumesic Stabilization of copper catalysts for liquid-phase reactions by atomic layer deposition Angew. Chem. Int. Ed. Engl. 52 51 2013 13808 13812 O'Neill, B. J.; Jackson, D. H.; Crisci, A. J.; Farberow, C. A.; Shi, F.; Alba-Rubio, A. C.; Lu, J.; Dietrich, P. J.; Gu, X.; Marshall, C. L.; Stair, P. C.; Elam, J. W.; Miller, J. T.; Ribeiro, F. H.; Voyles, P. M.; Greeley, J.; Mavrikakis, M.; Scott, S. L.; Kuech, T. F.; Dumesic, J. A., Stabilization of copper catalysts for liquid-phase reactions by atomic layer deposition. Angew Chem Int Ed Engl 2013, 52 (51), 13808-12. [36] J. Liu J. Liu Z. Zhao J. Tan Y. Wei W. Song Fe/Beta@SBA-15 core-shell catalyst: interface stable effect and propene poisoning resistance for no abatement AIChE J 64 11 2018 3967 3978 Liu, J.; Liu, J.; Zhao, Z.; Tan, J.; Wei, Y.; Song, W., Fe/Beta@SBA‐15 core‐shell catalyst: Interface stable effect and propene poisoning resistance for no abatement. AIChE Journal 2018, 64 (11), 3967-3978. [37] Z. Yu X. Lu H. Bai J. Xiong W. Feng N. Ji Effects of solid acid supports on the bifunctional catalysis of levulinic acid to gamma-valerolactone: catalytic activity and stability Chem. Asian J. 15 8 2020 1182 1201 Yu, Z.; Lu, X.; Bai, H.; Xiong, J.; Feng, W.; Ji, N., Effects of Solid Acid Supports on the Bifunctional Catalysis of Levulinic Acid to gamma-Valerolactone: Catalytic Activity and Stability. Chem Asian J 2020, 15 (8), 1182-1201. [38] L. Jia J. Liu D. Huang J. Zhao J. Zhang K. Li Z. Li W. Zhu Z. Zhao J. Liu Interface engineering of a bifunctional Cu-SSZ-13@CZO core-shell catalyst for boosting potassium ion and SO2 tolerance ACS Catal. 12 18 2022 11281 11293 Jia, L.; Liu, J.; Huang, D.; Zhao, J.; Zhang, J.; Li, K.; Li, Z.; Zhu, W.; Zhao, Z.; Liu, J., Interface Engineering of a Bifunctional Cu-SSZ-13@CZO Core–Shell Catalyst for Boosting Potassium Ion and SO2 Tolerance. ACS Catalysis 2022, 12 (18), 11281-11293. [39] Y. Liu K. Zhou H. Shu H. Liu J. Lou D. Guo Z. Wei X. Li Switchable synthesis of furfurylamine and tetrahydrofurfurylamine from furfuryl alcohol over RANEY nickel Cat. Sci. Technol. 7 18 2017 4129 4135 Liu, Y.; Zhou, K.; Shu, H.; Liu, H.; Lou, J.; Guo, D.; Wei, Z.; Li, X., Switchable synthesis of furfurylamine and tetrahydrofurfurylamine from furfuryl alcohol over RANEY nickel. Catalysis Science & Technology 2017, 7 (18), 4129-4135. [40] D. Chandra Y. Inoue M. Sasase M. Kitano A. Bhaumik K. Kamata H. Hosono M. Hara A high performance catalyst of shape-specific ruthenium nanoparticles for production of primary amines by reductive amination of carbonyl compounds Chem. Sci. 9 27 2018 5949 5956 Chandra, D.; Inoue, Y.; Sasase, M.; Kitano, M.; Bhaumik, A.; Kamata, K.; Hosono, H.; Hara, M., A high performance catalyst of shape-specific ruthenium nanoparticles for production of primary amines by reductive amination of carbonyl compounds. Chem Sci 2018, 9 (27), 5949-5956. [41] D. Ruiz A. Aho T. Saloranta K. Eränen J. Wärnå R. Leino D.Y. Murzin Direct amination of dodecanol with NH3 over heterogeneous catalysts. Catalyst screening and kinetic modelling Chem. Eng. J. 307 2017 739 749 Ruiz, D.; Aho, A.; Saloranta, T.; Eränen, K.; Wärnå, J.; Leino, R.; Murzin, D. Y., Direct amination of dodecanol with NH3 over heterogeneous catalysts. Catalyst screening and kinetic modelling. Chemical Engineering Journal 2017, 307, 739-749. [42] H. Liu G.-K. Chuah S. Jaenicke Self-coupling of benzylamines over a highly active and selective supported copper catalyst to produce N-substituted amines by the borrowing hydrogen method J. Catal. 329 2015 262 268 Liu, H.; Chuah, G.-K.; Jaenicke, S., Self-coupling of benzylamines over a highly active and selective supported copper catalyst to produce N-substituted amines by the borrowing hydrogen method. Journal of Catalysis 2015, 329, 262-268. [43] K. Han S. Wang N. Hu W. Shi F. Wang Alloying Ni-Cu nanoparticles encapsulated in SiO2 nanospheres for synergistic catalysts in CO2 reforming with methane reaction ACS Appl. Mater. Interf. 2022 Han, K.; Wang, S.; Hu, N.; Shi, W.; Wang, F., Alloying Ni-Cu Nanoparticles Encapsulated in SiO2 Nanospheres for Synergistic Catalysts in CO2 Reforming with Methane Reaction. ACS Appl Mater Interfaces 2022. [44] S. Gong A. Wang Y. Wang H. Liu N. Han Y. Chen Heterostructured Ni/NiO nanocatalysts for ozone decomposition ACS Appl. Nano Mater. 3 1 2019 597 607 Gong, S.; Wang, A.; Wang, Y.; Liu, H.; Han, N.; Chen, Y., Heterostructured Ni/NiO Nanocatalysts for Ozone Decomposition. ACS Applied Nano Materials 2019, 3 (1), 597-607. [45] S. Ghosh T. Ourlin J. Mazarío S. Cayez S. Daccache J. Carrey B. Chaudret Fe@SiO2@Ni: an iron-based composite material for magnetically induced hydrogenation reactions in gas and solution phases Chem. Mater. 2023 Ghosh, S.; Ourlin, T.; Mazarío, J.; Cayez, S.; Daccache, S.; Carrey, J.; Chaudret, B., Fe@SiO2@Ni: An Iron-Based Composite Material for Magnetically Induced Hydrogenation Reactions in Gas and Solution Phases. Chemistry of Materials 2023. [46] M. Yusuf G. Leeke J. Wood Anisole hydrodeoxygenation over nickel-based catalysts: influences of solvent and support properties Energy Fuel 37 2 2023 1225 1237 Yusuf, M.; Leeke, G.; Wood, J., Anisole Hydrodeoxygenation over Nickel-Based Catalysts: Influences of Solvent and Support Properties. Energy & Fuels 2023, 37 (2), 1225-1237. [47] C.A.H. Price L. Pastor-Perez T.R. Reina J. Liu Yolk-Shell structured NiCo@SiO2 nanoreactor for CO2 upgrading via reverse water-gas shift reaction Catal. Today 383 2022 358 367 Price, C. A. H.; Pastor-Perez, L.; Reina, T. R.; Liu, J., Yolk-Shell structured NiCo@SiO2 nanoreactor for CO2 upgrading via reverse water-gas shift reaction. Catalysis Today 2022, 383, 358-367. [48] N. Liu B. Chen K. Liu R. Qin J. Wang Y. Zhang Q. Zhang L. Gu P. Liu K. Cao P. Yan G. Fu N. Zheng Ensemble effect of the nickel-silica interface promotes the water-gas shift reaction ACS Catal. 13 11 2023 7347 7357 Liu, N.; Chen, B.; Liu, K.; Qin, R.; Wang, J.; Zhang, Y.; Zhang, Q.; Gu, L.; Liu, P.; Cao, K.; Yan, P.; Fu, G.; Zheng, N., Ensemble Effect of the Nickel–Silica Interface Promotes the Water–Gas Shift Reaction. ACS Catalysis 2023, 13 (11), 7347-7357. [49] M. Lv S. Yu S. Liu L. Li H. Yu Q. Wu J. Pang Y. Liu C. Xie Y. Liu One-pot synthesis of stable Pd@mSiO2 core-shell nanospheres with controlled pore structure and their application to the hydrogenation reaction Dalton Trans. 48 20 2019 7015 7024 Lv, M.; Yu, S.; Liu, S.; Li, L.; Yu, H.; Wu, Q.; Pang, J.; Liu, Y.; Xie, C.; Liu, Y., One-pot synthesis of stable Pd@mSiO2 core-shell nanospheres with controlled pore structure and their application to the hydrogenation reaction. Dalton Trans 2019, 48 (20), 7015-7024. [50] G. Li Y. Tan Z. Lei F. Yin X. He Ni nanoparticles supported on high surface area carborundum for enhanced hydrogen production by ammonia decomposition ACS Appl. Nano Mater. 6 11 2023 9892 9900 Li, G.; Tan, Y.; Lei, Z.; Yin, F.; He, X., Ni Nanoparticles Supported on High Surface Area Carborundum for Enhanced Hydrogen Production by Ammonia Decomposition. ACS Applied Nano Materials 2023, 6 (11), 9892-9900. [51] P.S. Bagus C.J. Nelin C.R. Brundle B.V. Crist E.S. Ilton N. Lahiri K.M. Rosso Main and satellite features in the Ni 2p XPS of NiO Inorg. Chem. 61 45 2022 18077 18094 Bagus, P. S.; Nelin, C. J.; Brundle, C. R.; Crist, B. V.; Ilton, E. S.; Lahiri, N.; Rosso, K. M., Main and Satellite Features in the Ni 2p XPS of NiO. Inorg Chem 2022, 61 (45), 18077-18094. [52] L. Wang X. Jv R. Wang L. Ma J. Liu J. Sun T. Shi L. Zhao X. Zhang B. Wang Highly selective synergistic n-alkylation of amines with ROH catalyzed by nickel-ruthenium ACS Sustain. Chem. Eng. 10 26 2022 8342 8349 Wang, L.; Jv, X.; Wang, R.; Ma, L.; Liu, J.; Sun, J.; Shi, T.; Zhao, L.; Zhang, X.; Wang, B., Highly Selective Synergistic N-Alkylation of Amines with ROH Catalyzed by Nickel–Ruthenium. ACS Sustainable Chemistry & Engineering 2022, 10 (26), 8342-8349. [53] P. Burattin M. Che C. Louis Characterization of the Ni (Ⅱ) phase formed on silica upon depositionprecipitation J. Phys. Chem. B 101 36 1997 7060 7074 Burattin, P.; Che, M.; Louis, C., Characterization of the Ni (Ⅱ) phase formed on silica upon depositionprecipitation. The Journal of Physical Chemistry B 1997, 101 (36), 7060-7074. [54] N. Zhou Q. An Z. Xiao S. Zhai Z. Shi Rational design of superior microwave shielding composites employing synergy of encapsulating character of alginate hydrogels and task-specific components (Ni NPs, Fe3O4/CNTs) ACS Sustain. Chem. Eng. 5 6 2017 5394 5407 Zhou, N.; An, Q.; Xiao, Z.; Zhai, S.; Shi, Z., Rational Design of Superior Microwave Shielding Composites Employing Synergy of Encapsulating Character of Alginate Hydrogels and Task-Specific Components (Ni NPs, Fe3O4/CNTs). ACS Sustainable Chemistry & Engineering 2017, 5 (6), 5394-5407. [55] X. Li J. Tian H. Liu C. Tang C. Xia J. Chen Z. Huang Effective synthesis of 5-amino-1-pentanol by reductive amination of biomass-derived 2-hydroxytetrahydropyran over supported Ni catalysts Chin. J. Catal. 41 4 2020 631 641 Li, X.; Tian, J.; Liu, H.; Tang, C.; Xia, C.; Chen, J.; Huang, Z., Effective synthesis of 5-amino-1-pentanol by reductive amination of biomass-derived 2-hydroxytetrahydropyran over supported Ni catalysts. Chinese Journal of Catalysis 2020, 41 (4), 631-641. [56] Z. Xie H. An X. Zhao Y. Wang Insight into highly catalytic performance of Co/γ-Al2O3 for ethylene glycol amination: promotion of catalytic activity of Co by acid sites and base sites. Mole. Catal. 528 2022 Xie, Z.; An, H.; Zhao, X.; Wang, Y., Insight into highly catalytic performance of Co/γ-Al2O3 for ethylene glycol amination: Promotion of catalytic activity of Co by acid sites and base sites. Molecular Catalysis 2022, 528.",
      "scopus-id": "85181983097",
      "coredata": {
        "eid": "1-s2.0-S0021951724000046",
        "dc:description": "2,5-Bis(aminomethyl)furan (BAF) is a diamine that is expected to have extensive applications in organic synthesis, medicine and polymer materials such as polyamides and polyimides. BAF can be prepared by one-step reductive amination of 5-hydroxymethylfurfural (HMF), one of the platform compounds for the added-valueconversion of biomass. Due to its complex structure, the one-step catalytically reductive amination of HMF to BAF in high yield is still a challenging issue. Herein, a core–shell structured catalyst (Ni@SiO2–0.2) was developed for this reaction, and the yield of BAF reached up to 99 % with aqueous ammonia as both ammonia source and solvent due to an isolation effect of the SiO2 shell. The isolation effect can prevent direct hydrogenation of HMF and self-coupling of BAF, thereby enhancing the selectivity of the reductive amination of HMF to BAF. In addition, the textural structure, acidity and acidic sites of the SiO2 shell can be tuned by adjusting the amount of TEOS during the catalyst preparation process, thus optimizing the performance of the catalyst. The characterization results also revealed that the Ni nanoparticles in the catalyst are uniformly dispersed and encapsulated within the SiO2 shell, which can decrease the charge density on the Ni surface and enhance the adsorption of ammonia and intermediates on the Ni surface, thus enhancing the catalytic activity of the catalyst.",
        "openArchiveArticle": "false",
        "prism:coverDate": "2024-01-31",
        "openaccessUserLicense": null,
        "prism:aggregationType": "Journal",
        "prism:url": "https://api.elsevier.com/content/article/pii/S0021951724000046",
        "dc:creator": [
          {
            "@_fa": "true",
            "$": "Liu, Peng"
          },
          {
            "@_fa": "true",
            "$": "Li, Xiaolong"
          },
          {
            "@_fa": "true",
            "$": "Zhang, Hongyu"
          },
          {
            "@_fa": "true",
            "$": "Zhang, Yuecheng"
          },
          {
            "@_fa": "true",
            "$": "Zhao, Jiquan"
          }
        ],
        "link": [
          {
            "@_fa": "true",
            "@rel": "self",
            "@href": "https://api.elsevier.com/content/article/pii/S0021951724000046"
          },
          {
            "@_fa": "true",
            "@rel": "scidir",
            "@href": "https://www.sciencedirect.com/science/article/pii/S0021951724000046"
          }
        ],
        "dc:format": "application/json",
        "openaccessType": null,
        "pii": "S0021-9517(24)00004-6",
        "prism:volume": "429",
        "articleNumber": "115291",
        "prism:publisher": "Elsevier Inc.",
        "dc:title": "One-step reductive amination of 5-hydroxymethylfurfural to 2,5-bis(aminomethyl)furan over a core–shell structured catalyst",
        "prism:copyright": "© 2024 Elsevier Inc. All rights reserved.",
        "openaccess": "0",
        "prism:issn": "00219517",
        "dcterms:subject": [
          {
            "@_fa": "true",
            "$": "One-step reductive amination"
          },
          {
            "@_fa": "true",
            "$": "Core-shell structure"
          },
          {
            "@_fa": "true",
            "$": "Ni@SiO2 catalyst"
          },
          {
            "@_fa": "true",
            "$": "5-Hydroxymethylfurfural"
          },
          {
            "@_fa": "true",
            "$": "2,5-Bis(aminomethyl)furan"
          }
        ],
        "openaccessArticle": "false",
        "prism:publicationName": "Journal of Catalysis",
        "openaccessSponsorType": null,
        "prism:pageRange": "115291",
        "pubType": "fla",
        "prism:coverDisplayDate": "January 2024",
        "prism:doi": "10.1016/j.jcat.2024.115291",
        "prism:startingPage": "115291",
        "dc:identifier": "doi:10.1016/j.jcat.2024.115291",
        "openaccessSponsorName": null
      },
      "objects": {
        "object": [
          {
            "@category": "standard",
            "@height": "464",
            "@width": "535",
            "@_fa": "true",
            "$": "https://api.elsevier.com/content/object/eid/1-s2.0-S0021951724000046-gr9.jpg?httpAccept=%2A%2F%2A",
            "@multimediatype": "JPEG image file",
            "@type": "IMAGE-DOWNSAMPLED",
            "@size": "51078",
            "@ref": "gr9",
            "@mimetype": "image/jpeg"
          },
          {
            "@category": "standard",
            "@height": "442",
            "@width": "535",
            "@_fa": "true",
            "$": "https://api.elsevier.com/content/object/eid/1-s2.0-S0021951724000046-gr6.jpg?httpAccept=%2A%2F%2A",
            "@multimediatype": "JPEG image file",
            "@type": "IMAGE-DOWNSAMPLED",
            "@size": "50885",
            "@ref": "gr6",
            "@mimetype": "image/jpeg"
          },
          {
            "@category": "standard",
            "@height": "401",
            "@width": "535",
            "@_fa": "true",
            "$": "https://api.elsevier.com/content/object/eid/1-s2.0-S0021951724000046-gr5.jpg?httpAccept=%2A%2F%2A",
            "@multimediatype": "JPEG image file",
            "@type": "IMAGE-DOWNSAMPLED",
            "@size": "53366",
            "@ref": "gr5",
            "@mimetype": "image/jpeg"
          },
          {
            "@category": "standard",
            "@height": "245",
            "@width": "644",
            "@_fa": "true",
            "$": "https://api.elsevier.com/content/object/eid/1-s2.0-S0021951724000046-gr8.jpg?httpAccept=%2A%2F%2A",
            "@multimediatype": "JPEG image file",
            "@type": "IMAGE-DOWNSAMPLED",
            "@size": "48596",
            "@ref": "gr8",
            "@mimetype": "image/jpeg"
          },
          {
            "@category": "standard",
            "@height": "458",
            "@width": "535",
            "@_fa": "true",
            "$": "https://api.elsevier.com/content/object/eid/1-s2.0-S0021951724000046-gr7.jpg?httpAccept=%2A%2F%2A",
            "@multimediatype": "JPEG image file",
            "@type": "IMAGE-DOWNSAMPLED",
            "@size": "66642",
            "@ref": "gr7",
            "@mimetype": "image/jpeg"
          },
          {
            "@category": "standard",
            "@height": "392",
            "@width": "535",
            "@_fa": "true",
            "$": "https://api.elsevier.com/content/object/eid/1-s2.0-S0021951724000046-gr2.jpg?httpAccept=%2A%2F%2A",
            "@multimediatype": "JPEG image file",
            "@type": "IMAGE-DOWNSAMPLED",
            "@size": "41875",
            "@ref": "gr2",
            "@mimetype": "image/jpeg"
          },
          {
            "@category": "standard",
            "@height": "631",
            "@width": "602",
            "@_fa": "true",
            "$": "https://api.elsevier.com/content/object/eid/1-s2.0-S0021951724000046-gr14.jpg?httpAccept=%2A%2F%2A",
            "@multimediatype": "JPEG image file",
            "@type": "IMAGE-DOWNSAMPLED",
            "@size": "50058",
            "@ref": "gr14",
            "@mimetype": "image/jpeg"
          },
          {
            "@category": "standard",
            "@height": "307",
            "@width": "535",
            "@_fa": "true",
            "$": "https://api.elsevier.com/content/object/eid/1-s2.0-S0021951724000046-gr1.jpg?httpAccept=%2A%2F%2A",
            "@multimediatype": "JPEG image file",
            "@type": "IMAGE-DOWNSAMPLED",
            "@size": "25120",
            "@ref": "gr1",
            "@mimetype": "image/jpeg"
          },
          {
            "@category": "standard",
            "@height": "401",
            "@width": "535",
            "@_fa": "true",
            "$": "https://api.elsevier.com/content/object/eid/1-s2.0-S0021951724000046-gr4.jpg?httpAccept=%2A%2F%2A",
            "@multimediatype": "JPEG image file",
            "@type": "IMAGE-DOWNSAMPLED",
            "@size": "47916",
            "@ref": "gr4",
            "@mimetype": "image/jpeg"
          },
          {
            "@category": "standard",
            "@height": "401",
            "@width": "535",
            "@_fa": "true",
            "$": "https://api.elsevier.com/content/object/eid/1-s2.0-S0021951724000046-gr3.jpg?httpAccept=%2A%2F%2A",
            "@multimediatype": "JPEG image file",
            "@type": "IMAGE-DOWNSAMPLED",
            "@size": "55235",
            "@ref": "gr3",
            "@mimetype": "image/jpeg"
          },
          {
            "@category": "standard",
            "@height": "314",
            "@width": "776",
            "@_fa": "true",
            "$": "https://api.elsevier.com/content/object/eid/1-s2.0-S0021951724000046-gr10.jpg?httpAccept=%2A%2F%2A",
            "@multimediatype": "JPEG image file",
            "@type": "IMAGE-DOWNSAMPLED",
            "@size": "83809",
            "@ref": "gr10",
            "@mimetype": "image/jpeg"
          },
          {
            "@category": "standard",
            "@height": "533",
            "@width": "534",
            "@_fa": "true",
            "$": "https://api.elsevier.com/content/object/eid/1-s2.0-S0021951724000046-gr11.jpg?httpAccept=%2A%2F%2A",
            "@multimediatype": "JPEG image file",
            "@type": "IMAGE-DOWNSAMPLED",
            "@size": "127305",
            "@ref": "gr11",
            "@mimetype": "image/jpeg"
          },
          {
            "@category": "standard",
            "@height": "332",
            "@width": "383",
            "@_fa": "true",
            "$": "https://api.elsevier.com/content/object/eid/1-s2.0-S0021951724000046-gr12.jpg?httpAccept=%2A%2F%2A",
            "@multimediatype": "JPEG image file",
            "@type": "IMAGE-DOWNSAMPLED",
            "@size": "38789",
            "@ref": "gr12",
            "@mimetype": "image/jpeg"
          },
          {
            "@category": "standard",
            "@height": "754",
            "@width": "608",
            "@_fa": "true",
            "$": "https://api.elsevier.com/content/object/eid/1-s2.0-S0021951724000046-gr13.jpg?httpAccept=%2A%2F%2A",
            "@multimediatype": "JPEG image file",
            "@type": "IMAGE-DOWNSAMPLED",
            "@size": "102124",
            "@ref": "gr13",
            "@mimetype": "image/jpeg"
          },
          {
            "@category": "standard",
            "@height": "200",
            "@width": "347",
            "@_fa": "true",
            "$": "https://api.elsevier.com/content/object/eid/1-s2.0-S0021951724000046-ga1.jpg?httpAccept=%2A%2F%2A",
            "@multimediatype": "JPEG image file",
            "@type": "IMAGE-DOWNSAMPLED",
            "@size": "13629",
            "@ref": "ga1",
            "@mimetype": "image/jpeg"
          },
          {
            "@category": "thumbnail",
            "@height": "164",
            "@width": "189",
            "@_fa": "true",
            "$": "https://api.elsevier.com/content/object/eid/1-s2.0-S0021951724000046-gr9.sml?httpAccept=%2A%2F%2A",
            "@multimediatype": "GIF image file",
            "@type": "IMAGE-THUMBNAIL",
            "@size": "6410",
            "@ref": "gr9",
            "@mimetype": "image/gif"
          },
          {
            "@category": "thumbnail",
            "@height": "164",
            "@width": "198",
            "@_fa": "true",
            "$": "https://api.elsevier.com/content/object/eid/1-s2.0-S0021951724000046-gr6.sml?httpAccept=%2A%2F%2A",
            "@multimediatype": "GIF image file",
            "@type": "IMAGE-THUMBNAIL",
            "@size": "12286",
            "@ref": "gr6",
            "@mimetype": "image/gif"
          },
          {
            "@category": "thumbnail",
            "@height": "164",
            "@width": "218",
            "@_fa": "true",
            "$": "https://api.elsevier.com/content/object/eid/1-s2.0-S0021951724000046-gr5.sml?httpAccept=%2A%2F%2A",
            "@multimediatype": "GIF image file",
            "@type": "IMAGE-THUMBNAIL",
            "@size": "12386",
            "@ref": "gr5",
            "@mimetype": "image/gif"
          },
          {
            "@category": "thumbnail",
            "@height": "83",
            "@width": "219",
            "@_fa": "true",
            "$": "https://api.elsevier.com/content/object/eid/1-s2.0-S0021951724000046-gr8.sml?httpAccept=%2A%2F%2A",
            "@multimediatype": "GIF image file",
            "@type": "IMAGE-THUMBNAIL",
            "@size": "7403",
            "@ref": "gr8",
            "@mimetype": "image/gif"
          },
          {
            "@category": "thumbnail",
            "@height": "164",
            "@width": "191",
            "@_fa": "true",
            "$": "https://api.elsevier.com/content/object/eid/1-s2.0-S0021951724000046-gr7.sml?httpAccept=%2A%2F%2A",
            "@multimediatype": "GIF image file",
            "@type": "IMAGE-THUMBNAIL",
            "@size": "8687",
            "@ref": "gr7",
            "@mimetype": "image/gif"
          },
          {
            "@category": "thumbnail",
            "@height": "161",
            "@width": "219",
            "@_fa": "true",
            "$": "https://api.elsevier.com/content/object/eid/1-s2.0-S0021951724000046-gr2.sml?httpAccept=%2A%2F%2A",
            "@multimediatype": "GIF image file",
            "@type": "IMAGE-THUMBNAIL",
            "@size": "8603",
            "@ref": "gr2",
            "@mimetype": "image/gif"
          },
          {
            "@category": "thumbnail",
            "@height": "163",
            "@width": "156",
            "@_fa": "true",
            "$": "https://api.elsevier.com/content/object/eid/1-s2.0-S0021951724000046-gr14.sml?httpAccept=%2A%2F%2A",
            "@multimediatype": "GIF image file",
            "@type": "IMAGE-THUMBNAIL",
            "@size": "3679",
            "@ref": "gr14",
            "@mimetype": "image/gif"
          },
          {
            "@category": "thumbnail",
            "@height": "126",
            "@width": "219",
            "@_fa": "true",
            "$": "https://api.elsevier.com/content/object/eid/1-s2.0-S0021951724000046-gr1.sml?httpAccept=%2A%2F%2A",
            "@multimediatype": "GIF image file",
            "@type": "IMAGE-THUMBNAIL",
            "@size": "7737",
            "@ref": "gr1",
            "@mimetype": "image/gif"
          },
          {
            "@category": "thumbnail",
            "@height": "164",
            "@width": "219",
            "@_fa": "true",
            "$": "https://api.elsevier.com/content/object/eid/1-s2.0-S0021951724000046-gr4.sml?httpAccept=%2A%2F%2A",
            "@multimediatype": "GIF image file",
            "@type": "IMAGE-THUMBNAIL",
            "@size": "9480",
            "@ref": "gr4",
            "@mimetype": "image/gif"
          },
          {
            "@category": "thumbnail",
            "@height": "164",
            "@width": "219",
            "@_fa": "true",
            "$": "https://api.elsevier.com/content/object/eid/1-s2.0-S0021951724000046-gr3.sml?httpAccept=%2A%2F%2A",
            "@multimediatype": "GIF image file",
            "@type": "IMAGE-THUMBNAIL",
            "@size": "11951",
            "@ref": "gr3",
            "@mimetype": "image/gif"
          },
          {
            "@category": "thumbnail",
            "@height": "89",
            "@width": "219",
            "@_fa": "true",
            "$": "https://api.elsevier.com/content/object/eid/1-s2.0-S0021951724000046-gr10.sml?httpAccept=%2A%2F%2A",
            "@multimediatype": "GIF image file",
            "@type": "IMAGE-THUMBNAIL",
            "@size": "8090",
            "@ref": "gr10",
            "@mimetype": "image/gif"
          },
          {
            "@category": "thumbnail",
            "@height": "164",
            "@width": "164",
            "@_fa": "true",
            "$": "https://api.elsevier.com/content/object/eid/1-s2.0-S0021951724000046-gr11.sml?httpAccept=%2A%2F%2A",
            "@multimediatype": "GIF image file",
            "@type": "IMAGE-THUMBNAIL",
            "@size": "22805",
            "@ref": "gr11",
            "@mimetype": "image/gif"
          },
          {
            "@category": "thumbnail",
            "@height": "164",
            "@width": "189",
            "@_fa": "true",
            "$": "https://api.elsevier.com/content/object/eid/1-s2.0-S0021951724000046-gr12.sml?httpAccept=%2A%2F%2A",
            "@multimediatype": "GIF image file",
            "@type": "IMAGE-THUMBNAIL",
            "@size": "8999",
            "@ref": "gr12",
            "@mimetype": "image/gif"
          },
          {
            "@category": "thumbnail",
            "@height": "164",
            "@width": "132",
            "@_fa": "true",
            "$": "https://api.elsevier.com/content/object/eid/1-s2.0-S0021951724000046-gr13.sml?httpAccept=%2A%2F%2A",
            "@multimediatype": "GIF image file",
            "@type": "IMAGE-THUMBNAIL",
            "@size": "7756",
            "@ref": "gr13",
            "@mimetype": "image/gif"
          },
          {
            "@category": "thumbnail",
            "@height": "126",
            "@width": "219",
            "@_fa": "true",
            "$": "https://api.elsevier.com/content/object/eid/1-s2.0-S0021951724000046-ga1.sml?httpAccept=%2A%2F%2A",
            "@multimediatype": "GIF image file",
            "@type": "IMAGE-THUMBNAIL",
            "@size": "7750",
            "@ref": "ga1",
            "@mimetype": "image/gif"
          },
          {
            "@category": "high",
            "@height": "2053",
            "@width": "2368",
            "@_fa": "true",
            "$": "https://api.elsevier.com/content/object/eid/1-s2.0-S0021951724000046-gr9_lrg.jpg?httpAccept=%2A%2F%2A",
            "@multimediatype": "JPEG image file",
            "@type": "IMAGE-HIGH-RES",
            "@size": "605741",
            "@ref": "gr9",
            "@mimetype": "image/jpeg"
          },
          {
            "@category": "high",
            "@height": "1958",
            "@width": "2368",
            "@_fa": "true",
            "$": "https://api.elsevier.com/content/object/eid/1-s2.0-S0021951724000046-gr6_lrg.jpg?httpAccept=%2A%2F%2A",
            "@multimediatype": "JPEG image file",
            "@type": "IMAGE-HIGH-RES",
            "@size": "649103",
            "@ref": "gr6",
            "@mimetype": "image/jpeg"
          },
          {
            "@category": "high",
            "@height": "1777",
            "@width": "2368",
            "@_fa": "true",
            "$": "https://api.elsevier.com/content/object/eid/1-s2.0-S0021951724000046-gr5_lrg.jpg?httpAccept=%2A%2F%2A",
            "@multimediatype": "JPEG image file",
            "@type": "IMAGE-HIGH-RES",
            "@size": "643678",
            "@ref": "gr5",
            "@mimetype": "image/jpeg"
          },
          {
            "@category": "high",
            "@height": "1083",
            "@width": "2852",
            "@_fa": "true",
            "$": "https://api.elsevier.com/content/object/eid/1-s2.0-S0021951724000046-gr8_lrg.jpg?httpAccept=%2A%2F%2A",
            "@multimediatype": "JPEG image file",
            "@type": "IMAGE-HIGH-RES",
            "@size": "588155",
            "@ref": "gr8",
            "@mimetype": "image/jpeg"
          },
          {
            "@category": "high",
            "@height": "2029",
            "@width": "2368",
            "@_fa": "true",
            "$": "https://api.elsevier.com/content/object/eid/1-s2.0-S0021951724000046-gr7_lrg.jpg?httpAccept=%2A%2F%2A",
            "@multimediatype": "JPEG image file",
            "@type": "IMAGE-HIGH-RES",
            "@size": "672320",
            "@ref": "gr7",
            "@mimetype": "image/jpeg"
          },
          {
            "@category": "high",
            "@height": "1736",
            "@width": "2368",
            "@_fa": "true",
            "$": "https://api.elsevier.com/content/object/eid/1-s2.0-S0021951724000046-gr2_lrg.jpg?httpAccept=%2A%2F%2A",
            "@multimediatype": "JPEG image file",
            "@type": "IMAGE-HIGH-RES",
            "@size": "576685",
            "@ref": "gr2",
            "@mimetype": "image/jpeg"
          },
          {
            "@category": "high",
            "@height": "2794",
            "@width": "2666",
            "@_fa": "true",
            "$": "https://api.elsevier.com/content/object/eid/1-s2.0-S0021951724000046-gr14_lrg.jpg?httpAccept=%2A%2F%2A",
            "@multimediatype": "JPEG image file",
            "@type": "IMAGE-HIGH-RES",
            "@size": "374622",
            "@ref": "gr14",
            "@mimetype": "image/jpeg"
          },
          {
            "@category": "high",
            "@height": "1359",
            "@width": "2368",
            "@_fa": "true",
            "$": "https://api.elsevier.com/content/object/eid/1-s2.0-S0021951724000046-gr1_lrg.jpg?httpAccept=%2A%2F%2A",
            "@multimediatype": "JPEG image file",
            "@type": "IMAGE-HIGH-RES",
            "@size": "125181",
            "@ref": "gr1",
            "@mimetype": "image/jpeg"
          },
          {
            "@category": "high",
            "@height": "1775",
            "@width": "2368",
            "@_fa": "true",
            "$": "https://api.elsevier.com/content/object/eid/1-s2.0-S0021951724000046-gr4_lrg.jpg?httpAccept=%2A%2F%2A",
            "@multimediatype": "JPEG image file",
            "@type": "IMAGE-HIGH-RES",
            "@size": "621966",
            "@ref": "gr4",
            "@mimetype": "image/jpeg"
          },
          {
            "@category": "high",
            "@height": "1775",
            "@width": "2368",
            "@_fa": "true",
            "$": "https://api.elsevier.com/content/object/eid/1-s2.0-S0021951724000046-gr3_lrg.jpg?httpAccept=%2A%2F%2A",
            "@multimediatype": "JPEG image file",
            "@type": "IMAGE-HIGH-RES",
            "@size": "602418",
            "@ref": "gr3",
            "@mimetype": "image/jpeg"
          },
          {
            "@category": "high",
            "@height": "1392",
            "@width": "3437",
            "@_fa": "true",
            "$": "https://api.elsevier.com/content/object/eid/1-s2.0-S0021951724000046-gr10_lrg.jpg?httpAccept=%2A%2F%2A",
            "@multimediatype": "JPEG image file",
            "@type": "IMAGE-HIGH-RES",
            "@size": "757208",
            "@ref": "gr10",
            "@mimetype": "image/jpeg"
          },
          {
            "@category": "high",
            "@height": "1488",
            "@width": "1490",
            "@_fa": "true",
            "$": "https://api.elsevier.com/content/object/eid/1-s2.0-S0021951724000046-gr11_lrg.jpg?httpAccept=%2A%2F%2A",
            "@multimediatype": "JPEG image file",
            "@type": "IMAGE-HIGH-RES",
            "@size": "498328",
            "@ref": "gr11",
            "@mimetype": "image/jpeg"
          },
          {
            "@category": "high",
            "@height": "1473",
            "@width": "1699",
            "@_fa": "true",
            "$": "https://api.elsevier.com/content/object/eid/1-s2.0-S0021951724000046-gr12_lrg.jpg?httpAccept=%2A%2F%2A",
            "@multimediatype": "JPEG image file",
            "@type": "IMAGE-HIGH-RES",
            "@size": "465422",
            "@ref": "gr12",
            "@mimetype": "image/jpeg"
          },
          {
            "@category": "high",
            "@height": "3337",
            "@width": "2692",
            "@_fa": "true",
            "$": "https://api.elsevier.com/content/object/eid/1-s2.0-S0021951724000046-gr13_lrg.jpg?httpAccept=%2A%2F%2A",
            "@multimediatype": "JPEG image file",
            "@type": "IMAGE-HIGH-RES",
            "@size": "674591",
            "@ref": "gr13",
            "@mimetype": "image/jpeg"
          },
          {
            "@category": "high",
            "@height": "886",
            "@width": "1536",
            "@_fa": "true",
            "$": "https://api.elsevier.com/content/object/eid/1-s2.0-S0021951724000046-ga1_lrg.jpg?httpAccept=%2A%2F%2A",
            "@multimediatype": "JPEG image file",
            "@type": "IMAGE-HIGH-RES",
            "@size": "84688",
            "@ref": "ga1",
            "@mimetype": "image/jpeg"
          },
          {
            "@category": "standard",
            "@_fa": "true",
            "$": "https://api.elsevier.com/content/object/eid/1-s2.0-S0021951724000046-mmc1.docx?httpAccept=%2A%2F%2A",
            "@multimediatype": "Microsoft Word file",
            "@type": "APPLICATION",
            "@size": "380195",
            "@ref": "mmc1",
            "@mimetype": "application/word"
          },
          {
            "@category": "standard",
            "@_fa": "true",
            "$": "https://api.elsevier.com/content/object/eid/1-s2.0-S0021951724000046-am.pdf?httpAccept=%2A%2F%2A",
            "@multimediatype": "Acrobat PDF file",
            "@type": "AAM-PDF",
            "@size": "4239901",
            "@ref": "am",
            "@mimetype": "application/pdf"
          }
        ]
      },
      "link": {
        "@rel": "abstract",
        "@href": "https://api.elsevier.com/content/abstract/scopus_id/85181983097"
      }
    }
  }
}