{
  "metadata": {
    "title": "Hydrogen generation from direct Z-scheme for photocatalytic overall water splitting with the SiSe/SnSe<ce:inf loc=post>2</ce:inf> and SiSe/SnSSe heterostructures",
    "authors": "; ; ",
    "journal": "Journal of Catalysis",
    "date": "2024-04-30",
    "doi": "10.1016/j.jcat.2024.115429",
    "abstract": "",
    "uri": "https://api.elsevier.com/content/article/pii/S0021951724001428",
    "pii": "S0021951724001428"
  },
  "fulltext": {
    "full-text-retrieval-response": {
      "scopus-eid": "2-s2.0-85187544195",
      "originalText": "serial JL 272561 291210 291744 291809 31 Journal of Catalysis JOURNALCATALYSIS 2024-03-09 2024-03-09 2024-03-13 2024-03-13 2024-04-05T04:47:49 1-s2.0-S0021951724001428 S0021-9517(24)00142-8 S0021951724001428 10.1016/j.jcat.2024.115429 S300 S300.1 FULL-TEXT 1-s2.0-S0021951724X00044 2024-04-25T07:29:32.096061Z 0 0 20240401 20240430 2024 2024-03-09T03:26:51.270631Z absattachment articleinfo articlenumber articletitlenorm authfirstinitialnorm authfirstsurnamenorm cid cids contenttype copyright crossmark dateloaded dateloadedtxt datesearch datesort dateupdated dco docsubtype doctype doi eid ewtransactionid hubeid indexeddate issn issnnorm itemstage itemtransactionid itemweight openaccess openarchive pg pgfirst pii piinorm pubdateend pubdatestart pubdatetxt pubyr sectiontitle sortorder srctitle srctitlenorm srctype ssids alllist content subj subheadings suppl tomb volfirst volissue volumelist webpdf webpdfpagecount yearnav figure e-component body mmlmath acknowledge affil appendices articletitle auth authfirstini authfull authkeywords authlast highlightsabst orcid primabst ref specialabst 0021-9517 00219517 true 432 432 C Volume 432 13 115429 115429 115429 202404 April 2024 2024-04-01 2024-04-30 2024 Regular Articles article fla © 2024 Elsevier Inc. All rights reserved. HYDROGENGENERATIONDIRECTZSCHEMEFORPHOTOCATALYTICOVERALLWATERSPLITTINGSISESNSE2SISESNSSEHETEROSTRUCTURES WANG F 1 Introduction 2 Computational methods 3 Results and discussions 3.1 Geometries, stabilities, and electronic properties of the SiSe, SnSe2 and SnSSe monolayers 3.2 Z-schemes for the SiSe/SnSe2 and SiSe/SnSSe heterostructure 3.3 STH efficiency and strain engineering 3.4 Nonadiabatic transfer and recombination of the photogenerated carriers 3.5 Thermodynamic feasibility 4 Conclusions CRediT authorship contribution statement Acknowledgments Appendix A Supplementary material References HISATOMI 2014 7520 7535 T TAO 2022 3561 3608 X STANCIN 2020 109927 H WAZZAN 2023 103319 N CHODVADIYA 2023 18326 18337 D GAN 2022 214665 X ZAVABETI 2020 1 34 A DHORI 2023 15461 15473 B XU 2018 1042 1063 Q GUO 2021 3960 3967 H YUAN 2014 3934 3951 Y LI 2016 2603 2636 X YUAN 2017 4270 4274 Q LI 2015 998 1013 H SHE 2017 1700025 X ZHU 2018 2160 2164 M WAN 2023 8861 8870 X ZHAO 2023 10051 10061 H LIANG 2021 130016 Z YANG 2016 1110 1117 J ZHU 2015 8284 8290 Z TAN 2018 11787 11794 S ZHOU 2015 8035 8041 X SHAFIQUE 2017 20677 20683 A INAMDAR 2020 18657 18665 A KODA 2018 165402 D ZHANG 2023 31364 31374 Y WANG 2023 X MING 2023 115783 S FU 2019 980 987 C ZHANG 2017 8192 8198 J GUO 2019 24620 24628 S ALAM 2022 413487 M KRESSE 1996 11169 G BLOCHL 1994 17953 P HEYD 2003 8207 8215 J CALDEWEYHER 2020 8499 8512 E CALDEWEYHER 2019 E GRIMME 2006 1787 1799 S GRIMME 2010 S BENGTSSON 1999 12301 L CLARK 2005 567 570 S BARONI 2001 515 562 S LIN 1993 4174 4180 J NOSE 1984 255 268 S ZHENG 2019 e1411 Q HE 2019 5798 5807 J JAEGER 2012 H WANG 2023 798 808 J LIN 2023 127682 C WAN 2024 2359 2372 X LIU 2024 234045 M FAN 2019 14836 14843 Y YANG 2017 123 128 J BAI 2015 2893 2939 S KUDO 2009 253 278 A KUMAR 2018 143 150 R LI 2016 118 151 S GARRETT 2006 R BIOCHEMISTRY ZHANG 2021 5064 5075 W GE 2021 150639 D WANG 2023 5591 5601 F BADER 1981 63 124 R FU 2018 6312 6317 C ROY 2016 083111 T WANG 2022 231352 F WAN 2023 9126 9135 X GE 2023 138 146 M LI 2020 5277 5283 X REEVES 2015 6429 6433 K GUO 2018 3485 3490 H YU 2021 2312 2319 X PONCE 2016 116 133 S LONG 2016 1996 2003 R MENG 2022 3443 3453 J ZHOU 2019 21835 21842 Z FAN 2022 9363 9371 Y SHI 2022 9570 9578 A HE 2022 404 409 C CHEN 2017 1701584 P KUZNETSOV 2019 17809 17816 D WAN 2020 4508 4516 Y WANGX2024X115429 WANGX2024X115429XF 2026-03-13T00:00:00.000Z 2026-03-13T00:00:00.000Z http://creativecommons.org/licenses/by-nc-nd/4.0/ © 2024 Elsevier Inc. All rights reserved. 2024-03-18T20:19:23.042Z http://vtw.elsevier.com/data/voc/AddOnTypes/50.7/aggregated-refined Xinjiang Tianchi Talent Program NSFC NSFC-12374232 NSFC National Natural Science Foundation of China http://data.elsevier.com/vocabulary/SciValFunders/501100001809 http://sws.geonames.org/1814991 This work was supported by the National Natural Science Foundation of China (NSFC) under Grant Nos. NSFC-12374232. C.L. Yang thanks the Xinjiang Tianchi Talent Program (2023). https://doi.org/10.15223/policy-017 https://doi.org/10.15223/policy-037 https://doi.org/10.15223/policy-012 https://doi.org/10.15223/policy-029 https://doi.org/10.15223/policy-004 item S0021-9517(24)00142-8 S0021951724001428 1-s2.0-S0021951724001428 10.1016/j.jcat.2024.115429 272561 2024-04-25T07:29:32.096061Z 2024-04-01 2024-04-30 1-s2.0-S0021951724001428-main.pdf https://s3-eu-west-1.amazonaws.com/prod-ucs-content-store-eu-west/content/pii:S0021951724001428/MAIN/application/pdf/301a3977750b16600a8d2f0e9ab88ba4/main.pdf main.pdf pdf true 8005602 MAIN 10 1-s2.0-S0021951724001428-main_1.png https://s3-eu-west-1.amazonaws.com/prod-ucs-content-store-eu-west/content/pii:S0021951724001428/PREVIEW/image/png/79b4b2495588dcd7ba3b673e42b27738/main_1.png main_1.png png 59124 849 656 IMAGE-WEB-PDF 1 1-s2.0-S0021951724001428-gr6.jpg https://s3-eu-west-1.amazonaws.com/prod-ucs-content-store-eu-west/content/pii:S0021951724001428/gr6/DOWNSAMPLED/image/jpeg/bb82ba8ed0df6e66b0a9e81a3a3899a8/gr6.jpg gr6 gr6.jpg jpg 93899 429 774 IMAGE-DOWNSAMPLED 1-s2.0-S0021951724001428-gr7.jpg https://s3-eu-west-1.amazonaws.com/prod-ucs-content-store-eu-west/content/pii:S0021951724001428/gr7/DOWNSAMPLED/image/jpeg/2e5bfc9f43902e93ca807a93c24213e3/gr7.jpg gr7 gr7.jpg jpg 105417 602 734 IMAGE-DOWNSAMPLED 1-s2.0-S0021951724001428-gr1.jpg https://s3-eu-west-1.amazonaws.com/prod-ucs-content-store-eu-west/content/pii:S0021951724001428/gr1/DOWNSAMPLED/image/jpeg/4d665ccbd7cfc11d94f9f58c005a0655/gr1.jpg gr1 gr1.jpg jpg 101716 335 667 IMAGE-DOWNSAMPLED 1-s2.0-S0021951724001428-gr4.jpg https://s3-eu-west-1.amazonaws.com/prod-ucs-content-store-eu-west/content/pii:S0021951724001428/gr4/DOWNSAMPLED/image/jpeg/a21e852038518d907ef8e9e3bbd8ebd0/gr4.jpg gr4 gr4.jpg jpg 90831 380 774 IMAGE-DOWNSAMPLED 1-s2.0-S0021951724001428-gr5.jpg https://s3-eu-west-1.amazonaws.com/prod-ucs-content-store-eu-west/content/pii:S0021951724001428/gr5/DOWNSAMPLED/image/jpeg/ce4380d30ece13ab71559e36dcc2efcc/gr5.jpg gr5 gr5.jpg jpg 155611 618 774 IMAGE-DOWNSAMPLED 1-s2.0-S0021951724001428-gr2.jpg https://s3-eu-west-1.amazonaws.com/prod-ucs-content-store-eu-west/content/pii:S0021951724001428/gr2/DOWNSAMPLED/image/jpeg/218d0279a105b185b709a47aa827deb5/gr2.jpg gr2 gr2.jpg jpg 80303 231 774 IMAGE-DOWNSAMPLED 1-s2.0-S0021951724001428-ga1.jpg https://s3-eu-west-1.amazonaws.com/prod-ucs-content-store-eu-west/content/pii:S0021951724001428/ga1/DOWNSAMPLED/image/jpeg/485cba614a57b63da243a7490ce1d984/ga1.jpg ga1 true ga1.jpg jpg 35801 192 500 IMAGE-DOWNSAMPLED 1-s2.0-S0021951724001428-gr3.jpg https://s3-eu-west-1.amazonaws.com/prod-ucs-content-store-eu-west/content/pii:S0021951724001428/gr3/DOWNSAMPLED/image/jpeg/ac364e42a5afcd93ea556deb36fda41f/gr3.jpg gr3 gr3.jpg jpg 74853 448 667 IMAGE-DOWNSAMPLED 1-s2.0-S0021951724001428-gr6.sml https://s3-eu-west-1.amazonaws.com/prod-ucs-content-store-eu-west/content/pii:S0021951724001428/gr6/THUMBNAIL/image/gif/44fd142a295e060874d7f5c7ca3c5a71/gr6.sml gr6 gr6.sml sml 10136 121 219 IMAGE-THUMBNAIL 1-s2.0-S0021951724001428-gr7.sml https://s3-eu-west-1.amazonaws.com/prod-ucs-content-store-eu-west/content/pii:S0021951724001428/gr7/THUMBNAIL/image/gif/6a49322e53f4abe6e68d33468907b6a6/gr7.sml gr7 gr7.sml sml 10802 164 200 IMAGE-THUMBNAIL 1-s2.0-S0021951724001428-gr1.sml https://s3-eu-west-1.amazonaws.com/prod-ucs-content-store-eu-west/content/pii:S0021951724001428/gr1/THUMBNAIL/image/gif/b4d056235ba29c42cf6bce6008073a92/gr1.sml gr1 gr1.sml sml 15775 110 219 IMAGE-THUMBNAIL 1-s2.0-S0021951724001428-gr4.sml https://s3-eu-west-1.amazonaws.com/prod-ucs-content-store-eu-west/content/pii:S0021951724001428/gr4/THUMBNAIL/image/gif/e8efa76e8e5052e140dca3b5ba6e9c7c/gr4.sml gr4 gr4.sml sml 10901 108 219 IMAGE-THUMBNAIL 1-s2.0-S0021951724001428-gr5.sml https://s3-eu-west-1.amazonaws.com/prod-ucs-content-store-eu-west/content/pii:S0021951724001428/gr5/THUMBNAIL/image/gif/350adace943d05a2163b8a4e0ad3a89b/gr5.sml gr5 gr5.sml sml 15980 164 205 IMAGE-THUMBNAIL 1-s2.0-S0021951724001428-gr2.sml https://s3-eu-west-1.amazonaws.com/prod-ucs-content-store-eu-west/content/pii:S0021951724001428/gr2/THUMBNAIL/image/gif/6375d9e2e93bef069cabce73db0f7bde/gr2.sml gr2 gr2.sml sml 10116 65 219 IMAGE-THUMBNAIL 1-s2.0-S0021951724001428-ga1.sml https://s3-eu-west-1.amazonaws.com/prod-ucs-content-store-eu-west/content/pii:S0021951724001428/ga1/THUMBNAIL/image/gif/4d52fdb6bf0b32d575468bdcedf9dc39/ga1.sml ga1 true ga1.sml sml 14995 84 219 IMAGE-THUMBNAIL 1-s2.0-S0021951724001428-gr3.sml https://s3-eu-west-1.amazonaws.com/prod-ucs-content-store-eu-west/content/pii:S0021951724001428/gr3/THUMBNAIL/image/gif/b1ee8b4ddc2cb180595ab3180f1935da/gr3.sml gr3 gr3.sml sml 11579 147 219 IMAGE-THUMBNAIL 1-s2.0-S0021951724001428-gr6_lrg.jpg https://s3-eu-west-1.amazonaws.com/prod-ucs-content-store-eu-west/content/pii:S0021951724001428/HIGHRES/image/jpeg/ecc956731f78703d259174d314e670b1/gr6_lrg.jpg gr6 gr6_lrg.jpg jpg 503126 1900 3425 IMAGE-HIGH-RES 1-s2.0-S0021951724001428-gr7_lrg.jpg https://s3-eu-west-1.amazonaws.com/prod-ucs-content-store-eu-west/content/pii:S0021951724001428/HIGHRES/image/jpeg/277106b927dc611a9bf3a556de06874f/gr7_lrg.jpg gr7 gr7_lrg.jpg jpg 737470 2666 3248 IMAGE-HIGH-RES 1-s2.0-S0021951724001428-gr1_lrg.jpg https://s3-eu-west-1.amazonaws.com/prod-ucs-content-store-eu-west/content/pii:S0021951724001428/HIGHRES/image/jpeg/3380c90a54fcc0530eba2366f7dd3207/gr1_lrg.jpg gr1 gr1_lrg.jpg jpg 615026 1485 2953 IMAGE-HIGH-RES 1-s2.0-S0021951724001428-gr4_lrg.jpg https://s3-eu-west-1.amazonaws.com/prod-ucs-content-store-eu-west/content/pii:S0021951724001428/HIGHRES/image/jpeg/62e6a74d0989e0581700f81b6b37f433/gr4_lrg.jpg gr4 gr4_lrg.jpg jpg 485518 1682 3425 IMAGE-HIGH-RES 1-s2.0-S0021951724001428-gr5_lrg.jpg https://s3-eu-west-1.amazonaws.com/prod-ucs-content-store-eu-west/content/pii:S0021951724001428/HIGHRES/image/jpeg/f7b365b4ae3606605fdc254b2f587a3d/gr5_lrg.jpg gr5 gr5_lrg.jpg jpg 969119 2736 3425 IMAGE-HIGH-RES 1-s2.0-S0021951724001428-gr2_lrg.jpg https://s3-eu-west-1.amazonaws.com/prod-ucs-content-store-eu-west/content/pii:S0021951724001428/HIGHRES/image/jpeg/f458f63cbb466bd0ba11390d7aba5c3a/gr2_lrg.jpg gr2 gr2_lrg.jpg jpg 703651 1020 3425 IMAGE-HIGH-RES 1-s2.0-S0021951724001428-ga1_lrg.jpg https://s3-eu-west-1.amazonaws.com/prod-ucs-content-store-eu-west/content/pii:S0021951724001428/HIGHRES/image/jpeg/8eca3a41a3802bf09efe065ee5da3aa5/ga1_lrg.jpg ga1 true ga1_lrg.jpg jpg 229163 849 2213 IMAGE-HIGH-RES 1-s2.0-S0021951724001428-gr3_lrg.jpg https://s3-eu-west-1.amazonaws.com/prod-ucs-content-store-eu-west/content/pii:S0021951724001428/HIGHRES/image/jpeg/fdaea9dd27e3fdc3716b798fd7aca67e/gr3_lrg.jpg gr3 gr3_lrg.jpg jpg 408125 1982 2953 IMAGE-HIGH-RES 1-s2.0-S0021951724001428-mmc1.pdf https://s3-eu-west-1.amazonaws.com/prod-ucs-content-store-eu-west/content/pii:S0021951724001428/mmc1/STRIPIN/application/pdf/a5293ac0e5a71f7ccfef6d2552c7a866/mmc1.pdf mmc1 mmc1.pdf pdf false 1885017 APPLICATION 1-s2.0-S0021951724001428-si1.svg https://s3-eu-west-1.amazonaws.com/prod-ucs-content-store-eu-west/content/pii:S0021951724001428/image/svg+xml/b12f5a06170ba7a8056b5f17fa4cadcd/si1.svg si1 si1.svg svg 2171 ALTIMG 1-s2.0-S0021951724001428-si10.svg https://s3-eu-west-1.amazonaws.com/prod-ucs-content-store-eu-west/content/pii:S0021951724001428/image/svg+xml/091c8b32fd8ec501d775f9f38062f18e/si10.svg si10 si10.svg svg 2891 ALTIMG 1-s2.0-S0021951724001428-si11.svg https://s3-eu-west-1.amazonaws.com/prod-ucs-content-store-eu-west/content/pii:S0021951724001428/image/svg+xml/c3bb159f30f9986ab6b44733439c04af/si11.svg si11 si11.svg svg 14496 ALTIMG 1-s2.0-S0021951724001428-si12.svg https://s3-eu-west-1.amazonaws.com/prod-ucs-content-store-eu-west/content/pii:S0021951724001428/image/svg+xml/11e45114a4a4196b1c15fbefdd7fe435/si12.svg si12 si12.svg svg 6205 ALTIMG 1-s2.0-S0021951724001428-si13.svg https://s3-eu-west-1.amazonaws.com/prod-ucs-content-store-eu-west/content/pii:S0021951724001428/image/svg+xml/55e62330fd2ea5709c6d4b64479a5780/si13.svg si13 si13.svg svg 4948 ALTIMG 1-s2.0-S0021951724001428-si14.svg https://s3-eu-west-1.amazonaws.com/prod-ucs-content-store-eu-west/content/pii:S0021951724001428/image/svg+xml/5fb52e35bf050160cf64dd7d106b9cf3/si14.svg si14 si14.svg svg 6811 ALTIMG 1-s2.0-S0021951724001428-si15.svg https://s3-eu-west-1.amazonaws.com/prod-ucs-content-store-eu-west/content/pii:S0021951724001428/image/svg+xml/a393deecdda7b5dfa90dd520b5cf43eb/si15.svg si15 si15.svg svg 1520 ALTIMG 1-s2.0-S0021951724001428-si16.svg https://s3-eu-west-1.amazonaws.com/prod-ucs-content-store-eu-west/content/pii:S0021951724001428/image/svg+xml/e77581a73c020e5f867842ac99150360/si16.svg si16 si16.svg svg 11384 ALTIMG 1-s2.0-S0021951724001428-si17.svg https://s3-eu-west-1.amazonaws.com/prod-ucs-content-store-eu-west/content/pii:S0021951724001428/image/svg+xml/03f7ea158535cd2e07942aeeef9a1e3a/si17.svg si17 si17.svg svg 3909 ALTIMG 1-s2.0-S0021951724001428-si18.svg https://s3-eu-west-1.amazonaws.com/prod-ucs-content-store-eu-west/content/pii:S0021951724001428/image/svg+xml/bb204bf080af7367d412c3090bb131e6/si18.svg si18 si18.svg svg 4296 ALTIMG 1-s2.0-S0021951724001428-si19.svg https://s3-eu-west-1.amazonaws.com/prod-ucs-content-store-eu-west/content/pii:S0021951724001428/image/svg+xml/df40172567b65d2be1a56ab1070fdcb3/si19.svg si19 si19.svg svg 5837 ALTIMG 1-s2.0-S0021951724001428-si2.svg https://s3-eu-west-1.amazonaws.com/prod-ucs-content-store-eu-west/content/pii:S0021951724001428/image/svg+xml/9afc6edf76210e4fee06a793f9945c64/si2.svg si2 si2.svg svg 3285 ALTIMG 1-s2.0-S0021951724001428-si20.svg https://s3-eu-west-1.amazonaws.com/prod-ucs-content-store-eu-west/content/pii:S0021951724001428/image/svg+xml/b8e1e3e08a394e6ea46d0ca4b72a8446/si20.svg si20 si20.svg svg 19509 ALTIMG 1-s2.0-S0021951724001428-si21.svg https://s3-eu-west-1.amazonaws.com/prod-ucs-content-store-eu-west/content/pii:S0021951724001428/image/svg+xml/1e6fd5d73cd21be289b058b0f47fc30d/si21.svg si21 si21.svg svg 4133 ALTIMG 1-s2.0-S0021951724001428-si22.svg https://s3-eu-west-1.amazonaws.com/prod-ucs-content-store-eu-west/content/pii:S0021951724001428/image/svg+xml/024136795488572536f5a2b320d0950f/si22.svg si22 si22.svg svg 2119 ALTIMG 1-s2.0-S0021951724001428-si23.svg https://s3-eu-west-1.amazonaws.com/prod-ucs-content-store-eu-west/content/pii:S0021951724001428/image/svg+xml/2fdf7800e9b6e259405eb13ec101c999/si23.svg si23 si23.svg svg 3846 ALTIMG 1-s2.0-S0021951724001428-si24.svg https://s3-eu-west-1.amazonaws.com/prod-ucs-content-store-eu-west/content/pii:S0021951724001428/image/svg+xml/a4480bb056c034c8c443520d4e9e3319/si24.svg si24 si24.svg svg 3600 ALTIMG 1-s2.0-S0021951724001428-si25.svg https://s3-eu-west-1.amazonaws.com/prod-ucs-content-store-eu-west/content/pii:S0021951724001428/image/svg+xml/075a5482e76c46ba9f6b7cdcf78ec89a/si25.svg si25 si25.svg svg 2226 ALTIMG 1-s2.0-S0021951724001428-si26.svg https://s3-eu-west-1.amazonaws.com/prod-ucs-content-store-eu-west/content/pii:S0021951724001428/image/svg+xml/6cf8a53f8857b0d9b509a67d6df1d9de/si26.svg si26 si26.svg svg 3919 ALTIMG 1-s2.0-S0021951724001428-si27.svg https://s3-eu-west-1.amazonaws.com/prod-ucs-content-store-eu-west/content/pii:S0021951724001428/image/svg+xml/2c51e75a2c4f2d8ddc743ae8037584af/si27.svg si27 si27.svg svg 8827 ALTIMG 1-s2.0-S0021951724001428-si28.svg https://s3-eu-west-1.amazonaws.com/prod-ucs-content-store-eu-west/content/pii:S0021951724001428/image/svg+xml/aa00c26e0e25080861ee26cc28bf3799/si28.svg si28 si28.svg svg 5280 ALTIMG 1-s2.0-S0021951724001428-si29.svg https://s3-eu-west-1.amazonaws.com/prod-ucs-content-store-eu-west/content/pii:S0021951724001428/image/svg+xml/c25c3770cca063df386a02f41378045e/si29.svg si29 si29.svg svg 6675 ALTIMG 1-s2.0-S0021951724001428-si3.svg https://s3-eu-west-1.amazonaws.com/prod-ucs-content-store-eu-west/content/pii:S0021951724001428/image/svg+xml/3b6a44a09656de086349c0dc425345b6/si3.svg si3 si3.svg svg 5304 ALTIMG 1-s2.0-S0021951724001428-si4.svg https://s3-eu-west-1.amazonaws.com/prod-ucs-content-store-eu-west/content/pii:S0021951724001428/image/svg+xml/5c6cd74e36af427be34c167b03b7d080/si4.svg si4 si4.svg svg 2863 ALTIMG 1-s2.0-S0021951724001428-si5.svg https://s3-eu-west-1.amazonaws.com/prod-ucs-content-store-eu-west/content/pii:S0021951724001428/image/svg+xml/0368cbc34c17a592ea40c22ba330b26b/si5.svg si5 si5.svg svg 9258 ALTIMG 1-s2.0-S0021951724001428-si6.svg https://s3-eu-west-1.amazonaws.com/prod-ucs-content-store-eu-west/content/pii:S0021951724001428/image/svg+xml/a98f3fa57450a101cf098ae6f60c8727/si6.svg si6 si6.svg svg 19232 ALTIMG 1-s2.0-S0021951724001428-si7.svg https://s3-eu-west-1.amazonaws.com/prod-ucs-content-store-eu-west/content/pii:S0021951724001428/image/svg+xml/2da1b95ad801c871a93ebb0ce0e93ea7/si7.svg si7 si7.svg svg 11476 ALTIMG 1-s2.0-S0021951724001428-si8.svg https://s3-eu-west-1.amazonaws.com/prod-ucs-content-store-eu-west/content/pii:S0021951724001428/image/svg+xml/7a04b03cca09f47bbcf4ed9334c1c2ef/si8.svg si8 si8.svg svg 7932 ALTIMG 1-s2.0-S0021951724001428-si9.svg https://s3-eu-west-1.amazonaws.com/prod-ucs-content-store-eu-west/content/pii:S0021951724001428/image/svg+xml/652107226f6366bed5b6b368880844b9/si9.svg si9 si9.svg svg 7677 ALTIMG 1-s2.0-S0021951724001428-am.pdf am am.pdf pdf 3175868 AAM-PDF https://s3-eu-west-1.amazonaws.com/prod-ucs-content-store-eu-west/content/egi:10FBB4XHRZ1/MAIN/application/pdf/974d4358b996f84e76ce28753e0584d0/am.pdf YJCAT 115429 115429 S0021-9517(24)00142-8 10.1016/j.jcat.2024.115429 Elsevier Inc. Fig. 1 The top and side views of the considered heterostructures. (a) SiSe/SnSe2, (b) SiSe/SnSSe-I and (c) SiSe/SnSSe-II. The black dashed lines represent the conventional supercells. Fig. 2 The band alignments and density of states (DOS) for the considered heterostructures. (a) SiSe/SnSe2, (b) SiSe/SnSSe-I and (c) SiSe/SnSSe-II. The Fermi level is set to zero. Fig. 3 Direct Z-schemes and the photogenerated carrier transfers for photocatalytic overall water splitting in the heterostructures; and charge populations of the band edges. Theisosurfacevalueissetto0.003e/Å. (a,d) SiSe/SnSe2; (b,e) SiSe/SnSSe-I; and (c,f) SiSe/SnSSe-II. The ellipse background in blue, light blue, and purple color represents the SiSe, SnSe2, and SnSSe monolayer, respectively. The short lines in blue and red colors represent the CBM and VBM, respectively. ①, ②, and ③ correspond to electron transfer, hole transfer, and e-h recombination, respectively. The χ(H2) and χ(O2) indicate the overpotential of HER and OER at PH = 0, respectively. The E built-in represents the built-in electric field. Fig. 4 The strain energies, band edges, and ηʹSTH under biaxial strains. (a,d) SiSe/SnSe2, (b,e) SiSe/SnSSe-I, and (c,f) SiSe/SnSSe-II heterostructures, respectively. Fig. 5 (a)–(c) Time-dependent evolution of the Kohn-Sham orbitals for SiSe/SnSe2, SiSe/SnSSe-I, and SiSe/SnSSe-II, respectively. The thick yellow, green, red, and purple lines represent the CBM/VBM contributed by SiSe, SnSe2, SnSSe-I, and SnSSe-II monolayer, respectively. (d-f) Fourier transform of the normalized ACF of the energy difference fluctuation between the acceptor and donor states in the SiSe/SnSe2, SiSe/SnSSe-I, and SiSe/SnSSe-II. (g-i) Time-averaged NAC between the considered states for SiSe/SnSe2, SiSe/SnSSe-I, and SiSe/SnSSe-II, respectively. Fig. 6 The transfers (a-c) and e-h recombination (d-f) of the photogenerated carriers in SiSe/SnSe2, SiSe/SnSSe-I, and SiSe/SnSSe-II, respectively. Fig. 7 (a-c) The sites and Gibbs free energies for HERs on CBM@SiSe. (d) The sketch for the single- or dual-site of OER on VBM@SnSe2. The red and pink balls represent the O and H atoms, respectively. (e-f) The Gibbs free energy for each intermediate step of OERs. The PH is zero. The single- or dual-site processes are labeled as “s” or “d”, respectively. Hydrogen generation from direct Z-scheme for photocatalytic overall water splitting with the SiSe/SnSe2 and SiSe/SnSSe heterostructures Fei Wang Writing – original draft Investigation Data curation a Chuan-Lu Yang Writing – review & editing Supervision Methodology Funding acquisition Conceptualization b c ⁎ Xiao-Hu Li Validation Formal analysis c d Yu-Liang Liu Software b Wen-Kai Zhao Visualization Resources b a School of Physics and Physical Engineering, Qufu Normal University, Qufu 273165, China School of Physics and Physical Engineering Qufu Normal University Qufu 273165 China School of Physics and Physical Engineering, Qufu Normal University, Qufu 273165, China b School of Physics and Optoelectronic Engineering, Ludong University, Yantai 264025, China School of Physics and Optoelectronic Engineering Ludong University Yantai 264025 China School of Physics and Optoelectronic Engineering, Ludong University, Yantai 264025, China c Xinjiang Astronomical Observatory, Chinese Academy of Science, Urumqi 830011, China Xinjiang Astronomical Observatory Chinese Academy of Science Urumqi 830011 China Xinjiang Astronomical Observatory, Chinese Academy of Science, Urumqi 830011, China d Key Laboratory of Radio Astronomy, Chinese Academy of Science, Urumqi 830011, China Key Laboratory of Radio Astronomy Chinese Academy of Science Urumqi 830011 China Key Laboratory of Radio Astronomy, Chinese Academy of Science, Urumqi 830011, China ⁎ Corresponding author. Graphical abstract The direct Z-schemes of the photocatalytic overall water splitting with the SiSe/SnSe2, SiSe/SnSSe-I, and SiSe/SnSSe-II heterostructures are constructed based on the density functional theory calculations and nonadiabatic molecular dynamics (NAMD) simulations. The maximum solar-to-hydrogen efficiency (ηʹ STH) reaches 19.18% and can be promoted to 28.71% under tensile biaxial strains. NAMD simulations indicate the transfer of the electron for hydrogen evolution reaction (HER) and hole for oxygen evolution reaction (OER) for SiSe/SnSe2 are apparently slower than those for the other two heterostructures, implicating the reduction and oxidation activities of this heterostructure are well-protected. Moreover, the shortest electron-hole recombination time is attributed to SiSe/SnSSe-I, indicating that it holds the best photocatalytic performance. Remarkably, the Gibbs free energies indicate that HER and OER with SiSe/SnSSe-I can spontaneously proceed, while OERs can but HERs cannot spontaneously proceed with the other two heterostructures. Therefore, the newfound heterostructures, especially SiSe/SnSSe-I, are promising candidates in photocatalytic overall water splitting. Keywords Solar-to-hydrogen Direct Z-scheme Hydrogen evolution reaction Photocatalytic Gibbs free energy Nonadiabatic molecular dynamics simulation Data availability Data will be made available on request. 1 Introduction In facing the growing energy crises and environmental pollution, the photocatalytic water splitting with semiconductors and sunlight, which utilizes inexhaustible solar energy to convert into storable hydrogen energy [1,2], has been paid too much attention as a promising and sustainable technology and is expected to become a promising and superior alternative energy source to the nonrenewable fossil energy [3]. Two-dimensional (2D) semiconductor materials have received very broad attention in optoelectronic [4,5] and photocatalysis [6] because of their unequaled structural characteristics and electronic properties [7,8]. A photocatalyst for overall water splitting ought to simultaneously meet the requirements of the strong redox ability, efficient charge spatial separation, and wide light response range. However, it is difficult to have good compatibility between the high redox ability and broad light absorption range in the one-vacuum-level photocatalyst [9]. Moreover, the high electron-hole recombination rate substantially reduces the photocatalytic ability, leading to low photocatalytic efficiency [10]. Among various strategies, constructing van der Waals (vdW) heterostructures should be the promising one. However, the driving force of the conventional type-II heterostructures is weak and reduces the redox ability of charge carriers [11,12]. Fortunately, the direct Z-scheme heterostructures not only separate the photogenerated charge carriers but also retain the strong redox ability for driving photocatalytic reactions, although they also are staggered band alignments [13,14]. Accordingly, the photocatalytic efficiency is remarkably improved. For example, She et al. [15] experimentally reported that α-Fe2O3/g-C3N4 exhibits high efficiency toward overall water splitting without any co-catalytic donor. Chen et al. [16] showed that BP/BiVO4 can realize spontaneously solar-driven hydrogen evolution reaction (HER) to produce H2. In theory, researchers have tried to search for suitable 2D monolayers to construct high-performing heterostructures. For example, the solar-to-hydrogen (STH) efficiency (ηʹ STH) of the ZrSe2/GaAs3 heterostructure [17] constructed according to theoretical calculations can reach 42.71 %. The β-AsP/g-C3N4 was theoretically predicted to have an efficient HER with −0.02 eV Gibbs free energy [18]. The Co doping induces the distortion of MoS2, which can induce better photocatalytic performance for the Co-MoS2/g-C3N4 in comparison with the MoS2/g-C3N4 heterostructures [19]. However, heterostructures with direct Z-scheme can spontaneously proceed with HER and oxygen evolution reactions (OER) are rarely reported. Therefore, there is adequate space for screening heterostructures to spontaneously drive overall water splitting. Generally, the monolayers with suitable bandgaps and mobility are necessary for constructing a satisfactory vdW heterostructure with an efficient direct Z-scheme. Yang et al. [20] identified that the Pmma-SiS monolayer has a direct bandgap, high mobility, good optical absorption, and low thermal conductivity. This monolayer is more stable than α-SiS and β-SiS [21] and is considered a potential anode for lithium-ion batteries [22]. Zhou et al. [23] experimentally synthesized ultrathin SnSe2, while the SnSe2 monolayer with high carrier mobility and strong light absorption was considered a compelling candidate for photocatalysis [24,25]. However, the conduction band minimum (CBM) of the SnSe2 monolayer cannot match the conditions of photocatalytic HER [26]. Experimentally, some heterostructures, such as SnSe2/CdS [27] and ZnIn2S4/SnSe2, [28] have been prepared, which showed a superior activity for photocatalytic HER with visible light. In theory, the water splitting with BP/SnSe2 [29] heterostructure and sunlight was reported. Moreover, the direct Z-scheme with the MoX2(X = Se, Te) monolayers for HER while the SnSe2 monolayer for OER was designed for the MoX2(X = Se, Te)/SnSe2 heterostructures [30]. The Janus MoSSe monolayer had been synthesized by a controlled sulfurization process, which opens a door for manufacturing polarization materials [31]. Guo et al. [32] found that the 1 T-SnSSe monolayer has a high carrier mobility and absorption coefficient, indicating a potential photocatalytic application. Other theoretical calculations demonstrated that 1 T-SnSSe is more stable than the 2H allotrope one [33]. However, we fail to find the heterostructures composed of the SiSe, SnSe2, and SnSSe monolayers although these monolayers are suitable for constructing heterostructures for photocatalytic applications. In this study, we explore the stability, electronic properties, photogenerated carrier dynamics, and Gibbs free energy change (ΔG) for the SiSe/SnSe2, SiSe/SnSSe-I, and SiSe/SnSSe-II heterostructures, based on the density functional theory (DFT) calculations and the non-adiabatic molecular dynamics (NAMD) simulations. The obtained band alignments and the built-in electric fields (E built-in) match the requirement of the photocatalytic direct Z-schemes with these heterostructures. Meanwhile, ηʹ STHs of the SiSe/SnSe2, SiSe/SnSSe-I, and SiSe/SnSSe-II can reach 19.18 %, 14.61 %, and 14.24 %, respectively. NAMD simulations indicate that the relaxations of the photoexcited carriers in SiSe/SnSe2 are slower than those in the other two heterostructures, implying that the photocatalytic activity of this heterostructure is well protected. The shortest electron-hole (e-h) recombination time of SiSe/SnSSe-I indicates that the most efficient photocatalytic Z-scheme is attributed to this heterostructure. The ΔG indicates that SiSe/SnSSe-I can spontaneously proceed both HER and OER, although the other considered ones can only trigger OER but cannot proceed HER spontaneously. Therefore, SiSe/SnSSe-I should be a competitive candidate material for overall water splitting. 2 Computational methods The first principles calculations are carried out using DFT in combination with the projector augmented wave (PAW) implemented in the Vienna Ab initio Simulation Package (VASP 6.3.0) [34,35]. The Heyd-Scuseria-Ernerh (HSE06) hybrid functional [36] is used in geometrical optimizations and static calculations. The plane-wave cutoff energy is 500 eV. The total energy and atomic forces on the atoms are 10-5 eV and 0.01 eV/Å, respectively. According to the manual of VASP, a roughly uniform sampling of the Brillouin zone can be yielded when N 1, N 2, and N 3 are chosen such that: N 1: N 2: N 3 ≅ 1: a/b: a/c. Here, a, b and c are lattice parameters. For the present 2D structure, b = 7a/4 will result in a k-point mesh of 7 × 4 × 1. A z-direction vacuum space of 15 Å is utilized to avoid the influence of near slabs. The vdW interactions are necessary for optimizing the correct geometrical structure of heterostructure. We used the density functional dispersion correction (DFT-D4) [37] to evaluate the vdW interactions in the heterostructure because it has several advantages [38]. DFT-D4 offers improved accuracy in describing dispersion interactions compared to earlier versions, such as DFT-D2 [39] and DFT-D3 [40]. The higher-order dispersion terms that capture more accurately the long-range interactions are also included. This allows for a more comprehensive treatment of dispersion forces, especially in larger and more complex systems. DFT-D4 is designed to be transferable across a wide range of molecular systems, making it applicable to diverse areas of chemistry and materials science. This transferability is crucial for a method to be widely adopted and applicable to various types of molecular interactions. Moreover, the results by DFT-D4 are more consistent with experimental data for various systems, providing more reliable predictions of molecular structures, interaction energies, and other properties. While dispersion corrections add an extra layer of complexity to the calculations, DFT-D4 has been optimized for computational efficiency. This allows researchers to include accurate dispersion corrections without an excessive increase in computational cost. DFT-D4 can be used with a variety of density functionals, making it versatile and compatible with different flavors of DFT. The dipole correction [41] is introduced to include the effect of the asymmetry charge distribution. The CASTEP code [42] in the Materials Studio software is used to evaluate the phonon dispersions via the linear response [43] with a convergence tolerance of 10-7. Norm-conserving pseudopotential [44] with 1000 eV of cutoff energy is utilized. The energy, maximum force, and maximum displacement standards are 10-7 eV, 10-2 eV/Å, and 10-4 Å, respectively. The ab initio molecular dynamics (AIMD) simulations with the ensemble (NVT) [45] are carried out to confirm the thermodynamic stability. The temperature is 300 K and the time is 5 ps with a time step of 1.0 fs. A 5-ps trajectory is generated by using AIMD with the microcanonical ensemble (NVE). The NAMD simulations are implemented in the Hefei-NAMD codes [46], by using a quantum–classical decoherence-induced surface-hopping (DISH) method in the Kohn-Sham framework [47,48]. The codes have been used to investigate nonadiabatic dynamics behaviors for many heterostructures. For example, the transfer and recombination times between electrons and holes are simulated by Hefei-NAMD codes for the C7N6/GaSnPS [49], CdS/C6N7 [50], the cascade dual Z-schemes for InAs3/HfSeTe/ZrSe2 [51] and the SbNR-CN/AsNR-CN nanoribbon heterostructure [52]. For each selected initial configuration, we select 1000 random initial configurations and 2000 surface-hopping trajectories. The calculational details of the carrier mobility, ηʹ STH, optical absorption, and ΔG can be found in Supporting Information. 3 Results and discussions 3.1 Geometries, stabilities, and electronic properties of the SiSe, SnSe2 and SnSSe monolayers The optimized structures of the SiSe, SnSe2, and SnSSe monolayers with the Pmma, P 3 ¯ m1, and P3m1 groups are represented in Fig. S1, while the obtained lattice parameters are 3.900/6.873, 3.773/6.534, and 3.696/6.400 Å, respectively. The lattice parameters of SiSe correspond to the previously reported 3.912/6.683 Å [22], while those of SnSe2 and SnSSe are comparable to the 3.82 and 3.784 Å for the rhombus primitive cell [32,53], respectively. The phonon dispersions in Fig. S2 confirm the dynamic stabilities of the SiSe, SnSe2, and SnSSe monolayers because no imaginary frequencies have been found. The structures in Figs. S3(a-c) show a small potential energy fluctuation around the initial value, indicating the three monolayers are thermodynamically stable. Fig. S4 shows the band structures and the partial density of states (PDOS) for the three monolayers, indicating that the SiSe and SnSSe monolayers have direct bandgaps of 1.50 and 1.76 eV, which are comparable to 1.35 [54] and 1.61 [33] eV in the literature, respectively. The SnSe2 monolayer has an indirect bandgap of 1.51 eV close to the previous 1.48 eV [29]. Therefore, all three monolayers can well respond to sunlight. The work function ( Δ Φ F ) difference between the two monolayers in heterostructures is essential for the redistribution of charge and built-in electric field formation at the interface [55]. We calculated the Δ Φ F by using the electrostatic potential E v a c and Fermi level E F . The E v a c / E F for SiSe, SnSe2 and SnSSe monolayer are 3.19/-1.89, 2.47/-3.83, and (2.71/2.44)/-3.92 eV, respectively, as shown in Figure S5. The obtained Δ Φ F values are 5.08, 6.30 and 6.63/6.36 eV, respectively. The smaller Δ Φ F of the SiSe monolayer means that the electrons will migrate from the SiSe monolayer to the SnSe2 or SnSSe monolayers until the same Fermi level is reached in the interface when the heterostructures are formed [9]. The absolute band edge E C B M / V B M A b s for evaluating overpotentials is calculated by: [56] (1) E C B M / V B M A b s = E C B M / V B M H S E 06 - E v a c where E C B M / V B M H S E 06 stands for the HSE06 energies of CBM and VBM. E v a c can be abstracted from Figs. S5(a-c). The E C B M / V B M A b s of the SiSe monolayer is −3.81/-5.30 eV. Similarly, the E C B M / V B M A b s s of the SnSe2 and SnSSe monolayer are −5.00/-6.62 and −5.09/-6.57 eV, respectively. The E C B M A b s of SiSe is higher than the reduction potential of H+/H2, but the oxidation potential for H2O/O2 is lower than the E V B M A b s . For SnSe2 and SnSSe, although the E V B M A b s is lower than the oxidation potential of H2O/O2, the E C B M A b s is lower than the reduction potential of H+/H2. Each of the monolayers cannot fully meet the requirements for photocatalytic overall water splitting. The carrier mobility μ is also a very crucial factor in assessing the photoelectronic performance of semiconductor materials. Figs. S6-S8 and Table S1 collect the calculated μs for the SiSe, SnSe2, and SnSSe monolayers, which demonstrates an obvious anisotropy characteristic because those along the x and y directions are substantially different. Some mobilities, for example, those for the electron of the SiSe, the y direction of the electron and hole of the SnSSe, and the electron of SnSe2 monolayers are much superior to the ones of other novel 2D materials, such as WS2 (542 cm2V-1s−1) [57], MoS2 (<400 cm2V-1s−1) [58]. Hence, the evident spatial charge separation of the photogenerated electron-hole pairs, and the rapid transfer of the photogenerated electron within the monolayers are expected, resulting in a positive impact on the photoelectronic efficiency. 3.2 Z-schemes for the SiSe/SnSe2 and SiSe/SnSSe heterostructure The lattice mismatch ratio between the SiSe and SnSe2 monolayers is 4.9 %. The Janus SnSSe monolayer can result in two different stacking patterns (represented by SiSe/SnSSe-I and SiSe/SnSSe-II) with the S or Se atoms confronting the SiSe monolayer. However, as shown in Fig. 1 , the lattice mismatch ratios are the same value of 6.8 %. The calculated interlayer distances (d ij) are 3.60, 3.58, and 3.65 Å, which fall within the range of the vdW interaction [59]. The formation energies E f s of the SiSe/SnSe2, SiSe/SnSSe-I, and SiSe/SnSSe-II heterostructures are calculated to assess the relative energy stability by: [60]. (2) E f = E Hetero - E SiSe - E SnSe 2 / SnSSe A where E H e t e r o is the energy of the heterostructure. E S i S e and E S n S e 2 / S n S S e represent the energies of the isolated SiSe and SnSe2/SnSSe monolayers, respectively. A is the area of the conventional supercell of the heterostructure. The more negative E f indicates the higher stability of relevant heterostructure. The E f s of the considered configurations are −13.33, −7.22, and −8.05 meV/Å2, which are comparable with those of some previous heterostructures [49,61] in the literature. The average bond energies between the atoms in the two monolayers are 31.63, 16.77, and 18.64 meV for SiSe/SnSe2, SiSe/SnSSe-I, and SiSe/SnSSe-II, respectively, which correspond to the vdW energy of 4.146–41.457 meV [59]. As shown in Figs. S3(d-f), the energies by the AIMD simulations at 300 K in 5 ps demonstrate that the geometrical structures are well preserved and all atoms vibrate around their equilibrium positions after 3 ps, indicating the constructed heterostructures are thermodynamically stable. Fig. 2 demonstrates that the band alignments of the three heterostructures all belong to a stagger arrangement, which matches the prerequisite for the direct Z-scheme. Moreover, the VBMs of the three heterostructures are all contributed by those of the SiSe monolayer (represented by VBM@SiSe), while CBMs are attributed to the ones of the SnSe2 or SnSSe (represented by CBM@SnSe2 or CBM@SnSSe). The PDOS shows that the Se atom mainly contributes the VBM@SiSe. Se and Sn contribute the CBM@SnSe2 of the SiSe/SnSe2, while Sn and S contribute the CBM@SnSSe of the SiSe/SnSSe-I and SiSe/SnSSe-II. To determine the direction of E built-in, we calculate the plane-averaged charge density difference Δ ρ by [62]: (3) Δ ρ = ρ H e t - ρ S i S e - ρ S n S e 2 / S n S S e where ρ H e t are the chargedensity for the SiSe/SnSe2, SiSe/SnSSe-I, and SiSe/SnSSe-II heterostructures, while ρ S i S e and ρ S n S e 2 / S n S S e represent those of the free-standing SiSe, SnSe2, and SnSSe monolayers, respectively. As shown in Fig. S10, an obvious redistribution of the charge density is observed at the interface of the three heterostructures. The charge depletion (on the SiSe monolayer) and accumulation zone (on the SnSe2/SnSSe monolayer) indicate the effective charge separation. Moreover, Bader charge analysis [63] quantitatively gives the electron transfer from the SiSe to the SnSe2 or SnSSe monolayers are 0.0005, 0.014, and 0.0006 e for SiSe/SnSe2, SiSe/SnSSe-I, and SiSe/SnSSe-II, respectively. The different charge transfers in SiSe/SnSSe-I and SiSe/SnSSe-II indicate the stacking patterns can substantially impact the charge transfer. The direction of the electron transfer can also be understood from the work function differences of the SiSe (5.08 eV), SnSe2 (6.30 eV), and SnSSe (6.63/6.35 eV) monolayers. The charge transfer could induce E built-ins from SiSe to SnSe2 or SnSSe monolayers when heterostructures are formed, as shown in Fig. 3 . These E built-ins can generate a driving force to accelerate the recombination of the photogenerated hole at VBM@SiSe and the photogenerated electron at CBM@SnSe2 or CBM@SnSSe. Meanwhile, the E built-in also suppresses the photogenerated electron to transfer from CBM@SiSe to CBM@SnSe2 or CBM@SnSSe and the hole to transfer from VBM@SnSe2 or VBM@SnSSe to VBM@SiSe of the heterostructures. Therefore, both the obtained band alignments and the E built-in support to construct Z-schemes for the three heterostructures. Based on the band edges of each monolayer projected from the band alignment of the heterostructures, we designed the Z-schemes for SiSe/SnSe2, SiSe/SnSSe-I, and SiSe/SnSSe-II according to E built-in and charge populations of the band edges, as shown in Fig. 3. According to the band edges in Table S2, all the constructed schemes satisfy the photocatalytic overall water splitting conditions. The optical absorption is evaluated to understand the response-ability of the monolayers separated from the heterostructures to light. In the visible light region, the SnSe2 and SnSSe monolayers possess larger absorptions in comparison with that of the SiSe monolayer, as shown in Fig. S9. The optical absorption of the SnSe2 monolayer increases rapidly in the near-ultraviolet regions. Therefore, all three monolayers can efficiently harvest solar energy to generate photoelectrons. 3.3 STH efficiency and strain engineering The STH efficiency ηʹ STH is calculated by using the overpotentials of HER/OER and bandgaps [64]. Based on the band edges in Table S2 and the electrostatic potential difference ΔΦ in Fig. S5, the ηʹ STHs are obtained and presented in Fig. 4 . The ηʹ STH free of strain (0 % in the figure) are 19.18 %, 14.61 %, and 14.24 % for the SiSe/SnSe2, SiSe/SnSSe-I, and SiSe/SnSSe-II heterostructures, respectively. These ηʹ STHs are larger than 10.5 % of the MoSe2/SnSe2 heterostructure [65] that has been fabricated in experiments. Moreover, the present ηʹ STHs are higher in comparison with 9.45 % for the RuI2/Sb2S3 [66], 10.60 % for the CrS3/GeSe [67], and 9.67 % for the InTe/Bismuthene [68] heterostructures. Therefore, the three considered heterostructures show promise in developing highly efficient photocatalysts for the overall water splitting to produce hydrogen. The strain energy E s is utilized to understand the stability of the systems under strains. Here, E s = (E strained - E unstrained)/n with E strained and E unstrained representing the energies of the strained or unstrained heterostructures. At the same time, the number of atoms in the cell is represented by n [69]. The strain energy curve ought to exhibit a parabolic trend when strains remain within the elastic limits, indicating that the heterostructure is stable in energy. Fig. 4(a-c) demonstrates the stability of the SiSe/SnSe2, SiSe/SnSSe-I, and SiSe/SnSSe-II can be maintained under the strains of a maximum of 11 %, 11%, and 7%. As a result, the ηʹ STH values can be boosted to 28.71 %, 27.78 %, and 18.37 % under tensile biaxial strains, respectively. As shown in Tables S3-S5, the compressive biaxial strains induce the increased bandgap and ΔΦ, as a result, an apparent decrease of ηʹ STH has been observed for SiSe/SnSSe-I. For the SiSe/SiSe2 and SiSe/SnSSe-II, the directions of the E built-in become inverse under the compressive biaxial strains and lead to a photocatalytic type-II scheme for the two heterostructures. To make matters worse, the overpotentials no longer meet the overall photocatalytic water-splitting conditions. Moreover, the band alignment of the SiSe/SnSSe-II heterostructure turns out to be type III when the tensile strain exceeds 8 %. So, these strains should be avoided to maintain high ηʹ STHs in the photocatalytic HER and OER. 3.4 Nonadiabatic transfer and recombination of the photogenerated carriers The nonadiabatic transferring and recombination of the photogenerated carriers in the present heterostructures with direct Z-scheme involve three processes: ① the electron transfer from CBM@SiSe to CBM@SnSe2/SnSSe, ② the hole transfer from VBM@SnSe2/SnSSe to VBM@SiSe, ③ the interlayer e-h recombination between the electrons from CBM@SnSe2/SnSSe and the holes from VBM@SiSe, as shown in Fig. 3. The above processes can be simulated by NAMD, which is highly reliant on the non-adiabatic coupling (NAC) factor defined as: (4) d ij = 〈 φ i ∂ ∂ t φ j 〉 = 〈 φ i ∇ R H ^ φ j 〉 ε j - ε i R ̇ where d ij is the NAC between states i and j, H ^ is the Kohn-Sham Hamiltonian, φ i / j and ε i / j are the wave functions and corresponding eigenvalues for i and j states, respectively, while R ̇ is the nuclei velocity [70,71]. Generally, the smaller energy gap ( ε j - ε i ), the larger electron–phonon (e-p) coupling 〈 φ i ∇ R H ^ φ j 〉 , and the faster nuclei velocity R ̇ mean a larger NAC [72]. The 〈 φ i ∇ R H ^ φ j 〉 term is corresponding to the first-order e-p matrix element [73]. The corresponding phonon mode can be visualized by the Fourier transforms (FT) of the normalized autocorrelation function (ACF) of the energy difference fluctuation between the donor and acceptor states to reveal the effect of e-p interaction on the carrier transfer and recombination [74]. Fig. 5 (a-c) shows that the energy gap between CBM@SiSe and its adjacent conduction band levels of SnSe2 is evidently larger than those of the other two heterostructures, while the energy gap between CBM@SiSe and its adjacent conduction band levels of SnSSe-I or SnSSe-II is nearly the same. As illustrated in Fig. 5(d-f), the main phonon modes for the three considered heterostructures are attributed to the frequency below 300 cm−1 that mostly comes from the strong interlayer interaction. In the electron transfer process, the peaks for SiSe/SnSSe-II are more and higher than those for SiSe/SnSe2 and SiSe/SnSSe-I. The phonon mode with the highest frequency of 200.13 cm−1 is assigned to the out-of-plane vibrations. However, there is only one dominant peak of 66.71 cm−1 for SiSe/SnSSe-I, which is attributed to the out-plane Si-Se, Sn-S(Se) bonds and in-plane Si-Si bonds. Usually, the high-frequency modes produce the larger R ̇ , which enhances NAC [75]. So, the smaller the energy gap, the larger 〈 φ i ∇ R H ^ φ j 〉 and R ̇ lead to a larger NAC of electron transfer in SiSe/SnSSe-II, as shown in Fig. 5. Moreover, the out-of-plane modes enlarge the interlayer wave function overlap and increase the e-p coupling, leading to larger NAC [76]. Similarly, the energy gap between VBM@SnSe2 and the adjacent valence band level of SiSe is larger than those of the other two heterostructures. The 〈 φ i ∇ R H ^ φ j 〉 is largest for the hole transfer in SiSe/SnSe2 due to the most peaks, but the peak at 200.13 cm−1 is assigned to the in-plane mode (see Fig. S11). Therefore, the NAC of the hole transfer process in SiSe/SnSe2 is still the smallest. Besides, there is no significant gap difference between VBM@SnSSe-I or VBM@SnSSe-II and the adjacent valence band level of SiSe. The phonon mode and R ̇ in SiSe/SnSSe-I for hole transfer are comparable to those of in SiSe/SnSSe-II, leading to NACs are 0.14 and 0.11 eV in the hole transfer process in SiSe/SnSSe-I and SiSe/SnSSe-II, respectively. Therefore, the NAC of the hole transfer in SiSe/SnSSe-I is the largest one. For the e-h recombination process, the energy gap between the VBM@SiSe and CBM@ SnSSe-I is the smallest, while those of VBM@SiSe and CBM@SnSe2 or CBM@SnSSe-II are almost the same. Also, the dominant peak at 66.71 cm−1 for the e-h recombination in SiSe/SnSSe-I is attributed to the out-plane mode (see Fig. S12). Although there is a dominant and a weak peaks in SiSe/SnSSe-II, the energy gap plays an important role in NAC. Hence, the NACs of SiSe/SnSSe-I and SiSe/SnSSe-II are 0.0030 and 0.0024 eV, respectively. Even though the e-h recombination in SiSe/SnSe2 couples with more phonon mode and higher peaks, the NAC is still the smallest with 0.0019 eV. As a result, the largest NAC for the electron transfer process is in SiSe/SnSSe-II, and those of hole transfer and e-h recombination are both in SiSe/SnSSe-I. The lifetime τ of the photogenerated carriers transfer is obtained by fitting the DISH population evolution curves relative to time into the exponential function f(t) = exp (−t/τ) [77], while the times of the e-h recombination processes are determined with the intersection points of the f(t) curves for the electron population on CBM@SnSe2/CBM@SnSSe and VBM@SiSe. As shown in Fig. 6 , The lifetimes of the interlayer transfer process for electron/hole are 33.89/15.04, 1.23/0.27, and 0.25/0.21 ps for SiSe/SnSe2, SiSe/SnSSe-I and SiSe/SnSSe-II, respectively. Apparently, the transfers of the electrons on CBM@SiSe for HER and holes on VBM@SnSe2 for OER in SiSe/SnSe2 are slower than those for other ones, implicating the photocatalytic activity of this heterostructure is better protected [78]. Moreover, the shortest e-h recombination time of 32.29 ps for SiSe/SnSSe-I means it is superior to the other two heterostructures in the photocatalytic performance with the direct Z-scheme. However, the e-h recombination time for the SiSe/SnSe2 is long compared to the other two heterostructures, which is not helpful for photocatalytic performance with Z-scheme. 3.5 Thermodynamic feasibility The Gibbs free energies ΔGs of OER and HER are computed to understand the thermodynamic feasibilities of the Z-schemes with SiSe/SnSe2, SiSe/SnSSe-I, and SiSe/SnSSe-II. For these heterostructures, the Z-schemes mean that the HERs occur at CBM@SiSe while the OERs reside on VBM@SnSe2 or VBM@SnSSe. The potential energies of the photogenerated electrons for HER (eU e) and holes for OER (eU h) are defined as the difference between the potential energy proceeding HER and E C B M A b s / E V B M A b s [79]. Therefore, if the absolute values of eU e and eU h are larger than the corresponding ΔGs, respectively, both the HER and OER can spontaneously proceed. Here, we use Δ G H ∗ and Δ G m a x to represent the maximum ΔGs for HER and OER, respectively. The optimal adsorption sites and structures are shown in Fig. 7 . The nonequivalent absorption sites and the absorption energies for the intermediates in HER and OER are listed in Tables S6-S11. For SiSe/SnSe2 and SiSe/SnSSe-I, the H atom is more inclined to be adsorbed on the Se atoms and the Δ G H ∗ are 1.20 and 1.09 eV (see Fig. 7), respectively, while the H atom prefers to be bonded to the Si atom for SiSe/SnSSe-II and Δ G H ∗ is 1.23 eV. The eU e for SiSe/SnSe2, SiSe/SnSSe-I, and SiSe/SnSSe-II are 1.01, 1.18, and 1.19 eV at PH = 0, respectively. Therefore, only the HER with SiSe/SnSSe-I can spontaneously proceed. The maximum external energies of 0.22 and 0.10 eV are needed to run HER with SiSe/SnSe2 and SiSe/SnSSe-II, respectively. In ideal HER activity, the Gibbs free energy ΔG H* should be close to zero. However, only some catalysts can proceed HER with the ideal condition. Therefore, additional treatments are used to promote the performance of the HER with a larger ΔG H*. Generally, a small absolute value of ΔG H* implies high thermodynamical feasibility. The present HERs have absolute values of ΔG H* larger than 1.0 eV. However, they are still thermodynamically feasible because some previous HERs with ΔG H* larger than the present ones are realized experimentally with the help of additional treatments. For example, Chen et al. [80] developed a nitrogen-anion decorated Ni3S2 directly grown on nickel foam substrate (N-Ni3S2/NF), which successfully enhances Ni3S2/NF to drive HER with ΔG H* of 2.5 eV. According to the experimental investigations of Kuznetsov et al. [81] the Mo2CO2 and Mo2CO2: Co can drive the HER with the Δ G H ∗ s smaller than 1.5 eV. Fortunately, the present Δ G H ∗ s with the HERs on the SiSe/SnSe2 and SiSe/SnSSe-II heterostructures fall into this range, suggesting that these HERs are also feasible in thermodynamics if some additional treatments are used in a similar way in the literature. Moreover, the OER on VBM@SnSe2 and VBM@SnSSe can proceed with two possible routes of single- or dual-site process involving the OOH* or O*OH* [82]. Fig. 7 and Tables S12-14 demonstrate that the rate-limiting steps for the single-site process occur at the reactions with the product of OOH*. Differently, for the dual-site process, the first steps with OH* are the rate-limiting steps, indicating that the dual-site reaction is more energetically favorable in comparison with the single-site reaction for the three heterostructures. Besides, the Δ G m a x s for the OERs with dual-site are 1.83, 1.97, and 1.74 eV for SiSe/SnSe2, SiSe/SnSSe-I, and SiSe/SnSSe-II, respectively. Therefore, the eU hs of 2.29, 2.44, and 2.75 eV are larger than the Δ G m a x s, indicating these OERs can spontaneously proceed with a dual-site process for the considered heterostructures. 4 Conclusions To summarize, the efficiently photocatalytic direct Z-schemes for overall water splitting are constructed for the SiSe/SnSe2, SiSe/SnSSe-I, and SiSe/SnSSe-II heterostructures according to electronic properties by the first-principles calculations, and the transferring and recombination mechanism of the photogenerated carriers are elucidated based on the NAMD simulations. The ηʹ STH values evaluated by using the overpotentials and bandgaps can reach 19.18 %, 14.61 %, and 14.24 % for the three heterostructures. The tensile strains can promote despite the compressive ones can decrease the ηʹ STHs. Remarkably, the maximum ηʹ STH of 28.71 % can be achieved for SiSe/SnSe2 by 11 % tensile biaxial strain. Thus, it is advisable to avoid any compressive strain to maintain the high photocatalytic performance. The transfer of the electron and hole for the SiSe/SnSe2 heterostructure is apparently slower than those for the other two ones, implicating that the photocatalytic activity of this heterostructure is better protected. SiSe/SnSSe-I possesses the smallest e-h recombination time, making it the superior one among the considered heterostructures in performance with the Z-scheme. The calculated ΔGs reveal that the photogenerated holes and electrons enable to spontaneously proceed both HER and OER with SiSe/SnSSe-I, although only OER can proceed spontaneously with SiSe/SnSe2 and SiSe/SnSSe-II. However, all the considered photocatalytic Z-schemes for overall water splitting are feasible if suitable additional treatments are provided. Therefore, the newfound heterostructures are promising candidates for the photocatalyst to generate hydrogen with overall water splitting. Undoubtedly, the SiSe/SnSSe-I heterostructure is the most promising one among the considered heterostructures. CRediT authorship contribution statement Fei Wang: Writing – original draft, Investigation, Data curation. Chuan-Lu Yang: Writing – review & editing, Supervision, Methodology, Funding acquisition, Conceptualization. Xiao-Hu Li: Validation, Formal analysis. Yu-Liang Liu: Software. Wen-Kai Zhao: Visualization, Resources. Declaration of competing interest The authors declare that they have no known competing financial interests or personal relationships that could have appeared to influence the work reported in this paper. Acknowledgments This work was supported by the National Natural Science Foundation of China (NSFC) under Grant Nos. NSFC-12374232. C.L. Yang thanks the Xinjiang Tianchi Talent Program (2023). Appendix A Supplementary material Supplementary data to this article can be found online at https://doi.org/10.1016/j.jcat.2024.115429. Appendix A Supplementary material The following are the Supplementary data to this article: Supplementary data 1 References [1] T. Hisatomi J. Kubota K. Domen Recent advances in semiconductors for photocatalytic and photoelectrochemical water splitting Chem. Soc. Rev. 43 2014 7520 7535 T. Hisatomi, J. Kubota, K. Domen, Recent advances in semiconductors for photocatalytic and photoelectrochemical water splitting, Chem. Soc. Rev., 43 (2014) 7520-7535. [2] X. Tao Y. Zhao S. Wang C. Li R. Li Recent advances and perspectives for solar-driven water splitting using particulate photocatalysts Chem. Soc. Rev. 51 2022 3561 3608 X. Tao, Y. Zhao, S. Wang, C. Li, R. Li, Recent advances and perspectives for solar-driven water splitting using particulate photocatalysts, Chem. Soc. Rev., 51 (2022) 3561-3608. [3] H. Stančin H. Mikulčić X. Wang N. Duić A review on alternative fuels in future energy system Renew. Sust. Energ. Rev. 128 2020 109927 H. Stančin, H. Mikulčić, X. Wang, N. Duić, A review on alternative fuels in future energy system, Renew. Sust. Energ. Rev., 128 (2020) 109927. [4] N. Wazzan P.K. Jha Single atom catalysts supported on cyclo[18] carbon and its allotropes (B9N9 and Al9N9) for the hydrogen evolution and oxygen evolution reactions Surf. Interfaces 42 2023 103319 N. Wazzan, P.K. Jha, Single atom catalysts supported on cyclo[18] carbon and its allotropes (B9N9 and Al9N9) for the hydrogen evolution and oxygen evolution reactions, Surf. Interfaces, 42 (2023) 103319. [5] D. Chodvadiya B. Chakraborty P.K. Jha Transition metal atoms anchored 2D holey graphyne for hydrogen evolution reaction: acumen from DFT simulation Int. J. Hydrogen. Energ. 48 2023 18326 18337 D. Chodvadiya, B. Chakraborty, P.K. Jha, Transition metal atoms anchored 2D holey graphyne for hydrogen evolution reaction: Acumen from DFT simulation, Int. J. Hydrogen. Energ., 48 (2023) 18326-18337. [6] X. Gan D. Lei Plasmonic-metal/2D-semiconductor hybrids for photodetection and photocatalysis in energy-related and environmental processes Coordin. Chem. Rev. 469 2022 214665 X. Gan, D. Lei, Plasmonic-metal/2D-semiconductor hybrids for photodetection and photocatalysis in energy-related and environmental processes, Coordin. Chem. Rev., 469 (2022) 214665. [7] A. Zavabeti A. Jannat L. Zhong A.A. Haidry Z. Yao J.Z. Ou Two-dimensional materials in large-areas: synthesis, properties and applications Nano-Micro Lett. 12 2020 1 34 A. Zavabeti, A. Jannat, L. Zhong, A.A. Haidry, Z. Yao, J.Z. Ou, Two-dimensional materials in large-areas: synthesis, properties and applications, Nano-micro Lett, 12 (2020) 1-34. [8] B.R. Dhori D. Chodvadiya P.K. Jha Evidence of topological phase transition with excellent catalytic activity in the AgCaAs Heusler alloy: a first-principles investigation J. Phys. Chem. C 127 2023 15461 15473 B.R. Dhori, D. Chodvadiya, P.K. Jha, Evidence of topological phase transition with excellent catalytic activity in the AgCaAs Heusler alloy: A first-principles investigation, J. Phys. Chem. C, 127 (2023) 15461-15473. [9] Q. Xu L. Zhang J. Yu S. Wageh A.A. Al-Ghamdi M. Jaroniec Direct Z-scheme photocatalysts: principles, synthesis, and applications Mater. Today 21 2018 1042 1063 Q. Xu, L. Zhang, J. Yu, S. Wageh, A.A. Al-Ghamdi, M. Jaroniec, Direct Z-scheme photocatalysts: Principles, synthesis, and applications, Mater. Today, 21 (2018) 1042-1063. [10] H. Guo W. Chu O.V. Prezhdo Q. Zheng J. Zhao Strong modulation of band gap, carrier mobility and lifetime in two-dimensional black phosphorene through acoustic phonon excitation J. Phys. Chem. Lett. 12 2021 3960 3967 H. Guo, W. Chu, O.V. Prezhdo, Q. Zheng, J. Zhao, Strong modulation of band gap, carrier mobility and lifetime in two-dimensional black phosphorene through acoustic phonon excitation, J. Phys. Chem. Lett., 12 (2021) 3960-3967. [11] Y.P. Yuan L.W. Ruan J. Barber S.C.J. Loo C. Xue Hetero-nanostructured suspended photocatalysts for solar-to-fuel conversion Energ. Environ. Sci. 7 2014 3934 3951 Y.P. Yuan, L.W. Ruan, J. Barber, S.C.J. Loo, C. Xue, Hetero-nanostructured suspended photocatalysts for solar-to-fuel conversion, Energy Environ. Sci., 7 (2014) 3934-3951. [12] X. Li J. Yu M. Jaroniec Hierarchical photocatalysts Chem. Soc. Rev. 45 2016 2603 2636 X. Li, J. Yu, M. Jaroniec, Hierarchical photocatalysts, Chem. Soc. Rev., 45 (2016) 2603-2636. [13] Q. Yuan D. Liu N. Zhang W. Ye H. Ju L. Shi R. Long J. Zhu Y. Xiong Noble-metal-free janus-like structures by cation exchange for Z-scheme photocatalytic water splitting under broadband light irradiation Angew. Chem. 129 2017 4270 4274 Q. Yuan, D. Liu, N. Zhang, W. Ye, H. Ju, L. Shi, R. Long, J. Zhu, Y. Xiong, Noble‐metal‐free janus‐like structures by cation exchange for Z‐scheme photocatalytic water splitting under broadband light irradiation, Angew. Chem., 129 (2017) 4270-4274. [14] H. Li Y. Zhou W. Tu J. Ye Z. Zou State-of-the-art progress in diverse heterostructured photocatalysts toward promoting photocatalytic performance Adv. Funct. Mater. 25 2015 998 1013 H. Li, Y. Zhou, W. Tu, J. Ye, Z. Zou, State‐of‐the‐art progress in diverse heterostructured photocatalysts toward promoting photocatalytic performance, Adv. Funct. Mater., 25 (2015) 998-1013. [15] X. She J. Wu H. Xu J. Zhong Y. Wang Y. Song K. Nie Y. Liu Y. Yang M.T.F. Rodrigues High efficiency photocatalytic water splitting using 2D α-Fe2O3/g-C3N4 Z-scheme catalysts Adv. Energy Mater. 7 2017 1700025 X. She, J. Wu, H. Xu, J. Zhong, Y. Wang, Y. Song, K. Nie, Y. Liu, Y. Yang, M.T.F. Rodrigues, High efficiency photocatalytic water splitting using 2D α‐Fe2O3/g‐C3N4 Z‐scheme catalysts, Adv. Energy Mater., 7 (2017) 1700025. [16] M. Zhu Z. Sun M. Fujitsuka T. Majima Z-scheme photocatalytic water splitting on a 2D heterostructure of black phosphorus/bismuth vanadate using visible light Angew. Chem. Int. Ed. 57 2018 2160 2164 M. Zhu, Z. Sun, M. Fujitsuka, T. Majima, Z‐scheme photocatalytic water splitting on a 2D heterostructure of black phosphorus/bismuth vanadate using visible light, Angew. Chem. Int. Ed., 57 (2018) 2160-2164. [17] X.Q. Wan C.L. Yang M.S. Wang X.G. Ma Efficient photocatalytic hydrogen evolution and CO2 reduction by HfSe2/GaAs3 and ZrSe2/GaAs3 heterostructures with direct Z-schemes PCCP 25 2023 8861 8870 X.Q. Wan, C.L. Yang, M.S. Wang, X.G. Ma, Efficient photocatalytic hydrogen evolution and CO2 reduction by HfSe2/GaAs3 and ZrSe2/GaAs3 heterostructures with direct Z-schemes, Phys. Chem. Chem. Phys., 25 (2023) 8861-8870. [18] H. Zhao B. Jia Z. Wang L. Han H. Song P. Lu High-efficiency hydrogen evolution reaction photocatalyst for water splitting of Type-II β-AsP/g-C3N4 van der Waals heterostructure Int. J. Hydrogen. Energ. 48 2023 10051 10061 H. Zhao, B. Jia, Z. Wang, L. Han, H. Song, P. Lu, High-efficiency hydrogen evolution reaction photocatalyst for water splitting of Type-II β-AsP/g-C3N4 van der Waals heterostructure, Int. J. Hydrogen. Energ., 48 (2023) 10051-10061. [19] Z. Liang Y. Xue X. Wang Y. Zhou X. Zhang H. Cui G. Cheng J. Tian Co doped MoS2 as cocatalyst considerably improved photocatalytic hydrogen evolution of g-C3N4 in an alkalescent environment Chem. Eng. J. 421 2021 130016 Z. Liang, Y. Xue, X. Wang, Y. Zhou, X. Zhang, H. Cui, G. Cheng, J. Tian, Co doped MoS2 as cocatalyst considerably improved photocatalytic hydrogen evolution of g-C3N4 in an alkalescent environment, Chem. Eng. J., 421 (2021) 130016. [20] J.H. Yang Y. Zhang W.J. Yin X. Gong B.I. Yakobson S.H. Wei Two-dimensional SiS layers with promising electronic and optoelectronic properties: theoretical prediction Nano Lett. 16 2016 1110 1117 J.H. Yang, Y. Zhang, W.J. Yin, X. Gong, B.I. Yakobson, S.H. Wei, Two-dimensional SiS layers with promising electronic and optoelectronic properties: theoretical prediction, Nano Lett., 16 (2016) 1110-1117. [21] Z. Zhu J. Guan D. Liu D. Tománek Designing isoelectronic counterparts to layered Group V semiconductors ACS Nano 9 2015 8284 8290 Z. Zhu, J. Guan, D. Liu, D. Tománek, Designing isoelectronic counterparts to layered Group V semiconductors, ACS Nano, 9 (2015) 8284-8290. [22] S.J. Tan B. Dai Earth-abundant SiX (X=S and Se) monolayers as promising anode materials for lithium ion batteries, a first-principles study Int. J. Electrochem. Sci. 13 2018 11787 11794 S.J. Tan, B. Dai, Earth-abundant SiX (X=S and Se) monolayers as promising anode materials for lithium ion batteries, a first-principles study, Int. J. Electrochem. Sci., 13 (2018) 11787-11794. [23] X. Zhou L. Gan W. Tian Q. Zhang S. Jin H. Li Y. Bando D. Golberg T. Zhai Ultrathin SnSe2 flakes grown by chemical vapor deposition for high-performance photodetectors Adv. Mater. 27 2015 8035 8041 X. Zhou, L. Gan, W. Tian, Q. Zhang, S. Jin, H. Li, Y. Bando, D. Golberg, T. Zhai, Ultrathin SnSe2 flakes grown by chemical vapor deposition for high‐performance photodetectors, Adv. Mater., 27 (2015) 8035-8041. [24] A. Shafique A. Samad Y.H. Shin Ultra low lattice thermal conductivity and high carrier mobility of monolayer SnS2 and SnSe2: a first principles study PCCP 19 2017 20677 20683 A. Shafique, A. Samad, Y.H. Shin, Ultra low lattice thermal conductivity and high carrier mobility of monolayer SnS2 and SnSe2: A first principles study, Phys. Chem. Chem. Phys., 19 (2017) 20677-20683. [25] A.N. Inamdar N.N. Som A. Pratap P.K. Jha Hydrogen evolution and oxygen evolution reactions of pristine and alkali metal doped SnSe2 monolayer Int. J. Hydrogen. Energ. 45 2020 18657 18665 A.N. Inamdar, N.N. Som, A. Pratap, P.K. Jha, Hydrogen evolution and oxygen evolution reactions of pristine and alkali metal doped SnSe2 monolayer, Int. J. Hydrogen. Energ., 45 (2020) 18657-18665. [26] D.S. Koda F. Bechstedt M. Marques L.K. Teles Trends on band alignments: Validity of Anderson's rule in SnS2-and SnSe2-based van der Waals heterostructures Phys. Rev. B 97 2018 165402 D.S. Koda, F. Bechstedt, M. Marques, L.K. Teles, Trends on band alignments: Validity of Anderson's rule in SnS2-and SnSe2-based van der Waals heterostructures, Phys. Rev. B, 97 (2018) 165402. [27] Y. Zhang C. Cheng F. Xing Z. Li C. Huang Transient metal centers at the covalent heterointerface favor photocatalytic hydrogen evolution ACS Appl. Mater. Interfaces 15 2023 31364 31374 Y. Zhang , C. Cheng , F. Xing , Z. Li , C. Huang , Transient metal centers at the covalent heterointerface favor photocatalytic hydrogen evolution , ACS Appl. Mater. Interfaces 15 ( 2023 ) 31364 – 31374. [28] X.H. Wang X.H. Wang T.Y. Shi A.A. Meng L. Wang S.X. Li G.C. Li X. Yu Z.J. Li Fabrication of sulfur defect rich ZnIn2S4/SnSe2 photocatalyst with Ohmic junction for efficient water to hydrogen energy conversion Sol. RRL 7 2023 X.H. Wang, X.H. Wang, T.Y. Shi, A.A. Meng, L. Wang, S.X. Li, G.C. Li, X. Yu, Z.J. Li, Fabrication of sulfur defect rich ZnIn2S4/SnSe2 photocatalyst with Ohmic junction for efficient water to hydrogen energy conversion, Sol. RRL, 7 (2023). [29] S. Ming J. Huang B. Wang M. Li L. Xu J. Su Direct Z-scheme 2D/2D heterojunction of BP/monolayer SnSe2 with photocatalytic activities: a first-principles study Physica E 153 2023 115783 S. Ming, J. Huang, B. Wang, M. Li, L. Xu, J. Su, Direct Z-scheme 2D/2D heterojunction of BP/monolayer SnSe2 with photocatalytic activities: A first-principles study, Physica E, 153 (2023) 115783. [30] C.F. Fu R. Zhang Q. Luo X. Li J. Yang Construction of direct Z-Scheme photocatalysts for overall water splitting using two-dimensional van der waals heterojunctions of metal dichalcogenides J. Comput. Chem. 40 2019 980 987 C.F. Fu, R. Zhang, Q. Luo, X. Li, J. Yang, Construction of direct Z‐Scheme photocatalysts for overall water splitting using two‐dimensional van der waals heterojunctions of metal dichalcogenides, J. Comput. Chem., 40 (2019) 980-987. [31] J. Zhang S. Jia I. Kholmanov L. Dong D. Er W. Chen H. Guo Z. Jin V.B. Shenoy L. Shi J. Lou Janus monolayer transition-metal dichalcogenides ACS Nano 11 2017 8192 8198 J. Zhang, S. Jia, I. Kholmanov, L. Dong, D. Er, W. Chen, H. Guo, Z. Jin, V.B. Shenoy, L. Shi, J. Lou, Janus monolayer transition-metal dichalcogenides, ACS Nano, 11 (2017) 8192-8198. [32] S.D. Guo X.S. Guo R.Y. Han Y. Deng Predicted Janus SnSSe monolayer: a comprehensive first-principles study PCCP 21 2019 24620 24628 S.D. Guo, X.S. Guo, R.Y. Han, Y. Deng, Predicted Janus SnSSe monolayer: a comprehensive first-principles study, Phys. Chem. Chem. Phys., 21 (2019) 24620-24628. [33] M. Alam H.S. Waheed H. Ullah M.W. Iqbal Y.-H. Shin M.J. Iqbal Khan H.I. Elsaeedy R. Neffati Optoelectronics properties of Janus SnSSe monolayer for solar cells applications Phys. B Condens. Matter 625 2022 413487 M. Alam, H.S. Waheed, H. Ullah, M.W. Iqbal, Y.-H. Shin, M.J. Iqbal Khan, H.I. Elsaeedy, R. Neffati, Optoelectronics properties of Janus SnSSe monolayer for solar cells applications, Physica B: Condensed Matter, 625 (2022) 413487. [34] G. Kresse J. Furthmüller Efficient iterative schemes for ab initio total-energy calculations using a plane-wave basis set Phys. Rev. B 54 1996 11169 G. Kresse, J. Furthmüller, Efficient iterative schemes for ab initio total-energy calculations using a plane-wave basis set, Phys. Rev. B, 54 (1996) 11169. [35] P.E. Blöchl Projector augmented-wave method Phys. Rev. B 50 1994 17953 P.E. Blöchl, Projector augmented-wave method, Phys. Rev. B, 50 (1994) 17953. [36] J. Heyd G.E. Scuseria M. Ernzerhof Hybrid functionals based on a screened Coulomb potential J. Chem. Phys. 118 2003 8207 8215 J. Heyd, G.E. Scuseria, M. Ernzerhof, Hybrid functionals based on a screened Coulomb potential, J. Chem. Phys., 118 (2003) 8207-8215. [37] E. Caldeweyher J.M. Mewes S. Ehlert S. Grimme Extension and evaluation of the D4 London-dispersion model for periodic systems PCCP 22 2020 8499 8512 E. Caldeweyher, J.M. Mewes, S. Ehlert, S. Grimme, Extension and evaluation of the D4 London-dispersion model for periodic systems, Phys. Chem. Chem. Phys., 22 (2020) 8499-8512. [38] E. Caldeweyher S. Ehlert A. Hansen H. Neugebauer S. Spicher C. Bannwarth S. Grimme A generally applicable atomic-charge dependent London dispersion correction J. Chem. Phys. 150 2019 E. Caldeweyher, S. Ehlert, A. Hansen, H. Neugebauer, S. Spicher, C. Bannwarth, S. Grimme, A generally applicable atomic-charge dependent London dispersion correction, J. Chem. Phys., 150 (2019). [39] S. Grimme Semiempirical GGA-type density functional constructed with a long-range dispersion correction J. Comput. Chem. 27 2006 1787 1799 S. Grimme, Semiempirical GGA-type density functional constructed with a long-range dispersion correction, J. Comput. Chem., 27 (2006) 1787-1799. [40] S. Grimme J. Antony S. Ehrlich H. Krieg A consistent and accurate ab initio parametrization of density functional dispersion correction (DFT-D) for the 94 elements H-Pu J. Chem. Phys. 132 2010 S. Grimme, J. Antony, S. Ehrlich, H. Krieg, A consistent and accurate ab initio parametrization of density functional dispersion correction (DFT-D) for the 94 elements H-Pu, J. Chem. Phys., 132 (2010). [41] L. Bengtsson Dipole correction for surface supercell calculations Phys. Rev. B 59 1999 12301 L. Bengtsson, Dipole correction for surface supercell calculations, Phys. Rev. B, 59 (1999) 12301. [42] S.J. Clark M.D. Segall C.J. Pickard P.J. Hasnip M.I. Probert K. Refson M.C. Payne First principles methods using CASTEP Z Krist-Cryst Mater. 220 2005 567 570 S.J. Clark, M.D. Segall, C.J. Pickard, P.J. Hasnip, M.I. Probert, K. Refson, M.C. Payne, First principles methods using CASTEP, Z Krist-Cryst Mater, 220 (2005) 567-570. [43] S. Baroni S. de Gironcoli A. Dal Corso P. Giannozzi Phonons and related crystal properties from density-functional perturbation theory Rev. Mod. Phys. 73 2001 515 562 S. Baroni, S. de Gironcoli, A. Dal Corso, P. Giannozzi, Phonons and related crystal properties from density-functional perturbation theory, Rev. Mod. Phys., 73 (2001) 515-562. [44] J.S. Lin A. Qteish M.C. Payne V. Heine Optimized and transferable nonlocal separable ab initio pseudopotentials Phys. Rev. B 47 1993 4174 4180 J.S. Lin, A. Qteish, M.C. Payne, V. Heine, Optimized and transferable nonlocal separable ab initio pseudopotentials, Phys. Rev. B, 47 (1993) 4174-4180. [45] S. Nosé A molecular dynamics method for simulations in the canonical ensemble Mol. Phys. 52 1984 255 268 S. Nosé, A molecular dynamics method for simulations in the canonical ensemble, Mol. Phys., 52 (1984) 255-268. [46] Q. Zheng W. Chu C. Zhao L. Zhang H. Guo Y. Wang X. Jiang J. Zhao Ab initio nonadiabatic molecular dynamics investigations on the excited carriers in condensed matter systems WIREs Comput. Mol. Sci. 9 2019 e1411 Q. Zheng, W. Chu, C. Zhao, L. Zhang, H. Guo, Y. Wang, X. Jiang, J. Zhao, Ab initio nonadiabatic molecular dynamics investigations on the excited carriers in condensed matter systems, Wires Comput Mol Sci, 9 (2019) e1411. [47] J. He W.-H. Fang R. Long O.V. Prezhdo Superoxide/peroxide chemistry extends charge carriers’ lifetime but undermines chemical stability of CH3NH3PbI3 exposed to oxygen: time-domain ab initio analysis J. Am. Chem. Soc. 141 2019 5798 5807 J. He, W.-H. Fang, R. Long, O.V. Prezhdo, Superoxide/peroxide chemistry extends charge carriers’ lifetime but undermines chemical stability of CH3NH3PbI3 exposed to oxygen: time-domain ab initio analysis, J. Am. Chem. Soc., 141 (2019) 5798-5807. [48] H.M. Jaeger S. Fischer O.V. Prezhdo Decoherence-induced surface hopping J. Chem. Phys. 137 2012 H.M. Jaeger, S. Fischer, O.V. Prezhdo, Decoherence-induced surface hopping, J. Chem. Phys., 137 (2012). [49] J. Wang X. Zhang X. Song Y. Fan Z. Zhang M. Zhao Insights into photoinduced carrier dynamics and overall water splitting of Z-scheme van der Waals heterostructures with intrinsic electric polarization J. Phys. Chem. Lett. 14 2023 798 808 J. Wang, X. Zhang, X. Song, Y. Fan, Z. Zhang, M. Zhao, Insights into photoinduced carrier dynamics and overall water splitting of Z-scheme van der Waals heterostructures with intrinsic electric polarization, J. Phys. Chem. Lett., 14 (2023) 798-808. [50] C.B. Lin F.L. Sun J. Wen W.X. Chen G.L. Zhuang Rational design of one inorganic-organic hybrid Z-scheme heterojunction for high-performance photocatalytic water splitting Fuel 341 2023 127682 C. B. Lin, F. L. Sun, J. Wen, W. X. Chen, G. L. Zhuang, Rational design of one inorganic-organic hybrid Z-scheme heterojunction for high-performance photocatalytic water splitting, Fuel, 341 (2023) 127682. [51] X.Q. Wan C.L. Yang X.H. Li Y.L. Liu W.K. Zhao Two-dimensional trilayer heterostructures with cascade dual Z-schemes to achieve efficient hydrogen evolution reaction J. Mater. Chem. A 12 2024 2359 2372 X. Q. Wan, C. L. Yang, X. H. Li, Y. L. Liu, W. K. Zhao, Two-dimensional trilayer heterostructures with cascade dual Z-schemes to achieve efficient hydrogen evolution reaction, J. Mater. Chem. A, 12 (2024) 2359-2372. [52] M. Liu C.L. Yang Y. Li M.S. Wang X.G. Ma Hydrogen production of overall water splitting with direct Z-scheme driven by antimonene and arsenide nanoribbon heterostructures: Insight from electronic properties and carrier nonadiabatic dynamics J. Power Sources 594 2024 234045 M. Liu, C. L. Yang, Y. Li, M. S. Wang, X. G. Ma, Hydrogen production of overall water splitting with direct Z-scheme driven by antimonene and arsenide nanoribbon heterostructures: Insight from electronic properties and carrier nonadiabatic dynamics, J. Power Sources, 594 (2024) 234045. [53] Y. Fan J. Wang M. Zhao Spontaneous full photocatalytic water splitting on 2D MoSe2/SnSe2 and WSe2/SnSe2 vdW heterostructures Nanoscale 11 2019 14836 14843 Y. Fan, J. Wang, M. Zhao, Spontaneous full photocatalytic water splitting on 2D MoSe2/SnSe2 and WSe2/SnSe2 vdW heterostructures, Nanoscale, 11 (2019) 14836-14843. [54] J.H. Yang Q. Yuan H. Deng S.H. Wei B.I. Yakobson Earth-abundant and non-toxic SiX (X = S, Se) monolayers as highly efficient thermoelectric materials J. Phys. Chem. C 121 2017 123 128 J.H. Yang, Q. Yuan, H. Deng, S.H. Wei, B.I. Yakobson, Earth-abundant and non-toxic SiX (X = S, Se) monolayers as highly efficient thermoelectric materials, J. Phys. Chem. C, 121 (2017) 123-128. [55] S. Bai J. Jiang Q. Zhang Y. Xiong Steering charge kinetics in photocatalysis: intersection of materials syntheses, characterization techniques and theoretical simulations Chem. Soc. Rev. 44 2015 2893 2939 S. Bai, J. Jiang, Q. Zhang, Y. Xiong, Steering charge kinetics in photocatalysis: intersection of materials syntheses, characterization techniques and theoretical simulations, Chem. Soc. Rev., 44 (2015) 2893-2939. [56] A. Kudo Y. Miseki Heterogeneous photocatalyst materials for water splitting Chem. Soc. Rev. 38 2009 253 278 A. Kudo, Y. Miseki, Heterogeneous photocatalyst materials for water splitting, Chem. Soc. Rev., 38 (2009) 253-278. [57] R. Kumar D. Das A.K. Singh C2N/WS2 van der Waals type-II heterostructure as a promising water splitting photocatalyst J. Catal. 359 2018 143 150 R. Kumar, D. Das, A.K. Singh, C2N/WS2 van der Waals type-II heterostructure as a promising water splitting photocatalyst, J. Catal., 359 (2018) 143-150. [58] S.L. Li K. Tsukagoshi E. Orgiu P. Samorì Charge transport and mobility engineering in two-dimensional transition metal chalcogenide semiconductors Chem. Soc. Rev. 45 2016 118 151 S.L. Li, K. Tsukagoshi, E. Orgiu, P. Samorì, Charge transport and mobility engineering in two-dimensional transition metal chalcogenide semiconductors, Chem. Soc. Rev., 45 (2016) 118-151. [59] R.H. Garrett C.M. Grisham Biochemistry 2006 Thomas Brooks/Cole R.H. Garrett, C.M. Grisham, Biochemistry, Thomas Brooks/Cole, 2006. [60] W. Zhang Y. Yin C. He Spontaneous enhanced visible-light-driven photocatalytic water splitting on novel type-II GaSe/CN and Ga2SSe/CN vdW heterostructures J. Phys. Chem. Lett. 12 2021 5064 5075 W. Zhang, Y. Yin, C. He, Spontaneous enhanced visible-light-driven photocatalytic water splitting on novel type-II GaSe/CN and Ga2SSe/CN vdW heterostructures, J. Phys. Chem. Lett., 12 (2021) 5064-5075. [61] D. Ge R. Luo X. Wang L. Yang W. Xiong F. Wang Internal and external electric field tunable electronic structures for photocatalytic water splitting: Janus transition-metal chalcogenides/C3N4 van der Waals heterojunctions Appl. Surf. Sci. 566 2021 150639 D. Ge, R. Luo, X. Wang, L. Yang, W. Xiong, F. Wang, Internal and external electric field tunable electronic structures for photocatalytic water splitting: Janus transition-metal chalcogenides/C3N4 van der Waals heterojunctions, Appl. Surf. Sci., 566 (2021) 150639. [62] F. Wang C.L. Yang M.S. Wang X.G. Ma PtTe2/Sb2S3 nanoscale heterostructures for the photocatalytic direct Z-scheme with high solar-to-hydrogen efficiency: a theoretical investigation ACS Appl. Nano Mater. 6 2023 5591 5601 F. Wang, C.L. Yang, M.S. Wang, X.G. Ma, PtTe2/Sb2S3 nanoscale heterostructures for the photocatalytic direct Z-scheme with high solar-to-hydrogen efficiency: A theoretical investigation, ACS Appl. Nano Mater., 6 (2023) 5591-5601. [63] R.F. Bader T. Nguyen Dang Quantum theory of atoms in molecules–Dalton revisited Adv. Quantum. Chem. 14 1981 63 124 R.F. Bader , T. Nguyen Dang , Quantum theory of atoms in molecules–Dalton revisited , Adv. Quantum. Chem. 14 ( 1981 ) 63 – 124 . [64] C.F. Fu J. Sun Q. Luo X. Li W. Hu J. Yang Intrinsic electric fields in two-dimensional materials boost the solar-to-hydrogen efficiency for photocatalytic water splitting Nano Lett. 18 2018 6312 6317 C.F. Fu, J. Sun, Q. Luo, X. Li, W. Hu, J. Yang, Intrinsic electric fields in two-dimensional materials boost the solar-to-hydrogen efficiency for photocatalytic water splitting, Nano Lett., 18 (2018) 6312-6317. [65] T. Roy M. Tosun M. Hettick G.H. Ahn C. Hu A. Javey 2D–2D tunneling field-effect transistors using WSe2/SnSe2 heterostructures Appl. Phys. Lett. 108 2016 083111 T. Roy, M. Tosun, M. Hettick, G.H. Ahn, C. Hu, A. Javey, 2D-2D tunneling field-effect transistors using WSe2/SnSe2 heterostructures, Appl. Phys. Lett., 108 (2016) 083111. [66] F. Wang C.L. Yang M.S. Wang X. Ma Photocatalytic hydrogen evolution reaction with high solar-to-hydrogen efficiency driven by the Sb2S3 monolayer and RuI2/Sb2S3 heterostructure with solar light J. Power Sources 532 2022 231352 F. Wang, C.L. Yang, M.S. Wang, X. Ma, Photocatalytic hydrogen evolution reaction with high solar-to-hydrogen efficiency driven by the Sb2S3 monolayer and RuI2/Sb2S3 heterostructure with solar light, J. Power Sources, 532 (2022) 231352. [67] X.Q. Wan C.L. Yang X.H. Li M.S. Wang X.G. Ma Insights into photogenerated carrier dynamics and overall water splitting of the CrS3/GeSe heterostructure J. Phys. Chem. Lett. 14 2023 9126 9135 X.Q. Wan, C.L. Yang, X.H. Li, M.S. Wang, X.G. Ma, Insights into photogenerated carrier dynamics and overall water splitting of the CrS3/GeSe heterostructure, J. Phys. Chem. Lett., 14 (2023) 9126-9135. [68] M. Ge C.L. Yang M.S. Wang X.G. Ma Photocatalytic hydrogen generation from overall water splitting with direct Z-scheme driven by two-dimensional InTe/Bismuthene heterostructure Int. J. Hydrogen. Energ. 48 2023 138 146 M. Ge, C.L. Yang, M.S. Wang, X.G. Ma, Photocatalytic hydrogen generation from overall water splitting with direct Z-scheme driven by two-dimensional InTe/Bismuthene heterostructure, Int. J. Hydrogen. Energ., 48 (2023) 138-146. [69] X.H. Li B.J. Wang G.D. Wang S.H. Ke Blue phosphorene/Sc2CX2 (X= O, F) van der Waals heterostructures as suitable candidates for water-splitting photocatalysts and solar cells Sustain. Energy Fuels 4 2020 5277 5283 X.H. Li, B.J. Wang, G.D. Wang, S.H. Ke, Blue phosphorene/Sc2CX2 (X= O, F) van der Waals heterostructures as suitable candidates for water-splitting photocatalysts and solar cells, Sustain Energy Fuels, 4 (2020) 5277-5283. [70] K.G. Reeves A. Schleife A.A. Correa Y. Kanai Role of surface termination on hot electron relaxation in silicon quantum dots: a first-principles dynamics simulation study Nano Lett. 15 2015 6429 6433 K.G. Reeves, A. Schleife, A.A. Correa, Y. Kanai, Role of surface termination on hot electron relaxation in silicon quantum dots: A first-principles dynamics simulation study, Nano Lett., 15 (2015) 6429-6433. [71] H. Guo C. Zhao Q. Zheng Z. Lan O.V. Prezhdo W.A. Saidi J. Zhao Superatom molecular orbital as an interfacial charge separation state J. Phys. Chem. Lett. 9 2018 3485 3490 H. Guo, C. Zhao, Q. Zheng, Z. Lan, O.V. Prezhdo, W.A. Saidi, J. Zhao, Superatom molecular orbital as an interfacial charge separation state, J. Phys. Chem. Lett., 9 (2018) 3485-3490. [72] X. Yu Y. Su W.W. Xu J.J. Zhao Efficient photoexcited charge separation at the interface of a novel 0D/2D heterojunction: a time-dependent ultrafast dynamic study J. Phys. Chem. Lett. 12 2021 2312 2319 X. Yu , Y. Su , W.W. Xu , J.J. Zhao , Efficient photoexcited charge separation at the interface of a novel 0D/2D heterojunction: a time-dependent ultrafast dynamic study , J. Phys. Chem. Lett. 12 ( 2021 ) 2312 – 2319. [73] S. Poncé E.R. Margine C. Verdi F. Giustino EPW: Electron–phonon coupling, transport and superconducting properties using maximally localized Wannier functions Comput. Phys. Commun. 209 2016 116 133 S. Poncé, E.R. Margine, C. Verdi, F. Giustino, EPW: Electron–phonon coupling, transport and superconducting properties using maximally localized Wannier functions, Comput. Phys. Commun., 209 (2016) 116-133. [74] R. Long O.V. Prezhdo Quantum coherence facilitates efficient charge separation at a MoS2/MoSe2 van der Waals junction Nano Lett. 16 2016 1996 2003 R. Long, O.V. Prezhdo, Quantum coherence facilitates efficient charge separation at a MoS2/MoSe2 van der Waals junction, Nano Lett., 16 (2016) 1996-2003. [75] J. Meng J. Wang J. Wang Q. Li J. Yang β-SnS/GaSe heterostructure: a promising solar-driven photocatalyst with low carrier recombination for overall water splitting J. Mater. Chem. A 10 2022 3443 3453 J. Meng, J. Wang, J. Wang, Q. Li, J. Yang, β-SnS/GaSe heterostructure: a promising solar-driven photocatalyst with low carrier recombination for overall water splitting, J. Mater. Chem. A, 10 (2022) 3443-3453. [76] Z. Zhou X. Niu Y. Zhang J. Wang Janus MoSSe/WSeTe heterostructures: a direct Z-scheme photocatalyst for hydrogen evolution J. Mater. Chem. A 7 2019 21835 21842 Z. Zhou, X. Niu, Y. Zhang, J. Wang, Janus MoSSe/WSeTe heterostructures: a direct Z-scheme photocatalyst for hydrogen evolution, J. Mater. Chem. A, 7 (2019) 21835-21842. [77] Y. Fan X. Song X. Ma W. Li M. Zhao Rational design of black phosphorus-based direct Z-scheme photocatalysts for overall water splitting: the role of defects J. Phys. Chem. Lett. 13 2022 9363 9371 Y. Fan, X. Song, X. Ma, W. Li, M. Zhao, Rational design of black phosphorus-based direct Z-scheme photocatalysts for overall water splitting: The role of defects, J. Phys. Chem. Lett., 13 (2022) 9363-9371. [78] A. Shi D. Sun X. Zhang S. Ji L. Wang X.A. Li Q. Zhao X. Niu Direct Z-scheme photocatalytic system: Insights into the formative factors of photogenerated carriers transfer channel from ultrafast dynamics ACS Catal 12 2022 9570 9578 A. Shi , D. Sun , X. Zhang , S. Ji , L. Wang , X.A. Li , Q. Zhao , X. Niu , Direct Z-scheme photocatalytic system: Insights into the formative factors of photogenerated carriers transfer channel from ultrafast dynamics , ACS Catal 12 ( 2022 ) 9570 – 9578. [79] C. He F. Han W. Zhang The InSe/g-CN van der Waals hybrid heterojunction as a photocatalyst for water splitting driven by visible light Chin. Chem. Lett. 33 2022 404 409 C. He, F. Han, W. Zhang, The InSe/g-CN van der Waals hybrid heterojunction as a photocatalyst for water splitting driven by visible light, Chin. Chem. Lett., 33 (2022) 404-409. [80] P. Chen T. Zhou M. Zhang Y. Tong C. Zhong N. Zhang L. Zhang C. Wu Y. Xie 3D nitrogen-anion-decorated nickel sulfides for highly efficient overall water splitting Adv. Mater. 29 2017 1701584 P. Chen, T. Zhou, M. Zhang, Y. Tong, C. Zhong, N. Zhang, L. Zhang, C. Wu, Y. Xie, 3D nitrogen-anion-decorated nickel sulfides for highly efficient overall water splitting, Adv. Mater., 29 (2017) 1701584. [81] D.A. Kuznetsov Z. Chen P.V. Kumar A. Tsoukalou A. Kierzkowska P.M. Abdala O.V. Safonova A. Fedorov C.R. Müller Single site cobalt substitution in 2D molybdenum carbide (MXene) enhances catalytic activity in the hydrogen evolution reaction J. Am. Chem. Soc. 141 2019 17809 17816 D.A. Kuznetsov, Z. Chen, P.V. Kumar, A. Tsoukalou, A. Kierzkowska, P.M. Abdala, O.V. Safonova, A. Fedorov, C.R. Müller, Single site cobalt substitution in 2D molybdenum carbide (MXene) enhances catalytic activity in the hydrogen evolution reaction, J. Am. Chem. Soc., 141 (2019) 17809-17816. [82] Y. Wan L. Wang H. Xu X. Wu J. Yang A simple molecular design strategy for two-dimensional covalent organic framework capable of visible-light-driven water splitting J. Am. Chem. Soc. 142 2020 4508 4516 Y. Wan, L. Wang, H. Xu, X. Wu, J. Yang, A simple molecular design strategy for two-dimensional covalent organic framework capable of visible-light-driven water splitting, J. Am. Chem. Soc., 142 (2020) 4508-4516.",
      "scopus-id": "85187544195",
      "coredata": {
        "eid": "1-s2.0-S0021951724001428",
        "dc:description": "The direct Z-schemes of the photocatalytic overall water splitting with the SiSe/SnSe2, SiSe/SnSSe-I, and SiSe/SnSSe-II heterostructures are constructed based on the density functional theory calculations and nonadiabatic molecular dynamics (NAMD) simulations. The maximum solar-to-hydrogen efficiency (ηʹ STH) reaches 19.18% and can be promoted to 28.71% under tensile biaxial strains. NAMD simulations indicate the transfer of the electron for hydrogen evolution reaction (HER) and hole for oxygen evolution reaction (OER) for SiSe/SnSe2 are apparently slower than those for the other two heterostructures, implicating the reduction and oxidation activities of this heterostructure are well-protected. Moreover, the shortest electron-hole recombination time is attributed to SiSe/SnSSe-I, indicating that it holds the best photocatalytic performance. Remarkably, the Gibbs free energies indicate that HER and OER with SiSe/SnSSe-I can spontaneously proceed, while OERs can but HERs cannot spontaneously proceed with the other two heterostructures. Therefore, the newfound heterostructures, especially SiSe/SnSSe-I, are promising candidates in photocatalytic overall water splitting.",
        "openArchiveArticle": "false",
        "prism:coverDate": "2024-04-30",
        "openaccessUserLicense": null,
        "prism:aggregationType": "Journal",
        "prism:url": "https://api.elsevier.com/content/article/pii/S0021951724001428",
        "dc:creator": [
          {
            "@_fa": "true",
            "$": "Wang, Fei"
          },
          {
            "@_fa": "true",
            "$": "Yang, Chuan-Lu"
          },
          {
            "@_fa": "true",
            "$": "Li, Xiao-Hu"
          },
          {
            "@_fa": "true",
            "$": "Liu, Yu-Liang"
          },
          {
            "@_fa": "true",
            "$": "Zhao, Wen-Kai"
          }
        ],
        "link": [
          {
            "@_fa": "true",
            "@rel": "self",
            "@href": "https://api.elsevier.com/content/article/pii/S0021951724001428"
          },
          {
            "@_fa": "true",
            "@rel": "scidir",
            "@href": "https://www.sciencedirect.com/science/article/pii/S0021951724001428"
          }
        ],
        "dc:format": "application/json",
        "openaccessType": null,
        "pii": "S0021-9517(24)00142-8",
        "prism:volume": "432",
        "articleNumber": "115429",
        "prism:publisher": "Elsevier Inc.",
        "dc:title": "Hydrogen generation from direct Z-scheme for photocatalytic overall water splitting with the SiSe/SnSe2 and SiSe/SnSSe heterostructures",
        "prism:copyright": "© 2024 Elsevier Inc. All rights reserved.",
        "openaccess": "0",
        "prism:issn": "00219517",
        "dcterms:subject": [
          {
            "@_fa": "true",
            "$": "Solar-to-hydrogen"
          },
          {
            "@_fa": "true",
            "$": "Direct Z-scheme"
          },
          {
            "@_fa": "true",
            "$": "Hydrogen evolution reaction"
          },
          {
            "@_fa": "true",
            "$": "Photocatalytic"
          },
          {
            "@_fa": "true",
            "$": "Gibbs free energy"
          },
          {
            "@_fa": "true",
            "$": "Nonadiabatic molecular dynamics simulation"
          }
        ],
        "openaccessArticle": "false",
        "prism:publicationName": "Journal of Catalysis",
        "openaccessSponsorType": null,
        "prism:pageRange": "115429",
        "pubType": "fla",
        "prism:coverDisplayDate": "April 2024",
        "prism:doi": "10.1016/j.jcat.2024.115429",
        "prism:startingPage": "115429",
        "dc:identifier": "doi:10.1016/j.jcat.2024.115429",
        "openaccessSponsorName": null
      },
      "objects": {
        "object": [
          {
            "@category": "standard",
            "@height": "429",
            "@width": "774",
            "@_fa": "true",
            "$": "https://api.elsevier.com/content/object/eid/1-s2.0-S0021951724001428-gr6.jpg?httpAccept=%2A%2F%2A",
            "@multimediatype": "JPEG image file",
            "@type": "IMAGE-DOWNSAMPLED",
            "@size": "93899",
            "@ref": "gr6",
            "@mimetype": "image/jpeg"
          },
          {
            "@category": "standard",
            "@height": "602",
            "@width": "734",
            "@_fa": "true",
            "$": "https://api.elsevier.com/content/object/eid/1-s2.0-S0021951724001428-gr7.jpg?httpAccept=%2A%2F%2A",
            "@multimediatype": "JPEG image file",
            "@type": "IMAGE-DOWNSAMPLED",
            "@size": "105417",
            "@ref": "gr7",
            "@mimetype": "image/jpeg"
          },
          {
            "@category": "standard",
            "@height": "335",
            "@width": "667",
            "@_fa": "true",
            "$": "https://api.elsevier.com/content/object/eid/1-s2.0-S0021951724001428-gr1.jpg?httpAccept=%2A%2F%2A",
            "@multimediatype": "JPEG image file",
            "@type": "IMAGE-DOWNSAMPLED",
            "@size": "101716",
            "@ref": "gr1",
            "@mimetype": "image/jpeg"
          },
          {
            "@category": "standard",
            "@height": "380",
            "@width": "774",
            "@_fa": "true",
            "$": "https://api.elsevier.com/content/object/eid/1-s2.0-S0021951724001428-gr4.jpg?httpAccept=%2A%2F%2A",
            "@multimediatype": "JPEG image file",
            "@type": "IMAGE-DOWNSAMPLED",
            "@size": "90831",
            "@ref": "gr4",
            "@mimetype": "image/jpeg"
          },
          {
            "@category": "standard",
            "@height": "618",
            "@width": "774",
            "@_fa": "true",
            "$": "https://api.elsevier.com/content/object/eid/1-s2.0-S0021951724001428-gr5.jpg?httpAccept=%2A%2F%2A",
            "@multimediatype": "JPEG image file",
            "@type": "IMAGE-DOWNSAMPLED",
            "@size": "155611",
            "@ref": "gr5",
            "@mimetype": "image/jpeg"
          },
          {
            "@category": "standard",
            "@height": "231",
            "@width": "774",
            "@_fa": "true",
            "$": "https://api.elsevier.com/content/object/eid/1-s2.0-S0021951724001428-gr2.jpg?httpAccept=%2A%2F%2A",
            "@multimediatype": "JPEG image file",
            "@type": "IMAGE-DOWNSAMPLED",
            "@size": "80303",
            "@ref": "gr2",
            "@mimetype": "image/jpeg"
          },
          {
            "@category": "standard",
            "@height": "192",
            "@width": "500",
            "@_fa": "true",
            "$": "https://api.elsevier.com/content/object/eid/1-s2.0-S0021951724001428-ga1.jpg?httpAccept=%2A%2F%2A",
            "@multimediatype": "JPEG image file",
            "@type": "IMAGE-DOWNSAMPLED",
            "@size": "35801",
            "@ref": "ga1",
            "@mimetype": "image/jpeg"
          },
          {
            "@category": "standard",
            "@height": "448",
            "@width": "667",
            "@_fa": "true",
            "$": "https://api.elsevier.com/content/object/eid/1-s2.0-S0021951724001428-gr3.jpg?httpAccept=%2A%2F%2A",
            "@multimediatype": "JPEG image file",
            "@type": "IMAGE-DOWNSAMPLED",
            "@size": "74853",
            "@ref": "gr3",
            "@mimetype": "image/jpeg"
          },
          {
            "@category": "thumbnail",
            "@height": "121",
            "@width": "219",
            "@_fa": "true",
            "$": "https://api.elsevier.com/content/object/eid/1-s2.0-S0021951724001428-gr6.sml?httpAccept=%2A%2F%2A",
            "@multimediatype": "GIF image file",
            "@type": "IMAGE-THUMBNAIL",
            "@size": "10136",
            "@ref": "gr6",
            "@mimetype": "image/gif"
          },
          {
            "@category": "thumbnail",
            "@height": "164",
            "@width": "200",
            "@_fa": "true",
            "$": "https://api.elsevier.com/content/object/eid/1-s2.0-S0021951724001428-gr7.sml?httpAccept=%2A%2F%2A",
            "@multimediatype": "GIF image file",
            "@type": "IMAGE-THUMBNAIL",
            "@size": "10802",
            "@ref": "gr7",
            "@mimetype": "image/gif"
          },
          {
            "@category": "thumbnail",
            "@height": "110",
            "@width": "219",
            "@_fa": "true",
            "$": "https://api.elsevier.com/content/object/eid/1-s2.0-S0021951724001428-gr1.sml?httpAccept=%2A%2F%2A",
            "@multimediatype": "GIF image file",
            "@type": "IMAGE-THUMBNAIL",
            "@size": "15775",
            "@ref": "gr1",
            "@mimetype": "image/gif"
          },
          {
            "@category": "thumbnail",
            "@height": "108",
            "@width": "219",
            "@_fa": "true",
            "$": "https://api.elsevier.com/content/object/eid/1-s2.0-S0021951724001428-gr4.sml?httpAccept=%2A%2F%2A",
            "@multimediatype": "GIF image file",
            "@type": "IMAGE-THUMBNAIL",
            "@size": "10901",
            "@ref": "gr4",
            "@mimetype": "image/gif"
          },
          {
            "@category": "thumbnail",
            "@height": "164",
            "@width": "205",
            "@_fa": "true",
            "$": "https://api.elsevier.com/content/object/eid/1-s2.0-S0021951724001428-gr5.sml?httpAccept=%2A%2F%2A",
            "@multimediatype": "GIF image file",
            "@type": "IMAGE-THUMBNAIL",
            "@size": "15980",
            "@ref": "gr5",
            "@mimetype": "image/gif"
          },
          {
            "@category": "thumbnail",
            "@height": "65",
            "@width": "219",
            "@_fa": "true",
            "$": "https://api.elsevier.com/content/object/eid/1-s2.0-S0021951724001428-gr2.sml?httpAccept=%2A%2F%2A",
            "@multimediatype": "GIF image file",
            "@type": "IMAGE-THUMBNAIL",
            "@size": "10116",
            "@ref": "gr2",
            "@mimetype": "image/gif"
          },
          {
            "@category": "thumbnail",
            "@height": "84",
            "@width": "219",
            "@_fa": "true",
            "$": "https://api.elsevier.com/content/object/eid/1-s2.0-S0021951724001428-ga1.sml?httpAccept=%2A%2F%2A",
            "@multimediatype": "GIF image file",
            "@type": "IMAGE-THUMBNAIL",
            "@size": "14995",
            "@ref": "ga1",
            "@mimetype": "image/gif"
          },
          {
            "@category": "thumbnail",
            "@height": "147",
            "@width": "219",
            "@_fa": "true",
            "$": "https://api.elsevier.com/content/object/eid/1-s2.0-S0021951724001428-gr3.sml?httpAccept=%2A%2F%2A",
            "@multimediatype": "GIF image file",
            "@type": "IMAGE-THUMBNAIL",
            "@size": "11579",
            "@ref": "gr3",
            "@mimetype": "image/gif"
          },
          {
            "@category": "high",
            "@height": "1900",
            "@width": "3425",
            "@_fa": "true",
            "$": "https://api.elsevier.com/content/object/eid/1-s2.0-S0021951724001428-gr6_lrg.jpg?httpAccept=%2A%2F%2A",
            "@multimediatype": "JPEG image file",
            "@type": "IMAGE-HIGH-RES",
            "@size": "503126",
            "@ref": "gr6",
            "@mimetype": "image/jpeg"
          },
          {
            "@category": "high",
            "@height": "2666",
            "@width": "3248",
            "@_fa": "true",
            "$": "https://api.elsevier.com/content/object/eid/1-s2.0-S0021951724001428-gr7_lrg.jpg?httpAccept=%2A%2F%2A",
            "@multimediatype": "JPEG image file",
            "@type": "IMAGE-HIGH-RES",
            "@size": "737470",
            "@ref": "gr7",
            "@mimetype": "image/jpeg"
          },
          {
            "@category": "high",
            "@height": "1485",
            "@width": "2953",
            "@_fa": "true",
            "$": "https://api.elsevier.com/content/object/eid/1-s2.0-S0021951724001428-gr1_lrg.jpg?httpAccept=%2A%2F%2A",
            "@multimediatype": "JPEG image file",
            "@type": "IMAGE-HIGH-RES",
            "@size": "615026",
            "@ref": "gr1",
            "@mimetype": "image/jpeg"
          },
          {
            "@category": "high",
            "@height": "1682",
            "@width": "3425",
            "@_fa": "true",
            "$": "https://api.elsevier.com/content/object/eid/1-s2.0-S0021951724001428-gr4_lrg.jpg?httpAccept=%2A%2F%2A",
            "@multimediatype": "JPEG image file",
            "@type": "IMAGE-HIGH-RES",
            "@size": "485518",
            "@ref": "gr4",
            "@mimetype": "image/jpeg"
          },
          {
            "@category": "high",
            "@height": "2736",
            "@width": "3425",
            "@_fa": "true",
            "$": "https://api.elsevier.com/content/object/eid/1-s2.0-S0021951724001428-gr5_lrg.jpg?httpAccept=%2A%2F%2A",
            "@multimediatype": "JPEG image file",
            "@type": "IMAGE-HIGH-RES",
            "@size": "969119",
            "@ref": "gr5",
            "@mimetype": "image/jpeg"
          },
          {
            "@category": "high",
            "@height": "1020",
            "@width": "3425",
            "@_fa": "true",
            "$": "https://api.elsevier.com/content/object/eid/1-s2.0-S0021951724001428-gr2_lrg.jpg?httpAccept=%2A%2F%2A",
            "@multimediatype": "JPEG image file",
            "@type": "IMAGE-HIGH-RES",
            "@size": "703651",
            "@ref": "gr2",
            "@mimetype": "image/jpeg"
          },
          {
            "@category": "high",
            "@height": "849",
            "@width": "2213",
            "@_fa": "true",
            "$": "https://api.elsevier.com/content/object/eid/1-s2.0-S0021951724001428-ga1_lrg.jpg?httpAccept=%2A%2F%2A",
            "@multimediatype": "JPEG image file",
            "@type": "IMAGE-HIGH-RES",
            "@size": "229163",
            "@ref": "ga1",
            "@mimetype": "image/jpeg"
          },
          {
            "@category": "high",
            "@height": "1982",
            "@width": "2953",
            "@_fa": "true",
            "$": "https://api.elsevier.com/content/object/eid/1-s2.0-S0021951724001428-gr3_lrg.jpg?httpAccept=%2A%2F%2A",
            "@multimediatype": "JPEG image file",
            "@type": "IMAGE-HIGH-RES",
            "@size": "408125",
            "@ref": "gr3",
            "@mimetype": "image/jpeg"
          },
          {
            "@category": "standard",
            "@_fa": "true",
            "$": "https://api.elsevier.com/content/object/eid/1-s2.0-S0021951724001428-mmc1.pdf?httpAccept=%2A%2F%2A",
            "@multimediatype": "Acrobat PDF file",
            "@type": "APPLICATION",
            "@size": "1885017",
            "@ref": "mmc1",
            "@mimetype": "application/pdf"
          },
          {
            "@category": "thumbnail",
            "@_fa": "true",
            "$": "https://api.elsevier.com/content/object/eid/1-s2.0-S0021951724001428-si1.svg?httpAccept=%2A%2F%2A",
            "@multimediatype": "Scalable Vector Graphics file",
            "@type": "ALTIMG",
            "@size": "2171",
            "@ref": "si1",
            "@mimetype": "image/svg+xml"
          },
          {
            "@category": "thumbnail",
            "@_fa": "true",
            "$": "https://api.elsevier.com/content/object/eid/1-s2.0-S0021951724001428-si10.svg?httpAccept=%2A%2F%2A",
            "@multimediatype": "Scalable Vector Graphics file",
            "@type": "ALTIMG",
            "@size": "2891",
            "@ref": "si10",
            "@mimetype": "image/svg+xml"
          },
          {
            "@category": "thumbnail",
            "@_fa": "true",
            "$": "https://api.elsevier.com/content/object/eid/1-s2.0-S0021951724001428-si11.svg?httpAccept=%2A%2F%2A",
            "@multimediatype": "Scalable Vector Graphics file",
            "@type": "ALTIMG",
            "@size": "14496",
            "@ref": "si11",
            "@mimetype": "image/svg+xml"
          },
          {
            "@category": "thumbnail",
            "@_fa": "true",
            "$": "https://api.elsevier.com/content/object/eid/1-s2.0-S0021951724001428-si12.svg?httpAccept=%2A%2F%2A",
            "@multimediatype": "Scalable Vector Graphics file",
            "@type": "ALTIMG",
            "@size": "6205",
            "@ref": "si12",
            "@mimetype": "image/svg+xml"
          },
          {
            "@category": "thumbnail",
            "@_fa": "true",
            "$": "https://api.elsevier.com/content/object/eid/1-s2.0-S0021951724001428-si13.svg?httpAccept=%2A%2F%2A",
            "@multimediatype": "Scalable Vector Graphics file",
            "@type": "ALTIMG",
            "@size": "4948",
            "@ref": "si13",
            "@mimetype": "image/svg+xml"
          },
          {
            "@category": "thumbnail",
            "@_fa": "true",
            "$": "https://api.elsevier.com/content/object/eid/1-s2.0-S0021951724001428-si14.svg?httpAccept=%2A%2F%2A",
            "@multimediatype": "Scalable Vector Graphics file",
            "@type": "ALTIMG",
            "@size": "6811",
            "@ref": "si14",
            "@mimetype": "image/svg+xml"
          },
          {
            "@category": "thumbnail",
            "@_fa": "true",
            "$": "https://api.elsevier.com/content/object/eid/1-s2.0-S0021951724001428-si15.svg?httpAccept=%2A%2F%2A",
            "@multimediatype": "Scalable Vector Graphics file",
            "@type": "ALTIMG",
            "@size": "1520",
            "@ref": "si15",
            "@mimetype": "image/svg+xml"
          },
          {
            "@category": "thumbnail",
            "@_fa": "true",
            "$": "https://api.elsevier.com/content/object/eid/1-s2.0-S0021951724001428-si16.svg?httpAccept=%2A%2F%2A",
            "@multimediatype": "Scalable Vector Graphics file",
            "@type": "ALTIMG",
            "@size": "11384",
            "@ref": "si16",
            "@mimetype": "image/svg+xml"
          },
          {
            "@category": "thumbnail",
            "@_fa": "true",
            "$": "https://api.elsevier.com/content/object/eid/1-s2.0-S0021951724001428-si17.svg?httpAccept=%2A%2F%2A",
            "@multimediatype": "Scalable Vector Graphics file",
            "@type": "ALTIMG",
            "@size": "3909",
            "@ref": "si17",
            "@mimetype": "image/svg+xml"
          },
          {
            "@category": "thumbnail",
            "@_fa": "true",
            "$": "https://api.elsevier.com/content/object/eid/1-s2.0-S0021951724001428-si18.svg?httpAccept=%2A%2F%2A",
            "@multimediatype": "Scalable Vector Graphics file",
            "@type": "ALTIMG",
            "@size": "4296",
            "@ref": "si18",
            "@mimetype": "image/svg+xml"
          },
          {
            "@category": "thumbnail",
            "@_fa": "true",
            "$": "https://api.elsevier.com/content/object/eid/1-s2.0-S0021951724001428-si19.svg?httpAccept=%2A%2F%2A",
            "@multimediatype": "Scalable Vector Graphics file",
            "@type": "ALTIMG",
            "@size": "5837",
            "@ref": "si19",
            "@mimetype": "image/svg+xml"
          },
          {
            "@category": "thumbnail",
            "@_fa": "true",
            "$": "https://api.elsevier.com/content/object/eid/1-s2.0-S0021951724001428-si2.svg?httpAccept=%2A%2F%2A",
            "@multimediatype": "Scalable Vector Graphics file",
            "@type": "ALTIMG",
            "@size": "3285",
            "@ref": "si2",
            "@mimetype": "image/svg+xml"
          },
          {
            "@category": "thumbnail",
            "@_fa": "true",
            "$": "https://api.elsevier.com/content/object/eid/1-s2.0-S0021951724001428-si20.svg?httpAccept=%2A%2F%2A",
            "@multimediatype": "Scalable Vector Graphics file",
            "@type": "ALTIMG",
            "@size": "19509",
            "@ref": "si20",
            "@mimetype": "image/svg+xml"
          },
          {
            "@category": "thumbnail",
            "@_fa": "true",
            "$": "https://api.elsevier.com/content/object/eid/1-s2.0-S0021951724001428-si21.svg?httpAccept=%2A%2F%2A",
            "@multimediatype": "Scalable Vector Graphics file",
            "@type": "ALTIMG",
            "@size": "4133",
            "@ref": "si21",
            "@mimetype": "image/svg+xml"
          },
          {
            "@category": "thumbnail",
            "@_fa": "true",
            "$": "https://api.elsevier.com/content/object/eid/1-s2.0-S0021951724001428-si22.svg?httpAccept=%2A%2F%2A",
            "@multimediatype": "Scalable Vector Graphics file",
            "@type": "ALTIMG",
            "@size": "2119",
            "@ref": "si22",
            "@mimetype": "image/svg+xml"
          },
          {
            "@category": "thumbnail",
            "@_fa": "true",
            "$": "https://api.elsevier.com/content/object/eid/1-s2.0-S0021951724001428-si23.svg?httpAccept=%2A%2F%2A",
            "@multimediatype": "Scalable Vector Graphics file",
            "@type": "ALTIMG",
            "@size": "3846",
            "@ref": "si23",
            "@mimetype": "image/svg+xml"
          },
          {
            "@category": "thumbnail",
            "@_fa": "true",
            "$": "https://api.elsevier.com/content/object/eid/1-s2.0-S0021951724001428-si24.svg?httpAccept=%2A%2F%2A",
            "@multimediatype": "Scalable Vector Graphics file",
            "@type": "ALTIMG",
            "@size": "3600",
            "@ref": "si24",
            "@mimetype": "image/svg+xml"
          },
          {
            "@category": "thumbnail",
            "@_fa": "true",
            "$": "https://api.elsevier.com/content/object/eid/1-s2.0-S0021951724001428-si25.svg?httpAccept=%2A%2F%2A",
            "@multimediatype": "Scalable Vector Graphics file",
            "@type": "ALTIMG",
            "@size": "2226",
            "@ref": "si25",
            "@mimetype": "image/svg+xml"
          },
          {
            "@category": "thumbnail",
            "@_fa": "true",
            "$": "https://api.elsevier.com/content/object/eid/1-s2.0-S0021951724001428-si26.svg?httpAccept=%2A%2F%2A",
            "@multimediatype": "Scalable Vector Graphics file",
            "@type": "ALTIMG",
            "@size": "3919",
            "@ref": "si26",
            "@mimetype": "image/svg+xml"
          },
          {
            "@category": "thumbnail",
            "@_fa": "true",
            "$": "https://api.elsevier.com/content/object/eid/1-s2.0-S0021951724001428-si27.svg?httpAccept=%2A%2F%2A",
            "@multimediatype": "Scalable Vector Graphics file",
            "@type": "ALTIMG",
            "@size": "8827",
            "@ref": "si27",
            "@mimetype": "image/svg+xml"
          },
          {
            "@category": "thumbnail",
            "@_fa": "true",
            "$": "https://api.elsevier.com/content/object/eid/1-s2.0-S0021951724001428-si28.svg?httpAccept=%2A%2F%2A",
            "@multimediatype": "Scalable Vector Graphics file",
            "@type": "ALTIMG",
            "@size": "5280",
            "@ref": "si28",
            "@mimetype": "image/svg+xml"
          },
          {
            "@category": "thumbnail",
            "@_fa": "true",
            "$": "https://api.elsevier.com/content/object/eid/1-s2.0-S0021951724001428-si29.svg?httpAccept=%2A%2F%2A",
            "@multimediatype": "Scalable Vector Graphics file",
            "@type": "ALTIMG",
            "@size": "6675",
            "@ref": "si29",
            "@mimetype": "image/svg+xml"
          },
          {
            "@category": "thumbnail",
            "@_fa": "true",
            "$": "https://api.elsevier.com/content/object/eid/1-s2.0-S0021951724001428-si3.svg?httpAccept=%2A%2F%2A",
            "@multimediatype": "Scalable Vector Graphics file",
            "@type": "ALTIMG",
            "@size": "5304",
            "@ref": "si3",
            "@mimetype": "image/svg+xml"
          },
          {
            "@category": "thumbnail",
            "@_fa": "true",
            "$": "https://api.elsevier.com/content/object/eid/1-s2.0-S0021951724001428-si4.svg?httpAccept=%2A%2F%2A",
            "@multimediatype": "Scalable Vector Graphics file",
            "@type": "ALTIMG",
            "@size": "2863",
            "@ref": "si4",
            "@mimetype": "image/svg+xml"
          },
          {
            "@category": "thumbnail",
            "@_fa": "true",
            "$": "https://api.elsevier.com/content/object/eid/1-s2.0-S0021951724001428-si5.svg?httpAccept=%2A%2F%2A",
            "@multimediatype": "Scalable Vector Graphics file",
            "@type": "ALTIMG",
            "@size": "9258",
            "@ref": "si5",
            "@mimetype": "image/svg+xml"
          },
          {
            "@category": "thumbnail",
            "@_fa": "true",
            "$": "https://api.elsevier.com/content/object/eid/1-s2.0-S0021951724001428-si6.svg?httpAccept=%2A%2F%2A",
            "@multimediatype": "Scalable Vector Graphics file",
            "@type": "ALTIMG",
            "@size": "19232",
            "@ref": "si6",
            "@mimetype": "image/svg+xml"
          },
          {
            "@category": "thumbnail",
            "@_fa": "true",
            "$": "https://api.elsevier.com/content/object/eid/1-s2.0-S0021951724001428-si7.svg?httpAccept=%2A%2F%2A",
            "@multimediatype": "Scalable Vector Graphics file",
            "@type": "ALTIMG",
            "@size": "11476",
            "@ref": "si7",
            "@mimetype": "image/svg+xml"
          },
          {
            "@category": "thumbnail",
            "@_fa": "true",
            "$": "https://api.elsevier.com/content/object/eid/1-s2.0-S0021951724001428-si8.svg?httpAccept=%2A%2F%2A",
            "@multimediatype": "Scalable Vector Graphics file",
            "@type": "ALTIMG",
            "@size": "7932",
            "@ref": "si8",
            "@mimetype": "image/svg+xml"
          },
          {
            "@category": "thumbnail",
            "@_fa": "true",
            "$": "https://api.elsevier.com/content/object/eid/1-s2.0-S0021951724001428-si9.svg?httpAccept=%2A%2F%2A",
            "@multimediatype": "Scalable Vector Graphics file",
            "@type": "ALTIMG",
            "@size": "7677",
            "@ref": "si9",
            "@mimetype": "image/svg+xml"
          },
          {
            "@category": "standard",
            "@_fa": "true",
            "$": "https://api.elsevier.com/content/object/eid/1-s2.0-S0021951724001428-am.pdf?httpAccept=%2A%2F%2A",
            "@multimediatype": "Acrobat PDF file",
            "@type": "AAM-PDF",
            "@size": "3175868",
            "@ref": "am",
            "@mimetype": "application/pdf"
          }
        ]
      },
      "link": {
        "@rel": "abstract",
        "@href": "https://api.elsevier.com/content/abstract/scopus_id/85187544195"
      }
    }
  }
}