{
  "metadata": {
    "title": "Graphical abstract TOC",
    "authors": "",
    "journal": "Journal of Catalysis",
    "date": "2021-12-31",
    "doi": "10.1016/S0021-9517(21)00508-X",
    "abstract": "",
    "uri": "https://api.elsevier.com/content/article/pii/S002195172100508X",
    "pii": "S002195172100508X"
  },
  "fulltext": {
    "full-text-retrieval-response": {
      "originalText": "serial JL 272561 291210 291744 291809 31 Journal of Catalysis JOURNALCATALYSIS 2021-12-15 2021-12-15 2021-12-15 2021-12-15 2022-03-22T20:46:55 1-s2.0-S002195172100508X S0021-9517(21)00508-X S002195172100508X 10.1016/S0021-9517(21)00508-X S300 S300.2 CONTENTS-ENTRY-ONLY 1-s2.0-S0021951721X00103 2022-03-22T21:19:50.092458Z 0 0 20211201 20211231 2021 2021-12-15T18:05:30.696745Z rawtext articleinfo articletitlenorm cid cids contenttype copyright crossmark dateloaded dateloadedtxt datesearch datesort dateupdated dco docsubtype doctype doi eid ewtransactionid hubeid indexeddate issn issnnorm itemstage itemtransactionid itemweight openaccess openarchive pg pgfirst pglast pii piinorm pubdateend pubdatestart pubdatetxt pubyr sortorder srctitle srctitlenorm srctype ssids alllist content subj suppl tomb volfirst volissue volumelist webpdf webpdfpagecount yearnav articletitle 0021-9517 00219517 false 404 404 C Volume 404 93 I XXII I XXII 202112 December 2021 2021-12-01 2021-12-31 2021 simple-article con GRAPHICALABSTRACTTOC 2023-12-15T00:00:00.000Z 2023-12-15T00:00:00.000Z http://creativecommons.org/licenses/by-nc-nd/4.0/ 0 item S0021-9517(21)00508-X S002195172100508X 1-s2.0-S002195172100508X 10.1016/S0021-9517(21)00508-X 272561 2022-03-22T21:19:50.092458Z 2021-12-01 2021-12-31 1-s2.0-S002195172100508X-main.pdf https://s3-eu-west-1.amazonaws.com/prod-ucs-content-store-eu-west/content/pii:S002195172100508X/MAIN/application/pdf/15f438f57d1dee29e849d8b7e81b6f8d/main.pdf main.pdf pdf true 8148341 MAIN 22 1-s2.0-S002195172100508X-main_1.png https://s3-eu-west-1.amazonaws.com/prod-ucs-content-store-eu-west/content/pii:S002195172100508X/PREVIEW/image/png/83e6016a511d8542b986f381075c02a6/main_1.png main_1.png png 9882 849 656 IMAGE-WEB-PDF 1 Catalysis is a kinetic phenomenon: The legacy of Michel Boudart pp 985â€“986 Gerhard Ertl Contents PERSPECTIVE ARTICLES Transport in heterogeneous catalysis â€“ Beyond reactant diffusion limitations pp 679â€“686 Gina Noh, Michele L. Sarazen Microkinetic modeling in electrocatalysis: Applications, limitations, and recommendations for reliable mechanistic insights pp 864â€“872 Adam Baz, Sean T. Dix, Adam Holewinski*, Suljo Linic* Michel Boudart, Catalytica and catalytic combustion â€“ A scientific odyssey pp 897â€“899 Ralph A. Dalla Betta Lies, damned lies, and turnover rates pp 925â€“928 Robert S. Weber Contents Challenges for the theoretical description of the mechanism and kinetics of reactions catalyzed by zeolites pp 832â€“849 Jeroen Van der Mynsbrugge, Alexis T. Bell* C2H6(g) 62.6 45.1 TS for C2H4 formation on [GaH2]+ T437 QM/MM model with long- range electrostatic and dispersion effects T5 model without long-range electrostatic and dispersion effects â±¡ â±¡ In-situ and operando spectroscopies for the characterization of catalysts and of mechanisms of catalytic reactions pp 900â€“910 Francisco Zaera Metal carbides as alternative electrocatalysts for energy conversion reactions pp 911â€“924 Sang Hoon Joo*, Jae Sung Lee* Transition metal carbides and nitrides as catalysts for thermochemical reactions pp 929â€“942 Zhexi Lin, Steven R. Denny, Jingguang G. Chen* Contents Anti-Heterogeneous catalysis revealed by the amidomagnesium halide chemistry in lithium sulfur batteries pp 999â€“1006 Miao Chen, Tianli Wu, Dan Zhou, Zhubing Xiao* Effects of heat-treatment atmosphere and temperature on cobalt species in Co/Al2O3 catalyst for propane dehydrogenation pp 1007â€“1016 Namgi Jeon, Jungmok Oh, Akhil Tayal, Beomgyun Jeong, Okkyun Seo, Sujin Kim, Iljun Chung, Yongju Yun* MINI REVIEWS Leveraging De Donder relations for a thermodynamically rigorous analysis of reaction kinetics in liquid media pp 687â€“705 Thomas J. Schwartz*, Jesse Q. Bond* Kinetics of chemical processes: From molecular to industrial scale pp 745â€“759 Guy B. Marin*, Vladimir V. Galvita, Gregory S. Yablonsky Contents Both sites must turn over in tandem catalysis: Lessons from one-pot CO2 capture and hydrogenation pp 977â€“984 Elizabeth A.K. Wilson, Shawn C. Eady, Trent Silbaugh, Levi T. Thompson, Mark A. Barteau* The extraordinary life of Michel Boudart : A very personal perspective pp 987â€“988 Ricardo B. Levy* Editorial introduction of the personal perspective of Ricardo Levy and technical Perspective of Gerhard Ertl p 989 Robert J. Davis*, Gary L. Haller TS-1 zeolite with homogeneous distribution of Ti atoms in the framework: synthesis, crystallization mechanism and its catalytic performance pp 990â€“998 Zhen Chen, Lianlin Zhang, Yunkai Yu*, Dongxu Liu, Nan Fang, Yuxia Lin, Deyi Xu, Fang Li, Yueming Liu*, Mingyuan He The properties of TS-1 changed greatly with the basicity of the synthetic sol, and the gripper-like silicon species obtained by TEOS condensed at high basicity was the core factor for the homogeneous distribution of Ti atoms of TS-1zeolite. Contents Support functionalization as an approach for modifying activation entropies of catalytic reactions on atomically dispersed metal sites pp 883â€“896 Gregory Zakem, Insoo Ro, Jordan Finzel, Phillip Christopher* Dilute Pd-in-Au alloy RCT-SiO2 catalysts for enhanced oxidative methanol coupling pp 943â€“953 Amanda Filie, Tanya Shirman, Alexandre C. Foucher, Eric A. Stach, Michael Aizenberg, Joanna Aizenberg, Cynthia M. Friend, Robert J. Madix* Reaction kinetics study of ethylene oligomerization into linear olefins over carbon-supported cobalt catalysts pp 954â€“963 Alvin Jonathan, Emily G. Tomashek, Michael P. Lanci, James A. Dumesic, George W. Huber* Steam reforming kinetics of olefins and aromatics over Mn-Cr-O spinel oxides pp 964â€“976 Lu Yang, Maxim P. Bukhovko, Andrzej Malek, Liwei Li, Christopher W. Jones, Pradeep K. Agrawal, Robert J. Davis* Contents Synthesis modification of hydroxyapatite surface for ethanol conversion: The role of the acidic/basic sites ratio pp 802â€“813 Henrique Brasil, Albert F.B. Bittencourt, Kathlen C.E.S. Yokoo, Paulo C.D. Mendes, Lucas G. Verga, Karla F. Andriani, Richard Landers, Juarez L.F. Da Silva, Gustavo P. ValenÃ§a* Unimolecular and bimolecular formic acid decomposition routes on dispersed Cu nanoparticles pp 814â€“831 Ting Chun Lin, Unai De La Torre, Ava Hejazi, Stephanie Kwon*, Enrique Iglesia* Chemical kinetics for generalized two-step reaction schemes pp 850â€“863 Ali Hussain Motagamwala, James A. Dumesic* Temperature dependence of Cu(I) oxidation and Cu(II) reduction kinetics in the selective catalytic reduction of NOx with NH3 on Cu-chabazite zeolites pp 873â€“882 Siddarth H. Krishna, Casey B. Jones, Rajamani Gounder* Contents Catalytic site ensembles: A context to reexamine the Langmuir-Hinshelwood kinetic description pp 726â€“744 N.K. Razdan, A. Bhan* Sodium-free synthesis of mesoporous zeolite to support Pt-Y alloy nanoparticles exhibiting high catalytic performance in propane dehydrogenation pp 760â€“770 Hongjun Park, Hanyoung Park, Jeong-Chul Kim, Minkee Choi, Jeong Young Park, Ryong Ryoo* Synthesis of silanol nest-containing, siliceous MFI mesoporous zeolites using Na-free synthesis gel was useful for the formation of rare-earth-platinum nanoalloy catalysts, to achieve high performance in propane dehydrogenation. Experimental and computational kinetics study of the liquid-phase hydrogenation of C@C and C@O bonds pp 771â€“785 Gengnan Li, Zheng Zhao, Tong Mou, Qiaohua Tan, Bin Wang, Daniel Resasco* The Delplot kinetic method applied to systems with adsorbates: Hydrodeoxygenation of benzofuran on a bimetallic CoPd phosphide catalyst supported on KUSY pp 786â€“801 William J. Movick, Gwang-Nam Yun, I. Tyrone Ghampson, S. Ted Oyama* Contents Analysis and prediction of reaction kinetics using the degree of rate control pp 647â€“660 Charles T. Campbell*, Zhongtian Mao H2O-assisted O2 reduction by H2 on Pt and PtAu bimetallic nanoparticles: Influences of composition and reactant coverages on kinetic regimes, rates, and selectivities pp 661â€“678 Tomas Ricciardulli, Jason S. Adams, Marco DeRidder, Alexander P. van Bavel, Ayman M. Karim, David W. Flaherty* Harmonious optimum conditions for heterogeneous catalytic reactions derived analytically with Polanyi relation and Bronsted relation pp 706â€“715 Shinichi Ichikawa Breaking the inverse relationship between catalytic activity and selectivity in acetylene partial hydrogenation using dynamic metalâ€“polymer interaction pp 716â€“725 Younghwan Park, Songhyun Lee, Kyunglim Hyun, Jueun Lee, Jeong Young Park, Ryong Ryoo, Minkee Choi* Contents Acidity effect on benzene methylation kinetics over substituted H-MeAlPO-5 catalysts pp 594â€“606 Magnus MortÃ©n, TomÃ¡s Cordero-Lanzac, Pieter Cnudde, Evgeniy A. Redekop, Stian Svelle, Veronique van Speybroeck, Unni Olsbye* -100 -120 -140 -160 -180 0 20 40 60 80 100 -100 -120 -140 -160 -180 100 120 140 160 180 200 Ap pa re nt a c va o n en eg y (k J m ol -1 ) ENH3 (kJ mol-1) H-MgAlPO-5 (44.6)(57.8) H-SAPO-5 H-ZrAlPO-5 (72.0) Low acidity High acidity M et hy la o n ba rr ie r ( kJ m ol -1 ) ENH3 (kJ mol-1) Zr Ti Si Co Zn Mg SSZ-24 (173.6) (157.1) (130.6) Low acidity High acidity Experimental Computa onalH-MeAlPO-5 High acidity Low acidity Me = Mg Zn Co Si Ti Zr Identification and quantification of distinct active sites in Hf-Beta zeolites for transfer hydrogenation catalysis pp 607â€“619 Blake A. Johnson, John R. Di Iorio, Yuriy RomÃ¡n-Leshkov* Methanol-to-olefins catalysis on ERI-type molecular sieves: towards enhancing ethylene selectivity pp 620â€“633 Faisal H. Alshafei, Youngkyu Park, Stacey I. Zones, Mark E. Davis* Mimicking industrial aging in fluid catalytic cracking: A correlative microscopy approach to unravel inter-particle heterogeneities pp 634â€“646 M. Gambino, A.E. Nieuwelink, F. Reints, M. VeselyÌ�, M. Filez, D. Ferreira Sanchez, D. Grolimund, N. Nesterenko, D. Minoux, F. Meirer*, B.M. Weckhuysen* Contents Boosting C3-alcohol electrooxidations by co-fueling with formic acid: A real-time quantitative nuclear magnetic resonance spectroelectrochemical study pp 551â€“559 Ye Feng, Xin-Yi Hou, Li-Fei Ji, Shuo-Hui Cao*, Wen-Long Jiang, Xi-Ji Wang, Hui-Jun Sun, Zu-Rong Ni, Tien-Mo Shih, Shu-Hui Cai, Zhong Chen* Highly efficient amorphous binary cobalt-cerium metal oxides for selective oxidation of 5-hydroxymethylfurfural to 2,5- diformylfuran pp 560â€“569 Thi-Hong-Hanh Le, Truong-Giang Vo, Chia-Ying Chiang* Revising catalytic â€˜â€˜accelerationâ€™â€™ of enzymes on citrate-capped gold nanoparticles pp 570â€“578 Eimantas Ramonas, Atefeh Shafaat, Marius Dagys, Tautgirdas Ruzgas*, Dalius Ratautas* Experiment-based guidelines for analysis of metal surface effect to overall catalytic process was suggested. Rate enhancement of phenol hydrogenation on Pt by hydronium ions in the aqueous phase pp 579â€“593 Guoju Yang, Vineet Maliekkal, Xi Chen, Sebastian Eckstein, Hui Shi, Donald M. Camaioni, Eszter BarÃ¡th, Gary L. Haller, Yue Liu*, Matthew Neurock*, Johannes A. Lercher* Contents Graphene-based catalyst for CO2 reduction: The critical role of solvents in materials design pp 512â€“517 Sehmus Ozden, Laurent Delafontaine, Tristan Asset, Shengyuan Guo, Kai A Filsinger, Rodney D. Priestley, Plamen Atanassov*, Craig B. Arnold* How the surface state of nickel/gadolinium-doped ceria cathodes influences the electrochemical performance in direct CO2 electrolysis pp 518â€“528 Dingkai Chen, Dimitrios K. Niakolas, Vasiliki Papaefthimiou, Evangelia Ioannidou, Stylianos G. Neophytides*, Spyridon Zafeiratos* Supramolecular chiral electrochemical reduction of acetophenone with hybridization of a chiral multifarene and Au nanoparticles pp 529â€“536 Yan-Fang Xue, Heng Li, Qingmei Ge, Mao Liu, Zhu Tao, Hang Cong* Base on the host-guest interaction of a chiral macrocyclic compound, chiral multifarene [3,2,1], with acetophenone, a hybridization catalyst of the host with Au nanoparticles was applied for asymmetric electrochemical reduction to realize a high reactivity and selectivity with 79.0% current efficiency. Solvent promotion on the metal-support interaction and activity of Pd@ZrO2 Catalyst: Formation of metal hydrides as the new catalytic active phase at the Solid-Liquid interface pp 537â€“550 Guang-Jie Xia, Yang-Gang Wang* Contents Homogeneous pressure hydrogenation of quinolines effected by a bench-stable tungsten-based pre-catalyst pp 451â€“461 Thomas Vielhaber, Christian Heizinger, Christoph Topf* A highly efficient Co-based catalyst fabricated by coordination-assisted impregnation strategy towards tandem catalytic functionalization of nitroarenes with various alcohols pp 462â€“474 Jing Wang, Wei She, Xuewei Li, Zhibin Li, Jingfang Li, Guijie Mao, Weizuo Li*, Guangming Li* Cinchonine-based organosilica materials as heterogeneous catalysts of enantioselective alkene dihydroxylation pp 493â€“500 David Tetour, TomÃ¡Å¡ PaÅ¡ka, Veronika MÃ¡kovÃ¡, Barbora Nikendey HolubovÃ¡, Jana KarpÃ­Å¡kovÃ¡, Michal RÌŒezanka, JirÌŒÃ­ Brus, Jana HodacÌŒovÃ¡* Unraveling the size-dependent effect of Ru-based catalysts on Ammonia synthesis at mild conditions pp 501â€“511 Yanliang Zhou, Junjie Wang, Lili Liang, Qianjin Sai, Jun Ni*, Chak-tong Au, Xingyi Lin, Xiuyun Wang*, Ying Zheng, Lirong Zheng, Lilong Jiang* Contents An efficient chiral porous catalyst support â€“ Hypercrosslinked amino acid polymer pp 411â€“419 Yaodong Wang, Lijia Liu*, Kexiao Sang, Yudan Wang, Chunhong Zhang*, Hongxing Dong, Jianwei Bai* By using aromatic amino acid as the starting material, a novel chiral catalyst support, porous hypercrosslinked amino acid polymer was synthesized, the recyclable asymmetric metal supported by it catalyzed efficient asymmetric reaction with high ee% (up to 99%). Catalytic hydrogenation of furfural to furfuryl alcohol on hydrotalcite-derived CuxNi3)xAlOy mixed-metal oxides pp 420â€“429 Lin Luo, Fulong Yuan, Francisco Zaera*, Yujun Zhu* Enhancing hydrophobicity and catalytic activity of nano-Sn-Beta for alcohol ring opening of epoxides through post- synthetic treatment with fluoride pp 430â€“439 Alexander P. Spanos, Aamena Parulkar, Nicholas A. Brunelli* Tuning N2 activation pathway over Ru/Co sub-nanometer alloy for efficient ammonia synthesis pp 440â€“450 Yangyu Zhang, Xuanbei Peng, Jinxiu Deng, Fuxiang Sun, Jihui Cai, Yanliang Zhou, Jun Ni, Bingyu Lin, Lirong Zheng, Xiuyun Wang*, Jianxin Lin, Lilong Jiang* Contents The capping agent is the key: Structural alterations of Ag NPs during CO2 electrolysis probed in a zero-gap gas-flow configuration pp 371â€“382 Menglong Liu, Ying Kong, Huifang Hu, NoÃ©mi KovÃ¡cs, Changzhe Sun, IvÃ¡n Zelocualtecatl Montiel, MarÃ­a de JesÃºs GÃ¡lvez VÃ¡zquez, Yuhui Hou*, Marta Mirolo, Isaac Martens, Jakub Drnec, Soma Vesztergom*, Peter Broekmann* The promoting role of Ga in ZnZrOx solid solution catalyst for CO2 hydrogenation to methanol pp 383â€“392 Feng Sha, Chizhou Tang, Shan Tang, Qingnan Wang, Zhe Han, Jijie Wang*, Can Li* The catalytic performance towards methanol synthesis from CO2 hydrogenation is enhanced by incorporating Ga into ZnZrOx solid solution catalyst. The results from chemisorption and H2-D2 exchange as well as in situ DRIFTS show the promoting role of incorporating Ga mainly reflects in improving the adsorption and activation of H2 and CO2 and in boosting the hydrogenation of HCOO* to CH3O*. Assessment of metal-metal interactions and catalytic behavior in platinum-tin bimetallic subnanometric clusters by using reactive characterizations pp 393â€“399 Aaron Sattler*, Michele Paccagnini, Lichen Liu, Elaine Gomez, Henry Klutse, Allen W. Burton, Avelino Corma* Facile synthesis of palladium incorporated NiCo2O4 spinel for low temperature methane combustion: Activate lattice oxygen to promote activity pp 400â€“410 Ting Wang, Lishushi Qiu, Haiyan Li, Chao Zhang, Yuanmiao Sun, Shibo Xi, Jingjie Ge, Zhichuan J. Xu*, Chuan Wang* Contents Ultrafine Pd nanoparticles on amine-functionalized carbon nanotubes for hydrogen production from formic acid pp 324â€“333 Yongwoo Kim, Hwangho Lee, Seungdo Yang, Jaeha Lee, Hyungjoo Kim, Sungha Hwang, Se Won Jeon, Do Heui Kim* Reaction paths of methane activation and oxidation of surface intermediates over NiO on Ceria-Zirconia catalysts studied by In-situ FTIR spectroscopy pp 334â€“347 Yimeng Lyu, Rui Xu, Olivia Williams, Ziyuan Wang, Carsten Sievers* Morphology alteration of nickel microstructures for glycerol electrooxidation pp 348â€“361 Mohamed S.E. Houache, Mario G. Sandoval, Reza Safari, Francisco GaztaÃ±aga, Federico Escudero, Alfonso HernÃ¡ndez-Laguna, Claro Ignacio Sainz-DÃ­az, Gianluigi A. Botton, Paula V. Jasen, Estela A. GonzÃ¡lez, Alfredo Juan*, Elena A. Baranova* Computational examination of the kinetics of electrochemical nitrogen reduction and hydrogen evolution on a tungsten electrode pp 362â€“370 Ã�rni BjÃ¶rn HÃ¶skuldsson, Ebrahim Tayyebi, Egill SkÃºlason* Contents Ultra-stable dye-sensitized graphene quantum dot as a robust metal-free photocatalyst for hydrogen production pp 273â€“282 Diptiman Dinda, Hyunho Park, Soo Young Park* Palladium-Catalyzed Methoxycarbonylation of 1,3-Butadiene to Methyl-3-Pentenoate: Introduction of a Continuous Process pp 283â€“290 Li-Jun Han, Chong-Shun Rao, Shuang-Shuang Ma, Gui-Yang Sheng, Jun-Ping Zhang, Bao-Hua Xu* Structure sensitivity of nitrogenâ€“doped carbonâ€“supported metal catalysts in dihalomethane hydrodehalogenation pp 291â€“305 Ali J. Saadun, Andrea Ruizâ€“Ferrando, Simon BÃ¼chele, Dario Faust Akl, NÃºria LÃ³pez*, Javier PÃ©rezâ€“RamÃ­rez* Iron and copper nanoparticles inside and outside carbon nanotubes: Nanoconfinement, migration, interaction and catalytic performance in Fischer-Tropsch synthesis pp 306â€“323 Ana Katiuce Fellenberg, Ahmed Addad, Jingping Hong, Pardis Simon, Yuliia Kosto, BrÌŒetislav Å mÃ­d, Gang Ji*, Andrei Y. Khodakov* Contents Epoxidation of propane with oxygen and/or nitrous oxide over silica-supported vanadium oxide pp 231â€“243 A. Held*, J. Kowalska-KusÌ�, E. Janiszewska, A. Jankowska, K. NowinÌ�ska A recyclable CoGa intermetallic compound catalyst for the hydroformylation reaction pp 244â€“249 Jiaojiao Zhao, Yurong He, Fei Wang*, Yusen Yang, Wentao Zheng, Chunfang Huo, Haijun Jiao, Yong Yang, Yongwang Li, Xiaodong Wen* Highly efficient hydroboration of alkynes catalyzed by porous copper-organic framework under mild conditions pp 250â€“257 Zhi-Lei Wu, Xingwang Lan*, Ning Gao, Xiaomin Kang, Zhenguang Wang, Tianding Hu*, Bin Zhao* Elucidating the layer-number impact of MoS2 on the adsorption and hydrogenation of CO pp 258â€“272 Jia-Xin He, Yong-Shan Xiao, Chang Liu*, Min-Li Zhu, Yong-Hong Song, Zhong-Wen Liu Contents Propylene polymerization over titaniumâ€“magnesium catalysts: The effect of internal and external stereoregulating donors on the number of active centers with different stereospecificity and their reactivity in propagation reaction pp 187â€“197 Artem A. Barabanov*, Victoria V. Vereykina, Mikhail A. Matsko, Vladimir A. Zakharov Nature of HCl oxidation Au anomalies and activation of non-carbon-material-supported Au catalyst pp 198â€“203 Bolin Wang, Yuxue Yue, Xiangxue Pang, Mingde Yu, Ting Wang, Renqin Chang, Zhiyan Pan, Jia Zhao*, Xiaonian Li Identifying higher oxygenate synthesis sites in Cu catalysts promoted and stabilized by atomic layer deposited Fe2O3 pp 210â€“223 Arun S. Asundi, Sindhu S. Nathan, Jiyun Hong, Adam S. Hoffman, Makenna Pennel, Simon R. Bare, Stacey F. Bent* Iron-catalyzed hydroaminocarbonylation of alkynes to produce succinimides with NH4HCO3 pp 224â€“230 Zijun Huang*, Changsheng Tang, Zilong Chen, Shaofeng Pi, Zhengde Tan, Jiyong Deng*, Yuehui Li* Contents Earth-abundant manganese oxide nanoneedle as highly efficient electrocatalyst for selective glycerol electro-oxidation to dihydroxyacetone pp 139â€“148 Giang-Son Tran, Truong-Giang Vo, Chia-Ying Chiang* This study report for the first time an earth-abundant manganese oxide (MnO2) was used for electrocatalytic glycerol oxidation with a satisfactory yield and high selectivity under mild pH media. Biowaste-derived hydrochar microspheres: Realizing metal-free visible-light photocatalytic oxidation of amines pp 149â€“162 Feng Su, Haoyu Peng, Hui Yin, Chao Luo, Lixia Zhu, Wenzhou Zhong*, Liqiu Mao*, Dulin Yin Chromium catalysts stabilized by alkylphosphanyl PNP ligands for selective ethylene tri-/tetramerization pp 163â€“173 Fakhre Alam, Haonan Fan, Chunhua Dong*, Jingyi Zhang, Jing Ma, Yanhui Chen, Tao Jiang* Effect of the PH2O/PCO2 and PH2 on the intrinsic electro-catalytic interactions and the CO production pathway on Ni/GDC during solid oxide H2O/CO2 co-electrolysis pp 174â€“186 E. Ioannidou, M. Chavani, S.G. Neophytides*, D.K. Niakolas* Contents Single-Atom Fe-N4 sites promote the triplet-energy transfer process of g-C3N4 for the photooxidation pp 89â€“95 Junhui Wang*, Shimin Yin, Qinhua Zhang, Fengliang Cao, Yicheng Xing, Qingshan Zhao, Yang Wang, Wengang Xu, Wenting Wu*, Mingbo Wu Facet-Dependent selectivity of CeO2 nanoparticles in 2-Propanol conversion pp 96â€“108 Berlin Sudduth, Dongmin Yun, Junming Sun, Yong Wang* Understanding the mechanism(s) of ketone oxidation on VOx/c-Al2O3 pp 109â€“127 Ran Zhu, Bowei Liu, Siwen Wang, Xinlei Huang, Robson L. Schuarca, Wenlin He, Viktor J. Cybulskis, Jesse Q. Bond* Pair sites on Al3O nodes of the metal-organic framework MIL-100: Cooperative roles of defect and structural vacancy sites in methanol dehydration catalysis pp 128â€“138 Shangpu Zhuang, Haodong Huang, Yue Xiao, Zhuxiu Zhang*, Jihai Tang, Bruce C. Gates*, Dong Yang* Contents Highly efficient CO2 reduction under visible-light on non-covalent Ru Re assembled photocatalyst: Evidence on the electron transfer mechanism pp 46â€“55 Houssein Nasrallah, Pengbo Lyu, Guillaume Maurin, Mohamad El-Roz* MXene-motivated accelerated charge transfer over TMCs quantum dots for solar-powered photoreduction catalysis pp 56â€“66 Shi-Cheng Zhu, Shen Li, Bo Tang, Hao Liang, Bi-Jian Liu, Guangcan Xiao, Fang-Xing Xiao* A study of the mechanism of triglyceride hydrodeoxygenation over alumina-supported and phosphatized-alumina- supported Pd catalysts pp 67â€“79 Anna VikÃ¡r, Hanna E. Solt, Gyula NovodÃ¡rszki, Magdolna R. MihÃ¡lyi, RÃ³bert Barthos, Attila DomjÃ¡n, Jen}o HancsÃ³k, JÃ³zsef Valyon, Ferenc LÃ³nyi* Synergistic metal-oxide interaction for efficient self-reconstruction of cobalt oxide as highly active water oxidation electrocatalyst pp 80â€“88 Taeoh Kang, Kwanwoo Kim, Myeongjin Kim*, Jooheon Kim* Contents Lan*, Ning Gao, Xiaomin Kang, Zhenguang Wang, Tianding Hu*, Bin Zhao* Elucidating the layer-number impact of MoS2 on the adsorption and hydrogenation of CO pp 258â€“272 Jia-Xin He, Yong-Shan Xiao, Chang Liu*, Min-Li Zhu, Yong-Hong Song, Zhong-Wen Liu Contents Propylene polymerization over titaniumâ€“magnesium catalysts: The effect of internal and external stereoregulating donors on the number of active centers with different stereospecificity and their reactivity in propagation reaction pp 187â€“197 Artem A. Barabanov*, Victoria V. Vereykina, Mikhail A. Matsko, Vladimir A. Zakharov Nature of HCl oxidation Au anomalies and activation of non-carbon-material-supported Au catalyst pp 198â€“203 Bolin Wang, Yuxue Yue, Xiangxue Pang, Mingde Yu, Ting Wang, Renqin Chang, Zhiyan Pan, Jia Zhao*, Xiaonian Li Identifying higher oxygenate synthesis sites in Cu catalysts promoted and stabilized by atomic layer deposited Fe2O3 pp 210â€“223 Arun S. Asundi, Sindhu S. Nathan, Jiyun Hong, Adam S. Hoffman, Makenna Pennel, Simon R. Bare, Stacey F. Bent* Iron-catalyzed hydroaminocarbonylation of alkynes to produce succinimides with NH4HCO3 pp 224â€“230 Zijun Huang*, Changsheng Tang, Zilong Chen, Shaofeng Pi, Zhengde Tan, Jiyong Deng*, Yuehui Li* Contents Earth-abundant manganese oxide nanoneedle as highly efficient electrocatalyst for selective glycerol electro-oxidation to dihydroxyacetone pp 139â€“148 Giang-Son Tran, Truong-Giang Vo, Chia-Ying Chiang* This study report for the first time an earth-abundant manganese oxide (MnO2) was used for electrocatalytic glycerol oxidation with a satisfactory yield and high selectivity under mild pH media. Biowaste-derived hydrochar microspheres: Realizing metal-free visible-light photocatalytic oxidation of amines pp 149â€“162 Feng Su, Haoyu Peng, Hui Yin, Chao Luo, Lixia Zhu, Wenzhou Zhong*, Liqiu Mao*, Dulin Yin Chromium catalysts stabilized by alkylphosphanyl PNP ligands for selective ethylene tri-/tetramerization pp 163â€“173 Fakhre Alam, Haonan Fan, Chunhua Dong*, Jingyi Zhang, Jing Ma, Yanhui Chen, Tao Jiang* Effect of the PH2O/PCO2 and PH2 on the intrinsic electro-catalytic interactions and the CO production pathway on Ni/GDC during solid oxide H2O/CO2 co-electrolysis pp 174â€“186 E. Ioannidou, M. Chavani, S.G. Neophytides*, D.K. Niakolas* Contents Single-Atom Fe-N4 sites promote the triplet-energy transfer process of g-C3N4 for the photooxidation pp 89â€“95 Junhui Wang*, Shimin Yin, Qinhua Zhang, Fengliang Cao, Yicheng Xing, Qingshan Zhao, Yang Wang, Wengang Xu, Wenting Wu*, Mingbo Wu Facet-Dependent selectivity of CeO2 nanoparticles in 2-Propanol conversion pp 96â€“108 Berlin Sudduth, Dongmin Yun, Junming Sun, Yong Wang* Understanding the mechanism(s) of ketone oxidation on VOx/c-Al2O3 pp 109â€“127 Ran Zhu, Bowei Liu, Siwen Wang, Xinlei Huang, Robson L. Schuarca, Wenlin He, Viktor J. Cybulskis, Jesse Q. Bond* Pair sites on Al3O nodes of the metal-organic framework MIL-100: Cooperative roles of defect and structural vacancy sites in methanol dehydration catalysis pp 128â€“138 Shangpu Zhuang, Haodong Huang, Yue Xiao, Zhuxiu Zhang*, Jihai Tang, Bruce C. Gates*, Dong Yang* Contents Highly efficient CO2 reduction under visible-light on non-covalent Ru Re assembled photocatalyst: Evidence on the electron transfer mechanism pp 46â€“55 Houssein Nasrallah, Pengbo Lyu, Guillaume Maurin, Mohamad El-Roz* MXene-motivated accelerated charge transfer over TMCs quantum dots for solar-powered photoreduction catalysis pp 56â€“66 Shi-Cheng Zhu, Shen Li, Bo Tang, Hao Liang, Bi-Jian Liu, Guangcan Xiao, Fang-Xing Xiao* A study of the mechanism of triglyceride hydrodeoxygenation over alumina-supported and phosphatized-alumina- supported Pd catalysts pp 67â€“79 Anna VikÃ¡r, Hanna E. Solt, Gyula NovodÃ¡rszki, Magdolna R. MihÃ¡lyi, RÃ³bert Barthos, Attila DomjÃ¡n, Jen}o HancsÃ³k, JÃ³zsef Valyon, Ferenc LÃ³nyi* Synergistic metal-oxide interaction for efficient self-reconstruction of cobalt oxide as highly active water oxidation YJCAT 80002432 S0021-9517(21)00508-X 10.1016/S0021-9517(21)00508-X Graphical abstract TOC",
      "coredata": {
        "eid": "1-s2.0-S002195172100508X",
        "dc:description": null,
        "openArchiveArticle": "false",
        "prism:coverDate": "2021-12-31",
        "openaccessUserLicense": null,
        "prism:aggregationType": "Journal",
        "prism:url": "https://api.elsevier.com/content/article/pii/S002195172100508X",
        "link": [
          {
            "@_fa": "true",
            "@rel": "self",
            "@href": "https://api.elsevier.com/content/article/pii/S002195172100508X"
          },
          {
            "@_fa": "true",
            "@rel": "scidir",
            "@href": "https://www.sciencedirect.com/science/article/pii/S002195172100508X"
          }
        ],
        "dc:format": "application/json",
        "openaccessType": null,
        "pii": "S0021-9517(21)00508-X",
        "prism:volume": "404",
        "dc:title": "Graphical abstract TOC",
        "prism:copyright": null,
        "openaccess": "0",
        "prism:issn": "00219517",
        "openaccessArticle": "false",
        "prism:publicationName": "Journal of Catalysis",
        "openaccessSponsorType": null,
        "prism:pageRange": "I-XXII",
        "prism:endingPage": "XXII",
        "pubType": "con",
        "prism:coverDisplayDate": "December 2021",
        "prism:doi": "10.1016/S0021-9517(21)00508-X",
        "prism:startingPage": "I",
        "dc:identifier": "doi:10.1016/S0021-9517(21)00508-X",
        "openaccessSponsorName": null
      }
    }
  }
}