{
  "metadata": {
    "title": "Synergistic effect of single atoms and clusters on boosting activity of TiO<ce:inf loc=post>2</ce:inf>-supported Pd catalysts towards total furfural hydrogenation",
    "authors": "; ; ",
    "journal": "Journal of Catalysis",
    "date": "2025-06-30",
    "doi": "10.1016/j.jcat.2025.116083",
    "abstract": "",
    "uri": "https://api.elsevier.com/content/article/pii/S0021951725001484",
    "pii": "S0021951725001484"
  },
  "fulltext": {
    "full-text-retrieval-response": {
      "scopus-eid": "2-s2.0-105000741885",
      "originalText": "serial JL 272561 291210 291744 291809 31 Journal of Catalysis JOURNALCATALYSIS 2025-03-18 2025-03-18 2025-03-26 2025-03-26 2025-04-04T15:09:58 1-s2.0-S0021951725001484 S0021-9517(25)00148-4 S0021951725001484 10.1016/j.jcat.2025.116083 S300 S300.1 FULL-TEXT 1-s2.0-S0021951725X0004X 2025-04-04T15:51:47.064074Z 0 0 20250601 20250630 2025 2025-03-18T23:58:39.712572Z absattachment articleinfo articlenumber articletitlenorm authfirstinitialnorm authfirstsurnamenorm cid cids contenttype copyright crossmark dateloaded dateloadedtxt datesearch datesort dateupdated dco docsubtype doctype doi eid ewtransactionid hubeid indexeddate issn issnnorm itemstage itemtransactionid itemweight openaccess openarchive pg pgfirst pii piinorm pubdateend pubdatestart pubdatetxt pubyr sectiontitle sortorder srctitle srctitlenorm srctype ssids alllist content subj subheadings suppl tomb volfirst volissue volumelist webpdf webpdfpagecount yearnav figure table e-component body mmlmath acknowledge affil appendices articletitle auth authfirstini authfull authkeywords authlast footnotes grantnumber grantsponsor grantsponsorid highlightsabst orcid primabst pubtype ref specialabst 0021-9517 00219517 true 446 446 C Volume 446 27 116083 116083 116083 202506 June 2025 2025-06-01 2025-06-30 2025 Regular Articles article fla © 2025 Elsevier Inc. All rights are reserved, including those for text and data mining, AI training, and similar technologies. SYNERGISTICEFFECTSINGLEATOMSCLUSTERSBOOSTINGACTIVITYTIO2SUPPORTEDPDCATALYSTSTOWARDSTOTALFURFURALHYDROGENATION GU J 1 Introduction 2 Experimental section 2.1 Materials 2.2 Synthesis of Pd/TiO2 2.3 General procedure for catalytic hydrogenation 2.4 Reusability of the Pd/TiO2 2.5 Characterization 3 Results and discussion 3.1 Catalyst screening 3.2 Characterization of Pd/TiO2 3.3 Kinetic studies 3.4 Recycle stability and substrate scope 4 Conclusion Author contributions CRediT authorship contribution statement Acknowledgments Appendix A Supplementary data References CORMA 2007 2411 2502 A CHHEDA 2007 7164 7183 J FERNANDO 2006 1727 1737 S BESSON 2014 1827 1870 M RAGAUSKAS 2006 484 489 A YAN 2014 663 676 K DUTTA 2012 2025 2036 S LI 2016 7621 7640 X MARISCAL 2016 1144 1189 R CHEN 2007 5 11 X KOSO 2009 2035 2037 S HUANG 2018 6957 6964 R NAKAGAWA 2014 2718 2726 Y ZHANG 2024 114101 Y ROGERS 2017 2266 2274 S PANG 2013 2448 S ZHANG 2018 148 155 J VOROTNIKOV 2012 2496 2504 V PEREZRAMIREZ 2019 971 976 J GUO 2024 2719 2729 M REN 2024 108 123 X LIU 2021 453 456 L KUAI 2020 48 L ZOU 2021 4968 H VANDEELEN 2019 955 970 T RO 2018 7368 7387 I XU 2018 3367 C MACINO 2019 873 881 M ALDOSARI 2016 234 242 O FANG 2024 114936 Q ALBILALI 2018 252 267 R ZHAO 2019 431 436 Z SHI 2023 429 S LI 2022 546 553 X GUO 2021 54 M FIGUEIREDO 2022 151647 W CHENG 2021 976 985 G YU 2022 7154 I CHEN 2022 12720 12743 X PENG 2020 262 273 M DONG 2022 485 493 C GASHNIKOVA 2024 14871 14886 D GUO 2018 6476 6485 M WANG 2024 1432 1442 S WANG 2021 119540 C LI 2017 560 569 Y YARAR 2023 106580 M SHAIKHUTDINOV 2001 330 339 S JACKSON 2003 5240 5243 S SINGH 2017 19380 19388 S XIE 2024 e202415203 J GAO 2023 2300956 W RESASCO 2020 595 603 J SHEN 2022 5024 5031 Q AIREDDY 2022 4707 4723 D NAKAGAWA 2012 179 1797 Y MEDFORD 2015 36 42 A RUBAN 1997 421 429 A VANSANTEN 2010 1 30 R NOVELCONCEPTSINCATALYSISCHEMICALREACTORS MOLECULARCATALYTICKINETICSCONCEPTS GUO 2022 1770 M WANG 2023 8720 8730 S MO 2023 2301711 F SERP 2023 e202300545 P PRINS 2012 2714 2738 R LI 2023 144691 M XIE 2009 746 749 X GUX2025X116083 GUX2025X116083XJ 2027-03-26T00:00:00.000Z 2027-03-26T00:00:00.000Z http://creativecommons.org/licenses/by-nc-nd/4.0/ © 2025 Elsevier Inc. All rights are reserved, including those for text and data mining, AI training, and similar technologies. 2025-03-28T02:36:51.026Z http://vtw.elsevier.com/data/voc/AddOnTypes/50.7/aggregated-refined Liaoning Revitalization Talents Program XLYC2008022 Liaoning Revitalization Talents Program http://data.elsevier.com/vocabulary/SciValFunders/501100018617 http://sws.geonames.org/1814991 CAS CAS Chinese Academy of Sciences http://data.elsevier.com/vocabulary/SciValFunders/501100002367 http://sws.geonames.org/1814991/ Dalian Institute of Chemical Physics DICP Dalian Institute of Chemical Physics, Chinese Academy of Sciences http://data.elsevier.com/vocabulary/SciValFunders/501100002979 http://sws.geonames.org/1814991/ National Natural Science Foundation of China 22202200 National Natural Science Foundation of China http://data.elsevier.com/vocabulary/SciValFunders/501100001809 http://sws.geonames.org/1814991 We acknowledge financial support from the National Natural Science Foundation of China (22202200) and Liaoning Revitalization Talents Program (XLYC2008022). We also thank Ms Peifang Yan from the Dalian Institute of Chemical Physics, CAS, for the TPD and TPR experiments. https://doi.org/10.15223/policy-017 https://doi.org/10.15223/policy-037 https://doi.org/10.15223/policy-012 https://doi.org/10.15223/policy-029 https://doi.org/10.15223/policy-004 item S0021-9517(25)00148-4 S0021951725001484 1-s2.0-S0021951725001484 10.1016/j.jcat.2025.116083 272561 2025-04-04T15:51:47.064074Z 2025-06-01 2025-06-30 1-s2.0-S0021951725001484-main.pdf https://s3-eu-west-1.amazonaws.com/prod-ucs-content-store-eu-west/content/pii:S0021951725001484/MAIN/application/pdf/b30a19cff25400f1652d8eb9933844f2/main.pdf main.pdf pdf true 7383036 MAIN 11 1-s2.0-S0021951725001484-main_1.png https://s3-eu-west-1.amazonaws.com/prod-ucs-content-store-eu-west/content/pii:S0021951725001484/PREVIEW/image/png/73a39b70c5b7abf4e04bfd932ba8cccf/main_1.png main_1.png png 58948 849 656 IMAGE-WEB-PDF 1 1-s2.0-S0021951725001484-gr2.jpg https://s3-eu-west-1.amazonaws.com/prod-ucs-content-store-eu-west/content/pii:S0021951725001484/gr2/DOWNSAMPLED/image/jpeg/5a1585bd57a15c032828027af799450a/gr2.jpg gr2 gr2.jpg jpg 151883 617 622 IMAGE-DOWNSAMPLED 1-s2.0-S0021951725001484-fx9.jpg https://s3-eu-west-1.amazonaws.com/prod-ucs-content-store-eu-west/content/pii:S0021951725001484/fx9/DOWNSAMPLED/image/jpeg/a7a97578e87b1730198fe7f63583a241/fx9.jpg fx9 fx9.jpg jpg 1431 35 69 IMAGE-DOWNSAMPLED 1-s2.0-S0021951725001484-gr1.jpg https://s3-eu-west-1.amazonaws.com/prod-ucs-content-store-eu-west/content/pii:S0021951725001484/gr1/DOWNSAMPLED/image/jpeg/8584f4a14e0a4c4183981dded86b4f24/gr1.jpg gr1 gr1.jpg jpg 73681 593 622 IMAGE-DOWNSAMPLED 1-s2.0-S0021951725001484-fx8.jpg https://s3-eu-west-1.amazonaws.com/prod-ucs-content-store-eu-west/content/pii:S0021951725001484/fx8/DOWNSAMPLED/image/jpeg/6ca09712cc38efddb9ce54d493bc1d1e/fx8.jpg fx8 fx8.jpg jpg 1262 35 59 IMAGE-DOWNSAMPLED 1-s2.0-S0021951725001484-fx7.jpg https://s3-eu-west-1.amazonaws.com/prod-ucs-content-store-eu-west/content/pii:S0021951725001484/fx7/DOWNSAMPLED/image/jpeg/290fd29eb2cadd5f844fdea302fcfa9f/fx7.jpg fx7 fx7.jpg jpg 1268 35 59 IMAGE-DOWNSAMPLED 1-s2.0-S0021951725001484-fx6.jpg https://s3-eu-west-1.amazonaws.com/prod-ucs-content-store-eu-west/content/pii:S0021951725001484/fx6/DOWNSAMPLED/image/jpeg/87e702079db2585708baee0d2f121eb1/fx6.jpg fx6 fx6.jpg jpg 1158 30 48 IMAGE-DOWNSAMPLED 1-s2.0-S0021951725001484-gr5.jpg https://s3-eu-west-1.amazonaws.com/prod-ucs-content-store-eu-west/content/pii:S0021951725001484/gr5/DOWNSAMPLED/image/jpeg/78daf53594b5ed6a87f3328220f6a3bb/gr5.jpg gr5 gr5.jpg jpg 60542 541 600 IMAGE-DOWNSAMPLED 1-s2.0-S0021951725001484-fx10.jpg https://s3-eu-west-1.amazonaws.com/prod-ucs-content-store-eu-west/content/pii:S0021951725001484/fx10/DOWNSAMPLED/image/jpeg/38472b75861904bd449ea5c56c343231/fx10.jpg fx10 fx10.jpg jpg 1440 34 69 IMAGE-DOWNSAMPLED 1-s2.0-S0021951725001484-gr4.jpg https://s3-eu-west-1.amazonaws.com/prod-ucs-content-store-eu-west/content/pii:S0021951725001484/gr4/DOWNSAMPLED/image/jpeg/8c9d6df529c43bde441e7d04f1d3bd2a/gr4.jpg gr4 gr4.jpg jpg 62371 455 711 IMAGE-DOWNSAMPLED 1-s2.0-S0021951725001484-fx11.jpg https://s3-eu-west-1.amazonaws.com/prod-ucs-content-store-eu-west/content/pii:S0021951725001484/fx11/DOWNSAMPLED/image/jpeg/a94e455b258dcb899dc8502961b6496d/fx11.jpg fx11 fx11.jpg jpg 1615 47 74 IMAGE-DOWNSAMPLED 1-s2.0-S0021951725001484-gr3.jpg https://s3-eu-west-1.amazonaws.com/prod-ucs-content-store-eu-west/content/pii:S0021951725001484/gr3/DOWNSAMPLED/image/jpeg/5f9e7c3a39e81c27b306e87f924fb3d4/gr3.jpg gr3 gr3.jpg jpg 62726 429 711 IMAGE-DOWNSAMPLED 1-s2.0-S0021951725001484-fx12.jpg https://s3-eu-west-1.amazonaws.com/prod-ucs-content-store-eu-west/content/pii:S0021951725001484/fx12/DOWNSAMPLED/image/jpeg/892c85549be3fc516d224832653eb39c/fx12.jpg fx12 fx12.jpg jpg 1586 46 72 IMAGE-DOWNSAMPLED 1-s2.0-S0021951725001484-fx13.jpg https://s3-eu-west-1.amazonaws.com/prod-ucs-content-store-eu-west/content/pii:S0021951725001484/fx13/DOWNSAMPLED/image/jpeg/8d5b8fd4dcdaa671f6d601e8bd75f192/fx13.jpg fx13 fx13.jpg jpg 844 32 45 IMAGE-DOWNSAMPLED 1-s2.0-S0021951725001484-fx14.jpg https://s3-eu-west-1.amazonaws.com/prod-ucs-content-store-eu-west/content/pii:S0021951725001484/fx14/DOWNSAMPLED/image/jpeg/b0691fae51a61d7d7fd725c0fee0592b/fx14.jpg fx14 fx14.jpg jpg 800 31 44 IMAGE-DOWNSAMPLED 1-s2.0-S0021951725001484-fx15.jpg https://s3-eu-west-1.amazonaws.com/prod-ucs-content-store-eu-west/content/pii:S0021951725001484/fx15/DOWNSAMPLED/image/jpeg/64ceddcc5cbeb008f069e261ecd65b51/fx15.jpg fx15 fx15.jpg jpg 1894 41 110 IMAGE-DOWNSAMPLED 1-s2.0-S0021951725001484-fx16.jpg https://s3-eu-west-1.amazonaws.com/prod-ucs-content-store-eu-west/content/pii:S0021951725001484/fx16/DOWNSAMPLED/image/jpeg/6905facce2ec2e4be177bb2ee209a0a1/fx16.jpg fx16 fx16.jpg jpg 1875 41 110 IMAGE-DOWNSAMPLED 1-s2.0-S0021951725001484-ga1.jpg https://s3-eu-west-1.amazonaws.com/prod-ucs-content-store-eu-west/content/pii:S0021951725001484/ga1/DOWNSAMPLED/image/jpeg/ca4f4fd9922e19aa89a3f24aaa5ecc83/ga1.jpg ga1 true ga1.jpg jpg 15608 200 369 IMAGE-DOWNSAMPLED 1-s2.0-S0021951725001484-fx1.jpg https://s3-eu-west-1.amazonaws.com/prod-ucs-content-store-eu-west/content/pii:S0021951725001484/fx1/DOWNSAMPLED/image/jpeg/e7479b4ff20b833a44c6746024c45297/fx1.jpg fx1 fx1.jpg jpg 1420 30 88 IMAGE-DOWNSAMPLED 1-s2.0-S0021951725001484-fx5.jpg https://s3-eu-west-1.amazonaws.com/prod-ucs-content-store-eu-west/content/pii:S0021951725001484/fx5/DOWNSAMPLED/image/jpeg/518feb1106d77c608d4f0608406bea2d/fx5.jpg fx5 fx5.jpg jpg 1174 31 49 IMAGE-DOWNSAMPLED 1-s2.0-S0021951725001484-fx4.jpg https://s3-eu-west-1.amazonaws.com/prod-ucs-content-store-eu-west/content/pii:S0021951725001484/fx4/DOWNSAMPLED/image/jpeg/d04d552e6a83e84296a985192b17c576/fx4.jpg fx4 fx4.jpg jpg 1450 46 72 IMAGE-DOWNSAMPLED 1-s2.0-S0021951725001484-sc1.jpg https://s3-eu-west-1.amazonaws.com/prod-ucs-content-store-eu-west/content/pii:S0021951725001484/sc1/DOWNSAMPLED/image/jpeg/6289709372bd033dad13cae6aab5ade7/sc1.jpg sc1 sc1.jpg jpg 13341 234 373 IMAGE-DOWNSAMPLED 1-s2.0-S0021951725001484-fx3.jpg https://s3-eu-west-1.amazonaws.com/prod-ucs-content-store-eu-west/content/pii:S0021951725001484/fx3/DOWNSAMPLED/image/jpeg/e5afbd71ac36bcccb63c952c05dc37fe/fx3.jpg fx3 fx3.jpg jpg 1521 47 72 IMAGE-DOWNSAMPLED 1-s2.0-S0021951725001484-fx2.jpg https://s3-eu-west-1.amazonaws.com/prod-ucs-content-store-eu-west/content/pii:S0021951725001484/fx2/DOWNSAMPLED/image/jpeg/5c1a969179790d8f78dc16e973ac4cb0/fx2.jpg fx2 fx2.jpg jpg 1427 29 96 IMAGE-DOWNSAMPLED 1-s2.0-S0021951725001484-gr2.sml https://s3-eu-west-1.amazonaws.com/prod-ucs-content-store-eu-west/content/pii:S0021951725001484/gr2/THUMBNAIL/image/gif/77b3e4421be5e0aa0aa5b6bf204bf333/gr2.sml gr2 gr2.sml sml 19059 164 165 IMAGE-THUMBNAIL 1-s2.0-S0021951725001484-fx9.sml https://s3-eu-west-1.amazonaws.com/prod-ucs-content-store-eu-west/content/pii:S0021951725001484/fx9/THUMBNAIL/image/gif/9e3ecb6764a90552f0021c59ffe7c00d/fx9.sml fx9 fx9.sml sml 5561 110 219 IMAGE-THUMBNAIL 1-s2.0-S0021951725001484-gr1.sml https://s3-eu-west-1.amazonaws.com/prod-ucs-content-store-eu-west/content/pii:S0021951725001484/gr1/THUMBNAIL/image/gif/fb42f48c489912155e771397b4909eeb/gr1.sml gr1 gr1.sml sml 10235 164 172 IMAGE-THUMBNAIL 1-s2.0-S0021951725001484-fx8.sml https://s3-eu-west-1.amazonaws.com/prod-ucs-content-store-eu-west/content/pii:S0021951725001484/fx8/THUMBNAIL/image/gif/df5ce2e506794c86eadcb6b58b48d6cd/fx8.sml fx8 fx8.sml sml 6233 129 219 IMAGE-THUMBNAIL 1-s2.0-S0021951725001484-fx7.sml https://s3-eu-west-1.amazonaws.com/prod-ucs-content-store-eu-west/content/pii:S0021951725001484/fx7/THUMBNAIL/image/gif/5a6b08cee63047770be9ae089ff5e164/fx7.sml fx7 fx7.sml sml 7311 129 219 IMAGE-THUMBNAIL 1-s2.0-S0021951725001484-fx6.sml https://s3-eu-west-1.amazonaws.com/prod-ucs-content-store-eu-west/content/pii:S0021951725001484/fx6/THUMBNAIL/image/gif/cdebbac40ed344b4987d1263e175305a/fx6.sml fx6 fx6.sml sml 7904 135 213 IMAGE-THUMBNAIL 1-s2.0-S0021951725001484-gr5.sml https://s3-eu-west-1.amazonaws.com/prod-ucs-content-store-eu-west/content/pii:S0021951725001484/gr5/THUMBNAIL/image/gif/ef3a37a207c640bdae71577c1d2e1fe5/gr5.sml gr5 gr5.sml sml 5908 164 182 IMAGE-THUMBNAIL 1-s2.0-S0021951725001484-fx10.sml https://s3-eu-west-1.amazonaws.com/prod-ucs-content-store-eu-west/content/pii:S0021951725001484/fx10/THUMBNAIL/image/gif/cffeb78fcf40d998fc42461ec6168da0/fx10.sml fx10 fx10.sml sml 5389 108 219 IMAGE-THUMBNAIL 1-s2.0-S0021951725001484-gr4.sml https://s3-eu-west-1.amazonaws.com/prod-ucs-content-store-eu-west/content/pii:S0021951725001484/gr4/THUMBNAIL/image/gif/35c389bd80319a90bea04f7946f0d1d9/gr4.sml gr4 gr4.sml sml 7176 140 219 IMAGE-THUMBNAIL 1-s2.0-S0021951725001484-fx11.sml https://s3-eu-west-1.amazonaws.com/prod-ucs-content-store-eu-west/content/pii:S0021951725001484/fx11/THUMBNAIL/image/gif/08e35465359eb279bf696c88acad8704/fx11.sml fx11 fx11.sml sml 6743 139 219 IMAGE-THUMBNAIL 1-s2.0-S0021951725001484-gr3.sml https://s3-eu-west-1.amazonaws.com/prod-ucs-content-store-eu-west/content/pii:S0021951725001484/gr3/THUMBNAIL/image/gif/a3ffa729dcb120294a20797c56b784bc/gr3.sml gr3 gr3.sml sml 8415 132 219 IMAGE-THUMBNAIL 1-s2.0-S0021951725001484-fx12.sml https://s3-eu-west-1.amazonaws.com/prod-ucs-content-store-eu-west/content/pii:S0021951725001484/fx12/THUMBNAIL/image/gif/5c08a9e86c111e55c4a7033ca9abcbfb/fx12.sml fx12 fx12.sml sml 6488 139 219 IMAGE-THUMBNAIL 1-s2.0-S0021951725001484-fx13.sml https://s3-eu-west-1.amazonaws.com/prod-ucs-content-store-eu-west/content/pii:S0021951725001484/fx13/THUMBNAIL/image/gif/b27218ff65b0b95cb606c825b1f4c541/fx13.sml fx13 fx13.sml sml 6935 144 201 IMAGE-THUMBNAIL 1-s2.0-S0021951725001484-fx14.sml https://s3-eu-west-1.amazonaws.com/prod-ucs-content-store-eu-west/content/pii:S0021951725001484/fx14/THUMBNAIL/image/gif/702bad4b2a3494bf304d8e75ded9963d/fx14.sml fx14 fx14.sml sml 5792 141 198 IMAGE-THUMBNAIL 1-s2.0-S0021951725001484-fx15.sml https://s3-eu-west-1.amazonaws.com/prod-ucs-content-store-eu-west/content/pii:S0021951725001484/fx15/THUMBNAIL/image/gif/cf22d25e8e6572e790218c73bf610f76/fx15.sml fx15 fx15.sml sml 4542 81 219 IMAGE-THUMBNAIL 1-s2.0-S0021951725001484-fx16.sml https://s3-eu-west-1.amazonaws.com/prod-ucs-content-store-eu-west/content/pii:S0021951725001484/fx16/THUMBNAIL/image/gif/c8279dfbbfe91d0bd405347096ec595e/fx16.sml fx16 fx16.sml sml 4247 81 219 IMAGE-THUMBNAIL 1-s2.0-S0021951725001484-ga1.sml https://s3-eu-west-1.amazonaws.com/prod-ucs-content-store-eu-west/content/pii:S0021951725001484/ga1/THUMBNAIL/image/gif/9765d5c32b15d8ecd733e39267441fc3/ga1.sml ga1 true ga1.sml sml 5642 119 219 IMAGE-THUMBNAIL 1-s2.0-S0021951725001484-fx1.sml https://s3-eu-west-1.amazonaws.com/prod-ucs-content-store-eu-west/content/pii:S0021951725001484/fx1/THUMBNAIL/image/gif/bd61802730778325e3ea6407ffd5e4bc/fx1.sml fx1 fx1.sml sml 4759 75 219 IMAGE-THUMBNAIL 1-s2.0-S0021951725001484-fx5.sml https://s3-eu-west-1.amazonaws.com/prod-ucs-content-store-eu-west/content/pii:S0021951725001484/fx5/THUMBNAIL/image/gif/6da13aff910247583e0d14e22111e500/fx5.sml fx5 fx5.sml sml 8874 138 219 IMAGE-THUMBNAIL 1-s2.0-S0021951725001484-fx4.sml https://s3-eu-west-1.amazonaws.com/prod-ucs-content-store-eu-west/content/pii:S0021951725001484/fx4/THUMBNAIL/image/gif/742108cd06248c7b87ef47e3069f7839/fx4.sml fx4 fx4.sml sml 5645 140 219 IMAGE-THUMBNAIL 1-s2.0-S0021951725001484-sc1.sml https://s3-eu-west-1.amazonaws.com/prod-ucs-content-store-eu-west/content/pii:S0021951725001484/sc1/THUMBNAIL/image/gif/ee08d87a19ad31a344115379b19a4b9a/sc1.sml sc1 sc1.sml sml 4952 137 219 IMAGE-THUMBNAIL 1-s2.0-S0021951725001484-fx3.sml https://s3-eu-west-1.amazonaws.com/prod-ucs-content-store-eu-west/content/pii:S0021951725001484/fx3/THUMBNAIL/image/gif/a76f93e46206f787eac181cdfbadcb44/fx3.sml fx3 fx3.sml sml 6271 142 219 IMAGE-THUMBNAIL 1-s2.0-S0021951725001484-fx2.sml https://s3-eu-west-1.amazonaws.com/prod-ucs-content-store-eu-west/content/pii:S0021951725001484/fx2/THUMBNAIL/image/gif/c722ca59a583c9fb890f4d6e5e201e41/fx2.sml fx2 fx2.sml sml 4185 66 219 IMAGE-THUMBNAIL 1-s2.0-S0021951725001484-gr2_lrg.jpg https://s3-eu-west-1.amazonaws.com/prod-ucs-content-store-eu-west/content/pii:S0021951725001484/HIGHRES/image/jpeg/f2a98824c9d290f009fb84094110b151/gr2_lrg.jpg gr2 gr2_lrg.jpg jpg 1435949 2734 2756 IMAGE-HIGH-RES 1-s2.0-S0021951725001484-fx9_lrg.jpg https://s3-eu-west-1.amazonaws.com/prod-ucs-content-store-eu-west/content/pii:S0021951725001484/HIGHRES/image/jpeg/9f9efebb41a4c74f221b7533f1c6f511/fx9_lrg.jpg fx9 fx9_lrg.jpg jpg 6466 153 306 IMAGE-HIGH-RES 1-s2.0-S0021951725001484-gr1_lrg.jpg https://s3-eu-west-1.amazonaws.com/prod-ucs-content-store-eu-west/content/pii:S0021951725001484/HIGHRES/image/jpeg/0c68ee8d8ae2ec37dbd2985f5c98047d/gr1_lrg.jpg gr1 gr1_lrg.jpg jpg 458099 2626 2756 IMAGE-HIGH-RES 1-s2.0-S0021951725001484-fx8_lrg.jpg https://s3-eu-west-1.amazonaws.com/prod-ucs-content-store-eu-west/content/pii:S0021951725001484/HIGHRES/image/jpeg/baef07f0076c75f4922d72168e806a61/fx8_lrg.jpg fx8 fx8_lrg.jpg jpg 4770 156 264 IMAGE-HIGH-RES 1-s2.0-S0021951725001484-fx7_lrg.jpg https://s3-eu-west-1.amazonaws.com/prod-ucs-content-store-eu-west/content/pii:S0021951725001484/HIGHRES/image/jpeg/54b458fd9c0a2c3d25b87a76bd19350c/fx7_lrg.jpg fx7 fx7_lrg.jpg jpg 4813 156 264 IMAGE-HIGH-RES 1-s2.0-S0021951725001484-fx6_lrg.jpg https://s3-eu-west-1.amazonaws.com/prod-ucs-content-store-eu-west/content/pii:S0021951725001484/HIGHRES/image/jpeg/df618e0fa58b7a1a4904fc56d1c03978/fx6_lrg.jpg fx6 fx6_lrg.jpg jpg 4433 135 213 IMAGE-HIGH-RES 1-s2.0-S0021951725001484-gr5_lrg.jpg https://s3-eu-west-1.amazonaws.com/prod-ucs-content-store-eu-west/content/pii:S0021951725001484/HIGHRES/image/jpeg/46ac692ed4b57d1e3bc9c1a433870320/gr5_lrg.jpg gr5 gr5_lrg.jpg jpg 316900 2396 2657 IMAGE-HIGH-RES 1-s2.0-S0021951725001484-fx10_lrg.jpg https://s3-eu-west-1.amazonaws.com/prod-ucs-content-store-eu-west/content/pii:S0021951725001484/HIGHRES/image/jpeg/8d65df01d841eebf5875af15ff9c319a/fx10_lrg.jpg fx10 fx10_lrg.jpg jpg 6721 152 307 IMAGE-HIGH-RES 1-s2.0-S0021951725001484-gr4_lrg.jpg https://s3-eu-west-1.amazonaws.com/prod-ucs-content-store-eu-west/content/pii:S0021951725001484/HIGHRES/image/jpeg/f32895124a224ff174fe1316d5f713aa/gr4_lrg.jpg gr4 gr4_lrg.jpg jpg 343692 2015 3150 IMAGE-HIGH-RES 1-s2.0-S0021951725001484-fx11_lrg.jpg https://s3-eu-west-1.amazonaws.com/prod-ucs-content-store-eu-west/content/pii:S0021951725001484/HIGHRES/image/jpeg/af15bf692bb35ac36f61a0a6f86a96ce/fx11_lrg.jpg fx11 fx11_lrg.jpg jpg 6785 210 330 IMAGE-HIGH-RES 1-s2.0-S0021951725001484-gr3_lrg.jpg https://s3-eu-west-1.amazonaws.com/prod-ucs-content-store-eu-west/content/pii:S0021951725001484/HIGHRES/image/jpeg/5d2b3ec2b63088d2a2720bd7fa20d449/gr3_lrg.jpg gr3 gr3_lrg.jpg jpg 387978 1901 3150 IMAGE-HIGH-RES 1-s2.0-S0021951725001484-fx12_lrg.jpg https://s3-eu-west-1.amazonaws.com/prod-ucs-content-store-eu-west/content/pii:S0021951725001484/HIGHRES/image/jpeg/58db5c07ea615d07016282dd57fe22fa/fx12_lrg.jpg fx12 fx12_lrg.jpg jpg 6602 203 320 IMAGE-HIGH-RES 1-s2.0-S0021951725001484-fx13_lrg.jpg https://s3-eu-west-1.amazonaws.com/prod-ucs-content-store-eu-west/content/pii:S0021951725001484/HIGHRES/image/jpeg/73e058fa41a70b0d2bae36fa93decb1f/fx13_lrg.jpg fx13 fx13_lrg.jpg jpg 3001 144 201 IMAGE-HIGH-RES 1-s2.0-S0021951725001484-fx14_lrg.jpg https://s3-eu-west-1.amazonaws.com/prod-ucs-content-store-eu-west/content/pii:S0021951725001484/HIGHRES/image/jpeg/c18cd12d3b85f63a58c29a9ec6fe1f28/fx14_lrg.jpg fx14 fx14_lrg.jpg jpg 2629 141 198 IMAGE-HIGH-RES 1-s2.0-S0021951725001484-fx15_lrg.jpg https://s3-eu-west-1.amazonaws.com/prod-ucs-content-store-eu-west/content/pii:S0021951725001484/HIGHRES/image/jpeg/b540a001cd9fd8ab84d77f2110fbc4d0/fx15_lrg.jpg fx15 fx15_lrg.jpg jpg 7283 181 489 IMAGE-HIGH-RES 1-s2.0-S0021951725001484-fx16_lrg.jpg https://s3-eu-west-1.amazonaws.com/prod-ucs-content-store-eu-west/content/pii:S0021951725001484/HIGHRES/image/jpeg/64e8f8dfaa14363f0ce7fdcbeda76841/fx16_lrg.jpg fx16 fx16_lrg.jpg jpg 7239 181 489 IMAGE-HIGH-RES 1-s2.0-S0021951725001484-ga1_lrg.jpg https://s3-eu-west-1.amazonaws.com/prod-ucs-content-store-eu-west/content/pii:S0021951725001484/HIGHRES/image/jpeg/0d53184c5b1960b5808c6265df29c401/ga1_lrg.jpg ga1 true ga1_lrg.jpg jpg 94629 886 1637 IMAGE-HIGH-RES 1-s2.0-S0021951725001484-fx1_lrg.jpg https://s3-eu-west-1.amazonaws.com/prod-ucs-content-store-eu-west/content/pii:S0021951725001484/HIGHRES/image/jpeg/63d82f6a2a57d57d2e593c8cf2edee0b/fx1_lrg.jpg fx1 fx1_lrg.jpg jpg 5555 133 390 IMAGE-HIGH-RES 1-s2.0-S0021951725001484-fx5_lrg.jpg https://s3-eu-west-1.amazonaws.com/prod-ucs-content-store-eu-west/content/pii:S0021951725001484/HIGHRES/image/jpeg/28c6031d0f4cf9d1f845346ccded4d52/fx5_lrg.jpg fx5 fx5_lrg.jpg jpg 4379 138 219 IMAGE-HIGH-RES 1-s2.0-S0021951725001484-fx4_lrg.jpg https://s3-eu-west-1.amazonaws.com/prod-ucs-content-store-eu-west/content/pii:S0021951725001484/HIGHRES/image/jpeg/7057bb58f854e5117507e3f80d19e682/fx4_lrg.jpg fx4 fx4_lrg.jpg jpg 5909 206 323 IMAGE-HIGH-RES 1-s2.0-S0021951725001484-sc1_lrg.jpg https://s3-eu-west-1.amazonaws.com/prod-ucs-content-store-eu-west/content/pii:S0021951725001265/HIGHRES/image/jpeg/b44a982549256444bd1ddd9f34d5d983/sc1_lrg.jpg sc1 sc1_lrg.jpg jpg 78827 1038 1654 IMAGE-HIGH-RES 1-s2.0-S0021951725001484-fx3_lrg.jpg https://s3-eu-west-1.amazonaws.com/prod-ucs-content-store-eu-west/content/pii:S0021951725001265/HIGHRES/image/jpeg/0f2208e690348440c339930f32609e7f/fx3_lrg.jpg fx3 fx3_lrg.jpg jpg 6027 209 323 IMAGE-HIGH-RES 1-s2.0-S0021951725001484-fx2_lrg.jpg https://s3-eu-west-1.amazonaws.com/prod-ucs-content-store-eu-west/content/pii:S0021951725001265/HIGHRES/image/jpeg/a80ec65a70099a86ffbdfd4f6548fc7d/fx2_lrg.jpg fx2 fx2_lrg.jpg jpg 5397 130 429 IMAGE-HIGH-RES 1-s2.0-S0021951725001484-mmc1.docx https://s3-eu-west-1.amazonaws.com/prod-ucs-content-store-eu-west/content/pii:S0021951725001484/mmc1/MAIN/application/vnd.openxmlformats-officedocument.wordprocessingml.document/847c764f62767e2066a1a9b2fefbcd46/mmc1.docx mmc1 mmc1.docx docx 3793721 APPLICATION 1-s2.0-S0021951725001484-si1.svg https://s3-eu-west-1.amazonaws.com/prod-ucs-content-store-eu-west/content/pii:S0021951725001484/image/svg+xml/b285d8447b223fc8ab015d5450ac50ac/si1.svg si1 si1.svg svg 30662 ALTIMG 1-s2.0-S0021951725001484-si2.svg https://s3-eu-west-1.amazonaws.com/prod-ucs-content-store-eu-west/content/pii:S0021951725001484/image/svg+xml/cee9234e7141677cd9ffb7fe485a462f/si2.svg si2 si2.svg svg 30307 ALTIMG YJCAT 116083 116083 S0021-9517(25)00148-4 10.1016/j.jcat.2025.116083 Elsevier Inc. Fig. 1 Comparison of the catalytic performance of (a) 0.2Pd/MOx, (b) 0.2Pd/TiO2 with different reduction temperature, (c) Pd/TiO2 with different Pd loadings, and (d) the binary solvent with different EtOH/H2O ratio catalysed by 0.2Pd/TiO2. Reaction conditions: 30 °C, 10 bar H2, 0.5 mmol FAL, 30 min. S/C = 645, 2 mL solvent (96 %EtOH) for a–c. S/C = 300, 2 mL solvent for d. Fig. 2 (a and b) HAADF-STEM images and brightness intensity profiles of Pd for 0.2Pd/TiO2. (c) HRTEM image of 0.2Pd/TiO2. Red circles and blue circles in (a) represent Pd single atoms and Pd clusters, respectively. (d) HAADF-STEM image and corresponding Ti, O, and Pd STEM-EDS maps for 0.2Pd/TiO2. (For interpretation of the references to colour in this figure legend, the reader is referred to the web version of this article.) Fig. 3 In situ DRIFT spectra of CO adsorption on (i) 0.2Pd/TiO2 and (ii) 5Pd/TiO2 after purging Ar for 60 min. (b) Pd 3d core levels, (c) H2-TPR results, and (d) H2-TPD results of (i) 0.2Pd/TiO2 and (ii) 5Pd/TiO2. (e) H2-D2 exchange results and (f) styrene hydrogenation results. Fig. 4 Reaction profiles of conversion (a, d) and selectivity (b, c, e, f) in the hydrogenation of FAL. Reaction conditions: 30 °C, 20 bar H2. 1 mmol FAL, S/C = 1000 and 2 mL EtOH for a,b and c. 0.5 mmol FAL, S/C = 300, 2 mL of 55 % EtOH for d, e, and f. Fig. 5 Reaction orders with respect to H2 (a) and FAL (b) in FAL hydrogenation. (c) Arrhenius plots showing apparent activation barriers for FAL hydrogenation on Pd catalysts. (d) Recycling stability of 0.2Pd/TiO2 in FAL hydrogenation. Conditions: 30 °C, 5–30 bar H2, S/C = 1000 for a; 30 °C, 20 bar H2, ∼20–60 mg mL−1 FAL for b. For the activation barriers test on c: 1 mmol FAL, 2 mL 55 % EtOH, 25–55 °C, S/C = 500 for 5Pd/TiO2, S/C = 1000 for 0.2Pd/TiO2. For the recycle experiment on d: 1 mmol FAL, S/C = 300, 30 °C, 20 bar H2, 60 min, 2 mL 55 % EtOH. Scheme 1 Possible product distribution of metal-catalyzed FAL hydrogenation. Table 1 BET surface area, Pd dispersion and Pd 3d BEs of TiO2 and Pd/TiO2 catalysts. Cat. BET surface area (m2 g−1) a Pd dispersion (%) b Pd size (nm) b Pd 3d5/2 (eV) c Pd0/Pd2+ (%) c Pd0 Pd2+ 0.2Pd/TiO2 32.8 40.6 2.8 – – – 5Pd/TiO2 26.4 4.4 25.6 335.0 337.4 54.0/46.0 a Determined by N2 adsorption. b Determined by CO chemisorption. c Determined by XPS. Table 2 Hydrogenation of bio-derived furans over 0.2Pd/TiO2. Entry Substrate Product T (h) Conv. (%) Sel. (%) Yield (%) a 1 5 >99 64 64 2 5 >99 80 80 3 5 >99 >99 >99 4 6 >99 >99 >99 5 6 >99 >99 >99 6 6 >99 >99 >99 7 6 >99 89 89 8 6 81 95 77 Reaction conditions: 30 °C, 20 bar H2. For entries 1–6: 0.5 mmol of substrate, S/C = 200; For entries 7–8: 0.2 mmol of FAL, S/C = 50. a GC yield. Research article Synergistic effect of single atoms and clusters on boosting activity of TiO2-supported Pd catalysts towards total furfural hydrogenation Jin Gu Investigation a b Hao Zhang Formal analysis a ⁎ 1 Miao Guo Writing – review & editing Writing – original draft Supervision Methodology Funding acquisition Data curation Conceptualization b ⁎ Yanming Hu Writing – review & editing b a College of Food Science and Engineering, National Engineering Research Center of Wheat and Corn Further Processing, Jilin Agricultural University, Changchun 130118, People's Republic of China College of Food Science and Engineering National Engineering Research Center of Wheat and Corn Further Processing Jilin Agricultural University Changchun 130118 People's Republic of China College of Food Science and Engineering, National Engineering Research Center of Wheat and Corn Further Processing, Jilin Agricultural University, Changchun 130118, People's Republic of China b Division of Energy Materials, Dalian Institute of Chemical Physics, Chinese Academy of Sciences, Dalian 116023, People's Republic of China Division of Energy Materials Dalian Institute of Chemical Physics Chinese Academy of Sciences Dalian 116023 People's Republic of China Division of Energy Materials, Dalian Institute of Chemical Physics, Chinese Academy of Sciences, Dalian 116023, People's Republic of China ⁎ Corresponding authors. 1 ORCID 000-0002-8582-8493. Graphical abstract Total furfural (FAL) hydrogenation to the industrially valuable tetrahydrofurfuryl alcohol (THFOL) involves the cascade hydrogenation of the formyl and furanic groups. However, supported metal catalysts are generally confronted with low activity, especially under mild conditions. Herein, we present a highly active Pd catalyst supported on TiO2 with a Pd loading of 0.2 wt% (0.2Pd/TiO2) for the efficient one-pot conversion of FAL to THFOL. Under mild conditions (25 °C, 60 bar H2), 0.2Pd/TiO2 achieves 90 % FAL conversion and 96 % selectivity to THFOL, outperforming the conventional high-Pd-content catalysts (e.g. 5 wt%Pd/TiO2) and most reported catalysts. Detailed characterization and kinetic investigations reveal that the exceptional performance stems from the synergistic interplay between Pd single atoms and nanoclusters on the 0.2Pd/TiO2 catalyst. Furthermore, kinetic studies highlight the crucial role of H2O in promoting the desired reaction pathway. Impressively, 0.2Pd/TiO2 demonstrates excellent stability, the activity and selectivity remain nearly identical even over seven consecutive reaction cycles. Moreover, the catalyst exhibits broad applicability, effectively hydrogenating various furanic compounds to the corresponding saturated products. This study provides key insights into the rational design of highly efficient and selective catalysts for tandem hydrogenation reactions. Keywords Furfural Hydrogenation Pd TiO2 Tetrahydrofurfuryl alcohol Data availability Data will be made available on request. 1 Introduction The growing concerns over limited fossil fuel resources and environmental impacts have intensified the focus on biorefinery, a process that converts biomass into value-added products [1–5]. Among the chemicals derived from biomass, furfural (FAL) produced through dehydration of sugars is particularly significant as a platform chemical in biorefinery [6,7]. Due to its chemically active carbonyl and furan groups, FAL can be transformed into various biofuels and chemical intermediates through the processes such as hydrogenation, decarboxylation, hydrogenolysis, and selective ring opening [8,9]. Among these products, tetrahydrofurfuryl alcohol (THFOL), the fully hydrogenated product of FAL, can serve as a green solvent used in printer inks and has found agricultural applications due to its degradability as well as less toxic and more stable properties, compared to the unsaturated furan compounds [10]. Notably, THFOL can also be converted into valuable straight-chain 1,5-pentanediol through hydrogenolysis [11]. Traditionally, THFOL is produced via a two-step hydrogenation process—FAL to FOL, and then to THFOL—using a cascade catalysis strategy. However, the harsh conditions employed in this process usually result in coke deposition and catalyst deactivation due to the FOL polymerization [12]. Consequently, there is increasing interest in one-pot total FAL hydrogenation to produce THFOL over supported metal nanoparticles (NPs), as this method reduces product separation/purification steps and lowers energy consumption [13,14]. Nevertheless, development of efficient metal catalysts for this transformation remains challenging, especially under mild conditions. The FAL hydrogenation on metal surfaces is particularly intricate (Scheme 1 ); the product selectivity is strongly influenced by the catalyst structure and reaction parameters [15]. For instance, the side reactions like C–O hydrogenolysis to 2-methylfuran, decarbonylation to furan, and rearrangement to levulinic acid can occur simultaneously. To achieve efficient total FAL hydrogenation to THFOL, it requires a catalytic system that can selectively hydrogenate CC or CO bonds while suppressing alternative pathways such as hydrogenolysis. The adsorption configuration of FAL on metal surfaces, particularly on palladium (Pd), is complex, and the multiple binding modes significantly impact the product selectivity [16–18]. Previous studies have demonstrated that the most stable adsorption configuration involves the furan ring and CO group lying parallel to the surface [15,18]. This configuration tends to yield FOL as the initial hydrogenation product due to the relatively easy hydrogenation of the CO group. However, achieving optimal catalytic performance for subsequent FOL hydrogenation on a specific metal surface is challenging due to the scaling relationship in heterogeneous catalysis [19,20], which explains the usually observed low catalytic efficiency of NPs catalysed total FAL hydrogenation in the literatures. Designing catalyst active site structures emerges as key to enhancing the overall efficiency of cascade multi-step reactions like total FAL hydrogenation [21,22]. Dual- or multi-site catalysts, for example, have been employed to balance the trade-off between activity and selectivity. These catalysts utilize different active sites to independently regulate the adsorption and activation of different reactants. For instance, recent studies have shown that combining Pd single-atom catalysts (SACs) with Pd NPs could enhance the capabilities for activation of CO groups and dissociation of H2, thereby leading to highly efficient hydrogenation of ketones and aldehydes to alcohols at room temperature [23]. The spatially separated PdRu dual metal catalyst has shown promise in cascade hydrogenation reactions by using different metals for distinct reaction steps and facilitating molecular transfer through nanochannels [24]. Another effective approach is to increase the number of active sites available for enhancing the catalytic performance. For the oxide-supported metal NPs, the formation of active sites at the metal/metal oxide interface is particularly important, as these sites are often responsible for hydrogenation activity [25–27]. Recently, Margherita Macino and colleagues reported that more peripheral sites at the Pt/TiO2 interface could be created by tailoring the metal loading and preparation parameters and consequently enhance the selectivity in the selective hydrogenation of 3-nitrostyrene [28]. In addition to catalyst structure, FAL hydrogenation is also strongly influenced by the solvent utilized, and altering the solvent can change the distribution of major products [29]. Recent research showed that polar protic solvents could enhance catalytic activity but led to the formation of unwanted by-products like acetyl and ester adducts [30]. Conversely, although the formation of these by-products could be suppressed through the utilization of some non-polar solvents, the reaction rate was significantly reduced [31]. Resasco and coworkers [32] demonstrated that H2O could participate in the rate-determining step (RDS) of FAL hydrogenation by providing an additional channel for hydrogenation of the CO group and potentially influencing the overall reaction mechanism. The promotion effect of H2O in FAL hydrogenation is probably related to the weak interaction between the substrate and solvent (e.g. forming a hydrogen bond with CO group) [33] and the altered H2 dissociation ability on the metal surface [34]. Among the various catalysts explored for total FAL hydrogenation, supported Pd catalysts have attracted the most attention due to their superior intrinsic activity for both the furan ring and aromatic CO group [14,15,18,32]. However, to realize high yields of THFOL typically requires harsh conditions, large amounts of catalyst, or both. In this study, we develop a highly active TiO2-supported Pd catalyst for total FAL hydrogenation. With a low Pd loading of 0.2 wt% (denoted as 0.2Pd/TiO2), this catalyst surpasses the performance of the control catalyst with a higher Pd content (5Pd/TiO2) and most of the catalysts reported in the literature. As revealed by systematic characterizations, the high activity and selectivity of 0.2Pd/TiO2 is attributed to the synergistic effect of Pd SACs and Pd nanoclusters (NCs). Moreover, kinetic studies of FAL hydrogenation on 0.2Pd/TiO2 and 5Pd/TiO2 demonstrated the important role of H2O in the reaction. The 0.2Pd/TiO2 catalyst also exhibits excellent catalytic stability and efficiency for the hydrogenation of other furanic compounds. 2 Experimental section 2.1 Materials All chemicals were used as received without further purification. TiO2 (rutile, 25 nm) and n-tetradecane were obtained from Shanghai Aladdin Bio-Chem Technology Co., Ltd. Na2PdCl4 (36.4 wt% Pd) was purchased from Beijing Innochem Co., Ltd. Furfural (FAL), furfuryl alcohol (FOL), and tetrahydrofurfuryl alcohol (THFOL) were obtained from TCI chemicals, Shanghai. Other organic chemicals, CeO2, SiO2, Fe3O4, MgO, Al2O3, and ZnO were obtained from Sinopharm Chemical Reagent Co., Ltd. 2.2 Synthesis of Pd/TiO2 Pd/TiO2 was prepared by a typical incipient wetness impregnation method. Specifically, 2.0 g of TiO2 was dispersed in 6.0 mL of deionized water, and then the desired amount of Na2PdCl4 (1.0 g/mL) was added. After stirring for 12 h at room temperature, the reaction mixture was evaporated by rotary evaporation to remove the solvent. After drying at 110 °C for 2 h, the powder product was reduced at 200 °C for 2 h in a H2 atmosphere with a heating rate of 2 °C min−1 (H2 flow: 20 mL min−1). The obtained catalyst was designated as xPd/TiO2, where x is the Pd content. Here, x% = 0.1 %, 0.2 %, 0.5 %, 2 %, or 5 %. The procedure for the synthesis of other oxides supported Pd NPs with Pd loading of 0.2 % was similar to 0.2Pd/TiO2 except for the corresponding oxides used. The obtained catalyst was denoted as Pd/MOx, where MOx is CeO2, SiO2, Fe3O4, MgO, Al2O3, or ZnO. 2.3 General procedure for catalytic hydrogenation FAL hydrogenation was performed in a 100 mL stainless steel autoclave equipped with a pressure gauge, magnetic stirrer, and an electric temperature controller. Typically, a desired amount of catalyst (0.2Pd/TiO2, 53 mg) was placed in a 4 mL reaction tube, followed by the addition of FAL (1.0 mmol) and 2.0 mL of solvent. The reaction tube was then loaded into the reactor. After the reactor was purged six times with H2, the final pressure was adjusted to 20 bar, and the temperature was raised to 30 °C with vigorous stirring. After the reaction, the reaction filtrate was collected, diluted with EtOH, and analyzed by an Agilent 8890 GC equipped with an Agilent J&W GC HP–5 capillary column (30 m × 0.32 mm × 0.25 µm). Conversion and selectivity were determined using n-tetradecane as the internal standard, and the carbon balance for all reactions was >85 %. In the binary solvent of EtOH and H2O, the solvent was abbreviated as x%EtOH in the following discussion, where x is the volume fraction of EtOH. The apparent turnover frequency (TOF) was calculated using the initial conversion (∼15 %) in hydrogenation reactions. The apparent TOF (normalized by total metal content) and GC yield of product is defined as follows: ApparentTOF ( h - 1 ) = m m o l o f r e a c t a n t r e a c t e d ( m m o l o f m e t a l ) ( r e a c t i o n t i m e / h ) G C Y i e l d % = m m o l o f p r o d u c t i o b t a i n e d m m o l o f r e a c t a n t r e a c t e d × 100 % To ensure the collection of reliable kinetic data, a control experiment was carried out at different stirring rates, and the results showed that the reaction rate remained constant within the range of 500–1000 rpm. The reactions in this study were conducted at 700 rpm to avoid catalyst splashing. Furthermore, the elimination of mass transfer limitations in our three-phase stirred reactor can also be assessed using widely accepted criteria from a previous report [35], where both the gas–liquid and liquid–solid mass transfer ratios are less than 0.1 (calculations see Supporting Information). For the activation energy measurement, the reaction was performed with 20 bar H2, 1.0 mmol FAL, 2.0 mL 55 %EtOH, with S/C = 500 and 1000 for 5Pd/TiO2 and 0.2Pd/TiO2, respectively. Reaction temperature ranged from 25 to 55 °C. 2.4 Reusability of the Pd/TiO2 To examine the reusability of the Pd/TiO2 catalyst, the liquid was decanted after centrifugation of the reaction mixture. The residual catalyst was thoroughly washed with EtOH, dried at 80 °C for 2 h, and used directly for the next run. 2.5 Characterization Transmission electron microscopy (TEM) images were obtained using a HITACHI HT7700 at an acceleration voltage of 100 kV. High-resolution scanning electron microscopy (HRSEM) was performed using a HITACHI S5500 apparatus operating at an acceleration voltage of 1–30 kV. High-resolution transmission electron microscopy (HRTEM) images, high-angle annular dark-field scanning transmission electron microscopy (HAADF-STEM) images, and energy-dispersive X-ray spectroscopy (EDS) of 0.2Pd/TiO2 were acquired using a JEM-ARM200F. Powder X-ray diffraction (XRD) patterns were measured on an Empyrean power diffraction system with Cu-Kα radiation operated at 40 kV and 200 mA. The 2θ angle was scanned in the range of 10–80°. X-ray photoelectron spectroscopy (XPS) data were collected using the ESCALAB 250Xi equipped with monochromatic Al Kα radiation (hλ = 1486.6 eV). The binding energy scales were calibrated using the C 1s peak at a binding energy of 284.8 eV. Inductively coupled plasma optical emission spectrometry (ICP-OES) analysis was used to quantify Pd leaching during the catalyst synthesis and hydrogenation reactions. The analysis was performed on a Perkin-Elmer 7300 DV equipment. Diffuse reflectance infrared Fourier-transform spectroscopy (DRIFTS) of CO adsorption was performed on an infrared spectrophotometer VERTEX 80 V equipped with a mercury cadmium telluride (MCT) detector. IR spectra were recorded in the range between 600 and 4000 cm−1 with a spectral resolution of 4 cm−1. Prior to measurements, about 30 mg of catalyst was reduced in a H2/Ar flow (10 mL min−1) at 200 °C for 1 h. After that, the system was cooled to 30 °C in an Ar flow (10 mL min−1), followed by purging with Ar flow at the same temperature for 30 min. A spectrum was taken and used as the background for the following adsorption experiments. The Ar flow was then switched to a pure CO flow (10 mL min−1) until saturated adsorption was achieved. CO adsorption experiments were carried out sequentially on a single sample. Gas–phase CO spectra were collected at the same pressure and subtracted from the corresponding sample spectra. H2-D2 exchange experiments were conducted on the AutoChem II-DSMS apparatus. The reactions were carried out in a flow quartz reactor at 30 °C. The formation rate of HD was measured by mass signal intensity (ion current). Before the test, the catalysts (0.02 mg Pd) were heated in H2 (10 % in Ar, 30 mL min−1) at 200 °C for 60 min. After cooling to room temperature, a mixture of D2 (20 mL min−1) and H2 was passed through the sample. Products (HD, H2, and D2) were analyzed with an online mass spectrometer (GAM200, InProcess Instruments). The mass/charge ratio (m/z) values used were 2 for H2, 4 for D2, and 3 for HD. The background HD exchanges from the corresponding support were deducted from the results. H2-TPD and H2-TPR were conducted using an Autochem II 2920 chemisorption instrument. For H2-TPD, ∼100 mg of catalyst sample was placed in a U-type quartz tube and heated to 200 °C for 60 min in H2 (10 % in Ar, 30 mL min−1) to remove adsorbed species from catalyst surface. When the sample was cooled down to −50 °C, the flow was switched to Ar (30 mL min−1) for 60 min. The sample was then heated to 600 °C with a ramp rate of 10 °C min−1 in Ar flow and the TPD profiles were recorded simultaneously. For H2-TPR, the experiment procedure was identical to H2-TPD, except that Ar (30 mL min−1) was used to remove adsorbed species from catalyst surface in the pretreatment procedure and after cooling the temperature to −50 °C, the sample was directly heated to 600 °C at a ramp rate of 10 °C min−1 under H2 flow (10 vol% in Ar, 30 mL min−1). 3 Results and discussion 3.1 Catalyst screening The catalytic performance of supported Pd catalysts on various metal oxides (Pd/MOx) was initially evaluated for FAL hydrogenation. The catalysts were prepared using a typical incipient wetness impregnation method, with hydrogen as the reductant, and the Pd loading was fixed at 0.2 wt% for all Pd/MOx samples. Under the reaction conditions of 30 °C, 10 bar H2, and a substrate-to-catalyst molar ratio (S/C) of 645, the FAL conversions catalyzed by Pd/TiO2, Pd/Fe3O4, and Pd/CeO2, were 85 %, 55 %, and 21 %, respectively (Fig. 1 a). The main products were FOL and THFOL, with by-products including acetals, 2-methylfuran, and trace amounts of ring-opening compounds. Minimal FAL conversion was observed for Pd NPs supported on SiO2, MgO, Al2O3, and ZnO. Notably, just the two catalysts Pd/TiO2 and Pd/CeO2 afforded THFOL, and the former gave a significantly higher yield (74 % vs. 11 %). Among the investigated Pd catalysts, Pd/TiO2 demonstrated the highest activity and THFOL yield, underscoring the unique ability of TiO2 to support Pd for total FAL hydrogenation. The effects of reduction temperature and Pd content of Pd/TiO2 were further investigated, and the results are summarized in Fig. 1b and c. As the reduction temperature increased from 80 to 200 °C, the FAL conversion increased from 68 % to 90 %. Further increasing the reduction temperature resulted in a rapid decrease in FAL conversion. The combined selectivity towards FOL and THFOL followed a similar trend, 0.2Pd/TiO2 reduced at 200 °C yielded the lowest formation of byproduct (3 % acetals). The characteristic volcanic curve observed in FAL hydrogenation as a function of reduction temperature may be related to both the Pd reduction degree and metal-support interaction between Pd and TiO2 [36]. On the other hand, the FAL conversion steadily increased as the Pd loading decreased from 5 % to 0.2 %. Meanwhile, the selectivity towards FOL and THFOL increased while the byproducts decreased. Pd/TiO2 with a Pd content of 0.2 wt% exhibited the highest FAL conversion and combined selectivity towards FOL and THFOL. Further decreasing the Pd content to 0.1 wt% resulted in a slightly lower THFOL yield, though a slightly higher FAL conversion was observed. Considering the high THFOL yield, 0.2Pd/TiO2 was used in the following investigation. Previous studies have demonstrated that the solvent utilized has a significant impact on the activity and selectivity of FAL hydrogenation [14,32]. Consequently, FAL hydrogenation was performed in various solvents, and the results are summarized in Table S1. The highest activity was observed in EtOH (26 %), followed by CH3COOH (14 %), acetone (11 %), EtOAc (10 %), toluene (10 %), and H2O (6 %). The highest activity in EtOH is likely related to the hydrogen-bond-promoted carbonyl activation [33]. Across all the solvents tested, the main side products were acetals and hydrogenolysis products. Notably, the FOL selectivity was significantly higher in H2O compared with other solvents (>99 %), suggesting that H2O plays an important role in the hydrogenation process. Given the excellent activity and selectivity of FAL hydrogenation in EtOH and H2O, the solvent effect were investigated using a binary solvent system of EtOH and H2O. The S/C ratio was adjusted to 300 to better reflect the catalytic performance. As depicted in Fig. 1d, the FAL conversion decreased monotonically with increasing the H2O content, while the combined selectivity towards FOL and THFOL steadily increased from 86 % to 99 % as the H2O content increased to 45 %. These results suggest that the presence of a certain amount of H2O in EtOH can efficiently suppress the side reactions. Further increasing H2O content to 75 % resulted in a slightly decreased selectivity towards FOL and THFOL (91 %). Although the promotion effect of H2O in hydrogenation is complicated, it is likely associated with the enhanced hydrogen dissociation ability on the Pd surface and/or the promotion of FAL activation through the easily formed hydrogen bonding with the polar solvent [14,32,33,37,38]. 0.2Pd/TiO2 exhibited an apparent TOF of 3060 h−1 for total FAL hydrogenation at 30 °C, 20 bar H2, and an S/C = 1000, in a mixture solvent of EtOH/H2O (55 %/45 %). However, complete FAL conversion was not achieved under these conditions. Generally, low temperature, high pressure, and low S/C are beneficial for the hydrogenation of polar unsaturated functional groups. To better compare the catalytic performance with the literature results, the reaction conditions were adjusted to 25 °C, 60 bar H2, and a S/C ratio of 150. Under these conditions, 0.2Pd/TiO2 achieved 90 % FAL conversion and 96 % selectivity to THFOL, with a gas chromatography (GC) yield of 86 %, implying it is the most active and selective solid catalyst reported to date for total FAL hydrogenation (Table S2). 3.2 Characterization of Pd/TiO2 To understand the high activity of 0.2Pd/TiO2 in total hydrogenation of FAL, 0.2Pd/TiO2 was characterized, along with 5Pd/TiO2 as a reference catalyst. As shown in Fig. S1a, 0.2Pd/TiO2 primarily consists of ellipsoidal/spherical particles with an average particle size of approximately 50 nm. The BET surface area of 0.2Pd/TiO2 is 32.8 m2/g, slightly higher than that of 5Pd/TiO2 (26.4 m2/g) (Table 1 ). The adsorption–desorption isotherms of BET results (Fig. S2) reveal only cumulative pores in these catalysts, consistent with the HRSEM observations. These results suggest that the Pd is located on the surface of TiO2, making it easily accessible to the reactants during catalysis. In the HAADF-STEM images of 0.2Pd/TiO2 (Fig. 2 a and b), the isolated bright dots are corresponding to the Pd single atoms (SACs, highlighted with red circles) along with several nanoclusters (NCs, highlighted with blue circles), confirming the presence of both Pd SACs and NCs within 0.2Pd/TiO2. We quantified the occurrences of Pd SACs and NCs by randomly assessing 100 Pd species. The ratio of NCs to SACs is approximately 1:4, indicating that the majority of Pd species on 0.2Pd/TiO2 exists as SACs. The HRTEM/TEM image reveals no obvious Pd NPs existed in 0.2Pd/TiO2 (Figs. 2c and S1b). Determined by energy-dispersive X-ray spectroscopy (EDS, Fig. 2d), 0.2Pd/TiO2 shows the homogeneous distribution of Pd atoms and NCs on the surface of TiO2. Notably, the Pd NCs, consisting of a specific number of Pd atoms, are predominantly arranged in a 2D structure on the TiO2 surface, suggesting that most of the Pd sites on 0.2Pd/TiO2 are fully exposed. Recent works have proved that this exposure is beneficial for catalysis [39,40]. CO chemisorption analysis shows that the Pd dispersion on 0.2Pd/TiO2 is 40.6 %, much higher than that on 5Pd/TiO2 (4.4 %, Table 1), further indicating the high level of exposed Pd on 0.2Pd/TiO2. The wide-angle XRD patterns of 0.2Pd/TiO2 (Fig. S3) only show diffraction peaks attributed to TiO2, confirming the high dispersion of Pd species on the TiO2 surface. In contrast, 5Pd/TiO2 displays distinct diffraction peaks corresponding to Pd, indicating the presence of Pd NPs. Using the Scherrer equation, the size of these Pd crystallites on 5Pd/TiO2 was calculated to be approximately 14.7 nm. These results highlight the clear difference in Pd species between 5Pd/TiO2 and 0.2Pd/TiO2. The surface structure of Pd/TiO2, which may influence the catalytic performance, was investigated using diffuse reflectance infrared Fourier transform spectroscopy (DRIFTS) of CO adsorption. The C–O stretching frequency is particularly sensitive to change on the metal surface when CO is adsorbed. As shown in Fig. 3 a, the main adsorption peaks fall within the ranges of 2200–2000 cm−1 and 2000–1800 cm−1, corresponding to the linearly CO on Pd SACs/larger Pd ensembles and bridged CO adsorption on Pd for the oxide-supported Pd catalysts [41,42]. For 0.2Pd/TiO2, the vibration at 2083 cm−1 is attributed to CO molecules linearly adsorbed on single-atom Pd species (Pd⁰) (see Table S3 for the assignment of CO adsorbed on Pd SACs) [41]. The bands at 1968 and 1864 cm−1 correspond to CO adsorbed on bridge and hollow sites of Pd ensembles [43]. No vibrational peaks associated with CO adsorbed on Pdδ+ species (above 2100 cm−1) were observed, likely due to their easy removal by Ar flow. These results suggest the coexistence of Pd SACs and agglomerated Pd species on 0.2Pd/TiO2, which aligns with the HRTEM findings. In contrast, for 5Pd/TiO2, a relatively lower intensity vibration signal at 2090 cm−1, corresponding to CO adsorbed on Pd SACs or larger Pd ensembles, and higher intensity signals at 1986, 1925, and 1884 cm−1, attributed to bridge-bonded CO on Pd surfaces, indicate that agglomerated Pd is the predominant species on 5Pd/TiO2. Rough calculations suggest that the ratio of CO linearly on Pd0 to bridged adsorbed sites for 0.2Pd/TiO2 and 5Pd/TiO2 is 0.4 and 0.06, respectively, indicating fewer Pd-Pd structures on 0.2Pd/TiO2, consistent with the HRTEM results. Compared to 5Pd/TiO2, the signal corresponding to CO adsorbed on Pd SACs appears more quickly as a function of purging time (Fig. S4), further supporting that SACs are the dominant species on 0.2Pd/TiO2. The surface electronic structures of Pd/TiO2 catalysts were further investigated using X-ray photoelectron spectroscopy (XPS). For 5Pd/TiO2, the peaks at 335.0 and 337.4 eV corresponding to Pd0 and Pd2+ states, respectively, were observed (Fig. 3b, Table 1). After deconvolution, the Pd0/Pd2+ ratio of 54.0/46.0 is typical for NPs, suggesting that 5Pd/TiO2 primarily consists of Pd NPs (Table 1). In contrast, for 0.2Pd/TiO2, a broad peak centered at 336.0 eV is detected. This binding energy (BE) lies between that of Pd0 and Pd2+, implying the presence of both Pd SACs and NCs. Generally, the presence of Ti3+-Ov states in TiO2 can anchor the metallic Pd cations, improving Pd dispersion and resulting in electron transfer between Pd and TiO2 [44]. The existence of Ti3+-Ov states was also confirmed by EPR spectroscopy, where a signal at g = 1.973, attributed to these states, was detected (Fig. S5) [45]. Notably, the 0.2Pd/TiO2 sample exhibited a significantly higher Ti3+ signal intensity, indicating that doping 0.2 wt% Pd into the TiO2 generates more surface defects. Additionally, deconvolution of the Ti 2p3/2 and O 1s shows that the Ti3+/chemisorbed oxygen species (OII) content follows the order: 0.2Pd/TiO2 > 5Pd/TiO2 > TiO2 (Fig. S6, Table S4), further suggesting 0.2Pd/TiO2 has more surface defects. These results are consistent with the EPR results. The relatively lower defect density on the surface of 5Pd/TiO2 may be due to its more agglomerated Pd NPs [46]. 0.2Pd/TiO2 and 5Pd/TiO2 contain different Pd species and the distinct coordination environments between the diverse Pd species and Ti3+-Ov states in the two catalysts lead to the different Pd electronic states observed in the XPS results. The effect of reduction temperature on the reducibility of the catalysts was investigated using H2-TPR measurements, and the results are shown in Fig. 3c. For 5Pd/TiO2, four positive peaks at 0.3, 320, 415, and 510 °C, and one negative peak at 80 °C were observed. The peak at 0.3 °C is attributed to the reduction of PdO and the formation of the PdH phase, while the negative peak at 80 °C is due to the decomposition of PdH [47]. The peaks at 320, 415, and 510 °C correspond to the surface reduction of TiO2. This above TPR results is typical for supported Pd NPs on TiO2 with high metal loading [46,47]. In contrast, for 0.2Pd/TiO2, only the PdO reduction peak at −3.8 °C and the TiO2 surface reduction peaks at 320 and 510 °C were observed. The slight shift to a lower temperature for the PdO reduction peak in 0.2Pd/TiO2 is consistent with the previous report [47]. The absence of a PdH decomposition peak for 0.2Pd/TiO2 may be due to the low content of Pd-Pd structures. According to the recent report, the 2D or 3D Pd structure can be determined based on the hydrogen stoichiometry of β-PdH in TPR results [47]. The estimated amount of bulk Pd capable of forming β-PdH (3D Pd) on 0.2Pd/TiO2 and 5Pd/TiO2 are respectively ∼0 and 86 % (see Table S5 for calculations). The absence of a 3D structure for 0.2Pd/TiO2 is consistent with the HRTEM, CO DRIFTS and XPS results. Since H2 adsorption/dissociation abilities play a crucial role in hydrogenation reactions, H2-TPD measurements were conducted to analyze the hydrogen species formed on 0.2Pd/TiO2 and 5Pd/TiO2, and to understand their interactions with the catalysts (Fig. 3d). For 5Pd/TiO2, three groups of desorption peaks corresponding to the desorption of H2 on metallic Pd at −12.9, −0.8, and 78 °C, are observed. The peaks at −12.9 °C and −0.8 °C are attributed to hydrogen residing in subsurface Pd sites [48,49], while the 78 °C peak corresponds to PdH decomposition on the Pd surface. Desorption peaks above 200 °C are attributed to hydrogen species on TiO2, likely derived from hydrogen spillover [50]. These results are typical H2-TPD results for Pd NPs, further demonstrating 5Pd/TiO2 primarily consists of Pd NPs. In contrast, for 0.2Pd/TiO2, no desorption peaks corresponding to the desorption from the Pd surface are detected, and only the hydrogen species related to hydrogen spillover are observed. These findings align with the recently reported Pd1/TiO2 catalyst [51]. In comparison with 0.2Pd/TiO2, the ability of 5Pd/TiO2 to recombine the atomic hydrogen and hydrogen desorption below 0 °C suggest that the Pd sites on 5Pd/TiO2 have significantly higher hydrogen activation ability than those on 0.2Pd/TiO2. This may be attributed to the much lower content of Pd-Pd ensembles in 0.2Pd/TiO2 [52]. H2–D2 exchange reaction was performed to further assess the activation of molecular hydrogen on Pd/TiO2 catalysts. Under identical conditions and normalized by total Pd content, 0.2Pd/TiO2 and 5Pd/TiO2 afforded H2 conversions of 71.9 % and 38.8 %, respectively (Fig. 3e and Fig. S7), suggesting 0.2Pd/TiO2 has a higher overall H2 activation ability than 5Pd/TiO2. A simple alkene hydrogenation reaction can also be used as a probe to evaluate H2 activation [20,53]. Thus, styrene hydrogenation to ethylbenzene was conducted, and in this reaction, the conversion of ∼15 % was maintained by adjusting the reaction time to calculate the TOF (Fig. 3f). 0.2Pd/TiO2 exhibited higher activity than 5Pd/TiO2, as revealed by the apparent TOFs normalized by total Pd content (22.2 vs. 13.2 × 103 h−1), which is consistent with the H2-D2 exchange result. The superior overall H2 activation ability of 0.2Pd/TiO2 is primarily attributed to the highly dispersed Pd in 0.2Pd/TiO2, which results from the abundance of SACs and fully exposed NCs, though SACs have lower H2 activation ability compared to NPs [23,54,55]. 3.3 Kinetic studies Fig. 4 a–c present the kinetic curves for the total FAL hydrogenation on 0.2Pd/TiO2 and 5Pd/TiO2 using EtOH as the solvent. Due to the high activity of Pd/TiO2-catalyzed FAL hydrogenation in EtOH, the S/C ratio was fixed at 1000 to facilitate better sampling and analysis of the reaction. As shown in Fig. 4a, the FAL conversion on 0.2Pd/TiO2 steadily increased with reaction time, reaching approximately 80 % at 30 min, and then practically leveled off until the reaction ended at 90 min. This phenomenon is likely due to the strong adsorption of the substrate or its intermediates on the active sites during the reaction process. Similar results were also observed in the cases of FAL hydrogenation on Pd and Ni NPs [14,56]. For 5Pd/TiO2, the reaction proceeded much slower than 0.2 Pd/TiO2, and after 90 min, the FAL conversion was 54 % under identical conditions. Regarding the selectivity of FAL hydrogenation on 0.2Pd/TiO2 in EtOH, the main product was FOL in the initial stages (Fig. 4b). As the reaction progressed, the content of FOL decreased while the THFOL content increased, along with a slight increase in the by-products. These observations suggest that the predominant reaction pathway on Pd/TiO2 involves sequential hydrogenation of the furanic CO and furan ring of FAL, consistent with the literature reports [14]. At 90 min, the THFOL yield was 61 % for 0.2Pd/TiO2, and the by-products mainly included 2-methylfuran/2-methyltetrahydrofuran and the ring-opening compounds. For 5Pd/TiO2, the selectivity towards FOL was 92 % within the first 3 min, after which its content decreased and the by products increased over time (Fig. 4c). Unlike 0.2Pd/TiO2, the main by-products were acetals. At the end of the reaction, no THFOL product and almost only acetals were obtained for 5Pd/TiO2. This may be due to the lower hydrogenation activity of 5Pd/TiO2. The above results suggested that the FAL hydrogenation on 0.2Pd/TiO2 predominantly occurs, whereas for the case of 5Pd/TiO2, acid catalysis is more prevalent. The different product selectivity is thus likely attributed to the presence of different active sites on the two catalysts as demonstrated above. The kinetic curves of Pd/TiO2 catalysts were also investigated in 55 %EtOH (Fig. 4d–f). In comparison with the EtOH system, the catalytic activity of 0.2Pd/TiO2 decreased significantly when 45 %H2O was added. Thus, the S/C ratio was adjusted from 1000 to 300 to better reflect the catalytic results in the binary solvent system. In the mixed solvent, for 0.2Pd/TiO2, the FAL conversion reached ∼80 % at 15 min and almost remained constant when further prolonging the reaction time (Fig. 4d), similar with the results observed in EtOH. Compared to 0.2Pd/TiO2, 5Pd/TiO2 displayed a slightly lower initial FAL conversion but a much higher final FAL conversion of 95 %. The corresponding product distribution of FAL hydrogenation in 55 %EtOH are shown in Fig. 4e and f. For the case of 0.2Pd/TiO2, FAL was first converted to FOL and acetals at initial 3 min, and the acetals quickly disappeared as the reaction proceeded (Fig. 4e). This result indicates that there are two parallel reaction pathways on 0.2Pd/TiO2 at the beginning of the reaction, that is, the hydrogenation of FAL to FOL and subsequently to THFOL being the main reaction path. The rapid decrease of acetal content may be due to the reversible nature of acid-catalysed condensation reaction. Consequently, THFOL selectivity reached ∼100 % at 60 min, much higher than that in EtOH. A similar product distribution and reaction trend was observed for 5Pd/TiO2, although the magnitude of product distribution changes was smaller (Fig. 4f). Interestingly, H2O totally altered the reaction route from acid catalysis in EtOH to hydrogenation in 55 %EtOH on 5Pd/TiO2, suggesting the promotion effect of H2O in FAL hydrogenation. It is thus concluded that the main reaction route both on the two catalysts are FAL hydrogenation. The inability of FOL to further transform into THFOL on 5Pd/TiO2 may be due to its low Pd dispersion and thus, resulting in a low availability of active sites for the subsequent hydrogenation. According to the Sabatier principle [57,58], the electronic structure of metal surface is directly associated with the adsorption strength of reactants/intermediates, which significantly affects the catalytic performance. Reaction kinetics is a powerful probe to characterize the surface electronic structure of metal NPs, as it is very sensitive to the structure of active sites [53,59]. First, the system in this investigation was verified to be free of mass transfer resistance to ensure the obtained kinetic data within the kinetic region (Experimental Section and SI) [20,35]. Given that hydrogenation is the main reaction route in 55 %EtOH, the reaction orders of 0.2Pd/TiO2 and 5Pd/TiO2 with respect to H2 and FAL were investigated in the mixed solvent (Fig. 5 a and b). The positive reaction orders with respect to H2 on 0.2Pd/TiO2 and 5Pd/TiO2 were 0.91 and 1.13, respectively. In heterogeneous catalysis, the reaction order reflects how the surface concentration of adsorbed reactant species affects the reaction rate. The near-first-order dependence on H2 for FAL hydrogenation over Pd/TiO2 suggests that the adsorbed hydrogen species are far from the Sabatier optimum (Fig. S8) [59], indicating low surface coverage of hydrogen species on the Pd surface. Based on the dual-site Langmuir–Hinshelwood mechanism, the near-first-order in H2 at low H2 pressure suggests the second hydrogenation of CO is the RDS (Eq. S15). Previous kinetic studies [32] and DFT calculations [60] have shown that sequential hydrogenation of the O atom, followed by the C atom in the carbonyl group, has a much lower free energy barrier than the reverse sequence. The almost first-order reaction with respect to H2 for both on 0.2Pd/TiO2 and 5Pd/TiO2 indicate that, for both catalysts, the RDS is the hydrogenation of C atom in the CO group of FAL [32]. These results show that FAL hydrogenation on both 0.2Pd/TiO2 and 5Pd/TiO2 follows the same reaction pathway with a similar RDS. The reaction order towards FAL on 0.2Pd/TiO2 is −0.55 (Fig. 5b). The negative value means that FAL acts as a “poison” for Pd NPs, due to the strong adsorption of the substrate or its hydrogenation intermediates on the Pd active sites. This strong adsorption of FAL also renders the desorption of the reactants difficult (Fig. S8). This result is consistent with the time/conversion curve shown in Fig. 4d, in which a plateau is observed after the FAL conversion exceeded 80 %. The reaction order towards FAL on 5Pd/TiO2 is −1.33, whereas the value for 0.2Pd/TiO2 is closer to 0, indicating relatively weaker adsorption of FAL on 0.2Pd/TiO2. Given the distinct active sites on the two catalysts, as demonstrated above, these findings may suggest that the active sites for FAL/FOL activation on 0.2Pd/TiO2 differ from those on 5Pd/TiO2. It is possible that activation occurs primarily on the SACs [54,61–63]. Previous studies have shown that Pd SACs are more effective at activating the CO group, while Pd NPs are better at activating H2 [23]. Therefore, the unique ability of SACs on 0.2Pd/TiO2 to activate FAL/FOL, combined with the high H2 activation capacity of Pd NCs in H2 [55] and the spillover effect promoted by protic solvents (e.g., water, alcohols) [64,65] contribute to the significantly higher yield of THFOL. Based on the above results, the high catalytic performance of 0.2Pd/TiO2 in total FAL hydrogenation can be attributed primarily to the synergistic effect of Pd SACs and Pd NCs, which could activate FAL/FOL and H2, respectively. Additionally, the promotion of hydrogenation by H2O—either through hydrogen bond-enhanced substrate activation or improved H2 activation [32,33] —leads to higher hydrogenation selectivity, even through H2O may block some active sites. The apparent activation energies calculated for FAL hydrogenation to FOL on 0.2Pd/TiO2 and 5Pd/TiO2 are 52.9 and 50.4 kJ/mol (Fig. 5c), respectively. These nearly identical values suggest that both the catalysts possess “similar active sites” for FAL hydrogenation in the presence of H2O [66], despite potential differences in their active site interfaces, as evidenced by the above characterizations. 3.4 Recycle stability and substrate scope The recyclability of 0.2Pd/TiO2 was tested using FAL hydrogenation as a model reaction. After the first reaction cycle, the liquid was decanted after centrifugation of the reaction mixture. The obtained catalyst was thoroughly washed with EtOH and then used directly for the next run. Notably, 0.2Pd/TiO2 retained its catalytic performance over seven consecutive recycling runs without significant loss of activity or selectivity (Fig. 5d), demonstrating its exceptional stability. Furthermore, under low FAL conversion conditions, the catalyst maintained stability through five additional cycles (Fig. S9a), further corroborating its robustness. It is noted that 0.2Pd/TiO2 could be recycled 7 times without any obvious loss of activity and selectivity (Fig. 5d), implying the excellent stability of 0.2Pd/TiO2. Similar recycle stability results were obtained for the 5Pd/TiO2 (Fig. S9b). These results also suggest that the deactivation phenomenon for FAL hydrogenation of Pd/TiO2 catalysts, as shown in Fig. 4a and d, is temporary, which results from the relatively strong adsorption of the reactants or intermediates on the active sites. Given the excellent catalytic performance of 0.2Pd/TiO2 for the total hydrogenation of FAL to THFOL, we further expanded the substrate scope to other biobased furanic compounds. As shown in Table 2 , 0.2Pd/TiO2 could effectively catalyze the hydrogenation of various furan-based compounds. The hydrogenation of 5-hydroxymethylfural (HMF), one of the most important C6 platform chemicals from cellulosic biomass, yielded the industrially relevant chemical 2,5-dihydroxymethyltetrahydrofuran in 64 % yield (Table 2, Entry 1). Under identical conditions, 2,5-furandimethanol was fully hydrogenated to 2,5-bis(hydroxymethyl) tetrahydrofuran in 80 % yield (Table 2, Entry 2). For benzofuran, methyl 2-furoate, 5-methoxybenzofuran, and methyl 6-benzofurancarboxylate, the corresponding furan ring saturated products were also obtained in high yields of 99 % (Table 2, Entries 3–6). For 2-methylfuran and dimethyl furan-2,5-dicarboxylate, the S/C ratio was adjusted from 200 to 50 to increase the furan-ring hydrogenated products. After 6 h, the respective furan ring-hydrogenated products were obtained in 89 % and 77 % yields. These results demonstrate that 0.2Pd/TiO2 is a highly efficient catalyst for the total hydrogenation of bio-based furan derivatives across a broad substrate scope. 4 Conclusion In summary, we have developed a highly active TiO2-supported Pd catalyst possessing SACs and NCs on the support for the total hydrogenation of FAL to THFOL. Under mild conditions, 0.2Pd/TiO2 with a relatively low Pd content (0.2 wt%) could achieve 90 % FAL conversion and 96 % selectivity to THFOL, outperforming both conventional high-Pd-content catalysts (5 wt%) and most of the reported catalysts. Detailed characterization and kinetic studies suggest that the superior catalytic performance of 0.2Pd/TiO2 is due to the synergistic effect of Pd SACs and NCs, which could activate FAL/FOL and H2, respectively, as well as the promoting effect of H2O in the total hydrogenation process. Moreover, 0.2Pd/TiO2 could recycle 7 times without any obvious activity and selectivity decreases in FAL hydrogenation and could also effectively catalyse the hydrogenation of various other bio-based furanic derivatives. This work provides valuable insights for the rational design of cascade catalysts to enhance tandem hydrogenation efficiency. Author contributions The manuscript was written through the contributions of all authors. All authors have given approval for the final version of the manuscript. CRediT authorship contribution statement Jin Gu: Investigation. Hao Zhang: Formal analysis. Miao Guo: Writing – review & editing, Writing – original draft, Supervision, Methodology, Funding acquisition, Data curation, Conceptualization. Yanming Hu: Writing – review & editing. Declaration of competing interest The authors declare that they have no known competing financial interests or personal relationships that could have appeared to influence the work reported in this paper. Acknowledgments We acknowledge financial support from the National Natural Science Foundation of China (22202200) and Liaoning Revitalization Talents Program (XLYC2008022). We also thank Ms Peifang Yan from the Dalian Institute of Chemical Physics, CAS, for the TPD and TPR experiments. Appendix A Supplementary data Supplementary data to this article can be found online at https://doi.org/10.1016/j.jcat.2025.116083. Appendix A Supplementary data The following are the Supplementary data to this article: Supplementary Data 1 References [1] A. Corma S. Iborra A. Velty Chemical routes for the transformation of biomass into chemicals Chem. Rev. 107 6 2007 2411 2502 10.1021/cr050989d Corma, A.; Iborra, S.; Velty, A. Chemical Routes for the Transformation of Biomass into Chemicals. Chem. Rev. 2007, 107 (6), 2411–2502. Doi: 10.1021/cr050989d. [2] J.N. Chheda G.W. Huber J.A. Dumesic Liquid-phase catalytic processing of biomass-derived oxygenated hydrocarbons to fuels and chemicals Angew. Chem. Int. Ed. 46 38 2007 7164 7183 10.1002/anie.200604274 Chheda, J. N.; Huber, G. W.; Dumesic, J. A. Liquid-Phase Catalytic Processing of Biomass-Derived Oxygenated Hydrocarbons to Fuels and Chemicals. Angew. Chem. Int. Ed. 2007, 46 (38), 7164–7183. Doi: 10.1002/anie.200604274. [3] S. Fernando S. Adhikari C. Chandrapal N. Murali Biorefineries: current status, challenges, and future direction Energy Fuels 20 4 2006 1727 1737 10.1021/ef060097w Fernando, S.; Adhikari, S.; Chandrapal, C.; Murali, N. Biorefineries: Current Status, Challenges, and Future Direction. Energy Fuels 2006, 20 (4), 1727–1737. Doi: 10.1021/ef060097w. [4] M. Besson P. Gallezot C. Pinel Conversion of biomass into chemicals over metal catalysts Chem. Rev. 114 3 2014 1827 1870 10.1021/cr4002269 Besson, M.; Gallezot, P.; Pinel, C. Conversion of Biomass into Chemicals over Metal Catalysts. Chem. Rev. 2014, 114 (3), 1827–1870. Doi: 10.1021/cr4002269. [5] A.J. Ragauskas C.K. Williams B.H. Davison G. Britovsek J. Cairney C.A. Eckert W.J. Frederick J.P. Hallett D.J. Leak C.L. Liotta J.R. Mielenz R. Murphy R. Templer T. Tschaplinski The path forward for biofuels and biomaterials Science 311 5760 2006 484 489 10.1126/science:1114736 Ragauskas, A. J.; Williams, C. K.; Davison, B. H.; Britovsek, G.; Cairney, J.; Eckert, C. A.; Frederick, W. J.; Hallett, J. P.; Leak, D.J.; Liotta, C. L.; Mielenz, J. R.; Murphy, R.; Templer, R.; Tschaplinski, T. The Path Forward for Biofuels and Biomaterials. Science 2006, 311 (5760), 484–489. Doi: 10.1126/science.1114736. [6] K. Yan G. Wu T. Lafleur C. Jarvis Production, properties and catalytic hydrogenation of furfural to fuel additives and value-added chemicals Renew. Sust. Energ. Rev. 38 2014 663 676 10.1016/j.rser.2014.07.003 Yan, K.; Wu, G.; Lafleur, T.; Jarvis, C. Production, Properties and Catalytic Hydrogenation of Furfural to Fuel Additives and Value-Added Chemicals. Renew. Sust. Energ. Rev. 2014, 38, 663–676. Doi: 10.1016/j.rser.2014.07.003. [7] S. Dutta S. De B. Saha M.I. Alam Advances in conversion of hemicellulosic biomass to furfural and upgrading to biofuels Catal. Sci. Technol. 2 10 2012 2025 2036 10.1039/C2CY20235B Dutta, S.; De, S.; Saha, B.; Alam, M. I. Advances in Conversion of Hemicellulosic Biomass to Furfural and Upgrading to Biofuels. Catal. Sci. Technol. 2012, 2 (10), 2025–2036. https://doi.org/ 10.1039/C2CY20235B. [8] X.D. Li P. Jia T.F. Wang Furfural: a promising platform compound for sustainable production of C4 and C5 chemicals ACS Catal. 6 11 2016 7621 7640 10.1021/acscatal.6b01838 Li, X. D.; Jia, P.; Wang, T. F. Furfural: A Promising Platform Compound for Sustainable Production of C4 and C5 Chemicals. ACS Catal. 2016, 6 (11), 7621–7640. Doi: 10.1021/acscatal.6b01838. [9] R. Mariscal P. Maireles-Torres M. Ojeda I. Sádaba M.L. Granados Furfural: a renewable and versatile platform molecule for the synthesis of chemicals and fuels Energ. Environ. Sci. 9 4 2016 1144 1189 10.1039/c5ee02666k Mariscal, R.; Maireles-Torres, P.; Ojeda, M.; Sádaba, I.; Granados, M. L. Furfural: A Renewable and Versatile Platform Molecule for the Synthesis of Chemicals and Fuels. Energ. Environ. Sci. 2016, 9 (4), 1144–1189. Doi: 10.1039/c5ee02666k. [10] X. Chen W. Sun N. Xiao Y. Yan S. Liu Experimental study for liquid phase selective hydrogenation of furfuryl alcohol to tetrahydrofurfuryl alcohol on supported Ni catalysts Chem. Eng. J. 126 1 2007 5 11 10.1016/j.cej.2006.08.019 Chen, X.; Sun, W.; Xiao, N.; Yan, Y.; Liu, S. Experimental Study for Liquid Phase Selective Hydrogenation of Furfuryl Alcohol to Tetrahydrofurfuryl Alcohol on Supported Ni Catalysts. Chem. Eng. J. 2007, 126 (1), 5−11. Doi: 10.1016/j.cej.2006.08.019. [11] S. Koso I. Furikado A. Shimao T. Miyazawa K. Kunimori K. Tomishige Chemoselective hydrogenolysis of tetrahydrofurfuryl alcohol to 1,5-pentanediol Chem. Commun. 15 2009 2035 2037 10.1039/b822942b Koso, S.; Furikado, I.; Shimao, A.; Miyazawa, T.; Kunimori, K.; Tomishige, K. Chemoselective Hydrogenolysis of Tetrahydrofurfuryl Alcohol to 1,5-pentanediol. Chem. Commun. 2009, (15), 2035–2037. Doi: 10.1039/b822942b. [12] R.J. Huang Q.Q. Cui Q.Q. Yuan H.H. Wu Y.J. Guan P. Wu Total hydrogenation of furfural over Pd/Al2O3 and Ru/ZrO2 mixture under mild conditions: essential role of tetrahydrofurfural as an intermediate and support effect ACS Sustain. Chem. Eng. 6 5 2018 6957 6964 10.1021/acssuschemeng.8b00801 Huang, R. J.; Cui, Q. Q.; Yuan, Q. Q.; Wu, H. H.; Guan, Y. J.; Wu, P. Total Hydrogenation of Furfural over Pd/Al2O3 and Ru/ZrO2 Mixture under Mild Conditions: Essential Role of Tetrahydrofurfural as An Intermediate and Support Effect. ACS Sustain. Chem. Eng. 2018, 6 (5), 6957–6964. https://doi.org/ 10.1021/acssuschemeng.8b00801. [13] Y. Nakagawa K. Takada M. Tamura K. Tomishige Total hydrogenation of furfural and 5-hydroxymethylfurfural over supported Pd-Ir alloy catalyst ACS Catal. 4 8 2014 2718 2726 10.1021/cs500620b Nakagawa, Y.; Takada, K.; Tamura, M.; Tomishige, K. Total Hydrogenation of Furfural and 5-Hydroxymethylfurfural over Supported Pd-Ir Alloy Catalyst. ACS Catal. 2014, 4 (8), 2718–2726. Doi: 10.1021/cs500620b. [14] Y. Zhang H. Li Z. Shi M. Guo Y. Hu G. Zhou Total hydrogenation of furfural on Pd/COFs under mild conditions Mol. Catal. 559 2024 114101 10.1016/j.mcat.2024.114101 Zhang, Y.; Li, H.; Shi, Z.; Guo, M.; Hu, Y.; Zhou, G. Total Hydrogenation of Furfural on Pd/COFs under Mild Conditions. Mol. Catal. 2024, 559, 114101. Doi: 10.1016/j.mcat.2024.114101. [15] S.M. Rogers C.R.A. Catlow C.E. Chan-Thaw A. Chutia N. Jian R.E. Palmer M. Perdjon A. Thetford N. Dimitratos A. Villa P.P. Wells Tandem site- and size-controlled Pd nanoparticles for the directed hydrogenation of furfural ACS Catal. 7 4 2017 2266 2274 10.1021/acscatal.6b03190 Rogers, S. M.; Catlow, C. R. A.; Chan-Thaw, C. E.; Chutia, A.; Jian, N.; Palmer, R. E.; Perdjon, M.; Thetford, A.; Dimitratos, N.; Villa, A.; Wells P. P. Tandem Site- and Size-Controlled Pd Nanoparticles for the Directed Hydrogenation of Furfural. ACS Catal. 2017, 7 (4), 2266–2274. Doi: 10.1021/acscatal.6b03190. [16] S.H. Pang C.A. Schoenbaum D.K. Schwartz J.W. Medlin Directing reaction pathways by catalyst active-site selection using self-assembled monolayers Nat. Commun. 4 1 2013 2448 10.1038/ncomms3448 Pang, S. H.; Schoenbaum, C. A.; Schwartz, D. K.; Medlin, J. W. Directing Reaction Pathways by Catalyst Active-Site Selection Using Self-Assembled Monolayers. Nat. Commun. 2013, 4 (1), 2448. Doi: 10.1038/ncomms3448. [17] J. Zhang L.D. Ellis B. Wang M.J. Dzara C. Sievers S. Pylypenko E. Nikolla J.W. Medlin Control of interfacial acid–metal catalysis with organic monolayers Nat. Catal. 1 2 2018 148 155 10.1038/s41929-017-0019-8 Zhang, J.; Ellis, L. D.; Wang, B.; Dzara, M. J.; Sievers, C.; Pylypenko, S.; Nikolla, E.; Medlin, J. W. Control of Interfacial Acid–Metal Catalysis with Organic Monolayers. Nat. Catal. 2018, 1 (2), 148–155. Doi: 10.1038/s41929-017-0019-8. [18] V. Vorotnikov G. Mpourmpakis D.G. Vlachos DFT study of furfural conversion to furan, furfuryl alcohol, and 2-methylfuran on Pd(111) ACS Catal. 2 12 2012 2496 2504 10.1021/cs300395a Vorotnikov, V.; Mpourmpakis, G.; Vlachos, D. G. DFT Study of Furfural Conversion to Furan, Furfuryl Alcohol, and 2-Methylfuran on Pd(111). ACS Catal. 2012, 2 (12), 2496–2504. Doi: 10.1021/cs300395a. [19] J. Pérez-Ramírez N. López Strategies to break linear scaling relationships Nat. Catal. 2 11 2019 971 976 10.1038/s41929-019-0376-6 Pérez-Ramírez, J.; López, N. Strategies to Break Linear Scaling Relationships. Nat. Catal. 2019, 2 (11), 971−976. Doi: 10.1038/s41929-019-0376-6. [20] M. Guo H. Dai Q. Yang Promotion effect of Pd in the Ru/C-catalyzed hydrogenation of benzofurans ACS Catal. 14 4 2024 2719 2729 10.1021/acscatal.3c05429 Guo, M.; Dai, H.; Yang, Q. Promotion Effect of Pd in the Ru/C-Catalyzed Hydrogenation of Benzofurans. ACS Catal. 2024, 14 (4), 2719–2729. Doi: 10.1021/acscatal.3c05429. [21] X. Ren H. Dai X. Liu Q. Yang Development of efficient catalysts for selective hydrogenation through multi-site division Chin. J. Catal. 62 2024 108 123 10.1016/S1872-2067(24)60049-5 Ren, X.; Dai, H.; Liu, X.; Yang, Q. Development of Efficient Catalysts for Selective Hydrogenation through Multi-Site Division. Chin. J. Catal. 2024, 62, 108–123. Doi: 10.1016/S1872-2067(24)60049-5. [22] L. Liu A. Corma Identification of the active sites in supported subnanometric metal catalysts Nat. Catal. 4 6 2021 453 456 10.1038/s41929-021-00632-y Liu, L.; A. Corma. Identification of the Active Sites in Supported Subnanometric Metal Catalysts. Nat. Catal. 2021, 4 (6), 453–456. Doi: 10.1038/s41929-021-00632-y. [23] L. Kuai Z. Chen S. Liu E. Kan N. Yu Y. Ren C. Fang X. Li Y. Li B. Geng Titania supported synergistic palladium single atoms and nanoparticles for room temperature ketone and aldehydes hydrogenation Nat. Commun. 11 1 2020 48 10.1038/s41467-019-13941-5 Kuai, L.; Chen, Z.; Liu, S.; Kan, E.; Yu, N.; Ren, Y.; Fang, C.; Li, X.; Li, Y.; Geng, B. Titania Supported Synergistic Palladium Single Atoms and Nanoparticles for Room Temperature Ketone and Aldehydes Hydrogenation. Nat. Commun. 2020, 11 (1), 48. Doi: 10.1038/s41467-019-13941-5. [24] H. Zou J. Dai J. Suo R. Ettelaie Y. Li N. Xue R. Wang H. Yang Dual metal nanoparticles within multicompartmentalized mesoporous organosilicas for efficient sequential hydrogenation Nat. Commun. 12 1 2021 4968 10.1038/s41467-021-25226-x Zou, H.; Dai, J.; Suo, J.; Ettelaie, R.; Li, Y.; Xue, N.; Wang, R.; Yang, H. Dual Metal Nanoparticles within Multicompartmentalized Mesoporous Organosilicas for Efficient Sequential Hydrogenation. Nat. Commun. 2021, 12 (1), 4968. Doi: 10.1038/s41467-021-25226-x. [25] T.W. van Deelen C. Hernández Mejía K.P. de Jong Control of metal-support interactions in heterogeneous catalysts to enhance activity and selectivity Nat. Catal. 2 11 2019 955 970 10.1038/s41929-019-0364-x van Deelen, T. W.; Hernández Mejía, C.; de Jong, K. P. Control of Metal-Support Interactions in Heterogeneous Catalysts to Enhance Activity and Selectivity. Nat. Catal. 2019, 2 (11), 955–970. Doi: 10.1038/s41929-019-0364-x. [26] I. Ro J. Resasco P. Christopher Approaches for understanding and controlling interfacial effects in oxide-supported metal catalysts ACS Catal. 8 8 2018 7368 7387 10.1021/acscatal.8b02071 Ro, I.; Resasco, J.; Christopher, P. Approaches for Understanding and Controlling Interfacial Effects in Oxide-Supported Metal Catalysts. ACS Catal. 2018, 8 (8), 7368–7387. Doi: 10.1021/acscatal.8b02071. [27] C. Xu G. Chen Y. Zhao P. Liu X. Duan L. Gu G. Fu Y. Yuan N. Zheng Interfacing with silica boosts the catalysis of copper Nat. Commun. 9 1 2018 3367 10.1038/s41467-018-05757-6 Xu, C.; Chen, G.; Zhao, Y.; Liu, P.; Duan, X.; Gu, L.; Fu, G.; Yuan, Y.; Zheng, N. Interfacing with Silica Boosts the Catalysis of Copper. Nat. Commun. 2018, 9 (1), 3367. Doi: 10.1038/s41467-018-05757-6. [28] M. Macino A.J. Barnes S.M. Althahban R. Qu E.K. Gibson D.J. Morgan S.J. Freakley N. Dimitratos C.J. Kiely X. Gao A.M. Beale D. Bethell Q. He M. Sankar G.J. Hutchings Tuning of catalytic sites in Pt/TiO2 catalysts for the chemoselective hydrogenation of 3-nitrostyrene Nat. Catal. 2 10 2019 873 881 10.1038/s41929-019-0334-3 Macino, M.; Barnes, A. J.; Althahban, S. M.; Qu, R.; Gibson, E. K.; Morgan, D. J.; Freakley, S. J.; Dimitratos, N.; Kiely, C. J.; Gao, X.; Beale, A. M.; Bethell, D.; He, Q.; Sankar, M.; Hutchings, G. J. Tuning of Catalytic Sites in Pt/TiO2 Catalysts for the Chemoselective Hydrogenation of 3-Nitrostyrene. Nat. Catal. 2019, 2 (10), 873–881. Doi: 10.1038/s41929-019-0334-3. [29] O.F. Aldosari S. Iqbal P.J. Miedziak G.L. Brett D.R. Jones X. Liu J.K. Edwards D.J. Morgan D.K. Knight G.J. Hutchings Pd-Ru/TiO2 catalyst–an active and selective catalyst for furfural hydrogenation Catal. Sci. Technol. 6 1 2016 234 242 10.1039/c5cy01650a Aldosari, O. F.; Iqbal, S.; Miedziak, P. J.; Brett, G. L.; Jones, D. R.; Liu, X.; Edwards, J. K.; Morgan, D. J.; Knight, D. K.; Hutchings, G. J. Pd-Ru/TiO2 Catalyst–an Active and Selective Catalyst for Furfural Hydrogenation. Catal. Sci. Technol. 2016, 6 (1), 234–242. Doi: 10.1039/c5cy01650a. [30] Q. Fang H. Du X. Liu Y. Ding Effect of the reorganization of acid sites induced by metal species on TiO2 supports on the conversion of furfural to acetals and ethers Catal. Today 442 2024 114936 10.1016/j.cattod.2024.114936 Fang, Q.; Du, H.; Liu, X.; Ding, Y. Effect of the Reorganization of Acid Sites Induced by Metal Species on TiO2 Supports on the Conversion of Furfural to Acetals and Ethers. Catal. Today 2024, 442, 114936. Doi: 10.1016/j.cattod.2024.114936. [31] R. Albilali M. Douthwaite Q. He S.H. Taylor The selective hydrogenation of furfural over supported palladium nanoparticle catalysts prepared by sol-immobilisation: effect of catalyst support and reaction conditions Catal. Sci. Technol. 8 1 2018 252 267 10.1039/c7cy02110k Albilali, R.; Douthwaite, M.; He, Q.; Taylor, S. H. The Selective Hydrogenation of Furfural over Supported Palladium Nanoparticle Catalysts Prepared by Sol-immobilisation: Effect of Catalyst Support and Reaction Conditions. Catal. Sci. Technol. 2018, 8 (1), 252–267. Doi: 10.1039/c7cy02110k. [32] Z. Zhao R. Bababrik W.H. Xue Y.P. Li N.M. Briggs D.T. Nguyen U. Nguyen S.P. Crossley S.W. Wang B. Wang D.E. Resasco Solvent-mediated charge separation drives alternative hydrogenation path of furanics in liquid water Nat. Catal. 2 5 2019 431 436 10.1038/s41929-019-0257-z Zhao, Z.; Bababrik, R.; Xue, W. H.; Li, Y. P.; Briggs, N. M.; Nguyen, D. T.; Nguyen, U.; Crossley, S. P.; Wang, S. W.; Wang, B.; Resasco, D. E. Solvent-mediated Charge Separation Drives Alternative Hydrogenation Path of Furanics in Liquid Water. Nat. Catal. 2019, 2 (5), 431–436. Doi: 10.1038/s41929-019-0257-z. [33] S. Shi P.P. Yang C. Dun W.Q. Zheng J.J. Urban D.G. Vlachos Selective hydrogenation via precise hydrogen bond interactions on catalytic scaffolds Nat. Commun. 14 1 2023 429 10.1038/s41467-023-36015-z Shi, S.; Yang, P. P.; Dun, C.; Zheng, W. Q.; Urban, J. J.; Vlachos, D. G. Selective Hydrogenation via Precise Hydrogen Bond Interactions on Catalytic Scaffolds. Nat. Commun. 2023, 14 (1), 429. Doi: 10.1038/s41467-023-36015-z. [34] X. Li X.M. Ren M. Guo W.J. Li Q.H. Yang Water accelerated activity of Ru NPs in sequential hydrogenation of nitrobenzene to cyclohexylamine J. Catal. 413 2022 546 553 10.1016/j.jcat.2022.07.010 Li, X.; Ren, X. M.; Guo, M.; Li, W. J.; Yang, Q. H. Water Accelerated Activity of Ru NPs in Sequential Hydrogenation of Nitrobenzene to Cyclohexylamine. J. Catal. 2022, 413, 546–553. Doi: 10.1016/j.jcat.2022.07.010. [35] M. Guo X. Kong C. Li Q.H. Yang Hydrogenation of benzoic acid derivatives over Pt/TiO2 under mild conditions Commun. Chem. 4 1 2021 54 10.1038/s42004-021-00489-z Guo, M.; Kong, X.; Li, C.; Yang, Q. H. Hydrogenation of Benzoic Acid Derivatives over Pt/TiO2 under Mild Conditions. Commun. Chem. 2021, 4 (1), 54. Doi: 10.1038/s42004-021-00489-z. [36] W.T. Figueiredo R. Prakash C.G. Vieira D.S. Lima V.E. Carvalho E.A. Soares S. Buchner H. Raschke O.W. Perez-Lapez D.L. Baptista R. Hergenroder M. Segala F. Bernardi New insights on the electronic factor of the SMSI effect in Pd/TiO2 nanoparticles Appl. Surf. Sci. 574 2022 151647 10.1016/j.apsusc.2021.151647 Figueiredo, W. T.; Prakash, R.; Vieira, C. G.; Lima, D. S.; Carvalho, V. E.; Soares, E. A.; Buchner, S.; Raschke, H.; Perez-Lapez, O. W.; Baptista, D. L.; Hergenroder, R.; Segala, M.; Bernardi, F. New Insights on the Electronic Factor of the SMSI Effect in Pd/TiO2 Nanoparticles. Appl. Surf. Sci. 2022, 574, 151647. Doi: 10.1016/j.apsusc.2021.151647. [37] G.H. Cheng A. Jentys O.Y. Gutiérrez Y. Liu Y.H. Chin J.A. Lercher Critical role of solvent-modulated hydrogen-binding strength in the catalytic hydrogenation of benzaldehyde on palladium Nat. Catal. 4 11 2021 976 985 10.1038/s41929-021-00701-2 Cheng, G. H.; Jentys, A.; Gutiérrez, O. Y.; Liu, Y.; Chin, Y. H.; Lercher, J. A. Critical Role of Solvent-modulated Hydrogen-binding Strength in the Catalytic Hydrogenation of Benzaldehyde on Palladium. Nat. Catal. 2021, 4 (11), 976–985. Doi: 10.1038/s41929-021-00701-2. [38] I.K.M. Yu F. Deng X. Chen G. Cheng Y. Liu W. Zhang J.A. Lercher Impact of hydronium ions on the Pd-catalyzed furfural hydrogenation Nat. Commun. 13 1 2022 7154 10.1038/s41467-022-34608-8 Yu, I. K. M.; Deng, F.; Chen, X.; Cheng, G.; Liu, Y.; Zhang, W.; Lercher, J. A. Impact of Hydronium Ions on the Pd-catalyzed Furfural Hydrogenation. Nat. Commun. 2022, 13 (1), 7154. Doi: 10.1038/s41467-022-34608-8. [39] X. Chen M. Peng D. Xiao H. Liu D. Ma Fully exposed metal clusters: fabrication and application in alkane dehydrogenation ACS Catal. 12 20 2022 12720 12743 10.1021/acscatal.2c04008 Chen, X.; Peng, M.; Xiao, D.; Liu, H.; Ma, D. Fully Exposed Metal Clusters: Fabrication and Application in Alkane Dehydrogenation. ACS Catal. 2022, 12 (20), 12720–12743. Doi: 10.1021/acscatal.2c04008. [40] M. Peng C. Dong R. Gao D. Xiao H. Liu D. Ma Fully exposed cluster catalyst (FECC): toward rich surface sites and full atom utilization efficiency ACS Cent. Sci. 7 2 2020 262 273 10.1021/acscentsci.0c01486 Peng, M.; Dong, C.; Gao, R.; Xiao, D.; Liu, H.; Ma, D. Fully Exposed Cluster Catalyst (FECC): Toward Rich Surface Sites and Full Atom Utilization Efficiency. ACS Cent. Sci. 2020, 7 (2), 262–273. Doi: 10.1021/acscentsci.0c01486. [41] C. Dong Z. Gao Y. Li M. Peng M. Wang Y. Xu C. Li M. Xu Y. Deng X. Qin F. Huang X. Wei Y.G. Wang Y. Liu D. Ma Fully exposed palladium cluster catalysts enable hydrogen production from nitrogen heterocycles Nat. Catal. 5 6 2022 485 493 10.1038/s41929-022-00769-4 Dong, C.; Gao, Z.; Li, Y.; Peng, M.; Wang, M.; Xu, Y.; Li, C.; Xu, M.; Deng, Y.; Qin, X.; Huang, F.; Wei, X.; Wang, Y. G.; Liu, Y.; Ma, D. Fully Exposed Palladium Cluster Catalysts Enable Hydrogen Production from Nitrogen Heterocycles. Nat. Catal. 2022, 5 (6), 485−493. Doi: 10.1038/s41929-022-00769-4. [42] D. Gashnikova F. Maurer M.R. Bauer S. Bernart J. Jelic M. Lützen C.B. Maliakkal P. Dolcet F. Studt C. Kübel C.D. Damsgaard M. Casapu J.D. Grunwaldt Lifecycle of Pd clusters: following the formation and evolution of active Pd clusters on ceria during CO oxidation by in situ/operando characterization techniques ACS Catal. 14 19 2024 14871 14886 10.1021/acscatal.4c02077 Gashnikova, D.; Maurer, F.; Bauer, M. R.; Bernart, S.; Jelic, J.; Lützen, M.; Maliakkal, C. B; Dolcet, P.; Studt, F.; Kübel, C.; Damsgaard, C. D.; Casapu, M.; Grunwaldt, J. D. Lifecycle of Pd Clusters: Following the Formation and Evolution of Active Pd Clusters on Ceria During CO Oxidation by In Situ/Operando Characterization Techniques. ACS Catal. 2024, 14 (19), 14871-14886. Doi: 10.1021/acscatal.4c02077. [43] M. Guo H. Li Y.Q. Ren X.M. Ren Q.H. Yang C. Li Improving catalytic hydrogenation performance of Pd nanoparticles by electronic modulation using phosphine ligands ACS Catal. 8 7 2018 6476 6485 10.1021/acscatal.8b00872 Guo, M.; Li, H.; Ren, Y. Q.; Ren, X. M.; Yang, Q. H.; Li, C. Improving Catalytic Hydrogenation Performance of Pd Nanoparticles by Electronic Modulation Using Phosphine Ligands. ACS Catal. 2018, 8 (7), 6476–6485. Doi: 10.1021/acscatal.8b00872. [44] S. Wang B. Ge Z. Yang H. Zhang Q. Yang C. Hu X. Bao P. Yuan Construction of highly active Pd–Ti3+ sites in defective Pd/TiO2 catalysts for efficient hydrogenation of styrene–butadiene–styrene ACS Catal. 14 3 2024 1432 1442 10.1021/acscatal.3c04811 Wang, S.; Ge, B.; Yang, Z.; Zhang, H.; Yang, Q.; Hu, C.; Bao, X.; Yuan, P. Construction of Highly Active Pd–Ti3+ Sites in Defective Pd/TiO2 Catalysts for Efficient Hydrogenation of Styrene–Butadiene–Styrene. ACS Catal. 2024, 14 (3), 1432–1442. Doi: 10.1021/acscatal.3c04811. [45] C. Wang Y. Li C. Zhang X. Chen C. Liu W. Weng W. Shan H. He A simple strategy to improve Pd dispersion and enhance Pd/TiO2 catalytic activity for formaldehyde oxidation: the roles of surface defects Appl. Catal. B-Environ. 282 2021 119540 Wang, C., Li, Y.; Zhang, C.; Chen, X.; Liu, C.; Weng, W.; Shan, W.; He, H. A Simple Strategy to Improve Pd Dispersion and Enhance Pd/TiO2 Catalytic Activity for Formaldehyde Oxidation: The Roles of Surface Defects. App. Catal. B-Environ. 2021, 282, 119540. [46] Y. Li C. Zhang J. Ma M. Chen H. Deng H. He High temperature reduction dramatically promotes Pd/TiO2 catalyst for ambient formaldehyde oxidation App. Catal. B-Environ. 217 2017 560 569 Li, Y.; Zhang, C.; Ma, J.; Chen, M.; Deng, H.; He, H. High Temperature Reduction Dramatically Promotes Pd/TiO2 Catalyst for Ambient Formaldehyde Oxidation. App. Catal. B-Environ. 2017, 217, 560-569. [47] M. Yarar A. Bouziani D. Uner Pd as a reduction promoter for TiO2: oxygen and hydrogen transport at 2D and 3D Pd interfaces with TiO2 monitored by TPR, operando 1H NMR and CO oxidation studies Catal. Commun. 174 2023 106580 Yarar, M.; Bouziani, A.; Uner, D. Pd as a Reduction Promoter for TiO2: Oxygen and Hydrogen Transport at 2D and 3D Pd Interfaces with TiO2 Monitored by TPR, Operando 1H NMR and CO Oxidation Studies. Catal. Commun. 2023, 174, 106580. [48] S. Shaikhutdinov M. Heemeier M. Bäumer T. Lear D. Lennon R.J. Oldman S.D. Jackson H.J. Freund Structure–reactivity relationships on supported metal model catalysts: adsorption and reaction of ethene and hydrogen on Pd/Al2O3/NiAl (110) J. Catal. 200 2 2001 330 339 Shaikhutdinov, S.; Heemeier, M.; Bäumer, M.; Lear, T.; Lennon, D.; Oldman, R. J.; Jackson, S. D.; Freund, H. J. Structure–Reactivity Relationships on Supported Metal Model Catalysts: Adsorption and Reaction of Ethene and Hydrogen on Pd/Al2O3/NiAl (110). J. Catal. 2001, 200 (2), 330-339. [49] S.D. Jackson A.M. Doyle S.K. Shikhutdinov Hydrogenation on metal surfaces: why are nanoparticles more active than single crystals Angew. Chem. Int. Ed. 42 2003 5240 5243 Jackson, S. D.; Doyle, A. M.; Shikhutdinov, S. K. Hydrogenation on Metal Surfaces: Why are Nanoparticles More Active than Single Crystals. Angew. Chem. Int. Ed. 2003, 42, 5240-5243. [50] S.A. Singh K. Vishwanath G. Madras Role of hydrogen and oxygen activation over Pt and Pd-doped composites for catalytic hydrogen combustion ACS Appl. Mater. Interfaces 9 23 2017 19380 19388 10.1021/acsami.6b08019 Singh, S. A.; Vishwanath, K.; Madras, G. Role of Hydrogen and Oxygen Activation over Pt and Pd-Doped Composites for Catalytic Hydrogen Combustion. ACS Appl. Mater. Interfaces 2017, 9 (23), 19380–19388. Doi: 10.1021/acsami.6b08019. [51] J. Xie Angew. Chem. Int. Ed. 2024 e202415203 Xie, J., et al. Angew. Chem. Int. Ed. 2024, e202415203 [52] W. Gao S. Liu G. Sun C. Zhang Y. Pan Single-atom catalysts for hydrogen activation Small 19 26 2023 2300956 10.1002/smll.202300956 Gao, W.; Liu, S.; Sun, G.; Zhang, C.; Pan, Y. Single-Atom Catalysts for Hydrogen Activation. Small 2023, 19 (26), 2300956. Doi: 10.1002/smll.202300956. [53] J. Resasco F. Yang T. Mou B. Wang P. Christopher D.E. Resasco Relationship between atomic scale structure and reactivity of Pt catalysts: hydrodeoxygenation of m-cresol over isolated Pt cations and clusters ACS Catal. 10 1 2020 595 603 10.1021/acscatal.9b04330 Resasco, J.; Yang, F.; Mou, T.; Wang, B.; Christopher, P.; Resasco, D. E. Relationship between Atomic Scale Structure and Reactivity of Pt Catalysts: Hydrodeoxygenation of m-Cresol over Isolated Pt Cations and Clusters. ACS Catal. 2020, 10 (1), 595–603. Doi: 10.1021/acscatal.9b04330. [54] Q. Shen H. Jin P. Li X. Yu L. Zheng W. Song C. Cao Breaking the activity limitation of iridium single-atom catalyst in hydrogenation of quinoline with synergistic nanoparticles catalysis Nano Res. 15 6 2022 5024 5031 10.1007/s12274-022-4235-4 Shen, Q.; Jin, H.; Li, P.; Yu, X.; Zheng, L.; Song, W.; Cao, C. Breaking the Activity Limitation of Iridium Single-Atom Catalyst in Hydrogenation of Quinoline with Synergistic Nanoparticles Catalysis. Nano Res. 2022, 15 (6), 5024–5031. Doi: 10.1007/s12274-022-4235-4. [55] D.R. Aireddy K. Ding Heterolytic dissociation of H2 in heterogeneous catalysis ACS Catal. 12 8 2022 4707 4723 10.1021/acscatal.2c00584 Aireddy, D. R.; Ding, K. Heterolytic Dissociation of H2 in Heterogeneous Catalysis. ACS Catal. 2022, 12 (8), 4707–4723. Doi: 10.1021/acscatal.2c00584. [56] Y. Nakagawa H. Nakazawa H. Watanabe K. Tomishige Total hydrogenation of furfural over a silica-supported nickel catalyst prepared by the reduction of a nickel nitrate precursor ChemCatChem 4 11 2012 179 1797 10.1002/cctc.201200218 Nakagawa, Y.; Nakazawa, H.; Watanabe, H.; Tomishige, K. Total Hydrogenation of Furfural over a Silica-Supported Nickel Catalyst Prepared by the Reduction of a Nickel Nitrate Precursor. ChemCatChem 2012, 4 (11), 179–1797. Doi: 10.1002/cctc.201200218. [57] A.J. Medford A. Vojvodic J.S. Hummelshoj J. Voss F. Abild-Pedersen F. Studt T. Bligaard A. Nilsson J.K. Norskov From the sabatier principle to a predictive theory of transition-metal heterogeneous catalysis J. Catal. 328 2015 36 42 10.1016/j.jcat.2014.12.033 Medford, A. J.; Vojvodic, A.; Hummelshoj, J. S.; Voss, J.; Abild-Pedersen, F.; Studt, F.; Bligaard, T.; Nilsson, A.; Norskov, J. K. From the Sabatier Principle to A Predictive Theory of Transition-Metal Heterogeneous Catalysis. J. Catal. 2015, 328, 36–42. Doi: 10.1016/j.jcat.2014.12.033. [58] A. Ruban B. Hammer P. Stoltze H.L. Skriver J.K. Norskov Surface electronic structure and reactivity of transition and noble metals J. Mol. Catal. A Chem. 115 3 1997 421 429 10.1016/S1381-1169(96)00348-2 Ruban, A.; Hammer, B.; Stoltze, P.; Skriver, H. L.; Norskov, J. K. Surface Electronic Structure and Reactivity of Transition and Noble Metals. J. Mol. Catal. A Chem. 1997, 115 (3), 421–429. Doi: 10.1016/S1381-1169(96)00348-2. [59] R.A. van Santen Molecular catalytic kinetics concepts Novel Concepts in Catalysis and Chemical Reactors 2010 1 30 10.1002/9783527630882.ch1 van Santen, R. A. Molecular Catalytic Kinetics Concepts. Novel Concepts in Catalysis and Chemical Reactors, 2010; 1–30. DOI: Doi: 10.1002/9783527630882.ch1. [60] M. Guo S. Jayakumar M. Luo X. Kong C. Li H. Li J. Chen Q. Yang The promotion effect of π-π interactions in Pd NPs catalysed selective hydrogenation Nat. Commun. 13 1 2022 1770 10.1038/s41467-022-29299-0 Guo, M.; Jayakumar, S.; Luo, M.; Kong, X.; Li, C.; Li, H.; Chen, J.; Yang, Q. The promotion effect of π-π interactions in Pd NPs catalysed selective hydrogenation. Nat. Commun., 2022, 13 (1), 1770. Doi: 10.1038/s41467-022-29299-0. [61] S. Wang Y. Lv J. Ren Z. Xu Q. Yang H. Zhao D. Gao G. Chen Ultrahigh selective hydrogenation of furfural enabled by modularizing hydrogen dissociation and substrate activation ACS Catal. 13 13 2023 8720 8730 10.1021/acscatal.3c01506 Wang, S.; Lv, Y.; Ren, J.; Xu, Z.; Yang, Q.; Zhao, H.; Gao, D.; Chen, G. Ultrahigh Selective Hydrogenation of Furfural Enabled by Modularizing Hydrogen Dissociation and Substrate Activation. ACS Catal. 2023, 13 (13), 8720–8730. Doi: 10.1021/acscatal.3c01506. [62] F. Mo Q. Zhou W. Xue W. Liu S. Xu Z. Hou J. Wang Q. Wang The optimized catalytic performance of single–atom catalysts by incorporating atomic clusters or nanoparticles: in–depth understanding on their synergisms Adv. Energy Mater. 13 38 2023 2301711 10.1002/aenm.202301711 Mo, F.; Zhou, Q.; Xue, W.; Liu, W.; Xu, S.; Hou, Z.; Wang, J.; Wang, Q. The Optimized Catalytic Performance of Single–Atom Catalysts by Incorporating Atomic Clusters or Nanoparticles: In–Depth Understanding on Their Synergisms. Adv. Energy Mater. 2023, 13 (38), 2301711. Doi: 10.1002/aenm.202301711. [63] P. Serp Synergy between supported metal single atoms and nanoparticles and their relevance in catalysis ChemCatChem 15 15 2023 e202300545 10.1002/cctc.202300545 Serp, P. Synergy Between Supported Metal Single Atoms and Nanoparticles and their Relevance in Catalysis. ChemCatChem 2023, 15 (15), e202300545. Doi: 10.1002/cctc.202300545. [64] R. Prins Hydrogen spillover: facts and fiction Chem. Rev. 112 5 2012 2714 2738 10.1021/cr200346z Prins, R. Hydrogen spillover: Facts and fiction. Chem. Rev. 2012, 112 (5), 2714-2738. Doi: 10.1021/cr200346z [65] M. Li W. Yin J. Pan Y. Zhu N. Sun X. Zhang Y. Wan Z. Luo L. Yi L. Wang Hydrogen spillover as a promising strategy for boosting heterogeneous catalysis and hydrogen storage Chem. Eng. J. 471 2023 144691 10.1016/j.cej.2023.144691 Li, M.; Yin, W.; Pan, J.; Zhu, Y.; Sun, N.; Zhang, X.; Wan, Y.; Luo, Z.; Yi, L.; Wang, L. Hydrogen Spillover as a Promising Strategy for Boosting Heterogeneous Catalysis and Hydrogen Storage. Chem. Eng. J. 2023, 471, 144691. Doi: 10.1016/j.cej.2023.144691. [66] X. Xie Y. Li Z.Q. Liu M. Haruta W. Shen Low-temperature oxidation of CO catalysed by Co3O4 nanorods Nature 458 7239 2009 746 749 10.1038/nature07877 Xie, X.; Li, Y.; Liu, Z. Q.; Haruta, M.; Shen, W. Low-Temperature Oxidation of CO Catalysed by Co3O4 Nanorods. Nature 2009, 458 (7239), 746–749. Doi: 10.1038/nature07877.",
      "scopus-id": "105000741885",
      "coredata": {
        "eid": "1-s2.0-S0021951725001484",
        "dc:description": "Total furfural (FAL) hydrogenation to the industrially valuable tetrahydrofurfuryl alcohol (THFOL) involves the cascade hydrogenation of the formyl and furanic groups. However, supported metal catalysts are generally confronted with low activity, especially under mild conditions. Herein, we present a highly active Pd catalyst supported on TiO2 with a Pd loading of 0.2 wt% (0.2Pd/TiO2) for the efficient one-pot conversion of FAL to THFOL. Under mild conditions (25 °C, 60 bar H2), 0.2Pd/TiO2 achieves 90 % FAL conversion and 96 % selectivity to THFOL, outperforming the conventional high-Pd-content catalysts (e.g. 5 wt%Pd/TiO2) and most reported catalysts. Detailed characterization and kinetic investigations reveal that the exceptional performance stems from the synergistic interplay between Pd single atoms and nanoclusters on the 0.2Pd/TiO2 catalyst. Furthermore, kinetic studies highlight the crucial role of H2O in promoting the desired reaction pathway. Impressively, 0.2Pd/TiO2 demonstrates excellent stability, the activity and selectivity remain nearly identical even over seven consecutive reaction cycles. Moreover, the catalyst exhibits broad applicability, effectively hydrogenating various furanic compounds to the corresponding saturated products. This study provides key insights into the rational design of highly efficient and selective catalysts for tandem hydrogenation reactions.",
        "openArchiveArticle": "false",
        "prism:coverDate": "2025-06-30",
        "openaccessUserLicense": null,
        "prism:aggregationType": "Journal",
        "prism:url": "https://api.elsevier.com/content/article/pii/S0021951725001484",
        "dc:creator": [
          {
            "@_fa": "true",
            "$": "Gu, Jin"
          },
          {
            "@_fa": "true",
            "$": "Zhang, Hao"
          },
          {
            "@_fa": "true",
            "$": "Guo, Miao"
          },
          {
            "@_fa": "true",
            "$": "Hu, Yanming"
          }
        ],
        "link": [
          {
            "@_fa": "true",
            "@rel": "self",
            "@href": "https://api.elsevier.com/content/article/pii/S0021951725001484"
          },
          {
            "@_fa": "true",
            "@rel": "scidir",
            "@href": "https://www.sciencedirect.com/science/article/pii/S0021951725001484"
          }
        ],
        "dc:format": "application/json",
        "openaccessType": null,
        "pii": "S0021-9517(25)00148-4",
        "prism:volume": "446",
        "articleNumber": "116083",
        "prism:publisher": "Elsevier Inc. All rights are reserved, including those for text and data mining, AI training, and similar technologies.",
        "dc:title": "Synergistic effect of single atoms and clusters on boosting activity of TiO2-supported Pd catalysts towards total furfural hydrogenation",
        "prism:copyright": "© 2025 Elsevier Inc. All rights are reserved, including those for text and data mining, AI training, and similar technologies.",
        "openaccess": "0",
        "prism:issn": "00219517",
        "dcterms:subject": [
          {
            "@_fa": "true",
            "$": "Furfural"
          },
          {
            "@_fa": "true",
            "$": "Hydrogenation"
          },
          {
            "@_fa": "true",
            "$": "Pd"
          },
          {
            "@_fa": "true",
            "$": "TiO2"
          },
          {
            "@_fa": "true",
            "$": "Tetrahydrofurfuryl alcohol"
          }
        ],
        "openaccessArticle": "false",
        "prism:publicationName": "Journal of Catalysis",
        "openaccessSponsorType": null,
        "prism:pageRange": "116083",
        "pubType": "fla",
        "prism:coverDisplayDate": "June 2025",
        "prism:doi": "10.1016/j.jcat.2025.116083",
        "prism:startingPage": "116083",
        "dc:identifier": "doi:10.1016/j.jcat.2025.116083",
        "openaccessSponsorName": null
      },
      "objects": {
        "object": [
          {
            "@category": "standard",
            "@height": "617",
            "@width": "622",
            "@_fa": "true",
            "$": "https://api.elsevier.com/content/object/eid/1-s2.0-S0021951725001484-gr2.jpg?httpAccept=%2A%2F%2A",
            "@multimediatype": "JPEG image file",
            "@type": "IMAGE-DOWNSAMPLED",
            "@size": "151883",
            "@ref": "gr2",
            "@mimetype": "image/jpeg"
          },
          {
            "@category": "standard",
            "@height": "35",
            "@width": "69",
            "@_fa": "true",
            "$": "https://api.elsevier.com/content/object/eid/1-s2.0-S0021951725001484-fx9.jpg?httpAccept=%2A%2F%2A",
            "@multimediatype": "JPEG image file",
            "@type": "IMAGE-DOWNSAMPLED",
            "@size": "1431",
            "@ref": "fx9",
            "@mimetype": "image/jpeg"
          },
          {
            "@category": "standard",
            "@height": "593",
            "@width": "622",
            "@_fa": "true",
            "$": "https://api.elsevier.com/content/object/eid/1-s2.0-S0021951725001484-gr1.jpg?httpAccept=%2A%2F%2A",
            "@multimediatype": "JPEG image file",
            "@type": "IMAGE-DOWNSAMPLED",
            "@size": "73681",
            "@ref": "gr1",
            "@mimetype": "image/jpeg"
          },
          {
            "@category": "standard",
            "@height": "35",
            "@width": "59",
            "@_fa": "true",
            "$": "https://api.elsevier.com/content/object/eid/1-s2.0-S0021951725001484-fx8.jpg?httpAccept=%2A%2F%2A",
            "@multimediatype": "JPEG image file",
            "@type": "IMAGE-DOWNSAMPLED",
            "@size": "1262",
            "@ref": "fx8",
            "@mimetype": "image/jpeg"
          },
          {
            "@category": "standard",
            "@height": "35",
            "@width": "59",
            "@_fa": "true",
            "$": "https://api.elsevier.com/content/object/eid/1-s2.0-S0021951725001484-fx7.jpg?httpAccept=%2A%2F%2A",
            "@multimediatype": "JPEG image file",
            "@type": "IMAGE-DOWNSAMPLED",
            "@size": "1268",
            "@ref": "fx7",
            "@mimetype": "image/jpeg"
          },
          {
            "@category": "standard",
            "@height": "30",
            "@width": "48",
            "@_fa": "true",
            "$": "https://api.elsevier.com/content/object/eid/1-s2.0-S0021951725001484-fx6.jpg?httpAccept=%2A%2F%2A",
            "@multimediatype": "JPEG image file",
            "@type": "IMAGE-DOWNSAMPLED",
            "@size": "1158",
            "@ref": "fx6",
            "@mimetype": "image/jpeg"
          },
          {
            "@category": "standard",
            "@height": "541",
            "@width": "600",
            "@_fa": "true",
            "$": "https://api.elsevier.com/content/object/eid/1-s2.0-S0021951725001484-gr5.jpg?httpAccept=%2A%2F%2A",
            "@multimediatype": "JPEG image file",
            "@type": "IMAGE-DOWNSAMPLED",
            "@size": "60542",
            "@ref": "gr5",
            "@mimetype": "image/jpeg"
          },
          {
            "@category": "standard",
            "@height": "34",
            "@width": "69",
            "@_fa": "true",
            "$": "https://api.elsevier.com/content/object/eid/1-s2.0-S0021951725001484-fx10.jpg?httpAccept=%2A%2F%2A",
            "@multimediatype": "JPEG image file",
            "@type": "IMAGE-DOWNSAMPLED",
            "@size": "1440",
            "@ref": "fx10",
            "@mimetype": "image/jpeg"
          },
          {
            "@category": "standard",
            "@height": "455",
            "@width": "711",
            "@_fa": "true",
            "$": "https://api.elsevier.com/content/object/eid/1-s2.0-S0021951725001484-gr4.jpg?httpAccept=%2A%2F%2A",
            "@multimediatype": "JPEG image file",
            "@type": "IMAGE-DOWNSAMPLED",
            "@size": "62371",
            "@ref": "gr4",
            "@mimetype": "image/jpeg"
          },
          {
            "@category": "standard",
            "@height": "47",
            "@width": "74",
            "@_fa": "true",
            "$": "https://api.elsevier.com/content/object/eid/1-s2.0-S0021951725001484-fx11.jpg?httpAccept=%2A%2F%2A",
            "@multimediatype": "JPEG image file",
            "@type": "IMAGE-DOWNSAMPLED",
            "@size": "1615",
            "@ref": "fx11",
            "@mimetype": "image/jpeg"
          },
          {
            "@category": "standard",
            "@height": "429",
            "@width": "711",
            "@_fa": "true",
            "$": "https://api.elsevier.com/content/object/eid/1-s2.0-S0021951725001484-gr3.jpg?httpAccept=%2A%2F%2A",
            "@multimediatype": "JPEG image file",
            "@type": "IMAGE-DOWNSAMPLED",
            "@size": "62726",
            "@ref": "gr3",
            "@mimetype": "image/jpeg"
          },
          {
            "@category": "standard",
            "@height": "46",
            "@width": "72",
            "@_fa": "true",
            "$": "https://api.elsevier.com/content/object/eid/1-s2.0-S0021951725001484-fx12.jpg?httpAccept=%2A%2F%2A",
            "@multimediatype": "JPEG image file",
            "@type": "IMAGE-DOWNSAMPLED",
            "@size": "1586",
            "@ref": "fx12",
            "@mimetype": "image/jpeg"
          },
          {
            "@category": "standard",
            "@height": "32",
            "@width": "45",
            "@_fa": "true",
            "$": "https://api.elsevier.com/content/object/eid/1-s2.0-S0021951725001484-fx13.jpg?httpAccept=%2A%2F%2A",
            "@multimediatype": "JPEG image file",
            "@type": "IMAGE-DOWNSAMPLED",
            "@size": "844",
            "@ref": "fx13",
            "@mimetype": "image/jpeg"
          },
          {
            "@category": "standard",
            "@height": "31",
            "@width": "44",
            "@_fa": "true",
            "$": "https://api.elsevier.com/content/object/eid/1-s2.0-S0021951725001484-fx14.jpg?httpAccept=%2A%2F%2A",
            "@multimediatype": "JPEG image file",
            "@type": "IMAGE-DOWNSAMPLED",
            "@size": "800",
            "@ref": "fx14",
            "@mimetype": "image/jpeg"
          },
          {
            "@category": "standard",
            "@height": "41",
            "@width": "110",
            "@_fa": "true",
            "$": "https://api.elsevier.com/content/object/eid/1-s2.0-S0021951725001484-fx15.jpg?httpAccept=%2A%2F%2A",
            "@multimediatype": "JPEG image file",
            "@type": "IMAGE-DOWNSAMPLED",
            "@size": "1894",
            "@ref": "fx15",
            "@mimetype": "image/jpeg"
          },
          {
            "@category": "standard",
            "@height": "41",
            "@width": "110",
            "@_fa": "true",
            "$": "https://api.elsevier.com/content/object/eid/1-s2.0-S0021951725001484-fx16.jpg?httpAccept=%2A%2F%2A",
            "@multimediatype": "JPEG image file",
            "@type": "IMAGE-DOWNSAMPLED",
            "@size": "1875",
            "@ref": "fx16",
            "@mimetype": "image/jpeg"
          },
          {
            "@category": "standard",
            "@height": "200",
            "@width": "369",
            "@_fa": "true",
            "$": "https://api.elsevier.com/content/object/eid/1-s2.0-S0021951725001484-ga1.jpg?httpAccept=%2A%2F%2A",
            "@multimediatype": "JPEG image file",
            "@type": "IMAGE-DOWNSAMPLED",
            "@size": "15608",
            "@ref": "ga1",
            "@mimetype": "image/jpeg"
          },
          {
            "@category": "standard",
            "@height": "30",
            "@width": "88",
            "@_fa": "true",
            "$": "https://api.elsevier.com/content/object/eid/1-s2.0-S0021951725001484-fx1.jpg?httpAccept=%2A%2F%2A",
            "@multimediatype": "JPEG image file",
            "@type": "IMAGE-DOWNSAMPLED",
            "@size": "1420",
            "@ref": "fx1",
            "@mimetype": "image/jpeg"
          },
          {
            "@category": "standard",
            "@height": "31",
            "@width": "49",
            "@_fa": "true",
            "$": "https://api.elsevier.com/content/object/eid/1-s2.0-S0021951725001484-fx5.jpg?httpAccept=%2A%2F%2A",
            "@multimediatype": "JPEG image file",
            "@type": "IMAGE-DOWNSAMPLED",
            "@size": "1174",
            "@ref": "fx5",
            "@mimetype": "image/jpeg"
          },
          {
            "@category": "standard",
            "@height": "46",
            "@width": "72",
            "@_fa": "true",
            "$": "https://api.elsevier.com/content/object/eid/1-s2.0-S0021951725001484-fx4.jpg?httpAccept=%2A%2F%2A",
            "@multimediatype": "JPEG image file",
            "@type": "IMAGE-DOWNSAMPLED",
            "@size": "1450",
            "@ref": "fx4",
            "@mimetype": "image/jpeg"
          },
          {
            "@category": "standard",
            "@height": "234",
            "@width": "373",
            "@_fa": "true",
            "$": "https://api.elsevier.com/content/object/eid/1-s2.0-S0021951725001484-sc1.jpg?httpAccept=%2A%2F%2A",
            "@multimediatype": "JPEG image file",
            "@type": "IMAGE-DOWNSAMPLED",
            "@size": "13341",
            "@ref": "sc1",
            "@mimetype": "image/jpeg"
          },
          {
            "@category": "standard",
            "@height": "47",
            "@width": "72",
            "@_fa": "true",
            "$": "https://api.elsevier.com/content/object/eid/1-s2.0-S0021951725001484-fx3.jpg?httpAccept=%2A%2F%2A",
            "@multimediatype": "JPEG image file",
            "@type": "IMAGE-DOWNSAMPLED",
            "@size": "1521",
            "@ref": "fx3",
            "@mimetype": "image/jpeg"
          },
          {
            "@category": "standard",
            "@height": "29",
            "@width": "96",
            "@_fa": "true",
            "$": "https://api.elsevier.com/content/object/eid/1-s2.0-S0021951725001484-fx2.jpg?httpAccept=%2A%2F%2A",
            "@multimediatype": "JPEG image file",
            "@type": "IMAGE-DOWNSAMPLED",
            "@size": "1427",
            "@ref": "fx2",
            "@mimetype": "image/jpeg"
          },
          {
            "@category": "thumbnail",
            "@height": "164",
            "@width": "165",
            "@_fa": "true",
            "$": "https://api.elsevier.com/content/object/eid/1-s2.0-S0021951725001484-gr2.sml?httpAccept=%2A%2F%2A",
            "@multimediatype": "GIF image file",
            "@type": "IMAGE-THUMBNAIL",
            "@size": "19059",
            "@ref": "gr2",
            "@mimetype": "image/gif"
          },
          {
            "@category": "thumbnail",
            "@height": "110",
            "@width": "219",
            "@_fa": "true",
            "$": "https://api.elsevier.com/content/object/eid/1-s2.0-S0021951725001484-fx9.sml?httpAccept=%2A%2F%2A",
            "@multimediatype": "GIF image file",
            "@type": "IMAGE-THUMBNAIL",
            "@size": "5561",
            "@ref": "fx9",
            "@mimetype": "image/gif"
          },
          {
            "@category": "thumbnail",
            "@height": "164",
            "@width": "172",
            "@_fa": "true",
            "$": "https://api.elsevier.com/content/object/eid/1-s2.0-S0021951725001484-gr1.sml?httpAccept=%2A%2F%2A",
            "@multimediatype": "GIF image file",
            "@type": "IMAGE-THUMBNAIL",
            "@size": "10235",
            "@ref": "gr1",
            "@mimetype": "image/gif"
          },
          {
            "@category": "thumbnail",
            "@height": "129",
            "@width": "219",
            "@_fa": "true",
            "$": "https://api.elsevier.com/content/object/eid/1-s2.0-S0021951725001484-fx8.sml?httpAccept=%2A%2F%2A",
            "@multimediatype": "GIF image file",
            "@type": "IMAGE-THUMBNAIL",
            "@size": "6233",
            "@ref": "fx8",
            "@mimetype": "image/gif"
          },
          {
            "@category": "thumbnail",
            "@height": "129",
            "@width": "219",
            "@_fa": "true",
            "$": "https://api.elsevier.com/content/object/eid/1-s2.0-S0021951725001484-fx7.sml?httpAccept=%2A%2F%2A",
            "@multimediatype": "GIF image file",
            "@type": "IMAGE-THUMBNAIL",
            "@size": "7311",
            "@ref": "fx7",
            "@mimetype": "image/gif"
          },
          {
            "@category": "thumbnail",
            "@height": "135",
            "@width": "213",
            "@_fa": "true",
            "$": "https://api.elsevier.com/content/object/eid/1-s2.0-S0021951725001484-fx6.sml?httpAccept=%2A%2F%2A",
            "@multimediatype": "GIF image file",
            "@type": "IMAGE-THUMBNAIL",
            "@size": "7904",
            "@ref": "fx6",
            "@mimetype": "image/gif"
          },
          {
            "@category": "thumbnail",
            "@height": "164",
            "@width": "182",
            "@_fa": "true",
            "$": "https://api.elsevier.com/content/object/eid/1-s2.0-S0021951725001484-gr5.sml?httpAccept=%2A%2F%2A",
            "@multimediatype": "GIF image file",
            "@type": "IMAGE-THUMBNAIL",
            "@size": "5908",
            "@ref": "gr5",
            "@mimetype": "image/gif"
          },
          {
            "@category": "thumbnail",
            "@height": "108",
            "@width": "219",
            "@_fa": "true",
            "$": "https://api.elsevier.com/content/object/eid/1-s2.0-S0021951725001484-fx10.sml?httpAccept=%2A%2F%2A",
            "@multimediatype": "GIF image file",
            "@type": "IMAGE-THUMBNAIL",
            "@size": "5389",
            "@ref": "fx10",
            "@mimetype": "image/gif"
          },
          {
            "@category": "thumbnail",
            "@height": "140",
            "@width": "219",
            "@_fa": "true",
            "$": "https://api.elsevier.com/content/object/eid/1-s2.0-S0021951725001484-gr4.sml?httpAccept=%2A%2F%2A",
            "@multimediatype": "GIF image file",
            "@type": "IMAGE-THUMBNAIL",
            "@size": "7176",
            "@ref": "gr4",
            "@mimetype": "image/gif"
          },
          {
            "@category": "thumbnail",
            "@height": "139",
            "@width": "219",
            "@_fa": "true",
            "$": "https://api.elsevier.com/content/object/eid/1-s2.0-S0021951725001484-fx11.sml?httpAccept=%2A%2F%2A",
            "@multimediatype": "GIF image file",
            "@type": "IMAGE-THUMBNAIL",
            "@size": "6743",
            "@ref": "fx11",
            "@mimetype": "image/gif"
          },
          {
            "@category": "thumbnail",
            "@height": "132",
            "@width": "219",
            "@_fa": "true",
            "$": "https://api.elsevier.com/content/object/eid/1-s2.0-S0021951725001484-gr3.sml?httpAccept=%2A%2F%2A",
            "@multimediatype": "GIF image file",
            "@type": "IMAGE-THUMBNAIL",
            "@size": "8415",
            "@ref": "gr3",
            "@mimetype": "image/gif"
          },
          {
            "@category": "thumbnail",
            "@height": "139",
            "@width": "219",
            "@_fa": "true",
            "$": "https://api.elsevier.com/content/object/eid/1-s2.0-S0021951725001484-fx12.sml?httpAccept=%2A%2F%2A",
            "@multimediatype": "GIF image file",
            "@type": "IMAGE-THUMBNAIL",
            "@size": "6488",
            "@ref": "fx12",
            "@mimetype": "image/gif"
          },
          {
            "@category": "thumbnail",
            "@height": "144",
            "@width": "201",
            "@_fa": "true",
            "$": "https://api.elsevier.com/content/object/eid/1-s2.0-S0021951725001484-fx13.sml?httpAccept=%2A%2F%2A",
            "@multimediatype": "GIF image file",
            "@type": "IMAGE-THUMBNAIL",
            "@size": "6935",
            "@ref": "fx13",
            "@mimetype": "image/gif"
          },
          {
            "@category": "thumbnail",
            "@height": "141",
            "@width": "198",
            "@_fa": "true",
            "$": "https://api.elsevier.com/content/object/eid/1-s2.0-S0021951725001484-fx14.sml?httpAccept=%2A%2F%2A",
            "@multimediatype": "GIF image file",
            "@type": "IMAGE-THUMBNAIL",
            "@size": "5792",
            "@ref": "fx14",
            "@mimetype": "image/gif"
          },
          {
            "@category": "thumbnail",
            "@height": "81",
            "@width": "219",
            "@_fa": "true",
            "$": "https://api.elsevier.com/content/object/eid/1-s2.0-S0021951725001484-fx15.sml?httpAccept=%2A%2F%2A",
            "@multimediatype": "GIF image file",
            "@type": "IMAGE-THUMBNAIL",
            "@size": "4542",
            "@ref": "fx15",
            "@mimetype": "image/gif"
          },
          {
            "@category": "thumbnail",
            "@height": "81",
            "@width": "219",
            "@_fa": "true",
            "$": "https://api.elsevier.com/content/object/eid/1-s2.0-S0021951725001484-fx16.sml?httpAccept=%2A%2F%2A",
            "@multimediatype": "GIF image file",
            "@type": "IMAGE-THUMBNAIL",
            "@size": "4247",
            "@ref": "fx16",
            "@mimetype": "image/gif"
          },
          {
            "@category": "thumbnail",
            "@height": "119",
            "@width": "219",
            "@_fa": "true",
            "$": "https://api.elsevier.com/content/object/eid/1-s2.0-S0021951725001484-ga1.sml?httpAccept=%2A%2F%2A",
            "@multimediatype": "GIF image file",
            "@type": "IMAGE-THUMBNAIL",
            "@size": "5642",
            "@ref": "ga1",
            "@mimetype": "image/gif"
          },
          {
            "@category": "thumbnail",
            "@height": "75",
            "@width": "219",
            "@_fa": "true",
            "$": "https://api.elsevier.com/content/object/eid/1-s2.0-S0021951725001484-fx1.sml?httpAccept=%2A%2F%2A",
            "@multimediatype": "GIF image file",
            "@type": "IMAGE-THUMBNAIL",
            "@size": "4759",
            "@ref": "fx1",
            "@mimetype": "image/gif"
          },
          {
            "@category": "thumbnail",
            "@height": "138",
            "@width": "219",
            "@_fa": "true",
            "$": "https://api.elsevier.com/content/object/eid/1-s2.0-S0021951725001484-fx5.sml?httpAccept=%2A%2F%2A",
            "@multimediatype": "GIF image file",
            "@type": "IMAGE-THUMBNAIL",
            "@size": "8874",
            "@ref": "fx5",
            "@mimetype": "image/gif"
          },
          {
            "@category": "thumbnail",
            "@height": "140",
            "@width": "219",
            "@_fa": "true",
            "$": "https://api.elsevier.com/content/object/eid/1-s2.0-S0021951725001484-fx4.sml?httpAccept=%2A%2F%2A",
            "@multimediatype": "GIF image file",
            "@type": "IMAGE-THUMBNAIL",
            "@size": "5645",
            "@ref": "fx4",
            "@mimetype": "image/gif"
          },
          {
            "@category": "thumbnail",
            "@height": "137",
            "@width": "219",
            "@_fa": "true",
            "$": "https://api.elsevier.com/content/object/eid/1-s2.0-S0021951725001484-sc1.sml?httpAccept=%2A%2F%2A",
            "@multimediatype": "GIF image file",
            "@type": "IMAGE-THUMBNAIL",
            "@size": "4952",
            "@ref": "sc1",
            "@mimetype": "image/gif"
          },
          {
            "@category": "thumbnail",
            "@height": "142",
            "@width": "219",
            "@_fa": "true",
            "$": "https://api.elsevier.com/content/object/eid/1-s2.0-S0021951725001484-fx3.sml?httpAccept=%2A%2F%2A",
            "@multimediatype": "GIF image file",
            "@type": "IMAGE-THUMBNAIL",
            "@size": "6271",
            "@ref": "fx3",
            "@mimetype": "image/gif"
          },
          {
            "@category": "thumbnail",
            "@height": "66",
            "@width": "219",
            "@_fa": "true",
            "$": "https://api.elsevier.com/content/object/eid/1-s2.0-S0021951725001484-fx2.sml?httpAccept=%2A%2F%2A",
            "@multimediatype": "GIF image file",
            "@type": "IMAGE-THUMBNAIL",
            "@size": "4185",
            "@ref": "fx2",
            "@mimetype": "image/gif"
          },
          {
            "@category": "high",
            "@height": "2734",
            "@width": "2756",
            "@_fa": "true",
            "$": "https://api.elsevier.com/content/object/eid/1-s2.0-S0021951725001484-gr2_lrg.jpg?httpAccept=%2A%2F%2A",
            "@multimediatype": "JPEG image file",
            "@type": "IMAGE-HIGH-RES",
            "@size": "1435949",
            "@ref": "gr2",
            "@mimetype": "image/jpeg"
          },
          {
            "@category": "high",
            "@height": "153",
            "@width": "306",
            "@_fa": "true",
            "$": "https://api.elsevier.com/content/object/eid/1-s2.0-S0021951725001484-fx9_lrg.jpg?httpAccept=%2A%2F%2A",
            "@multimediatype": "JPEG image file",
            "@type": "IMAGE-HIGH-RES",
            "@size": "6466",
            "@ref": "fx9",
            "@mimetype": "image/jpeg"
          },
          {
            "@category": "high",
            "@height": "2626",
            "@width": "2756",
            "@_fa": "true",
            "$": "https://api.elsevier.com/content/object/eid/1-s2.0-S0021951725001484-gr1_lrg.jpg?httpAccept=%2A%2F%2A",
            "@multimediatype": "JPEG image file",
            "@type": "IMAGE-HIGH-RES",
            "@size": "458099",
            "@ref": "gr1",
            "@mimetype": "image/jpeg"
          },
          {
            "@category": "high",
            "@height": "156",
            "@width": "264",
            "@_fa": "true",
            "$": "https://api.elsevier.com/content/object/eid/1-s2.0-S0021951725001484-fx8_lrg.jpg?httpAccept=%2A%2F%2A",
            "@multimediatype": "JPEG image file",
            "@type": "IMAGE-HIGH-RES",
            "@size": "4770",
            "@ref": "fx8",
            "@mimetype": "image/jpeg"
          },
          {
            "@category": "high",
            "@height": "156",
            "@width": "264",
            "@_fa": "true",
            "$": "https://api.elsevier.com/content/object/eid/1-s2.0-S0021951725001484-fx7_lrg.jpg?httpAccept=%2A%2F%2A",
            "@multimediatype": "JPEG image file",
            "@type": "IMAGE-HIGH-RES",
            "@size": "4813",
            "@ref": "fx7",
            "@mimetype": "image/jpeg"
          },
          {
            "@category": "high",
            "@height": "135",
            "@width": "213",
            "@_fa": "true",
            "$": "https://api.elsevier.com/content/object/eid/1-s2.0-S0021951725001484-fx6_lrg.jpg?httpAccept=%2A%2F%2A",
            "@multimediatype": "JPEG image file",
            "@type": "IMAGE-HIGH-RES",
            "@size": "4433",
            "@ref": "fx6",
            "@mimetype": "image/jpeg"
          },
          {
            "@category": "high",
            "@height": "2396",
            "@width": "2657",
            "@_fa": "true",
            "$": "https://api.elsevier.com/content/object/eid/1-s2.0-S0021951725001484-gr5_lrg.jpg?httpAccept=%2A%2F%2A",
            "@multimediatype": "JPEG image file",
            "@type": "IMAGE-HIGH-RES",
            "@size": "316900",
            "@ref": "gr5",
            "@mimetype": "image/jpeg"
          },
          {
            "@category": "high",
            "@height": "152",
            "@width": "307",
            "@_fa": "true",
            "$": "https://api.elsevier.com/content/object/eid/1-s2.0-S0021951725001484-fx10_lrg.jpg?httpAccept=%2A%2F%2A",
            "@multimediatype": "JPEG image file",
            "@type": "IMAGE-HIGH-RES",
            "@size": "6721",
            "@ref": "fx10",
            "@mimetype": "image/jpeg"
          },
          {
            "@category": "high",
            "@height": "2015",
            "@width": "3150",
            "@_fa": "true",
            "$": "https://api.elsevier.com/content/object/eid/1-s2.0-S0021951725001484-gr4_lrg.jpg?httpAccept=%2A%2F%2A",
            "@multimediatype": "JPEG image file",
            "@type": "IMAGE-HIGH-RES",
            "@size": "343692",
            "@ref": "gr4",
            "@mimetype": "image/jpeg"
          },
          {
            "@category": "high",
            "@height": "210",
            "@width": "330",
            "@_fa": "true",
            "$": "https://api.elsevier.com/content/object/eid/1-s2.0-S0021951725001484-fx11_lrg.jpg?httpAccept=%2A%2F%2A",
            "@multimediatype": "JPEG image file",
            "@type": "IMAGE-HIGH-RES",
            "@size": "6785",
            "@ref": "fx11",
            "@mimetype": "image/jpeg"
          },
          {
            "@category": "high",
            "@height": "1901",
            "@width": "3150",
            "@_fa": "true",
            "$": "https://api.elsevier.com/content/object/eid/1-s2.0-S0021951725001484-gr3_lrg.jpg?httpAccept=%2A%2F%2A",
            "@multimediatype": "JPEG image file",
            "@type": "IMAGE-HIGH-RES",
            "@size": "387978",
            "@ref": "gr3",
            "@mimetype": "image/jpeg"
          },
          {
            "@category": "high",
            "@height": "203",
            "@width": "320",
            "@_fa": "true",
            "$": "https://api.elsevier.com/content/object/eid/1-s2.0-S0021951725001484-fx12_lrg.jpg?httpAccept=%2A%2F%2A",
            "@multimediatype": "JPEG image file",
            "@type": "IMAGE-HIGH-RES",
            "@size": "6602",
            "@ref": "fx12",
            "@mimetype": "image/jpeg"
          },
          {
            "@category": "high",
            "@height": "144",
            "@width": "201",
            "@_fa": "true",
            "$": "https://api.elsevier.com/content/object/eid/1-s2.0-S0021951725001484-fx13_lrg.jpg?httpAccept=%2A%2F%2A",
            "@multimediatype": "JPEG image file",
            "@type": "IMAGE-HIGH-RES",
            "@size": "3001",
            "@ref": "fx13",
            "@mimetype": "image/jpeg"
          },
          {
            "@category": "high",
            "@height": "141",
            "@width": "198",
            "@_fa": "true",
            "$": "https://api.elsevier.com/content/object/eid/1-s2.0-S0021951725001484-fx14_lrg.jpg?httpAccept=%2A%2F%2A",
            "@multimediatype": "JPEG image file",
            "@type": "IMAGE-HIGH-RES",
            "@size": "2629",
            "@ref": "fx14",
            "@mimetype": "image/jpeg"
          },
          {
            "@category": "high",
            "@height": "181",
            "@width": "489",
            "@_fa": "true",
            "$": "https://api.elsevier.com/content/object/eid/1-s2.0-S0021951725001484-fx15_lrg.jpg?httpAccept=%2A%2F%2A",
            "@multimediatype": "JPEG image file",
            "@type": "IMAGE-HIGH-RES",
            "@size": "7283",
            "@ref": "fx15",
            "@mimetype": "image/jpeg"
          },
          {
            "@category": "high",
            "@height": "181",
            "@width": "489",
            "@_fa": "true",
            "$": "https://api.elsevier.com/content/object/eid/1-s2.0-S0021951725001484-fx16_lrg.jpg?httpAccept=%2A%2F%2A",
            "@multimediatype": "JPEG image file",
            "@type": "IMAGE-HIGH-RES",
            "@size": "7239",
            "@ref": "fx16",
            "@mimetype": "image/jpeg"
          },
          {
            "@category": "high",
            "@height": "886",
            "@width": "1637",
            "@_fa": "true",
            "$": "https://api.elsevier.com/content/object/eid/1-s2.0-S0021951725001484-ga1_lrg.jpg?httpAccept=%2A%2F%2A",
            "@multimediatype": "JPEG image file",
            "@type": "IMAGE-HIGH-RES",
            "@size": "94629",
            "@ref": "ga1",
            "@mimetype": "image/jpeg"
          },
          {
            "@category": "high",
            "@height": "133",
            "@width": "390",
            "@_fa": "true",
            "$": "https://api.elsevier.com/content/object/eid/1-s2.0-S0021951725001484-fx1_lrg.jpg?httpAccept=%2A%2F%2A",
            "@multimediatype": "JPEG image file",
            "@type": "IMAGE-HIGH-RES",
            "@size": "5555",
            "@ref": "fx1",
            "@mimetype": "image/jpeg"
          },
          {
            "@category": "high",
            "@height": "138",
            "@width": "219",
            "@_fa": "true",
            "$": "https://api.elsevier.com/content/object/eid/1-s2.0-S0021951725001484-fx5_lrg.jpg?httpAccept=%2A%2F%2A",
            "@multimediatype": "JPEG image file",
            "@type": "IMAGE-HIGH-RES",
            "@size": "4379",
            "@ref": "fx5",
            "@mimetype": "image/jpeg"
          },
          {
            "@category": "high",
            "@height": "206",
            "@width": "323",
            "@_fa": "true",
            "$": "https://api.elsevier.com/content/object/eid/1-s2.0-S0021951725001484-fx4_lrg.jpg?httpAccept=%2A%2F%2A",
            "@multimediatype": "JPEG image file",
            "@type": "IMAGE-HIGH-RES",
            "@size": "5909",
            "@ref": "fx4",
            "@mimetype": "image/jpeg"
          },
          {
            "@category": "high",
            "@height": "1038",
            "@width": "1654",
            "@_fa": "true",
            "$": "https://api.elsevier.com/content/object/eid/1-s2.0-S0021951725001484-sc1_lrg.jpg?httpAccept=%2A%2F%2A",
            "@multimediatype": "JPEG image file",
            "@type": "IMAGE-HIGH-RES",
            "@size": "78827",
            "@ref": "sc1",
            "@mimetype": "image/jpeg"
          },
          {
            "@category": "high",
            "@height": "209",
            "@width": "323",
            "@_fa": "true",
            "$": "https://api.elsevier.com/content/object/eid/1-s2.0-S0021951725001484-fx3_lrg.jpg?httpAccept=%2A%2F%2A",
            "@multimediatype": "JPEG image file",
            "@type": "IMAGE-HIGH-RES",
            "@size": "6027",
            "@ref": "fx3",
            "@mimetype": "image/jpeg"
          },
          {
            "@category": "high",
            "@height": "130",
            "@width": "429",
            "@_fa": "true",
            "$": "https://api.elsevier.com/content/object/eid/1-s2.0-S0021951725001484-fx2_lrg.jpg?httpAccept=%2A%2F%2A",
            "@multimediatype": "JPEG image file",
            "@type": "IMAGE-HIGH-RES",
            "@size": "5397",
            "@ref": "fx2",
            "@mimetype": "image/jpeg"
          },
          {
            "@category": "standard",
            "@_fa": "true",
            "$": "https://api.elsevier.com/content/object/eid/1-s2.0-S0021951725001484-mmc1.docx?httpAccept=%2A%2F%2A",
            "@multimediatype": "Microsoft Word file",
            "@type": "APPLICATION",
            "@size": "3793721",
            "@ref": "mmc1",
            "@mimetype": "application/word"
          },
          {
            "@category": "thumbnail",
            "@_fa": "true",
            "$": "https://api.elsevier.com/content/object/eid/1-s2.0-S0021951725001484-si1.svg?httpAccept=%2A%2F%2A",
            "@multimediatype": "Scalable Vector Graphics file",
            "@type": "ALTIMG",
            "@size": "30662",
            "@ref": "si1",
            "@mimetype": "image/svg+xml"
          },
          {
            "@category": "thumbnail",
            "@_fa": "true",
            "$": "https://api.elsevier.com/content/object/eid/1-s2.0-S0021951725001484-si2.svg?httpAccept=%2A%2F%2A",
            "@multimediatype": "Scalable Vector Graphics file",
            "@type": "ALTIMG",
            "@size": "30307",
            "@ref": "si2",
            "@mimetype": "image/svg+xml"
          }
        ]
      },
      "link": {
        "@rel": "abstract",
        "@href": "https://api.elsevier.com/content/abstract/scopus_id/105000741885"
      }
    }
  }
}