{
  "metadata": {
    "title": "Probing the particle size effect of carbon disulfide deep hydrogenation over low-loading Pt/Al<ce:inf loc=post>2</ce:inf>O<ce:inf loc=post>3</ce:inf> catalysts",
    "authors": "; ; ",
    "journal": "Journal of Catalysis",
    "date": "2025-08-31",
    "doi": "10.1016/j.jcat.2025.116198",
    "abstract": "",
    "uri": "https://api.elsevier.com/content/article/pii/S0021951725002635",
    "pii": "S0021951725002635"
  },
  "fulltext": {
    "full-text-retrieval-response": {
      "scopus-eid": "2-s2.0-105004350287",
      "originalText": "serial JL 272561 291210 291744 291809 31 Journal of Catalysis JOURNALCATALYSIS 2025-05-06 2025-05-06 2025-05-09 2025-05-09 2025-06-14T12:46:09 1-s2.0-S0021951725002635 S0021-9517(25)00263-5 S0021951725002635 10.1016/j.jcat.2025.116198 S300 S300.1 FULL-TEXT 1-s2.0-S0021951725X00063 2025-06-14T12:29:39.509965Z 0 0 20250801 20250831 2025 2025-05-06T16:20:04.029233Z absattachment articleinfo articlenumber articletitlenorm authfirstinitialnorm authfirstsurnamenorm cid cids contenttype copyright crossmark dateloaded dateloadedtxt datesearch datesort dateupdated dco docsubtype doctype doi eid ewtransactionid hubeid indexeddate issn issnnorm itemstage itemtransactionid itemweight openaccess openarchive pg pgfirst pii piinorm pubdateend pubdatestart pubdatetxt pubyr sectiontitle sortorder srctitle srctitlenorm srctype ssids alllist content subj subheadings suppl tomb volfirst volissue volumelist webpdf webpdfpagecount yearnav figure e-component body mmlmath acknowledge affil appendices articletitle auth authfirstini authfull authkeywords authlast grantnumber grantsponsor grantsponsorid highlightsabst primabst pubtype ref specialabst 0021-9517 00219517 true 448 448 C Volume 448 30 116198 116198 116198 202508 August 2025 2025-08-01 2025-08-31 2025 Regular Articles article fla © 2025 Elsevier Inc. All rights are reserved, including those for text and data mining, AI training, and similar technologies. PROBINGPARTICLESIZEEFFECTCARBONDISULFIDEDEEPHYDROGENATIONOVERLOWLOADINGPTAL2O3CATALYSTS XIE Y 1 Introduction 2 Experimental section 2.1 Materials 2.2 Catalyst preparation 2.3 Characterization 2.4 Catalyst performance test 2.5 DFT calculations 3 Results and discussion 3.1 DFT calculations of reaction pathway for CH3SH formation over different Pt cluster models 3.2 Synthesis of Pt NPs with different sizes 3.3 Activity and products selectivity of Pt/Al2O3 catalysts with different sizes 3.4 Electronic states and existing sites analysis of Pt species 3.5 Hydrogen adsorption behavior and spillover capacity analysis 3.6 In situ DRIFTS mechanistic study of CS2 hydrogenation 4 Conclusions CRediT authorship contribution statement Acknowledgements Appendix A Supplementary data References ZHANG 2023 789 800 Y SONG 2023 131464 J QU 2023 13205 13216 W XIA 2019 21 28 G CAI 2023 95 C MCGEOUGH 2007 4607 4612 K GHAREHVERAN 2018 9108 9117 M ZHOU 2020 1900890 W JIAO 2018 89 97 F KANDA 2022 294 302 Y SHI 2023 115198 P LONG 2022 120778 Y KAMP 2020 2961 2969 E CHEN 2018 3055 3062 H PENG 2021 1365 C XIE 2023 17553 17565 Y POTTER 2023 e202312645 M HOU 2023 G SUN 2019 23102 23111 M CAO 2021 24957 24965 F LI 2023 123881 Z WANG 2019 1437 1445 F WANG 2020 529 F WANG 2018 2670 2682 F CAROSSO 2019 7124 7136 M BERGMAN 2018 506 511 S SERRANORUIZ 2006 378 388 J BOUWMAN 1977 209 216 R SHYU 1988 246 252 J TIAN 2023 1443 1455 R KALE 2016 5599 5609 M DING 2015 189 192 K CHILDERS 2013 2487 2496 D LIU 2019 7759 7768 A QUINDIMIL 2021 120322 A ZHONG 2023 126241 Z LING 2022 e202116396 L FENG 2025 e202413417 Y PAPAGERIDIS 2021 8569 8584 K WIERZBICKI 2016 5 8 D LIU 2022 11369 11379 X XIE 2020 104653 C KIM 2023 11857 11870 H LI 2019 2739 2751 W PAN 2014 74 78 Q YAN 2016 108 116 Y YAO 2009 32 41 X ZENG 2003 111 117 A WANG 2017 513 X BAI 2019 6938 6944 S LI 2022 121529 W XIEX2025X116198 XIEX2025X116198XY 2027-05-09T00:00:00.000Z 2027-05-09T00:00:00.000Z http://creativecommons.org/licenses/by-nc-nd/4.0/ © 2025 Elsevier Inc. All rights are reserved, including those for text and data mining, AI training, and similar technologies. 2025-05-10T00:47:22.120Z http://vtw.elsevier.com/data/voc/AddOnTypes/50.7/aggregated-refined Yunnan Key Laboratory of Phosphorous Gypsum Resource Recycling and Ecological Utilization 202449CE340028 http://sws.geonames.org/1814991 National Natural Science Foundation of China 52370113 52460012 52470118 National Natural Science Foundation of China http://data.elsevier.com/vocabulary/SciValFunders/501100001809 http://sws.geonames.org/1814991 This work was financially supported by the National Natural Science Foundation of China (Nos. 52370113, 52460012, 52470118), Yunnan Key Laboratory of Phosphorous Gypsum Resource Recycling and Ecological Utilization (202449CE340028). https://doi.org/10.15223/policy-017 https://doi.org/10.15223/policy-037 https://doi.org/10.15223/policy-012 https://doi.org/10.15223/policy-029 https://doi.org/10.15223/policy-004 item S0021-9517(25)00263-5 S0021951725002635 1-s2.0-S0021951725002635 10.1016/j.jcat.2025.116198 272561 2025-06-14T12:29:39.509965Z 2025-08-01 2025-08-31 1-s2.0-S0021951725002635-main.pdf https://s3-eu-west-1.amazonaws.com/prod-ucs-content-store-eu-west/content/pii:S0021951725002635/MAIN/application/pdf/6e632130f2a7b61967d9aa5f284bbda1/main.pdf main.pdf pdf true 8705160 MAIN 11 1-s2.0-S0021951725002635-main_1.png https://s3-eu-west-1.amazonaws.com/prod-ucs-content-store-eu-west/content/pii:S0021951725002635/PREVIEW/image/png/2f21058a70ced1b402e72f17d1316af7/main_1.png main_1.png png 60323 928 656 IMAGE-WEB-PDF 1 1-s2.0-S0021951725002635-gr6.jpg https://s3-eu-west-1.amazonaws.com/prod-ucs-content-store-eu-west/content/pii:S0021951725002635/gr6/DOWNSAMPLED/image/jpeg/5e62ad29abe3e42fd6ef4beca1a503da/gr6.jpg gr6 gr6.jpg jpg 119985 595 734 IMAGE-DOWNSAMPLED 1-s2.0-S0021951725002635-gr4.jpg https://s3-eu-west-1.amazonaws.com/prod-ucs-content-store-eu-west/content/pii:S0021951725002635/gr4/DOWNSAMPLED/image/jpeg/2a7fe209f343007d4b2c850734b5b25a/gr4.jpg gr4 gr4.jpg jpg 88643 449 713 IMAGE-DOWNSAMPLED 1-s2.0-S0021951725002635-gr5.jpg https://s3-eu-west-1.amazonaws.com/prod-ucs-content-store-eu-west/content/pii:S0021951725002635/gr5/DOWNSAMPLED/image/jpeg/63c8e109b628ed91ebb560d64479abd3/gr5.jpg gr5 gr5.jpg jpg 116811 466 713 IMAGE-DOWNSAMPLED 1-s2.0-S0021951725002635-gr2.jpg https://s3-eu-west-1.amazonaws.com/prod-ucs-content-store-eu-west/content/pii:S0021951725002635/gr2/DOWNSAMPLED/image/jpeg/d858c6c7e2db8da366afd0913ab2067f/gr2.jpg gr2 gr2.jpg jpg 89095 477 712 IMAGE-DOWNSAMPLED 1-s2.0-S0021951725002635-ga1.jpg https://s3-eu-west-1.amazonaws.com/prod-ucs-content-store-eu-west/content/pii:S0021951725002635/ga1/DOWNSAMPLED/image/jpeg/d5c671790f92e5961b123da131c13fce/ga1.jpg ga1 true ga1.jpg jpg 30606 200 329 IMAGE-DOWNSAMPLED 1-s2.0-S0021951725002635-gr3.jpg https://s3-eu-west-1.amazonaws.com/prod-ucs-content-store-eu-west/content/pii:S0021951725002635/gr3/DOWNSAMPLED/image/jpeg/321b87d946866b8d737dd1626dd7a356/gr3.jpg gr3 gr3.jpg jpg 116910 624 713 IMAGE-DOWNSAMPLED 1-s2.0-S0021951725002635-gr1.jpg https://s3-eu-west-1.amazonaws.com/prod-ucs-content-store-eu-west/content/pii:S0021951725002635/gr1/DOWNSAMPLED/image/jpeg/a087a8f3ee2e597be5112a577de7a9ee/gr1.jpg gr1 gr1.jpg jpg 202307 835 713 IMAGE-DOWNSAMPLED 1-s2.0-S0021951725002635-gr6.sml https://s3-eu-west-1.amazonaws.com/prod-ucs-content-store-eu-west/content/pii:S0021951725002635/gr6/THUMBNAIL/image/gif/4b1dc7847c3ee44bda972a0c9d321eff/gr6.sml gr6 gr6.sml sml 24669 164 202 IMAGE-THUMBNAIL 1-s2.0-S0021951725002635-gr4.sml https://s3-eu-west-1.amazonaws.com/prod-ucs-content-store-eu-west/content/pii:S0021951725002635/gr4/THUMBNAIL/image/gif/be95585eac81e076bbe0b0d635797f77/gr4.sml gr4 gr4.sml sml 11959 138 219 IMAGE-THUMBNAIL 1-s2.0-S0021951725002635-gr5.sml https://s3-eu-west-1.amazonaws.com/prod-ucs-content-store-eu-west/content/pii:S0021951725002635/gr5/THUMBNAIL/image/gif/8bdb27cf856c0396fa85f97335ac7f88/gr5.sml gr5 gr5.sml sml 17501 143 219 IMAGE-THUMBNAIL 1-s2.0-S0021951725002635-gr2.sml https://s3-eu-west-1.amazonaws.com/prod-ucs-content-store-eu-west/content/pii:S0021951725002635/gr2/THUMBNAIL/image/gif/54ab205fd4f97f6993ea1c7fc4884228/gr2.sml gr2 gr2.sml sml 21438 147 219 IMAGE-THUMBNAIL 1-s2.0-S0021951725002635-ga1.sml https://s3-eu-west-1.amazonaws.com/prod-ucs-content-store-eu-west/content/pii:S0021951725002635/ga1/THUMBNAIL/image/gif/e5e9412b5827077191495e07af93d38f/ga1.sml ga1 true ga1.sml sml 16183 133 219 IMAGE-THUMBNAIL 1-s2.0-S0021951725002635-gr3.sml https://s3-eu-west-1.amazonaws.com/prod-ucs-content-store-eu-west/content/pii:S0021951725002118/gr3/THUMBNAIL/image/gif/a2e24327bf6d6c9ea752ce97b5ded880/gr3.sml gr3 gr3.sml sml 12154 164 187 IMAGE-THUMBNAIL 1-s2.0-S0021951725002635-gr1.sml https://s3-eu-west-1.amazonaws.com/prod-ucs-content-store-eu-west/content/pii:S0021951725002118/gr1/THUMBNAIL/image/gif/f4aeb57b7cf8eb6ec87aed664c2d327d/gr1.sml gr1 gr1.sml sml 13246 164 140 IMAGE-THUMBNAIL 1-s2.0-S0021951725002635-gr6_lrg.jpg https://s3-eu-west-1.amazonaws.com/prod-ucs-content-store-eu-west/content/pii:S0021951725002635/HIGHRES/image/jpeg/2c556ec88b68c4c1250221231e02f2bd/gr6_lrg.jpg gr6 gr6_lrg.jpg jpg 907035 2631 3248 IMAGE-HIGH-RES 1-s2.0-S0021951725002635-gr4_lrg.jpg https://s3-eu-west-1.amazonaws.com/prod-ucs-content-store-eu-west/content/pii:S0021951725002635/HIGHRES/image/jpeg/7a44f9ae13699b7a1de332a2d4ed6019/gr4_lrg.jpg gr4 gr4_lrg.jpg jpg 469557 1752 2780 IMAGE-HIGH-RES 1-s2.0-S0021951725002635-gr5_lrg.jpg https://s3-eu-west-1.amazonaws.com/prod-ucs-content-store-eu-west/content/pii:S0021951725002635/HIGHRES/image/jpeg/99f5d1079e74472b9a91d2e1821883ed/gr5_lrg.jpg gr5 gr5_lrg.jpg jpg 704757 2063 3156 IMAGE-HIGH-RES 1-s2.0-S0021951725002635-gr2_lrg.jpg https://s3-eu-west-1.amazonaws.com/prod-ucs-content-store-eu-west/content/pii:S0021951725002635/HIGHRES/image/jpeg/f49db12ec721cc601d7ddaeb131dee46/gr2_lrg.jpg gr2 gr2_lrg.jpg jpg 306432 1305 1949 IMAGE-HIGH-RES 1-s2.0-S0021951725002635-ga1_lrg.jpg https://s3-eu-west-1.amazonaws.com/prod-ucs-content-store-eu-west/content/pii:S0021951725002635/HIGHRES/image/jpeg/fa1509334e358a57cf7b8ed8e16e3d06/ga1_lrg.jpg ga1 true ga1_lrg.jpg jpg 216795 886 1460 IMAGE-HIGH-RES 1-s2.0-S0021951725002635-gr3_lrg.jpg https://s3-eu-west-1.amazonaws.com/prod-ucs-content-store-eu-west/content/pii:S0021951725002118/HIGHRES/image/jpeg/caeca481a9df523583be92d4eb27f514/gr3_lrg.jpg gr3 gr3_lrg.jpg jpg 659377 2761 3156 IMAGE-HIGH-RES 1-s2.0-S0021951725002635-gr1_lrg.jpg https://s3-eu-west-1.amazonaws.com/prod-ucs-content-store-eu-west/content/pii:S0021951725002118/HIGHRES/image/jpeg/a2e621324a99ce74832841ceab7adc45/gr1_lrg.jpg gr1 gr1_lrg.jpg jpg 1038815 3268 2791 IMAGE-HIGH-RES 1-s2.0-S0021951725002635-mmc1.docx https://s3-eu-west-1.amazonaws.com/prod-ucs-content-store-eu-west/content/pii:S0021951725002635/mmc1/MAIN/application/vnd.openxmlformats-officedocument.wordprocessingml.document/122dda7aa08d73d499f261690bf8ebf7/mmc1.docx mmc1 mmc1.docx docx 4257779 APPLICATION 1-s2.0-S0021951725002635-si1.svg https://s3-eu-west-1.amazonaws.com/prod-ucs-content-store-eu-west/content/pii:S0021951725002635/image/svg+xml/7ea163ecd35e014aa57c99f8eb8d610c/si1.svg si1 si1.svg svg 22423 ALTIMG 1-s2.0-S0021951725002635-si10.svg https://s3-eu-west-1.amazonaws.com/prod-ucs-content-store-eu-west/content/pii:S0021951725002635/image/svg+xml/0acf75f4818335779e25bfb6ee61bfa9/si10.svg si10 si10.svg svg 13824 ALTIMG 1-s2.0-S0021951725002635-si11.svg https://s3-eu-west-1.amazonaws.com/prod-ucs-content-store-eu-west/content/pii:S0021951725002635/image/svg+xml/8749510de1a4908ff591aa7f4c7fa168/si11.svg si11 si11.svg svg 7007 ALTIMG 1-s2.0-S0021951725002635-si12.svg https://s3-eu-west-1.amazonaws.com/prod-ucs-content-store-eu-west/content/pii:S0021951725002635/image/svg+xml/d38a584fee8438d8f058a8220d10ce11/si12.svg si12 si12.svg svg 13653 ALTIMG 1-s2.0-S0021951725002635-si13.svg https://s3-eu-west-1.amazonaws.com/prod-ucs-content-store-eu-west/content/pii:S0021951725002635/image/svg+xml/81f5ced51064321603cd657c45d02a4c/si13.svg si13 si13.svg svg 7880 ALTIMG 1-s2.0-S0021951725002635-si2.svg https://s3-eu-west-1.amazonaws.com/prod-ucs-content-store-eu-west/content/pii:S0021951725002635/image/svg+xml/d708b327064ee1beddffdb322c425a38/si2.svg si2 si2.svg svg 25092 ALTIMG 1-s2.0-S0021951725002635-si3.svg https://s3-eu-west-1.amazonaws.com/prod-ucs-content-store-eu-west/content/pii:S0021951725002635/image/svg+xml/d794f7ae82067593813e5d235302c550/si3.svg si3 si3.svg svg 23900 ALTIMG 1-s2.0-S0021951725002635-si4.svg https://s3-eu-west-1.amazonaws.com/prod-ucs-content-store-eu-west/content/pii:S0021951725002635/image/svg+xml/252fd28f022233ad9803eb2826bca08c/si4.svg si4 si4.svg svg 23456 ALTIMG 1-s2.0-S0021951725002635-si5.svg https://s3-eu-west-1.amazonaws.com/prod-ucs-content-store-eu-west/content/pii:S0021951725002635/image/svg+xml/b991fcafaeab3b3ab15ae4c4c0d73d5f/si5.svg si5 si5.svg svg 24735 ALTIMG 1-s2.0-S0021951725002635-si6.svg https://s3-eu-west-1.amazonaws.com/prod-ucs-content-store-eu-west/content/pii:S0021951725002635/image/svg+xml/b527a3c1d0b0677941f1cba88d60dfab/si6.svg si6 si6.svg svg 25505 ALTIMG 1-s2.0-S0021951725002635-si7.svg https://s3-eu-west-1.amazonaws.com/prod-ucs-content-store-eu-west/content/pii:S0021951725002635/image/svg+xml/28e408d616ae19c98b3804b46ec550ea/si7.svg si7 si7.svg svg 6304 ALTIMG 1-s2.0-S0021951725002635-si8.svg https://s3-eu-west-1.amazonaws.com/prod-ucs-content-store-eu-west/content/pii:S0021951725002635/image/svg+xml/67518251def1388c88bf9ad20424777a/si8.svg si8 si8.svg svg 12798 ALTIMG 1-s2.0-S0021951725002635-si9.svg https://s3-eu-west-1.amazonaws.com/prod-ucs-content-store-eu-west/content/pii:S0021951725002635/image/svg+xml/a32c0e6cd8f13250ee626443f0d61f55/si9.svg si9 si9.svg svg 13854 ALTIMG YJCAT 116198 116198 S0021-9517(25)00263-5 10.1016/j.jcat.2025.116198 Elsevier Inc. Fig. 1 (a) Calculation of the free energy profile formed by the catalytic hydrogenation of CS2 to CH3SH on Pt19, Pt55, Pt92, and Pt135 clusters, (b) trends in the free energy of the critical step of CS2 hydrogenation with Pt cluster size, and (c) step-by-step energy diagrams of CS2 hydrogenation steps on Pt19, Pt55, Pt92, and Pt135 cluster models. Fig. 2 Representative HAADF-STEM images of particles distributions (sample size 200) of (a) 1Pt/Al, (b) 1Pt/Al-400H, (c) 1Pt/Al-500H, (d) 1Pt/Al-600H, and (e) 1Pt/Al-700H, and (f) XRD patterns of different fresh and reduced samples. Fig. 3 (a) CS2 conversion, (b) CH3SH selectivity, and (c) CH4 selectivity on 1Pt/Al, 1Pt/Al-400H, 1Pt/Al-500H, 1Pt/Al-600H, and 1Pt/Al-700H catalysts. (Reaction condition: 200 ppm CS2/10 % H2/N2 balance; 30 mg catalysts; WHSV = 200,000 mL/gcatal·h) (d) The relationship between Pt NPs size and dispersion of TEM, TOF at 260 ℃, and CH3SH selectivity (%) at 250 ℃, (e) Arrhenius plots and corresponding Ea (Reaction condition: 200 ppm CS2/10 % H2/N2 balance; 10 mg catalysts; WHSV = 600,000 mL/gcatal·h) and (f) long-term experiment for CH3SH production of 1Pt/Al-500H catalyst at 250 ℃ (Reaction condition: 1000 ppm CS2/20 % H2/N2 balance; 100 mg catalysts; WHSV = 60000 mL/gcatal·h). Fig. 4 (a) XPS Pt 4d fitting curves and (b-e) CO-DRIFTS of 1Pt/Al, 1Pt/Al-400H, 1Pt/Al-500H, and 1Pt/Al-600H catalysts. Fig. 5 (a) H2-TPD and (b) CO2-TPD patterns of the samples, (c) photographs of WO3 with fresh and reduced samples at different H2 treatment times at 25 °C, and (d–g) in situ DRIFTS of H2 adsorption at 200 ℃ for 1Pt/Al, 1Pt/Al-400H, 1Pt/Al-500H, and 1Pt/Al-600H catalysts. Fig. 6 2D plot graphs of in situ DRIFT spectra recorded on (a) 1Pt/Al-400H, (b) 1Pt/Al-500H, and (c) 1Pt/Al-600H during the catalytic process with increasing reaction time at 250 ℃ under CS2/H2/N2 flow (100 mL/min, 200 ppm CS2, and 10 % H2). Research article Probing the particle size effect of carbon disulfide deep hydrogenation over low-loading Pt/Al2O3 catalysts Yuxuan Xie Writing – original draft Investigation Formal analysis Data curation a Zhao Li Methodology Investigation Data curation a Ziruo Zeng Methodology Data curation a Lina Sun Data curation a Shuangyou Bao Validation Investigation a b Xin Sun Validation Investigation a b Kunlin Li Investigation Conceptualization a b Chi Wang Visualization Supervision Investigation c Fei Wang Writing – review & editing Project administration Funding acquisition Conceptualization a b ⁎ Ping Ning Writing – review & editing Project administration Funding acquisition Conceptualization a b ⁎ Kai Li Writing – review & editing Project administration Funding acquisition Conceptualization a b ⁎ a Faculty of Environmental Science and Engineering, Kunming University of Science and Technology, Kunming 650500, China Faculty of Environmental Science and Engineering Kunming University of Science and Technology Kunming 650500 China Faculty of Environmental Science and Engineering, Kunming University of Science and Technology, Kunming 650500, China b National-Regional Engineering Center for Recovery of Waste Gases from Metallurgical and Chemical Industries, Kunming 650500, China National-Regional Engineering Center for Recovery of Waste Gases from Metallurgical and Chemical Industries Kunming 650500 China National-Regional Engineering Center for Recovery of Waste Gases from Metallurgical and Chemical Industries, Kunming 650500, China c Faculty of Chemical Engineering, Kunming University of Science and Technology, Kunming 650500, China Faculty of Chemical Engineering Kunming University of Science and Technology Kunming 650500 China Faculty of Chemical Engineering, Kunming University of Science and Technology, Kunming 650500, China ⁎ Corresponding authors at: Faculty of Environmental Science and Engineering, Kunming University of Science and Technology, Kunming 650500, China. Faculty of Environmental Science and Engineering Kunming University of Science and Technology Kunming 650500 China Graphical abstract To investigate the mechanism of the role of active center size on the selectivity of methyl mercaptan (CH3SH) and methane (CH4) in the deep hydrogenation reaction of carbon disulfide (CS2), it was first derived from DFT calculations that the Pt cluster geometries showed a decreasing and increasing pattern on the energy barriers of the two key hydrogenation steps: (I) HCSS* to HCSSH* and (II) deep hydrogenation of CH2S* to CH3SH. For further validation, we synthesized Pt NPs with varied average sizes (1.7–4.0 nm) using a reduction-agglomeration strategy to probe the source of size sensitivity at low Pt loading. It was found that the active centers of Pt NPs located in the 2.0–3.0 nm region have the highest proportion of medium-coordinated Pt sites, which can effectively promote hydrogen spillover and enhance the HCSS* pathway. Finally, with this modulation strategy, the catalytic activity and selectivity were significantly improved at 1 wt% Pt loading, which exceeded that of the fresh 4 wt% Pt/Al2O3 catalyst, and the long-term stable production of CH3SH (selectivity was maintained at 80 %) was achieved at 250 ℃ in the high-concentration CS2 environment. Keywords CS2 hydrogenation Pt-based catalysts Size effect Hydrogen spillover CH3SH production Data availability Data will be made available on request. 1 Introduction Carbon disulfide (CS2), a common volatile organosulfur species, is widely present in coke oven gas and viscose fiber industry exhaust gases in concentrations that are typically trace [1–4]. Organic sulfur compounds at only about 5 ppm can cause irreversible damage to the human respiratory system and kidneys and are often difficult to prevent due to their imperceptible odor [5,6]. CS2 emissions enter the atmosphere and undergo a complex photochemical reaction and chemical deposition to form sulfates, which contribute to the formation of acid rain [7]. Therefore, it is essential to control industrial emissions of trace organosulfur gases, which at the same time safeguards the degree of utilization of renewable industrial waste gases and dramatically improves the service life of downstream production catalysts. Direct conversion of CS2 to high value-added products CH3SH or CH4 is what we desire, while organic sulfur impurities have a strong adsorption capacity on the surface of noble metal-loaded catalysts and are catalyst poisons that can severely reduce or even completely inhibit the activity of supported metal catalysts [8]. For various complex sulfur-containing compounds that are difficult to remove, deep removal and generation of sulfur-free compounds can be achieved through hydrodesulfurization under pressurized conditions by taking advantage of the excellent hydrogen dissociation and spillover capability of noble metal catalysts [9–11]. Therefore, the utilization of residual hydrogen in coke oven gas [12] to realize the hydrogenation removal of CS2 is an effective means. For example, Kamp et al. [13] evaluated the ability of the Pd/Al2O3 catalyst to convert 100mol ppm CS2 at conditions of T = 150 ℃ and P = 1.2 bar and found that CS2 was completely eliminated, and the products were dominated by CH3SH and H2S but CH3SH selectivity did not exceed 30 % with elemental carbon being deposited mainly as coke on the catalyst. As the temperature increased to 200 ℃, the CH3SH product was almost undetectable. For the CS2 hydrogenation reaction at higher temperatures, Chen et al. [14] synthesized a magnesium-carbon composite hydrogen storage catalyst, which can convert CS2 to CH4 and H2S at 350 ℃ in the absence of high-pressure gaseous H2 and achieved a conversion rate of more than 99.1 % within 300 min, but did not provide CH4 selectivity data. Despite the complete conversion of CS2 by these catalysts, there is a lack of in-depth studies on the controlled modulation of product selectivity. The use of CS2 as resources at T = 260 ℃ and P = 0.3 MPa for the synthesis of the methionine feedstock CH3SH is feasible [15], and the reaction is more advantageous if it can be realized at atmospheric pressure. Pt/Al2O3 catalysts have been demonstrated to have low coke selectivity (≤10 %) in CS2 hydrogenation reaction [16]. Normally, platinum (Pt), palladium (Pd), and other noble metals typically have optimal hydrogen dissociation capabilities in the metallic state, and monoatomic dispersed Pt species possesses poor hydrogen dissociation ability [16–18]. Therefore, regulation of the existence state of metallic Pt on noble metal-based catalysts is critical to enhance the CH3SH and CH4 selectivity for CS2 hydrogenation. Pt NPs size has salient effects on the hydrogen dissociation and hydrogenation reaction paths, there is a high demand for the synthesis of size-tunable metal catalysts on supports with similar surface physical and chemical properties to obtain the specified products. Wet-impregnation method is widely used to control the size of metal nanoparticles by adjusting the loading of metal precursors and/or the surface properties of the supports. For example, active ingredients with different dispersions could be acquired by taking advantage of differences in supports properties or by special pretreatment of the supports. Sun et al. [19] utilized the properties discrepancies of CeZrO2 and Al2O3 to form Pt NPs with different sizes, and Cao et al. [20] treated CeO2 nanorods with different concentrations of ascorbic acid (AA) to obtain support with an incremental concentration of Ce3+ and thus obtained larger Pd NPs size. However, differences in catalyst surface properties and metal-support interactions can also make catalyst comparisons uncertain. Highly dispersed Pt atoms can sinter and agglomerate into larger clusters by a “reduction-aggregation” strategy [21], thus the Pt NPs size can be modulated by changing the H2 pretreatment temperature, and the properties of the irreducible support Al2O3 are not changed and the occurrence of SMSI is avoided. Towards improving the selectivity of the CH3SH and CH4 products, we have deeply analyzed the particle size sensitivity of CS2 hydrogenation using a “reduction-agglomeration” strategy in a suitable temperature interval (400–700 ℃) guided by the predictions of DFT computational modeling and taking advantage of the property of the Pt atoms to attract each other to agglomerate in a high-temperature reducing atmosphere. In addition, High-angle annular dark-field STEM (HAADF-STEM) images, powder X-ray diffractometer (XRD), X-ray photoelectron spectroscopy (XPS), and CO-DRIFTS measurements were used to investigate the dispersion states and electronic states of the Pt species. Finally, the correlation between the CS2 hydrogenation mechanism and the Pt NPs size over 1Pt/Al-xH catalysts was investigated using in situ diffuse reflectance infrared Fourier transform spectroscopy (DRIFTS). 2 Experimental section 2.1 Materials Nano γ-Al2O3 (10 nm) and H2PtCl6 solution (8 wt% in water) are purchased from Aladdin Limited Company, China. All materials are not subjected to further purification. WO3 were purchased from Macklin Biochemical Technology Co., Ltd. Deionized water was used in the entire experimental process. 2.2 Catalyst preparation Pt/Al2O3 catalysts with different Pt loading (0.2, 0.5, 1, 2 and 4 wt%) were prepared by conventional impregnation methods. The samples were prepared by adding 0.01 M HCl solution to ensure the pH of the mixed solution was weakly acidic. Typically, the 5 g nano γ-Al2O3 powder (≥200 mesh, 10 nm) were dispersed in H2PtCl6 (8 wt.% in water, 1.25 mL, 0.05 g for 1 wt%) aqueous solution, stirred for 3 h at room temperature and evaporated at 80 ℃ in a rotary evaporator, and then dried overnight at 100 ℃. The powder products were calcined at 500 ℃ for 3 h under an air atmosphere to obtain the desired 1Pt/Al-fresh catalyst. The calcined powder samples (40–60 mesh) were reduced at 400 °C to 800 °C under H2 atmosphere at a heating rate of 10 °C/min and maintained for 2 h, which were denoted as 1Pt/Al-TH (T refers to the reduction temperature). 2.3 Characterization High-resolution transmission electron microscopy (HR-TEM) images and High-angle annular dark-field STEM (HAADF-STEM) images were obtained on an FEI Talos F200S TEM instrument equipped with an EDX analyzer at an acceleration voltage of 1−20 kV. Powder XRD (Bruker D8 Advance) measurements of the catalysts were diffractometer with Cu Kα radiation source (λ = 0.15406 nm). The patterns were taken over the 2θ range from 10 to 80◦ at a scan speed of 2◦/min. XPS (Thermo Fisher Scientific K-alpha)’s X-ray light source is a monochromatic Al Kα source (Mono Al Kα, 1486.6 eV). The basic site of the material is determined by CO2-Temperature Programmed Desorption (CO2-TPD) through the Micromeritics AutoChem II 2920 instrument. During measuring, the 50 mg sample was pretreated in a He atmosphere at 300 ℃ for 60 min firstly and then exposed to CO2/He at 25 ℃ for 1 h. Finally, the temperature was increased to 800 ℃ at a rate of 10 ℃ /min under He atmosphere, the gas concentration was monitored by a TCD detector. Similarly, H2-TPD (H2 Temperature programmed desorption) was carried out on the Micromeritics AutoChem II 2920 instrument, the 50 mg sample was pretreated in a He atmosphere at 300 ℃ for 1 h firstly, then the mixture of 10 % H2/Ar was introduced at 25 ℃ for 1 h until saturation, and finally, the gas was desorbed at a temperature increase rate of 10 ℃/min to 800 ℃ under Ar atmosphere, and the gas was detected by TCD. The CO chemisorption of catalysts was recorded at 50 °C by using CO pulse chemisorption on Autochem II 2920 chemisorption. The sample (∼100 mg) was pretreated with hydrogen at desired temperatures for 1 h, followed by purging with high purity He for 30 min. After cooling down to 50 °C, a 5 % CO/He mixture was injected into the reactor repeatedly until CO adsorption was saturated. The Pt dispersion was calculated based on the chemically adsorbed CO and the practical amount of Pt in the catalysts with the assumption that CO: Pt is 1:1. In situ DRIFTS spectra of CO or H2 adsorption were collected on a Thermo iS50 infrared spectrometer with a mercury cadmium telluride (MCT) detector and a transmission cell. Before the measurement, each catalyst was pretreated at a desired temperature under a flowing H2 atmosphere (100 mL/min) for 1 h. The catalyst was subsequently cooled down to room temperature (CO) or 200 °C (H2) under a flowing N2 atmosphere (100 mL/min). After evacuating for 30 min and collecting background, the spectrum was recorded in 1 % CO/N2 or 10 % H2/N2 gas flow, which was introduced to the catalyst at room temperature (CO) or 200 °C (H2). In situ DRIFTS measurements for CS2 hydrogenation were conducted using Thermo iS50 infrared spectrometer with an MCT detector and a flow-type quartz IR cell connected to a flow system. The 1Pt/Al-TH samples were heated under a flow of 10 % H2/N2 (100 mL/min) at 400 °C for 120 min before the measurement. The background spectrum was recorded after switching the gas to pure N2, followed by the IR spectra recorded under a 200 ppm CS2 (10 % H2, balanced with N2, 100 mL/min) flow at 250 °C for 30 min. Afterward, the IR cell was purged with pure N2 (100 mL/min) for 1 min and switched to 10 % H2/N2 (100 mL/min) at 250 °C for 30 min. 2.4 Catalyst performance test The catalytic hydrogenation reaction of CS2 was conducted in a fixed bed reactor (i.d. 4 mm), and the entire reaction process uses catalyst particles pressed into 40–60 mesh. 1 % CS2/N2 cylinder gas is used as raw gas, and the CS2 concentration is controlled by flow rate regulation. Pure hydrogen comes from the electrolysis of water in the hydrogen generator. A simulated gas stream composed of CS2 (200 ppm), H2 (10 vol%), and balance N2 with the gas flow rate of 100 mL/min and the volume space velocity of 200,000 mL/gcatal∙h. The concentration of CS2, H2S, and CH3SH was detected with gas chromatography (GC-9790II, Zhejiang Fuli Analytical Instrument Co., Ltd, China) with a flame photometric detector (FPD) under the following conditions: capillary chromatographic column (RB-PLOT Q), the oven temperature was 80°C and detector temperature was 250 °C. The concentration of CO and CH4 was detected with gas chromatography (GC-9790II, Zhejiang Fuli Analytical Instrument Co., Ltd, China) with a flame ionization detector (FID) equipped with a methanation furnace under the following conditions: capillary chromatographic column (RB-PLOT Q), the oven temperature was 80 °C and detector temperature was 250 °C. Among them, the concentration of CO is indirectly quantified using a methanation furnace. The selectivity of CH3SH, CH4 and CO is calculated based on the number of C atoms, and the selectivity of H2S is calculated based on the number of S atoms. The calculations formulas of the CS2 conversion, the selectivity of generated H2S, CO, CH3SH, and CH4, and S balance are described as follows (Eqs. (2-1)–(2-6)): (2-1) C S 2 conversion (%)= C S 2in -C S 2out C S 2in × 100% (2-2) C H 3 SH selectivity (%)= C H 3 S H out C S 2in -C S 2out × 100% (2-3) C H 4 selectivity (%)= C H 4out C S 2in -C S 2out × 100% (2-4) CO selectivity (%)= C O out C S 2in -C S 2out × 100% (2-5) H 2 S selectivity (%)= 1 2 H 2 S out C S 2in -C S 2out × 100% (2-6) S balance (%)= 1 2 H 2 S out + 1 2 C H 3 S H out C S 2in -C S 2out × 100% 2.5 DFT calculations Details of the density functional theory calculations can be found in Supporting information S1 section. 3 Results and discussion 3.1 DFT calculations of reaction pathway for CH3SH formation over different Pt cluster models As the key intermediates for the generation of CH3SH and CH4 on Pt-based catalysts have been found to be HCSS* and CH2S* species in our previous studies [16], thus, we first analyzed the size effect of Pt NPs on the generation of different pivotal intermediates of CS2 hydrogenation by DFT calculations. Due to the variations in geometric configurations of Pt clusters of varied sizes, this can have an impact on the adsorption and further hydrogenation of CS2 molecules. To explore the influence of Pt cluster size on the energy barrier of the key step of CS2 hydrogenation, we chose to construct Pt19, Pt55, Pt92 and Pt135 models presenting a certain gradient, which can fully represent the crucial effect of the geometrical configuration change. As shown in Fig. 1 a, and their adsorption energies to CS2 showed a tendency of decreasing and then increasing, so that the appropriate Pt cluster sizes could enhance sulfur-resistant performance. Because of the spontaneous dissociation of H2 on Pt clusters, we calculated the intermediate adsorbates for four model hydrogenation processes. Taken as a whole (Fig. 1a), the steps that determined the generation of CH3SH consist of two, (I) HCSS* hydrogenation to HCSSH* and (II) deep hydrogenation of CH2S* to CH3SH*. We counted the energy of each intermediate (Fig. 1c), and for the rate-determining step of generating formic acid, Pt19 had a maximum energy barrier of 0.771 eV, and the energy barrier decreased with increasing particle size. On Pt135, the energy barrier is even negative (−0.41 eV). For the conversion step of CH2S* to CH3SH, there was just the opposite trend, the largest energy barrier appeared on Pt135 at 0.845 eV, while the energy barrier on Pt19 is −0.21 eV. It is not difficult to conclude that the energy barriers of two main rate-determining steps have the opposite trend with the Pt cluster size, and there is an optimal Pt cluster size to ensure the most efficient reaction. The curves of the energy barrier changing with the Pt clusters size are intersected (Fig. 1b), and there is just an intersection point, that is, the Pt cluster containing 75 Pt atoms may have the best CH3SH generation ability. The smaller Pt cluster system like Pt19 adsorbed CS2 strongly, but it was difficult to continue the conversion to the effective intermediate HCSSH*, which limited the generation of CH3SH from the beginning of the reaction and may lead to the occurrence of additional side reactions (formation of coke). Larger clusters, such as Pt92, have moderate CS2 adsorption strength and rapidly generate CH2S* intermediates under H-atom attack, with the main rate-controlling step determined in the generation of CH3SH. A key hydrogenation step of small and large clusters is limited by relatively higher energy barriers, and medium-sized Pt clusters are more effective in converting CS2 to CH3SH under fixed energy input conditions. The results of theoretical calculations therefore revealed a certain particle size (geometry) sensitivity in the product selectivity of CS2 hydrogenation. 3.2 Synthesis of Pt NPs with different sizes The results of theoretical calculations confirm the effect of Pt particle geometry (size) on the reaction path energy barriers, but in practice the reaction is still governed by various factors, such as the size effect of Pt NPs real sites, and the effect of particle size on the hydrogen dissociation behavior (which could not be fully taken into account during the DFT calculations due to the spontaneous dissociation of hydrogen). Therefore, we prepared Pt NPs-loaded Al2O3 catalysts with different sizes by adopting a reduction-agglomeration strategy to deeply analyze the relationship between dimension and activity and product selectivity. Treatment of Al2O3 based catalysts under high-temperature H2 conditions does not change the nature of the support and can modulate the size of Pt NPs [22]. On the 1Pt/Al catalyst without reduction treatment, it can be found that the Pt atoms are well dispersed, and all Pt atoms exist as single atoms or small clusters (Fig. 2 a). H2 reduction at different temperatures caused varying degrees of agglomeration of Pt atoms (Fig. S1), the size of the Pt NPs increased between 1–5 nm (Fig. 2b–e) and the dispersion decreased from 83.5 % to 28.3 % (Table S1, CO pulse chemisorption) as the reduction temperature increased (0–700 ℃). The Pt species were stably anchored to the terminal hydroxyl groups of the Al2O3 support, resulting in single atom-level dispersion. Treatment with high-temperature H2 can lead to delocalization of Pt atoms from the anchoring sites, breaking of the PtO bond, and increased interaction between Pt atoms to aggregate into Pt NPs [21,23]. The Pt NPs on the surface of 1Pt/Al-400H were more homogeneous and the particle sizes were small concentrated between 1.5–2.0 nm, with an average value of 1.75 nm. On the surface of 1Pt/Al-500H, Pt NPs mostly distributed in the 2.0–3.0 nm region and the average size of the particles reached 2.70 nm. When the temperature was raised to 600 and 700 ℃, the average size of the Pt NPs reached 3.3 and 4.0 nm respectively, and majority of the particles concentrated between 3.0–4.0 nm and 3.5–5.0 nm respectively. It is worth noting that due to the low loading and the absence of a particularly large degree of agglomeration of the Pt atoms, the associated peaks of the Pt NPs were not observed in the XRD spectra (Figs. 2f and S3), only the characteristic peaks of γ-Al2O3 were found [24]. But lattice fringes of the Pt (111) plane are exposed in the TEM, with a lattice distance of d = 0.231 nm on 1Pt/Al-500H sample (Fig. S2) [25]. Therefore, under the condition of limited loading of Pt, it is of immense importance to increase the particle size of Pt by adjusting the reduction temperature, especially applied in the reaction under reducing atmosphere. Conversely, the conventional roasting method cannot guarantee the stability of the formed Pt NPs, which may be re-dispersed into small Pt clusters under a high temperature reducing atmosphere. 3.3 Activity and products selectivity of Pt/Al2O3 catalysts with different sizes 1Pt/Al catalysts with different particle sizes obtained by reduction-agglomeration strategy were applied in the reaction of CS2 hydrogenation. It was obvious that the CS2 hydrogenation activity, CH3SH at 250 ℃, and CH4 selectivity at 350 ℃ of 1Pt/Al-TH catalysts increased and then decreased with the Pt NPs (Fig. 3 a–c). The other major gaseous products are H2S and CO (Fig. S4), and the sulfur balance of the entire reaction is more than 95 %. Medium-sized Pt NPs (2.0–3.0 nm) have better CS2 conversion and CH3SH and CH4 selectivity, and either smaller (1.5–2.0 nm) or larger Pt particles (3.0–5.0 nm) are not favorable for deep hydrogenation of CS2 and increase the generation of by-products CO (Fig. S4) and coke. In addition, we compared the activity changes of Pt/Al-TH catalysts with different loadings (Figs. S5a and S5b). As the Pt loading was decreased to 0.2 wt% and 0.5 wt%, the reduction temperatures required to reach the optimal activity increased to 900 °C and 800 °C, respectively, at which point the 0.2Pt/Al-900H catalyst may not have reached the inflection point. The decrease in the number of Pt atoms at low loadings required higher temperatures to agglomerate into medium Pt NPs. To verify the synergistic effect of Pt NPs with various sizes, we physically mixed 1Pt/Al-xH (400, 500, 800, representing small, medium, and large Pt NPs respectively) with different size distributions in equal proportions, and compared the activity and selectivity with 1Pt/Al-500H. As presented in Fig. S6, the CS2 activity and CH3SH, CH4 selectivity of 1Pt/Al-mixH with various particle size distributions at 250–300 ℃ are lower than those of 1Pt/Al-500H. It was expected that if there was synergy, the activity should be equivalent or better, but the results did not match the synergistic effect. Nevertheless, due to the higher number of active centers for the optimal particle size, we found that the 1Pt/Al-500H catalysts showed better activity at 250 °C relative to 0.2Pt/Al-900H and 0.5Pt/Al-800H. By modulating the particle size, 1Pt/Al-500H showed enhanced activity, even exceeding the activity of 4Pt-fresh (Fig. S5c) with CH3SH and CH4 selectivity reaching 79 % (250 ℃) and 85 % (350 ℃) respectively (Fig. 3b and c). In general agreement with the DFT prediction, the synthesized Pt clusters with an average particle size of 2.7 nm showed the best CH3SH, CH4 selectivity and CS2 hydrogenation activity. Fitness adjustment by reduction temperature and Pt loading played a key role in the enhancement of CS2 hydrogenation activity and selectivity. Moreover, the CS2 conversion of 2Pt/Al-500H and 4Pt/Al-500H at 250 °C was only 70–80 % (Fig. S4d). In conjunction with the DFT calculations, the possible reason is that as the Pt loading is increased to 2 and 4 wt%, larger Pt NPs are formed at the same reduction temperature, but fewer Pt NPs are distributed in the appropriate size range (2.0–3.0 nm), which is unsuitable for the conversion of the CH2S* species to CH3SH. Thus, despite the large increase in the number of active centers, the 2Pt/Al-500H and 4Pt/Al-500H do not show a significant increase in CS2 conversion. To compare the turnover frequency (TOF) of individual active sites, the reaction conversion was uniformly controlled below 20 %, the 1Pt/Al-700H sample has the highest TOF of 0.833 S−1 (Table S1) and there showed a negative correlation between TOF and dispersion (Fig. 3d). In general, since the total number of Pt atoms is certain, the performance of 1Pt/Al-TH is affected by the number of active sites and the Pt NPs size, which results in a volcano-shaped curve of CH3SH selectivity as a function of particle size. Also, the Arrhenius curves (Fig. 3e) showed that 1Pt/Al-500H had the lowest activation energy (Ea = 67.195 kJ/mol), which was consistent with the activity evaluation results. However, it was worth noting that the number of H2 reaction orders increased with the average particle size, reaching 0.708 for 1Pt/Al-600H catalyst (Fig. S7), revealing that the larger Pt NPs are more sensitive to the H2 concentration and facilitate dissociating H2, which was one of the probable reasons for the lower energy barriers of the HCSS*-HCSSH* step. Subsequently, we examined the stability of the CS2 hydrogenation reaction at different temperatures, respectively. Both the reactant concentration and catalyst mass were scaled up to investigate whether the catalyst has the potential to stably produce the high value-added product CH3SH at 250 ℃. As shown in Fig. 3f, the CS2 conversion of 1Pt/Al-500H decreased from the initial 87 % to 78 % after 1500 min of reaction, but the selectivity of each product remained stable, the accumulation of intermediate products led to a decrease in activity. As shown in Fig. S8, after 24h of reaction at higher temperature (300 and 350 ℃), the catalyst activity decreased from 100 % to 93 % at 300 ℃ and maintained for 100 % at 350 ℃, which possessed stability in prolonged CS2 removal. Under high temperature conditions (350 ℃), the main product of CS2 hydrogenation is CH4 (selectivity 85 %), and the S balance is close to 100 %, which is suitable for long-term deep removal of CS2 in coke oven gas. Meanwhile, STEM and mapping characterization of the spent sample (Fig. S9) showed that the average particle size of the Pt NPs did not change significantly, with a value of 2.8 nm. 3.4 Electronic states and existing sites analysis of Pt species The high-temperature H2 reduction pretreatment can break the Pt-O bond and transform the oxidized Pt to the metallic state, forming Pt0 nanoparticles with different particle sizes. XPS spectra of Pt 4d were analyzed to understand the effect of increasing particle size on the chemical state of Pt species (Figs. 4a and S10). In the 1Pt/Al catalyst, the binding energy (BE) of Pt 4d5/2 was concentrated around 316.0 eV, indicating that the Pt species existed in the oxidized state (Ptσ+) [26]; after hydrogen reduction, the binding energy of the main peak of Pt 4d5/2 was continuously redshifted to around 314.2 eV, indicating that Ptσ+ progressively gained electrons and was reduced to Pt0 [27]. For 1Pt/Al, a peak splitting, two peaks can be clearly observed, belonging to Pt4+ near 317.2 eV and Pt2+ near 315.0 eV [27–29]. Nevertheless, a new Pt BE value of 1Pt/Al-400H, 1Pt/Al-500H, and 1Pt/Al-600H appeared (313.0, 312.9, and 312.8 eV, respectively), and the electronic energy levels were attributed to the Pt0 BE [26,27], which implied that the formation of enlarged Pt0 NPs. As the temperature of H2 treatment raised (400–600 ℃), the proportion of metallic Pt increased from 31.6 % to 55.2 %, implying that the increase in particle size was accompanied by the generation of more Pt0 species. Meanwhile, the decreasing XPS intensity of Pt 4d with increasing reduction temperature suggested a decline in the concentration of Pt species dispersed on the catalyst surface and the formation of larger Pt NPs (Fig. S10). In addition, the XPS survey analysis of the deactivated 1Pt/Al-500H was carried out. As presented in Fig. S11, the reason for the deactivation was that some of the Pt0 was oxidized to Pt2+ (Pt0 percentage decreased from 43.1 % to 27.3 %) under the continuous decomposition of CS2 and the formation of PtS [30], which resulted in the reduction of the Pt0 active centers for hydrogen dissociation. The dispersion state and electronic environment of Pt species on Al2O3 were verified using CO-DRIFTS at room temperature (Fig. 4 b–e). 1Pt/Al showed four peaks centered at 2139 cm−1 (CO linearly adsorbed on single-atom Pt species (CO-Ptδ+)), near 2089 cm−1 (CO linearly adsorbed on well-coordinated Pt (terrace sites), coordinated numbers (CN) ≥ 8), near 2043 cm−1 (CO linearly adsorbed on under-coordinated Pt (edge or corner sites), CN ≤ 6), and near 1844 cm−1 (bridged CO adsorption on medium-coordinated step sites, CN = 6–8) [31–34]. 1Pt/Al was not observed to have significant nanoparticles formation in the TEM images, but due to the extreme susceptibility of the oxidized state of Pt to be given electrons by reducing gas CO, the bridged adsorption peaks of CO appeared. It can be observed that the CO adsorption peaks of the H2-pretreated samples all shift to lower wavenumbers, which is attributed to the enrichment of electrons on Pt species. Moreover, the percentage of CO bridged adsorption peaks area on 1Pt/Al-400H, 1Pt/Al-500H, and 1Pt/Al-600H increased to 19.7 %, 40.5 %, and 30.1 %, and the proportions of well-coordinated Pt species were 23.6 %, 20.6 %, and 27.6 % respectively, which suggested the formation of continuous Pt (111) facets and larger nanoparticles. As the size of Pt NPs continued to enlarge, the under-coordinated Pt sites gradually shifted to medium-coordinated and well-coordinated Pt species [31,33,34], among which 1Pt/Al-500H exhibited the highest proportion of step sites (40.5 %) exposure. The increase in terrace sites (27.6 %) of 1Pt/Al-600H was accompanied by a decrease in step sites (30.1 %), which meant that the coordination number continued to increase as a function of NP size, and the number of Pt atoms located at the Pt-Al interface should also decrease accordingly. 3.5 Hydrogen adsorption behavior and spillover capacity analysis To investigate the effect of the Pt-Al interface on the adsorption and dissociation of H2, we constructed a Pt19/Al2O3 (100) model to analyze the differences in the behavior of H2 adsorption and dissociation on the surface of Pt19 clusters and at the Pt-Al interface (Fig. S12). It can be observed that a H2 molecule spontaneously dissociates either when they are placed at the top atom of the Pt19 cluster or near the Pt-Al interface. When the distance of a H2 molecule from the Pt19 cluster is increased, adsorption configurations appear at the apical position and at the Pt-Al interface, with adsorption energies of −0.009 eV and −0.04 eV, respectively. The very small adsorption energies imply that H2 is active at both positions and tends to desorb or dissociate. Therefore, the Pt-Al interface is not decisive for H2 dissociation. Subsequently, H2 adsorption behavior and spillover capacity of 1Pt/Al catalysts with different particle sizes were investigated. H2-TPD tests were operated for different samples after adsorption saturation at room temperature. Three desorption peaks can be observed in Fig. 5 a, centered at 150 ℃, 350 ℃ and ≥ 450 ℃, which were attributed to the detachment of metal weakly metal-bonded hydrogen, metal strongly bonded hydrogen, and spillover hydrogen from the Al2O3 support [16,35–38]. On 1Pt/Al and 1Pt/Al-400H, hydrogen was bonded to metal Pt and hardly spilled outward, while on 1Pt/Al-500H and 1Pt/Al-600H hydrogen spillover was more active and a desorption peak with higher temperatures appeared. After pretreatment of 1Pt/Al with hydrogen reduction at different temperatures, CO2-TPD tests were performed on the samples to determine the extent of H spillover laterally by observing the desorption peak located near 430 ℃ (Fig. 5b). Since hydrogen was usually stored on the non-reducible support Al2O3 in the form of H/OH pairs after spillover, which can be used as moderate adsorption sites for CO2 molecules [39,40], and the significant increase in peak area of the moderate basic sites on 1Pt/Al-500H confirmed the level of H spillover. Subsequently, the H spillover capacity of various samples was investigated by reducing a mixture of WO3 and catalyst with H2 at room temperature. The reaction mechanism is that WO3 combines with the H overflow from the catalyst to form HxWO3, and the color changes from yellow to dark green [41,42], hence, the H spillover ability can be judged by the degree of color change. As shown in Fig. 5c, the color of 1Pt/Al remained unchanged for 12 min, while 1Pt/Al-500H changed to dark green in 4 min and 1Pt/Al-600H for 8 min. Furthermore, the H2-DRIFTS (Fig. 5d) was conducted at 200 °C on the 1Pt/Al and 1Pt/Al-xH samples to observe the evolution of OH stretching (observed at ∼3450−3550 cm−1), which was an indicator of hydrogen spillover on Al2O3 [43]. The results showed that the 1Pt/Al-500H and 1Pt/Al-600H catalysts clearly exhibited the evolution of OH stretching, while the 1Pt/Al and 1Pt/Al-400H catalysts were negligible. Briefly, it can be concluded that hydrogen spillovers are more active on catalysts with Pt NPs sizes located between 2.0–3.0 nm compared to unreduced 1Pt/Al and smaller or larger Pt NPs loaded catalysts, which is also corroborated by H2-TPD, CO2-TPD and WO3 discoloration experiments. In summary, combining the XPS and CO-DRIFTS results, the hydrogen spillover ability of the catalyst also has a size effect, rather than being controlled by the number of Pt0 (well-coordinated Pt terrace sites) or Pt-Al interface number. That is, medium-coordinated Pt species (Pt step sites) are more conducive to the dissociation and overflow of hydrogen, which is also an important factor in improving the performance of CS2 hydrogenation. 3.6 In situ DRIFTS mechanistic study of CS2 hydrogenation The H2 reaction orders (Fig. 3e) and the efficiency of hydrogen spillovers (Fig. 5) do not have the same dependence on Pt NPs size, and the H2 reaction order is more sensitive to the amount of Pt0. Our previous studies have found that hydrogen spillover promotes the hydrogenation of HCSS* to CH2S* on the H/OH pairs of the support [16], which may serve as an auxiliary reaction pathway. To further verify the effects of the particle size of Pt NPs on the key intermediates and reaction mechanisms of the CS2 hydrogenation reaction, in situ DRIFTS experiments on 1Pt/Al-xH catalysts were conducted at 250 ℃. Before the test, all samples were first pretreated at 400 °C for 1 h under 10 % H2/N2 atmosphere. As shown in Figs. S13 and S14, several characteristic peaks appeared during the reaction: the SCS vibration of the bidentate HCSS* at 1345 cm−1 and the SCS vibration of the monodentate HCSS* at 1596 cm−1 [44–46], the CH vibration assigned to the CH2S* species at 2918 cm−1 [30], and the adsorbed CS2* at 1525 and 1540 cm−1 [47,48], as well as the CH vibrations attributed to the product CH3S* and CH4 species near 2982 cm−1 and 3014 cm−1 [49,50], respectively. When CS2 was adsorbed on the surface of 1Pt/Al-400H, it reacted with the surface H2O species (3389 cm−1) on Al2O3 to generate carbonate (HCSO2 −) species located near 1470 cm−1 [51], which proved that H/OH pairs were not generated through hydrogen spillover during the pretreatment process, thus led to the occurrence of the hydrolysis side reaction of CS2. In contrast, relatively more H/OH pairs remained on 1Pt/Al-500H and 1Pt/Al-600H, which contributed to the observation of the generation of a weak CH2S* species at 2915 or 2920 cm−1, and the intensity of this species increased after H2 passages. This phenomenon confirmed that the conversion of HCSS* to CH2S* species was positively correlated with the concentration of residual H/OH species on the Al2O3. After hydrogen injection, the H/OH pairs on 1Pt/Al-500H and 1Pt/Al-600H were replenished and strengthened until stabilized; whereas the change of this species on the surface of 1Pt/Al-400H was negligible, and only the accumulation of the intermediate bidentate HCSS* (1350 cm−1), was noticed, which highlighted that hydrogen spillover capacity of the catalyst was particularly critical for the generation of CH2S*. Subsequently the catalyst surface reaction was carried out using actual reaction conditions (200 ppm CS2 + 10 % H2). As shown in Figs. 6 and S14, the change of surface intermediates of 1Pt/Al-400H was insignificant, and only a slight generation of CH2S* was observed; according to DFT calculations, smaller Pt clusters are unfavorable for HCSSH* generation and then CH2S* formation, thus, the intensity of CH2S* species were not as much as that of 1Pt/Al-500H (600H) with larger Pt NPs size. Indeed, 1Pt/Al-400H has difficulty in efficiently converting HCSS* to CH2S* due to the small particle size of the Pt NPs, which leads to almost no subsequent products. While on 1Pt/Al-600H, although CH2S* was continuously generated and accumulated through the HCSS* pathway, it was still sticky to convert to CH3SH and CH4 due to the higher energy barrier of the CH2S*-CH3SH step on the larger Pt NPs, as well as the lack of spilled H2. Conversely, on 1Pt/Al-500H, a first increase and then decrease in CH2S* and CH3S* species can be observed, with CH3SH and CH4 products maintaining the same trend. This suggests that the energy barriers for both the generation of HCSSH* from HCSS* and CH3SH from CH2S* on 1Pt/Al-500H are moderate; meanwhile, the Pt NPs in the 2.0–3.0 nm region have the strongest hydrogen spillover capacity, which is favorable for the conversion of HCSS* to CH2S* and CH3SH. Therefore, the excellent selectivity stems from the moderate reaction energy barriers of rate-determining steps and the good hydrogen spillover ability, which are both related to the Pt NPs size. Based on DFT calculations and in situ DRIFTS results in this work and our previous research [16], the specific CH3SH and CH4 formation mechanisms are as follows (Eqs. (3–1) to (3–7)): (3-1) 4 H 2 → 8 H ∗ (3-2) C S 2 ad + H ∗ → H C S 2 ∗ ad (3-3) H C S 2 ∗ ad +2 H ∗ → C H 2 S ∗ ad +H S ∗ (3-4) C H 2 S ∗ ad +2 H ∗ → C H 3 SH (3-5) H S ∗ + H ∗ → H 2 S (3-6) C H 2 S ∗ ad +3 H ∗ → C H 4 +H S ∗ (3-7) 2H S ∗ + 2H ∗ → 2H 2 S Among them, steps (3–3) and (3–4) are the key rate-determining steps for the generation of CH3SH, while CH2S* and CH3S* are the crucial intermediates. At high temperatures, CH2S* is prone to directly deep hydrogenation to CH4. 4 Conclusions Gaseous organic sulfur compounds are not only directly hazardous to human health but are also important precursors of PM2.5 and ozone, as well as toxic to downstream reactors and catalysts in industrial production. Catalytic hydrogenation is one of the most effective methods for deep cleaning of industrial emissions of organic sulfur. Due to the presence of high concentration of methane (23–27 %) in coke oven gas, it is thermodynamically more feasible to convert CS2 into CH3SH for recycling, and the required temperature is lower. In addition, CH3SH (up to 500 mg/m3) generated under highly selective conditions can be liquefied and recycled as a raw material to produce methionine, which is more advantageous than the traditional technology of converting CO, H2 and H2S into methyl mercaptan under pressurized conditions, and has the potential to be used as an alternative synthesis route. Here, the key steps of CS2 hydrogenation (I) HCSS* − HCSSH and (II) CH2S* − CH3SH were found to be sensitive to Pt clusters size by DFT calculations, and highly dispersed Pt atoms on Al2O3 were aggregated into different sizes of Pt NPs by the reduction-aggregation method, among which the average particle size of 1Pt/Al-500H was 2.7 nm, which had the best low-temperature activity and CH3SH selectivity, with the activity even exceeding that of 4Pt/Al, and the product selectivity (80–85 %) remained stable in the 24 h experiment at 250 ℃. The following two points are summarized from the DFT calculations and experimental results: (1) 1Pt/Al-500H forms the best-sized active centers (2.0–3.0 nm) of Pt NPs and has the largest proportion of exposed moderate coordinated sites (step sites, CN = 6–8), which enhances the efficiency of hydrogen spillover to the supports after dissociation; (2) the medium-sized Pt NPs with moderate energy barriers in both key hydrogenation steps, together with the spilled hydrogen-assisted monodentate HCSS* pathway, performing the best activity and CH3SH and CH4 selectivity. We have analyzed the source of particle size sensitivity about the volatile organic sulfur pollutants (VOSPs) hydrogenation product selectivity from a new perspective, which provides innovative guides for the subsequent design of rationally sized noble metal catalysts. CRediT authorship contribution statement Yuxuan Xie: Writing – original draft, Investigation, Formal analysis, Data curation. Zhao Li: Methodology, Investigation, Data curation. Ziruo Zeng: Methodology, Data curation. Lina Sun: Data curation. Shuangyou Bao: Validation, Investigation. Xin Sun: Validation, Investigation. Kunlin Li: Investigation, Conceptualization. Chi Wang: Visualization, Supervision, Investigation. Fei Wang: Writing – review & editing, Project administration, Funding acquisition, Conceptualization. Ping Ning: Writing – review & editing, Project administration, Funding acquisition, Conceptualization. Kai Li: Writing – review & editing, Project administration, Funding acquisition, Conceptualization. Declaration of competing interest The authors declare that they have no known competing financial interests or personal relationships that could have appeared to influence the work reported in this paper. Acknowledgements This work was financially supported by the National Natural Science Foundation of China (Nos. 52370113, 52460012, 52470118), Yunnan Key Laboratory of Phosphorous Gypsum Resource Recycling and Ecological Utilization (202449CE340028). Appendix A Supplementary data Supplementary data to this article can be found online at https://doi.org/10.1016/j.jcat.2025.116198. Appendix A Supplementary data The following are the Supplementary data to this article: Supplementary Data 1 References [1] Y. Zhang Z. Wei Y. Zhu S. Tao M. Chen Z. Zhang Z. Jiang W. Shangguan RE-NiOx (RE=Ce, Y, La) composite oxides coupled plasma catalysis for benzene oxidation and by-product ozone removal J. Rare Earths 41 2023 789 800 Y. Zhang; Z. Wei; Y. Zhu; S. Tao; M. Chen; Z. Zhang; Z. Jiang; W. Shangguan, RE-NiOx (RE=Ce, Y, La) composite oxides coupled plasma catalysis for benzene oxidation and by-product ozone removal. J. Rare Earths 41 (2023) 789-800. [2] J. Song D. Wang M. Zhou X. You Q. Tan W. Liu L. Yu B. Wang W. Chen X. Zhang Carbon disulfide exposure induced lung function reduction partly through oxidative protein damage: A cross-sectional and longitudinal analysis J. Hazard. Mater. 454 2023 131464 J. Song, D. Wang, M. Zhou, X. You, Q. Tan, W. Liu, L. Yu, B. Wang, W. Chen, X. Zhang, Carbon disulfide exposure induced lung function reduction partly through oxidative protein damage: A cross-sectional and longitudinal analysis, J. Hazard. Mater. 454 (2023). [3] W. Qu M. Luo Z. Tang T. Zhong H. Zhao L. Hu D. Xia S. Tian D. Shu C. He Accelerated catalytic ozonation in a mesoporous carbon-supported atomic Fe-N4 sites nanoreactor: confinement effect and resistance to poisoning Environ. Sci. Technol. 57 2023 13205 13216 W. Qu, M. Luo, Z. Tang, T. Zhong, H. Zhao, L. Hu, D. Xia, S. Tian, D. Shu, C. He, Accelerated Catalytic Ozonation in a Mesoporous Carbon-Supported Atomic Fe-N4 Sites Nanoreactor: Confinement Effect and Resistance to Poisoning, Environ. Sci. Technol. (2023). [4] G. Xia X. Zhou J. Hu Z. Sun J. Yao D. Chen J. Wang Simultaneous removal of carbon disulfide and hydrogen sulfide from viscose fibre waste gas with a biotrickling filter in pilot scale J. Cleaner Prod. 230 2019 21 28 G. Xia, X. Zhou, J. Hu, Z. Sun, J. Yao, D. Chen, J. Wang, Simultaneous removal of carbon disulfide and hydrogen sulfide from viscose fibre waste gas with a biotrickling filter in pilot scale, J. Cleaner Prod. 230 (2019) 21-28. [5] C. Cai J. Li Y. He J. Jia Target the neglected VOCs emission from iron and steel industry in China for air quality improvement Front. Environ. Sci. Eng. 17 2023 95 C. Cai; J. Li; Y. He; J. Jia, Target the neglected VOCs emission from iron and steel industry in China for air quality improvement. Front. Environ. Sci. Eng. 17 (2023) 95. [6] K.L. McGeough R.M. Kalin P. Myles Carbon disulfide removal by zero valent iron Environ. Sci. Technol. 41 2007 4607 4612 K.L. McGeough, R.M. Kalin, P. Myles, Carbon disulfide removal by zero valent iron, Environ. Sci. Technol. 41 (2007) 4607-4612. [7] M.M. Gharehveran A.D. Shah Indirect photochemical formation of carbonyl sulfide and carbon disulfide in natural waters: role of organic sulfur precursors, water quality constituents, and temperature Environ. Sci. Technol. 52 2018 9108 9117 M.M. Gharehveran, A.D. Shah, Indirect Photochemical Formation of Carbonyl Sulfide and Carbon Disulfide in Natural Waters: Role of Organic Sulfur Precursors, Water Quality Constituents, and Temperature, Environ. Sci. Technol. 52 (2018) 9108-9117. [8] W. Zhou W.L. Teo S.Z.F. Phua S. Xi B. Chen D. Jana D. Wang C. Qian H. Wang H. Zhang Y. Zhao Impeding catalyst sulfur poisoning in aqueous solution by metal-organic framework composites Small Methods 4 2020 1900890 W. Zhou, W.L. Teo, S.Z.F. Phua, S. Xi, B. Chen, D. Jana, D. Wang, C. Qian, H. Wang, H. Zhang, Y. Zhao, Impeding Catalyst Sulfur Poisoning in Aqueous Solution by Metal-Organic Framework Composites, Small Methods 4 (2020). [9] F. Jiao H. Guo Y. Chai H. Awala S. Mintova C. Liu Synergy between a sulfur-tolerant Pt/Al2O3@sodalite core–shell catalyst and a CoMo/Al2O3 catalyst J. Catal. 368 2018 89 97 F. Jiao, H. Guo, Y. Chai, H. Awala, S. Mintova, C. Liu, Synergy between a sulfur-tolerant Pt/Al2O3@sodalite core–shell catalyst and a CoMo/Al2O3 catalyst, J. Catal. 368 (2018) 89-97. [10] Y. Kanda R. Saito T. Ono K. Kon T. Toyao S. Furukawa Y. Obora K.-I. Shimizu Enhancement of the hydrodesulfurization and C−S bond cleavage activities of rhodium phosphide catalysts by platinum addition J. Catal. 408 2022 294 302 Y. Kanda, R. Saito, T. Ono, K. Kon, T. Toyao, S. Furukawa, Y. Obora, K.-i. Shimizu, Enhancement of the hydrodesulfurization and C−S bond cleavage activities of rhodium phosphide catalysts by platinum addition, J. Catal. 408 (2022) 294-302. [11] P. Shi X. Li X. Zhou R. Prins Q. Sheng S. Shang C. Liu Desulfurization of 2-phenylcyclohexanethiol over Pd and Pt catalysts on γ-Al2O3 J. Catal. 428 2023 115198 P. Shi, X. Li, X. Zhou, R. Prins, Q. Sheng, S. Shang, C. Liu, Desulfurization of 2-phenylcyclohexanethiol over Pd and Pt catalysts on γ-Al2O3, J. Catal. 428 (2023) 115198. [12] Y. Long K. Yang Z. Gu S. Lin D. Li X. Zhu H. Wang K. Li Hydrogen generation from water splitting over polyfunctional perovskite oxygen carriers by using coke oven gas as reducing agent Appl. Catal., B 301 2022 120778 Y. Long, K. Yang, Z. Gu, S. Lin, D. Li, X. Zhu, H. Wang, K. Li, Hydrogen generation from water splitting over polyfunctional perovskite oxygen carriers by using coke oven gas as reducing agent, Appl. Catal., B 301 (2022). [13] E. Kamp H. Thielert O. von Morstein S. Kureti N. Schreiter J.-U. Repke Investigation on the simultaneous removal of COS, CS2 and O2 from coke oven gas by hydrogenation on a Pd/Al2O3 catalyst Catal. Sci. Technol. 10 2020 2961 2969 E. Kamp, H. Thielert, O. von Morstein, S. Kureti, N. Schreiter, J.-U. Repke, Investigation on the simultaneous removal of COS, CS2 and O2 from coke oven gas by hydrogenation on a Pd/Al2O3 catalyst, Catal. Sci. Technol. 10 (2020) 2961-2969. [14] H. Chen Z. Han X. Feng P. Liu J. Liu G. Liu W. Yuan T. Ren S. Zhou Solid-phase hydrogen in a magnesium–carbon composite for efficient hydrogenation of carbon disulfide J. Mater. Chem. A 6 2018 3055 3062 H. Chen, Z. Han, X. Feng, P. Liu, J. Liu, G. Liu, W. Yuan, T. Ren, S. Zhou, Solid-phase hydrogen in a magnesium–carbon composite for efficient hydrogenation of carbon disulfide, J. Mater. Chem. A 6 (2018) 3055-3062. [15] C. Peng D. Zeng J. Li S. Peng J. Xiong W. Wang Y. Chen H. Liu H. Liu R. Qin Synthesis of methyl mercaptan on mesoporous alumina prepared with hydroxysafflor yellow a as template: the synergistic effect of potassium and molybdenum Catalysts 11 2021 1365 C. Peng, D. Zeng, J. Li, S. Peng, J. Xiong, W. Wang, Y. Chen, H. Liu, H. Liu, R. Qin, Synthesis of Methyl Mercaptan on Mesoporous Alumina Prepared with Hydroxysafflor Yellow A as Template: The Synergistic Effect of Potassium and Molybdenum, Catalysts 11(2021), 1365. [16] Y. Xie Y. Li Z. Zeng P. Ning X. Sun F. Wang K. Li L. Wang Mechanism study of organic sulfur hydrogenation over Pt- and Pd-loaded alumina-based catalysts Environ. Sci. Technol. 57 2023 17553 17565 Y. Xie, Y. Li, Z. Zeng, P. Ning, X. Sun, F. Wang, K. Li, L. Wang, Mechanism Study of Organic Sulfur Hydrogenation over Pt- and Pd-Loaded Alumina-Based Catalysts, Environ. Sci. Technol. 57 (2023) 17553-17565. [17] M.E. Potter S.M. Madrigal E. Campbell L.J. Allen U. Vyas S. Parry A. Garcia-Zaragova L.M. Martinez-Prieto P. Ona-Burgos M. Lutzen C.D. Damsgaard E. Rodriguez-Castellon N. Schiaroli G. Fornasari P. Benito A.M. Beale A high pressure operando spectroscopy examination of bimetal interactions in ‘metal efficient’ palladium/In2O3/Al2O3 catalysts for CO2 hydrogenation Angew. Chem., Int. Ed. 62 2023 e202312645 M.E. Potter, S.M. Madrigal, E. Campbell, L.J. Allen, U. Vyas, S. Parry, A. Garcia-Zaragova, L.M. Martinez-Prieto, P. Ona-Burgos, M. Lutzen, C.D. Damsgaard, E. Rodriguez-Castellon, N. Schiaroli, G. Fornasari, P. Benito, A.M. Beale, A High Pressure Operando Spectroscopy Examination of Bimetal Interactions in 'Metal Efficient' Palladium/In2O3/Al2O3 Catalysts for CO2 Hydrogenation, Angew. Chem., Int. Ed. (2023). [18] G.-L. Hou E. Janssens Supported and isolated metal atoms and clusters as models for understanding the hydrogen economy Fundam. Res. 2023 G.-L. Hou, E. Janssens, Supported and Isolated Metal Atoms and Clusters as Models for Understanding the Hydrogen Economy. Fundam. Res. (2023). [19] M. Sun J. Liu C. Song Y. Ogata H. Rao X. Zhao H. Xu Y. Chen Different reaction mechanisms of ammonia oxidation reaction on Pt/Al2O3 and Pt/CeZrO2 with various Pt states ACS Appl. Mater. Interfaces 11 2019 23102 23111 M. Sun, J. Liu, C. Song, Y. Ogata, H. Rao, X. Zhao, H. Xu, Y. Chen, Different Reaction Mechanisms of Ammonia Oxidation Reaction on Pt/Al2O3 and Pt/CeZrO2 with Various Pt States, ACS Appl. Mater. Interfaces 11 (2019) 23102-23111. [20] F. Cao Z. Song Z. Zhang Y.-S. Xiao M. Zhang X. Hu Z.-W. Liu Y. Qu Size-controlled synthesis of Pd nanocatalysts on defect-engineered CeO2 for CO2 hydrogenation ACS Appl. Mater. Interfaces 13 2021 24957 24965 F. Cao, Z. Song, Z. Zhang, Y.-S. Xiao, M. Zhang, X. Hu, Z.-W. Liu, Y. Qu, Size-Controlled Synthesis of Pd Nanocatalysts on Defect-Engineered CeO2 for CO2 Hydrogenation, ACS Appl. Mater. Interfaces 13 (2021) 24957-24965. [21] Z. Li J. Zhao J. Gao Y. Li S. Bao K. Li P. Ning F. Wang “Reduction-aggregation” strategy to construct a low-cost and high-efficiency Ag/Al2O3 catalyst for NH3-SCO Sep. Purif. Technol. 317 2023 123881 Z. Li, J. Zhao, J. Gao, Y. Li, S. Bao, K. Li, P. Ning, F. Wang, “Reduction-aggregation” strategy to construct a low-cost and high-efficiency Ag/Al2O3 catalyst for NH3-SCO, Sep. Purif. Technol. 317 (2023) 123881. [22] F. Wang G. He B. Zhang M. Chen X. Chen C. Zhang H. He Insights into the activation effect of H2 pretreatment on Ag/Al2O3 catalyst for the selective oxidation of ammonia ACS Catal. 9 2019 1437 1445 F. Wang, G. He, B. Zhang, M. Chen, X. Chen, C. Zhang, H. He, Insights into the Activation Effect of H2 Pretreatment on Ag/Al2O3 Catalyst for the Selective Oxidation of Ammonia, ACS Catal. 9 (2019) 1437-1445. [23] F. Wang J. Ma S. Xin Q. Wang J. Xu C. Zhang H. He X.C. Zeng Resolving the puzzle of single-atom silver dispersion on nanosized γ-Al2O3 surface for high catalytic performance Nat. Commun. 11 2020 529 F. Wang, J. Ma, S. Xin, Q. Wang, J. Xu, C. Zhang, H. He, X.C. Zeng, Resolving the puzzle of single-atom silver dispersion on nanosized γ-Al2O3 surface for high catalytic performance, Nat. Commun. 11 (2020). [24] F. Wang J. Ma G. He M. Chen C. Zhang H. He Nanosize effect of Al2O3 in Ag/Al2O3 catalyst for the selective catalytic oxidation of ammonia ACS Catal. 8 2018 2670 2682 F. Wang, J. Ma, G. He, M. Chen, C. Zhang, H. He, Nanosize Effect of Al2O3 in Ag/Al2O3 Catalyst for the Selective Catalytic Oxidation of Ammonia, ACS Catal. 8 (2018) 2670-2682. [25] M. Carosso E. Vottero A. Lazzarini S. Morandi M. Manzoli K.A. Lomachenko M.J. Ruiz R. Pellegrini C. Lamberti A. Piovano E. Groppo Dynamics of reactive species and reactant-induced reconstruction of Pt clusters in Pt/Al2O3 catalysts ACS Catal. 9 2019 7124 7136 M. Carosso, E. Vottero, A. Lazzarini, S. Morandi, M. Manzoli, K.A. Lomachenko, M.J. Ruiz, R. Pellegrini, C. Lamberti, A. Piovano, E. Groppo, Dynamics of Reactive Species and Reactant-Induced Reconstruction of Pt Clusters in Pt/Al2O3 Catalysts, ACS Catal. 9 (2019) 7124-7136. [26] S.L. Bergman J. Granestrand Y. Tang R.S. París M. Nilsson F.F. Tao C. Tang S.J. Pennycook L.J. Pettersson S.L. Bernasek In-situ characterization by near-ambient pressure XPS of the catalytically active phase of Pt/Al2O3 during NO and CO oxidation Appl. Catal., B 220 2018 506 511 S.L. Bergman, J. Granestrand, Y. Tang, R.S. París, M. Nilsson, F.F. Tao, C. Tang, S.J. Pennycook, L.J. Pettersson, S.L. Bernasek, In-situ characterization by Near-Ambient Pressure XPS of the catalytically active phase of Pt/Al2O3 during NO and CO oxidation, Appl. Catal., B 220 (2018) 506-511. [27] J.C. Serrano-Ruiz G.W. Huber M.A. Sánchez-Castillo J.A. Dumesic F. Rodríguez-Reinoso A. Sepúlveda-Escribano Effect of Sn addition to Pt/CeO2–Al2O3 and Pt/Al2O3 catalysts: An XPS, 119Sn Mössbauer and microcalorimetry study J. Catal. 241 2006 378 388 J.C. Serrano-Ruiz, G.W. Huber, M.A. Sánchez-Castillo, J.A. Dumesic, F. Rodríguez-Reinoso, A. Sepúlveda-Escribano, Effect of Sn addition to Pt/CeO2–Al2O3 and Pt/Al2O3 catalysts: An XPS, 119Sn Mössbauer and microcalorimetry study, J. Catal. 241 (2006) 378-388. [28] R. Bouwman P. Biloen Valence state and interaction of platinum and germanium on γ-Al2O3 investigated by X-ray photoelectron spectroscopy J. Catal. 48 1977 209 216 R. Bouwman, P. Biloen, Valence state and interaction of platinum and germanium on γ-Al2O3 investigated by X-ray photoelectron spectroscopy, J. Catal. 48 (1977) 209-216. [29] J.Z. Shyu K. Otto Identification of platinum phases on γ-alumina by XPS Appl. Surf. Sci. 32 1988 246 252 J.Z. Shyu, K. Otto, Identification of platinum phases on γ-alumina by XPS, Appl. Surf. Sci. 32 (1988) 246-252. [30] R. Tian J. Lu Z. Xu W. Zhang J. Liu L. Wang Y. Xie Y. Zhao X. Cao Y. Luo Unraveling the synergistic reaction and the deactivation mechanism for the catalytic degradation of double components of sulfur-containing VOCs over ZSM-5-based materials Environ. Sci. Technol. 57 2023 1443 1455 R. Tian, J. Lu, Z. Xu, W. Zhang, J. Liu, L. Wang, Y. Xie, Y. Zhao, X. Cao, Y. Luo, Unraveling the Synergistic Reaction and the Deactivation Mechanism for the Catalytic Degradation of Double Components of Sulfur-Containing VOCs over ZSM-5-Based Materials, Environ. Sci. Technol. 57 (2023) 1443-1455. [31] M.J. Kale P. Christopher Utilizing quantitative in situ FTIR spectroscopy to identify well-coordinated Pt atoms as the active site for CO oxidation on Al2O3-supported Pt catalysts ACS Catal. 6 2016 5599 5609 M.J. Kale, P. Christopher, Utilizing Quantitative in Situ FTIR Spectroscopy To Identify Well-Coordinated Pt Atoms as the Active Site for CO Oxidation on Al2O3-Supported Pt Catalysts, ACS Catal. 6 (2016) 5599-5609. [32] K. Ding A. Gulec A.M. Johnson N.M. Schweitzer G.D. Stucky L.D. Marks P.C. Stair Identification of active sites in CO oxidation and water-gas shift over supported Pt catalysts Science 350 2015 189 192 K. Ding, A. Gulec, A.M. Johnson, N.M. Schweitzer, G.D. Stucky, L.D. Marks, P.C. Stair, Identification of active sites in CO oxidation and water-gas shift over supported Pt catalysts, Science 350 (2015) 189-192. [33] D. Childers A. Saha N. Schweitzer R.M. Rioux J.T. Miller R.J. Meyer Correlating heat of adsorption of CO to reaction selectivity: geometric effects vs electronic effects in neopentane isomerization over Pt and Pd catalysts ACS Catal. 3 2013 2487 2496 D. Childers, A. Saha, N. Schweitzer, R.M. Rioux, J.T. Miller, R.J. Meyer, Correlating Heat of Adsorption of CO to Reaction Selectivity: Geometric Effects vs Electronic Effects in Neopentane Isomerization over Pt and Pd Catalysts, ACS Catal. 3 (2013) 2487-2496. [34] A. Liu X. Liu L. Liu Y. Pu K. Guo W. Tan S. Gao Y. Luo S. Yu R. Si B. Shan F. Gao L. Dong Getting insights into the temperature-specific active sites on platinum nanoparticles for CO oxidation: a combined in situ spectroscopic and ab initio density functional theory study ACS Catal. 9 2019 7759 7768 A. Liu, X. Liu, L. Liu, Y. Pu, K. Guo, W. Tan, S. Gao, Y. Luo, S. Yu, R. Si, B. Shan, F. Gao, L. Dong, Getting Insights into the Temperature-Specific Active Sites on Platinum Nanoparticles for CO Oxidation: A Combined in Situ Spectroscopic and ab Initio Density Functional Theory Study, ACS Catal. 9 (2019) 7759-7768. [35] A. Quindimil M.C. Bacariza J.A. Gonzalez-Marcos C. Henriques J.R. Gonzalez-Velasco Enhancing the CO2 methanation activity of gamma-Al2O3 supported mono- and bi-metallic catalysts prepared by glycerol assisted impregnation Appl. Catal., B 296 2021 120322 A. Quindimil, M.C. Bacariza, J.A. Gonzalez-Marcos, C. Henriques, J.R. Gonzalez-Velasco, Enhancing the CO2 methanation activity of gamma-Al2O3 supported mono- and bi-metallic catalysts prepared by glycerol assisted impregnation, Appl. Catal., B 296 (2021). [36] Z. Zhong J. Li M. Jian R. Shu Z. Tian C. Wang Y. Chen N. Shi Y. Wu Hydrodeoxygenation of lignin-derived phenolic compounds over Ru/TiO2 catalyst: Effect of TiO2 morphology Fuel 333 2023 126241 Z. Zhong, J. Li, M. Jian, R. Shu, Z. Tian, C. Wang, Y. Chen, N. Shi, Y. Wu, Hydrodeoxygenation of lignin-derived phenolic compounds over Ru/TiO2 catalyst: Effect of TiO2 morphology, Fuel 333 (2023) 126241. [37] L.-L. Ling W. Yang P. Yan M. Wang H.-L. Jiang Light-assisted CO2 hydrogenation over Pd3Cu@UiO-66 promoted by active sites in close proximity Angew. Chem., Int. Ed. 61 2022 e202116396 L.-L. Ling, W. Yang, P. Yan, M. Wang, H.-L. Jiang, Light-Assisted CO2 Hydrogenation over Pd3Cu@UiO-66 Promoted by Active Sites in Close Proximity, Angew. Chem., Int. Ed. 61 (2022) e202116396. [38] Y. Feng Y. Xie Y. Yu Y. Chen Q. Liu H. Bao F. Luo S. Pan Z. Yang Electronic metal-support interaction induces hydrogen spillover and platinum utilization in hydrogen evolution reaction Angew. Chem., Int. Ed. 64 2025 e202413417 Y. Feng, Y. Xie, Y. Yu, Y. Chen, Q. Liu, H. Bao, F. Luo, S. Pan, Z. Yang, Electronic Metal-Support Interaction Induces Hydrogen Spillover and Platinum Utilization in Hydrogen Evolution Reaction, Angew. Chem., Int. Ed. 64 (2025) e202413417. [39] K.N. Papageridis N.D. Charisiou S. Douvartzides V. Sebastian S.J. Hinder M.A. Baker A.A. AlKhoori S.I. AlKhoori K. Polychronopoulou M.A. Goula Continuous selective deoxygenation of palm oil for renewable diesel production over Ni catalysts supported on Al2O3 and La2O3-Al2O3 RSC Adv. 11 2021 8569 8584 K.N. Papageridis, N.D. Charisiou, S. Douvartzides, V. Sebastian, S.J. Hinder, M.A. Baker, A.A. AlKhoori, S.I. AlKhoori, K. Polychronopoulou, M.A. Goula, Continuous selective deoxygenation of palm oil for renewable diesel production over Ni catalysts supported on Al2O3 and La2O3-Al2O3, RSC Adv. 11 (2021) 8569-8584. [40] D. Wierzbicki R. Debek M. Motak T. Grzybek M.E. Galvez P. Da Costa Novel Ni-La-hydrotalcite derived catalysts for CO2 methanation Catal. Commun. 83 2016 5 8 D. Wierzbicki, R. Debek, M. Motak, T. Grzybek, M.E. Galvez, P. Da Costa, Novel Ni-La-hydrotalcite derived catalysts for CO2 methanation, Catal. Commun. 83 (2016) 5-8. [41] X. Liu Y. Ren M. Wang X. Ren J. Liu Q. Yang Cooperation of Pt and TiOX in the hydrogenation of nitrobenzothiazole ACS Catal. 12 2022 11369 11379 X. Liu, Y. Ren, M. Wang, X. Ren, J. Liu, Q. Yang, Cooperation of Pt and TiOX in the Hydrogenation of Nitrobenzothiazole, ACS Catal. 12 (2022) 11369-11379. [42] C. Xie W. Chen S. Du D. Yan Y. Zhang J. Chen B. Liu S. Wang In-situ phase transition of WO3 boosting electron and hydrogen transfer for enhancing hydrogen evolution on Pt Nano Energy 71 2020 104653 C. Xie, W. Chen, S. Du, D. Yan, Y. Zhang, J. Chen, B. Liu, S. Wang, In-situ phase transition of WO3 boosting electron and hydrogen transfer for enhancing hydrogen evolution on Pt, Nano Energy, 71 (2020) 104653. [43] H. Kim J.H. Park J.-M. Ha D.H. Kim Effect of hydrogen spillover on the Ru/TiO2-catalyzed guaiacol hydrodeoxygenation: rutile vs anatase TiO2 ACS Catal. 13 2023 11857 11870 H. Kim, J.H. Park, J.-M. Ha, D.H. Kim, Effect of Hydrogen Spillover on the Ru/TiO2-Catalyzed Guaiacol Hydrodeoxygenation: Rutile vs Anatase TiO2, ACS Catal. 13 (2023) 11857-11870. [44] W. Li G. Zhang X. Jiang Y. Liu J. Zhu F. Ding Z. Liu X. Guo C. Song CO2 hydrogenation on unpromoted and M-promoted Co/TiO2 catalysts (M = Zr, K, Cs): effects of crystal phase of supports and metal-support interaction on tuning product distribution ACS Catal. 9 2019 2739 2751 W. Li, G. Zhang, X. Jiang, Y. Liu, J. Zhu, F. Ding, Z. Liu, X. Guo, C. Song, CO2 Hydrogenation on Unpromoted and M-Promoted Co/TiO2 Catalysts (M = Zr, K, Cs): Effects of Crystal Phase of Supports and Metal-Support Interaction on Tuning Product Distribution, ACS Catal. 9 (2019) 2739-2751. [45] Q. Pan J. Peng T. Sun S. Wang S. Wang Insight into the reaction route of CO2 methanation: Promotion effect of medium basic sites Catal. Commun. 45 2014 74 78 Q. Pan, J. Peng, T. Sun, S. Wang, S. Wang, Insight into the reaction route of CO2 methanation: Promotion effect of medium basic sites, Catal. Commun. 45 (2014) 74-78. [46] Y. Yan Y.H. Dai H. He Y.B. Yu Y.H. Yang A novel W-doped Ni-Mg mixed oxide catalyst for CO2 methanation Appl. Catal., B 196 2016 108 116 Y. Yan, Y.H. Dai, H. He, Y.B. Yu, Y.H. Yang, A novel W-doped Ni-Mg mixed oxide catalyst for CO2 methanation, Appl. Catal., B 196 (2016) 108-116. [47] X.Q. Yao Y.W. Li Density functional theory study on the hydrodesulfurization reactions of COS and CS2 with Mo3S9 model catalyst J. Mol. Struct.:Theochem. 899 2009 32 41 X.Q. Yao, Y.W. Li, Density functional theory study on the hydrodesulfurization reactions of COS and CS2 with Mo3S9 model catalyst, J. Mol. Struct.:THEOCHEM 899 (2009) 32-41. [48] A.H. Zeng Q.Y. Kong Y. Wang M.F. Zhou Matrix isolation infrared spectroscopic and density functional theoretical studies of the reactions of silver and gold atoms with carbon disulfide Chem. Phys. 292 2003 111 117 A.H. Zeng, Q.Y. Kong, Y. Wang, M.F. Zhou, Matrix isolation infrared spectroscopic and density functional theoretical studies of the reactions of silver and gold atoms with carbon disulfide, Chem. Phys. 292 (2003) 111-117. [49] X. Wang H. Shi J. Szanyi Controlling selectivities in CO2 reduction through mechanistic understanding Nat. Commun. 8 2017 513 X. Wang, H. Shi, J. Szanyi, Controlling selectivities in CO2 reduction through mechanistic understanding, Nat. Commun. 8 (2017). [50] S. Bai Y. Xu P. Wang Q. Shao X. Huang Activating and converting CH4 to CH3OH via the CuPdO2/CuO nanointerface ACS Catal. 9 2019 6938 6944 S. Bai, Y. Xu, P. Wang, Q. Shao, X. Huang, Activating and Converting CH4 to CH3OH via the CuPdO2/CuO Nanointerface, ACS Catal. 9 (2019) 6938-6944. [51] W. Li X. Nie H. Yang X. Wang F. Polo-Garzon Z. Wu J. Zhu J. Wang Y. Liu C. Shi C. Song X. Guo Crystallographic dependence of CO2 hydrogenation pathways over HCP-Co and FCC-Co catalysts Appl. Catal., B 315 2022 121529 W. Li, X. Nie, H. Yang, X. Wang, F. Polo-Garzon, Z. Wu, J. Zhu, J. Wang, Y. Liu, C. Shi, C. Song, X. Guo, Crystallographic dependence of CO2 hydrogenation pathways over HCP-Co and FCC-Co catalysts, Appl. Catal., B 315 (2022) 121529.",
      "scopus-id": "105004350287",
      "coredata": {
        "eid": "1-s2.0-S0021951725002635",
        "dc:description": "To investigate the mechanism of the role of active center size on the selectivity of methyl mercaptan (CH3SH) and methane (CH4) in the deep hydrogenation reaction of carbon disulfide (CS2), it was first derived from DFT calculations that the Pt cluster geometries showed a decreasing and increasing pattern on the energy barriers of the two key hydrogenation steps: (I) HCSS* to HCSSH* and (II) deep hydrogenation of CH2S* to CH3SH. For further validation, we synthesized Pt NPs with varied average sizes (1.7–4.0 nm) using a reduction-agglomeration strategy to probe the source of size sensitivity at low Pt loading. It was found that the active centers of Pt NPs located in the 2.0–3.0 nm region have the highest proportion of medium-coordinated Pt sites, which can effectively promote hydrogen spillover and enhance the HCSS* pathway. Finally, with this modulation strategy, the catalytic activity and selectivity were significantly improved at 1 wt% Pt loading, which exceeded that of the fresh 4 wt% Pt/Al2O3 catalyst, and the long-term stable production of CH3SH (selectivity was maintained at 80 %) was achieved at 250 ℃ in the high-concentration CS2 environment.",
        "openArchiveArticle": "false",
        "prism:coverDate": "2025-08-31",
        "openaccessUserLicense": null,
        "prism:aggregationType": "Journal",
        "prism:url": "https://api.elsevier.com/content/article/pii/S0021951725002635",
        "dc:creator": [
          {
            "@_fa": "true",
            "$": "Xie, Yuxuan"
          },
          {
            "@_fa": "true",
            "$": "Li, Zhao"
          },
          {
            "@_fa": "true",
            "$": "Zeng, Ziruo"
          },
          {
            "@_fa": "true",
            "$": "Sun, Lina"
          },
          {
            "@_fa": "true",
            "$": "Bao, Shuangyou"
          },
          {
            "@_fa": "true",
            "$": "Sun, Xin"
          },
          {
            "@_fa": "true",
            "$": "Li, Kunlin"
          },
          {
            "@_fa": "true",
            "$": "Wang, Chi"
          },
          {
            "@_fa": "true",
            "$": "Wang, Fei"
          },
          {
            "@_fa": "true",
            "$": "Ning, Ping"
          },
          {
            "@_fa": "true",
            "$": "Li, Kai"
          }
        ],
        "link": [
          {
            "@_fa": "true",
            "@rel": "self",
            "@href": "https://api.elsevier.com/content/article/pii/S0021951725002635"
          },
          {
            "@_fa": "true",
            "@rel": "scidir",
            "@href": "https://www.sciencedirect.com/science/article/pii/S0021951725002635"
          }
        ],
        "dc:format": "application/json",
        "openaccessType": null,
        "pii": "S0021-9517(25)00263-5",
        "prism:volume": "448",
        "articleNumber": "116198",
        "prism:publisher": "Elsevier Inc. All rights are reserved, including those for text and data mining, AI training, and similar technologies.",
        "dc:title": "Probing the particle size effect of carbon disulfide deep hydrogenation over low-loading Pt/Al2O3 catalysts",
        "prism:copyright": "© 2025 Elsevier Inc. All rights are reserved, including those for text and data mining, AI training, and similar technologies.",
        "openaccess": "0",
        "prism:issn": "00219517",
        "dcterms:subject": [
          {
            "@_fa": "true",
            "$": "CS2 hydrogenation"
          },
          {
            "@_fa": "true",
            "$": "Pt-based catalysts"
          },
          {
            "@_fa": "true",
            "$": "Size effect"
          },
          {
            "@_fa": "true",
            "$": "Hydrogen spillover"
          },
          {
            "@_fa": "true",
            "$": "CH3SH production"
          }
        ],
        "openaccessArticle": "false",
        "prism:publicationName": "Journal of Catalysis",
        "openaccessSponsorType": null,
        "prism:pageRange": "116198",
        "pubType": "fla",
        "prism:coverDisplayDate": "August 2025",
        "prism:doi": "10.1016/j.jcat.2025.116198",
        "prism:startingPage": "116198",
        "dc:identifier": "doi:10.1016/j.jcat.2025.116198",
        "openaccessSponsorName": null
      },
      "objects": {
        "object": [
          {
            "@category": "standard",
            "@height": "595",
            "@width": "734",
            "@_fa": "true",
            "$": "https://api.elsevier.com/content/object/eid/1-s2.0-S0021951725002635-gr6.jpg?httpAccept=%2A%2F%2A",
            "@multimediatype": "JPEG image file",
            "@type": "IMAGE-DOWNSAMPLED",
            "@size": "119985",
            "@ref": "gr6",
            "@mimetype": "image/jpeg"
          },
          {
            "@category": "standard",
            "@height": "449",
            "@width": "713",
            "@_fa": "true",
            "$": "https://api.elsevier.com/content/object/eid/1-s2.0-S0021951725002635-gr4.jpg?httpAccept=%2A%2F%2A",
            "@multimediatype": "JPEG image file",
            "@type": "IMAGE-DOWNSAMPLED",
            "@size": "88643",
            "@ref": "gr4",
            "@mimetype": "image/jpeg"
          },
          {
            "@category": "standard",
            "@height": "466",
            "@width": "713",
            "@_fa": "true",
            "$": "https://api.elsevier.com/content/object/eid/1-s2.0-S0021951725002635-gr5.jpg?httpAccept=%2A%2F%2A",
            "@multimediatype": "JPEG image file",
            "@type": "IMAGE-DOWNSAMPLED",
            "@size": "116811",
            "@ref": "gr5",
            "@mimetype": "image/jpeg"
          },
          {
            "@category": "standard",
            "@height": "477",
            "@width": "712",
            "@_fa": "true",
            "$": "https://api.elsevier.com/content/object/eid/1-s2.0-S0021951725002635-gr2.jpg?httpAccept=%2A%2F%2A",
            "@multimediatype": "JPEG image file",
            "@type": "IMAGE-DOWNSAMPLED",
            "@size": "89095",
            "@ref": "gr2",
            "@mimetype": "image/jpeg"
          },
          {
            "@category": "standard",
            "@height": "200",
            "@width": "329",
            "@_fa": "true",
            "$": "https://api.elsevier.com/content/object/eid/1-s2.0-S0021951725002635-ga1.jpg?httpAccept=%2A%2F%2A",
            "@multimediatype": "JPEG image file",
            "@type": "IMAGE-DOWNSAMPLED",
            "@size": "30606",
            "@ref": "ga1",
            "@mimetype": "image/jpeg"
          },
          {
            "@category": "standard",
            "@height": "624",
            "@width": "713",
            "@_fa": "true",
            "$": "https://api.elsevier.com/content/object/eid/1-s2.0-S0021951725002635-gr3.jpg?httpAccept=%2A%2F%2A",
            "@multimediatype": "JPEG image file",
            "@type": "IMAGE-DOWNSAMPLED",
            "@size": "116910",
            "@ref": "gr3",
            "@mimetype": "image/jpeg"
          },
          {
            "@category": "standard",
            "@height": "835",
            "@width": "713",
            "@_fa": "true",
            "$": "https://api.elsevier.com/content/object/eid/1-s2.0-S0021951725002635-gr1.jpg?httpAccept=%2A%2F%2A",
            "@multimediatype": "JPEG image file",
            "@type": "IMAGE-DOWNSAMPLED",
            "@size": "202307",
            "@ref": "gr1",
            "@mimetype": "image/jpeg"
          },
          {
            "@category": "thumbnail",
            "@height": "164",
            "@width": "202",
            "@_fa": "true",
            "$": "https://api.elsevier.com/content/object/eid/1-s2.0-S0021951725002635-gr6.sml?httpAccept=%2A%2F%2A",
            "@multimediatype": "GIF image file",
            "@type": "IMAGE-THUMBNAIL",
            "@size": "24669",
            "@ref": "gr6",
            "@mimetype": "image/gif"
          },
          {
            "@category": "thumbnail",
            "@height": "138",
            "@width": "219",
            "@_fa": "true",
            "$": "https://api.elsevier.com/content/object/eid/1-s2.0-S0021951725002635-gr4.sml?httpAccept=%2A%2F%2A",
            "@multimediatype": "GIF image file",
            "@type": "IMAGE-THUMBNAIL",
            "@size": "11959",
            "@ref": "gr4",
            "@mimetype": "image/gif"
          },
          {
            "@category": "thumbnail",
            "@height": "143",
            "@width": "219",
            "@_fa": "true",
            "$": "https://api.elsevier.com/content/object/eid/1-s2.0-S0021951725002635-gr5.sml?httpAccept=%2A%2F%2A",
            "@multimediatype": "GIF image file",
            "@type": "IMAGE-THUMBNAIL",
            "@size": "17501",
            "@ref": "gr5",
            "@mimetype": "image/gif"
          },
          {
            "@category": "thumbnail",
            "@height": "147",
            "@width": "219",
            "@_fa": "true",
            "$": "https://api.elsevier.com/content/object/eid/1-s2.0-S0021951725002635-gr2.sml?httpAccept=%2A%2F%2A",
            "@multimediatype": "GIF image file",
            "@type": "IMAGE-THUMBNAIL",
            "@size": "21438",
            "@ref": "gr2",
            "@mimetype": "image/gif"
          },
          {
            "@category": "thumbnail",
            "@height": "133",
            "@width": "219",
            "@_fa": "true",
            "$": "https://api.elsevier.com/content/object/eid/1-s2.0-S0021951725002635-ga1.sml?httpAccept=%2A%2F%2A",
            "@multimediatype": "GIF image file",
            "@type": "IMAGE-THUMBNAIL",
            "@size": "16183",
            "@ref": "ga1",
            "@mimetype": "image/gif"
          },
          {
            "@category": "thumbnail",
            "@height": "164",
            "@width": "187",
            "@_fa": "true",
            "$": "https://api.elsevier.com/content/object/eid/1-s2.0-S0021951725002635-gr3.sml?httpAccept=%2A%2F%2A",
            "@multimediatype": "GIF image file",
            "@type": "IMAGE-THUMBNAIL",
            "@size": "12154",
            "@ref": "gr3",
            "@mimetype": "image/gif"
          },
          {
            "@category": "thumbnail",
            "@height": "164",
            "@width": "140",
            "@_fa": "true",
            "$": "https://api.elsevier.com/content/object/eid/1-s2.0-S0021951725002635-gr1.sml?httpAccept=%2A%2F%2A",
            "@multimediatype": "GIF image file",
            "@type": "IMAGE-THUMBNAIL",
            "@size": "13246",
            "@ref": "gr1",
            "@mimetype": "image/gif"
          },
          {
            "@category": "high",
            "@height": "2631",
            "@width": "3248",
            "@_fa": "true",
            "$": "https://api.elsevier.com/content/object/eid/1-s2.0-S0021951725002635-gr6_lrg.jpg?httpAccept=%2A%2F%2A",
            "@multimediatype": "JPEG image file",
            "@type": "IMAGE-HIGH-RES",
            "@size": "907035",
            "@ref": "gr6",
            "@mimetype": "image/jpeg"
          },
          {
            "@category": "high",
            "@height": "1752",
            "@width": "2780",
            "@_fa": "true",
            "$": "https://api.elsevier.com/content/object/eid/1-s2.0-S0021951725002635-gr4_lrg.jpg?httpAccept=%2A%2F%2A",
            "@multimediatype": "JPEG image file",
            "@type": "IMAGE-HIGH-RES",
            "@size": "469557",
            "@ref": "gr4",
            "@mimetype": "image/jpeg"
          },
          {
            "@category": "high",
            "@height": "2063",
            "@width": "3156",
            "@_fa": "true",
            "$": "https://api.elsevier.com/content/object/eid/1-s2.0-S0021951725002635-gr5_lrg.jpg?httpAccept=%2A%2F%2A",
            "@multimediatype": "JPEG image file",
            "@type": "IMAGE-HIGH-RES",
            "@size": "704757",
            "@ref": "gr5",
            "@mimetype": "image/jpeg"
          },
          {
            "@category": "high",
            "@height": "1305",
            "@width": "1949",
            "@_fa": "true",
            "$": "https://api.elsevier.com/content/object/eid/1-s2.0-S0021951725002635-gr2_lrg.jpg?httpAccept=%2A%2F%2A",
            "@multimediatype": "JPEG image file",
            "@type": "IMAGE-HIGH-RES",
            "@size": "306432",
            "@ref": "gr2",
            "@mimetype": "image/jpeg"
          },
          {
            "@category": "high",
            "@height": "886",
            "@width": "1460",
            "@_fa": "true",
            "$": "https://api.elsevier.com/content/object/eid/1-s2.0-S0021951725002635-ga1_lrg.jpg?httpAccept=%2A%2F%2A",
            "@multimediatype": "JPEG image file",
            "@type": "IMAGE-HIGH-RES",
            "@size": "216795",
            "@ref": "ga1",
            "@mimetype": "image/jpeg"
          },
          {
            "@category": "high",
            "@height": "2761",
            "@width": "3156",
            "@_fa": "true",
            "$": "https://api.elsevier.com/content/object/eid/1-s2.0-S0021951725002635-gr3_lrg.jpg?httpAccept=%2A%2F%2A",
            "@multimediatype": "JPEG image file",
            "@type": "IMAGE-HIGH-RES",
            "@size": "659377",
            "@ref": "gr3",
            "@mimetype": "image/jpeg"
          },
          {
            "@category": "high",
            "@height": "3268",
            "@width": "2791",
            "@_fa": "true",
            "$": "https://api.elsevier.com/content/object/eid/1-s2.0-S0021951725002635-gr1_lrg.jpg?httpAccept=%2A%2F%2A",
            "@multimediatype": "JPEG image file",
            "@type": "IMAGE-HIGH-RES",
            "@size": "1038815",
            "@ref": "gr1",
            "@mimetype": "image/jpeg"
          },
          {
            "@category": "standard",
            "@_fa": "true",
            "$": "https://api.elsevier.com/content/object/eid/1-s2.0-S0021951725002635-mmc1.docx?httpAccept=%2A%2F%2A",
            "@multimediatype": "Microsoft Word file",
            "@type": "APPLICATION",
            "@size": "4257779",
            "@ref": "mmc1",
            "@mimetype": "application/word"
          },
          {
            "@category": "thumbnail",
            "@_fa": "true",
            "$": "https://api.elsevier.com/content/object/eid/1-s2.0-S0021951725002635-si1.svg?httpAccept=%2A%2F%2A",
            "@multimediatype": "Scalable Vector Graphics file",
            "@type": "ALTIMG",
            "@size": "22423",
            "@ref": "si1",
            "@mimetype": "image/svg+xml"
          },
          {
            "@category": "thumbnail",
            "@_fa": "true",
            "$": "https://api.elsevier.com/content/object/eid/1-s2.0-S0021951725002635-si10.svg?httpAccept=%2A%2F%2A",
            "@multimediatype": "Scalable Vector Graphics file",
            "@type": "ALTIMG",
            "@size": "13824",
            "@ref": "si10",
            "@mimetype": "image/svg+xml"
          },
          {
            "@category": "thumbnail",
            "@_fa": "true",
            "$": "https://api.elsevier.com/content/object/eid/1-s2.0-S0021951725002635-si11.svg?httpAccept=%2A%2F%2A",
            "@multimediatype": "Scalable Vector Graphics file",
            "@type": "ALTIMG",
            "@size": "7007",
            "@ref": "si11",
            "@mimetype": "image/svg+xml"
          },
          {
            "@category": "thumbnail",
            "@_fa": "true",
            "$": "https://api.elsevier.com/content/object/eid/1-s2.0-S0021951725002635-si12.svg?httpAccept=%2A%2F%2A",
            "@multimediatype": "Scalable Vector Graphics file",
            "@type": "ALTIMG",
            "@size": "13653",
            "@ref": "si12",
            "@mimetype": "image/svg+xml"
          },
          {
            "@category": "thumbnail",
            "@_fa": "true",
            "$": "https://api.elsevier.com/content/object/eid/1-s2.0-S0021951725002635-si13.svg?httpAccept=%2A%2F%2A",
            "@multimediatype": "Scalable Vector Graphics file",
            "@type": "ALTIMG",
            "@size": "7880",
            "@ref": "si13",
            "@mimetype": "image/svg+xml"
          },
          {
            "@category": "thumbnail",
            "@_fa": "true",
            "$": "https://api.elsevier.com/content/object/eid/1-s2.0-S0021951725002635-si2.svg?httpAccept=%2A%2F%2A",
            "@multimediatype": "Scalable Vector Graphics file",
            "@type": "ALTIMG",
            "@size": "25092",
            "@ref": "si2",
            "@mimetype": "image/svg+xml"
          },
          {
            "@category": "thumbnail",
            "@_fa": "true",
            "$": "https://api.elsevier.com/content/object/eid/1-s2.0-S0021951725002635-si3.svg?httpAccept=%2A%2F%2A",
            "@multimediatype": "Scalable Vector Graphics file",
            "@type": "ALTIMG",
            "@size": "23900",
            "@ref": "si3",
            "@mimetype": "image/svg+xml"
          },
          {
            "@category": "thumbnail",
            "@_fa": "true",
            "$": "https://api.elsevier.com/content/object/eid/1-s2.0-S0021951725002635-si4.svg?httpAccept=%2A%2F%2A",
            "@multimediatype": "Scalable Vector Graphics file",
            "@type": "ALTIMG",
            "@size": "23456",
            "@ref": "si4",
            "@mimetype": "image/svg+xml"
          },
          {
            "@category": "thumbnail",
            "@_fa": "true",
            "$": "https://api.elsevier.com/content/object/eid/1-s2.0-S0021951725002635-si5.svg?httpAccept=%2A%2F%2A",
            "@multimediatype": "Scalable Vector Graphics file",
            "@type": "ALTIMG",
            "@size": "24735",
            "@ref": "si5",
            "@mimetype": "image/svg+xml"
          },
          {
            "@category": "thumbnail",
            "@_fa": "true",
            "$": "https://api.elsevier.com/content/object/eid/1-s2.0-S0021951725002635-si6.svg?httpAccept=%2A%2F%2A",
            "@multimediatype": "Scalable Vector Graphics file",
            "@type": "ALTIMG",
            "@size": "25505",
            "@ref": "si6",
            "@mimetype": "image/svg+xml"
          },
          {
            "@category": "thumbnail",
            "@_fa": "true",
            "$": "https://api.elsevier.com/content/object/eid/1-s2.0-S0021951725002635-si7.svg?httpAccept=%2A%2F%2A",
            "@multimediatype": "Scalable Vector Graphics file",
            "@type": "ALTIMG",
            "@size": "6304",
            "@ref": "si7",
            "@mimetype": "image/svg+xml"
          },
          {
            "@category": "thumbnail",
            "@_fa": "true",
            "$": "https://api.elsevier.com/content/object/eid/1-s2.0-S0021951725002635-si8.svg?httpAccept=%2A%2F%2A",
            "@multimediatype": "Scalable Vector Graphics file",
            "@type": "ALTIMG",
            "@size": "12798",
            "@ref": "si8",
            "@mimetype": "image/svg+xml"
          },
          {
            "@category": "thumbnail",
            "@_fa": "true",
            "$": "https://api.elsevier.com/content/object/eid/1-s2.0-S0021951725002635-si9.svg?httpAccept=%2A%2F%2A",
            "@multimediatype": "Scalable Vector Graphics file",
            "@type": "ALTIMG",
            "@size": "13854",
            "@ref": "si9",
            "@mimetype": "image/svg+xml"
          }
        ]
      },
      "link": {
        "@rel": "abstract",
        "@href": "https://api.elsevier.com/content/abstract/scopus_id/105004350287"
      }
    }
  }
}