{
  "metadata": {
    "title": "Rh<ce:sup loc=post>I</ce:sup> supramolecular assembly framework enables recyclable and thermal-stable catalysts for alkene functionalization",
    "authors": "; ; ",
    "journal": "Journal of Catalysis",
    "date": "2025-10-31",
    "doi": "10.1016/j.jcat.2025.116285",
    "abstract": "",
    "uri": "https://api.elsevier.com/content/article/pii/S0021951725003501",
    "pii": "S0021951725003501"
  },
  "fulltext": {
    "full-text-retrieval-response": {
      "scopus-eid": "2-s2.0-105008885473",
      "originalText": "serial JL 272561 291210 291744 291809 31 Journal of Catalysis JOURNALCATALYSIS 2025-06-20 2025-06-20 2025-06-25 2025-06-25 2025-08-08T04:43:02 1-s2.0-S0021951725003501 S0021-9517(25)00350-1 S0021951725003501 10.1016/j.jcat.2025.116285 S300 S300.1 FULL-TEXT 1-s2.0-S0021951725X00087 2025-08-08T03:54:43.326507Z 0 0 20251001 20251031 2025 2025-06-20T23:29:10.244345Z absattachment articleinfo articlenumber articletitlenorm authfirstinitialnorm authfirstsurnamenorm cid cids contenttype copyright crossmark dateloaded dateloadedtxt datesearch datesort dateupdated dco docsubtype doctype doi eid ewtransactionid hubeid indexeddate issn issnnorm itemstage itemtransactionid itemweight openaccess openarchive pg pgfirst pii piinorm pubdateend pubdatestart pubdatetxt pubyr sectiontitle sortorder srctitle srctitlenorm srctype ssids alllist content subj subheadings suppl tomb volfirst volissue volumelist webpdf webpdfpagecount yearnav figure e-component body acknowledge affil appendices articletitle auth authfirstini authfull authkeywords authlast grantnumber grantsponsor grantsponsorid highlightsabst orcid primabst pubtype ref specialabst 0021-9517 00219517 true 450 450 C Volume 450 47 116285 116285 116285 202510 October 2025 2025-10-01 2025-10-31 2025 Regular Articles article fla © 2025 Elsevier Inc. All rights are reserved, including those for text and data mining, AI training, and similar technologies. RHISUPRAMOLECULARASSEMBLYFRAMEWORKENABLESRECYCLABLETHERMALSTABLECATALYSTSFORALKENEFUNCTIONALIZATION FANG H 1 Introduction 2 Experimental methods 2.1 Synthesis of (RhI 2L2)n·X 2.2 Synthesis of RhI 2(CO)2L2 2.3 Synthesis of RhI(CO)(Bpy)(Bisbi)·ClO4 2.4 Catalysts characterization 2.5 Hydroformylation reaction 2.6 Hydrosilylation reactions 3 Results and discussion 3.1 Synthesis and characterization of RhI SAF catalyst 3.2 Responsive to temperature and reversibly binding CO 3.3 Hydroformylation of alkenes 3.4 Reaction nature and mechanism studies 3.5 Stability studies for industrial hydroformylation 3.6 Hydrosilylation reactions 4 Conclusion Funding Information CRediT authorship contribution statement Acknowledgments Appendix A Supplementary material References MOLNAR 2011 2251 2320 A MOLNAR 2017 1 65 A ZHANG 2020 3187 3210 S RENOMCARRASCO 2018 5038 5060 M DURAND 2019 6561 6594 D SANG 2019 14365 14373 R ZHANG 2018 653 672 L WANG 2018 9843 9929 W SUN 2021 2104442 Q DIEKAMP 2023 e202304223 J DOU 2024 666 677 X ZHANG 2024 597 602 X MATSUBU 2017 120 127 J RO 2022 287 292 I SUN 2015 5204 5209 Q SUN 2016 628 639 Q LIU 2014 6011 6061 J BROWN 2015 3012 3035 C NEEL 2017 637 646 A OLIVO 2021 7681 7724 G HAM 2023 5225 5261 R DEGROOT 2001 8453 8458 D CHEN 2004 14557 14566 R GONG 2019 600 608 W ZHANG 2021 17446 17451 H LIU 2009 2383 2390 G WITTMANN 2010 1867 1870 S GARRIDOBARROS 2017 12907 12910 P YANG 2021 119547 J SHARMA 2010 153 162 S DONG 2019 3059 3067 K QIN 2022 121386 L CAI 2024 2308469 B WANG 2019 8020 8024 L SAKAMOTO 2023 3263 3271 K ZHANG 2024 2407128 Z LUO 2024 e202412188 Z YU 2010 3627 3630 L POTIER 2014 2342 2346 J MIAO 2018 1801226 Z VERMA 2021 13608 13614 P MONDAL 2016 1709 1716 B OLDENHUIS 2020 2784 2792 N ZHU 2021 14721 14730 X BROWN 2022 13276 13284 C WU 2017 1605446 C HONG 2018 2447 2455 C ZHANG 2021 3851 3863 B TANG 2024 e202406956 X KAN 2024 2310061 L CHEN 2022 9 H YAM 2015 7589 7728 V CHAN 2016 3685 3691 A MASADA 2023 8524 8530 K VANROOY 1995 34 43 A SIMPSON 1996 163 207 M KAMER 2004 2409 2424 P FRANKE 2012 5675 5732 R WU 2014 1041 1053 X KOEKEN 2013 1036 1045 A ZHENG 2016 678 680 X CRABTREE 2012 1536 1554 R DEDONCKER 2020 12928 12940 S MATSINHA 2015 1240 1248 L SIANGWATA 2019 117179 S DREIMANN 2019 4308 4319 J DIEBOLT 2012 2357 2370 O LIU 2018 10282 10288 J MING 2024 115459 L LU 2021 113249 T SELLMANN 1997 2071 2080 D HUTSCHKA 1997 1899 1902 F ANDRIEU 2006 51 61 J LINKE 2020 10795 10811 S LIU 2022 2630 2658 B FANGX2025X116285 FANGX2025X116285XH 2027-06-25T00:00:00.000Z 2027-06-25T00:00:00.000Z http://creativecommons.org/licenses/by-nc-nd/4.0/ © 2025 Elsevier Inc. All rights are reserved, including those for text and data mining, AI training, and similar technologies. 2025-06-28T02:01:20.477Z http://vtw.elsevier.com/data/voc/AddOnTypes/50.7/aggregated-refined https://doi.org/10.15223/policy-017 https://doi.org/10.15223/policy-037 https://doi.org/10.15223/policy-012 https://doi.org/10.15223/policy-029 https://doi.org/10.15223/policy-004 item S0021-9517(25)00350-1 S0021951725003501 1-s2.0-S0021951725003501 10.1016/j.jcat.2025.116285 272561 2025-08-08T03:54:43.326507Z 2025-10-01 2025-10-31 1-s2.0-S0021951725003501-main.pdf https://s3-eu-west-1.amazonaws.com/prod-ucs-content-store-eu-west/content/pii:S0021951725003501/MAIN/application/pdf/688abeb5ff8e81142d5fd3a2fbb6f75b/main.pdf main.pdf pdf true 3176362 MAIN 8 1-s2.0-S0021951725003501-main_1.png https://s3-eu-west-1.amazonaws.com/prod-ucs-content-store-eu-west/content/pii:S0021951725003501/PREVIEW/image/png/d7c3fb2bdcb4f4a16a8966708f45d443/main_1.png main_1.png png 60651 928 656 IMAGE-WEB-PDF 1 1-s2.0-S0021951725003501-fx1.jpg https://s3-eu-west-1.amazonaws.com/prod-ucs-content-store-eu-west/content/pii:S0021951725003501/fx1/DOWNSAMPLED/image/jpeg/639adf16d7c2a942df79fd6070c4e4ed/fx1.jpg fx1 fx1.jpg jpg 8649 82 370 IMAGE-DOWNSAMPLED 1-s2.0-S0021951725003501-gr5.jpg https://s3-eu-west-1.amazonaws.com/prod-ucs-content-store-eu-west/content/pii:S0021951725003501/gr5/DOWNSAMPLED/image/jpeg/6155509a567b617ff273f66c30f1d822/gr5.jpg gr5 gr5.jpg jpg 62296 456 758 IMAGE-DOWNSAMPLED 1-s2.0-S0021951725003501-gr3.jpg https://s3-eu-west-1.amazonaws.com/prod-ucs-content-store-eu-west/content/pii:S0021951725003501/gr3/DOWNSAMPLED/image/jpeg/8dd8a3ee8b6b25e93bd53b31ce4f727d/gr3.jpg gr3 gr3.jpg jpg 25935 182 647 IMAGE-DOWNSAMPLED 1-s2.0-S0021951725003501-gr4.jpg https://s3-eu-west-1.amazonaws.com/prod-ucs-content-store-eu-west/content/pii:S0021951725003501/gr4/DOWNSAMPLED/image/jpeg/1c25fb112ea14df61ca851483a22ffd3/gr4.jpg gr4 gr4.jpg jpg 64097 300 757 IMAGE-DOWNSAMPLED 1-s2.0-S0021951725003501-gr1.jpg https://s3-eu-west-1.amazonaws.com/prod-ucs-content-store-eu-west/content/pii:S0021951725003501/gr1/DOWNSAMPLED/image/jpeg/04d20a9ea2e6790f687c57f48c05458c/gr1.jpg gr1 gr1.jpg jpg 80237 450 760 IMAGE-DOWNSAMPLED 1-s2.0-S0021951725003501-gr2.jpg https://s3-eu-west-1.amazonaws.com/prod-ucs-content-store-eu-west/content/pii:S0021951725003501/gr2/DOWNSAMPLED/image/jpeg/b3df1eb15ee8e04ec2602af9a6845df6/gr2.jpg gr2 gr2.jpg jpg 26381 185 534 IMAGE-DOWNSAMPLED 1-s2.0-S0021951725003501-ga1.jpg https://s3-eu-west-1.amazonaws.com/prod-ucs-content-store-eu-west/content/pii:S0021951725003501/ga1/DOWNSAMPLED/image/jpeg/d922cd6934c33e00edbf5b92c45d5b46/ga1.jpg ga1 true ga1.jpg jpg 33309 185 500 IMAGE-DOWNSAMPLED 1-s2.0-S0021951725003501-fx1.sml https://s3-eu-west-1.amazonaws.com/prod-ucs-content-store-eu-west/content/pii:S0021951725003501/fx1/THUMBNAIL/image/gif/a822e30c2e9c64e2e9d3ff4d7545b632/fx1.sml fx1 fx1.sml sml 2294 49 219 IMAGE-THUMBNAIL 1-s2.0-S0021951725003501-gr5.sml https://s3-eu-west-1.amazonaws.com/prod-ucs-content-store-eu-west/content/pii:S0021951725003501/gr5/THUMBNAIL/image/gif/a439f467d0b68164acda7ac2b74bb666/gr5.sml gr5 gr5.sml sml 6791 132 219 IMAGE-THUMBNAIL 1-s2.0-S0021951725003501-gr3.sml https://s3-eu-west-1.amazonaws.com/prod-ucs-content-store-eu-west/content/pii:S0021951725003501/gr3/THUMBNAIL/image/gif/547efaa07249d67a24cc7a219f51a062/gr3.sml gr3 gr3.sml sml 6168 62 219 IMAGE-THUMBNAIL 1-s2.0-S0021951725003501-gr4.sml https://s3-eu-west-1.amazonaws.com/prod-ucs-content-store-eu-west/content/pii:S0021951725003501/gr4/THUMBNAIL/image/gif/f57083ddf4f3f0f3f1e4844dfad4b3a5/gr4.sml gr4 gr4.sml sml 7768 87 219 IMAGE-THUMBNAIL 1-s2.0-S0021951725003501-gr1.sml https://s3-eu-west-1.amazonaws.com/prod-ucs-content-store-eu-west/content/pii:S0021951725003501/gr1/THUMBNAIL/image/gif/59ba37807058761d192477f55447cdff/gr1.sml gr1 gr1.sml sml 10848 130 219 IMAGE-THUMBNAIL 1-s2.0-S0021951725003501-gr2.sml https://s3-eu-west-1.amazonaws.com/prod-ucs-content-store-eu-west/content/pii:S0021951725003501/gr2/THUMBNAIL/image/gif/3dba5c1a627ca49db9d8480a42d317c8/gr2.sml gr2 gr2.sml sml 5733 76 219 IMAGE-THUMBNAIL 1-s2.0-S0021951725003501-ga1.sml https://s3-eu-west-1.amazonaws.com/prod-ucs-content-store-eu-west/content/pii:S0021951725003987/ga1/THUMBNAIL/image/gif/1fb4aa4637f711770cb8d7122041cb50/ga1.sml ga1 true ga1.sml sml 8639 81 219 IMAGE-THUMBNAIL 1-s2.0-S0021951725003501-fx1_lrg.jpg https://s3-eu-west-1.amazonaws.com/prod-ucs-content-store-eu-west/content/pii:S0021951725003501/HIGHRES/image/jpeg/f9588ab8818b25c5b47d6c8ed22360a4/fx1_lrg.jpg fx1 fx1_lrg.jpg jpg 52781 365 1640 IMAGE-HIGH-RES 1-s2.0-S0021951725003501-gr5_lrg.jpg https://s3-eu-west-1.amazonaws.com/prod-ucs-content-store-eu-west/content/pii:S0021951725003501/HIGHRES/image/jpeg/534cca6e13533332c9534510102367a0/gr5_lrg.jpg gr5 gr5_lrg.jpg jpg 315702 2020 3357 IMAGE-HIGH-RES 1-s2.0-S0021951725003501-gr3_lrg.jpg https://s3-eu-west-1.amazonaws.com/prod-ucs-content-store-eu-west/content/pii:S0021951725003501/HIGHRES/image/jpeg/e9ba81b8c221db905ab4b896abf3de67/gr3_lrg.jpg gr3 gr3_lrg.jpg jpg 154474 808 2866 IMAGE-HIGH-RES 1-s2.0-S0021951725003501-gr4_lrg.jpg https://s3-eu-west-1.amazonaws.com/prod-ucs-content-store-eu-west/content/pii:S0021951725003501/HIGHRES/image/jpeg/8b5f6af961d5d3ccd11025028785ad20/gr4_lrg.jpg gr4 gr4_lrg.jpg jpg 303061 1328 3352 IMAGE-HIGH-RES 1-s2.0-S0021951725003501-gr1_lrg.jpg https://s3-eu-west-1.amazonaws.com/prod-ucs-content-store-eu-west/content/pii:S0021951725003987/HIGHRES/image/jpeg/502887568b808d6d29902e9b110127ef/gr1_lrg.jpg gr1 gr1_lrg.jpg jpg 459003 1995 3366 IMAGE-HIGH-RES 1-s2.0-S0021951725003501-gr2_lrg.jpg https://s3-eu-west-1.amazonaws.com/prod-ucs-content-store-eu-west/content/pii:S0021951725003501/HIGHRES/image/jpeg/7b248f21b859d0ec2898d8bd104654a8/gr2_lrg.jpg gr2 gr2_lrg.jpg jpg 175582 821 2367 IMAGE-HIGH-RES 1-s2.0-S0021951725003501-ga1_lrg.jpg https://s3-eu-west-1.amazonaws.com/prod-ucs-content-store-eu-west/content/pii:S0021951725003987/HIGHRES/image/jpeg/d8cf177788ba71012b7056e849ab8b65/ga1_lrg.jpg ga1 true ga1_lrg.jpg jpg 268653 819 2213 IMAGE-HIGH-RES 1-s2.0-S0021951725003501-mmc4.docx https://s3-eu-west-1.amazonaws.com/prod-ucs-content-store-eu-west/content/pii:S0021951725003501/mmc4/MAIN/application/vnd.openxmlformats-officedocument.wordprocessingml.document/28c855484a9fd3be5d0b5a9745afce7c/mmc4.docx mmc4 mmc4.docx docx 88614477 APPLICATION 1-s2.0-S0021951725003501-mmc1.pdf https://s3-eu-west-1.amazonaws.com/prod-ucs-content-store-eu-west/content/pii:S0021951725003501/mmc1/MAIN/application/pdf/e1d9048d25ef1427d07af8a359f30eb5/mmc1.pdf mmc1 mmc1.pdf pdf false 110079 APPLICATION 1-s2.0-S0021951725003501-mmc2.pdf https://s3-eu-west-1.amazonaws.com/prod-ucs-content-store-eu-west/content/pii:S0021951725003501/mmc2/MAIN/application/pdf/8e9a5a1fc5b53588ec8a53570f11c6a4/mmc2.pdf mmc2 mmc2.pdf pdf false 100496 APPLICATION 1-s2.0-S0021951725003501-mmc3.pdf https://s3-eu-west-1.amazonaws.com/prod-ucs-content-store-eu-west/content/pii:S0021951725003501/mmc3/MAIN/application/pdf/4f310de8b8bfb2608d237e0457710561/mmc3.pdf mmc3 mmc3.pdf pdf false 109700 APPLICATION YJCAT 116285 116285 S0021-9517(25)00350-1 10.1016/j.jcat.2025.116285 Elsevier Inc. Fig. 1 (A) Synthesis route of RhI 2L2·ClO4. (B) 1H DOSY spectrum of RhI 2L2 (400 MHz, CD3CN, 25 °C). (C) 31P{1H} NMR spectra of free ligand L and RhI 2L2 (162 MHz, CD3CN, 25 °C). (D)–(G) SEM images of (RhI 2L2)n·X (X = ClO4, OTf, BF4, BPh4), showing the regular cuboid structure. Fig. 2 UV/Vis spectra of RhI 2L2·ClO4 in toluene with temperature variation, and reversible cycle of (RhI 2L2)n·ClO4 upon heating and cooling in toluene. (B) Partial IR and 31P{1H} NMR spectra of RhI 2L2 upon reversibly binding CO (162 MHz, CD3CN, 25 °C). Fig. 3 (A) Performance evaluation of (RhI 2L2)n·ClO4 catalyst in alkene hydroformylation. The substrates are Long-chain α-C6 to α-C18 alkenes, cyclohexene, 2-octene, styrene, and α-methylstyrene. (B) Recyclability of (RhI 2L2)n·ClO4 catalyst in hydroformylation of 1-dodecene. (C) Partial 31P{1H} NMR spectra of RhI 2L2 after recycling (162 MHz, CD3CN, 25 °C). The fresh (RhI 2L2)n·ClO4 was used in run 1, and the recovered catalysts from the previous run were reused in the next runs 2–10. The reaction conditions: (RhI 2L2)n·ClO4 (0.0151 g, 1.0 × 10−5 mol), alkene (1.0 × 10−2 mol), toluene (3 mL), 800 rpm, 40 bar (CO/H2 = 1/1), 80 °C, 6 h. Yields of aldehydes were determined by GC. Fig. 4 In-situ time-resolved HP-FTIR spectroscopy study of (RhI 2L2)n·ClO4 in CH3CN under 30 bar syngas at 80 °C (A) and after addition of 1-dodecene (B). Fig. 5 (A) Flowchart of the continuous-flow mini-plant setup with RhI 2L2·ClO4; CWS: Cooling Water Supply; CWR: Cooling Water Return. (B) Results for continuous-flow hydroformylation of FT-C8 alkene (1-octene: 75 %, octane: 25 %) with RhI 2L2·ClO4. The reaction conditions: CO/alkene = 0.99, H2/CO = 1.01, L/Rh = 1, [Rh] = 30 ppm. a Conversion of alkene. b Selectivity of aldehyde. c The molar ratio of n-aldehyde to all the iso-aldehydes. Higher temperature led to lower selectivity of aldehydes and selectivity of iso-alkenes. Faster rates of alkene feed and catalyst recycling gave higher space–time yield, which could reach up to 88.8 kg·m−3·h−1. Research article RhI supramolecular assembly framework enables recyclable and thermal-stable catalysts for alkene functionalization Hu Fang Writing – original draft Investigation Formal analysis Data curation Conceptualization a Zuowei Sun Investigation Funding acquisition Formal analysis Data curation a Shaokun Tao Software Formal analysis a Tianhua Cui Software Methodology Formal analysis a Yanxin Jiang Supervision Formal analysis a Qianhui Wu Visualization Validation a Fanding Zhou Formal analysis Data curation b Xianwen Zhang Formal analysis b Weichao Xue Validation Supervision Resources Project administration Investigation a Chunchun Zhang Formal analysis Data curation a Yuqiao Zhou Data curation a Jiaqi Xu Validation Project administration Funding acquisition a Ruixiang Li Project administration Methodology Investigation Formal analysis a Haiyan Fu Writing – review & editing Project administration Investigation Funding acquisition a Hua Chen Writing – review & editing Visualization Validation Project administration a ⁎ Xueli Zheng Writing – review & editing Writing – original draft Conceptualization a ⁎ a Key Laboratory of Green Chemistry & Technology, Ministry of Education, College of Chemistry, Sichuan University, Chengdu, Sichuan 610064, PR China Key Laboratory of Green Chemistry & Technology Ministry of Education College of Chemistry Sichuan University Chengdu Sichuan 610064 PR China Key Laboratory of Green Chemistry & Technology, Ministry of Education, College of Chemistry, Sichuan University, Chengdu, Sichuan 610064, PR China b Chengdu Xinhua Yuan Technology Co., Ltd., Chengdu, Sichuan 610093, PR China Chengdu Xinhua Yuan Technology Co., Ltd. Chengdu Sichuan 610093 PR China Chengdu Xinhua Yuan Technology Co., Ltd., Chengdu, Sichuan 610093, PR China ⁎ Corresponding authors. Graphical abstract The design of carrier-free recyclable catalysts is a key objective yet challenging task in modern catalysis. Here, we present the self-assembly of a nitrogen and phosphine-containing ligand (L) with RhI precusor to form a supramolecular assembly framework, (RhI 2L2)n·X, as confirmed by NMR, ESI-MS and X-ray crystallographic analysis. This RhI supramolecular assembly framework can partially dissolve in solution at high temperatures and fully recover at room temperature, facilitated by π-π, C–H···π and electrostatic interactions, thereby adopting the merits of both homogeneous and heterogeneous catalysis. The inherent coordination mode of RhI 2L2 enables this RhI supramolecular assembly framework to serve as an effective catalyst for promoting the hydroformylation and hydrosilylation of alkenes, with its practicality further demonstrated in a continuous-flow mini-plant, kilogram-scale hydroformylation of Fischtropsch C8 alkene, affording a turnover number of 1.27 × 105 over a 100-hour recycling period. In-situ high-pressure FTIR and DFT calculation elucidate the role of nitrogen and the dynamic evolution of catalytic resting state in the presence of syngas and alkene. Keywords Supramolecular assembly framework Alkene functionalization Carrier-free recyclable catalyst Reversibly binding CO Hydroformylation Data availability No data was used for the research described in the article. 1 Introduction The precise design and construction of catalysts is a fundamental focus in catalysis science, serving as a pivotal technology for advancing chemical processes to convert feedstocks into value-added products [1–3]. While homogeneous metal catalysts have garnered extensive attention due to their exceptional tunability in activity and selectivity, a primary challenge lies in the separation and recovery of these often costly catalysts [4–6]. In response to these challenges, innovative materials have been developed to covalently anchor homogeneous catalysts onto solid supports, [7–10] such as zeolites, [11,12] metal oxides, [13,14] and porous polymers, [15,16] incorporating the inherent advantages of homogeneous catalysts into heterogeneous catalytic systems. Consequently, the ongoing pursuit of new sustainable catalytic systems, which combines the merits of both heterogeneous and homogeneous catalysis, remains a key objective in modern catalysis. In recent years, the rapid development of supramolecular chemistry has provided an alternative platform for the modular design of recycling catalysts [17–21]. One common approach is to immobilize homogenous catalysts onto host materials by non-covalent interactions, such as hydrogen bonding, [22–25] π-π stacking, [26–29] electrostatic interactions, [30–33] and other supramolecular interactions [34–37]. Furthermore, the self-assembly of supramolecular gels incorporating catalytically active metal complexes [38–41] or coordination cages [42–45] represents an additional elegant strategy for catalyst recovery [46–48]. These catalytic systems frequently display good selectivity, high efficiency, and robust recyclability of catalysts. Despite these advances, the development of more sustainable recyclable catalysts without the need for additional supporting materials remains a challenge and relatively elusive. An ideal approach for designing carrier-free recyclable catalysts is to harness the advantages of both homogeneous and heterogeneous phases. For example, catalysts can be designed to dissolve and form a homogeneous solution in response to specific stimuli, such as temperature, and subsequently recover in a heterogeneous form after the catalytic transformation. Supramolecular assembly frameworks (SAF), [49] formed through the assembly of metal ions and ligands, can adopt various packing models in the solid state, controlled by counterions and/or non-covalent interactions between each individual structure [50]. This would allow for the regulation of solubility in the solution, thus enabling the recycling of catalysts. Rhodium complex was chosen to demonstrate the proof-of-concept, taking into account its substantial contributions to industrial processes and its high cost. Here, we present a supramolecular assembly framework comprising an RhI 2L2 unit, formed through the self-assembly of BiPyPhos (L) with RhI, which efficiently catalyzes both the hydroformylation and hydrosilylation of a wide range of alkenes. This RhI SAF can partially dissolve under high temperature and crystallize in a self-replication manner through π-π, C–H···π, and electrostatic interactions at room temperature, enabling homogeneous catalysis and heterogeneous recycling of the precious rhodium catalysts with complete rhodium reclamation ( Fig. 1 A). After ten runs, the RhI 2L2 complex maintains high catalytic performance while retaining its structural integrity. Importantly, this catalyst displayed long-term stability in a continuous-flow hydroformylation of C8 alkene, with a turnover number of 1.27 × 105 over a 100-hour recycling period. 2 Experimental methods 2.1 Synthesis of (RhI 2L2)n·X A 25 mL double-necked flask was charged with L (BiPyPhos) (0.10 mmol, 55.20 mg), Rh(acac)(CO)2 (0.10 mmol, 25.80 mg), and perchloric acid zinc hydrate (0.12 mmol, 44.70 mg). The mixture was sealed and degassed by N2. Subsequently, anhydrous and deoxygenated CH3CN (5 mL) was added and the mixture was stirred at room temperature to give a clear yellow solution. After heated at 60 °C for 10 h, a yellow precipitate was formed. The supernatant was filtered and the solid was washed with degassed Et2O (3 × 5 mL) and dried under vacuum to provide 53.50 mg of RhI 2L2·ClO4 as a yellow solid (71 % yield). 1H NMR (400 MHz, Acetonitrile‑d3 ) δ 9.23 (d, J = 5.4 Hz, 4H), 8.27 – 8.19 (m, 8H), 7.68 – 7.61 (m, 12H), 7.38 (dd, J = 7.8, 5.4 Hz, 4H), 7.29 (d, J = 7.8 Hz, 4H), 7.04 (t, J = 7.4 Hz, 4H), 6.76 (t, J = 7.4 Hz, 8H), 6.44 – 6.36 (m, 8H), 3.51 (m, 4H), 2.78 (m, 4H). 31P{1H} NMR (162 MHz, Acetonitrile‑d3 ) δ 57.34 (d, J Rh-P = 175.0 Hz). ESI-MS spectrum of RhI 2L2 in CH3CN. ESI-MS (m/z): 655.0940 (calc. for 655.0939). Following the same procedure, RhI 2L2·OTf, RhI 2L2·BF4, RhI 2L2·BPh4, and RhI 2L2·PTA were also prepared by using their corresponding sodium salts instead of Zn(ClO4)2. 2.2 Synthesis of RhI 2(CO)2L2 The autoclave was charged with 10 mL anhydrous and deoxygenated CH3CN solution of RhI 2L2·ClO4 (0.02 mmol, 30.20 mg). The autoclave was sealed, flushed by CO three times and pressurized with 40 bar CO. After heated at 80 °C for 4 h, the autoclave was cooled down to room temperature and the pressure was released. The suspension was centrifuged, and the solid was washed with Et2O (3 × 5 mL) and dried in vacuum to give 28.50 mg of RhI 2(CO)2L2·ClO4 as an orange solid (91 % yield). 31P{1H} NMR (162 MHz, Acetonitrile‑d3 ) intricate AB pattern at 41.16 (dd, 1J Rh-P = 131.2 Hz, 2J P-P = 45.4 Hz), 39.65 (dd, 1J Rh-P = 131.2 Hz, 2J P-P = 47.0 Hz) and 32.05 (dd, 1J Rh-P = 128.8 Hz, 2J P-P = 42.1 Hz), 30.32 (dd, 1J Rh-P = 128.8 Hz, 2J P-P = 43.7 Hz). ESI-MS spectrum of RhI 2(CO)2L2 in CH3CN. ESI-MS (m/z): 683.0982 (calc. for RhI 2(CO)2L2 683.0883). 2.3 Synthesis of RhI(CO)(Bpy)(Bisbi)·ClO4 A 50 mL double-necked flask was charged with 2,2′-bipyridine (Bpy, 0.10 mmol, 15.60 mg), 2,2′-bis(diphenylphosphinomethyl)-1,1′-biphenyl (Bisbi, 0.10 mmol, 55.00 mg), Rh(acac)(CO)2 (0.10 mmol, 25.80 mg), and sodium perchlorate (0.12 mmol, 14.60 mg). The mixture was sealed and degassed by N2. Subsequently, anhydrous and deoxygenated EtOH (10 mL) was added and the mixture was stirred at room temperature to give a clear yellow solution. After heated at 60 °C for 10 h, a yellow precipitate was formed. The supernatant was filtered and the solid was washed with degassed Et2O (3 × 5 mL) and dried under vacuum to provide 65.50 mg of RhI(CO)(Bpy)(Bisbi)·ClO4 as a yellow solid (70 % yield). 31P{1H} NMR (162 MHz, Acetonitrile‑d3 ) AB system centered at 35.47 (dd, 1J Rh-P = 134.5 Hz, 2J P-P = 294.0 Hz) and 19.12 (dd, 1J Rh-P = 137.7 Hz, 2J P-P = 294.0 Hz). 2.4 Catalysts characterization 1H NMR and 31P{1H} NMR spectra were collected using a Bruker 400 MHz AVA spectrometer at 25 °C unless otherwise noted. Signal multiplicity is reported using the following abbreviations: s = singlet, d = doublet, t = triplet, q = quartet, sep = septet, dt = doublet of triplets, and m = multiplet. All measurements were carried out at room temperature unless otherwise stated. High resolution mass spectra (HRMS) were obtained with a Shimadzu (LCMS-IT-TOF). The data are given as mass units per charge (m/z) and intensities of signals are given in brackets. UV–Vis absorption spectra were recorded on UV-3600 spectrophotometer from SHIMADZU Corporation. Infrared spectra were collected using a Shimadzu IRTracer-100, with a high signal-to-noise ratio of 60000:1 and a resolution of 0.25 cm−1. The scanning electron microscope (SEM) images were performed by Thermo Scientific Apreo S. Thermogravimetric analysis (TGA) data were collected under a N2 atmosphere over the temperature range 25–600 °C with a ramp rate of 10 °C/min using a Mettler Toledo Star TGA/DSC. Inductively Coupled Plasma-Optical Emission Spectrometer (ICP-OES) analysis of Rh leaching was performed with the PerkinElmer OPTIMA8000. 2.5 Hydroformylation reaction All hydroformylation reactions were conducted in a 25 mL stainless steel autoclave equipped with a magnetic stirrer. After loading a certain amount of catalysts (RhI 2L2)n·X, substrate alkene and solvent toluene, the autoclave was sealed and purged with syngas for four times, and then pressurized with syngas to the desired pressure and heated to the preset temperature for a specified time. After the reaction was stopped, the autoclave was immediately cooled to room temperature and vented. After centrifuge and filtration, the filtrate was analyzed by gas chromatography (GC-FID, Agilent 7890B equipped with a KB-1 column). The recovered (RhI 2L2)n·X by filtration was added into the autoclave which equipped with another portion of substrate and solvent to start the second run. The fresh (RhI 2L2)n·X was used in run 1, and the recovered catalyst from previous run was reused in next runs 2–10. The reaction conditions: 1.0 × 10−5 mol (RhI 2L2)n·X (catalyst), 1.0 × 10−2 mol alkene (substrate), substrate/catalyst = 1000/1, 3 mL toluene (solvent), 800 rpm, 40 bar (CO/H2 = 1/1), 80 °C, 6 h. 2.6 Hydrosilylation reactions All hydrosilylation reactions were conducted in a pre-dried Schlenk tube (10 mL), adding the (RhI 2L2)n·ClO4 catalyst (1.90 mg). Subsequently, alkenes (1.00 mmol), dimethyl(phenyl)silane (1.20 mmol) and toluene (1 mL) were injected into Schlenk tube, then the reaction was stirred under 80 °C for 12 h. After the reaction, the mixture was simply centrifuged and filtrated. The product phase was purified by preparative thin-layer chromatography on silica gel to furnish the desired product. 3 Results and discussion 3.1 Synthesis and characterization of RhI SAF catalyst A nitrogen and phosphine-containing ligand, 3,3′-bis((diphenylphosphanyl)methyl)-2,2′-bipyridine (BiPyPhos or L for short), [51] bearing two N-donors and two P-donors reacted with RhI(acac)(CO)2 in presence of Zn(ClO4)2 in CH3CN at 60 °C for 10 h, giving rise to a RhI complex ( Fig. 1 A ). Side product Zn(acac)2 was successfully removed by washing the crude product with diethyl ether. A RhI 2L2 composition was confirmed by electrospray ionization mass spectrometry (ESI-MS, Fig. S4 ). In the 1H diffusion-ordered spectroscopy (DOSY) spectrum of RhI 2L2 complex, a uniform diffusion coefficient was observed for all peaks, indicating the presence of a single complex (Fig. 1B and Fig. S3 ). Evidence of P-donor coordination was obtained from the 31P{1H} NMR spectra (Fig. 1 C), showing a doublet signal at 57.8 ppm (d, J Rh-P = 174.7 Hz) resulting from the Rh-P coupling. X-ray quality crystals of RhI 2L2·ClO4 were obtained by slow vapor diffusion of hexane into the acetone solution of this complex. The solid-state structure of RhI 2L2·ClO4 adopts a D2 -symmetric helical configuration, in which two Rh centers are bridged by two ligands ( Fig. 1 A, middle). Each RhI center adopts a square planar geometry, surrounded by two N-donors and two P-donors. The RhI···RhI distance is 4.7 Å, indicating the absence of RhI···RhI interactions [52–54]. The observed π-π stacking interactions (3.5 Å) between the phenyl rings of intramolecular PPh2 groups contribute to the formation of the robust RhI 2L2 structure. The RhI 2L2·ClO4 crystallizes in a P-1 space group, composing of twelve RhI 2L2 units distributed across three layers, as shown in the packing model ( Fig. 1A, right). In this arrangement, four RhI 2L2 units form a layer through extensive C–H···π interactions, while the layers are stacked non-covalently via electrostatic interactions between cationic RhI 2L2 and anionic ClO4, as well as C–H···π interactions. The unique stacking model observed here may suppress the dynamic nature of the metal–organic complex, making it less prone to disassembly under harsh conditions and more amenable to crystallization [50]. Consequently, the RhI 2L2 complexes readily crystallized, forming well-organized cuboid supramolecular crystalline catalysts (RhI 2L2)n (Fig. 1D). Other perchlorate salts were also tested as additives, including Fe(ClO4)3, Cu(ClO4)2, Mg(ClO4)2, NaClO4 and TBATClO4 (TBAT = tetrabutylammonium). Of these, all metal salts resulted in RhI 2L2·ClO4, as confirmed by 31P{1H} NMR spectra ( Fig. S13 ). However, TBATClO4 did not give the desired RhI complex, but yielded the oxidation of BiPyPhos. These observations indicate that the metal salt is essential for ligand exchange to remove the chelating acetylacetonate and the coordination of Rh and L also protect the ligand from oxidation. Additionally, various counteranions, such as OTf, BPh4, BF4, PTA (PTA = phosphotungstate), and ClO4, were screened to investigate the generality of this self-assembly strategy in forming (RhI 2L2)n·X complexes by adding their corresponding sodium salts instead of Zn(ClO4)2. Scanning electron microscope (SEM) again revealed well-crystalized cuboid (Fig. 1 E-G), with their structures confirmed by 1H and 31P{1H} NMR spectra ( Figs. S5–S12 ). Single crystal structure of RhI 2L2·BF4 also exhibits a similar crystal structure and packing model ( Scheme S2 ). 3.2 Responsive to temperature and reversibly binding CO UV/Vis spectroscopy was employed to study the temperature-responsive solubility of RhI 2L2·ClO4 in toluene ( Fig. 2 A). Crystallized solid (RhI 2L2)n·ClO4 was subjected to toluene at 25 °C. As the temperature increased, a peak (300–360 nm) corresponding to π–π* transitions emerged, suggesting the partial dissolution of the solid and the homogeneous formation of RhI 2L2 in toluene. The solubility of RhI 2L2·ClO4 in toluene at 80 °C was measured to be 0.1 ppm using an inductively coupled plasma-optical emission spectrometer (ICP-OES, Figs. S18, S19 ). Upon cooling back to 25 °C, the solid-state (RhI 2L2)n·ClO4 was fully recovered (Fig. 2A). It is worth noting here that no changes in 1H and 31P{1H} NMR were observed at higher temperatures, indicating that RhI 2L2 retains its structural integrity without disassembly ( Figs. S14–S17 ). In addition, the RhI complex displayed good thermal stability in the solid state ( Fig. S20 ), with a decomposition temperature of approximately 310 °C. Furthermore, it exhibited robust air stability in both solid and solution states, including in solvents such as toluene, acetone and acetonitrile, for a duration of 60 days without decomposition ( Figs. S21–S22 ). The observed temperature-dependent solubility here, along with the good stability, would benefit the catalyst recycling in catalytic transformations. The unsaturated 16-electron nature of RhI vertex within RhI 2L2 suggests the potential for catalytic capability of such RhI SAF, [55–57] prompting us to investigate its reactivity with CO (Fig. 2B). Upon activation by 40 bar of CO in an autoclave at 80 °C for 4 h, a characteristic carbonyl band at 2007 cm−1 appeared in the IR spectra ( Fig. 2B), consistent with the 31P{1H} NMR spectra showing an AB pattern at 41.2 and 32.1 ppm at the expense of free RhI 2L2 ( Fig. 2B). ESI-MS confirmed the formation of the RhI 2(CO)2L2 complex ( Fig. S25 ). Further heating under air led to the release of CO and the recovery of RhI 2L2, which was confirmed by IR and 31P{1H} NMR spectra (Fig. 2B). Despite numerous attempts, we were unsuccessful in growing single crystals of RhI 2(CO)2L2. However, in control experiments, mixing 2,2′-bipyridine (Bpy) and 2,2′-bis(diphenylphosphinomethyl)-1,1′-biphenyl (Bisbi) with Rh(acac)(CO)2 and sodium perchlorate gave X-ray quality crystals of the mononuclear RhI(CO)(Bpy)(Bisbi) complex, with the RhI center adopting a pseudo-trigonal bipyramidal geometry ( Scheme S4 ), where the P-Rh-P bite angle was bent to 151.15°. Such a distorted configuration may lead to a different packing arrangement, resulting in micromorphology changes of the catalyst. Indeed, the micromorphology of (RhI 2L2)n became disordered upon binding CO and reordered upon releasing CO, as shown by SEM ( Fig. S23 ). 3.3 Hydroformylation of alkenes Encouraged by the reversible binding of CO to RhI 2L2 and its temperature-dependent solubility, we turned to investigate its catalytic performance and recyclability in industrially appealing hydroformylation reaction, [58,59] which produces over 10 million tons of value-added aldehydes annually. (RhI 2L2)n·ClO4 was firstly employed to promote the hydroformylation of various alkenes, in toluene at 80 °C under H2 and CO (1/1, 40 bar), and moderate to excellent aldehydes yields (56–97 %) were generally obtained, as shown in Fig. 3 A and Table S1 . Moderate n/iso (n-aldehyde to total iso-aldehydes) ratios 0.45–0.99 was observed under low P/Rh (2/1) at 4 MPa. Remarkably, (RhI 2L2)n·ClO4 successfully facilitated the high-yield conversion of long-chain C8–C18 alkenes into their corresponding aldehydes (80–91 %), which are highly demanded raw materials of new plasticizers, surfactants, and lubricants. (RhI 2L2)n·ClO4 worked well in the hydroformylation of styrene (93 %, Fig. 3 A, Table S1 , entry 9), and afforded lower yield for the hydroformylation of steric hindered 1,1-disubstituted alkene α-methylstyrene (56 %, Fig. 3 A, Table S1 , entry 10) [60,61]. Notably, steric effect also influences regioselectivity [62]. Styrene may form η3-allyl-Rh intermediates favoring the formation of branched aldehydes, while, α-methylstyrene favors η1-allyl-Rh coordination, resulting in excellent selectivity for linear aldehyde (3-phenylbutanal, > 99 %). After the reactions, simply cooling the reaction systems to room temperature and performing a straightforward filtration process could achieve the recycling of the Rh catalyst. It is interesting that the recovered (RhI 2L2)n·ClO4 demonstrates similar catalytic behavior to the fresh one in the hydroformylation of 1-dodecene ( Fig. S29 ). Notably, the (RhI 2L2)n·ClO4 catalyst maintained both consistent reactivity and structural integrity for the hydroformylation of various alkenes after multiple recycling cycles ( Figs. 3C, S30 ), without decreased yields being observed ( Figs. 3B, S38–S46 ). After 10 runs, the Rh leaching was calculated to be 3.47 wt% for (RhI 2L2)n·ClO4 ( Table S1 ). Similarly, (RhI 2L2)n·PTA, (RhI 2L2)n·OTf and (RhI 2L2)n·BF4 also exhibited excellent catalytic capability and recyclability for the hydroformylation of 1-dodecene ( Figs. S34–S37 ). The (RhI 2L2)n·PTA exhibited lower Rh leaching of 1.36 wt% ( Table S2 ), while (RhI 2L2)n·BPh4 yielded only 70 % tridecanal ( Fig. S37 ), and exhibited significantly higher Rh leaching of 27.0 wt% after 10 runs ( Table S3 ). We attribute this to the bulky nature of BPh4 hindering alkene coordination to Rh during the catalytic process, as well as the better solubility of (RhI 2L2)n·BPh4 in toluene at room temperature (Fig. S19). Interestingly, the leaching part due to dissolution could be completely reclaimed through vacuum evaporation, confirmed by 1H and 31P{1H} NMR spectra ( Figs. S47–S48 ). 3.4 Reaction nature and mechanism studies To determine whether the RhI SAF functions as a homogeneous or heterogeneous catalyst in the hydroformylation reactions, we conducted a series of control experiments. Firstly, during the hydromation of 1-dodecene, the solid state (RhI 2L2)n·ClO4 was removed by hot filtration after 1 h. The resulting filtrate, containing homogeneous RhI 2L2, 1-dodecene, and 17 % tridecanals, was then subjected to identical conditions for an additional 5 h, yielding similar results to that of the one-pot reaction using (RhI 2L2)n·ClO4 ( Fig. S28 ). Furthermore, a mercury poisoning study was conducted. Hg(0) would deactivate the rhodium nanoparticles. Consequently, nanoparticle-derived activity would decrease upon with the presence of mercury [62,63]. In this study, mercury did not inhibit the hydroformylation of 1-dodecene, as the yield of tridecanals was 89 %, comparable to the standard hydroformylation yield (90 %) ( Fig. S28 ). These reults indicated the RhI SAF partially dissolves under standard conditions and functions as a homogeneous catalyst, which as has been disclosed by Smith with Rh catalyst precursors [63–65]. In order to gain an insight into the catalytic mechanism, in-situ high-pressure (HP)-FTIR and HP-NMR spectroscopic characterizations were conducted on the solution of (RhI 2L2)n·ClO4 in CH3CN or CD3CN. HP-FTIR experiments of (RhI 2L2)n·ClO4 in CH3CN were performed under 30 bar of syngas at room temperature and 80 °C. The spectra revealed a transition of the RhI 2L2 catalyst to the active species once syngas was introduced at room temperature, as a new vibrational band was observed at 2069 cm−1 (Fig. 4 A), which was different from the vibration of RhI 2(CO)2L2 (2007 cm−1) and could be belonged to the ν(Rh-CO) of [HRh(P)2(CO)] species with the dissociation of nitrogen atom [57,66]. Interestingly, two new bands at 2139 cm−1 and 2010 cm−1 appeared rapidly over the time, those could be assigned to ν(Rh-CO) stretching vibration of [HRh(P)2(CO)2]. After addition of 1-dodecene, the carbonyl region of [HRh(P)2(CO)] and [HRh(P)2(CO)2] were also observed in the HR-FTIR spectra, but the ν(Rh-CO) vibration signal at 2010 cm−1 was slightly decreased with an additional broad shoulder detected at 1999 cm−1 (Fig. 4B), which was probably ascribed to the ν(Rh-CO) of [HRh(P)2(CO)(alkene)] originating from the dissociation of a Rh-CO bond followed by 1-dodecene coordination [57,66]. These results reveals that the catalytically active species might be an equilibrium of [HRh(P)2(CO)], [HRh(P)2(CO)2] and [HRh(P)2(CO)(alkene)] species under hydroformylation conditions. HP-NMR experiments of (RhI 2L2)n·ClO4 in CD3CN were performed under 10 bar of syngas at 80 °C. Unfortunately, the signal of rhodium hydride was not detected probably due to low concentration or low pressure [67]. Beller disclosed that N-pyridyl moiety might function as a proton shuttle to facilitate the formation of catalytically active species for carbonylation reaction [68,69]. Density functional theory (DFT) calculations were conducted to understand the contribution of N-pyridyl moiety in hydroformylation. Two plausible pathways were suggested [70,71]. One pathway involves pyridine-N-assisted heterolytic H2 splitting, followed by protonolysis of the acyl-RhI key intermediate, while the other proceeds through the H2 oxidative addition to RhI species and subsequent reductive elimination of the acyl-RhIII-H complex ( Supplementary Information , Section 6.9). Although both pathways are feasible, the pyridine-N-assisted pathway exhibits significantly lower Gibbs free energy, with −16.2 kcal/mol for the protonolysis of the acyl-RhI species, [72–74] thereby promoting product release and the regeneration of RhI 2(CO)2L2. 3.5 Stability studies for industrial hydroformylation The hydroformylation of alkenes generally requires high temperatures, with even higher temperatures needed for the distillation of the desired aldehydes, particularly for the long-chain C8–C18 alkenes [75,76]. As such, we proceeded to evaluate the thermal stability of RhI 2L2 catalyst for long-term use in a continuous-flow mini-plant setup on a kilogram-scale (Fig. 5 A). The investigation was carried out with a mixture of substrates, similar to an industrial process that rarely use single components in large-scale hydroformylation. In a 100-hour continuous operation, RhI 2L2, loaded at 30 ppm, effectively catalyzed the hydroformylation of Fischer-Tropsch (FT) C8 alkene, with a mean conversion of 97 %, an average selectivity of 84 % for nonanal, and an average space–time yield (STY) of 72 kg·m−3·h−1. A total turnover number of 1.27 × 105 was achieved without the addition of any extra catalyst or ligand, demonstrating the exceptional long-term stability of the catalyst. This remarkable stability might be attributed to the inherent coordination mode of RhI 2L2. Although the Rh content in the product stream was measured around 100–140 ppb by atomic absorption spectroscopy, at 25-hour intervals throughout the 100-hour reaction period. This minimal leaching is primarily attributed to physical entrainment during product distillation rather than catalyst decomposition. Further leaching reduction will be pursued through separation unit optimization to minimize carry-over and anion exchange ([PTA]3- for ClO4 -) to strengthen electrostatic stabilization. 3.6 Hydrosilylation reactions The practicality of this RhI SAF was further demonstrated in the hydrosilylation reactions (Eq. 1), with moderate to good yields for the anti-Markovnikov hydrosilylation of terminal alkenes. However, internal alkenes showed no reactivity, likely due to steric hindrance. However, internal alkenes showed no reactivity, likely due to steric hindrance. 4 Conclusion The coordination-driven self-assembly of RhI 2L2 thus provides a general method to prepare a new class of carrier-free recyclable RhI catalysts. The unique packing model enables the RhI SAF to integrate the advantages of both homogeneous and heterogeneous catalysis, as demonstrated by its high reactivity and robust recyclability in hydroformylation reactions. In-situ HP-FTIR reveals the presence of [HRh(P)2(CO)], [HRh(P)2(CO)2] and [HRh(P)2(CO)(alkene)] catalytic species under hydroformylation conditions. DFT calculation suggests that N-pyridyl moiety might facilitate the protonolysis of the acyl-RhI species and yield aldehyde product. Its long-term thermal stability was further demonstrated by a 100-hour continuous-flow mini-plant experiment, underlining its potential for application in industrially relevant chemical processes and laying the foundation for the future design of more sustainable carrier-free catalysts using a supramolecular self-assembly strategy. Funding Information We are grateful for the financial support from the Sichuan Science and Technology Program (2024ZYD0099), the National Natural Science Foundation of China (22072099), and the Fundamental Research Funds for the Central Universities (1082204112I96). CRediT authorship contribution statement Hu Fang: Writing – original draft, Investigation, Formal analysis, Data curation, Conceptualization. Zuowei Sun: Investigation, Funding acquisition, Formal analysis, Data curation. Shaokun Tao: Software, Formal analysis. Tianhua Cui: Software, Methodology, Formal analysis. Yanxin Jiang: Supervision, Formal analysis. Qianhui Wu: Visualization, Validation. Fanding Zhou: Formal analysis, Data curation. Xianwen Zhang: Formal analysis. Weichao Xue: Validation, Supervision, Resources, Project administration, Investigation. Chunchun Zhang: Formal analysis, Data curation. Yuqiao Zhou: Data curation. Jiaqi Xu: Validation, Project administration, Funding acquisition. Ruixiang Li: Project administration, Methodology, Investigation, Formal analysis. Haiyan Fu: Writing – review & editing, Project administration, Investigation, Funding acquisition. Hua Chen: Writing – review & editing, Visualization, Validation, Project administration. Xueli Zheng: Writing – review & editing, Writing – original draft, Conceptualization. Declaration of competing interest The authors declare that they have no known competing financial interests or personal relationships that could have appeared to influence the work reported in this paper. Acknowledgments We thank Chunchun Zhang from the Centre of Analysis & Testing, and Jing Li, Dongyan Deng, Feng Yang, Yue Qi from the Comprehensive Training Platform of the Specialized Laboratory in the College of Chemistry, at Sichuan University for NMR, ESI-MS and SEM measurements. We also thank the computational supports of Computing Center in Xi’an and National Supercomputing Center in Shenzhen. The in situ FTIR experiments were performed in Tianjin Xianquan industry and trade development Co., Ltd. Appendix A Supplementary material Supporting Information includes additional experimental details: Experimental procedures for catalyst preparation, characterization, catalytic performance test, DFT calculation, single crystal data are provided in Supplementary Information in detail (PDF). Deposition numbers CCDC 2254737 (RhI 2L2·ClO4), 2,327,496 (RhI 2L2·BF4), 2,327,495 [RhI(CO)(Bpy)(Bisbi)] contain the supplementary crystallographic data for this paper. These data are provided free of charge by the joint Cambridge Crystallographic Data Centre and Fachinformationszentrum Karlsruhe Access Structures service. Supplementary data to this article can be found online at https://doi.org/10.1016/j.jcat.2025.116285. Appendix A Supplementary material The following are the Supplementary data to this article: Supplementary Data 1 Supplementary Data 2 Supplementary Data 3 Supplementary Data 4 References [1] Á. Molnár Efficient, selective, and recyclable palladium catalysts in carbon-carbon coupling reactions Chem. Rev. 111 2011 2251 2320 10.1021/cr100355b Á. Molnár, Efficient, Selective, and Recyclable Palladium Catalysts in Carbon-Carbon Coupling Reactions. Chem. Rev. 111 (2011) 2251–2320. DOI: 10.1021/cr100355b [2] Á. Molnár A. Papp Catalyst recycling—a survey of recent progress and current status Coord. Chem. Rev. 349 2017 1 65 10.1016/j.ccr.2017.08.011 Á. Molnár, A. Papp, Catalyst recycling—A survey of recent progress and current status. Coord. Chem. Rev. 349 (2017) 1–65. DOI: 10.1016/j.ccr.2017.08.011 [3] S. Zhang H. Neumann M. Beller Synthesis of α,β-unsaturated carbonyl compounds by carbonylation reactions Chem. Soc. Rev. 49 2020 3187 3210 10.1039/C9CS00615J S. Zhang, H. Neumann, M. Beller, Synthesis of α,β-unsaturated carbonyl compounds by carbonylation reactions. Chem. Soc. Rev. 49 (2020) 3187–3210. DOI: 10.1039/C9CS00615J [4] M. Renom-Carrasco L. Lefort Ligand libraries for high throughput screening of homogeneous catalysts Chem. Soc. Rev. 47 2018 5038 5060 10.1039/C7CS00844A M. Renom-Carrasco, L. Lefort, Ligand libraries for high throughput screening of homogeneous catalysts. Chem. Soc. Rev. 47 (2018) 5038–5060. DOI: 10.1039/C7CS00844A [5] D.J. Durand N. Fey Computational ligand descriptors for catalyst design Chem. Rev. 119 2019 6561 6594 10.1021/acs.chemrev.8b00588 D.J. Durand, N. Fey, Computational ligand descriptors for catalyst design. Chem. Rev. 119 (2019) 6561−6594. DOI: 10.1021/acs.chemrev.8b00588 [6] R. Sang P. Kucmierczyk R. Dühren R. Razzaq K. Dong J. Liu R. Franke R. Jackstell M. Beller Synthesis of carboxylic acids by palladium-catalyzed hydroxycarbonylation Angew. Chem. Int. Ed. 58 2019 14365 14373 10.1002/anie.201908451 R. Sang, P. Kucmierczyk, R. Dühren, R. Razzaq, K. Dong, J. Liu, R. Franke, R. Jackstell, M. Beller, Synthesis of Carboxylic Acids by Palladium-Catalyzed Hydroxycarbonylation. Angew. Chem. Int. Ed. 58 (2019) 14365–14373. DOI: 10.1002/anie.201908451 [7] L. Zhang Y. Ren W. Liu A. Wang T. Zhang Single-atom catalyst: a rising star for green synthesis of fine chemicals Natl. Sci. Rev. 5 2018 653 672 10.1093/nsr/nwy077 L. Zhang, Y. Ren, W. Liu, A. Wang, T. Zhang, Single-atom catalyst: a rising star for green synthesis of fine chemicals. Natl. Sci. Rev. 5 (2018) 653–672. DOI: 10.1093/nsr/nwy077 [8] W. Wang L. Cui P. Sun L. Shi C. Yue F. Li Reusable N‑heterocyclic carbene complex catalysts and beyond: a perspective on recycling strategies Chem. Rev. 118 2018 9843 9929 10.1021/acs.chemrev.8b00057 W. Wang, L. Cui, P. Sun, L. Shi, C. Yue, F. Li, Reusable N‑Heterocyclic Carbene Complex Catalysts and Beyond: A Perspective on Recycling Strategies. Chem. Rev. 118 (2018) 9843−9929. DOI: 10.1021/acs.chemrev.8b00057 [9] Q. Sun N. Wang J. Yu Advances in catalytic applications of zeolite-supported metal catalysts Adv. Mater. 33 2021 2104442 10.1002/adma.202104442 Q. Sun, N. Wang, J. Yu, Advances in Catalytic Applications of Zeolite-Supported Metal Catalysts. Adv. Mater. 33 (2021) 2104442. DOI: 10.1002/adma.202104442 [10] J. Diekamp T. Seidensticker Synthesis strategies towards Tagged Homogeneous Catalysts to Improve their Separation Angew. Chem. Int. Ed. 62 2023 e202304223 10.1002/anie.202304223 J. Diekamp, T. Seidensticker, Synthesis Strategies towards Tagged Homogeneous Catalysts to Improve Their Separation. Angew. Chem. Int. Ed. 62 (2023) e202304223. DOI: 10.1002/anie.202304223 [11] X.M. Dou T. Yan L. Qian H. Hou M. Lopez-Haro C. Marini G. Agostini D.M. Meira X. Zhang L. Zhang Z. Cao L. Liu Regioselective hydroformylation with subnanometre Rh clusters in MFI zeolite Nat. Catal. 7 2024 666 677 10.1038/s41929-024-01155-y X.M. Dou, T. Yan, L. Qian, H. Hou, M. Lopez-Haro, C. Marini, G. Agostini, D.M. Meira, X. Zhang, L. Zhang, Z. Cao, L. Liu, Regioselective hydroformylation with subnanometre Rh clusters in MFI zeolite. Nat. Catal. 7 (2024) 666–677. DOI: 10.1038/s41929-024-01155-y [12] X. Zhang T. Yan H. Hou J. Yin H. Wan X. Sun Q. Zhang F. Sun Y. Wei M. Dong W. Fan J. Wang Y. Sun X. Zhou K. Wu Y. Yang Y. Li Z. Cao Regioselective hydroformylation of propene catalysed by rhodium-zeolite Nature 629 2024 597 602 10.1038/s41586-024-07342-y X. Zhang, T. Yan, H. Hou, J. Yin, H. Wan, X. Sun, Q. Zhang, F. Sun, Y. Wei, M. Dong, W. Fan, J. Wang, Y. Sun, X. Zhou, K. Wu, Y. Yang, Y. Li, Z. Cao, Regioselective hydroformylation of propene catalysed by rhodium-zeolite. Nature 629 (2024) 597–602. DOI: 10.1038/s41586-024-07342-y [13] J.C. Matsubu S. Zhang L. DeRita N.S. Marinkovic J.G. Chen G.W. Graham X. Pan P. Christopher Adsorbate-mediated strong metal–support interactions in oxide-supported Rh catalysts Nat. Chem. 9 2017 120 127 10.1038/nchem.2607 J.C. Matsubu, S. Zhang, L. DeRita, N.S. Marinkovic, J.G. Chen, G.W. Graham, X. Pan, P. Christopher, Adsorbate-mediated strong metal–support interactions in oxide-supported Rh catalysts. Nat. Chem. 9 (2017) 120–127. DOI: 10.1038/nchem.2607 [14] I. Ro J. Qi S. Lee M. Xu X. Yan Z. Xie G. Zakem A. Morales J.G. Chen X. Pan D.G. Vlachos S. Caratzoulas P. Christopher Bifunctional hydroformylation on heterogeneous Rh-WOx pair site catalysts Nature 609 2022 287 292 10.1038/s41586-022-05075-4 I. Ro, J. Qi, S. Lee, M. Xu, X. Yan, Z. Xie, G. Zakem, A. Morales, J.G. Chen, X. Pan, D.G. Vlachos, S. Caratzoulas, P. Christopher, Bifunctional hydroformylation on heterogeneous Rh-WOx pair site catalysts. Nature 609 (2022) 287–292. DOI: 10.1038/s41586-022-05075-4 [15] Q. Sun Z. Dai X. Liu N. Sheng F. Deng X. Meng F.-S. Xiao Highly efficient heterogeneous hydroformylation over rh-metalated porous organic polymers: synergistic effect of high ligand concentration and flexible framework J. Am. Chem. Soc. 137 2015 5204 5209 10.1021/jacs.5b02122 Q. Sun, Z. Dai, X. Liu, N. Sheng, F. Deng, X. Meng, F.-S. Xiao, Highly Efficient Heterogeneous Hydroformylation over Rh-Metalated Porous Organic Polymers: Synergistic Effect of High Ligand Concentration and Flexible Framework. J. Am. Chem. Soc. 137 (2015) 5204–5209. DOI: 10.1021/jacs.5b02122 [16] Q. Sun B. Aguila G. Verma X. Liu Z. Dai F. Deng X. Meng F.-S. Xiao S. Ma Superhydrophobicity: constructing homogeneous catalysts into superhydrophobic porous frameworks to protect them from hydrolytic degradation Chem 1 2016 628 639 10.1016/j.chempr.2016.09.008 Q. Sun, B. Aguila, G. Verma, X. Liu, Z. Dai, F. Deng, X. Meng, F.-S. Xiao, S. Ma, Superhydrophobicity: Constructing Homogeneous Catalysts into Superhydrophobic Porous Frameworks to Protect Them from Hydrolytic Degradation. Chem. 1 (2016) 628–639. DOI: 10.1016/j.chempr.2016.09.008 [17] J. Liu L. Chen H. Cui J. Zhang L. Zhang C.-Y. Su Applications of metal–organic frameworks in heterogeneous supramolecular catalysis Chem. Soc. Rev. 43 2014 6011 6061 10.1039/C4CS00094C J. Liu, L. Chen, H. Cui, J. Zhang, L. Zhang, C.-Y. Su, Applications of metal–organic frameworks in heterogeneous supramolecular catalysis. Chem. Soc. Rev. 43 (2014) 6011–6061. DOI: 10.1039/C4CS00094C [18] C.J. Brown F.D. Toste R.G. Bergman K.N. Raymond Supramolecular catalysis in metal−ligand cluster hosts Chem. Rev. 115 2015 3012 3035 10.1021/cr4001226 C.J. Brown, F.D. Toste, R.G. Bergman, K.N. Raymond, Supramolecular Catalysis in Metal−Ligand Cluster Hosts. Chem. Rev. 115 (2015) 3012−3035. DOI: 10.1021/cr4001226 [19] A.J. Neel M.J. Hilton M.S. Sigman F.D. Toste Exploiting non-covalent π interactions for catalyst design Nature 543 2017 637 646 10.1038/nature21701 A.J. Neel, M.J. Hilton, M.S. Sigman, F.D. Toste, Exploiting non-covalent π interactions for catalyst design. Nature 543 (2017) 637–646. DOI: 10.1038/nature21701 [20] G. Olivo G. Capocasa D.D. Giudice O. Lanzalunga S.D. Stefano New horizons for catalysis disclosed by supramolecular chemistry Chem. Soc. Rev. 50 2021 7681 7724 10.1039/D1CS00175B G. Olivo, G. Capocasa, D.D. Giudice, O. Lanzalunga, S.D. Stefano, New horizons for catalysis disclosed by supramolecular chemistry. Chem. Soc. Rev. 50 (2021) 7681–7724. DOI: 10.1039/D1CS00175B [21] R. Ham C.J. Nielsen S. Pullen J.N.H. Reek Supramolecular coordination cages for artificial photosynthesis and synthetic photocatalysis Chem. Rev. 123 2023 5225 5261 10.1021/acs.chemrev.2c00759 R. Ham, C. J. Nielsen, S. Pullen, J.N.H. Reek, Supramolecular Coordination Cages for Artificial Photosynthesis and Synthetic Photocatalysis. Chem. Rev. 123 (2023) 5225−5261. DOI: 10.1021/acs.chemrev.2c00759 [22] D. de Groot B.F.M. de Waal J.N.H. Reek A.P.H.J. Schenning P.C.J. Kamer E.W. Meijer P.W.N.M. van Leeuwen Noncovalently functionalized dendrimers as recyclable catalysts J. Am. Chem. Soc. 123 2001 8453 8458 10.1021/ja005774u D. de Groot, B.F.M. de Waal, J.N.H. Reek, A.P.H.J. Schenning, P.C.J. Kamer, E.W. Meijer, P.W.N.M. van Leeuwen, Noncovalently Functionalized Dendrimers as Recyclable Catalysts. J. Am. Chem. Soc. 123 (2001) 8453−8458. DOI: 10.1021/ja005774u [23] R. Chen R.P.J. Bronger P.C.J. Kamer P.W.N.M. van Leeuwen J.N.H. Reek Noncovalent anchoring of homogeneous catalysts to silica supports with well-defined binding sites J. Am. Chem. Soc. 126 2004 14557 14566 10.1021/ja046956h R. Chen, R.P.J. Bronger, P.C.J. Kamer, P.W.N.M. van Leeuwen, J.N.H. Reek, Noncovalent Anchoring of Homogeneous Catalysts to Silica Supports with Well-Defined Binding Sites. J. Am. Chem. Soc. 126 (2004) 14557−14566. DOI: 10.1021/ja046956h [24] W. Gong D. Chu H. Jiang X. Chen Y. Cui Y. Liu Permanent porous hydrogen-bonded frameworks with two types of Brønsted acid sites for heterogeneous asymmetric catalysis Nat. Commun. 10 2019 600 608 10.1038/s41467-019-08416-6 W. Gong, D. Chu, H. Jiang, X. Chen, Y. Cui, Y. Liu, Permanent porous hydrogen-bonded frameworks with two types of Brønsted acid sites for heterogeneous asymmetric catalysis. Nat. Commun. 10 (2019) 600−608. DOI: 10.1038/s41467-019-08416-6 [25] H. Zhang C. Zou H. Zhao Z. Cai C. Chen Hydrogen-bonding-induced heterogenization of nickel and palladium catalysts for copolymerization of ethylene with polar monomers Angew. Chem. Int. Ed. 60 2021 17446 17451 10.1002/anie.202106682 H. Zhang, C. Zou, H. Zhao, Z. Cai, C. Chen, Hydrogen-Bonding-Induced Heterogenization of Nickel and Palladium Catalysts for Copolymerization of Ethylene with Polar Monomers. Angew. Chem. Int. Ed. 60 (2021) 17446–17451. DOI: 10.1002/anie.202106682 [26] G. Liu B. Wu J. Zhang X. Wang M. Shao J. Wang Controlled reversible immobilization of Ru carbene on single-walled carbon nanotubes: a new strategy for green catalytic systems based on a solvent effECT on π-π interaction Inorg. Chem. 48 2009 2383 2390 10.1021/ic801111h G. Liu, B. Wu, J. Zhang, X. Wang, M. Shao, J. Wang, Controlled Reversible Immobilization of Ru Carbene on Single-Walled Carbon Nanotubes: A New Strategy for Green Catalytic Systems Based on a Solvent Effect on π-π Interaction. Inorg. Chem. 48 (2009) 2383–2390. DOI: 10.1021/ic801111h [27] S. Wittmann A. Schtz R.N. Grass W.J. Stark O. Reiser A Recyclable nanoparticle-supported palladium catalyst for the hydroxycarbonylation of aryl halides in water Angew. Chem. Int. Ed. 49 2010 1867 1870 10.1002/anie.200906166 S. Wittmann, A. Schtz, R.N. Grass, W.J. Stark, O. Reiser, A Recyclable Nanoparticle-Supported Palladium Catalyst for the Hydroxycarbonylation of Aryl Halides in Water. Angew. Chem. Int. Ed. 49 (2010) 1867–1870. DOI: 10.1002/anie.200906166 [28] P. Garrido-Barros C. Gimbert-Suriñach D. Moonshiram A. Picón P. Monge V.S. Batista A. Llobet Electronic π‑delocalization boosts catalytic water oxidation by Cu(II) molecular catalysts heterogenized on graphene sheets J. Am. Chem. Soc. 139 2017 12907 12910 10.1021/jacs.7b06828 P. Garrido-Barros, C. Gimbert-Suriñach, D. Moonshiram, A. Picón, P. Monge, V.S. Batista, A. Llobet, Electronic π‑Delocalization Boosts Catalytic Water Oxidation by Cu(II) Molecular Catalysts Heterogenized on Graphene Sheets. J. Am. Chem. Soc. 139 (2017) 12907−12910. DOI: 10.1021/jacs.7b06828 [29] J. Yang H. Miao J. Jing Y. Zhu W. Choi Photocatalytic activity enhancement of PDI supermolecular via π-π action and energy level adjusting with graphene quantum dots Appl. Catal. B: Environ. 281 2021 119547 10.1016/j.apcatb.2020.119547 J. Yang, H. Miao, J. Jing, Y. Zhu, W. Choi, Photocatalytic activity enhancement of PDI supermolecular via π-π action and energy level adjusting with graphene quantum dots. Appl. Catal. B: Environ. 281 (2021) 119547. DOI: 10.1016/j.apcatb.2020.119547 [30] S.K. Sharma P.A. Parikh R.V. Jasra Hydroformylation of alkenes using heterogeneous catalyst prepared by intercalation of HRh(CO)(TPPTS)3 complex in hydrotalcite J. Mol. Catal. A Chem. 316 2010 153 162 10.1016/j.molcata.2009.10.014 S.K. Sharma, P.A. Parikh, R.V. Jasra, Hydroformylation of alkenes using heterogeneous catalyst prepared by intercalation of HRh(CO)(TPPTS)3 complex in hydrotalcite. J. Mol. Catal. A: Chem. 316 (2010) 153–162. DOI: 10.1016/j.molcata.2009.10.014 [31] K. Dong Q. Sun Y. Tang C. Shan B. Aguila S. Wang X. Meng S. Ma F.-S. Xiao Bio-inspired creation of heterogeneous reaction vessels via polymerization of supramolecular ion pair Nat. Commun. 10 2019 3059 3067 10.1038/s41467-019-11080-5 K. Dong, Q. Sun, Y. Tang, C. Shan, B. Aguila, S. Wang, X. Meng, S. Ma, F.-S. Xiao, Bio-inspired creation of heterogeneous reaction vessels via polymerization of supramolecular ion pair. Nat. Commun. 10, (2019) 3059–3067. DOI: 10.1038/s41467-019-11080-5 [32] L. Qin R. Wang X. Xin M. Zhang T. Liu H. Lv G.-Y. Yang A dual-functional supramolecular assembly for enhanced photocatalytic hydrogen evolution Appl. Catal. B: Environ. 312 2022 121386 10.1016/j.apcatb.2022.121386 L. Qin, R. Wang, X. Xin, M. Zhang, T. Liu, H. Lv, G.-Y. Yang, A dual-functional supramolecular assembly for enhanced photocatalytic hydrogen evolution. Appl. Catal. B: Environ. 312 (2022) 121386. DOI: 10.1016/j.apcatb.2022.121386 [33] B. Cai P. Huang Y. Fang H. Tian Recyclable and Stable porphyrin-based self-assemblies by electrostatic force for efficient photocatalytic organic transformation Adv. Sci. 11 2024 2308469 10.1002/advs.202308469 B. Cai, P. Huang, Y. Fang, H. Tian, Recyclable and Stable Porphyrin-Based Self-Assemblies by Electrostatic Force for Efficient Photocatalytic Organic Transformation. Adv. Sci. 11 (2024) 2308469. DOI: 10.1002/advs.202308469 [34] L. Wang D.E. Polyansky J.J. Concepcion Self-assembled bilayers as an anchoring strategy: catalysts, chromophores, and chromophore-catalyst assemblies J. Am. Chem. Soc. 141 2019 8020 8024 10.1021/jacs.9b01044 L. Wang, D. E. Polyansky, J. J. Concepcion, Self-Assembled Bilayers as an Anchoring Strategy: Catalysts, Chromophores, and Chromophore-Catalyst Assemblies. J. Am. Chem. Soc. 141 (2019) 8020−8024. DOI: 10.1021/jacs.9b01044 [35] K. Sakamoto S. Masuda S. Takano T. Tsukuda Partially thiolated Au25 cluster anchored on carbon support via noncovalent ligand−support interactions: active and robust catalyst for aerobic oxidation of alcohols ACS Catal. 13 2023 3263 3271 10.1021/acscatal.2c06197 K. Sakamoto, S. Masuda, S. Takano, T. Tsukuda, Partially Thiolated Au25 Cluster Anchored on Carbon Support via Noncovalent Ligand−Support Interactions: Active and Robust Catalyst for Aerobic Oxidation of Alcohols. ACS Catal. 13 (2023) 3263−3271. DOI: 10.1021/acscatal.2c06197 [36] Z. Zhang Y. Zhang L. Zhao Z. Wang Noncovalent assembly strategy for efficient synthesis of dual-atom catalysts Adv. Funct. Mater. 34 2024 2407128 10.1002/adfm.202407128 Z. Zhang, Y. Zhang, L. Zhao, Z. Wang, Noncovalent Assembly Strategy for Efficient Synthesis of Dual-Atom Catalysts. Adv. Funct. Mater. 34 (2024) 2407128. DOI: 10.1002/adfm.202407128 [37] Z.-M. Luo J.-W. Wang M. Nicaso M. Gil-Sepulcre E. Solano V. Nikolaou J. Benet M. Segado-Centellas C. Bo A. Llobet Supramolecular anchoring of Fe(III) molecular redox catalysts into graphitic surfaces Via CH-π and π–π interactions for CO2 electroreduction Angew. Chem. Int. Ed. 63 2024 e202412188 10.1002/anie.202412188 Z.-M. Luo, J.-W. Wang, M. Nicaso, M. Gil-Sepulcre, E. Solano, V. Nikolaou, J. Benet, M. Segado-Centellas, C. Bo, A. Llobet, Supramolecular Anchoring of Fe(III) Molecular Redox Catalysts into Graphitic Surfaces Via CH-π and π–π Interactions for CO2 Electroreduction. Angew. Chem. Int. Ed. 63 (2024) e202412188. DOI: 10.1002/anie.202412188 [38] L. Yu Z. Wang J. Wu S. Tu K. Ding Directed orthogonal self-assembly of homochiral coordination polymers for heterogeneous enantioselective hydrogenation Angew. Chem. Int. Ed. 49 2010 3627 3630 10.1002/anie.200906405 L. Yu, Z. Wang, J. Wu, S. Tu, K. Ding, Directed Orthogonal Self-Assembly of Homochiral Coordination Polymers for Heterogeneous Enantioselective Hydrogenation. Angew. Chem. Int. Ed. 49 (2010) 3627–3630. DOI: 10.1002/anie.200906405 [39] J. Potier S. Menuel E. Monflier F. Hapiot Synergetic effect of randomly methylated β‑cyclodextrin and a supramolecular hydrogel in rh-catalyzed hydroformylation of higher olefins ACS Catal. 4 2014 2342 2346 10.1021/cs5004883 J. Potier, S. Menuel, E. Monflier, F. Hapiot, Synergetic Effect of Randomly Methylated β‑Cyclodextrin and a Supramolecular Hydrogel in Rh-Catalyzed Hydroformylation of Higher Olefins. ACS Catal. 4 (2014) 2342−2346. DOI: 10.1021/cs5004883 [40] Z. Miao S. Guo Q. Li Atomically dispersed Fe-Nx/C electrocatalyst boosts oxygen catalysis via a new metal-organic polymer supramolecule strategy Adv. Energy Mater. 8 2018 1801226 10.1002/aenm.201801226 Z. Miao, S. Guo, Q. Li, Atomically Dispersed Fe-Nx/C Electrocatalyst Boosts Oxygen Catalysis via a New Metal-Organic Polymer Supramolecule Strategy. Adv. Energy Mater. 8 (2018) 1801226. DOI: 10.1002/aenm.201801226 [41] P. Verma A. Singh F.A. Rahimi T.K. Maji Colocalization of light harvesting and catalytic units in a ‘soft’ coordination polymer hydrogel toward visible-light driven photocatalytic hydrogen production J. Mater. Chem. A 9 2021 13608 13614 10.1039/D1TA02425F P. Verma, A. Singh, F.A. Rahimi, T.K. Maji, Colocalization of light harvesting and catalytic units in a ‘soft’ coordination polymer hydrogel toward visible-light driven photocatalytic hydrogen production. J. Mater. Chem. A 9 (2021) 13608–13614. DOI: 10.1039/D1TA02425F [42] B. Mondal K. Acharyya P. Howlader P.S. Mukherjee Molecular cage impregnated palladium nanoparticles: efficient, additive-free heterogeneous catalysts for cyanation of aryl halides J. Am. Chem. Soc. 138 2016 1709 1716 10.1021/jacs.5b13307 B. Mondal, K. Acharyya, P. Howlader, P.S. Mukherjee, Molecular Cage Impregnated Palladium Nanoparticles: Efficient, Additive-Free Heterogeneous Catalysts for Cyanation of Aryl Halides. J. Am. Chem. Soc. 138 (2016) 1709−1716. DOI: 10.1021/jacs.5b13307 [43] N.J. Oldenhuis K.P. Qin S. Wang H.-Z. Ye E.A. Alt A.P. Willard T.V. Voorhis S.L. Craig J.A. Johnson Photoswitchable sol–gel transitions and catalysis mediated by polymer networks with coumarin-decorated cu24l24 metal–organic cages as junctions Angew. Chem. Int. Ed. 59 2020 2784 2792 10.1002/anie.201913297 N.J. Oldenhuis, K.P. Qin, S. Wang, H.-Z. Ye, E.A. Alt, A.P. Willard, T.V. Voorhis, S.L. Craig, J.A. Johnson, Photoswitchable Sol–Gel Transitions and Catalysis Mediated by Polymer Networks with Coumarin-Decorated Cu24L24 Metal–Organic Cages as Junctions. Angew. Chem. Int. Ed. 59 (2020) 2784–2792. DOI: 10.1002/anie.201913297 [44] X.-W. Zhu F.-L. Zhuang Z.-Y. Chen S. Zhou Y.-B. Wei X.-P. Zhou D. Li Heterometal−organic cages as photo-fenton-like catalysts Inorg. Chem. 60 2021 14721 14730 10.1021/acs.inorgchem.1c01841 X.-W. Zhu, F.-L. Zhuang, Z.-Y. Chen, S. Zhou, Y.-B. Wei, X.-P. Zhou, D. Li, Heterometal−Organic Cages as Photo-Fenton-like Catalysts. Inorg. Chem. 60 (2021) 14721−14730. DOI: 10.1021/acs.inorgchem.1c01841 [45] C.M. Brown D.J. Lundberg J.R.L. Kevlishvili D. Kleinschmidt Y.S. Alfaraj H.J. Kulik M.F. Ottaviani N.J. Oldenhuis J.A. Johnson Endohedrally functionalized metal−organic cage-cross-linked polymer gels as modular heterogeneous catalysts J. Am. Chem. Soc. 144 2022 13276 13284 10.1021/jacs.2c04289 C.M. Brown, D.J. Lundberg, J.R.L. Kevlishvili, D. Kleinschmidt, Y.S. Alfaraj, H.J. Kulik, M.F. Ottaviani, N.J. Oldenhuis, J.A. Johnson, Endohedrally Functionalized Metal−Organic Cage-Cross-Linked Polymer Gels as Modular Heterogeneous Catalysts. J. Am. Chem. Soc. 144 (2022) 13276−13284. DOI: 10.1021/jacs.2c04289 [46] C.-D. Wu M. Zhao Incorporation of molecular catalysts in metal–organic frameworks for highly efficient heterogeneous catalysis Adv. Mater. 29 2017 1605446 10.1002/adma.201605446 C.-D. Wu, M. Zhao, Incorporation of Molecular Catalysts in Metal–Organic Frameworks for Highly Efficient Heterogeneous Catalysis. Adv. Mater. 29 (2017) 1605446. DOI: 10.1002/adma.201605446 [47] C.M. Hong R.G. Bergman K.N. Raymond F.D. Toste Self-assembled tetrahedral hosts as supramolecular catalysts Acc. Chem. Res. 51 2018 2447 2455 10.1021/acs.accounts.8b00328 C.M. Hong, R.G. Bergman, K.N. Raymond, F.D. Toste, Self-Assembled Tetrahedral Hosts as Supramolecular Catalysts. Acc. Chem. Res. 51 (2018) 2447−2455. DOI: 10.1021/acs.accounts.8b00328 [48] B. Zhang J.N.H. Reek Supramolecular strategies for the recycling of homogeneous catalysts Chem. Asian J. 16 2021 3851 3863 10.1002/asia.202100968 B. Zhang, J.N.H. Reek, Supramolecular Strategies for the Recycling of Homogeneous Catalysts. Chem Asian J. 16 (2021) 3851–3863. DOI: 10.1002/asia.202100968 [49] X. Tang J. Pang J. Dong Y. Liu X.-H. Bu Y. Cui Supramolecular assembly frameworks (SAFs): shaping the future of functional materials Angew. Chem. Int. Ed. 63 2024 e202406956 10.1002/anie.202406956 X. Tang, J. Pang, J. Dong, Y. Liu, X.-H. Bu, Y. Cui, Supramolecular Assembly Frameworks (SAFs): Shaping the Future of Functional Materials. Angew. Chem. Int. Ed. 63 (2024) e202406956. DOI: 10.1002/anie.202406956 [50] L. Kan L. Zhang L.-Z. Dong X.-H. Wang R.-H. Li C. Guo X. Li Y. Yan S.-L. Li Y.-Q. Lan Bridging the homogeneous and heterogeneous catalysis by supramolecular metal-organic cages with varied packing modes Adv. Mater. 36 2024 2310061 10.1002/adma.202310061 L. Kan, L. Zhang, L.-Z. Dong, X.-H. Wang, R.-H. Li, C. Guo, X. Li, Y. Yan, S.-L. Li, Y.-Q. Lan, Bridging the Homogeneous and Heterogeneous Catalysis by Supramolecular Metal-Organic Cages with Varied Packing Modes. Adv. Mater. 36 (2024) 2310061. DOI: 10.1002/adma.202310061 [51] H. Chen Z.-J. Shu X.-L. Zheng Q.-H. Wu H.-R. Liang M.-L. Yuan Synthesis methods and applications of 2,2'-bipyridine-based bisphosphine ligands (chengdu Xinhuayuan Sci. & Tech. Limit. Comp.), CN 202210438026 2022 9 H. Chen, Z.-J. Shu, X.-L. Zheng, Q.-H. Wu, H.-R. Liang, M.-L. Yuan, Synthesis methods and applications of 2,2'-bipyridine-based bisphosphine ligands. (Chengdu Xinhuayuan Sci. & Tech. Limit. Comp.), CN 202210438026.9, (2022). [52] V.W.W. Yam V.K.M. Au S.Y.L. Leung Light-emitting self-assembled materials based on d8 and d10 transition metal complexes Chem. Rev. 115 2015 7589 7728 10.1021/acs.chemrev.5b00074 V.W.W. Yam, V.K.M. Au, S.Y.L. Leung, Light-Emitting Self-Assembled Materials Based on d8 and d10 Transition Metal Complexes. Chem. Rev. 115 (2015) 7589−7728. DOI: 10.1021/acs.chemrev.5b00074 [53] A.K.W. Chan D. Wu K.M.C. Wong V.W.W. Yam Rhodium(I) complexes of tridentate N‑donor ligands and their supramolecular assembly studies Inorg. Chem. 55 2016 3685 3691 10.1021/acs.inorgchem.6b00289 A.K.W. Chan, D. Wu, K.M.C. Wong, V.W.W. Yam, Rhodium(I) Complexes of Tridentate N‑Donor Ligands and Their Supramolecular Assembly Studies. Inorg. Chem. 55 (2016) 3685–3691. DOI: 10.1021/acs.inorgchem.6b00289 [54] K. Masada K. Okabe S. Kusumoto K. Nozaki A dinuclear Rh(−I)/Rh(I) complex bridged by biphilic phosphinine ligands Chem. Sci. 14 2023 8524 8530 10.1039/D3SC02292G K. Masada, K. Okabe, S. Kusumoto, K. Nozaki, A dinuclear Rh(−I)/Rh(I) complex bridged by biphilic phosphinine ligands. Chem. Sci. 14 (2023) 8524–8530. DOI: 10.1039/D3SC02292G [55] A. van Rooy E.N. Orij P.C.J. Hamer P.W.N.M. van Leeuwen Hydroformylation with a Rhodium/Bulky Phosphite Modified Catalyst. Catalyst Comparison for Oct-1-ene, cyclohexene, and styrene Organometallics 14 1995 34 43 10.1021/om00001a010 A. van Rooy, E.N. Orij, P.C.J. Hamer, P.W.N.M. van Leeuwen, Hydroformylation with a Rhodium/Bulky Phosphite Modified Catalyst. Catalyst Comparison for Oct-1-ene, Cyclohexene, and Styrene. Organometallics 14 (1995) 34–43. DOI: 10.1021/om00001a010 [56] M.C. Simpson D.J. Cole-Hamilton Catalytic applications of rhodium complexes containing trialkylphosphines Coord. Chem. Rev. 155 1996 163 207 10.1016/S0010-8545(96)90181-2 M.C. Simpson, D.J. Cole-Hamilton, Catalytic applications of rhodium complexes containing trialkylphosphines. Coord. Chem. Rev. 155 (1996) 163–207. DOI: 10.1016/S0010-8545(96)90181-2 [57] P.C.J. Kamer A. van Rooy G.C. Schoemaker P.W.N.M. van Leeuwen In situ mechanistic studies in rhodium catalyzed hydroformylation of alkenes Coord. Chem. Rev. 248 2004 2409 2424 10.1016/j.ccr.2004.06.006 P.C.J. Kamer, A. van Rooy, G.C. Schoemaker, P.W.N.M. van Leeuwen, In situ mechanistic studies in rhodium catalyzed hydroformylation of alkenes. Coord. Chem. Rev. 248 (2004) 2409–2424. DOI: 10.1016/j.ccr.2004.06.006 [58] R. Franke D. Selent A. Börner Applied hydroformylation Chem. Rev. 112 2012 5675 5732 10.1021/cr3001803 R. Franke, D. Selent, A. Börner, Applied Hydroformylation. Chem. Rev. 112 (2012) 5675−5732. DOI: 10.1021/cr3001803 [59] X.-F. Wu X. Fang L. Wu R. Jackstell H. Neumann M. Beller Transition-metal-catalyzed carbonylation reactions of olefins and alkynes: a personal account Acc. Chem. Res. 47 2014 1041 1053 10.1021/ar400222k X.-F. Wu, X. Fang, L. Wu, R. Jackstell, H. Neumann, M. Beller, Transition-Metal-Catalyzed Carbonylation Reactions of Olefins and Alkynes: A Personal Account. Acc. Chem. Res. 47 (2014) 1041−1053. DOI: 10.1021/ar400222k [60] A.C.J. Koeken N.M.B. Smeets A bulky phosphite modified rhodium catalyst for efficient hydroformylation of disubstituted alkenes and macromonomers in supercritical carbon dioxide Catal. Sci. Technol. 3 2013 1036 1045 10.1039/C2CY20867A A.C.J. Koeken, N.M.B. Smeets, A bulky phosphite modified rhodium catalyst for efficient hydroformylation of disubstituted alkenes and macromonomers in supercritical carbon dioxide. Catal. Sci. Technol. 3 (2013) 1036–1045. DOI: 10.1039/C2CY20867A [61] X.-L. Zheng C.-Y. Zheng F.-D. Zhou H.-Y. Fu M.-L. Yuan R.-X. Li B. Xu H. Chen Highly active rhodium/phosphorus catalytic system for the hydroformylation of α-methylstyrene Chin. Chem. Lett. 27 2016 678 680 10.1016/j.cclet.2016.01.028 X.-L. Zheng, C.-Y. Zheng, F.-D. Zhou, H.-Y. Fu, M.-L. Yuan, R.-X. Li, B. Xu, H. Chen, Highly active rhodium/phosphorus catalytic system for the hydroformylation of α-methylstyrene. Chin. Chem. Lett. 27 (2016) 678–680. DOI: 10.1016/j.cclet.2016.01.028 [62] R.H. Crabtree Resolving heterogeneity problems and impurity artifacts in operationally homogeneous transition metal catalysts Chem. Rev. 112 2012 1536 1554 10.1021/cr2002905 R.H. Crabtree, Resolving Heterogeneity Problems and Impurity Artifacts in Operationally Homogeneous Transition Metal Catalysts. Chem. Rev. 112 (2012) 1536−1554. DOI: 10.1021/cr2002905 [63] S. de Doncker A. Casimiro I.A. Kotze S. Ngubane G.S. Smith Bimetallic paddlewheel-type dirhodium(II,II) acetate and formamidinate complexes: synthesis, structure, electrochemistry, and hydroformylation activity Inorg. Chem. 59 2020 12928 12940 10.1021/acs.inorgchem.0c02020 S. de Doncker, A. Casimiro, I.A. Kotze, S. Ngubane, G.S. Smith, Bimetallic Paddlewheel-type Dirhodium(II,II) Acetate and Formamidinate Complexes: Synthesis, Structure, Electrochemistry, and Hydroformylation Activity. Inorg. Chem. 59 (2020) 12928−12940. DOI: 10.1021/acs.inorgchem.0c02020 [64] L.C. Matsinha S.F. Mapolie G.S. Smith Recoverable and recyclable water-soluble sulphonated salicylaldimine Rh(I) complexes for 1-octene hydroformylation in aqueous biphasic media Dalton Trans. 44 2015 1240 1248 10.1039/C4DT02740J L.C. Matsinha, S.F. Mapolie, G.S. Smith, Recoverable and Recyclable Water-Soluble Sulphonated Salicylaldimine Rh(I) Complexes for 1-Octene Hydroformylation in Aqueous Biphasic Media. Dalton Trans. 44 (2015) 1240–1248. DOI: 10.1039/C4DT02740J [65] S. Siangwata N.C.C. Breckwoldt N.J. Goosen G.S. Smith Olefin hydroformylation and kinetic studies using mono- and trinuclear N,O-chelate rhodium(I)-aryl ether precatalysts Appl. Catal. A. Gen. 585 2019 117179 10.1016/j.apcata.2019.117179 S. Siangwata, N.C.C. Breckwoldt, N.J. Goosen, G.S. Smith, Olefin Hydroformylation and Kinetic Studies Using Mono- and Trinuclear N,O-chelate Rhodium(I)-Aryl Ether Precatalysts. Appl. Catal. A, Gen. 585 (2019) 117179. DOI: 10.1016/j.apcata.2019.117179 [66] J.M. Dreimann E. Kohls H.F.W. Warmeling M. Stein L.F. Guo M. Garland T.N. Dinh A.J. Vorholt In Situ infrared spectroscopy as a tool for monitoring molecular catalyst for hydroformylation in continuous processes ACS Catal. 9 2019 4308 4319 10.1021/acscatal.8b05066 J.M. Dreimann, E. Kohls, H.F.W. Warmeling, M. Stein, L.F. Guo, M. Garland, T.N. Dinh, A.J. Vorholt, In Situ Infrared Spectroscopy as a Tool for Monitoring Molecular Catalyst for Hydroformylation in Continuous Processes. ACS Catal. 9 (2019) 4308−4319. DOI: 10.1021/acscatal.8b05066 [67] O. Diebolt P.W.N.M. van Leeuwen P.C.J. Kamer Operando Spectroscopy in Catalytic Carbonylation Reactions ACS Catal. 2 2012 2357 2370 10.1021/cs300471s O. Diebolt, P.W.N.M. van Leeuwen, P.C.J. Kamer, Operando Spectroscopy in Catalytic Carbonylation Reactions. ACS Catal. 2 (2012) 2357−2370. DOI: 10.1021/cs300471s [68] J. Liu K. Dong R. Franke H. Neumann R. Jackstell M. Beller Selective palladium-catalyzed carbonylation of alkynes: an atom economic synthesis of 1,4-dicarboxylic acid diesters J. Am. Chem. Soc. 140 2018 10282 10288 10.1021/jacs.8b05852 J. Liu, K. Dong, R. Franke, H. Neumann, R. Jackstell, M. Beller, Selective Palladium-Catalyzed Carbonylation of Alkynes: An Atom Economic Synthesis of 1,4-Dicarboxylic Acid Diesters. J. Am. Chem. Soc. 140 (2018) 10282−10288. DOI: 10.1021/jacs.8b05852 [69] L. Ming Z. Liu H. Chen H. Fu R. Li X. Zheng Bifunctional diphosphine ligand-enabled cobalt catalyzed bis-alkoxycarbonylation of alkynes J. Catal. 433 2024 115459 10.1016/j.jcat.2024.115459 L. Ming, Z. Liu, H. Chen, H. Fu, R. Li, X. Zheng, Bifunctional diphosphine ligand-enabled cobalt catalyzed bis-alkoxycarbonylation of alkynes. J. Catal. 433 (2024) 115459. DOI: 10.1016/j.jcat.2024.115459 [70] M.J. Frisch, G.W. Trucks, H.B. Schlegel, G.E. Scuseria, M.A. Robb, J.R. Cheeseman, G. Scalmani, V. Barone, G.A. Petersson, H. Nakatsuji, X. Li, M. Caricato, A. Marenich, J. Bloino, B.G. Janesko, R. Gomperts, B. Mennucci, H.P. Hratchian, J.V. Ortiz, A.F. Izmaylov, J.L. Sonnenberg, D. Williams-Young, F. Ding, F. Lipparini, F. Egidi, J. Goings, B. Peng, A. Petrone, T. Henderson, D. Ranasinghe, V.G. Zakrzewski, J. Gao, N. Rega, G. Zheng, W. Liang, M. Hada, M. Ehara, K. Toyota, R. Fukuda, J. Hasegawa, M. Ishida, T. Nakajima, Y. Honda, O. Kitao, H. Nakai, T. Vreven, K. Throssell, J. A. Montgomery, Jr., J. E. Peralta, F. Ogliaro, M. Bearpark, J. J. Heyd, E. Brothers, K.N. Kudin, V.N. Staroverov, T. Keith, R. Kobayashi, J. Normand, K. Raghavachari, A. Rendell, J.C. Burant, S.S. Iyengar, J. Tomasi, M. Cossi, J. M. Millam, M. Klene, C. Adamo, R. Cammi, J.W. Ochterski, R.L. Martin, K. Morokuma, O. Farkas, J.B. Foresman, D.J. Fox, Gaussian, Inc., Wallingford CT, 2016. [71] T. Lu Q. Chen Shermo: a general code for calculating molecular thermochemistry properties Comput. Theor. Chem. 1200 2021 113249 10.1016/j.comptc.2021.113249 T. Lu, Q. Chen, Shermo: A general code for calculating molecular thermochemistry properties. Comput. Theor. Chem. 1200 (2021) 113249. DOI: 10.1016/j.comptc.2021.113249 [72] D. Sellmann G.H. Rackelmann F.W. Heinemann Heterolytic activation of dihydrogen at transition-metal sulfur sites in coordinatively unsaturated [Rh(L)(“buS4”)]BF4 complexes, involving neutral hydrides, thiol hydrides, and thiol-hydride proton scrambling (L = CO, PCy3; “buS4”2- = 1,2-Bis[(2-mercapto-3,5-di-tert-butylphenylthio]ethane2-) Chem. Eur. J. 3 1997 2071 2080 10.1002/chem.19970031224 D. Sellmann, G.H. Rackelmann, F.W. Heinemann, Heterolytic Activation of Dihydrogen at Transition-Metal Sulfur Sites in Coordinatively Unsaturated [Rh(L)(“buS4”)]BF4 Complexes, Involving Neutral Hydrides, Thiol Hydrides, and Thiol-Hydride Proton Scrambling (L = CO, PCy3; “buS4”2- = 1,2-Bis[(2-mercapto-3,5-di-tert-butylphenylthio]ethane2-). Chem. Eur. J. 3 (1997) 2071–2080. DOI: 10.1002/chem.19970031224 [73] F. Hutschka A. Dedieu On the assistance of the heterolytic cleavage of H2 by an external base: a theoretical assessment J. Chem. Soc. Dalton Trans. 11 1997 1899 1902 10.1039/A608594F F. Hutschka, A. Dedieu, On the assistance of the heterolytic cleavage of H2 by an external base: a theoretical assessment. J. Chem. Soc., Dalton Trans. 11 (1997) 1899–1902. DOI: 10.1039/A608594F [74] J. Andrieu J.-M. Camus P. Richard R. Poli L. Gonsalvi F. Vizza M. Peruzzini Amino-phosphanes in RhI-catalyzed hydroformylation: hemilabile behavior of P,N ligands under high CO pressure and catalytic properties Eur. J. Inorg. Chem. 1 2006 51 61 10.1002/ejic.200500432 J. Andrieu, J.-M. Camus, P. Richard, R. Poli, L. Gonsalvi, F. Vizza, M. Peruzzini, Amino-phosphanes in RhI-Catalyzed Hydroformylation: Hemilabile Behavior of P,N Ligands under High CO Pressure and Catalytic Properties. Eur. J. Inorg. Chem. 1 (2006) 51–61. DOI: 10.1002/ejic.200500432 [75] S. Linke K. McBride K. Sundmacher Systematic green solvent selection for the hydroformylation of long-chain alkenes ACS Sustain. Chem. Eng. 8 2020 10795 10811 10.1021/acssuschemeng.0c02611 S. Linke, K. McBride, K. Sundmacher, Systematic Green Solvent Selection for the Hydroformylation of Long-Chain Alkenes. ACS Sustainable Chem. Eng. 8 (2020) 10795−10811. DOI: 10.1021/acssuschemeng.0c02611 [76] B. Liu Y. Wang N. Huang X. Lan Z. Xie J.G. Chen T. Wang Heterogeneous hydroformylation of alkenes by Rh-based catalysts Chem 8 2022 2630 2658 10.1016/j.chempr.2022.07.020 B. Liu, Y. Wang, N. Huang, X. Lan, Z. Xie, J.G. Chen, T. Wang, Heterogeneous hydroformylation of alkenes by Rh-based catalysts. Chem 8 (2022) 2630−2658. DOI: 10.1016/j.chempr.2022.07.020",
      "scopus-id": "105008885473",
      "coredata": {
        "eid": "1-s2.0-S0021951725003501",
        "dc:description": "The design of carrier-free recyclable catalysts is a key objective yet challenging task in modern catalysis. Here, we present the self-assembly of a nitrogen and phosphine-containing ligand (L) with RhI precusor to form a supramolecular assembly framework, (RhI 2L2)n·X, as confirmed by NMR, ESI-MS and X-ray crystallographic analysis. This RhI supramolecular assembly framework can partially dissolve in solution at high temperatures and fully recover at room temperature, facilitated by π-π, C–H···π and electrostatic interactions, thereby adopting the merits of both homogeneous and heterogeneous catalysis. The inherent coordination mode of RhI 2L2 enables this RhI supramolecular assembly framework to serve as an effective catalyst for promoting the hydroformylation and hydrosilylation of alkenes, with its practicality further demonstrated in a continuous-flow mini-plant, kilogram-scale hydroformylation of Fischtropsch C8 alkene, affording a turnover number of 1.27 × 105 over a 100-hour recycling period. In-situ high-pressure FTIR and DFT calculation elucidate the role of nitrogen and the dynamic evolution of catalytic resting state in the presence of syngas and alkene.",
        "openArchiveArticle": "false",
        "prism:coverDate": "2025-10-31",
        "openaccessUserLicense": null,
        "prism:aggregationType": "Journal",
        "prism:url": "https://api.elsevier.com/content/article/pii/S0021951725003501",
        "dc:creator": [
          {
            "@_fa": "true",
            "$": "Fang, Hu"
          },
          {
            "@_fa": "true",
            "$": "Sun, Zuowei"
          },
          {
            "@_fa": "true",
            "$": "Tao, Shaokun"
          },
          {
            "@_fa": "true",
            "$": "Cui, Tianhua"
          },
          {
            "@_fa": "true",
            "$": "Jiang, Yanxin"
          },
          {
            "@_fa": "true",
            "$": "Wu, Qianhui"
          },
          {
            "@_fa": "true",
            "$": "Zhou, Fanding"
          },
          {
            "@_fa": "true",
            "$": "Zhang, Xianwen"
          },
          {
            "@_fa": "true",
            "$": "Xue, Weichao"
          },
          {
            "@_fa": "true",
            "$": "Zhang, Chunchun"
          },
          {
            "@_fa": "true",
            "$": "Zhou, Yuqiao"
          },
          {
            "@_fa": "true",
            "$": "Xu, Jiaqi"
          },
          {
            "@_fa": "true",
            "$": "Li, Ruixiang"
          },
          {
            "@_fa": "true",
            "$": "Fu, Haiyan"
          },
          {
            "@_fa": "true",
            "$": "Chen, Hua"
          },
          {
            "@_fa": "true",
            "$": "Zheng, Xueli"
          }
        ],
        "link": [
          {
            "@_fa": "true",
            "@rel": "self",
            "@href": "https://api.elsevier.com/content/article/pii/S0021951725003501"
          },
          {
            "@_fa": "true",
            "@rel": "scidir",
            "@href": "https://www.sciencedirect.com/science/article/pii/S0021951725003501"
          }
        ],
        "dc:format": "application/json",
        "openaccessType": null,
        "pii": "S0021-9517(25)00350-1",
        "prism:volume": "450",
        "articleNumber": "116285",
        "prism:publisher": "Elsevier Inc. All rights are reserved, including those for text and data mining, AI training, and similar technologies.",
        "dc:title": "RhI supramolecular assembly framework enables recyclable and thermal-stable catalysts for alkene functionalization",
        "prism:copyright": "© 2025 Elsevier Inc. All rights are reserved, including those for text and data mining, AI training, and similar technologies.",
        "openaccess": "0",
        "prism:issn": "00219517",
        "dcterms:subject": [
          {
            "@_fa": "true",
            "$": "Supramolecular assembly framework"
          },
          {
            "@_fa": "true",
            "$": "Alkene functionalization"
          },
          {
            "@_fa": "true",
            "$": "Carrier-free recyclable catalyst"
          },
          {
            "@_fa": "true",
            "$": "Reversibly binding CO"
          },
          {
            "@_fa": "true",
            "$": "Hydroformylation"
          }
        ],
        "openaccessArticle": "false",
        "prism:publicationName": "Journal of Catalysis",
        "openaccessSponsorType": null,
        "prism:pageRange": "116285",
        "pubType": "fla",
        "prism:coverDisplayDate": "October 2025",
        "prism:doi": "10.1016/j.jcat.2025.116285",
        "prism:startingPage": "116285",
        "dc:identifier": "doi:10.1016/j.jcat.2025.116285",
        "openaccessSponsorName": null
      },
      "objects": {
        "object": [
          {
            "@category": "standard",
            "@height": "82",
            "@width": "370",
            "@_fa": "true",
            "$": "https://api.elsevier.com/content/object/eid/1-s2.0-S0021951725003501-fx1.jpg?httpAccept=%2A%2F%2A",
            "@multimediatype": "JPEG image file",
            "@type": "IMAGE-DOWNSAMPLED",
            "@size": "8649",
            "@ref": "fx1",
            "@mimetype": "image/jpeg"
          },
          {
            "@category": "standard",
            "@height": "456",
            "@width": "758",
            "@_fa": "true",
            "$": "https://api.elsevier.com/content/object/eid/1-s2.0-S0021951725003501-gr5.jpg?httpAccept=%2A%2F%2A",
            "@multimediatype": "JPEG image file",
            "@type": "IMAGE-DOWNSAMPLED",
            "@size": "62296",
            "@ref": "gr5",
            "@mimetype": "image/jpeg"
          },
          {
            "@category": "standard",
            "@height": "182",
            "@width": "647",
            "@_fa": "true",
            "$": "https://api.elsevier.com/content/object/eid/1-s2.0-S0021951725003501-gr3.jpg?httpAccept=%2A%2F%2A",
            "@multimediatype": "JPEG image file",
            "@type": "IMAGE-DOWNSAMPLED",
            "@size": "25935",
            "@ref": "gr3",
            "@mimetype": "image/jpeg"
          },
          {
            "@category": "standard",
            "@height": "300",
            "@width": "757",
            "@_fa": "true",
            "$": "https://api.elsevier.com/content/object/eid/1-s2.0-S0021951725003501-gr4.jpg?httpAccept=%2A%2F%2A",
            "@multimediatype": "JPEG image file",
            "@type": "IMAGE-DOWNSAMPLED",
            "@size": "64097",
            "@ref": "gr4",
            "@mimetype": "image/jpeg"
          },
          {
            "@category": "standard",
            "@height": "450",
            "@width": "760",
            "@_fa": "true",
            "$": "https://api.elsevier.com/content/object/eid/1-s2.0-S0021951725003501-gr1.jpg?httpAccept=%2A%2F%2A",
            "@multimediatype": "JPEG image file",
            "@type": "IMAGE-DOWNSAMPLED",
            "@size": "80237",
            "@ref": "gr1",
            "@mimetype": "image/jpeg"
          },
          {
            "@category": "standard",
            "@height": "185",
            "@width": "534",
            "@_fa": "true",
            "$": "https://api.elsevier.com/content/object/eid/1-s2.0-S0021951725003501-gr2.jpg?httpAccept=%2A%2F%2A",
            "@multimediatype": "JPEG image file",
            "@type": "IMAGE-DOWNSAMPLED",
            "@size": "26381",
            "@ref": "gr2",
            "@mimetype": "image/jpeg"
          },
          {
            "@category": "standard",
            "@height": "185",
            "@width": "500",
            "@_fa": "true",
            "$": "https://api.elsevier.com/content/object/eid/1-s2.0-S0021951725003501-ga1.jpg?httpAccept=%2A%2F%2A",
            "@multimediatype": "JPEG image file",
            "@type": "IMAGE-DOWNSAMPLED",
            "@size": "33309",
            "@ref": "ga1",
            "@mimetype": "image/jpeg"
          },
          {
            "@category": "thumbnail",
            "@height": "49",
            "@width": "219",
            "@_fa": "true",
            "$": "https://api.elsevier.com/content/object/eid/1-s2.0-S0021951725003501-fx1.sml?httpAccept=%2A%2F%2A",
            "@multimediatype": "GIF image file",
            "@type": "IMAGE-THUMBNAIL",
            "@size": "2294",
            "@ref": "fx1",
            "@mimetype": "image/gif"
          },
          {
            "@category": "thumbnail",
            "@height": "132",
            "@width": "219",
            "@_fa": "true",
            "$": "https://api.elsevier.com/content/object/eid/1-s2.0-S0021951725003501-gr5.sml?httpAccept=%2A%2F%2A",
            "@multimediatype": "GIF image file",
            "@type": "IMAGE-THUMBNAIL",
            "@size": "6791",
            "@ref": "gr5",
            "@mimetype": "image/gif"
          },
          {
            "@category": "thumbnail",
            "@height": "62",
            "@width": "219",
            "@_fa": "true",
            "$": "https://api.elsevier.com/content/object/eid/1-s2.0-S0021951725003501-gr3.sml?httpAccept=%2A%2F%2A",
            "@multimediatype": "GIF image file",
            "@type": "IMAGE-THUMBNAIL",
            "@size": "6168",
            "@ref": "gr3",
            "@mimetype": "image/gif"
          },
          {
            "@category": "thumbnail",
            "@height": "87",
            "@width": "219",
            "@_fa": "true",
            "$": "https://api.elsevier.com/content/object/eid/1-s2.0-S0021951725003501-gr4.sml?httpAccept=%2A%2F%2A",
            "@multimediatype": "GIF image file",
            "@type": "IMAGE-THUMBNAIL",
            "@size": "7768",
            "@ref": "gr4",
            "@mimetype": "image/gif"
          },
          {
            "@category": "thumbnail",
            "@height": "130",
            "@width": "219",
            "@_fa": "true",
            "$": "https://api.elsevier.com/content/object/eid/1-s2.0-S0021951725003501-gr1.sml?httpAccept=%2A%2F%2A",
            "@multimediatype": "GIF image file",
            "@type": "IMAGE-THUMBNAIL",
            "@size": "10848",
            "@ref": "gr1",
            "@mimetype": "image/gif"
          },
          {
            "@category": "thumbnail",
            "@height": "76",
            "@width": "219",
            "@_fa": "true",
            "$": "https://api.elsevier.com/content/object/eid/1-s2.0-S0021951725003501-gr2.sml?httpAccept=%2A%2F%2A",
            "@multimediatype": "GIF image file",
            "@type": "IMAGE-THUMBNAIL",
            "@size": "5733",
            "@ref": "gr2",
            "@mimetype": "image/gif"
          },
          {
            "@category": "thumbnail",
            "@height": "81",
            "@width": "219",
            "@_fa": "true",
            "$": "https://api.elsevier.com/content/object/eid/1-s2.0-S0021951725003501-ga1.sml?httpAccept=%2A%2F%2A",
            "@multimediatype": "GIF image file",
            "@type": "IMAGE-THUMBNAIL",
            "@size": "8639",
            "@ref": "ga1",
            "@mimetype": "image/gif"
          },
          {
            "@category": "high",
            "@height": "365",
            "@width": "1640",
            "@_fa": "true",
            "$": "https://api.elsevier.com/content/object/eid/1-s2.0-S0021951725003501-fx1_lrg.jpg?httpAccept=%2A%2F%2A",
            "@multimediatype": "JPEG image file",
            "@type": "IMAGE-HIGH-RES",
            "@size": "52781",
            "@ref": "fx1",
            "@mimetype": "image/jpeg"
          },
          {
            "@category": "high",
            "@height": "2020",
            "@width": "3357",
            "@_fa": "true",
            "$": "https://api.elsevier.com/content/object/eid/1-s2.0-S0021951725003501-gr5_lrg.jpg?httpAccept=%2A%2F%2A",
            "@multimediatype": "JPEG image file",
            "@type": "IMAGE-HIGH-RES",
            "@size": "315702",
            "@ref": "gr5",
            "@mimetype": "image/jpeg"
          },
          {
            "@category": "high",
            "@height": "808",
            "@width": "2866",
            "@_fa": "true",
            "$": "https://api.elsevier.com/content/object/eid/1-s2.0-S0021951725003501-gr3_lrg.jpg?httpAccept=%2A%2F%2A",
            "@multimediatype": "JPEG image file",
            "@type": "IMAGE-HIGH-RES",
            "@size": "154474",
            "@ref": "gr3",
            "@mimetype": "image/jpeg"
          },
          {
            "@category": "high",
            "@height": "1328",
            "@width": "3352",
            "@_fa": "true",
            "$": "https://api.elsevier.com/content/object/eid/1-s2.0-S0021951725003501-gr4_lrg.jpg?httpAccept=%2A%2F%2A",
            "@multimediatype": "JPEG image file",
            "@type": "IMAGE-HIGH-RES",
            "@size": "303061",
            "@ref": "gr4",
            "@mimetype": "image/jpeg"
          },
          {
            "@category": "high",
            "@height": "1995",
            "@width": "3366",
            "@_fa": "true",
            "$": "https://api.elsevier.com/content/object/eid/1-s2.0-S0021951725003501-gr1_lrg.jpg?httpAccept=%2A%2F%2A",
            "@multimediatype": "JPEG image file",
            "@type": "IMAGE-HIGH-RES",
            "@size": "459003",
            "@ref": "gr1",
            "@mimetype": "image/jpeg"
          },
          {
            "@category": "high",
            "@height": "821",
            "@width": "2367",
            "@_fa": "true",
            "$": "https://api.elsevier.com/content/object/eid/1-s2.0-S0021951725003501-gr2_lrg.jpg?httpAccept=%2A%2F%2A",
            "@multimediatype": "JPEG image file",
            "@type": "IMAGE-HIGH-RES",
            "@size": "175582",
            "@ref": "gr2",
            "@mimetype": "image/jpeg"
          },
          {
            "@category": "high",
            "@height": "819",
            "@width": "2213",
            "@_fa": "true",
            "$": "https://api.elsevier.com/content/object/eid/1-s2.0-S0021951725003501-ga1_lrg.jpg?httpAccept=%2A%2F%2A",
            "@multimediatype": "JPEG image file",
            "@type": "IMAGE-HIGH-RES",
            "@size": "268653",
            "@ref": "ga1",
            "@mimetype": "image/jpeg"
          },
          {
            "@category": "standard",
            "@_fa": "true",
            "$": "https://api.elsevier.com/content/object/eid/1-s2.0-S0021951725003501-mmc4.docx?httpAccept=%2A%2F%2A",
            "@multimediatype": "Microsoft Word file",
            "@type": "APPLICATION",
            "@size": "88614477",
            "@ref": "mmc4",
            "@mimetype": "application/word"
          },
          {
            "@category": "standard",
            "@_fa": "true",
            "$": "https://api.elsevier.com/content/object/eid/1-s2.0-S0021951725003501-mmc1.pdf?httpAccept=%2A%2F%2A",
            "@multimediatype": "Acrobat PDF file",
            "@type": "APPLICATION",
            "@size": "110079",
            "@ref": "mmc1",
            "@mimetype": "application/pdf"
          },
          {
            "@category": "standard",
            "@_fa": "true",
            "$": "https://api.elsevier.com/content/object/eid/1-s2.0-S0021951725003501-mmc2.pdf?httpAccept=%2A%2F%2A",
            "@multimediatype": "Acrobat PDF file",
            "@type": "APPLICATION",
            "@size": "100496",
            "@ref": "mmc2",
            "@mimetype": "application/pdf"
          },
          {
            "@category": "standard",
            "@_fa": "true",
            "$": "https://api.elsevier.com/content/object/eid/1-s2.0-S0021951725003501-mmc3.pdf?httpAccept=%2A%2F%2A",
            "@multimediatype": "Acrobat PDF file",
            "@type": "APPLICATION",
            "@size": "109700",
            "@ref": "mmc3",
            "@mimetype": "application/pdf"
          }
        ]
      },
      "link": {
        "@rel": "abstract",
        "@href": "https://api.elsevier.com/content/abstract/scopus_id/105008885473"
      }
    }
  }
}