{
  "metadata": {
    "title": "Mechanistic insights into methanol steam reforming on copper catalysts: Dynamics of active sites and reaction pathway",
    "authors": "; ; ",
    "journal": "Journal of Catalysis",
    "date": "2025-02-28",
    "doi": "10.1016/j.jcat.2024.115922",
    "abstract": "",
    "uri": "https://api.elsevier.com/content/article/pii/S0021951724006353",
    "pii": "S0021951724006353"
  },
  "fulltext": {
    "full-text-retrieval-response": {
      "scopus-eid": "2-s2.0-85212845922",
      "originalText": "serial JL 272561 291210 291744 291809 31 Journal of Catalysis JOURNALCATALYSIS 2024-12-21 2024-12-21 2024-12-24 2024-12-24 2025-01-10T20:44:47 1-s2.0-S0021951724006353 S0021-9517(24)00635-3 S0021951724006353 10.1016/j.jcat.2024.115922 S300 S300.1 FULL-TEXT 1-s2.0-S0021951724X00147 2025-01-10T21:03:22.362079Z 0 0 20250201 20250228 2025 2024-12-21T16:25:30.983468Z absattachment articleinfo articlenumber articletitlenorm authfirstinitialnorm authfirstsurnamenorm cid cids contenttype copyright crossmark dateloaded dateloadedtxt datesearch datesort dateupdated dco docsubtype doctype doi eid ewtransactionid hubeid indexeddate issn issnnorm itemstage itemtransactionid itemweight openaccess openarchive pg pgfirst pii piinorm pubdateend pubdatestart pubdatetxt pubyr sectiontitle sortorder srctitle srctitlenorm srctype ssids alllist content subj subheadings suppl tomb volfirst volissue volumelist webpdf webpdfpagecount yearnav figure table e-component body mmlmath acknowledge affil appendices articletitle auth authfirstini authfull authkeywords authlast grantnumber grantsponsor grantsponsorid highlightsabst primabst ref specialabst 0021-9517 00219517 true 442 442 C Volume 442 41 115922 115922 115922 202502 February 2025 2025-02-01 2025-02-28 2025 Regular Articles article fla © 2024 Elsevier Inc. All rights are reserved, including those for text and data mining, AI training, and similar technologies. MECHANISTICINSIGHTSMETHANOLSTEAMREFORMINGCOPPERCATALYSTSDYNAMICSACTIVESITESREACTIONPATHWAY LIU D 1 Introduction 2 Experimental section 2.1 Catalyst preparation 2.2 Characterization 2.3 Catalytic tests 2.4 In situ spectroscopic study 2.5 DFT calculations 3 Results and discussion 4 Conclusions CRediT authorship contribution statement Acknowledgments Appendix A Supplementary data References EBERLE 2009 6608 6630 U OSMAN 2022 153 188 A PALO 2007 3992 4021 D LUNKENBEIN 2015 4544 4548 T XU 2022 Y SA 2010 43 57 S TAKEZAWA 1997 45 56 N MENG 2023 7980 H LI 2020 119052 H LI 2022 99 108 D PLONER 2020 497 512 K BOSSOLA 2019 118016 F MA 2019 2578 2584 K LAM 2019 13989 13996 E PLONER 2021 118279 K XU 2023 122839 X TONG 2013 1231 1244 W YANG 2018 1836 1840 H CAO 2019 192 203 X SONG 2022 14162 14172 X RAVEL 2005 537 541 B XU 2021 5506 5516 G CHEN 2020 9706 9715 X SUN 2023 20370 20379 Y XU 2019 10489 10498 G AN 2023 6851 6861 Q WANG 2024 10357 10367 Y WANG 2024 124221 Y XU 2021 1 9 G KRESSE 1996 11169 11186 G PERDEW 1996 3865 3868 J NIELSEN 2021 121725 N ZHAO 2022 818 831 H WANG 2010 W DENG 2016 2473 2481 Y YU 2012 1230 K AI 2022 14884 14895 X XIA 2012 1 11 S HU 2021 367 375 J ZHANG 2022 10916 10924 Z MATYSHAK 2009 111 121 V QI 2018 11320 11327 T MAO 2024 3448 3458 Q YU 2020 5977 C PERI 1965 211 219 J SALMERON 2009 221 229 M DENG 2008 9668 9672 X LAN 2022 3955 3964 T SONG 2017 8214 8227 J WANG 2017 1875 1932 Y LOEHR 1988 C-46-C-48 S NIAURA 2000 3507 3519 G FROST 2002 252 259 R RUANO 2019 2922 2930 D LUO 2023 20530 20538 S JABLONSKA 2018 275 287 M SUN 2022 7300 7313 Z ZHANG 2023 12798 12808 W WANG 2018 10811 10819 S PEPPLEY 1999 31 49 B FRANK 2007 177 192 B KIM 2008 17235 17243 D CAI 2024 6674 6686 G CUI 2022 1326 1337 Z FERNANDEZVILLANUEVA 2024 2024 2032 E TU 2023 8751 8756 W LARRUBIAVARGAS 2007 188 197 M YANG 2023 262 269 Y ZHANG 2021 118072 G XI 2014 11886 11889 H LIU 2017 5069 5078 Y QING 2018 12242 12245 S RANJEKAR 2021 89 113 A LI 2021 22303 22327 H HERDEM 2019 5076 5105 M LIUX2025X115922 LIUX2025X115922XD 2026-12-24T00:00:00.000Z 2026-12-24T00:00:00.000Z http://creativecommons.org/licenses/by-nc-nd/4.0/ © 2024 Elsevier Inc. All rights are reserved, including those for text and data mining, AI training, and similar technologies. 2024-12-27T02:01:57.938Z http://vtw.elsevier.com/data/voc/AddOnTypes/50.7/aggregated-refined National Natural Science Foundation of China 22276203 NSFC National Natural Science Foundation of China http://data.elsevier.com/vocabulary/SciValFunders/501100001809 http://sws.geonames.org/1814991 Chinese Academy of Sciences XDA0390103 CAS Chinese Academy of Sciences http://data.elsevier.com/vocabulary/SciValFunders/501100002367 http://sws.geonames.org/1814991 Shanghai Synchrotron Radiation Facility MOST Ministry of Science and Technology of the People's Republic of China http://data.elsevier.com/vocabulary/SciValFunders/501100002855 http://sws.geonames.org/1814991 National Key R&D Program of China 2022YFC3704400 NKRDPC National Key Research and Development Program of China http://data.elsevier.com/vocabulary/SciValFunders/501100012166 http://sws.geonames.org/1814991/ RCEES-TDZ-2021-6 RCEES, CAS Research Centre for Eco-Environmental Sciences Chinese Academy of Sciences http://data.elsevier.com/vocabulary/SciValFunders/501100010555 http://sws.geonames.org/1814991 This work was supported by the National Key R&D Program of China (2022YFC3704400), the National Natural Science Foundation of China (22276203), the Strategic Priority Research Program of the Chinese Academy of Sciences (XDA0390103), and the project of eco-environmental technology for carbon neutrality (RCEES-TDZ-2021-6). The authors thank BL11B beamline of the Shanghai Synchrotron Radiation Facility (SSRF), China for providing the XAFS beamtime. This work was supported by the National Key R&D Program of China ( 2022YFC3704400 ), the National Natural Science Foundation of China ( 22276203 ), the Strategic Priority Research Program of the Chinese Academy of Sciences ( XDA0390103 ), and the project of eco-environmental technology for carbon neutrality (RCEES-TDZ-2021-6). The authors thank BL11B beamline of the Shanghai Synchrotron Radiation Facility (SSRF) for providing the XAFS beamtime. https://doi.org/10.15223/policy-017 https://doi.org/10.15223/policy-037 https://doi.org/10.15223/policy-012 https://doi.org/10.15223/policy-029 https://doi.org/10.15223/policy-004 item S0021-9517(24)00635-3 S0021951724006353 1-s2.0-S0021951724006353 10.1016/j.jcat.2024.115922 272561 2025-01-10T21:03:22.362079Z 2025-02-01 2025-02-28 1-s2.0-S0021951724006353-main.pdf https://s3-eu-west-1.amazonaws.com/prod-ucs-content-store-eu-west/content/pii:S0021951724006353/MAIN/application/pdf/5588679e2e5d05156414b9f4146a8265/main.pdf main.pdf pdf true 3659845 MAIN 12 1-s2.0-S0021951724006353-main_1.png https://s3-eu-west-1.amazonaws.com/prod-ucs-content-store-eu-west/content/pii:S0021951724006353/PREVIEW/image/png/d82fd184724d2b4416d70fa12b0247c9/main_1.png main_1.png png 57450 849 656 IMAGE-WEB-PDF 1 1-s2.0-S0021951724006353-gr5.jpg https://s3-eu-west-1.amazonaws.com/prod-ucs-content-store-eu-west/content/pii:S0021951724006353/gr5/DOWNSAMPLED/image/jpeg/84fbdba0e1caed3d35ba1b136e4f59a9/gr5.jpg gr5 gr5.jpg jpg 99456 564 667 IMAGE-DOWNSAMPLED 1-s2.0-S0021951724006353-gr4.jpg https://s3-eu-west-1.amazonaws.com/prod-ucs-content-store-eu-west/content/pii:S0021951724006353/gr4/DOWNSAMPLED/image/jpeg/67a08bf6befb35de49263eba8f8bbdaf/gr4.jpg gr4 gr4.jpg jpg 97592 544 667 IMAGE-DOWNSAMPLED 1-s2.0-S0021951724006353-gr6.jpg https://s3-eu-west-1.amazonaws.com/prod-ucs-content-store-eu-west/content/pii:S0021951724006353/gr6/DOWNSAMPLED/image/jpeg/5d1b7b6d1aebaf64fc454aa7480b03b2/gr6.jpg gr6 gr6.jpg jpg 60224 508 667 IMAGE-DOWNSAMPLED 1-s2.0-S0021951724006353-gr1.jpg https://s3-eu-west-1.amazonaws.com/prod-ucs-content-store-eu-west/content/pii:S0021951724006353/gr1/DOWNSAMPLED/image/jpeg/c110e601b3d420bfb9b606c20f89e0f9/gr1.jpg gr1 gr1.jpg jpg 41243 271 667 IMAGE-DOWNSAMPLED 1-s2.0-S0021951724006353-gr3.jpg https://s3-eu-west-1.amazonaws.com/prod-ucs-content-store-eu-west/content/pii:S0021951724006353/gr3/DOWNSAMPLED/image/jpeg/c9cdde9005359ae5b5faa379598ca337/gr3.jpg gr3 gr3.jpg jpg 92617 557 667 IMAGE-DOWNSAMPLED 1-s2.0-S0021951724006353-gr2.jpg https://s3-eu-west-1.amazonaws.com/prod-ucs-content-store-eu-west/content/pii:S0021951724006353/gr2/DOWNSAMPLED/image/jpeg/28899b393e1eea367b4787d892e5a61e/gr2.jpg gr2 gr2.jpg jpg 74399 415 660 IMAGE-DOWNSAMPLED 1-s2.0-S0021951724006353-ga1.jpg https://s3-eu-west-1.amazonaws.com/prod-ucs-content-store-eu-west/content/pii:S0021951724006353/ga1/DOWNSAMPLED/image/jpeg/41982ba4b5c7449011e4e0c67912cb32/ga1.jpg ga1 true ga1.jpg jpg 27463 200 373 IMAGE-DOWNSAMPLED 1-s2.0-S0021951724006353-gr5.sml https://s3-eu-west-1.amazonaws.com/prod-ucs-content-store-eu-west/content/pii:S0021951724006353/gr5/THUMBNAIL/image/gif/bcc4acb7ce36cc3d0211908033f47dbf/gr5.sml gr5 gr5.sml sml 11452 164 194 IMAGE-THUMBNAIL 1-s2.0-S0021951724006353-gr4.sml https://s3-eu-west-1.amazonaws.com/prod-ucs-content-store-eu-west/content/pii:S0021951724006353/gr4/THUMBNAIL/image/gif/9edbc34464afc1897f6d1022a60c9f2d/gr4.sml gr4 gr4.sml sml 12356 164 201 IMAGE-THUMBNAIL 1-s2.0-S0021951724006353-gr6.sml https://s3-eu-west-1.amazonaws.com/prod-ucs-content-store-eu-west/content/pii:S0021951724006353/gr6/THUMBNAIL/image/gif/52d2d6f18eb46ff1c5734f44b67a6aef/gr6.sml gr6 gr6.sml sml 9001 164 215 IMAGE-THUMBNAIL 1-s2.0-S0021951724006353-gr1.sml https://s3-eu-west-1.amazonaws.com/prod-ucs-content-store-eu-west/content/pii:S0021951724006353/gr1/THUMBNAIL/image/gif/a7870bc2a13c51e830ca19373fb35966/gr1.sml gr1 gr1.sml sml 6946 89 219 IMAGE-THUMBNAIL 1-s2.0-S0021951724006353-gr3.sml https://s3-eu-west-1.amazonaws.com/prod-ucs-content-store-eu-west/content/pii:S0021951724006079/gr3/THUMBNAIL/image/gif/f9c88aa48284af650544263362ed7f58/gr3.sml gr3 gr3.sml sml 11887 164 196 IMAGE-THUMBNAIL 1-s2.0-S0021951724006353-gr2.sml https://s3-eu-west-1.amazonaws.com/prod-ucs-content-store-eu-west/content/pii:S0021951724006079/gr2/THUMBNAIL/image/gif/d9f0adeb0adad145f9358e95f9f975ec/gr2.sml gr2 gr2.sml sml 13929 138 219 IMAGE-THUMBNAIL 1-s2.0-S0021951724006353-ga1.sml https://s3-eu-west-1.amazonaws.com/prod-ucs-content-store-eu-west/content/pii:S0021951724006079/ga1/THUMBNAIL/image/gif/255e898530aa71a6336f67a5778d957d/ga1.sml ga1 true ga1.sml sml 15345 117 219 IMAGE-THUMBNAIL 1-s2.0-S0021951724006353-gr5_lrg.jpg https://s3-eu-west-1.amazonaws.com/prod-ucs-content-store-eu-west/content/pii:S0021951724006353/HIGHRES/image/jpeg/c45cfe9420080021f7b844aa32a9da6a/gr5_lrg.jpg gr5 gr5_lrg.jpg jpg 388516 1499 1772 IMAGE-HIGH-RES 1-s2.0-S0021951724006353-gr4_lrg.jpg https://s3-eu-west-1.amazonaws.com/prod-ucs-content-store-eu-west/content/pii:S0021951724006353/HIGHRES/image/jpeg/e65b6be2bbc17ab1e7e9692ca4f6ac22/gr4_lrg.jpg gr4 gr4_lrg.jpg jpg 380118 1446 1772 IMAGE-HIGH-RES 1-s2.0-S0021951724006353-gr6_lrg.jpg https://s3-eu-west-1.amazonaws.com/prod-ucs-content-store-eu-west/content/pii:S0021951724006353/HIGHRES/image/jpeg/756cdd7c76c62c506002421b3ae98a58/gr6_lrg.jpg gr6 gr6_lrg.jpg jpg 215372 1349 1772 IMAGE-HIGH-RES 1-s2.0-S0021951724006353-gr1_lrg.jpg https://s3-eu-west-1.amazonaws.com/prod-ucs-content-store-eu-west/content/pii:S0021951724006353/HIGHRES/image/jpeg/e1d44d43ef202074b259503723ab603d/gr1_lrg.jpg gr1 gr1_lrg.jpg jpg 147332 719 1772 IMAGE-HIGH-RES 1-s2.0-S0021951724006353-gr3_lrg.jpg https://s3-eu-west-1.amazonaws.com/prod-ucs-content-store-eu-west/content/pii:S0021951724006079/HIGHRES/image/jpeg/49fe8e720277a9c9f03e6f4934c6f9d9/gr3_lrg.jpg gr3 gr3_lrg.jpg jpg 351720 1480 1772 IMAGE-HIGH-RES 1-s2.0-S0021951724006353-gr2_lrg.jpg https://s3-eu-west-1.amazonaws.com/prod-ucs-content-store-eu-west/content/pii:S0021951724006079/HIGHRES/image/jpeg/dacff0dae9d4ab1cb0b9a40a01bcd7f4/gr2_lrg.jpg gr2 gr2_lrg.jpg jpg 320456 1102 1753 IMAGE-HIGH-RES 1-s2.0-S0021951724006353-ga1_lrg.jpg https://s3-eu-west-1.amazonaws.com/prod-ucs-content-store-eu-west/content/pii:S0021951724006079/HIGHRES/image/jpeg/1ff0c3b3f3f996f7c9deaa60ae794945/ga1_lrg.jpg ga1 true ga1_lrg.jpg jpg 172926 886 1653 IMAGE-HIGH-RES 1-s2.0-S0021951724006353-mmc1.docx https://s3-eu-west-1.amazonaws.com/prod-ucs-content-store-eu-west/content/pii:S0021951724006353/mmc1/MAIN/application/vnd.openxmlformats-officedocument.wordprocessingml.document/55c09620ce9bea4f56b6effc0976b918/mmc1.docx mmc1 mmc1.docx docx 4005422 APPLICATION 1-s2.0-S0021951724006353-si1.svg https://s3-eu-west-1.amazonaws.com/prod-ucs-content-store-eu-west/content/pii:S0021951724006353/image/svg+xml/ee43d9b5d5bdd4a9fe6d84c3020eea59/si1.svg si1 si1.svg svg 12684 ALTIMG 1-s2.0-S0021951724006353-si10.svg https://s3-eu-west-1.amazonaws.com/prod-ucs-content-store-eu-west/content/pii:S0021951724006353/image/svg+xml/cbe934a90bf54bb9f29073dd06c22d47/si10.svg si10 si10.svg svg 16139 ALTIMG 1-s2.0-S0021951724006353-si11.svg https://s3-eu-west-1.amazonaws.com/prod-ucs-content-store-eu-west/content/pii:S0021951724006353/image/svg+xml/f0f083dccbe01bf876b61a2d50b8679d/si11.svg si11 si11.svg svg 8561 ALTIMG 1-s2.0-S0021951724006353-si12.svg https://s3-eu-west-1.amazonaws.com/prod-ucs-content-store-eu-west/content/pii:S0021951724006353/image/svg+xml/b066c7d7c069b9551ca104cd02bbbc43/si12.svg si12 si12.svg svg 6693 ALTIMG 1-s2.0-S0021951724006353-si13.svg https://s3-eu-west-1.amazonaws.com/prod-ucs-content-store-eu-west/content/pii:S0021951724006353/image/svg+xml/ece2db81b8df672e93c51cb8642a6ab1/si13.svg si13 si13.svg svg 7623 ALTIMG 1-s2.0-S0021951724006353-si14.svg https://s3-eu-west-1.amazonaws.com/prod-ucs-content-store-eu-west/content/pii:S0021951724006353/image/svg+xml/446154a4daa4ed498bdfaf705353cc2a/si14.svg si14 si14.svg svg 7286 ALTIMG 1-s2.0-S0021951724006353-si15.svg https://s3-eu-west-1.amazonaws.com/prod-ucs-content-store-eu-west/content/pii:S0021951724006353/image/svg+xml/f13ba08a3c97af34149f57052ff7e5f1/si15.svg si15 si15.svg svg 3401 ALTIMG 1-s2.0-S0021951724006353-si2.svg https://s3-eu-west-1.amazonaws.com/prod-ucs-content-store-eu-west/content/pii:S0021951724006353/image/svg+xml/bc0cdb56790a58e9962196271225b213/si2.svg si2 si2.svg svg 12621 ALTIMG 1-s2.0-S0021951724006353-si3.svg https://s3-eu-west-1.amazonaws.com/prod-ucs-content-store-eu-west/content/pii:S0021951724006353/image/svg+xml/9bd53d83e43785197491ea52dcba676b/si3.svg si3 si3.svg svg 15120 ALTIMG 1-s2.0-S0021951724006353-si4.svg https://s3-eu-west-1.amazonaws.com/prod-ucs-content-store-eu-west/content/pii:S0021951724006353/image/svg+xml/80e39c1b5593a149b8cba59358ada6fd/si4.svg si4 si4.svg svg 3554 ALTIMG 1-s2.0-S0021951724006353-si5.svg https://s3-eu-west-1.amazonaws.com/prod-ucs-content-store-eu-west/content/pii:S0021951724006353/image/svg+xml/1fa9fae2ea2239ed21ae46c55799f03f/si5.svg si5 si5.svg svg 4445 ALTIMG 1-s2.0-S0021951724006353-si6.svg https://s3-eu-west-1.amazonaws.com/prod-ucs-content-store-eu-west/content/pii:S0021951724006353/image/svg+xml/c1c8985ec1ee2aa37e3d6b0eb38d9fb7/si6.svg si6 si6.svg svg 35415 ALTIMG 1-s2.0-S0021951724006353-si7.svg https://s3-eu-west-1.amazonaws.com/prod-ucs-content-store-eu-west/content/pii:S0021951724006353/image/svg+xml/c3cd689c4073831f5bd1703cb0a09202/si7.svg si7 si7.svg svg 27693 ALTIMG 1-s2.0-S0021951724006353-si8.svg https://s3-eu-west-1.amazonaws.com/prod-ucs-content-store-eu-west/content/pii:S0021951724006353/image/svg+xml/9c44ca504b664e9d60dccb00956a10d7/si8.svg si8 si8.svg svg 29351 ALTIMG 1-s2.0-S0021951724006353-si9.svg https://s3-eu-west-1.amazonaws.com/prod-ucs-content-store-eu-west/content/pii:S0021951724006353/image/svg+xml/74804f80786d398c9606918e3fe7ab9d/si9.svg si9 si9.svg svg 27342 ALTIMG YJCAT 115922 115922 S0021-9517(24)00635-3 10.1016/j.jcat.2024.115922 Elsevier Inc. Fig. 1 Catalytic performance of Cu/Al2O3 catalysts in methanol steam reforming. (a) H2 production rate on Cu/Al2O3 catalysts. (reaction conditions: liquid feed of H2O/CH3OH = 1.5 at 8.0 μL/min, with balance N2 at 120 mL min −1, WHSV of methanol = 2.32 h−1 and 100 mg of sample, 473 K). (b) The TOF values and H2 production rate of Cu/Al2O3 catalysts towards MSR reaction (WHSV of methanol = 9.28 h−1, 473 K). Fig. 2 Characterization of Cu/Al2O3 catalysts. (a) and (b) HAADF-STEM image and particle size statistics of Cu5-Al. (c) in situ DRIFTS spectra of CO adsorption on Cu/Al2O3 catalysts, the signal was normalized by Cu loadings. (d) in situ Raman spectra of Cu/Al2O3 catalysts. (e) the concentration of surface Cu species (CCu) of Cu/Al2O3 catalysts. (f) The correlation between the hydrogen production rate (473 K) during TOF test and the concentration of surface Cu species on Cu/Al2O3 catalysts. Fig. 3 In situ DRIFTS-MS experiments of methanol steam reforming on Cu5-Al catalyst. (a) In situ DRIFTS spectra of different formates on Cu5-Al catalyst during MSR reaction. (b) The formation of H2 and CO2 during MSR reaction. (c) In situ DRIFTS spectra of Cu5-Al catalyst exposed to different reaction composition at 523 K. (d) The consumption rate of different formates and the formation of H2 and CO2 on Cu5-Al after exposure to H2O. This sample was pre-exposed to CH3OH/N2 at 523 K for 30 min, followed by N2 purging for 30 min. Fig. 4 Water activation on Cu/Al2O3 catalysts. (a) In situ DRIFTS spectra of water adsorption on Al2O3, Cu5-Al-oxidized, and Cu5-Al at 473 K. (b) In situ Raman spectra of Cu5-Al exposed to H2O/N2 at various temperatures and the reference Cu5-Al-oxidized sample. (c) Bader charges of H atom in Cu-H on Cu(111) and O-H on Cu1/Al2O3 during the H2O dissociation. (d) Energies of a dissociating H moiety along the reaction coordinate for *H2O + * → *OH + *H on Cu(111) and Cu1/Al2O3, respectively. insets: snapshots of the initial, and final states. Orange, purple, red, and white balls represent Cu, Al, O, and H atoms, respectively. Fig. 5 Dynamics of Cu species on Cu/Al2O3 catalysts during methanol steam reforming. (a) In situ DR-UV–vis spectra of Cu5-Al catalyst exposed to H2O/N2 at various temperatures. (b) In situ DR-UV–vis spectra of Cu5-Al catalyst exposed to CH3OH/N2 at various temperatures. (c) In situ DR-UV–vis spectra of Cu5-Al catalyst exposed to CH3OH/H2O/N2 at various temperatures. (d) Dynamics of metallic Cu species (560 nm) on Cu5-Al during the switching of the gas composition. Fig. 6 The proposed reaction mechanism of methanol steam reforming on Cu/Al2O3 catalysts (double-headed arrows indicate the reversibility of the step). Al2O3 serves as adsorption site for methanol, and the most abundant surface intermediate is reactive formate. Table 1 Chemical properties of Cu/Al2O3 catalysts. Samples DCu (%) a dCu (nm) a dCu (nm) b CCu (μmol/g) a Cu0.25-Al − − − − Cu2.5-Al 38.9 2.56 2.31 152.15 Cu5-Al 32.8 3.05 2.85 256.25 Cu7.5-Al 15.4 6.51 5.29 179.97 Cu10-Al 7.5 13.38 14.81 116.79 a based on N2O titration. b based on particle size statistics from HAADF-STEM. Mechanistic insights into methanol steam reforming on copper catalysts: Dynamics of active sites and reaction pathway Diru Liu Writing – review & editing Writing – original draft Investigation Data curation a b Mengyuan Zhang Investigation a b Lin Zhao Investigation a Xueli Guo Data curation a Guangyan Xu Writing – review & editing Validation Project administration Methodology Conceptualization a b ⁎ Hong He Writing – review & editing Supervision Project administration Conceptualization a b c ⁎ a State Key Joint Laboratory of Environment Simulation and Pollution Control, Research Center for Eco-Environmental Sciences, Chinese Academy of Sciences, Beijing 100085, China State Key Joint Laboratory of Environment Simulation and Pollution Control Research Center for Eco-Environmental Sciences Chinese Academy of Sciences Beijing 100085 China State Key Joint Laboratory of Environment Simulation and Pollution Control, Research Center for Eco-Environmental Sciences, Chinese Academy of Sciences, Beijing 100085, China b University of Chinese Academy of Sciences, Beijing 100049, China University of Chinese Academy of Sciences Beijing 100049 China University of Chinese Academy of Sciences, Beijing 100049, China c Institute of Urban Environment, Chinese Academy of Sciences, Xiamen 361021, China Institute of Urban Environment Chinese Academy of Sciences Xiamen 361021 China Institute of Urban Environment, Chinese Academy of Sciences, Xiamen 361021, China ⁎ Corresponding authors at: State Key Joint Laboratory of Environment Simulation and Pollution Control, Research Center for Eco-Environmental Sciences, Chinese Academy of Sciences, Beijing 100085, China. State Key Joint Laboratory of Environment Simulation and Pollution Control Research Center for Eco-Environmental Sciences Chinese Academy of Sciences Beijing 100085 China Graphical abstract Methanol steam reforming (MSR) is essential for in-situ hydrogen production, providing a clean fuel alternative for sustainable energy applications. Copper catalysts are widely applied in MSR, yet the nature of active sites and reaction pathway involved remain some debates. Herein, we reveal the crucial role of water activation and dynamic active sites on Cu/Al2O3 catalysts during the MSR reaction. Specifically, methanol was preferentially adsorbed on Al2O3 and underwent stepwise dehydrogenation to formaldehyde, while water was activated on metallic Cu, oxidizing Cu0 to form Cu+-OH species, accompanied by hydrogen migration to another Cu0 site. The Cu+-OH species further reacted with formaldehyde to generate highly reactive formate, whose dehydrogenation produced CO2. Concurrently, the Cu+ was reduced back to the Cu0 state, and H2 was continuously produced by dehydrogenation. Compared to the facile oxidation of Cu0 by water, the slow reduction of Cu+ induced by the dehydrogenation of formate predominated the overall reaction rate at low temperatures. These findings provide new insights into a dynamic Cu0/+-Cu0 site mechanism on copper catalysts in methanol steam reforming, beneficial for the design of efficient MSR catalysts. Keywords Methanol steam reforming Copper catalysts Water activation Dynamic active sites Operando DRIFTS-MS In-situ UV–Vis Data availability Data will be made available on request. 1 Introduction Hydrogen, as a clean fuel alternative with high energy density and zero-carbon emissions, is essential for achieving carbon neutrality, while the challenges of safe storage and transportation hinder its widespread adoption [1]. Methanol Steam Reforming (MSR) stands as a promising solution for in-situ hydrogen production, distinguished by its advantageous features, including low-temperature operation and high hydrogen yield [2,3]. Among MSR catalysts, Cu/Al2O3 catalysts are known for their high catalytic activity and selectivity, while ZnO is often introduced to further enhance the activity and stability of the catalyst, leading to the application of commercial Cu/ZnO/Al2O3 catalysts [4,5]. Extensive investigations have been conducted to unravel the mechanistic intricacies and structure–activity relationships of these copper catalysts, encompassing the elucidation of the MSR mechanism by identifying pivotal intermediates and the recognition of active sites on copper catalysts by investigating the correlation between the physical and chemical states of copper and the catalytic activity in methanol steam reforming [3,6,7]. The reaction pathway of MSR on copper catalysts has been widely studied, yet the exact mechanism remains debated. One proposed pathway involved methyl formate as a key intermediate, where two methanol molecules were first dehydrogenated to form methyl formate, which was then hydrolyzed into formate, eventually decomposing to carbon dioxide and hydrogen [8,9]. However, other groups have proposed the pathway involving formaldehyde and formate, with methanol initially dehydrogenating to formaldehyde, followed by its reaction with water to form formate, which subsequently decomposed to carbon dioxide and hydrogen [10,11]. Despite the rough acknowledgement of these intermediates in MSR, the specific reaction sites and the conversion process of intermediates remain unclear. Some studies suggested that the activation of methanol and the subsequent conversion of intermediates occurred on metallic Cu nanoparticles [12,13], while others pointed out that the metal-support interface plays an important role in the conversion of intermediates [14–16]. As for water, which plays an important role in promoting the generation and conversion of intermediates, its activation sites and reaction pathway have been rarely studied. These ambiguities have hindered the understanding of the mechanism and active sites. While many researchers attempted to identify the primary active sites on copper catalysts through mechanistic studies, there was less solid experimental evidence to explain the actual active sites due to the complex physical structure and the redox state of Cu species. Some reports suggested that small Cu nanoparticles could activate methanol at low temperatures [12,17], while others argued that large Cu nanoparticles could avoid adverse support effects to increase the CO2 selectivity [15]. Furthermore, some researchers observed a strong linear correlation between the TOF values and the Cu+/Cu0 ratio, so they proposed that Cu+ species may be active sites [10,13], while other studies argued that Cu0 species were the active sites because both the dehydrogenation of intermediates and H2 formation occurring on the same Cu0 site markedly boosted hydrogen production, with the presence of Cu+ species being adverse to MSR [12]. The contradictions in these studies likely stemmed from the dynamic nature of Cu species during methanol reforming. While numerous studies have investigated the influence of the initial redox state of Cu on methanol steam reforming reactivity and selectivity [10,18,19], few studies have probed the dynamics of Cu species under reaction conditions, which has impeded the recognition of the actual active sites on copper catalysts. In summary, despite the widespread application of commercial Cu/ZnO/Al2O3 catalysts in MSR, the active sites and reaction mechanism of copper catalysts remain unclear. To elucidate these aspects, present work focuses on Cu/Al2O3 catalysts, with an emphasis on investigating the changes in Cu species and their role in the methanol steam reforming reaction. Herein, we prepared a series of Cu/Al2O3 catalysts with varying numbers of active Cu sites and then applied them in the methanol reforming reaction. Afterward, the concentrations of surface Cu species on Cu/Al2O3 catalysts were quantitatively calculated and then correlated to the H2 production rate in methanol reforming. Subsequently, the reactive intermediates and the dynamics of active sites in methanol reforming on Cu/Al2O3 catalysts were further investigated using in situ Diffuse Reflectance Infrared Fourier Transform Spectroscopy coupled with Mass Spectrometry (in situ DRIFTS-MS), in situ Raman spectroscopy, and in situ Diffuse Reflectance Ultraviolet–Visible spectroscopy (in situ DR-UV–vis). Based on these experiments, we established a correlation between the hydrogen production rate and the quantity of surface Cu species, identified highly reactive intermediates, and investigated the dynamics of Cu species. This work elucidated the reaction mechanism and the dynamics of the active sites during methanol steam reforming on Cu/Al2O3, offering important insight for the design of high-efficiency catalysts. 2 Experimental section 2.1 Catalyst preparation Cu/Al2O3 catalysts with 0.25 to 10 wt% copper loadings were prepared by an impregnation method. Initially, the required amount of nano-Al2O3 (Sigma-Aldrich) was added to deionized water and stirred to form a suspension. A specified amount of copper(II) nitrate trihydrate (Cu(NO3)2·3H2O, >99 %, Sigma-Aldrich) was dissolved in deionized water and then added to the above suspension with stirring. This solution was subsequently stirred at 353 K to evaporate the excess water, and the samples were dried in an oven at 383 K for 12 h. These samples were then calcined in a muffle furnace at 623 K for 4 h to obtain the Cu x -Al-oxidized samples (x denotes copper loadings). These samples were further reduced in a mixed gas (5 % H2/N2, 100 mL min−1) at 573 K for 1 h to obtain the final catalysts and denoted as Cu x -Al. 2.2 Characterization X-ray diffraction (XRD) analysis was carried out on a D8-ADVANCE (Bruker) diffractometer with Cu Kα radiation (λ = 0.15406 nm) at 40 kV and 40 mA. The specific surface area and pore characterization of the catalysts were obtained using a Micromeritics ASAP 2460 analyzer. Inductively coupled plasma optical emission spectroscopy (ICP-OES) measurement was obtained using an OPTIMA 8300 instrument to determine the exact Cu loadings. High-angle annular dark-field scanning transmission electron microscopy (HAADF-STEM) was performed on a JEOL JEM-ARM 200F microscope with an accelerating voltage of 200 kV. Diffuse Reflectance Ultraviolet–Visible spectroscopy (DR-UV–vis) analysis was performed on a UV–vis spectrophotometer (LAMBDA 650, PerkinElmer). The spectra were recorded at a resolution of 1 nm, with BaSO4 used as the reference. Raman spectra were obtained using a Renishaw inVia Raman microscope system with a 532 nm-excitation laser. Baseline correction was implemented to mitigate background interference. The H2-TPR experiments were conducted on a chemisorption analyzer (Micromeritics AutoChem 2920 II) equipped with a thermal conductivity detector (TCD). In a typical measurement, 25 mg of sample was pretreated in 10 % O2/He at 573 K for 30 min and then cooled down to 323 K. Subsequently, the sample was heated to 623 K at a rate of 10 K/min in 10 % H2/Ar. The dispersion of Cu was tested by N2O titration experiments on the same Micromeritics AutoChem 2920 II apparatus. First, 25 mg of a Cu x -Al-oxidized sample was pretreated in 10 % O2/He at 573 K for 30 min. Then the sample was reduced by 10 % H2/Ar with the temperature raised from 323 K to 623 K at a rate of 10 K/min and held at 623 K for 1 h. The amount of H2 consumed (X) was calculated. Then, the sample was cooled down to 323 K in Ar and exposed to 5 % N2O/Ar for 30 min to oxidize the surface Cu0 to Cu2O. Subsequently, the sample was purged with Ar for 30 min to remove the residual N2O. Finally, the sample was heated to 623 K at a rate of 10 K/min in 10 % H2/Ar. The amount of H2 consumed (Y) was calculated. The dispersion of copper (D Cu), the average volume–surface diameter of copper (d Cu) and the concentration of surface Cu species (C Cu) were calculated as follows [20]: (1) D Cu (%) = 2 Y X × 100% (2) d Cu (nm) = 0.5 X Y (3) C Cu (mol/g) = Wt Cu M Cu × D Cu where C Cu is the concentration of surface Cu sites, Wt Cu is the Cu loading of catalysts and MCu is the relative atomic mass of copper (63.46 g/mol). The XAFS spectra at the Cu K-edge were recorded at the BL11B beamline of Shanghai Synchrotron Radiation Facility (SSRF). The beam current of the storage ring was 200 mA in a top-up mode. The incident photons were monochromatized by a Si(111) double-crystal monochromator. For energy calibration, a copper foil was employed, establishing a reference at E0 = 8979 eV. The reference spectra were measured in transmission mode, with the ionization chambers filled with N2. EXAFS data were processed using the Athena and Artemis software suites [21]. 2.3 Catalytic tests The catalytic tests of methanol steam reforming were conducted in a fixed-bed reactor (interior diameter: 4 mm) [22]. Before the tests, a 100 mg oxidized sample was placed into the reactor and reduced in H2/N2 at 573 K for 60 min. A mixture of methanol and water with a molar ratio of 1.5 was fed into the reactor by an injection pump at a rate of 8.0 μL min−1.The reactants, mixed with N2 (120 mL min−1), were evaporated at 413 K before entering the reactor. The reactants and reaction products were analyzed by an online gas chromatograph (Agilent, GC 8890) equipped with both FID and TCD detectors. The methanol conversion, CO selectivity, H2 production rate, H2 selectivity and the turnover frequency (TOF) were calculated as follows equations. During the TOF test, methanol conversion was kept below 10 % (25 mg of catalyst mixed with 75 mg of silica). (4) Methanol conversion X MeOH (%) = F CO, out + F CO 2 , out + F CH 4 , out F CH 3 OH, in × 100% (5) H 2 production rate (mol g -1 s -1 ) = F H 2 M cat (6) H 2 selectivity (%) = F H 2 3 × ( F CH 3 OH, in × X MeOH ) × 100% (7) CO selectivity (%) = F CO, out F CO, out + F CO 2 , out + F CH 4 , out × 100% (8) TOF ( h -1 ) = F H 2 D Cu × Wt Cu / M Cu where F CH 3 OH, in is the molar flow rate of CH3OH at the reactor inlet. The F CO, out , F CO 2 , out , F CH 4 , out and F H 2 represent the molar flow rates of CO, CO2, CH4 and H2 at the outlet of the reactor, respectively. Notably, H2 selectivity is defined as the ratio of actual amount of H2 produced to theoretical amount of H2 produced, where each molecule of methanol stoichiometrically generates three moles of H2 (CH3OH + H2O = 3H2 + CO2). M cat is the mass of catalyst, D Cu is the dispersion of Cu, Wt Cu is the Cu loading of catalysts and MCu is the relative atomic mass of copper (63.46 g/mol). 2.4 In situ spectroscopic study In situ DRIFTS of CO adsorption were performed by FTIR spectroscopy (Nicolet iS 50) [23,24]. Before the measurements, a 50 mg oxidized sample was placed into a Harrick Scientific cell and reduced in H2/N2 at 573 K for 60 min. After reduction, the sample was cooled to 303 K in a purge of argon flow and exposed to 1 % CO/Ar for 30 min. After the saturation adsorption of CO, the sample was purged in Ar for 30 min to remove weakly adsorbed CO, and the spectrum of CO adsorption was further collected. In situ DRIFTS-MS experiments were performed by FTIR spectroscopy (Nicolet iS 50) and online MS (InProcess Instruments, GAM 200) [25,26]. The spectra were collected with an accumulation of 100 scans at 4 cm−1 resolution, and the gaseous products (H2 and CO2) were detected by online MS. Before the measurements, a 50 mg oxidized sample was placed into a Harrick Scientific cell and reduced in H2/N2 at 573 K for 60 min. The background spectrum was recorded at the corresponding reaction temperature. During the TPSR experiment for the MSR reaction, the sample was ramped up from 50 to 573 K at a rate of 5 K/min in a flow of 500 ppm CH3OH and 750 ppm H2O in N2 balance, with the spectra collected every minute. During step-response experiments, the sample was sequentially exposed to 500 ppm CH3OH/N2 for 30 min, then N2 for 30 min, and finally 750 ppm H2O/N2 for 30 min at 523 K, with the spectra continuously recorded at reaction temperature. During H2O or D2O adsorption experiments, the sample was exposed to 750 ppm H2O/N2 or D2O/N2 at 473 K for 10 min, and the spectra were then collected. In situ Raman spectroscopy was acquired on a Renishaw inVia Raman microscope system equipped with an in-situ cell, using a 532 nm-excitation laser at 2 cm−1 resolution [27,28]. Baseline correction was implemented to mitigate background interference. During water activation experiments, the sample was exposed to 750 ppm H2O/N2 at different temperatures for 10 min, and the spectra were then collected. In situ DR-UV–vis experiments were conducted on the above UV–vis spectrophotometer equipped with a Harrick Scientific cell [22,29]. The spectra were recorded from 800 to 400 nm at a rate of 1 nm/s with 5 nm resolution. It should be noted that the disparities between the ex-situ DR-UV–vis spectra and the in-situ DR-UV–vis spectra can be attributed to the distinct experimental modes employed. During experiments, the oxidized Cu5-Al sample was first exposed to N2 for 30 min and subsequently to H2/N2 for 60 min at 573 K to collect reference spectra, followed by subsequent exposure to various gas conditions (750 ppm H2O in N2 balance, 500 ppm CH3OH in N2 balance, and 500 ppm CH3OH and 750 ppm H2O in N2 balance, respectively) at different temperatures for 60 min, and the spectrum was then collected. During step-response experiments, the oxidized sample was pretreated in H2/N2 at 573 K for 60 min and then successively exposed to 750 ppm H2O/N2, 500 ppm CH3OH/N2, 750 ppm H2O/N2, and 500 ppm CH3OH/N2 for 1 h each. The dynamics of Cu species data were obtained by continuously measuring the absorbance at 560 nm with 1 point/s time resolution. 2.5 DFT calculations All density functional theory calculations were performed by the Vienna ab initio simulation package (VASP) [30]. The Perdew-Burke-Ernzerhof (PBE) [31] functional was employed to treat the exchange–correlation interactions. The plane-wave basis set with a kinetic energy cutoff of 400 eV, the energy convergence criterion of 10–4 eV, the force convergence criterion of 0.02 eV Å−1 were employed for structure relaxation. A sufficiently large vacuum gap (>12 Å) was employed to prevent the interaction between neighboring periodic structures·H2O was calculated in boxes of 20 Å×20 Å×20 Å with the gamma point only. The Cu(111) model was constructed using five-layer slabs with (2 × 2) surface unit cells. The Cu1/Al2O3 was modeled with a single Cu atom supported by a five-layer Al2O3(110) with (2 × 2) surface. In the optimization process, the bottom three layers were fixed while the remaining layers were relaxed. The Bader charge analysis employed a grid-based weighting method, where the fraction of space neighboring each grid point that transfers to its neighbors was utilized as a weight for discrete integration of functions across the Bader volume. 3 Results and discussion A series of Cu/Al2O3 catalysts with various copper loadings (0.25–10 wt%), denoted as Cu x -Al (x wt%), were synthesized using an impregnation method. The exact Cu loadings were determined by inductively coupled plasma atomic emission spectroscopy (ICP-AES) (Table S1). During methanol steam reforming (Figs. 1 a and S1), Al2O3 demonstrated complete inactivity in H2 production and methanol conversion, while impregnation with a tiny amount of Cu barely improved the catalytic performance of Cu0.25-Al. However, the Cu2.5-Al catalyst exhibited remarkably increased activity in this reaction, achieving a H2 production rate of 35.7 μmol g−1 s−1 at 513 K. Notably, the Cu5-Al catalyst exhibited the best catalytic performance in methanol reforming for H2 production, achieving nearly complete methanol conversion and a H2 production rate of 52.0 μmol g−1 s−1 at the same temperature, which demonstrated to be an efficient MSR catalysts compared to other reported copper-based catalysts (Table S2). However, further increasing the Cu content induced a gradual decrease in the H2 production rate on Cu7.5-Al (42.4 μmol g−1 s−1) and Cu10-Al (9.1 μmol g−1 s−1). In addition, the H2 selectivity on Cu5-Al was close to 100 %, accompanied with a low CO selectivity (<1.3 %) over the whole reaction temperature range (Figs. S2 and S3). To ensure a more accurate comparison of intrinsic activity, the methanol conversion was maintained below 10 % at 473 K by adjusting the WHSV, allowing for the determination of the H2 production rate and turnover frequency (TOF) values. As shown in Fig. 1b, the H2 production rate on these Cu catalysts exhibited a volcano-shaped trend, where the H2 production gradually increased from 9.0 μmol g−1 s−1 (Cu2.5-Al) to 19.1 μmol g−1 s−1 (Cu5-Al), followed by a gradual decrease to 11.1 μmol g−1 s−1 (Cu7.5-Al) and 6.9 μmol g−1 s−1 (Cu10-Al). In contrast, the TOF values exhibited minor variations with the increase in Cu content, in the sequence of 216.5 h−1 (Cu2.5-Al), 228.9 h−1 (Cu5-Al), 221.4 h−1 (Cu7.5-Al) and 212.1 h−1 (Cu10-Al). These results indicate that the differences in catalytic activity among the samples were not due to variations in intrinsic activity but were instead linked to differences in the number of active sites. Generally, the catalytic activity of Cu/Al2O3 catalysts in methanol reforming for H2 production is positively correlated with the number of active sites on these samples. Thus, the volcano-shaped trend of the H2 production rate suggested that the concentration of active Cu sites does not monotonically increase with Cu loading. To ascertain the active Cu sites, a range of techniques were employed to assess the physical and chemical state of Cu species on the Cu/Al2O3 catalysts. X-ray diffraction (XRD) analysis (Figs. S4 and S5) revealed the presence of the γ-Al2O3 phase in all samples. In oxidized samples, the CuO phase was solely detected in the Cu7.5-Al-oxidized and Cu10-Al-oxidized samples. Similarly, in reduced samples, the metallic Cu phase was observed exclusively in the Cu7.5-Al and Cu10-Al samples. High-angle annular dark-field scanning transmission electron microscopy (HAADF-STEM) indicated the presence of highly dispersed Cu atoms on Cu0.25-Al, whereas Cu nanoparticles with progressively increasing sizes were observed on Cu2.5-Al (2.45 nm), Cu5-Al (2.62 nm), Cu7.5-Al (5.29 nm), and Cu10-Al (14.81 nm) (Figs. 2 a, b and S6–S9). Additionally, the similar specific surface areas of Cu5-Al (185.1 m2/g) and Al2O3 (201.0 m2/g) indicated that the specific surface area was not the primary factor in enhancing catalytic performance (Table S1). In situ CO-DRIFTS was conducted with CO as the probe molecule to investigate the state of surface Cu species. As shown in Fig. 2c, only one band at 2114 cm−1, assigned to Cuδ+ species [32], was observed on Cu0.25-Al and these Cuδ+ species were generally considered to be single Cu atoms, which was also confirmed by the absence of Cu-Cu and Cu-O-Cu bonds in EXAFS spectra (Fig. S10) [33]. On the contrary, only another band at 2088 cm−1, attributed to Cu0 nanoparticles [8,32], was observed on Cu x -Al (x = 2.5 to 10). This indicates that Cu species exhibited single atom state on Cu0.25-Al, while only metallic Cu0 nanoparticles were present on Cu x -Al (x = 2.5 to 10). Furthermore, in situ Raman spectroscopy was employed to study chemical state of Cu species of Cu/Al2O3 catalysts. It should be noted that the tiny Cu content of the Cu0.25-Al sample exceeded the detection limit of in situ Raman. On Cu x -Al-oxidized (x = 2.5 to 10), peaks at 273, 321, and 606 cm−1, assigned to phonon vibration of Cu2+ species [34,35] and peaks at 150, and 220 cm−1, assigned to phonon vibration of Cu+ species [35], were observed, indictating that Cu species were in an oxidized state in the unreduced samples (Fig. 2d). However, after reduction, all the peaks attributed to Cu oxides disappeared, indicating that Cu species was in a metallic state in Cu x -Al (x = 2.5 to 10). In summary, the analysis indicated that Cu species existed as single atoms on the Cu0.25-Al sample and as Cu nanoparticles on the Cu x -Al samples (x = 2.5 to 10). H2-temperature programmed reduction (H2-TPR) experiments were conducted to investigate the redox behavior of Cu species on the Cu/Al2O3 catalysts (Fig. S11). The absence of H2 consumption on Cu0.25-Al indicated that the Cu single atoms on this sample were unable to participate in the redox process under the specified conditions. Conversely, a distinct H2 consumption peak (α), attributed to the reduction of small Cu nanoparticles at a lower temperature [36], was observed for the other samples. The intensity of this peak reached its maximum for Cu5-Al, suggesting that the Cu5-Al sample contained a substantial quantity of small Cu nanoparticles with strong redox ability. In the subsequent samples, from Cu7.5-Al to Cu10-Al, the intensity of peak α gradually decreased. Simultaneously, another H2 consumption peak (β), corresponding to the reduction of large Cu nanoparticles at a higher temperature [36,37], began to emerge with increasing intensity, indicating that the number of larger Cu nanoparticles with weaker redox abilities gradually increased in these two samples. Additionally, XRD analysis revealed pronounced Cu phase diffraction peaks in the Cu7.5-Al and Cu10-Al samples, while the particle size statistics further revealed that the Cu7.5-Al and Cu10-Al samples exhibited a proportion of Cu particles of 10 nm and larger. These results further provided compelling evidence that the H2 consumption peak α and β could be attributed to small and large Cu nanoparticles, respectively. N2O titration was utilized to analyze the Cu dispersion and nanoparticle size, allowing for quantification of the concentrations of surface Cu species (CCu) on the Cu/Al2O3 catalysts [8,38]. The first set of H2-TPR data for the completely oxidized samples was used to determine the total Cu content (Fig. S12), while the second set of H2-TPR data for samples after N2O oxidation was utilized to assess the surface Cu content (Fig. S13). The negligible H2 consumption on Cu0.25-Al in the second H2-TPR experiment confirmed that Cu single atoms could not be oxidized by N2O post-reduction. Cu2.5-Al and Cu5-Al samples exhibited high Cu dispersion (DCu) of 38.9 % and 32.8 %, respectively, while the Cu dispersion of Cu7.5-Al and Cu10-Al decreased sharply to 15.4 % and 7.5 %, respectively, indicating that larger Cu nanoparticles reduced Cu dispersion (Table 1 ). Notably, the nanoparticle sizes (dCu) calculated via N2O titration are highly aligned with the particle size statistics obtained from HAADF-STEM analysis. Normalizing the dispersion by the Cu loadings led to the calculation of CCu, which exhibited a similar volcano-shaped trend in line with the H2 production rate as the Cu nanoparticle size increased (Fig. 2e). To further elucidate the relationship between CCu and the H2 production rate, the concentration of surface Cu species (CCu) were calculated for each catalyst (Fig. 2e and Table 1). Remarkably, CCu presented volcano-shaped curves as Cu content increased, with Cu5-Al containing the highest value for CCu (256.25μmol g−1). Interestingly, a linear correlation was discerned between CCu (X) and the H2 production rate (Y), with the relationship given by Y = 0.067X. These findings suggested that the H2 production rate was correlated with the surface Cu sites on Cu nanoparticles. Catalysts with abundant small Cu nanoparticles demonstrated a higher H2 production rate due to the larger amount of surface Cu sites, while catalysts with larger Cu nanoparticle sizes may form fewer surface Cu sites, leading to a lower H2 production rate. To elucidate the reaction mechanism and identify the active sites in methanol steam reforming on Cu/Al2O3 catalysts, in situ DRIFTS-MS experiments were conducted on both Al2O3 and Cu5-Al. On Al2O3 exposed to a CH3OH/H2O/N2 mixture at 323 K (Fig. S14a), abundant methoxy species (2945, 2845, and 2820 cm−1) [11,39] were formed, accompanied by the consumption of hydroxyl groups (Al-OH species, 3800 ∼ 3600 cm−1) [40] due to methanol adsorption (Fig. S15). These indicated that methanol dissociation consumed Al-OH species to form methoxy species (Table S3) [8]. As the temperature was gradually raised to 573 K, the methoxy species gradually disappeared, while new bands corresponding to Al2O3-bound formate (1588 cm−1) appeared [41], along with several bands representing different formate vibrational modes (2905, 1394, and 1373 cm−1) [11,42]. Despite the formation of Al2O3-bound formate, negligible H2 and CO2 production was detected during this procedure (Fig. S14b), indicating the inactivity of Al2O3-bound formate in H2 production. By contrast, on Cu5-Al exposed to a CH3OH/H2O/N2 mixture at 323 K, fewer methoxy species were generated with less consumption of Al-OH species, signifying preferential methanol dissociation on Al2O3 (Fig. S16a). As the temperature increased to 423 K, the generation of Al2O3-bound formate and Cu-Al interfacial formate (1612 cm−1) [43] was observed coupled with the decrease in the number of methoxy species, indicating that methoxy species may be the precursors of formate (Fig. 3 a). As the temperature further rose, the quantity of Cu-Al interfacial formate increased rapidly until 533 K, followed by significant decrease at higher temperatures, while the amount of Al2O3-bound formate exhibited only slight changes (Fig. S16b). Simultaneously, the generation of H2 and CO2 gradually emerged and increased at around 423 K, reaching maximum values at around 513 K, after which they slowly decreased to stable levels (Fig. 3b). The observed alignment of the transformation of Cu-Al interfacial formate with the trends of H2 and CO2 production provided compelling evidence suggesting that the reaction pathway of Cu-Al interfacial formate played a significant role in H2 production. To elucidate the distinct reactivity of formates, step-response experiments were conducted. When Cu5-Al was exposed to a CH3OH/N2 mixture at 523 K (Fig. 3c), Al-OH species consumption and the generation of substantial formate were observed, coupled with the formation of methoxy species and a small amount of formaldehyde (1659 cm−1) [40,41]. This observation indicates the methanol dissociation consumed Al-OH species and its subsequent conversion to formaldehyde and formate. Subsequently, when exposed to N2, the amount of formate exhibited slight changes, indicating its strong binding to the catalyst surface. However, the final introduction of H2O/N2 led to almost complete consumption of reactive Cu-Al interfacial formate within 30 min and replenished Al-OH species, leaving exclusively inert Al2O3-bound formate on the catalyst surface. Notably, Al2O3-bound formate, generated by methoxy and formaldehyde species adsorbed on Al2O3 was gradually consumed, further confirming the continuous involvement of methoxy and formaldehyde species bound to Al sites in the reaction. Concurrently, the concentrations of H2 and CO2 rapidly increased within the first 2 min, peaking around 8 min, and then gradually declined over the next 10 min. This trend aligned with the consumption rate of Cu-Al interfacial formate, while the consumption rate of Al2O3-bound formate exhibited slight change, as determined from the first derivative of the normalized peak area of formate (Figs. 3d and S17g). Additionally, when exposed to methanol at 523 K, only Al2O3-bound formate, accompanied by a substantial amount of formaldehyde (1659, 1633, and 1320 cm−1) [41], was observed on both Al2O3 and Cu0.25-Al, while a lower amount of reactive formate was observed on Cu10-Al (Fig. S17a–c). By the way, the observed water production during the adsorption of methanol on Al2O3 suggested that the H species produced by dehydrogenation of methanol might react with Al-OH to produce water (Fig. S17h). Moreover, the Al2O3-bound formate on both Al2O3 and Cu0.25-Al exhibited poor reactivity toward H2O to produce H2 and CO2 (Fig. S17d, e, and g). These observations further confirmed that the key reaction pathway involved the Cu-Al interfacial formate. In addition, on the Cu10-Al catalyst, the formate showed lower reactivity in producing H2, possibly attributed to inefficiency in H2O activation (Fig. S17f and g). Notably, the weak sensitivity of TOF to Cu nanoparticle size suggested that the H2 production was not exclusively regulated by the interface sites, while the surface Cu species, serving as the primary active sites, determined the H2 production. Interestingly, the consumption of Al2O3-bound formate suggested that Al2O3-bound formate could serve as a supplement to reactive formate, whereby neighboring Al2O3-bound formate may migrate to Cu nanoparticles. This further indicated that formate dehydrogenation, the significant step in H2 production, did not occur exclusively at the Cu-Al interface but rather transferred to the surface Cu species, where it occurred uniformly. Hence, the Cu-Al interface may primarily act as the trigger site to promote the formation of reactive formate. In situ DRIFTS experiments were performed on Al2O3 and Cu/Al2O3 to elucidate the active sites and intermediates involved in water activation. Upon exposure to a H2O/N2 mixture at 473 K, bands at 1650 cm−1 corresponding to the water H-O-H bending [44] mode and negative bands at 3768, 3725, and 3669 cm−1 corresponding to Al-OH species were observed on Al2O3 [40], indicating the dissociation of water may occupy Al-OH sites to form H-bonds, weakening the vibration of Al-OH (Figs. 4 a and S18) [45–47]. In contrast, on Cu5-Al, the adsorption of molecular water and the consumption of Al-OH decreased, while broad bands in the range of 3600–2900 cm−1 were enhanced and a new band at 3735 cm−1 appeared, which indicate that the water dissociation may be facilitated on Cu5-Al to generate some new hydroxyl groups. Notably, upon exposure to a H2O/N2 mixture at 573 K, a similar band at 3735 cm−1 was observed on Cu powder (Fig. S19), which may suggest that the new hydroxyl groups could be associated with Cu-OH species [48,49]. To further verify the generation of Cu-OH species, D2O adsorption experiments were conducted. Upon exposure to a D2O/N2 mixture at 473 K, a weakened vibration of Al-OH was observed on Al2O3, exhibiting varying degrees of redshift compared to that during H2O adsorption (Fig. S20). However, on the Cu5-Al, the weakening of Al-OH vibrations was significantly reduced, while broad OD vibration bands in the range of 2700–2200 cm−1 were greatly enhanced [50]. Furthermore, a new band at 2716 cm−1, with a ratio of 1.38 to the 3735 cm−1 band, was observed. Given that previous studies proposed an isotope shift of 1.36 for Cu-OH and Cu-OD [50–52], these findings confirmed that the 3735 and 2716 cm−1 bands correspond to Cu-OH and Cu-OD species, respectively. In situ Raman was further employed to investigate the redox cycle of Cu species on Cu5-Al during the activation of water. The absence of Cu2+ species (273, 321, and 606 cm−1) and Cu+ species (150, 220 cm−1) [35] confirmed the metallic state of Cu species on Cu5-Al at 298 K (Fig. 4b). After the introduction of water at 323 K, peaks at 184 and 212 cm−1, attributed to the bending vibration of Cu-OH species [53,54] and peaks at 448 and 550 cm−1, assigned to the stretching vibration of Cu-OH species emerged, accompanied by the generation of Cu+ species. This further confirmed that water activation occurs on Cu0 species via oxidizing Cu0 to Cu-OH species, in which the Cu electronic sate was Cu+. As the temperature rose, the number of Cu+-OH species increased, suggesting that the activation of water was enhanced with rising temperature. Notably, despite the temperature rising to 573 K, negligible Cu2+ species were detected, signifying that water could not oxidize Cu0 to Cu2+ throughout the entire range of reaction temperatures. The strong linear correlation between the changes in Cu-OH species (184 cm−1) and Cu+ species (220 cm−1) further indicated that the increase in Cu+ species during water activation was mainly due to the formation of Cu-OH species (Fig. S21). The above results provided compelling evidence that water activation occurs on Cu0 species, oxidizing Cu0 to form Cu+-OH species. Additionally, the amount of Cu+-OH species generated from water activation increased with rising water concentration, suggesting that its production was probably influenced by the partial pressure of water (Fig. S22). This observation indicated that the water activation was likely quasi-equilibrated. By contrast, negligible Cu+-OH species were generated on Cu0.25-Al (Fig. S23), indicating that Cu single atoms could not activate water. Besides, fewer Cu+-OH species were formed on the Cu10-Al catalyst compared to the Cu5-Al catalyst (Fig. S24), indicating that large Cu nanoparticles exhibited a weaker ability to activate water. DFT calculations provided additional insights into the activation of water on the Cu/Al2O3 catalysts. A Cu(111) surface and a single Cu atom on a Al2O3(110) surface (Cu1/Al2O3) were used to represent the Cu nanoparticles and single Cu atom species, respectively. Bader charge analysis indicated that H existed in the form of a proton in adsorbed H2O with a Bader charge of 0.58 e− at the initial state (IS). The dissociation of H2O on Cu(111) would generate Cu-OH and electron-rich H, where the H atom in Cu-H gained 1.10 e− at the final state (FS), with a substantial contribution of electrons (0.60 e−) originating from Cu atoms in Cu-OH (Fig. 4c). This indicated that the Cu species in Cu-OH were present in the Cu+ state, aligning with the Raman results. Further, the electron-rich H may detach more easily from the Cu surface to produce hydrogen [8]. However, H2O dissociation on Cu1/Al2O3 would generate Cu-OH and Al-OH, and the H moiety in H2O only gained 0.32 e− from the O atoms in Al2O3 and H2O at the FS. While the energy barrier for H2O dissociation on Cu1/Al2O3 was lower, the formation of electron-poor H in Al-OH was disadvantageous to the subsequent dehydrogenation (Fig. 4d). In situ DR-UV–vis was employed to probe the dynamics of Cu species on the Cu5-Al catalyst under varying reaction conditions. DR-UV–vis spectra revealed that Cu0 species (560–620 nm) [48,55,56] were present on Cu x -Al (x = 2.5 to 10) samples (Fig. S25). During in situ DR-UV–vis experiments, the oxidized Cu5-Al sample was first reduced in H2/N2 at 573 K for 60 min, followed by subsequent exposure to various gas conditions at different temperatures for 60 min (Fig. 5 ). By the way, the slight changes in the Cu0 species from 573 K to 323 K indicated that temperature had a negligible impact on the background of DR-UV–Vis spectra (Fig. S26). After exposure to a flow of H2O/N2 at 323 K, the number of Cu0 species decreased significantly, suggesting the facile oxidation of Cu0 by water (Fig. 5a). As the temperature further increased to 423 K, the reduced Cu0 species almost completely vanished, further confirming the role of H2O in oxidizing Cu0 species. Besides, the Cu5-Al sample was pretreated in O2/N2 at 473 K, followed by exposure to a flow of CH3OH/N2 (Fig. 5b), this had a minor influence on the Cu0 species. The number of Cu0 species exhibited a remarkable increase at 523 K, while the Cu species were almost entirely reduced at the higher temperature of 573 K. These results revealed the reduction ability of methanol toward Cu species, which was enhanced progressively with rising temperature. Notably, the reduction of Cu species by methanol was more difficult than the oxidation of metallic Cu by water. After exposure to a flow of CH3OH/H2O/N2 at 473 K, the reduced Cu0 species were rapidly oxidized, indicating that the oxidation ability of water outpaced the reduction ability of methanol at temperatures below 523 K (Fig. 5c). In contrast, at 573 K, the Cu species were completely reduced, indicating that the reduction potency of methanol surpassed the oxidation potency of water at higher temperatures. A step-response experiment was further performed on Cu5-Al to investigate the dynamics of Cu species during methanol steam reforming (Fig. 5d). The oxidized Cu5-Al sample was pretreated in H2/N2 and then successively exposed to H2O/N2, CH3OH/N2, H2O/N2, and CH3OH/N2 for 1 h each. At 473 K, Cu0 species were rapidly oxidized in the flow of H2O/N2, while only slight changes occurred after the subsequent gas composition switches. At 523 K, however, once the reaction gas was switched from H2O/N2 to CH3OH/N2, Cu0 species underwent deep oxidation within the first 20 min, probably attributed to the formation of formate [18]. In the succeeding 40 min, part of the Cu species were slowly reduced back to Cu0 species. At 573 K, in the flow of CH3OH/N2, Cu0 species were deeply oxidized within the first 10 min, while almost all Cu species were rapidly reduced to Cu0 species in the subsequent 20 min. Hence, although the reduction induced by methanol predominated over the oxidation of Cu0 species at high temperatures (573 K), the reduction of oxidized Cu species predominated the overall reaction rate at low temperatures. Interestingly, TPR results showed that the H2 reduction temperature of Cu5-Al ranged from 403 K to 473 K, confirming the complete reduction of oxidized Cu species to Cu0 at 573 K, as observed by in situ DR-UV–vis. The lower reduction temperature indicated Cu species might be easily oxidized, consistent with the rapid reoxidation of Cu0 species by H2O. Methanol, with its weaker reduction capability, could not reduce oxidized Cu species at 473 K but achieved partial reduction at higher temperatures. Overall, the reduction behavior observed via in situ DR-UV–vis corresponded to the TPR results. In the process of methanol steam reforming, methanol undergoes continuous dehydrogenation to form methoxy groups and formaldehyde, which subsequently react with water to produce formate, ultimately decomposing into CO2, and H2 is continuously produced by the dehydrogenation [6,10,17,57]. During this process, water activation and active formate formation are critical for H2 production; yet, these issues have not been fully explained in previous studies. In the present work, in situ Raman and DFT results showed that water was mainly activated on Cu0 species, leading to the oxidation of Cu0 to Cu+-OH. Notably, the H moiety generated from H2O dissociation was more likely to transfer to remained Cu0 species, while numerous studies have highlighted the adsorption and dissociation of H2 on Cu0 species [8,58,59]. This suggests that the H moiety produced during the continuous dehydrogenation of methanol may similarly transfer to Cu0 species. Moreover, active formate, as well as the most abundant surface intermediates (MBSI) identified by in situ DRIFTS-MS was Cu-Al interfacial formate, as deduced from the strong correlation between its high reactivity and H2 production tendency. Notably, on the Cu5-Al sample, with strong water activation ability, little formaldehyde accumulated and abundant Cu-Al interfacial formate was formed, while substantial formaldehyde and negligible reactive formate was produced on Al2O3 and Cu0.25-Al samples without water activation ability. These findings indicated that the reactive formate originated from the reaction of formaldehyde and Cu+-OH species. Recent work reported the crucial role of the Cu-Al2O3 interface in MSR, where it generates reactive HCOO-CuAl species [43]. The present work further clarified that the reactive formate originated from the reaction between Cu+-OH and formaldehyde species on Al2O3 and also identified surface Cu species as the active sites for the MSR reaction, with the Cu-Al interface primarily acting as trigger sites to regulate the formation of reactive formate. Based on the above findings, a reaction pathway for methanol steam reforming was proposed (Fig. 6 ). Initially, methanol preferentially adsorbs and dissociates on Al2O3 to form methoxy species (CH3O*), followed by stepwise dehydrogenation to produce formaldehyde (CH2O*). The transfer of hydrogen atoms occurs on the Cu0 nanoparticles, resulting in the production of H2 molecules. Based on the kinetic, thermodynamic, and DFT studies of methanol dehydrogenation and CO2 hydrogenation to methanol, the dissociative adsorption of methanol is likely to be reversible [60–63]. Although the energy barrier for the further dehydrogenation of CH3O* to CH2O* is higher than that of the reverse reaction [10,33,64], the observed rapid kinetics of this step suggests that both the forward and reverse directions are feasible. Simultaneously, water undergoes activation on another Cu0 site, resulting in the generation of Cu+-OH species. During this process, Cu0 sites transfer electrons to the O atoms, leading to the generation of electron-rich hydrogen. The dependence of Cu+-OH species formation on the partial pressure of water, as well as the previous DFT studies reported similar energy barriers for the forward and reverse reactions of water activation, suggesting that the water activation may be quasi-equilibrated [62,65]. Subsequently, an interaction between the formaldehyde and the Cu+-OH species occur, leading to the formation of methylene dioxygen (CH2OO*), which then dehydrogenates to generate reactive formate (HCOO*). The formate then migrated to the surface Cu species for further dehydrogenation. The instability and rapid reaction of the CH2OO* intermediate, along with the slightly higher energy barrier for the reverse reaction, suggest limited reversibility for this process [10,66]. Finally, the uniform dehydrogenation of formate on the surface Cu species produced H2 and CO2, thus completing the redox cycle between Cu0 and Cu+. Notably, the dehydrogenation of HCOO* proceeded slowly with a high energy barrier [10,33], indicating that this step may be both the rate-determining step and partially irreversible. The hypothesized active sites, dynamically formed, comprise dynamic Cu0/+ sites coupled with Cu0 sites. The formation of Cu+ arises from the oxidation of Cu0 by water, likely involving electron transfer from Cu0 to the adsorbed water. Concurrently, the reduction of Cu+ by methanol potentially involves electron transfer from formate to Cu+ during dehydrogenation. Notably, the rate-determining step (RDS) in the MSR reaction has garnered significant attention among researchers. While some studies suggest that the rate-determining step is the dehydrogenation of CH3O* [43,61], others have demonstrated through DFT calculations that the dissociation energy barrier of H2O is higher than that of CH3O* dehydrogenation [10]. Furthermore, certain researchers have proposed that the rate-determining step transitions to HCOO* dehydrogenation under specific catalysts [8]. In present work, the dehydrogenation of CH3O* was not considered to be the rate-determining step of MSR, since the dehydrogenation of CH3O* on inactive Al2O3 occurred rapidly, while the rapid oxidation of Cu0 species by water also indicated that the dissociation of water was not the rate-determining step. While the size of Cu nanoparticles could affect its ability of water activation, the rapid process of water activation would not significantly limit the overall H2 production rate. Instead, the gradually increasing reduction of Cu+ at low temperature was correlated with the MSR activity, suggesting that at lower temperatures, the dehydrogenation of formate, which led to the reduction of Cu+, may be the rate-determining step of methanol steam reforming on Cu/Al2O3 catalysts. In contrast to previous studies that primarily focused on the initial content of Cu0 and Cu+ species in the catalyst [8,13,54,67], and notwithstanding recent demonstrations of MSR activity enhancements through Cu0-Cu+ interfacial sites [8], the present work has innovatively monitored the dynamic changes of Cu species during the reaction, revealing the presence of a dynamic Cu0/+-Cu0 active site in MSR. Considering the potential morphological changes of copper catalysts during specific processes [68], the dynamic observation of copper morphology changes in MSR reaction emerges as a crucial task for future research. Furthermore, the dependence of the H2 production rate on CCu indicates that the active sites in methanol steam reforming are surface Cu species, which would be regulated by the size of Cu nanoparticles. Hence, small Cu nanoparticles (like ∼ 3 nm in the Cu5Al sample) will optimize the number of active sites, while Cu single atoms cannot activate water, and large Cu nanoparticles suffer from a deficiency of surface Cu sites. Interestingly, previous studies have shown that the activity of Cu-based catalysts tended to initially increase and then decrease with extended test duration [69,70]. The initial increase in activity was often termed self-activation [71,72], while the subsequent decrease was termed deactivation [73,74]. Combined with the above results, the self-activation process possibly stems from the gradual enlargement of Cu nanoparticles to the optimal particle size. However, further enlargement may lead to sintering and subsequent deactivation [75]. 4 Conclusions This study elucidates a dynamic active sites mechanism for methanol steam reforming over Cu/Al2O3 catalysts, wherein a dynamic Cu0/+ site and an adjacent Cu0 site are proposed as the active sites. Water is activated on Cu0 site, oxidizing it to Cu+-OH species. These Cu+-OH species subsequently promote the formation of reactive formate that produce H2 and CO2 upon dehydrogenation, while reducing Cu+ back to Cu0. The small size Cu nanoparticles provide abundant active surface Cu sites, enhancing catalytic performance. Compared to the facile activation of water, the dehydrogenation of formate may be the rate-determining step of the reaction at lower temperatures. The Cu0/+-Cu0 sites represent a departure from previous static models, showcasing the dynamic nature of active Cu sites during methanol steam reforming. This work provides new insights into the dynamics of active sites on copper catalysts during methanol steam reforming, providing guidance for high-efficiency catalysts. CRediT authorship contribution statement Diru Liu: Writing – review & editing, Writing – original draft, Investigation, Data curation. Mengyuan Zhang: Investigation. Lin Zhao: Investigation. Xueli Guo: Data curation. Guangyan Xu: Writing – review & editing, Validation, Project administration, Methodology, Conceptualization. Hong He: Writing – review & editing, Supervision, Project administration, Conceptualization. Declaration of competing interest The authors declare that they have no known competing financial interests or personal relationships that could have appeared to influence the work reported in this paper. Acknowledgments This work was supported by the National Key R&D Program of China (2022YFC3704400), the National Natural Science Foundation of China (22276203), the Strategic Priority Research Program of the Chinese Academy of Sciences (XDA0390103), and the project of eco-environmental technology for carbon neutrality (RCEES-TDZ-2021-6). The authors thank BL11B beamline of the Shanghai Synchrotron Radiation Facility (SSRF), China for providing the XAFS beamtime. Appendix A Supplementary data Supplementary data to this article can be found online at https://doi.org/10.1016/j.jcat.2024.115922. Appendix A Supplementary data The following are the Supplementary data to this article: Supplementary Data 1 References [1] U. Eberle M. Felderhoff F. Schuth Chemical and physical solutions for hydrogen storage Angew. Chem. Int. Ed. 48 2009 6608 6630 10.1002/anie.200806293 U. Eberle, M. Felderhoff, F. Schuth, Chemical and physical solutions for hydrogen storage, Angew. Chem. Int. Ed. 48 (2009) 6608-6630. 10.1002/anie.200806293 [2] A.I. Osman N. Mehta A.M. Elgarahy M. Hefny A. Al-Hinai A.A.H. Al-Muhtaseb D.W. Rooney Hydrogen production, storage, utilisation and environmental impacts: a review Environ. Chem. Lett. 20 2022 153 188 10.1007/s10311-021-01322-8 A.I. Osman, N. Mehta, A.M. Elgarahy, M. Hefny, A. Al-Hinai, A.A.H. Al-Muhtaseb, D.W. Rooney, Hydrogen production, storage, utilisation and environmental impacts: a review, Environ. Chem. Lett. 20 (2022) 153-188. 10.1007/s10311-021-01322-8 [3] D.R. Palo R.A. Dagle J.D. Holladay Methanol steam reforming for hydrogen production Chem. Rev. 107 2007 3992 4021 10.1021/cr050198b D.R. Palo, R.A. Dagle, J.D. Holladay, Methanol Steam Reforming for Hydrogen Production, Chem. Rev. 107 (2007) 3992-4021. 10.1021/cr050198b [4] T. Lunkenbein J. Schumann M. Behrens R. Schlögl M.G. Willinger Formation of a ZnO overlayer in industrial Cu/ZnO/Al2O3 catalysts induced by strong metal-support interactions Angew. Chem. Int. Ed. 54 2015 4544 4548 10.1002/anie.201411581 T. Lunkenbein, J. Schumann, M. Behrens, R. Schlögl, M.G. Willinger, Formation of a ZnO Overlayer in Industrial Cu/ZnO/Al2O3 Catalysts Induced by Strong Metal–Support Interactions, Angew. Chem. Int. Ed. 54 (2015) 4544-4548. 10.1002/anie.201411581 [5] Y. Xu Z. Dai Y. Ding L. Zhang Revealing the synergy between zinc and aluminum in Cu/ZnO/Al2O3 industrial catalyst J. Chem. Phys. 157 2022 10.1063/5.0117718 Y. Xu, Z. Dai, Y. Ding, L. Zhang, Revealing the synergy between zinc and aluminum in Cu/ZnO/Al2O3 industrial catalyst, The Journal of Chemical Physics 157 (2022). 10.1063/5.0117718 [6] S. Sá H. Silva L. Brandão J.M. Sousa A. Mendes Catalysts for methanol steam reforming—A review Appl. Catal. B 99 2010 43 57 10.1016/j.apcatb.2010.06.015 S. Sá, H. Silva, L. Brandão, J.M. Sousa, A. Mendes, Catalysts for methanol steam reforming—A review, Appl. Catal. B 99 (2010) 43-57. 10.1016/j.apcatb.2010.06.015 [7] N. Takezawa N. Iwasa Steam reforming and dehydrogenation of methanol: difference in the catalytic functions of copper and group VIII metals Catal. Today 36 1997 45 56 10.1016/S0920-5861(96)00195-2 N. Takezawa, N. Iwasa, Steam reforming and dehydrogenation of methanol: Difference in the catalytic functions of copper and group VIII metals, Catal. Today 36 (1997) 45-56. 10.1016/S0920-5861(96)00195-2 [8] H. Meng Y. Yang T. Shen Z. Yin L. Wang W. Liu P. Yin Z. Ren L. Zheng J. Zhang F.-S. Xiao M. Wei Designing Cu0−Cu+ dual sites for improved C−H bond fracture towards methanol steam reforming Nat. Commun. 14 2023 7980 10.1038/s41467-023-43679-0 H. Meng, Y. Yang, T. Shen, Z. Yin, L. Wang, W. Liu, P. Yin, Z. Ren, L. Zheng, J. Zhang, F.-S. Xiao, M. Wei, Designing Cu0−Cu+ dual sites for improved C−H bond fracture towards methanol steam reforming, Nat. Commun. 14 (2023) 7980. 10.1038/s41467-023-43679-0 [9] H. Li H. Tian S. Chen Z. Sun T. Liu R. Liu S. Assabumrungrat J. Saupsor R. Mu C. Pei J. Gong Sorption enhanced steam reforming of methanol for high-purity hydrogen production over Cu-MgO/Al2O3 bifunctional catalysts Appl. Catal. B 276 2020 119052 10.1016/j.apcatb.2020.119052 H. Li, H. Tian, S. Chen, Z. Sun, T. Liu, R. Liu, S. Assabumrungrat, J. Saupsor, R. Mu, C. Pei, J. Gong, Sorption enhanced steam reforming of methanol for high-purity hydrogen production over Cu-MgO/Al2O3 bifunctional catalysts, Appl. Catal. B 276 (2020) 119052. 10.1016/j.apcatb.2020.119052 [10] D. Li F. Xu X. Tang S. Dai T. Pu X. Liu P. Tian F. Xuan Z. Xu I.E. Wachs M. Zhu Induced activation of the commercial Cu/ZnO/Al2O3 catalyst for the steam reforming of methanol Nat. Catal. 5 2022 99 108 10.1038/s41929-021-00729-4 D. Li, F. Xu, X. Tang, S. Dai, T. Pu, X. Liu, P. Tian, F. Xuan, Z. Xu, I.E. Wachs, M. Zhu, Induced activation of the commercial Cu/ZnO/Al2O3 catalyst for the steam reforming of methanol, Nat. Catal. 5 (2022) 99-108. 10.1038/s41929-021-00729-4 [11] K. Ploner M. Watschinger P.D. Kheyrollahi Nezhad T. Götsch L. Schlicker E.-M. Köck A. Gurlo A. Gili A. Doran L. Zhang N. Köwitsch M. Armbrüster S. Vanicek W. Wallisch C. Thurner B. Klötzer S. Penner Mechanistic insights into the catalytic methanol steam reforming performance of Cu/ZrO2 catalysts by in situ and operando studies J. Catal. 391 2020 497 512 10.1016/j.jcat.2020.09.018 K. Ploner, M. Watschinger, P.D. Kheyrollahi Nezhad, T. Götsch, L. Schlicker, E.-M. Köck, A. Gurlo, A. Gili, A. Doran, L. Zhang, N. Köwitsch, M. Armbrüster, S. Vanicek, W. Wallisch, C. Thurner, B. Klötzer, S. Penner, Mechanistic insights into the catalytic methanol steam reforming performance of Cu/ZrO2 catalysts by in situ and operando studies, J. Catal. 391 (2020) 497-512. 10.1016/j.jcat.2020.09.018 [12] F. Bossola N. Scotti F. Somodi M. Coduri C. Evangelisti V. Dal Santo Electron-poor copper nanoparticles over amorphous zirconia-silica as all-in-one catalytic sites for the methanol steam reforming Appl. Catal. B 258 2019 118016 10.1016/j.apcatb.2019.118016 F. Bossola, N. Scotti, F. Somodi, M. Coduri, C. Evangelisti, V. Dal Santo, Electron-poor copper nanoparticles over amorphous zirconia-silica as all-in-one catalytic sites for the methanol steam reforming, Appl. Catal. B 258 (2019) 118016. 10.1016/j.apcatb.2019.118016 [13] K. Ma Y. Tian Z.J. Zhao Q. Cheng T. Ding J. Zhang L. Zheng Z. Jiang T. Abe N. Tsubaki J. Gong X. Li Achieving efficient and robust catalytic reforming on dual-sites of Cu species Chem. Sci. 10 2019 2578 2584 10.1039/c9sc00015a K. Ma, Y. Tian, Z.J. Zhao, Q. Cheng, T. Ding, J. Zhang, L. Zheng, Z. Jiang, T. Abe, N. Tsubaki, J. Gong, X. Li, Achieving efficient and robust catalytic reforming on dual-sites of Cu species, Chem. Sci. 10 (2019) 2578-2584. 10.1039/c9sc00015a [14] E. Lam J.J. Corral-Perez K. Larmier G. Noh P. Wolf A. Comas-Vives A. Urakawa C. Coperet CO2 hydrogenation on Cu/Al2O3: role of the metal/support interface in driving activity and selectivity of a bifunctional catalyst Angew. Chem. Int. Ed. 58 2019 13989 13996 10.1002/anie.201908060 E. Lam, J.J. Corral-Perez, K. Larmier, G. Noh, P. Wolf, A. Comas-Vives, A. Urakawa, C. Coperet, CO2 Hydrogenation on Cu/Al2O3 : Role of the Metal/Support Interface in Driving Activity and Selectivity of a Bifunctional Catalyst, Angew. Chem. Int. Ed. 58 (2019) 13989-13996. 10.1002/anie.201908060 [15] K. Ploner P. Delir Kheyrollahi Nezhad M. Watschinger L. Schlicker M.F. Bekheet A. Gurlo A. Gili A. Doran S. Schwarz M. Stöger-Pollach J. Bernardi M. Armbrüster B. Klötzer S. Penner Steering the methanol steam reforming performance of Cu/ZrO2 catalysts by modification of the Cu-ZrO2 interface dimensions resulting from Cu loading variation Appl. Catal. A 623 2021 118279 10.1016/j.apcata.2021.118279 K. Ploner, P. Delir Kheyrollahi Nezhad, M. Watschinger, L. Schlicker, M.F. Bekheet, A. Gurlo, A. Gili, A. Doran, S. Schwarz, M. Stöger-Pollach, J. Bernardi, M. Armbrüster, B. Klötzer, S. Penner, Steering the methanol steam reforming performance of Cu/ZrO2 catalysts by modification of the Cu-ZrO2 interface dimensions resulting from Cu loading variation, Appl. Catal. A 623 (2021) 118279. 10.1016/j.apcata.2021.118279 [16] X. Xu T. Lan G. Zhao Q. Nie F. Jiang Y. Lu Interface-hydroxyl enabling methanol steam reforming toward CO-free hydrogen production over inverse ZrO2/Cu catalyst Appl. Catal. B 334 2023 122839 10.1016/j.apcatb.2023.122839 X. Xu, T. Lan, G. Zhao, Q. Nie, F. Jiang, Y. Lu, Interface-hydroxyl enabling methanol steam reforming toward CO-free hydrogen production over inverse ZrO2/Cu catalyst, Appl. Catal. B 334 (2023) 122839. 10.1016/j.apcatb.2023.122839 [17] W. Tong A. West K. Cheung K.-M. Yu S.C.E. Tsang Dramatic effects of gallium promotion on methanol steam reforming Cu–ZnO catalyst for hydrogen production: formation of 5 Å copper clusters from Cu–ZnGaOx ACS Catal. 3 2013 1231 1244 10.1021/cs400011m W. Tong, A. West, K. Cheung, K.-M. Yu, S.C.E. Tsang, Dramatic Effects of Gallium Promotion on Methanol Steam Reforming Cu–ZnO Catalyst for Hydrogen Production: Formation of 5 Å Copper Clusters from Cu–ZnGaOx, ACS Catal. 3 (2013) 1231-1244. 10.1021/cs400011m [18] H. Yang Y. Chen X. Cui G. Wang Y. Cen T. Deng W. Yan J. Gao S. Zhu U. Olsbye J. Wang W. Fan A highly stable copper-based catalyst for clarifying the catalytic roles of Cu0 and Cu+ species in methanol dehydrogenation Angew. Chem. Int. Ed. 57 2018 1836 1840 10.1002/anie.201710605 H. Yang, Y. Chen, X. Cui, G. Wang, Y. Cen, T. Deng, W. Yan, J. Gao, S. Zhu, U. Olsbye, J. Wang, W. Fan, A Highly Stable Copper-Based Catalyst for Clarifying the Catalytic Roles of Cu0 and Cu+ Species in Methanol Dehydrogenation, Angew. Chem. Int. Ed. 57 (2018) 1836-1840. 10.1002/anie.201710605 [19] X. Cao H. Liu J. Wei X. Tang X. Zeng Y. Sun T. Lei G. Zhao L. Lin Effective production of γ-valerolactone from biomass-derived methyl levulinate over CuOx-CaCO3 catalyst Chin. J. Catal. 40 2019 192 203 10.1016/s1872-2067(19)63270-5 X. Cao, H. Liu, J. Wei, X. Tang, X. Zeng, Y. Sun, T. Lei, G. Zhao, L. Lin, Effective production of γ-valerolactone from biomass-derived methyl levulinate over CuOx-CaCO3 catalyst, Chin. J. Catal. 40 (2019) 192-203. 10.1016/s1872-2067(19)63270-5 [20] X. Song C. Yang X. Li Z. Wang C. Pei Z.-J. Zhao J. Gong On the role of hydroxyl groups on Cu/Al2O3 in CO2 hydrogenation ACS Catal. 12 2022 14162 14172 10.1021/acscatal.2c03591 X. Song, C. Yang, X. Li, Z. Wang, C. Pei, Z.-J. Zhao, J. Gong, On the Role of Hydroxyl Groups on Cu/Al2O3 in CO2 Hydrogenation, ACS Catal. 12 (2022) 14162-14172. 10.1021/acscatal.2c03591 [21] B. Ravel M. Newville ATHENA, ARTEMIS, HEPHAESTUS: data analysis for X-ray absorption spectroscopy using IFEFFIT J. Synchrotron Radiat. 12 2005 537 541 10.1107/S0909049505012719 B. Ravel, M. Newville, ATHENA, ARTEMIS, HEPHAESTUS: data analysis for X-ray absorption spectroscopy using IFEFFIT, J. Synchrotron Radiat. 12 (2005) 537-541. 10.1107/S0909049505012719 [22] G. Xu Y. Zhang J. Lin Y. Wang X. Shi Y. Yu H. He Unraveling the mechanism of ammonia selective catalytic oxidation on Ag/Al2O3 catalysts by operando spectroscopy ACS Catal. 11 2021 5506 5516 10.1021/acscatal.1c01054 G. Xu, Y. Zhang, J. Lin, Y. Wang, X. Shi, Y. Yu, H. He, Unraveling the Mechanism of Ammonia Selective Catalytic Oxidation on Ag/Al2O3 Catalysts by Operando Spectroscopy, ACS Catal. 11 (2021) 5506-5516. 10.1021/acscatal.1c01054 [23] X. Chen G. He Y. Li M. Chen X. Qin C. Zhang H. He Identification of a facile pathway for dioxymethylene conversion to formate catalyzed by surface hydroxyl on TiO2-based catalyst ACS Catal. 10 2020 9706 9715 10.1021/acscatal.0c01901 X. Chen, G. He, Y. Li, M. Chen, X. Qin, C. Zhang, H. He, Identification of a Facile Pathway for Dioxymethylene Conversion to Formate Catalyzed by Surface Hydroxyl on TiO2-Based Catalyst, ACS Catal. 10 (2020) 9706-9715. 10.1021/acscatal.0c01901 [24] Y. Sun G. Xu Y. Wang W. Shi Y. Yu H. He In situ synthesis of encapsulated Pd@silicalite-2 for highly stable methane catalytic combustion Environ. Sci. Tech. 57 2023 20370 20379 10.1021/acs.est.3c05634 Y. Sun, G. Xu, Y. Wang, W. Shi, Y. Yu, H. He, In Situ Synthesis of Encapsulated Pd@silicalite-2 for Highly Stable Methane Catalytic Combustion, Environ. Sci. Technol. 57 (2023) 20370-20379. 10.1021/acs.est.3c05634 [25] G. Xu J. Ma L. Wang Z. Lv S. Wang Y. Yu H. He Mechanism of the H2 effect on NH3-selective catalytic reduction over Ag/Al2O3: kinetic and diffuse reflectance infrared Fourier transform spectroscopy studies ACS Catal. 9 2019 10489 10498 10.1021/acscatal.9b04100 G. Xu, J. Ma, L. Wang, Z. Lv, S. Wang, Y. Yu, H. He, Mechanism of the H2 Effect on NH3-Selective Catalytic Reduction over Ag/Al2O3: Kinetic and Diffuse Reflectance Infrared Fourier Transform Spectroscopy Studies, ACS Catal. 9 (2019) 10489-10498. 10.1021/acscatal.9b04100 [26] Q. An G. Xu J. Liu Y. Wang Y. Yu H. He Designing a bifunctional Pt/Cu-SSZ-13 catalyst for ammonia-selective catalytic oxidation with superior selectivity ACS Catal. 13 2023 6851 6861 10.1021/acscatal.3c01322 Q. An, G. Xu, J. Liu, Y. Wang, Y. Yu, H. He, Designing a Bifunctional Pt/Cu-SSZ-13 Catalyst for Ammonia-Selective Catalytic Oxidation with Superior Selectivity, ACS Catal. 13 (2023) 6851-6861. 10.1021/acscatal.3c01322 [27] Y. Wang G. Xu Y. Sun W. Shi X. Shi Y. Yu H. He Creating atomically iridium-doped PdOx nanoparticles for efficient and durable methane abatement Environ. Sci. Tech. 58 2024 10357 10367 10.1021/acs.est.4c00868 Y. Wang, G. Xu, Y. Sun, W. Shi, X. Shi, Y. Yu, H. He, Creating Atomically Iridium-Doped PdOx Nanoparticles for Efficient and Durable Methane Abatement, Environ. Sci. Technol. 58 (2024) 10357-10367. 10.1021/acs.est.4c00868 [28] Y. Wang Y. Sun G. Xu Z. Liu W. Shi X. Shi Y. Yu H. He Palladium nanoparticles anchored on silanol nests of zeolite showed superior stability for methane combustion Appl. Catal. B: Environ. Energy 356 2024 124221 10.1016/j.apcatb.2024.124221 Y. Wang, Y. Sun, G. Xu, Z. Liu, W. Shi, X. Shi, Y. Yu, H. He, Palladium nanoparticles anchored on silanol nests of zeolite showed superior stability for methane combustion, Applied Catalysis B: Environment and Energy 356 (2024) 124221. 10.1016/j.apcatb.2024.124221 [29] G. Xu H. Wang Y. Yu H. He Role of silver species in H2-NH3-SCR of NOx over Ag/Al2O3 catalysts: operando spectroscopy and DFT calculations J. Catal. 395 2021 1 9 10.1016/j.jcat.2020.12.025 G. Xu, H. Wang, Y. Yu, H. He, Role of silver species in H2-NH3-SCR of NOx over Ag/Al2O3 catalysts: Operando spectroscopy and DFT calculations, J. Catal. 395 (2021) 1-9. 10.1016/j.jcat.2020.12.025 [30] G. Kresse J. Furthmuller Efficient iterative schemes for ab initio total-energy calculations using a plane-wave basis set Phys. Rev. B 54 1996 11169 11186 10.1103/physrevb.54.11169 G. Kresse, J. Furthmuller, Efficient iterative schemes for ab initio total-energy calculations using a plane-wave basis set, Phys. Rev. B 54 (1996) 11169-11186. 10.1103/physrevb.54.11169 [31] J.P. Perdew K. Burke M. Ernzerhof Generalized gradient approximation made simple Phys. Rev. Lett. 77 1996 3865 3868 10.1103/PhysRevLett.77.3865 J.P. Perdew, K. Burke, M. Ernzerhof, Generalized Gradient Approximation Made Simple, Phys. Rev. Lett. 77 (1996) 3865-3868. 10.1103/PhysRevLett.77.3865 [32] N.D. Nielsen T.E.L. Smitshuysen C.D. Damsgaard A.D. Jensen J.M. Christensen Characterization of oxide-supported Cu by infrared measurements on adsorbed CO Surf. Sci. 703 2021 121725 10.1016/j.susc.2020.121725 N.D. Nielsen, T.E.L. Smitshuysen, C.D. Damsgaard, A.D. Jensen, J.M. Christensen, Characterization of oxide-supported Cu by infrared measurements on adsorbed CO, Surf. Sci. 703 (2021) 121725. 10.1016/j.susc.2020.121725 [33] H. Zhao R. Yu S. Ma K. Xu Y. Chen K. Jiang Y. Fang C. Zhu X. Liu Y. Tang L. Wu Y. Wu Q. Jiang P. He Z. Liu L. Tan The role of Cu1–O3 species in single-atom Cu/ZrO2 catalyst for CO2 hydrogenation Nat. Catal. 5 2022 818 831 10.1038/s41929-022-00840-0 H. Zhao, R. Yu, S. Ma, K. Xu, Y. Chen, K. Jiang, Y. Fang, C. Zhu, X. Liu, Y. Tang, L. Wu, Y. Wu, Q. Jiang, P. He, Z. Liu, L. Tan, The role of Cu1–O3 species in single-atom Cu/ZrO2 catalyst for CO2 hydrogenation, Nat. Catal. 5 (2022) 818-831. 10.1038/s41929-022-00840-0 [34] W. Wang Q. Zhou X. Fei Y. He P. Zhang G. Zhang L. Peng W. Xie Synthesis of CuO nano- and micro-structures and their Raman spectroscopic studies CrstEngComm 12 2010 10.1039/b919043k W. Wang, Q. Zhou, X. Fei, Y. He, P. Zhang, G. Zhang, L. Peng, W. Xie, Synthesis of CuO nano- and micro-structures and their Raman spectroscopic studies, CrystEngComm 12 (2010). 10.1039/b919043k [35] Y. Deng A.D. Handoko Y. Du S. Xi B.S. Yeo In situ Raman spectroscopy of copper and copper oxide surfaces during electrochemical oxygen evolution reaction: identification of CuIII oxides as catalytically active species ACS Catal. 6 2016 2473 2481 10.1021/acscatal.6b00205 Y. Deng, A.D. Handoko, Y. Du, S. Xi, B.S. Yeo, In Situ Raman Spectroscopy of Copper and Copper Oxide Surfaces during Electrochemical Oxygen Evolution Reaction: Identification of CuIII Oxides as Catalytically Active Species, ACS Catal. 6 (2016) 2473-2481. 10.1021/acscatal.6b00205 [36] K.M. Yu W. Tong A. West K. Cheung T. Li G. Smith Y. Guo S.C. Tsang Non-syngas direct steam reforming of methanol to hydrogen and carbon dioxide at low temperature Nat. Commun. 3 2012 1230 10.1038/ncomms2242 K.M. Yu, W. Tong, A. West, K. Cheung, T. Li, G. Smith, Y. Guo, S.C. Tsang, Non-syngas direct steam reforming of methanol to hydrogen and carbon dioxide at low temperature, Nat. Commun. 3 (2012) 1230. 10.1038/ncomms2242 [37] X. Ai H. Xie S. Chen G. Zhang B. Xu G. Zhou Highly dispersed mesoporous Cu/γ-Al2O3 catalyst for RWGS reaction Int. J. Hydrog. Energy 47 2022 14884 14895 10.1016/j.ijhydene.2022.03.002 X. Ai, H. Xie, S. Chen, G. Zhang, B. Xu, G. Zhou, Highly dispersed mesoporous Cu/γ-Al2O3 catalyst for RWGS reaction, Int. J. Hydrog. Energy 47 (2022) 14884-14895. 10.1016/j.ijhydene.2022.03.002 [38] S. Xia R. Nie X. Lu L. Wang P. Chen Z. Hou Hydrogenolysis of glycerol over Cu0.4/Zn5.6−xMgxAl2O8.6 catalysts: the role of basicity and hydrogen spillover J. Catal. 296 2012 1 11 10.1016/j.jcat.2012.08.007 S. Xia, R. Nie, X. Lu, L. Wang, P. Chen, Z. Hou, Hydrogenolysis of glycerol over Cu0.4/Zn5.6−xMgxAl2O8.6 catalysts: The role of basicity and hydrogen spillover, J. Catal. 296 (2012) 1-11. 10.1016/j.jcat.2012.08.007 [39] J. Hu Y. Li Y. Zhen M. Chen H. Wan In situ FTIR and ex situ XPS/HS-LEIS study of supported Cu/Al2O3 and Cu/ZnO catalysts for CO2 hydrogenation Chin. J. Catal. 42 2021 367 375 10.1016/s1872-2067(20)63672-5 J. Hu, Y. Li, Y. Zhen, M. Chen, H. Wan, In situ FTIR and ex situ XPS/HS-LEIS study of supported Cu/Al2O3 and Cu/ZnO catalysts for CO2 hydrogenation, Chin. J. Catal. 42 (2021) 367-375. 10.1016/s1872-2067(20)63672-5 [40] Z. Zhang G. He Y. Li C. Zhang J. Ma H. He Effect of hydroxyl groups on metal anchoring and formaldehyde oxidation performance of Pt/Al2O3 Environ. Sci. Tech. 56 2022 10916 10924 10.1021/acs.est.2c01278 Z. Zhang, G. He, Y. Li, C. Zhang, J. Ma, H. He, Effect of Hydroxyl Groups on Metal Anchoring and Formaldehyde Oxidation Performance of Pt/Al2O3, Environ. Sci. Technol. 56 (2022) 10916-10924. 10.1021/acs.est.2c01278 [41] V.A. Matyshak L.A. Berezina O.N. Sil’chenkova V.F. Tret’yakov G.I. Lin A.Y. Rozovskii Properties of surface compounds in methanol conversion on γ-Al2O3: data of in situ IR spectroscopy Kinet. Catal. 50 2009 111 121 10.1134/s0023158409010157 V.A. Matyshak, L.A. Berezina, O.N. Sil’chenkova, V.F. Tret’yakov, G.I. Lin, A.Y. Rozovskii, Properties of surface compounds in methanol conversion on γ-Al2O3: Data of in situ IR spectroscopy, Kinet. Catal. 50 (2009) 111-121. 10.1134/s0023158409010157 [42] T. Qi Z. Zhang Y. Li J. Wang F. Xiao A low temperature self-reducible copper hydroxide amino–alcohol complex catalyzed by formic acid for conductive copper films J. Mater. Chem. C 6 2018 11320 11327 10.1039/C8TC02665C T. Qi, Z. Zhang, Y. Li, J. Wang, F. Xiao, A low temperature self-reducible copper hydroxide amino–alcohol complex catalyzed by formic acid for conductive copper films, J. Mater. Chem. C 6 (2018) 11320-11327. 10.1039/C8TC02665C [43] Q. Mao Z. Gao X. Liu Y. Guo Y. Wang D. Ma The Cu–Al2O3 interface: an unignorable active site for methanol steam reforming hydrogen production Catal. Sci. Technol. 14 2024 3448 3458 10.1039/D4CY00401A Q. Mao, Z. Gao, X. Liu, Y. Guo, Y. Wang, D. Ma, The Cu–Al2O3 interface: an unignorable active site for methanol steam reforming hydrogen production, Catal. Sci. Technol. 14 (2024) 3448-3458. 10.1039/D4CY00401A [44] C.-C. Yu K.-Y. Chiang M. Okuno T. Seki T. Ohto X. Yu V. Korepanov H.-O. Hamaguchi M. Bonn J. Hunger Y. Nagata Vibrational couplings and energy transfer pathways of water’s bending mode Nat. Commun. 11 2020 5977 10.1038/s41467-020-19759-w C.-C. Yu, K.-Y. Chiang, M. Okuno, T. Seki, T. Ohto, X. Yu, V. Korepanov, H.-o. Hamaguchi, M. Bonn, J. Hunger, Y. Nagata, Vibrational couplings and energy transfer pathways of water’s bending mode, Nat. Commun. 11 (2020) 5977. 10.1038/s41467-020-19759-w [45] J.B. Peri Infrared and Gravimetric study of the surface hydration of γ-alumina J. Phys. Chem. 69 1965 211 219 10.1021/j100885a032 J.B. Peri, Infrared and Gravimetric Study of the Surface Hydration of γ-Alumina, The Journal of Physical Chemistry 69 (1965) 211-219. 10.1021/j100885a032 [46] M. Salmeron H. Bluhm M. Tatarkhanov G. Ketteler T.K. Shimizu A. Mugarza X. Deng T. Herranz S. Yamamoto A. Nilsson Water growth on metals and oxides: binding, dissociation and role of hydroxyl groups Faraday Discuss. 141 2009 221 229 10.1039/B806516K M. Salmeron, H. Bluhm, M. Tatarkhanov, G. Ketteler, T.K. Shimizu, A. Mugarza, X. Deng, T. Herranz, S. Yamamoto, A. Nilsson, Water growth on metals and oxides: binding, dissociation and role of hydroxyl groups, Faraday Discuss. 141 (2009) 221-229. 10.1039/B806516K [47] X. Deng T. Herranz C. Weis H. Bluhm M. Salmeron Adsorption of water on Cu2O and Al2O3 thin films J. Phys. Chem. C 112 2008 9668 9672 10.1021/jp800944r X. Deng, T. Herranz, C. Weis, H. Bluhm, M. Salmeron, Adsorption of Water on Cu2O and Al2O3 Thin Films, J. Phys. Chem. C 112 (2008) 9668-9672. 10.1021/jp800944r [48] T. Lan J. Deng X. Zhang F. Wang X. Liu D. Cheng D. Zhang Unraveling the promotion effects of dynamically constructed CuOx-OH interfacial sites in the selective catalytic oxidation of ammonia ACS Catal. 12 2022 3955 3964 10.1021/acscatal.1c05676 T. Lan, J. Deng, X. Zhang, F. Wang, X. Liu, D. Cheng, D. Zhang, Unraveling the Promotion Effects of Dynamically Constructed CuOx-OH Interfacial Sites in the Selective Catalytic Oxidation of Ammonia, ACS Catal. 12 (2022) 3955-3964. 10.1021/acscatal.1c05676 [49] J. Song Y. Wang E.D. Walter N.M. Washton D. Mei L. Kovarik M.H. Engelhard S. Prodinger Y. Wang C.H.F. Peden F. Gao Toward rational design of Cu/SSZ-13 selective catalytic reduction catalysts: implications from atomic-level understanding of hydrothermal stability ACS Catal. 7 2017 8214 8227 10.1021/acscatal.7b03020 J. Song, Y. Wang, E.D. Walter, N.M. Washton, D. Mei, L. Kovarik, M.H. Engelhard, S. Prodinger, Y. Wang, C.H.F. Peden, F. Gao, Toward Rational Design of Cu/SSZ-13 Selective Catalytic Reduction Catalysts: Implications from Atomic-Level Understanding of Hydrothermal Stability, ACS Catal. 7 (2017) 8214-8227. 10.1021/acscatal.7b03020 [50] Y. Wang C. Wöll IR spectroscopic investigations of chemical and photochemical reactions on metal oxides: bridging the materials gap Chem. Soc. Rev. 46 2017 1875 1932 10.1039/C6CS00914J Y. Wang, C. Wöll, IR spectroscopic investigations of chemical and photochemical reactions on metal oxides: bridging the materials gap, Chem. Soc. Rev. 46 (2017) 1875-1932. 10.1039/C6CS00914J [51] S.R. Loehr K.-H. Chung C.T. Moynihan Infrared absorption due to H2O and D2O in a fluorozirconate glass J. Am. Ceram. Soc. 71 1988 C-46-C-48 10.1111/j.1151-2916.1988.tb05781.x S.R. Loehr, K.-H. Chung, C.T. Moynihan, Infrared Absorption Due to H2O and D2O in a Fluorozirconate Glass, J. Am. Ceram. Soc. 71 (1988) C‐46-C‐48. 10.1111/j.1151-2916.1988.tb05781.x [52] G. Niaura Surface-enhanced Raman spectroscopic observation of two kinds of adsorbed OH− ions at copper electrode Electrochim. Acta 45 2000 3507 3519 10.1016/S0013-4686(00)00434-5 G. Niaura, Surface-enhanced Raman spectroscopic observation of two kinds of adsorbed OH− ions at copper electrode, Electrochim. Acta 45 (2000) 3507-3519. 10.1016/S0013-4686(00)00434-5 [53] R.L. Frost W.N. Martens L. Rintoul E. Mahmutagic J.T. Kloprogge Raman spectroscopic study of azurite and malachite at 298 and 77 K J. Raman Spectrosc. 33 2002 252 259 10.1002/jrs.848 R.L. Frost, W.N. Martens, L. Rintoul, E. Mahmutagic, J.T. Kloprogge, Raman spectroscopic study of azurite and malachite at 298 and 77 K, J. Raman Spectrosc. 33 (2002) 252-259. 10.1002/jrs.848 [54] D. Ruano J. Cored C. Azenha V. Pérez-Dieste A. Mendes C. Mateos-Pedrero P. Concepción Dynamic structure and subsurface oxygen formation of a working copper catalyst under methanol steam reforming conditions: an in situ time-resolved spectroscopic study ACS Catal. 9 2019 2922 2930 10.1021/acscatal.8b05042 D. Ruano, J. Cored, C. Azenha, V. Pérez-Dieste, A. Mendes, C. Mateos-Pedrero, P. Concepción, Dynamic Structure and Subsurface Oxygen Formation of a Working Copper Catalyst under Methanol Steam Reforming Conditions: An in Situ Time-Resolved Spectroscopic Study, ACS Catal. 9 (2019) 2922-2930. 10.1021/acscatal.8b05042 [55] S. Luo H. Song F. Ichihara M. Oshikiri W. Lu D.-M. Tang S. Li Y. Li Y. Li P. Davin T. Kako H. Lin J. Ye Light-induced dynamic restructuring of Cu active sites on TiO2 for low-temperature H2 production from methanol and water J. Am. Chem. Soc. 145 2023 20530 20538 10.1021/jacs.3c06688 S. Luo, H. Song, F. Ichihara, M. Oshikiri, W. Lu, D.-M. Tang, S. Li, Y. Li, Y. Li, P. Davin, T. Kako, H. Lin, J. Ye, Light-Induced Dynamic Restructuring of Cu Active Sites on TiO2 for Low-Temperature H2 Production from Methanol and Water, J. Am. Chem. Soc. 145 (2023) 20530-20538. 10.1021/jacs.3c06688 [56] M. Jabłońska A.M. Beale M. Nocuń R. Palkovits Ag-Cu based catalysts for the selective ammonia oxidation into nitrogen and water vapour Appl. Catal. B 232 2018 275 287 10.1016/j.apcatb.2018.03.029 M. Jabłońska, A.M. Beale, M. Nocuń, R. Palkovits, Ag-Cu based catalysts for the selective ammonia oxidation into nitrogen and water vapour, Appl. Catal. B 232 (2018) 275-287. 10.1016/j.apcatb.2018.03.029 [57] Z. Sun J. Liu R. Zhang Y. Wu H. Li S. Toan Z. Sun Fabricating Ga doped and MgO embedded nanomaterials for sorption-enhanced steam reforming of methanol J. Mater. Chem. A 10 2022 7300 7313 10.1039/d1ta10306g Z. Sun, J. Liu, R. Zhang, Y. Wu, H. Li, S. Toan, Z. Sun, Fabricating Ga doped and MgO embedded nanomaterials for sorption-enhanced steam reforming of methanol, J. Mater. Chem. A 10 (2022) 7300-7313. 10.1039/d1ta10306g [58] W. Zhang Y. Wang B. Gu Q. Tang Q.-E. Cao W. Fang Regulating the interaction within Pd-Cu dual metal sites for selective hydrogenation of furfural using ambient H2 pressure ACS Sustain. Chem. Eng. 11 2023 12798 12808 10.1021/acssuschemeng.3c03763 W. Zhang, Y. Wang, B. Gu, Q. Tang, Q.-E. Cao, W. Fang, Regulating the Interaction within Pd-Cu Dual Metal Sites for Selective Hydrogenation of Furfural Using Ambient H2 Pressure, ACS Sustainable Chem. Eng. 11 (2023) 12798-12808. 10.1021/acssuschemeng.3c03763 [59] S.-S. Wang X.-K. Gu H.-Y. Su W.-X. Li First-principles and microkinetic simulation studies of the structure sensitivity of Cu catalyst for methanol steam reforming J. Phys. Chem. C 122 2018 10811 10819 10.1021/acs.jpcc.8b00085 S.-S. Wang, X.-K. Gu, H.-Y. Su, W.-X. Li, First-Principles and Microkinetic Simulation Studies of the Structure Sensitivity of Cu Catalyst for Methanol Steam Reforming, J. Phys. Chem. C 122 (2018) 10811-10819. 10.1021/acs.jpcc.8b00085 [60] B.A. Peppley J.C. Amphlett L.M. Kearns R.F. Mann Methanol–steam reforming on Cu/ZnO/Al2O3 catalysts. Part 2. A comprehensive kinetic model Appl. Catal. A 179 1999 31 49 10.1016/s0926-860x(98)00299-3 B.A. Peppley, J.C. Amphlett, L.M. Kearns, R.F. Mann, Methanol–steam reforming on Cu/ZnO/Al2O3 catalysts. Part 2. A comprehensive kinetic model, Appl. Catal. A 179 (1999) 31-49. 10.1016/s0926-860x(98)00299-3 [61] B. Frank F. Jentoft H. Soerijanto J. Krohnert R. Schlogl R. Schomacker Steam reforming of methanol over copper-containing catalysts: influence of support material on microkinetics J. Catal. 246 2007 177 192 10.1016/j.jcat.2006.11.031 B. Frank, F. Jentoft, H. Soerijanto, J. Krohnert, R. Schlogl, R. Schomacker, Steam reforming of methanol over copper-containing catalysts: Influence of support material on microkinetics, J. Catal. 246 (2007) 177-192. 10.1016/j.jcat.2006.11.031 [62] D.K. Kim E. Iglesia Isotopic and kinetic assessment of the mechanism of CH3OH−H2O catalysis on supported copper clusters J. Phys. Chem. C 112 2008 17235 17243 10.1021/jp8062178 D.K. Kim, E. Iglesia, Isotopic and Kinetic Assessment of the Mechanism of CH3OH−H2O Catalysis on Supported Copper Clusters, J. Phys. Chem. C 112 (2008) 17235-17243. 10.1021/jp8062178 [63] G. Cai Y.-H.-C. Chin Catalytic consequences of protons in methanol oxidative dehydrogenation on molybdenum-based polyoxometalate clusters ACS Catal. 14 2024 6674 6686 10.1021/acscatal.4c00440 G. Cai, Y.-H.C. Chin, Catalytic Consequences of Protons in Methanol Oxidative Dehydrogenation on Molybdenum-Based Polyoxometalate Clusters, ACS Catal. 14 (2024) 6674-6686. 10.1021/acscatal.4c00440 [64] Z. Cui S. Meng Y. Yi A. Jafarzadeh S. Li E.C. Neyts Y. Hao L. Li X. Zhang X. Wang A. Bogaerts Plasma-catalytic methanol synthesis from CO2 hydrogenation over a supported Cu cluster catalyst: insights into the reaction mechanism ACS Catal. 12 2022 1326 1337 10.1021/acscatal.1c04678 Z. Cui, S. Meng, Y. Yi, A. Jafarzadeh, S. Li, E.C. Neyts, Y. Hao, L. Li, X. Zhang, X. Wang, A. Bogaerts, Plasma-Catalytic Methanol Synthesis from CO2 Hydrogenation over a Supported Cu Cluster Catalyst: Insights into the Reaction Mechanism, ACS Catal. 12 (2022) 1326-1337. 10.1021/acscatal.1c04678 [65] E. Fernández-Villanueva P.G. Lustemberg M. Zhao J. Soriano Rodriguez P. Concepción M.V. Ganduglia-Pirovano Water and Cu+ synergy in selective CO2 hydrogenation to methanol over Cu-MgO-Al2O3 catalysts J. Am. Chem. Soc. 146 2024 2024 2032 10.1021/jacs.3c10685 E. Fernández-Villanueva, P.G. Lustemberg, M. Zhao, J. Soriano Rodriguez, P. Concepción, M.V. Ganduglia-Pirovano, Water and Cu+ Synergy in Selective CO2 Hydrogenation to Methanol over Cu-MgO-Al2O3 Catalysts, J. Am. Chem. Soc. 146 (2024) 2024-2032. 10.1021/jacs.3c10685 [66] W. Tu P. Ren Y. Li Y. Yang Y. Tian Z. Zhang M. Zhu Y.-H.-C. Chin J. Gong Y.-F. Han Gas-dependent active sites on Cu/ZnO clusters for CH3OH synthesis J. Am. Chem. Soc. 145 2023 8751 8756 10.1021/jacs.2c13784 W. Tu, P. Ren, Y. Li, Y. Yang, Y. Tian, Z. Zhang, M. Zhu, Y.-H.C. Chin, J. Gong, Y.-F. Han, Gas-Dependent Active Sites on Cu/ZnO Clusters for CH3OH Synthesis, J. Am. Chem. Soc. 145 (2023) 8751-8756. 10.1021/jacs.2c13784 [67] M.A. Larrubia Vargas G. Busca U. Costantino F. Marmottini T. Montanari P. Patrono F. Pinzari G. Ramis An IR study of methanol steam reforming over ex-hydrotalcite Cu–Zn–Al catalysts J. Mol. Catal. A Chem. 266 2007 188 197 10.1016/j.molcata.2006.08.085 M.A. Larrubia Vargas, G. Busca, U. Costantino, F. Marmottini, T. Montanari, P. Patrono, F. Pinzari, G. Ramis, An IR study of methanol steam reforming over ex-hydrotalcite Cu–Zn–Al catalysts, J. Mol. Catal. A: Chem. 266 (2007) 188-197. 10.1016/j.molcata.2006.08.085 [68] Y. Yang S. Louisia S. Yu J. Jin I. Roh C. Chen M.V. Fonseca Guzman J. Feijóo P.-C. Chen H. Wang C.J. Pollock X. Huang Y.-T. Shao C. Wang D.A. Muller H.D. Abruña P. Yang Operando studies reveal active Cu nanograins for CO2 electroreduction Nature 614 2023 262 269 10.1038/s41586-022-05540-0 Y. Yang, S. Louisia, S. Yu, J. Jin, I. Roh, C. Chen, M.V. Fonseca Guzman, J. Feijóo, P.-C. Chen, H. Wang, C.J. Pollock, X. Huang, Y.-T. Shao, C. Wang, D.A. Muller, H.D. Abruña, P. Yang, Operando studies reveal active Cu nanograins for CO2 electroreduction, Nature 614 (2023) 262-269. 10.1038/s41586-022-05540-0 [69] G. Zhang J. Zhao T. Yang Q. Zhang L. Zhang In-situ self-assembled Cu2O/ZnO core-shell catalysts synergistically enhance the durability of methanol steam reforming Appl. Catal. A 616 2021 118072 10.1016/j.apcata.2021.118072 G. Zhang, J. Zhao, T. Yang, Q. Zhang, L. Zhang, In-situ self-assembled Cu2O/ZnO core-shell catalysts synergistically enhance the durability of methanol steam reforming, Appl. Catal. A 616 (2021) 118072. 10.1016/j.apcata.2021.118072 [70] H. Xi X. Hou Y. Liu S. Qing Z. Gao Cu-Al spinel oxide as an efficient catalyst for methanol steam reforming Angew. Chem. Int. Ed. 53 2014 11886 11889 10.1002/anie.201405213 H. Xi, X. Hou, Y. Liu, S. Qing, Z. Gao, Cu-Al spinel oxide as an efficient catalyst for methanol steam reforming, Angew. Chem. Int. Ed. 53 (2014) 11886-11889. 10.1002/anie.201405213 [71] Y. Liu S. Qing X. Hou F. Qin X. Wang Z. Gao H. Xiang Temperature dependence of Cu-Al spinel formation and its catalytic performance in methanol steam reforming Catal. Sci. Technol. 7 2017 5069 5078 10.1039/c7cy01236e Y. Liu, S. Qing, X. Hou, F. Qin, X. Wang, Z. Gao, H. Xiang, Temperature dependence of Cu-Al spinel formation and its catalytic performance in methanol steam reforming, Catal. Sci. Technol. 7 (2017) 5069-5078. 10.1039/c7cy01236e [72] S. Qing X. Hou Y. Liu L. Li X. Wang Z. Gao W. Fan Strategic use of CuAlO2 as a sustained release catalyst for production of hydrogen from methanol steam reforming Chem. Commun. 54 2018 12242 12245 10.1039/c8cc06600k S. Qing, X. Hou, Y. Liu, L. Li, X. Wang, Z. Gao, W. Fan, Strategic use of CuAlO2 as a sustained release catalyst for production of hydrogen from methanol steam reforming, Chem. Commun. 54 (2018) 12242-12245. 10.1039/c8cc06600k [73] A.M. Ranjekar G.D. Yadav Steam reforming of methanol for hydrogen production: a critical analysis of catalysis, processes, and scope Ind. Eng. Chem. Res. 60 2021 89 113 10.1021/acs.iecr.0c05041 A.M. Ranjekar, G.D. Yadav, Steam Reforming of Methanol for Hydrogen Production: A Critical Analysis of Catalysis, Processes, and Scope, Ind. Eng. Chem. Res. 60 (2021) 89-113. 10.1021/acs.iecr.0c05041 [74] H.Z. Li C. Ma X.Y. Zou A. Li Z. Huang L. Zhu On-board methanol catalytic reforming for hydrogen Production-A review Int. J. Hydrog. Energy 46 2021 22303 22327 10.1016/j.ijhydene.2021.04.062 H.Z. Li, C. Ma, X.Y. Zou, A. Li, Z. Huang, L. Zhu, On-board methanol catalytic reforming for hydrogen Production-A review, Int. J. Hydrog. Energy 46 (2021) 22303-22327. 10.1016/j.ijhydene.2021.04.062 [75] M.S. Herdem M.Y. Sinaki S. Farhad F. Hamdullahpur An overview of the methanol reforming process: comparison of fuels, catalysts, reformers, and systems Int. J. Energy Res. 43 2019 5076 5105 10.1002/er.4440 M.S. Herdem, M.Y. Sinaki, S. Farhad, F. Hamdullahpur, An overview of the methanol reforming process: Comparison of fuels, catalysts, reformers, and systems, Int. J. Energy Res. 43 (2019) 5076-5105. 10.1002/er.4440",
      "scopus-id": "85212845922",
      "coredata": {
        "eid": "1-s2.0-S0021951724006353",
        "dc:description": "Methanol steam reforming (MSR) is essential for in-situ hydrogen production, providing a clean fuel alternative for sustainable energy applications. Copper catalysts are widely applied in MSR, yet the nature of active sites and reaction pathway involved remain some debates. Herein, we reveal the crucial role of water activation and dynamic active sites on Cu/Al2O3 catalysts during the MSR reaction. Specifically, methanol was preferentially adsorbed on Al2O3 and underwent stepwise dehydrogenation to formaldehyde, while water was activated on metallic Cu, oxidizing Cu0 to form Cu+-OH species, accompanied by hydrogen migration to another Cu0 site. The Cu+-OH species further reacted with formaldehyde to generate highly reactive formate, whose dehydrogenation produced CO2. Concurrently, the Cu+ was reduced back to the Cu0 state, and H2 was continuously produced by dehydrogenation. Compared to the facile oxidation of Cu0 by water, the slow reduction of Cu+ induced by the dehydrogenation of formate predominated the overall reaction rate at low temperatures. These findings provide new insights into a dynamic Cu0/+-Cu0 site mechanism on copper catalysts in methanol steam reforming, beneficial for the design of efficient MSR catalysts.",
        "openArchiveArticle": "false",
        "prism:coverDate": "2025-02-28",
        "openaccessUserLicense": null,
        "prism:aggregationType": "Journal",
        "prism:url": "https://api.elsevier.com/content/article/pii/S0021951724006353",
        "dc:creator": [
          {
            "@_fa": "true",
            "$": "Liu, Diru"
          },
          {
            "@_fa": "true",
            "$": "Zhang, Mengyuan"
          },
          {
            "@_fa": "true",
            "$": "Zhao, Lin"
          },
          {
            "@_fa": "true",
            "$": "Guo, Xueli"
          },
          {
            "@_fa": "true",
            "$": "Xu, Guangyan"
          },
          {
            "@_fa": "true",
            "$": "He, Hong"
          }
        ],
        "link": [
          {
            "@_fa": "true",
            "@rel": "self",
            "@href": "https://api.elsevier.com/content/article/pii/S0021951724006353"
          },
          {
            "@_fa": "true",
            "@rel": "scidir",
            "@href": "https://www.sciencedirect.com/science/article/pii/S0021951724006353"
          }
        ],
        "dc:format": "application/json",
        "openaccessType": null,
        "pii": "S0021-9517(24)00635-3",
        "prism:volume": "442",
        "articleNumber": "115922",
        "prism:publisher": "Elsevier Inc. All rights are reserved, including those for text and data mining, AI training, and similar technologies.",
        "dc:title": "Mechanistic insights into methanol steam reforming on copper catalysts: Dynamics of active sites and reaction pathway",
        "prism:copyright": "© 2024 Elsevier Inc. All rights are reserved, including those for text and data mining, AI training, and similar technologies.",
        "openaccess": "0",
        "prism:issn": "00219517",
        "dcterms:subject": [
          {
            "@_fa": "true",
            "$": "Methanol steam reforming"
          },
          {
            "@_fa": "true",
            "$": "Copper catalysts"
          },
          {
            "@_fa": "true",
            "$": "Water activation"
          },
          {
            "@_fa": "true",
            "$": "Dynamic active sites"
          },
          {
            "@_fa": "true",
            "$": "Operando DRIFTS-MS"
          },
          {
            "@_fa": "true",
            "$": "In-situ UV–Vis"
          }
        ],
        "openaccessArticle": "false",
        "prism:publicationName": "Journal of Catalysis",
        "openaccessSponsorType": null,
        "prism:pageRange": "115922",
        "pubType": "fla",
        "prism:coverDisplayDate": "February 2025",
        "prism:doi": "10.1016/j.jcat.2024.115922",
        "prism:startingPage": "115922",
        "dc:identifier": "doi:10.1016/j.jcat.2024.115922",
        "openaccessSponsorName": null
      },
      "objects": {
        "object": [
          {
            "@category": "standard",
            "@height": "564",
            "@width": "667",
            "@_fa": "true",
            "$": "https://api.elsevier.com/content/object/eid/1-s2.0-S0021951724006353-gr5.jpg?httpAccept=%2A%2F%2A",
            "@multimediatype": "JPEG image file",
            "@type": "IMAGE-DOWNSAMPLED",
            "@size": "99456",
            "@ref": "gr5",
            "@mimetype": "image/jpeg"
          },
          {
            "@category": "standard",
            "@height": "544",
            "@width": "667",
            "@_fa": "true",
            "$": "https://api.elsevier.com/content/object/eid/1-s2.0-S0021951724006353-gr4.jpg?httpAccept=%2A%2F%2A",
            "@multimediatype": "JPEG image file",
            "@type": "IMAGE-DOWNSAMPLED",
            "@size": "97592",
            "@ref": "gr4",
            "@mimetype": "image/jpeg"
          },
          {
            "@category": "standard",
            "@height": "508",
            "@width": "667",
            "@_fa": "true",
            "$": "https://api.elsevier.com/content/object/eid/1-s2.0-S0021951724006353-gr6.jpg?httpAccept=%2A%2F%2A",
            "@multimediatype": "JPEG image file",
            "@type": "IMAGE-DOWNSAMPLED",
            "@size": "60224",
            "@ref": "gr6",
            "@mimetype": "image/jpeg"
          },
          {
            "@category": "standard",
            "@height": "271",
            "@width": "667",
            "@_fa": "true",
            "$": "https://api.elsevier.com/content/object/eid/1-s2.0-S0021951724006353-gr1.jpg?httpAccept=%2A%2F%2A",
            "@multimediatype": "JPEG image file",
            "@type": "IMAGE-DOWNSAMPLED",
            "@size": "41243",
            "@ref": "gr1",
            "@mimetype": "image/jpeg"
          },
          {
            "@category": "standard",
            "@height": "557",
            "@width": "667",
            "@_fa": "true",
            "$": "https://api.elsevier.com/content/object/eid/1-s2.0-S0021951724006353-gr3.jpg?httpAccept=%2A%2F%2A",
            "@multimediatype": "JPEG image file",
            "@type": "IMAGE-DOWNSAMPLED",
            "@size": "92617",
            "@ref": "gr3",
            "@mimetype": "image/jpeg"
          },
          {
            "@category": "standard",
            "@height": "415",
            "@width": "660",
            "@_fa": "true",
            "$": "https://api.elsevier.com/content/object/eid/1-s2.0-S0021951724006353-gr2.jpg?httpAccept=%2A%2F%2A",
            "@multimediatype": "JPEG image file",
            "@type": "IMAGE-DOWNSAMPLED",
            "@size": "74399",
            "@ref": "gr2",
            "@mimetype": "image/jpeg"
          },
          {
            "@category": "standard",
            "@height": "200",
            "@width": "373",
            "@_fa": "true",
            "$": "https://api.elsevier.com/content/object/eid/1-s2.0-S0021951724006353-ga1.jpg?httpAccept=%2A%2F%2A",
            "@multimediatype": "JPEG image file",
            "@type": "IMAGE-DOWNSAMPLED",
            "@size": "27463",
            "@ref": "ga1",
            "@mimetype": "image/jpeg"
          },
          {
            "@category": "thumbnail",
            "@height": "164",
            "@width": "194",
            "@_fa": "true",
            "$": "https://api.elsevier.com/content/object/eid/1-s2.0-S0021951724006353-gr5.sml?httpAccept=%2A%2F%2A",
            "@multimediatype": "GIF image file",
            "@type": "IMAGE-THUMBNAIL",
            "@size": "11452",
            "@ref": "gr5",
            "@mimetype": "image/gif"
          },
          {
            "@category": "thumbnail",
            "@height": "164",
            "@width": "201",
            "@_fa": "true",
            "$": "https://api.elsevier.com/content/object/eid/1-s2.0-S0021951724006353-gr4.sml?httpAccept=%2A%2F%2A",
            "@multimediatype": "GIF image file",
            "@type": "IMAGE-THUMBNAIL",
            "@size": "12356",
            "@ref": "gr4",
            "@mimetype": "image/gif"
          },
          {
            "@category": "thumbnail",
            "@height": "164",
            "@width": "215",
            "@_fa": "true",
            "$": "https://api.elsevier.com/content/object/eid/1-s2.0-S0021951724006353-gr6.sml?httpAccept=%2A%2F%2A",
            "@multimediatype": "GIF image file",
            "@type": "IMAGE-THUMBNAIL",
            "@size": "9001",
            "@ref": "gr6",
            "@mimetype": "image/gif"
          },
          {
            "@category": "thumbnail",
            "@height": "89",
            "@width": "219",
            "@_fa": "true",
            "$": "https://api.elsevier.com/content/object/eid/1-s2.0-S0021951724006353-gr1.sml?httpAccept=%2A%2F%2A",
            "@multimediatype": "GIF image file",
            "@type": "IMAGE-THUMBNAIL",
            "@size": "6946",
            "@ref": "gr1",
            "@mimetype": "image/gif"
          },
          {
            "@category": "thumbnail",
            "@height": "164",
            "@width": "196",
            "@_fa": "true",
            "$": "https://api.elsevier.com/content/object/eid/1-s2.0-S0021951724006353-gr3.sml?httpAccept=%2A%2F%2A",
            "@multimediatype": "GIF image file",
            "@type": "IMAGE-THUMBNAIL",
            "@size": "11887",
            "@ref": "gr3",
            "@mimetype": "image/gif"
          },
          {
            "@category": "thumbnail",
            "@height": "138",
            "@width": "219",
            "@_fa": "true",
            "$": "https://api.elsevier.com/content/object/eid/1-s2.0-S0021951724006353-gr2.sml?httpAccept=%2A%2F%2A",
            "@multimediatype": "GIF image file",
            "@type": "IMAGE-THUMBNAIL",
            "@size": "13929",
            "@ref": "gr2",
            "@mimetype": "image/gif"
          },
          {
            "@category": "thumbnail",
            "@height": "117",
            "@width": "219",
            "@_fa": "true",
            "$": "https://api.elsevier.com/content/object/eid/1-s2.0-S0021951724006353-ga1.sml?httpAccept=%2A%2F%2A",
            "@multimediatype": "GIF image file",
            "@type": "IMAGE-THUMBNAIL",
            "@size": "15345",
            "@ref": "ga1",
            "@mimetype": "image/gif"
          },
          {
            "@category": "high",
            "@height": "1499",
            "@width": "1772",
            "@_fa": "true",
            "$": "https://api.elsevier.com/content/object/eid/1-s2.0-S0021951724006353-gr5_lrg.jpg?httpAccept=%2A%2F%2A",
            "@multimediatype": "JPEG image file",
            "@type": "IMAGE-HIGH-RES",
            "@size": "388516",
            "@ref": "gr5",
            "@mimetype": "image/jpeg"
          },
          {
            "@category": "high",
            "@height": "1446",
            "@width": "1772",
            "@_fa": "true",
            "$": "https://api.elsevier.com/content/object/eid/1-s2.0-S0021951724006353-gr4_lrg.jpg?httpAccept=%2A%2F%2A",
            "@multimediatype": "JPEG image file",
            "@type": "IMAGE-HIGH-RES",
            "@size": "380118",
            "@ref": "gr4",
            "@mimetype": "image/jpeg"
          },
          {
            "@category": "high",
            "@height": "1349",
            "@width": "1772",
            "@_fa": "true",
            "$": "https://api.elsevier.com/content/object/eid/1-s2.0-S0021951724006353-gr6_lrg.jpg?httpAccept=%2A%2F%2A",
            "@multimediatype": "JPEG image file",
            "@type": "IMAGE-HIGH-RES",
            "@size": "215372",
            "@ref": "gr6",
            "@mimetype": "image/jpeg"
          },
          {
            "@category": "high",
            "@height": "719",
            "@width": "1772",
            "@_fa": "true",
            "$": "https://api.elsevier.com/content/object/eid/1-s2.0-S0021951724006353-gr1_lrg.jpg?httpAccept=%2A%2F%2A",
            "@multimediatype": "JPEG image file",
            "@type": "IMAGE-HIGH-RES",
            "@size": "147332",
            "@ref": "gr1",
            "@mimetype": "image/jpeg"
          },
          {
            "@category": "high",
            "@height": "1480",
            "@width": "1772",
            "@_fa": "true",
            "$": "https://api.elsevier.com/content/object/eid/1-s2.0-S0021951724006353-gr3_lrg.jpg?httpAccept=%2A%2F%2A",
            "@multimediatype": "JPEG image file",
            "@type": "IMAGE-HIGH-RES",
            "@size": "351720",
            "@ref": "gr3",
            "@mimetype": "image/jpeg"
          },
          {
            "@category": "high",
            "@height": "1102",
            "@width": "1753",
            "@_fa": "true",
            "$": "https://api.elsevier.com/content/object/eid/1-s2.0-S0021951724006353-gr2_lrg.jpg?httpAccept=%2A%2F%2A",
            "@multimediatype": "JPEG image file",
            "@type": "IMAGE-HIGH-RES",
            "@size": "320456",
            "@ref": "gr2",
            "@mimetype": "image/jpeg"
          },
          {
            "@category": "high",
            "@height": "886",
            "@width": "1653",
            "@_fa": "true",
            "$": "https://api.elsevier.com/content/object/eid/1-s2.0-S0021951724006353-ga1_lrg.jpg?httpAccept=%2A%2F%2A",
            "@multimediatype": "JPEG image file",
            "@type": "IMAGE-HIGH-RES",
            "@size": "172926",
            "@ref": "ga1",
            "@mimetype": "image/jpeg"
          },
          {
            "@category": "standard",
            "@_fa": "true",
            "$": "https://api.elsevier.com/content/object/eid/1-s2.0-S0021951724006353-mmc1.docx?httpAccept=%2A%2F%2A",
            "@multimediatype": "Microsoft Word file",
            "@type": "APPLICATION",
            "@size": "4005422",
            "@ref": "mmc1",
            "@mimetype": "application/word"
          },
          {
            "@category": "thumbnail",
            "@_fa": "true",
            "$": "https://api.elsevier.com/content/object/eid/1-s2.0-S0021951724006353-si1.svg?httpAccept=%2A%2F%2A",
            "@multimediatype": "Scalable Vector Graphics file",
            "@type": "ALTIMG",
            "@size": "12684",
            "@ref": "si1",
            "@mimetype": "image/svg+xml"
          },
          {
            "@category": "thumbnail",
            "@_fa": "true",
            "$": "https://api.elsevier.com/content/object/eid/1-s2.0-S0021951724006353-si10.svg?httpAccept=%2A%2F%2A",
            "@multimediatype": "Scalable Vector Graphics file",
            "@type": "ALTIMG",
            "@size": "16139",
            "@ref": "si10",
            "@mimetype": "image/svg+xml"
          },
          {
            "@category": "thumbnail",
            "@_fa": "true",
            "$": "https://api.elsevier.com/content/object/eid/1-s2.0-S0021951724006353-si11.svg?httpAccept=%2A%2F%2A",
            "@multimediatype": "Scalable Vector Graphics file",
            "@type": "ALTIMG",
            "@size": "8561",
            "@ref": "si11",
            "@mimetype": "image/svg+xml"
          },
          {
            "@category": "thumbnail",
            "@_fa": "true",
            "$": "https://api.elsevier.com/content/object/eid/1-s2.0-S0021951724006353-si12.svg?httpAccept=%2A%2F%2A",
            "@multimediatype": "Scalable Vector Graphics file",
            "@type": "ALTIMG",
            "@size": "6693",
            "@ref": "si12",
            "@mimetype": "image/svg+xml"
          },
          {
            "@category": "thumbnail",
            "@_fa": "true",
            "$": "https://api.elsevier.com/content/object/eid/1-s2.0-S0021951724006353-si13.svg?httpAccept=%2A%2F%2A",
            "@multimediatype": "Scalable Vector Graphics file",
            "@type": "ALTIMG",
            "@size": "7623",
            "@ref": "si13",
            "@mimetype": "image/svg+xml"
          },
          {
            "@category": "thumbnail",
            "@_fa": "true",
            "$": "https://api.elsevier.com/content/object/eid/1-s2.0-S0021951724006353-si14.svg?httpAccept=%2A%2F%2A",
            "@multimediatype": "Scalable Vector Graphics file",
            "@type": "ALTIMG",
            "@size": "7286",
            "@ref": "si14",
            "@mimetype": "image/svg+xml"
          },
          {
            "@category": "thumbnail",
            "@_fa": "true",
            "$": "https://api.elsevier.com/content/object/eid/1-s2.0-S0021951724006353-si15.svg?httpAccept=%2A%2F%2A",
            "@multimediatype": "Scalable Vector Graphics file",
            "@type": "ALTIMG",
            "@size": "3401",
            "@ref": "si15",
            "@mimetype": "image/svg+xml"
          },
          {
            "@category": "thumbnail",
            "@_fa": "true",
            "$": "https://api.elsevier.com/content/object/eid/1-s2.0-S0021951724006353-si2.svg?httpAccept=%2A%2F%2A",
            "@multimediatype": "Scalable Vector Graphics file",
            "@type": "ALTIMG",
            "@size": "12621",
            "@ref": "si2",
            "@mimetype": "image/svg+xml"
          },
          {
            "@category": "thumbnail",
            "@_fa": "true",
            "$": "https://api.elsevier.com/content/object/eid/1-s2.0-S0021951724006353-si3.svg?httpAccept=%2A%2F%2A",
            "@multimediatype": "Scalable Vector Graphics file",
            "@type": "ALTIMG",
            "@size": "15120",
            "@ref": "si3",
            "@mimetype": "image/svg+xml"
          },
          {
            "@category": "thumbnail",
            "@_fa": "true",
            "$": "https://api.elsevier.com/content/object/eid/1-s2.0-S0021951724006353-si4.svg?httpAccept=%2A%2F%2A",
            "@multimediatype": "Scalable Vector Graphics file",
            "@type": "ALTIMG",
            "@size": "3554",
            "@ref": "si4",
            "@mimetype": "image/svg+xml"
          },
          {
            "@category": "thumbnail",
            "@_fa": "true",
            "$": "https://api.elsevier.com/content/object/eid/1-s2.0-S0021951724006353-si5.svg?httpAccept=%2A%2F%2A",
            "@multimediatype": "Scalable Vector Graphics file",
            "@type": "ALTIMG",
            "@size": "4445",
            "@ref": "si5",
            "@mimetype": "image/svg+xml"
          },
          {
            "@category": "thumbnail",
            "@_fa": "true",
            "$": "https://api.elsevier.com/content/object/eid/1-s2.0-S0021951724006353-si6.svg?httpAccept=%2A%2F%2A",
            "@multimediatype": "Scalable Vector Graphics file",
            "@type": "ALTIMG",
            "@size": "35415",
            "@ref": "si6",
            "@mimetype": "image/svg+xml"
          },
          {
            "@category": "thumbnail",
            "@_fa": "true",
            "$": "https://api.elsevier.com/content/object/eid/1-s2.0-S0021951724006353-si7.svg?httpAccept=%2A%2F%2A",
            "@multimediatype": "Scalable Vector Graphics file",
            "@type": "ALTIMG",
            "@size": "27693",
            "@ref": "si7",
            "@mimetype": "image/svg+xml"
          },
          {
            "@category": "thumbnail",
            "@_fa": "true",
            "$": "https://api.elsevier.com/content/object/eid/1-s2.0-S0021951724006353-si8.svg?httpAccept=%2A%2F%2A",
            "@multimediatype": "Scalable Vector Graphics file",
            "@type": "ALTIMG",
            "@size": "29351",
            "@ref": "si8",
            "@mimetype": "image/svg+xml"
          },
          {
            "@category": "thumbnail",
            "@_fa": "true",
            "$": "https://api.elsevier.com/content/object/eid/1-s2.0-S0021951724006353-si9.svg?httpAccept=%2A%2F%2A",
            "@multimediatype": "Scalable Vector Graphics file",
            "@type": "ALTIMG",
            "@size": "27342",
            "@ref": "si9",
            "@mimetype": "image/svg+xml"
          }
        ]
      },
      "link": {
        "@rel": "abstract",
        "@href": "https://api.elsevier.com/content/abstract/scopus_id/85212845922"
      }
    }
  }
}