{
  "metadata": {
    "title": "Understanding the synergetic catalytic functions of Cu–Pt active sites in the bimetallic CuPt/ZrO<ce:inf loc=post>2</ce:inf> catalyst in CO oxidation",
    "authors": "; ; ",
    "journal": "Journal of Catalysis",
    "date": "2025-04-30",
    "doi": "10.1016/j.jcat.2025.115995",
    "abstract": "",
    "uri": "https://api.elsevier.com/content/article/pii/S0021951725000600",
    "pii": "S0021951725000600"
  },
  "fulltext": {
    "full-text-retrieval-response": {
      "scopus-eid": "2-s2.0-85217823117",
      "originalText": "serial JL 272561 291210 291744 291809 31 Journal of Catalysis JOURNALCATALYSIS 2025-02-07 2025-02-07 2025-02-16 2025-02-16 2025-02-23T12:42:55 1-s2.0-S0021951725000600 S0021-9517(25)00060-0 S0021951725000600 10.1016/j.jcat.2025.115995 S300 S300.1 FULL-TEXT 1-s2.0-S0021951725X00026 2025-02-25T20:42:43.081129Z 0 0 20250401 20250430 2025 2025-02-08T00:07:34.514828Z absattachment articleinfo articlenumber articletitlenorm authfirstinitialnorm authfirstsurnamenorm cid cids contenttype copyright crossmark dateloaded dateloadedtxt datesearch datesort dateupdated dco docsubtype doctype doi eid ewtransactionid hubeid indexeddate issn issnnorm itemstage itemtransactionid itemweight openaccess openarchive pg pgfirst pii piinorm pubdateend pubdatestart pubdatetxt pubyr sectiontitle sortorder srctitle srctitlenorm srctype ssids alllist content subj subheadings suppl tomb volfirst volissue volumelist webpdf webpdfpagecount yearnav figure table body mmlmath acknowledge affil articletitle auth authfirstini authfull authkeywords authlast footnotes grantnumber grantsponsor grantsponsorid highlightsabst orcid primabst pubtype ref specialabst 0021-9517 00219517 true 444 444 C Volume 444 6 115995 115995 115995 202504 April 2025 2025-04-01 2025-04-30 2025 Regular Articles article fla © 2025 Elsevier Inc. All rights are reserved, including those for text and data mining, AI training, and similar technologies. UNDERSTANDINGSYNERGETICCATALYTICFUNCTIONSCUPTACTIVESITESINBIMETALLICCUPTZRO2CATALYSTINCOOXIDATION XU L 1 Introduction 2 Experimental 2.1 Chemicals and materials 2.2 Preparation of the catalysts 2.3 Characterization 2.4 Catalytic measurement 2.5 Computational methods and models 3 Results and discussion 3.1 Characterization of the catalyst 3.1.1 TEM observation 3.1.2 H2–TPR, CO–TPD, O2–TPD, and XRD analysis 3.1.3 XPS analysis 3.2 Catalytic performance of the catalysts 3.3 In situ DRIFTS analysis 3.4 DFT calculation 3.5 Proposed catalytic mechanism 4 Conclusion CRediT authorship contribution statement Acknowledgements References ELIAS 2017 6843 6857 J ZHANG 2017 5179 5186 X WANG 2016 13425 13430 K PORTILLOVELEZ 2020 123848 N KUGAI 2012 306 314 J ZHENG 2024 Y SANDOVAL 2011 40 49 A LIU 2011 103 108 X ZHAO 2016 4127 4134 Y ZHAO 2021 130448 S KIM 2020 10459 10467 T POZDNYAKOVA 2006 1 16 O CHEN 2023 3477 J WANG 2022 138171 M JIA 2022 9602 9610 Z CHEN 2022 e202200190 W LIU 2023 101 112 W GOMEZ 2014 3719 3729 L FOUCHER 2023 5410 5421 A SONG 2019 6177 6187 S LI 2023 9159 9168 Y ZHANG 2022 333 345 Z ZHAO 2022 132219 S CHEN 2023 156539 W ZHANG 2022 166994 X LIU 2022 604 614 Y GONCALVES 2015 7987 7994 R FANG 2020 7091 7101 Y BABER 2013 16781 16784 A EREN 2015 11186 11190 B JIANG 2023 Y KIM 2023 122704 T LUO 2016 8760 8769 L KRESSE 1996 11169 11186 G KRESSE 1996 15 50 G PERDEW 1996 3865 3868 J ZHANG 2022 18703 18711 T WANG 2022 Q DING 2021 119471 S ZHANG 2019 X TANG 2019 9953 9963 Z YU 2021 129656 J WEI 2012 105 114 X KONG 2023 123118 J REN 2016 150 160 Z YU 2021 14453 14464 Y TUO 2021 26326 26335 Y POLISSKI 2010 59 66 S TEEPARTHI 2018 S LI 2024 151714 Y PENG 2022 154056 S IVANIN 2024 159577 I GAO 2016 82 90 J SANDOVAL 2013 363 377 A ZHANG 2025 128109 Z KANG 2018 46 58 R WANG 2014 12860 12867 J WANG 2017 887 891 C MOSESDEBUSK 2013 12634 12645 M LIU 2020 4240 X YANG 2019 9751 9763 J SUN 2018 4454 G LIU 2016 6396 6399 J ZOU 2010 468 477 Z ARAIZA 2024 152921 D LI 2024 5598 Y WANG 2017 1313 1329 W YIN 2017 4923 4931 C FUNG 2017 10796 10802 V JIA 2021 5115 5122 Y ZHANG 2013 2943 2947 L FANG 2022 Y LU 2018 149 156 Y ZANG 2022 137414 P PAN 2021 11151 11161 Y XUX2025X115995 XUX2025X115995XL 2027-02-16T00:00:00.000Z 2027-02-16T00:00:00.000Z http://creativecommons.org/licenses/by-nc-nd/4.0/ © 2025 Elsevier Inc. All rights are reserved, including those for text and data mining, AI training, and similar technologies. https://doi.org/10.15223/policy-017 https://doi.org/10.15223/policy-037 https://doi.org/10.15223/policy-012 https://doi.org/10.15223/policy-029 https://doi.org/10.15223/policy-004 2025-02-25T20:05:20.216Z http://vtw.elsevier.com/data/voc/AddOnTypes/50.7/aggregated-refined National Key R&amp;D Program of China 2023YFC3707001 NKRDPC National Key Research and Development Program of China http://data.elsevier.com/vocabulary/SciValFunders/501100012166 http://sws.geonames.org/1814991/ Open Research Fund of State Key Laboratory of Mesoscience and Engineering MESO-23-D13 This research was funded by the National Key R&amp;D Program of China (No.2023YFC3707001) and Open Research Fund of State Key Laboratory of Mesoscience and Engineering (MESO-23-D13). item S0021-9517(25)00060-0 S0021951725000600 1-s2.0-S0021951725000600 10.1016/j.jcat.2025.115995 272561 2025-02-23T12:45:24.909507Z 2025-04-01 2025-04-30 1-s2.0-S0021951725000600-main.pdf https://s3-eu-west-1.amazonaws.com/prod-ucs-content-store-eu-west/content/pii:S0021951725000600/MAIN/application/pdf/5e34a5d3d64a22c0af7be399222160d0/main.pdf main.pdf pdf true 11744719 MAIN 13 1-s2.0-S0021951725000600-main_1.png https://s3-eu-west-1.amazonaws.com/prod-ucs-content-store-eu-west/content/pii:S0021951725000600/PREVIEW/image/png/68b3b64d88352e3192b45817b1fc2390/main_1.png main_1.png png 57838 849 656 IMAGE-WEB-PDF 1 1-s2.0-S0021951725000600-gr8.jpg https://s3-eu-west-1.amazonaws.com/prod-ucs-content-store-eu-west/content/pii:S0021951725000600/gr8/DOWNSAMPLED/image/jpeg/08e3f567b5b9514f90c05382dfa75b09/gr8.jpg gr8 gr8.jpg jpg 41587 359 671 IMAGE-DOWNSAMPLED 1-s2.0-S0021951725000600-gr9.jpg https://s3-eu-west-1.amazonaws.com/prod-ucs-content-store-eu-west/content/pii:S0021951725000600/gr9/DOWNSAMPLED/image/jpeg/8737c1ed91093cdc25acb04e8710612e/gr9.jpg gr9 gr9.jpg jpg 37121 322 535 IMAGE-DOWNSAMPLED 1-s2.0-S0021951725000600-gr10.jpg https://s3-eu-west-1.amazonaws.com/prod-ucs-content-store-eu-west/content/pii:S0021951725000600/gr10/DOWNSAMPLED/image/jpeg/f3354c9be86525e7ace28943412d2b50/gr10.jpg gr10 gr10.jpg jpg 37032 344 535 IMAGE-DOWNSAMPLED 1-s2.0-S0021951725000600-gr1.jpg https://s3-eu-west-1.amazonaws.com/prod-ucs-content-store-eu-west/content/pii:S0021951725000600/gr1/DOWNSAMPLED/image/jpeg/909669c4db885f5d511bd47699cd3e7c/gr1.jpg gr1 gr1.jpg jpg 136495 594 534 IMAGE-DOWNSAMPLED 1-s2.0-S0021951725000600-gr2.jpg https://s3-eu-west-1.amazonaws.com/prod-ucs-content-store-eu-west/content/pii:S0021951725000600/gr2/DOWNSAMPLED/image/jpeg/bf76e5a5fffb000ff46cc8bda2c27fec/gr2.jpg gr2 gr2.jpg jpg 89947 537 534 IMAGE-DOWNSAMPLED 1-s2.0-S0021951725000600-ga1.jpg https://s3-eu-west-1.amazonaws.com/prod-ucs-content-store-eu-west/content/pii:S0021951725000600/ga1/DOWNSAMPLED/image/jpeg/180def6d3918f26854edf22af228b153/ga1.jpg ga1 true ga1.jpg jpg 18578 200 317 IMAGE-DOWNSAMPLED 1-s2.0-S0021951725000600-gr3.jpg https://s3-eu-west-1.amazonaws.com/prod-ucs-content-store-eu-west/content/pii:S0021951725000600/gr3/DOWNSAMPLED/image/jpeg/2ea43671335e3bfb670c98b8ff279927/gr3.jpg gr3 gr3.jpg jpg 72356 484 535 IMAGE-DOWNSAMPLED 1-s2.0-S0021951725000600-gr4.jpg https://s3-eu-west-1.amazonaws.com/prod-ucs-content-store-eu-west/content/pii:S0021951725000600/gr4/DOWNSAMPLED/image/jpeg/8fcd66f18c8a6827be721cad827f80d2/gr4.jpg gr4 gr4.jpg jpg 118895 657 713 IMAGE-DOWNSAMPLED 1-s2.0-S0021951725000600-gr5.jpg https://s3-eu-west-1.amazonaws.com/prod-ucs-content-store-eu-west/content/pii:S0021951725000600/gr5/DOWNSAMPLED/image/jpeg/a00c4bc7c6cd80e01d438f4943afe893/gr5.jpg gr5 gr5.jpg jpg 135189 865 705 IMAGE-DOWNSAMPLED 1-s2.0-S0021951725000600-gr6.jpg https://s3-eu-west-1.amazonaws.com/prod-ucs-content-store-eu-west/content/pii:S0021951725000600/gr6/DOWNSAMPLED/image/jpeg/019c49ee2ebe0ba80d0e4690a41c2cc3/gr6.jpg gr6 gr6.jpg jpg 114457 433 713 IMAGE-DOWNSAMPLED 1-s2.0-S0021951725000600-gr7.jpg https://s3-eu-west-1.amazonaws.com/prod-ucs-content-store-eu-west/content/pii:S0021951725000600/gr7/DOWNSAMPLED/image/jpeg/9397100ed75134086e3112383b787f51/gr7.jpg gr7 gr7.jpg jpg 112507 458 785 IMAGE-DOWNSAMPLED 1-s2.0-S0021951725000600-gr8.sml https://s3-eu-west-1.amazonaws.com/prod-ucs-content-store-eu-west/content/pii:S0021951725000600/gr8/THUMBNAIL/image/gif/d2aaa7ec8b2f1717b7e541cc5e50f28c/gr8.sml gr8 gr8.sml sml 7029 117 219 IMAGE-THUMBNAIL 1-s2.0-S0021951725000600-gr9.sml https://s3-eu-west-1.amazonaws.com/prod-ucs-content-store-eu-west/content/pii:S0021951725000600/gr9/THUMBNAIL/image/gif/abe72f5c0ab72fdfaedb2fcd7a3426af/gr9.sml gr9 gr9.sml sml 7510 132 219 IMAGE-THUMBNAIL 1-s2.0-S0021951725000600-gr10.sml https://s3-eu-west-1.amazonaws.com/prod-ucs-content-store-eu-west/content/pii:S0021951725000600/gr10/THUMBNAIL/image/gif/8cbea2f0aec5a947a0f2a42deb8a9936/gr10.sml gr10 gr10.sml sml 17456 141 219 IMAGE-THUMBNAIL 1-s2.0-S0021951725000600-gr1.sml https://s3-eu-west-1.amazonaws.com/prod-ucs-content-store-eu-west/content/pii:S0021951725000600/gr1/THUMBNAIL/image/gif/7b98784604c27a8902c60a8603e79750/gr1.sml gr1 gr1.sml sml 18713 164 147 IMAGE-THUMBNAIL 1-s2.0-S0021951725000600-gr2.sml https://s3-eu-west-1.amazonaws.com/prod-ucs-content-store-eu-west/content/pii:S0021951725000600/gr2/THUMBNAIL/image/gif/70247bd76c6b8c0ce696db0cd744b246/gr2.sml gr2 gr2.sml sml 14388 164 163 IMAGE-THUMBNAIL 1-s2.0-S0021951725000600-ga1.sml https://s3-eu-west-1.amazonaws.com/prod-ucs-content-store-eu-west/content/pii:S0021951725000600/ga1/THUMBNAIL/image/gif/82e319ad773dacab240347fe607747a4/ga1.sml ga1 true ga1.sml sml 18750 138 219 IMAGE-THUMBNAIL 1-s2.0-S0021951725000600-gr3.sml https://s3-eu-west-1.amazonaws.com/prod-ucs-content-store-eu-west/content/pii:S0021951725000600/gr3/THUMBNAIL/image/gif/019471dddb82c1d5c8d02eb2188ba831/gr3.sml gr3 gr3.sml sml 10715 164 181 IMAGE-THUMBNAIL 1-s2.0-S0021951725000600-gr4.sml https://s3-eu-west-1.amazonaws.com/prod-ucs-content-store-eu-west/content/pii:S0021951725000600/gr4/THUMBNAIL/image/gif/7807c896a0ee5f0aeb9b5ff8a163d257/gr4.sml gr4 gr4.sml sml 12529 164 178 IMAGE-THUMBNAIL 1-s2.0-S0021951725000600-gr5.sml https://s3-eu-west-1.amazonaws.com/prod-ucs-content-store-eu-west/content/pii:S002195172500065X/gr5/THUMBNAIL/image/gif/b4668433ed3b44106c2d7aa6cb6eca09/gr5.sml gr5 gr5.sml sml 9035 163 133 IMAGE-THUMBNAIL 1-s2.0-S0021951725000600-gr6.sml https://s3-eu-west-1.amazonaws.com/prod-ucs-content-store-eu-west/content/pii:S0021951725000600/gr6/THUMBNAIL/image/gif/d3bccbfd3b7a2bff5e9c82c767244f6e/gr6.sml gr6 gr6.sml sml 14704 133 219 IMAGE-THUMBNAIL 1-s2.0-S0021951725000600-gr7.sml https://s3-eu-west-1.amazonaws.com/prod-ucs-content-store-eu-west/content/pii:S002195172500065X/gr7/THUMBNAIL/image/gif/fbeaeb206026a3801c36bbac9a4d7402/gr7.sml gr7 gr7.sml sml 15122 128 219 IMAGE-THUMBNAIL 1-s2.0-S0021951725000600-gr8_lrg.jpg https://s3-eu-west-1.amazonaws.com/prod-ucs-content-store-eu-west/content/pii:S0021951725000600/HIGHRES/image/jpeg/99581effa2c85e7d5fdc5c6a4ad61c7b/gr8_lrg.jpg gr8 gr8_lrg.jpg jpg 211475 1591 2973 IMAGE-HIGH-RES 1-s2.0-S0021951725000600-gr9_lrg.jpg https://s3-eu-west-1.amazonaws.com/prod-ucs-content-store-eu-west/content/pii:S0021951725000600/HIGHRES/image/jpeg/b803e18b0136c520e8ff78cf29a5bcd5/gr9_lrg.jpg gr9 gr9_lrg.jpg jpg 211563 1426 2368 IMAGE-HIGH-RES 1-s2.0-S0021951725000600-gr10_lrg.jpg https://s3-eu-west-1.amazonaws.com/prod-ucs-content-store-eu-west/content/pii:S0021951725000600/HIGHRES/image/jpeg/a31f29c116091714ffbe3ab393adfc31/gr10_lrg.jpg gr10 gr10_lrg.jpg jpg 103643 998 1554 IMAGE-HIGH-RES 1-s2.0-S0021951725000600-gr1_lrg.jpg https://s3-eu-west-1.amazonaws.com/prod-ucs-content-store-eu-west/content/pii:S0021951725000600/HIGHRES/image/jpeg/60f104f9c1b5418109180a458d362927/gr1_lrg.jpg gr1 gr1_lrg.jpg jpg 763697 2202 1978 IMAGE-HIGH-RES 1-s2.0-S0021951725000600-gr2_lrg.jpg https://s3-eu-west-1.amazonaws.com/prod-ucs-content-store-eu-west/content/pii:S0021951725000600/HIGHRES/image/jpeg/b2bc3d8fe1cea4d2c265158a321cba98/gr2_lrg.jpg gr2 gr2_lrg.jpg jpg 505125 1913 1903 IMAGE-HIGH-RES 1-s2.0-S0021951725000600-ga1_lrg.jpg https://s3-eu-west-1.amazonaws.com/prod-ucs-content-store-eu-west/content/pii:S0021951725000600/HIGHRES/image/jpeg/b840372ed6ce111e04d03fa9bb50872a/ga1_lrg.jpg ga1 true ga1_lrg.jpg jpg 107462 886 1403 IMAGE-HIGH-RES 1-s2.0-S0021951725000600-gr3_lrg.jpg https://s3-eu-west-1.amazonaws.com/prod-ucs-content-store-eu-west/content/pii:S0021951725000600/HIGHRES/image/jpeg/cd4c6190d89a2b4ec80ccab42cec291e/gr3_lrg.jpg gr3 gr3_lrg.jpg jpg 389962 2144 2368 IMAGE-HIGH-RES 1-s2.0-S0021951725000600-gr4_lrg.jpg https://s3-eu-west-1.amazonaws.com/prod-ucs-content-store-eu-west/content/pii:S0021951725000600/HIGHRES/image/jpeg/4df7f2b97c009d618c022581186f0399/gr4_lrg.jpg gr4 gr4_lrg.jpg jpg 667727 2907 3156 IMAGE-HIGH-RES 1-s2.0-S0021951725000600-gr5_lrg.jpg https://s3-eu-west-1.amazonaws.com/prod-ucs-content-store-eu-west/content/pii:S002195172500065X/HIGHRES/image/jpeg/729e7842e85b2ee114239ea3b7531ffe/gr5_lrg.jpg gr5 gr5_lrg.jpg jpg 707474 3826 3120 IMAGE-HIGH-RES 1-s2.0-S0021951725000600-gr6_lrg.jpg https://s3-eu-west-1.amazonaws.com/prod-ucs-content-store-eu-west/content/pii:S002195172500065X/HIGHRES/image/jpeg/f083eaf77939aadb56f79c5f4dedabec/gr6_lrg.jpg gr6 gr6_lrg.jpg jpg 607326 1915 3156 IMAGE-HIGH-RES 1-s2.0-S0021951725000600-gr7_lrg.jpg https://s3-eu-west-1.amazonaws.com/prod-ucs-content-store-eu-west/content/pii:S002195172500065X/HIGHRES/image/jpeg/9dd1f4c17762a36c0086d0cb7a748684/gr7_lrg.jpg gr7 gr7_lrg.jpg jpg 567518 2028 3476 IMAGE-HIGH-RES 1-s2.0-S0021951725000600-si1.svg https://s3-eu-west-1.amazonaws.com/prod-ucs-content-store-eu-west/content/pii:S0021951725000600/image/svg+xml/7c17c768fe595246acdea6261e702cad/si1.svg si1 si1.svg svg 16993 ALTIMG 1-s2.0-S0021951725000600-si2.svg https://s3-eu-west-1.amazonaws.com/prod-ucs-content-store-eu-west/content/pii:S0021951725000600/image/svg+xml/876b8121075f46059f8ef42335ba0e7e/si2.svg si2 si2.svg svg 5377 ALTIMG 1-s2.0-S0021951725000600-si3.svg https://s3-eu-west-1.amazonaws.com/prod-ucs-content-store-eu-west/content/pii:S0021951725000600/image/svg+xml/77cfafae77c58d5c80681f6e5cdd4a7a/si3.svg si3 si3.svg svg 6059 ALTIMG 1-s2.0-S0021951725000600-si4.svg https://s3-eu-west-1.amazonaws.com/prod-ucs-content-store-eu-west/content/pii:S0021951725000600/image/svg+xml/a66b3c605806171942d3af096d7146bd/si4.svg si4 si4.svg svg 21935 ALTIMG 1-s2.0-S0021951725000600-si5.svg https://s3-eu-west-1.amazonaws.com/prod-ucs-content-store-eu-west/content/pii:S0021951725000600/image/svg+xml/1e330715cfebf99c2347a118cba361fc/si5.svg si5 si5.svg svg 24705 ALTIMG 1-s2.0-S0021951725000600-si6.svg https://s3-eu-west-1.amazonaws.com/prod-ucs-content-store-eu-west/content/pii:S0021951725000600/image/svg+xml/6bc96b9bd489b48e51830adab6371e11/si6.svg si6 si6.svg svg 3027 ALTIMG 1-s2.0-S0021951725000600-si7.svg https://s3-eu-west-1.amazonaws.com/prod-ucs-content-store-eu-west/content/pii:S0021951725000600/image/svg+xml/198bcfbc4b1f0fad2276395b6b596e01/si7.svg si7 si7.svg svg 1561 ALTIMG YJCAT 115995 115995 S0021-9517(25)00060-0 10.1016/j.jcat.2025.115995 Elsevier Inc. Fig. 1 HRTEM images and enlarged images of all catalysts: (a and b) 0.3Cu0.1Pt/ZrO2, (c and d) 0.1Pt/ZrO2, (e and f) 0.4Cu/ZrO2. Fig. 2 (a) STEM image, (b) overlayered EDS images, (c) a zoom-view of (b), (d) Zr, (e) O, (f) Cu, and (g) Pt elemental mapping images, and (h) the corresponding EDS line scanning profile of 0.3Cu0.1Pt/ZrO2. Fig. 3 H2–TPR (a), CO–TPD (b), and O2–TPD (c) profiles of 0.1Pt/ZrO2, 0.4Cu/ZrO2, and 0.3Cu0.1Pt/ZrO2; XRD patterns (d) of 0.1Pt/ZrO2, 0.4Cu/ZrO2, 0.3Cu0.1Pt/ZrO2 and Pure ZrO2. Fig. 4 XPS spectra of all the catalysts after reduction in the H2 gas: (a) Cu 2p, (b) Pt 4f, (c) Zr 3d, and (d) O 1 s; O 1 s XPS spectra of the fresh and the used 0.3Cu0.1Pt/ZrO2 catalyst after CO oxidation (e). Cu 2p XPS spectra of 0.3Cu0.1Pt/ZrO2 after O2 pre–adsorption (f). Pt 4f 2p XPS spectra of 0.3Cu0.1Pt/ZrO2 after O2 + CO pre–adsorption (g). Fig. 5 (a) CO conversion profiles of 0.1Pt/ZrO2 , 0.4Cu/ZrO2, 0.3Cu0.1Pt/ZrO2, Pure ZrO2 and 0.1Pt/ZrO2 + 0.4Cu/ZrO2. (b) Stability of 0.3Cu0.1Pt/ZrO2 at 150 °C. (Reaction conditions: [CO] = 1 vol%, [O2] = 16 vol% and N2 as balance gas, the WHSV of 0.1Pt/ZrO2 , 0.4Cu/ZrO2 and 0.3Cu0.1Pt/ZrO2 are 60, 000 mL·g−1·h−1, respectively). (c and d) Arrhenius plots for CO conversion. (Reaction conditions: [CO] = 1 vol%, [O2] = 16 vol% and N2 as balance gas, the WHSV of 0.1Pt/ZrO2 , 0.4Cu/ZrO2 and 0.3Cu0.1Pt/ZrO2 are 240, 000 mL·g−1·h−1, respectively). Reaction orders in (e) CO and (f) O2 on 0.1Pt/ZrO2 and 0.3Cu0.1Pt/ZrO2. Fig. 6 In situ DRIFTS study of CO adsorption and N2 purging: (a and d) 0.1Pt/ZrO2, (b and e) 0.4Cu/ZrO2, and (c and f) 0.3Cu0.1Pt/ZrO2. Fig. 7 In situ DRIFTS study of CO adsorption, O2 adsorption and N2 purging on 0.3Cu0.1Pt/ZrO2 at (a–c) 50 °C and (d–f) 160 °C. Fig. 8 The adsorption site of a single CO molecule: (a) Pt site, (b) Cu site. Fig. 9 The LH mechanism diagram of CO oxidation on Cu7Pt3/ZrO2 (111) and the calculated energies of intermediates and transition states. Fig. 10 Schematic illustration of the structure evolutions of CuPt/ZrO2 under CO oxidation processes. Table 1 O2–TPD peak area of all catalysts. Catalyst O2–TPD results Peak (OI) area (mmol·g−1) Peak (OII) area (mmol·g−1) Peak (OIII) area (mmol·g−1) 0.3Cu0.1Pt/ZrO2 0.45 1.66 0.10 0.1Pt/ZrO2 0.39 1.13 0.01 0.4Cu/ZrO2 0.30 1.52 N/A Table 2 Quantities of raw materials used in catalyst preparation. Sample Support(g) Loading a (wt%) CO chemisorption b (umol/g) Dispersion c (%) S d (m2/g) PS e (nm) Pt Cu 0.3Cu0.1Pt/ZrO2 2.00 0.14 0.33 289.80 12.70 81.50 6.80 0.1Pt/ZrO2 2.00 0.14 − 314.20 61.20 151.10 1.50 0.4Cu/ZrO2 2.00 − 0.46 388.50 4.60 29.30 19.00 a Determined by ICP − MS. b obtained by CO − TPD. c obtained by CO pulse adsorption. d S is the metallic surface area, obtained by CO pulse adsorption. e PS is the crystallite size, obtained by CO pulse adsorption. Table 3 The comparative TOFs of Cu and Pt catalysts under similar conditions. Sample Loading (wt%) Reactant gas composition TOF a (s−1) Con. b References Pt Cu 0.1Pt0.3Cu/ZrO2 0.14 0.33 1 % CO, 16 % O2, rest N2 4.90 × 10−2 (70 °C) 4.10 This work 0.4Cu/ZrO2 − 0.46 1 % CO, 16 % O2, rest N2 1.20 × 10−2 (70 °C) 0.53 This work 0.1Pt/ZrO2 0.14 − 1 % CO, 16 % O2, rest N2 0.60 × 10−2 (70 °C) 0.35 This work Cu0.1MnO x − 0.09 1 % CO, 20 % O2, rest N2 9.10 × 10−3 (70 °C) 3.40 [53] AuCu/TiO2 3.80 1.15 1 % CO, 1 % O2, rest N2 2.90 × 10−2 (30 °C) − [54] Cu0.05/ε − MnOy − 5.00 1 % CO, 20 % O2, rest N2 9.92 × 10−3 (65 °C) − [55] CuO/Ce0.75Zr0.25O2–δ − 33.38 1 %CO, 1 %O2, rest N2 8.50 × 10−4 (90 °C) 10.00 [56] Pt/WO3 0.70 − 1 % CO, 20 % O2, rest N2 4.60 × 10−3 (80 °C) − [57] Pt/CeO2 0.22 − 1 % CO, 20 % O2, rest He 1.80 × 10−2 (80 °C) − [58] 0.18 % Pt/θ − Al2O3 0.18 − 1 % CO, 20 % O2, rest Ar 1.30 × 10−2 (200 °C) 1.40 [59] Ptn/Ce 0.72 − 1 % CO, 10 % O2, rest N2 3.20 × 10−2 (90 °C) − [60] a The TOF value was evaluated by the number of CO converted per second per catalytic site (assuming all the metal atoms are active sites for a fair comparison). Reaction temperature is shown in parentheses below the TOF value. b CO conversion used to calculate TOF. Research article Understanding the synergetic catalytic functions of Cu–Pt active sites in the bimetallic CuPt/ZrO2 catalyst in CO oxidation Lianxin Xu Writing – original draft Methodology Investigation Formal analysis Data curation a b 1 Peng Zheng Writing – original draft Software Methodology Data curation a 1 Junbo Tian Validation Methodology Formal analysis b Tengfei Zhang Validation Formal analysis b Renzheng Jiang Writing – review & editing Resources Project administration Formal analysis a ⁎ Jiajian Gao Writing – review & editing Supervision Formal analysis c ⁎ Lili Zhang Writing – review & editing Formal analysis c Guangwen Xu Software Resources a d Ziyi Zhong Writing – review & editing Formal analysis Conceptualization e ⁎ Fabing Su Writing – review & editing Supervision Funding acquisition Conceptualization b d ⁎ a Key Laboratory on Resources Chemicals and Materials of Ministry of Education, Shenyang University of Chemical Technology, Shenyang 110142, China Key Laboratory on Resources Chemicals and Materials of Ministry of Education Shenyang University of Chemical Technology Shenyang 110142 China Key Laboratory on Resources Chemicals and Materials of Ministry of Education, Shenyang University of Chemical Technology, Shenyang 110142, China b State Key Laboratory of Mesoscience and Engineering, Institute of Process Engineering, Chinese Academy of Sciences, Beijing 100190, China State Key Laboratory of Mesoscience and Engineering Institute of Process Engineering Chinese Academy of Sciences Beijing 100190 China State Key Laboratory of Mesoscience and Engineering, Institute of Process Engineering, Chinese Academy of Sciences, Beijing 100190, China c Institute of Sustainability for Chemicals, Energy and Environment (ISCE2), Agency for Science, Technology and Research (A*STAR), 1 Pesek Road, Jurong Island, Singapore 627833 Singapore Institute of Sustainability for Chemicals, Energy and Environment (ISCE2) Agency for Science, Technology and Research (A*STAR) 1 Pesek Road, Jurong Island Singapore 627833 Singapore Institute of Sustainability for Chemicals, Energy and Environment (ISCE2), Agency for Science, Technology and Research (A*STAR), 1 Pesek Road, Jurong Island, Singapore 627833, Singapore d Institute of Industrial Chemistry and Energy Technology, Shenyang University of Chemical Technology, Shenyang 110142, China Institute of Industrial Chemistry and Energy Technology Shenyang University of Chemical Technology Shenyang 110142 China Institute of Industrial Chemistry and Energy Technology, Shenyang University of Chemical Technology, Shenyang 110142, China e Department of Chemical Engineering, and Guangdong Provincial Key Laboratory of Materials and Technologies for Energy Conversion (MATEC), Guangdong Technion Israel Institute of Technology (GTIIT), 241 Daxue Road, Shantou 515063, China Department of Chemical Engineering and Guangdong Provincial Key Laboratory of Materials and Technologies for Energy Conversion (MATEC) Guangdong Technion Israel Institute of Technology (GTIIT) 241 Daxue Road Shantou 515063 China Department of Chemical Engineering, and Guangdong Provincial Key Laboratory of Materials and Technologies for Energy Conversion (MATEC), Guangdong Technion Israel Institute of Technology (GTIIT), 241 Daxue Road, Shantou, 515063, China ⁎ Corresponding authors. 1 Lianxin Xu and Peng Zheng contributed equally to this work. Graphical abstract The study focused on investigating the role of CuPt bimetallic active sites in CO oxidation. First, there is an electron transfer phenomenon from the Cu sites to the Pt sites, resulting in a significant change in the surface electron distribution of Cu. This leads to the suppression of strong CO adsorption on Cu while simultaneously creating sites for O2 adsorption. Following this, CO interacts with CuPt NPs on the catalyst surface to form Cu–CO and Pt–CO and then reacts with adsorbed oxygen to produce CO2. Catalytic oxidation processes for carbon monoxide (CO) typically rely on catalysts made from noble metals. However, due to the scarcity and high cost of noble metals, developing low–cost, highly active, and stable catalysts with low noble metal loading is highly demanded but challenging. Herein, we synthesized ZrO2–supported CuPt alloy nanoparticle (NP) catalyst (0.3Cu0.1Pt/ZrO2), with a Cu loading of 0.3 wt% and a Pt loading of 0.1 wt%, using a straightforward impregnation method. This catalyst structure enables the well-mixing of Cu and Pt atoms in the pristine and partially oxidized catalysts during the CO oxidation. The temperature for 0.3Cu0.1Pt/ZrO2 to reach 90 % CO conversion is 160 °C, which is much lower than those for 0.1Pt/ZrO2 (220 °C) and 0.4Cu/ZrO2 (195 °C). Extensive characterizations were conducted, particularly for the pristine catalysts. The experiments and density functional theory (DFT) calculations results reveal that the interaction between the two metals significantly modified the electronic property of the catalyst. On CuPt bimetallic sites, the electron transfer from Cu to Pt weakens the strong adsorption of CO, and Cu species provide sites for O2 adsorption, which synergistically promotes the CO oxidation on the surface of CuPt NPs. This research provides deep insights into the relationship between the catalyst structure and their catalytic performance and paves the way for developing highly active bimetallic synergistic catalysts for CO oxidation. Keywords CuPt bimetallic catalysts CO oxidation Competitive adsorption Catalytic performance Interfacial structure Data availability Data will be made available on request. 1 Introduction CO is a major atmospheric pollutant primarily emitted from the incomplete combustion of carbon–based fuels. It is commonly found in vehicle exhaust and industrial emissions [1–3]. Catalytic oxidation is an effective method for CO purification [4]. Noble metals, like Pt [5], Pd [6], Ag [7], and Au [8], are commonly used in CO oxidation catalysts. However, due to the limited reserves of noble metals and their high production and use costs, using these noble metals can be expensive [9–11]. Hence, discovering methods to decrease the usage of noble metals to reduce costs while still maintaining excellent catalytic performance, particularly at low temperatures (≤150 °C), continues to be a major challenge. Any advancement in this field will have substantial implications for scientific research and industrial applications. At present, supported Pt catalysts have attracted much attention due to their high CO oxidation activity and reaction stability [12–14]. However, the high price of Pt and its easy–poisoning properties by CO pose significant challenges to its continuous application [15–17]. In recent years, there have been numerous efforts to decrease the use of Pt while maintaining high catalytic performance. Using a rational structural design for bimetallic catalysts allows for reduced platinum usage and enables the adjustment of activity compared to single platinum catalysts [18,19]. It has been reported that modifying Pt–CeO2 with transition metal oxides (M = Fe, Co, and Ni) could enhance the redox properties of the support, reducing the adsorption strength of CO and preventing CO poisoning [20]. Additionally, introducing the inexpensive metal Ni to form a Pt–Ni bimetallic catalyst in the appropriate Pt/Ni proportion could alleviate CO poisoning to Pt [21]. Therefore, substituting noble metals with affordable transition metals is a viable solution. Cu group metals have been widely studied because of their abundant resources, low cost, and high intrinsic catalytic activity [22–24]. The greater electronegativity of Pt than Cu can cause electron transfer, which is expected to modulate surface electronic properties that affect the catalytic performance [25,26]. The previous study by Gonçalves et al. [27] demonstrated that the presence of Cu active sites was functional for CO oxidation. However, the limited stability of Cu catalysts hinders their practical application [28–30]. It is suggested that combining the strong stability of the noble metal Pt with Cu may address this issue. The previous study found that PdCu and RhCu bimetallic NPs exhibited better CO oxidation activity than Pd and Rh NPs [31]. This is because the Cu formed very active and stable Pd–CuO NPs or Rh–CuO interfaces, which could significantly improve their catalytic activity. Kim et al. [32] synthesized an AuCu/SiO2 catalyst with an abundant Au–CuO x interface for CO oxidation reaction. Oxygen vacancies in the CuO x /Au interface were found to promote the effective conversion of CO through the Mars–Van Krevelen mechanism. Furthermore, Cu sites on Pt NPs could enhance the electro–oxidation of CO by providing a binding site with selective OH adsorption for CO oxidation [33]. However, while these studies showed that Cu can enhance the catalytic activity of noble metals, the specific role that Cu plays in CO oxidation, particularly in common Pt catalysts, remains to be clarified. Based on the previous efforts and our understanding, in this work, we prepared a ZrO2–supported well–mixed CuPt bimetallic catalyst (0.3Cu0.1Pt/ZrO2) by direct impregnation technique. Control experiments show that 0.3Cu0.1Pt/ZrO2 exhibited a much higher CO oxidation activity than 0.1Pt/ZrO2 and 0.4Cu/ZrO2, and the physically mixed 0.1Pt/ZrO2 + 0.4Cu/ZrO2 catalyst. The characterization and theoretical calculation results suggest that the synergistic effect in CuPt bimetallic NPs boosts the catalytic activity of 0.3Cu0.1Pt/ZrO2. The enhanced electron transfer from Cu to Pt modifies the electronic properties of the catalyst surface, thereby promoting CO desorption. In situ DRIFTS and DFT simulation shows that Cu provides adsorption sites for O2 and promotes further CO oxidation on the surface. Hence, this study clarifies the synergistic effect of bimetal sites in CO oxidation and lays a foundation for designing efficient bimetallic catalysts. 2 Experimental 2.1 Chemicals and materials Chloroplatinic acid hexahydrate (H2PtCl66H2O, analytical grade (AR), Pt ≥ 37.5 wt%) and copper nitrate hydrate (Cu(NO3)23H2O, AR, ≥ 99.9 wt%) were purchased from Sinopharm Chemical Reagent Co. Ltd. Zirconium dioxide (ZrO2, AR, ≥ 99.9 wt%, specific surface area: 40 m2/g) was bought from Zhejiang Yamei Nano Technology Co. Ltd. All the chemicals were used directly without further purification. 2.2 Preparation of the catalysts 0.3Cu0.1Pt/ZrO2: 10 mg of H2PtCl66H2O (0.1 wt% nominal loading of Pt) and 23 mg of Cu(NO3)23H2O (0.3 wt% nominal loading of Cu) were dissolved in 9 mL of deionized water. Subsequently, 2.0 g of ZrO2 powder was added to the above–mixed solution and stirred at room temperature for 1 h. The resultant slurry was dried at 100 °C overnight, followed by calcination in air at 400 °C for 3 h, with a ramp rate of 5 °C /min. The calcined material was then reduced in a tubular furnace under a hydrogen flow (≥99.9 vol%, 60 mL/min) at 250 °C for 2 h, with the same ramp rate. After H2 reduction, the reduced sample was cooled to room temperature, denoted as 0.3Cu0.1Pt/ZrO2. 0.1Pt/ZrO2: 10 mg H2PtCl66H2O (0.1 wt% nominal loading of Pt) was dissolved in 9 mL deionized water. Subsequently, 2.0 g of ZrO2 powder was added into the above H2PtCl6 solution and stirred at room temperature for 1 h. The resulting slurry was dried at 100 °C overnight and then calcined at 400 °C for 3 h in air at a heating rate of 5 °C /min. The calcined material was then reduced in a tubular furnace under a hydrogen flow (≥99.9 vol%, 60 mL/min) at 250 °C for 2 h, with the same ramp rate. After H2 reduction, the reduced sample was cooled to room temperature, denoted as 0.1Pt/ZrO2. 0.4Cu/ZrO2: 30 mg of Cu(NO3)23H2O (0.4 wt% nominal loading of Cu) was dissolved in 9 mL deionized water. Subsequently, 2.0 g of ZrO2 powder was added to the above Cu(NO3)2 solution and stirred at room temperature for 1 h. The resulting slurry was dried at 100 °C overnight and then calcined at 400 °C for 3 h in air at a heating rate of 5 °C /min. The calcined material was then reduced in a tubular furnace under a hydrogen flow (≥99.9 vol%, 60 mL/min) at 250 °C for 2 h, with the same ramp rate. After H2 reduction, the reduced sample was cooled to room temperature, denoted as 0.4Cu/ZrO2. Pure ZrO2: The preparation conditions were the same as mentioned above but without the addition of Cu(NO3)23H2O and H2PtCl66H2O precursors. The resulting sample is referred to as Pure ZrO2. 0.1Pt/ZrO2 + 0.4Cu/ZrO2: It was obtained by physically mixing 0.1Pt/ZrO2 and 0.4Cu/ZrO2 with a mass ratio of 1:1, denoted as 0.1Pt/ZrO2 + 0.4Cu/ZrO2. 2.3 Characterization Transmission electron microscope (TEM) and scanning transmission electron microscopy (STEM) analyses were conducted using a JEOL JEM 2100F system equipped with a field emission gun at an accelerating voltage of 200 kV. Before TEM experiments, all samples were reduced at 250 °C for 2 h in an atmosphere of H2, and then N2 was introduced to purge the catalyst surface. The samples are placed in a vacuum bag to avoid oxidation and ensure a dry state. X–ray diffraction (XRD) patterns were measured on a PANalytical X'Pert PRO MPD using Cu Kα radiation (λ = 1.5418 Å) at 40 kV and 200 mA, and compared with the standard XRD patterns provided by the Joint Committee on Powder Diffraction Standards (JCPDS). X–ray photoelectron spectroscopy (XPS) spectra were recorded using a Thermo Scientific K–Alpha spectrometer, which is equipped with monochromatized Al Kα radiation (1486.6 eV). The spectrometer was operated at 12 kV and 6 mA under pressure below 2.0 × 10–5 Pa to analyze the valence of each element. All binding energies were calibrated to the C 1 s peak at 284.8 eV of the adventitious carbon. Before XPS experiments, all samples were reduced at 250 °C for 2 h in an atmosphere of H2, and then N2 was introduced to purge the catalyst surface. The samples were placed in a vacuum bag to avoid oxidation and ensure a dry state. The used samples were obtained using the same protection treatment after CO oxidation. The metal content in the samples was measured by inductively coupled plasma−optical emission spectroscopy (ICP–MS, Agilent 7800, America). The hydrogen temperature–programmed reduction (H2–TPR) experiments were conducted on an automated chemisorption analyzer (Quantachrome, ChemBET Pulsar TPR). CO temperature–programmed desorption (CO–TPD) and O2 temperature–programmed desorption (O2–TPD) experiments were performed on a Micromeritics Autochem II 2920 and an Altamira instrument AMI–300 chemisorption analyzer, respectively. For H2–TPR, a 0.15 g sample was loaded in a quartz U–tube, heated from room temperature to 150 °C at 10 °C /min, and maintained for 2 h under a helium (He) flow. Then, the sample was cooled to 50 °C, followed by heating to 900 °C at 10 °C /min under a binary gas (10.0 vol% H2/Ar) with a gas flow of 100 mL/min. For CO–TPD, a 0.05 g sample was placed in a reaction tube and dried at 10 °C /min from room temperature to 120 °C. Then, the sample was cooled to room temperature and saturated with 10 % CO/He. After the physically adsorbed CO was removed by purging with He for 1 h, the sample was heated to 800 °C at 10 °C /min in a He flow (30 mL/min). A thermal conductivity detector (TCD) was used to detect the desorbed CO gas. For O2–TPD, a 0.1 g sample was placed in a reaction tube and dried at 10 °C /min from room temperature to 120 °C. Then, the sample was cooled to room temperature and saturated with 10 % O2/He. After the physically adsorbed O2 was removed by purging with He for 1 h, the sample was heated to 800 °C at 10 °C /min in a He flow (30 mL/min). TCD was used to detect the desorbed oxygen gas. In situ diffuse reflectance infrared Fourier transform spectroscopy (In situ DRIFTS) spectra were collected continuously using a TENSOR 27 spectrometer equipped with an MCT detector cooled by liquid nitrogen. The sample was placed on the sample holder at the center of the cell. The sample was placed in a reaction tube, dried from room temperature to 200 °C at 10 °C /min in an N2 atmosphere, and then cooled to 50 °C, followed by flowing CO (2 % CO/N2, 50 mL/min). The adsorption of CO molecules on the catalyst surface lasted for 30 min. After that, the DRIFTS spectra were recorded until there was no visible change in the absorption band intensity under the N2 purge. For the experiment in the CO–O2–N2 atmosphere, the sample was first dried from room temperature to 200 °C at a rate of 10 °C /min in an N2 atmosphere, then cooled to 50 °C and adsorbed in 2 % CO/N2 for 30 min, then the gas was switched to 5 % O2/N2 for 30 min, and finally swept with N2. All these spectra were collected by accumulating 32 scans in 600–4000 cm−1 range at a resolution of 4 cm−1 as a function of time. The CO pulse adsorption test was conducted using the BSD–Chem C200 instrument. A 0.15 g sample was reduced with H2 at 250 °C for 2 h, with a heating rate of 10 °C/min. After cooling the temperature down to 50 °C, excess H2 was removed using a high–purity He gas flow. Subsequently, the dispersion and particle size of the metal were measured using the CO pulse technique. 2.4 Catalytic measurement The CO oxidation reaction was performed using a continuous flow system in a stainless steel fixed–bed reactor under atmospheric pressure. The feed gas (1 vol% CO, 16 vol% O2, and 83 vol% N2 as balance gas) was purchased from Beijing Haipu Gas Co. Ltd. Firstly, 0.2 g of catalyst (20–40 mesh) was placed into the reactor. Subsequently, the feed gas was introduced into the reactor with a 200 mL/min flow rate and a weight hourly space velocity (WHSV) of 60, 000 mL−1·g−1·h−1. The reaction temperature was increased from 50 to 230 °C at a heating rate of 5 °C /min, where each point was maintained for 45 min to stabilize. The Testo 350 pro multi–component flue gas analyzer was used to measure the concentration of CO at the inlet and outlet. The CO conversion was calculated as follows: (1) X C O = V C O in - V C O out V C O in × 100 % where XCO is CO conversion, and V C O in and V C O out represent the CO concentration at the inlet and outlet, respectively. CO conversion was controlled below 20 % by varying the WHSV and reaction temperature to eliminate the effects of internal and external diffusion. Then, the specific reaction rate and turnover frequency (TOF) of CO oxidation were measured. The reaction rate (molCO·molmetal –1·s−1) is calculated as follows: (2) CO Reaction rate = X CO × F CO n × 100 % where XCO is CO conversion (< 20 %), FCO (mol/s) is the molar gas flow rate of CO, and n (molmetal) is the molar amount of the metal in the catalyst. The TOF on active metal sites (TOFmetal (s−1)) is calculated by the following equation: (3) TOF metal = X CO × F CO × M metal m × W metal × D metal × 100 % where XCO is CO conversion (< 20 %), FCO (mol/s) is the molar gas flow rate of CO, Mmatal is the atomic weight of the active metal, Wmetal is the active metal loading, and Dmetal is the dispersion of active metal. The apparent activation energies (Ea (kJ/mol)) over the catalysts were calculated via the Arrhenius equation at CO conversions below 20 %. 2.5 Computational methods and models All the periodic DFT calculations were performed through the Vienna ab initio simulation package (VASP) [34,35], using the Perdew–Burke–Ernzerhof (PBE) functional [36]. The core electrons were treated with the projector augmented–wave (PAW) pseudopotentials. The used plane wave cutoff energy was 450 eV. The Monkhorst–Pack grid was set as a gamma point. The convergence criterion for the geometric relaxation was 0.02 eV/Å. The adsorption energy was calculated through the following equations: Eads = Emol/sub – (Emol + Esub). The Emol/sub represents the energy of the whole adsorbed system, Emol is the energy of a free molecule, Esub is the energy of a substrate. Four layers of ZrO2 (111) and a Cu7Pt3 cluster were used to explore the adsorption behaviors and reaction mechanisms. 3 Results and discussion 3.1 Characterization of the catalyst 3.1.1 TEM observation Fig. 1 presents the TEM images of the 0.3Cu0.1Pt/ZrO2, 0.1Pt/ZrO2, and 0.4Cu/ZrO2 catalysts. The ZrO2 lattice can be seen for all the catalysts, with spacings of 0.311, 0.362, 0.499, and 0.181 nm attributed to the ZrO2 ( 1 ¯ 1 1 ) , (110), (100), and (022) crystal planes, respectively [37]. In 0.3Cu0.1Pt/ZrO2, the CuPt NPs with a diameter of ∼ 2 nm are loaded on ZrO2 support with sizes of 15–30 nm. High–resolution transmission electron microscopy (HRTEM) images (Fig. 1a) show the lattice spacing of 0.218 nm, which corresponds to the (111) crystal plane of CuPt NPs (Fig. 1b) [38]. For 0.1Pt/ZrO2, Pt NPs possess an average size of 3.9 nm, and the lattice spacing of 0.225 nm is related to the Pt (111) crystal plane (Fig. 1c and d) [39]. The Cu NPs in 0.4Cu/ZrO2 possess an average size of 5.4 nm, and the lattice spacing of 0.208 nm corresponds to the Cu (111) crystal plane (Fig. 1e and f) [8]. The lattice spacing of CuPt NPs is 0.218 nm, which is between the lattice spacing of single metal Pt (0.225 nm) and Cu (0.208 nm), indicating the formation of the Cu–Pt alloy particles [40]. To further prove the existence of CuPt alloy in the bimetallic catalyst, the STEM dark field images of 0.3Cu0.1Pt/ZrO2 are measured, as shown in Fig. 2 . There are small metal nanoparticles loaded on the ZrO2 support (Fig. 2a, blue circle). EDS mapping (Fig. 2b) shows that the small metal particles are composed of Cu and Pt elements (Fig. 2c). The overlayered EDS images Fig. 2b and the elemental mapping of Cu, Pt, and Zr (Fig. 2d–g) reveal the uniform distribution of Cu and Pt on CuPt NPs. To confirm this, we further scanned the surface of the catalyst (Fig. 2h) and found that the elemental peaks of Cu and Pt are almost at the same position. These findings demonstrate the formation of the well–mixed or even alloyed CuPt bimetallic NPs, which enable the effective interaction between metal sites. Furthermore, the H2–TPR (Fig. 3 a) and CO–adsorption DRIFTS (Fig. 6) experiments confirmed such kind of interaction between the two metals. 3.1.2 H2–TPR, CO–TPD, O2–TPD, and XRD analysis Fig. 3a presents the H2–TPR profiles of all the catalysts after their calcination in air, which reflect the reducibility and metal–metal interaction of the catalysts. For 0.1Pt/ZrO2, the peak at 243 °C is attributed to the reduction of the PtO x species [41]. The peak at 268 °C for 0.4Cu/ZrO2 is attributed to the reduction of CuO x species [42]. The strong reduction peak at 256 °C in 0.3Cu0.1Pt/ZrO2 is attributed to the reduction of Pt–[O] x –Cu structure, which is different from the reduction peak of either PtO x (243 °C) or CuO x (268 °C) species. This indicates a strong interaction between the Pt and Cu species [5,43], which provides indirect evidence of forming CuPt alloy NPs. Furthermore, the individual temperature profile illustrates the uniform dispersion of bimetallic NPs. Fig. 3b shows the CO–TPD profiles of all the catalysts after their reduction in H2 gas. Before CO–TPD analysis, the weakly adsorbed CO on the catalyst surface was removed by He purging. Two types of CO desorption peaks can be observed. The low–temperature strong desorption peak around 142.1 °C is assigned to CO adsorbed on the metal sites, which plays the key role in CO oxidation. The high–temperature weak desorption peak at about 500.4 °C is not significantly different. The order of the low–temperature strong desorption peak area is 0.4Cu/ZrO2 > 0.1Pt/ZrO2 > 0.3Cu0.1Pt/ZrO2 (Fig. 3b). The strong adsorption of CO deactivates catalysts because CO molecules might cover the active sites [44]. Compared to 0.1Pt/ZrO2 and 0.4Cu/ZrO2, 0.3Cu0.1Pt/ZrO2 shows a lower CO desorption temperature and weaker CO adsorption, indicating less covered surface sites on it. To further investigate the oxygen adsorption and activation on 0.3Cu0.1Pt/ZrO2, 0.1Pt/ZrO2, and 0.4Cu/ZrO2 catalysts, O2–TPD experiments were conducted for these catalysts after their reduction in H2 (Fig. 3c). The desorption of surface adsorbed oxygen species follows a sequence with increasing temperature: from surface adsorbed peroxo species (O2 −, below 200 °C, OIII) to surface adsorbed monoatomic species (O−, 200 − 500 °C, OII), transitioning to surface lattice oxygen (O2−, 500 − 700 °C, OI), and finally to bulk lattice oxygen (above 700 °C) [44]. It should be pointed out that before the O2–TPD analysis, the physically adsorbed oxygen was removed through He purging. The peak above 500 °C is related to the surface lattice oxygen species, which are not directly involved in the reaction [45]. Table 1 shows the area of the oxygen desorption peaks for each catalyst. The oxygen desorption peak area follows 0.3Cu0.1Pt/ZrO2 > 0.4Cu/ZrO2 > 0.1Pt/ZrO2. No obvious OIII below 200 °C is observed for 0.4Cu/ZrO2, while 0.3Cu0.1Pt/ZrO2 show a prominent peak of OIII, and the peak area much larger than of 0.1Pt/ZrO2. This indicates that the formation of PtCu NPs increases the oxygen storage capacity for weak chemisorption. The OII peak area of 0.3Cu0.1Pt/ZrO2 is significantly larger than that of the other two catalysts. These results show that 0.3Cu0.1Pt/ZrO2 has the largest capacity for surface–adsorbed oxygen species due to the formation of CuPt NPs. Fig. 3d presents the XRD patterns of the catalysts. Characteristic diffraction peaks are only observed at 2θ values of 17.4, 24.4, 28.2, 31.4, 49.2, and 50.1°, corresponding to the monoclinic ZrO2 crystal planes of (100), (110), ( 1 ¯ 1 1 ) , (111), (022), and (220), respectively (JCPDS No. 86–1449). No other peaks are observed, confirming the high purity of the ZrO2 sample. Furthermore, crystalline phases of Pt and Cu species are not discernible due to their low concentration and/or high dispersion on the ZrO2 surface. 3.1.3 XPS analysis Fig. 4 a displays the Cu 2p spectra of 0.3Cu0.1Pt/ZrO2 and 0.4Cu/ZrO2. The samples were reduced in H2 before the XPS analysis. The peaks at 932.6 and 952.7 eV are attributed to the Cu0 species, and the peaks at 935.1 and 955.0 eV to the Cu2+ species [46]. Compared with 0.4Cu/ZrO2, the Cu0 peak of Cu 2p3/2 and 2p1/2 in 0.3Cu0.1Pt/ZrO2 shift to higher binding energies (BEs) by 0.2 and 0.5 eV, respectively, indicating the partial electron transfer from Cu to Pt. Fig. 4b shows the Pt 4f spectra of 0.3Cu0.1Pt/ZrO2 and 0.4Cu/ZrO2. The peaks at 70.1 and 74.1 eV are attributed to Pt0, and those at 72.7 and 75.6 eV are attributed to Pt2+. The peaks at 74.8 and 78.3 eV are attributed to Pt4+ [37,47]. Compared with 0.1Pt/ZrO2, the Pt0 peak of Pt 4f7/2 and 4f5/2 of 0.3Cu0.1Pt/ZrO2 shift to lower BEs by 0.5 and 0.2 eV, respectively. These observations indicate that the electronic properties of Pt are modified due to the gain of electrons from Cu [48]. For Zr 3d spectra (Fig. 4c), two peaks at 181.8 and 184.7 eV are the BEs of 3d5/2 and 3d3/2 electrons of Zr4+, respectively [49,50]. The Zr 3d signals of the three catalysts are observed with similar intensity. Also, the peak shape remains consistent, although there is a slight shift observed. This shift may be attributed to the higher electronegativity of copper (Cu, 1.9) and platinum (Pt, 2.2) compared to zirconium (Zr, 1.3), which affects the Zr 3d signals [51]. As a result, the Zr peaks of the three catalysts cannot be accurately assessed. Fig. 4d shows the O 1 s spectra of all the catalysts. Two distinct characteristic peaks are observed: the lattice oxygen (OI) at 529.8 eV in ZrO2 and the surface–adsorbed oxygen species (OII) at 532.5 eV. OII represents the molecular oxygen, and other oxygen species adsorbed on the surface of the catalyst [37]. Compared with other catalysts (70.5 % for 0.4Cu/ZrO2 and 62.7 % for 0.1Pt/ZrO2), the proportion of OII in 0.3Cu0.1Pt/ZrO2 (78.3 %) is the highest. 0.3Cu0.1Pt/ZrO2 surface has the largest amount of the adsorbed oxygen species, which coincides with the above O2–TPD test results (Fig. 3c). These observations indicate that forming CuPt alloy NPs improves the oxygen adsorption capacity of the catalyst. Compared with the O 1 s spectra of the fresh 0.3Cu0.1Pt/ZrO2, after CO oxidation, a new peak of O 1 s spectra appears at about 531.4 eV for 0.3Cu0.1Pt/ZrO2, which proves the existence of new chemisorbed oxygen species on the CuPt bimetallic NPs (Fig. 4e). Furthermore, the OII peak has almost completely disappeared, proving that the OII species are the reactive species for CO oxidation. For the Cu site, O2 pre–adsorption led to the appearance of Cu+ species (933.4 eV and 953.3 eV), with a concurrent disappearance of Cu0 (932.7 eV and 952.5 eV). Following the pre–adsorption of CO + O2, Cu0 species were restored (Fig. 4f) [52]. Similarly, for Pt sites, Pt2+ species emerged during O2 pre–adsorption, replacing Pt0. However, after the pre–adsorption of CO + O2, the Pt2+ (75.8 eV and 72.7 eV) sites were reduced back to Pt0 (74.1 eV and 70.1 eV) (Fig. 4g). This process illustrates the role of Cu in the catalyst, which stabilizes the metallic Pt as the active site for CO oxidation, while Cu species likely facilitate the adsorption of molecular O2 and its activation. 3.2 Catalytic performance of the catalysts The catalytic performance of the ZrO2–supported catalysts for CO oxidation was evaluated using a gas mixture (1.0 vol% CO/16 vol% O2/N2) at a WHSV of 60, 000 mL·g−1·h−1. As depicted in Fig. 5 a, pristine ZrO2 exhibits an ignorable CO oxidation performance. The order of the catalytic activity of the ZrO2–supported catalysts for CO oxidation is as follows: 0.3Cu0.1Pt/ZrO2 > 0.4Cu/ZrO2 > 0.1Pt/ZrO2. The CO conversion reaches 90 % on 0.3Cu0.1Pt/ZrO2 at only 160 °C, which is lower than the temperature of 0.1Pt/ZrO2 (220 °C) and 0.4Cu/ZrO2 (195 °C). The excellent performance of 0.3Cu0.1Pt/ZrO2 compared with other ZrO2–supported catalysts is due to the alloying effect of Pt and Cu in the pristine catalyst, and their intimate contact during the catalytic process. Conversely, the CO oxidation performance of the physically mixed 0.1Pt/ZrO2 + 0.4Cu/ZrO2 catalyst is lower than that of 0.3Cu0.1Pt/ZrO2, confirming that the separated Cu and Pt sites cannot function well synergistically for the CO oxidation. The long–term stability of a catalyst is a critical factor in its practical application. The durability of 0.3Cu0.1Pt/ZrO2 was evaluated in a prolonged stability test at 150 °C. Fig. 5b shows that the CO conversion is 64 % within 50 h at 150 °C without any visible deactivation, indicating that 0.3Cu0.1Pt/ZrO2 has excellent catalytic stability. The intrinsic reaction rates and apparent activation energies of CO oxidation were further measured to compare the activity of the catalysts. For 0.3Cu0.1Pt/ZrO2, the reaction rate is 8.6 × 10–4 molCO·molmetal –1·s−1 at 140 °C (Fig. 5c), which is higher than those of 0.1Pt/ZrO2 (1.0 × 10–4 molCO·molmetal –1·s−1) and 0.4Cu/ZrO2 (4.7 × 10–4 molCO·molmetal –1·s−1). Fig. 5d shows the activation energy (Ea) of all the catalysts. Compared with 0.1Pt/ZrO2 (41.3 kJ/mol) and 0.4Cu/ZrO2 (38.4 kJ/mol), 0.3Cu0.1Pt/ZrO2 has the lowest Ea value of 30.9 kJ/mol, further indicating its highest catalytic activity. Standard CO chemisorption was performed on 0.3Cu0.1Pt/ZrO2, 0.4Cu/ZrO2, and 0.1Pt/ZrO2 to measure active metal dispersion, metallic metal surface, and cubic crystallite size (Table 2 ). For the 0.3Cu0.1Pt/ZrO2 sample, the measured dispersion, surface area, and average particle size values of the active metal are between those of 0.4Cu/ZrO2 and 0.1Pt/ZrO2, indicating that there is a synergistic effect between Cu and Pt. Table 3 summarizes the TOFs of the Cu and Pt–based catalysts reported under similar reaction conditions. The TOFs of 0.3Cu0.1Pt/ZrO2 measured at 70 °C is 4.90 × 10−2 s−1, which is higher than that of 0.4Cu/ZrO2 (1.20 × 10−2 s−1) and 0.1Pt/ZrO2 (0.60 × 10−2 s−1), suggesting that the former exhibits a much stronger CO oxidation activity. It is worth noting that the TOF value of 0.3Cu0.1Pt/ZrO2 at 70 °C obtained in this work is even higher than that of the reported catalysts in Table 3 at higher reaction temperatures. To elucidate the CO oxidation mechanism on the two catalysts, we determined the reaction orders for CO and O2, as depicted in Fig. 5e and f. The CO reaction order on 0.3Cu0.1Pt/ZrO2 is –0.29, exceeding that of 0.4Cu/ZrO2 (–0.40), indicating that the former is more resistant to CO poisoning. The reaction order for O2 was 0.1 for 0.3Cu0.1Pt/ZrO2 and 0.2 for 0.4Cu/ZrO2. The lower O2 reaction order for 0.3Cu0.1Pt/ZrO2 suggests less competitive adsorption between CO and O2 and a lower energy barrier for O2 activation, which will be proven again by the following DFT calculations. 3.3 In situ DRIFTS analysis Fig. 6 a–c presents the DRIFTS spectra of CO adsorption on 0.1Pt/ZrO2, 0.4Cu/ZrO2, and 0.3Cu0.1Pt/ZrO2. Strong gas–phase CO absorption bands are observed on 0.1Pt/ZrO2 at 2112 and 2171 cm−1, accompanied by a CO bridge absorption band at 1822 cm−1 [61]. The bridge adsorption of CO was observed on 0.1Pt/ZrO2 but not on 0.3Cu0.1Pt/ZrO2, indicating the separation effect of Cu in the alloyed Cu-Pt NPs. The electron redistribution on the Cu and Pt atoms can facilitate linear adsorption [62,63]. Thus, the in Situ DRIFTS results confirm the well–mixed Cu and Pt elements at the atomic level in the alloyed nanoparticles. The observed peaks at 1639, 1537, 1460, and 1394 cm−1 on the three catalysts are attributed to the bidentate carbonate intermediate species [6,64]. 0.1Pt/ZrO2 exhibits a characteristic linear Pt–CO adsorption vibration at 2065 cm−1 [14], which shifts to 2060 cm−1 upon N2 purging (Fig. 6d). For 0.4Cu/ZrO2, two strong absorption bands are observed at 2109 and 2171 cm−1, which are attributed to Cuδ+–CO species and gaseous CO [24,65]. During the N2 purge process, the gaseous CO peak in the case of 0.4Cu/ZrO2 gradually decayed within the initial 10 mins and completely disappeared at 20 mins. The linear CO adsorption completely disappeared at 30 mins (Fig. 6e). For 0.3Cu0.1Pt/ZrO2, CO adsorption shows two different bands at 2170 and 2109 cm−1, which are attributed to linear CO adsorption and gas–phase CO adsorption, respectively. During the N2 purge process, the gaseous CO peak of the 0.3Cu0.1Pt/ZrO2 catalyst gradually decayed in about 10 min and completely disappeared at 20 min. However, the linear CO adsorption did not change significantly (Fig. 6f) [60]. A notable redshift is observed on 0.3Cu0.1Pt/ZrO2 compared to 0.1Pt/ZrO2 before N2 purging, suggesting a synergy effect due to the electron transfer from Cu to Pt. This surface composition aligns with the results from the H2–TPR analysis (Fig. 3a). The observed CO adsorption strength from the in situ DRIFTS spectra is consistent with the CO chemisorption data (Fig. 3b). This further suggests that excessive CO adsorption can reduce catalytic performance. To further explore the adsorption of CO and O2 on 0.3Cu0.1Pt/ZrO2, we measured the in situ DRIFTS spectra by switching among various gas atmospheres of “CO–O2–N2” at 50 and 160 °C (Fig. 7 ), respectively. At 50 °C, when introducing O2, the bands at 2108 and 2173 cm−1 became weak, and all disappeared at 8 min. The peaks of Cu0 − CO (2085 cm−1), Cuδ+ − CO (2108 cm−1), gas phase CO (2173 cm−1), and Pt0 − CO (2065 cm−1) were observed at 14 min, and there was no significant change within 30 min after adsorption, which confirms the reliability of the structural characterization of CuPt NPs (Fig. 7a and b) [66]. In addition, in the CO–O2–N2 switching process, the peak position of Pt0 − CO maintained at 2065 cm−1 and the absorption peak intensity became lower, while the Cu0 − CO peak shifted from 2085 cm−1 to 2082 cm−1 during N2 purging (Fig. 7c). It is thus evident that the Cu sites in CuPt NPs act as sites for O2 adsorption and decrease the intensity of CO adsorption on Pt to prevent poisoning [67]. To detect the role of CuPt NPs in CO oxidation, we performed the same in situ DRIFTS experiment at 160 °C. The adsorption peak intensity of CO on Cuδ+ − CO (2111 cm−1) and Pt0 − CO (2062 cm−1) became strong. After introducing O2, the Cuδ+ − CO peak disappeared, but the Cu0 − CO peak appeared (2084 cm−1). At the same time, the peak intensity of Cu0 − CO and Pt0 − CO became stronger, indicating that both Cu and Pt sites adsorbed CO at the high temperature of 160 °C (Fig. 7d and e). Compared with the results at 50 °C (Fig. 7c), the CO peak on the Cu and Pt sites had a smaller wavenumber shift (Fig. 7f), indicating that high temperatures can provide sufficient energy for the Cu sites to activate gas oxygen to participate in CO oxidation. 3.4 DFT calculation From an experimental aspect, the ZrO2 support primarily exposes the (111) crystal plane. Transmission characterization reveals that the Cu content in the CuPt bimetallic system significantly exceeds that of Pt. Previous studies on M10 cluster modeling have demonstrated that Pt10 exhibits exceptional stability and structural diversity [68–70]. Similarly, the bimetallic cluster Au7Cu3, modeled on this structure, also shares these advantages [71]. Consequently, we selected ZrO2 (111) and Cu7Pt3 as the model catalysts, positioning the Pt site within the cluster and the Cu site at the interface to establish a more accurate adsorption configuration (Fig. 8 ). The computational results indicate that the initial CO molecule can adsorb on either the Cu or Pt site (Fig. 8a and b). Characterization results further reveal that O2 and CO adsorption on metal sites play a critical role in CO oxidation, aligning closely with the Langmuir–Hinshelwood (LH) mechanism [72]. To better align the density functional theory (DFT) computational model with the catalyst structure under actual reaction conditions, we employed a model comprising a ZrO2 (111) surface and a Cu7Pt3 cluster, where the initial state was fully covered by CO and O2 molecules (Fig. 9 , IS). As shown in Fig. 9, the first elementary reaction involves the interaction between an O2 molecule and a CO molecule, overcoming an activation energy of 0.79 eV (TS1). In this step, O2 reacts with CO adsorbed on the Pt site to form an OCOO* intermediate (IM1), while Cu transitions into an oxidized state due to the adsorption and transformation of O2. Subsequently, CO2 is spontaneously formed and released, releasing 2.23 eV of energy (IM2). The cleavage of the O–O bond in the OCCO* intermediate results in the release of CO2, leaving behind an oxygen atom. At this stage, the oxidized Cu state is partially reduced, with an exothermic CO2 desorption energy of 1.31 eV (IM3). In the next step, a second CO molecule binds to the Pt site (IM4) and reacts with the remaining O* atom to form another CO2 molecule, requiring an activation energy of 1.46 eV (TS2). Finally, CO2 desorbs into the gas phase, returning the Pt and Cu sites to their initial states and completing the oxygen cycle (FS). Based on previous studies of catalytic cycling during CO oxidation, it was found that the leapfrogging behavior of O2 molecules at different sites drives the cycling of valence states [72,73]. This confirms the critical role of the O2 adsorption cycle, particularly at the Cu sites, in facilitating this mechanism. These findings are consistent with the results obtained from XPS and in situ DRIFTS analyses. 3.5 Proposed catalytic mechanism Based on the above characterizations, the structural model of the CuPt/ZrO2 catalyst is proposed to illustrate the reaction process, as shown in Fig. 10 . In general, CO is adsorbed on CuPt NPs and interacts with surface–adsorbed oxygen species to undergo an oxidation reaction at the Cu site to form CO2, which is a typical LH mechanism [74,75]. In the catalyst, some electrons are transferred from the Cu sites to the Pt sites, which significantly changes the surface electron distribution of Cu. As a result, the strong adsorption of CO on Cu is suppressed, which simultaneously provides sites for O2 adsorption. Subsequently, CO combines with CuPt NPs on the catalyst surface to form Cu–CO and Pt–CO, and further reacts with the adsorbed oxygen to form CO2. In the process, the synergetic interaction between Pt and Cu sites in CuPt NPs can reduce the competitive adsorption of CO and O2 at single metal sites and contribute to CO oxidation. 4 Conclusion ZrO2–supported CuPt alloy catalysts have been successfully synthesized by a simple impregnation method, which enables a mixing at the atomic level of Cu and Pt atoms even in their partially oxidized status during the CO oxidation. Compared to the individual Pt and Cu metal catalysts, the CuPt bimetallic catalyst shows higher activity and stability in the CO oxidation reaction. The characterization results, particularly to the pristine catalysts, show that both Pt and Cu can separately adsorb CO strongly, leading to the severe coverage of the active sites by CO. However, in the 0.3Cu0.1Pt/ZrO2 bimetallic catalyst, there is an electron transfer phenomenon from Cu to Pt atoms, which significantly alters the surface electronic properties and suppresses the excessive adsorption of CO on Pt. Also, this synergistic interaction leads to the enhanced ability for oxygen adsorption, thus greatly reducing the CO–poisoning effect and improving catalytic activity. In situ DRIFTS and DFT simulation results show that the LH mechanism is prominent, and the Cu site in CuPt NPs acts as the adsorption site for O2, which improves the competitive adsorption of CO and O2 on Pt and Cu metal sites. Therefore, this study offers a deep insight into the reaction mechanism of CO oxidation over CuPt bimetallic NPs, highlighting the significance of designing proper active centers for efficient and long–lasting catalysts. CRediT authorship contribution statement Lianxin Xu: Writing – original draft, Methodology, Investigation, Formal analysis, Data curation. Peng Zheng: Writing – original draft, Software, Methodology, Data curation. Junbo Tian: Validation, Methodology, Formal analysis. Tengfei Zhang: Validation, Formal analysis. Renzheng Jiang: Writing – review & editing, Resources, Project administration, Formal analysis. Jiajian Gao: Writing – review & editing, Supervision, Formal analysis. Lili Zhang: Writing – review & editing, Formal analysis. Guangwen Xu: Software, Resources. Ziyi Zhong: Writing – review & editing, Formal analysis, Conceptualization. Fabing Su: Writing – review & editing, Supervision, Funding acquisition, Conceptualization. Declaration of competing interest The authors declare that they have no known competing financial interests or personal relationships that could have appeared to influence the work reported in this paper. Acknowledgements This research was funded by the National Key R&D Program of China (No.2023YFC3707001) and Open Research Fund of State Key Laboratory of Mesoscience and Engineering (MESO-23-D13). References [1] J.S. Elias K.A. Stoerzinger W.T. Hong M. Risch L. Giordano A.N. Mansour Y. Shao-Horn In situ spectroscopy and mechanistic insights into CO oxidation on transition–metal–substituted ceria nanoparticles ACS Catal. 7 2017 6843 6857 J.S. Elias, K.A. Stoerzinger, W.T. Hong, M. Risch, L. Giordano, A.N. Mansour, Y. Shao-Horn, In Situ Spectroscopy and Mechanistic Insights into CO Oxidation on Transition–Metal–Substituted Ceria Nanoparticles, ACS Catal. 7 (2017) 6843–6857. [2] X. Zhang H. Li Y. Yang T. Zhang X. Wen N. Liu D. Wang Facile synthesis of new efficient Cu/MnO2 catalysts from used battery for CO oxidation J. Environ. Chem. Eng. 5 2017 5179 5186 X. Zhang, H. Li, Y. Yang, T. Zhang, X. Wen, N. Liu, D. Wang, Facile synthesis of new efficient Cu/MnO2 catalysts from used battery for CO oxidation, J. Environ. Chem. Eng. 5 (2017) 5179–5186. [3] K. Wang R. Sriphathoorat S. Luo M. Tang H. Du P.K. Shen Ultrathin PtCu hexapod nanocrystals with enhanced catalytic performance for electro–oxidation reactions J. Mater. Chem. a. 4 2016 13425 13430 K. Wang, R. Sriphathoorat, S. Luo, M. Tang, H. Du, P.K. Shen, Ultrathin PtCu hexapod nanocrystals with enhanced catalytic performance for electro–oxidation reactions, J. Mater. Chem. A. 4 (2016) 13425–13430. [4] N.S. Portillo-Vélez R. Zanella Comparative study of transition metal (Mn, Fe or Co) catalysts supported on titania: effect of Au nanoparticles addition towards CO oxidation and soot combustion reactions Chem. Eng. J. 385 2020 123848 N.S. Portillo-Vélez, R. Zanella, Comparative study of transition metal (Mn, Fe or Co) catalysts supported on titania: Effect of Au nanoparticles addition towards CO oxidation and soot combustion reactions, Chem. Eng. J. 385 (2020) 123848. [5] J. Kugai T. Moriya S. Seino T. Nakagawa Y. Ohkubo H. Nitani Y. Mizukoshi T.A. Yamamoto Effect of support for Pt–Cu bimetallic catalysts synthesized by electron beam irradiation method on preferential CO oxidation Appl. Catal. b. 126 2012 306 314 J. Kugai, T. Moriya, S. Seino, T. Nakagawa, Y. Ohkubo, H. Nitani, Y. Mizukoshi, T.A. Yamamoto, Effect of support for Pt–Cu bimetallic catalysts synthesized by electron beam irradiation method on preferential CO oxidation, Appl. Catal. B. 126 (2012) 306–314. [6] Y. Zheng L. Zhang H. Jiang C. Li Y. Hu Pd single–atom loaded Ce–Zr solid solution catalysts prepared by flame spray pyrolysis for efficient CO catalytic oxidation Small 2024 Y. Zheng, L. Zhang, H. Jiang, C. Li, Y. Hu, Pd Single–Atom Loaded Ce–Zr Solid Solution Catalysts Prepared by Flame Spray Pyrolysis for Efficient CO Catalytic Oxidation, Small. (2024). [7] A. Sandoval A. Aguilar C. Louis A. Traverse R. Zanella Bimetallic Au–Ag/TiO2 catalyst prepared by deposition–precipitation: High activity and stability in CO oxidation J. Catal. 281 2011 40 49 A. Sandoval, A. Aguilar, C. Louis, A. Traverse, R. Zanella, Bimetallic Au–Ag/TiO2 catalyst prepared by deposition–precipitation: High activity and stability in CO oxidation, J. Catal. 281 (2011) 40–49. [8] X. Liu A. Wang T. Zhang D.-S. Su C.-Y. Mou Au–Cu alloy nanoparticles supported on silica gel as catalyst for CO oxidation: effects of Au/Cu ratios Catal. Today. 160 2011 103 108 X. Liu, A. Wang, T. Zhang, D.-S. Su, C.-Y. Mou, Au–Cu alloy nanoparticles supported on silica gel as catalyst for CO oxidation: Effects of Au/Cu ratios, Catal. Today. 160 (2011) 103–108. [9] Y. Zhao J. Liu C. Liu F. Wang Y. Song Amorphous CuPt alloy nanotubes induced by Na2S2O3 as efficient catalysts for the methanol oxidation reaction ACS Catal. 6 2016 4127 4134 Y. Zhao, J. Liu, C. Liu, F. Wang, Y. Song, Amorphous CuPt Alloy Nanotubes Induced by Na2S2O3 as Efficient Catalysts for the Methanol Oxidation Reaction, ACS Catal. 6 (2016) 4127–4134. [10] S. Zhao T. Li J. Lin P. Wu Y. Li A. Li T. Chen Y. Zhao G. Chen L. Yang Y. Meng X. Jin Y. Qiu D. Ye Engineering Co3+–rich crystal planes on Co3O4 hexagonal nanosheets for CO and hydrocarbons oxidation with enhanced catalytic activity and water resistance Chem. Eng. J. 420 2021 130448 S. Zhao, T. Li, J. Lin, P. Wu, Y. Li, A. Li, T. Chen, Y. Zhao, G. Chen, L. Yang, Y. Meng, X. Jin, Y. Qiu, D. Ye, Engineering Co3+–rich crystal planes on Co3O4 hexagonal nanosheets for CO and hydrocarbons oxidation with enhanced catalytic activity and water resistance, Chem. Eng. J. 420 (2021) 130448. [11] T.S. Kim J. Kim H.C. Song D. Kim B. Jeong J. Lee J.W. Shin R. Ryoo J.Y. Park Catalytic synergy on PtNi bimetal catalysts driven by interfacial intermediate structures ACS Catal. 10 2020 10459 10467 T.S. Kim, J. Kim, H.C. Song, D. Kim, B. Jeong, J. Lee, J.W. Shin, R. Ryoo, J.Y. Park, Catalytic Synergy on PtNi Bimetal Catalysts Driven by Interfacial Intermediate Structures, ACS Catal. 10 (2020) 10459–10467. [12] O. Pozdnyakova D. Teschner A. Wootsch J. Krohnert B. Steinhauer H. Sauer L. Toth F. Jentoft A. Knopgericke Z. Paal Preferential CO oxidation in hydrogen (PROX) on ceria–supported catalysts, part I: oxidation state and surface species on Pt/CeO2 under reaction conditions J. Catal. 237 2006 1 16 O. Pozdnyakova, D. Teschner, A. Wootsch, J. Krohnert, B. Steinhauer, H. Sauer, L. Toth, F. Jentoft, A. Knopgericke, Z. Paal, Preferential CO oxidation in hydrogen (PROX) on ceria–supported catalysts, part I: Oxidation state and surface species on Pt/CeO2 under reaction conditions, J. Catal. 237 (2006) 1–16. [13] J. Chen S. Xiong H. Liu J. Shi J. Mi H. Liu Z. Gong L. Oliviero F. Maugé J. Li Reverse oxygen spillover triggered by CO adsorption on Sn–doped Pt/TiO2 for low–temperature CO oxidation Nat. Commun. 14 2023 3477 J. Chen, S. Xiong, H. Liu, J. Shi, J. Mi, H. Liu, Z. Gong, L. Oliviero, F. Maugé, J. Li, Reverse oxygen spillover triggered by CO adsorption on Sn–doped Pt/TiO2 for low–temperature CO oxidation, Nat. Commun. 14 (2023) 3477. [14] M. Wang Y. Zhang Z. Wu Y. Zheng Z. Zhou W. Weng Redox dynamics of platinum species on CeO2 during CO oxidation reaction Chem. Eng. J. 450 2022 138171 M. Wang, Y. Zhang, Z. Wu, Y. Zheng, Z. Zhou, W. Weng, Redox dynamics of platinum species on CeO2 during CO oxidation reaction, Chem. Eng. J. 450 (2022) 138171. [15] Z. Jia M. Peng X. Cai Y. Chen X. Chen F. Huang L. Zhao J. Diao N. Wang D. Xiao X. Wen Z. Jiang H. Liu D. Ma Fully exposed platinum clusters on a nanodiamond/graphene hybrid for efficient low–temperature CO oxidation ACS Catal. 12 2022 9602 9610 Z. Jia, M. Peng, X. Cai, Y. Chen, X. Chen, F. Huang, L. Zhao, J. Diao, N. Wang, D. Xiao, X. Wen, Z. Jiang, H. Liu, D. Ma, Fully Exposed Platinum Clusters on a Nanodiamond/Graphene Hybrid for Efficient Low–Temperature CO Oxidation, ACS Catal. 12 (2022) 9602–9610. [16] W. Chen J. Cao W. Fu J. Zhang G. Qian J. Yang D. Chen X. Zhou W. Yuan X. Duan Molecular–Level insights into the notorious CO poisoning of platinum catalyst Angew. Chem. Int. Ed. 61 2022 e202200190 W. Chen, J. Cao, W. Fu, J. Zhang, G. Qian, J. Yang, D. Chen, X. Zhou, W. Yuan, X. Duan, Molecular–Level Insights into the Notorious CO Poisoning of Platinum Catalyst, Angew. Chem. Int. Ed. 61 (2022) e202200190. [17] W. Liu Y. Zhang M. Wang H. Sheng B. Wang H. Li Y. Zhao L. Wang G. Chen Z. Wang The coupling synergy of active Pt species and oxygen vacancy induced by PtCu for enhanced performance towards the removal of NO and CO J. Catal. 426 2023 101 112 W. Liu, Y. Zhang, M. Wang, H. Sheng, B. Wang, H. Li, Y. Zhao, L. Wang, G. Chen, Z. Wang, The coupling synergy of active Pt species and oxygen vacancy induced by PtCu for enhanced performance towards the removal of NO and CO, J. Catal. 426 (2023) 101–112. [18] L.E. Gómez B.M. Sollier M.D. Mizrahi J.M. Ramallo López E.E. Miró A.V. Boix Preferential CO oxidation on Pt–Cu/Al2O3 catalysts with low Pt loadings Int. J. Hydrog. Energy. 39 2014 3719 3729 L.E. Gómez, B.M. Sollier, M.D. Mizrahi, J.M. Ramallo López, E.E. Miró, A.V. Boix, Preferential CO oxidation on Pt–Cu/Al2O3 catalysts with low Pt loadings, Int. J. Hydrog. Energy. 39 (2014) 3719–3729. [19] A.C. Foucher S. Yang D.J. Rosen R. Huang J.B. Pyo O. Kwon C.J. Owen D.F. Sanchez I.I. Sadykov D. Grolimund B. Kozinsky A.I. Frenkel R.J. Gorte C.B. Murray E.A. Stach Synthesis and characterization of stable Cu–Pt nanoparticles under reductive and oxidative conditions J. Am. Chem. Soc. 145 2023 5410 5421 A.C. Foucher, S. Yang, D.J. Rosen, R. Huang, J.B. Pyo, O. Kwon, C.J. Owen, D.F. Sanchez, I.I. Sadykov, D. Grolimund, B. Kozinsky, A.I. Frenkel, R.J. Gorte, C.B. Murray, E.A. Stach, Synthesis and Characterization of Stable Cu–Pt Nanoparticles under Reductive and Oxidative Conditions, J. Am. Chem. Soc. 145 (2023) 5410–5421. [20] S. Song Y. Wu S. Ge L. Wang Y. Wang Y. Guo W. Zhan Y. Guo A facile way to improve Pt atom efficiency for CO oxidation at low temperature: modification by transition metal oxides ACS Catal. 9 2019 6177 6187 S. Song, Y. Wu, S. Ge, L. Wang, Y. Wang, Y. Guo, W. Zhan, Y. Guo, A Facile Way To Improve Pt Atom Efficiency for CO Oxidation at Low Temperature: Modification by Transition Metal Oxides, ACS Catal. 9 (2019) 6177–6187. [21] Y. Li J. Ying T. He G. Li H. Zhang S. Huang T. Huang W. Liu H. Peng Ultra-Small Pt–Ni bimetallic nanoparticles confined in dendritic mesoporous silica with remarkable CO catalytic oxidation performance Ind. Eng. Chem. Res. 62 2023 9159 9168 Y. Li, J. Ying, T. He, G. Li, H. Zhang, S. Huang, T. Huang, W. Liu, H. Peng, Ultra-Small Pt–Ni Bimetallic Nanoparticles Confined in Dendritic Mesoporous Silica with Remarkable CO Catalytic Oxidation Performance, Ind. Eng. Chem. Res. 62 (2023) 9159–9168. [22] Z. Zhang L. Fan W. Liao F. Zhao C. Tang J. Zhang M. Feng J.-Q. Lu Structure sensitivity of CuO in CO oxidation over CeO2–CuO/Cu2O catalysts J. Catal. 405 2022 333 345 Z. Zhang, L. Fan, W. Liao, F. Zhao, C. Tang, J. Zhang, M. Feng, J.-Q. Lu, Structure sensitivity of CuO in CO oxidation over CeO2–CuO/Cu2O catalysts, J. Catal. 405 (2022) 333–345. [23] S. Zhao P. Wu J. Lin Y. Li A. Li X. Jin Y. Chen B. Zhao Y. Zhao G. Chen Y. Qiu D. Ye S. Yang Unveiling the water-resistant mechanism of Cu(I)–O–Co interfaces for catalytic oxidation Chem. Eng. J. 429 2022 132219 S. Zhao, P. Wu, J. Lin, Y. Li, A. Li, X. Jin, Y. Chen, B. Zhao, Y. Zhao, G. Chen, Y. Qiu, D. Ye, S. Yang, Unveiling the water-resistant mechanism of Cu(I)–O–Co interfaces for catalytic oxidation, Chem. Eng. J. 429 (2022) 132219. [24] W. Chen J. Xu F. Huang C. Zhao Y. Guan Y. Fang J. Hu W. Yang Z. Luo Y. Guo CO oxidation over CuOx/TiO2 catalyst: the importance of oxygen vacancies and Cu+ species Appl. Surf. Sci. 618 2023 156539 W. Chen, J. Xu, F. Huang, C. Zhao, Y. Guan, Y. Fang, J. Hu, W. Yang, Z. Luo, Y. Guo, CO oxidation over CuOx/TiO2 catalyst: The importance of oxygen vacancies and Cu+ species, Appl. Surf. Sci. 618 (2023) 156539. [25] X. Zhang H. Fan X. Lu L. Guo D. Du H. Shan L. Geng O. Akdim X. Huang G.-S. Park N. Zhang R. Oh B. Chen Enhanced redox catalysis of electrochemical alcohol oxidation in alkaline medium by using Pt–Cu/C catalyst J. Alloys Compd. 926 2022 166994 X. Zhang, H. Fan, X. Lu, L. Guo, D. Du, H. Shan, L. Geng, O. Akdim, X. Huang, G.-S. Park, N. Zhang, R. Oh, B. Chen, Enhanced redox catalysis of electrochemical alcohol oxidation in alkaline medium by using Pt–Cu/C catalyst, J. Alloys Compd. 926 (2022) 166994. [26] Y. Liu A. Zhang L. Xue H. Zhang Y. Hao Y. Wang J. Wu S. Zeng Dual active sites of CO adsorption and activation over PtCu alloy nanocages for preferential oxidation of carbon monoxide ACS Appl. Energy Mater. 5 2022 604 614 Y. Liu, A. Zhang, L. Xue, H. Zhang, Y. Hao, Y. Wang, J. Wu, S. Zeng, Dual Active Sites of CO Adsorption and Activation over PtCu Alloy Nanocages for Preferential Oxidation of Carbon Monoxide, ACS Appl. Energy Mater. 5 (2022) 604–614. [27] R.V. Gonçalves R. Wojcieszak H. Wender C. Sato B. Dias L.L.R. Vono D. Eberhardt S.R. Teixeira L.M. Rossi Easy access to metallic copper nanoparticles with high activity and stability for CO oxidation ACS Appl. Mater. Interfaces. 7 2015 7987 7994 R.V. Gonçalves, R. Wojcieszak, H. Wender, C. Sato B. Dias, L.L.R. Vono, D. Eberhardt, S.R. Teixeira, L.M. Rossi, Easy Access to Metallic Copper Nanoparticles with High Activity and Stability for CO Oxidation, ACS Appl. Mater. Interfaces. 7 (2015) 7987-7994. [28] Y. Fang X. Chi L. Li J. Yang S. Liu X. Lu W. Xiao L. Wang Z. Luo W. Yang S. Hu J. Xiong S. Hoang H. Deng F. Liu L. Zhang P. Gao J. Ding Y. Guo Elucidating the nature of the Cu(I) active site in CuO/TiO2 for excellent low-temperature CO oxidation ACS Appl. Mater. Interfaces. 12 2020 7091 7101 Y. Fang, X. Chi, L. Li, J. Yang, S. Liu, X. Lu, W. Xiao, L. Wang, Z. Luo, W. Yang, S. Hu, J. Xiong, S. Hoang, H. Deng, F. Liu, L. Zhang, P. Gao, J. Ding, Y. Guo, Elucidating the Nature of the Cu(I) Active Site in CuO/TiO2 for Excellent Low-Temperature CO Oxidation, ACS Appl. Mater. Interfaces. 12 (2020) 7091–7101. [29] A.E. Baber F. Xu F. Dvorak K. Mudiyanselage M. Soldemo J. Weissenrieder S.D. Senanayake J.T. Sadowski J.A. Rodriguez V. Matolín M.G. White D.J. Stacchiola In situ imaging of Cu2O under reducing conditions: formation of metallic fronts by mass transfer J. Am. Chem. Soc. 135 2013 16781 16784 A.E. Baber, F. Xu, F. Dvorak, K. Mudiyanselage, M. Soldemo, J. Weissenrieder, S.D. Senanayake, J.T. Sadowski, J.A. Rodriguez, V. Matolín, M.G. White, D.J. Stacchiola, In Situ Imaging of Cu2O under Reducing Conditions: Formation of Metallic Fronts by Mass Transfer, J. Am. Chem. Soc. 135 (2013) 16781-16784. [30] B. Eren C. Heine H. Bluhm G.A. Somorjai M. Salmeron Catalyst chemical state during CO oxidation reaction on Cu(111) studied with ambient–pressure X–ray photoelectron spectroscopy and near edge X–ray adsorption fine structure spectroscopy J. Am. Chem. Soc. 137 2015 11186 11190 B. Eren, C. Heine, H. Bluhm, G.A. Somorjai, M. Salmeron, Catalyst Chemical State during CO Oxidation Reaction on Cu(111) Studied with Ambient–Pressure X–ray Photoelectron Spectroscopy and Near Edge X–ray Adsorption Fine Structure Spectroscopy, J. Am. Chem. Soc. 137 (2015) 11186–11190. [31] Y. Jiang A.M.H. Lim H. Yan H.C. Zeng U. Mirsaidov Phase segregation in PdCu alloy nanoparticles during CO Oxidation reaction at atmospheric pressure Adv. Sci. 10 2023 Y. Jiang, A.M.H. Lim, H. Yan, H.C. Zeng, U. Mirsaidov, Phase Segregation in PdCu Alloy Nanoparticles During CO Oxidation Reaction at Atmospheric Pressure, Adv. Sci. 10 (2023). [32] T.-S. Kim H. Choi D. Kim H.C. Song Y. Oh B. Jeong J. Lee K.-J. Kim J.W. Shin H.R. Byon R. Ryoo H.Y. Kim J.Y. Park Catalytic boosting on AuCu bimetallic nanoparticles by oxygen-induced atomic restructuring Appl. Catal. B. 331 2023 122704 T.-S. Kim, H. Choi, D. Kim, H.C. Song, Y. Oh, B. Jeong, J. Lee, K.-J. Kim, J.W. Shin, H.R. Byon, R. Ryoo, H.Y. Kim, J.Y. Park, Catalytic boosting on AuCu bimetallic nanoparticles by oxygen-induced atomic restructuring, Appl. Catal. B. 331 (2023) 122704. [33] L. Luo L. Zhang Z. Duan A.S. Lapp G. Henkelman R.M. Crooks Efficient CO oxidation using dendrimer–encapsulated Pt nanoparticles activated with <2% Cu surface atoms ACS Nano 10 2016 8760 8769 L. Luo, L. Zhang, Z. Duan, A.S. Lapp, G. Henkelman, R.M. Crooks, Efficient CO Oxidation Using Dendrimer–Encapsulated Pt Nanoparticles Activated with <2% Cu Surface Atoms, ACS Nano. 10 (2016) 8760-8769. [34] G. Kresse J. Furthmüller Efficient iterative schemes for ab initio total-energy calculations using a plane–wave basis set Phys. Rev. B. 54 1996 11169 11186 G. Kresse, J. Furthmüller, Efficient iterative schemes for ab initio total-energy calculations using a plane–wave basis set, Phys. Rev. B. 54 (1996) 11169–11186. [35] G. Kresse J. Furthmüller Efficiency of ab–initio total energy calculations for metals and semiconductors using a plane–wave basis set Comput. Mater. Sci. 6 1996 15 50 G. Kresse, J. Furthmüller, Efficiency of ab–initio total energy calculations for metals and semiconductors using a plane–wave basis set, Comput. Mater. Sci. 6 (1996) 15–50. [36] J.P. Perdew K. Burke M. Ernzerhof Generalized gradient approximation made simple Phys. Rev. Lett. 77 1996 3865 3868 J.P. Perdew, K. Burke, M. Ernzerhof, Generalized Gradient Approximation Made Simple, Phys. Rev. Lett. 77 (1996) 3865–3868. [37] T.F. Zhang M.Y. Li P. Zheng J. Li J.J. Gao H.Y. He F.N. Gu W.X. Chen Y.J. Ji Z.Y. Zhong D.R. Bai G.W. Xu F.B. Su Highly Efficient hydrosilylation of ethyne over Pt/ZrO2 catalysts with size–dependent metal–support interactions Ind. Eng. Chem. Res. 61 2022 18703 18711 T.F. Zhang, M.Y. Li, P. Zheng, J. Li, J.J. Gao, H.Y. He, F.N. Gu, W.X. Chen, Y.J. Ji, Z.Y. Zhong, D.R. Bai, G.W. Xu, F.B. Su, Highly Efficient Hydrosilylation of Ethyne over Pt/ZrO2 Catalysts with Size–Dependent Metal–Support Interactions, Ind. Eng. Chem. Res. 61 (2022) 18703–18711. [38] Q. Wang J. Gong H. Zhang Q.-Y. Fan L. Xue J. Wu J. Li Y. Wang Z. Liu R. Gao S. Zeng Co–promotion of two–type active sites: PtCu single–atom alloy and copper–ceria interface for preferential oxidation of CO Appl. Catal. B. 306 2022 Q. Wang, J. Gong, H. Zhang, Q.-Y. Fan, L. Xue, J. Wu, J. Li, Y. Wang, Z. Liu, R. Gao, S. Zeng, Co–promotion of two–type active sites: PtCu single–atom alloy and copper–ceria interface for preferential oxidation of CO, Appl. Catal. B. 306 (2022). [39] S. Ding H.-A. Chen O. Mekasuwandumrong M.J. Hülsey X. Fu Q. He J. Panpranot C.-M. Yang N. Yan High-temperature flame spray pyrolysis induced stabilization of Pt single–atom catalysts Appl. Catal. B. 281 2021 119471 S. Ding, H.-A. Chen, O. Mekasuwandumrong, M.J. Hülsey, X. Fu, Q. He, J. Panpranot, C.-M. Yang, N. Yan, High-temperature flame spray pyrolysis induced stabilization of Pt single–atom catalysts, Appl. Catal. B. 281 (2021) 119471. [40] X. Zhang G. Cui H. Feng L. Chen H. Wang B. Wang X. Zhang L. Zheng S. Hong M. Wei Platinum–copper single atom alloy catalysts with high performance towards glycerol hydrogenolysis Nat. Commun. 10 2019 X. Zhang, G. Cui, H. Feng, L. Chen, H. Wang, B. Wang, X. Zhang, L. Zheng, S. Hong, M. Wei, Platinum–copper single atom alloy catalysts with high performance towards glycerol hydrogenolysis, Nat. Commun. 10 (2019). [41] Z. Tang P. Liu H. Cao S. Bals H.J. Heeres P.P. Pescarmona Pt/ZrO2 prepared by atomic trapping: an efficient catalyst for the conversion of glycerol to lactic acid with concomitant transfer hydrogenation of cyclohexene ACS Catal. 9 2019 9953 9963 Z. Tang, P. Liu, H. Cao, S. Bals, H.J. Heeres, P.P. Pescarmona, Pt/ZrO2 Prepared by Atomic Trapping: An Efficient Catalyst for the Conversion of Glycerol to Lactic Acid with Concomitant Transfer Hydrogenation of Cyclohexene, ACS Catal. 9 (2019) 9953–9963. [42] J. Yu S. Liu X. Mu G. Yang X. Luo E. Lester T. Wu Cu–ZrO2 catalysts with highly dispersed Cu nanoclusters derived from ZrO2@ HKUST–1 composites for the enhanced CO2 hydrogenation to methanol Chem. Eng. J. 419 2021 129656 J. Yu, S. Liu, X. Mu, G. Yang, X. Luo, E. Lester, T. Wu, Cu–ZrO2 catalysts with highly dispersed Cu nanoclusters derived from ZrO2@ HKUST–1 composites for the enhanced CO2 hydrogenation to methanol, Chem. Eng. J. 419 (2021) 129656. [43] X. Wei A.-Q. Wang X.-F. Yang L. Li T. Zhang Synthesis of Pt–Cu/SiO2 catalysts with different structures and their application in hydrodechlorination of 1,2–dichloroethane Appl. Catal. B. 121–122 2012 105 114 X. Wei, A.-Q. Wang, X.-F. Yang, L. Li, T. Zhang, Synthesis of Pt–Cu/SiO2 catalysts with different structures and their application in hydrodechlorination of 1,2–dichloroethane, Appl. Catal. B. 121–122 (2012) 105–114. [44] J. Kong S. Song W. Zhao Z. Yu Z. Xiang G. Li W. Zhang T. An Unraveling a trade–off between positive effect and poisoning mechanism of soot over low-dose PtCu/CeO2 for simultaneously photothermocatalytic removal of VOCs and soot Appl. Catal. B. 339 2023 123118 J. Kong, S. Song, W. Zhao, Z. Yu, Z. Xiang, G. Li, W. Zhang, T. An, Unraveling a trade–off between positive effect and poisoning mechanism of soot over low-dose PtCu/CeO2 for simultaneously photothermocatalytic removal of VOCs and soot, Appl. Catal. B. 339 (2023) 123118. [45] Z. Ren Z. Wu W. Song W. Xiao Y. Guo J. Ding S.L. Suib P.-X. Gao Low temperature propane oxidation over Co3O4 based nano–array catalysts: Ni dopant effect, reaction mechanism and structural stability Appl. Catal. B. 180 2016 150 160 Z. Ren, Z. Wu, W. Song, W. Xiao, Y. Guo, J. Ding, S.L. Suib, P.-X. Gao, Low temperature propane oxidation over Co3O4 based nano–array catalysts: Ni dopant effect, reaction mechanism and structural stability, Appl. Catal. B. 180 (2016) 150–160. [46] Y. Yu X.a. Dong P. Chen Q. Geng H. Wang J. Li Y. Zhou F. Dong Synergistic effect of Cu single atoms and Au–Cu alloy nanoparticles on TiO2 for efficient CO2 photoreduction ACS Nano 15 2021 14453 14464 Y. Yu, X.a. Dong, P. Chen, Q. Geng, H. Wang, J. Li, Y. Zhou, F. Dong, Synergistic Effect of Cu Single Atoms and Au–Cu Alloy Nanoparticles on TiO2 for Efficient CO2 Photoreduction, ACS Nano. 15 (2021) 14453–14464. [47] Y. Tuo Q. Lu C. Chen T. Liu Y. Pan Y. Zhou J. Zhang The facile synthesis of core–shell PtCu nanoparticles with superior electrocatalytic activity and stability in the hydrogen evolution reaction RSC Adv. 11 2021 26326 26335 Y. Tuo, Q. Lu, C. Chen, T. Liu, Y. Pan, Y. Zhou, J. Zhang, The facile synthesis of core–shell PtCu nanoparticles with superior electrocatalytic activity and stability in the hydrogen evolution reaction, RSC Adv. 11 (2021) 26326–26335. [48] S. Polisski B. Goller K. Wilson D. Kovalev V. Zaikowskii A. Lapkin In situ synthesis and catalytic activity in CO oxidation of metal nanoparticles supported on porous nanocrystalline silicon J. Catal. 271 2010 59 66 S. Polisski, B. Goller, K. Wilson, D. Kovalev, V. Zaikowskii, A. Lapkin, In situ synthesis and catalytic activity in CO oxidation of metal nanoparticles supported on porous nanocrystalline silicon, J. Catal. 271 (2010) 59–66. [49] S.R. Teeparthi E.W. Awin R. Kumar Dominating role of crystal structure over defect chemistry in black and white zirconia on visible light photocatalytic activity Sci. Rep. 8 2018 S.R. Teeparthi, E.W. Awin, R. Kumar, Dominating role of crystal structure over defect chemistry in black and white zirconia on visible light photocatalytic activity, Sci. Rep. 8 (2018). [50] Y. Li D. He H. Zhao M. Pei Y. Fan H. Xu J. Wang Y. Chen Revealing the roles of Zr on enhanced H2–SCR performances on Pt/TiO2 catalyst Chem. Eng. J. 490 2024 151714 Y. Li, D. He, H. Zhao, M. Pei, Y. Fan, H. Xu, J. Wang, Y. Chen, Revealing the roles of Zr on enhanced H2–SCR performances on Pt/TiO2 catalyst, Chem. Eng. J. 490 (2024) 151714. [51] S. Peng R. Li Y. Huang Y. Zhang J.-J. Cao S. Lee Interfacial dependent reactive oxygen species generation over Pt–ZrO2 nanoparticles for catalytic oxidation of formaldehyde at room temperature Appl. Surf. Sci. 600 2022 154056 S. Peng, R. Li, Y. Huang, Y. Zhang, J.-j. Cao, S. Lee, Interfacial dependent reactive oxygen species generation over Pt–ZrO2 nanoparticles for catalytic oxidation of formaldehyde at room temperature, Appl. Surf. Sci. 600 (2022) 154056. [52] I.A. Ivanin O.V. Udalova I.Y. Kaplin M.I. Shilina New insights on the Cu–Ce interaction in Cu/Ce catalysts based on ZSM-5 and Beta for the preferential oxidation of carbon monoxide in excess hydrogen Appl. Surf. Sci. 655 2024 159577 I.A. Ivanin, O.V. Udalova, I.Y. Kaplin, M.I. Shilina, New insights on the Cu–Ce interaction in Cu/Ce catalysts based on ZSM-5 and Beta for the preferential oxidation of carbon monoxide in excess hydrogen, Appl. Surf. Sci. 655 (2024) 159577. [53] J. Gao C. Jia L. Zhang H. Wang Y. Yang S.-F. Hung Y.-Y. Hsu B. Liu Tuning chemical bonding of MnO2 through transition-metal doping for enhanced CO oxidation J. Catal. 341 2016 82 90 J. Gao, C. Jia, L. Zhang, H. Wang, Y. Yang, S.-F. Hung, Y.-Y. Hsu, B. Liu, Tuning chemical bonding of MnO2 through transition-metal doping for enhanced CO oxidation, J. Catal. 341 (2016) 82–90. [54] A. Sandoval C. Louis R. Zanella Improved activity and stability in CO oxidation of bimetallic Au–Cu/TiO2 catalysts prepared by deposition–precipitation with urea Appl. Catal. B. 140–141 2013 363 377 A. Sandoval, C. Louis, R. Zanella, Improved activity and stability in CO oxidation of bimetallic Au–Cu/TiO2 catalysts prepared by deposition–precipitation with urea, Appl. Catal. B. 140–141 (2013) 363–377. [55] Z. Zhang D. Zhang D. Li L. He Z. Guo G. Yeli X. Zhang B. Liu H. Tan F. Zhang X. Chen J. Li X. Xu Oxygen vacancies promote the activation of O2 in transition metal oxide doped ε–MnO2 for low–temperature CO oxidation Sep. Purif. 352 2025 128109 Z. Zhang, D. Zhang, D. Li, L. He, Z. Guo, G. Yeli, X. Zhang, B. Liu, H. Tan, F. Zhang, X. Chen, J. Li, X. Xu, Oxygen vacancies promote the activation of O2 in transition metal oxide doped ε–MnO2 for low–temperature CO oxidation, Sep. Purif. 352 (2025) 128109. [56] R. Kang X. Wei F. Bin Z. Wang Q. Hao B. Dou Reaction mechanism and kinetics of CO oxidation over a CuO/Ce0.75Zr0.25O2-δ catalyst Appl. Catal. A-Gen. 565 2018 46 58 R. Kang, X. Wei, F. Bin, Z. Wang, Q. Hao, B. Dou, Reaction mechanism and kinetics of CO oxidation over a CuO/Ce0.75Zr0.25O2-δ catalyst, Appl Catal A-Gen. 565 (2018) 46–58. [57] J. Wang Z. Wang C.-J. Liu Enhanced activity for CO oxidation over WO3 nanolamella supported Pt catalyst ACS Appl. Mater. 6 2014 12860 12867 J. Wang, Z. Wang, C.-J. Liu, Enhanced Activity for CO Oxidation over WO3 Nanolamella Supported Pt Catalyst, ACS Appl. Mater. 6 (2014) 12860-12867. [58] C. Wang X.-K. Gu H. Yan Y. Lin J. Li D. Liu W.-X. Li J. Lu Water–mediated mars–van krevelen mechanism for CO oxidation on ceria–supported single–atom Pt1 catalyst ACS Catal. 7 2017 887 891 C. Wang, X.-K. Gu, H. Yan, Y. Lin, J. Li, D. Liu, W.-X. Li, J. Lu, Water–Mediated Mars–Van Krevelen Mechanism for CO Oxidation on Ceria–Supported Single–Atom Pt1 Catalyst, ACS Catal. 7 (2017) 887-891. [59] M. Moses-DeBusk M. Yoon L.F. Allard D.R. Mullins Z. Wu X. Yang G. Veith G.M. Stocks C.K. Narula CO Oxidation on supported Single Pt atoms: experimental and ab initio density functional studies of CO interaction with Pt atom on θ–Al2O3(010) surface J. Am. Chem. Soc. 135 2013 12634 12645 M. Moses-DeBusk, M. Yoon, L.F. Allard, D.R. Mullins, Z. Wu, X. Yang, G. Veith, G.M. Stocks, C.K. Narula, CO Oxidation on Supported Single Pt Atoms: Experimental and ab Initio Density Functional Studies of CO Interaction with Pt Atom on θ–Al2O3(010) Surface, J. Am. Chem. Soc. 135 (2013) 12634–12645. [60] X. Liu S. Jia M. Yang Y. Tang Y. Wen S. Chu J. Wang B. Shan R. Chen Activation of subnanometric Pt on Cu–modified CeO2 via redox–coupled atomic layer deposition for CO oxidation Nat. Commun. 11 2020 4240 X. Liu, S. Jia, M. Yang, Y. Tang, Y. Wen, S. Chu, J. Wang, B. Shan, R. Chen, Activation of subnanometric Pt on Cu–modified CeO2 via redox–coupled atomic layer deposition for CO oxidation, Nat. Commun. 11 (2020) 4240. [61] J. Yang S. Hu Y. Fang S. Hoang L. Li W. Yang Z. Liang J. Wu J. Hu W. Xiao C. Pan Z. Luo J. Ding L. Zhang Y. Guo Oxygen vacancy promoted O2 activation over perovskite oxide for low–temperature CO oxidation ACS Catal. 9 2019 9751 9763 J. Yang, S. Hu, Y. Fang, S. Hoang, L. Li, W. Yang, Z. Liang, J. Wu, J. Hu, W. Xiao, C. Pan, Z. Luo, J. Ding, L. Zhang, Y. Guo, Oxygen Vacancy Promoted O2 Activation over Perovskite Oxide for Low–Temperature CO Oxidation, ACS Catal. 9 (2019) 9751–9763. [62] G. Sun Z. Zhao R. Mu S. Zha L. Li S. Chen K. Zang J. Luo Z. Li S.C. Purdy A.J. Kropf J.T. Miller L. Zeng J. Gong Breaking the scaling relationship via thermally stable Pt/Cu single atom alloys for catalytic dehydrogenation Nat Commun. 9 2018 4454 G. Sun, Z. Zhao, R. Mu, S. Zha, L. Li, S. Chen, K. Zang, J. Luo, Z. Li, S.C. Purdy, A.J. Kropf, J.T. Miller, L. Zeng, J. Gong, Breaking the scaling relationship via thermally stable Pt/Cu single atom alloys for catalytic dehydrogenation, Nat Commun. 9 (2018) 4454. [63] J. Liu F.R. Lucci M. Yang S. Lee M.D. Marcinkowski A.J. Therrien C.T. Williams E.C.H. Sykes M. Flytzani-Stephanopoulos Tackling CO poisoning with single–atom alloy catalysts J. Am. Chem. Soc. 138 2016 6396 6399 J. Liu, F.R. Lucci, M. Yang, S. Lee, M.D. Marcinkowski, A.J. Therrien, C.T. Williams, E.C.H. Sykes, M. Flytzani-Stephanopoulos, Tackling CO Poisoning with Single–Atom Alloy Catalysts, J. Am. Chem. Soc. 138 (2016) 6396-6399. [64] Z.-Q. Zou M. Meng Y.-Q. Zha Surfactant–Assisted synthesis, characterizations, and catalytic oxidation mechanisms of the mesoporous MnOx−CeO2 and Pd/MnOx−CeO2 catalysts used for CO and C3H8 oxidation J. Phys. Chem. C. 114 2010 468 477 Z.-Q. Zou, M. Meng, Y.-Q. Zha, Surfactant–Assisted Synthesis, Characterizations, and Catalytic Oxidation Mechanisms of the Mesoporous MnOx−CeO2 and Pd/MnOx−CeO2 Catalysts Used for CO and C3H8 Oxidation, J. Phys. Chem. C. 114 (2010) 468–477. [65] D.G. Araiza C.A. Celaya D.A. Solís-Casados J. Muñiz R. Zanella Unveiling the structural behavior of bimetallic AuCu/TiO2 catalysts in the CO oxidation: a combined in–situ spectroscopic and theoretical study Chem. Eng. J. 494 2024 152921 D.G. Araiza, C.A. Celaya, D.A. Solís-Casados, J. Muñiz, R. Zanella, Unveiling the structural behavior of bimetallic AuCu/TiO2 catalysts in the CO oxidation: A combined in–situ spectroscopic and theoretical study, Chem. Eng. J. 494 (2024) 152921. [66] Y. Li L. Guo M. Du C. Tian G. Zhao Z. Liu Z. Liang K. Hou J. Chen X. Liu L. Jiang B. Nan L. Li Unraveling distinct effects between CuOx and PtCu alloy sites in Pt−Cu bimetallic catalysts for CO oxidation at different temperatures Nat. Commun. 15 2024 5598 Y. Li, L. Guo, M. Du, C. Tian, G. Zhao, Z. Liu, Z. Liang, K. Hou, J. Chen, X. Liu, L. Jiang, B. Nan, L. Li, Unraveling distinct effects between CuOx and PtCu alloy sites in Pt−Cu bimetallic catalysts for CO oxidation at different temperatures, Nat Commun. 15 (2024) 5598. [67] W. Wang W. Yu P. Du H. Xu Z. Jin R. Si C. Ma S. Shi C. Jia C. Yan Crystal plane effect of ceria on supported copper oxide cluster catalyst for CO oxidation: importance of metal–support interaction ACS Catal. 7 2017 1313 1329 W. Wang, W. Yu, P. Du, H. Xu, Z. Jin, R. Si, C. Ma, S. Shi, C. Jia, C. Yan, Crystal Plane Effect of Ceria on Supported Copper Oxide Cluster Catalyst for CO Oxidation: Importance of Metal–Support Interaction, ACS Catal. 7 (2017) 1313–1329. [68] C. Yin F.R. Negreiros G. Barcaro A. Beniya L. Sementa E.C. Tyo S. Bartling K.-H. Meiwes-Broer S. Seifert H. Hirata N. Isomura S. Nigam C. Majumder Y. Watanabe A. Fortunelli S. Vajda Alumina-supported sub-nanometer Pt10 clusters: amorphization and role of the support material in a highly active CO oxidation catalyst J. Mater. Chem. A. 5 2017 4923 4931 C. Yin, F.R. Negreiros, G. Barcaro, A. Beniya, L. Sementa, E.C. Tyo, S. Bartling, K.-H. Meiwes-Broer, S. Seifert, H. Hirata, N. Isomura, S. Nigam, C. Majumder, Y. Watanabe, A. Fortunelli, S. Vajda, Alumina-supported sub-nanometer Pt10 clusters: amorphization and role of the support material in a highly active CO oxidation catalyst, J. Mater. Chem. A. 5 (2017) 4923-4931. [69] V. Fung D.-E. Jiang Exploring structural diversity and fluxionality of Ptn (n = 10–13) clusters from first-principles J. Phys. Chem. C. 121 2017 10796 10802 V. Fung, D.-e. Jiang, Exploring Structural Diversity and Fluxionality of Ptn (n = 10–13) Clusters from First-Principles, J. Phys. Chem. C. 121 (2017) 10796-10802. [70] Y. Jia X. Yu H. Zhang L. Cheng Z. Luo Tetrahedral Pt10–Cluster with unique beta aromaticity and superatomic feature in mimicking methane J. Phys. Chem. Lett. 12 2021 5115 5122 Y. Jia, X. Yu, H. Zhang, L. Cheng, Z. Luo, Tetrahedral Pt10–Cluster with Unique Beta Aromaticity and Superatomic Feature in Mimicking Methane, J. Phys. Chem. Lett. 12 (2021) 5115-5122. [71] L. Zhang H.Y. Kim G. Henkelman CO Oxidation at the Au–Cu interface of bimetallic nanoclusters supported on CeO2(111) J. Phys. Chem. Lett. 4 2013 2943 2947 L. Zhang, H.Y. Kim, G. Henkelman, CO Oxidation at the Au–Cu Interface of Bimetallic Nanoclusters Supported on CeO2(111), J. Phys. Chem. Lett. 4 (2013) 2943-2947. [72] Y. Fang Q. Zhang H. Zhang X. Li W. Chen J. Xu H. Shen J. Yang C. Pan Y. Zhu J. Wang Z. Luo L. Wang X. Bai F. Song L. Zhang Y. Guo Dual activation of molecular oxygen and surface lattice oxygen in single atom Cu1/TiO2 catalyst for CO Oxidation Angew. Chem. Int. Ed. 61 2022 Y. Fang, Q. Zhang, H. Zhang, X. Li, W. Chen, J. Xu, H. Shen, J. Yang, C. Pan, Y. Zhu, J. Wang, Z. Luo, L. Wang, X. Bai, F. Song, L. Zhang, Y. Guo, Dual Activation of Molecular Oxygen and Surface Lattice Oxygen in Single Atom Cu1/TiO2 Catalyst for CO Oxidation, Angew. Chem. Int. Ed. 61 (2022). [73] Y. Lu J. Wang L. Yu L. Kovarik X. Zhang A.S. Hoffman A. Gallo S.R. Bare D. Sokaras T. Kroll V. Dagle H. Xin A.M. Karim Identification of the active complex for CO oxidation over single-atom Ir-on-MgAl2O4 catalysts Nat. Catal. 2 2018 149 156 Y. Lu, J. Wang, L. Yu, L. Kovarik, X. Zhang, A.S. Hoffman, A. Gallo, S.R. Bare, D. Sokaras, T. Kroll, V. Dagle, H. Xin, A.M. Karim, Identification of the active complex for CO oxidation over single-atom Ir-on-MgAl2O4 catalysts, Nat. Catal. 2 (2018) 149-156. [74] P. Zang J. Liu Y. He G. Zhang G. Li Y. Wang Y. Lv LDH-derived preparation of CuMgFe layered double oxides for NH3-SCR and CO oxidation reactions: performance study and synergistic mechanism Chem. Eng. J. 446 2022 137414 P. Zang, J. Liu, Y. He, G. Zhang, G. Li, Y. Wang, Y. Lv, LDH-derived preparation of CuMgFe layered double oxides for NH3-SCR and CO oxidation reactions: Performance study and synergistic mechanism, Chem. Eng. J. 446 (2022) 137414. [75] Y. Pan L. Xu L. Huang W. He H. Li S. Wang Z. Long Z. Sun Identification of active sites in Pt–Co bimetallic catalysts for CO oxidation ACS Appl. Energy Mater. 4 2021 11151 11161 Y. Pan, L. Xu, L. Huang, W. He, H. Li, S. Wang, Z. Long, Z. Sun, Identification of Active Sites in Pt–Co Bimetallic Catalysts for CO Oxidation, ACS Appl. Energy Mater. 4 (2021) 11151–11161.",
      "scopus-id": "85217823117",
      "coredata": {
        "eid": "1-s2.0-S0021951725000600",
        "dc:description": "Catalytic oxidation processes for carbon monoxide (CO) typically rely on catalysts made from noble metals. However, due to the scarcity and high cost of noble metals, developing low–cost, highly active, and stable catalysts with low noble metal loading is highly demanded but challenging. Herein, we synthesized ZrO2–supported CuPt alloy nanoparticle (NP) catalyst (0.3Cu0.1Pt/ZrO2), with a Cu loading of 0.3 wt% and a Pt loading of 0.1 wt%, using a straightforward impregnation method. This catalyst structure enables the well-mixing of Cu and Pt atoms in the pristine and partially oxidized catalysts during the CO oxidation. The temperature for 0.3Cu0.1Pt/ZrO2 to reach 90 % CO conversion is 160 °C, which is much lower than those for 0.1Pt/ZrO2 (220 °C) and 0.4Cu/ZrO2 (195 °C). Extensive characterizations were conducted, particularly for the pristine catalysts. The experiments and density functional theory (DFT) calculations results reveal that the interaction between the two metals significantly modified the electronic property of the catalyst. On CuPt bimetallic sites, the electron transfer from Cu to Pt weakens the strong adsorption of CO, and Cu species provide sites for O2 adsorption, which synergistically promotes the CO oxidation on the surface of CuPt NPs. This research provides deep insights into the relationship between the catalyst structure and their catalytic performance and paves the way for developing highly active bimetallic synergistic catalysts for CO oxidation.",
        "openArchiveArticle": "false",
        "prism:coverDate": "2025-04-30",
        "openaccessUserLicense": null,
        "prism:aggregationType": "Journal",
        "prism:url": "https://api.elsevier.com/content/article/pii/S0021951725000600",
        "dc:creator": [
          {
            "@_fa": "true",
            "$": "Xu, Lianxin"
          },
          {
            "@_fa": "true",
            "$": "Zheng, Peng"
          },
          {
            "@_fa": "true",
            "$": "Tian, Junbo"
          },
          {
            "@_fa": "true",
            "$": "Zhang, Tengfei"
          },
          {
            "@_fa": "true",
            "$": "Jiang, Renzheng"
          },
          {
            "@_fa": "true",
            "$": "Gao, Jiajian"
          },
          {
            "@_fa": "true",
            "$": "Zhang, Lili"
          },
          {
            "@_fa": "true",
            "$": "Xu, Guangwen"
          },
          {
            "@_fa": "true",
            "$": "Zhong, Ziyi"
          },
          {
            "@_fa": "true",
            "$": "Su, Fabing"
          }
        ],
        "link": [
          {
            "@_fa": "true",
            "@rel": "self",
            "@href": "https://api.elsevier.com/content/article/pii/S0021951725000600"
          },
          {
            "@_fa": "true",
            "@rel": "scidir",
            "@href": "https://www.sciencedirect.com/science/article/pii/S0021951725000600"
          }
        ],
        "dc:format": "application/json",
        "openaccessType": null,
        "pii": "S0021-9517(25)00060-0",
        "prism:volume": "444",
        "articleNumber": "115995",
        "prism:publisher": "Elsevier Inc. All rights are reserved, including those for text and data mining, AI training, and similar technologies.",
        "dc:title": "Understanding the synergetic catalytic functions of Cu–Pt active sites in the bimetallic CuPt/ZrO2 catalyst in CO oxidation",
        "prism:copyright": "© 2025 Elsevier Inc. All rights are reserved, including those for text and data mining, AI training, and similar technologies.",
        "openaccess": "0",
        "prism:issn": "00219517",
        "dcterms:subject": [
          {
            "@_fa": "true",
            "$": "CuPt bimetallic catalysts"
          },
          {
            "@_fa": "true",
            "$": "CO oxidation"
          },
          {
            "@_fa": "true",
            "$": "Competitive adsorption"
          },
          {
            "@_fa": "true",
            "$": "Catalytic performance"
          },
          {
            "@_fa": "true",
            "$": "Interfacial structure"
          }
        ],
        "openaccessArticle": "false",
        "prism:publicationName": "Journal of Catalysis",
        "openaccessSponsorType": null,
        "prism:pageRange": "115995",
        "pubType": "fla",
        "prism:coverDisplayDate": "April 2025",
        "prism:doi": "10.1016/j.jcat.2025.115995",
        "prism:startingPage": "115995",
        "dc:identifier": "doi:10.1016/j.jcat.2025.115995",
        "openaccessSponsorName": null
      },
      "objects": {
        "object": [
          {
            "@category": "standard",
            "@height": "359",
            "@width": "671",
            "@_fa": "true",
            "$": "https://api.elsevier.com/content/object/eid/1-s2.0-S0021951725000600-gr8.jpg?httpAccept=%2A%2F%2A",
            "@multimediatype": "JPEG image file",
            "@type": "IMAGE-DOWNSAMPLED",
            "@size": "41587",
            "@ref": "gr8",
            "@mimetype": "image/jpeg"
          },
          {
            "@category": "standard",
            "@height": "322",
            "@width": "535",
            "@_fa": "true",
            "$": "https://api.elsevier.com/content/object/eid/1-s2.0-S0021951725000600-gr9.jpg?httpAccept=%2A%2F%2A",
            "@multimediatype": "JPEG image file",
            "@type": "IMAGE-DOWNSAMPLED",
            "@size": "37121",
            "@ref": "gr9",
            "@mimetype": "image/jpeg"
          },
          {
            "@category": "standard",
            "@height": "344",
            "@width": "535",
            "@_fa": "true",
            "$": "https://api.elsevier.com/content/object/eid/1-s2.0-S0021951725000600-gr10.jpg?httpAccept=%2A%2F%2A",
            "@multimediatype": "JPEG image file",
            "@type": "IMAGE-DOWNSAMPLED",
            "@size": "37032",
            "@ref": "gr10",
            "@mimetype": "image/jpeg"
          },
          {
            "@category": "standard",
            "@height": "594",
            "@width": "534",
            "@_fa": "true",
            "$": "https://api.elsevier.com/content/object/eid/1-s2.0-S0021951725000600-gr1.jpg?httpAccept=%2A%2F%2A",
            "@multimediatype": "JPEG image file",
            "@type": "IMAGE-DOWNSAMPLED",
            "@size": "136495",
            "@ref": "gr1",
            "@mimetype": "image/jpeg"
          },
          {
            "@category": "standard",
            "@height": "537",
            "@width": "534",
            "@_fa": "true",
            "$": "https://api.elsevier.com/content/object/eid/1-s2.0-S0021951725000600-gr2.jpg?httpAccept=%2A%2F%2A",
            "@multimediatype": "JPEG image file",
            "@type": "IMAGE-DOWNSAMPLED",
            "@size": "89947",
            "@ref": "gr2",
            "@mimetype": "image/jpeg"
          },
          {
            "@category": "standard",
            "@height": "200",
            "@width": "317",
            "@_fa": "true",
            "$": "https://api.elsevier.com/content/object/eid/1-s2.0-S0021951725000600-ga1.jpg?httpAccept=%2A%2F%2A",
            "@multimediatype": "JPEG image file",
            "@type": "IMAGE-DOWNSAMPLED",
            "@size": "18578",
            "@ref": "ga1",
            "@mimetype": "image/jpeg"
          },
          {
            "@category": "standard",
            "@height": "484",
            "@width": "535",
            "@_fa": "true",
            "$": "https://api.elsevier.com/content/object/eid/1-s2.0-S0021951725000600-gr3.jpg?httpAccept=%2A%2F%2A",
            "@multimediatype": "JPEG image file",
            "@type": "IMAGE-DOWNSAMPLED",
            "@size": "72356",
            "@ref": "gr3",
            "@mimetype": "image/jpeg"
          },
          {
            "@category": "standard",
            "@height": "657",
            "@width": "713",
            "@_fa": "true",
            "$": "https://api.elsevier.com/content/object/eid/1-s2.0-S0021951725000600-gr4.jpg?httpAccept=%2A%2F%2A",
            "@multimediatype": "JPEG image file",
            "@type": "IMAGE-DOWNSAMPLED",
            "@size": "118895",
            "@ref": "gr4",
            "@mimetype": "image/jpeg"
          },
          {
            "@category": "standard",
            "@height": "865",
            "@width": "705",
            "@_fa": "true",
            "$": "https://api.elsevier.com/content/object/eid/1-s2.0-S0021951725000600-gr5.jpg?httpAccept=%2A%2F%2A",
            "@multimediatype": "JPEG image file",
            "@type": "IMAGE-DOWNSAMPLED",
            "@size": "135189",
            "@ref": "gr5",
            "@mimetype": "image/jpeg"
          },
          {
            "@category": "standard",
            "@height": "433",
            "@width": "713",
            "@_fa": "true",
            "$": "https://api.elsevier.com/content/object/eid/1-s2.0-S0021951725000600-gr6.jpg?httpAccept=%2A%2F%2A",
            "@multimediatype": "JPEG image file",
            "@type": "IMAGE-DOWNSAMPLED",
            "@size": "114457",
            "@ref": "gr6",
            "@mimetype": "image/jpeg"
          },
          {
            "@category": "standard",
            "@height": "458",
            "@width": "785",
            "@_fa": "true",
            "$": "https://api.elsevier.com/content/object/eid/1-s2.0-S0021951725000600-gr7.jpg?httpAccept=%2A%2F%2A",
            "@multimediatype": "JPEG image file",
            "@type": "IMAGE-DOWNSAMPLED",
            "@size": "112507",
            "@ref": "gr7",
            "@mimetype": "image/jpeg"
          },
          {
            "@category": "thumbnail",
            "@height": "117",
            "@width": "219",
            "@_fa": "true",
            "$": "https://api.elsevier.com/content/object/eid/1-s2.0-S0021951725000600-gr8.sml?httpAccept=%2A%2F%2A",
            "@multimediatype": "GIF image file",
            "@type": "IMAGE-THUMBNAIL",
            "@size": "7029",
            "@ref": "gr8",
            "@mimetype": "image/gif"
          },
          {
            "@category": "thumbnail",
            "@height": "132",
            "@width": "219",
            "@_fa": "true",
            "$": "https://api.elsevier.com/content/object/eid/1-s2.0-S0021951725000600-gr9.sml?httpAccept=%2A%2F%2A",
            "@multimediatype": "GIF image file",
            "@type": "IMAGE-THUMBNAIL",
            "@size": "7510",
            "@ref": "gr9",
            "@mimetype": "image/gif"
          },
          {
            "@category": "thumbnail",
            "@height": "141",
            "@width": "219",
            "@_fa": "true",
            "$": "https://api.elsevier.com/content/object/eid/1-s2.0-S0021951725000600-gr10.sml?httpAccept=%2A%2F%2A",
            "@multimediatype": "GIF image file",
            "@type": "IMAGE-THUMBNAIL",
            "@size": "17456",
            "@ref": "gr10",
            "@mimetype": "image/gif"
          },
          {
            "@category": "thumbnail",
            "@height": "164",
            "@width": "147",
            "@_fa": "true",
            "$": "https://api.elsevier.com/content/object/eid/1-s2.0-S0021951725000600-gr1.sml?httpAccept=%2A%2F%2A",
            "@multimediatype": "GIF image file",
            "@type": "IMAGE-THUMBNAIL",
            "@size": "18713",
            "@ref": "gr1",
            "@mimetype": "image/gif"
          },
          {
            "@category": "thumbnail",
            "@height": "164",
            "@width": "163",
            "@_fa": "true",
            "$": "https://api.elsevier.com/content/object/eid/1-s2.0-S0021951725000600-gr2.sml?httpAccept=%2A%2F%2A",
            "@multimediatype": "GIF image file",
            "@type": "IMAGE-THUMBNAIL",
            "@size": "14388",
            "@ref": "gr2",
            "@mimetype": "image/gif"
          },
          {
            "@category": "thumbnail",
            "@height": "138",
            "@width": "219",
            "@_fa": "true",
            "$": "https://api.elsevier.com/content/object/eid/1-s2.0-S0021951725000600-ga1.sml?httpAccept=%2A%2F%2A",
            "@multimediatype": "GIF image file",
            "@type": "IMAGE-THUMBNAIL",
            "@size": "18750",
            "@ref": "ga1",
            "@mimetype": "image/gif"
          },
          {
            "@category": "thumbnail",
            "@height": "164",
            "@width": "181",
            "@_fa": "true",
            "$": "https://api.elsevier.com/content/object/eid/1-s2.0-S0021951725000600-gr3.sml?httpAccept=%2A%2F%2A",
            "@multimediatype": "GIF image file",
            "@type": "IMAGE-THUMBNAIL",
            "@size": "10715",
            "@ref": "gr3",
            "@mimetype": "image/gif"
          },
          {
            "@category": "thumbnail",
            "@height": "164",
            "@width": "178",
            "@_fa": "true",
            "$": "https://api.elsevier.com/content/object/eid/1-s2.0-S0021951725000600-gr4.sml?httpAccept=%2A%2F%2A",
            "@multimediatype": "GIF image file",
            "@type": "IMAGE-THUMBNAIL",
            "@size": "12529",
            "@ref": "gr4",
            "@mimetype": "image/gif"
          },
          {
            "@category": "thumbnail",
            "@height": "163",
            "@width": "133",
            "@_fa": "true",
            "$": "https://api.elsevier.com/content/object/eid/1-s2.0-S0021951725000600-gr5.sml?httpAccept=%2A%2F%2A",
            "@multimediatype": "GIF image file",
            "@type": "IMAGE-THUMBNAIL",
            "@size": "9035",
            "@ref": "gr5",
            "@mimetype": "image/gif"
          },
          {
            "@category": "thumbnail",
            "@height": "133",
            "@width": "219",
            "@_fa": "true",
            "$": "https://api.elsevier.com/content/object/eid/1-s2.0-S0021951725000600-gr6.sml?httpAccept=%2A%2F%2A",
            "@multimediatype": "GIF image file",
            "@type": "IMAGE-THUMBNAIL",
            "@size": "14704",
            "@ref": "gr6",
            "@mimetype": "image/gif"
          },
          {
            "@category": "thumbnail",
            "@height": "128",
            "@width": "219",
            "@_fa": "true",
            "$": "https://api.elsevier.com/content/object/eid/1-s2.0-S0021951725000600-gr7.sml?httpAccept=%2A%2F%2A",
            "@multimediatype": "GIF image file",
            "@type": "IMAGE-THUMBNAIL",
            "@size": "15122",
            "@ref": "gr7",
            "@mimetype": "image/gif"
          },
          {
            "@category": "high",
            "@height": "1591",
            "@width": "2973",
            "@_fa": "true",
            "$": "https://api.elsevier.com/content/object/eid/1-s2.0-S0021951725000600-gr8_lrg.jpg?httpAccept=%2A%2F%2A",
            "@multimediatype": "JPEG image file",
            "@type": "IMAGE-HIGH-RES",
            "@size": "211475",
            "@ref": "gr8",
            "@mimetype": "image/jpeg"
          },
          {
            "@category": "high",
            "@height": "1426",
            "@width": "2368",
            "@_fa": "true",
            "$": "https://api.elsevier.com/content/object/eid/1-s2.0-S0021951725000600-gr9_lrg.jpg?httpAccept=%2A%2F%2A",
            "@multimediatype": "JPEG image file",
            "@type": "IMAGE-HIGH-RES",
            "@size": "211563",
            "@ref": "gr9",
            "@mimetype": "image/jpeg"
          },
          {
            "@category": "high",
            "@height": "998",
            "@width": "1554",
            "@_fa": "true",
            "$": "https://api.elsevier.com/content/object/eid/1-s2.0-S0021951725000600-gr10_lrg.jpg?httpAccept=%2A%2F%2A",
            "@multimediatype": "JPEG image file",
            "@type": "IMAGE-HIGH-RES",
            "@size": "103643",
            "@ref": "gr10",
            "@mimetype": "image/jpeg"
          },
          {
            "@category": "high",
            "@height": "2202",
            "@width": "1978",
            "@_fa": "true",
            "$": "https://api.elsevier.com/content/object/eid/1-s2.0-S0021951725000600-gr1_lrg.jpg?httpAccept=%2A%2F%2A",
            "@multimediatype": "JPEG image file",
            "@type": "IMAGE-HIGH-RES",
            "@size": "763697",
            "@ref": "gr1",
            "@mimetype": "image/jpeg"
          },
          {
            "@category": "high",
            "@height": "1913",
            "@width": "1903",
            "@_fa": "true",
            "$": "https://api.elsevier.com/content/object/eid/1-s2.0-S0021951725000600-gr2_lrg.jpg?httpAccept=%2A%2F%2A",
            "@multimediatype": "JPEG image file",
            "@type": "IMAGE-HIGH-RES",
            "@size": "505125",
            "@ref": "gr2",
            "@mimetype": "image/jpeg"
          },
          {
            "@category": "high",
            "@height": "886",
            "@width": "1403",
            "@_fa": "true",
            "$": "https://api.elsevier.com/content/object/eid/1-s2.0-S0021951725000600-ga1_lrg.jpg?httpAccept=%2A%2F%2A",
            "@multimediatype": "JPEG image file",
            "@type": "IMAGE-HIGH-RES",
            "@size": "107462",
            "@ref": "ga1",
            "@mimetype": "image/jpeg"
          },
          {
            "@category": "high",
            "@height": "2144",
            "@width": "2368",
            "@_fa": "true",
            "$": "https://api.elsevier.com/content/object/eid/1-s2.0-S0021951725000600-gr3_lrg.jpg?httpAccept=%2A%2F%2A",
            "@multimediatype": "JPEG image file",
            "@type": "IMAGE-HIGH-RES",
            "@size": "389962",
            "@ref": "gr3",
            "@mimetype": "image/jpeg"
          },
          {
            "@category": "high",
            "@height": "2907",
            "@width": "3156",
            "@_fa": "true",
            "$": "https://api.elsevier.com/content/object/eid/1-s2.0-S0021951725000600-gr4_lrg.jpg?httpAccept=%2A%2F%2A",
            "@multimediatype": "JPEG image file",
            "@type": "IMAGE-HIGH-RES",
            "@size": "667727",
            "@ref": "gr4",
            "@mimetype": "image/jpeg"
          },
          {
            "@category": "high",
            "@height": "3826",
            "@width": "3120",
            "@_fa": "true",
            "$": "https://api.elsevier.com/content/object/eid/1-s2.0-S0021951725000600-gr5_lrg.jpg?httpAccept=%2A%2F%2A",
            "@multimediatype": "JPEG image file",
            "@type": "IMAGE-HIGH-RES",
            "@size": "707474",
            "@ref": "gr5",
            "@mimetype": "image/jpeg"
          },
          {
            "@category": "high",
            "@height": "1915",
            "@width": "3156",
            "@_fa": "true",
            "$": "https://api.elsevier.com/content/object/eid/1-s2.0-S0021951725000600-gr6_lrg.jpg?httpAccept=%2A%2F%2A",
            "@multimediatype": "JPEG image file",
            "@type": "IMAGE-HIGH-RES",
            "@size": "607326",
            "@ref": "gr6",
            "@mimetype": "image/jpeg"
          },
          {
            "@category": "high",
            "@height": "2028",
            "@width": "3476",
            "@_fa": "true",
            "$": "https://api.elsevier.com/content/object/eid/1-s2.0-S0021951725000600-gr7_lrg.jpg?httpAccept=%2A%2F%2A",
            "@multimediatype": "JPEG image file",
            "@type": "IMAGE-HIGH-RES",
            "@size": "567518",
            "@ref": "gr7",
            "@mimetype": "image/jpeg"
          },
          {
            "@category": "thumbnail",
            "@_fa": "true",
            "$": "https://api.elsevier.com/content/object/eid/1-s2.0-S0021951725000600-si1.svg?httpAccept=%2A%2F%2A",
            "@multimediatype": "Scalable Vector Graphics file",
            "@type": "ALTIMG",
            "@size": "16993",
            "@ref": "si1",
            "@mimetype": "image/svg+xml"
          },
          {
            "@category": "thumbnail",
            "@_fa": "true",
            "$": "https://api.elsevier.com/content/object/eid/1-s2.0-S0021951725000600-si2.svg?httpAccept=%2A%2F%2A",
            "@multimediatype": "Scalable Vector Graphics file",
            "@type": "ALTIMG",
            "@size": "5377",
            "@ref": "si2",
            "@mimetype": "image/svg+xml"
          },
          {
            "@category": "thumbnail",
            "@_fa": "true",
            "$": "https://api.elsevier.com/content/object/eid/1-s2.0-S0021951725000600-si3.svg?httpAccept=%2A%2F%2A",
            "@multimediatype": "Scalable Vector Graphics file",
            "@type": "ALTIMG",
            "@size": "6059",
            "@ref": "si3",
            "@mimetype": "image/svg+xml"
          },
          {
            "@category": "thumbnail",
            "@_fa": "true",
            "$": "https://api.elsevier.com/content/object/eid/1-s2.0-S0021951725000600-si4.svg?httpAccept=%2A%2F%2A",
            "@multimediatype": "Scalable Vector Graphics file",
            "@type": "ALTIMG",
            "@size": "21935",
            "@ref": "si4",
            "@mimetype": "image/svg+xml"
          },
          {
            "@category": "thumbnail",
            "@_fa": "true",
            "$": "https://api.elsevier.com/content/object/eid/1-s2.0-S0021951725000600-si5.svg?httpAccept=%2A%2F%2A",
            "@multimediatype": "Scalable Vector Graphics file",
            "@type": "ALTIMG",
            "@size": "24705",
            "@ref": "si5",
            "@mimetype": "image/svg+xml"
          },
          {
            "@category": "thumbnail",
            "@_fa": "true",
            "$": "https://api.elsevier.com/content/object/eid/1-s2.0-S0021951725000600-si6.svg?httpAccept=%2A%2F%2A",
            "@multimediatype": "Scalable Vector Graphics file",
            "@type": "ALTIMG",
            "@size": "3027",
            "@ref": "si6",
            "@mimetype": "image/svg+xml"
          },
          {
            "@category": "thumbnail",
            "@_fa": "true",
            "$": "https://api.elsevier.com/content/object/eid/1-s2.0-S0021951725000600-si7.svg?httpAccept=%2A%2F%2A",
            "@multimediatype": "Scalable Vector Graphics file",
            "@type": "ALTIMG",
            "@size": "1561",
            "@ref": "si7",
            "@mimetype": "image/svg+xml"
          }
        ]
      },
      "link": {
        "@rel": "abstract",
        "@href": "https://api.elsevier.com/content/abstract/scopus_id/85217823117"
      }
    }
  }
}