{
  "metadata": {
    "title": "Lithium nitride (Li<ce:inf loc=post>3</ce:inf>N) formation in lithium-mediated electrochemical ammonia synthesis can be enhanced with the right proton donor",
    "authors": "; ; ",
    "journal": "Journal of Catalysis",
    "date": "2025-10-31",
    "doi": "10.1016/j.jcat.2025.116250",
    "abstract": "",
    "uri": "https://api.elsevier.com/content/article/pii/S002195172500315X",
    "pii": "S002195172500315X"
  },
  "fulltext": {
    "full-text-retrieval-response": {
      "scopus-eid": "2-s2.0-105009999644",
      "originalText": "serial JL 272561 291210 291744 291809 31 90 Journal of Catalysis JOURNALCATALYSIS 2025-06-18 2025-06-18 2025-07-10 2025-07-10 2025-08-08T04:43:02 1-s2.0-S002195172500315X S0021-9517(25)00315-X S002195172500315X 10.1016/j.jcat.2025.116250 S300 S300.1 FULL-TEXT 1-s2.0-S0021951725X00087 2025-08-08T03:54:43.354482Z 0 0 20251001 20251031 2025 2025-06-18T07:09:22.914454Z absattachment articleinfo articlenumber articletitlenorm authfirstinitialnorm authfirstsurnamenorm cid cids contenttype copyright crossmark dateloaded dateloadedtxt datesearch datesort dateupdated dco docsubtype doctype doi eid ewtransactionid fundingbodyid hubeid indexeddate issn issnnorm itemstage itemtransactionid itemweight oauserlicense openaccess openarchive pg pgfirst pii piinorm pubdateend pubdatestart pubdatetxt pubyr sectiontitle sortorder sponsoredaccesstype srctitle srctitlenorm srctype ssids alllist content oa subj subheadings suppl tomb volfirst volissue volumelist webpdf webpdfpagecount yearnav figure e-component body mmlmath acknowledge affil appendices articletitle auth authfirstini authfull authkeywords authlast grantsponsor grantsponsorid highlightsabst orcid primabst pubtype ref specialabst 0021-9517 00219517 UNLIMITED MICHHY25 true 450 450 C Volume 450 70 116250 116250 116250 202510 October 2025 2025-10-01 2025-10-31 2025 Regular Articles article fla © 2025 The Author(s). Published by Elsevier Inc. LITHIUMNITRIDELI3NFORMATIONINLITHIUMMEDIATEDELECTROCHEMICALAMMONIASYNTHESISCANENHANCEDRIGHTPROTONDONOR AZUMAH V 1 Introduction 2 Methods 2.1 Computational parameters 2.2 Lithium nitride formation baseline 2.3 Lithium nitride formation in the presence of a proton donor (PD) 2.4 Geometric analysis and dimensionality reduction 2.5 Statistical analysis and significance testing 3 Results and discussion 3.1 Nitride formation on the lithium slab 3.2 Proton donor (PD) effects on formation 3.2.1 Proton donor selection 3.2.2 structures evolved in the presence of PD 3.2.3 PD effects on energetics of nitride formation 3.2.4 Comparative energetics for the PD-induced protonation 3.3 Understanding PD-induced behavior 3.3.1 PD-induced slab reorganization 3.3.2 PD effects on nitrogen reduction 3.4 Kamlet–Taft parameters as predictors for PD behavior and resulting outcomes 3.4.1 Correlations with Li3N formation 3.4.2 Understanding protonation behavior 3.4.3 Understanding decomposition behavior 4 Conclusion CRediT authorship contribution statement Acknowledgments Appendix A Supplementary data References ROUWENHORST 2018 K ERISMAN 2008 636 639 J NORSKOV 2016 J SUSTAINABLEAMMONIASYNTHESISEXPLORINGSCIENTIFICCHALLENGESASSOCIATEDDISCOVERINGALTERNATIVESUSTAINABLEPROCESSESFORAMMONIAPRODUCTION KAHRL 2010 688 694 F BENCHAITA 2013 T LAMB 2021 073005 W ISELLA 2022 7560 A SCHIFFER 2017 10 14 Z MALLAPRAGADA 2023 23 41 D FICHTER 1930 1228 1236 F SURYANTO 2021 1187 1191 B DU 2022 722 727 H LI 2022 2083 2101 S CUI 2018 1800369 X TSUNETO 1993 851 854 A TSUNETO 1994 183 188 A FU 2023 707 712 X LAZOUSKI 2020 463 469 N MCFARLANE 1962 997 1007 E GREENWOOD 2012 N CHEMISTRYELEMENTS VAJENINE 2008 450 454 G IRIAWAN 2021 56 H WESTHEAD 2023 184 201 O CAI 2021 X SINGH 2019 8316 8324 A MONTOYA 2015 2180 2186 J KAVALSKY 2020 23164 23176 L TANG 2019 3166 3180 C PAN 2020 24098 24107 J GUAN 2022 e202205805 Y ANDERSEN 2020 4291 4300 S LAZOUSKI 2019 1127 1139 N JEON 2024 4147 4152 Y LI 2024 92 97 S CHANG 2024 1 11 W LIU 2024 151707 H CAI 2023 25716 25725 X IRIAWAN 2024 4883 4891 H FU 2024 3790 3795 X STEINBERG 2023 138 148 K KRISHNAMURTHY 2021 2073 2082 D LAZOUSKI 2022 5197 5208 N FU 2024 2417 X DU 2023 1082 1090 H SPRY 2023 1230 1235 M LI 2021 1593 1597 K AZUMAH 2024 V PROTONDONORSINFLUENCENITROGENADSORPTIONINLITHIUMMEDIATEDELECTROCHEMICALAMMONIASYNTHESIS HIMANEN 2020 106949 L LAAKSO 2023 J LUDWIG 2020 26368 26378 T SHEN 2015 14204 Y DE 2016 13754 13769 S JAGER 2018 37 M BARTOK 2013 184115 A WILLATT 2018 29661 29668 M FABER 2015 1094 1101 F KAVALSKY 2024 L SAINBURG 2021 2881 2907 T MCINNES 2017 L VALLAT 2018 1026 R TORT 2025 R ROLEETHANOLINLITHIUMMEDIATEDNITROGENREDUCTION SCHWALBE 2020 1542 1549 J ZHANG 2020 070554 Y ZHANG 2020 11450 11466 Y ZHANG 2021 5821 5828 Y AZOFRA 2024 L YOKOYAMA 1976 3233 3237 T KAMLET 1976 377 383 M KAMLET 1977 6027 6038 M TANG 2009 084204 W REICHARDT 2011 93 96 C SOLVENTSSOLVENTEFFECTSINORGANICCHEMISTRY HAAK 1986 307 311 J REICHARDT 1965 29 40 C GUTMANN 1976 661 670 V GUTMANN 1982 265 278 V KUKUSHKIN 2005 1 21 V KRIEBLE 1939 560 563 V MAGAT 1951 1028 1031 E TEWARI 2005 720 728 Y WADE 2022 1135 1136 L ORGANICCHEMISTRY FLEMING 2005 2200 2205 F ELANGOVAN 2016 8809 8814 S WADE 2022 949 950 L ORGANICCHEMISTRY SWAIN 1947 2306 2309 C BLICKE 1953 5587 5590 F KOLASINSKI 2020 115 185 K SURFACESCIENCEFOUNDATIONSCATALYSISNANOSCIENCE XU 2023 70 76 L AZUMAHX2025X116250 AZUMAHX2025X116250XV Full 2025-06-13T16:49:59Z ElsevierWaived University of Michigan: Core Hybrid journals RAP 2025 http://creativecommons.org/licenses/by/4.0/ 2027-07-10T00:00:00.000Z 2027-07-10T00:00:00.000Z http://creativecommons.org/licenses/by-nc-nd/4.0/ This is an open access article under the CC BY license. © 2025 The Author(s). Published by Elsevier Inc. 2025-07-12T01:47:36.246Z http://vtw.elsevier.com/data/voc/AddOnTypes/50.7/aggregated-refined Natural Sciences and Engineering Research Council of Canada CRSNG Natural Sciences and Engineering Research Council of Canada http://data.elsevier.com/vocabulary/SciValFunders/501100000038 http://sws.geonames.org/6251999/ This work used Bridges-2 at the Pittsburgh Supercomputing Center through allocation CTS180061 from the Advanced Cyberinfrastructure Coordination Ecosystem: Services and Support (ACCESS) program, L.K. acknowledges the support of the Natural Sciences and Engineering Research Council of Canada (NSERC). item S0021-9517(25)00315-X S002195172500315X 1-s2.0-S002195172500315X 10.1016/j.jcat.2025.116250 272561 2025-08-08T03:54:43.354482Z 2025-10-01 2025-10-31 UNLIMITED MICHHY25 1-s2.0-S002195172500315X-main.pdf https://s3-eu-west-1.amazonaws.com/prod-ucs-content-store-eu-west/content/pii:S002195172500315X/MAIN/application/pdf/d96f1e2313fc991e215a1b82eb7bbf22/main.pdf main.pdf pdf true 3322471 MAIN 16 1-s2.0-S002195172500315X-main_1.png https://s3-eu-west-1.amazonaws.com/prod-ucs-content-store-eu-west/content/pii:S002195172500315X/PREVIEW/image/png/0e0835c4fffa56771e4806066a9e5f84/main_1.png main_1.png png 59642 928 656 IMAGE-WEB-PDF 1 1-s2.0-S002195172500315X-gr3.jpg https://s3-eu-west-1.amazonaws.com/prod-ucs-content-store-eu-west/content/pii:S002195172500315X/gr3/DOWNSAMPLED/image/jpeg/d218ccf0aeb9d00fa783d4fde9302d9d/gr3.jpg gr3 gr3.jpg jpg 127916 383 525 IMAGE-DOWNSAMPLED 1-s2.0-S002195172500315X-gr4.jpg https://s3-eu-west-1.amazonaws.com/prod-ucs-content-store-eu-west/content/pii:S002195172500315X/gr4/DOWNSAMPLED/image/jpeg/d8444a16fa8718c658ca051c904c46db/gr4.jpg gr4 gr4.jpg jpg 178535 574 697 IMAGE-DOWNSAMPLED 1-s2.0-S002195172500315X-gr1.jpg https://s3-eu-west-1.amazonaws.com/prod-ucs-content-store-eu-west/content/pii:S002195172500315X/gr1/DOWNSAMPLED/image/jpeg/9251a97fd763ee59320d2ee39cd0b501/gr1.jpg gr1 gr1.jpg jpg 127735 342 698 IMAGE-DOWNSAMPLED 1-s2.0-S002195172500315X-gr2.jpg https://s3-eu-west-1.amazonaws.com/prod-ucs-content-store-eu-west/content/pii:S002195172500315X/gr2/DOWNSAMPLED/image/jpeg/2416bd0f6744f6425fc6182b88698f38/gr2.jpg gr2 gr2.jpg jpg 158577 499 688 IMAGE-DOWNSAMPLED 1-s2.0-S002195172500315X-gr9.jpg https://s3-eu-west-1.amazonaws.com/prod-ucs-content-store-eu-west/content/pii:S002195172500315X/gr9/DOWNSAMPLED/image/jpeg/184ab6a24a135a693d64bc0ffeeaa0c0/gr9.jpg gr9 gr9.jpg jpg 155112 349 690 IMAGE-DOWNSAMPLED 1-s2.0-S002195172500315X-gr7.jpg https://s3-eu-west-1.amazonaws.com/prod-ucs-content-store-eu-west/content/pii:S002195172500315X/gr7/DOWNSAMPLED/image/jpeg/e815321ce1d59845272cd76718895320/gr7.jpg gr7 gr7.jpg jpg 156618 502 687 IMAGE-DOWNSAMPLED 1-s2.0-S002195172500315X-gr8.jpg https://s3-eu-west-1.amazonaws.com/prod-ucs-content-store-eu-west/content/pii:S002195172500315X/gr8/DOWNSAMPLED/image/jpeg/628552ffc62c9bb04724d501dc24b4eb/gr8.jpg gr8 gr8.jpg jpg 150103 428 691 IMAGE-DOWNSAMPLED 1-s2.0-S002195172500315X-gr5.jpg https://s3-eu-west-1.amazonaws.com/prod-ucs-content-store-eu-west/content/pii:S002195172500315X/gr5/DOWNSAMPLED/image/jpeg/db4d15725549c5c608146333cc71d491/gr5.jpg gr5 gr5.jpg jpg 154957 576 694 IMAGE-DOWNSAMPLED 1-s2.0-S002195172500315X-gr6.jpg https://s3-eu-west-1.amazonaws.com/prod-ucs-content-store-eu-west/content/pii:S002195172500315X/gr6/DOWNSAMPLED/image/jpeg/1d6db55f0f5ac154c250f49ccb455693/gr6.jpg gr6 gr6.jpg jpg 120489 232 634 IMAGE-DOWNSAMPLED 1-s2.0-S002195172500315X-fx1020.jpg https://s3-eu-west-1.amazonaws.com/prod-ucs-content-store-eu-west/content/pii:S002195172500315X/fx1020/DOWNSAMPLED/image/jpeg/bb31c879bb82e011945b394e61721c23/fx1020.jpg fx1020 fx1020.jpg jpg 4608 12 24 IMAGE-DOWNSAMPLED 1-s2.0-S002195172500315X-fx1021.jpg https://s3-eu-west-1.amazonaws.com/prod-ucs-content-store-eu-west/content/pii:S002195172500315X/fx1021/DOWNSAMPLED/image/jpeg/999aa6744b78978ebbec03feae2376cc/fx1021.jpg fx1021 fx1021.jpg jpg 8854 18 241 IMAGE-DOWNSAMPLED 1-s2.0-S002195172500315X-ga1.jpg https://s3-eu-west-1.amazonaws.com/prod-ucs-content-store-eu-west/content/pii:S002195172500315X/ga1/DOWNSAMPLED/image/jpeg/c4e44824e83034a585a715561560c48d/ga1.jpg ga1 true ga1.jpg jpg 90612 121 301 IMAGE-DOWNSAMPLED 1-s2.0-S002195172500315X-fx1022.jpg https://s3-eu-west-1.amazonaws.com/prod-ucs-content-store-eu-west/content/pii:S002195172500315X/fx1022/DOWNSAMPLED/image/jpeg/4a2e09b566c75380e4e5f28775097c95/fx1022.jpg fx1022 fx1022.jpg jpg 4591 14 19 IMAGE-DOWNSAMPLED 1-s2.0-S002195172500315X-fx1001.jpg https://s3-eu-west-1.amazonaws.com/prod-ucs-content-store-eu-west/content/pii:S002195172500315X/fx1001/DOWNSAMPLED/image/jpeg/306ef87ac172d435cdda32fb7fcb4013/fx1001.jpg fx1001 fx1001.jpg jpg 4608 12 24 IMAGE-DOWNSAMPLED 1-s2.0-S002195172500315X-fx1023.jpg https://s3-eu-west-1.amazonaws.com/prod-ucs-content-store-eu-west/content/pii:S002195172500315X/fx1023/DOWNSAMPLED/image/jpeg/bc084e820bc8168ca39591e0bae4705c/fx1023.jpg fx1023 fx1023.jpg jpg 4586 14 19 IMAGE-DOWNSAMPLED 1-s2.0-S002195172500315X-fx1002.jpg https://s3-eu-west-1.amazonaws.com/prod-ucs-content-store-eu-west/content/pii:S002195172500315X/fx1002/DOWNSAMPLED/image/jpeg/550fd8b30992e043ee73bde145960518/fx1002.jpg fx1002 fx1002.jpg jpg 7308 16 166 IMAGE-DOWNSAMPLED 1-s2.0-S002195172500315X-fx1024.jpg https://s3-eu-west-1.amazonaws.com/prod-ucs-content-store-eu-west/content/pii:S002195172500315X/fx1024/DOWNSAMPLED/image/jpeg/15d0684f283928bb9c9b25df9fe0627a/fx1024.jpg fx1024 fx1024.jpg jpg 4790 8 46 IMAGE-DOWNSAMPLED 1-s2.0-S002195172500315X-fx1003.jpg https://s3-eu-west-1.amazonaws.com/prod-ucs-content-store-eu-west/content/pii:S002195172500315X/fx1003/DOWNSAMPLED/image/jpeg/47214d97ba51915334079696badbc936/fx1003.jpg fx1003 fx1003.jpg jpg 4591 14 19 IMAGE-DOWNSAMPLED 1-s2.0-S002195172500315X-fx1025.jpg https://s3-eu-west-1.amazonaws.com/prod-ucs-content-store-eu-west/content/pii:S002195172500315X/fx1025/DOWNSAMPLED/image/jpeg/9e20d0cfb30689a814f358934b9e8463/fx1025.jpg fx1025 fx1025.jpg jpg 4674 8 36 IMAGE-DOWNSAMPLED 1-s2.0-S002195172500315X-fx1004.jpg https://s3-eu-west-1.amazonaws.com/prod-ucs-content-store-eu-west/content/pii:S002195172500315X/fx1004/DOWNSAMPLED/image/jpeg/fbac303d14cc4d0d2b73bb85b87db9ec/fx1004.jpg fx1004 fx1004.jpg jpg 6815 14 157 IMAGE-DOWNSAMPLED 1-s2.0-S002195172500315X-fx1026.jpg https://s3-eu-west-1.amazonaws.com/prod-ucs-content-store-eu-west/content/pii:S002195172500315X/fx1026/DOWNSAMPLED/image/jpeg/77b541eb0e46653c8bcdde4d2816a96a/fx1026.jpg fx1026 fx1026.jpg jpg 4608 12 24 IMAGE-DOWNSAMPLED 1-s2.0-S002195172500315X-fx1005.jpg https://s3-eu-west-1.amazonaws.com/prod-ucs-content-store-eu-west/content/pii:S002195172500315X/fx1005/DOWNSAMPLED/image/jpeg/592b5167632678b732780c25a7ce6492/fx1005.jpg fx1005 fx1005.jpg jpg 4419 11 13 IMAGE-DOWNSAMPLED 1-s2.0-S002195172500315X-fx1027.jpg https://s3-eu-west-1.amazonaws.com/prod-ucs-content-store-eu-west/content/pii:S002195172500315X/fx1027/DOWNSAMPLED/image/jpeg/ab937a8a97b2a2f46bf8ee4e7242b79f/fx1027.jpg fx1027 fx1027.jpg jpg 4608 12 24 IMAGE-DOWNSAMPLED 1-s2.0-S002195172500315X-fx1006.jpg https://s3-eu-west-1.amazonaws.com/prod-ucs-content-store-eu-west/content/pii:S002195172500315X/fx1006/DOWNSAMPLED/image/jpeg/cffe6d790cadf3ade6ba238b5b19ca57/fx1006.jpg fx1006 fx1006.jpg jpg 4967 14 41 IMAGE-DOWNSAMPLED 1-s2.0-S002195172500315X-fx1028.jpg https://s3-eu-west-1.amazonaws.com/prod-ucs-content-store-eu-west/content/pii:S002195172500315X/fx1028/DOWNSAMPLED/image/jpeg/8febacfbf74256a7645f04872f02461f/fx1028.jpg fx1028 fx1028.jpg jpg 4500 11 20 IMAGE-DOWNSAMPLED 1-s2.0-S002195172500315X-fx1007.jpg https://s3-eu-west-1.amazonaws.com/prod-ucs-content-store-eu-west/content/pii:S002195172500315X/fx1007/DOWNSAMPLED/image/jpeg/588aad5afc9698793942c8b9d1595a87/fx1007.jpg fx1007 fx1007.jpg jpg 4608 12 24 IMAGE-DOWNSAMPLED 1-s2.0-S002195172500315X-fx1008.jpg https://s3-eu-west-1.amazonaws.com/prod-ucs-content-store-eu-west/content/pii:S002195172500315X/fx1008/DOWNSAMPLED/image/jpeg/ef539db3601c8a3a6777a49c3f68ebeb/fx1008.jpg fx1008 fx1008.jpg jpg 7803 14 214 IMAGE-DOWNSAMPLED 1-s2.0-S002195172500315X-fx1009.jpg https://s3-eu-west-1.amazonaws.com/prod-ucs-content-store-eu-west/content/pii:S002195172500315X/fx1009/DOWNSAMPLED/image/jpeg/568a8a10e51a792f69c7be104c72ec95/fx1009.jpg fx1009 fx1009.jpg jpg 4608 12 24 IMAGE-DOWNSAMPLED 1-s2.0-S002195172500315X-fx1010.jpg https://s3-eu-west-1.amazonaws.com/prod-ucs-content-store-eu-west/content/pii:S002195172500315X/fx1010/DOWNSAMPLED/image/jpeg/e90b21cbd3942f4dd725e0553ecc8f5a/fx1010.jpg fx1010 fx1010.jpg jpg 4608 12 24 IMAGE-DOWNSAMPLED 1-s2.0-S002195172500315X-fx1011.jpg https://s3-eu-west-1.amazonaws.com/prod-ucs-content-store-eu-west/content/pii:S002195172500315X/fx1011/DOWNSAMPLED/image/jpeg/f3242c824ffa9f83b2e3674d1e1ea126/fx1011.jpg fx1011 fx1011.jpg jpg 4419 11 13 IMAGE-DOWNSAMPLED 1-s2.0-S002195172500315X-fx1012.jpg https://s3-eu-west-1.amazonaws.com/prod-ucs-content-store-eu-west/content/pii:S002195172500315X/fx1012/DOWNSAMPLED/image/jpeg/2b893b1453dfc45b7e3b02492654ff52/fx1012.jpg fx1012 fx1012.jpg jpg 4608 12 24 IMAGE-DOWNSAMPLED 1-s2.0-S002195172500315X-fx1013.jpg https://s3-eu-west-1.amazonaws.com/prod-ucs-content-store-eu-west/content/pii:S002195172500315X/fx1013/DOWNSAMPLED/image/jpeg/b1720b1e10fa233b17994d13aa828524/fx1013.jpg fx1013 fx1013.jpg jpg 4419 11 13 IMAGE-DOWNSAMPLED 1-s2.0-S002195172500315X-gr10.jpg https://s3-eu-west-1.amazonaws.com/prod-ucs-content-store-eu-west/content/pii:S002195172500315X/gr10/DOWNSAMPLED/image/jpeg/751b64b0c9a82551e070e7281bb254c7/gr10.jpg gr10 gr10.jpg jpg 166154 553 572 IMAGE-DOWNSAMPLED 1-s2.0-S002195172500315X-fx1014.jpg https://s3-eu-west-1.amazonaws.com/prod-ucs-content-store-eu-west/content/pii:S002195172500315X/fx1014/DOWNSAMPLED/image/jpeg/d1898cbb16f38ccbb41d882bafb5a190/fx1014.jpg fx1014 fx1014.jpg jpg 4419 11 13 IMAGE-DOWNSAMPLED 1-s2.0-S002195172500315X-fx1015.jpg https://s3-eu-west-1.amazonaws.com/prod-ucs-content-store-eu-west/content/pii:S002195172500315X/fx1015/DOWNSAMPLED/image/jpeg/a62e9d6812d4781d8c3bb0a6aafcdfc9/fx1015.jpg fx1015 fx1015.jpg jpg 4608 12 24 IMAGE-DOWNSAMPLED 1-s2.0-S002195172500315X-fx1016.jpg https://s3-eu-west-1.amazonaws.com/prod-ucs-content-store-eu-west/content/pii:S002195172500315X/fx1016/DOWNSAMPLED/image/jpeg/53c075e332c3d024886e24806c9d7ea8/fx1016.jpg fx1016 fx1016.jpg jpg 4608 12 24 IMAGE-DOWNSAMPLED 1-s2.0-S002195172500315X-fx1017.jpg https://s3-eu-west-1.amazonaws.com/prod-ucs-content-store-eu-west/content/pii:S002195172500315X/fx1017/DOWNSAMPLED/image/jpeg/c5a7c9ed12da06f43dd426e325f89904/fx1017.jpg fx1017 fx1017.jpg jpg 4608 12 24 IMAGE-DOWNSAMPLED 1-s2.0-S002195172500315X-fx1018.jpg https://s3-eu-west-1.amazonaws.com/prod-ucs-content-store-eu-west/content/pii:S002195172500315X/fx1018/DOWNSAMPLED/image/jpeg/40fd0761be3035ddbc1231085883148e/fx1018.jpg fx1018 fx1018.jpg jpg 4608 12 24 IMAGE-DOWNSAMPLED 1-s2.0-S002195172500315X-fx1019.jpg https://s3-eu-west-1.amazonaws.com/prod-ucs-content-store-eu-west/content/pii:S002195172500315X/fx1019/DOWNSAMPLED/image/jpeg/06fa026d3efa47866164ea04653f8928/fx1019.jpg fx1019 fx1019.jpg jpg 4419 11 13 IMAGE-DOWNSAMPLED 1-s2.0-S002195172500315X-gr3.sml https://s3-eu-west-1.amazonaws.com/prod-ucs-content-store-eu-west/content/pii:S002195172500315X/gr3/THUMBNAIL/image/gif/bbd1e4687164c38a1d74e812cab77913/gr3.sml gr3 gr3.sml sml 81521 160 219 IMAGE-THUMBNAIL 1-s2.0-S002195172500315X-gr4.sml https://s3-eu-west-1.amazonaws.com/prod-ucs-content-store-eu-west/content/pii:S002195172500315X/gr4/THUMBNAIL/image/gif/79f16dc9f2218d0daec8fa6c66ab781a/gr4.sml gr4 gr4.sml sml 82162 164 199 IMAGE-THUMBNAIL 1-s2.0-S002195172500315X-gr1.sml https://s3-eu-west-1.amazonaws.com/prod-ucs-content-store-eu-west/content/pii:S002195172500315X/gr1/THUMBNAIL/image/gif/ab62e4ce18ba6d38b47949313af70ee0/gr1.sml gr1 gr1.sml sml 77384 107 219 IMAGE-THUMBNAIL 1-s2.0-S002195172500315X-gr2.sml https://s3-eu-west-1.amazonaws.com/prod-ucs-content-store-eu-west/content/pii:S002195172500315X/gr2/THUMBNAIL/image/gif/6b69141d36c7d74a9b8cc850e69badf6/gr2.sml gr2 gr2.sml sml 81341 159 219 IMAGE-THUMBNAIL 1-s2.0-S002195172500315X-gr9.sml https://s3-eu-west-1.amazonaws.com/prod-ucs-content-store-eu-west/content/pii:S002195172500315X/gr9/THUMBNAIL/image/gif/8355e6c878dbf945a52f6cbeccc97fa7/gr9.sml gr9 gr9.sml sml 81031 111 219 IMAGE-THUMBNAIL 1-s2.0-S002195172500315X-gr7.sml https://s3-eu-west-1.amazonaws.com/prod-ucs-content-store-eu-west/content/pii:S002195172500315X/gr7/THUMBNAIL/image/gif/4a705589e224c48d79328d740ac03169/gr7.sml gr7 gr7.sml sml 77752 160 219 IMAGE-THUMBNAIL 1-s2.0-S002195172500315X-gr8.sml https://s3-eu-west-1.amazonaws.com/prod-ucs-content-store-eu-west/content/pii:S002195172500315X/gr8/THUMBNAIL/image/gif/398d0dccde94aa088fad59a781441083/gr8.sml gr8 gr8.sml sml 76738 136 219 IMAGE-THUMBNAIL 1-s2.0-S002195172500315X-gr5.sml https://s3-eu-west-1.amazonaws.com/prod-ucs-content-store-eu-west/content/pii:S002195172500315X/gr5/THUMBNAIL/image/gif/73a580a451722c15549468358e8af53a/gr5.sml gr5 gr5.sml sml 79261 163 197 IMAGE-THUMBNAIL 1-s2.0-S002195172500315X-gr6.sml https://s3-eu-west-1.amazonaws.com/prod-ucs-content-store-eu-west/content/pii:S002195172500315X/gr6/THUMBNAIL/image/gif/c9506ab09383a500035a5f5fa0a814aa/gr6.sml gr6 gr6.sml sml 74655 80 219 IMAGE-THUMBNAIL 1-s2.0-S002195172500315X-fx1020.sml https://s3-eu-west-1.amazonaws.com/prod-ucs-content-store-eu-west/content/pii:S002195172500315X/fx1020/THUMBNAIL/image/gif/3771d93d61a278c375ed06e3bc88b69b/fx1020.sml fx1020 fx1020.sml sml 4255 33 66 IMAGE-THUMBNAIL 1-s2.0-S002195172500315X-fx1021.sml https://s3-eu-west-1.amazonaws.com/prod-ucs-content-store-eu-west/content/pii:S002195172500315X/fx1021/THUMBNAIL/image/gif/69c1cbd4ba6ff9e7da01707deb6b2ffd/fx1021.sml fx1021 fx1021.sml sml 5866 17 219 IMAGE-THUMBNAIL 1-s2.0-S002195172500315X-ga1.sml https://s3-eu-west-1.amazonaws.com/prod-ucs-content-store-eu-west/content/pii:S002195172500315X/ga1/THUMBNAIL/image/gif/4ca0009807d775ce81e0f1d5c4693fa3/ga1.sml ga1 true ga1.sml sml 78246 88 219 IMAGE-THUMBNAIL 1-s2.0-S002195172500315X-fx1022.sml https://s3-eu-west-1.amazonaws.com/prod-ucs-content-store-eu-west/content/pii:S002195172500315X/fx1022/THUMBNAIL/image/gif/fd9a009a9a78a3237f93f25b9051cf05/fx1022.sml fx1022 fx1022.sml sml 4282 37 51 IMAGE-THUMBNAIL 1-s2.0-S002195172500315X-fx1001.sml https://s3-eu-west-1.amazonaws.com/prod-ucs-content-store-eu-west/content/pii:S002195172500315X/fx1001/THUMBNAIL/image/gif/b8dd83f91a3fea472befa592d73f790e/fx1001.sml fx1001 fx1001.sml sml 4255 33 66 IMAGE-THUMBNAIL 1-s2.0-S002195172500315X-fx1023.sml https://s3-eu-west-1.amazonaws.com/prod-ucs-content-store-eu-west/content/pii:S002195172500315X/fx1023/THUMBNAIL/image/gif/360522af6f7e5411c94ce99943140b74/fx1023.sml fx1023 fx1023.sml sml 4303 37 51 IMAGE-THUMBNAIL 1-s2.0-S002195172500315X-fx1002.sml https://s3-eu-west-1.amazonaws.com/prod-ucs-content-store-eu-west/content/pii:S002195172500315X/fx1002/THUMBNAIL/image/gif/fe9f28afaa8a948e7fbfc224d8672b1d/fx1002.sml fx1002 fx1002.sml sml 5712 21 219 IMAGE-THUMBNAIL 1-s2.0-S002195172500315X-fx1024.sml https://s3-eu-west-1.amazonaws.com/prod-ucs-content-store-eu-west/content/pii:S002195172500315X/fx1024/THUMBNAIL/image/gif/2a2913d9ad936557ed4abd6866d3408e/fx1024.sml fx1024 fx1024.sml sml 4855 22 123 IMAGE-THUMBNAIL 1-s2.0-S002195172500315X-fx1003.sml https://s3-eu-west-1.amazonaws.com/prod-ucs-content-store-eu-west/content/pii:S002195172500315X/fx1003/THUMBNAIL/image/gif/b51ea2c431e5c0c55c347d82275b077d/fx1003.sml fx1003 fx1003.sml sml 4282 37 51 IMAGE-THUMBNAIL 1-s2.0-S002195172500315X-fx1025.sml https://s3-eu-west-1.amazonaws.com/prod-ucs-content-store-eu-west/content/pii:S002195172500315X/fx1025/THUMBNAIL/image/gif/5640cd6fa082f0ce585330a32ce87d61/fx1025.sml fx1025 fx1025.sml sml 4567 22 98 IMAGE-THUMBNAIL 1-s2.0-S002195172500315X-fx1004.sml https://s3-eu-west-1.amazonaws.com/prod-ucs-content-store-eu-west/content/pii:S002195172500315X/fx1004/THUMBNAIL/image/gif/661d42171ae3a570a11bc15839c41284/fx1004.sml fx1004 fx1004.sml sml 5435 19 219 IMAGE-THUMBNAIL 1-s2.0-S002195172500315X-fx1026.sml https://s3-eu-west-1.amazonaws.com/prod-ucs-content-store-eu-west/content/pii:S002195172500315X/fx1026/THUMBNAIL/image/gif/fe4a5e8de3b308aea726f8cb8024084b/fx1026.sml fx1026 fx1026.sml sml 4255 33 66 IMAGE-THUMBNAIL 1-s2.0-S002195172500315X-fx1005.sml https://s3-eu-west-1.amazonaws.com/prod-ucs-content-store-eu-west/content/pii:S002195172500315X/fx1005/THUMBNAIL/image/gif/125a6e65f4f04ba816f0d2ff69946ba1/fx1005.sml fx1005 fx1005.sml sml 4039 31 37 IMAGE-THUMBNAIL 1-s2.0-S002195172500315X-fx1027.sml https://s3-eu-west-1.amazonaws.com/prod-ucs-content-store-eu-west/content/pii:S002195172500315X/fx1027/THUMBNAIL/image/gif/aa21d316879141491ce3f2872e5f9068/fx1027.sml fx1027 fx1027.sml sml 4255 33 66 IMAGE-THUMBNAIL 1-s2.0-S002195172500315X-fx1006.sml https://s3-eu-west-1.amazonaws.com/prod-ucs-content-store-eu-west/content/pii:S002195172500315X/fx1006/THUMBNAIL/image/gif/827e767a5380aa2ecc4e2f1485296f4f/fx1006.sml fx1006 fx1006.sml sml 4929 37 111 IMAGE-THUMBNAIL 1-s2.0-S002195172500315X-fx1028.sml https://s3-eu-west-1.amazonaws.com/prod-ucs-content-store-eu-west/content/pii:S002195172500315X/fx1028/THUMBNAIL/image/gif/9a34610f5bf9a72dd3b01a7479c1b7d5/fx1028.sml fx1028 fx1028.sml sml 4153 31 55 IMAGE-THUMBNAIL 1-s2.0-S002195172500315X-fx1007.sml https://s3-eu-west-1.amazonaws.com/prod-ucs-content-store-eu-west/content/pii:S002195172500315X/fx1007/THUMBNAIL/image/gif/dbb648ded00505d77af18f54a588bc4a/fx1007.sml fx1007 fx1007.sml sml 4255 33 66 IMAGE-THUMBNAIL 1-s2.0-S002195172500315X-fx1008.sml https://s3-eu-west-1.amazonaws.com/prod-ucs-content-store-eu-west/content/pii:S002195172500315X/fx1008/THUMBNAIL/image/gif/14bca8c28d71441856d7a5480f3a3a43/fx1008.sml fx1008 fx1008.sml sml 5359 14 219 IMAGE-THUMBNAIL 1-s2.0-S002195172500315X-fx1009.sml https://s3-eu-west-1.amazonaws.com/prod-ucs-content-store-eu-west/content/pii:S002195172500315X/fx1009/THUMBNAIL/image/gif/055daf0516243a41e617ee427356ee14/fx1009.sml fx1009 fx1009.sml sml 4255 33 66 IMAGE-THUMBNAIL 1-s2.0-S002195172500315X-fx1010.sml https://s3-eu-west-1.amazonaws.com/prod-ucs-content-store-eu-west/content/pii:S002195172500315X/fx1010/THUMBNAIL/image/gif/703b86883d3673d30a65d9193e4e385b/fx1010.sml fx1010 fx1010.sml sml 4255 33 66 IMAGE-THUMBNAIL 1-s2.0-S002195172500315X-fx1011.sml https://s3-eu-west-1.amazonaws.com/prod-ucs-content-store-eu-west/content/pii:S002195172500315X/fx1011/THUMBNAIL/image/gif/c69d9ffc9714a38924909f89fb6d7aa4/fx1011.sml fx1011 fx1011.sml sml 4039 31 37 IMAGE-THUMBNAIL 1-s2.0-S002195172500315X-fx1012.sml https://s3-eu-west-1.amazonaws.com/prod-ucs-content-store-eu-west/content/pii:S002195172500315X/fx1012/THUMBNAIL/image/gif/3fc6511754c87757ca00be00d47f0100/fx1012.sml fx1012 fx1012.sml sml 4255 33 66 IMAGE-THUMBNAIL 1-s2.0-S002195172500315X-fx1013.sml https://s3-eu-west-1.amazonaws.com/prod-ucs-content-store-eu-west/content/pii:S002195172500315X/fx1013/THUMBNAIL/image/gif/278d58d05039584151a173c9f5acc75c/fx1013.sml fx1013 fx1013.sml sml 4039 31 37 IMAGE-THUMBNAIL 1-s2.0-S002195172500315X-gr10.sml https://s3-eu-west-1.amazonaws.com/prod-ucs-content-store-eu-west/content/pii:S0021951725003446/gr10/THUMBNAIL/image/gif/037096e1e45de717a36e457e461e9e0b/gr10.sml gr10 gr10.sml sml 78635 163 169 IMAGE-THUMBNAIL 1-s2.0-S002195172500315X-fx1014.sml https://s3-eu-west-1.amazonaws.com/prod-ucs-content-store-eu-west/content/pii:S002195172500315X/fx1014/THUMBNAIL/image/gif/7488e31dc280ad8be50c78ad4f926f9c/fx1014.sml fx1014 fx1014.sml sml 4039 31 37 IMAGE-THUMBNAIL 1-s2.0-S002195172500315X-fx1015.sml https://s3-eu-west-1.amazonaws.com/prod-ucs-content-store-eu-west/content/pii:S002195172500315X/fx1015/THUMBNAIL/image/gif/c1add4aad2b4c0ea4768a8d68bfc15d5/fx1015.sml fx1015 fx1015.sml sml 4255 33 66 IMAGE-THUMBNAIL 1-s2.0-S002195172500315X-fx1016.sml https://s3-eu-west-1.amazonaws.com/prod-ucs-content-store-eu-west/content/pii:S002195172500315X/fx1016/THUMBNAIL/image/gif/bf96783920d1c6e230e35205f722a529/fx1016.sml fx1016 fx1016.sml sml 4255 33 66 IMAGE-THUMBNAIL 1-s2.0-S002195172500315X-fx1017.sml https://s3-eu-west-1.amazonaws.com/prod-ucs-content-store-eu-west/content/pii:S002195172500315X/fx1017/THUMBNAIL/image/gif/852cc667c863824fb9d73d0996b03148/fx1017.sml fx1017 fx1017.sml sml 4255 33 66 IMAGE-THUMBNAIL 1-s2.0-S002195172500315X-fx1018.sml https://s3-eu-west-1.amazonaws.com/prod-ucs-content-store-eu-west/content/pii:S002195172500315X/fx1018/THUMBNAIL/image/gif/e8ee60cdc7c2055c1f007d96d7c23201/fx1018.sml fx1018 fx1018.sml sml 4255 33 66 IMAGE-THUMBNAIL 1-s2.0-S002195172500315X-fx1019.sml https://s3-eu-west-1.amazonaws.com/prod-ucs-content-store-eu-west/content/pii:S0021951725003446/fx1019/THUMBNAIL/image/gif/2f63ff85aa23eac27dadffef9dfec37e/fx1019.sml fx1019 fx1019.sml sml 4039 31 37 IMAGE-THUMBNAIL 1-s2.0-S002195172500315X-gr3_lrg.jpg https://s3-eu-west-1.amazonaws.com/prod-ucs-content-store-eu-west/content/pii:S002195172500315X/HIGHRES/image/jpeg/abd0318ded89f27003d85e9e545422f6/gr3_lrg.jpg gr3 gr3_lrg.jpg jpg 460224 1694 2324 IMAGE-HIGH-RES 1-s2.0-S002195172500315X-gr4_lrg.jpg https://s3-eu-west-1.amazonaws.com/prod-ucs-content-store-eu-west/content/pii:S002195172500315X/HIGHRES/image/jpeg/0a71b3f0ae55229549af76dce7d143cf/gr4_lrg.jpg gr4 gr4_lrg.jpg jpg 714192 2541 3085 IMAGE-HIGH-RES 1-s2.0-S002195172500315X-gr1_lrg.jpg https://s3-eu-west-1.amazonaws.com/prod-ucs-content-store-eu-west/content/pii:S002195172500315X/HIGHRES/image/jpeg/daf43807bf43113c7c22063dae823e55/gr1_lrg.jpg gr1 gr1_lrg.jpg jpg 493088 1514 3089 IMAGE-HIGH-RES 1-s2.0-S002195172500315X-gr2_lrg.jpg https://s3-eu-west-1.amazonaws.com/prod-ucs-content-store-eu-west/content/pii:S002195172500315X/HIGHRES/image/jpeg/f5fc4e2eba781c19761c1ae6c349b994/gr2_lrg.jpg gr2 gr2_lrg.jpg jpg 587742 2212 3047 IMAGE-HIGH-RES 1-s2.0-S002195172500315X-gr9_lrg.jpg https://s3-eu-west-1.amazonaws.com/prod-ucs-content-store-eu-west/content/pii:S002195172500315X/HIGHRES/image/jpeg/952fa7f735e8b07839d449454c9339b8/gr9_lrg.jpg gr9 gr9_lrg.jpg jpg 637850 1545 3056 IMAGE-HIGH-RES 1-s2.0-S002195172500315X-gr7_lrg.jpg https://s3-eu-west-1.amazonaws.com/prod-ucs-content-store-eu-west/content/pii:S002195172500315X/HIGHRES/image/jpeg/b19e8f48dcf9292200e326122faf87b4/gr7_lrg.jpg gr7 gr7_lrg.jpg jpg 711600 2222 3042 IMAGE-HIGH-RES 1-s2.0-S002195172500315X-gr8_lrg.jpg https://s3-eu-west-1.amazonaws.com/prod-ucs-content-store-eu-west/content/pii:S002195172500315X/HIGHRES/image/jpeg/d78809f8f54dfbba708d7febea8134d6/gr8_lrg.jpg gr8 gr8_lrg.jpg jpg 677231 1898 3061 IMAGE-HIGH-RES 1-s2.0-S002195172500315X-gr5_lrg.jpg https://s3-eu-west-1.amazonaws.com/prod-ucs-content-store-eu-west/content/pii:S002195172500315X/HIGHRES/image/jpeg/b77ae9d555244604b8f716b0917da378/gr5_lrg.jpg gr5 gr5_lrg.jpg jpg 578679 2551 3075 IMAGE-HIGH-RES 1-s2.0-S002195172500315X-gr6_lrg.jpg https://s3-eu-west-1.amazonaws.com/prod-ucs-content-store-eu-west/content/pii:S002195172500315X/HIGHRES/image/jpeg/8af4c7245757c598ff621091fd378a13/gr6_lrg.jpg gr6 gr6_lrg.jpg jpg 455464 1029 2809 IMAGE-HIGH-RES 1-s2.0-S002195172500315X-fx1020_lrg.jpg https://s3-eu-west-1.amazonaws.com/prod-ucs-content-store-eu-west/content/pii:S002195172500315X/HIGHRES/image/jpeg/4b81c3c9f1a0bd14d31e9efa0344c481/fx1020_lrg.jpg fx1020 fx1020_lrg.jpg jpg 5544 33 66 IMAGE-HIGH-RES 1-s2.0-S002195172500315X-fx1021_lrg.jpg https://s3-eu-west-1.amazonaws.com/prod-ucs-content-store-eu-west/content/pii:S002195172500315X/HIGHRES/image/jpeg/4aee2b3136e97250e2e3559f60bf1b06/fx1021_lrg.jpg fx1021 fx1021_lrg.jpg jpg 16835 49 641 IMAGE-HIGH-RES 1-s2.0-S002195172500315X-ga1_lrg.jpg https://s3-eu-west-1.amazonaws.com/prod-ucs-content-store-eu-west/content/pii:S002195172500315X/HIGHRES/image/jpeg/d91fb504223e12866f6918e5382b0509/ga1_lrg.jpg ga1 true ga1_lrg.jpg jpg 235671 536 1333 IMAGE-HIGH-RES 1-s2.0-S002195172500315X-fx1022_lrg.jpg https://s3-eu-west-1.amazonaws.com/prod-ucs-content-store-eu-west/content/pii:S002195172500315X/HIGHRES/image/jpeg/db2e6ae31f1dc7de076b27c9f5fb9529/fx1022_lrg.jpg fx1022 fx1022_lrg.jpg jpg 5574 37 51 IMAGE-HIGH-RES 1-s2.0-S002195172500315X-fx1001_lrg.jpg https://s3-eu-west-1.amazonaws.com/prod-ucs-content-store-eu-west/content/pii:S002195172500315X/HIGHRES/image/jpeg/c50b5a9410e4328f0ca602c829bee53b/fx1001_lrg.jpg fx1001 fx1001_lrg.jpg jpg 5544 33 66 IMAGE-HIGH-RES 1-s2.0-S002195172500315X-fx1023_lrg.jpg https://s3-eu-west-1.amazonaws.com/prod-ucs-content-store-eu-west/content/pii:S002195172500315X/HIGHRES/image/jpeg/73496896c8dc9120c95860b5926afcf7/fx1023_lrg.jpg fx1023 fx1023_lrg.jpg jpg 5557 37 51 IMAGE-HIGH-RES 1-s2.0-S002195172500315X-fx1002_lrg.jpg https://s3-eu-west-1.amazonaws.com/prod-ucs-content-store-eu-west/content/pii:S002195172500315X/HIGHRES/image/jpeg/23e6bbbf5251b7adafb777f29b6c5d53/fx1002_lrg.jpg fx1002 fx1002_lrg.jpg jpg 13070 43 443 IMAGE-HIGH-RES 1-s2.0-S002195172500315X-fx1024_lrg.jpg https://s3-eu-west-1.amazonaws.com/prod-ucs-content-store-eu-west/content/pii:S002195172500315X/HIGHRES/image/jpeg/47325d42892b1a8d56e9c4b88b3dda13/fx1024_lrg.jpg fx1024 fx1024_lrg.jpg jpg 6284 22 123 IMAGE-HIGH-RES 1-s2.0-S002195172500315X-fx1003_lrg.jpg https://s3-eu-west-1.amazonaws.com/prod-ucs-content-store-eu-west/content/pii:S002195172500315X/HIGHRES/image/jpeg/ed96254c539d57a8a4499c50337b5a7a/fx1003_lrg.jpg fx1003 fx1003_lrg.jpg jpg 5574 37 51 IMAGE-HIGH-RES 1-s2.0-S002195172500315X-fx1025_lrg.jpg https://s3-eu-west-1.amazonaws.com/prod-ucs-content-store-eu-west/content/pii:S002195172500315X/HIGHRES/image/jpeg/e49b7c85daead4b32d396c5a61706308/fx1025_lrg.jpg fx1025 fx1025_lrg.jpg jpg 5835 22 98 IMAGE-HIGH-RES 1-s2.0-S002195172500315X-fx1004_lrg.jpg https://s3-eu-west-1.amazonaws.com/prod-ucs-content-store-eu-west/content/pii:S002195172500315X/HIGHRES/image/jpeg/fbf689cffdb93ba64aa8abe6ed40d873/fx1004_lrg.jpg fx1004 fx1004_lrg.jpg jpg 11252 37 417 IMAGE-HIGH-RES 1-s2.0-S002195172500315X-fx1026_lrg.jpg https://s3-eu-west-1.amazonaws.com/prod-ucs-content-store-eu-west/content/pii:S002195172500315X/HIGHRES/image/jpeg/218d09180bff1a8ec588ef85759c864c/fx1026_lrg.jpg fx1026 fx1026_lrg.jpg jpg 5544 33 66 IMAGE-HIGH-RES 1-s2.0-S002195172500315X-fx1005_lrg.jpg https://s3-eu-west-1.amazonaws.com/prod-ucs-content-store-eu-west/content/pii:S002195172500315X/HIGHRES/image/jpeg/74d38160b687dad979175dc5ace166de/fx1005_lrg.jpg fx1005 fx1005_lrg.jpg jpg 5029 31 37 IMAGE-HIGH-RES 1-s2.0-S002195172500315X-fx1027_lrg.jpg https://s3-eu-west-1.amazonaws.com/prod-ucs-content-store-eu-west/content/pii:S002195172500315X/HIGHRES/image/jpeg/2a25afda0eb270aadf8f3dc573ece53a/fx1027_lrg.jpg fx1027 fx1027_lrg.jpg jpg 5544 33 66 IMAGE-HIGH-RES 1-s2.0-S002195172500315X-fx1006_lrg.jpg https://s3-eu-west-1.amazonaws.com/prod-ucs-content-store-eu-west/content/pii:S002195172500315X/HIGHRES/image/jpeg/58c32987458d9ee4798cfd5b210413a9/fx1006_lrg.jpg fx1006 fx1006_lrg.jpg jpg 6498 37 111 IMAGE-HIGH-RES 1-s2.0-S002195172500315X-fx1028_lrg.jpg https://s3-eu-west-1.amazonaws.com/prod-ucs-content-store-eu-west/content/pii:S002195172500315X/HIGHRES/image/jpeg/b3322fc36fde21fd0be0072f1648e982/fx1028_lrg.jpg fx1028 fx1028_lrg.jpg jpg 5176 31 55 IMAGE-HIGH-RES 1-s2.0-S002195172500315X-fx1007_lrg.jpg https://s3-eu-west-1.amazonaws.com/prod-ucs-content-store-eu-west/content/pii:S002195172500315X/HIGHRES/image/jpeg/b630fad4d7c339d04230132f01807683/fx1007_lrg.jpg fx1007 fx1007_lrg.jpg jpg 5544 33 66 IMAGE-HIGH-RES 1-s2.0-S002195172500315X-fx1008_lrg.jpg https://s3-eu-west-1.amazonaws.com/prod-ucs-content-store-eu-west/content/pii:S002195172500315X/HIGHRES/image/jpeg/ac3f84a29d95e6642932c931f9412524/fx1008_lrg.jpg fx1008 fx1008_lrg.jpg jpg 13733 37 570 IMAGE-HIGH-RES 1-s2.0-S002195172500315X-fx1009_lrg.jpg https://s3-eu-west-1.amazonaws.com/prod-ucs-content-store-eu-west/content/pii:S002195172500315X/HIGHRES/image/jpeg/2d49aea735b27ff0701be56bbd5a60ac/fx1009_lrg.jpg fx1009 fx1009_lrg.jpg jpg 5544 33 66 IMAGE-HIGH-RES 1-s2.0-S002195172500315X-fx1010_lrg.jpg https://s3-eu-west-1.amazonaws.com/prod-ucs-content-store-eu-west/content/pii:S002195172500315X/HIGHRES/image/jpeg/7487f9f8e4a7e4867933f0b363fd54b0/fx1010_lrg.jpg fx1010 fx1010_lrg.jpg jpg 5544 33 66 IMAGE-HIGH-RES 1-s2.0-S002195172500315X-fx1011_lrg.jpg https://s3-eu-west-1.amazonaws.com/prod-ucs-content-store-eu-west/content/pii:S002195172500315X/HIGHRES/image/jpeg/e03ba821546492f1cfc9e5f550f08e78/fx1011_lrg.jpg fx1011 fx1011_lrg.jpg jpg 5029 31 37 IMAGE-HIGH-RES 1-s2.0-S002195172500315X-fx1012_lrg.jpg https://s3-eu-west-1.amazonaws.com/prod-ucs-content-store-eu-west/content/pii:S002195172500315X/HIGHRES/image/jpeg/eace431ebe7ac0aee0c0296d899219c6/fx1012_lrg.jpg fx1012 fx1012_lrg.jpg jpg 5544 33 66 IMAGE-HIGH-RES 1-s2.0-S002195172500315X-fx1013_lrg.jpg https://s3-eu-west-1.amazonaws.com/prod-ucs-content-store-eu-west/content/pii:S002195172500315X/HIGHRES/image/jpeg/26a81f98a3dbfd0142a49e53ccf04738/fx1013_lrg.jpg fx1013 fx1013_lrg.jpg jpg 5029 31 37 IMAGE-HIGH-RES 1-s2.0-S002195172500315X-gr10_lrg.jpg https://s3-eu-west-1.amazonaws.com/prod-ucs-content-store-eu-west/content/pii:S0021951725003446/HIGHRES/image/jpeg/ddd0e24aed7786f5182edc95082380da/gr10_lrg.jpg gr10 gr10_lrg.jpg jpg 699559 2448 2533 IMAGE-HIGH-RES 1-s2.0-S002195172500315X-fx1014_lrg.jpg https://s3-eu-west-1.amazonaws.com/prod-ucs-content-store-eu-west/content/pii:S002195172500315X/HIGHRES/image/jpeg/da6bea8fdcc6d7b042e59ff76f44b4e1/fx1014_lrg.jpg fx1014 fx1014_lrg.jpg jpg 5029 31 37 IMAGE-HIGH-RES 1-s2.0-S002195172500315X-fx1015_lrg.jpg https://s3-eu-west-1.amazonaws.com/prod-ucs-content-store-eu-west/content/pii:S002195172500315X/HIGHRES/image/jpeg/9f6149262747a7b97f8b74917f25978a/fx1015_lrg.jpg fx1015 fx1015_lrg.jpg jpg 5544 33 66 IMAGE-HIGH-RES 1-s2.0-S002195172500315X-fx1016_lrg.jpg https://s3-eu-west-1.amazonaws.com/prod-ucs-content-store-eu-west/content/pii:S002195172500315X/HIGHRES/image/jpeg/69a3a532292fffcd58b85d6b97221d63/fx1016_lrg.jpg fx1016 fx1016_lrg.jpg jpg 5544 33 66 IMAGE-HIGH-RES 1-s2.0-S002195172500315X-fx1017_lrg.jpg https://s3-eu-west-1.amazonaws.com/prod-ucs-content-store-eu-west/content/pii:S0021951725003446/HIGHRES/image/jpeg/718faefe4ffe62253ecc09b0399fde83/fx1017_lrg.jpg fx1017 fx1017_lrg.jpg jpg 5544 33 66 IMAGE-HIGH-RES 1-s2.0-S002195172500315X-fx1018_lrg.jpg https://s3-eu-west-1.amazonaws.com/prod-ucs-content-store-eu-west/content/pii:S0021951725003446/HIGHRES/image/jpeg/1896139124c1a1b1e1c6d5b1395283f9/fx1018_lrg.jpg fx1018 fx1018_lrg.jpg jpg 5544 33 66 IMAGE-HIGH-RES 1-s2.0-S002195172500315X-fx1019_lrg.jpg https://s3-eu-west-1.amazonaws.com/prod-ucs-content-store-eu-west/content/pii:S0021951725003446/HIGHRES/image/jpeg/dc5c36363b289800b50b11bb4b1c6605/fx1019_lrg.jpg fx1019 fx1019_lrg.jpg jpg 5029 31 37 IMAGE-HIGH-RES 1-s2.0-S002195172500315X-mmc1.pdf https://s3-eu-west-1.amazonaws.com/prod-ucs-content-store-eu-west/content/pii:S002195172500315X/mmc1/MAIN/application/pdf/c2be71cb8bd1979fbdb0cde165c82d09/mmc1.pdf mmc1 mmc1.pdf pdf false 1356411 APPLICATION 1-s2.0-S002195172500315X-si103.svg https://s3-eu-west-1.amazonaws.com/prod-ucs-content-store-eu-west/content/pii:S002195172500315X/image/svg+xml/fd714a9f135a50c202d75933e4974a29/si103.svg si103 si103.svg svg 2280 ALTIMG 1-s2.0-S002195172500315X-si109.svg https://s3-eu-west-1.amazonaws.com/prod-ucs-content-store-eu-west/content/pii:S002195172500315X/image/svg+xml/503dc2a1bbc1cb9de347e09f91c33de7/si109.svg si109 si109.svg svg 3144 ALTIMG 1-s2.0-S002195172500315X-si12.svg https://s3-eu-west-1.amazonaws.com/prod-ucs-content-store-eu-west/content/pii:S002195172500315X/image/svg+xml/af2c99cb8527b91be097f71e776ee356/si12.svg si12 si12.svg svg 3315 ALTIMG 1-s2.0-S002195172500315X-si13.svg https://s3-eu-west-1.amazonaws.com/prod-ucs-content-store-eu-west/content/pii:S002195172500315X/image/svg+xml/e0254e42700641a8fa35fb249ab65b0f/si13.svg si13 si13.svg svg 1550 ALTIMG 1-s2.0-S002195172500315X-si14.svg https://s3-eu-west-1.amazonaws.com/prod-ucs-content-store-eu-west/content/pii:S002195172500315X/image/svg+xml/141820ee91f765a5e6300d27e88dda6a/si14.svg si14 si14.svg svg 7271 ALTIMG 1-s2.0-S002195172500315X-si15.svg https://s3-eu-west-1.amazonaws.com/prod-ucs-content-store-eu-west/content/pii:S002195172500315X/image/svg+xml/6470b353f26a86fd33c09efc8d37e5b9/si15.svg si15 si15.svg svg 5291 ALTIMG 1-s2.0-S002195172500315X-si17.svg https://s3-eu-west-1.amazonaws.com/prod-ucs-content-store-eu-west/content/pii:S002195172500315X/image/svg+xml/91c0fbdbad6ac7c3af357264dd6e32e0/si17.svg si17 si17.svg svg 1258 ALTIMG 1-s2.0-S002195172500315X-si19.svg https://s3-eu-west-1.amazonaws.com/prod-ucs-content-store-eu-west/content/pii:S002195172500315X/image/svg+xml/98208e91c89ca75db0aad20ea9344cdc/si19.svg si19 si19.svg svg 4524 ALTIMG 1-s2.0-S002195172500315X-si2.svg https://s3-eu-west-1.amazonaws.com/prod-ucs-content-store-eu-west/content/pii:S002195172500315X/image/svg+xml/86081a79fe59c59ea20bb97d0808836e/si2.svg si2 true si2.svg svg 1424 ALTIMG 1-s2.0-S002195172500315X-si20.svg https://s3-eu-west-1.amazonaws.com/prod-ucs-content-store-eu-west/content/pii:S002195172500315X/image/svg+xml/33708d8fb76b239e6754d4fd1199b314/si20.svg si20 si20.svg svg 9308 ALTIMG 1-s2.0-S002195172500315X-si22.svg https://s3-eu-west-1.amazonaws.com/prod-ucs-content-store-eu-west/content/pii:S002195172500315X/image/svg+xml/67ef454693dfcc9948ef2ef10e9eff63/si22.svg si22 si22.svg svg 3502 ALTIMG 1-s2.0-S002195172500315X-si23.svg https://s3-eu-west-1.amazonaws.com/prod-ucs-content-store-eu-west/content/pii:S002195172500315X/image/svg+xml/bbd07faa92245b83af6ff82a0a6755eb/si23.svg si23 si23.svg svg 3359 ALTIMG 1-s2.0-S002195172500315X-si24.svg https://s3-eu-west-1.amazonaws.com/prod-ucs-content-store-eu-west/content/pii:S002195172500315X/image/svg+xml/3ab23ec5eec61ce0fa89ec2ffc7c477b/si24.svg si24 si24.svg svg 1389 ALTIMG 1-s2.0-S002195172500315X-si25.svg https://s3-eu-west-1.amazonaws.com/prod-ucs-content-store-eu-west/content/pii:S002195172500315X/image/svg+xml/7ca5c469c7db63ef4c64558f30a4cb0a/si25.svg si25 si25.svg svg 702 ALTIMG 1-s2.0-S002195172500315X-si26.svg https://s3-eu-west-1.amazonaws.com/prod-ucs-content-store-eu-west/content/pii:S002195172500315X/image/svg+xml/88393af7ea432ff6a97c4660622d9397/si26.svg si26 si26.svg svg 4240 ALTIMG 1-s2.0-S002195172500315X-si27.svg https://s3-eu-west-1.amazonaws.com/prod-ucs-content-store-eu-west/content/pii:S002195172500315X/image/svg+xml/6e62220cce8fc01486e20caf9182a37f/si27.svg si27 si27.svg svg 1456 ALTIMG 1-s2.0-S002195172500315X-si28.svg https://s3-eu-west-1.amazonaws.com/prod-ucs-content-store-eu-west/content/pii:S002195172500315X/image/svg+xml/6420859a510c51ecd8f567c4e07485bf/si28.svg si28 si28.svg svg 1886 ALTIMG 1-s2.0-S002195172500315X-si3.svg https://s3-eu-west-1.amazonaws.com/prod-ucs-content-store-eu-west/content/pii:S002195172500315X/image/svg+xml/9b09f8396822361063a08b830301a69c/si3.svg si3 si3.svg svg 9314 ALTIMG 1-s2.0-S002195172500315X-si34.svg https://s3-eu-west-1.amazonaws.com/prod-ucs-content-store-eu-west/content/pii:S002195172500315X/image/svg+xml/ae63200f24aa87fda73714f3fcc9fb2a/si34.svg si34 si34.svg svg 3146 ALTIMG 1-s2.0-S002195172500315X-si4.svg https://s3-eu-west-1.amazonaws.com/prod-ucs-content-store-eu-west/content/pii:S002195172500315X/image/svg+xml/a33cc996f42585c79bef1cc7c7ff80cb/si4.svg si4 si4.svg svg 13002 ALTIMG 1-s2.0-S002195172500315X-si49.svg https://s3-eu-west-1.amazonaws.com/prod-ucs-content-store-eu-west/content/pii:S002195172500315X/image/svg+xml/8b992b0dfe09aabf10a4a281a6d10d70/si49.svg si49 si49.svg svg 4372 ALTIMG 1-s2.0-S002195172500315X-si5.svg https://s3-eu-west-1.amazonaws.com/prod-ucs-content-store-eu-west/content/pii:S002195172500315X/image/svg+xml/552d623cc615eb6ed97640eb52ceae56/si5.svg si5 si5.svg svg 15202 ALTIMG 1-s2.0-S002195172500315X-si51.svg https://s3-eu-west-1.amazonaws.com/prod-ucs-content-store-eu-west/content/pii:S002195172500315X/image/svg+xml/0b380a22e5103bf3e337fbfad8c0a3f4/si51.svg si51 si51.svg svg 8198 ALTIMG 1-s2.0-S002195172500315X-si53.svg https://s3-eu-west-1.amazonaws.com/prod-ucs-content-store-eu-west/content/pii:S002195172500315X/image/svg+xml/842419c77b181e3b72b9c0927c2a1e5a/si53.svg si53 si53.svg svg 43684 ALTIMG 1-s2.0-S002195172500315X-si54.svg https://s3-eu-west-1.amazonaws.com/prod-ucs-content-store-eu-west/content/pii:S002195172500315X/image/svg+xml/f51feddadbe5e9690d88c94f5b939297/si54.svg si54 si54.svg svg 6306 ALTIMG 1-s2.0-S002195172500315X-si55.svg https://s3-eu-west-1.amazonaws.com/prod-ucs-content-store-eu-west/content/pii:S002195172500315X/image/svg+xml/43ee904ef8c784f31cb3bfd7107ecc43/si55.svg si55 si55.svg svg 5966 ALTIMG 1-s2.0-S002195172500315X-si56.svg https://s3-eu-west-1.amazonaws.com/prod-ucs-content-store-eu-west/content/pii:S002195172500315X/image/svg+xml/7101983ea91cd90efac49e880371b466/si56.svg si56 si56.svg svg 1296 ALTIMG 1-s2.0-S002195172500315X-si6.svg https://s3-eu-west-1.amazonaws.com/prod-ucs-content-store-eu-west/content/pii:S002195172500315X/image/svg+xml/12d5e974e56117d9c5ce78d4c2bf214e/si6.svg si6 si6.svg svg 12978 ALTIMG 1-s2.0-S002195172500315X-si66.svg https://s3-eu-west-1.amazonaws.com/prod-ucs-content-store-eu-west/content/pii:S002195172500315X/image/svg+xml/d33fcb6aef26ae9c36fdaefc75b4080a/si66.svg si66 si66.svg svg 6270 ALTIMG 1-s2.0-S002195172500315X-si68.svg https://s3-eu-west-1.amazonaws.com/prod-ucs-content-store-eu-west/content/pii:S002195172500315X/image/svg+xml/a05cef1eff042eba2075d9ee7c0e47d4/si68.svg si68 si68.svg svg 2351 ALTIMG 1-s2.0-S002195172500315X-si7.svg https://s3-eu-west-1.amazonaws.com/prod-ucs-content-store-eu-west/content/pii:S002195172500315X/image/svg+xml/201ec25895b0bf96fe61a285ba3e9569/si7.svg si7 si7.svg svg 767 ALTIMG 1-s2.0-S002195172500315X-si71.svg https://s3-eu-west-1.amazonaws.com/prod-ucs-content-store-eu-west/content/pii:S002195172500315X/image/svg+xml/d81cd1a277caee331244bf4328697edd/si71.svg si71 true si71.svg svg 1685 ALTIMG 1-s2.0-S002195172500315X-si8.svg https://s3-eu-west-1.amazonaws.com/prod-ucs-content-store-eu-west/content/pii:S002195172500315X/image/svg+xml/59c1c62928a3e9f284b04b71ca3e8bb3/si8.svg si8 si8.svg svg 763 ALTIMG 1-s2.0-S002195172500315X-si87.svg https://s3-eu-west-1.amazonaws.com/prod-ucs-content-store-eu-west/content/pii:S002195172500315X/image/svg+xml/e58a6319698f179134f6b6cbf3503d21/si87.svg si87 si87.svg svg 3137 ALTIMG 1-s2.0-S002195172500315X-si89.svg https://s3-eu-west-1.amazonaws.com/prod-ucs-content-store-eu-west/content/pii:S002195172500315X/image/svg+xml/1d3a3d4cfaa54497574895d505e1bf43/si89.svg si89 si89.svg svg 3171 ALTIMG 1-s2.0-S002195172500315X-si9.svg https://s3-eu-west-1.amazonaws.com/prod-ucs-content-store-eu-west/content/pii:S002195172500315X/image/svg+xml/d8199638134c4dc497d28b802730470e/si9.svg si9 si9.svg svg 752 ALTIMG YJCAT 116250 116250 S0021-9517(25)00315-X 10.1016/j.jcat.2025.116250 The Author(s) Fig. 1 (a) Nitrogen atoms were placed on the slab in a nearest neighbor (NN) and next nearest neighbor (NNN) scheme. (b) Proton Donors were placed above the nitrogen atoms in both neighborhood schemes. (c) Selection of proton donors was based on their position on the Kamlet–Tafts Quadrant. Fig. 2 Comparison of Li interactions with N2 and 2N atoms at all symmetry sites in the (a) the NN scheme (b) NNN scheme. PD selected here is ethanol. (c) Bar chart showing the outcomes of structures relaxed in both neighborhood schemes and (d) the probability that an outcome is the most stable for a given PD considering all outcomes possible for that PD. Fig. 3 UMAP projection of relaxed Li3N configurations in the presence of PDs. Clusters are color-coded by emergent geometric themes with representative structures visualized as insets. Purple atoms are lithium, blue are nitrogen atoms. Fig. 4 Proton Donors effect on (a–b) surface nitride formation Energy at the (a) 1NN site (b) 2NN site, and (c–d) Interaction Energy at the (c) 1NN site (d) 2NN site. Fig. 5 Proton Donors effect on (a–b) Protonation Energy at the (a) NN site (b) NNN site, and (c–d) Interaction Energy at the (c) NN site (d) NNN site. Fig. 6 Correlations between the two-layer displacement and the interaction energy in (a) the NN scheme, (b) the NNN scheme. Similar correlations can be seen between the two-layer displacement and the nitride formation energy in (c) the NN scheme, and (d) the NNN scheme. Fig. 7 Correlations between the two-layer displacement and the (a) interaction energy and (b) the surface nitride formation energy in the NNN scheme. Similar correlations can be seen between the two-layer displacement and (c) the Interaction Energy, and (d) the nitride formation energy in the NN scheme. Fig. 8 Correlations between the two-layer displacement in the NNN scheme and (a) Electrophilic N Charge, (b) Nucleophilic N Charge Gain, and (c) Total 2N charge gain. Interaction energy is shown to correlate with (d) Electrophilic N Charge, (e) Nucleophilic N Charge Gain, and (f) Total 2N charge gain. Fig. 9 Correlation Analysis between PD Chemistry and thermodynamic indicators of stability. Correlation shown between (a) Kamlet–Taft β , (b) Gutmann Donor Number, and the interaction energy. (c) Heatmap showing correlation strength between PD chemistry parameters and the interaction (Int.) and nitride formation (NF.) energy. (d) Similar correlation heatmap for correlations between PD chemistry and indicators of thermodynamic stability for protonated Li3N. Fig. 10 Mapping of PD parameters in KT space to understand PD outcome of minimum energy configurations. Distribution of PD outcomes in (a) KT α − β space in NN scheme, (b) α − β across entire data, (c) KT π − β space in NN scheme, and (d) π − β space across entire dataset. (b) α − β in NNN scheme. (c) AN-DN space across all data. Research Article Lithium nitride (Li3N) formation in lithium-mediated electrochemical ammonia synthesis can be enhanced with the right proton donor Victor Azumah Writing – review & editing Writing – original draft Visualization Validation Methodology Investigation Formal analysis Data curation Conceptualization a Lance Kavalsky Writing – review & editing Supervision Software Conceptualization b Venkatasubramanian Viswanathan Writing – review & editing Supervision Resources Project administration Funding acquisition Conceptualization c b ⁎ a Department of Chemical Engineering, University of Michigan, Ann Arbor, MI 48109, USA Department of Chemical Engineering, University of Michigan Ann Arbor MI 48109 USA o=Department of Chemical Engineering, University of Michigan, c=Ann Arbor, s=MI,sp=, p=48109, cy=USA b Department of Mechanical Engineering, University of Michigan, Ann Arbor, MI 48109, USA Department of Mechanical Engineering, University of Michigan Ann Arbor MI 48109 USA o=Department of Mechanical Engineering, University of Michigan, c=Ann Arbor, s=MI,sp=, p=48109, cy=USA c Department of Aerospace Engineering, University of Michigan, Ann Arbor, MI 48109, USA Department of Aerospace Engineering, University of Michigan Ann Arbor MI 48109 USA o=Department of Aerospace Engineering, University of Michigan, c=Ann Arbor, s=MI,sp=, p=48109, cy=USA ⁎ Corresponding author at: Department of Chemical Engineering, University of Michigan, Ann Arbor, MI 48109, USA. Department of Chemical Engineering, University of Michigan Ann Arbor MI 48109 USA Lithium-mediated electrochemical ammonia synthesis (LiMEAS) hinges on the formation of lithium nitride (Li3N) from dissociated nitrogen at a lithium surface. Although proton donors (PDs) are known to influence nitrogen activation, their specific role in promoting Li3N formation is still being investigated. Herein, we employ density functional theory (DFT) to examine the effects of 17 PDs on the stability and energetics of Li3N formation. We show that in the absence of PD, Li3N formation is consistently outcompeted by subsurface N2 embedding and, in some cases, by surface N2 adsorption. However, the introduction of PD species yields three distinct outcomes: (i) the PD remains intact during Li3N formation, (ii) the PD protonates Li3N, or (iii) the PD undergoes structural change. Notably, configurations in which the PD remains intact exhibited greater stability compared to subsurface embedding, driven by PD-induced surface reconstruction. We quantify this reconstruction using a two-layer displacement metric and find a strong correlation between the magnitude of displacement and the system’s overall stability. Further charge analyses show that the enhanced Li3N stability correlates with a greater electron transfer to nitrogen. Finally, we link the basicity, acidity and polarity of PD with the results of the formation of nitride, demonstrating that the basicity of PD promotes intact configurations Li3N. In contrast, higher acidity and polarity lead to protonation and alteration of PD. These insights pinpoint a region in the Kamlet–Taft β – π space where PDs remain intact and foster stable Li3N, informing future strategies to design more efficient LiMEAS systems. Graphical abstract Keywords Electrochemical ammonia synthesis Lithium-mediated nitrogen reduction Nitrogen dissociation Density functional theory Proton donor Data availability Data will be made available on request. 1 Introduction Ammonia production contributes approximately 1%–2% to global greenhouse gas emissions, primarily due to the energy-demanding Haber–Bosch process—a process that has recently become a prime target for electrification efforts [1–10]. Among the many electrochemical strategies proposed to replace this conventional method, metal nitride-mediated synthesis has emerged as particularly promising, mainly because lithium acts as the principal electrocatalyst, yielding enhanced Faradaic efficiencies. This approach, known as lithium-mediated electrochemical ammonia synthesis (LiMEAS), consistently delivers current efficiencies exceeding 60% while achieving robust ammonia production yields [11–14]. The LiMEAS process unfolds through three main stages: (i) electrodeposition of lithium onto a substrate (Eq. (1)), (ii) generation of a lithium nitride film via the dissociation of molecular nitrogen (Eq. (2)), and (iii) subsequent hydrogenation of the nitride by a proton donor, which releases ammonia and regenerates lithium ions (Eq. (3)). The overall electrochemical reaction can be summarized as follows: (1) Li + (aq) + e − → Li (s) (2) 3 Li (s) + 1 2 N 2 ( g ) → Li 3 N (s) (3) Li 3 N (s) + 3H + (aq) → 3Li + (aq) + NH 3 (g) (4) 1 2 N 2 ( g ) + 3 ( H + + e − ) → NH 3 (g) With the realization of a full-cell proof-of-concept [15–18], lithium’s capacity to cleave the robust triple bond in nitrogen at near-ambient conditions has been demonstrated to be central to this process’ success [19–23]. In particular, lithium-induced splitting of the nitrogen molecule competes with the hydrogen evolution reaction, the primary side reaction that diminishes Faradaic efficiency [24,25]. These enhancements in both activity and selectivity give LiMEAS a distinct advantage over previous electrochemical methods for ammonia synthesis, which have long been hampered by poor selectivity [14,22,23,25–30]. However, even with LiMEAS’s impressive current and Faradaic efficiency, there are challenges to increasing the cyclability and overall yield of the system [11,12,31,32]. Electrolyte design and cathode material modifications have emerged as powerful levers to optimize LiMEAS further. For example, Jeon et al. have shown that incorporating Ag into a copper cathode significantly enhances ammonia production by promoting the formation of LiF and Ag–Li alloys within the SEI, thereby reducing Li plating overpotentials—especially in fluorine-containing electrolytes [33]. In parallel, Li et al. demonstrated that a chain ether-based solvent, with its high boiling point (162, °C) and non-polymerizing properties, supports a compact SEI on the gas diffusion electrode, allowing 300h continuous operation at room temperature and 1bar pressure with a current-to-ammonia efficiency of 64% and a gas-phase ammonia content of approximately 98% [34]. Further advancing our understanding, Chang et al. emphasized the catalytic role of the SEI by systematically analyzing its chemical species and reaction pathways, linking its composition to improved product selectivity and kinetics in LiNRR [35]. Electrolyte engineering has also proven to be effective: Liu et al. replaced tetrahydrofuran with 1,2-diethoxyethane (DEE), which weakens interfacial passivation and induces a general corrosion behavior that nearly doubles the Faradaic efficiency (from 33.4% to 61.7%) [36]. Similarly, investigations by Cai et al. into ether-based solvents revealed that dimethoxyethane minimizes potential losses, while tetrahydrofuran achieves a faradaic efficiency of 58.5 ± 6.1% at ambient pressure by affecting ion solvation and SEI composition [37]. Additionally, Iriawan et al. found that an upshift in the Li + /Li potential – attained using more dissociative lithium salts at higher concentrations – correlates with improved ammonia production stability and efficiency through beneficial modifications in the SEI (notably enriched with LiF and LiOEt species) [38]. Finally, Fu et al. provided systematic information on the influence of lithium salt selection in a continuous flow reactor, identifying lithium tetrafluoroborate (LiBF 4 ) as the optimal salt to achieve ammonia selectivity 61%, while lithium bis (trifluoromethanesulfonyl)imide (LiTFSI) underperformed due to catalyst poisoning [39]. When designing an electrolyte for LiMEAS, the choice of proton donor (PD) is crucial, as it notably influences the morphology of the interface [40]. In particular, the Kamlet–Taft (KT) parameters have been correlated with nitrogen reduction activity [41]. Investigations of PD behavior have revealed that while an optimal PD can enhance interface morphology and improve Faradaic efficiency, exceeding a certain threshold can lead to excessive hydrogen evolution, undermining ammonia synthesis [42]. Initially regarded solely as a source of protons to drive nitrogen reduction — and thus a tool to modulate hydrogen evolution through its availability and dissociation characteristics [15,16]—recent studies have also explored the potential of proton shuttles [11] and proton donors with intermediate dissociation strengths [43]. Emerging findings indicate that the role of PD in shaping interfacial morphology may extend beyond merely supplying protons; its involvement in the formation of lithium nitride remained an open question [32,40,42]. We note that experimental studies, including Du et al. [44], have demonstrated the sensitivity of LiMEAS performance to proton donor identity. However, reactor conditions and electrolyte composition can lead to widely divergent results even for the same proton donor species. Our first-principles calculations aim to complement these studies by isolating and clarifying the atomic-scale mechanisms, specifically how proton donor chemistry influences lithium surface structure and nitride formation stability, providing a molecular-level framework for interpreting and guiding experimental findings. However, experimental investigations of proton donor effects are complicated by the interplay of reactor design, electrolyte properties, gas diffusion, and operational parameters, which can confound intrinsic mechanistic interpretations. Thus, a systematic first-principles approach is valuable to isolate the fundamental atomic-scale interactions underpinning lithium nitride formation and nitrogen reduction. While the formation of lithium nitride is assumed to be spontaneous, previous work on lithium nitridation shows that even in the presence of pure metallic lithium, nitride formation is not spontaneous under dry conditions and requires facilitation due to the presence of a humid environment, or elevated temperatures or pressures [19]. This finding, in addition to similar findings of improvements in LiNRR efficiencies in the presence of water and oxygen [45,46]. These works suggest that lithium nitride formation is highly influenced by the local environment within which the nitrogen interacts with the lithium surface. However, we found no prior work exhaustively probed this hypothesis. In our previous work, we began to bridge this knowledge gap by demonstrating that PD affects the strength of nitrogen adsorption on the lithium slab, revealing two proton-free nitrogen configurations with substantially stronger interactions and identifying a thermodynamically favorable path to formation Li3N from PD-induced N2 [47]. Herein, we build on this finding by investigating the effects of PD on Li3N formation and exploring how PD influences the process following dissociation. Utilizing density-functional theory (DFT) calculations, we demonstrate that Li3N formation after the dissociation of N2 on the surface is less favored compared to processes like N2 subsurface embedding. However, the presence of PD may lead to the formation of more stable Li3N in scenarios where proton transfer or PD decomposition did not occur. This increased favorability of Li3N formation in the presence of PD was consistent across all 17 PDs studied, which were selected to represent the KT space. We further show that the creation of these stable Li3N configurations results from PD-induced surface reconstruction. Charge and correlation analyses indicate a strong dependence of nitrogen reduction on this induced reconstruction, and further analyses elucidate the integral role of PD in Li3N formation by establishing direct connections to its chemistry. Thus, our work underscores the importance of PD in influencing nitride formation at the atomic level. 2 Methods 2.1 Computational parameters Density functional theory (DFT) calculations were carried out with GPAW within the Atomic Simulation Environment (ASE) framework [48,49]. The structures were generated through the AutoCat software package and relaxed until the atomic forces fell below a convergence threshold of 0.05 eV/Å [50]. The Bayesian Error Estimation Functional with van der Waals correlation (BEEF-vdW) was employed to model electron–electron exchange–correlation interactions. A finite difference method was used with a grid spacing of 0.16 Å, along with a 4 × 4 × 1 Monkhorst–Pack k-point grid to sample the Brillouin zone of the surfaces. To improve the convergence of the self-consistent field (SCF) algorithm, electron occupations were smeared using the Fermi-Dirac method with a width of 0.05 eV. Adsorbates were positioned on one side of the slab, and a dipole correction was applied accordingly. Slabs were chosen to be 3 × 3 × 4 with the bottom 2 layers fixed and top 2 layers allowed to move. 2.2 Lithium nitride formation baseline In this work, we study the adsorption energetics of two nitrogen atoms on the Li(100) slab, which was chosen as prior work showed that nitrogen adsorption was strongest on this facet [47]. This step serves to provide a fundamental understanding of the thermodynamics of nitride formation after nitrogen molecule dissociation and to set a baseline for which subsequent studies can be compared. Nitrogen atoms were placed 1.5 Å above the slab, well within the bond length (1.927 Å) predicted by our bulk relaxations and in agreement with prior literature [51]. Here we restricted the initial placement of both atoms to the same kind of symmetry site to reduce the combinatorics. For this bcc100 surface, the three symmetry site types are ontop, bridge, and hollow. To explore the potential energy landscape, the two atoms were also placed at nearest neighbor (NN) symmetry sites and next nearest neighbor (NNN) sites, with each configuration having placements at the respective symmetry sites as shown in (Fig. 1a). We will compare this to the minimum energy of different orientations of the nitrogen molecule N2 at the same sites to assess the thermodynamic drive from adsorption to nitride. The adsorption energy between the nitrogen atoms and the slab, which we will define as the nitride formation (NF) energy, is calculated via: (5) where E 2 N is the surface nitride formation energy, n the number of nitrogen atoms, E s l a b − 2 N is the DFT energy of the two nitrogen atoms (N) on the lithium slab, E s l a b is the energy of the lithium slab alone, and is the DFT energy of an isolated nitrogen molecule. For the nitrogen molecule, the adsorption energy is calculated using a similar scheme to Eq. (5) as: (6) Here we define the DFT energy of a nitrogen molecule ( ) adsorbed on the lithium slab as . 2.3 Lithium nitride formation in the presence of a proton donor (PD) The effects of the proton donor on formation are studied in the two neighborhood schemes NN and NNN by placing the PD halfway between the two nitrogen atoms (Fig. 1b). Each PD was initially placed much further from the slab at 3 Å. However, PD interaction ability is maximized by using the most electrophilic atom (determined by charge analysis) as the placement anchor, and each symmetry site is explored, consistent with our established scheme. Drawing from the insights established by previous literature showing the PD’s Kamlet–Taft (KT) parameters to be indicators of LiMEAS, we select our PDs to span over each quadrant of the KT space (Fig. 1c) [41]. To allow for variety in the exploration of the PD’s effects on the surface nitride formation landscape, three different configurations are generated for each PD, each one having the PD uniquely aligned along the x-, y-, or z -axis. This means that for each PD, we have 3 unique sites, 3 orientations, and 2 neighbor schemes, resulting in 18 calculations per PD. As the presence of the PD introduces another layer of interaction into our system, the energy between the components is the interaction energy which is calculated using: (7) where E i n t is the interaction energy, E s l a b − P D − 2 N is the DFT energy of the model system, E s l a b is the energy of the pristine lithium slab, and E P D and E N 2 represent the energies of the isolated proton donor and the isolated nitrogen molecule respectively. When the PD is absent from the model, the interaction energy is equivalent to the NF energy in Eq. (5). Thus, to allow a comparison of the PD-calculated interaction energies with the NF energies set by the baseline, the energy of the final configuration is obtained after removing the PD. Eq. (5) is used to calculate the NF energy of the PD-induced nitride structure. 2.4 Geometric analysis and dimensionality reduction To understand the nature of the underlying nitride structures and their similarities and differences, structural analysis was performed on all final configurations after the PD was removed, allowing them to be compared to the baseline nitrides. This analysis was done by encoding each structure using DScribe’s Smooth Overlap of Atomic Positions (SOAP) descriptor, interfacing with our in-house AutoCat software, to obtain vectors of fixed length [48,49,52–57]. We then perform dimensionality reduction on these structure encodings of the slab to two dimensions via the Uniform Manifold Approximation Projection (UMAP) algorithm [58]. Any subsequent clustering after identifying unique and recurring themes is done with the HDBSCAN clustering algorithm [59]. 2.5 Statistical analysis and significance testing All statistical analyses were performed using the Pingouin statistical package in Python [60]. Pearson’s product-moment correlation coefficients (r values) were computed to quantify the strength and direction of linear relationships between numerical descriptors—including surface reconstruction metrics, interaction energies, nitride formation energies, and proton donor (PD) chemical parameters. The r value ranges from −1 to 1, where 1 indicates a perfect positive linear correlation, −1 indicates a perfect negative linear correlation, and 0 indicates no linear relationship. Correlation strength was interpreted as follows: nonexistent for —r— between 0.0 and 0.3, weak between 0.3 and 0.5, moderate between 0.5 and 0.7, strong between 0.7 and 0.9, and near-perfect above 0.9. The statistical significance of correlations was assessed using two-tailed tests at a significance level of α = 0.05. The associated p value represents the probability of observing a correlation as extreme as the computed r value under the null hypothesis of no relationship. Correlations were considered statistically significant when p < 0 . 05 , regardless of the absolute magnitude of r. The blue shaded regions in correlation plots represent the 95% confidence intervals of the linear regression fit, calculated from the standard error of the regression, and indicate the range within which the true regression line is expected to fall with 95% confidence. To assess the dependence of DFT-induced numerical changes on the categorical variable of proton donor identity, one-way analysis of variance (ANOVA) tests were performed. In these analyses, the numerical descriptor was treated as the dependent variable, while proton donor identity served as the independent factor. A p -value less than 0.05 was considered statistically significant. Where significant differences were detected, no post hoc comparisons were conducted, as the objective was to determine the existence of dependency rather than to resolve individual groupwise differences. Normality and homogeneity of variances were assumed for all statistical tests unless otherwise indicated. 3 Results and discussion 3.1 Nitride formation on the lithium slab As the goal of this work is to understand formation in the context of LiMEAS, we start with a simplified model of the system, abstracting the interactions of all the components that are generally present in experiments and allowing us to focus on the thermodynamics of isolated surface nitride formation. Primarily, we aim to isolate the behavior of PD-2N when it is present in the presence of lithium alone, with an extension to SEI surfaces reserved for a future study. Motivating this approach, we note that the continuous deposition employed in LiNRR does not preclude the existence of metallic Li, even in the presence of an SEI [31,61,62]. Additionally, both within the field of LiNRR and in general studies of lithium-metal batteries, where SEI plays a role, excluding SEI to focus solely on metallic lithium behaviors facilitated theoretical insights into probing the influence of lithium metal on system interactions [37,47,62–66]. With this baseline model, we can begin to add complexity to our system with the introduction of the PD to understand then how its presence changes the interaction. From our most straightforward model, we relaxed the two nitrogen atoms on the 100 facet of the lithium slab, opting for two neighborhood configurations, a nearest neighbor (NN) placement and a next nearest neighbor (NNN) placement at all three unique symmetry sites (Fig. 1a). For the 100 surface, these are the ontop site, where each nitrogen atom sits directly on a lithium atom; the bridge site, where each nitrogen atom sits in between two lithium atoms directly adjacent to each other; and the hollow site, where the nitrogen atom sits at the four-fold coordination point between surface lithium atoms. With three sites and two neighborhood configurations, this resulted in six calculations. For all of these sites, we also investigated the adsorption of the nitrogen molecule N2 as well as the thermodynamics of its subsurface embedding across 3 axis-oriented configurations. We then compared the minimum energy for N2 adsorption and subsurface embedding at each site with the surface nitride formation energy at the same site as shown in Fig. 2(a–b). With the initial placement well within the bond length of bulk and the initial distance between nitrogen atoms at or greater than the lithium lattice constant (3.32 Å), we expected all configurations to form some nitride system, with each nitrogen atom coordinating with their own set of lithium atoms. We found that the relaxed configurations for all but one system are consistent with these expectations. In the NN placement at the ontop site, we find that the two nitrogen atoms recombine into the nitrogen molecule despite an initial separation distance of more than 300% the bond length (1.097 Å). Considering the energetics of the system in Fig. 2a, we see that the formation of at the ontop site is thermodynamically unfavorable with initial placement at the NN site. Even with initial placements at the hollow and bridge site, where surface nitride formation is thermodynamically favorable, our results show that adsorption is energetically preferred to surface nitride formation at the three sites, although the subsurface N2 is by far the most dominant process. However, with initial nitrogen atom placement at the NNN sites, surface nitride formation at the bridge and hollow sites become more thermodynamically favored over N2 adsorption at the same sites, although again at the top site adsorption is stronger than surface nitride formation. However, this improvement within the NNN scheme is not enough to displace subsurface N2 formation as the most thermodynamically favored process. That surface nitride formation gets more favored over adsorption within the NNN scheme suggests that favorable formation, at least on the 100 facet, requires significant nitrogen atom diffusion ( 2 × the lattice constant) across the slab to occur. This would require multiple site-hopping steps, which may lead to a more significant kinetic barrier towards surface nitride formation. Either way, the strong thermodynamic drive towards subsurface N2 formation suggests a propensity towards interactions with the lithium bulk. However, this need not be inhibitive to the formation of nitride, as the existing literature examining the dissociation of N2 reveals a subsurface N2 transition state, suggesting that subsurface N2 formation could be a precursor to Li3N formation [50,66]. 3.2 Proton donor (PD) effects on formation After establishing a baseline understanding of how forms in the absence of the PD, we next introduce different PDs into our model to probe their effect on surface nitride formation thermodynamics. Consistent with our established model for surface nitride formation, we explore the impact of the presence of PD on all symmetrically relevant sites in two neighborhood regimes (Fig. 1b). Here, we introduce variance to our PD effects and increase our sampling of the energy landscape by modeling three different axis-aligned PD orientations for each site-neighborhood configuration considered. This allows us to probe for consistent effects within and across PDs and enables a more systematic probing of their effects on surface nitride formation. 3.2.1 Proton donor selection We selected 17 PDs to use in our model as their chemical identity could have significant and varying effects on the formation of the underlying nitride. For this work, it was important that the PDs selected were both field-relevant and varied enough to establish different chemical environments around the nitrogen atoms. The Kamlet–Taft selection criterion for the effects of PD identity on LiMEAS activity established by previous work [41] provides such a guide for PD selection. That work unveiled that PDs with high Kamlet–Taft α and β showed activity towards LiMEAS when tested, whereas those in the three red quadrants were inactive. Thus, drawing from the insights established by previous literature showing that PD Kamlet–Taft (KT) parameters are indicators of LiMEAS activity, we select our PDs to span each quadrant of the KT space, including linear aliphatic alcohols such as ethanol and butanol, shuttle-type PDs such as phenol and solvent species tetrahydrofuran (Fig. 1c). Here, α measures the strength of hydrogen bond donating (proton-donating) [67], β measures the strength of hydrogen bond accepting (basicity) [68], and π ∗ captures the solvent polarity effects [69]. These parameters provide a chemical framework for understanding how proton donors may influence surface interactions, electron transfer, and ammonia production efficiency. Furthermore, due to speculation that tetrahydropyran could be a viable candidate to reduce the effects of SEI impermeability, it was included as a PD of interest [42]. For a complete list of the species explored, refer to the Supplementary Material. In the following sections, we discuss structural and thermodynamic trends observed across PDs and insights into PD effects obtained from a combination of charge and statistical analysis. 3.2.2 structures evolved in the presence of PD Completing geometric relaxations with the PD present resulted in a bifurcation in themes seen across PDs pertaining to the lithium slab and the behavior of nitrogen atoms and the PD. The themes relating to PD behavior are primarily an indication of the PD’s end state in the final configuration. This serves as an indicator of the PD’s ability to facilitate Li3N formation without engaging in adverse interactions. This was done to ensure consistency across configurations that were used in downstream analysis. We classify final proton donor (PD) behaviors into three categories based on their interaction with the lithium–nitrogen system: “Intact”, where the PD remains chemically unchanged while stabilizing the formation of the expected Li3N (Fig. 2c); “Protonated”, where the PD transfers a proton to Li3N, altering the chemistry of both the PD and the nitride; and “Altered”, where the PD undergoes decomposition or reacts with nitrogen to form N-derivative species. These outcomes are analyzed in detail in later sections for their practical implications in LiMEAS, particularly regarding their influence on system stability, electron transfer, and the efficiency of nitride formation. Furthermore, the evolution of these themes suggests that events such as protonation of Li3N by PD are not purely sequential events but can occur concurrently with nitride formation, providing a pathway for early stage NH3 release without requiring full decomposition of the PD. This indicates that certain PDs may simultaneously stabilize Li3N and act as effective proton sources, a dual function relevant for the practical design of LiMEAS. In Fig. 2c, we see that both the Intact and Altered grouping have a higher occurrence than the Protonated grouping. Looking at the minimum energy configuration for each PD, we show in Fig. 2d the number of groupings possible within each PD and the proportion of minimum energy configurations corresponding to a particular grouping. We find that if only one grouping was possible for a PD, it was equally likely (proportion = 0.5) that the PD would remain intact, resulting in the expected Li3N configuration or be altered, resulting in decomposition. This suggests that there exist PDs for which surface nitride formation is the only possible interaction between Li, 2N atoms, and the PD. In contrast, there are also PDs for which decomposition of the PD itself is the only expected route. We find this to hold true for both the NN and NNN schemes (Fig. S1). When two states were possible, the proportion of the Altered PDs remained the same at 0.5, with the Intact PDs ceding some proportion to the Protonated group as the most energetically favorable configuration. We assert this to be the case as Fig. S1d shows that for our data, the protonated nitride configuration was thermodynamically favored over the nonprotonated Li3N nitride configuration (with Intact PD) whenever the only two possible PD outcomes were Intact and Protonated regardless of the neighborhood scheme. Although it appears that the formation of protonated nitride thermodynamically dominates the other two in the NN scheme whenever it was possible (fig. S1e), that is not the case for the NNN scheme where our analysis in fig. S1f. Thus, we cannot yet rule out the importance of Li3N formation accompanied by Altered PD. However, here we confine our dataset to the expected Li3N configurations where the PD remains intact, as they allow for an unambiguous one-to-one comparison with our established baseline. Fig. 2c shows adequate neighborhood representation in all our datasets, allowing statistical analyses to be performed on both types of neighborhood. Using our Intact dataset, we explore the themes derived from the lithium slab behavior, using SOAP to encode the slab, created after the PD was removed, into vectors. These encoded vectors are then visualized in two-dimensional space using UMAP, encouraging the localization of similar structures by minimizing the distance between points and allowing structures sufficiently far from each other to be considered a group. The resulting structures were assigned arbitrary labels based on their clustering in two-dimensional space and before label updates were given based on similarities in qualitative behavior. To understand these projected clusters, we consider the average surface nitride formation energies (E(Li-2N)) of each cluster (Table S1). We then confirm the similarity between the in-group structures through manual visual inspection. Combining these two methods, we find that clusters of unique structures display an absolute deviation in their mean surface nitride formation energy of less than 0.1 eV. In Fig. 3, we show the results of this clustering method, elucidating 7 different Li3N configurations, which we named based on the unique structural moieties resulting from the interaction of the N atom with the Li atoms. The seven named Li3N are dubbed (a) the square procession, (b) the distorted square procession, (c) the single free, (d) the concealed procession, (e) the shared corner squares, (f) the Li zip, and finally (g) the triangle-square. Square Procession. Representing the most abundant Li3N structures (Fig. S2a), these clusters of structures are so-called due to the unique six Li atom structure, forming a 2 × 3 Li row coordinating with the subsurface/buried N atoms. Four such clusters are shown in Fig. 3, with an average surface nitride formation energy of −2.42 eV, with all identified clusters lying 0.1 eV within this mean energy. Despite being the most abundant state, this structure type is associated with the lowest mean surface nitride formation energy (Fig. S2b and Table S1). Distorted Square Procession. With a mean energy of −2.47 eV, the distorted square procession represents a configuration akin to the square procession. However, the coordination between the N atoms and the 2 × 3 Li row is not as clean, resulting in a distortion of the Li atoms and the N atoms that are not completely buried. Single Free. Progressing in mean energy from the distorted square procession structures with an average energy −2.73 eV, these clusters of structures are characterized by a single buried N atom, coordinating almost randomly with Li atoms. Its name comes from the single N atom that is always observed to coordinate loosely with Li atoms on the surface. Conceal Procession. Similar to the square procession, the concealed procession presents a 2 × 3 Li structure coordinated by subsurface N atoms. However, this cluster shows much closer coordination than in the square procession, aided by the presence of an additional Li atom, which completely conceals the N atoms. This unique configuration results in a much more stable average energy of −2.79 eV. Shared Corner Squares. Unlike any of the square procession configurations, the shared corner square configurations are a seven-Li structure in which four Li atoms each coordinate in a square-like structure with a subsurface N atom. The two squares are joined by a common Li atom, thus giving these clusters their name. The average surface nitride formation energy for this group is −2.87 eV. Li Zip. Having structures most similar to the shared-corner square, this surface Li3N configuration is also characterized by seven Li atoms that coordinate to bury the N atoms. It derives its name from the unique displacement of the shared Li atom, which results in three Li atoms across the structure, having a high surface nitride formation energy of −2.94 eV. Triangle-Square. Representing the other side of the shared corner squares configuration, these structures are characterized by a separation of the N atoms to form a square of Li atoms burying one N atom and a triangle of Li atoms burying the other. This class of structures is the most stable, presenting the lowest surface nitride formation energy of −2.99 eV. 3.2.3 PD effects on energetics of nitride formation We turn to an assessment of the effect of PD on surface nitride formation’s energetics. Here, we use Eq. (7) to calculate the interaction energy, the net energy of the system after all individual components are removed, and Eq. (5) to calculate the equivalent surface nitride formation energy (NF) after removal of PD to allow comparison with our baseline. In Fig. 4, we compare the interaction energies and NF energies between species with critical benchmarks for other competing behaviors in the system. In particular, we look at how PD-induced surface nitride formation compares to N2 adsorption, PD-free/baseline surface nitride formation within the NN and NNN neighborhood regimes, and finally the most stable PD-assisted adsorption calculated in previous work. PDs are arranged within each plot by their minimum energy from highest to lowest. Looking at the surface nitride formation energy within the NN regime (Fig. 4a), we find that the PD increases the favorability of when compared to the most thermodynamically favorable baseline nitrides in both neighborhood regimes. Nitride formation is also favored over nitrogen adsorption, although competition with adsorbed N2 phases formed by the influence of PD could be challenging. Within the NNN regime (Fig. 4b), the formation of nitride appears to be thermodynamically favored over the competing nitrogen interactions considered for most investigated PD species. This difference in behavior across the two neighborhood regimes is consistent with observed behaviors with the baseline nitride, where, similarly to what we see here, the thermodynamics of surface nitride formation is stronger within the NNN regime. We note that these surface nitride formation energies exist for systems that are stabilized only through the presence of the PD. We next consider the interaction energy, which is a metric for the overall stability of the system. We find that in both the NN regime (Fig. 4c) and the NNN regime (Fig. 4d), the interaction energies of the Li-PD-N2 system is much more negative than any of the pure Li-N2 energies. This confirms that the presence of PD during the PD-induced formation of Li3N does not destabilize the system with respect to the PD-absent system. The prediction of more thermodynamically favorable Li3N(Fig. 4(a–b)) in the presence of a PD-stabilized lithium-nitrogen system (Fig. 4(c-d)) is in line with experimental studies by McFarlene et al. [19], who showed increased nitride formation on lithium in the presence of humidified N2 and may underlie the increased Faradaic efficiencies observed in lithium-mediated systems when trace water and oxygen are introduced into the electrolyte [45,46]. 3.2.4 Comparative energetics for the PD-induced protonation The protonation of Li3N during or after its formation is an important intermediate step to NH3 formation in the lithium-mediated process. In this section, we explore the thermodynamics of the protonated configurations evolved during our structural relaxation. We do this by adsorbing a single hydrogen in the PD-absent systems Li3N that we established during our baseline study to provide a new comparative baseline for the thermodynamics of PD-induced protonation. Similar to our nitride systems, we allow for comparison between the PD-induced protonated system and the PD-absent one by getting the energy of the Protonated configuration deprotonated PD. For these systems, we can thus define the protonation energy which we can find using: (8) where E N − N H is the protonation energy, n the number of nitrogen atoms, E s l a b − N − N H is the DFT energy of the nitrogen atom (N) and a protonated nitrogen atom (NH) on the lithium slab, E s l a b is the energy of the lithium slab alone, is the DFT energy of an isolated nitrogen molecule, and is the DFT energy of an isolated hydrogen molecule. As we did not find doubly protonated ( or NNH2) configurations, we find Eq. (8) sufficient to provide a comparison to PD-absent protonation. In Fig. 5, we show how protonation of Li3N due to proton transfer from PD compares to protonation from a free proton H. Fig. 5a shows the protonation energy in the NN scheme. We find that for all PDs studied, the minimum energy configuration due to proton transfer from the PD is less thermodynamically favored than protonation from the free proton (black line). This observation is shown to be the same for the NNN scheme (Fig. 5b), within which fewer PDs are observed to experience proton transfer. Perhaps more interestingly, when looking at the interaction energy for these protonated in the NN scheme (Fig. 5c), we find that some of these configurations – despite being the most thermodynamically stable system for their respective PD – are destabilized with respect to protonation from a free hydrogen atom. Although this is expected for molecules without protons such as ethane and propane, we find this also to be the case for PDs like ethanol and 1-propanol that have been shown to be active in LiMEAS [40–42]. In the NNN regime (Fig. 5d ), we find propane and ethane still show destabilization of their protonated systems with respect to free hydrogen protonation. However, for all other species, we find a larger and more negative interaction energy compared to the PD-free system. Aggregating the results of Fig. 5, we deduce that PD-induced protonation of Li3N is primarily stabilized by the presence of PD through the interaction energy. 3.3 Understanding PD-induced behavior 3.3.1 PD-induced slab reorganization We seek now to understand the source of the PD’s nitride stabilizing effect on surface nitride formation and gain insight into the comparative instability of the protonated structures. Motivated by the plethora of emergent nitride structures discussed previously, we hypothesize that the presence of PD could induce the reorganization of lithium atoms to facilitate more stable surface nitride formation. We tested this hypothesis by using the average positional displacement of freely moving atoms in our final configuration when compared to a reference slab as a metric to quantify the degree of slab reorganization. We calculate this average displacement using: (9) Two-Layer Displacement = 1 N ∑ i = 1 N ( x i − x 0 ) 2 + ( y i − y 0 ) 2 + ( z i − z 0 ) 2 where ( x , y , z ) i represent atomic positions in our final configuration and ( x , y , z ) 0 represent atomic positions in our reference slab. We compare the final configurations with the pristine slab (Fig. 6a). Additionally, we consider displacements in the first and second atomic layers separately in addition to their average, which we dub the 2-layer displacement. We verify the physicality of this metric by comparing it to the surface energy of the lithium slab, calculated after obtaining the energy of the relaxed lithium slab without any adsorbates. In Fig. 6b, we observe that for all three displacement metrics, the surface energy increases as the atoms in the slab undergo more displacement. In line with our intuition, surface atoms experience more displacement on average than atoms in the second layer, and the 2-layer displacement lies between the two groups. With both references across all displacement types, we find that the surface energy of the PD-reorganized slab is much lower than that of the pristine slab, lending credence to the need for the PD to stabilize the slab. It is also worth noting that with reconstructions ranging from 0.2 Å to 1.2 Å, Li-slab atoms are displaced on average 6%–40% of the slab’s lattice constant. To elucidate the effect of reconstruction on thermodynamics, we consider in Fig. 7 any statistically significant correlations between the average 2-layer displacement of each proton donor species and their energetics. Within the NNN regime (Fig. 7a), we find a strong negative correlation (−0.926) between the interaction energy and the average 2-layer displacement compared to the pristine slab. This suggests, perhaps counterintuitively, that configurations with the greatest slab reorganization are the most stable. To understand this more clearly, we look at how the average displacements when compared to similar baselines correlate with the surface nitride formation energy within the same neighborhood regime (Fig. 7b). We find a moderately positive correlation (0.64) between the surface nitride formation energy and the displacement of the free atoms. From this we deduce that the stability of the underlying nitride structure decreases with increasing displacement compared to that of baseline systems. Considering both results in tandem suggests that while the nitrides formed by slab reorganization may not be as stable (from NF energy), the PD manages to stabilize the system through the interaction energy, allowing the Li slab to accommodate greater degrees of reorganization to form a nitride. Within the NN regime, we find only a moderately negative correlation (−0.645) between the interaction energy and the displacement of the free atoms (Fig. 7c). Consistent with the NNN regime, albeit to a lesser extent, the PD appears to stabilize larger displacements through the interaction. Unlike the NN regime, we find a moderate negative correlation (−0.647) between the surface nitride formation energy and the average atomic displacement compared to comparable baseline slabs (Fig. 7d). This correlation indicates increasing stability of the underlying nitride with increasing slab reorganization, again reinforcing the idea that PD-induced reorganization of the lithium slab is a driver for surface nitride formation. For the protonated structures, performing similar analysis shows a strongly positive correlation (0.748) between the protonation energy and the 2-layer displacement in the NN scheme. However, this corresponds to a weak correlation (−0.336) with the interaction energy. This suggests that while increasing the average displacement of free atoms may lead to more stable protonated forms, the formation of these protonated structures is not solely due to the PD’s influence on the Li slab. This is further emphasized in the NNN regime where we find a weakly positive correlation (0.508) between the protonation energy and the 2-layer displacement corresponding to a moderately negative interaction energy correlation of −0.661. The core insight of these correlations is that the PD-induced reorganization of the Li surface has a much stronger effect on stabilizing the formation of nitrides than it does facilitating proton transfer (see Fig. S3). 3.3.2 PD effects on nitrogen reduction The dissociative reduction of nitrogen from its elemental state (oxidation state 0) to its trivalent state (oxidation state −3) during the formation of its nitride phase is deemed to be a crucial step in electrochemical ammonia synthesis via a dissociative pathway. Thus, we performed Bader charge analysis on the final configurations to understand how the presence of the PD affects nitrogen reduction during surface nitride formation and elucidate any correlations with the PD’s slab reorganization effects. In Fig. 8, we consider how the charge on both nitrogen atoms change with increasing slab reorganization [70]. For the NNN regime, we find that the two-layer displacement is strongly correlated (−0.760) with the minimum charge gained on any of the N atoms (electrophilic N) (Fig. 8a). Similar but stronger correlation strengths are found for both the charge gained on the nucleophilic N atom (−0.945; Fig. 8b) and the total charge gained across both N atoms (−0.952; Fig. 8c). This suggests that increasing the two-layer displacement, which is a proxy for the degree of surface reconstruction, results in an increased reduction of the N atom on the Li surface, providing a direct link for the effect of PD on nitrogen reduction. In the NN regime (Fig. S4), there is only a moderately negative correlation (−0.540) between the charge on the least reduced nitrogen and the Li slab (Fig. S4a). However, in the most reduced nitrogen atom (Fig. S4b), we find a slightly stronger negative correlation between the nitrogen charge and the reorganization of the Li slab. In both regimes, we see that, as the reorganization increases, the degree of nitrogen reduction in the underlying nitride makes it more trivalent and thus more similar to nitrogen in the bulk nitride. We speculate that the weakening correlation in the NN regime may be a result of destructive interactions between nitrogen and the PD’s reorganization effect. These findings establish a mechanistic link between PD-induced surface reconstruction and enhanced Li3N stability. Specifically, we find that greater slab reorganization correlates strongly with increased electron transfer to nitrogen atoms, facilitating their reduction towards a trivalent ( ) state. This deeper reduction is expected to strengthen Li–N bonding interactions, thereby stabilizing the resulting nitride phase more effectively than on unreconstructed or less distorted surfaces. We additionally find that all three charge parameters are strongly positively correlated with the interaction energy (Fig. 8(d–f)) with the electrophilic, nucleophilic and total 2N charge gained having correlation strengths of 0.733, 0.909 and 0.917 respectively. This tells us that systems with more negative interaction energies are associated with a more reduced N. Alternatively, the greater the degree of reduction of N atoms, the more stable the system. As N atom reduction occurs primarily due to its interaction with the Li surface, this means that the formation of a more energetically stable PD-induced Li3N drives greater reduction of N on the surface, which further stresses the importance of PD in this interaction. 3.4 Kamlet–Taft parameters as predictors for PD behavior and resulting outcomes So far, we have shown that PD increases the stability of Li3N for all PDs (Fig. 4) and only stabilizes the protonation of Li3N for certain PDs (Fig. 5). We have successfully linked this influence to the PD’s ability to induce reconstruction on the Li surface (Fig. 7), forcing it into structural configurations favorable for Li3N formation with reduced N reduction(Fig. 8). In this section, we seek to concretize our understanding of the effect of PD as a driving force for Li3N formation, Li3N protonation and finally its decomposition in the presence of dissociated N atoms. We look to the chemistry of these PDs to understand how they affect these phenomena of interest. We use the Kamlet–Taft parameters as a starting point of this discussion, as our previous work has shown them to be descriptors of LiMEAS activity [41] and a strong predictor of N2 bond length elongation in cases where protonation of N2 occurred [47]. With the Kamlet–Taft α parameter being a measure of a PD’s hydrogen-bond-donating strength, we expect that it will remain a strong predictor for proton transfer activity on Li3N ( ∗ H + 2 N → N + NH ∗ ). We use the interaction (Int.) energy as the starting point for our analysis for Li3N formation, Li3N protonation, and dissociation of PD in Li3N. We perform additional analyses on the surface nitride formation (NF.) and protonation energies where appropriate, and we also try to understand correlations between the PD’s chemistry and nitrogen charge across the surface. We expand our suite of descriptors of PD chemistry to capture a diverse range of PD behavior. To account for the effects of polarity, we explore correlations with the Kamlet–Taft π ∗ [71] and the Dimroth and Reichardt E T [72,73]. In addition to the Kamlet–Taft α which serves as a measure of PD acidity, we include the Gutmann Acceptor number (AN), a measure of Lewis acidity [74,75], and other acidity measures such as the acid dissociation constant (pKa). We augment our parameter list for basicity measures, too, adding to the Kamlet–Taft β parameter, the Gutmann Donor number (DN) [74,75]. Consistent with our previous correlation analysis, we classify correlation values of magnitude from 0 to 0.3 to be a negligible correlation, between 0.3 and 0.5 to be a low correlation, between 0.5 and 0.7 to be moderate, between 0.7 and 0.9 to be strong, and above 0.9 to be nearly perfect [47]. 3.4.1 Correlations with Li3N formation Exploring the correlation between the interaction energy of the NNN configuration with PD intact and the parameters of interest, we find a strong negative correlation (−0.815) associated with the Kamlet–Taft beta β parameter (Fig. 9a). This means that the interaction energy decreases as the β parameter increases, making the system more stable. As β indicates hydrogen bond-accepting behavior, we ascertain that the stability of the underlying Li3N through the interaction energy increases with increasing Kamlet–Taft β . Similarly, strong correlations are found with other measures of bond basicity considered, with a strong negative correlation found to exist with the Donor Number (DN) of −0.838 (Fig. 9b). This suggests that the stabilizing influence of PD on Li3N formation is not exclusively linked to the hydrogen-bond acceptance activity of the PD, but also the electron pair donation activity of the PD. These correlations highlight an interaction that is facilitated primarily through electron transfer, with the nucleophilicity of the PD being an intervening factor. This point is further reinforced when looking at the correlations between the interaction energy and the Kamlet–Taft α parameter, an indicator of hydrogen-bond donation behavior. Here, perhaps expectedly, we find a low and statistically insignificant correlation of −0.458 between α and the interaction energy(Fig. 9c). However, in contrast, strong correlations are found with measures of electron pair acceptance such as the Gutmann Acceptor Number (AN), with a negative correlation of −0.766 and a positive correlation with the acid dissociation constant pKa (0.738). This suggests that increasing acidity, either by increasing the acceptor number or by lowering the pKa, results in more negative interaction energy, thus resulting in more stable underlying nitrides Li3N. Synthesizing this result leads to the assessment that the nucleophilic properties of PD are important to facilitate the stabilization of Li3N through the interaction energy. From the analysis to date, we are led to believe that both the electrophilic (acceptance of electron pairs) and the nucleophilic (donation of electron pairs) properties of PD are necessary to facilitate stable formation Li3N. The moderately negative correlation (−0.658) between the interaction energy and the Kamlet–Taft pi parameter π further suggests that increasing the polarity of the PD results in a higher negative interaction energy, thus stabilizing Li3N. A similarly moderately negative correlation (−0.645) is found with Dimroth–Reichardt E T , another measure of hydrogen bond polarity. Combining all of these findings suggests that highly amphoteric PDs are necessary for stable Li3N formation due to their ability to receive and transfer electron pairs. The correlation with polarity may thus be as a result of the resultant polarity arising from the presence of these highly acidic and basic centers. We continue to build our understanding of the system by expanding our analysis to the nitride formation energy, which highlights the stability of Li3N formed without the PD. Here, we find low and statistically insignificant correlations between the chosen measures of basicity, the Kamlet–Taft β (0.366) and the Gutmann Donor number (0.313). On the other hand, when considering measures of acidity, we find moderate correlations of 0.629 with the Gutmann Acceptor Number, −0.692 with the pKa, and 0.649 with the Kamlet–Taft α . From these correlations, we see that increasing AN or α results in more positive nitride formation energy, thus creating a less stable Li3N in the absence of the PD. This is the same trend witness for increasing pKa (reducing acidity) which also results in lower nitride formation energy. We find a moderately positive correlation between the polarity parameter π and the nitride formation energy (0.627), suggesting that increasing the polarity also destabilizes underlying Li3N. The above results highlight the crucial role of the PD in Li3N formation. Here, too, the unifying concept across the α , AN, and pKa lies within the electrophilicity of the PD. Fig. 4 clearly shows that the Li3N produced in the presence of the PD are more stable than that produced in their absence. We also showed in Fig. 7 that this increase in stability owes to the increased surface reconstruction. Our analysis of the interaction energy correlations with the nitride formation energy correlations show an inverse relationship across the acidity parameters. That is, increasing the acidity of the PD results in reducing stability of the reconstructed Li3N configurations. However, these Li3N can exist because in the presence of the PD, the interaction energy creates a more stable system. As we find correlations with the measures of acidity and polarity to persist across both the interaction energy and the nitride formation energy whilst correlations with measures of basicity only exist through the interaction energy, we hypothesize then that the acidity of the PD, through its electrophilicity governs the formation of the Li3N whether it be through surface reconstruction or some other unexplored mechanism. This created Li3N is then stabilized by the PD through its basicity, thus requiring the amphoteric PD. Unfortunately, we find no direct and statistically significant correlations between any of the PD parameters and our measure of slab reconstruction, the 2-layer displacement. Similarly, no correlation effects are found between the PD and measures of N reduction (total 2N charge, Electrophilic N charge, Nucleophilic N charge). However, as the 2-layer displacement and the measures of N reduction are shown to be correlated to the 2-layer displacement and the interaction energy, this merely shows that some of these variables may be confounding factors, or that the correlation between the PD’s chemistry and these resultant effects (2-layer displacement and measures of N reduction) may be more complex and nonlinear. However, the dependence of the Li3N nitride formation energy on acidity measures suggests that its formation would occur through some acid-catalyzed mechanism. This could be a result of an electron-withdrawing interaction from N atoms to make them more electrophilic, thus promoting their subsequent electron-withdrawing interaction with the Li. This electrophilic interaction within the vicinity of the N atom would, therefore, induce the reconstruction of the Li surface to promote the formation of Li3N, which explains the strong correlation between the two variables but not with the PD chemistry. Finally, the reduction of N through its interaction with the Li surface via the reconstruction mechanism would create an unstable surface — as the reconstruction would create higher Miller index surfaces on Li with dangling bonds. The adsorptive interaction with the PD would then stabilize these bonds. This task would be more suited towards PDs with available electron pairs that can interact with the now deficient Li surface in electron-donation interactions, thus explaining the high correlations found with the measures of basicity. Precedence for both reaction mechanisms exists already in the literature. We see that in the acid-catalyzed hydrolysis of nitriles to form carboxylic acid, electron transfer from nitrogen to a deficient hydrogen forms a crucial intermediate step of the reactions [76–80]. In a similar vein, nitrile reduction with organometallic catalysts (R-M-X where R is an alkyl group and M is a metal) such as an organolithium or organomagnesum reagent to form aldehydes requires a similar electrophilic attack of the cyano-group, freeing up the nitrogen to engage in an electron-donating interaction with the electron-deficient metal, similar to what we have proposed above [81–85]. The interaction of surfaces with adsorbates whether to induce chemisorption or result in adsorbate-induced surface reconstruction, as we propose through the PD’s electron-donation influence, as seen in related heterogeneous catalysis and surface science principles [86,87]. 3.4.2 Understanding protonation behavior We proceed to correlation analysis between the protonated configurations, where proton transfer occurs to formed Li3N, and the interaction as well as the protonation energy to understand the effect of PD chemistry in driving these interactions. When exploring the interaction energy, we find the strongest correlation with the Kamlet–Taft polarity parameter π , being strongly negative at −0.899. This correlation aligns with that found between the E T and the interaction energy (−0.82) (Fig. 9d). This indicates that increasing the hydrogen-bond polarity of the PD results in more negative interaction energy associated with systems where proton transfer occurs, which is what one would intuit. Considering the measures of acidity, we find stronger correlations specifically with measures of hydrogen bond acidity, α (−0.707) and pKa (0.827) than with AN (−0.689), the primary measure of Lewis acidity (−0.689). We see then that increasing the acidity of the PD, whether by increasing α and AN, or reducing the pKa, results in protonated structures with more negative energies, suggesting again increased stabilization through acidity. For the measures of basicity, we find only moderately negative correlations between the interaction energy and β (−0.507) and DN (−0.588). This suggests that while the nucleophilicity of the PD may play a role in stabilizing the system, the protonation interaction is dominated primarily by the PD’s polarity and how electron-deficient its hydrogen atom is to facilitate the transfer. The correlations between protonation energy and acidity measures reveal only moderate correlations with pKa (−0.633) and α (0.575). This behavior is consistent with that observed for nonprotonated Li3N where increasing the acidity of the proton donor by reducing pKa or increasing α results in a protonated state with more positive energy and thus less stable. However, differing from non-protonated Li3N is the fact that protonated structures in the presence of PD were less stable than protonation of free hydrogen (Fig. 5). Insight into the cause of this deviation can be gleaned from the correlations with the basicity measures. We suggested previously that the electron-donation interaction of PD was the primary mechanism for stabilizing the dangling bonds created on the surface due to its reconstruction [47]. The weaker correlation observed here may suggest an inhibition of its ability to do so in the protonated structure, most likely through the confounding of the interaction due to the PD transfer. 3.4.3 Understanding decomposition behavior We finally explore the formation of altered PD states by similarly looking at whether the chemistry of PD links to the interaction energy of systems in which the PD decomposition occurred due to adverse interactions with N atoms. Unlike our previous analysis for both protonated and non- protonated Li3N configurations, where stronger correlations are found in our exploration of the NNN neighborhood scheme, we find no statistically significant correlation between the interaction energy of altered states in the NNN scheme and any of the parameters of PD chemistry explored. However, when looking at the NN scheme, we find the strongest correlation between the interaction energy and the Gutmann Acceptor Number (−0.77), suggesting that an increase in PD acidity results in lower interaction energies and thus more stable states. This is reinforced by a strongly positive correlation with pKa (0.701) and a strongly negative correlation with E T , with the latter correlation highlighting a similar dependence of the stability of the PD altered state on the PD polarity. The correlation with α is only moderately negative at −0.564, leading us to believe the primary source of the interaction is through electron-pair rather than hydrogen-bond acidity. Finally, the interaction energy of these altered states show moderately negative correlations with the Gutmann Donor Number (−0.647) and β (−0.639). The behavior of the correlations seen here is similar to that governing the protonation behavior of Li3N, where we also found stronger correlations to measures of acidity than to measures of basicity. In line with the explanation outlined there, we are led to believe then that the formation of these PD altered states is made favorable when the PD is too electron-withdrawing, suggesting that an excess of this interaction causes reaction with the N atom, preventing it from engaging in its Li3N formation duties. The main distinguishing feature between correlations of PD chemistry towards the formation of nonprotonated Li3N versus those where the PD undergoes protonation or some other alteration is in the dominating importance of PD basicity over its acidity in cases where Li3N forms. This naturally leads to the hypothesis that systems having acidities that are too high are more likely to engage in interactions detrimental to Li3N formation, whereas those having intermediate acidities with moderate to high basicities would favor Li3N without inhibition. We perform our final analysis on our full dataset to test this hypothesis. We explore the correlations between the measures of basicity and acidity and the minimum interaction energy per PD across our entire dataset. We switch our summary statistic here from the median to the minimum here because we are more interested in the overall thermodynamic drive to a particular PD outcome. Consistent with behaviors in both the protonated and altered states, the correlations of the interaction energy with measures of acidity are shown to be much stronger across both scheme in the NN and NNN scheme (Table S4), with the Acceptor Number being the weakest coordinating acidity parameter at −0.685 in the NN scheme and −0.705 in the NNN scheme. In contrast to correlations with acidity measures, the highest correlations of the interaction energy with PD basicity measures are found with the Donor Number (−0.641) and β (−0.578). In Fig. 10, we project the various PD outcomes into the KT space, drawing inspiration from the work done by Krishnamurthy et al. [41]. For the NN scheme whose decomposed state showed stronger and statistically significant correlations with the interaction energy (Fig. 10a), we show that the Kamlet–Taft parameters are a descriptor of the behavior of PD, particularly highlighting the goldilocks zone 0.48 ≤ β ≤ 0.8 where PD forms Li3N without engaging in protonation or alteration through decomposition. That this zone is only dependent on β , the measure of the basicity of the hydrogen bond, is consistent with our analysis, suggesting that the basicity of the PD is required to stabilize the formation of Li3N, in addition to supporting our hypothesis that extremes in acidity result in Li3N inhibition. Expanding to a neighborhood-agnostic data set results in the introduction of an altered and protonated configuration within this suggested goldilocks zone, challenging our earlier assertion (Fig. 10b). However, we note that even with the introduction of these states into the goldilocks zone, no uninhibited or normal Li3N is formed out of it, highlighting the role of intermediate basicity in promoting the formation of Li3N. The acidity measures were not the only parameters of PD that served as indicators of the formation of decomposed and protonated Li3N. Thus, we turn to Kamlet–Taft π , a measure of hydrogen-bond polarity, to glean insights into how it may interact with basicity to determine the outcome of PD during Li3N formation. In Fig. 10c, we find that we can still make the same separation between the different PD outcomes within the same range of β (0.48 ≤ β ≤ 0.8) with π . After expanding to the neighborhood-agnostic data set (Fig. 10d), we are able to obtain a perfect separation between the Li3N states where PD remains intact and those where other outcomes occur. This suggests that polarity may have a stronger effect in modulating the formation of altered states than the electron-withdrawing behavior. In the very least, our analysis shows that there is a range of β − π where PD can influence Li3N formation without undergoing alteration. We did not find such a zone to exist when considering a similar analysis for AN and DN (See Fig. S7). We round up this work by highlighting that while the formulation of the goldilocks zone only excludes the formation of protonated Li3N, this state may be more desirable in LiMEAS, where the formation of NH3 through rapid protolysis is needed to avoid hydrogen evolution. Furthermore, since our analysis does not consider the effect of the potential and the many complexities of the experimental system, such as the interactions between PD and the solvent, it is probable that the boundaries of this unique region where Li3N formation is encouraged become more malleable. However, our analysis provides a first approximation for the design and selection of solvent components towards the more favorable formation of Li3N post N2 dissociation. 4 Conclusion In this work, we used DFT to explore the effects of 14 proton donor (PD) species on Li3N formation. We show that the absence of PD, Li3N formation from 2 nitrogen atoms is always out-competed by subsurface N2 embedding and sometimes out-competed by surface N2 adsorption. However, the presence of PD species during the formation of Li3N resulted in one of three outcomes; the PD remains intact on forming Li3N, the PD protonates Li3N, or the PD is altered. In cases where the PD remain intact, it was shown to increase the stability of the formation of nitride, making it the most preferred lithium-nitrogen interaction in the system. Exploration of these Li3N configurations showed an increased arrangement of Li atoms, leading us to speculate that the PD influence was to induce surface reconstruction. By introducing the two-layer displacement as a measure of this reconstruction, we were able to draw strong correlations between the stability of the Li-2N-PD system (through the interaction energy) and the degree of surface reconstruction, showing that higher two-layer displacements resulted in more favorable stable systems. Through charge analysis, we further linked this two-layer displacement to the degree of reduction of nitrogen atoms on the Li surface. We drew correlations between Li3N formation and the parameters that govern PD chemistry, showing that PD basicity showed strong correlations with the stability of the overall system. The PD’s acidity and polarity were shown to destabilize the underlying Li3N and were shown to be the primary parameter classes governing the protonation and PD alteration. This allowed us to establish a region in KT β − π space where PDs in the region formed intact Li3N. CRediT authorship contribution statement Victor Azumah: Writing – review & editing, Writing – original draft, Visualization, Validation, Methodology, Investigation, Formal analysis, Data curation, Conceptualization. Lance Kavalsky: Writing – review & editing, Supervision, Software, Conceptualization. Venkatasubramanian Viswanathan: Writing – review & editing, Supervision, Resources, Project administration, Funding acquisition, Conceptualization. Declaration of competing interest The authors declare the following financial interests/personal relationships which may be considered as potential competing interests: There is a patent application filed with Venkatasubramanian Viswanathan as one of the inventors. If there are other authors, they declare that they have no known competing financial interests or personal relationships that could have appeared to influence the work reported in this paper. Acknowledgments This work used Bridges-2 at the Pittsburgh Supercomputing Center through allocation CTS180061 from the Advanced Cyberinfrastructure Coordination Ecosystem: Services and Support (ACCESS) program, L.K. acknowledges the support of the Natural Sciences and Engineering Research Council of Canada (NSERC) . Appendix A Supplementary data Supplementary material related to this article can be found online at https://doi.org/10.1016/j.jcat.2025.116250. Additional discussion on thermodynamics details, dimensionality reduction and clustering, statistics of observed states, and details of chemical species used. Appendix A Supplementary data The following is the Supplementary material related to this article.Additional discussion on thermodynamics details, dimensionality reduction and clustering, statistics of observed states, and details of chemical species used. MMC S1 Additional discussion on thermodynamics details, dimensionality reduction and clustering, statistics of observed states, and details of chemical species used. References [1] K.H.R. Rouwenhorst A. Van der Ham G. Mul S. Kersten Power-to-ammonia-to-power (p2a2p) for local electricity storage in 2025 Curr. Dev. Process. Propos. Futur. Res. Required. Univ. Twente 2018 Kevin Hendrik Reindert Rouwenhorst, AGJ Van der Ham, G Mul, and SRA Kersten. Power-to-ammonia-to-power (p2a2p) for local electricity storage in 2025. Current developments, process proposal & future research required. University of Twente, 2018. [2] J.W. Erisman M.A. Sutton J. Galloway Z. Klimont W. Winiwarter How a century of ammonia synthesis changed the world Nat. Geosci. 1 10 2008 636 639 Jan Willem Erisman, Mark A Sutton, James Galloway, Zbigniew Klimont, and Wilfried Winiwarter. How a century of ammonia synthesis changed the world. Nature geoscience, 1(10):636–639, 2008. [3] J. Nørskov J. Chen R. Miranda T. Fitzsimmons R. Stack Sustainable ammonia synthesis–exploring the scientific challenges associated with discovering alternative, sustainable processes for ammonia production 2016 Jens Nørskov, Jingguang Chen, Raul Miranda, Tim Fitzsimmons, and Robert Stack. Sustainable ammonia synthesis–exploring the scientific challenges associated with discovering alternative, sustainable processes for ammonia production. Technical report, US DOE Office of Science, 2016. [4] F. Kahrl Y. Li Y. Su T. Tennigkeit A. Wilkes J. Xu Greenhouse gas emissions from nitrogen fertilizer use in China Environ. Sci. Policy 13 8 2010 688 694 Fredrich Kahrl, Yunju Li, Yufang Su, Timm Tennigkeit, Andreas Wilkes, and Jianchu Xu. Greenhouse gas emissions from nitrogen fertilizer use in china. Environmental science & policy, 13(8):688–694, 2010. [5] T. Benchaita Greenhouse gas emissions from new petrochemical plants Inter-Am. Dev. Bank 2013 Tayeb Benchaita. Greenhouse gas emissions from new petrochemical plants. Inter-American Development Bank, 2013. [6] W.F. Lamb T. Wiedmann J. Pongratz R. Andrew M. Crippa J.G. Olivier D. Wiedenhofer G. Mattioli A. Al Khourdajie J. House A review of trends and drivers of greenhouse gas emissions by sector from 1990 to 2018 Environ. Res. Lett. 16 7 2021 073005 William F Lamb, Thomas Wiedmann, Julia Pongratz, Robbie Andrew, Monica Crippa, Jos GJ Olivier, Dominik Wiedenhofer, Giulio Mattioli, Alaa Al Khourdajie, Jo House, et al. A review of trends and drivers of greenhouse gas emissions by sector from 1990 to 2018. Environmental research letters, 16(7):073005, 2021. [7] A. Isella D. Manca GHG emissions by (petro) chemical processes and decarbonization priorities—A review Energies 15 20 2022 7560 Andrea Isella and Davide Manca. Ghg emissions by (petro) chemical processes and decarbonization priorities—a review. Energies, 15(20):7560, 2022. [8] Z.J. Schiffer K. Manthiram Electrification and decarbonization of the chemical industry Joule 1 1 2017 10 14 Zachary J Schiffer and Karthish Manthiram. Electrification and decarbonization of the chemical industry. Joule, 1(1):10–14, 2017. [9] D.S. Mallapragada Y. Dvorkin M.A. Modestino D.V. Esposito W.A. Smith B.-M. Hodge M.P. Harold V.M. Donnelly A. Nuz C. Bloomquist Decarbonization of the chemical industry through electrification: Barriers and opportunities Joule 7 1 2023 23 41 Dharik S Mallapragada, Yury Dvorkin, Miguel A Modestino, Daniel V Esposito, Wilson A Smith, Bri-Mathias Hodge, Michael P Harold, Vincent M Donnelly, Alice Nuz, Casey Bloomquist, et al. Decarbonization of the chemical industry through electrification: Barriers and opportunities. Joule, 7(1):23–41, 2023. [10] F. Fichter P. Girard H. Erlenmeyer Elektrolytische bindung von komprimiertem stickstoff bei gewöhnlicher temperatur Helv. Chim. Acta 13 6 1930 1228 1236 Fr Fichter, Pierre Girard, and Hans Erlenmeyer. Elektrolytische bindung von komprimiertem stickstoff bei gewöhnlicher temperatur. Helvetica Chimica Acta, 13(6):1228–1236, 1930. [11] B.H. Suryanto K. Matuszek J. Choi R.Y. Hodgetts H.-L. Du J.M. Bakker C.S. Kang P.V. Cherepanov A.N. Simonov D.R. MacFarlane Nitrogen reduction to ammonia at high efficiency and rates based on a phosphonium proton shuttle Science 372 6547 2021 1187 1191 Bryan HR Suryanto, Karolina Matuszek, Jaecheol Choi, Rebecca Y Hodgetts, Hoang-Long Du, Jacinta M Bakker, Colin SM Kang, Pavel V Cherepanov, Alexandr N Simonov, and Douglas R MacFarlane. Nitrogen reduction to ammonia at high efficiency and rates based on a phosphonium proton shuttle. Science, 372(6547):1187–1191, 2021. [12] H.-L. Du M. Chatti R.Y. Hodgetts P.V. Cherepanov C.K. Nguyen K. Matuszek D.R. MacFarlane A.N. Simonov Electroreduction of nitrogen with almost 100% current-to-ammonia efficiency Nature 609 7928 2022 722 727 Hoang-Long Du, Manjunath Chatti, Rebecca Y Hodgetts, Pavel V Cherepanov, Cuong K Nguyen, Karolina Matuszek, Douglas R MacFarlane, and Alexandr N Simonov. Electroreduction of nitrogen with almost 100% current-to-ammonia efficiency. Nature, 609(7928):722–727, 2022. [13] S. Li Y. Zhou K. Li M. Saccoccio R. Sažinas S.Z. Andersen J.B. Pedersen X. Fu V. Shadravan D. Chakraborty Electrosynthesis of ammonia with high selectivity and high rates via engineering of the solid-electrolyte interphase Joule 6 9 2022 2083 2101 Shaofeng Li, Yuanyuan Zhou, Katja Li, Mattia Saccoccio, Rokas Sažinas, Suzanne Z Andersen, Jakob B Pedersen, Xianbiao Fu, Vahid Shadravan, Debasish Chakraborty, et al. Electrosynthesis of ammonia with high selectivity and high rates via engineering of the solid-electrolyte interphase. Joule, 6(9):2083–2101, 2022. [14] X. Cui C. Tang Q. Zhang A review of electrocatalytic reduction of dinitrogen to ammonia under ambient conditions Adv. Energy Mater. 8 22 2018 1800369 Xiaoyang Cui, Cheng Tang, and Qiang Zhang. A review of electrocatalytic reduction of dinitrogen to ammonia under ambient conditions. Advanced Energy Materials, 8(22):1800369, 2018. [15] A. Tsuneto A. Kudo T. Sakata Efficient electrochemical reduction of N2 to NH3 catalyzed by lithium Chem. Lett. 22 5 1993 851 854 Akira Tsuneto, Akihiko Kudo, and Tadayoshi Sakata. Efficient electrochemical reduction of n2 to nh3 catalyzed by lithium. Chemistry letters, 22(5):851–854, 1993. [16] A. Tsuneto A. Kudo T. Sakata Lithium-mediated electrochemical reduction of high pressure N2 to NH3 J. Electroanal. Chem. 367 1–2 1994 183 188 Akira Tsuneto, Akihiko Kudo, and Tadayoshi Sakata. Lithium-mediated electrochemical reduction of high pressure n2 to nh3. Journal of Electroanalytical Chemistry, 367(1-2):183–188, 1994. [17] X. Fu J.B. Pedersen Y. Zhou M. Saccoccio S. Li R. Sažinas K. Li S.Z. Andersen A. Xu N.H. Deissler Continuous-flow electrosynthesis of ammonia by nitrogen reduction and hydrogen oxidation Science 379 6633 2023 707 712 Xianbiao Fu, Jakob B Pedersen, Yuanyuan Zhou, Mattia Saccoccio, Shaofeng Li, Rokas Sažinas, Katja Li, Suzanne Z Andersen, Aoni Xu, Niklas H Deissler, et al. Continuous-flow electrosynthesis of ammonia by nitrogen reduction and hydrogen oxidation. Science, 379(6633):707–712, 2023. [18] N. Lazouski M. Chung K. Williams M.L. Gala K. Manthiram Non-aqueous gas diffusion electrodes for rapid ammonia synthesis from nitrogen and water-splitting-derived hydrogen Nat. Catal. 3 5 2020 463 469 Nikifar Lazouski, Minju Chung, Kindle Williams, Michal L Gala, and Karthish Manthiram. Non-aqueous gas diffusion electrodes for rapid ammonia synthesis from nitrogen and water-splitting-derived hydrogen. Nature Catalysis, 3(5):463–469, 2020. [19] E. McFarlane F. Tompkins Nitridation of lithium Trans. Faraday Soc. 58 1962 997 1007 EF McFarlane and FC Tompkins. Nitridation of lithium. Transactions of the Faraday Society, 58:997–1007, 1962. [20] N.N. Greenwood A. Earnshaw Chemistry of the Elements 2012 Elsevier Norman Neill Greenwood and Alan Earnshaw. Chemistry of the Elements. Elsevier, 2012. [21] G.V. Vajenine On reactions between alkali metals and active nitrogen Solid State Sci. 10 4 2008 450 454 Grigori V Vajenine. On reactions between alkali metals and active nitrogen. Solid state sciences, 10(4):450–454, 2008. [22] H. Iriawan S.Z. Andersen X. Zhang B.M. Comer J. Barrio P. Chen A.J. Medford I.E. Stephens I. Chorkendorff Y. Shao-Horn Methods for nitrogen activation by reduction and oxidation Nat. Rev. Methods Prim. 1 1 2021 56 Haldrian Iriawan, Suzanne Z Andersen, Xilun Zhang, Benjamin M Comer, Jesús Barrio, Ping Chen, Andrew J Medford, Ifan EL Stephens, Ib Chorkendorff, and Yang Shao-Horn. Methods for nitrogen activation by reduction and oxidation. Nature Reviews Methods Primers, 1(1):56, 2021. [23] O. Westhead J. Barrio A. Bagger J.W. Murray J. Rossmeisl M.-M. Titirici R. Jervis A. Fantuzzi A. Ashley I.E. Stephens Near ambient N2 fixation on solid electrodes versus enzymes and homogeneous catalysts Nat. Rev. Chem. 7 3 2023 184 201 Olivia Westhead, Jesús Barrio, Alexander Bagger, James W Murray, Jan Rossmeisl, Maria-Magdalena Titirici, Rhodri Jervis, Andrea Fantuzzi, Andrew Ashley, and Ifan EL Stephens. Near ambient n2 fixation on solid electrodes versus enzymes and homogeneous catalysts. Nature Reviews Chemistry, 7(3):184–201, 2023. [24] X. Cai C. Fu H. Iriawan F. Yang A. Wu L. Luo S. Shen G. Wei Y. Shao-Horn J. Zhang Lithium-mediated electrochemical nitrogen reduction: Mechanistic insights to enhance performance Iscience 24 10 2021 Xiyang Cai, Cehuang Fu, Haldrian Iriawan, Fan Yang, Aiming Wu, Liuxuan Luo, Shuiyun Shen, Guanghua Wei, Yang Shao-Horn, and Junliang Zhang. Lithium-mediated electrochemical nitrogen reduction: Mechanistic insights to enhance performance. Iscience, 24(10), 2021. [25] A.R. Singh B.A. Rohr M.J. Statt J.A. Schwalbe M. Cargnello J.K. Nørskov Strategies toward selective electrochemical ammonia synthesis Acs Catal. 9 9 2019 8316 8324 Aayush R Singh, Brian A Rohr, Michael J Statt, Jay A Schwalbe, Matteo Cargnello, and Jens K Nørskov. Strategies toward selective electrochemical ammonia synthesis. Acs Catalysis, 9(9):8316–8324, 2019. [26] J.H. Montoya C. Tsai A. Vojvodic J.K. Nørskov The challenge of electrochemical ammonia synthesis: a new perspective on the role of nitrogen scaling relations ChemSusChem 8 13 2015 2180 2186 Joseph H Montoya, Charlie Tsai, Aleksandra Vojvodic, and Jens K Nørskov. The challenge of electrochemical ammonia synthesis: a new perspective on the role of nitrogen scaling relations. ChemSusChem, 8(13):2180–2186, 2015. [27] L. Kavalsky V. Viswanathan Robust active site design of single-atom catalysts for electrochemical ammonia synthesis J. Phys. Chem. C 124 42 2020 23164 23176 Lance Kavalsky and Venkatasubramanian Viswanathan. Robust active site design of single-atom catalysts for electrochemical ammonia synthesis. The Journal of Physical Chemistry C, 124(42):23164–23176, 2020. [28] C. Tang S.-Z. Qiao How to explore ambient electrocatalytic nitrogen reduction reliably and insightfully Chem. Soc. Rev. 48 12 2019 3166 3180 Cheng Tang and Shi-Zhang Qiao. How to explore ambient electrocatalytic nitrogen reduction reliably and insightfully. Chemical Society Reviews, 48(12):3166–3180, 2019. [29] J. Pan H.A. Hansen T. Vegge Vanadium oxynitrides as stable catalysts for electrochemical reduction of nitrogen to ammonia: the role of oxygen J. Mater. Chem. A 8 45 2020 24098 24107 Jaysree Pan, Heine Anton Hansen, and Tejs Vegge. Vanadium oxynitrides as stable catalysts for electrochemical reduction of nitrogen to ammonia: the role of oxygen. Journal of Materials Chemistry A, 8(45):24098–24107, 2020. [30] Y. Guan C. Liu Q. Wang W. Gao H.A. Hansen J. Guo T. Vegge P. Chen Transition-metal-free barium hydride mediates dinitrogen fixation and ammonia synthesis Angew. Chem. Int. Ed. 61 39 2022 e202205805 Yeqin Guan, Chuangwei Liu, Qianru Wang, Wenbo Gao, Heine Anton Hansen, Jianping Guo, Tejs Vegge, and Ping Chen. Transition-metal-free barium hydride mediates dinitrogen fixation and ammonia synthesis. Angewandte Chemie International Edition, 61(39):e202205805, 2022. [31] S.Z. Andersen M.J. Statt V.J. Bukas S.G. Shapel J.B. Pedersen K. Krempl M. Saccoccio D. Chakraborty J. Kibsgaard P.C. Vesborg Increasing stability, efficiency, and fundamental understanding of lithium-mediated electrochemical nitrogen reduction Energy Environ. Sci. 13 11 2020 4291 4300 Suzanne Z Andersen, Michael J Statt, Vanessa J Bukas, Sarah G Shapel, Jakob B Pedersen, Kevin Krempl, Mattia Saccoccio, Debasish Chakraborty, Jakob Kibsgaard, Peter CK Vesborg, et al. Increasing stability, efficiency, and fundamental understanding of lithium-mediated electrochemical nitrogen reduction. Energy & Environmental Science, 13(11):4291–4300, 2020. [32] N. Lazouski Z.J. Schiffer K. Williams K. Manthiram Understanding continuous lithium-mediated electrochemical nitrogen reduction Joule 3 4 2019 1127 1139 Nikifar Lazouski, Zachary J Schiffer, Kindle Williams, and Karthish Manthiram. Understanding continuous lithium-mediated electrochemical nitrogen reduction. Joule, 3(4):1127–1139, 2019. [33] Y. Jeon D. Shin K. Yong Y.J. Hwang Enhancing ammonia production by ag incorporation in li-mediated nitrogen reduction reactions ACS Energy Lett. 9 8 2024 4147 4152 Yeongbae Jeon, Dongwoo Shin, Kijung Yong, and Yun Jeong Hwang. Enhancing ammonia production by ag incorporation in li-mediated nitrogen reduction reactions. ACS Energy Letters, 9(8):4147–4152, 2024. [34] S. Li Y. Zhou X. Fu J.B. Pedersen M. Saccoccio S.Z. Andersen K. Enemark-Rasmussen P.J. Kempen C.D. Damsgaard A. Xu Long-term continuous ammonia electrosynthesis Nature 629 8010 2024 92 97 Shaofeng Li, Yuanyuan Zhou, Xianbiao Fu, Jakob B Pedersen, Mattia Saccoccio, Suzanne Z Andersen, Kasper Enemark-Rasmussen, Paul J Kempen, Christian Danvad Damsgaard, Aoni Xu, et al. Long-term continuous ammonia electrosynthesis. Nature, 629(8010):92–97, 2024. [35] W. Chang A. Jain F. Rezaie K. Manthiram Lithium-mediated nitrogen reduction to ammonia via the catalytic solid–electrolyte interphase Nat. Catal. 2024 1 11 Wesley Chang, Anukta Jain, Fateme Rezaie, and Karthish Manthiram. Lithium-mediated nitrogen reduction to ammonia via the catalytic solid–electrolyte interphase. Nature Catalysis, pages 1–11, 2024. [36] H. Liu Z. Wang H. Ji T. Qian C. Yan J. Lu General corrosion endowed by electrolyte engineering enhancing lithium-mediated nitrogen fixation Chem. Eng. J. 490 2024 151707 Hong Liu, Zhenkang Wang, Haoqing Ji, Tao Qian, Chenglin Yan, and Jianmei Lu. General corrosion endowed by electrolyte engineering enhancing lithium-mediated nitrogen fixation. Chemical Engineering Journal, 490:151707, 2024. [37] X. Cai X. Li J. You F. Yang Z. Shadike S. Qin L. Luo Y. Guo X. Yan S. Shen Lithium-mediated ammonia electrosynthesis with ether-based electrolytes J. Am. Chem. Soc. 145 47 2023 25716 25725 Xiyang Cai, Xingdian Li, Jiabin You, Fan Yang, Zulipiya Shadike, Song Qin, Liuxuan Luo, Yangge Guo, Xiaohui Yan, Shuiyun Shen, et al. Lithium-mediated ammonia electrosynthesis with ether-based electrolytes. Journal of the American Chemical Society, 145(47):25716–25725, 2023. [38] H. Iriawan A. Herzog S. Yu N. Ceribelli Y. Shao-Horn Upshifting lithium plating potential to enhance electrochemical lithium mediated ammonia synthesis ACS Energy Lett. 9 10 2024 4883 4891 Haldrian Iriawan, Antonia Herzog, Sunmoon Yu, Nicole Ceribelli, and Yang Shao-Horn. Upshifting lithium plating potential to enhance electrochemical lithium mediated ammonia synthesis. ACS Energy Letters, 9(10):4883–4891, 2024. [39] X. Fu S. Li N.H. Deissler J.B.V. Mygind J. Kibsgaard I. Chorkendorff Effect of lithium salt on lithium-mediated ammonia synthesis ACS Energy Lett. 9 8 2024 3790 3795 Xianbiao Fu, Shaofeng Li, Niklas H Deissler, Jon Bjarke Valbæk Mygind, Jakob Kibsgaard, and Ib Chorkendorff. Effect of lithium salt on lithium-mediated ammonia synthesis. ACS Energy Letters, 9(8):3790–3795, 2024. [40] K. Steinberg X. Yuan C.K. Klein N. Lazouski M. Mecklenburg K. Manthiram Y. Li Imaging of nitrogen fixation at lithium solid electrolyte interphases via cryo-electron microscopy Nat. Energy 8 2 2023 138 148 Katherine Steinberg, Xintong Yuan, Channing K Klein, Nikifar Lazouski, Matthew Mecklenburg, Karthish Manthiram, and Yuzhang Li. Imaging of nitrogen fixation at lithium solid electrolyte interphases via cryo-electron microscopy. Nature Energy, 8(2):138–148, 2023. [41] D. Krishnamurthy N. Lazouski M.L. Gala K. Manthiram V. Viswanathan Closed-loop electrolyte design for lithium-mediated ammonia synthesis ACS Cent. Sci. 7 12 2021 2073 2082 Dilip Krishnamurthy, Nikifar Lazouski, Michal L Gala, Karthish Manthiram, and Venkatasubramanian Viswanathan. Closed-loop electrolyte design for lithium-mediated ammonia synthesis. ACS Central Science, 7(12):2073–2082, 2021. [42] N. Lazouski K.J. Steinberg M.L. Gala D. Krishnamurthy V. Viswanathan K. Manthiram Proton donors induce a differential transport effect for selectivity toward ammonia in lithium-mediated nitrogen reduction ACS Catal. 12 9 2022 5197 5208 Nikifar Lazouski, Katherine J Steinberg, Michal L Gala, Dilip Krishnamurthy, Venkatasubramanian Viswanathan, and Karthish Manthiram. Proton donors induce a differential transport effect for selectivity toward ammonia in lithium-mediated nitrogen reduction. ACS Catalysis, 12(9):5197–5208, 2022. [43] X. Fu A. Xu J.B. Pedersen S. Li R. Sažinas Y. Zhou S.Z. Andersen M. Saccoccio N.H. Deissler J.B.V. Mygind Phenol as proton shuttle and buffer for lithium-mediated ammonia electrosynthesis Nat. Commun. 15 1 2024 2417 Xianbiao Fu, Aoni Xu, Jakob B Pedersen, Shaofeng Li, Rokas Sažinas, Yuanyuan Zhou, Suzanne Z Andersen, Mattia Saccoccio, Niklas H Deissler, Jon Bjarke Valbæk Mygind, et al. Phenol as proton shuttle and buffer for lithium-mediated ammonia electrosynthesis. Nature Communications, 15(1):2417, 2024. [44] H.-L. Du K. Matuszek R.Y. Hodgetts K.N. Dinh P.V. Cherepanov J.M. Bakker D.R. MacFarlane A.N. Simonov The chemistry of proton carriers in high-performance lithium-mediated ammonia electrosynthesis Energy Environ. Sci. 16 3 2023 1082 1090 Hoang-Long Du, Karolina Matuszek, Rebecca Y Hodgetts, Khang Ngoc Dinh, Pavel V Cherepanov, Jacinta M Bakker, Douglas R MacFarlane, and Alexandr N Simonov. The chemistry of proton carriers in high-performance lithium-mediated ammonia electrosynthesis. Energy & Environmental Science, 16(3):1082–1090, 2023. [45] M. Spry O. Westhead R. Tort B. Moss Y. Katayama M.-M. Titirici I.E. Stephens A. Bagger Water increases the faradaic selectivity of Li-mediated nitrogen reduction ACS Energy Lett. 8 2 2023 1230 1235 Matthew Spry, Olivia Westhead, Romain Tort, Benjamin Moss, Yu Katayama, Maria-Magdalena Titirici, Ifan EL Stephens, and Alexander Bagger. Water increases the faradaic selectivity of li-mediated nitrogen reduction. ACS Energy Letters, 8(2):1230–1235, 2023. [46] K. Li S.Z. Andersen M.J. Statt M. Saccoccio V.J. Bukas K. Krempl R. Sažinas J.B. Pedersen V. Shadravan Y. Zhou Enhancement of lithium-mediated ammonia synthesis by addition of oxygen Science 374 6575 2021 1593 1597 Katja Li, Suzanne Z Andersen, Michael J Statt, Mattia Saccoccio, Vanessa J Bukas, Kevin Krempl, Rokas Sažinas, Jakob B Pedersen, Vahid Shadravan, Yuanyuan Zhou, et al. Enhancement of lithium-mediated ammonia synthesis by addition of oxygen. Science, 374(6575):1593–1597, 2021. [47] V. Azumah L. Kavalsky V. Viswanathan Proton donors influence nitrogen adsorption in lithium-mediated electrochemical ammonia synthesis 2024 Victor Azumah, Lance Kavalsky, and Venkatasubramanian Viswanathan. Proton donors influence nitrogen adsorption in lithium-mediated electrochemical ammonia synthesis. 2024. [48] L. Himanen M.O.J. Jäger E.V. Morooka F. Federici Canova Y.S. Ranawat D.Z. Gao P. Rinke A.S. Foster DScribe: Library of descriptors for machine learning in materials science Comput. Phys. Comm. 247 2020 106949 10.1016/j.cpc.2019.106949 Lauri Himanen, Marc O. J. Jäger, Eiaki V. Morooka, Filippo Federici Canova, Yashasvi S. Ranawat, David Z. Gao, Patrick Rinke, and Adam S. Foster. DScribe: Library of descriptors for machine learning in materials science. Computer Physics Communications, 247:106949, 2020. [49] J. Laakso L. Himanen H. Homm E.V. Morooka M.O. Jäger M. Todorović P. Rinke Updates to the dscribe library: New descriptors and derivatives J. Chem. Phys. 158 23 2023 Jarno Laakso, Lauri Himanen, Henrietta Homm, Eiaki V Morooka, Marc OJ Jäger, Milica Todorović, and Patrick Rinke. Updates to the dscribe library: New descriptors and derivatives. The Journal of Chemical Physics, 158(23), 2023. [50] T. Ludwig A.R. Singh J.K. Nørskov Subsurface nitrogen dissociation kinetics in lithium metal from metadynamics J. Phys. Chem. C 124 48 2020 26368 26378 Thomas Ludwig, Aayush R Singh, and Jens K Nørskov. Subsurface nitrogen dissociation kinetics in lithium metal from metadynamics. The Journal of Physical Chemistry C, 124(48):26368–26378, 2020. [51] Y. Shen A.R. Oganov G. Qian J. Zhang H. Dong Q. Zhu Z. Zhou Novel lithium-nitrogen compounds at ambient and high pressures Sci. Rep. 5 1 2015 14204 Yanqing Shen, Artem R Oganov, Guangri Qian, Jin Zhang, Huafeng Dong, Qiang Zhu, and Zhongxiang Zhou. Novel lithium-nitrogen compounds at ambient and high pressures. Scientific reports, 5(1):14204, 2015. [52] S. De A.P. Bartók G. Csányi M. Ceriotti Comparing molecules and solids across structural and alchemical space Phys. Chem. Chem. Phys. 18 20 2016 13754 13769 Sandip De, Albert P Bartók, Gábor Csányi, and Michele Ceriotti. Comparing molecules and solids across structural and alchemical space. Physical Chemistry Chemical Physics, 18(20):13754–13769, 2016. [53] M.O. Jäger E.V. Morooka F. Federici Canova L. Himanen A.S. Foster Machine learning hydrogen adsorption on nanoclusters through structural descriptors Npj Comput. Mater. 4 1 2018 37 Marc OJ Jäger, Eiaki V Morooka, Filippo Federici Canova, Lauri Himanen, and Adam S Foster. Machine learning hydrogen adsorption on nanoclusters through structural descriptors. npj Computational Materials, 4(1):37, 2018. [54] A.P. Bartók R. Kondor G. Csányi On representing chemical environments Phys. Rev. B 87 18 2013 184115 Albert P Bartók, Risi Kondor, and Gábor Csányi. On representing chemical environments. Physical Review B, 87(18):184115, 2013. [55] M.J. Willatt F. Musil M. Ceriotti Feature optimization for atomistic machine learning yields a data-driven construction of the periodic table of the elements Phys. Chem. Chem. Phys. 20 47 2018 29661 29668 Michael J Willatt, Félix Musil, and Michele Ceriotti. Feature optimization for atomistic machine learning yields a data-driven construction of the periodic table of the elements. Physical Chemistry Chemical Physics, 20(47):29661–29668, 2018. [56] F. Faber A. Lindmaa O.A. Von Lilienfeld R. Armiento Crystal structure representations for machine learning models of formation energies Int. J. Quantum Chem. 115 16 2015 1094 1101 Felix Faber, Alexander Lindmaa, O Anatole Von Lilienfeld, and Rickard Armiento. Crystal structure representations for machine learning models of formation energies. International Journal of Quantum Chemistry, 115(16):1094–1101, 2015. [57] L. Kavalsky V.I. Hegde B. Meredig V. Viswanathan A multiobjective closed-loop approach towards autonomous discovery of electrocatalysts for nitrogen reduction Digit. Discov. 2024 Lance Kavalsky, Vinay I Hegde, Bryce Meredig, and Venkatasubramanian Viswanathan. A multiobjective closed-loop approach towards autonomous discovery of electrocatalysts for nitrogen reduction. Digital Discovery, 2024. [58] T. Sainburg L. McInnes T.Q. Gentner Parametric UMAP embeddings for representation and semisupervised learning Neural Comput. 33 11 2021 2881 2907 Tim Sainburg, Leland McInnes, and Timothy Q Gentner. Parametric umap embeddings for representation and semisupervised learning. Neural Computation, 33(11):2881–2907, 2021. [59] L. McInnes J. Healy S. Astels hdbscan: Hierarchical density based clustering J. Open Source Softw. 2 11 2017 10.21105/joss.00205 Leland McInnes, John Healy, and Steve Astels. hdbscan: Hierarchical density based clustering. The Journal of Open Source Software, 2(11), mar 2017. [60] R. Vallat Pingouin: statistics in python J. Open Source Softw. 3 31 2018 1026 10.21105/joss.01026 Raphael Vallat. Pingouin: statistics in python. Journal of Open Source Software, 3(31):1026, November 2018. [61] R. Tort O. Westhead J.O. Douglas M. Conroy B.J. Davies A. Winiwarter A. Faisal M. Spry A. Khobnya M.P. Ryan The role of ethanol in lithium-mediated nitrogen reduction 2025 Romain Tort, Olivia Westhead, James O Douglas, Michele Conroy, Bethan JV Davies, Anna Winiwarter, Aishah Faisal, Matthew Spry, Artem Khobnya, Mary P Ryan, et al. The role of ethanol in lithium-mediated nitrogen reduction. 2025. [62] J.A. Schwalbe M.J. Statt C. Chosy A.R. Singh B.A. Rohr A.C. Nielander S.Z. Andersen J.M. McEnaney J.G. Baker T.F. Jaramillo A combined theory-experiment analysis of the surface species in lithium-mediated NH3 electrosynthesis ChemElectroChem 7 7 2020 1542 1549 Jay A Schwalbe, Michael J Statt, Cullen Chosy, Aayush R Singh, Brian A Rohr, Adam C Nielander, Suzanne Z Andersen, Joshua M McEnaney, Jon G Baker, Thomas F Jaramillo, et al. A combined theory-experiment analysis of the surface species in lithium-mediated nh3 electrosynthesis. ChemElectroChem, 7(7):1542–1549, 2020. [63] Y. Zhang D. Krishnamurthy V. Viswanathan Engineering solid electrolyte interphase composition by assessing decomposition pathways of fluorinated organic solvents in lithium metal batteries J. Electrochem. Soc. 167 7 2020 070554 Yumin Zhang, Dilip Krishnamurthy, and Venkatasubramanian Viswanathan. Engineering solid electrolyte interphase composition by assessing decomposition pathways of fluorinated organic solvents in lithium metal batteries. Journal of The Electrochemical Society, 167(7):070554, 2020. [64] Y. Zhang V. Viswanathan Not all fluorination is the same: Unique effects of fluorine functionalization of ethylene carbonate for tuning solid-electrolyte interphase in Li metal batteries Langmuir 36 39 2020 11450 11466 Yumin Zhang and Venkatasubramanian Viswanathan. Not all fluorination is the same: Unique effects of fluorine functionalization of ethylene carbonate for tuning solid-electrolyte interphase in li metal batteries. Langmuir, 36(39):11450–11466, 2020. [65] Y. Zhang V. Viswanathan Design rules for selecting fluorinated linear organic solvents for li metal batteries J. Phys. Chem. Lett. 12 24 2021 5821 5828 Yumin Zhang and Venkatasubramanian Viswanathan. Design rules for selecting fluorinated linear organic solvents for li metal batteries. The Journal of Physical Chemistry Letters, 12(24):5821–5828, 2021. [66] L.M. Azofra J.M. Doña-Rodríguez D.R. MacFarlane A.N. Simonov Mechanism of the N2 cleavage promoted by lithium vs other alkali and alkaline-earth metals J. Phys. Chem. C 2024 Luis Miguel Azofra, José Miguel Doña-Rodríguez, Douglas R MacFarlane, and Alexandr N Simonov. Mechanism of the n2 cleavage promoted by lithium vs other alkali and alkaline-earth metals. The Journal of Physical Chemistry C, 2024. [67] T. Yokoyama R. Taft M.J. Kamlet The solvatochromic comparison method. 3. Hydrogen bonding by some 2-nitroaniline derivatives J. Am. Chem. Soc. 98 11 1976 3233 3237 Tai Yokoyama, RW Taft, and Mortimer J Kamlet. The solvatochromic comparison method. 3. hydrogen bonding by some 2-nitroaniline derivatives. Journal of the American Chemical Society, 98(11):3233–3237, 1976. [68] M.J. Kamlet R. Taft The solvatochromic comparison method. I. The. beta.-scale of solvent hydrogen-bond acceptor (HBA) basicities J. Am. Chem. Soc. 98 2 1976 377 383 Mortimer J Kamlet and RW Taft. The solvatochromic comparison method. i. the. beta.-scale of solvent hydrogen-bond acceptor (hba) basicities. Journal of the American chemical Society, 98(2):377–383, 1976. [69] M.J. Kamlet J.L. Abboud R. Taft The solvatochromic comparison method. 6. The. pi.* scale of solvent polarities J. Am. Chem. Soc. 99 18 1977 6027 6038 Mortimer J Kamlet, Jose Luis Abboud, and RW Taft. The solvatochromic comparison method. 6. the. pi.* scale of solvent polarities. Journal of the American Chemical Society, 99(18):6027–6038, 1977. [70] W. Tang E. Sanville G. Henkelman A grid-based bader analysis algorithm without lattice bias J. Phys.: Condens. Matter. 21 8 2009 084204 W Tang, E Sanville, and G Henkelman. A grid-based bader analysis algorithm without lattice bias. Journal of Physics: Condensed Matter, 21(8):084204, 2009. [71] C. Reichardt T. Welton Solvents and Solvent Effects in Organic Chemistry 2011 John Wiley & Sons 93 96 Christian Reichardt and Thomas Welton. Solvents and solvent effects in organic chemistry. John Wiley & Sons, 2011. [72] J.R. Haak J.B. Engberts Solvent polarity and solvation effects in highly aqueous mixed solvents. Application of the dimroth-reichardt ET (30) parameter Recl. Des. Trav. Chim. Des. Pays-Bas 105 9 1986 307 311 Jan R Haak and Jan BFN Engberts. Solvent polarity and solvation effects in highly aqueous mixed solvents. application of the dimroth-reichardt et (30) parameter. Recueil des Travaux Chimiques des Pays-Bas, 105(9):307–311, 1986. [73] C. Reichardt Empirical parameters of the polarity of solvents Angew. Chem. Int. Ed. Engl. 4 1 1965 29 40 Chr Reichardt. Empirical parameters of the polarity of solvents. Angewandte Chemie International Edition in English, 4(1):29–40, 1965. [74] V. Gutmann Empirical parameters for donor and acceptor properties of solvents Electrochim. Acta 21 9 1976 661 670 V Gutmann. Empirical parameters for donor and acceptor properties of solvents. Electrochimica Acta, 21(9):661–670, 1976. [75] V. Gutmann G. Resch The impact of the donor-acceptor concept Comments Inorg. Chem. 1 5 1982 265 278 Viktor Gutmann and Gerhard Resch. The impact of the donor–acceptor concept. Comments on Inorganic Chemistry, 1(5):265–278, 1982. [76] V.Y. Kukushkin A.J. Pombeiro Metal-mediated and metal-catalyzed hydrolysis of nitriles Inorg. Chim. Acta 358 1 2005 1 21 Vadim Yu Kukushkin and Armando JL Pombeiro. Metal-mediated and metal-catalyzed hydrolysis of nitriles. Inorganica Chimica Acta, 358(1):1–21, 2005. [77] V.K. Krieble C.I. Noll The hydrolysis of nitriles with acids J. Am. Chem. Soc. 61 3 1939 560 563 Vernon K Krieble and Clarence I Noll. The hydrolysis of nitriles with acids. Journal of the American Chemical Society, 61(3):560–563, 1939. [78] E.E. Magat B.F. Faris J.E. Reith L.F. Salisbury Acid-catalyzed reactions of nitriles. I. The reaction of nitriles with formaldehyde1 J. Am. Chem. Soc. 73 3 1951 1028 1031 Eugene E Magat, Burt F Faris, John E Reith, and L Frank Salisbury. Acid-catalyzed reactions of nitriles. i. the reaction of nitriles with formaldehyde1. Journal of the American Chemical Society, 73(3):1028–1031, 1951. [79] Y.B. Tewari R.N. Goldberg Thermodynamics of the hydrolysis reactions of nitriles J. Chem. Thermodyn. 37 7 2005 720 728 Yadu B Tewari and Robert N Goldberg. Thermodynamics of the hydrolysis reactions of nitriles. The Journal of Chemical Thermodynamics, 37(7):720–728, 2005. [80] L. Wade W. Simek Organic Chemistry tenth ed. 2022 Pearson 1135 1136 Leroy Wade and William Simek. Organic Chemistry. Pearson, tenth edition, 2022. [81] F.F. Fleming Z. Zhang W. Liu P. Knochel Metalated nitriles: Organolithium,-magnesium, and-copper exchange of α -halonitriles J. Org. Chem. 70 6 2005 2200 2205 Fraser F Fleming, Zhiyu Zhang, Wang Liu, and Paul Knochel. Metalated nitriles: Organolithium,-magnesium, and-copper exchange of α-halonitriles. The Journal of Organic Chemistry, 70(6):2200–2205, 2005. [82] S. Elangovan C. Topf S. Fischer H. Jiao A. Spannenberg W. Baumann R. Ludwig K. Junge M. Beller Selective catalytic hydrogenations of nitriles, ketones, and aldehydes by well-defined manganese pincer complexes J. Am. Chem. Soc. 138 28 2016 8809 8814 Saravanakumar Elangovan, Christoph Topf, Steffen Fischer, Haijun Jiao, Anke Spannenberg, Wolfgang Baumann, Ralf Ludwig, Kathrin Junge, and Matthias Beller. Selective catalytic hydrogenations of nitriles, ketones, and aldehydes by well-defined manganese pincer complexes. Journal of the American Chemical Society, 138(28):8809–8814, 2016. [83] L. Wade W. Simek Organic Chemistry tenth ed. 2022 Pearson 949 950 Leroy Wade and William Simek. Organic Chemistry. Pearson, tenth edition, 2022. [84] C.G. Swain The mechanism of addition of grignard reagents to nitriles J. Am. Chem. Soc. 69 10 1947 2306 2309 C Gardner Swain. The mechanism of addition of grignard reagents to nitriles. Journal of the American Chemical Society, 69(10):2306–2309, 1947. [85] F. Blicke E.-P. Tsao The reaction of certain nitriles with grignard Reagents1 J. Am. Chem. Soc. 75 22 1953 5587 5590 FF Blicke and Eu-Phang Tsao. The reaction of certain nitriles with grignard reagents1. Journal of the American Chemical Society, 75(22):5587–5590, 1953. [86] K.W. Kolasinski Surface Science: Foundations of Catalysis and Nanoscience 2020 John Wiley & Sons 115 185 Kurt W Kolasinski. Surface science: foundations of catalysis and nanoscience. John Wiley & Sons, 2020. [87] L. Xu K.G. Papanikolaou B.A. Lechner L. Je G.A. Somorjai M. Salmeron M. Mavrikakis Formation of active sites on transition metals through reaction-driven migration of surface atoms Science 380 6640 2023 70 76 Lang Xu, Konstantinos G Papanikolaou, Barbara AJ Lechner, Lisa Je, Gabor A Somorjai, Miquel Salmeron, and Manos Mavrikakis. Formation of active sites on transition metals through reaction-driven migration of surface atoms. Science, 380(6640):70–76, 2023.",
      "scopus-id": "105009999644",
      "coredata": {
        "eid": "1-s2.0-S002195172500315X",
        "dc:description": "Lithium-mediated electrochemical ammonia synthesis (LiMEAS) hinges on the formation of lithium nitride (Li3N) from dissociated nitrogen at a lithium surface. Although proton donors (PDs) are known to influence nitrogen activation, their specific role in promoting Li3N formation is still being investigated. Herein, we employ density functional theory (DFT) to examine the effects of 17 PDs on the stability and energetics of Li3N formation. We show that in the absence of PD, Li3N formation is consistently outcompeted by subsurface N2 embedding and, in some cases, by surface N2 adsorption. However, the introduction of PD species yields three distinct outcomes: (i) the PD remains intact during Li3N formation, (ii) the PD protonates Li3N, or (iii) the PD undergoes structural change. Notably, configurations in which the PD remains intact exhibited greater stability compared to subsurface embedding, driven by PD-induced surface reconstruction. We quantify this reconstruction using a two-layer displacement metric and find a strong correlation between the magnitude of displacement and the system’s overall stability. Further charge analyses show that the enhanced Li3N stability correlates with a greater electron transfer to nitrogen. Finally, we link the basicity, acidity and polarity of PD with the results of the formation of nitride, demonstrating that the basicity of PD promotes intact configurations Li3N. In contrast, higher acidity and polarity lead to protonation and alteration of PD. These insights pinpoint a region in the Kamlet–Taft β – π space where PDs remain intact and foster stable Li3N, informing future strategies to design more efficient LiMEAS systems.",
        "openArchiveArticle": "false",
        "prism:coverDate": "2025-10-31",
        "openaccessUserLicense": "http://creativecommons.org/licenses/by/4.0/",
        "prism:aggregationType": "Journal",
        "prism:url": "https://api.elsevier.com/content/article/pii/S002195172500315X",
        "dc:creator": [
          {
            "@_fa": "true",
            "$": "Azumah, Victor"
          },
          {
            "@_fa": "true",
            "$": "Kavalsky, Lance"
          },
          {
            "@_fa": "true",
            "$": "Viswanathan, Venkatasubramanian"
          }
        ],
        "link": [
          {
            "@_fa": "true",
            "@rel": "self",
            "@href": "https://api.elsevier.com/content/article/pii/S002195172500315X"
          },
          {
            "@_fa": "true",
            "@rel": "scidir",
            "@href": "https://www.sciencedirect.com/science/article/pii/S002195172500315X"
          }
        ],
        "dc:format": "application/json",
        "openaccessType": "Full",
        "pii": "S0021-9517(25)00315-X",
        "prism:volume": "450",
        "articleNumber": "116250",
        "prism:publisher": "The Author(s). Published by Elsevier Inc.",
        "dc:title": "Lithium nitride (Li3N) formation in lithium-mediated electrochemical ammonia synthesis can be enhanced with the right proton donor",
        "prism:copyright": "© 2025 The Author(s). Published by Elsevier Inc.",
        "openaccess": "1",
        "prism:issn": "00219517",
        "dcterms:subject": [
          {
            "@_fa": "true",
            "$": "Electrochemical ammonia synthesis"
          },
          {
            "@_fa": "true",
            "$": "Lithium-mediated nitrogen reduction"
          },
          {
            "@_fa": "true",
            "$": "Nitrogen dissociation"
          },
          {
            "@_fa": "true",
            "$": "Density functional theory"
          },
          {
            "@_fa": "true",
            "$": "Proton donor"
          }
        ],
        "openaccessArticle": "true",
        "prism:publicationName": "Journal of Catalysis",
        "openaccessSponsorType": "ElsevierWaived",
        "prism:pageRange": "116250",
        "pubType": "fla",
        "prism:coverDisplayDate": "October 2025",
        "prism:doi": "10.1016/j.jcat.2025.116250",
        "prism:startingPage": "116250",
        "dc:identifier": "doi:10.1016/j.jcat.2025.116250",
        "openaccessSponsorName": "University of Michigan: Core Hybrid journals RAP 2025"
      },
      "objects": {
        "object": [
          {
            "@category": "standard",
            "@height": "383",
            "@width": "525",
            "@_fa": "true",
            "$": "https://api.elsevier.com/content/object/eid/1-s2.0-S002195172500315X-gr3.jpg?httpAccept=%2A%2F%2A",
            "@multimediatype": "JPEG image file",
            "@type": "IMAGE-DOWNSAMPLED",
            "@size": "127916",
            "@ref": "gr3",
            "@mimetype": "image/jpeg"
          },
          {
            "@category": "standard",
            "@height": "574",
            "@width": "697",
            "@_fa": "true",
            "$": "https://api.elsevier.com/content/object/eid/1-s2.0-S002195172500315X-gr4.jpg?httpAccept=%2A%2F%2A",
            "@multimediatype": "JPEG image file",
            "@type": "IMAGE-DOWNSAMPLED",
            "@size": "178535",
            "@ref": "gr4",
            "@mimetype": "image/jpeg"
          },
          {
            "@category": "standard",
            "@height": "342",
            "@width": "698",
            "@_fa": "true",
            "$": "https://api.elsevier.com/content/object/eid/1-s2.0-S002195172500315X-gr1.jpg?httpAccept=%2A%2F%2A",
            "@multimediatype": "JPEG image file",
            "@type": "IMAGE-DOWNSAMPLED",
            "@size": "127735",
            "@ref": "gr1",
            "@mimetype": "image/jpeg"
          },
          {
            "@category": "standard",
            "@height": "499",
            "@width": "688",
            "@_fa": "true",
            "$": "https://api.elsevier.com/content/object/eid/1-s2.0-S002195172500315X-gr2.jpg?httpAccept=%2A%2F%2A",
            "@multimediatype": "JPEG image file",
            "@type": "IMAGE-DOWNSAMPLED",
            "@size": "158577",
            "@ref": "gr2",
            "@mimetype": "image/jpeg"
          },
          {
            "@category": "standard",
            "@height": "349",
            "@width": "690",
            "@_fa": "true",
            "$": "https://api.elsevier.com/content/object/eid/1-s2.0-S002195172500315X-gr9.jpg?httpAccept=%2A%2F%2A",
            "@multimediatype": "JPEG image file",
            "@type": "IMAGE-DOWNSAMPLED",
            "@size": "155112",
            "@ref": "gr9",
            "@mimetype": "image/jpeg"
          },
          {
            "@category": "standard",
            "@height": "502",
            "@width": "687",
            "@_fa": "true",
            "$": "https://api.elsevier.com/content/object/eid/1-s2.0-S002195172500315X-gr7.jpg?httpAccept=%2A%2F%2A",
            "@multimediatype": "JPEG image file",
            "@type": "IMAGE-DOWNSAMPLED",
            "@size": "156618",
            "@ref": "gr7",
            "@mimetype": "image/jpeg"
          },
          {
            "@category": "standard",
            "@height": "428",
            "@width": "691",
            "@_fa": "true",
            "$": "https://api.elsevier.com/content/object/eid/1-s2.0-S002195172500315X-gr8.jpg?httpAccept=%2A%2F%2A",
            "@multimediatype": "JPEG image file",
            "@type": "IMAGE-DOWNSAMPLED",
            "@size": "150103",
            "@ref": "gr8",
            "@mimetype": "image/jpeg"
          },
          {
            "@category": "standard",
            "@height": "576",
            "@width": "694",
            "@_fa": "true",
            "$": "https://api.elsevier.com/content/object/eid/1-s2.0-S002195172500315X-gr5.jpg?httpAccept=%2A%2F%2A",
            "@multimediatype": "JPEG image file",
            "@type": "IMAGE-DOWNSAMPLED",
            "@size": "154957",
            "@ref": "gr5",
            "@mimetype": "image/jpeg"
          },
          {
            "@category": "standard",
            "@height": "232",
            "@width": "634",
            "@_fa": "true",
            "$": "https://api.elsevier.com/content/object/eid/1-s2.0-S002195172500315X-gr6.jpg?httpAccept=%2A%2F%2A",
            "@multimediatype": "JPEG image file",
            "@type": "IMAGE-DOWNSAMPLED",
            "@size": "120489",
            "@ref": "gr6",
            "@mimetype": "image/jpeg"
          },
          {
            "@category": "standard",
            "@height": "12",
            "@width": "24",
            "@_fa": "true",
            "$": "https://api.elsevier.com/content/object/eid/1-s2.0-S002195172500315X-fx1020.jpg?httpAccept=%2A%2F%2A",
            "@multimediatype": "JPEG image file",
            "@type": "IMAGE-DOWNSAMPLED",
            "@size": "4608",
            "@ref": "fx1020",
            "@mimetype": "image/jpeg"
          },
          {
            "@category": "standard",
            "@height": "18",
            "@width": "241",
            "@_fa": "true",
            "$": "https://api.elsevier.com/content/object/eid/1-s2.0-S002195172500315X-fx1021.jpg?httpAccept=%2A%2F%2A",
            "@multimediatype": "JPEG image file",
            "@type": "IMAGE-DOWNSAMPLED",
            "@size": "8854",
            "@ref": "fx1021",
            "@mimetype": "image/jpeg"
          },
          {
            "@category": "standard",
            "@height": "121",
            "@width": "301",
            "@_fa": "true",
            "$": "https://api.elsevier.com/content/object/eid/1-s2.0-S002195172500315X-ga1.jpg?httpAccept=%2A%2F%2A",
            "@multimediatype": "JPEG image file",
            "@type": "IMAGE-DOWNSAMPLED",
            "@size": "90612",
            "@ref": "ga1",
            "@mimetype": "image/jpeg"
          },
          {
            "@category": "standard",
            "@height": "14",
            "@width": "19",
            "@_fa": "true",
            "$": "https://api.elsevier.com/content/object/eid/1-s2.0-S002195172500315X-fx1022.jpg?httpAccept=%2A%2F%2A",
            "@multimediatype": "JPEG image file",
            "@type": "IMAGE-DOWNSAMPLED",
            "@size": "4591",
            "@ref": "fx1022",
            "@mimetype": "image/jpeg"
          },
          {
            "@category": "standard",
            "@height": "12",
            "@width": "24",
            "@_fa": "true",
            "$": "https://api.elsevier.com/content/object/eid/1-s2.0-S002195172500315X-fx1001.jpg?httpAccept=%2A%2F%2A",
            "@multimediatype": "JPEG image file",
            "@type": "IMAGE-DOWNSAMPLED",
            "@size": "4608",
            "@ref": "fx1001",
            "@mimetype": "image/jpeg"
          },
          {
            "@category": "standard",
            "@height": "14",
            "@width": "19",
            "@_fa": "true",
            "$": "https://api.elsevier.com/content/object/eid/1-s2.0-S002195172500315X-fx1023.jpg?httpAccept=%2A%2F%2A",
            "@multimediatype": "JPEG image file",
            "@type": "IMAGE-DOWNSAMPLED",
            "@size": "4586",
            "@ref": "fx1023",
            "@mimetype": "image/jpeg"
          },
          {
            "@category": "standard",
            "@height": "16",
            "@width": "166",
            "@_fa": "true",
            "$": "https://api.elsevier.com/content/object/eid/1-s2.0-S002195172500315X-fx1002.jpg?httpAccept=%2A%2F%2A",
            "@multimediatype": "JPEG image file",
            "@type": "IMAGE-DOWNSAMPLED",
            "@size": "7308",
            "@ref": "fx1002",
            "@mimetype": "image/jpeg"
          },
          {
            "@category": "standard",
            "@height": "8",
            "@width": "46",
            "@_fa": "true",
            "$": "https://api.elsevier.com/content/object/eid/1-s2.0-S002195172500315X-fx1024.jpg?httpAccept=%2A%2F%2A",
            "@multimediatype": "JPEG image file",
            "@type": "IMAGE-DOWNSAMPLED",
            "@size": "4790",
            "@ref": "fx1024",
            "@mimetype": "image/jpeg"
          },
          {
            "@category": "standard",
            "@height": "14",
            "@width": "19",
            "@_fa": "true",
            "$": "https://api.elsevier.com/content/object/eid/1-s2.0-S002195172500315X-fx1003.jpg?httpAccept=%2A%2F%2A",
            "@multimediatype": "JPEG image file",
            "@type": "IMAGE-DOWNSAMPLED",
            "@size": "4591",
            "@ref": "fx1003",
            "@mimetype": "image/jpeg"
          },
          {
            "@category": "standard",
            "@height": "8",
            "@width": "36",
            "@_fa": "true",
            "$": "https://api.elsevier.com/content/object/eid/1-s2.0-S002195172500315X-fx1025.jpg?httpAccept=%2A%2F%2A",
            "@multimediatype": "JPEG image file",
            "@type": "IMAGE-DOWNSAMPLED",
            "@size": "4674",
            "@ref": "fx1025",
            "@mimetype": "image/jpeg"
          },
          {
            "@category": "standard",
            "@height": "14",
            "@width": "157",
            "@_fa": "true",
            "$": "https://api.elsevier.com/content/object/eid/1-s2.0-S002195172500315X-fx1004.jpg?httpAccept=%2A%2F%2A",
            "@multimediatype": "JPEG image file",
            "@type": "IMAGE-DOWNSAMPLED",
            "@size": "6815",
            "@ref": "fx1004",
            "@mimetype": "image/jpeg"
          },
          {
            "@category": "standard",
            "@height": "12",
            "@width": "24",
            "@_fa": "true",
            "$": "https://api.elsevier.com/content/object/eid/1-s2.0-S002195172500315X-fx1026.jpg?httpAccept=%2A%2F%2A",
            "@multimediatype": "JPEG image file",
            "@type": "IMAGE-DOWNSAMPLED",
            "@size": "4608",
            "@ref": "fx1026",
            "@mimetype": "image/jpeg"
          },
          {
            "@category": "standard",
            "@height": "11",
            "@width": "13",
            "@_fa": "true",
            "$": "https://api.elsevier.com/content/object/eid/1-s2.0-S002195172500315X-fx1005.jpg?httpAccept=%2A%2F%2A",
            "@multimediatype": "JPEG image file",
            "@type": "IMAGE-DOWNSAMPLED",
            "@size": "4419",
            "@ref": "fx1005",
            "@mimetype": "image/jpeg"
          },
          {
            "@category": "standard",
            "@height": "12",
            "@width": "24",
            "@_fa": "true",
            "$": "https://api.elsevier.com/content/object/eid/1-s2.0-S002195172500315X-fx1027.jpg?httpAccept=%2A%2F%2A",
            "@multimediatype": "JPEG image file",
            "@type": "IMAGE-DOWNSAMPLED",
            "@size": "4608",
            "@ref": "fx1027",
            "@mimetype": "image/jpeg"
          },
          {
            "@category": "standard",
            "@height": "14",
            "@width": "41",
            "@_fa": "true",
            "$": "https://api.elsevier.com/content/object/eid/1-s2.0-S002195172500315X-fx1006.jpg?httpAccept=%2A%2F%2A",
            "@multimediatype": "JPEG image file",
            "@type": "IMAGE-DOWNSAMPLED",
            "@size": "4967",
            "@ref": "fx1006",
            "@mimetype": "image/jpeg"
          },
          {
            "@category": "standard",
            "@height": "11",
            "@width": "20",
            "@_fa": "true",
            "$": "https://api.elsevier.com/content/object/eid/1-s2.0-S002195172500315X-fx1028.jpg?httpAccept=%2A%2F%2A",
            "@multimediatype": "JPEG image file",
            "@type": "IMAGE-DOWNSAMPLED",
            "@size": "4500",
            "@ref": "fx1028",
            "@mimetype": "image/jpeg"
          },
          {
            "@category": "standard",
            "@height": "12",
            "@width": "24",
            "@_fa": "true",
            "$": "https://api.elsevier.com/content/object/eid/1-s2.0-S002195172500315X-fx1007.jpg?httpAccept=%2A%2F%2A",
            "@multimediatype": "JPEG image file",
            "@type": "IMAGE-DOWNSAMPLED",
            "@size": "4608",
            "@ref": "fx1007",
            "@mimetype": "image/jpeg"
          },
          {
            "@category": "standard",
            "@height": "14",
            "@width": "214",
            "@_fa": "true",
            "$": "https://api.elsevier.com/content/object/eid/1-s2.0-S002195172500315X-fx1008.jpg?httpAccept=%2A%2F%2A",
            "@multimediatype": "JPEG image file",
            "@type": "IMAGE-DOWNSAMPLED",
            "@size": "7803",
            "@ref": "fx1008",
            "@mimetype": "image/jpeg"
          },
          {
            "@category": "standard",
            "@height": "12",
            "@width": "24",
            "@_fa": "true",
            "$": "https://api.elsevier.com/content/object/eid/1-s2.0-S002195172500315X-fx1009.jpg?httpAccept=%2A%2F%2A",
            "@multimediatype": "JPEG image file",
            "@type": "IMAGE-DOWNSAMPLED",
            "@size": "4608",
            "@ref": "fx1009",
            "@mimetype": "image/jpeg"
          },
          {
            "@category": "standard",
            "@height": "12",
            "@width": "24",
            "@_fa": "true",
            "$": "https://api.elsevier.com/content/object/eid/1-s2.0-S002195172500315X-fx1010.jpg?httpAccept=%2A%2F%2A",
            "@multimediatype": "JPEG image file",
            "@type": "IMAGE-DOWNSAMPLED",
            "@size": "4608",
            "@ref": "fx1010",
            "@mimetype": "image/jpeg"
          },
          {
            "@category": "standard",
            "@height": "11",
            "@width": "13",
            "@_fa": "true",
            "$": "https://api.elsevier.com/content/object/eid/1-s2.0-S002195172500315X-fx1011.jpg?httpAccept=%2A%2F%2A",
            "@multimediatype": "JPEG image file",
            "@type": "IMAGE-DOWNSAMPLED",
            "@size": "4419",
            "@ref": "fx1011",
            "@mimetype": "image/jpeg"
          },
          {
            "@category": "standard",
            "@height": "12",
            "@width": "24",
            "@_fa": "true",
            "$": "https://api.elsevier.com/content/object/eid/1-s2.0-S002195172500315X-fx1012.jpg?httpAccept=%2A%2F%2A",
            "@multimediatype": "JPEG image file",
            "@type": "IMAGE-DOWNSAMPLED",
            "@size": "4608",
            "@ref": "fx1012",
            "@mimetype": "image/jpeg"
          },
          {
            "@category": "standard",
            "@height": "11",
            "@width": "13",
            "@_fa": "true",
            "$": "https://api.elsevier.com/content/object/eid/1-s2.0-S002195172500315X-fx1013.jpg?httpAccept=%2A%2F%2A",
            "@multimediatype": "JPEG image file",
            "@type": "IMAGE-DOWNSAMPLED",
            "@size": "4419",
            "@ref": "fx1013",
            "@mimetype": "image/jpeg"
          },
          {
            "@category": "standard",
            "@height": "553",
            "@width": "572",
            "@_fa": "true",
            "$": "https://api.elsevier.com/content/object/eid/1-s2.0-S002195172500315X-gr10.jpg?httpAccept=%2A%2F%2A",
            "@multimediatype": "JPEG image file",
            "@type": "IMAGE-DOWNSAMPLED",
            "@size": "166154",
            "@ref": "gr10",
            "@mimetype": "image/jpeg"
          },
          {
            "@category": "standard",
            "@height": "11",
            "@width": "13",
            "@_fa": "true",
            "$": "https://api.elsevier.com/content/object/eid/1-s2.0-S002195172500315X-fx1014.jpg?httpAccept=%2A%2F%2A",
            "@multimediatype": "JPEG image file",
            "@type": "IMAGE-DOWNSAMPLED",
            "@size": "4419",
            "@ref": "fx1014",
            "@mimetype": "image/jpeg"
          },
          {
            "@category": "standard",
            "@height": "12",
            "@width": "24",
            "@_fa": "true",
            "$": "https://api.elsevier.com/content/object/eid/1-s2.0-S002195172500315X-fx1015.jpg?httpAccept=%2A%2F%2A",
            "@multimediatype": "JPEG image file",
            "@type": "IMAGE-DOWNSAMPLED",
            "@size": "4608",
            "@ref": "fx1015",
            "@mimetype": "image/jpeg"
          },
          {
            "@category": "standard",
            "@height": "12",
            "@width": "24",
            "@_fa": "true",
            "$": "https://api.elsevier.com/content/object/eid/1-s2.0-S002195172500315X-fx1016.jpg?httpAccept=%2A%2F%2A",
            "@multimediatype": "JPEG image file",
            "@type": "IMAGE-DOWNSAMPLED",
            "@size": "4608",
            "@ref": "fx1016",
            "@mimetype": "image/jpeg"
          },
          {
            "@category": "standard",
            "@height": "12",
            "@width": "24",
            "@_fa": "true",
            "$": "https://api.elsevier.com/content/object/eid/1-s2.0-S002195172500315X-fx1017.jpg?httpAccept=%2A%2F%2A",
            "@multimediatype": "JPEG image file",
            "@type": "IMAGE-DOWNSAMPLED",
            "@size": "4608",
            "@ref": "fx1017",
            "@mimetype": "image/jpeg"
          },
          {
            "@category": "standard",
            "@height": "12",
            "@width": "24",
            "@_fa": "true",
            "$": "https://api.elsevier.com/content/object/eid/1-s2.0-S002195172500315X-fx1018.jpg?httpAccept=%2A%2F%2A",
            "@multimediatype": "JPEG image file",
            "@type": "IMAGE-DOWNSAMPLED",
            "@size": "4608",
            "@ref": "fx1018",
            "@mimetype": "image/jpeg"
          },
          {
            "@category": "standard",
            "@height": "11",
            "@width": "13",
            "@_fa": "true",
            "$": "https://api.elsevier.com/content/object/eid/1-s2.0-S002195172500315X-fx1019.jpg?httpAccept=%2A%2F%2A",
            "@multimediatype": "JPEG image file",
            "@type": "IMAGE-DOWNSAMPLED",
            "@size": "4419",
            "@ref": "fx1019",
            "@mimetype": "image/jpeg"
          },
          {
            "@category": "thumbnail",
            "@height": "160",
            "@width": "219",
            "@_fa": "true",
            "$": "https://api.elsevier.com/content/object/eid/1-s2.0-S002195172500315X-gr3.sml?httpAccept=%2A%2F%2A",
            "@multimediatype": "GIF image file",
            "@type": "IMAGE-THUMBNAIL",
            "@size": "81521",
            "@ref": "gr3",
            "@mimetype": "image/gif"
          },
          {
            "@category": "thumbnail",
            "@height": "164",
            "@width": "199",
            "@_fa": "true",
            "$": "https://api.elsevier.com/content/object/eid/1-s2.0-S002195172500315X-gr4.sml?httpAccept=%2A%2F%2A",
            "@multimediatype": "GIF image file",
            "@type": "IMAGE-THUMBNAIL",
            "@size": "82162",
            "@ref": "gr4",
            "@mimetype": "image/gif"
          },
          {
            "@category": "thumbnail",
            "@height": "107",
            "@width": "219",
            "@_fa": "true",
            "$": "https://api.elsevier.com/content/object/eid/1-s2.0-S002195172500315X-gr1.sml?httpAccept=%2A%2F%2A",
            "@multimediatype": "GIF image file",
            "@type": "IMAGE-THUMBNAIL",
            "@size": "77384",
            "@ref": "gr1",
            "@mimetype": "image/gif"
          },
          {
            "@category": "thumbnail",
            "@height": "159",
            "@width": "219",
            "@_fa": "true",
            "$": "https://api.elsevier.com/content/object/eid/1-s2.0-S002195172500315X-gr2.sml?httpAccept=%2A%2F%2A",
            "@multimediatype": "GIF image file",
            "@type": "IMAGE-THUMBNAIL",
            "@size": "81341",
            "@ref": "gr2",
            "@mimetype": "image/gif"
          },
          {
            "@category": "thumbnail",
            "@height": "111",
            "@width": "219",
            "@_fa": "true",
            "$": "https://api.elsevier.com/content/object/eid/1-s2.0-S002195172500315X-gr9.sml?httpAccept=%2A%2F%2A",
            "@multimediatype": "GIF image file",
            "@type": "IMAGE-THUMBNAIL",
            "@size": "81031",
            "@ref": "gr9",
            "@mimetype": "image/gif"
          },
          {
            "@category": "thumbnail",
            "@height": "160",
            "@width": "219",
            "@_fa": "true",
            "$": "https://api.elsevier.com/content/object/eid/1-s2.0-S002195172500315X-gr7.sml?httpAccept=%2A%2F%2A",
            "@multimediatype": "GIF image file",
            "@type": "IMAGE-THUMBNAIL",
            "@size": "77752",
            "@ref": "gr7",
            "@mimetype": "image/gif"
          },
          {
            "@category": "thumbnail",
            "@height": "136",
            "@width": "219",
            "@_fa": "true",
            "$": "https://api.elsevier.com/content/object/eid/1-s2.0-S002195172500315X-gr8.sml?httpAccept=%2A%2F%2A",
            "@multimediatype": "GIF image file",
            "@type": "IMAGE-THUMBNAIL",
            "@size": "76738",
            "@ref": "gr8",
            "@mimetype": "image/gif"
          },
          {
            "@category": "thumbnail",
            "@height": "163",
            "@width": "197",
            "@_fa": "true",
            "$": "https://api.elsevier.com/content/object/eid/1-s2.0-S002195172500315X-gr5.sml?httpAccept=%2A%2F%2A",
            "@multimediatype": "GIF image file",
            "@type": "IMAGE-THUMBNAIL",
            "@size": "79261",
            "@ref": "gr5",
            "@mimetype": "image/gif"
          },
          {
            "@category": "thumbnail",
            "@height": "80",
            "@width": "219",
            "@_fa": "true",
            "$": "https://api.elsevier.com/content/object/eid/1-s2.0-S002195172500315X-gr6.sml?httpAccept=%2A%2F%2A",
            "@multimediatype": "GIF image file",
            "@type": "IMAGE-THUMBNAIL",
            "@size": "74655",
            "@ref": "gr6",
            "@mimetype": "image/gif"
          },
          {
            "@category": "thumbnail",
            "@height": "33",
            "@width": "66",
            "@_fa": "true",
            "$": "https://api.elsevier.com/content/object/eid/1-s2.0-S002195172500315X-fx1020.sml?httpAccept=%2A%2F%2A",
            "@multimediatype": "GIF image file",
            "@type": "IMAGE-THUMBNAIL",
            "@size": "4255",
            "@ref": "fx1020",
            "@mimetype": "image/gif"
          },
          {
            "@category": "thumbnail",
            "@height": "17",
            "@width": "219",
            "@_fa": "true",
            "$": "https://api.elsevier.com/content/object/eid/1-s2.0-S002195172500315X-fx1021.sml?httpAccept=%2A%2F%2A",
            "@multimediatype": "GIF image file",
            "@type": "IMAGE-THUMBNAIL",
            "@size": "5866",
            "@ref": "fx1021",
            "@mimetype": "image/gif"
          },
          {
            "@category": "thumbnail",
            "@height": "88",
            "@width": "219",
            "@_fa": "true",
            "$": "https://api.elsevier.com/content/object/eid/1-s2.0-S002195172500315X-ga1.sml?httpAccept=%2A%2F%2A",
            "@multimediatype": "GIF image file",
            "@type": "IMAGE-THUMBNAIL",
            "@size": "78246",
            "@ref": "ga1",
            "@mimetype": "image/gif"
          },
          {
            "@category": "thumbnail",
            "@height": "37",
            "@width": "51",
            "@_fa": "true",
            "$": "https://api.elsevier.com/content/object/eid/1-s2.0-S002195172500315X-fx1022.sml?httpAccept=%2A%2F%2A",
            "@multimediatype": "GIF image file",
            "@type": "IMAGE-THUMBNAIL",
            "@size": "4282",
            "@ref": "fx1022",
            "@mimetype": "image/gif"
          },
          {
            "@category": "thumbnail",
            "@height": "33",
            "@width": "66",
            "@_fa": "true",
            "$": "https://api.elsevier.com/content/object/eid/1-s2.0-S002195172500315X-fx1001.sml?httpAccept=%2A%2F%2A",
            "@multimediatype": "GIF image file",
            "@type": "IMAGE-THUMBNAIL",
            "@size": "4255",
            "@ref": "fx1001",
            "@mimetype": "image/gif"
          },
          {
            "@category": "thumbnail",
            "@height": "37",
            "@width": "51",
            "@_fa": "true",
            "$": "https://api.elsevier.com/content/object/eid/1-s2.0-S002195172500315X-fx1023.sml?httpAccept=%2A%2F%2A",
            "@multimediatype": "GIF image file",
            "@type": "IMAGE-THUMBNAIL",
            "@size": "4303",
            "@ref": "fx1023",
            "@mimetype": "image/gif"
          },
          {
            "@category": "thumbnail",
            "@height": "21",
            "@width": "219",
            "@_fa": "true",
            "$": "https://api.elsevier.com/content/object/eid/1-s2.0-S002195172500315X-fx1002.sml?httpAccept=%2A%2F%2A",
            "@multimediatype": "GIF image file",
            "@type": "IMAGE-THUMBNAIL",
            "@size": "5712",
            "@ref": "fx1002",
            "@mimetype": "image/gif"
          },
          {
            "@category": "thumbnail",
            "@height": "22",
            "@width": "123",
            "@_fa": "true",
            "$": "https://api.elsevier.com/content/object/eid/1-s2.0-S002195172500315X-fx1024.sml?httpAccept=%2A%2F%2A",
            "@multimediatype": "GIF image file",
            "@type": "IMAGE-THUMBNAIL",
            "@size": "4855",
            "@ref": "fx1024",
            "@mimetype": "image/gif"
          },
          {
            "@category": "thumbnail",
            "@height": "37",
            "@width": "51",
            "@_fa": "true",
            "$": "https://api.elsevier.com/content/object/eid/1-s2.0-S002195172500315X-fx1003.sml?httpAccept=%2A%2F%2A",
            "@multimediatype": "GIF image file",
            "@type": "IMAGE-THUMBNAIL",
            "@size": "4282",
            "@ref": "fx1003",
            "@mimetype": "image/gif"
          },
          {
            "@category": "thumbnail",
            "@height": "22",
            "@width": "98",
            "@_fa": "true",
            "$": "https://api.elsevier.com/content/object/eid/1-s2.0-S002195172500315X-fx1025.sml?httpAccept=%2A%2F%2A",
            "@multimediatype": "GIF image file",
            "@type": "IMAGE-THUMBNAIL",
            "@size": "4567",
            "@ref": "fx1025",
            "@mimetype": "image/gif"
          },
          {
            "@category": "thumbnail",
            "@height": "19",
            "@width": "219",
            "@_fa": "true",
            "$": "https://api.elsevier.com/content/object/eid/1-s2.0-S002195172500315X-fx1004.sml?httpAccept=%2A%2F%2A",
            "@multimediatype": "GIF image file",
            "@type": "IMAGE-THUMBNAIL",
            "@size": "5435",
            "@ref": "fx1004",
            "@mimetype": "image/gif"
          },
          {
            "@category": "thumbnail",
            "@height": "33",
            "@width": "66",
            "@_fa": "true",
            "$": "https://api.elsevier.com/content/object/eid/1-s2.0-S002195172500315X-fx1026.sml?httpAccept=%2A%2F%2A",
            "@multimediatype": "GIF image file",
            "@type": "IMAGE-THUMBNAIL",
            "@size": "4255",
            "@ref": "fx1026",
            "@mimetype": "image/gif"
          },
          {
            "@category": "thumbnail",
            "@height": "31",
            "@width": "37",
            "@_fa": "true",
            "$": "https://api.elsevier.com/content/object/eid/1-s2.0-S002195172500315X-fx1005.sml?httpAccept=%2A%2F%2A",
            "@multimediatype": "GIF image file",
            "@type": "IMAGE-THUMBNAIL",
            "@size": "4039",
            "@ref": "fx1005",
            "@mimetype": "image/gif"
          },
          {
            "@category": "thumbnail",
            "@height": "33",
            "@width": "66",
            "@_fa": "true",
            "$": "https://api.elsevier.com/content/object/eid/1-s2.0-S002195172500315X-fx1027.sml?httpAccept=%2A%2F%2A",
            "@multimediatype": "GIF image file",
            "@type": "IMAGE-THUMBNAIL",
            "@size": "4255",
            "@ref": "fx1027",
            "@mimetype": "image/gif"
          },
          {
            "@category": "thumbnail",
            "@height": "37",
            "@width": "111",
            "@_fa": "true",
            "$": "https://api.elsevier.com/content/object/eid/1-s2.0-S002195172500315X-fx1006.sml?httpAccept=%2A%2F%2A",
            "@multimediatype": "GIF image file",
            "@type": "IMAGE-THUMBNAIL",
            "@size": "4929",
            "@ref": "fx1006",
            "@mimetype": "image/gif"
          },
          {
            "@category": "thumbnail",
            "@height": "31",
            "@width": "55",
            "@_fa": "true",
            "$": "https://api.elsevier.com/content/object/eid/1-s2.0-S002195172500315X-fx1028.sml?httpAccept=%2A%2F%2A",
            "@multimediatype": "GIF image file",
            "@type": "IMAGE-THUMBNAIL",
            "@size": "4153",
            "@ref": "fx1028",
            "@mimetype": "image/gif"
          },
          {
            "@category": "thumbnail",
            "@height": "33",
            "@width": "66",
            "@_fa": "true",
            "$": "https://api.elsevier.com/content/object/eid/1-s2.0-S002195172500315X-fx1007.sml?httpAccept=%2A%2F%2A",
            "@multimediatype": "GIF image file",
            "@type": "IMAGE-THUMBNAIL",
            "@size": "4255",
            "@ref": "fx1007",
            "@mimetype": "image/gif"
          },
          {
            "@category": "thumbnail",
            "@height": "14",
            "@width": "219",
            "@_fa": "true",
            "$": "https://api.elsevier.com/content/object/eid/1-s2.0-S002195172500315X-fx1008.sml?httpAccept=%2A%2F%2A",
            "@multimediatype": "GIF image file",
            "@type": "IMAGE-THUMBNAIL",
            "@size": "5359",
            "@ref": "fx1008",
            "@mimetype": "image/gif"
          },
          {
            "@category": "thumbnail",
            "@height": "33",
            "@width": "66",
            "@_fa": "true",
            "$": "https://api.elsevier.com/content/object/eid/1-s2.0-S002195172500315X-fx1009.sml?httpAccept=%2A%2F%2A",
            "@multimediatype": "GIF image file",
            "@type": "IMAGE-THUMBNAIL",
            "@size": "4255",
            "@ref": "fx1009",
            "@mimetype": "image/gif"
          },
          {
            "@category": "thumbnail",
            "@height": "33",
            "@width": "66",
            "@_fa": "true",
            "$": "https://api.elsevier.com/content/object/eid/1-s2.0-S002195172500315X-fx1010.sml?httpAccept=%2A%2F%2A",
            "@multimediatype": "GIF image file",
            "@type": "IMAGE-THUMBNAIL",
            "@size": "4255",
            "@ref": "fx1010",
            "@mimetype": "image/gif"
          },
          {
            "@category": "thumbnail",
            "@height": "31",
            "@width": "37",
            "@_fa": "true",
            "$": "https://api.elsevier.com/content/object/eid/1-s2.0-S002195172500315X-fx1011.sml?httpAccept=%2A%2F%2A",
            "@multimediatype": "GIF image file",
            "@type": "IMAGE-THUMBNAIL",
            "@size": "4039",
            "@ref": "fx1011",
            "@mimetype": "image/gif"
          },
          {
            "@category": "thumbnail",
            "@height": "33",
            "@width": "66",
            "@_fa": "true",
            "$": "https://api.elsevier.com/content/object/eid/1-s2.0-S002195172500315X-fx1012.sml?httpAccept=%2A%2F%2A",
            "@multimediatype": "GIF image file",
            "@type": "IMAGE-THUMBNAIL",
            "@size": "4255",
            "@ref": "fx1012",
            "@mimetype": "image/gif"
          },
          {
            "@category": "thumbnail",
            "@height": "31",
            "@width": "37",
            "@_fa": "true",
            "$": "https://api.elsevier.com/content/object/eid/1-s2.0-S002195172500315X-fx1013.sml?httpAccept=%2A%2F%2A",
            "@multimediatype": "GIF image file",
            "@type": "IMAGE-THUMBNAIL",
            "@size": "4039",
            "@ref": "fx1013",
            "@mimetype": "image/gif"
          },
          {
            "@category": "thumbnail",
            "@height": "163",
            "@width": "169",
            "@_fa": "true",
            "$": "https://api.elsevier.com/content/object/eid/1-s2.0-S002195172500315X-gr10.sml?httpAccept=%2A%2F%2A",
            "@multimediatype": "GIF image file",
            "@type": "IMAGE-THUMBNAIL",
            "@size": "78635",
            "@ref": "gr10",
            "@mimetype": "image/gif"
          },
          {
            "@category": "thumbnail",
            "@height": "31",
            "@width": "37",
            "@_fa": "true",
            "$": "https://api.elsevier.com/content/object/eid/1-s2.0-S002195172500315X-fx1014.sml?httpAccept=%2A%2F%2A",
            "@multimediatype": "GIF image file",
            "@type": "IMAGE-THUMBNAIL",
            "@size": "4039",
            "@ref": "fx1014",
            "@mimetype": "image/gif"
          },
          {
            "@category": "thumbnail",
            "@height": "33",
            "@width": "66",
            "@_fa": "true",
            "$": "https://api.elsevier.com/content/object/eid/1-s2.0-S002195172500315X-fx1015.sml?httpAccept=%2A%2F%2A",
            "@multimediatype": "GIF image file",
            "@type": "IMAGE-THUMBNAIL",
            "@size": "4255",
            "@ref": "fx1015",
            "@mimetype": "image/gif"
          },
          {
            "@category": "thumbnail",
            "@height": "33",
            "@width": "66",
            "@_fa": "true",
            "$": "https://api.elsevier.com/content/object/eid/1-s2.0-S002195172500315X-fx1016.sml?httpAccept=%2A%2F%2A",
            "@multimediatype": "GIF image file",
            "@type": "IMAGE-THUMBNAIL",
            "@size": "4255",
            "@ref": "fx1016",
            "@mimetype": "image/gif"
          },
          {
            "@category": "thumbnail",
            "@height": "33",
            "@width": "66",
            "@_fa": "true",
            "$": "https://api.elsevier.com/content/object/eid/1-s2.0-S002195172500315X-fx1017.sml?httpAccept=%2A%2F%2A",
            "@multimediatype": "GIF image file",
            "@type": "IMAGE-THUMBNAIL",
            "@size": "4255",
            "@ref": "fx1017",
            "@mimetype": "image/gif"
          },
          {
            "@category": "thumbnail",
            "@height": "33",
            "@width": "66",
            "@_fa": "true",
            "$": "https://api.elsevier.com/content/object/eid/1-s2.0-S002195172500315X-fx1018.sml?httpAccept=%2A%2F%2A",
            "@multimediatype": "GIF image file",
            "@type": "IMAGE-THUMBNAIL",
            "@size": "4255",
            "@ref": "fx1018",
            "@mimetype": "image/gif"
          },
          {
            "@category": "thumbnail",
            "@height": "31",
            "@width": "37",
            "@_fa": "true",
            "$": "https://api.elsevier.com/content/object/eid/1-s2.0-S002195172500315X-fx1019.sml?httpAccept=%2A%2F%2A",
            "@multimediatype": "GIF image file",
            "@type": "IMAGE-THUMBNAIL",
            "@size": "4039",
            "@ref": "fx1019",
            "@mimetype": "image/gif"
          },
          {
            "@category": "high",
            "@height": "1694",
            "@width": "2324",
            "@_fa": "true",
            "$": "https://api.elsevier.com/content/object/eid/1-s2.0-S002195172500315X-gr3_lrg.jpg?httpAccept=%2A%2F%2A",
            "@multimediatype": "JPEG image file",
            "@type": "IMAGE-HIGH-RES",
            "@size": "460224",
            "@ref": "gr3",
            "@mimetype": "image/jpeg"
          },
          {
            "@category": "high",
            "@height": "2541",
            "@width": "3085",
            "@_fa": "true",
            "$": "https://api.elsevier.com/content/object/eid/1-s2.0-S002195172500315X-gr4_lrg.jpg?httpAccept=%2A%2F%2A",
            "@multimediatype": "JPEG image file",
            "@type": "IMAGE-HIGH-RES",
            "@size": "714192",
            "@ref": "gr4",
            "@mimetype": "image/jpeg"
          },
          {
            "@category": "high",
            "@height": "1514",
            "@width": "3089",
            "@_fa": "true",
            "$": "https://api.elsevier.com/content/object/eid/1-s2.0-S002195172500315X-gr1_lrg.jpg?httpAccept=%2A%2F%2A",
            "@multimediatype": "JPEG image file",
            "@type": "IMAGE-HIGH-RES",
            "@size": "493088",
            "@ref": "gr1",
            "@mimetype": "image/jpeg"
          },
          {
            "@category": "high",
            "@height": "2212",
            "@width": "3047",
            "@_fa": "true",
            "$": "https://api.elsevier.com/content/object/eid/1-s2.0-S002195172500315X-gr2_lrg.jpg?httpAccept=%2A%2F%2A",
            "@multimediatype": "JPEG image file",
            "@type": "IMAGE-HIGH-RES",
            "@size": "587742",
            "@ref": "gr2",
            "@mimetype": "image/jpeg"
          },
          {
            "@category": "high",
            "@height": "1545",
            "@width": "3056",
            "@_fa": "true",
            "$": "https://api.elsevier.com/content/object/eid/1-s2.0-S002195172500315X-gr9_lrg.jpg?httpAccept=%2A%2F%2A",
            "@multimediatype": "JPEG image file",
            "@type": "IMAGE-HIGH-RES",
            "@size": "637850",
            "@ref": "gr9",
            "@mimetype": "image/jpeg"
          },
          {
            "@category": "high",
            "@height": "2222",
            "@width": "3042",
            "@_fa": "true",
            "$": "https://api.elsevier.com/content/object/eid/1-s2.0-S002195172500315X-gr7_lrg.jpg?httpAccept=%2A%2F%2A",
            "@multimediatype": "JPEG image file",
            "@type": "IMAGE-HIGH-RES",
            "@size": "711600",
            "@ref": "gr7",
            "@mimetype": "image/jpeg"
          },
          {
            "@category": "high",
            "@height": "1898",
            "@width": "3061",
            "@_fa": "true",
            "$": "https://api.elsevier.com/content/object/eid/1-s2.0-S002195172500315X-gr8_lrg.jpg?httpAccept=%2A%2F%2A",
            "@multimediatype": "JPEG image file",
            "@type": "IMAGE-HIGH-RES",
            "@size": "677231",
            "@ref": "gr8",
            "@mimetype": "image/jpeg"
          },
          {
            "@category": "high",
            "@height": "2551",
            "@width": "3075",
            "@_fa": "true",
            "$": "https://api.elsevier.com/content/object/eid/1-s2.0-S002195172500315X-gr5_lrg.jpg?httpAccept=%2A%2F%2A",
            "@multimediatype": "JPEG image file",
            "@type": "IMAGE-HIGH-RES",
            "@size": "578679",
            "@ref": "gr5",
            "@mimetype": "image/jpeg"
          },
          {
            "@category": "high",
            "@height": "1029",
            "@width": "2809",
            "@_fa": "true",
            "$": "https://api.elsevier.com/content/object/eid/1-s2.0-S002195172500315X-gr6_lrg.jpg?httpAccept=%2A%2F%2A",
            "@multimediatype": "JPEG image file",
            "@type": "IMAGE-HIGH-RES",
            "@size": "455464",
            "@ref": "gr6",
            "@mimetype": "image/jpeg"
          },
          {
            "@category": "high",
            "@height": "33",
            "@width": "66",
            "@_fa": "true",
            "$": "https://api.elsevier.com/content/object/eid/1-s2.0-S002195172500315X-fx1020_lrg.jpg?httpAccept=%2A%2F%2A",
            "@multimediatype": "JPEG image file",
            "@type": "IMAGE-HIGH-RES",
            "@size": "5544",
            "@ref": "fx1020",
            "@mimetype": "image/jpeg"
          },
          {
            "@category": "high",
            "@height": "49",
            "@width": "641",
            "@_fa": "true",
            "$": "https://api.elsevier.com/content/object/eid/1-s2.0-S002195172500315X-fx1021_lrg.jpg?httpAccept=%2A%2F%2A",
            "@multimediatype": "JPEG image file",
            "@type": "IMAGE-HIGH-RES",
            "@size": "16835",
            "@ref": "fx1021",
            "@mimetype": "image/jpeg"
          },
          {
            "@category": "high",
            "@height": "536",
            "@width": "1333",
            "@_fa": "true",
            "$": "https://api.elsevier.com/content/object/eid/1-s2.0-S002195172500315X-ga1_lrg.jpg?httpAccept=%2A%2F%2A",
            "@multimediatype": "JPEG image file",
            "@type": "IMAGE-HIGH-RES",
            "@size": "235671",
            "@ref": "ga1",
            "@mimetype": "image/jpeg"
          },
          {
            "@category": "high",
            "@height": "37",
            "@width": "51",
            "@_fa": "true",
            "$": "https://api.elsevier.com/content/object/eid/1-s2.0-S002195172500315X-fx1022_lrg.jpg?httpAccept=%2A%2F%2A",
            "@multimediatype": "JPEG image file",
            "@type": "IMAGE-HIGH-RES",
            "@size": "5574",
            "@ref": "fx1022",
            "@mimetype": "image/jpeg"
          },
          {
            "@category": "high",
            "@height": "33",
            "@width": "66",
            "@_fa": "true",
            "$": "https://api.elsevier.com/content/object/eid/1-s2.0-S002195172500315X-fx1001_lrg.jpg?httpAccept=%2A%2F%2A",
            "@multimediatype": "JPEG image file",
            "@type": "IMAGE-HIGH-RES",
            "@size": "5544",
            "@ref": "fx1001",
            "@mimetype": "image/jpeg"
          },
          {
            "@category": "high",
            "@height": "37",
            "@width": "51",
            "@_fa": "true",
            "$": "https://api.elsevier.com/content/object/eid/1-s2.0-S002195172500315X-fx1023_lrg.jpg?httpAccept=%2A%2F%2A",
            "@multimediatype": "JPEG image file",
            "@type": "IMAGE-HIGH-RES",
            "@size": "5557",
            "@ref": "fx1023",
            "@mimetype": "image/jpeg"
          },
          {
            "@category": "high",
            "@height": "43",
            "@width": "443",
            "@_fa": "true",
            "$": "https://api.elsevier.com/content/object/eid/1-s2.0-S002195172500315X-fx1002_lrg.jpg?httpAccept=%2A%2F%2A",
            "@multimediatype": "JPEG image file",
            "@type": "IMAGE-HIGH-RES",
            "@size": "13070",
            "@ref": "fx1002",
            "@mimetype": "image/jpeg"
          },
          {
            "@category": "high",
            "@height": "22",
            "@width": "123",
            "@_fa": "true",
            "$": "https://api.elsevier.com/content/object/eid/1-s2.0-S002195172500315X-fx1024_lrg.jpg?httpAccept=%2A%2F%2A",
            "@multimediatype": "JPEG image file",
            "@type": "IMAGE-HIGH-RES",
            "@size": "6284",
            "@ref": "fx1024",
            "@mimetype": "image/jpeg"
          },
          {
            "@category": "high",
            "@height": "37",
            "@width": "51",
            "@_fa": "true",
            "$": "https://api.elsevier.com/content/object/eid/1-s2.0-S002195172500315X-fx1003_lrg.jpg?httpAccept=%2A%2F%2A",
            "@multimediatype": "JPEG image file",
            "@type": "IMAGE-HIGH-RES",
            "@size": "5574",
            "@ref": "fx1003",
            "@mimetype": "image/jpeg"
          },
          {
            "@category": "high",
            "@height": "22",
            "@width": "98",
            "@_fa": "true",
            "$": "https://api.elsevier.com/content/object/eid/1-s2.0-S002195172500315X-fx1025_lrg.jpg?httpAccept=%2A%2F%2A",
            "@multimediatype": "JPEG image file",
            "@type": "IMAGE-HIGH-RES",
            "@size": "5835",
            "@ref": "fx1025",
            "@mimetype": "image/jpeg"
          },
          {
            "@category": "high",
            "@height": "37",
            "@width": "417",
            "@_fa": "true",
            "$": "https://api.elsevier.com/content/object/eid/1-s2.0-S002195172500315X-fx1004_lrg.jpg?httpAccept=%2A%2F%2A",
            "@multimediatype": "JPEG image file",
            "@type": "IMAGE-HIGH-RES",
            "@size": "11252",
            "@ref": "fx1004",
            "@mimetype": "image/jpeg"
          },
          {
            "@category": "high",
            "@height": "33",
            "@width": "66",
            "@_fa": "true",
            "$": "https://api.elsevier.com/content/object/eid/1-s2.0-S002195172500315X-fx1026_lrg.jpg?httpAccept=%2A%2F%2A",
            "@multimediatype": "JPEG image file",
            "@type": "IMAGE-HIGH-RES",
            "@size": "5544",
            "@ref": "fx1026",
            "@mimetype": "image/jpeg"
          },
          {
            "@category": "high",
            "@height": "31",
            "@width": "37",
            "@_fa": "true",
            "$": "https://api.elsevier.com/content/object/eid/1-s2.0-S002195172500315X-fx1005_lrg.jpg?httpAccept=%2A%2F%2A",
            "@multimediatype": "JPEG image file",
            "@type": "IMAGE-HIGH-RES",
            "@size": "5029",
            "@ref": "fx1005",
            "@mimetype": "image/jpeg"
          },
          {
            "@category": "high",
            "@height": "33",
            "@width": "66",
            "@_fa": "true",
            "$": "https://api.elsevier.com/content/object/eid/1-s2.0-S002195172500315X-fx1027_lrg.jpg?httpAccept=%2A%2F%2A",
            "@multimediatype": "JPEG image file",
            "@type": "IMAGE-HIGH-RES",
            "@size": "5544",
            "@ref": "fx1027",
            "@mimetype": "image/jpeg"
          },
          {
            "@category": "high",
            "@height": "37",
            "@width": "111",
            "@_fa": "true",
            "$": "https://api.elsevier.com/content/object/eid/1-s2.0-S002195172500315X-fx1006_lrg.jpg?httpAccept=%2A%2F%2A",
            "@multimediatype": "JPEG image file",
            "@type": "IMAGE-HIGH-RES",
            "@size": "6498",
            "@ref": "fx1006",
            "@mimetype": "image/jpeg"
          },
          {
            "@category": "high",
            "@height": "31",
            "@width": "55",
            "@_fa": "true",
            "$": "https://api.elsevier.com/content/object/eid/1-s2.0-S002195172500315X-fx1028_lrg.jpg?httpAccept=%2A%2F%2A",
            "@multimediatype": "JPEG image file",
            "@type": "IMAGE-HIGH-RES",
            "@size": "5176",
            "@ref": "fx1028",
            "@mimetype": "image/jpeg"
          },
          {
            "@category": "high",
            "@height": "33",
            "@width": "66",
            "@_fa": "true",
            "$": "https://api.elsevier.com/content/object/eid/1-s2.0-S002195172500315X-fx1007_lrg.jpg?httpAccept=%2A%2F%2A",
            "@multimediatype": "JPEG image file",
            "@type": "IMAGE-HIGH-RES",
            "@size": "5544",
            "@ref": "fx1007",
            "@mimetype": "image/jpeg"
          },
          {
            "@category": "high",
            "@height": "37",
            "@width": "570",
            "@_fa": "true",
            "$": "https://api.elsevier.com/content/object/eid/1-s2.0-S002195172500315X-fx1008_lrg.jpg?httpAccept=%2A%2F%2A",
            "@multimediatype": "JPEG image file",
            "@type": "IMAGE-HIGH-RES",
            "@size": "13733",
            "@ref": "fx1008",
            "@mimetype": "image/jpeg"
          },
          {
            "@category": "high",
            "@height": "33",
            "@width": "66",
            "@_fa": "true",
            "$": "https://api.elsevier.com/content/object/eid/1-s2.0-S002195172500315X-fx1009_lrg.jpg?httpAccept=%2A%2F%2A",
            "@multimediatype": "JPEG image file",
            "@type": "IMAGE-HIGH-RES",
            "@size": "5544",
            "@ref": "fx1009",
            "@mimetype": "image/jpeg"
          },
          {
            "@category": "high",
            "@height": "33",
            "@width": "66",
            "@_fa": "true",
            "$": "https://api.elsevier.com/content/object/eid/1-s2.0-S002195172500315X-fx1010_lrg.jpg?httpAccept=%2A%2F%2A",
            "@multimediatype": "JPEG image file",
            "@type": "IMAGE-HIGH-RES",
            "@size": "5544",
            "@ref": "fx1010",
            "@mimetype": "image/jpeg"
          },
          {
            "@category": "high",
            "@height": "31",
            "@width": "37",
            "@_fa": "true",
            "$": "https://api.elsevier.com/content/object/eid/1-s2.0-S002195172500315X-fx1011_lrg.jpg?httpAccept=%2A%2F%2A",
            "@multimediatype": "JPEG image file",
            "@type": "IMAGE-HIGH-RES",
            "@size": "5029",
            "@ref": "fx1011",
            "@mimetype": "image/jpeg"
          },
          {
            "@category": "high",
            "@height": "33",
            "@width": "66",
            "@_fa": "true",
            "$": "https://api.elsevier.com/content/object/eid/1-s2.0-S002195172500315X-fx1012_lrg.jpg?httpAccept=%2A%2F%2A",
            "@multimediatype": "JPEG image file",
            "@type": "IMAGE-HIGH-RES",
            "@size": "5544",
            "@ref": "fx1012",
            "@mimetype": "image/jpeg"
          },
          {
            "@category": "high",
            "@height": "31",
            "@width": "37",
            "@_fa": "true",
            "$": "https://api.elsevier.com/content/object/eid/1-s2.0-S002195172500315X-fx1013_lrg.jpg?httpAccept=%2A%2F%2A",
            "@multimediatype": "JPEG image file",
            "@type": "IMAGE-HIGH-RES",
            "@size": "5029",
            "@ref": "fx1013",
            "@mimetype": "image/jpeg"
          },
          {
            "@category": "high",
            "@height": "2448",
            "@width": "2533",
            "@_fa": "true",
            "$": "https://api.elsevier.com/content/object/eid/1-s2.0-S002195172500315X-gr10_lrg.jpg?httpAccept=%2A%2F%2A",
            "@multimediatype": "JPEG image file",
            "@type": "IMAGE-HIGH-RES",
            "@size": "699559",
            "@ref": "gr10",
            "@mimetype": "image/jpeg"
          },
          {
            "@category": "high",
            "@height": "31",
            "@width": "37",
            "@_fa": "true",
            "$": "https://api.elsevier.com/content/object/eid/1-s2.0-S002195172500315X-fx1014_lrg.jpg?httpAccept=%2A%2F%2A",
            "@multimediatype": "JPEG image file",
            "@type": "IMAGE-HIGH-RES",
            "@size": "5029",
            "@ref": "fx1014",
            "@mimetype": "image/jpeg"
          },
          {
            "@category": "high",
            "@height": "33",
            "@width": "66",
            "@_fa": "true",
            "$": "https://api.elsevier.com/content/object/eid/1-s2.0-S002195172500315X-fx1015_lrg.jpg?httpAccept=%2A%2F%2A",
            "@multimediatype": "JPEG image file",
            "@type": "IMAGE-HIGH-RES",
            "@size": "5544",
            "@ref": "fx1015",
            "@mimetype": "image/jpeg"
          },
          {
            "@category": "high",
            "@height": "33",
            "@width": "66",
            "@_fa": "true",
            "$": "https://api.elsevier.com/content/object/eid/1-s2.0-S002195172500315X-fx1016_lrg.jpg?httpAccept=%2A%2F%2A",
            "@multimediatype": "JPEG image file",
            "@type": "IMAGE-HIGH-RES",
            "@size": "5544",
            "@ref": "fx1016",
            "@mimetype": "image/jpeg"
          },
          {
            "@category": "high",
            "@height": "33",
            "@width": "66",
            "@_fa": "true",
            "$": "https://api.elsevier.com/content/object/eid/1-s2.0-S002195172500315X-fx1017_lrg.jpg?httpAccept=%2A%2F%2A",
            "@multimediatype": "JPEG image file",
            "@type": "IMAGE-HIGH-RES",
            "@size": "5544",
            "@ref": "fx1017",
            "@mimetype": "image/jpeg"
          },
          {
            "@category": "high",
            "@height": "33",
            "@width": "66",
            "@_fa": "true",
            "$": "https://api.elsevier.com/content/object/eid/1-s2.0-S002195172500315X-fx1018_lrg.jpg?httpAccept=%2A%2F%2A",
            "@multimediatype": "JPEG image file",
            "@type": "IMAGE-HIGH-RES",
            "@size": "5544",
            "@ref": "fx1018",
            "@mimetype": "image/jpeg"
          },
          {
            "@category": "high",
            "@height": "31",
            "@width": "37",
            "@_fa": "true",
            "$": "https://api.elsevier.com/content/object/eid/1-s2.0-S002195172500315X-fx1019_lrg.jpg?httpAccept=%2A%2F%2A",
            "@multimediatype": "JPEG image file",
            "@type": "IMAGE-HIGH-RES",
            "@size": "5029",
            "@ref": "fx1019",
            "@mimetype": "image/jpeg"
          },
          {
            "@category": "standard",
            "@_fa": "true",
            "$": "https://api.elsevier.com/content/object/eid/1-s2.0-S002195172500315X-mmc1.pdf?httpAccept=%2A%2F%2A",
            "@multimediatype": "Acrobat PDF file",
            "@type": "APPLICATION",
            "@size": "1356411",
            "@ref": "mmc1",
            "@mimetype": "application/pdf"
          },
          {
            "@category": "thumbnail",
            "@_fa": "true",
            "$": "https://api.elsevier.com/content/object/eid/1-s2.0-S002195172500315X-si103.svg?httpAccept=%2A%2F%2A",
            "@multimediatype": "Scalable Vector Graphics file",
            "@type": "ALTIMG",
            "@size": "2280",
            "@ref": "si103",
            "@mimetype": "image/svg+xml"
          },
          {
            "@category": "thumbnail",
            "@_fa": "true",
            "$": "https://api.elsevier.com/content/object/eid/1-s2.0-S002195172500315X-si109.svg?httpAccept=%2A%2F%2A",
            "@multimediatype": "Scalable Vector Graphics file",
            "@type": "ALTIMG",
            "@size": "3144",
            "@ref": "si109",
            "@mimetype": "image/svg+xml"
          },
          {
            "@category": "thumbnail",
            "@_fa": "true",
            "$": "https://api.elsevier.com/content/object/eid/1-s2.0-S002195172500315X-si12.svg?httpAccept=%2A%2F%2A",
            "@multimediatype": "Scalable Vector Graphics file",
            "@type": "ALTIMG",
            "@size": "3315",
            "@ref": "si12",
            "@mimetype": "image/svg+xml"
          },
          {
            "@category": "thumbnail",
            "@_fa": "true",
            "$": "https://api.elsevier.com/content/object/eid/1-s2.0-S002195172500315X-si13.svg?httpAccept=%2A%2F%2A",
            "@multimediatype": "Scalable Vector Graphics file",
            "@type": "ALTIMG",
            "@size": "1550",
            "@ref": "si13",
            "@mimetype": "image/svg+xml"
          },
          {
            "@category": "thumbnail",
            "@_fa": "true",
            "$": "https://api.elsevier.com/content/object/eid/1-s2.0-S002195172500315X-si14.svg?httpAccept=%2A%2F%2A",
            "@multimediatype": "Scalable Vector Graphics file",
            "@type": "ALTIMG",
            "@size": "7271",
            "@ref": "si14",
            "@mimetype": "image/svg+xml"
          },
          {
            "@category": "thumbnail",
            "@_fa": "true",
            "$": "https://api.elsevier.com/content/object/eid/1-s2.0-S002195172500315X-si15.svg?httpAccept=%2A%2F%2A",
            "@multimediatype": "Scalable Vector Graphics file",
            "@type": "ALTIMG",
            "@size": "5291",
            "@ref": "si15",
            "@mimetype": "image/svg+xml"
          },
          {
            "@category": "thumbnail",
            "@_fa": "true",
            "$": "https://api.elsevier.com/content/object/eid/1-s2.0-S002195172500315X-si17.svg?httpAccept=%2A%2F%2A",
            "@multimediatype": "Scalable Vector Graphics file",
            "@type": "ALTIMG",
            "@size": "1258",
            "@ref": "si17",
            "@mimetype": "image/svg+xml"
          },
          {
            "@category": "thumbnail",
            "@_fa": "true",
            "$": "https://api.elsevier.com/content/object/eid/1-s2.0-S002195172500315X-si19.svg?httpAccept=%2A%2F%2A",
            "@multimediatype": "Scalable Vector Graphics file",
            "@type": "ALTIMG",
            "@size": "4524",
            "@ref": "si19",
            "@mimetype": "image/svg+xml"
          },
          {
            "@category": "thumbnail",
            "@_fa": "true",
            "$": "https://api.elsevier.com/content/object/eid/1-s2.0-S002195172500315X-si2.svg?httpAccept=%2A%2F%2A",
            "@multimediatype": "Scalable Vector Graphics file",
            "@type": "ALTIMG",
            "@size": "1424",
            "@ref": "si2",
            "@mimetype": "image/svg+xml"
          },
          {
            "@category": "thumbnail",
            "@_fa": "true",
            "$": "https://api.elsevier.com/content/object/eid/1-s2.0-S002195172500315X-si20.svg?httpAccept=%2A%2F%2A",
            "@multimediatype": "Scalable Vector Graphics file",
            "@type": "ALTIMG",
            "@size": "9308",
            "@ref": "si20",
            "@mimetype": "image/svg+xml"
          },
          {
            "@category": "thumbnail",
            "@_fa": "true",
            "$": "https://api.elsevier.com/content/object/eid/1-s2.0-S002195172500315X-si22.svg?httpAccept=%2A%2F%2A",
            "@multimediatype": "Scalable Vector Graphics file",
            "@type": "ALTIMG",
            "@size": "3502",
            "@ref": "si22",
            "@mimetype": "image/svg+xml"
          },
          {
            "@category": "thumbnail",
            "@_fa": "true",
            "$": "https://api.elsevier.com/content/object/eid/1-s2.0-S002195172500315X-si23.svg?httpAccept=%2A%2F%2A",
            "@multimediatype": "Scalable Vector Graphics file",
            "@type": "ALTIMG",
            "@size": "3359",
            "@ref": "si23",
            "@mimetype": "image/svg+xml"
          },
          {
            "@category": "thumbnail",
            "@_fa": "true",
            "$": "https://api.elsevier.com/content/object/eid/1-s2.0-S002195172500315X-si24.svg?httpAccept=%2A%2F%2A",
            "@multimediatype": "Scalable Vector Graphics file",
            "@type": "ALTIMG",
            "@size": "1389",
            "@ref": "si24",
            "@mimetype": "image/svg+xml"
          },
          {
            "@category": "thumbnail",
            "@_fa": "true",
            "$": "https://api.elsevier.com/content/object/eid/1-s2.0-S002195172500315X-si25.svg?httpAccept=%2A%2F%2A",
            "@multimediatype": "Scalable Vector Graphics file",
            "@type": "ALTIMG",
            "@size": "702",
            "@ref": "si25",
            "@mimetype": "image/svg+xml"
          },
          {
            "@category": "thumbnail",
            "@_fa": "true",
            "$": "https://api.elsevier.com/content/object/eid/1-s2.0-S002195172500315X-si26.svg?httpAccept=%2A%2F%2A",
            "@multimediatype": "Scalable Vector Graphics file",
            "@type": "ALTIMG",
            "@size": "4240",
            "@ref": "si26",
            "@mimetype": "image/svg+xml"
          },
          {
            "@category": "thumbnail",
            "@_fa": "true",
            "$": "https://api.elsevier.com/content/object/eid/1-s2.0-S002195172500315X-si27.svg?httpAccept=%2A%2F%2A",
            "@multimediatype": "Scalable Vector Graphics file",
            "@type": "ALTIMG",
            "@size": "1456",
            "@ref": "si27",
            "@mimetype": "image/svg+xml"
          },
          {
            "@category": "thumbnail",
            "@_fa": "true",
            "$": "https://api.elsevier.com/content/object/eid/1-s2.0-S002195172500315X-si28.svg?httpAccept=%2A%2F%2A",
            "@multimediatype": "Scalable Vector Graphics file",
            "@type": "ALTIMG",
            "@size": "1886",
            "@ref": "si28",
            "@mimetype": "image/svg+xml"
          },
          {
            "@category": "thumbnail",
            "@_fa": "true",
            "$": "https://api.elsevier.com/content/object/eid/1-s2.0-S002195172500315X-si3.svg?httpAccept=%2A%2F%2A",
            "@multimediatype": "Scalable Vector Graphics file",
            "@type": "ALTIMG",
            "@size": "9314",
            "@ref": "si3",
            "@mimetype": "image/svg+xml"
          },
          {
            "@category": "thumbnail",
            "@_fa": "true",
            "$": "https://api.elsevier.com/content/object/eid/1-s2.0-S002195172500315X-si34.svg?httpAccept=%2A%2F%2A",
            "@multimediatype": "Scalable Vector Graphics file",
            "@type": "ALTIMG",
            "@size": "3146",
            "@ref": "si34",
            "@mimetype": "image/svg+xml"
          },
          {
            "@category": "thumbnail",
            "@_fa": "true",
            "$": "https://api.elsevier.com/content/object/eid/1-s2.0-S002195172500315X-si4.svg?httpAccept=%2A%2F%2A",
            "@multimediatype": "Scalable Vector Graphics file",
            "@type": "ALTIMG",
            "@size": "13002",
            "@ref": "si4",
            "@mimetype": "image/svg+xml"
          },
          {
            "@category": "thumbnail",
            "@_fa": "true",
            "$": "https://api.elsevier.com/content/object/eid/1-s2.0-S002195172500315X-si49.svg?httpAccept=%2A%2F%2A",
            "@multimediatype": "Scalable Vector Graphics file",
            "@type": "ALTIMG",
            "@size": "4372",
            "@ref": "si49",
            "@mimetype": "image/svg+xml"
          },
          {
            "@category": "thumbnail",
            "@_fa": "true",
            "$": "https://api.elsevier.com/content/object/eid/1-s2.0-S002195172500315X-si5.svg?httpAccept=%2A%2F%2A",
            "@multimediatype": "Scalable Vector Graphics file",
            "@type": "ALTIMG",
            "@size": "15202",
            "@ref": "si5",
            "@mimetype": "image/svg+xml"
          },
          {
            "@category": "thumbnail",
            "@_fa": "true",
            "$": "https://api.elsevier.com/content/object/eid/1-s2.0-S002195172500315X-si51.svg?httpAccept=%2A%2F%2A",
            "@multimediatype": "Scalable Vector Graphics file",
            "@type": "ALTIMG",
            "@size": "8198",
            "@ref": "si51",
            "@mimetype": "image/svg+xml"
          },
          {
            "@category": "thumbnail",
            "@_fa": "true",
            "$": "https://api.elsevier.com/content/object/eid/1-s2.0-S002195172500315X-si53.svg?httpAccept=%2A%2F%2A",
            "@multimediatype": "Scalable Vector Graphics file",
            "@type": "ALTIMG",
            "@size": "43684",
            "@ref": "si53",
            "@mimetype": "image/svg+xml"
          },
          {
            "@category": "thumbnail",
            "@_fa": "true",
            "$": "https://api.elsevier.com/content/object/eid/1-s2.0-S002195172500315X-si54.svg?httpAccept=%2A%2F%2A",
            "@multimediatype": "Scalable Vector Graphics file",
            "@type": "ALTIMG",
            "@size": "6306",
            "@ref": "si54",
            "@mimetype": "image/svg+xml"
          },
          {
            "@category": "thumbnail",
            "@_fa": "true",
            "$": "https://api.elsevier.com/content/object/eid/1-s2.0-S002195172500315X-si55.svg?httpAccept=%2A%2F%2A",
            "@multimediatype": "Scalable Vector Graphics file",
            "@type": "ALTIMG",
            "@size": "5966",
            "@ref": "si55",
            "@mimetype": "image/svg+xml"
          },
          {
            "@category": "thumbnail",
            "@_fa": "true",
            "$": "https://api.elsevier.com/content/object/eid/1-s2.0-S002195172500315X-si56.svg?httpAccept=%2A%2F%2A",
            "@multimediatype": "Scalable Vector Graphics file",
            "@type": "ALTIMG",
            "@size": "1296",
            "@ref": "si56",
            "@mimetype": "image/svg+xml"
          },
          {
            "@category": "thumbnail",
            "@_fa": "true",
            "$": "https://api.elsevier.com/content/object/eid/1-s2.0-S002195172500315X-si6.svg?httpAccept=%2A%2F%2A",
            "@multimediatype": "Scalable Vector Graphics file",
            "@type": "ALTIMG",
            "@size": "12978",
            "@ref": "si6",
            "@mimetype": "image/svg+xml"
          },
          {
            "@category": "thumbnail",
            "@_fa": "true",
            "$": "https://api.elsevier.com/content/object/eid/1-s2.0-S002195172500315X-si66.svg?httpAccept=%2A%2F%2A",
            "@multimediatype": "Scalable Vector Graphics file",
            "@type": "ALTIMG",
            "@size": "6270",
            "@ref": "si66",
            "@mimetype": "image/svg+xml"
          },
          {
            "@category": "thumbnail",
            "@_fa": "true",
            "$": "https://api.elsevier.com/content/object/eid/1-s2.0-S002195172500315X-si68.svg?httpAccept=%2A%2F%2A",
            "@multimediatype": "Scalable Vector Graphics file",
            "@type": "ALTIMG",
            "@size": "2351",
            "@ref": "si68",
            "@mimetype": "image/svg+xml"
          },
          {
            "@category": "thumbnail",
            "@_fa": "true",
            "$": "https://api.elsevier.com/content/object/eid/1-s2.0-S002195172500315X-si7.svg?httpAccept=%2A%2F%2A",
            "@multimediatype": "Scalable Vector Graphics file",
            "@type": "ALTIMG",
            "@size": "767",
            "@ref": "si7",
            "@mimetype": "image/svg+xml"
          },
          {
            "@category": "thumbnail",
            "@_fa": "true",
            "$": "https://api.elsevier.com/content/object/eid/1-s2.0-S002195172500315X-si71.svg?httpAccept=%2A%2F%2A",
            "@multimediatype": "Scalable Vector Graphics file",
            "@type": "ALTIMG",
            "@size": "1685",
            "@ref": "si71",
            "@mimetype": "image/svg+xml"
          },
          {
            "@category": "thumbnail",
            "@_fa": "true",
            "$": "https://api.elsevier.com/content/object/eid/1-s2.0-S002195172500315X-si8.svg?httpAccept=%2A%2F%2A",
            "@multimediatype": "Scalable Vector Graphics file",
            "@type": "ALTIMG",
            "@size": "763",
            "@ref": "si8",
            "@mimetype": "image/svg+xml"
          },
          {
            "@category": "thumbnail",
            "@_fa": "true",
            "$": "https://api.elsevier.com/content/object/eid/1-s2.0-S002195172500315X-si87.svg?httpAccept=%2A%2F%2A",
            "@multimediatype": "Scalable Vector Graphics file",
            "@type": "ALTIMG",
            "@size": "3137",
            "@ref": "si87",
            "@mimetype": "image/svg+xml"
          },
          {
            "@category": "thumbnail",
            "@_fa": "true",
            "$": "https://api.elsevier.com/content/object/eid/1-s2.0-S002195172500315X-si89.svg?httpAccept=%2A%2F%2A",
            "@multimediatype": "Scalable Vector Graphics file",
            "@type": "ALTIMG",
            "@size": "3171",
            "@ref": "si89",
            "@mimetype": "image/svg+xml"
          },
          {
            "@category": "thumbnail",
            "@_fa": "true",
            "$": "https://api.elsevier.com/content/object/eid/1-s2.0-S002195172500315X-si9.svg?httpAccept=%2A%2F%2A",
            "@multimediatype": "Scalable Vector Graphics file",
            "@type": "ALTIMG",
            "@size": "752",
            "@ref": "si9",
            "@mimetype": "image/svg+xml"
          }
        ]
      },
      "link": {
        "@rel": "abstract",
        "@href": "https://api.elsevier.com/content/abstract/scopus_id/105009999644"
      }
    }
  }
}