{
  "metadata": {
    "title": "Crystal defects Boost cellulose conversion to C<ce:inf loc=post>2</ce:inf> alcohols over Pd/WO<ce:inf loc=post>3</ce:inf> catalysts",
    "authors": "; ; ",
    "journal": "Journal of Catalysis",
    "date": "2025-02-28",
    "doi": "10.1016/j.jcat.2024.115860",
    "abstract": "",
    "uri": "https://api.elsevier.com/content/article/pii/S0021951724005736",
    "pii": "S0021951724005736"
  },
  "fulltext": {
    "full-text-retrieval-response": {
      "scopus-eid": "2-s2.0-85210054864",
      "originalText": "serial JL 272561 291210 291744 291809 31 Journal of Catalysis JOURNALCATALYSIS 2024-11-26 2024-11-26 2024-11-28 2024-11-28 2025-01-10T20:44:47 1-s2.0-S0021951724005736 S0021-9517(24)00573-6 S0021951724005736 10.1016/j.jcat.2024.115860 S300 S300.1 FULL-TEXT 1-s2.0-S0021951724X00147 2025-01-10T21:03:22.325727Z 0 0 20250201 20250228 2025 2024-11-26T08:09:47.580654Z absattachment articleinfo articlenumber articletitlenorm authfirstinitialnorm authfirstsurnamenorm cid cids contenttype copyright crossmark dateloaded dateloadedtxt datesearch datesort dateupdated dco docsubtype doctype doi eid ewtransactionid hubeid indexeddate issn issnnorm itemstage itemtransactionid itemweight openaccess openarchive pg pgfirst pii piinorm pubdateend pubdatestart pubdatetxt pubyr sectiontitle sortorder srctitle srctitlenorm srctype ssids alllist content subj subheadings suppl tomb volfirst volissue volumelist webpdf webpdfpagecount yearnav figure table e-component body mmlmath acknowledge affil appendices articletitle auth authfirstini authfull authkeywords authlast grantnumber grantsponsor grantsponsorid highlightsabst orcid primabst pubtype ref specialabst 0021-9517 00219517 true 442 442 C Volume 442 5 115860 115860 115860 202502 February 2025 2025-02-01 2025-02-28 2025 Regular Articles article fla © 2024 Elsevier Inc. All rights are reserved, including those for text and data mining, AI training, and similar technologies. CRYSTALDEFECTSBOOSTCELLULOSECONVERSIONC2ALCOHOLSOVERPDWO3CATALYSTS JIA W 1 Introduction 2 Experimental section 2.1 Materials and catalyst preparation 2.2 Activity Measurements 2.3 Catalysis characterizations 2.4 Density functional theory (DFT) calculations 3 Result and discussion 3.1 One-pot conversion of cellulose to EG 3.1.1 Evaluation of catalytic performance 3.1.2 Optimization of reaction conditions 3.2 Catalyst characterization 3.2.1 Structural properties 3.2.2 Chemical states 3.3 Influence of the Structural changes 3.4 Identification of reaction mechanism and pathway 4 Conclusion CRediT authorship contribution statement Acknowledgements Appendix A Supplementary material References MIKA 2017 505 613 L CHHEDA 2007 7298 7318 J SHROTRI 2018 761 768 A CHO 2023 100238 E WEI 2017 760 766 W KLEMM 2005 3422 3458 D LI 2017 682 691 N YANG 2019 1937 1948 M YANG 2023 139206 Y GUO 2023 4235 M WANG 2020 10646 10660 H FAN 2023 585 595 L LI 2019 2234 2239 C FUKUOKA 2006 5161 5163 A MANKAR 2021 A RIBEIRO 2017 244 251 L JI 2008 8510 8513 N ZHENG 2010 63 66 M ZHAO 2010 928 932 G RIBEIRO 2018 402 409 L RIBEIRO 2019 7337 7353 L RIBEIRO 2022 1008 1022 L GAO 2023 M HUANG 2022 8195 8211 H XIAO 2018 3757 3770 Z LIANG 2014 468 476 G CHAI 2017 8567 8574 J LIU 2012 3249 3253 Y CAO 2014 46 53 Y WU 2024 Q SONG 2019 4303 4306 H LIU 2023 56 63 Y BERGMANN 2019 10020 10043 A LIAO 2023 5767 5779 W CAI 2020 13275 13289 Z WANG 2022 14976 14989 Z ZHANG 2016 9684 9691 J ALI 2021 W PORWAL 2019 17126 17136 G LEAL 2016 87756 87766 G LI 2024 3773 3782 H CHU 2021 D VERMA 2021 P LIU 2023 Z WATTANAPAPHAWONG 2017 18561 18568 P WANG 2011 4179 4183 P REKHA 2020 4508 4518 B SHI 2023 122927 Y NUNES 2021 2100196 D NAGY 2016 95369 95377 D LI 2022 1873 1888 H KONG 2022 2204106 H YE 2019 1900282 Y SHEN 2022 12658 12669 C YI 2023 228 P MODAK 2022 15875 15888 A MODAK 2023 10832 10846 A HU 2021 105737 Y FAN 2023 2301178 X ZHANG 2020 2003192 W XUE 2017 2351 2357 N WU 2023 141779 Y ZHAO 2017 191 201 X YANG 2022 W YU 2021 12027 12031 H YANG 2023 127560 X TIAN 2023 2303061 H ENJAMURI 2022 1 71 N LIU 2022 Y JIAX2025X115860 JIAX2025X115860XW 2026-11-28T00:00:00.000Z 2026-11-28T00:00:00.000Z http://creativecommons.org/licenses/by-nc-nd/4.0/ © 2024 Elsevier Inc. All rights are reserved, including those for text and data mining, AI training, and similar technologies. 2024-11-29T01:14:59.320Z http://vtw.elsevier.com/data/voc/AddOnTypes/50.7/aggregated-refined http://sws.geonames.org/1814991 State Key Laboratory of Bio-Fibers and Eco-Textiles in Qingdao University G2RC202021 National Natural Science Foundation of China 22478209 52303058 NSFC National Natural Science Foundation of China http://data.elsevier.com/vocabulary/SciValFunders/501100001809 http://sws.geonames.org/1814991 Shandong Provincial Colleges and Universities Youth Innovation Technology Support Program 2023KJ356 Youth Innovation Technology Project of Higher School in Shandong Province http://data.elsevier.com/vocabulary/SciValFunders/100016697 http://sws.geonames.org/1814991/ Natural Science Foundation of Shandong Province ZR2024YQ018 ZR2021YQ09 Natural Science Foundation of Shandong Province http://data.elsevier.com/vocabulary/SciValFunders/501100007129 http://sws.geonames.org/1814991/ The authors gratefully acknowledge the National Natural Science Foundation of China (No. 22478209 , 52303058 ), Natural Science Foundation of Shandong Province (No. ZR2021YQ09 ), Shandong Provincial Colleges and Universities Youth Innovation Technology Support Program (No. 2023KJ356 ), and State Key Laboratory of Bio-Fibers and Eco-Textiles in Qingdao University (No. G2RC202021 ) for support. The authors gratefully acknowledge the National Natural Science Foundation of China (No. 22478209, 52303058), Natural Science Foundation of Shandong Province (No. ZR2021YQ09, ZR2024YQ018), Shandong Provincial Colleges and Universities Youth Innovation Technology Support Program (No. 2023KJ356), and State Key Laboratory of Bio-Fibers and Eco-Textiles in Qingdao University (No. G2RC202021) for support. https://doi.org/10.15223/policy-017 https://doi.org/10.15223/policy-037 https://doi.org/10.15223/policy-012 https://doi.org/10.15223/policy-029 https://doi.org/10.15223/policy-004 item S0021-9517(24)00573-6 S0021951724005736 1-s2.0-S0021951724005736 10.1016/j.jcat.2024.115860 272561 2025-01-10T21:03:22.325727Z 2025-02-01 2025-02-28 1-s2.0-S0021951724005736-main.pdf https://s3-eu-west-1.amazonaws.com/prod-ucs-content-store-eu-west/content/pii:S0021951724005736/MAIN/application/pdf/e65dfc7fa62e06bdf9930fd4312e2fab/main.pdf main.pdf pdf true 8418384 MAIN 12 1-s2.0-S0021951724005736-main_1.png https://s3-eu-west-1.amazonaws.com/prod-ucs-content-store-eu-west/content/pii:S0021951724005736/PREVIEW/image/png/c5c8cc35e9696b5b6f3911a8277ac1b1/main_1.png main_1.png png 57509 849 656 IMAGE-WEB-PDF 1 1-s2.0-S0021951724005736-gr4.jpg https://s3-eu-west-1.amazonaws.com/prod-ucs-content-store-eu-west/content/pii:S0021951724005736/gr4/DOWNSAMPLED/image/jpeg/cd76771146ee858d448feb6f2f67af71/gr4.jpg gr4 gr4.jpg jpg 182365 676 711 IMAGE-DOWNSAMPLED 1-s2.0-S0021951724005736-gr5.jpg https://s3-eu-west-1.amazonaws.com/prod-ucs-content-store-eu-west/content/pii:S0021951724005736/gr5/DOWNSAMPLED/image/jpeg/592f995637e9f1494f132f7613fc3938/gr5.jpg gr5 gr5.jpg jpg 72038 499 667 IMAGE-DOWNSAMPLED 1-s2.0-S0021951724005736-gr2.jpg https://s3-eu-west-1.amazonaws.com/prod-ucs-content-store-eu-west/content/pii:S0021951724005736/gr2/DOWNSAMPLED/image/jpeg/fc34ef243393241b84e3c0335c84ca7c/gr2.jpg gr2 gr2.jpg jpg 127327 725 533 IMAGE-DOWNSAMPLED 1-s2.0-S0021951724005736-ga1.jpg https://s3-eu-west-1.amazonaws.com/prod-ucs-content-store-eu-west/content/pii:S0021951724005736/ga1/DOWNSAMPLED/image/jpeg/666b347f22d8b1ebd6a06afd623bb238/ga1.jpg ga1 true ga1.jpg jpg 27062 200 400 IMAGE-DOWNSAMPLED 1-s2.0-S0021951724005736-gr3.jpg https://s3-eu-west-1.amazonaws.com/prod-ucs-content-store-eu-west/content/pii:S0021951724005736/gr3/DOWNSAMPLED/image/jpeg/d53833b57a4f603533e78d286efa4769/gr3.jpg gr3 gr3.jpg jpg 74954 371 711 IMAGE-DOWNSAMPLED 1-s2.0-S0021951724005736-gr6.jpg https://s3-eu-west-1.amazonaws.com/prod-ucs-content-store-eu-west/content/pii:S0021951724005736/gr6/DOWNSAMPLED/image/jpeg/373d848cec217195071bb4e18f07c1b8/gr6.jpg gr6 gr6.jpg jpg 86709 428 778 IMAGE-DOWNSAMPLED 1-s2.0-S0021951724005736-gr7.jpg https://s3-eu-west-1.amazonaws.com/prod-ucs-content-store-eu-west/content/pii:S0021951724005736/gr7/DOWNSAMPLED/image/jpeg/a2b8cd4b515e278c3dc954a2770286ab/gr7.jpg gr7 gr7.jpg jpg 73861 648 667 IMAGE-DOWNSAMPLED 1-s2.0-S0021951724005736-gr1.jpg https://s3-eu-west-1.amazonaws.com/prod-ucs-content-store-eu-west/content/pii:S0021951724005736/gr1/DOWNSAMPLED/image/jpeg/7eb9337cf1be5a4229cc77aebe8992c6/gr1.jpg gr1 gr1.jpg jpg 26733 191 533 IMAGE-DOWNSAMPLED 1-s2.0-S0021951724005736-gr4.sml https://s3-eu-west-1.amazonaws.com/prod-ucs-content-store-eu-west/content/pii:S0021951724005736/gr4/THUMBNAIL/image/gif/36de2d7ada02c301aeb492034cf1fa15/gr4.sml gr4 gr4.sml sml 17723 163 172 IMAGE-THUMBNAIL 1-s2.0-S0021951724005736-gr5.sml https://s3-eu-west-1.amazonaws.com/prod-ucs-content-store-eu-west/content/pii:S0021951724005736/gr5/THUMBNAIL/image/gif/127c11a85642849ee7c8bae06fde0e93/gr5.sml gr5 gr5.sml sml 10941 164 219 IMAGE-THUMBNAIL 1-s2.0-S0021951724005736-gr2.sml https://s3-eu-west-1.amazonaws.com/prod-ucs-content-store-eu-west/content/pii:S0021951724005736/gr2/THUMBNAIL/image/gif/98d907749d89c79befb287c41b5990f3/gr2.sml gr2 gr2.sml sml 15450 163 120 IMAGE-THUMBNAIL 1-s2.0-S0021951724005736-ga1.sml https://s3-eu-west-1.amazonaws.com/prod-ucs-content-store-eu-west/content/pii:S0021951724005736/ga1/THUMBNAIL/image/gif/2c5cb90a9dd00d00b33861bb32bd6dcf/ga1.sml ga1 true ga1.sml sml 15820 110 219 IMAGE-THUMBNAIL 1-s2.0-S0021951724005736-gr3.sml https://s3-eu-west-1.amazonaws.com/prod-ucs-content-store-eu-west/content/pii:S0021951724005736/gr3/THUMBNAIL/image/gif/558db263a1260a2c84d5094aea4e3746/gr3.sml gr3 gr3.sml sml 10279 114 219 IMAGE-THUMBNAIL 1-s2.0-S0021951724005736-gr6.sml https://s3-eu-west-1.amazonaws.com/prod-ucs-content-store-eu-west/content/pii:S0021951724005736/gr6/THUMBNAIL/image/gif/f0964561ab27011f6605049d07f2bcc8/gr6.sml gr6 gr6.sml sml 10613 120 219 IMAGE-THUMBNAIL 1-s2.0-S0021951724005736-gr7.sml https://s3-eu-west-1.amazonaws.com/prod-ucs-content-store-eu-west/content/pii:S0021951724006031/gr7/THUMBNAIL/image/gif/3c6faf34807a7a9105e49bc68d5edf6e/gr7.sml gr7 gr7.sml sml 7967 164 169 IMAGE-THUMBNAIL 1-s2.0-S0021951724005736-gr1.sml https://s3-eu-west-1.amazonaws.com/prod-ucs-content-store-eu-west/content/pii:S0021951724006031/gr1/THUMBNAIL/image/gif/3b504dc055b97c0c7013db09e933f428/gr1.sml gr1 gr1.sml sml 6156 79 219 IMAGE-THUMBNAIL 1-s2.0-S0021951724005736-gr4_lrg.jpg https://s3-eu-west-1.amazonaws.com/prod-ucs-content-store-eu-west/content/pii:S0021951724005736/HIGHRES/image/jpeg/439783be6e1d04e4eff5f024a46bec92/gr4_lrg.jpg gr4 gr4_lrg.jpg jpg 1374693 2993 3150 IMAGE-HIGH-RES 1-s2.0-S0021951724005736-gr5_lrg.jpg https://s3-eu-west-1.amazonaws.com/prod-ucs-content-store-eu-west/content/pii:S0021951724005736/HIGHRES/image/jpeg/71ab46317475a43de8f2778ec52560e9/gr5_lrg.jpg gr5 gr5_lrg.jpg jpg 366506 2208 2953 IMAGE-HIGH-RES 1-s2.0-S0021951724005736-gr2_lrg.jpg https://s3-eu-west-1.amazonaws.com/prod-ucs-content-store-eu-west/content/pii:S0021951724005736/HIGHRES/image/jpeg/e8e3eefe33641c17c88f7554bc901316/gr2_lrg.jpg gr2 gr2_lrg.jpg jpg 833444 3212 2362 IMAGE-HIGH-RES 1-s2.0-S0021951724005736-ga1_lrg.jpg https://s3-eu-west-1.amazonaws.com/prod-ucs-content-store-eu-west/content/pii:S0021951724005736/HIGHRES/image/jpeg/49447e90aae79dc61e98e6ff155cc930/ga1_lrg.jpg ga1 true ga1_lrg.jpg jpg 145630 886 1772 IMAGE-HIGH-RES 1-s2.0-S0021951724005736-gr3_lrg.jpg https://s3-eu-west-1.amazonaws.com/prod-ucs-content-store-eu-west/content/pii:S0021951724005736/HIGHRES/image/jpeg/15d7a179936185ac25060a22370032b9/gr3_lrg.jpg gr3 gr3_lrg.jpg jpg 427048 1642 3150 IMAGE-HIGH-RES 1-s2.0-S0021951724005736-gr6_lrg.jpg https://s3-eu-west-1.amazonaws.com/prod-ucs-content-store-eu-west/content/pii:S0021951724006031/HIGHRES/image/jpeg/8a31d6525fdbd7119d40b7aac008f661/gr6_lrg.jpg gr6 gr6_lrg.jpg jpg 477723 1893 3445 IMAGE-HIGH-RES 1-s2.0-S0021951724005736-gr7_lrg.jpg https://s3-eu-west-1.amazonaws.com/prod-ucs-content-store-eu-west/content/pii:S0021951724006031/HIGHRES/image/jpeg/2a24c465ccf7c30fc7ba1939be5bb558/gr7_lrg.jpg gr7 gr7_lrg.jpg jpg 365478 2867 2953 IMAGE-HIGH-RES 1-s2.0-S0021951724005736-gr1_lrg.jpg https://s3-eu-west-1.amazonaws.com/prod-ucs-content-store-eu-west/content/pii:S0021951724006031/HIGHRES/image/jpeg/90a7cb0f55f12364f99ab7355ebe5e94/gr1_lrg.jpg gr1 gr1_lrg.jpg jpg 134985 848 2362 IMAGE-HIGH-RES 1-s2.0-S0021951724005736-mmc1.docx https://s3-eu-west-1.amazonaws.com/prod-ucs-content-store-eu-west/content/pii:S0021951724005736/mmc1/MAIN/application/vnd.openxmlformats-officedocument.wordprocessingml.document/ec8603a770f620e2b224299120fd4b6b/mmc1.docx mmc1 mmc1.docx docx 2636621 APPLICATION 1-s2.0-S0021951724005736-si1.svg https://s3-eu-west-1.amazonaws.com/prod-ucs-content-store-eu-west/content/pii:S0021951724005736/image/svg+xml/cc96a442818569236121f1c397db350f/si1.svg si1 si1.svg svg 23921 ALTIMG 1-s2.0-S0021951724005736-si2.svg https://s3-eu-west-1.amazonaws.com/prod-ucs-content-store-eu-west/content/pii:S0021951724005736/image/svg+xml/5563e370416925d609944e06b2a02af1/si2.svg si2 si2.svg svg 31856 ALTIMG YJCAT 115860 115860 S0021-9517(24)00573-6 10.1016/j.jcat.2024.115860 Elsevier Inc. Fig. 1 Catalytic performance over (a) various x-WO3 and (b) Pd/x-WO3 catalysts. Reaction condition: initial 5.5 MPa H2, 245°C, 4 h, 30 mL of H2O, 0.1 g of reactant, 0.05 g of catalyst. 1,2-BDO: 1,2-butanediol, 1,2-PG: 1,2-propylene glycol, EG: ethylene glycol; EtOH: ethanol, LA: lactic acid. Fig. 2 SEM images of (a, b) o-WO3, (c, d) h-WO3, (e, f) m-WO3, (g, h) c-WO3. Fig. 3 (a) N2 adsorption–desorption isotherm and (b) X-ray diffraction patterns of Pd/x-WO3 catalysts. XRD Rietveld Refinements of (c) Pd/o-WO3, (d) Pd/h-WO3 and (e) Pd/m-WO3. (f) Raman spectra of Pd/x-WO3 catalysts. Fig. 4 (a) Elemental mapping of Pd/o-WO3. (b, c) STEM image of Pd/o-WO3 and the inset in (c) is the corresponding SAED pattern and particle diameter, (d) STEM image of Pd/h-WO3 and the inset is the corresponding SAED pattern and particle diameter. (e) STEM image of Pd/m-WO3 and the inset is the corresponding SAED pattern and particle diameter. Fig. 5 (a) The X-band EPR spectra of Pd/x-WO3 catalysts. Defect models of (b) o-WO3 and (c) h-WO3. The red and blue balls represent the O and W atoms, respectively. (d) Comparison chart of defect formation energy over o-WO3 and h-WO3. (e) Linear relationship diagram between integral defect quantity and C2 alcohols yield. (For interpretation of the references to colour in this figure legend, the reader is referred to the web version of this article.) Fig. 6 (a) The O 1s spectra, (b) W 4f spectra, and (c) Pd 3d spectra of Pd/x-WO3 catalysts. (d) H2-TPD profiles and (e) NH3-TPD profiles of Pd/x-WO3 catalysts. (f) Py-IR spectra of Pd/x-WO3 catalysts at 250 °C. Fig. 7 (a) Possible reaction pathways for converting cellulose into C2 alcohols. (b) Product distribution of different substrates catalyzed by Pd/o-WO3 catalyst. Reaction condition: 30 mL of H2O, 0.1 g of reactant. EG: ethylene glycol; EtOH: ethanol; 1,2-PG: 1,2-propylene glycol; 1,2-BDO: 1,2-butanediol; Sor: sorbitol; Ery: erythritol; Mnt: mannitol; Others: LA, Formic acid, and other unidentified polyols and oligomers. Table 1 Catalytic performance of Pd/o-WO3 under different reaction conditions. Reaction conditions Conversion (%) Selectivity of products in liquid (%) Temperature (°C) H2 Pressure (MPa) Time (h) Ratio catalyst/cellulose EG EtOH 1,2-PG 1,2-BDO Sor Ery Others 215 5.5 4 1:2 70 37.3 12.8 5.6 3.8 10.1 3.3 2.3 230 5.5 4 1:2 >99 61.0 8.6 6.4 16.9 3.8 3.1 3.2 245 5.5 4 1:2 >99 64.8 15.4 9.5 6.2 2.9 1.8 1.7 260 5.5 4 1:2 >99 60.3 18.0 8.0 1.5 1.0 1.5 4.3 245 3.5 4 1:2 >99 53.8 13.6 10.4 10.7 4.0 2.6 2.9 245 4.5 4 1:2 >99 63.5 17.4 8.9 6.6 2.9 2.1 2.7 245 6.5 4 1:2 >99 63.3 17.0 11.0 8.2 2.1 1.2 2.9 245 5.5 2 1:2 >99 60.2 19.7 6.8 8.8 2.9 2.0 2.2 245 5.5 3 1:2 >99 62.9 18.0 7.7 4.5 4.8 2.6 3.8 245 5.5 5 1:2 >99 60.1 15.4 8.1 5.5 3.3 2.2 1.3 245 5.5 4 1:3 >99 62.5 16.6 11.7 4.2 3.5 2.1 3.1 245 5.5 4 1:4 >99 61.2 18.6 9.1 5.5 2.6 1.4 3.4 245 5.5 4 1:5 >99 60.0 18.4 11.9 6.9 2.1 1.0 2.1 EG: ethylene glycol; EtOH: ethanol; 1,2-PG: 1,2-propylene glycol; 1,2-BDO: 1,2-butanediol; Sor: sorbitol; Ery: erythritol. Others: LA, Formic acid, and other unidentified polyols and oligomers. Research article Crystal defects Boost cellulose conversion to C2 alcohols over Pd/WO3 catalysts Wei Jia Writing – original draft Methodology Investigation Formal analysis Data curation Conceptualization a Wengang Liu Writing – original draft Funding acquisition Data curation b Yuandong Cui Investigation Formal analysis a Hang Song Resources Investigation c Chengfeng Zhou Supervision Resources Funding acquisition a Wei Jiang Writing – original draft Methodology Investigation Formal analysis Data curation Conceptualization a Haoxi Ben Writing – review & editing Supervision Resources Funding acquisition a Xiaoli Yang Writing – review & editing Supervision Resources Project administration Methodology Funding acquisition Formal analysis Data curation Conceptualization a ⁎ De Chen Writing – review & editing Methodology d a College of Textiles and Clothing, State Key Laboratory of BioFibers and Eco-textiles, Qingdao University, Qingdao 266071, China College of Textiles and Clothing State Key Laboratory of BioFibers and Eco-textiles Qingdao University Qingdao 266071 China College of Textiles and Clothing, State Key Laboratory of BioFibers and Eco-textiles, Qingdao University, Qingdao 266071, China b College of Materials Science and Engineering, Qingdao University of Science and Technology, Qingdao 266042, China College of Materials Science and Engineering Qingdao University of Science and Technology Qingdao 266042 China College of Materials Science and Engineering, Qingdao University of Science and Technology, Qingdao 266042, China c State Key Laboratory for Marine Corrosion and Protection, Luoyang Ship Material Research Institute, Qingdao 266237, China State Key Laboratory for Marine Corrosion and Protection Luoyang Ship Material Research Institute Qingdao 266237 China State Key Laboratory for Marine Corrosion and Protection, Luoyang Ship Material Research Institute, Qingdao 266237, China d Department of Chemical Engineering, Norwegian University of Science and Technology, Trondheim 7491, Norway Department of Chemical Engineering Norwegian University of Science and Technology Trondheim 7491 Norway Department of Chemical Engineering, Norwegian University of Science and Technology, Trondheim 7491, Norway ⁎ Corresponding author. Graphical abstract A large number of crystal defects were found on the Pd/o-WO3 surface, which improved the efficiency of cellulose conversion to C2 alcohols. Converting cellulose into C2 alcohols presents a sustainable alternative to fossil fuels, contributing to the development of eco-friendly and economically viable biofuels and chemicals. Tungsten oxide (WO3) is a key solid acid catalyst for this process, yet limited research explores its diverse morphologies and unique catalytic effects. This study investigates diverse WO3 morphologies (nanosheets, nanoflowers, nanoblocks, and tetrahedral octahedra) in combination with Pd for converting cellulose to C2 alcohols. Optimized conditions with Pd/o-WO3 catalyst resulted in the highest C2 alcohols (ethylene glycol and ethanol, 80.9 %), notably yielding 64.8 % ethylene glycol. Extensive characterizations and DFT calculations reveal the smaller element occupancy rates and a longer W-O bond length led to a large number of crystal defects over Pd/o-WO3. It facilitated the formation of W5+–OH sites and Pd-O(H)-W interactions, further synergistically enhancing hydrogenation ability and acidity. Designed experiments to elucidate cellulose conversion pathways, including hydrolysis, retro-aldol condensation, and hydrogenation. This study emphasizes the unique impact of WO3 morphologies and underscores the importance of supporting crystal defects for catalytic performance in eco-friendly biofuel and chemical production. Keywords Cellulose conversion Tungsten trioxide Morphological impact Crystal defects Alcohols Data availability Data will be made available on request. 1 Introduction The excessive dependence on fossil resources, such as coal, oil, and natural gas, not only depletes energy reserves but also causes environmental pollution. Hence, finding an alternative green resource for sustainable development is crucial [1,2]. Cellulose, the predominant carbon source in lignocellulose derived from non-food sources like trees, straw, and discarded cotton fibers [3,4], offers significant potential as a substitute for fossil energy in the sustainable production of fuels and chemicals. As a D-(+)-glucose pyranose linear homopolymer linked by β-1,4-glycosidic bonds [5,6], cellulose can be efficiently converted into high-value platform compounds through hydrothermal catalysis, including ethylene glycol (EG)[7], ethanol (EtOH)[8], 1,2-propanediol (1,2-PG)[9], lactic acid (LA)[10], Ketone alcohol [11], and others. Notably, EG finds widespread use as a precursor for polyester fibers, antifreeze, coolant, and energy carrier [12], while EtOH serves as a versatile low-carbon fuel, solvent, and disinfectant [13]. Consequently, the development of efficient catalysts for the conversion of cellulose to C2 alcohols (EG and EtOH) holds immense research potential and significance. Currently, a multitude of supported catalysts have been developed for the conversion of cellulose into valuable chemicals. Although oxides, molecular sieves, and other carbon materials are commonly utilized as supports, most of these exhibit proclivity toward catalyzing the synthesis of C6 alcohols. The pioneering work by Atsushi Fukuoka and Paresh L. Dhepe [14] showcased the capability of Pt/γ-Al2O3 in converting cellulose into sugar alcohols, predominantly sorbitol and mannitol. Akshay R. Mankar et al. [15] prepared heteropolyacid (HPA)/zirconia and Ru/C catalysts for one-pot conversion of raw cellulose into high-yield value-added products such as hexitol and ethylene glycol. Ribeiro et al. [16] employed carbon materials as supports and loaded Ru metal, revealing that the Ru/CNT catalyst effectively converted cellulose into sorbitol with over 60 % selectivity. However, the materials containing W species have recently gained attention for their ability to promote the production of C2 alcohols. Zhang's team pioneered the use of W species in cellulose conversion, achieving a maximum ethylene glycol yield of 61 % with the Ni-W2C/AC catalyst [17]. They later developed a series of bimetallic catalysts based on W, exploring synergistic effects between W and metals such as Ni, Pd, Ru, and Ir, with the Ni–W/SBA-15 catalyst yielding up to 75.4 % EG [18]. Additionally, they found that WP could be used as a support to prepare Ni-based catalysts for this process [19]. Subsequently, Lucília Sousa Ribeiro and colleagues prepared a nitric acid-modified carbon nanotube-supported Ru catalyst and an untreated carbon nanotube-supported tungsten catalyst. When physically mixed and used in a one-pot reaction with cellulose, these catalysts yielded 41 % ethylene glycol within just 5 h [20]. Their subsequent improvements led to the development of Ru-W/CG [21] and Ni–W/CNT [22] catalysts, which showed even better performance in converting cellulose into ethylene glycol. Applying these catalysts to lignocellulosic biomass, they achieved an ethylene glycol yield of over 35 %. Gao et al. [23] recently prepared a nickel-tungsten co-doped spherical carbon-based catalyst using a one-pot hydrothermal carbonization method, with glucose as the carbon source. The resulting WCx catalyst led to a 100 % conversion of cellulose and a 69 % selectivity for ethylene glycol. Among the varied W-contained species, WO3 is particularly noteworthy due to its excellent acidic properties [24]. Unlike other acidic metal oxides like SiO2 and ZrO2, WO3 has been found to significantly promote the cleavage of C2-C3 bonds in glucose, making the formation of ethylene glycol and other low-carbon alcohols more feasible [25–27]. Liu et al. [28] introduced WO3 during cellulose conversion with a Ru/C catalyst, resulting in a substantial shift towards the production of ethylene glycol. Cao et al. [29] developed a Ni-WO3/SBA-15 catalyst, achieving a 70.7 % EG yield. Wu et al. [30] discovered that modulating the WOx content can adjust catalyst acidity, enhancing cellulose hydrolysis, inhibiting glucose isomerization to fructose, and boosting ethylene glycol yield. Additionally, some studies found that the unique ability of WO3 to form nonhomogeneous HxWO3 species in water aids in cellulose hydrolysis and C–C bond cleavage in sugars, setting it apart from catalysts that quickly convert glucose to hexanol [31,32]. This mechanism highlights the role of WO3 in selectively producing C2 alcohols. Furthermore, existing research emphasizes the profound influence of catalyst morphology on catalytic efficacy. Disparate morphologies can exert influence on intermolecular forces, alter interface structures, and lead to the formation of distinct functional sites during catalyst preparation [33]. For instance, Liao et al. [34] fine-tuned the interface structure of Rh particles and CeO2 by altering the CeO2 morphology, leading to discernible alterations in surface oxygen vacancy density and catalytic activity. Similarly, Cai et al. [35] found that the electronic effect of strong metal support interaction between Pd and In2O3 was significantly influenced by their morphology. Notably, WO3 also has diverse morphologies, and studies have demonstrated that these morphological variations have distinct catalytic effects on processes such as the photocatalytic oxidation of benzene to phenol [36] and photoelectrochemical water splitting [37]. This indicates that the structure and surface electron gap of WO3 with diverse morphologies have an impact on the performance of the catalyst. [38] Thus, the morphology of WO3 may also play a role in altering the catalytic performance of cellulose conversion to C2 alcohols, but this aspect remains unexplored in the literature, and its intrinsic reasons are still unclear. Moreover, Palladium (Pd) is renowned for its excellent hydrogenation capability [39] and can form synergistic interactions with tungsten-containing materials, which facilitates the hydrogenolysis of cellulose. Leal et al. [40] prepared a Pd-W2C/C catalyst for the production of EG from cellulose. Their findings revealed a significant interaction between Pd and W, promoting a multi-step reaction and enhancing EG production. Pd can also form synergistic interactions with WO3 [41], which is particularly beneficial for cellulose conversion. Chu et al. [42] demonstrated that incorporating Pd into Cu-WOx/SiO2 substantially improved the production efficiency of C2 alcohols. In this study, we prepared a series of Pd/x-WO3 catalysts with different WO3 morphologies, including nanosheets, nanoflowers, nanoblocks, and tetrahedral octahedra, to investigate their effect on the catalytic conversion of cellulose to C2 alcohols. Through optimizing the reaction conditions, a high total C2 alcohols selectivity of 80.9 % with EG selectivity reaching 64.8 % was acquired over Pd/o-WO3 (Orthogonal tungsten trioxide). Various characterizations were conducted to explore the microstructural differences and the chemical state of elements. Subsequently, the hydrogenation and acidic properties of these catalysts were investigated to establish the structure-performance relationship. The designed experiments provided insights into the reaction path and mechanism. 2 Experimental section 2.1 Materials and catalyst preparation Sodium tungstate (Na2WO4·2H2O, 99.5 %), palladium nitrate (Pd (NO3)2, 4-5 wt%, diluted to 5.04 g/L), hydrochloric acid (HCl, 38 %), nitric acid (HNO3, 65–68 %), sodium chloride (NaCl, 99.5 %), acetone (99.5 %), sodium borohydride (98 %), microcrystalline cellulose (25 μm), D-glucose anhydrous (99 %), fructose (99 %), mannose (99 %), sorbitol (98 %), ethanol (99.7 %) and ethylene glycol (98 %) were all purchased from Shanghai Aladdin Biochemical Technology Co., Ltd. (Shanghai, China). All reagents were used without further processing. Various morphologies of WO3 were prepared by introducing different inducers and adjusting the concentration of H+ in the solution. For the production of o-WO3 nanosheets, 0.50 g of Na2WO4·2H2O was dissolved in 22 mL of deionized water and thoroughly mixed. Subsequently, 0.45 mL of HCl (38 %) was gradually added under continuous stirring until the solution turned light yellow. 11 mL of acetone was then introduced, and stirring continued for 30 min until complete mixing. The resulting solution was transferred into a Teflon-lined autoclave and heated at 140 °C in an oven for 72 h. After cooling to room temperature, the grey-blue solid was filtrated, washed, dried overnight at 60 °C in a vacuum drying oven, and calcined at 250 °C for 3 h to obtain o-WO3 nanosheets. For the synthesis of h-WO3 nanoflowers, 2.00 g of Na2WO4·2H2O was dissolved in 40 mL of deionized water, and 6 mL of 1 M HNO3 solution was added. The solution was then transferred to a Teflon-lined stainless autoclave and kept at 180 °C for 4 h. Following filtration, washing, and drying, the resulting solid powder was calcined at 350 °C for 3 h to yield h-WO3 nanoflowers. Similarly, m-WO3 nanoblocks was obtained by dissolving 2.00 g of Na2WO4·2H2O in 40 mL of deionized water, adding 20 mL of 5 M HNO3 to the solution, stirring for 30 min, heating at 180 °C for 4 h, subsequently washing and drying overnight at 60 °C. The calcination step was performed at 350 °C in air for 3 h. To synthesize c-WO3 regular octahedrons, 3.30 g of Na2WO4·2H2O and 5.85 g of NaCl were initially added into 70 mL of deionized water to form a transparent solution. HCl was then added until the pH reached 3.5. The solution was transferred into a Teflon-lined autoclave and heated at 180 °C in an oven for 24 h. After cooling, the resulting product was separated by filtration, washed, dried overnight at 60 °C, and calcined at 350 °C for 4 h. Pd-loaded WO3 catalysts were synthesized by a wet impregnation method. Typically, 200 mg of WO3 was dispersed in 50 mL of deionized water with continuous stirring. Then, a certain amount of Pd(NO3)2 solution, based on a theoretical 2 % mass fraction of Pd, was added. Next, excessive sodium borohydride was introduced to the solution and stirred for 1 h to ensure full reduction of Pd ions. The samples were then obtained by filtration, washing, and drying at 60 °C overnight in a vacuum oven, denoted as Pd/x-WO3 (where x represents the type of WO3). 2.2 Activity Measurements The catalytic test was conducted in a 100 mL reaction vessel. Initially, 50 mg of catalyst and 100 mg of microcrystalline cellulose powder or other raw materials, along with 30 mL of deionized water, were sequentially added. Following several purges of the reactor with H2, the reactor was pressurized with 5.5 MPa H2 (99.999 %) and heated to 245 °C for 4 h at a stirring speed of 600 rpm. The collected reaction products were analyzed using high-performance liquid chromatography (HPLC, Agilent 1260, Shanghai, China) equipped with an 87-H column and a refractive index detector (RID). The mobile phase consisted of a 2 mmol/L H2SO4 aqueous solution, flowing at a rate of 0.6 mL min−1. The cellulose conversion and product selectivity are calculated as follows: X cellulose % = m rawcellulose - m residualcellulose m rawcellulose × 100 Y product % = mol carboninaspecificproduct mol carboninrawcellulose × 100 To ensure result reliability, all tests were conducted in triplicate, and the error was kept below 3 %. Turnover number (TON) values were calculated according to the following equation. TON = Amount of C2 alcohols (μmol)/amount of catalyst (μmol) [43,44]. 2.3 Catalysis characterizations X-ray diffraction (XRD) patterns were obtained using a Japanese Science Ultima IV diffractometer equipped with a Cu Kα (λ = 0.15406 nm) radiation source. The scanning rate was set at 10° min−1 within the 2θ range of 10 − 80°. The Brunauer-Emmett-Teller (BET) surface area of various catalysts was determined using an Automatic specific surface area analyzer (Tristar 3000). Before testing, samples were pretreated at 200 °C for 3 h under a vacuum atmosphere. The content of Pd and W elements in the catalyst was measured via Inductively Coupled Plasma Optical Emission Spectrometry (ICP-OES) using AGILENT ICP-OES 730. The morphology of the catalysts was observed using a Sigma500 scanning electron microscopy (SEM, Carl Zeiss AG, Jena, Germany). The size distribution of metal particles and the lattice fringes were examined through scanning transmission electron microscopy (STEM, Talos F200S). X-ray photoelectron spectroscopy (XPS) was performed on an ESCALAB Xi+ electron spectrometer (Thermo Fisher Scientific, US) using 300 W Al Kα radiation. Raman spectra of all samples were collected at room temperature using a 532 nm He Ne laser on Thermo Fisher DXR2. Electron paramagnetic resonance (EPR) spectra were recorded using an EMX micro A300 spectrometer at −196 °C. The data was quantified using Bruker WINEPR software. For H2 and NH3 temperature-programmed desorption (H2-TPD, NH3-TPD), the sample was heated to 120 °C at a rate of 2 °C min−1, treated with Ar flow for 60 min, then cooled to 50 °C for H2/NH3 adsorption with 5 vol% H2/Ar or NH3/Ar. After adsorption saturation, the samples were heated to 900 °C at a ramping rate of 10 °C min−1. Fourier transform infrared spectroscopy of pyridine adsorption (Py-IR) was performed on Thermo Scientific (Nicolet 380). Initially, the sample was pretreated under a dynamic vacuum of 350 °C for 1 h and then dropped to 40 °C to record the background spectrum. Subsequently, the samples were exposed to pyridine for 10 min, and spectra were collected. Desorption was performed at 150 °C under dynamic vacuum conditions, and the IR peaks were monitored. 2.4 Density functional theory (DFT) calculations The formation energy (ΔEv ) of oxygen vacancy on the o-WO3 (220) surface and h-WO3 (220) surface was calculated using the DMol3 code. The change-correlation interaction was treated by the generalized gradient approximation (GGA) with PBE functional with long-range dispersion correction via the TS scheme. An all-electron double numerical atomic orbital augmented by double-numerical + d function (DND) was used as the basis set, with a cutoff radius of 4.5 Å. Brillouin zone integration was sampled with the 3 × 3 × 1 k-points using the Monkhorst − Pack scheme for surface calculations. To obtain convergent results in the geometry optimization step, the tolerance of energy, maximum force, maximum displacement, and self-consistent field (SCF) were set to 2.0 × 10−5 Ha, 0.004 Ha/Å, 0.005 Å, and 1.0 × 10−5 Ha, respectively. In this work, the WO3 (220) surface slab was constructed with two atomic layers. The bottom layer was constrained at their lattice positions. The vacuum space along the z direction was set to 15 Å to avoid interactions between periodic slabs. The formation energy (ΔEv ) of oxygen vacancy was defined as: ΔEv = Ev − E0 + μo , where Ev , E0 , and μo represent the total energy of the WO3 (220) surface slab, the energy of the WO3 (220) surface slab with oxygen vacancy, and the chemical potential of oxygen, respectively. 3 Result and discussion 3.1 One-pot conversion of cellulose to EG 3.1.1 Evaluation of catalytic performance The catalytic efficacy of four distinct morphologies of pure WO3 in cellulose hydrogenation was initially assessed (Fig. 1 a). Cellulose conversion and product distribution were monitored over a 4 h of reaction period under initial 5.5 MPa hydrogen conditions at 245 °C. Notably, cellulose remained incompletely converted over pure WO3 variants. The resulting products exhibited a minimal presence of polyols but a significant amount of LA. According to the conventional conversion pathway, cellulose, upon hydrolysis to glucose, underwent substantial isomerization to fructose, which was subsequently converted to LA through retro-aldol condensation and dehydration reactions [45]. These processes took place over the WO3 catalyst due to the presence of water-tolerant Lewis acid W6+ centers, basic oxo species (W = O groups), and a hydrogen-bond network within the surface water layer. Upon loading Pd nanoparticles, significant changes in catalytic performance were observed. As depicted in Fig. 1b, Fig. S1 and Table S1, cellulose was converted after 4 h over the Pd/o-WO3, Pd/h-WO3, and Pd/m-WO3 catalysts under the same conditions, suggesting that the introduction of metal sites promoted the reaction process and enhanced cellulose conversion. Additionally, the product distribution differed significantly from that of pure WO3, with the main product shifting from LA to EG and EtOH. This underscored the substantial contribution of metal nanoparticles to the alteration of the reaction path due to the reconstruction of the active sites. Unlike the glucose isomerization to fructose over WO3 support, the Pd/x-WO3 catalysts promoted the cleavage of C–C bonds in glucose and its selective conversion into C2 alcohols (EG and EtOH). Specifically, Pd/o-WO3 exhibited the highest selectivity of C2 alcohols at approximately 80.2 %, with EG selectivity reaching 64.8 %. This is a notably high yield of C2 alcohols compared to previous studies (Table S2). The selectivity of Pd/h-WO3 for C2 alcohols was only 69.6 %, and the selectivity for EG decreased to 49.4 %. Pd/m-WO3 displayed a similar selectivity for C2 alcohols (69.4 %) as the Pd/h-WO3 catalyst, but the selectivity of EG was only 44.5 %. However, it was worth noting that Pd/c-WO3 exhibited poor performance, with cellulose conversion reaching only ∼ 75.0 %. The selectivity of total C2 alcohols was 35.1 %, including 27.3 % of EG. The significant differences in the product distribution among the four catalysts suggested the morphology of WO3 has a significant effect on the catalytic activity of the Pd/x-WO3 catalysts. Further characterization of the intrinsic influencing factors was required. 3.1.2 Optimization of reaction conditions Table 1 illustrated the impact of temperature, pressure, time, and catalyst dosage on the catalytic conversion of cellulose to C2 alcohols over Pd/o-WO3. At 215 °C, cellulose could not be fully converted, and the selectivity of C2 alcohols, especially for EG, was quite low. It indicated that low temperatures were not conducive to the hydrolysis and transformation of cellulose. As the temperature increased, cellulose conversion reached 100 %, with C2 alcohols selectivity reaching its maximum at 245 °C. Further increase in the temperature resulted in a decline in C2 alcohols selectivity, which was attributed to the further transformation of C2 alcohols into smaller molecules. Additionally, adjusting the pressure revealed a significant increase in C2 alcohols selectivity from 3.5 to 4.5 MPa, indicating the promotional role of hydrogen. Subsequently, the selectivity of C2 alcohols remained nearly constant with the sufficient hydrogenation ability. Besides, cellulose was fully converted within 2 h, suggesting the efficiency of the Pd/o-WO3 catalyst. With an extended reaction time, the selectivity of C2 alcohols gradually increased, reaching its maximum at 4 h. Then it showed a decreasing trend, possibly due to the further transformation of C2 alcohols. Furthermore, the influence of catalyst loading on product selectivity was explored. As the catalyst-to-cellulose ratio decreased, the yield of EG slightly decreased. This indicated more catalysts accelerate the formation of intermediate product glycolaldehyde, and promote the formation of ethylene glycol and ethanol [46,47]. Therefore, the conditions of 0.05 g catalyst, 0.1 g cellulose, 245°C, and 5.5 MPa H2 were selected for economic efficiency and safety considerations. Besides, the recyclability of the Pd/o-WO3 catalyst was investigated, as shown in Fig. S2. It was observed that the total cellulose conversion remained consistent even after five runs. However, the selectivity of EG and EtOH exhibited a minor decrease after the initial cyclic reaction, followed by stabilization. The XRD patterns (Fig. S3) of Pd/o-WO3 post-reaction closely resembled that of the fresh catalyst. Moreover, the ICP analysis (Table S3) of the final reaction solution detected trace amounts of Pd and W, indicating reasonable stability of the catalyst. 3.2 Catalyst characterization 3.2.1 Structural properties SEM images revealed distinct morphologies for the four types of WO3. The o-WO3 sample (Fig. 2 a-b) displayed an accumulation of nanosheets, while the h-WO3 sample (Fig. 2c-d) exhibited a nanoflower-shaped structure composed of multiple nanorods. In contrast, the m-WO3 sample (Fig. 2e-f) featured a nano-block shape, and the c-WO3 sample (Fig. 2g-h) showcased a regular octahedron shape. Correspondingly, XRD patterns in Fig. S4 indicated that these WO3 samples matched different crystal phases. The o-WO3 sample was aligned with the Joint Committee on Powder Diffraction Standards card number 97–008-2941 (JCPDS No. 97–008-2941), and corresponds to the orthogonal crystal phase. The h-WO3, m-WO3, and c-WO3 samples matched the hexagonal (JCPDS No. 97–003-2001), monoclinic (JCPDS No. 97–008-0057), and cubic (JCPDS No. 97–020-2875) crystal phases, respectively. Based on these diverse WO3 morphologies, Pd metal was loaded, resulting in an actual Pd loading of approximately 1.7 wt% for the four Pd/x-WO3 catalysts, as revealed by ICP results (Table S4). N2 adsorption–desorption curves of these catalysts in Fig. 3 a revealed a type H3 hysteresis, indicating an irregular distribution of pore structures attributed to flat slit structures, cracks, and wedge-shaped structures. The BET surface areas (Table S5) of these catalysts were all below 10 m2 g−1, indicating small surface areas with few mesopores. XRD patterns of Pd-loaded WO3 samples (Fig. 3b) retained the same peaks as pure WO3 samples, with no observable peaks for Pd or PdO. It suggested that the addition of Pd species did not affect the crystals of WO3 and affirmed the high dispersion of Pd species [48]. Subsequently, the XRD pattern of these catalysts after a 4 h reaction was observed. Fig. S3 revealed that Pd/o-WO3, Pd/h-WO3, and Pd/m-WO3 catalysts almost maintained their original patterns, whereas the Pd/c-WO3 catalyst exhibited significant changes. Furthermore, the XRD patterns of the Pd/c-WO3 catalyst after 1 h of reaction also indicated a phase change (Fig. S5), suggesting that c-WO3 could not maintain its original crystalline phase during the reaction. This likely contributed to its poor catalytic performance. Therefore, Pd/c-WO3 was excluded from further discussion to eliminate performance differences caused by crystal phase changes. To obtain precise phase composition and lattice parameter information, Rietveld refinements were made to the XRD data of the three Pd/x-WO3 samples (Fig. 3c-e). The refined simulation mode matched well with the experimental data, indicating good correspondence on the crystal phases. However, unlike x-WOx samples (Table S6- 7), the occupancy rates of W and O greatly varied among the Pd/x-WOx samples (Table S8- 9). Specifically, the occupancy of W1 in Pd/o-WO3 was 0.994, and that in Pd/h-WO3 was 0.995, while the occupancy of W2 in Pd/m-WO3 was 0.998. The greater decreasing trend of W occupancy in the Pd/o-WO3 catalyst possibly suggested richer crystal plane defects on the catalyst surface. Raman spectroscopy also revealed distinct characteristic peaks corresponding to different crystal phases (Fig. 3f). The orthogonal phase WO3 exhibited peaks at 252, 323, 690, and 850 cm−1 [49]. The spectral bands at 243, 325, 690, and 850 cm−1 were attributed to the basic mode of crystalline hexagonal phase WO3 [50,51]. Peaks at 270, 325, 713, and 806 cm−1 were characteristic of monoclinic tungsten oxide [52]. Notably, the scattering peaks in o-WO3 and h-WO3 samples had a widened half-peak width compared to the sharp scattering peaks of m-WO3, indicating the presence of a large number of defect energy levels in their structures [53]. Next, the differences in the microstructures were investigated. The elemental mapping of Pd/o-WO3 in Fig. 4 a revealed well-distributed Pd, W, and O elements. TEM images in Fig. 4b illustrated highly dispersed Pd particles on the o-WO3 support, with an average particle size of 2.79 nm. Additionally, the analysis of lattice spacing in the TEM images indicated the presence of (111) crystal faces of Pd metal nanoparticles and (220) crystal faces of o-WO3 structures on the Pd/o-WO3 catalyst (Fig. 4c). Notably, careful observation revealed white areas indicative of crystal defects on o-WO3 support, where a large number of Pd nanoparticles were distributed. These observations suggested the presence of defects over o-WO3 favored the dispersion and stability of Pd nanoparticles. Furthermore, the lattice distances of 0.182 and 0.228 nm assigned to the (220) crystal face of the hexagonal phase and the (002) crystal face of the monoclinic phase were observed over Pd/h-WO3 and Pd/m-WO3 samples, respectively. Analyzing the crystal faces found that Pd particles on these two catalysts were also primarily in the form of (111) crystal faces (Fig. 4d-e and Fig. S6), thus excluding differences caused by the Pd crystal face. Moreover, no obvious crystal defects were found over the h-WO3 and m-WO3, and the average Pd particle sizes were 3.02 and 4.13 nm, respectively. EPR spectra were also employed to accurately determine the existing defects of various samples, revealing again that Pd/o-WO3 had more defects, followed by Pd/h-WO3 and Pd/m-WO3 (Fig. 5 a)[48]. Besides, the EPR spectra of pure x-WO3, reduced x-WO3 and unreduced Pd/x-WO3 catalysts were collected to check the origin of defects. As shown in Fig. S7, no significant defects were observed on pure x-WO3 and unreduced Pd/x-WO3, but few defects were observed on the reduced x-WO3. This indicates that defects were formed during the reduction process. Also, the defect amount over o-WO3 was higher than that over other WO3. To figure out the reasons, DFT calculations were conducted to assess the defect formation energy of various samples. Based on the TEM images, the (220) crystal faces of o-WO3 and h-WO3 were selected to construct the model for data comparability (Fig. 5b-c). According to the models, the bond length of the W-O bond in o-WO3 was 1.96 Å, and the bond length of the W-O bond in h-WO3 was 1.91 Å (Table S10). Since a longer bond length suggested lower bond energy, it meant that W-O in o-WO3 might be more prone to fracture and form crystal plane defects. Further comparison of the formation of defects indeed found that h-WO3 required approximately 1 eV more energy input than o-WO3 (Fig. 5d and Table S11). This meant the defects were more easily formed over o-WO3. Additionally, the defect amount on x-WO3 is smaller than that on Pd/x-WO3, likely due to the presence of hydrogen spillover. Variations in metal-support interaction caused by different microstructures led to differing levels of hydrogen spillover, ultimately resulting in varying numbers of defects on the surface of Pd/x-WO3. Moreover, an in-depth analysis of the defect quantity of Pd/x-WO3 and C2 alcohols yield, by integrating the EPR data (Fig. 5e), unveiled a discernible linear relationship between them. This illustrated that crystal defects played a vital role in the formation of EG and EtOH. These defects not only facilitated the dispersion and stability of Pd but could also potentially alter the local electron density of the WO3 support and Pd particles, thereby influencing the overall catalytic performance. 3.2.2 Chemical states Building upon these findings, XPS was employed to discern the chemical states of various catalysts. As shown in Fig. 6 a, the curves of O 1s were divided into three peaks. The peak at 529.9 eV was attributed to lattice oxygen, the peak at 531.2 eV belonged to the defect oxygen, and the additional one at 532.5 eV was ascribed to the hydroxyl groups [54,55]. Quantitative analysis indicated a higher proportion of defect oxygen and hydroxyl groups in Pd/o-WO3 compared to other samples. Additionally, the results of infrared spectra (Fig. S8) also indicated the presence of more hydroxyl groups in Pd/o-WO3. This aligns with previous reports in the literature, suggesting the formation of hydroxylated Pd species [56,57]. The prevalence of hydroxyl species could be attributed to the role of defective oxygen, potentially altering the adsorption properties and acidic characteristics of the catalysts [58,59]. W 4f spectra of samples in Fig. 6b showed the total peak slightly shifted towards a lower binding energy in Pd/o-WO3 compared with the other two catalysts. After analyzing, the W 4f spectra could be resolved into four peaks. The peaks at 35.9 and 38.0 eV corresponded to W6+, while the peaks that appeared at 35.4 and 37.5 eV were attributed to W5+ [60]. Quantitative analysis of the area of W5+/W showed that Pd/o-WO3 had a higher percentage of W5+, about 16 %, while only a small amount of W5+ species (11 %) was present in the Pd/m-WO3 catalyst (Table S12). This suggested that the defects in Pd/o-WO3 also promoted the formation of W5+ species [61]. These species would facilitate the existence of hydroxyl groups on the catalyst surface, which has been consistent with the above analysis. In contrast, fewer defects in Pd/h-WO3 and Pd/m-WO3 correspond to a small amount of W5+ species. Additionally, Pd 3d spectra of samples in Fig. 6c showed peaks slightly shifted towards higher binding energies in Pd/o-WO3 compared to the Pd/h-WO3 and Pd/m-WO3 catalysts. This phenomenon showed that there were varied degrees of electron transfer between Pd and WO3 with different crystal phases, and the strain of Pd particles was greatly affected by the crystal phases of WO3. Further analyzing the spectra found that Pd species coexisted with 0, +2, and + δ valences. Peaks at 335.5 and 340.7 eV belonged to Pd0, while small peaks at 337.3 and 342.6 eV were attributed to Pd2+ due to the inevitable surface oxidization. Besides, peaks at 336.3 and 341.5 eV contributed by Pdδ+ were found over all samples, but the percentage was higher over Pd/o-WO3. This suggested a greater electron transfer between Pd and o-WO3 support, forming stronger Pd-O(H)-W interactions [62–65]. Since the electronic states of Pd and W were related to the activation ability of feed gas and the acidic properties, which affected the catalytic performance [66], further studies were conducted on their influence. 3.3 Influence of the Structural changes Considering the reaction primarily involved the isomerization/C–C bonds cleavage at acidic sites and the hydrogenation process at metal sites, the hydrogenation ability and acidic properties of these catalysts were explored to understand the impact of the above changes on the reaction. H2-TPD curves in Fig. 6d indicated that all three catalysts have dissociation ability for H2. However, the Pd/o-WO3 catalyst exhibited a larger desorption area of H2 and a higher desorption temperature compared to the other two catalysts. It indicated that H2 was more accessible and activated over Pd/o-WO3 due to the changes in the Pd electronic state over the Pd-O(H)-W interfaces. This phenomenon favored the occurrence of the hydrogenation process [67]. Furthermore, dissociated H+ on the Pd particles might migrate into neighboring crystal defects of WO3 support, facilitating the formation of acidic W5+–OH sites as evidenced by EPR, XPS and IR analysis [27]. These acid sites further played an important role in promoting the isomerization/C–C bonds cleavage reactions. In contrast, there is relatively little electron transfer between Pd and h-WO3 or m-WO3, resulting in poor hydrogenation ability and possibly lower acidic sites at the interfaces. NH3-TPD profiles in Fig. 6e illustrated a noteworthy disparity in acidity among the Pd/o-WO3, Pd/h-WO3, and Pd/m-WO3 catalysts. Specifically, the acidity amount of Pd/o-WO3 was about 2.1 times higher than that of Pd/h-WO3, and Pd/m-WO3 exhibited negligible acidity (Fig. S9 and Table S13). Additionally, the acidity strength of Pd/o-WO3 was stronger than Pd/h-WO3 and Pd/m-WO3. Concurrently, Py-IR spectroscopy was employed to quantify the distinct types of acid sites within the catalyst (Fig. 6f and Table S14). Evidently, Pd/o-WO3 exhibited the highest acid content, comprising 189.7 μmol g−1 of B acid and 36.2 μmol g−1 of L acid. Subsequently, the acid content of Pd/h-WO3 and Pd/m-WO3 followed a decreasing trend. Investigation into the correlation between acid content and the integral defect quantity in Fig. S10- 11 demonstrated a robust linear relationship with the total acid content, consistent with the NH3-TPD results. This observation implied that the crystal defects of the catalyst facilitated the generation of acid sites, encompassing both B and L acid sites. In concert with the outcomes, the preponderance of B acid sites on Pd/x-WO3 catalysts could be primarily ascribed to the presence of W5+–OH species at the defect sites, while the prominent Lewis active sites were contributed by Pd-O(H)-W bonds [27]. Based on the above results, owing to the existence of crystal plane defects, Pd/o-WO3 revealed a high content of surface W5+–OH sites and Pd-O(H)-W interface sites. Meanwhile, the hydrogenation ability was enhanced because of the electron transfer between Pd and W. These synergistic effects significantly enhanced the efficacy of cellulose conversion into EG and EtOH over the Pd/o-WO3 catalyst. In contrast, Pd/h-WO3 and Pd/m-WO3 with a few defect sites had few acidic sites and poor hydrogenation ability, leading to an unsatisfactory performance in the cellulose conversion. 3.4 Identification of reaction mechanism and pathway Based on previous research, the conversion of cellulose into EG following hydrolysis into glucose can potentially occur through three distinct pathways. (Fig. 7 a): (i) direct hydrogenation of glucose to produce sorbitol, wherein the C2-C3 bond is cleaved to simultaneously yield EG and butanediol; (ii) initial isomerization of glucose into mannose, followed by C–C bond cleavage and subsequent hydrogenation to produce EG; (iii) a retro-aldol condensation reaction of glucose to form glycolaldehyde, subsequently hydrogenated to yield EG [28,68]. Research has demonstrated that glucose reacts with WO3, leading to the formation of mannose at the C2 position and the cleavage of the C–C bond at the β position, which releases acetaldehyde and erythritol. Subsequently, the mannose and erythritol intermediates underwent a secondary reaction, ultimately resulting in the formation of ethanol. Additionally, the isomerization step at the C2 position is reversible [69]. This indicated that paths (ii) and (iii) were similar. To further elucidate the specific reaction path over the Pd/o-WO3 catalyst, glucose, mannose, and sorbitol were used as reactants, and subjected to a 15 min reaction under the conditions of 245 °C and initial 5.5 MPa H2. Analysis of product distribution revealed only a 1.5 % EG yield from sorbitol (Fig. 7b). For mannose and glucose, similar EG and EtOH yields (about 62 %) were acquired. Calculating the TON of C2 alcohols derived from sorbitol, mannose and glucose revealed the values were 0.1, 3.9, and 4.0, respectively (Table S15). Since the value from the sorbitol pathway was much lower than that of cellulose conversion, this pathway could be ruled out. In addition, the analysis of product distribution found that the mannose-derived products contained a certain amount of mannitol, unlike those from glucose. As the products of cellulose conversion lacked mannitol, the third pathway was deemed the plausible route for the Pd/o-WO3 catalyst. Considering the electronic status of Pd particles and the formation of acidic sites, the active sites and reaction mechanisms over the Pd/o-WO3 catalyst were proposed. By utilizing the water-tolerant acid centers at high temperatures and basic oxo species on o-WO3 support, cellulose was hydrolyzed into glucose. Glucose bound to the WO3 surface at positions C1, C2, and C3. The coordination unsaturated W species at the surface defect sites interacted with the O atom of the C = O group in glucose, forming a new W-O = C bond that polarized the C = O bond. The adjacent hydroxyl groups on the surface of WO3 or Pd-O(OH)-W interfaces interacted with the α- and β- hydroxyl groups of glucose to form W-O-C2 and W-O-C3 bonds, forming a glucose-WO3 tridentate complex. This complex led to the formation of mannose through C1-C2 carbon skeleton rearrangement and C–C bond breaking, ultimately leading to the formation of glycolaldehyde [27,69]. The glycolaldehyde then migrated to the adjacent Pd particles, where it underwent hydrogenation to produce EG and EtOH. 4 Conclusion In this study, we explored the catalytic potential of four different shapes of WO3 (orthogonal nanosheets, hexagonal nanoflowers, monoclinic nanoblocks, and tetrahedral octahedra) combined with Pd metal particles for converting cellulose into C2 alcohols. Under optimized reaction conditions, the Pd/o-WO3 catalyst exhibited the highest C2 alcohols yield at 80.9 %, with a remarkable 64.8 % yield of EG. Our various characterizations revealed a significant presence of crystal defects on the Pd/o-WO3 samples, attributed to the smaller W and O occupancy rates and longer W-O bond lengths. These defects facilitated the formation of W5+–OH sites and promoted Pd-O(H)-W interactions, thereby enhancing both the hydrogenation ability of Pd particles and the acidic properties of the WO3 support. Further experiments elucidated that cellulose hydrolyzed into glucose, followed by a retro-aldol condensation reaction at the W5+–OH sites and Pd-O(H)-W interface. The intermediate product glycolaldehyde then hydrogenated on Pd particles, ultimately leading to the formation of C2 alcohols. These findings underscore the influence of catalyst morphologies and provide valuable insights for the strategic design of catalysts aimed at the conversion of cellulose. CRediT authorship contribution statement Wei Jia: Writing – original draft, Methodology, Investigation, Formal analysis, Data curation, Conceptualization. Wengang Liu: Writing – original draft, Funding acquisition, Data curation. Yuandong Cui: Investigation, Formal analysis. Hang Song: Resources, Investigation. Chengfeng Zhou: Supervision, Resources, Funding acquisition. Wei Jiang: Writing – original draft, Methodology, Investigation, Formal analysis, Data curation, Conceptualization. Haoxi Ben: Writing – review & editing, Supervision, Resources, Funding acquisition. Xiaoli Yang: Writing – review & editing, Supervision, Resources, Project administration, Methodology, Funding acquisition, Formal analysis, Data curation, Conceptualization. De Chen: Writing – review & editing, Methodology. Declaration of competing interest The authors declare that they have no known competing financial interests or personal relationships that could have appeared to influence the work reported in this paper. Acknowledgements The authors gratefully acknowledge the National Natural Science Foundation of China (No. 22478209, 52303058), Natural Science Foundation of Shandong Province (No. ZR2021YQ09, ZR2024YQ018), Shandong Provincial Colleges and Universities Youth Innovation Technology Support Program (No. 2023KJ356), and State Key Laboratory of Bio-Fibers and Eco-Textiles in Qingdao University (No. G2RC202021) for support. Appendix A Supplementary material Supplementary data to this article can be found online at https://doi.org/10.1016/j.jcat.2024.115860. Appendix A Supplementary material The following are the Supplementary data to this article: Supplementary Data 1 References [1] L.T. Mika E. Cséfalvay Á. Németh Catalytic Conversion of Carbohydrates to Initial Platform Chemicals: Chemistry and Sustainability Chem. Rev. 118 2017 505 613 10.1021/acs.chemrev.7b00395 Mika LT, Cséfalvay E, Németh Á. Catalytic Conversion of Carbohydrates to Initial Platform Chemicals: Chemistry and Sustainability. Chem Rev. 2017; 118: 505-613. Doi: 10.1021/acs.chemrev.7b00395 [2] J.N. Chheda G.W. Huber J.A. Dumesic Katalytische Flüssigphasenumwandlung oxygenierter Kohlenwasserstoffe aus Biomasse zu Treibstoffen und Rohstoffen für die Chemiewirtschaft Angew. Chem. Int. Ed. 119 2007 7298 7318 10.1002/ange.200604274 Chheda JN, Huber GW, Dumesic JA. Katalytische Flüssigphasenumwandlung oxygenierter Kohlenwasserstoffe aus Biomasse zu Treibstoffen und Rohstoffen für die Chemiewirtschaft. Angew Chem Int Ed. 2007; 119: 7298-318. Doi: 10.1002/ange.200604274 [3] A. Shrotri H. Kobayashi A. Fukuoka Cellulose Depolymerization over Heterogeneous Catalysts Acc. Chem. Res. 51 2018 761 768 10.1021/acs.accounts.7b00614 Shrotri A, Kobayashi H, Fukuoka A. Cellulose Depolymerization over Heterogeneous Catalysts. Acc Chem Res. 2018; 51: 761-8. Doi: 10.1021/acs.accounts.7b00614 [4] E.J. Cho Y.G. Lee Y. Song H.Y. Kim D.-T. Nguyen H.-J. Bae Converting textile waste into value-added chemicals: An integrated bio-refinery process Environ. Sci. Ecotechnol. 15 2023 100238 10.1016/j.ese.2023.100238 Cho EJ, Lee YG, Song Y, Kim HY, Nguyen D-T, Bae H-J. Converting textile waste into value-added chemicals: An integrated bio-refinery process. Environ Sci Ecotechnol. 2023; 15: 100238. Doi: 10.1016/j.ese.2023.100238 [5] W. Wei S. Wu Depolymerization of cellulose into high-value chemicals by using synergy of zinc chloride hydrate and sulfate ion promoted titania catalyst Bioresour. Technol. 241 2017 760 766 10.1016/j.biortech.2017.06.004 Wei W, Wu S. Depolymerization of cellulose into high-value chemicals by using synergy of zinc chloride hydrate and sulfate ion promoted titania catalyst. Bioresour Technol. 2017; 241: 760-6. Doi: 10.1016/j.biortech.2017.06.004 [6] D. Klemm B. Heublein H.P. Fink A. Bohn Cellulose: faszinierendes Biopolymer und nachhaltiger Rohstoff Angew. Chem. Int. Ed. 117 2005 3422 3458 10.1002/ange.200460587 Klemm D, Heublein B, Fink HP, Bohn A. Cellulose: faszinierendes Biopolymer und nachhaltiger Rohstoff. Angew Chem Int Ed. 2005; 117: 3422-58. Doi: 10.1002/ange.200460587 [7] N. Li Y. Zheng L. Wei H. Teng J. Zhou Metal nanoparticles supported on WO3 nanosheets for highly selective hydrogenolysis of cellulose to ethylene glycol Green Chem. 19 2017 682 691 10.1039/c6gc01327a Li N, Zheng Y, Wei L, Teng H, Zhou J. Metal nanoparticles supported on WO3 nanosheets for highly selective hydrogenolysis of cellulose to ethylene glycol. Green Chem. 2017; 19: 682-91. Doi: 10.1039/c6gc01327a [8] M. Yang H. Qi F. Liu Y. Ren X. Pan L. Zhang One-Pot Production of Cellulosic Ethanol via Tandem Catalysis over a Multifunctional Mo/Pt/WOx Catalyst Joule. 3 2019 1937 1948 10.1016/j.joule.2019.05.020 Yang M, Qi H, Liu F, Ren Y, Pan X, Zhang L, et al. One-Pot Production of Cellulosic Ethanol via Tandem Catalysis over a Multifunctional Mo/Pt/WOx Catalyst. Joule. 2019; 3: 1937-48. Doi: 10.1016/j.joule.2019.05.020 [9] Y. Yang D. Ren C. Shang Z. Ding X. Luo Site isolated Ru clusters and sulfoacids in a yolk-shell nanoreactor towards cellulose valorization to 1,2-propylene glycol Chem. Eng. J. 452 2023 139206 10.1016/j.cej.2022.139206 Yang Y, Ren D, Shang C, Ding Z, Luo X. Site isolated Ru clusters and sulfoacids in a yolk-shell nanoreactor towards cellulose valorization to 1,2-propylene glycol. Chem Eng J. 2023; 452: 139206. Doi: 10.1016/j.cej.2022.139206 [10] M. Guo C. Zhou Y. Cui W. Jiang G. Han Z. Jiang Sustainable Production of Lactic Acid from Cellulose Using Au/W-ZnO Catalysts Polymers 15 2023 4235 10.3390/polym15214235 Guo M, Zhou C, Cui Y, Jiang W, Han G, Jiang Z, et al. Sustainable Production of Lactic Acid from Cellulose Using Au/W-ZnO Catalysts. Polymers. 2023; 15: 4235. Doi: 10.3390/polym15214235 [11] H. Wang H. Xin C. Cai C. Zhu Z. Xiu Q. Liu Selective C3-C4 Keto-Alcohol Production from Cellulose Hydrogenolysis over Ni-WOx/C Catalysts ACS Catal. 10 2020 10646 10660 10.1021/acscatal.0c02375 Wang H, Xin H, Cai C, Zhu C, Xiu Z, Liu Q, et al. Selective C3-C4 Keto-Alcohol Production from Cellulose Hydrogenolysis over Ni-WOx/C Catalysts. ACS Catal. 2020; 10: 10646-60. Doi: 10.1021/acscatal.0c02375 [12] L. Fan Y. Zhao L. Chen J. Chen J. Chen H. Yang Selective production of ethylene glycol at high rate via cascade catalysis Nat. Catal. 6 2023 585 595 10.1038/s41929-023-00977-6 Fan L, Zhao Y, Chen L, Chen J, Chen J, Yang H, et al. Selective production of ethylene glycol at high rate via cascade catalysis. Nat Catal. 2023; 6: 585-95. Doi: 10.1038/s41929-023-00977-6 [13] C. Li G. Xu C. Wang L. Ma Y. Qiao Y. Zhang One-pot chemocatalytic transformation of cellulose to ethanol over Ru-WOx/HZSM-5 Green Chem. 21 2019 2234 2239 10.1039/c9gc00719a Li C, Xu G, Wang C, Ma L, Qiao Y, Zhang Y, et al. One-pot chemocatalytic transformation of cellulose to ethanol over Ru-WOx/HZSM-5. Green Chem. 2019; 21: 2234-9. Doi: 10.1039/c9gc00719a [14] A. Fukuoka P.L. Dhepe Catalytic Conversion of Cellulose into Sugar Alcohols Angew. Chem. Int. Ed. 45 2006 5161 5163 10.1002/anie.200601921 Fukuoka A, Dhepe PL. Catalytic Conversion of Cellulose into Sugar Alcohols. Angew Chem Int Ed. 2006;45:5161-3. Doi: 10.1002/anie.200601921 [15] A.R. Mankar A. Modak K.K. Pant High yield synthesis of hexitols and ethylene glycol through one-pot hydrolytic hydrogenation of cellulose Fuel Process. Technol. 218 2021 10.1016/j.fuproc.2021.106847 Mankar AR, Modak A, Pant KK. High yield synthesis of hexitols and ethylene glycol through one-pot hydrolytic hydrogenation of cellulose. Fuel Process Technol. 2021; 218. Doi: 10.1016/j.fuproc.2021.106847 [16] L.S. Ribeiro J.J. Delgado J.J. de Melo Órfão M.F.R. Pereira Direct conversion of cellulose to sorbitol over ruthenium catalysts: Influence of the support Catal. Today 279 2017 244 251 10.1016/j.cattod.2016.05.028 Ribeiro LS, Delgado JJ, de Melo Órfão JJ, Pereira MFR. Direct conversion of cellulose to sorbitol over ruthenium catalysts: Influence of the support. Catal Today. 2017; 279: 244-51. Doi: 10.1016/j.cattod.2016.05.028 [17] N. Ji T. Zhang M. Zheng A. Wang H. Wang X. Wang Direct Catalytic Conversion of Cellulose into Ethylene Glycol Using Nickel‐Promoted Tungsten Carbide Catalysts Angew. Chem. Int. Ed. 47 2008 8510 8513 10.1002/anie.200803233 Ji N, Zhang T, Zheng M, Wang A, Wang H, Wang X, et al. Direct Catalytic Conversion of Cellulose into Ethylene Glycol Using Nickel‐Promoted Tungsten Carbide Catalysts. Angew Chem Int Ed. 2008; 47: 8510-3. Doi: 10.1002/anie.200803233 [18] M.Y. Zheng A.Q. Wang N. Ji J.F. Pang X.D. Wang T. Zhang Transition Metal–Tungsten Bimetallic Catalysts for the Conversion of Cellulose into Ethylene Glycol ChemSusChem 3 2010 63 66 10.1002/cssc.200900197 Zheng MY, Wang AQ, Ji N, Pang JF, Wang XD, Zhang T. Transition Metal–Tungsten Bimetallic Catalysts for the Conversion of Cellulose into Ethylene Glycol. ChemSusChem. 2010; 3: 63-6. Doi: 10.1002/cssc.200900197 [19] G. Zhao M. Zheng A. Wang T. Zhang Catalytic Conversion of Cellulose to Ethylene Glycol over Tungsten Phosphide Catalysts Chin. J. Catal. 31 2010 928 932 10.1016/s1872-2067(10)60104-0 Zhao G, Zheng M, Wang A, Zhang T. Catalytic Conversion of Cellulose to Ethylene Glycol over Tungsten Phosphide Catalysts. Chin J Catal. 2010; 31: 928-32. Doi: 10.1016/s1872-2067(10)60104-0 [20] L.S. Ribeiro J.J.M. Órfão M.F.R. Pereira Insights into the effect of the catalytic functions on selective production of ethylene glycol from lignocellulosic biomass over carbon supported ruthenium and tungsten catalysts Bioresource Technol. 263 2018 402 409 10.1016/j.biortech.2018.05.034 Ribeiro LS, Órfão JJM, Pereira MFR. Insights into the effect of the catalytic functions on selective production of ethylene glycol from lignocellulosic biomass over carbon supported ruthenium and tungsten catalysts. Bioresource Technol.. 2018; 263: 402-9. Doi: 10.1016/j.biortech.2018.05.034 [21] L.S. Ribeiro N. Rey-Raap J.L. Figueiredo J.J. Melo Órfão M.F.R. Pereira Glucose-based carbon materials as supports for the efficient catalytic transformation of cellulose directly to ethylene glycol Cellul. 26 2019 7337 7353 10.1007/s10570-019-02583-x Ribeiro LS, Rey-Raap N, Figueiredo JL, Melo Órfão JJ, Pereira MFR. Glucose-based carbon materials as supports for the efficient catalytic transformation of cellulose directly to ethylene glycol. Cellulose. 2019; 26: 7337-53. Doi: 10.1007/s10570-019-02583-x [22] L.S. Ribeiro A.L.F. Pires J.J.M. Órfão M.F.R. Pereira Paving the way towards an eco- and budget-friendly one-pot catalytic conversion of cellulose and lignocellulosic residues into ethylene glycol over Ni–W/CNT catalysts. Renew Energy 200 2022 1008 1022 10.1016/j.renene.2022.10.026 Ribeiro LS, Pires ALF, Órfão JJdM, Pereira MFR. Paving the way towards an eco- and budget-friendly one-pot catalytic conversion of cellulose and lignocellulosic residues into ethylene glycol over Ni–W/CNT catalysts. Renew Energy. 2022; 200: 1008-22. Doi: 10.1016/j.renene.2022.10.026 [23] M. Gao Z. Li B. Zhao S. Yu L. Huang Q. Wu Nickel‑tungsten co-doped carbon-based catalyst for high selective production of ethylene glycol from cellulose hydrogenolysis Fuel Process. Technol. 247 2023 10.1016/j.fuproc.2023.107816 Gao M, Li Z, Zhao B, Yu S, Huang L, Wu Q. Nickel‑tungsten co-doped carbon-based catalyst for high selective production of ethylene glycol from cellulose hydrogenolysis. Fuel Process Technol. 2023; 247. Doi: 10.1016/j.fuproc.2023.107816 [24] H. Huang L. Chen C. Gu X. Zhang J. Liu Q. Zhang In-situ synthesis of Ru–WOX/biochar catalyst for conversion of cellulose toward ethylene glycol Cellul. 29 2022 8195 8211 10.1007/s10570-022-04794-1 Huang H, Chen L, Gu C, Zhang X, Liu J, Zhang Q, et al. In-situ synthesis of Ru–WOX/biochar catalyst for conversion of cellulose toward ethylene glycol. Cellulose. 2022; 29:8195-211. Doi: 10.1007/s10570-022-04794-1 [25] Z. Xiao Q. Zhang T. Chen C. Cai Q. Ge Y. Nie Nickel–Tungsten Supported on Thin Carbon Coated SiO2 Nanosphere for Cellulose Conversion to Lower Polyols Catal. Lett. 148 2018 3757 3770 10.1007/s10562-018-2582-2 Xiao Z, Zhang Q, Chen T, Cai C, Ge Q, Nie Y, et al. Nickel–Tungsten Supported on Thin Carbon Coated SiO2 Nanosphere for Cellulose Conversion to Lower Polyols. Catal Lett. 2018; 148: 3757-70. Doi: 10.1007/s10562-018-2582-2 [26] G. Liang L. He H. Cheng W. Li X. Li C. Zhang The hydrogenation/dehydrogenation activity of supported Ni catalysts and their effect on hexitols selectivity in hydrolytic hydrogenation of cellulose J. Catal. 309 2014 468 476 10.1016/j.jcat.2013.10.022 Liang G, He L, Cheng H, Li W, Li X, Zhang C, et al. The hydrogenation/dehydrogenation activity of supported Ni catalysts and their effect on hexitols selectivity in hydrolytic hydrogenation of cellulose. J Catal. 2014; 309: 468-76. Doi: 10.1016/j.jcat.2013.10.022 [27] J. Chai S. Zhu Y. Cen J. Guo J. Wang W. Fan Effect of tungsten surface density of WO3–ZrO2 on its catalytic performance in hydrogenolysis of cellulose to ethylene glycol RSC Adv. 7 2017 8567 8574 10.1039/c6ra27524a Chai J, Zhu S, Cen Y, Guo J, Wang J, Fan W. Effect of tungsten surface density of WO3–ZrO2 on its catalytic performance in hydrogenolysis of cellulose to ethylene glycol. RSC Adv. 2017; 7: 8567-74. Doi: 10.1039/c6ra27524a [28] Y. Liu C. Luo H. Liu Tungsten Trioxide Promoted Selective Conversion of Cellulose into Propylene Glycol and Ethylene Glycol on a Ruthenium Catalyst Angew. Chem. Int. Ed. 51 2012 3249 3253 10.1002/anie.201200351 Liu Y, Luo C, Liu H. Tungsten Trioxide Promoted Selective Conversion of Cellulose into Propylene Glycol and Ethylene Glycol on a Ruthenium Catalyst. Angew Chem Int Ed. 2012; 51: 3249-53. Doi: 10.1002/anie.201200351 [29] Y. Cao J. Wang M. Kang Y. Zhu Efficient synthesis of ethylene glycol from cellulose over Ni–WO3/SBA-15 catalysts J. Mol. Catal. A Chem. 381 2014 46 53 10.1016/j.molcata.2013.10.002 Cao Y, Wang J, Kang M, Zhu Y. Efficient synthesis of ethylene glycol from cellulose over Ni–WO3/SBA-15 catalysts. J Mol Catal A: Chem. 2014; 381: 46-53. Doi: 10.1016/j.molcata.2013.10.002 [30] Q. Wu Z. Wang B. Zhao R. Zhao S. Yu L. Huang Nickel-tungsten co-doped biochar catalyst boosting ethylene glycol production from cellulose hydrogenolysis. Ind Crops Prod. 207 2024 10.1016/j.indcrop.2023.117752 Wu Q, Wang Z, Zhao B, Zhao R, Yu S, Huang L. Nickel-tungsten co-doped biochar catalyst boosting ethylene glycol production from cellulose hydrogenolysis. Ind Crops Prod. 2024; 207. Doi: 10.1016/j.indcrop.2023.117752 [31] H. Song P. Wang S. Li W. Deng Y. Li Q. Zhang Direct conversion of cellulose into ethanol catalysed by a combination of tungstic acid and zirconia-supported Pt nanoparticles Chem. Commun. 55 2019 4303 4306 10.1039/c9cc00619b Song H, Wang P, Li S, Deng W, Li Y, Zhang Q, et al. Direct conversion of cellulose into ethanol catalysed by a combination of tungstic acid and zirconia-supported Pt nanoparticles. Chem Commun. 2019; 55: 4303-6. Doi: 10.1039/c9cc00619b [32] Y. Liu W. Zhang H. Liu Unraveling the active states of WO3-based catalysts in the selective conversion of cellulose to glycols Chin. J. Catal. 46 2023 56 63 10.1016/s1872-2067(22)64187-1 Liu Y, Zhang W, Liu H. Unraveling the active states of WO3-based catalysts in the selective conversion of cellulose to glycols. Chin J Catal. 2023; 46: 56-63. Doi: 10.1016/s1872-2067(22)64187-1 [33] A. Bergmann C.B. Roldan Operando Insights into Nanoparticle Transformations during Catalysis ACS Catal. 9 2019 10020 10043 10.1021/acscatal.9b01831 Bergmann A, Roldan Cuenya B. Operando Insights into Nanoparticle Transformations during Catalysis. ACS Catal. 2019; 9: 10020-43. Doi: 10.1021/acscatal.9b01831 [34] W. Liao M. Yue J. Chen Z. Wang J. Ding Y. Xu Decoupling the Interfacial Catalysis of CeO2-Supported Rh Catalysts Tuned by CeO2 Morphology and Rh Particle Size in CO2 Hydrogenation ACS Catal. 13 2023 5767 5779 10.1021/acscatal.3c00512 Liao W, Yue M, Chen J, Wang Z, Ding J, Xu Y, et al. Decoupling the Interfacial Catalysis of CeO2-Supported Rh Catalysts Tuned by CeO2 Morphology and Rh Particle Size in CO2 Hydrogenation. ACS Catal. 2023;13:5767-79. Doi: 10.1021/acscatal.3c00512 [35] Z. Cai J. Dai W. Li K.B. Tan Z. Huang G. Zhan Pd Supported on MIL-68(In)-Derived In2O3 Nanotubes as Superior Catalysts to Boost CO2 Hydrogenation to Methanol ACS Catal. 10 2020 13275 13289 10.1021/acscatal.0c03372 Cai Z, Dai J, Li W, Tan KB, Huang Z, Zhan G, et al. Pd Supported on MIL-68(In)-Derived In2O3 Nanotubes as Superior Catalysts to Boost CO2 Hydrogenation to Methanol. ACS Catal. 2020; 10: 13275-89. Doi: 10.1021/acscatal.0c03372 [36] Z. Wang C. Zhu Z. Ni H. Hojo H. Einaga Enhanced Photocatalytic Benzene Oxidation to Phenol over Monoclinic WO3 Nanorods under Visible Light ACS Catal. 12 2022 14976 14989 10.1021/acscatal.2c03832 Wang Z, Zhu C, Ni Z, Hojo H, Einaga H. Enhanced Photocatalytic Benzene Oxidation to Phenol over Monoclinic WO3 Nanorods under Visible Light. ACS Catal. 2022; 12: 14976-89. Doi: 10.1021/acscatal.2c03832 [37] J. Zhang Z. Liu Z. Liu Novel WO3/Sb2S3 Heterojunction Photocatalyst Based on WO3 of Different Morphologies for Enhanced Efficiency in Photoelectrochemical Water Splitting ACS Appl. Mater. Interfaces 8 2016 9684 9691 10.1021/acsami.6b00429 Zhang J, Liu Z, Liu Z. Novel WO3/Sb2S3 Heterojunction Photocatalyst Based on WO3 of Different Morphologies for Enhanced Efficiency in Photoelectrochemical Water Splitting. ACS Appl Mater Interfaces. 2016; 8: 9684-91. Doi: 10.1021/acsami.6b00429 [38] W.A. Ali G. Bharath P.P. Morajkar A.V. Salkar M.A. Haija F. Banat Morphology-dependent catalytic activity of tungsten trioxide (WO3) nanostructures for hydrogenation of furfural to furfuryl alcohol J. Phys. D Appl. Phys. 54 2021 10.1088/1361-6463/abfad6 Ali WA, Bharath G, Morajkar PP, Salkar AV, Haija MA, Banat F. Morphology-dependent catalytic activity of tungsten trioxide (WO3) nanostructures for hydrogenation of furfural to furfuryl alcohol. J Phys D: Appl Phys. 2021; 54. Doi: 10.1088/1361-6463/abfad6 [39] G. Porwal S. Gupta S. Sreedhala J. Elizabeth T.S. Khan M.A. Haider Mechanistic Insights into the Pathways of Phenol Hydrogenation on Pd Nanostructures ACS Sustain. Chem. Eng. 7 2019 17126 17136 10.1021/acssuschemeng.9b03392 Porwal G, Gupta S, Sreedhala S, Elizabeth J, Khan TS, Haider MA, et al. Mechanistic Insights into the Pathways of Phenol Hydrogenation on Pd Nanostructures. ACS Sustain. Chem. Eng.. 2019; 7: 17126-36. Doi: 10.1021/acssuschemeng.9b03392 [40] G.F. Leal S.F. Moya D.M. Meira D.H. Barrett E. Teixeira-Neto A.A.S. Curvelo Promotion effects of Pd on tungsten carbide catalysts: physiochemical properties and cellulose conversion performance RSC Adv. 6 2016 87756 87766 10.1039/c6ra15819f Leal GF, Moya SF, Meira DM, Barrett DH, Teixeira-Neto E, Curvelo AAS, et al. Promotion effects of Pd on tungsten carbide catalysts: physiochemical properties and cellulose conversion performance. RSC Adv. 2016; 6: 87756-66. Doi: 10.1039/c6ra15819f [41] H. Li G. Wu J. Wu J. Shen L. Chen J. Zhang Ultrathin WO3 Nanosheets/Pd with Strong Metal–Support Interactions for Highly Sensitive and Selective Detection of Mustard-Gas Simulants ACS Sens. 9 2024 3773 3782 10.1021/acssensors.4c01002 Li H, Wu G, Wu J, Shen J, Chen L, Zhang J, et al. Ultrathin WO3 Nanosheets/Pd with Strong Metal–Support Interactions for Highly Sensitive and Selective Detection of Mustard-Gas Simulants. ACS Sens.. 2024; 9: 3773-82. Doi: 10.1021/acssensors.4c01002 [42] D. Chu Z. Luo Y. Xin C. Jiang S. Gao Z. Wang One-pot hydrogenolysis of cellulose to bioethanol over Pd-Cu-WOx/SiO2 catalysts Fuel 292 2021 10.1016/j.fuel.2021.120311 Chu D, Luo Z, Xin Y, Jiang C, Gao S, Wang Z, et al. One-pot hydrogenolysis of cellulose to bioethanol over Pd-Cu-WOx/SiO2 catalysts. Fuel. 2021; 292. Doi: 10.1016/j.fuel.2021.120311 [43] P. Verma A. Singh F.A. Rahimi P. Sarkar S. Nath S.K. Pati Charge-transfer regulated visible light driven photocatalytic H2 production and CO2 reduction in tetrathiafulvalene based coordination polymer gel Nat. Commun. 12 2021 10.1038/s41467-021-27457-4 Verma P, Singh A, Rahimi FA, Sarkar P, Nath S, Pati SK, et al. Charge-transfer regulated visible light driven photocatalytic H2 production and CO2 reduction in tetrathiafulvalene based coordination polymer gel. Nat Commun. 2021; 12. Doi: 10.1038/s41467-021-27457-4 [44] Z. Liu X. Gao G. Song Synergy of ultra-low-loaded ruthenium with alumina stimulating the catalytic hydrogenation of levulinic acid into γ-valerolactone. Chem Eng J. 470 2023 10.1016/j.cej.2023.143869 Liu Z, Gao X, Song G. Synergy of ultra-low-loaded ruthenium with alumina stimulating the catalytic hydrogenation of levulinic acid into γ-valerolactone. Chem Eng J. 2023; 470. Doi: 10.1016/j.cej.2023.143869 [45] P. Wattanapaphawong P. Reubroycharoen A. Yamaguchi Conversion of cellulose into lactic acid using zirconium oxide catalysts RSC Adv. 7 2017 18561 18568 10.1039/c6ra28568f Wattanapaphawong P, Reubroycharoen P, Yamaguchi A. Conversion of cellulose into lactic acid using zirconium oxide catalysts. RSC Adv. 2017;7:18561-8. Doi: 10.1039/c6ra28568f [46] P. Wang H. Yu S. Zhan S. Wang Catalytic hydrolysis of lignocellulosic biomass into 5-hydroxymethylfurfural in ionic liquid Bioresour. Technol. 102 2011 4179 4183 10.1016/j.biortech.2010.12.073 Wang P, Yu H, Zhan S, Wang S. Catalytic hydrolysis of lignocellulosic biomass into 5-hydroxymethylfurfural in ionic liquid. Bioresour Technol. 2011; 102: 4179–83. Doi: 10.1016/j.biortech.2010.12.073 [47] B. Rekha R. Saravanathamizhan Catalytic conversion of corncob biomass into bioethanol Int. J. Energy Res. 45 2020 4508 4518 10.1002/er.6119 Rekha B, Saravanathamizhan R. Catalytic conversion of corncob biomass into bioethanol. Int J Energy Res. 2020; 45: 4508-18. Doi: 10.1002/er.6119 [48] Y. Shi L. Wang M. Wu F. Wang Order-of-magnitude increase in rate of methane dry reforming over Ni/CeO2-SiC catalysts by microwave catalysis Appl. Catal. B Environ. 337 2023 122927 10.1016/j.apcatb.2023.122927 Shi Y, Wang L, Wu M, Wang F. Order-of-magnitude increase in rate of methane dry reforming over Ni/CeO2-SiC catalysts by microwave catalysis. Appl Catal B Environ. 2023; 337: 122927. Doi: 10.1016/j.apcatb.2023.122927 [49] D. Nunes A.R. Fragoso T. Freire M. Matias A.C. Marques R.F.P. Martins Ultrafast Microwave Synthesis of WO3 Nanostructured Films for Solar Photocatalysis Phys. Status Solidi RRL 15 2021 2100196 10.1002/pssr.202100196 Nunes D, Fragoso AR, Freire T, Matias M, Marques AC, Martins RFdP, et al. Ultrafast Microwave Synthesis of WO3 Nanostructured Films for Solar Photocatalysis. Phys Status Solidi RRL. 2021; 15: 2100196. Doi: 10.1002/pssr.202100196 [50] D. Nagy T. Firkala E. Drotár Á. Szegedi K. László I.M. Szilágyi Photocatalytic WO3/TiO2 nanowires: WO3 polymorphs influencing the atomic layer deposition of TiO2 RSC Adv. 6 2016 95369 95377 10.1039/c6ra18899k Nagy D, Firkala T, Drotár E, Szegedi Á, László K, Szilágyi IM. Photocatalytic WO3/TiO2 nanowires: WO3 polymorphs influencing the atomic layer deposition of TiO2. RSC Adv. 2016; 6: 95369-77. Doi: 10.1039/c6ra18899k [51] H. Li Q. Shen H. Zhang J. Gao H. Jia X. Liu Oxygen vacancy-mediated WO3 phase junction to steering photogenerated charge separation for enhanced water splitting J. Adv. Ceram. 11 2022 1873 1888 10.1007/s40145-022-0653-8 Li H, Shen Q, Zhang H, Gao J, Jia H, Liu X, et al. Oxygen vacancy-mediated WO3 phase junction to steering photogenerated charge separation for enhanced water splitting. J Adv Ceram. 2022; 11: 1873-88. Doi: 10.1007/s40145-022-0653-8 [52] H. Kong H. Yang J.S. Park W.S. Chae H.Y. Kim J. Park Spatial Control of Oxygen Vacancy Concentration in Monoclinic WO3 Photoanodes for Enhanced Solar Water Splitting Adv. Funct. Mater. 32 2022 2204106 10.1002/adfm.202204106 Kong H, Yang H, Park JS, Chae WS, Kim HY, Park J, et al. Spatial Control of Oxygen Vacancy Concentration in Monoclinic WO3 Photoanodes for Enhanced Solar Water Splitting. Adv Funct Mater. 2022; 32: 2204106. Doi: 10.1002/adfm.202204106 [53] Y. Ye H. Bai M. Li Z. Tian R. Du W. Fan Construction of Sensitive Surface‐Enhanced Raman Spectroscopy Chip with Sub-Nanometer WO3−x Nanowire‐Based Superstructures for Multicomponent Detection Adv. Mater. Technol. 4 2019 1900282 10.1002/admt.201900282 Ye Y, Bai H, Li M, Tian Z, Du R, Fan W, et al. Construction of Sensitive Surface‐Enhanced Raman Spectroscopy Chip with Sub-Nanometer WO3−x Nanowire‐Based Superstructures for Multicomponent Detection. Adv Mater Technol. 2019; 4: 1900282. Doi: 10.1002/admt.201900282 [54] C. Shen K. Sun R. Zou Q. Wu D. Mei C.-j. Liu CO2 Hydrogenation to Methanol on Indium Oxide-Supported Rhenium Catalysts: The Effects of Size ACS Catal. 12 2022 12658 12669 10.1021/acscatal.2c03709 Shen C, Sun K, Zou R, Wu Q, Mei D, Liu C-j. CO2 Hydrogenation to Methanol on Indium Oxide-Supported Rhenium Catalysts: The Effects of Size. ACS Catal. 2022; 12: 12658-69. Doi: 10.1021/acscatal.2c03709 [55] P. Yi Y. Song Z. Liu P. Xie G. Liang R. Liu Boosting alkaline urea oxidation with a nickel sulfide/cobalt oxide heterojunction catalyst via interface engineering Adv. Compos. Hybrid Mater. 6 2023 228 10.1007/s42114-023-00810-5 Yi P, Song Y, Liu Z, Xie P, Liang G, Liu R, et al. Boosting alkaline urea oxidation with a nickel sulfide/cobalt oxide heterojunction catalyst via interface engineering. Adv Compos Hybrid Mater 2023; 6: 228. Doi: 10.1007/s42114-023-00810-5 [56] A. Modak D. Gill A.R. Mankar K.K. Pant V. Bhasin C. Nayak Controlled synthesis of Ru-single-atoms on ordered mesoporous phosphine polymers for microwave-assisted conversion of biomass-derived sugars to artificial sweeteners Nanoscale 14 2022 15875 15888 10.1039/d2nr03645b Modak A, Gill D, Mankar AR, Pant KK, Bhasin V, Nayak C, et al. Controlled synthesis of Ru-single-atoms on ordered mesoporous phosphine polymers for microwave-assisted conversion of biomass-derived sugars to artificial sweeteners. Nanoscale. 2022; 14: 15875-88. Doi: 10.1039/d2nr03645b [57] A. Modak D. Gill K. Sharma V. Bhasin K.K. Pant S.N. Jha Facile Hydrogenolysis of Sugars to 1,2-Glycols by Ru@PPh3/OPPh3 Confined Large-Pore Mesoporous Silica Chem. A Eur. J. 14 2023 10832 10846 10.1021/acs.jpclett.3c02740 Modak A, Gill D, Sharma K, Bhasin V, Pant KK, Jha SN, et al. Facile Hydrogenolysis of Sugars to 1,2-Glycols by Ru@PPh3/OPPh3 Confined Large-Pore Mesoporous Silica. J Phys Chem A 2023; 14: 10832-46. Doi: 10.1021/acs.jpclett.3c02740 [58] Y. Hu X. Ping Y. Zhang L. Hao T. Liu Q. Zhao A nanotree-like WO3 film with adjustable defect concentration and its photocatalytic activity Mater. Sci. Semicond. Process. 127 2021 105737 10.1016/j.mssp.2021.105737 Hu Y, Ping X, Zhang Y, Hao L, Liu T, Zhao Q, et al. A nanotree-like WO3 film with adjustable defect concentration and its photocatalytic activity. Mater Sci Semicond Process. 2021; 127: 105737. Doi: 10.1016/j.mssp.2021.105737 [59] X. Fan C. Liu B. Gao H. Li Y. Zhang H. Zhang Electronic Structure Engineering of Pt Species over Pt/WO3 toward Highly Efficient Electrocatalytic Hydrogen Evolution Small 19 2023 2301178 10.1002/smll.202301178 Fan X, Liu C, Gao B, Li H, Zhang Y, Zhang H, et al. Electronic Structure Engineering of Pt Species over Pt/WO3 toward Highly Efficient Electrocatalytic Hydrogen Evolution. Small 2023; 19: 2301178. Doi: 10.1002/smll.202301178 [60] W. Zhang B. Huang K. Wang W. Yang F. Lv N. Li WOx‐Surface Decorated PtNi@Pt Dendritic Nanowires as Efficient pH‐Universal Hydrogen Evolution Electrocatalysts Adv. Energy Mater. 11 2020 2003192 10.1002/aenm.202003192 Zhang W, Huang B, Wang K, Yang W, Lv F, Li N, et al. WOx‐Surface Decorated PtNi@Pt Dendritic Nanowires as Efficient pH‐Universal Hydrogen Evolution Electrocatalysts. Adv Energy Mater. 2020; 11: 2003192. Doi: 10.1002/aenm.202003192 [61] N. Xue R.-J. Yu C.-Z. Yuan X. Xie Y.-F. Jiang H.-Y. Zhou In situ redox deposition of palladium nanoparticles on oxygen-deficient tungsten oxide as efficient hydrogenation catalysts RSC Adv. 7 2017 2351 2357 10.1039/c6ra26267h Xue N, Yu R-J, Yuan C-Z, Xie X, Jiang Y-F, Zhou H-Y, et al. In situ redox deposition of palladium nanoparticles on oxygen-deficient tungsten oxide as efficient hydrogenation catalysts. RSC Adv. 2017; 7: 2351-7. Doi: 10.1039/c6ra26267h [62] Y. Wu Y. Tong H. Liang J. Peng X.-K. Gu M. Ding Pd nanoparticles encapsulated in MOF boosts selective hydrogenation of biomass derived compound under mild conditions Chem. Eng. J. 460 2023 141779 10.1016/j.cej.2023.141779 Wu Y, Tong Y, Liang H, Peng J, Gu X-K, Ding M. Pd nanoparticles encapsulated in MOF boosts selective hydrogenation of biomass derived compound under mild conditions. Chem Eng J. 2023; 460: 141779. Doi: 10.1016/j.cej.2023.141779 [63] X. Zhao Y. Liu J. Deng P. Xu J. Yang K. Zhang Mesoporous Pd Pt alloys: High-performance catalysts for methane combustion Mol. Catal. 442 2017 191 201 10.1016/j.mcat.2017.09.002 Zhao X, Liu Y, Deng J, Xu P, Yang J, Zhang K, et al. Mesoporous Pd Pt alloys: High-performance catalysts for methane combustion. Mol Catal. 2017; 442: 191-201. Doi: 10.1016/j.mcat.2017.09.002 [64] W. Yang F. Polo-Garzon H. Zhou Z. Huang M. Chi H. Meyer Boosting the Activity of Pd Single Atoms by Tuning Their Local Environment on Ceria for Methane Combustion Angew. Chem. Int. Ed. 62 2022 10.1002/anie.202217323 Yang W, Polo‐Garzon F, Zhou H, Huang Z, Chi M, Meyer H, et al. Boosting the Activity of Pd Single Atoms by Tuning Their Local Environment on Ceria for Methane Combustion. Angew Chem Int Ed. 2022; 62. Doi: 10.1002/anie.202217323 [65] H. Yu T. Zhou Z. Wang Y. Xu X. Li L. Wang Defect‐Rich Porous Palladium Metallene for Enhanced Alkaline Oxygen Reduction Electrocatalysis Angew. Chem. Int. Ed. 60 2021 12027 12031 10.1002/anie.202101019 Yu H, Zhou T, Wang Z, Xu Y, Li X, Wang L, et al. Defect‐Rich Porous Palladium Metallene for Enhanced Alkaline Oxygen Reduction Electrocatalysis. Angew Chem Int Ed. 2021; 60: 12027-31. Doi: 10.1002/anie.202101019 [66] X. Yang Z. Li M. Guo T. Zhao X. Su W. Jiang Synergistic effects of WO3 and NiCu bimetals for the One-Pot conversion of cellulose into ethylene glycol Fuel 341 2023 127560 10.1016/j.fuel.2023.127560 Yang X, Li Z, Guo M, Zhao T, Su X, Jiang W, et al. Synergistic effects of WO3 and NiCu bimetals for the One-Pot conversion of cellulose into ethylene glycol. Fuel. 2023; 341: 127560. Doi: 10.1016/j.fuel.2023.127560 [67] H. Tian X. Yu W. Huang Z. Chang F. Pei J. Zhou WO3‐Assisted Synergetic Effect Catalyzes Efficient and CO‐Tolerant Hydrogen Oxidation for PEMFCs Small 19 2023 2303061 10.1002/smll.202303061 Tian H, Yu X, Huang W, Chang Z, Pei F, Zhou J, et al. WO3‐Assisted Synergetic Effect Catalyzes Efficient and CO‐Tolerant Hydrogen Oxidation for PEMFCs. Small. 2023; 19: 2303061. Doi: 10.1002/smll.202303061 [68] N. Enjamuri S. Darbha Advances in catalytic conversion of lignocellulosic biomass to ethylene glycol Cat. Rev. - Sci. Eng. 2022 1 71 10.1080/01614940.2022.2111070 Enjamuri N, Darbha S. Advances in catalytic conversion of lignocellulosic biomass to ethylene glycol. Cat Rev - Sci Eng. 2022: 1-71. Doi: 10.1080/01614940.2022.2111070 [69] Y. Liu W. Zhang C. Hao S. Wang H. Liu Unveiling the mechanism for selective cleavage of C-C bonds in sugar reactions on tungsten trioxide–based catalysts PNAS 119 2022 10.1073/pnas.2206399119 e2206399119 Liu Y, Zhang W, Hao C, Wang S, Liu H. Unveiling the mechanism for selective cleavage of C-C bonds in sugar reactions on tungsten trioxide–based catalysts. Proc Natl Acad Sci USA. 2022; 119: e2206399119. Doi: 10.1073/pnas.2206399119",
      "scopus-id": "85210054864",
      "coredata": {
        "eid": "1-s2.0-S0021951724005736",
        "dc:description": "Converting cellulose into C2 alcohols presents a sustainable alternative to fossil fuels, contributing to the development of eco-friendly and economically viable biofuels and chemicals. Tungsten oxide (WO3) is a key solid acid catalyst for this process, yet limited research explores its diverse morphologies and unique catalytic effects. This study investigates diverse WO3 morphologies (nanosheets, nanoflowers, nanoblocks, and tetrahedral octahedra) in combination with Pd for converting cellulose to C2 alcohols. Optimized conditions with Pd/o-WO3 catalyst resulted in the highest C2 alcohols (ethylene glycol and ethanol, 80.9 %), notably yielding 64.8 % ethylene glycol. Extensive characterizations and DFT calculations reveal the smaller element occupancy rates and a longer W-O bond length led to a large number of crystal defects over Pd/o-WO3. It facilitated the formation of W5+–OH sites and Pd-O(H)-W interactions, further synergistically enhancing hydrogenation ability and acidity. Designed experiments to elucidate cellulose conversion pathways, including hydrolysis, retro-aldol condensation, and hydrogenation. This study emphasizes the unique impact of WO3 morphologies and underscores the importance of supporting crystal defects for catalytic performance in eco-friendly biofuel and chemical production.",
        "openArchiveArticle": "false",
        "prism:coverDate": "2025-02-28",
        "openaccessUserLicense": null,
        "prism:aggregationType": "Journal",
        "prism:url": "https://api.elsevier.com/content/article/pii/S0021951724005736",
        "dc:creator": [
          {
            "@_fa": "true",
            "$": "Jia, Wei"
          },
          {
            "@_fa": "true",
            "$": "Liu, Wengang"
          },
          {
            "@_fa": "true",
            "$": "Cui, Yuandong"
          },
          {
            "@_fa": "true",
            "$": "Song, Hang"
          },
          {
            "@_fa": "true",
            "$": "Zhou, Chengfeng"
          },
          {
            "@_fa": "true",
            "$": "Jiang, Wei"
          },
          {
            "@_fa": "true",
            "$": "Ben, Haoxi"
          },
          {
            "@_fa": "true",
            "$": "Yang, Xiaoli"
          },
          {
            "@_fa": "true",
            "$": "Chen, De"
          }
        ],
        "link": [
          {
            "@_fa": "true",
            "@rel": "self",
            "@href": "https://api.elsevier.com/content/article/pii/S0021951724005736"
          },
          {
            "@_fa": "true",
            "@rel": "scidir",
            "@href": "https://www.sciencedirect.com/science/article/pii/S0021951724005736"
          }
        ],
        "dc:format": "application/json",
        "openaccessType": null,
        "pii": "S0021-9517(24)00573-6",
        "prism:volume": "442",
        "articleNumber": "115860",
        "prism:publisher": "Elsevier Inc. All rights are reserved, including those for text and data mining, AI training, and similar technologies.",
        "dc:title": "Crystal defects Boost cellulose conversion to C2 alcohols over Pd/WO3 catalysts",
        "prism:copyright": "© 2024 Elsevier Inc. All rights are reserved, including those for text and data mining, AI training, and similar technologies.",
        "openaccess": "0",
        "prism:issn": "00219517",
        "dcterms:subject": [
          {
            "@_fa": "true",
            "$": "Cellulose conversion"
          },
          {
            "@_fa": "true",
            "$": "Tungsten trioxide"
          },
          {
            "@_fa": "true",
            "$": "Morphological impact"
          },
          {
            "@_fa": "true",
            "$": "Crystal defects"
          },
          {
            "@_fa": "true",
            "$": "Alcohols"
          }
        ],
        "openaccessArticle": "false",
        "prism:publicationName": "Journal of Catalysis",
        "openaccessSponsorType": null,
        "prism:pageRange": "115860",
        "pubType": "fla",
        "prism:coverDisplayDate": "February 2025",
        "prism:doi": "10.1016/j.jcat.2024.115860",
        "prism:startingPage": "115860",
        "dc:identifier": "doi:10.1016/j.jcat.2024.115860",
        "openaccessSponsorName": null
      },
      "objects": {
        "object": [
          {
            "@category": "standard",
            "@height": "676",
            "@width": "711",
            "@_fa": "true",
            "$": "https://api.elsevier.com/content/object/eid/1-s2.0-S0021951724005736-gr4.jpg?httpAccept=%2A%2F%2A",
            "@multimediatype": "JPEG image file",
            "@type": "IMAGE-DOWNSAMPLED",
            "@size": "182365",
            "@ref": "gr4",
            "@mimetype": "image/jpeg"
          },
          {
            "@category": "standard",
            "@height": "499",
            "@width": "667",
            "@_fa": "true",
            "$": "https://api.elsevier.com/content/object/eid/1-s2.0-S0021951724005736-gr5.jpg?httpAccept=%2A%2F%2A",
            "@multimediatype": "JPEG image file",
            "@type": "IMAGE-DOWNSAMPLED",
            "@size": "72038",
            "@ref": "gr5",
            "@mimetype": "image/jpeg"
          },
          {
            "@category": "standard",
            "@height": "725",
            "@width": "533",
            "@_fa": "true",
            "$": "https://api.elsevier.com/content/object/eid/1-s2.0-S0021951724005736-gr2.jpg?httpAccept=%2A%2F%2A",
            "@multimediatype": "JPEG image file",
            "@type": "IMAGE-DOWNSAMPLED",
            "@size": "127327",
            "@ref": "gr2",
            "@mimetype": "image/jpeg"
          },
          {
            "@category": "standard",
            "@height": "200",
            "@width": "400",
            "@_fa": "true",
            "$": "https://api.elsevier.com/content/object/eid/1-s2.0-S0021951724005736-ga1.jpg?httpAccept=%2A%2F%2A",
            "@multimediatype": "JPEG image file",
            "@type": "IMAGE-DOWNSAMPLED",
            "@size": "27062",
            "@ref": "ga1",
            "@mimetype": "image/jpeg"
          },
          {
            "@category": "standard",
            "@height": "371",
            "@width": "711",
            "@_fa": "true",
            "$": "https://api.elsevier.com/content/object/eid/1-s2.0-S0021951724005736-gr3.jpg?httpAccept=%2A%2F%2A",
            "@multimediatype": "JPEG image file",
            "@type": "IMAGE-DOWNSAMPLED",
            "@size": "74954",
            "@ref": "gr3",
            "@mimetype": "image/jpeg"
          },
          {
            "@category": "standard",
            "@height": "428",
            "@width": "778",
            "@_fa": "true",
            "$": "https://api.elsevier.com/content/object/eid/1-s2.0-S0021951724005736-gr6.jpg?httpAccept=%2A%2F%2A",
            "@multimediatype": "JPEG image file",
            "@type": "IMAGE-DOWNSAMPLED",
            "@size": "86709",
            "@ref": "gr6",
            "@mimetype": "image/jpeg"
          },
          {
            "@category": "standard",
            "@height": "648",
            "@width": "667",
            "@_fa": "true",
            "$": "https://api.elsevier.com/content/object/eid/1-s2.0-S0021951724005736-gr7.jpg?httpAccept=%2A%2F%2A",
            "@multimediatype": "JPEG image file",
            "@type": "IMAGE-DOWNSAMPLED",
            "@size": "73861",
            "@ref": "gr7",
            "@mimetype": "image/jpeg"
          },
          {
            "@category": "standard",
            "@height": "191",
            "@width": "533",
            "@_fa": "true",
            "$": "https://api.elsevier.com/content/object/eid/1-s2.0-S0021951724005736-gr1.jpg?httpAccept=%2A%2F%2A",
            "@multimediatype": "JPEG image file",
            "@type": "IMAGE-DOWNSAMPLED",
            "@size": "26733",
            "@ref": "gr1",
            "@mimetype": "image/jpeg"
          },
          {
            "@category": "thumbnail",
            "@height": "163",
            "@width": "172",
            "@_fa": "true",
            "$": "https://api.elsevier.com/content/object/eid/1-s2.0-S0021951724005736-gr4.sml?httpAccept=%2A%2F%2A",
            "@multimediatype": "GIF image file",
            "@type": "IMAGE-THUMBNAIL",
            "@size": "17723",
            "@ref": "gr4",
            "@mimetype": "image/gif"
          },
          {
            "@category": "thumbnail",
            "@height": "164",
            "@width": "219",
            "@_fa": "true",
            "$": "https://api.elsevier.com/content/object/eid/1-s2.0-S0021951724005736-gr5.sml?httpAccept=%2A%2F%2A",
            "@multimediatype": "GIF image file",
            "@type": "IMAGE-THUMBNAIL",
            "@size": "10941",
            "@ref": "gr5",
            "@mimetype": "image/gif"
          },
          {
            "@category": "thumbnail",
            "@height": "163",
            "@width": "120",
            "@_fa": "true",
            "$": "https://api.elsevier.com/content/object/eid/1-s2.0-S0021951724005736-gr2.sml?httpAccept=%2A%2F%2A",
            "@multimediatype": "GIF image file",
            "@type": "IMAGE-THUMBNAIL",
            "@size": "15450",
            "@ref": "gr2",
            "@mimetype": "image/gif"
          },
          {
            "@category": "thumbnail",
            "@height": "110",
            "@width": "219",
            "@_fa": "true",
            "$": "https://api.elsevier.com/content/object/eid/1-s2.0-S0021951724005736-ga1.sml?httpAccept=%2A%2F%2A",
            "@multimediatype": "GIF image file",
            "@type": "IMAGE-THUMBNAIL",
            "@size": "15820",
            "@ref": "ga1",
            "@mimetype": "image/gif"
          },
          {
            "@category": "thumbnail",
            "@height": "114",
            "@width": "219",
            "@_fa": "true",
            "$": "https://api.elsevier.com/content/object/eid/1-s2.0-S0021951724005736-gr3.sml?httpAccept=%2A%2F%2A",
            "@multimediatype": "GIF image file",
            "@type": "IMAGE-THUMBNAIL",
            "@size": "10279",
            "@ref": "gr3",
            "@mimetype": "image/gif"
          },
          {
            "@category": "thumbnail",
            "@height": "120",
            "@width": "219",
            "@_fa": "true",
            "$": "https://api.elsevier.com/content/object/eid/1-s2.0-S0021951724005736-gr6.sml?httpAccept=%2A%2F%2A",
            "@multimediatype": "GIF image file",
            "@type": "IMAGE-THUMBNAIL",
            "@size": "10613",
            "@ref": "gr6",
            "@mimetype": "image/gif"
          },
          {
            "@category": "thumbnail",
            "@height": "164",
            "@width": "169",
            "@_fa": "true",
            "$": "https://api.elsevier.com/content/object/eid/1-s2.0-S0021951724005736-gr7.sml?httpAccept=%2A%2F%2A",
            "@multimediatype": "GIF image file",
            "@type": "IMAGE-THUMBNAIL",
            "@size": "7967",
            "@ref": "gr7",
            "@mimetype": "image/gif"
          },
          {
            "@category": "thumbnail",
            "@height": "79",
            "@width": "219",
            "@_fa": "true",
            "$": "https://api.elsevier.com/content/object/eid/1-s2.0-S0021951724005736-gr1.sml?httpAccept=%2A%2F%2A",
            "@multimediatype": "GIF image file",
            "@type": "IMAGE-THUMBNAIL",
            "@size": "6156",
            "@ref": "gr1",
            "@mimetype": "image/gif"
          },
          {
            "@category": "high",
            "@height": "2993",
            "@width": "3150",
            "@_fa": "true",
            "$": "https://api.elsevier.com/content/object/eid/1-s2.0-S0021951724005736-gr4_lrg.jpg?httpAccept=%2A%2F%2A",
            "@multimediatype": "JPEG image file",
            "@type": "IMAGE-HIGH-RES",
            "@size": "1374693",
            "@ref": "gr4",
            "@mimetype": "image/jpeg"
          },
          {
            "@category": "high",
            "@height": "2208",
            "@width": "2953",
            "@_fa": "true",
            "$": "https://api.elsevier.com/content/object/eid/1-s2.0-S0021951724005736-gr5_lrg.jpg?httpAccept=%2A%2F%2A",
            "@multimediatype": "JPEG image file",
            "@type": "IMAGE-HIGH-RES",
            "@size": "366506",
            "@ref": "gr5",
            "@mimetype": "image/jpeg"
          },
          {
            "@category": "high",
            "@height": "3212",
            "@width": "2362",
            "@_fa": "true",
            "$": "https://api.elsevier.com/content/object/eid/1-s2.0-S0021951724005736-gr2_lrg.jpg?httpAccept=%2A%2F%2A",
            "@multimediatype": "JPEG image file",
            "@type": "IMAGE-HIGH-RES",
            "@size": "833444",
            "@ref": "gr2",
            "@mimetype": "image/jpeg"
          },
          {
            "@category": "high",
            "@height": "886",
            "@width": "1772",
            "@_fa": "true",
            "$": "https://api.elsevier.com/content/object/eid/1-s2.0-S0021951724005736-ga1_lrg.jpg?httpAccept=%2A%2F%2A",
            "@multimediatype": "JPEG image file",
            "@type": "IMAGE-HIGH-RES",
            "@size": "145630",
            "@ref": "ga1",
            "@mimetype": "image/jpeg"
          },
          {
            "@category": "high",
            "@height": "1642",
            "@width": "3150",
            "@_fa": "true",
            "$": "https://api.elsevier.com/content/object/eid/1-s2.0-S0021951724005736-gr3_lrg.jpg?httpAccept=%2A%2F%2A",
            "@multimediatype": "JPEG image file",
            "@type": "IMAGE-HIGH-RES",
            "@size": "427048",
            "@ref": "gr3",
            "@mimetype": "image/jpeg"
          },
          {
            "@category": "high",
            "@height": "1893",
            "@width": "3445",
            "@_fa": "true",
            "$": "https://api.elsevier.com/content/object/eid/1-s2.0-S0021951724005736-gr6_lrg.jpg?httpAccept=%2A%2F%2A",
            "@multimediatype": "JPEG image file",
            "@type": "IMAGE-HIGH-RES",
            "@size": "477723",
            "@ref": "gr6",
            "@mimetype": "image/jpeg"
          },
          {
            "@category": "high",
            "@height": "2867",
            "@width": "2953",
            "@_fa": "true",
            "$": "https://api.elsevier.com/content/object/eid/1-s2.0-S0021951724005736-gr7_lrg.jpg?httpAccept=%2A%2F%2A",
            "@multimediatype": "JPEG image file",
            "@type": "IMAGE-HIGH-RES",
            "@size": "365478",
            "@ref": "gr7",
            "@mimetype": "image/jpeg"
          },
          {
            "@category": "high",
            "@height": "848",
            "@width": "2362",
            "@_fa": "true",
            "$": "https://api.elsevier.com/content/object/eid/1-s2.0-S0021951724005736-gr1_lrg.jpg?httpAccept=%2A%2F%2A",
            "@multimediatype": "JPEG image file",
            "@type": "IMAGE-HIGH-RES",
            "@size": "134985",
            "@ref": "gr1",
            "@mimetype": "image/jpeg"
          },
          {
            "@category": "standard",
            "@_fa": "true",
            "$": "https://api.elsevier.com/content/object/eid/1-s2.0-S0021951724005736-mmc1.docx?httpAccept=%2A%2F%2A",
            "@multimediatype": "Microsoft Word file",
            "@type": "APPLICATION",
            "@size": "2636621",
            "@ref": "mmc1",
            "@mimetype": "application/word"
          },
          {
            "@category": "thumbnail",
            "@_fa": "true",
            "$": "https://api.elsevier.com/content/object/eid/1-s2.0-S0021951724005736-si1.svg?httpAccept=%2A%2F%2A",
            "@multimediatype": "Scalable Vector Graphics file",
            "@type": "ALTIMG",
            "@size": "23921",
            "@ref": "si1",
            "@mimetype": "image/svg+xml"
          },
          {
            "@category": "thumbnail",
            "@_fa": "true",
            "$": "https://api.elsevier.com/content/object/eid/1-s2.0-S0021951724005736-si2.svg?httpAccept=%2A%2F%2A",
            "@multimediatype": "Scalable Vector Graphics file",
            "@type": "ALTIMG",
            "@size": "31856",
            "@ref": "si2",
            "@mimetype": "image/svg+xml"
          }
        ]
      },
      "link": {
        "@rel": "abstract",
        "@href": "https://api.elsevier.com/content/abstract/scopus_id/85210054864"
      }
    }
  }
}