{
  "metadata": {
    "title": "Phosphorous-doped carbon coordinated iridium diphosphide bifunctional catalyst with ultralow iridium amount for efficient all-pH-value hydrogen evolution and oxygen reduction reactions",
    "authors": "; ; ",
    "journal": "Journal of Catalysis",
    "date": "2020-03-31",
    "doi": "10.1016/j.jcat.2020.01.026",
    "abstract": "",
    "uri": "https://api.elsevier.com/content/article/pii/S0021951720300270",
    "pii": "S0021951720300270"
  },
  "fulltext": {
    "full-text-retrieval-response": {
      "scopus-eid": "2-s2.0-85079227212",
      "originalText": "serial JL 272561 291210 291744 291809 31 Journal of Catalysis JOURNALCATALYSIS 2020-02-27 2020-02-27 2020-02-27 2020-02-27 2020-02-27T17:14:25 1-s2.0-S0021951720300270 S0021-9517(20)30027-0 S0021951720300270 10.1016/j.jcat.2020.01.026 S300 S300.1 FULL-TEXT 1-s2.0-S0021951720X00029 2020-04-28T12:43:51.900159Z 0 0 20200301 20200331 2020 2020-02-27T19:51:10.57951Z absattachment articleinfo articletitlenorm authfirstinitialnorm authfirstsurnamenorm cid cids contenttype copyright crossmark dateloaded dateloadedtxt datesearch datesort dateupdated dco docsubtype doctype doi eid ewtransactionid hubeid indexeddate issn issnnorm itemstage itemtransactionid itemweight openaccess openarchive pg pgfirst pglast pii piinorm pubdateend pubdatestart pubdatetxt pubyr sectiontitle sortorder srctitle srctitlenorm srctype ssids alllist content subj subheadings suppl tomb volfirst volissue volumelist webpdf webpdfpagecount yearnav figure e-component body acknowledge affil appendices articletitle auth authfirstini authfull authkeywords authlast grantnumber grantsponsor grantsponsorid highlightsabst orcid primabst ref specialabst 0021-9517 00219517 true 383 383 C Volume 383 29 244 253 244 253 202003 March 2020 2020-03-01 2020-03-31 2020 Regular Articles article fla © 2020 Elsevier Inc. All rights reserved. PHOSPHOROUSDOPEDCARBONCOORDINATEDIRIDIUMDIPHOSPHIDEBIFUNCTIONALCATALYSTULTRALOWIRIDIUMAMOUNTFOREFFICIENTALLPHVALUEHYDROGENEVOLUTIONOXYGENREDUCTIONREACTIONS ZHAO J 1 Introduction 2 Experimental section 2.1 Synthesis of IrP2@PC catalysts 2.2 HER measurements 2.3 ORR measurements 2.4 Structural characterization 3 Results and discussion 3.1 Structure of IrP2@PC catalysts 3.2 HER performance of catalysts 3.3 Mechanism analysis 3.4 ORR performance of catalysts 4 Conclusion Acknowledgment Appendix A Supplementary material References WINTER 2005 M DRESSELHAUS 2001 332 337 M ZHANG 2018 1706523 X CHEN 2016 8537 8544 X LIU 2009 156 165 G NGUYENTHANH 2011 50 60 D JIN 2019 143 149 H ZHU 2018 1800563 J WALTER 2010 6446 6473 M LI 2019 164 170 W WANG 2018 800 806 J CHEN 2019 11038 11043 J PU 2016 8500 8504 Z LIU 2018 37067 37078 X DATTA 2016 14614 14624 A XU 2015 1841 1846 C YUAN 2018 5603 5607 H WANG 2015 9304 J LIU 2016 554 561 J WANG 2015 1 8 J PU 2016 12753 12756 Z PU 2016 15327 15332 Z SALEEM 2015 2013 2018 F WANG 2018 210 219 P WANG 2019 600 608 P LIU 2005 14871 14878 P DUAN 2017 5494 5502 H PU 2017 11559 11564 Z PU 2019 952 957 Z PU 2018 12407 12412 Z QIN 2018 1801478 Q ZHANG 2017 11248 11253 T BAO 2019 15364 15370 X CAO 2018 7077 7085 Y GAO 2017 1702634 H HUANG 2017 1703057 W LIANG 2012 11496 11500 J LONG 2017 151 159 G MERKI 2011 1262 1267 D SANCHEZCASALONGUE 2014 7169 7172 H PI 2017 1700886 Y WANG 2009 768 771 X LI 2017 1605083 B RAZMJOOEI 2017 2381 2391 F GARCIAMATEOS 2018 1219 1233 F LI 2012 9689 9692 X SHENG 2013 1509 1512 W ZHENG 2015 F1470 F1481 J DENG 2017 14430 J LI 2017 7527 7533 F ZHENG 2015 52 65 Y ZHANG 2015 444 452 J ZHAOX2020X244 ZHAOX2020X244X253 ZHAOX2020X244XJ ZHAOX2020X244X253XJ 2022-02-27T00:00:00.000Z 2022-02-27T00:00:00.000Z http://creativecommons.org/licenses/by-nc-nd/4.0/ © 2020 Elsevier Inc. All rights reserved. 2020-01-30T13:33:41.515Z http://vtw.elsevier.com/data/voc/AddOnTypes/50.7/eoas Fundamental Research Funds for the Central Universities http://data.elsevier.com/vocabulary/SciValFunders/501100012226 http://sws.geonames.org/1814991 NSFC National Natural Science Foundation of China http://data.elsevier.com/vocabulary/SciValFunders/501100001809 http://sws.geonames.org/1814991 item S0021-9517(20)30027-0 S0021951720300270 1-s2.0-S0021951720300270 10.1016/j.jcat.2020.01.026 272561 2020-04-28T12:43:51.900159Z 2020-03-01 2020-03-31 1-s2.0-S0021951720300270-main.pdf https://s3-eu-west-1.amazonaws.com/prod-ucs-content-store-eu-west/content/pii:S0021951720300270/MAIN/application/pdf/edebcf79fe1cafab3639314df8bb7719/main.pdf main.pdf pdf true 4570517 MAIN 10 1-s2.0-S0021951720300270-main_1.png https://s3-eu-west-1.amazonaws.com/prod-ucs-content-store-eu-west/content/pii:S0021951720300270/PREVIEW/image/png/b310bf2793e9e85ff774ffca6ce267f4/main_1.png main_1.png png 56677 849 656 IMAGE-WEB-PDF 1 1-s2.0-S0021951720300270-gr10.jpg https://s3-eu-west-1.amazonaws.com/prod-ucs-content-store-eu-west/content/pii:S0021951720300270/gr10/DOWNSAMPLED/image/jpeg/b2edc5a973e86b84da2e401cb0cfcb07/gr10.jpg gr10 gr10.jpg jpg 86582 501 667 IMAGE-DOWNSAMPLED 1-s2.0-S0021951720300270-gr2.jpg https://s3-eu-west-1.amazonaws.com/prod-ucs-content-store-eu-west/content/pii:S0021951720300270/gr2/DOWNSAMPLED/image/jpeg/5e5918f294d9f8357f4992b780122d15/gr2.jpg gr2 gr2.jpg jpg 150849 664 665 IMAGE-DOWNSAMPLED 1-s2.0-S0021951720300270-gr3.jpg https://s3-eu-west-1.amazonaws.com/prod-ucs-content-store-eu-west/content/pii:S0021951720300270/gr3/DOWNSAMPLED/image/jpeg/4fb09ce57f5411ed36d016ed12a683b7/gr3.jpg gr3 gr3.jpg jpg 66489 402 756 IMAGE-DOWNSAMPLED 1-s2.0-S0021951720300270-gr4.jpg https://s3-eu-west-1.amazonaws.com/prod-ucs-content-store-eu-west/content/pii:S0021951720300270/gr4/DOWNSAMPLED/image/jpeg/8da183e8f71e288d96831f7099b9e293/gr4.jpg gr4 gr4.jpg jpg 80559 491 667 IMAGE-DOWNSAMPLED 1-s2.0-S0021951720300270-gr5.jpg https://s3-eu-west-1.amazonaws.com/prod-ucs-content-store-eu-west/content/pii:S0021951720300270/gr5/DOWNSAMPLED/image/jpeg/68e9e347a0617df090d1dd322c62d38e/gr5.jpg gr5 gr5.jpg jpg 75659 498 666 IMAGE-DOWNSAMPLED 1-s2.0-S0021951720300270-gr6.jpg https://s3-eu-west-1.amazonaws.com/prod-ucs-content-store-eu-west/content/pii:S0021951720300270/gr6/DOWNSAMPLED/image/jpeg/915a0da01a41a2ce1f002c215e45d26c/gr6.jpg gr6 gr6.jpg jpg 83320 509 667 IMAGE-DOWNSAMPLED 1-s2.0-S0021951720300270-gr7.jpg https://s3-eu-west-1.amazonaws.com/prod-ucs-content-store-eu-west/content/pii:S0021951720300270/gr7/DOWNSAMPLED/image/jpeg/a26894dbd540e15a3a8eef1252426883/gr7.jpg gr7 gr7.jpg jpg 198670 691 667 IMAGE-DOWNSAMPLED 1-s2.0-S0021951720300270-gr8.jpg https://s3-eu-west-1.amazonaws.com/prod-ucs-content-store-eu-west/content/pii:S0021951720300270/gr8/DOWNSAMPLED/image/jpeg/59f41a06374d6b95575dc395b15db858/gr8.jpg gr8 gr8.jpg jpg 111326 548 667 IMAGE-DOWNSAMPLED 1-s2.0-S0021951720300270-gr9.jpg https://s3-eu-west-1.amazonaws.com/prod-ucs-content-store-eu-west/content/pii:S0021951720300270/gr9/DOWNSAMPLED/image/jpeg/3629c6b3880fa44a42b06cebe86e38b4/gr9.jpg gr9 gr9.jpg jpg 48466 312 756 IMAGE-DOWNSAMPLED 1-s2.0-S0021951720300270-ga1.jpg https://s3-eu-west-1.amazonaws.com/prod-ucs-content-store-eu-west/content/pii:S0021951720300270/ga1/DOWNSAMPLED/image/jpeg/938d24e08cddcd76db1a97b39abff92e/ga1.jpg ga1 true ga1.jpg jpg 37380 200 378 IMAGE-DOWNSAMPLED 1-s2.0-S0021951720300270-gr1.jpg https://s3-eu-west-1.amazonaws.com/prod-ucs-content-store-eu-west/content/pii:S0021951720300270/gr1/DOWNSAMPLED/image/jpeg/dab33959700a44d1bf2e73d783ae4827/gr1.jpg gr1 gr1.jpg jpg 35668 222 667 IMAGE-DOWNSAMPLED 1-s2.0-S0021951720300270-gr10.sml https://s3-eu-west-1.amazonaws.com/prod-ucs-content-store-eu-west/content/pii:S0021951720300270/gr10/THUMBNAIL/image/gif/645c406a5312a81750680ae49bf97e71/gr10.sml gr10 gr10.sml sml 10842 164 218 IMAGE-THUMBNAIL 1-s2.0-S0021951720300270-gr2.sml https://s3-eu-west-1.amazonaws.com/prod-ucs-content-store-eu-west/content/pii:S0021951720300270/gr2/THUMBNAIL/image/gif/9dd50fef65cfe0dc8a79c9a7248a9238/gr2.sml gr2 gr2.sml sml 16941 164 164 IMAGE-THUMBNAIL 1-s2.0-S0021951720300270-gr3.sml https://s3-eu-west-1.amazonaws.com/prod-ucs-content-store-eu-west/content/pii:S0021951720300270/gr3/THUMBNAIL/image/gif/650255268e960ef4e9f7c8c8fc33d0b7/gr3.sml gr3 gr3.sml sml 7543 116 219 IMAGE-THUMBNAIL 1-s2.0-S0021951720300270-gr4.sml https://s3-eu-west-1.amazonaws.com/prod-ucs-content-store-eu-west/content/pii:S0021951720300270/gr4/THUMBNAIL/image/gif/7b8273e1f0cd8b7294236c1e07bcddeb/gr4.sml gr4 gr4.sml sml 10059 161 219 IMAGE-THUMBNAIL 1-s2.0-S0021951720300270-gr5.sml https://s3-eu-west-1.amazonaws.com/prod-ucs-content-store-eu-west/content/pii:S0021951720300270/gr5/THUMBNAIL/image/gif/31e4d04597915a398c9b031ddd1bf7a9/gr5.sml gr5 gr5.sml sml 9830 164 219 IMAGE-THUMBNAIL 1-s2.0-S0021951720300270-gr6.sml https://s3-eu-west-1.amazonaws.com/prod-ucs-content-store-eu-west/content/pii:S0021951720300270/gr6/THUMBNAIL/image/gif/f3a67fa9a89b045df2b420552cf7e2aa/gr6.sml gr6 gr6.sml sml 10089 164 215 IMAGE-THUMBNAIL 1-s2.0-S0021951720300270-gr7.sml https://s3-eu-west-1.amazonaws.com/prod-ucs-content-store-eu-west/content/pii:S0021951720300270/gr7/THUMBNAIL/image/gif/8a925fa11c97c448d109497fa46a2b0b/gr7.sml gr7 gr7.sml sml 14071 164 158 IMAGE-THUMBNAIL 1-s2.0-S0021951720300270-gr8.sml https://s3-eu-west-1.amazonaws.com/prod-ucs-content-store-eu-west/content/pii:S0021951720300270/gr8/THUMBNAIL/image/gif/5868f4baebdb637e91c26688777ffa1b/gr8.sml gr8 gr8.sml sml 21788 164 200 IMAGE-THUMBNAIL 1-s2.0-S0021951720300270-gr9.sml https://s3-eu-west-1.amazonaws.com/prod-ucs-content-store-eu-west/content/pii:S0021951720300270/gr9/THUMBNAIL/image/gif/31283e21a89ac808da18822cee45e876/gr9.sml gr9 gr9.sml sml 4669 90 219 IMAGE-THUMBNAIL 1-s2.0-S0021951720300270-ga1.sml https://s3-eu-west-1.amazonaws.com/prod-ucs-content-store-eu-west/content/pii:S0021951720300270/ga1/THUMBNAIL/image/gif/d147954d4fd96e637bca154828c6cb9d/ga1.sml ga1 true ga1.sml sml 21845 116 219 IMAGE-THUMBNAIL 1-s2.0-S0021951720300270-gr1.sml https://s3-eu-west-1.amazonaws.com/prod-ucs-content-store-eu-west/content/pii:S0021951720300270/gr1/THUMBNAIL/image/gif/4b6f51d51000bc82283e6e71089c40ec/gr1.sml gr1 gr1.sml sml 6937 73 219 IMAGE-THUMBNAIL 1-s2.0-S0021951720300270-gr10_lrg.jpg https://s3-eu-west-1.amazonaws.com/prod-ucs-content-store-eu-west/content/pii:S0021951720300270/gr10/HIGHRES/image/jpeg/260a0b915415773149c5134f7b8db6cd/gr10_lrg.jpg gr10 gr10_lrg.jpg jpg 470333 2217 2953 IMAGE-HIGH-RES 1-s2.0-S0021951720300270-gr2_lrg.jpg https://s3-eu-west-1.amazonaws.com/prod-ucs-content-store-eu-west/content/pii:S0021951720300270/gr2/HIGHRES/image/jpeg/a9faefe78dbf46484a1156ba3e94a569/gr2_lrg.jpg gr2 gr2_lrg.jpg jpg 1013534 2940 2943 IMAGE-HIGH-RES 1-s2.0-S0021951720300270-gr3_lrg.jpg https://s3-eu-west-1.amazonaws.com/prod-ucs-content-store-eu-west/content/pii:S0021951720300270/gr3/HIGHRES/image/jpeg/5fd99d57ec1c22c5a14e9b5a912584e8/gr3_lrg.jpg gr3 gr3_lrg.jpg jpg 437861 1778 3346 IMAGE-HIGH-RES 1-s2.0-S0021951720300270-gr4_lrg.jpg https://s3-eu-west-1.amazonaws.com/prod-ucs-content-store-eu-west/content/pii:S0021951720300270/gr4/HIGHRES/image/jpeg/3d33ced828face03eb836e69a8e14c39/gr4_lrg.jpg gr4 gr4_lrg.jpg jpg 447230 2173 2953 IMAGE-HIGH-RES 1-s2.0-S0021951720300270-gr5_lrg.jpg https://s3-eu-west-1.amazonaws.com/prod-ucs-content-store-eu-west/content/pii:S0021951720300270/gr5/HIGHRES/image/jpeg/40efa13f61f26a1499020fcf2fc0df25/gr5_lrg.jpg gr5 gr5_lrg.jpg jpg 374415 2205 2950 IMAGE-HIGH-RES 1-s2.0-S0021951720300270-gr6_lrg.jpg https://s3-eu-west-1.amazonaws.com/prod-ucs-content-store-eu-west/content/pii:S0021951720300270/gr6/HIGHRES/image/jpeg/ae69acee39d7abbbd8e9992661707ecd/gr6_lrg.jpg gr6 gr6_lrg.jpg jpg 536439 2253 2953 IMAGE-HIGH-RES 1-s2.0-S0021951720300270-gr7_lrg.jpg https://s3-eu-west-1.amazonaws.com/prod-ucs-content-store-eu-west/content/pii:S0021951720300270/gr7/HIGHRES/image/jpeg/603c1cca9096764e23253731926b8c26/gr7_lrg.jpg gr7 gr7_lrg.jpg jpg 1242892 3060 2953 IMAGE-HIGH-RES 1-s2.0-S0021951720300270-gr8_lrg.jpg https://s3-eu-west-1.amazonaws.com/prod-ucs-content-store-eu-west/content/pii:S0021951720300270/gr8/HIGHRES/image/jpeg/69f6f1195b9467b4ba6e8e4ac897c330/gr8_lrg.jpg gr8 gr8_lrg.jpg jpg 642109 2425 2953 IMAGE-HIGH-RES 1-s2.0-S0021951720300270-gr9_lrg.jpg https://s3-eu-west-1.amazonaws.com/prod-ucs-content-store-eu-west/content/pii:S0021951720300270/gr9/HIGHRES/image/jpeg/90d1689360cdca72df344676b9646bbf/gr9_lrg.jpg gr9 gr9_lrg.jpg jpg 263885 1382 3346 IMAGE-HIGH-RES 1-s2.0-S0021951720300270-ga1_lrg.jpg https://s3-eu-west-1.amazonaws.com/prod-ucs-content-store-eu-west/content/pii:S0021951720300270/ga1/HIGHRES/image/jpeg/f12eebf9c511554ef7687601e648742b/ga1_lrg.jpg ga1 true ga1_lrg.jpg jpg 149153 531 1005 IMAGE-HIGH-RES 1-s2.0-S0021951720300270-gr1_lrg.jpg https://s3-eu-west-1.amazonaws.com/prod-ucs-content-store-eu-west/content/pii:S0021951720300270/gr1/HIGHRES/image/jpeg/c119e0afbb92a85939df2835d800d53a/gr1_lrg.jpg gr1 gr1_lrg.jpg jpg 216070 985 2953 IMAGE-HIGH-RES 1-s2.0-S0021951720300270-mmc1.docx https://s3-eu-west-1.amazonaws.com/prod-ucs-content-store-eu-west/content/pii:S0021951720300270/mmc1/MAIN/application/vnd.openxmlformats-officedocument.wordprocessingml.document/f1212394f27731ec7703559b4cec2b6f/mmc1.docx mmc1 mmc1.docx docx 2641155 APPLICATION 1-s2.0-S0021951720300270-am.pdf am am.pdf pdf 5164679 AAM-PDF https://s3-eu-west-1.amazonaws.com/prod-ucs-content-store-eu-west/content/egi:102SFMP1LK2/MAIN/application/pdf/1e29edb98251f854f6fbb8d327929a1c/am.pdf YJCAT 13627 S0021-9517(20)30027-0 10.1016/j.jcat.2020.01.026 Elsevier Inc. Fig. 1 Schematic illustration of the synthetic procedure for the preparation of IrP2@PC. Fig. 2 (a) TEM image of IrP2@PC-0.96. (b) The size of the IrP2@PC-0.96 nanoparticles. (c) HRTEM image of IrP2@PC-0.96. (d) TEM and HRTEM images of IrP2@PC-0.96. (e–i) HAADF-STEM image and EDX element mapping images of IrP2@PC-0.96. Fig. 3 (a) XPS survey pattern of IrP2@PC-0.96. (b–e) High-resolution XPS spectra of IrP2@PC-0.96. (f) Raman spectrum of IrP2@PC-0.96. Fig. 4 (a) 1 M KOH HER polarization curves for IrP2@PC, Pt/C, Ir/C and PC, recorded at 5 mV s−1. (b) Overpotential of η10. (c) Corresponding Tafel slopes. (d) i-t curve for IrP2@PC-0.96 for 10 h, without iR correction and polarization curves for IrP2@PC-0.96 initial and after 3000 CV cycles. Fig. 5 (a) HER polarization curves for IrP2@PC, Pt/C, Ir/C and PC, recorded at 5 mV s−1 in 0.5 M H2SO4. (b) Overpotentials (η10). (c) Corresponding Tafel slopes. (d) i-t curve for IrP2@PC-0.96 under static overpotential for 20 h, without iR correction, the inset is the polarization curves for IrP2@PC-0.96 initial and after 3000 CV cycles between +0.25 and −0.14 V vs. RHE. Fig. 6 (a) 1 M PBS HER polarization curves for catalysts, recorded at 5 mV s−1. (b) Overpotential of η10. (c) Corresponding Tafel slopes. (d) i-t curve for IrP2@PC under static overpotential for 10 h, without iR correction and Polarization curves for IrP2@PC-0.96 initial and after 1000 CV cycles. Fig. 7 (a) TEM image of IrP2@PC-1.41. (b-f) HAADF-STEM image and EDX element mapping images of IrP2@PC-1.41 after 3000 CV cycles. (g) The high-resolution XPS spectra of Ir peaks of the IrP2@PC-1.41 after 3000 cycles in 1 M KOH. (h) The high-resolution XPS spectra of P peaks of the IrP2@PC-1.41 after 3000 cycles in 1 M KOH. Fig. 8 (a) Gas collection device of water splitting in 1.0 M KOH. (b) O2 generated at 0, 200,400, 600, 800 s. (C) H2 generated at 0, 200, 400, 600, 800 s. (d)Amount of H2/O2. Time-dependent experimentally measured versus time for IrP2@PC-1.41/RuO2 in 1.0 M KOH. (e) Schematic of the electrolyzed water reaction. (f) O2 bubbles attached to nickel foam. (g) H2 bubbles attached to nickel foam. Fig. 9 (a) The difference in current density (j) between the anodic and cathodic sweeps (△j = ja − jc) versus scan rate; the slope of the fitting line is used for determination of the double-layer capacitance (Cdl). (b) EIS for IrP2@PC-1.41 in 1 M KOH. Fig. 10 (a) ORR polarization curves for catalysts in O2 saturated 0.1 M KOH electrolyte. (b) Half-wave potential (E1/2) of IrP2@PC, Pt/C, Ir/C and PC. (c) ORR polarization curves of IrP2@PC-0.96 at different rotating rates in O2 saturated 0.1 M KOH and Koutecky-Levich plots. (d) Durability test for IrP2@PC-0.96 and 20% Pt/C. Phosphorous-doped carbon coordinated iridium diphosphide bifunctional catalyst with ultralow iridium amount for efficient all-pH-value hydrogen evolution and oxygen reduction reactions Jiahuan Zhao Zonghua Pu Huihui Jin Zhiwei Zhang Jing Liu Shichun Mu ⁎ State Key Laboratory of Advanced Technology for Materials Synthesis and Processing, Wuhan University of Technology, Wuhan, Hubei 430056, PR China State Key Laboratory of Advanced Technology for Materials Synthesis and Processing Wuhan University of Technology Wuhan Hubei 430056 PR China State Key Laboratory of Advanced Technology for Materials Synthesis and Processing, Wuhan University of Technology, Wuhan, Hubei 430056, PR China ⁎ Corresponding author. Graphical abstract Ultralow noble metal loading catalyst is one of the current main research trends for hydrogen evolution reaction (HER) and oxygen reduction reaction (ORR). In this context, we synthesize the phosphorus-doped carbon covered IrP2 catalysts (IrP2@PC) with Ir amount merely about 1 wt% by an extremely simple way. It possesses remarkably high HER performance, exceeding commercial Pt/C and most reported transition metal catalysts in the whole pH range. In alkaline electrolytes, it shows an ultralow overpotential of 10 mV at a current density of 10 mA·cm−2, almost 100% Faradaic yield for hydrogen production, and continuous discharge stability for more than 10 h. At the same time, in acidic and neutral electrolytes, its overpotentials at the same current density are as low as 15 and 32 mV, respectively. Interestingly, linear Sweep Voltammetry (LSV) data present that, under alkaline conditions, IrP2@PC also possesses a half-wave potential of 0.81 V, extremely close to commercial Pt/C catalysts, indicating that the catalyst also possesses outstanding ORR performance. Keywords Bifunctional catalyst Iridium diphosphide Hydrogen evolution reaction Oxygen reduction reaction All-pH-value 1 Introduction The development and utilization of new energy sources is the main method to solve the issues of traditional energy consumption and environmental pollution [1]. As we know, hydrogen considered as a clean renewable energy source has the potential to replace fossil fuels [2–4]. The hydrogen evolution reaction (HER) plays a vital role on hydrogen generation. Similarly, efficient oxygen reduction reaction (ORR) is important in the renewable energy platform particularly for fuel cells and metal-air (O2) batteries [5–8]. Up to now, Pt-based noble materials are still the best catalysts for both HER and ORR [9,10]. However, high-price and rare sources seriously limit their widespread applications [11,12]. In response to this problem, non-noble transition metal (Mo, Ni, W, Co, Fe) catalysts have been widely explored [13–25]. However, most of their catalytic efficiency is still much lower than Pt catalysts, and they generally own a single catalytic performance in very small pH ranges. Transition metal phosphides (TMPs) have been demonstrated new and promising HER catalysts due to their outstanding physicochemical properties. TMPs own more electronegative phosphorous (P) atoms that can induce the local charge density and adapt to surface charge states [26]. Thus, most of TMPs show better activity than the corresponding pure metals [27–29]. Our group reported that Rh2P-NC had higher HER catalytic activity and better stability than Pt/C over the whole pH range [30]. Qin et al. demonstrated that RuP and RhxP nanoparticles possessed good ORR and OER properties [31]. Zhang et al. prepared carbon nanotube supported MoP with excellent HER performance over the full pH range [3]. However, they usually used hypophosphite as the source of P with release of PH3, which is highly flammable, toxic, corrosive and harmful to the environment [32]. And they also used H2 as the reducing agent, which is prone to the danger of explosion. Note that both iridium (Ir) and platinum (Pt) elements belong to group VIII, and have similar physical and chemical properties. But Ir-based TMPs have rarely been studied as multifunctional catalysts for HER and ORR. It is well known that porous carbon materials have high surface area and excellent electron transfer capability. Wang et al. fabricated Metal @N-Doped Carbon Catalysts via a thermal method that prove the carbon layers can effectively prevent agglomeration of nanoparticles [33,34]. In addition, it is also possible to increase the stability of TMP during the catalysis process [35,36]. In particular, the uneven spin density and charge distribution that occur after introduction of heteroatoms further promote the electron transfer and catalytic reaction [11,37,38]. Herein, for the first time, we successfully obtain a P-doped carbon (PC) covered IrP2 nanocrystal core-shell skeleton (IrP2@PC) catalyst with ultralow Ir loading. It can be prepared by using environmentally friendly phytic acid (PA) as phosphorus source and a convenient reaction with IrCl4·xH2O (Fig. 1 ). The synergy between IrP2 and PC exhibits excellent HER catalytic performance and stability over the full pH range and high ORR performance in alkaline media. 2 Experimental section 2.1 Synthesis of IrP2@PC catalysts To synthesis IrP2@PC-0.63, IrP2@PC-0.96 and IrP2@PC-1.41, 6, 12 and 24 mg of IrCl4·xH2O were poured into 2 ml of phytic acid solution, respectively, with ultrasonic dispersion for half an hour. The mixture was poured into the porcelain boat, then place the porcelain boat in the middle of the quartz tube of the tube furnace. After purging with N2 gas for one hour, heat up the tube furnace from room temperature to 850 ℃ at 5 ℃/min. Keep the temperature for 2 h, then naturally cooled to room temperature. The collected product was dispersed in 20 ml of dilute hydrochloric acid, refluxed for 24 h, washed several times with deionized water, and the product was dried in a vacuum oven to obtain the product IrP2@PC. The step of synthesis for PC was identical to those described above except add IrCl4·xH2O. 2.2 HER measurements The HER performance was tested in electrolyte of 0.5 M H2SO4, 1 M KOH, and 1 M PBS solutions, respectively. 5 mg of the catalyst was dispersed in a dispersant composed of 10 μL 5 wt% Nafion solution and 1000 μL ethanol. The catalyst ink was prepared by sonication for about 0.5 h. 5 μL of the catalyst ink was dropped onto a smooth 3 mm glassy carbon electrode (loading amount: 0.35 mg/cm−2), and naturally dried at room temperature to prepare a catalyst electrode. All electrochemical tests were performed on CHI 750D electrochemical workstation. All electrochemical tests were performed in a conventional three-electrode system. A 3 mm glassy carbon electrode was used as the working electrode. Graphite rod was used as counter electrode, and a saturated calomel electrode (SCE) was used as reference electrode. All polarization curves are corrected by iR. The electrochemical impedance frequency spectrum (EIS) measures from 100 kHz to 0.1 Hz with an ac frequency of 10 mV. By using the midpoint specific capacitance of 40 μF cm−2, the ECSA is determined as: ECSA = Cdl/Cs. 2.3 ORR measurements The electrolyte was 0.1 M KOH. 5 mg of the catalyst was dispersed in a dispersant composed of 10 μL 5 wt% Nafion solution and 1000 μL ethanol. The catalyst ink was prepared by sonication for about 0.5 h. 10 μL of the catalyst ink was dropped onto a smooth 5 mm glassy carbon electrode (loading amount: 0.23 mg/cm−2), and naturally dried at room temperature to prepare a catalyst electrode. All electrochemical tests were performed on a CHI 750D electrochemical workstation. The operation was carried out in a three-electrode system with rotating disc. Ag/AgCl electrode is reference electrode and platinum wire is counter electrode. Before the test, we aerate oxygen for 0.5 h to make the solution saturated. The electron transfer number was calculated by Koutecky-Levich equation using RDE technique (see Supporting information). 2.4 Structural characterization XRD measurements were performed on a Bruker D8 advance XRD system using CuKa radiation. XPS testing was performed on an ESCALAB 250Xi/ESCALAB 250Xi X-ray photoelectron using a spectrometer Al Ka as the excitation source. SEM imaging was performed by using a ZEISS-Merlin field emission microscope to set an acceleration voltage of 5 kV. The HAADF-STEM imaging test was performed by using a JEM-2100F at an acceleration voltage of 200 kV. The ICP test was performed with Prodigy 7. 3 Results and discussion 3.1 Structure of IrP2@PC catalysts IrP2@PC nanocatalysts were obtained by annealing the mixture of phytic acid and IrCl4·xH2O in an N2 environment. To compare the effect of different Ir loadings on the performance, three catalysts with extremely low amount of Ir contents of 0.63 wt%, 0.96 wt% and 1.41 wt% were prepared, respectively, and determined by inductively coupled plasma atomic emission spectroscopy (ICP-AES) analysis. As shown in Fig. S1 (ESI†), the main diffraction peaks in the powder X-ray diffraction (XRD) pattern can be attributed to the monoclinic phase of IrP2 (JCPDS No. 13-0212). Fig. S2 (ESI†) shows SEM images of IrP2@PC-0.96. We can see that the carbon covered IrP2 nanoparticles are very small and evenly distributed. Furthermore, Fig. 2 shows the images of transmission electron microscopy (TEM) and high resolution transmission electron microscopy (HRTEM) of IrP2@PC-0.96. As exhibited in Fig. 2a, IrP2 nanoparticles are uniformly covered with the carbon layer. To further verify it, XPSwithArgon-ionetching processes was carried out to unveil the information of content distribution for Ir with depth. (Fig. S3) (ESI†) Through etching, the content of Ir is gradually increasing with depth (Table S1) (ESI†), evidencing that the IrP2 nanoparticles are covered with the carbon layer. The average size of IrP2 NPs in diameter (Fig. 2b) is about 2.0 nm. Fig. 2c shows a TEM image of nanocrystals for IrP2@PC-0.96 with a specific lattice spacing of 0.369 nm and 0.289 nm corresponding to the IrP2 (−1 1 1) and IrP2 (0 2 0) planes. From the HRTEM image (Fig. 2d), it reveals that the surface of IrP2 nanocrystals is indeed covered by a thinner porous carbon layer. High-angle annular dark-field scanning TEM (HAADF-STEM), and EDX element mapping (Fig. 2e–i), further unveil that C, P, O and Ir elements are uniformly distributed in IrP2@PC-0.96, evidencing the presence of IrP2 and P-doped carbon layers. According to nitrogen adsorption/desorption isotherm of IrP2@PC-0.96 (Fig. S4) (ESI†), the specific surface area based on the Brunauer-Emmett-Teller (BET) model is 1182.5 m2·g−1, and the pore size distribution (Fig. S4) (ESI†) shows the characteristic microporous and mesoporous structures [39]. From the full X-ray Photoelectron Spectroscopy (XPS) spectra of IrP2@PC-0.96 (Fig. 3 ) and PC (Fig. S5) (ESI†), they also manifest the existence of Ir, C, P, O elements and unveils the surface electronic states of IrP2@PC-0.96. As shown in Fig. 3b, the subpeaks at 61.2 and 64.2 eV are consistent with the binding energy (BE) of Ir4+ 4f7/2 and Ir4+ 4f5/2 of IrP2 [40,41]. For the high-resolution C 1 s spectrum, the peaks appearing at 284.5 eV 285.3 eV and 288.9 eV are attributed to C=C, C-P, O-C=O, respectively [42,43]. In the high-resolution P 2p spectrum of IrP2@PC-0.96, the peaks at 134.8 eV and 132.5 eV are assigned to P-O and P-C, respectively. The peak at 129.8 eV presents a slightly negative shift of 0.3 eV relative to the peak of the standard P2p3 at 130.1 eV [28], indicating that it can be attributed to P-Ir [29,44]. In the high-resolution O 1 s spectrum of IrP2@PC-0.96, the peaks at 532.7 eV and 530.6 eV are ascribed to C-O and C=O, respectively [45]. In the Raman spectrum (Fig. 3f), the ratio of ID to IG is 1.08, indicating that the carbon matrix in IrP2@PC catalysts are quite disordered [46]. 3.2 HER performance of catalysts In electrochemical testing, a three-electrode system configuration was carried out where the 3 mm glassy carbon electrode, graphite rod and saturated calomel electrode (SCE) were used as the working electrode, counter electrode and reference electrode, respectively. The catalytic activity of IrP2@PC-0.63, IrP2@PC-0.96 and IrP2@PC-1.41 in different pH electrolytes was investigated at a scanning rate of 5 mV·s−1. For comparison, the catalytic performance of commercial Pt/C (20 wt%), Ir/C (10 wt%) and PC was also examined under the same test conditions. It is noted that almost rare HER catalysts have an excellent activity in both acidic, neutral and alkaline media, because for the conversion of H2O in a neutral or alkaline medium, it is typically about 2–3 orders of magnitude lower than that in an acidic medium [47]. As shown in Fig. 4 a and b, in the alkaline medium of pH = 14 (1 M KOH), both IrP2@PC-1.41 and IrP2@PC-0.96 exhibit ultralow overpotentials of 10 mV and 25 mV, respectively, at a current density of 10 mA·cm−2, much lower than that of Pt/C (38 mV). Their corresponding Tafel slopes are 49 mV·dec-1 and 58 mV·dec-1, respectively. By contrast, Ir/C and PC require larger overpotentials (290 mV, 403 mV) to achieve a current density of 10 mA·cm−2. Interestingly, as shown in Table S2 (ESI†), the HER activity of IrP2@PC-1.41 is higher than that of most recently reported catalysts for alkaline HER. As shown in Fig. 4c, Tafel slopes of IrP2@PC-1.41 and IrP2@PC-0.96 are 49 mV·dec-1 and 58 mV·dec-1, respectively. Such small Tafel slope values are close to Pt/C. Meanwhile, we also measured the cyclic stability under alkaline conditions. The continuous water electrolysis on the IrP2@PC-0.96 electrode for 10 h at a constant potential is revealed in Fig. 4d. After 3000 cyclic tests at the scanning rate of 0.1 V/s, the catalytic activity remains basically unchanged. In order to more accurately characterize the intrinsic activities of the catalyst, the mass activity (Ir) is used to characterize the intrinsic activities of the catalyst (Fig. S6) (ESI†). IrP2@PC-1.41 also shows higher HER mass activity than other catalysts. Fig. 5 a and b show HER polarization curves of catalysts in acidic electrolytes (0.5 M H2SO4) and overpotentials at the cathode current density of 10 mA·cm−2 (η10), respectively. Among them, IrP2@PC-0.96 just requires a very small overpotential of 15 mV to drive a cathode current density of 10 mA·cm−2, even 12 mV less than that of Pt/C (27 mV), which is one of the smallest overpotentials in the reported TMP catalysts (Table S2) (ESI†). In addition, IrP2@PC-0.63 needs an overpotential of 33 mV for driving a cathode current density of 10 mA·cm−2. As shown in Fig. 5c, the Tafel slopes of IrP2@PC-0.96 and IrP2@PC-0.63 are 33 mV·dec-1 and 32 mV·dec-1, respectively. They are similar to the Tafel slope of Pt/C. As Zheng et al. demonstrated, the overlapping between the polarization curve and the concentration overpotential curve on Pt at this Tafel slope in acid media suggests that the measured current is H2 diffusion limited rather than HER kinetics [48]. Importantly, as presented in Fig. 5d, for the IrP2@PC-0.96 electrode, after continuously electrolyzed at a constant potential for 20 h, the current density also stays stable. After 3000 CV cycle test at a sweep rate of 100 mV/s, the catalytic activity also almost remains unchanged, further proving the excellent stability of IrP2@PC catalysts in acidic electrolytes. The electrochemical impedance frequency spectrum (EIS) is shown in Fig. S7 (ESI†), which manifests IrP2@PC just need a quite small reaction resistance for catalysis. Also, it is worth noting that, IrP2@PC still has a brilliant HER in neutral media (1 M PBS) (Fig. 6 ). As presented in Fig. 6a and b, it only takes IrP2@PC-0.96 a very low overpotential of 32 mV to achieve a current density of 10 mA cm−2, which is 5 mV lower than Pt/C (37 mV). Its corresponding Tafel slope is 65 mV·dec-1, 13 mV·dec-1 lower than that of Pt/C (78 mV·dec-1). Meanwhile, we also measured the cyclic stability under a neutral condition. The continuous water electrolysis on the IrP2@PC-0.96 electrode for 10 h at a constant potential is exhibited in Fig. 6d. After 1000 cycles at the scanning rate of 0.1 V/s, almost no changes of the catalytic activity for IrP2@PC-0.96 can be found. As shown in Fig. 7 , from TEM and HAADF-STEM, and EDX element mapping, after 3000 cycles in 1 M KOH the IrP2 nanoparticles of IrP2@PC-1.41 are still evenly distributed on the P-doped C substrate without agglomeration. The number of O elements in the EDX element mapping increases, which is mainly from the 1 M KOH electrolyte. As presented in Fig. S8 (ESI†), Fig. S9 (ESI†) and Fig. 7, the XPS of IrP2@PC-1.41 before and after 3000 cycles were performed. In the high-resolution P 2p spectrum of IrP2@PC-1.41, the peak at 134.8 eV is assigned to P-O which disappears after 3000 cycles. The peaks of P-Ir (129.6 eV), Ir 4+ 4f 7/2 and Ir 4+ 4f 5/2 have no significant changes, indicating the high electrochemical stability of IrP2@PC catalysts in the accelerated HER process. In addition, the Faradaic yield of hydrogen production is very important for the practical application of catalysts in water splitting. As shown in Fig. 8 , IrP2@PC-1.41 exhibits nearly 100% Faradaic yield, confirming the high electron utilization of IrP2@PC-1.41. 3.3 Mechanism analysis To confirm the improved mechanism of HER electrocatalysis for IrP2@PC catalysts, some intrinsic properties of catalysts were explored by comprehensive analysis. According to nitrogen adsorption/desorption isotherm, IrP2@PC has high specific surface area (1182.5 m2·g−1) based on the Brunauer-Emmett-Teller (BET) model, and shows the characteristic microporous and mesoporous structure (Fig. S4) (ESI†). Due to the higher BET value of the material, the IrP2 nanoparticles are sufficiently dispersed to expose more active sites and could own larger ECSA. Furthermore, the highest Cdl value of 70.3 mF cm−2 and a high ECSA value of 1757.5 cm2 (Fig. 9 a and Fig. S10 (ESI†)) for IrP2@PC-1.41 are confirmed by CV measurements. These facilitate the effective accessibility of the intrinsic active site. Note that, the porous structure of IrP2@PC also has better mass transfer and charge transfer capacity, which synergistically improves the catalytic efficiency [49,50]. The presence of porous P-doped carbon layers can not only effectively promote the catalysis by means of coordination with IrP2 and high electrical conductivity, but also prevent agglomeration between IrP2 nanoparticles and protect them from heavy corrosion during the catalytic process, improving the activity and stability of catalysts. As shown in Fig. 9b, the electrochemical impedance spectroscopy (EIS) of IrP2@PC-1.41 manifests that it just needs a quite small electrochemical reaction resistance for catalysis in 1 M KOH solutions due to the rich active site and high electrical conductivity. It can be evidenced that Ir moieties are the main active center of HER electrocatalysis for IrP2@PC. By contrast, Ir/C and metal-free P-doped carbon layer (PC) catalysts need more than 300 mV overpotentials to drive the overpotential at current density of 10 mA·cm−2. In addition, by using a very small amount of Ir (0.63–1.41 wt%), it makes the catalytic performance of IrP2@PC significantly elevated, indicating that Ir moieties provide more active sites. In addition, among IrP2@PC catalysts, IrP2@PC-1.41 owns a remarkably high performance in the alkaline medium, which means more metal loading is conducive to catalyze the HER under alkaline conditions. From the XPS, TEM, (HAADF-STEM), and EDX element mapping analysis of IrP2@PC-1.41 before and after 3000 cycles, it proves that more Ir loading is conducive to catalyze the HER under alkaline conditions, demonstrating that IrP2 is the main catalytic active site. In addition, the interaction between Ir and P can regulate the outer electron structure of Ir, and optimize the affinity of Ir for hydrogen, thus increasing the rate of hydrogen generation. For XPS of IrP2@PC, the peak at 129.8 eV presents a slightly negatively shift relative to the peak of the standard P2p3, indicating that Ir and P in IrP2@PC bear a partial positive charge (δ+) and a partial negative charge (δ−), respectively. These findings point to a weak electron transfer from Ir to P in IrP2@PC. Theoretically, an excellent HER catalyst should have a moderate hydrogen adsorption strength to promote proton-coupled electron transfer and release hydrogen. According to the hydrogen evolution reaction volcano plot [51], the iridium material has suitable hydrogen adsorption and desorption energy, near the apex of the volcano plot. Interfacial engineering research on Ir and heteroatom doping have become important methods to improve the nanocatalytic efficiency. According to the DFT calculation in our another work [29], the introduction of phosphorus promotes water adsorption and dissociation kinetics, and IrP2 significantly reduces the proton adsorption energy of Ir, thereby benefiting the surface hydrogen production. The interaction between the metal and phosphorus makes it possible to efficiently adsorb protons and desorb the formed hydrogen molecules. However, in an alkaline medium, since the protons are derived from the dissociation of water, some substances having an affinity for the oxygen-containing functional groups are introduced into the catalyst. For example, a P-doped carbon material greatly contributes to oxygen reduction, which can effectively reduce the energy barrier of hydrolysis reaction. 3.4 ORR performance of catalysts The ORR test of IrP2@PC, Pt/C and Ir/C was carried out in an O2 saturated 0.1 M KOH solution. Surprisingly, IrP2@PC also exhibits excellent ORR performance (Fig. 10 ). Linear Sweep Voltammetry (LSV) curves (Fig. 10a) show that IrP2@PC-0.96 has a half-wave potential (E1/2) of 0.81 V relative to RHE, much higher than Ir/C (0.75 V) and PC, and close to commercial Pt/C (E1/2 = 0.85 V vs. RHE). From the Koutecky–Levich (K–L) curves (Fig. 10c), the calculated electron transfer number (n) of IrP2@PC-0.96 catalyst is approximately 3.98. At the same time, we tested the current versus time (i–t) chronoamperometric response of IrP2@PC-0.96 and Pt/C (Fig. 10d). They were employed at 1600 rpm in the O2‐saturated 0.1 M KOH solution. After 50 000 s operation, we can see the stability of IrP2@PC-0.96 is significantly better than Pt/C. The P-doped carbon in the substrate can modify the distribution of charge on the carbon surface and activate adjacent carbon, which facilitates the ORR catalysis [31,52]. Therefore, we can conclude that, the excellent ORR performance of IrP2@PC comes from IrP2 and the synergy between IrP2 and PC. 4 Conclusion The phosphorus-doped carbon covered IrP2 nanocrystal catalyst (IrP2@PC) is successfully prepared by a facile method. The obtained IrP2@PC exhibits excellent performances in hydrogen evolution reaction over the whole pH range, and oxygen reduction reaction under alkaline conditions, with a very low amount of Ir (approximately 1 wt%). At a current density of 10 mA·cm−2, and in alkaline, acidic and neutral electrolytes, it shows ultralow overpotentials of 10 mV, 15 mV and 32 mV, respectively. Especially, the IrP2@PC catalyst with 0.96 wt% Ir loading, has HER catalytic activity that exceeds commercial Pt/C over the full pH range. In addition, the IrP2@PC catalyst also possesses high ORR performance close to Pt/C in alkaline media. Our work demonstrates a new synthesis method for the high performance IrP2@PC bifunction catalyst toward higher efficient electrolysis of water and oxygen reduction, and the extremely low precious metal loading is conducive to saving environmental resources. Undoubtedly, this work will promote the development of environmentally friendly energy and electrochemical energy conversion devices in terms of our novel catalysts. Declaration of Competing Interest The authors declare that they have no known competing financial interests or personal relationships that could have appeared to influence the work reported in this paper. Acknowledgment This work is jointly supported by the Natural Science Foundation of China (No. 51672204), the National Key Research and Development Program of China (No. 2016YFA0202603), and the Central Universities (WUT:2019-zy-049). The authors express thanks to Xiaoqing Liu and Tingting Luo for HR-TEM measurement support, in the Materials Analysis Center of Wuhan University of Technology. Appendix A Supplementary material Supplementary data to this article can be found online at https://doi.org/10.1016/j.jcat.2020.01.026. Appendix A Supplementary material The following are the Supplementary data to this article: Supplementary data 1 References [1] M. Winter R.J. Brodd What are batteries, fuel cells, and supercapacitors? Chem. Rev. 105 2005 1021-1021 M. Winter, R.J. Brodd, What are batteries, fuel cells, and supercapacitors? Chem. Rev., 105 (2005) 1021-1021. [2] M.S. Dresselhaus I.L. Thomas Alternative energy technologies Nature 414 2001 332 337 M.S. Dresselhaus, I.L. Thomas, Alternative energy technologies, Nature, 414 (2001) 332-337. [3] X. Zhang X. Yu L. Zhang F. Zhou Y. Liang R. Wang Molybdenum phosphide/carbon nanotube hybrids as pH-universal electrocatalysts for hydrogen evolution reaction Adv. Funct. Mater. 28 2018 1706523 X. Zhang, X. Yu, L. Zhang, F. Zhou, Y. Liang, R. Wang, Molybdenum Phosphide/Carbon Nanotube Hybrids as pH-Universal Electrocatalysts for Hydrogen Evolution Reaction, Adv. Funct. Mater., 28 (2018) 1706523. [4] X. Chen G. Liu W. Zheng W. Feng W. Cao W. Hu P. Hu Vertical 2D MoO2/MoSe2core-shell nanosheet arrays as high-performance electrocatalysts for hydrogen evolution reaction Adv. Funct. Mater. 26 2016 8537 8544 X. Chen, G. Liu, W. Zheng, W. Feng, W. Cao, W. Hu, P. Hu, Vertical 2D MoO2/MoSe2Core-Shell Nanosheet Arrays as High-Performance Electrocatalysts for Hydrogen Evolution Reaction, Adv. Funct. Mater., 26 (2016) 8537-8544. [5] G. Liu X. Li P. Ganesan B.N. Popov Development of non-precious metal oxygen-reduction catalysts for PEM fuel cells based on N-doped ordered porous carbon Appl. Catal. B 93 2009 156 165 G. Liu, X. Li, P. Ganesan, B.N. Popov, Development of non-precious metal oxygen-reduction catalysts for PEM fuel cells based on N-doped ordered porous carbon, Applied Catalysis B: Environmental, 93 (2009) 156-165. [6] D. Nguyen-Thanh A.I. Frenkel J. Wang S. O’Brien D.L. Akins Cobalt–polypyrrole–carbon black (Co–PPY–CB) electrocatalysts for the oxygen reduction reaction (ORR) in fuel cells: composition and kinetic activity Appl. Catal. B 105 2011 50 60 D. Nguyen-Thanh, A.I. Frenkel, J. Wang, S. O’Brien, D.L. Akins, Cobalt–polypyrrole–carbon black (Co–PPY–CB) electrocatalysts for the oxygen reduction reaction (ORR) in fuel cells: Composition and kinetic activity, Applied Catalysis B: Environmental, 105 (2011) 50-60. [7] H. Jin H. Zhou D. He Z. Wang Q. Wu Q. Liang S. Liu S. Mu MOF-derived 3D Fe-N-S co-doped carbon matrix/nanotube nanocomposites with advanced oxygen reduction activity and stability in both acidic and alkaline media Appl. Catal. B 250 2019 143 149 H. Jin, H. Zhou, D. He, Z. Wang, Q. Wu, Q. Liang, S. Liu, S. Mu, MOF-derived 3D Fe-N-S co-doped carbon matrix/nanotube nanocomposites with advanced oxygen reduction activity and stability in both acidic and alkaline media, Applied Catalysis B: Environmental, 250 (2019) 143-149. [8] J. Zhu W. Li S. Li J. Zhang H. Zhou C. Zhang J. Zhang S. Mu Defective N/S-codoped 3D cheese-like porous carbon nanomaterial toward efficient oxygen reduction and Zn-air batteries Small 14 2018 1800563 J. Zhu, W. Li, S. Li, J. Zhang, H. Zhou, C. Zhang, J. Zhang, S. Mu, Defective N/S-Codoped 3D Cheese-Like Porous Carbon Nanomaterial toward Efficient Oxygen Reduction and Zn-Air Batteries, Small, 14 (2018) 1800563. [9] M.G. Walter E.L. Warren J.R. McKone S.W. Boettcher Q.X. Mi E.A. Santori N.S. Lewis Solar water splitting cells Chem. Rev. 110 2010 6446 6473 M.G. Walter, E.L. Warren, J.R. McKone, S.W. Boettcher, Q.X. Mi, E.A. Santori, N.S. Lewis, Solar Water Splitting Cells, Chem. Rev., 110 (2010) 6446-6473. [10] W. Li Z.-Y. Hu Z. Zhang P. Wei J. Zhang Z. Pu J. Zhu D. He S. Mu G. Van Tendeloo Nano-single crystal coalesced PtCu nanospheres as robust bifunctional catalyst for hydrogen evolution and oxygen reduction reactions J. Catal. 375 2019 164 170 W. Li, Z.-Y. Hu, Z. Zhang, P. Wei, J. Zhang, Z. Pu, J. Zhu, D. He, S. Mu, G. Van Tendeloo, Nano-single crystal coalesced PtCu nanospheres as robust bifunctional catalyst for hydrogen evolution and oxygen reduction reactions, J. Catal., 375 (2019) 164-170. [11] J. Wang Z.Z. Wei S.J. Mao H.R. Li Y. Wang Highly uniform Ru nanoparticles over N-doped carbon: pH and temperature-universal hydrogen release from water reduction Energy Environ. Sci. 11 2018 800 806 J. Wang, Z.Z. Wei, S.J. Mao, H.R. Li, Y. Wang, Highly uniform Ru nanoparticles over N-doped carbon: pH and temperature-universal hydrogen release from water reduction, Energy Environ. Sci., 11 (2018) 800-806. [12] J.D. Chen H.Y. Wang Y.T. Gong Y. Wang Directly immobilizing a Ru-tannic acid linkage coordination complex on carbon cloth: an efficient and ultrastable catalyst for the hydrogen evolution reaction J. Mater. Chem. 7 2019 11038 11043 J.D. Chen, H.Y. Wang, Y.T. Gong, Y. Wang, Directly immobilizing a Ru-tannic acid linkage coordination complex on carbon cloth: an efficient and ultrastable catalyst for the hydrogen evolution reaction, J. Mater. Chem., 7 (2019) 11038-11043. [13] Z. Pu I. Saana Amiinu M. Wang Y. Yang S. Mu Semimetallic MoP2: an active and stable hydrogen evolution electrocatalyst over the whole pH range Nanoscale 8 2016 8500 8504 Z. Pu, I. Saana Amiinu, M. Wang, Y. Yang, S. Mu, Semimetallic MoP2: an active and stable hydrogen evolution electrocatalyst over the whole pH range, Nanoscale, 8 (2016) 8500-8504. [14] X. Liu Y. Wang L. Chen P. Chen S. Jia Y. Zhang S. Zhou J. Zang Co2B and Co nanoparticles immobilized on the N-B-doped carbon derived from nano-B4C for efficient catalysis of oxygen evolution, hydrogen evolution, and oxygen reduction reactions ACS Appl. Mater. Interfaces 10 2018 37067 37078 X. Liu, Y. Wang, L. Chen, P. Chen, S. Jia, Y. Zhang, S. Zhou, J. Zang, Co2B and Co Nanoparticles Immobilized on the N–B-Doped Carbon Derived from Nano-B4C for Efficient Catalysis of Oxygen Evolution, Hydrogen Evolution, and Oxygen Reduction Reactions, ACS Appl. Mater. Interfaces., 10 (2018) 37067-37078. [15] A. Datta S. Kapri S. Bhattacharyya Carbon dots with tunable concentrations of trapped anti-oxidant as an efficient metal-free catalyst for electrochemical water oxidation J. Mater. Chem. 4 2016 14614 14624 A. Datta, S. Kapri, S. Bhattacharyya, Carbon dots with tunable concentrations of trapped anti-oxidant as an efficient metal-free catalyst for electrochemical water oxidation, J. Mater. Chem., 4 (2016) 14614-14624. [16] C. Xu Q. Han Y. Zhao L. Wang Y. Li L. Qu Sulfur-doped graphitic carbon nitride decorated with graphene quantum dots for an efficient metal-free electrocatalyst J. Mater. Chem. 3 2015 1841 1846 C. Xu, Q. Han, Y. Zhao, L. Wang, Y. Li, L. Qu, Sulfur-doped graphitic carbon nitride decorated with graphene quantum dots for an efficient metal-free electrocatalyst, J. Mater. Chem., 3 (2015) 1841-1846. [17] H. Yuan J. Liu H. Li Y. Li X. Liu D. Shi Q. Wu Q. Jiao Graphitic carbon nitride quantum dot decorated three-dimensional graphene as an efficient metal-free electrocatalyst for triiodide reduction J. Mater. Chem. 6 2018 5603 5607 H. Yuan, J. Liu, H. Li, Y. Li, X. Liu, D. Shi, Q. Wu, Q. Jiao, Graphitic carbon nitride quantum dot decorated three-dimensional graphene as an efficient metal-free electrocatalyst for triiodide reduction, J. Mater. Chem., 6 (2018) 5603-5607. [18] J. Wang R. Ma Z. Zhou G. Liu Q. Liu Magnesiothermic synthesis of sulfur-doped graphene as an efficient metal-free electrocatalyst for oxygen reduction Sci. Rep. 5 2015 9304 J. Wang, R. Ma, Z. Zhou, G. Liu, Q. Liu, Magnesiothermic synthesis of sulfur-doped graphene as an efficient metal-free electrocatalyst for oxygen reduction, Sci. Rep., 5 (2015). [19] J. Liu B.V. Cunning T. Daio A. Mufundirwa K. Sasaki S.M. Lyth Nitrogen-doped carbon foam as a highly durable metal-free electrocatalyst for the oxygen reduction reaction in alkaline solution Electrochim. Acta 220 2016 554 561 J. Liu, B.V. Cunning, T. Daio, A. Mufundirwa, K. Sasaki, S.M. Lyth, Nitrogen-Doped Carbon Foam as a Highly Durable Metal-Free Electrocatalyst for the Oxygen Reduction Reaction in Alkaline Solution, Electrochim. Acta, 220 (2016) 554-561. [20] J.X. Wang Y. Zhang C.B. Capuano K.E. Ayers Ultralow charge-transfer resistance with ultralow Pt loading for hydrogen evolution and oxidation using Ru@Pt core-shell nanocatalysts Sci. Rep. 5 2015 1 8 J.X. Wang, Y. Zhang, C.B. Capuano, K.E. Ayers, Ultralow charge-transfer resistance with ultralow Pt loading for hydrogen evolution and oxidation using Ru@Pt core-shell nanocatalysts, Sci. Rep., 5 (2015). [21] Z. Pu M. Wang Z. Kou I.S. Amiinu S. Mu Mo2C quantum dot embedded chitosan-derived nitrogen-doped carbon for efficient hydrogen evolution in a broad pH range Chem. Commun. 52 2016 12753 12756 Z. Pu, M. Wang, Z. Kou, I.S. Amiinu, S. Mu, Mo2C quantum dot embedded chitosan-derived nitrogen-doped carbon for efficient hydrogen evolution in a broad pH range, Chem. Commun., 52 (2016) 12753-12756. [22] Z. Pu X. Ya I.S. Amiinu Z. Tu X. Liu W. Li S. Mu Ultrasmall tungsten phosphide nanoparticles embedded in nitrogen-doped carbon as a highly active and stable hydrogen-evolution electrocatalyst J. Mater. Chem. 4 2016 15327 15332 Z. Pu, X. Ya, I.S. Amiinu, Z. Tu, X. Liu, W. Li, S. Mu, Ultrasmall tungsten phosphide nanoparticles embedded in nitrogen-doped carbon as a highly active and stable hydrogen-evolution electrocatalyst, J. Mater. Chem., 4 (2016) 15327-15332. [23] F. Saleem B. Xu B. Ni H. Liu F. Nosheen H. Li X. Wang Atomically thick Pt-Cu nanosheets: self-assembled sandwich and nanoring-like structures Adv. Mater. 27 2015 2013 2018 F. Saleem, B. Xu, B. Ni, H. Liu, F. Nosheen, H. Li, X. Wang, Atomically Thick Pt-Cu Nanosheets: Self-Assembled Sandwich and Nanoring-Like Structures, Adv. Mater., 27 (2015) 2013-2018. [24] P. Wang S. Zhan H. Wang Y. Xia Q. Hou Q. Zhou Y. Li R.R. Kumar Cobalt phosphide nanowires as efficient co-catalyst for photocatalytic hydrogen evolution over Zn0.5Cd0.5S Appl. Catal. B 230 2018 210 219 P. Wang, S. Zhan, H. Wang, Y. Xia, Q. Hou, Q. Zhou, Y. Li, R.R. Kumar, Cobalt phosphide nanowires as efficient co-catalyst for photocatalytic hydrogen evolution over Zn0.5Cd0.5S, Applied Catalysis B: Environmental, 230 (2018) 210-219. [25] P. Wang Z. Pu W. Li J. Zhu C. Zhang Y. Zhao S. Mu Coupling NiSe2-Ni2P heterostructure nanowrinkles for highly efficient overall water splitting J. Catal. 377 2019 600 608 P. Wang, Z. Pu, W. Li, J. Zhu, C. Zhang, Y. Zhao, S. Mu, Coupling NiSe2-Ni2P heterostructure nanowrinkles for highly efficient overall water splitting, J. Catal., 377 (2019) 600-608. [26] P. Liu J.A. Rodriguez Catalysts for hydrogen evolution from the [NiFe] hydrogenase to the Ni2P(001) surface: the importance of ensemble effect J. Am. Chem. Soc. 127 2005 14871 14878 P. Liu, J.A. Rodriguez, Catalysts for Hydrogen Evolution from the [NiFe] Hydrogenase to the Ni2P(001) Surface:The Importance of Ensemble Effect, J. Am. Chem. Soc., 127 (2005) 14871-14878. [27] H. Duan D. Li Y. Tang Y. He S. Ji R. Wang H. Lv P.P. Lopes A.P. Paulikas H. Li S.X. Mao C. Wang N.M. Markovic J. Li V.R. Stamenkovic Y. Li High-performance Rh2P electrocatalyst for efficient water splitting J. Am. Chem. Soc. 139 2017 5494 5502 H. Duan, D. Li, Y. Tang, Y. He, S. Ji, R. Wang, H. Lv, P.P. Lopes, A.P. Paulikas, H. Li, S.X. Mao, C. Wang, N.M. Markovic, J. Li, V.R. Stamenkovic, Y. Li, High-Performance Rh2P Electrocatalyst for Efficient Water Splitting, J. Am. Chem. Soc., 139 (2017) 5494-5502. [28] Z. Pu I.S. Amiinu Z. Kou W. Li S. Mu RuP2-based catalysts with platinum-like activity and higher durability for the hydrogen evolution reaction at All pH values Angew. Chem. Int. Ed. 56 2017 11559 11564 Z. Pu, I.S. Amiinu, Z. Kou, W. Li, S. Mu, RuP2-Based Catalysts with Platinum-like Activity and Higher Durability for the Hydrogen Evolution Reaction at All pH Values, Angew. Chem. Int. Ed., 56 (2017) 11559-11564. [29] Z. Pu J. Zhao I.S. Amiinu W. Li M. Wang D. He S. Mu A universal synthesis strategy for P-rich noble metal diphosphide-based electrocatalysts for the hydrogen evolution reaction Energy Environ. Sci. 12 2019 952 957 Z. Pu, J. Zhao, I.S. Amiinu, W. Li, M. Wang, D. He, S. Mu, A universal synthesis strategy for P-rich noble metal diphosphide-based electrocatalysts for the hydrogen evolution reaction, Energy Environ. Sci., 12 (2019) 952-957. [30] Z.H. Pu I.S. Amiinu D.P. He M. Wang G.Q. Li S.C. Mu Activating rhodium phosphide-based catalysts for the pH-universal hydrogen evolution reaction Nanoscale 10 2018 12407 12412 Z.H. Pu, I.S. Amiinu, D.P. He, M. Wang, G.Q. Li, S.C. Mu, Activating rhodium phosphide-based catalysts for the pH-universal hydrogen evolution reaction, Nanoscale, 10 (2018) 12407-12412. [31] Q. Qin H. Jang L.L. Chen G. Nam X. Liu J. Cho Low loading of RhxP and RuP on N, P codoped carbon as two trifunctional electrocatalysts for the oxygen and hydrogen electrode reactions Adv. Energy Mater. 8 2018 1801478 Q. Qin, H. Jang, L.L. Chen, G. Nam, X. Liu, J. Cho, Low Loading of RhxP and RuP on N, P Codoped Carbon as Two Trifunctional Electrocatalysts for the Oxygen and Hydrogen Electrode Reactions, Adv. Energy Mater., 8 (2018). [32] T.Q. Zhang J. Liu L.B. Huang X.D. Zhang Y.G. Sun X.C. Liu D.S. Bin X. Chen A.M. Cao J.S. Hu L.J. Wan Microbial-phosphorus-enabled synthesis of phosphide nanocomposites for efficient electrocatalysts J. Am. Chem. Soc. 139 2017 11248 11253 T.Q. Zhang, J. Liu, L.B. Huang, X.D. Zhang, Y.G. Sun, X.C. Liu, D.S. Bin, X. Chen, A.M. Cao, J.S. Hu, L.J. Wan, Microbial-Phosphorus-Enabled Synthesis of Phosphide Nanocomposites for Efficient Electrocatalysts, J. Am. Chem. Soc., 139 (2017) 11248-11253. [33] X.B. Bao Y.T. Gong Y.Z. Chen H. Zhang Z. Wang S.J. Mao L. Xie Z. Jiang Y. Wang Carbon vacancy defect-activated Pt cluster for hydrogen generation J. Mater. Chem. 7 2019 15364 15370 X.B. Bao, Y.T. Gong, Y.Z. Chen, H. Zhang, Z. Wang, S.J. Mao, L. Xie, Z. Jiang, Y. Wang, Carbon vacancy defect-activated Pt cluster for hydrogen generation, J. Mater. Chem., 7 (2019) 15364-15370. [34] Y.L. Cao B.W. Zhao X.B. Bao Y. Wang Fabricating Metal@N-Doped carbon catalysts via a thermal method ACS Catal. 8 2018 7077 7085 Y.L. Cao, B.W. Zhao, X.B. Bao, Y. Wang, Fabricating Metal@N-Doped Carbon Catalysts via a Thermal Method, Acs Catal, 8 (2018) 7077-7085. [35] H. Gao T. Zhou Y. Zheng Q. Zhang Y. Liu J. Chen H. Liu Z. Guo CoS quantum dot nanoclusters for high-energy potassium-ion batteries Adv. Funct. Mater. 27 2017 1702634 H. Gao, T. Zhou, Y. Zheng, Q. Zhang, Y. Liu, J. Chen, H. Liu, Z. Guo, CoS Quantum Dot Nanoclusters for High-Energy Potassium-Ion Batteries, Adv. Funct. Mater., 27 (2017) 1702634. [36] W. Huang X.-Y. Ma H. Wang R. Feng J. Zhou P.N. Duchesne P. Zhang F. Chen N. Han F. Zhao J. Zhou W.-B. Cai Y. Li Promoting effect of Ni(OH)2 on palladium nanocrystals leads to greatly improved operation durability for electrocatalytic ethanol oxidation in alkaline solution Adv. Mater. 29 2017 1703057 W. Huang, X.-Y. Ma, H. Wang, R. Feng, J. Zhou, P.N. Duchesne, P. Zhang, F. Chen, N. Han, F. Zhao, J. Zhou, W.-B. Cai, Y. Li, Promoting Effect of Ni(OH)2 on Palladium Nanocrystals Leads to Greatly Improved Operation Durability for Electrocatalytic Ethanol Oxidation in Alkaline Solution, Adv. Mater., 29 (2017) 1703057. [37] J. Liang Y. Jiao M. Jaroniec S.Z. Qiao Sulfur and nitrogen dual-doped mesoporous graphene electrocatalyst for oxygen reduction with synergistically enhanced performance Angew. Chem. Int. Ed. 51 2012 11496 11500 J. Liang, Y. Jiao, M. Jaroniec, S.Z. Qiao, Sulfur and Nitrogen Dual-Doped Mesoporous Graphene Electrocatalyst for Oxygen Reduction with Synergistically Enhanced Performance, Angew. Chem. Int. Ed., 51 (2012) 11496-11500. [38] G.-F. Long K. Wan M.-Y. Liu Z.-X. Liang J.-H. Piao P. Tsiakaras Active sites and mechanism on nitrogen-doped carbon catalyst for hydrogen evolution reaction J. Catal. 348 2017 151 159 G.-f. Long, K. Wan, M.-y. Liu, Z.-x. Liang, J.-h. Piao, P. Tsiakaras, Active sites and mechanism on nitrogen-doped carbon catalyst for hydrogen evolution reaction, J. Catal., 348 (2017) 151-159. [39] D. Merki S. Fierro H. Vrubel X. Hu Amorphous molybdenum sulfide films as catalysts for electrochemical hydrogen production in water Chem. Sci. 2 2011 1262 1267 D. Merki, S. Fierro, H. Vrubel, X. Hu, Amorphous molybdenum sulfide films as catalysts for electrochemical hydrogen production in water, Chem. Sci., 2 (2011) 1262-1267. [40] H.G. Sanchez Casalongue M.L. Ng S. Kaya D. Friebel H. Ogasawara A. Nilsson In situ observation of surface species on iridium oxide nanoparticles during the oxygen evolution reaction Angew. Chem. Int. Ed. 53 2014 7169 7172 H.G. Sanchez Casalongue, M.L. Ng, S. Kaya, D. Friebel, H. Ogasawara, A. Nilsson, In Situ Observation of Surface Species on Iridium Oxide Nanoparticles during the Oxygen Evolution Reaction, Angew. Chem. Int. Ed., 53 (2014) 7169-7172. [41] Y. Pi Q. Shao P. Wang J. Guo X. Huang General formation of monodisperse IrM (M = Ni Co, Fe) bimetallic nanoclusters as bifunctional electrocatalysts for acidic overall water splitting Adv. Funct. Mater. 27 2017 1700886 Y. Pi, Q. Shao, P. Wang, J. Guo, X. Huang, General Formation of Monodisperse IrM (M = Ni, Co, Fe) Bimetallic Nanoclusters as Bifunctional Electrocatalysts for Acidic Overall Water Splitting, Adv. Funct. Mater., 27 (2017) 1700886. [42] X. Wang X. Li L. Zhang Y. Yoon P.K. Weber H. Wang J. Guo H. Dai N-doping of graphene through electrothermal reactions with ammonia Science 324 2009 768 771 X. Wang, X. Li, L. Zhang, Y. Yoon, P.K. Weber, H. Wang, J. Guo, H. Dai, N-Doping of Graphene Through Electrothermal Reactions with Ammonia, Science, 324 (2009) 768-771. [43] B. Li H. Nam J. Zhao J. Chang N. Lingappan F. Yao T.H. Lee Y.H. Lee Nanoreactor of nickel-containing carbon-shells as oxygen reduction catalyst Adv. Mater. 29 2017 1605083 B. Li, H. Nam, J. Zhao, J. Chang, N. Lingappan, F. Yao, T.H. Lee, Y.H. Lee, Nanoreactor of Nickel-Containing Carbon-Shells as Oxygen Reduction Catalyst, Adv. Mater., 29 (2017) 1605083. [44] F. Razmjooei K.P. Singh D.S. Yang W. Cui Y.H. Jang J.S. Yu Fe-treated heteroatom (S/N/B/P)-doped graphene electrocatalysts for water oxidation ACS Catal. 7 2017 2381 2391 F. Razmjooei, K.P. Singh, D.S. Yang, W. Cui, Y.H. Jang, J.S. Yu, Fe-Treated Heteroatom (S/N/B/P)-Doped Graphene Electrocatalysts for Water Oxidation, Acs Catal, 7 (2017) 2381-2391. [45] F.J. Garcia-Mateos R. Berenguer M.J. Valero-Romero J. Rodriguez-Mirasol T. Cordero Phosphorus functionalization for the rapid preparation of highly nanoporous submicron-diameter carbon fibers by electrospinning of lignin solutions J. Mater. Chem. 6 2018 1219 1233 F.J. Garcia-Mateos, R. Berenguer, M.J. Valero-Romero, J. Rodriguez-Mirasol, T. Cordero, Phosphorus functionalization for the rapid preparation of highly nanoporous submicron-diameter carbon fibers by electrospinning of lignin solutions, J. Mater. Chem., 6 (2018) 1219-1233. [46] X.-H. Li S. Kurasch U. Kaiser M. Antonietti Synthesis of monolayer-patched graphene from glucose Angew. Chem. Int. Ed. 51 2012 9689 9692 X.-H. Li, S. Kurasch, U. Kaiser, M. Antonietti, Synthesis of Monolayer-Patched Graphene from Glucose, Angew. Chem. Int. Ed., 51 (2012) 9689-9692. [47] W.C. Sheng M. Myint J.G.G. Chen Y.S. Yan Correlating the hydrogen evolution reaction activity in alkaline electrolytes with the hydrogen binding energy on monometallic surfaces Energy Environ. Sci. 6 2013 1509 1512 W.C. Sheng, M. Myint, J.G.G. Chen, Y.S. Yan, Correlating the hydrogen evolution reaction activity in alkaline electrolytes with the hydrogen binding energy on monometallic surfaces, Energy Environ. Sci., 6 (2013) 1509-1512. [48] J. Zheng Y. Yan B. Xu Correcting the hydrogen diffusion limitation in rotating disk electrode measurements of hydrogen evolution reaction kinetics J. Electrochem. Soc. 162 2015 F1470 F1481 J. Zheng, Y. Yan, B. Xu, Correcting the Hydrogen Diffusion Limitation in Rotating Disk Electrode Measurements of Hydrogen Evolution Reaction Kinetics, J. Electrochem. Soc., 162 (2015) F1470-F1481. [49] J. Deng H. Li S. Wang D. Ding M. Chen C. Liu Z. Tian K.S. Novoselov C. Ma D. Deng X. Bao Multiscale structural and electronic control of molybdenum disulfide foam for highly efficient hydrogen production Nat. Commun. 8 2017 14430 J. Deng, H. Li, S. Wang, D. Ding, M. Chen, C. Liu, Z. Tian, K.S. Novoselov, C. Ma, D. Deng, X. Bao, Multiscale structural and electronic control of molybdenum disulfide foam for highly efficient hydrogen production, Nat. Commun., 8 (2017) 14430. [50] F. Li X. Zhao J. Mahmood M.S. Okyay S.-M. Jung I. Ahmad S.-J. Kim G.-F. Han N. Park J.-B. Baek Macroporous inverse opal-like MoxC with incorporated Mo vacancies for significantly enhanced hydrogen evolution ACS Nano 11 2017 7527 7533 F. Li, X. Zhao, J. Mahmood, M.S. Okyay, S.-M. Jung, I. Ahmad, S.-J. Kim, G.-F. Han, N. Park, J.-B. Baek, Macroporous Inverse Opal-like MoxC with Incorporated Mo Vacancies for Significantly Enhanced Hydrogen Evolution, ACS Nano, 11 (2017) 7527-7533. [51] Y. Zheng Y. Jiao M. Jaroniec S.Z. Qiao Advancing the electrochemistry of the hydrogen-evolution reaction through combining experiment and theory Angew. Chem. Int. Ed. 54 2015 52 65 Y. Zheng, Y. Jiao, M. Jaroniec, S.Z. Qiao, Advancing the Electrochemistry of the Hydrogen-Evolution Reaction through Combining Experiment and Theory, Angew. Chem. Int. Ed, 54 (2015) 52-65. [52] J.T. Zhang Z.H. Zhao Z.H. Xia L.M. Dai A metal-free bifunctional electrocatalyst for oxygen reduction and oxygen evolution reactions Nat. Nanotechnol. 10 2015 444 452 J.T. Zhang, Z.H. Zhao, Z.H. Xia, L.M. Dai, A metal-free bifunctional electrocatalyst for oxygen reduction and oxygen evolution reactions, Nat. Nanotechnol., 10 (2015) 444-452.",
      "scopus-id": "85079227212",
      "coredata": {
        "eid": "1-s2.0-S0021951720300270",
        "dc:description": "Ultralow noble metal loading catalyst is one of the current main research trends for hydrogen evolution reaction (HER) and oxygen reduction reaction (ORR). In this context, we synthesize the phosphorus-doped carbon covered IrP2 catalysts (IrP2@PC) with Ir amount merely about 1 wt% by an extremely simple way. It possesses remarkably high HER performance, exceeding commercial Pt/C and most reported transition metal catalysts in the whole pH range. In alkaline electrolytes, it shows an ultralow overpotential of 10 mV at a current density of 10 mA·cm−2, almost 100% Faradaic yield for hydrogen production, and continuous discharge stability for more than 10 h. At the same time, in acidic and neutral electrolytes, its overpotentials at the same current density are as low as 15 and 32 mV, respectively. Interestingly, linear Sweep Voltammetry (LSV) data present that, under alkaline conditions, IrP2@PC also possesses a half-wave potential of 0.81 V, extremely close to commercial Pt/C catalysts, indicating that the catalyst also possesses outstanding ORR performance.",
        "openArchiveArticle": "false",
        "prism:coverDate": "2020-03-31",
        "openaccessUserLicense": null,
        "prism:aggregationType": "Journal",
        "prism:url": "https://api.elsevier.com/content/article/pii/S0021951720300270",
        "dc:creator": [
          {
            "@_fa": "true",
            "$": "Zhao, Jiahuan"
          },
          {
            "@_fa": "true",
            "$": "Pu, Zonghua"
          },
          {
            "@_fa": "true",
            "$": "Jin, Huihui"
          },
          {
            "@_fa": "true",
            "$": "Zhang, Zhiwei"
          },
          {
            "@_fa": "true",
            "$": "Liu, Jing"
          },
          {
            "@_fa": "true",
            "$": "Mu, Shichun"
          }
        ],
        "link": [
          {
            "@_fa": "true",
            "@rel": "self",
            "@href": "https://api.elsevier.com/content/article/pii/S0021951720300270"
          },
          {
            "@_fa": "true",
            "@rel": "scidir",
            "@href": "https://www.sciencedirect.com/science/article/pii/S0021951720300270"
          }
        ],
        "dc:format": "application/json",
        "openaccessType": null,
        "pii": "S0021-9517(20)30027-0",
        "prism:volume": "383",
        "prism:publisher": "Elsevier Inc.",
        "dc:title": "Phosphorous-doped carbon coordinated iridium diphosphide bifunctional catalyst with ultralow iridium amount for efficient all-pH-value hydrogen evolution and oxygen reduction reactions",
        "prism:copyright": "© 2020 Elsevier Inc. All rights reserved.",
        "openaccess": "0",
        "prism:issn": "00219517",
        "dcterms:subject": [
          {
            "@_fa": "true",
            "$": "Bifunctional catalyst"
          },
          {
            "@_fa": "true",
            "$": "Iridium diphosphide"
          },
          {
            "@_fa": "true",
            "$": "Hydrogen evolution reaction"
          },
          {
            "@_fa": "true",
            "$": "Oxygen reduction reaction"
          },
          {
            "@_fa": "true",
            "$": "All-pH-value"
          }
        ],
        "openaccessArticle": "false",
        "prism:publicationName": "Journal of Catalysis",
        "openaccessSponsorType": null,
        "prism:pageRange": "244-253",
        "prism:endingPage": "253",
        "pubType": "fla",
        "prism:coverDisplayDate": "March 2020",
        "prism:doi": "10.1016/j.jcat.2020.01.026",
        "prism:startingPage": "244",
        "dc:identifier": "doi:10.1016/j.jcat.2020.01.026",
        "openaccessSponsorName": null
      },
      "objects": {
        "object": [
          {
            "@category": "standard",
            "@height": "501",
            "@width": "667",
            "@_fa": "true",
            "$": "https://api.elsevier.com/content/object/eid/1-s2.0-S0021951720300270-gr10.jpg?httpAccept=%2A%2F%2A",
            "@multimediatype": "JPEG image file",
            "@type": "IMAGE-DOWNSAMPLED",
            "@size": "86582",
            "@ref": "gr10",
            "@mimetype": "image/jpeg"
          },
          {
            "@category": "standard",
            "@height": "664",
            "@width": "665",
            "@_fa": "true",
            "$": "https://api.elsevier.com/content/object/eid/1-s2.0-S0021951720300270-gr2.jpg?httpAccept=%2A%2F%2A",
            "@multimediatype": "JPEG image file",
            "@type": "IMAGE-DOWNSAMPLED",
            "@size": "150849",
            "@ref": "gr2",
            "@mimetype": "image/jpeg"
          },
          {
            "@category": "standard",
            "@height": "402",
            "@width": "756",
            "@_fa": "true",
            "$": "https://api.elsevier.com/content/object/eid/1-s2.0-S0021951720300270-gr3.jpg?httpAccept=%2A%2F%2A",
            "@multimediatype": "JPEG image file",
            "@type": "IMAGE-DOWNSAMPLED",
            "@size": "66489",
            "@ref": "gr3",
            "@mimetype": "image/jpeg"
          },
          {
            "@category": "standard",
            "@height": "491",
            "@width": "667",
            "@_fa": "true",
            "$": "https://api.elsevier.com/content/object/eid/1-s2.0-S0021951720300270-gr4.jpg?httpAccept=%2A%2F%2A",
            "@multimediatype": "JPEG image file",
            "@type": "IMAGE-DOWNSAMPLED",
            "@size": "80559",
            "@ref": "gr4",
            "@mimetype": "image/jpeg"
          },
          {
            "@category": "standard",
            "@height": "498",
            "@width": "666",
            "@_fa": "true",
            "$": "https://api.elsevier.com/content/object/eid/1-s2.0-S0021951720300270-gr5.jpg?httpAccept=%2A%2F%2A",
            "@multimediatype": "JPEG image file",
            "@type": "IMAGE-DOWNSAMPLED",
            "@size": "75659",
            "@ref": "gr5",
            "@mimetype": "image/jpeg"
          },
          {
            "@category": "standard",
            "@height": "509",
            "@width": "667",
            "@_fa": "true",
            "$": "https://api.elsevier.com/content/object/eid/1-s2.0-S0021951720300270-gr6.jpg?httpAccept=%2A%2F%2A",
            "@multimediatype": "JPEG image file",
            "@type": "IMAGE-DOWNSAMPLED",
            "@size": "83320",
            "@ref": "gr6",
            "@mimetype": "image/jpeg"
          },
          {
            "@category": "standard",
            "@height": "691",
            "@width": "667",
            "@_fa": "true",
            "$": "https://api.elsevier.com/content/object/eid/1-s2.0-S0021951720300270-gr7.jpg?httpAccept=%2A%2F%2A",
            "@multimediatype": "JPEG image file",
            "@type": "IMAGE-DOWNSAMPLED",
            "@size": "198670",
            "@ref": "gr7",
            "@mimetype": "image/jpeg"
          },
          {
            "@category": "standard",
            "@height": "548",
            "@width": "667",
            "@_fa": "true",
            "$": "https://api.elsevier.com/content/object/eid/1-s2.0-S0021951720300270-gr8.jpg?httpAccept=%2A%2F%2A",
            "@multimediatype": "JPEG image file",
            "@type": "IMAGE-DOWNSAMPLED",
            "@size": "111326",
            "@ref": "gr8",
            "@mimetype": "image/jpeg"
          },
          {
            "@category": "standard",
            "@height": "312",
            "@width": "756",
            "@_fa": "true",
            "$": "https://api.elsevier.com/content/object/eid/1-s2.0-S0021951720300270-gr9.jpg?httpAccept=%2A%2F%2A",
            "@multimediatype": "JPEG image file",
            "@type": "IMAGE-DOWNSAMPLED",
            "@size": "48466",
            "@ref": "gr9",
            "@mimetype": "image/jpeg"
          },
          {
            "@category": "standard",
            "@height": "200",
            "@width": "378",
            "@_fa": "true",
            "$": "https://api.elsevier.com/content/object/eid/1-s2.0-S0021951720300270-ga1.jpg?httpAccept=%2A%2F%2A",
            "@multimediatype": "JPEG image file",
            "@type": "IMAGE-DOWNSAMPLED",
            "@size": "37380",
            "@ref": "ga1",
            "@mimetype": "image/jpeg"
          },
          {
            "@category": "standard",
            "@height": "222",
            "@width": "667",
            "@_fa": "true",
            "$": "https://api.elsevier.com/content/object/eid/1-s2.0-S0021951720300270-gr1.jpg?httpAccept=%2A%2F%2A",
            "@multimediatype": "JPEG image file",
            "@type": "IMAGE-DOWNSAMPLED",
            "@size": "35668",
            "@ref": "gr1",
            "@mimetype": "image/jpeg"
          },
          {
            "@category": "thumbnail",
            "@height": "164",
            "@width": "218",
            "@_fa": "true",
            "$": "https://api.elsevier.com/content/object/eid/1-s2.0-S0021951720300270-gr10.sml?httpAccept=%2A%2F%2A",
            "@multimediatype": "GIF image file",
            "@type": "IMAGE-THUMBNAIL",
            "@size": "10842",
            "@ref": "gr10",
            "@mimetype": "image/gif"
          },
          {
            "@category": "thumbnail",
            "@height": "164",
            "@width": "164",
            "@_fa": "true",
            "$": "https://api.elsevier.com/content/object/eid/1-s2.0-S0021951720300270-gr2.sml?httpAccept=%2A%2F%2A",
            "@multimediatype": "GIF image file",
            "@type": "IMAGE-THUMBNAIL",
            "@size": "16941",
            "@ref": "gr2",
            "@mimetype": "image/gif"
          },
          {
            "@category": "thumbnail",
            "@height": "116",
            "@width": "219",
            "@_fa": "true",
            "$": "https://api.elsevier.com/content/object/eid/1-s2.0-S0021951720300270-gr3.sml?httpAccept=%2A%2F%2A",
            "@multimediatype": "GIF image file",
            "@type": "IMAGE-THUMBNAIL",
            "@size": "7543",
            "@ref": "gr3",
            "@mimetype": "image/gif"
          },
          {
            "@category": "thumbnail",
            "@height": "161",
            "@width": "219",
            "@_fa": "true",
            "$": "https://api.elsevier.com/content/object/eid/1-s2.0-S0021951720300270-gr4.sml?httpAccept=%2A%2F%2A",
            "@multimediatype": "GIF image file",
            "@type": "IMAGE-THUMBNAIL",
            "@size": "10059",
            "@ref": "gr4",
            "@mimetype": "image/gif"
          },
          {
            "@category": "thumbnail",
            "@height": "164",
            "@width": "219",
            "@_fa": "true",
            "$": "https://api.elsevier.com/content/object/eid/1-s2.0-S0021951720300270-gr5.sml?httpAccept=%2A%2F%2A",
            "@multimediatype": "GIF image file",
            "@type": "IMAGE-THUMBNAIL",
            "@size": "9830",
            "@ref": "gr5",
            "@mimetype": "image/gif"
          },
          {
            "@category": "thumbnail",
            "@height": "164",
            "@width": "215",
            "@_fa": "true",
            "$": "https://api.elsevier.com/content/object/eid/1-s2.0-S0021951720300270-gr6.sml?httpAccept=%2A%2F%2A",
            "@multimediatype": "GIF image file",
            "@type": "IMAGE-THUMBNAIL",
            "@size": "10089",
            "@ref": "gr6",
            "@mimetype": "image/gif"
          },
          {
            "@category": "thumbnail",
            "@height": "164",
            "@width": "158",
            "@_fa": "true",
            "$": "https://api.elsevier.com/content/object/eid/1-s2.0-S0021951720300270-gr7.sml?httpAccept=%2A%2F%2A",
            "@multimediatype": "GIF image file",
            "@type": "IMAGE-THUMBNAIL",
            "@size": "14071",
            "@ref": "gr7",
            "@mimetype": "image/gif"
          },
          {
            "@category": "thumbnail",
            "@height": "164",
            "@width": "200",
            "@_fa": "true",
            "$": "https://api.elsevier.com/content/object/eid/1-s2.0-S0021951720300270-gr8.sml?httpAccept=%2A%2F%2A",
            "@multimediatype": "GIF image file",
            "@type": "IMAGE-THUMBNAIL",
            "@size": "21788",
            "@ref": "gr8",
            "@mimetype": "image/gif"
          },
          {
            "@category": "thumbnail",
            "@height": "90",
            "@width": "219",
            "@_fa": "true",
            "$": "https://api.elsevier.com/content/object/eid/1-s2.0-S0021951720300270-gr9.sml?httpAccept=%2A%2F%2A",
            "@multimediatype": "GIF image file",
            "@type": "IMAGE-THUMBNAIL",
            "@size": "4669",
            "@ref": "gr9",
            "@mimetype": "image/gif"
          },
          {
            "@category": "thumbnail",
            "@height": "116",
            "@width": "219",
            "@_fa": "true",
            "$": "https://api.elsevier.com/content/object/eid/1-s2.0-S0021951720300270-ga1.sml?httpAccept=%2A%2F%2A",
            "@multimediatype": "GIF image file",
            "@type": "IMAGE-THUMBNAIL",
            "@size": "21845",
            "@ref": "ga1",
            "@mimetype": "image/gif"
          },
          {
            "@category": "thumbnail",
            "@height": "73",
            "@width": "219",
            "@_fa": "true",
            "$": "https://api.elsevier.com/content/object/eid/1-s2.0-S0021951720300270-gr1.sml?httpAccept=%2A%2F%2A",
            "@multimediatype": "GIF image file",
            "@type": "IMAGE-THUMBNAIL",
            "@size": "6937",
            "@ref": "gr1",
            "@mimetype": "image/gif"
          },
          {
            "@category": "high",
            "@height": "2217",
            "@width": "2953",
            "@_fa": "true",
            "$": "https://api.elsevier.com/content/object/eid/1-s2.0-S0021951720300270-gr10_lrg.jpg?httpAccept=%2A%2F%2A",
            "@multimediatype": "JPEG image file",
            "@type": "IMAGE-HIGH-RES",
            "@size": "470333",
            "@ref": "gr10",
            "@mimetype": "image/jpeg"
          },
          {
            "@category": "high",
            "@height": "2940",
            "@width": "2943",
            "@_fa": "true",
            "$": "https://api.elsevier.com/content/object/eid/1-s2.0-S0021951720300270-gr2_lrg.jpg?httpAccept=%2A%2F%2A",
            "@multimediatype": "JPEG image file",
            "@type": "IMAGE-HIGH-RES",
            "@size": "1013534",
            "@ref": "gr2",
            "@mimetype": "image/jpeg"
          },
          {
            "@category": "high",
            "@height": "1778",
            "@width": "3346",
            "@_fa": "true",
            "$": "https://api.elsevier.com/content/object/eid/1-s2.0-S0021951720300270-gr3_lrg.jpg?httpAccept=%2A%2F%2A",
            "@multimediatype": "JPEG image file",
            "@type": "IMAGE-HIGH-RES",
            "@size": "437861",
            "@ref": "gr3",
            "@mimetype": "image/jpeg"
          },
          {
            "@category": "high",
            "@height": "2173",
            "@width": "2953",
            "@_fa": "true",
            "$": "https://api.elsevier.com/content/object/eid/1-s2.0-S0021951720300270-gr4_lrg.jpg?httpAccept=%2A%2F%2A",
            "@multimediatype": "JPEG image file",
            "@type": "IMAGE-HIGH-RES",
            "@size": "447230",
            "@ref": "gr4",
            "@mimetype": "image/jpeg"
          },
          {
            "@category": "high",
            "@height": "2205",
            "@width": "2950",
            "@_fa": "true",
            "$": "https://api.elsevier.com/content/object/eid/1-s2.0-S0021951720300270-gr5_lrg.jpg?httpAccept=%2A%2F%2A",
            "@multimediatype": "JPEG image file",
            "@type": "IMAGE-HIGH-RES",
            "@size": "374415",
            "@ref": "gr5",
            "@mimetype": "image/jpeg"
          },
          {
            "@category": "high",
            "@height": "2253",
            "@width": "2953",
            "@_fa": "true",
            "$": "https://api.elsevier.com/content/object/eid/1-s2.0-S0021951720300270-gr6_lrg.jpg?httpAccept=%2A%2F%2A",
            "@multimediatype": "JPEG image file",
            "@type": "IMAGE-HIGH-RES",
            "@size": "536439",
            "@ref": "gr6",
            "@mimetype": "image/jpeg"
          },
          {
            "@category": "high",
            "@height": "3060",
            "@width": "2953",
            "@_fa": "true",
            "$": "https://api.elsevier.com/content/object/eid/1-s2.0-S0021951720300270-gr7_lrg.jpg?httpAccept=%2A%2F%2A",
            "@multimediatype": "JPEG image file",
            "@type": "IMAGE-HIGH-RES",
            "@size": "1242892",
            "@ref": "gr7",
            "@mimetype": "image/jpeg"
          },
          {
            "@category": "high",
            "@height": "2425",
            "@width": "2953",
            "@_fa": "true",
            "$": "https://api.elsevier.com/content/object/eid/1-s2.0-S0021951720300270-gr8_lrg.jpg?httpAccept=%2A%2F%2A",
            "@multimediatype": "JPEG image file",
            "@type": "IMAGE-HIGH-RES",
            "@size": "642109",
            "@ref": "gr8",
            "@mimetype": "image/jpeg"
          },
          {
            "@category": "high",
            "@height": "1382",
            "@width": "3346",
            "@_fa": "true",
            "$": "https://api.elsevier.com/content/object/eid/1-s2.0-S0021951720300270-gr9_lrg.jpg?httpAccept=%2A%2F%2A",
            "@multimediatype": "JPEG image file",
            "@type": "IMAGE-HIGH-RES",
            "@size": "263885",
            "@ref": "gr9",
            "@mimetype": "image/jpeg"
          },
          {
            "@category": "high",
            "@height": "531",
            "@width": "1005",
            "@_fa": "true",
            "$": "https://api.elsevier.com/content/object/eid/1-s2.0-S0021951720300270-ga1_lrg.jpg?httpAccept=%2A%2F%2A",
            "@multimediatype": "JPEG image file",
            "@type": "IMAGE-HIGH-RES",
            "@size": "149153",
            "@ref": "ga1",
            "@mimetype": "image/jpeg"
          },
          {
            "@category": "high",
            "@height": "985",
            "@width": "2953",
            "@_fa": "true",
            "$": "https://api.elsevier.com/content/object/eid/1-s2.0-S0021951720300270-gr1_lrg.jpg?httpAccept=%2A%2F%2A",
            "@multimediatype": "JPEG image file",
            "@type": "IMAGE-HIGH-RES",
            "@size": "216070",
            "@ref": "gr1",
            "@mimetype": "image/jpeg"
          },
          {
            "@category": "standard",
            "@_fa": "true",
            "$": "https://api.elsevier.com/content/object/eid/1-s2.0-S0021951720300270-mmc1.docx?httpAccept=%2A%2F%2A",
            "@multimediatype": "Microsoft Word file",
            "@type": "APPLICATION",
            "@size": "2641155",
            "@ref": "mmc1",
            "@mimetype": "application/word"
          },
          {
            "@category": "standard",
            "@_fa": "true",
            "$": "https://api.elsevier.com/content/object/eid/1-s2.0-S0021951720300270-am.pdf?httpAccept=%2A%2F%2A",
            "@multimediatype": "Acrobat PDF file",
            "@type": "AAM-PDF",
            "@size": "5164679",
            "@ref": "am",
            "@mimetype": "application/pdf"
          }
        ]
      },
      "link": {
        "@rel": "abstract",
        "@href": "https://api.elsevier.com/content/abstract/scopus_id/85079227212"
      }
    }
  }
}