{
  "metadata": {
    "title": "Abridging the modeling of CO oxidation on single-atom catalysts: From microkinetics to descriptor-based analysis",
    "authors": "; ; ",
    "journal": "Journal of Catalysis",
    "date": "2025-10-31",
    "doi": "10.1016/j.jcat.2025.116308",
    "abstract": "",
    "uri": "https://api.elsevier.com/content/article/pii/S0021951725003732",
    "pii": "S0021951725003732"
  },
  "fulltext": {
    "full-text-retrieval-response": {
      "scopus-eid": "2-s2.0-105009624559",
      "originalText": "serial JL 272561 291210 291744 291809 31 90 Journal of Catalysis JOURNALCATALYSIS 2025-07-02 2025-07-02 2025-07-06 2025-07-06 2025-08-08T04:43:02 1-s2.0-S0021951725003732 S0021-9517(25)00373-2 S0021951725003732 10.1016/j.jcat.2025.116308 S300 S300.1 FULL-TEXT 1-s2.0-S0021951725X00087 2025-08-08T03:54:43.290001Z 0 0 20251001 20251031 2025 2025-07-02T15:07:52.945048Z absattachment articleinfo articlenumber articletitlenorm authfirstinitialnorm authfirstsurnamenorm cid cids contenttype copyright crossmark dateloaded dateloadedtxt datesearch datesort dateupdated dco docsubtype doctype doi eid ewtransactionid fundingbodyid hubeid indexeddate issn issnnorm itemstage itemtransactionid itemweight oauserlicense openaccess openarchive pg pgfirst pii piinorm pubdateend pubdatestart pubdatetxt pubyr sectiontitle sortorder sponsoredaccesstype srctitle srctitlenorm srctype ssids alllist content oa subj subheadings suppl tomb volfirst volissue volumelist webpdf webpdfpagecount yearnav figure e-component body mmlmath acknowledge affil appendices articletitle auth authfirstini authfull authkeywords authlast grantnumber grantsponsor grantsponsorid highlightsabst orcid primabst pubtype ref specialabst 0021-9517 00219517 UNLIMITED SPCRUEHY25 true 450 450 C Volume 450 62 116308 116308 116308 202510 October 2025 2025-10-01 2025-10-31 2025 Regular Articles article fla © 2025 The Author(s). Published by Elsevier Inc. ABRIDGINGMODELINGCOOXIDATIONSINGLEATOMCATALYSTSMICROKINETICSDESCRIPTORBASEDANALYSIS SU H 1 Introduction 2 Methods 3 Results and discussion 3.1 Modeling the M/TiO2(110) catalyst 3.2 Adsorption of intermediates and elementary steps 3.3 Microkinetic modeling 4 Conclusions CRediT authorship contribution statement Acknowledgments Appendix A Supplementary data References QIAO 2011 634 641 B HACKETT 2007 8593 8596 S TANG 2010 125 137 W ZHANG 2005 7132 7135 X SUN 2019 12372 12381 Y LUO 2020 1215 1223 F JAOUEN 2011 114 130 F JU 2017 944 W LI 2016 2427 2431 X ZHANG 2020 2000768 Q YANG 2013 1740 1748 X CALLEVALLEJO 2013 1245 1249 F LIU 2017 34 59 J QIAO 2015 2913 2924 B SU 2022 153614 H GUAN 2017 2081 2088 H SUN 2017 4022 4031 X SU 2021 3261 3269 H LIN 2017 4003 4012 J FILOT 2015 5453 5467 I MEDFORD 2015 794 807 A SU 2009 8266 8272 H SU 2008 683 686 H JIANG 2009 10548 10553 T MURAVEV 2021 469 478 V LU 2024 28141 28152 Y WANG 2022 12927 12941 L CHEN 2017 4613 4620 X KRESSE 1996 11169 11186 G PERDEW 1996 3865 3868 J KRESSE 1999 1758 G BLOCHL 1994 17953 17979 P GRANT 1959 646 674 F MONKHORST 1976 5188 5192 H KURTH 1999 889 909 S SARGEANT 2021 115178 E NORSKOV 2004 17886 17892 J CALLEVALLEJO 2010 7699 7701 F GRANDAMARULANDA 2020 6900 6907 L YU 2011 064111 M NELSON 2020 1931 1940 R DERINGER 2011 5461 5466 V SU 2016 5302 5306 H ZHAO 2024 6391 J HENKELMAN 2000 9978 G SUN 2012 1118 K DUDAREV 1998 1505 1509 S SU 2020 4119 4124 H STEGELMANN 2009 8077 8082 C KIM 2008 12398 12408 H HARUTA 1997 153 166 M SCHUBERT 2001 113 122 M LIU 2003 266102 Z BAC 2022 2064 2076 S EVANS 1938 11 24 M VOJVODIC 2011 244509 A WANG 2011 370 373 S SIANI 2006 5160 5167 A ORTIZSOTO 2006 3112 3117 L YANG 2021 4610 4617 Y CHEN 2007 5326 5331 M ZHANG 2000 2134 2135 C RASMUSSEN 2004 988 997 M MAYERNICK 2009 084701 A ZOU 2024 159175 X SARMA 2020 14890 14902 B GUAN 2016 2820 2824 H FALSIG 2008 4835 4839 H LEBEDEVA 2002 12938 12947 N CALLEVALLEJO 2017 4355 4359 F RODRIGUEZ 2014 182 189 P BERRETTI 2023 30 E SU 2008 194707 H SU 2024 2608 2618 H SU 2023 157721 H SUX2025X116308 SUX2025X116308XH Full 2025-06-30T10:05:05Z ElsevierWaived Spain (CRUE): Core Hybrid journals RAP 2025 http://creativecommons.org/licenses/by-nc/4.0/ 2027-07-06T00:00:00.000Z 2027-07-06T00:00:00.000Z http://creativecommons.org/licenses/by-nc-nd/4.0/ This is an open access article under the CC BY-NC license. © 2025 The Author(s). Published by Elsevier Inc. 2025-07-08T01:55:46.047Z http://vtw.elsevier.com/data/voc/AddOnTypes/50.7/aggregated-refined National Natural Science Foundation of China 22172026 National Natural Science Foundation of China http://data.elsevier.com/vocabulary/SciValFunders/501100001809 http://sws.geonames.org/1814991 Basque Government http://data.elsevier.com/vocabulary/SciValFunders/501100003086 http://sws.geonames.org/2510769 Key Science and Technology Project of Social Development Foundation of Dongguan 20211800904612 MICIU/AEI/10.13039/501100011033 Guangdong Provincial Key Laboratory of Distributed Energy Systems 2020B1212060075 PID2021-127957NB-I00 TED2021-132550B-C21 Ministerio de Ciencia e Innovación http://data.elsevier.com/vocabulary/SciValFunders/501100004837 http://sws.geonames.org/2510769 European Union EC European Commission http://data.elsevier.com/vocabulary/SciValFunders/501100000780 http://sws.geonames.org/6695072/ Natural Science Foundation of Hebei Province B2021203016 Hebei Provincial Natural Science Foundation http://data.elsevier.com/vocabulary/SciValFunders/501100003787 http://sws.geonames.org/1814991 We gratefully acknowledge the financial support from the National Natural Science Foundation of China (22172026), Natural Science Foundation of Hebei Province (B2021203016) and Guangdong Provincial Key Laboratory of Distributed Energy Systems (2020B1212060075) and Key Science and Technology Project of Social Development Foundation of Dongguan (20211800904612). The grants PID2021-127957NB-I00 and TED2021-132550B-C21 were funded by MICIU/AEI/10.13039/501100011033 and by the European Union. FCV also acknowledges financial support through grant IT1453-22 \\u201CGrupos Consolidados UPV/EHU del Gobierno Vasco\\u201D. item S0021-9517(25)00373-2 S0021951725003732 1-s2.0-S0021951725003732 10.1016/j.jcat.2025.116308 272561 2025-08-08T03:54:43.290001Z 2025-10-01 2025-10-31 UNLIMITED SPCRUEHY25 1-s2.0-S0021951725003732-main.pdf https://s3-eu-west-1.amazonaws.com/prod-ucs-content-store-eu-west/content/pii:S0021951725003732/MAIN/application/pdf/db5b95f4b8e611aff6c57bf8998c70d5/main.pdf main.pdf pdf true 4990294 MAIN 11 1-s2.0-S0021951725003732-main_1.png https://s3-eu-west-1.amazonaws.com/prod-ucs-content-store-eu-west/content/pii:S0021951725003732/PREVIEW/image/png/ed4e7e0c7def7564e5722652cebb6552/main_1.png main_1.png png 59183 928 656 IMAGE-WEB-PDF 1 1-s2.0-S0021951725003732-gr2.jpg https://s3-eu-west-1.amazonaws.com/prod-ucs-content-store-eu-west/content/pii:S0021951725003732/gr2/DOWNSAMPLED/image/jpeg/d7f599227bda2c5e75a9a8b31c3933e8/gr2.jpg gr2 gr2.jpg jpg 91505 302 728 IMAGE-DOWNSAMPLED 1-s2.0-S0021951725003732-ga1.jpg https://s3-eu-west-1.amazonaws.com/prod-ucs-content-store-eu-west/content/pii:S0021951725003732/ga1/DOWNSAMPLED/image/jpeg/d8df6b7915d66a7c3acf3d1c7e8a6b5a/ga1.jpg ga1 true ga1.jpg jpg 15235 245 283 IMAGE-DOWNSAMPLED 1-s2.0-S0021951725003732-gr1.jpg https://s3-eu-west-1.amazonaws.com/prod-ucs-content-store-eu-west/content/pii:S0021951725003732/gr1/DOWNSAMPLED/image/jpeg/67c627b1156b53493e1891868f87aa56/gr1.jpg gr1 gr1.jpg jpg 120292 316 732 IMAGE-DOWNSAMPLED 1-s2.0-S0021951725003732-gr4.jpg https://s3-eu-west-1.amazonaws.com/prod-ucs-content-store-eu-west/content/pii:S0021951725003732/gr4/DOWNSAMPLED/image/jpeg/c5f8d5341703468a6e7b7866d77ae082/gr4.jpg gr4 gr4.jpg jpg 42772 226 534 IMAGE-DOWNSAMPLED 1-s2.0-S0021951725003732-gr3.jpg https://s3-eu-west-1.amazonaws.com/prod-ucs-content-store-eu-west/content/pii:S0021951725003732/gr3/DOWNSAMPLED/image/jpeg/3686ac6b76c12e659d0a74ecd6c67327/gr3.jpg gr3 gr3.jpg jpg 145721 614 657 IMAGE-DOWNSAMPLED 1-s2.0-S0021951725003732-gr6.jpg https://s3-eu-west-1.amazonaws.com/prod-ucs-content-store-eu-west/content/pii:S0021951725003732/gr6/DOWNSAMPLED/image/jpeg/b1b7b2c0b0149235d570200fe42c883d/gr6.jpg gr6 gr6.jpg jpg 103653 573 622 IMAGE-DOWNSAMPLED 1-s2.0-S0021951725003732-gr5.jpg https://s3-eu-west-1.amazonaws.com/prod-ucs-content-store-eu-west/content/pii:S0021951725003732/gr5/DOWNSAMPLED/image/jpeg/0cc085b6ea7edbc18f9baa0aead12695/gr5.jpg gr5 gr5.jpg jpg 109511 594 685 IMAGE-DOWNSAMPLED 1-s2.0-S0021951725003732-gr7.jpg https://s3-eu-west-1.amazonaws.com/prod-ucs-content-store-eu-west/content/pii:S0021951725003732/gr7/DOWNSAMPLED/image/jpeg/b2d696326ac0feab5e2d7c338d41d348/gr7.jpg gr7 gr7.jpg jpg 22221 331 383 IMAGE-DOWNSAMPLED 1-s2.0-S0021951725003732-gr2.sml https://s3-eu-west-1.amazonaws.com/prod-ucs-content-store-eu-west/content/pii:S0021951725003732/gr2/THUMBNAIL/image/gif/54010b32ac6f619b82dd475114ebc01b/gr2.sml gr2 gr2.sml sml 13942 91 219 IMAGE-THUMBNAIL 1-s2.0-S0021951725003732-ga1.sml https://s3-eu-west-1.amazonaws.com/prod-ucs-content-store-eu-west/content/pii:S0021951725003732/ga1/THUMBNAIL/image/gif/f5659f903b5dd08c67745f10c88547e2/ga1.sml ga1 true ga1.sml sml 7661 163 189 IMAGE-THUMBNAIL 1-s2.0-S0021951725003732-gr1.sml https://s3-eu-west-1.amazonaws.com/prod-ucs-content-store-eu-west/content/pii:S0021951725003732/gr1/THUMBNAIL/image/gif/44a51b6e515ced2b0036c9359d6dd386/gr1.sml gr1 gr1.sml sml 20500 95 219 IMAGE-THUMBNAIL 1-s2.0-S0021951725003732-gr4.sml https://s3-eu-west-1.amazonaws.com/prod-ucs-content-store-eu-west/content/pii:S0021951725003732/gr4/THUMBNAIL/image/gif/11f23aaff4519cc98d0ba25a0d6e06f8/gr4.sml gr4 gr4.sml sml 8180 92 219 IMAGE-THUMBNAIL 1-s2.0-S0021951725003732-gr3.sml https://s3-eu-west-1.amazonaws.com/prod-ucs-content-store-eu-west/content/pii:S0021951725003732/gr3/THUMBNAIL/image/gif/e0c537c15b7c487a01aa3aa30c6a429c/gr3.sml gr3 gr3.sml sml 16686 163 175 IMAGE-THUMBNAIL 1-s2.0-S0021951725003732-gr6.sml https://s3-eu-west-1.amazonaws.com/prod-ucs-content-store-eu-west/content/pii:S0021951725003732/gr6/THUMBNAIL/image/gif/eb62df7be41504b761306b8278abda03/gr6.sml gr6 gr6.sml sml 10580 164 178 IMAGE-THUMBNAIL 1-s2.0-S0021951725003732-gr5.sml https://s3-eu-west-1.amazonaws.com/prod-ucs-content-store-eu-west/content/pii:S0021951725003732/gr5/THUMBNAIL/image/gif/8dc18ab971d866c12947f74fda15fec1/gr5.sml gr5 gr5.sml sml 14640 164 189 IMAGE-THUMBNAIL 1-s2.0-S0021951725003732-gr7.sml https://s3-eu-west-1.amazonaws.com/prod-ucs-content-store-eu-west/content/pii:S0021951725003732/gr7/THUMBNAIL/image/gif/49b671bf8ec3090c41c47e768ed6ffcf/gr7.sml gr7 gr7.sml sml 7609 164 189 IMAGE-THUMBNAIL 1-s2.0-S0021951725003732-gr2_lrg.jpg https://s3-eu-west-1.amazonaws.com/prod-ucs-content-store-eu-west/content/pii:S0021951725003732/HIGHRES/image/jpeg/961c8df80cc28bd3061f2b601f70a005/gr2_lrg.jpg gr2 gr2_lrg.jpg jpg 480450 1336 3223 IMAGE-HIGH-RES 1-s2.0-S0021951725003732-ga1_lrg.jpg https://s3-eu-west-1.amazonaws.com/prod-ucs-content-store-eu-west/content/pii:S0021951725003732/HIGHRES/image/jpeg/f8b81a1b1c7323e1843ab3dd423610f7/ga1_lrg.jpg ga1 true ga1_lrg.jpg jpg 79107 1085 1255 IMAGE-HIGH-RES 1-s2.0-S0021951725003732-gr1_lrg.jpg https://s3-eu-west-1.amazonaws.com/prod-ucs-content-store-eu-west/content/pii:S0021951725003732/HIGHRES/image/jpeg/bdc004e5490e5b800801f6ba5ae98661/gr1_lrg.jpg gr1 gr1_lrg.jpg jpg 618355 1398 3239 IMAGE-HIGH-RES 1-s2.0-S0021951725003732-gr4_lrg.jpg https://s3-eu-west-1.amazonaws.com/prod-ucs-content-store-eu-west/content/pii:S0021951725003732/HIGHRES/image/jpeg/27b714d17883ec656e8935710f8bdf06/gr4_lrg.jpg gr4 gr4_lrg.jpg jpg 282848 998 2363 IMAGE-HIGH-RES 1-s2.0-S0021951725003732-gr3_lrg.jpg https://s3-eu-west-1.amazonaws.com/prod-ucs-content-store-eu-west/content/pii:S002195172500332X/HIGHRES/image/jpeg/e7a99e2334febe04156daf05800d5fc9/gr3_lrg.jpg gr3 gr3_lrg.jpg jpg 723631 2718 2910 IMAGE-HIGH-RES 1-s2.0-S0021951725003732-gr6_lrg.jpg https://s3-eu-west-1.amazonaws.com/prod-ucs-content-store-eu-west/content/pii:S002195172500332X/HIGHRES/image/jpeg/ea1f1aa6b8b34f8d6579c73d2cb4194c/gr6_lrg.jpg gr6 gr6_lrg.jpg jpg 659970 2541 2756 IMAGE-HIGH-RES 1-s2.0-S0021951725003732-gr5_lrg.jpg https://s3-eu-west-1.amazonaws.com/prod-ucs-content-store-eu-west/content/pii:S002195172500332X/HIGHRES/image/jpeg/83ca53c580539c7dd607d17e2b454f12/gr5_lrg.jpg gr5 gr5_lrg.jpg jpg 691815 2628 3033 IMAGE-HIGH-RES 1-s2.0-S0021951725003732-gr7_lrg.jpg https://s3-eu-west-1.amazonaws.com/prod-ucs-content-store-eu-west/content/pii:S0021951725003732/HIGHRES/image/jpeg/f67554802dda5a2a221343b1511d0739/gr7_lrg.jpg gr7 gr7_lrg.jpg jpg 121629 1470 1699 IMAGE-HIGH-RES 1-s2.0-S0021951725003732-mmc1.pdf https://s3-eu-west-1.amazonaws.com/prod-ucs-content-store-eu-west/content/pii:S0021951725003732/mmc1/MAIN/application/pdf/85c7ccc61e342d5b89ba30163daefb64/mmc1.pdf mmc1 mmc1.pdf pdf false 2897479 APPLICATION 1-s2.0-S0021951725003732-si1.svg https://s3-eu-west-1.amazonaws.com/prod-ucs-content-store-eu-west/content/pii:S0021951725003732/image/svg+xml/8425067980b9e8b3e69c9e5d453f4010/si1.svg si1 si1.svg svg 16447 ALTIMG 1-s2.0-S0021951725003732-si10.svg https://s3-eu-west-1.amazonaws.com/prod-ucs-content-store-eu-west/content/pii:S0021951725003732/image/svg+xml/1f4a5d43b7a78932a933763eaa6965c1/si10.svg si10 si10.svg svg 12705 ALTIMG 1-s2.0-S0021951725003732-si11.svg https://s3-eu-west-1.amazonaws.com/prod-ucs-content-store-eu-west/content/pii:S0021951725003732/image/svg+xml/d34269e438aed48a95fd74775c478767/si11.svg si11 si11.svg svg 5237 ALTIMG 1-s2.0-S0021951725003732-si12.svg https://s3-eu-west-1.amazonaws.com/prod-ucs-content-store-eu-west/content/pii:S0021951725003732/image/svg+xml/55fef27786805410738a73c4d84d5242/si12.svg si12 si12.svg svg 21233 ALTIMG 1-s2.0-S0021951725003732-si13.svg https://s3-eu-west-1.amazonaws.com/prod-ucs-content-store-eu-west/content/pii:S0021951725003732/image/svg+xml/693e44423e5d225abc3d79876404924b/si13.svg si13 si13.svg svg 1025 ALTIMG 1-s2.0-S0021951725003732-si14.svg https://s3-eu-west-1.amazonaws.com/prod-ucs-content-store-eu-west/content/pii:S0021951725003732/image/svg+xml/f14421e63ff1cd1a8696aae232d983a4/si14.svg si14 si14.svg svg 22580 ALTIMG 1-s2.0-S0021951725003732-si15.svg https://s3-eu-west-1.amazonaws.com/prod-ucs-content-store-eu-west/content/pii:S0021951725003732/image/svg+xml/493ef868879296990c761e433f0bc377/si15.svg si15 si15.svg svg 5877 ALTIMG 1-s2.0-S0021951725003732-si16.svg https://s3-eu-west-1.amazonaws.com/prod-ucs-content-store-eu-west/content/pii:S0021951725003732/image/svg+xml/c75b304c1827e8cfc4b36415a52c65b2/si16.svg si16 si16.svg svg 4123 ALTIMG 1-s2.0-S0021951725003732-si17.svg https://s3-eu-west-1.amazonaws.com/prod-ucs-content-store-eu-west/content/pii:S0021951725003732/image/svg+xml/f71404d5123d9b30fc9a906957656ef2/si17.svg si17 si17.svg svg 5642 ALTIMG 1-s2.0-S0021951725003732-si18.svg https://s3-eu-west-1.amazonaws.com/prod-ucs-content-store-eu-west/content/pii:S0021951725003732/image/svg+xml/68396e5d3eb46f8ed94f4fbe97cd2e15/si18.svg si18 si18.svg svg 3662 ALTIMG 1-s2.0-S0021951725003732-si19.svg https://s3-eu-west-1.amazonaws.com/prod-ucs-content-store-eu-west/content/pii:S0021951725003732/image/svg+xml/9c14069b0f7db2d99d088de787bfff61/si19.svg si19 si19.svg svg 3574 ALTIMG 1-s2.0-S0021951725003732-si2.svg https://s3-eu-west-1.amazonaws.com/prod-ucs-content-store-eu-west/content/pii:S0021951725003732/image/svg+xml/b408a94e8683b8d3f0eaa1a5762b758a/si2.svg si2 si2.svg svg 5502 ALTIMG 1-s2.0-S0021951725003732-si20.svg https://s3-eu-west-1.amazonaws.com/prod-ucs-content-store-eu-west/content/pii:S0021951725003732/image/svg+xml/5799a2feea0535760b6ae813b796435a/si20.svg si20 si20.svg svg 2298 ALTIMG 1-s2.0-S0021951725003732-si21.svg https://s3-eu-west-1.amazonaws.com/prod-ucs-content-store-eu-west/content/pii:S0021951725003732/image/svg+xml/492396a1226cf40cc11ffcbe1cb8f1f1/si21.svg si21 si21.svg svg 2955 ALTIMG 1-s2.0-S0021951725003732-si22.svg https://s3-eu-west-1.amazonaws.com/prod-ucs-content-store-eu-west/content/pii:S0021951725003732/image/svg+xml/7151abeb96c656ae9d45eb5494c23315/si22.svg si22 si22.svg svg 1867 ALTIMG 1-s2.0-S0021951725003732-si23.svg https://s3-eu-west-1.amazonaws.com/prod-ucs-content-store-eu-west/content/pii:S0021951725003732/image/svg+xml/079c910daa5abd73f691f58ed8151cc6/si23.svg si23 si23.svg svg 6592 ALTIMG 1-s2.0-S0021951725003732-si24.svg https://s3-eu-west-1.amazonaws.com/prod-ucs-content-store-eu-west/content/pii:S0021951725003732/image/svg+xml/e6964e2b6832d8bcd28bc3ea3456b295/si24.svg si24 si24.svg svg 10580 ALTIMG 1-s2.0-S0021951725003732-si25.svg https://s3-eu-west-1.amazonaws.com/prod-ucs-content-store-eu-west/content/pii:S0021951725003732/image/svg+xml/1e5d0eb55b9ecdc3fb9312863384e016/si25.svg si25 si25.svg svg 3342 ALTIMG 1-s2.0-S0021951725003732-si26.svg https://s3-eu-west-1.amazonaws.com/prod-ucs-content-store-eu-west/content/pii:S0021951725003732/image/svg+xml/c987201f1293a53b0a2e556d40229ade/si26.svg si26 si26.svg svg 5385 ALTIMG 1-s2.0-S0021951725003732-si27.svg https://s3-eu-west-1.amazonaws.com/prod-ucs-content-store-eu-west/content/pii:S0021951725003732/image/svg+xml/968776b68881756a9929271229d8a223/si27.svg si27 si27.svg svg 5294 ALTIMG 1-s2.0-S0021951725003732-si28.svg https://s3-eu-west-1.amazonaws.com/prod-ucs-content-store-eu-west/content/pii:S0021951725003732/image/svg+xml/ba54fd08b6cc1bd4cdceb4297634e03d/si28.svg si28 si28.svg svg 865 ALTIMG 1-s2.0-S0021951725003732-si29.svg https://s3-eu-west-1.amazonaws.com/prod-ucs-content-store-eu-west/content/pii:S0021951725003732/image/svg+xml/73dc6aeb8e54847da172d12af5acd7e5/si29.svg si29 si29.svg svg 1360 ALTIMG 1-s2.0-S0021951725003732-si3.svg https://s3-eu-west-1.amazonaws.com/prod-ucs-content-store-eu-west/content/pii:S0021951725003732/image/svg+xml/da50a0fa856e8015b4786f42b2937ee8/si3.svg si3 si3.svg svg 7137 ALTIMG 1-s2.0-S0021951725003732-si30.svg https://s3-eu-west-1.amazonaws.com/prod-ucs-content-store-eu-west/content/pii:S0021951725003732/image/svg+xml/5607abb8d74e03f77f726d7c9643b715/si30.svg si30 si30.svg svg 2411 ALTIMG 1-s2.0-S0021951725003732-si31.svg https://s3-eu-west-1.amazonaws.com/prod-ucs-content-store-eu-west/content/pii:S0021951725003732/image/svg+xml/379be5e32bf2a4ccaf1b3ecd0a1e45ae/si31.svg si31 si31.svg svg 2867 ALTIMG 1-s2.0-S0021951725003732-si32.svg https://s3-eu-west-1.amazonaws.com/prod-ucs-content-store-eu-west/content/pii:S0021951725003732/image/svg+xml/9c2f6ef41451048357b5834a95f350c6/si32.svg si32 si32.svg svg 23155 ALTIMG 1-s2.0-S0021951725003732-si33.svg https://s3-eu-west-1.amazonaws.com/prod-ucs-content-store-eu-west/content/pii:S0021951725003732/image/svg+xml/9e4bc482d72505931d3f33d9fae4d9d9/si33.svg si33 si33.svg svg 9147 ALTIMG 1-s2.0-S0021951725003732-si34.svg https://s3-eu-west-1.amazonaws.com/prod-ucs-content-store-eu-west/content/pii:S0021951725003732/image/svg+xml/104dc18e164a75aff749c72dcb2a9ac6/si34.svg si34 si34.svg svg 24599 ALTIMG 1-s2.0-S0021951725003732-si35.svg https://s3-eu-west-1.amazonaws.com/prod-ucs-content-store-eu-west/content/pii:S0021951725003732/image/svg+xml/c978594a19c1e8685e241bf0f9462ba2/si35.svg si35 si35.svg svg 25563 ALTIMG 1-s2.0-S0021951725003732-si36.svg https://s3-eu-west-1.amazonaws.com/prod-ucs-content-store-eu-west/content/pii:S0021951725003732/image/svg+xml/928bebcaaf6e8a44543fbcff02810456/si36.svg si36 si36.svg svg 24456 ALTIMG 1-s2.0-S0021951725003732-si4.svg https://s3-eu-west-1.amazonaws.com/prod-ucs-content-store-eu-west/content/pii:S0021951725003732/image/svg+xml/5b770c219eb3edf3091579884e8f999d/si4.svg si4 si4.svg svg 4032 ALTIMG 1-s2.0-S0021951725003732-si5.svg https://s3-eu-west-1.amazonaws.com/prod-ucs-content-store-eu-west/content/pii:S0021951725003732/image/svg+xml/4210c68222070ebf3a79ce5ba438da90/si5.svg si5 si5.svg svg 3105 ALTIMG 1-s2.0-S0021951725003732-si6.svg https://s3-eu-west-1.amazonaws.com/prod-ucs-content-store-eu-west/content/pii:S0021951725003732/image/svg+xml/214b66cf42576f67993627867a5adaf9/si6.svg si6 si6.svg svg 17132 ALTIMG 1-s2.0-S0021951725003732-si7.svg https://s3-eu-west-1.amazonaws.com/prod-ucs-content-store-eu-west/content/pii:S0021951725003732/image/svg+xml/178c6646b92f1b99f09b96741c7c5dc6/si7.svg si7 si7.svg svg 9299 ALTIMG 1-s2.0-S0021951725003732-si8.svg https://s3-eu-west-1.amazonaws.com/prod-ucs-content-store-eu-west/content/pii:S0021951725003732/image/svg+xml/1005347635baab5d87ca6f6eda35edc1/si8.svg si8 si8.svg svg 3636 ALTIMG 1-s2.0-S0021951725003732-si9.svg https://s3-eu-west-1.amazonaws.com/prod-ucs-content-store-eu-west/content/pii:S0021951725003732/image/svg+xml/d06f1b111c379897d39f294c2aa3d7a6/si9.svg si9 si9.svg svg 14608 ALTIMG YJCAT 116308 116308 S0021-9517(25)00373-2 10.1016/j.jcat.2025.116308 The Author(s) Fig. 1 Top view of stoichiometric (a, b, c) and reduced (d, e, f) TiO2(110) and M/TiO2(110) (M = 3d–5d metals). The blue, yellow and red balls and black dashed circles represent Ti, M and O atoms and O vacancies, respectively. (For interpretation of the references to color in this figure legend, the reader is referred to the web version of this article.) Fig. 2 Differential charge density map for O adsorption at the bridge oxygen vacancy on reduced TiO2(110) and M/TiO2(110) (M = Ta, W, Os and Pt). Blue, cyan, purple, green, grey and red spheres represent Ti, Ta, W, Os, Pt and O, respectively. Blue and yellow–red isosurfaces indicate charge depletion and accumulation, respectively. The 2D profile is a cut along the x-z plane with two bridge O–Ti bonds (upper panels) and Ti or M atoms (lower panels). (For interpretation of the references to color in this figure legend, the reader is referred to the web version of this article.) Fig. 3 Dissociative (a) and associative routes (b, c and d) for CO oxidation in the co-adsorption model. M/TiO2-x, *, and # denote the reduced M/TiO2(110) surface, bridge O vacancy and M, and the nearest Ti to M, respectively. Blue, yellow, grey, red and green balls represent Ti, M, C, lattice O in M/TiO2-x(110) and O in adsorbed species, respectively. O2* and O2*(II) in Fig. 3a correspond to Routes I and II, respectively. (CO + O2)*(III) and (CO + O2)*(IV) in (d) correspond to routes VII and VIII, respectively. Optimized configurations of the transition state of the reactions: (e) O2* → (2O)*, (f) O2*(II) → (2O)*, (g) (CO + 2O)*# → CO2 + O* + #, (h) (CO + O)* → CO2 + *, (i) (CO + O2)* → CO2 + O*, (j) (CO + O2)* → CO3*, (k) CO3* → CO2 + O*, (l) (CO + O2)*(II) → CO2 + O*, (m) (CO + O2)*(II) → CO3*, (n) (CO + O2)*(III) → CO3*, (o) (CO + O2)*(IV) → CO3* on the reduced M/TiO2(110). (For interpretation of the references to color in this figure legend, the reader is referred to the web version of this article.) Fig. 4 CO2 formation rate as a function of temperature on M/TiO2(110) (M is noted in each case) predicted by (a) co-adsorption (CA), and (b) separate adsorption (SA) models (P = 1 bar, CO/O2 = 2). Fig. 5 Ratio of the rates for various CO oxidation routes and the total reaction rate as a function of temperature on TiO2(110) and M/TiO2(110). CA and SA: co-adsorption and separate adsorption models. Fig. 6 Degree of rate control (DRC) of the elementary steps for CO oxidation as a function of temperature on TiO2(110) and M/TiO2(110). # denotes Ti and * denotes the bridge O vacancy and M. Only steps with absolute DRC values > 0.01 are shown. Fig. 7 CO oxidation rate as a function of the adsorption energy of O (ΔE Ads(OM)) at the M site of stoichiometric M/TiO2(110) at 400 K using the co-adsorption (CA) model. M is noted in each case in the figure, M = Ti is pure TiO2. The systems are classified according to their O binding as strong, intermediate and weak coupling catalysts. In line with the Sabatier principle, high activities are observed for intermediate-coupling catalysts. Research article Abridging the modeling of CO oxidation on single-atom catalysts: From microkinetics to descriptor-based analysis Hai-Yan Su Writing – review & editing Writing – original draft Resources Project administration Investigation Funding acquisition Formal analysis Data curation Conceptualization a Keju Sun Writing – review & editing Supervision Methodology Investigation Formal analysis Conceptualization b ⁎ Xiufang Ma Writing – review & editing Investigation c Xiangxuan Huang Writing – review & editing Formal analysis a Junquan Feng Writing – review & editing Formal analysis a Federico Calle-Vallejo Writing – review & editing Supervision Project administration Formal analysis Conceptualization d e ⁎ a Guangdong Provincial Key Laboratory of Distributed Energy Systems, School of Chemical Engineering and Energy Technology, Dongguan University of Technology, Dongguan 523808, China Guangdong Provincial Key Laboratory of Distributed Energy Systems School of Chemical Engineering and Energy Technology Dongguan University of Technology Dongguan 523808 China Guangdong Provincial Key Laboratory of Distributed Energy Systems, School of Chemical Engineering and Energy Technology, Dongguan University of Technology, Dongguan 523808, China b Hebei Key Laboratory of Applied Chemistry, School of Environmental and Chemical Engineering, Yanshan University, 438 Hebei Avenue, Qinhuangdao 066004, China Hebei Key Laboratory of Applied Chemistry School of Environmental and Chemical Engineering Yanshan University 438 Hebei Avenue Qinhuangdao 066004 China Hebei Key Laboratory of Applied Chemistry, School of Environmental and Chemical Engineering, Yanshan University, 438 Hebei Avenue, Qinhuangdao 066004, China c Institute of Thin Film Physics and Applications, Shenzhen Key Laboratory of Advanced Thin Films and Applications, Key Laboratory of Optoelectronic Devices and Systems of Ministry of Education and Guangdong Province, College of Physics and Optoelectronic Engineering, Shenzhen University, Shenzhen 518060, China Institute of Thin Film Physics and Applications Shenzhen Key Laboratory of Advanced Thin Films and Applications Key Laboratory of Optoelectronic Devices and Systems of Ministry of Education and Guangdong Province College of Physics and Optoelectronic Engineering Shenzhen University Shenzhen 518060 China Institute of Thin Film Physics and Applications, Shenzhen Key Laboratory of Advanced Thin Films and Applications, Key Laboratory of Optoelectronic Devices and Systems of Ministry of Education and Guangdong Province, College of Physics and Optoelectronic Engineering, Shenzhen University, Shenzhen 518060, China d Nano-Bio Spectroscopy Group and European Theoretical Spectroscopy Facility (ETSF), Department of Polymers and Advanced Materials: Physics, Chemistry and Technology, University of the Basque Country UPV/EHU, Av. Tolosa 72, 20018 San Sebastián, Spain Nano-Bio Spectroscopy Group and European Theoretical Spectroscopy Facility (ETSF) Department of Polymers and Advanced Materials: Physics, Chemistry and Technology University of the Basque Country UPV/EHU Av. Tolosa 72 San Sebastián 20018 Spain Nano-Bio Spectroscopy Group and European Theoretical Spectroscopy Facility (ETSF), Department of Polymers and Advanced Materials: Physics, Chemistry and Technology, University of the Basque Country UPV/EHU, Av. Tolosa 72, 20018 San Sebastián, Spain e IKERBASQUE, Basque Foundation for Science, Plaza de Euskadi 5, 48009 Bilbao, Spain IKERBASQUE Basque Foundation for Science Plaza de Euskadi 5 Bilbao 48009 Spain IKERBASQUE, Basque Foundation for Science, Plaza de Euskadi 5, 48009 Bilbao, Spain ⁎ Corresponding authors at: Nano-Bio Spectroscopy Group and European Theoretical Spectroscopy Facility (ETSF), Department of Polymers and Advanced Materials: Physics, Chemistry and Technology, University of the Basque Country UPV/EHU, Av. Tolosa 72, 20018 San Sebastián, Spain (F. Calle-Vallejo). Nano-Bio Spectroscopy Group and European Theoretical Spectroscopy Facility (ETSF) Department of Polymers and Advanced Materials: Physics, Chemistry and Technology University of the Basque Country UPV/EHU Av. Tolosa 72 San Sebastián 20018 Spain Graphical abstract Single-atom catalysts (SACs) display prominent performance and high metal utilization for numerous catalytic processes. Harnessing the interaction between single atoms and supports is crucial to improve the performance of SACs. By means of density functional theory calculations and microkinetic modeling including adsorbate interactions, we expose the promising synergy between 3d–5d single metal atoms (M) and TiO2(110) for CO oxidation. Upon a rigorous analysis, we identify the adsorption energy of O at M sites as a simple and robust descriptor to abridge the design of catalysts for CO oxidation on M/TiO2 catalysts, so that enhanced activities are predicted at mild O adsorption energies. Single Pt and Rh atoms provide the largest enhancement around 400 K, with CO2 formation rates 7–8 orders of magnitude higher than on TiO2(110). Non-precious Ta/TiO2 and Mn/TiO2 also exhibit salient activities. This work highlights the often disregarded yet central role of adsorbate interactions in CO oxidation. Keywords Single-atom catalyst Rutile oxide CO oxidation DFT calculations Microkinetic modeling Data availability Data will be made available on request. 1 Introduction Supported single-atom catalysts (SACs) have attracted considerable interest in recent years in view of their enhanced catalytic performance and higher metal utilization in comparison to supported metal catalysts. Great promise is held for important catalytic processes including oxidation [1–3] and hydrogenation reactions [4], oxygen reduction [5–7], CO2 reduction [8], photocatalytic water splitting [9], and numerous other reactions [10,11]. Importantly, incorporating a metal atom on an ionic support such as a metal oxide often implies that the SACs become cationic and, thus, their properties differ visibly from those of supported metal catalysts. In fact, the valence states of metal atoms can have a significant influence on the adsorption energies of reaction intermediates [12] and the overall catalytic performance [13], opening new possibilities to substitute precious metal catalysts by cheap and abundant metal cations by engineering catalyst-support interactions. In supported SACs, the electronic structure of the support can vary dramatically upon the incorporation of the individual atoms. For instance, the presence of SACs facilitates the formation of oxygen or sulfur vacancies on oxide or sulfide supports [14,15]. A synergetic interaction between SACs and such vacancies exists that helps catalyze a variety of reactions [16–18]. Specifically, CO molecules adsorb on single Rh or Pd atoms and an adjacent oxygen vacancy activates H2O molecules, providing enhanced activity and selectivity for the water–gas shift (WGS) on TiO2 and FeO x surfaces [16,17]. Moreover, a suitable combination of metal atoms and supports makes Pt1/FeO x SACs 2−3 times more active than the subnanometer counterparts for CO oxidation and its preferential oxidation in H2 [1]. However, FeO x -supported single Ir atoms exhibit lower activity for the two reactions than Ir subnanometer clusters [19]. These examples illustrate the need for a fundamental understanding of the interactions between SACs and supports, such that clear guidelines are established to find suitable combinations for specific catalytic reactions. These insights would definitely accelerate the design and implementation of SACs in many branches of catalysis. DFT-calculated activation energies and adsorption energies can be inputted into suitable microkinetic models to assess the kinetics of catalytic reactions, thereby connecting the atomic-scale properties and the macroscopic functionality of the catalyst. Often, microkinetic models use the activation energies of elementary reactions calculated with respect to the separate adsorption of species [20,21], which is a fair simplification as long as the interactions between adsorbed species are small. However, supported SACs may display strong metal-support interactions that in turn influence their catalytic activities. In such case, sizable deviations in the activation energies and reaction mechanism from the separate adsorption (SA) picture can be expected. Therefore, it is crucial to appraise if substrate-modulated interactions between species are important in SACs. By means of DFT calculations and microkinetic simulations including the interactions between intermediates (co-adsorption model, CA) or discarding them (separate adsorption model, SA), here we study how the reaction mechanism and catalytic activity for CO oxidation change as a function of the SAC added to a TiO2 catalyst. CO oxidation is markedly important in car-exhaust emission control, CO2 lasers, air purification, etc. As it is one of the simplest catalytic reactions, it is extensively used as a probe to understand more complex catalytic processes [22–27]. In a previous study, single atoms of Ir embedded in rutile TiO2 were synthesized by tuning the Ir content at 0.1 wt%, using an incipient-wetness impregnation method [28]. Aberration-corrected high-angle annular darkfield (AC-HAADF) images and X-ray absorption near-edge structure (XANES) showed that all Ir species in 0.1 wt% Ir/TiO2 are single atoms, positively charged with a structure similar to that of the IrO2 phase but different from that of Ir foil. The 0.1 wt% Ir/TiO2 catalyst is stable under typical reverse water gas shift (rWGS) reaction conditions (623 K, CO2/H2 = 1). Indeed, similar crystal structure and lattice constants between MO2 and rutile TiO2 are known to stabilize single atoms (M) embedded in the titania lattice [28]. Thus, M is chosen here as a 3d-5d metal with rutile-type oxide structure, namely M = V, Cr, Mn, Nb, Mo, Ru, Rh, Ta, W, Os, Ir and Pt. Furthermore, single-atom Rh/TiO2-P25 catalysts have been shown to be promising for the water gas shift reaction, which comprises CO oxidation [16]. As TiO2-P25 includes both rutile and anatase phases, we choose the typically more abundant rutile phase in our study despite the higher stability of the anatase phase in the temperature range studied (320–500 K). We show that adsorbate interactions are crucial to accurately calculating the kinetics of CO oxidation on M/TiO2(110). In particular, Pt/TiO2(110) and Rh/TiO2(110) exhibit the largest enhancement at temperatures below and above 400 K, and their formation rate of CO2 is 7–8 orders of magnitude higher than on TiO2(110). An intuitive descriptor-based analysis abridges the model and reveals that such noteworthy activities can be expected when O adsorption is moderate at the M site of M/TiO2(110). 2 Methods Spin-polarized DFT calculations of TiO2(110) and M/TiO2(110) (M = V, Cr, Mn, Nb, Mo, Ru, Rh, Ta, W, Os, Ir and Pt) were performed using VASP [29] with the PBE exchange–correlation functional [30]. Because no rutile-type oxide structure is available for Pd, we did not consider it in the present study. We randomly chose M = Mn, Rh and Ta from 3d to 5d metals and investigated the effect of spin on the total energies of reduced M/TiO2(110) (denoted as M/TiO2- x (110)). As shown in Fig. S1, unconstrained spin calculations (as opposed to fixing the total magnetic moment) find the total energies of these systems and are thus used in this work; the optimized magnetic moments of the stoichiometric and reduced M/TiO2(110) surfaces are listed in Table S1. The interaction between ionic cores and electrons was described by the projector-augmented wave (PAW) method [31,32]. The Kohn–Sham wavefunctions of valence electrons (3d4s for Ti-Mn; 4p5s4d for Nb; 5s4d for Mo, Ru, Rh; 6s5d for Ta, W, Os, Ir, Pt; 2s2p for C, O) were expanded in a plane-wave basis set with a kinetic energy cutoff of 400 eV. Zero-point energy (ZPE) corrections to the total DFT energies were included. The lattice constants of bulk TiO2 in the rutile crystalline system were calculated to be a = b = 4.67 Å, c = 2.97 Å, in fair agreement with the experimental values (a = b = 4.59 Å, c = 2.96 Å) [33]. As shown in Fig. 1 , TiO2(110) was modeled with a four O−Ti−O trilayer slab with (4 × 1) periodicity. M/TiO2(110) was modeled by substituting one of the eight surface Ti atoms by M on the (4 × 1) TiO2(110) slab. A vacuum region of at least 15 Å was used along the z-direction to avoid electrostatic interactions between repeated slabs. The two bottommost layers were fixed at the bulk distances, and the two topmost layers and the adsorbates were fully relaxed. The surface Brillouin zone was sampled with a (2 × 4 × 1) Monkhorst-Pack [34] k-point grid for TiO2(110) and M/TiO2(110). The energy (ΔE Sub) for substituting Ti by M on TiO2(110) is: (1) Δ E Sub = E M / T i O 2 + E Ti - E TiO 2 - E M where E TiO 2 , E M / T i O 2 , E Ti and E M represent the energies of TiO2(110), M/TiO2(110), a Ti atom and a dopant atom in vacuum, respectively. The formation energy of bridge oxygen vacancies (ΔE Vac) is: (2) Δ E Vac = E M / T i O 2 - x + 1 2 E O 2 - E M / T i O 2 where E M / T i O 2 and E M / T i O 2 - x are the energy of stoichiometric and reduced M/TiO2(110), and E O 2 is the gas-phase energy of O2. The adsorption energy (ΔE Ads) was calculated using the most stable adsorption configurations (E slab+ad) relative to the clean surfaces (E slab) and the isolated adsorbates (E ad): (3) Δ E Ads = E slab + a d - E slab - E ad To avoid the direct calculation of the total energy of O2, which is generally problematic within the DFT formalism [35], we calculated the total energy of O2 using the DFT-assessed free energies of H2 and H2O and the experimental free energy change (2.46 eV) of the reaction H 2 O l → H 2 ( g ) + 1 2 O 2 ( g ) [35–38]. In addition, the total energies of CO(g) and CO2(g) were corrected by −0.24 and 0.19 eV following a previous study to ensure that the DFT-calculated free energy of CO oxidation matches the experimental one (−2.67 eV) [39]. Bader charge analysis was performed using a grid-based weight method [40] in which the expression for the fraction of space neighboring each grid point flowing to its neighbors is used as a weight for the discrete integration of functions over the Bader volume. Positive or negative charges mean charge depletion or charge accumulation, respectively. The crystal orbital overlap populations (COOP) were computed and analyzed using the LOBSTER program [41]. COOP is an overlap-population-weighted density of states that provides information on electron distribution [42]. In turn, the integrated COOP is useful to describe adsorption-energy trends among different materials [43], or coordinatively different sites of the same material [44]. All transition states (TSs) were located by the climbing-image nudged elastic band method (CI-NEB) [45] and the force reversed method [46], and saddle points were confirmed when a single imaginary frequency was observed along the reaction coordinate. The relaxations stopped when the residual forces on each atom were below 0.03 eV/Å. The elementary activation barrier (ΔE Act) and reaction energy (ΔH) were calculated with respect to the most stable co-adsorption state of the species in the initial states unless otherwise stated. We previously investigated the effect of the Hubbard U parameter [47] on the adsorption energies of O, the activation energies and reaction energies of CO2 and N2O decomposition on MO2(110) (M = 3d metals from Ti to Ni) and found that it does not alter the trends [48]. Because we primarily concentrate on the trends in this work, U was not included. The reaction temperature in this study ranges from 320 to 500 K, and the total pressure is kept at 1 bar with a CO/O2 ratio of 2. More details about the microkinetic model can be found in section S18. The degree of rate control of step i ( D RC , i ) [49] helps quantitatively determine the significance of a given step i in the overall reaction and is defined as: (4) D RC , i = k i r ∂ r ∂ k i k j ≠ i , K i = ∂ ln r ∂ ln k i k j ≠ i , K i where ki, Ki and r are the forward rate constant, the equilibrium constant for elementary step i and the reaction rate, respectively. A positive value of D RC , i means that step i is a rate-limiting step, and decreasing its activation energy increases the overall rate. Negative values are associated with inhibition steps, for which lowering the barriers decreases the overall rate. 3 Results and discussion 3.1 Modeling the M/TiO2(110) catalyst There are two types of surface Ti atoms that can be substituted by a single metal atom M on a stoichiometric TiO2(110) surface, marked as I and II in Fig. 1a. Fig. S2 and Table S2 show that the energy (ΔE Sub, see definition in the Methods section) for substituting TiI by M (Fig. 1b) is higher than for TiII (Fig. 1c) by 0.03–1.23 eV. However, the case is different in presence of 25 % bridge oxygen vacancies, where the former site (Fig. 1e) generally has lower ΔE Sub than the latter (Fig. 1f) by 0.13–0.43 eV (Fig. S2 and Table S2). These results indicate that substituting TiII by M is thermodynamically more stable under oxidative atmospheres, whereas substituting TiI is preferable under reductive atmospheres. We emphasize that ΔE Sub is assessed only to compare the relative stability of M at different locations. Note that metal salts are typically used to synthesize the SACs in experiments and the type of salt depends on M, and SACs are often metastable [13]. Hence, it is not our intention to address the synthesizability of SACs in this work. TiI is sterically more accessible for M substitution than TiII, which is blocked by bridge oxygen atoms. Therefore, M substitution of TiI on the stoichiometric and reduced TiO2(110) surface (Fig. 1b, e) is used here to model CO oxidation on M/TiO2(110) catalysts, and we assume that the location of M does not change during the reaction process. As discussed later in this work, the surface diffusion of SACs is difficult once they occupy a substitutional position in the lattice and, although their diffusion into the bulk might be thermodynamically favorable in some cases (Table S16), large kinetic impediments are expected at the temperatures considered here. Having ascertained the location of M, we investigated its effect on the formation of bridge oxygen vacancies on TiO2(110) (Fig. 1e). Compared to stoichiometric TiO2(110), ΔE Vac on the stoichiometric M/TiO2(110) decreases by 0.10–2.16 eV (Fig. S3 and Table S3), indicating that M facilitates the formation of adjacent oxygen vacancies. These results are consistent with those of a previous theoretical study [50]. Moreover, as the number of outer electrons [12] of M (NM) increases in Fig. S3, ΔE Vac on the stoichiometric M/TiO2(110) progressively decreases, implying an easier formation of oxygen vacancies for surfaces with late transition metal dopants. To understand the nature of the bond between bridge oxygen and Ti in M/TiO2, we provide differential charge density maps for M = Ta, W, Os, Pt in Fig. 2 . We observe considerable charge withdrawal from Ti by O in TiO2, Ta/TiO2 and W/TiO2, which is indicative of markedly ionic bonds. When M = Os, Pt, a sizeable charge depletion from both Ti and O centers and accumulation between them is seen, suggesting that the bonds are now covalent. Thus, bridge O–Ti bonds switch from ionic to covalent as M moves to the right of the periodic table, which in turn decreases ΔE Vac. Interestingly, the switch of bond type of bridge O–M has also been seen in rutile MO2(110) when M is a 3d metal [48]. The Bader charge of M is positive on both stoichiometric and reduced M/TiO2(110), as shown in Fig. S4 and Table S4. Compared with stoichiometric M/TiO2(110), the Bader charge of M on reduced M/TiO2(110) is smaller by 0.04–0.46 e−. This is reasonable because the removal of a bridge O atom leaves free electrons in the reduced M/TiO2(110) surface, resulting in less electron withdrawal from M. Moreover, as M moves to the right of the periodic table, the decrease in Bader charge of M on the reduced M/TiO2(110) becomes larger. For instance, the Bader charge of Ta on stoichiometric Ta/TiO2(110) is larger than on reduced Ta/TiO2(110) by only 0.04 e−. However, the difference in Bader charge of Pt between stoichiometric and reduced Pt/TiO2(110) is as large as 0.46 e−. These results agree with the differential charge density maps in Fig. 2 (lower panels): the formation of bridge O-Ti bonds causes large charge variations in Os/TiO2 and Pt/TiO2, in contrast with pure TiO2, Ta/TiO2 and W/TiO2, where there is no noticeable charge transfer on Ti, Ta and W. This is because bridge O interacts more strongly with the 5d states of Os and Pt near the Fermi level (see Fig. S5) compared to those of W and Ta and the 3d states of Ti. 3.2 Adsorption of intermediates and elementary steps Two primary mechanisms, i.e., dissociative and associative, have been proposed for CO oxidation. As shown in Fig. 3 a, the dissociative mechanism involves CO oxidation by adsorbed atomic O, obtained from the dissociation of O2* (Route I) or O2*(II) (Route II). Furthermore, CO can directly react with adsorbed molecular oxygen, leading to the formation of CO2. As shown in Fig. 3b–d, several associative routes (Routes III-VIII) are available, and they differ in the co-adsorption structure of CO and O2 and whether or not CO3 is formed. We note that CO3 is often regarded as a possible intermediate on Au-based catalysts [51–53]. It can be seen that lattice O (bridge O) participates in the CO oxidation reaction and is recovered by O from gaseous oxygen in all the dissociative and associative mechanisms considered. That is to say, we consider different Mars-van Krevelen (MvK) mechanisms (I-VIII) [54], involving both reduced (M/TiO2-x, Fig. 3) and stoichiometric (O*, Fig. 3) M/TiO2(110). We first investigated the adsorption of various intermediates involved in the two aforementioned mechanisms on the reduced and stoichiometric M/TiO2(110), and the adsorption energies (ΔE Ads) and structures are shown in Table S5 and Fig. S6. We studied a number of configurations for O2 adsorption on reduced M/TiO2(110), and only the two most stable configurations on most surfaces are summarized for brevity, namely O2 at the bridge O vacancy (denoted as O2*) and O2 at both bridge O vacancy and M (denoted as O2*(II), Fig. S6a and b). Table S5 shows that O2*, O2*(II) and O* (Fig. S6c) bind significantly weaker by 1.80–2.26 eV with increasing number of outer electrons of M on reduced M/TiO2(110). This is related to the aforementioned switch in bridge O–Ti bond type on M/TiO2(110) depending on M. We found a substrate-mediated interaction between bridge O (O*) and co-adsorbed O (OM) or CO (COM) at M sites. The interaction energy (ΔE Int) is defined as the difference between ΔE Ads of OM or COM on stoichiometric and reduced M/TiO2. As shown in Fig. S7a and Table S6, ΔE Int between O* and OM is more positive when M is an early transition metal such as Ti, Ta, Nb, V, Cr, Mo and Mn, which is indicative of strong repulsive interactions. However, if M is a late transition metal such as Ru and Os, a strong repulsion is found between O* and COM (Fig. S7b). For Pt/TiO2, a rather negative ΔE Int is found for both O* and OM, and O* and COM, implying strong attraction between them. Further energetic and electronic-structure analyses about OM and COM adsorption with or without the presence of O* appear in sections S7 and S8. Those strong interactions lead to a large difference in the activation energies (ΔE + and ΔE − for forward and backward reactions) of relevant elementary reactions calculated by separate adsorption and co-adsorption, see Table S7. In fact, on Pt/TiO2, the strong attraction between O* and OM and COM results in rather negative ΔE + or ΔE − values for most elementary reactions in the separate adsorption (SA) model (Table S7). This indicates that the SA model fails to describe the energetics of elementary reactions with strong interactions between reactants or products, and in this case such interactions ought to be considered, as will be shown later. For this important reason, we use the energetics of the systems with co-adsorption (CA model) and treat the bridge O vacancy and M as a joint site * for convenience. We primarily present the results of the CA model below unless otherwise stated. According to the dissociative mechanism, adsorbed O2* (Route I, Fig. 3a) or O2*(II) (Route II, Fig. 3a) decompose into adsorbed O at the bridge oxygen vacancy and adsorbed O at the M site (denoted (2O)*). Route I is found on various M/TiO2 surfaces except M = Ti, Cr, Mn, Rh, Pt, and ΔE+ of O2* dissociation is in the range of 0.26–0.93 eV. The energetics and TS structures appear in Table S7 and Fig. 3e–o. Route II is observed on all M/TiO2 surfaces except for Mo/TiO2 and Os/TiO2, where no stable O2*(II) adsorption state was observed. ΔE+ of O2*(II) dissociation ranges from 0 to 1.26 eV. Both routes exist when M = V, Nb, Ru, Ta, W, Ir, as shown in Table S7, and O2*(II) dissociation has lower ΔE+ than O2* dissociation by 0.26–0.93 eV. The dissociated O atoms (2O)* combine with CO (CO#) at the Ti site leading to CO2 formation ((CO + 2O)*# = CO2 + O* + #, see Fig. 3a), and ΔE+ is in the range of 0.21–1.30 eV on M/TiO2(110). Compared to (CO + 2O)*# = CO2 + O* + #, the range spanned by ΔE+ of the step (CO + O)* = CO2 + * is narrower (0.40–0.86 eV). This is reasonable as both O and CO binding (O* on M/TiO2-x and COM on M/TiO2) affect ΔE+ , and ΔE Ads of O* and COM show opposite trends with M (Table S5). The associative mechanism can proceed through (CO + O2)* = CO2 + O* (Route III, Fig. 3b) on most surfaces except where direct O2 dissociation is facile, as is the case of M = Nb, Mo, Ta, W. ΔE+ of (CO + O2)* = CO2 + O* is typically above 1 eV, suggesting that this route is unlikely to proceed. Alternatively, CO* can react with O2*, leading to the formation of *CO3, which then undergoes O–O bond scission to yield CO2 on Mn/TiO2 and Pt/TiO2 (Route IV, Fig. 3b). Compared to Route III, the barriers for the elementary reactions in Route IV are lower and no larger than 0.70 eV (Table S7). In addition, the route of (CO + O2)*(II) = CO2 + O* (Route V, Fig. 3c) is also found on Cr/TiO2, has ΔE+ = 0.39 eV and is lower than that of Route III by 0.64 eV on this surface. Moreover, CO* can react with O2*(II) (Route VI, Fig. 3c) on M/TiO2 (M = Ti, V, Mo) or O2*(III) (Route VII, Fig. 3d) on M/TiO2 (M = Ru, Rh, Os, Ir) or O2*(IV) (Route VIII, Fig. 3d) on Ta/TiO2, yielding a *CO3 intermediate that decomposes into CO2 and O*. ΔE+ of the elementary reactions in these routes goes from 0.07 to 0.81 eV, which is lower than the corresponding values of Route III. There are approximate Brønsted-Evans-Polanyi (BEP) relations [55–57] between the activation energies (ΔE+ ) and reaction energies (ΔH) for O2*(II) decomposition, (CO + O)* = CO2 + *, (CO + O2)* = CO2 + O*, (CO + 2O)*# = CO2 + O* + # and CO3* = CO2 + O* on M/TiO2(110), as shown in Fig. S13 and Table S8. Considering that the reactions take place on multiple sites, such as bridge oxygen vacancy and M and Ti sites and involve clear bonding variations of the intermediates, the correlations provide predictions with reasonable mean absolute errors. 3.3 Microkinetic modeling Using the DFT calculated energetics, microkinetic simulations were conducted at typical CO oxidation conditions (320–500 K, 1 bar, PCO/PO2 = 2) [58–60]. Details of the microkinetic model are given in section S18. Fig. 4 a shows that the rate of CO2 formation increases with temperature on all M/TiO2(110) surfaces. Introducing Pt, Rh, Ta, Mn, Ir, Ru, Nb, V, Cr and Os atoms accelerates CO oxidation on TiO2(110). Pt atoms exhibit the largest enhancement below 400 K, with a CO2 formation rate 7–8 orders of magnitude higher than that of undoped TiO2(110). In turn, Rh/TiO2(110) is the most active system at higher temperatures and has a higher CO2 formation rate than TiO2(110) by 7 orders of magnitude. This agrees well with the experimental observation that single-atom Rh/TiO2 catalysts are promising for the WGS [16], as CO oxidation is a key part of that process. Nonprecious Ta/TiO2 and Mn/TiO2 also display salient activities, which outperform by 1–6 orders of magnitude those of precious Ir/TiO2 below 400 K and Ru/TiO2 and Os/TiO2 in the whole temperature range considered. Although Nb, V and Cr-doped TiO2(110) are not as good as Ir/TiO2 and Ru/TiO2 catalysts, they display higher activity than Os/TiO2(110). Moreover, Mo and W atoms on TiO2(110) are less active than TiO2(110) at all temperatures in Fig. 4a. These results are clearly distinct from supported metal catalysts, where precious metals often showcase excellent CO oxidation activity [24,61]. Compared to the CA model, the reaction rate predicted by the SA model is generally lower, as shown in Fig. 4b. The activity ordering of M/TiO2 surfaces also varies drastically in the two models. According to the SA model, pure TiO2 and TiO2 doped with early transition metals such as Ta, Nb, V, Ti and Mo are inactive for CO oxidation, in contrast with the excellent activity of Ta/TiO2 and Nb/TiO2 predicted by the CA model. In brief, the absolute activities and the activity trends are different in the two models. This highlights the importance of input data for microkinetic modeling in SAC-at-oxide catalysts, where lattice oxygen may have strong repulsive or attractive interactions with the adsorbed species during catalytic cycles. Figs. 5 and S14 show the ratio of the rates for various CO oxidation routes and the total reaction rate as a function of temperature on M/TiO2(110). At all temperatures, CO oxidation proceeds through associative routes III and VI on TiO2(110). Although ΔE+ of the elementary reactions from the former are higher than the latter, the high O2* coverage observed in Fig. S15 favors the formation of (CO + O2)* and, hence, route III. The degree of rate control (DRC, see the Methods section) analysis in Fig. 6 shows that the CO2 formation rate on TiO2(110) is mainly determined by (CO + O2)* → CO2 + O*, which can be rationalized on the basis of its higher ΔE+ compared with the other elementary steps in route III (Table S7). Moreover, O2*(II) formation is also important in determining the overall rate, in contrast with O2* formation, which inhibits it. This is because both decreasing ΔE+ of the former step and increasing ΔE+ of the latter increase the coverage of O2*(II), favoring the formation of (CO + O2)*(II) and accelerating CO oxidation through (CO + O2)*(II) → CO3* (route VI). In the presence of M, the reaction mechanism has significant variations. If M is an early transition metal such as Ta, Nb, V, Cr, Mo and W, the dissociative routes dominate (Figs. 5 and S14). Specifically, routes I and II contribute almost equally on TiO2 doped with Ta, Nb, V and W. However, only routes II and I are found on Cr/TiO2 and Mo/TiO2, respectively, where only O2*(II) and O2* dissociation is available. The preference for dissociative routes of TiO2 doped with early transition metal atoms mainly stems from a combination of facile O2 dissociation and weak CO adsorption, which inhibits the formation of CO3* species (θ < 10−15) or CO2 via (CO + O2)*. In fact, (CO + 2O)*# = CO2 + O* + # determines to a great extent the overall rate on TiO2 doped with early transition metals (Figs. 6 and S16), in view of its higher ΔE+ compared to other elementary reactions in the dissociative routes (Table S7). This also explains the equivalent contribution from dissociative routes I and II on M/TiO2 (M = Ta, Nb, V, W). Specifically, as shown in Fig. 3a, routes I and II differ only in the initial two steps, namely the adsorption of O2* and O2*(II) and their dissociation into (2O)*. Afterwards, they undergo the same elementary steps. Since (CO + 2O)*# = CO2 + O* + # controls the rate of both routes, their contributions are equivalent. As M moves toward the right of the periodic table, associative routes VII or IV contribute almost as much as the dissociative routes (M = Mn, Ir, Ru) and even dominate the total rate (M = Rh and Os) on M/TiO2 except for M = Pt, as dissociative route II is more favorable. This is noticeably different from late transition metal nanoparticles, where the dissociative mechanism prevails [62]. This is probably because the O2*(III) precursor (Fig. S6f) is abundant on rutile supports [63], which favors the formation of CO3*, a key intermediate in the associative routes. Compared with TiO2 doped with early transition metals, the O2 dissociation activity decreases (M = Mn) or CO binding becomes stronger (M = Ru, Rh, Os, Ir) on TiO2 with late transition metal atoms, leading to large contributions from the associative routes. The dominance of the dissociative route on Pt/TiO2 in Fig. 5 is justified by the easily surmountable activation energies of relevant elementary reactions. Indeed, the elementary reactions from dissociative route II have lower ΔE+ than those from associative routes III and IV on Pt/TiO2 (Table S7). As shown in Fig. 6, O2*(II) dissociation to (2O)* controls the overall rate at low temperatures on Mn/TiO2 and Pt/TiO2, while (CO + 2O)*# = CO2 + O* + # controls it at higher temperatures. This is presumably because the reaction is controlled by kinetics at low temperatures, as O2*(II) dissociation has higher ΔE+ than (CO + 2O)*# → CO2 + O* + # in dissociative route II on those two surfaces and, as temperature increases, thermochemistry gains importance. In addition, O2* adsorption determines the overall rate on Mn/TiO2, whereas O2*(II) adsorption suppresses it. This is expectable because increased O2* coverage favors the formation of (CO + O2)* and enhances the formation of CO3* species through (CO + O2)* → CO3* in associative route IV, which contributes nearly as much as dissociative route II on Mn/TiO2. O2 adsorption in the presence of CO* controls to a great extent the overall rate on Rh/TiO2 and Ir/TiO2, since facile O2 co-adsorption with CO* facilitates the formation of CO3* and favors associative route VII. In Fig. 4 the rates of CO2 formation reach 105 s−1/site on Rh/TiO2 and Pt/TiO2 at high temperatures. In these cases, surface diffusion of adsorbates, which is not included in the present microkinetic modeling, might become rate-limiting instead of elementary reactions. Besides, we studied the diffusion of Rh and Pt atoms from the TiO2 lattice to the hollow sites of surface O atoms. This process is endothermic by 1.91–3.34 eV regardless of the nature of M (Rh or Pt) and the oxidation state of TiO2 (stoichiometric or reduced). These results indicate that the Rh/TiO2 and Pt/TiO2 catalysts are highly stable. Taking Pt/TiO2 as an example, we investigated its stability compared to adsorbed Pt (denoted as Pta/TiO2), PtO and PtO2 on stoichiometric TiO2(110) (see Fig. S17). The relative stability of various low-energy structures is assessed by the surface free energies ( γ ): [64] (5) γ = E total - N Pt ∙ E Pt - N Ti ∙ E Ti O 2 - 0.5 ∙ N O - 2 N Ti ∙ μ O 2 2 S where E total , E Pt , E Ti O 2 are the energy of the total system, the Pt atom and bulk TiO2; N Pt , N Ti , N O are the number of Pt, Ti and O atoms in the system, μ O 2 is the chemical potential of O2 and S is the surface area. As shown in Fig. S18, Pt/TiO2 is the most stable configuration under the studied conditions ( 320 - 500 K , P O 2 = 0.33 a t m ), which further confirms the reliability of our model. Moreover, (CO + 2O)*# = CO2 + O* + # controls the overall rate on Ru/TiO2 and Os/TiO2, likely in view of the high ΔE+ (0.61 and 0.86 eV). Previous works have shown that the rate-limiting step (RLS) often involves the removal of abundant surface species [65]. Specifically, the reaction (CO + O2)* = CO2 + O*, which displays large DRC values on TiO2(110), removes the most abundant O2* species (Figs. 6 and S15). Moreover, (CO + 2O)*# = CO2 + O* + # on M/TiO2 (M = Ta, Ru, Nb, V, Os, Cr, Mo, W) can remove the dominant (2O)* species (Fig. 6, S15-S16). In turn, O2 + CO* = (CO + O2)*(III) on Ir/TiO2 helps remove the abundant (CO + O2)* (Figs. 6 and S15). The switch of RLS as a function of temperature coincides with that of dominant surface species. At low temperatures, the RLS is O2*(II) dissociation on Pt/TiO2 and Mn/TiO2, which facilitates the removal of abundant O2*(II). With increasing temperature, (2O)* becomes the most abundant species, which is accompanied by the shift of the RLS to (CO + 2O)*# = CO2 + O* + #, and a similar phenomenon is observed on Rh/TiO2. Fig. S19 plots the CO oxidation rate ( Lnr , in s−1site−1) on various M/TiO2(110) at 400 K as a function of the pressures of CO ( Ln P CO ) and O2 ( LnP O 2 ). The reaction orders of CO ( α ) and O2 ( β ) are listed in Table S9. We observe in Table S9 that if M is an early transition metal, such as Ti–Cr, Nb, Mo, Ta and W, α = 1 and β = 0 . When M is a late transition metal, α and β change from one metal to the next. Negative values of α are observed on Rh/TiO2 and Ir/TiO2, and negative values of β on Ru/TiO2 and Os/TiO2. To the best of our knowledge, no experimentally apparent activation barriers are available for CO oxidation on single metal/rutile TiO2 catalysts, but we did find those of single metals (Ru, Rh, Ir and Pt) supported on MgO [66]. The simulated apparent activation barriers in Table S10 are generally lower than their counterparts on MgO, highlighting the great promise of our SACs/TiO2. Moreover, our apparent activation barriers of Rh/TiO2 are visibly larger than the experimental ones of Rh clusters/TiO2-P25 (Table S10) [67]. As this is the only major difference observed among the systems compared, we hypothesize that additional active sites might be present in experiments in this specific case (Rh/TiO2-P25 with ∼80 % anatase) compared to those in our Rh/TiO2. Lastly, the barriers are comparable for Pt/TiO2 and experimental Pt nanoparticles/TiO2-rutile (0.52 vs 0.67 eV) [60]. Compared to the CA model, the SA model predicts markedly different routes on various surfaces (see Figs. 5 and S14). Indeed, CO oxidation proceeds exclusively through route VII on TiO2 with Rh, Ir, Ru and Os atoms, and routes II and I on Cr/TiO2 and W/TiO2, respectively. However, the preferred route on Mn/TiO2 is temperature dependent. Route IV dominates the total rate at low temperatures, whereas route II becomes more favorable as the temperature increases to 500 K. In addition, the two models predict different RLSs, see Figs. 6 and S16. In the following, we will abridge the model by means of a descriptor-based analysis. The CO2 formation rates on M/TiO2(110) surfaces are often determined by (CO + 2O)*# = CO2 + O* + #, particularly at high temperature, as shown in Figs. 6 and S16. Section S16 proves that the reaction energy (ΔH) of this elementary step can be written as: (6) Δ H = E O ∗ - E C O + 2 O ∗ # + E C O 2 = R - Δ E A d s CO # - Δ E A d s O M where E O* and E (CO+2O)*# are the total energies of O* and (CO + 2O)*# (Fig. 3), and E CO2 is the total energy of CO2(g). R = E C O 2 - E O - E CO is a gas-phase reaction. In turn, ΔE Ads(CO#) is the adsorption energy of CO at the Ti site next to M on (2O)*-covered M/TiO2-x, and ΔE Ads(OM) is the adsorption energy of O at the M site of stoichiometric M/TiO2. Importantly, ΔE Ads(CO#) does not strongly depend on M, with variations of 0.14 eV at most on the surfaces under study, see Fig. S20. Therefore, differences in ΔH in Eq. (6) from one material to the next are mainly determined by ΔE Ads(OM). Since a reasonable BEP relation exists between ΔE+ and ΔH for that step (Fig. S13), we posit that ΔE Ads(OM) can be used as a descriptor of the CO oxidation activity. Indeed, Fig. 7 shows the CO oxidation activity as a function of ΔE Ads(OM) on M/TiO2(110) surfaces at 400 K. A volcano-shaped curve is observed with a maximum at ΔE Ads(OM) = −3.26 eV. The weak OM adsorption of TiO2(110) (ΔE Ads = −1.35 eV) inhibits O2*(II) dissociation and CO oxidation proceeds exclusively through associative routes. Conversely, strong OM adsorption on M/TiO2 (M = W, Mo, Os, Nb, ΔE Ads = −6.52 to −4.42 eV) facilitates O2 dissociation. CO oxidation on these surfaces proceeds via dissociative routes, but strong OM adsorption limits CO2 production. Because they have intermediate OM adsorption strength (ΔE Ads = −4.33 to −2.87 eV), such that both dissociative and associative routes contribute to CO oxidation, precious Pt, Rh, Ir, Ru and non-precious Mn and Ta atoms on TiO2(110) display enhanced activity for CO oxidation. For numerous elements there are PAWs with additional electrons in VASP. Table S11 compares the effect of the PAWs used in this work and others with additional electrons (denoted as extra) for Ti, Mo, Rh, Ta. For *CO the effect is small and positive: a v g Δ E Ads C O - Δ E Ads extra C O = 0.06 e V . For O2 and O the effect is larger but the differences are again nearly constant and positive: a v g Δ E Ads O 2 - Δ E Ads extra O 2 = 0.23 e V and a v g Δ E Ads O - Δ E Ads extra O = 0.25 e V . Hence, PAW-extras induce adsorbate-specific systematic strengthening of adsorption energies. We note that Mo,Ti, Os, V and Cr/TiO2 are far from the summit in Fig. 7, while Rh/TiO2 and Ta/TiO2 are close to the top. According to Fig. 7, if Mo, Os, V, Cr, Ta and Rh bind O more strongly, their activities should decrease slightly. Ti is on the opposite side of the volcano, so its activity should increase slightly. However, the three activity regions (strong, moderate and weak coupling) and trends in Fig. 7 should remain unchanged given the large energy span of the x-axis (∼5 eV) and the logarithmic scale in the y-axis. Finally, Table S12 shows the minor effect of the PAWs on the magnetic moments, with variations < 0.05 μB on the surfaces studied. The fact that a single parameter, namely ΔE Ads(OM), suffices as a descriptor for M/TiO2 catalysts is markedly different from supported metal catalysts, where the adsorption energies of O and CO are typically necessary to describe CO oxidation [24,68], as O and CO binding energies are generally linearly independent on metals. However, multiple sites exist on M/TiO2 catalysts, such as the bridge O vacancy, Ti sites next to M, and M, and all of them are involved in CO oxidation. We note that although oxygen adsorption at the bridge O vacancy (O*) depends on M, it is not involved in the RLS (i.e., (CO + 2O)*# = CO2 + O* + #). The adsorption of CO at the Ti site next to M (CO#) on (2O)*-covered surfaces does not depend on M. Hence, only O adsorption at the M site (OM) affects strongly the CO oxidation activity of M/TiO2 catalysts. Evidently, a single descriptor conveniently simplifies the analysis and can potentially save computational costs during materials screening. Our descriptor may be applied to other single-metal-decorated catalysts for CO oxidation or in other important reactions of academic and industrial interest involving CO and oxygenated species, such as electrochemical CO oxidation, which is key in direct alcohol fuel cells, WGS and rWGS [28,69–75]. In summary, a strong interaction exists between bridge O and adsorbed species at M sites on M/TiO2 catalysts. Neglecting such interaction in a separate adsorption model leads to substantial differences in activation energies, reaction routes, rate-limiting steps and catalytic activity predictions for CO oxidation, highlighting the often overlooked importance of adsorbate interactions in catalyst screening. 4 Conclusions Seeking suitable SACs for CO oxidation, we used DFT calculations and microkinetic modeling to elucidate the interaction between single 3d–5d metal atoms M and rutile TiO2(110). To abridge the model, we identified the adsorption energy of O at M sites as a simple and predictive descriptor for the CO oxidation activity of M/TiO2 catalysts, which is different from supported metal catalysts, as those require two adsorption-energy descriptors. In line with the Sabatier principle, our descriptor classifies M/TiO2 catalysts into three categories: (i) weak O adsorption (e.g., TiO2), which inhibits O2*(II) dissociation, so that CO oxidation proceeds exclusively through associative routes; (ii) strong O adsorption on M/TiO2 (M = W, Mo, Os, Nb, V, Cr), which hurdles its recombination, so that CO oxidation mainly proceeds via dissociative routes; (iii) intermediate O adsorption on precious Pt, Rh, Ir, Ru and non-precious Mn and Ta atoms embedded in TiO2, which accelerates CO oxidation by enabling both dissociative and associative routes. This work features the importance of adsorbate interactions to accurately describe CO oxidation kinetics on M/TiO2 catalysts, where strong substrate-mediated interactions between adsorbed species exist. The insights provided here may be used to guide experiments and be applied to different SAC architectures for CO oxidation and akin reactions of technological interest. CRediT authorship contribution statement Hai-Yan Su: Writing – review & editing, Writing – original draft, Resources, Project administration, Investigation, Funding acquisition, Formal analysis, Data curation, Conceptualization. Keju Sun: Writing – review & editing, Supervision, Methodology, Investigation, Formal analysis, Conceptualization. Xiufang Ma: Writing – review & editing, Investigation. Xiangxuan Huang: Writing – review & editing, Formal analysis. Junquan Feng: Writing – review & editing, Formal analysis. Federico Calle-Vallejo: Writing – review & editing, Supervision, Project administration, Formal analysis, Conceptualization. Declaration of competing interest The authors declare that they have no known competing financial interests or personal relationships that could have appeared to influence the work reported in this paper. Acknowledgments We gratefully acknowledge the financial support from the National Natural Science Foundation of China (22172026), Natural Science Foundation of Hebei Province (B2021203016) and Guangdong Provincial Key Laboratory of Distributed Energy Systems (2020B1212060075) and Key Science and Technology Project of Social Development Foundation of Dongguan (20211800904612). The grants PID2021-127957NB-I00 and TED2021-132550B-C21 were funded by MICIU/AEI/10.13039/501100011033 and by the European Union. FCV also acknowledges financial support through grant IT1453-22 “Grupos Consolidados UPV/EHU del Gobierno Vasco”. Appendix A Supplementary data Supporting Information . Spin effects and magnetic moments, substitution energies, vacancy formation energies and Bader charge analysis, structure and adsorption energies of species and activation energies of elementary reactions, interaction energies between bridge O and adsorbed species, differential charge density map and PDOS and COOP analysis for O and CO adsorption, BEP relations for elementary reactions, ratio of reaction rates between various CO oxidation pathways and the total rate, coverage of adsorbed intermediates, degree of rate control analysis, reaction orders and apparent activation energies, relative stability of Pt and Pt oxide doped TiO2 catalysts, identification of the descriptor for CO oxidation, effect of PAW setups on adsorption energies and magnetic moments, microkinetic modeling and bulk diffusion energies. Supplementary data to this article can be found online at https://doi.org/10.1016/j.jcat.2025.116308. Appendix A Supplementary data The following are the Supplementary data to this article: Supplementary Data 1 References [1] B. Qiao A. Wang X. Yang L.F. Allard Z. Jiang Y. Cui J. Liu J. Li T. Zhang Single-atom catalysis of CO oxidation using Pt1/FeOx Nat. Chem. 3 2011 634 641 Qiao, B.; Wang, A.; Yang, X.; Allard, L. F.; Jiang, Z.; Cui, Y.; Liu, J.; Li, J.; Zhang, T. Single-Atom Catalysis of CO Oxidation Using Pt1/FeOx. Nat. Chem. 2011, 3, 634−641. [2] S.F. Hackett R.M. Brydson M.H. Gass I. Harvey A.D. Newman K. Wilson L.A.F. High-Activity Single-site mesoporous Pd/Al2O3 catalysts for selective aerobic oxidation of allylic alcohols Angew. Chem. Int. Ed. 46 2007 8593 8596 Hackett, S. F.; Brydson, R. M.; Gass, M. H.; Harvey, I.; Newman, A. D.; Wilson, K.; Lee, A. F. High-Activity, Single-Site Mesoporous Pd/Al2O3 Catalysts for Selective Aerobic Oxidation of Allylic Alcohols. Angew. Chem., Int. Ed. 2007, 46, 8593−8596. [3] W. Tang Z. Hu M. Wang G.D. Stucky H. Metiu E.W. McFarland Methane complete and partial oxidation catalyzed by Pt-doped CeO2 J. Catal. 273 2010 125 137 Tang, W.; Hu, Z.; Wang, M.; Stucky, G. D.; Metiu, H.; McFarland, E. W. Methane Complete and Partial Oxidation Catalyzed by Pt-Doped CeO2. J. Catal. 2010, 273, 125−137. [4] X. Zhang H. Shi B.Q. Xu Catalysis by gold: isolated surface Au3+ ions are active sites for selective hydrogenation of 1,3-butadiene over Au/ZrO2 catalysts Angew. Chem. Int. Ed. 44 2005 7132 7135 Zhang, X.; Shi, H.; Xu, B. Q. Catalysis by Gold: Isolated Surface Au3+ Ions Are Active Sites for Selective Hydrogenation of 1,3-Butadiene over Au/ZrO2 Catalysts. Angew. Chem. Int. Ed. 2005, 44, 7132−7135. [5] Y.Y. Sun L. Silvioli N.R. Sahraie W. Ju J.K. Li A. Zitolo S. Li A. Bagger L. Arnarson X.L. Wang T. Moeller D. Bernsmeier J. Rossmeisl F. Jaouen P. Strasser Activity–selectivity trends in the electrochemical production of hydrogen peroxide over single-site metal–nitrogen–carbon catalysts J. Am. Chem. Soc. 141 2019 12372 12381 Sun, Y. Y.; Silvioli, L.; Sahraie, N. R.; Ju, W.; Li, J. K.; Zitolo, A.; Li, S.; Bagger, A.; Arnarson, L.; Wang, X. L.; Moeller, T.; Bernsmeier, D.; Rossmeisl, J.; Jaouen, F.; Strasser, P. Activity–Selectivity Trends in the Electrochemical Production of Hydrogen Peroxide over Single-Site Metal–Nitrogen–Carbon Catalysts. J. Am. Chem. Soc. 2019, 141, 12372–12381. [6] F. Luo A. Roy L. Silvioli D.A. Cullen A. Zitolo M.T. Sougrati I.C. Oguz T. Mineva D. Teschner S. Wagner J. Wen F. Dionigi U.I. Kramm J. Rossmeisl F. Jaouen P. Strasser P-Block single-metal-site tin/nitrogen-doped carbon fuel cell cathode catalyst for oxygen reduction reaction Nat. Mater. 19 2020 1215 1223 Luo, F.; Roy, A.; Silvioli, L.; Cullen, D. A.; Zitolo, A.; Sougrati, M. T.; Oguz, I. C.; Mineva, T.; Teschner, D.; Wagner, S.; Wen, J.; Dionigi, F.; Kramm, U. I.; Rossmeisl, J.; Jaouen, F.; Strasser, P. P-Block Single-Metal-Site Tin/Nitrogen-Doped Carbon Fuel Cell Cathode Catalyst for Oxygen Reduction Reaction. Nat. Mater. 2020, 19, 1215–1223. [7] F. Jaouen E. Proietti M. Lefèvre R. Chenitz J.-P. Dodelet G. Wu H.T. Chung C.M. Johnston P. Zelenay Recent advances in non-precious metal catalysis for oxygen-reduction reaction in polymer electrolyte fuel cells Energy Environ. Sci. 4 2011 114 130 Jaouen, F.; Proietti, E.;Lefèvre, M.;Chenitz, R.; Dodelet, J.-P.;Wu, G.; Chung, H. T.; Johnston, C. M.; Zelenay, P. Recent Advances in Non-Precious Metal Catalysis for Oxygen-Reduction Reaction in Polymer Electrolyte Fuel Cells. Energy Environ. Sci. 2011, 4, 114–130. [8] W. Ju A. Bagger G.P. Hao A.S. Varela I. Sinev V. Bon B.R. Cuenya S. Kaskel J. Rossmeisl P. Strasser Understanding activity and selectivity of metal-nitrogen-doped carbon catalysts for electrochemical reduction of CO2 Nat. Commun. 8 2017 944 Ju, W.; Bagger, A.; Hao, G. P.; Varela, A. S.; Sinev, I.; Bon, V.; Cuenya, B. R.; Kaskel, S.; Rossmeisl, J.; Strasser, P. Understanding Activity and Selectivity of Metal-Nitrogen-Doped Carbon Catalysts for Electrochemical Reduction of CO2. Nat Commun. 2017, 8, 944. [9] X. Li W. Bi L. Zhang S. Tao W. Chu Q. Zhang Y. Luo C. Wu Y. Xie Single-atom Pt as co-catalyst for enhanced photocatalytic H2 evolution Adv. Mater. 28 2016 2427 2431 Li, X.; Bi, W.; Zhang, L.; Tao, S.; Chu, W.; Zhang, Q.; Luo, Y.; Wu, C.; Xie, Y. Single-Atom Pt as Co-Catalyst for Enhanced Photocatalytic H2 Evolution. Adv. Mater. 2016, 28, 2427−2431. [10] Q.Q. Zhang J.Q. Guan Single-atom catalysts for electrocatalytic applications Adv. Func. Mater. 30 2020 2000768 Zhang, Q. Q.; Guan, J. Q. Single-Atom Catalysts for Electrocatalytic Applications. Adv. Func. Mater. 2020, 30, 2000768. [11] X.-F. Yang A. Wang B. Qiao J. Li J. Liu T. Zhang Single-atom catalysts: a new frontier in heterogeneous catalysis Acc. Chem. Res. 46 2013 1740 1748 Yang, X.-F.; Wang, A.; Qiao, B.; Li, J.; Liu, J.; Zhang, T. Single-Atom Catalysts: A New Frontier in Heterogeneous Catalysis. Acc. Chem. Res. 2013, 46, 1740–1748. [12] F. Calle-Vallejo N.G. Inoglu H.-Y. Su J.I. Martínez I.C. Man M.T.M. Koper J.R. Kitchin J. Rossmeisl Number of outer electrons as descriptor for adsorption processes on transition metals and their oxides Chem. Sci. 4 2013 1245 1249 Calle-Vallejo, F.; Inoglu, N. G.; Su, H.-Y.; Martínez, J. I.; Man, I. C.; Koper, M. T. M.; Kitchin, J. R.; Rossmeisl, J. Number of Outer Electrons As Descriptor for Adsorption Processes on Transition Metals and Their Oxides. Chem. Sci. 2013, 4, 1245−1249. [13] J. Liu Catalysis by supported single metal atoms ACS Catal. 7 2017 34 59 Liu, J. Catalysis by Supported Single Metal Atoms. ACS Catal. 2017, 7, 34−59. [14] B. Qiao J.-X. Liang A. Wang C.-Q. Xu J. Li T. Zhang J. Liu Ultrastable single-atom gold catalysts with strong covalent metal-support interaction (CMSI) Nano Res. 8 2015 2913 2924 Qiao, B.; Liang, J.-X.; Wang, A.; Xu, C.-Q.; Li, J.; Zhang, T.; Liu, J. Ultrastable Single-Atom Gold Catalysts with Strong Covalent Metal-Support Interaction (CMSI). Nano Res. 2015, 8, 2913−2924. [15] H.Y. Su X.F. Ma K.J. Sun Single-atom metal tuned sulfur vacancy for efficient H2 activation and hydrogen evolution reaction on MoS2 basal plane Appl. Surf. Sci. 597 2022 153614 Su, H. Y.; Ma, X. F.; Sun, K. J. Single-Atom Metal Tuned Sulfur Vacancy for Efficient H2 Activation and Hydrogen Evolution Reaction on MoS2 Basal Plane. Appl. Surf. Sci. 2022, 597, 153614. [16] H. Guan J. Lin B. Qiao S. Miao A.-Q. Wang X. Wang T. Zhang Enhanced performance of Rh1/TiO2 catalyst without methanation in water-gas shift reaction AIChE J. 63 2017 2081 2088 Guan, H.; Lin, J.; Qiao, B.; Miao, S.; Wang, A.-Q.; Wang, X.; Zhang, T. Enhanced Performance of Rh1/TiO2 Catalyst without Methanation in Water-Gas Shift Reaction. AIChE J. 2017, 63, 2081–2088. [17] X.C. Sun J. Lin Y. Zhou L. Li Y. Su X.D. Wang T. Zhang FeOx supported single-atom Pd bifunctional catalyst for water gas shift reaction AIChE J. 63 2017 4022 4031 Sun, X. C.; Lin, J.; Zhou, Y.; Li, L.; Su, Y.; Wang, X. D.; Zhang, T. FeOx Supported Single-Atom Pd Bifunctional Catalyst for Water Gas Shift Reaction. AIChE J. 2017, 63, 4022–4031. [18] H.Y. Su X.F. Ma C.H. Sun K.J. Sun A synergetic effect between a single Cu site and S vacancy on an MoS2 basal plane for methanol synthesis from syngas Catal. Sci. Technol. 11 2021 3261 3269 Su, H. Y.; Ma, X. F.; Sun, C. H.; Sun, K. J. A Synergetic Effect between a Single Cu Site and S Vacancy on an MoS2 Basal Plane for Methanol Synthesis from Syngas. Catal. Sci. Technol. 2021, 11, 3261-3269. [19] J. Lin Y. Chen Y. Zhou L. Li B. Qiao A. Wang J. Liu X. Wang T. Zhang More active Ir subnanometer clusters than single-atoms for catalytic oxidation of CO at low temperature AIChE J. 63 2017 4003 4012 Lin, J.; Chen, Y.; Zhou, Y.; Li, L.; Qiao, B.; Wang, A.; Liu, J.; Wang, X.; Zhang, T. More Active Ir Subnanometer Clusters than Single-Atoms for Catalytic Oxidation of CO at Low Temperature. AIChE J. 2017, 63, 4003–4012. [20] I.A.W. Filot R.J.P. Broos J.P.M. van Rijn G.J.H.A. van Heugten R.A. van Santen E.J.M. Hensen First-principles-based microkinetics simulations of synthesis gas conversion on a stepped rhodium surface ACS Catal. 5 2015 5453 5467 Filot, I. A. W.; Broos, R. J. P.; van Rijn, J. P. M.; van Heugten, G. J. H. A.; van Santen, R. A.; Hensen. E. J. M. First-Principles-Based Microkinetics Simulations of Synthesis Gas Conversion on a Stepped Rhodium Surface. ACS Catal. 2015, 5, 5453−5467. [21] A.J. Medford C. Shi M.J. Hoffmann A.C. Lausche S.R. Fitzgibbon T. Bligaard J.K. Nørskov CatMAP: a software package for descriptor-based microkinetic mapping of catalytic trends Catal. Lett. 145 2015 794 807 Medford, A. J.; Shi, C.; Hoffmann, M. J.; Lausche, A. C.; Fitzgibbon, S. R.; Bligaard, T.; Nørskov, J. K. CatMAP: A Software Package for Descriptor-Based Microkinetic Mapping of Catalytic Trends. Catal.Lett. 2015, 145, 794–807. [22] H.Y. Su Z.H. Zeng X. Bao W.X. Li First-principles study of carbon monoxide oxidation on Ag(111) in presence of subsurface oxygen and stepped Ag(221) J. Phys. Chem. C 113 2009 8266 8272 Su, H. Y.; Zeng, Z. H.; Bao, X.; Li, W. X. First-Principles Study of Carbon Monoxide Oxidation on Ag(111) in Presence of Subsurface Oxygen and Stepped Ag(221). J. Phys. Chem. C 2009, 113, 8266–8272. [23] H.Y. Su W.X. Li X. Bao Density Functional Theory Study of CO Catalytic Oxidation on Pt(111) and Pt3Ni(111) Surfaces Chinese J. Catal. 29 2008 683 686 Su, H. Y.; Li, W. X.; Bao, X. Density Functional Theory Study of CO Catalytic Oxidation on Pt(111) and Pt3Ni(111) Surfaces. Chinese J. Catal. 2008, 29, 683–686. [24] T. Jiang D.J. Mowbray S. Dobrin H. Falsig B. Hvolbæk T. Bligaard J.K. Nørskov Trends in CO oxidation rates for metal nanoparticles and close-packed, stepped, and kinked surfaces J. Phys. Chem. C 113 2009 10548 10553 Jiang, T.; Mowbray, D. J.; Dobrin, S.; Falsig, H.; Hvolbæk, B.; Bligaard, T.; Nørskov, J. K. Trends in CO Oxidation Rates for Metal Nanoparticles and Close-Packed, Stepped, and Kinked Surfaces. J. Phys. Chem. C 2009, 113, 10548–10553. [25] V. Muravev G. Spezzati Y.Q. Su A. Parastaev F.-K. Chiang A. Longo C. Escudero N. Kosinov E.J.M. Hensen Interface dynamics of Pd–CeO2 single-atom catalysts during CO oxidation Nat. Catal. 4 2021 469 478 Muravev, V.; Spezzati, G.; Su, Y. Q.; Parastaev, A.; Chiang, F.-K.; Longo, A.; Escudero, C.; Kosinov, N.; Hensen, E. J. M. Interface Dynamics of Pd–CeO2 Single-Atom Catalysts during CO Oxidation. Nat. Catal. 2021, 4, 469–478. [26] Y. Lu F. Lin Z. Zhang C. Thompson Y. Zhu N. Doudin L. Kovarik C.E. García Vargas D. Jiang J.L. Fulton Y. Wu F. Gao Z. Dohnálek A.M. Karim H. Wang Y. Wang Enhancing activity and stability of Pd-on-TiO2 single-atom catalyst for low-temperature CO oxidation through in situ local environment tailoring J. Am. Chem. Soc. 146 2024 28141 28152 Lu, Y.; Lin, F.; Zhang, Z.; Thompson, C.; Zhu, Y.; Doudin, N.; Kovarik, L.; García Vargas, C. E.; Jiang, D.; Fulton, J. L.; Wu, Y.; Gao, F.; Dohnálek, Z.; Karim, A. M.; Wang, H.; Wang, Y. Enhancing Activity and Stability of Pd-on-TiO2 Single-Atom Catalyst for Low-Temperature CO Oxidation through in Situ Local Environment Tailoring. J. Am. Chem. Soc. 2024, 146, 28141–28152. [27] L. Wang S. Deo A. Mukhopadhyay N.A. Pantelis II M.J. Janik R.M. Rioux Emergent behavior in oxidation catalysis over single-atom Pd on a reducible CeO2 support via mixed redox cycles ACS Catal. 12 2022 12927 12941 Wang, L.; Deo, S.; Mukhopadhyay, A.; Pantelis II, N. A.; Janik, M. J.; Rioux, R. M. Emergent Behavior in Oxidation Catalysis over Single-Atom Pd on a Reducible CeO2 Support via Mixed Redox Cycles. ACS Catal. 2022, 12, 12927–12941. [28] X.D. Chen X. Su H.Y. Su X.Y. Liu S. Miao Y.H. Zhao K.J. Sun Y.Q. Huang T. Zhang Theoretical insights and the corresponding construction of supported metal catalysts for highly selective CO2 to CO conversion ACS Catal. 7 2017 4613 4620 Chen, X. D.; Su, X.; Su, H. Y.; Liu, X. Y.; Miao, S.; Zhao, Y. H.; Sun, K. J.; Huang, Y. Q.; Zhang T. Theoretical Insights and the Corresponding Construction of Supported Metal Catalysts for Highly Selective CO2 to CO Conversion. ACS Catal. 2017, 7, 4613−4620. [29] G. Kresse J. Furthmüller Efficient iterative schemes for Ab initio total-energy calculations using a plane-wave basis set Phys. Rev. B 54 1996 11169 11186 Kresse, G.; Furthmüller, J. Efficient Iterative Schemes for Ab Initio Total-energy Calculations Using a Plane-wave Basis Set. Phys. Rev. B 1996, 54, 11169−11186. [30] J.P. Perdew K. Burke M. Ernzerhof Generalized gradient approximation made simple Phys. Rev. Lett. 77 1996 3865 3868 Perdew, J. P.; Burke, K.; Ernzerhof, M. Generalized Gradient Approximation Made Simple. Phys. Rev. Lett. 1996, 77, 3865−3868. [31] G. Kresse D. Joubert From ultrasoft pseudopotentials to the projector augmented-wave method Phys. Rev. B 59 1999 1758 Kresse G.; Joubert, D. From Ultrasoft Pseudopotentials to the Projector Augmented-Wave Method. Phys. Rev. B 1999, 59, 1758. [32] P.E. Blöchl Projector augmented-wave method Phys. Rev. B 50 1994 17953 17979 Blöchl, P. E. Projector Augmented-wave Method. Phys. Rev. B 1994, 50, 17953−17979. [33] F.A. Grant Properties of rutile (titanium dioxide) Rev. Mod. Phys. 31 1959 646 674 Grant, F. A. Properties of Rutile (Titanium Dioxide). Rev. Mod. Phys. 1959, 31, 646-674. [34] H.J. Monkhorst J.D. Pack Special points for brillouin-zone integrations Phys. Rev. B 13 1976 5188 5192 Monkhorst, H. J.; Pack, J. D. Special Points for Brillouin-zone Integrations. Phys. Rev. B 1976, 13, 5188−5192. [35] S. Kurth J.P. Perdew P. Blaha Molecular and solid-state tests of density functional approximations: LSD, GGAs, and meta-GGAs Int. J. Quantum Chem 75 1999 889 909 Kurth, S.; Perdew, J. P.; Blaha, P. Molecular and Solid-State Tests of Density Functional Approximations: LSD, GGAs, and Meta-GGAs. Int. J. Quantum Chem. 1999, 75, 889–909. [36] E. Sargeant F. Illas P. Rodríguez F. Calle-Vallejo Importance of the gas-phase error correction for O2 when using DFT to model the oxygen reduction and evolution reactions J. Electroanal. Chem. 896 2021 115178 Sargeant, E.; Illas, F.; Rodríguez, P.; Calle-Vallejo, F. Importance of the Gas-Phase Error Correction for O2 When Using DFT to Model the Oxygen Reduction and Evolution Reactions. J. Electroanal. Chem. 2021, 896, 115178. [37] J.K. Nørskov J. Rossmeisl A. Logadottir L. Lindqvist J.R. Kitchin T. Bligaard H. Jónsson Origin of the overpotential for oxygen reduction at a fuel-cell cathode J. Phys. Chem. B 108 2004 17886 17892 Nørskov, J. K.; Rossmeisl, J.; Logadottir, A.; Lindqvist, L.; Kitchin, J. R.; Bligaard, T.; Jónsson, H. Origin of the Overpotential for Oxygen Reduction at a Fuel-Cell Cathode. J. Phys. Chem. B 2004, 108, 17886–17892. [38] F. Calle-Vallejo J.I. Martínez J.M. García-Lastra M. Mogensen J. Rossmeisl Trends in stability of perovskite oxides Angew. Chem. Int. Ed. 49 2010 7699 7701 Calle-Vallejo, F.; Martínez, J. I.; García-Lastra, J. M.; Mogensen, M.; Rossmeisl, J. Trends in Stability of Perovskite Oxides, Angew. Chem. Int. Ed. 2010, 49, 7699–7701. [39] L.P. Granda-Marulanda A. Rendón-Calle S. Builes F. Illas M.T.M. Koper F. Calle-Vallejo A Semiempirical method to detect and correct DFT-based gas-phase errors and its application in electrocatalysis ACS Catal. 10 2020 6900 6907 Granda-Marulanda, L. P.; Rendón-Calle, A.; Builes, S.; Illas, F.; Koper, M. T. M.; Calle-Vallejo, F. A Semiempirical Method to Detect and Correct DFT-Based Gas-Phase Errors and Its Application in Electrocatalysis, ACS Catal. 2020, 10, 6900–6907. [40] M. Yu D.R. Trinkle Accurate and efficient algorithm for bader charge integration J. Chem. Phys. 134 2011 064111 Yu, M.; Trinkle, D. R. Accurate and Efficient Algorithm for Bader Charge Integration. J. Chem. Phys. 2011, 134, 064111. [41] R. Nelson C. Ertural J. George V. Deringer G. Hautier R. Dronskowski LOBSTER: local orbital projections, atomic charges, and chemical bonding analysis from projector-augmented-wave-based DFT J. Comput. Chem. 41 2020 1931 1940 Nelson, R.; Ertural, C.; George, J.; Deringer, V.; Hautier, G.; Dronskowski, R. LOBSTER: Local Orbital Projections, Atomic Charges, and Chemical Bonding Analysis from Projector-Augmented-Wave-Based DFT. J. Comput. Chem. 2020, 41, 1931–1940. [42] V.L. Deringer A.L. Tchougréeff R. Dronskowski Crystal orbital hamilton population (COHP) analysis as projected from plane-wave basis sets J. Phys. Chem. A 115 2011 5461 5466 Deringer, V. L.; Tchougréeff, A. L.; Dronskowski, R. Crystal Orbital Hamilton Population (COHP) Analysis As Projected from Plane-Wave Basis Sets. J. Phys. Chem. A 2011, 115, 5461–5466. [43] H.Y. Su K.J. Sun W.Q. Wang Z.H. Zeng F. Calle-Vallejo W.-X. Li Establishing and understanding adsorption–energy scaling relations with negative slopes J. Phys. Chem. Lett. 7 2016 5302 5306 Su, H. Y.; Sun, K. J.; Wang, W. Q.; Zeng, Z. H.; Calle-Vallejo, F.; Li, W.-X. Establishing and Understanding Adsorption–Energy Scaling Relations with Negative Slopes. J. Phys. Chem. Lett. 2016, 7, 5302–5306. [44] J. Zhao R. Urrego-Ortiz N. Liao F. Calle-Vallejo J. Luo Rationally designed Ru catalysts supported on TiN for highly efficient and stable hydrogen evolution in alkaline conditions Nat. Commun. 15 2024 6391 Zhao, J.; Urrego-Ortiz, R.; Liao, N.; Calle-Vallejo, F.; Luo, J. Rationally Designed Ru Catalysts Supported on TiN for Highly Efficient and Stable Hydrogen Evolution in Alkaline Conditions. Nat. Commun. 2024, 15, 6391. [45] G. Henkelman H. Jonsson Improved tangent estimate in the nudged elastic band method for finding minimum energy paths and saddle points J. Chem. Phys. 113 2000 9978 Henkelman, G.; Jonsson, H. Improved Tangent Estimate in the Nudged Elastic Band Method for Finding Minimum Energy Paths and Saddle Points. J. Chem. Phys. 2000, 113, 9978. [46] K.J. Sun Y.H. Zhao H.Y. Su W.-X. Li Force reversed method for locating transition states Theo. Chem. Acc. 131 2012 1118 Sun, K. J.; Zhao, Y. H.; Su, H. Y.; Li, W.-X. Force Reversed Method for Locating Transition States. Theo. Chem. Acc. 2012, 131, 1118. [47] S.L. Dudarev G.A. Botton S.Y. Savrasov C.J. Humphreys A.P. Sutton Electron-energy-loss spectra and the structural stability of nickel oxide: an LSDA+U study Phys. Rev. B 57 1998 1505 1509 Dudarev, S. L.; Botton, G. A.; Savrasov, S. Y.; Humphreys, C. J.; Sutton, A. P. Electron-Energy-Loss Spectra and the Structural Stability of Nickel Oxide: An LSDA+U Study. Phys. Rev. B 1998, 57, 1505−1509. [48] H.Y. Su X.F. Ma K.J. Sun C.H. Sun Y.J. Xu F. Calle-Vallejo Trends in C–O and N–O bond scission on rutile oxides described using oxygen vacancy formation energies Chem. Sci. 11 2020 4119 4124 Su, H. Y.; Ma, X. F.; Sun, K. J.; Sun, C. H.; Xu, Y. J.; Calle-Vallejo, F. Trends in C–O and N–O Bond Scission on Rutile Oxides Described Using Oxygen Vacancy Formation Energies, Chem. Sci. 2020, 11, 4119−4124. [49] C. Stegelmann A. Andreasen C.T. Campbell Degree of rate control: how much the energies of intermediates and transition states control rates J. Am. Chem. Soc. 131 2009 8077 8082 Stegelmann, C.; Andreasen, A.; Campbell, C. T. Degree of Rate Control: How Much the Energies of Intermediates and Transition States Control Rates. J. Am. Chem. Soc. 2009, 131, 8077−8082. [50] H.Y. Kim H.M. Lee R.G.S. Pala V. Shapovalov H. Metiu CO oxidation by rutile TiO2(110) doped with V, W, Cr, Mo, and Mn J. Phys. Chem. C 112 2008 12398 12408 Kim, H. Y.; Lee, H. M.; Pala, R. G. S.; Shapovalov, V.; Metiu, H. CO Oxidation by Rutile TiO2(110) Doped with V, W, Cr, Mo, and Mn. J. Phys. Chem. C 2008, 112, 12398–12408. [51] M. Haruta Size- and support-dependency in the catalysis of gold Catal. Today 36 1997 153 166 Haruta, M. Size- and Support-Dependency in the Catalysis of Gold. Catal. Today 1997, 36, 153−166. [52] M.M. Schubert S. Hackenberg A.C. van Veen M. Muhler V. Plzak R.J. Behm CO oxidation over supported gold catalysts—“inert” and “active” support materials and their role for the oxygen supply during reaction J. Catal. 197 2001 113 122 Schubert, M. M.; Hackenberg, S.; van Veen, A. C.; Muhler, M.; Plzak, V.; Behm, R. J. CO Oxidation over Supported Gold Catalysts—“Inert” and “Active” Support Materials and Their Role for the Oxygen Supply during Reaction. J. Catal. 2001, 197, 113−122. [53] Z.P. Liu X.Q. Gong J. Kohanoff C. Sanchez P. Hu Catalytic role of metal oxides in gold-based catalysts: a first principles study of CO oxidation on TiO2 supported Au Phys. Rev. Lett. 91 2003 266102 Liu, Z. P.; Gong, X. Q.; Kohanoff, J.; Sanchez, C.; Hu, P. Catalytic Role of Metal Oxides in Gold-Based Catalysts: A First Principles Study of CO Oxidation on TiO2 Supported Au. Phys. Rev. Lett. 2003, 91, 266102. [54] S. Bac S.M. Sharada CO oxidation with atomically dispersed catalysts: insights from the energetic span model ACS Catal. 12 2022 2064 2076 Bac, S.; Sharada, S. M. CO Oxidation with Atomically Dispersed Catalysts: Insights from the Energetic Span Model. ACS Catal. 2022, 12, 2064–2076. [55] M.G. Evans M. Polanyi Inertia and driving force of chemical reactions Trans. Faraday Soc. 34 1938 11 24 Evans, M. G.; Polanyi, M. Inertia and Driving Force of Chemical Reactions. Trans. Faraday Soc. 1938, 34, 11–24. [56] A. Vojvodic F. Calle-Vallejo W. Guo S. Wang A. Toftelund F. Studt J.I. Martínez J. Shen I.C. Man J. Rossmeisl T. Bligaard J.K. Nørskov F. Abild-Pedersen On the behavior of brønsted-evans-polanyi relations for transition metal oxides J. Chem. Phys. 134 2011 244509 Vojvodic, A.; Calle-Vallejo, F.; Guo, W.; Wang, S.; Toftelund, A.; Studt, F.; Martínez, J. I.; Shen, J.; Man, I. C.; Rossmeisl, J.; Bligaard, T.; Nørskov, J. K.; Abild-Pedersen, F. On the Behavior of Brønsted-Evans-Polanyi Relations for Transition Metal Oxides. J. Chem. Phys. 2011, 134, 244509. [57] S. Wang B. Temel J. Shen G. Jones L.C. Grabow F. Studt T. Bligaard F. Abild-Pedersen C.H. Christensen J.K. Nørskov Universal brønsted-evans-polanyi relations for C–C, C–O, C–N, N–O, N–N, and O–O dissociation reactions Catal. Lett. 141 2011 370 373 Wang, S.; Temel, B.; Shen, J.; Jones, G.; Grabow, L. C.; Studt, F.; Bligaard, T.; Abild-Pedersen, F.; Christensen, C. H.; Nørskov, J. K. Universal Brønsted-Evans-Polanyi Relations for C–C, C–O, C–N, N–O, N–N, and O–O Dissociation Reactions. Catal. Lett. 2011, 141, 370–373. [58] A. Siani B. Captain O.S. Alexeev E. Stafyla A.B. Hungria P.A. Midgley J.M. Thomas R.D. Adams M.D. Amiridis Improved CO oxidation activity in the presence and absence of hydrogen over cluster-derived PtFe/SiO2 catalysts Langmuir 22 2006 5160 5167 Siani, A.; Captain, B.; Alexeev, O. S.; Stafyla, E.; Hungria, A. B.; Midgley, P. A.; Thomas, J. M.; Adams, R. D.; Amiridis, M. D. Improved CO Oxidation Activity in the Presence and Absence of Hydrogen over Cluster-Derived PtFe/SiO2 Catalysts. Langmuir 2006, 22, 5160-5167. [59] L.B. Ortiz-Soto O.S. Alexeev M.D. Amiridis Low temperature oxidation of CO over cluster-derived platinum-gold catalysts Langmuir 22 2006 3112 3117 Ortiz-Soto, L. B.; Alexeev, O. S.; Amiridis, M. D. Low Temperature Oxidation of CO over Cluster-Derived Platinum-Gold Catalysts. Langmuir 2006, 22, 3112-3117. [60] Y.F. Yang L.S. Zhou J. Chen R.Z. Qiu Y.X. Yao Low-temperature CO oxidation over the Pt-TiN interfacial dual sites ChemCatChem 13 2021 4610 4617 Yang, Y. F.; Zhou, L. S.; Chen, J.; Qiu, R. Z.; Yao, Y. X. Low-Temperature CO Oxidation over the Pt-TiN Interfacial Dual Sites. ChemCatChem 2021, 13, 4610-4617. [61] M.S. Chen Y. Cai Z. Yan K.K. Gath S. Axnanda D.W. Goodman Highly active surfaces for CO oxidation on Rh, Pd, and Pt Surf. Sci. 601 2007 5326 5331 Chen, M. S.; Cai, Y.; Yan, Z.; Gath, K. K.; Axnanda, S.; Goodman, D. W. Highly Active Surfaces for CO Oxidation on Rh, Pd, and Pt. Surf. Sci. 2007, 601, 5326–5331. [62] C.J. Zhang P. Hu Why must oxygen atoms be activated from hollow sites to bridge sites in catalytic CO oxidation? J. Am. Chem. Soc. 122 2000 2134 2135 Zhang, C. J.; Hu, P. Why Must Oxygen Atoms Be Activated from Hollow Sites to Bridge Sites in Catalytic CO Oxidation? J. Am. Chem. Soc. 2000, 122, 2134–2135. [63] M.D. Rasmussen L.M. Molina B. Hammer Adsorption, diffusion, and dissociation of molecular oxygen at defected TiO2(110): a density functional theory study J. Chem. Phys. 120 2004 988 997 Rasmussen, M. D.; Molina, L. M.; Hammer, B. Adsorption, Diffusion, and Dissociation of Molecular Oxygen at Defected TiO2(110): A Density Functional Theory Study. J. Chem. Phys. 2004, 120, 988–997. [64] A.D. Mayernick M.J. Janik Ab initio thermodynamic evaluation of Pd atom interaction with CeO2 surfaces J. Chem. Phys. 131 2009 084701 Mayernick, A. D.; Janik, M. J. Ab Initio Thermodynamic Evaluation of Pd Atom Interaction with CeO2 Surfaces. J. Chem. Phys. 2009, 131, 084701. [65] X.X. Zou H.Y. Su X.B. Sun W.Y. Pang X.F. Hao Y.H. Xu K.J. Sun Interplay between surface structure, reaction condition and mechanism for ammonia decomposition on Ru catalyst Appl. Surf. Sci. 649 2024 159175 Zou, X. X.; Su, H. Y.; Sun, X. B.; Pang, W. Y.; Hao, X. F.; Xu, Y. H.; Sun, K. J. Interplay between Surface Structure, Reaction Condition and Mechanism for Ammonia Decomposition on Ru Catalyst. Appl. Surf. Sci. 2024, 649, 159175. [66] B.B. Sarma P.N. Plessow G. Agostini P. Concepción N. Pfänder L. Kang F.R. Wang F. Studt G. Prieto Metal-specific reactivity in single-atom catalysts: CO oxidation on 4d and 5d transition metals atomically dispersed on MgO J. Am. Chem. Soc. 142 2020 14890 14902 Sarma, B. B.; Plessow, P. N.; Agostini, G.; Concepción, P.; Pfänder, N.; Kang, L.; Wang, F. R.; Studt, F.; Prieto, G. Metal-Specific Reactivity in Single-Atom Catalysts: CO Oxidation on 4d and 5d Transition Metals Atomically Dispersed on MgO. J. Am. Chem. Soc. 2020, 142, 14890-14902. [67] H. Guan J. Lin B. Qiao X. Yang L. Li S. Miao J. Liu A.-Q. Wang X. Wang T. Zhang Catalytically active Rh sub-nanoclusters on TiO2 for CO oxidation at cryogenic temperatures Angew. Chem. Int. Ed. 55 2016 2820 2824 Guan, H.; Lin, J.; Qiao, B.; Yang, X.; Li, L.; Miao, S.; Liu, J.; Wang, A.-Q.; Wang, X.; Zhang, T. Catalytically Active Rh Sub-Nanoclusters on TiO2 for CO Oxidation at Cryogenic Temperatures. Angew. Chem. Int. Ed. 2016, 55, 2820-2824. [68] H. Falsig B. Hvolbæk I.S. Kristensen T. Jiang T. Bligaard C.H. Christensen J.K. Nørskov Trends in the catalytic CO oxidation activity of nanoparticles Angew. Chem. Int. Ed. 47 2008 4835 4839 Falsig, H.; Hvolbæk, B.; Kristensen, I. S.; Jiang, T.; Bligaard, T.; Christensen, C. H.; Nørskov, J. K. Trends in the Catalytic CO Oxidation Activity of Nanoparticles. Angew. Chem. Int. Ed. 2008, 47, 4835–4839. [69] N.P. Lebedeva M.T.M. Koper J.M. Feliu R.A. van Santen Role of crystalline defects in electrocatalysis: mechanism and kinetics of CO adlayer oxidation on stepped platinum electrodes J. Phys. Chem. B 106 2002 12938 12947 Lebedeva, N. P.; Koper, M. T. M.; Feliu, J. M.; van Santen, R. A. Role of Crystalline Defects in Electrocatalysis: Mechanism and Kinetics of CO Adlayer Oxidation on Stepped Platinum Electrodes. J. Phys. Chem. B 2002, 106, 12938–12947. [70] F. Calle-Vallejo M.D. Pohl A.S. Bandarenka Quantitative coordination–activity relations for the design of enhanced Pt catalysts for CO electro-oxidation ACS Catal. 7 2017 4355 4359 Calle-Vallejo, F.; Pohl, M. D.; Bandarenka, A. S. Quantitative Coordination–Activity Relations for the Design of Enhanced Pt Catalysts for CO Electro-oxidation. ACS Catal. 2017, 7, 4355–4359. [71] P. Rodriguez D. Plana D.J. Fermin M.T.M. Koper New insights into the catalytic activity of gold nanoparticles for CO oxidation in electrochemical media J. Catal. 311 2014 182 189 Rodriguez, P.; Plana, D.; Fermin, D. J.; Koper, M. T. M. New Insights into the Catalytic Activity of Gold Nanoparticles for CO Oxidation in Electrochemical Media. J. Catal. 2014, 311, 182–189. [72] E. Berretti L. Osmieri V. Baglio H.A. Miller J. Filippi F. Vizza M. Santamaria S. Specchia C. Santoro A. Lavacchi Direct alcohol fuel cells: a comparative review of acidic and alkaline systems Electrochem. Energy Rev. 6 2023 30 Berretti, E.; Osmieri, L.; Baglio, V.; Miller, H. A.; Filippi, J.; Vizza, F.; Santamaria, M.; Specchia, S.; Santoro, C.; Lavacchi, A. Direct Alcohol Fuel Cells: A Comparative Review of Acidic and Alkaline Systems. Electrochem. Energy Rev. 2023, 6, 30. [73] H.Y. Su X.H. Bao W.-X. Li Modulating the reactivity of Ni-containing Pt(111)-skin catalysts by density functional theory calculations J. Chem. Phys. 128 2008 194707 Su, H. Y.; Bao, X. H.; Li, W.-X. Modulating the Reactivity of Ni-containing Pt(111)-skin Catalysts by Density Functional Theory Calculations. J. Chem. Phys. 2008, 128, 194707. [74] H.Y. Su W.B. Liao K.J. Sun Synergistic effect and coordination environment tuned water-gas shift reaction on MoS2 catalyst Catal. Sci. Technol. 14 2024 2608 2618 Su, H. Y.; Liao, W. B.; Sun, K. J. Synergistic Effect and Coordination Environment Tuned Water-gas Shift Reaction on MoS2 Catalyst. Catal. Sci. Technol. 2024, 14, 2608–2618. [75] H.Y. Su W.B. Liao K.J. Sun First-principles and microkinetic simulation studies of CO2 hydrogenation mechanism and active site on MoS2 catalyst Appl. Surf. Sci. 635 2023 157721 Su, H. Y.; Liao, W. B.; Sun, K. J. First-principles and Microkinetic Simulation Studies of CO2 Hydrogenation Mechanism and Active Site on MoS2 Catalyst. Appl. Surf. Sci. 2023, 635, 157721.",
      "scopus-id": "105009624559",
      "coredata": {
        "eid": "1-s2.0-S0021951725003732",
        "dc:description": "Single-atom catalysts (SACs) display prominent performance and high metal utilization for numerous catalytic processes. Harnessing the interaction between single atoms and supports is crucial to improve the performance of SACs. By means of density functional theory calculations and microkinetic modeling including adsorbate interactions, we expose the promising synergy between 3d–5d single metal atoms (M) and TiO2(110) for CO oxidation. Upon a rigorous analysis, we identify the adsorption energy of O at M sites as a simple and robust descriptor to abridge the design of catalysts for CO oxidation on M/TiO2 catalysts, so that enhanced activities are predicted at mild O adsorption energies. Single Pt and Rh atoms provide the largest enhancement around 400 K, with CO2 formation rates 7–8 orders of magnitude higher than on TiO2(110). Non-precious Ta/TiO2 and Mn/TiO2 also exhibit salient activities. This work highlights the often disregarded yet central role of adsorbate interactions in CO oxidation.",
        "openArchiveArticle": "false",
        "prism:coverDate": "2025-10-31",
        "openaccessUserLicense": "http://creativecommons.org/licenses/by-nc/4.0/",
        "prism:aggregationType": "Journal",
        "prism:url": "https://api.elsevier.com/content/article/pii/S0021951725003732",
        "dc:creator": [
          {
            "@_fa": "true",
            "$": "Su, Hai-Yan"
          },
          {
            "@_fa": "true",
            "$": "Sun, Keju"
          },
          {
            "@_fa": "true",
            "$": "Ma, Xiufang"
          },
          {
            "@_fa": "true",
            "$": "Huang, Xiangxuan"
          },
          {
            "@_fa": "true",
            "$": "Feng, Junquan"
          },
          {
            "@_fa": "true",
            "$": "Calle-Vallejo, Federico"
          }
        ],
        "link": [
          {
            "@_fa": "true",
            "@rel": "self",
            "@href": "https://api.elsevier.com/content/article/pii/S0021951725003732"
          },
          {
            "@_fa": "true",
            "@rel": "scidir",
            "@href": "https://www.sciencedirect.com/science/article/pii/S0021951725003732"
          }
        ],
        "dc:format": "application/json",
        "openaccessType": "Full",
        "pii": "S0021-9517(25)00373-2",
        "prism:volume": "450",
        "articleNumber": "116308",
        "prism:publisher": "The Author(s). Published by Elsevier Inc.",
        "dc:title": "Abridging the modeling of CO oxidation on single-atom catalysts: From microkinetics to descriptor-based analysis",
        "prism:copyright": "© 2025 The Author(s). Published by Elsevier Inc.",
        "openaccess": "1",
        "prism:issn": "00219517",
        "dcterms:subject": [
          {
            "@_fa": "true",
            "$": "Single-atom catalyst"
          },
          {
            "@_fa": "true",
            "$": "Rutile oxide"
          },
          {
            "@_fa": "true",
            "$": "CO oxidation"
          },
          {
            "@_fa": "true",
            "$": "DFT calculations"
          },
          {
            "@_fa": "true",
            "$": "Microkinetic modeling"
          }
        ],
        "openaccessArticle": "true",
        "prism:publicationName": "Journal of Catalysis",
        "openaccessSponsorType": "ElsevierWaived",
        "prism:pageRange": "116308",
        "pubType": "fla",
        "prism:coverDisplayDate": "October 2025",
        "prism:doi": "10.1016/j.jcat.2025.116308",
        "prism:startingPage": "116308",
        "dc:identifier": "doi:10.1016/j.jcat.2025.116308",
        "openaccessSponsorName": "Spain (CRUE): Core Hybrid journals RAP 2025"
      },
      "objects": {
        "object": [
          {
            "@category": "standard",
            "@height": "302",
            "@width": "728",
            "@_fa": "true",
            "$": "https://api.elsevier.com/content/object/eid/1-s2.0-S0021951725003732-gr2.jpg?httpAccept=%2A%2F%2A",
            "@multimediatype": "JPEG image file",
            "@type": "IMAGE-DOWNSAMPLED",
            "@size": "91505",
            "@ref": "gr2",
            "@mimetype": "image/jpeg"
          },
          {
            "@category": "standard",
            "@height": "245",
            "@width": "283",
            "@_fa": "true",
            "$": "https://api.elsevier.com/content/object/eid/1-s2.0-S0021951725003732-ga1.jpg?httpAccept=%2A%2F%2A",
            "@multimediatype": "JPEG image file",
            "@type": "IMAGE-DOWNSAMPLED",
            "@size": "15235",
            "@ref": "ga1",
            "@mimetype": "image/jpeg"
          },
          {
            "@category": "standard",
            "@height": "316",
            "@width": "732",
            "@_fa": "true",
            "$": "https://api.elsevier.com/content/object/eid/1-s2.0-S0021951725003732-gr1.jpg?httpAccept=%2A%2F%2A",
            "@multimediatype": "JPEG image file",
            "@type": "IMAGE-DOWNSAMPLED",
            "@size": "120292",
            "@ref": "gr1",
            "@mimetype": "image/jpeg"
          },
          {
            "@category": "standard",
            "@height": "226",
            "@width": "534",
            "@_fa": "true",
            "$": "https://api.elsevier.com/content/object/eid/1-s2.0-S0021951725003732-gr4.jpg?httpAccept=%2A%2F%2A",
            "@multimediatype": "JPEG image file",
            "@type": "IMAGE-DOWNSAMPLED",
            "@size": "42772",
            "@ref": "gr4",
            "@mimetype": "image/jpeg"
          },
          {
            "@category": "standard",
            "@height": "614",
            "@width": "657",
            "@_fa": "true",
            "$": "https://api.elsevier.com/content/object/eid/1-s2.0-S0021951725003732-gr3.jpg?httpAccept=%2A%2F%2A",
            "@multimediatype": "JPEG image file",
            "@type": "IMAGE-DOWNSAMPLED",
            "@size": "145721",
            "@ref": "gr3",
            "@mimetype": "image/jpeg"
          },
          {
            "@category": "standard",
            "@height": "573",
            "@width": "622",
            "@_fa": "true",
            "$": "https://api.elsevier.com/content/object/eid/1-s2.0-S0021951725003732-gr6.jpg?httpAccept=%2A%2F%2A",
            "@multimediatype": "JPEG image file",
            "@type": "IMAGE-DOWNSAMPLED",
            "@size": "103653",
            "@ref": "gr6",
            "@mimetype": "image/jpeg"
          },
          {
            "@category": "standard",
            "@height": "594",
            "@width": "685",
            "@_fa": "true",
            "$": "https://api.elsevier.com/content/object/eid/1-s2.0-S0021951725003732-gr5.jpg?httpAccept=%2A%2F%2A",
            "@multimediatype": "JPEG image file",
            "@type": "IMAGE-DOWNSAMPLED",
            "@size": "109511",
            "@ref": "gr5",
            "@mimetype": "image/jpeg"
          },
          {
            "@category": "standard",
            "@height": "331",
            "@width": "383",
            "@_fa": "true",
            "$": "https://api.elsevier.com/content/object/eid/1-s2.0-S0021951725003732-gr7.jpg?httpAccept=%2A%2F%2A",
            "@multimediatype": "JPEG image file",
            "@type": "IMAGE-DOWNSAMPLED",
            "@size": "22221",
            "@ref": "gr7",
            "@mimetype": "image/jpeg"
          },
          {
            "@category": "thumbnail",
            "@height": "91",
            "@width": "219",
            "@_fa": "true",
            "$": "https://api.elsevier.com/content/object/eid/1-s2.0-S0021951725003732-gr2.sml?httpAccept=%2A%2F%2A",
            "@multimediatype": "GIF image file",
            "@type": "IMAGE-THUMBNAIL",
            "@size": "13942",
            "@ref": "gr2",
            "@mimetype": "image/gif"
          },
          {
            "@category": "thumbnail",
            "@height": "163",
            "@width": "189",
            "@_fa": "true",
            "$": "https://api.elsevier.com/content/object/eid/1-s2.0-S0021951725003732-ga1.sml?httpAccept=%2A%2F%2A",
            "@multimediatype": "GIF image file",
            "@type": "IMAGE-THUMBNAIL",
            "@size": "7661",
            "@ref": "ga1",
            "@mimetype": "image/gif"
          },
          {
            "@category": "thumbnail",
            "@height": "95",
            "@width": "219",
            "@_fa": "true",
            "$": "https://api.elsevier.com/content/object/eid/1-s2.0-S0021951725003732-gr1.sml?httpAccept=%2A%2F%2A",
            "@multimediatype": "GIF image file",
            "@type": "IMAGE-THUMBNAIL",
            "@size": "20500",
            "@ref": "gr1",
            "@mimetype": "image/gif"
          },
          {
            "@category": "thumbnail",
            "@height": "92",
            "@width": "219",
            "@_fa": "true",
            "$": "https://api.elsevier.com/content/object/eid/1-s2.0-S0021951725003732-gr4.sml?httpAccept=%2A%2F%2A",
            "@multimediatype": "GIF image file",
            "@type": "IMAGE-THUMBNAIL",
            "@size": "8180",
            "@ref": "gr4",
            "@mimetype": "image/gif"
          },
          {
            "@category": "thumbnail",
            "@height": "163",
            "@width": "175",
            "@_fa": "true",
            "$": "https://api.elsevier.com/content/object/eid/1-s2.0-S0021951725003732-gr3.sml?httpAccept=%2A%2F%2A",
            "@multimediatype": "GIF image file",
            "@type": "IMAGE-THUMBNAIL",
            "@size": "16686",
            "@ref": "gr3",
            "@mimetype": "image/gif"
          },
          {
            "@category": "thumbnail",
            "@height": "164",
            "@width": "178",
            "@_fa": "true",
            "$": "https://api.elsevier.com/content/object/eid/1-s2.0-S0021951725003732-gr6.sml?httpAccept=%2A%2F%2A",
            "@multimediatype": "GIF image file",
            "@type": "IMAGE-THUMBNAIL",
            "@size": "10580",
            "@ref": "gr6",
            "@mimetype": "image/gif"
          },
          {
            "@category": "thumbnail",
            "@height": "164",
            "@width": "189",
            "@_fa": "true",
            "$": "https://api.elsevier.com/content/object/eid/1-s2.0-S0021951725003732-gr5.sml?httpAccept=%2A%2F%2A",
            "@multimediatype": "GIF image file",
            "@type": "IMAGE-THUMBNAIL",
            "@size": "14640",
            "@ref": "gr5",
            "@mimetype": "image/gif"
          },
          {
            "@category": "thumbnail",
            "@height": "164",
            "@width": "189",
            "@_fa": "true",
            "$": "https://api.elsevier.com/content/object/eid/1-s2.0-S0021951725003732-gr7.sml?httpAccept=%2A%2F%2A",
            "@multimediatype": "GIF image file",
            "@type": "IMAGE-THUMBNAIL",
            "@size": "7609",
            "@ref": "gr7",
            "@mimetype": "image/gif"
          },
          {
            "@category": "high",
            "@height": "1336",
            "@width": "3223",
            "@_fa": "true",
            "$": "https://api.elsevier.com/content/object/eid/1-s2.0-S0021951725003732-gr2_lrg.jpg?httpAccept=%2A%2F%2A",
            "@multimediatype": "JPEG image file",
            "@type": "IMAGE-HIGH-RES",
            "@size": "480450",
            "@ref": "gr2",
            "@mimetype": "image/jpeg"
          },
          {
            "@category": "high",
            "@height": "1085",
            "@width": "1255",
            "@_fa": "true",
            "$": "https://api.elsevier.com/content/object/eid/1-s2.0-S0021951725003732-ga1_lrg.jpg?httpAccept=%2A%2F%2A",
            "@multimediatype": "JPEG image file",
            "@type": "IMAGE-HIGH-RES",
            "@size": "79107",
            "@ref": "ga1",
            "@mimetype": "image/jpeg"
          },
          {
            "@category": "high",
            "@height": "1398",
            "@width": "3239",
            "@_fa": "true",
            "$": "https://api.elsevier.com/content/object/eid/1-s2.0-S0021951725003732-gr1_lrg.jpg?httpAccept=%2A%2F%2A",
            "@multimediatype": "JPEG image file",
            "@type": "IMAGE-HIGH-RES",
            "@size": "618355",
            "@ref": "gr1",
            "@mimetype": "image/jpeg"
          },
          {
            "@category": "high",
            "@height": "998",
            "@width": "2363",
            "@_fa": "true",
            "$": "https://api.elsevier.com/content/object/eid/1-s2.0-S0021951725003732-gr4_lrg.jpg?httpAccept=%2A%2F%2A",
            "@multimediatype": "JPEG image file",
            "@type": "IMAGE-HIGH-RES",
            "@size": "282848",
            "@ref": "gr4",
            "@mimetype": "image/jpeg"
          },
          {
            "@category": "high",
            "@height": "2718",
            "@width": "2910",
            "@_fa": "true",
            "$": "https://api.elsevier.com/content/object/eid/1-s2.0-S0021951725003732-gr3_lrg.jpg?httpAccept=%2A%2F%2A",
            "@multimediatype": "JPEG image file",
            "@type": "IMAGE-HIGH-RES",
            "@size": "723631",
            "@ref": "gr3",
            "@mimetype": "image/jpeg"
          },
          {
            "@category": "high",
            "@height": "2541",
            "@width": "2756",
            "@_fa": "true",
            "$": "https://api.elsevier.com/content/object/eid/1-s2.0-S0021951725003732-gr6_lrg.jpg?httpAccept=%2A%2F%2A",
            "@multimediatype": "JPEG image file",
            "@type": "IMAGE-HIGH-RES",
            "@size": "659970",
            "@ref": "gr6",
            "@mimetype": "image/jpeg"
          },
          {
            "@category": "high",
            "@height": "2628",
            "@width": "3033",
            "@_fa": "true",
            "$": "https://api.elsevier.com/content/object/eid/1-s2.0-S0021951725003732-gr5_lrg.jpg?httpAccept=%2A%2F%2A",
            "@multimediatype": "JPEG image file",
            "@type": "IMAGE-HIGH-RES",
            "@size": "691815",
            "@ref": "gr5",
            "@mimetype": "image/jpeg"
          },
          {
            "@category": "high",
            "@height": "1470",
            "@width": "1699",
            "@_fa": "true",
            "$": "https://api.elsevier.com/content/object/eid/1-s2.0-S0021951725003732-gr7_lrg.jpg?httpAccept=%2A%2F%2A",
            "@multimediatype": "JPEG image file",
            "@type": "IMAGE-HIGH-RES",
            "@size": "121629",
            "@ref": "gr7",
            "@mimetype": "image/jpeg"
          },
          {
            "@category": "standard",
            "@_fa": "true",
            "$": "https://api.elsevier.com/content/object/eid/1-s2.0-S0021951725003732-mmc1.pdf?httpAccept=%2A%2F%2A",
            "@multimediatype": "Acrobat PDF file",
            "@type": "APPLICATION",
            "@size": "2897479",
            "@ref": "mmc1",
            "@mimetype": "application/pdf"
          },
          {
            "@category": "thumbnail",
            "@_fa": "true",
            "$": "https://api.elsevier.com/content/object/eid/1-s2.0-S0021951725003732-si1.svg?httpAccept=%2A%2F%2A",
            "@multimediatype": "Scalable Vector Graphics file",
            "@type": "ALTIMG",
            "@size": "16447",
            "@ref": "si1",
            "@mimetype": "image/svg+xml"
          },
          {
            "@category": "thumbnail",
            "@_fa": "true",
            "$": "https://api.elsevier.com/content/object/eid/1-s2.0-S0021951725003732-si10.svg?httpAccept=%2A%2F%2A",
            "@multimediatype": "Scalable Vector Graphics file",
            "@type": "ALTIMG",
            "@size": "12705",
            "@ref": "si10",
            "@mimetype": "image/svg+xml"
          },
          {
            "@category": "thumbnail",
            "@_fa": "true",
            "$": "https://api.elsevier.com/content/object/eid/1-s2.0-S0021951725003732-si11.svg?httpAccept=%2A%2F%2A",
            "@multimediatype": "Scalable Vector Graphics file",
            "@type": "ALTIMG",
            "@size": "5237",
            "@ref": "si11",
            "@mimetype": "image/svg+xml"
          },
          {
            "@category": "thumbnail",
            "@_fa": "true",
            "$": "https://api.elsevier.com/content/object/eid/1-s2.0-S0021951725003732-si12.svg?httpAccept=%2A%2F%2A",
            "@multimediatype": "Scalable Vector Graphics file",
            "@type": "ALTIMG",
            "@size": "21233",
            "@ref": "si12",
            "@mimetype": "image/svg+xml"
          },
          {
            "@category": "thumbnail",
            "@_fa": "true",
            "$": "https://api.elsevier.com/content/object/eid/1-s2.0-S0021951725003732-si13.svg?httpAccept=%2A%2F%2A",
            "@multimediatype": "Scalable Vector Graphics file",
            "@type": "ALTIMG",
            "@size": "1025",
            "@ref": "si13",
            "@mimetype": "image/svg+xml"
          },
          {
            "@category": "thumbnail",
            "@_fa": "true",
            "$": "https://api.elsevier.com/content/object/eid/1-s2.0-S0021951725003732-si14.svg?httpAccept=%2A%2F%2A",
            "@multimediatype": "Scalable Vector Graphics file",
            "@type": "ALTIMG",
            "@size": "22580",
            "@ref": "si14",
            "@mimetype": "image/svg+xml"
          },
          {
            "@category": "thumbnail",
            "@_fa": "true",
            "$": "https://api.elsevier.com/content/object/eid/1-s2.0-S0021951725003732-si15.svg?httpAccept=%2A%2F%2A",
            "@multimediatype": "Scalable Vector Graphics file",
            "@type": "ALTIMG",
            "@size": "5877",
            "@ref": "si15",
            "@mimetype": "image/svg+xml"
          },
          {
            "@category": "thumbnail",
            "@_fa": "true",
            "$": "https://api.elsevier.com/content/object/eid/1-s2.0-S0021951725003732-si16.svg?httpAccept=%2A%2F%2A",
            "@multimediatype": "Scalable Vector Graphics file",
            "@type": "ALTIMG",
            "@size": "4123",
            "@ref": "si16",
            "@mimetype": "image/svg+xml"
          },
          {
            "@category": "thumbnail",
            "@_fa": "true",
            "$": "https://api.elsevier.com/content/object/eid/1-s2.0-S0021951725003732-si17.svg?httpAccept=%2A%2F%2A",
            "@multimediatype": "Scalable Vector Graphics file",
            "@type": "ALTIMG",
            "@size": "5642",
            "@ref": "si17",
            "@mimetype": "image/svg+xml"
          },
          {
            "@category": "thumbnail",
            "@_fa": "true",
            "$": "https://api.elsevier.com/content/object/eid/1-s2.0-S0021951725003732-si18.svg?httpAccept=%2A%2F%2A",
            "@multimediatype": "Scalable Vector Graphics file",
            "@type": "ALTIMG",
            "@size": "3662",
            "@ref": "si18",
            "@mimetype": "image/svg+xml"
          },
          {
            "@category": "thumbnail",
            "@_fa": "true",
            "$": "https://api.elsevier.com/content/object/eid/1-s2.0-S0021951725003732-si19.svg?httpAccept=%2A%2F%2A",
            "@multimediatype": "Scalable Vector Graphics file",
            "@type": "ALTIMG",
            "@size": "3574",
            "@ref": "si19",
            "@mimetype": "image/svg+xml"
          },
          {
            "@category": "thumbnail",
            "@_fa": "true",
            "$": "https://api.elsevier.com/content/object/eid/1-s2.0-S0021951725003732-si2.svg?httpAccept=%2A%2F%2A",
            "@multimediatype": "Scalable Vector Graphics file",
            "@type": "ALTIMG",
            "@size": "5502",
            "@ref": "si2",
            "@mimetype": "image/svg+xml"
          },
          {
            "@category": "thumbnail",
            "@_fa": "true",
            "$": "https://api.elsevier.com/content/object/eid/1-s2.0-S0021951725003732-si20.svg?httpAccept=%2A%2F%2A",
            "@multimediatype": "Scalable Vector Graphics file",
            "@type": "ALTIMG",
            "@size": "2298",
            "@ref": "si20",
            "@mimetype": "image/svg+xml"
          },
          {
            "@category": "thumbnail",
            "@_fa": "true",
            "$": "https://api.elsevier.com/content/object/eid/1-s2.0-S0021951725003732-si21.svg?httpAccept=%2A%2F%2A",
            "@multimediatype": "Scalable Vector Graphics file",
            "@type": "ALTIMG",
            "@size": "2955",
            "@ref": "si21",
            "@mimetype": "image/svg+xml"
          },
          {
            "@category": "thumbnail",
            "@_fa": "true",
            "$": "https://api.elsevier.com/content/object/eid/1-s2.0-S0021951725003732-si22.svg?httpAccept=%2A%2F%2A",
            "@multimediatype": "Scalable Vector Graphics file",
            "@type": "ALTIMG",
            "@size": "1867",
            "@ref": "si22",
            "@mimetype": "image/svg+xml"
          },
          {
            "@category": "thumbnail",
            "@_fa": "true",
            "$": "https://api.elsevier.com/content/object/eid/1-s2.0-S0021951725003732-si23.svg?httpAccept=%2A%2F%2A",
            "@multimediatype": "Scalable Vector Graphics file",
            "@type": "ALTIMG",
            "@size": "6592",
            "@ref": "si23",
            "@mimetype": "image/svg+xml"
          },
          {
            "@category": "thumbnail",
            "@_fa": "true",
            "$": "https://api.elsevier.com/content/object/eid/1-s2.0-S0021951725003732-si24.svg?httpAccept=%2A%2F%2A",
            "@multimediatype": "Scalable Vector Graphics file",
            "@type": "ALTIMG",
            "@size": "10580",
            "@ref": "si24",
            "@mimetype": "image/svg+xml"
          },
          {
            "@category": "thumbnail",
            "@_fa": "true",
            "$": "https://api.elsevier.com/content/object/eid/1-s2.0-S0021951725003732-si25.svg?httpAccept=%2A%2F%2A",
            "@multimediatype": "Scalable Vector Graphics file",
            "@type": "ALTIMG",
            "@size": "3342",
            "@ref": "si25",
            "@mimetype": "image/svg+xml"
          },
          {
            "@category": "thumbnail",
            "@_fa": "true",
            "$": "https://api.elsevier.com/content/object/eid/1-s2.0-S0021951725003732-si26.svg?httpAccept=%2A%2F%2A",
            "@multimediatype": "Scalable Vector Graphics file",
            "@type": "ALTIMG",
            "@size": "5385",
            "@ref": "si26",
            "@mimetype": "image/svg+xml"
          },
          {
            "@category": "thumbnail",
            "@_fa": "true",
            "$": "https://api.elsevier.com/content/object/eid/1-s2.0-S0021951725003732-si27.svg?httpAccept=%2A%2F%2A",
            "@multimediatype": "Scalable Vector Graphics file",
            "@type": "ALTIMG",
            "@size": "5294",
            "@ref": "si27",
            "@mimetype": "image/svg+xml"
          },
          {
            "@category": "thumbnail",
            "@_fa": "true",
            "$": "https://api.elsevier.com/content/object/eid/1-s2.0-S0021951725003732-si28.svg?httpAccept=%2A%2F%2A",
            "@multimediatype": "Scalable Vector Graphics file",
            "@type": "ALTIMG",
            "@size": "865",
            "@ref": "si28",
            "@mimetype": "image/svg+xml"
          },
          {
            "@category": "thumbnail",
            "@_fa": "true",
            "$": "https://api.elsevier.com/content/object/eid/1-s2.0-S0021951725003732-si29.svg?httpAccept=%2A%2F%2A",
            "@multimediatype": "Scalable Vector Graphics file",
            "@type": "ALTIMG",
            "@size": "1360",
            "@ref": "si29",
            "@mimetype": "image/svg+xml"
          },
          {
            "@category": "thumbnail",
            "@_fa": "true",
            "$": "https://api.elsevier.com/content/object/eid/1-s2.0-S0021951725003732-si3.svg?httpAccept=%2A%2F%2A",
            "@multimediatype": "Scalable Vector Graphics file",
            "@type": "ALTIMG",
            "@size": "7137",
            "@ref": "si3",
            "@mimetype": "image/svg+xml"
          },
          {
            "@category": "thumbnail",
            "@_fa": "true",
            "$": "https://api.elsevier.com/content/object/eid/1-s2.0-S0021951725003732-si30.svg?httpAccept=%2A%2F%2A",
            "@multimediatype": "Scalable Vector Graphics file",
            "@type": "ALTIMG",
            "@size": "2411",
            "@ref": "si30",
            "@mimetype": "image/svg+xml"
          },
          {
            "@category": "thumbnail",
            "@_fa": "true",
            "$": "https://api.elsevier.com/content/object/eid/1-s2.0-S0021951725003732-si31.svg?httpAccept=%2A%2F%2A",
            "@multimediatype": "Scalable Vector Graphics file",
            "@type": "ALTIMG",
            "@size": "2867",
            "@ref": "si31",
            "@mimetype": "image/svg+xml"
          },
          {
            "@category": "thumbnail",
            "@_fa": "true",
            "$": "https://api.elsevier.com/content/object/eid/1-s2.0-S0021951725003732-si32.svg?httpAccept=%2A%2F%2A",
            "@multimediatype": "Scalable Vector Graphics file",
            "@type": "ALTIMG",
            "@size": "23155",
            "@ref": "si32",
            "@mimetype": "image/svg+xml"
          },
          {
            "@category": "thumbnail",
            "@_fa": "true",
            "$": "https://api.elsevier.com/content/object/eid/1-s2.0-S0021951725003732-si33.svg?httpAccept=%2A%2F%2A",
            "@multimediatype": "Scalable Vector Graphics file",
            "@type": "ALTIMG",
            "@size": "9147",
            "@ref": "si33",
            "@mimetype": "image/svg+xml"
          },
          {
            "@category": "thumbnail",
            "@_fa": "true",
            "$": "https://api.elsevier.com/content/object/eid/1-s2.0-S0021951725003732-si34.svg?httpAccept=%2A%2F%2A",
            "@multimediatype": "Scalable Vector Graphics file",
            "@type": "ALTIMG",
            "@size": "24599",
            "@ref": "si34",
            "@mimetype": "image/svg+xml"
          },
          {
            "@category": "thumbnail",
            "@_fa": "true",
            "$": "https://api.elsevier.com/content/object/eid/1-s2.0-S0021951725003732-si35.svg?httpAccept=%2A%2F%2A",
            "@multimediatype": "Scalable Vector Graphics file",
            "@type": "ALTIMG",
            "@size": "25563",
            "@ref": "si35",
            "@mimetype": "image/svg+xml"
          },
          {
            "@category": "thumbnail",
            "@_fa": "true",
            "$": "https://api.elsevier.com/content/object/eid/1-s2.0-S0021951725003732-si36.svg?httpAccept=%2A%2F%2A",
            "@multimediatype": "Scalable Vector Graphics file",
            "@type": "ALTIMG",
            "@size": "24456",
            "@ref": "si36",
            "@mimetype": "image/svg+xml"
          },
          {
            "@category": "thumbnail",
            "@_fa": "true",
            "$": "https://api.elsevier.com/content/object/eid/1-s2.0-S0021951725003732-si4.svg?httpAccept=%2A%2F%2A",
            "@multimediatype": "Scalable Vector Graphics file",
            "@type": "ALTIMG",
            "@size": "4032",
            "@ref": "si4",
            "@mimetype": "image/svg+xml"
          },
          {
            "@category": "thumbnail",
            "@_fa": "true",
            "$": "https://api.elsevier.com/content/object/eid/1-s2.0-S0021951725003732-si5.svg?httpAccept=%2A%2F%2A",
            "@multimediatype": "Scalable Vector Graphics file",
            "@type": "ALTIMG",
            "@size": "3105",
            "@ref": "si5",
            "@mimetype": "image/svg+xml"
          },
          {
            "@category": "thumbnail",
            "@_fa": "true",
            "$": "https://api.elsevier.com/content/object/eid/1-s2.0-S0021951725003732-si6.svg?httpAccept=%2A%2F%2A",
            "@multimediatype": "Scalable Vector Graphics file",
            "@type": "ALTIMG",
            "@size": "17132",
            "@ref": "si6",
            "@mimetype": "image/svg+xml"
          },
          {
            "@category": "thumbnail",
            "@_fa": "true",
            "$": "https://api.elsevier.com/content/object/eid/1-s2.0-S0021951725003732-si7.svg?httpAccept=%2A%2F%2A",
            "@multimediatype": "Scalable Vector Graphics file",
            "@type": "ALTIMG",
            "@size": "9299",
            "@ref": "si7",
            "@mimetype": "image/svg+xml"
          },
          {
            "@category": "thumbnail",
            "@_fa": "true",
            "$": "https://api.elsevier.com/content/object/eid/1-s2.0-S0021951725003732-si8.svg?httpAccept=%2A%2F%2A",
            "@multimediatype": "Scalable Vector Graphics file",
            "@type": "ALTIMG",
            "@size": "3636",
            "@ref": "si8",
            "@mimetype": "image/svg+xml"
          },
          {
            "@category": "thumbnail",
            "@_fa": "true",
            "$": "https://api.elsevier.com/content/object/eid/1-s2.0-S0021951725003732-si9.svg?httpAccept=%2A%2F%2A",
            "@multimediatype": "Scalable Vector Graphics file",
            "@type": "ALTIMG",
            "@size": "14608",
            "@ref": "si9",
            "@mimetype": "image/svg+xml"
          }
        ]
      },
      "link": {
        "@rel": "abstract",
        "@href": "https://api.elsevier.com/content/abstract/scopus_id/105009624559"
      }
    }
  }
}