{
  "metadata": {
    "title": "Multicomponent Pt-based catalyst for highly efficient chemoselective hydrogenation of 4-carboxybenzaldehyde",
    "authors": "; ; ",
    "journal": "Journal of Catalysis",
    "date": "2021-09-30",
    "doi": "10.1016/j.jcat.2021.07.019",
    "abstract": "",
    "uri": "https://api.elsevier.com/content/article/pii/S0021951721002840",
    "pii": "S0021951721002840"
  },
  "fulltext": {
    "full-text-retrieval-response": {
      "scopus-eid": "2-s2.0-85111970857",
      "originalText": "serial JL 272561 291210 291744 291809 31 Journal of Catalysis JOURNALCATALYSIS 2021-07-22 2021-07-22 2021-08-07 2021-08-07 2021-08-26T20:42:54 1-s2.0-S0021951721002840 S0021-9517(21)00284-0 S0021951721002840 10.1016/j.jcat.2021.07.019 S300 S300.1 FULL-TEXT 1-s2.0-S0021951721X00085 2022-12-13T01:11:51.748527Z 0 0 20210901 20210930 2021 2021-07-22T08:51:45.072084Z absattachment articleinfo articletitlenorm authfirstinitialnorm authfirstsurnamenorm cid cids contenttype copyright crossmark dateloaded dateloadedtxt datesearch datesort dateupdated dco docsubtype doctype doi eid ewtransactionid hubeid indexeddate issn issnnorm itemstage itemtransactionid itemweight openaccess openarchive pg pgfirst pglast pii piinorm pubdateend pubdatestart pubdatetxt pubyr sectiontitle sortorder srctitle srctitlenorm srctype ssids alllist content subj subheadings suppl tomb volfirst volissue volumelist webpdf webpdfpagecount yearnav figure table e-component body mmlmath acknowledge affil appendices articletitle auth authfirstini authfull authkeywords authlast grantnumber grantsponsor grantsponsorid highlightsabst orcid primabst ref specialabst 0021-9517 00219517 true 401 401 C Volume 401 19 174 182 174 182 202109 September 2021 2021-09-01 2021-09-30 2021 Regular Articles article fla © 2021 Elsevier Inc. All rights reserved. MULTICOMPONENTPTBASEDCATALYSTFORHIGHLYEFFICIENTCHEMOSELECTIVEHYDROGENATION4CARBOXYBENZALDEHYDE FANG X 1 Introduction 2 Experimental 2.1 Chemical reagents 2.2 Synthesis of FeNi-MOFs 2.3 Synthesis of Fe-MOFs or Ni-MOFs 2.4 Synthesis of Pt-FeNi@C, Pt-Fe@C and Pt-Ni@C 2.5 Catalyst characterization 2.6 Catalytic reaction measurement 3 Results and discussion 3.1 Catalyst structure 3.2 Catalytic performances 3.3 Catalyst stability 4 Conclusion Acknowledgments Appendix A Supplementary material References DONG 2014 18775 18785 Z ZHU 2016 6391 6398 Q ZHANG 2016 426 433 Z KHAN 2016 17268 17275 I WANG 2016 9370 9374 X XU 2018 1705442 H CAI 2019 1804903 Z LIU 2017 11781 11787 X XIA 2015 1837 1866 W XIAO 2017 15901 15912 Y AMALI 2014 8279 8282 A CHEN 2008 1581 1583 L XIA 2013 1935 W HUANG 2020 2000158 M LIN 2017 1601296 Y CAO 2017 2660 2677 X WANG 2020 1 12 G MATSAGAR 2019 4604 4616 B CAO 2017 2201 2211 W WEN 2015 3519 3525 M MA 2010 838 846 L NAKATSUKA 2018 898 905 K GAO 2020 Z LI 2008 2771 2776 J AZHAR 2019 875 904 A YANG 2020 105126 C CENTI 2020 G LI 2016 1111 1118 X GU 2019 2111 2117 Z LIAO 2016 502 509 Y LIU 2018 908 911 H QIN 2019 10313 10319 Y XUE 2017 6112 6123 Y WANG 2019 154 159 H SKOBELEV 2013 61 69 I WANG 2018 3315 3322 X FAN 2019 2285 2295 A FAN 2019 24347 24355 A YE 2019 307 317 B QIN 2019 9061 9075 C YAO 2019 25844 25853 J XIN 2021 126 139 H NING 2021 704 711 L ALJISHI 1982 4514 4522 R XU 2012 16987 16990 X WU 2015 3038 3044 R YANG 2017 469 479 Y ISARAINCHAVEZ 2017 18081 18093 E FAN 2021 2000017 C MACINO 2019 873 881 M QIN 2020 1910107 Y ZHANG 2019 4166 J ZHANG 2018 1704318 N LI 2017 6762 6769 Z YU 2020 2659 2665 L WANG 2021 56 75 Y GUO 2013 13252 Z WU 2020 2178 2184 J ZHANG 2021 375 386 W HALILU 2016 2216 2226 A YANG 2021 286 290 W PUTRO 2017 3637 3646 W BAI 2018 8384 8387 S SINGH 2001 73 84 U PUTRO 2017 149 151 W TANIYA 2012 84 91 K WANG 2020 2395 2412 X LI 2013 34 41 X LIU 2018 2472 2479 J TOURANI 2016 41 52 S GAO 2019 87 100 D TIE 2019 154 158 K KAN 2011 584 592 Y XIAO 2016 234 241 F TOURANI 2015 202 210 S FANGX2021X174 FANGX2021X174X182 FANGX2021X174XX FANGX2021X174X182XX 2023-08-07T00:00:00.000Z 2023-08-07T00:00:00.000Z http://creativecommons.org/licenses/by-nc-nd/4.0/ © 2021 Elsevier Inc. All rights reserved. 2021-08-10T23:27:07.624Z http://vtw.elsevier.com/data/voc/AddOnTypes/50.7/aggregated-refined National Natural Science Foundation of China 21573286 21874153 NSFC National Natural Science Foundation of China http://data.elsevier.com/vocabulary/SciValFunders/501100001809 http://sws.geonames.org/1814991/ Key scientific and technological innovation projects in Shandong Province 2019JZZY010343 Major Scientific and Technological Innovation Project of Shandong Province http://data.elsevier.com/vocabulary/SciValFunders/501100018532 http://sws.geonames.org/1814991/ This work is financially supported by the National Natural Science Foundation of China (No. 21874153 , No. 21573286 ) and the Key scientific and technological innovation projects in Shandong Province (No. 2019JZZY010343). 0 https://doi.org/10.15223/policy-017 https://doi.org/10.15223/policy-037 https://doi.org/10.15223/policy-012 https://doi.org/10.15223/policy-029 https://doi.org/10.15223/policy-004 item S0021-9517(21)00284-0 S0021951721002840 1-s2.0-S0021951721002840 10.1016/j.jcat.2021.07.019 272561 2021-08-26T20:31:07.81902Z 2021-09-01 2021-09-30 1-s2.0-S0021951721002840-main.pdf https://s3-eu-west-1.amazonaws.com/prod-ucs-content-store-eu-west/content/pii:S0021951721002840/MAIN/application/pdf/db83ca35440d4d05989ce8d5cc7f5f27/main.pdf main.pdf pdf true 2518298 MAIN 9 1-s2.0-S0021951721002840-main_1.png https://s3-eu-west-1.amazonaws.com/prod-ucs-content-store-eu-west/content/pii:S0021951721002840/PREVIEW/image/png/3ab9c3bd3105a5fc1d9315f79e514520/main_1.png main_1.png png 61839 849 656 IMAGE-WEB-PDF 1 1-s2.0-S0021951721002840-ga1.jpg https://s3-eu-west-1.amazonaws.com/prod-ucs-content-store-eu-west/content/pii:S0021951721002840/ga1/DOWNSAMPLED/image/jpeg/e112da3a9aaee424d4c26d9c3c3b425b/ga1.jpg ga1 true ga1.jpg jpg 22125 200 397 IMAGE-DOWNSAMPLED 1-s2.0-S0021951721002840-gr1.jpg https://s3-eu-west-1.amazonaws.com/prod-ucs-content-store-eu-west/content/pii:S0021951721002840/gr1/DOWNSAMPLED/image/jpeg/089c122534a5e3efc6b35f8450fbffb3/gr1.jpg gr1 gr1.jpg jpg 27940 255 311 IMAGE-DOWNSAMPLED 1-s2.0-S0021951721002840-gr2.jpg https://s3-eu-west-1.amazonaws.com/prod-ucs-content-store-eu-west/content/pii:S0021951721002840/gr2/DOWNSAMPLED/image/jpeg/db0e4536a97a461f54fa946964b88428/gr2.jpg gr2 gr2.jpg jpg 140105 444 711 IMAGE-DOWNSAMPLED 1-s2.0-S0021951721002840-gr3.jpg https://s3-eu-west-1.amazonaws.com/prod-ucs-content-store-eu-west/content/pii:S0021951721002840/gr3/DOWNSAMPLED/image/jpeg/2266fd056cee14c933c39e8b7c705dde/gr3.jpg gr3 gr3.jpg jpg 36951 191 711 IMAGE-DOWNSAMPLED 1-s2.0-S0021951721002840-gr4.jpg https://s3-eu-west-1.amazonaws.com/prod-ucs-content-store-eu-west/content/pii:S0021951721002840/gr4/DOWNSAMPLED/image/jpeg/faf6c17c807b109a22eaeb2f2f6e2af9/gr4.jpg gr4 gr4.jpg jpg 78332 458 542 IMAGE-DOWNSAMPLED 1-s2.0-S0021951721002840-gr5.jpg https://s3-eu-west-1.amazonaws.com/prod-ucs-content-store-eu-west/content/pii:S0021951721002840/gr5/DOWNSAMPLED/image/jpeg/d19bc32e8b66cf634b96d378f107f753/gr5.jpg gr5 gr5.jpg jpg 76916 468 711 IMAGE-DOWNSAMPLED 1-s2.0-S0021951721002840-gr6.jpg https://s3-eu-west-1.amazonaws.com/prod-ucs-content-store-eu-west/content/pii:S0021951721002840/gr6/DOWNSAMPLED/image/jpeg/5806e844a0f40579cc65c7018b5ff937/gr6.jpg gr6 gr6.jpg jpg 36595 237 622 IMAGE-DOWNSAMPLED 1-s2.0-S0021951721002840-gr7.jpg https://s3-eu-west-1.amazonaws.com/prod-ucs-content-store-eu-west/content/pii:S0021951721002840/gr7/DOWNSAMPLED/image/jpeg/e76f53cf7390dabb2ad2a42f282fe631/gr7.jpg gr7 gr7.jpg jpg 36712 282 542 IMAGE-DOWNSAMPLED 1-s2.0-S0021951721002840-gr8.jpg https://s3-eu-west-1.amazonaws.com/prod-ucs-content-store-eu-west/content/pii:S0021951721002840/gr8/DOWNSAMPLED/image/jpeg/447e7182d0016c8ee473195f6c15c8aa/gr8.jpg gr8 gr8.jpg jpg 41841 333 542 IMAGE-DOWNSAMPLED 1-s2.0-S0021951721002840-ga1.sml https://s3-eu-west-1.amazonaws.com/prod-ucs-content-store-eu-west/content/pii:S0021951721002840/ga1/THUMBNAIL/image/gif/cb695a65c0a06d295e370ca4cec460a1/ga1.sml ga1 true ga1.sml sml 9109 110 219 IMAGE-THUMBNAIL 1-s2.0-S0021951721002840-gr1.sml https://s3-eu-west-1.amazonaws.com/prod-ucs-content-store-eu-west/content/pii:S0021951721002840/gr1/THUMBNAIL/image/gif/08f3d10a1b8a5d14182d7ef16d1e9925/gr1.sml gr1 gr1.sml sml 9070 164 200 IMAGE-THUMBNAIL 1-s2.0-S0021951721002840-gr2.sml https://s3-eu-west-1.amazonaws.com/prod-ucs-content-store-eu-west/content/pii:S0021951721002840/gr2/THUMBNAIL/image/gif/670a85a14eea45cb687da3726b3c588b/gr2.sml gr2 gr2.sml sml 24496 137 219 IMAGE-THUMBNAIL 1-s2.0-S0021951721002840-gr3.sml https://s3-eu-west-1.amazonaws.com/prod-ucs-content-store-eu-west/content/pii:S0021951721002840/gr3/THUMBNAIL/image/gif/043306d01b68d39e79c8b646851efc47/gr3.sml gr3 gr3.sml sml 4067 59 219 IMAGE-THUMBNAIL 1-s2.0-S0021951721002840-gr4.sml https://s3-eu-west-1.amazonaws.com/prod-ucs-content-store-eu-west/content/pii:S0021951721002840/gr4/THUMBNAIL/image/gif/297f9fad2d71b9471cd3e431bee44650/gr4.sml gr4 gr4.sml sml 11035 164 194 IMAGE-THUMBNAIL 1-s2.0-S0021951721002840-gr5.sml https://s3-eu-west-1.amazonaws.com/prod-ucs-content-store-eu-west/content/pii:S0021951721002840/gr5/THUMBNAIL/image/gif/85ccd4360a0b590f33665a7851a02540/gr5.sml gr5 gr5.sml sml 8720 144 219 IMAGE-THUMBNAIL 1-s2.0-S0021951721002840-gr6.sml https://s3-eu-west-1.amazonaws.com/prod-ucs-content-store-eu-west/content/pii:S0021951721002840/gr6/THUMBNAIL/image/gif/6f46091245c9c09ac2e421491e8b34da/gr6.sml gr6 gr6.sml sml 5254 84 219 IMAGE-THUMBNAIL 1-s2.0-S0021951721002840-gr7.sml https://s3-eu-west-1.amazonaws.com/prod-ucs-content-store-eu-west/content/pii:S0021951721002840/gr7/THUMBNAIL/image/gif/e1ea775f845480c8fb817214d9ad1af1/gr7.sml gr7 gr7.sml sml 9336 114 219 IMAGE-THUMBNAIL 1-s2.0-S0021951721002840-gr8.sml https://s3-eu-west-1.amazonaws.com/prod-ucs-content-store-eu-west/content/pii:S0021951721002840/gr8/THUMBNAIL/image/gif/ce17f25f1ffb2c12c54b9dc4b0c3cc58/gr8.sml gr8 gr8.sml sml 9673 134 219 IMAGE-THUMBNAIL 1-s2.0-S0021951721002840-ga1_lrg.jpg https://s3-eu-west-1.amazonaws.com/prod-ucs-content-store-eu-west/content/pii:S0021951721002840/ga1/HIGHRES/image/jpeg/99aaafd0c42d2ee764c711a44bd7712d/ga1_lrg.jpg ga1 true ga1_lrg.jpg jpg 68074 531 1056 IMAGE-HIGH-RES 1-s2.0-S0021951721002840-gr1_lrg.jpg https://s3-eu-west-1.amazonaws.com/prod-ucs-content-store-eu-west/content/pii:S0021951721002840/gr1/HIGHRES/image/jpeg/38d453efd4fb749146cb5c2cb92f6da2/gr1_lrg.jpg gr1 gr1_lrg.jpg jpg 152055 1129 1378 IMAGE-HIGH-RES 1-s2.0-S0021951721002840-gr2_lrg.jpg https://s3-eu-west-1.amazonaws.com/prod-ucs-content-store-eu-west/content/pii:S0021951721002840/gr2/HIGHRES/image/jpeg/efa768d851fdbf686d6e51ada8ea67e6/gr2_lrg.jpg gr2 gr2_lrg.jpg jpg 944223 1966 3149 IMAGE-HIGH-RES 1-s2.0-S0021951721002840-gr3_lrg.jpg https://s3-eu-west-1.amazonaws.com/prod-ucs-content-store-eu-west/content/pii:S0021951721002840/gr3/HIGHRES/image/jpeg/baef7feb03faaf15a933fe885d80dd4e/gr3_lrg.jpg gr3 gr3_lrg.jpg jpg 220096 845 3149 IMAGE-HIGH-RES 1-s2.0-S0021951721002840-gr4_lrg.jpg https://s3-eu-west-1.amazonaws.com/prod-ucs-content-store-eu-west/content/pii:S0021951721002840/gr4/HIGHRES/image/jpeg/e7c01b1ea816c012cf0c7981d48b7b2a/gr4_lrg.jpg gr4 gr4_lrg.jpg jpg 487455 2028 2402 IMAGE-HIGH-RES 1-s2.0-S0021951721002840-gr5_lrg.jpg https://s3-eu-west-1.amazonaws.com/prod-ucs-content-store-eu-west/content/pii:S0021951721002840/gr5/HIGHRES/image/jpeg/eddf9da6941480de3c66de03facf4e7b/gr5_lrg.jpg gr5 gr5_lrg.jpg jpg 404802 2074 3150 IMAGE-HIGH-RES 1-s2.0-S0021951721002840-gr6_lrg.jpg https://s3-eu-west-1.amazonaws.com/prod-ucs-content-store-eu-west/content/pii:S0021951721002840/gr6/HIGHRES/image/jpeg/a1ec27aa9087eb0ecb27d0948cd8b359/gr6_lrg.jpg gr6 gr6_lrg.jpg jpg 205382 1052 2756 IMAGE-HIGH-RES 1-s2.0-S0021951721002840-gr7_lrg.jpg https://s3-eu-west-1.amazonaws.com/prod-ucs-content-store-eu-west/content/pii:S0021951721002840/gr7/HIGHRES/image/jpeg/bbfba44ea08b716fa97f752203aa5e32/gr7_lrg.jpg gr7 gr7_lrg.jpg jpg 190365 1251 2402 IMAGE-HIGH-RES 1-s2.0-S0021951721002840-gr8_lrg.jpg https://s3-eu-west-1.amazonaws.com/prod-ucs-content-store-eu-west/content/pii:S0021951721002840/gr8/HIGHRES/image/jpeg/35ee679a51f800976be90f65cd1ad669/gr8_lrg.jpg gr8 gr8_lrg.jpg jpg 216020 1474 2402 IMAGE-HIGH-RES 1-s2.0-S0021951721002840-mmc1.docx https://s3-eu-west-1.amazonaws.com/prod-ucs-content-store-eu-west/content/pii:S0021951721002840/mmc1/MAIN/application/vnd.openxmlformats-officedocument.wordprocessingml.document/838865bfd59d0b7e5575963d85044d54/mmc1.docx mmc1 mmc1.docx docx 3333444 APPLICATION 1-s2.0-S0021951721002840-si1.svg https://s3-eu-west-1.amazonaws.com/prod-ucs-content-store-eu-west/content/pii:S0021951721002840/STRIPIN/image/svg+xml/884d65889791f73a9775a7ee77a9a3e5/si1.svg si1 si1.svg svg 31298 ALTIMG 1-s2.0-S0021951721002840-si2.svg https://s3-eu-west-1.amazonaws.com/prod-ucs-content-store-eu-west/content/pii:S0021951721002840/STRIPIN/image/svg+xml/36fd7c288a77cac68b898fa1ada70f98/si2.svg si2 si2.svg svg 38764 ALTIMG 1-s2.0-S0021951721002840-am.pdf https://s3-eu-west-1.amazonaws.com/prod-ucs-content-store-eu-west/content/egi:100RMVLSHQX/MAIN/application/pdf/5856735cca5cde5e0e2acbebb57dc48a/am.pdf am am.pdf pdf false 1667486 AAM-PDF YJCAT 14255 S0021-9517(21)00284-0 10.1016/j.jcat.2021.07.019 Elsevier Inc. Fig. 1 N2 sorption isotherms of FeNi@C,Pt-FeNi@C, Pt-Fe@C and Pt-Ni@C. Fig. 2 (a) SEM and (b) TEM images of Pt-FeNi@C. (c) HR-TEM image and (d) STEM images of Pt-FeNi@C. Element mapping images of carbon, iron, nickel and platinum with their overlapping image (e–i) of Pt-FeNi@C. (j) EDX analysis of the Pt-FeNi@C. Fig. 3 (a and b) The XRD diffraction patterns of FeNi@C and Pt-FeNi@C. (c) Raman spectra of FeNi@C and Pt-FeNi@C. Fig. 4 XPS spectra of Pt-FeNi@C and FeNi@C catalysts: (a) full-survey XPS spectra; (b) Pt 4f of Pt-FeNi@C; (c) Fe 2p and (d) Ni 2p of Pt-FeNi@C and FeNi@C. Fig. 5 (a) The scheme of hydrogenation of 4-CBA. (b) The liquid-phase selective hydrogenation of 4-CBA over the FeNi@C, Pt-Fe@C, Pt-Ni@C and Pt-FeNi@C catalyst. (c) 4-CBA conversion of Pt-Fe@C, Pt-Ni@C and Pt-FeNi@C catalyst over time under 280 °C. (d), (e), (f), (g) The distribution of Pt-FeNi@C, Pt-Fe@C Pt-Ni@C and Pt/C catalyst over the reaction time. Fig. 6 (a) Recycling of the Pt-FeNi@C catalyst in the selective hydrogenation of 4-CBA under the same conditions. (b) Recycling of the commercial catalyst in the selective hydrogenation of 4-CBA under the same conditions. Scheme 1 Illustration of the synthesis procedure of Pt-FeNi@C and metal nanoparticles for hydrogenation of 4-CBA. Scheme 2 Schematic illustration of Pt-FeNi@C, Pt-Fe@C and Pt-Ni@C catalysts for hydrogenation of 4-CBA. Table 1 Structural properties of the as-prepared catalysts. catalyst SBET (m2/g) Vp (cm3/g) FeNi@C 35.5 0.14 Pt-FeNi@C 156.5 0.29 Pt-Fe@C 75.5 0.19 Pt-Ni@C 56.4 0.15 Table 2 Comparison of catalytic hydrogenation of 4-CBA reported in literatures. Catalyst Catalyst weight 4-CBA weight Time T PH2 Conv. Selectivity [%] Ref. (g) (g) (min) (°C) (MPa) [%] 4-HMBA P-TOL BA Pt-FeNi@C 0.03 0.1 60 280 0.5 97 85 0 15 This work Pt/C 0.03 0.1 60 280 0.5 96 10 2 88 This work commercial catalyst 0.03 0.1 60 280 0.5 92 1 6 93 This work Pd/BC 0.02 0.2 40 100 0.5 77.1 – – – [73] Pd/TNT 0.2 0.7 60 280 0.6 96.8 13.4 0.9 82 [70] Pd/TiO2 2 0.7 90 280 0.6 99.5 – – – [74] Pd/C 2 1 60 278 0.5 100 – – – [75] Pd–Sn/FMWCNT 1.3 0.25 60 290 1 99.7 – – – [71] Pd/MWCNT 1.3 0.25 60 290 1 99 – – – [76] Multicomponent Pt-based catalyst for highly efficient chemoselective hydrogenation of 4-carboxybenzaldehyde Xu Fang a Aixin Fan b Zhen Wang a Yao Wang c Yunrui Li a Shuna Li a Yinghao Wang a Chenglong Dong a Haixiao Sun a Yuanyuan Liu a Xin Zhang a ⁎ Yehua Han a ⁎ Xiaoping Dai a a State Key Laboratory of Heavy Oil Processing, China University of Petroleum, Beijing 102249, China State Key Laboratory of Heavy Oil Processing China University of Petroleum Beijing 102249 China State Key Laboratory of Heavy Oil Processing, China University of Petroleum, Beijing 102249, China b School of Chemistry & Material Science, Langfang Normal University, Langfang 065000, China School of Chemistry & Material Science Langfang Normal University Langfang 065000 China School of Chemistry & Material Science, Langfang Normal University, Langfang 065000, China c Department of Chemistry, Tsinghua University, Beijing 100084, China Department of Chemistry Tsinghua University Beijing 100084 China Department of Chemistry, Tsinghua University, Beijing 100084, China ⁎ Corresponding authors. Graphical abstract The design of efficient nanostructured catalysts is highly desirable for promoting the hydrogenation of 4-carboxybenzaldehyde (4-CBA), which are the key process of hydrorefining of crude terephthalic acid (CTA) to pure terephthalic acid (PTA). Herein, the Pt-FeNi@C, Pt-Fe@C and Pt-Ni@C catalysts were developed and proved to be active for the selective hydrogenation of 4-CBA. As a result, the excellent 4-hydroxymethylbenzoic acid (4-HMBA) selectivity (85%) and benzoic acid (BA) selectivity (88%) were achieved on Pt-FeNi@C and Pt/C, respectively. In comparison with the commercial Pd/C catalyst, the Pt-FeNi@C catalyst exhibits excellent activity (97%) and reduces the occurrence of decarbonylation. Moreover, the Pt-FeNi@C catalyst exhibits excellent recyclability: the catalytic activity did not decrease significantly after four reaction cycles. In combination with detailed characterization, the Pt-FeNi@C catalyst has porous graphene core-shell architecture and remarkable electron transfer capacity. This work may provide some inspirations for the exploration of new PTA hydrofining catalysts. Keywords Pt 4-Carboxybenzaldehyde Hydrogenation Metals@carbon MOF-derived 1 Introduction Recently, metals@carbon composites have gained substantial attention as an excellent candidate for the noble metal nanoparticle (NMNP) catalyst support [1]. The metal@carbon composites are prepared by pyrolysis of metal–organic frameworks (MOFs) coordinated by metal ions and organic ligands [2–7]. The advantages for MOFs as precursors of metals@carbon composites include: a) the homogeneous distribution of metal ions and organic ligands lead to well-organized nanostructures on carbonization of the MOF [8]; b) after carbonization, a carbon shell appears over the metal surface which prevent their agglomeration and corrosion [9,10]; c) high porosity can afford more channels for hydrogen molecule and reactant diffusion [5]; d) the carbon composites converted from MOFs still remain the properties of the MOF [11–14]. Metals@carbon composites maintain most of advantages derived from their MOFs, such as high porosity, extremely surface area, tunable pore sizes, outstanding cycle lifetime, and so on [15,16]. Meanwhile, metals@carbon composites can serve as host to encapsulate metal nanoparticles (NPs) especially noble metals such as Pt [17], Pd [18], Rh [19] and Ru [20]. Therefore, NMNP-metals@carbon catalysts have been widely applied in catalysis [21–24], gas storage [25], environmental remediation and many other aspects [26–28]. Especially, utilization of NMNP-metals@carbon catalysts for hydrogenation reactions has been received considerable attention due to highly porous structures with an enhanced specific surface area which might improve the efficiency and catalytic activity, such as semihydrogenation of acetylene to ethylene [29], selectivity for hydrogenation of the carbonyl groups [30], hydrogenation of nitro compounds [31] and so on. Pt-based catalysts have been widely employed and demonstrated to be the effective catalysts for selectivity hydrogenation due to their excellent hydrogenation activity [32,33]. However, poor selectivity of monometallic Pt catalyst limits their application [34]. Therefore, the addition of one or more transition metals to Pt-based catalysts to form bimetallic or multimetallic catalysts has received extensive attention due to the electronic and geometric modifications [35]. Transition metals such as Fe, Ni, Co and Cu based MOFs exhibit excellent performance toward electrocatalytic applications and conventional thermal catalysis. In particular, MIL-101(Fe), a zerotype crystal structure consisting of two kinds of cages [36], is applied as a suitable precursor for obtaining high-performance nonprecious Fe-C catalyst. The unit components of MIL-101(Fe) has good stability, nontoxic nature, extremely large surface area and numerous active transition metal sites [37]. As well as Fe, Ni as an earth abundant transition metal possesses excellent corrosion resistance in many fields such as batteries, super capacitors and catalysis. Homogeneous multimetallic MOFs could be easily synthesized due to the good compatibility of metal ions with organic frameworks. Inspired by above advantages, we report here, for the first time, that Pt-based metals@carbon catalysts derived from MOFs represent excellent catalytic activity for hydrorefining of CTA to PTA as shown in Scheme 1 . The method of catalyst preparation follows a synthetic route previously developed by our research group [38,39]. The combination of Pt and metals@carbon composites derived from MOFs improves the properties of the catalyst and forms a unique bipyramidal morphology which was in-depth characterized by scanning electron microscopy (SEM), transmission electron microscopy (TEM), high-resolution transmission electron microscopy (HRTEM), X-ray photoelectron spectroscopy (XPS) and so on. Compared with commercial Pt/C (Pd/C) catalyst, Pt-FeNi@C catalyst not only has good activity and stability for hydrogenation of 4-CBA, but also has great differences in selectivity due to the excellent electron transfer capacity. These give the catalyst system great potential for industrial application in the PTA refining. 2 Experimental 2.1 Chemical reagents Terephthalic acid (H2BDC), nickel acetylacetonate (Ni(acac)2), ferric trichloride hexahydrate (FeCl3·6H2O), chloroplatinic acid (H2PtCl6·6H2O) and N, N-dimethylformamide (DMF) were purchased from Sinopharm Chemical Reagent Co. Ltd. Ethanol and n-hexane were purchased from Beijing Chemical Reagent Company. All chemicals were used as received without further purification. 2.2 Synthesis of FeNi-MOFs FeNi-MOFs were synthesized according to our previously reported procedure [38]. Briefly, FeCl3·6H2O (1 mmol), Ni(acac)2 (0.5 mmol), H2BDC (1 mmol) and DMF (16 mL) were well mixed via ultrasonic and magnetic stirring and then placed in a 50 mL Teflon-lined autoclave. After that the mixed solution maintained at 120 °C for 8 h. The final product was obtained by centrifugation, washing and drying. 2.3 Synthesis of Fe-MOFs or Ni-MOFs FeCl3·6H2O (1 mmol) or Ni(acac)2 (0.5 mmol), H2BDC (1 mmol) and DMF (16 mL) were well mixed via ultrasonic and magnetic stirring and then placed in a 50 mL Teflon-lined autoclave. After that the mixed solution maintained at 120 °C for 8 h. The final product was obtained by centrifugation, washing and drying. 2.4 Synthesis of Pt-FeNi@C, Pt-Fe@C and Pt-Ni@C Pt-FeNi@C, Pt-Fe@C and Pt-Ni@C were synthesized according to our previously reported procedure [39]. Typically, FeNi-MOF (100 mg) was uniformly dispersed in n-hexane (10 mL) via ultrasonication. Subsequently, a certain amount of H2PtCl6·6H2O solution (20 mmol, 200 μL) was added into the solution under vigorous stirring for 2 h. The final product was obtained via centrifugation and dried at 60 °C in an oven overnight, followed by calcination under Ar at 600 °C for 2 h (denoted as Pt-FeNi@C). The preparation of Pt-Fe@C and Pt-Ni-@C is the same as that of Pt-FeNi@C. 2.5 Catalyst characterization Power X-ray diffraction (XRD) was tested on a Brüker D8 Advance diffractometer at 40 kV and 40 mA for Cu Kα (λ = 0.15406). SEM images were observed on an ULTRA 55 SEM at 20 kV. TEM was performed on JEM-2100 at 200 kV. HRTEM was performed on a Tecnai G2 F20 S-Twin at 200 kV. High- angle annular dark field scanning transmission electron microscopy (HAADF-STEM) was carried out on Tecnai G2 F20 S-Twin HRTEM operating at 200 kV. XPS was measured on a PHI 5000 Versaprobe system using monochromatic Al Kα radiation (1486.6 eV). The C 1s graphitic peak is referred to as the reference (284.6 eV). Inductively coupled plasma optical emission spectrometer (ICP- OES) was performed on iCAP7400 (Thermo Fisher Scientific). Renishaw Micro-Raman System 2000 spectrometer with spectral resolution of 2 cm−1 was used to record Raman spectra. A laser line at 532 nm of a He/Cd laser was used as an exciting source, and the output power was 20 mW. The spectra were recorded at a 1 cm−1 resolution with the condition of 50 s integral time at room temperature. N2 adsorption/desorption isotherms were conducted at −196 °C using a kubo X10000 static volumetric gas adsorption instrument. The samples were degassed at 200 °C for 3 h in a vacuum before measurements. The specific surface area of the sample was calculated from the adsorption branches (p/p0 : 0.05–0.20) by the Brunauer − Emmett − Teller (BET) method. The mesopore size distribution was calculated from desorption branches by the Barret − Joyner − Halenda (BJH) method, and the single point adsorption total pore volume was taken at the relative pressure of 0.96. 2.6 Catalytic reaction measurement The reaction of hydrogenation of 4-CBA was carried out in a 100 mL stirred autoclave reactor. 0.1 g 4-CBA and 50 mL water was added to the reactor in the presence of the catalyst (0.03 g), under a hydrogenation of 5 bar and 280 °C. After reacting at a stirring speed of 800 rpm/min for 1 h, the reactants and products are determined by ultra-high performance liquid chromatography Agilent 1290 equipped with a C18 column using acetonitrile–water binary mixture as gradient elution mobile phase. The performance of the catalyst is evaluated by the conversion of 4-CBA and the selectivity of yield products. The stability of the catalyst was obtained by six consecutive reactions. The product conversion and selectivity were calculated as follows: C n o v e r s i o n % = m o l o f p r o d u c t p r o d u c e d m o l o f s u b s t r a t e f e d × 100 % Selectivity ( % ) = m o l o f p r o d u c t p r o d c e d mol o f s u b s t r a t e c o n s u m e d × 100 % 3 Results and discussion 3.1 Catalyst structure The texture properties of as-synthesized catalysts were determined using N2 adsorption–desorption isotherm and Barrett–Joyner–Halenda (BJH) pore size distribution curves. The as-synthesized catalysts exhibited type I isotherms with insignificant Ⅳ-type hysteresis loops, which was associated with capillary condensation in mesopores (Fig. 1 ). The calculated surface areas (pore volumes) of as-synthesized catalysts are shown in Table 1 . The surface areas and pore volumes of the Pt-FeNi@C catalyst are much higher than that of FeNi@C catalyst. The Pt-FeNi@C catalyst possesses the largest surface area and pore volume, which can facilitate mass diffusion/transport and provide more activity sites for conversation of 4-CBA. This is because larger surface area and pore volume can facilitate mass diffusion/transport and provide more activity sites. The as-obtained Pt-based catalysts were characterized by SEM and TEM. As shown in Fig. S2a and Fig. 2 a, the prepared FeNi@C and Pt-FeNi@C retained the bipyramidal morphology of the original FeNi-MOF. The TEM image shows that Pt-FeNi@C consists of numerous small nano-particles, and every nano-particle has a core (66 nm)-shell (12 nm) structure (Fig. 2b). As shown in Fig. S3, the Pt-Ni@C and Pt-Fe@C catalysts do not have the unique bipyramidal structure of Pt-FeNi@C catalysts. As revealed by HRTEM in Fig. 2c, the well-resolved lattice fringes with interplanar spacings of 0.21 nm and 0.34 nm can be indexed to the (111) plane of Fe0.64Ni0.36 alloy [17] and the typical layer spacing of graphitic carbon [39]. Meanwhile, Pt (111) facets with the interplanar spacings of 0.22 nm were detected for Pt-FeNi@C (Fig. 2d) [40]. The resulting HAADF-STEM and EDX element mappings indicate that the carbon element is mainly distributed outside of an individual nano-particle, while Fe, Ni, and Pt elements are basically distributed inside, which also indicate the formation of the metal@carbon (core-shell) structure (Fig. 2e–j). EDX analysis showed the presence of C, Fe, Ni and Pt elements. Besides, HRTEM-EDX of Pt-FeNi@C showed that the PtFeNi nanostructures should be highly dispersed in the carbon shell (Fig. 2j). The HRTEM image (Fig. S2c) shows a smaller lattice spacing (0.21 nm) than that of Pt-FeNi@C. This phenomenon indicated that a small amount of Pt was incorporated into the FeNi alloy to form PtFeNi ternary alloy [41]. Moreover, the chemical composition analyses of the as-obtained Pt-based catalysts verified by ICP-OES and EDAX are shown in Tables S1 and S2. The atomic ratio of Ni and Fe in Pt-FeNi@C and FeNi@C was close to 1:2. Meanwhile, the Pt content of all Pt-based catalysts was 0.66 wt%. Moreover, the XRD patterns of the FeNi@C and Pt-FeNi@C catalyst are shown in Fig. 3 . Three distinct diffraction peaks located at 2θ of 43.6°, 50.8° and 74.7° are indexed as (111), (200) and (220) planes of the cubic Fe0.64Ni0.36 alloy (JCPDS 47-1405), respectively (Fig. 3a). Furthermore, the Pt-FeNi@C catalyst exhibited similar diffraction patterns to FeNi@C, indicating that doping Pt into FeNi@C did not destroy the structure of the FeNi@C. This phenomenon is consistent with TEM images of Pt-FeNi@C and FeNi@C. When compared with the peak of FeNi@C, a little negative shift appears in the peak of Pt-FeNi@C. This phenomenon indicated that Pt atoms were introduced into the FeNi alloys (Fig. 3b) [42]. In addition, the XRD patterns of the Pt-Fe@C and Pt-Ni@C are shown in Fig. S4. There is no obvious difference between the diffraction patterns of PtFe@C and PtNi@C, but they are significantly different from Pt-FeNi@C and FeNi@C. This may be due to the formation of FeNi alloy in Pt-FeNi@C and FeNi@C, but not in Pt-Ni@C and Pt-Fe@C. Besides, the diffraction patterns of Pt (111) planes are note detected due to the low Pt loading in all Pt-based catalysts [43,44]. The formation of graphitic order of carbon shells was further proved by Raman spectroscopy. As shown in Fig. 3c, the G band at 1576.0 cm−1 is consistent with the in-plane vibration of sp2 carbon atoms, while the D band at 1336.1 cm−1 indicates the sp3-hybridized disordered structures [45,46]. Besides, the G band appears to be stronger than the D band, indicating that the Pt-FeNi@C and FeNi@C possess better degree of the graphitic crystalline structure. However, the I G/I D value of Pt-FeNi@C was higher than that of FeNi@C, demonstrating that the Pt-FeNi@C has better degree of the graphitic crystalline structure, which can be beneficial for achieving enhanced electronic conduction between neighboring Pt-FeNi alloy NPs [47]. To our delight, compared with FeNi@C, there is another relatively weak 2D broad peak located at 2681 cm−1 for Pt-FeNi@C, also demonstrating the existence of graphene carbon [48]. To further identify the surface compositions and chemical states of Pt-based catalysts, the Pt-FeNi@C and FeNi@C catalysts were detected by XPS (Fig. 4 ). There are two distinct metallic Pt peaks detected at 71.6 eV and 74.8 eV which are consistent with Pt 4f7/2 and Pt 4f5/2, respectively [49] (Fig. 4b). The binding energy of Pt 4f7/2 peak at 71.6 eV and 74.8 eV corresponds to Pt0 species [50,51]. It is worth noting that the Pt 4f peaks had a positive shift compared with that of pure Pt [52]. This phenomenon indicates that the electron transfer from Fe or Ni to Pt [35,53]. The peak position of Pt 4f7/2 of Pt-FeNi@C is shifted to 71.6 eV, indicating that Pt element gains extracharge from iron and nickel, which favors the CO adsorption during the hydrogenation [54] and improves the conversion and stability of 4-CBA. From Fig. 4c, there are three distinct metallic Fe peaks matching with Fe 2p detected at 707.5 eV, 710.7 eV and 712.7 eV which are assigned to Fe0, Fe2+ and Fe3+, respectively. Likewise, in the spectrum of Ni 2p, there appeared two chemically distinct species: metallic Ni (852.9 eV) and Ni2+ (855.2 eV) species, respectively (Fig. 4d). In addition, according to the peak areas, the percentages of metallic Fe0 and Ni0 in the Pt-FeNi@C catalyst are lower than those of the FeNi@C catalyst, which also indicates the existence of electron interactions between Pt, Fe and Ni. The XPS was also employed to investigate the chemical state of Pt-Fe@C and Pt-Ni@C (Fig. S5). The Fe 2p peaks could be deconvoluted to peaks at 710.5 and 712.5 eV representing Fe2+ and Fe3+, respectively (Fig. S5a), confirming the coexistence of Fe2+ and Fe3+ species on the catalyst surface. The Ni 2p peaks at 853.7 and 859.8 eV can be corresponded to Ni0 and Ni2+ species, respectively (Fig. S5c) [55]. The binding energy of Pt 4f region of Pt-Fe@C and Pt-Ni@C catalysts shows significant shifts to the binding energies of 0.6 eV and 0.1 eV, respectively, when compared with pure Pt metal peaks (70.9 eV) [56,57]. The positive shift compared to pure Pt is probably due to electron donation from Ni/Fe to Pt [58–60]. Compared with Pt-Ni@C, the peak deviation of Pt 4f in Pt-Fe@C is larger than that of in Pt-Ni@C indicating that the interaction for Pt-Fe system is stronger than that of the Pt-Ni system [44]. 3.2 Catalytic performances The hydrogenation scheme of 4-CBA is given as Fig. 5 a. With these Pt-based catalysts and Pt/C catalyst at hand, we are eager to investigate the catalytic performance in the selective hydrogenation of 4-CBA. The influence of Pt-based catalysts and Pt/C catalyst for the selective hydrogenation of 4-CBA is summarized in Fig. 5b. The generated products include 4-HMBA, p-toluic acid (P-TOL) and BA. The reactions were initially performed under 0.5 MPa H2 at 280 °C for 1 h in the screening series of various catalysts. There is only 4-HMBA in the 4-CBA hydrogenation products of FeNi@C, which indicates that FeNi alloy has a high hydrogenation selectivity for CO [61]. For the Pt-Fe@C catalyst, the generated products only include 4-HMBA and BA, suggesting that Fe favours the hydrogenation of CO over the decarboxylic reaction [2]. This is because electron-deficient Fe could attract the lone pair of oxygen in the carbonyl group via side-bonding interaction, which indicates that the presence of Fe can promote the hydrogenation selectivity of CO [60,62]. In addition, due to the anticlinal folded Pt-Fe skin [63], CO group can be more easily adsorbed and activated. Moreover the excellent 4-HMBA selectivity of Pt-Fe@C is due to the higher electron density of the surface Pt atoms [64]. However, for the Pt-Ni@C catalyst, the generated products not only include 4-HMBA and BA, but also have P-TOL which demonstrates that the hydrogenation effect of Ni on CO is not obvious [44,65]. This is because Ni has activity for homolytic-H2 dissociation to create hydride-like species attached on the Ni. The interaction between those hydride-like species and Pt can further hydrogenate the CO group to CH3 group. The variation of hydrogenation products of each catalyst with time is shown in Fig. 5d–g. As the reaction continues, 4-HMBA is the main product of Pt-based catalyst doped with Fe or Ni, while BA is the main product of Pt/C catalyst. The same results are also shown in Fig. 5b, 4-HMBA is the main product of the hydrogenation products of Pt-FeNi@C, Pt-Fe@C and Pt-Ni@C catalysts. In contrast, when Pt/C catalyst is used, the main product is dramatically switched to BA in a selectivity of 88%. Therefore, the addition of iron and nickel into the Pt-based catalyst changes the hydrogenation selectivity of 4-CBA. The possible process of Pt-FeNi@C, Pt-Fe@C and Pt-Ni@C catalysts in the hydrogenation of 4-CBA is illustrated in Scheme 2 . The H2 dissolved in the solution should be adsorbed and activated on the Pt surface to form hydrides [44]. And the CO bond of 4-CBA could be activated on the surface of Fe [66]. Then the activated H*-H* would react with the CO bond of 4-carboxybenzaldehyde to hydrogenate 4-CBA to p-TOL [67]. As can be seen from the results of XPS, compared to Pt/C catalyst, there are strong electron interactions between Pt and Fe or Ni in Pt-FeNi@C, Pt-Fe@C and Pt-Ni@C catalysts which results in rich electron density of the surface of Pt atoms. Therefore, the higher electron density of Pt in Pt-FeNi@C, Pt-Fe@C and Pt-Ni@C catalysts inhibits the decarbonylation of 4-CBA, consequently to high selectivity of 4-HMBA [68]. Compared to Pt/C catalyst, the main chemoselectivity of Pt-FeNi@C, Pt-Fe@C and Pt-Ni@C catalysts were 4-HMBA (85%, 89% and 75%, respectively) instead of BA (Table S3). The FeNi@C, Pt-Fe@C and Pt-Ni@C catalysts showed lower activity, only 20%, 63% and 29%, respectively. Notably, when Pt-FeNi@C was used as the catalyst, the conversion of 4-CBA was 97%, is higher than Pt-Fe@C and Pt-Ni@C catalyst (Fig. 5c). These results indicated that the combination of Pt and Fe/Ni is desirable for the chemoselective transformation of 4-CBA. We also investigated the effect of Pt-FeNi@C catalysts with different Pt loadings on the hydrogenation performance of 4-CBA. As can be seen in Fig. S6, when the Pt loading is 0.66 wt%, the conversion of 4-CBA is the highest, and when the Pt loading is 0.31 wt% and 1.61 wt%, the corresponding conversion are 81% and 72%, respectively. The hydrogenation selectivity of 4-CBA is consistent for Pt-FeNi@C catalysts with different Pt loadings, and only BA and 4-HMBA are found in the products. The reaction time versus 4-CBA conversion was shown in Fig. 5c. The 4-CBA conversion over Pt-FeNi@C is greater than the sum of Pt-Fe@C and Pt-Ni@C catalysts within 60 min. For an instance, at the initial reaction time of 10 min, the 4-CBA conversion over Pt-FeNi@C is nearly 90% which is greater than that of Pt-Fe@C and Pt-Ni@C catalysts (nearly 50% and 20% respectively). The 4-CBA conversion over Pt-FeNi@C is also greater than Pt/C catalyst. The turnover frequencies (TOFs) of Pt-FeNi@C (5515 h−1) calculated on the basis of total platinum is significantly higher than that of Pt/C (2826 h−1) calculated at the 4-CBA conversion of 70%. It has also been reported that Pd-based catalyst supported on SiC (TOFs = 5436 h−1) [69], Pd on mesoporous TiO2 nanotube (TOFs = 1127 h−1) [70] are active catalysts for the hydrogenation of 4-CBA. However, the results present above clearly show that the activity of our Pt-FeNi@C catalyst is higher than that Pd-based catalysts supported on SiC and on mesoporous TiO2 nanotube. 3.3 Catalyst stability To explore the stability of the catalyst, the Pt-FeNi@C catalyst was investigated as a representative for four consecutive reactions under the same conditions. After the reaction, the catalyst was easily separated through filtrating. It was used for the next run after washing and drying. As shown in Fig. 6 a, the Pt-FeNi@C catalyst exhibited excellent stability and reusability. The conversion of 4-CBA (~97%) is almost unchanged even after 4 cycles. In the four consecutive reactions, the main product of hydrogenation is 4-HMBA (~80%), with only a small amount of BA (~20%). Compared to Pt-FeNi@C catalyst, the conversion of 4-CBA on commercial Pd/C was 92%, 90%, 73%, and 60%, respectively, for the four successive reaction runs (Fig. 6b). This indicates that the stability of commercial Pd/C catalyst is lower than that of Pt-FeNi@C catalyst. Moreover, the main hydrogenation product of commercial catalysts is BA (~93%). During the hydrogenation of 4-CBA, BA is produced at the same time will produce CO, and the Pd/C catalyst would be poisoned at the presence of CO [71]. However, the Pt-FeNi@C catalyst showed excellent CO toxicity resistance, mainly owing to the addition of Fe and Ni enhanced the CO toxicity resistance of the catalyst [72]. To further check the catalyst stability, the catalyst after four times of use was detected using ICP (Table S3). To our delight, there is no obvious loss of Pt. In addition, we compared the Pt-FeNi@C, Pt-Fe@C and Pt-Ni@C catalysts with other catalysts reported in the literature for the conversion of 4-CBA. The detailed comparison results are shown in Table 2 . The Pt-FeNi@C catalyst in this work catalyzes the largest 4-CBA with the least amount, and the conversion rate can reach 97%, which is consistent with the catalytic activity in other literatures. The BA selectivity of Pt-FeNi@C catalyst is only 15%, compared with 82% in Liu's work. These results indicate that Pt-FeNi@C catalyst has a stronger ability to inhibit decarbonylation reaction than other catalysts in the literature. Based on the above characterization results and 4-CBA hydrogenation performance of Pt-FeNi@C catalyst, the possible reasons for high activity and selectivity could be attributed to the following aspects. (a) Structure effect: the N2 adsorption–desorption isotherm and BJH pore size distribution curve indicates that Pt-FeNi@C catalyst has larger specific surface area and good mesoporous structure. It is well known that the larger specific surface area can make the active sites evenly distributed and the mesoporous structure can facilitate mass diffusion/transport. Therefore, the hydrogenation activity is enhanced. Moreover, the unique core-shell structure demonstrated by TEM, HR-TEM and EDX can avoid the aggregation and dissolution of the Pt-FeNi alloy. This is why the stability of Pt-FeNi catalyst is higher than that of Pt/C catalyst. (b) electronic effect: according to XPS results, the peak of Pt 4f in Pt-FeNi@C catalyst is positively shifted compared with pure Pt which is due to the charge from Fe and Ni to Pt. As a result, the electron density of the Pt atom increases. The enhancement of Pt electron density not only increases the selectivity of 4-HMBA but also enhances the hydrogenation activity of 4-CBA. 4 Conclusion In summary, the Pt-FeNi@C, Pt-Fe@C and Pt-Ni@C catalysts show unique electronic structure and catalytic properties for selectivity of 4-CBA in comparison with mono-metal Pt/C catalyst. Superior selectivity to 4-HMBA was achieved by Pt-FeNi@C, Pt-Fe@C and Pt-Ni@C catalyst. With dropping of Fe or Ni into Pt-based catalysts, the BA selectivity was disappeared or declined. As a result, about 88% selectivity to BA was obtained on Pt/C catalyst without dropping of Fe or Ni. Based on the detailed characterization and 4-CBA hydrogenation experiment, we found that Pt-FeNi@C catalyst showed excellent hydrogenation activity and superior selectivity due to the unique core-shell structure and fast electron transfer capability. However, the conversion of both Pt-Fe@C and Pt-Ni@C are lower than that of Pt-FeNi@C, owing to the good surface area and electron transfer capacity of Pt-FeNi@C. All the catalysts have a small degree of decarbonylation reaction during the hydrogenation process of 4-CBA, which provides important guidance for the study of PTA hydrogenation catalysts. Declaration of Competing Interest The authors declare that they have no known competing financial interests or personal relationships that could have appeared to influence the work reported in this paper. Acknowledgments This work is financially supported by the National Natural Science Foundation of China (No. 21874153, No. 21573286) and the Key scientific and technological innovation projects in Shandong Province (No. 2019JZZY010343). Appendix A Supplementary material Supplementary data to this article can be found online at https://doi.org/10.1016/j.jcat.2021.07.019. Appendix A Supplementary material The following are the Supplementary data to this article: Supplementary data 1 References [1] Z. Dong X. Le Y. Liu C. Dong J. Ma Metal organic framework derived magnetic porous carbon composite supported gold and palladium nanoparticles as highly efficient and recyclable catalysts for reduction of 4-nitrophenol and hydrodechlorination of 4-chlorophenol J. Mater. Chem. A 2 44 2014 18775 18785 Z. Dong, X. Le, Y. Liu, C. Dong, J. Ma, Metal organic framework derived magnetic porous carbon composite supported gold and palladium nanoparticles as highly efficient and recyclable catalysts for reduction of 4-nitrophenol and hydrodechlorination of 4-chlorophenol, J. Mater. Chem. A, 2 (2014) 18775-18785. [2] Q.-L. Zhu W. Xia T. Akita R. Zou Q. Xu Metal-organic framework-derived honeycomb-like open porous nanostructures as precious-metal-free catalysts for highly efficient oxygen electroreduction Adv. Mater. 28 30 2016 6391 6398 Q.L. Zhu, W. Xia, T. Akita, R. Zou, Q. Xu, Metal-Organic Framework-Derived Honeycomb-Like Open Porous Nanostructures as Precious-Metal-Free Catalysts for Highly Efficient Oxygen Electroreduction, Adv Mater, 28 (2016) 6391-6398. [3] Z. Zhang Y. Qin M. Dou J. Ji F. Wang One-step conversion from Ni/Fe polyphthalocyanine to N-doped carbon supported Ni-Fe nanoparticles for highly efficient water splitting Nano Energy 30 2016 426 433 Z. Zhang, Y. Qin, M. Dou, J. Ji, F. Wang, One-step conversion from Ni/Fe polyphthalocyanine to N-doped carbon supported Ni-Fe nanoparticles for highly efficient water splitting, Nano Energy, 30 (2016) 426-433. [4] I.A. Khan Y. Qian A. Badshah M.A. Nadeem D. Zhao Highly porous carbon derived from MOF-5 as a support of ORR electrocatalysts for fuel cells ACS Appl. Mater. Interfaces 8 27 2016 17268 17275 I.A. Khan, Y. Qian, A. Badshah, M.A. Nadeem, D. Zhao, Highly Porous Carbon Derived from MOF-5 as a Support of ORR Electrocatalysts for Fuel Cells, ACS Appl Mater Interfaces, 8 (2016) 17268-17275. [5] X. Wang X. Li C. Ouyang Z. Li S. Dou Z. Ma L.i. Tao J. Huo S. Wang Nonporous MOF-derived dopant-free mesoporous carbon as an efficient metal-free electrocatalyst for the oxygen reduction reaction J. Mater. Chem. A 4 24 2016 9370 9374 X. Wang, X. Li, C. Ouyang, Z. Li, S. Dou, Z. Ma, L. Tao, J. Huo, S. Wang, Nonporous MOF-derived dopant-free mesoporous carbon as an efficient metal-free electrocatalyst for the oxygen reduction reaction, Journal of Materials Chemistry A, 4 (2016) 9370-9374. [6] H. Xu Z.-X. Shi Y.-X. Tong G.-R. Li Porous microrod arrays constructed by carbon-confined NiCo@NiCoO2 core@shell nanoparticles as efficient electrocatalysts for oxygen evolution Adv. Mater. 30 21 2018 1705442 10.1002/adma.v30.2110.1002/adma.201705442 H. Xu, Z.X. Shi, Y.X. Tong, G.R. Li, Porous Microrod Arrays Constructed by Carbon-Confined NiCo@NiCoO2 Core@Shell Nanoparticles as Efficient Electrocatalysts for Oxygen Evolution, Adv Mater, 30 (2018) e1705442. [7] Z.-X. Cai Z.-L. Wang J. Kim Y. Yamauchi Hollow functional materials derived from metal-organic frameworks: synthetic strategies, conversion mechanisms, and electrochemical applications Adv. Mater. 31 11 2019 1804903 10.1002/adma.v31.1110.1002/adma.201804903 Z.X. Cai, Z.L. Wang, J. Kim, Y. Yamauchi, Hollow Functional Materials Derived from Metal-Organic Frameworks: Synthetic Strategies, Conversion Mechanisms, and Electrochemical Applications, Adv Mater, 31 (2019) e1804903. [8] X. Liu F. Zou K. Liu Z. Qiang C.J. Taubert P. Ustriyana B.D. Vogt Y.u. Zhu A binary metal organic framework derived hierarchical hollow Ni3S2/Co9S8/N-doped carbon composite with superior sodium storage performance J. Mater. Chem. A 5 23 2017 11781 11787 X. Liu, F. Zou, K. Liu, Z. Qiang, C.J. Taubert, P. Ustriyana, B.D. Vogt, Y. Zhu, A binary metal organic framework derived hierarchical hollow Ni3S2/Co9S8/N-doped carbon composite with superior sodium storage performance, Journal of Materials Chemistry A, 5 (2017) 11781-11787. [9] W. Xia A. Mahmood R. Zou Q. Xu Metal–organic frameworks and their derived nanostructures for electrochemical energy storage and conversion Energy Environ. Sci. 8 7 2015 1837 1866 W. Xia, A. Mahmood, R. Zou, Q. Xu, Metal–organic frameworks and their derived nanostructures for electrochemical energy storage and conversion, Energy & Environmental Science, 8 (2015) 1837-1866. [10] Y. Xiao P. Zhang X. Zhang X. Dai Y. Ma Y. Wang Y. Jiang M. Liu Y. Wang Bimetallic thin film NiCo–NiCoO2@NC as a superior bifunctional electrocatalyst for overall water splitting in alkaline media J. Mater. Chem. A 5 30 2017 15901 15912 Y. Xiao, P. Zhang, X. Zhang, X. Dai, Y. Ma, Y. Wang, Y. Jiang, M. Liu, Y. Wang, Bimetallic thin film NiCo–NiCoO2@NC as a superior bifunctional electrocatalyst for overall water splitting in alkaline media, Journal of Materials Chemistry A, 5 (2017) 15901-15912. [11] A.J. Amali H. Hoshino C. Wu M. Ando Q. Xu From metal-organic framework to intrinsically fluorescent carbon nanodots Chemistry 20 2014 8279 8282 A.J. Amali, H. Hoshino, C. Wu, M. Ando, Q. Xu, From metal-organic framework to intrinsically fluorescent carbon nanodots, Chemistry, 20 (2014) 8279-8282. [12] L. Chen J. Bai C. Wang Y. Pan M. Scheer X. You One-step solid-state thermolysis of a metal-organic framework: a simple and facile route to large-scale of multiwalled carbon nanotubes Chem. Commun. (Camb) 2008 1581 1583 L. Chen, J. Bai, C. Wang, Y. Pan, M. Scheer, X. You, One-step solid-state thermolysis of a metal-organic framework: a simple and facile route to large-scale of multiwalled carbon nanotubes, Chem Commun (Camb), (2008) 1581-1583. [13] W. Xia B. Qiu D. Xia R. Zou Facile preparation of hierarchically porous carbons from metal-organic gels and their application in energy storage Sci. Rep. 3 2013 1935 W. Xia, B. Qiu, D. Xia, R. Zou, Facile preparation of hierarchically porous carbons from metal-organic gels and their application in energy storage, Sci Rep, 3 (2013) 1935. [14] M. Huang L. Wang K.e. Pei W. You X. Yu Z. Wu R. Che Multidimension-controllable synthesis of MOF-derived Co@N-doped carbon composite with magnetic-dielectric synergy toward strong microwave absorption Small 16 14 2020 2000158 10.1002/smll.v16.1410.1002/smll.202000158 M. Huang, L. Wang, K. Pei, W. You, X. Yu, Z. Wu, R. Che, Multidimension-Controllable Synthesis of MOF-Derived Co@N-Doped Carbon Composite with Magnetic-Dielectric Synergy toward Strong Microwave Absorption, Small, 16 (2020) e2000158. [15] Y. Lin C. Kong Q. Zhang L. Chen Metal-organic frameworks for carbon dioxide capture and methane storage Adv. Energy Mater. 7 2017 1601296 Y. Lin, C. Kong, Q. Zhang, L. Chen, Metal-Organic Frameworks for Carbon Dioxide Capture and Methane Storage, Advanced Energy Materials, 7 (2017) 1601296. [16] X. Cao C. Tan M. Sindoro H. Zhang Hybrid micro-/nano-structures derived from metal-organic frameworks: preparation and applications in energy storage and conversion Chem. Soc. Rev. 46 2017 2660 2677 X. Cao, C. Tan, M. Sindoro, H. Zhang, Hybrid micro-/nano-structures derived from metal-organic frameworks: preparation and applications in energy storage and conversion, Chem Soc Rev, 46 (2017) 2660-2677. [17] G. Wang H. Xin Q. Wang P. Wu X. Li Efficient liquid-phase hydrogenation of cinnamaldehyde to cinnamyl alcohol with a robust PtFe/HPZSM-5 catalyst J. Catal. 382 2020 1 12 G. Wang, H. Xin, Q. Wang, P. Wu, X. Li, Efficient liquid-phase hydrogenation of cinnamaldehyde to cinnamyl alcohol with a robust PtFe/HPZSM-5 catalyst, Journal of Catalysis, 382 (2020) 1-12. [18] D. Chen, W. Yang, L. Jiao, L. Li, S.H. Yu, H.L. Jiang, Boosting catalysis of Pd nanoparticles in MOFs by pore wall engineering: the roles of electron transfer and adsorption energy, Adv. Mater. 32 (2020) e2000041. [19] B.M. Matsagar Z.Y. Wang C. Sakdaronnarong S.S. Chen D.C.W. Tsang K.C.W. Wu Effect of solvent, role of formic acid and Rh/C catalyst for the efficient liquefaction of lignin ChemCatChem 11 2019 4604 4616 B.M. Matsagar, Z.Y. Wang, C. Sakdaronnarong, S.S. Chen, D.C.W. Tsang, K.C.W. Wu, Effect of Solvent, Role of Formic Acid and Rh/C Catalyst for the Efficient Liquefaction of Lignin, ChemCatChem, 11 (2019) 4604-4616. [20] W. Cao W. Luo H. Ge Y. Su A. Wang T. Zhang UiO-66 derived Ru/ZrO2@C as a highly stable catalyst for hydrogenation of levulinic acid to γ-valerolactone Green Chem. 19 2017 2201 2211 W. Cao, W. Luo, H. Ge, Y. Su, A. Wang, T. Zhang, UiO-66 derived Ru/ZrO2@C as a highly stable catalyst for hydrogenation of levulinic acid to γ-valerolactone, Green Chemistry, 19 (2017) 2201-2211. [21] M. Wen K. Mori Y. Kuwahara H. Yamashita Visible-light-responsive carbon dioxide reduction system: rhenium complex intercalated into a zirconium phosphate layered matrix ChemCatChem 7 21 2015 3519 3525 M. Wen, K. Mori, Y. Kuwahara, H. Yamashita, Visible-Light-Responsive Carbon Dioxide Reduction System: Rhenium Complex Intercalated into a Zirconium Phosphate Layered Matrix, ChemCatChem, 7 (2015) 3519-3525. [22] L. Ma J.M. Falkowski C. Abney W. Lin A series of isoreticular chiral metal-organic frameworks as a tunable platform for asymmetric catalysis Nat. Chem. 2 10 2010 838 846 L. Ma, J.M. Falkowski, C. Abney, W. Lin, A series of isoreticular chiral metal-organic frameworks as a tunable platform for asymmetric catalysis, Nat Chem, 2 (2010) 838-846. [23] K. Nakatsuka T. Yoshii Y. Kuwahara K. Mori H. Yamashita Controlled pyrolysis of Ni-MOF-74 as a promising precursor for the creation of highly active Ni nanocatalysts in size-selective hydrogenation Chemistry 24 4 2018 898 905 K. Nakatsuka, T. Yoshii, Y. Kuwahara, K. Mori, H. Yamashita, Controlled Pyrolysis of Ni-MOF-74 as a Promising Precursor for the Creation of Highly Active Ni Nanocatalysts in Size-Selective Hydrogenation, Chemistry, 24 (2018) 898-905. [24] Z. Gao C. Wang J. Li Y. Zhu Z. Zhang W. Hu Conductive metal-organic frameworks for electrocatalysis: achievements challenges, and opportunities Acta Phys. Chim. Sin. 2020 2010025-12010020 Z. Gao, C. Wang, J. Li, Y. Zhu, Z. Zhang, W. Hu, Conductive Metal-Organic Frameworks for Electrocatalysis:Achievements, Challenges, and Opportunities, Acta Physico Chimica Sinica, 0 (2020) 2010025-2010020. [25] J.-R. Li Y. Tao Q. Yu X.-H. Bu H. Sakamoto S. Kitagawa Selective gas adsorption and unique structural topology of a highly stable guest-free zeolite-type MOF material with N-rich chiral open channels Chemistry 14 9 2008 2771 2776 J.R. Li, Y. Tao, Q. Yu, X.H. Bu, H. Sakamoto, S. Kitagawa, Selective gas adsorption and unique structural topology of a highly stable guest-free zeolite-type MOF material with N-rich chiral open channels, Chemistry, 14 (2008) 2771-2776. [26] A. Azhar Y. Li Z. Cai M.B. Zakaria M.K. Masud M.S.A. Hossain J. Kim W. Zhang J. Na Y. Yamauchi M. Hu Nanoarchitectonics: a new materials horizon for Prussian blue and its analogues Bull. Chem. Soc. Jpn. 92 4 2019 875 904 A. Azhar, Y. Li, Z. Cai, M.B. Zakaria, M.K. Masud, M.S.A. Hossain, J. Kim, W. Zhang, J. Na, Y. Yamauchi, M. Hu, Nanoarchitectonics: A New Materials Horizon for Prussian Blue and Its Analogues, Bulletin of the Chemical Society of Japan, 92 (2019) 875-904. [27] C. Yang Y. Zhu J. Liu Y. Qin H. Wang H. Liu Y. Chen Z. Zhang W. Hu Defect engineering for electrochemical nitrogen reduction reaction to ammonia Nano Energy 77 2020 105126 10.1016/j.nanoen.2020.105126 C. Yang, Y. Zhu, J. Liu, Y. Qin, H. Wang, H. Liu, Y. Chen, Z. Zhang, W. Hu, Defect engineering for electrochemical nitrogen reduction reaction to ammonia, Nano Energy, 77 (2020) 105126. [28] G. Centi Smart catalytic materials for energy transition SmartMat 1 1 2020 10.1002/smm2.v1.110.1002/smm2.1005 G. Centi, Smart catalytic materials for energy transition, SmartMat, 1 (2020). [29] X. Li W. Zhang Y. Liu R. Li Palladium nanoparticles immobilized on magnetic porous carbon derived from ZIF-67 as efficient catalysts for the semihydrogenation of phenylacetylene under extremely mild conditions ChemCatChem 8 6 2016 1111 1118 X. Li, W. Zhang, Y. Liu, R. Li, Palladium Nanoparticles Immobilized on Magnetic Porous Carbon Derived from ZIF-67 as Efficient Catalysts for the Semihydrogenation of Phenylacetylene under Extremely Mild Conditions, ChemCatChem, 8 (2016) 1111-1118. [30] Z. Gu L. Chen X. Li L. Chen Y. Zhang C. Duan NH2-MIL-125(Ti)-derived porous cages of titanium oxides to support Pt-Co alloys for chemoselective hydrogenation reactions Chem. Sci. 10 7 2019 2111 2117 Z. Gu, L. Chen, X. Li, L. Chen, Y. Zhang, C. Duan, NH2-MIL-125(Ti)-derived porous cages of titanium oxides to support Pt-Co alloys for chemoselective hydrogenation reactions, Chem Sci, 10 (2019) 2111-2117. [31] Y.-T. Liao J.E. Chen Y. Isida T. Yonezawa W.-C. Chang S.M. Alshehri Y. Yamauchi K.-W. Wu De novo synthesis of gold-nanoparticle-embedded, nitrogen-doped nanoporous carbon nanoparticles (Au@NC) with enhanced reduction ability ChemCatChem 8 3 2016 502 509 Y.-T. Liao, J.E. Chen, Y. Isida, T. Yonezawa, W.-C. Chang, S.M. Alshehri, Y. Yamauchi, K.C.W. Wu, De Novo Synthesis of Gold-Nanoparticle-Embedded, Nitrogen-Doped Nanoporous Carbon Nanoparticles (Au@NC) with Enhanced Reduction Ability, ChemCatChem, 8 (2016) 502-509. [32] H. Liu Q. Mei S. Li Y. Yang YanYan Wang H. Liu LiRong Zheng P. An J. Zhang B. Han Selective hydrogenation of unsaturated aldehydes over Pt nanoparticles promoted by the cooperation of steric and electronic effects Chem. Commun. (Camb) 54 8 2018 908 911 H. Liu, Q. Mei, S. Li, Y. Yang, Y. Wang, H. Liu, L. Zheng, P. An, J. Zhang, B. Han, Selective hydrogenation of unsaturated aldehydes over Pt nanoparticles promoted by the cooperation of steric and electronic effects, Chem Commun (Camb), 54 (2018) 908-911. [33] Y. Qin H. Zhuo X. Liang K. Yu Y. Wang D. Gao X. Zhang Surface-modified Pt1Ni1-Ni(OH)2 nanoparticles with abundant Pt-Ni(OH)2 interfaces enhance electrocatalytic properties Dalton Trans. 48 27 2019 10313 10319 Y. Qin, H. Zhuo, X. Liang, K. Yu, Y. Wang, D. Gao, X. Zhang, Surface-modified Pt1Ni1-Ni(OH)2 nanoparticles with abundant Pt-Ni(OH)2 interfaces enhance electrocatalytic properties, Dalton Trans, 48 (2019) 10313-10319. [34] Y. Xue R. Yao J. Li G. Wang P. Wu X. Li Efficient Pt–FeOx/TiO2@SBA-15 catalysts for selective hydrogenation of cinnamaldehyde to cinnamyl alcohol Catal. Sci. Technol. 7 24 2017 6112 6123 Y. Xue, R. Yao, J. Li, G. Wang, P. Wu, X. Li, Efficient Pt–FeOx/TiO2@SBA-15 catalysts for selective hydrogenation of cinnamaldehyde to cinnamyl alcohol, Catalysis Science & Technology, 7 (2017) 6112-6123. [35] H. Wang S. Bai Y. Pi Q.i. Shao Y. Tan X. Huang A Strongly Coupled Ultrasmall Pt3Co Nanoparticle-Ultrathin Co(OH)2 Nanosheet Architecture Enhances Selective Hydrogenation of α, β-Unsaturated Aldehydes ACS Catal. 9 1 2019 154 159 H. Wang, S. Bai, Y. Pi, Q. Shao, Y. Tan, X. Huang, A Strongly Coupled Ultrasmall Pt3Co Nanoparticle-Ultrathin Co(OH)2 Nanosheet Architecture Enhances Selective Hydrogenation of α,β-Unsaturated Aldehydes, ACS Catalysis, 9 (2018) 154-159. [36] I.Y. Skobelev A.B. Sorokin K.A. Kovalenko V.P. Fedin O.A. Kholdeeva Solvent-free allylic oxidation of alkenes with O2 mediated by Fe- and Cr-MIL-101 J. Catal. 298 2013 61 69 I.Y. Skobelev, A.B. Sorokin, K.A. Kovalenko, V.P. Fedin, O.A. Kholdeeva, Solvent-free allylic oxidation of alkenes with O2 mediated by Fe- and Cr-MIL-101, Journal of Catalysis, 298 (2013) 61-69. [37] X. Wang F.M. Wisser J. Canivet M. Fontecave C. Mellot-Draznieks Immobilization of a full photosystem in the large-pore MIL-101 metal-organic framework for CO2 reduction ChemSusChem 11 18 2018 3315 3322 X. Wang, F.M. Wisser, J. Canivet, M. Fontecave, C. Mellot-Draznieks, Immobilization of a Full Photosystem in the Large-Pore MIL-101 Metal-Organic Framework for CO2 reduction, ChemSusChem, 11 (2018) 3315-3322. [38] A. Fan C. Qin X. Zhang X. Dai Z. Dong C. Luan L. Yu J. Ge F. Gao Phosphorus-doped FeNi alloys/NiFe2O4 imbedded in carbon network hollow bipyramid as efficient electrocatalysts for oxygen evolution reaction ACS Sustainable Chem. Eng. 7 2 2019 2285 2295 A. Fan, C. Qin, X. Zhang, X. Dai, Z. Dong, C. Luan, L. Yu, J. Ge, F. Gao, Phosphorus-Doped FeNi Alloys/NiFe2O4 Imbedded in Carbon Network Hollow Bipyramid as Efficient Electrocatalysts for Oxygen Evolution Reaction, ACS Sustainable Chemistry & Engineering, 7 (2018) 2285-2295. [39] A. Fan C. Qin X. Zhang J. Yang J. Ge S. Wang X. Yuan S.u. Wang X. Dai Engineering FeNi alloy nanoparticles via synergistic ultralow Pt doping and nanocarbon capsulation for efficient hydrogen evolution J. Mater. Chem. A 7 42 2019 24347 24355 A. Fan, C. Qin, X. Zhang, J. Yang, J. Ge, S. Wang, X. Yuan, S. Wang, X. Dai, Engineering FeNi alloy nanoparticles via synergistic ultralow Pt doping and nanocarbon capsulation for efficient hydrogen evolution, Journal of Materials Chemistry A, 7 (2019) 24347-24355. [40] B.o. Ye R. Jiang Z. Yu Y. Hou J. Huang B. Zhang Y. Huang Y. Zhang R. Zhang Pt (1 1 1) quantum dot engineered Fe-MOF nanosheet arrays with porous core-shell as an electrocatalyst for efficient overall water splitting J. Catal. 380 2019 307 317 B. Ye, R. Jiang, Z. Yu, Y. Hou, J. Huang, B. Zhang, Y. Huang, Y. Zhang, R. Zhang, Pt (1 1 1) quantum dot engineered Fe-MOF nanosheet arrays with porous core-shell as an electrocatalyst for efficient overall water splitting, Journal of Catalysis, 380 (2019) 307-317. [41] C. Qin A. Fan X. Zhang X. Dai H. Sun D. Ren Z. Dong Y. Wang C. Luan J.Y. Ye S.G. Sun The in situ etching assisted synthesis of Pt-Fe-Mn ternary alloys with high-index facets as efficient catalysts for electro-oxidation reactions Nanoscale 11 2019 9061 9075 C. Qin, A. Fan, X. Zhang, X. Dai, H. Sun, D. Ren, Z. Dong, Y. Wang, C. Luan, J.Y. Ye, S.G. Sun, The in situ etching assisted synthesis of Pt-Fe-Mn ternary alloys with high-index facets as efficient catalysts for electro-oxidation reactions, Nanoscale, 11 (2019) 9061-9075. [42] J. Yao Y. Zheng X. Jia L. Duan Q. Wu C. Huang W. An Q. Xu W. Yao Highly active Pt3Sn{110}-excavated nanocube cocatalysts for photocatalytic hydrogen production ACS Appl. Mater. Interfaces 11 2019 25844 25853 J. Yao, Y. Zheng, X. Jia, L. Duan, Q. Wu, C. Huang, W. An, Q. Xu, W. Yao, Highly Active Pt3Sn{110}-Excavated Nanocube Cocatalysts for Photocatalytic Hydrogen Production, ACS Appl Mater Interfaces, 11 (2019) 25844-25853. [43] H. Xin W. Zhang X. Xiao L. Chen P. Wu X. Li Selective hydrogenation of cinnamaldehyde with Ni Fe1-Al2O4+ composite oxides supported Pt catalysts: C=O versus C=C selectivity switch by varying the Ni/Fe molar ratios J. Catal. 393 2021 126 139 H. Xin, W. Zhang, X. Xiao, L. Chen, P. Wu, X. Li, Selective hydrogenation of cinnamaldehyde with Ni Fe1-Al2O4+ composite oxides supported Pt catalysts: C=O versus C=C selectivity switch by varying the Ni/Fe molar ratios, Journal of Catalysis, 393 (2021) 126-139. [44] L. Ning M. Zhang S. Liao Y. Zhang D. Jia Y. Yan W. Gu X. Liu Differentiation of Pt−Fe and Pt−Ni3 surface catalytic mechanisms towards contrasting products in chemoselective hydrogenation of α, β-unsaturated aldehydes ChemCatChem 20 2021 704 711 L. Ning, M. Zhang, S. Liao, Y. Zhang, D. Jia, Y. Yan, W. Gu, X. Liu, Differentiation of Pt−Fe and Pt−Ni3 Surface Catalytic Mechanisms towards Contrasting Products in Chemoselective Hydrogenation of α,β‐Unsaturated Aldehydes, ChemCatChem, 20 (2021) 704-711. [45] R. Al-Jishi G. Dresselhaus Lattice-dynamical model for graphite Phys. Rev. B 26 1982 4514 4522 R. Al-Jishi, G. Dresselhaus, Lattice-dynamical model for graphite, Physical Review B, 26 (1982) 4514-4522. [46] X. Xu Y.i. Li Y. Gong P. Zhang H. Li Y. Wang Synthesis of palladium nanoparticles supported on mesoporous N-doped carbon and their catalytic ability for biofuel upgrade J. Am. Chem. Soc. 134 41 2012 16987 16990 X. Xu, Y. Li, Y. Gong, P. Zhang, H. Li, Y. Wang, Synthesis of palladium nanoparticles supported on mesoporous N-doped carbon and their catalytic ability for biofuel upgrade, J Am Chem Soc, 134 (2012) 16987-16990. [47] R. Wu D.P. Wang X. Rui B.o. Liu K. Zhou A.W.K. Law Q. Yan J. Wei Z. Chen In-situ formation of hollow hybrids composed of cobalt sulfides embedded within porous carbon polyhedra/carbon nanotubes for high-performance lithium-ion batteries Adv. Mater. 27 19 2015 3038 3044 R. Wu, D.P. Wang, X. Rui, B. Liu, K. Zhou, A.W. Law, Q. Yan, J. Wei, Z. Chen, In-situ formation of hollow hybrids composed of cobalt sulfides embedded within porous carbon polyhedra/carbon nanotubes for high-performance lithium-ion batteries, Adv Mater, 27 (2015) 3038-3044. [48] Y. Yang Z. Lin S. Gao J. Su Z. Lun G. Xia J. Chen R. Zhang Q. Chen Tuning electronic structures of nonprecious ternary alloys encapsulated in graphene layers for optimizing overall water splitting activity ACS Catal. 7 1 2017 469 479 Y. Yang, Z. Lin, S. Gao, J. Su, Z. Lun, G. Xia, J. Chen, R. Zhang, Q. Chen, Tuning Electronic Structures of Nonprecious Ternary Alloys Encapsulated in Graphene Layers for Optimizing Overall Water Splitting Activity, ACS Catalysis, 7 (2016) 469-479. [49] E. Isarain-Chávez M.D. Baró E. Pellicer J. Sort Micelle-assisted electrodeposition of highly mesoporous Fe-Pt nodular films with soft magnetic and electrocatalytic properties Nanoscale 9 45 2017 18081 18093 E. Isarain-Chavez, M.D. Baro, E. Pellicer, J. Sort, Micelle-assisted electrodeposition of highly mesoporous Fe-Pt nodular films with soft magnetic and electrocatalytic properties, Nanoscale, 9 (2017) 18081-18093. [50] C. Fan X. Jiang J. Chen X.u. Wang S. Qian C. Zhao L. Ding D. Sun Y. Tang Low-load Pt nanoclusters anchored on graphene hollow spheres for efficient hydrogen evolution Small Struct. 2 1 2021 2000017 10.1002/sstr.v2.110.1002/sstr.202000017 C. Fan, X. Jiang, J. Chen, X. Wang, S. Qian, C. Zhao, L. Ding, D. Sun, Y. Tang, Low‐Load Pt Nanoclusters Anchored on Graphene Hollow Spheres for Efficient Hydrogen Evolution, Small Structures, 2 (2021) 2000017. [51] M. Macino A.J. Barnes S.M. Althahban R. Qu E.K. Gibson D.J. Morgan S.J. Freakley N. Dimitratos C.J. Kiely X. Gao A.M. Beale D. Bethell Q. He M. Sankar G.J. Hutchings Tuning of catalytic sites in Pt/TiO2 catalysts for the chemoselective hydrogenation of 3-nitrostyrene Nat. Catal. 2 10 2019 873 881 M. Macino, A.J. Barnes, S.M. Althahban, R. Qu, E.K. Gibson, D.J. Morgan, S.J. Freakley, N. Dimitratos, C.J. Kiely, X. Gao, A.M. Beale, D. Bethell, Q. He, M. Sankar, G.J. Hutchings, Tuning of catalytic sites in Pt/TiO2 catalysts for the chemoselective hydrogenation of 3-nitrostyrene, Nature Catalysis, 2 (2019) 873-881. [52] Y. Qin W. Zhang K. Guo X. Liu J. Liu X. Liang X. Wang D. Gao LiYong Gan Y. Zhu Z. Zhang W. Hu Fine-tuning intrinsic strain in Penta-twinned Pt–Cu–Mn nanoframes boosts oxygen reduction catalysis Adv. Funct. Mater. 30 11 2020 1910107 10.1002/adfm.v30.1110.1002/adfm.201910107 Y. Qin, W. Zhang, K. Guo, X. Liu, J. Liu, X. Liang, X. Wang, D. Gao, L. Gan, Y. Zhu, Z. Zhang, W. Hu, Fine‐Tuning Intrinsic Strain in Penta‐Twinned Pt–Cu–Mn Nanoframes Boosts Oxygen Reduction Catalysis, Advanced Functional Materials, 30 (2020) 1910107. [53] J. Zhang Z. Gao S. Wang G. Wang X. Gao B. Zhang S. Xing S. Zhao Y. Qin Origin of synergistic effects in bicomponent cobalt oxide-platinum catalysts for selective hydrogenation reaction Nat. Commun. 10 2019 4166 J. Zhang, Z. Gao, S. Wang, G. Wang, X. Gao, B. Zhang, S. Xing, S. Zhao, Y. Qin, Origin of synergistic effects in bicomponent cobalt oxide-platinum catalysts for selective hydrogenation reaction, Nat Commun, 10 (2019) 4166. [54] N. Zhang Q.i. Shao P. Wang X. Zhu X. Huang Porous Pt-Ni nanowires within in situ generated metal-organic frameworks for highly chemoselective cinnamaldehyde hydrogenation Small 14 19 2018 1704318 10.1002/smll.v14.1910.1002/smll.201704318 N. Zhang, Q. Shao, P. Wang, X. Zhu, X. Huang, Porous Pt-Ni Nanowires within In Situ Generated Metal-Organic Frameworks for Highly Chemoselective Cinnamaldehyde Hydrogenation, Small, 14 (2018) e1704318. [55] Z. Li T. He D. Matsumura S. Miao A. Wu L. Liu G. Wu P. Chen Atomically dispersed Pt on the surface of Ni particles: synthesis and catalytic function in hydrogen generation from aqueous ammonia-borane ACS Catal. 7 10 2017 6762 6769 Z. Li, T. He, D. Matsumura, S. Miao, A. Wu, L. Liu, G. Wu, P. Chen, Atomically Dispersed Pt on the Surface of Ni Particles: Synthesis and Catalytic Function in Hydrogen Generation from Aqueous Ammonia–Borane, ACS Catalysis, 7 (2017) 6762-6769. [56] L. Yu T. Zhou S. Cao X. Tai L. Liu Y. Wang Suppressing the surface passivation of Pt-Mo nanowires via constructing Mo-Se coordination for boosting HER performance Nano Res. 14 2020 2659 2665 10.1007/s12274-020-3269-8 Yu L., Zhou T., Cao S., Tai X., Liu L., Wang Y., Suppressing the surface passivation of Pt-Mo nanowires via constructing Mo-Se coordination for boosting HER performance, Nano Res. 14 (2020) 2659-2665. doi:10.1007/s12274-020-3269-8 [57] Y. Wang D. Wang Y. Li A fundamental comprehension and recent progress in advanced Pt-based ORR nanocatalysts SmartMat 2 1 2021 56 75 Y. Wang, D. Wang, Y. Li, A fundamental comprehension and recent progress in advanced Pt‐based ORR nanocatalysts, SmartMat, 2 (2021) 56-75. [58] Z. Guo X. Dai Y. Yang Z. Zhang X. Zhang S. Mi K. Xu Y. Li Highly stable and active PtNiFe dandelion-like alloys for methanol electrooxidation J. Mater. Chem. A 1 42 2013 13252 10.1039/c3ta12894f Z. Guo, X. Dai, Y. Yang, Z. Zhang, X. Zhang, S. Mi, K. Xu, Y. Li, Highly stable and active PtNiFe dandelion-like alloys for methanol electrooxidation, Journal of Materials Chemistry A, 1 (2013) 13252. [59] J. Wu X. Zhang Q. Chen L. Chen Q. Liu C. Wang L. Ma One-pot hydrogenation of furfural into tetrahydrofurfuryl alcohol under ambient conditions over PtNi alloy catalyst Energy Fuels 34 2 2020 2178 2184 J. Wu, X. Zhang, Q. Chen, L. Chen, Q. Liu, C. Wang, L. Ma, One-Pot Hydrogenation of Furfural into Tetrahydrofurfuryl Alcohol under Ambient Conditions over PtNi Alloy Catalyst, Energy & Fuels, 34 (2019) 2178-2184. [60] W. Zhang H. Xin Y. Zhang X. Jin P. Wu W. Xie X. Li Bimetallic Pt-Fe catalysts supported on mesoporous TS-1 microspheres for the liquid-phase selective hydrogenation of cinnamaldehyde J. Catal. 395 2021 375 386 W. Zhang, H. Xin, Y. Zhang, X. Jin, P. Wu, W. Xie, X. Li, Bimetallic Pt-Fe catalysts supported on mesoporous TS-1 microspheres for the liquid-phase selective hydrogenation of cinnamaldehyde, Journal of Catalysis, 395 (2021) 375-386. [61] A. Halilu T.H. Ali A.Y. Atta P. Sudarsanam S.K. Bhargava S.B. Abd Hamid Highly selective hydrogenation of biomass-derived furfural into furfuryl alcohol using a novel magnetic nanoparticles catalyst Energy Fuels 30 3 2016 2216 2226 A. Halilu, T.H. Ali, A.Y. Atta, P. Sudarsanam, S.K. Bhargava, S.B. Abd Hamid, Highly Selective Hydrogenation of Biomass-Derived Furfural into Furfuryl Alcohol Using a Novel Magnetic Nanoparticles Catalyst, Energy & Fuels, 30 (2016) 2216-2226. [62] W. Yang Y. Zhu J. Li Z. Chen F. Nosheen Q. Zhang Z. Zhang Understanding the dehydrogenation mechanism over iron nanoparticles catalysts based on density functional theory Chin. Chem. Lett. 32 1 2021 286 290 W. Yang, Y. Zhu, J. Li, Z. Chen, F. Nosheen, Q. Zhang, Z. Zhang, Understanding the dehydrogenation mechanism over iron nanoparticles catalysts based on density functional theory, Chinese Chemical Letters, 32 (2021) 286-290. [63] W.S. Putro T. Kojima T. Hara N. Ichikuni S. Shimazu Selective hydrogenation of unsaturated carbonyls by Ni–Fe-based alloy catalysts Catal. Sci. Technol. 7 16 2017 3637 3646 W.S. Putro, T. Kojima, T. Hara, N. Ichikuni, S. Shimazu, Selective hydrogenation of unsaturated carbonyls by Ni–Fe-based alloy catalysts, Catalysis Science & Technology, 7 (2017) 3637-3646. [64] S. Bai L. Bu Q.i. Shao X. Zhu X. Huang Multicomponent Pt-based zigzag nanowires as selectivity controllers for selective hydrogenation reactions J. Am. Chem. Soc. 140 27 2018 8384 8387 S. Bai, L. Bu, Q. Shao, X. Zhu, X. Huang, Multicomponent Pt-Based Zigzag Nanowires as Selectivity Controllers for Selective Hydrogenation Reactions, J Am Chem Soc, 140 (2018) 8384-8387. [65] U.K. Singh M.A. Vannice Liquid-phase citral hydrogenation over SiO2-supported group VIII metals J. Catal. 199 1 2001 73 84 U.K. Singh, M.A. Vannice, Liquid-Phase Citral Hydrogenation over SiO2-Supported Group VIII Metals, Journal of Catalysis, 199 (2001) 73-84. [66] W.S. Putro T. Hara N. Ichikuni S. Shimazu Efficiently recyclable and easily separable Ni-Fe alloy catalysts for chemoselective hydrogenation of biomass-derived furfural Chem. Lett. 46 2017 149 151 W.S. Putro, T. Hara, N. Ichikuni, S. Shimazu, Efficiently Recyclable and Easily Separable Ni-Fe Alloy Catalysts for Chemoselective Hydrogenation of Biomass-derived Furfural, Chemistry Letters, 46 (2017) 149-151. [67] K. Taniya H. Jinno M. Kishida Y. Ichihashi S. Nishiyama Preparation of Sn-modified silica-coated Pt catalysts: a new PtSn bimetallic model catalyst for selective hydrogenation of crotonaldehyde J. Catal. 288 2012 84 91 K. Taniya, H. Jinno, M. Kishida, Y. Ichihashi, S. Nishiyama, Preparation of Sn-modified silica-coated Pt catalysts: A new PtSn bimetallic model catalyst for selective hydrogenation of crotonaldehyde, Journal of Catalysis, 288 (2012) 84-91. [68] X. Wang X. Liang P. Geng Q. Li Recent advances in selective hydrogenation of cinnamaldehyde over supported metal-based catalysts ACS Catal. 10 2020 2395 2412 X. Wang, X. Liang, P. Geng, Q. Li, Recent Advances in Selective Hydrogenation of Cinnamaldehyde over Supported Metal-Based Catalysts, ACS Catalysis, 10 (2020) 2395-2412. [69] X. Li X. Pan Y. Zhou X. Bao Modulation of the textures and chemical nature of C-SiC as the support of Pd for liquid phase hydrogenation Carbon 57 2013 34 41 X. Li, X. Pan, Y. Zhou, X. Bao, Modulation of the textures and chemical nature of C–SiC as the support of Pd for liquid phase hydrogenation, Carbon, 57 (2013) 34-41. [70] J. Liu W. Du Z. Li A. Yang Preparation of TiO2 nanotube supported Pd for the hydrogenation of 4-carboxy-benzaldehyde Catal. Lett. 148 2018 2472 2479 J. Liu, W. Du, Z. Li, A. Yang, Preparation of TiO2 Nanotube Supported Pd for the Hydrogenation of 4-carboxy-benzaldehyde, Catalysis Letters, 148 (2018) 2472-2479. [71] S. Tourani A.A. Safekordi M. Rashidzadeh A.M. Rashidi F. Khorasheh Hydrogenation of crude terephthalic acid by supported Pd and Pd–Sn catalysts on functionalized multiwall carbon nanotubes Chem. Eng. Res. Des. 109 2016 41 52 S. Tourani, A.A. Safekordi, M. Rashidzadeh, A.M. Rashidi, F. Khorasheh, Hydrogenation of crude terephthalic acid by supported Pd and Pd–Sn catalysts on functionalized multiwall carbon nanotubes, Chemical Engineering Research and Design, 109 (2016) 41-52. [72] D. Gao S. Li Y. Lv H. Zhuo S. Zhao L. Song S. Yang Y. Qin C. Li Q. Wei G. Chen PtNi colloidal nanoparticle clusters: tuning electronic structure and boundary density of nanocrystal subunits for enhanced electrocatalytic properties J. Catal. 376 2019 87 100 D. Gao, S. Li, Y. Lv, H. Zhuo, S. Zhao, L. Song, S. Yang, Y. Qin, C. Li, Q. Wei, G. Chen, PtNi colloidal nanoparticle clusters: Tuning electronic structure and boundary density of nanocrystal subunits for enhanced electrocatalytic properties, Journal of Catalysis, 376 (2019) 87-100. [73] K. Tie X. Pan T. Yu P. Li L. He X. Bao A highly active and stable Pd/B-doped carbon catalyst for the hydrogenation of 4-carboxybenzaldehyde J. Energy Chem. 31 2019 154 158 K. Tie, X. Pan, T. Yu, P. Li, L. He, X. Bao, A highly active and stable Pd/B-doped carbon catalyst for the hydrogenation of 4-carboxybenzaldehyde, Journal of Energy Chemistry, 31 (2019) 154-158. [74] Y. Kan K. Li J.Y. Wang L. Lin C.Y. Zeng Preparation and characterization of TiO2 support for Pd catalysts: application in hydrogenation of 4-carboxybenzaldehyde Adv. Mater. Res. 361–363 2011 584 592 Y. Kan, K. Li, J.Y. Wang, L. Lin, C.Y. Zeng, Preparation and Characterization of TiO2 Support for Pd Catalysts: Application in Hydrogenation of 4-Carboxybenzaldehyde, Advanced Materials Research, 361-363 (2011) 584-592. [75] F. Xiao Y. Li Y. Ren X. Shen Y. Liu H. Yang Preparation of Pd/C nanocatalyst for hydropurification of terephthalic acid from aqueous colloid solution Colloids Surf., A 504 2016 234 241 F. Xiao, Y. Li, Y. Ren, X. Shen, Y. Liu, H. Yang, Preparation of Pd/C nanocatalyst for hydropurification of terephthalic acid from aqueous colloid solution, Colloids and Surfaces A: Physicochemical and Engineering Aspects, 504 (2016) 234-241. [76] S. Tourani F. Khorasheh A.M. Rashidi A.A. Safekordi Hydro-purification of crude terephthalic acid using palladium catalyst supported on multi-wall carbon nanotubes J. Ind. Eng. Chem. 28 2015 202 210 S. Tourani, F. Khorasheh, A.M. Rashidi, A.A. Safekordi, Hydro-purification of crude terephthalic acid using palladium catalyst supported on multi-wall carbon nanotubes, Journal of Industrial and Engineering Chemistry, 28 (2015) 202-210.",
      "scopus-id": "85111970857",
      "coredata": {
        "eid": "1-s2.0-S0021951721002840",
        "dc:description": "The design of efficient nanostructured catalysts is highly desirable for promoting the hydrogenation of 4-carboxybenzaldehyde (4-CBA), which are the key process of hydrorefining of crude terephthalic acid (CTA) to pure terephthalic acid (PTA). Herein, the Pt-FeNi@C, Pt-Fe@C and Pt-Ni@C catalysts were developed and proved to be active for the selective hydrogenation of 4-CBA. As a result, the excellent 4-hydroxymethylbenzoic acid (4-HMBA) selectivity (85%) and benzoic acid (BA) selectivity (88%) were achieved on Pt-FeNi@C and Pt/C, respectively. In comparison with the commercial Pd/C catalyst, the Pt-FeNi@C catalyst exhibits excellent activity (97%) and reduces the occurrence of decarbonylation. Moreover, the Pt-FeNi@C catalyst exhibits excellent recyclability: the catalytic activity did not decrease significantly after four reaction cycles. In combination with detailed characterization, the Pt-FeNi@C catalyst has porous graphene core-shell architecture and remarkable electron transfer capacity. This work may provide some inspirations for the exploration of new PTA hydrofining catalysts.",
        "openArchiveArticle": "false",
        "prism:coverDate": "2021-09-30",
        "openaccessUserLicense": null,
        "prism:aggregationType": "Journal",
        "prism:url": "https://api.elsevier.com/content/article/pii/S0021951721002840",
        "dc:creator": [
          {
            "@_fa": "true",
            "$": "Fang, Xu"
          },
          {
            "@_fa": "true",
            "$": "Fan, Aixin"
          },
          {
            "@_fa": "true",
            "$": "Wang, Zhen"
          },
          {
            "@_fa": "true",
            "$": "Wang, Yao"
          },
          {
            "@_fa": "true",
            "$": "Li, Yunrui"
          },
          {
            "@_fa": "true",
            "$": "Li, Shuna"
          },
          {
            "@_fa": "true",
            "$": "Wang, Yinghao"
          },
          {
            "@_fa": "true",
            "$": "Dong, Chenglong"
          },
          {
            "@_fa": "true",
            "$": "Sun, Haixiao"
          },
          {
            "@_fa": "true",
            "$": "Liu, Yuanyuan"
          },
          {
            "@_fa": "true",
            "$": "Zhang, Xin"
          },
          {
            "@_fa": "true",
            "$": "Han, Yehua"
          },
          {
            "@_fa": "true",
            "$": "Dai, Xiaoping"
          }
        ],
        "link": [
          {
            "@_fa": "true",
            "@rel": "self",
            "@href": "https://api.elsevier.com/content/article/pii/S0021951721002840"
          },
          {
            "@_fa": "true",
            "@rel": "scidir",
            "@href": "https://www.sciencedirect.com/science/article/pii/S0021951721002840"
          }
        ],
        "dc:format": "application/json",
        "openaccessType": null,
        "pii": "S0021-9517(21)00284-0",
        "prism:volume": "401",
        "prism:publisher": "Elsevier Inc.",
        "dc:title": "Multicomponent Pt-based catalyst for highly efficient chemoselective hydrogenation of 4-carboxybenzaldehyde",
        "prism:copyright": "© 2021 Elsevier Inc. All rights reserved.",
        "openaccess": "0",
        "prism:issn": "00219517",
        "dcterms:subject": [
          {
            "@_fa": "true",
            "$": "Pt"
          },
          {
            "@_fa": "true",
            "$": "4-Carboxybenzaldehyde"
          },
          {
            "@_fa": "true",
            "$": "Hydrogenation"
          },
          {
            "@_fa": "true",
            "$": "Metals@carbon"
          },
          {
            "@_fa": "true",
            "$": "MOF-derived"
          }
        ],
        "openaccessArticle": "false",
        "prism:publicationName": "Journal of Catalysis",
        "openaccessSponsorType": null,
        "prism:pageRange": "174-182",
        "prism:endingPage": "182",
        "pubType": "fla",
        "prism:coverDisplayDate": "September 2021",
        "prism:doi": "10.1016/j.jcat.2021.07.019",
        "prism:startingPage": "174",
        "dc:identifier": "doi:10.1016/j.jcat.2021.07.019",
        "openaccessSponsorName": null
      },
      "objects": {
        "object": [
          {
            "@category": "standard",
            "@height": "200",
            "@width": "397",
            "@_fa": "true",
            "$": "https://api.elsevier.com/content/object/eid/1-s2.0-S0021951721002840-ga1.jpg?httpAccept=%2A%2F%2A",
            "@multimediatype": "JPEG image file",
            "@type": "IMAGE-DOWNSAMPLED",
            "@size": "22125",
            "@ref": "ga1",
            "@mimetype": "image/jpeg"
          },
          {
            "@category": "standard",
            "@height": "255",
            "@width": "311",
            "@_fa": "true",
            "$": "https://api.elsevier.com/content/object/eid/1-s2.0-S0021951721002840-gr1.jpg?httpAccept=%2A%2F%2A",
            "@multimediatype": "JPEG image file",
            "@type": "IMAGE-DOWNSAMPLED",
            "@size": "27940",
            "@ref": "gr1",
            "@mimetype": "image/jpeg"
          },
          {
            "@category": "standard",
            "@height": "444",
            "@width": "711",
            "@_fa": "true",
            "$": "https://api.elsevier.com/content/object/eid/1-s2.0-S0021951721002840-gr2.jpg?httpAccept=%2A%2F%2A",
            "@multimediatype": "JPEG image file",
            "@type": "IMAGE-DOWNSAMPLED",
            "@size": "140105",
            "@ref": "gr2",
            "@mimetype": "image/jpeg"
          },
          {
            "@category": "standard",
            "@height": "191",
            "@width": "711",
            "@_fa": "true",
            "$": "https://api.elsevier.com/content/object/eid/1-s2.0-S0021951721002840-gr3.jpg?httpAccept=%2A%2F%2A",
            "@multimediatype": "JPEG image file",
            "@type": "IMAGE-DOWNSAMPLED",
            "@size": "36951",
            "@ref": "gr3",
            "@mimetype": "image/jpeg"
          },
          {
            "@category": "standard",
            "@height": "458",
            "@width": "542",
            "@_fa": "true",
            "$": "https://api.elsevier.com/content/object/eid/1-s2.0-S0021951721002840-gr4.jpg?httpAccept=%2A%2F%2A",
            "@multimediatype": "JPEG image file",
            "@type": "IMAGE-DOWNSAMPLED",
            "@size": "78332",
            "@ref": "gr4",
            "@mimetype": "image/jpeg"
          },
          {
            "@category": "standard",
            "@height": "468",
            "@width": "711",
            "@_fa": "true",
            "$": "https://api.elsevier.com/content/object/eid/1-s2.0-S0021951721002840-gr5.jpg?httpAccept=%2A%2F%2A",
            "@multimediatype": "JPEG image file",
            "@type": "IMAGE-DOWNSAMPLED",
            "@size": "76916",
            "@ref": "gr5",
            "@mimetype": "image/jpeg"
          },
          {
            "@category": "standard",
            "@height": "237",
            "@width": "622",
            "@_fa": "true",
            "$": "https://api.elsevier.com/content/object/eid/1-s2.0-S0021951721002840-gr6.jpg?httpAccept=%2A%2F%2A",
            "@multimediatype": "JPEG image file",
            "@type": "IMAGE-DOWNSAMPLED",
            "@size": "36595",
            "@ref": "gr6",
            "@mimetype": "image/jpeg"
          },
          {
            "@category": "standard",
            "@height": "282",
            "@width": "542",
            "@_fa": "true",
            "$": "https://api.elsevier.com/content/object/eid/1-s2.0-S0021951721002840-gr7.jpg?httpAccept=%2A%2F%2A",
            "@multimediatype": "JPEG image file",
            "@type": "IMAGE-DOWNSAMPLED",
            "@size": "36712",
            "@ref": "gr7",
            "@mimetype": "image/jpeg"
          },
          {
            "@category": "standard",
            "@height": "333",
            "@width": "542",
            "@_fa": "true",
            "$": "https://api.elsevier.com/content/object/eid/1-s2.0-S0021951721002840-gr8.jpg?httpAccept=%2A%2F%2A",
            "@multimediatype": "JPEG image file",
            "@type": "IMAGE-DOWNSAMPLED",
            "@size": "41841",
            "@ref": "gr8",
            "@mimetype": "image/jpeg"
          },
          {
            "@category": "thumbnail",
            "@height": "110",
            "@width": "219",
            "@_fa": "true",
            "$": "https://api.elsevier.com/content/object/eid/1-s2.0-S0021951721002840-ga1.sml?httpAccept=%2A%2F%2A",
            "@multimediatype": "GIF image file",
            "@type": "IMAGE-THUMBNAIL",
            "@size": "9109",
            "@ref": "ga1",
            "@mimetype": "image/gif"
          },
          {
            "@category": "thumbnail",
            "@height": "164",
            "@width": "200",
            "@_fa": "true",
            "$": "https://api.elsevier.com/content/object/eid/1-s2.0-S0021951721002840-gr1.sml?httpAccept=%2A%2F%2A",
            "@multimediatype": "GIF image file",
            "@type": "IMAGE-THUMBNAIL",
            "@size": "9070",
            "@ref": "gr1",
            "@mimetype": "image/gif"
          },
          {
            "@category": "thumbnail",
            "@height": "137",
            "@width": "219",
            "@_fa": "true",
            "$": "https://api.elsevier.com/content/object/eid/1-s2.0-S0021951721002840-gr2.sml?httpAccept=%2A%2F%2A",
            "@multimediatype": "GIF image file",
            "@type": "IMAGE-THUMBNAIL",
            "@size": "24496",
            "@ref": "gr2",
            "@mimetype": "image/gif"
          },
          {
            "@category": "thumbnail",
            "@height": "59",
            "@width": "219",
            "@_fa": "true",
            "$": "https://api.elsevier.com/content/object/eid/1-s2.0-S0021951721002840-gr3.sml?httpAccept=%2A%2F%2A",
            "@multimediatype": "GIF image file",
            "@type": "IMAGE-THUMBNAIL",
            "@size": "4067",
            "@ref": "gr3",
            "@mimetype": "image/gif"
          },
          {
            "@category": "thumbnail",
            "@height": "164",
            "@width": "194",
            "@_fa": "true",
            "$": "https://api.elsevier.com/content/object/eid/1-s2.0-S0021951721002840-gr4.sml?httpAccept=%2A%2F%2A",
            "@multimediatype": "GIF image file",
            "@type": "IMAGE-THUMBNAIL",
            "@size": "11035",
            "@ref": "gr4",
            "@mimetype": "image/gif"
          },
          {
            "@category": "thumbnail",
            "@height": "144",
            "@width": "219",
            "@_fa": "true",
            "$": "https://api.elsevier.com/content/object/eid/1-s2.0-S0021951721002840-gr5.sml?httpAccept=%2A%2F%2A",
            "@multimediatype": "GIF image file",
            "@type": "IMAGE-THUMBNAIL",
            "@size": "8720",
            "@ref": "gr5",
            "@mimetype": "image/gif"
          },
          {
            "@category": "thumbnail",
            "@height": "84",
            "@width": "219",
            "@_fa": "true",
            "$": "https://api.elsevier.com/content/object/eid/1-s2.0-S0021951721002840-gr6.sml?httpAccept=%2A%2F%2A",
            "@multimediatype": "GIF image file",
            "@type": "IMAGE-THUMBNAIL",
            "@size": "5254",
            "@ref": "gr6",
            "@mimetype": "image/gif"
          },
          {
            "@category": "thumbnail",
            "@height": "114",
            "@width": "219",
            "@_fa": "true",
            "$": "https://api.elsevier.com/content/object/eid/1-s2.0-S0021951721002840-gr7.sml?httpAccept=%2A%2F%2A",
            "@multimediatype": "GIF image file",
            "@type": "IMAGE-THUMBNAIL",
            "@size": "9336",
            "@ref": "gr7",
            "@mimetype": "image/gif"
          },
          {
            "@category": "thumbnail",
            "@height": "134",
            "@width": "219",
            "@_fa": "true",
            "$": "https://api.elsevier.com/content/object/eid/1-s2.0-S0021951721002840-gr8.sml?httpAccept=%2A%2F%2A",
            "@multimediatype": "GIF image file",
            "@type": "IMAGE-THUMBNAIL",
            "@size": "9673",
            "@ref": "gr8",
            "@mimetype": "image/gif"
          },
          {
            "@category": "high",
            "@height": "531",
            "@width": "1056",
            "@_fa": "true",
            "$": "https://api.elsevier.com/content/object/eid/1-s2.0-S0021951721002840-ga1_lrg.jpg?httpAccept=%2A%2F%2A",
            "@multimediatype": "JPEG image file",
            "@type": "IMAGE-HIGH-RES",
            "@size": "68074",
            "@ref": "ga1",
            "@mimetype": "image/jpeg"
          },
          {
            "@category": "high",
            "@height": "1129",
            "@width": "1378",
            "@_fa": "true",
            "$": "https://api.elsevier.com/content/object/eid/1-s2.0-S0021951721002840-gr1_lrg.jpg?httpAccept=%2A%2F%2A",
            "@multimediatype": "JPEG image file",
            "@type": "IMAGE-HIGH-RES",
            "@size": "152055",
            "@ref": "gr1",
            "@mimetype": "image/jpeg"
          },
          {
            "@category": "high",
            "@height": "1966",
            "@width": "3149",
            "@_fa": "true",
            "$": "https://api.elsevier.com/content/object/eid/1-s2.0-S0021951721002840-gr2_lrg.jpg?httpAccept=%2A%2F%2A",
            "@multimediatype": "JPEG image file",
            "@type": "IMAGE-HIGH-RES",
            "@size": "944223",
            "@ref": "gr2",
            "@mimetype": "image/jpeg"
          },
          {
            "@category": "high",
            "@height": "845",
            "@width": "3149",
            "@_fa": "true",
            "$": "https://api.elsevier.com/content/object/eid/1-s2.0-S0021951721002840-gr3_lrg.jpg?httpAccept=%2A%2F%2A",
            "@multimediatype": "JPEG image file",
            "@type": "IMAGE-HIGH-RES",
            "@size": "220096",
            "@ref": "gr3",
            "@mimetype": "image/jpeg"
          },
          {
            "@category": "high",
            "@height": "2028",
            "@width": "2402",
            "@_fa": "true",
            "$": "https://api.elsevier.com/content/object/eid/1-s2.0-S0021951721002840-gr4_lrg.jpg?httpAccept=%2A%2F%2A",
            "@multimediatype": "JPEG image file",
            "@type": "IMAGE-HIGH-RES",
            "@size": "487455",
            "@ref": "gr4",
            "@mimetype": "image/jpeg"
          },
          {
            "@category": "high",
            "@height": "2074",
            "@width": "3150",
            "@_fa": "true",
            "$": "https://api.elsevier.com/content/object/eid/1-s2.0-S0021951721002840-gr5_lrg.jpg?httpAccept=%2A%2F%2A",
            "@multimediatype": "JPEG image file",
            "@type": "IMAGE-HIGH-RES",
            "@size": "404802",
            "@ref": "gr5",
            "@mimetype": "image/jpeg"
          },
          {
            "@category": "high",
            "@height": "1052",
            "@width": "2756",
            "@_fa": "true",
            "$": "https://api.elsevier.com/content/object/eid/1-s2.0-S0021951721002840-gr6_lrg.jpg?httpAccept=%2A%2F%2A",
            "@multimediatype": "JPEG image file",
            "@type": "IMAGE-HIGH-RES",
            "@size": "205382",
            "@ref": "gr6",
            "@mimetype": "image/jpeg"
          },
          {
            "@category": "high",
            "@height": "1251",
            "@width": "2402",
            "@_fa": "true",
            "$": "https://api.elsevier.com/content/object/eid/1-s2.0-S0021951721002840-gr7_lrg.jpg?httpAccept=%2A%2F%2A",
            "@multimediatype": "JPEG image file",
            "@type": "IMAGE-HIGH-RES",
            "@size": "190365",
            "@ref": "gr7",
            "@mimetype": "image/jpeg"
          },
          {
            "@category": "high",
            "@height": "1474",
            "@width": "2402",
            "@_fa": "true",
            "$": "https://api.elsevier.com/content/object/eid/1-s2.0-S0021951721002840-gr8_lrg.jpg?httpAccept=%2A%2F%2A",
            "@multimediatype": "JPEG image file",
            "@type": "IMAGE-HIGH-RES",
            "@size": "216020",
            "@ref": "gr8",
            "@mimetype": "image/jpeg"
          },
          {
            "@category": "standard",
            "@_fa": "true",
            "$": "https://api.elsevier.com/content/object/eid/1-s2.0-S0021951721002840-mmc1.docx?httpAccept=%2A%2F%2A",
            "@multimediatype": "Microsoft Word file",
            "@type": "APPLICATION",
            "@size": "3333444",
            "@ref": "mmc1",
            "@mimetype": "application/word"
          },
          {
            "@category": "thumbnail",
            "@_fa": "true",
            "$": "https://api.elsevier.com/content/object/eid/1-s2.0-S0021951721002840-si1.svg?httpAccept=%2A%2F%2A",
            "@multimediatype": "Scalable Vector Graphics file",
            "@type": "ALTIMG",
            "@size": "31298",
            "@ref": "si1",
            "@mimetype": "image/svg+xml"
          },
          {
            "@category": "thumbnail",
            "@_fa": "true",
            "$": "https://api.elsevier.com/content/object/eid/1-s2.0-S0021951721002840-si2.svg?httpAccept=%2A%2F%2A",
            "@multimediatype": "Scalable Vector Graphics file",
            "@type": "ALTIMG",
            "@size": "38764",
            "@ref": "si2",
            "@mimetype": "image/svg+xml"
          },
          {
            "@category": "standard",
            "@_fa": "true",
            "$": "https://api.elsevier.com/content/object/eid/1-s2.0-S0021951721002840-am.pdf?httpAccept=%2A%2F%2A",
            "@multimediatype": "Acrobat PDF file",
            "@type": "AAM-PDF",
            "@size": "1667486",
            "@ref": "am",
            "@mimetype": "application/pdf"
          }
        ]
      },
      "link": {
        "@rel": "abstract",
        "@href": "https://api.elsevier.com/content/abstract/scopus_id/85111970857"
      }
    }
  }
}