{
  "metadata": {
    "title": "TiO<ce:inf loc=post>2</ce:inf>/MXene Ti<ce:inf loc=post>3</ce:inf>C<ce:inf loc=post>2</ce:inf> composite with excellent photocatalytic CO<ce:inf loc=post>2</ce:inf> reduction activity",
    "authors": "; ; ",
    "journal": "Journal of Catalysis",
    "date": "2018-05-31",
    "doi": "10.1016/j.jcat.2018.03.009",
    "abstract": "",
    "uri": "https://api.elsevier.com/content/article/pii/S002195171830109X",
    "pii": "S002195171830109X"
  },
  "fulltext": {
    "full-text-retrieval-response": {
      "scopus-eid": "2-s2.0-85044442673",
      "originalText": "serial JL 272561 291210 291744 291809 31 Journal of Catalysis JOURNALCATALYSIS 2018-03-26 2018-03-26 2018-03-26 2018-03-26 2020-11-09T08:43:21 1-s2.0-S002195171830109X S0021-9517(18)30109-X S002195171830109X 10.1016/j.jcat.2018.03.009 S300 S300.4 FULL-TEXT 1-s2.0-S0021951718X00049 2022-11-16T08:52:33.224264Z 0 0 20180501 20180531 2018 2018-03-27T00:34:16.837073Z absattachment articleinfo articletitlenorm authfirstinitialnorm authfirstsurnamenorm cid cids contenttype copyright crossmark dateloaded dateloadedtxt datesearch datesort dateupdated dco docsubtype doctype doi eid ewtransactionid hubeid indexeddate issn issnnorm itemstage itemtransactionid itemweight openaccess openarchive pg pgfirst pglast pii piinorm pubdateend pubdatestart pubdatetxt pubyr sectiontitle sortorder srctitle srctitlenorm srctype ssids alllist content subj subheadings suppl tomb volfirst volissue volumelist webpdf webpdfpagecount yearnav figure table e-component body mmlmath acknowledge affil appendices articletitle auth authfirstini authfull authkeywords authlast grantnumber grantsponsor grantsponsorid highlightsabst primabst ref specialabst 0021-9517 00219517 true 361 361 C Volume 361 29 255 266 255 266 201805 May 2018 2018-05-01 2018-05-31 2018 Regular Articles article fla © 2018 Elsevier Inc. All rights reserved. TIO2MXENETI3C2COMPOSITEEXCELLENTPHOTOCATALYTICCO2REDUCTIONACTIVITY LOW J 1 Introduction 2 Experimental details 2.1 Sample preparation 2.1.1 Materials 2.1.2 Preparation of Ti3C2 2.1.3 Preparation of TiO2/Ti3C2 composite 2.2 Characterization 2.3 Electrochemical measurement and photocatalytic performance test 2.4 Material simulation 3 Results and discussion 3.1 Phase structures 3.2 Morphology 3.3 Optical property 3.4 Surface composition 3.5 Physical and electrochemical properties 3.6 Material simulations 3.7 Photocatalytic performance 4 Conclusion Appendix A Supplementary material References LOW 2017 1601694 J ZHANG 2017 14542 X OHKUBO 2016 278 289 K YE 2016 281 290 L NGUYEN 2017 67 74 T YU 2017 693 704 W JIN 2015 5262 5271 J XU 2015 7950 7953 Q MA 2017 1956 1969 Y YU 2015 19936 19947 W QI 2017 1936 1955 K CHANG 2016 2177 2196 X LOW 2017 658 686 J TAHIR 2016 244 252 M ZHANG 2017 452 465 H CAO 2017 208 217 S MARSZEWSKI 2015 261 278 M NIKOKAVOURA 2017 149 174 A HE 2016 416 427 Z LI 2017 184 193 J TAHIR 2016 46 55 M ZHU 2017 175 183 B DI 2017 532 541 T XIONG 2017 695 703 Z BERA 2016 55 63 S YANG 2017 472 480 Z PHAM 2017 87 95 T PAULINO 2016 362 370 P WANG 2016 47 52 M AKPLE 2016 442 449 M LOW 2018 423 432 J LOW 2015 4244 4251 J KAWAMURA 2017 39 52 S KAR 2016 3478 3493 P BONACCORSO 2015 1246501 F ZHANG 2015 10307 10377 N FU 2017 1603938 J NAGUIB 2011 4248 4253 M BERDIYOROV 2017 725 730 G NAGUIB 2014 992 1005 M NAGUIB 2012 1322 1331 M GHIDIU 2014 78 82 M TANG 2013 1244 1315 Q LIU 2017 781 789 F RAN 2017 13907 J GHASSEMI 2014 14339 14343 H MASHTALIR 2013 1716 O SUN 2014 80 83 D SEGALL 2002 2717 2744 M PERDEW 1996 3865 3868 J GRIMME 2004 1463 1473 S ZHAO 2015 7870 7876 X ZHU 2016 A785 A791 J HAN 2016 21011 21019 M HU 2016 11344 11350 M YANG 2017 859 865 Y YU 2014 3407 3416 J YU 2014 8839 8842 J SHAH 2017 400 403 S HALIM 2016 406 417 J KERBER 1998 329 333 S CHASTAIN 1992 J HANDBOOKXRAYPHOTOELECTRONSPECTROSCOPYAREFERENCEBOOKSTANDARDSPECTRAFORIDENTIFICATIONINTERPRETATIONXPSDATA LOW 2014 1111 1120 J WANG 2015 44 52 K ZHOU 2011 3594 3601 Y WANG 2015 9491 9501 T MANZANARES 2014 57 62 M TU 2015 14232 14236 W LIU 2015 8166 8175 S WANG 2017 5020 5029 W XIA 2017 3230 3238 P LOWX2018X255 LOWX2018X255X266 LOWX2018X255XJ LOWX2018X255X266XJ 2020-03-26T00:00:00.000Z http://creativecommons.org/licenses/by-nc-nd/4.0/ © 2018 Elsevier Inc. All rights reserved. 2022-11-16T08:51:27.977Z http://vtw.elsevier.com/data/voc/AddOnTypes/50.7/aggregated-refined SKLWUT 2016-KF-17 2017-KF-15 2017-ZD-4 NSFC 21433007 21573170 51320105001 U1705251 NSFC National Natural Science Foundation of China http://data.elsevier.com/vocabulary/SciValFunders/501100001809 http://sws.geonames.org/1814991/ Natural Science Foundation of Hubei Province of China 2015CFA001 Natural Science Foundation of Hubei Province http://data.elsevier.com/vocabulary/SciValFunders/501100003819 http://sws.geonames.org/1814991/ This work was supported by NSFC ( 21573170 , 51320105001 , 21433007 and U1705251 ), Self-determined and Innovative Research Funds of SKLWUT (2017-ZD-4, 2016-KF-17 and 2017-KF-15) and the Natural Science Foundation of Hubei Province of China (No. 2015CFA001 ). item S0021-9517(18)30109-X S002195171830109X 1-s2.0-S002195171830109X 10.1016/j.jcat.2018.03.009 272561 2020-11-09T08:57:28.473895Z 2018-05-01 2018-05-31 1-s2.0-S002195171830109X-main.pdf https://s3-eu-west-1.amazonaws.com/prod-ucs-content-store-eu-west/content/pii:S002195171830109X/MAIN/application/pdf/5902d763909e40524f025515e704d0c4/main.pdf main.pdf pdf true 4877956 MAIN 12 1-s2.0-S002195171830109X-main_1.png https://s3-eu-west-1.amazonaws.com/prod-ucs-content-store-eu-west/content/pii:S002195171830109X/PREVIEW/image/png/1e7259423c245b165376f74d7636f435/main_1.png main_1.png png 59695 849 656 IMAGE-WEB-PDF 1 1-s2.0-S002195171830109X-fx1.jpg https://s3-eu-west-1.amazonaws.com/prod-ucs-content-store-eu-west/content/pii:S002195171830109X/fx1/DOWNSAMPLED/image/jpeg/db8730a86978d3573a804d973af1bf98/fx1.jpg fx1 true fx1.jpg jpg 33001 200 325 IMAGE-DOWNSAMPLED 1-s2.0-S002195171830109X-gr1.jpg https://s3-eu-west-1.amazonaws.com/prod-ucs-content-store-eu-west/content/pii:S002195171830109X/gr1/DOWNSAMPLED/image/jpeg/c19880940078ad30d20818fd8457eb96/gr1.jpg gr1 gr1.jpg jpg 61361 506 316 IMAGE-DOWNSAMPLED 1-s2.0-S002195171830109X-gr10.jpg https://s3-eu-west-1.amazonaws.com/prod-ucs-content-store-eu-west/content/pii:S002195171830109X/gr10/DOWNSAMPLED/image/jpeg/92644a0ebe2fbe04fa88552e103f59bf/gr10.jpg gr10 gr10.jpg jpg 23471 291 366 IMAGE-DOWNSAMPLED 1-s2.0-S002195171830109X-gr11.jpg https://s3-eu-west-1.amazonaws.com/prod-ucs-content-store-eu-west/content/pii:S002195171830109X/gr11/DOWNSAMPLED/image/jpeg/0ab4a7cfd2c3364068308bc95e7661da/gr11.jpg gr11 gr11.jpg jpg 12936 323 311 IMAGE-DOWNSAMPLED 1-s2.0-S002195171830109X-gr12.jpg https://s3-eu-west-1.amazonaws.com/prod-ucs-content-store-eu-west/content/pii:S002195171830109X/gr12/DOWNSAMPLED/image/jpeg/c859c94b009c30f92765e5d04527073a/gr12.jpg gr12 gr12.jpg jpg 35730 264 719 IMAGE-DOWNSAMPLED 1-s2.0-S002195171830109X-gr13.jpg https://s3-eu-west-1.amazonaws.com/prod-ucs-content-store-eu-west/content/pii:S002195171830109X/gr13/DOWNSAMPLED/image/jpeg/f685d42297b85076c0c3378b06b59b00/gr13.jpg gr13 gr13.jpg jpg 49633 272 365 IMAGE-DOWNSAMPLED 1-s2.0-S002195171830109X-gr14.jpg https://s3-eu-west-1.amazonaws.com/prod-ucs-content-store-eu-west/content/pii:S002195171830109X/gr14/DOWNSAMPLED/image/jpeg/98ffe53bef6cf275750186abaca720ed/gr14.jpg gr14 gr14.jpg jpg 71170 300 542 IMAGE-DOWNSAMPLED 1-s2.0-S002195171830109X-gr2.jpg https://s3-eu-west-1.amazonaws.com/prod-ucs-content-store-eu-west/content/pii:S002195171830109X/gr2/DOWNSAMPLED/image/jpeg/4ea041fc66f350cd7a1eae1394397a23/gr2.jpg gr2 gr2.jpg jpg 29854 285 363 IMAGE-DOWNSAMPLED 1-s2.0-S002195171830109X-gr3.jpg https://s3-eu-west-1.amazonaws.com/prod-ucs-content-store-eu-west/content/pii:S002195171830109X/gr3/DOWNSAMPLED/image/jpeg/28d393c6026b3d8f4506acd71b09ffdf/gr3.jpg gr3 gr3.jpg jpg 172260 701 542 IMAGE-DOWNSAMPLED 1-s2.0-S002195171830109X-gr4.jpg https://s3-eu-west-1.amazonaws.com/prod-ucs-content-store-eu-west/content/pii:S002195171830109X/gr4/DOWNSAMPLED/image/jpeg/d941f84a0b2f409e541a71cf2abcd620/gr4.jpg gr4 gr4.jpg jpg 64676 236 587 IMAGE-DOWNSAMPLED 1-s2.0-S002195171830109X-gr5.jpg https://s3-eu-west-1.amazonaws.com/prod-ucs-content-store-eu-west/content/pii:S002195171830109X/gr5/DOWNSAMPLED/image/jpeg/41183f556f3ad5203a171960e0322b83/gr5.jpg gr5 gr5.jpg jpg 23248 263 320 IMAGE-DOWNSAMPLED 1-s2.0-S002195171830109X-gr6.jpg https://s3-eu-west-1.amazonaws.com/prod-ucs-content-store-eu-west/content/pii:S002195171830109X/gr6/DOWNSAMPLED/image/jpeg/6a9a3116a53104564108e7832dc83cab/gr6.jpg gr6 gr6.jpg jpg 143924 573 711 IMAGE-DOWNSAMPLED 1-s2.0-S002195171830109X-gr7.jpg https://s3-eu-west-1.amazonaws.com/prod-ucs-content-store-eu-west/content/pii:S002195171830109X/gr7/DOWNSAMPLED/image/jpeg/336b32b989e20490f61101f3769c7cd1/gr7.jpg gr7 gr7.jpg jpg 43751 284 367 IMAGE-DOWNSAMPLED 1-s2.0-S002195171830109X-gr8.jpg https://s3-eu-west-1.amazonaws.com/prod-ucs-content-store-eu-west/content/pii:S002195171830109X/gr8/DOWNSAMPLED/image/jpeg/d87d0977abe577fd1079b2e0b5016dc8/gr8.jpg gr8 gr8.jpg jpg 53042 280 643 IMAGE-DOWNSAMPLED 1-s2.0-S002195171830109X-gr9.jpg https://s3-eu-west-1.amazonaws.com/prod-ucs-content-store-eu-west/content/pii:S002195171830109X/gr9/DOWNSAMPLED/image/jpeg/05f3c3931cd5aac4eee28a1a12269683/gr9.jpg gr9 gr9.jpg jpg 123931 919 573 IMAGE-DOWNSAMPLED 1-s2.0-S002195171830109X-fx1.sml https://s3-eu-west-1.amazonaws.com/prod-ucs-content-store-eu-west/content/pii:S002195171830109X/fx1/THUMBNAIL/image/gif/e221e6095d1ef6034de991a66d45ef9c/fx1.sml fx1 true fx1.sml sml 20527 135 219 IMAGE-THUMBNAIL 1-s2.0-S002195171830109X-gr1.sml https://s3-eu-west-1.amazonaws.com/prod-ucs-content-store-eu-west/content/pii:S002195171830109X/gr1/THUMBNAIL/image/gif/ac4a2eeca14148e3496b5f75858f6898/gr1.sml gr1 gr1.sml sml 8264 163 102 IMAGE-THUMBNAIL 1-s2.0-S002195171830109X-gr10.sml https://s3-eu-west-1.amazonaws.com/prod-ucs-content-store-eu-west/content/pii:S002195171830109X/gr10/THUMBNAIL/image/gif/cd1a780f58acdf1a85f9117ad3e1ea34/gr10.sml gr10 gr10.sml sml 7987 164 206 IMAGE-THUMBNAIL 1-s2.0-S002195171830109X-gr11.sml https://s3-eu-west-1.amazonaws.com/prod-ucs-content-store-eu-west/content/pii:S002195171830109X/gr11/THUMBNAIL/image/gif/898d6c9b58f505a5f335a64ea08d6727/gr11.sml gr11 gr11.sml sml 4226 164 158 IMAGE-THUMBNAIL 1-s2.0-S002195171830109X-gr12.sml https://s3-eu-west-1.amazonaws.com/prod-ucs-content-store-eu-west/content/pii:S002195171830109X/gr12/THUMBNAIL/image/gif/9c9d00b7c06a65604492881875cdc349/gr12.sml gr12 gr12.sml sml 5179 80 219 IMAGE-THUMBNAIL 1-s2.0-S002195171830109X-gr13.sml https://s3-eu-west-1.amazonaws.com/prod-ucs-content-store-eu-west/content/pii:S002195171830109X/gr13/THUMBNAIL/image/gif/e5a02da30bb79966207a2f788c861a56/gr13.sml gr13 gr13.sml sml 18705 163 219 IMAGE-THUMBNAIL 1-s2.0-S002195171830109X-gr14.sml https://s3-eu-west-1.amazonaws.com/prod-ucs-content-store-eu-west/content/pii:S002195171830109X/gr14/THUMBNAIL/image/gif/07dc392a90bfa90d44b0f8eafae8f58d/gr14.sml gr14 gr14.sml sml 19289 121 219 IMAGE-THUMBNAIL 1-s2.0-S002195171830109X-gr2.sml https://s3-eu-west-1.amazonaws.com/prod-ucs-content-store-eu-west/content/pii:S002195171830109X/gr2/THUMBNAIL/image/gif/308417b13db84e4363241401b97da35a/gr2.sml gr2 gr2.sml sml 11309 164 209 IMAGE-THUMBNAIL 1-s2.0-S002195171830109X-gr3.sml https://s3-eu-west-1.amazonaws.com/prod-ucs-content-store-eu-west/content/pii:S002195171830109X/gr3/THUMBNAIL/image/gif/bc3ee80ec6e81d14705ca0ccc917136b/gr3.sml gr3 gr3.sml sml 17043 163 126 IMAGE-THUMBNAIL 1-s2.0-S002195171830109X-gr4.sml https://s3-eu-west-1.amazonaws.com/prod-ucs-content-store-eu-west/content/pii:S002195171830109X/gr4/THUMBNAIL/image/gif/0e1d2f592417a08641a3f31a1bcda69c/gr4.sml gr4 gr4.sml sml 16186 88 219 IMAGE-THUMBNAIL 1-s2.0-S002195171830109X-gr5.sml https://s3-eu-west-1.amazonaws.com/prod-ucs-content-store-eu-west/content/pii:S002195171830109X/gr5/THUMBNAIL/image/gif/603c1c0a610e79b84735e196b1fa1b92/gr5.sml gr5 gr5.sml sml 9836 164 199 IMAGE-THUMBNAIL 1-s2.0-S002195171830109X-gr6.sml https://s3-eu-west-1.amazonaws.com/prod-ucs-content-store-eu-west/content/pii:S002195171830109X/gr6/THUMBNAIL/image/gif/a77219675c2af2d64f226e12f06644bc/gr6.sml gr6 gr6.sml sml 15805 164 203 IMAGE-THUMBNAIL 1-s2.0-S002195171830109X-gr7.sml https://s3-eu-west-1.amazonaws.com/prod-ucs-content-store-eu-west/content/pii:S002195171830109X/gr7/THUMBNAIL/image/gif/b1c48377fcc4fd1178c919160987d509/gr7.sml gr7 gr7.sml sml 13191 164 212 IMAGE-THUMBNAIL 1-s2.0-S002195171830109X-gr8.sml https://s3-eu-west-1.amazonaws.com/prod-ucs-content-store-eu-west/content/pii:S002195171830109X/gr8/THUMBNAIL/image/gif/63f2de0e4e338f86607cc870f8c4e064/gr8.sml gr8 gr8.sml sml 8161 95 219 IMAGE-THUMBNAIL 1-s2.0-S002195171830109X-gr9.sml https://s3-eu-west-1.amazonaws.com/prod-ucs-content-store-eu-west/content/pii:S002195171830109X/gr9/THUMBNAIL/image/gif/33a2b0695c76ca9870a988000ab8a561/gr9.sml gr9 gr9.sml sml 8113 164 102 IMAGE-THUMBNAIL 1-s2.0-S002195171830109X-fx1_lrg.jpg https://s3-eu-west-1.amazonaws.com/prod-ucs-content-store-eu-west/content/pii:S002195171830109X/fx1/HIGHRES/image/jpeg/95748a187916946a92e2866be58f422a/fx1_lrg.jpg fx1 true fx1_lrg.jpg jpg 112574 531 863 IMAGE-HIGH-RES 1-s2.0-S002195171830109X-gr1_lrg.jpg https://s3-eu-west-1.amazonaws.com/prod-ucs-content-store-eu-west/content/pii:S002195171830109X/gr1/HIGHRES/image/jpeg/e6abbe7a5f2c574c41f9a4ccaaea48ce/gr1_lrg.jpg gr1 gr1_lrg.jpg jpg 185337 1343 839 IMAGE-HIGH-RES 1-s2.0-S002195171830109X-gr10_lrg.jpg https://s3-eu-west-1.amazonaws.com/prod-ucs-content-store-eu-west/content/pii:S002195171830109X/gr10/HIGHRES/image/jpeg/84516ef7956042c33209452a6b689276/gr10_lrg.jpg gr10 gr10_lrg.jpg jpg 73875 774 973 IMAGE-HIGH-RES 1-s2.0-S002195171830109X-gr11_lrg.jpg https://s3-eu-west-1.amazonaws.com/prod-ucs-content-store-eu-west/content/pii:S002195171830109X/gr11/HIGHRES/image/jpeg/2975242ae81d3e82e25940350646091a/gr11_lrg.jpg gr11 gr11_lrg.jpg jpg 42234 859 827 IMAGE-HIGH-RES 1-s2.0-S002195171830109X-gr12_lrg.jpg https://s3-eu-west-1.amazonaws.com/prod-ucs-content-store-eu-west/content/pii:S002195171830109X/gr12/HIGHRES/image/jpeg/9e8d124be0a99612673907b4f1a5a3c4/gr12_lrg.jpg gr12 gr12_lrg.jpg jpg 105909 702 1910 IMAGE-HIGH-RES 1-s2.0-S002195171830109X-gr13_lrg.jpg https://s3-eu-west-1.amazonaws.com/prod-ucs-content-store-eu-west/content/pii:S002195171830109X/gr13/HIGHRES/image/jpeg/8d2a5a8b5ba867163233f538cd69bfd5/gr13_lrg.jpg gr13 gr13_lrg.jpg jpg 169610 727 977 IMAGE-HIGH-RES 1-s2.0-S002195171830109X-gr14_lrg.jpg https://s3-eu-west-1.amazonaws.com/prod-ucs-content-store-eu-west/content/pii:S002195171830109X/gr14/HIGHRES/image/jpeg/a9724634a4450aad054cab6531152b99/gr14_lrg.jpg gr14 gr14_lrg.jpg jpg 229765 797 1441 IMAGE-HIGH-RES 1-s2.0-S002195171830109X-gr2_lrg.jpg https://s3-eu-west-1.amazonaws.com/prod-ucs-content-store-eu-west/content/pii:S002195171830109X/gr2/HIGHRES/image/jpeg/141e8555a4085a242a0c177ac06badcd/gr2_lrg.jpg gr2 gr2_lrg.jpg jpg 96280 756 964 IMAGE-HIGH-RES 1-s2.0-S002195171830109X-gr3_lrg.jpg https://s3-eu-west-1.amazonaws.com/prod-ucs-content-store-eu-west/content/pii:S002195171830109X/gr3/HIGHRES/image/jpeg/c36c5d216a25a0ea819217276e952706/gr3_lrg.jpg gr3 gr3_lrg.jpg jpg 640022 1865 1441 IMAGE-HIGH-RES 1-s2.0-S002195171830109X-gr4_lrg.jpg https://s3-eu-west-1.amazonaws.com/prod-ucs-content-store-eu-west/content/pii:S002195171830109X/gr4/HIGHRES/image/jpeg/82dfb69e19fe5ae774e6e7f1650dfb19/gr4_lrg.jpg gr4 gr4_lrg.jpg jpg 243787 628 1559 IMAGE-HIGH-RES 1-s2.0-S002195171830109X-gr5_lrg.jpg https://s3-eu-west-1.amazonaws.com/prod-ucs-content-store-eu-west/content/pii:S002195171830109X/gr5/HIGHRES/image/jpeg/6961acdcf81584fa7de0e39a9f85829d/gr5_lrg.jpg gr5 gr5_lrg.jpg jpg 86010 764 928 IMAGE-HIGH-RES 1-s2.0-S002195171830109X-gr6_lrg.jpg https://s3-eu-west-1.amazonaws.com/prod-ucs-content-store-eu-west/content/pii:S002195171830109X/gr6/HIGHRES/image/jpeg/e388252e1c12526992f4da63da460d45/gr6_lrg.jpg gr6 gr6_lrg.jpg jpg 466124 1523 1890 IMAGE-HIGH-RES 1-s2.0-S002195171830109X-gr7_lrg.jpg https://s3-eu-west-1.amazonaws.com/prod-ucs-content-store-eu-west/content/pii:S002195171830109X/gr7/HIGHRES/image/jpeg/465f1c6dd0b1fd100c3804e53ac3efb7/gr7_lrg.jpg gr7 gr7_lrg.jpg jpg 160370 775 1002 IMAGE-HIGH-RES 1-s2.0-S002195171830109X-gr8_lrg.jpg https://s3-eu-west-1.amazonaws.com/prod-ucs-content-store-eu-west/content/pii:S002195171830109X/gr8/HIGHRES/image/jpeg/57fbc7247800d1fb3c2c5c0e79e38973/gr8_lrg.jpg gr8 gr8_lrg.jpg jpg 171771 744 1708 IMAGE-HIGH-RES 1-s2.0-S002195171830109X-gr9_lrg.jpg https://s3-eu-west-1.amazonaws.com/prod-ucs-content-store-eu-west/content/pii:S002195171830109X/gr9/HIGHRES/image/jpeg/ceaac9c10d4964c4b570ce6b7af4ad98/gr9_lrg.jpg gr9 gr9_lrg.jpg jpg 368631 2442 1523 IMAGE-HIGH-RES 1-s2.0-S002195171830109X-mmc1.docx https://s3-eu-west-1.amazonaws.com/prod-ucs-content-store-eu-west/content/pii:S002195171830109X/mmc1/MAIN/application/vnd.openxmlformats-officedocument.wordprocessingml.document/c58eff69b376952d9c534c85749202a8/mmc1.docx mmc1 mmc1.docx docx 1406146 APPLICATION 1-s2.0-S002195171830109X-si1.gif https://s3-eu-west-1.amazonaws.com/prod-ucs-content-store-eu-west/content/pii:S002195171830109X/STRIPIN/image/gif/442d7f348947566ad2884a2a9d815790/si1.gif si1 si1.gif gif 1137 17 273 ALTIMG 1-s2.0-S002195171830109X-si2.gif https://s3-eu-west-1.amazonaws.com/prod-ucs-content-store-eu-west/content/pii:S002195171830109X/STRIPIN/image/gif/05e15cbdb8a55ae27b62f52ded994dae/si2.gif si2 si2.gif gif 181 18 9 ALTIMG 1-s2.0-S002195171830109X-si3.gif https://s3-eu-west-1.amazonaws.com/prod-ucs-content-store-eu-west/content/pii:S002195171830109X/STRIPIN/image/gif/4fc74caa3da386f86de651376e2aca46/si3.gif si3 si3.gif gif 460 15 100 ALTIMG 1-s2.0-S002195171830109X-si4.gif https://s3-eu-west-1.amazonaws.com/prod-ucs-content-store-eu-west/content/pii:S002195171830109X/STRIPIN/image/gif/c1d114ffcb2b26b71149691d0773fa14/si4.gif si4 si4.gif gif 695 18 154 ALTIMG 1-s2.0-S002195171830109X-si5.gif https://s3-eu-west-1.amazonaws.com/prod-ucs-content-store-eu-west/content/pii:S002195171830109X/STRIPIN/image/gif/50c0c6125538f9fe5c2f9d3143740c07/si5.gif si5 si5.gif gif 520 18 107 ALTIMG YJCAT 12751 S0021-9517(18)30109-X 10.1016/j.jcat.2018.03.009 Elsevier Inc. Fig. 1 (a) X-ray diffraction (XRD) and (b) magnified XRD patterns of the prepared samples. Fig. 2 Raman spectra of the Ti3AlC2, TT0, TT550 and TT650 and high-resolution Raman spectra (inset) of Ti3AlC2 and TT0. Fig. 3 Field emission scanning electron microscope (FESEM) images of (a, b) TT0, (c, d) TT550 and (e, f) TT650. Fig. 4 (a) Transmission electron microscope (TEM) image and schematic illustration of the sandwich structure of TT550 (inset). (b) Corresponding (red rectangle in a) high resolution TEM (HRTEM) image of TT550. Fig. 5 Comparison of light absorption spectra and corresponding optical photographs (inset) of the prepared samples. Fig. 6 (a) X-ray photoelectron spectroscopy (XPS) survey spectra of TT0 and TT550. High resolution Ti 2p XPS spectra of (b) TT0 and (c) TT550 and TT650. High resolution XPS spectra for (d–f) C 1s of TT0 (d), TT550 (e) and TT650 (f) and (g-i) O 1s of TT0 (g), TT550 (h) and TT650 (i). Fig. 7 Nitrogen adsorption–desorption isotherms and pore size distribution (inset) of the prepared samples. Fig. 8 (a) Photocurrent curves of all the prepared samples. (b) Nyquist plots of all the prepared samples and the equivalent electrical circuit (inset). Fig. 9 (a, b) Schematic illustration for electronic structure of Ti3C2 (a) and (1 0 1) facets of anatase TiO2 (b). (c) Density of state (DOS) plots for Ti3C2 where C 2p, Ti 3d and TDOS are partial DOS of C 2p, partial DOS of Ti 3d and total DOS, respectively. (d) Calculated electrostatic potential of Ti3C2. (e) Band structure and calculated excitation energy of TiO2. (f) Schematic illustration for charge carrier migration on TiO2/Ti3C2 composite. Fig. 10 Comparison of the gas chromatograms for the gaseous products of the photocatalytic CO2 reduction over different prepared samples under 1 h light irradiation. Fig. 11 GC–MS spectra of the photocatalytic (a) 12CO2 and (b) 13CO2 reduction over TT550, where m stands for mass and z stands for charge number of ions. Fig. 12 (a) Comparison of the photocatalytic CO2 reduction performance of the prepared samples and P25 for CH4 production. (b) Photocatalytic CO2 reduction stability test of TT550. Fig. 13 In situ DRIFTS spectra of photocatalytic CO2 reduction using TT550 under dark condition (0–60 min) and LED light irradiation (80–120 min). C1 and C2 represent condition (1) (dark condition) and condition (2) (LED light irradiation), respectively. Fig. 14 Schematic illustration for the enhancement mechanism of photocatalytic CO2 reduction on TiO2/Ti3C2 composite. Table 1 The reduction potentials and required electron numbers for various CO2 reduction reactions. Reduction reaction Standard reduction potential CO2 + 2H+ + 2e− → HCO2H −0.61 V vs. NHE at pH 7 CO2 + 2H+ + 2e− → CO + H2O −0.53 V vs. NHE at pH 7 CO2 + 4H+ + 4e− → HCHO + H2O −0.48 V vs. NHE at pH 7 CO2 + 6H+ + 6e− → CH3OH + H2O −0.38 V vs. NHE at pH 7 CO2 + 8H+ + 8e− → CH4 + 2H2O −0.24 V vs. NHE at pH 7 2CO2 + 8H2O + 12e− → C2H4 + 12OH− −0.34 V vs. NHE at pH 7 2CO2 + 9H2O + 12e− → C2H5OH + 12OH− −0.33 V vs. NHE at pH 7 Table 2 Comparison of the photocatalytic CO2 reduction performance of the optimized TiO2/Ti3C2 with those of the previous reported photocatalysts. Photocatalyst Photocatalyst weight Light source Photocatalytic performance Reference TiO2/Ti3C2 50 mg 300 W Xe lamp 0.22 μmol h−1 (CH4) This work Anatase TiO2 with co-exposed (0 0 1) and (1 0 1) facets 100 mg 300 W Xe lamp 0.14 μmol h−1 (CH4) [58] Sulfur-doped g-C3N4/Pt 100 mg 300 W Xe lamp (AM1.5 filter) 0.04 μmol h−1 (CH3OH) [64] Direct Z-scheme CdS-WO3 100 mg 300 W Xe lamp (420 nm cutoff filter) 0.10 μmol h−1 (CH4) [7] Bi2WO6 square nanoplates 100 mg 300 W Xe lamp (420 nm cutoff filter) 0.11 μmol h−1 (CH4) [65] Ordered mesoporous Co-doped TiO2 100 mg 300 W Xe lamp (420 nm cutoff filter) 0.19 μmol h−1 (CO) [66] Mixed-phase TiO2/Mg 150 mg 300 W Xe lamp (AM1.5 filter) 0.15 μmol h−1 (CH4) [67] Au@TiO2 yolk-shell hollow spheres 10 mg 300 W Xe lamp 0.03 μmol h−1 (CH4) [68] TiO2 yolk-shell hierarchicalmicrospheres 100 mg 300 W Xe lamp (400 nm cutoff filter) 0.21 μmol h−1 (CH3OH) [69] TiO2/MXene Ti3C2 composite with excellent photocatalytic CO2 reduction activity Jingxiang Low a Liuyang Zhang a Tong Tong a Baojia Shen a Jiaguo Yu a b ⁎ a State Key Laboratory of Advanced Technology for Materials Synthesis and Processing, Wuhan University of Technology, Luoshi Road 122, Wuhan 430070, PR China State Key Laboratory of Advanced Technology for Materials Synthesis and Processing Wuhan University of Technology Luoshi Road 122 Wuhan 430070 PR China b Department of Physics, Faculty of Science, King Abdulaziz University, Jeddah 21589, Saudi Arabia Department of Physics Faculty of Science King Abdulaziz University Jeddah 21589 Saudi Arabia ⁎ Corresponding author at: State Key Laboratory of Advanced Technology for Materials Synthesis and Processing, Wuhan University of Technology, Luoshi Road 122, Wuhan 430070, PR China. State Key Laboratory of Advanced Technology for Materials Synthesis and Processing Wuhan University of Technology Luoshi Road 122 Wuhan 430070 PR China Graphical abstract Photocatalytic CO2 reduction for solar fuel production has received enormous attention due to its ability for solving both energy crisis and CO2 pollution. However, fabrication of cheap and efficient materials for photocatalytic CO2 reduction is still challenging. Herein, TiO2 nanoparticles (NPs) in situ grew on highly conductive MXene Ti3C2 through calcination method. And a unique rice crust-like structure was achieved through the uniform distribution of TiO2 nanoparticles on Ti3C2. This optimized TiO2/Ti3C2 composite exhibited a 3.7 times higher photocatalytic CO2 reduction performance for CH4-production (0.22 μmol h−1) than commercial TiO2 (P25). The detailed photocatalytic CO2 reduction mechanism using TiO2/Ti3C2 was confirmed through the 13CO2 isotopic test and in situ diffuse reflectance infrared Fourier transform spectroscopy. Experimental evidence along with preliminary calculation was also used to further elucidate the proposed photocatalytic enhancement mechanism. This extraordinary photocatalytic performance was due to the unique morphology and the features of individual components in the composite. Namely, fluffy rice crust-like structure of the prepared samples rendered the composite with large population of the surface-active sites. Ultrahigh conductivity of Ti3C2 facilitated the photogenerated electron transfer and suppressed its recombination with photogenerated holes. This work presents a simple method to prepare highly efficient TiO2/Ti3C2 composite for photoconversion applications. Keywords MXenes Ti3C2 TiO2 Photocatalysis CO2 reduction 1 Introduction Due to the rapid growth in the industry and human population, fossil fuels such as coal, petroleum and natural gas have been vastly consumed, causing energy crisis and environmental problems [1–6]. To address these problems, artificial photosynthesis through photocatalytic CO2 reduction in the presence of H2O has attracted wide attention due to its potential in converting greenhouse gases, i.e. CO2, into valuable chemical fuels through various chemical reactions [7–11]. Formic acid (CH2O2), formaldehyde (CH2O), and methane (CH4) are three of countless representative chemical fuels [12–17]. In this context, various semiconductors such as TiO2, CdS, g-C3N4, BiOBr and Fe3O4, have been extensively studied and investigated for photocatalytic CO2 reduction [18–23]. Among them, TiO2 is the first candidate and still a benchmark because of its effectiveness, environmental friendliness and photostability [24–27]. However, it still remains challenging to achieve the practical application of TiO2 for photocatalytic CO2 reduction mainly due to its low light utilization ability and rapid electron-hole recombination [28–31]. Thus, enormous strategies, (for instance, surface modification, co-catalyst loading, impurity doping and heterojunction construction) have been proposed to enhance the photocatalytic performance of TiO2 [32–34]. Two-dimensional (2D) layered materials have been widely studied due to their extraordinary physical and chemical properties [35–37]. Especially, studies on graphene analogues such as g-C3N4 and MoS2 have bloomed in the past decade. Recently, the discovery of 2D MXenes (e.g., Ti3C2, Ti2C, Nb2C, V2C and Mo2C) by Gogotsi et al. has reignited scientific interest in preparing 2D layered materials [38–40]. Generally, MXene is a layer of transition metal carbides and/or nitrides with a Mn+1AXn formula, where M is a transition metal, i.e. Ti, V, Mo; A is a group-XIII (or XIV) element and n is an integer from 1 to 3 [40,41]. Attributing to their high electrical conductivity, large specific surface area, hydrophilicity and compositional variability, MXenes have been intensively investigated and applied for various applications, not confined to supercapacitors, batteries, water filtration, catalysis and antibacterial films [42–44]. The photocatalytic application of MXene Ti3C2 has also been investigated by Qiao and co-workers [45], indicating that photocatalytic H2-production performance of CdS was enhanced using Ti3C2 as cocatalyst due to its high conductivity. Herein, the design motif was the grafting of TiO2 nanoparticles (NPs) on the MXene Ti3C2 by a simple calcination method. Advances of the in situ growth allowed for the intimate contact and portrayed a unique rice crust like structure, endowing it with large specific surface area. The loading amount of TiO2 NPs on Ti3C2 can be tailored by adjusting the calcination temperature. Moreover, after careful investigation, the high electronic conductivity of the Ti3C2 was found to be beneficial for the migration of photogenerated electrons from TiO2 to Ti3C2, achieving spatial separation of electron-hole pairs. The photocatalytic CO2 reduction performance of the optimized TiO2/Ti3C2 composite was 3.7 times higher than that of commercial TiO2 (P25) due to the enlarged specific surface area and enhanced electron-hole separation efficiency. This simple and effective method was highlighted to enhance the photocatalytic performance of TiO2, providing fertile ground for the potential applications of MXene-based materials in photocatalysis. 2 Experimental details 2.1 Sample preparation 2.1.1 Materials All chemical reagents (analytical grade) were purchased from Shanghai Chemical Reagent Factory of China without further purification. Deionized (DI) water was used in all experiments. 2.1.2 Preparation of Ti3C2 Ti3C2 was prepared according to a previous report [46]. Two grams of as-purchased Ti3AlC2 powders were dispersed in 40 ml HF solution. The obtained dispersion was stirred at room temperature for 48 h to remove Al layer, obtaining Ti3C2. The slurry was then filtered and dried in an oven at 80 °C for 12 h. Then, Ti3C2 powders were intercalated by polar organic molecules using 30 ml dimethyl sulfoxide (DMSO) solution. The mixture was then kept stirring for 24 h. Thereafter, the obtained solution underwent sonication for 1 h to obtain ultrathin 2D layered Ti3C2 [47,48]. 2.1.3 Preparation of TiO2/Ti3C2 composite TiO2/Ti3C2 composite was obtained by a simple calcination method. Typically, the above-prepared Ti3C2 solution was dried at 80 °C for 12 h. Then, the dried Ti3C2 were calcined at 350 °C, 450 °C, 550 °C and 650 °C with a ramping rate of 10 °C/min to obtain TT350, TT450, TT550 and TT650, respectively. Finally, the obtained samples were grinded and collected. The dried Ti3C2 without calcination were used as the controlled sample and labeled as TT0. 2.2 Characterization The phase structures of the prepared samples were investigated through X-ray diffraction (XRD) patterns recorded on a D/Max-RB X-ray diffractometer (Rigaku, Japan) using CuKα radiation (λ = 0.15418 nm) with a scan rate of 0.05°(2θ) s−1. The elemental analysis was carried out on Vario EL cube through the dry combustion method. Field emission scanning electron microscope (FESEM) (JSM-7500F, JEOL, Japan) was applied to determine the morphologies of the prepared samples. Oxford Instruments X-ray analysis system equipped on JSM-7500F was used to carry out the energy-dispersive X-ray (EDX) spectroscopy and elemental mapping test. Titan G2 60–300 microscope operated at 300 kV was used to obtain the transmission electron microscope (TEM) images of the prepared samples. The thickness and surface topology for single layer Ti3C2 of TT0 were determined using an an atomic force microscopy (AFM, Multimode 8 AFM, Bruker, Germany) under ScanAnalyst mode with cantilevers at a spring constant of 0.35 N m−1 and a frequency of 65 kHz. X-ray photoelectron spectroscopy (XPS) (JPS-9010MC, JEOL, Japan) characterization was performed with a hemispherical electron energy analyzer (1486 eV Al Kα radiation) to determine the surface composition and chemical status of the prepared samples. The binding energy of all prepared samples was calibrated with the C 1s peak of C–C (284.8 eV). Raman analysis was carried out on Raman spectrometer (Renishaw InVia) with back-scattering geometry and 514.5 nm laser excitation. UV–visible spectrophotometer (UV-2600, Shimadzu, Japan) was used to record the light absorption spectra of the prepared samples. BaSO4 was used as reflectance reference for UV–visible spectrophotometer. The nitrogen adsorption-desorption isotherm was obtained on a Micromeritics ASAP 2020 nitrogen adsorption apparatus (USA) to determine the Brunauer–Emmett–Teller (BET) specific surface area (S BET) of the prepared samples through a multipoint BET method using the adsorption data at the relative pressure (P/P 0) range of 0.05–0.3. Prior to the test, the samples were degassed at 180 °C. The pore size distribution of the prepared samples was calculated through the Barret-Joyner-Halender (BJH) method. The pore volume and average pore size of the prepared samples were determined using the adsorbed nitrogen volume at the relative pressure of 0.994. 2.3 Electrochemical measurement and photocatalytic performance test The electrochemical measurement was performed on standard three-electrode electrochemical analyzer (CHI660C instruments, CHI, China) system using low power UV-LED (3 W, 365 nm) as light source. During the electrochemical test, 30 ml 0.5 M Na2SO4 aqueous solution was used as electrolyte. Meanwhile, the prepared sample (with a geometrical area of 1.0 cm2), Pt wire and Ag|AgCl immersed in the filling solution (saturated KCl) were respectively utilized as working, counter and reference electrodes in this electrochemical analyzer system. Photocatalytic performance of the prepared samples was investigated through photocatalytic CO2 reduction test. The photocatalytic CO2 reduction test was carried out in a 200 ml Pyrex reactor at room temperature. Prior to the reaction, 50 mg of the prepared sample was ultrasonically dispersed in deionized water and poured into the Pyrex reactor. Then, the dispersion was dried at 80 °C for 6 h to create a thin film at the bottom of Pyrex reactor. Thereafter, the Pyrex reactor was sealed and flowed with the nitrogen gas for 30 min to achieve the anaerobic condition. The reaction between 84 mg NaHCO3 (added into the reactor before sealing) and 0.3 ml 4 M HCl (excess HCl solution, added into the reactor by syringe after sealing) was applied to in situ generate CO2 and H2O vapor within the system. The detailed reaction between NaHCO3 and HCl is as follows, (1) NaHC O 3 + HCl = NaCl + H 2 O + C O 2 Then, 300 W simulated solar Xe arc lamp (see Fig. S1 for the spectral distribution) was used as light source and placed vertically 10 cm above the Pyrex reactor. After 1 h of light irradiation, 1 ml of gas was taken out from the reactor and analyzed. Gas chromatograph (PGC-80, Changzhou Panna Instrument, China) equipped with flame ionized detector (FID) and methanizer was used to determine the composition of resultant gas. High purity nitrogen gas was applied as carrier gas in the PGC-80. Gas chromatography–mass spectrometry (GC–MS) was carried out to confirm the origin of the hydrocarbon compounds produced during photocatalytic CO2 reduction. The above-mentioned CO2 reduction test was also carried out during GC–MS characterization except that the CO2 and H2O vapor were generated by NaHCO3 with different C-labelling. NaHCO3-12C and NaHCO3-13C were selectively used during photocatalytic 12CO2 and 13CO2 reduction test, respectively. GC–MS (6980N network GC system–5975 inert mass selective detector, Agilent technologies, USA) was used to determine the mixed gas (250 μL) taken out from the reactor after 1 h of photocatalytic reaction. Nicolet iS50 infrared Fourier transform spectrometer (TMO, USA) was used to record in situ diffuse reflectance infrared Fourier transform spectra (DRIFTS) of the prepared samples. Prior to the test, the prepared samples were degassed at 150 °C for 6 h and placed into the reaction chamber of DRIFTS. Then, the chamber was sealed and purged with the mixed CO2 and H2O vapor. The DRIFTS was carried out under dark condition (3 cycles, 20 min each) and 3 W 365 nm LED light irradiation (3 cycles, 20 min each). 2.4 Material simulation Density functional theory (DFT) simulation was performed using Cambridge Sequential Total Energy Package (CASTEP) module in Materials Studio software [49]. The Perdew–Burke–Ernzerhof (PBE) version of the generalized gradient approximation (GGA) was used to optimize the geometry structures [50]. The norm-conserving pseudopotentials were performed for simulating interaction between valence electrons and ionic core. Van der Waals interactions were considered using Grimme empirical correction [51]. An optimized 500 eV cut-off energy was selected after testing higher kinetic cut-off energies for confirming the accuracy of the simulations. The Monkhorst-Pack k-point grid was set as 3 × 3 × 1 for the Brillouin zone. A vacuum space of 15 Å was built to avoid the interference of neighboring systems along the c axis. The convergence standards for the electronic structure iteration were 1.0 × 10−5 eV/atom for energy, 0.03 eV Å−1 for max force, 0.005 GPa for max pressure and 0.001 Å for max displacement. The electronic structures of TiO2 and Ti3C2 were calculated by HSE06 hybrid functional to avoid underestimation in bandgap for PBE of GGA exchange correlation function. 3 Results and discussion 3.1 Phase structures The X-ray diffraction (XRD) patterns of the prepared samples are shown in Fig. 1 a. Obviously, after reaction with the HF, the diffraction line for the (1 0 4) planes of TT0 at 39° disappeared in comparison with Ti3AlC2, indicating the transformation from Ti3AlC2 to Ti3C2 after elimination of the Al layers by HF etching [52,53]. Moreover, it can be found that the position of the (0 0 4) planes of TT0 shifted to a lower angle after HF etching and DMSO delamination due to an increase in the interlayer spacing of the Ti3C2, indicating the successful exfoliation of Ti3C2 [54]. After calcination of Ti3C2 at 350 °C, the diffraction lines assigned to the Ti3C2 were intensified due to an increase in the crystallinity of Ti3C2. Furthermore, new diffraction lines assigned to anatase TiO2 can be observed, suggesting the successful transformation of Ti3C2 into TiO2. As the calcination temperature further increased, the diffraction line intensity of TiO2 gradually increased due to an increase in the TiO2 content, increase in TiO2 crystallinity and decrease in the surface defects of the samples. The shrink in surface defects reduced the likelihood of electron-hole pair recombination. Moreover, in TT350, TT450 and TT550, in the range between 30° and 50° (Fig. 1b), the diffraction lines of the Ti3C2 located at 35° and 43° were still retained, confirming the formation of TiO2/Ti3C2 composite. In addition, the intensity of diffraction lines of the Ti3C2 were found to be decreased with increasing calcination temperature due to the transformation of Ti3C2 into the TiO2. The ratio of TiO2 to Ti3C2 was estimated using elemental analysis (listed in Table S1), and it is positively correlated with calcination temperature. At 650 °C, Ti3C2 was fully transformed into TiO2. This result further confirmed that the loading amount of TiO2 can be simply tuned by changing the calcination temperature. Raman spectra, shown in Fig. 2 , further reveal the constituents of the prepared samples. For the Ti2AlC and TT0 (Fig. 2 inset), several characteristic bands appeared at ca. 175, 260, 410 and 605 cm−1, attributed to the ω 1, ω 2, ω 3, and ω 4 Raman-active phonon vibration modes [55]. Noticeably, the ω3 Raman band modes of TT0 are blue-shifted in comparison with that of Ti2AlC. This shift was due to the presence of interlayer adsorbents and delamination of Ti3AlC2 by HF etching and DMSO delamination [56]. For Raman spectra of TT550 and TT650, several characteristic bands attributed to E g (144 cm−1), B 1g (400 cm−1), A 1g (514 cm−1) and E g (650 cm−1) modes of anatase TiO2 can be observed, suggesting the transformation of Ti3C2 into TiO2 during calcination. 3.2 Morphology As shown in Fig. 3 a and b, the prepared TT0 exhibited a hierarchical accordion-like structure. The thickness of the single layer Ti3C2 obtained by ultrasonication was determined to be ca. 1.6 nm through AFM characterization (Fig. S2). However, a visualized single layer in SEM (see Fig. 3a and b) was about 5–10 nm, suggesting a stacking of several single layers. It should be noted that a lot of nanoparticles can be found on the edge of the TT0. These nanoparticles were amorphous TiO2 NPs which were formed due to the introduction of strong oxidation agent (viz. DMSO) during the delamination of Ti3C2. The surface of Ti3C2 became rougher (Fig. 3c and d) after calcination, which was attributed to the formation of TiO2 NPs on the surface of Ti3C2. Notably, TiO2 NPs with the size of ca. 25 nm were uniformly dispersed on Ti3C2. This was because in situ transformation of the Ti3C2 into TiO2 can inhibit the agglomeration and thus preserve the uniform size distribution of the TiO2 NPs. In addition, the oxidation of the Ti3C2 into TiO2 can also cause enlargement of interspace between TiO2 laminar due to the increased crystal size of the prepared samples. Interestingly, the morphology of TT550 was fluffy and similar to that of the rice crust (see Fig. 3c inset). Particularly, although these TiO2 nanoparticles were interconnected, a lot of air voids existed in between (see Fig. S3a and b), increasing the specific surface area of the samples. The presence of these unique air voids on the TT550 was attributed to the production of CO2 gas during the calcination process. However, further increase in the calcination temperature to 650 °C caused the reduction in the air void density due to the increase in the size of the TiO2 NPs (Fig. 3e and f). Moreover, a lot of cracks can be found on TT650 (see Fig. S3c and d). The formation of these cracks was due to the incompatibility of their respective surface tension. Furthermore, the information regarding the elemental composition and the distribution of elements on prepared samples were determined by elemental mapping test using energy dispersive X-ray spectroscopy (EDX) (see Fig. S4). As shown in Fig. S4a, Ti, O, C, and F elements can be observed, indicating the presence of Ti3C2, TiO2 and residue F− ions on the TT0. After calcination (Fig. S4b–e), the F element disappeared due to the removal of F− ions at high temperature. Moreover, it can be found that the content of O element increased with increasing calcination temperature. Oppositely, the content of C element decreased and disappeared at 650 °C. This result was on account of the gradual transformation from Ti3C2 into TiO2 during calcination, in good agreement with the XRD results. The TEM and HRTEM images of TT550 are shown in Fig. 4 . As shown in Fig. 4a, the TiO2 NPs were attached to Ti3C2, forming a sandwich-like structure. This result indicated that the transformation from Ti3C2 to TiO2 began from the surface and extended to the core of the Ti3C2. The clearly-observed lattice fringes of the TiO2 and Ti3C2 (see Fig. 4b) suggested successful preparation of the TiO2/Ti3C2 composite. In detail, the lattice fringes of 3.45 Å and 2.70 Å were attributed to the (1 0 1) planes of anatase TiO2 and (0 1 ¯ 10) planes of Ti3C2, respectively. Interestingly, the Ti3C2 nanosheets were sandwiched between the TiO2 NPs, further confirming the sandwich structure of the TiO2/Ti3C2 composite. The sandwich structure of the TiO2/Ti3C2 composite was beneficial for providing more contact interface to accelerate the charge carrier migration between them. 3.3 Optical property Comparison of the light absorption spectra of the prepared samples is shown in Fig. 5 . TT0 exhibited the highest light absorption from 300 to 700 nm due to the black color nature of Ti3C2. TT350 exhibited similar optical properties with slightly reduced light absorption intensity because a small portion of the Ti3C2 was converted into TiO2. Obvious light absorption edges at ca. 400 nm can be found for samples calcinated at temperature higher than 450 °C, due to the intrinsic light absorption of the TiO2, confirming the emergence of TiO2. Also, there is a decrease in light absorption intensity of the samples in the visible-light range (>400 nm) with calcination temperature rising. This trend was in accordance with the gradual color changes of the prepared samples from dark black (TT0) to white (TT650) (inset of Fig. 5). These changes reinforced the changes in Ti3C2 content, in line with previous XRD and EDS results. Generally, a higher content of the Ti3C2 generated a stronger light absorption at visible-light range. Although this Ti3C2-induced light absorption enhancement cannot be directly applied for the generation of photogenerated electron-hole pairs, the accompanying photothermal effect on the samples is beneficial for accelerating the reactant adsorption-desorption and charge carrier migration [57]. However, for TT650, the light absorption of the samples at visible-light range almost vanished due to a fully transformation of Ti3C2 into TiO2. 3.4 Surface composition As evidenced in the previous sections, the surface composition of the prepared samples would greatly change after the calcination due to the oxidation of Ti3C2. To further confirm the changes of the surface compositions and chemical states of the prepared samples, the XPS characterization was carried out. The survey spectra of three typical samples TT0, TT550 and TT650 are compared in Fig. 6 a. Obviously, three samples exhibited the binding energy peaks of Ti element. An extra F peak can only be found on TT0 due to the residue F− ions from the HF solution, suggesting its complete removal in the TT550 and TT650 samples, coincided well with EDS results [58]. As shown in Fig. 6b, 8 different peaks can be found in the high resolution Ti 2p, which is in accordance with the previous report of Ti3C2 [59,60]. In contrast, only two main binding energy peaks originating from TiO2 can be observed for TT550 and TT650 (see Fig. 6c); whilst Ti3C2 binding energy peak can hardly be found, which seems to be in contradiction with XRD characterization. This was because XPS technique can only examine the composition of the surface layer (less than 5 nm depth) [61], making it difficult to detect the Ti3C2 sandwiched by TiO2 NPs (ca. 25 nm in size). Furthermore, the C 1s XPS spectrum of TT0 XPS spectrum exhibited three obvious peaks at 286.6, 284.8 and 281.6 eV, designated to COC, CC and CTiOx, respectively. Those were attributed to the Ti3C2 and adventitious carbon (Fig. 6d) [60,62]. After calcination at 550 (Fig. 6e) and 650 °C (Fig. 6f), the peak attributed to CTiOx disappeared, manifesting the decrease in Ti3C2 content [59]. Furthermore, as shown in Fig. 6g–i, the intensity of CTiOx, CTiOHx and CO decreased; meanwhile, intensity of TiO increased with increasing calcination temperature, indicating the transformation of the Ti3C2 into the TiO2. 3.5 Physical and electrochemical properties The nitrogen adsorption-desorption isotherms and corresponding pore-size distribution curves of the prepared samples are shown in Fig. 7 . Obviously, all the prepared samples exhibited type-IV isotherms according to the Brunauer-Deming-Deming-Teller (BDDT) classification, suggesting the presence of mesopores (2–50 nm). The isotherms at the higher relative pressure range (at the range 0.8–1.0) showed H3-type hysteresis loops, indicating the presence of slit-like pores [63]. In addition, high adsorption can also be observed at adsorption range approaching 1.0, demonstrating the presence of large mesopores and macropores. Apparently from the inset of Fig. 7, all the prepared samples manifested a wide range pore distribution from 2 to 100 nm, with a peak at ca. 20 nm, suggesting the presence of mesopores and macropores attributed to the stacking of the Ti3C2 nanosheets and air voids formed between TiO2 NPs. The aforementioned data in easily assimilated form was summarized in Table S1. The specific surface area increased linearly with calcination temperature before 550 °C. This was because in situ growth of TiO2 on Ti3C2 created a lot of air void within the TiO2/Ti3C2 composite. In detail, these air voids were generated by the CO2 evolution during the calcination of the Ti3C2. However, further increase in calcination temperature from 550 to 650 °C reduced the specific surface area. This was because opposite trend of crystallinity and particle size met in an intermediate. The results suggest the importance of precise control of the calcination temperature to optimize the physical property of the TiO2/Ti3C2 composite. Furthermore, the electrochemical surface area (ECSA) characterization can also shed light on the physical properties of the TiO2/Ti3C2 composite. In a typical ECSA test, the surface area of a material is measured through electrochemical double layer capacitance (EDLC) which can be investigated by cyclic voltammetry (CV) (see Fig. S5a and b). As shown in Fig. S5a, TT450, TT550 and TT650 exhibited similar CV curves, suggesting their similar electrochemical properties. However, the Ti3C2 dominated samples (TT0 and TT350) revealed severe polarization (see Fig. S5b). Then, ECSA curves of TT450, TT550 and TT650 were derived from CV curves using the halves of the positive and negative current density differences at the center point of their potential ranges (Fig. S5c). Obviously, ECSA of the prepared samples increased with increasing calcination temperature from 450 °C to 550 °C. The enlarged ECSA was in virtue of air voids, analogous to surface area increment. Additional temperature escalating was detrimental for the ESCA due to the grain coarsening. To investigate the generation and separation efficiency of the photogenerated charge carrier, the photocurrent response test was performed. Prior to the test, the linear sweep voltammetry test (Fig. S6) was carried out to confirm that the bias voltage used was 1.2 V during the photocurrent response test. As shown in Fig. 8 a, without light, photocurrent was indiscernible. Upon light irradiation, TT0 showed no difference because it was mainly constituted by non-semiconducting Ti3C2 (>85 wt%). Nevertheless, as for TT350, TT450, TT550 and TT650, significant photocurrent appeared, indicating that the efficient transfer of excited electrons to the cathode. Notably, these curves can be categorized into two types. Except TT650, other samples displayed similar photocurrent curves (represented by photocurrent curve i in Fig. 8a). Specifically, the photocurrents increased smoothly before levelling off when the light was on. To expound this phenomenon, we tentatively propose the mechanism. The photogenerated electrons on TiO2 preferred to migrate to Ti3C2 before reaching the cathode due to the high electronic conductivity of Ti3C2, achieving spatial separation of electron-hole pairs. Similarly, when turning off the light, the trend of photocurrent declining was stable, indicating the electron reservoir characteristic of the Ti3C2. Namely, the stored electrons on Ti3C2 gradually migrated to the cathode. The accumulation of the photogenerated electrons on Ti3C2 is beneficial for accelerating the multi-electron CO2 reduction reactions, such as: CO2 + 8H+ + 8e− → CH4 + 2H2O, −0.24 V vs. NHE at pH 7. Distinctively, TT650 exhibited a different behavior (see Fig. 8a photocurrent curve ii). On light irradiation, it evinced an anodic photocurrent spike, possibly due to direct migration of the photogenerated electron from TiO2 to the cathode. Afterwards, a reduction in photocurrent was explicit because the photogenerated holes on the TT650 tend to recombine with the photogenerated electrons due to the absence of Ti3C2. Subsequently, the photocurrent of TT650 dropped steeply to 0 after switching off the light. Overall, TT550 exhibited the highest photocurrent density among all the prepared samples, indicating that it had the highest electron-hole photogeneration efficiency and the lowest electron-hole recombination rate. Its superiority was ascribed to complex interplay of several factors: superior photogenerated electron-hole generation ability of TiO2 and suppressed electron-hole recombination rate devoted by highly conductive Ti3C2. Charge carrier migration process was further assessed by the electrochemical impedance spectra (EIS) characterization. The EIS Nyquist plots of the prepared samples are shown in Fig. 8b. Typically, the charge transfer resistance is reflected by the diameter of each semicircle. Obviously, the diameter became larger with increasing calcination temperature, indicating that the samples with higher Ti3C2 content exhibited lower charge transfer resistance. 3.6 Material simulations Furthermore, along with the experimental results, density functional theory (DFT) was employed to provide more insights into the preceding interpretation of the migration of photogenerated electrons from TiO2 to Ti3C2. The schematic atomic structures of the Ti3C2 and TiO2 are illustrated in Fig. 9 a and b. Obviously, a layered structure of Ti3C2 was formed by alternately arranging Ti and C atomic layers. The total and partial densities of states of the Ti3C2 are shown in Fig. 9c. Its conducting feature was authenticated by the overlap of conduction band with Fermi level, E F. E F is an important indicator related to electron accepting ability of a material. Generally, it is defined as follows: (2) E F = E vac - Φ where E vac and Φ are the energy of a stationary electron at vacuum level (assumed as 0 eV) and work function, respectively. The calculated electrostatic potential for the Ti3C2 is exhibited in Fig. 9d, in which the work function of Ti3C2 is 4.46 eV. Therefore, it can be estimated that the Fermi level of the Ti3C2 is located at −4.46 eV vs. vacuum level (−0.04 vs. normal hydrogen electrode (NHE)). To evaluate the charge migration between TiO2 and Ti3C2, the band edges of TiO2 were also estimated through following equations: (3) E VB = χ - E e + 0.5 E g (4) E CB = E VB - E g where χ, E e, E g, E CB and E VB are absolute electronegativity of TiO2 (5.8 eV), energy of free electron on the hydrogen scale (4.5 eV), bandgap of TiO2, conduction band edge position of TiO2 and valence band edge position of TiO2, respectively. The bandgap of the TiO2 was estimated to be 3.09 eV vs. NHE according to DFT simulation (Fig. 9e), in accordance with the light absorption spectrum of the pristine TiO2 (TT650). Based on the above equations, E CB of the TiO2 was calculated to be −0.25 eV vs. NHE, obviously, which was more negative than the Fermi level of the Ti3C2 (−0.04 eV vs. NHE) (see Fig. 9f), indicating that it is feasible for photogenerated electrons to migrate from TiO2 to Ti3C2. Notably, the difference between the conduction band edge position of TiO2 and Fermi level of the Ti3C2 was very small, effectively reducing the energy barrier for electron transfer. Therefore, the photogenerated electrons can easily migrate through the TiO2/Ti3C2 interface, achieving high electron-hole separation efficiency. 3.7 Photocatalytic performance To determine the photocatalytic performance of the TiO2/Ti3C2 composite, we carried out photocatalytic CO2 reduction tests using different samples under light irradiation. The resultant products of photocatalytic CO2 reduction using prepared samples under 1 h light irradiation are shown in Fig. 10 . Obviously, CH4 was the main product for all the prepared samples along with small amounts of CH3OH and C2H5OH. The production of these compounds (CH4, CH3OH and C2H5OH) was thermodynamically feasible because the reduction potential of photogenerated electrons in TiO2 is −0.5 V vs. NHE at pH = 7 (see also Table 1 ) more negative than that of these compounds. Furthermore, the CH4 was the dominant product due to its reduction potential (−0.24 V vs. NHE at pH 7) less negative than that for CH3OH (−0.38 V vs. NHE at pH 7) and C2H5OH (−0.33 V vs. NHE at pH 7). The production of these valuable fuels using the prepared samples indicated the potential of TiO2/Ti3C2 composite in photocatalytic CO2 reduction. The origin of the carbon elements of the hydrocarbon compounds produced by photocatalytic CO2 reduction was confirmed by the isotope tracer analysis involving the photocatalytic reduction of different C-labelling CO2. The isotope tracer analysis was performed through photocatalytic reduction of 12C-labeled CO2 and 13C-labeled CO2 using TT550 using GC–MS. The resultant GC–MS spectra are presented in Fig. 11 . It was apparent that characteristic peaks at m/z = 16.1 (12CH4) and m/z = 17.1 (13CH4) were dominated in the GC–MS spectra of photocatalytic 12C-labeled CO2 and 13C-labeled CO2 reduction, respectively. This result validated that the labelling of the resultant CH4 was consistent with the labelling of the CO2, confirming that CO2 was the origin of the hydrocarbon compounds of the photocatalytic CO2 reduction. Comparison of the photocatalytic CH4 production rate using different prepared samples is shown in Fig. 12 a. CH4 production was difficult to observe for TT0 due to the high content of non-semiconducting Ti3C2. The photocatalytic performance of the prepared samples gradually improved with the rising of calcination temperature up to 550 °C due to an increase in TiO2 content. This was because TiO2 is a high performance photocatalyst for photocatalytic CO2 reduction. However, further raising calcination temperature to 650 °C deteriorated the photocatalytic performance. We owed this to the absence of Ti3C2, which causes rapid electron-hole recombination on TiO2, thereby worsening the photocatalytic performance. Besides, as already noticed, the specific surface area shrinking under high temperature was another important issue. These results reasserted the significance of calcination temperature for optimizing the photocatalytic performance of the TiO2/Ti3C2 composite. Indicator to quantify the improvement is highlighted: photocatalytic CH4 production rate (0.22 μmol h−1) of optimized TiO2/Ti3C2 composite (TT550) was ca. 3.7 times higher than that of commercial TiO2 (P25). In addition, this superior photocatalytic CH4 production performance of the optimized TiO2/Ti3C2 is also comparable with those of previous reported photocatalysts (see Table 2 ). Furthermore, the stability of the best sample TT550 was investigated (Fig. 12b). After 5 cycles, the photocatalytic CH4 production rate of the TT550 did not show pronounced change, indicating its excellent photostability. The in situ diffuse reflectance infrared Fourier transform spectroscopy (DRIFTS) was carried out to determine intermediate products for photocatalytic CO2 reduction using TT550. The DRIFTS characterization was performed under two conditions: dark condition (Fig. 13. C1) and light irradiation (Fig. 13.C2). Initially, under adsorption condition, various DRIFTS peaks of carbonate species can be observed on the DRIFTS spectra of TT550, suggesting its adsorption ability toward CO2 molecules. Over time, the DRIFTS peaks of HCOO, HCHO and CH3O appeared and intensified. It should be pointed out that the characteristic peak of CH4 was undetectable on the C2 part due to the nonpolar property of the CH4 [70,71]. The findings pinpointed that CO2 molecules were firstly adsorbed on the surface of TiO2/Ti3C2 composite and then transformed into assorted intermediate products composed of CH4, HCOO, HCO and CH3O. Based on previous results and discussion, the photocatalytic enhancement mechanism of TiO2/Ti3C2 composite for CO2 reduction is proposed and illustrated in Fig. 14 . Firstly, large specific surface area springing from intriguing morphology should take the credit. It not only ensures abundant surface-active sites, but also promotes CO2 adsorption ability. Secondly, individual components contribute to the comprehensive performance. The light adsorption of the composite is upgraded by the black color nature of Ti3C2, creating photothermal effect. Thirdly, in situ growth on conductive 2D Ti3C2 generates heterogeneous interfaces that can modify native material properties. Unlike weakly-adhered mechanically mixed materials, the intimate contact facilitates the charge carrier migration, achieving efficient electron-hole separation. Moreover, the accumulation of the photogenerated electrons on Ti3C2 is favorable for the multi-electron CO2 reduction reaction. In addition, it should be noted that three main products including CH4 (reduction potential at −0.24 V), C2H5OH (at −0.33 V) and CH3OH (at −0.38 V) can be obtained during the photocatalytic CO2 reduction due to the sufficiently high intrinsic reduction potential (−0.5 V vs. NHE at pH = 7) of the TiO2 (see Table 1). Although the coupling of the Ti3C2 with TiO2 NPs is beneficial for photocatalytic CO2 reduction, we should always keep in mind that an excess of Ti3C2 can cause adverse effect on the photocatalytic performance. An excess of Ti3C2 leads to the light shielding effect. In detail, Ti3C2 would compete with TiO2 NPs to absorb the incident photons, significantly suppressing the photoconversion efficiency of the TiO2 NPs. Therefore, the control over the ratio of TiO2 NPs to Ti3C2 is crucial to achieve optimized photocatalytic performance of the composite. We envisioned a paradigm of material design which can effectively tune this vital ratio. This method is expected to be extended to prepare other MXene/metal oxide composites. 4 Conclusion In summary, the design concept is the in situ growth of TiO2 NPs on the MXene Ti3C2 by a simple calcination method. Strong evidences have demonstrated the successful preparation and modulation on the loading ratio of TiO2 NPs. Since we are interested in investigating the consequences of this unique synthesis, we focus our studies on the ratio and probing its effect on photocatalytic performance. The photocatalytic CH4 production rate of the optimized TiO2/Ti3C2 (TT550) was ca. 2.8 and 3.7 times higher than that of the pure TiO2 (TT650) and P25, respectively. The underlying mechanism is proposed. The electron reservoir characteristic of the Ti3C2 can greatly suppress the electron-hole recombination on TiO2 NPs and enhance the accumulation of electron for multi-electron reaction. Moreover, the intimate contact benefiting from in situ growth is crucial for accelerating the photogenerated electrons transfer from TiO2 to Ti3C2. The large specific surface area of the unique rice crust-like multilayer configuration of TiO2/Ti3C2 composite governs in providing enormous surface-active sites for photocatalytic reaction. We hope that this work can herald the advent for other MXene-based composites for photoconversion applications. Acknowledgement This work was supported by NSFC (21573170, 51320105001, 21433007 and U1705251), Self-determined and Innovative Research Funds of SKLWUT (2017-ZD-4, 2016-KF-17 and 2017-KF-15) and the Natural Science Foundation of Hubei Province of China (No. 2015CFA001). Appendix A Supplementary material Supplementary data associated with this article can be found, in the online version, at https://doi.org/10.1016/j.jcat.2018.03.009. Appendix A Supplementary material Supplementary data 1 References [1] J.X. Low J.G. Yu M. Jaroniec S. Wageh A.A. Al-Ghamdi Heterojunction photocatalysts Adv. Mater. 29 2017 1601694 [2] X. Zhang X.Q. Li D. Zhang N.Q. Su W.T. Yang H.O. Everitt J. Liu Product selectivity in plasmonic photocatalysis for carbon dioxide hydrogenation Nat. Commun. 8 2017 14542 [3] K. Ohkubo Y. Yamazaki T. Nakashima Y. Tamaki K. Koike O. Ishitani Photocatalyses of Ru(II)-Re(I) binuclear complexes connected through two ethylene chains for CO2 reduction J. Catal. 343 2016 278 289 [4] L.Q. Ye X.L. Jin C. Liu C.H. Ding H.Q. Xie K.H. Chu P.K. Wong Thickness-ultrathin and bismuth-rich strategies for BiOBr to enhance photoreduction of CO2 into solar fuels Appl. Catal. B 187 2016 281 290 [5] T.D.C. Nguyen T. Nguyen H.T.T. Mai V.D. Dao M.P. Nguyen V.N. Nguyen Novel photocatalytic conversion of CO2 by vanadium-doped tantalum nitride for valuable solar fuel production J. Catal. 352 2017 67 74 [6] W.L. Yu J.X. Chen T.T. Shang L.F. Chen L. Gu T.Y. Peng Direct Z-scheme g-C3N4/WO3 photocatalyst with atomically defined junction for H2 production Appl. Catal. B 219 2017 693 704 [7] J. Jin J.G. Yu D.P. Guo C. Cui W.K. Ho A hierarchical Z-scheme CdS-WO3 photocatalyst with enhanced CO2 reduction activity Small 11 2015 5262 5271 [8] Q.L. Xu J.G. Yu J. Zhang J.F. Zhang G. Liu Cubic anatase TiO2 nanocrystals with enhanced photocatalytic CO2 reduction activity Chem. Commun. 51 2015 7950 7953 [9] Y. Ma Z. Wang X. Xu J. Wang Review on porous nanomaterials for adsorption and photocatalytic conversion of CO2 Chin. J. Catal. 38 2017 1956 1969 [10] W.L. Yu D.F. Xu T.Y. Peng Enhanced photocatalytic activity of g-C3N4 for selective CO2 reduction to CH3OH via facile coupling of ZnO: a direct Z-scheme mechanism J. Mater. Chem. A 3 2015 19936 19947 [11] K.Z. Qi B. Cheng J.G. Yu W.K. Ho A review on TiO2-based Z-scheme photocatalysts Chin. J. Catal. 38 2017 1936 1955 [12] X.X. Chang T. Wang J.L. Gong CO2 photo-reduction: insights into CO2 activation and reaction on surfaces of photocatalysts Energy Environ. Sci. 9 2016 2177 2196 [13] J.X. Low B. Cheng J.G. Yu Surface modification and enhanced photocatalytic CO2 reduction performance of TiO2: a review Appl. Surf. Sci. 392 2017 658 686 [14] M. Tahir B. Tahir Dynamic photocatalytic reduction of CO2 to CO in a honeycomb monolith reactor loaded with Cu and N doped TiO2 nanocatalysts Appl. Surf. Sci. 377 2016 244 252 [15] H.W. Zhang S. Kawamura M. Tamba T. Kojima M. Yoshiba Y. Izumi Is water more reactive than H2 in photocatalytic CO2 conversion into fuels using semiconductor catalysts under high reaction pressures? J. Catal. 352 2017 452 465 [16] S.W. Cao Y. Li B.C. Zhu M. Jaroniec J.G. Yu Facet effect of Pd cocatalyst on photocatalytic CO2 reduction over g-C3N4 J. Catal. 349 2017 208 217 [17] M. Marszewski S.W. Cao J.G. Yu M. Jaroniec Semiconductor-based photocatalytic CO2 conversion Mater. Horiz. 2 2015 261 278 [18] A. Nikokavoura C. Trapalis Alternative photocatalysts to TiO2 for the photocatalytic reduction of CO2 Appl. Surf. Sci. 391 2017 149 174 [19] Z.Q. He J.T. Tang J. Shen J.M. Chen S. Song Enhancement of photocatalytic reduction of CO2 to CH4 over TiO2 nanosheets by modifying with sulfuric acid Appl. Surf. Sci. 364 2016 416 427 [20] J. Li M. Zhang Q.Y. Li J.J. Yang Enhanced visible light activity on direct contact Z-zcheme g-C3N4-TiO2 photocatalyst Appl. Surf. Sci. 391 2017 184 193 [21] M. Tahir B. Tahir N.A.S. Amin H. Alias Selective photocatalytic reduction of CO2 by H2O/H2 to CH4 and CH3OH over Cu-promoted In2O3/TiO2 nanocatalyst Appl. Surf. Sci. 389 2016 46 55 [22] B.C. Zhu P.F. Xia Y. Li W.K. Ho J.G. Yu Fabrication and photocatalytic activity enhanced mechanism of direct Z-scheme g-C3N4/Ag2WO4 photocatalyst Appl. Surf. Sci. 391 2017 175 183 [23] T.M. Di B.C. Zhu B. Cheng J.G. Yu J.S. Xu A direct Z-scheme g-C3N4/SnS2 photocatalyst with superior visible-light CO2 reduction performance J. Catal. 352 2017 532 541 [24] Z. Xiong Z. Lei C.C. Kuang X.X. Chen B.G. Gong Y.C. Zhao J.Y. Zhang C.G. Zheng J.C.S. Wu Selective photocatalytic reduction of CO2 into CH4 over Pt-Cu2O TiO2 nanocrystals: The interaction between Pt and Cu2O cocatalysts Appl. Catal. B 202 2017 695 703 [25] S. Bera J.E. Lee S.B. Rawal W.I. Lee Size-dependent plasmonic effects of Au and Au@SiO2 nanoparticles in photocatalytic CO2 conversion reaction of Pt/TiO2 Appl. Catal. B 199 2016 55 63 [26] Z.L. Yang J. Lu W.C. Ye C.S. Yu Y.L. Chang Preparation of Pt/TiO2 hollow nanofibers with highly visible light photocatalytic activity Appl. Surf. Sci. 392 2017 472 480 [27] T.D. Pham B.K. Lee Novel photocatalytic activity of Cu@V co-doped TiO2/PU for CO2 reduction with H2O vapor to produce solar fuels under visible light J. Catal. 345 2017 87 95 [28] P.N. Paulino V.M.M. Salim N.S. Resende Zn-Cu promoted TiO2 photocatalyst for CO2 reduction with H2O under UV light Appl. Catal. B 185 2016 362 370 [29] M.T. Wang D.K. Wang Z.H. Li Self-assembly of CPO-27-Mg/TiO2 nanocomposite with enhanced performance for photocatalytic CO2 reduction Appl. Catal. B 183 2016 47 52 [30] M.S. Akple J. Low S.W. Liu B. Cheng J.G. Yu W.K. Ho Fabrication and enhanced CO2 reduction performance of N-self-doped TiO2 microsheet photocatalyst by bi-cocatalyst modification J. CO2 Util. 16 2016 442 449 [31] J.X. Low S.Q. Qiu D.F. Xu C.J. Jiang B. Cheng Direct evidence and enhancement of surface plasmon resonance effect on Ag-loaded TiO2 nanotube arrays for photocatalytic CO2 reduction Appl. Surf. Sci. 434 2018 423 432 [32] J.X. Low J.G. Yu W.K. Ho Graphene-based photocatalysts for CO2 reduction to solar fuel J. Phys. Chem. Lett. 6 2015 4244 4251 [33] S. Kawamura H.W. Zhang M. Tamba T. Kojima M. Miyano Y. Yoshida M. Yoshiba Y. Izumi Efficient volcano-type dependence of photocatalytic CO2 conversion into methane using hydrogen at reaction pressures up to 0.80 MPa J. Catal. 345 2017 39 52 [34] P. Kar S. Farsinezhad N. Mahdi Y. Zhang U. Obuekwe H. Sharma J. Shen N. Semagina K. Shankar Enhanced CH4 yield by photocatalytic CO2 reduction using TiO2 nanotube arrays grafted with Au, Ru, and ZnPd nanoparticles Nano Res. 9 2016 3478 3493 [35] F. Bonaccorso L. Colombo G.H. Yu M. Stoller V. Tozzini A.C. Ferrari R.S. Ruoff V. Pellegrini Graphene, related two-dimensional crystals, and hybrid systems for energy conversion and storage Science 347 2015 1246501 [36] N. Zhang M.Q. Yang S.Q. Liu Y.G. Sun Y.J. Xu Waltzing with the versatile platform of graphene to synthesize composite photocatalysts Chem. Rev. 115 2015 10307 10377 [37] J. Fu B. Zhu C. Jiang B. Cheng W. You J. Yu Hierarchical porous O-doped g-C3N4 with enhanced photocatalytic CO2 reduction activity Small 13 2017 1603938 [38] M. Naguib M. Kurtoglu V. Presser J. Lu J.J. Niu M. Heon L. Hultman Y. Gogotsi M.W. Barsoum Two-dimensional nanocrystals produced by exfoliation of Ti3AlC2 Adv. Mater. 23 2011 4248 4253 [39] G.R. Berdiyorov K.A. Mahmoud Effect of surface termination on ion intercalation selectivity of bilayer Ti3C2T2 (T = F, O and OH) MXene Appl. Surf. Sci. 416 2017 725 730 [40] M. Naguib V.N. Mochalin M.W. Barsoum Y. Gogotsi MXenes: a new family of two-dimensional materials Adv. Mater. 26 2014 992 1005 [41] M. Naguib O. Mashtalir J. Carle V. Presser J. Lu L. Hultman Y. Gogotsi M.W. Barsoum Two-dimensional transition metal carbides ACS Nano 6 2012 1322 1331 [42] M. Ghidiu M.R. Lukatskaya M.Q. Zhao Y. Gogotsi M.W. Barsoum Conductive two-dimensional titanium carbide 'clay' with high volumetric capacitance Nature 516 2014 78 82 [43] Q. Tang Z. Zhou Graphene-analogous low-dimensional materials Prog. Mater Sci. 58 2013 1244 1315 [44] F.F. Liu A.G. Zhou J.F. Chen J. Jin W.J. Zhou L.B. Wang Q.K. Hu Preparation of Ti3C2 and Ti2C MXenes by fluoride salts etching and methane adsorptive properties Appl. Surf. Sci. 416 2017 781 789 [45] J.R. Ran G.P. Gao F.T. Li T.Y. Ma A.J. Du S.Z. Qiao Ti3C2 MXene co-catalyst on metal sulfide photo-absorbers for enhanced visible-light photocatalytic hydrogen production Nat. Commun. 8 2017 13907 [46] H. Ghassemi W. Harlow O. Mashtalir M. Beidaghi M.R. Lukatskaya Y. Gogotsi M.L. Taheri In situ environmental transmission electron microscopy study of oxidation of two-dimensional Ti3C2 and formation of carbon-supported TiO2 J. Mater. Chem. A 2 2014 14339 14343 [47] O. Mashtalir M. Naguib V.N. Mochalin Y. Dall'Agnese M. Heon M.W. Barsoum Y. Gogotsi Intercalation and delamination of layered carbides and carbonitrides Nat. Commun. 4 2013 1716 [48] D.D. Sun M.S. Wang Z.Y. Li G.X. Fan L.Z. Fan A.G. Zhou Two-dimensional Ti3C2 as anode material for Li-ion batteries Electrochem. Commun. 47 2014 80 83 [49] M. Segall P.J. Lindan M.A. Probert C. Pickard P.J. Hasnip S. Clark M. Payne First-principles simulation: ideas, illustrations and the CASTEP code J. Phys.: Condens. Matter 14 2002 2717 2744 [50] J.P. Perdew K. Burke M. Ernzerhof Generalized gradient approximation made simple Phys. Rev. Lett. 77 1996 3865 3868 [51] S. Grimme Accurate description of van der Waals complexes by density functional theory including empirical corrections J. Comput. Chem. 25 2004 1463 1473 [52] X.Q. Zhao M. Liu Y. Chen B. Hou N. Zhang B.B. Chen N. Yang K. Chen J.L. Li L.A. An Fabrication of layered Ti3C2 with an accordion-like structure as a potential cathode material for high performance lithium-sulfur batteries J. Mater. Chem. A 3 2015 7870 7876 [53] J.F. Zhu Y. Tang C.H. Yang F. Wang M.J. Cao Composites of TiO2 nanoparticles deposited on Ti3C2 MXene nanosheets with enhanced electrochemical performance J. Electrochem. Soc. 163 2016 A785 A791 [54] M.K. Han X.W. Yin H. Wu Z.X. Hou C.Q. Song X.L. Li L.T. Zhang L.F. Cheng Ti3C2 MXenes with modified surface for high-performance electromagnetic absorption and shielding in the X-band ACS Appl. Mater. Interfaces 8 2016 21011 21019 [55] M.M. Hu Z.J. Li T. Hu S.H. Zhu C. Zhang X.H. Wang High-capacitance mechanism for Ti3C2TX MXene by in situ electrochemical Raman spectroscopy investigation ACS Nano 10 2016 11344 11350 [56] Y. Yang S. Umrao S. Lai S. Lee Large-area highly conductive transparent two-dimensional Ti2CTx Film J. Phys. Chem. Lett. 8 2017 859 865 [57] J.G. Yu J. Jin B. Cheng M. Jaroniec A noble metal-free reduced graphene oxide-CdS nanorod composite for the enhanced visible-light photocatalytic reduction of CO2 to solar fuel J. Mater. Chem. A 2 2014 3407 3416 [58] J.G. Yu J.X. Low W. Xiao P. Zhou M. Jaroniec Enhanced photocatalytic CO2-reduction activity of anatase TiO2 by coexposed {001} and {101} facets J. Am. Chem. Soc. 136 2014 8839 8842 [59] S.A. Shah T. Habib H. Gao P. Gao W. Sun M.J. Green M. Radovic Template-free 3D titanium carbide (Ti3C2Tx) MXene particles crumpled by capillary forces Chem. Commun. 53 2017 400 403 [60] J. Halim K.M. Cook M. Naguib P. Eklund Y. Gogotsi J. Rosen M.W. Barsoum X-ray photoelectron spectroscopy of select multi-layered transition metal carbides (MXenes) Appl. Surf. Sci. 362 2016 406 417 [61] S. Kerber T. Barr G. Mann W. Brantley E. Papazoglou J. Mitchell The complementary nature of X-ray photoelectron spectroscopy and angle-resolved X-ray diffraction Part I: Background and theory J. Mater. Eng. Perform. 7 1998 329 333 [62] J. Chastain R.C. King J. Moulder Handbook of X-ray photoelectron spectroscopy: a reference book of standard spectra for identification and interpretation of XPS data 1992 Physical Electronics Division, Perkin-Elmer Corporation Eden Prairie Minnesota [63] J.X. Low J.G. Yu Q. Li B. Cheng Enhanced visible-light photocatalytic activity of plasmonic Ag and graphene co-modified Bi2WO6 nanosheets Phys. Chem. Chem. Phys. 16 2014 1111 1120 [64] K. Wang Q. Li B.S. Liu B. Cheng W.K. Ho J.G. Yu Sulfur-doped g-C3N4 with enhanced photocatalytic CO2-reduction performance Appl. Catal. B 176 2015 44 52 [65] Y. Zhou Z.P. Tian Z.Y. Zhao Q. Liu J.H. Kou X.Y. Chen J. Gao S.C. Yan Z.G. Zou High-yield synthesis of ultrathin and uniform Bi2WO6 square nanoplates benefitting from photocatalytic reduction of CO2 into renewable hydrocarbon fuel under visible light ACS Appl. Mater. Interfaces 3 2011 3594 3601 [66] T. Wang X.G. Meng G.G. Liu K. Chang P. Li Q. Kang L.Q. Liu M. Li S.X. Ouyang J.H. Ye In situ synthesis of ordered mesoporous Co-doped TiO2 and its enhanced photocatalytic activity and selectivity for the reduction of CO2 J. Mater. Chem. A 3 2015 9491 9501 [67] M. Manzanares C. Fabrega J.O. Osso L.F. Vega T. Andreu J.R. Morante Engineering the TiO2 outermost layers using magnesium for carbon dioxide photoreduction Appl. Catal. B 150 2014 57 62 [68] W.G. Tu Y. Zhou H.J. Li P. Li Z.G. Zou Au@TiO2 yolk-shell hollow spheres for plasmon-induced photocatalytic reduction of CO2 to solar fuel via a local electromagnetic field Nanoscale 7 2015 14232 14236 [69] S.W. Liu J.Q. Xia J.G. Yu Amine-functionalized titanate nanosheet-assembled yolk@shell microspheres for efficient cocatalyst-free visible-light photocatalytic CO2 reduction ACS Appl. Mater. Interfaces 7 2015 8166 8175 [70] W.K. Wang D.F. Xu B. Cheng J.G. Yu C.J. Jiang Hybrid carbon@TiO2 hollow spheres with enhanced photocatalytic CO2 reduction activity J. Mater. Chem. A 5 2017 5020 5029 [71] P.F. Xia B.C. Zhu J.G. Yu S.W. Cao M. Jaroniec Ultra-thin nanosheet assemblies of graphitic carbon nitride for enhanced photocatalytic CO2 reduction J. Mater. Chem. A 5 2017 3230 3238",
      "scopus-id": "85044442673",
      "coredata": {
        "eid": "1-s2.0-S002195171830109X",
        "dc:description": "Photocatalytic CO2 reduction for solar fuel production has received enormous attention due to its ability for solving both energy crisis and CO2 pollution. However, fabrication of cheap and efficient materials for photocatalytic CO2 reduction is still challenging. Herein, TiO2 nanoparticles (NPs) in situ grew on highly conductive MXene Ti3C2 through calcination method. And a unique rice crust-like structure was achieved through the uniform distribution of TiO2 nanoparticles on Ti3C2. This optimized TiO2/Ti3C2 composite exhibited a 3.7 times higher photocatalytic CO2 reduction performance for CH4-production (0.22 μmol h−1) than commercial TiO2 (P25). The detailed photocatalytic CO2 reduction mechanism using TiO2/Ti3C2 was confirmed through the 13CO2 isotopic test and in situ diffuse reflectance infrared Fourier transform spectroscopy. Experimental evidence along with preliminary calculation was also used to further elucidate the proposed photocatalytic enhancement mechanism. This extraordinary photocatalytic performance was due to the unique morphology and the features of individual components in the composite. Namely, fluffy rice crust-like structure of the prepared samples rendered the composite with large population of the surface-active sites. Ultrahigh conductivity of Ti3C2 facilitated the photogenerated electron transfer and suppressed its recombination with photogenerated holes. This work presents a simple method to prepare highly efficient TiO2/Ti3C2 composite for photoconversion applications.",
        "openArchiveArticle": "false",
        "prism:coverDate": "2018-05-31",
        "openaccessUserLicense": null,
        "prism:aggregationType": "Journal",
        "prism:url": "https://api.elsevier.com/content/article/pii/S002195171830109X",
        "dc:creator": [
          {
            "@_fa": "true",
            "$": "Low, Jingxiang"
          },
          {
            "@_fa": "true",
            "$": "Zhang, Liuyang"
          },
          {
            "@_fa": "true",
            "$": "Tong, Tong"
          },
          {
            "@_fa": "true",
            "$": "Shen, Baojia"
          },
          {
            "@_fa": "true",
            "$": "Yu, Jiaguo"
          }
        ],
        "link": [
          {
            "@_fa": "true",
            "@rel": "self",
            "@href": "https://api.elsevier.com/content/article/pii/S002195171830109X"
          },
          {
            "@_fa": "true",
            "@rel": "scidir",
            "@href": "https://www.sciencedirect.com/science/article/pii/S002195171830109X"
          }
        ],
        "dc:format": "application/json",
        "openaccessType": null,
        "pii": "S0021-9517(18)30109-X",
        "prism:volume": "361",
        "prism:publisher": "Elsevier Inc.",
        "dc:title": "TiO2/MXene Ti3C2 composite with excellent photocatalytic CO2 reduction activity",
        "prism:copyright": "© 2018 Elsevier Inc. All rights reserved.",
        "openaccess": "0",
        "prism:issn": "00219517",
        "dcterms:subject": [
          {
            "@_fa": "true",
            "$": "MXenes"
          },
          {
            "@_fa": "true",
            "$": "Ti3C2"
          },
          {
            "@_fa": "true",
            "$": "TiO2"
          },
          {
            "@_fa": "true",
            "$": "Photocatalysis"
          },
          {
            "@_fa": "true",
            "$": "CO2 reduction"
          }
        ],
        "openaccessArticle": "false",
        "prism:publicationName": "Journal of Catalysis",
        "openaccessSponsorType": null,
        "prism:pageRange": "255-266",
        "prism:endingPage": "266",
        "pubType": "fla",
        "prism:coverDisplayDate": "May 2018",
        "prism:doi": "10.1016/j.jcat.2018.03.009",
        "prism:startingPage": "255",
        "dc:identifier": "doi:10.1016/j.jcat.2018.03.009",
        "openaccessSponsorName": null
      },
      "objects": {
        "object": [
          {
            "@category": "standard",
            "@height": "200",
            "@width": "325",
            "@_fa": "true",
            "$": "https://api.elsevier.com/content/object/eid/1-s2.0-S002195171830109X-fx1.jpg?httpAccept=%2A%2F%2A",
            "@multimediatype": "JPEG image file",
            "@type": "IMAGE-DOWNSAMPLED",
            "@size": "33001",
            "@ref": "fx1",
            "@mimetype": "image/jpeg"
          },
          {
            "@category": "standard",
            "@height": "506",
            "@width": "316",
            "@_fa": "true",
            "$": "https://api.elsevier.com/content/object/eid/1-s2.0-S002195171830109X-gr1.jpg?httpAccept=%2A%2F%2A",
            "@multimediatype": "JPEG image file",
            "@type": "IMAGE-DOWNSAMPLED",
            "@size": "61361",
            "@ref": "gr1",
            "@mimetype": "image/jpeg"
          },
          {
            "@category": "standard",
            "@height": "291",
            "@width": "366",
            "@_fa": "true",
            "$": "https://api.elsevier.com/content/object/eid/1-s2.0-S002195171830109X-gr10.jpg?httpAccept=%2A%2F%2A",
            "@multimediatype": "JPEG image file",
            "@type": "IMAGE-DOWNSAMPLED",
            "@size": "23471",
            "@ref": "gr10",
            "@mimetype": "image/jpeg"
          },
          {
            "@category": "standard",
            "@height": "323",
            "@width": "311",
            "@_fa": "true",
            "$": "https://api.elsevier.com/content/object/eid/1-s2.0-S002195171830109X-gr11.jpg?httpAccept=%2A%2F%2A",
            "@multimediatype": "JPEG image file",
            "@type": "IMAGE-DOWNSAMPLED",
            "@size": "12936",
            "@ref": "gr11",
            "@mimetype": "image/jpeg"
          },
          {
            "@category": "standard",
            "@height": "264",
            "@width": "719",
            "@_fa": "true",
            "$": "https://api.elsevier.com/content/object/eid/1-s2.0-S002195171830109X-gr12.jpg?httpAccept=%2A%2F%2A",
            "@multimediatype": "JPEG image file",
            "@type": "IMAGE-DOWNSAMPLED",
            "@size": "35730",
            "@ref": "gr12",
            "@mimetype": "image/jpeg"
          },
          {
            "@category": "standard",
            "@height": "272",
            "@width": "365",
            "@_fa": "true",
            "$": "https://api.elsevier.com/content/object/eid/1-s2.0-S002195171830109X-gr13.jpg?httpAccept=%2A%2F%2A",
            "@multimediatype": "JPEG image file",
            "@type": "IMAGE-DOWNSAMPLED",
            "@size": "49633",
            "@ref": "gr13",
            "@mimetype": "image/jpeg"
          },
          {
            "@category": "standard",
            "@height": "300",
            "@width": "542",
            "@_fa": "true",
            "$": "https://api.elsevier.com/content/object/eid/1-s2.0-S002195171830109X-gr14.jpg?httpAccept=%2A%2F%2A",
            "@multimediatype": "JPEG image file",
            "@type": "IMAGE-DOWNSAMPLED",
            "@size": "71170",
            "@ref": "gr14",
            "@mimetype": "image/jpeg"
          },
          {
            "@category": "standard",
            "@height": "285",
            "@width": "363",
            "@_fa": "true",
            "$": "https://api.elsevier.com/content/object/eid/1-s2.0-S002195171830109X-gr2.jpg?httpAccept=%2A%2F%2A",
            "@multimediatype": "JPEG image file",
            "@type": "IMAGE-DOWNSAMPLED",
            "@size": "29854",
            "@ref": "gr2",
            "@mimetype": "image/jpeg"
          },
          {
            "@category": "standard",
            "@height": "701",
            "@width": "542",
            "@_fa": "true",
            "$": "https://api.elsevier.com/content/object/eid/1-s2.0-S002195171830109X-gr3.jpg?httpAccept=%2A%2F%2A",
            "@multimediatype": "JPEG image file",
            "@type": "IMAGE-DOWNSAMPLED",
            "@size": "172260",
            "@ref": "gr3",
            "@mimetype": "image/jpeg"
          },
          {
            "@category": "standard",
            "@height": "236",
            "@width": "587",
            "@_fa": "true",
            "$": "https://api.elsevier.com/content/object/eid/1-s2.0-S002195171830109X-gr4.jpg?httpAccept=%2A%2F%2A",
            "@multimediatype": "JPEG image file",
            "@type": "IMAGE-DOWNSAMPLED",
            "@size": "64676",
            "@ref": "gr4",
            "@mimetype": "image/jpeg"
          },
          {
            "@category": "standard",
            "@height": "263",
            "@width": "320",
            "@_fa": "true",
            "$": "https://api.elsevier.com/content/object/eid/1-s2.0-S002195171830109X-gr5.jpg?httpAccept=%2A%2F%2A",
            "@multimediatype": "JPEG image file",
            "@type": "IMAGE-DOWNSAMPLED",
            "@size": "23248",
            "@ref": "gr5",
            "@mimetype": "image/jpeg"
          },
          {
            "@category": "standard",
            "@height": "573",
            "@width": "711",
            "@_fa": "true",
            "$": "https://api.elsevier.com/content/object/eid/1-s2.0-S002195171830109X-gr6.jpg?httpAccept=%2A%2F%2A",
            "@multimediatype": "JPEG image file",
            "@type": "IMAGE-DOWNSAMPLED",
            "@size": "143924",
            "@ref": "gr6",
            "@mimetype": "image/jpeg"
          },
          {
            "@category": "standard",
            "@height": "284",
            "@width": "367",
            "@_fa": "true",
            "$": "https://api.elsevier.com/content/object/eid/1-s2.0-S002195171830109X-gr7.jpg?httpAccept=%2A%2F%2A",
            "@multimediatype": "JPEG image file",
            "@type": "IMAGE-DOWNSAMPLED",
            "@size": "43751",
            "@ref": "gr7",
            "@mimetype": "image/jpeg"
          },
          {
            "@category": "standard",
            "@height": "280",
            "@width": "643",
            "@_fa": "true",
            "$": "https://api.elsevier.com/content/object/eid/1-s2.0-S002195171830109X-gr8.jpg?httpAccept=%2A%2F%2A",
            "@multimediatype": "JPEG image file",
            "@type": "IMAGE-DOWNSAMPLED",
            "@size": "53042",
            "@ref": "gr8",
            "@mimetype": "image/jpeg"
          },
          {
            "@category": "standard",
            "@height": "919",
            "@width": "573",
            "@_fa": "true",
            "$": "https://api.elsevier.com/content/object/eid/1-s2.0-S002195171830109X-gr9.jpg?httpAccept=%2A%2F%2A",
            "@multimediatype": "JPEG image file",
            "@type": "IMAGE-DOWNSAMPLED",
            "@size": "123931",
            "@ref": "gr9",
            "@mimetype": "image/jpeg"
          },
          {
            "@category": "thumbnail",
            "@height": "135",
            "@width": "219",
            "@_fa": "true",
            "$": "https://api.elsevier.com/content/object/eid/1-s2.0-S002195171830109X-fx1.sml?httpAccept=%2A%2F%2A",
            "@multimediatype": "GIF image file",
            "@type": "IMAGE-THUMBNAIL",
            "@size": "20527",
            "@ref": "fx1",
            "@mimetype": "image/gif"
          },
          {
            "@category": "thumbnail",
            "@height": "163",
            "@width": "102",
            "@_fa": "true",
            "$": "https://api.elsevier.com/content/object/eid/1-s2.0-S002195171830109X-gr1.sml?httpAccept=%2A%2F%2A",
            "@multimediatype": "GIF image file",
            "@type": "IMAGE-THUMBNAIL",
            "@size": "8264",
            "@ref": "gr1",
            "@mimetype": "image/gif"
          },
          {
            "@category": "thumbnail",
            "@height": "164",
            "@width": "206",
            "@_fa": "true",
            "$": "https://api.elsevier.com/content/object/eid/1-s2.0-S002195171830109X-gr10.sml?httpAccept=%2A%2F%2A",
            "@multimediatype": "GIF image file",
            "@type": "IMAGE-THUMBNAIL",
            "@size": "7987",
            "@ref": "gr10",
            "@mimetype": "image/gif"
          },
          {
            "@category": "thumbnail",
            "@height": "164",
            "@width": "158",
            "@_fa": "true",
            "$": "https://api.elsevier.com/content/object/eid/1-s2.0-S002195171830109X-gr11.sml?httpAccept=%2A%2F%2A",
            "@multimediatype": "GIF image file",
            "@type": "IMAGE-THUMBNAIL",
            "@size": "4226",
            "@ref": "gr11",
            "@mimetype": "image/gif"
          },
          {
            "@category": "thumbnail",
            "@height": "80",
            "@width": "219",
            "@_fa": "true",
            "$": "https://api.elsevier.com/content/object/eid/1-s2.0-S002195171830109X-gr12.sml?httpAccept=%2A%2F%2A",
            "@multimediatype": "GIF image file",
            "@type": "IMAGE-THUMBNAIL",
            "@size": "5179",
            "@ref": "gr12",
            "@mimetype": "image/gif"
          },
          {
            "@category": "thumbnail",
            "@height": "163",
            "@width": "219",
            "@_fa": "true",
            "$": "https://api.elsevier.com/content/object/eid/1-s2.0-S002195171830109X-gr13.sml?httpAccept=%2A%2F%2A",
            "@multimediatype": "GIF image file",
            "@type": "IMAGE-THUMBNAIL",
            "@size": "18705",
            "@ref": "gr13",
            "@mimetype": "image/gif"
          },
          {
            "@category": "thumbnail",
            "@height": "121",
            "@width": "219",
            "@_fa": "true",
            "$": "https://api.elsevier.com/content/object/eid/1-s2.0-S002195171830109X-gr14.sml?httpAccept=%2A%2F%2A",
            "@multimediatype": "GIF image file",
            "@type": "IMAGE-THUMBNAIL",
            "@size": "19289",
            "@ref": "gr14",
            "@mimetype": "image/gif"
          },
          {
            "@category": "thumbnail",
            "@height": "164",
            "@width": "209",
            "@_fa": "true",
            "$": "https://api.elsevier.com/content/object/eid/1-s2.0-S002195171830109X-gr2.sml?httpAccept=%2A%2F%2A",
            "@multimediatype": "GIF image file",
            "@type": "IMAGE-THUMBNAIL",
            "@size": "11309",
            "@ref": "gr2",
            "@mimetype": "image/gif"
          },
          {
            "@category": "thumbnail",
            "@height": "163",
            "@width": "126",
            "@_fa": "true",
            "$": "https://api.elsevier.com/content/object/eid/1-s2.0-S002195171830109X-gr3.sml?httpAccept=%2A%2F%2A",
            "@multimediatype": "GIF image file",
            "@type": "IMAGE-THUMBNAIL",
            "@size": "17043",
            "@ref": "gr3",
            "@mimetype": "image/gif"
          },
          {
            "@category": "thumbnail",
            "@height": "88",
            "@width": "219",
            "@_fa": "true",
            "$": "https://api.elsevier.com/content/object/eid/1-s2.0-S002195171830109X-gr4.sml?httpAccept=%2A%2F%2A",
            "@multimediatype": "GIF image file",
            "@type": "IMAGE-THUMBNAIL",
            "@size": "16186",
            "@ref": "gr4",
            "@mimetype": "image/gif"
          },
          {
            "@category": "thumbnail",
            "@height": "164",
            "@width": "199",
            "@_fa": "true",
            "$": "https://api.elsevier.com/content/object/eid/1-s2.0-S002195171830109X-gr5.sml?httpAccept=%2A%2F%2A",
            "@multimediatype": "GIF image file",
            "@type": "IMAGE-THUMBNAIL",
            "@size": "9836",
            "@ref": "gr5",
            "@mimetype": "image/gif"
          },
          {
            "@category": "thumbnail",
            "@height": "164",
            "@width": "203",
            "@_fa": "true",
            "$": "https://api.elsevier.com/content/object/eid/1-s2.0-S002195171830109X-gr6.sml?httpAccept=%2A%2F%2A",
            "@multimediatype": "GIF image file",
            "@type": "IMAGE-THUMBNAIL",
            "@size": "15805",
            "@ref": "gr6",
            "@mimetype": "image/gif"
          },
          {
            "@category": "thumbnail",
            "@height": "164",
            "@width": "212",
            "@_fa": "true",
            "$": "https://api.elsevier.com/content/object/eid/1-s2.0-S002195171830109X-gr7.sml?httpAccept=%2A%2F%2A",
            "@multimediatype": "GIF image file",
            "@type": "IMAGE-THUMBNAIL",
            "@size": "13191",
            "@ref": "gr7",
            "@mimetype": "image/gif"
          },
          {
            "@category": "thumbnail",
            "@height": "95",
            "@width": "219",
            "@_fa": "true",
            "$": "https://api.elsevier.com/content/object/eid/1-s2.0-S002195171830109X-gr8.sml?httpAccept=%2A%2F%2A",
            "@multimediatype": "GIF image file",
            "@type": "IMAGE-THUMBNAIL",
            "@size": "8161",
            "@ref": "gr8",
            "@mimetype": "image/gif"
          },
          {
            "@category": "thumbnail",
            "@height": "164",
            "@width": "102",
            "@_fa": "true",
            "$": "https://api.elsevier.com/content/object/eid/1-s2.0-S002195171830109X-gr9.sml?httpAccept=%2A%2F%2A",
            "@multimediatype": "GIF image file",
            "@type": "IMAGE-THUMBNAIL",
            "@size": "8113",
            "@ref": "gr9",
            "@mimetype": "image/gif"
          },
          {
            "@category": "high",
            "@height": "531",
            "@width": "863",
            "@_fa": "true",
            "$": "https://api.elsevier.com/content/object/eid/1-s2.0-S002195171830109X-fx1_lrg.jpg?httpAccept=%2A%2F%2A",
            "@multimediatype": "JPEG image file",
            "@type": "IMAGE-HIGH-RES",
            "@size": "112574",
            "@ref": "fx1",
            "@mimetype": "image/jpeg"
          },
          {
            "@category": "high",
            "@height": "1343",
            "@width": "839",
            "@_fa": "true",
            "$": "https://api.elsevier.com/content/object/eid/1-s2.0-S002195171830109X-gr1_lrg.jpg?httpAccept=%2A%2F%2A",
            "@multimediatype": "JPEG image file",
            "@type": "IMAGE-HIGH-RES",
            "@size": "185337",
            "@ref": "gr1",
            "@mimetype": "image/jpeg"
          },
          {
            "@category": "high",
            "@height": "774",
            "@width": "973",
            "@_fa": "true",
            "$": "https://api.elsevier.com/content/object/eid/1-s2.0-S002195171830109X-gr10_lrg.jpg?httpAccept=%2A%2F%2A",
            "@multimediatype": "JPEG image file",
            "@type": "IMAGE-HIGH-RES",
            "@size": "73875",
            "@ref": "gr10",
            "@mimetype": "image/jpeg"
          },
          {
            "@category": "high",
            "@height": "859",
            "@width": "827",
            "@_fa": "true",
            "$": "https://api.elsevier.com/content/object/eid/1-s2.0-S002195171830109X-gr11_lrg.jpg?httpAccept=%2A%2F%2A",
            "@multimediatype": "JPEG image file",
            "@type": "IMAGE-HIGH-RES",
            "@size": "42234",
            "@ref": "gr11",
            "@mimetype": "image/jpeg"
          },
          {
            "@category": "high",
            "@height": "702",
            "@width": "1910",
            "@_fa": "true",
            "$": "https://api.elsevier.com/content/object/eid/1-s2.0-S002195171830109X-gr12_lrg.jpg?httpAccept=%2A%2F%2A",
            "@multimediatype": "JPEG image file",
            "@type": "IMAGE-HIGH-RES",
            "@size": "105909",
            "@ref": "gr12",
            "@mimetype": "image/jpeg"
          },
          {
            "@category": "high",
            "@height": "727",
            "@width": "977",
            "@_fa": "true",
            "$": "https://api.elsevier.com/content/object/eid/1-s2.0-S002195171830109X-gr13_lrg.jpg?httpAccept=%2A%2F%2A",
            "@multimediatype": "JPEG image file",
            "@type": "IMAGE-HIGH-RES",
            "@size": "169610",
            "@ref": "gr13",
            "@mimetype": "image/jpeg"
          },
          {
            "@category": "high",
            "@height": "797",
            "@width": "1441",
            "@_fa": "true",
            "$": "https://api.elsevier.com/content/object/eid/1-s2.0-S002195171830109X-gr14_lrg.jpg?httpAccept=%2A%2F%2A",
            "@multimediatype": "JPEG image file",
            "@type": "IMAGE-HIGH-RES",
            "@size": "229765",
            "@ref": "gr14",
            "@mimetype": "image/jpeg"
          },
          {
            "@category": "high",
            "@height": "756",
            "@width": "964",
            "@_fa": "true",
            "$": "https://api.elsevier.com/content/object/eid/1-s2.0-S002195171830109X-gr2_lrg.jpg?httpAccept=%2A%2F%2A",
            "@multimediatype": "JPEG image file",
            "@type": "IMAGE-HIGH-RES",
            "@size": "96280",
            "@ref": "gr2",
            "@mimetype": "image/jpeg"
          },
          {
            "@category": "high",
            "@height": "1865",
            "@width": "1441",
            "@_fa": "true",
            "$": "https://api.elsevier.com/content/object/eid/1-s2.0-S002195171830109X-gr3_lrg.jpg?httpAccept=%2A%2F%2A",
            "@multimediatype": "JPEG image file",
            "@type": "IMAGE-HIGH-RES",
            "@size": "640022",
            "@ref": "gr3",
            "@mimetype": "image/jpeg"
          },
          {
            "@category": "high",
            "@height": "628",
            "@width": "1559",
            "@_fa": "true",
            "$": "https://api.elsevier.com/content/object/eid/1-s2.0-S002195171830109X-gr4_lrg.jpg?httpAccept=%2A%2F%2A",
            "@multimediatype": "JPEG image file",
            "@type": "IMAGE-HIGH-RES",
            "@size": "243787",
            "@ref": "gr4",
            "@mimetype": "image/jpeg"
          },
          {
            "@category": "high",
            "@height": "764",
            "@width": "928",
            "@_fa": "true",
            "$": "https://api.elsevier.com/content/object/eid/1-s2.0-S002195171830109X-gr5_lrg.jpg?httpAccept=%2A%2F%2A",
            "@multimediatype": "JPEG image file",
            "@type": "IMAGE-HIGH-RES",
            "@size": "86010",
            "@ref": "gr5",
            "@mimetype": "image/jpeg"
          },
          {
            "@category": "high",
            "@height": "1523",
            "@width": "1890",
            "@_fa": "true",
            "$": "https://api.elsevier.com/content/object/eid/1-s2.0-S002195171830109X-gr6_lrg.jpg?httpAccept=%2A%2F%2A",
            "@multimediatype": "JPEG image file",
            "@type": "IMAGE-HIGH-RES",
            "@size": "466124",
            "@ref": "gr6",
            "@mimetype": "image/jpeg"
          },
          {
            "@category": "high",
            "@height": "775",
            "@width": "1002",
            "@_fa": "true",
            "$": "https://api.elsevier.com/content/object/eid/1-s2.0-S002195171830109X-gr7_lrg.jpg?httpAccept=%2A%2F%2A",
            "@multimediatype": "JPEG image file",
            "@type": "IMAGE-HIGH-RES",
            "@size": "160370",
            "@ref": "gr7",
            "@mimetype": "image/jpeg"
          },
          {
            "@category": "high",
            "@height": "744",
            "@width": "1708",
            "@_fa": "true",
            "$": "https://api.elsevier.com/content/object/eid/1-s2.0-S002195171830109X-gr8_lrg.jpg?httpAccept=%2A%2F%2A",
            "@multimediatype": "JPEG image file",
            "@type": "IMAGE-HIGH-RES",
            "@size": "171771",
            "@ref": "gr8",
            "@mimetype": "image/jpeg"
          },
          {
            "@category": "high",
            "@height": "2442",
            "@width": "1523",
            "@_fa": "true",
            "$": "https://api.elsevier.com/content/object/eid/1-s2.0-S002195171830109X-gr9_lrg.jpg?httpAccept=%2A%2F%2A",
            "@multimediatype": "JPEG image file",
            "@type": "IMAGE-HIGH-RES",
            "@size": "368631",
            "@ref": "gr9",
            "@mimetype": "image/jpeg"
          },
          {
            "@category": "standard",
            "@_fa": "true",
            "$": "https://api.elsevier.com/content/object/eid/1-s2.0-S002195171830109X-mmc1.docx?httpAccept=%2A%2F%2A",
            "@multimediatype": "Microsoft Word file",
            "@type": "APPLICATION",
            "@size": "1406146",
            "@ref": "mmc1",
            "@mimetype": "application/word"
          },
          {
            "@category": "thumbnail",
            "@height": "17",
            "@width": "273",
            "@_fa": "true",
            "$": "https://api.elsevier.com/content/object/eid/1-s2.0-S002195171830109X-si1.gif?httpAccept=%2A%2F%2A",
            "@multimediatype": "GIF image file",
            "@type": "ALTIMG",
            "@size": "1137",
            "@ref": "si1",
            "@mimetype": "image/gif"
          },
          {
            "@category": "thumbnail",
            "@height": "18",
            "@width": "9",
            "@_fa": "true",
            "$": "https://api.elsevier.com/content/object/eid/1-s2.0-S002195171830109X-si2.gif?httpAccept=%2A%2F%2A",
            "@multimediatype": "GIF image file",
            "@type": "ALTIMG",
            "@size": "181",
            "@ref": "si2",
            "@mimetype": "image/gif"
          },
          {
            "@category": "thumbnail",
            "@height": "15",
            "@width": "100",
            "@_fa": "true",
            "$": "https://api.elsevier.com/content/object/eid/1-s2.0-S002195171830109X-si3.gif?httpAccept=%2A%2F%2A",
            "@multimediatype": "GIF image file",
            "@type": "ALTIMG",
            "@size": "460",
            "@ref": "si3",
            "@mimetype": "image/gif"
          },
          {
            "@category": "thumbnail",
            "@height": "18",
            "@width": "154",
            "@_fa": "true",
            "$": "https://api.elsevier.com/content/object/eid/1-s2.0-S002195171830109X-si4.gif?httpAccept=%2A%2F%2A",
            "@multimediatype": "GIF image file",
            "@type": "ALTIMG",
            "@size": "695",
            "@ref": "si4",
            "@mimetype": "image/gif"
          },
          {
            "@category": "thumbnail",
            "@height": "18",
            "@width": "107",
            "@_fa": "true",
            "$": "https://api.elsevier.com/content/object/eid/1-s2.0-S002195171830109X-si5.gif?httpAccept=%2A%2F%2A",
            "@multimediatype": "GIF image file",
            "@type": "ALTIMG",
            "@size": "520",
            "@ref": "si5",
            "@mimetype": "image/gif"
          }
        ]
      },
      "link": {
        "@rel": "abstract",
        "@href": "https://api.elsevier.com/content/abstract/scopus_id/85044442673"
      }
    }
  }
}