{
  "metadata": {
    "title": "Hierarchical, multiscale surface reaction mechanism development: CO and H<ce:inf loc=post>2</ce:inf> oxidation, water–gas shift, and preferential oxidation of CO on Rh",
    "authors": "; ",
    "journal": "Journal of Catalysis",
    "date": "2005-08-15",
    "doi": "10.1016/j.jcat.2005.05.016",
    "abstract": "",
    "uri": "https://api.elsevier.com/content/article/pii/S0021951705002290",
    "pii": "S0021951705002290"
  },
  "fulltext": {
    "full-text-retrieval-response": {
      "scopus-eid": "2-s2.0-23244449459",
      "originalText": "serial JL 272561 291210 291744 291809 31 Journal of Catalysis JOURNALCATALYSIS 2005-07-12 2005-07-12 2010-11-14T14:56:34 1-s2.0-S0021951705002290 S0021-9517(05)00229-0 S0021951705002290 10.1016/j.jcat.2005.05.016 S300 S300.1 FULL-TEXT 1-s2.0-S0021951705X05292 2015-05-14T00:56:36.782564-04:00 0 0 20050815 2005 2005-07-12T00:00:00Z articleinfo crossmark dco dateupdated tomb dateloaded datesearch indexeddate issuelist volumelist yearnav articletitlenorm authfirstinitialnorm authfirstsurnamenorm cid cids contenttype copyright dateloadedtxt docsubtype doctype doi eid ewtransactionid hubeid issfirst issn issnnorm itemstage itemtransactionid itemweight openaccess openarchive pg pgfirst pglast pii piinorm pubdatestart pubdatetxt pubyr sortorder srctitle srctitlenorm srctype subheadings volfirst volissue webpdf webpdfpagecount figure table body mmlmath acknowledge affil appendices articletitle auth authfirstini authfull authkeywords authlast primabst ref alllist content subj ssids 0021-9517 00219517 234 234 1 1 Volume 234, Issue 1 7 48 63 48 63 20050815 15 August 2005 2005-08-15 2005 article fla Copyright © 2005 Elsevier Inc. All rights reserved. HIERARCHICALMULTISCALESURFACEREACTIONMECHANISMDEVELOPMENTCOH2OXIDATIONWATERGASSHIFTPREFERENTIALOXIDATIONCORH MHADESHWAR A 1 Introduction 2 CO and H2 oxidation mechanisms on Rh 2.1 Experimental data on CO oxidation and H2 oxidation on Rh 2.2 Screening surface reaction mechanisms, parameter estimation, and model assessment 2.3 Optimization of pre-factors, model predictions, and validation 3 Development of a CO–H2 coupling mechanism 3.1 Experimental data on WGS and CO PROX on Rh 3.2 Coupling pathways, initial parameter estimation, and predictions 3.3 Hierarchical multiscale parameter refinement using DFT 3.4 Important reactions for PROX at high temperatures 3.5 Analysis of reaction pathways in the coupling mechanism with interactions and modified pre-factors 4 Conclusions Acknowledgements Appendix A Selection of targeted experiments for optimization of CO and H2 screening mechanisms Appendix B Assessment of reaction mechanisms against additional experimental data on Rh References MHADESHWAR 2004 15246 15258 A DUMESIC 1993 J MICROKINETICSHETEROGENEOUSCATALYSIS HICKMAN 1993 1164 1177 D WILLIAMS 1992 5922 5931 W ZUMMALLEN 1993 625 632 M DEUTSCHMANN 1996 1747 1754 O ZUMMALLEN 1996 230 246 M BUI 1997 1029 1034 P VESER 2000 2271 2286 G AGHALAYAM 2003 23 38 P AGHALAYAM 1999 745 748 P AGHALAYAM 2000 98 137 P PARTIALOXIDATIONLIGHTALKANESINSHORTCONTACTTIMEMICROREACTORSCATALYSIS AGHALAYAM 2000 2017 2029 P PARK 1999 8101 8107 Y KANDOI 2004 93 100 S SCHUMACHER 2005 265 275 N MHADESHWAR 2003 12721 12733 A AGHALAYAM 2000 1331 1339 P MHADESHWAR 2005 162 172 A DESHMUKH 2004 221 238 S RAIMONDEAU 2002 3 23 S SANT 1990 3137 3147 R GOPINATH 2001 270 287 C COULSTON 1991 6932 6944 G KLOTZER 2003 142 147 B ROOT 1983 30 45 T HOPSTAKEN 2000 5457 5465 M YATES 1979 427 439 J PAYNE 1999 279 295 S GIBSON 2000 9582 9589 K GREGORATTI 1995 205 214 L WEI 1997 49 64 D YATES 1979 45 68 J MICHAELIDES 2001 4235 4242 A SHUSTOROVICH 1998 1 119 E SHUSTOROVICH 1990 101 164 E MICHAELIDES 2003 3704 3705 A LIU 2001 4977 4980 Z NORSKOV 2002 275 278 J DAHL 2001 19 29 S LOGADOTTIR 2001 229 231 A VANSANTEN 1995 R CHEMICALKINETICSCATALYSIS ZHDANOV 1991 183 242 V SCHENNACH 2003 237 245 R BEUTL 1999 71 83 M HRNCIR 2001 260 265 T PANAGIOTOPOULOU 2004 327 336 P WHEELER 2004 191 199 C UTAKA 2003 343 351 T HAN 2004 209 218 Y ITO 2000 247 254 S CHEN 2004 101 106 G MHADESHWAR 2004 13 22 A FISHER 1983 1064 1069 G SAVCHENKO 1983 983 990 V WILKE 2000 9986 9995 S HANSEN 1999 410 424 E LOFFREDA 1998 6447 6457 D SMEDH 2001 115 123 M HE 2003 209 221 R THIEL 1979 54 64 P ZHANG 1999 305 315 C MAVRIKAKIS 2002 153 156 M HENDRICKX 1985 503 523 H BROWN 1989 2807 2815 L HEI 1998 82 96 M WILKE 1994 2548 2564 S MAVRIKAKIS 2002 6737 6744 M EICHLER 1996 7659 7675 A ZINCK 1980 188 189 J FEIBELMAN 2003 186103 P MHADESHWARX2005X48 MHADESHWARX2005X48X63 MHADESHWARX2005X48XA MHADESHWARX2005X48X63XA item S0021-9517(05)00229-0 S0021951705002290 1-s2.0-S0021951705002290 10.1016/j.jcat.2005.05.016 272561 2010-12-23T23:40:08.979312-05:00 2005-08-15 1-s2.0-S0021951705002290-main.pdf https://s3.amazonaws.com/prod-ucs-content-store-us-east/content/pii:S0021951705002290/MAIN/application/pdf/8ca786082841d672403833ba5ea87138/main.pdf https://s3-eu-west-1.amazonaws.com/prod-ucs-content-store-eu-west/content/pii:S0021951705002290/MAIN/application/pdf/8ca786082841d672403833ba5ea87138/main.pdf main.pdf pdf true 909978 MAIN 16 1-s2.0-S0021951705002290-main_1.png https://s3.amazonaws.com/prod-ucs-content-store-us-east/content/pii:S0021951705002290/PREVIEW/image/png/ef8f9ff07e488f373d6d2bc7b96ea8b3/main_1.png https://s3-eu-west-1.amazonaws.com/prod-ucs-content-store-eu-west/content/pii:S0021951705002290/PREVIEW/image/png/ef8f9ff07e488f373d6d2bc7b96ea8b3/main_1.png main_1.png png 65415 849 656 IMAGE-WEB-PDF 1 1-s2.0-S0021951705002290-si98.gif https://s3.amazonaws.com/prod-ucs-content-store-us-east/content/pii:S0021951705002290/STRIPIN/image/gif/dccb65faff6930d726c59e965ecd8b55/si98.gif https://s3-eu-west-1.amazonaws.com/prod-ucs-content-store-eu-west/content/pii:S0021951705002290/STRIPIN/image/gif/dccb65faff6930d726c59e965ecd8b55/si98.gif si98 si98.gif gif 548 15 180 ALTIMG 1-s2.0-S0021951705002290-si116.gif https://s3.amazonaws.com/prod-ucs-content-store-us-east/content/pii:S0021951705002290/STRIPIN/image/gif/586d29d5edae9d99032a1e32a8dba665/si116.gif https://s3-eu-west-1.amazonaws.com/prod-ucs-content-store-eu-west/content/pii:S0021951705002290/STRIPIN/image/gif/586d29d5edae9d99032a1e32a8dba665/si116.gif si116 si116.gif gif 527 15 172 ALTIMG 1-s2.0-S0021951705002290-si115.gif https://s3.amazonaws.com/prod-ucs-content-store-us-east/content/pii:S0021951705002290/STRIPIN/image/gif/9e0e990e504309a6d81a4e7efa309e9b/si115.gif https://s3-eu-west-1.amazonaws.com/prod-ucs-content-store-eu-west/content/pii:S0021951705002290/STRIPIN/image/gif/9e0e990e504309a6d81a4e7efa309e9b/si115.gif si115 si115.gif gif 561 16 199 ALTIMG 1-s2.0-S0021951705002290-si114.gif https://s3.amazonaws.com/prod-ucs-content-store-us-east/content/pii:S0021951705002290/STRIPIN/image/gif/3df12e1a30935859fd7154c6f830862a/si114.gif https://s3-eu-west-1.amazonaws.com/prod-ucs-content-store-eu-west/content/pii:S0021951705002290/STRIPIN/image/gif/3df12e1a30935859fd7154c6f830862a/si114.gif si114 si114.gif gif 522 16 178 ALTIMG 1-s2.0-S0021951705002290-si109.gif https://s3.amazonaws.com/prod-ucs-content-store-us-east/content/pii:S0021951705002290/STRIPIN/image/gif/dd5eda7f26276e53bd8ec5ee337edb3f/si109.gif https://s3-eu-west-1.amazonaws.com/prod-ucs-content-store-eu-west/content/pii:S0021951705002290/STRIPIN/image/gif/dd5eda7f26276e53bd8ec5ee337edb3f/si109.gif si109 si109.gif gif 458 15 147 ALTIMG 1-s2.0-S0021951705002290-si100.gif https://s3.amazonaws.com/prod-ucs-content-store-us-east/content/pii:S0021951705002290/STRIPIN/image/gif/3ee32453959547328458f654deebdc23/si100.gif https://s3-eu-west-1.amazonaws.com/prod-ucs-content-store-eu-west/content/pii:S0021951705002290/STRIPIN/image/gif/3ee32453959547328458f654deebdc23/si100.gif si100 si100.gif gif 551 16 175 ALTIMG 1-s2.0-S0021951705002290-si72.gif https://s3.amazonaws.com/prod-ucs-content-store-us-east/content/pii:S0021951705002290/STRIPIN/image/gif/1b01b83b89af8a37b0e795614b56ea83/si72.gif https://s3-eu-west-1.amazonaws.com/prod-ucs-content-store-eu-west/content/pii:S0021951705002290/STRIPIN/image/gif/1b01b83b89af8a37b0e795614b56ea83/si72.gif si72 si72.gif gif 570 17 161 ALTIMG 1-s2.0-S0021951705002290-si68.gif https://s3.amazonaws.com/prod-ucs-content-store-us-east/content/pii:S0021951705002290/STRIPIN/image/gif/ec3d560ce86f64a137d91d3fe729a184/si68.gif https://s3-eu-west-1.amazonaws.com/prod-ucs-content-store-eu-west/content/pii:S0021951705002290/STRIPIN/image/gif/ec3d560ce86f64a137d91d3fe729a184/si68.gif si68 si68.gif gif 502 15 149 ALTIMG 1-s2.0-S0021951705002290-si5.gif https://s3.amazonaws.com/prod-ucs-content-store-us-east/content/pii:S0021951705002290/STRIPIN/image/gif/15a7bfd93a1c196ef41c937d470aeb4b/si5.gif https://s3-eu-west-1.amazonaws.com/prod-ucs-content-store-eu-west/content/pii:S0021951705002290/STRIPIN/image/gif/15a7bfd93a1c196ef41c937d470aeb4b/si5.gif si5 si5.gif gif 621 15 198 ALTIMG 1-s2.0-S0021951705002290-si3.gif https://s3.amazonaws.com/prod-ucs-content-store-us-east/content/pii:S0021951705002290/STRIPIN/image/gif/1d3a002e8eca37879407bd7d3c0a7862/si3.gif https://s3-eu-west-1.amazonaws.com/prod-ucs-content-store-eu-west/content/pii:S0021951705002290/STRIPIN/image/gif/1d3a002e8eca37879407bd7d3c0a7862/si3.gif si3 si3.gif gif 500 14 134 ALTIMG 1-s2.0-S0021951705002290-si23.gif https://s3.amazonaws.com/prod-ucs-content-store-us-east/content/pii:S0021951705002290/STRIPIN/image/gif/85ad5f69ddf3fa4a8b072f9a761c001c/si23.gif https://s3-eu-west-1.amazonaws.com/prod-ucs-content-store-eu-west/content/pii:S0021951705002290/STRIPIN/image/gif/85ad5f69ddf3fa4a8b072f9a761c001c/si23.gif si23 si23.gif gif 653 15 203 ALTIMG 1-s2.0-S0021951705002290-si22.gif https://s3.amazonaws.com/prod-ucs-content-store-us-east/content/pii:S0021951705002290/STRIPIN/image/gif/21567889a04e919b50c1691d34bd9495/si22.gif https://s3-eu-west-1.amazonaws.com/prod-ucs-content-store-eu-west/content/pii:S0021951705002290/STRIPIN/image/gif/21567889a04e919b50c1691d34bd9495/si22.gif si22 si22.gif gif 719 17 212 ALTIMG 1-s2.0-S0021951705002290-si99.gif https://s3.amazonaws.com/prod-ucs-content-store-us-east/content/pii:S0021951705002290/STRIPIN/image/gif/282fdac15a6aec6f5adbad85ea7c77c7/si38.gif https://s3-eu-west-1.amazonaws.com/prod-ucs-content-store-eu-west/content/pii:S0021951705002290/STRIPIN/image/gif/282fdac15a6aec6f5adbad85ea7c77c7/si38.gif si99 si99.gif gif 222 15 36 ALTIMG 1-s2.0-S0021951705002290-si97.gif https://s3.amazonaws.com/prod-ucs-content-store-us-east/content/pii:S0021951705002290/STRIPIN/image/gif/282fdac15a6aec6f5adbad85ea7c77c7/si38.gif https://s3-eu-west-1.amazonaws.com/prod-ucs-content-store-eu-west/content/pii:S0021951705002290/STRIPIN/image/gif/282fdac15a6aec6f5adbad85ea7c77c7/si38.gif si97 si97.gif gif 222 15 36 ALTIMG 1-s2.0-S0021951705002290-si96.gif https://s3.amazonaws.com/prod-ucs-content-store-us-east/content/pii:S0021951705002290/STRIPIN/image/gif/ebf82b2a01b1ae93c2f16a11efc25531/si96.gif https://s3-eu-west-1.amazonaws.com/prod-ucs-content-store-eu-west/content/pii:S0021951705002290/STRIPIN/image/gif/ebf82b2a01b1ae93c2f16a11efc25531/si96.gif si96 si96.gif gif 376 16 102 ALTIMG 1-s2.0-S0021951705002290-si95.gif https://s3.amazonaws.com/prod-ucs-content-store-us-east/content/pii:S0021951705002290/STRIPIN/image/gif/cd1b570f155f533d5d5b2f53b8a2c70b/si94.gif https://s3-eu-west-1.amazonaws.com/prod-ucs-content-store-eu-west/content/pii:S0021951705002290/STRIPIN/image/gif/cd1b570f155f533d5d5b2f53b8a2c70b/si94.gif si95 si95.gif gif 423 18 117 ALTIMG 1-s2.0-S0021951705002290-si94.gif https://s3.amazonaws.com/prod-ucs-content-store-us-east/content/pii:S0021951705002290/STRIPIN/image/gif/cd1b570f155f533d5d5b2f53b8a2c70b/si94.gif https://s3-eu-west-1.amazonaws.com/prod-ucs-content-store-eu-west/content/pii:S0021951705002290/STRIPIN/image/gif/cd1b570f155f533d5d5b2f53b8a2c70b/si94.gif si94 si94.gif gif 423 18 117 ALTIMG 1-s2.0-S0021951705002290-si93.gif https://s3.amazonaws.com/prod-ucs-content-store-us-east/content/pii:S0021951705002290/STRIPIN/image/gif/f8537a83dee37789b55d332e730abbac/si91.gif https://s3-eu-west-1.amazonaws.com/prod-ucs-content-store-eu-west/content/pii:S0021951705002290/STRIPIN/image/gif/f8537a83dee37789b55d332e730abbac/si91.gif si93 si93.gif gif 502 19 155 ALTIMG 1-s2.0-S0021951705002290-si92.gif https://s3.amazonaws.com/prod-ucs-content-store-us-east/content/pii:S0021951705002290/STRIPIN/image/gif/cd1b570f155f533d5d5b2f53b8a2c70b/si94.gif https://s3-eu-west-1.amazonaws.com/prod-ucs-content-store-eu-west/content/pii:S0021951705002290/STRIPIN/image/gif/cd1b570f155f533d5d5b2f53b8a2c70b/si94.gif si92 si92.gif gif 423 18 117 ALTIMG 1-s2.0-S0021951705002290-si91.gif https://s3.amazonaws.com/prod-ucs-content-store-us-east/content/pii:S0021951705002290/STRIPIN/image/gif/f8537a83dee37789b55d332e730abbac/si91.gif https://s3-eu-west-1.amazonaws.com/prod-ucs-content-store-eu-west/content/pii:S0021951705002290/STRIPIN/image/gif/f8537a83dee37789b55d332e730abbac/si91.gif si91 si91.gif gif 502 19 155 ALTIMG 1-s2.0-S0021951705002290-si90.gif https://s3.amazonaws.com/prod-ucs-content-store-us-east/content/pii:S0021951705002290/STRIPIN/image/gif/404df1e9608b1596a27824a4c7fdea07/si90.gif https://s3-eu-west-1.amazonaws.com/prod-ucs-content-store-eu-west/content/pii:S0021951705002290/STRIPIN/image/gif/404df1e9608b1596a27824a4c7fdea07/si90.gif si90 si90.gif gif 246 15 59 ALTIMG 1-s2.0-S0021951705002290-si9.gif https://s3.amazonaws.com/prod-ucs-content-store-us-east/content/pii:S0021951705002290/STRIPIN/image/gif/dfde66c08ba07db0abef192d49adaad8/si9.gif https://s3-eu-west-1.amazonaws.com/prod-ucs-content-store-eu-west/content/pii:S0021951705002290/STRIPIN/image/gif/dfde66c08ba07db0abef192d49adaad8/si9.gif si9 si9.gif gif 568 14 162 ALTIMG 1-s2.0-S0021951705002290-si89.gif https://s3.amazonaws.com/prod-ucs-content-store-us-east/content/pii:S0021951705002290/STRIPIN/image/gif/255a4727a6fff1cf6fe6dbc34ec8448f/si79.gif https://s3-eu-west-1.amazonaws.com/prod-ucs-content-store-eu-west/content/pii:S0021951705002290/STRIPIN/image/gif/255a4727a6fff1cf6fe6dbc34ec8448f/si79.gif si89 si89.gif gif 174 17 19 ALTIMG 1-s2.0-S0021951705002290-si88.gif https://s3.amazonaws.com/prod-ucs-content-store-us-east/content/pii:S0021951705002290/STRIPIN/image/gif/9cd2294d97fce0358fdd827da0601686/si88.gif https://s3-eu-west-1.amazonaws.com/prod-ucs-content-store-eu-west/content/pii:S0021951705002290/STRIPIN/image/gif/9cd2294d97fce0358fdd827da0601686/si88.gif si88 si88.gif gif 266 18 50 ALTIMG 1-s2.0-S0021951705002290-si87.gif https://s3.amazonaws.com/prod-ucs-content-store-us-east/content/pii:S0021951705002290/STRIPIN/image/gif/f77f127a502f2fcc586d33853a49d7e8/si87.gif https://s3-eu-west-1.amazonaws.com/prod-ucs-content-store-eu-west/content/pii:S0021951705002290/STRIPIN/image/gif/f77f127a502f2fcc586d33853a49d7e8/si87.gif si87 si87.gif gif 214 17 30 ALTIMG 1-s2.0-S0021951705002290-si86.gif https://s3.amazonaws.com/prod-ucs-content-store-us-east/content/pii:S0021951705002290/STRIPIN/image/gif/a238f416228b7b57ad70dddc1d66a01f/si77.gif https://s3-eu-west-1.amazonaws.com/prod-ucs-content-store-eu-west/content/pii:S0021951705002290/STRIPIN/image/gif/a238f416228b7b57ad70dddc1d66a01f/si77.gif si86 si86.gif gif 289 18 51 ALTIMG 1-s2.0-S0021951705002290-si85.gif https://s3.amazonaws.com/prod-ucs-content-store-us-east/content/pii:S0021951705002290/STRIPIN/image/gif/353ae57d74e8c395d96255313b8b4705/si85.gif https://s3-eu-west-1.amazonaws.com/prod-ucs-content-store-eu-west/content/pii:S0021951705002290/STRIPIN/image/gif/353ae57d74e8c395d96255313b8b4705/si85.gif si85 si85.gif gif 468 15 154 ALTIMG 1-s2.0-S0021951705002290-si84.gif https://s3.amazonaws.com/prod-ucs-content-store-us-east/content/pii:S0021951705002290/STRIPIN/image/gif/2ef079baf90b17fe94fb28e25ee1a9e6/si84.gif https://s3-eu-west-1.amazonaws.com/prod-ucs-content-store-eu-west/content/pii:S0021951705002290/STRIPIN/image/gif/2ef079baf90b17fe94fb28e25ee1a9e6/si84.gif si84 si84.gif gif 200 14 28 ALTIMG 1-s2.0-S0021951705002290-si83.gif https://s3.amazonaws.com/prod-ucs-content-store-us-east/content/pii:S0021951705002290/STRIPIN/image/gif/8221bbded7ff57e9e20bcfc6a20da36f/si83.gif https://s3-eu-west-1.amazonaws.com/prod-ucs-content-store-eu-west/content/pii:S0021951705002290/STRIPIN/image/gif/8221bbded7ff57e9e20bcfc6a20da36f/si83.gif si83 si83.gif gif 164 14 20 ALTIMG 1-s2.0-S0021951705002290-si82.gif https://s3.amazonaws.com/prod-ucs-content-store-us-east/content/pii:S0021951705002290/STRIPIN/image/gif/a59f7bfc066cdf58e5039df27ca44b43/si82.gif https://s3-eu-west-1.amazonaws.com/prod-ucs-content-store-eu-west/content/pii:S0021951705002290/STRIPIN/image/gif/a59f7bfc066cdf58e5039df27ca44b43/si82.gif si82 si82.gif gif 167 14 20 ALTIMG 1-s2.0-S0021951705002290-si81.gif https://s3.amazonaws.com/prod-ucs-content-store-us-east/content/pii:S0021951705002290/STRIPIN/image/gif/0ef84bae4312d213ba549f326b2aaf28/si81.gif https://s3-eu-west-1.amazonaws.com/prod-ucs-content-store-eu-west/content/pii:S0021951705002290/STRIPIN/image/gif/0ef84bae4312d213ba549f326b2aaf28/si81.gif si81 si81.gif gif 161 14 19 ALTIMG 1-s2.0-S0021951705002290-si80.gif https://s3.amazonaws.com/prod-ucs-content-store-us-east/content/pii:S0021951705002290/STRIPIN/image/gif/a238f416228b7b57ad70dddc1d66a01f/si77.gif https://s3-eu-west-1.amazonaws.com/prod-ucs-content-store-eu-west/content/pii:S0021951705002290/STRIPIN/image/gif/a238f416228b7b57ad70dddc1d66a01f/si77.gif si80 si80.gif gif 289 18 51 ALTIMG 1-s2.0-S0021951705002290-si8.gif https://s3.amazonaws.com/prod-ucs-content-store-us-east/content/pii:S0021951705002290/STRIPIN/image/gif/29657cce130dbaa9daca41e040e14bc7/si54.gif https://s3-eu-west-1.amazonaws.com/prod-ucs-content-store-eu-west/content/pii:S0021951705002290/STRIPIN/image/gif/29657cce130dbaa9daca41e040e14bc7/si54.gif si8 si8.gif gif 245 15 52 ALTIMG 1-s2.0-S0021951705002290-si79.gif https://s3.amazonaws.com/prod-ucs-content-store-us-east/content/pii:S0021951705002290/STRIPIN/image/gif/255a4727a6fff1cf6fe6dbc34ec8448f/si79.gif https://s3-eu-west-1.amazonaws.com/prod-ucs-content-store-eu-west/content/pii:S0021951705002290/STRIPIN/image/gif/255a4727a6fff1cf6fe6dbc34ec8448f/si79.gif si79 si79.gif gif 174 17 19 ALTIMG 1-s2.0-S0021951705002290-si78.gif https://s3.amazonaws.com/prod-ucs-content-store-us-east/content/pii:S0021951705002290/STRIPIN/image/gif/f77f127a502f2fcc586d33853a49d7e8/si87.gif https://s3-eu-west-1.amazonaws.com/prod-ucs-content-store-eu-west/content/pii:S0021951705002290/STRIPIN/image/gif/f77f127a502f2fcc586d33853a49d7e8/si87.gif si78 si78.gif gif 214 17 30 ALTIMG 1-s2.0-S0021951705002290-si77.gif https://s3.amazonaws.com/prod-ucs-content-store-us-east/content/pii:S0021951705002290/STRIPIN/image/gif/a238f416228b7b57ad70dddc1d66a01f/si77.gif https://s3-eu-west-1.amazonaws.com/prod-ucs-content-store-eu-west/content/pii:S0021951705002290/STRIPIN/image/gif/a238f416228b7b57ad70dddc1d66a01f/si77.gif si77 si77.gif gif 289 18 51 ALTIMG 1-s2.0-S0021951705002290-si76.gif https://s3.amazonaws.com/prod-ucs-content-store-us-east/content/pii:S0021951705002290/STRIPIN/image/gif/a238f416228b7b57ad70dddc1d66a01f/si77.gif https://s3-eu-west-1.amazonaws.com/prod-ucs-content-store-eu-west/content/pii:S0021951705002290/STRIPIN/image/gif/a238f416228b7b57ad70dddc1d66a01f/si77.gif si76 si76.gif gif 289 18 51 ALTIMG 1-s2.0-S0021951705002290-si75.gif https://s3.amazonaws.com/prod-ucs-content-store-us-east/content/pii:S0021951705002290/STRIPIN/image/gif/ffa918452d0b8d50fd3e62cf34a324d4/si75.gif https://s3-eu-west-1.amazonaws.com/prod-ucs-content-store-eu-west/content/pii:S0021951705002290/STRIPIN/image/gif/ffa918452d0b8d50fd3e62cf34a324d4/si75.gif si75 si75.gif gif 440 14 131 ALTIMG 1-s2.0-S0021951705002290-si74.gif https://s3.amazonaws.com/prod-ucs-content-store-us-east/content/pii:S0021951705002290/STRIPIN/image/gif/8edc94ec9428a98d5ab845531a37b788/si73.gif https://s3-eu-west-1.amazonaws.com/prod-ucs-content-store-eu-west/content/pii:S0021951705002290/STRIPIN/image/gif/8edc94ec9428a98d5ab845531a37b788/si73.gif si74 si74.gif gif 547 15 177 ALTIMG 1-s2.0-S0021951705002290-si73.gif https://s3.amazonaws.com/prod-ucs-content-store-us-east/content/pii:S0021951705002290/STRIPIN/image/gif/8edc94ec9428a98d5ab845531a37b788/si73.gif https://s3-eu-west-1.amazonaws.com/prod-ucs-content-store-eu-west/content/pii:S0021951705002290/STRIPIN/image/gif/8edc94ec9428a98d5ab845531a37b788/si73.gif si73 si73.gif gif 547 15 177 ALTIMG 1-s2.0-S0021951705002290-si71.gif https://s3.amazonaws.com/prod-ucs-content-store-us-east/content/pii:S0021951705002290/STRIPIN/image/gif/cab2303adf9da4beed85d31ebe3a7dc1/si71.gif https://s3-eu-west-1.amazonaws.com/prod-ucs-content-store-eu-west/content/pii:S0021951705002290/STRIPIN/image/gif/cab2303adf9da4beed85d31ebe3a7dc1/si71.gif si71 si71.gif gif 544 14 177 ALTIMG 1-s2.0-S0021951705002290-si70.gif https://s3.amazonaws.com/prod-ucs-content-store-us-east/content/pii:S0021951705002290/STRIPIN/image/gif/6e0f7ab66da552c9c7252dff2129ef58/si70.gif https://s3-eu-west-1.amazonaws.com/prod-ucs-content-store-eu-west/content/pii:S0021951705002290/STRIPIN/image/gif/6e0f7ab66da552c9c7252dff2129ef58/si70.gif si70 si70.gif gif 507 17 134 ALTIMG 1-s2.0-S0021951705002290-si7.gif https://s3.amazonaws.com/prod-ucs-content-store-us-east/content/pii:S0021951705002290/STRIPIN/image/gif/12169db164e3b31b3700cd98c7fa8c10/si7.gif https://s3-eu-west-1.amazonaws.com/prod-ucs-content-store-eu-west/content/pii:S0021951705002290/STRIPIN/image/gif/12169db164e3b31b3700cd98c7fa8c10/si7.gif si7 si7.gif gif 249 15 57 ALTIMG 1-s2.0-S0021951705002290-si69.gif https://s3.amazonaws.com/prod-ucs-content-store-us-east/content/pii:S0021951705002290/STRIPIN/image/gif/506aee35948b898678a52c7039a4b3f8/si63.gif https://s3-eu-west-1.amazonaws.com/prod-ucs-content-store-eu-west/content/pii:S0021951705002290/STRIPIN/image/gif/506aee35948b898678a52c7039a4b3f8/si63.gif si69 si69.gif gif 327 14 85 ALTIMG 1-s2.0-S0021951705002290-si67.gif https://s3.amazonaws.com/prod-ucs-content-store-us-east/content/pii:S0021951705002290/STRIPIN/image/gif/1a9b64fc8c906901597b407e8e4699ea/si67.gif https://s3-eu-west-1.amazonaws.com/prod-ucs-content-store-eu-west/content/pii:S0021951705002290/STRIPIN/image/gif/1a9b64fc8c906901597b407e8e4699ea/si67.gif si67 si67.gif gif 408 14 123 ALTIMG 1-s2.0-S0021951705002290-si66.gif https://s3.amazonaws.com/prod-ucs-content-store-us-east/content/pii:S0021951705002290/STRIPIN/image/gif/282fdac15a6aec6f5adbad85ea7c77c7/si38.gif https://s3-eu-west-1.amazonaws.com/prod-ucs-content-store-eu-west/content/pii:S0021951705002290/STRIPIN/image/gif/282fdac15a6aec6f5adbad85ea7c77c7/si38.gif si66 si66.gif gif 222 15 36 ALTIMG 1-s2.0-S0021951705002290-si65.gif https://s3.amazonaws.com/prod-ucs-content-store-us-east/content/pii:S0021951705002290/STRIPIN/image/gif/cab2303adf9da4beed85d31ebe3a7dc1/si71.gif https://s3-eu-west-1.amazonaws.com/prod-ucs-content-store-eu-west/content/pii:S0021951705002290/STRIPIN/image/gif/cab2303adf9da4beed85d31ebe3a7dc1/si71.gif si65 si65.gif gif 544 14 177 ALTIMG 1-s2.0-S0021951705002290-si64.gif https://s3.amazonaws.com/prod-ucs-content-store-us-east/content/pii:S0021951705002290/STRIPIN/image/gif/ebcf736d8995e5c36523bb4fe1d91dc2/si64.gif https://s3-eu-west-1.amazonaws.com/prod-ucs-content-store-eu-west/content/pii:S0021951705002290/STRIPIN/image/gif/ebcf736d8995e5c36523bb4fe1d91dc2/si64.gif si64 si64.gif gif 481 15 145 ALTIMG 1-s2.0-S0021951705002290-si63.gif https://s3.amazonaws.com/prod-ucs-content-store-us-east/content/pii:S0021951705002290/STRIPIN/image/gif/506aee35948b898678a52c7039a4b3f8/si63.gif https://s3-eu-west-1.amazonaws.com/prod-ucs-content-store-eu-west/content/pii:S0021951705002290/STRIPIN/image/gif/506aee35948b898678a52c7039a4b3f8/si63.gif si63 si63.gif gif 327 14 85 ALTIMG 1-s2.0-S0021951705002290-si62.gif https://s3.amazonaws.com/prod-ucs-content-store-us-east/content/pii:S0021951705002290/STRIPIN/image/gif/7adb411ffacd47efcaa303a742a79876/si62.gif https://s3-eu-west-1.amazonaws.com/prod-ucs-content-store-eu-west/content/pii:S0021951705002290/STRIPIN/image/gif/7adb411ffacd47efcaa303a742a79876/si62.gif si62 si62.gif gif 323 14 75 ALTIMG 1-s2.0-S0021951705002290-si61.gif https://s3.amazonaws.com/prod-ucs-content-store-us-east/content/pii:S0021951705002290/STRIPIN/image/gif/0ab85412437b4a1d5a83288301773d01/si61.gif https://s3-eu-west-1.amazonaws.com/prod-ucs-content-store-eu-west/content/pii:S0021951705002290/STRIPIN/image/gif/0ab85412437b4a1d5a83288301773d01/si61.gif si61 si61.gif gif 432 26 72 ALTIMG 1-s2.0-S0021951705002290-si60.gif https://s3.amazonaws.com/prod-ucs-content-store-us-east/content/pii:S0021951705002290/STRIPIN/image/gif/821a7c9fa4e968d534f84775f1ef491e/si60.gif https://s3-eu-west-1.amazonaws.com/prod-ucs-content-store-eu-west/content/pii:S0021951705002290/STRIPIN/image/gif/821a7c9fa4e968d534f84775f1ef491e/si60.gif si60 si60.gif gif 318 14 76 ALTIMG 1-s2.0-S0021951705002290-si6.gif https://s3.amazonaws.com/prod-ucs-content-store-us-east/content/pii:S0021951705002290/STRIPIN/image/gif/3a7a7de858d128b25d9ca1e0fc8e74fd/si6.gif https://s3-eu-west-1.amazonaws.com/prod-ucs-content-store-eu-west/content/pii:S0021951705002290/STRIPIN/image/gif/3a7a7de858d128b25d9ca1e0fc8e74fd/si6.gif si6 si6.gif gif 247 15 57 ALTIMG 1-s2.0-S0021951705002290-si59.gif https://s3.amazonaws.com/prod-ucs-content-store-us-east/content/pii:S0021951705002290/STRIPIN/image/gif/1e48e027f98b7a1b9f7d8c5750119c5f/si59.gif https://s3-eu-west-1.amazonaws.com/prod-ucs-content-store-eu-west/content/pii:S0021951705002290/STRIPIN/image/gif/1e48e027f98b7a1b9f7d8c5750119c5f/si59.gif si59 si59.gif gif 293 14 89 ALTIMG 1-s2.0-S0021951705002290-si58.gif https://s3.amazonaws.com/prod-ucs-content-store-us-east/content/pii:S0021951705002290/STRIPIN/image/gif/fa2d222e38f536e4b6fd0967d996d40c/si58.gif https://s3-eu-west-1.amazonaws.com/prod-ucs-content-store-eu-west/content/pii:S0021951705002290/STRIPIN/image/gif/fa2d222e38f536e4b6fd0967d996d40c/si58.gif si58 si58.gif gif 1717 41 429 ALTIMG 1-s2.0-S0021951705002290-si57.gif https://s3.amazonaws.com/prod-ucs-content-store-us-east/content/pii:S0021951705002290/STRIPIN/image/gif/340a325440d898fcd428c1e44c3cef57/si57.gif https://s3-eu-west-1.amazonaws.com/prod-ucs-content-store-eu-west/content/pii:S0021951705002290/STRIPIN/image/gif/340a325440d898fcd428c1e44c3cef57/si57.gif si57 si57.gif gif 639 16 177 ALTIMG 1-s2.0-S0021951705002290-si56.gif https://s3.amazonaws.com/prod-ucs-content-store-us-east/content/pii:S0021951705002290/STRIPIN/image/gif/29657cce130dbaa9daca41e040e14bc7/si54.gif https://s3-eu-west-1.amazonaws.com/prod-ucs-content-store-eu-west/content/pii:S0021951705002290/STRIPIN/image/gif/29657cce130dbaa9daca41e040e14bc7/si54.gif si56 si56.gif gif 245 15 52 ALTIMG 1-s2.0-S0021951705002290-si55.gif https://s3.amazonaws.com/prod-ucs-content-store-us-east/content/pii:S0021951705002290/STRIPIN/image/gif/420fcc0a7337931839853b09ea8d72b2/si55.gif https://s3-eu-west-1.amazonaws.com/prod-ucs-content-store-eu-west/content/pii:S0021951705002290/STRIPIN/image/gif/420fcc0a7337931839853b09ea8d72b2/si55.gif si55 si55.gif gif 641 16 177 ALTIMG 1-s2.0-S0021951705002290-si54.gif https://s3.amazonaws.com/prod-ucs-content-store-us-east/content/pii:S0021951705002290/STRIPIN/image/gif/29657cce130dbaa9daca41e040e14bc7/si54.gif https://s3-eu-west-1.amazonaws.com/prod-ucs-content-store-eu-west/content/pii:S0021951705002290/STRIPIN/image/gif/29657cce130dbaa9daca41e040e14bc7/si54.gif si54 si54.gif gif 245 15 52 ALTIMG 1-s2.0-S0021951705002290-si53.gif https://s3.amazonaws.com/prod-ucs-content-store-us-east/content/pii:S0021951705002290/STRIPIN/image/gif/47598bd2ca164b8a35099aba768ce161/si53.gif https://s3-eu-west-1.amazonaws.com/prod-ucs-content-store-eu-west/content/pii:S0021951705002290/STRIPIN/image/gif/47598bd2ca164b8a35099aba768ce161/si53.gif si53 si53.gif gif 531 16 144 ALTIMG 1-s2.0-S0021951705002290-si52.gif https://s3.amazonaws.com/prod-ucs-content-store-us-east/content/pii:S0021951705002290/STRIPIN/image/gif/21c8ecb01b489dc5e128b6e76d9f89cc/si52.gif https://s3-eu-west-1.amazonaws.com/prod-ucs-content-store-eu-west/content/pii:S0021951705002290/STRIPIN/image/gif/21c8ecb01b489dc5e128b6e76d9f89cc/si52.gif si52 si52.gif gif 246 15 50 ALTIMG 1-s2.0-S0021951705002290-si51.gif https://s3.amazonaws.com/prod-ucs-content-store-us-east/content/pii:S0021951705002290/STRIPIN/image/gif/ff31806a137a0ed7d682882183e8d3ed/si51.gif https://s3-eu-west-1.amazonaws.com/prod-ucs-content-store-eu-west/content/pii:S0021951705002290/STRIPIN/image/gif/ff31806a137a0ed7d682882183e8d3ed/si51.gif si51 si51.gif gif 545 17 145 ALTIMG 1-s2.0-S0021951705002290-si50.gif https://s3.amazonaws.com/prod-ucs-content-store-us-east/content/pii:S0021951705002290/STRIPIN/image/gif/282fdac15a6aec6f5adbad85ea7c77c7/si38.gif https://s3-eu-west-1.amazonaws.com/prod-ucs-content-store-eu-west/content/pii:S0021951705002290/STRIPIN/image/gif/282fdac15a6aec6f5adbad85ea7c77c7/si38.gif si50 si50.gif gif 222 15 36 ALTIMG 1-s2.0-S0021951705002290-si49.gif https://s3.amazonaws.com/prod-ucs-content-store-us-east/content/pii:S0021951705002290/STRIPIN/image/gif/2b4a659f63e1f4f17d165feb4402e61e/si49.gif https://s3-eu-west-1.amazonaws.com/prod-ucs-content-store-eu-west/content/pii:S0021951705002290/STRIPIN/image/gif/2b4a659f63e1f4f17d165feb4402e61e/si49.gif si49 si49.gif gif 499 14 131 ALTIMG 1-s2.0-S0021951705002290-si48.gif https://s3.amazonaws.com/prod-ucs-content-store-us-east/content/pii:S0021951705002290/STRIPIN/image/gif/21c8ecb01b489dc5e128b6e76d9f89cc/si52.gif https://s3-eu-west-1.amazonaws.com/prod-ucs-content-store-eu-west/content/pii:S0021951705002290/STRIPIN/image/gif/21c8ecb01b489dc5e128b6e76d9f89cc/si52.gif si48 si48.gif gif 246 15 50 ALTIMG 1-s2.0-S0021951705002290-si47.gif https://s3.amazonaws.com/prod-ucs-content-store-us-east/content/pii:S0021951705002290/STRIPIN/image/gif/7fe2b4b54d24bcfea2057241ab185ad5/si47.gif https://s3-eu-west-1.amazonaws.com/prod-ucs-content-store-eu-west/content/pii:S0021951705002290/STRIPIN/image/gif/7fe2b4b54d24bcfea2057241ab185ad5/si47.gif si47 si47.gif gif 482 14 131 ALTIMG 1-s2.0-S0021951705002290-si46.gif https://s3.amazonaws.com/prod-ucs-content-store-us-east/content/pii:S0021951705002290/STRIPIN/image/gif/29657cce130dbaa9daca41e040e14bc7/si54.gif https://s3-eu-west-1.amazonaws.com/prod-ucs-content-store-eu-west/content/pii:S0021951705002290/STRIPIN/image/gif/29657cce130dbaa9daca41e040e14bc7/si54.gif si46 si46.gif gif 245 15 52 ALTIMG 1-s2.0-S0021951705002290-si45.gif https://s3.amazonaws.com/prod-ucs-content-store-us-east/content/pii:S0021951705002290/STRIPIN/image/gif/2cc4aed4f3ea0406c67f04edba44bd23/si45.gif https://s3-eu-west-1.amazonaws.com/prod-ucs-content-store-eu-west/content/pii:S0021951705002290/STRIPIN/image/gif/2cc4aed4f3ea0406c67f04edba44bd23/si45.gif si45 si45.gif gif 634 16 177 ALTIMG 1-s2.0-S0021951705002290-si44.gif https://s3.amazonaws.com/prod-ucs-content-store-us-east/content/pii:S0021951705002290/STRIPIN/image/gif/21c8ecb01b489dc5e128b6e76d9f89cc/si52.gif https://s3-eu-west-1.amazonaws.com/prod-ucs-content-store-eu-west/content/pii:S0021951705002290/STRIPIN/image/gif/21c8ecb01b489dc5e128b6e76d9f89cc/si52.gif si44 si44.gif gif 246 15 50 ALTIMG 1-s2.0-S0021951705002290-si43.gif https://s3.amazonaws.com/prod-ucs-content-store-us-east/content/pii:S0021951705002290/STRIPIN/image/gif/3910b9054621484d6bd9446f2b07ef3f/si43.gif https://s3-eu-west-1.amazonaws.com/prod-ucs-content-store-eu-west/content/pii:S0021951705002290/STRIPIN/image/gif/3910b9054621484d6bd9446f2b07ef3f/si43.gif si43 si43.gif gif 640 17 177 ALTIMG 1-s2.0-S0021951705002290-si42.gif https://s3.amazonaws.com/prod-ucs-content-store-us-east/content/pii:S0021951705002290/STRIPIN/image/gif/29657cce130dbaa9daca41e040e14bc7/si54.gif https://s3-eu-west-1.amazonaws.com/prod-ucs-content-store-eu-west/content/pii:S0021951705002290/STRIPIN/image/gif/29657cce130dbaa9daca41e040e14bc7/si54.gif si42 si42.gif gif 245 15 52 ALTIMG 1-s2.0-S0021951705002290-si41.gif https://s3.amazonaws.com/prod-ucs-content-store-us-east/content/pii:S0021951705002290/STRIPIN/image/gif/2096ba6e6bb01ada051197b738bcf807/si41.gif https://s3-eu-west-1.amazonaws.com/prod-ucs-content-store-eu-west/content/pii:S0021951705002290/STRIPIN/image/gif/2096ba6e6bb01ada051197b738bcf807/si41.gif si41 si41.gif gif 549 16 144 ALTIMG 1-s2.0-S0021951705002290-si40.gif https://s3.amazonaws.com/prod-ucs-content-store-us-east/content/pii:S0021951705002290/STRIPIN/image/gif/282fdac15a6aec6f5adbad85ea7c77c7/si38.gif https://s3-eu-west-1.amazonaws.com/prod-ucs-content-store-eu-west/content/pii:S0021951705002290/STRIPIN/image/gif/282fdac15a6aec6f5adbad85ea7c77c7/si38.gif si40 si40.gif gif 222 15 36 ALTIMG 1-s2.0-S0021951705002290-si4.gif https://s3.amazonaws.com/prod-ucs-content-store-us-east/content/pii:S0021951705002290/STRIPIN/image/gif/cc5b1904d5be1ac7bb8e973e149b7dcd/si4.gif https://s3-eu-west-1.amazonaws.com/prod-ucs-content-store-eu-west/content/pii:S0021951705002290/STRIPIN/image/gif/cc5b1904d5be1ac7bb8e973e149b7dcd/si4.gif si4 si4.gif gif 466 14 129 ALTIMG 1-s2.0-S0021951705002290-si39.gif https://s3.amazonaws.com/prod-ucs-content-store-us-east/content/pii:S0021951705002290/STRIPIN/image/gif/dcd2a24d0188f647c44159610cc64198/si39.gif https://s3-eu-west-1.amazonaws.com/prod-ucs-content-store-eu-west/content/pii:S0021951705002290/STRIPIN/image/gif/dcd2a24d0188f647c44159610cc64198/si39.gif si39 si39.gif gif 547 16 145 ALTIMG 1-s2.0-S0021951705002290-si38.gif https://s3.amazonaws.com/prod-ucs-content-store-us-east/content/pii:S0021951705002290/STRIPIN/image/gif/282fdac15a6aec6f5adbad85ea7c77c7/si38.gif https://s3-eu-west-1.amazonaws.com/prod-ucs-content-store-eu-west/content/pii:S0021951705002290/STRIPIN/image/gif/282fdac15a6aec6f5adbad85ea7c77c7/si38.gif si38 si38.gif gif 222 15 36 ALTIMG 1-s2.0-S0021951705002290-si37.gif https://s3.amazonaws.com/prod-ucs-content-store-us-east/content/pii:S0021951705002290/STRIPIN/image/gif/ce23227689548899c7d673c7029de9d7/si37.gif https://s3-eu-west-1.amazonaws.com/prod-ucs-content-store-eu-west/content/pii:S0021951705002290/STRIPIN/image/gif/ce23227689548899c7d673c7029de9d7/si37.gif si37 si37.gif gif 741 17 210 ALTIMG 1-s2.0-S0021951705002290-si36.gif https://s3.amazonaws.com/prod-ucs-content-store-us-east/content/pii:S0021951705002290/STRIPIN/image/gif/9abf5b22d341cd41d8cf8397ed85bc43/si36.gif https://s3-eu-west-1.amazonaws.com/prod-ucs-content-store-eu-west/content/pii:S0021951705002290/STRIPIN/image/gif/9abf5b22d341cd41d8cf8397ed85bc43/si36.gif si36 si36.gif gif 745 16 211 ALTIMG 1-s2.0-S0021951705002290-si35.gif https://s3.amazonaws.com/prod-ucs-content-store-us-east/content/pii:S0021951705002290/STRIPIN/image/gif/0843afafe65ff89f5ae15e7cbbffb3aa/si35.gif https://s3-eu-west-1.amazonaws.com/prod-ucs-content-store-eu-west/content/pii:S0021951705002290/STRIPIN/image/gif/0843afafe65ff89f5ae15e7cbbffb3aa/si35.gif si35 si35.gif gif 499 14 131 ALTIMG 1-s2.0-S0021951705002290-si34.gif https://s3.amazonaws.com/prod-ucs-content-store-us-east/content/pii:S0021951705002290/STRIPIN/image/gif/84ec7396159ac1575f48d66c9376dd10/si34.gif https://s3-eu-west-1.amazonaws.com/prod-ucs-content-store-eu-west/content/pii:S0021951705002290/STRIPIN/image/gif/84ec7396159ac1575f48d66c9376dd10/si34.gif si34 si34.gif gif 541 36 79 ALTIMG 1-s2.0-S0021951705002290-si33.gif https://s3.amazonaws.com/prod-ucs-content-store-us-east/content/pii:S0021951705002290/STRIPIN/image/gif/29657cce130dbaa9daca41e040e14bc7/si54.gif https://s3-eu-west-1.amazonaws.com/prod-ucs-content-store-eu-west/content/pii:S0021951705002290/STRIPIN/image/gif/29657cce130dbaa9daca41e040e14bc7/si54.gif si33 si33.gif gif 245 15 52 ALTIMG 1-s2.0-S0021951705002290-si32.gif https://s3.amazonaws.com/prod-ucs-content-store-us-east/content/pii:S0021951705002290/STRIPIN/image/gif/7fe2b4b54d24bcfea2057241ab185ad5/si47.gif https://s3-eu-west-1.amazonaws.com/prod-ucs-content-store-eu-west/content/pii:S0021951705002290/STRIPIN/image/gif/7fe2b4b54d24bcfea2057241ab185ad5/si47.gif si32 si32.gif gif 482 14 131 ALTIMG 1-s2.0-S0021951705002290-si31.gif https://s3.amazonaws.com/prod-ucs-content-store-us-east/content/pii:S0021951705002290/STRIPIN/image/gif/7d5c33471e7289a6868f639b8c3ca53e/si31.gif https://s3-eu-west-1.amazonaws.com/prod-ucs-content-store-eu-west/content/pii:S0021951705002290/STRIPIN/image/gif/7d5c33471e7289a6868f639b8c3ca53e/si31.gif si31 si31.gif gif 541 35 85 ALTIMG 1-s2.0-S0021951705002290-si30.gif https://s3.amazonaws.com/prod-ucs-content-store-us-east/content/pii:S0021951705002290/STRIPIN/image/gif/29657cce130dbaa9daca41e040e14bc7/si54.gif https://s3-eu-west-1.amazonaws.com/prod-ucs-content-store-eu-west/content/pii:S0021951705002290/STRIPIN/image/gif/29657cce130dbaa9daca41e040e14bc7/si54.gif si30 si30.gif gif 245 15 52 ALTIMG 1-s2.0-S0021951705002290-si29.gif https://s3.amazonaws.com/prod-ucs-content-store-us-east/content/pii:S0021951705002290/STRIPIN/image/gif/6a139f840350bd6495c62bf5305397da/si29.gif https://s3-eu-west-1.amazonaws.com/prod-ucs-content-store-eu-west/content/pii:S0021951705002290/STRIPIN/image/gif/6a139f840350bd6495c62bf5305397da/si29.gif si29 si29.gif gif 695 16 201 ALTIMG 1-s2.0-S0021951705002290-si28.gif https://s3.amazonaws.com/prod-ucs-content-store-us-east/content/pii:S0021951705002290/STRIPIN/image/gif/99b6ca426dd28976862f9f1c1ddb62fe/si28.gif https://s3-eu-west-1.amazonaws.com/prod-ucs-content-store-eu-west/content/pii:S0021951705002290/STRIPIN/image/gif/99b6ca426dd28976862f9f1c1ddb62fe/si28.gif si28 si28.gif gif 678 16 194 ALTIMG 1-s2.0-S0021951705002290-si27.gif https://s3.amazonaws.com/prod-ucs-content-store-us-east/content/pii:S0021951705002290/STRIPIN/image/gif/a0b92b59d01d9698592c2d60344e6665/si27.gif https://s3-eu-west-1.amazonaws.com/prod-ucs-content-store-eu-west/content/pii:S0021951705002290/STRIPIN/image/gif/a0b92b59d01d9698592c2d60344e6665/si27.gif si27 si27.gif gif 714 17 202 ALTIMG 1-s2.0-S0021951705002290-si26.gif https://s3.amazonaws.com/prod-ucs-content-store-us-east/content/pii:S0021951705002290/STRIPIN/image/gif/29657cce130dbaa9daca41e040e14bc7/si54.gif https://s3-eu-west-1.amazonaws.com/prod-ucs-content-store-eu-west/content/pii:S0021951705002290/STRIPIN/image/gif/29657cce130dbaa9daca41e040e14bc7/si54.gif si26 si26.gif gif 245 15 52 ALTIMG 1-s2.0-S0021951705002290-si25.gif https://s3.amazonaws.com/prod-ucs-content-store-us-east/content/pii:S0021951705002290/STRIPIN/image/gif/6feb383601d0a3260dcb7b310ddcbeb6/si25.gif https://s3-eu-west-1.amazonaws.com/prod-ucs-content-store-eu-west/content/pii:S0021951705002290/STRIPIN/image/gif/6feb383601d0a3260dcb7b310ddcbeb6/si25.gif si25 si25.gif gif 676 16 194 ALTIMG 1-s2.0-S0021951705002290-si24.gif https://s3.amazonaws.com/prod-ucs-content-store-us-east/content/pii:S0021951705002290/STRIPIN/image/gif/29657cce130dbaa9daca41e040e14bc7/si54.gif https://s3-eu-west-1.amazonaws.com/prod-ucs-content-store-eu-west/content/pii:S0021951705002290/STRIPIN/image/gif/29657cce130dbaa9daca41e040e14bc7/si54.gif si24 si24.gif gif 245 15 52 ALTIMG 1-s2.0-S0021951705002290-si21.gif https://s3.amazonaws.com/prod-ucs-content-store-us-east/content/pii:S0021951705002290/STRIPIN/image/gif/677949d945cdc41bf6a0d9e4f8cd1eb0/si21.gif https://s3-eu-west-1.amazonaws.com/prod-ucs-content-store-eu-west/content/pii:S0021951705002290/STRIPIN/image/gif/677949d945cdc41bf6a0d9e4f8cd1eb0/si21.gif si21 si21.gif gif 653 17 188 ALTIMG 1-s2.0-S0021951705002290-si20.gif https://s3.amazonaws.com/prod-ucs-content-store-us-east/content/pii:S0021951705002290/STRIPIN/image/gif/d501dab8f3274a77454b2ff2ffd77acb/si20.gif https://s3-eu-west-1.amazonaws.com/prod-ucs-content-store-eu-west/content/pii:S0021951705002290/STRIPIN/image/gif/d501dab8f3274a77454b2ff2ffd77acb/si20.gif si20 si20.gif gif 655 16 178 ALTIMG 1-s2.0-S0021951705002290-si2.gif https://s3.amazonaws.com/prod-ucs-content-store-us-east/content/pii:S0021951705002290/STRIPIN/image/gif/70946c88f516116b4e982614411f40b4/si2.gif https://s3-eu-west-1.amazonaws.com/prod-ucs-content-store-eu-west/content/pii:S0021951705002290/STRIPIN/image/gif/70946c88f516116b4e982614411f40b4/si2.gif si2 si2.gif gif 165 21 25 ALTIMG 1-s2.0-S0021951705002290-si19.gif https://s3.amazonaws.com/prod-ucs-content-store-us-east/content/pii:S0021951705002290/STRIPIN/image/gif/d35ef693f7081c0721c73c583d451124/si19.gif https://s3-eu-west-1.amazonaws.com/prod-ucs-content-store-eu-west/content/pii:S0021951705002290/STRIPIN/image/gif/d35ef693f7081c0721c73c583d451124/si19.gif si19 si19.gif gif 628 16 177 ALTIMG 1-s2.0-S0021951705002290-si18.gif https://s3.amazonaws.com/prod-ucs-content-store-us-east/content/pii:S0021951705002290/STRIPIN/image/gif/15c423ee75fd3ee096d44d3128ad845f/si18.gif https://s3-eu-west-1.amazonaws.com/prod-ucs-content-store-eu-west/content/pii:S0021951705002290/STRIPIN/image/gif/15c423ee75fd3ee096d44d3128ad845f/si18.gif si18 si18.gif gif 780 16 234 ALTIMG 1-s2.0-S0021951705002290-si17.gif https://s3.amazonaws.com/prod-ucs-content-store-us-east/content/pii:S0021951705002290/STRIPIN/image/gif/24800ac6e40e937ee058c48aa6f2c437/si17.gif https://s3-eu-west-1.amazonaws.com/prod-ucs-content-store-eu-west/content/pii:S0021951705002290/STRIPIN/image/gif/24800ac6e40e937ee058c48aa6f2c437/si17.gif si17 si17.gif gif 563 35 85 ALTIMG 1-s2.0-S0021951705002290-si16.gif https://s3.amazonaws.com/prod-ucs-content-store-us-east/content/pii:S0021951705002290/STRIPIN/image/gif/277b070f7336aa60e051b09af1bd2b39/si16.gif https://s3-eu-west-1.amazonaws.com/prod-ucs-content-store-eu-west/content/pii:S0021951705002290/STRIPIN/image/gif/277b070f7336aa60e051b09af1bd2b39/si16.gif si16 si16.gif gif 785 17 234 ALTIMG 1-s2.0-S0021951705002290-si15.gif https://s3.amazonaws.com/prod-ucs-content-store-us-east/content/pii:S0021951705002290/STRIPIN/image/gif/707e24fb658b87aa8bfbe2f6443dda37/si15.gif https://s3-eu-west-1.amazonaws.com/prod-ucs-content-store-eu-west/content/pii:S0021951705002290/STRIPIN/image/gif/707e24fb658b87aa8bfbe2f6443dda37/si15.gif si15 si15.gif gif 545 36 85 ALTIMG 1-s2.0-S0021951705002290-si14.gif https://s3.amazonaws.com/prod-ucs-content-store-us-east/content/pii:S0021951705002290/STRIPIN/image/gif/accd4aea4277fc65e15f7e8db3c32d4b/si14.gif https://s3-eu-west-1.amazonaws.com/prod-ucs-content-store-eu-west/content/pii:S0021951705002290/STRIPIN/image/gif/accd4aea4277fc65e15f7e8db3c32d4b/si14.gif si14 si14.gif gif 690 16 201 ALTIMG 1-s2.0-S0021951705002290-si13.gif https://s3.amazonaws.com/prod-ucs-content-store-us-east/content/pii:S0021951705002290/STRIPIN/image/gif/bf9ac88088df9b0df206b0a8bafd13cd/si13.gif https://s3-eu-west-1.amazonaws.com/prod-ucs-content-store-eu-west/content/pii:S0021951705002290/STRIPIN/image/gif/bf9ac88088df9b0df206b0a8bafd13cd/si13.gif si13 si13.gif gif 701 16 202 ALTIMG 1-s2.0-S0021951705002290-si126.gif https://s3.amazonaws.com/prod-ucs-content-store-us-east/content/pii:S0021951705002290/STRIPIN/image/gif/58025d30480e428a5517601c06892490/si103.gif https://s3-eu-west-1.amazonaws.com/prod-ucs-content-store-eu-west/content/pii:S0021951705002290/STRIPIN/image/gif/58025d30480e428a5517601c06892490/si103.gif si126 si126.gif gif 198 14 34 ALTIMG 1-s2.0-S0021951705002290-si125.gif https://s3.amazonaws.com/prod-ucs-content-store-us-east/content/pii:S0021951705002290/STRIPIN/image/gif/b8852f678e5eebb13f665f6eeb8e74f8/si125.gif https://s3-eu-west-1.amazonaws.com/prod-ucs-content-store-eu-west/content/pii:S0021951705002290/STRIPIN/image/gif/b8852f678e5eebb13f665f6eeb8e74f8/si125.gif si125 si125.gif gif 190 14 39 ALTIMG 1-s2.0-S0021951705002290-si124.gif https://s3.amazonaws.com/prod-ucs-content-store-us-east/content/pii:S0021951705002290/STRIPIN/image/gif/021c21c3df968de0f0d96e4b14891774/si124.gif https://s3-eu-west-1.amazonaws.com/prod-ucs-content-store-eu-west/content/pii:S0021951705002290/STRIPIN/image/gif/021c21c3df968de0f0d96e4b14891774/si124.gif si124 si124.gif gif 290 16 78 ALTIMG 1-s2.0-S0021951705002290-si123.gif https://s3.amazonaws.com/prod-ucs-content-store-us-east/content/pii:S0021951705002290/STRIPIN/image/gif/667293dc633a19bdac4312ca82b44e80/si123.gif https://s3-eu-west-1.amazonaws.com/prod-ucs-content-store-eu-west/content/pii:S0021951705002290/STRIPIN/image/gif/667293dc633a19bdac4312ca82b44e80/si123.gif si123 si123.gif gif 352 14 81 ALTIMG 1-s2.0-S0021951705002290-si122.gif https://s3.amazonaws.com/prod-ucs-content-store-us-east/content/pii:S0021951705002290/STRIPIN/image/gif/fb70ad5b2377b29a94e515155ad99aad/si122.gif https://s3-eu-west-1.amazonaws.com/prod-ucs-content-store-eu-west/content/pii:S0021951705002290/STRIPIN/image/gif/fb70ad5b2377b29a94e515155ad99aad/si122.gif si122 si122.gif gif 270 15 74 ALTIMG 1-s2.0-S0021951705002290-si121.gif https://s3.amazonaws.com/prod-ucs-content-store-us-east/content/pii:S0021951705002290/STRIPIN/image/gif/73f046845d7b5e028914c29e8b1fcc80/si121.gif https://s3-eu-west-1.amazonaws.com/prod-ucs-content-store-eu-west/content/pii:S0021951705002290/STRIPIN/image/gif/73f046845d7b5e028914c29e8b1fcc80/si121.gif si121 si121.gif gif 211 16 45 ALTIMG 1-s2.0-S0021951705002290-si120.gif https://s3.amazonaws.com/prod-ucs-content-store-us-east/content/pii:S0021951705002290/STRIPIN/image/gif/78b026ea152df44448cb82d444995391/si120.gif https://s3-eu-west-1.amazonaws.com/prod-ucs-content-store-eu-west/content/pii:S0021951705002290/STRIPIN/image/gif/78b026ea152df44448cb82d444995391/si120.gif si120 si120.gif gif 206 15 46 ALTIMG 1-s2.0-S0021951705002290-si12.gif https://s3.amazonaws.com/prod-ucs-content-store-us-east/content/pii:S0021951705002290/STRIPIN/image/gif/2cf312edf067bf051420a746eebca43d/si12.gif https://s3-eu-west-1.amazonaws.com/prod-ucs-content-store-eu-west/content/pii:S0021951705002290/STRIPIN/image/gif/2cf312edf067bf051420a746eebca43d/si12.gif si12 si12.gif gif 611 15 190 ALTIMG 1-s2.0-S0021951705002290-si119.gif https://s3.amazonaws.com/prod-ucs-content-store-us-east/content/pii:S0021951705002290/STRIPIN/image/gif/5decadd42fdfc9d3cf5263d79d11013c/si119.gif https://s3-eu-west-1.amazonaws.com/prod-ucs-content-store-eu-west/content/pii:S0021951705002290/STRIPIN/image/gif/5decadd42fdfc9d3cf5263d79d11013c/si119.gif si119 si119.gif gif 206 15 45 ALTIMG 1-s2.0-S0021951705002290-si118.gif https://s3.amazonaws.com/prod-ucs-content-store-us-east/content/pii:S0021951705002290/STRIPIN/image/gif/58025d30480e428a5517601c06892490/si103.gif https://s3-eu-west-1.amazonaws.com/prod-ucs-content-store-eu-west/content/pii:S0021951705002290/STRIPIN/image/gif/58025d30480e428a5517601c06892490/si103.gif si118 si118.gif gif 198 14 34 ALTIMG 1-s2.0-S0021951705002290-si117.gif https://s3.amazonaws.com/prod-ucs-content-store-us-east/content/pii:S0021951705002290/STRIPIN/image/gif/58025d30480e428a5517601c06892490/si103.gif https://s3-eu-west-1.amazonaws.com/prod-ucs-content-store-eu-west/content/pii:S0021951705002290/STRIPIN/image/gif/58025d30480e428a5517601c06892490/si103.gif si117 si117.gif gif 198 14 34 ALTIMG 1-s2.0-S0021951705002290-si113.gif https://s3.amazonaws.com/prod-ucs-content-store-us-east/content/pii:S0021951705002290/STRIPIN/image/gif/282fdac15a6aec6f5adbad85ea7c77c7/si38.gif https://s3-eu-west-1.amazonaws.com/prod-ucs-content-store-eu-west/content/pii:S0021951705002290/STRIPIN/image/gif/282fdac15a6aec6f5adbad85ea7c77c7/si38.gif si113 si113.gif gif 222 15 36 ALTIMG 1-s2.0-S0021951705002290-si112.gif https://s3.amazonaws.com/prod-ucs-content-store-us-east/content/pii:S0021951705002290/STRIPIN/image/gif/58025d30480e428a5517601c06892490/si103.gif https://s3-eu-west-1.amazonaws.com/prod-ucs-content-store-eu-west/content/pii:S0021951705002290/STRIPIN/image/gif/58025d30480e428a5517601c06892490/si103.gif si112 si112.gif gif 198 14 34 ALTIMG 1-s2.0-S0021951705002290-si111.gif https://s3.amazonaws.com/prod-ucs-content-store-us-east/content/pii:S0021951705002290/STRIPIN/image/gif/58025d30480e428a5517601c06892490/si103.gif https://s3-eu-west-1.amazonaws.com/prod-ucs-content-store-eu-west/content/pii:S0021951705002290/STRIPIN/image/gif/58025d30480e428a5517601c06892490/si103.gif si111 si111.gif gif 198 14 34 ALTIMG 1-s2.0-S0021951705002290-si110.gif https://s3.amazonaws.com/prod-ucs-content-store-us-east/content/pii:S0021951705002290/STRIPIN/image/gif/58025d30480e428a5517601c06892490/si103.gif https://s3-eu-west-1.amazonaws.com/prod-ucs-content-store-eu-west/content/pii:S0021951705002290/STRIPIN/image/gif/58025d30480e428a5517601c06892490/si103.gif si110 si110.gif gif 198 14 34 ALTIMG 1-s2.0-S0021951705002290-si11.gif https://s3.amazonaws.com/prod-ucs-content-store-us-east/content/pii:S0021951705002290/STRIPIN/image/gif/74c77d5605928cb3ab3dbd07bd228ef3/si11.gif https://s3-eu-west-1.amazonaws.com/prod-ucs-content-store-eu-west/content/pii:S0021951705002290/STRIPIN/image/gif/74c77d5605928cb3ab3dbd07bd228ef3/si11.gif si11 si11.gif gif 586 15 163 ALTIMG 1-s2.0-S0021951705002290-si108.gif https://s3.amazonaws.com/prod-ucs-content-store-us-east/content/pii:S0021951705002290/STRIPIN/image/gif/d359f5e627f621aab18d2f83eafd6d05/si108.gif https://s3-eu-west-1.amazonaws.com/prod-ucs-content-store-eu-west/content/pii:S0021951705002290/STRIPIN/image/gif/d359f5e627f621aab18d2f83eafd6d05/si108.gif si108 si108.gif gif 181 11 38 ALTIMG 1-s2.0-S0021951705002290-si107.gif https://s3.amazonaws.com/prod-ucs-content-store-us-east/content/pii:S0021951705002290/STRIPIN/image/gif/215aa9f039261fa0d7be7d86e40a7873/si107.gif https://s3-eu-west-1.amazonaws.com/prod-ucs-content-store-eu-west/content/pii:S0021951705002290/STRIPIN/image/gif/215aa9f039261fa0d7be7d86e40a7873/si107.gif si107 si107.gif gif 232 13 50 ALTIMG 1-s2.0-S0021951705002290-si106.gif https://s3.amazonaws.com/prod-ucs-content-store-us-east/content/pii:S0021951705002290/STRIPIN/image/gif/67d485979902191866c2125d9cacde96/si106.gif https://s3-eu-west-1.amazonaws.com/prod-ucs-content-store-eu-west/content/pii:S0021951705002290/STRIPIN/image/gif/67d485979902191866c2125d9cacde96/si106.gif si106 si106.gif gif 184 11 36 ALTIMG 1-s2.0-S0021951705002290-si105.gif https://s3.amazonaws.com/prod-ucs-content-store-us-east/content/pii:S0021951705002290/STRIPIN/image/gif/87390e47fe53a94640752f50182a6d05/si105.gif https://s3-eu-west-1.amazonaws.com/prod-ucs-content-store-eu-west/content/pii:S0021951705002290/STRIPIN/image/gif/87390e47fe53a94640752f50182a6d05/si105.gif si105 si105.gif gif 321 15 73 ALTIMG 1-s2.0-S0021951705002290-si104.gif https://s3.amazonaws.com/prod-ucs-content-store-us-east/content/pii:S0021951705002290/STRIPIN/image/gif/b55b1bfe32a92913b6641028b8424b3d/si104.gif https://s3-eu-west-1.amazonaws.com/prod-ucs-content-store-eu-west/content/pii:S0021951705002290/STRIPIN/image/gif/b55b1bfe32a92913b6641028b8424b3d/si104.gif si104 si104.gif gif 292 16 74 ALTIMG 1-s2.0-S0021951705002290-si103.gif https://s3.amazonaws.com/prod-ucs-content-store-us-east/content/pii:S0021951705002290/STRIPIN/image/gif/58025d30480e428a5517601c06892490/si103.gif https://s3-eu-west-1.amazonaws.com/prod-ucs-content-store-eu-west/content/pii:S0021951705002290/STRIPIN/image/gif/58025d30480e428a5517601c06892490/si103.gif si103 si103.gif gif 198 14 34 ALTIMG 1-s2.0-S0021951705002290-si102.gif https://s3.amazonaws.com/prod-ucs-content-store-us-east/content/pii:S0021951705002290/STRIPIN/image/gif/58025d30480e428a5517601c06892490/si103.gif https://s3-eu-west-1.amazonaws.com/prod-ucs-content-store-eu-west/content/pii:S0021951705002290/STRIPIN/image/gif/58025d30480e428a5517601c06892490/si103.gif si102 si102.gif gif 198 14 34 ALTIMG 1-s2.0-S0021951705002290-si101.gif https://s3.amazonaws.com/prod-ucs-content-store-us-east/content/pii:S0021951705002290/STRIPIN/image/gif/282fdac15a6aec6f5adbad85ea7c77c7/si38.gif https://s3-eu-west-1.amazonaws.com/prod-ucs-content-store-eu-west/content/pii:S0021951705002290/STRIPIN/image/gif/282fdac15a6aec6f5adbad85ea7c77c7/si38.gif si101 si101.gif gif 222 15 36 ALTIMG 1-s2.0-S0021951705002290-si10.gif https://s3.amazonaws.com/prod-ucs-content-store-us-east/content/pii:S0021951705002290/STRIPIN/image/gif/29657cce130dbaa9daca41e040e14bc7/si54.gif https://s3-eu-west-1.amazonaws.com/prod-ucs-content-store-eu-west/content/pii:S0021951705002290/STRIPIN/image/gif/29657cce130dbaa9daca41e040e14bc7/si54.gif si10 si10.gif gif 245 15 52 ALTIMG 1-s2.0-S0021951705002290-si1.gif https://s3.amazonaws.com/prod-ucs-content-store-us-east/content/pii:S0021951705002290/STRIPIN/image/gif/70946c88f516116b4e982614411f40b4/si2.gif https://s3-eu-west-1.amazonaws.com/prod-ucs-content-store-eu-west/content/pii:S0021951705002290/STRIPIN/image/gif/70946c88f516116b4e982614411f40b4/si2.gif si1 si1.gif gif 165 21 25 ALTIMG 1-s2.0-S0021951705002290-gr003.gif https://s3.amazonaws.com/prod-ucs-content-store-us-east/content/pii:S0021951705002290/fgr003/DOWNSAMPLED/image/gif/7343a476a5bbc92b697677529c9ab853/gr003.gif https://s3-eu-west-1.amazonaws.com/prod-ucs-content-store-eu-west/content/pii:S0021951705002290/fgr003/DOWNSAMPLED/image/gif/7343a476a5bbc92b697677529c9ab853/gr003.gif gr003 gr003.gif gif 9757 315 332 IMAGE-DOWNSAMPLED 1-s2.0-S0021951705002290-gr003.sml https://s3.amazonaws.com/prod-ucs-content-store-us-east/content/pii:S0021951705002290/fgr003/THUMBNAIL/image/gif/8174186e61852d7e6e1c9a394b43fc75/gr003.sml https://s3-eu-west-1.amazonaws.com/prod-ucs-content-store-eu-west/content/pii:S0021951705002290/fgr003/THUMBNAIL/image/gif/8174186e61852d7e6e1c9a394b43fc75/gr003.sml gr003 gr003.sml sml 1639 93 98 IMAGE-THUMBNAIL 1-s2.0-S0021951705002290-gr015.gif https://s3.amazonaws.com/prod-ucs-content-store-us-east/content/pii:S0021951705002290/fgr015/DOWNSAMPLED/image/gif/41b1f6010b8cc76488f74ddc398a7011/gr015.gif https://s3-eu-west-1.amazonaws.com/prod-ucs-content-store-eu-west/content/pii:S0021951705002290/fgr015/DOWNSAMPLED/image/gif/41b1f6010b8cc76488f74ddc398a7011/gr015.gif gr015 gr015.gif gif 9181 280 303 IMAGE-DOWNSAMPLED 1-s2.0-S0021951705002290-gr015.sml https://s3.amazonaws.com/prod-ucs-content-store-us-east/content/pii:S0021951705002290/fgr015/THUMBNAIL/image/gif/0de9512719f199de789a8192d3628edf/gr015.sml https://s3-eu-west-1.amazonaws.com/prod-ucs-content-store-eu-west/content/pii:S0021951705002290/fgr015/THUMBNAIL/image/gif/0de9512719f199de789a8192d3628edf/gr015.sml gr015 gr015.sml sml 1809 93 101 IMAGE-THUMBNAIL 1-s2.0-S0021951705002290-gr017.gif https://s3.amazonaws.com/prod-ucs-content-store-us-east/content/pii:S0021951705002290/fgr017/DOWNSAMPLED/image/gif/3bbf52841945ddb073132c2744cf7c9a/gr017.gif https://s3-eu-west-1.amazonaws.com/prod-ucs-content-store-eu-west/content/pii:S0021951705002290/fgr017/DOWNSAMPLED/image/gif/3bbf52841945ddb073132c2744cf7c9a/gr017.gif gr017 gr017.gif gif 10305 286 297 IMAGE-DOWNSAMPLED 1-s2.0-S0021951705002290-gr017.sml https://s3.amazonaws.com/prod-ucs-content-store-us-east/content/pii:S0021951705002290/fgr017/THUMBNAIL/image/gif/e1ef99dc763bce52393e980814580f3b/gr017.sml https://s3-eu-west-1.amazonaws.com/prod-ucs-content-store-eu-west/content/pii:S0021951705002290/fgr017/THUMBNAIL/image/gif/e1ef99dc763bce52393e980814580f3b/gr017.sml gr017 gr017.sml sml 1901 93 97 IMAGE-THUMBNAIL 1-s2.0-S0021951705002290-gr019.gif https://s3.amazonaws.com/prod-ucs-content-store-us-east/content/pii:S0021951705002290/fgr019/DOWNSAMPLED/image/gif/c119f31c5c7f90b1329ad94c354b3f36/gr019.gif https://s3-eu-west-1.amazonaws.com/prod-ucs-content-store-eu-west/content/pii:S0021951705002290/fgr019/DOWNSAMPLED/image/gif/c119f31c5c7f90b1329ad94c354b3f36/gr019.gif gr019 gr019.gif gif 9181 306 333 IMAGE-DOWNSAMPLED 1-s2.0-S0021951705002290-gr019.sml https://s3.amazonaws.com/prod-ucs-content-store-us-east/content/pii:S0021951705002290/fgr019/THUMBNAIL/image/gif/7c4906985fc8683b148ece0999a3a257/gr019.sml https://s3-eu-west-1.amazonaws.com/prod-ucs-content-store-eu-west/content/pii:S0021951705002290/fgr019/THUMBNAIL/image/gif/7c4906985fc8683b148ece0999a3a257/gr019.sml gr019 gr019.sml sml 1621 93 101 IMAGE-THUMBNAIL 1-s2.0-S0021951705002290-gr010.gif https://s3.amazonaws.com/prod-ucs-content-store-us-east/content/pii:S0021951705002290/fgr010/DOWNSAMPLED/image/gif/cac326dd4c04ab374c52e01078fc7f25/gr010.gif https://s3-eu-west-1.amazonaws.com/prod-ucs-content-store-eu-west/content/pii:S0021951705002290/fgr010/DOWNSAMPLED/image/gif/cac326dd4c04ab374c52e01078fc7f25/gr010.gif gr010 gr010.gif gif 15686 454 371 IMAGE-DOWNSAMPLED 1-s2.0-S0021951705002290-gr010.sml https://s3.amazonaws.com/prod-ucs-content-store-us-east/content/pii:S0021951705002290/fgr010/THUMBNAIL/image/gif/2fdd7f898651adc52d648f64b1eb1231/gr010.sml https://s3-eu-west-1.amazonaws.com/prod-ucs-content-store-eu-west/content/pii:S0021951705002290/fgr010/THUMBNAIL/image/gif/2fdd7f898651adc52d648f64b1eb1231/gr010.sml gr010 gr010.sml sml 1316 93 76 IMAGE-THUMBNAIL 1-s2.0-S0021951705002290-gr005.gif https://s3.amazonaws.com/prod-ucs-content-store-us-east/content/pii:S0021951705002290/fgr005/DOWNSAMPLED/image/gif/464065fbd21fbbbc7346d89e9afbc865/gr005.gif https://s3-eu-west-1.amazonaws.com/prod-ucs-content-store-eu-west/content/pii:S0021951705002290/fgr005/DOWNSAMPLED/image/gif/464065fbd21fbbbc7346d89e9afbc865/gr005.gif gr005 gr005.gif gif 10708 307 322 IMAGE-DOWNSAMPLED 1-s2.0-S0021951705002290-gr005.sml https://s3.amazonaws.com/prod-ucs-content-store-us-east/content/pii:S0021951705002290/fgr005/THUMBNAIL/image/gif/39a83a5a7abc831a542d0b72c6232fac/gr005.sml https://s3-eu-west-1.amazonaws.com/prod-ucs-content-store-eu-west/content/pii:S0021951705002290/fgr005/THUMBNAIL/image/gif/39a83a5a7abc831a542d0b72c6232fac/gr005.sml gr005 gr005.sml sml 1804 93 98 IMAGE-THUMBNAIL 1-s2.0-S0021951705002290-gr009.gif https://s3.amazonaws.com/prod-ucs-content-store-us-east/content/pii:S0021951705002290/fgr009/DOWNSAMPLED/image/gif/92f6a16ffe8dea461856c9f8a2723068/gr009.gif https://s3-eu-west-1.amazonaws.com/prod-ucs-content-store-eu-west/content/pii:S0021951705002290/fgr009/DOWNSAMPLED/image/gif/92f6a16ffe8dea461856c9f8a2723068/gr009.gif gr009 gr009.gif gif 16942 548 299 IMAGE-DOWNSAMPLED 1-s2.0-S0021951705002290-gr009.sml https://s3.amazonaws.com/prod-ucs-content-store-us-east/content/pii:S0021951705002290/fgr009/THUMBNAIL/image/gif/7d77c5b506662737f46de7cd06acadce/gr009.sml https://s3-eu-west-1.amazonaws.com/prod-ucs-content-store-eu-west/content/pii:S0021951705002290/fgr009/THUMBNAIL/image/gif/7d77c5b506662737f46de7cd06acadce/gr009.sml gr009 gr009.sml sml 1194 94 51 IMAGE-THUMBNAIL 1-s2.0-S0021951705002290-gr007.gif https://s3.amazonaws.com/prod-ucs-content-store-us-east/content/pii:S0021951705002290/fgr007/DOWNSAMPLED/image/gif/061fa92a3e8406f4c1e59925e786e8b4/gr007.gif https://s3-eu-west-1.amazonaws.com/prod-ucs-content-store-eu-west/content/pii:S0021951705002290/fgr007/DOWNSAMPLED/image/gif/061fa92a3e8406f4c1e59925e786e8b4/gr007.gif gr007 gr007.gif gif 13252 533 302 IMAGE-DOWNSAMPLED 1-s2.0-S0021951705002290-gr007.sml https://s3.amazonaws.com/prod-ucs-content-store-us-east/content/pii:S0021951705002290/fgr007/THUMBNAIL/image/gif/8a98be52e11fb73e7f486c0bdc0a3736/gr007.sml https://s3-eu-west-1.amazonaws.com/prod-ucs-content-store-eu-west/content/pii:S0021951705002290/fgr007/THUMBNAIL/image/gif/8a98be52e11fb73e7f486c0bdc0a3736/gr007.sml gr007 gr007.sml sml 1057 93 53 IMAGE-THUMBNAIL 1-s2.0-S0021951705002290-gr004.gif https://s3.amazonaws.com/prod-ucs-content-store-us-east/content/pii:S0021951705002290/fgr004/DOWNSAMPLED/image/gif/f20d3c6c9d01ecf65d88ce1a4b978760/gr004.gif https://s3-eu-west-1.amazonaws.com/prod-ucs-content-store-eu-west/content/pii:S0021951705002290/fgr004/DOWNSAMPLED/image/gif/f20d3c6c9d01ecf65d88ce1a4b978760/gr004.gif gr004 gr004.gif gif 9754 321 326 IMAGE-DOWNSAMPLED 1-s2.0-S0021951705002290-gr004.sml https://s3.amazonaws.com/prod-ucs-content-store-us-east/content/pii:S0021951705002290/fgr004/THUMBNAIL/image/gif/b8c7b9792354f40ee0231b71a81d44ea/gr004.sml https://s3-eu-west-1.amazonaws.com/prod-ucs-content-store-eu-west/content/pii:S0021951705002290/fgr004/THUMBNAIL/image/gif/b8c7b9792354f40ee0231b71a81d44ea/gr004.sml gr004 gr004.sml sml 1580 94 95 IMAGE-THUMBNAIL 1-s2.0-S0021951705002290-gr008.jpg https://s3.amazonaws.com/prod-ucs-content-store-us-east/content/pii:S0021951705002290/fgr008/DOWNSAMPLED/image/jpeg/2b6cc6ef5e6bf0f6aa95fdfa819c5978/gr008.jpg https://s3-eu-west-1.amazonaws.com/prod-ucs-content-store-eu-west/content/pii:S0021951705002290/fgr008/DOWNSAMPLED/image/jpeg/2b6cc6ef5e6bf0f6aa95fdfa819c5978/gr008.jpg gr008 gr008.jpg jpg 52413 478 325 IMAGE-DOWNSAMPLED 1-s2.0-S0021951705002290-gr008.sml https://s3.amazonaws.com/prod-ucs-content-store-us-east/content/pii:S0021951705002290/fgr008/THUMBNAIL/image/gif/607a6c326c13822e225d41614bf3c696/gr008.sml https://s3-eu-west-1.amazonaws.com/prod-ucs-content-store-eu-west/content/pii:S0021951705002290/fgr008/THUMBNAIL/image/gif/607a6c326c13822e225d41614bf3c696/gr008.sml gr008 gr008.sml sml 2497 93 63 IMAGE-THUMBNAIL 1-s2.0-S0021951705002290-gr012.jpg https://s3.amazonaws.com/prod-ucs-content-store-us-east/content/pii:S0021951705002290/fgr012/DOWNSAMPLED/image/jpeg/ac36c37993c91b3b4f105f72717e4298/gr012.jpg https://s3-eu-west-1.amazonaws.com/prod-ucs-content-store-eu-west/content/pii:S0021951705002290/fgr012/DOWNSAMPLED/image/jpeg/ac36c37993c91b3b4f105f72717e4298/gr012.jpg gr012 gr012.jpg jpg 86622 728 335 IMAGE-DOWNSAMPLED 1-s2.0-S0021951705002290-gr012.sml https://s3.amazonaws.com/prod-ucs-content-store-us-east/content/pii:S0021951705002290/fgr012/THUMBNAIL/image/gif/02907bad9f8f9e70503c4cd32a0031e6/gr012.sml https://s3-eu-west-1.amazonaws.com/prod-ucs-content-store-eu-west/content/pii:S0021951705002290/fgr012/THUMBNAIL/image/gif/02907bad9f8f9e70503c4cd32a0031e6/gr012.sml gr012 gr012.sml sml 1209 93 43 IMAGE-THUMBNAIL 1-s2.0-S0021951705002290-gr020.gif https://s3.amazonaws.com/prod-ucs-content-store-us-east/content/pii:S0021951705002290/fgr020/DOWNSAMPLED/image/gif/8cab581b842b7c57614f637601578577/gr020.gif https://s3-eu-west-1.amazonaws.com/prod-ucs-content-store-eu-west/content/pii:S0021951705002290/fgr020/DOWNSAMPLED/image/gif/8cab581b842b7c57614f637601578577/gr020.gif gr020 gr020.gif gif 16208 537 279 IMAGE-DOWNSAMPLED 1-s2.0-S0021951705002290-gr020.sml https://s3.amazonaws.com/prod-ucs-content-store-us-east/content/pii:S0021951705002290/fgr020/THUMBNAIL/image/gif/999c3cf69eabfd2864e63b4c12b8aab0/gr020.sml https://s3-eu-west-1.amazonaws.com/prod-ucs-content-store-eu-west/content/pii:S0021951705002290/fgr020/THUMBNAIL/image/gif/999c3cf69eabfd2864e63b4c12b8aab0/gr020.sml gr020 gr020.sml sml 1098 92 48 IMAGE-THUMBNAIL 1-s2.0-S0021951705002290-gr013.gif https://s3.amazonaws.com/prod-ucs-content-store-us-east/content/pii:S0021951705002290/fgr013/DOWNSAMPLED/image/gif/74eb2c542e235448ece29f54d7b771a5/gr013.gif https://s3-eu-west-1.amazonaws.com/prod-ucs-content-store-eu-west/content/pii:S0021951705002290/fgr013/DOWNSAMPLED/image/gif/74eb2c542e235448ece29f54d7b771a5/gr013.gif gr013 gr013.gif gif 12148 314 340 IMAGE-DOWNSAMPLED 1-s2.0-S0021951705002290-gr013.sml https://s3.amazonaws.com/prod-ucs-content-store-us-east/content/pii:S0021951705002290/fgr013/THUMBNAIL/image/gif/96801f3b0ca7d356d2bc92f6db82872a/gr013.sml https://s3-eu-west-1.amazonaws.com/prod-ucs-content-store-eu-west/content/pii:S0021951705002290/fgr013/THUMBNAIL/image/gif/96801f3b0ca7d356d2bc92f6db82872a/gr013.sml gr013 gr013.sml sml 2027 93 101 IMAGE-THUMBNAIL 1-s2.0-S0021951705002290-gr014.gif https://s3.amazonaws.com/prod-ucs-content-store-us-east/content/pii:S0021951705002290/fgr014/DOWNSAMPLED/image/gif/af713a5943edd18afd0a014cd0b1444b/gr014.gif https://s3-eu-west-1.amazonaws.com/prod-ucs-content-store-eu-west/content/pii:S0021951705002290/fgr014/DOWNSAMPLED/image/gif/af713a5943edd18afd0a014cd0b1444b/gr014.gif gr014 gr014.gif gif 12182 334 333 IMAGE-DOWNSAMPLED 1-s2.0-S0021951705002290-gr014.sml https://s3.amazonaws.com/prod-ucs-content-store-us-east/content/pii:S0021951705002290/fgr014/THUMBNAIL/image/gif/04fbdc23dca726caa6e3ca659b70184e/gr014.sml https://s3-eu-west-1.amazonaws.com/prod-ucs-content-store-eu-west/content/pii:S0021951705002290/fgr014/THUMBNAIL/image/gif/04fbdc23dca726caa6e3ca659b70184e/gr014.sml gr014 gr014.sml sml 1871 93 93 IMAGE-THUMBNAIL 1-s2.0-S0021951705002290-gr006.gif https://s3.amazonaws.com/prod-ucs-content-store-us-east/content/pii:S0021951705002290/fgr006/DOWNSAMPLED/image/gif/21ac5775c7a76364f9853721e91ef11e/gr006.gif https://s3-eu-west-1.amazonaws.com/prod-ucs-content-store-eu-west/content/pii:S0021951705002290/fgr006/DOWNSAMPLED/image/gif/21ac5775c7a76364f9853721e91ef11e/gr006.gif gr006 gr006.gif gif 18414 522 307 IMAGE-DOWNSAMPLED 1-s2.0-S0021951705002290-gr006.sml https://s3.amazonaws.com/prod-ucs-content-store-us-east/content/pii:S0021951705002290/fgr006/THUMBNAIL/image/gif/35b9fc778cae1cb1d785dccf87073705/gr006.sml https://s3-eu-west-1.amazonaws.com/prod-ucs-content-store-eu-west/content/pii:S0021951705002290/fgr006/THUMBNAIL/image/gif/35b9fc778cae1cb1d785dccf87073705/gr006.sml gr006 gr006.sml sml 1485 93 55 IMAGE-THUMBNAIL 1-s2.0-S0021951705002290-gr011.jpg https://s3.amazonaws.com/prod-ucs-content-store-us-east/content/pii:S0021951705002290/fgr011/DOWNSAMPLED/image/jpeg/ae73fc981c9b30478f751659baa37184/gr011.jpg https://s3-eu-west-1.amazonaws.com/prod-ucs-content-store-eu-west/content/pii:S0021951705002290/fgr011/DOWNSAMPLED/image/jpeg/ae73fc981c9b30478f751659baa37184/gr011.jpg gr011 gr011.jpg jpg 34547 332 314 IMAGE-DOWNSAMPLED 1-s2.0-S0021951705002290-gr011.sml https://s3.amazonaws.com/prod-ucs-content-store-us-east/content/pii:S0021951705002290/fgr011/THUMBNAIL/image/gif/4ba06b4eec156ad929fa4d53411d4746/gr011.sml https://s3-eu-west-1.amazonaws.com/prod-ucs-content-store-eu-west/content/pii:S0021951705002290/fgr011/THUMBNAIL/image/gif/4ba06b4eec156ad929fa4d53411d4746/gr011.sml gr011 gr011.sml sml 1824 93 88 IMAGE-THUMBNAIL 1-s2.0-S0021951705002290-gr018.gif https://s3.amazonaws.com/prod-ucs-content-store-us-east/content/pii:S0021951705002290/fgr018/DOWNSAMPLED/image/gif/a7a61eff6892c20fe3a8ae13d86bece2/gr018.gif https://s3-eu-west-1.amazonaws.com/prod-ucs-content-store-eu-west/content/pii:S0021951705002290/fgr018/DOWNSAMPLED/image/gif/a7a61eff6892c20fe3a8ae13d86bece2/gr018.gif gr018 gr018.gif gif 16301 523 299 IMAGE-DOWNSAMPLED 1-s2.0-S0021951705002290-gr018.sml https://s3.amazonaws.com/prod-ucs-content-store-us-east/content/pii:S0021951705002290/fgr018/THUMBNAIL/image/gif/61c6e95468b880320979bcd485ad8d22/gr018.sml https://s3-eu-west-1.amazonaws.com/prod-ucs-content-store-eu-west/content/pii:S0021951705002290/fgr018/THUMBNAIL/image/gif/61c6e95468b880320979bcd485ad8d22/gr018.sml gr018 gr018.sml sml 1187 93 53 IMAGE-THUMBNAIL 1-s2.0-S0021951705002290-gr001.gif https://s3.amazonaws.com/prod-ucs-content-store-us-east/content/pii:S0021951705002290/fgr001/DOWNSAMPLED/image/gif/acf7b20ea9d3d2c6f3794d6fc1d605d3/gr001.gif https://s3-eu-west-1.amazonaws.com/prod-ucs-content-store-eu-west/content/pii:S0021951705002290/fgr001/DOWNSAMPLED/image/gif/acf7b20ea9d3d2c6f3794d6fc1d605d3/gr001.gif gr001 gr001.gif gif 9010 314 329 IMAGE-DOWNSAMPLED 1-s2.0-S0021951705002290-gr001.sml https://s3.amazonaws.com/prod-ucs-content-store-us-east/content/pii:S0021951705002290/fgr001/THUMBNAIL/image/gif/2e707d31da7f2ede655cf0c3e2cda107/gr001.sml https://s3-eu-west-1.amazonaws.com/prod-ucs-content-store-eu-west/content/pii:S0021951705002290/fgr001/THUMBNAIL/image/gif/2e707d31da7f2ede655cf0c3e2cda107/gr001.sml gr001 gr001.sml sml 1507 93 98 IMAGE-THUMBNAIL 1-s2.0-S0021951705002290-gr002.gif https://s3.amazonaws.com/prod-ucs-content-store-us-east/content/pii:S0021951705002290/fgr002/DOWNSAMPLED/image/gif/f92cf092abb619ab95ac03a4232c4464/gr002.gif https://s3-eu-west-1.amazonaws.com/prod-ucs-content-store-eu-west/content/pii:S0021951705002290/fgr002/DOWNSAMPLED/image/gif/f92cf092abb619ab95ac03a4232c4464/gr002.gif gr002 gr002.gif gif 10700 314 340 IMAGE-DOWNSAMPLED 1-s2.0-S0021951705002290-gr002.sml https://s3.amazonaws.com/prod-ucs-content-store-us-east/content/pii:S0021951705002290/fgr002/THUMBNAIL/image/gif/8a36483ed65cf62277871ffcd80eab4b/gr002.sml https://s3-eu-west-1.amazonaws.com/prod-ucs-content-store-eu-west/content/pii:S0021951705002290/fgr002/THUMBNAIL/image/gif/8a36483ed65cf62277871ffcd80eab4b/gr002.sml gr002 gr002.sml sml 1804 93 101 IMAGE-THUMBNAIL 1-s2.0-S0021951705002290-gr016.gif https://s3.amazonaws.com/prod-ucs-content-store-us-east/content/pii:S0021951705002290/fgr016/DOWNSAMPLED/image/gif/75b551462e1345f482b7c0a4b7b5dbf2/gr016.gif https://s3-eu-west-1.amazonaws.com/prod-ucs-content-store-eu-west/content/pii:S0021951705002290/fgr016/DOWNSAMPLED/image/gif/75b551462e1345f482b7c0a4b7b5dbf2/gr016.gif gr016 gr016.gif gif 18769 525 310 IMAGE-DOWNSAMPLED 1-s2.0-S0021951705002290-gr016.sml https://s3.amazonaws.com/prod-ucs-content-store-us-east/content/pii:S0021951705002290/fgr016/THUMBNAIL/image/gif/f7fa533e47d9e3e678a2ba5b0a734559/gr016.sml https://s3-eu-west-1.amazonaws.com/prod-ucs-content-store-eu-west/content/pii:S0021951705002290/fgr016/THUMBNAIL/image/gif/f7fa533e47d9e3e678a2ba5b0a734559/gr016.sml gr016 gr016.sml sml 1365 93 55 IMAGE-THUMBNAIL YJCAT 8721 S0021-9517(05)00229-0 10.1016/j.jcat.2005.05.016 Elsevier Inc. Fig. 1 Performance of the screening and optimized CO mechanisms against the CO-ignition experimental data of [24] at atmospheric pressure. Other operating conditions include a catalyst area of 5.67 cm2, a reactor volume of 6 cm3, and a residence time of ∼1.9 s. Fig. 2 Performance of the screening and optimized CO mechanisms against the molecular beam experimental data of [25]. The total inlet flux is 1 ML/s and the inlet composition is CO/O2 =3/1. Fig. 3 Performance of the screening and optimized H2 mechanisms against the H2-ignition experimental data collected in our laboratory at atmospheric pressure in a microreactor. Other operating conditions include a reactor volume of 0.64 cm3, a catalyst area of 1.56 cm2, and a flow rate of 2 l/min (corresponding to a residence time of ∼20 ms). Fig. 4 Performance of the screening and optimized H2 mechanisms against the laser induced fluorescence (LIF) experiments of [5]. The operating conditions include a pressure of 0.102 Torr (0.1 Torr O2 and 0.002 Torr H2), a reactor volume of 400 cm3, and a catalyst area of 0.51 cm2. Fig. 5 Predictions of the coupling mechanism (R1–R46) against the WGS experimental data of [50]. The operating conditions include a pressure of 1 atm, a reactor volume of ∼0.5 cm3, an inlet flow rate of 200 cm3/min, and an inlet composition of 3% CO, 10% H2O, and 87% N2. A/V is fitted to 13.7 cm−1. Predictions without coupling reactions, i.e., with only reactions R1–R24 of Table 1, are also shown with dotted lines. Fig. 6 Predictions of the coupling mechanism against the CO PROX experimental data of [53]. The operating conditions include a pressure of 1 atm, a reactor volume of ∼0.1 cm3, an inlet flow rate of 120 cm3/min at STP, and an inlet composition of 1% CO, 1% O2, 75% H2, and 23% N2. Five different cases are shown with the coupling mechanism, viz., (1) A / V = 3.5 × 10 5 cm −1 , (2) A / V = 600 cm −1 , (3) A / V = 3.5 × 10 5 cm −1 and CO–H interactions of 3.7 kcal/(mol ML), (4) A / V = 600 cm −1 and CO–H interactions of 3.7 kcal/(mol ML), and (5) A / V = 600 cm −1 , CO–H interactions of 3.7 kcal/(mol ML), and modified pre-factors (shown in italics in Table 1). Case 0 represents predictions without the coupling reactions, i.e., with only reactions R1–R24 of Table 1, with an A/V of 3.5 × 10 5 cm −1 . Fig. 7 Dominant surface species coverage profiles under typical WGS and PROX conditions, using the coupling mechanism without CO–H interactions or any pre-factor modification. Panels a and b correspond to low and high temperatures, respectively. Fig. 8 Panel (a) shows the Rh slab with CO and H atoms, corresponding to a H*-coverage of 0.25 ML and a CO* coverage of 0.25 ml. A (2×2) periodic unit cell is used. Panel b shows the heat of CO chemisorption versus H*-coverage ( θ CO = 0.25 ) using DFT calculations on a three-layer Rh(111) slab. The line in panel (b) is a linear fit to the calculation points. Repulsive CO–H interactions of ∼3.7 kcal/(mol ML) are found. Fig. 9 RPA for WGS (a) and PROX (b) using the coupling mechanism with modified pre-factors and modified A/V values in the simulations. Various CO consumption pathways are analyzed excluding CO desorption, which has a significantly higher rate than the other reactions. A crossover in the dominant CO consumption pathway occurs for WGS as temperature increases. Fig. 10 Comparison of activation energies of various CO consumption reactions under typical WGS (a) and PROX (b) conditions. X* indicates possible reactant, such as O*, OH*, or H2O*. Dashed lines indicate the energetics with no adsorbate-adsorbate interactions between CO–CO, H–H, or CO–H, whereas solid lines indicate coverage dependent activation energies. The values in parenthesis indicate the activation energy of a surface reaction. Typical coverages of CO* and H* are 0.6 and 0.15 for WGS at 600 K and 0.8 and 0.19 for PROX at 450 K. Reaction R30 (CO* + OH* →COOH* + *) has the lowest activation energy under all conditions. Fig. A.1 Sensitivity analysis (SA) of the screening CO mechanism against ignition (Ign.) data of [24] and molecular-beam (MB1 [25] and MB2 [26]) experiments at different temperatures. Fig. A.2 Sensitivity analysis (SA) of the screening H2 mechanism for our ignition experiments at 10% H2/air conditions (a) and LIF experiments of [5] at low and high temperatures (b). Fig. B.1 Assessment of the optimized CO mechanism against the molecular-beam experiments of [25] for different compositions of CO and O2. The operating conditions include a total flux of 1 ML/s and CO/O2 ratios of 7/1, 5/3, and 3/5. The experimental data is fairly well captured by the optimized mechanism. No fitting of these data is done. Fig. B.2 Assessment of the optimized CO mechanism against the molecular-beam experiments of [26]. The operating conditions include a CO flux of 1.1×1018 molecules/(cm2 s) and a CO/O2 ratio of 1/1. The predictions of the optimized mechanism, normalized against the experimental peak rate, are in good agreement with the data. Fair agreement (within a factor of two) is observed when the predictions are not normalized. No fitting of these data is done. Fig. B.3 Assessment of the optimized CO mechanism against the CO-TPD data of [27] for two different initial CO*-coverages indicated. The operating conditions include a pressure of 10−10 Torr and an assumed ramp rate of 15 K/s. The rate of CO production is normalized with the experimental peak rate. No fitting of these data is done. Fig. B.4 Assessment of the optimized CO mechanism against the TPR data of [29] for different initial coverages indicated. The operating conditions include a pressure of 7.5×10−11 Torr and a ramp rate of 5 K/s. The rates of CO2 (a) and CO (b) production are normalized with the experimental peak rate (reported in arbitrary units). The simulated peak location and the shape of the TPR curve compare fairly well with the experiments. No fitting of these data is done. Fig. B.5 Assessment of the optimized H2 mechanism against the H2-TPD data of [30] for three different initial H*-coverages indicated. The operating conditions include an initial temperature of 100 K and a ramp rate of 6.7 K/s [31]. The rate of H2 production is normalized with the experimental peak rate. No fitting of these data is done. Fig. B.6 Assessment of the optimized H2 mechanism against the TPR data of [33] on Rh(100). The operating conditions include an initial temperature of 200 K and a ramp rate of 3.5 K/s. The rates of H2O and H2 production are normalized with the experimental peak rates. No fitting of these data is done. Fig. B.7 Predictions of the coupling mechanism with CO–H interactions and modified pre-factors against the CO PROX experimental data of [54]. The dashed line shows the lack of activity when the CO–H interactions are turned off. The operating conditions include a pressure of 1 atm, an assumed reactor length and diameter of 1 and 0.5 cm, respectively, an inlet flow rate of 100 cm3/min at STP, and an inlet composition of 0.2% CO, 1% O2, 3% H2, and 95.8% He. A/V is adjusted to 40 cm−1. No fitting of these data is done. Fig. B.8 Predictions of the coupling mechanism with CO–H interactions and modified pre-factors against the CO PROX experimental data of [55]. The dashed lines show the minute activity when the CO–H interactions are turned off. The operating conditions include a pressure of 1 atm, a temperature of 500 K, a reactor volume of 0.88 cm3, and a space velocity of 5 × 10 5 h −1 at STP. The dry feed stream contains 40% H2, 20% CO2, 0.2–1% CO, 0.2–1.5% O2, with N2 as balance. The mole ratio of H2O to dry gas is 1:10. In panel (a), O2/CO is equal to 1/1, whereas in panel (b), the inlet CO fraction is 0.5%. A/V is adjusted to 225 cm−1. No fitting of these data is done. Table 1 Surface reaction mechanisms for CO oxidation (R1–R10), H2 oxidation (R1–R4 and R11–R24), and CO–H2 coupling (R1–R46) for WGS and PROX reactions on Rh No. Reaction Sticking coefficient (unitless) or pre-factor (s−1) Temperature exponent β Activation energy at 300 K (kcal/mol) Oxygen adsorption–desorption steps R1 O2 + 2* → 2O* 4.81×10−2 1.997 0.0 R2 2O* → O2 + 2* 4.31×1012 1.199 80.9 − 42 θ O + f ( T ) R3 O + * → O* 4.45×10−2 −1.895 0.0 R4 O* → O + * 9.76×1012 −1.999 100 − 21 θ O + f ( T ) CO oxidation on Rh R5 CO + * → CO* 5.00×10−1 −2.000 0.0 R6 CO* → CO + * 2.26×1014 1.988 38.5 − 17 θ CO − 3.7 θ H + f ( T ) R7 CO2 + * → CO 2 ∗ 9.77×10−2 −1.946 0.0 R8 CO 2 ∗ → CO2 + * 1.13×1013 1.800 5.2+f(T) R9 CO 2 ∗ + * → CO* + O* 2.04×1010 1.545 17.3 + f ( θ O , θ H , θ CO , T ) a R10 CO* + O* → CO 2 ∗ + * 1.17×109 1.781 23.5 + f ( θ O , θ H , θ CO , T ) b H2 oxidation on Rh R11 H2 + 2* → 2H* 7.73×10−1 0.939 0.0 R12 2H* → H2 + 2* 5.56×1011 −0.435 20.4 − 5 θ H − 7.4 θ CO + f ( T ) R13 OH* + * → H* + O* 1.41×1011 −0.375 24.2 + f ( θ O , θ H , θ H 2 O , θ CO , T ) R14 H* + O* → OH* + * 1.73×1010 −0.710 14.2 + f ( θ O , θ H , θ H 2 O , θ CO , T ) R15 H2O* + * → H* + OH* 7.58 × 10 11 3.79 × 10 11 c 0.828 15.4 + f ( θ O , θ H , θ OH , θ H 2 O , θ CO , T ) R16 H* + OH* → H2O* + * 9.46 × 10 10 4.73 × 10 10 c 0.498 17.6 + f ( θ O , θ H , θ OH , θ H 2 O , θ CO , T ) R17 H2O* + O* → 2OH* 1.87×1010 −0.918 11.4 + f ( θ O , θ OH , θ H 2 O , T ) R18 2OH* → H2O* + O* 3.20×1010 −1.485 23.6 + f ( θ O , θ OH , θ H 2 O , T ) R19 OH + * → OH* 5.59×10−2 0.354 0.0 R20 OH* → OH + * 5.42×1013 −1.593 70 − 33 θ O + 25 θ H 2 O + f ( T ) R21 H2O + * → H2O* 7.72×10−2 1.407 0.0 R22 H2O* → H2O + * 2.06×1013 −1.861 10.8 − 4.5 θ H 2 O + 25 θ OH + f ( T ) R23 H + * → H* 1.63×10−1 1.688 0.0 R24 H* → H + * 2.83×1012 1.164 62.3 − 2.5 θ H − 3.7 θ CO + f ( T ) Coupling between CO and H2 chemistries on Rh R25 CO 2 ∗ + H* → CO* + OH* 1.07×1011 0.030 4.4 + f ( θ O , θ H , θ H 2 O , θ CO , T ) R26 CO* + OH* → CO 2 ∗ + H* 9.38×1010 −0.030 20.5 + f ( θ O , θ H , θ H 2 O , θ CO , T ) R27 COOH + * → COOH* 1.51×10−2 −0.938 0.0 R28 COOH* → COOH + * 4.69×1013 0.938 62.2+f(T) R29 COOH* + * → CO* + OH* 4.83×1011 −0.397 6.2 + f ( θ O , θ H , θ H 2 O , θ CO , T ) R30 CO* + OH* → COOH* + * 2.07×1010 0.397 18.6 + f ( θ O , θ H , θ H 2 O , θ CO , T ) R31 COOH* + * → CO 2 ∗ + H* 4.57 × 10 11 4.57 × 10 10 c −0.434 4.2 + f ( θ H , θ CO , T ) R32 CO 2 ∗ + H* → COOH* + * 2.19 × 10 10 2.19 × 10 9 c 0.434 0.6 + f ( θ H , θ CO , T ) R33 CO* + H2O* → COOH* + H* 7.15×1010 0.440 20.7 + f ( θ H , θ OH , θ H 2 O , θ CO , T ) R34 COOH* + H* → CO* + H2O* 1.40×1011 −0.440 10.5 + f ( θ H , θ OH , θ H 2 O , θ CO , T ) R35 CO 2 ∗ + OH* → COOH* + O* 9.54×1010 0.200 22.3 + f ( θ O , θ H 2 O , T ) R36 COOH* + O* → CO 2 ∗ + OH* 1.05×1011 −0.200 16.0 + f ( θ O , θ H 2 O , T ) R37 CO 2 ∗ + H2O* → COOH* + OH* 7.44×1010 0.479 13.5 + f ( θ O , θ OH , θ H 2 O , T ) R38 COOH* + OH* → CO 2 ∗ + H2O* 1.34×1011 −0.479 19.4 + f ( θ O , θ OH , θ H 2 O , T ) R39 HCOO + 2* → HCOO** 1.89×10−2 −0.555 0.0 R40 HCOO** → HCOO + 2* 3.74×1013 0.555 69.2+f(T) R41 CO 2 ∗ + H* → HCOO** 1.40×1010 0.654 4.2 + f ( θ H , θ CO , T ) R42 HCOO** → CO 2 ∗ + H* 7.12×1011 −0.654 0.0 + f ( θ H , θ CO , T ) R43 CO 2 ∗ + OH* + * → HCOO** + O* 5.97×1010 0.431 27.5 + f ( θ O , θ H 2 O , T ) R44 HCOO** + O* → CO 2 ∗ + OH* + * 1.67×1011 −0.431 13.4 + f ( θ O , θ H 2 O , T ) R45 CO 2 ∗ + H2O* + * → HCOO** + OH* 4.78×1010 0.696 18.4 + f ( θ O , θ OH , θ H 2 O , T ) R46 HCOO** + OH* → CO 2 ∗ + H2O* + * 2.09×1011 −0.696 16.4 + f ( θ O , θ OH , θ H 2 O , T ) The activation energies are temperature dependent according to statistical mechanics (see Table 2) [1,17,18]. The modified Arrhenius expression, k = A σ n − 1 ( T T o ) β e − E / ( R g T ) or k = s σ n R g T 2 π M ( T T o ) β e − E / ( R g T ) , is used for computing the rate constant k. Here A is the pre-factor, s is the sticking coefficient, σ is the site density, n is the reaction order, β is the temperature exponent, E is activation energy, R g is the ideal gas constant, and T is the absolute temperature. The coverage dependence of the activation energies of various reaction steps is incorporated in our simulations via the UBI-QEP method [37,38]. The functions f in the last column indicate the nonlinear dependence of activation energies on specific coverages indicated and on temperature. a A bond index of 0.8 is used in the UBI-QEP formula for the calculation of the forward activation energy, instead of the usual value of 0.5. b The backward activation energy is calculated using the forward activation energy of R9 and the heat of reaction. c Modified pre-factor to improve the predictions of the coupling mechanism against the CO PROX experiments of [53]. Table 2 Temperature and coverage dependent heats of chemisorption using statistical mechanics [1,17,18] and the UBI-QEP method [37,38]. The heat of chemisorption, Q(T), decreases with increasing temperature (here Δ T = T − T 0 and T 0 = 300 K ) Species Heat of chemisorption Q (kcal/mole) References Temperature dependence a Q ( T 0 ) − Q ( T ) R g Δ T Changes in degrees of freedom for deriving the temperature dependence b O* 100 − 21 θ O Expts. [28,59,60], DFT [61–63] 1.5 − 3 F T + 3 F V CO* 38.5 − 17 θ CO − 3.7 θ H Expts. [34,64–66], DFT [67,68], our DFT calculations 2.0 − 3 F T − 2 F R + F RR + 4 F V CO 2 ∗ 5.2 Expts. [69,70], UBI-QEP [71] 2.0 − F T − 3 F R + 4 F V H* 62.3 − 2.5 θ H − 3.7 θ CO Expts. [31], DFT [61,72–74], our DFT calculations 1.5 − 3 F T + 3 F V OH* 70 − 33 θ O + 25 θ H 2 O UBI-QEP [71], DFT [61,73] 2.0 − 3 F T − 2 F R + F RR + 4 F V H2O* 10.8 − 4.5 θ H 2 O + 25 θ OH Expts. [75], DFT [61,76] 2.5 − 3 F T − 3 F R + F RR + 5 F V COOH* 62.2 DFT [56] 2.5 − 3 F T − 3 F R + F RR + 5 F V HCOO** (bidentate) 69.2 DFT [56] 3.0 − 3 F T − 3 F R + 6 F V a The generalized assumptions to calculate the temperature dependence are as follows: (1) Each translational, rotational, and vibrational degree of freedom (DOF) corresponds to 0.5 R g T , 0.5 R g T , and R g T , respectively, where R g is the universal gas constant. (2) Upon adsorption, all translational DOF are converted into vibrational DOF. In the case of weakly bound molecules (such as CO2), only 1 translational DOF is lost upon adsorption (the molecule is able to move readily on the surface). (3) All rotational DOF are converted into vibrational DOF upon adsorption. For species, such as OH*, H2O*, and COOH*, with a vertical axis through the adsorbed atom, 1 of the gained vibrational DOF is assumed to be a free, internal rotor (rigid rotor approximation) and counts as 0.5 R g T . b F T , F R , and F V stand for translational, rotational, and vibrational DOF. F RR indicates that a vibrational DOF is assumed to be a free, internal rotor. The ‘minus’ and ‘plus’ signs indicate loss and gain of DOF, respectively. Hierarchical, multiscale surface reaction mechanism development: CO and H2 oxidation, water–gas shift, and preferential oxidation of CO on Rh A.B. Mhadeshwar D.G. Vlachos ⁎ Department of Chemical Engineering and Center for Catalytic Science and Technology, University of Delaware, Newark, DE 19716-3110, USA ⁎ Corresponding author. Fax: +1-302-831-1048. A hierarchical multiscale parameter refinement approach was used to develop microkinetic models for CO and H2 oxidation, and CO–H2 coupling for water–gas shift (WGS) and preferential oxidation (PROX) of CO on Rh. The rate parameters were estimated with a combination of quantum mechanical density functional theory (DFT), the semi empirical unity bond index-quadratic exponential potential method, and transition-state theory. To improve the predictive ability, selected pre-factors of the CO and H2 oxidation reaction mechanisms were optimized against multiple experimental data sets, such as ignition, molecular beam, and laser-induced fluorescence. Thermodynamic consistency of rate parameters was ensured over a wide temperature range by a combination of statistical mechanics and constraints-based optimization. DFT calculations were used to estimate cross adsorbate–adsorbate CO–H interactions. It is shown that the coupling between the two fuels arising from these interactions is essential for PROX of CO. Important reaction pathways in the WGS and PROX chemistries are discussed. For example, it is shown that the oxidation of CO by OH via the carboxyl intermediate, and not by O, is the dominant path in PROX. Thus, hydrogen acts as a “catalyst” for CO combustion under certain conditions. Finally, the mechanisms are validated against additional sets of redundant experimental data. Keywords Microkinetic modeling Hierarchical parameter refinement Fuel processing Carbon monoxide Hydrogen Catalytic combustion Water–gas shift Preferential oxidation Thermodynamic consistency Rhodium 1 Introduction Fuel-cell technology is of recent interest for generating electricity because of its potential widespread applications, ranging from small-scale portable devices to stationary power generation and automobiles. Compared with conventional lithium batteries, fuel cells offer far higher energy densities, and they are less polluting and could be more efficient than internal combustion engines. H2 acts as the fuel in proton exchange membrane (PEM) fuel cells. However, H2 storage and transportation are a major problem in the widespread commercialization of PEM fuel cells. Furthermore, even minute amounts of CO in the H2 fuel can poison the fuel-cell catalyst. Catalytic partial oxidation (CPOX) of natural gas on various transition metals can be used to produce syngas. Syngas produced by various means typically undergoes water–gas shift (WGS) reaction to convert CO to H2 (1) CO + H2O ↔ CO2+ H2. To minimize the remaining CO content in the H2 stream in order to avoid poisoning of the fuel-cell catalyst, preferential oxidation (PROX) of CO is typically carried out (2) CO + 1 2 O2 → CO2 and H2 + 1 2 O2 → H2O. All of these processes encompass the same fundamental chemistries of CO and H2 adsorption, desorption, and combustion, as well as synergetic effects arising from using multiple fuels. This synergism was referred to in Ref. [1] as CO–H2 coupling (see Section 3 for a more detailed discussion). Microkinetic modeling [2] offers an efficient approach to understanding the underlying chemistry and eventually design fuel processors used upstream of a PEM fuel cell. Obviously, the uniqueness of kinetic parameters that can explain certain experimental features still remains a problem under certain conditions. For example, we have found examples where even small changes in parameters can change the rate-determining step [1]. A number of microkinetic models have previously been proposed for natural gas CPOX and its subsets on Pt and Rh [3–10]. However, all of these mechanisms have some inherent limitations, as outlined in [11–14]. A primary reason for the lack of a single comprehensive predictive reaction mechanism is that most of these mechanisms are optimized against a single type of experimental data. A limited number of fundamental density functional theory (DFT)-based microkinetic models [15,16], for PROX and WGS on various transition metals, established the foundations for first-principles modeling but do not account for CO–H2 coupling steps, adsorbate–adsorbate interactions, and catalyst heterogeneity. Most fitted mechanisms lack thermodynamic consistency, an essential feature for ensuring correct rate calculations, equilibrium composition, energy balance, and temperature profiles [17]. This becomes an essential issue when equilibrium limited reactions, such as WGS, are modeled at high temperatures. Over the past few years, we have been developing techniques that overcome the above limitations [13,14,17] to describe CO oxidation [18,19], H2 oxidation [1,13,14], and CO–H2 coupling for WGS and PROX [1,20] on Pt. More recently, we have introduced a hierarchical multiscale approach [21] that combines quantum mechanical DFT with semiempirical methods to improve predictive capabilities with minimal computational cost. In brief, the approach is hierarchical in nature, since we start with simple theoretical tools (e.g., semiempirical estimation methods, mean field approximation, simple reactor models) to identify the important parameters, followed by refinement (iterative, if necessary) of these parameters only, with the use of advanced theoretical and computational tools (e.g., first-principles quantum mechanics, kinetic Monte Carlo, molecular dynamics, computational fluid dynamics). Our approach is multiscale, since tools and phenomena span a broad range of length and time scales, from the quantum to the reactor. Reviews of multiscale simulation can be found in [22,23]. Note that in conventional bottom-up multiscale simulation, nearly all tools are coupled. However, for complex systems, such as catalytic reactions on polycrystalline and supported catalysts, we advocate that only some of these higher-level theoretical tools should be used whenever judged necessary. Consequently, the hierarchical approach makes simulations feasible in reasonable computational times. In this paper, we develop microkinetic models for CO and H2 oxidation and for the WGS and PROX on Rh, using the hierarchical approach. The paper is organized as follows. The development of CO and H2 catalytic oxidation mechanisms is discussed in Section 2 with pre-factor refinement against targeted experiments, which we identify via sensitivity analysis (SA) in Appendix A, and by ensuring thermodynamic consistency. These reaction mechanisms serve as building blocks for the more complex WGS and PROX reactions and to illustrate some elements of the reaction mechanism development. Section 3 is devoted to the development of a CO–H2 coupling mechanism, along with an analysis of the important reaction pathways in WGS and PROX. Finally, further validation of the reaction mechanisms is presented in Appendix B. 2 CO and H2 oxidation mechanisms on Rh 2.1 Experimental data on CO oxidation and H2 oxidation on Rh Sant and Wolf [24] carried out atmospheric pressure ignition experiments on a Rh/SiO2 wafer with a mixture of CO, O2, and N2. The ignition temperature of CO/O2 mixtures was found to increase with the inlet CO composition (Fig. 1 ). Molecular beam experiments were carried out by Gopinath and Zaera [25] on a Rh(111) single crystal to investigate the effects of temperature and inlet composition on the rate of CO2 production (Figs. 2 and B.1 ). The CO2 production rate versus temperature shows a maximum for all compositions. Coulston and Haller [26] studied the effect of temperature on the rate of CO2 production on a Rh foil with molecular beam experiments. The CO2 production rate exhibited a maximum (Fig. B.2). CO TPD (Fig. B.3), O2 TPD, and CO–O2 TPR (Fig. B.4) experiments on Rh(111) and Rh(100) single crystals were investigated by several groups [27–29]. The desorption rates of CO and O were found to be coverage dependent. To the best of our knowledge, ignition experiments for H2 oxidation on Rh are not available in the literature; therefore, we have conducted such experiments in our laboratory at 1 atm with a Rh foil inserted into a metallic microreactor. The ignition temperature of H2/O2 mixtures was found to decrease with increase in the inlet H2 composition (Fig. 3 ). Zum Mallen et al. [5] carried out laser-induced fluorescence (LIF) studies on a polycrystalline Rh foil with H2/O2 mixtures. The OH LIF signal was found to increase with increasing temperature (Fig. 4 ). H2 TPD (Fig. B.5), H2O TPD, and H2–O2 TPR (Fig. B.6) experiments on Rh(111), Rh(110), and Rh(100) single crystals were carried out by several groups [30–33]. The activation energy for H2 desorption was found to be coverage dependent. 2.2 Screening surface reaction mechanisms, parameter estimation, and model assessment For the CO oxidation mechanism on Rh, we propose five reversible elementary-like steps (R1–R10), as shown in Table 1 . Similarly, nine reversible elementary-like steps are proposed for H2 oxidation (R1–R4 and R11–R24). The dissociative and atomic adsorption–desorption steps of oxygen (R1–R4) are common in both mechanisms. These and all other steps in our mechanism follow Langmuir–Hinshelwood kinetics. However, additional reactions, such as Eley–Rideal and steps involving subsurface species, could easily be included if information existed. We first make initial estimates of kinetics parameters to develop screening reaction mechanisms, and we use the mean-field approximation for all calculations. This process is outlined next. Transition-state theory (TST)-based order-of-magnitude initial estimates of the pre-factors are taken to be 1013 s−1 for desorption steps and 1011 s−1 for Langmuir–Hinshelwood (LH)-type surface reactions [2]. The initial CO desorption pre-factor is taken to be 1016 s−1, considering its typical range of 1014–1018 s−1 [34]. Initial sticking coefficients of O2, CO, H2, and H2O are taken to be 0.1, 0.9, 0.25, and 0.7, respectively, whereas those of the other species (O, CO2, OH, and H) are assumed to be equal to 1. These initial sticking coefficients are similar to the ones in the screening reaction mechanisms on Pt [13,14,19] and merely serve as starting values that are optimized against experimental data and thermodynamic constraints (see Section 2.3). The adsorption steps are considered to be non-activated, in accordance with previous mechanisms in [3,5–10] and experiments on the specific diatomics [30,35]. Most chemisorption energies and adsorbate–adsorbate interactions are taken as intermediate values from a range of literature experimental and DFT data without further adjustment. Hydrogen bonding interactions of 25 kcal/(mol ML) (ML stands for monolayer) are assumed between adsorbed OH and H2O molecules, by analogy to Pt [1], based on the DFT calculations of Michaelides and Hu [36]. The species chemisorption energies and their coverage dependence are summarized in Table 2 . These coverage-dependent heats of chemisorption, shown in Table 2, are then used in the UBI-QEP framework [37,38] to calculate the activation energies of the reaction steps. The activation energies are shown in Table 1. For the LH surface reaction R9–R10 ( CO 2 ∗ + ∗ ↔ CO ∗ + O ∗ ), we propose a modified bond index of 0.8 instead of the UBI-QEP value of 0.5 that is usually assumed [37,38]. Such modification was previously proposed for CO oxidation on Pt [18], because of a comparison of the UBI-QEP estimate with DFT predictions and experimental data. This modification is further supported by recent DFT work [39–43], which shows that for certain classes of reactions, the structure of the transition state is more similar to the products than the reactants or vice versa. As an example, Michaelides et al. [39] found that dissociation activation energies are typically linearly proportional to the heats of reaction with a slope of 0.86, rather than the classical value of 0.5; this high slope implies that these surface reactions have product-like or late transition states. This is an example of how semiempirical methods can be improved or retained based on higher level theoretical (DFT) tools. The last part of parameter estimation is associated with ensuring enthalpic consistency as the temperature varies, following the concepts discussed in [17]. Briefly, the gas-phase reaction enthalpies are temperature dependent. To ensure enthalpic consistency in a mechanism, the enthalpies of adsorption, desorption, and surface reactions should also be temperature dependent. We use statistical mechanics to incorporate temperature dependence in the heats of chemisorption by accounting for the changes in translational, rotational, and vibrational degrees of freedom (DOF) that occur upon adsorption–desorption [1,17,18]. For example, O has three translational DOF in gas phase. It is assumed that upon adsorption, these DOF are converted into three vibrational DOF. Assuming each translational DOF and vibrational DOF to be approximately equal to 0.5 R g T and R g T , respectively, the net heat of chemisorption has a temperature dependence of 1.5 R g T . Here, R g is the universal gas constant and T is the temperature. Note that different assumptions may be invoked. For example, one could account for the high mobility of certain species, such as H, on the surface at higher temperatures. However, heats of chemisorption change moderately over typical temperature ranges. The temperature dependence of the heats of chemisorption and the associated formulae are summarized in Table 2. Since heats of chemisorption are input to the UBI-QEP method to compute activation energies, this temperature dependence makes the activation energies also temperature dependent. Ensuring entropic consistency as a function of temperature is also crucial, and this is achieved in the optimization process with a previously described method [17]. In the remainder of the paper, no adjustment of the activation energies is made. Figs. 1–4 show the predictions (dashed lines) made with the screening mechanisms against experimental data for CO ignition [24], molecular beam CO oxidation [25], H2 ignition (this work), and LIF H2/O2 experiments [5], respectively. Predictions are qualitative, indicating that the mechanisms and associated parameters are reasonable. However, the agreement between model predictions and the experimental data is not spectacular. In particular, the ignition temperatures are either underpredicted (for CO in Fig. 1) or overpredicted (for H2 in Fig. 3). Reaction rate predictions in Fig. 2 are flatter compared with the experimental data, whereas the slope in the LIF predictions in Fig. 4 is not in complete agreement with the experimental data. 2.3 Optimization of pre-factors, model predictions, and validation Predictions made with the screening mechanisms are not quantitative. This is due in part to the fact that the initial pre-factor and sticking coefficient estimates are very crude and do not obey entropic consistency. Optimization and enforcement of entropic consistency of these parameters are therefore necessary. To reduce the number of parameters optimized, neither heats of chemisorption nor activation energies are modified. SA is first carried out to select targeted experiments for optimization, as described in Appendix A. The experimental data in Figs. 1–4 have been selected as optimization targets, and other data, judged as providing redundant information in terms of the key kinetic parameters, are left for validation (see Appendix B). Note that these data are collected on single crystal, polycrystalline foil and supported catalysts and over a range of pressures. This diversity is due in part to a lack of such data on the same (e.g., supported) catalyst and in part is created purposely to overcome the materials and pressure gaps. Obviously, it is tacitly assumed that the fundamental chemistry is structure insensitive. The optimization range for sticking coefficients is taken to be 5 × 10 −3 to 1 (see [44,45] for typical estimates), whereas that for pre-factors is taken to be as two orders of magnitude in either direction from the nominal values mentioned above. The sticking coefficient of CO is restricted to the range of 0.5–1, based on typical values reported in [46–48]. To ensure entropic consistency, the implicit thermodynamic constraints approach with a modified Arrhenius equation (denoted as case b in [17]) is used in the optimization. The IMSL subroutine library [49] is used for optimization. The screening CO mechanism is first optimized against the CO ignition [24] and the molecular beam CO oxidation [25] experiments. While the screening H2 mechanism is optimized against the H2 ignition (this work) and the LIF H2 oxidation [5] experiments, the oxygen parameters (common reactions R1–R4) are kept the same as those in the optimized CO oxidation mechanism. Pre-factors and temperature exponents of both mechanisms are optimized against experimental points, along with entropic constraints over a temperature range from room temperature to ∼2000 K. The optimized parameters are shown in Table 1. The mechanisms in Table 1 are hereafter referred to as the optimized CO and H2 oxidation mechanisms. Predictions using the optimized parameters against the targeted experiments are shown in Figs. 1–4 (solid lines), where reasonably good performance is observed. Significant improvement in thermodynamic consistency is observed after optimization (ratios of equilibrium constants lie close to 1) compared with the screening mechanisms (ratios of equilibrium constants are on the order of 102–103), over the temperature range of 300–2000 K. Further validation of these mechanisms against additional experimental data sets is shown in Appendix B. 3 Development of a CO–H2 coupling mechanism 3.1 Experimental data on WGS and CO PROX on Rh Interest in WGS and CO PROX on noble metals has recently increased because of their non-pyrophoric nature and high activity in the presence of steam. Different research groups have used Rh for such experiments. Panagiotopoulou and Kondarides [50] carried out fixed-bed WGS experiments on Rh/TiO2 and found that Rh is an active catalyst for WGS (Fig. 5 ). Wheeler et al. [51] and Utaka et al. [52] carried out WGS experiments with a Rh/Al2O3 washcoat monolith reactor and a fixed-bed reactor with Rh/Al2O3 catalyst, respectively, and found similar observations. In those experiments, CO conversion initially increases as a function of temperature, corresponding to a kinetically controlled regime, and then decreases at higher temperatures because of the reverse water–gas shift (RWGS) reaction. Regarding CO PROX experiments, Han et al. [53] measured CO conversion and selectivity on a Rh/MgO catalyst in a fixed-bed microreactor. Similar to WGS, the CO conversion shows a maximum, whereas the selectivity for CO oxidation significantly decreases from ∼70 to ∼30% (Fig. 6 ). Ito et al. [54] studied the low-temperature regime of CO PROX (80–140 °C) on Rh/SiO2 and observed a continuous rise in CO conversion with increasing temperature (Fig. B.7). Chen et al. [55] studied the effect of inlet composition on CO conversion in a microchannel reactor (Fig. B.8). These different types of experiments cover a wide range of operating conditions and are useful in the optimization and validation of the surface reaction mechanism. 3.2 Coupling pathways, initial parameter estimation, and predictions For the combined reaction steps (R1–R24) of the CO and H2 combustion mechanisms, little activity is found under typical WGS and PROX experimental conditions, as shown in Figs. 5 and 6, respectively. In this mechanism, the oxidation of CO* occurs via O* forming by dissociative adsorption of O2 in the case of PROX or after complete dissociation of H2O* in the case of WGS (3) H2O* → OH* + H* → O* + 2H*. In our previous work on WGS and PROX on Pt, we showed that aside from the obvious coupling of site competition between the two fuels and sharing of O* as an oxidant, there are additional chemical reaction steps that couple the two reaction mechanisms [1]. These coupling steps between CO and H2 chemistries are essential for providing sufficient speed to capture the promoting effect of water on CO oxidation as well as WGS and PROX experimental data, even under equilibrium conditions, with reasonable catalyst surface areas [1]. Here we propose the same additional mechanistic steps for Rh (R25–R46), shown in Table 1. The coupling pathways include the oxidation of adsorbed carbon monoxide CO* by OH* to CO 2 ∗ via the direct path R26 CO 2 ∗ + H ∗ ↔ CO ∗ + OH ∗ . The indirect oxidation CO* to CO 2 ∗ by OH* via path R30 entails the intermediate carboxyl COOH* formation and thermal decomposition: (R29–R30) COOH* + * ↔ CO*+ OH*, COOH ∗ + ∗ ↔ CO 2 ∗ + H ∗ , and the oxidation of CO* by H2O* (reaction R33), (R33–R34) CO* + H2O* ↔ COOH* + H*. Additional COOH*-related reactions (R27–R28 and R35–R38, which describe other steps to CO 2 ∗ from carboxyl) and formate (HCOO**)-related steps (R39–R46) are also accounted for. The overall mechanism in Table 1 (R1–R46) is referred to as the coupling mechanism. The heats of chemisorption of COOH* and HCOO** are taken from [56]. Pre-factors and activation energies are estimated with the same approach explained in Section 2. The pre-factors and sticking coefficients are made thermodynamically consistent by minimizing of the deviation between gas-phase reaction entropies and surface reaction entropies (see [1] for details). The thermodynamically consistent parameters of the coupling mechanism are shown in Table 1, and the relevant heats of chemisorption and their statistical mechanics-based temperature dependence are shown in Table 2. The coupling mechanism is used to model the WGS and CO PROX experiments of [50] and [53], respectively, without any adjustments of kinetic parameters. With the area of catalyst per unit reactor volume ( A / V ) as an adjustable parameter, it is possible to get reasonable agreement with the experimental WGS data, as shown in Fig. 5 (dashed lines). Even though the WGS data are captured well, the CO conversion and selectivity in PROX are substantially underpredicted at high temperatures (case 1 in Fig. 6). Furthermore, the good agreement at low temperatures of PROX is only possible for an A / V value of > 10 5 cm −1 that is too high. Therefore, it is necessary to resolve this issue. 3.3 Hierarchical multiscale parameter refinement using DFT As a first step toward rationalizing the inability of the coupling mechanism to predict the PROX data, the coverages of dominant surface species are checked. Under the low temperatures of WGS and PROX, CO* and H* are the most abundant reactive intermediates (MARI), with coverages on the order of 0.9 and 0.1, respectively, as shown in Fig. 7 a. At high temperatures, the CO* and H* coverages are in the range of 0.4–0.7 and 0.2–0.5, respectively (e.g., see Fig. 7b). Whereas the heats of chemisorption account for CO–CO and H–H interactions, adsorbate–adsorbate interactions between CO* and H* need to be incorporated into the kinetic parameters, given that both species are present in significant fractions on the surface. This is an example of hierarchical multiscale parameter refinement, whose overall idea was discussed in [21] and relies on refinement of parameters of the semiempirical UBI-QEP method using DFT calculations, only after the simulations have been carried out with the semiempirical method to identify the MARI and rate-determining steps. We have carried out periodic DFT calculations on a three-layer 2 × 2 Rh(111) slab with DACAPO software [57]. A total of eight DFT calculations, that is, gas-phase CO, gas-phase H, Rh slab, CO/Rh, H/Rh, (CO+H)/Rh, (CO+2H)/Rh, and (CO+3H)/Rh, are carried out. The adsorbates and the top two slab layers are relaxed, whereas the bottom slab layer is fixed. A picture of adsorbates on the Rh slab is shown in Fig. 8 a. Fig. 8b shows the effect of H* coverage on the heat of CO chemisorption. Repulsive CO–H interactions of 3.7 kcal/(mol ML) are found. While calculating these interactions, we assumed pairwise additivity. Upon the addition of an H to a system of CO + n H ( n = 0 , 1, 2), CO–H and H–H interactions are estimated. Furthermore, it is assumed that the effect of CO on H is the same as that of H on CO. Because of symmetry and a typically observed linear behavior for other systems [21,58], a similar dependence of the heat of H chemisorption on CO* coverage is assumed (see Table 2). Even though the magnitude of these interactions is relatively small, these cross-interactions significantly affect the H2 desorption energy (by as much as ∼7 kcal/mol, which is a ∼35% decrease compared with the zero coverage desorption energy of ∼20 kcal/mol). Such a substantial decrease in activation energy of desorption results in a decrease in H* coverage due to the high CO* coverage, and a further increase in the CO* coverage toward 1, which in turn changes the mechanism activity at these relatively low temperatures. In comparison, since the H* coverage is small, the CO desorption energy is less affected (see Table 2). This coverage dependence is then incorporated into the UBI-QEP method and affects a number of reaction steps. In the WGS reaction, without CO-H interactions, the reaction (R33–R34) CO* + H2O* ↔ COOH* + H* is the most dominant CO consumption reaction at low temperatures (e.g., 450 K). When CO–H interactions are included, the H2 desorption energy decreases, leading to a higher CO* coverage. Because of an order-of-magnitude decrease in H*-coverage, all remaining coverages, including H2O*, increase. At the same time, the activation energy of R33 increases slightly, leading to an overall increase in the rate of R33 by a factor of ∼2. Therefore, the CO–H interactions shift the activity to lower temperatures (not shown) by ∼50 °C, but the dominant CO consumption pathway remains the same at low temperatures. Overall, the cross-CO–H interactions accelerate the onset of catalyst activity, but their effect is not dramatic. In the PROX reaction, without the CO–H interactions, both R10, CO ∗ + O ∗ → CO 2 ∗ + ∗ and the carboxyl path R30, (R30) CO* + OH* → COOH* + * are the important CO consumption pathways at low temperatures. The CO–H interactions decrease the H2 desorption energy by ∼7 kcal/mol, resulting in an increase of the CO* coverage of up to ∼0.96 at low temperatures (e.g., at 380 K) and a reduction of H* coverage. The activation energy of hydroxyl formation, (R14) H* + O* → OH* + * decreases by ∼2 kcal/mol, resulting in higher OH* production. This increased rate of OH* production, in conjunction with a similar decrease in the activation energy of the carboxyl formation via R30 by ∼1.5 kcal/mol, gives rise to a higher rate of R30. The net result is that R30 becomes the most dominant CO consumption reaction and leads to higher CO conversion at lower temperatures without the need for unrealistically high surface areas. Overall, the CO–H interactions shift the activity to lower temperatures (case 3 in Fig. 6a) by ∼50 °C when A / V is kept fixed. However, the high-temperature data are still not well captured. An important consequence of including interactions is that one can now adjust A / V to a reasonable value to predict the low-temperature region and part of the high-temperature data fairly well (case 4 in Fig. 6a). With this moderate A / V , when the interactions are turned off, the low-temperature activity drops (case 2 in Fig. 6a). Therefore, in PROX the CO–H interactions significantly affect the dominant CO consumption pathways at low temperatures and enhance the net rate for CO consumption. The effect of CO–H lateral adsorbate–adsorbate interactions on chemistry is an additional manifestation of synergism between multiple fuels arising from concentration or proximity effects, that is, the fact that surface processes often operate under non-dilute and therefore non-ideal conditions. This coupling is unique to reactions in liquids and on surfaces. In our case, the presence of CO at low temperatures has a promoting effect on CO combustion, with hydrogen used to combust and regenerate H*. Reaction path analysis (RPA) at 380 K shows that reactions R14 (H* +O* → OH* + *) and R10 (CO* +O* → CO 2 ∗ + *) contribute equally to O* consumption without CO–H interactions. CO* consumption occurs almost equally through R10 and R30 (CO* +OH* →COOH* + *), as mentioned before. Furthermore, R16 (H* +OH* →H2O* + *) is negligible compared with R14. This results in a H* -catalyzed path, given as (R14) H* + O* → OH* + *, (R30) CO* + OH* → COOH* + *, COOH ∗ + ∗ → CO 2 ∗ + H ∗ , net: CO ∗ + O ∗ → CO 2 ∗ + ∗ , where no net consumption of H* occurs, giving rise to 100% CO2 selectivity. However, with CO–H interactions, the activation energy of R16 decreases by ∼1.9 kcal/mol, leading to R14 ≈R16. Since R16 is no longer negligible, some net H2 consumption occurs, leading to a moderate selectivity for CO2 formation. 3.4 Important reactions for PROX at high temperatures By including CO–H interactions, the coupling mechanism still underpredicts the highest temperature PROX data (case 4 in Fig. 6a). To improve the high-temperature predictions, a pairwise SA is carried out at high temperatures (635 K) with respect to the pre-factors. The forward and backward pre-factors are perturbed by the same fraction to maintain thermodynamic consistency. SA indicated (not shown here) that the water dissociation reaction, (R15–R16) H2O* + * ↔ H* + OH* is the most important step (normalized sensitivity coefficient =−0.28), followed by the carboxyl decomposition reaction, COOH ∗ + ∗ ↔ CO 2 ∗ + H ∗ (normalized sensitivity coefficient =−0.05). To keep the predictions of optimized H2 mechanism nearly unaltered, we decreased the pre-factors of R15–R16 by a factor of only 2. The pre-factors of R31–R32 are decreased by a factor of 10 to improve the high-temperature PROX predictions. This is another example of iterative parameter refinement. The modified pre-factors of these two steps are shown in Table 1 in italics. The predictions of the coupling mechanism with modified pre-factors are shown in Figs. 5 and 6 (solid lines, denoted as case 5 in Fig. 6). Both sets of data are fairly well captured, and the agreement at high temperature is significantly improved, especially for PROX. The WGS predictions in Fig. 5 are slightly deteriorated, but this is definitely outweighed by the significant gain in the PROX predictions in Figs. 6, B.7, and B.8. No adjustment of pre-factors was made for the WGS data. In the remainder of the paper, we refer to this set of parameters as coupling mechanism with interactions and modified pre-factors. The results of the H2 oxidation mechanism are almost unaffected by the pre-factor modification. Such pre-factor modification is within the range of uncertainty of typical parameter estimation techniques. In fact, instead of a change in the pre-factors of R31–R32 by a factor of 10, an increase in the forward and backward activation energies by ∼2.5 kcal/mol (this could be done, for example, by a change in the bond index of these reactions from 0.5 to 0.8) gives similar predictions. The CO–H interactions are also found to be important for providing sufficient activity for the PROX predictions shown in Figs. B.8 against the experimental data of [55]. Similarly, CO–H interactions are necessary to enable use of a moderate A / V value against the experimental PROX data of [54], as shown in Fig. B.7. Finally, one should note that the dominant surface species are still CO* (coverage ≈0.2–1.0) and H* (coverage ≈0–0.8), for the coupling mechanism with CO–H interactions and modified pre-factors, which indicates that no further hierarchical parameter refinement is necessary in terms of additional adsorbate–adsorbate interactions. 3.5 Analysis of reaction pathways in the coupling mechanism with interactions and modified pre-factors An RPA is carried out with the coupling mechanism with interactions and modified pre-factors, and adjusted A / V values to identify the important CO consumption paths as a function of temperature. Figs. 9 a and b show the RPA for WGS and PROX, respectively. Figs. 10 a and b compare the activation energies for the CO consumption pathways for typical WGS and PROX conditions, respectively, with adsorbate–adsorbate interactions taken into account (solid lines), and without interactions (dashed lines). R30 has the lowest activation energy with or without any adsorbate-adsorbate interactions between CO–CO, H–H, and CO–H. The interactions substantially decrease the activation energy of R30. At low temperatures, the dominant pathway for CO consumption in WGS is carboxyl formation by H2O* (R33) CO* + H2O* → COOH* + H*. However, at higher temperatures, the dominant CO consumption path changes to (R30) CO* + OH* → COOH* + *. R30 has a lower activation energy than R33 at low temperatures (e.g., 5.7 kcal/mol vs. 13.6 kcal/mol at 450 K (not shown)) as well as at high temperatures (e.g., 9.7 kcal/mol vs. 16.1 kcal/mol at 600 K, as shown in Fig. 10a). However, at low temperatures, the OH* coverage ( ∼ 10 −7 ) is negligible compared with that of H2O* ( ∼ 10 −4 ). Therefore, R33 dominates at low temperatures. On the other hand, at high temperatures, R33 and the H2O* decomposition reaction (R15) H2O* + * → H* + OH* with a comparable activation energy of 16.9 kcal/mol, start competing with the H2O* consumption path. As a result, more OH* is produced at a coverage on the order of ∼ 10 −5 , and the rates of R30 and R26 (CO* +OH* → CO 2 ∗ + H*) increase. Since the activation energy of R30 is much lower than that of R33, there is a gradual crossover in the most important CO consumption pathway toward R30. This crossover is different from our previous observations on Pt, where the carboxyl path R33 via H2O* dominated in the entire temperature range of WGS [20]. This is not an effect of CO–H interactions or pre-factor modification, because even without taking these into account, a similar crossover is mechanistically observed on Rh. As a final note, it is clear that activation energies alone (Fig. 10a) do not explain the dominant paths shown in Fig. 9a. Coverages are also important in controlling activation energies and the actual reaction rates via mass action kinetics. In PROX on Rh, since H2O* coverage is negligible at the conditions of these experiments, R30 is the most dominant CO consumption pathway at all temperatures. This is again different from our observations on Pt [20], where all CO consumption paths (R26, R30, and R33) except R24 contribute in different temperature ranges. Since the coupling mechanism on Rh shows higher CO conversion at all temperatures than the coupling mechanism on Pt [20], Rh is a better PROX catalyst than Pt, in accordance with the experiments of [53]. 4 Conclusions Toward the goal of developing a comprehensive surface reaction mechanism for natural gas partial oxidation on Rh and subsequent CO removal, thermodynamically consistent reaction sets have been proposed for CO and H2 oxidation chemistry, WGS, and PROX reactions. Parameter estimation entailed combining the semiempirical UBI-QEP method, DFT calculations, and crude TST estimates. All reaction sets have been thermodynamically consistent from room temperature to ∼2000 K using statistical mechanics and constraints-based optimization. It has been found that the CO+O reaction in WGS and PROX reactions is slow, and additional CO–H2 coupling reactions, including the carboxyl and hydroxyl intermediates as well as H2O, are crucial steps for these processes. Incorporation of adsorbate–adsorbate CO–H interactions, computed via DFT, into the UBI-QEP semiempirical method in a hierarchical multiscale manner was found to be essential in developing a reaction mechanism that can predict the PROX data well. The proposed mechanisms capture targeted and additional experimental data well over a range of conditions. Their integration into methane and oxygenate chemistry will be discussed in a forthcoming publication. It is important to note that a one-step reduced-rate expression based on microkinetic models, such as that developed in [20], could be valuable for reactor design. Finally, identification of rate-determining step(s) could assist the improvement of catalysts. Acknowledgements This work was supported in part by ConocoPhillips and by the donors of the Petroleum Research Fund, administered by the American Chemical Society. ABM acknowledges Dr. Daniel Norton of University of Delaware for the assistance with the H2 ignition studies in a microreactor. We also acknowledge Prof. Manos Mavrikakis of the University of Wisconsin, Madison, for providing heats of chemisorption data, used in Table 2, before publication. Appendix A Selection of targeted experiments for optimization of CO and H2 screening mechanisms Given multiple experimental data sets, one needs to select targeted experiments for optimization and regard other data sets as redundant experiments to validate the performance of an optimized mechanism. SA is a useful tool for such a task. Fig. A.1 shows the SA of the screening CO mechanism for ignition (Ign.) data [24] and molecular-beam experiments (MB1 and MB2 refer to experiments of [25] and [26], respectively) at different temperatures. The sensitivity coefficients are defined as d ln R / d ln A , where R is the model response and A is the pre-factor. The model responses are the ignition temperature for the ignition experiments and the CO2 production rate for the molecular-beam experiments. It is found that the adsorption–desorption of CO, the O2 adsorption, and the surface reaction between CO* and O* are the most important steps. Because of a similar sensitivity in the two molecular-beam experiments, the second data set (MB2) can be considered as a redundant experiment and used for mechanism validation only. The CO-TPD [27] experiments depend only on the CO desorption pre-factor, as expected (not shown), whereas the CO oxidation TPR experiments of [29] are sensitive to the LH-type reaction between CO* and O* only (not shown); therefore they are also redundant and are used for validation. Fig. A.2 a shows the SA of the screening H2 mechanism for our ignition data, and Fig. A.2b shows the SA for the LIF experiments of [5] at low and high temperatures. The model responses are the ignition temperature for ignition experiments and the OH mole fraction for the LIF experiments. Fig. A.2a shows that the adsorption–desorption of H2 and O2 and the surface reaction between H* and O* are the most important steps. For the LIF data, the model response is sensitive to the adsorption–desorption of O2, the adsorption of H2, and the desorption of OH (as expected), and at low temperatures it is affected to some extent by the loss of OH to H2O+O. Again, the H2-TPD [30] experiments depend only on the corresponding desorption pre-factor (not shown), whereas the H2 oxidation TPR [33] experiments are sensitive only to LH-type reaction steps (not shown); therefore they are also redundant and are used for validation. Overall, the ignition, molecular-beam (MB1), and LIF experiments are selected as targeted experiments for optimization of the pre-factors of the mechanisms. These experiments represent a wide range of operating conditions, from atmospheric pressure to low pressures, and from low temperatures to high temperatures. Appendix B Assessment of reaction mechanisms against additional experimental data on Rh Even though the optimized parameters capture the targeted experimental data, it is important to assess their performance against other redundant data sets, so that their validity under different operating conditions can be justified. Here we show the performance of the reaction mechanisms listed in Table 1 against some selected experiments discussed in the main paper. Fig. B.1 shows the performance of the optimized CO mechanism against the molecular-beam experiments of [25] for different CO/O2 compositions. Note that the targeted experimental data in Fig. 2 are for a different inlet composition of CO/O2 = 3 / 1 . The trends in the experimental data are fairly well captured in Fig. B.1. Fig. B.2 shows another validation against the molecular-beam experiments of [26]. The peak location is well predicted by the optimized microkinetic model. Finally, we present two more validations against CO-TPD [27] and TPR [29] data in Figs. B.3 and B.4 , respectively. Good qualitative agreement between experimental data and mechanism predictions indicates that the heat of CO chemisorption, the coverage effects, and the activation energies of steps R9–R10 are reasonably incorporated into the mechanism. Similar validations for the optimized H2 mechanism are shown in Figs. B.5 and B.6 against the H2-TPD [30,31] and TPR [33] experiments, respectively. Good qualitative agreement is observed between the experimental data and the mechanism predictions. Validation of the coupling mechanism with CO–H interactions and modified pre-factors is presented against the low-temperature PROX experiments of Ito et al. [54] in Fig. B.7 . Figs. B.8a and B.8b show the predictions of the coupling mechanism against the CO PROX experimental data of [55] for the effect of inlet composition on CO conversion. Our coupling mechanism captures all considered data sets fairly well. The CO–H interactions play a significant role in providing high activity in these predictions (compare solid with dashed lines). For example, even if A / V is set very high, the experimental data at the lowest inlet CO mole fraction (0.002) are underpredicted by at least a factor of 2. References [1] A.B. Mhadeshwar D.G. Vlachos J. Phys. Chem. B 108 2004 15246 15258 [2] J.A. Dumesic D.F. Rudd L.M. Aparicio J.E. Rekoske A.A. Trevino The Microkinetics of Heterogeneous Catalysis 1993 American Chemical Society Washington, DC [3] D.A. Hickman L.D. Schmidt AIChE J. 39 7 1993 1164 1177 [4] W.R. Williams C.M. Marks L.D. Schmidt J. Phys. Chem. 96 1992 5922 5931 [5] M.P. Zum Mallen W.R. Williams L.D. Schmidt J. Phys. Chem. 97 1993 625 632 [6] O. Deutschmann R. Schmidt F. Behrendt J. Warnatz Proc. Comb. Inst. 26 1996 1747 1754 [7] M.P. Zum Mallen L.D. Schmidt J. Catal. 161 1996 230 246 [8] P.-A. Bui D.G. Vlachos P.R. Westmoreland Surf. Sci. 385 2–3 1997 1029 1034 [9] G. Veser J. Frauhammer Chem. Eng. Sci. 55 12 2000 2271 2286 [10] P. Aghalayam Y.K. Park N.E. Fernandes V. Papavassiliou A.B. Mhadeshwar D.G. Vlachos J. Catal. 213 2003 23 38 [11] P. Aghalayam Y.K. Park D.G. Vlachos Joint Combustion Meeting of the US Sections of the Combustion Institute, March 14–17 1999 The Combustion Institute Washington, DC 745 748 [12] P. Aghalayam Y.K. Park D.G. Vlachos J.J. Spivey Partial oxidation of Light Alkanes in Short Contact Time Microreactors, Catalysis vol. 15 2000 The Royal Society of Chemistry Cambridge, UK 98 137 [13] P. Aghalayam Y.K. Park D.G. Vlachos AIChE J. 46 10 2000 2017 2029 [14] Y.K. Park P. Aghalayam D.G. Vlachos J. Phys. Chem. A 103 40 1999 8101 8107 [15] S. Kandoi A.A. Gokhale L.C. Grabow J.A. Dumesic M. Mavrikakis Cat. Lett. 93 1–2 2004 93 100 [16] N. Schumacher A. Boisen S. Dahl A.A. Gokhale S. Kandoi L.C. Grabow J.A. Dumesic M. Mavrikakis I. Chorkendorff J. Catal. 229 2005 265 275 [17] A.B. Mhadeshwar H. Wang D.G. Vlachos J. Phys. Chem. B 107 2003 12721 12733 [18] A.B. Mhadeshwar, D.G. Vlachos, Combust. Flame (2005), in press [19] P. Aghalayam Y.K. Park D.G. Vlachos Proc. Combust. Inst. 28 2000 1331 1339 [20] A.B. Mhadeshwar D.G. Vlachos Catal. Today 105 2005 162 172 [21] S.R. Deshmukh A.B. Mhadeshwar M. Lebedeva D.G. Vlachos Int. J. Multiscale Comp. Eng. 2 2 2004 221 238 [22] S. Raimondeau D.G. Vlachos Chem. Eng. J. 90 2002 3 23 [23] D.G. Vlachos, Adv. Chem. Eng. (2005), accepted for press [24] R. Sant E.E. Wolf Chem. Eng. Sci. 45 10 1990 3137 3147 [25] C.S. Gopinath F. Zaera J. Catal. 200 2001 270 287 [26] G.W. Coulston G.L. Haller J. Chem. Phys. 95 9 1991 6932 6944 [27] B. Klotzer W. Unterberger K. Hayek Surf. Sci. 532–535 2003 142 147 [28] T.W. Root L.D. Schmidt Surf. Sci. 134 1983 30 45 [29] M.J.P. Hopstaken J.W. Niemantsverdriet J. Chem. Phys. 113 13 2000 5457 5465 [30] J.T. Yates P.A. Thiel W.H. Weinberg Surf. Sci. 84 2 1979 427 439 [31] S.H. Payne H.J. Kreuzer W. Frie L. Hammer K. Heinz Surf. Sci. 421 1999 279 295 [32] K.D. Gibson M. Viste S.J. Sibener J. Chem. Phys. 112 21 2000 9582 9589 [33] L. Gregoratti A. Baraldi V.R. Dhanak G. Comelli M. Kiskinova R. Rosei Surf. Sci. 340 1995 205 214 [34] D.H. Wei D.C. Skelton S.D. Kevan Surf. Sci. 381 1997 49 64 [35] J.T. Yates P.A. Thiel W.H. Weinberg Surf. Sci. 82 1 1979 45 68 [36] A. Michaelides P. Hu J. Am. Chem. Soc. 123 2001 4235 4242 [37] E. Shustorovich H. Sellers Surf. Sci. Report 31 1998 1 119 [38] E. Shustorovich Adv. Catal. 37 1990 101 164 [39] A. Michaelides Z.-P. Liu C.J. Zhang A. Alavi D.A. King P. Hu J. Am. Chem. Soc. 125 2003 3704 3705 [40] Z.-P. Liu P. Hu J. Chem. Phys. 115 11 2001 4977 4980 [41] J.K. Norskov T. Bligaard A. Logadottir S. Bahn E.W. Hansen M. Bollinger H. Bengaard B. Hammer Z. Sljivancanin M. Mavrikakis Y. Xu S. Dahl C.J.H. Jacobsen J. Catal. 209 2002 275 278 [42] S. Dahl A. Logadottir C.J.H. Jacobsen J.K. Norskov Appl. Catal. A: Gen. 222 2001 19 29 [43] A. Logadottir T.H. Rod J.K. Norskov B. Hammer S. Dahl C.J.H. Jacobsen J. Catal. 197 2001 229 231 [44] R.A. van Santen J.W. Niemantsverdriet Chemical Kinetics and Catalysis 1995 Plenum Press New York [45] V.P. Zhdanov Surf. Sci. Report 12 1991 183 242 [46] R. Schennach G. Krenn B. Klotzer K.D. Rendulic Surf. Sci. 540 2003 237 245 [47] M. Beutl J. Lesnik K.D. Rendulic Surf. Sci. 429 1999 71 83 [48] T. Hrncir V. Matolin V. Nehasil Surf. Sci. 482–485 2001 260 265 [49] Visual-Numerics, IMSL FORTRAN subroutines for mathematical applications (1997) [50] P. Panagiotopoulou D.I. Kondarides J. Catal. 225 2004 327 336 [51] C. Wheeler A. Jhalani E.J. Klein S. Tummala L.D. Schmidt J. Catal. 223 2004 191 199 [52] T. Utaka T. Okanishi T. Takeguchi R. Kikuchi K. Eguchi Appl. Catal. A: Gen. 245 2003 343 351 [53] Y.-F. Han M.J. Kahlich M. Kinne R.J. Behm Appl. Catal. B: Env. 50 2004 209 218 [54] S. Ito T. Fujimori K. Nagashima K. Yuzaki K. Kunimori Catal. Today 57 2000 247 254 [55] G. Chen Q. Yuan H. Li S. Li Chem. Eng. J. 101 2004 101 106 [56] M. Mavrikakis (2004), personal communications [57] B. Hammer, O.H. Nielsen, J.J. Mortensen, L. Bengtsson, L.B. Hansen, A.C.E. Madsen, Y. Morikawa, T. Bligaard, A. Christensen, DACAPO version 2.7 (CAMP, Technical University, Denmark) [58] A.B. Mhadeshwar J.R. Kitchin M.A. Barteau D.G. Vlachos Catal. Lett. 96 1–2 2004 13 22 [59] G.B. Fisher S.J. Schmieg J. Vacuum Sci. Technol. A 1 2 1983 1064 1069 [60] V.I. Savchenko G.K. Boreskov A.V. Kalinkin A.N. Salanov Kinet. Catal. 24 5 1983 983 990 [61] S. Wilke V. Natoli M.H. Cohen J. Chem. Phys. 112 22 2000 9986 9995 [62] E.W. Hansen M. Neurock Surf. Sci. 441 1999 410 424 [63] D. Loffreda D. Simon P. Sautet J. Chem. Phys. 108 15 1998 6447 6457 [64] M. Smedh A. Beutler M. Borg R. Nyholm J.N. Anderson Surf. Sci. 491 2001 115 123 [65] R. He H. Kusaka M. Mavrikakis J.A. Dumesic J. Catal. 217 2003 209 221 [66] P.A. Thiel E.D. Williams J.T. Yates W.H. Weinberg Surf. Sci. 84 1 1979 54 64 [67] C.J. Zhang P. Hu M.-H. Lee Surf. Sci. 432 1999 305 315 [68] M. Mavrikakis M. Baumer H.-J. Freund J.K. Norskov Catal. Lett. 81 3–4 2002 153 156 [69] H.A.C.M. Hendrickx A.P.J.M. Jongenelis B.E. Nieuwenhuys Surf. Sci. 154 2–3 1985 503 523 [70] L.S. Brown S.J. Sibener J. Chem. Phys. 90 5 1989 2807 2815 [71] M.J. Hei H.B. Chen J. Yi Y.J. Lin Y.Z. Lin G. Wei D.W. Liao Surf. Sci. 417 1998 82 96 [72] S. Wilke D. Hennig R. Lober Phys. Rev. B 50 4 1994 2548 2564 [73] M. Mavrikakis J. Rempel J. Greeley L.B. Hansen J.K. Norskov J. Chem. Phys. 117 14 2002 6737 6744 [74] A. Eichler J. Hafner G. Kresse J. Phys. Condens. Mater. 8 1996 7659 7675 [75] J.J. Zinck W.H. Weinberg J. Vacuum Sci. Technol. 17 1 1980 188 189 [76] P.J. Feibelman Phys. Rev. Lett. 90 18 2003 186103 186103",
      "scopus-id": "23244449459",
      "coredata": {
        "eid": "1-s2.0-S0021951705002290",
        "dc:description": "A hierarchical multiscale parameter refinement approach was used to develop microkinetic models for CO and H2 oxidation, and CO–H2 coupling for water–gas shift (WGS) and preferential oxidation (PROX) of CO on Rh. The rate parameters were estimated with a combination of quantum mechanical density functional theory (DFT), the semi empirical unity bond index-quadratic exponential potential method, and transition-state theory. To improve the predictive ability, selected pre-factors of the CO and H2 oxidation reaction mechanisms were optimized against multiple experimental data sets, such as ignition, molecular beam, and laser-induced fluorescence. Thermodynamic consistency of rate parameters was ensured over a wide temperature range by a combination of statistical mechanics and constraints-based optimization. DFT calculations were used to estimate cross adsorbate–adsorbate CO–H interactions. It is shown that the coupling between the two fuels arising from these interactions is essential for PROX of CO. Important reaction pathways in the WGS and PROX chemistries are discussed. For example, it is shown that the oxidation of CO by OH via the carboxyl intermediate, and not by O, is the dominant path in PROX. Thus, hydrogen acts as a “catalyst” for CO combustion under certain conditions. Finally, the mechanisms are validated against additional sets of redundant experimental data.",
        "openArchiveArticle": "false",
        "prism:coverDate": "2005-08-15",
        "openaccessUserLicense": null,
        "prism:aggregationType": "Journal",
        "prism:url": "https://api.elsevier.com/content/article/pii/S0021951705002290",
        "dc:creator": [
          {
            "@_fa": "true",
            "$": "Mhadeshwar, A.B."
          },
          {
            "@_fa": "true",
            "$": "Vlachos, D.G."
          }
        ],
        "link": [
          {
            "@_fa": "true",
            "@rel": "self",
            "@href": "https://api.elsevier.com/content/article/pii/S0021951705002290"
          },
          {
            "@_fa": "true",
            "@rel": "scidir",
            "@href": "https://www.sciencedirect.com/science/article/pii/S0021951705002290"
          }
        ],
        "dc:format": "application/json",
        "openaccessType": null,
        "pii": "S0021-9517(05)00229-0",
        "prism:volume": "234",
        "prism:publisher": "Elsevier Inc.",
        "dc:title": "Hierarchical, multiscale surface reaction mechanism development: CO and H2 oxidation, water–gas shift, and preferential oxidation of CO on Rh",
        "prism:copyright": "Copyright © 2005 Elsevier Inc. All rights reserved.",
        "openaccess": "0",
        "prism:issn": "00219517",
        "prism:issueIdentifier": "1",
        "dcterms:subject": [
          {
            "@_fa": "true",
            "$": "Microkinetic modeling"
          },
          {
            "@_fa": "true",
            "$": "Hierarchical parameter refinement"
          },
          {
            "@_fa": "true",
            "$": "Fuel processing"
          },
          {
            "@_fa": "true",
            "$": "Carbon monoxide"
          },
          {
            "@_fa": "true",
            "$": "Hydrogen"
          },
          {
            "@_fa": "true",
            "$": "Catalytic combustion"
          },
          {
            "@_fa": "true",
            "$": "Water–gas shift"
          },
          {
            "@_fa": "true",
            "$": "Preferential oxidation"
          },
          {
            "@_fa": "true",
            "$": "Thermodynamic consistency"
          },
          {
            "@_fa": "true",
            "$": "Rhodium"
          }
        ],
        "openaccessArticle": "false",
        "prism:publicationName": "Journal of Catalysis",
        "prism:number": "1",
        "openaccessSponsorType": null,
        "prism:pageRange": "48-63",
        "prism:endingPage": "63",
        "pubType": "fla",
        "prism:coverDisplayDate": "15 August 2005",
        "prism:doi": "10.1016/j.jcat.2005.05.016",
        "prism:startingPage": "48",
        "dc:identifier": "doi:10.1016/j.jcat.2005.05.016",
        "openaccessSponsorName": null
      },
      "objects": {
        "object": [
          {
            "@category": "thumbnail",
            "@height": "15",
            "@width": "180",
            "@_fa": "true",
            "$": "https://api.elsevier.com/content/object/eid/1-s2.0-S0021951705002290-si98.gif?httpAccept=%2A%2F%2A",
            "@multimediatype": "GIF image file",
            "@type": "ALTIMG",
            "@size": "548",
            "@ref": "si98",
            "@mimetype": "image/gif"
          },
          {
            "@category": "thumbnail",
            "@height": "15",
            "@width": "172",
            "@_fa": "true",
            "$": "https://api.elsevier.com/content/object/eid/1-s2.0-S0021951705002290-si116.gif?httpAccept=%2A%2F%2A",
            "@multimediatype": "GIF image file",
            "@type": "ALTIMG",
            "@size": "527",
            "@ref": "si116",
            "@mimetype": "image/gif"
          },
          {
            "@category": "thumbnail",
            "@height": "16",
            "@width": "199",
            "@_fa": "true",
            "$": "https://api.elsevier.com/content/object/eid/1-s2.0-S0021951705002290-si115.gif?httpAccept=%2A%2F%2A",
            "@multimediatype": "GIF image file",
            "@type": "ALTIMG",
            "@size": "561",
            "@ref": "si115",
            "@mimetype": "image/gif"
          },
          {
            "@category": "thumbnail",
            "@height": "16",
            "@width": "178",
            "@_fa": "true",
            "$": "https://api.elsevier.com/content/object/eid/1-s2.0-S0021951705002290-si114.gif?httpAccept=%2A%2F%2A",
            "@multimediatype": "GIF image file",
            "@type": "ALTIMG",
            "@size": "522",
            "@ref": "si114",
            "@mimetype": "image/gif"
          },
          {
            "@category": "thumbnail",
            "@height": "15",
            "@width": "147",
            "@_fa": "true",
            "$": "https://api.elsevier.com/content/object/eid/1-s2.0-S0021951705002290-si109.gif?httpAccept=%2A%2F%2A",
            "@multimediatype": "GIF image file",
            "@type": "ALTIMG",
            "@size": "458",
            "@ref": "si109",
            "@mimetype": "image/gif"
          },
          {
            "@category": "thumbnail",
            "@height": "16",
            "@width": "175",
            "@_fa": "true",
            "$": "https://api.elsevier.com/content/object/eid/1-s2.0-S0021951705002290-si100.gif?httpAccept=%2A%2F%2A",
            "@multimediatype": "GIF image file",
            "@type": "ALTIMG",
            "@size": "551",
            "@ref": "si100",
            "@mimetype": "image/gif"
          },
          {
            "@category": "thumbnail",
            "@height": "17",
            "@width": "161",
            "@_fa": "true",
            "$": "https://api.elsevier.com/content/object/eid/1-s2.0-S0021951705002290-si72.gif?httpAccept=%2A%2F%2A",
            "@multimediatype": "GIF image file",
            "@type": "ALTIMG",
            "@size": "570",
            "@ref": "si72",
            "@mimetype": "image/gif"
          },
          {
            "@category": "thumbnail",
            "@height": "15",
            "@width": "149",
            "@_fa": "true",
            "$": "https://api.elsevier.com/content/object/eid/1-s2.0-S0021951705002290-si68.gif?httpAccept=%2A%2F%2A",
            "@multimediatype": "GIF image file",
            "@type": "ALTIMG",
            "@size": "502",
            "@ref": "si68",
            "@mimetype": "image/gif"
          },
          {
            "@category": "thumbnail",
            "@height": "15",
            "@width": "198",
            "@_fa": "true",
            "$": "https://api.elsevier.com/content/object/eid/1-s2.0-S0021951705002290-si5.gif?httpAccept=%2A%2F%2A",
            "@multimediatype": "GIF image file",
            "@type": "ALTIMG",
            "@size": "621",
            "@ref": "si5",
            "@mimetype": "image/gif"
          },
          {
            "@category": "thumbnail",
            "@height": "14",
            "@width": "134",
            "@_fa": "true",
            "$": "https://api.elsevier.com/content/object/eid/1-s2.0-S0021951705002290-si3.gif?httpAccept=%2A%2F%2A",
            "@multimediatype": "GIF image file",
            "@type": "ALTIMG",
            "@size": "500",
            "@ref": "si3",
            "@mimetype": "image/gif"
          },
          {
            "@category": "thumbnail",
            "@height": "15",
            "@width": "203",
            "@_fa": "true",
            "$": "https://api.elsevier.com/content/object/eid/1-s2.0-S0021951705002290-si23.gif?httpAccept=%2A%2F%2A",
            "@multimediatype": "GIF image file",
            "@type": "ALTIMG",
            "@size": "653",
            "@ref": "si23",
            "@mimetype": "image/gif"
          },
          {
            "@category": "thumbnail",
            "@height": "17",
            "@width": "212",
            "@_fa": "true",
            "$": "https://api.elsevier.com/content/object/eid/1-s2.0-S0021951705002290-si22.gif?httpAccept=%2A%2F%2A",
            "@multimediatype": "GIF image file",
            "@type": "ALTIMG",
            "@size": "719",
            "@ref": "si22",
            "@mimetype": "image/gif"
          },
          {
            "@category": "thumbnail",
            "@height": "15",
            "@width": "36",
            "@_fa": "true",
            "$": "https://api.elsevier.com/content/object/eid/1-s2.0-S0021951705002290-si99.gif?httpAccept=%2A%2F%2A",
            "@multimediatype": "GIF image file",
            "@type": "ALTIMG",
            "@size": "222",
            "@ref": "si99",
            "@mimetype": "image/gif"
          },
          {
            "@category": "thumbnail",
            "@height": "15",
            "@width": "36",
            "@_fa": "true",
            "$": "https://api.elsevier.com/content/object/eid/1-s2.0-S0021951705002290-si97.gif?httpAccept=%2A%2F%2A",
            "@multimediatype": "GIF image file",
            "@type": "ALTIMG",
            "@size": "222",
            "@ref": "si97",
            "@mimetype": "image/gif"
          },
          {
            "@category": "thumbnail",
            "@height": "16",
            "@width": "102",
            "@_fa": "true",
            "$": "https://api.elsevier.com/content/object/eid/1-s2.0-S0021951705002290-si96.gif?httpAccept=%2A%2F%2A",
            "@multimediatype": "GIF image file",
            "@type": "ALTIMG",
            "@size": "376",
            "@ref": "si96",
            "@mimetype": "image/gif"
          },
          {
            "@category": "thumbnail",
            "@height": "18",
            "@width": "117",
            "@_fa": "true",
            "$": "https://api.elsevier.com/content/object/eid/1-s2.0-S0021951705002290-si95.gif?httpAccept=%2A%2F%2A",
            "@multimediatype": "GIF image file",
            "@type": "ALTIMG",
            "@size": "423",
            "@ref": "si95",
            "@mimetype": "image/gif"
          },
          {
            "@category": "thumbnail",
            "@height": "18",
            "@width": "117",
            "@_fa": "true",
            "$": "https://api.elsevier.com/content/object/eid/1-s2.0-S0021951705002290-si94.gif?httpAccept=%2A%2F%2A",
            "@multimediatype": "GIF image file",
            "@type": "ALTIMG",
            "@size": "423",
            "@ref": "si94",
            "@mimetype": "image/gif"
          },
          {
            "@category": "thumbnail",
            "@height": "19",
            "@width": "155",
            "@_fa": "true",
            "$": "https://api.elsevier.com/content/object/eid/1-s2.0-S0021951705002290-si93.gif?httpAccept=%2A%2F%2A",
            "@multimediatype": "GIF image file",
            "@type": "ALTIMG",
            "@size": "502",
            "@ref": "si93",
            "@mimetype": "image/gif"
          },
          {
            "@category": "thumbnail",
            "@height": "18",
            "@width": "117",
            "@_fa": "true",
            "$": "https://api.elsevier.com/content/object/eid/1-s2.0-S0021951705002290-si92.gif?httpAccept=%2A%2F%2A",
            "@multimediatype": "GIF image file",
            "@type": "ALTIMG",
            "@size": "423",
            "@ref": "si92",
            "@mimetype": "image/gif"
          },
          {
            "@category": "thumbnail",
            "@height": "19",
            "@width": "155",
            "@_fa": "true",
            "$": "https://api.elsevier.com/content/object/eid/1-s2.0-S0021951705002290-si91.gif?httpAccept=%2A%2F%2A",
            "@multimediatype": "GIF image file",
            "@type": "ALTIMG",
            "@size": "502",
            "@ref": "si91",
            "@mimetype": "image/gif"
          },
          {
            "@category": "thumbnail",
            "@height": "15",
            "@width": "59",
            "@_fa": "true",
            "$": "https://api.elsevier.com/content/object/eid/1-s2.0-S0021951705002290-si90.gif?httpAccept=%2A%2F%2A",
            "@multimediatype": "GIF image file",
            "@type": "ALTIMG",
            "@size": "246",
            "@ref": "si90",
            "@mimetype": "image/gif"
          },
          {
            "@category": "thumbnail",
            "@height": "14",
            "@width": "162",
            "@_fa": "true",
            "$": "https://api.elsevier.com/content/object/eid/1-s2.0-S0021951705002290-si9.gif?httpAccept=%2A%2F%2A",
            "@multimediatype": "GIF image file",
            "@type": "ALTIMG",
            "@size": "568",
            "@ref": "si9",
            "@mimetype": "image/gif"
          },
          {
            "@category": "thumbnail",
            "@height": "17",
            "@width": "19",
            "@_fa": "true",
            "$": "https://api.elsevier.com/content/object/eid/1-s2.0-S0021951705002290-si89.gif?httpAccept=%2A%2F%2A",
            "@multimediatype": "GIF image file",
            "@type": "ALTIMG",
            "@size": "174",
            "@ref": "si89",
            "@mimetype": "image/gif"
          },
          {
            "@category": "thumbnail",
            "@height": "18",
            "@width": "50",
            "@_fa": "true",
            "$": "https://api.elsevier.com/content/object/eid/1-s2.0-S0021951705002290-si88.gif?httpAccept=%2A%2F%2A",
            "@multimediatype": "GIF image file",
            "@type": "ALTIMG",
            "@size": "266",
            "@ref": "si88",
            "@mimetype": "image/gif"
          },
          {
            "@category": "thumbnail",
            "@height": "17",
            "@width": "30",
            "@_fa": "true",
            "$": "https://api.elsevier.com/content/object/eid/1-s2.0-S0021951705002290-si87.gif?httpAccept=%2A%2F%2A",
            "@multimediatype": "GIF image file",
            "@type": "ALTIMG",
            "@size": "214",
            "@ref": "si87",
            "@mimetype": "image/gif"
          },
          {
            "@category": "thumbnail",
            "@height": "18",
            "@width": "51",
            "@_fa": "true",
            "$": "https://api.elsevier.com/content/object/eid/1-s2.0-S0021951705002290-si86.gif?httpAccept=%2A%2F%2A",
            "@multimediatype": "GIF image file",
            "@type": "ALTIMG",
            "@size": "289",
            "@ref": "si86",
            "@mimetype": "image/gif"
          },
          {
            "@category": "thumbnail",
            "@height": "15",
            "@width": "154",
            "@_fa": "true",
            "$": "https://api.elsevier.com/content/object/eid/1-s2.0-S0021951705002290-si85.gif?httpAccept=%2A%2F%2A",
            "@multimediatype": "GIF image file",
            "@type": "ALTIMG",
            "@size": "468",
            "@ref": "si85",
            "@mimetype": "image/gif"
          },
          {
            "@category": "thumbnail",
            "@height": "14",
            "@width": "28",
            "@_fa": "true",
            "$": "https://api.elsevier.com/content/object/eid/1-s2.0-S0021951705002290-si84.gif?httpAccept=%2A%2F%2A",
            "@multimediatype": "GIF image file",
            "@type": "ALTIMG",
            "@size": "200",
            "@ref": "si84",
            "@mimetype": "image/gif"
          },
          {
            "@category": "thumbnail",
            "@height": "14",
            "@width": "20",
            "@_fa": "true",
            "$": "https://api.elsevier.com/content/object/eid/1-s2.0-S0021951705002290-si83.gif?httpAccept=%2A%2F%2A",
            "@multimediatype": "GIF image file",
            "@type": "ALTIMG",
            "@size": "164",
            "@ref": "si83",
            "@mimetype": "image/gif"
          },
          {
            "@category": "thumbnail",
            "@height": "14",
            "@width": "20",
            "@_fa": "true",
            "$": "https://api.elsevier.com/content/object/eid/1-s2.0-S0021951705002290-si82.gif?httpAccept=%2A%2F%2A",
            "@multimediatype": "GIF image file",
            "@type": "ALTIMG",
            "@size": "167",
            "@ref": "si82",
            "@mimetype": "image/gif"
          },
          {
            "@category": "thumbnail",
            "@height": "14",
            "@width": "19",
            "@_fa": "true",
            "$": "https://api.elsevier.com/content/object/eid/1-s2.0-S0021951705002290-si81.gif?httpAccept=%2A%2F%2A",
            "@multimediatype": "GIF image file",
            "@type": "ALTIMG",
            "@size": "161",
            "@ref": "si81",
            "@mimetype": "image/gif"
          },
          {
            "@category": "thumbnail",
            "@height": "18",
            "@width": "51",
            "@_fa": "true",
            "$": "https://api.elsevier.com/content/object/eid/1-s2.0-S0021951705002290-si80.gif?httpAccept=%2A%2F%2A",
            "@multimediatype": "GIF image file",
            "@type": "ALTIMG",
            "@size": "289",
            "@ref": "si80",
            "@mimetype": "image/gif"
          },
          {
            "@category": "thumbnail",
            "@height": "15",
            "@width": "52",
            "@_fa": "true",
            "$": "https://api.elsevier.com/content/object/eid/1-s2.0-S0021951705002290-si8.gif?httpAccept=%2A%2F%2A",
            "@multimediatype": "GIF image file",
            "@type": "ALTIMG",
            "@size": "245",
            "@ref": "si8",
            "@mimetype": "image/gif"
          },
          {
            "@category": "thumbnail",
            "@height": "17",
            "@width": "19",
            "@_fa": "true",
            "$": "https://api.elsevier.com/content/object/eid/1-s2.0-S0021951705002290-si79.gif?httpAccept=%2A%2F%2A",
            "@multimediatype": "GIF image file",
            "@type": "ALTIMG",
            "@size": "174",
            "@ref": "si79",
            "@mimetype": "image/gif"
          },
          {
            "@category": "thumbnail",
            "@height": "17",
            "@width": "30",
            "@_fa": "true",
            "$": "https://api.elsevier.com/content/object/eid/1-s2.0-S0021951705002290-si78.gif?httpAccept=%2A%2F%2A",
            "@multimediatype": "GIF image file",
            "@type": "ALTIMG",
            "@size": "214",
            "@ref": "si78",
            "@mimetype": "image/gif"
          },
          {
            "@category": "thumbnail",
            "@height": "18",
            "@width": "51",
            "@_fa": "true",
            "$": "https://api.elsevier.com/content/object/eid/1-s2.0-S0021951705002290-si77.gif?httpAccept=%2A%2F%2A",
            "@multimediatype": "GIF image file",
            "@type": "ALTIMG",
            "@size": "289",
            "@ref": "si77",
            "@mimetype": "image/gif"
          },
          {
            "@category": "thumbnail",
            "@height": "18",
            "@width": "51",
            "@_fa": "true",
            "$": "https://api.elsevier.com/content/object/eid/1-s2.0-S0021951705002290-si76.gif?httpAccept=%2A%2F%2A",
            "@multimediatype": "GIF image file",
            "@type": "ALTIMG",
            "@size": "289",
            "@ref": "si76",
            "@mimetype": "image/gif"
          },
          {
            "@category": "thumbnail",
            "@height": "14",
            "@width": "131",
            "@_fa": "true",
            "$": "https://api.elsevier.com/content/object/eid/1-s2.0-S0021951705002290-si75.gif?httpAccept=%2A%2F%2A",
            "@multimediatype": "GIF image file",
            "@type": "ALTIMG",
            "@size": "440",
            "@ref": "si75",
            "@mimetype": "image/gif"
          },
          {
            "@category": "thumbnail",
            "@height": "15",
            "@width": "177",
            "@_fa": "true",
            "$": "https://api.elsevier.com/content/object/eid/1-s2.0-S0021951705002290-si74.gif?httpAccept=%2A%2F%2A",
            "@multimediatype": "GIF image file",
            "@type": "ALTIMG",
            "@size": "547",
            "@ref": "si74",
            "@mimetype": "image/gif"
          },
          {
            "@category": "thumbnail",
            "@height": "15",
            "@width": "177",
            "@_fa": "true",
            "$": "https://api.elsevier.com/content/object/eid/1-s2.0-S0021951705002290-si73.gif?httpAccept=%2A%2F%2A",
            "@multimediatype": "GIF image file",
            "@type": "ALTIMG",
            "@size": "547",
            "@ref": "si73",
            "@mimetype": "image/gif"
          },
          {
            "@category": "thumbnail",
            "@height": "14",
            "@width": "177",
            "@_fa": "true",
            "$": "https://api.elsevier.com/content/object/eid/1-s2.0-S0021951705002290-si71.gif?httpAccept=%2A%2F%2A",
            "@multimediatype": "GIF image file",
            "@type": "ALTIMG",
            "@size": "544",
            "@ref": "si71",
            "@mimetype": "image/gif"
          },
          {
            "@category": "thumbnail",
            "@height": "17",
            "@width": "134",
            "@_fa": "true",
            "$": "https://api.elsevier.com/content/object/eid/1-s2.0-S0021951705002290-si70.gif?httpAccept=%2A%2F%2A",
            "@multimediatype": "GIF image file",
            "@type": "ALTIMG",
            "@size": "507",
            "@ref": "si70",
            "@mimetype": "image/gif"
          },
          {
            "@category": "thumbnail",
            "@height": "15",
            "@width": "57",
            "@_fa": "true",
            "$": "https://api.elsevier.com/content/object/eid/1-s2.0-S0021951705002290-si7.gif?httpAccept=%2A%2F%2A",
            "@multimediatype": "GIF image file",
            "@type": "ALTIMG",
            "@size": "249",
            "@ref": "si7",
            "@mimetype": "image/gif"
          },
          {
            "@category": "thumbnail",
            "@height": "14",
            "@width": "85",
            "@_fa": "true",
            "$": "https://api.elsevier.com/content/object/eid/1-s2.0-S0021951705002290-si69.gif?httpAccept=%2A%2F%2A",
            "@multimediatype": "GIF image file",
            "@type": "ALTIMG",
            "@size": "327",
            "@ref": "si69",
            "@mimetype": "image/gif"
          },
          {
            "@category": "thumbnail",
            "@height": "14",
            "@width": "123",
            "@_fa": "true",
            "$": "https://api.elsevier.com/content/object/eid/1-s2.0-S0021951705002290-si67.gif?httpAccept=%2A%2F%2A",
            "@multimediatype": "GIF image file",
            "@type": "ALTIMG",
            "@size": "408",
            "@ref": "si67",
            "@mimetype": "image/gif"
          },
          {
            "@category": "thumbnail",
            "@height": "15",
            "@width": "36",
            "@_fa": "true",
            "$": "https://api.elsevier.com/content/object/eid/1-s2.0-S0021951705002290-si66.gif?httpAccept=%2A%2F%2A",
            "@multimediatype": "GIF image file",
            "@type": "ALTIMG",
            "@size": "222",
            "@ref": "si66",
            "@mimetype": "image/gif"
          },
          {
            "@category": "thumbnail",
            "@height": "14",
            "@width": "177",
            "@_fa": "true",
            "$": "https://api.elsevier.com/content/object/eid/1-s2.0-S0021951705002290-si65.gif?httpAccept=%2A%2F%2A",
            "@multimediatype": "GIF image file",
            "@type": "ALTIMG",
            "@size": "544",
            "@ref": "si65",
            "@mimetype": "image/gif"
          },
          {
            "@category": "thumbnail",
            "@height": "15",
            "@width": "145",
            "@_fa": "true",
            "$": "https://api.elsevier.com/content/object/eid/1-s2.0-S0021951705002290-si64.gif?httpAccept=%2A%2F%2A",
            "@multimediatype": "GIF image file",
            "@type": "ALTIMG",
            "@size": "481",
            "@ref": "si64",
            "@mimetype": "image/gif"
          },
          {
            "@category": "thumbnail",
            "@height": "14",
            "@width": "85",
            "@_fa": "true",
            "$": "https://api.elsevier.com/content/object/eid/1-s2.0-S0021951705002290-si63.gif?httpAccept=%2A%2F%2A",
            "@multimediatype": "GIF image file",
            "@type": "ALTIMG",
            "@size": "327",
            "@ref": "si63",
            "@mimetype": "image/gif"
          },
          {
            "@category": "thumbnail",
            "@height": "14",
            "@width": "75",
            "@_fa": "true",
            "$": "https://api.elsevier.com/content/object/eid/1-s2.0-S0021951705002290-si62.gif?httpAccept=%2A%2F%2A",
            "@multimediatype": "GIF image file",
            "@type": "ALTIMG",
            "@size": "323",
            "@ref": "si62",
            "@mimetype": "image/gif"
          },
          {
            "@category": "thumbnail",
            "@height": "26",
            "@width": "72",
            "@_fa": "true",
            "$": "https://api.elsevier.com/content/object/eid/1-s2.0-S0021951705002290-si61.gif?httpAccept=%2A%2F%2A",
            "@multimediatype": "GIF image file",
            "@type": "ALTIMG",
            "@size": "432",
            "@ref": "si61",
            "@mimetype": "image/gif"
          },
          {
            "@category": "thumbnail",
            "@height": "14",
            "@width": "76",
            "@_fa": "true",
            "$": "https://api.elsevier.com/content/object/eid/1-s2.0-S0021951705002290-si60.gif?httpAccept=%2A%2F%2A",
            "@multimediatype": "GIF image file",
            "@type": "ALTIMG",
            "@size": "318",
            "@ref": "si60",
            "@mimetype": "image/gif"
          },
          {
            "@category": "thumbnail",
            "@height": "15",
            "@width": "57",
            "@_fa": "true",
            "$": "https://api.elsevier.com/content/object/eid/1-s2.0-S0021951705002290-si6.gif?httpAccept=%2A%2F%2A",
            "@multimediatype": "GIF image file",
            "@type": "ALTIMG",
            "@size": "247",
            "@ref": "si6",
            "@mimetype": "image/gif"
          },
          {
            "@category": "thumbnail",
            "@height": "14",
            "@width": "89",
            "@_fa": "true",
            "$": "https://api.elsevier.com/content/object/eid/1-s2.0-S0021951705002290-si59.gif?httpAccept=%2A%2F%2A",
            "@multimediatype": "GIF image file",
            "@type": "ALTIMG",
            "@size": "293",
            "@ref": "si59",
            "@mimetype": "image/gif"
          },
          {
            "@category": "thumbnail",
            "@height": "41",
            "@width": "429",
            "@_fa": "true",
            "$": "https://api.elsevier.com/content/object/eid/1-s2.0-S0021951705002290-si58.gif?httpAccept=%2A%2F%2A",
            "@multimediatype": "GIF image file",
            "@type": "ALTIMG",
            "@size": "1717",
            "@ref": "si58",
            "@mimetype": "image/gif"
          },
          {
            "@category": "thumbnail",
            "@height": "16",
            "@width": "177",
            "@_fa": "true",
            "$": "https://api.elsevier.com/content/object/eid/1-s2.0-S0021951705002290-si57.gif?httpAccept=%2A%2F%2A",
            "@multimediatype": "GIF image file",
            "@type": "ALTIMG",
            "@size": "639",
            "@ref": "si57",
            "@mimetype": "image/gif"
          },
          {
            "@category": "thumbnail",
            "@height": "15",
            "@width": "52",
            "@_fa": "true",
            "$": "https://api.elsevier.com/content/object/eid/1-s2.0-S0021951705002290-si56.gif?httpAccept=%2A%2F%2A",
            "@multimediatype": "GIF image file",
            "@type": "ALTIMG",
            "@size": "245",
            "@ref": "si56",
            "@mimetype": "image/gif"
          },
          {
            "@category": "thumbnail",
            "@height": "16",
            "@width": "177",
            "@_fa": "true",
            "$": "https://api.elsevier.com/content/object/eid/1-s2.0-S0021951705002290-si55.gif?httpAccept=%2A%2F%2A",
            "@multimediatype": "GIF image file",
            "@type": "ALTIMG",
            "@size": "641",
            "@ref": "si55",
            "@mimetype": "image/gif"
          },
          {
            "@category": "thumbnail",
            "@height": "15",
            "@width": "52",
            "@_fa": "true",
            "$": "https://api.elsevier.com/content/object/eid/1-s2.0-S0021951705002290-si54.gif?httpAccept=%2A%2F%2A",
            "@multimediatype": "GIF image file",
            "@type": "ALTIMG",
            "@size": "245",
            "@ref": "si54",
            "@mimetype": "image/gif"
          },
          {
            "@category": "thumbnail",
            "@height": "16",
            "@width": "144",
            "@_fa": "true",
            "$": "https://api.elsevier.com/content/object/eid/1-s2.0-S0021951705002290-si53.gif?httpAccept=%2A%2F%2A",
            "@multimediatype": "GIF image file",
            "@type": "ALTIMG",
            "@size": "531",
            "@ref": "si53",
            "@mimetype": "image/gif"
          },
          {
            "@category": "thumbnail",
            "@height": "15",
            "@width": "50",
            "@_fa": "true",
            "$": "https://api.elsevier.com/content/object/eid/1-s2.0-S0021951705002290-si52.gif?httpAccept=%2A%2F%2A",
            "@multimediatype": "GIF image file",
            "@type": "ALTIMG",
            "@size": "246",
            "@ref": "si52",
            "@mimetype": "image/gif"
          },
          {
            "@category": "thumbnail",
            "@height": "17",
            "@width": "145",
            "@_fa": "true",
            "$": "https://api.elsevier.com/content/object/eid/1-s2.0-S0021951705002290-si51.gif?httpAccept=%2A%2F%2A",
            "@multimediatype": "GIF image file",
            "@type": "ALTIMG",
            "@size": "545",
            "@ref": "si51",
            "@mimetype": "image/gif"
          },
          {
            "@category": "thumbnail",
            "@height": "15",
            "@width": "36",
            "@_fa": "true",
            "$": "https://api.elsevier.com/content/object/eid/1-s2.0-S0021951705002290-si50.gif?httpAccept=%2A%2F%2A",
            "@multimediatype": "GIF image file",
            "@type": "ALTIMG",
            "@size": "222",
            "@ref": "si50",
            "@mimetype": "image/gif"
          },
          {
            "@category": "thumbnail",
            "@height": "14",
            "@width": "131",
            "@_fa": "true",
            "$": "https://api.elsevier.com/content/object/eid/1-s2.0-S0021951705002290-si49.gif?httpAccept=%2A%2F%2A",
            "@multimediatype": "GIF image file",
            "@type": "ALTIMG",
            "@size": "499",
            "@ref": "si49",
            "@mimetype": "image/gif"
          },
          {
            "@category": "thumbnail",
            "@height": "15",
            "@width": "50",
            "@_fa": "true",
            "$": "https://api.elsevier.com/content/object/eid/1-s2.0-S0021951705002290-si48.gif?httpAccept=%2A%2F%2A",
            "@multimediatype": "GIF image file",
            "@type": "ALTIMG",
            "@size": "246",
            "@ref": "si48",
            "@mimetype": "image/gif"
          },
          {
            "@category": "thumbnail",
            "@height": "14",
            "@width": "131",
            "@_fa": "true",
            "$": "https://api.elsevier.com/content/object/eid/1-s2.0-S0021951705002290-si47.gif?httpAccept=%2A%2F%2A",
            "@multimediatype": "GIF image file",
            "@type": "ALTIMG",
            "@size": "482",
            "@ref": "si47",
            "@mimetype": "image/gif"
          },
          {
            "@category": "thumbnail",
            "@height": "15",
            "@width": "52",
            "@_fa": "true",
            "$": "https://api.elsevier.com/content/object/eid/1-s2.0-S0021951705002290-si46.gif?httpAccept=%2A%2F%2A",
            "@multimediatype": "GIF image file",
            "@type": "ALTIMG",
            "@size": "245",
            "@ref": "si46",
            "@mimetype": "image/gif"
          },
          {
            "@category": "thumbnail",
            "@height": "16",
            "@width": "177",
            "@_fa": "true",
            "$": "https://api.elsevier.com/content/object/eid/1-s2.0-S0021951705002290-si45.gif?httpAccept=%2A%2F%2A",
            "@multimediatype": "GIF image file",
            "@type": "ALTIMG",
            "@size": "634",
            "@ref": "si45",
            "@mimetype": "image/gif"
          },
          {
            "@category": "thumbnail",
            "@height": "15",
            "@width": "50",
            "@_fa": "true",
            "$": "https://api.elsevier.com/content/object/eid/1-s2.0-S0021951705002290-si44.gif?httpAccept=%2A%2F%2A",
            "@multimediatype": "GIF image file",
            "@type": "ALTIMG",
            "@size": "246",
            "@ref": "si44",
            "@mimetype": "image/gif"
          },
          {
            "@category": "thumbnail",
            "@height": "17",
            "@width": "177",
            "@_fa": "true",
            "$": "https://api.elsevier.com/content/object/eid/1-s2.0-S0021951705002290-si43.gif?httpAccept=%2A%2F%2A",
            "@multimediatype": "GIF image file",
            "@type": "ALTIMG",
            "@size": "640",
            "@ref": "si43",
            "@mimetype": "image/gif"
          },
          {
            "@category": "thumbnail",
            "@height": "15",
            "@width": "52",
            "@_fa": "true",
            "$": "https://api.elsevier.com/content/object/eid/1-s2.0-S0021951705002290-si42.gif?httpAccept=%2A%2F%2A",
            "@multimediatype": "GIF image file",
            "@type": "ALTIMG",
            "@size": "245",
            "@ref": "si42",
            "@mimetype": "image/gif"
          },
          {
            "@category": "thumbnail",
            "@height": "16",
            "@width": "144",
            "@_fa": "true",
            "$": "https://api.elsevier.com/content/object/eid/1-s2.0-S0021951705002290-si41.gif?httpAccept=%2A%2F%2A",
            "@multimediatype": "GIF image file",
            "@type": "ALTIMG",
            "@size": "549",
            "@ref": "si41",
            "@mimetype": "image/gif"
          },
          {
            "@category": "thumbnail",
            "@height": "15",
            "@width": "36",
            "@_fa": "true",
            "$": "https://api.elsevier.com/content/object/eid/1-s2.0-S0021951705002290-si40.gif?httpAccept=%2A%2F%2A",
            "@multimediatype": "GIF image file",
            "@type": "ALTIMG",
            "@size": "222",
            "@ref": "si40",
            "@mimetype": "image/gif"
          },
          {
            "@category": "thumbnail",
            "@height": "14",
            "@width": "129",
            "@_fa": "true",
            "$": "https://api.elsevier.com/content/object/eid/1-s2.0-S0021951705002290-si4.gif?httpAccept=%2A%2F%2A",
            "@multimediatype": "GIF image file",
            "@type": "ALTIMG",
            "@size": "466",
            "@ref": "si4",
            "@mimetype": "image/gif"
          },
          {
            "@category": "thumbnail",
            "@height": "16",
            "@width": "145",
            "@_fa": "true",
            "$": "https://api.elsevier.com/content/object/eid/1-s2.0-S0021951705002290-si39.gif?httpAccept=%2A%2F%2A",
            "@multimediatype": "GIF image file",
            "@type": "ALTIMG",
            "@size": "547",
            "@ref": "si39",
            "@mimetype": "image/gif"
          },
          {
            "@category": "thumbnail",
            "@height": "15",
            "@width": "36",
            "@_fa": "true",
            "$": "https://api.elsevier.com/content/object/eid/1-s2.0-S0021951705002290-si38.gif?httpAccept=%2A%2F%2A",
            "@multimediatype": "GIF image file",
            "@type": "ALTIMG",
            "@size": "222",
            "@ref": "si38",
            "@mimetype": "image/gif"
          },
          {
            "@category": "thumbnail",
            "@height": "17",
            "@width": "210",
            "@_fa": "true",
            "$": "https://api.elsevier.com/content/object/eid/1-s2.0-S0021951705002290-si37.gif?httpAccept=%2A%2F%2A",
            "@multimediatype": "GIF image file",
            "@type": "ALTIMG",
            "@size": "741",
            "@ref": "si37",
            "@mimetype": "image/gif"
          },
          {
            "@category": "thumbnail",
            "@height": "16",
            "@width": "211",
            "@_fa": "true",
            "$": "https://api.elsevier.com/content/object/eid/1-s2.0-S0021951705002290-si36.gif?httpAccept=%2A%2F%2A",
            "@multimediatype": "GIF image file",
            "@type": "ALTIMG",
            "@size": "745",
            "@ref": "si36",
            "@mimetype": "image/gif"
          },
          {
            "@category": "thumbnail",
            "@height": "14",
            "@width": "131",
            "@_fa": "true",
            "$": "https://api.elsevier.com/content/object/eid/1-s2.0-S0021951705002290-si35.gif?httpAccept=%2A%2F%2A",
            "@multimediatype": "GIF image file",
            "@type": "ALTIMG",
            "@size": "499",
            "@ref": "si35",
            "@mimetype": "image/gif"
          },
          {
            "@category": "thumbnail",
            "@height": "36",
            "@width": "79",
            "@_fa": "true",
            "$": "https://api.elsevier.com/content/object/eid/1-s2.0-S0021951705002290-si34.gif?httpAccept=%2A%2F%2A",
            "@multimediatype": "GIF image file",
            "@type": "ALTIMG",
            "@size": "541",
            "@ref": "si34",
            "@mimetype": "image/gif"
          },
          {
            "@category": "thumbnail",
            "@height": "15",
            "@width": "52",
            "@_fa": "true",
            "$": "https://api.elsevier.com/content/object/eid/1-s2.0-S0021951705002290-si33.gif?httpAccept=%2A%2F%2A",
            "@multimediatype": "GIF image file",
            "@type": "ALTIMG",
            "@size": "245",
            "@ref": "si33",
            "@mimetype": "image/gif"
          },
          {
            "@category": "thumbnail",
            "@height": "14",
            "@width": "131",
            "@_fa": "true",
            "$": "https://api.elsevier.com/content/object/eid/1-s2.0-S0021951705002290-si32.gif?httpAccept=%2A%2F%2A",
            "@multimediatype": "GIF image file",
            "@type": "ALTIMG",
            "@size": "482",
            "@ref": "si32",
            "@mimetype": "image/gif"
          },
          {
            "@category": "thumbnail",
            "@height": "35",
            "@width": "85",
            "@_fa": "true",
            "$": "https://api.elsevier.com/content/object/eid/1-s2.0-S0021951705002290-si31.gif?httpAccept=%2A%2F%2A",
            "@multimediatype": "GIF image file",
            "@type": "ALTIMG",
            "@size": "541",
            "@ref": "si31",
            "@mimetype": "image/gif"
          },
          {
            "@category": "thumbnail",
            "@height": "15",
            "@width": "52",
            "@_fa": "true",
            "$": "https://api.elsevier.com/content/object/eid/1-s2.0-S0021951705002290-si30.gif?httpAccept=%2A%2F%2A",
            "@multimediatype": "GIF image file",
            "@type": "ALTIMG",
            "@size": "245",
            "@ref": "si30",
            "@mimetype": "image/gif"
          },
          {
            "@category": "thumbnail",
            "@height": "16",
            "@width": "201",
            "@_fa": "true",
            "$": "https://api.elsevier.com/content/object/eid/1-s2.0-S0021951705002290-si29.gif?httpAccept=%2A%2F%2A",
            "@multimediatype": "GIF image file",
            "@type": "ALTIMG",
            "@size": "695",
            "@ref": "si29",
            "@mimetype": "image/gif"
          },
          {
            "@category": "thumbnail",
            "@height": "16",
            "@width": "194",
            "@_fa": "true",
            "$": "https://api.elsevier.com/content/object/eid/1-s2.0-S0021951705002290-si28.gif?httpAccept=%2A%2F%2A",
            "@multimediatype": "GIF image file",
            "@type": "ALTIMG",
            "@size": "678",
            "@ref": "si28",
            "@mimetype": "image/gif"
          },
          {
            "@category": "thumbnail",
            "@height": "17",
            "@width": "202",
            "@_fa": "true",
            "$": "https://api.elsevier.com/content/object/eid/1-s2.0-S0021951705002290-si27.gif?httpAccept=%2A%2F%2A",
            "@multimediatype": "GIF image file",
            "@type": "ALTIMG",
            "@size": "714",
            "@ref": "si27",
            "@mimetype": "image/gif"
          },
          {
            "@category": "thumbnail",
            "@height": "15",
            "@width": "52",
            "@_fa": "true",
            "$": "https://api.elsevier.com/content/object/eid/1-s2.0-S0021951705002290-si26.gif?httpAccept=%2A%2F%2A",
            "@multimediatype": "GIF image file",
            "@type": "ALTIMG",
            "@size": "245",
            "@ref": "si26",
            "@mimetype": "image/gif"
          },
          {
            "@category": "thumbnail",
            "@height": "16",
            "@width": "194",
            "@_fa": "true",
            "$": "https://api.elsevier.com/content/object/eid/1-s2.0-S0021951705002290-si25.gif?httpAccept=%2A%2F%2A",
            "@multimediatype": "GIF image file",
            "@type": "ALTIMG",
            "@size": "676",
            "@ref": "si25",
            "@mimetype": "image/gif"
          },
          {
            "@category": "thumbnail",
            "@height": "15",
            "@width": "52",
            "@_fa": "true",
            "$": "https://api.elsevier.com/content/object/eid/1-s2.0-S0021951705002290-si24.gif?httpAccept=%2A%2F%2A",
            "@multimediatype": "GIF image file",
            "@type": "ALTIMG",
            "@size": "245",
            "@ref": "si24",
            "@mimetype": "image/gif"
          },
          {
            "@category": "thumbnail",
            "@height": "17",
            "@width": "188",
            "@_fa": "true",
            "$": "https://api.elsevier.com/content/object/eid/1-s2.0-S0021951705002290-si21.gif?httpAccept=%2A%2F%2A",
            "@multimediatype": "GIF image file",
            "@type": "ALTIMG",
            "@size": "653",
            "@ref": "si21",
            "@mimetype": "image/gif"
          },
          {
            "@category": "thumbnail",
            "@height": "16",
            "@width": "178",
            "@_fa": "true",
            "$": "https://api.elsevier.com/content/object/eid/1-s2.0-S0021951705002290-si20.gif?httpAccept=%2A%2F%2A",
            "@multimediatype": "GIF image file",
            "@type": "ALTIMG",
            "@size": "655",
            "@ref": "si20",
            "@mimetype": "image/gif"
          },
          {
            "@category": "thumbnail",
            "@height": "21",
            "@width": "25",
            "@_fa": "true",
            "$": "https://api.elsevier.com/content/object/eid/1-s2.0-S0021951705002290-si2.gif?httpAccept=%2A%2F%2A",
            "@multimediatype": "GIF image file",
            "@type": "ALTIMG",
            "@size": "165",
            "@ref": "si2",
            "@mimetype": "image/gif"
          },
          {
            "@category": "thumbnail",
            "@height": "16",
            "@width": "177",
            "@_fa": "true",
            "$": "https://api.elsevier.com/content/object/eid/1-s2.0-S0021951705002290-si19.gif?httpAccept=%2A%2F%2A",
            "@multimediatype": "GIF image file",
            "@type": "ALTIMG",
            "@size": "628",
            "@ref": "si19",
            "@mimetype": "image/gif"
          },
          {
            "@category": "thumbnail",
            "@height": "16",
            "@width": "234",
            "@_fa": "true",
            "$": "https://api.elsevier.com/content/object/eid/1-s2.0-S0021951705002290-si18.gif?httpAccept=%2A%2F%2A",
            "@multimediatype": "GIF image file",
            "@type": "ALTIMG",
            "@size": "780",
            "@ref": "si18",
            "@mimetype": "image/gif"
          },
          {
            "@category": "thumbnail",
            "@height": "35",
            "@width": "85",
            "@_fa": "true",
            "$": "https://api.elsevier.com/content/object/eid/1-s2.0-S0021951705002290-si17.gif?httpAccept=%2A%2F%2A",
            "@multimediatype": "GIF image file",
            "@type": "ALTIMG",
            "@size": "563",
            "@ref": "si17",
            "@mimetype": "image/gif"
          },
          {
            "@category": "thumbnail",
            "@height": "17",
            "@width": "234",
            "@_fa": "true",
            "$": "https://api.elsevier.com/content/object/eid/1-s2.0-S0021951705002290-si16.gif?httpAccept=%2A%2F%2A",
            "@multimediatype": "GIF image file",
            "@type": "ALTIMG",
            "@size": "785",
            "@ref": "si16",
            "@mimetype": "image/gif"
          },
          {
            "@category": "thumbnail",
            "@height": "36",
            "@width": "85",
            "@_fa": "true",
            "$": "https://api.elsevier.com/content/object/eid/1-s2.0-S0021951705002290-si15.gif?httpAccept=%2A%2F%2A",
            "@multimediatype": "GIF image file",
            "@type": "ALTIMG",
            "@size": "545",
            "@ref": "si15",
            "@mimetype": "image/gif"
          },
          {
            "@category": "thumbnail",
            "@height": "16",
            "@width": "201",
            "@_fa": "true",
            "$": "https://api.elsevier.com/content/object/eid/1-s2.0-S0021951705002290-si14.gif?httpAccept=%2A%2F%2A",
            "@multimediatype": "GIF image file",
            "@type": "ALTIMG",
            "@size": "690",
            "@ref": "si14",
            "@mimetype": "image/gif"
          },
          {
            "@category": "thumbnail",
            "@height": "16",
            "@width": "202",
            "@_fa": "true",
            "$": "https://api.elsevier.com/content/object/eid/1-s2.0-S0021951705002290-si13.gif?httpAccept=%2A%2F%2A",
            "@multimediatype": "GIF image file",
            "@type": "ALTIMG",
            "@size": "701",
            "@ref": "si13",
            "@mimetype": "image/gif"
          },
          {
            "@category": "thumbnail",
            "@height": "14",
            "@width": "34",
            "@_fa": "true",
            "$": "https://api.elsevier.com/content/object/eid/1-s2.0-S0021951705002290-si126.gif?httpAccept=%2A%2F%2A",
            "@multimediatype": "GIF image file",
            "@type": "ALTIMG",
            "@size": "198",
            "@ref": "si126",
            "@mimetype": "image/gif"
          },
          {
            "@category": "thumbnail",
            "@height": "14",
            "@width": "39",
            "@_fa": "true",
            "$": "https://api.elsevier.com/content/object/eid/1-s2.0-S0021951705002290-si125.gif?httpAccept=%2A%2F%2A",
            "@multimediatype": "GIF image file",
            "@type": "ALTIMG",
            "@size": "190",
            "@ref": "si125",
            "@mimetype": "image/gif"
          },
          {
            "@category": "thumbnail",
            "@height": "16",
            "@width": "78",
            "@_fa": "true",
            "$": "https://api.elsevier.com/content/object/eid/1-s2.0-S0021951705002290-si124.gif?httpAccept=%2A%2F%2A",
            "@multimediatype": "GIF image file",
            "@type": "ALTIMG",
            "@size": "290",
            "@ref": "si124",
            "@mimetype": "image/gif"
          },
          {
            "@category": "thumbnail",
            "@height": "14",
            "@width": "81",
            "@_fa": "true",
            "$": "https://api.elsevier.com/content/object/eid/1-s2.0-S0021951705002290-si123.gif?httpAccept=%2A%2F%2A",
            "@multimediatype": "GIF image file",
            "@type": "ALTIMG",
            "@size": "352",
            "@ref": "si123",
            "@mimetype": "image/gif"
          },
          {
            "@category": "thumbnail",
            "@height": "15",
            "@width": "74",
            "@_fa": "true",
            "$": "https://api.elsevier.com/content/object/eid/1-s2.0-S0021951705002290-si122.gif?httpAccept=%2A%2F%2A",
            "@multimediatype": "GIF image file",
            "@type": "ALTIMG",
            "@size": "270",
            "@ref": "si122",
            "@mimetype": "image/gif"
          },
          {
            "@category": "thumbnail",
            "@height": "16",
            "@width": "45",
            "@_fa": "true",
            "$": "https://api.elsevier.com/content/object/eid/1-s2.0-S0021951705002290-si121.gif?httpAccept=%2A%2F%2A",
            "@multimediatype": "GIF image file",
            "@type": "ALTIMG",
            "@size": "211",
            "@ref": "si121",
            "@mimetype": "image/gif"
          },
          {
            "@category": "thumbnail",
            "@height": "15",
            "@width": "46",
            "@_fa": "true",
            "$": "https://api.elsevier.com/content/object/eid/1-s2.0-S0021951705002290-si120.gif?httpAccept=%2A%2F%2A",
            "@multimediatype": "GIF image file",
            "@type": "ALTIMG",
            "@size": "206",
            "@ref": "si120",
            "@mimetype": "image/gif"
          },
          {
            "@category": "thumbnail",
            "@height": "15",
            "@width": "190",
            "@_fa": "true",
            "$": "https://api.elsevier.com/content/object/eid/1-s2.0-S0021951705002290-si12.gif?httpAccept=%2A%2F%2A",
            "@multimediatype": "GIF image file",
            "@type": "ALTIMG",
            "@size": "611",
            "@ref": "si12",
            "@mimetype": "image/gif"
          },
          {
            "@category": "thumbnail",
            "@height": "15",
            "@width": "45",
            "@_fa": "true",
            "$": "https://api.elsevier.com/content/object/eid/1-s2.0-S0021951705002290-si119.gif?httpAccept=%2A%2F%2A",
            "@multimediatype": "GIF image file",
            "@type": "ALTIMG",
            "@size": "206",
            "@ref": "si119",
            "@mimetype": "image/gif"
          },
          {
            "@category": "thumbnail",
            "@height": "14",
            "@width": "34",
            "@_fa": "true",
            "$": "https://api.elsevier.com/content/object/eid/1-s2.0-S0021951705002290-si118.gif?httpAccept=%2A%2F%2A",
            "@multimediatype": "GIF image file",
            "@type": "ALTIMG",
            "@size": "198",
            "@ref": "si118",
            "@mimetype": "image/gif"
          },
          {
            "@category": "thumbnail",
            "@height": "14",
            "@width": "34",
            "@_fa": "true",
            "$": "https://api.elsevier.com/content/object/eid/1-s2.0-S0021951705002290-si117.gif?httpAccept=%2A%2F%2A",
            "@multimediatype": "GIF image file",
            "@type": "ALTIMG",
            "@size": "198",
            "@ref": "si117",
            "@mimetype": "image/gif"
          },
          {
            "@category": "thumbnail",
            "@height": "15",
            "@width": "36",
            "@_fa": "true",
            "$": "https://api.elsevier.com/content/object/eid/1-s2.0-S0021951705002290-si113.gif?httpAccept=%2A%2F%2A",
            "@multimediatype": "GIF image file",
            "@type": "ALTIMG",
            "@size": "222",
            "@ref": "si113",
            "@mimetype": "image/gif"
          },
          {
            "@category": "thumbnail",
            "@height": "14",
            "@width": "34",
            "@_fa": "true",
            "$": "https://api.elsevier.com/content/object/eid/1-s2.0-S0021951705002290-si112.gif?httpAccept=%2A%2F%2A",
            "@multimediatype": "GIF image file",
            "@type": "ALTIMG",
            "@size": "198",
            "@ref": "si112",
            "@mimetype": "image/gif"
          },
          {
            "@category": "thumbnail",
            "@height": "14",
            "@width": "34",
            "@_fa": "true",
            "$": "https://api.elsevier.com/content/object/eid/1-s2.0-S0021951705002290-si111.gif?httpAccept=%2A%2F%2A",
            "@multimediatype": "GIF image file",
            "@type": "ALTIMG",
            "@size": "198",
            "@ref": "si111",
            "@mimetype": "image/gif"
          },
          {
            "@category": "thumbnail",
            "@height": "14",
            "@width": "34",
            "@_fa": "true",
            "$": "https://api.elsevier.com/content/object/eid/1-s2.0-S0021951705002290-si110.gif?httpAccept=%2A%2F%2A",
            "@multimediatype": "GIF image file",
            "@type": "ALTIMG",
            "@size": "198",
            "@ref": "si110",
            "@mimetype": "image/gif"
          },
          {
            "@category": "thumbnail",
            "@height": "15",
            "@width": "163",
            "@_fa": "true",
            "$": "https://api.elsevier.com/content/object/eid/1-s2.0-S0021951705002290-si11.gif?httpAccept=%2A%2F%2A",
            "@multimediatype": "GIF image file",
            "@type": "ALTIMG",
            "@size": "586",
            "@ref": "si11",
            "@mimetype": "image/gif"
          },
          {
            "@category": "thumbnail",
            "@height": "11",
            "@width": "38",
            "@_fa": "true",
            "$": "https://api.elsevier.com/content/object/eid/1-s2.0-S0021951705002290-si108.gif?httpAccept=%2A%2F%2A",
            "@multimediatype": "GIF image file",
            "@type": "ALTIMG",
            "@size": "181",
            "@ref": "si108",
            "@mimetype": "image/gif"
          },
          {
            "@category": "thumbnail",
            "@height": "13",
            "@width": "50",
            "@_fa": "true",
            "$": "https://api.elsevier.com/content/object/eid/1-s2.0-S0021951705002290-si107.gif?httpAccept=%2A%2F%2A",
            "@multimediatype": "GIF image file",
            "@type": "ALTIMG",
            "@size": "232",
            "@ref": "si107",
            "@mimetype": "image/gif"
          },
          {
            "@category": "thumbnail",
            "@height": "11",
            "@width": "36",
            "@_fa": "true",
            "$": "https://api.elsevier.com/content/object/eid/1-s2.0-S0021951705002290-si106.gif?httpAccept=%2A%2F%2A",
            "@multimediatype": "GIF image file",
            "@type": "ALTIMG",
            "@size": "184",
            "@ref": "si106",
            "@mimetype": "image/gif"
          },
          {
            "@category": "thumbnail",
            "@height": "15",
            "@width": "73",
            "@_fa": "true",
            "$": "https://api.elsevier.com/content/object/eid/1-s2.0-S0021951705002290-si105.gif?httpAccept=%2A%2F%2A",
            "@multimediatype": "GIF image file",
            "@type": "ALTIMG",
            "@size": "321",
            "@ref": "si105",
            "@mimetype": "image/gif"
          },
          {
            "@category": "thumbnail",
            "@height": "16",
            "@width": "74",
            "@_fa": "true",
            "$": "https://api.elsevier.com/content/object/eid/1-s2.0-S0021951705002290-si104.gif?httpAccept=%2A%2F%2A",
            "@multimediatype": "GIF image file",
            "@type": "ALTIMG",
            "@size": "292",
            "@ref": "si104",
            "@mimetype": "image/gif"
          },
          {
            "@category": "thumbnail",
            "@height": "14",
            "@width": "34",
            "@_fa": "true",
            "$": "https://api.elsevier.com/content/object/eid/1-s2.0-S0021951705002290-si103.gif?httpAccept=%2A%2F%2A",
            "@multimediatype": "GIF image file",
            "@type": "ALTIMG",
            "@size": "198",
            "@ref": "si103",
            "@mimetype": "image/gif"
          },
          {
            "@category": "thumbnail",
            "@height": "14",
            "@width": "34",
            "@_fa": "true",
            "$": "https://api.elsevier.com/content/object/eid/1-s2.0-S0021951705002290-si102.gif?httpAccept=%2A%2F%2A",
            "@multimediatype": "GIF image file",
            "@type": "ALTIMG",
            "@size": "198",
            "@ref": "si102",
            "@mimetype": "image/gif"
          },
          {
            "@category": "thumbnail",
            "@height": "15",
            "@width": "36",
            "@_fa": "true",
            "$": "https://api.elsevier.com/content/object/eid/1-s2.0-S0021951705002290-si101.gif?httpAccept=%2A%2F%2A",
            "@multimediatype": "GIF image file",
            "@type": "ALTIMG",
            "@size": "222",
            "@ref": "si101",
            "@mimetype": "image/gif"
          },
          {
            "@category": "thumbnail",
            "@height": "15",
            "@width": "52",
            "@_fa": "true",
            "$": "https://api.elsevier.com/content/object/eid/1-s2.0-S0021951705002290-si10.gif?httpAccept=%2A%2F%2A",
            "@multimediatype": "GIF image file",
            "@type": "ALTIMG",
            "@size": "245",
            "@ref": "si10",
            "@mimetype": "image/gif"
          },
          {
            "@category": "thumbnail",
            "@height": "21",
            "@width": "25",
            "@_fa": "true",
            "$": "https://api.elsevier.com/content/object/eid/1-s2.0-S0021951705002290-si1.gif?httpAccept=%2A%2F%2A",
            "@multimediatype": "GIF image file",
            "@type": "ALTIMG",
            "@size": "165",
            "@ref": "si1",
            "@mimetype": "image/gif"
          },
          {
            "@category": "standard",
            "@height": "315",
            "@width": "332",
            "@_fa": "true",
            "$": "https://api.elsevier.com/content/object/eid/1-s2.0-S0021951705002290-gr003.gif?httpAccept=%2A%2F%2A",
            "@multimediatype": "GIF image file",
            "@type": "IMAGE-DOWNSAMPLED",
            "@size": "9757",
            "@ref": "gr003",
            "@mimetype": "image/gif"
          },
          {
            "@category": "thumbnail",
            "@height": "93",
            "@width": "98",
            "@_fa": "true",
            "$": "https://api.elsevier.com/content/object/eid/1-s2.0-S0021951705002290-gr003.sml?httpAccept=%2A%2F%2A",
            "@multimediatype": "GIF image file",
            "@type": "IMAGE-THUMBNAIL",
            "@size": "1639",
            "@ref": "gr003",
            "@mimetype": "image/gif"
          },
          {
            "@category": "standard",
            "@height": "280",
            "@width": "303",
            "@_fa": "true",
            "$": "https://api.elsevier.com/content/object/eid/1-s2.0-S0021951705002290-gr015.gif?httpAccept=%2A%2F%2A",
            "@multimediatype": "GIF image file",
            "@type": "IMAGE-DOWNSAMPLED",
            "@size": "9181",
            "@ref": "gr015",
            "@mimetype": "image/gif"
          },
          {
            "@category": "thumbnail",
            "@height": "93",
            "@width": "101",
            "@_fa": "true",
            "$": "https://api.elsevier.com/content/object/eid/1-s2.0-S0021951705002290-gr015.sml?httpAccept=%2A%2F%2A",
            "@multimediatype": "GIF image file",
            "@type": "IMAGE-THUMBNAIL",
            "@size": "1809",
            "@ref": "gr015",
            "@mimetype": "image/gif"
          },
          {
            "@category": "standard",
            "@height": "286",
            "@width": "297",
            "@_fa": "true",
            "$": "https://api.elsevier.com/content/object/eid/1-s2.0-S0021951705002290-gr017.gif?httpAccept=%2A%2F%2A",
            "@multimediatype": "GIF image file",
            "@type": "IMAGE-DOWNSAMPLED",
            "@size": "10305",
            "@ref": "gr017",
            "@mimetype": "image/gif"
          },
          {
            "@category": "thumbnail",
            "@height": "93",
            "@width": "97",
            "@_fa": "true",
            "$": "https://api.elsevier.com/content/object/eid/1-s2.0-S0021951705002290-gr017.sml?httpAccept=%2A%2F%2A",
            "@multimediatype": "GIF image file",
            "@type": "IMAGE-THUMBNAIL",
            "@size": "1901",
            "@ref": "gr017",
            "@mimetype": "image/gif"
          },
          {
            "@category": "standard",
            "@height": "306",
            "@width": "333",
            "@_fa": "true",
            "$": "https://api.elsevier.com/content/object/eid/1-s2.0-S0021951705002290-gr019.gif?httpAccept=%2A%2F%2A",
            "@multimediatype": "GIF image file",
            "@type": "IMAGE-DOWNSAMPLED",
            "@size": "9181",
            "@ref": "gr019",
            "@mimetype": "image/gif"
          },
          {
            "@category": "thumbnail",
            "@height": "93",
            "@width": "101",
            "@_fa": "true",
            "$": "https://api.elsevier.com/content/object/eid/1-s2.0-S0021951705002290-gr019.sml?httpAccept=%2A%2F%2A",
            "@multimediatype": "GIF image file",
            "@type": "IMAGE-THUMBNAIL",
            "@size": "1621",
            "@ref": "gr019",
            "@mimetype": "image/gif"
          },
          {
            "@category": "standard",
            "@height": "454",
            "@width": "371",
            "@_fa": "true",
            "$": "https://api.elsevier.com/content/object/eid/1-s2.0-S0021951705002290-gr010.gif?httpAccept=%2A%2F%2A",
            "@multimediatype": "GIF image file",
            "@type": "IMAGE-DOWNSAMPLED",
            "@size": "15686",
            "@ref": "gr010",
            "@mimetype": "image/gif"
          },
          {
            "@category": "thumbnail",
            "@height": "93",
            "@width": "76",
            "@_fa": "true",
            "$": "https://api.elsevier.com/content/object/eid/1-s2.0-S0021951705002290-gr010.sml?httpAccept=%2A%2F%2A",
            "@multimediatype": "GIF image file",
            "@type": "IMAGE-THUMBNAIL",
            "@size": "1316",
            "@ref": "gr010",
            "@mimetype": "image/gif"
          },
          {
            "@category": "standard",
            "@height": "307",
            "@width": "322",
            "@_fa": "true",
            "$": "https://api.elsevier.com/content/object/eid/1-s2.0-S0021951705002290-gr005.gif?httpAccept=%2A%2F%2A",
            "@multimediatype": "GIF image file",
            "@type": "IMAGE-DOWNSAMPLED",
            "@size": "10708",
            "@ref": "gr005",
            "@mimetype": "image/gif"
          },
          {
            "@category": "thumbnail",
            "@height": "93",
            "@width": "98",
            "@_fa": "true",
            "$": "https://api.elsevier.com/content/object/eid/1-s2.0-S0021951705002290-gr005.sml?httpAccept=%2A%2F%2A",
            "@multimediatype": "GIF image file",
            "@type": "IMAGE-THUMBNAIL",
            "@size": "1804",
            "@ref": "gr005",
            "@mimetype": "image/gif"
          },
          {
            "@category": "standard",
            "@height": "548",
            "@width": "299",
            "@_fa": "true",
            "$": "https://api.elsevier.com/content/object/eid/1-s2.0-S0021951705002290-gr009.gif?httpAccept=%2A%2F%2A",
            "@multimediatype": "GIF image file",
            "@type": "IMAGE-DOWNSAMPLED",
            "@size": "16942",
            "@ref": "gr009",
            "@mimetype": "image/gif"
          },
          {
            "@category": "thumbnail",
            "@height": "94",
            "@width": "51",
            "@_fa": "true",
            "$": "https://api.elsevier.com/content/object/eid/1-s2.0-S0021951705002290-gr009.sml?httpAccept=%2A%2F%2A",
            "@multimediatype": "GIF image file",
            "@type": "IMAGE-THUMBNAIL",
            "@size": "1194",
            "@ref": "gr009",
            "@mimetype": "image/gif"
          },
          {
            "@category": "standard",
            "@height": "533",
            "@width": "302",
            "@_fa": "true",
            "$": "https://api.elsevier.com/content/object/eid/1-s2.0-S0021951705002290-gr007.gif?httpAccept=%2A%2F%2A",
            "@multimediatype": "GIF image file",
            "@type": "IMAGE-DOWNSAMPLED",
            "@size": "13252",
            "@ref": "gr007",
            "@mimetype": "image/gif"
          },
          {
            "@category": "thumbnail",
            "@height": "93",
            "@width": "53",
            "@_fa": "true",
            "$": "https://api.elsevier.com/content/object/eid/1-s2.0-S0021951705002290-gr007.sml?httpAccept=%2A%2F%2A",
            "@multimediatype": "GIF image file",
            "@type": "IMAGE-THUMBNAIL",
            "@size": "1057",
            "@ref": "gr007",
            "@mimetype": "image/gif"
          },
          {
            "@category": "standard",
            "@height": "321",
            "@width": "326",
            "@_fa": "true",
            "$": "https://api.elsevier.com/content/object/eid/1-s2.0-S0021951705002290-gr004.gif?httpAccept=%2A%2F%2A",
            "@multimediatype": "GIF image file",
            "@type": "IMAGE-DOWNSAMPLED",
            "@size": "9754",
            "@ref": "gr004",
            "@mimetype": "image/gif"
          },
          {
            "@category": "thumbnail",
            "@height": "94",
            "@width": "95",
            "@_fa": "true",
            "$": "https://api.elsevier.com/content/object/eid/1-s2.0-S0021951705002290-gr004.sml?httpAccept=%2A%2F%2A",
            "@multimediatype": "GIF image file",
            "@type": "IMAGE-THUMBNAIL",
            "@size": "1580",
            "@ref": "gr004",
            "@mimetype": "image/gif"
          },
          {
            "@category": "standard",
            "@height": "478",
            "@width": "325",
            "@_fa": "true",
            "$": "https://api.elsevier.com/content/object/eid/1-s2.0-S0021951705002290-gr008.jpg?httpAccept=%2A%2F%2A",
            "@multimediatype": "JPEG image file",
            "@type": "IMAGE-DOWNSAMPLED",
            "@size": "52413",
            "@ref": "gr008",
            "@mimetype": "image/jpeg"
          },
          {
            "@category": "thumbnail",
            "@height": "93",
            "@width": "63",
            "@_fa": "true",
            "$": "https://api.elsevier.com/content/object/eid/1-s2.0-S0021951705002290-gr008.sml?httpAccept=%2A%2F%2A",
            "@multimediatype": "GIF image file",
            "@type": "IMAGE-THUMBNAIL",
            "@size": "2497",
            "@ref": "gr008",
            "@mimetype": "image/gif"
          },
          {
            "@category": "standard",
            "@height": "728",
            "@width": "335",
            "@_fa": "true",
            "$": "https://api.elsevier.com/content/object/eid/1-s2.0-S0021951705002290-gr012.jpg?httpAccept=%2A%2F%2A",
            "@multimediatype": "JPEG image file",
            "@type": "IMAGE-DOWNSAMPLED",
            "@size": "86622",
            "@ref": "gr012",
            "@mimetype": "image/jpeg"
          },
          {
            "@category": "thumbnail",
            "@height": "93",
            "@width": "43",
            "@_fa": "true",
            "$": "https://api.elsevier.com/content/object/eid/1-s2.0-S0021951705002290-gr012.sml?httpAccept=%2A%2F%2A",
            "@multimediatype": "GIF image file",
            "@type": "IMAGE-THUMBNAIL",
            "@size": "1209",
            "@ref": "gr012",
            "@mimetype": "image/gif"
          },
          {
            "@category": "standard",
            "@height": "537",
            "@width": "279",
            "@_fa": "true",
            "$": "https://api.elsevier.com/content/object/eid/1-s2.0-S0021951705002290-gr020.gif?httpAccept=%2A%2F%2A",
            "@multimediatype": "GIF image file",
            "@type": "IMAGE-DOWNSAMPLED",
            "@size": "16208",
            "@ref": "gr020",
            "@mimetype": "image/gif"
          },
          {
            "@category": "thumbnail",
            "@height": "92",
            "@width": "48",
            "@_fa": "true",
            "$": "https://api.elsevier.com/content/object/eid/1-s2.0-S0021951705002290-gr020.sml?httpAccept=%2A%2F%2A",
            "@multimediatype": "GIF image file",
            "@type": "IMAGE-THUMBNAIL",
            "@size": "1098",
            "@ref": "gr020",
            "@mimetype": "image/gif"
          },
          {
            "@category": "standard",
            "@height": "314",
            "@width": "340",
            "@_fa": "true",
            "$": "https://api.elsevier.com/content/object/eid/1-s2.0-S0021951705002290-gr013.gif?httpAccept=%2A%2F%2A",
            "@multimediatype": "GIF image file",
            "@type": "IMAGE-DOWNSAMPLED",
            "@size": "12148",
            "@ref": "gr013",
            "@mimetype": "image/gif"
          },
          {
            "@category": "thumbnail",
            "@height": "93",
            "@width": "101",
            "@_fa": "true",
            "$": "https://api.elsevier.com/content/object/eid/1-s2.0-S0021951705002290-gr013.sml?httpAccept=%2A%2F%2A",
            "@multimediatype": "GIF image file",
            "@type": "IMAGE-THUMBNAIL",
            "@size": "2027",
            "@ref": "gr013",
            "@mimetype": "image/gif"
          },
          {
            "@category": "standard",
            "@height": "334",
            "@width": "333",
            "@_fa": "true",
            "$": "https://api.elsevier.com/content/object/eid/1-s2.0-S0021951705002290-gr014.gif?httpAccept=%2A%2F%2A",
            "@multimediatype": "GIF image file",
            "@type": "IMAGE-DOWNSAMPLED",
            "@size": "12182",
            "@ref": "gr014",
            "@mimetype": "image/gif"
          },
          {
            "@category": "thumbnail",
            "@height": "93",
            "@width": "93",
            "@_fa": "true",
            "$": "https://api.elsevier.com/content/object/eid/1-s2.0-S0021951705002290-gr014.sml?httpAccept=%2A%2F%2A",
            "@multimediatype": "GIF image file",
            "@type": "IMAGE-THUMBNAIL",
            "@size": "1871",
            "@ref": "gr014",
            "@mimetype": "image/gif"
          },
          {
            "@category": "standard",
            "@height": "522",
            "@width": "307",
            "@_fa": "true",
            "$": "https://api.elsevier.com/content/object/eid/1-s2.0-S0021951705002290-gr006.gif?httpAccept=%2A%2F%2A",
            "@multimediatype": "GIF image file",
            "@type": "IMAGE-DOWNSAMPLED",
            "@size": "18414",
            "@ref": "gr006",
            "@mimetype": "image/gif"
          },
          {
            "@category": "thumbnail",
            "@height": "93",
            "@width": "55",
            "@_fa": "true",
            "$": "https://api.elsevier.com/content/object/eid/1-s2.0-S0021951705002290-gr006.sml?httpAccept=%2A%2F%2A",
            "@multimediatype": "GIF image file",
            "@type": "IMAGE-THUMBNAIL",
            "@size": "1485",
            "@ref": "gr006",
            "@mimetype": "image/gif"
          },
          {
            "@category": "standard",
            "@height": "332",
            "@width": "314",
            "@_fa": "true",
            "$": "https://api.elsevier.com/content/object/eid/1-s2.0-S0021951705002290-gr011.jpg?httpAccept=%2A%2F%2A",
            "@multimediatype": "JPEG image file",
            "@type": "IMAGE-DOWNSAMPLED",
            "@size": "34547",
            "@ref": "gr011",
            "@mimetype": "image/jpeg"
          },
          {
            "@category": "thumbnail",
            "@height": "93",
            "@width": "88",
            "@_fa": "true",
            "$": "https://api.elsevier.com/content/object/eid/1-s2.0-S0021951705002290-gr011.sml?httpAccept=%2A%2F%2A",
            "@multimediatype": "GIF image file",
            "@type": "IMAGE-THUMBNAIL",
            "@size": "1824",
            "@ref": "gr011",
            "@mimetype": "image/gif"
          },
          {
            "@category": "standard",
            "@height": "523",
            "@width": "299",
            "@_fa": "true",
            "$": "https://api.elsevier.com/content/object/eid/1-s2.0-S0021951705002290-gr018.gif?httpAccept=%2A%2F%2A",
            "@multimediatype": "GIF image file",
            "@type": "IMAGE-DOWNSAMPLED",
            "@size": "16301",
            "@ref": "gr018",
            "@mimetype": "image/gif"
          },
          {
            "@category": "thumbnail",
            "@height": "93",
            "@width": "53",
            "@_fa": "true",
            "$": "https://api.elsevier.com/content/object/eid/1-s2.0-S0021951705002290-gr018.sml?httpAccept=%2A%2F%2A",
            "@multimediatype": "GIF image file",
            "@type": "IMAGE-THUMBNAIL",
            "@size": "1187",
            "@ref": "gr018",
            "@mimetype": "image/gif"
          },
          {
            "@category": "standard",
            "@height": "314",
            "@width": "329",
            "@_fa": "true",
            "$": "https://api.elsevier.com/content/object/eid/1-s2.0-S0021951705002290-gr001.gif?httpAccept=%2A%2F%2A",
            "@multimediatype": "GIF image file",
            "@type": "IMAGE-DOWNSAMPLED",
            "@size": "9010",
            "@ref": "gr001",
            "@mimetype": "image/gif"
          },
          {
            "@category": "thumbnail",
            "@height": "93",
            "@width": "98",
            "@_fa": "true",
            "$": "https://api.elsevier.com/content/object/eid/1-s2.0-S0021951705002290-gr001.sml?httpAccept=%2A%2F%2A",
            "@multimediatype": "GIF image file",
            "@type": "IMAGE-THUMBNAIL",
            "@size": "1507",
            "@ref": "gr001",
            "@mimetype": "image/gif"
          },
          {
            "@category": "standard",
            "@height": "314",
            "@width": "340",
            "@_fa": "true",
            "$": "https://api.elsevier.com/content/object/eid/1-s2.0-S0021951705002290-gr002.gif?httpAccept=%2A%2F%2A",
            "@multimediatype": "GIF image file",
            "@type": "IMAGE-DOWNSAMPLED",
            "@size": "10700",
            "@ref": "gr002",
            "@mimetype": "image/gif"
          },
          {
            "@category": "thumbnail",
            "@height": "93",
            "@width": "101",
            "@_fa": "true",
            "$": "https://api.elsevier.com/content/object/eid/1-s2.0-S0021951705002290-gr002.sml?httpAccept=%2A%2F%2A",
            "@multimediatype": "GIF image file",
            "@type": "IMAGE-THUMBNAIL",
            "@size": "1804",
            "@ref": "gr002",
            "@mimetype": "image/gif"
          },
          {
            "@category": "standard",
            "@height": "525",
            "@width": "310",
            "@_fa": "true",
            "$": "https://api.elsevier.com/content/object/eid/1-s2.0-S0021951705002290-gr016.gif?httpAccept=%2A%2F%2A",
            "@multimediatype": "GIF image file",
            "@type": "IMAGE-DOWNSAMPLED",
            "@size": "18769",
            "@ref": "gr016",
            "@mimetype": "image/gif"
          },
          {
            "@category": "thumbnail",
            "@height": "93",
            "@width": "55",
            "@_fa": "true",
            "$": "https://api.elsevier.com/content/object/eid/1-s2.0-S0021951705002290-gr016.sml?httpAccept=%2A%2F%2A",
            "@multimediatype": "GIF image file",
            "@type": "IMAGE-THUMBNAIL",
            "@size": "1365",
            "@ref": "gr016",
            "@mimetype": "image/gif"
          }
        ]
      },
      "link": {
        "@rel": "abstract",
        "@href": "https://api.elsevier.com/content/abstract/scopus_id/23244449459"
      }
    }
  }
}