{
  "metadata": {
    "title": "Robust and efficient catalyst derived from bimetallic Zn/Co zeolitic imidazolate frameworks for CO<ce:inf loc=post>2</ce:inf> conversion",
    "authors": "; ; ",
    "journal": "Journal of Catalysis",
    "date": "2019-02-28",
    "doi": "10.1016/j.jcat.2018.11.027",
    "abstract": "",
    "uri": "https://api.elsevier.com/content/article/pii/S0021951718304688",
    "pii": "S0021951718304688"
  },
  "fulltext": {
    "full-text-retrieval-response": {
      "scopus-eid": "2-s2.0-85058947353",
      "originalText": "serial JL 272561 291210 291744 291809 31 Journal of Catalysis JOURNALCATALYSIS 2018-12-20 2018-12-20 2018-12-20 2018-12-20 2021-01-18T04:42:44 1-s2.0-S0021951718304688 S0021-9517(18)30468-8 S0021951718304688 10.1016/j.jcat.2018.11.027 S300 S300.3 FULL-TEXT 1-s2.0-S0021951718X0013X 2021-01-18T05:05:04.192207Z 0 0 20190201 20190228 2019 2018-12-20T22:44:50.421663Z absattachment articleinfo articletitlenorm authfirstinitialnorm authfirstsurnamenorm cid cids contenttype copyright crossmark dateloaded dateloadedtxt datesearch datesort dateupdated dco docsubtype doctype doi eid ewtransactionid hubeid indexeddate issn issnnorm itemstage itemtransactionid itemweight openaccess openarchive pg pgfirst pglast pii piinorm pubdateend pubdatestart pubdatetxt pubyr sectiontitle sortorder srctitle srctitlenorm srctype ssids alllist content subj subheadings suppl tomb volfirst volissue volumelist webpdf webpdfpagecount yearnav figure table body acknowledge affil articletitle auth authfirstini authfull authkeywords authlast grantnumber grantsponsor grantsponsorid highlightsabst orcid primabst ref specialabst 0021-9517 00219517 true 370 370 C Volume 370 6 38 45 38 45 201902 February 2019 2019-02-01 2019-02-28 2019 Regular Articles article fla © 2018 Elsevier Inc. All rights reserved. ROBUSTEFFICIENTCATALYSTDERIVEDBIMETALLICZNCOZEOLITICIMIDAZOLATEFRAMEWORKSFORCO2CONVERSION CHAEMCHUEN S 1 Introduction 2 Experimental 3 Results and discussion 3.1 Catalytic activity 3.2 Material characterization 4 Conclusion Acknowledgements References BUTTNER 2017 50 H LANG 2015 681 694 X MIKKELSEN 2010 43 81 M COMERFORD 2015 1966 1987 J MAINA 2017 345 361 J KATHALIKKATTIL 2015 223 235 A ZOU 2016 2334 2343 R ZHU 2013 36 40 M THARUN 2016 2479 2487 J ZHOU 2017 952 957 K KAUR 2016 14932 14938 G RUBIOMARTINEZ 2017 3453 3480 M CARNESANCHEZ 2013 203 211 A GHOLAMPOUR 2017 702 709 N CHAEMCHUEN 2017 84 91 S OARARTETA 2017 1709 1745 L WANG 2018 1705048 T LIU 2008 5390 5391 B TANG 2016 2796 2804 J ENTERRIA 2016 79 102 M ZHOU 2017 K DING 2017 6113 6121 M BAI 2016 1061 1069 C KURUPPATHPARAMBIL 2016 6349 6356 R MOUSAVI 2016 5170 5176 B BANKS 2006 2533 2537 C MOUSAVI 2017 B CHEN 2015 5010 5016 Y TORAD 2014 2096 2107 N TANG 2016 30295 J XIA 2016 15006 B CHAIKITTISILP 2013 14 19 W BO 2011 8360 8365 X LV 2013 13093 13100 G JAOUEN 2009 1623 1639 F MIRALDA 2012 180 183 C ZALOMAEVA 2013 179 185 O CHAEMCHUENX2019X38 CHAEMCHUENX2019X38X45 CHAEMCHUENX2019X38XS CHAEMCHUENX2019X38X45XS 2020-12-20T00:00:00.000Z 2020-12-20T00:00:00.000Z http://creativecommons.org/licenses/by-nc-nd/4.0/ © 2018 Elsevier Inc. All rights reserved. 2020-03-08T17:23:03.902Z http://vtw.elsevier.com/data/voc/AddOnTypes/50.7/nlp S0021951718304688 Tomsk Polytechnic University VIU-195/2018 TPU Tomsk Polytechnic University http://data.elsevier.com/vocabulary/SciValFunders/100012934 http://sws.geonames.org/2017370/ Russian Foundation for Basic Research 18-29-04047 RFBR Russian Foundation for Basic Research http://data.elsevier.com/vocabulary/SciValFunders/501100002261 http://sws.geonames.org/2017370/ Wuhan University of technology WUT Wuhan University of Technology http://data.elsevier.com/vocabulary/SciValFunders/501100007724 http://sws.geonames.org/1814991/ National Natural Science Foundation of China 21502146 21850410449 NSFC National Natural Science Foundation of China http://data.elsevier.com/vocabulary/SciValFunders/501100001809 http://sws.geonames.org/1814991/ The authors are grateful to the State Key Lab of Advanced Technology for Materials Synthesis and Processing for financial support (Wuhan University of technology). S.C. acknowledges the support of the National Natural Science Foundation of China (Nos. 21502146 , 21850410449 ). F.V. acknowledges the support from the Russian Foundation for Basic Research (No. 18-29-04047 ) and Tomsk Polytechnic University Competitiveness Enhancement Program grant ( VIU-195/2018 ). item S0021-9517(18)30468-8 S0021951718304688 1-s2.0-S0021951718304688 10.1016/j.jcat.2018.11.027 272561 2021-01-18T05:05:04.192207Z 2019-02-01 2019-02-28 1-s2.0-S0021951718304688-main.pdf https://s3-eu-west-1.amazonaws.com/prod-ucs-content-store-eu-west/content/pii:S0021951718304688/MAIN/application/pdf/8277c34c32e8dee1a2dceebfb1a0baef/main.pdf main.pdf pdf true 1618918 MAIN 8 1-s2.0-S0021951718304688-main_1.png https://s3-eu-west-1.amazonaws.com/prod-ucs-content-store-eu-west/content/pii:S0021951718304688/PREVIEW/image/png/1fe03509f32ef109348a434e9df1cccb/main_1.png main_1.png png 58090 849 656 IMAGE-WEB-PDF 1 1-s2.0-S0021951718304688-fx1.jpg https://s3-eu-west-1.amazonaws.com/prod-ucs-content-store-eu-west/content/pii:S0021951718304688/fx1/DOWNSAMPLED/image/jpeg/fa28376d3d49db65692c61a0b5ee3724/fx1.jpg fx1 fx1.jpg jpg 1401 53 90 IMAGE-DOWNSAMPLED 1-s2.0-S0021951718304688-fx2.jpg https://s3-eu-west-1.amazonaws.com/prod-ucs-content-store-eu-west/content/pii:S0021951718304688/fx2/DOWNSAMPLED/image/jpeg/8f1edc0483aa7388c14950f15b8d58c1/fx2.jpg fx2 fx2.jpg jpg 2377 56 161 IMAGE-DOWNSAMPLED 1-s2.0-S0021951718304688-fx3.jpg https://s3-eu-west-1.amazonaws.com/prod-ucs-content-store-eu-west/content/pii:S0021951718304688/fx3/DOWNSAMPLED/image/jpeg/8b19e678860d7feca7d01ab9d1a6560c/fx3.jpg fx3 fx3.jpg jpg 1467 54 84 IMAGE-DOWNSAMPLED 1-s2.0-S0021951718304688-fx4.jpg https://s3-eu-west-1.amazonaws.com/prod-ucs-content-store-eu-west/content/pii:S0021951718304688/fx4/DOWNSAMPLED/image/jpeg/44e7c3efe73ac80c58b77c3b343990eb/fx4.jpg fx4 fx4.jpg jpg 2375 62 134 IMAGE-DOWNSAMPLED 1-s2.0-S0021951718304688-fx5.jpg https://s3-eu-west-1.amazonaws.com/prod-ucs-content-store-eu-west/content/pii:S0021951718304688/fx5/DOWNSAMPLED/image/jpeg/ac91647d4940c3285eb9599165db5ced/fx5.jpg fx5 fx5.jpg jpg 2371 68 118 IMAGE-DOWNSAMPLED 1-s2.0-S0021951718304688-fx6.jpg https://s3-eu-west-1.amazonaws.com/prod-ucs-content-store-eu-west/content/pii:S0021951718304688/fx6/DOWNSAMPLED/image/jpeg/b9d6067e7c3fee51afd1676eac1514fc/fx6.jpg fx6 fx6.jpg jpg 2799 88 138 IMAGE-DOWNSAMPLED 1-s2.0-S0021951718304688-fx7.jpg https://s3-eu-west-1.amazonaws.com/prod-ucs-content-store-eu-west/content/pii:S0021951718304688/fx7/DOWNSAMPLED/image/jpeg/1bedae2f46975a2f963a8c55092c0234/fx7.jpg fx7 fx7.jpg jpg 2218 81 121 IMAGE-DOWNSAMPLED 1-s2.0-S0021951718304688-fx8.jpg https://s3-eu-west-1.amazonaws.com/prod-ucs-content-store-eu-west/content/pii:S0021951718304688/fx8/DOWNSAMPLED/image/jpeg/f9cfbf2d767e1d12f2d4b11882318ed2/fx8.jpg fx8 fx8.jpg jpg 3235 76 168 IMAGE-DOWNSAMPLED 1-s2.0-S0021951718304688-ga1.jpg https://s3-eu-west-1.amazonaws.com/prod-ucs-content-store-eu-west/content/pii:S0021951718304688/ga1/DOWNSAMPLED/image/jpeg/a48ca733e283a511dddc01b847b64876/ga1.jpg ga1 true ga1.jpg jpg 17488 200 316 IMAGE-DOWNSAMPLED 1-s2.0-S0021951718304688-gr1.jpg https://s3-eu-west-1.amazonaws.com/prod-ucs-content-store-eu-west/content/pii:S0021951718304688/gr1/DOWNSAMPLED/image/jpeg/7b1d547ce55c74ef5638348db0072319/gr1.jpg gr1 gr1.jpg jpg 42173 233 711 IMAGE-DOWNSAMPLED 1-s2.0-S0021951718304688-gr2.jpg https://s3-eu-west-1.amazonaws.com/prod-ucs-content-store-eu-west/content/pii:S0021951718304688/gr2/DOWNSAMPLED/image/jpeg/229c327233438485374d1efb96c3f854/gr2.jpg gr2 gr2.jpg jpg 27407 213 364 IMAGE-DOWNSAMPLED 1-s2.0-S0021951718304688-gr3.jpg https://s3-eu-west-1.amazonaws.com/prod-ucs-content-store-eu-west/content/pii:S0021951718304688/gr3/DOWNSAMPLED/image/jpeg/c80cfc9da037382c6fb73d0e1e2b4f5b/gr3.jpg gr3 gr3.jpg jpg 28633 270 355 IMAGE-DOWNSAMPLED 1-s2.0-S0021951718304688-gr4.jpg https://s3-eu-west-1.amazonaws.com/prod-ucs-content-store-eu-west/content/pii:S0021951718304688/gr4/DOWNSAMPLED/image/jpeg/1c097135818990572afd4674747b9185/gr4.jpg gr4 gr4.jpg jpg 90324 488 579 IMAGE-DOWNSAMPLED 1-s2.0-S0021951718304688-gr5.jpg https://s3-eu-west-1.amazonaws.com/prod-ucs-content-store-eu-west/content/pii:S0021951718304688/gr5/DOWNSAMPLED/image/jpeg/aa0bb752cc9709d33d924744fd122c20/gr5.jpg gr5 gr5.jpg jpg 52995 391 556 IMAGE-DOWNSAMPLED 1-s2.0-S0021951718304688-gr6.jpg https://s3-eu-west-1.amazonaws.com/prod-ucs-content-store-eu-west/content/pii:S0021951718304688/gr6/DOWNSAMPLED/image/jpeg/81980fe563a5a6ea76eb3d926af310fb/gr6.jpg gr6 gr6.jpg jpg 43342 466 551 IMAGE-DOWNSAMPLED 1-s2.0-S0021951718304688-fx1.sml https://s3-eu-west-1.amazonaws.com/prod-ucs-content-store-eu-west/content/pii:S0021951718304688/fx1/THUMBNAIL/image/gif/74bc4465bd1d57ed505eaa2e52ce02dc/fx1.sml fx1 fx1.sml sml 3492 129 219 IMAGE-THUMBNAIL 1-s2.0-S0021951718304688-fx2.sml https://s3-eu-west-1.amazonaws.com/prod-ucs-content-store-eu-west/content/pii:S0021951718304688/fx2/THUMBNAIL/image/gif/2d3618396d5a215cb53555fb81c822e5/fx2.sml fx2 fx2.sml sml 2962 76 219 IMAGE-THUMBNAIL 1-s2.0-S0021951718304688-fx3.sml https://s3-eu-west-1.amazonaws.com/prod-ucs-content-store-eu-west/content/pii:S0021951718304688/fx3/THUMBNAIL/image/gif/5850336b24cfd7ff2347e5d1ae33f99f/fx3.sml fx3 fx3.sml sml 3967 142 219 IMAGE-THUMBNAIL 1-s2.0-S0021951718304688-fx4.sml https://s3-eu-west-1.amazonaws.com/prod-ucs-content-store-eu-west/content/pii:S0021951718304688/fx4/THUMBNAIL/image/gif/cc1e8ed525687e5a8a44b7af75f7eead/fx4.sml fx4 fx4.sml sml 3346 101 219 IMAGE-THUMBNAIL 1-s2.0-S0021951718304688-fx5.sml https://s3-eu-west-1.amazonaws.com/prod-ucs-content-store-eu-west/content/pii:S0021951718304688/fx5/THUMBNAIL/image/gif/8c38c38f196b27c47b4fec76ab15aa70/fx5.sml fx5 fx5.sml sml 4123 126 219 IMAGE-THUMBNAIL 1-s2.0-S0021951718304688-fx6.sml https://s3-eu-west-1.amazonaws.com/prod-ucs-content-store-eu-west/content/pii:S0021951718304688/fx6/THUMBNAIL/image/gif/a09d646515837491264c4bf0fdfc27e5/fx6.sml fx6 fx6.sml sml 4063 140 219 IMAGE-THUMBNAIL 1-s2.0-S0021951718304688-fx7.sml https://s3-eu-west-1.amazonaws.com/prod-ucs-content-store-eu-west/content/pii:S0021951718304688/fx7/THUMBNAIL/image/gif/b227ae82db353807103014492b071d5f/fx7.sml fx7 fx7.sml sml 3753 146 219 IMAGE-THUMBNAIL 1-s2.0-S0021951718304688-fx8.sml https://s3-eu-west-1.amazonaws.com/prod-ucs-content-store-eu-west/content/pii:S0021951718304688/fx8/THUMBNAIL/image/gif/580fba591955d4c4624e7ec82ebbc474/fx8.sml fx8 fx8.sml sml 3468 99 219 IMAGE-THUMBNAIL 1-s2.0-S0021951718304688-ga1.sml https://s3-eu-west-1.amazonaws.com/prod-ucs-content-store-eu-west/content/pii:S0021951718304688/ga1/THUMBNAIL/image/gif/35979269033cd8d2cf482c660ecad44f/ga1.sml ga1 true ga1.sml sml 9172 139 219 IMAGE-THUMBNAIL 1-s2.0-S0021951718304688-gr1.sml https://s3-eu-west-1.amazonaws.com/prod-ucs-content-store-eu-west/content/pii:S0021951718304688/gr1/THUMBNAIL/image/gif/76644564da05173e87e853e7eaf1bbe3/gr1.sml gr1 gr1.sml sml 8182 72 219 IMAGE-THUMBNAIL 1-s2.0-S0021951718304688-gr2.sml https://s3-eu-west-1.amazonaws.com/prod-ucs-content-store-eu-west/content/pii:S0021951718304688/gr2/THUMBNAIL/image/gif/70ac04b1dae31702baf8aca571420e3d/gr2.sml gr2 gr2.sml sml 11077 128 219 IMAGE-THUMBNAIL 1-s2.0-S0021951718304688-gr3.sml https://s3-eu-west-1.amazonaws.com/prod-ucs-content-store-eu-west/content/pii:S0021951718304688/gr3/THUMBNAIL/image/gif/62532f4026b2c6907e9c25764ce5a341/gr3.sml gr3 gr3.sml sml 9655 164 215 IMAGE-THUMBNAIL 1-s2.0-S0021951718304688-gr4.sml https://s3-eu-west-1.amazonaws.com/prod-ucs-content-store-eu-west/content/pii:S0021951718304688/gr4/THUMBNAIL/image/gif/1eb6373ed3f76fdf78d8bd4defb944e4/gr4.sml gr4 gr4.sml sml 22864 164 194 IMAGE-THUMBNAIL 1-s2.0-S0021951718304688-gr5.sml https://s3-eu-west-1.amazonaws.com/prod-ucs-content-store-eu-west/content/pii:S0021951718304688/gr5/THUMBNAIL/image/gif/11dffe1940b978f9c3586eeb3e2fa9fa/gr5.sml gr5 gr5.sml sml 13084 154 219 IMAGE-THUMBNAIL 1-s2.0-S0021951718304688-gr6.sml https://s3-eu-west-1.amazonaws.com/prod-ucs-content-store-eu-west/content/pii:S0021951718304688/gr6/THUMBNAIL/image/gif/f677e30217eeec671a1991a61be2c93a/gr6.sml gr6 gr6.sml sml 8832 164 194 IMAGE-THUMBNAIL 1-s2.0-S0021951718304688-fx1_lrg.jpg https://s3-eu-west-1.amazonaws.com/prod-ucs-content-store-eu-west/content/pii:S0021951718304688/fx1/HIGHRES/image/jpeg/d1897fc4ff16d4ddf7d8007eecfe418c/fx1_lrg.jpg fx1 fx1_lrg.jpg jpg 7830 236 401 IMAGE-HIGH-RES 1-s2.0-S0021951718304688-fx2_lrg.jpg https://s3-eu-west-1.amazonaws.com/prod-ucs-content-store-eu-west/content/pii:S0021951718304688/fx2/HIGHRES/image/jpeg/e15433bce89faad2edd655314155e29e/fx2_lrg.jpg fx2 fx2_lrg.jpg jpg 15850 247 714 IMAGE-HIGH-RES 1-s2.0-S0021951718304688-fx3_lrg.jpg https://s3-eu-west-1.amazonaws.com/prod-ucs-content-store-eu-west/content/pii:S0021951718304688/fx3/HIGHRES/image/jpeg/e17cb6a0f5787a68862052b25f4581f3/fx3_lrg.jpg fx3 fx3_lrg.jpg jpg 7967 243 376 IMAGE-HIGH-RES 1-s2.0-S0021951718304688-fx4_lrg.jpg https://s3-eu-west-1.amazonaws.com/prod-ucs-content-store-eu-west/content/pii:S0021951718304688/fx4/HIGHRES/image/jpeg/14ce4203a03b089f4143ba5076a3b881/fx4_lrg.jpg fx4 fx4_lrg.jpg jpg 14668 274 594 IMAGE-HIGH-RES 1-s2.0-S0021951718304688-fx5_lrg.jpg https://s3-eu-west-1.amazonaws.com/prod-ucs-content-store-eu-west/content/pii:S0021951718304688/fx5/HIGHRES/image/jpeg/17b50620593754913e466352a12efb59/fx5_lrg.jpg fx5 fx5_lrg.jpg jpg 15056 302 525 IMAGE-HIGH-RES 1-s2.0-S0021951718304688-fx6_lrg.jpg https://s3-eu-west-1.amazonaws.com/prod-ucs-content-store-eu-west/content/pii:S0021951718304688/fx6/HIGHRES/image/jpeg/ed8cc297683ebe1cbbd0ef6a58e607ef/fx6_lrg.jpg fx6 fx6_lrg.jpg jpg 19512 392 613 IMAGE-HIGH-RES 1-s2.0-S0021951718304688-fx7_lrg.jpg https://s3-eu-west-1.amazonaws.com/prod-ucs-content-store-eu-west/content/pii:S0021951718304688/fx7/HIGHRES/image/jpeg/88226a77b97c476a2505cf46cb22de02/fx7_lrg.jpg fx7 fx7_lrg.jpg jpg 14728 360 539 IMAGE-HIGH-RES 1-s2.0-S0021951718304688-fx8_lrg.jpg https://s3-eu-west-1.amazonaws.com/prod-ucs-content-store-eu-west/content/pii:S0021951718304688/fx8/HIGHRES/image/jpeg/e05ecadeee01c1b24d551745ecc33fd2/fx8_lrg.jpg fx8 fx8_lrg.jpg jpg 21789 335 744 IMAGE-HIGH-RES 1-s2.0-S0021951718304688-ga1_lrg.jpg https://s3-eu-west-1.amazonaws.com/prod-ucs-content-store-eu-west/content/pii:S0021951718304688/ga1/HIGHRES/image/jpeg/9afee7044a5049a24567f7de8b3debfa/ga1_lrg.jpg ga1 true ga1_lrg.jpg jpg 48553 531 839 IMAGE-HIGH-RES 1-s2.0-S0021951718304688-gr1_lrg.jpg https://s3-eu-west-1.amazonaws.com/prod-ucs-content-store-eu-west/content/pii:S0021951718304688/gr1/HIGHRES/image/jpeg/485c4b9ac420fe0fa96e85446da66da9/gr1_lrg.jpg gr1 gr1_lrg.jpg jpg 241520 1033 3150 IMAGE-HIGH-RES 1-s2.0-S0021951718304688-gr2_lrg.jpg https://s3-eu-west-1.amazonaws.com/prod-ucs-content-store-eu-west/content/pii:S0021951718304688/gr2/HIGHRES/image/jpeg/9d38b2674b8a6cbf4f8adb1d3715341b/gr2_lrg.jpg gr2 gr2_lrg.jpg jpg 134406 943 1614 IMAGE-HIGH-RES 1-s2.0-S0021951718304688-gr3_lrg.jpg https://s3-eu-west-1.amazonaws.com/prod-ucs-content-store-eu-west/content/pii:S0021951718304688/gr3/HIGHRES/image/jpeg/bdc692454c24f898d4a512e8ee54fb8a/gr3_lrg.jpg gr3 gr3_lrg.jpg jpg 224957 1200 1575 IMAGE-HIGH-RES 1-s2.0-S0021951718304688-gr4_lrg.jpg https://s3-eu-west-1.amazonaws.com/prod-ucs-content-store-eu-west/content/pii:S0021951718304688/gr4/HIGHRES/image/jpeg/2ffd58fe222bec67d84dd6e387b5a111/gr4_lrg.jpg gr4 gr4_lrg.jpg jpg 762561 2163 2565 IMAGE-HIGH-RES 1-s2.0-S0021951718304688-gr5_lrg.jpg https://s3-eu-west-1.amazonaws.com/prod-ucs-content-store-eu-west/content/pii:S0021951718304688/gr5/HIGHRES/image/jpeg/7378e3fa36e12174bda75f9782e071f4/gr5_lrg.jpg gr5 gr5_lrg.jpg jpg 284911 1732 2461 IMAGE-HIGH-RES 1-s2.0-S0021951718304688-gr6_lrg.jpg https://s3-eu-west-1.amazonaws.com/prod-ucs-content-store-eu-west/content/pii:S0021951718304688/gr6/HIGHRES/image/jpeg/2abc23bbf64d5c668909cbf4ae466422/gr6_lrg.jpg gr6 gr6_lrg.jpg jpg 241326 2064 2441 IMAGE-HIGH-RES 1-s2.0-S0021951718304688-am.pdf https://s3-eu-west-1.amazonaws.com/prod-ucs-content-store-eu-west/content/egi:10VJQ372856/MAIN/application/pdf/69c2156b4b893ece11fa162628662f00/am.pdf https://s3.amazonaws.com/prod-ucs-content-store-us-east/content/egi:10VJQ372856/MAIN/application/pdf/69c2156b4b893ece11fa162628662f00/am.pdf am am.pdf pdf false 1064243 AAM-PDF YJCAT 13034 S0021-9517(18)30468-8 10.1016/j.jcat.2018.11.027 Elsevier Inc. Fig. 1 Catalyst performance applying different conditions: (a) Different pyrolysis conditions of Zn/Co-ZIF, reaction conditions: 850 mg epichlorohydrin, 50 mg of catalysts, 140 °C, CO2 pressure 8 bars, 8 h. (b) Optimization of CO2 pressure and temperature using 35 mg Zn/Co-ZIF-H2/Ar-1000, and 850 mg of epichlorohydrin. Fig. 2 Catalyst recycling experiment: catalyst loading (left axis) and catalytic activity (right axis). Reaction conditions: 50 mg of Zn/Co-ZIF-H2Ar-1000 (5.88 %wt catalyst based on epichlorohydrin), 140 °C, 8 bars, 8 h, product analysis by 1H NMR. Fig. 3 XRD patterns of pyrolyzed Zn/Co-ZIF at various temperatures. Fig. 4 SEM analysis of fresh Zn/Co-ZIF (a) and pyrolyzed Zn/Co-ZIF-H2/Ar-1000 (b); TEM analysis of Zn/Co-ZIF-H2/Ar-1000 containing Co-particles and its diffraction pattern obtained in the insert picture (c), the carbon-wall matrix surrounding the metallic Co particles (d). Fig. 5 XPS characterization of the N and Co region of Zn/Co-ZIF-H2/Ar: N 1 s (a) and Co 2p3/2 (b) spectra for Zn/Co-ZIF-H2/Ar at 600 °C (bottom), 800 °C (middle), 1000 °C (top). Fig. 6 Mechanism for the CO2 addition to epoxide generating cyclic carbonates using Zn/Co-ZIF-H2/Ar-1000. Table 1 Various cyclic carbonates synthesized by using Zn/Co-ZIF-H2Ar-1000 as catalyst. Entry Epoxide Product Reaction time (h) Yield (%)* 1 8 93 2 8 70 3 14 72 4 15 74 * All the products obtained with 100% of selectivity. Table 2 Porosity and gas adsorption properties of the pyrolized materials. Samples Surface area (m2/g) Porosity CO2 adsorption @ 0 °C BET Langmuir External Pv (cm3/g) Ps(nm) Zn/Co-ZIF 1746 1804 85 0.6158 1.27 34.33 Zn/Co-ZIF-Ar-600 407 429 128 0.1621 0.94 62.33 Zn/Co-ZIF-Ar-800 689 719 241 0.2752 1.15 113.78 Zn/Co-ZIF-Ar-1000 599 618 295 0.2438 1.19 80.47 Zn/Co-ZIF-H2/Ar-600 346 373 114 0.1378 1.01 48.11 Zn/Co-ZIF-H2/Ar-800 725 786 318 0.2935 1.20 61.67 Zn/Co-ZIF-H2/Ar-1000 694 751 329 0.2841 1.22 48.79 Zn/Co-ZIF-Air-600 8 9 11 0.0038 1.86 2.78 Zn/Co-ZIF-Air-400 25 27 23 0.0108 1.85 5.24 Zn/Co-ZIF-Air-300 1019 1073 95 0.4042 1.26 30.09 Pore volume (Pv) and Pore size (Ps) were determined from H-K method. Robust and efficient catalyst derived from bimetallic Zn/Co zeolitic imidazolate frameworks for CO2 conversion Somboon Chaemchuen a b Xuan Xiao a c Marzieh Ghadamyari a c Bibimaryam Mousavi a Nikom Klomkliang d Ye Yuan a ⁎ Francis Verpoort a b c e ⁎ a Laboratory of Organometallics, Catalysis and Ordered Materials, State Key Laboratory of Advanced Technology for Materials Synthesis and Processing, Wuhan University of Technology, Wuhan, China Laboratory of Organometallics, Catalysis and Ordered Materials State Key Laboratory of Advanced Technology for Materials Synthesis and Processing Wuhan University of Technology Wuhan China b National Research Tomsk Polytechnic University, Lenin Avenue 30, 634050 Tomsk, Russian Federation National Research Tomsk Polytechnic University Lenin Avenue 30 634050 Tomsk Russian Federation c School of Materials Science and Engineering, Wuhan University of Technology, Wuhan 430070, China School of Materials Science and Engineering Wuhan University of Technology Wuhan 430070 China d School of Chemical Engineering, Suranaree University of Technology, Nakhon Ratchasima 30000, Thailand School of Chemical Engineering Suranaree University of Technology Nakhon Ratchasima 30000 Thailand e College of Arts and Sciences, Khalifa University of Science and Technology, PO Box 127788, Abu Dhabi, United Arab Emirates College of Arts and Sciences Khalifa University of Science and Technology PO Box 127788 Abu Dhabi United Arab Emirates ⁎ Corresponding authors at: Laboratory of Organometallics, Catalysis and Ordered Materials, State Key Laboratory of Advanced Technology for Materials Synthesis and Processing, Wuhan University of Technology, Wuhan, China (F. Verpoort). Laboratory of Organometallics, Catalysis and Ordered Materials State Key Laboratory of Advanced Technology for Materials Synthesis and Processing Wuhan University of Technology Wuhan China Graphical abstract A robust catalyst generated from the pyrolysis of bimetallic Zn/Co-ZIF comprising magnetic properties demonstrated to be an effective heterogeneous catalyst system for CO2 conversion reaction without the need of co-catalyst and solvent. Controllable pyrolysis under various conditions resulted in a unique active structure composed of metallic particles stabilized in a nitrogen-doped carbon matrix. The metallic particles acting as acid sites are dispersed in a nitrogen-doped porous carbon-wall which provides the basic sites. These sites are created during the pyrolysis process of Zn/Co-ZIF used as a special template under a controlled atmosphere. The resulting material possessing both, acid and basic sites, showed an excellent catalytic performance for the cycloaddition of CO2 into epoxides as these sites correspond to the active sites in the catalytic cycle. Additional, the pyrolysis conditions indicated to play an important role in the properties of the resulting materials and in parallel with the catalytic performance. The catalytic material proved to be very robust and maintained high activities for at least eleven cycles using the optimized reaction condition. Moreover, the magnetic property of the resulting catalyst is advantageous especially for the separation from the reaction mixture. Keywords Bi-metallic ZIF Pyrolysis CO2 conversion Heterogeneous catalysis Cyclic carbonates 1 Introduction Utilization of carbon dioxide (CO2) as a carbon source has received extensive attention in research societies aiming to reduce CO2 emission which is the main cause of global warming [1,2]. Among the CO2 utilization reactions, the CO2 chemical fixation, producing carbonates is an economical attractive reaction pathway and remediates the environment of CO2 emission. Numerous cyclic carbonates are widely applied as electrolytes in Li-ion batteries, aprotic solvents for cosmetics, and intermediates in pharmaceutical and polymer synthesis, etc. [3,4]. Furthermore, several reports describe MOFs as efficient heterogeneous catalysts converting CO2 to value-added chemicals in absence of solvent and co-catalyst [5,6]. Tailoring the MOF structures via metals ions/clusters and specifically designed organic linkers provides advanced properties such as high CO2 uptake, permanent porosity, and active catalytic sites, etc. [7]. The Zn-based ZIFs (ZIF-8, ZIF-90, ZIF-68, etc.) were among the first MOFs to be applied as a catalyst for the conversion of CO2 with an epoxide to produce cyclic carbonates. However, these systems suffered from low selectivity and reusability [8,9]. Later on, Co-based MOFs were found to be active for this reaction as well, however, they exhibited lower conversion rates than their Zn-based MOF analogous. Recently, a bimetallic Zn/Co-ZIF was developed via a simple synthesis method to synthesize a bimetallic MOF with Zn and Co as metal centers which showed enhanced gas adsorption properties [10,11]. Moreover, from all reported catalytic MOF materials, the bimetallic Zn/Co-ZIF exhibited a high catalytic conversion of epoxide to carbonates using CO2 as a C1 source with excellent selectivity and performance [10]. Nevertheless, MOFs applied as heterogeneous catalysts possess a relatively low chemical/thermal stability and combined with their small particle size, these drawbacks have to be considered for large-scale or industrial applications. Moreover, small particle-sized catalysts may require complicated purification procedures for the separation from the reaction mixture. Therefore, the exploration of new pathways making the catalytic material stable and comprising magnetic properties could be an attractive route to develop a catalyst for e.g. the CO2 addition reaction. The ability to manufacture MOFs/ZIFs on large scale with high purity at a low price is still challenging and prevent the transfer of these materials into implementation [12]. The commercial application requires a strong imperative to develop and produce efficiently with versatile means MOFs at large scale. In this sense, we recently reported that the spray drying method could be used to synthesize ZIFs having a uniform structure and unique properties [13–15]. Especially, using the spray-drying synthesis method MOFs with remarkably attractive properties for catalytic application were generated [15]. Recently, metallic particles dispersed in a carbon matrix synthesized via carbonization/pyrolysis of metal-organic frameworks (MOFs) has been intensively investigated. These techniques use MOFs as a template and proceed under a certain atmosphere and high temperature to obtain the desired material. The framework of the MOF collapses at these conditions, due to the decomposition of the organic linker which is partially or completely pyrolyzed (converted into a carbon matrix). Additionally, the metal ions/clusters become mobile within the matrix and metal species are created or the metal even evaporates [16]. The various applied conditions result in different types of materials with diverse properties. These materials attracted numerous attentions for several applications, especially for high-performance electronic devices such as batteries, capacitors, etc. [17,18] due to their structure made of a carbon matrix and metal species deriving from MOFs applied as a template. Excellent electronic connections between the metallic/metal oxide and carbon matrix were provided [19]. While catalytic reactions, as a heterogeneous application of metals doped in a carbon matrix, are still explored rarely. A hierarchical carbon matrix is usually generated during the pyrolysis of the original MOF material by volatilization at high temperature, together with highly dispersed metal nanoparticles encapsulated within the porous carbon matrix. Nonetheless, the main hurdle in the development of these materials is tailoring the porosity and morphology of carbonaceous nanostructures when a metal phase remains in the resulting carbon material [20]. In this study, we investigated metal nanoparticles encapsulated in a nitrogen-doped porous carbon material deriving from the pyrolysis of bimetallic MOFs (Zn/Co-ZIF) used as a template under various controllable pyrolysis conditions. The bimetallic MOF, Zn/Co-ZIF, was selected for this investigation since the Zn/Co-ZIF itself (not-pyrolyzed) demonstrated a better CO2 fixation performance compared with the single-metal ZIFs (ZIF-8, ZIF-67) as reported before by our group [15]. The synthesis of the bimetallic MOF was done using a spray drying procedure. The spray drying technique was applied to provide a synthesis method suitable for making materials for large-scale productions. The final metal nanoparticles encapsulated in a nitrogen-doped porous carbon material was applied as a heterogeneous catalyst for the cycloaddition of CO2 into epoxide producing carbonate compounds without co-catalyst, and solvent-free. Furthermore, taking advantage of the magnetic properties of carbon material, separation of the catalyst from the reaction mixture is straightforward and beneficial for the recycling of the catalyst. 2 Experimental All reagents were purchased from Aladdin chemical and used as received without any further purification. The template material (Zn/Co-ZIF) was synthesized using spray dry equipment (AF−88 laboratory spray dryer, AFIND Scientific Instrument CO. Ltd.). Two solutions of Zn(OAc)2⋅2H2O (3 mmol), Co(OAc)2⋅4H2O (3 mmol) in water (25 mL) and 2-methylimidazole (0.66 g, 8 mmol) in water (25 mL) were mixed as a feed solution. The obtained suspension was then used as the feed for the spray dryer having an 8 mm diameter spray nozzle, at a feed rate of 400 mL/h, with a flow rate of 160 m3/h and an inlet temperature of 180 °C. The powder product was collected and immersed in methanol for a certain time for the re-crystallization process. Finally, the suspension was separated, washed with methanol and dried at room temperature under vacuum for 12 h. Thereafter, the temperature was raised to 120 °C for 3 h under vacuum. The dried material was heated (pyrolyzed) to the required temperature with a ramp rate of 10 °C/min applying different gas atmospheres (flow rate 50 cc/min) for 4 h. Thereafter, the material was transferred to a desiccator to cool down to room temperature. The material was kept in the desiccator and was used for further analysis and utilization. The catalytic reactions were performed as previously reported with only a minor modification; 9 mmol of epoxide (substrate) and 50 mg of pyrolyzed Zn/Co-ZIFs were charged in a 10 mL stainless steel high-pressure reactor (XINGDA company, Beijing, China) [21]. The catalyst was dispersed on the bottom of the reactor. No magnetic stir bar was added to prevent the accumulation of catalyst on the magnetic stir bar since the catalyst is magnetic. The substrate (epoxide) was added before purging the system with CO2 gas for a few minutes. Subsequently, the reaction mixture was pressurized with CO2 (99.9%) and kept at the required pressure using a pressure regulator. After the required reaction time at the required conditions, the reactor was cooled down to room temperature followed by venting the excess of gas. The final product was analyzed by 1H NMR. The catalyst was magnetically separated from the reaction mixture and washed several times with methanol followed by drying under vacuum at 80 °C for 6 h before the next use (details are available in the ESI). 3 Results and discussion 3.1 Catalytic activity Among the MOFs, the zeolitic imidazolate frameworks (ZIFs) have been mostly used as precursors or MOF template to develop porous carbon material. Recently, bimetallic metal-organic frameworks (BMOFs) have been developed as precursor possessing two types of integrated metal ions with properties depending on the ratio of the metal ions [22,23]. The characteristic properties of the spray dried Zn/Co-ZIF material indicated a successful formation of a homogeneous structure similar to previous reports [10,24]. The Zn/Co-ZIF structure is isoreticular possessing unit cell parameters similar to ZIF-8 and ZIF-67 as determined by powder-XRD (Fig. 1, in Data in Brief). Properties such as the morphology (SEM), surface area and porosity (N2 adsorption at 77 K), the chemical coordination (FT-IR), the thermal stability (TGA), etc. were determined (Figs. 1–5, in Data in Brief). After verifying the Zn/Co-ZIF structure, the material was pyrolyzed applying various atmospheres and temperatures (denoted as Zn/Co-ZIF-X-Y wherein X = Ar, H2/Ar or Air, and Y = pyrolysis temperature in °C). For Zn/Co-ZIF, pyrolysis at a temperature higher than 600 °C a black colored material encapsulating metallic nanoparticles was obtained. The CO2 fixation with an epoxide to produce cyclic carbonate was selected as a green atom efficient reaction, besides, Zn/Co-ZIF was reported to demonstrate the best catalytic performance among all MOFs families for this fixation reaction [10,25]. Additionally, the spray-dry method, a fast synthesis and convenient method to produce Zn/Co-ZIF, was explored over other synthesis routes [10]. Epichlorohydrin as substrate was used to optimize the reaction conditions and investigate the influence of pyrolysis conditions of Zn/Co-ZIF. The catalytic performance of the different Zn/Co-ZIF-X-Y materials was analyzed via 1H NMR (calculation details are available in supporting information). To have a reference, the initial Zn/Co-ZIF (non-pyrolyzed) was firstly examined for the chemical fixation of CO2 (Table 1, in Data in Brief, entry 3–5). The product yield can raise up > 99% by increasing the reaction temperature (Table 1, in Data in Brief, entry 5), while the selectivity still remains 100% for non-pyrolysis Zn/Co-ZIF prepared via the spray drying method. Pyrolyzed materials obtained via calcination in air (presence of oxygen; Zn/Co-ZIF-Air) exhibit a drop in the catalytic performance, which can be explained by the decomposition of the ZIF structure at higher calcination temperature (for more details see material characterizations and discussion). A contradictory behavior of the catalytic performance was observed after pyrolysis of Zn/Co-ZIF under inert gas (Ar) and even more improved under a reducing atmosphere (5% H2/Ar) as shown in Fig. 1 a. Thereafter, the optimum pyrolysis conditions were applied to prepare the catalytic material (Zn/Co-ZIF-H2Ar-1000). This material was then used to investigate the ideal reaction conditions such as catalyst loading, reaction temperature, and pressure, etc. Increasing the catalyst loading, while keeping other parameters constant, an improvement was observed and a 93% yield was obtained using 50 mg catalyst (Fig. 6, in Data in Brief). Next, the reaction time was investigated and an increased yield, up to 93% was demonstrated for a prolonged reaction time of 8 h (Table 1, in Data in Brief, entry 6–9). It is well known that the reaction temperature and pressure play crucial roles in the CO2 addition reaction. The catalytic performance improves with higher temperature, while the catalytic activity remains stable at a certain pressure (Fig. 1 b). Additionally, it has to be mentioned that an excellent selectivity (100%) was obtained using the pyrolyzed material (Zn/Co-ZIF- H2Ar-1000). To verify the unique catalytic properties of the material deriving from pyrolyzed Zn/Co-ZIF, a series of carbon materials and pyrolyzed metal-precursor (Co, Zn-acetate) were investigated, see Table 1, in Data in Brief, entry 7–15. It is clear that materials not deriving from pyrolyzed Zn/Co-ZIF exhibited a very low catalytic performance, although, some materials showed some activity compared to the blank test (no-catalyst) Table 1, in Data in Brief. Carbon nanotube as a catalyst revealed 20.8% yield, while carbon graphite only gives 10% yield. These results may suggest that the porosity of the carbon species plays a role in the catalytic performance. Moreover, incorporated metal impurities in the carbon species could provide some activity as well [26,27]. Surprisingly, pyrolyzed Co(OAc)2⋅4H2O using similar conditions as for Zn/Co-ZIF-H2/Ar-1000 was inactive. Zn species (zinc oxide and carbonate) including pyrolyzed Zn(OAc)2⋅2H2O were evaluated as well on their catalytic performance for the CO2 addition (Table 1, in Data in Brief, entry 13–15). The obtained results clearly indicate that the catalyst Zn/Co-ZIF-H2/Ar-1000 obtained from pyrolyzed Zn/Co-ZIF is of utmost importance to determine the catalytic performance for the CO2 fixation with an epoxide. Finally, treatment of Zn/Co-ZIF-H2/Ar-1000 with an acid to etch out unstable Co particles and/or CoO from the pyrolyzed product as previously reported for electrochemical catalysts was also investigated [28,29]. However, a reduced or no activity was obtained (Table 1, in Data in Brief, entry 16 and 17) suggesting an undesirable change of the metallic Co particles to un-active species during the etching process. The substrate scope was studied by using different epoxides in combination with the Zn/Co-ZIF-H2/Ar-1000 catalyst (Table 1 ). All the epoxides were converted into cyclic carbonates without the need for solvent and co-catalyst. Although, for epoxides different than epichlorohydrin the obtained yields were lower indicating that for each substrate the reaction conditions could be further optimized. Besides the metal nanoparticles present in the N-doped carbon matrix, another very attractive characteristic of Zn/Co-ZIF-H2/Ar-1000 catalyst is its magnetic property. Due to the presence of Co nanoparticles, this catalyst system could be easily separated from the reaction mixture and reused several times without any significant loss in catalytic efficiency. The recyclability of Zn/Co-ZIF-H2/Ar-1000 was investigated using epichlorohydrin under 8 bar of CO2 pressure and 140 °C for 8 h. Thanks to the magnetic characteristics of the catalyst the catalyst could easily be separated from the reaction mixture using a magnet. The spent catalyst was washed several times with methanol followed by drying at 80 °C under vacuum for 6 h. The catalyst could catalyze the reaction without any significant reduction in catalytic performance and material weight for at least 11 recycles times. The XRD characterization of the recycled catalyst revealed that the composition remains the same as the fresh catalyst (Fig. 12, in Data in Brief). These results demonstrate and confirm that the catalyst can be easily separated and reused. 3.2 Material characterization To find out more about the diverse catalytic behavior of the novel materials obtained via pyrolysis, XRD analyses were performed. Different crystal patterns of the pyrolyzed Zn/Co-ZIF were observed depending on the pyrolysis conditions (atmosphere and temperature) as displayed in Fig. 3 and Fig. 11, in Data in Brief. Generally, for Zn/Co-ZIF pyrolyzed under inert atmosphere, the organic linker (2-methylimidazole) is converted into carbon and nitrogen compounds while the metal ions (Zn and Co) are reduced to metallic Co and Zn covered with an N-doped carbon matrix [30]. When Zn/Co-ZIF is pyrolyzed in the presence of air then the MOF structure decomposes at a temperature higher then 400 °C and metal oxide is generated (Fig. 11a, in Data in Brief). These results are in excellent agreement with the reported thermal stability of Zn/Co-ZIF, the MOF structure was retained up to 400–500 °C under an inert atmosphere and lower in the presence of oxygen [10]. At higher calcination temperature (>400 °C) metal oxide with ashes are produced resulting in a loss of the catalytic performance for the fixation reaction since metal oxide is not the active catalyst as proven with results in Table 1, in Data in Brief, entry 12–14). While under an inert (Ar) and 5% H2/Ar atmosphere metallic and/or metal oxide crystals were produced as shown in Fig. 3. Furthermore, Zn and Co nanoparticles might remain in the N-doped carbon matrix until a certain pyrolysis temperature, though, at a high temperature (1000 °C) zinc is eliminated, as shown in Fig. 11b, and c, in Data in Brief. At a temperature of 1000 °C, the metallic zinc evaporates as the boiling point of metallic zinc is 908 °C and the lack of zinc was also confirmed with metal element analysis (ICP, Table 2, in Data in Brief) [18]. The temperature also affects the diffraction line at 44.2°, which is assigned to the Co metallic species with a face-centered cubic (fcc, Fm3m(2 2 5), a = 0.355 nm) structure (JCPDS no. 15–0806). The diffraction line becomes more and more intense with an increasing temperature, suggesting an elevation of the crystallinity degree of the metallic Co species in the N-doped carbon matrix. That the metallic Co species are enclosed in carbon layers was also confirmed via TEM analysis [22]. The XRD analysis revealed the importance of atmospheric conditions and temperature during the pyrolysis to provide metal nanoparticles in an N-doped carbon matrix. A reducing atmosphere could promote the metallic dispersion in an N-doped carbon matrix. Moreover, it was reported recently that using reducing conditions (H2/Ar) during pyrolysis, ZIF-67 particles played a critical role in the formation of N-doped carbon nanotube frameworks (NCNTFs) by favoring the formation of metallic Co nanoparticles and also catalyzing the growth of hierarchical shells of interconnected crystalline NCNTs [31]. Moreover, the resultant NCNTFs retained the size and morphology of the initial ZIF-67 particles while possessing hierarchical shells of interconnected crystalline NCNTs. Therefore, in this study, the morphologies of Zn/Co-ZIF-H2/Ar obtained at elevated temperature from 600° to 1000 °C were investigated using a scanning electron microscope (SEM). The pyrolyzed materials partially shrink and deform and smaller particle size in line with the pyrolysis temperature are observed (Fig. 13, in Data in Brief). Similar bumpy morphologies of materials pyrolyzed under Ar with shrinkage of particle size were reported [22]. Furthermore, the size and volume are smaller than their parent Zn/Co-ZIF and smaller than products obtained at higher pyrolysis temperature that suggested that shrinking of particles occurs during pyrolysis. The Co species agglomerate together forming metallic nanoparticles in an N-doped carbon matrix as confirmed by TEM and element mapping (EDS) measurements (Fig. 4 and Fig. 14, in Data in Brief). The Co nanoparticles size ranges from 5 nm up to 50 nm and is closely wrapped by several carbon layers and uniformly distributed in the porous carbon phase (Fig. 4c). The representative TEM image shows the Co particles enclosed in the microporous carbon layers (arrow pointing in Fig. 4d). The spatial distribution of carbon, nitrogen, and cobalt was detected by elemental mapping (Fig. 14, in Data in Brief). Especially, the spatial confinement of the element species is particularly important for suppressing the dissolution and aggregation of the metal nanoparticles, which is advantageous for maintaining a high stability under working conditions. The surface area and porosity analysis by N2 adsorption-desorption at −196 °C revealed an enormous reduction after pyrolysis (Table 2 and Fig. 15, in Data in Brief). These results correspond directly to the decomposition of the template framework of Zn/Co-ZIF. The obtained porous carbon material possesses pores spanning from the micro- to the macro range and are in good agreement with the previous observation of MOFs pyrolysis [32]. The isotherms show sharp uptakes at relatively low pressure (P/P0  < 0.05) which is typical for Type I isotherm of a microporous material. Furthermore, the presence of a hysteresis loop at high relative pressure (P/P0  > 0.9) is typical for a type IV isotherm and is most probably due to the removal of metal oxide/metal species from the template. This indicates that the pyrolyzed materials are totally microporous materials with some macropores probably due to particle aggregation (i.e. interparticle void) [33]. Obviously, careful investigation clarified that the lower surface area is caused by the loss of porosity (pore volume; Pv and/or pore size; Ps) as a consequence of the framework collapse and decomposition during the pyrolysis process. Especially, the enormous decrease in porosity down to non-porosity was obtained at a higher pyrolysis temperature in the presence of oxygen (Air). Interestingly, the results illustrate a small increase in surface area when pyrolyzed under Ar and H2/Ar at temperatures ranging from 600 °C to 800 °C which corresponds to a higher porosity (Pv and Ps). Additionally, according to the thermal stability of the metals, Zn metal can be partially eliminated at high temperatures which is in agreement with the intensity decline of the Zn XRD diffraction line. Unfortunately, the surface area of these pyrolyzed materials reduces slightly at the highest temperature (1000 °C) under Ar and H2/Ar atmosphere which is the result of the evaporation of Zn from the frameworks, as confirmed by the Zn element analysis (ICP) shown in Table 2, in Data in Brief. Surprisingly, the carbonaceous materials demonstrate clearly a higher adsorption of carbon dioxide (CO2) in comparison with the template material (Zn/Co-ZIF). Furthermore, these results provide the possibility to use these materials in more and different CO2 adsorption applications since the development of innovations for CO2 capture has been considered an urgent task on the way toward a sustainable low-carbon future. To gain further insight regarding the type of metal species and nitrogen species present in the Zn/Co-ZIF-H2/Ar materials, XPS characterization was performed (Zn/Co-ZIF-H2/Ar was selected due to its attractive catalytic performance). Three types of N were observed in the N 1s spectrum having electron binding energies of 398.8, 400.5, and 401.6 eV, which are attributed to pyridine-type, pyrrole-type, and ammonium-type nitrogen species, respectively (Fig. 5) [34]. The highest percentage of pyridinic nitrogen was obtained using the lowest pyrolysis temperature (Zn/Co-ZIF-H2/Ar-600). This amount reduced at a higher pyrolysis temperature, contrarily, pyrrole-type, and ammonium-type N-species increased at a higher temperature. Additionally, Jaouen et al. reported N-species at 399–400.5 eV (pyrrole) resulting from nitrogen bonded to metal [35], of which the amount increased at higher pyrolysis temperature and might play a role in the catalytic activity. Also, the elimination of the zinc metal at higher pyrolysis temperature could further promoted the pyrrole-type nitrogen in the pyrolyzed material. Moreover, these coordination interactions are advantageous in preventing aggregation of Co species in the course of the pyrolysis process, and it is in good agreement with the TEM observations (Fig. 4d). A different chemical Co environment was observed as well, depending on the pyrolysis temperature, see Fig. 5b. Co0 at 778.3 eV and CoII at 780.6 eV are both present in the sample obtained at 800 °C. Whereas, at a temperature of 1000 °C a higher contribution of divalent Co0 (778.3 eV) is observed. The observation suggests that there are interactions between the Co species with nitrogen or carbon matrix and probably is the key to facilitate the formation of uniformly dispersed Co particles. The above results demonstrate that the N-doping could promote the basic properties of the material and play an important role in the dispersion of Co species, which may lead to materials with excellent catalytic performances. Remarkably as well is that both the basicity and acidity play a crucial role in the catalytic performance of CO2 addition into epoxide generating cyclic carbonate similar as previously reported for this reaction [25,36,37]. Herein, the metal species (Co and/or Zn) present in the pyrolyzed materials was confirmed from characterizations such as XRD, XPS etc. The basicity present on pyrolyzed Zn/Co-ZIF materials was elucidated by CO2-TPD (Fig. 17, in Data in Brief) using a similar approach as reported recently for pyrolyzed ZIF-67 [23]. Furthermore, these analyses reveal that pyrolyzed MOFs with N-containing ligands such as ZIFs could enhance the basicity of the resulting materials. The N-species of uncoordinated metal sites (pyrrole-type) generated during the metal elimination in the pyrolysis process at high temperature promote the catalytic performance as a basic site. Moreover, the increased CO2 adsorption at 0 °C also confirmed the presence of a higher amount of basic sites in pyrolyzed materials. The acidity of the synthesized material was determined by ammonia temperature programmed desorption analysis (NH3-TPD) as displayed in Fig. 18, in Data in Brief. Strong interactions of acid sites were mainly observed at high desorption temperature (500–700 °C), while a small broad band within the temperature range of 200–350 °C was attributed to the weak adsorption of NH3 molecules. Additionally, Li et al. have reported that the uniform dispersion of Co species is promoted by the introduction of N-containing ligands using pyrolysis of the Co-MOF (Co9(btc)6(tpt)2(H2O)15). This uniform distribution plays a key role to obtain an excellent catalytic performance in the oxidation reaction of alcohols [23]. The above characterization results revealed that pyrolysis of Zn/Co-ZIF having N-containing linkers exhibits well-dispersed Co in an N-doped porous carbon matrix, which promotes the basic and acid properties of the material and hence, play a role in the catalytic performance. Consequently, the reaction mechanism for the CO2 cycloaddition using cobalt in an N-doped carbon matrix as a heterogeneous catalyst can be attributed to the presence of basic sites deriving from N-compounds (N-doped carbon matrix) activating the carbon-oxygen bond of CO2, while Lewis acid sites originating from Co species activate the ring opening of the epoxide (Fig. 6). Moreover, the existence of well-dispersed Co species surrounded by a protecting carbon-wall could favor the binding and activation of the epoxide (substrate). Hence, the basicity deriving from the N-compounds not only activates the carbon dioxide but also enhances its adsorption and thus promotes the catalytic reaction. Moreover, the carbon wall/layer surrounding the metallic particles could prevent aggregation and leaching of metal species during the catalytic reaction. The results reveal that the pyrolysis conditions play a key role in the material properties which are of crucial importance for the catalytic performance. The metal oxides in the ash content were obtained after pyrolysis under air (calcination in the presence of oxygen) demonstrated to be inactive due to the lack of acid/basic sites required for this catalytic reaction. Moreover, the disappearance of the carbon matrix and the large weight loss was observed after pyrolysis in the air as well. The metallic and/or metal oxide particles in the carbon matrix with doped N-species obtained after pyrolysis under inert atmosphere proofed to be catalytic active as a result of the presence of acid-sites (metal species) and basic-site (N-doped carbon species). The materials pyrolyzed under a reducing atmosphere (5% H2/Ar) exhibited the best catalytic performance compared to the samples obtained under a non-reducing atmosphere. Moreover, applying a higher pyrolysis temperature combined with a reducing atmosphere further enhanced the catalytic performance. The higher catalytic activity is related to the increasing number of pyrrole-type N-species (basic sites) obtained at high pyrolysis temperature resulting from the metal elimination (Zn) at this high temperature. The dispersed metallic particles (Co-particles) interacting with the carbon matrix (confirmed from XPS) promote the acid sites required for the catalytic reaction and prevent metal leaching from the carbon matrix. Therefore, dual catalytic active sites (acid/basic) were created in a unique structure of which the properties derived from a controlled pyrolysis process of a bi-metallic ZIF. 4 Conclusion A robust catalyst made of metal nanoparticles in an N-doped carbon matrix deriving from controllable pyrolysis of bimetallic Zn/Co-ZIF as a template was utilized as an efficient heterogeneous catalyst for the CO2 conversion reaction. The pyrolysis process of bimetallic Zn/Co-ZIF template attributed to the decomposition of the ZIF framework and vaporization of gaseous species during pyrolysis creating metallic nanoparticles in an N-doped carbon matrix. The temperature and atmosphere during the pyrolysis process were the main parameters affecting the creation of a unique structure and properties of the pyrolyzed material. The characterization of the catalyst pointed out that the Co species hybrid with N species in the composite carbon matrix wall improving the metal dispersion and catalytic properties. The dual sites, acids (Co) and basics (N-based) were generated and work parallel as active sites for the catalytic reaction. The advantage of a stable and recyclable heterogeneous catalyst was investigated and an excellent catalytic performance without the use of co-catalyst and solvent was obtained. Furthermore, the catalyst could be easily separated and recycled by using an external magnetic field. The present facile-to-prepare catalyst material might provide a simple, cost-effective, and environmentally friendly alternative for the catalyzed addition of CO2 to epoxides to produce cyclic carbonates. Acknowledgements The authors are grateful to the State Key Lab of Advanced Technology for Materials Synthesis and Processing for financial support (Wuhan University of technology). S.C. acknowledges the support of the National Natural Science Foundation of China (Nos. 21502146, 21850410449). F.V. acknowledges the support from the Russian Foundation for Basic Research (No. 18-29-04047) and Tomsk Polytechnic University Competitiveness Enhancement Program grant (VIU-195/2018). References [1] H. Büttner L. Longwitz J. Steinbauer C. Wulf T. Werner Recent developments in the synthesis of cyclic carbonates from epoxides and CO2 Top. Curr. Chem. 375 2017 50 [2] X.-D. Lang X.-F. Liu L.-N. He Sustainable solid catalysts for cyclic carbonate synthesis from CO2 and epoxide Curr. Org. Chem. 19 2015 681 694 [3] M. Mikkelsen M. Jorgensen F.C. Krebs The teraton challenge. A review of fixation and transformation of carbon dioxide Energy Environ. Sci. 3 2010 43 81 [4] J.W. Comerford I.D.V. Ingram M. North X. Wu Sustainable metal-based catalysts for the synthesis of cyclic carbonates containing five-membered rings Green Chem. 17 2015 1966 1987 [5] J.W. Maina C. Pozo-Gonzalo L. Kong J. Schutz M. Hill L.F. Dumee Metal organic framework based catalysts for CO2 conversion Mater. Horiz. 4 2017 345 361 [6] A.C. Kathalikkattil R. Babu J. Tharun R. Roshan D.-W. Park Advancements in the conversion of carbon dioxide to cyclic carbonates using metal organic frameworks as catalysts Catal. Surv. Asia 19 2015 223 235 [7] R. Zou P.-Z. Li Y.-F. Zeng J. Liu R. Zhao H. Duan Z. Luo J.-G. Wang R. Zou Y. Zhao Bimetallic metal-organic frameworks: probing the lewis acid site for CO2 conversion Small 12 2016 2334 2343 [8] M. Zhu D. Srinivas S. Bhogeswararao P. Ratnasamy M.A. Carreon Catalytic activity of ZIF-8 in the synthesis of styrene carbonate from CO2 and styrene oxide Catal. Commun. 32 2013 36 40 [9] J. Tharun K.-M. Bhin R. Roshan D.W. Kim A.C. Kathalikkattil R. Babu H.Y. Ahn Y.S. Won D.-W. Park Ionic liquid tethered post functionalized ZIF-90 framework for the cycloaddition of propylene oxide and CO2 Green Chem. 18 2016 2479 2487 [10] K. Zhou B. Mousavi Z. Luo S. Phatanasri S. Chaemchuen F. Verpoort Characterization and properties of Zn/Co zeolitic imidazolate frameworks vs. ZIF-8 and ZIF-67 J. Mater. Chem. A 5 2017 952 957 [11] G. Kaur R.K. Rai D. Tyagi X. Yao P.-Z. Li X.-C. Yang Y. Zhao Q. Xu S.K. Singh Room-temperature synthesis of bimetallic Co–Zn based zeolitic imidazolate frameworks in water for enhanced CO2 and H2 uptakes J. Mater. Chem. A 4 2016 14932 14938 [12] M. Rubio-Martinez C. Avci-Camur A.W. Thornton I. Imaz D. Maspoch M.R. Hill New synthetic routes towards MOF production at scale Chem. Soc. Rev. 46 2017 3453 3480 [13] A. Carné-Sánchez I. Imaz M. Cano-Sarabia D. Maspoch A spray-drying strategy for synthesis of nanoscale metal–organic frameworks and their assembly into hollow superstructures Nat. Chem. 5 2013 203 211 [14] N. Gholampour S. Chaemchuen Z.-Y. Hu B. Mousavi G. Van Tendeloo F. Verpoort Simultaneous creation of metal nanoparticles in metal organic frameworks via spray drying technique Chem. Eng. J. 322 2017 702 709 [15] S. Chaemchuen Z. Luo K. Zhou B. Mousavi S. Phatanasri M. Jaroniec F. Verpoort Defect formation in metal–organic frameworks initiated by the crystal growth-rate and effect on catalytic performance J. Catal. 354 2017 84 91 [16] L. Oar-Arteta T. Wezendonk X. Sun F. Kapteijn J. Gascon Metal organic frameworks as precursors for the manufacture of advanced catalytic materials Mater. Chem. Front. 1 2017 1709 1745 [17] T.-T. Wang Z.-K. Kou S. Mu J.-P. Liu D.-P. He I.S. Amiinu W. Meng K. Zhou Z.-X. Luo S. Chaemchuen F. Verpoort 2D dual-metal Zeolitic-Imidazolate-Framework-(ZIF)-derived bifunctional air electrodes with ultrahigh electrochemical properties for rechargeable zinc-air batteries Adv. Funct. Mater. 28 2018 1705048 [18] B. Liu H. Shioyama T. Akita Q. Xu Metal-organic framework as a template for porous carbon synthesis J. Am. Chem. Soc. 130 2008 5390 5391 [19] J. Tang S. Wu T. Wang H. Gong H. Zhang S.M. Alshehri T. Ahamad H. Zhou Y. Yamauchi Cage-type highly graphitic porous carbon–Co3O4 polyhedron as the cathode of lithium-oxygen batteries ACS Appl. Mater. Interfaces 8 2016 2796 2804 [20] M. Enterría J.L. Figueiredo Nanostructured mesoporous carbons: tuning texture and surface chemistry Carbon 108 2016 79 102 [21] K. Zhou B. Mousavi Z. Luo S. Phatanasri S. Chaemchuen F. Verpoort Characterization and properties of Zn/Co zeolitic imidazolate frameworks vs. ZIF-8 and ZIF-67 J. Mater. Chem. A 2017 [22] M. Ding W. Shi L. Guo Z.Y. Leong A. Baji H.Y. Yang Bimetallic metal-organic framework derived porous carbon nanostructures for high performance membrane capacitive desalination J. Mater. Chem. A 5 2017 6113 6121 [23] C. Bai A. Li X. Yao H. Liu Y. Li Efficient and selective aerobic oxidation of alcohols catalysed by MOF-derived Co catalysts Green Chem. 18 2016 1061 1069 [24] R.R. Kuruppathparambil R. Babu H.M. Jeong G.-Y. Hwang G.S. Jeong M.-I. Kim D.-W. Kim D.-W. Park A solid solution zeolitic imidazolate framework as a room temperature efficient catalyst for the chemical fixation of CO2 Green Chem. 18 2016 6349 6356 [25] B. Mousavi S. Chaemchuen B. Moosavi Z. Luo N. Gholampour F. Verpoort Zeolitic imidazole framework-67 as an efficient heterogeneous catalyst for the conversion of CO2 to cyclic carbonates New J. Chem. 40 2016 5170 5176 [26] C.E. Banks A. Crossley C. Salter S.J. Wilkins R.G. Compton Carbon nanotubes contain metal impurities which are responsible for the “Electrocatalysis” seen at some nanotube-modified electrodes Angew. Chem. Int. Ed. 45 2006 2533 2537 [27] B. Mousavi S. Chaemchuen C.I. Ezugwu Y. Yuan F. Verpoort The effect of synthesis procedure on the catalytic performance of isostructural ZIF-8 Appl. Organomet. Chem. 2017 [28] Y.Z. Chen C. Wang Z.Y. Wu Y. Xiong Q. Xu S.H. Yu H.L. Jiang From bimetallic metal-organic framework to porous carbon: high surface area and multicomponent active dopants for excellent electrocatalysis Adv. Mater. 27 2015 5010 5016 [29] N.L. Torad M. Hu S. Ishihara H. Sukegawa A.A. Belik M. Imura K. Ariga Y. Sakka Y. Yamauchi Direct synthesis of MOF-derived nanoporous carbon with magnetic Co nanoparticles toward efficient water treatment Small 10 2014 2096 2107 [30] J. Tang R.R. Salunkhe H. Zhang V. Malgras T. Ahamad S.M. Alshehri N. Kobayashi S. Tominaka Y. Ide J.H. Kim Y. Yamauchi Bimetallic metal-organic frameworks for controlled catalytic graphitization of nanoporous carbons Sci. Rep. 6 2016 30295 [31] B.Y. Xia Y. Yan N. Li H.B. Wu X.W. Lou X. Wang A metal–organic framework-derived bifunctional oxygen electrocatalyst Nat. Energy 1 2016 15006 [32] W. Chaikittisilp K. Ariga Y. Yamauchi A new family of carbon materials: synthesis of MOF-derived nanoporous carbons and their promising applications J. Mater. Chem. A 1 2013 14 19 [33] X. Bo J. Bai J. Ju L. Guo Highly dispersed Pt nanoparticles supported on poly(ionic liquids) derived hollow carbon spheres for methanol oxidation J. Power Sources 196 2011 8360 8365 [34] G. Lv L. Cui Y. Wu Y. Liu T. Pu X. He A novel cobalt tetranitrophthalocyanine/graphene composite assembled by an in situ solvothermal synthesis method as a highly efficient electrocatalyst for the oxygen reduction reaction in alkaline medium Phys. Chem. Chem. Phys. 15 2013 13093 13100 [35] F. Jaouen J. Herranz M. Lefèvre J.-P. Dodelet U.I. Kramm I. Herrmann P. Bogdanoff J. Maruyama T. Nagaoka A. Garsuch J.R. Dahn T. Olson S. Pylypenko P. Atanassov E.A. Ustinov Cross-laboratory experimental study of non-noble-metal electrocatalysts for the oxygen reduction reaction ACS Appl. Mater. Interfaces 1 2009 1623 1639 [36] C.M. Miralda E.E. Macias M. Zhu P. Ratnasamy M.A. Carreon Zeolitic imidazole framework-8 catalysts in the conversion of CO2 to chloropropene carbonate ACS Catal. 2 2012 180 183 [37] O.V. Zalomaeva A.M. Chibiryaev K.A. Kovalenko O.A. Kholdeeva B.S. Balzhinimaev V.P. Fedin Cyclic carbonates synthesis from epoxides and CO2 over metal–organic framework Cr-MIL-101 J. Catal. 298 2013 179 185",
      "scopus-id": "85058947353",
      "coredata": {
        "eid": "1-s2.0-S0021951718304688",
        "dc:description": "A robust catalyst generated from the pyrolysis of bimetallic Zn/Co-ZIF comprising magnetic properties demonstrated to be an effective heterogeneous catalyst system for CO2 conversion reaction without the need of co-catalyst and solvent. Controllable pyrolysis under various conditions resulted in a unique active structure composed of metallic particles stabilized in a nitrogen-doped carbon matrix. The metallic particles acting as acid sites are dispersed in a nitrogen-doped porous carbon-wall which provides the basic sites. These sites are created during the pyrolysis process of Zn/Co-ZIF used as a special template under a controlled atmosphere. The resulting material possessing both, acid and basic sites, showed an excellent catalytic performance for the cycloaddition of CO2 into epoxides as these sites correspond to the active sites in the catalytic cycle. Additional, the pyrolysis conditions indicated to play an important role in the properties of the resulting materials and in parallel with the catalytic performance. The catalytic material proved to be very robust and maintained high activities for at least eleven cycles using the optimized reaction condition. Moreover, the magnetic property of the resulting catalyst is advantageous especially for the separation from the reaction mixture.",
        "openArchiveArticle": "false",
        "prism:coverDate": "2019-02-28",
        "openaccessUserLicense": null,
        "prism:aggregationType": "Journal",
        "prism:url": "https://api.elsevier.com/content/article/pii/S0021951718304688",
        "dc:creator": [
          {
            "@_fa": "true",
            "$": "Chaemchuen, Somboon"
          },
          {
            "@_fa": "true",
            "$": "Xiao, Xuan"
          },
          {
            "@_fa": "true",
            "$": "Ghadamyari, Marzieh"
          },
          {
            "@_fa": "true",
            "$": "Mousavi, Bibimaryam"
          },
          {
            "@_fa": "true",
            "$": "Klomkliang, Nikom"
          },
          {
            "@_fa": "true",
            "$": "Yuan, Ye"
          },
          {
            "@_fa": "true",
            "$": "Verpoort, Francis"
          }
        ],
        "link": [
          {
            "@_fa": "true",
            "@rel": "self",
            "@href": "https://api.elsevier.com/content/article/pii/S0021951718304688"
          },
          {
            "@_fa": "true",
            "@rel": "scidir",
            "@href": "https://www.sciencedirect.com/science/article/pii/S0021951718304688"
          }
        ],
        "dc:format": "application/json",
        "openaccessType": null,
        "pii": "S0021-9517(18)30468-8",
        "prism:volume": "370",
        "prism:publisher": "Elsevier Inc.",
        "dc:title": "Robust and efficient catalyst derived from bimetallic Zn/Co zeolitic imidazolate frameworks for CO2 conversion",
        "prism:copyright": "© 2018 Elsevier Inc. All rights reserved.",
        "openaccess": "0",
        "prism:issn": "00219517",
        "dcterms:subject": [
          {
            "@_fa": "true",
            "$": "Bi-metallic ZIF"
          },
          {
            "@_fa": "true",
            "$": "Pyrolysis"
          },
          {
            "@_fa": "true",
            "$": "CO2 conversion"
          },
          {
            "@_fa": "true",
            "$": "Heterogeneous catalysis"
          },
          {
            "@_fa": "true",
            "$": "Cyclic carbonates"
          }
        ],
        "openaccessArticle": "false",
        "prism:publicationName": "Journal of Catalysis",
        "openaccessSponsorType": null,
        "prism:pageRange": "38-45",
        "prism:endingPage": "45",
        "pubType": "fla",
        "prism:coverDisplayDate": "February 2019",
        "prism:doi": "10.1016/j.jcat.2018.11.027",
        "prism:startingPage": "38",
        "dc:identifier": "doi:10.1016/j.jcat.2018.11.027",
        "openaccessSponsorName": null
      },
      "objects": {
        "object": [
          {
            "@category": "standard",
            "@height": "53",
            "@width": "90",
            "@_fa": "true",
            "$": "https://api.elsevier.com/content/object/eid/1-s2.0-S0021951718304688-fx1.jpg?httpAccept=%2A%2F%2A",
            "@multimediatype": "JPEG image file",
            "@type": "IMAGE-DOWNSAMPLED",
            "@size": "1401",
            "@ref": "fx1",
            "@mimetype": "image/jpeg"
          },
          {
            "@category": "standard",
            "@height": "56",
            "@width": "161",
            "@_fa": "true",
            "$": "https://api.elsevier.com/content/object/eid/1-s2.0-S0021951718304688-fx2.jpg?httpAccept=%2A%2F%2A",
            "@multimediatype": "JPEG image file",
            "@type": "IMAGE-DOWNSAMPLED",
            "@size": "2377",
            "@ref": "fx2",
            "@mimetype": "image/jpeg"
          },
          {
            "@category": "standard",
            "@height": "54",
            "@width": "84",
            "@_fa": "true",
            "$": "https://api.elsevier.com/content/object/eid/1-s2.0-S0021951718304688-fx3.jpg?httpAccept=%2A%2F%2A",
            "@multimediatype": "JPEG image file",
            "@type": "IMAGE-DOWNSAMPLED",
            "@size": "1467",
            "@ref": "fx3",
            "@mimetype": "image/jpeg"
          },
          {
            "@category": "standard",
            "@height": "62",
            "@width": "134",
            "@_fa": "true",
            "$": "https://api.elsevier.com/content/object/eid/1-s2.0-S0021951718304688-fx4.jpg?httpAccept=%2A%2F%2A",
            "@multimediatype": "JPEG image file",
            "@type": "IMAGE-DOWNSAMPLED",
            "@size": "2375",
            "@ref": "fx4",
            "@mimetype": "image/jpeg"
          },
          {
            "@category": "standard",
            "@height": "68",
            "@width": "118",
            "@_fa": "true",
            "$": "https://api.elsevier.com/content/object/eid/1-s2.0-S0021951718304688-fx5.jpg?httpAccept=%2A%2F%2A",
            "@multimediatype": "JPEG image file",
            "@type": "IMAGE-DOWNSAMPLED",
            "@size": "2371",
            "@ref": "fx5",
            "@mimetype": "image/jpeg"
          },
          {
            "@category": "standard",
            "@height": "88",
            "@width": "138",
            "@_fa": "true",
            "$": "https://api.elsevier.com/content/object/eid/1-s2.0-S0021951718304688-fx6.jpg?httpAccept=%2A%2F%2A",
            "@multimediatype": "JPEG image file",
            "@type": "IMAGE-DOWNSAMPLED",
            "@size": "2799",
            "@ref": "fx6",
            "@mimetype": "image/jpeg"
          },
          {
            "@category": "standard",
            "@height": "81",
            "@width": "121",
            "@_fa": "true",
            "$": "https://api.elsevier.com/content/object/eid/1-s2.0-S0021951718304688-fx7.jpg?httpAccept=%2A%2F%2A",
            "@multimediatype": "JPEG image file",
            "@type": "IMAGE-DOWNSAMPLED",
            "@size": "2218",
            "@ref": "fx7",
            "@mimetype": "image/jpeg"
          },
          {
            "@category": "standard",
            "@height": "76",
            "@width": "168",
            "@_fa": "true",
            "$": "https://api.elsevier.com/content/object/eid/1-s2.0-S0021951718304688-fx8.jpg?httpAccept=%2A%2F%2A",
            "@multimediatype": "JPEG image file",
            "@type": "IMAGE-DOWNSAMPLED",
            "@size": "3235",
            "@ref": "fx8",
            "@mimetype": "image/jpeg"
          },
          {
            "@category": "standard",
            "@height": "200",
            "@width": "316",
            "@_fa": "true",
            "$": "https://api.elsevier.com/content/object/eid/1-s2.0-S0021951718304688-ga1.jpg?httpAccept=%2A%2F%2A",
            "@multimediatype": "JPEG image file",
            "@type": "IMAGE-DOWNSAMPLED",
            "@size": "17488",
            "@ref": "ga1",
            "@mimetype": "image/jpeg"
          },
          {
            "@category": "standard",
            "@height": "233",
            "@width": "711",
            "@_fa": "true",
            "$": "https://api.elsevier.com/content/object/eid/1-s2.0-S0021951718304688-gr1.jpg?httpAccept=%2A%2F%2A",
            "@multimediatype": "JPEG image file",
            "@type": "IMAGE-DOWNSAMPLED",
            "@size": "42173",
            "@ref": "gr1",
            "@mimetype": "image/jpeg"
          },
          {
            "@category": "standard",
            "@height": "213",
            "@width": "364",
            "@_fa": "true",
            "$": "https://api.elsevier.com/content/object/eid/1-s2.0-S0021951718304688-gr2.jpg?httpAccept=%2A%2F%2A",
            "@multimediatype": "JPEG image file",
            "@type": "IMAGE-DOWNSAMPLED",
            "@size": "27407",
            "@ref": "gr2",
            "@mimetype": "image/jpeg"
          },
          {
            "@category": "standard",
            "@height": "270",
            "@width": "355",
            "@_fa": "true",
            "$": "https://api.elsevier.com/content/object/eid/1-s2.0-S0021951718304688-gr3.jpg?httpAccept=%2A%2F%2A",
            "@multimediatype": "JPEG image file",
            "@type": "IMAGE-DOWNSAMPLED",
            "@size": "28633",
            "@ref": "gr3",
            "@mimetype": "image/jpeg"
          },
          {
            "@category": "standard",
            "@height": "488",
            "@width": "579",
            "@_fa": "true",
            "$": "https://api.elsevier.com/content/object/eid/1-s2.0-S0021951718304688-gr4.jpg?httpAccept=%2A%2F%2A",
            "@multimediatype": "JPEG image file",
            "@type": "IMAGE-DOWNSAMPLED",
            "@size": "90324",
            "@ref": "gr4",
            "@mimetype": "image/jpeg"
          },
          {
            "@category": "standard",
            "@height": "391",
            "@width": "556",
            "@_fa": "true",
            "$": "https://api.elsevier.com/content/object/eid/1-s2.0-S0021951718304688-gr5.jpg?httpAccept=%2A%2F%2A",
            "@multimediatype": "JPEG image file",
            "@type": "IMAGE-DOWNSAMPLED",
            "@size": "52995",
            "@ref": "gr5",
            "@mimetype": "image/jpeg"
          },
          {
            "@category": "standard",
            "@height": "466",
            "@width": "551",
            "@_fa": "true",
            "$": "https://api.elsevier.com/content/object/eid/1-s2.0-S0021951718304688-gr6.jpg?httpAccept=%2A%2F%2A",
            "@multimediatype": "JPEG image file",
            "@type": "IMAGE-DOWNSAMPLED",
            "@size": "43342",
            "@ref": "gr6",
            "@mimetype": "image/jpeg"
          },
          {
            "@category": "thumbnail",
            "@height": "129",
            "@width": "219",
            "@_fa": "true",
            "$": "https://api.elsevier.com/content/object/eid/1-s2.0-S0021951718304688-fx1.sml?httpAccept=%2A%2F%2A",
            "@multimediatype": "GIF image file",
            "@type": "IMAGE-THUMBNAIL",
            "@size": "3492",
            "@ref": "fx1",
            "@mimetype": "image/gif"
          },
          {
            "@category": "thumbnail",
            "@height": "76",
            "@width": "219",
            "@_fa": "true",
            "$": "https://api.elsevier.com/content/object/eid/1-s2.0-S0021951718304688-fx2.sml?httpAccept=%2A%2F%2A",
            "@multimediatype": "GIF image file",
            "@type": "IMAGE-THUMBNAIL",
            "@size": "2962",
            "@ref": "fx2",
            "@mimetype": "image/gif"
          },
          {
            "@category": "thumbnail",
            "@height": "142",
            "@width": "219",
            "@_fa": "true",
            "$": "https://api.elsevier.com/content/object/eid/1-s2.0-S0021951718304688-fx3.sml?httpAccept=%2A%2F%2A",
            "@multimediatype": "GIF image file",
            "@type": "IMAGE-THUMBNAIL",
            "@size": "3967",
            "@ref": "fx3",
            "@mimetype": "image/gif"
          },
          {
            "@category": "thumbnail",
            "@height": "101",
            "@width": "219",
            "@_fa": "true",
            "$": "https://api.elsevier.com/content/object/eid/1-s2.0-S0021951718304688-fx4.sml?httpAccept=%2A%2F%2A",
            "@multimediatype": "GIF image file",
            "@type": "IMAGE-THUMBNAIL",
            "@size": "3346",
            "@ref": "fx4",
            "@mimetype": "image/gif"
          },
          {
            "@category": "thumbnail",
            "@height": "126",
            "@width": "219",
            "@_fa": "true",
            "$": "https://api.elsevier.com/content/object/eid/1-s2.0-S0021951718304688-fx5.sml?httpAccept=%2A%2F%2A",
            "@multimediatype": "GIF image file",
            "@type": "IMAGE-THUMBNAIL",
            "@size": "4123",
            "@ref": "fx5",
            "@mimetype": "image/gif"
          },
          {
            "@category": "thumbnail",
            "@height": "140",
            "@width": "219",
            "@_fa": "true",
            "$": "https://api.elsevier.com/content/object/eid/1-s2.0-S0021951718304688-fx6.sml?httpAccept=%2A%2F%2A",
            "@multimediatype": "GIF image file",
            "@type": "IMAGE-THUMBNAIL",
            "@size": "4063",
            "@ref": "fx6",
            "@mimetype": "image/gif"
          },
          {
            "@category": "thumbnail",
            "@height": "146",
            "@width": "219",
            "@_fa": "true",
            "$": "https://api.elsevier.com/content/object/eid/1-s2.0-S0021951718304688-fx7.sml?httpAccept=%2A%2F%2A",
            "@multimediatype": "GIF image file",
            "@type": "IMAGE-THUMBNAIL",
            "@size": "3753",
            "@ref": "fx7",
            "@mimetype": "image/gif"
          },
          {
            "@category": "thumbnail",
            "@height": "99",
            "@width": "219",
            "@_fa": "true",
            "$": "https://api.elsevier.com/content/object/eid/1-s2.0-S0021951718304688-fx8.sml?httpAccept=%2A%2F%2A",
            "@multimediatype": "GIF image file",
            "@type": "IMAGE-THUMBNAIL",
            "@size": "3468",
            "@ref": "fx8",
            "@mimetype": "image/gif"
          },
          {
            "@category": "thumbnail",
            "@height": "139",
            "@width": "219",
            "@_fa": "true",
            "$": "https://api.elsevier.com/content/object/eid/1-s2.0-S0021951718304688-ga1.sml?httpAccept=%2A%2F%2A",
            "@multimediatype": "GIF image file",
            "@type": "IMAGE-THUMBNAIL",
            "@size": "9172",
            "@ref": "ga1",
            "@mimetype": "image/gif"
          },
          {
            "@category": "thumbnail",
            "@height": "72",
            "@width": "219",
            "@_fa": "true",
            "$": "https://api.elsevier.com/content/object/eid/1-s2.0-S0021951718304688-gr1.sml?httpAccept=%2A%2F%2A",
            "@multimediatype": "GIF image file",
            "@type": "IMAGE-THUMBNAIL",
            "@size": "8182",
            "@ref": "gr1",
            "@mimetype": "image/gif"
          },
          {
            "@category": "thumbnail",
            "@height": "128",
            "@width": "219",
            "@_fa": "true",
            "$": "https://api.elsevier.com/content/object/eid/1-s2.0-S0021951718304688-gr2.sml?httpAccept=%2A%2F%2A",
            "@multimediatype": "GIF image file",
            "@type": "IMAGE-THUMBNAIL",
            "@size": "11077",
            "@ref": "gr2",
            "@mimetype": "image/gif"
          },
          {
            "@category": "thumbnail",
            "@height": "164",
            "@width": "215",
            "@_fa": "true",
            "$": "https://api.elsevier.com/content/object/eid/1-s2.0-S0021951718304688-gr3.sml?httpAccept=%2A%2F%2A",
            "@multimediatype": "GIF image file",
            "@type": "IMAGE-THUMBNAIL",
            "@size": "9655",
            "@ref": "gr3",
            "@mimetype": "image/gif"
          },
          {
            "@category": "thumbnail",
            "@height": "164",
            "@width": "194",
            "@_fa": "true",
            "$": "https://api.elsevier.com/content/object/eid/1-s2.0-S0021951718304688-gr4.sml?httpAccept=%2A%2F%2A",
            "@multimediatype": "GIF image file",
            "@type": "IMAGE-THUMBNAIL",
            "@size": "22864",
            "@ref": "gr4",
            "@mimetype": "image/gif"
          },
          {
            "@category": "thumbnail",
            "@height": "154",
            "@width": "219",
            "@_fa": "true",
            "$": "https://api.elsevier.com/content/object/eid/1-s2.0-S0021951718304688-gr5.sml?httpAccept=%2A%2F%2A",
            "@multimediatype": "GIF image file",
            "@type": "IMAGE-THUMBNAIL",
            "@size": "13084",
            "@ref": "gr5",
            "@mimetype": "image/gif"
          },
          {
            "@category": "thumbnail",
            "@height": "164",
            "@width": "194",
            "@_fa": "true",
            "$": "https://api.elsevier.com/content/object/eid/1-s2.0-S0021951718304688-gr6.sml?httpAccept=%2A%2F%2A",
            "@multimediatype": "GIF image file",
            "@type": "IMAGE-THUMBNAIL",
            "@size": "8832",
            "@ref": "gr6",
            "@mimetype": "image/gif"
          },
          {
            "@category": "high",
            "@height": "236",
            "@width": "401",
            "@_fa": "true",
            "$": "https://api.elsevier.com/content/object/eid/1-s2.0-S0021951718304688-fx1_lrg.jpg?httpAccept=%2A%2F%2A",
            "@multimediatype": "JPEG image file",
            "@type": "IMAGE-HIGH-RES",
            "@size": "7830",
            "@ref": "fx1",
            "@mimetype": "image/jpeg"
          },
          {
            "@category": "high",
            "@height": "247",
            "@width": "714",
            "@_fa": "true",
            "$": "https://api.elsevier.com/content/object/eid/1-s2.0-S0021951718304688-fx2_lrg.jpg?httpAccept=%2A%2F%2A",
            "@multimediatype": "JPEG image file",
            "@type": "IMAGE-HIGH-RES",
            "@size": "15850",
            "@ref": "fx2",
            "@mimetype": "image/jpeg"
          },
          {
            "@category": "high",
            "@height": "243",
            "@width": "376",
            "@_fa": "true",
            "$": "https://api.elsevier.com/content/object/eid/1-s2.0-S0021951718304688-fx3_lrg.jpg?httpAccept=%2A%2F%2A",
            "@multimediatype": "JPEG image file",
            "@type": "IMAGE-HIGH-RES",
            "@size": "7967",
            "@ref": "fx3",
            "@mimetype": "image/jpeg"
          },
          {
            "@category": "high",
            "@height": "274",
            "@width": "594",
            "@_fa": "true",
            "$": "https://api.elsevier.com/content/object/eid/1-s2.0-S0021951718304688-fx4_lrg.jpg?httpAccept=%2A%2F%2A",
            "@multimediatype": "JPEG image file",
            "@type": "IMAGE-HIGH-RES",
            "@size": "14668",
            "@ref": "fx4",
            "@mimetype": "image/jpeg"
          },
          {
            "@category": "high",
            "@height": "302",
            "@width": "525",
            "@_fa": "true",
            "$": "https://api.elsevier.com/content/object/eid/1-s2.0-S0021951718304688-fx5_lrg.jpg?httpAccept=%2A%2F%2A",
            "@multimediatype": "JPEG image file",
            "@type": "IMAGE-HIGH-RES",
            "@size": "15056",
            "@ref": "fx5",
            "@mimetype": "image/jpeg"
          },
          {
            "@category": "high",
            "@height": "392",
            "@width": "613",
            "@_fa": "true",
            "$": "https://api.elsevier.com/content/object/eid/1-s2.0-S0021951718304688-fx6_lrg.jpg?httpAccept=%2A%2F%2A",
            "@multimediatype": "JPEG image file",
            "@type": "IMAGE-HIGH-RES",
            "@size": "19512",
            "@ref": "fx6",
            "@mimetype": "image/jpeg"
          },
          {
            "@category": "high",
            "@height": "360",
            "@width": "539",
            "@_fa": "true",
            "$": "https://api.elsevier.com/content/object/eid/1-s2.0-S0021951718304688-fx7_lrg.jpg?httpAccept=%2A%2F%2A",
            "@multimediatype": "JPEG image file",
            "@type": "IMAGE-HIGH-RES",
            "@size": "14728",
            "@ref": "fx7",
            "@mimetype": "image/jpeg"
          },
          {
            "@category": "high",
            "@height": "335",
            "@width": "744",
            "@_fa": "true",
            "$": "https://api.elsevier.com/content/object/eid/1-s2.0-S0021951718304688-fx8_lrg.jpg?httpAccept=%2A%2F%2A",
            "@multimediatype": "JPEG image file",
            "@type": "IMAGE-HIGH-RES",
            "@size": "21789",
            "@ref": "fx8",
            "@mimetype": "image/jpeg"
          },
          {
            "@category": "high",
            "@height": "531",
            "@width": "839",
            "@_fa": "true",
            "$": "https://api.elsevier.com/content/object/eid/1-s2.0-S0021951718304688-ga1_lrg.jpg?httpAccept=%2A%2F%2A",
            "@multimediatype": "JPEG image file",
            "@type": "IMAGE-HIGH-RES",
            "@size": "48553",
            "@ref": "ga1",
            "@mimetype": "image/jpeg"
          },
          {
            "@category": "high",
            "@height": "1033",
            "@width": "3150",
            "@_fa": "true",
            "$": "https://api.elsevier.com/content/object/eid/1-s2.0-S0021951718304688-gr1_lrg.jpg?httpAccept=%2A%2F%2A",
            "@multimediatype": "JPEG image file",
            "@type": "IMAGE-HIGH-RES",
            "@size": "241520",
            "@ref": "gr1",
            "@mimetype": "image/jpeg"
          },
          {
            "@category": "high",
            "@height": "943",
            "@width": "1614",
            "@_fa": "true",
            "$": "https://api.elsevier.com/content/object/eid/1-s2.0-S0021951718304688-gr2_lrg.jpg?httpAccept=%2A%2F%2A",
            "@multimediatype": "JPEG image file",
            "@type": "IMAGE-HIGH-RES",
            "@size": "134406",
            "@ref": "gr2",
            "@mimetype": "image/jpeg"
          },
          {
            "@category": "high",
            "@height": "1200",
            "@width": "1575",
            "@_fa": "true",
            "$": "https://api.elsevier.com/content/object/eid/1-s2.0-S0021951718304688-gr3_lrg.jpg?httpAccept=%2A%2F%2A",
            "@multimediatype": "JPEG image file",
            "@type": "IMAGE-HIGH-RES",
            "@size": "224957",
            "@ref": "gr3",
            "@mimetype": "image/jpeg"
          },
          {
            "@category": "high",
            "@height": "2163",
            "@width": "2565",
            "@_fa": "true",
            "$": "https://api.elsevier.com/content/object/eid/1-s2.0-S0021951718304688-gr4_lrg.jpg?httpAccept=%2A%2F%2A",
            "@multimediatype": "JPEG image file",
            "@type": "IMAGE-HIGH-RES",
            "@size": "762561",
            "@ref": "gr4",
            "@mimetype": "image/jpeg"
          },
          {
            "@category": "high",
            "@height": "1732",
            "@width": "2461",
            "@_fa": "true",
            "$": "https://api.elsevier.com/content/object/eid/1-s2.0-S0021951718304688-gr5_lrg.jpg?httpAccept=%2A%2F%2A",
            "@multimediatype": "JPEG image file",
            "@type": "IMAGE-HIGH-RES",
            "@size": "284911",
            "@ref": "gr5",
            "@mimetype": "image/jpeg"
          },
          {
            "@category": "high",
            "@height": "2064",
            "@width": "2441",
            "@_fa": "true",
            "$": "https://api.elsevier.com/content/object/eid/1-s2.0-S0021951718304688-gr6_lrg.jpg?httpAccept=%2A%2F%2A",
            "@multimediatype": "JPEG image file",
            "@type": "IMAGE-HIGH-RES",
            "@size": "241326",
            "@ref": "gr6",
            "@mimetype": "image/jpeg"
          },
          {
            "@category": "standard",
            "@_fa": "true",
            "$": "https://api.elsevier.com/content/object/eid/1-s2.0-S0021951718304688-am.pdf?httpAccept=%2A%2F%2A",
            "@multimediatype": "Acrobat PDF file",
            "@type": "AAM-PDF",
            "@size": "1064243",
            "@ref": "am",
            "@mimetype": "application/pdf"
          }
        ]
      },
      "link": {
        "@rel": "abstract",
        "@href": "https://api.elsevier.com/content/abstract/scopus_id/85058947353"
      }
    }
  }
}