{
  "metadata": {
    "title": "Zinc cations incorporated in Silicalite-1 zeolite assist in anchoring atomically dispersed platinum catalyst for boosted and robust propane dehydrogenation",
    "authors": "; ; ",
    "journal": "Journal of Catalysis",
    "date": "2024-09-30",
    "doi": "10.1016/j.jcat.2024.115647",
    "abstract": "",
    "uri": "https://api.elsevier.com/content/article/pii/S0021951724003609",
    "pii": "S0021951724003609"
  },
  "fulltext": {
    "full-text-retrieval-response": {
      "scopus-eid": "2-s2.0-85198568111",
      "originalText": "serial JL 272561 291210 291744 291809 31 Journal of Catalysis JOURNALCATALYSIS 2024-07-14 2024-07-14 2024-07-17 2024-07-17 2024-08-09T04:44:15 1-s2.0-S0021951724003609 S0021-9517(24)00360-9 S0021951724003609 10.1016/j.jcat.2024.115647 S300 S300.1 FULL-TEXT 1-s2.0-S0021951724X00093 2024-08-30T19:31:20.250784Z 0 0 20240901 20240930 2024 2024-07-14T07:40:03.287559Z absattachment articleinfo articlenumber articletitlenorm authfirstinitialnorm authfirstsurnamenorm cid cids contenttype copyright crossmark dateloaded dateloadedtxt datesearch datesort dateupdated dco docsubtype doctype doi eid ewtransactionid hubeid indexeddate issn issnnorm itemstage itemtransactionid itemweight openaccess openarchive pg pgfirst pii piinorm pubdateend pubdatestart pubdatetxt pubyr sectiontitle sortorder srctitle srctitlenorm srctype ssids alllist content subj subheadings suppl tomb volfirst volissue volumelist webpdf webpdfpagecount yearnav figure table e-component body mmlmath acknowledge affil appendices articletitle auth authfirstini authfull authkeywords authlast footnotes grantnumber grantsponsor grantsponsorid highlightsabst primabst ref specialabst 0021-9517 00219517 true 437 437 C Volume 437 13 115647 115647 115647 202409 September 2024 2024-09-01 2024-09-30 2024 Regular Articles article fla © 2024 Elsevier Inc. All rights are reserved, including those for text and data mining, AI training, and similar technologies. ZINCCATIONSINCORPORATEDINSILICALITE1ZEOLITEASSISTINANCHORINGATOMICALLYDISPERSEDPLATINUMCATALYSTFORBOOSTEDROBUSTPROPANEDEHYDROGENATION WANG P 1 Introduction 2 Experimental section 2.1 Catalyst preparation 2.2 Catalyst characterization 2.3 Catalytic activity tests 3 Results and discussion 3.1 The propane dehydrogenation (PDH) catalytic performance and deactivation study 3.2 Micro-structure characterization of the 0.5Pt/Zn@S-1 catalyst 3.3 The incorporation of Zn and Pt into the zeolite in the 0.5Pt/Zn@S-1 catalyst 3.4 The surface reactivity of the 0.5Pt/Zn@S-1 catalyst 3.5 Chemical state and coordination environment of atomically dispersed Pt active sites in the catalyst 3.6 The investigation into the spent catalyst to unveil the origination of stability 4 Conclusions CRediT authorship contribution statement Acknowledgments Appendix A Supplementary data References DAI 2021 5590 5630 Y QU 2022 3095 3115 Z WEI 2023 X HE 2023 129044 Y SONG 2023 6044 6067 S HE 2018 14010 14014 Y ALIHUSSAINMOTAGAMWALA 2021 217 222 R ZHA 2018 3925 3931 S WANG 2022 120731 P ZHANG 2019 5998 6005 J WANG 2023 118450 P ZHANG 2022 1310 1314 B WU 2021 48934 48948 L SUN 2023 4719 4741 M NAKAYA 2020 2838 Y RIMAZ 2019 117266 S LI 2018 38134 38140 J WANG 2024 8116 8129 P SEARLES 2018 11674 11679 K CAMACHOBUNQUIN 2018 10058 10063 J XIE 2021 92 98 L BIAN 2023 118748 K ZHANG 2020 12932 12942 W SUN 2021 2104442 Q WANG 2019 1803966 N QU 2023 Z YUAN 2023 2207756 Y YU 2022 6968 6976 J QI 2021 21364 21378 L SUN 2020 19450 19459 Q ZHAO 2021 234 238 D XIE 2021 262 269 L WANG 2023 P HE 2023 112402 J LIU 2023 eadj1962 L WU 2022 2 11 Q RAVEL 2005 537 541 B FUNKE 2005 094110 H FUNKE 2007 426 432 H DAI 2021 105 116 Y WEI 2004 4094 4103 J JI 2020 719 729 Z ZHU 2014 52 62 H LI 2017 361 370 J ZHOU 2016 30 35 H RAZAVIAN 2015 176 189 M SHI 2020 2283 2293 Y LIU 2019 866 873 L ZHANG 2019 85 91 H YANG 2020 16429 16436 Z LIU 2016 2158 2162 G INGALE 2021 484 493 P JEANPHILIPPENOGIER 2009 4885 4889 Y JI 2018 94 104 Z BARBERA 2011 196 205 K ZHU 2017 27273 27283 Z SUN 2016 19 25 P DONG 2016 26713 W LIN 2020 6424 6434 C XU 2019 818 828 Z KIM 2017 7213 7222 W WANG 2020 61 69 Y BORDIGA 2013 1736 1850 S ZHANG 2015 7938 S TANG 2020 6255 6262 Y KANG 2022 1050 1066 J TAO 2023 486 499 F MA 2018 46 49 X ZHANG 2023 113401 S XIA 2018 12 19 Z WANGX2024X115647 WANGX2024X115647XP 2026-07-17T00:00:00.000Z 2026-07-17T00:00:00.000Z http://creativecommons.org/licenses/by-nc-nd/4.0/ © 2024 Elsevier Inc. All rights are reserved, including those for text and data mining, AI training, and similar technologies. 2024-07-24T17:56:44.951Z http://vtw.elsevier.com/data/voc/AddOnTypes/50.7/aggregated-refined National Natural Science Foundation of China 22172032 U22A20431 U19B2003 22202047 21902027 NSFC NSFC http://data.elsevier.com/vocabulary/SciValFunders/501100001809 http://sws.geonames.org/1814991 Shanghai Synchrotron Radiation Facility Natural Science Foundation of Fujian Province BL-11B BL-14\\u202FW1 2022- SSRF - PT-501293 2022\\u202F J05110 2023- SSRF - PT-504535 Natural Science Foundation of Fujian Province http://data.elsevier.com/vocabulary/SciValFunders/501100003392 http://sws.geonames.org/1814991/ This work is supported by the National Natural Science Foundation of China (21902027, U19B2003, U22A20431, 22172032, and 22202047), the Natural Science Foundation of Fujian Province (2022 J05110). The X-ray experiment was supported by BL-11B and BL-14 W1, Shanghai Synchrotron Radiation Facility (j21sr004, 2022-SSRF-PT-501293 and 2023-SSRF-PT-504535). This work is supported by the National Natural Science Foundation of China ( 21902027 , U19B2003 , U22A20431 , 22172032 , and 22202047 ), the Natural Science Foundation of Fujian Province (2022\\u202F J05110 ). The X-ray experiment was supported by BL-11B and BL-14\\u202FW1, Shanghai Synchrotron Radiation Facility (j21sr004, 2022- SSRF - PT-501293 and 2023- SSRF - PT-504535 ). https://doi.org/10.15223/policy-017 https://doi.org/10.15223/policy-037 https://doi.org/10.15223/policy-012 https://doi.org/10.15223/policy-029 https://doi.org/10.15223/policy-004 item S0021-9517(24)00360-9 S0021951724003609 1-s2.0-S0021951724003609 10.1016/j.jcat.2024.115647 272561 2024-08-30T19:31:20.250784Z 2024-09-01 2024-09-30 1-s2.0-S0021951724003609-main.pdf https://s3-eu-west-1.amazonaws.com/prod-ucs-content-store-eu-west/content/pii:S0021951724003609/MAIN/application/pdf/e69d88a8644e74e04af483c3f67d7b58/main.pdf main.pdf pdf true 5438405 MAIN 11 1-s2.0-S0021951724003609-main_1.png https://s3-eu-west-1.amazonaws.com/prod-ucs-content-store-eu-west/content/pii:S0021951724003609/PREVIEW/image/png/3b362932a8da2e52a8f4e7d70c48ce30/main_1.png main_1.png png 57609 849 656 IMAGE-WEB-PDF 1 1-s2.0-S0021951724003609-gr5.jpg https://s3-eu-west-1.amazonaws.com/prod-ucs-content-store-eu-west/content/pii:S0021951724003609/gr5/DOWNSAMPLED/image/jpeg/6c6b67b56368812dd04ddf88d45c7ce7/gr5.jpg gr5 gr5.jpg jpg 40423 248 535 IMAGE-DOWNSAMPLED 1-s2.0-S0021951724003609-gr6.jpg https://s3-eu-west-1.amazonaws.com/prod-ucs-content-store-eu-west/content/pii:S0021951724003609/gr6/DOWNSAMPLED/image/jpeg/66db8b2c644fd23b0a9b766093d74d09/gr6.jpg gr6 gr6.jpg jpg 24735 231 289 IMAGE-DOWNSAMPLED 1-s2.0-S0021951724003609-gr3.jpg https://s3-eu-west-1.amazonaws.com/prod-ucs-content-store-eu-west/content/pii:S0021951724003609/gr3/DOWNSAMPLED/image/jpeg/e74b311702ce4cb3ff3555d2f555da2a/gr3.jpg gr3 gr3.jpg jpg 79482 398 623 IMAGE-DOWNSAMPLED 1-s2.0-S0021951724003609-gr4.jpg https://s3-eu-west-1.amazonaws.com/prod-ucs-content-store-eu-west/content/pii:S0021951724003609/gr4/DOWNSAMPLED/image/jpeg/f2473e15a60ae73de23230edcaf5e8e8/gr4.jpg gr4 gr4.jpg jpg 34375 197 533 IMAGE-DOWNSAMPLED 1-s2.0-S0021951724003609-gr9.jpg https://s3-eu-west-1.amazonaws.com/prod-ucs-content-store-eu-west/content/pii:S0021951724003609/gr9/DOWNSAMPLED/image/jpeg/e121b9edee0d0cd5381a664a3fa5ec55/gr9.jpg gr9 gr9.jpg jpg 75115 732 289 IMAGE-DOWNSAMPLED 1-s2.0-S0021951724003609-gr7.jpg https://s3-eu-west-1.amazonaws.com/prod-ucs-content-store-eu-west/content/pii:S0021951724003609/gr7/DOWNSAMPLED/image/jpeg/0a772681705722cddd2447c6585f5466/gr7.jpg gr7 gr7.jpg jpg 50808 213 533 IMAGE-DOWNSAMPLED 1-s2.0-S0021951724003609-gr8.jpg https://s3-eu-west-1.amazonaws.com/prod-ucs-content-store-eu-west/content/pii:S0021951724003609/gr8/DOWNSAMPLED/image/jpeg/c5a8804cd3caedc71383d1d142143116/gr8.jpg gr8 gr8.jpg jpg 79280 461 534 IMAGE-DOWNSAMPLED 1-s2.0-S0021951724003609-ga1.jpg https://s3-eu-west-1.amazonaws.com/prod-ucs-content-store-eu-west/content/pii:S0021951724003609/ga1/DOWNSAMPLED/image/jpeg/2f00c0a61f3655a4b8ac5e0b464a877d/ga1.jpg ga1 true ga1.jpg jpg 18151 200 325 IMAGE-DOWNSAMPLED 1-s2.0-S0021951724003609-gr11.jpg https://s3-eu-west-1.amazonaws.com/prod-ucs-content-store-eu-west/content/pii:S0021951724003609/gr11/DOWNSAMPLED/image/jpeg/3454f37da6cb371f8192c93773a8857e/gr11.jpg gr11 gr11.jpg jpg 77065 297 735 IMAGE-DOWNSAMPLED 1-s2.0-S0021951724003609-gr10.jpg https://s3-eu-west-1.amazonaws.com/prod-ucs-content-store-eu-west/content/pii:S0021951724003609/gr10/DOWNSAMPLED/image/jpeg/4dc19a7e457a31f5b64214add51b50ac/gr10.jpg gr10 gr10.jpg jpg 34727 171 623 IMAGE-DOWNSAMPLED 1-s2.0-S0021951724003609-gr13.jpg https://s3-eu-west-1.amazonaws.com/prod-ucs-content-store-eu-west/content/pii:S0021951724003609/gr13/DOWNSAMPLED/image/jpeg/3382f189ef04076815fdd202365c5e38/gr13.jpg gr13 gr13.jpg jpg 44724 197 774 IMAGE-DOWNSAMPLED 1-s2.0-S0021951724003609-gr12.jpg https://s3-eu-west-1.amazonaws.com/prod-ucs-content-store-eu-west/content/pii:S0021951724003609/gr12/DOWNSAMPLED/image/jpeg/77337353d3dd2bbfb5d3e6f30dcbb2f7/gr12.jpg gr12 gr12.jpg jpg 20563 215 289 IMAGE-DOWNSAMPLED 1-s2.0-S0021951724003609-gr1.jpg https://s3-eu-west-1.amazonaws.com/prod-ucs-content-store-eu-west/content/pii:S0021951724003609/gr1/DOWNSAMPLED/image/jpeg/346bfafaec1f79111b5e526f84e3bf30/gr1.jpg gr1 gr1.jpg jpg 35559 179 533 IMAGE-DOWNSAMPLED 1-s2.0-S0021951724003609-gr2.jpg https://s3-eu-west-1.amazonaws.com/prod-ucs-content-store-eu-west/content/pii:S0021951724003609/gr2/DOWNSAMPLED/image/jpeg/4b56c9ec47763b80f76e43d67816219d/gr2.jpg gr2 gr2.jpg jpg 35727 178 533 IMAGE-DOWNSAMPLED 1-s2.0-S0021951724003609-gr5.sml https://s3-eu-west-1.amazonaws.com/prod-ucs-content-store-eu-west/content/pii:S0021951724003609/gr5/THUMBNAIL/image/gif/01b7d4671bab42d4805026a9e206f16f/gr5.sml gr5 gr5.sml sml 8017 102 219 IMAGE-THUMBNAIL 1-s2.0-S0021951724003609-gr6.sml https://s3-eu-west-1.amazonaws.com/prod-ucs-content-store-eu-west/content/pii:S0021951724003609/gr6/THUMBNAIL/image/gif/8c1d64b88757966bf563b839d32d979c/gr6.sml gr6 gr6.sml sml 9381 164 205 IMAGE-THUMBNAIL 1-s2.0-S0021951724003609-gr3.sml https://s3-eu-west-1.amazonaws.com/prod-ucs-content-store-eu-west/content/pii:S0021951724003609/gr3/THUMBNAIL/image/gif/24207d2e130c7aec868b302d5d9b2404/gr3.sml gr3 gr3.sml sml 18514 140 219 IMAGE-THUMBNAIL 1-s2.0-S0021951724003609-gr4.sml https://s3-eu-west-1.amazonaws.com/prod-ucs-content-store-eu-west/content/pii:S0021951724003609/gr4/THUMBNAIL/image/gif/5e9843aa973c1749d805c5bcfe1a63e1/gr4.sml gr4 gr4.sml sml 7069 81 219 IMAGE-THUMBNAIL 1-s2.0-S0021951724003609-gr9.sml https://s3-eu-west-1.amazonaws.com/prod-ucs-content-store-eu-west/content/pii:S0021951724003609/gr9/THUMBNAIL/image/gif/bba60422c416490e47fc95d055384a99/gr9.sml gr9 gr9.sml sml 6421 162 64 IMAGE-THUMBNAIL 1-s2.0-S0021951724003609-gr7.sml https://s3-eu-west-1.amazonaws.com/prod-ucs-content-store-eu-west/content/pii:S0021951724003609/gr7/THUMBNAIL/image/gif/3df983987e958babe8733887cbf04e80/gr7.sml gr7 gr7.sml sml 9311 88 219 IMAGE-THUMBNAIL 1-s2.0-S0021951724003609-gr8.sml https://s3-eu-west-1.amazonaws.com/prod-ucs-content-store-eu-west/content/pii:S0021951724003609/gr8/THUMBNAIL/image/gif/7059e8f235ecbf7414492582271c6692/gr8.sml gr8 gr8.sml sml 12381 164 190 IMAGE-THUMBNAIL 1-s2.0-S0021951724003609-ga1.sml https://s3-eu-west-1.amazonaws.com/prod-ucs-content-store-eu-west/content/pii:S0021951724003609/ga1/THUMBNAIL/image/gif/e5e6edf821d507aa9c1babdd8327634f/ga1.sml ga1 true ga1.sml sml 10636 135 219 IMAGE-THUMBNAIL 1-s2.0-S0021951724003609-gr11.sml https://s3-eu-west-1.amazonaws.com/prod-ucs-content-store-eu-west/content/pii:S0021951724003609/gr11/THUMBNAIL/image/gif/e47edd0660eab0156e5c6ffb7b0fd205/gr11.sml gr11 gr11.sml sml 13907 88 219 IMAGE-THUMBNAIL 1-s2.0-S0021951724003609-gr10.sml https://s3-eu-west-1.amazonaws.com/prod-ucs-content-store-eu-west/content/pii:S0021951724003609/gr10/THUMBNAIL/image/gif/dccdfacd591147e9f829b4b5294ddeca/gr10.sml gr10 gr10.sml sml 4850 60 219 IMAGE-THUMBNAIL 1-s2.0-S0021951724003609-gr13.sml https://s3-eu-west-1.amazonaws.com/prod-ucs-content-store-eu-west/content/pii:S0021951724003609/gr13/THUMBNAIL/image/gif/170f994b3c6e7857ee74b4dcbdbe5e30/gr13.sml gr13 gr13.sml sml 7256 56 219 IMAGE-THUMBNAIL 1-s2.0-S0021951724003609-gr12.sml https://s3-eu-west-1.amazonaws.com/prod-ucs-content-store-eu-west/content/pii:S0021951724003609/gr12/THUMBNAIL/image/gif/51e5e602ce6b5f3645507544685a8a03/gr12.sml gr12 gr12.sml sml 8937 163 219 IMAGE-THUMBNAIL 1-s2.0-S0021951724003609-gr1.sml https://s3-eu-west-1.amazonaws.com/prod-ucs-content-store-eu-west/content/pii:S0021951724003609/gr1/THUMBNAIL/image/gif/cff856982763a426fe1d0db3ed3a3145/gr1.sml gr1 gr1.sml sml 6821 74 219 IMAGE-THUMBNAIL 1-s2.0-S0021951724003609-gr2.sml https://s3-eu-west-1.amazonaws.com/prod-ucs-content-store-eu-west/content/pii:S0021951724003828/gr2/THUMBNAIL/image/gif/61696c43c412c7e52e3343b3fb8d1a6a/gr2.sml gr2 gr2.sml sml 6365 73 219 IMAGE-THUMBNAIL 1-s2.0-S0021951724003609-gr5_lrg.jpg https://s3-eu-west-1.amazonaws.com/prod-ucs-content-store-eu-west/content/pii:S0021951724003609/HIGHRES/image/jpeg/5d432dfb3963ff500e5f2891f3be9f7f/gr5_lrg.jpg gr5 gr5_lrg.jpg jpg 227715 1098 2368 IMAGE-HIGH-RES 1-s2.0-S0021951724003609-gr6_lrg.jpg https://s3-eu-west-1.amazonaws.com/prod-ucs-content-store-eu-west/content/pii:S0021951724003609/HIGHRES/image/jpeg/53e2e5964cc016bf7ae3fd8e204a3c02/gr6_lrg.jpg gr6 gr6_lrg.jpg jpg 182776 1022 1280 IMAGE-HIGH-RES 1-s2.0-S0021951724003609-gr3_lrg.jpg https://s3-eu-west-1.amazonaws.com/prod-ucs-content-store-eu-west/content/pii:S0021951724003609/HIGHRES/image/jpeg/b48b7f447757a1ff5b74e39455f8886d/gr3_lrg.jpg gr3 gr3_lrg.jpg jpg 839193 1760 2758 IMAGE-HIGH-RES 1-s2.0-S0021951724003609-gr4_lrg.jpg https://s3-eu-west-1.amazonaws.com/prod-ucs-content-store-eu-west/content/pii:S0021951724003609/HIGHRES/image/jpeg/b47a4c7b24c61f5ab6cf8959d9ff4092/gr4_lrg.jpg gr4 gr4_lrg.jpg jpg 294137 871 2362 IMAGE-HIGH-RES 1-s2.0-S0021951724003609-gr9_lrg.jpg https://s3-eu-west-1.amazonaws.com/prod-ucs-content-store-eu-west/content/pii:S0021951724003609/HIGHRES/image/jpeg/c25c192ad5dcbf1c334792c37609dcaa/gr9_lrg.jpg gr9 gr9_lrg.jpg jpg 549754 3241 1280 IMAGE-HIGH-RES 1-s2.0-S0021951724003609-gr7_lrg.jpg https://s3-eu-west-1.amazonaws.com/prod-ucs-content-store-eu-west/content/pii:S0021951724003609/HIGHRES/image/jpeg/7025815f1581cca65b977c63276821ba/gr7_lrg.jpg gr7 gr7_lrg.jpg jpg 377349 945 2362 IMAGE-HIGH-RES 1-s2.0-S0021951724003609-gr8_lrg.jpg https://s3-eu-west-1.amazonaws.com/prod-ucs-content-store-eu-west/content/pii:S0021951724003609/HIGHRES/image/jpeg/ded6bbd6bbc518ed1928642f06f01ee7/gr8_lrg.jpg gr8 gr8_lrg.jpg jpg 566066 2042 2363 IMAGE-HIGH-RES 1-s2.0-S0021951724003609-ga1_lrg.jpg https://s3-eu-west-1.amazonaws.com/prod-ucs-content-store-eu-west/content/pii:S0021951724003609/HIGHRES/image/jpeg/392417f0a257f02aa4c45a99468d7410/ga1_lrg.jpg ga1 true ga1_lrg.jpg jpg 93915 886 1440 IMAGE-HIGH-RES 1-s2.0-S0021951724003609-gr11_lrg.jpg https://s3-eu-west-1.amazonaws.com/prod-ucs-content-store-eu-west/content/pii:S0021951724003609/HIGHRES/image/jpeg/d903ec8a63cd3c8389824a0166e1f552/gr11_lrg.jpg gr11 gr11_lrg.jpg jpg 860909 1314 3256 IMAGE-HIGH-RES 1-s2.0-S0021951724003609-gr10_lrg.jpg https://s3-eu-west-1.amazonaws.com/prod-ucs-content-store-eu-west/content/pii:S0021951724003609/HIGHRES/image/jpeg/da14d0ba8029feaa74706f2a2e917c1f/gr10_lrg.jpg gr10 gr10_lrg.jpg jpg 247659 755 2757 IMAGE-HIGH-RES 1-s2.0-S0021951724003609-gr13_lrg.jpg https://s3-eu-west-1.amazonaws.com/prod-ucs-content-store-eu-west/content/pii:S0021951724003609/HIGHRES/image/jpeg/77e0fafe5f759a247e8570f466b16161/gr13_lrg.jpg gr13 gr13_lrg.jpg jpg 246111 870 3426 IMAGE-HIGH-RES 1-s2.0-S0021951724003609-gr12_lrg.jpg https://s3-eu-west-1.amazonaws.com/prod-ucs-content-store-eu-west/content/pii:S0021951724003609/HIGHRES/image/jpeg/18e3f3204730ef395d480843387d9522/gr12_lrg.jpg gr12 gr12_lrg.jpg jpg 151825 954 1280 IMAGE-HIGH-RES 1-s2.0-S0021951724003609-gr1_lrg.jpg https://s3-eu-west-1.amazonaws.com/prod-ucs-content-store-eu-west/content/pii:S0021951724003828/HIGHRES/image/jpeg/6dc8feb13ab0c82cf9cd4535d34f462e/gr1_lrg.jpg gr1 gr1_lrg.jpg jpg 311226 795 2362 IMAGE-HIGH-RES 1-s2.0-S0021951724003609-gr2_lrg.jpg https://s3-eu-west-1.amazonaws.com/prod-ucs-content-store-eu-west/content/pii:S0021951724003828/HIGHRES/image/jpeg/f91922f1df446c327c8a8ef1c672cfb3/gr2_lrg.jpg gr2 gr2_lrg.jpg jpg 301037 789 2362 IMAGE-HIGH-RES 1-s2.0-S0021951724003609-mmc1.pdf https://s3-eu-west-1.amazonaws.com/prod-ucs-content-store-eu-west/content/pii:S0021951724003609/mmc1/MAIN/application/pdf/d8686332aa0b6b7508940ba742dcee46/mmc1.pdf mmc1 mmc1.pdf pdf false 2391354 APPLICATION 1-s2.0-S0021951724003609-si1.svg https://s3-eu-west-1.amazonaws.com/prod-ucs-content-store-eu-west/content/pii:S0021951724003609/image/svg+xml/2100ab754749b02e40347ae4940c872b/si1.svg si1 si1.svg svg 6602 ALTIMG 1-s2.0-S0021951724003609-si10.svg https://s3-eu-west-1.amazonaws.com/prod-ucs-content-store-eu-west/content/pii:S0021951724003609/image/svg+xml/d87b6c12996d1a9181f3c0e7865a8728/si10.svg si10 si10.svg svg 26267 ALTIMG 1-s2.0-S0021951724003609-si2.svg https://s3-eu-west-1.amazonaws.com/prod-ucs-content-store-eu-west/content/pii:S0021951724003609/image/svg+xml/ff45e96d242f8419c3aa1a579b6d77fc/si2.svg si2 si2.svg svg 6415 ALTIMG 1-s2.0-S0021951724003609-si3.svg https://s3-eu-west-1.amazonaws.com/prod-ucs-content-store-eu-west/content/pii:S0021951724003609/image/svg+xml/89320ffb645074146bde3f7c7829489d/si3.svg si3 si3.svg svg 6066 ALTIMG 1-s2.0-S0021951724003609-si4.svg https://s3-eu-west-1.amazonaws.com/prod-ucs-content-store-eu-west/content/pii:S0021951724003609/image/svg+xml/5fc3817a6421e26f501431f3011024bc/si4.svg si4 si4.svg svg 34354 ALTIMG 1-s2.0-S0021951724003609-si5.svg https://s3-eu-west-1.amazonaws.com/prod-ucs-content-store-eu-west/content/pii:S0021951724003609/image/svg+xml/7443bb36d1ec7c44e09c6311c9897f55/si5.svg si5 si5.svg svg 24454 ALTIMG 1-s2.0-S0021951724003609-si6.svg https://s3-eu-west-1.amazonaws.com/prod-ucs-content-store-eu-west/content/pii:S0021951724003609/image/svg+xml/aaa299b31f3726e8361103dbe2c0e48b/si6.svg si6 si6.svg svg 25162 ALTIMG 1-s2.0-S0021951724003609-si7.svg https://s3-eu-west-1.amazonaws.com/prod-ucs-content-store-eu-west/content/pii:S0021951724003609/image/svg+xml/fad28def4f469e43ee11990e27d429dc/si7.svg si7 si7.svg svg 55355 ALTIMG 1-s2.0-S0021951724003609-si8.svg https://s3-eu-west-1.amazonaws.com/prod-ucs-content-store-eu-west/content/pii:S0021951724003609/image/svg+xml/8a1df6c55b980e5dc599f1321d81e5fa/si8.svg si8 si8.svg svg 49732 ALTIMG 1-s2.0-S0021951724003609-si9.svg https://s3-eu-west-1.amazonaws.com/prod-ucs-content-store-eu-west/content/pii:S0021951724003609/image/svg+xml/4af1c5f328183310406b56ec81998300/si9.svg si9 si9.svg svg 30175 ALTIMG 1-s2.0-S0021951724003609-am.pdf am am.pdf pdf 2402109 AAM-PDF https://s3-eu-west-1.amazonaws.com/prod-ucs-content-store-eu-west/content/egi:1050MBTNVC3/MAIN/application/pdf/cbb116c3471af011bd9c45bc8989dbfa/am.pdf YJCAT 115647 115647 S0021-9517(24)00360-9 10.1016/j.jcat.2024.115647 Elsevier Inc. Fig. 1 Comparison of catalytic activity among the two catalysts for propane dehydrogenation. (A) Conversion of propane and (B) yield of propylene. The detailed propylene selectivity, carbon balance, and linear fit of kd are summarized in Figs. S2 and S4. Test conditions: 0.1 g of catalyst was pre-reduced under 5.0 % H2/Ar (20 mL/min) at 550 °C for 2 h, and then switched to Ar gas (20 mL/min) for 1 h. Reactant feed: 5.0 % C3H8/Ar with a WHSV of 2.9 h−1 (for a total flow of 50 mL/min). The equilibrium conversion of 73.4 % was obtained by Aspen software as shown in Fig. S1. Fig. 2 The stability of the 0.5Pt/Zn@S-1 catalyst and the deactivation study. (A) tested at a WHSV of 49.1 h−1 (for a total flow of 50 mL/min of 25.0 % C3H8/Ar) and the theoretical equilibrium conversion of 47.8 % (shown in Fig. S1). Test conditions: 0.030 g of catalyst was pre-reduced under 5.0 % H2/Ar (20 mL/min) at 550 °C for 2 h, and then switched to Ar gas (20 mL/min) for 1 h. (B) The deactivation study and the theoretical equilibrium conversion of 29.8 % (shown in Fig. S1). The propylene turnover rate as a function of time-on-stream of the 0.5Pt/Zn@S-1 catalyst, was tested at a WHSV of 94.2 h−1 (for a total flow of 8 mL/min of pure C3H8). More results are shown in Figs. S5–S7 . Test conditions: 0.010 g of catalyst was pre-reduced under 5.0 % H2/Ar (20 mL/min) at 550 °C for 2 h, and then switched to Ar gas (20 mL/min) for 1 h. Fig. 3 The TEM analysis of the fresh 0.5Pt/Zn@S-1 catalyst. (A-C) The bright field (BF) TEM images with different scales, (D) HAADF-STEM image, (E) EDS analysis of Pt and Zn element distribution, and (F) line scans along the red arrow in (E). (For interpretation of the references to colour in this figure legend, the reader is referred to the web version of this article.) Fig. 4 The properties of the pore structure of the catalysts. (A) N2 physical adsorption–desorption isotherms and (B) pore size distribution. Fig. 5 Analysis of the relation between surface functional groups and metal species. (A) Normalized FTIR spectrum and (B) 29Si MAS NMR in hydroxyl stretching region. Semi-quantitative areas of the silicon hydroxyl group from 29Si MAS NMR are shown in Table S4. Fig. 6 The H2-TPR profiles of the catalysts. Fig. 7 Py-IR spectra of pyridine adsorption of the fresh catalysts. (A) at 150 °C and (B) 350 °C. Brönsted (B), Lewis (L) acid sites, and hydrogen (H)-bonded pyridine adsorption. Fig. 8 Analysis of coordination environment of Pt by X-ray absorption spectrum. (A) XANES spectra, (B) the Fourier transformed EXAFS spectra, and (C, D) Pt L3-edge EXAFS (points) and curve fit (line) of the fresh (F) and used (U) 0.5Pt/Zn@S-1 catalysts. All the FT-EXAFS for the k3-weighted are plotted without phase correction. Fig. 9 The wavelet transformed EXAFS. Comparison of the wavelet transforms for the k3-weighted Pt L3-edge EXAFS signals for the high coordination shells. (A) Pt foil, (B) fresh 0.5Pt/Zn@S-1 catalyst, (C) spent 0.5Pt/Zn@S-1 catalyst. Fig. 10 The electronic structure of the catalysts. (A-C) DRIFTS-CO of (A) the 0.5Pt/S-1, (B) the 0.5Pt/Zn@S-1, and (C) 0.5Pt/2.0Zn/S-1 of fresh (F) and pre-reduced (R) by 5 % H2/Ar at 550 °C for 2 h. Fig. 11 Comparative TEM analysis of metal agglomeration phenomenon. (A-E) The spent 0.5Pt/Zn@S-1 and (F-J) 0.5Pt/2.0Zn/S-1. (C, H) representative HAADF image, (D, E, I, J) corresponding element mapping and line scan of Zn and Pt. Fig. 12 The coke analysis of the TG profiles for the catalysts. Scheme 1 Demonstration of the catalyst design. Table 1 Textural properties of the PtZn catalysts. Sample Porosity data SBJH, meso [m2/g] a St-Plot, micro [m2/g] b VBJH, meso [cm3/g] a Vt-Plot, micro [cm3/g] b 0.5Pt/2.0Zn/S-1 105 574 0.11 0.25 0.5Pt/Zn@S-1 79 438 0.08 0.19 a from the BJH adsorption method. b from the t-plot method. Table 2 Acidity derived from Py-IR analysis. Catalyst Brönsted acid site (mmol⋅g−1) Lewis acid sites (mmol⋅g−1) B/L Weak 150 °C Medium 350 °C Total Weak 150 °C Medium 350 °C Total 2.0Zn/S-1 0.015 0.012 0.027 0.257 0.091 0.348 0.078 0.5Pt/2.0Zn/S-1 0.017 0.014 0.031 0.204 0.076 0.280 0.111 Zn@S-1 0.001 0.001 0.002 0.047 0.021 0.068 0.029 0.5Pt/Zn@S-1 0.001 0.001 0.002 0.092 0.038 0.130 0.015 Table 3 Curve fit parameters of Pt L3-edge EXAFS for 0.5Pt/Zn@S-1 before and after the reaction. a. Sample Absorption Edge Path CN a R / Å σ2 / Å2 0.5Pt/Zn@S-1-F Pt L3 Pt-O 2.9 ± 1.4 2.01 ± 0.02 0.002 Pt-Zn 3.4 ± 5.1 2.72 ± 0.09 0.009 0.5Pt/Zn@S-1-U Pt L3 Pt-O 1.4 ± 0.6 1.99 ± 0.04 0.004 Pt-Zn 3.4 ± 1.3 2.64 ± 0.02 0.007 a S0 2 was fixed as 0.85 according to the fitting result of Pt foil. Zinc cations incorporated in Silicalite-1 zeolite assist in anchoring atomically dispersed platinum catalyst for boosted and robust propane dehydrogenation Peng Wang Writing – original draft Validation Methodology Investigation Formal analysis Data curation a 1 Rong Chen Validation Investigation Formal analysis a 1 Huafei Liao Validation Investigation Formal analysis Data curation a 1 Hongqiao Lin Formal analysis a Yuanjie Xu Investigation a Bo Liu Investigation a Xupeng Zong Investigation b Yihu Dai Investigation c Lizhi Wu Formal analysis a Li Tan Funding acquisition Formal analysis a Zailai Xie Investigation a Yu Tang Writing – review & editing Supervision Funding acquisition Conceptualization a ⁎ a Institute of Molecular Engineering Plus, College of Chemistry, Fuzhou University, Fuzhou 350108, China Institute of Molecular Engineering Plus College of Chemistry Fuzhou University Fuzhou 350108 China Institute of Molecular Engineering Plus, College of Chemistry, Fuzhou University, Fuzhou 350108, China b Dalian Institute of Chemical Physics, Chinese Academy of Sciences, Dalian 116023, China Dalian Institute of Chemical Physics Chinese Academy of Sciences Dalian 116023 China Dalian Institute of Chemical Physics, Chinese Academy of Sciences, Dalian 116023, China c Institute of Advanced Synthesis, School of Chemistry and Molecular Engineering, Nanjing Tech University, Nanjing 211816, China Institute of Advanced Synthesis School of Chemistry and Molecular Engineering Nanjing Tech University Nanjing 211816 China Institute of Advanced Synthesis, School of Chemistry and Molecular Engineering, Nanjing Tech University, Nanjing 211816, China ⁎ Corresponding author. 1 equal contribution to this work. Graphical abstract The utilization of Pt-based catalysts in the catalytic conversion of propane to propylene (PDH) remains pivotal in industrial processes. However, the scarcity of Pt and its high cost necessitates innovative strategies to enhance Pt dispersion and catalytic performance. In this study, we present an approach involving the in-situ incorporation of Zn cations into Silicalite-1 (S-1) zeolite through one-pot hydrothermal synthesis, which facilitates the anchoring of atomically dispersed Pt atoms. The synthesized 0.5Pt/Zn@S-1 catalyst exhibits the dehydrogenation performance of 25 % propane for approximately 34.2 % propane conversion and 95.1 % propylene selectivity (propylene turnover rate of 14.2 s−1), coupled with robust stability of up to 60 h without distinct deactivation under a WHSV of 49.1 h−1. Comprehensive characterizations reveal the formation of atomically dispersed Pt-Zn catalytic sites. The Pt atoms are incorporated with the Zn cations and dense silanol nests. This unique configuration facilitates a synergistic effect between Pt and Zn for dehydrogenation. Keywords Propane Propylene Dehydrogenation Platinum Zinc Deactivation Sintering Zeolite Synergistic effect Silanol nest Data availability Data will be made available on request. 1 Introduction The significance of propylene in industrial production is undeniable, as it serves as a crucial building block for various industrial intermediates that are essential raw materials used in diverse manufacturing processes.[1–5] Compared with traditional steam cracking and fluid catalytic cracking processes, direct dehydrogenation of propane (PDH) shows great advantages in raw material cost and propylene selectivity. Especially, with the increase of available shale gas resources in recent years, the purposeful production of propylene through propane has attracted more and more attention.[1–5] So far, Pt-based catalysts are still widely applied in the industrialized Oleflex process.[6,7] However, the scarcity and high cost of Pt metal usually necessitate a high dispersion with a large exposed metal area for easy accessibility of reactants. Hence, developing a Pt-based catalyst for PDH with high dispersion and good catalytic performance is needed. Strategies for improving the performance of noble-metal catalysts have been widely explored.[7–14] Precious metals with high dispersion on the support surface may easily aggregate into large particles or be poisoned by coke deposition.[15–18] The strong electronic interaction between noble metals and low-cost metals (e.g., Sn, Zn, Ga, Fe, etc.) results in a synergistic effect in bimetallic catalysts, which enhances the performance of the PDH reaction and improves the sintering resistance of highly dispersed active sites.[19–28] Due to the abundance of Zn reserves on Earth, it has become increasingly common to use it as an additive to disperse Pt sites. Zn, as a common ingredient in Pt catalysts, effectively controls the activity and selectivity in PDH reactions. Whether used as a promoter or support (e.g., ZnO), the presence of Zn has been shown to enhance the catalytic performance of Pt-catalysts in the chemoselective dehydrogenation of propane to produce propylene. Zn is a more electropositive metal that is conducive to the formation of bimetallic Pt-Zn and/or Pt-ZnOX entities,[29–31] which favor the desorption of C = C bonds, thus improving the propylene selectivity. In addition, many studies have shown that the PtZn bimetallic clusters or nanoparticles can be well anchored by defective sites inside the pores of siliceous zeolites, forming a robust metal-support structure as active sites,[21,29,32–35] which can effectively inhibit the deactivation of the active sites induced by sintering and carbon deposition. As mentioned above, incorporating Zn into Silicalite-1 (S-1) zeolite can give rise to increased catalytic performance in PDH reactions.[36] Therefore, it is worthwhile considering the effects of Zn species with distinct chemical states on stabilizing the Pt sites atomically. Herein, this work reports an approach involving the in-situ incorporation of Zn cations into Silicalite-1 (S-1) zeolite through one-pot hydrothermal synthesis, which facilitates the anchoring of atomically dispersed Pt atoms. The Zn cations were first incorporated into the S-1 zeolite to obtain Zn@S-1 by one-pot hydrothermal synthesis. Then, Pt was impregnated on Zn-modified S-1 zeolite (Zn@S-1) to produce the 0.5Pt/Zn@S-1 catalyst. The protocol is shown in Scheme 1 . The 0.5Pt/Zn@S-1 catalyst exhibits outstanding catalytic performance compared with that of 0.5Pt/2.0Zn/S-1 (this catalyst was prepared by a conventional two-step impregnation method) under the same condition. Comprehensive characterizations are applied to investigate the activity-structure correlation of the 0.5Pt/Zn@S-1 catalyst. It is revealed that the Zn cations (Znδ+) can assist in immobilizing the Pt0 active sites via the formation of a positively charged atomically dispersed bimetallic Pt0-Znδ+ structure. Moreover, the enhanced catalytic activity of 0.5Pt/Zn@S-1 is attributed to the atomically dispersed bimetallic Pt0-Znδ+ sites anchored by the dense silanol nests of the S-1 zeolite surface. This unique configuration facilitates a synergistic effect between Pt and Zn species, significantly enhancing the catalyst's performance. This work brings new insights into the design of high-performance Pt-based catalysts. 2 Experimental section 2.1 Catalyst preparation All chemicals were used as received. The modified Zn-zeolite (Zn@S-1) was synthesized by a “one-pot” hydrothermal method. In a typical synthesis, 10.0 g of tetraethyl orthosilicate (TEOS, AR, SiO2 ≥ 28.4 %, Sinopharm Chemical Reagent Co., Ltd.) was introduced into the mixture of 21.45 g H2O together with 11.71 g of tetrapropylammonium hydroxide (TPAOH, 25 wt% in water, Energy Chemical Co., Ltd.) by syringe pump at the rate of 100 μL/min. The mixture was stirred in an ice-water bath for 1 h and heated to 70 °C for 3 h. Then 12.0 g of isopropanol (IPA, AR, ≥ 99.7 %, Sinopharm Chemical Reagent Co., Ltd.) was added dropwise at a rate of 500 uL/min and stirred for 20 min. The molar composition of the gel was 1 SiO2: 4 IPA: 0.3 TPAOH: 35 H2O. Finally, 2.69 g of 0.32 M [Zn(NH2CH2CH2NH2)3](OAc)2 aqueous solution was added dropwise at a rate of 100 uL/min and stirred for 30 min. The precursor solution was then transferred to an oven at 170 °C for 4 days. After repeated washing and drying, the powers were calcined in air at 550 °C for 6 h with a heating rate of 1 °C/min. Notably, the primitive S-1 zeolite is synthesized based on the above scheme but lacks the final step of adding Zn. The actual content of Zn in the Zn@S-1 and 2.0Zn/S-1 zeolites was determined by ICP-OES ( Table S3 ). As a comparison, the 2.0Zn/S-1 catalyst was obtained by post-synthesis of the incipient-wetness impregnation method. The Pt-modified Zn@S-1 or 2.0Zn/S-1 zeolites were prepared by the incipient-wetness impregnation method. A water solution of Pt(NH3)4(NO3)2 (Pt, 50 % basis, Sigma-Aldrich) was added dropwise to the prepared zeolites. After constant stirring, the mixture was leftat room temperature for 2 h. Finally, the mixture was roasted at 353 K overnight to remove water. After grinding, it was put into a muffle furnace calcined in static air at 500 °C for 4 h with a heating rate of 3 °C/min. The content of Pt in the final catalyst was nominally fixed at 0.5 wt%. The preparation method of the 0.5Pt/S-1 catalyst is the same as above. 2.2 Catalyst characterization X-ray diffraction (XRD) patterns were applied to characterize the crystalline structure of the fresh and used catalysts on an Ultimate III diffractometer (Rigaku, Japan) at the range of 5° < 2θ < 80°. TEM images and HAADF-STEM images were recorded by FEI Talos F200S G2 microscope at 200 kV (FEI, USA). Simultaneously, the chemical components were conducted on an FEI Super-X energy-dispersive spectrum (EDS) system with a collection solid angle above 0.45 rad. The Pt dispersion was studied by CO pulse chemisorption (CO-Pulse) via a BELCAT-B analyzer (MicrotracBEL, Japan). Before the experiment, 50 mg of each sample was pre-treated using 100 mL/min H2 at 500 °C for 1 h. The actual elemental contents of the catalysts were determined by an iCAP 7000 series inductively coupled plasma optical emission spectrometer (ICP-OES, Thermo Fisher Scientific, USA). The physical properties of catalysts were studied on an ASAP 2020 plus (Micromeritics, USA). Before the test, the sample was vacuumed at 200 °C for 8 h. The BJH method and t-plot method were used to calculate the mesoporous and microporous specific surface area and volume of the catalyst, respectively. The data of FT-IR spectrum and Py-IR spectra were recorded on a Thermo-Fisher iS100 FT-IR spectrometer (USA). 29Si solid magic angle NMR (29Si MAS NMR) experiment was carried out on a 600 MHz NMR spectrometer (JEOL ECZ600R, Japan). The Shimadzu UV-2400PC instrument was applied to collect UV–Vis spectra equipped with BaSO4 for comparison. H2-TPR was carried out on an AutoChem II 2920 chemisorption analyzer (Micromeritics, USA) with a thermal conductivity detector (TCD). Before the test, 200 mg of the fresh catalyst was pretreated under flowing Ar at 400 °C for 0.5 h. The temperature was heated from 100 °C to 800 °C with a ramping rate of 10 °C min−1 under a flow of 10 % H2/Ar (30 mL/min). NH3-TPD profile of the catalyst was conducted on a Micromeritics AutoChem II 2920 chemisorption analyzer with a TCD detector. The test procedure was that 100 mg of the sample was pretreated in flowing He at 400 °C for 1 h, and then the NH3 adsorption was carried out at 40 °C for 0.5 h in 10 % NH3/He (30 mL min−1), followed by converting the flowing gas to He to remove the physical adsorption on the surface until the baseline kept stable. The NH3-TPD profile was recorded at a ramping rate of 10 °C min−1 from 100 °C to 600 °C. For the C3H6-TPD, 100 mg of the fresh catalyst was pretreated under a flow of 10 % H2/Ar (30 mL min−1) at 550 °C for 2 h. The flow gas was switched to He after the pre-reduction was complete, and cooled to 40 °C. Then, the catalyst was exposed to 5 % C3H6/Ar mixture gas for 1 h until adsorption saturation, followed by purging with He for 2 h at 100 °C to remove physical adsorption on the surface. Finally, the TPD profiles were recorded from 100 °C to 600 °C at a ramping rate of 10 °C min−1. Pt L3-edge and Zn K-edge X-ray absorption spectra in fluorescence mode were collected on BL-11B and BL-14 W1 beamlines of the Shanghai Synchrotron Radiation Facility (China). The spectra of Pt foil and Zn foil were recorded as the references. The catalyst pellets were prepared for testing under environmental conditions. According to the standard protocol, the collected XAS data was processed and analyzed by the Demeter software package[37] and using the HAMA Fortran software package for generating WT EXAFS patterns from ESRF (Morlet function, kappa = 10, sigma = 1).[38,39] The surface chemical property of the catalysts was analyzed by XPS on a Thermo Scientific ESCALAB 250 (Thermo Fisher Scientific, USA) equipped with a monochromatized Al Kα X-ray source (200 W). The binding energies were referenced to the Si 2p peak at 103.5 eV. DRIFTS-CO adsorption experiments were conducted on a Nicolet iS50 FTIR spectrometer (Thermo Fisher Scientific, USA). The experimental process was as follows: the sample was loaded into an in-situ cell (Harrick Scientific Instrument, USA), and purged by a flow of Ar (>99.99 %, 30 mL/min) at 300 °C for 0.5 h. Then the background spectrum was collected after the sample temperature was dropped to room temperature. In the end, the 10 % CO/Ar mixture gas was fed into the cell with a flow rate of 20 mL/min, followed by purging with Ar and beginning to record the DRIFTS-CO spectra. The thermogravimetric analysis (TG) of the spent catalyst was investigated using TG-DSC on a STA449F5 Jupiter thermal analyzer (Netzsch, Germany). The temperature was raised from 30 °C to 800 °C at a heating rate of 10 °C/min in air (30 mL/min). Raman spectroscopic measurements were performed on a DXRxi Raman microscope (Thermo Fisher Scientific, USA) with the excitation wavelength of 532 nm, and the wavenumbers were recorded from 400 to 3000 cm−1 with an average of 30 scans. 2.3 Catalytic activity tests The dehydrogenation of propane was carried out on a fixed-bed tubular quartz reactor at 0.1 MPa. Typically, 100 mg of catalyst was diluted with 500 mg quartz sand (40–60 mesh) and then loaded into the reaction tube with an inner diameter of 6 mm. Prior to each test, the catalyst was pre-reduced with 20 mL/min 5 % H2/Ar at 550 °C for 2 h. After that, the reactive gas of 5 % C3H8 balanced with Ar (50 mL/min) was fed into the reactor for the catalytic performance test. The propane conversion ( X C 3 H 8 ), propylene selectivity ( S C 3 H 6 ), the yield of propylene ( Y C 3 H 6 ), specific activity, carbon balance (CB), deactivation constant (kd) [33,40], and weight hour space velocity (WHSV) are calculated as the following equations: (1) C a r b o n B a l a n c e % = ( 1 / 3 [ C H 4 ] o u t + 2 / 3 [ C 2 H 6 ] o u t + 2 / 3 [ C 2 H 4 ] o u t + [ C 3 H 8 ] o u t + [ C 3 H 6 ] o u t ) / [ C 3 H 8 ] i n × 100 % (2) X C 3 H 8 % = ( [ C 3 H 8 ] i n - [ C 3 H 8 ] o u t ) / [ C 3 H 8 ] i n × 100 % (3) S C 3 H 6 % = [ C 3 H 6 ] o u t / ( [ C 3 H 8 ] i n - [ C 3 H 8 ] o u t ) × 100 % (4) S p e c i f i c a c t i v i t y s - 1 = N u m b e r o f p r o d u c e d C 3 H 6 m o l e s p e r s e c o n d N u m b e r o f t h e w h o l e o f P t m o l e s = F C 3 H 8 × Y × M w m c a t . × W P t × 22.414 L / m o l (5) C 3 H 6 t u r n o v e r r a t e s - 1 = m o l e s o f p r o d u c e d C 3 H 6 p e r s e c o n d m o l e s o f t h e s u r f a c e P t a t o m = F C 3 H 8 × Y × M w m c a t . × W P t × P t d i s p e r s i o n × 22.414 L / m o l (6) D e a c t i v a t e c o n s t a n t k d ( h - 1 ) = [ ln 100 - X e n d X e n d - ln 100 - X i n X i n ] / T i m e (7) W H S V = mass of propane mass of catalyst × t i m e Where F represents the flow rate of hydrocarbon (L/min), Y is the yield of propylene and mcat. is the weight of catalysts (g). The mass transfer limitation is analyzed in Note S1. Under the catalytic evaluation, the measured activity is not limited by external or internal mass transfer. In addition, 25 % or pure propane gas was used in the PDH test with high propane concentration and deactivation test. 3 Results and discussion 3.1 The propane dehydrogenation (PDH) catalytic performance and deactivation study Two kinds of zeolites, surface Zn-modified Zn@S-1 and Zn/S-1 were synthesized by “one pot” synthesis and incipient wetness impregnation, respectively.[13] Subsequently, the same amount of Pt was loaded for further investigation. Two catalysts, 0.5Pt/Zn@S-1 and 0.5Pt/2.0Zn/S-1 were obtained and evaluated for the catalytic performance in the same PDH reaction. The catalytic performance was tested using 5 % C3H8/Ar as reactant gas without adding H2 (Fig. 1 ). The propane conversion of 0.5Pt/Zn@S-1 catalyst remained at ∼ 69.8 % after 40 h (Fig. 1 A). The theoretical equilibrium conversion calculated by Aspen is ∼ 73.4 % at 550 °C ( Fig. S1 ), while the measured initial conversion of propane is ∼ 71.8 %, this result illustrates that the synthesis method playing a critical role in maximizing exposure of its active sites. As the control experiment with the same usage of Pt, the initial propane conversion of 0.5Pt/2.0Zn/S-1 catalyst is ∼ 53.4 % and decreased to 26.6 % after 40 h of reaction (Fig. 1 B), which indicates that the catalytic active sites changed significantly during the reaction. The long-term stability under realistic and harsher reactions is a crucial factor in assessing the catalyst merit. The optimal catalyst is tested at a relatively harsh reactant gas concentration of 25 % propane. It is gratifying that the catalytic stability of up to 60 h without distinct deactivation (Fig. 2 A), testifies to the robust structure of active sites for 0.5Pt/Zn@S-1. Furthermore, considering that all the PDH catalysts eventually deactivate, the deactivation of the designed catalyst was accelerated by harsh reaction condition. The deactivation was carried out under the reaction condition of pure propane gas with a WHSV of 94.2 h−1 at 550 °C. The high WHSV is adopted to control the propane conversion below the thermodynamic equilibrium ( Fig. S1 ). As shown in Fig. S6 , the propane conversion of 0.5Pt/Zn@S-1 catalyst decreased from 26.2 % to 14.6 % with the selectivity toward propylene of 96.5 % after 28 h of reaction. Notably, the remarkable propylene turnover rate [41] of 14.2 s−1 and accumulative turnover numbers of 988,341 per surface Pt site for 28 h of reaction (Fig. 2 B and Fig. S7 ). The comparison of the reported catalyst activity shown in Table S2 fully reflect its catalytic activity and catalytic stability. However, the regeneration results of the catalyst suggest it cannot be restored after 2nd regeneration ( Fig. S6 ). The corresponding analysis for the permanent deactivation of this catalyst is due to the severe sintering of active metals during the regeneration protocol, as detailed discussed in Note S1. Moreover, the best-performance 0.5Pt/Zn@S-1 catalyst is superior to that of most Pt-based catalysts reported in the literature.[29,30,42–49] Compared with the very low propane conversion of monometallic 0.5Pt/S-1 and/or Zn@S-1 ( Fig. S3 ), the bimetallic PtZn catalyst exhibits enough excellent PDH performance. Therefore, it is necessary to investigate the structure of the PtZn sites, and further unveil the structure feature of 0.5Pt/Zn@S-1 distinct from 0.5Pt/2.0Zn/S-1. 3.2 Micro-structure characterization of the 0.5Pt/Zn@S-1 catalyst The XRD patterns ( Fig. S12 ) show that all the synthesized samples are the typical MFI structure.[50] The maintained peaks at 7.9°, 8.8°, 23.1°, 23.8°, and 24.3° of the Zn@S-1 zeolite indicate that the addition of Zn in the synthesis process does not change the MFI structure. No diffraction signals of Pt or Zn species are distinguished in these fresh samples, suggesting that Pt/Zn particles are highly dispersed or the size of crystal grains is difficult to detect. Therefore, TEM was carried out to further observe the morphology of metal particles. As shown in the bright-field TEM (BF-TEM) and dark-field TEM (DF-TEM) (Fig. 3 and Fig. S13 ), there are no visible particles existing in the fresh 0.5Pt/Zn@S-1. Combined with EDS and line scan, it is indicated that the Pt and Zn species are uniformly distributed in the inner surface of zeolite pores. In addition, the actual metal loading of the catalysts was determined based on ICP-OES shown in Table S3 . The loading of Pt is similar with around 0.3 ∼ 0.4 wt%, while the loading of Zn in the spent catalysts decreases, which is attributed to the loss of weak bounded Zn under the reaction conditions.[51,52]. The structure properties of zeolite pores over the prepared 0.5Pt/2.0Zn/S-1 and 0.5Pt/Zn@S-1 catalysts were analyzed via nitrogen adsorption–desorption. The adsorption branches of both catalysts are type II (Fig. 4 A) patterns, typical for microporous materials. However, the N2 uptake of 0.5Pt/2.0Zn/S-1 catalyst is higher than that of 0.5Pt/Zn@S-1 catalyst, which indicates that different synthesis methods will affect the pore structure. The pore size distribution in Fig. 4 B shows that the pore structures of the two catalysts are slightly different, the amounts of micropores on the 0.5Pt/Zn@S-1 catalyst is more than that of 0.5Pt/2.0Zn/S-1 catalyst. However, the micro-mesoporous surface area and pore volume of 0.5Pt/2.0Zn/S-1 catalyst is larger than those of 0.5Pt/Zn@S-1 catalyst (Table 1 ). Therefore, this result shows that the reason for the high dispersion of 0.5Pt/Zn@S-1 catalyst is not due to physical properties, but owning to Zn modification in different local positions in zeolite. 3.3 The incorporation of Zn and Pt into the zeolite in the 0.5Pt/Zn@S-1 catalyst The interaction between the silanol groups and metal species was studied by the FTIR spectrum. The FTIR spectra of the primitive S-1 zeolite exhibit two major absorption peaks at 3722 and 3500 cm−1 (Fig. 5 A), the one at 3722 cm−1 corresponds to external isolated silanol groups.[29,53] The other band at 3500 cm−1 is associated with hydrogen-bonded silanol groups, i.e., silanol nests or defect sites.[32] In the case of Zn@S-1, the peak intensity of the silanol nests is found to decline compared with pristine S-1. When Pt is further introduced, the intensity of the overall hydroxyl groups decreases slightly. According to the previous report, the major silanol nests are located in the pores of zeolites, while the isolated silanol group is located on the external surface.[54,55] Therefore, it can be speculated that Zn species are predominantly trapped by silanol nests in the pores of Zn@S-1. In addition, the metal-support interactions of the prepared catalysts were further demonstrated by 29Si MAS NMR (Fig. 5 B and Table S4 ). The resonance at −103.0 ppm is assigned to the framework Si-OH groups (Si(OSi)3(OH), Q3),[32,56] the other bands at −113.2 and −115.4 ppm are attributed to framework Si(SiO)4 species (Q4).[32,56] The decreasing intensity of the band at −103.0 ppm with the introduction of Zn and Pt is consistent with the IR results, indicating Pt and/or Zn species are trapped by the silanol nest of S-1 zeolite. To further clarify the detailed location of Zn species in S-1 zeolite, UV–vis analysis was conducted as shown in Fig. S14 . As a contrast, a strong ultraviolet absorption edge located at ∼ 370 nm is observed for commercial ZnO nanoparticles, which is ascribed to the charge transfer from O2– to Zn2+.[21,32] In the case of both modified 2.0Zn/S-1 and Zn@S-1 zeolites, no signal was detected at the wavelength of 370 nm, indicating that the introduced Zn species does not form ZnO crystalline domain on the S-1 surface or the highly dispersed ZnO clusters are below the detection limit. For 0.5Pt/2.0Zn/S-1 and 0.5Pt/Zn@S-1, the existence of a sharp band below 240 nm is generally corresponding to the Si-O-Zn structure.[21,32] Moreover, the order of absorption band intensity (ca. ∼ 205 nm) is 0.5Pt/Zn@S-1 > 0.5Pt/2.0Zn/S-1 > S-1, which may be associated with the formation of more Si-O-Zn structure. Thus, it can be inferred that Zn cations mainly exist in the 0.5Pt/Zn@S-1 catalyst. The regulated metal-support interaction can usually be reflected by the reducibility of metal species on zeolites and studied by H2-TPR. As shown in Fig. 6 , there is no visible reduction peak of the 0.5Pt/S-1. The formed Zn species of the two 2.0Zn/S-1 and Zn@S-1 samples from different synthesis methods caused distinct reduction peaks, which correspond to external oxidized Zn species. However, a weak signal of H2 consumption appears on 0.5Pt/Zn@S-1 and 0.5Pt/2.0Zn/S-1 catalysts, indicating that the introduction of Pt promoted the reduction of oxidized Zn species. Moreover, the reduction peak at ∼ 390 °C of 0.5Pt/Zn@S-1 catalyst is slightly lower than that of 0.5Pt/2.0Zn/S-1 catalyst (∼415 °C) ( Table S5 ), associated with their different particle sizes. In addition, the faint H2 consumption may correspond to a small proportion of surface ZnO engaged in the reduction process. Above FTIR, 29Si NMR, UV–Vis, and H2-TPR results show that in the 0.5Pt/Zn@S-1 catalyst, the confined Zn species are anchored by abundant silanol functional groups on the internal surface of S-1 zeolite, and are incorporated into the “defect sites” of zeolite to form framework Zn species. The post-impregnated Pt modulates the reduction properties of Zn, and the stable bimetallic structure can be constructed by harnessing the structural stability of framework Zn. 3.4 The surface reactivity of the 0.5Pt/Zn@S-1 catalyst The acidity of the prepared catalysts is studied by NH3-TPD. As shown in Fig. S15 , the S-1 and 0.5Pt/S-1 show no significant acidity. When Zn species was introduced into these catalysts, a big and broad peak centered at ∼ 200 °C is assigned to weak acidity.[57] The above results show that Zn species can modify the surface acidity property of pure-silica S-1 zeolite. Py-IR spectrum was also applied to further study the types of acidic sites. As presented in Fig. 7 , the primitive S-1 zeolite has no surface acid signal. The vibration bands at 1444 and 1597 cm−1 of 0.5Pt/S-1 are attributed to hydrogen (H)-bonded pyridine adsorption,[58,59] at the same time as indicates that Pt species will not cause acidity. As for 2.0Zn/S-1 and Zn@S-1 zeolites, the vibration bands at 1450 and 1540 cm−1 belonged to Lewis (L) and Brönsted (B) acid sites, respectively.[60,61] Combining with the semi-quantitative analysis for the amounts of L and B acid sites (Table 2 ), it shows that the Zn species mainly produces L acid sites, and the B/L ratio of 0.5Pt/Zn@S-1 catalyst is 0.015, which is lower than that of 0.111 for the 0.5Pt/2.0Zn/S-1 catalyst. Furthermore, the adsorption properties of the product over the catalysts were investigated by C3H6-TPD. Fig. S16 shows that the changes in propylene adsorption on the catalysts are kept in good line with the changes in the surface acidic property. To be specific, the desorption peak appears with the introduction of Zn. The peak centered at ∼ 200 °C indicates that propylene weakly interacts with the catalyst surface.[62] Hence, the altered nature of the catalyst surface for product adsorption is caused by the Zn species, and at the same time, the acidic sites generated by Zn species do not hamper the propylene selectivity. 3.5 Chemical state and coordination environment of atomically dispersed Pt active sites in the catalyst The detailed coordination structure of the catalytic active site of 0.5Pt/Zn@S-1 catalyst before and after the reaction was studied by X-ray absorption spectrum.[63] In the XANES spectra of the Pt L3 edge (Fig. 8 A), the height of the white line on the Pt L3-edge over the fresh 0.5Pt/Zn@S-1 catalyst is the same as that of the PtO2, but that of the spent catalyst is near to that of Pt foil. In other words, the oxidized Pt species are reduced to the metallic Pt0 active sites during the reaction condition, which follows the previous reports.[29,33] In the XANES spectra of Zn K-edge ( Fig. S17 A), the white line of the 0.5Pt/Zn@S-1 catalyst did not change significantly before and after the reaction. As shown in Fourier transformed EXAFS spectrum (Fig. 8 B), the peaks located at 1.60 Å and 2.64 Å are corresponded to PtO2 and Pt foil, while the peak of 2.25 Å located in between PtO2 and Pt foil attributed to Pt-Zn path. Moreover, the detailed coordination environment of the samples is further determined by the Fourier-transformed EXAFS of Pt L3-edge and Zn K-edge (Fig. 8 , Fig. S17 -18 and Table 3 , Table S6 ). The coordination numbers of Pt-O and Pt-Zn paths of the 0.5Pt/Zn@S-1 catalyst after the reaction (0.5Pt/Zn@S-1-U) are 1.4 ± 0.6 and 3.4 ± 1.3, respectively. The lack of a Pt-Pt path excludes the presence of Pt particles in a metallic state and suggests the atomically dispersed Pt1Znm bimetallic sites in the zeolite.[64–69] However, it is worth mentioning that the peak intensities of 0.5Pt/Zn@S-1 catalyst before and after the reaction in the EXAFS spectra (Fig. 8 B) are quite different, which may be because more Pt-O species are transformed into Pt-Zn structure during the reaction, consistentwith the observation in Pt L3-edge XANES spectrum. Compared with the pre-reduced 0.5Pt/S-1 sample existed the metallic Pt particles with the coordination number of 9.4 ± 1.5, the Pt-Pt bond is interrupted by the introduced Zn species of the pre-reduced 0.5Pt/2.0Zn/S-1, forming the Pt-Zn bond with the coordination number of 6.5 ± 2.0 ( Fig. S19 and Table S7 ). Therefore, the bimetallic nanoparticles of PtZn are formed after reduction treatment for 0.5Pt/2.0Zn/S-1 catalyst. Furthermore, the wavelet-transformed (WT) EXAFS spectrum is applied to examine the coordination environment more intuitively ( Fig. 9 and Fig. S20 ).[70] Three distinct different WT maxima of around 11.4 Å−1, 7.6 Å−1, and 9.0 Å−1 are attributed to the Pt-Pt, Pt-O, and Pt-Zn path, respectively. Combined with the EXAFS and (WT) EXAFS in Zn K-edge, only the primary first scattering shell of Zn-O is observed, indicating the Zn are mainly coordinated with O atoms in the catalyst. Considering the XAS is a bulk technique, it is deduced that only a little portion of Zn atoms are coordinated with Pt. In-situ DRIFTS-CO was also used to study the electronic structure of the Pt active site. The fresh 0.5Pt/S-1 catalyst shows a linear adsorption peak of CO located at 2068 cm−1, while the pre-reduced catalyst has an additional CO linear adsorption peak of 2046 cm−1, indicating two kinds of Pt atoms are co-existed as metallic nanoparticles in the spent 0.5Pt/S-1 (Fig. 10 A). Similarly, the two same peaks of 2068 cm−1 and 2047 cm−1 appeared in the 0.5Pt/Zn@S-1 catalyst after the pre-reduction, and there is an extra CO adsorption peak at around ∼ 1998 cm−1. Meanwhile, the absence of the signals appearing in the range of 2100–2200 cm−1 implies the trace amount of oxidized Pt species is below the detection limit of FTIR. Furthermore, noblue shiftphenomenonalso demonstrates that the valence state of Pt active sites remains metallic (i.e. Pt0 sites) of 0.5Pt/Zn@S-1 catalyst during the reduction process (Fig. 10 B). However, the 0.5Pt/2.0Zn/S-1 catalyst only shows a linear adsorption band of CO and accompanies with a red shift after pre-reduction (Fig. 10 C). In a nutshell, the role of Zn species plays a role in modulating the geometry and coordination environment of Pt sites, which is in line with XANES spectra. Furthermore, based on the CO pulse experiment ( Fig. S22 ), it can be seen that the Pt dispersions of monometallic 0.5Pt/S-1 and 0.5Pt/2.0Zn/S-1 catalysts are 10.7 % and 21.4 %, respectively. The 0.5Pt/Zn@S-1 catalyst has the highest Pt dispersion of 42.1 %. The relationship between the Pt sites and Zn species causes the Pt active site structure to be atom dispersed but not completely exposed on the surface in terms of quantity. This result demonstrates that the intimate relationship between Pt and Zn in 0.5Pt/2.0Zn/S-1 catalyst will lead to Zn species on the surface covering part of Pt sites. Interestingly, the Zn species on the surface of Zn@S-1 zeolite modified by confinement promote the dispersion of Pt sites and effectively improve the PDH performance of 0.5Pt/Zn@S-1 bimetallic catalyst. To sum up, the detailed coordination structure of atomically dispersed Pt1Zn3 sites is analyzed by the Fourier-transformed EXAFS and the wavelet-transformed EXAFS. Moreover, the XANES and DRIFTS-CO characterizations indicate that the positively charged atomically dispersed bimetallic Pt-Zn structure serves as active sites. As a result, the derived synergic effect between Pt and Zn species contributes to enhancing the PDH performance. 3.6 The investigation into the spent catalyst to unveil the origination of stability The morphology of the spent catalysts was also studied by TEM (Fig. 11 ). It can be seen that the 0.5Pt/Zn@S-1 catalyst is still consistent with the fresh counterpart, even though it suffered from 40 h of PDH reaction. Moreover, no metal particles can be observed in dark-field TEM images of the spent 0.5Pt/Zn@S-1 catalyst ( Fig. S23 ). As for the spent 0.5Pt/2.0Zn/S-1 catalyst, larger PtZn particles are unevenly distributed on the surface of the catalyst, which may be associated with fast deactivation. In contrast, the big bright spot in the dark field TEM images of 0.5Pt/2.0Zn/S-1 catalyst represents the agglomeration of metal particles ( Fig. S24 ). The result of dot scanning shows the compact interaction between Pt and Zn species. Furthermore, EDS and line scanning also show an apparent discrepancy in sintering resistance on these two catalysts. To further explore the coke resistance of catalysts, the spent catalysts were analyzed by TG accordingly, as presented in Fig. 12 . As can be seen from Fig. 12, the carbon deposition of 8.4 % over the 0.5Pt/2.0Zn/S-1 catalyst is more serious than that of 5.7 % over 0.5Pt/Zn@S-1 catalyst, elucidating that the encapsulated Zn species effectively improve coking resistance of 0.5Pt/Zn@S-1 catalyst. Moreover, the Raman spectrum has no stretching vibration signal of carbonaceous species ( Fig. S25 ), which demonstrates the low carbon deposition on the catalyst surface. 4 Conclusions In summary, modified Zn-zeolites synthesized by different strategies were used as substances to support Pt. The 0.5Pt/Zn@S-1 catalyst shows a propane (25 % C3H8 in Ar) dehydrogenation performance with ∼ 34.2 % propane conversion and ∼ 95.1 % propylene selectivity (propylene turnover rate of 14.2 s−1 under a WHSV of 94.2 h−1 of pure C3H8). Moreover, the optimal catalyst exhibits the catalytic stability of up to 60 h without distinct deactivation under a WHSV of 49.1 h−1, further indicating the robust structure of active sites for 0.5Pt/Zn@S-1. However, the deactivation in pure propane and regeneration in air under harsh conditions of the catalyst suggest it cannot be restored after 2nd regeneration due to aggregation of metals. As indicated by FT-IR, 29Si MAS NMR, and XAS spectrum, the dense silanol nests assist in obtaining the robustness of the confined Pt-Zn bimetallic structure, thus realizing the synergistic effect between Pt and Zn species. Compared with the 0.5Pt/2.0Zn/S-1 catalyst, the 0.5Pt/Zn@S-1 catalyst proves that confined Zn species are more beneficial to promote the Pt dispersion, and forming atomically dispersed Pt1Zn3 sites. This work provides an effective reference for designing highly dispersed precious metal-zeolite catalysts with superior catalytic performance. CRediT authorship contribution statement Peng Wang: Writing – original draft, Validation, Methodology, Investigation, Formal analysis, Data curation. Rong Chen: Validation, Investigation, Formal analysis. Huafei Liao: Validation, Investigation, Formal analysis, Data curation. Hongqiao Lin: Formal analysis. Yuanjie Xu: Investigation. Bo Liu: Investigation. Xupeng Zong: Investigation. Yihu Dai: Investigation. Lizhi Wu: Formal analysis. Li Tan: Funding acquisition, Formal analysis. Zailai Xie: Investigation. Yu Tang: Writing – review & editing, Supervision, Funding acquisition, Conceptualization. Declaration of competing interest The authors declare that they have no known competing financial interests or personal relationships that could have appeared to influence the work reported in this paper. Acknowledgments This work is supported by the National Natural Science Foundation of China (21902027, U19B2003, U22A20431, 22172032, and 22202047), the Natural Science Foundation of Fujian Province (2022 J05110). The X-ray experiment was supported by BL-11B and BL-14 W1, Shanghai Synchrotron Radiation Facility (j21sr004, 2022-SSRF-PT-501293 and 2023-SSRF-PT-504535). Appendix A Supplementary data Supplementary data to this article can be found online at https://doi.org/10.1016/j.jcat.2024.115647. Appendix A Supplementary data The following are the Supplementary data to this article: Supplementary Data 1 References [1] Y. Dai X. Gao Q. Wang X. Wan C. Zhou Y. Yang Recent progress in heterogeneous metal and metal oxide catalysts for direct dehydrogenation of ethane and propane Chem. Soc. Rev. 50 2021 5590 5630 Y. Dai, X. Gao, Q. Wang, X. Wan, C. Zhou, Y. Yang, Recent progress in heterogeneous metal and metal oxide catalysts for direct dehydrogenation of ethane and propane, Chem. Soc. Rev., 50 (2021) 5590-5630. [2] Z. Qu Q. Sun Advances in zeolite-supported metal catalysts for propane dehydrogenation Inorg. Chem. Front. 9 2022 3095 3115 Z. Qu, Q. Sun, Advances in zeolite-supported metal catalysts for propane dehydrogenation, Inorg. Chem. Front., 9 (2022) 3095-3115. [3] X. Wei J. Cheng Y. Li K. Cheng F. Sun Q. Zhang Y. Wang Bimetallic clusters confined inside silicalite-1 for stable propane dehydrogenation Nano Res. 2023 X. Wei, J. Cheng, Y. Li, K. Cheng, F. Sun, Q. Zhang, Y. Wang, Bimetallic clusters confined inside silicalite-1 for stable propane dehydrogenation, Nano Res., (2023). [4] Y. He H. Deng Y. Zhang X. Wang W. Zheng Z. Ren L. Tan Y. Tang L. Wu Boosting propane dehydrogenation over Sn stabilizing dispersed Ptδ+ confined in Silicalite-1 at low temperature Fuel 352 2023 129044 Y. He, H. Deng, Y. Zhang, X. Wang, W. Zheng, Z. Ren, L. Tan, Y. Tang, L. Wu, Boosting propane dehydrogenation over Sn stabilizing dispersed Ptδ+ confined in Silicalite-1 at low temperature, Fuel, 352 (2023) 129044. [5] S. Song Y. Sun K. Yang Y. Fo X. Ji H. Su Z. Li C. Xu G. Huang J. Liu W. Song Recent progress in metal-molecular sieve catalysts for propane dehydrogenation ACS Catal. 13 2023 6044 6067 S. Song, Y. Sun, K. Yang, Y. Fo, X. Ji, H. Su, Z. Li, C. Xu, G. Huang, J. Liu, W. Song, Recent progress in metal-molecular sieve catalysts for propane dehydrogenation, ACS Catal., 13 (2023) 6044-6067. [6] Y. He Y. Song D.A. Cullen S. Laursen Selective and stable non-noble-metal intermetallic compound catalyst for the direct dehydrogenation of propane to propylene J. Am. Chem. Soc. 140 2018 14010 14014 Y. He, Y. Song, D.A. Cullen, S. Laursen, Selective and stable non-noble-metal intermetallic compound catalyst for the direct dehydrogenation of propane to propylene, J. Am. Chem. Soc., 140 (2018) 14010-14014. [7] R.A. Ali Hussain Motagamwala S.L. James Wortman Valentina Omoze Igenegbai, Stable and selective catalysts for propane dehydrogenation operating at thermodynamic limit Science 373 2021 217 222 R.A. Ali Hussain Motagamwala, James Wortman, S.L. Valentina Omoze Igenegbai, Stable and selective catalysts for propane dehydrogenation operating at thermodynamic limit, Science, 373 (2021) 217-222. [8] S. Zha G. Sun T. Wu J. Zhao Z.J. Zhao J. Gong Identification of Pt-based catalysts for propane dehydrogenation via a probability analysis Chem. Sci. 9 2018 3925 3931 S. Zha, G. Sun, T. Wu, J. Zhao, Z.J. Zhao, J. Gong, Identification of Pt-based catalysts for propane dehydrogenation via a probability analysis, Chem. Sci., 9 (2018) 3925-3931. [9] P. Wang J. Yao Q. Jiang X. Gao D. Lin H. Yang L. Wu Y. Tang L. Tan Stabilizing the isolated Pt sites on PtGa/Al2O3 catalyst via silica coating layers for propane dehydrogenation at low temperature Appl. Catal. b: Environ. 300 2022 120731 P. Wang, J. Yao, Q. Jiang, X. Gao, D. Lin, H. Yang, L. Wu, Y. Tang, L. Tan, Stabilizing the isolated Pt sites on PtGa/Al2O3 catalyst via silica coating layers for propane dehydrogenation at low temperature, Appl. Catal. B: Environ., 300 (2022) 120731. [10] J. Zhang Y. Deng X. Cai Y. Chen M. Peng Z. Jia Z. Jiang P. Ren S. Yao J. Xie D. Xiao X. Wen N. Wang H. Liu D. Ma Tin-assisted fully exposed platinum clusters stabilized on defect-rich graphene for dehydrogenation reaction ACS Catal. 9 2019 5998 6005 J. Zhang, Y. Deng, X. Cai, Y. Chen, M. Peng, Z. Jia, Z. Jiang, P. Ren, S. Yao, J. Xie, D. Xiao, X. Wen, N. Wang, H. Liu, D. Ma, Tin-assisted fully exposed platinum clusters stabilized on defect-rich graphene for dehydrogenation reaction, ACS Catal., 9 (2019) 5998-6005. [11] P. Wang H. Liao H. Yang Q. Lv Y. Li L. Wu Y. Tang Z. Xie L. Tan Constructing PtCe cluster catalysts by regulating metal-support interaction via Al in zeolite for propane dehydrogenation Chem. Eng. Sci. 269 2023 118450 P. Wang, H. Liao, H. Yang, Q. Lv, Y. Li, L. Wu, Y. Tang, Z. Xie, L. Tan, Constructing PtCe cluster catalysts by regulating metal-support interaction via Al in zeolite for propane dehydrogenation, Chem. Eng. Sci., 269 (2023) 118450. [12] B.F. Zhang G.Z. Li S.B. Liu Y.C. Qin L.J. Song L. Wang X.W. Zhang G.Z. Liu Boosting propane dehydrogenation over PtZn encapsulated in an epitaxial High-crystallized zeolite with a low surface barrier ACS Catal. 12 2022 1310 1314 B.F. Zhang, G.Z. Li, S.B. Liu, Y.C. Qin, L.J. Song, L. Wang, X.W. Zhang, G.Z. Liu, Boosting propane dehydrogenation over PtZn encapsulated in an epitaxial High-crystallized zeolite with a low surface barrier, ACS Catal., 12 (2022) 1310-1314. [13] L. Wu Z. Ren Y. He M. Yang Y. Yu Y. Liu L. Tan Y. Tang Atomically dispersed Co2+ sites incorporated into a Silicalite-1 zeolite framework as a high-performance and coking-resistant catalyst for propane nonoxidative dehydrogenation to propylene ACS Appl. Mater. Inter. 13 2021 48934 48948 L. Wu, Z. Ren, Y. He, M. Yang, Y. Yu, Y. Liu, L. Tan, Y. Tang, Atomically dispersed Co2+ sites incorporated into a Silicalite-1 zeolite framework as a high-performance and coking-resistant catalyst for propane nonoxidative dehydrogenation to propylene, ACS Appl. Mater. Inter., 13 (2021) 48934-48948. [14] M.-L. Sun Z.-P. Hu H.-Y. Wang Y.-J. Suo Z.-Y. Yuan Design strategies of stable catalysts for propane dehydrogenation to propylene ACS Catal. 13 2023 4719 4741 M.-L. Sun, Z.-P. Hu, H.-Y. Wang, Y.-J. Suo, Z.-Y. Yuan, Design strategies of stable catalysts for propane dehydrogenation to propylene, ACS Catal., 13 (2023) 4719-4741. [15] Y. Nakaya J. Hirayama S. Yamazoe K.I. Shimizu S. Furukawa Single-atom Pt in intermetallics as an ultrastable and selective catalyst for propane dehydrogenation Nat. Commun. 11 2020 2838 Y. Nakaya, J. Hirayama, S. Yamazoe, K.I. Shimizu, S. Furukawa, Single-atom Pt in intermetallics as an ultrastable and selective catalyst for propane dehydrogenation, Nat. Commun., 11 (2020) 2838. [16] S. Rimaz L. Chen S. Kawi A. Borgna Promoting effect of Ge on Pt-based catalysts for dehydrogenation of propane to propylene Appl. Catal. a: Gen. 588 2019 117266 S. Rimaz, L. Chen, S. Kawi, A. Borgna, Promoting effect of Ge on Pt-based catalysts for dehydrogenation of propane to propylene, Appl. Catal. A: Gen., 588 (2019) 117266. [17] J. Li Y. Tang Y. Ma Z. Zhang F.F. Tao Y. Qu In situ formation of isolated bimetallic PtCe sites of single-dispersed Pt on CeO2 for low-temperature CO oxidation ACS Appl. Mater. Inter. 10 2018 38134 38140 J. Li, Y. Tang, Y. Ma, Z. Zhang, F.F. Tao, Y. Qu, In situ formation of isolated bimetallic PtCe sites of single-dispersed Pt on CeO2 for low-temperature CO oxidation, ACS Appl. Mater. Inter., 10 (2018) 38134-38140. [18] P. Wang H. Liao Y. Chen X. Tao Y. Gan H. Deng Y. Fu Y. Tang L. Wu L. Tan Enhanced PtIn catalyst via Ce-assisted confinement effect in propane dehydrogenation ACS Catal. 2024 8116 8129 P. Wang, H. Liao, Y. Chen, X. Tao, Y. Gan, H. Deng, Y. Fu, Y. Tang, L. Wu, L. Tan, Enhanced PtIn catalyst via Ce-assisted confinement effect in propane dehydrogenation, ACS Catal., (2024) 8116-8129. [19] K. Searles K.W. Chan J.A. Mendes Burak D. Zemlyanov O. Safonova C. Copéret Highly productive propane dehydrogenation catalyst using silica-supported Ga-Pt nanoparticles generated from single-sites J. Am. Chem. Soc. 140 2018 11674 11679 K. Searles, K.W. Chan, J.A. Mendes Burak, D. Zemlyanov, O. Safonova, C. Copéret, Highly productive propane dehydrogenation catalyst using silica-supported Ga-Pt nanoparticles generated from single-sites, J. Am. Chem. Soc., 140 (2018) 11674-11679. [20] J. Camacho-Bunquin M.S. Ferrandon H. Sohn A.J. Kropf C. Yang J. Wen R.A. Hackler C. Liu G. Celik C.L. Marshall P.C. Stair M. Delferro Atomically precise strategy to a PtZn alloy nanocluster catalyst for the deep dehydrogenation of n-butane to 1,3-butadiene ACS Catal. 8 2018 10058 10063 J. Camacho-Bunquin, M.S. Ferrandon, H. Sohn, A.J. Kropf, C. Yang, J. Wen, R.A. Hackler, C. Liu, G. Celik, C.L. Marshall, P.C. Stair, M. Delferro, Atomically precise strategy to a PtZn alloy nanocluster catalyst for the deep dehydrogenation of n-butane to 1,3-butadiene, ACS Catal., 8 (2018) 10058-10063. [21] L. Xie Y. Chai L. Sun W. Dai G. Wu N. Guan L. Li Optimizing zeolite stabilized Pt-Zn catalysts for propane dehydrogenation J. Energy Chem. 57 2021 92 98 L. Xie, Y. Chai, L. Sun, W. Dai, G. Wu, N. Guan, L. Li, Optimizing zeolite stabilized Pt-Zn catalysts for propane dehydrogenation, J. Energy Chem., 57 (2021) 92-98. [22] K. Bian G. Zhang M. Wang S. Liu C.J. Breckner D.P. Dean J. Zhu J.T. Miller S. Hou C. Song X. Guo Promoting propane dehydrogenation over PtFe bimetallic catalysts by optimizing the state of Fe species Chem. Eng. Sci. 275 2023 118748 K. Bian, G. Zhang, M. Wang, S. Liu, C.J. Breckner, D.P. Dean, J. Zhu, J.T. Miller, S. Hou, C. Song, X. Guo, Promoting propane dehydrogenation over PtFe bimetallic catalysts by optimizing the state of Fe species, Chem. Eng. Sci., 275 (2023) 118748. [23] W. Zhang H. Wang J. Jiang Z. Sui Y. Zhu D. Chen X. Zhou Size dependence of Pt catalysts for propane dehydrogenation: from atomically dispersed to nanoparticles ACS Catal. 10 2020 12932 12942 W. Zhang, H. Wang, J. Jiang, Z. Sui, Y. Zhu, D. Chen, X. Zhou, Size dependence of Pt catalysts for propane dehydrogenation: from atomically dispersed to nanoparticles, ACS Catal., 10 (2020) 12932-12942. [24] Q. Sun N. Wang J. Yu Advances in catalytic applications of zeolite-supported metal catalysts Adv. Mater. 33 2021 2104442 Q. Sun, N. Wang, J. Yu, Advances in catalytic applications of zeolite-supported metal catalysts, Adv. Mater., 33 (2021) 2104442. [25] N. Wang Q. Sun J. Yu Ultrasmall metal nanoparticles confined within crystalline nanoporous materials: A fascinating class of nanocatalysts Adv. Mater. 31 2019 1803966 N. Wang, Q. Sun, J. Yu, Ultrasmall metal nanoparticles confined within crystalline nanoporous materials: A fascinating class of nanocatalysts, Adv. Mater., 31 (2019) 1803966. [26] Z. Qu T. Zhang X. Yin J. Zhang X. Xiong Q. Sun Zeolite-encaged ultrasmall Pt-Zn species with trace amount of Pt for efficient propane dehydrogenation Chem. Res. Chinese u. 2023 Z. Qu, T. Zhang, X. Yin, J. Zhang, X. Xiong, Q. Sun, Zeolite-encaged ultrasmall Pt-Zn species with trace amount of Pt for efficient propane dehydrogenation, Chem. Res. Chinese U., (2023). [27] Y. Yuan Z. Zhao R.F. Lobo B. Xu Site diversity and mechanism of metal-exchanged zeolite catalyzed non-oxidative propane dehydrogenation Adv. Sci. 10 2023 2207756 Y. Yuan, Z. Zhao, R.F. Lobo, B. Xu, Site diversity and mechanism of metal-exchanged zeolite catalyzed non-oxidative propane dehydrogenation, Adv. Sci., 10 (2023) 2207756. [28] J. Yu S.-W. Yu Z. Qi X. Fang T.-H. Kim L. Zhou S. Zhang W. Huang Synthesis of PtSn4 intermetallic nanodisks through a galvanic replacement mechanism Chem. Mater. 34 2022 6968 6976 J. Yu, S.-W. Yu, Z. Qi, X. Fang, T.-H. Kim, L. Zhou, S. Zhang, W. Huang, Synthesis of PtSn4 intermetallic nanodisks through a galvanic replacement mechanism, Chem. Mater., 34 (2022) 6968-6976. [29] L. Qi M. Babucci Y. Zhang A. Lund L. Liu J. Li Y. Chen A.S. Hoffman S.R. Bare Y. Han B.C. Gates A.T. Bell Propane dehydrogenation catalyzed by isolated Pt atoms in identical with SiOZn-OH nests in dealuminated zeolite Beta J. Am. Chem. Soc. 143 2021 21364 21378 L. Qi, M. Babucci, Y. Zhang, A. Lund, L. Liu, J. Li, Y. Chen, A.S. Hoffman, S.R. Bare, Y. Han, B.C. Gates, A.T. Bell, Propane dehydrogenation catalyzed by isolated Pt atoms in identical with SiOZn-OH nests in dealuminated zeolite Beta, J. Am. Chem. Soc., 143 (2021) 21364-21378. [30] Q. Sun N. Wang Q. Fan L. Zeng A. Mayoral S. Miao R. Yang Z. Jiang W. Zhou J. Zhang T. Zhang J. Xu P. Zhang J. Cheng D.-C. Yang R. Jia L. Li Q. Zhang Y. Wang O. Terasaki J. Yu Subnanometer bimetallic platinum–zinc clusters in zeolites for propane dehydrogenation Angew. Chem. 59 2020 19450 19459 Q. Sun, N. Wang, Q. Fan, L. Zeng, A. Mayoral, S. Miao, R. Yang, Z. Jiang, W. Zhou, J. Zhang, T. Zhang, J. Xu, P. Zhang, J. Cheng, D.-C. Yang, R. Jia, L. Li, Q. Zhang, Y. Wang, O. Terasaki, J. Yu, Subnanometer bimetallic platinum–zinc clusters in zeolites for propane dehydrogenation, Angew. Chem., 59 (2020) 19450-19459. [31] D. Zhao X. Tian D.E. Doronkin S. Han V.A. Kondratenko J.-D. Grunwaldt A. Perechodjuk T.H. Vuong J. Rabeah R. Eckelt U. Rodemerck D. Linke G. Jiang H. Jiao E.V. Kondratenko In situ formation of ZnOx species for efficient propane dehydrogenation Nature 599 2021 234 238 D. Zhao, X. Tian, D.E. Doronkin, S. Han, V.A. Kondratenko, J.-D. Grunwaldt, A. Perechodjuk, T.H. Vuong, J. Rabeah, R. Eckelt, U. Rodemerck, D. Linke, G. Jiang, H. Jiao, E.V. Kondratenko, In situ formation of ZnOx species for efficient propane dehydrogenation, Nature, 599 (2021) 234-238. [32] L. Xie R. Wang Y. Chai X. Weng N. Guan L. Li Propane dehydrogenation catalyzed by in-situ partially reduced zinc cations confined in zeolites J. Energy Chem. 63 2021 262 269 L. Xie, R. Wang, Y. Chai, X. Weng, N. Guan, L. Li, Propane dehydrogenation catalyzed by in-situ partially reduced zinc cations confined in zeolites, J. Energy Chem., 63 (2021) 262-269. [33] P. Wang M. Yang H. Liao K. Xu X. Zong Z. Xie H. Zhao Y. Xu H. Yang Y. Gan Y. Fang L. Wu Y. Tang L. Tan Restructured zeolites anchoring singly dispersed bimetallic platinum and zinc catalysts for propane dehydrogenation Cell Reports Physical Science 101311 2023 P. Wang, M. Yang, H. Liao, K. Xu, X. Zong, Z. Xie, H. Zhao, Y. Xu, H. Yang, Y. Gan, Y. Fang, L. Wu, Y. Tang, L. Tan, Restructured zeolites anchoring singly dispersed bimetallic platinum and zinc catalysts for propane dehydrogenation, Cell Reports Physical Science, (2023) 101311. [34] J. He J. Zhang J. Chen J. Zhang G. Wang Z. Shi F. Yang J. Zhao R. Zhuo R. Wang Re-dispersion of active Zn species on modified S-1 zeolite as an efficient catalyst for direct dehydrogenation of propane Micropor. and Mesopor. Mat. 348 2023 112402 J. He, J. Zhang, J. Chen, J. Zhang, G. Wang, Z. Shi, F. Yang, J. Zhao, R. Zhuo, R. Wang, Re-dispersion of active Zn species on modified S-1 zeolite as an efficient catalyst for direct dehydrogenation of propane, Micropor. and Mesopor. Mat., 348 (2023) 112402. [35] L. Liu J. Lu Y. Yang W. Ruettinger X. Gao M. Wang H. Lou Z. Wang Y. Liu X. Tao Dealuminated Beta zeolite reverses Ostwald ripening for durable copper nanoparticle catalysts Science 2023 eadj1962 L. Liu, J. Lu, Y. Yang, W. Ruettinger, X. Gao, M. Wang, H. Lou, Z. Wang, Y. Liu, X. Tao, Dealuminated Beta zeolite reverses Ostwald ripening for durable copper nanoparticle catalysts, Science, (2023) eadj1962. [36] Q. Wu C. Xu L. Zhu X. Meng F.-S. Xiao Recent strategies for synthesis of metallosilicate zeolites Catal. Today 390–391 2022 2 11 Q. Wu, C. Xu, L. Zhu, X. Meng, F.-S. Xiao, Recent strategies for synthesis of metallosilicate zeolites, Catal. Today, 390-391 (2022) 2-11. [37] B. Ravel M. Newville ATHENA, ARTEMIS, HEPHAESTUS: data analysis for X-ray absorption spectroscopy using IFEFFIT J. Synchrotron Radiat. 12 2005 537 541 B. Ravel, M. Newville, ATHENA, ARTEMIS, HEPHAESTUS: data analysis for X-ray absorption spectroscopy using IFEFFIT, J. Synchrotron Radiat., 12 (2005) 537-541. [38] H. Funke A. Scheinost M. Chukalina Wavelet analysis of extended x-ray absorption fine structure data Phys. Rev. B 71 2005 094110 H. Funke, A. Scheinost, M. Chukalina, Wavelet analysis of extended x-ray absorption fine structure data, Phys. Rev. B, 71 (2005) 094110. [39] H. Funke M. Chukalina A.C. Scheinost A new FEFF-based wavelet for EXAFS data analysis J. Synchrotron Radiat. 14 2007 426 432 H. Funke, M. Chukalina, A.C. Scheinost, A new FEFF-based wavelet for EXAFS data analysis, J. Synchrotron Radiat., 14 (2007) 426-432. [40] Y. Dai Y. Wu H. Dai X. Gao S. Tian J. Gu X. Yi A. Zheng Y. Yang Effect of coking and propylene adsorption on enhanced stability for Co2+-catalyzed propane dehydrogenation J. Catal. 395 2021 105 116 Y. Dai, Y. Wu, H. Dai, X. Gao, S. Tian, J. Gu, X. Yi, A. Zheng, Y. Yang, Effect of coking and propylene adsorption on enhanced stability for Co2+-catalyzed propane dehydrogenation, J. Catal., 395 (2021) 105-116. [41] J. Wei E. Iglesia Mechanism and site requirements for activation and chemical conversion of methane on supported Pt clusters and turnover rate comparisons among noble metals The Journal of Physical Chemistry B 108 2004 4094 4103 J. Wei, E. Iglesia, Mechanism and site requirements for activation and chemical conversion of methane on supported Pt clusters and turnover rate comparisons among noble metals, The Journal of Physical Chemistry B, 108 (2004) 4094-4103. [42] Z. Ji D. Miao L. Gao X. Pan X. Bao Effect of pH on the catalytic performance of PtSn/B-ZrO2 in propane dehydrogenation Chin. J. Catal. 41 2020 719 729 Z. Ji, D. Miao, L. Gao, X. Pan, X. Bao, Effect of pH on the catalytic performance of PtSn/B-ZrO2 in propane dehydrogenation, Chin. J. Catal., 41 (2020) 719-729. [43] H. Zhu D.H. Anjum Q. Wang E. Abou-Hamad L. Emsley H. Dong P. Laveille L. Li A.K. Samal J.-M. Basset Sn surface-enriched Pt-Sn bimetallic nanoparticles as a selective and stable catalyst for propane dehydrogenation J. Catal. 320 2014 52 62 H. Zhu, D.H. Anjum, Q. Wang, E. Abou-Hamad, L. Emsley, H. Dong, P. Laveille, L. Li, A.K. Samal, J.-M. Basset, Sn surface-enriched Pt-Sn bimetallic nanoparticles as a selective and stable catalyst for propane dehydrogenation, J. Catal., 320 (2014) 52-62. [44] J. Li J. Li Z. Zhao X. Fan J. Liu Y. Wei A. Duan Z. Xie Q. Liu Size effect of TS-1 supports on the catalytic performance of PtSn/TS-1 catalysts for propane dehydrogenation J. Catal. 352 2017 361 370 J. Li, J. Li, Z. Zhao, X. Fan, J. Liu, Y. Wei, A. Duan, Z. Xie, Q. Liu, Size effect of TS-1 supports on the catalytic performance of PtSn/TS-1 catalysts for propane dehydrogenation, J. Catal., 352 (2017) 361-370. [45] H. Zhou J. Gong B. Xu L. Yu Y. Fan PtSnNa@SUZ-4-catalyzed propane dehydrogenation Appl. Catal. a: Gen. 527 2016 30 35 H. Zhou, J. Gong, B. Xu, L. Yu, Y. Fan, PtSnNa@SUZ-4-catalyzed propane dehydrogenation, Appl. Catal. A: Gen., 527 (2016) 30-35. [46] M. Razavian S. Fatemi Synthesis and application of ZSM-5/SAPO-34 and SAPO-34/ZSM-5 composite systems for propylene yield enhancement in propane dehydrogenation process Micro. Meso. Mater. 201 2015 176 189 M. Razavian, S. Fatemi, Synthesis and application of ZSM-5/SAPO-34 and SAPO-34/ZSM-5 composite systems for propylene yield enhancement in propane dehydrogenation process, Micro. Meso. Mater., 201 (2015) 176-189. [47] Y. Shi X. Li X. Rong B. Gu H. Wei Y. Zhao W. Wang C. Sun Effect of aging temperature of support on catalytic performance of PtSnK/Al2O3 propane dehydrogenation catalyst Catal. Lett. 150 2020 2283 2293 Y. Shi, X. Li, X. Rong, B. Gu, H. Wei, Y. Zhao, W. Wang, C. Sun, Effect of aging temperature of support on catalytic performance of PtSnK/Al2O3 propane dehydrogenation catalyst, Catal. Lett., 150 (2020) 2283-2293. [48] L. Liu M. Lopez-Haro C.W. Lopes C. Li P. Concepcion L. Simonelli J.J. Calvino A. Corma Regioselective generation and reactivity control of subnanometric platinum clusters in zeolites for high-temperature catalysis Nat. Mater. 18 2019 866 873 L. Liu, M. Lopez-Haro, C.W. Lopes, C. Li, P. Concepcion, L. Simonelli, J.J. Calvino, A. Corma, Regioselective generation and reactivity control of subnanometric platinum clusters in zeolites for high-temperature catalysis, Nat. Mater., 18 (2019) 866-873. [49] H. Zhang H. Wan Y. Zhao W. Wang Effect of chlorine elimination from Pt-Sn catalyst on the behavior of hydrocarbon reconstruction in propane dehydrogenation Catal. Today 330 2019 85 91 H. Zhang, H. Wan, Y. Zhao, W. Wang, Effect of chlorine elimination from Pt-Sn catalyst on the behavior of hydrocarbon reconstruction in propane dehydrogenation, Catal. Today, 330 (2019) 85-91. [50] Z.Y. Yang H. Li H. Zhou L. Wang L.X. Wang Q.Y. Zhu J.P. Xiao X.J. Meng J.X. Chen F.S. Xiao Coking-resistant iron catalyst in ethane dehydrogenation achieved through siliceous zeolite modulation J. Am. Chem. Soc. 142 2020 16429 16436 Z.Y. Yang, H. Li, H. Zhou, L. Wang, L.X. Wang, Q.Y. Zhu, J.P. Xiao, X.J. Meng, J.X. Chen, F.S. Xiao, Coking-resistant iron catalyst in ethane dehydrogenation achieved through siliceous zeolite modulation, J. Am. Chem. Soc., 142 (2020) 16429-16436. [51] G. Liu L. Zeng Z.-J. Zhao H. Tian T. Wu J. Gong Platinum-modified ZnO/Al2O3 for propane dehydrogenation: minimized platinum usage and improved catalytic stability ACS Catal. 6 2016 2158 2162 G. Liu, L. Zeng, Z.-J. Zhao, H. Tian, T. Wu, J. Gong, Platinum-modified ZnO/Al2O3 for propane dehydrogenation: minimized platinum usage and improved catalytic stability, ACS Catal., 6 (2016) 2158-2162. [52] P. Ingale K. Knemeyer P. Preikschas M. Ye M. Geske R. Naumann d'Alnoncourt A. Thomas F. Rosowski Design of PtZn nanoalloy catalysts for propane dehydrogenation through interface tailoring via atomic layer deposition Catal. Sci. Technol. 11 2021 484 493 P. Ingale, K. Knemeyer, P. Preikschas, M. Ye, M. Geske, R. Naumann d'Alnoncourt, A. Thomas, F. Rosowski, Design of PtZn nanoalloy catalysts for propane dehydrogenation through interface tailoring via atomic layer deposition, Catal. Sci. Technol., 11 (2021) 484-493. [53] Y.M. Jean-Philippe Nogier P.P. Man T. Shishido M. Che S. Dzwigaj Probing the incorporation of Ti(IV) into the BEA zeolite framework by XRD, FTIR, NMR, and DR UV J. Phys. Chem. C 113 2009 4885 4889 Y.M. Jean-Philippe Nogier, Pascal P. Man, Tetsuya Shishido, Michel Che, and Stanislaw Dzwigaj, Probing the incorporation of Ti(IV) into the BEA zeolite framework by XRD, FTIR, NMR, and DR UV, J. Phys. Chem. C, 113 (2009) 4885-4889. [54] Z. Ji H. Lv X. Pan X. Bao Enhanced ethylene selectivity and stability of Mo/ZSM5 upon modification with phosphorus in ethane dehydrogenation J. Catal. 361 2018 94 104 Z. Ji, H. Lv, X. Pan, X. Bao, Enhanced ethylene selectivity and stability of Mo/ZSM5 upon modification with phosphorus in ethane dehydrogenation, J. Catal., 361 (2018) 94-104. [55] K. Barbera F. Bonino S. Bordiga T.V.W. Janssens P. Beato Structure-deactivation relationship for ZSM-5 catalysts governed by framework defects J. Catal. 280 2011 196 205 K. Barbera, F. Bonino, S. Bordiga, T.V.W. Janssens, P. Beato, Structure-deactivation relationship for ZSM-5 catalysts governed by framework defects, J. Catal., 280 (2011) 196-205. [56] Z. Zhu H. Xu J. Jiang H. Wu P. Wu Hydrophobic nanosized all-silica Beta zeolite: efficient synthesis and adsorption application ACS Appl. Mater. Inter. 9 2017 27273 27283 Z. Zhu, H. Xu, J. Jiang, H. Wu, P. Wu, Hydrophobic nanosized all-silica Beta zeolite: efficient synthesis and adsorption application, ACS Appl. Mater. Inter., 9 (2017) 27273-27283. [57] P. Sun G. Gao Z.L. Zhao C.G. Xia F.W. Li Acidity-regulation for enhancing the stability of Ni/HZSM-5 catalyst for valeric biofuel production Appl. Catal. b: Environ. 189 2016 19 25 P. Sun, G. Gao, Z.L. Zhao, C.G. Xia, F.W. Li, Acidity-regulation for enhancing the stability of Ni/HZSM-5 catalyst for valeric biofuel production, Appl. Catal. B: Environ., 189 (2016) 19-25. [58] W. Dong Z. Shen B. Peng M. Gu X. Zhou B. Xiang Y. Zhang Selective chemical conversion of sugars in aqueous solutions without alkali to lactic acid over a Zn-Sn-Beta Lewis acid-base catalyst Sci. Rep. 6 2016 26713 W. Dong, Z. Shen, B. Peng, M. Gu, X. Zhou, B. Xiang, Y. Zhang, Selective chemical conversion of sugars in aqueous solutions without alkali to lactic acid over a Zn-Sn-Beta Lewis acid-base catalyst, Sci. Rep., 6 (2016) 26713. [59] C. Lin H. Pan Z. Yang X. Han P. Tian P. Li Z. Xiao J. Xu Y.-F. Han Effects of cerium doping on Pt-Sn/Al2O3 catalysts for n-heptane reforming Ind. Eng. Chem. Res. 59 2020 6424 6434 C. Lin, H. Pan, Z. Yang, X. Han, P. Tian, P. Li, Z. Xiao, J. Xu, Y.-F. Han, Effects of cerium doping on Pt-Sn/Al2O3 catalysts for n-heptane reforming, Ind. Eng. Chem. Res., 59 (2020) 6424-6434. [60] Z. Xu Y. Yue X. Bao Z. Xie H. Zhu Propane dehydrogenation over Pt clusters localized at the Sn single-site in zeolite framework ACS Catal. 10 2019 818 828 Z. Xu, Y. Yue, X. Bao, Z. Xie, H. Zhu, Propane dehydrogenation over Pt clusters localized at the Sn single-site in zeolite framework, ACS Catal., 10 (2019) 818-828. [61] W.-G. Kim J. So S.-W. Choi Y. Liu R.S. Dixit C. Sievers D.S. Sholl S. Nair C.W. Jones Hierarchical Ga-MFI catalysts for propane dehydrogenation Chem. Mater. 29 2017 7213 7222 W.-g. Kim, J. So, S.-W. Choi, Y. Liu, R.S. Dixit, C. Sievers, D.S. Sholl, S. Nair, C.W. Jones, Hierarchical Ga-MFI catalysts for propane dehydrogenation, Chem. Mater., 29 (2017) 7213-7222. [62] Y. Wang Z.-P. Hu X. Lv L. Chen Z.-Y. Yuan Ultrasmall PtZn bimetallic nanoclusters encapsulated in silicalite-1 zeolite with superior performance for propane dehydrogenation J. Catal. 385 2020 61 69 Y. Wang, Z.-P. Hu, X. Lv, L. Chen, Z.-Y. Yuan, Ultrasmall PtZn bimetallic nanoclusters encapsulated in silicalite-1 zeolite with superior performance for propane dehydrogenation, J. Catal., 385 (2020) 61-69. [63] S. Bordiga E. Groppo G. Agostini J.A. van Bokhoven C. Lamberti Reactivity of surface species in heterogeneous catalysts probed by in situ X-ray absorption techniques Chem. Rev. 113 2013 1736 1850 S. Bordiga, E. Groppo, G. Agostini, J.A. van Bokhoven, C. Lamberti, Reactivity of surface species in heterogeneous catalysts probed by in situ X-ray absorption techniques, Chem. Rev., 113 (2013) 1736-1850. [64] S. Zhang L. Nguyen J.-X. Liang J. Shan J. Liu A.I. Frenkel A. Patlolla W. Huang J. Li F. Tao Catalysis on singly dispersed bimetallic sites Nat. Commun. 6 2015 7938 S. Zhang, L. Nguyen, J.-X. Liang, J. Shan, J. Liu, A.I. Frenkel, A. Patlolla, W. Huang, J. Li, F. Tao, Catalysis on singly dispersed bimetallic sites, Nat. Commun., 6 (2015) 7938. [65] Y. Tang S. Zhang T.B. Rawal L. Nguyen Y. Iwasawa S.R. Acharya J. Liu S. Hong T.S. Rahman F. Tao Atomic-scale structure and catalysis on positively charged bimetallic sites for generation of H2 Nano Lett. 20 2020 6255 6262 Y. Tang, S. Zhang, T.B. Rawal, L. Nguyen, Y. Iwasawa, S.R. Acharya, J. Liu, S. Hong, T.S. Rahman, F. Tao, Atomic-scale structure and catalysis on positively charged bimetallic sites for generation of H2, Nano Lett., 20 (2020) 6255-6262. [66] J. Kang Q.-Y. Fan W. Zhou Q. Zhang S. He L. Yue Y. Tang L. Nguyen X. Yu Y. You Iridium boosts the selectivity and stability of cobalt catalysts for syngas to liquid fuels Chem 8 2022 1050 1066 J. Kang, Q.-Y. Fan, W. Zhou, Q. Zhang, S. He, L. Yue, Y. Tang, L. Nguyen, X. Yu, Y. You, Iridium boosts the selectivity and stability of cobalt catalysts for syngas to liquid fuels, Chem, 8 (2022) 1050-1066. [67] F. Tao Y. Li A new type of catalysts: catalysts of singly dispersed bimetallic sites Trends Chem. 5 2023 486 499 F. Tao, Y. Li, A new type of catalysts: catalysts of singly dispersed bimetallic sites, Trends Chem., 5 (2023) 486-499. [68] X.-L. Ma J.-C. Liu H. Xiao J. Li Surface single-cluster catalyst for N2-to-NH3 thermal conversion J. Am. Chem. Soc. 140 2018 46 49 X.-L. Ma, J.-C. Liu, H. Xiao, J. Li, Surface single-cluster catalyst for N2-to-NH3 thermal conversion, J. Am. Chem. Soc., 140 (2018) 46-49. [69] S. Zhang X. Liu H. Lin R. Chen Y. Chen Y. Xu K. Xu H. Zhao L. Tan L. Wu Y. Tang Unveiling the in-situ formation of single-atomically dispersed Pd-Fe bimetallic catalytic sites during anisole hydrodeoxygenation Mol. Catal. 2023 113401 S. Zhang, X. Liu, H. Lin, R. Chen, Y. Chen, Y. Xu, K. Xu, H. Zhao, L. Tan, L. Wu, Y. Tang, Unveiling the in-situ formation of single-atomically dispersed Pd-Fe bimetallic catalytic sites during anisole hydrodeoxygenation, Mol. Catal., (2023) 113401. [70] Z. Xia H. Zhang K. Shen Y. Qu Z. Jiang Wavelet analysis of extended X-ray absorption fine structure data: Theory, application Physica B 542 2018 12 19 Z. Xia, H. Zhang, K. Shen, Y. Qu, Z. Jiang, Wavelet analysis of extended X-ray absorption fine structure data: Theory, application, Physica B, 542 (2018) 12-19.",
      "scopus-id": "85198568111",
      "coredata": {
        "eid": "1-s2.0-S0021951724003609",
        "dc:description": "The utilization of Pt-based catalysts in the catalytic conversion of propane to propylene (PDH) remains pivotal in industrial processes. However, the scarcity of Pt and its high cost necessitates innovative strategies to enhance Pt dispersion and catalytic performance. In this study, we present an approach involving the in-situ incorporation of Zn cations into Silicalite-1 (S-1) zeolite through one-pot hydrothermal synthesis, which facilitates the anchoring of atomically dispersed Pt atoms. The synthesized 0.5Pt/Zn@S-1 catalyst exhibits the dehydrogenation performance of 25 % propane for approximately 34.2 % propane conversion and 95.1 % propylene selectivity (propylene turnover rate of 14.2 s−1), coupled with robust stability of up to 60 h without distinct deactivation under a WHSV of 49.1 h−1. Comprehensive characterizations reveal the formation of atomically dispersed Pt-Zn catalytic sites. The Pt atoms are incorporated with the Zn cations and dense silanol nests. This unique configuration facilitates a synergistic effect between Pt and Zn for dehydrogenation.",
        "openArchiveArticle": "false",
        "prism:coverDate": "2024-09-30",
        "openaccessUserLicense": null,
        "prism:aggregationType": "Journal",
        "prism:url": "https://api.elsevier.com/content/article/pii/S0021951724003609",
        "dc:creator": [
          {
            "@_fa": "true",
            "$": "Wang, Peng"
          },
          {
            "@_fa": "true",
            "$": "Chen, Rong"
          },
          {
            "@_fa": "true",
            "$": "Liao, Huafei"
          },
          {
            "@_fa": "true",
            "$": "Lin, Hongqiao"
          },
          {
            "@_fa": "true",
            "$": "Xu, Yuanjie"
          },
          {
            "@_fa": "true",
            "$": "Liu, Bo"
          },
          {
            "@_fa": "true",
            "$": "Zong, Xupeng"
          },
          {
            "@_fa": "true",
            "$": "Dai, Yihu"
          },
          {
            "@_fa": "true",
            "$": "Wu, Lizhi"
          },
          {
            "@_fa": "true",
            "$": "Tan, Li"
          },
          {
            "@_fa": "true",
            "$": "Xie, Zailai"
          },
          {
            "@_fa": "true",
            "$": "Tang, Yu"
          }
        ],
        "link": [
          {
            "@_fa": "true",
            "@rel": "self",
            "@href": "https://api.elsevier.com/content/article/pii/S0021951724003609"
          },
          {
            "@_fa": "true",
            "@rel": "scidir",
            "@href": "https://www.sciencedirect.com/science/article/pii/S0021951724003609"
          }
        ],
        "dc:format": "application/json",
        "openaccessType": null,
        "pii": "S0021-9517(24)00360-9",
        "prism:volume": "437",
        "articleNumber": "115647",
        "prism:publisher": "Elsevier Inc. All rights are reserved, including those for text and data mining, AI training, and similar technologies.",
        "dc:title": "Zinc cations incorporated in Silicalite-1 zeolite assist in anchoring atomically dispersed platinum catalyst for boosted and robust propane dehydrogenation",
        "prism:copyright": "© 2024 Elsevier Inc. All rights are reserved, including those for text and data mining, AI training, and similar technologies.",
        "openaccess": "0",
        "prism:issn": "00219517",
        "dcterms:subject": [
          {
            "@_fa": "true",
            "$": "Propane"
          },
          {
            "@_fa": "true",
            "$": "Propylene"
          },
          {
            "@_fa": "true",
            "$": "Dehydrogenation"
          },
          {
            "@_fa": "true",
            "$": "Platinum"
          },
          {
            "@_fa": "true",
            "$": "Zinc"
          },
          {
            "@_fa": "true",
            "$": "Deactivation"
          },
          {
            "@_fa": "true",
            "$": "Sintering"
          },
          {
            "@_fa": "true",
            "$": "Zeolite"
          },
          {
            "@_fa": "true",
            "$": "Synergistic effect"
          },
          {
            "@_fa": "true",
            "$": "Silanol nest"
          }
        ],
        "openaccessArticle": "false",
        "prism:publicationName": "Journal of Catalysis",
        "openaccessSponsorType": null,
        "prism:pageRange": "115647",
        "pubType": "fla",
        "prism:coverDisplayDate": "September 2024",
        "prism:doi": "10.1016/j.jcat.2024.115647",
        "prism:startingPage": "115647",
        "dc:identifier": "doi:10.1016/j.jcat.2024.115647",
        "openaccessSponsorName": null
      },
      "objects": {
        "object": [
          {
            "@category": "standard",
            "@height": "248",
            "@width": "535",
            "@_fa": "true",
            "$": "https://api.elsevier.com/content/object/eid/1-s2.0-S0021951724003609-gr5.jpg?httpAccept=%2A%2F%2A",
            "@multimediatype": "JPEG image file",
            "@type": "IMAGE-DOWNSAMPLED",
            "@size": "40423",
            "@ref": "gr5",
            "@mimetype": "image/jpeg"
          },
          {
            "@category": "standard",
            "@height": "231",
            "@width": "289",
            "@_fa": "true",
            "$": "https://api.elsevier.com/content/object/eid/1-s2.0-S0021951724003609-gr6.jpg?httpAccept=%2A%2F%2A",
            "@multimediatype": "JPEG image file",
            "@type": "IMAGE-DOWNSAMPLED",
            "@size": "24735",
            "@ref": "gr6",
            "@mimetype": "image/jpeg"
          },
          {
            "@category": "standard",
            "@height": "398",
            "@width": "623",
            "@_fa": "true",
            "$": "https://api.elsevier.com/content/object/eid/1-s2.0-S0021951724003609-gr3.jpg?httpAccept=%2A%2F%2A",
            "@multimediatype": "JPEG image file",
            "@type": "IMAGE-DOWNSAMPLED",
            "@size": "79482",
            "@ref": "gr3",
            "@mimetype": "image/jpeg"
          },
          {
            "@category": "standard",
            "@height": "197",
            "@width": "533",
            "@_fa": "true",
            "$": "https://api.elsevier.com/content/object/eid/1-s2.0-S0021951724003609-gr4.jpg?httpAccept=%2A%2F%2A",
            "@multimediatype": "JPEG image file",
            "@type": "IMAGE-DOWNSAMPLED",
            "@size": "34375",
            "@ref": "gr4",
            "@mimetype": "image/jpeg"
          },
          {
            "@category": "standard",
            "@height": "732",
            "@width": "289",
            "@_fa": "true",
            "$": "https://api.elsevier.com/content/object/eid/1-s2.0-S0021951724003609-gr9.jpg?httpAccept=%2A%2F%2A",
            "@multimediatype": "JPEG image file",
            "@type": "IMAGE-DOWNSAMPLED",
            "@size": "75115",
            "@ref": "gr9",
            "@mimetype": "image/jpeg"
          },
          {
            "@category": "standard",
            "@height": "213",
            "@width": "533",
            "@_fa": "true",
            "$": "https://api.elsevier.com/content/object/eid/1-s2.0-S0021951724003609-gr7.jpg?httpAccept=%2A%2F%2A",
            "@multimediatype": "JPEG image file",
            "@type": "IMAGE-DOWNSAMPLED",
            "@size": "50808",
            "@ref": "gr7",
            "@mimetype": "image/jpeg"
          },
          {
            "@category": "standard",
            "@height": "461",
            "@width": "534",
            "@_fa": "true",
            "$": "https://api.elsevier.com/content/object/eid/1-s2.0-S0021951724003609-gr8.jpg?httpAccept=%2A%2F%2A",
            "@multimediatype": "JPEG image file",
            "@type": "IMAGE-DOWNSAMPLED",
            "@size": "79280",
            "@ref": "gr8",
            "@mimetype": "image/jpeg"
          },
          {
            "@category": "standard",
            "@height": "200",
            "@width": "325",
            "@_fa": "true",
            "$": "https://api.elsevier.com/content/object/eid/1-s2.0-S0021951724003609-ga1.jpg?httpAccept=%2A%2F%2A",
            "@multimediatype": "JPEG image file",
            "@type": "IMAGE-DOWNSAMPLED",
            "@size": "18151",
            "@ref": "ga1",
            "@mimetype": "image/jpeg"
          },
          {
            "@category": "standard",
            "@height": "297",
            "@width": "735",
            "@_fa": "true",
            "$": "https://api.elsevier.com/content/object/eid/1-s2.0-S0021951724003609-gr11.jpg?httpAccept=%2A%2F%2A",
            "@multimediatype": "JPEG image file",
            "@type": "IMAGE-DOWNSAMPLED",
            "@size": "77065",
            "@ref": "gr11",
            "@mimetype": "image/jpeg"
          },
          {
            "@category": "standard",
            "@height": "171",
            "@width": "623",
            "@_fa": "true",
            "$": "https://api.elsevier.com/content/object/eid/1-s2.0-S0021951724003609-gr10.jpg?httpAccept=%2A%2F%2A",
            "@multimediatype": "JPEG image file",
            "@type": "IMAGE-DOWNSAMPLED",
            "@size": "34727",
            "@ref": "gr10",
            "@mimetype": "image/jpeg"
          },
          {
            "@category": "standard",
            "@height": "197",
            "@width": "774",
            "@_fa": "true",
            "$": "https://api.elsevier.com/content/object/eid/1-s2.0-S0021951724003609-gr13.jpg?httpAccept=%2A%2F%2A",
            "@multimediatype": "JPEG image file",
            "@type": "IMAGE-DOWNSAMPLED",
            "@size": "44724",
            "@ref": "gr13",
            "@mimetype": "image/jpeg"
          },
          {
            "@category": "standard",
            "@height": "215",
            "@width": "289",
            "@_fa": "true",
            "$": "https://api.elsevier.com/content/object/eid/1-s2.0-S0021951724003609-gr12.jpg?httpAccept=%2A%2F%2A",
            "@multimediatype": "JPEG image file",
            "@type": "IMAGE-DOWNSAMPLED",
            "@size": "20563",
            "@ref": "gr12",
            "@mimetype": "image/jpeg"
          },
          {
            "@category": "standard",
            "@height": "179",
            "@width": "533",
            "@_fa": "true",
            "$": "https://api.elsevier.com/content/object/eid/1-s2.0-S0021951724003609-gr1.jpg?httpAccept=%2A%2F%2A",
            "@multimediatype": "JPEG image file",
            "@type": "IMAGE-DOWNSAMPLED",
            "@size": "35559",
            "@ref": "gr1",
            "@mimetype": "image/jpeg"
          },
          {
            "@category": "standard",
            "@height": "178",
            "@width": "533",
            "@_fa": "true",
            "$": "https://api.elsevier.com/content/object/eid/1-s2.0-S0021951724003609-gr2.jpg?httpAccept=%2A%2F%2A",
            "@multimediatype": "JPEG image file",
            "@type": "IMAGE-DOWNSAMPLED",
            "@size": "35727",
            "@ref": "gr2",
            "@mimetype": "image/jpeg"
          },
          {
            "@category": "thumbnail",
            "@height": "102",
            "@width": "219",
            "@_fa": "true",
            "$": "https://api.elsevier.com/content/object/eid/1-s2.0-S0021951724003609-gr5.sml?httpAccept=%2A%2F%2A",
            "@multimediatype": "GIF image file",
            "@type": "IMAGE-THUMBNAIL",
            "@size": "8017",
            "@ref": "gr5",
            "@mimetype": "image/gif"
          },
          {
            "@category": "thumbnail",
            "@height": "164",
            "@width": "205",
            "@_fa": "true",
            "$": "https://api.elsevier.com/content/object/eid/1-s2.0-S0021951724003609-gr6.sml?httpAccept=%2A%2F%2A",
            "@multimediatype": "GIF image file",
            "@type": "IMAGE-THUMBNAIL",
            "@size": "9381",
            "@ref": "gr6",
            "@mimetype": "image/gif"
          },
          {
            "@category": "thumbnail",
            "@height": "140",
            "@width": "219",
            "@_fa": "true",
            "$": "https://api.elsevier.com/content/object/eid/1-s2.0-S0021951724003609-gr3.sml?httpAccept=%2A%2F%2A",
            "@multimediatype": "GIF image file",
            "@type": "IMAGE-THUMBNAIL",
            "@size": "18514",
            "@ref": "gr3",
            "@mimetype": "image/gif"
          },
          {
            "@category": "thumbnail",
            "@height": "81",
            "@width": "219",
            "@_fa": "true",
            "$": "https://api.elsevier.com/content/object/eid/1-s2.0-S0021951724003609-gr4.sml?httpAccept=%2A%2F%2A",
            "@multimediatype": "GIF image file",
            "@type": "IMAGE-THUMBNAIL",
            "@size": "7069",
            "@ref": "gr4",
            "@mimetype": "image/gif"
          },
          {
            "@category": "thumbnail",
            "@height": "162",
            "@width": "64",
            "@_fa": "true",
            "$": "https://api.elsevier.com/content/object/eid/1-s2.0-S0021951724003609-gr9.sml?httpAccept=%2A%2F%2A",
            "@multimediatype": "GIF image file",
            "@type": "IMAGE-THUMBNAIL",
            "@size": "6421",
            "@ref": "gr9",
            "@mimetype": "image/gif"
          },
          {
            "@category": "thumbnail",
            "@height": "88",
            "@width": "219",
            "@_fa": "true",
            "$": "https://api.elsevier.com/content/object/eid/1-s2.0-S0021951724003609-gr7.sml?httpAccept=%2A%2F%2A",
            "@multimediatype": "GIF image file",
            "@type": "IMAGE-THUMBNAIL",
            "@size": "9311",
            "@ref": "gr7",
            "@mimetype": "image/gif"
          },
          {
            "@category": "thumbnail",
            "@height": "164",
            "@width": "190",
            "@_fa": "true",
            "$": "https://api.elsevier.com/content/object/eid/1-s2.0-S0021951724003609-gr8.sml?httpAccept=%2A%2F%2A",
            "@multimediatype": "GIF image file",
            "@type": "IMAGE-THUMBNAIL",
            "@size": "12381",
            "@ref": "gr8",
            "@mimetype": "image/gif"
          },
          {
            "@category": "thumbnail",
            "@height": "135",
            "@width": "219",
            "@_fa": "true",
            "$": "https://api.elsevier.com/content/object/eid/1-s2.0-S0021951724003609-ga1.sml?httpAccept=%2A%2F%2A",
            "@multimediatype": "GIF image file",
            "@type": "IMAGE-THUMBNAIL",
            "@size": "10636",
            "@ref": "ga1",
            "@mimetype": "image/gif"
          },
          {
            "@category": "thumbnail",
            "@height": "88",
            "@width": "219",
            "@_fa": "true",
            "$": "https://api.elsevier.com/content/object/eid/1-s2.0-S0021951724003609-gr11.sml?httpAccept=%2A%2F%2A",
            "@multimediatype": "GIF image file",
            "@type": "IMAGE-THUMBNAIL",
            "@size": "13907",
            "@ref": "gr11",
            "@mimetype": "image/gif"
          },
          {
            "@category": "thumbnail",
            "@height": "60",
            "@width": "219",
            "@_fa": "true",
            "$": "https://api.elsevier.com/content/object/eid/1-s2.0-S0021951724003609-gr10.sml?httpAccept=%2A%2F%2A",
            "@multimediatype": "GIF image file",
            "@type": "IMAGE-THUMBNAIL",
            "@size": "4850",
            "@ref": "gr10",
            "@mimetype": "image/gif"
          },
          {
            "@category": "thumbnail",
            "@height": "56",
            "@width": "219",
            "@_fa": "true",
            "$": "https://api.elsevier.com/content/object/eid/1-s2.0-S0021951724003609-gr13.sml?httpAccept=%2A%2F%2A",
            "@multimediatype": "GIF image file",
            "@type": "IMAGE-THUMBNAIL",
            "@size": "7256",
            "@ref": "gr13",
            "@mimetype": "image/gif"
          },
          {
            "@category": "thumbnail",
            "@height": "163",
            "@width": "219",
            "@_fa": "true",
            "$": "https://api.elsevier.com/content/object/eid/1-s2.0-S0021951724003609-gr12.sml?httpAccept=%2A%2F%2A",
            "@multimediatype": "GIF image file",
            "@type": "IMAGE-THUMBNAIL",
            "@size": "8937",
            "@ref": "gr12",
            "@mimetype": "image/gif"
          },
          {
            "@category": "thumbnail",
            "@height": "74",
            "@width": "219",
            "@_fa": "true",
            "$": "https://api.elsevier.com/content/object/eid/1-s2.0-S0021951724003609-gr1.sml?httpAccept=%2A%2F%2A",
            "@multimediatype": "GIF image file",
            "@type": "IMAGE-THUMBNAIL",
            "@size": "6821",
            "@ref": "gr1",
            "@mimetype": "image/gif"
          },
          {
            "@category": "thumbnail",
            "@height": "73",
            "@width": "219",
            "@_fa": "true",
            "$": "https://api.elsevier.com/content/object/eid/1-s2.0-S0021951724003609-gr2.sml?httpAccept=%2A%2F%2A",
            "@multimediatype": "GIF image file",
            "@type": "IMAGE-THUMBNAIL",
            "@size": "6365",
            "@ref": "gr2",
            "@mimetype": "image/gif"
          },
          {
            "@category": "high",
            "@height": "1098",
            "@width": "2368",
            "@_fa": "true",
            "$": "https://api.elsevier.com/content/object/eid/1-s2.0-S0021951724003609-gr5_lrg.jpg?httpAccept=%2A%2F%2A",
            "@multimediatype": "JPEG image file",
            "@type": "IMAGE-HIGH-RES",
            "@size": "227715",
            "@ref": "gr5",
            "@mimetype": "image/jpeg"
          },
          {
            "@category": "high",
            "@height": "1022",
            "@width": "1280",
            "@_fa": "true",
            "$": "https://api.elsevier.com/content/object/eid/1-s2.0-S0021951724003609-gr6_lrg.jpg?httpAccept=%2A%2F%2A",
            "@multimediatype": "JPEG image file",
            "@type": "IMAGE-HIGH-RES",
            "@size": "182776",
            "@ref": "gr6",
            "@mimetype": "image/jpeg"
          },
          {
            "@category": "high",
            "@height": "1760",
            "@width": "2758",
            "@_fa": "true",
            "$": "https://api.elsevier.com/content/object/eid/1-s2.0-S0021951724003609-gr3_lrg.jpg?httpAccept=%2A%2F%2A",
            "@multimediatype": "JPEG image file",
            "@type": "IMAGE-HIGH-RES",
            "@size": "839193",
            "@ref": "gr3",
            "@mimetype": "image/jpeg"
          },
          {
            "@category": "high",
            "@height": "871",
            "@width": "2362",
            "@_fa": "true",
            "$": "https://api.elsevier.com/content/object/eid/1-s2.0-S0021951724003609-gr4_lrg.jpg?httpAccept=%2A%2F%2A",
            "@multimediatype": "JPEG image file",
            "@type": "IMAGE-HIGH-RES",
            "@size": "294137",
            "@ref": "gr4",
            "@mimetype": "image/jpeg"
          },
          {
            "@category": "high",
            "@height": "3241",
            "@width": "1280",
            "@_fa": "true",
            "$": "https://api.elsevier.com/content/object/eid/1-s2.0-S0021951724003609-gr9_lrg.jpg?httpAccept=%2A%2F%2A",
            "@multimediatype": "JPEG image file",
            "@type": "IMAGE-HIGH-RES",
            "@size": "549754",
            "@ref": "gr9",
            "@mimetype": "image/jpeg"
          },
          {
            "@category": "high",
            "@height": "945",
            "@width": "2362",
            "@_fa": "true",
            "$": "https://api.elsevier.com/content/object/eid/1-s2.0-S0021951724003609-gr7_lrg.jpg?httpAccept=%2A%2F%2A",
            "@multimediatype": "JPEG image file",
            "@type": "IMAGE-HIGH-RES",
            "@size": "377349",
            "@ref": "gr7",
            "@mimetype": "image/jpeg"
          },
          {
            "@category": "high",
            "@height": "2042",
            "@width": "2363",
            "@_fa": "true",
            "$": "https://api.elsevier.com/content/object/eid/1-s2.0-S0021951724003609-gr8_lrg.jpg?httpAccept=%2A%2F%2A",
            "@multimediatype": "JPEG image file",
            "@type": "IMAGE-HIGH-RES",
            "@size": "566066",
            "@ref": "gr8",
            "@mimetype": "image/jpeg"
          },
          {
            "@category": "high",
            "@height": "886",
            "@width": "1440",
            "@_fa": "true",
            "$": "https://api.elsevier.com/content/object/eid/1-s2.0-S0021951724003609-ga1_lrg.jpg?httpAccept=%2A%2F%2A",
            "@multimediatype": "JPEG image file",
            "@type": "IMAGE-HIGH-RES",
            "@size": "93915",
            "@ref": "ga1",
            "@mimetype": "image/jpeg"
          },
          {
            "@category": "high",
            "@height": "1314",
            "@width": "3256",
            "@_fa": "true",
            "$": "https://api.elsevier.com/content/object/eid/1-s2.0-S0021951724003609-gr11_lrg.jpg?httpAccept=%2A%2F%2A",
            "@multimediatype": "JPEG image file",
            "@type": "IMAGE-HIGH-RES",
            "@size": "860909",
            "@ref": "gr11",
            "@mimetype": "image/jpeg"
          },
          {
            "@category": "high",
            "@height": "755",
            "@width": "2757",
            "@_fa": "true",
            "$": "https://api.elsevier.com/content/object/eid/1-s2.0-S0021951724003609-gr10_lrg.jpg?httpAccept=%2A%2F%2A",
            "@multimediatype": "JPEG image file",
            "@type": "IMAGE-HIGH-RES",
            "@size": "247659",
            "@ref": "gr10",
            "@mimetype": "image/jpeg"
          },
          {
            "@category": "high",
            "@height": "870",
            "@width": "3426",
            "@_fa": "true",
            "$": "https://api.elsevier.com/content/object/eid/1-s2.0-S0021951724003609-gr13_lrg.jpg?httpAccept=%2A%2F%2A",
            "@multimediatype": "JPEG image file",
            "@type": "IMAGE-HIGH-RES",
            "@size": "246111",
            "@ref": "gr13",
            "@mimetype": "image/jpeg"
          },
          {
            "@category": "high",
            "@height": "954",
            "@width": "1280",
            "@_fa": "true",
            "$": "https://api.elsevier.com/content/object/eid/1-s2.0-S0021951724003609-gr12_lrg.jpg?httpAccept=%2A%2F%2A",
            "@multimediatype": "JPEG image file",
            "@type": "IMAGE-HIGH-RES",
            "@size": "151825",
            "@ref": "gr12",
            "@mimetype": "image/jpeg"
          },
          {
            "@category": "high",
            "@height": "795",
            "@width": "2362",
            "@_fa": "true",
            "$": "https://api.elsevier.com/content/object/eid/1-s2.0-S0021951724003609-gr1_lrg.jpg?httpAccept=%2A%2F%2A",
            "@multimediatype": "JPEG image file",
            "@type": "IMAGE-HIGH-RES",
            "@size": "311226",
            "@ref": "gr1",
            "@mimetype": "image/jpeg"
          },
          {
            "@category": "high",
            "@height": "789",
            "@width": "2362",
            "@_fa": "true",
            "$": "https://api.elsevier.com/content/object/eid/1-s2.0-S0021951724003609-gr2_lrg.jpg?httpAccept=%2A%2F%2A",
            "@multimediatype": "JPEG image file",
            "@type": "IMAGE-HIGH-RES",
            "@size": "301037",
            "@ref": "gr2",
            "@mimetype": "image/jpeg"
          },
          {
            "@category": "standard",
            "@_fa": "true",
            "$": "https://api.elsevier.com/content/object/eid/1-s2.0-S0021951724003609-mmc1.pdf?httpAccept=%2A%2F%2A",
            "@multimediatype": "Acrobat PDF file",
            "@type": "APPLICATION",
            "@size": "2391354",
            "@ref": "mmc1",
            "@mimetype": "application/pdf"
          },
          {
            "@category": "thumbnail",
            "@_fa": "true",
            "$": "https://api.elsevier.com/content/object/eid/1-s2.0-S0021951724003609-si1.svg?httpAccept=%2A%2F%2A",
            "@multimediatype": "Scalable Vector Graphics file",
            "@type": "ALTIMG",
            "@size": "6602",
            "@ref": "si1",
            "@mimetype": "image/svg+xml"
          },
          {
            "@category": "thumbnail",
            "@_fa": "true",
            "$": "https://api.elsevier.com/content/object/eid/1-s2.0-S0021951724003609-si10.svg?httpAccept=%2A%2F%2A",
            "@multimediatype": "Scalable Vector Graphics file",
            "@type": "ALTIMG",
            "@size": "26267",
            "@ref": "si10",
            "@mimetype": "image/svg+xml"
          },
          {
            "@category": "thumbnail",
            "@_fa": "true",
            "$": "https://api.elsevier.com/content/object/eid/1-s2.0-S0021951724003609-si2.svg?httpAccept=%2A%2F%2A",
            "@multimediatype": "Scalable Vector Graphics file",
            "@type": "ALTIMG",
            "@size": "6415",
            "@ref": "si2",
            "@mimetype": "image/svg+xml"
          },
          {
            "@category": "thumbnail",
            "@_fa": "true",
            "$": "https://api.elsevier.com/content/object/eid/1-s2.0-S0021951724003609-si3.svg?httpAccept=%2A%2F%2A",
            "@multimediatype": "Scalable Vector Graphics file",
            "@type": "ALTIMG",
            "@size": "6066",
            "@ref": "si3",
            "@mimetype": "image/svg+xml"
          },
          {
            "@category": "thumbnail",
            "@_fa": "true",
            "$": "https://api.elsevier.com/content/object/eid/1-s2.0-S0021951724003609-si4.svg?httpAccept=%2A%2F%2A",
            "@multimediatype": "Scalable Vector Graphics file",
            "@type": "ALTIMG",
            "@size": "34354",
            "@ref": "si4",
            "@mimetype": "image/svg+xml"
          },
          {
            "@category": "thumbnail",
            "@_fa": "true",
            "$": "https://api.elsevier.com/content/object/eid/1-s2.0-S0021951724003609-si5.svg?httpAccept=%2A%2F%2A",
            "@multimediatype": "Scalable Vector Graphics file",
            "@type": "ALTIMG",
            "@size": "24454",
            "@ref": "si5",
            "@mimetype": "image/svg+xml"
          },
          {
            "@category": "thumbnail",
            "@_fa": "true",
            "$": "https://api.elsevier.com/content/object/eid/1-s2.0-S0021951724003609-si6.svg?httpAccept=%2A%2F%2A",
            "@multimediatype": "Scalable Vector Graphics file",
            "@type": "ALTIMG",
            "@size": "25162",
            "@ref": "si6",
            "@mimetype": "image/svg+xml"
          },
          {
            "@category": "thumbnail",
            "@_fa": "true",
            "$": "https://api.elsevier.com/content/object/eid/1-s2.0-S0021951724003609-si7.svg?httpAccept=%2A%2F%2A",
            "@multimediatype": "Scalable Vector Graphics file",
            "@type": "ALTIMG",
            "@size": "55355",
            "@ref": "si7",
            "@mimetype": "image/svg+xml"
          },
          {
            "@category": "thumbnail",
            "@_fa": "true",
            "$": "https://api.elsevier.com/content/object/eid/1-s2.0-S0021951724003609-si8.svg?httpAccept=%2A%2F%2A",
            "@multimediatype": "Scalable Vector Graphics file",
            "@type": "ALTIMG",
            "@size": "49732",
            "@ref": "si8",
            "@mimetype": "image/svg+xml"
          },
          {
            "@category": "thumbnail",
            "@_fa": "true",
            "$": "https://api.elsevier.com/content/object/eid/1-s2.0-S0021951724003609-si9.svg?httpAccept=%2A%2F%2A",
            "@multimediatype": "Scalable Vector Graphics file",
            "@type": "ALTIMG",
            "@size": "30175",
            "@ref": "si9",
            "@mimetype": "image/svg+xml"
          },
          {
            "@category": "standard",
            "@_fa": "true",
            "$": "https://api.elsevier.com/content/object/eid/1-s2.0-S0021951724003609-am.pdf?httpAccept=%2A%2F%2A",
            "@multimediatype": "Acrobat PDF file",
            "@type": "AAM-PDF",
            "@size": "2402109",
            "@ref": "am",
            "@mimetype": "application/pdf"
          }
        ]
      },
      "link": {
        "@rel": "abstract",
        "@href": "https://api.elsevier.com/content/abstract/scopus_id/85198568111"
      }
    }
  }
}