{
  "metadata": {
    "title": "Dearomative selective reduction of structurally diverse <ce:italic>N</ce:italic>-heteroarenes enabled by a homogeneous titanium catalyst",
    "authors": "; ; ",
    "journal": "Journal of Catalysis",
    "date": "2025-03-31",
    "doi": "10.1016/j.jcat.2025.115937",
    "abstract": "",
    "uri": "https://api.elsevier.com/content/article/pii/S0021951725000016",
    "pii": "S0021951725000016"
  },
  "fulltext": {
    "full-text-retrieval-response": {
      "scopus-eid": "2-s2.0-85214504008",
      "originalText": "serial JL 272561 291210 291744 291809 31 Journal of Catalysis JOURNALCATALYSIS 2025-01-03 2025-01-03 2025-01-11 2025-01-11 2025-04-22T20:44:56 1-s2.0-S0021951725000016 S0021-9517(25)00001-6 S0021951725000016 10.1016/j.jcat.2025.115937 S300 S300.1 FULL-TEXT 1-s2.0-S0021951724X00159 2025-04-22T20:38:01.355351Z 0 0 20250301 20250331 2025 2025-01-03T17:55:13.191258Z absattachment articleinfo articlenumber articletitlenorm authfirstinitialnorm authfirstsurnamenorm cid cids contenttype copyright crossmark dateloaded dateloadedtxt datesearch datesort dateupdated dco docsubtype doctype doi eid ewtransactionid hubeid indexeddate issn issnnorm itemstage itemtransactionid itemweight openaccess openarchive pg pgfirst pii piinorm pubdateend pubdatestart pubdatetxt pubyr sectiontitle sortorder srctitle srctitlenorm srctype ssids alllist content subj subheadings suppl tomb volfirst volissue volumelist webpdf webpdfpagecount yearnav figure table e-component body acknowledge affil appendices articletitle auth authfirstini authfull authkeywords authlast highlightsabst primabst pubtype ref specialabst 0021-9517 00219517 true 443 443 C Volume 443 10 115937 115937 115937 202503 March 2025 2025-03-01 2025-03-31 2025 Regular Articles article fla © 2025 Elsevier Inc. All rights are reserved, including those for text and data mining, AI training, and similar technologies. DEAROMATIVESELECTIVEREDUCTIONSTRUCTURALLYDIVERSENHETEROARENESENABLEDBYAHOMOGENEOUSTITANIUMCATALYST BHATT T 1 Introduction 2 Results and Discussion 3 Conclusion Author contributions CRediT authorship contribution statement Acknowledgements Appendix A Supplementary data References TAYLOR 2014 5845 5859 R DAS 2019 4265 4311 P SANEMITSU 2008 175 177 Y SCOTT 2022 7044 7072 K VITAKU 2014 10257 10274 E ABDELSHAFY 2016 107 123 H CORMA 2007 2411 2502 A CALVO 2019 3410 R TAO 2023 e202300622 P CAMPEAU 2019 3 35 L LUCKEMEIER 2023 4996 5012 L WIESENFELDT 2019 10460 10476 M WERTJES 2018 7996 8017 W HUCK 2020 1589 1603 C WEI 2019 980 1002 Z CHENQIAN 2024 2063 2076 H ESCOLANO 2024 1122 1246 M FROLOV 2023 2937 N BU 2024 F REN 2012 17592 17598 D WEI 2023 e202200235 H SRIDHARAN 2011 7157 7259 V KALLSTROM 2008 601 635 S LOVERING 2009 6752 6756 F LOVERING 2013 515 519 F FAHEEM 2021 12254 12287 B WEI 2020 1839 1845 W HANBY 2020 2280 2283 A RITCHIE 2011 164 171 T RITCHIE 2009 1011 1020 T LIU 2013 12968 12971 Y KIM 2019 17900 17908 S CHEN 2018 14488 14492 F SAHOO 2018 8134 8141 B NAIROUKH 2019 264 270 Z CHEN 2015 11718 11724 F ZHANG 2020 2994 3006 S MURUGESAN 2020 17408 17412 K LIU 2017 5817 5820 Z GONG 2021 6901 6908 Y ZHANG 2023 e202311427 Y BORDET 2021 916 922 A MAEGAWA 2009 6953 6963 T TANAKA 2020 5514 5522 N GANDHAMSETTY 2017 2396 2400 N MAHAPATRA 2024 6001 6005 D DING 2017 9262 9264 F GELIS 2020 14090 14094 C CUI 2021 5002 5007 X VIELHABER 2021 451 461 T PRADHAN 2024 e202412979 S LUCKEMEIER 2024 5864 5871 L ZHOU 2023 e202215699 B WIESENFELDT 2018 8297 8300 M CHHABRA 2024 10590 10607 A PERRIN 2014 6361 6373 L GLORIUS 2005 4171 4175 F LIU 2024 11866 11875 D ZHANG 2024 18682 18688 F WANG 2015 6621 6686 D TALEB 2023 7541 B LAU 2021 14272 14294 S FAVERIO 2020 7789 7813 C HUO 2023 108280 J ZHAO 2023 948 971 W DEWANGAN 2023 14709 14712 C BHATT 2024 866 871 T KUMAWAT 2024 10719 10728 S CENTI 2019 621 632 G NISHIMURA 2001 S HANDBOOKHETEROGENEOUSCATALYTICHYDROGENATIONFORORGANICSYNTHESIS ROESSLER 2003 791 F BELLER 2019 2089 M FORMENTI 2019 2611 2680 D VOGIATZIS 2019 2453 2523 K MANEN 2020 6947 6994 M MCCALLUM 2019 14369 14380 T DAVISGILBERT 2017 11522 11528 Z HAN 2022 e202209232 B HAN 2023 1248 1253 B CACIULEANU 2023 2927 2935 A SINGH 2023 9724 9744 B KUMAR 2020 15740 15754 A RUIZCASTILLO 2016 12564 12649 P NOOR 2022 5654 R ZHANG 2022 e202205671 Y ISHIKAWA 2024 4501 4509 H ISHIKAWA 2023 5744 5751 H ELSAYED 2020 2124 2130 S KARAKULINA 2016 292 296 A MOOCK 2021 13677 13681 D BECKE 1993 5648 5652 A HAY 1985 299 310 P HEHRE 1972 2257 2261 W LU 2012 580 592 T BHATTX2025X115937 BHATTX2025X115937XT 2027-01-11T00:00:00.000Z 2027-01-11T00:00:00.000Z http://creativecommons.org/licenses/by-nc-nd/4.0/ © 2025 Elsevier Inc. All rights are reserved, including those for text and data mining, AI training, and similar technologies. 2025-01-03T10:54:05.863Z http://vtw.elsevier.com/data/voc/AddOnTypes/50.7/aggregated-refined University Grants Commission CRG/2023/002936 UGC University Grants Commission http://data.elsevier.com/vocabulary/SciValFunders/501100001501 http://sws.geonames.org/1269750/ Science and Engineering Research Board SERB Science and Engineering Research Board http://data.elsevier.com/vocabulary/SciValFunders/501100001843 http://sws.geonames.org/1269750/ IIT Hyderabad CRG/2023/005734 IITH Indian Institute of Technology Hyderabad http://data.elsevier.com/vocabulary/SciValFunders/100021136 http://sws.geonames.org/1269750/ K.N. acknowledges the Seed Grant (SG-128) from IIT Hyderabad and CRG/2023/005734 from the Science and Engineering Research Board for financial support. T. B. is thankful to PMRF. S. V. and M.C. are thankful to the University Grants Commission (UGC) New Delhi for awarding junior research fellowships (JRF). S.K.S. acknowledges the Science and Engineering Research Board (CRG/2023/002936) for funding. The support and resources provided by PARAM Seva Facility under the National Supercomputing Mission, Government of India, at IIT Hyderabad, is gratefully acknowledged. https://doi.org/10.15223/policy-017 https://doi.org/10.15223/policy-037 https://doi.org/10.15223/policy-012 https://doi.org/10.15223/policy-029 https://doi.org/10.15223/policy-004 item S0021-9517(25)00001-6 S0021951725000016 1-s2.0-S0021951725000016 10.1016/j.jcat.2025.115937 272561 2025-04-22T20:38:01.355351Z 2025-03-01 2025-03-31 1-s2.0-S0021951725000016-main.pdf https://s3-eu-west-1.amazonaws.com/prod-ucs-content-store-eu-west/content/pii:S0021951725000016/MAIN/application/pdf/4536e9967e9d441acb9aecaec3f9f6cc/main.pdf main.pdf pdf true 2888110 MAIN 12 1-s2.0-S0021951725000016-main_1.png https://s3-eu-west-1.amazonaws.com/prod-ucs-content-store-eu-west/content/pii:S0021951725000016/PREVIEW/image/png/c1a0faa902fbb5701c8e041f563e224a/main_1.png main_1.png png 56656 849 656 IMAGE-WEB-PDF 1 1-s2.0-S0021951725000016-gr5.jpg https://s3-eu-west-1.amazonaws.com/prod-ucs-content-store-eu-west/content/pii:S0021951725000016/gr5/DOWNSAMPLED/image/jpeg/aee2d0e85309801067531c191e856c90/gr5.jpg gr5 gr5.jpg jpg 70837 534 622 IMAGE-DOWNSAMPLED 1-s2.0-S0021951725000016-gr6.jpg https://s3-eu-west-1.amazonaws.com/prod-ucs-content-store-eu-west/content/pii:S0021951725000016/gr6/DOWNSAMPLED/image/jpeg/a30f2730b11301d99bb659c15baeb177/gr6.jpg gr6 gr6.jpg jpg 165929 978 786 IMAGE-DOWNSAMPLED 1-s2.0-S0021951725000016-gr7.jpg https://s3-eu-west-1.amazonaws.com/prod-ucs-content-store-eu-west/content/pii:S0021951725000016/gr7/DOWNSAMPLED/image/jpeg/8d40330998b57770f7bd17521e26c85b/gr7.jpg gr7 gr7.jpg jpg 70717 459 752 IMAGE-DOWNSAMPLED 1-s2.0-S0021951725000016-gr8.jpg https://s3-eu-west-1.amazonaws.com/prod-ucs-content-store-eu-west/content/pii:S0021951725000016/gr8/DOWNSAMPLED/image/jpeg/a46c55d37221f2e4289a0da679f8e8fa/gr8.jpg gr8 gr8.jpg jpg 25856 250 533 IMAGE-DOWNSAMPLED 1-s2.0-S0021951725000016-gr1.jpg https://s3-eu-west-1.amazonaws.com/prod-ucs-content-store-eu-west/content/pii:S0021951725000016/gr1/DOWNSAMPLED/image/jpeg/598cc2c0a55e469c6830f2a7eee45580/gr1.jpg gr1 gr1.jpg jpg 97983 586 631 IMAGE-DOWNSAMPLED 1-s2.0-S0021951725000016-gr2.jpg https://s3-eu-west-1.amazonaws.com/prod-ucs-content-store-eu-west/content/pii:S0021951725000016/gr2/DOWNSAMPLED/image/jpeg/fb0ec68b94d6fbca1ffe62e3d5f7acca/gr2.jpg gr2 gr2.jpg jpg 150045 809 765 IMAGE-DOWNSAMPLED 1-s2.0-S0021951725000016-ga1.jpg https://s3-eu-west-1.amazonaws.com/prod-ucs-content-store-eu-west/content/pii:S0021951725000016/ga1/DOWNSAMPLED/image/jpeg/32e5b710ac3ae0cf53d9b0bc6e14149d/ga1.jpg ga1 true ga1.jpg jpg 34796 192 500 IMAGE-DOWNSAMPLED 1-s2.0-S0021951725000016-gr3.jpg https://s3-eu-west-1.amazonaws.com/prod-ucs-content-store-eu-west/content/pii:S0021951725000016/gr3/DOWNSAMPLED/image/jpeg/d287cb79c015095e0f3aae739d418b29/gr3.jpg gr3 gr3.jpg jpg 70191 532 774 IMAGE-DOWNSAMPLED 1-s2.0-S0021951725000016-gr4.jpg https://s3-eu-west-1.amazonaws.com/prod-ucs-content-store-eu-west/content/pii:S0021951725000016/gr4/DOWNSAMPLED/image/jpeg/a2e79e16a095ebf000495c4e5fdfc09c/gr4.jpg gr4 gr4.jpg jpg 78120 528 756 IMAGE-DOWNSAMPLED 1-s2.0-S0021951725000016-fx1.jpg https://s3-eu-west-1.amazonaws.com/prod-ucs-content-store-eu-west/content/pii:S0021951725000016/fx1/DOWNSAMPLED/image/jpeg/b58b0c66019ca70cd38094cb5ed431d8/fx1.jpg fx1 fx1.jpg jpg 47300 581 542 IMAGE-DOWNSAMPLED 1-s2.0-S0021951725000016-gr5.sml https://s3-eu-west-1.amazonaws.com/prod-ucs-content-store-eu-west/content/pii:S0021951725000016/gr5/THUMBNAIL/image/gif/9b5021e7f92ae196c3e3751159ff5a43/gr5.sml gr5 gr5.sml sml 8545 164 191 IMAGE-THUMBNAIL 1-s2.0-S0021951725000016-gr6.sml https://s3-eu-west-1.amazonaws.com/prod-ucs-content-store-eu-west/content/pii:S0021951725000016/gr6/THUMBNAIL/image/gif/8f14fe2cdf279da445d7ffda407fc586/gr6.sml gr6 gr6.sml sml 8235 163 131 IMAGE-THUMBNAIL 1-s2.0-S0021951725000016-gr7.sml https://s3-eu-west-1.amazonaws.com/prod-ucs-content-store-eu-west/content/pii:S0021951725000016/gr7/THUMBNAIL/image/gif/7247b9156c0d30ebc2596cbc063ada94/gr7.sml gr7 gr7.sml sml 8272 134 219 IMAGE-THUMBNAIL 1-s2.0-S0021951725000016-gr8.sml https://s3-eu-west-1.amazonaws.com/prod-ucs-content-store-eu-west/content/pii:S0021951725000016/gr8/THUMBNAIL/image/gif/ff6297b6b980226929d3b64eb9bfad1e/gr8.sml gr8 gr8.sml sml 7245 103 219 IMAGE-THUMBNAIL 1-s2.0-S0021951725000016-gr1.sml https://s3-eu-west-1.amazonaws.com/prod-ucs-content-store-eu-west/content/pii:S0021951725000016/gr1/THUMBNAIL/image/gif/013ef3277e60cc7a66fd9fd399c1af7c/gr1.sml gr1 gr1.sml sml 10955 164 176 IMAGE-THUMBNAIL 1-s2.0-S0021951725000016-gr2.sml https://s3-eu-west-1.amazonaws.com/prod-ucs-content-store-eu-west/content/pii:S0021951725000016/gr2/THUMBNAIL/image/gif/91e329c9c776c4e1782d9f9b33dcb423/gr2.sml gr2 gr2.sml sml 8820 164 155 IMAGE-THUMBNAIL 1-s2.0-S0021951725000016-ga1.sml https://s3-eu-west-1.amazonaws.com/prod-ucs-content-store-eu-west/content/pii:S0021951725000016/ga1/THUMBNAIL/image/gif/0fbe9ba30937e0700ea815911518921b/ga1.sml ga1 true ga1.sml sml 6277 84 219 IMAGE-THUMBNAIL 1-s2.0-S0021951725000016-gr3.sml https://s3-eu-west-1.amazonaws.com/prod-ucs-content-store-eu-west/content/pii:S0021951725000016/gr3/THUMBNAIL/image/gif/09f33357244b4cded173b0418e7079d5/gr3.sml gr3 gr3.sml sml 6701 150 219 IMAGE-THUMBNAIL 1-s2.0-S0021951725000016-gr4.sml https://s3-eu-west-1.amazonaws.com/prod-ucs-content-store-eu-west/content/pii:S0021951725000016/gr4/THUMBNAIL/image/gif/14d8caa0f28c097df14d0bf884997046/gr4.sml gr4 gr4.sml sml 8598 153 219 IMAGE-THUMBNAIL 1-s2.0-S0021951725000016-fx1.sml https://s3-eu-west-1.amazonaws.com/prod-ucs-content-store-eu-west/content/pii:S0021951725000016/fx1/THUMBNAIL/image/gif/5b5bd4de4e6e44b76999591f3bd90d35/fx1.sml fx1 fx1.sml sml 3913 164 153 IMAGE-THUMBNAIL 1-s2.0-S0021951725000016-gr5_lrg.jpg https://s3-eu-west-1.amazonaws.com/prod-ucs-content-store-eu-west/content/pii:S0021951725000016/HIGHRES/image/jpeg/90a66bf54bc0c598065cddd77d533ac3/gr5_lrg.jpg gr5 gr5_lrg.jpg jpg 554158 2367 2756 IMAGE-HIGH-RES 1-s2.0-S0021951725000016-gr6_lrg.jpg https://s3-eu-west-1.amazonaws.com/prod-ucs-content-store-eu-west/content/pii:S0021951725000016/HIGHRES/image/jpeg/d187a7dabb5e0d4f6c847504cf25b8ba/gr6_lrg.jpg gr6 gr6_lrg.jpg jpg 1149497 4331 3479 IMAGE-HIGH-RES 1-s2.0-S0021951725000016-gr7_lrg.jpg https://s3-eu-west-1.amazonaws.com/prod-ucs-content-store-eu-west/content/pii:S0021951725000016/HIGHRES/image/jpeg/d15c17ad2cf3b75c7a220eeed82cf252/gr7_lrg.jpg gr7 gr7_lrg.jpg jpg 540132 2031 3331 IMAGE-HIGH-RES 1-s2.0-S0021951725000016-gr8_lrg.jpg https://s3-eu-west-1.amazonaws.com/prod-ucs-content-store-eu-west/content/pii:S0021951725000016/HIGHRES/image/jpeg/6639d4bcb0b4e5277ef9cb7ee16413e2/gr8_lrg.jpg gr8 gr8_lrg.jpg jpg 207021 1109 2362 IMAGE-HIGH-RES 1-s2.0-S0021951725000016-gr1_lrg.jpg https://s3-eu-west-1.amazonaws.com/prod-ucs-content-store-eu-west/content/pii:S0021951725000016/HIGHRES/image/jpeg/ee2a788edd339266a2fe76261be59a13/gr1_lrg.jpg gr1 gr1_lrg.jpg jpg 792229 2597 2795 IMAGE-HIGH-RES 1-s2.0-S0021951725000016-gr2_lrg.jpg https://s3-eu-west-1.amazonaws.com/prod-ucs-content-store-eu-west/content/pii:S0021951725000016/HIGHRES/image/jpeg/af06dbf56c72caee5e140e496be1e9a3/gr2_lrg.jpg gr2 gr2_lrg.jpg jpg 1139415 3582 3389 IMAGE-HIGH-RES 1-s2.0-S0021951725000016-ga1_lrg.jpg https://s3-eu-west-1.amazonaws.com/prod-ucs-content-store-eu-west/content/pii:S0021951725000016/HIGHRES/image/jpeg/32f1b0bcceaf7f08aa467d689093f1ea/ga1_lrg.jpg ga1 true ga1_lrg.jpg jpg 224784 849 2213 IMAGE-HIGH-RES 1-s2.0-S0021951725000016-gr3_lrg.jpg https://s3-eu-west-1.amazonaws.com/prod-ucs-content-store-eu-west/content/pii:S0021951725000016/HIGHRES/image/jpeg/b1e33582cf3cf4995852b78d44d682bf/gr3_lrg.jpg gr3 gr3_lrg.jpg jpg 498817 2353 3426 IMAGE-HIGH-RES 1-s2.0-S0021951725000016-gr4_lrg.jpg https://s3-eu-west-1.amazonaws.com/prod-ucs-content-store-eu-west/content/pii:S0021951725000259/HIGHRES/image/jpeg/8b5b4e53894de8495179f785d8cad31d/gr4_lrg.jpg gr4 gr4_lrg.jpg jpg 549484 2338 3346 IMAGE-HIGH-RES 1-s2.0-S0021951725000016-fx1_lrg.jpg https://s3-eu-west-1.amazonaws.com/prod-ucs-content-store-eu-west/content/pii:S0021951725000259/HIGHRES/image/jpeg/c086cfc7874ac9e858e000904152eba7/fx1_lrg.jpg fx1 fx1_lrg.jpg jpg 360560 2576 2402 IMAGE-HIGH-RES 1-s2.0-S0021951725000016-mmc1.docx https://s3-eu-west-1.amazonaws.com/prod-ucs-content-store-eu-west/content/pii:S0021951725000016/mmc1/MAIN/application/vnd.openxmlformats-officedocument.wordprocessingml.document/308c274873d6f6b3c7efe2f5ceb2c9f5/mmc1.docx mmc1 mmc1.docx docx 21946090 APPLICATION YJCAT 115937 115937 S0021-9517(25)00001-6 10.1016/j.jcat.2025.115937 Elsevier Inc. Fig. 1 (A) Overview of aromatic rings to the saturated carbocycles; (B) FDA-approved and top pharmaceuticals bearing piperidine unit; (C) Improved F(sp3 ) through the saturation of N-heterocycle. Fig. 2 (A) Reduction of functionalized N-heteroarenes; (B) Ti-catalyzed reduction of structurally diverse N-heteroarenes using AB. Fig. 3 Proposed catalytic cycle for the hydrogenation of 3-bromoquinoline with DFT optimized Gibbs free energy value in kcal/mol. Fig. 4 DFT computed free energy profile for the reduction of 3-bromoquinoline at B3LYP/LANL2DZ (Ti and Br)/6-31G** level of theory. Scheme 1 Substrate scope for the reduction of quinolines bearing functional groups on phenyl ring under optimized conditions.[a] [a] Reaction conditions: 0.5 mmol of quinoline, 3 equiv· NH3·BH3, 10 mol % Cp2TiCl2, 1.0 equiv of NaOMe, 3 mL of dry THF in 21 mL sealed tube and stirred at 120 °C for 24 h, isolated yields. Scheme 2 Substrate scope for the reduction of functionalized quinolines under optimized conditions.[a] [a] Reaction conditions: 0.5 mmol of quinoline, 3 equiv· NH3·BH3, 10 mol % Cp2TiCl2, 1.0 equiv of NaOMe, 3 mL of dry THF in 21 mL sealed tube and stirred at 120 °C for 24 h, isolated yields. Scheme 3 Substrate scope for the reduction of functionalized pyridines under optimized conditions. [a] Reaction conditions: 0.5 mmol of quinoline, 3 equiv· NH3·BH3, 10 mol % Cp2TiCl2, 1.0 equiv of NaOMe, 3 mL of dry THF in 21 mL sealed tube and stirred at 120 °C for 24 h, isolated yields. [b] Reaction conditions: 0.5 mmol of quinoline, 5 equiv· NH3·BH3, 10 mol % Cp2TiCl2, 1.0 equiv of NaOMe, 3 mL of dry THF in 21 mL sealed tube and stirred at 120 °C for 24 h, isolated yields. Scheme 4 Gram-scale reaction: See supporting information for the reaction procedure. Table 1 Optimization of Arene Hydrogenation of 6-Fluoroquinoline.[a] [a]Reaction conditions: 0.5 mmol 1a, 3 equiv· NH3·BH3, 10 mol% Cp2TiCl2, 1.0 equiv of base, 2 mL of solvent in 21 mL sealed tube and stirred at 120 °C for 24 h; Yields were determined by 19F using trifluorotoluene as an internal standard. [b]Isolated yield. Research article Dearomative selective reduction of structurally diverse N-heteroarenes enabled by a homogeneous titanium catalyst Tarun Bhatt Validation Methodology Investigation Formal analysis Data curation a Vadithya Suman Visualization Validation Methodology a Mridula Choudhary Validation Software Investigation Formal analysis b Saurabh Kumar Singh Writing – review & editing Supervision Software Resources b ⁎ Kishore Natte Writing – review & editing Writing – original draft Visualization Validation Supervision Resources Project administration Methodology Investigation Funding acquisition Formal analysis Data curation Conceptualization a ⁎ a Laboratory of Sustainable Catalysis and Organic Synthesis, Department of Chemistry, Indian Institute of Technology Hyderabad, Kandi, Sangareddy 502 285, Telangana, India Laboratory of Sustainable Catalysis and Organic Synthesis Department of Chemistry Indian Institute of Technology Hyderabad Kandi Sangareddy Telangana 502 285 India Laboratory of Sustainable Catalysis and Organic Synthesis, Department of Chemistry, Indian Institute of Technology Hyderabad, Kandi, Sangareddy 502 285, Telangana, India b Computational Inorganic Chemistry Group, Department of Chemistry, Indian Institute of Technology Hyderabad, Kandi, Sangareddy 502 285, Telangana, India Computational Inorganic Chemistry Group Department of Chemistry Indian Institute of Technology Hyderabad Kandi Sangareddy Telangana 502 285 India Computational Inorganic Chemistry Group, Department of Chemistry, Indian Institute of Technology Hyderabad, Kandi, Sangareddy 502 285, Telangana, India ⁎ Corresponding authors. Graphical abstract The reduction of aromatic compounds is a stalwart transformation in modern organic synthesis since it allows the generation of novel complex three-dimensional (3D) chemical entities from two-dimensional precursors (2D), linking readily available aromatic feedstocks with unobtainable alicyclic structures. However, controlling the high level of selectivity of N-heteroarenes (quinolines and pyridines), particularly substituents positioned on the reducible quinoline ring, is both intriguing and challenging, and methods for selective saturation of structurally complex derivatives (multiple aromatic rings) are rarely unaddressed and need further improvements. Also, many approaches suffer from scalability problems, high cost, and low availability of catalysts and tailor-made ligands. To address this issue, we herein report the first example of commercially available titanocene dichloride (Cp2TiCl2)-catalyzed chemoselective reduction of structurally diverse nitrogen-based heteroarenes with ammonia borane as a reducing agent (>100 examples). The developed protocol features the advantage of chemoselectivity and wide functional group tolerance of quinolines. Meanwhile, the efficient reduction of challenging and unprotected functionalized pyridines, as well as pyrazines, are also furnished with remarkable functional group preservation and also with an improved F(sp3) carbon fraction. Additionally, a few selected furans and benzofuran derivatives were successfully demonstrated under synthetically relevant conditions, and gram-scale synthesis was effectively executed. The methodology can be extended to the saturation of complex N-heteroarenes with conserved selectivity. In addition, density functional theory (DFT) calculations were carried out to shed light on the mechanistic insights into the reduction of quinoline. Keywords Reduction N-Heteroarenes Titanium catalyst Late-stage saturation 1,2,3,4-Tetrahydroquinolines Data availability The data supporting this article have been included as part of the ESI. 1 Introduction Arenes and heteroarenes are very important structural building blocks and are ubiquitously seen in several life science products and agrochemicals [1–6]. Since a larger pool of inert and planar aromatic compounds is accessible from the processing of coal and petroleum feedstocks, including bio-based resources [7,8], they can be readily modified and or functionalized using a variety of well-established synthetic techniques, such as nitration [9], halogenation [10], cross-coupling [11], and many more, especially for preparing core drug analogs. In turn, straightforward access to privileged 3D chemical space using ubiquitous aromatic feedstocks is of prime importance, as their incorporation into the organic structural framework holds substantial value in drug development ( Fig. 1 A) and finds application in a multitude of organic reactions [12,13]. The dearomative selective reduction of (hetero)arenes [12–19] and reductive deuteration [20], especially nitrogenous heterocyclic compounds, represent a direct platform to leverage the preparation of saturated nitrogen-containing heterocycles (cyclic amines) [16,18,21,22], which are advanced chemical building blocks enabling their exploration for targeted therapies [1–6]. For instance, substituted 1,2,3,4-tetrahydroquinolines, piperidines, piperazines, indolines, pyrrolidines, and related ring systems are integral parts of 3D-pharmacophores, orally bioavailable drugs, as well as bio-active natural products ( Fig. 1B) [23–27]. However, generating saturated N-heterocyclic analogues can be a substantial synthetic burden and labor-intensive [16,18]. Therefore, the expansion of robust methodologies is necessary not only to access nitrogen-based 3D-like sp3 -rich fragments for efficient clinical research but also to search for innovative pharmaceutical compounds with enhanced therapeutic efficiency. In addition, the latest accomplishments in the medicinal chemistry community invented “escaping from flatland” i.e., increasing saturation as a tool for improving clinical development success [25,26]. In this sense, saturated heterocyclic rings allow improved F(sp3 ) carbon fraction, increased substitution, and greater structural diversity, as well as enhanced aqueous solubility that may lead to higher bioavailability, which makes them appealing in the drug discovery setting ( Fig. 1C) [12,25,28–30]. In contrast, excessive flat sp2 -rich aromatic cores are associated with some parameters like low specificity (selectivity) and poor solubility in aqueous media [31,32]. For this reason, saturated carbo- and/or heterocyclic ring motifs are present in a large number of top-selling pharmaceuticals and FDA-approved drugs, signifying that 82% of small-molecule therapeutics contain at least one N-heterocycle, with the piperidine, piperazine, and pyrrolidine analogs ring being the most prime ones [6]. In recent years, various research groups have achieved significant advances in the reduction of N-heteroarenes, namely, quinolines, pyridines, and related heterocycles [12–18,33–53]. Despite remarkable progress, there is still a notable gap in the substrate scope. The substrate scope of quinoline derivatives is divided into two types ( Fig. 2 A): 1) substituents present on the phenyl ring and 2) substituents present on the N-heteroarene ring. Although the first one is well-established [12–18,33–40], there are still drawbacks with some functional group compatibility. For example, during the ring saturation process, the persistence of the iodine (I) moiety situated on the benzene core of quinoline is subpar [39,42,47]. Further, methods that tolerate sulfur groups are inadequate [54,55], and phosphorus, as well as silanes [56,57], and many more are barely known. On the other hand, the second type, i.e., the tolerance of the substituents on the reducible nitrogen ring, remains conspicuously incipient. Additionally, the catalytic reduction of functionalized pyridines offers a gateway to piperidine analogs that are found in a vast array of FDA-approved drugs [13,33,35,40,41], which is due to the increased fraction of sp3 carbon atoms (Fsp3 ) that manifest improved drug-like properties [12,25,28–30]. Alternatively, piperidines can be prepared by multiple synthetic techniques, such as cycloadditions, ring expansions, radical cyclizations, nucleophilic substitutions, etc.[19] Among all of these, the reduction of pyridines is an ideal route to access diverse piperidines on a large scale owing to the availability of bulk pyridine derivatives and step-economy. One of the key problems in this chemistry is the binding of coordinating nitrogen atoms to the metal center or the presence of weak C–H bonds close to nitrogen atoms that assist unwanted side reactions [58,59]. Due to this reason, the aromatic reduction of unprotected functionalized pyridines is less known [13,33,35,40,41]. Thus, it is not able to expand the wider piperidine-based 3D chemical space in the small molecule drug discovery process. Just recently, Glorious and co-workers discovered an unprecedented conversion of complex aromatic building blocks into saturated pharmaceuticals by using an Rh-based catalyst and a boron-based H2 source [60]. Subsequently, the same group also reported PtO2-catalyzed controllable and chemoselective hydrogenation of benzene and pyridine rings that exist in pharmaceutically relevant complex molecules [61]. These two reports proved useful in terms of chemo- and diastereoselectivity and overcame several limitations in the hydrogenation of (hetero)arene chemistry, and opened up new frontiers in medicinal and synthetic chemistry [60,61]. Despite these potential transformative innovations, the high-cost of precious metal-based catalysts, the functional group existence on the reducible nitrogen ring of quinoline, and the reduction of pyridines bearing sensitive functional groups remain a significant challenge. Indeed, such skeletons are of great importance owing to their wide range of applications in the synthesis of several drugs and natural products [23–25]. Therefore, the development of the selective and sustainable synthesis of diverse saturated N-heterocycles (e.g., 2-, 3-, or 4-substituted 1,2,3,4-tetrahydroquinolines, and functionalized phenylpiperidine analogs), is highly coveted. Over the last two decades, transfer hydrogenation reactions have emerged as an attractive alternative to the conventional hydrogenation approach [62,63]. A few benefits of the transfer hydrogenation process are (a) the avoidance of special equipment and gaseous H2 cylinder and (b) the large availability of relatively inexpensive hydrogen donors. Among available hydrogen donors [62,63], Ammonia borane (NH3·BH3, AB) is one of the potential solid-state hydrogen-rich material (19.6 wt%) and is comparatively stable in air and moisture [64–67], Further, AB is non-explosive, non-toxic, and moderately inexpensive, and it can be successfully recyclable [64–67]. For these reasons, AB is applied as an efficient H2 source in various chemical transformations [64–66]. In this context, our group also recently utilized AB for the reduction of nitroarenes, heteroarenes, and carboxylic esters [68–70]. Material insufficiency is a particularly crucial problem to be addressed in modern catalysis research [71,72]. Noble metals are often applied not only in the hydrogenation of (hetero)arenes [1–6] but also in other related reactions [21,73], and several industrial processes rely on them. As such, there is an increasing demand to substitute expensive and endangered metals (e.g., Rh, Ir, Pd, Pt, and Ru) with considerably cheaper, sustainable, and abundant 3d metals [74–76]. However, this is a challenging task, as the reactivity of non-precious metals is typically different from that of precious metals. Over the last decade, earth-abundant metal catalysts for hydrogenation of (hetero)arenes with high selectivities have attracted much attention due to their analogous properties with those of precious metal-based catalysts in both homogeneous and heterogeneous catalysis [12–18,33–41]. However, there are some limitations in the substrate scope and late-stage saturation of structurally complex molecules [60,61]. Another crucial limitation is the lack of “general” catalysts for the selective reduction of N-heteroarenes bearing wide reactive functional groups that permit the introduction of greater 3D chemical space and precise structural building blocks into the target molecules. For example [35,40,55], there are exceptionally few reports where a single type of catalyst reduces aromatic rings within heteroarene while preserving different sets of functional groups. Similarly, the same type of catalyst hardly reduces the heteroarene ring in both substituted quinolines and pyridines [12–18,33–47]. To overcome these problems, new catalytic systems are required, which can lower the activation barrier for the reduction of structurally diverse heteroarenes and features tolerance toward reactive functional groups. Such catalytic systems would bring more incentives to pharmaceutical R&D and manufacturing sectors. Notably, Titanium is the second most earth-abundant transition metal as well as non-toxic and plays a crucial role in the field of inexpensive metal catalysis in comparison to other 3d-based metal catalysis [77–79]. Also, titanium complexes frequently display strongly Lewis acidic metal centers. Therefore, titanium-based catalysts are well applied in synthetically useful organic transformations [77–79], particularly titanocene dichloride (Cp2TiCl2), showing new vistas in the exhaustive reduction and hydrodehalogenation as well as hydrodeoxygenation reactions is appealing [80–82]. Specifically, the catalytic exhaustive reduction of oxo-chemicals [80] and hydrodehalogenation of alkyl halides [81] enabled by Cp2TiCl2 are highly remarkable. However, Ti-catalyzed chemoselective reduction of N-heterocycles holding challenging functional groups is, therefore, elusive in the literature. Inspired by the above-mentioned breakthrough reports as well as our continuous interest in the reduction of (hetero)arenes [69,83,84], here, we report that a simple titanocene dichloride allows for chemoselective reduction of N-heterocycles, especially functionalized quinolines, and pyridines, including few benzofurans using AB as an H2 source, and without the requirement of external sophisticated ligands ( Fig. 2B). 2 Results and Discussion We initiated our investigations by evaluating the reduction of 6-Fluoroquinoline (1a) as a model substrate (0.5 mmol) with 3 equivalents of AB as the hydrogen source in the presence of Cp2TiCl2 (10 mol%) and NaOMe (1 equiv.) in dry THF (3 mL) at 120 °C for 24 h; 93% (isolated yield) of the desired product 6-fluoro-1,2,3,4-tetrahydroquinoline (1b) was obtained ( Table 1 , entry 1) and no byproduct (defluorination) is detected. Lowering the amount of AB (from 2 to 1 equiv.) resulted in a decay of 1b yield, and no product (1b) formation took place in the absence of AB (entries 2–4). Further, other reducing reagents (( t Bu)NH2·BH3, NHMe2·BH3, 9-BBN, HBpin, Ph3SiH, Et3SiH, Ph2SiH2, Et2SiH2) were tested instead of AB, and AB was found to be the best among others (see supporting information, Table S1). A number of bases were screened NaOMe, NaOH, KOH, KOtBu, NaOtBu, KOMe, NaOEt, TEA, and DiPEA (see supporting information Table S2). Interestingly, NaOMe was found to be the optimal one among others (entry 1). However, NaOMe with 0.5 equiv. gave only 68% of 1b (entry 5), and without base, a drastic decrease in the yield of 1b was observed (entry 6). These results clearly showed the critical role of the base in the reaction. Other Ti catalysts (Cp2Ti(OTf)2, Cp*TiCl3, and TiO2) were all found to be less active than Cp2TiCl2 (see supporting information, Table S3). Next, a few solvents were examined and found that only dry THF afforded 1b in excellent yield (entry 1), while acetonitrile (ACN), dimethylformamide (DMF), toluene, tertiary butanol (tBuOH), 1,4-dioxane, and methyl tertiary butyl ether (MTBE) provided moderate to a good yield of 1b (entries 7–12). Lowering the temperature (100 to 60 °C) and shorter reaction times (18–12 h) gave the product 1b in low to satisfactory yields (entries 13–18). Only a trace of 1b was observed without adding Cp2TiCl2 (entry 19). Having identified optimized reaction conditions (10 mol% Cp2TiCl2, 1 equiv. NaOMe, 3 equiv. AB, 120 °C, 24 h), we thoroughly investigated the scope and compatibility of the reduction of various quinolines. As shown in Scheme 1 , methyl substituents at the 6-, 5-, and 8- positions on the phenyl ring of quinoline, including methoxy substituent at the 6-position, were well-tolerated and gave the corresponding 1,2,3,4-tetrahydroquinolines products in very good yields (entries 1–4). The high functional group tolerance of C-X bonds of quinolines is a valuable asset in numerous applications, from drugs to material science [85]. In this context, the reduction of quinolines-bearing sensitive halides despite their substituent position proved possible, as chloro (5: 87 %), bromo at 6- and 5-position (6: 86 %; 7: 83 %), fluoro at 6-position (8: 93 %), iodo at 6-position (9: 87 %), and a combination of bromo and methyl unit (10: 77 %), chloro and methyl unit (11: 76 %), as well as fluoro and methyl unit (12: 75 %), were all readily accommodated in this reaction. Remarkably, no reductive dehalogenation of the C-X bond or byproduct took place. It is also worth noting that the preservation of the iodo group in 6-Iodoquinoline (9) is extremely challenging, and is rarely reported in the literature with low yields [39,42]. Quinolines with electron-withdrawing and electron-donating groups were also found to be suitable substrates for this transformation. Thus, CF3-, free OH and NH2-containing 1,2,3,4-tetrahydroquinolines (13: 82 %; 14: 84 %; 15: 92 %; 16: 75 %) were formed from their respective quinolines in high yields. Quinoline substrates featuring 6-phenyl, 5-phenyl, 4-fluoro-, 4-trifluoromethoxylphenyl, and 4-trifluoromethylphenyl in the 6-position were also undergone selective quinoline reduction (17: 82 %; 18: 83 %; 17: 83 %; 19: 78 %; 20: 81 %; 21: 80 %). Notably, 6-styrylquinoline provided exceptional chemoselectivity, and exclusively the quinoline ring was reduced without harming the double bond (22: 85 %). 1,2,3,4-tetrahydroisoquinolines are unique scaffolds in natural products and medicinal chemistry [27]; a few selected examples are demonstrated here with our optimized conditions and achieved the targeted products in excellent yields (23–25: 79–92 % yields). Unfortunately, 7-nitroquinoline and quinoline-6-pinacol were found to be unsuitable under the standard reaction conditions (See supporting information, Scheme S5). Next, we explored the structural diversity of quinolines-bearing substituents directly on the reducible ring ( Scheme 2 ). Simple and methyl substituents at the 2-,3-, and 4-position of quinoline gave products 26, 27, 28, and 29 in good to high yields, respectively. Interestingly, bromo and chloro substitution on the 3-position of quinoline ring were tolerated under standard procedure, providing the corresponding products in high yields (30 and 31), which can be used for further cross-coupling reactions involving oxidative addition of an aryl-X (X = Cl, Br). Sensitive functional groups such as bromo and chloro (30 and 31) were untouched under our optimized conditions, showing notable significance in organic synthesis, and such compounds have scarcely been documented. Alcohol derivatives such as 2-quinolinylmethanol and 3-quinolinylmethanol were amenable to this transformation and afforded the quinoline-reduced product 32 and 33 in good yields. It is noteworthy that no hydrodeoxygenation products were observed, underscoring the high selectivity. Even free NH2-group on quinoline ring is tolerated and gave 1,2,3,4-tetrahydroquinolin-3-amine (34) in high yield without any observed byproduct. Encouragingly, quinolines featuring 3-phenyl, and 4-phenyl groups turned out to be effective substrates, being transformed into the targeted tetrahydroquinoline products in good to high yields (35–36). Selective saturation of the N-heteroarene ring in complex molecules can quickly influence the structural and functional diversities [12,13,60,61]. In this respect, several nitrogen-based complex molecules were demonstrated under standard conditions. For instance, 3-(p-tolyl)quinoline, 4-(quinolin-3-yl)phenol, and 3-(4-methoxyphenyl)quinoline were cleanly reduced into the corresponding N-saturated products in good yields with titanium catalysis (37–39) while retaining the aromaticity of other phenyl ring systems. Although organosilicon compounds constitute useful synthetic precursors in Hiyama couplings and Brook rearrangement reactions [86,87], the reduction of silyl-substituted substrates tends to be more challenging due to competing desilylation reactions. Our optimal conditions enable selective quinoline reduction of 3-(4-(trimethylsilyl)phenyl)quinoline smoothly and provide a yield of 75% (40). In this substrate, no desilylation occurred. The incorporation of 4-trifluoromethylphenyl and 4-fluorophenyl substituents into the 3-position of quinoline has no influence on the reduction of N-heterocycle ring; 3-(4-(trifluoromethyl)phenyl)-1,2,3,4-tetrahydroquinoline and 3-(4-fluorophenyl)-1,2,3,4-tetrahydroquinoline congeners (43 and 44) were obtained in excellent yields, which are useful compounds in drug discovery.The chemoselective reduction of N-heterocycles in the presence of a carbon–carbon double bond constitutes an additional challenge in organic synthesis. Thus, we explored the selective reduction of quinolines comprising double bonds. A series of styryl-N-heteroarenes bearing methyl, methoxy, fluoro, and −CF3 were subjected to this procedure, and exclusively the corresponding quinoline-reduced products 45–47 were obtained and isolated in high yields (75–82%) without further double bond reduction, which revealed that a variety of styryl-N-heteroarenes could operate as substrates for our chemoselective N-heteroarene reduction reaction. Despite varying the reaction conditions, when using 3-(4-(trimethylsilyl)phenethyl)quinoline, both double bond and quinoline ring were synchronously reduced and afforded the quinoline-reduced product 48 in good yield. This parallel reduction could be attributed to the electronic influence of the silicon atom. We believe the reduction approach of complex molecules, as well as access to such types of functionalized tetrahydroquinoline-based products, will provide an excellent platform for generating structural analogs to meet the demand for optimizing drug activities. Although there are several catalysts available for the hydrogenation of N-heterocycles [12–18,33–42], sulfur-containing quinolines are still a formidable challenge because sulfur atoms are capable of binding to metal complexes and may poison catalysts. Very recently, glorius and co-workers made a significant contribution in this area and reported a Ru-based heterogeneous catalyst for the hydrogenation of sulfur-containing quinolines with molecular hydrogen as a reductant [54]. The group of Mitsudome also reported sulfur-tolerant ruthenium phosphide catalyst for the reductive amination and hydrogenation reactions [88,89]. However, still, a few molecules with sulfur substituents were not undertaken. In this respect, we subjected five challenging sulfur-containing quinolines with Ti catalyst under the standard reaction conditions that are scarcely reported in the literature. To our delight, the incorporation of 2-methylthiophenyl, 4-methylthiophenyl, and 4-methylsulfonylphenyl substituents on the 3-position of quinoline did not diminish the reaction yield and furnished the corresponding sulfur-containing 1,2,3,4-tetrahydroquinoline in high yields (49–51). It is worth noting that compound 51 is used for the medical treatment of ferroptosis inhibitory. Similar results were obtained with 4-methylthiophenyl and thiomethyl substituents on the 6-position of quinoline to deliver the targeted products 52 and 53 in high yields, and the success of these examples highlights the Ti catalyst's remarkable sulfur resistance in organic synthesis. Tetrahydroquinoxaline skeletons are present in the structures of various biologically relevant compounds [23]. Utilizing our catalytic protocol, three quinoxaline substrates were reduced with full conversion and yielded the desired products 54, 55, and 56 in very good yields. In addition, unprotected simple indole and its derivatives bearing methyl, bromo, fluoro, trifluoromethyl, trifluoromethoxy, and methylsulfonyl functional groups were selectively transformed to the corresponding indolines in excellent yields under standard reaction conditions (57–64). This provides a substantial impact on reduction chemistry, as indolines are widely used in both organic synthesis and drug discovery [22]. The selective reduction of functionalized benzofurans to the corresponding dihydrobenzofuran derivatives is very attractive and remains a challenge [90–92]. Under the standard conditions, benzofuran derivatives, including 2,5-methylfuran and 2-furanmethanol, were also able to reduce very selectivelyand give access to the corresponding dihydrobenzofurans products in good to high yields (65–70). Unfortunately, S-containing heterocycles such as thiophene and benzothiophene did not show any reactivity with our catalytic system. Late-stage saturation of medicinally relevant compounds without disturbing the core structure is a powerful method to quickly generate new analogues [12,13,60,61]. In this regard, we applied our titanium catalyst for the quinoline reduction of some selected bioactive molecules (Scheme 2 ) Firstly, we have synthesized 2-methyl-N-phenyl-1,2,3,4-tetrahydroquinolin-4-amine (71) in 44% isolated yield from 2-methyl-N-phenylquinolin-4-amine as a starting material. Interestingly, compound 71 has significant applications in medicinal chemistry. Similarly, an intermediate of galipeine (72) was also proved successful, leading to their corresponding reduced derivative with good yield. Remarkably, we also prepared α-(4-piperidyl)benzhydrol in 53% isolated yield, which serves as a crucial building block for the manufacture of terfenadine (73). N-heteroarenes, such as hybrid tetrahydroquinoline derivatives with phosphorated functionality, possess antileishmanial activity, and to prepare such compounds, a multi-component approach is essential. By keeping this aspect in mind, we attempted diphenyl(4-(quinolin-3-yl)phenyl)phosphine oxide for this transformation, and selectively quinoline ring was reduced in order to generate the corresponding product (74) in high yields while preserving the aromaticity of other phenyl ring systems. These results clearly indicated the wide generality of our Ti catalytic system to afford structurally diverse saturated N-heterocycles, thereby making important contributions to the field of medicinal chemistry and drug discovery. Based on these promising results, we extended our catalytic protocol for the reduction of unprotected functionalized pyridines ( Scheme 3 ). The resulting piperidines are key saturated heterocyclic scaffolds often encountered in the synthesis of top-selling drugs [23–25]. Simple and methyl-substituted pyridines, including 4-methoxypyridine, were well tolerated and efficiently reduced, thus providing the piperidines 75–80 in high yields. Halide-containing pyridines are extremely challenging molecules for this type of transformation due to competing hydrodehalogenation pathways. Applying our optimal reaction conditions, 4-chloro and 4-bromopyridine rings were selectively reduced and gave access to the corresponding piperidines 81 and 82 in moderate yields. The reaction was also amenable with pyridines bearing –OH, −CF3, –NH2, −NMe2, –CH2NH2, and –CH2OH at 4-position, thus giving the corresponding piperidines 83–88 in satisfactory to good yields upon isolation. Gratifyingly, 4-substituted pyridines with morpholine, pyrrolidine, and piperidine were capable of chemoselectively reducing the pyridine core, affording the desired products in high yields (89–91), which implies great promise for this approach in applications in clinical studies. Interestingly, para-substituted pyridines comprising potential functional groups (−Ph, −PhCl, −PhBr, −PhF, −PhCF3, −OArOCF3) under standard conditions were selectively transformed to the respective functionalized tetrahydropyridines in excellent yields (92–97) that are hitherto difficult to access therefore opening up new possibilities for synthetic and medicinal applications, thus highlighting the sustainability of our current catalysis. Notably, compound 97 is a vital intermediate for the production of delamanid, which is an antibiotic medicine used to treat multidrug-resistant tuberculosis in adults. The aromatic reduction of pyrazine-to-piperazine is seldom reported in the literature despite the potential applications of piperazine motifs in medicinal chemistry [6]. To our delight, our Ti-catalyzed protocol could be further extended to simple and alkyl-substituted pyrazines, affording the corresponding piperazines in high yields (98–102), which are hard to prepare by other methods. Pyrrole also proved to be compatible with this reaction, furnishing the corresponding pyrrolidine in a 73% isolated yield (103). It is worth mentioning that the F(sp 3) carbon fraction has been improved along with the functional group persistence in all the products, as shown in Scheme 3. We also applied our titanium catalytic system for the large-scale synthesis of tetrahydroquinoline-based crucial building blocks in an operationally simple manner. We predominantly conducted a range of 1–5 g scale reactions with some selected quinolines and furnished the products 51a, 39a, 9a, and 26a in good yields, thereby enhancing the practicality of our method ( Scheme 4 ). Based on experimental observations (See supporting information, Fig. S8-S10), computational analyses, and insights from prior literature [80], we proposed a plausible reaction pathway ( Fig. 3 ). Initially, Cp2TiCl2 undergoes a reaction with sodium methoxide, resulting in the in-situ formation of a dimethoxy derivative of the titanocene catalyst. Subsequently, this dimethoxy derivative reacts with ammonia borane, generating an active titanium hydride species and releasing B(OMe)3 ( Fig. 3 , cycle 1) [80]. The presence of B(OMe)3 in the reaction mixture was confirmed by 11B NMR, exhibiting a peak at 20.19 ppm (Fig. S10), and further validated by gas chromatography, showing a retention time of 1.692 (Fig. S236). Additionally, the observed color change from orange to dark blue after stirring a mixture of Cp2TiCl2, NaOMe, and NH3·BH3 in dry THF at 120 °C for 30 min suggests a possible shift in the oxidation state of the metal, indicating the formation of Ti(III) species (Fig. S8). Supporting this observation, an electron paramagnetic resonance (EPR) signal was detected at 298 K, showing a value of g = 1.974, which is consistent with the characteristic EPR signal for Ti(III) species (Fig. S9). Computational studies were conducted to gain further insights into the reaction mechanism [93–97]. The full cycle of catalytic hydroboration, where the Gibbs free energies corresponding to all the intermediates and transition states involved, are shown in Figs. 3 and 4 . The DFT calculations indicates that the reaction progresses through the coordination of 3-bromoquinoline [I], with the coordinatively unsaturated Cp2Ti(III)-H species (A), forms an intermediate B, which is ∼1.74 kcal/mol more stabilized than A. In the next step, the metal hydride transfers from the Ti(III) center to the 2-position C atom of the quinoline ring (intramolecular hydride transfer) via TS1 to yield an intermediate C. The formation of species C from B is an endergonic process (1.47 kcal/mol). The Ti-H/C–H bond distances are 1.712 Å/2.696 Å (1.746 Å/1.821 Å) in B(TS1), indicating a simultaneous breaking of the Ti-H bond and the formation of the C–H bonds towards species C. Laplacian electron density [97] for the TS1 shows the bond critical points between the Ti-H-C confirms hydride transfer pathway (Fig. S7(a)). The computed IRC pathway further verifies the correctness of the TS1. (Fig. S5) The TS1 requires a free energy barrier of ∼12.8 kcal/mol (ΔH393.15 = 8.75 kcal/mol) and is the rate-determining step for the overall reaction. In the next step, NH3·BH3 is introduced in the cycle, forming a reaction complex (D). The titanium-amido complex D is ∼8.46 kcal/mol higher in energy than species C. Electrostatic potential maps and NPA charge analysis of NH3·BH3 suggest that the BH3 group is electron-rich while the NH3 group is electron-deficient in nature (Fig. S4(b)). The formation of a titanium-amido complex in species D can facilitate the activation of the NH3·BH3 by generating hydride-proton species. The next step involves a concerted H+/H− mechanism where H− from the electron-rich BH3 unit is delivered to the positively charged Ti atom while the H+ from the electron-deficient NH3 unit is transferred to the quinoline nitrogen. The computed free energy barrier for TS2 is ∼9.69 kcal/mol. Laplacian electron density of the TS2 reveals the presence of BCP between the N–H-C and B-H-Ti centers, further confirming the concerted H+/H− pathway. (Fig. S7(b)) The TS2 yields the formation of 3-bromo-1,2-dihydroquinoline [II] ( Figs. 3 and 4 ) (characterized by 1H NMR and HRMS (Fig. S234, S235)), NH2·BH2, and regenerates the Cp2Ti(III)-H catalyst for the subsequent complete reduction cycle to form 3-bromo-1,2,3,4-tetrahydroquinoline (III) ( Fig. 3 , cycle 2 and Fig. 4 ). 3 Conclusion In conclusion, we have developed the first versatile and useful approach for the selective reduction of structurally diverse nitrogen-based heteroarenes with ammonia borane as a reducing agent in the presence of a homogeneous Cp2TiCl2 catalyst. The reaction enables a broad functional group tolerance of quinolines under synthetically relevant conditions, which proved useful for complex and medicinally relevant compounds. Particularly, for the first time, we have shown the chemoselective reduction of quinolines-bearing substituents directly on the reducible ring (e.g., Br, Cl, Ph-CF3, PhOCF3, Ph-F, Ph-SO2Me, and styryl derivatives) and many of the isolated corresponding Csp3-rich N-heterocycles are elusive in literature. Further, unprotected functionalized pyridines (e.g., Cl, Br, OH, CF3, NH2, CH2-NH2, CH2-OH, Ph-Br, Ph-Cl, Ph-CF3, PhOCF3), indoles, pyrazines, and some selected benzofuran derivatives were also successfully demonstrated, and gram-scale synthesis was also effectively executed. The Ti-catalyst is also viable for the partial reduction of 3-bromoquinoline, illustrating the very nice regioselectivity of this approach. DFT calculations support Cp2Ti(III)-H formation as an active species and predict a concerted H+/H− mechanism for the hydrogenation of quinoline. We believe the isolated saturated nitrogenous-based products using ammonia borane and titanium as green catalysts will enhance drug discovery space. Author contributions The manuscript was written through the contributions of all authors. All authors have given approval to the final version of the manuscript. CRediT authorship contribution statement Tarun Bhatt: Validation, Methodology, Investigation, Formal analysis, Data curation. Vadithya Suman: Visualization, Validation, Methodology. Mridula Choudhary: Validation, Software, Investigation, Formal analysis. Saurabh Kumar Singh: Writing – review & editing, Supervision, Software, Resources. Kishore Natte: Writing – review & editing, Writing – original draft, Visualization, Validation, Supervision, Resources, Project administration, Methodology, Investigation, Funding acquisition, Formal analysis, Data curation, Conceptualization. Declaration of competing interest The authors declare that they have no known competing financial interests or personal relationships that could have appeared to influence the work reported in this paper. Acknowledgements K.N. acknowledges the Seed Grant (SG-128) from IIT Hyderabad and CRG/2023/005734 from the Science and Engineering Research Board for financial support. T. B. is thankful to PMRF. S. V. and M.C. are thankful to the University Grants Commission (UGC) New Delhi for awarding junior research fellowships (JRF). S.K.S. acknowledges the Science and Engineering Research Board (CRG/2023/002936) for funding. The support and resources provided by PARAM Seva Facility under the National Supercomputing Mission, Government of India, atIITHyderabad, is gratefully acknowledged. Appendix A Supplementary data Supplementary data to this article can be found online at https://doi.org/10.1016/j.jcat.2025.115937. Appendix A Supplementary data The following are the Supplementary data to this article: Supplementary Data 1 References [1] R.D. Taylor M. MacCoss A.D.G. Lawson Rings in Drugs J. Med. Chem. 57 2014 5845 5859 R.D. Taylor, M. MacCoss, A.D.G. Lawson, Rings in Drugs, J. Med. Chem., 57 (2014) 5845-5859. [2] P. Das M.D. Delost M.H. Qureshi D.T. Smith J.T. Njardarson A Survey of the Structures of US FDA Approved Combination Drugs J. Med.chem. 62 2019 4265 4311 P. Das, M.D. Delost, M.H. Qureshi, D.T. Smith, J.T. Njardarson, A Survey of the Structures of US FDA Approved Combination Drugs, J. Med.Chem., 62 (2019) 4265-4311. [3] Y. Sanemitsu S. Kawamura Studies on the synthetic development for the discovery of novel heterocyclic agrochemicals J. Pest. Sci. 33 2008 175 177 Y. Sanemitsu, S. Kawamura, Studies on the synthetic development for the discovery of novel heterocyclic agrochemicals, J. Pest. Sci. 33 (2008) 175-177. [4] K.A. Scott P.B. Cox J.T. Njardarson Phenols in Pharmaceuticals: Analysis of a Recurring Motif J. Med.chem. 65 2022 7044 7072 K.A. Scott, P.B. Cox, J.T. Njardarson, Phenols in Pharmaceuticals: Analysis of a Recurring Motif, J. Med.Chem. 65 (2022) 7044-7072. [5] E. Vitaku D.T. Smith J.T. Njardarson Analysis of the Structural Diversity, Substitution Patterns, and Frequency of Nitrogen Heterocycles among U.S. FDA Approved Pharmaceuticals J. Med.chem. 57 2014 10257 10274 E. Vitaku, D.T. Smith, J.T. Njardarson, Analysis of the Structural Diversity, Substitution Patterns, and Frequency of Nitrogen Heterocycles among U.S. FDA Approved Pharmaceuticals, J. Med.Chem. 57 (2014) 10257-10274. [6] C.M. Marshall, J.G. Federice, C.N. Bell, P.B. Cox, J.T. Njardarson, An Update on the Nitrogen Heterocycle Compositions and Properties of U.S. FDA-Approved Pharmaceuticals (2013–2023), J. Med.Chem. (2024). [7] H.I. Abdel-Shafy M.S.M. Mansour A review on polycyclic aromatic hydrocarbons: Source, environmental impact, effect on human health and remediation, Egypt J. Petrol. 25 2016 107 123 H.I. Abdel-Shafy, M.S.M. Mansour, A review on polycyclic aromatic hydrocarbons: Source, environmental impact, effect on human health and remediation, Egypt. J. Petrol., 25 (2016) 107-123. [8] A. Corma S. Iborra A. Velty Chemical Routes for the Transformation of Biomass into Chemicals Chem. Rev. 107 2007 2411 2502 A. Corma, S. Iborra, A. Velty, Chemical Routes for the Transformation of Biomass into Chemicals, Chem Rev. 107 (2007) 2411-2502. [9] R. Calvo K. Zhang A. Passera D. Katayev Facile access to nitroarenes and nitroheteroarenes using N-nitrosaccharin Nat. Commun. 10 2019 3410 R. Calvo, K. Zhang, A. Passera, D. Katayev, Facile access to nitroarenes and nitroheteroarenes using N-nitrosaccharin, Nat. Commun. 10 (2019) 3410. [10] P. Tao Y. Li K. Zheng Electrochemical Direct C−H Halogenation of N-Heteroarenes and Naphthols Eur. J. Org. Chem. 26 2023 e202300622 P. Tao, Y. Li, K. Zheng, Electrochemical Direct C−H Halogenation of N-Heteroarenes and Naphthols, Eur. J. Org. Chem. 26 (2023) e202300622. [11] L.-C. Campeau N. Hazari Cross-Coupling and Related Reactions: Connecting Past Success to the Development of New Reactions for the Future Organometallics 38 2019 3 35 L.-C. Campeau, N. Hazari, Cross-Coupling and Related Reactions: Connecting Past Success to the Development of New Reactions for the Future, Organometallics, 38 (2019) 3-35. [12] L. Lückemeier M. Pierau F. Glorius Asymmetric arene hydrogenation: towards sustainability and application Chem. Soc. Rev. 52 2023 4996 5012 L. Lückemeier, M. Pierau, F. Glorius, Asymmetric arene hydrogenation: towards sustainability and application, Chem. Soc. Rev. 52 (2023) 4996-5012. [13] M.P. Wiesenfeldt Z. Nairoukh T. Dalton F. Glorius Selective Arene Hydrogenation for Direct Access to Saturated Carbo- and Heterocycles Angew. Chem. Int. Ed. 58 2019 10460 10476 M.P. Wiesenfeldt, Z. Nairoukh, T. Dalton, F. Glorius, Selective Arene Hydrogenation for Direct Access to Saturated Carbo- and Heterocycles, Angew Chem Int Ed. 58 (2019) 10460-10476. [14] W.C. Wertjes E.H. Southgate D. Sarlah Recent advances in chemical dearomatization of nonactivated arenes Chem. Soc. Rev. 47 2018 7996 8017 W.C. Wertjes, E.H. Southgate, D. Sarlah, Recent advances in chemical dearomatization of nonactivated arenes, Chem. Soc. Rev. 47 (2018) 7996-8017. [15] C.J. Huck D. Sarlah Shaping Molecular Landscapes: Recent Advances Opportunities, and Challenges in Dearomatization, Chem 6 2020 1589 1603 C.J. Huck, D. Sarlah, Shaping Molecular Landscapes: Recent Advances, Opportunities, and Challenges in Dearomatization, Chem, 6 (2020) 1589-1603. [16] Z. Wei F. Shao J. Wang Recent advances in heterogeneous catalytic hydrogenation and dehydrogenation of N-heterocycles, Chinese J. Catal. 40 2019 980 1002 Z. Wei, F. Shao, J. Wang, Recent advances in heterogeneous catalytic hydrogenation and dehydrogenation of N-heterocycles, Chinese J. Catal. 40 (2019) 980-1002. [17] H.Z. Chen Qian D. Kuiling Transition Metal Catalyzed Carbocycle-Selective Asymmetric Hydrogenation of Aromatic Rings, C Chin. J. Org. Chem. 44 2024 2063 2076 H.Z. Chen Qian, Ding Kuiling, Transition Metal Catalyzed Carbocycle-Selective Asymmetric Hydrogenation of Aromatic Rings, C Chin. J. Org. Chem, 44 (2024), 2063-2076.. [18] M. Escolano D. Gaviña G. Alzuet-Piña S. Díaz-Oltra M. Sánchez-Roselló C.d. Pozo, Recent Strategies in the Nucleophilic Dearomatization of Pyridines, Quinolines, and Isoquinolines Chem. Rev. 124 2024 1122 1246 M. Escolano, D. Gaviña, G. Alzuet-Piña, S. Díaz-Oltra, M. Sánchez-Roselló, C.d. Pozo, Recent Strategies in the Nucleophilic Dearomatization of Pyridines, Quinolines, and Isoquinolines, Chem. Rev. 124 (2024) 1122-1246. [19] N.A. Frolov A.N. Vereshchagin Piperidine Derivatives: Recent Advances in Synthesis and Pharmacological Applications Int. J. Mol. Sci. 24 2023 2937 N.A. Frolov, A.N. Vereshchagin, Piperidine Derivatives: Recent Advances in Synthesis and Pharmacological Applications, Int. J. Mol. Sci. 24 (2023) 2937. [20] F. Bu Y. Deng J. Xu D. Yang Y. Li W. Li A. Lei Electrocatalytic reductive deuteration of arenes and heteroarenes Nature 2024 F. Bu, Y. Deng, J. Xu, D. Yang, Y. Li, W. Li, A. Lei, Electrocatalytic reductive deuteration of arenes and heteroarenes, Nature, (2024). [21] D. Ren L. He L. Yu R.-S. Ding Y.-M. Liu Y. Cao H.-Y. He K.-N. Fan An Unusual Chemoselective Hydrogenation of Quinoline Compounds Using Supported Gold Catalysts J. Am. Chem. Soc. 134 2012 17592 17598 D. Ren, L. He, L. Yu, R.-S. Ding, Y.-M. Liu, Y. Cao, H.-Y. He, K.-N. Fan, An Unusual Chemoselective Hydrogenation of Quinoline Compounds Using Supported Gold Catalysts, J. Am. Chem. Soc. 134 (2012) 17592-17598. [22] H. Wei B. Li N. Wang Y. Ma J. Yu X. Wang J. Su D. Liu Development and Application of Indolines in Pharmaceuticals ChemistryOpen 12 2023 e202200235 H. Wei, B. Li, N. Wang, Y. Ma, J. Yu, X. Wang, J. Su, D. Liu, Development and Application of Indolines in Pharmaceuticals, ChemistryOpen, 12 (2023) e202200235. [23] V. Sridharan P.A. Suryavanshi J.C. Menéndez Advances in the Chemistry of Tetrahydroquinolines Chem. Rev. 111 2011 7157 7259 V. Sridharan, P.A. Suryavanshi, J.C. Menéndez, Advances in the Chemistry of Tetrahydroquinolines, Chem. Rev., 111 (2011) 7157-7259. [24] S. Källström R. Leino Synthesis of pharmaceutically active compounds containing a disubstituted piperidine framework Bioorg. Med. Chem. 16 2008 601 635 S. Källström, R. Leino, Synthesis of pharmaceutically active compounds containing a disubstituted piperidine framework, Bioorg. Med. Chem. 16 (2008) 601-635. [25] F. Lovering J. Bikker C. Humblet Escape from Flatland: Increasing Saturation as an Approach to Improving Clinical Success J. Med. Chem. 52 2009 6752 6756 F. Lovering, J. Bikker, C. Humblet, Escape from Flatland: Increasing Saturation as an Approach to Improving Clinical Success, J. Med. Chem. 52 (2009) 6752-6756. [26] F. Lovering Escape from Flatland 2: complexity and promiscuity MedChemComm 4 2013 515 519 F. Lovering, Escape from Flatland 2: complexity and promiscuity, MedChemComm, 4 (2013) 515-519. [27] B.K. Faheem K.V.G.C. Kumar S. Sekhar S. Chander S.M. Kunjiappan Medicinal chemistry perspectives of 1,2,3,4-tetrahydroisoquinoline analogs – biological activities and SAR studies RSC Adv. 11 2021 12254 12287 Faheem, B. Karan Kumar, K.V.G. Chandra Sekhar, S. Chander, S. Kunjiappan, S. Murugesan, Medicinal chemistry perspectives of 1,2,3,4-tetrahydroisoquinoline analogs – biological activities and SAR studies, RSC Adv. 11 (2021) 12254-12287. [28] W. Wei S. Cherukupalli L. Jing X. Liu P. Zhan Fsp3: A new parameter for drug-likeness Drug Discov. Today 25 2020 1839 1845 W. Wei, S. Cherukupalli, L. Jing, X. Liu, P. Zhan, Fsp3: A new parameter for drug-likeness, Drug Discov. Today 25 (2020) 1839-1845. [29] https://lifechemicals.com/screening-libraries/fsp3-enriched-library (accessed on 12-10-2024). [30] A.R. Hanby N.S. Troelsen T.J. Osberger S.L. Kidd K.T. Mortensen D.R. Spring Fsp3-rich and diverse fragments inspired by natural products as a collection to enhance fragment-based drug discovery Chem. Commun. 56 2020 2280 2283 A.R. Hanby, N.S. Troelsen, T.J. Osberger, S.L. Kidd, K.T. Mortensen, D.R. Spring, Fsp3-rich and diverse fragments inspired by natural products as a collection to enhance fragment-based drug discovery, Chem. Commun., 56 (2020) 2280-2283. [31] T.J. Ritchie S.J.F. Macdonald R.J. Young S.D. Pickett The impact of aromatic ring count on compound developability: further insights by examining carbo- and hetero-aromatic and -aliphatic ring types Drug Discov. Today 16 2011 164 171 T.J. Ritchie, S.J.F. Macdonald, R.J. Young, S.D. Pickett, The impact of aromatic ring count on compound developability: further insights by examining carbo- and hetero-aromatic and -aliphatic ring types, Drug Discov. Today 16 (2011) 164-171. [32] T.J. Ritchie S.J.F. Macdonald The impact of aromatic ring count on compound developability – are too many aromatic rings a liability in drug design? Drug Discov. Today 14 2009 1011 1020 T.J. Ritchie, S.J.F. Macdonald, The impact of aromatic ring count on compound developability – are too many aromatic rings a liability in drug design?, Drug Discov. Today 14 (2009) 1011-1020. [33] Y. Liu H. Du Metal-Free Borane-Catalyzed Highly Stereoselective Hydrogenation of Pyridines J. Am. Chem. Soc. 135 2013 12968 12971 Y. Liu, H. Du, Metal-Free Borane-Catalyzed Highly Stereoselective Hydrogenation of Pyridines, J. Am. Chem. Soc. 135 (2013) 12968-12971. [34] S. Kim F. Loose M.J. Bezdek X. Wang P.J. Chirik Hydrogenation of N-Heteroarenes Using Rhodium Precatalysts: Reductive Elimination Leads to Formation of Multimetallic Clusters J. Am. Chem. Soc. 141 2019 17900 17908 S. Kim, F. Loose, M.J. Bezdek, X. Wang, P.J. Chirik, Hydrogenation of N-Heteroarenes Using Rhodium Precatalysts: Reductive Elimination Leads to Formation of Multimetallic Clusters, J. Am. Chem. Soc. 141 (2019) 17900-17908. [35] F. Chen W. Li B. Sahoo C. Kreyenschulte G. Agostini H. Lund K. Junge M. Beller Hydrogenation of Pyridines Using a Nitrogen-Modified Titania-Supported Cobalt Catalyst Angew. Chem. Int. Ed. 57 2018 14488 14492 F. Chen, W. Li, B. Sahoo, C. Kreyenschulte, G. Agostini, H. Lund, K. Junge, M. Beller, Hydrogenation of Pyridines Using a Nitrogen-Modified Titania-Supported Cobalt Catalyst, Angew. Chem. Int. Ed. 57 (2018) 14488-14492. [36] B. Sahoo C. Kreyenschulte G. Agostini H. Lund S. Bachmann M. Scalone K. Junge M. Beller A robust iron catalyst for the selective hydrogenation of substituted (iso)quinolones Chem. Sci. 9 2018 8134 8141 B. Sahoo, C. Kreyenschulte, G. Agostini, H. Lund, S. Bachmann, M. Scalone, K. Junge, M. Beller, A robust iron catalyst for the selective hydrogenation of substituted (iso)quinolones, Chem Sci. 9 (2018) 8134-8141. [37] Z. Nairoukh M. Wollenburg C. Schlepphorst K. Bergander F. Glorius The formation of all-cis-(multi)fluorinated piperidines by a dearomatization–hydrogenation process Nat. Chem. 11 2019 264 270 Z. Nairoukh, M. Wollenburg, C. Schlepphorst, K. Bergander, F. Glorius, The formation of all-cis-(multi)fluorinated piperidines by a dearomatization–hydrogenation process, Nat. Chem. 11 (2019) 264-270. [38] F. Chen A.-E. Surkus L. He M.-M. Pohl J. Radnik C. Topf K. Junge M. Beller Selective Catalytic Hydrogenation of Heteroarenes with N-Graphene-Modified Cobalt Nanoparticles (Co3O4–Co/NGr@α-Al2O3) J J. Am. Chem. Soc. 137 2015 11718 11724 F. Chen, A.-E. Surkus, L. He, M.-M. Pohl, J. Radnik, C. Topf, K. Junge, M. Beller, Selective Catalytic Hydrogenation of Heteroarenes with N-Graphene-Modified Cobalt Nanoparticles (Co3O4–Co/NGr@α-Al2O3), J J. Am. Chem. Soc. 137 (2015) 11718-11724. [39] S. Zhang J. Gan Z. Xia X. Chen Y. Zou X. Duan Y. Qu Dual-Active-Sites Design of Co@C Catalysts for Ultrahigh Selective Hydrogenation of N-Heteroarenes Chem 6 2020 2994 3006 S. Zhang, J. Gan, Z. Xia, X. Chen, Y. Zou, X. Duan, Y. Qu, Dual-Active-Sites Design of Co@C Catalysts for Ultrahigh Selective Hydrogenation of N-Heteroarenes, Chem, 6 (2020) 2994-3006. [40] K. Murugesan V.G. Chandrashekhar C. Kreyenschulte M. Beller R.V. Jagadeesh A General Catalyst Based on Cobalt Core–Shell Nanoparticles for the Hydrogenation of N-Heteroarenes Including Pyridines Angew. Chem. Int. Ed. 59 2020 17408 17412 K. Murugesan, V.G. Chandrashekhar, C. Kreyenschulte, M. Beller, R.V. Jagadeesh, A General Catalyst Based on Cobalt Core–Shell Nanoparticles for the Hydrogenation of N-Heteroarenes Including Pyridines, Angew. Chem. Int. Ed. 59 (2020) 17408-17412. [41] Z.-Y. Liu Z.-H. Wen X.-C. Wang B(C6F5)3-Catalyzed Cascade Reduction of Pyridines Angew. Chem. Int. Ed. 56 2017 5817 5820 Z.-Y. Liu, Z.-H. Wen, X.-C. Wang, B(C6F5)3-Catalyzed Cascade Reduction of Pyridines, Angew. Chem. Int. Ed. 56 (2017) 5817-5820. [42] Y. Gong J. He X. Wen H. Xi Z. Wei W. Liu Transfer hydrogenation of N-heteroarenes with 2-propanol and ethanol enabled by manganese catalysis Org. Chem. Front. 8 2021 6901 6908 Y. Gong, J. He, X. Wen, H. Xi, Z. Wei, W. Liu, Transfer hydrogenation of N-heteroarenes with 2-propanol and ethanol enabled by manganese catalysis, Org. Chem. Front. 8 (2021) 6901-6908. [43] Y. Zhang S. El Sayed L. Kang M. Sanger T. Wiegand P.G. Jessop S. DeBeer A. Bordet W. Leitner Adaptive Catalysts for the Selective Hydrogenation of Bicyclic Heteroaromatics using Ruthenium Nanoparticles on a CO2-Responsive Support Angew. Chem. Int. Ed. 62 2023 e202311427 Y. Zhang, S. El Sayed, L. Kang, M. Sanger, T. Wiegand, P.G. Jessop, S. DeBeer, A. Bordet, W. Leitner, Adaptive Catalysts for the Selective Hydrogenation of Bicyclic Heteroaromatics using Ruthenium Nanoparticles on a CO2-Responsive Support, Angew. Chem. Int. Ed. 62 (2023) e202311427. [44] A. Bordet S. El Sayed M. Sanger K.J. Boniface D. Kalsi K.L. Luska P.G. Jessop W. Leitner Selectivity control in hydrogenation through adaptive catalysis using ruthenium nanoparticles on a CO2-responsive support Nat. Chem. 13 2021 916 922 A. Bordet, S. El Sayed, M. Sanger, K.J. Boniface, D. Kalsi, K.L. Luska, P.G. Jessop, W. Leitner, Selectivity control in hydrogenation through adaptive catalysis using ruthenium nanoparticles on a CO2-responsive support, Nat. Chem. 13 (2021) 916-922. [45] T. Maegawa A. Akashi K. Yaguchi Y. Iwasaki M. Shigetsura Y. Monguchi H. Sajiki Efficient and Practical Arene Hydrogenation by Heterogeneous Catalysts under Mild Conditions Chem Eur J 15 2009 6953 6963 T. Maegawa, A. Akashi, K. Yaguchi, Y. Iwasaki, M. Shigetsura, Y. Monguchi, H. Sajiki, Efficient and Practical Arene Hydrogenation by Heterogeneous Catalysts under Mild Conditions, Chem. Eur. J. 15 (2009) 6953-6963. [46] N. Tanaka T. Usuki Can Heteroarenes/Arenes Be Hydrogenated Over Catalytic Pd/C Under Ambient Conditions? Eur. J. Org. Chem. 2020 2020 5514 5522 N. Tanaka, T. Usuki, Can Heteroarenes/Arenes Be Hydrogenated Over Catalytic Pd/C Under Ambient Conditions?, Eur. J. Org. Chem. 2020 (2020) 5514-5522. [47] N. Gandhamsetty S. Park S. Chang Boron-Catalyzed Hydrogenative Reduction of Substituted Quinolines to Tetrahydroquinolines with Hydrosilanes Synlett 28 2017 2396 2400 N. Gandhamsetty, S. Park, S. Chang, Boron-Catalyzed Hydrogenative Reduction of Substituted Quinolines to Tetrahydroquinolines with Hydrosilanes, Synlett, 28 (2017) 2396-2400. [48] D. Mahapatra A. Sau T. Ghosh A. Roy S. Kundu Co(II)-Catalyzed Additive-Free Transfer Hydrogenation of N-Heteroarenes at Room Temperature Org. Lett. 26 2024 6001 6005 D. Mahapatra, A. Sau, T. Ghosh, A. Roy, S. Kundu, Co(II)-Catalyzed Additive-Free Transfer Hydrogenation of N-Heteroarenes at Room Temperature, Org. Lett. 26 (2024) 6001-6005. [49] F. Ding Y. Zhang R. Zhao Y. Jiang R.-L.-Y. Bao K. Lin L. Shi B(C6F5)3-Promoted hydrogenations of N-heterocycles with ammonia borane Chem. Commun. 53 2017 9262 9264 F. Ding, Y. Zhang, R. Zhao, Y. Jiang, R.L.-Y. Bao, K. Lin, L. Shi, B(C6F5)3-Promoted hydrogenations of N-heterocycles with ammonia borane, Chem. Commun. 53 (2017) 9262-9264. [50] C. Gelis A. Heusler Z. Nairoukh F. Glorius Catalytic Transfer Hydrogenation of Arenes and Heteroarenes Chem Eur J 26 2020 14090 14094 C. Gelis, A. Heusler, Z. Nairoukh, F. Glorius, Catalytic Transfer Hydrogenation of Arenes and Heteroarenes, Chem. Eur. J. 26 (2020) 14090-14094. [51] X. Cui W. Huang L. Wu Zirconium-hydride-catalyzed transfer hydrogenation of quinolines and indoles with ammonia borane Org. Chem. Front. 8 2021 5002 5007 X. Cui, W. Huang, L. Wu, Zirconium-hydride-catalyzed transfer hydrogenation of quinolines and indoles with ammonia borane, Org. Chem. Front. 8 (2021) 5002-5007. [52] T. Vielhaber C. Heizinger C. Topf Homogeneous pressure hydrogenation of quinolines effected by a bench-stable tungsten-based pre-catalyst J. Catal. 404 2021 451 461 T. Vielhaber, C. Heizinger, C. Topf, Homogeneous pressure hydrogenation of quinolines effected by a bench-stable tungsten-based pre-catalyst, J. Catal. 404 (2021) 451-461. [53] S. Pradhan S. Maiti S. Dutta C.A. Russell S. Tyagi D. Maiti A Modular Approach for Accessing 3D Heterocycles via 1,2-Dicyanation of Planar N-Heteroarenes Angew. Chem. Int. Ed. 2024 e202412979 S. Pradhan, S. Maiti, S. Dutta, C.A. Russell, S. Tyagi, D. Maiti, A Modular Approach for Accessing 3D Heterocycles via 1,2-Dicyanation of Planar N-Heteroarenes, Angew. Chem. Int. Ed. 2024, e202412979. [54] L. Lückemeier T. De Vos L. Schlichter C. Gutheil C.G. Daniliuc F. Glorius Chemoselective Heterogeneous Hydrogenation of Sulfur Containing Quinolines under Mild Conditions J. Am. Chem. Soc. 146 2024 5864 5871 L. Lückemeier, T. De Vos, L. Schlichter, C. Gutheil, C.G. Daniliuc, F. Glorius, Chemoselective Heterogeneous Hydrogenation of Sulfur Containing Quinolines under Mild Conditions, J. Am. Chem. Soc. 146 (2024) 5864-5871. [55] B. Zhou V.G. Chandrashekhar Z. Ma C. Kreyenschulte S. Bartling H. Lund M. Beller R.V. Jagadeesh Development of a General and Selective Nanostructured Cobalt Catalyst for the Hydrogenation of Benzofurans, Indoles and Benzothiophenes Angew. Chem. Int. Ed. 62 2023 e202215699 B. Zhou, V.G. Chandrashekhar, Z. Ma, C. Kreyenschulte, S. Bartling, H. Lund, M. Beller, R.V. Jagadeesh, Development of a General and Selective Nanostructured Cobalt Catalyst for the Hydrogenation of Benzofurans, Indoles and Benzothiophenes, Angew. Chem. Int. Ed. 62 (2023) e202215699. [56] M.P. Wiesenfeldt T. Knecht C. Schlepphorst F. Glorius Silylarene Hydrogenation: A Strategic Approach that Enables Direct Access to Versatile Silylated Saturated Carbo- and Heterocycles Angew. Chem. Int. Ed. 57 2018 8297 8300 M.P. Wiesenfeldt, T. Knecht, C. Schlepphorst, F. Glorius, Silylarene Hydrogenation: A Strategic Approach that Enables Direct Access to Versatile Silylated Saturated Carbo- and Heterocycles, Angew. Chem. Int. Ed. 57 (2018) 8297-8300. [57] A. Chhabra S. Reich T.M. Shannon R.E. Maleczka M.R. Smith Access to C(sp3) borylated and silylated cyclic molecules: hydrogenation of corresponding arenes and heteroarenes RSC Adv. 14 2024 10590 10607 A. Chhabra, S. Reich, T.M. Shannon, R.E. Maleczka, M.R. Smith, Access to C(sp3) borylated and silylated cyclic molecules: hydrogenation of corresponding arenes and heteroarenes, RSC Adv. 14 (2024) 10590-10607. [58] L. Perrin E.L. Werkema O. Eisenstein R.A. Andersen Two [1,2,4-(Me3C)3C5H2]2CeH Molecules are Involved in Hydrogenation of Pyridine to Piperidine as Shown by Experiments and Computations Inorg. Chem. 53 2014 6361 6373 L. Perrin, E.L. Werkema, O. Eisenstein, R.A. Andersen, Two [1,2,4-(Me3C)3C5H2]2CeH Molecules are Involved in Hydrogenation of Pyridine to Piperidine as Shown by Experiments and Computations, Inorg. Chem. 53 (2014) 6361-6373. [59] F. Glorius Asymmetric hydrogenation of aromatic compounds Org. Biomol. Chem. 3 2005 4171 4175 F. Glorius, Asymmetric hydrogenation of aromatic compounds, Org. Biomol. Chem. 3 (2005) 4171-4175. [60] D.-H. Liu P.M. Pflüger A. Outlaw L. Lückemeier F. Zhang C. Regan H. Rashidi Nodeh T. Cernak J. Ma F. Glorius Late-Stage Saturation of Drug Molecules J. Am. Chem. Soc. 146 2024 11866 11875 D.-H. Liu, P.M. Pflüger, A. Outlaw, L. Lückemeier, F. Zhang, C. Regan, H. Rashidi Nodeh, T. Cernak, J. Ma, F. Glorius, Late-Stage Saturation of Drug Molecules, J. Am. Chem. Soc. 146 (2024) 11866-11875. [61] F. Zhang H.S. Sasmal D. Rana F. Glorius Switchable and Chemoselective Arene Hydrogenation for Efficient Late Stage Applications J. Am. Chem. Soc. 146 2024 18682 18688 F. Zhang, H.S. Sasmal, D. Rana, F. Glorius, Switchable and Chemoselective Arene Hydrogenation for Efficient Late Stage Applications, J. Am. Chem. Soc. 146 (2024) 18682-18688. [62] D. Wang D. Astruc The Golden Age of Transfer Hydrogenation Chem. Rev. 115 2015 6621 6686 D. Wang, D. Astruc, The Golden Age of Transfer Hydrogenation, Chem. Rev. 115 (2015) 6621-6686. [63] B. Taleb R. Jahjah D. Cornu M. Bechelany M. Al Ajami G. Kataya A. Hijazi M.H. El-Dakdouki Exploring Hydrogen Sources in Catalytic Transfer Hydrogenation: A Review of Unsaturated Compound Reduction Molecules 28 2023 7541 B. Taleb, R. Jahjah, D. Cornu, M. Bechelany, M. Al Ajami, G. Kataya, A. Hijazi, M.H. El-Dakdouki, Exploring Hydrogen Sources in Catalytic Transfer Hydrogenation: A Review of Unsaturated Compound Reduction, Molecules, 28 (2023) 7541. [64] S. Lau D. Gasperini R.L. Webster Amine–Boranes as Transfer Hydrogenation and Hydrogenation Reagents: A Mechanistic Perspective Angew. Chem. Int. Ed. 60 2021 14272 14294 S. Lau, D. Gasperini, R.L. Webster, Amine–Boranes as Transfer Hydrogenation and Hydrogenation Reagents: A Mechanistic Perspective, Angew. Chem. Int. Ed. 60 (2021) 14272-14294. [65] C. Faverio M.F. Boselli F. Medici M. Benaglia Ammonia borane as a reducing agent in organic synthesis Org. Biomol. Chem. 18 2020 7789 7813 C. Faverio, M.F. Boselli, F. Medici, M. Benaglia, Ammonia borane as a reducing agent in organic synthesis, Org. Biomol. Chem. 18 (2020) 7789-7813. [66] J. Huo K. Zhang H. Wei L. Fu C. Zhao C. He X. Hu A review on hydrogen production from ammonia borane: Experimental and theoretical studies Chinese Chem Lett. 34 2023 108280 J. Huo, K. Zhang, H. Wei, L. Fu, C. Zhao, C. He, X. Hu, A review on hydrogen production from ammonia borane: Experimental and theoretical studies, Chinese Chem Lett. 34 (2023) 108280. [67] W. Zhao H. Li H. Zhang S. Yang A. Riisager Ammonia borane-enabled hydrogen transfer processes: Insights into catalytic strategies and mechanisms, Green Energy Environ. 8 2023 948 971 W. Zhao, H. Li, H. Zhang, S. Yang, A. Riisager, Ammonia borane-enabled hydrogen transfer processes: Insights into catalytic strategies and mechanisms, Green Energy Environ. 8 (2023) 948-971. [68] C. Dewangan S. Kumawat T. Bhatt K. Natte Homogenous nickel-catalyzed chemoselective transfer hydrogenation of functionalized nitroarenes with ammonia–borane Chem. Commun. 59 2023 14709 14712 C. Dewangan, S. Kumawat, T. Bhatt, K. Natte, Homogenous nickel-catalyzed chemoselective transfer hydrogenation of functionalized nitroarenes with ammonia–borane, Chem Commun. 59 (2023) 14709-14712. [69] T. Bhatt K. Natte Transfer Hydrogenation of N- and O-Containing Heterocycles Including Pyridines with H3N–BH3 Under the Catalysis of the Homogeneous Ruthenium Precatalyst Org. Lett. 26 2024 866 871 T. Bhatt, K. Natte, Transfer Hydrogenation of N- and O-Containing Heterocycles Including Pyridines with H3N–BH3 Under the Catalysis of the Homogeneous Ruthenium Precatalyst, Org. Lett. 26 (2024) 866-871. [70] S. Kumawat S. Dey K. Natte Ammonia-Borane Dependent Transfer Hydrogenation of Carboxylic Esters to Primary Alcohols J. Org. Chem. 89 2024 10719 10728 S. Kumawat, S. Dey, K. Natte, Ammonia-Borane Dependent Transfer Hydrogenation of Carboxylic Esters to Primary Alcohols, J. Org. Chem. 89 (2024) 10719–10728 [71] G. Centi J. Čejka Needs and Gaps for Catalysis in Addressing Transitions in Chemistry and Energy from a Sustainability Perspective ChemSusChem 12 2019 621 632 G. Centi, J. Čejka, Needs and Gaps for Catalysis in Addressing Transitions in Chemistry and Energy from a Sustainability Perspective, ChemSusChem, 12 (2019) 621-632. [72] S. Nishimura Handbook of heterogeneous catalytic hydrogenation for organic synthesis 2001 Wiley New York S. Nishimura (2001) Handbook of heterogeneous catalytic hydrogenation for organic synthesis. Wiley, New York. [73] F. Roessler Catalytic Hydrogenation in the Liquid Phase Chimia 57 2003 791 F. Roessler, Catalytic Hydrogenation in the Liquid Phase, CHIMIA, 57 (2003) 791. [74] M. Beller Introduction: First Row Metals and Catalysis Chem. Rev. 119 2019 2089 M. Beller, Introduction: First Row Metals and Catalysis, Chem. Rev. 119 (2019) 2089-2089. [75] D. Formenti F. Ferretti F.K. Scharnagl M. Beller Reduction of Nitro Compounds Using 3d-Non-Noble Metal Catalysts Chem. Rev. 119 2019 2611 2680 D. Formenti, F. Ferretti, F.K. Scharnagl, M. Beller, Reduction of Nitro Compounds Using 3d-Non-Noble Metal Catalysts, Chem. Rev. 119 (2019) 2611-2680. [76] K.D. Vogiatzis M.V. Polynski J.K. Kirkland J. Townsend A. Hashemi C. Liu E.A. Pidko Computational Approach to Molecular Catalysis by 3d Transition Metals: Challenges and Opportunities Chem. Rev. 119 2019 2453 2523 K.D. Vogiatzis, M.V. Polynski, J.K. Kirkland, J. Townsend, A. Hashemi, C. Liu, E.A. Pidko, Computational Approach to Molecular Catalysis by 3d Transition Metals: Challenges and Opportunities, Chem. Rev. 119 (2019) 2453-2523. [77] M. Manßen L.L. Schafer Titanium catalysis for the synthesis of fine chemicals – development and trends Chem. Soc. Rev. 49 2020 6947 6994 M. Manßen, L.L. Schafer, Titanium catalysis for the synthesis of fine chemicals – development and trends, Chem. Soc. Rev. 49 (2020) 6947-6994. [78] T. McCallum X. Wu S. Lin Recent Advances in Titanium Radical Redox Catalysis J. Org. Chem. 84 2019 14369 14380 T. McCallum, X. Wu, S. Lin, Recent Advances in Titanium Radical Redox Catalysis, J Org Chem, 84 (2019) 14369-14380. [79] Z.W. Davis-Gilbert I.A. Tonks Titanium redox catalysis: insights and applications of an earth-abundant base metal Dalton Transact. 46 2017 11522 11528 Z.W. Davis-Gilbert, I.A. Tonks, Titanium redox catalysis: insights and applications of an earth-abundant base metal, Dalton Transact. 46 (2017) 11522-11528. [80] B. Han C. Ren M. Jiang L. Wu Titanium-Catalyzed Exhaustive Reduction of Oxo-Chemicals Angew. Chem. Int. Ed. 61 2022 e202209232 B. Han, C. Ren, M. Jiang, L. Wu, Titanium-Catalyzed Exhaustive Reduction of Oxo-Chemicals, Angew. Chem. Int. Ed. 61 (2022) e202209232. [81] B. Han C. Ren L. Wu Titanium-Catalyzed Hydrodehalogenation of Alkyl Halides Organometallics 42 2023 1248 1253 B. Han, C. Ren, L. Wu, Titanium-Catalyzed Hydrodehalogenation of Alkyl Halides, Organometallics, 42 (2023) 1248-1253. [82] A. Căciuleanu F. Vöhringer I. Fleischer Titanium-catalysed deoxygenation of benzylic alcohols and lignin model compounds Org. Chem. Front. 10 2023 2927 2935 A. Căciuleanu, F. Vöhringer, I. Fleischer, Titanium-catalysed deoxygenation of benzylic alcohols and lignin model compounds, Org. Chem. Front, 10 (2023) 2927-2935. [83] B. Singh V. Goyal D. Sarma R. Kumar T. Bhatt A. Mahata C. Raji Reddy A. Narani K. Natte Earth-Abundant Heterogeneous Cobalt Catalyst for Selective Ring Hydrogenation of (Hetero)arenes and Gram-Scale Synthesis of Pharmaceutical Intermediates ACS Catal. 13 2023 9724 9744 B. Singh, V. Goyal, D. Sarma, R. Kumar, T. Bhatt, A. Mahata, C. Raji Reddy, A. Narani, K. Natte, Earth-Abundant Heterogeneous Cobalt Catalyst for Selective Ring Hydrogenation of (Hetero)arenes and Gram-Scale Synthesis of Pharmaceutical Intermediates, ACS Catal. 13 (2023) 9724-9744. [84] A. Kumar V. Goyal N. Sarki B. Singh A. Ray T. Bhaskar A. Bordoloi A. Narani K. Natte Biocarbon Supported Nanoscale Ruthenium Oxide-Based Catalyst for Clean Hydrogenation of Arenes and Heteroarenes ACS Sustain. Chem. Eng. 8 2020 15740 15754 A. Kumar, V. Goyal, N. Sarki, B. Singh, A. Ray, T. Bhaskar, A. Bordoloi, A. Narani, K. Natte, Biocarbon Supported Nanoscale Ruthenium Oxide-Based Catalyst for Clean Hydrogenation of Arenes and Heteroarenes, ACS Sustainable Chem. Eng. 8 (2020) 15740-15754. [85] P. Ruiz-Castillo S.L. Buchwald Applications of Palladium-Catalyzed C–N Cross-Coupling Reactions Chem. Rev. 116 2016 12564 12649 P. Ruiz-Castillo, S.L. Buchwald, Applications of Palladium-Catalyzed C–N Cross-Coupling Reactions, Chem. Rev. 116 (2016) 12564-12649. [86] R. Noor A.F. Zahoor M. Irfan S.M. Hussain S. Ahmad A. Irfan K. Kotwica-Mojzych M. Mojzych Transition Metal Catalyzed Hiyama Cross-Coupling: Recent Methodology Developments and Synthetic Applications Molecules 27 2022 5654 R. Noor, A.F. Zahoor, M. Irfan, S.M. Hussain, S. Ahmad, A. Irfan, K. Kotwica-Mojzych, M. Mojzych, Transition Metal Catalyzed Hiyama Cross-Coupling: Recent Methodology Developments and Synthetic Applications, Molecules, 27 (2022) 5654. [87] Y. Zhang J.-J. Chen H.-M. Huang Radical Brook Rearrangements: Concept and Recent Developments Angew. Chem. Int. Ed. 61 2022 e202205671 Y. Zhang, J.-J. Chen, H.-M. Huang, Radical Brook Rearrangements: Concept and Recent Developments, Angew. Chem. Int. Ed., 61 (2022) e202205671. [88] H. Ishikawa S. Yamaguchi T. Mizugaki T. Mitsudome Highly Active and Sulfur-Tolerant Ruthenium Phosphide Catalyst for Efficient Reductive Amination of Carbonyl Compounds ACS Catal. 14 2024 4501 4509 H. Ishikawa, S. Yamaguchi, T. Mizugaki, T. Mitsudome, Highly Active and Sulfur-Tolerant Ruthenium Phosphide Catalyst for Efficient Reductive Amination of Carbonyl Compounds, ACS Catal. 14 (2024) 4501-4509. [89] H. Ishikawa N. Nakatani S. Yamaguchi T. Mizugaki T. Mitsudome Robust Ruthenium Phosphide Catalyst for Hydrogenation of Sulfur-Containing Nitroarenes ACS Catal. 13 2023 5744 5751 H. Ishikawa, N. Nakatani, S. Yamaguchi, T. Mizugaki, T. Mitsudome, Robust Ruthenium Phosphide Catalyst for Hydrogenation of Sulfur-Containing Nitroarenes, ACS Catal. 13 (2023) 5744-5751. [90] S. El Sayed A. Bordet C. Weidenthaler W. Hetaba K.L. Luska W. Leitner Selective Hydrogenation of Benzofurans Using Ruthenium Nanoparticles in Lewis Acid-Modified Ruthenium-Supported Ionic Liquid Phases ACS Catal. 10 2020 2124 2130 S. El Sayed, A. Bordet, C. Weidenthaler, W. Hetaba, K.L. Luska, W. Leitner, Selective Hydrogenation of Benzofurans Using Ruthenium Nanoparticles in Lewis Acid-Modified Ruthenium-Supported Ionic Liquid Phases, ACS Catal. 10 (2020) 2124-2130. [91] A. Karakulina A. Gopakumar İ. Akçok B.L. Roulier T. LaGrange S.A. Katsyuba S. Das P.J. Dyson A Rhodium Nanoparticle–Lewis Acidic Ionic Liquid Catalyst for the Chemoselective Reduction of Heteroarenes Angew. Chem. Int. Ed. 55 2016 292 296 A. Karakulina, A. Gopakumar, İ. Akçok, B.L. Roulier, T. LaGrange, S.A. Katsyuba, S. Das, P.J. Dyson, A Rhodium Nanoparticle–Lewis Acidic Ionic Liquid Catalyst for the Chemoselective Reduction of Heteroarenes, Angew. Chem. Int. Ed. 55 (2016) 292-296. [92] D. Moock T. Wagener T. Hu T. Gallagher F. Glorius Enantio- and Diastereoselective, Complete Hydrogenation of Benzofurans by Cascade Catalysis Angew. Chem. Int. Ed. 60 2021 13677 13681 D. Moock, T. Wagener, T. Hu, T. Gallagher, F. Glorius, Enantio- and Diastereoselective, Complete Hydrogenation of Benzofurans by Cascade Catalysis, Angew. Chem. Int. Ed. 60 (2021) 13677-13681. [93] R.A. Gaussian 09, M. J. Frisch, G. W. Trucks, H. B. Schlegel, G. E. Scuseria, M. A. Robb, J. R. Cheeseman, G. Scalmani, V. Barone, G. A. Petersson, H. Nakatsuji, X. Li, M. Caricato, A. Marenich, J. Bloino, B. G. Janesko, R. Gomperts, B. Mennucci, H. P. Hratchian, J. V. Ortiz, A. F. Izmaylov, J. L. Sonnenberg, D. Williams-Young, F. Ding, F. Lipparini, F. Egidi, J. Goings, B. Peng, A. Petrone, T. Henderson, D. Ranasinghe, V. G. Zakrzewski, J. Gao, N. Rega, G. Zheng, W. Liang, M. Hada, M. Ehara, K. Toyota, R. Fukuda, J. Hasegawa, M. Ishida, T. Nakajima, Y. Honda, O. Kitao, H. Nakai, T. Vreven, K. Throssell, J. A. Montgomery, Jr., J. E. Peralta, F. Ogliaro, M. Bearpark, J. J. Heyd, E. Brothers, K. N. Kudin, V. N. Staroverov, T. Keith, R. Kobayashi, J. Normand, K. Raghavachari, A. Rendell, J. C. Burant, S. S. Iyengar, J. Tomasi, M. Cossi, J. M. Millam, M. Klene, C. Adamo, R. Cammi, J. W. Ochterski, R. L. Martin, K. Morokuma, O. Farkas, J. B. Foresman, and D. J. Fox, Gaussian, Inc., Wallingford CT, 2016. [94] A.D. Becke Density‐functional thermochemistry. III. The role of exact exchange J. Chem. Phys. 98 1993 5648 5652 A.D. Becke, Density‐functional thermochemistry. III. The role of exact exchange, J. Chem. Phys. 98 (1993) 5648-5652. [95] P.J. Hay W.R. Wadt Ab initio effective core potentials for molecular calculations. Potentials for K to Au including the outermost core orbitals J. Chem. Phys. 82 1985 299 310 P.J. Hay, W.R. Wadt, Ab initio effective core potentials for molecular calculations. Potentials for K to Au including the outermost core orbitals, J. Chem. Phys. 82 (1985) 299-310. [96] W.J. Hehre R. Ditchfield J.A. Pople Self—Consistent Molecular Orbital Methods. XII. Further Extensions of Gaussian—Type Basis Sets for Use in Molecular Orbital Studies of Organic Molecules J. Chem. Phys. 56 1972 2257 2261 W.J. Hehre, R. Ditchfield, J.A. Pople, Self—Consistent Molecular Orbital Methods. XII. Further Extensions of Gaussian—Type Basis Sets for Use in Molecular Orbital Studies of Organic Molecules, J. Chem. Phys. 56 (1972) 2257-2261. [97] T. Lu F. Chen Multiwfn: A multifunctional wavefunction analyzer J. Comput. Chem. 33 2012 580 592 T. Lu, F. Chen, Multiwfn: A multifunctional wavefunction analyzer, J. Comput. Chem. 33 (2012) 580-592.",
      "scopus-id": "85214504008",
      "coredata": {
        "eid": "1-s2.0-S0021951725000016",
        "dc:description": "The reduction of aromatic compounds is a stalwart transformation in modern organic synthesis since it allows the generation of novel complex three-dimensional (3D) chemical entities from two-dimensional precursors (2D), linking readily available aromatic feedstocks with unobtainable alicyclic structures. However, controlling the high level of selectivity of N-heteroarenes (quinolines and pyridines), particularly substituents positioned on the reducible quinoline ring, is both intriguing and challenging, and methods for selective saturation of structurally complex derivatives (multiple aromatic rings) are rarely unaddressed and need further improvements. Also, many approaches suffer from scalability problems, high cost, and low availability of catalysts and tailor-made ligands. To address this issue, we herein report the first example of commercially available titanocene dichloride (Cp2TiCl2)-catalyzed chemoselective reduction of structurally diverse nitrogen-based heteroarenes with ammonia borane as a reducing agent (>100 examples). The developed protocol features the advantage of chemoselectivity and wide functional group tolerance of quinolines. Meanwhile, the efficient reduction of challenging and unprotected functionalized pyridines, as well as pyrazines, are also furnished with remarkable functional group preservation and also with an improved F(sp3) carbon fraction. Additionally, a few selected furans and benzofuran derivatives were successfully demonstrated under synthetically relevant conditions, and gram-scale synthesis was effectively executed. The methodology can be extended to the saturation of complex N-heteroarenes with conserved selectivity. In addition, density functional theory (DFT) calculations were carried out to shed light on the mechanistic insights into the reduction of quinoline.",
        "openArchiveArticle": "false",
        "prism:coverDate": "2025-03-31",
        "openaccessUserLicense": null,
        "prism:aggregationType": "Journal",
        "prism:url": "https://api.elsevier.com/content/article/pii/S0021951725000016",
        "dc:creator": [
          {
            "@_fa": "true",
            "$": "Bhatt, Tarun"
          },
          {
            "@_fa": "true",
            "$": "Suman, Vadithya"
          },
          {
            "@_fa": "true",
            "$": "Choudhary, Mridula"
          },
          {
            "@_fa": "true",
            "$": "Singh, Saurabh Kumar"
          },
          {
            "@_fa": "true",
            "$": "Natte, Kishore"
          }
        ],
        "link": [
          {
            "@_fa": "true",
            "@rel": "self",
            "@href": "https://api.elsevier.com/content/article/pii/S0021951725000016"
          },
          {
            "@_fa": "true",
            "@rel": "scidir",
            "@href": "https://www.sciencedirect.com/science/article/pii/S0021951725000016"
          }
        ],
        "dc:format": "application/json",
        "openaccessType": null,
        "pii": "S0021-9517(25)00001-6",
        "prism:volume": "443",
        "articleNumber": "115937",
        "prism:publisher": "Elsevier Inc. All rights are reserved, including those for text and data mining, AI training, and similar technologies.",
        "dc:title": "Dearomative selective reduction of structurally diverse N-heteroarenes enabled by a homogeneous titanium catalyst",
        "prism:copyright": "© 2025 Elsevier Inc. All rights are reserved, including those for text and data mining, AI training, and similar technologies.",
        "openaccess": "0",
        "prism:issn": "00219517",
        "dcterms:subject": [
          {
            "@_fa": "true",
            "$": "Reduction"
          },
          {
            "@_fa": "true",
            "$": "N-Heteroarenes"
          },
          {
            "@_fa": "true",
            "$": "Titanium catalyst"
          },
          {
            "@_fa": "true",
            "$": "Late-stage saturation"
          },
          {
            "@_fa": "true",
            "$": "1,2,3,4-Tetrahydroquinolines"
          }
        ],
        "openaccessArticle": "false",
        "prism:publicationName": "Journal of Catalysis",
        "openaccessSponsorType": null,
        "prism:pageRange": "115937",
        "pubType": "fla",
        "prism:coverDisplayDate": "March 2025",
        "prism:doi": "10.1016/j.jcat.2025.115937",
        "prism:startingPage": "115937",
        "dc:identifier": "doi:10.1016/j.jcat.2025.115937",
        "openaccessSponsorName": null
      },
      "objects": {
        "object": [
          {
            "@category": "standard",
            "@height": "534",
            "@width": "622",
            "@_fa": "true",
            "$": "https://api.elsevier.com/content/object/eid/1-s2.0-S0021951725000016-gr5.jpg?httpAccept=%2A%2F%2A",
            "@multimediatype": "JPEG image file",
            "@type": "IMAGE-DOWNSAMPLED",
            "@size": "70837",
            "@ref": "gr5",
            "@mimetype": "image/jpeg"
          },
          {
            "@category": "standard",
            "@height": "978",
            "@width": "786",
            "@_fa": "true",
            "$": "https://api.elsevier.com/content/object/eid/1-s2.0-S0021951725000016-gr6.jpg?httpAccept=%2A%2F%2A",
            "@multimediatype": "JPEG image file",
            "@type": "IMAGE-DOWNSAMPLED",
            "@size": "165929",
            "@ref": "gr6",
            "@mimetype": "image/jpeg"
          },
          {
            "@category": "standard",
            "@height": "459",
            "@width": "752",
            "@_fa": "true",
            "$": "https://api.elsevier.com/content/object/eid/1-s2.0-S0021951725000016-gr7.jpg?httpAccept=%2A%2F%2A",
            "@multimediatype": "JPEG image file",
            "@type": "IMAGE-DOWNSAMPLED",
            "@size": "70717",
            "@ref": "gr7",
            "@mimetype": "image/jpeg"
          },
          {
            "@category": "standard",
            "@height": "250",
            "@width": "533",
            "@_fa": "true",
            "$": "https://api.elsevier.com/content/object/eid/1-s2.0-S0021951725000016-gr8.jpg?httpAccept=%2A%2F%2A",
            "@multimediatype": "JPEG image file",
            "@type": "IMAGE-DOWNSAMPLED",
            "@size": "25856",
            "@ref": "gr8",
            "@mimetype": "image/jpeg"
          },
          {
            "@category": "standard",
            "@height": "586",
            "@width": "631",
            "@_fa": "true",
            "$": "https://api.elsevier.com/content/object/eid/1-s2.0-S0021951725000016-gr1.jpg?httpAccept=%2A%2F%2A",
            "@multimediatype": "JPEG image file",
            "@type": "IMAGE-DOWNSAMPLED",
            "@size": "97983",
            "@ref": "gr1",
            "@mimetype": "image/jpeg"
          },
          {
            "@category": "standard",
            "@height": "809",
            "@width": "765",
            "@_fa": "true",
            "$": "https://api.elsevier.com/content/object/eid/1-s2.0-S0021951725000016-gr2.jpg?httpAccept=%2A%2F%2A",
            "@multimediatype": "JPEG image file",
            "@type": "IMAGE-DOWNSAMPLED",
            "@size": "150045",
            "@ref": "gr2",
            "@mimetype": "image/jpeg"
          },
          {
            "@category": "standard",
            "@height": "192",
            "@width": "500",
            "@_fa": "true",
            "$": "https://api.elsevier.com/content/object/eid/1-s2.0-S0021951725000016-ga1.jpg?httpAccept=%2A%2F%2A",
            "@multimediatype": "JPEG image file",
            "@type": "IMAGE-DOWNSAMPLED",
            "@size": "34796",
            "@ref": "ga1",
            "@mimetype": "image/jpeg"
          },
          {
            "@category": "standard",
            "@height": "532",
            "@width": "774",
            "@_fa": "true",
            "$": "https://api.elsevier.com/content/object/eid/1-s2.0-S0021951725000016-gr3.jpg?httpAccept=%2A%2F%2A",
            "@multimediatype": "JPEG image file",
            "@type": "IMAGE-DOWNSAMPLED",
            "@size": "70191",
            "@ref": "gr3",
            "@mimetype": "image/jpeg"
          },
          {
            "@category": "standard",
            "@height": "528",
            "@width": "756",
            "@_fa": "true",
            "$": "https://api.elsevier.com/content/object/eid/1-s2.0-S0021951725000016-gr4.jpg?httpAccept=%2A%2F%2A",
            "@multimediatype": "JPEG image file",
            "@type": "IMAGE-DOWNSAMPLED",
            "@size": "78120",
            "@ref": "gr4",
            "@mimetype": "image/jpeg"
          },
          {
            "@category": "standard",
            "@height": "581",
            "@width": "542",
            "@_fa": "true",
            "$": "https://api.elsevier.com/content/object/eid/1-s2.0-S0021951725000016-fx1.jpg?httpAccept=%2A%2F%2A",
            "@multimediatype": "JPEG image file",
            "@type": "IMAGE-DOWNSAMPLED",
            "@size": "47300",
            "@ref": "fx1",
            "@mimetype": "image/jpeg"
          },
          {
            "@category": "thumbnail",
            "@height": "164",
            "@width": "191",
            "@_fa": "true",
            "$": "https://api.elsevier.com/content/object/eid/1-s2.0-S0021951725000016-gr5.sml?httpAccept=%2A%2F%2A",
            "@multimediatype": "GIF image file",
            "@type": "IMAGE-THUMBNAIL",
            "@size": "8545",
            "@ref": "gr5",
            "@mimetype": "image/gif"
          },
          {
            "@category": "thumbnail",
            "@height": "163",
            "@width": "131",
            "@_fa": "true",
            "$": "https://api.elsevier.com/content/object/eid/1-s2.0-S0021951725000016-gr6.sml?httpAccept=%2A%2F%2A",
            "@multimediatype": "GIF image file",
            "@type": "IMAGE-THUMBNAIL",
            "@size": "8235",
            "@ref": "gr6",
            "@mimetype": "image/gif"
          },
          {
            "@category": "thumbnail",
            "@height": "134",
            "@width": "219",
            "@_fa": "true",
            "$": "https://api.elsevier.com/content/object/eid/1-s2.0-S0021951725000016-gr7.sml?httpAccept=%2A%2F%2A",
            "@multimediatype": "GIF image file",
            "@type": "IMAGE-THUMBNAIL",
            "@size": "8272",
            "@ref": "gr7",
            "@mimetype": "image/gif"
          },
          {
            "@category": "thumbnail",
            "@height": "103",
            "@width": "219",
            "@_fa": "true",
            "$": "https://api.elsevier.com/content/object/eid/1-s2.0-S0021951725000016-gr8.sml?httpAccept=%2A%2F%2A",
            "@multimediatype": "GIF image file",
            "@type": "IMAGE-THUMBNAIL",
            "@size": "7245",
            "@ref": "gr8",
            "@mimetype": "image/gif"
          },
          {
            "@category": "thumbnail",
            "@height": "164",
            "@width": "176",
            "@_fa": "true",
            "$": "https://api.elsevier.com/content/object/eid/1-s2.0-S0021951725000016-gr1.sml?httpAccept=%2A%2F%2A",
            "@multimediatype": "GIF image file",
            "@type": "IMAGE-THUMBNAIL",
            "@size": "10955",
            "@ref": "gr1",
            "@mimetype": "image/gif"
          },
          {
            "@category": "thumbnail",
            "@height": "164",
            "@width": "155",
            "@_fa": "true",
            "$": "https://api.elsevier.com/content/object/eid/1-s2.0-S0021951725000016-gr2.sml?httpAccept=%2A%2F%2A",
            "@multimediatype": "GIF image file",
            "@type": "IMAGE-THUMBNAIL",
            "@size": "8820",
            "@ref": "gr2",
            "@mimetype": "image/gif"
          },
          {
            "@category": "thumbnail",
            "@height": "84",
            "@width": "219",
            "@_fa": "true",
            "$": "https://api.elsevier.com/content/object/eid/1-s2.0-S0021951725000016-ga1.sml?httpAccept=%2A%2F%2A",
            "@multimediatype": "GIF image file",
            "@type": "IMAGE-THUMBNAIL",
            "@size": "6277",
            "@ref": "ga1",
            "@mimetype": "image/gif"
          },
          {
            "@category": "thumbnail",
            "@height": "150",
            "@width": "219",
            "@_fa": "true",
            "$": "https://api.elsevier.com/content/object/eid/1-s2.0-S0021951725000016-gr3.sml?httpAccept=%2A%2F%2A",
            "@multimediatype": "GIF image file",
            "@type": "IMAGE-THUMBNAIL",
            "@size": "6701",
            "@ref": "gr3",
            "@mimetype": "image/gif"
          },
          {
            "@category": "thumbnail",
            "@height": "153",
            "@width": "219",
            "@_fa": "true",
            "$": "https://api.elsevier.com/content/object/eid/1-s2.0-S0021951725000016-gr4.sml?httpAccept=%2A%2F%2A",
            "@multimediatype": "GIF image file",
            "@type": "IMAGE-THUMBNAIL",
            "@size": "8598",
            "@ref": "gr4",
            "@mimetype": "image/gif"
          },
          {
            "@category": "thumbnail",
            "@height": "164",
            "@width": "153",
            "@_fa": "true",
            "$": "https://api.elsevier.com/content/object/eid/1-s2.0-S0021951725000016-fx1.sml?httpAccept=%2A%2F%2A",
            "@multimediatype": "GIF image file",
            "@type": "IMAGE-THUMBNAIL",
            "@size": "3913",
            "@ref": "fx1",
            "@mimetype": "image/gif"
          },
          {
            "@category": "high",
            "@height": "2367",
            "@width": "2756",
            "@_fa": "true",
            "$": "https://api.elsevier.com/content/object/eid/1-s2.0-S0021951725000016-gr5_lrg.jpg?httpAccept=%2A%2F%2A",
            "@multimediatype": "JPEG image file",
            "@type": "IMAGE-HIGH-RES",
            "@size": "554158",
            "@ref": "gr5",
            "@mimetype": "image/jpeg"
          },
          {
            "@category": "high",
            "@height": "4331",
            "@width": "3479",
            "@_fa": "true",
            "$": "https://api.elsevier.com/content/object/eid/1-s2.0-S0021951725000016-gr6_lrg.jpg?httpAccept=%2A%2F%2A",
            "@multimediatype": "JPEG image file",
            "@type": "IMAGE-HIGH-RES",
            "@size": "1149497",
            "@ref": "gr6",
            "@mimetype": "image/jpeg"
          },
          {
            "@category": "high",
            "@height": "2031",
            "@width": "3331",
            "@_fa": "true",
            "$": "https://api.elsevier.com/content/object/eid/1-s2.0-S0021951725000016-gr7_lrg.jpg?httpAccept=%2A%2F%2A",
            "@multimediatype": "JPEG image file",
            "@type": "IMAGE-HIGH-RES",
            "@size": "540132",
            "@ref": "gr7",
            "@mimetype": "image/jpeg"
          },
          {
            "@category": "high",
            "@height": "1109",
            "@width": "2362",
            "@_fa": "true",
            "$": "https://api.elsevier.com/content/object/eid/1-s2.0-S0021951725000016-gr8_lrg.jpg?httpAccept=%2A%2F%2A",
            "@multimediatype": "JPEG image file",
            "@type": "IMAGE-HIGH-RES",
            "@size": "207021",
            "@ref": "gr8",
            "@mimetype": "image/jpeg"
          },
          {
            "@category": "high",
            "@height": "2597",
            "@width": "2795",
            "@_fa": "true",
            "$": "https://api.elsevier.com/content/object/eid/1-s2.0-S0021951725000016-gr1_lrg.jpg?httpAccept=%2A%2F%2A",
            "@multimediatype": "JPEG image file",
            "@type": "IMAGE-HIGH-RES",
            "@size": "792229",
            "@ref": "gr1",
            "@mimetype": "image/jpeg"
          },
          {
            "@category": "high",
            "@height": "3582",
            "@width": "3389",
            "@_fa": "true",
            "$": "https://api.elsevier.com/content/object/eid/1-s2.0-S0021951725000016-gr2_lrg.jpg?httpAccept=%2A%2F%2A",
            "@multimediatype": "JPEG image file",
            "@type": "IMAGE-HIGH-RES",
            "@size": "1139415",
            "@ref": "gr2",
            "@mimetype": "image/jpeg"
          },
          {
            "@category": "high",
            "@height": "849",
            "@width": "2213",
            "@_fa": "true",
            "$": "https://api.elsevier.com/content/object/eid/1-s2.0-S0021951725000016-ga1_lrg.jpg?httpAccept=%2A%2F%2A",
            "@multimediatype": "JPEG image file",
            "@type": "IMAGE-HIGH-RES",
            "@size": "224784",
            "@ref": "ga1",
            "@mimetype": "image/jpeg"
          },
          {
            "@category": "high",
            "@height": "2353",
            "@width": "3426",
            "@_fa": "true",
            "$": "https://api.elsevier.com/content/object/eid/1-s2.0-S0021951725000016-gr3_lrg.jpg?httpAccept=%2A%2F%2A",
            "@multimediatype": "JPEG image file",
            "@type": "IMAGE-HIGH-RES",
            "@size": "498817",
            "@ref": "gr3",
            "@mimetype": "image/jpeg"
          },
          {
            "@category": "high",
            "@height": "2338",
            "@width": "3346",
            "@_fa": "true",
            "$": "https://api.elsevier.com/content/object/eid/1-s2.0-S0021951725000016-gr4_lrg.jpg?httpAccept=%2A%2F%2A",
            "@multimediatype": "JPEG image file",
            "@type": "IMAGE-HIGH-RES",
            "@size": "549484",
            "@ref": "gr4",
            "@mimetype": "image/jpeg"
          },
          {
            "@category": "high",
            "@height": "2576",
            "@width": "2402",
            "@_fa": "true",
            "$": "https://api.elsevier.com/content/object/eid/1-s2.0-S0021951725000016-fx1_lrg.jpg?httpAccept=%2A%2F%2A",
            "@multimediatype": "JPEG image file",
            "@type": "IMAGE-HIGH-RES",
            "@size": "360560",
            "@ref": "fx1",
            "@mimetype": "image/jpeg"
          },
          {
            "@category": "standard",
            "@_fa": "true",
            "$": "https://api.elsevier.com/content/object/eid/1-s2.0-S0021951725000016-mmc1.docx?httpAccept=%2A%2F%2A",
            "@multimediatype": "Microsoft Word file",
            "@type": "APPLICATION",
            "@size": "21946090",
            "@ref": "mmc1",
            "@mimetype": "application/word"
          }
        ]
      },
      "link": {
        "@rel": "abstract",
        "@href": "https://api.elsevier.com/content/abstract/scopus_id/85214504008"
      }
    }
  }
}