{
  "metadata": {
    "title": "Electrocatalytic oxygen reduction on metalloporphyrins. Second coordination sphere substituents on the ligand: Electronic and steric effects through pocket and extended structures and their effect on the electrocatalytic activity",
    "authors": "; ; ",
    "journal": "Journal of Catalysis",
    "date": "2024-02-29",
    "doi": "10.1016/j.jcat.2024.115365",
    "abstract": "",
    "uri": "https://api.elsevier.com/content/article/pii/S0021951724000782",
    "pii": "S0021951724000782"
  },
  "fulltext": {
    "full-text-retrieval-response": {
      "scopus-eid": "2-s2.0-85187266935",
      "originalText": "serial JL 272561 291210 291744 291809 31 Journal of Catalysis JOURNALCATALYSIS 2024-02-10 2024-02-10 2024-02-13 2024-02-13 2024-05-13T12:44:40 1-s2.0-S0021951724000782 S0021-9517(24)00078-2 S0021951724000782 10.1016/j.jcat.2024.115365 S300 S300.1 FULL-TEXT 1-s2.0-S0021951724X00020 2024-05-13T12:09:44.844599Z 0 0 20240201 20240229 2024 2024-02-10T15:54:05.84713Z absattachment articleinfo articlenumber articletitlenorm authfirstinitialnorm authfirstsurnamenorm cid cids contenttype copyright crossmark dateloaded dateloadedtxt datesearch datesort dateupdated dco docsubtype doctype doi eid ewtransactionid hubeid indexeddate issn issnnorm itemstage itemtransactionid itemweight openaccess openarchive pg pgfirst pii piinorm pubdateend pubdatestart pubdatetxt pubyr sectiontitle sortorder srctitle srctitlenorm srctype ssids alllist content subj subheadings suppl tomb volfirst volissue volumelist webpdf webpdfpagecount yearnav figure e-component body mmlmath acknowledge affil appendices articletitle auth authfirstini authfull authkeywords authlast highlightsabst orcid primabst pubtype ref specialabst 0021-9517 00219517 true 430 430 C Volume 430 51 115365 115365 115365 202402 February 2024 2024-02-01 2024-02-29 2024 Regular Articles article fla © 2024 Elsevier Inc. All rights reserved. ELECTROCATALYTICOXYGENREDUCTIONMETALLOPORPHYRINSSECONDCOORDINATIONSPHERESUBSTITUENTSLIGANDELECTRONICSTERICEFFECTSTHROUGHPOCKETEXTENDEDSTRUCTURESEFFECTELECTROCATALYTICACTIVITY SILVA C 1 Introduction 2 Experimental 2.1 Materials and methods 2.2 Synthesis of the catalyst 2.3 Preparation of the catalyst-modified OPG electrodes 2.4 Electrochemical measurements 3 Results and discussion 3.1 Synthesis of catalysts 3.2 Electrochemical behavior 3.3 Electrocatalysis for the ORR on OPG/Porphyrins electrode systems 4 Conclusions CRediT authorship contribution statement Acknowledgments Appendix A Supplementary material References LIN 2021 1012 1023 C ZAGAL 2010 2755 2791 J ZAGAL 1992 13 30 J MASA 2012 761 784 J ZAGAL 1992 89 136 J CHEN 2022 14368 14376 Y WU 2013 1878 1889 G BASHYAM 2006 63 66 R DEY 2017 0098 S SHI 1995 319 322 C ZAGAL 2016 14510 14521 J SPECCHIA 2021 100687 S SCARPETTAPIZO 2023 143160 L ZHOU 2019 1158 1166 Y OLGUIN 2021 1631 C PARSA 2018 5870 5877 Z ZUNIGA 2019 78 82 C ZAGAL 2012 B90 J PAVEZ 2005 21 29 J DERRICK 2022 11656 11663 J LASHGARI 2020 16774 16781 A RAMUGLIA 2021 3934 3944 A SAMANTA 2013 1443 1453 S SAPUTRO 2015 3059 3071 A CHEN 2010 18146 18152 W SAMANTA 2012 7631 7633 S BARRAL 2007 1809 1811 K LABBE 1969 345 363 G STEPHENSON 2011 6227 6238 A TSEBERLIDIS 2015 3774 3781 G WANG 2023 5347 5420 K BHUNIA 2023 3812 3825 S HEPPE 2023 e202202465 N COSTENTIN 2015 13535 13544 C YUAN 2023 e202300027 R CHATTERJEE 2017 1744 1753 S SILVAX2024X115365 SILVAX2024X115365XC 2026-02-13T00:00:00.000Z 2026-02-13T00:00:00.000Z http://creativecommons.org/licenses/by-nc-nd/4.0/ © 2024 Elsevier Inc. All rights reserved. 2024-02-20T08:36:20.620Z http://vtw.elsevier.com/data/voc/AddOnTypes/50.7/aggregated-refined ANID-Chile 022342PI_Ayudante1 EQM 120065 EQM150106 EQM160036 FONDECYT-ANID 11190782 1221798 3200196 3200199 ACT 192175 FONDECYT CONICYT FONDECYT http://data.elsevier.com/vocabulary/SciValFunders/501100002850 http://sws.geonames.org/3895114 This research was funded by FONDECYT-ANID; Postdoc grants 3200196 (N.A.) and 3200199 (E.I.), and Initiation grant 11190782 (C.P.S); J.H.Z. is grateful to ANID, grants 1221798 and ACT 192175. C.P.C. C.F.O. and G.J. are thankful to ANID-Chile for Doctoral fellowships. ANID FODEQUIP: EQM 120065; EQM150106, and EQM160036. J.P. is grateful to DICYT-USACH project 022342PI_Ayudante1. This research was funded by FONDECYT-ANID; Postdoc grants 3200196 (N.A.) and 3200199 (E.I.), and Initiation grant 11190782 (C.P.S); J.H.Z. is grateful to ANID, grants 1221798 and ACT 192175. C.P.C., C.F.O. and G.J. are thankful to ANID-Chile for Doctoral fellowships. ANID FODEQUIP: EQM 120065; EQM150106, and EQM160036. https://doi.org/10.15223/policy-017 https://doi.org/10.15223/policy-037 https://doi.org/10.15223/policy-012 https://doi.org/10.15223/policy-029 https://doi.org/10.15223/policy-004 item S0021-9517(24)00078-2 S0021951724000782 1-s2.0-S0021951724000782 10.1016/j.jcat.2024.115365 272561 2024-05-13T12:09:44.844599Z 2024-02-01 2024-02-29 1-s2.0-S0021951724000782-main.pdf https://s3-eu-west-1.amazonaws.com/prod-ucs-content-store-eu-west/content/pii:S0021951724000782/MAIN/application/pdf/70bcca3e5bafd6f7648c671792ccaff7/main.pdf main.pdf pdf true 2020381 MAIN 8 1-s2.0-S0021951724000782-main_1.png https://s3-eu-west-1.amazonaws.com/prod-ucs-content-store-eu-west/content/pii:S0021951724000782/PREVIEW/image/png/27e02435336afb482ab22e25e2647c68/main_1.png main_1.png png 54929 849 656 IMAGE-WEB-PDF 1 1-s2.0-S0021951724000782-gr5.jpg https://s3-eu-west-1.amazonaws.com/prod-ucs-content-store-eu-west/content/pii:S0021951724000782/gr5/DOWNSAMPLED/image/jpeg/0026dcb71e36fd26dd171d53f7b718a2/gr5.jpg gr5 gr5.jpg jpg 41488 419 535 IMAGE-DOWNSAMPLED 1-s2.0-S0021951724000782-gr4.jpg https://s3-eu-west-1.amazonaws.com/prod-ucs-content-store-eu-west/content/pii:S0021951724000782/gr4/DOWNSAMPLED/image/jpeg/621e4420c18924edec2d2717e2fdc223/gr4.jpg gr4 gr4.jpg jpg 30182 253 665 IMAGE-DOWNSAMPLED 1-s2.0-S0021951724000782-gr3.jpg https://s3-eu-west-1.amazonaws.com/prod-ucs-content-store-eu-west/content/pii:S0021951724000782/gr3/DOWNSAMPLED/image/jpeg/c87ad405760b52e4fecdbbc5f1fccc0e/gr3.jpg gr3 gr3.jpg jpg 35175 221 651 IMAGE-DOWNSAMPLED 1-s2.0-S0021951724000782-gr2.jpg https://s3-eu-west-1.amazonaws.com/prod-ucs-content-store-eu-west/content/pii:S0021951724000782/gr2/DOWNSAMPLED/image/jpeg/2f8b61124205cedce125f5610db811ee/gr2.jpg gr2 gr2.jpg jpg 30706 379 535 IMAGE-DOWNSAMPLED 1-s2.0-S0021951724000782-ga1.jpg https://s3-eu-west-1.amazonaws.com/prod-ucs-content-store-eu-west/content/pii:S0021951724000782/ga1/DOWNSAMPLED/image/jpeg/7a9643e2d217a80119c75916e9544599/ga1.jpg ga1 true ga1.jpg jpg 19232 200 323 IMAGE-DOWNSAMPLED 1-s2.0-S0021951724000782-gr1.jpg https://s3-eu-west-1.amazonaws.com/prod-ucs-content-store-eu-west/content/pii:S0021951724000782/gr1/DOWNSAMPLED/image/jpeg/3e913966c9b360bc5f2b20499e6612ca/gr1.jpg gr1 gr1.jpg jpg 17228 154 383 IMAGE-DOWNSAMPLED 1-s2.0-S0021951724000782-gr7.jpg https://s3-eu-west-1.amazonaws.com/prod-ucs-content-store-eu-west/content/pii:S0021951724000782/gr7/DOWNSAMPLED/image/jpeg/457f678dd802038ad0ce13e64e7c0ba4/gr7.jpg gr7 gr7.jpg jpg 34053 389 535 IMAGE-DOWNSAMPLED 1-s2.0-S0021951724000782-gr6.jpg https://s3-eu-west-1.amazonaws.com/prod-ucs-content-store-eu-west/content/pii:S0021951724000782/gr6/DOWNSAMPLED/image/jpeg/610e454c0c73b2c402056f89a9bdabcb/gr6.jpg gr6 gr6.jpg jpg 43054 337 383 IMAGE-DOWNSAMPLED 1-s2.0-S0021951724000782-gr5.sml https://s3-eu-west-1.amazonaws.com/prod-ucs-content-store-eu-west/content/pii:S0021951724000782/gr5/THUMBNAIL/image/gif/4b2e797df57a8a18235d3d1a77176a43/gr5.sml gr5 gr5.sml sml 7182 164 209 IMAGE-THUMBNAIL 1-s2.0-S0021951724000782-gr4.sml https://s3-eu-west-1.amazonaws.com/prod-ucs-content-store-eu-west/content/pii:S0021951724000782/gr4/THUMBNAIL/image/gif/40780b18b88e20fcd4d61ad3a44f80c3/gr4.sml gr4 gr4.sml sml 4811 83 219 IMAGE-THUMBNAIL 1-s2.0-S0021951724000782-gr3.sml https://s3-eu-west-1.amazonaws.com/prod-ucs-content-store-eu-west/content/pii:S0021951724000782/gr3/THUMBNAIL/image/gif/21960af598d367ae9cbf9ff91f2a9297/gr3.sml gr3 gr3.sml sml 4708 74 219 IMAGE-THUMBNAIL 1-s2.0-S0021951724000782-gr2.sml https://s3-eu-west-1.amazonaws.com/prod-ucs-content-store-eu-west/content/pii:S0021951724000782/gr2/THUMBNAIL/image/gif/59ae2140f1ea82267242c2d5a142896b/gr2.sml gr2 gr2.sml sml 5675 155 219 IMAGE-THUMBNAIL 1-s2.0-S0021951724000782-ga1.sml https://s3-eu-west-1.amazonaws.com/prod-ucs-content-store-eu-west/content/pii:S0021951724000782/ga1/THUMBNAIL/image/gif/6170c8b93598d072992d47e2ddcd740c/ga1.sml ga1 true ga1.sml sml 9856 136 219 IMAGE-THUMBNAIL 1-s2.0-S0021951724000782-gr1.sml https://s3-eu-west-1.amazonaws.com/prod-ucs-content-store-eu-west/content/pii:S0021951724000782/gr1/THUMBNAIL/image/gif/ab0b07737c964aa985b75f207428c374/gr1.sml gr1 gr1.sml sml 5432 88 219 IMAGE-THUMBNAIL 1-s2.0-S0021951724000782-gr7.sml https://s3-eu-west-1.amazonaws.com/prod-ucs-content-store-eu-west/content/pii:S0021951724000782/gr7/THUMBNAIL/image/gif/1f52719b58cc6cb43ac440c5ab4e5318/gr7.sml gr7 gr7.sml sml 6079 159 219 IMAGE-THUMBNAIL 1-s2.0-S0021951724000782-gr6.sml https://s3-eu-west-1.amazonaws.com/prod-ucs-content-store-eu-west/content/pii:S0021951724000782/gr6/THUMBNAIL/image/gif/1996a83838b1db06e2bd8322c644abb4/gr6.sml gr6 gr6.sml sml 10711 164 186 IMAGE-THUMBNAIL 1-s2.0-S0021951724000782-gr5_lrg.jpg https://s3-eu-west-1.amazonaws.com/prod-ucs-content-store-eu-west/content/pii:S0021951724000782/HIGHRES/image/jpeg/bcb30f04609b57dcad5dffbc2298c539/gr5_lrg.jpg gr5 gr5_lrg.jpg jpg 221761 1854 2368 IMAGE-HIGH-RES 1-s2.0-S0021951724000782-gr4_lrg.jpg https://s3-eu-west-1.amazonaws.com/prod-ucs-content-store-eu-west/content/pii:S0021951724000782/HIGHRES/image/jpeg/18876e1d5e322b46eabdbe16d87caf10/gr4_lrg.jpg gr4 gr4_lrg.jpg jpg 152466 1121 2945 IMAGE-HIGH-RES 1-s2.0-S0021951724000782-gr3_lrg.jpg https://s3-eu-west-1.amazonaws.com/prod-ucs-content-store-eu-west/content/pii:S0021951724000782/HIGHRES/image/jpeg/dd37284e339461e5ec75c8656f88f089/gr3_lrg.jpg gr3 gr3_lrg.jpg jpg 221575 981 2884 IMAGE-HIGH-RES 1-s2.0-S0021951724000782-gr2_lrg.jpg https://s3-eu-west-1.amazonaws.com/prod-ucs-content-store-eu-west/content/pii:S0021951724000782/HIGHRES/image/jpeg/bcd8a3eaf8ec1aaae2e48cf264b5ec36/gr2_lrg.jpg gr2 gr2_lrg.jpg jpg 182139 1679 2368 IMAGE-HIGH-RES 1-s2.0-S0021951724000782-ga1_lrg.jpg https://s3-eu-west-1.amazonaws.com/prod-ucs-content-store-eu-west/content/pii:S0021951724000782/HIGHRES/image/jpeg/c11fcedd6b904ffaad22f9a865efb80c/ga1_lrg.jpg ga1 true ga1_lrg.jpg jpg 124591 886 1431 IMAGE-HIGH-RES 1-s2.0-S0021951724000782-gr1_lrg.jpg https://s3-eu-west-1.amazonaws.com/prod-ucs-content-store-eu-west/content/pii:S0021951724000782/HIGHRES/image/jpeg/92dde63dba7e3776e03a80947f799f9b/gr1_lrg.jpg gr1 gr1_lrg.jpg jpg 114491 683 1699 IMAGE-HIGH-RES 1-s2.0-S0021951724000782-gr7_lrg.jpg https://s3-eu-west-1.amazonaws.com/prod-ucs-content-store-eu-west/content/pii:S0021951724000782/HIGHRES/image/jpeg/edc65c3cbf6d517c1641fdb17af8e2ed/gr7_lrg.jpg gr7 gr7_lrg.jpg jpg 207727 1722 2368 IMAGE-HIGH-RES 1-s2.0-S0021951724000782-gr6_lrg.jpg https://s3-eu-west-1.amazonaws.com/prod-ucs-content-store-eu-west/content/pii:S0021951724000782/HIGHRES/image/jpeg/bfe07735c5f0c7472c9ac29b7183efda/gr6_lrg.jpg gr6 gr6_lrg.jpg jpg 259928 1495 1699 IMAGE-HIGH-RES 1-s2.0-S0021951724000782-mmc1.docx https://s3-eu-west-1.amazonaws.com/prod-ucs-content-store-eu-west/content/pii:S0021951724000782/mmc1/MAIN/application/vnd.openxmlformats-officedocument.wordprocessingml.document/6f5301ddd8f3b3c081d67ca837c5b63c/mmc1.docx mmc1 mmc1.docx docx 2256546 APPLICATION 1-s2.0-S0021951724000782-si1.svg https://s3-eu-west-1.amazonaws.com/prod-ucs-content-store-eu-west/content/pii:S0021951724000782/image/svg+xml/084bad0abe1ed330b7dbd3c92e1fa820/si1.svg si1 si1.svg svg 20860 ALTIMG 1-s2.0-S0021951724000782-am.pdf https://s3-eu-west-1.amazonaws.com/prod-ucs-content-store-eu-west/content/egi:10VDKSQ48VV/MAIN/application/pdf/c304c7f89f2b472a109f9a690e0d60a5/am.pdf am am.pdf pdf false 1974057 AAM-PDF YJCAT 115365 115365 S0021-9517(24)00078-2 10.1016/j.jcat.2024.115365 Elsevier Inc. Fig. 1 Metalloporphyrin used in electrocatalytic study: α4-meso-tetra-2-(4-ferrocenyl-1,2,3-triazolyl)-phenylporphyrinato iron (III) bromide ( o-Fc4TPP-FeIII ) and meso-tetra-4-(4-ferrocenyl-1,2,3-triazolyl)-phenylporphyrinato iron (III) bromide ( p-Fc4TPP-FeIII ). Fig. 2 CV response of both compounds in 0.1 M Bu4NPF6/dry CH3Cl and deaerated solution. Scan rate: 100 mVs−1; complexes concentration: 1.0 mM. 2 mm diameter Platinum working electrode. Fig. 3 Electrochemical characterization by CV of modified electrodes OPG/o-Fc4TPP-FeIII (red) and OPG/p-Fc4TPP-FeIII (black) in 0.1 M NaOH at 250 mVs−1; (a) N2-saturated and (b) N2-saturated Vs. electroreduction of O2. (For interpretation of the references to color in this figure legend, the reader is referred to the web version of this article.) Fig. 4 (a) polarization curves by LSV of modified electrodes OPG/o-Fc4TPP-FeIII (red), and OPG/p-Fc4TPP-FeIII (black) in 0.1 M NaOH at 2 mVs−1 and saturated O2, using a thermoregulated bath at 21 °C. (b) Tafel plots of both systems. (For interpretation of the references to color in this figure legend, the reader is referred to the web version of this article.) Fig. 5 Rotating ring-disc electrode (RRDE) curves of modified electrodes OPG/o-Fc4TPP-FeIII (red), OPG/p-Fc4TPP-FeIII (black) and OPGbare (green) in 0.1 M NaOH at 5 mVs−1, 500 rpm and saturated O2, using a thermoregulated bath at 21 °C. (For interpretation of the references to color in this figure legend, the reader is referred to the web version of this article.) Fig. 6 Comparison of ORR catalytic activities of several FeN4 macrocyclic complexes versus their FeIII/II redox potential. All in 0.1 M NaOH. Our data in sky-blue. The rest as reported, adapted from Fig. 3 in [13]. (For interpretation of the references to color in this figure legend, the reader is referred to the web version of this article.) Scheme 1 Synthesis of meso-tetra-4-(4-ferrocenyl-1,2,3-triazolyl)-phenylporphyrinato iron (III) bromide (p-Fc4TPP-FeIII). Research article Electrocatalytic oxygen reduction on metalloporphyrins. Second coordination sphere substituents on the ligand: Electronic and steric effects through pocket and extended structures and their effect on the electrocatalytic activity Carlos P. Silva Investigation Writing – original draft Writing – review & editing a b Carolina P. Candia Investigation Methodology Validation a b Mauricio Paredes Investigation c Elizabeth Imbarack Data curation Funding acquisition Investigation Software a b Fabian Martínez-Gómez Data curation Investigation Methodology d Camila F. Olguín Data curation Investigation Methodology a b Geraldine Jara Investigation a b José H. Zagal Formal analysis Validation Writing – review & editing a b Jorge Pavez Conceptualization Formal analysis Supervision Writing – original draft a b ⁎ Nicolás Agurto Funding acquisition Investigation Methodology Writing – original draft Writing – review & editing a b ⁎ a Universidad de Santiago de Chile (USACH), Facultad de Química y Biología, Departamento de Química de los Materiales, Av. Libertador B. O’Higgins 3363, Casilla 40, Correo 33, Santiago, Chile Universidad de Santiago de Chile (USACH) Facultad de Química y Biología Departamento de Química de los Materiales Av. Libertador B. O’Higgins 3363, Casilla 40 Correo 33 Santiago Chile Universidad de Santiago de Chile (USACH), Facultad de Química y Biología, Departamento de Química de los Materiales, Av. Libertador B. O’Higgins 3363, Casilla 40, Correo 33, Santiago, Chile b Soft Matter Research and Technology Center, SMAT-C, Santiago, Chile Soft Matter Research and Technology Center SMAT-C Santiago Chile Soft Matter Research and Technology Center, SMAT-C, Santiago, Chile c Departamento de Química Inorgánica, Facultad de Química y de Farmacia. Pontificia Universidad Católica de, Chile Departamento de Química Inorgánica Facultad de Química y de Farmacia. Pontificia Universidad Católica de Chile Departamento de Química Inorgánica, Facultad de Química y de Farmacia. Pontificia Universidad Católica de, Chile d Universidad de Santiago de Chile (USACH), Facultad de Química y Biología, Departamento de Ciencias del ambiente, Av. Libertador B. O’Higgins 3363, Casilla 40, Correo 33, Santiago, Chile Universidad de Santiago de Chile (USACH) Facultad de Química y Biología Departamento de Ciencias del ambiente Av. Libertador B. O’Higgins 3363, Casilla 40, Correo 33 Santiago Chile Universidad de Santiago de Chile (USACH), Facultad de Química y Biología, Departamento de Ciencias del ambiente, Av. Libertador B. O’Higgins 3363, Casilla 40, Correo 33, Santiago, Chile ⁎ Corresponding authors. Graphical abstract The rational design of new electrocatalysts remains a continuous challenge in pursuing high-performance fuel cells free of precious metals. In this work, we report MN4-type metal-complex catalyst based on bio-inspired systems, i.e., metalloporphyrins complexes that include the second coordination sphere as the central axis for a relevant improvement in catalysis. Two isostructural systems, tetra-ferrocenyl-triazole metalloporphyrin (pocket vs. extended structures), were synthesized to study the role of the second coordination sphere on the electrochemical oxygen reduction reaction (ORR). The electrocatalysis results show that both porphyrin systems promote the ORR via four electrons. The system that presents a pocket structure (o-Fc4TPP-FeIII) exhibits a foot of the wave 72 mV more positive than its analog with an extended structure (p-Fc4TPP-FeIII). Rotating ring-disc experiments evidenced that the presence of H-bonding and distal redox groups would be directly related to faradaic efficiency for the 4-electron reduction to water, with an 86 % for the pocket structure and 76 % for the extended system. This study allows us to confirm the molecular scaffolding function by comparing two systems that present the same functional groups but in different chemical environments, providing valuable information regarding the steric-spatial parameters that play a role in the ORR. Keywords Second coordination sphere Ferrocenyl-metalloporphyrin Oxygen reduction reaction H-bonding and distal redox groups Redox potential Electrocatalysis Data availability No data was used for the research described in the article. 1 Introduction The oxygen reduction reaction (ORR) is considered one of the most important electrochemical reactions in energy conversion devices, such as fuel cells and lithium-air batteries [1]. ORR is a complex and slow process that, in an aqueous medium, depending on pH, can result in obtaining hydrogen peroxide (H2O2/HO2 –, via two electrons) or water (H2O/OH– via four electrons) [2–5] with the 4-electron reduction delivering the most energy in a H2/O2 fuel cell. Although the bond cleavage of the oxygen molecule is thermodynamically favored, its efficiency is low because it requires high overpotentials to promote its unfavorable kinetics [6]. Accordingly, expensive platinum-based catalysts have been the most appropriate materials to catalyze this reaction with high efficiency in fuel cells. The search lower cost materials for alternative systems based on non-precious metals, alloys, and materials derived from carbon and MN4 macrocyclic compounds of transition metals, among others, has been investigated for many years [7,8]. In biological environments, it is possible to find systems that present affinity and reactivity for oxygen, as a process associated with the heme groups in hemoglobin, cytochrome c, chlorophyll, and vitamin B12, among others [7]. These bio-structures have inspired the development of MN4-type macrocycle complexes, i.e., derivatives of metal phthalocyanines and metalporphyrins as redox mediators in catalysis and electrocatalysis [9]. These MN4-based systems have been investigated for more than five decades due to their applications in several areas like electrochemical sensors, photovoltaic devices, molecular electronics, and specially in electrocatalysis, just to name a few [10–13]. Various strategies have been employed to enhance ORR kinetics using MN4-type macrocycle complexes. Among these strategies are periphery functionalization, the addition of a fifth axial ligand (push effect), pyrolysis, and pull effect in meso-substituted macrocycle [14–19]. Some meso-porphyrins have substituents at the ortho position of the phenyl group, which has generated significant interest since it is possible to obtain systems to study the pull effect, also known as the second coordination sphere [20–22]. Thereby, ferrocenyl-triazole meso-tetraphenylporphyrin derivatives of FeIII (FeFc4) were synthesized by Copper-Catalyzed Azide-Alkyne Cycloaddition Reaction (CuAAC), known as “click reaction” to be compared with the FeES4 system, thus evaluating the inclusion of the organometallic fragment [23]. The studies showed that the presence of triazole groups promotes the end-on or axial interaction between oxygen molecule and iron center atom. Related works have determined that the orientation of O2 is essential to determine the reduction mechanism [24], where the side-on configuration promotes reduction via four electrons (4e), while the end-on configuration is through two electrons (2e). However, despite both systems promoting the axial configuration (end-on) due to the presence of substituents in a distal hydrogen bonding environment, they both demonstrated oxygen reduction preferentially via 4e. This result was associated with the additional interaction of the distal hydrogen bonding pocket, which stabilizes the Fe-O2-HN adduct. However, the inclusion of the identical subunits in other positions of the aromatic ring in the meso-position of the macrocycle has not been systematically studied. These researches are crucial to effectively understand the role played by the presence of the pocket structure associated with the second sphere, especially when these compounds work under experimental conditions relevant to ORR. In this work, two structural isomers, α4-meso-tetra-2-(4-ferrocenyl-1,2,3-triazolyl)-phenylporphyrinato iron (III) bromide (o-Fc4TPP-FeIII) and meso-tetra-4-(4-ferrocenyl-1,2,3-triazolyl)-phenylporphyrinato iron (III) bromide (p-Fc4TPP-FeIII) (Fig. 1 ), were synthesized and studied to contribute to understanding the second coordination sphere effect on the performance in the ORR catalysis in basic medium through pocket vs. extended structures. 2 Experimental 2.1 Materials and methods All synthetic reactions were performed using standard Schlenk techniques under inert atmosphere. All solvents were purified and dried by conventional methods before use. Reagents ferrocenecarboxaldehyde, 2-nitrobenzaldehyde, 4-nitrobenzaldehyde, trifluoroacetic acid (TFA), pyrrole, sodium nitrite, zinc acetate dihydrate, sodium azide, sodium ascorbate, iron (II) bromide (Aldrich), copper (II) sulfate (Merck) were used as received. Ethynyl ferrocene, and α4-meso-tetra-2-(4-ferrocenyl-1,2,3-triazolyl)-phenylporphyrinato iron (III) bromide (o-Fc4TPP-FeIII) were synthesized following a previously reported procedure [25,26]. NMR spectra were registered on a Bruker AC 400 MHz instrument. 1H NMR chemical shifts were referenced against the chemical shifts of residual solvent resonances. The 1H NMR experiments were obtained with a spectral window of 30 ppm, 32 scans and 4 dummy scans. Infrared spectra were recorded on a Perkin-Elmer Spectrum Two spectrophotometer, with all samples being dispersed in KBr using a solid sample. Mass spectra were acquired on a Thermo Fisher Scientific Velos Pro LTQ linear ion trap mass spectrometer with Z-spray electrospray ionization (ESI). UV–visible spectra were recorded with a Shimadzu spectrophotometer UV-1800. Metalo ligands solutions were prepared using chloroform (CHCl3) as a solvent with a 10−3 mol/L concentration for electrochemical characterization in organic medium. Cyclic voltammetry (CV), linear sweep voltammetry (LSV), and rotating ring-disc electrode (RRDE) studies were carried out at 25 °C using a Metrohm Autolab PGSTAT302N bi-potentiostat with an Analytical Rotator (Metrohm Autolab). All solutions (0.1 M NaOH, 0.1 M Bu4NPF6/CH3Cl) were purged with ultrapure nitrogen or oxygen for 30 min before electrochemical measurements. A modified Edge Plane Graphite (OPG, PineInstruments, USA) was used as a working electrode in CV and LSV, geometrical area of 0.196 cm2. For RRDE experiments, a Glassy Carbon 5 mm area disk Platinum ring (Metrohm Autolab) as a working electrode and a platinum coil having an area of 5 cm2 was used as an auxiliary electrode. A saturated calomel electrode served as the reference electrode. A silver wire with 10 mM silver nitrate and 0.1 M Bu4NPF6 in acetonitrile was used as a reference electrode for non-aqueous solvent. 2.2 Synthesis of the catalyst Isostructural isomers tetra-ferrocenyl-triazole metalloporphyrin (o/p-Fc4TPP-FeIII) were synthesized in several reaction steps (see Supplementary Material). Briefly, the corresponding aminophenyl porphyrin derivatives were converted to azido phenyl porphyrin using sodium nitrite and TFA solution under strict temperature control. Zinc azidoporphyrin derivatives were obtained by metalation reaction of zinc acetate dihydrate in organic solution and the corresponding amino porphyrin. This step is followed by an attachment of the ethynyl ferrocene using a copper-catalyzed azide-alkyne click reaction. Demetallation of the Zinc (II) ferrocenyl porphyrin derivatives are performed by adding concentrated hydrochloric acid in an organic medium, and the free porphyrins are obtained. Finally, o-Fc4TPP-FeIII and p-Fc4TPP-FeIII were obtained by refluxing the free macrocycles in a solution of FeBr2 in THF. The compounds and the precursors were characterized by spectroscopic and electrochemical techniques. 2.3 Preparation of the catalyst-modified OPG electrodes The working electrode was polished with 5-μm sandpaper, rinsed with bi-distilled water (18 MΩ cm) and acetone, and dried under a stream of N2 gas before modification. 10 μL of dilute solutions (1 mg of the compound in 3 mL DMSO) of the catalysts were uniformly distributed on the disc. After 10 min of incubation at room temperature, the surfaces were first immersed in Milli-Q water and then methanol. 2.4 Electrochemical measurements The electrocatalytic study of ORR was carried out by cyclic voltammetry (CV), slow potential scan rate linear sweep voltammetry (LSV) and rotating ring-disk electrode (RRDE). The CV was registered at different potential sweep rates in 0.1 M NaOH saturated O2, and LSV (at 2 mV s−1) both in 0.1 M NaOH in saturated O2. In RRDE experiments the collection efficiency N of the ring electrode was estimated using solutions of Fe(CN)6 3− and gave a value of 25 %, value very close to that reported by the manufacturer (24.9 %). 3 Results and discussion 3.1 Synthesis of catalysts The synthetic methodology used to obtain the meso-tetra-azidophenylporphyrin precursor was carried out based on known methods, using sodium nitrite and sodium azide in an acid medium (TFA). The temperature control in this reaction turned out to be an important issue and the synthesis was performed maintaining a temperature of −10 °C during the reaction. In the initial trials, the reaction was carried out at room temperature and 0 °C. The initial trials were carried out at room temperature and 0 °C. Under these conventional experimental conditions, the product formation was observed, albeit in low yields [27]. However, after purifying and isolating the desired product, the appearance of multiple spots that did not correspond to the precursors or product was observed by silica gel thin layer chromatography (TLC). This behavior is related to the photosensitive and thermal decomposition that a large number of azide derivatives present [28]. To achieve a higher conversion and prevent product decomposition, two parameters were adjusted: the reaction temperature was lowered to −10 °C, and an amber glass vessel was used. Once the azidophenylporphyrin (p-TAzPP-2H) was obtained, this compound was immediately used to obtain the metalated derivative p-TAzPP-Zn. The metalation reaction between p-TAzPP-2H and zinc acetate was carried out under mild reaction conditions (room temperature and without an inert atmosphere), generating the desired product with a quantitative conversion. This reaction step is essential to prevent the incorporation of CuII into the porphyrin ring, a precursor used to generate in situ the catalyst (CuI). This step is necessary for the cycloaddition reaction (CuAAC) between the azido porphyrin and ethynyl ferrocene precursors. The outcome of this process is the generation of the Zn (II) meso-tetra-4-(4-ferrocenyl-1,2,3-triazolyl)-phenylporphyrinate derivative (p-Fc4TPP-Zn) [29]. Subsequently, the demetallation was carried out, where the compound was treated with 32 % HCl to give the free ligand. Finally, free macrocycle reaction in the presence of refluxing FeBr2 produced the p-Fc4TPP-FeIII catalyst in 77 % yield (Scheme 1 ). The complex was filtered on celite® and obtained in pure form without further purification. Purification using a chromatographic column resulted in a color change of the obtained compound, shifting from violet to green. When using silica gel as the stationary phase and a mixture of dichloromethane/methanol (93:7), although it allowed the separation of the precursors from the possible product, the observed color change was likely associated with the generation of the corresponding methoxide (p-Fc4TPP-FeIII-OMe3), which is favored in this type of experimental conditions [30]. The synthetic methodologies and characterizations for the steps depicted are described in detail in the support information section (Fig. S1-6), both for the new catalyst (p-Fc4TPP-FeIII) and the one already reported in the literature (o-Fc4TPP-FeIII) (Figures S7-9). 3.2 Electrochemical behavior The Metalloporphyrins o-Fc4TPP-FeIII (red) and p-Fc4TPP-FeIII (black) were characterized in an organic solution by cyclic voltammetry (Fig. 2 ). In general, the ferrocenyl-triazole meso-TPP-Fe complexes exhibited similar voltammetric behavior in dry chloroform containing 0.1 M Bu4NPF6 as supporting electrolyte. Starting in the anodic direction, both compounds exhibited a clear quasi-reversible process at ∼ 0.25 V attributed to the response of the four ferrocenyl group (FcIII/II process), and then an irreversible wave at ∼ 1.0 V, associated to the oxidation of the porphyrin ring (P/P+) [26]. This assignment was possible by the electrochemical characterization of the TPPFe derivative, which has no ferrocenyl groups or triazole moieties. In this experiment, only the process attributed to the porphyrin ring is observed (Figure S10). The p-Fc4TPP-Fe compound also exhibited a quasi-reversible anodic wave centered at approximately 0.77 V, possibly attributed to the oxidation of the triazole moiety. An experiment using a wider potential window was performed in order to observe if the oxidation of the triazole could be linked to the quasi-reversible ferrocene oxidation (Figure S11a). The results indicated that when a wider potential window is examined, i.e., higher potentials than the ferrocenyl redox process, the ferrocene-associated signal broadens. Furthermore, after multiple scans are performed, incipient passivation of the electrode surface was observed (Figure S11b). This behavior can be associated to the forming radical species and subsequent surface modification. Despite the differences found at potentials higher than 0.5 V vs Ag/Ag+, as expected the redox couples associated with the ferrocenyl fragments showed the same Ep1/2 when comparing both compounds (ortho- and para- positions), which confirms that these functional groups do not present electronic differences related to the position on the aromatic ring of the metalloporphyrins. The inclusion of ferrocenyl fragments in both systems are distal redox centers and play an important role in the selective reduction of O2, as observed in biomimetic functional models of cytochrome c oxidase (Cco) [31]. Regarding the catalytically active site (MN4/FeII), it was not possible to distinguish them by cyclic voltammetry in the region of cathodic potentials in organic medium. Consequently, we proceeded to study their electroactive behavior with the FeN4 molecules confined on a OPG electrode surface under alkaline conditions and investigated their electrocatalytic activity for ORR. 3.3 Electrocatalysis for the ORR on OPG/Porphyrins electrode systems The study for the catalytic activity for the oxygen reduction reaction was carried out using cyclic voltammetry techniques after modifying the OPG working electrode with monolayer levels of the two catalysts under study, o-Fc4TPP-FeIII and p-Fc4TPP-FeIII. The modified electrodes were studied in heterogeneous conditions in aqueous media. Fig. 3 shows the cyclic voltammograms of the systems recorded in a 0.1 M NaOH (pH = 13) deaired electrolyte (N2 purged) and in O2 saturated at 250 mVs−1 (Figure S12 shows a CV at a lower scan rate.). The measurements performed under N2 show the processes associated with the catalytically active iron centers in FeN4 (Fig. 3a), which were not observed in organic media. The structural isomers showed a quasi-reversible process centered at 0.49 V and 0.40 V for the ortho- and para-substituted systems, respectively. In contrast to the redox process of the ferrocenyl group (FcIII/II) in organic media (Fig. 2) the process associated with MN4/FeIII/II is shifted approximately ∼ 0.09 V toward higher potentials than its extended analog. The position of the substituent (Fc-triazole) on the aromatic rings, particularly in the meso-position, modulates the energy levels of the frontier orbitals with d-character of the metal center. As a result, the ortho-substituted system provides an electronic environment that favors the reduction of iron to its more catalytically electroactive (II) oxidation state (Fig. 3b). This is reflected in a more positive FeIII/II redox potential compared to that of the para derivative. Fig. 4 a shows the polarization curves by LSV of modified electrodes. The polarization curves show that the system that structurally contains the pocket site associated with the second coordination sphere (OPG/o-Fc4TPP-FeIII), presents the best performance in terms of onset potential for the ORR in comparison with the extended system (OPG/p-Fc4TPP-FeIII), shifting 72 mV to more positive potentials. The Tafel plots in Fig. 4b obtained from the polarization curves (Fig. 4a), give two linear correlations, with slope values of −47 mV/decade and −66 mV/decade for [OPG/o-Fc4TPP-FeIII] and [OPG/p-Fc4TPP-FeIII] systems, respectively. The Tafel slope of −47 mV for OPG/o-Fc4TPP-FeIII] is close to a hypotethical value of −40 mV/dec that suggests that the rate determining step is a one electron transfer occurring after a fast one-electron transfer step involving the reduction of the FeIII in the complex. The value for p-Fc4TPP-FeIII is within the range reported for iron porphyrins (∼60 mV/dec.), and therefore would suggest that the rate-determining step (rds) is a chemical step preceded by a fast one electron step involving the FeIIIOH + ->FeII + OH– transition. Electron transfer (Eq. 2) as shown in the Mechanism 1. For both complexes the first step is common, but it is intriguing that a slight modification of the ligand seems to change the rate determining step. Both complexes catalyze the reduction of O2 via an overall transfer of 4-electron, which is typical of FeN4 complexes including Fe porphyrins and Fe phthalocyanines [11,17]. Mechanism 1 (1) [OHFeIIIFc4TPP]ad + e + H2O⇆[H2OFeIIFc4TPP]ad + OH– (aq) fast (2) [H2OFeIIFc4TPP]ad + O2(aq) + e → [O2FeIIFc4TPP] − ad + H2O rds Tafel slope of ca. −40 mV/decade Mechanism 2 (1) [OHFeIIIFc4TPP]ad + e + H2O⇆[H2OFeIIFc4TPP]ad + OH– (aq) fast (3) [H2OFeIIFc4TPP]ad + O2(aq) → [O2 −FeIIIFc4TPP]ad + H2O rds Tafel slope of ca. −60 mV/decade Previous studies have suggested that the orientation of O2 on the Fe site is essential to determine the reduction mechanism [17]. It was found that the side-on configuration promotes reduction via four electrons (4e), while the end-on configuration isthroughtwo electrons (2e). The end on interaction does not destabilizes the OO bond enough to promote its rupture. It is also possible that the Fe-O2 binding is strong compared for example to CoN4 macrocyclic. Most CoN4 macrocyclic are known to promote the 2-e reduction of O2 only as Co-O2 binding is weaker compared to that on Fe porphyrins [8]. However, although the pocket system promotes the axial configuration (end-on) due to substituents in a distal hydrogen bonding environment, it preferentially shows an oxygen reduction via 4e. This outcome was associated with the additional interaction of the distal hydrogen bonding pocket, which stabilizes the Fe-O2-HN adduct. The presence of the ferrocenyl moieties play an important role in benefiting the ORR via 4 electron pathways. Metalloporphyrins bearing ferrocene immobilized on self-assembled monolayers (SAMs) of alkanethiols of different chain lengths on Au electrode have been reported to modulate the electron flow [23]. The experiment showed that incorporating the ferrocenyl moieties act as intramolecular electron transfer sites maintain the formation of H2O as the main reaction product via 4 electrons, unlike the FeEs4 macrocyclic, that contained four ester groups (-COOMe) in replaced of organometallic fragments, which generated hydrogen peroxide as the majority reaction product (two electrons) [23]. On the other hand, the interaction of the second coordination sphere associated with the hydrogen bonding interactions facilitates the protonation of distal oxygen, which can be related to the change in the slow reaction stage. Through SERRS-RDE studies, the formation and accumulation of the FeIV = O species have been detected, which is evidence of being the determining stage for this derivative [23,32]. Therefore, it can be established that both pocket (o-Fc4TPP-FeIII) and extend (p-Fc4TPP-FeIII) structures affect the ET mechanism of the reaction, or at least change the Tafel slope. It is interesting to observe the behavior of the LSV down to 0. V. These types of complexes are known for catalyzing the hydrogen evolution reaction; however, as is observed in Fig. 4a with a scan down to 0.0 V no hydrogen evolution was observed (no visible bubble formation) [33]. The limiting currents are not flat but show a slight maximum. The slight decay at more negative potentials could attributed to a decrease of the 4 electrons ORR currents and some peroxide formation. The limiting currents are directly proportional to the total number of electrons transferred. This has also been observed for ORR on graphite modified with Fe phthalocyanines and seems to be a common feature of FeN4 type catalysts in alkaline media [33]. Even though we did not see clear signals in the voltammograms in the absence of O2 that could attributed to the Fe(II)/(I) process (Fig. 3 a), a reduced form of the complex may be formed at more negative potentials that could promote ORR via 2 electrons to form some peroxide [3]. Fig. 5 shows the polarization curves obtained by LSV using a rotating ring-disc electrode, along with the determination of hydrogen peroxide. Although the electrocatalytic studies predominantly indicated that a four-electron mechanism takes place, both systems under study showed the formation of some hydrogen peroxide but much less than bare graphite which only reduces O2 via 2-electrons (see green line Fig. 5). It is also possible that the little peroxide formation observed on both complexes could be attributed to O2 reduction on graphite naked regions on the surface that are not coated by the Fe complexes, but the peroxide response of both complexes is different. In agreement with the polarization curves, although the OPG/p-Fc4TPP-FeIII system presents a higher peroxide percentage than its OPG/o-Fc4TPP-FeIII analog, the ring response of the extended derivative (p-Fc4TPP-FeIII) shows a narrow potential range for peroxide formation (0.52 V vs. RHE). In comparison, the pocket structure generates peroxide at two different potentials (0.58 and 0.13 V vs. RHE). These differences could arise from the contrasting structural characteristics of the extended vs. pocket structure. When these derivatives are deposited on the substrate (OPG), the differences in compound geometry among these derivatives might produce variations in the surface array of coating. This characteristic could leave possible unmodified graphite surface sites, i.e., two different active sites affecting electrocatalytic performance. In the same way, this would explain the peroxide production (ORR via two electrons) observed at 0.13 V vs. RHE for the pocket structure. This is related to the disk-current response at high overpotentials (Fig. 5), where only the OPG/p-Fc4TPP-FeIII system reaches a limit current, meanwhile the o-Fc4TPP-Fe system shows special behavior, i.e., the disk-current decrease at the same potential zone of peroxide formation (0.13 V). The percentage of peroxide production at 0.52 V vs. RHE, was estimated using the following equation: % H 2 O 2 = 2 ∙ I ring / N I disk + I ring / N ∙ 100 For OPG/p-Fc4TPP-FeIII system 24 % peroxide was obtained, while for OPG/o-Fc4TPP-FeIII it reached 14 % peroxide. Our results, especially with the o-Fc4TPP-FeIII catalyst, indicate a significant electrocatalytic performance via 4 electrons compared to the similar systems studied in a homogeneous catalysis, leading to an increase in peroxide generation above 50 % [34,35]. Including distal electroactive fragments would be crucial to favor the selectivity-determining step. The species HO2-FeIII obtained as a product has two possibilities depending on the protonated oxygen (distal vs. proximal). The scheme presented above shows the protonation of the distal oxygen, giving water as a reaction product (OH-basic medium) [36]. However, there is the possibility of protonating the proximal oxygen, which is directly attached to the MN4 metal center, resulting in hydrogen peroxide and only two electrons transferred to regenerate the catalytic cycle. The higher activity catalytic of o-Fc4TPP-Fe compared to p-Fc4TPP-Fe can be explained by the redox mechanism that operates on both complexes (first step of mechanism 1 and 2 involving the fast reduction of FeIIIOH− inactive to FeII active). When polarizing the electrode in the negative direction, catalytic response should start when FeIIIOH is reduced when active sites are electrogenerated on the electrode surface. FeIII(OH) is not active because OH– is strongly bound to the FeIII center and obviously predominates at potentials more positive than the FeIII/II redox potential of each complex. Since o-Fc4TPP-Fe has a more positive FeIII/II redox potential the ORR process should start at a more positive potential, which is experimentally observed, and the opposite is true p-Fc4TPP-Fe. It is interesting to compare the activities of our two complexes with the Fe(IIII)/(II) redox potential which has been proposed as an experimental reactivity descriptor [11–13,18]. Fig. 6 compares the catalytic activity of a great variety of Fe porphyrins and Fe phthalocyanines reported recently [13], with different substituents on the ligand. The kinetic data for our two complexes was taken from the Tafel plots of Fig. 4-b at E = 0.85 V vs RHE. They are illustrated as two sky-blue circles and they follow the general trend of the rest of the macrocyclic, in spite of the dispersion of some Fe porphyrins reported before. The Figure clear shows that the higher activity is exhibited by Fe phthalocyanines with strong electron-withdrawing ligand substituents that weaken the Fe-O2 bond. The low activity of o-Fc4TPP-Fe and to p-Fc4TPP-Fe compared to most Fe phthalocyanines can be associated to a strong Fe-O2 binding energy [11] and also to the fact that at 0.85 V vs RHE most of the surface is coated mostly with inactive Fe(III)OH species as their redox potentials are well below the potential chosen for comparing the activity. This is illustrated in Fig. 6 that in the potential region below 0.85 (vertical green line) Fe(III) predominates on the surface (lower activity) and the opposite is true for complexes on the right side of the green line (higher activity). In other words, the decrease in activity from right to left is associated with a gradual decrease of Fe(II) active sites on the electrode surface at 0.85 V for complexes exhibiting redox potentials below 0.85 V. Those complexes can act as O2 carriers in homogeneous media as hemoglobin as they bind O2 more strongly. 4 Conclusions In this work, isostructural metalloporphyrin derivatives were prepared and characterized. These derivatives were structurally designed to include a catalytically active center (FeN4), H bonds (triazole groups) and distal redox groups (ferrocenyl moieties). Despite both presenting the same functional groups, their electrocatalytic results highlighted the importance of conformation (pocket vs. extend-structure), as evidenced by differences in the Tafel slopes and, consequently, the reaction mechanism. This structural changes also affect their electronic structure which is evidenced by the two different Fe(III)/(II) redox potentials observed for the two complexes. In agreement with previous work, the complex with a more positive redox potential exhibits the higher catalytic activity for ORR. Additionally, the presence of distal redox groups (Fc) in both systems resulted in a high faradaic efficiency. This indicates that their inclusion is crucial for favoring the selectivity-determining step via four electrons pathway, generating water as a primary product, with efficiencies of 93 % for the pocket, and 86 % for the extended-structure, even when measured under heterogeneous conditions. CRediT authorship contribution statement Carlos P. Silva: Investigation, Writing – original draft, Writing – review & editing. Carolina P. Candia: Investigation, Methodology, Validation. Mauricio Paredes: Investigation. Elizabeth Imbarack: Data curation, Funding acquisition, Investigation, Software. Fabian Martínez-Gómez: Data curation, Investigation, Methodology. Camila F. Olguín: Data curation, Investigation, Methodology. Geraldine Jara: Investigation. José H. Zagal: Formal analysis, Validation, Writing – review & editing. Jorge Pavez: Conceptualization, Formal analysis, Supervision, Writing – original draft. Nicolás Agurto: Funding acquisition, Investigation, Methodology, Writing – original draft, Writing – review & editing. Declaration of competing interest The authors declare that they have no known competing financial interests or personal relationships that could have appeared to influence the work reported in this paper. Acknowledgments This research was funded by FONDECYT-ANID; Postdoc grants 3200196 (N.A.) and 3200199 (E.I.), and Initiation grant 11190782 (C.P.S); J.H.Z. is grateful to ANID, grants 1221798 and ACT 192175. C.P.C., C.F.O. and G.J. are thankful to ANID-Chile for Doctoral fellowships. ANID FODEQUIP: EQM 120065; EQM150106, and EQM160036. J.P. is grateful to DICYT-USACH project 022342PI_Ayudante1. Appendix A Supplementary material Supplementary data to this article can be found online at https://doi.org/10.1016/j.jcat.2024.115365. Appendix A Supplementary material The following are the Supplementary data to this article: Supplementary data 1 References [1] C. Lin J.-L. Li X. Li S. Yang W. Luo Y. Zhang In-situ reconstructed Ru atom array on α-MnO2 with enhanced performance for acidic water oxidation Nat. Catal. 4 2021 1012 1023 10.1038/s41929-021-00703-0 C. Lin, J.-L. Li, X. Li, S. Yang, W. Luo, Y. Zhang, S.-H. Kim, D.-H. Kim, S.S. Shinde, Y.-F. Li, Z.-P. Liu, Z. Jiang, J.-H. Lee, In-situ reconstructed Ru atom array on α-MnO2 with enhanced performance for acidic water oxidation, Nature Catalysis 4 (2021) 1012–1023. https://doi.org/10.1038/s41929-021-00703-0. [2] J.H. Zagal S. Griveau J.F. Silva T. Nyokong F. Bedioui Metallophthalocyanine-based molecular materials as catalysts for electrochemical reactions Coord. Chem. Rev. 254 2010 2755 2791 10.1016/j.ccr.2010.05.001 J.H. Zagal, S. Griveau, J.F. Silva, T. Nyokong, F. Bedioui, Metallophthalocyanine-based molecular materials as catalysts for electrochemical reactions, Coordination Chemistry Reviews 254 (2010) 2755–2791. https://doi.org/10.1016/j.ccr.2010.05.001. [3] J. Zagal M. Páez A.A. Tanaka J.R. dos Santos C.A. Linkous Electrocatalytic activity of metal phthalocyanines for oxygen reduction J. Electroanal. Chem. 339 1992 13 30 10.1016/0022-0728(92)80442-7 J. Zagal, M. Páez, A.A. Tanaka, J.R. dos Santos, C.A. Linkous, Electrocatalytic activity of metal phthalocyanines for oxygen reduction, Journal of Electroanalytical Chemistry 339 (1992) 13–30. https://doi.org/10.1016/0022-0728(92)80442-7. [4] J. Masa K. Ozoemena W. Schuhmann J.H. Zagal Oxygen reduction reaction using N4-metallomacrocyclic catalysts: fundamentals on rational catalyst design J. Porphyrins Phthalocyanines 16 2012 761 784 10.1142/S1088424612300091 J. Masa, K. Ozoemena, W. Schuhmann, J.H. Zagal, Oxygen reduction reaction using N4-metallomacrocyclic catalysts: fundamentals on rational catalyst design, Journal of Porphyrins and Phthalocyanines 16 (2012) 761–784. https://doi.org/10.1142/S1088424612300091. [5] J.H. Zagal Metallophthalocyanines as catalysts in electrochemical reactions Coord. Chem. Rev. 119 1992 89 136 10.1016/0010-8545(92)80031-L J.H. Zagal, Metallophthalocyanines as catalysts in electrochemical reactions, Coordination Chemistry Reviews 119 (1992) 89–136. https://doi.org/10.1016/0010-8545(92)80031-L. [6] Y. Chen Q. Jiang X. Bai P. Shan T. Liu Y. Wang Rational design of M-N4–Gr/V2C heterostructures as highly active ORR catalysts: a density functional theory study RSC Adv. 12 2022 14368 14376 10.1039/D2RA01956F Y. Chen, Q. Jiang, X. Bai, P. Shan, T. Liu, Y. Wang, H. Cui, R. Feng, Q. Kang, Z. Liang, H. Yuan, Rational design of M–N4–Gr/V2C heterostructures as highly active ORR catalysts: a density functional theory study, RSC Adv. 12 (2022) 14368–14376. https://doi.org/10.1039/D2RA01956F. [7] G. Wu P. Zelenay Nanostructured Nonprecious Metal Catalysts for Oxygen Reduction Reaction Acc. Chem. Res. 46 2013 1878 1889 10.1021/ar400011z G. Wu, P. Zelenay, Nanostructured Nonprecious Metal Catalysts for Oxygen Reduction Reaction, Acc. Chem. Res. 46 (2013) 1878–1889. https://doi.org/10.1021/ar400011z. [8] R. Bashyam P. Zelenay A class of non-precious metal composite catalysts for fuel cells Nature 443 2006 63 66 10.1038/nature05118 R. Bashyam, P. Zelenay, A class of non-precious metal composite catalysts for fuel cells, Nature 443 (2006) 63–66. https://doi.org/10.1038/nature05118. [9] S. Dey B. Mondal S. Chatterjee A. Rana S. Amanullah A. Dey Molecular electrocatalysts for the oxygen reduction reaction Nat. Rev. Chem. 1 2017 0098 10.1038/s41570-017-0098 S. Dey, B. Mondal, S. Chatterjee, A. Rana, S. Amanullah, A. Dey, Molecular electrocatalysts for the oxygen reduction reaction, Nature Reviews Chemistry 1 (2017) 0098. https://doi.org/10.1038/s41570-017-0098. [10] C. Shi B. Steiger F.C. Anson Coordination chemistry in electrocatalysis Pure Appl. Chem. 67 1995 319 322 10.1351/pac199567020319 C. Shi, B. Steiger, F.C. Anson, Coordination chemistry in electrocatalysis, Pure and Applied Chemistry 67 (1995) 319–322. https://doi.org/10.1351/pac199567020319. [11] J.H. Zagal M.T.M. Koper Reactivity Descriptors for the Activity of Molecular MN4 Catalysts for the Oxygen Reduction Reaction Angew. Chem. Int. Ed. 55 2016 14510 14521 10.1002/anie.201604311 J.H. Zagal, M.T.M. Koper, Reactivity Descriptors for the Activity of Molecular MN4 Catalysts for the Oxygen Reduction Reaction, Angew. Chem. Int. Ed. 55 (2016) 14510–14521. https://doi.org/10.1002/anie.201604311. [12] S. Specchia P. Atanassov J.H. Zagal Mapping transition metal–nitrogen–carbon catalyst performance on the critical descriptor diagram Curr. Opin. Electrochem. 27 2021 100687 10.1016/j.coelec.2021.100687 S. Specchia, P. Atanassov, J.H. Zagal, Mapping transition metal–nitrogen–carbon catalyst performance on the critical descriptor diagram, Current Opinion in Electrochemistry 27 (2021) 100687. https://doi.org/10.1016/j.coelec.2021.100687. [13] L. Scarpetta-Pizo R. Venegas K. Muñoz-Becerra L. Muñoz A. Toro-Labbé N. Darwish Using reactivity predictors for enhancing the electrocatalytic activity of MN4 molecular catalysts for the oxygen reduction reaction: The role of the N-pyridinium functional group in the porphyrazine-derivative ligands Electrochim. Acta 468 2023 143160 10.1016/j.electacta.2023.143160 L. Scarpetta-Pizo, R. Venegas, K. Muñoz-Becerra, L. Muñoz, A. Toro-Labbé, N. Darwish, R. Matute, R. Oñate, J.H. Zagal, I. Ponce, Using reactivity predictors for enhancing the electrocatalytic activity of MN4 molecular catalysts for the oxygen reduction reaction: The role of the N-pyridinium functional group in the porphyrazine-derivative ligands, Electrochimica Acta 468 (2023) 143160. https://doi.org/10.1016/j.electacta.2023.143160. [14] Y. Zhou Y.-F. Xing J. Wen H.-B. Ma F.-B. Wang X.-H. Xia Axial ligands tailoring the ORR activity of cobalt porphyrin Science Bulletin 64 2019 1158 1166 10.1016/j.scib.2019.07.003 Y. Zhou, Y.-F. Xing, J. Wen, H.-B. Ma, F.-B. Wang, X.-H. Xia, Axial ligands tailoring the ORR activity of cobalt porphyrin, Science Bulletin 64 (2019) 1158–1166. https://doi.org/10.1016/j.scib.2019.07.003. [15] C.F. Olguín N. Agurto C.P. Silva C.P. Candia M. Santander-Nelli J. Oyarzo Tuning the Covering on Gold Surfaces by Grafting Amino-Aryl Films Functionalized with Fe(II) Phthalocyanine: Performance on the Electrocatalysis of Oxygen Reduction Molecules 26 2021 1631 10.3390/molecules26061631 C.F. Olguín, N. Agurto, C.P. Silva, C.P. Candia, M. Santander-Nelli, J. Oyarzo, A. Gómez, J.F. Silva, J. Pavez, Tuning the Covering on Gold Surfaces by Grafting Amino-Aryl Films Functionalized with Fe(II) Phthalocyanine: Performance on the Electrocatalysis of Oxygen Reduction, Molecules 26 (2021) 1631. https://doi.org/10.3390/molecules26061631. [16] Z. Parsa S.S. Naghavi N. Safari Designing Push-Pull Porphyrins for Efficient Dye-Sensitized Solar Cells J. Phys. Chem. A 122 2018 5870 5877 10.1021/acs.jpca.8b03668 Z. Parsa, S.S. Naghavi, N. Safari, Designing Push–Pull Porphyrins for Efficient Dye-Sensitized Solar Cells, J. Phys. Chem. A 122 (2018) 5870–5877. https://doi.org/10.1021/acs.jpca.8b03668. [17] C. Zúñiga C. Candia-Onfray R. Venegas K. Muñoz J. Urra M. Sánchez-Arenillas Elucidating the mechanism of the oxygen reduction reaction for pyrolyzed Fe-N-C catalysts in basic media Electrochem. Commun. 102 2019 78 82 10.1016/j.elecom.2019.04.005 C. Zúñiga, C. Candia-Onfray, R. Venegas, K. Muñoz, J. Urra, M. Sánchez-Arenillas, J.F. Marco, J.H. Zagal, F.J. Recio, Elucidating the mechanism of the oxygen reduction reaction for pyrolyzed Fe-N-C catalysts in basic media, Electrochemistry Communications 102 (2019) 78–82. https://doi.org/10.1016/j.elecom.2019.04.005. [18] J.H. Zagal I. Ponce D. Baez R. Venegas J. Pavez M. Paez A Possible Interpretation for the High Catalytic Activity of Heat-Treated Non-Precious Metal Nx/C Catalysts for O2 Reduction in Terms of Their Formal Potentials Electrochem. Solid St. 15 2012 B90 10.1149/2.032206esl J.H. Zagal, I. Ponce, D. Baez, R. Venegas, J. Pavez, M. Paez, M. Gulppi, A Possible Interpretation for the High Catalytic Activity of Heat-Treated Non-Precious Metal Nx/C Catalysts for O2 Reduction in Terms of Their Formal Potentials, Electrochemical and Solid-State Letters 15 (2012) B90. https://doi.org/10.1149/2.032206esl. [19] J. Pavez M. Páez A. Ringuedé F. Bedioui J.H. Zagal Effect of film thickness on the electro-reduction of molecular oxygen on electropolymerized cobalt tetra-aminophthalocyanine films J. Solid State Electrochem. 9 2005 21 29 10.1007/s10008-004-0522-0 J. Pavez, M. Páez, A. Ringuedé, F. Bedioui, J.H. Zagal, Effect of film thickness on the electro-reduction of molecular oxygen on electropolymerized cobalt tetra-aminophthalocyanine films, Journal of Solid State Electrochemistry 9 (2005) 21–29. https://doi.org/10.1007/s10008-004-0522-0. [20] J.S. Derrick M. Loipersberger S.K. Nistanaki A.V. Rothweiler M. Head-Gordon E.M. Nichols Templating Bicarbonate in the Second Coordination Sphere Enhances Electrochemical CO2 Reduction Catalyzed by Iron Porphyrins J. Am. Chem. Soc. 144 2022 11656 11663 10.1021/jacs.2c02972 J.S. Derrick, M. Loipersberger, S.K. Nistanaki, A.V. Rothweiler, M. Head-Gordon, E.M. Nichols, C.J. Chang, Templating Bicarbonate in the Second Coordination Sphere Enhances Electrochemical CO2 Reduction Catalyzed by Iron Porphyrins, J. Am. Chem. Soc. 144 (2022) 11656–11663. https://doi.org/10.1021/jacs.2c02972. [21] A. Lashgari C.K. Williams J.L. Glover Y. Wu J. Chai J. “Jimmy” Jiang Enhanced Electrocatalytic Activity of a Zinc Porphyrin for CO2 Reduction: Cooperative Effects of Triazole Units in the Second Coordination Sphere Chem. –Eur. J. 26 2020 16774 16781 10.1002/chem.202002813 A. Lashgari, C.K. Williams, J.L. Glover, Y. Wu, J. Chai, J. “Jimmy” Jiang, Enhanced Electrocatalytic Activity of a Zinc Porphyrin for CO2 Reduction: Cooperative Effects of Triazole Units in the Second Coordination Sphere, Chemistry – A European Journal 26 (2020) 16774–16781. https://doi.org/10.1002/chem.202002813. [22] A.R. Ramuglia V. Budhija K.H. Ly M. Marquardt M. Schwalbe I.M. Weidinger An Iron Porphyrin Complex with Pendant Pyridine Substituents Facilitates Electrocatalytic CO2 Reduction via Second Coordination Sphere Effects ChemCatChem 13 2021 3934 3944 10.1002/cctc.202100625 A.R. Ramuglia, V. Budhija, K.H. Ly, M. Marquardt, M. Schwalbe, I.M. Weidinger, An Iron Porphyrin Complex with Pendant Pyridine Substituents Facilitates Electrocatalytic CO2 Reduction via Second Coordination Sphere Effects, ChemCatChem 13 (2021) 3934–3944. https://doi.org/10.1002/cctc.202100625. [23] S. Samanta K. Mittra K. Sengupta S. Chatterjee A. Dey Second Sphere Control of Redox Catalysis: Selective Reduction of O2 to O2– or H2O by an Iron Porphyrin Catalyst Inorg. Chem. 52 2013 1443 1453 10.1021/ic3021782 S. Samanta, K. Mittra, K. Sengupta, S. Chatterjee, A. Dey, Second Sphere Control of Redox Catalysis: Selective Reduction of O2 to O2– or H2O by an Iron Porphyrin Catalyst, Inorg. Chem. 52 (2013) 1443–1453. https://doi.org/10.1021/ic3021782. [24] A.G. Saputro H. Kasai Oxygen reduction reaction on neighboring Fe–N4 and quaternary-N sites of pyrolized Fe/N/C catalyst Phys. Chem. Chem. Phys. 17 2015 3059 3071 10.1039/C4CP04811C A.G. Saputro, H. Kasai, Oxygen reduction reaction on neighboring Fe–N4 and quaternary-N sites of pyrolized Fe/N/C catalyst, Phys. Chem. Chem. Phys. 17 (2015) 3059–3071. https://doi.org/10.1039/C4CP04811C. [25] W. Chen N.B. Zuckerman X. Kang D. Ghosh J.P. Konopelski S. Chen Alkyne-Protected Ruthenium Nanoparticles J. Phys. Chem. C 114 2010 18146 18152 10.1021/jp101053c W. Chen, N.B. Zuckerman, X. Kang, D. Ghosh, J.P. Konopelski, S. Chen, Alkyne-Protected Ruthenium Nanoparticles, J. Phys. Chem. C 114 (2010) 18146–18152. https://doi.org/10.1021/jp101053c. [26] S. Samanta K. Sengupta K. Mittra S. Bandyopadhyay A. Dey Selective four electron reduction of O2 by an iron porphyrin electrocatalyst under fast and slow electron fluxes Chem. Commun. 48 2012 7631 7633 10.1039/C2CC32832A S. Samanta, K. Sengupta, K. Mittra, S. Bandyopadhyay, A. Dey, Selective four electron reduction of O2 by an iron porphyrin electrocatalyst under fast and slow electron fluxes, Chem. Commun. 48 (2012) 7631–7633. https://doi.org/10.1039/C2CC32832A. [27] K. Barral A.D. Moorhouse J.E. Moses Efficient Conversion of Aromatic Amines into Azides: A One-Pot Synthesis of Triazole Linkages Org. Lett. 9 2007 1809 1811 10.1021/ol070527h K. Barral, A.D. Moorhouse, J.E. Moses, Efficient Conversion of Aromatic Amines into Azides: A One-Pot Synthesis of Triazole Linkages, Org. Lett. 9 (2007) 1809–1811. https://doi.org/10.1021/ol070527h. [28] G. L’abbe Decomposition and addition reactions of organic azides Chem. Rev. 69 1969 345 363 10.1021/cr60259a004 G. L’abbe, Decomposition and addition reactions of organic azides, Chem. Rev. 69 (1969) 345–363. https://doi.org/10.1021/cr60259a004. [29] A.W.I. Stephenson A.C. Partridge V.V. Filichev Synthesis of β-Pyrrolic-Modified Porphyrins and Their Incorporation into DNA, Chemistry – A European Journal 17 2011 6227 6238 10.1002/chem.201003200 A.W.I. Stephenson, A.C. Partridge, V.V. Filichev, Synthesis of β-Pyrrolic-Modified Porphyrins and Their Incorporation into DNA, Chemistry – A European Journal 17 (2011) 6227–6238. https://doi.org/10.1002/chem.201003200. [30] G. Tseberlidis P. Zardi A. Caselli D. Cancogni M. Fusari L. Lay Glycoporphyrin Catalysts for Efficient C-H Bond Aminations by Organic Azides Organometallics 34 2015 3774 3781 10.1021/acs.organomet.5b00436 G. Tseberlidis, P. Zardi, A. Caselli, D. Cancogni, M. Fusari, L. Lay, E. Gallo, Glycoporphyrin Catalysts for Efficient C–H Bond Aminations by Organic Azides, Organometallics 34 (2015) 3774–3781. https://doi.org/10.1021/acs.organomet.5b00436. [31] K.-Y. Wang J. Zhang Y.-C. Hsu H. Lin Z. Han J. Pang Bioinspired Framework Catalysts: From Enzyme Immobilization to Biomimetic Catalysis Chem. Rev. 123 2023 5347 5420 10.1021/acs.chemrev.2c00879 K.-Y. Wang, J. Zhang, Y.-C. Hsu, H. Lin, Z. Han, J. Pang, Z. Yang, R.-R. Liang, W. Shi, H.-C. Zhou, Bioinspired Framework Catalysts: From Enzyme Immobilization to Biomimetic Catalysis, Chem. Rev. 123 (2023) 5347–5420. https://doi.org/10.1021/acs.chemrev.2c00879. [32] S. Bhunia A. Ghatak A. Rana A. Dey Amine Groups in the Second Sphere of Iron Porphyrins Allow for Higher and Selective 4e–/4H+ Oxygen Reduction Rates at Lower Overpotentials J. Am. Chem. Soc. 145 2023 3812 3825 10.1021/jacs.2c13552 S. Bhunia, A. Ghatak, A. Rana, A. Dey, Amine Groups in the Second Sphere of Iron Porphyrins Allow for Higher and Selective 4e–/4H+ Oxygen Reduction Rates at Lower Overpotentials, J. Am. Chem. Soc. 145 (2023) 3812–3825. https://doi.org/10.1021/jacs.2c13552. [33] N. Heppe C. Gallenkamp S. Paul N. Segura-Salas N. von Rhein B. Kaiser Substituent Effects in Iron Porphyrin Catalysts for the Hydrogen Evolution Reaction**, Chemistry – A European Journal 29 2023 e202202465 N. Heppe, C. Gallenkamp, S. Paul, N. Segura-Salas, N. von Rhein, B. Kaiser, W. Jaegermann, A. Jafari, I. Sergueev, V. Krewald, U.I. Kramm, Substituent Effects in Iron Porphyrin Catalysts for the Hydrogen Evolution Reaction**, Chemistry – A European Journal 29 (2023) e202202465. https://doi.org/10.1002/chem.202202465. [34] C. Costentin H. Dridi J.-M. Savéant Molecular Catalysis of O2 Reduction by Iron Porphyrins in Water: Heterogeneous versus Homogeneous Pathways J. Am. Chem. Soc. 137 2015 13535 13544 10.1021/jacs.5b06834 C. Costentin, H. Dridi, J.-M. Savéant, Molecular Catalysis of O2 Reduction by Iron Porphyrins in Water: Heterogeneous versus Homogeneous Pathways, J. Am. Chem. Soc. 137 (2015) 13535–13544. https://doi.org/10.1021/jacs.5b06834. [35] R. Yuan S.L. George J. Chen Q. Wu X. Qiu L. Zhao Meso-substituted Metalloporphyrin-based Composites for Electrocatalytic Oxygen Reduction Reactions ChemNanoMat 9 2023 e202300027 R. Yuan, S.L. George, J. Chen, Q. Wu, X. Qiu, L. Zhao, Meso-substituted Metalloporphyrin-based Composites for Electrocatalytic Oxygen Reduction Reactions, ChemNanoMat 9 (2023) e202300027. https://doi.org/10.1002/cnma.202300027. [36] S. Chatterjee K. Sengupta B. Mondal S. Dey A. Dey Factors Determining the Rate and Selectivity of 4e–/4H+ Electrocatalytic Reduction of Dioxygen by Iron Porphyrin Complexes Acc. Chem. Res. 50 2017 1744 1753 10.1021/acs.accounts.7b00192 S. Chatterjee, K. Sengupta, B. Mondal, S. Dey, A. Dey, Factors Determining the Rate and Selectivity of 4e–/4H+ Electrocatalytic Reduction of Dioxygen by Iron Porphyrin Complexes, Acc. Chem. Res. 50 (2017) 1744–1753. https://doi.org/10.1021/acs.accounts.7b00192.",
      "scopus-id": "85187266935",
      "coredata": {
        "eid": "1-s2.0-S0021951724000782",
        "dc:description": "The rational design of new electrocatalysts remains a continuous challenge in pursuing high-performance fuel cells free of precious metals. In this work, we report MN4-type metal-complex catalyst based on bio-inspired systems, i.e., metalloporphyrins complexes that include the second coordination sphere as the central axis for a relevant improvement in catalysis. Two isostructural systems, tetra-ferrocenyl-triazole metalloporphyrin (pocket vs. extended structures), were synthesized to study the role of the second coordination sphere on the electrochemical oxygen reduction reaction (ORR). The electrocatalysis results show that both porphyrin systems promote the ORR via four electrons. The system that presents a pocket structure (o-Fc4TPP-FeIII) exhibits a foot of the wave 72 mV more positive than its analog with an extended structure (p-Fc4TPP-FeIII). Rotating ring-disc experiments evidenced that the presence of H-bonding and distal redox groups would be directly related to faradaic efficiency for the 4-electron reduction to water, with an 86 % for the pocket structure and 76 % for the extended system. This study allows us to confirm the molecular scaffolding function by comparing two systems that present the same functional groups but in different chemical environments, providing valuable information regarding the steric-spatial parameters that play a role in the ORR.",
        "openArchiveArticle": "false",
        "prism:coverDate": "2024-02-29",
        "openaccessUserLicense": null,
        "prism:aggregationType": "Journal",
        "prism:url": "https://api.elsevier.com/content/article/pii/S0021951724000782",
        "dc:creator": [
          {
            "@_fa": "true",
            "$": "Silva, Carlos P."
          },
          {
            "@_fa": "true",
            "$": "Candia, Carolina P."
          },
          {
            "@_fa": "true",
            "$": "Paredes, Mauricio"
          },
          {
            "@_fa": "true",
            "$": "Imbarack, Elizabeth"
          },
          {
            "@_fa": "true",
            "$": "Martínez-Gómez, Fabian"
          },
          {
            "@_fa": "true",
            "$": "Olguín, Camila F."
          },
          {
            "@_fa": "true",
            "$": "Jara, Geraldine"
          },
          {
            "@_fa": "true",
            "$": "Zagal, José H."
          },
          {
            "@_fa": "true",
            "$": "Pavez, Jorge"
          },
          {
            "@_fa": "true",
            "$": "Agurto, Nicolás"
          }
        ],
        "link": [
          {
            "@_fa": "true",
            "@rel": "self",
            "@href": "https://api.elsevier.com/content/article/pii/S0021951724000782"
          },
          {
            "@_fa": "true",
            "@rel": "scidir",
            "@href": "https://www.sciencedirect.com/science/article/pii/S0021951724000782"
          }
        ],
        "dc:format": "application/json",
        "openaccessType": null,
        "pii": "S0021-9517(24)00078-2",
        "prism:volume": "430",
        "articleNumber": "115365",
        "prism:publisher": "Elsevier Inc.",
        "dc:title": "Electrocatalytic oxygen reduction on metalloporphyrins. Second coordination sphere substituents on the ligand: Electronic and steric effects through pocket and extended structures and their effect on the electrocatalytic activity",
        "prism:copyright": "© 2024 Elsevier Inc. All rights reserved.",
        "openaccess": "0",
        "prism:issn": "00219517",
        "dcterms:subject": [
          {
            "@_fa": "true",
            "$": "Second coordination sphere"
          },
          {
            "@_fa": "true",
            "$": "Ferrocenyl-metalloporphyrin"
          },
          {
            "@_fa": "true",
            "$": "Oxygen reduction reaction"
          },
          {
            "@_fa": "true",
            "$": "H-bonding and distal redox groups"
          },
          {
            "@_fa": "true",
            "$": "Redox potential"
          },
          {
            "@_fa": "true",
            "$": "Electrocatalysis"
          }
        ],
        "openaccessArticle": "false",
        "prism:publicationName": "Journal of Catalysis",
        "openaccessSponsorType": null,
        "prism:pageRange": "115365",
        "pubType": "fla",
        "prism:coverDisplayDate": "February 2024",
        "prism:doi": "10.1016/j.jcat.2024.115365",
        "prism:startingPage": "115365",
        "dc:identifier": "doi:10.1016/j.jcat.2024.115365",
        "openaccessSponsorName": null
      },
      "objects": {
        "object": [
          {
            "@category": "standard",
            "@height": "419",
            "@width": "535",
            "@_fa": "true",
            "$": "https://api.elsevier.com/content/object/eid/1-s2.0-S0021951724000782-gr5.jpg?httpAccept=%2A%2F%2A",
            "@multimediatype": "JPEG image file",
            "@type": "IMAGE-DOWNSAMPLED",
            "@size": "41488",
            "@ref": "gr5",
            "@mimetype": "image/jpeg"
          },
          {
            "@category": "standard",
            "@height": "253",
            "@width": "665",
            "@_fa": "true",
            "$": "https://api.elsevier.com/content/object/eid/1-s2.0-S0021951724000782-gr4.jpg?httpAccept=%2A%2F%2A",
            "@multimediatype": "JPEG image file",
            "@type": "IMAGE-DOWNSAMPLED",
            "@size": "30182",
            "@ref": "gr4",
            "@mimetype": "image/jpeg"
          },
          {
            "@category": "standard",
            "@height": "221",
            "@width": "651",
            "@_fa": "true",
            "$": "https://api.elsevier.com/content/object/eid/1-s2.0-S0021951724000782-gr3.jpg?httpAccept=%2A%2F%2A",
            "@multimediatype": "JPEG image file",
            "@type": "IMAGE-DOWNSAMPLED",
            "@size": "35175",
            "@ref": "gr3",
            "@mimetype": "image/jpeg"
          },
          {
            "@category": "standard",
            "@height": "379",
            "@width": "535",
            "@_fa": "true",
            "$": "https://api.elsevier.com/content/object/eid/1-s2.0-S0021951724000782-gr2.jpg?httpAccept=%2A%2F%2A",
            "@multimediatype": "JPEG image file",
            "@type": "IMAGE-DOWNSAMPLED",
            "@size": "30706",
            "@ref": "gr2",
            "@mimetype": "image/jpeg"
          },
          {
            "@category": "standard",
            "@height": "200",
            "@width": "323",
            "@_fa": "true",
            "$": "https://api.elsevier.com/content/object/eid/1-s2.0-S0021951724000782-ga1.jpg?httpAccept=%2A%2F%2A",
            "@multimediatype": "JPEG image file",
            "@type": "IMAGE-DOWNSAMPLED",
            "@size": "19232",
            "@ref": "ga1",
            "@mimetype": "image/jpeg"
          },
          {
            "@category": "standard",
            "@height": "154",
            "@width": "383",
            "@_fa": "true",
            "$": "https://api.elsevier.com/content/object/eid/1-s2.0-S0021951724000782-gr1.jpg?httpAccept=%2A%2F%2A",
            "@multimediatype": "JPEG image file",
            "@type": "IMAGE-DOWNSAMPLED",
            "@size": "17228",
            "@ref": "gr1",
            "@mimetype": "image/jpeg"
          },
          {
            "@category": "standard",
            "@height": "389",
            "@width": "535",
            "@_fa": "true",
            "$": "https://api.elsevier.com/content/object/eid/1-s2.0-S0021951724000782-gr7.jpg?httpAccept=%2A%2F%2A",
            "@multimediatype": "JPEG image file",
            "@type": "IMAGE-DOWNSAMPLED",
            "@size": "34053",
            "@ref": "gr7",
            "@mimetype": "image/jpeg"
          },
          {
            "@category": "standard",
            "@height": "337",
            "@width": "383",
            "@_fa": "true",
            "$": "https://api.elsevier.com/content/object/eid/1-s2.0-S0021951724000782-gr6.jpg?httpAccept=%2A%2F%2A",
            "@multimediatype": "JPEG image file",
            "@type": "IMAGE-DOWNSAMPLED",
            "@size": "43054",
            "@ref": "gr6",
            "@mimetype": "image/jpeg"
          },
          {
            "@category": "thumbnail",
            "@height": "164",
            "@width": "209",
            "@_fa": "true",
            "$": "https://api.elsevier.com/content/object/eid/1-s2.0-S0021951724000782-gr5.sml?httpAccept=%2A%2F%2A",
            "@multimediatype": "GIF image file",
            "@type": "IMAGE-THUMBNAIL",
            "@size": "7182",
            "@ref": "gr5",
            "@mimetype": "image/gif"
          },
          {
            "@category": "thumbnail",
            "@height": "83",
            "@width": "219",
            "@_fa": "true",
            "$": "https://api.elsevier.com/content/object/eid/1-s2.0-S0021951724000782-gr4.sml?httpAccept=%2A%2F%2A",
            "@multimediatype": "GIF image file",
            "@type": "IMAGE-THUMBNAIL",
            "@size": "4811",
            "@ref": "gr4",
            "@mimetype": "image/gif"
          },
          {
            "@category": "thumbnail",
            "@height": "74",
            "@width": "219",
            "@_fa": "true",
            "$": "https://api.elsevier.com/content/object/eid/1-s2.0-S0021951724000782-gr3.sml?httpAccept=%2A%2F%2A",
            "@multimediatype": "GIF image file",
            "@type": "IMAGE-THUMBNAIL",
            "@size": "4708",
            "@ref": "gr3",
            "@mimetype": "image/gif"
          },
          {
            "@category": "thumbnail",
            "@height": "155",
            "@width": "219",
            "@_fa": "true",
            "$": "https://api.elsevier.com/content/object/eid/1-s2.0-S0021951724000782-gr2.sml?httpAccept=%2A%2F%2A",
            "@multimediatype": "GIF image file",
            "@type": "IMAGE-THUMBNAIL",
            "@size": "5675",
            "@ref": "gr2",
            "@mimetype": "image/gif"
          },
          {
            "@category": "thumbnail",
            "@height": "136",
            "@width": "219",
            "@_fa": "true",
            "$": "https://api.elsevier.com/content/object/eid/1-s2.0-S0021951724000782-ga1.sml?httpAccept=%2A%2F%2A",
            "@multimediatype": "GIF image file",
            "@type": "IMAGE-THUMBNAIL",
            "@size": "9856",
            "@ref": "ga1",
            "@mimetype": "image/gif"
          },
          {
            "@category": "thumbnail",
            "@height": "88",
            "@width": "219",
            "@_fa": "true",
            "$": "https://api.elsevier.com/content/object/eid/1-s2.0-S0021951724000782-gr1.sml?httpAccept=%2A%2F%2A",
            "@multimediatype": "GIF image file",
            "@type": "IMAGE-THUMBNAIL",
            "@size": "5432",
            "@ref": "gr1",
            "@mimetype": "image/gif"
          },
          {
            "@category": "thumbnail",
            "@height": "159",
            "@width": "219",
            "@_fa": "true",
            "$": "https://api.elsevier.com/content/object/eid/1-s2.0-S0021951724000782-gr7.sml?httpAccept=%2A%2F%2A",
            "@multimediatype": "GIF image file",
            "@type": "IMAGE-THUMBNAIL",
            "@size": "6079",
            "@ref": "gr7",
            "@mimetype": "image/gif"
          },
          {
            "@category": "thumbnail",
            "@height": "164",
            "@width": "186",
            "@_fa": "true",
            "$": "https://api.elsevier.com/content/object/eid/1-s2.0-S0021951724000782-gr6.sml?httpAccept=%2A%2F%2A",
            "@multimediatype": "GIF image file",
            "@type": "IMAGE-THUMBNAIL",
            "@size": "10711",
            "@ref": "gr6",
            "@mimetype": "image/gif"
          },
          {
            "@category": "high",
            "@height": "1854",
            "@width": "2368",
            "@_fa": "true",
            "$": "https://api.elsevier.com/content/object/eid/1-s2.0-S0021951724000782-gr5_lrg.jpg?httpAccept=%2A%2F%2A",
            "@multimediatype": "JPEG image file",
            "@type": "IMAGE-HIGH-RES",
            "@size": "221761",
            "@ref": "gr5",
            "@mimetype": "image/jpeg"
          },
          {
            "@category": "high",
            "@height": "1121",
            "@width": "2945",
            "@_fa": "true",
            "$": "https://api.elsevier.com/content/object/eid/1-s2.0-S0021951724000782-gr4_lrg.jpg?httpAccept=%2A%2F%2A",
            "@multimediatype": "JPEG image file",
            "@type": "IMAGE-HIGH-RES",
            "@size": "152466",
            "@ref": "gr4",
            "@mimetype": "image/jpeg"
          },
          {
            "@category": "high",
            "@height": "981",
            "@width": "2884",
            "@_fa": "true",
            "$": "https://api.elsevier.com/content/object/eid/1-s2.0-S0021951724000782-gr3_lrg.jpg?httpAccept=%2A%2F%2A",
            "@multimediatype": "JPEG image file",
            "@type": "IMAGE-HIGH-RES",
            "@size": "221575",
            "@ref": "gr3",
            "@mimetype": "image/jpeg"
          },
          {
            "@category": "high",
            "@height": "1679",
            "@width": "2368",
            "@_fa": "true",
            "$": "https://api.elsevier.com/content/object/eid/1-s2.0-S0021951724000782-gr2_lrg.jpg?httpAccept=%2A%2F%2A",
            "@multimediatype": "JPEG image file",
            "@type": "IMAGE-HIGH-RES",
            "@size": "182139",
            "@ref": "gr2",
            "@mimetype": "image/jpeg"
          },
          {
            "@category": "high",
            "@height": "886",
            "@width": "1431",
            "@_fa": "true",
            "$": "https://api.elsevier.com/content/object/eid/1-s2.0-S0021951724000782-ga1_lrg.jpg?httpAccept=%2A%2F%2A",
            "@multimediatype": "JPEG image file",
            "@type": "IMAGE-HIGH-RES",
            "@size": "124591",
            "@ref": "ga1",
            "@mimetype": "image/jpeg"
          },
          {
            "@category": "high",
            "@height": "683",
            "@width": "1699",
            "@_fa": "true",
            "$": "https://api.elsevier.com/content/object/eid/1-s2.0-S0021951724000782-gr1_lrg.jpg?httpAccept=%2A%2F%2A",
            "@multimediatype": "JPEG image file",
            "@type": "IMAGE-HIGH-RES",
            "@size": "114491",
            "@ref": "gr1",
            "@mimetype": "image/jpeg"
          },
          {
            "@category": "high",
            "@height": "1722",
            "@width": "2368",
            "@_fa": "true",
            "$": "https://api.elsevier.com/content/object/eid/1-s2.0-S0021951724000782-gr7_lrg.jpg?httpAccept=%2A%2F%2A",
            "@multimediatype": "JPEG image file",
            "@type": "IMAGE-HIGH-RES",
            "@size": "207727",
            "@ref": "gr7",
            "@mimetype": "image/jpeg"
          },
          {
            "@category": "high",
            "@height": "1495",
            "@width": "1699",
            "@_fa": "true",
            "$": "https://api.elsevier.com/content/object/eid/1-s2.0-S0021951724000782-gr6_lrg.jpg?httpAccept=%2A%2F%2A",
            "@multimediatype": "JPEG image file",
            "@type": "IMAGE-HIGH-RES",
            "@size": "259928",
            "@ref": "gr6",
            "@mimetype": "image/jpeg"
          },
          {
            "@category": "standard",
            "@_fa": "true",
            "$": "https://api.elsevier.com/content/object/eid/1-s2.0-S0021951724000782-mmc1.docx?httpAccept=%2A%2F%2A",
            "@multimediatype": "Microsoft Word file",
            "@type": "APPLICATION",
            "@size": "2256546",
            "@ref": "mmc1",
            "@mimetype": "application/word"
          },
          {
            "@category": "thumbnail",
            "@_fa": "true",
            "$": "https://api.elsevier.com/content/object/eid/1-s2.0-S0021951724000782-si1.svg?httpAccept=%2A%2F%2A",
            "@multimediatype": "Scalable Vector Graphics file",
            "@type": "ALTIMG",
            "@size": "20860",
            "@ref": "si1",
            "@mimetype": "image/svg+xml"
          },
          {
            "@category": "standard",
            "@_fa": "true",
            "$": "https://api.elsevier.com/content/object/eid/1-s2.0-S0021951724000782-am.pdf?httpAccept=%2A%2F%2A",
            "@multimediatype": "Acrobat PDF file",
            "@type": "AAM-PDF",
            "@size": "1974057",
            "@ref": "am",
            "@mimetype": "application/pdf"
          }
        ]
      },
      "link": {
        "@rel": "abstract",
        "@href": "https://api.elsevier.com/content/abstract/scopus_id/85187266935"
      }
    }
  }
}