{
  "metadata": {
    "title": "The microscopic mechanisms and essential factors governing regioselectivity in Rh-catalyzed hydroformylation of allyl acetate via DFT and microkinetic modeling",
    "authors": "; ; ",
    "journal": "Journal of Catalysis",
    "date": "2025-10-31",
    "doi": "10.1016/j.jcat.2025.116307",
    "abstract": "",
    "uri": "https://api.elsevier.com/content/article/pii/S0021951725003720",
    "pii": "S0021951725003720"
  },
  "fulltext": {
    "full-text-retrieval-response": {
      "scopus-eid": "2-s2.0-105009710794",
      "originalText": "serial JL 272561 291210 291744 291809 31 Journal of Catalysis JOURNALCATALYSIS 2025-07-01 2025-07-01 2025-07-04 2025-07-04 2025-08-08T04:43:02 1-s2.0-S0021951725003720 S0021-9517(25)00372-0 S0021951725003720 10.1016/j.jcat.2025.116307 S300 S300.1 FULL-TEXT 1-s2.0-S0021951725X00087 2025-08-08T03:54:43.289086Z 0 0 20251001 20251031 2025 2025-07-01T16:03:51.673001Z absattachment articleinfo articlenumber articletitlenorm authfirstinitialnorm authfirstsurnamenorm cid cids contenttype copyright crossmark dateloaded dateloadedtxt datesearch datesort dateupdated dco docsubtype doctype doi eid ewtransactionid hubeid indexeddate issn issnnorm itemstage itemtransactionid itemweight openaccess openarchive pg pgfirst pii piinorm pubdateend pubdatestart pubdatetxt pubyr sectiontitle sortorder srctitle srctitlenorm srctype ssids alllist content subj subheadings suppl tomb volfirst volissue volumelist webpdf webpdfpagecount yearnav figure table e-component body mmlmath affil appendices articletitle auth authfirstini authfull authkeywords authlast highlightsabst orcid primabst pubtype ref specialabst 0021-9517 00219517 true 450 450 C Volume 450 59 116307 116307 116307 202510 October 2025 2025-10-01 2025-10-31 2025 Regular Articles article fla © 2025 Elsevier Inc. All rights are reserved, including those for text and data mining, AI training, and similar technologies. MICROSCOPICMECHANISMSESSENTIALFACTORSGOVERNINGREGIOSELECTIVITYINRHCATALYZEDHYDROFORMYLATIONALLYLACETATEVIADFTMICROKINETICMODELING ZHANG M 1 Introduction 2 Methods 2.1 Theoretical calculation 2.1.1 DFT calculation 2.1.2 MKM simulation 2.2 Experimental methods 3 Results and discussion 3.1 Reaction mechanism of target aldehyde 3.1.1 CO dissociation and olefin coordination 3.1.2 Olefin insertion 3.1.3 CO coordination and insertion 3.1.4 H2 oxidation addition and aldehyde reduction elimination 3.2 Reaction mechanism of hydrogenation and hydrogenolysis 3.3 MKM simulation 4 Conclusion CRediT authorship contribution statement Appendix A Supplementary data References GIGLI 2016 431 460 M YANG 2025 923 935 Y LIU 2024 108455 Y HAAS 2005 83 88 T ZHU 2022 6450 6466 Y KUMAR 2024 530 546 P ICHIKAWA 2002 S MORALESTORRES 2015 34 54 G SHI 2023 113209 G BOROLE 2005 9601 9608 Y FRANKE 2012 5675 5732 R BREIT 2003 B BOTTEGHI 1987 129 182 C PANDA 2009 A CAI 2012 9992 9998 C EVANS 1968 3133 3142 D AMSLER 2020 5087 5096 J CARBO 2001 7630 7637 J SPARTA 2007 8487 8499 M LEE 2021 9506 9518 S LIU 2022 2630 2658 B GUO 2020 13551 13559 J ZHANG 2024 597 602 X LIU 2021 1787 1796 B LIU 2022 136101 B CLARK 2005 5040 5042 T NELSEN 2015 E WANG 2024 16014 16024 G LUO 2005 108 123 X MEI 2024 M CLAUS 1991 1 18 P KITAMURA 2002 6649 6667 M NEESE 2020 224108 F NEESE 2012 73 78 F NEESE 2018 e1327 F NEESE 2022 e1606 F ZHAO 2008 157 167 Y ZHAO 2006 364 382 Y ZHAO 2008 215 241 Y WALKER 2013 12590 12600 M KUMAR 2014 4183 4191 M DANGAT 2020 17079 17092 Y SCHMIDT 2014 3593 3604 S HARIHARAN 1973 213 222 P HEHRE 1972 2257 2261 W WEIGEND 2005 3297 3305 F MARENICH 2009 6378 6396 A GRIMME 2011 1456 1465 S GRIMME 2010 154104 S LU 2021 113249 T LU 2021 231 239 T LU 2024 082503 T LU 2012 580 592 T HUMPHREY 1996 33 38 W POATER 2009 1759 1766 A POATER 2008 2679 2681 A POATER 2010 14348 14353 A BESORA 2018 e1372 M MOTAGAMWALA 2020 A SIRADZE 2021 16665 16681 S RUSH 2014 8816 8820 L RAMA 2024 e202400224 R HOOPS 2006 3067 3074 S MATSUBARA 1997 1065 1078 T KOGA 1988 3417 3425 N LAZZARONI 2010 696 706 R MATSUMOTO 1982 195 207 M ZHANGX2025X116307 ZHANGX2025X116307XM 2027-07-04T00:00:00.000Z 2027-07-04T00:00:00.000Z http://creativecommons.org/licenses/by-nc-nd/4.0/ © 2025 Elsevier Inc. All rights are reserved, including those for text and data mining, AI training, and similar technologies. https://doi.org/10.15223/policy-017 https://doi.org/10.15223/policy-037 https://doi.org/10.15223/policy-012 https://doi.org/10.15223/policy-029 https://doi.org/10.15223/policy-004 item S0021-9517(25)00372-0 S0021951725003720 1-s2.0-S0021951725003720 10.1016/j.jcat.2025.116307 272561 2025-08-08T03:54:43.289086Z 2025-10-01 2025-10-31 1-s2.0-S0021951725003720-main.pdf https://s3-eu-west-1.amazonaws.com/prod-ucs-content-store-eu-west/content/pii:S0021951725003720/MAIN/application/pdf/fcfe7586441f3397c258bf6181567d9f/main.pdf main.pdf pdf true 11118465 MAIN 15 1-s2.0-S0021951725003720-main_1.png https://s3-eu-west-1.amazonaws.com/prod-ucs-content-store-eu-west/content/pii:S0021951725003720/PREVIEW/image/png/0a9797a702f974f6f2fc842782243deb/main_1.png main_1.png png 54956 928 656 IMAGE-WEB-PDF 1 1-s2.0-S0021951725003720-sc1.jpg https://s3-eu-west-1.amazonaws.com/prod-ucs-content-store-eu-west/content/pii:S0021951725003720/sc1/DOWNSAMPLED/image/jpeg/6d1913bd37f8ae49e0c169cba8ebb73c/sc1.jpg sc1 sc1.jpg jpg 26826 356 625 IMAGE-DOWNSAMPLED 1-s2.0-S0021951725003720-gr3.jpg https://s3-eu-west-1.amazonaws.com/prod-ucs-content-store-eu-west/content/pii:S0021951725003720/gr3/DOWNSAMPLED/image/jpeg/c01d07aac8444a93f71461e1ff145dbb/gr3.jpg gr3 gr3.jpg jpg 72223 420 714 IMAGE-DOWNSAMPLED 1-s2.0-S0021951725003720-sc2.jpg https://s3-eu-west-1.amazonaws.com/prod-ucs-content-store-eu-west/content/pii:S0021951725003720/sc2/DOWNSAMPLED/image/jpeg/ab7b725efcbaeb20cfb82d4d1e6a75ed/sc2.jpg sc2 sc2.jpg jpg 59268 451 715 IMAGE-DOWNSAMPLED 1-s2.0-S0021951725003720-gr2.jpg https://s3-eu-west-1.amazonaws.com/prod-ucs-content-store-eu-west/content/pii:S0021951725003720/gr2/DOWNSAMPLED/image/jpeg/ea80c5d1254e9b7813cc4ceba64fc7e3/gr2.jpg gr2 gr2.jpg jpg 46706 293 802 IMAGE-DOWNSAMPLED 1-s2.0-S0021951725003720-gr1.jpg https://s3-eu-west-1.amazonaws.com/prod-ucs-content-store-eu-west/content/pii:S0021951725003720/gr1/DOWNSAMPLED/image/jpeg/fc933245f75eaa98d5a8686de6f691f1/gr1.jpg gr1 gr1.jpg jpg 105033 646 701 IMAGE-DOWNSAMPLED 1-s2.0-S0021951725003720-gr7.jpg https://s3-eu-west-1.amazonaws.com/prod-ucs-content-store-eu-west/content/pii:S0021951725003720/gr7/DOWNSAMPLED/image/jpeg/baabf7441e5874dbca30cf19e1514b0b/gr7.jpg gr7 gr7.jpg jpg 35972 335 383 IMAGE-DOWNSAMPLED 1-s2.0-S0021951725003720-gr6.jpg https://s3-eu-west-1.amazonaws.com/prod-ucs-content-store-eu-west/content/pii:S0021951725003720/gr6/DOWNSAMPLED/image/jpeg/10655d402c912f6e7c459ad4792c8de1/gr6.jpg gr6 gr6.jpg jpg 64891 282 625 IMAGE-DOWNSAMPLED 1-s2.0-S0021951725003720-gr5.jpg https://s3-eu-west-1.amazonaws.com/prod-ucs-content-store-eu-west/content/pii:S0021951725003720/gr5/DOWNSAMPLED/image/jpeg/0240510908d48cbfeaac01c447ea065f/gr5.jpg gr5 gr5.jpg jpg 34543 318 535 IMAGE-DOWNSAMPLED 1-s2.0-S0021951725003720-gr4.jpg https://s3-eu-west-1.amazonaws.com/prod-ucs-content-store-eu-west/content/pii:S0021951725003720/gr4/DOWNSAMPLED/image/jpeg/119bad907ae4bdc0aabc9f320c143fe9/gr4.jpg gr4 gr4.jpg jpg 22837 167 383 IMAGE-DOWNSAMPLED 1-s2.0-S0021951725003720-gr9.jpg https://s3-eu-west-1.amazonaws.com/prod-ucs-content-store-eu-west/content/pii:S0021951725003720/gr9/DOWNSAMPLED/image/jpeg/242c43dd082a96ca9e6041e77c3b1d4c/gr9.jpg gr9 gr9.jpg jpg 105418 458 803 IMAGE-DOWNSAMPLED 1-s2.0-S0021951725003720-gr8.jpg https://s3-eu-west-1.amazonaws.com/prod-ucs-content-store-eu-west/content/pii:S0021951725003720/gr8/DOWNSAMPLED/image/jpeg/987be4713d0d0e343e8390bcdd164d10/gr8.jpg gr8 gr8.jpg jpg 54834 291 625 IMAGE-DOWNSAMPLED 1-s2.0-S0021951725003720-ga1.jpg https://s3-eu-west-1.amazonaws.com/prod-ucs-content-store-eu-west/content/pii:S0021951725003720/ga1/DOWNSAMPLED/image/jpeg/4a23ad5aa2027a42a8cff1ba4a4941b8/ga1.jpg ga1 true ga1.jpg jpg 20404 200 355 IMAGE-DOWNSAMPLED 1-s2.0-S0021951725003720-gr13.jpg https://s3-eu-west-1.amazonaws.com/prod-ucs-content-store-eu-west/content/pii:S0021951725003720/gr13/DOWNSAMPLED/image/jpeg/b41a62933485b97df9bae4da70dcc9db/gr13.jpg gr13 gr13.jpg jpg 62014 309 803 IMAGE-DOWNSAMPLED 1-s2.0-S0021951725003720-gr11.jpg https://s3-eu-west-1.amazonaws.com/prod-ucs-content-store-eu-west/content/pii:S0021951725003720/gr11/DOWNSAMPLED/image/jpeg/a1ce81925ebff8171cfe777a08363064/gr11.jpg gr11 gr11.jpg jpg 58506 451 746 IMAGE-DOWNSAMPLED 1-s2.0-S0021951725003720-gr12.jpg https://s3-eu-west-1.amazonaws.com/prod-ucs-content-store-eu-west/content/pii:S0021951725003720/gr12/DOWNSAMPLED/image/jpeg/4592b5910c5169bdf0d2901c1656c3df/gr12.jpg gr12 gr12.jpg jpg 45736 632 533 IMAGE-DOWNSAMPLED 1-s2.0-S0021951725003720-gr10.jpg https://s3-eu-west-1.amazonaws.com/prod-ucs-content-store-eu-west/content/pii:S0021951725003720/gr10/DOWNSAMPLED/image/jpeg/cd48eea4bcdb3e6bca1809fa75ccb897/gr10.jpg gr10 gr10.jpg jpg 72384 693 535 IMAGE-DOWNSAMPLED 1-s2.0-S0021951725003720-sc1.sml https://s3-eu-west-1.amazonaws.com/prod-ucs-content-store-eu-west/content/pii:S0021951725003720/sc1/THUMBNAIL/image/gif/05dcfdd8f49af1aa51b5b79c7f1df206/sc1.sml sc1 sc1.sml sml 3407 125 219 IMAGE-THUMBNAIL 1-s2.0-S0021951725003720-gr3.sml https://s3-eu-west-1.amazonaws.com/prod-ucs-content-store-eu-west/content/pii:S0021951725003720/gr3/THUMBNAIL/image/gif/411354f0c2652aa8f8779cdf8c1bb3f9/gr3.sml gr3 gr3.sml sml 9294 129 219 IMAGE-THUMBNAIL 1-s2.0-S0021951725003720-sc2.sml https://s3-eu-west-1.amazonaws.com/prod-ucs-content-store-eu-west/content/pii:S0021951725003720/sc2/THUMBNAIL/image/gif/1b5ec5f28826948b0cbd7d7e69ba6c47/sc2.sml sc2 sc2.sml sml 7168 138 219 IMAGE-THUMBNAIL 1-s2.0-S0021951725003720-gr2.sml https://s3-eu-west-1.amazonaws.com/prod-ucs-content-store-eu-west/content/pii:S0021951725003720/gr2/THUMBNAIL/image/gif/d853a82e8c4aff4810d29ff7107da954/gr2.sml gr2 gr2.sml sml 5287 80 219 IMAGE-THUMBNAIL 1-s2.0-S0021951725003720-gr1.sml https://s3-eu-west-1.amazonaws.com/prod-ucs-content-store-eu-west/content/pii:S0021951725003720/gr1/THUMBNAIL/image/gif/563262d7490ee5375c16a254366bc088/gr1.sml gr1 gr1.sml sml 13211 164 178 IMAGE-THUMBNAIL 1-s2.0-S0021951725003720-gr7.sml https://s3-eu-west-1.amazonaws.com/prod-ucs-content-store-eu-west/content/pii:S0021951725003720/gr7/THUMBNAIL/image/gif/42e8d66b8ca443717d42431cab64c555/gr7.sml gr7 gr7.sml sml 11992 164 188 IMAGE-THUMBNAIL 1-s2.0-S0021951725003720-gr6.sml https://s3-eu-west-1.amazonaws.com/prod-ucs-content-store-eu-west/content/pii:S0021951725003720/gr6/THUMBNAIL/image/gif/43685a67d420c991e153ce4dbdaa76d2/gr6.sml gr6 gr6.sml sml 13107 99 219 IMAGE-THUMBNAIL 1-s2.0-S0021951725003720-gr5.sml https://s3-eu-west-1.amazonaws.com/prod-ucs-content-store-eu-west/content/pii:S0021951725003720/gr5/THUMBNAIL/image/gif/33f4c96853f895c9f52d48b62b06b759/gr5.sml gr5 gr5.sml sml 7760 130 219 IMAGE-THUMBNAIL 1-s2.0-S0021951725003720-gr4.sml https://s3-eu-west-1.amazonaws.com/prod-ucs-content-store-eu-west/content/pii:S0021951725003720/gr4/THUMBNAIL/image/gif/70cf0819007a83ec4bf7518cc38ec71a/gr4.sml gr4 gr4.sml sml 12390 96 219 IMAGE-THUMBNAIL 1-s2.0-S0021951725003720-gr9.sml https://s3-eu-west-1.amazonaws.com/prod-ucs-content-store-eu-west/content/pii:S0021951725003720/gr9/THUMBNAIL/image/gif/fbbfd58000ba12ecaab6e79183544aba/gr9.sml gr9 gr9.sml sml 15522 125 219 IMAGE-THUMBNAIL 1-s2.0-S0021951725003720-gr8.sml https://s3-eu-west-1.amazonaws.com/prod-ucs-content-store-eu-west/content/pii:S0021951725003720/gr8/THUMBNAIL/image/gif/5e66a35177e4fcd0d84a8152a5a044ad/gr8.sml gr8 gr8.sml sml 8423 102 219 IMAGE-THUMBNAIL 1-s2.0-S0021951725003720-ga1.sml https://s3-eu-west-1.amazonaws.com/prod-ucs-content-store-eu-west/content/pii:S0021951725003720/ga1/THUMBNAIL/image/gif/b0eca3cb15bcdb146e26ccd03b29b8bc/ga1.sml ga1 true ga1.sml sml 18999 123 219 IMAGE-THUMBNAIL 1-s2.0-S0021951725003720-gr13.sml https://s3-eu-west-1.amazonaws.com/prod-ucs-content-store-eu-west/content/pii:S0021951725003720/gr13/THUMBNAIL/image/gif/7170e11e6a77117a042130ce8b73bf26/gr13.sml gr13 gr13.sml sml 9118 84 219 IMAGE-THUMBNAIL 1-s2.0-S0021951725003720-gr11.sml https://s3-eu-west-1.amazonaws.com/prod-ucs-content-store-eu-west/content/pii:S0021951725003720/gr11/THUMBNAIL/image/gif/190ebf2bcca53e965ca8f40ec3449e0a/gr11.sml gr11 gr11.sml sml 7781 132 219 IMAGE-THUMBNAIL 1-s2.0-S0021951725003720-gr12.sml https://s3-eu-west-1.amazonaws.com/prod-ucs-content-store-eu-west/content/pii:S0021951725003720/gr12/THUMBNAIL/image/gif/470da3eac1ede69c90d3f1b8e8d38247/gr12.sml gr12 gr12.sml sml 7700 164 138 IMAGE-THUMBNAIL 1-s2.0-S0021951725003720-gr10.sml https://s3-eu-west-1.amazonaws.com/prod-ucs-content-store-eu-west/content/pii:S0021951725003689/gr10/THUMBNAIL/image/gif/31684df84e218cfe8e28d73f88d50434/gr10.sml gr10 gr10.sml sml 6337 163 126 IMAGE-THUMBNAIL 1-s2.0-S0021951725003720-sc1_lrg.jpg https://s3-eu-west-1.amazonaws.com/prod-ucs-content-store-eu-west/content/pii:S0021951725003720/HIGHRES/image/jpeg/5e3333a1c1e867b87b2053550bf12394/sc1_lrg.jpg sc1 sc1_lrg.jpg jpg 108954 1350 2368 IMAGE-HIGH-RES 1-s2.0-S0021951725003720-gr3_lrg.jpg https://s3-eu-west-1.amazonaws.com/prod-ucs-content-store-eu-west/content/pii:S0021951725003720/HIGHRES/image/jpeg/387eabaf495144996cf8b8eb01d7a9b3/gr3_lrg.jpg gr3 gr3_lrg.jpg jpg 310301 1612 2738 IMAGE-HIGH-RES 1-s2.0-S0021951725003720-sc2_lrg.jpg https://s3-eu-west-1.amazonaws.com/prod-ucs-content-store-eu-west/content/pii:S0021951725003720/HIGHRES/image/jpeg/d414f0b6bf55bff529153813a12d1c2e/sc2_lrg.jpg sc2 sc2_lrg.jpg jpg 213532 1493 2367 IMAGE-HIGH-RES 1-s2.0-S0021951725003720-gr2_lrg.jpg https://s3-eu-west-1.amazonaws.com/prod-ucs-content-store-eu-west/content/pii:S0021951725003720/HIGHRES/image/jpeg/61ffc496cb97edd00d24d9aa7db5335c/gr2_lrg.jpg gr2 gr2_lrg.jpg jpg 212763 1164 3181 IMAGE-HIGH-RES 1-s2.0-S0021951725003720-gr1_lrg.jpg https://s3-eu-west-1.amazonaws.com/prod-ucs-content-store-eu-west/content/pii:S0021951725003720/HIGHRES/image/jpeg/254bd2ac7806c8c9d730b946409c9eb0/gr1_lrg.jpg gr1 gr1_lrg.jpg jpg 504563 2862 3106 IMAGE-HIGH-RES 1-s2.0-S0021951725003720-gr7_lrg.jpg https://s3-eu-west-1.amazonaws.com/prod-ucs-content-store-eu-west/content/pii:S0021951725003720/HIGHRES/image/jpeg/4a688a44812e957d450ccf68386d0922/gr7_lrg.jpg gr7 gr7_lrg.jpg jpg 184499 1484 1699 IMAGE-HIGH-RES 1-s2.0-S0021951725003720-gr6_lrg.jpg https://s3-eu-west-1.amazonaws.com/prod-ucs-content-store-eu-west/content/pii:S0021951725003720/HIGHRES/image/jpeg/13020efa2754eced45964fc4db8d1c20/gr6_lrg.jpg gr6 gr6_lrg.jpg jpg 306509 1070 2368 IMAGE-HIGH-RES 1-s2.0-S0021951725003720-gr5_lrg.jpg https://s3-eu-west-1.amazonaws.com/prod-ucs-content-store-eu-west/content/pii:S0021951725003720/HIGHRES/image/jpeg/6212e867628288c002f3d2a71b85fde0/gr5_lrg.jpg gr5 gr5_lrg.jpg jpg 168627 1409 2368 IMAGE-HIGH-RES 1-s2.0-S0021951725003720-gr4_lrg.jpg https://s3-eu-west-1.amazonaws.com/prod-ucs-content-store-eu-west/content/pii:S0021951725003720/HIGHRES/image/jpeg/41463497cb4ba085ea8edc16bf2d4961/gr4_lrg.jpg gr4 gr4_lrg.jpg jpg 93658 618 1415 IMAGE-HIGH-RES 1-s2.0-S0021951725003720-gr9_lrg.jpg https://s3-eu-west-1.amazonaws.com/prod-ucs-content-store-eu-west/content/pii:S0021951725003720/HIGHRES/image/jpeg/542658be6a84ad0b415bbc3379342d83/gr9_lrg.jpg gr9 gr9_lrg.jpg jpg 470310 1730 3035 IMAGE-HIGH-RES 1-s2.0-S0021951725003720-gr8_lrg.jpg https://s3-eu-west-1.amazonaws.com/prod-ucs-content-store-eu-west/content/pii:S0021951725003720/HIGHRES/image/jpeg/e93de5a5be6b58f91fee4b0b6c85841b/gr8_lrg.jpg gr8 gr8_lrg.jpg jpg 223971 1099 2362 IMAGE-HIGH-RES 1-s2.0-S0021951725003720-ga1_lrg.jpg https://s3-eu-west-1.amazonaws.com/prod-ucs-content-store-eu-west/content/pii:S0021951725003720/HIGHRES/image/jpeg/8ec069f27bb346b82ed541d5c09f045a/ga1_lrg.jpg ga1 true ga1_lrg.jpg jpg 125334 886 1572 IMAGE-HIGH-RES 1-s2.0-S0021951725003720-gr13_lrg.jpg https://s3-eu-west-1.amazonaws.com/prod-ucs-content-store-eu-west/content/pii:S0021951725003689/HIGHRES/image/jpeg/23d68d1eb12664ae813c99c037113ee2/gr13_lrg.jpg gr13 gr13_lrg.jpg jpg 293378 1274 3314 IMAGE-HIGH-RES 1-s2.0-S0021951725003720-gr11_lrg.jpg https://s3-eu-west-1.amazonaws.com/prod-ucs-content-store-eu-west/content/pii:S0021951725003689/HIGHRES/image/jpeg/30a7a77285ccad0e36c1b03c831aff76/gr11_lrg.jpg gr11 gr11_lrg.jpg jpg 267474 1996 3305 IMAGE-HIGH-RES 1-s2.0-S0021951725003720-gr12_lrg.jpg https://s3-eu-west-1.amazonaws.com/prod-ucs-content-store-eu-west/content/pii:S0021951725003689/HIGHRES/image/jpeg/190b2cf1956806bb1b9ebe9c97906cb9/gr12_lrg.jpg gr12 gr12_lrg.jpg jpg 120452 1680 1417 IMAGE-HIGH-RES 1-s2.0-S0021951725003720-gr10_lrg.jpg https://s3-eu-west-1.amazonaws.com/prod-ucs-content-store-eu-west/content/pii:S0021951725003689/HIGHRES/image/jpeg/5c5e8802f972579cbf8a29a8e3428c9a/gr10_lrg.jpg gr10 gr10_lrg.jpg jpg 345919 3068 2368 IMAGE-HIGH-RES 1-s2.0-S0021951725003720-mmc1.docx https://s3-eu-west-1.amazonaws.com/prod-ucs-content-store-eu-west/content/pii:S0021951725003720/mmc1/MAIN/application/vnd.openxmlformats-officedocument.wordprocessingml.document/da6685c20e3b9eb032bfc0bceebdf4ef/mmc1.docx mmc1 mmc1.docx docx 3824586 APPLICATION 1-s2.0-S0021951725003720-si1.svg https://s3-eu-west-1.amazonaws.com/prod-ucs-content-store-eu-west/content/pii:S0021951725003720/image/svg+xml/ab1bef3da3bc8934f709f69a11e15800/si1.svg si1 si1.svg svg 3212 ALTIMG 1-s2.0-S0021951725003720-si10.svg https://s3-eu-west-1.amazonaws.com/prod-ucs-content-store-eu-west/content/pii:S0021951725003720/image/svg+xml/fdbef4ce4c036bfa7edc11cdd06428e4/si10.svg si10 si10.svg svg 1813 ALTIMG 1-s2.0-S0021951725003720-si11.svg https://s3-eu-west-1.amazonaws.com/prod-ucs-content-store-eu-west/content/pii:S0021951725003720/image/svg+xml/7077212279c443f05b90498e1f5f2248/si11.svg si11 si11.svg svg 5220 ALTIMG 1-s2.0-S0021951725003720-si12.svg https://s3-eu-west-1.amazonaws.com/prod-ucs-content-store-eu-west/content/pii:S0021951725003720/image/svg+xml/c9e7bf67d2f354db01cdef3c65477eea/si12.svg si12 si12.svg svg 18943 ALTIMG 1-s2.0-S0021951725003720-si13.svg https://s3-eu-west-1.amazonaws.com/prod-ucs-content-store-eu-west/content/pii:S0021951725003720/image/svg+xml/df7a020ad084346d3f40918f3ba53926/si13.svg si13 si13.svg svg 947 ALTIMG 1-s2.0-S0021951725003720-si14.svg https://s3-eu-west-1.amazonaws.com/prod-ucs-content-store-eu-west/content/pii:S0021951725003720/image/svg+xml/96d671aac3fd7562e4a4dff9590f3de8/si14.svg si14 si14.svg svg 3064 ALTIMG 1-s2.0-S0021951725003720-si15.svg https://s3-eu-west-1.amazonaws.com/prod-ucs-content-store-eu-west/content/pii:S0021951725003720/image/svg+xml/2dd972f8f815559809153d6cbc3d2883/si15.svg si15 si15.svg svg 2697 ALTIMG 1-s2.0-S0021951725003720-si16.svg https://s3-eu-west-1.amazonaws.com/prod-ucs-content-store-eu-west/content/pii:S0021951725003720/image/svg+xml/6e3d1cb968d9ddf99b8c8bd6a2bd1b9b/si16.svg si16 si16.svg svg 9475 ALTIMG 1-s2.0-S0021951725003720-si17.svg https://s3-eu-west-1.amazonaws.com/prod-ucs-content-store-eu-west/content/pii:S0021951725003720/image/svg+xml/0cda2fff03b5f33e3d2a1d5c7289f3f8/si17.svg si17 si17.svg svg 3058 ALTIMG 1-s2.0-S0021951725003720-si18.svg https://s3-eu-west-1.amazonaws.com/prod-ucs-content-store-eu-west/content/pii:S0021951725003720/image/svg+xml/473e3152fb24958a964efbbb1104e69d/si18.svg si18 si18.svg svg 14901 ALTIMG 1-s2.0-S0021951725003720-si19.svg https://s3-eu-west-1.amazonaws.com/prod-ucs-content-store-eu-west/content/pii:S0021951725003720/image/svg+xml/cf7b6fe9c86b3fd8e96a3bb2e4db2ac0/si19.svg si19 si19.svg svg 19890 ALTIMG 1-s2.0-S0021951725003720-si2.svg https://s3-eu-west-1.amazonaws.com/prod-ucs-content-store-eu-west/content/pii:S0021951725003720/image/svg+xml/9dd3d3ded283ac129a7a1ae3ed542cc4/si2.svg si2 si2.svg svg 2383 ALTIMG 1-s2.0-S0021951725003720-si20.svg https://s3-eu-west-1.amazonaws.com/prod-ucs-content-store-eu-west/content/pii:S0021951725003720/image/svg+xml/73dac89be2749cdc0633241e01a14800/si20.svg si20 si20.svg svg 7207 ALTIMG 1-s2.0-S0021951725003720-si21.svg https://s3-eu-west-1.amazonaws.com/prod-ucs-content-store-eu-west/content/pii:S0021951725003720/image/svg+xml/db688ee81d9c5d00421d5f99893f3ff8/si21.svg si21 si21.svg svg 4887 ALTIMG 1-s2.0-S0021951725003720-si22.svg https://s3-eu-west-1.amazonaws.com/prod-ucs-content-store-eu-west/content/pii:S0021951725003720/image/svg+xml/21178d19b9d23b48b0b42d4507f916d7/si22.svg si22 si22.svg svg 5599 ALTIMG 1-s2.0-S0021951725003720-si23.svg https://s3-eu-west-1.amazonaws.com/prod-ucs-content-store-eu-west/content/pii:S0021951725003720/image/svg+xml/0535b703d5f062bfc0f1ea43925d2cb9/si23.svg si23 si23.svg svg 9304 ALTIMG 1-s2.0-S0021951725003720-si24.svg https://s3-eu-west-1.amazonaws.com/prod-ucs-content-store-eu-west/content/pii:S0021951725003720/image/svg+xml/02311cc760274f5d5d4914b0e5642b02/si24.svg si24 si24.svg svg 2699 ALTIMG 1-s2.0-S0021951725003720-si25.svg https://s3-eu-west-1.amazonaws.com/prod-ucs-content-store-eu-west/content/pii:S0021951725003720/image/svg+xml/5d84924a724df770946f65ecdbe25293/si25.svg si25 si25.svg svg 2919 ALTIMG 1-s2.0-S0021951725003720-si3.svg https://s3-eu-west-1.amazonaws.com/prod-ucs-content-store-eu-west/content/pii:S0021951725003720/image/svg+xml/0feb80500b12a545fafad849f1238790/si3.svg si3 si3.svg svg 7331 ALTIMG 1-s2.0-S0021951725003720-si4.svg https://s3-eu-west-1.amazonaws.com/prod-ucs-content-store-eu-west/content/pii:S0021951725003720/image/svg+xml/041c4e543e40adbc104bceec698d4fa8/si4.svg si4 si4.svg svg 7329 ALTIMG 1-s2.0-S0021951725003720-si5.svg https://s3-eu-west-1.amazonaws.com/prod-ucs-content-store-eu-west/content/pii:S0021951725003720/image/svg+xml/d03b11747f282e981ee22e1a17218625/si5.svg si5 si5.svg svg 4016 ALTIMG 1-s2.0-S0021951725003720-si6.svg https://s3-eu-west-1.amazonaws.com/prod-ucs-content-store-eu-west/content/pii:S0021951725003720/image/svg+xml/d5de63dcca0322467811b7f8864df46c/si6.svg si6 si6.svg svg 4418 ALTIMG 1-s2.0-S0021951725003720-si7.svg https://s3-eu-west-1.amazonaws.com/prod-ucs-content-store-eu-west/content/pii:S0021951725003720/image/svg+xml/2f0a8d576d703e05309effb04a7e72aa/si7.svg si7 si7.svg svg 3905 ALTIMG 1-s2.0-S0021951725003720-si8.svg https://s3-eu-west-1.amazonaws.com/prod-ucs-content-store-eu-west/content/pii:S0021951725003720/image/svg+xml/1a1ae08fc9b1402f8c4f8f724b1cfc2c/si8.svg si8 si8.svg svg 864 ALTIMG 1-s2.0-S0021951725003720-si9.svg https://s3-eu-west-1.amazonaws.com/prod-ucs-content-store-eu-west/content/pii:S0021951725003720/image/svg+xml/c3f35c1846547aecd96a76e8d214b433/si9.svg si9 si9.svg svg 2958 ALTIMG YJCAT 116307 116307 S0021-9517(25)00372-0 10.1016/j.jcat.2025.116307 Elsevier Inc. Fig. 1 Free energy profiles for the hydroformylation of allyl acetate catalyzed by (a) RhH(CO)2(Xantphos). (b) RhH(CO)2(PPh3)2. Fig. 2 Comparison of the energy profiles of CO dissociation for the ee and ea configurations of (a) RhH(CO)2(Xantphos), (b) RhH(CO)2(PPh3)2. Color code: grey, C; white, H; red, O; purple, Rh; yellow, P. (For interpretation of the references to color in this figure legend, the reader is referred to the web version of this article.) Fig. 3 Seven conformations of RhH(CO)(AA)(Xantphos) with allyl acetate coordination, showing the Gibbs free energy differences at 353.15 K and 20 bar (referenced to Xantphos-ea2). Fig. 4 Isosurface maps of (a) Xantphos-ea1 and (b) Xantphos-ea2 at IRI = 1. Color code: blue, C; white, H; red, O; brown, Rh; green, P. (For interpretation of the references to color in this figure legend, the reader is referred to the web version of this article.) Fig. 5 Insertion process of allyl acetate on X-ea. Fig. 6 Steric maps of (a) X-ea-3* and (b) P-ee-3* (with the direction of the H atom as the positive z-axis, the plane containing the double-bond carbons of the olefin defining the xz-plane, radius 4.5 Å, excluding the metal atom and substrate). The figure labels the free volume fractions in each quadrant and the relative positions of olefin insertion. Fig. 7 Isosurface maps of olefin insertion on X-ea and X-ea1 at IRI = 1. Fig. 8 CO coordination and insertion process of allyl acetate on X-ea. (a) Linear pathway, (b) branched pathway. Energies are calculated as differences relative to X-ea-3l* and X-ea-3b*. Fig. 9 (a) Schematic diagram of spatial distribution (with the C atom of the carbonyl group as the positive z-axis direction, and the xz-plane determined by the two P atoms (in (d), the C atoms of the other two carbonyl groups), with a radius of 4.5 Å). Spatial distribution of steric hindrance for the structures before H2 oxidation addition: (b) RhCO(Xantphos)-AA, (c) RhCO(PPh3)2-AA, (d) Rh(CO)3-AA. The free volume fractions in each quadrant and the relative positions of H2 coordination are labeled. Fig. 10 Energy barriers for side reactions of allyl acetate. (a) Energy barrier diagram for the formation of propyl acetate. (b) Energy barrier diagram for the hydrogenolysis of allyl acetate. Fig. 11 (a) Simulated product distributions for the hydroformylation of allyl acetate catalyzed by (I) RhH(CO)2(Xantphos)-ea, (II) RhH(CO)2(Xantphos)-ea and RhH(CO)2(Xantphos)-ee. (b) Simulated product distributions for the hydroformylation of allyl acetate catalyzed by (III) RhH(CO)2(PPh3)2-ee, (IV) RhH(CO)2(PPh3)2-ee and RhH(CO)2(PPh3)2-ea. Fig. 12 Relationship between pressure and syngas ratio with product selectivity in the hydroformylation of allyl acetate at 353 K. (a) Catalyzed by RhH(CO)2(Xantphos)-ea, (b) catalyzed by RhH(CO)2(PPh3)2-ee. Fig. 13 Relationship between temperature and syngas pressure with the selectivity of (a) 4-acetoxybutyraldehyde catalyzed by X-ea and (b) 2-methyl-3-acetoxypropionaldehyde by P-ee in the hydroformylation of allyl acetate catalyzed at a CO/H2 ratio of 1. Scheme 1 Reactions in the hydroformylation of allyl acetate. Scheme 2 Mechanism for the hydroformylation of allyl acetate to produce 4-acetoxybutyraldehyde, 2-methyl-3-acetoxypropionaldehyde and propyl acetate. Table 1 Hydroformylation of allyl acetate catalyzed by RhH(CO)2(Xantphos) and RhH(CO)2(PPh3)2.. Entry Ligand P/Rh T (K) P (bar) CO/H2 Conv. (%) Selection (%) a l/b b l* b* p* n* i* blank c — — 363 40 1:1 0.40 — — 100 — — — 1 c — — 363 20 1:1 99.72 35.96 30.74 1.01 16.58 15.71 1.17 2 c — — 363 20 1:2 99.64 27.20 12.70 1.90 27.20 30.99 2.14 3 Xantphos 4 333 20 1:1 48.15 67.30 22.71 2.25 6.33 1.41 2.96 4 Xantphos 4 333 40 1:1 66.42 78.30 15.85 3.70 2.13 0.03 4.94 5 Xantphos 4 353 20 1:1 99.95 75.87 8.50 2.97 9.77 2.89 8.93 6 Xantphos 4 353 40 1:1 99.83 83.26 6.48 2.56 7.36 0.35 12.86 7 Xantphos 10 333 20 1:1 63.23 82.01 13.34 2.83 1.80 0.03 6.15 8 Xantphos 10 353 20 1:1 99.45 81.67 10.57 3.18 4.36 0.22 7.73 9 Xantphos 4 353 20 1:2 99.88 65.48 10.73 13.28 7.92 2.59 6.10 10 Xantphos 10 333 20 1:2 89.10 78.78 13.33 6.19 1.64 0.06 5.91 11 Xantphos 10 353 20 1:2 99.79 76.08 12.72 7.20 3.79 0.21 5.98 12 Xantphos 10 363 20 1:2 99.77 73.20 10.27 7.58 8.18 0.78 7.13 13 PPh3 1 363 40 1:1 99.97 35.72 50.37 1.06 8.74 4.12 0.71 14 PPh3 4 333 40 1:1 99.99 34.68 64.48 0.25 0.50 0.08 0.54 15 PPh3 4 353 40 1:1 99.99 36.21 62.03 0.30 1.04 0.42 0.58 16 PPh3 4 363 20 1:1 99.89 37.68 54.66 0.36 5.20 2.11 0.69 17 PPh3 4 353 20 1:1 99.93 37.15 58.39 0.56 2.94 0.96 0.64 18 PPh3 4 333 20 1:2 99.97 41.78 49.70 0.80 1.28 6.44 0.84 19 PPh3 4 353 20 1:2 99.84 38.02 55.58 0.58 4.14 1.68 0.68 a l*, b*, p*, n*, i* represent the selectivity of 4-acetoxybutyraldehyde, 2-methyl-3-acetoxypropionaldehyde, propyl acetate, n-butyraldehyde and isobutyraldehyde, respectively. b l/b represents the linear-to-branched ratio, which is the ratio of 4-acetoxybutyraldehyde to 2-methyl-3-acetoxypropionaldehyde. c Entry blank represents the experiment conducted in the absence of Rh and phosphine ligands. Entry 1 and entry 2 represent the experiments conducted in the presence of Rh but in the absence of phosphine ligands. Table 2 Charge analysis of olefin insertion on X-ea and P-ee. Charge/|e| Rh C(α) C(β) H X-ea-3* −1.275 −0.243 −0.422 0.151 X-ea-TS3l −1.100 −0.237 −0.456 0.178 X-ea-TS3b −1.298 −0.259 −0.456 0.265 X-ea-4 l* −0.658 −0.075 −0.559 0.210 X-ea-4b* −0.562 −0.361 −0.634 0.209 P-ee-3* −1.375 −0.256 −0.399 0.135 P-ee-TS3l −1.287 −0.275 −0.418 0.221 P-ee-TS3b −1.296 −0.266 −0.409 0.217 P-ee-4 l* −0.583 −0.444 −0.605 0.170 P-ee-4b* −0.546 −0.397 −0.633 0.203 Table 3 Energy comparison of various species in the olefin insertion process on X-ea and X-ea1. 3* TS3l TS3b 4 l* 4b* X-ea a 0 11.17 16.66 3.60 −4.61 X-ea1 a 0.88 11.07 17.78 −0.32 −3.81 a The energies are obtained by comparing each species with X-ea-3*, and the unit is kcal/mol. Table 4 Energy barriers for H2 oxidation addition and electron densities of Rh for three catalysts. Rh-xantphos Rh-PPh3 Rh TS6l TS6b TS6l TS6b TS6l TS6b Energy barrier / kcal·mol−1 21.63 29.30 34.17 16.56 21.03 21.63 Electron density of Rh / |e| −0.677 −0.633 −0.748 −0.768 −0.740 −0.766 Table 5 Comparison of reaction barriers for H2 and CO coordination on various catalyst configurations. a H2 coordination CO coordination ER8l ER8b ER4l ER4b xantphos-ea 21.52 19.02 4.57 4.09 xantphos-ee 24.46 36.03 5.55 7.21 PPh3-ee 18.63 18.49 1.98 15.88 PPh3-ea 31.16 23.90 18.10 10.78 Rh 24.28 7.87 23.35 5.13 a All barriers are referenced to the 3* state of respective catalyst, with units in kcal/mol. Research article The microscopic mechanisms and essential factors governing regioselectivity in Rh-catalyzed hydroformylation of allyl acetate via DFT and microkinetic modeling Minhua Zhang Supervision Software Project administration Funding acquisition Conceptualization a b c Yuzhe Sun Writing – original draft Visualization Validation Formal analysis a b c Lingtao Wang Writing – review & editing Supervision Methodology a b c Hao Gong Supervision Software Investigation a b c Yifei Chen Writing – review & editing Validation Supervision a b c ⁎ a Key Laboratory for Green Chemical Technology of Ministry of Education, R&D Center for Petrochemical Technology, Tianjin University, Tianjin 300072, China Key Laboratory for Green Chemical Technology of Ministry of Education R&D Center for Petrochemical Technology Tianjin University Tianjin 300072 China Key Laboratory for Green Chemical Technology of Ministry of Education, R&D Center for Petrochemical Technology, Tianjin University, Tianjin 300072, China b Zhejiang Institute of Tianjin University, Ningbo, Zhejiang 315201, China Zhejiang Institute of Tianjin University Ningbo Zhejiang 315201 China Zhejiang Institute of Tianjin University, Ningbo, Zhejiang 315201, China c State Key Laboratory of Engines, Tianjin University, Tianjin 300072, China State Key Laboratory of Engines Tianjin University Tianjin 300072 China State Key Laboratory of Engines, Tianjin University, Tianjin 300072, China ⁎ Corresponding author at: Key Laboratory for Green Chemical Technology of Ministry of Education, R&D Center for Petrochemical Technology, Tianjin University, Tianjin 300072, China. Key Laboratory for Green Chemical Technology of Ministry of Education R&D Center for Petrochemical Technology Tianjin University Tianjin 300072 China Graphical abstract The direct hydroformylation of allyl acetate followed by hydrogenation represents a novel route for 1,4-butanediol production with significant industrial potential and market prospects. In this study, we employed Density Functional Theory (DFT) and Microkinetic Modeling (MKM) to comparatively investigate two representative Rh-based catalysts with distinct product distributions (RhH(CO)2(Xantphos) and RhH(CO)2(PPh3)2), systematically elucidate the mechanisms for improving the selectivity and regulation principles of this reaction. Theoretical calculations reveal that the regioselectivity is primarily determined by the olefin insertion step. Xantphos ligand reduces the electron density of the Rh center and provides a sterically favorable environment for the linear pathway. Additionally, the acetoxy group in allyl acetate exerts a repulsive interaction with the Rh-carbonyl, directing Rh to preferentially coordinate with the β-C, thereby significantly enhancing the formation of 4-acetoxybutyraldehyde. In contrast, the PPh3-modified Rh catalyst exhibits lower steric hindrance along the branched pathway, thus favoring the formation of branched aldehydes. Experimental investigations demonstrate that hydrogenolysis of allyl acetate predominantly occurs at the uncoordinated Rh sites, and the elevated H2 concentration and higher temperature will promote this side reaction. For Xantphos, MKM simulations indicate that the increased pressure and optimized syngas composition (CO/H2 = 0.5–2) can lead to linear aldehyde selectivity exceeding 98 %. Similarly, in the PPh3 system, high pressure and a near-equimolar syngas ratio favor the formation of branched aldehyde. These findings unveil the intrinsic relationships between ligand design, reaction conditions and selectivity, establishing a structure–activity framework for hydroformylation of acetoxy-functionalized olefins. This work provides critical theoretical guidance for the rational design of efficient catalysts and advances the development of scalable 1,4-BDO production process. Keywords Allyl acetate Hydroformylation Xantphos DFT MKM Data availability Data will be made available on request. 1 Introduction 1,4-Butanediol (1,4-BDO) is an important organic chemical intermediate, which can be used to produce high-value downstream products such as spandex, battery electrolytes, polyurethane materials, and engineering plastics [1–3]. The production of 1,4-BDO from propylene is one of the main industrial processes, offering significant market and economic advantages in regions with abundant propylene resources [4–6]. This process initially produces allyl alcohol via propylene oxide isomerization or hydrolysis of allyl acetate [7,8], followed by further hydroformylation and hydrogenation to produce 1,4-BDO [9,10]. While the process is straightforward and utilizes stable and recyclable catalyst, the intermediate allyl alcohol is highly toxic and unstable, posing difficulties in storage and transportation. Therefore, the direct hydroformylation of allyl acetate instead of allyl alcohol, followed by hydrogenation to synthesize 1,4-BDO has garnered significant attention in the industry [11]. This approach not only retains the advantages of the propylene-based process but also enhances the safety of the production process, representing a new 1,4-BDO production route with great potential for industrialization and market prospects. In the development of the propylene-allyl acetate-1,4-BDO process, the hydroformylation of allyl acetate to synthesize 4-acetoxybutyraldehyde is the most challenging technology, determining the final product yield [12]. Early studies mainly used it as a probe molecule for the hydroformylation of ester-functionalized olefins [13–15]. Recently, research has focused on developing allyl acetate hydroformylation catalysts with high n/i ratios, and significant progress has been made in experiments. Anil et al. [16] reported a polyethylene glycol functionalized with diphenylphosphino groups for a polymeric Rh catalyst, achieving 94 % total aldehyde selectivity and a l/b ratio of 2.6 at 323 K, 40 bar for 4 h. Zhang et al. [17] found that 2,4-difluorophenyl tetraphosphine ligands with strong electron-withdrawing groups could selectively catalyze the production of straight-chain aldehydes from functionalized allyl derivatives, achieving a l/b ratio of 26 at 393 K, 100 bar syngas for 2 h. Liu et al. [11] reported that Xantphos-modified Rh(acac)(CO)2 catalysts could achieve 80 % yield of 4-acetoxybutyraldehyde. While some experiments have confirmed that changing phosphine ligands can alter product distributions, the underlying reasons and theoretical studies on allyl acetate hydroformylation remain unexplored. Wilkinson and colleagues proposed in 1968 that the hydroformylation reaction might follow two pathways: associative and dissociative [18]. Existing theoretical and experimental literature predominantly supports the dissociative mechanism. While extensive theoretical calculations and experimental validations exist for the hydroformylation of terminal olefins such as ethylene [19–22], propylene [20,23–25] and styrene [26,27], theoretical research on the hydroformylation of acetoxy-containing olefins remains in its early stages, with only a few studies on vinyl acetate [28,29]. Ding and co-workers [30] studied the performance of Rh-P-N-POPs heterogeneous catalysts in the hydroformylation of vinyl acetate through experiments and theoretical calculations. They attributed the high selectivity for linear aldehydes to the confinement effect of the ligand, which hinders acetate chelation, and the N atom which provides an electron-deficient coordination environment for the active Rh center. Li et al. [31] investigated the Rh-catalyzed asymmetric hydroformylation of vinyl formate modified by CHIRAPHOS-type ligands and identified the H2 oxidative addition step as the rate-determining step. Despite some similarities between allyl acetate and vinyl acetate, there are significant differences in product selectivity [14]. To clarify the factors affecting the selectivity in allyl acetate hydroformylation, comprehensive theoretical calculations of the reaction pathway are necessary. This will guide the design of targeted ligands to enhance the selectivity for 4-acetoxybutyraldehyde. Additionally, unlike α-olefins, allyl acetate may undergo hydrogenolysis at high temperatures, affecting aldehyde selectivity [32–34]. However, the active site for hydrogenolysis and its competition with hydroformylation are still unclear, requiring further investigation through theoretical calculations. Based on current research, Rh-catalyzed hydroformylation of allyl acetate with Xantphos modification can achieve a high l/b ratio of product selectivity [11,32], which has been also confirmed by our experiments. Moreover, we found that the l/b ratio for hydroformylation catalyzed by PPh3 ligand ranges from 0.5 to 0.9. Therefore, this study focuses on the detailed theoretical calculations of two typical Rh catalysts (RhH(CO)2(Xantphos) and RhH(CO)2(PPh3)2) in the hydroformylation of allyl acetate. We explain the factors influencing the aldehyde selectivity in allyl acetate hydroformylation in terms of electronic effects and steric hindrance, and explore the structure–activity relationship of ligands for the hydroformylation of acetoxy-containing olefins. Combining experiments and microkinetic simulations, we analyze the key steps in allyl acetate hydroformylation. Additionally, comparative experiments reveal that the active site for hydrogenolysis is primarily Rh site without phosphine ligand coordination, and theoretical calculations indicate that allyl acetate is the main species undergoing hydrogenolysis. The purpose of this study is to give a comprehensive understanding of hydroformylation of propenyl derivatives and acetoxy-functionalized olefins, with a particular focus on elucidating how to regulating the selectivity of allyl acetate hydroformylation. 2 Methods 2.1 Theoretical calculation 2.1.1 DFT calculation All Density Functional Theory (DFT) calculations in this study were performed using ORCA [35–38]. In the theoretical calculations for hydroformylation, the M06-2X functional [39–41] has proven to be adept at accurately capturing experimental regioselectivity. Moreover, it offers an authentic description of medium-range, nonlocal dispersion effects [42–45]. Geometry optimization and transition state search were using the M06-2X functional with a mixed basis set, where non-metal elements (C, H, O, P) were described with the 6-31G* basis set [46,47]and Rh was described with the SDD basis set. Frequency analysis was calculated at the same theoretical level to confirm that the optimized structures correspond to stable conformations, as well as to ensure that the transition state has only one imaginary frequency associated with the reaction bond formation or cleavage. Single-point energy was calculated at the M06-2X/def2-TZVP level [48] on the optimized geometry. All calculations were conducted using the SMD model [49] to simulate the liquid phase environment, considering the solvation effect of toluene. Dispersion corrections were applied using Grimme's DFT-D3 method [50,51]. When calculating Gibbs free energy, corrections for enthalpy and entropy were considered based on the partition functions obtained from frequency analysis under actual reaction condition, which were computed using Shermo [52]. Unless otherwise specified, Gibbs free energies were corrected at 20 bar and 353 K. The activation energy ( E a ) and reaction energy ( Δ E ) were calculated to quantify the energy changes during the reaction process, as defined by the following equations: (1) E a = E TS - E IS (2) ΔE = E FS - E IS where E TS , E FS , E IS represent the energies of the transition state, initial state, and final state, respectively. In this study, the visualization of molecular structures was achieved using CYLview [53]. For the visualization of electronic effects, the Interaction Region Indicator (IRI) [54] analysis method was employed. The grid data calculations were performed using Multiwfn [55,56], and the isosurface diagrams of the structures were rendered using VMD software [57] (detailed methods are provided in the Supporting Information). The SambVca [58–60] program is used to calculate, analyze and visualize the steric hindrance of organic ligands in metal coordination compounds. 2.1.2 MKM simulation Microkinetic Modeling (MKM) is a dynamic method which can simulate the temporal evolution of species involved in catalytic reactions, providing a description of the catalytic system that closely resembles experimental observations [61,62]. In the hydroformylation process, MKM simulation enables the investigation of how variations in temperature, pressure and syngas composition affect product distribution, which is highly beneficial for elucidating reaction mechanisms, optimizing reaction conditions, and improving catalyst design [63–65]. In this study, the reaction network for the allyl acetate hydroformylation was constructed based on DFT-calculated elementary reactions. The forward and reverse reaction rate constants were derived using Equation (3). Here, σ represents the reaction path degeneracy, which is considered in the form of point group symmetry when calculating thermodynamic quantities using Shermo, without the need for additional calculations. The tunneling correction factor κ is commonly assumed to 1 in homogeneous systems [61]. The Boltzmann constant ( k b = 1.381 × 10-23 J/K) and Planck constant ( h = 6.626 × 10-34 J·s) are employed in these calculations, with Δ G ‡ representing the Gibbs free energy barrier difference computed using transition state theory at the reaction temperature and pressure. Using the flash model of Aspen, we calculated the concentrations of CO and H2 in the liquid phase under different reaction conditions. We performed MKM simulations of allyl acetate hydroformylation catalyzed bytwo catalysts using COPASI [66]. (3) k T = σ κ k b T h e x p ( - Δ G ‡ RT ) 2.2 Experimental methods All hydroformylation experiments were carried out in a 50 mL stainless steel autoclave equipped with magnetic stirring. The reagents used were all commercially available. In a typical experiment, Rh(CO)2(acac), toluene, allyl acetate, phosphine ligand, and n-dodecane were added to the autoclave. The system was purged with N2 and syngas for 10 min each to eliminate air. Then, under atmospheric syngas pressure, the mixture was stirred and quickly heated to the reaction temperature. After reaching the desired temperature, the pressure was raised to the reaction pressure and maintained for 2 h with a continuous supply of syngas to ensure the reaction proceeded at the specified pressure. Upon completion, the autoclave was quickly cooled to room temperature and then slowly depressurized to avoid product evaporation. The gaseous product only contained a trace amount of propylene, with no reactants or other products. The liquid product was analyzed using GC–MS (Agilent 6890 with HP-5 capillary column, 30 m × 0.53 mm × 0.25 μ m ), and conversion rates and yields were determined using dodecane as the internal standard. The reactions involved in the process are shown in Scheme 1 , including the hydroformylation (Eq. (1)), hydrogenation (Eq. (2)), and hydrogenolysis of allyl acetate (Eq. (3)), and the hydroformylation of propylene (Eq. (4)). Analysis was conducted solely on liquid-phase products. Given that the formation of acetic acid is accompanied by other hydrogenolysis products, it was not included in the selectivity calculations. The conversion rate of allyl acetate ( X AA ), product selectivity ( S product ), and linear-to-branched ratio ( l / b ) were calculated as follows: (4) X AA = n AAin - n AAout n AAin × 100 % (5) S product = n product n AAin - n AAout × 100 % (6) l / b = n l n b where, n AAin and n AAout are the moles of allyl acetate initially fed into the reaction and remaining in the liquid-phase product after reaction, respectively. n product represents the moles of each product in the liquid phase, while n l and n b specifically denote the moles of 4-acetoxybutyraldehyde and 2-methyl-3-acetoxypropionaldehyde. 3 Results and discussion This study employs the Wilson dissociative mechanism to describe the fundamental reaction steps in the RhH(CO)2P2 catalyzed hydroformylation of allyl acetate, producing linear and branched aldehydes and by-product propyl acetate. The left and right black-line cycles represent pathways for linear and branched aldehyde formation, respectively, while the green line indicates propyl acetate formation. The main catalytic cycle involves four crucial steps: allyl acetate insertion, CO insertion, H2 oxidative addition, and aldehyde reduction-elimination, as shown in Scheme 2 (taking RhH(CO)2(Xantphos) as an example). Possible structures for each step were assessed to identify the most stable conformations. Fig. 1 illustrates the energy profiles for the hydroformylation of allyl acetate to produce aldehydes using RhH(CO)2(Xantphos) and RhH(CO)2(PPh3)2 as catalysts. Additionally, Fig. S2 presents the energy diagram for RhH(CO)4-catalyzed reaction in the absence of ligand modification. The following discussion is mainly based on RhH(CO)2(Xantphos), combined with the experimental results (Table 1 ) to analyze the key steps in the whole process. 3.1 Reaction mechanism of target aldehyde 3.1.1 CO dissociation and olefin coordination The stable 18-electron trigonal bipyramidal structure (RhH(CO)2P2) serves as a common pre-catalyst model in olefin hydroformylation. Theoretical calculations indicate that H atom prefer axial position in the complex [68], and phosphine ligands can coordinate at equatorial (e) or apical (a) positions, resulting in two major configurations: ee and ea. In the hydroformylation process, it is commonly considered that the binding and dissociation of the tetracoordinate catalyst structure with CO or olefin occur in a quick dynamic equilibrium [67,68], with olefin insertion being generally irreversible [69]. Thus, the entire process from CO dissociation to olefin coordination has been considered to identify the most probable starting point for subsequent reactions. Fig. 2 illustrates the energy profiles of ee and ea structures for CO dissociation on RhH(CO)2(Xantphos) and RhH(CO)2(PPh3)2. The ea structure of RhH(CO)2(Xantphos) is 0.46 kcal/mol more stable than the ee structure. It also has a lower CO dissociation barrier of 9.69 kcal/mol, making it more reactive. Conversely, for RhH(CO)2(PPh3)2, despite the greater stability of the ea structure, the ee structure exhibits a lower CO dissociation barrier by 1 kcal/mol. To investigate the stable olefin coordination mode, a series of potential five-coordinate configurations of RhH(CO)(AA)P (AA = allyl acetate, P = Xantphos, (PPh3)2) was constructed. For RhH(CO)(AA)(Xantphos), four different conformations of equatorially coordinated allyl acetate were found in the ee structure, while three different olefin coordination modes were observed at the apical position in the ea structure, depending on whether the acetoxy group was near the H or CO side and the functional group orientation (Fig. 3 ). The energy of the four Xantphos-ee conformations was much higher than that of Xantphos-ea. Regardless of whether the functional group was close to CO or H, the most stable conformation was that with the acetoxy group away from the catalyst, indicating repulsion between the two. The weak interactions within the Xantphos-ea1 and Xantphos-ea2 were analyzed using IRI (Fig. 4 ). Notably, when the acetoxy group is in proximity to the carbonyl group of the catalyst (as in Xantphos-ea1), van der Waals forces are significantly present, whereas they are almost negligible in Xantphos-ea2. This distinction is the source of the observed differences in structural energies. In the Xantphos-ea structure, the carbonyl group repelled the acetoxy group of allyl acetate, causing it to twist away on the equatorial plane and forming a stable quadrilateral with two C atoms of the olefin and one phosphine ligand. Among these, the conformation Xantphos-ea2, with the acetoxy group near the CO side and twisted away, was the most stable. Similar conclusions were drawn from the conformational analysis of RhH(CO)(AA)(PPh3)2 (detailed in Fig. S3). The most stable conformation identified was PPh3-ee2, characterized by the acetoxy group being close to the CO side and oriented away from the catalyst. In summary, considering both CO dissociation and olefin coordination, Rh catalysts modified with Xantphos prefer to bind allyl acetate in the ea2 conformation (referred to subsequently as X-ea), whereas Rh-PPh3 catalysts exhibit greater stability in the ee2 conformation (referred to subsequently as P-ee). Subsequent discussions will be based on these conformations. Additionally, we have conducted comprehensive reaction network calculations for the Xantphos-ee4 and PPh3-ea2 catalyst conformations (see Figs. S4–S5) to comprehensively consider the impact of less stable structures on reaction pathways in the kinetics analysis. 3.1.2 Olefin insertion The transition state of H atom transfer from Rh to the α-C or β-C of allyl acetate is the crucial step in the catalytic cycle, as it determines the position of the aldehyde group and the subsequent formation of linear and branched aldehydes through distinct pathways. Fig. 5 illustrates the insertion process of allyl acetate on X-ea, with green highlighting the breaking bonds and involved atoms in the transition state. When H atom transfers to α-C, the substrate rotates counterclockwise, the carbonyl group twists from the equatorial to the apical position, and the bite angle changes from 100.1° to 115.3°, forming the tetrahedral X-ea-4l structure. In contrast, when H atom transfers to β-C, leading to branched aldehyde formation, the substrate rotates clockwise slightly, the bite angle changes from 100.1° to 99.1°, and minimal movement of the carbonyl group (as confirmed by the IRI analysis of X-ea-TS3l in Fig. 7), resulting in the quadrilateral X-ea-4b structure. In contrast, for the olefin insertion reaction catalyzed by P-ee (Fig. S6), the allyl acetate intermediate encounters greater steric hindrance from the ligand when rotating counterclockwise around the Rh-C(β) axis compared to rotating clockwise around the Rh-C(α) axis, leading to a higher energy barrier for the P-ee-TS3l. The final complexes, P-ee-4l and P-ee-4b, both adopt quadrilateral configurations. To further investigate the steric effects of different ligands and configurations on TS3, stereograms of X-ea-3* and P-ee-3* were created (Fig. 6 ), displaying the relative positions of the olefin and Rh, as well as the free volume fractions in each quadrant. Fig. 6 presents the structure viewed along the z-axis from the olefin side, where R denotes CH2COOCH3. Its projection appears northeastward in four quadrants, in agreement with the actual model, thus serving as the reference for subsequent analysis. The contour lines in the visualization delineate the ligand-embedded space within the Rh coordination sphere along the z-axis orientation, with positive isovalues (shown in red) specifically mapping the top hemisphere where the ligand is situated. For X-ea-3*, the olefin rotates from the northeast to the southeast (%Vf = 43.9 %) to form the linear aldehyde intermediate and from the northeast to the northwest (%Vf = 31.9 %) to form the branched aldehyde intermediate. The linear pathway experiences less steric hindrance than the branched pathway, resulting in a lower reaction barrier. Conversely, for P-ee-3*, the olefin rotates from the northeast to the northwest (%Vf = 41.6 %) to form the linear aldehyde intermediate and from the northeast to the northwest (%Vf = 44.8 %) to form the branched aldehyde intermediate. Unlike X-ea-3*, the linear pathway in P-ee-3* encounters greater steric hindrance, leading to a higher reaction barrier than the branched pathway. In addition, the charge transfer during the reaction was analyzed (Table 2 ). It was found that in X-ea-3*, Rh carries a charge of −1.275|e|, and the β-C serves as a negative charge center, readily attracting the transferred positively charged H, consistent with Markovnikov's rule. However, the O atom in the Xantphos structure not only enhances structural flexibility but also modulates the charge on Rh. As a result, in X-ea-TS3l, the distance between Rh and O is shortened (from 3.52 Å to 3.44 Å), which reduces the charge density on Rh and promotes the combination of Rh with β-C. More research has been conducted on the hydroformylation of vinyl acetate than that of allyl acetate. In vinyl acetate hydroformylation with Xantphos as the ligand, branched aldehyde is the main product. This is because the acetoxy group induces double-bond polarization, making the α-C negatively charged and more likely to bond with the positively charged Rh. During olefin insertion, the α-C and acetoxy group form a chelate with Rh, favoring branched aldehyde formation [70]. For allyl acetate, charge analysis shows the charge on β-C atom is −0.379|e| and α-C is −0.208|e|, indicating Rh is more likely to connect with β-C, which acts as the negative charge center. To investigate the influence of the acetoxy group, we calculated the olefin insertion step for the Xantphos-ea1 (referred to subsequently as X-ea1) with the acetoxy group near the carbonyl and oriented upward. Unlike in vinyl acetate hydroformylation, no chelation structure between the acetoxy group and Rh was observed. TS energy comparisons revealed that altering the position of acetoxy group has opposite effects on the H atom transfer barrier (Table 3 ). The movement of acetoxy group decreases the distance to carbonyl in the production of 4b*, while in the 4l* formation, it increases (Fig. S7). Combining with the IRI study of TS3b (Fig. 7 ), it shows weak interactions between the carbonyl and acetoxy group in X-ea1-TS3b, resulting in a higher reaction barrier than in X-ea-TS3b by 1.12 kcal/mol. This comparison further confirms the repulsion between the carbonyl and acetoxy group in allyl acetate. In contrast, during the formation of 4l*, the acetoxy group in X-ea1-TS3l mainly interacts with the ligand's phenyl ring via van der Waals forces, lowering the barrier compared to X-ea-TS3l by 0.10 kcal/mol. Overall, unlike vinyl acetate, allyl acetate is more prone to forming linear aldehydes. The olefin insertion process is exothermic and can be considered irreversible. When catalyzed by RhH(CO)2(Xantphos), the reaction barrier for forming the linear intermediate is 5.49 kcal/mol lower than that for the branched intermediate, favoring the formation of 4-acetoxybutyraldehyde. Conversely, with RhH(CO)2(PPh3)2 as the catalyst, the barrier for producing the linear intermediate is 4.15 kcal/mol higher than that for the branched intermediate, resulting in a l/b ratio of less than 1. In the absence of the ligand (Fig. S2), the barrier difference between forming linear and branched aldehyde intermediates is minimal, with the linear intermediate being only 0.15 kcal/mol lower, leading to a l/b ratio close to 1. Therefore, similar to most olefin hydroformylations [20], this step is also the selectivity-determining step in the hydroformylation of allyl acetate. 3.1.3 CO coordination and insertion After olefin insertion forms a four-coordinate structure, the subsequent steps involve CO coordination and insertion (Fig. 8 ). Calculations show that in the linear path, CO coordinates to the equatorial site of the tetrahedral (X-ea-4l) complex, while in the branched path, it approaches the apical position of the quadrilateral (X-ea-4b) complex. Both pathways ultimately form a trigonal bipyramidal structure with carbonyl and allyl acetate intermediate at the axial position. During CO insertion, the Rh-C bond cleaves, and the propenyl group bends toward the adjacent carbonyl to form a new bond, creating a distorted quadrilateral. In the P-ee catalytic system, CO coordination results in P-ee-5l and P-ee-5b structures, where the olefin intermediate and phosphine ligand are at the axial position. CO insertion then forms a quadrilateral configuration (details in Fig. S8). 3.1.4 H2 oxidation addition and aldehyde reduction elimination The coordination of H2 to the Rh active center is the highest-barrier step in the entire reaction and is strongly endothermic, which is consistent in both Rh-catalyzed systems with PPh3 ligand and without ligand, as shown in the Table 4 . Thus, H2 oxidation addition is regarded as the rate controlling step of the entire reaction, and primarily influenced by the steric hindrance and charge density of Rh. The charge densities of Rh in the three catalytic systems are relatively similar. The Xantphos-modified catalyst has a lower electron density, which could theoretically make the H2 oxidation addition reaction relatively easier. However, no corresponding trend is observed in the reaction barriers, suggesting that the charge density of Rh is not the primary influencing factor. The spatial distribution of steric hindrance before H2 coordination was calculated for the three catalysts, with the positions of H2 coordination indicated in the Fig. 9 . For Rh without a ligand, the free volume percentages in the linear and branched aldehyde formation pathways are relatively high (57.5 % and 50.5 %, respectively), with low steric hindrance in the quadrants for H2 coordination. The electron densities of Rh are similar, resulting in similar barriers for H2 oxidation addition in both pathways. For ligand-modified catalysts, the steric hindrance is significantly increased, and the free volume is reduced to less than half. The overall free volumes of X-ea-6l* and X-ea-6b* are comparable. Specifically, in X-ea-6l*, H2 coordinates with Rh from the northeast quadrant with a larger free space (39.4 %), while in X-ea-6b*, H2 approaches Rh from the southeast direction (33.4 %), encountering less steric hindrance in X-ea-6l*. The impact of steric hindrance is very evident for P-ee-6l* and P-ee-6b*. In P-ee-6b*, H2 coordinates with Rh from the west, with relatively large free volumes in the southwest (36.4 %) and northwest (28.1 %) quadrants. However, in P-ee-6l*, although there is a free space of 34.6 % for H2 insertion from the northeast direction, the available coordination angle is narrow, leading to a high reaction barrier of 34.17 kcal/mol. Overall, the extent of steric hindrance significantly influences the feasibility of the H2 oxidation addition reaction in the hydroformylation of allyl acetate. To reduce the reaction barrier and increase the reaction rate, catalysts must provide sufficient free space volume and a wider contact angle with the Rh active site. Upon H2 coordinates to the catalyst, forming the octahedral X-ea-7b and X-ea-7l complexes where H atoms are positioned opposite to the olefin and phosphine atom. During aldehyde reduction elimination, H atom from active Rh center transfers to the olefin intermediate, yielding 4-acetoxybutyraldehyde or 2-methyl-3-acetoxypropionaldehyde. After aldehyde desorption, the catalyst reverts to RhHCO(Xantphos) tetracoordinate state, ready for the next catalytic cycle. 3.2 Reaction mechanism of hydrogenation and hydrogenolysis In the process of allyl acetate hydroformylation, by-products include propyl acetate, n-butyraldehyde, isobutyraldehyde, propylene and acetic acid. Propyl acetate, formed via hydrogenation, arises from the formation of tetrahedral structures (X-ea-4b and X-ea-4l) after olefin insertion, where H2 and CO compete for coordination. Therefore, a hydrogenation reaction may occur to produce propyl acetate, and the reaction energy barriers are shown in Fig. 10 (a). Table 5 lists the computed reaction energy barriers for H2 coordination (ER7) and CO coordination (ER4) on various catalysts. The former is all higher, so that the reaction is more likely to proceed along the main reaction pathway, aligning with our experimental observations (Table 1). For the Xantphos-modified catalyst, propyl acetate formation is below 4 % at a syngas ratio of 1, increasing the temperature (Entry5) or pressure (Entry 4) from leads to higher hydrogenation product formation. Higher H2 concentration (CO/H2 = 1/2) boosts propyl acetate yield to 13.28 % by overcoming high barriers (Entry 9–12). Other by-products are thought to be hydrogenolysis products formed at high temperature, and we have conducted experiments to investigate their reactive sites and formation pathways. In the absence of catalyst, only trace amounts of allyl acetate undergo hydrogenation. Without ligand modification, Rh-catalyzed reactions produce 32.29 % hydrogenolysis products (Entry 2), which increase dramatically to 58.19 % (Entry 3) with higher H2 concentration. In contrast, introducing ligands primarily promotes the hydroformylation of allyl acetate, occurring predominantly on ligand modified Rh catalysts. Increasing ligand concentration reduces hydrogenolysis products (Entry 7&8) and enhances chemical selectivity to over 92 %. Besides experimental results, we found that 4-acetoxybutyraldehyde and 2-methyl-3-acetoxypropionaldehyde rapidly desorb after formation and do not adsorb onto the Rh-based active center. Thus, we speculate that allyl acetate is the main hydrogenolysis reactant, with active site being Rh not coordinated by phosphine ligands, a process we have theoretically calculated. Fig. 10(b) depicts the dissociation of allyl acetate on active Rh site to form propylene and acetic acid, where H atom may migrate to the O atom of the acetoxy group instead of α-C or β-C. This step requires overcoming a high reaction barrier of 40.62 kcal/mol, thus being more likely to occur at high temperature. Subsequently, propylene undergoes hydroformylation, yielding n-butyraldehyde and isobutyraldehyde as the final by-products. 3.3 MKM simulation In the preceding theoretical calculations, we constructed a detailed reaction network for the hydroformylation of allyl acetate and calculated the energy barriers for elementary reactions of main products, followed by qualitative analysis. Based on these results, we explored the impact of reaction conditions through MKM simulation and compared them with experimental findings (Tables S4–S9). First, we discussed the impact of metastable conformations on reaction product distribution. By considering the energy barrier difference for ee and ea isomer interconversion of RhH(CO)2(Xantphos) as the bridge, we connected the complete reaction networks under both conformations. Tracing the sources of product formation further elucidated the impact of catalyst conformation. We investigated the species concentrations and product distribution under the condition of CO/H2 = 1, 353 K, 40 bar, and AA/Rh = 400 (mol). Given that this is a batch reaction, the overall process can be divided into two stages: from the reaction start to the complete adsorption of allyl acetate (stage 1) and the complete formation of reaction products (stage 2) (see Figs. S9–S10). In the linear pathway, the trends of other intermediates over time in the system are consistent with X-ea-4l (or X-ee-4l) formed after olefin insertion, and similarly in the branched pathway, they are consistent with X-ea-4b (or X-ee-4b). The highest concentrations in the linear and branched pathways are X-ea-6l and X-ea-6b (X-ee-6l and X-ee-6b), respectively, which are the intermediates before hydrogen oxidation addition, consistent with the high reaction barriers calculated by DFT. Fig. 11 presents the product distributions simulated with only the X-ea structure and with both X-ea and X-ee structures. The simulated selectivities for linear aldehyde are 93.61 % and 91.88 %, respectively, while those for branched aldehyde are 6.38 % and 8.11 %. Compared to the products formed from the X-ea structure, those from the X-ee are 1 to 2 orders of magnitude lower, primarily influencing the dynamic equilibrium of various intermediate species within the system. Under the given reaction conditions, the MKM simulation of the RhH(CO)2(Xantphos)-ea catalyzed process yields a l/b aldehyde ratio of 14.65, which closely corresponds with the experimental value of 12.86 obtained under identical conditions. Similarly, we simulated the product distribution of allyl acetate hydroformylation catalyzed by different configurations of Rh-PPh3 (Fig. 11(b)). The simulated selectivity for linear aldehyde was 19.62 %, and for branched aldehyde was 80.33 % on P-ee. On P-ee and P-ea, the simulated selectivities were 18.90 % and 81.06 % respectively, with the products mainly originating from the P-ee. In summary, the simulation results demonstrate that the structure with the most stable olefin coordination in the hydroformylation of allyl acetate dominates the system, and the product distribution derived from it can be approximated as the product distribution for the hydroformylation of allyl acetate catalyzed by this catalyst. For the reaction conditions at 353 K and 40 bar, the simulated theoretical isomer ratio of Rh-PPh3 is lower than that of the experiment (0.24 vs 0.58), while the simulated isomer ratio of Rh-Xantphos is higher than that of the experiment (14.65 vs 12.86). We analyzed this difference and attributed it to two aspects. From a kinetic perspective, comparative analysis of the H2 oxidative addition process reveals that Rh-Xantphos displays a 7.67 kcal/mol lower energy barrier for the linear pathway versus the branched pathway, whereas Rh-PPh3 shows the opposite trend with a 17.61 kcal/mol higher barrier for the linear pathway. This indicates that for both Xantphos and PPh3, the lower energy barrier corresponds to the favored aldehyde formation pathway. Thus, it is highly plausible that olefin insertion is the selectivity-determining step, while the differences in energy barriers for the H2 oxidative addition process play a synergistic role. Furthermore, our simulations identified that the product distribution is significantly influenced by H2 and CO concentrations and their ratios (Fig. 12 ), which contributes to the observed deviations. Additionally, inherent differences between the idealized simulation conditions and actual reaction parameters inevitably affect the quantitative agreement. To explore the impact of reaction conditions on product distribution, MKM simulations were conducted for the X-ea and P-ee catalysts, with different reaction temperature (333–373 K), reaction pressure (10–80 bar), and syngas ratio (CO/H2 = 1/8–8). Fig. 12 illustrates the relationship between pressure and syngas ratio with product selectivity at 353 K (for other temperatures, see Figs. S11–S18). As pressure increases, the selectivity for linear aldehydes significantly rises on X-ea, peaking at 94.93 % at 80 bar. At lower pressures, changes in the syngas ratio have a greater effect on product selectivity. For instance, at 10 bar, the selectivity for linear aldehydes is 19.61 % higher when CO/H2 = 1 compared to CO/H2 = 8. At higher pressures, the effect is less pronounced, with a maximum difference of only 2.61 % at 80 bar. Interestingly, the highest selectivity for 4-acetoxybutyraldehyde is consistently achieved at a CO/H2 ratio of 0.5–2 across different pressures, a trend also observed experimentally. In P-ee, a similar trend is observed, where the selectivity for branched aldehyde, as the dominant species, increases with pressure, reaching a maximum of 85.65 %. Across different pressures, the highest selectivity for 2-methyl-3-acetoxypropionaldehyde is consistently achieved at a syngas ratio of 1. This insight guides us in the hydroformylation of allyl acetate to moderately increase H2 concentration to accelerate the reaction rate while maintaining a high selectivity for the target product by keeping the CO/H2 ratio of 0.5–2. Fig. 13 (a) shows the impact of varying temperature and pressure on the selectivity of 4-acetoxybutyraldehyde in the hydroformylation of allyl acetate catalyzed by X-ea at a CO/H2 ratio of 1. With the increasing pressure, the concentration of CO and H2 in the liquid phase increases, resulting in the enhanced selectivity for 4-acetoxybutyraldehyde. Temperature variations have a notable effect on the Gibbs free energy of the elementary reactions involving CO and H2 coordination, with each 10 K rise adding roughly 0.5 kcal/mol to the energy barrier. This results in varying rates of selectivity increase with pressure at different temperatures. Nevertheless, at high pressures like 80 bar, the selectivity for 4-acetoxybutyraldehyde can surpass 98 %. When P-ee serves as the catalyst, increasing either temperature or pressure enhances the selectivity for 2-methyl-3-acetoxypropionaldehyde (Fig. 13(b)), with a maximum of 91.49 % achieved at 363 K and 80 bar. For the hydrogenation product propyl acetate, the influence of reaction conditions on selectivity are shown in Figs. S19–S22. In the simulated hydroformylation of allyl acetate at 353 K, both the Rh-Xantphos and Rh-PPh3 catalytic systems exhibited increased propyl acetate selectivity with rising H2 concentration under varying pressures. Experimental results from Rh-Xantphos-catalyzed reactions demonstrated that the selectivity of propyl acetate increased by 3.36 % at 333 K (CO/H2 = 0.5 vs. 1) and by 4.12 % at 353 K (Table 1, entry 7 vs. entry 10 and entry 8 vs. entry 11), consistent with the simulation trend. The variation in selectivity for the hydrogenation product with changing pressure or temperature was non-monotonic, as increasing pressure or temperature not only accelerated the hydrogen oxidative addition process but also affected CO concentration, involving competition between primary and side reactions. For Xantphos, simulations indicated minimal propyl acetate formation at 60 bar, whereas for PPh3, this occurred at 80 bar. In summary, Table S11 compares MKM-simulated and experimental selectivities under identical conditions. For hydroformylation products, MKM modeling accurately reproduced the regioselectivity trends observed experimentally for both Rh-Xantphos and Rh-PPh3 catalysts across various temperatures and pressures. However, for the hydrogenated products, the simulation results of the Rh-PPh3 are consistent with the experiments, while the Rh-Xantphos has the same trend but quantitative differences. This may stem from dynamic equilibrium between Xantphos and Rh, leaving unmodified Rh sites available for hydrogenation, leading to increased propyl acetate formation. While the predictive performance of the developed MKM model requires further experimental validation under extreme conditions (>4 MPa, H2/CO > 2:1), it demonstrates exceptional regioselectivity prediction accuracy within industrial operating windows, providing reliable theoretical guidance for both process optimization and catalyst design in hydroformylation. 4 Conclusion This study provides a comprehensive understanding of the hydroformylation mechanism of allyl acetate and the impact factors on its product selectivity through a combination of experimental and theoretical calculations, offering a detailed insight into the key intermediate reaction for the synthesis of 1,4-BDO from propylene. Theoretical calculations were employed to investigate the key elementary reactions of allyl acetate hydroformylation catalyzed by Rh-based catalysts modified with Xantphos, which favors the formation of linear aldehyde, and PPh3, which tends to produce branched aldehyde. The results revealed that the olefin insertion is the selectivity-determining step. The acetoxy group in allyl acetate exhibits repulsive van der Waals interactions with the carbonyl group of the catalyst, leading to a more stable conformation where the groups are positioned away from each other. The Xantphos-modified Rh catalyst provides a more favorable reaction pathway for linear aldehyde formation due to the relative lower steric hindrance than that of branched one and the modulate the charge density of Rh through structural flexibility. In contrast, for the PPh3 system, the alkene insertion step along the isomerization pathway encounters lower steric hindrance during rotation, thus favoring the formation of branched aldehyde. The H2 oxidative addition is the rate-determining step of this reaction, where the steric hindrance of the catalyst structure serves as the primary influencing factor. Providing larger free space volume facilitates lowering the energy barrier for H2 insertion, thereby enhancing the reaction efficiency. Additionally, calculations indicated that the hydrogenolysis of allyl acetate primarily occurs at uncoordinated Rh sites, a process that requires a high energy barrier and is more likely to proceed under high temperature or high H2 concentration conditions. MKM further validated the theoretical results and explored the influence of reaction conditions on product selectivity. The simulations demonstrated that the product distribution derived from the most stable olefin coordination conformation can approximate the product distribution of allyl acetate hydroformylation catalyzed by the respective catalyst. The MKM simulation results were consistent with the experimental trends. Increasing pressure and optimizing the syngas ratio (0.5–2) significantly enhanced the selectivity for aldehydes with lower olefin insertion energy barriers. For Xantphos, the selectivity for linear aldehyde could exceed 98 % under optimal conditions. The findings in this work are expected to guide the development of novel industrial catalysts for 1,4-BDO synthesis from propylene, while also demonstrating the potential of a multi-scale approach combining DFT and MKM for exploring hydroformylation catalytic reaction systems. CRediT authorship contribution statement Minhua Zhang: Supervision, Software, Project administration, Funding acquisition, Conceptualization. Yuzhe Sun: Writing – original draft, Visualization, Validation, Formal analysis. Lingtao Wang: Writing – review & editing, Supervision, Methodology. Hao Gong: Supervision, Software, Investigation. Yifei Chen: Writing – review & editing, Validation, Supervision. Declaration of competing interest The authors declare that they have no known competing financial interests or personal relationships that could have appeared to influence the work reported in this paper. Appendix A Supplementary data Supplementary data to this article can be found online at https://doi.org/10.1016/j.jcat.2025.116307. Details of research methods, conformation and energy profile diagrams, supplementary MKM simulation data and results can be found in Supporting Material. Appendix A Supplementary data The following are the Supplementary data to this article: Supplementary Data 1 References [1] M. Gigli M. Fabbri N. Lotti R. Gamberini B. Rimini A. Munari Poly(butylene succinate)-based polyesters for biomedical applications: a review Eur. Polym. J. 75 2016 431 460 10.1016/j.eurpolymj.2016.01.016 Gigli, M.; Fabbri, M.; Lotti, N.; Gamberini, R.; Rimini, B.; Munari, A. Poly(Butylene Succinate)-Based Polyesters for Biomedical Applications: A Review. Eur. Polym. J. 2016, 75, 431-460. DOI: 10.1016/j.eurpolymj.2016.01.016. [2] Y. Yang K. Seo J. Kim W. Won Biodegradable plastic production: economic and environmental perspective ACS Sustain. Chem. Eng. 13 2 2025 923 935 10.1021/acssuschemeng.4c07893 Yang, Y.; Seo, K.; Kim, J.; Won, W. Biodegradable Plastic Production: Economic and Environmental Perspective. ACS Sustain. Chem. Eng. 2025, 13 (2), 923-935. DOI: 10.1021/acssuschemeng.4c07893. [3] Y. Liu C. Zhang A.-P. Zeng Advances in biosynthesis and downstream processing of diols Biotechnol. Adv. 77 2024 108455 10.1016/j.biotechadv.2024.108455 Liu, Y.; Zhang, C.; Zeng, A.-P. Advances in Biosynthesis and Downstream Processing of Diols. Biotechnol. Adv. 2024, 77, 108455. DOI: 10.1016/j.biotechadv.2024.108455. [4] T. Haas B. Jaeger R. Weber S.F. Mitchell C.F. King New diol processes: 1,3-propanediol and 1,4-butanediol Appl. Catal. Gen. 280 1 2005 83 88 10.1016/j.apcata.2004.08.027 Haas, T.; Jaeger, B.; Weber, R.; Mitchell, S. F.; King, C. F. New Diol Processes: 1,3-Propanediol and 1,4-Butanediol. Appl. Catal. Gen. 2005, 280 (1), 83-88. DOI: 10.1016/j.apcata.2004.08.027. [5] Y. Zhu J. Yang F. Mei X. Li C. Zhao Bio-based 1,4-butanediol and tetrahydrofuran synthesis: perspective Green Chem. 24 17 2022 6450 6466 10.1039/D2GC02271K Zhu, Y.; Yang, J.; Mei, F.; Li, X.; Zhao, C. Bio-Based 1,4-Butanediol and Tetrahydrofuran Synthesis: Perspective. Green Chem. 2022, 24 (17), 6450-6466. DOI: 10.1039/D2GC02271K. [6] P. Kumar H. Park Y. Yuk H. Kim J. Jang R. Pagolu S. Park C. Yeo K.Y. Choi Developed and emerging 1,4-butanediol commercial production strategies: forecasting the current status and future possibility Crit. Rev. Biotechnol. 44 4 2024 530 546 10.1080/07388551.2023.2176740 Kumar, P.; Park, HyunA; Yuk,Yong; Kim, Hayan; Jang, Jihwan; Pagolu, Raviteja; Park, SeoA; Yeo, Chanseo; and Choi, K.-Y. Developed and Emerging 1,4-Butanediol Commercial Production Strategies: Forecasting the Current Status and Future Possibility. Crit. Rev. Biotechnol. 2024, 44 (4), 530-546. DOI: 10.1080/07388551.2023.2176740. [7] Dubner; Walter S. et al. Allyl Alcohol Hydroformylation. US-6225509-B1. [8] Matsumoto; Mitsuo et al. Process for Continuous Hydroformylation of Allyl Alcohol. US-4567305-A. [9] S. Ichikawa Y. Ohgomori N. Sumitani H. Hayashi M. Imanari Process for manufacturing 1,4-butanediol from acrolein ACS Publ. 2002 10.1021/ie00042a034 Ichikawa, S.; Ohgomori, Y.; Sumitani, N.; Hayashi, H.; Imanari, M. Process for Manufacturing 1,4-Butanediol from Acrolein. ACS Publ. 2002. DOI: 10.1021/ie00042a034. [10] G. Morales Torres R. Frauenlob R. Franke A. Börner Production of alcohols via hydroformylation Catal. Sci. Technol. 5 1 2015 34 54 10.1039/C4CY01131G MoralesTorres, G.; Frauenlob, R.; Franke, R.; Börner, A. Production of Alcohols via Hydroformylation. Catal. Sci. Technol. 2015, 5 (1), 34-54. DOI: 10.1039/C4CY01131G. [11] G.-H. Shi X.-C. Chen T. Jing Y.-Y. Zhuang Y. Lu Y. Liu Rh-catalyzed hydroformylation of allyl acetate toward 4-acetoxybutyraldehyde: the crucial step in production of 1,4-butanediol via hydroformylation/hydrogenation sequence Mol. Catal. 545 2023 113209 10.1016/j.mcat.2023.113209 Shi, G.-H.; Chen, X.-C.; Jing, T.; Zhuang, Y.-Y.; Lu, Y.; Liu, Y. Rh-Catalyzed Hydroformylation of Allyl Acetate toward 4-Acetoxybutyraldehyde: The Crucial Step in Production of 1,4-Butanediol via Hydroformylation/Hydrogenation Sequence. Mol. Catal. 2023, 545, 113209. DOI: 10.1016/j.mcat.2023.113209. [12] Y.L. Borole R.V. Chaudhari New route for the synthesis of propylene glycols via hydroformylation of vinyl acetate Ind. Eng. Chem. Res. 44 25 2005 9601 9608 10.1021/ie050272g Borole, Y. L.; Chaudhari, R. V. New Route for the Synthesis of Propylene Glycols via Hydroformylation of Vinyl Acetate. Ind. Eng. Chem. Res. 2005, 44 (25), 9601-9608. DOI: 10.1021/ie050272g. [13] R. Franke D. Selent A. Börner Applied hydroformylation Chem. Rev. 112 11 2012 5675 5732 10.1021/cr3001803 Franke, R.; Selent, D.; Börner, A. Applied Hydroformylation. Chem. Rev. 2012, 112 (11), 5675-5732. DOI: 10.1021/cr3001803. [14] B. Breit Synthetic aspects of stereoselective hydroformylation ACS Publ. 2003 10.1021/ar0200596 Breit, B. Synthetic Aspects of Stereoselective Hydroformylation. ACS Publ. 2003. DOI: 10.1021/ar0200596. [15] C. Botteghi R. Ganzerla M. Lenarda G. Moretti Advances in the hydroformylation of olefins containing functional groups J. Mol. Catal. 40 2 1987 129 182 10.1016/0304-5102(87)80033-0 Botteghi, C.; Ganzerla, R.; Lenarda, M.; Moretti, G. Advances in the Hydroformylation of Olefins Containing Functional Groups. J. Mol. Catal. 1987, 40 (2), 129-182. DOI: 10.1016/0304-5102(87)80033-0. [16] A.G. Panda P.J. Tambade Y.P. Patil B.M. Bhanage Hydroformylation of allyl acetate using rhodium polyether diphosphinite catalyst React. Kinet. Mech. Catal. 2009 10.1007/s11144-009-0123-0 Panda, A. G.; Tambade, P. J.; Patil, Y. P.; Bhanage, B. M. Hydroformylation of Allyl Acetate Using Rhodium Polyether Diphosphinite Catalyst. React. Kinet. Mech. Catal. 2009. DOI: 10.1007/s11144-009-0123-0. [17] C. Cai S. Yu B. Cao X. Zhang New tetraphosphorus ligands for highly linear selective hydroformylation of allyl and vinyl derivatives Chem. - Eur. J. 18 32 2012 9992 9998 10.1002/chem.201201396 Cai, C.; Yu, S.; Cao, B.; Zhang, X. New Tetraphosphorus Ligands for Highly Linear Selective Hydroformylation of Allyl and Vinyl Derivatives. Chem. - Eur. J. 2012, 18 (32), 9992-9998. DOI: 10.1002/chem.201201396. [18] D. Evans A. Osborn G. Wilkinson Hydroformylation of alkenes by use of rhodium complex catalysts J. Chem. Soc. A 1968 3133 3142 10.1039/J19680003133 Evans, D.; Osborn, A.; Wilkinson G. Hydroformylation of Alkenes by Use of Rhodium Complex Catalysts. J. Chem. Soc. A. 1968, 3133-3142. DOI: 10.1039/J19680003133. [19] J. Amsler B.B. Sarma G. Agostini G. Prieto P.N. Plessow F. Studt Prospects of heterogeneous hydroformylation with supported single atom catalysts J. Am. Chem. Soc. 142 11 2020 5087 5096 10.1021/jacs.9b12171 Amsler, J.; Sarma, B. B.; Agostini, G.; Prieto, G.; Plessow, P. N.; Studt, F. Prospects of Heterogeneous Hydroformylation with Supported Single Atom Catalysts. J. Am. Chem. Soc. 2020, 142 (11), 5087-5096. DOI: 10.1021/jacs.9b12171. [20] J.J. Carbó F. Maseras C. Bo P.W.N.M. van Leeuwen Unraveling the origin of regioselectivity in rhodium diphosphine catalyzed hydroformylation. A DFT QM/MM study J. Am. Chem. Soc. 123 31 2001 7630 7637 10.1021/ja0101678 Carbó, J. J.; Maseras, F.; Bo, C.; van Leeuwen, P. W. N. M. Unraveling the Origin of Regioselectivity in Rhodium Diphosphine Catalyzed Hydroformylation. A DFT QM/MM Study. J. Am. Chem. Soc. 2001, 123 (31), 7630-7637. DOI: 10.1021/ja0101678. [21] M. Sparta K.J. Børve V.R. Jensen Activity of rhodium-catalyzed hydroformylation: added insight and predictions from theory J. Am. Chem. Soc. 129 27 2007 8487 8499 10.1021/ja070395n Sparta, M.; Børve, K. J.; Jensen, V. R. Activity of Rhodium-Catalyzed Hydroformylation: Added Insight and Predictions from Theory. J. Am. Chem. Soc. 2007, 129 (27), 8487-8499. DOI: 10.1021/ja070395n. [22] S. Lee A. Patra P. Christopher D.G. Vlachos S. Caratzoulas Theoretical study of ethylene hydroformylation on atomically dispersed Rh/Al2O3 catalysts: reaction mechanism and influence of the ReOx promoter ACS Catal. 11 15 2021 9506 9518 10.1021/acscatal.1c00705 Lee, S.; Patra, A.; Christopher, P.; Vlachos, D. G.; Caratzoulas, S. Theoretical Study of Ethylene Hydroformylation on Atomically Dispersed Rh/Al2O3 Catalysts: Reaction Mechanism and Influence of the ReOx Promoter. ACS Catal. 2021, 11 (15), 9506-9518. DOI: 10.1021/acscatal.1c00705. [23] B. Liu Y. Wang N. Huang X. Lan Z. Xie J.G. Chen T. Wang Heterogeneous hydroformylation of alkenes by Rh-based catalysts Chem 8 10 2022 2630 2658 10.1016/j.chempr.2022.07.020 Liu, B.; Wang, Y.; Huang, N.; Lan, X.; Xie, Z.; Chen, J. G.; Wang, T. Heterogeneous Hydroformylation of Alkenes by Rh-Based Catalysts. Chem 2022, 8 (10), 2630-2658. DOI: 10.1016/j.chempr.2022.07.020. [24] J. Guo D. Zhang X. Wang Mechanistic insights into hydroformylation catalyzed by cationic cobalt(II) complexes: in silico modification of the catalyst system ACS Catal. 10 22 2020 13551 13559 10.1021/acscatal.0c03161 Guo, J.; Zhang, D.; Wang, X. Mechanistic Insights into Hydroformylation Catalyzed by Cationic Cobalt(II) Complexes: In Silico Modification of the Catalyst System. ACS Catal. 2020, 10 (22), 13551-13559. DOI: 10.1021/acscatal.0c03161. [25] X. Zhang T. Yan H. Hou J. Yin H. Wan X. Sun Q. Zhang F. Sun Y. Wei M. Dong W. Fan J. Wang Y. Sun X. Zhou K. Wu Y. Yang Y. Li Z. Cao Regioselective hydroformylation of propene catalysed by rhodium-zeolite Nature 629 8012 2024 597 602 10.1038/s41586-024-07342-y Zhang, X.; Yan, T.; Hou, H.; Yin, J.; Wan, H.; Sun, X.; Zhang, Q.; Sun, F.; Wei, Y.; Dong, M.; Fan, W.; Wang, J.; Sun, Y.; Zhou, X.; Wu, K.; Yang, Y.; Li, Y.; Cao, Z. Regioselective Hydroformylation of Propene Catalysed by Rhodium-Zeolite. Nature 2024, 629 (8012), 597-602. DOI: 10.1038/s41586-024-07342-y. [26] B. Liu N. Huang Y. Wang X. Lan T. Wang Promotion of inorganic phosphorus on Rh catalysts in styrene hydroformylation: geometric and electronic effects ACS Catal. 11 3 2021 1787 1796 10.1021/acscatal.0c04684 Liu, B.; Huang, N.; Wang, Y.; Lan, X.; Wang, T. Promotion of Inorganic Phosphorus on Rh Catalysts in Styrene Hydroformylation: Geometric and Electronic Effects. ACS Catal. 2021, 11 (3), 1787-1796. DOI: 10.1021/acscatal.0c04684. [27] B. Liu N. Huang Y. Wang X. Lan T. Wang Regioselectivity regulation of styrene hydroformylation over Rh-based phosphides: combination of DFT calculations and kinetic studies Chem. Eng. J. 441 2022 136101 10.1016/j.cej.2022.136101 Liu, B.; Huang, N.; Wang, Y.; Lan, X.; Wang, T. Regioselectivity Regulation of Styrene Hydroformylation over Rh-Based Phosphides: Combination of DFT Calculations and Kinetic Studies. Chem. Eng. J. 2022, 441, 136101. DOI: 10.1016/j.cej.2022.136101. [28] T.P. Clark C.R. Landis S.L. Freed J. Klosin K.A. Abboud Highly active, regioselective, and enantioselective hydroformylation with rh catalysts ligated by bis-3,4-diazaphospholanes J. Am. Chem. Soc. 127 14 2005 5040 5042 10.1021/ja050148o Clark, T. P.; Landis, C. R.; Freed, S. L.; Klosin, J.; Abboud, K. A. Highly Active, Regioselective, and Enantioselective Hydroformylation with Rh Catalysts Ligated by Bis-3,4-Diazaphospholanes. J. Am. Chem. Soc. 2005, 127 (14), 5040-5042. DOI: 10.1021/ja050148o. [29] E.R. Nelsen A.C. Brezny C.R. Landis Interception and characterization of catalyst species in rhodium bis(diazaphospholane)-catalyzed hydroformylation of octene, vinyl acetate, allyl cyanide, and 1-phenyl-1,3-butadiene ACS Publ. 2015 10.1021/jacs.5b09858 Nelsen, E. R.; Brezny, A. C.; Landis, C. R. Interception and Characterization of Catalyst Species in Rhodium Bis(Diazaphospholane)-Catalyzed Hydroformylation of Octene, Vinyl Acetate, Allyl Cyanide, and 1-Phenyl-1,3-Butadiene. ACS Publ. 2015. DOI: 10.1021/jacs.5b09858. [30] G. Wang M. Jiang B. Fan Z. Sun L. Qian G. Ji L. Ma C. Li Z. Wang G. Long Y. Yang L. Yan Y. Ding Selective association enforced by the confinement effect to boost the regioselectivity of vinyl acetate hydroformylation ACS Catal. 14 21 2024 16014 16024 10.1021/acscatal.4c03932 Wang, G.; Jiang, M.; Fan, B.; Sun, Z.; Qian, L.; Ji, G.; Ma, L.; Li, C.; Wang, Z.; Long, G.; Yang, Y.; Yan, L.; Ding, Y. Selective Association Enforced by the Confinement Effect to Boost the Regioselectivity of Vinyl Acetate Hydroformylation. ACS Catal. 2024, 14 (21), 16014-16024. DOI: 10.1021/acscatal.4c03932. [31] X. Luo D. Tang M. Li Computational investigation of enantio‐ and regioselectivity of rhodium‐catalyzed asymmetric hydroformylation of vinyl formate with CHIRAPHOS‐type ligand Int. J. Quantum Chem 105 2 2005 108 123 10.1002/qua.20696 Luo, X.; Tang, D.; Li, M. Computational Investigation of Enantio‐ and Regioselectivity of Rhodium‐catalyzed Asymmetric Hydroformylation of Vinyl Formate with CHIRAPHOS‐type Ligand. Int. J. Quantum Chem. 2005, 105 (2), 108-123. DOI: 10.1002/qua.20696. [32] M. Mei J. Zhao H. Fang Z. Sun W. Xue H. Fu R. Li H. Chen C. Li C. Yang X. Zheng M. Yuan Highly efficient and linear-selective hydroformylation of allyl acetate under mild conditions regulated by additives Catal. Lett. 2024 10.1007/s10562-024-04720-z Mei, M.; Zhao, J.; Fang, H.; Sun, Z.; Xue, W.; Fu, H.; Li, R.; Chen, H.; Li, C.; Yang, C.; Zheng, X.; Yuan, M. Highly Efficient and Linear-Selective Hydroformylation of Allyl Acetate Under Mild Conditions Regulated by Additives. Catal. Lett. 2024. DOI: 10.1007/s10562-024-04720-z. [33] P. Claus M. Lucas B. Lücke T. Berndt P. Birke Selective hydrogenolysis of methyl and ethyl acetate in the gas phase on copper and supported group VIII metal catalysts Appl. Catal. Gen. 79 1 1991 1 18 10.1016/0926-860X(91)85002-F Claus, P.; Lucas, M.; Lücke, B.; Berndt, T.; Birke, P. Selective Hydrogenolysis of Methyl and Ethyl Acetate in the Gas Phase on Copper and Supported Group VIII Metal Catalysts. Appl. Catal. Gen. 1991, 79 (1), 1-18. DOI: 10.1016/0926-860X(91)85002-F. [34] M. Kitamura M. Tsukamoto Y. Bessho M. Yoshimura U. Kobs M. Widhalm R. Noyori Mechanism of asymmetric hydrogenation of α-(Acylamino)acrylic esters catalyzed by BINAP-ruthenium(II) diacetate J. Am. Chem. Soc. 124 23 2002 6649 6667 10.1021/ja010982n Kitamura, M.; Tsukamoto, M.; Bessho, Y.; Yoshimura, M.; Kobs, U.; Widhalm, M.; Noyori, R. Mechanism of Asymmetric Hydrogenation of α-(Acylamino)Acrylic Esters Catalyzed by BINAP-Ruthenium(II) Diacetate. J. Am. Chem. Soc. 2002, 124 (23), 6649-6667. DOI: 10.1021/ja010982n. [35] F. Neese F. Wennmohs U. Becker C. Riplinger The ORCA quantum chemistry program package J. Chem. Phys. 152 22 2020 224108 10.1063/5.0004608 Neese, F.; Wennmohs, F.; Becker, U.; Riplinger, C. The ORCA Quantum Chemistry Program Package. J. Chem. Phys. 2020, 152 (22), 224108. DOI: 10.1063/5.0004608. [36] F. Neese The ORCA program system WIREs Comput. Mol. Sci. 2 1 2012 73 78 10.1002/wcms.81 Neese, F. The ORCA Program System. WIREs Comput. Mol. Sci. 2012, 2 (1), 73-78. DOI: 10.1002/wcms.81. [37] F. Neese Software update: the ORCA program system, version 4.0 WIREs Comput. Mol. Sci. 8 1 2018 e1327 10.1002/wcms.1327 Neese, F. Software Update: The ORCA Program System, Version 4.0. WIREs Comput. Mol. Sci. 2018, 8 (1), e1327. DOI: 10.1002/wcms.1327. [38] F. Neese Software update: the ORCA program system—version 5.0 WIREs Comput. Mol. Sci. 12 5 2022 e1606 10.1002/wcms.1606 Neese, F. Software Update: The ORCA Program System—Version 5.0. WIREs Comput. Mol. Sci. 2022, 12 (5), e1606. DOI: 10.1002/wcms.1606. [39] Y. Zhao D.G. Truhlar Density functionals with broad applicability in chemistry Acc. Chem. Res. 41 2 2008 157 167 10.1021/ar700111a Zhao, Y.; Truhlar, D. G. Density Functionals with Broad Applicability in Chemistry. Acc. Chem. Res. 2008, 41 (2), 157-167. DOI: 10.1021/ar700111a. [40] Y. Zhao N.E. Schultz D.G. Truhlar Design of density functionals by combining the method of constraint satisfaction with parametrization for thermochemistry, thermochemical kinetics, and noncovalent interactions J. Chem. Theory Comput. 2 2 2006 364 382 10.1021/ct0502763 Zhao, Y.; Schultz, N. E.; Truhlar, D. G. Design of Density Functionals by Combining the Method of Constraint Satisfaction with Parametrization for Thermochemistry, Thermochemical Kinetics, and Noncovalent Interactions. J. Chem. Theory Comput. 2006, 2 (2), 364-382. DOI: 10.1021/ct0502763. [41] Y. Zhao D.G. Truhlar The M06 suite of density functionals for main group thermochemistry, thermochemical kinetics, noncovalent interactions, excited states, and transition elements: two new functionals and systematic testing of four M06-class functionals and 12 other functionals Theor. Chem. Acc. 120 1 2008 215 241 10.1007/s00214-007-0310-x Zhao, Y.; Truhlar, D. G. The M06 Suite of Density Functionals for Main Group Thermochemistry, Thermochemical Kinetics, Noncovalent Interactions, Excited States, and Transition Elements: Two New Functionals and Systematic Testing of Four M06-Class Functionals and 12 Other Functionals. Theor. Chem. Acc. 2008, 120 (1), 215-241. DOI: 10.1007/s00214-007-0310-x. [42] M. Walker A.J.A. Harvey A. Sen C.E.H. Dessent Performance of M06, M06-2X, and M06-HF density functionals for conformationally flexible anionic clusters: M06 functionals perform better than B3LYP for a model system with dispersion and ionic hydrogen-bonding interactions J. Phys. Chem. A 117 47 2013 12590 12600 10.1021/jp408166m Walker, M.; Harvey, A. J. A.; Sen, A.; Dessent, C. E. H. Performance of M06, M06-2X, and M06-HF Density Functionals for Conformationally Flexible Anionic Clusters: M06 Functionals Perform Better than B3LYP for a Model System with Dispersion and Ionic Hydrogen-Bonding Interactions. J. Phys. Chem. A 2013, 117 (47), 12590-12600. DOI: 10.1021/jp408166m. [43] M. Kumar R.V. Chaudhari B. Subramaniam T.A. Jackson Ligand effects on the regioselectivity of rhodium-catalyzed hydroformylation: density functional calculations illuminate the role of long-range noncovalent interactions Organometallics 33 16 2014 4183 4191 10.1021/om500196g Kumar, M.; Chaudhari, R. V.; Subramaniam, B.; Jackson, T. A. Ligand Effects on the Regioselectivity of Rhodium-Catalyzed Hydroformylation: Density Functional Calculations Illuminate the Role of Long-Range Noncovalent Interactions. Organometallics 2014, 33 (16), 4183-4191. DOI: 10.1021/om500196g. [44] Y. Dangat S. Popli R.B. Sunoj Unraveling the importance of noncovalent interactions in asymmetric hydroformylation reactions J. Am. Chem. Soc. 142 40 2020 17079 17092 10.1021/jacs.0c06942 Dangat, Y.; Popli, S.; Sunoj, R. B. Unraveling the Importance of Noncovalent Interactions in Asymmetric Hydroformylation Reactions. J. Am. Chem. Soc. 2020, 142 (40), 17079-17092. DOI: 10.1021/jacs.0c06942. [45] S. Schmidt P. Deglmann P. Hofmann Density functional investigations of the Rh-catalyzed hydroformylation of 1,3-butadiene with bisphosphite ligands ACS Catal. 4 10 2014 3593 3604 10.1021/cs500718v Schmidt, S.; Deglmann, P.; Hofmann, P. Density Functional Investigations of the Rh-Catalyzed Hydroformylation of 1,3-Butadiene with Bisphosphite Ligands. ACS Catal. 2014, 4 (10), 3593-3604. DOI: 10.1021/cs500718v. [46] P.C. Hariharan J.A. Pople The influence of polarization functions on molecular orbital hydrogenation energies Theor. Chim. Acta 28 3 1973 213 222 10.1007/BF00533485 Hariharan, P. C.; Pople, J. A. The Influence of Polarization Functions on Molecular Orbital Hydrogenation Energies. Theor. Chim. Acta 1973, 28 (3), 213-222. DOI: 10.1007/BF00533485. [47] W.J. Hehre R. Ditchfield J.A. Pople Self-consistent molecular orbital methods. XII. Further extensions of gaussian-type basis sets for use in molecular orbital studies of organic molecules J. Chem. Phys. 56 5 1972 2257 2261 10.1063/1.1677527 Hehre, W. J.; Ditchfield, R.; Pople, J. A. Self-Consistent Molecular Orbital Methods. XII. Further Extensions of Gaussian-Type Basis Sets for Use in Molecular Orbital Studies of Organic Molecules. J. Chem. Phys. 1972, 56 (5), 2257-2261. DOI: 10.1063/1.1677527. [48] F. Weigend R. Ahlrichs Balanced basis sets of split valence, triple zeta valence and quadruple zeta valence quality for H to Rn: design and assessment of accuracy Phys. Chem. Chem. Phys. 7 18 2005 3297 3305 10.1039/B508541A Weigend, F.; Ahlrichs, R. Balanced Basis Sets of Split Valence, Triple Zeta Valence and Quadruple Zeta Valence Quality for H to Rn: Design and Assessment of Accuracy. Phys. Chem. Chem. Phys. 2005, 7 (18), 3297-3305. DOI: 10.1039/B508541A. [49] A.V. Marenich C.J. Cramer D.G. Truhlar Universal solvation model based on solute electron density and on a continuum model of the solvent defined by the bulk dielectric constant and atomic surface tensions J. Phys. Chem. B 113 18 2009 6378 6396 10.1021/jp810292n Marenich, A. V.; Cramer, C. J.; Truhlar, D. G. Universal Solvation Model Based on Solute Electron Density and on a Continuum Model of the Solvent Defined by the Bulk Dielectric Constant and Atomic Surface Tensions. J. Phys. Chem. B 2009, 113 (18), 6378-6396. DOI: 10.1021/jp810292n. [50] S. Grimme S. Ehrlich L. Goerigk Effect of the damping function in dispersion corrected density functional theory J. Computational Chem. 32 7 2011 1456 1465 10.1002/jcc.21759 Grimme S.; Ehrlich S.; Goerigk L. Effect of the damping function in dispersion corrected density functional theory. DOI: 10.1002/jcc.21759. [51] S. Grimme J. Antony S. Ehrlich H. Krieg A consistent and accurate Ab initio parametrization of Density Functional Dispersion correction (DFT-D) for the 94 elements H-Pu J. Chem. Phys. 132 15 2010 154104 10.1063/1.3382344 Grimme, S.; Antony, J.; Ehrlich, S.; Krieg, H. A Consistent and Accurate Ab Initio Parametrization of Density Functional Dispersion Correction (DFT-D) for the 94 Elements H-Pu. J. Chem. Phys. 2010, 132 (15), 154104. DOI: 10.1063/1.3382344. [52] T. Lu Q. Chen Shermo: a general code for calculating molecular thermochemistry properties Comput. Theor. Chem. 1200 2021 113249 10.1016/j.comptc.2021.113249 Lu, T.; Chen, Q. Shermo: A General Code for Calculating Molecular Thermochemistry Properties. Comput. Theor. Chem. 2021, 1200, 113249. DOI: 10.1016/j.comptc.2021.113249. [53] CYLview Visualization Software. https://www.cylview.org. [54] T. Lu Q. Chen Interaction region indicator: a simple real space function clearly revealing both chemical bonds and weak interactions Chem.-Methods 1 5 2021 231 239 10.1002/cmtd.202100007 Lu, T.; Chen, Q. Interaction Region Indicator: A Simple Real Space Function Clearly Revealing Both Chemical Bonds and Weak Interactions. Chemistry‐Methods. 2021, 1(5), 231-239. DOI: 10.1002/cmtd.202100007. [55] T. Lu A comprehensive electron wavefunction analysis toolbox for chemists, Multiwfn J. Chem. Phys. 161 8 2024 082503 10.1063/5.0216272 Lu, T. A Comprehensive Electron Wavefunction Analysis Toolbox for Chemists, Multiwfn. J. Chem. Phys. 2024, 161 (8), 082503. DOI: 10.1063/5.0216272. [56] T. Lu F. Chen Multiwfn: a multifunctional wavefunction analyzer J. Comput. Chem. 33 5 2012 580 592 10.1002/jcc.22885 Lu, T.; Chen, F. Multiwfn: A Multifunctional Wavefunction Analyzer. J. Comput. Chem. 2012, 33 (5), 580-592. DOI: 10.1002/jcc.22885. [57] W. Humphrey A. Dalke K. Schulten VMD: visual molecular dynamics J. Mol. Graph. 14 1 1996 33 38 10.1016/0263-7855(96)00018-5 Humphrey, W.; Dalke, A.; Schulten, K. VMD: Visual Molecular Dynamics. J. Mol. Graph. 1996, 14 (1), 33-38. DOI: 10.1016/0263-7855(96)00018-5. [58] A. Poater B. Cosenza A. Correa S. Giudice F. Ragone V. Scarano L. Cavallo Samb V ca: a web application for the calculation of the buried volume of N-heterocyclic carbene ligands Eur. J. Inorg. Chem. 13 2009 1759 1766 10.1002/ejic.200801160 Poater, A.; Cosenza, B.; Correa, A.; Giudice, S.; Ragone, F.; Scarano, V.; Cavallo, L. Samb V ca: A Web Application for the Calculation of the Buried Volume of N-Heterocyclic Carbene Ligands. Eur. J. Inorg. Chem. 2009, (13), 1759-1766. DOI: 10.1002/ejic.200801160. [59] A. Poater F. Ragone S. Giudice C. Costabile R. Dorta S.P. Nolan L. Cavallo Thermodynamics of N-heterocyclic carbene dimerization: the balance of sterics and electronics Organometallics 27 12 2008 2679 2681 10.1021/om8001119 Poater, A.; Ragone, F.; Giudice, S.; Costabile, C.; Dorta, R.; Nolan, S. P.; Cavallo, L. Thermodynamics of N-Heterocyclic Carbene Dimerization: The Balance of Sterics and Electronics. Organometallics. 2008, 27 (12), 2679-2681. DOI: 10.1021/om8001119. [60] A. Poater F. Ragone R. Mariz R. Dorta L. Cavallo Comparing the enantioselective power of steric and electrostatic effects in transition-metal-catalyzed asymmetric synthesis Chem. - Eur. J. 16 48 2010 14348 14353 10.1002/chem.201001938 Poater, A.; Ragone, F.; Mariz, R.; Dorta, R.; Cavallo, L. Comparing the Enantioselective Power of Steric and Electrostatic Effects in Transition‐Metal‐Catalyzed Asymmetric Synthesis. Chem. - Eur. J. 2010, 16 (48), 14348-14353. DOI: 10.1002/chem.201001938. [61] M. Besora F. Maseras Microkinetic modeling in homogeneous catalysis WIREs Comput. Mol. Sci. 8 6 2018 e1372 Besora, M.; Maseras, F. Microkinetic Modeling in Homogeneous Catalysis. WIREs Comput. Mol. Sci. 2018, 8 (6), e1372. DOI: 10.1002/wcms.1372. [62] A.H. Motagamwala J.A. Dumesic Microkinetic modeling: a tool for rational catalyst design Chem. Rev. 2020 10.1021/acs.chemrev.0c00394 Motagamwala, A. H.; Dumesic, J. A. Microkinetic Modeling: A Tool for Rational Catalyst Design. Chem. Rev. 2020. DOI: 10.1021/acs.chemrev.0c00394. [63] S. Siradze J. Poissonnier M. Frøseth R.E. Stensrød R.H. Heyn J.W. Thybaut Kinetics assessment of the homogeneously catalyzed hydroformylation of ethylene on an Rh catalyst Ind. Eng. Chem. Res. 60 46 2021 16665 16681 10.1021/acs.iecr.1c02572 Siradze, S.; Poissonnier, J.; Frøseth, M.; Stensrød, R. E.; Heyn, R. H.; Thybaut, J. W. Kinetics Assessment of the Homogeneously Catalyzed Hydroformylation of Ethylene on an Rh Catalyst. Ind. Eng. Chem. Res. 2021, 60 (46), 16665-16681. DOI: 10.1021/acs.iecr.1c02572. [64] L.E. Rush P.G. Pringle J.N. Harvey Computational kinetics of cobalt‐catalyzed alkene hydroformylation Angew. Chem. 126 33 2014 8816 8820 10.1002/ange.201402115 Rush, L. E.; Pringle, P. G.; Harvey, J. N. Computational Kinetics of Cobalt‐Catalyzed Alkene Hydroformylation. Angew. Chem. 2014, 126 (33), 8816-8820. DOI: 10.1002/ange.201402115. [65] R.J. Rama A. Nova M.C. Nicasio Microkinetic model as a crucial tool for understanding homogeneous catalysis Chem. Cat. Chem. 16 17 2024 e202400224 10.1002/cctc.202400224 Rama, R. J.; Nova, A.; Nicasio, M. C. Microkinetic Model as a Crucial Tool for Understanding Homogeneous Catalysis. ChemCatChem. 2024, 16 (17), e202400224. DOI: 10.1002/cctc.202400224. [66] S. Hoops S. Sahle R. Gauges C. Lee J. Pahle N. Simus M. Singhal L. Xu P. Mendes U. Kummer COPASI-a complex pathway simulator Bioinformatics 22 24 2006 3067 3074 10.1093/bioinformatics/btl485 Hoops, S.; Sahle, S.; Gauges, R.; Lee, C.; Pahle, J.; Simus, N.; Singhal, M.; Xu, L.; Mendes, P.; Kummer, U. COPASI-a COmplex PAthway SImulator. Bioinformatics 2006, 22 (24), 3067-3074. DOI: 10.1093/bioinformatics/btl485. [67] T. Matsubara N. Koga Y. Ding D.G. Musaev K. Morokuma Ab initio MO study of the full cycle of olefin hydroformylation catalyzed by a rhodium complex, RhH(CO)2(PH3)2 Organometallics 16 5 1997 1065 1078 10.1021/om960785a Matsubara, T.; Koga, N.; Ding, Y.; Musaev, D. G.; Morokuma, K. Ab Initio MO Study of the Full Cycle of Olefin Hydroformylation Catalyzed by a Rhodium Complex, RhH(CO)2(PH3)2. Organometallics 1997, 16 (5), 1065-1078. DOI: 10.1021/om960785a. [68] N. Koga S.Q. Jin K. Morokuma Rearrangement through berry pseudorotation and olefin insertion of D8 five-coordinate Rh(H)(C2H4)(CO)2(PH3). An Ab initio MO study J. Am. Chem. Soc. 110 11 1988 3417 3425 10.1021/ja00219a013 Koga, Nobuaki.; Jin, S. Qian.; Morokuma, Keiji. Rearrangement through Berry Pseudorotation and Olefin Insertion of D8 Five-Coordinate Rh(H)(C2H4)(CO)2(PH3). An Ab Initio MO Study. J. Am. Chem. Soc. 1988, 110 (11), 3417-3425. DOI: 10.1021/ja00219a013. [69] R. Lazzaroni R. Settambolo G. Alagona C. Ghio Investigation of alkyl metal intermediate formation in the rhodium-catalyzed hydroformylation: experimental and theoretical approaches Coord. Chem. Rev. 254 5–6 2010 696 706 10.1016/j.ccr.2009.09.032 Lazzaroni, R.; Settambolo, R.; Alagona, G.; Ghio, C. Investigation of Alkyl Metal Intermediate Formation in the Rhodium-Catalyzed Hydroformylation: Experimental and Theoretical Approaches. Coord. Chem. Rev. 2010, 254 (5-6), 696-706. DOI: 10.1016/j.ccr.2009.09.032. [70] M. Matsumoto M. Tamura Rhodium-catalyzed low pressure hydroformylation of substituted terminal olefins. Role of α,ω-bis(diphenylphosphino)alkane in combination with excess triphenylphosphine J. Mol. Catal. 16 2 1982 195 207 10.1016/0304-5102(82)85008-6 Matsumoto, M.; Tamura, M. Rhodium-Catalyzed Low Pressure Hydroformylation of Substituted Terminal Olefins. Role of α,ω-Bis(Diphenylphosphino)Alkane in Combination with Excess Triphenylphosphine. J. Mol. Catal. 1982, 16 (2), 195-207. DOI: 10.1016/0304-5102(82)85008-6.",
      "scopus-id": "105009710794",
      "coredata": {
        "eid": "1-s2.0-S0021951725003720",
        "dc:description": "The direct hydroformylation of allyl acetate followed by hydrogenation represents a novel route for 1,4-butanediol production with significant industrial potential and market prospects. In this study, we employed Density Functional Theory (DFT) and Microkinetic Modeling (MKM) to comparatively investigate two representative Rh-based catalysts with distinct product distributions (RhH(CO)2(Xantphos) and RhH(CO)2(PPh3)2), systematically elucidate the mechanisms for improving the selectivity and regulation principles of this reaction. Theoretical calculations reveal that the regioselectivity is primarily determined by the olefin insertion step. Xantphos ligand reduces the electron density of the Rh center and provides a sterically favorable environment for the linear pathway. Additionally, the acetoxy group in allyl acetate exerts a repulsive interaction with the Rh-carbonyl, directing Rh to preferentially coordinate with the β-C, thereby significantly enhancing the formation of 4-acetoxybutyraldehyde. In contrast, the PPh3-modified Rh catalyst exhibits lower steric hindrance along the branched pathway, thus favoring the formation of branched aldehydes. Experimental investigations demonstrate that hydrogenolysis of allyl acetate predominantly occurs at the uncoordinated Rh sites, and the elevated H2 concentration and higher temperature will promote this side reaction. For Xantphos, MKM simulations indicate that the increased pressure and optimized syngas composition (CO/H2 = 0.5–2) can lead to linear aldehyde selectivity exceeding 98 %. Similarly, in the PPh3 system, high pressure and a near-equimolar syngas ratio favor the formation of branched aldehyde. These findings unveil the intrinsic relationships between ligand design, reaction conditions and selectivity, establishing a structure–activity framework for hydroformylation of acetoxy-functionalized olefins. This work provides critical theoretical guidance for the rational design of efficient catalysts and advances the development of scalable 1,4-BDO production process.",
        "openArchiveArticle": "false",
        "prism:coverDate": "2025-10-31",
        "openaccessUserLicense": null,
        "prism:aggregationType": "Journal",
        "prism:url": "https://api.elsevier.com/content/article/pii/S0021951725003720",
        "dc:creator": [
          {
            "@_fa": "true",
            "$": "Zhang, Minhua"
          },
          {
            "@_fa": "true",
            "$": "Sun, Yuzhe"
          },
          {
            "@_fa": "true",
            "$": "Wang, Lingtao"
          },
          {
            "@_fa": "true",
            "$": "Gong, Hao"
          },
          {
            "@_fa": "true",
            "$": "Chen, Yifei"
          }
        ],
        "link": [
          {
            "@_fa": "true",
            "@rel": "self",
            "@href": "https://api.elsevier.com/content/article/pii/S0021951725003720"
          },
          {
            "@_fa": "true",
            "@rel": "scidir",
            "@href": "https://www.sciencedirect.com/science/article/pii/S0021951725003720"
          }
        ],
        "dc:format": "application/json",
        "openaccessType": null,
        "pii": "S0021-9517(25)00372-0",
        "prism:volume": "450",
        "articleNumber": "116307",
        "prism:publisher": "Elsevier Inc. All rights are reserved, including those for text and data mining, AI training, and similar technologies.",
        "dc:title": "The microscopic mechanisms and essential factors governing regioselectivity in Rh-catalyzed hydroformylation of allyl acetate via DFT and microkinetic modeling",
        "prism:copyright": "© 2025 Elsevier Inc. All rights are reserved, including those for text and data mining, AI training, and similar technologies.",
        "openaccess": "0",
        "prism:issn": "00219517",
        "dcterms:subject": [
          {
            "@_fa": "true",
            "$": "Allyl acetate"
          },
          {
            "@_fa": "true",
            "$": "Hydroformylation"
          },
          {
            "@_fa": "true",
            "$": "Xantphos"
          },
          {
            "@_fa": "true",
            "$": "DFT"
          },
          {
            "@_fa": "true",
            "$": "MKM"
          }
        ],
        "openaccessArticle": "false",
        "prism:publicationName": "Journal of Catalysis",
        "openaccessSponsorType": null,
        "prism:pageRange": "116307",
        "pubType": "fla",
        "prism:coverDisplayDate": "October 2025",
        "prism:doi": "10.1016/j.jcat.2025.116307",
        "prism:startingPage": "116307",
        "dc:identifier": "doi:10.1016/j.jcat.2025.116307",
        "openaccessSponsorName": null
      },
      "objects": {
        "object": [
          {
            "@category": "standard",
            "@height": "356",
            "@width": "625",
            "@_fa": "true",
            "$": "https://api.elsevier.com/content/object/eid/1-s2.0-S0021951725003720-sc1.jpg?httpAccept=%2A%2F%2A",
            "@multimediatype": "JPEG image file",
            "@type": "IMAGE-DOWNSAMPLED",
            "@size": "26826",
            "@ref": "sc1",
            "@mimetype": "image/jpeg"
          },
          {
            "@category": "standard",
            "@height": "420",
            "@width": "714",
            "@_fa": "true",
            "$": "https://api.elsevier.com/content/object/eid/1-s2.0-S0021951725003720-gr3.jpg?httpAccept=%2A%2F%2A",
            "@multimediatype": "JPEG image file",
            "@type": "IMAGE-DOWNSAMPLED",
            "@size": "72223",
            "@ref": "gr3",
            "@mimetype": "image/jpeg"
          },
          {
            "@category": "standard",
            "@height": "451",
            "@width": "715",
            "@_fa": "true",
            "$": "https://api.elsevier.com/content/object/eid/1-s2.0-S0021951725003720-sc2.jpg?httpAccept=%2A%2F%2A",
            "@multimediatype": "JPEG image file",
            "@type": "IMAGE-DOWNSAMPLED",
            "@size": "59268",
            "@ref": "sc2",
            "@mimetype": "image/jpeg"
          },
          {
            "@category": "standard",
            "@height": "293",
            "@width": "802",
            "@_fa": "true",
            "$": "https://api.elsevier.com/content/object/eid/1-s2.0-S0021951725003720-gr2.jpg?httpAccept=%2A%2F%2A",
            "@multimediatype": "JPEG image file",
            "@type": "IMAGE-DOWNSAMPLED",
            "@size": "46706",
            "@ref": "gr2",
            "@mimetype": "image/jpeg"
          },
          {
            "@category": "standard",
            "@height": "646",
            "@width": "701",
            "@_fa": "true",
            "$": "https://api.elsevier.com/content/object/eid/1-s2.0-S0021951725003720-gr1.jpg?httpAccept=%2A%2F%2A",
            "@multimediatype": "JPEG image file",
            "@type": "IMAGE-DOWNSAMPLED",
            "@size": "105033",
            "@ref": "gr1",
            "@mimetype": "image/jpeg"
          },
          {
            "@category": "standard",
            "@height": "335",
            "@width": "383",
            "@_fa": "true",
            "$": "https://api.elsevier.com/content/object/eid/1-s2.0-S0021951725003720-gr7.jpg?httpAccept=%2A%2F%2A",
            "@multimediatype": "JPEG image file",
            "@type": "IMAGE-DOWNSAMPLED",
            "@size": "35972",
            "@ref": "gr7",
            "@mimetype": "image/jpeg"
          },
          {
            "@category": "standard",
            "@height": "282",
            "@width": "625",
            "@_fa": "true",
            "$": "https://api.elsevier.com/content/object/eid/1-s2.0-S0021951725003720-gr6.jpg?httpAccept=%2A%2F%2A",
            "@multimediatype": "JPEG image file",
            "@type": "IMAGE-DOWNSAMPLED",
            "@size": "64891",
            "@ref": "gr6",
            "@mimetype": "image/jpeg"
          },
          {
            "@category": "standard",
            "@height": "318",
            "@width": "535",
            "@_fa": "true",
            "$": "https://api.elsevier.com/content/object/eid/1-s2.0-S0021951725003720-gr5.jpg?httpAccept=%2A%2F%2A",
            "@multimediatype": "JPEG image file",
            "@type": "IMAGE-DOWNSAMPLED",
            "@size": "34543",
            "@ref": "gr5",
            "@mimetype": "image/jpeg"
          },
          {
            "@category": "standard",
            "@height": "167",
            "@width": "383",
            "@_fa": "true",
            "$": "https://api.elsevier.com/content/object/eid/1-s2.0-S0021951725003720-gr4.jpg?httpAccept=%2A%2F%2A",
            "@multimediatype": "JPEG image file",
            "@type": "IMAGE-DOWNSAMPLED",
            "@size": "22837",
            "@ref": "gr4",
            "@mimetype": "image/jpeg"
          },
          {
            "@category": "standard",
            "@height": "458",
            "@width": "803",
            "@_fa": "true",
            "$": "https://api.elsevier.com/content/object/eid/1-s2.0-S0021951725003720-gr9.jpg?httpAccept=%2A%2F%2A",
            "@multimediatype": "JPEG image file",
            "@type": "IMAGE-DOWNSAMPLED",
            "@size": "105418",
            "@ref": "gr9",
            "@mimetype": "image/jpeg"
          },
          {
            "@category": "standard",
            "@height": "291",
            "@width": "625",
            "@_fa": "true",
            "$": "https://api.elsevier.com/content/object/eid/1-s2.0-S0021951725003720-gr8.jpg?httpAccept=%2A%2F%2A",
            "@multimediatype": "JPEG image file",
            "@type": "IMAGE-DOWNSAMPLED",
            "@size": "54834",
            "@ref": "gr8",
            "@mimetype": "image/jpeg"
          },
          {
            "@category": "standard",
            "@height": "200",
            "@width": "355",
            "@_fa": "true",
            "$": "https://api.elsevier.com/content/object/eid/1-s2.0-S0021951725003720-ga1.jpg?httpAccept=%2A%2F%2A",
            "@multimediatype": "JPEG image file",
            "@type": "IMAGE-DOWNSAMPLED",
            "@size": "20404",
            "@ref": "ga1",
            "@mimetype": "image/jpeg"
          },
          {
            "@category": "standard",
            "@height": "309",
            "@width": "803",
            "@_fa": "true",
            "$": "https://api.elsevier.com/content/object/eid/1-s2.0-S0021951725003720-gr13.jpg?httpAccept=%2A%2F%2A",
            "@multimediatype": "JPEG image file",
            "@type": "IMAGE-DOWNSAMPLED",
            "@size": "62014",
            "@ref": "gr13",
            "@mimetype": "image/jpeg"
          },
          {
            "@category": "standard",
            "@height": "451",
            "@width": "746",
            "@_fa": "true",
            "$": "https://api.elsevier.com/content/object/eid/1-s2.0-S0021951725003720-gr11.jpg?httpAccept=%2A%2F%2A",
            "@multimediatype": "JPEG image file",
            "@type": "IMAGE-DOWNSAMPLED",
            "@size": "58506",
            "@ref": "gr11",
            "@mimetype": "image/jpeg"
          },
          {
            "@category": "standard",
            "@height": "632",
            "@width": "533",
            "@_fa": "true",
            "$": "https://api.elsevier.com/content/object/eid/1-s2.0-S0021951725003720-gr12.jpg?httpAccept=%2A%2F%2A",
            "@multimediatype": "JPEG image file",
            "@type": "IMAGE-DOWNSAMPLED",
            "@size": "45736",
            "@ref": "gr12",
            "@mimetype": "image/jpeg"
          },
          {
            "@category": "standard",
            "@height": "693",
            "@width": "535",
            "@_fa": "true",
            "$": "https://api.elsevier.com/content/object/eid/1-s2.0-S0021951725003720-gr10.jpg?httpAccept=%2A%2F%2A",
            "@multimediatype": "JPEG image file",
            "@type": "IMAGE-DOWNSAMPLED",
            "@size": "72384",
            "@ref": "gr10",
            "@mimetype": "image/jpeg"
          },
          {
            "@category": "thumbnail",
            "@height": "125",
            "@width": "219",
            "@_fa": "true",
            "$": "https://api.elsevier.com/content/object/eid/1-s2.0-S0021951725003720-sc1.sml?httpAccept=%2A%2F%2A",
            "@multimediatype": "GIF image file",
            "@type": "IMAGE-THUMBNAIL",
            "@size": "3407",
            "@ref": "sc1",
            "@mimetype": "image/gif"
          },
          {
            "@category": "thumbnail",
            "@height": "129",
            "@width": "219",
            "@_fa": "true",
            "$": "https://api.elsevier.com/content/object/eid/1-s2.0-S0021951725003720-gr3.sml?httpAccept=%2A%2F%2A",
            "@multimediatype": "GIF image file",
            "@type": "IMAGE-THUMBNAIL",
            "@size": "9294",
            "@ref": "gr3",
            "@mimetype": "image/gif"
          },
          {
            "@category": "thumbnail",
            "@height": "138",
            "@width": "219",
            "@_fa": "true",
            "$": "https://api.elsevier.com/content/object/eid/1-s2.0-S0021951725003720-sc2.sml?httpAccept=%2A%2F%2A",
            "@multimediatype": "GIF image file",
            "@type": "IMAGE-THUMBNAIL",
            "@size": "7168",
            "@ref": "sc2",
            "@mimetype": "image/gif"
          },
          {
            "@category": "thumbnail",
            "@height": "80",
            "@width": "219",
            "@_fa": "true",
            "$": "https://api.elsevier.com/content/object/eid/1-s2.0-S0021951725003720-gr2.sml?httpAccept=%2A%2F%2A",
            "@multimediatype": "GIF image file",
            "@type": "IMAGE-THUMBNAIL",
            "@size": "5287",
            "@ref": "gr2",
            "@mimetype": "image/gif"
          },
          {
            "@category": "thumbnail",
            "@height": "164",
            "@width": "178",
            "@_fa": "true",
            "$": "https://api.elsevier.com/content/object/eid/1-s2.0-S0021951725003720-gr1.sml?httpAccept=%2A%2F%2A",
            "@multimediatype": "GIF image file",
            "@type": "IMAGE-THUMBNAIL",
            "@size": "13211",
            "@ref": "gr1",
            "@mimetype": "image/gif"
          },
          {
            "@category": "thumbnail",
            "@height": "164",
            "@width": "188",
            "@_fa": "true",
            "$": "https://api.elsevier.com/content/object/eid/1-s2.0-S0021951725003720-gr7.sml?httpAccept=%2A%2F%2A",
            "@multimediatype": "GIF image file",
            "@type": "IMAGE-THUMBNAIL",
            "@size": "11992",
            "@ref": "gr7",
            "@mimetype": "image/gif"
          },
          {
            "@category": "thumbnail",
            "@height": "99",
            "@width": "219",
            "@_fa": "true",
            "$": "https://api.elsevier.com/content/object/eid/1-s2.0-S0021951725003720-gr6.sml?httpAccept=%2A%2F%2A",
            "@multimediatype": "GIF image file",
            "@type": "IMAGE-THUMBNAIL",
            "@size": "13107",
            "@ref": "gr6",
            "@mimetype": "image/gif"
          },
          {
            "@category": "thumbnail",
            "@height": "130",
            "@width": "219",
            "@_fa": "true",
            "$": "https://api.elsevier.com/content/object/eid/1-s2.0-S0021951725003720-gr5.sml?httpAccept=%2A%2F%2A",
            "@multimediatype": "GIF image file",
            "@type": "IMAGE-THUMBNAIL",
            "@size": "7760",
            "@ref": "gr5",
            "@mimetype": "image/gif"
          },
          {
            "@category": "thumbnail",
            "@height": "96",
            "@width": "219",
            "@_fa": "true",
            "$": "https://api.elsevier.com/content/object/eid/1-s2.0-S0021951725003720-gr4.sml?httpAccept=%2A%2F%2A",
            "@multimediatype": "GIF image file",
            "@type": "IMAGE-THUMBNAIL",
            "@size": "12390",
            "@ref": "gr4",
            "@mimetype": "image/gif"
          },
          {
            "@category": "thumbnail",
            "@height": "125",
            "@width": "219",
            "@_fa": "true",
            "$": "https://api.elsevier.com/content/object/eid/1-s2.0-S0021951725003720-gr9.sml?httpAccept=%2A%2F%2A",
            "@multimediatype": "GIF image file",
            "@type": "IMAGE-THUMBNAIL",
            "@size": "15522",
            "@ref": "gr9",
            "@mimetype": "image/gif"
          },
          {
            "@category": "thumbnail",
            "@height": "102",
            "@width": "219",
            "@_fa": "true",
            "$": "https://api.elsevier.com/content/object/eid/1-s2.0-S0021951725003720-gr8.sml?httpAccept=%2A%2F%2A",
            "@multimediatype": "GIF image file",
            "@type": "IMAGE-THUMBNAIL",
            "@size": "8423",
            "@ref": "gr8",
            "@mimetype": "image/gif"
          },
          {
            "@category": "thumbnail",
            "@height": "123",
            "@width": "219",
            "@_fa": "true",
            "$": "https://api.elsevier.com/content/object/eid/1-s2.0-S0021951725003720-ga1.sml?httpAccept=%2A%2F%2A",
            "@multimediatype": "GIF image file",
            "@type": "IMAGE-THUMBNAIL",
            "@size": "18999",
            "@ref": "ga1",
            "@mimetype": "image/gif"
          },
          {
            "@category": "thumbnail",
            "@height": "84",
            "@width": "219",
            "@_fa": "true",
            "$": "https://api.elsevier.com/content/object/eid/1-s2.0-S0021951725003720-gr13.sml?httpAccept=%2A%2F%2A",
            "@multimediatype": "GIF image file",
            "@type": "IMAGE-THUMBNAIL",
            "@size": "9118",
            "@ref": "gr13",
            "@mimetype": "image/gif"
          },
          {
            "@category": "thumbnail",
            "@height": "132",
            "@width": "219",
            "@_fa": "true",
            "$": "https://api.elsevier.com/content/object/eid/1-s2.0-S0021951725003720-gr11.sml?httpAccept=%2A%2F%2A",
            "@multimediatype": "GIF image file",
            "@type": "IMAGE-THUMBNAIL",
            "@size": "7781",
            "@ref": "gr11",
            "@mimetype": "image/gif"
          },
          {
            "@category": "thumbnail",
            "@height": "164",
            "@width": "138",
            "@_fa": "true",
            "$": "https://api.elsevier.com/content/object/eid/1-s2.0-S0021951725003720-gr12.sml?httpAccept=%2A%2F%2A",
            "@multimediatype": "GIF image file",
            "@type": "IMAGE-THUMBNAIL",
            "@size": "7700",
            "@ref": "gr12",
            "@mimetype": "image/gif"
          },
          {
            "@category": "thumbnail",
            "@height": "163",
            "@width": "126",
            "@_fa": "true",
            "$": "https://api.elsevier.com/content/object/eid/1-s2.0-S0021951725003720-gr10.sml?httpAccept=%2A%2F%2A",
            "@multimediatype": "GIF image file",
            "@type": "IMAGE-THUMBNAIL",
            "@size": "6337",
            "@ref": "gr10",
            "@mimetype": "image/gif"
          },
          {
            "@category": "high",
            "@height": "1350",
            "@width": "2368",
            "@_fa": "true",
            "$": "https://api.elsevier.com/content/object/eid/1-s2.0-S0021951725003720-sc1_lrg.jpg?httpAccept=%2A%2F%2A",
            "@multimediatype": "JPEG image file",
            "@type": "IMAGE-HIGH-RES",
            "@size": "108954",
            "@ref": "sc1",
            "@mimetype": "image/jpeg"
          },
          {
            "@category": "high",
            "@height": "1612",
            "@width": "2738",
            "@_fa": "true",
            "$": "https://api.elsevier.com/content/object/eid/1-s2.0-S0021951725003720-gr3_lrg.jpg?httpAccept=%2A%2F%2A",
            "@multimediatype": "JPEG image file",
            "@type": "IMAGE-HIGH-RES",
            "@size": "310301",
            "@ref": "gr3",
            "@mimetype": "image/jpeg"
          },
          {
            "@category": "high",
            "@height": "1493",
            "@width": "2367",
            "@_fa": "true",
            "$": "https://api.elsevier.com/content/object/eid/1-s2.0-S0021951725003720-sc2_lrg.jpg?httpAccept=%2A%2F%2A",
            "@multimediatype": "JPEG image file",
            "@type": "IMAGE-HIGH-RES",
            "@size": "213532",
            "@ref": "sc2",
            "@mimetype": "image/jpeg"
          },
          {
            "@category": "high",
            "@height": "1164",
            "@width": "3181",
            "@_fa": "true",
            "$": "https://api.elsevier.com/content/object/eid/1-s2.0-S0021951725003720-gr2_lrg.jpg?httpAccept=%2A%2F%2A",
            "@multimediatype": "JPEG image file",
            "@type": "IMAGE-HIGH-RES",
            "@size": "212763",
            "@ref": "gr2",
            "@mimetype": "image/jpeg"
          },
          {
            "@category": "high",
            "@height": "2862",
            "@width": "3106",
            "@_fa": "true",
            "$": "https://api.elsevier.com/content/object/eid/1-s2.0-S0021951725003720-gr1_lrg.jpg?httpAccept=%2A%2F%2A",
            "@multimediatype": "JPEG image file",
            "@type": "IMAGE-HIGH-RES",
            "@size": "504563",
            "@ref": "gr1",
            "@mimetype": "image/jpeg"
          },
          {
            "@category": "high",
            "@height": "1484",
            "@width": "1699",
            "@_fa": "true",
            "$": "https://api.elsevier.com/content/object/eid/1-s2.0-S0021951725003720-gr7_lrg.jpg?httpAccept=%2A%2F%2A",
            "@multimediatype": "JPEG image file",
            "@type": "IMAGE-HIGH-RES",
            "@size": "184499",
            "@ref": "gr7",
            "@mimetype": "image/jpeg"
          },
          {
            "@category": "high",
            "@height": "1070",
            "@width": "2368",
            "@_fa": "true",
            "$": "https://api.elsevier.com/content/object/eid/1-s2.0-S0021951725003720-gr6_lrg.jpg?httpAccept=%2A%2F%2A",
            "@multimediatype": "JPEG image file",
            "@type": "IMAGE-HIGH-RES",
            "@size": "306509",
            "@ref": "gr6",
            "@mimetype": "image/jpeg"
          },
          {
            "@category": "high",
            "@height": "1409",
            "@width": "2368",
            "@_fa": "true",
            "$": "https://api.elsevier.com/content/object/eid/1-s2.0-S0021951725003720-gr5_lrg.jpg?httpAccept=%2A%2F%2A",
            "@multimediatype": "JPEG image file",
            "@type": "IMAGE-HIGH-RES",
            "@size": "168627",
            "@ref": "gr5",
            "@mimetype": "image/jpeg"
          },
          {
            "@category": "high",
            "@height": "618",
            "@width": "1415",
            "@_fa": "true",
            "$": "https://api.elsevier.com/content/object/eid/1-s2.0-S0021951725003720-gr4_lrg.jpg?httpAccept=%2A%2F%2A",
            "@multimediatype": "JPEG image file",
            "@type": "IMAGE-HIGH-RES",
            "@size": "93658",
            "@ref": "gr4",
            "@mimetype": "image/jpeg"
          },
          {
            "@category": "high",
            "@height": "1730",
            "@width": "3035",
            "@_fa": "true",
            "$": "https://api.elsevier.com/content/object/eid/1-s2.0-S0021951725003720-gr9_lrg.jpg?httpAccept=%2A%2F%2A",
            "@multimediatype": "JPEG image file",
            "@type": "IMAGE-HIGH-RES",
            "@size": "470310",
            "@ref": "gr9",
            "@mimetype": "image/jpeg"
          },
          {
            "@category": "high",
            "@height": "1099",
            "@width": "2362",
            "@_fa": "true",
            "$": "https://api.elsevier.com/content/object/eid/1-s2.0-S0021951725003720-gr8_lrg.jpg?httpAccept=%2A%2F%2A",
            "@multimediatype": "JPEG image file",
            "@type": "IMAGE-HIGH-RES",
            "@size": "223971",
            "@ref": "gr8",
            "@mimetype": "image/jpeg"
          },
          {
            "@category": "high",
            "@height": "886",
            "@width": "1572",
            "@_fa": "true",
            "$": "https://api.elsevier.com/content/object/eid/1-s2.0-S0021951725003720-ga1_lrg.jpg?httpAccept=%2A%2F%2A",
            "@multimediatype": "JPEG image file",
            "@type": "IMAGE-HIGH-RES",
            "@size": "125334",
            "@ref": "ga1",
            "@mimetype": "image/jpeg"
          },
          {
            "@category": "high",
            "@height": "1274",
            "@width": "3314",
            "@_fa": "true",
            "$": "https://api.elsevier.com/content/object/eid/1-s2.0-S0021951725003720-gr13_lrg.jpg?httpAccept=%2A%2F%2A",
            "@multimediatype": "JPEG image file",
            "@type": "IMAGE-HIGH-RES",
            "@size": "293378",
            "@ref": "gr13",
            "@mimetype": "image/jpeg"
          },
          {
            "@category": "high",
            "@height": "1996",
            "@width": "3305",
            "@_fa": "true",
            "$": "https://api.elsevier.com/content/object/eid/1-s2.0-S0021951725003720-gr11_lrg.jpg?httpAccept=%2A%2F%2A",
            "@multimediatype": "JPEG image file",
            "@type": "IMAGE-HIGH-RES",
            "@size": "267474",
            "@ref": "gr11",
            "@mimetype": "image/jpeg"
          },
          {
            "@category": "high",
            "@height": "1680",
            "@width": "1417",
            "@_fa": "true",
            "$": "https://api.elsevier.com/content/object/eid/1-s2.0-S0021951725003720-gr12_lrg.jpg?httpAccept=%2A%2F%2A",
            "@multimediatype": "JPEG image file",
            "@type": "IMAGE-HIGH-RES",
            "@size": "120452",
            "@ref": "gr12",
            "@mimetype": "image/jpeg"
          },
          {
            "@category": "high",
            "@height": "3068",
            "@width": "2368",
            "@_fa": "true",
            "$": "https://api.elsevier.com/content/object/eid/1-s2.0-S0021951725003720-gr10_lrg.jpg?httpAccept=%2A%2F%2A",
            "@multimediatype": "JPEG image file",
            "@type": "IMAGE-HIGH-RES",
            "@size": "345919",
            "@ref": "gr10",
            "@mimetype": "image/jpeg"
          },
          {
            "@category": "standard",
            "@_fa": "true",
            "$": "https://api.elsevier.com/content/object/eid/1-s2.0-S0021951725003720-mmc1.docx?httpAccept=%2A%2F%2A",
            "@multimediatype": "Microsoft Word file",
            "@type": "APPLICATION",
            "@size": "3824586",
            "@ref": "mmc1",
            "@mimetype": "application/word"
          },
          {
            "@category": "thumbnail",
            "@_fa": "true",
            "$": "https://api.elsevier.com/content/object/eid/1-s2.0-S0021951725003720-si1.svg?httpAccept=%2A%2F%2A",
            "@multimediatype": "Scalable Vector Graphics file",
            "@type": "ALTIMG",
            "@size": "3212",
            "@ref": "si1",
            "@mimetype": "image/svg+xml"
          },
          {
            "@category": "thumbnail",
            "@_fa": "true",
            "$": "https://api.elsevier.com/content/object/eid/1-s2.0-S0021951725003720-si10.svg?httpAccept=%2A%2F%2A",
            "@multimediatype": "Scalable Vector Graphics file",
            "@type": "ALTIMG",
            "@size": "1813",
            "@ref": "si10",
            "@mimetype": "image/svg+xml"
          },
          {
            "@category": "thumbnail",
            "@_fa": "true",
            "$": "https://api.elsevier.com/content/object/eid/1-s2.0-S0021951725003720-si11.svg?httpAccept=%2A%2F%2A",
            "@multimediatype": "Scalable Vector Graphics file",
            "@type": "ALTIMG",
            "@size": "5220",
            "@ref": "si11",
            "@mimetype": "image/svg+xml"
          },
          {
            "@category": "thumbnail",
            "@_fa": "true",
            "$": "https://api.elsevier.com/content/object/eid/1-s2.0-S0021951725003720-si12.svg?httpAccept=%2A%2F%2A",
            "@multimediatype": "Scalable Vector Graphics file",
            "@type": "ALTIMG",
            "@size": "18943",
            "@ref": "si12",
            "@mimetype": "image/svg+xml"
          },
          {
            "@category": "thumbnail",
            "@_fa": "true",
            "$": "https://api.elsevier.com/content/object/eid/1-s2.0-S0021951725003720-si13.svg?httpAccept=%2A%2F%2A",
            "@multimediatype": "Scalable Vector Graphics file",
            "@type": "ALTIMG",
            "@size": "947",
            "@ref": "si13",
            "@mimetype": "image/svg+xml"
          },
          {
            "@category": "thumbnail",
            "@_fa": "true",
            "$": "https://api.elsevier.com/content/object/eid/1-s2.0-S0021951725003720-si14.svg?httpAccept=%2A%2F%2A",
            "@multimediatype": "Scalable Vector Graphics file",
            "@type": "ALTIMG",
            "@size": "3064",
            "@ref": "si14",
            "@mimetype": "image/svg+xml"
          },
          {
            "@category": "thumbnail",
            "@_fa": "true",
            "$": "https://api.elsevier.com/content/object/eid/1-s2.0-S0021951725003720-si15.svg?httpAccept=%2A%2F%2A",
            "@multimediatype": "Scalable Vector Graphics file",
            "@type": "ALTIMG",
            "@size": "2697",
            "@ref": "si15",
            "@mimetype": "image/svg+xml"
          },
          {
            "@category": "thumbnail",
            "@_fa": "true",
            "$": "https://api.elsevier.com/content/object/eid/1-s2.0-S0021951725003720-si16.svg?httpAccept=%2A%2F%2A",
            "@multimediatype": "Scalable Vector Graphics file",
            "@type": "ALTIMG",
            "@size": "9475",
            "@ref": "si16",
            "@mimetype": "image/svg+xml"
          },
          {
            "@category": "thumbnail",
            "@_fa": "true",
            "$": "https://api.elsevier.com/content/object/eid/1-s2.0-S0021951725003720-si17.svg?httpAccept=%2A%2F%2A",
            "@multimediatype": "Scalable Vector Graphics file",
            "@type": "ALTIMG",
            "@size": "3058",
            "@ref": "si17",
            "@mimetype": "image/svg+xml"
          },
          {
            "@category": "thumbnail",
            "@_fa": "true",
            "$": "https://api.elsevier.com/content/object/eid/1-s2.0-S0021951725003720-si18.svg?httpAccept=%2A%2F%2A",
            "@multimediatype": "Scalable Vector Graphics file",
            "@type": "ALTIMG",
            "@size": "14901",
            "@ref": "si18",
            "@mimetype": "image/svg+xml"
          },
          {
            "@category": "thumbnail",
            "@_fa": "true",
            "$": "https://api.elsevier.com/content/object/eid/1-s2.0-S0021951725003720-si19.svg?httpAccept=%2A%2F%2A",
            "@multimediatype": "Scalable Vector Graphics file",
            "@type": "ALTIMG",
            "@size": "19890",
            "@ref": "si19",
            "@mimetype": "image/svg+xml"
          },
          {
            "@category": "thumbnail",
            "@_fa": "true",
            "$": "https://api.elsevier.com/content/object/eid/1-s2.0-S0021951725003720-si2.svg?httpAccept=%2A%2F%2A",
            "@multimediatype": "Scalable Vector Graphics file",
            "@type": "ALTIMG",
            "@size": "2383",
            "@ref": "si2",
            "@mimetype": "image/svg+xml"
          },
          {
            "@category": "thumbnail",
            "@_fa": "true",
            "$": "https://api.elsevier.com/content/object/eid/1-s2.0-S0021951725003720-si20.svg?httpAccept=%2A%2F%2A",
            "@multimediatype": "Scalable Vector Graphics file",
            "@type": "ALTIMG",
            "@size": "7207",
            "@ref": "si20",
            "@mimetype": "image/svg+xml"
          },
          {
            "@category": "thumbnail",
            "@_fa": "true",
            "$": "https://api.elsevier.com/content/object/eid/1-s2.0-S0021951725003720-si21.svg?httpAccept=%2A%2F%2A",
            "@multimediatype": "Scalable Vector Graphics file",
            "@type": "ALTIMG",
            "@size": "4887",
            "@ref": "si21",
            "@mimetype": "image/svg+xml"
          },
          {
            "@category": "thumbnail",
            "@_fa": "true",
            "$": "https://api.elsevier.com/content/object/eid/1-s2.0-S0021951725003720-si22.svg?httpAccept=%2A%2F%2A",
            "@multimediatype": "Scalable Vector Graphics file",
            "@type": "ALTIMG",
            "@size": "5599",
            "@ref": "si22",
            "@mimetype": "image/svg+xml"
          },
          {
            "@category": "thumbnail",
            "@_fa": "true",
            "$": "https://api.elsevier.com/content/object/eid/1-s2.0-S0021951725003720-si23.svg?httpAccept=%2A%2F%2A",
            "@multimediatype": "Scalable Vector Graphics file",
            "@type": "ALTIMG",
            "@size": "9304",
            "@ref": "si23",
            "@mimetype": "image/svg+xml"
          },
          {
            "@category": "thumbnail",
            "@_fa": "true",
            "$": "https://api.elsevier.com/content/object/eid/1-s2.0-S0021951725003720-si24.svg?httpAccept=%2A%2F%2A",
            "@multimediatype": "Scalable Vector Graphics file",
            "@type": "ALTIMG",
            "@size": "2699",
            "@ref": "si24",
            "@mimetype": "image/svg+xml"
          },
          {
            "@category": "thumbnail",
            "@_fa": "true",
            "$": "https://api.elsevier.com/content/object/eid/1-s2.0-S0021951725003720-si25.svg?httpAccept=%2A%2F%2A",
            "@multimediatype": "Scalable Vector Graphics file",
            "@type": "ALTIMG",
            "@size": "2919",
            "@ref": "si25",
            "@mimetype": "image/svg+xml"
          },
          {
            "@category": "thumbnail",
            "@_fa": "true",
            "$": "https://api.elsevier.com/content/object/eid/1-s2.0-S0021951725003720-si3.svg?httpAccept=%2A%2F%2A",
            "@multimediatype": "Scalable Vector Graphics file",
            "@type": "ALTIMG",
            "@size": "7331",
            "@ref": "si3",
            "@mimetype": "image/svg+xml"
          },
          {
            "@category": "thumbnail",
            "@_fa": "true",
            "$": "https://api.elsevier.com/content/object/eid/1-s2.0-S0021951725003720-si4.svg?httpAccept=%2A%2F%2A",
            "@multimediatype": "Scalable Vector Graphics file",
            "@type": "ALTIMG",
            "@size": "7329",
            "@ref": "si4",
            "@mimetype": "image/svg+xml"
          },
          {
            "@category": "thumbnail",
            "@_fa": "true",
            "$": "https://api.elsevier.com/content/object/eid/1-s2.0-S0021951725003720-si5.svg?httpAccept=%2A%2F%2A",
            "@multimediatype": "Scalable Vector Graphics file",
            "@type": "ALTIMG",
            "@size": "4016",
            "@ref": "si5",
            "@mimetype": "image/svg+xml"
          },
          {
            "@category": "thumbnail",
            "@_fa": "true",
            "$": "https://api.elsevier.com/content/object/eid/1-s2.0-S0021951725003720-si6.svg?httpAccept=%2A%2F%2A",
            "@multimediatype": "Scalable Vector Graphics file",
            "@type": "ALTIMG",
            "@size": "4418",
            "@ref": "si6",
            "@mimetype": "image/svg+xml"
          },
          {
            "@category": "thumbnail",
            "@_fa": "true",
            "$": "https://api.elsevier.com/content/object/eid/1-s2.0-S0021951725003720-si7.svg?httpAccept=%2A%2F%2A",
            "@multimediatype": "Scalable Vector Graphics file",
            "@type": "ALTIMG",
            "@size": "3905",
            "@ref": "si7",
            "@mimetype": "image/svg+xml"
          },
          {
            "@category": "thumbnail",
            "@_fa": "true",
            "$": "https://api.elsevier.com/content/object/eid/1-s2.0-S0021951725003720-si8.svg?httpAccept=%2A%2F%2A",
            "@multimediatype": "Scalable Vector Graphics file",
            "@type": "ALTIMG",
            "@size": "864",
            "@ref": "si8",
            "@mimetype": "image/svg+xml"
          },
          {
            "@category": "thumbnail",
            "@_fa": "true",
            "$": "https://api.elsevier.com/content/object/eid/1-s2.0-S0021951725003720-si9.svg?httpAccept=%2A%2F%2A",
            "@multimediatype": "Scalable Vector Graphics file",
            "@type": "ALTIMG",
            "@size": "2958",
            "@ref": "si9",
            "@mimetype": "image/svg+xml"
          }
        ]
      },
      "link": {
        "@rel": "abstract",
        "@href": "https://api.elsevier.com/content/abstract/scopus_id/105009710794"
      }
    }
  }
}