{
  "metadata": {
    "title": "Preferential CO oxidation (PROX) on LaCoO<ce:inf loc=post>3</ce:inf>–based catalysts: Effect of cobalt oxidation state on selectivity",
    "authors": "; ; ",
    "journal": "Journal of Catalysis",
    "date": "2025-03-31",
    "doi": "10.1016/j.jcat.2025.115973",
    "abstract": "",
    "uri": "https://api.elsevier.com/content/article/pii/S0021951725000387",
    "pii": "S0021951725000387"
  },
  "fulltext": {
    "full-text-retrieval-response": {
      "scopus-eid": "2-s2.0-85217086330",
      "originalText": "serial JL 272561 291210 291744 291809 31 90 Journal of Catalysis JOURNALCATALYSIS 2025-01-20 2025-01-20 2025-02-10 2025-02-10 2025-04-22T20:44:56 1-s2.0-S0021951725000387 S0021-9517(25)00038-7 S0021951725000387 10.1016/j.jcat.2025.115973 S300 S300.1 FULL-TEXT 1-s2.0-S0021951724X00159 2025-04-22T20:38:01.497828Z 0 0 20250301 20250331 2025 2025-01-20T17:05:19.853379Z absattachment articleinfo articlenumber articletitlenorm authfirstinitialnorm authfirstsurnamenorm cid cids contenttype copyright crossmark dateloaded dateloadedtxt datesearch datesort dateupdated dco docsubtype doctype doi eid ewtransactionid fundingbodyid hubeid indexeddate issn issnnorm itemstage itemtransactionid itemweight oauserlicense openaccess openarchive pg pgfirst pii piinorm pubdateend pubdatestart pubdatetxt pubyr sectiontitle sortorder sponsoredaccesstype srctitle srctitlenorm srctype ssids alllist content oa subj subheadings suppl tomb volfirst volissue volumelist webpdf webpdfpagecount yearnav figure table e-component body mmlmath acknowledge affil appendices articletitle auth authfirstini authfull authkeywords authlast grantnumber grantsponsor highlightsabst primabst pubtype ref specialabst 0021-9517 00219517 UNLIMITED AUSHYB2024 true 443 443 C Volume 443 51 115973 115973 115973 202503 March 2025 2025-03-01 2025-03-31 2025 Regular Articles article fla © 2025 The Author(s). Published by Elsevier Inc. PREFERENTIALCOOXIDATIONPROXLACOO3BASEDCATALYSTSEFFECTCOBALTOXIDATIONSTATESELECTIVITY YIGIT N 1 Introduction 2 Experimental 2.1 Catalyst Preparation 2.2 Catalyst characterization by TGA, XRD, BET, HRTEM, and TPR 2.3 Catalytic preferential oxidation of CO (PROX) 3 Results and discussion 3.1 Structural properties (XRD, BET, TEM) 3.2 Reduction behavior (H2-TPR and CO-TPR) 3.3 XRD and TEM of catalyst pretreatment 3.4 PROX performance 4 Conclusions CRediT authorship contribution statement Acknowledgments Appendix A Supplementary material References TENG 1999 355 358 Y NYATHI 2024 T JIMENEZ 2005 69 73 S CRUZ 2023 24961 24975 A NGUYEN 2015 106 114 T ARAUJO 2012 5498 5507 V WANG 2024 L TANGPAKONSAB 2023 1129 1142 P DIBENEDETTO 2013 169 177 A BARBATO 2016 13039 13048 P XIE 2009 746 749 X JANSSON 2002 387 397 J BROQVIST 2002 198 206 P LUKASHUK 2018 8630 8641 L YIGIT 2022 N BAIDYA 2019 19557 19571 T JANSSON 2000 55 60 J NGUYEN 2015 2346 2353 L KHASU 2017 4806 4817 M WANG 2024 Y LUKASHUK 2016 1 15 L ZHAO 2011 1448 1451 Z BAIKER 1994 268 276 A TEJUCA 1989 237 328 L RUH 2022 31 43 T LARA 2024 K LI 2023 Y NITADORI 1988 621 626 T TANAKA 2005 63 74 H VAZ 2007 81 84 T RIDA 2006 963 968 K SEYFI 2009 306 311 B MAGALHAES 2010 216 224 R FIUZA 2023 25016 25030 T PERENIGUEZ 2017 75 79 R CHAGAS 2020 409 421 C BERGER 2024 T NEAGU 2023 D SCHRENK 2022 F ISLAM 2021 Q RUH 2023 3948 3956 T JI 2019 13840 13844 D KIRKENDALL 1939 186 203 E SHAO 2009 263 267 J ROYER 2005 273 284 S HUANG 2005 360 375 L ENGELMANNPIREZ 2005 315 322 M CHIARELLO 2007 127 136 G CRESPIN 1981 359 370 M EYSSLER 2012 1864 1875 A JANG 2017 6942 6949 J ARAKAWA 1988 215 221 T LUKASHUK 2019 139 147 L HANSTEEN 1998 411 417 O RABEE 2022 A WU 2019 12123 12135 M LINDENTHAL 2021 L NYATHI 2017 269 285 T RICOFRANCES 2016 169 178 S LU 2019 2177 2195 J WANG 2012 110 119 H OMATA 1996 255 267 K YANG 2018 330 335 J YUNG 2008 1 9 M YIGITX2025X115973 YIGITX2025X115973XN Full 2025-01-19T11:14:26Z FundingBody Austria institutions 2024: Hybrid journals http://creativecommons.org/licenses/by/4.0/ 2027-02-10T00:00:00.000Z 2027-02-10T00:00:00.000Z http://creativecommons.org/licenses/by-nc-nd/4.0/ This is an open access article under the CC BY license. © 2025 The Author(s). Published by Elsevier Inc. 2025-02-25T07:51:33.648Z http://vtw.elsevier.com/data/voc/AddOnTypes/50.7/aggregated-refined FWF SFB TACO/P08/P10 FWF Fiona Wood Foundation http://data.elsevier.com/vocabulary/SciValFunders/501100022218 http://sws.geonames.org/2077456/ FWF Austrian Science Fund http://data.elsevier.com/vocabulary/SciValFunders/501100002428 http://sws.geonames.org/2782113 This research was funded in part by the Austrian Science Fund (FWF) [ 10.55776/F81 ] (SFB TACO/P08/P10). For open access purposes, the author has applied a CC BY public copyright license to any author accepted manuscript version arising from this submission. We thank Klaudia Hradil and Werner Artner (X-ray Centre of TU Wien) for assistance with measurements and Liliana Lukashuk for helpful discussions. item S0021-9517(25)00038-7 S0021951725000387 1-s2.0-S0021951725000387 10.1016/j.jcat.2025.115973 272561 2025-04-22T20:38:01.497828Z 2025-03-01 2025-03-31 UNLIMITED AUSHYB2024 1-s2.0-S0021951725000387-main.pdf https://s3-eu-west-1.amazonaws.com/prod-ucs-content-store-eu-west/content/pii:S0021951725000387/MAIN/application/pdf/28f7cc06017fc694ca2eb2e6958dd70b/main.pdf main.pdf pdf true 6032848 MAIN 10 1-s2.0-S0021951725000387-main_1.png https://s3-eu-west-1.amazonaws.com/prod-ucs-content-store-eu-west/content/pii:S0021951725000387/PREVIEW/image/png/88b8d332698979dd330f9182e58e8e74/main_1.png main_1.png png 57977 849 656 IMAGE-WEB-PDF 1 1-s2.0-S0021951725000387-gr4.jpg https://s3-eu-west-1.amazonaws.com/prod-ucs-content-store-eu-west/content/pii:S0021951725000387/gr4/DOWNSAMPLED/image/jpeg/bb70c4e9495770c0947ef29489eacddc/gr4.jpg gr4 gr4.jpg jpg 146939 878 689 IMAGE-DOWNSAMPLED 1-s2.0-S0021951725000387-gr5.jpg https://s3-eu-west-1.amazonaws.com/prod-ucs-content-store-eu-west/content/pii:S0021951725000387/gr5/DOWNSAMPLED/image/jpeg/498687f86284752ca50fd34198531477/gr5.jpg gr5 gr5.jpg jpg 47045 271 689 IMAGE-DOWNSAMPLED 1-s2.0-S0021951725000387-gr6.jpg https://s3-eu-west-1.amazonaws.com/prod-ucs-content-store-eu-west/content/pii:S0021951725000387/gr6/DOWNSAMPLED/image/jpeg/b6fb8afab7ca1ec806397119d8ff81a1/gr6.jpg gr6 gr6.jpg jpg 40760 235 578 IMAGE-DOWNSAMPLED 1-s2.0-S0021951725000387-gr1.jpg https://s3-eu-west-1.amazonaws.com/prod-ucs-content-store-eu-west/content/pii:S0021951725000387/gr1/DOWNSAMPLED/image/jpeg/b7dbeb2d1ce5d01c6348148ce0f58747/gr1.jpg gr1 gr1.jpg jpg 84416 631 689 IMAGE-DOWNSAMPLED 1-s2.0-S0021951725000387-gr2.jpg https://s3-eu-west-1.amazonaws.com/prod-ucs-content-store-eu-west/content/pii:S0021951725000387/gr2/DOWNSAMPLED/image/jpeg/9975b72192b078ae5912e05b08e8b9a1/gr2.jpg gr2 gr2.jpg jpg 37537 337 382 IMAGE-DOWNSAMPLED 1-s2.0-S0021951725000387-ga1.jpg https://s3-eu-west-1.amazonaws.com/prod-ucs-content-store-eu-west/content/pii:S0021951725000387/ga1/DOWNSAMPLED/image/jpeg/f07028f4776df143e455c56fbf52ccda/ga1.jpg ga1 true ga1.jpg jpg 32572 196 500 IMAGE-DOWNSAMPLED 1-s2.0-S0021951725000387-gr3.jpg https://s3-eu-west-1.amazonaws.com/prod-ucs-content-store-eu-west/content/pii:S0021951725000387/gr3/DOWNSAMPLED/image/jpeg/be804edbbfc27baa73d7e447d0209f32/gr3.jpg gr3 gr3.jpg jpg 129515 590 689 IMAGE-DOWNSAMPLED 1-s2.0-S0021951725000387-gr4.sml https://s3-eu-west-1.amazonaws.com/prod-ucs-content-store-eu-west/content/pii:S0021951725000387/gr4/THUMBNAIL/image/gif/55a25d8a88b2c75565873c4c00a45de0/gr4.sml gr4 gr4.sml sml 8263 163 128 IMAGE-THUMBNAIL 1-s2.0-S0021951725000387-gr5.sml https://s3-eu-west-1.amazonaws.com/prod-ucs-content-store-eu-west/content/pii:S0021951725000387/gr5/THUMBNAIL/image/gif/1ff222ae546b862f1aa80866ae648aa8/gr5.sml gr5 gr5.sml sml 5959 86 219 IMAGE-THUMBNAIL 1-s2.0-S0021951725000387-gr6.sml https://s3-eu-west-1.amazonaws.com/prod-ucs-content-store-eu-west/content/pii:S0021951725000387/gr6/THUMBNAIL/image/gif/7d568193241cdea6aec3b63cfafe9f67/gr6.sml gr6 gr6.sml sml 6529 89 219 IMAGE-THUMBNAIL 1-s2.0-S0021951725000387-gr1.sml https://s3-eu-west-1.amazonaws.com/prod-ucs-content-store-eu-west/content/pii:S0021951725000387/gr1/THUMBNAIL/image/gif/e1f361143046c66e085275662ac1cd9c/gr1.sml gr1 gr1.sml sml 7656 164 179 IMAGE-THUMBNAIL 1-s2.0-S0021951725000387-gr2.sml https://s3-eu-west-1.amazonaws.com/prod-ucs-content-store-eu-west/content/pii:S0021951725000387/gr2/THUMBNAIL/image/gif/d775813e39d39ae2f5068e16dd130259/gr2.sml gr2 gr2.sml sml 8946 164 186 IMAGE-THUMBNAIL 1-s2.0-S0021951725000387-ga1.sml https://s3-eu-west-1.amazonaws.com/prod-ucs-content-store-eu-west/content/pii:S0021951725000387/ga1/THUMBNAIL/image/gif/e28204aad51cd5e8bf8d4c1f597f5abf/ga1.sml ga1 true ga1.sml sml 9398 86 219 IMAGE-THUMBNAIL 1-s2.0-S0021951725000387-gr3.sml https://s3-eu-west-1.amazonaws.com/prod-ucs-content-store-eu-west/content/pii:S0021951725000466/gr3/THUMBNAIL/image/gif/038a30f8fd510a27b07335c3d5bfeb02/gr3.sml gr3 gr3.sml sml 21758 164 191 IMAGE-THUMBNAIL 1-s2.0-S0021951725000387-gr4_lrg.jpg https://s3-eu-west-1.amazonaws.com/prod-ucs-content-store-eu-west/content/pii:S0021951725000466/HIGHRES/image/jpeg/1bc98d92beb5dc9c5691eb494f1e792d/gr4_lrg.jpg gr4 gr4_lrg.jpg jpg 981919 3886 3051 IMAGE-HIGH-RES 1-s2.0-S0021951725000387-gr5_lrg.jpg https://s3-eu-west-1.amazonaws.com/prod-ucs-content-store-eu-west/content/pii:S0021951725000387/HIGHRES/image/jpeg/2f524eb17877ba655fbc0e9cdcf55cd5/gr5_lrg.jpg gr5 gr5_lrg.jpg jpg 298342 1201 3051 IMAGE-HIGH-RES 1-s2.0-S0021951725000387-gr6_lrg.jpg https://s3-eu-west-1.amazonaws.com/prod-ucs-content-store-eu-west/content/pii:S0021951725000387/HIGHRES/image/jpeg/c1efecb71b088125cf9c56a30d55e2a8/gr6_lrg.jpg gr6 gr6_lrg.jpg jpg 254896 1041 2559 IMAGE-HIGH-RES 1-s2.0-S0021951725000387-gr1_lrg.jpg https://s3-eu-west-1.amazonaws.com/prod-ucs-content-store-eu-west/content/pii:S0021951725000466/HIGHRES/image/jpeg/4440fa86c1afc1ef45dae8197c7de222/gr1_lrg.jpg gr1 gr1_lrg.jpg jpg 573274 2793 3051 IMAGE-HIGH-RES 1-s2.0-S0021951725000387-gr2_lrg.jpg https://s3-eu-west-1.amazonaws.com/prod-ucs-content-store-eu-west/content/pii:S0021951725000387/HIGHRES/image/jpeg/3ccb8aa625c959b0538c585702afbcdb/gr2_lrg.jpg gr2 gr2_lrg.jpg jpg 256426 1493 1693 IMAGE-HIGH-RES 1-s2.0-S0021951725000387-ga1_lrg.jpg https://s3-eu-west-1.amazonaws.com/prod-ucs-content-store-eu-west/content/pii:S0021951725000466/HIGHRES/image/jpeg/23fe9962b9bc7ef670c7c69b90330a19/ga1_lrg.jpg ga1 true ga1_lrg.jpg jpg 245567 869 2213 IMAGE-HIGH-RES 1-s2.0-S0021951725000387-gr3_lrg.jpg https://s3-eu-west-1.amazonaws.com/prod-ucs-content-store-eu-west/content/pii:S0021951725000466/HIGHRES/image/jpeg/57c3d2798ce766668c98873616514f5a/gr3_lrg.jpg gr3 gr3_lrg.jpg jpg 1116772 2614 3051 IMAGE-HIGH-RES 1-s2.0-S0021951725000387-mmc1.pdf https://s3-eu-west-1.amazonaws.com/prod-ucs-content-store-eu-west/content/pii:S0021951725000387/mmc1/MAIN/application/pdf/58b97608bdf181998e2d14b8d4f56f42/mmc1.pdf mmc1 mmc1.pdf pdf false 1479148 APPLICATION 1-s2.0-S0021951725000387-si1.svg https://s3-eu-west-1.amazonaws.com/prod-ucs-content-store-eu-west/content/pii:S0021951725000387/image/svg+xml/5f83395c53f07a1d70fd5bd730be2051/si1.svg si1 si1.svg svg 15788 ALTIMG 1-s2.0-S0021951725000387-si10.svg https://s3-eu-west-1.amazonaws.com/prod-ucs-content-store-eu-west/content/pii:S0021951725000387/image/svg+xml/89b25bc374ecdb2c062bbb4ab96d6570/si10.svg si10 si10.svg svg 4537 ALTIMG 1-s2.0-S0021951725000387-si2.svg https://s3-eu-west-1.amazonaws.com/prod-ucs-content-store-eu-west/content/pii:S0021951725000387/image/svg+xml/0d43de2f3c9f834d9ddf87fcc13d35ac/si2.svg si2 si2.svg svg 25433 ALTIMG 1-s2.0-S0021951725000387-si3.svg https://s3-eu-west-1.amazonaws.com/prod-ucs-content-store-eu-west/content/pii:S0021951725000387/image/svg+xml/6c1768ac7c7e54afc77ed04e51c62b65/si3.svg si3 si3.svg svg 21300 ALTIMG 1-s2.0-S0021951725000387-si4.svg https://s3-eu-west-1.amazonaws.com/prod-ucs-content-store-eu-west/content/pii:S0021951725000387/image/svg+xml/23bc87d639d96306cbea2f31f5d5f3c9/si4.svg si4 si4.svg svg 16016 ALTIMG 1-s2.0-S0021951725000387-si5.svg https://s3-eu-west-1.amazonaws.com/prod-ucs-content-store-eu-west/content/pii:S0021951725000387/image/svg+xml/6fbf8ac4beed81d65a070b8da7decf78/si5.svg si5 si5.svg svg 17387 ALTIMG 1-s2.0-S0021951725000387-si6.svg https://s3-eu-west-1.amazonaws.com/prod-ucs-content-store-eu-west/content/pii:S0021951725000387/image/svg+xml/e95fc7d5ff4c41f86b1585244ff5f8d9/si6.svg si6 si6.svg svg 36959 ALTIMG 1-s2.0-S0021951725000387-si7.svg https://s3-eu-west-1.amazonaws.com/prod-ucs-content-store-eu-west/content/pii:S0021951725000387/image/svg+xml/92980183ed0afc44f49ff5a3ce432257/si7.svg si7 si7.svg svg 35645 ALTIMG 1-s2.0-S0021951725000387-si8.svg https://s3-eu-west-1.amazonaws.com/prod-ucs-content-store-eu-west/content/pii:S0021951725000387/image/svg+xml/b8aaba912bf811754c13812461ac90a8/si8.svg si8 si8.svg svg 14935 ALTIMG 1-s2.0-S0021951725000387-si9.svg https://s3-eu-west-1.amazonaws.com/prod-ucs-content-store-eu-west/content/pii:S0021951725000387/image/svg+xml/8955886f223bf606ac0901c48894b15a/si9.svg si9 si9.svg svg 27702 ALTIMG YJCAT 115973 115973 S0021-9517(25)00038-7 10.1016/j.jcat.2025.115973 The Author(s) Fig. 1 (a, c) H2-TPR (5 vol% or 50 vol% H2 in He, total flow 50 ml min−1) of calcined LaCoO3, with LT and HT temperatures marked in (a); (b, d) CO-TPR (5 vol% and 1 vol% CO in He, total flow 50 ml min−1). Fig. 2 XRD patterns obtained after different treatments of LaCoO3: (a) after Ox 400, (b) Ox 400/LTR, (c) Ox 400/HTR, (d) Ox 400/HTR/Ox 150. Fig. 3 TEM (a,d,g,j), HRTEM (b,e,h,k) and EDX mapping (c,f,i,l) of the La-L, Co-K and O-K edge energies: (a-c) Catalysts obtained after LCO oxidation at 400 °C, (d-f) after Ox 400/LTR, (g-i) after Ox 400/HTR, (j-l) after Ox 400/HTR/Ox 150. Fig. 4 PROX on differently pretreated LCO perovskite monitored by (a-e) MS and (f) GC: (a) LaCoO3, (b) La2Co2O5, (c) Co/La2O3, (d) Co3O4/La2O3, (e) La2O3 and (f) CO conversion and TOF. PROX was performed with a reaction mixture of 1 vol% CO, 1 vol% O2, 50 vol% H2 and balance 48 vol% He at a total flow of 50 mL min−1. Catalyst amount: 20 mg. Fig. 5 (a) CO2 yield and (b) CO2 and H2O selectivity of PROX (T < 300 °C), determined by gas chromatography. Experimental conditions as in Fig. 4. Fig. 6 PROX on LaCoO3 at 200 °C in different varying gas mixtures, as monitored by MS. Table 1 Different treatments of LaCoO3: Expected composition vs. XRD-derived phases, crystallite size and SBET. Treatment Expected composition Phases and Composition (wt.%) Crystallite size (nm) SBET (m2 g−1) 1. Ox 400 LaCoO3 100 % LaCoO3 25 18 2. Ox 400/ LTR LaCoO3 + 1/2 H2 → La2Co2O5 + 1/2 H2O 83 % La2Co2O5 17 % La2O3 16 − 14.8 3. Ox 400/ HTR La2Co2O5 + H2 → Co0 + 1/2 La2O3 + H2O 16 % Co0 84 % La2O3 1018 11.4 4. Ox 400/ HTR/Ox 150 3 Co0 + 2 O2 → Co3O4 28 % Co3O4 71 % La2O3 1 % CoO 1315− 14.8 Table 2 Temperature windows for (selective) CO oxidation, H2 oxidation, methanation, and reaction rate, along with TOF values during PROX on differently pretreated LCO perovskite catalysts, as well as Co3O4, 1% Pt/CeO2 and 10% CuO/CeO2 as reference for TOF comparison. Sample CO oxidation (°C)(Selective T windows) H2 oxidation (°C) Methanation (°C) rS100% a (mol s−1 g−1) r200 °C b (mol s−1 g−1) TOF c (s−1) LaCoO3 (1 % O2) 100–320(100–220) >220 − 9.3 × 10-6 9.3x10-6 0.009 (150 °C)0.056 (200 °C) La2Co2O5 190–310(Non selective) >200 − − 2.2x10-7 0.002 (200 °C) Co / La2O3 125–290(∼130) >200 >310 1.0 × 10-6 9.3x10-6 (Non selective) − Co3O4 / La2O3 75–270(75–150) >150 >270 4.5 × 10-6 1.4x10-5 (Non selective) − La2O3 275–400(Non selective) >320 − − − − Co3O4 [21] 75–250(75–125) 125–350 225–350 3.4 × 10-6 − 0.003 (70 °C) 1 % Pt/CeO2 [61] − − − − − 0.005 (60 °C) 10 % CuO/CeO2 [62] − − − − − 0.036 (80 °C) a Reaction rate per gram of catalyst calculated at the highest temperature of 100 % selectivity (S100%), i.e. for CO oxidation per gram of catalyst: at 200 °C for LCO, at 125 °C for Co/La2O3 and Co3O4/La2O3 and at 100 °C for Co3O4. b Reaction rate of CO oxidation at 200 °C per gram of a catalyst. c TOF-like values were calculated, assuming a (110) LaCoO3 surface and a (200) La2Co2O5 surface (see the SI). Research article Preferential CO oxidation (PROX) on LaCoO3–based catalysts: Effect of cobalt oxidation state on selectivity Nevzat Yigit Writing – review & editing Writing – original draft Visualization Validation Methodology Investigation Formal analysis Data curation a Karin Föttinger Writing – review & editing Supervision Funding acquisition a Johannes Bernardi Writing – review & editing Investigation Formal analysis b Günther Rupprechter Writing – review & editing Writing – original draft Validation Supervision Resources Project administration Funding acquisition Formal analysis Conceptualization a ⁎ a Institute of Materials Chemistry, TU Wien, Getreidemarkt 9/BC, 1060 Vienna, Austria Institute of Materials Chemistry TU Wien Getreidemarkt 9/BC Vienna 1060 Austria nstitute of Materials Chemistry, TU Wien, Getreidemarkt 9/BC, 1060 Vienna, Austria b University Service Centre for Transmission Electron Microscopy (USTEM), TU Wien, Stadionallee 2/057-02, 1020 Vienna, Austria University Service Centre for Transmission Electron Microscopy (USTEM) TU Wien Stadionallee 2/057-02 Vienna 1020 Austria University Service Centre for Transmission Electron Microscopy (USTEM), TU Wien, Stadionallee 2/057-02, 1020 Wien, Vienna, Austria ⁎ Corresponding author. Graphical abstract The perovskite LaCoO3 (LCO) was used as catalyst for preferential oxidation of CO (PROX). LCO was synthesized via the modified Pechini method and characterized by X-ray diffraction (XRD), high resolution transmission electron microscopy (HRTEM), and CO– and H2– temperature programmed reduction (TPR). Different reductive and oxidative pretreatments were applied to systematically vary the Co oxidation state in order to examine its effect on catalytic performance and to single out active site requirements. Upon reduction at increasing temperature, LaCoO3 transformed to brownmillerite-type La2Co2O5, exsolved Co0 nanoparticles supported on La2O3 and, upon reoxidation, to Co3O4/La2O3. The Co oxidation state of the various catalysts correlated with their CO2 selectivity: LCO containing only Co3+ exhibited 100 % CO2 selectivity in a wide temperature window, whereas La2Co2O5, Co/La2O3 and Co3O4/La2O3 had markedly lower selectivity. It is suggested that Co3+ is crucial and that the strong resistivity of LaCoO3 towards reduction is responsible for the high and stable CO2 selectivity over a temperature range of 100 °C–220 °C. Higher oxygen concentration further broadens the PROX window. Keywords Perovskite Preferential Oxidation of CO Brownmillerite Exsolution Co Oxidation State Data availability Data will be made available on request. 1 Introduction Transition metal oxides are efficient catalysts for the preferential oxidation of CO in excess of H2 (PROX; Eq. (1) ) [1,2]. The interest in these low-cost materials is driven by their high catalytic activity and stability, which is comparable to that of noble metal-based catalysts, while being less sensitive to CO poisoning. (1) PROX: CO + H2 + 0.5O2 → CO2 + H2 ΔH298 = − 283 kJ/mol Selective CO oxidation in H2 has relevance for H2 purification technologies required for the operation of fuel cells [3]. To prevent loss of H2, the reaction must be CO2 selective, which is challenging due to competitive adsorption of CO and H2 on the catalyst surface and similar enthalpies of CO oxidation (Eq. (2) ) and H2 oxidation (Eq. (3) ): (2) CO + 0.5 O2 → CO2 ΔH298 = − 283 kJ/mol (3) H2 + 0.5O2 → H2O ΔH298 = − 242 kJ/mol The goal is thus to achieve a high CO oxidation rate at moderate temperature and high selectivity, avoiding not only H2 oxidation but also CO methanation, paralleled by stability against deactivation. While supported Pt catalysts are highly effective [4,5], their high cost and limited availability have shifted attention toward non-noble metal alternatives, such as transition metal oxides. Ceria supported copper oxides show excellent PROX performance [6–10], i.e., they exhibit high activity at low temperatures but operate within a relatively narrow temperature window (50–130 °C) while showing limited stability at higher temperatures. Cobalt oxides, based on their low temperature CO oxidation activity [11–17], have been particularly promising for PROX as well [1,2,18–20]. In our previous studies, Co3O4 was active but decently selective for PROX between 75 °C and 150 °C, while pronounced H2 oxidation set in at higher temperature [21]. Above 250 °C, cobalt oxide reduction (Co3+ to Co2+ and Co0) occurs, leading to methanation. Adding 10 % CeO2 to Co3O4 increased the PROX activity and made Co3O4 more difficult to reduce, resulting in a wider operation temperature window [20,21]. Mixed oxide-supported Co3O4 was reported to be less prone to reduction and high activity/selectivity was maintained up to 250 °C [22]. For cobalt oxide, both CO oxidation and PROX have also been extensively studied by in situ/operando techniques [14,19,21]. In an alternative approach, perovskite-type oxides (ABO3) have also been shown to be active in CO and hydrocarbon oxidation, NOx reduction, dry reforming of methane, CO, CO2 and hydrocarbon hydrogenation [23–29]. For hydrocarbon and CO oxidation, among the La-based perovskites (A=La), the order of activity was (B=) Co > Mn > Ni > Fe > Cr [24,28,29]. For example, Vaz et al. reported that substituting the B site of LaNiO3 by Co3+ enhanced the CO oxidation activity [30]. Moreover, partial A substitution by rare earth elements improved the structural stability, making these materials resistant towards reduction at low temperature and thermal sintering, which is important for high-temperature applications [31–33]. With respect to PROX on LaCoO3, Magalhaes et al. reported that adding cerium on La(1-x)CexCoO3 (x = 0, 0.05 and 0.1) led to higher PROX onset temperature [33]. Fiuza et al. found that substituting Co by Fe in LaCo0.9Fe0.1O3 induced slightly lower CO conversion during heating, while after 30 min at 330 °C CO conversion and CO2 selectivity were similar to those of LaCoO3 [34]. Adding Pt to LaCoO3 even negatively affected performance due to H2 spillover and over-reduction of the perovskite surface, with metallic Co leading to CH4 formation. Partial substitution of Co by Ru was reported in [35]. When Co was substituted by V (LaCo1-xVxO3, x = 0, 0.05 and 0.1), 50 % CO conversion was achieved at 25 °C lower temperature, but with a narrower temperature window in CO2 selectivity [36]. Altogether, even without modifications, the pure LaCoO3 is quite an active oxidation catalyst. However, in perovskite catalysis, especially at high temperatures, the in situ generation of new phases by (partial) decomposition and/or metal exsolution has been repeatedly reported [37–41]. During the reaction a mixture of phases may be obtained, which makes interpretation of reactivity more difficult, though. The current study thus focused on the active LaCoO3 catalyst and specifically aimed at examining different (preferentially pure) phases/compositions that were systematically prepared by reductive and oxidative pretreatments, to determine the impact of the Co oxidation state on PROX performance. Note that, in variance to common practice, the pretreatments were not intended to increase performance, but to obtain specific target compositions. As described below, apart from the initial LaCoO3, La2Co2O5, exsolved Co on La2O3 and (reoxidized) Co3O4/La2O3 were obtained, with marked differences in activity/selectivity. Among all catalysts, LaCoO3 exhibited 100 % CO2 selectivity over a wide temperature range (100–220 °C), which was attributed to its Co3+ oxidation state. Accordingly, reductive pretreatment above 300 °C lowers both activity and CO2 selectivity. Reoxidation led to “Kirkendall-type“ [42,43] but unselective Co3O4 nanoparticles on La2O3. 2 Experimental 2.1 Catalyst Preparation The LaCoO3 (LCO) catalyst was synthesized via the sol–gel based Pechini method [44,45], using La(NO3)2·6H2O (from Sigma, for R&D) and Co(NO3)2·6H2O (from Fluka, purum p.a.), as illustrated in Fig. S1. Citric acid monohydrate (CA, from Riedel-de Haen) was used as chelating agent and ethylenediaminetetraacetic acid (EDTA, from Fluka, puriss. p.a.) as reaction medium. EDTA (0.02 mol) was dissolved in ammonium hydroxide aqueous solution (50 mL; 28.0–30.0 %), adding 0.03 mol CA while stirring at room temperature (RT). Each metal salt (0.01 mol) was dissolved in 25 mL deionized water (molar ratio of total metal ions:EDTA:CA = 1:1:1.5) and added simultaneously and dropwise to the EDTA/CA solution in a three-necked flask at RT. The pH was adjusted to 9 with ammonium hydroxide solution, and the solution stirred at 90 °C overnight until a viscous gel formed. The gel was dried at 120 °C for 24 h (yielding the catalyst precursor) and finally calcined in static air at 600 °C (10 °C min−1) for 4 h to obtain the LaCoO3 perovskite catalyst. 2.2 Catalyst characterization by TGA, XRD, BET, HRTEM, and TPR To determine the best-suited calcination temperature of the catalyst precursor, thermogravimetric analysis (TGA) was performed on a Netzsch TGA 209C, heating the sample (dried at 120 °C in static air for 24 h) in synthetic air (50 mL min−1) from RT to 700 °C at 10 °C min−1. For phase analysis, X-ray diffraction (XRD) was carried out on a Philips XPERT-PRO diffractometer with Cu K-α radiation (1.5406 Å), operating in Bragg-Brentano reflection geometry at 40 kV and 40 mA with 2θ scanning from 10° to 90° (step size of 0.02° and a dwell time of 0.37 s per step). Phase analyses and Rietveld refinements were performed with the HighScorePlus software (JCPDS data base). To determine the BET surface area (SBET), N2 adsorption at −196 °C was performed in an ASAP 2020 Micromeritics apparatus. The sample was preheated under vacuum (<0.013 mbar) at 250 °C for 2 h. Evaluation of SBET was based on the linear part of the Brunauer-Emmett-Teller (BET) analysis, pore size distributions were obtained applying the Barrett-Joyner-Halenda (BJH) equation to the isotherm desorption branch, and total pore volume was estimated from the N2 uptake at a P/P 0 of 0.99. High-resolution transmission electron microscopy (HRTEM), yielding information on particle size, morphology and lattice structure, was performed on a TECNAI F20 microscope operated at 200 kV. The sample powders were deposited on copper grids coated with lacey carbon film (without using liquids). Energy dispersive X-ray fluorescence (EDX) was applied for elemental mapping of selected regions. H2 temperature programmed reduction (H2-TPR) and CO-TPR were applied to characterize the catalyst reducibility at atmospheric pressure. Approximately 20 mg catalyst was loaded in a continuous-flow fixed-bed quartz reactor between two quartz wool plugs. Before each TPR, potential surface species (adsorbed hydrocarbons, carbonates, water/hydroxyls) were removed by oxidation in synthetic air (50 mL min−1) at 400 °C for 30 min (heating rate 10 °C min−1). Samples were cooled to 30 °C under a flow of synthetic air and purged with He for 30 min. The cleaned samples were then exposed at room temperature to either a mixture of 5 vol% H2 in He (H2-TPR) or 5 vol% CO in He (CO-TPR), at a flow rate of 50 mL min−1, subsequently heated to 800 °C (10 °C min−1). In addition, 50 vol% H2 in He or 1 vol% CO in He were used, mimicking PROX reaction conditions. H2 consumption and CO2 evolution were analysed by an online quadrupole mass spectrometer (QMS; Prisma Plus QMG 220, Pfeiffer Vacuum) equipped with a secondary electron multiplier (SEM) detector. 2.3 Catalytic preferential oxidation of CO (PROX) Preferential CO oxidation on calcined LaCoO3 (LCO) and differently pretreated catalysts was carried out in a continuous-flow fixed-bed quartz reactor under atmospheric pressure. 20 mg of sample were mixed with 100 mg quartz sand to avoid mass and heat transfer limitations and were loaded into the reactor in between two quartz wool plugs. Before each PROX experiment, a fresh catalyst sample was pretreated in oxidizing and reducing atmosphere, as described below. After cooling to RT, the PROX reaction was performed in 1 vol% CO, 1 vol% O2, 50 vol% H2 and 48 vol% He (total flow 50 mL min−1), heating to 400 °C at a rate of 2 °C min−1. A CO flow of 0.5 ml min−1 corresponds to 0.0204 mmol min−1 or 2.05·1017 CO molecules per second. The concentration of reactants (CO, O2, H2) and products (CO2, H2O, CH4) in the outlet stream were monitored by an online QMS (Prisma Plus QMG 220, Pfeiffer Vacuum) equipped with an SEM detector and by gas chromatography (Agilent 6890) using a HP-PLOT Q column and a flame-ionization detector (FID) with a methanizer and thermal conductivity detector (TCD). The CO conversion (Eq. (4) ), CO2 yield (Eq. (5) ), CO2 and H2O selectivity (Eq. (6) and (7*) , respectively) and turnover frequency (TOF) (Eq. (8**) ) were calculated from the calibrated GC data: (4) X CO ( % ) = n ̇ CO IN - n ̇ CO OUT n ̇ CO IN ∙ 100 (5) CO 2 y i e l d ( % ) = n ̇ CO 2 n ̇ ∑ carbon ∙ 100 (6) S C O 2 % = n ̇ CO IN - n ̇ CO OUT 2 ( n ̇ O 2 IN - n ̇ O 2 OUT ) ∙ 100 (7) S H 2 O % = 100 - S C O 2 ( T < 300 ° C ) (8) TOF = n ̇ CO ∙ X CO 60 ∙ 100 ∙ n Cobalt n ̇ : M o l / m i n b a s e d o n a r e a o f CO , O 2 o r C O 2 p e a k f r o m c a l i b r a t e d g a s c h r o m a t o g r a p h y . n ̇ ∑ c a r b o n : T o t a l a r e a o f t h e p e a k s o f c a r b o n - c o n t a i n i n g c o m p o u n d s ( CO , CO 2 and CH 4 ) . X CO : C o n v e r s i o n o f C O . n Cobalt : M o l o f c o b a l t i n 20 m g c a t a l y s t . *CH4 was only formed above 300 °C and only for specific catalysts (see below). **The temperature-dependent turnover frequency, TOF, the number of CO molecules converted per Co atom and per second, calculated with respect to nCobalt in 20 mg catalyst, can therefore not be calculated for La2O3. 3 Results and discussion 3.1 Structural properties (XRD, BET, TEM) The optimum calcination temperature of the synthesized catalyst precursor was determined by TGA (Fig. S2a). The most pronounced weight loss of organic/inorganic material occurred between 100 °C and 420 °C, with a smaller loss at 420 °C-600 °C. Above 600 °C, no further decomposition was observed. The phase composition of the catalyst precursor and after air calcination at 450 °C or 600 °C (4 h each) were studied by X-ray diffraction (XRD) (Fig. S2b). Only after calcination at 600 °C, strong reflections at 32° (110) and 33° (104) were observed, characterizing the stoichiometric crystalline LaCoO3 (LCO) perovskite with rhombohedral unit cell of space group R 3 ¯ c (ICDD PDF no: 04–015-9695; rhombohedral). The average crystallite size of LCO calcined at 600 °C was 25 nm, as calculated by Rietveld refinement. BET indicated a specific surface area (SSA) of 18 m2 g−1, an average pore diameter of 29.7 nm and a pore volume of 0.10 cm3 g−1. The BET results for all samples are summarised in Table S1. 3.2 Reduction behavior (H2-TPR and CO-TPR) When measuring H2-TPR (Fig. 1 a) of LaCoO3 (calcined at 600 °C) in 5 vol% H2, two consecutive reduction steps were observed [33,46–49]. The first peak at 420 °C is attributed to reduction of Co3+ to Co2+ (motivating the low temperature reduction (LTR) pretreatment at 450 °C below), whereas the second peak at 600 °C is attributed to Co2+ reduction to metallic Co0 (motivating the high temperature reduction (HTR) pretreatment at 650 °C below). This assignment was confirmed by XRD and TEM (cf. Figs. 2 and 3 ). Up to 450 °C, a (near) surface reduction takes place, likely removing surface oxygen. Upon increasing the temperature to 650 °C, bulk reduction occurs. Oxygen loss upon reduction may destabilize the perovskite structure and, as Co0 atoms are too large to remain in the lattice, they exsolved from the bulk, forming Co0 atoms/clusters on La2O3 [50]. During CO-TPR (Fig. 1 b) in 5 vol% CO, CO2 peaks appeared at 325 °C, 400 °C, and 650 °C. The two peaks at 325 °C and 400 °C are attributed to the stepwise reduction of Co3+ to Co2+, i.e., LaCoO3 → La3Co3O8 → La2Co2O5 [49,51,52]. Between 500 °C and 750 °C the perovskite was fully reduced, forming exsolved Co0 and La2O3 (cf. Figs. 2 and 3). The shoulder at 550 °C is likely due to CO disproportionation (Boudouard) reaction [53]. Additionally, TPR was performed with 50 vol% H2 and 1 vol% CO (Fig. 1 c and d, respectively), mimicking PROX conditions. The different concentrations of reducing gases shifted the reduction temperatures as expected: in both cases higher concentrations led to lower reduction temperatures. The different concentrations of H2 and CO (1 vs 5 vs 50 %) were chosen, on the one hand, to compare reduction by H2 and CO at the same concentrations (5 %) and, on the other hand, to use conditions similar to those under PROX (1 % CO and 50 % H2). The different concentrations somewhat shifted the reduction temperatures, but they were still much higher than the selective PROX window described below. Catalyst reduction under PROX reaction conditions is thus only to be expected above 300 °C. 3.3 XRD and TEM of catalyst pretreatment Based on the results of H2-TPR, the 600 °C calcined LaCoO3 powder (before each experiment the catalyst was oxidized again at 400 °C to remove contaminants adsorbed from air) was subjected to gas treatments to modify catalyst structure and composition (Co oxidation state). H2-treatment at 450 °C (low temperature reduction, LTR) reduces Co3+ to Co2+, whereas high temperature reduction (HTR) at 650 °C further reduces Co2+ to metallic Co0. Thus, the pretreatments described below create a defined (initial) state for catalyst characterization and kinetic tests, while the re-oxidation treatment was motivated by our previous studies on Co3O4 [14,21,54]. The terminology used below is: 1. Ox 400: the (stored, calcined) LCO catalyst was oxidized in synthetic air (50 mL min−1) at 400 °C for 30 min (heating rate 10 °C min−1) and then cooled to RT in synthetic air, assuring a defined starting state. 2. Ox 400/LTR: after (1), the sample was reduced in 5 % H2 in He at 450 °C for 1 h and cooled to RT in the same gas. 3. Ox 400/HTR: after (1), the sample was reduced in 5 % H2 in He at 650 °C and cooled to RT in the same gas. 4. Ox 400/HTR/Ox 150: after (3), the sample was reoxidized in synthetic air (50 mL min−1) at 150 °C for 30 min (heating rate 10 °C min−1) and then cooled to RT in the same gas. The resulting crystalline phase were examined by XRD, N2 adsorption and TEM. XRD after Ox 400/LTR revealed a brownmillerite-type structure (i.e., La2Co2O5; 04-008-6405; orthorhombic) and La2O3 (04-002-2528; hexagonal) (Fig. 2 b) [55], whereas after Ox 400/HTR metallic Co0 and La2O3 were observed (Co; 04-015-0419; cubic and La2O3; 04-002-2528; hexagonal) (Fig. 2 c), in line with H2-TPR. Despite room temperature sample transfer in air, no significant Co oxidation was detected. The Ox 400/HTR/Ox 150 sample showed Co3O4 (01-78-5634; cubic), CoO (04-03-2617; cubic) and La2O3 (04-002-2528; hexagonal) phases (Fig. 2 d). Table 1 summarizes the phases, crystallite sizes (from Rietfeld refinement) and SBET of all materials. Fig. 3 a–l shows TEM, HRTEM images and EDX mapping acquired after the different pretreatments of LCO. After Ox 400, lattice fringes (Fig. 3 b) of 0.272 nm spacing indicated (110) planes of the LCO perovskite, matching well the ICDD database (PDF no: 04-015-9695). Particle size ranged from 30 nm to 70 nm, often with hexagonal/polygonal shapes. STEM-EDX maps (Fig. 3 c) of La (orange), Co (purple) and O (blue) confirmed their homogeneous distribution. After Ox 400/LTR (Fig. 3 d–f), HRTEM revealed somewhat larger and irregular La2Co2O5 particles (50 nm to 100 nm) with characteristic lattice fringes of 0.793 nm (020), according to the ICDD database (PDF no: 04-008-6405, orthorhombic). EDX mapping (Fig. 3 f) indicated that the homogeneous elemental distribution was maintained. After Ox 400/HTR, Fig. 3 g–i shows irregularly shaped Co and La2O3 particles in the size range of ∼20 to 100 nm (the difficulty of differentiating Co and La2O3 did not allow to obtain size histograms). Lattice fringes of 0.216 nm spacing indicated (111) planes of Co (PDF no: Co; 04-015-0419; cubic), whereas those at 0.329 nm the (222) planes of La2O3 (PDF no: 04-002-2528; hexagonal). To differentiate Co and La2O3, we concentrated on specific particles in “profile view” and used EDX analysis to confirm that – at least in these cases − exsolution occurred and that cobalt was positioned on/near the surface. Elemental La, Co and O EDX maps are displayed in Fig. 3 i. Despite room temperature sample transfer to the microscope in air, no significant oxidation of the Co nanoparticles was detected, in line with XRD. After reoxidation at 150 °C, irregular particles (∼25–100 nm) were still observed (Fig. 3 j). An EDX line scan (Fig. S3) showed that Co3O4 nanoparticles remained on the surface of La2O3. The image contrast in Fig. 3k even points to a hollow Co3O4 nanoparticle (analogous ones shown in Fig. S4), pointing to a Kirkendall effect [42,43]. In addition to examining the cobalt oxidation state via XRD and HRTEM phase analysis, carrying out H2-TPR of already reduced catalysts can further verify it. As illustrated in Fig. S5a, the catalyst was initially reduced at 450 °C for 30 min, followed by cooling to room temperature. Subsequently, the catalyst was exposed to a second reduction at 650 °C without any intermediate treatment. Notably, as depicted in Fig. S5b, the characteristic peak corresponding to the reduction from Co3+ to Co2+ at 420 °C (LaCoO3 to La2Co2O5) had disappeared and only the peak at 600 °C characteristic of the reduction from Co2+ to Co0 was observed. Following the reduction at 650 °C for 30 min, the catalyst was once again cooled to room temperature. It was then reoxidized at 150 °C in a 20 vol% oxygen atmosphere, followed by cooling to room temperature. As shown in Fig. S5c, the oxidized cobalt species were subsequently re-reduced with a broader peak between 300 and 500 °C [56,57]. Importantly, above 550 °C, the reduction peak associated with the transition from Co2+ to Co⁰ (La2Co2O5 to Co/La2O3) was not present anymore, indicating the completion of the reduction process in the preceding reduction. 3.4 PROX performance The four different pretreatments created the four targeted different catalyst compositions, which allowed to assess the reactivity of Co in different oxidation states: LaCoO3 (Co3+), La2Co2O5 (Co2+), metallic Co0 on La2O3, and Co3O4 (Co3+ and Co2+) on La2O3. Thus, temperature programmed PROX (1 vol% CO, 1 vol% O2, 50 vol% H2, 48 vol% He) was examined for all states by MS. The catalytic results are presented in Fig. 4 , with temperature windows of selective CO2 formation marked with a grey background. For LaCoO3 (Fig. 4 a), solely CO2 was produced in a temperature window of 100 °C-220 °C. From 220 °C to 320 °C both CO2 and H2O were formed, whereas mostly H2 oxidation occurred at higher temperature. Accordingly, the CO consumption and CO2 formation decreased. Reverse water gas shift (RWGS: CO2 + H2 ⇄ CO + H2O) [58] and methanation (CO + 3H2 → CH4 + H2O; CO2 + 4H2 → CH4 + 2H2O) did not occur below ∼ 300 °C, as shown in Fig. S6 [59]. Gas phase oxygen was typically fully consumed above 300 °C, which also holds true for the other catalysts. On La2Co2O5, only a small amount of H2O was detected below 190 °C (Fig. 4 b). From 190 °C to 310 °C, unselective CO2 and H2O formation occurred. The lacking PROX activity seems to be related to the Co2+ oxidation state in the La2Co2O5 perovskite. Above 310 °C, H2O formation dominated, but no methane was observed. On Co/La2O3 (Fig. 4 c), both CO2 and H2O were produced from 125 °C to 290 °C, with the lack of selectivity likely due to Co oxidation. At higher temperatures, H2O formation initially dominated, but methanation occurred above 325 °C due to the presence of metallic cobalt, as observed in [21]. Overall, Co/La2O3 showed a behaviour in between La2Co2O5 and Co3O4/La2O3 (see below), pointing to initial oxidation and re-reduction of Co. On Co3O4/La2O3 (Fig. 4 d), preferential CO oxidation occurred from 75 °C to 150 °C (lower temperature than on the other catalysts but much narrower range than LCO), whereas both CO2 and H2O formation were produced from 150 °C to 270 °C. At higher temperature, H2O formation dominated first, while above 300 °C methanation set in. Although the performance of Co3O4/La2O3 is similar to (pure) Co3O4 [21], the supported Co3O4 shows even better selectivity below 150 °C. As PROX is strongly exothermic, the higher activity of Co3O4/La2O3 than Co/La2O3 (c.f. Fig. 4c, 4d, and 4f) may also affect the methanation onset temperature in favor of Co3O4/La2O3. Pure La2O3, measured for comparison, hardly showed any PROX activity (Fig. 4 e). Methane formation did not occur on LaCoO3 and La2Co2O5, but only on Co/La2O3 and Co3O4/La2O3 at higher temperature. As known from literature, metallic cobalt facilitates methanation [21,33,60] (note that above 300 °C, Co3O4 is reduced to Co0 [21]). The ∼75 °C lower CH4 onset temperature of Co3O4/La2O3 may be due to Co redispersion upon the preceding re-oxidation step. In contrast, LaCoO3 and La2Co2O5, not containing Co0, did not produce any CH4 under the same conditions. Although the MS sensitivity to reactants (CO:1.05; O2:0.86; H2:0.44) and products (CO2:1.4; H2O:0.9; CH4:1.6) is known, for quantitative measurements gas chromatography was applied. Fig. 4 f shows the temperature-dependent CO conversion and TOF of the different pretreated catalysts, as determined by GC. On Co3O4/La2O3 (Ox 400/HTR/Ox 150) the CO conversion to CO2 started at ∼75 °C and reached 90 % at 225 °C. For LCO, the onset temperature was 100 °C and conversion reached 95 % at 300 °C. The onset temperature of CO conversion was 130 °C for Co/La2O3 and 190 °C for La2Co2O5, with both reaching 80 % conversion at 300 °C. Please note that Co3O4/La2O3 was the best in terms of CO conversion at low temperature, but not in CO2 selectivity. Using 2 vol% oxygen on LaCoO3 (Fig. S7), the selective PROX region was even extended to 240 °C with the CO oxidation rate remaining high up to 370 °C. Higher oxygen concentration thus widens the PROX window, shifting the onset of water formation to higher temperature, likely by delaying/hindering perovskite surface reduction. The CO2 yield as a function of temperature, determined by gas chromatography, is displayed in Fig. 5 a for all catalysts, showing a trend of Co3+ > Co0 > Co2+. Above ∼250 °C-300 °C, the CO2 yield decreased due to the competing water and methane formation, but depending on the catalyst. The CO2 and H2O selectivity are plotted in Fig. 5 b, demonstrating the wide 100 % selectivity window of LaCoO3. Table 2 summarizes the observed (selective/unselective) temperature windows, including benchmark systems from literature [21,61,62]. Temperature programmed PROX ( Fig. 5 b) demonstrated that LaCoO3 was selective even in a wider temperature window (100 °C-220 °C) than Co3O4/La2O3 (75 °C-150 °C). La2Co2O5 and Co/La2O3 did not exhibit selective temperature ranges. Methanation, which consumes hydrogen and reduces the selectivity of CO oxidation, was observed on Co/La2O3 and on Co3O4/La2O3 due to metallic cobalt being present at high temperature [21]. For CO oxidation on Co3O4, Co3+ was often regarded an active centre [12,13,54,63–65]. Similarly, Co3+ of the LaCoO3 perovskite may favour CO2 selectivity [21,60]. Co3+ apparently provides stronger adsorption sites for CO [13] than for H2, facilitating preferential CO oxidation, whereas metallic Co⁰ favors H2 dissociation/activation, thereby impacting selectivity towards methane [66]. Clearly, the reaction onset temperature of PROX on LCO (100 °C) is higher than that of Co3O4 (75 °C), but the temperature window is twice as wide on LCO. Based on the measured BET surface area of LCO and La2Co2O5 “TOF-like values” were calculated, assuming a (110) LaCoO3 surface and a (200) La2Co2O5 surface (see the SI). Clearly, this is an approximation for pure phase catalysts (and could not be calculated for Co/La2O3 and Co3O4/La2O3) but should still be handled with care. Reaction rates at 200 °C normalized per surface area can be found in Table S1. Further experiments varying the gas mixture at 200 °C were performed to confirm the robustness of the PROX selectivity (Fig. 6 ). First, the LCO catalyst was heated to 200 °C in the PROX mixture, leading to CO oxidation (I). Then, when CO was switched off, exclusively hydrogen oxidation took place after some induction period (II). The rate of H2 oxidation increased with time suggesting a slow modification of the catalyst under these conditions (e.g., by removal of adsorbed carbonates or surface reduction). Thereafter, CO was added again, with the selectivity switching back to CO oxidation (III). After turning off oxygen, in the CO/H2 mixture no methanation was observed (IV). When oxygen was added once again, CO oxidation occurred straight away (V), reaching the same amount of CO2 as in (I) and (III). In pure H2 atmosphere, no water formation was detected (VI), whereas after oxygen addition water formation occurred instantaneously (VII). As compared to (II), in the preceding period (VI), carbonate removal or surface reduction had already occurred, so that there was no delay in water formation. When CO was added, the selectivity changed back to CO oxidation (VIII). During all experiments at 200 °C, no methanation occurred. Altogether, this cycling experiment clearly demonstrates that the LCO PROX activity and selectivity were largely reversible at 200 °C (I, III, V, VIII) and that changes in the gas composition did not irreversibly modify the surface and bulk structure of the catalyst, highlighting the excellent performance of the LaCoO3 catalyst. To examine the LCO catalyst stability, time-on-stream (TOS) measurements were performed at 150 °C (in the centre of the selective temperature window) (Fig. S8). LCO showed stable 10 % CO conversion at 150 °C over a period of 10 h. Then, the temperature was increased to 160 °C (for 1 h), followed by further increase to 170 °C (for 1 h), revealing good stability without deactivation. 4 Conclusions The current study was based on a LaCoO3 (LCO) perovskite catalyst for preferential CO oxidation (PROX) up to 400 °C, but specifically aimed at determining the impact of the Co oxidation state. Accordingly, different (preferentially pure) target phases/compositions were systematically prepared by reductive and oxidative treatments of LCO and examined for PROX (thus, at first hand, the pretreatments were not intended to simply increase performance). Subjecting LCO to low temperature H2 reduction (LTR) at 450 °C produced a Brownmillerite-type structure La2Co2O5 (accompanied by a small amount of La2O3), whereas high temperature H2 reduction (HTR) at 650 °C led to exsolved metallic Co0 supported on La2O3. Reoxidation of this catalyst at 150 °C yielded Kirkendall-type Co3O4 nanoparticles on La2O3, but without major implications on the catalytic properties. EDX mapping and lattice fringe analyses corroborated the presence of Co in the intended oxidation states and, for the (nearly) pure phases, a rather homogeneous distribution of La, Co, and O. The four different pretreatments thus created four different catalyst compositions, allowing to assess the reactivity of Co in different oxidation states: LaCoO3 with Co3+, La2Co2O5 with Co2+, Co0 on La2O3, and Co3O4 (Co3+ and Co2+) on La2O3. The catalytic PROX tests revealed that LaCoO3 with Co3+ exhibited the best performance in terms of activity, selectivity, and selective operation range. The LTR sample (Co2+, La2Co2O5), and the HTR sample (Co0, Co/La2O3) were both unselective, showing additional water formation. Reoxidation of the HTR sample led to Co3O4/La2O3, again being selective, with a CO oxidation onset temperature similar to Co3O4, but lower than for LCO. Nevertheless, the selective temperature window of LCO was twice as wide as that of Co3O4 with H2O formation setting in at higher temperature. Methanation occurred at high temperature for Co/La2O3 and Co3O4/La2O3, due to the presence of metallic cobalt (with Co3O4 partly reduced under reaction conditions). In contrast, LCO perovskite and La2Co2O5 seemed resistant towards reduction during reaction, so that no CH4 was formed. Cycling experiments demonstrated that the PROX activity/selectivity of LCO were reversible at 200 °C, so that changes in the gas composition did not irreversibly modify the surface and bulk structure of the catalyst. The LCO catalysts also exhibited sufficient stability at 150 °C for longer times. Although the reductive pretreatments lowered the performance, they still enabled improved insight in the active species required, i.e., that the Co3+ oxidation state should be maintained. Thus, higher oxygen concentration broadens the PROX window and shifts the water formation onset to higher temperatures. Altogether, this study emphasized that catalyst performance was strongly influenced by the cobalt oxidation state. The results indicated that LCO is a highly selective and stable catalyst for preferential CO oxidation in hydrogen rich atmosphere, while the other catalysts exhibited varying degrees of selectivity and reactivity. Operando spectroscopic studies are currently performed to learn more about molecular details of the PROX reaction on LCO. CRediT authorship contribution statement Nevzat Yigit: Writing – review & editing, Writing – original draft, Visualization, Validation, Methodology, Investigation, Formal analysis, Data curation. Karin Föttinger: Writing – review & editing, Supervision, Funding acquisition. Johannes Bernardi: Writing – review & editing, Investigation, Formal analysis. Günther Rupprechter: Writing – review & editing, Writing – original draft, Validation, Supervision, Resources, Project administration, Funding acquisition, Formal analysis, Conceptualization. Declaration of competing interest The authors declare that they have no known competing financial interests or personal relationships that could have appeared to influence the work reported in this paper. Acknowledgments This research was funded in part by the Austrian Science Fund (FWF) [10.55776/F81] (SFB TACO/P08/P10). For open access purposes, the author has applied a CC BY public copyright license to any author accepted manuscript version arising from this submission. We thank Klaudia Hradil and Werner Artner (X-ray Centre of TU Wien) for assistance with measurements and Liliana Lukashuk for helpful discussions. Appendix A Supplementary material Supplementary data to this article can be found online at https://doi.org/10.1016/j.jcat.2025.115973. Appendix A Supplementary material The following are the Supplementary data to this article: Supplementary Data 1 References [1] Y. Teng H. Sakurai A. Ueda T. Kobayashi Oxidative removal of co contained in hydrogen by using metal oxide catalysts Int. J. Hydrogen Energy 24 1999 355 358 10.1016/s0360-3199(98)00083-4 Y. Teng, H. Sakurai, A. Ueda, T. Kobayashi, Oxidative removal of co contained in hydrogen by using metal oxide catalysts, Int. J. Hydrogen Energy, 24 (1999) 355-358 DOI: 10.1016/s0360-3199(98)00083-4. [2] T.M. Nyathi M.I. Fadlalla M. Claeys In situ and Operando characterisation in the preferential oxidation of carbon monoxide over base metal oxide catalysts: a review ChemCatChem 2024 10.1002/cctc.202400285 T.M. Nyathi, M.I. Fadlalla, M. Claeys, In situ and Operando characterisation in the preferential oxidation of carbon monoxide over base metal oxide catalysts: A Review, ChemCatChem, (2024), DOI: 10.1002/cctc.202400285. [3] S. Jiménez J. Soler R.X. Valenzuela L. Daza Assessment of the performance of a PEMFC in the presence of CO J. of Power Sources 151 2005 69 73 10.1016/j.jpowsour.2005.02.049 S. Jiménez, J. Soler, R.X. Valenzuela, L. Daza, Assessment of the performance of a PEMFC in the presence of CO, J. of Power Sources, 151 (2005) 69-73 DOI: 10.1016/j.jpowsour.2005.02.049. [4] A.R.M. Cruz L.H. Vieira E.M. Assaf J.F. Gomes J.M. Assaf Cooperative effect of Pt and Cu on CeO2 for the CO-PROX reaction under CO2–H2O feed stream Int. J. Hydrogen Energy 48 2023 24961 24975 10.1016/j.ijhydene.2023.01.077 A.R.M. Cruz, L.H. Vieira, E.M. Assaf, J.F. Gomes, J.M. Assaf, Cooperative effect of Pt and Cu on CeO2 for the CO-PROX reaction under CO2–H2O feed stream, Int. J. Hydrogen Energy, 48 (2023) 24961-24975 DOI: 10.1016/j.ijhydene.2023.01.077. [5] T.-S. Nguyen F. Morfin M. Aouine F. Bosselet J.-L. Rousset L. Piccolo Trends in the CO oxidation and PROX performances of the platinum-group metals supported on ceria Catal Today 253 2015 106 114 10.1016/j.cattod.2014.12.038 T.-S. Nguyen, F. Morfin, M. Aouine, F. Bosselet, J.-L. Rousset, L. Piccolo, Trends in the CO oxidation and PROX performances of the platinum-group metals supported on ceria, Catal Today, 253 (2015) 106-114 DOI: 10.1016/j.cattod.2014.12.038. [6] V.D. Araújo J.D.A. Bellido M.I.B. Bernardi J.M. Assaf E.M. Assaf CuO–CeO2 catalysts synthesized in one-step: characterization and PROX performance Int. J. Hydrogen Energy 37 2012 5498 5507 10.1016/j.ijhydene.2011.12.143 V.D. Araújo, J.D.A. Bellido, M.I.B. Bernardi, J.M. Assaf, E.M. Assaf, CuO–CeO2 catalysts synthesized in one-step: Characterization and PROX performance, Int. J. Hydrogen Energy, 37 (2012) 5498-5507 DOI: 10.1016/j.ijhydene.2011.12.143. [7] L. Wang Q. Li X. Liu C. Li Z. Zhao S. Diao D. Cao D. Xiang C. Wu K. Liu Improved CO-PROX selectivity of CuO/CeO2 catalysts by decorating with lanthanum via surface Cuξ+ redox site Appl. Surf. Sci. 649 2024 10.1016/j.apsusc.2023.159087 L. Wang, Q. Li, X. Liu, C. Li, Z. Zhao, S. Diao, D. Cao, D. Xiang, C. Wu, K. Liu, Improved CO-PROX selectivity of CuO/CeO2 catalysts by decorating with lanthanum via surface Cuξ+ redox site, Appl. Surf. Sci., 649 (2024) DOI: 10.1016/j.apsusc.2023.159087. [8] P. Tangpakonsab A. Genest J. Yang A. Meral B. Zou N. Yigit S. Schwarz G. Rupprechter Kinetic and computational studies of CO oxidation and PROX on Cu/CeO2 nanospheres Top. Catal. 66 2023 1129 1142 10.1007/s11244-023-01848-x P. Tangpakonsab, A. Genest, J. Yang, A. Meral, B. Zou, N. Yigit, S. Schwarz, G. Rupprechter, Kinetic and Computational Studies of CO Oxidation and PROX on Cu/CeO2 Nanospheres, Top. Catal., 66 (2023) 1129-1142 DOI: 10.1007/s11244-023-01848-x. [9] A. Di Benedetto G. Landi L. Lisi G. Russo Role of CO2 on CO preferential oxidation over CuO/CeO2 catalyst Appl. Catal. b: Environ. 142–143 2013 169 177 10.1016/j.apcatb.2013.05.001 A. Di Benedetto, G. Landi, L. Lisi, G. Russo, Role of CO2 on CO preferential oxidation over CuO/CeO2 catalyst, Appl. Catal. B: Environmental, 142-143 (2013) 169-177 DOI: 10.1016/j.apcatb.2013.05.001. [10] P.S. Barbato S. Colussi A. Di Benedetto G. Landi L. Lisi J. Llorca A. Trovarelli Origin of high activity and selectivity of CuO/CeO2 catalysts prepared by solution combustion synthesis in CO-PROX reaction J. Phys. Chem. C 120 2016 13039 13048 10.1021/acs.jpcc.6b02433 P.S. Barbato, S. Colussi, A. Di Benedetto, G. Landi, L. Lisi, J. Llorca, A. Trovarelli, Origin of High Activity and Selectivity of CuO/CeO2 Catalysts Prepared by Solution Combustion Synthesis in CO-PROX Reaction, J. Phys. Chem. C, 120 (2016) 13039-13048 DOI: 10.1021/acs.jpcc.6b02433. [11] X. Xie Y. Li Z.Q. Liu M. Haruta W. Shen Low-temperature oxidation of CO catalysed by Co3O4 nanorods Nature 458 2009 746 749 10.1038/nature07877 X. Xie, Y. Li, Z.Q. Liu, M. Haruta, W. Shen, Low-temperature oxidation of CO catalysed by Co3O4 nanorods, Nature, 458 (2009) 746-749 DOI: 10.1038/nature07877. [12] J. Jansson A.E.C. Palmqvist E. Fridell M. Skoglundh L. Osterlund P. Thormahlen V. Langer On the catalytic activity of Co3O4 in low-temperature CO oxidation J. Catal. 211 2002 387 397 10.1006/jcat.2002.3738 J. Jansson, A.E.C. Palmqvist, E. Fridell, M. Skoglundh, L. Osterlund, P. Thormahlen, V. Langer, On the catalytic activity of Co3O4 in low-temperature CO oxidation, J. Catal., 211 (2002) 387-397 DOI: 10.1006/jcat.2002.3738. [13] P. Broqvist I. Panas H. Persson A DFT study on CO oxidation over Co3O4 J. Catal. 210 2002 198 206 10.1006/jcat.2002.3678 P. Broqvist, I. Panas, H. Persson, A DFT study on CO oxidation over Co3O4, J. Catal., 210 (2002) 198-206 DOI: 10.1006/jcat.2002.3678. [14] L. Lukashuk N. Yigit R. Rameshan E. Kolar D. Teschner M. Hävecker A. Knop-Gericke R. Schlögl K. Föttinger G. Rupprechter Operando insights into CO oxidation on cobalt oxide catalysts by NAP-XPS FTIR, and XRD, ACS Catal. 8 2018 8630 8641 10.1021/acscatal.8b01237 L. Lukashuk, N. Yigit, R. Rameshan, E. Kolar, D. Teschner, M. Havecker, A. Knop-Gericke, R. Schlogl, K. Fottinger, G. Rupprechter, Operando Insights into CO Oxidation on Cobalt Oxide Catalysts by NAP-XPS, FTIR, and XRD, ACS Catal., 8 (2018) 8630-8641 DOI: 10.1021/acscatal.8b01237. [15] N. Yigit A. Genest S. Terloev J. Möller G. Rupprechter Active sites and deactivation of room temperature CO oxidation on Co3O4 catalysts: combined experimental and computational investigations J. Phys. Condens. Matter 34 2022 10.1088/1361-648X/ac718b N. Yigit, A. Genest, S. Terloev, J. Moller, G. Rupprechter, Active sites and deactivation of room temperature CO oxidation on Co3O4 catalysts: combined experimental and computational investigations, J. Phys. Condens. Matter, 34 (2022) DOI: 10.1088/1361-648X/ac718b. [16] T. Baidya T. Murayama S. Nellaiappan N.K. Katiyar P. Bera O. Safonova M. Lin K.R. Priolkar S. Kundu B. Srinivasa Rao P. Steiger S. Sharma K. Biswas S.K. Pradhan N. Lingaiah K.D. Malviya M. Haruta Ultra-low-temperature CO oxidation activity of octahedral site cobalt species in Co3O4 based catalysts: unravelling the origin of the unique catalytic property J. Phys. Chem. C 123 2019 19557 19571 10.1021/acs.jpcc.9b04136 T. Baidya, T. Murayama, S. Nellaiappan, N.K. Katiyar, P. Bera, O. Safonova, M. Lin, K.R. Priolkar, S. Kundu, B. Srinivasa Rao, P. Steiger, S. Sharma, K. Biswas, S.K. Pradhan, N. Lingaiah, K.D. Malviya, M. Haruta, Ultra-Low-Temperature CO Oxidation Activity of Octahedral Site Cobalt Species in Co3O4 Based Catalysts: Unravelling the Origin of the Unique Catalytic Property, J. Phys. Chem. C, 123 (2019) 19557-19571 DOI: 10.1021/acs.jpcc.9b04136. [17] J. Jansson Low-temperature CO oxidation over Co3O4/Al2O3 J. Catal. 194 2000 55 60 10.1006/jcat.2000.2924 J. Jansson, Low-Temperature CO Oxidation over Co3O4/Al2O3, J. Catal., 194 (2000) 55-60 DOI: 10.1006/jcat.2000.2924. [18] L. Nguyen S. Zhang S.J. Yoon F.F. Tao Preferential oxidation of CO in H2 on Pure Co3O4−x and Pt/Co3O4−x ChemCatChem 7 2015 2346 2353 10.1002/cctc.201500320 L. Nguyen, S. Zhang, S.J. Yoon, F.F. Tao, Preferential Oxidation of CO in H2 on Pure Co3O4−x and Pt/Co3O4−x, ChemCatChem, 7 (2015) 2346-2353 DOI: 10.1002/cctc.201500320. [19] M. Khasu T. Nyathi D.J. Morgan G.J. Hutchings M. Claeys N. Fischer Co3O4 morphology in the preferential oxidation of CO Catal. Sci. Technol. 7 2017 4806 4817 10.1039/c7cy01194f M. Khasu, T. Nyathi, D.J. Morgan, G.J. Hutchings, M. Claeys, N. Fischer, Co3O4 morphology in the preferential oxidation of CO, Catal. Sci. Technol., 7 (2017) 4806-4817 DOI: 10.1039/c7cy01194f. [20] Y. Wang C. Yang S. Lv W. Gao S. Li J. Li R. Song H. Zhong J. Zhang L. Pan Co3O4 supported on CeO2 with specific morphologies for high efficient CO-PROX reaction Chem. Phys. 584 2024 10.1016/j.chemphys.2024.112335 Y. Wang, C. Yang, S. Lv, W. Gao, S. Li, J. Li, R. Song, H. Zhong, J. Zhang, L. Pan, Co3O4 supported on CeO2 with specific morphologies for high efficient CO-PROX reaction, Chem. Phys., 584 (2024) DOI: 10.1016/j.chemphys.2024.112335. [21] L. Lukashuk K. Föttinger E. Kolar C. Rameshan D. Teschner M. Hävecker A. Knop-Gericke N. Yigit H. Li E. McDermott M. Stöger-Pollach G. Rupprechter Operando XAS and NAP-XPS studies of preferential CO oxidation on Co3O4 and CeO2-Co3O4 catalysts J. Catal. 344 2016 1 15 10.1016/j.jcat.2016.09.002 L. Lukashuk, K. Fottinger, E. Kolar, C. Rameshan, D. Teschner, M. Havecker, A. Knop-Gericke, N. Yigit, H. Li, E. McDermott, M. Stoger-Pollach, G. Rupprechter, Operando XAS and NAP-XPS studies of preferential CO oxidation on Co3O4 and CeO2-Co3O4 catalysts, J. Catal., 344 (2016) 1-15 DOI: 10.1016/j.jcat.2016.09.002. [22] Z. Zhao X. Lin R. Jin Y. Dai G. Wang High catalytic activity in CO PROX reaction of low cobalt-oxide loading catalysts supported on nano-particulate CeO2–ZrO2 oxides Catal. Commun. 12 2011 1448 1451 10.1016/j.catcom.2011.05.031 Z. Zhao, X. Lin, R. Jin, Y. Dai, G. Wang, High catalytic activity in CO PROX reaction of low cobalt-oxide loading catalysts supported on nano-particulate CeO2–ZrO2 oxides, Catal. Commun., 12 (2011) 1448-1451 DOI: 10.1016/j.catcom.2011.05.031. [23] A. Baiker P.E. Marti P. Keusch E. Fritsch A. Reller Influence of the A-site cation in ACoO3 (A = La, Pr, Nd, and Gd) perovskite-type oxides on catalytic activity for methane combustion J. Catal. 146 1994 268 276 10.1016/0021-9517(94)90030-2 A. Baiker, P.E. Marti, P. Keusch, E. Fritsch, A. Reller, Influence of the A-site cation in ACoO3 (A = La, Pr, Nd, and Gd) perovskite-type oxides on catalytic activity for methane combustion, J. Catal., 146 (1994) 268-276 DOI: 10.1016/0021-9517(94)90030-2. [24] L.G. Tejuca J.L.G. Fierro J.M.D. Tascon Structure and reactivity of perovskite-type oxides Adv. Catal. 36 1989 237 328 10.1016/s0360-0564(08)60019-x L.G. Tejuca, J.L.G. Fierro, J.M.D. Tascon, Structure and Reactivity of Perovskite-Type Oxides, Adv. Catal., 36 (1989) 237-328 DOI: 10.1016/s0360-0564(08)60019-x. [25] T. Ruh R. Buchinger L. Lindenthal F. Schrenk C. Rameshan CO Oxidation capabilities of La- and Nd-based perovskites Fuels 3 2022 31 43 10.3390/fuels3010003 T. Ruh, R. Buchinger, L. Lindenthal, F. Schrenk, C. Rameshan, CO Oxidation Capabilities of La- and Nd-Based Perovskites, Fuels, 3 (2022) 31-43 DOI: 10.3390/fuels3010003. [26] K. Lara D. Arias C. Sepulveda A. Buljan I. Lizana E.J. Delgado G. Pecchi C. Herrera Furfural Hydrogenation over Reduced Pure (LaBO3) and Substituted (LaB0.5B'0.5O3) (B, B': Fe, Co, Ni) Perovskites ChemCatChem 2024 10.1002/cctc.202301507 K. Lara, D. Arias, C. Sepulveda, A. Buljan, I. Lizana, E.J. Delgado, G. Pecchi, C. Herrera, Furfural Hydrogenation over Reduced Pure (LaBO3) and Substituted (LaB0.5B'0.5O3) (B, B': Fe, Co, Ni) Perovskites, ChemCatChem, (2024) DOI: 10.1002/cctc.202301507. [27] Y. Li S. Liu K. Yin D. Jia Y. Sun X. Zhang J. Yan L. Yang Understanding the mechanisms of catalytic enhancement of La-Sr-Co-Fe-O perovskite-type oxides for efficient toluene combustion J. Environ. Chem. Eng. 11 2023 10.1016/j.jece.2022.109050 Y. Li, S. Liu, K. Yin, D. Jia, Y. Sun, X. Zhang, J. Yan, L. Yang, Understanding the mechanisms of catalytic enhancement of La-Sr-Co-Fe-O perovskite-type oxides for efficient toluene combustion, J. Environ. Chem. Eng., 11 (2023) DOI: 10.1016/j.jece.2022.109050. [28] T. Nitadori T. Ichiki M. Misono Catalytic properties of perovskite-type mixed oxides (ABO3) consisting of rare earth and 3d transition metals. the roles of the A- and B-site ions Bull. Chem. Soc. Jpn. 61 1988 621 626 10.1246/bcsj.61.621 T. Nitadori, T. Ichiki, M. Misono, Catalytic Properties of Perovskite-Type Mixed Oxides (ABO3) Consisting of Rare Earth and 3d Transition Metals. The Roles of the A- and B-Site Ions, Bull. Chem. Soc. Jpn. , 61 (1988) 621-626 DOI: 10.1246/bcsj.61.621. [29] H. Tanaka An intelligent catalyst: the self-regenerative palladium-perovskite catalyst for automotive emissions control Catal. Surv Asia 9 2005 63 74 10.1007/s10563-005-5992-2 H. Tanaka, An intelligent catalyst: the self-regenerative palladium-perovskite catalyst for automotive emissions control, Catal. Surv. Asia, 9 (2005) 63-74 DOI: 10.1007/s10563-005-5992-2. [30] T. Vaz A.V. Salker Preparation, characterization and catalytic CO oxidation studies on LaNi1−xCoxO3 system Mater. Sci. Eng. b. 143 2007 81 84 10.1016/j.mseb.2007.07.027 T. Vaz, A.V. Salker, Preparation, characterization and catalytic CO oxidation studies on LaNi1−xCoxO3 system, Mater. Sci. Eng. B., 143 (2007) 81-84 DOI: 10.1016/j.mseb.2007.07.027. [31] K. Rida A. Benabbas F. Bouremmad M.A. Pena A. Martinez-Arias Surface properties and catalytic performance of La1-xSrxCrO3 perovskite-type oxides for CO and C3H6 combustion Catal. Commun. 7 2006 963 968 10.1016/j.catcom.2006.04.011 K. Rida, A. Benabbas, F. Bouremmad, M.A. Pena, A. Martinez-Arias, Surface properties and catalytic performance of La1-xSrxCrO3 perovskite-type oxides for CO and C3H6 combustion, Catal. Commun., 7 (2006) 963-968 DOI: 10.1016/j.catcom.2006.04.011. [32] B. Seyfi M. Baghalha H. Kazemian Modified LaCoO3 nano-perovskite catalysts for the environmental application of automotive CO oxidation Chem. Eng. J. 148 2009 306 311 10.1016/j.cej.2008.08.041 B. Seyfi, M. Baghalha, H. Kazemian, Modified LaCoO3 nano-perovskite catalysts for the environmental application of automotive CO oxidation, Chem. Eng. J. , 148 (2009) 306-311 DOI: 10.1016/j.cej.2008.08.041. [33] R. Magalhaes F.S. Toniolo V.T. da Silva M. Schmal Selective CO oxidation reaction (SELOX) over cerium-doped LaCoO3 perovskite catalysts Appl. Catal. a: General 388 2010 216 224 10.1016/j.apcata.2010.08.052 R. Magalhaes, F.S. Toniolo, V.T. da Silva, M. Schmal, Selective CO oxidation reaction (SELOX) over cerium-doped LaCoO3 perovskite catalysts, Appl. Catal. A: General, 388 (2010) 216-224 DOI: 10.1016/j.apcata.2010.08.052. [34] T.E.R. Fiuza L.S. Sousa D. Zanchet Bare and Pt-loaded LaCo1-xFexO3 perovskites as catalysts for CO-PROX reaction Int. J. Hydrogen Energy. 48 2023 25016 25030 10.1016/j.ijhydene.2023.02.097 T.E.R. Fiuza, L.S. Sousa, D. Zanchet, Bare and Pt-loaded LaCo1-xFexO3 perovskites as catalysts for CO-PROX reaction, Int. J. Hydrogen Energy., 48 (2023) 25016-25030 DOI: 10.1016/j.ijhydene.2023.02.097. [35] R. Pereñíguez A. Caballero D. Ferri Preferential oxidation of CO on a La-Co-Ru perovskite-type oxide catalyst Catal. Commun. 92 2017 75 79 10.1016/j.catcom.2016.12.020 R. Pereñíguez, A. Caballero, D. Ferri, Preferential oxidation of CO on a La-Co-Ru perovskite-type oxide catalyst, Catal. Commun., 92 (2017) 75-79 DOI: 10.1016/j.catcom.2016.12.020. [36] C.A. Chagas R.N.S.H. Magalhães M. Schmal The LaCo1−xVxO3 catalyst for CO oxidation in Rich H2 stream Catal. Letters 151 2020 409 421 10.1007/s10562-020-03303-y C.A. Chagas, R.N.S.H. Magalhães, M. Schmal, The LaCo1−xVxO3 Catalyst for CO Oxidation in Rich H2 Stream, Catal. Letters, 151 (2020) 409-421 DOI: 10.1007/s10562-020-03303-y. [37] T. Berger H. Drexler T. Ruh L. Lindenthal F. Schrenk J. Bock R. Rameshan K. Föttinger J. Irrgeher C. Rameshan Cu-doped perovskite-type oxides: a structural deep dive and examination of their exsolution behaviour influenced by B-site doping Catal. Today 437 2024 10.1016/j.cattod.2024.114787 T. Berger, H. Drexler, T. Ruh, L. Lindenthal, F. Schrenk, J. Bock, R. Rameshan, K. Föttinger, J. Irrgeher, C. Rameshan, Cu-doped perovskite-type oxides: A structural deep dive and examination of their exsolution behaviour influenced by B-site doping, Catal Today, 437 (2024) DOI: 10.1016/j.cattod.2024.114787. [38] D. Neagu J.T.S. Irvine J. Wang B. Yildiz A.K. Opitz J. Fleig Y. Wang J. Liu L. Shen F. Ciucci B.A. Rosen Y. Xiao K. Xie G. Yang Z. Shao Y. Zhang J. Reinke T.A. Schmauss S.A. Barnett R. Maring V. Kyriakou U. Mushtaq M.N. Tsampas Y. Kim R. O’Hayre A.J. Carrillo T. Ruh L. Lindenthal F. Schrenk C. Rameshan E.I. Papaioannou K. Kousi I.S. Metcalfe X. Xu G. Liu Roadmap on exsolution for energy applications J Physics Energy 5 2023 10.1088/2515-7655/acd146 D. Neagu, J.T.S. Irvine, J. Wang, B. Yildiz, A.K. Opitz, J. Fleig, Y. Wang, J. Liu, L. Shen, F. Ciucci, B.A. Rosen, Y. Xiao, K. Xie, G. Yang, Z. Shao, Y. Zhang, J. Reinke, T.A. Schmauss, S.A. Barnett, R. Maring, V. Kyriakou, U. Mushtaq, M.N. Tsampas, Y. Kim, R. O’Hayre, A.J. Carrillo, T. Ruh, L. Lindenthal, F. Schrenk, C. Rameshan, E.I. Papaioannou, K. Kousi, I.S. Metcalfe, X. Xu, G. Liu, Roadmap on exsolution for energy applications, J Physics Energy, 5 (2023) DOI: 10.1088/2515-7655/acd146. [39] F. Schrenk L. Lindenthal H. Drexler G. Urban R. Rameshan H. Summerer T. Berger T. Ruh A.K. Opitz C. Rameshan Impact of nanoparticle exsolution on dry reforming of methane: Improving catalytic activity by reductive pre-treatment of perovskite-type catalysts Appl. Catal., B: Environ. 318 2022 10.1016/j.apcatb.2022.121886 F. Schrenk, L. Lindenthal, H. Drexler, G. Urban, R. Rameshan, H. Summerer, T. Berger, T. Ruh, A.K. Opitz, C. Rameshan, Impact of nanoparticle exsolution on dry reforming of methane: Improving catalytic activity by reductive pre-treatment of perovskite-type catalysts, Appl. Catal., B: Environmental, 318 (2022) DOI: 10.1016/j.apcatb.2022.121886. [40] Q.A. Islam S. Paydar N. Akbar B. Zhu Y. Wu Nanoparticle exsolution in perovskite oxide and its sustainable electrochemical energy systems J. Power Sources 492 2021 10.1016/j.jpowsour.2021.229626 Q.A. Islam, S. Paydar, N. Akbar, B. Zhu, Y. Wu, Nanoparticle exsolution in perovskite oxide and its sustainable electrochemical energy systems, J. Power Sources, 492 (2021) DOI: 10.1016/j.jpowsour.2021.229626. [41] T. Ruh D. Berkovec F. Schrenk C. Rameshan Exsolution on perovskite oxides: morphology and anchorage of nanoparticles Chem. Commun. (Camb) 59 2023 3948 3956 10.1039/d3cc00456b T. Ruh, D. Berkovec, F. Schrenk, C. Rameshan, Exsolution on perovskite oxides: morphology and anchorage of nanoparticles, Chem Commun (Camb), 59 (2023) 3948-3956 DOI: 10.1039/d3cc00456b. [42] D. Ji L. Fan L. Tao Y. Sun M. Li G. Yang T.Q. Tran S. Ramakrishna S. Guo The kirkendall effect for engineering oxygen vacancy of hollow Co3O4 nanoparticles toward high-performance portable zinc-air batteries Angew. Chem. Int. Ed. Engl. 58 2019 13840 13844 10.1002/anie.201908736 D. Ji, L. Fan, L. Tao, Y. Sun, M. Li, G. Yang, T.Q. Tran, S. Ramakrishna, S. Guo, The Kirkendall Effect for Engineering Oxygen Vacancy of Hollow Co3O4 Nanoparticles toward High-Performance Portable Zinc-Air Batteries, Angew. Chem. Int. Ed. Engl., 58 (2019) 13840-13844 DOI: 10.1002/anie.201908736. [43] E. Kirkendall L. Thomassen C. Upthegrove Rates of diffusion of copper and zinc in alpha brass Trans. Metall. Soc. AIME 133 1939 186 203 E. Kirkendall, Thomassen, L. and Upthegrove, C., Rates of Diffusion of Copper and Zinc in Alpha Brass., Transactions of the Metallurgical Society of AIME, 133 (1939) 186-203. [44] J. Shao Y.K. Tao J.X. Wang C. Xu W.G. Wang Investigation of precursors in the preparation of nanostructured La0.6Sr0.4Co0.2Fe0.8O3-δ via a modified combined complexing method J. Alloys Compd. 484 2009 263 267 10.1016/j.jallcom.2009.04.075 J. Shao, Y.K. Tao, J.X. Wang, C. Xu, W.G. Wang, Investigation of precursors in the preparation of nanostructured La0.6Sr0.4Co0.2Fe0.8O3-δ via a modified combined complexing method, J. Alloys Compd., 484 (2009) 263-267 DOI: 10.1016/j.jallcom.2009.04.075. [45] M.P. Pechini, Method of Preparing Lead and Alkaline Earth Titanates and Niobates and Coating Method Using the Same to Form a Capacitor, US Patent No. 3330697, (1967). [46] S. Royer F. Berube S. Kaliaguine Effect of the synthesis conditions on the redox and catalytic properties in oxidation reactions of LaCo1-xFexO3 Appl. Catal. A: General 282 2005 273 284 10.1016/j.apcata.2004.12.018 S. Royer, F. Berube, S. Kaliaguine, Effect of the synthesis conditions on the redox and catalytic properties in oxidation reactions of LaCo1-xFexO3, Appl. Catal. A: General, 282 (2005) 273-284 DOI: 10.1016/j.apcata.2004.12.018. [47] L. Huang M. Bassir S. Kaliaguine Reducibility of Co3+ in perovskite-type LaCoO3 and promotion of copper on the reduction of Co3+ in perovskite-type oxides Appl. Surf. Sci. 243 2005 360 375 10.1016/j.apsusc.2004.09.079 L. Huang, M. Bassir, S. Kaliaguine, Reducibility of Co3+ in perovskite-type LaCoO3 and promotion of copper on the reduction of Co3+ in perovskite-type oxides, Appl. Surf. Sci., 243 (2005) 360-375 DOI: 10.1016/j.apsusc.2004.09.079. [48] M. Engelmann-Pirez P. Granger G. Leclercq Investigation of the catalytic performances of supported noble metal based catalysts in the NO+H2 reaction under lean conditions Catal. Today 107–08 2005 315 322 10.1016/j.cattod.2005.07.087 M. Engelmann-Pirez, P. Granger, G. Leclercq, Investigation of the catalytic performances of supported noble metal based catalysts in the NO+H2 reaction under lean conditions, Catal Today, 107-08 (2005) 315-322 DOI: 10.1016/j.cattod.2005.07.087. [49] G.L. Chiarello J.D. Grunwaldt D. Ferri R. Krumeich C. Oliva L. Forni A. Baiker Flame-synthesized LaCoO3 supported Pd 1. structure, thermal stability and reducibility J. Catal. 252 2007 127 136 10.1016/j.jcat.2007.10.004 G.L. Chiarello, J.D. Grunwaldt, D. Ferri, R. Krumeich, C. Oliva, L. Forni, A. Baiker, Flame-synthesized LaCoO3 supported Pd 1. Structure, thermal stability and reducibility, J. Catal., 252 (2007) 127-136 DOI: 10.1016/j.jcat.2007.10.004. [50] M. Crespin W.K. Hall The surface chemistry of some perovskite oxides J. Catal. 69 1981 359 370 10.1016/0021-9517(81)90171-8 M. Crespin, W.K. Hall, The surface chemistry of some perovskite oxides, J. Catal., 69 (1981) 359-370 DOI: 10.1016/0021-9517(81)90171-8. [51] A. Eyssler A. Winkler O. Safonova M. Nachtegaal S.K. Matam P. Hug A. Weidenkaff D. Ferri On the state of Pd in perovskite-type oxidation catalysts of composition A(B,Pd)O3±δ (A = La, Y; B = Mn, Fe, Co) Chem. Mater. 24 2012 1864 1875 10.1021/cm300571y A. Eyssler, A. Winkler, O. Safonova, M. Nachtegaal, S.K. Matam, P. Hug, A. Weidenkaff, D. Ferri, On the State of Pd in Perovskite-Type Oxidation Catalysts of Composition A(B,Pd)O3±δ (A = La, Y; B = Mn, Fe, Co), Chem. Mater., 24 (2012) 1864-1875 DOI: 10.1021/cm300571y. [52] J.H. Jang Y.M. Kim Q. He R. Mishra L. Qiao M.D. Biegalski A.R. Lupini S.T. Pantelides S.J. Pennycook S.V. Kalinin A.Y. Borisevich In situ observation of oxygen vacancy dynamics and ordering in the epitaxial LaCoO3 system ACS Nano 11 2017 6942 6949 10.1021/acsnano.7b02188 J.H. Jang, Y.M. Kim, Q. He, R. Mishra, L. Qiao, M.D. Biegalski, A.R. Lupini, S.T. Pantelides, S.J. Pennycook, S.V. Kalinin, A.Y. Borisevich, In Situ Observation of Oxygen Vacancy Dynamics and Ordering in the Epitaxial LaCoO3 System, Acs Nano, 11 (2017) 6942-6949 DOI: 10.1021/acsnano.7b02188. [53] T. Arakawa K.-I. Takada Y. Tsunemine J. Shiokawa CO gas sensitivities of reduced perovskite oxide LaCoO3−x Sens. Actuat. 14 1988 215 221 10.1016/0250-6874(88)80068-4 T. Arakawa, K.-I. Takada, Y. Tsunemine, J. Shiokawa, CO gas sensitivities of reduced perovskite oxide LaCoO3 − x, Sensors and Actuators, 14 (1988) 215-221 DOI: 10.1016/0250-6874(88)80068-4. [54] L. Lukashuk N. Yigit H. Li J. Bernardi K. Föttinger G. Rupprechter Operando XAS and NAP-XPS investigation of CO oxidation on meso- and nanoscale CoO catalysts Catal Today 336 2019 139 147 10.1016/j.cattod.2018.12.052 L. Lukashuk, N. Yigit, H. Li, J. Bernardi, K. Föttinger, G. Rupprechter, Operando XAS and NAP-XPS investigation of CO oxidation on meso- and nanoscale CoO catalysts, Catal Today, 336 (2019) 139-147 DOI: 10.1016/j.cattod.2018.12.052. [55] O.H. Hansteen H. Fjellvag B.C. Hauback Crystal structure and magnetic properties of La2Co2O5 J. Solid State Chem. 141 1998 411 417 10.1006/jssc.1998.7963 O.H. Hansteen, H. Fjellvag, B.C. Hauback, Crystal structure and magnetic properties of La2Co2O5, J. Solid State Chem., 141 (1998) 411-417 DOI: 10.1006/jssc.1998.7963. [56] A.I.M. Rabee C.B.A. Gaid G.A.H. Mekhemer M.I. Zaki Combined TPR, XRD, and FTIR studies on the reduction behavior of Co3O4 Mater. Chem. Phys. 289 2022 10.1016/j.matchemphys.2022.126367 A.I.M. Rabee, C.B.A. Gaid, G.A.H. Mekhemer, M.I. Zaki, Combined TPR, XRD, and FTIR studies on the reduction behavior of Co3O4, Mater. Chem. Phys., 289 (2022) DOI: 10.1016/j.matchemphys.2022.126367. [57] M. Wu S. Chen A. Soomro S. Ma M. Zhu X. Hua W. Xiang Investigation of synergistic effects and high performance of La-Co composite oxides for toluene catalytic oxidation at low temperature Environ. Sci. Pollut. Res. Int. 26 2019 12123 12135 10.1007/s11356-019-04672-7 M. Wu, S. Chen, A. Soomro, S. Ma, M. Zhu, X. Hua, W. Xiang, Investigation of synergistic effects and high performance of La-Co composite oxides for toluene catalytic oxidation at low temperature, Environ Sci Pollut Res Int, 26 (2019) 12123-12135 DOI: 10.1007/s11356-019-04672-7. [58] L. Lindenthal J. Popovic R. Rameshan J. Huber F. Schrenk T. Ruh A. Nenning S. Löffler A.K. Opitz C. Rameshan Novel perovskite catalysts for CO2 utilization - exsolution enhanced reverse water-gas shift activity Appl. Catal. B 292 2021 10.1016/j.apcatb.2021.120183 L. Lindenthal, J. Popovic, R. Rameshan, J. Huber, F. Schrenk, T. Ruh, A. Nenning, S. Löffler, A.K. Opitz, C. Rameshan, Novel perovskite catalysts for CO2 utilization - Exsolution enhanced reverse water-gas shift activity, Appl. Catal. B, 292 (2021) DOI: 10.1016/j.apcatb.2021.120183. [59] N. Yigit, LaCoO3 based catalysts for preferential CO oxidation: operando spectroscopy, in, TU Wien, PhD Thesis, 2019. [60] T.M. Nyathi N. Fischer A.P.E. York M. Claeys Effect of crystallite size on the performance and phase transformation of Co3O4/Al2O3 catalysts during CO-PrOx - an in situ study Faraday Discuss. 197 2017 269 285 10.1039/c6fd00217j T.M. Nyathi, N. Fischer, A.P.E. York, M. Claeys, Effect of crystallite size on the performance and phase transformation of Co3O4/Al2O3 catalysts during CO-PrOx - an in situ study, Faraday Discuss., 197 (2017) 269-285 DOI: 10.1039/c6fd00217j. [61] S. Rico-Francés E.O. Jardim T.A. Wezendonk F. Kapteijn J. Gascon A. Sepúlveda-Escribano E.V. Ramos-Fernandez Highly dispersed Ptδ+ on Ti Ce(1−x)O2 as an active phase in preferential oxidation of CO Appl. Catal. B 180 2016 169 178 10.1016/j.apcatb.2015.06.031 S. Rico-Francés, E.O. Jardim, T.A. Wezendonk, F. Kapteijn, J. Gascon, A. Sepúlveda-Escribano, E.V. Ramos-Fernandez, Highly dispersed Ptδ+ on Ti Ce(1−x)O2 as an active phase in preferential oxidation of CO, Appl. Catal. B, 180 (2016) 169-178 DOI: 10.1016/j.apcatb.2015.06.031. [62] J. Lu J. Wang Q. Zou D. He L. Zhang Z. Xu S. He Y. Luo Unravelling the nature of the active species as well as the doping effect over Cu/Ce-based catalyst for carbon monoxide preferential oxidation ACS Catal. 9 2019 2177 2195 10.1021/acscatal.8b04035 J. Lu, J. Wang, Q. Zou, D. He, L. Zhang, Z. Xu, S. He, Y. Luo, Unravelling the Nature of the Active Species as well as the Doping Effect over Cu/Ce-Based Catalyst for Carbon Monoxide Preferential Oxidation, ACS Catal., 9 (2019) 2177-2195 DOI: 10.1021/acscatal.8b04035. [63] H.F. Wang R. Kavanagh Y.L. Guo Y. Guo G.Z. Lu P. Hu Origin of extraordinarily high catalytic activity of Co3O4 and its morphological chemistry for CO oxidation at low temperature J. Catal. 296 2012 110 119 10.1016/j.jcat.2012.09.005 H.F. Wang, R. Kavanagh, Y.L. Guo, Y. Guo, G.Z. Lu, P. Hu, Origin of extraordinarily high catalytic activity of Co3O4 and its morphological chemistry for CO oxidation at low temperature, J. Catal., 296 (2012) 110-119 DOI: 10.1016/j.jcat.2012.09.005. [64] K. Omata T. Takada S. Kasahara M. Yamada Active site of substituted cobalt spinel oxide for selective oxidation of COH2. Part II Appl. Catal. A: General 146 1996 255 267 10.1016/s0926-860x(96)00151-2 K. Omata, T. Takada, S. Kasahara, M. Yamada, Active site of substituted cobalt spinel oxide for selective oxidation of COH2. Part II, Appl. Catal. A: General, 146 (1996) 255-267 DOI: 10.1016/s0926-860x(96)00151-2. [65] J. Yang J. Guo Y.B. Wang T. Wang J. Gu L.M. Peng N.H. Xue Y. Zhu X.F. Guo W.P. Ding Reduction-oxidation pretreatment enhanced catalytic performance of Co3O4/Al2O3 over CO oxidation Appl. Surf. Sci. 453 2018 330 335 10.1016/j.apsusc.2018.05.103 J. Yang, J. Guo, Y.B. Wang, T. Wang, J. Gu, L.M. Peng, N.H. Xue, Y. Zhu, X.F. Guo, W.P. Ding, Reduction-oxidation pretreatment enhanced catalytic performance of Co3O4/Al2O3 over CO oxidation, Appl. Surf. Sci., 453 (2018) 330-335 DOI: 10.1016/j.apsusc.2018.05.103. [66] M.M. Yung Z. Zhao M.P. Woods U.S. Ozkan Preferential oxidation of carbon monoxide on CoOx/ZrO2 J. Mol. Catal. A Chem. 279 2008 1 9 10.1016/j.molcata.2007.09.026 M.M. Yung, Z. Zhao, M.P. Woods, U.S. Ozkan, Preferential oxidation of carbon monoxide on CoOx/ZrO2, J. Mol. Catal. A Chem., 279 (2008) 1-9 DOI: 10.1016/j.molcata.2007.09.026.",
      "scopus-id": "85217086330",
      "coredata": {
        "eid": "1-s2.0-S0021951725000387",
        "dc:description": "The perovskite LaCoO3 (LCO) was used as catalyst for preferential oxidation of CO (PROX). LCO was synthesized via the modified Pechini method and characterized by X-ray diffraction (XRD), high resolution transmission electron microscopy (HRTEM), and CO– and H2– temperature programmed reduction (TPR). Different reductive and oxidative pretreatments were applied to systematically vary the Co oxidation state in order to examine its effect on catalytic performance and to single out active site requirements. Upon reduction at increasing temperature, LaCoO3 transformed to brownmillerite-type La2Co2O5, exsolved Co0 nanoparticles supported on La2O3 and, upon reoxidation, to Co3O4/La2O3. The Co oxidation state of the various catalysts correlated with their CO2 selectivity: LCO containing only Co3+ exhibited 100 % CO2 selectivity in a wide temperature window, whereas La2Co2O5, Co/La2O3 and Co3O4/La2O3 had markedly lower selectivity. It is suggested that Co3+ is crucial and that the strong resistivity of LaCoO3 towards reduction is responsible for the high and stable CO2 selectivity over a temperature range of 100 °C–220 °C. Higher oxygen concentration further broadens the PROX window.",
        "openArchiveArticle": "false",
        "prism:coverDate": "2025-03-31",
        "openaccessUserLicense": "http://creativecommons.org/licenses/by/4.0/",
        "prism:aggregationType": "Journal",
        "prism:url": "https://api.elsevier.com/content/article/pii/S0021951725000387",
        "dc:creator": [
          {
            "@_fa": "true",
            "$": "Yigit, Nevzat"
          },
          {
            "@_fa": "true",
            "$": "Föttinger, Karin"
          },
          {
            "@_fa": "true",
            "$": "Bernardi, Johannes"
          },
          {
            "@_fa": "true",
            "$": "Rupprechter, Günther"
          }
        ],
        "link": [
          {
            "@_fa": "true",
            "@rel": "self",
            "@href": "https://api.elsevier.com/content/article/pii/S0021951725000387"
          },
          {
            "@_fa": "true",
            "@rel": "scidir",
            "@href": "https://www.sciencedirect.com/science/article/pii/S0021951725000387"
          }
        ],
        "dc:format": "application/json",
        "openaccessType": "Full",
        "pii": "S0021-9517(25)00038-7",
        "prism:volume": "443",
        "articleNumber": "115973",
        "prism:publisher": "The Author(s). Published by Elsevier Inc.",
        "dc:title": "Preferential CO oxidation (PROX) on LaCoO3–based catalysts: Effect of cobalt oxidation state on selectivity",
        "prism:copyright": "© 2025 The Author(s). Published by Elsevier Inc.",
        "openaccess": "1",
        "prism:issn": "00219517",
        "dcterms:subject": [
          {
            "@_fa": "true",
            "$": "Perovskite"
          },
          {
            "@_fa": "true",
            "$": "Preferential Oxidation of CO"
          },
          {
            "@_fa": "true",
            "$": "Brownmillerite"
          },
          {
            "@_fa": "true",
            "$": "Exsolution"
          },
          {
            "@_fa": "true",
            "$": "Co Oxidation State"
          }
        ],
        "openaccessArticle": "true",
        "prism:publicationName": "Journal of Catalysis",
        "openaccessSponsorType": "FundingBody",
        "prism:pageRange": "115973",
        "pubType": "fla",
        "prism:coverDisplayDate": "March 2025",
        "prism:doi": "10.1016/j.jcat.2025.115973",
        "prism:startingPage": "115973",
        "dc:identifier": "doi:10.1016/j.jcat.2025.115973",
        "openaccessSponsorName": "Austria institutions 2024: Hybrid journals"
      },
      "objects": {
        "object": [
          {
            "@category": "standard",
            "@height": "878",
            "@width": "689",
            "@_fa": "true",
            "$": "https://api.elsevier.com/content/object/eid/1-s2.0-S0021951725000387-gr4.jpg?httpAccept=%2A%2F%2A",
            "@multimediatype": "JPEG image file",
            "@type": "IMAGE-DOWNSAMPLED",
            "@size": "146939",
            "@ref": "gr4",
            "@mimetype": "image/jpeg"
          },
          {
            "@category": "standard",
            "@height": "271",
            "@width": "689",
            "@_fa": "true",
            "$": "https://api.elsevier.com/content/object/eid/1-s2.0-S0021951725000387-gr5.jpg?httpAccept=%2A%2F%2A",
            "@multimediatype": "JPEG image file",
            "@type": "IMAGE-DOWNSAMPLED",
            "@size": "47045",
            "@ref": "gr5",
            "@mimetype": "image/jpeg"
          },
          {
            "@category": "standard",
            "@height": "235",
            "@width": "578",
            "@_fa": "true",
            "$": "https://api.elsevier.com/content/object/eid/1-s2.0-S0021951725000387-gr6.jpg?httpAccept=%2A%2F%2A",
            "@multimediatype": "JPEG image file",
            "@type": "IMAGE-DOWNSAMPLED",
            "@size": "40760",
            "@ref": "gr6",
            "@mimetype": "image/jpeg"
          },
          {
            "@category": "standard",
            "@height": "631",
            "@width": "689",
            "@_fa": "true",
            "$": "https://api.elsevier.com/content/object/eid/1-s2.0-S0021951725000387-gr1.jpg?httpAccept=%2A%2F%2A",
            "@multimediatype": "JPEG image file",
            "@type": "IMAGE-DOWNSAMPLED",
            "@size": "84416",
            "@ref": "gr1",
            "@mimetype": "image/jpeg"
          },
          {
            "@category": "standard",
            "@height": "337",
            "@width": "382",
            "@_fa": "true",
            "$": "https://api.elsevier.com/content/object/eid/1-s2.0-S0021951725000387-gr2.jpg?httpAccept=%2A%2F%2A",
            "@multimediatype": "JPEG image file",
            "@type": "IMAGE-DOWNSAMPLED",
            "@size": "37537",
            "@ref": "gr2",
            "@mimetype": "image/jpeg"
          },
          {
            "@category": "standard",
            "@height": "196",
            "@width": "500",
            "@_fa": "true",
            "$": "https://api.elsevier.com/content/object/eid/1-s2.0-S0021951725000387-ga1.jpg?httpAccept=%2A%2F%2A",
            "@multimediatype": "JPEG image file",
            "@type": "IMAGE-DOWNSAMPLED",
            "@size": "32572",
            "@ref": "ga1",
            "@mimetype": "image/jpeg"
          },
          {
            "@category": "standard",
            "@height": "590",
            "@width": "689",
            "@_fa": "true",
            "$": "https://api.elsevier.com/content/object/eid/1-s2.0-S0021951725000387-gr3.jpg?httpAccept=%2A%2F%2A",
            "@multimediatype": "JPEG image file",
            "@type": "IMAGE-DOWNSAMPLED",
            "@size": "129515",
            "@ref": "gr3",
            "@mimetype": "image/jpeg"
          },
          {
            "@category": "thumbnail",
            "@height": "163",
            "@width": "128",
            "@_fa": "true",
            "$": "https://api.elsevier.com/content/object/eid/1-s2.0-S0021951725000387-gr4.sml?httpAccept=%2A%2F%2A",
            "@multimediatype": "GIF image file",
            "@type": "IMAGE-THUMBNAIL",
            "@size": "8263",
            "@ref": "gr4",
            "@mimetype": "image/gif"
          },
          {
            "@category": "thumbnail",
            "@height": "86",
            "@width": "219",
            "@_fa": "true",
            "$": "https://api.elsevier.com/content/object/eid/1-s2.0-S0021951725000387-gr5.sml?httpAccept=%2A%2F%2A",
            "@multimediatype": "GIF image file",
            "@type": "IMAGE-THUMBNAIL",
            "@size": "5959",
            "@ref": "gr5",
            "@mimetype": "image/gif"
          },
          {
            "@category": "thumbnail",
            "@height": "89",
            "@width": "219",
            "@_fa": "true",
            "$": "https://api.elsevier.com/content/object/eid/1-s2.0-S0021951725000387-gr6.sml?httpAccept=%2A%2F%2A",
            "@multimediatype": "GIF image file",
            "@type": "IMAGE-THUMBNAIL",
            "@size": "6529",
            "@ref": "gr6",
            "@mimetype": "image/gif"
          },
          {
            "@category": "thumbnail",
            "@height": "164",
            "@width": "179",
            "@_fa": "true",
            "$": "https://api.elsevier.com/content/object/eid/1-s2.0-S0021951725000387-gr1.sml?httpAccept=%2A%2F%2A",
            "@multimediatype": "GIF image file",
            "@type": "IMAGE-THUMBNAIL",
            "@size": "7656",
            "@ref": "gr1",
            "@mimetype": "image/gif"
          },
          {
            "@category": "thumbnail",
            "@height": "164",
            "@width": "186",
            "@_fa": "true",
            "$": "https://api.elsevier.com/content/object/eid/1-s2.0-S0021951725000387-gr2.sml?httpAccept=%2A%2F%2A",
            "@multimediatype": "GIF image file",
            "@type": "IMAGE-THUMBNAIL",
            "@size": "8946",
            "@ref": "gr2",
            "@mimetype": "image/gif"
          },
          {
            "@category": "thumbnail",
            "@height": "86",
            "@width": "219",
            "@_fa": "true",
            "$": "https://api.elsevier.com/content/object/eid/1-s2.0-S0021951725000387-ga1.sml?httpAccept=%2A%2F%2A",
            "@multimediatype": "GIF image file",
            "@type": "IMAGE-THUMBNAIL",
            "@size": "9398",
            "@ref": "ga1",
            "@mimetype": "image/gif"
          },
          {
            "@category": "thumbnail",
            "@height": "164",
            "@width": "191",
            "@_fa": "true",
            "$": "https://api.elsevier.com/content/object/eid/1-s2.0-S0021951725000387-gr3.sml?httpAccept=%2A%2F%2A",
            "@multimediatype": "GIF image file",
            "@type": "IMAGE-THUMBNAIL",
            "@size": "21758",
            "@ref": "gr3",
            "@mimetype": "image/gif"
          },
          {
            "@category": "high",
            "@height": "3886",
            "@width": "3051",
            "@_fa": "true",
            "$": "https://api.elsevier.com/content/object/eid/1-s2.0-S0021951725000387-gr4_lrg.jpg?httpAccept=%2A%2F%2A",
            "@multimediatype": "JPEG image file",
            "@type": "IMAGE-HIGH-RES",
            "@size": "981919",
            "@ref": "gr4",
            "@mimetype": "image/jpeg"
          },
          {
            "@category": "high",
            "@height": "1201",
            "@width": "3051",
            "@_fa": "true",
            "$": "https://api.elsevier.com/content/object/eid/1-s2.0-S0021951725000387-gr5_lrg.jpg?httpAccept=%2A%2F%2A",
            "@multimediatype": "JPEG image file",
            "@type": "IMAGE-HIGH-RES",
            "@size": "298342",
            "@ref": "gr5",
            "@mimetype": "image/jpeg"
          },
          {
            "@category": "high",
            "@height": "1041",
            "@width": "2559",
            "@_fa": "true",
            "$": "https://api.elsevier.com/content/object/eid/1-s2.0-S0021951725000387-gr6_lrg.jpg?httpAccept=%2A%2F%2A",
            "@multimediatype": "JPEG image file",
            "@type": "IMAGE-HIGH-RES",
            "@size": "254896",
            "@ref": "gr6",
            "@mimetype": "image/jpeg"
          },
          {
            "@category": "high",
            "@height": "2793",
            "@width": "3051",
            "@_fa": "true",
            "$": "https://api.elsevier.com/content/object/eid/1-s2.0-S0021951725000387-gr1_lrg.jpg?httpAccept=%2A%2F%2A",
            "@multimediatype": "JPEG image file",
            "@type": "IMAGE-HIGH-RES",
            "@size": "573274",
            "@ref": "gr1",
            "@mimetype": "image/jpeg"
          },
          {
            "@category": "high",
            "@height": "1493",
            "@width": "1693",
            "@_fa": "true",
            "$": "https://api.elsevier.com/content/object/eid/1-s2.0-S0021951725000387-gr2_lrg.jpg?httpAccept=%2A%2F%2A",
            "@multimediatype": "JPEG image file",
            "@type": "IMAGE-HIGH-RES",
            "@size": "256426",
            "@ref": "gr2",
            "@mimetype": "image/jpeg"
          },
          {
            "@category": "high",
            "@height": "869",
            "@width": "2213",
            "@_fa": "true",
            "$": "https://api.elsevier.com/content/object/eid/1-s2.0-S0021951725000387-ga1_lrg.jpg?httpAccept=%2A%2F%2A",
            "@multimediatype": "JPEG image file",
            "@type": "IMAGE-HIGH-RES",
            "@size": "245567",
            "@ref": "ga1",
            "@mimetype": "image/jpeg"
          },
          {
            "@category": "high",
            "@height": "2614",
            "@width": "3051",
            "@_fa": "true",
            "$": "https://api.elsevier.com/content/object/eid/1-s2.0-S0021951725000387-gr3_lrg.jpg?httpAccept=%2A%2F%2A",
            "@multimediatype": "JPEG image file",
            "@type": "IMAGE-HIGH-RES",
            "@size": "1116772",
            "@ref": "gr3",
            "@mimetype": "image/jpeg"
          },
          {
            "@category": "standard",
            "@_fa": "true",
            "$": "https://api.elsevier.com/content/object/eid/1-s2.0-S0021951725000387-mmc1.pdf?httpAccept=%2A%2F%2A",
            "@multimediatype": "Acrobat PDF file",
            "@type": "APPLICATION",
            "@size": "1479148",
            "@ref": "mmc1",
            "@mimetype": "application/pdf"
          },
          {
            "@category": "thumbnail",
            "@_fa": "true",
            "$": "https://api.elsevier.com/content/object/eid/1-s2.0-S0021951725000387-si1.svg?httpAccept=%2A%2F%2A",
            "@multimediatype": "Scalable Vector Graphics file",
            "@type": "ALTIMG",
            "@size": "15788",
            "@ref": "si1",
            "@mimetype": "image/svg+xml"
          },
          {
            "@category": "thumbnail",
            "@_fa": "true",
            "$": "https://api.elsevier.com/content/object/eid/1-s2.0-S0021951725000387-si10.svg?httpAccept=%2A%2F%2A",
            "@multimediatype": "Scalable Vector Graphics file",
            "@type": "ALTIMG",
            "@size": "4537",
            "@ref": "si10",
            "@mimetype": "image/svg+xml"
          },
          {
            "@category": "thumbnail",
            "@_fa": "true",
            "$": "https://api.elsevier.com/content/object/eid/1-s2.0-S0021951725000387-si2.svg?httpAccept=%2A%2F%2A",
            "@multimediatype": "Scalable Vector Graphics file",
            "@type": "ALTIMG",
            "@size": "25433",
            "@ref": "si2",
            "@mimetype": "image/svg+xml"
          },
          {
            "@category": "thumbnail",
            "@_fa": "true",
            "$": "https://api.elsevier.com/content/object/eid/1-s2.0-S0021951725000387-si3.svg?httpAccept=%2A%2F%2A",
            "@multimediatype": "Scalable Vector Graphics file",
            "@type": "ALTIMG",
            "@size": "21300",
            "@ref": "si3",
            "@mimetype": "image/svg+xml"
          },
          {
            "@category": "thumbnail",
            "@_fa": "true",
            "$": "https://api.elsevier.com/content/object/eid/1-s2.0-S0021951725000387-si4.svg?httpAccept=%2A%2F%2A",
            "@multimediatype": "Scalable Vector Graphics file",
            "@type": "ALTIMG",
            "@size": "16016",
            "@ref": "si4",
            "@mimetype": "image/svg+xml"
          },
          {
            "@category": "thumbnail",
            "@_fa": "true",
            "$": "https://api.elsevier.com/content/object/eid/1-s2.0-S0021951725000387-si5.svg?httpAccept=%2A%2F%2A",
            "@multimediatype": "Scalable Vector Graphics file",
            "@type": "ALTIMG",
            "@size": "17387",
            "@ref": "si5",
            "@mimetype": "image/svg+xml"
          },
          {
            "@category": "thumbnail",
            "@_fa": "true",
            "$": "https://api.elsevier.com/content/object/eid/1-s2.0-S0021951725000387-si6.svg?httpAccept=%2A%2F%2A",
            "@multimediatype": "Scalable Vector Graphics file",
            "@type": "ALTIMG",
            "@size": "36959",
            "@ref": "si6",
            "@mimetype": "image/svg+xml"
          },
          {
            "@category": "thumbnail",
            "@_fa": "true",
            "$": "https://api.elsevier.com/content/object/eid/1-s2.0-S0021951725000387-si7.svg?httpAccept=%2A%2F%2A",
            "@multimediatype": "Scalable Vector Graphics file",
            "@type": "ALTIMG",
            "@size": "35645",
            "@ref": "si7",
            "@mimetype": "image/svg+xml"
          },
          {
            "@category": "thumbnail",
            "@_fa": "true",
            "$": "https://api.elsevier.com/content/object/eid/1-s2.0-S0021951725000387-si8.svg?httpAccept=%2A%2F%2A",
            "@multimediatype": "Scalable Vector Graphics file",
            "@type": "ALTIMG",
            "@size": "14935",
            "@ref": "si8",
            "@mimetype": "image/svg+xml"
          },
          {
            "@category": "thumbnail",
            "@_fa": "true",
            "$": "https://api.elsevier.com/content/object/eid/1-s2.0-S0021951725000387-si9.svg?httpAccept=%2A%2F%2A",
            "@multimediatype": "Scalable Vector Graphics file",
            "@type": "ALTIMG",
            "@size": "27702",
            "@ref": "si9",
            "@mimetype": "image/svg+xml"
          }
        ]
      },
      "link": {
        "@rel": "abstract",
        "@href": "https://api.elsevier.com/content/abstract/scopus_id/85217086330"
      }
    }
  }
}