{
  "metadata": {
    "title": "Ultrasmall Co confined in the silanols of dealuminated beta zeolite: A highly active and selective catalyst for direct dehydrogenation of propane to propylene",
    "authors": "; ; ",
    "journal": "Journal of Catalysis",
    "date": "2020-03-31",
    "doi": "10.1016/j.jcat.2019.12.037",
    "abstract": "",
    "uri": "https://api.elsevier.com/content/article/pii/S0021951719306426",
    "pii": "S0021951719306426"
  },
  "fulltext": {
    "full-text-retrieval-response": {
      "scopus-eid": "2-s2.0-85078297339",
      "originalText": "serial JL 272561 291210 291744 291809 31 Journal of Catalysis JOURNALCATALYSIS 2020-01-28 2020-01-28 2020-01-28 2020-01-28 2020-02-27T17:14:25 1-s2.0-S0021951719306426 S0021-9517(19)30642-6 S0021951719306426 10.1016/j.jcat.2019.12.037 S300 S300.1 FULL-TEXT 1-s2.0-S0021951720X00029 2020-03-12T07:01:07.984296Z 0 0 20200301 20200331 2020 2020-01-28T18:16:26.580399Z absattachment articleinfo articletitlenorm authfirstinitialnorm authfirstsurnamenorm cid cids contenttype copyright crossmark dateloaded dateloadedtxt datesearch datesort dateupdated dco docsubtype doctype doi eid ewtransactionid hubeid indexeddate issn issnnorm itemstage itemtransactionid itemweight openaccess openarchive pg pgfirst pglast pii piinorm pubdateend pubdatestart pubdatetxt pubyr sectiontitle sortorder srctitle srctitlenorm srctype ssids alllist content subj subheadings suppl tomb volfirst volissue volumelist webpdf webpdfpagecount yearnav figure table e-component body mmlmath acknowledge affil appendices articletitle auth authfirstini authfull authkeywords authlast grantnumber grantsponsor grantsponsorid highlightsabst orcid primabst ref specialabst 0021-9517 00219517 true 383 383 C Volume 383 10 77 87 77 87 202003 March 2020 2020-03-01 2020-03-31 2020 Regular Articles article fla © 2020 Elsevier Inc. All rights reserved. ULTRASMALLCOCONFINEDINSILANOLSDEALUMINATEDBETAZEOLITEAHIGHLYACTIVESELECTIVECATALYSTFORDIRECTDEHYDROGENATIONPROPANEPROPYLENE CHEN C 1 Introduction 2 Experimental 2.1 Catalyst preparation 2.2 Catalyst characterization 2.3 Catalytic PDH evaluation 3 Results and discussion 3.1 Catalytic performances of 0.5CoSiBeta catalysts 3.2 Characterization of 0.5CoSiBeta catalysts 3.3 The nature of active Co phases in CoSiBeta catalysts 3.4 Catalyst stability and performance comparison 4 Conclusions Acknowledgments Appendix A Supplementary material References SHI 2015 13994 13998 L XIONG 2017 8986 8991 H SATTLER 2014 10613 10653 J CHEN 2019 868 877 C SUN 2014 145 151 Y GONG 2016 601 614 T SATTLER 2014 9251 9256 J ZHAO 2018 6791 6795 Z ZHAO 2018 11117 11127 Y ESTES 2016 14987 14997 D LI 2001 1176 1184 W HU 2015 24 37 B HU 2017 3330 3337 B SUN 2015 1413 1419 Y SUN 2015 42 45 Y LI 2018 688 693 X BLANCHRAGA 2016 90 97 N OGURA 2014 1 5 M HELD 2018 18570 18582 A BARAN 2014 4143 4150 R BARAN 2014 20445 20451 R CHALUPKA 2015 9 18 K SONG 2016 8325 8335 S SUN 2018 3044 3051 L GAC 2018 94 109 W TANG 2014 2281 2291 B CHAI 2018 230 239 Y YAN 2018 1923 1930 Y ZHANG 2019 7209 7216 X JI 2009 7186 7199 Y OTTO 2017 173 185 T CHENG 2018 3250 Q ROKICINSKA 2017 59 67 A JACOBS 2002 263 281 G PEREIRA 2011 179 189 A MARTINEZHERNANDEZ 2005 167 174 A VERBERCKMOES 1998 165 178 A BELLMANN 2018 184 193 A KOJIMA 1991 7595 7598 K ZHANG 2016 487 494 X CHEN 2016 154 159 Z SELVAM 2005 276 287 P TSONCHEVA 2009 365 374 T KOIRALA 2018 77 85 R LUO 2019 143 156 Q KUBONOVA 2017 57 72 L HE 2015 9550 9559 X LIU 2016 1 9 L REN 2009 78 83 L TANG 2004 1967 1976 Q JACOBS 2002 G PAWEL 2015 507 517 B BARAN 2016 515 523 R ZHANG 2017 1207 1215 G GU 2015 11407 11418 D XIANG 2019 41 49 R WANG 2000 227 239 X CHENX2020X77 CHENX2020X77X87 CHENX2020X77XC CHENX2020X77X87XC 2022-01-28T00:00:00.000Z 2022-01-28T00:00:00.000Z http://creativecommons.org/licenses/by-nc-nd/4.0/ © 2020 Elsevier Inc. All rights reserved. 2020-01-03T12:48:09.567Z http://vtw.elsevier.com/data/voc/AddOnTypes/50.7/eoas NSFC National Natural Science Foundation of China http://data.elsevier.com/vocabulary/SciValFunders/501100001809 http://sws.geonames.org/1814991 item S0021-9517(19)30642-6 S0021951719306426 1-s2.0-S0021951719306426 10.1016/j.jcat.2019.12.037 272561 2020-03-12T07:01:07.984296Z 2020-03-01 2020-03-31 1-s2.0-S0021951719306426-main.pdf https://s3-eu-west-1.amazonaws.com/prod-ucs-content-store-eu-west/content/pii:S0021951719306426/MAIN/application/pdf/99503d4fcbb5f429e8f91d1afa5ac439/main.pdf main.pdf pdf true 1759626 MAIN 11 1-s2.0-S0021951719306426-main_1.png https://s3-eu-west-1.amazonaws.com/prod-ucs-content-store-eu-west/content/pii:S0021951719306426/PREVIEW/image/png/13e5d4b8a96fc84cdcd449b32fd1151f/main_1.png main_1.png png 57859 849 656 IMAGE-WEB-PDF 1 1-s2.0-S0021951719306426-gr1.jpg https://s3-eu-west-1.amazonaws.com/prod-ucs-content-store-eu-west/content/pii:S0021951719306426/gr1/DOWNSAMPLED/image/jpeg/95ed0b5e1b20f91ab19402d3f3c7298c/gr1.jpg gr1 gr1.jpg jpg 26931 238 578 IMAGE-DOWNSAMPLED 1-s2.0-S0021951719306426-gr10.jpg https://s3-eu-west-1.amazonaws.com/prod-ucs-content-store-eu-west/content/pii:S0021951719306426/gr10/DOWNSAMPLED/image/jpeg/c8b95955ca6a73134b0ef2a5b503e949/gr10.jpg gr10 gr10.jpg jpg 24421 260 369 IMAGE-DOWNSAMPLED 1-s2.0-S0021951719306426-gr11.jpg https://s3-eu-west-1.amazonaws.com/prod-ucs-content-store-eu-west/content/pii:S0021951719306426/gr11/DOWNSAMPLED/image/jpeg/782edae29b2abdd03a166449ed2981e1/gr11.jpg gr11 gr11.jpg jpg 31450 242 621 IMAGE-DOWNSAMPLED 1-s2.0-S0021951719306426-gr2.jpg https://s3-eu-west-1.amazonaws.com/prod-ucs-content-store-eu-west/content/pii:S0021951719306426/gr2/DOWNSAMPLED/image/jpeg/649f14c4386e3e76b926939492aac369/gr2.jpg gr2 gr2.jpg jpg 29456 232 576 IMAGE-DOWNSAMPLED 1-s2.0-S0021951719306426-gr3.jpg https://s3-eu-west-1.amazonaws.com/prod-ucs-content-store-eu-west/content/pii:S0021951719306426/gr3/DOWNSAMPLED/image/jpeg/5f005e3c3c938031deb5928e19359ae8/gr3.jpg gr3 gr3.jpg jpg 37829 244 575 IMAGE-DOWNSAMPLED 1-s2.0-S0021951719306426-gr4.jpg https://s3-eu-west-1.amazonaws.com/prod-ucs-content-store-eu-west/content/pii:S0021951719306426/gr4/DOWNSAMPLED/image/jpeg/40f5a49e1f6d1f4f52060945845ac12c/gr4.jpg gr4 gr4.jpg jpg 35297 293 347 IMAGE-DOWNSAMPLED 1-s2.0-S0021951719306426-gr5.jpg https://s3-eu-west-1.amazonaws.com/prod-ucs-content-store-eu-west/content/pii:S0021951719306426/gr5/DOWNSAMPLED/image/jpeg/4f1e5e3be5b977e92d705353239e29d5/gr5.jpg gr5 gr5.jpg jpg 60729 218 762 IMAGE-DOWNSAMPLED 1-s2.0-S0021951719306426-gr6.jpg https://s3-eu-west-1.amazonaws.com/prod-ucs-content-store-eu-west/content/pii:S0021951719306426/gr6/DOWNSAMPLED/image/jpeg/ecf68558ad787160ed4e2abaef970a8b/gr6.jpg gr6 gr6.jpg jpg 88647 388 578 IMAGE-DOWNSAMPLED 1-s2.0-S0021951719306426-gr7.jpg https://s3-eu-west-1.amazonaws.com/prod-ucs-content-store-eu-west/content/pii:S0021951719306426/gr7/DOWNSAMPLED/image/jpeg/40dc662a41aa675c83ef6db02229f0a0/gr7.jpg gr7 gr7.jpg jpg 49369 226 755 IMAGE-DOWNSAMPLED 1-s2.0-S0021951719306426-gr8.jpg https://s3-eu-west-1.amazonaws.com/prod-ucs-content-store-eu-west/content/pii:S0021951719306426/gr8/DOWNSAMPLED/image/jpeg/4227fc7917dc3292308de3a8f176c4a0/gr8.jpg gr8 gr8.jpg jpg 63465 735 578 IMAGE-DOWNSAMPLED 1-s2.0-S0021951719306426-gr9.jpg https://s3-eu-west-1.amazonaws.com/prod-ucs-content-store-eu-west/content/pii:S0021951719306426/gr9/DOWNSAMPLED/image/jpeg/61a53fcfdc3688b5096c87718d51e152/gr9.jpg gr9 gr9.jpg jpg 36784 240 575 IMAGE-DOWNSAMPLED 1-s2.0-S0021951719306426-ga1.jpg https://s3-eu-west-1.amazonaws.com/prod-ucs-content-store-eu-west/content/pii:S0021951719306426/ga1/DOWNSAMPLED/image/jpeg/071af840feb42340902da2699b1b47c1/ga1.jpg ga1 true ga1.jpg jpg 27094 200 435 IMAGE-DOWNSAMPLED 1-s2.0-S0021951719306426-gr1.sml https://s3-eu-west-1.amazonaws.com/prod-ucs-content-store-eu-west/content/pii:S0021951719306426/gr1/THUMBNAIL/image/gif/665486ef451471a9f41ff2754dceda28/gr1.sml gr1 gr1.sml sml 4733 90 219 IMAGE-THUMBNAIL 1-s2.0-S0021951719306426-gr10.sml https://s3-eu-west-1.amazonaws.com/prod-ucs-content-store-eu-west/content/pii:S0021951719306426/gr10/THUMBNAIL/image/gif/9fbb40ba7dd1a8b35e57dfa7071b351b/gr10.sml gr10 gr10.sml sml 12135 154 219 IMAGE-THUMBNAIL 1-s2.0-S0021951719306426-gr11.sml https://s3-eu-west-1.amazonaws.com/prod-ucs-content-store-eu-west/content/pii:S0021951719306426/gr11/THUMBNAIL/image/gif/72985fb28c4aabd089f50a4c27d1eb18/gr11.sml gr11 gr11.sml sml 4961 85 219 IMAGE-THUMBNAIL 1-s2.0-S0021951719306426-gr2.sml https://s3-eu-west-1.amazonaws.com/prod-ucs-content-store-eu-west/content/pii:S0021951719306426/gr2/THUMBNAIL/image/gif/1214d55d56b3c3d58cc42d4d6dadade3/gr2.sml gr2 gr2.sml sml 5175 88 219 IMAGE-THUMBNAIL 1-s2.0-S0021951719306426-gr3.sml https://s3-eu-west-1.amazonaws.com/prod-ucs-content-store-eu-west/content/pii:S0021951719306426/gr3/THUMBNAIL/image/gif/bf42401a29aaf4abccd288db433777c8/gr3.sml gr3 gr3.sml sml 6188 93 219 IMAGE-THUMBNAIL 1-s2.0-S0021951719306426-gr4.sml https://s3-eu-west-1.amazonaws.com/prod-ucs-content-store-eu-west/content/pii:S0021951719306426/gr4/THUMBNAIL/image/gif/14fdce0461c18d57d98a753162f7cb82/gr4.sml gr4 gr4.sml sml 19329 164 194 IMAGE-THUMBNAIL 1-s2.0-S0021951719306426-gr5.sml https://s3-eu-west-1.amazonaws.com/prod-ucs-content-store-eu-west/content/pii:S0021951719306426/gr5/THUMBNAIL/image/gif/c9fcaeee6fbfce649bcecafb2d9845b0/gr5.sml gr5 gr5.sml sml 6947 63 219 IMAGE-THUMBNAIL 1-s2.0-S0021951719306426-gr6.sml https://s3-eu-west-1.amazonaws.com/prod-ucs-content-store-eu-west/content/pii:S0021951719306426/gr6/THUMBNAIL/image/gif/8b7b8619abd6c2ae79df5778f4100362/gr6.sml gr6 gr6.sml sml 23336 147 219 IMAGE-THUMBNAIL 1-s2.0-S0021951719306426-gr7.sml https://s3-eu-west-1.amazonaws.com/prod-ucs-content-store-eu-west/content/pii:S0021951719306426/gr7/THUMBNAIL/image/gif/68b728da518e00e6206f8e4002eeb976/gr7.sml gr7 gr7.sml sml 5742 65 219 IMAGE-THUMBNAIL 1-s2.0-S0021951719306426-gr8.sml https://s3-eu-west-1.amazonaws.com/prod-ucs-content-store-eu-west/content/pii:S0021951719306426/gr8/THUMBNAIL/image/gif/68f74a830a047255b2f933ff870342d3/gr8.sml gr8 gr8.sml sml 5144 164 129 IMAGE-THUMBNAIL 1-s2.0-S0021951719306426-gr9.sml https://s3-eu-west-1.amazonaws.com/prod-ucs-content-store-eu-west/content/pii:S0021951719306426/gr9/THUMBNAIL/image/gif/9e31c6ce917a753f310a19939cfa69f1/gr9.sml gr9 gr9.sml sml 7004 91 219 IMAGE-THUMBNAIL 1-s2.0-S0021951719306426-ga1.sml https://s3-eu-west-1.amazonaws.com/prod-ucs-content-store-eu-west/content/pii:S0021951719306426/ga1/THUMBNAIL/image/gif/2ac1cb9f2c557b18288dfaf8f38187b9/ga1.sml ga1 true ga1.sml sml 9089 101 219 IMAGE-THUMBNAIL 1-s2.0-S0021951719306426-gr1_lrg.jpg https://s3-eu-west-1.amazonaws.com/prod-ucs-content-store-eu-west/content/pii:S0021951719306426/gr1/HIGHRES/image/jpeg/b3c13de5b1ab1dc31e0f52caa26063a0/gr1_lrg.jpg gr1 gr1_lrg.jpg jpg 191354 1056 2560 IMAGE-HIGH-RES 1-s2.0-S0021951719306426-gr10_lrg.jpg https://s3-eu-west-1.amazonaws.com/prod-ucs-content-store-eu-west/content/pii:S0021951719306426/gr10/HIGHRES/image/jpeg/71877fb0e4f077a544e45598b0221028/gr10_lrg.jpg gr10 gr10_lrg.jpg jpg 143504 1152 1635 IMAGE-HIGH-RES 1-s2.0-S0021951719306426-gr11_lrg.jpg https://s3-eu-west-1.amazonaws.com/prod-ucs-content-store-eu-west/content/pii:S0021951719306426/gr11/HIGHRES/image/jpeg/10dbbf9a0cbcddcad220e57270cd5b18/gr11_lrg.jpg gr11 gr11_lrg.jpg jpg 198640 1072 2752 IMAGE-HIGH-RES 1-s2.0-S0021951719306426-gr2_lrg.jpg https://s3-eu-west-1.amazonaws.com/prod-ucs-content-store-eu-west/content/pii:S0021951719306426/gr2/HIGHRES/image/jpeg/43fe791e996f3f4c5fa011b63f33d599/gr2_lrg.jpg gr2 gr2_lrg.jpg jpg 205366 1029 2553 IMAGE-HIGH-RES 1-s2.0-S0021951719306426-gr3_lrg.jpg https://s3-eu-west-1.amazonaws.com/prod-ucs-content-store-eu-west/content/pii:S0021951719306426/gr3/HIGHRES/image/jpeg/490467358d556cc62d291f9bdff1b7b6/gr3_lrg.jpg gr3 gr3_lrg.jpg jpg 277897 1080 2547 IMAGE-HIGH-RES 1-s2.0-S0021951719306426-gr4_lrg.jpg https://s3-eu-west-1.amazonaws.com/prod-ucs-content-store-eu-west/content/pii:S0021951719306426/gr4/HIGHRES/image/jpeg/2a78b5a7d36928cc10bc71f07fff1698/gr4_lrg.jpg gr4 gr4_lrg.jpg jpg 308789 1296 1537 IMAGE-HIGH-RES 1-s2.0-S0021951719306426-gr5_lrg.jpg https://s3-eu-west-1.amazonaws.com/prod-ucs-content-store-eu-west/content/pii:S0021951719306426/gr5/HIGHRES/image/jpeg/3102424ae2712a66b077a3420e2d1bbd/gr5_lrg.jpg gr5 gr5_lrg.jpg jpg 474247 968 3376 IMAGE-HIGH-RES 1-s2.0-S0021951719306426-gr6_lrg.jpg https://s3-eu-west-1.amazonaws.com/prod-ucs-content-store-eu-west/content/pii:S0021951719306426/gr6/HIGHRES/image/jpeg/1aa91a889414e45f5ecfef5ebb9bc480/gr6_lrg.jpg gr6 gr6_lrg.jpg jpg 819923 1720 2559 IMAGE-HIGH-RES 1-s2.0-S0021951719306426-gr7_lrg.jpg https://s3-eu-west-1.amazonaws.com/prod-ucs-content-store-eu-west/content/pii:S0021951719306426/gr7/HIGHRES/image/jpeg/0db2128b26bb2f58c46b82a12770c404/gr7_lrg.jpg gr7 gr7_lrg.jpg jpg 373935 1000 3344 IMAGE-HIGH-RES 1-s2.0-S0021951719306426-gr8_lrg.jpg https://s3-eu-west-1.amazonaws.com/prod-ucs-content-store-eu-west/content/pii:S0021951719306426/gr8/HIGHRES/image/jpeg/284c1c4b501481a2ef398d39207d5cc2/gr8_lrg.jpg gr8 gr8_lrg.jpg jpg 481594 3256 2560 IMAGE-HIGH-RES 1-s2.0-S0021951719306426-gr9_lrg.jpg https://s3-eu-west-1.amazonaws.com/prod-ucs-content-store-eu-west/content/pii:S0021951719306426/gr9/HIGHRES/image/jpeg/4ee95271dd687823ffbe49e9948763a0/gr9_lrg.jpg gr9 gr9_lrg.jpg jpg 290769 1064 2547 IMAGE-HIGH-RES 1-s2.0-S0021951719306426-ga1_lrg.jpg https://s3-eu-west-1.amazonaws.com/prod-ucs-content-store-eu-west/content/pii:S0021951719306426/ga1/HIGHRES/image/jpeg/2beeacd483cb6f86aa31e0c02f92839a/ga1_lrg.jpg ga1 true ga1_lrg.jpg jpg 83794 531 1155 IMAGE-HIGH-RES 1-s2.0-S0021951719306426-mmc1.docx https://s3-eu-west-1.amazonaws.com/prod-ucs-content-store-eu-west/content/pii:S0021951719306426/mmc1/MAIN/application/vnd.openxmlformats-officedocument.wordprocessingml.document/ae2e5afbdf8053c98c89b855db02bf23/mmc1.docx mmc1 mmc1.docx docx 6493627 APPLICATION 1-s2.0-S0021951719306426-si1.svg https://s3-eu-west-1.amazonaws.com/prod-ucs-content-store-eu-west/content/pii:S0021951719306426/STRIPIN/image/svg+xml/4b57dba7305bc13c05e0d1efccad7e87/si1.svg si1 si1.svg svg 27337 ALTIMG 1-s2.0-S0021951719306426-si2.svg https://s3-eu-west-1.amazonaws.com/prod-ucs-content-store-eu-west/content/pii:S0021951719306426/STRIPIN/image/svg+xml/c9d6e84014c36177d794ccb2c40dcdbc/si2.svg si2 si2.svg svg 29815 ALTIMG 1-s2.0-S0021951719306426-si3.svg https://s3-eu-west-1.amazonaws.com/prod-ucs-content-store-eu-west/content/pii:S0021951719306426/STRIPIN/image/svg+xml/271e226e42de93f9cb6ef27120b22227/si3.svg si3 si3.svg svg 28021 ALTIMG 1-s2.0-S0021951719306426-am.pdf am am.pdf pdf 1149869 AAM-PDF https://s3-eu-west-1.amazonaws.com/prod-ucs-content-store-eu-west/content/egi:104RMN9LV44/MAIN/application/pdf/72b0b9646ddbc96e7a3e9fa9cb02c699/am.pdf YJCAT 13593 S0021-9517(19)30642-6 10.1016/j.jcat.2019.12.037 Elsevier Inc. Fig. 1 Propane conversion (a) and propylene selectivity (b) of the 0.5CoSiBeta and Re0.5CoSiBeta600 catalysts. Reaction conditions: 0.3 g catalyst, 5 vol% C3H8/N2, 20 mL/min, 600 °C. Fig. 2 Propane conversions (a) and propylene selectivities (b) of the Re0.5CoSiBeta catalysts prereduced under H2 at different temperatures for 1 h. Reaction conditions: 0.3 g catalyst, 5 vol% C3H8/N2, 20 mL/min, 600 °C. Fig. 3 XRD patterns (a) and DRIFT spectra (b) of AlBeta, SiBeta, and 0.5CoSiBeta samples. The insets for AlBeta, SiBeta, and 0.5CoSiBeta correspond to a magnification of 1000×. Fig. 4 TEM images (a and b), EDS spectrum obtained from these TEM images (c), and EDS mappings (d) of the 0.5CoSiBeta catalyst. Fig. 5 H2 TPR profiles (a), XPS spectra (b), and DR UV–vis spectra (c) of the 0.5CoSiBeta catalysts with and without prereduction treatments at different temperatures for 1 h. Fig. 6 TEM images (a and b) of the Re0.5CoSiBeta600 catalyst. TEM images (c and d), EDS mappings (e), and HR-TEM image (f) of the Re0.5CoSiBeta800 catalyst. Inset in (c): particle size distributions in the Re0.5CoSiBeta800 catalyst. Fig. 7 XRD patterns (a), H2 TPR profiles (b), and DR UV–vis spectra (c) of the CoSiBeta catalysts with different Co loadings. Fig. 8 Propane conversion (a) and propylene selectivity (b) of CoSiBeta catalysts with different Co loadings. Propane conversion (c) and propylene selectivity (d) of varied 10CoSiBeta catalysts. (The Re10CoSiBeta were obtained from in situ reduction treatment, the Reox10CoSiBeta from reduction–oxidation treatment). Reaction conditions: 0.3 g catalyst, 5 vol% C3H8/N2, 20 mL/min, 600 °C. Fig. 9 Co2p XPS spectra of selected samples. Fig. 10 Model diagram of different cobalt species present on SiBeta support. Fig. 11 Reusability (a) of the 0.5CoSiBeta catalyst and comparison of TOF values (b) obtained at 550 °C over the recently reported Co catalysts in PDH reaction. Table 1 Catalytic performance of the samples. a Samples Propane conversion (%) Propylene selectivity (%) Deactivation rate (%) d C max b C final b S max c S final c 0.5CoSiBeta 53.0 40.2 98.2 98.3 24.1 0.5CoAlBeta 18.4 12.7 43.5 47.2 20.1 Re0.5CoSiBeta600 57.4 44.6 96.0 97.5 21.1 Re0.5CoSiBeta700 72.4 38.7 93.1 96.7 44.5 Re0.5CoSiBeta800 40.9 29.3 96.9 98.0 27.5 1CoSiBeta 58.8 49.4 98.4 98.3 16.1 Re1CoSiBeta 63.4 48.5 98.0 98.4 23.2 3CoSiBeta 80.3 38.4 94.6 96.6 51.2 Re3CoSiBeta 81.6 33.6 95.1 96.8 58.1 10CoSiBeta 81.4 38.6 94.4 97.6 51.0 Re10CoSiBeta 78.8 39.7 95.9 98.0 48.5 a Reaction conditions: after reaction for 6 h, 0.3 g catalyst, 5 vol% C3H8/N2, 20 mL/min, 600 °C. b C max and C final represent the maximum and final propane conversion, respectively. c S max and S final represent the maximum and final propylene selectivity, respectively. d Relative to the maximum propane conversion at 6 h on stream. Table 2 The XRD parameters and textural properties of AlBeta, SiBeta, and xCoSiBeta samples. Samples 2θ (°) d 302 (Å) S BET (m2 g−1) a V total (cm3 g−1) b AlBeta 22.54 3.9414 460 0.365 SiBeta 22.57 3.9346 472 0.395 0.5CoSiBeta 22.50 3.9484 450 0.377 1CoSiBeta — — 449 0.370 3CoSiBeta — — 440 0.358 10CoSiBeta — — 400 0.326 a Specific surface area calculated by the BET method. b Obtained at P/P 0 = 0.98. Ultrasmall Co confined in the silanols of dealuminated beta zeolite: A highly active and selective catalyst for direct dehydrogenation of propane to propylene Chong Chen a b Shoumin Zhang b Zheng Wang c Zhong-Yong Yuan a b ⁎ a National Institute for Advanced Materials, School of Materials Science and Engineering, Nankai University, Tianjin 300350, China National Institute for Advanced Materials School of Materials Science and Engineering Nankai University Tianjin 300350 China National Institute for Advanced Materials, School of Materials Science and Engineering, Nankai University, Tianjin 300350, China b Key Laboratory of Advanced Energy Materials Chemistry (Ministry of Education), College of Chemistry, Nankai University, Tianjin 300071, China Key Laboratory of Advanced Energy Materials Chemistry (Ministry of Education) College of Chemistry Nankai University Tianjin 300071 China Key Laboratory of Advanced Energy Materials Chemistry (Ministry of Education), College of Chemistry, Nankai University, Tianjin 300071, China c State Key Laboratory of High-efficiency Utilization of Coal and Green Chemical Engineering, Ningxia University, Yinchuan 750021, China State Key Laboratory of High-efficiency Utilization of Coal and Green Chemical Engineering Ningxia University Yinchuan 750021 China State Key Laboratory of High-efficiency Utilization of Coal and Green Chemical Engineering, Ningxia University, Yinchuan 750021, China ⁎ Corresponding author at: National Institute for Advanced Materials, School of Materials Science and Engineering, Nankai University, Tianjin 300350, China. National Institute for Advanced Materials School of Materials Science and Engineering Nankai University Tianjin 300350 China Graphical abstract A small amount of Co (0.5 wt%) supported on dealuminated Beta zeolite shows much better catalytic performance than other Co catalysts. The small confined metallic Co serving as the active site is proposed. CoO x within dealuminated Beta (SiBeta) zeolite developing into ultrasmall-sized Co particles under H2 or reactant gas is highly efficient for catalyzing direct dehydrogenation of propane (PDH) to propylene reaction. The existence of highly dispersed CoO x species is identified, and the easily reducible CoO x species are confined in the created T-sites (silanols) of SiBeta support. The CoSiBeta catalysts with or without prereduction treatments show similar catalytic performance but different induction periods, implying that the metallic Co formed in situ during the reaction are the active sites. Co in SiBeta zeolite (0.5 wt%) showed state-of-the-art propylene productivity with propane conversion of about 72% and propylene selectivity of over 92% at 600 °C, which is far better than that of the other reported Co catalysts and comparable to that of industrial catalysts. This work proves the high catalytic ability and product selectivity of small confined Co particles, as well as providing novel inspiration for the design of low-cost, ecofriendly, and advanced catalysts for PDH. Keywords Propane dehydrogenation CoSiBeta catalyst Active sites Confined Co particles Silanols 1 Introduction Continuous global oil depletion provokes the urgent demand to find an alternative way to produce propylene. Direct dehydrogenation of propane (PDH) to propylene is thus of great significance in the chemical industry, upgrading low-priced and abundant propane to value-added propylene. Supported CrO x and Pt catalysts used in the PDH industry exhibit very high catalytic activity, but suffer from various problems such as high price, environmental hostility, and fast deactivation [1–4]. Alternatively, several transition metals, void of shortcomings typical of CrO x and Pt catalysts, have been investigated for the PDH reaction [3]. Unfortunately, they achieved much lower catalytic activity or propylene selectivity for PDH [5–8]. Thus, it is still urgent and challenging to design a green and low-priced PDH catalyst with high reactivity and great selectivity to propylene. The earth abundance of Co bodes well for long-term utility, and it has been reported to show a certain degree of catalytic activity for PDH [9,10]. Iglesia et al. found that alkane dehydrogenation over Co-ZSM-5 catalysts had reactivity similar to that over Ga-ZSM-5 [11]. However, the specific active phase of cobalt catalysts in PDH is still unresolved. The catalytic ability of Co(II) for C–H activation of propane was proposed by Coperet et al. [10]. Hu et al. reported that silica-supported single-site Co2+ was highly selective toward propylene [12] and proposed a nonredox mechanism involving heterolytic C–H bond cleavage over single-site Co2+ sites in tetrahedral coordination. Afterward, they put forward that the tetrahedral Co2+ species acting as Lewis acidic sites in CoAl2O4 were also active sites in the PDH reaction [13], which could not be reduced during the reaction procedure at 550 °C. They did not explain the presence of an induction period or the cause of catalyst deactivation. Sun et al. similarly reported that the ‘‘surface Co spinel’’ derived from tetracoordinated Co(II) on Al2O3 support under reaction conditions accounted for catalyzing the PDH reaction at a low Co loading [14], and large Co3O4 crystallites formed at high Co loadings were easily reduced to metallic Co particles in favor of cracking reactions. Sulfate addition could lead to improved catalytic performance by dispersing cobalt species well and restraining the reduction to metallic Co [15]. Tetrahedral Co2+ ions are widely recognized to be the active phases in spite of the varied coordination environments. Metallic Co was considered as the active site for cracking and coking reactions, which are responsible for catalyst deactivation. However, the above reports showing the catalytic ability of Co2+ lacked contrasting experiments with reduced Co catalysts. Recently Li’s group gave new insight into the active phase of Co/Al2O3 catalyst in the PDH reaction [16]. The Co/Al2O3 catalyst treated through a reduction–reoxidization procedure showed high catalytic activity, indicating that small metallic Co particles were the active sites. This inspires us to reexamine the active phases of cobalt catalysts in PDH. Moreover, there is a great need to explore an efficient cobalt catalyst for PDH because the catalytic performance of the previously reported cobalt catalysts is still unsatisfactory and falls short of industrial demand. The distribution and reduction behavior of cobalt species is directly related to the support types, while general SiO2 and Al2O3 supports have inferior structures leading to ill-defined surface-active species. To expose more active sites, metal catalysts are generally downsized into nanoparticulate form and stabilized onto certain substrates. Beta zeolite is such a substrate that possesses high specific surface area for well-dispersed metal species and high stability for tolerance of harsh reaction conditions, as well as an adjustable inner environment for changing the surrounding environment of metal catalysts, and thus has been widely employed to support metal catalysts [17,18]. Moreover, the dealumination of Beta zeolite developed by Dzwigaj et al. is a good way to further modify its structural and acidic properties, since the created T-vacant sites and low acidity are beneficial for many catalytic reactions [19–22]. We prepared cobalt catalysts supported on dealuminated Beta (SiBeta) based on Dzwigaj’s method, followed by high-temperature calcination in air to obtain CoSiBeta catalysts for PDH. After prereduction under optimum conditions, the 0.5CoSiBeta catalyst (Co loading is 0.5 wt%) showed propane conversion as high as 72% with propylene selectivity of around 92%. The 0.5CoSiBeta catalysts with or without prereduction treatments likely contained single cobalt species, as detected by a series of techniques of XRD, N2 sorption, DRIFT, DR UV–vis, NH3 TPD, H2 TPR, XPS, TEM, and EDS mapping. By combining activity test and characterization results, the nature of active cobalt species and the cause of catalyst deactivation in PDH are discussed. A sequence of CoSiBeta catalysts with higher Co loadings were also prepared and characterized, confirming that the small metallic Co particles confined in silanols are active sites, and bulk Co3O4 and large Co0 particles on SiBeta support contribute to cracking and carbon deposition, respectively. 2 Experimental 2.1 Catalyst preparation The SiBeta support was obtained by treating raw AlBeta zeolite with an SiO2/Al2O3 ratio of 20:1 in a concentrated nitric acid solution (13 mol L−1) at 100 °C for 12 h under constant stirring and then washed several times with distilled water. Subsequently, the as-obtained SiBeta was dried at 100 °C in air overnight. The obtained SiBeta solid was excessively impregnated with calculated cobalt nitrate solution (1 g of SiBeta in 20 mL of solution) and stirred overnight at ambient temperature. The impregnated samples were dried at 80 °C for 8 h and then calcined at 600 °C for 6 h in air with a heating rate of 10 °C min−1. The resultant samples were named as xCoSiBeta, where x refers to the mass percentage of Co (x = 0.5, 1, 3. and 10). The in situ reduction treatments over the xCoSiBeta samples were carried out at 600 °C for 1 h in the reactor in flowing pure H2. The obtained catalysts were denoted as RexCoSiBeta. The in situ reduction treatments over the 0.5CoSiBeta sample were carried out at different temperatures of 600, 700, and 800 °C, and these catalysts were labeled as Re0.5CoSiBeta600, Re0.5CoSiBeta700, and Re0.5CoSiBeta800, respectively. The Re10CoSiBeta catalyst was taken out of the reactor and then exposed to air overnight. The obtained sample was named as Reox10CoSiBeta. Raw AlBeta zeolite was used to prepare the reference catalyst, and the preparation procedure for the 0.5CoAlBeta catalyst was the same as that for xCoSiBeta. The 0.5 wt% Co supported on Al2O3 as a reference catalyst (0.5Co/Al2O3) was also prepared by the same method. 2.2 Catalyst characterization N2 adsorption–desorption isotherms were determined at −196 °C using a Quantachrome NOVA 2000e sorption analyzer. The samples were outgassed at 200 °C for 8 h before measurements. The specific surface area was obtained by the standard Brunauer–Emmett–Teller (BET) equation, and the total pore volume was determined from the desorption branch of isotherms at a relative P/P 0 of 0.98. Powder X-ray diffraction patterns were recorded on a Bruker D8 Focus diffractometer with CuKα radiation at λ = 1.5406 Å. Diffuse reflectance infrared Fourier transform (DRIFT) spectra were measured at room temperature with a Bruker Tensor 27 spectrometer with 128 scans at a resolution of 2 cm−1. Transmission electron microscopy (TEM), as well as electron energy dispersive spectroscopy (EDS), was carried out on a JEOL JSM-2800 microscope at 200 kV. H2 temperature-programmed reduction (H2 TPR) experiments were conducted on a Quantachrome ChemBET 3000 analyzer equipped with a U-shaped tubular microreactor in an electrical furnace. The sample (50 mg) was degassed at 600 °C in He for 30 min. After cooling down to ambient temperature, the sample was treated by 10 vol% H2/Ar mixed gas (110 mL min−1), from 100 to 950 °C at a ramp rate of 10 °C min−1. The ammonia temperature-programmed desorption (NH3 TPD) profiles were similarly obtained from a Quantachrome ChemBET-3000 analyzer. Samples of 100 mg were pretreated at 600 °C under He for 1 h, followed by saturation them with NH3 at 80 °C for 30 min. Then the experiments were carried out from 100 to 650 °C in He. X-ray photoelectron spectra (XPS) were recorded on a Thermo Scientific ESCALAB 250Xi spectrometer equipped with a monochromatic AlKα X-ray excitation source. The reported binding energies were calibrated against the C1s peak at 284.8 eV. Diffuse reflectance ultraviolet–visible (DR UV–vis) spectra were recorded on a Shimadzu UV2450 using BaSO4 as white standards. 2.3 Catalytic PDH evaluation PDH reactions were carried out on a quartzose fixed-bed microreactor (6 mm in inner diameter) under atmospheric pressure. All samples were pressed into tablets, crushed, and sieved into a particle size fraction of 0.25–0.5 mm in order to achieve plug-flow isothermal conditions. Subsequently, 0.05–0.3 g of the sieved fraction was loaded into the isothermal zone of the reactor using two quartz wool plugs. A thermocouple was placed in the isothermal zone to measure the operation temperature. Specifically, all the ReCoSiBeta catalysts were obtained in situ at preset temperatures, and the reactor was cooled to 200 °C after reduction. Without disconnecting the reactor, the activity tests were performed. The reaction products were analyzed by an on-line gas chromatograph (SP-6890), which was equipped with a GDX-01 column and a flame ionization detector (FID). The following reaction conditions were set in these activity tests: reaction temperatures, 550 and 600 °C; total flow rate of gas reactant, 20 mL min−1 (5 vol% propane in nitrogen). The propane conversion (C propane), propylene selectivity (S propylene), and propylene yield (Y propylene) were calculated on the basis of a carbon atom balance method as follows: C propane = moles of propane reacted moles of propane fed × 100 % , S propylene = moles of propylene formed moles of propane reacted × 100 % , Y propylene = moles of propylene formed moles of propane fed × 100 % . 3 Results and discussion 3.1 Catalytic performances of 0.5CoSiBeta catalysts The catalytic performance of the 0.5CoSiBeta and Re0.5CoSiBeta600 catalysts is shown in Fig. 1 and listed in Table 1 . Carbon balance remains above 95% in all experiments. At such a low Co loading, the propane conversion of the 0.5CoSiBeta catalyst reaches ca. 40% at first and then gradually increases to ca. 53% within 30 min. After 6 h time on stream, the propane conversion decreases to ca. 40%. It is noticeable that its propylene selectivity remains at ca. 98% during the whole reaction, which is hard to realize at such a high propane conversion. The Re0.5CoSiBeta600 catalyst shows a higher initial propane conversion of ca. 55% and ta maximal propane conversion of ca. 57% with a shorter induction period of 10 min. Then the propane conversion decreases to ca. 45% after 6 h on stream. Meanwhile, the propylene selectivity of the Re0.5CoSiBeta600 progressively increases from 96% to 97% as the reaction goes on, slightly lower than that of 0.5CoSiBeta. Overall, 0.5CoSiBeta has propylene productivity similar to that of Re0.5CoSiBeta600, while the induction period of the former is longer and more considerable. The catalytic performance of the Re0.5CoSiBeta catalysts prereduced at different temperatures is shown in Fig. 2 . The maximal propane conversion of Re0.5CoSiBeta increases from 57% to 72% with the elevation of reduction temperature from 600 to 700 °C, and decreases to 41% as the reduction temperature increases further to 800 °C (Fig. 2a). After 6 h on stream, the Re0.5CoSiBeta700 has the highest deactivation rate of 44.5% (Table 1). The propylene selectivities are determined by the corresponding propane conversions, which they all maintain at higher than 92% (Fig. 2b). Noticeably, the propane conversion reaches 72% with a propylene selectivity of ~92% with the Re0.5CoSiBeta700 catalyst. Such high catalytic performance is on the upper level among most reported Pt and CrO x catalysts. The comparison data are listed in Table S1 in the Supplementary Material. The catalytic performance of the Re0.5CoSiBeta600 catalysts obtained over different reduction periods is shown in Fig. S1 in the Supplementary Material; the maximal propane conversion of Re0.5CoSiBeta600 decreases from 57% to 49% as the reduction time increases from 60 to 80 min, while the propylene selectivities at steady state have a slight difference of within 2%, indicating the minor influence of reduction time on the propylene selectivity. 3.2 Characterization of 0.5CoSiBeta catalysts The XRD patterns and DRIFT spectra of AlBeta, SiBeta, and 0.5CoSiBeta samples are presented in Fig. 3 . A sequence of preparation procedures have no significant influence on the characteristic BEA structure of Beta zeolite but influence the intensity of diffraction peaks (Fig. 3a). The position of the main diffraction at 2θ around 22.5° corresponding to the d 302 spacing of Beta zeolite has shifted slightly in different samples. Obtained from the corresponding 2θ value (Table 2 ), the d 302 spacing declines from 3.9414 Å (AlBeta, 2θ = 22.54°) to 3.9346 Å (SiBeta, 2θ = 22.57°), demonstrating the contraction of the BEA matrix after concentrated nitric acid treatment. Then the cobalt introduction and high-temperature calcination lead to the expansion of the SiBeta zeolite framework, which is reflected by the increase of 2θ value to 3.9484 Å (0.5CoSiBeta, 2θ = 22.50°), suggesting that partial cobalt species are located in the T-site positions. The specific surface area and total pore volume of the CoSiBeta catalysts with Co loading less than 3 wt% have no significant difference, as listed in Table 2, indicating the slight change of the textural structures after a series of treatments. Silanols were analyzed in the hydroxyl vibration region of the DRIFT spectra of the selected catalysts presented in Fig. 3b. The band at 3730 cm−1 in all samples is assigned to the fundamental O–H stretching vibration of isolated external silanols, and the band at 3600 cm−1 shown in the AlBeta sample corresponds to the bridging hydroxyl groups (Al–OH–Si) [23,24]. Upon dealumination treatment, the band at 3730 cm−1 is well reserved, while the 3600 cm−1 band disappears due to the removal of lattice Al atoms. Simultaneously, a broad new band appears at 3440 cm−1, revealing the presence of vacant T-sites associated with silanols as reported in previous studies [25,26]. The incorporation of cobalt has a very slight effect on the intensity of the 3440 cm−1 band, indicating that very few Co(II) ions are anchored in the silanols [27]. The band at 3730 cm−1 is intense in the 0.5CoSiBeta, possibly attributable to perturbation by the interactions with adjacent Co species [12]. The SiBeta is free of any acidic sites after dealumination, as shown in Fig. S2. There are very weak NH3 desorption peaks on the CoSiBeta catalysts, which does not conform to the results for Lewis acidic Co(II) in zeolite framework [12]. Thus, it can be inferred that the calcination in air for 6 h transforms framework Co(II) into extraframework cobalt species. Consistently, the as-prepared 0.5CoSiBeta sample after impregnation was light blue, and turned gray-white after calcination treatment. It is notable that the very weak acidity may be responsible for its superior propylene selectivity by boosting the propylene desorption. The morphology of the 0.5CoSiBeta catalyst was characterized by TEM. As seen in Fig. 4 a, there are no particles, which may be due to the high dispersity and low content of cobalt. Still, no Co particles can be discerned in Fig. 4b under higher magnification. The EDS spectrum of this TEM image (Fig. 4c) confirms the absence of impurities, and EDS mapping (Fig. 4d) evidences the presence of Co, which is well dispersed throughout the whole SiBeta support. Therefore, a battery of post-treatments cause the cobalt species to be confined in the SiBeta support with a highly dispersed distribution. Combined with above XRD and DRIFT results, this suggests that the dealumination treatment creates a lot of vacant T-sites with silanols, which provide good conditions for confining the cobalt species and thus lead to the formation of confined cobalt species after high-temperature treatment [11]. All the prereduced samples were unavoidably oxidized to cobalt oxides by air before characterization due to the limitation of conditions [28,29]. The existence of cobalt species in SiBeta zeolite was investigated by H2 TPR, XPS, and DR UV–vis measurements (Fig. 5 ). In the H2 TPR profiles of Fig. 5a, the catalysts have a weak reduction peak at about 280 °C ascribed to the reduction of superficial CoO x on the SiBeta support [30]. The following peaks are ascribed to the reduction of CoO → Co. A broad reduction peak in the range of 400–600 °C is related to the CoO x clusters located in the T-sites of the zeolite [31,32]. The weak reduction peak above 600 °C is related to the reduction of framework Co ions [33]. The reduction properties of the 0.5CoSiBeta indicate that the cobalt species are mainly present in the form of confined CoO x , which can easily be reduced to metallic Co in a reductive atmosphere below 600 °C. The reduction peaks of the Re0.5CoSiBeta samples at ca. 480 °C shift to lower positions, becoming weaker with the elevated reduction temperature from 600 to 800 °C, because the overreduction treatment weakens the interaction effect. The number of surface Co sites accessible to H2 is proportional to the H2 consumption [34], so the intensity of the peak at around 480 °C decreases with the increase of reduction temperature, probably due to the less accessible CoO x . The XPS results presented in Fig. 5b are well consistent with H2 TPR profiles. The core-level binding energy of Co2p 3/2 is about 783.3 eV for 0.5CoSiBeta, very close to the reported binding energy of Co2p in CoSiBeta and CoZSM-5 [35], indicating that the CoO x species in the 0.5CoSiBeta sample interact strongly with the zeolite framework. For the prereduced samples, the core binding energies of Co2p 3/2 shifting to lower positions (ca. 782.5 eV) are related to the oxidation of metallic Co particles, because exposure to air before the XPS measurement is unavoidable. Increasing the reduction temperature to 800 °C leads to the aggregation of Co particles, so the Co2p signal is very weak to be discerned in the Re0.5CoSiBeta800 catalyst. The influence of H2 treatment on the cobalt species was also revealed by the DR UV–vis spectra displayed in Fig. 5c. The 0.5CoSiBeta catalyst mainly possesses a characteristic band at ca. 330 nm assigned to distorted tetrahedral Co(III), presumably corresponding to the CoO x moieties inside the zeolite channels [36–38], and this band in Re0.5CoSiBeta catalysts is dramatically crippled. Besides, two evident bands at 590 and 660 nm appear in Re0.5CoSiBeta600/700 catalysts and are likely ascribable to the 4A2(F) → 4T1(P) d–d transition of T d Co(II) in tetrahedral coordination [39], which might be ascribed to the amorphous cobalt oxides produced from the metallic Co at T-sites under ambient atmosphere [40–43]. The newborn band at 520 nm is related to the octahedral Co(II) in extraframework cobalt species, while the absorbance band of octahedral Co(II) is less intense (about 100 times) than that of tetrahedral Co(II), so the contribution of octahedral Co(II) in the cobalt oxides is greatly masked [44]. Re0.5CoSiBeta800 shows a significant reduction in the overall intensity of the triplet band, possibly attributable to the aggregation of cobalt species [42], which is in line with the above H2 TPR and XPS results. The TEM images of the Re0.5CoSiBeta600/800 catalysts, prereduced for 1 h at 600 and 800 °C, respectively, are presented in Fig. 6 . No particles can be observed in the TEM image of the Re0.5CoSiBeta600 sample (Fig. 6a and b), while a lot of particles with the mean size 4.15 ± 3.0 nm are clearly seen in the Re0.5CoSiBeta800 (Fig. 6c and d). The EDS mappings in Fig. 6e evidence the particles consisting of Co. The HR-TEM image in Fig. 6f shows that the interplanar distances of 0.203 and 0.212 nm match the metallic Co (0 0 2) and crystallites CoO (2 0 0), respectively [45–47], indicating that the Re0.5CoSiBeta catalysts include highly dispersed metallic Co and CoO particles that are formed in ambient atmosphere [48]. The TEM results reveal that the overreduction treatment can cause the migration of cobalt species out of the zeolite pores, which may be the reason for the poor catalytic performance of the Re0.5CoSiBeta800 catalyst. The 0.5CoSiBeta catalyst shows considerable catalytic activity with very high propylene selectivity, and the induction period is evidently shortened after reduction treatment. The cobalt species are mainly present in the form of CoO x located at the T-sites of the 0.5CoSiBeta catalyst. The catalytic performance of the 0.5CoSiBeta catalysts with and without prereduction treatments at 600 °C for 1 h is very similar, in spite of the induction period, implying that confined CoO x can be reduced to metallic Co during the reaction. However, the higher reduction temperature and longer reduction time lead to lower catalytic activity or higher deactivation rate, possibly because massive Co particles are formed and can easily migrate and aggregate. 3.3 The nature of active Co phases in CoSiBeta catalysts To further figure out the correlation of catalyst activity and structure, the characterizations and catalytic performance of the CoSiBeta catalysts with higher Co loadings were compared. The XRD patterns of CoSiBeta catalysts with different Co loadings are presented in Fig. 7 a. All CoSiBeta catalysts show the typical BEA structures of Beta zeolite. The intensities of these diffraction peaks become weaker with the increase of Co loading. The cobalt species are undiscerned on SiBeta support when the Co loading is low, while the diffraction peaks of Co3O4 at 2θ = 31.23°, 36.85°, 59.36°, and 65.24° (JCPDS No. 42-1467) appear when the Co loading reaches 10 wt% [49]. The collected H2 TPR profiles of the CoSiBeta catalysts are displayed in Fig. 7b. The reduction process starting at relatively low temperature depends on the Co loading. The starting temperature is lowest for the 10CoSiBeta (ca. 250 °C), followed by overlapped doublet peaks lower than 390 °C, which is consistent with the reduction temperature of pure Co3O4. Overall, the main reduction peak shifts toward higher positions with decreasing Co loading, suggesting that the metal–support interaction becomes stronger. The main peak at 480 °C indicates the predominant existence of confined CoO x in the 0.5CoSiBeta catalyst [50,51]. The absorbance band at ca. 200 nm in the DR UV–vis spectra (Fig. 7c) is related to the BEA structure of SiBeta [52]. The band at 330 nm corresponds to the oxygen-to-metal charge transfer between the framework O atoms and Co(III) ions [9], the intensity of which decreases with the increase of Co loading. The bands at 460 and 720 nm become more intense due to the formation of Co(II) in octahedral symmetry and crystallite Co3O4 [21,53]. Thus, it can be determined that the cobalt species are mainly present in the forms of confined CoO x for a low Co loading and bulk Co3O4 for a high Co loading in CoSiBeta catalysts. The propane conversion and propylene selectivity of xCoSiBeta catalysts are presented in Fig. 8 and Table 1. All propane conversions show similar variation trends, first increasing and then decreasing. The induction period decreases with increased Co loading, from 30 min for 0.5/1CoSiBeta to 10 min for 3/10CoSiBeta catalysts. Moreover, the Co loading has a great effect on the propane conversion. The initial propane conversion increases with the increase of Co loading, from 40% for 0.5CoSiBeta to 86% for 10CoSiBeta. The maximal propane conversion is around 53, 59, 80, and 81% for the 0.5/1/3/10CoSiBeta catalysts, respectively. Increasing Co loading from 3 to 10 wt% does not lead to a significant increase in propane conversion, meaning that there are the same numbers of active sites in the two samples. After 6 h time on stream, the deactivation rates of the 3/10CoSiBeta catalysts are much higher than that of the 0.5/1CoSiBeta catalysts (Table 1), with final propane conversion of around 40%. The final propane conversion of the 0.5/1CoSiBeta catalysts is 45 and 59%, respectively, slightly lower than the corresponding initial values. The propylene selectivities of the 0.5/1CoSiBeta catalysts are very high and stable, stabilizing at about 98% during the whole reaction. For the CoSiBeta catalyst with high Co loadings, the variation trend of propylene selectivity is evident. The initial propylene selectivity for the 3CoSiBeta is 92% and increases continuously during the reaction. Noticeably, the initial propylene selectivity of 10CoSiBeta is null, indicating that only side reactions occur at first. After that, the propylene selectivity rapidly increases to a high value of about 92%, suggesting that the PDH becomes the predominant reaction. To identify the active Co phases, the Reox10CoSiBeta catalyst was also prepared by exposing the Re10CoSiBeta catalyst to air overnight. The activity comparisons are depicted in Fig. 8c and d. The initial propane conversions of three catalysts are 22% for Re10CoSiBeta, 60% for Reox10CoSiBeta, and 85% for 10CoSiBeta. After 20 min on stream, the propane conversions all reach ca. 80%. The initial propylene selectivities all are null, while the value increases to 92% for Re10CoSiBeta, 70% for Reox10CoSiBeta, and only 20% for 10CoSiBeta within 10 min. Interestingly, all the catalysts exhibit similar catalytic activity (about 80%) and propylene selectivity (about 93%) after 0.5 h on stream, indicating that cobalt species transform into the same active phases in spite of the initial states. After 6 h on stream, the propane conversion and propylene selectivity of the three catalysts remain at the same levels of about 40 and 98%, respectively, presenting similar deactivation trends. Considering that in situ dynamic transformation of cobalt species can occur under reaction conditions, the real active species in the PDH reaction may not be any of the starting materials, which is a probable reason for the similar catalytic performance of the 10CoSiBeta, Re10CoSiBeta, and Reox10CoSiBeta catalysts. The Co2p XPS spectra of the 10CoSiBeta catalysts pretreated under different conditions are shown in Fig. 9 . The Co2p 3/2 and Co2p 1/2 peaks of 10CoSiBeta are present at 781.2 and 796.9 eV, respectively. The doublet separation between the two signals is about 15.7 eV and the weak satellite peaks located at 786.3 and 804.3 eV jointly confirm the predominant presence of bulk Co3O4 [41,54,55]. After the reduction–oxidation treatment, a new peak appears at 780.2 eV, which is ascribed to the metallic Co resulting from reduction [16], and the doublet separation between the Co2p 3/2 and Co2p 1/2 peaks decreases to 15.3 eV, plus intensive satellite peaks at 786.8 and 803.6 eV, indicating the coexistence of Co0 and Co2+ in the Reox10CoSiBeta [16,55]. Here, the prereduction treatment caused the formation of metallic Co, a fraction of which can be reoxidized into CoO because the Co0 nanoparticles are sensitive to aerobic atmosphere [29]. After 10 min on stream, the Co2p XPS signals of 10CoSiBeta were evidently attenuated, possibly due to the coverage of Co particles by deposited carbon, as shown in Fig. 9b. Also, a peak at around 779.0 eV ascribed to confined metallic Co is seen on the 10CoSiBeta catalyst [16], confirming that the Co species in 10CoSiBeta can also be reduced under reaction conditions. The TEM images of Fig. S3 show that the mean particle sizes of 10CoSiBeta and Reox10CoSiBeta are 11.48 and 7.67 nm, respectively. The XRD pattern of Reox10CoSiBeta in Fig. S4a evidences the presence of metallic Co (JCPDS No. 15-0806) [56]. The H2 TPR profiles of 10CoSiBeta and Reox10CoSiBeta catalysts (Fig. S4b) show that the reduction peak of Co3O4 is greatly reduced in Reox10CoSiBeta, and the weak peak is ascribed to the reduction of newly formed CoO x . It can be inferred that the initial content of metallic Co is different and follows the order 10CoSiBeta < Reox10CoSiBeta < Re10CoSiBeta. Therefore, the 10CoSiBeta, Re10CoSiBeta, and Reox10CoSiBeta catalysts show similar catalytic performances after 0.5 h on stream, regardless of the difference in particle sizes and initial chemical states of cobalt, suggesting that they possess the same active sites starting to function after the external cobalt species are covered with coke deposition. Also, this is reflected by the similar Co 2p XPS spectra after 10 min on stream (Fig. S5). Combined with activity test results, the large Co3O4 particles lead to serious side reactions responsible for the very low initial propylene selectivity of 10CoSiBeta. After prereduction pretreatment, all the surface Co3O4 particles are reduced to bulk Co0 particles, showing little propane conversion of Re10CoSiBeta at first, which means that the bulk Co are almost inactive for PDH and just result in the carbon deposition. As presented in Fig. S6, the Re1/3CoSiBeta catalysts show activity and selectivity similar to that of the corresponding 1/3CoSiBeta catalysts during the whole reaction, which is different from the 10CoSiBeta catalyst containing massive Co3O4 particles on the external surface. The binding energies of Co2p 3/2 and Co2p 1/2 observed for the 3CoSiBeta catalyst are at 782.0 and 797.6 eV (Fig. S7), with the two spin–orbital peaks appearing at 786.0 and 804.5 eV, confirming there are mainly Co(II) species (in confined CoO x ), and very few superficial Co(III) species (in Co3O4) can influence the initial catalytic performance [52]. Here, varied cobalt species including bulk Co0 particles, bulk Co3O4, and small confined Co0 particles present on the SiBeta support are illustrated in Fig. 10 . Bulk Co and Co3O4 particles result in coking and side reactions, respectively, and only the small metallic Co particles confined in SiBeta are active sites. 3.4 Catalyst stability and performance comparison The recycling stability of the PDH reaction over the CoSiBeta catalyst is a prerequisite for practical application, and thus the reaction stability of 0.5CoSiBeta under forcing conditions was tested here. In Fig. 11 a, after completion of the previous run, the catalysts were calcinated for 2 h in air at 600 °C to remove the deposited coke for the next cycle without another reduction treatment. The catalytic activities of the regenerated 0.5CoSiBeta are almost the same as that obtained with the fresh catalyst over four cycles, indicating that deactivation is caused mainly by carbon deposits instead of sintering of cobalt. In Fig. S8, the 0.5CoAlBeta catalyst shows much lower propane conversion (ca. 20%) and propylene selectivity (ca. 50%) than the 0.5CoSiBeta catalyst. According to the DR UV–vis spectra in Fig. S9, framework Co ions are primarily present in the 0.5CoAlBeta catalyst, and thus hard to reduce to metallic Co [57], which may be the reason for its very weak catalytic performance. The TOF value of the 0.5CoSiBeta catalyst is the highest and reaches 32.9 h−1 for the PDH reaction at 550 °C, as shown in Fig. 11b, much higher than those obtained in previous reports. Meanwhile, the propylene selectivity of the 0.5CoSiBeta catalyst is also the highest, with a value above 97%. As shown in Fig. S10, the 0.5Co/Al2O3 catalyst exhibits much weaker catalytic performance (only ~5% propane conversion) compared with 0.5CoSiBeta under the same reaction condition. The superiority of the CoSiBeta catalyst is thus clearly shown. The TOF values were obtained at different WHSVs in Fig. S11, showing that decreasing catalyst mass leads to a loss of catalytic activity and simultaneously confirming the intrinsic activity of the 0.5CoSiBeta catalyst for PDH. Therefore, it was determined that the small metallic Co particles generated by the reduction of confined CoO x are the active sites, which show great catalytic activity with high product selectivity, as well as ideal reusability. Still, the accurate HAADF-STEM and XANES techniques are needed to witness the presence of these Co sites and the connection between them and the silanols. 4 Conclusions CoO x confined in the SiBeta zeolite by connecting with silanols was prepared by a procedure comprising dealumination of AlBeta, impregnation with cobalt nitrate solution, and calcination at 600 °C in air. Great propane conversion and extremely high propylene selectivity were simultaneously realized over the 0.5CoSiBeta catalyst and match to that over commercial Pt and CrO x catalysts, which is the first time to be reported. The 57% propane conversion and 96% propylene selectivity were achieved over the 0.5CoSiBeta catalyst after prereduction treatment at 600 °C, and this catalyst exhibited superior reuse performance with the removal of coke by facile calcination. It was found that confined CoO x could be reduced to metallic Co particles during the reaction, which is responsible for the similar catalytic performance of CoSiBeta catalysts with or without prereduction treatment. Also, the PDH reaction over the metallic Co is likely a structure-sensitive reaction, the target reactivity of which seems to be determined by the metallic Co sizes: small metallic Co leads to high propylene selectivity, possibly by boosting propylene desorption. This work not only affords a green and very promising nonprecious dehydrogenation catalyst but gives new insight into the active Co phase for the PDH reaction. Acknowledgments This work was supported by the National Natural Science Foundation of China (21421001, 21573115), the Ph.D. Candidate Research Innovation Fund of the College of Chemistry Nankai University, the Foundation of State Key Laboratory of High-Efficiency Utilization of Coal and Green Chemical Engineering (2017-K13), and the 111 project (B12015). Appendix A Supplementary material Supplementary data to this article can be found online at https://doi.org/10.1016/j.jcat.2019.12.037. Appendix A Supplementary material The following are the Supplementary data to this article: Supplementary data 1 References [1] L. Shi G.M. Deng W.C. Li S. Miao Q.N. Wang W.P. Zhang A.H. Lu Al2O3 nanosheets rich in pentacoordinate Al(3+) ions stabilize Pt-Sn clusters for propane dehydrogenation Angew. Chem. Int. Ed. 54 2015 13994 13998 10.1002/anie.201507119 L. Shi, G.M. Deng, W.C. Li, S. Miao, Q.N. Wang, W.P. Zhang, A.H. Lu, Al2O3 Nanosheets Rich in Pentacoordinate Al(3+) Ions Stabilize Pt-Sn Clusters for Propane Dehydrogenation, Angew. Chem. Int. Ed. 54 (2015) 13994-13998. DOI: 10.1002/anie.201507119 [2] H. Xiong S. Lin J. Goetze P. Pletcher H. Guo L. Kovarik K. Artyushkova B.M. Weckhuysen A.K. Datye Thermally stable and regenerable platinum-tin clusters for propane dehydrogenation prepared by atom trapping on ceria Angew. Chem. Int. Ed. 56 2017 8986 8991 10.1002/anie.201701115 H. Xiong, S. Lin, J. Goetze, P. Pletcher, H. Guo, L. Kovarik, K. Artyushkova, B.M. Weckhuysen, A.K. Datye, Thermally Stable and Regenerable Platinum-Tin Clusters for Propane Dehydrogenation Prepared by Atom Trapping on Ceria, Angew. Chem. Int. Ed. 56 (2017) 8986-8991. DOI: 10.1002/anie.201701115 [3] J.J. Sattler J. Ruiz-Martinez E. Santillan-Jimenez B.M. Weckhuysen Catalytic dehydrogenation of light alkanes on metals and metal oxides Chem. Rev. 114 2014 10613 10653 10.1021/cr5002436 J.J. Sattler, J. Ruiz-Martinez, E. Santillan-Jimenez, B.M. Weckhuysen, Catalytic dehydrogenation of light alkanes on metals and metal oxides, Chem. Rev. 114 (2014) 10613-10653. DOI: 10.1021/cr5002436 [4] C. Chen Z. Hu J. Ren S. Zhang Z. Wang Z.-Y. Yuan ZnO nanoclusters supported on dealuminated zeolite β as a novel catalyst for direct dehydrogenation of propane to propylene ChemCatChem 11 2019 868 877 10.1002/cctc.201801708 C. Chen, Z. Hu, J. Ren, S. Zhang, Z. Wang, Z.-Y. Yuan, ZnO Nanoclusters Supported on Dealuminated Zeolite β as a Novel Catalyst for Direct Dehydrogenation of Propane to Propylene, ChemCatChem 11 (2019) 868-877. DOI: 10.1002/cctc.201801708 [5] Y.-N. Sun L. Tao T. You C. Li H. Shan Effect of sulfation on the performance of Fe2O3/Al2O3 catalyst in catalytic dehydrogenation of propane to propylene Chem. Eng. J. 244 2014 145 151 10.1016/j.cej.2014.01.047 Y.-n. Sun, L. Tao, T. You, C. Li, H. Shan, Effect of sulfation on the performance of Fe2O3/Al2O3 catalyst in catalytic dehydrogenation of propane to propylene, Chem. Eng. J. 244 (2014) 145-151. DOI: 10.1016/j.cej.2014.01.047 [6] T. Gong L. Qin J. Lu H. Feng ZnO modified ZSM-5 and Y zeolites fabricated by atomic layer deposition for propane conversion Phys. Chem. Chem. Phys. 18 2016 601 614 10.1039/c5cp05043j T. Gong, L. Qin, J. Lu, H. Feng, ZnO modified ZSM-5 and Y zeolites fabricated by atomic layer deposition for propane conversion, Phys. Chem. Chem. Phys. 18 (2016) 601-614. DOI: 10.1039/c5cp05043j [7] J.J. Sattler I.D. Gonzalez-Jimenez L. Luo B.A. Stears A. Malek D.G. Barton B.A. Kilos M.P. Kaminsky T.W. Verhoeven E.J. Koers M. Baldus B.M. Weckhuysen Platinum-promoted Ga/Al2O3 as highly active, selective, and stable catalyst for the dehydrogenation of propane Angew. Chem. Int. Ed. 53 2014 9251 9256 10.1002/anie.201404460 J.J. Sattler, I.D. Gonzalez-Jimenez, L. Luo, B.A. Stears, A. Malek, D.G. Barton, B.A. Kilos, M.P. Kaminsky, T.W. Verhoeven, E.J. Koers, M. Baldus, B.M. Weckhuysen, Platinum-promoted Ga/Al2O3 as highly active, selective, and stable catalyst for the dehydrogenation of propane, Angew. Chem. Int. Ed. 53 (2014) 9251-9256. DOI: 10.1002/anie.201404460 [8] Z.J. Zhao T. Wu C. Xiong G. Sun R. Mu L. Zeng J. Gong Hydroxyl-mediated non-oxidative propane dehydrogenation over VO x /gamma-Al2O3 catalysts with improved stability Angew. Chem. Int. Ed. 57 2018 6791 6795 10.1002/anie.201800123 Z.J. Zhao, T. Wu, C. Xiong, G. Sun, R. Mu, L. Zeng, J. Gong, Hydroxyl-Mediated Non-oxidative Propane Dehydrogenation over VOx/gamma-Al2O3 Catalysts with Improved Stability, Angew. Chem. Int. Ed. 57 (2018) 6791-6795. DOI: 10.1002/anie.201800123 [9] Y. Zhao H. Sohn B. Hu J. Niklas O.G. Poluektov J. Tian M. Delferro A.S. Hock Zirconium modification promotes catalytic activity of a single-site cobalt heterogeneous catalyst for propane dehydrogenation ACS Omega 3 2018 11117 11127 10.1021/acsomega.8b00862 Y. Zhao, H. Sohn, B. Hu, J. Niklas, O.G. Poluektov, J. Tian, M. Delferro, A.S. Hock, Zirconium Modification Promotes Catalytic Activity of a Single-Site Cobalt Heterogeneous Catalyst for Propane Dehydrogenation, ACS Omega 3 (2018) 11117-11127. DOI: 10.1021/acsomega.8b00862 [10] D.P. Estes G. Siddiqi F. Allouche K.V. Kovtunov O.V. Safonova A.L. Trigub I.V. Koptyug C. Coperet C-H activation on Co, O sites: isolated surface sites versus molecular analogs J. Am. Chem. Soc. 138 2016 14987 14997 10.1021/jacs.6b08705 D.P. Estes, G. Siddiqi, F. Allouche, K.V. Kovtunov, O.V. Safonova, A.L. Trigub, I.V. Koptyug, C. Coperet, C-H Activation on Co,O Sites: Isolated Surface Sites versus Molecular Analogs, J. Am. Chem. Soc. 138 (2016) 14987-14997. DOI: 10.1021/jacs.6b08705 [11] W. Li S.Y. Yu M. George D.E. Iglesia Structure and properties of cobalt-exchanged H-ZSM5 catalysts for dehydrogenation and dehydrocyclization of alkanes J. Phys. Chem. B 105 2001 1176 1184 10.1021/jp002102h W. Li, S.Y. Yu, M. George D, E. Iglesia, Structure and Properties of Cobalt-Exchanged H-ZSM5 Catalysts for Dehydrogenation and Dehydrocyclization of Alkanes, J. Phys. Chem. B 105 (2001) 1176-1184. DOI: 10.1021/jp002102h [12] B. Hu A. “Bean” Getsoian, N.M. Schweitzer U. Das H. Kim J. Niklas O. Poluektov L.A. Curtiss P.C. Stair J.T. Miller A.S. Hock Selective propane dehydrogenation with single-site CoII on SiO2 by a non-redox mechanism J. Catal. 322 2015 24 37 10.1016/j.jcat.2014.10.018 B. Hu, A. “Bean” Getsoian, N.M. Schweitzer, U. Das, H. Kim, J. Niklas, O. Poluektov, L.A. Curtiss, P.C. Stair, J.T. Miller, A.S. Hock, Selective propane dehydrogenation with single-site CoII on SiO2 by a non-redox mechanism, J. Catal. 322 (2015) 24-37. DOI: 10.1016/j.jcat.2014.10.018 [13] B. Hu W.-G. Kim T.P. Sulmonetti M.L. Sarazen S. Tan J. So Y. Liu R.S. Dixit S. Nair C.W. Jones A Mesoporous cobalt aluminate spinel catalyst for nonoxidative propane dehydrogenation ChemCatChem 9 2017 3330 3337 10.1002/cctc.201700647 B. Hu, W.-G. Kim, T.P. Sulmonetti, M.L. Sarazen, S. Tan, J. So, Y. Liu, R.S. Dixit, S. Nair, C.W. Jones, A Mesoporous Cobalt Aluminate Spinel Catalyst for Nonoxidative Propane Dehydrogenation, ChemCatChem 9 (2017) 3330-3337. DOI: 10.1002/cctc.201700647 [14] Y. Sun Y. Wu H. Shan C. Li Studies on the nature of active cobalt species for the production of methane and propylene in catalytic dehydrogenation of propane Catal. Lett. 145 2015 1413 1419 10.1007/s10562-015-1533-4 Y. Sun, Y. Wu, H. Shan, C. Li, Studies on the Nature of Active Cobalt Species for the Production of Methane and Propylene in Catalytic Dehydrogenation of Propane, Catal. Lett. 145 (2015) 1413-1419. DOI: 10.1007/s10562-015-1533-4 [15] Y. Sun Y. Gao Y. Wu H. Shan G. Wang C. Li Effect of sulfate addition on the performance of Co/Al2O3 catalysts in catalytic dehydrogenation of propane Catal. Commun. 60 2015 42 45 10.1016/j.catcom.2014.11.024 Y. Sun, Y. Gao, Y. Wu, H. Shan, G. Wang, C. Li, Effect of sulfate addition on the performance of Co/Al2O3 catalysts in catalytic dehydrogenation of propane, Catal. Commun. 60 (2015) 42-45. DOI: 10.1016/j.catcom.2014.11.024 [16] X. Li P. Wang H. Wang C. Li Effects of the state of Co species in Co/Al2O3 catalysts on the catalytic performance of propane dehydrogenation Appl. Surf. Sci. 441 2018 688 693 10.1016/j.apsusc.2018.02.024 X. Li, P. Wang, H. Wang, C. Li, Effects of the state of Co species in Co/Al2O3 catalysts on the catalytic performance of propane dehydrogenation, Appl. Surf. Sci. 441 (2018) 688-693. DOI: 10.1016/j.apsusc.2018.02.024 [17] N. Blanch-Raga A.E. Palomares J. Martínez-Triguero S. Valencia Cu and Co modified beta zeolite catalysts for the trichloroethylene oxidation Appl. Catal. B 187 2016 90 97 10.1016/j.apcatb.2016.01.029 N. Blanch-Raga, A.E. Palomares, J. Martínez-Triguero, S. Valencia, Cu and Co modified beta zeolite catalysts for the trichloroethylene oxidation, Appl. Catal. B 187 (2016) 90-97. DOI: 10.1016/j.apcatb.2016.01.029 [18] M. Ogura K. Itabashi J. Dedecek T. Onkawa Y. Shimada K. Kawakami K. Onodera S. Nakamura T. Okubo Stabilization of bare divalent Fe(II) cations in Al-rich beta zeolites for superior NO adsorption J. Catal. 315 2014 1 5 10.1016/j.jcat.2014.04.001 M. Ogura, K. Itabashi, J. Dedecek, T. Onkawa, Y. Shimada, K. Kawakami, K. Onodera, S. Nakamura, T. Okubo, Stabilization of bare divalent Fe(II) cations in Al-rich beta zeolites for superior NO adsorption, J. Catal. 315 (2014) 1-5. DOI: 10.1016/j.jcat.2014.04.001 [19] A. Held J. Kowalska-Kuś Y. Millot F. Averseng C. Calers L. Valentin S. Dzwigaj Influence of the preparation procedure of vanadium-containing SiBEA zeolites on their catalytic activity in propene epoxidation J. Phys. Chem. C 122 2018 18570 18582 10.1021/acs.jpcc.8b05731 A. Held, J. Kowalska-Kuś, Y. Millot, F. Averseng, C. Calers, L. Valentin, S. Dzwigaj, Influence of the Preparation Procedure of Vanadium-Containing SiBEA Zeolites on Their Catalytic Activity in Propene Epoxidation, J. Phys. Chem. C 122 (2018) 18570-18582. DOI: 10.1021/acs.jpcc.8b05731 [20] R. Baran F. Averseng Y. Millot T. Onfroy S. Casale S. Dzwigaj Incorporation of Mo into the vacant T-atom sites of the framework of BEA zeolite as mononuclear Mo evidenced by XRD and FTIR, NMR, EPR, and DR UV–Vis spectroscopies J. Phys. Chem. C 118 2014 4143 4150 10.1021/jp410016g R. Baran, F. Averseng, Y. Millot, T. Onfroy, S. Casale, S. Dzwigaj, Incorporation of Mo into the Vacant T-Atom Sites of the Framework of BEA Zeolite as Mononuclear Mo Evidenced by XRD and FTIR, NMR, EPR, and DR UV–Vis Spectroscopies, J. Phys. Chem. C 118 (2014) 4143-4150. DOI: 10.1021/jp410016g [21] R. Baran T. Onfroy S. Casale S. Dzwigaj Introduction of Co into the vacant T-atom sites of SiBEA zeolite as isolated mononuclear Co species J. Phys. Chem. C 118 2014 20445 20451 10.1021/jp506375v R. Baran, T. Onfroy, S. Casale, S. Dzwigaj, Introduction of Co into the Vacant T-Atom Sites of SiBEA Zeolite as Isolated Mononuclear Co Species, J. Phys. Chem. C 118 (2014) 20445-20451. DOI: 10.1021/jp506375v [22] K.A. Chalupka S. Casale E. Zurawicz J. Rynkowski S. Dzwigaj The remarkable effect of the preparation procedure on the catalytic activity of CoBEA zeolites in the FischereTropsch synthesis Micropor. Mesopor. Mater. 211 2015 9 18 10.1016/j.micromeso.2015.02.024 K.A. Chalupka, S. Casale, E. Zurawicz, J. Rynkowski, S. Dzwigaj, The remarkable effect of the preparation procedure on the catalytic activity of CoBEA zeolites in the FischereTropsch synthesis, Micropor. Mesopor. Mater. 211 (2015) 9-18. DOI: 10.1016/j.micromeso.2015.02.024 [23] S. Song G. Wu W. Dai N. Guan L. Li Al-free Fe-beta as a robust catalyst for selective reduction of nitric oxide by ammonia Catal. Sci. Technol. 6 2016 8325 8335 10.1039/c6cy02124g S. Song, G. Wu, W. Dai, N. Guan, L. Li, Al-free Fe-beta as a robust catalyst for selective reduction of nitric oxide by ammonia, Catal. Sci. Technol. 6 (2016) 8325-8335. DOI: 10.1039/c6cy02124g [24] L. Sun Y. Chai W. Dai G. Wu N. Guan L. Li Oxidative dehydrogenation of propane over Pt–Sn/Si-beta catalysts: key role of Pt–Sn interaction Catal. Sci. Technol. 8 2018 3044 3051 10.1039/C8CY00712H L. Sun, Y. Chai, W. Dai, G. Wu, N. Guan, L. Li, Oxidative dehydrogenation of propane over Pt–Sn/Si-beta catalysts: key role of Pt–Sn interaction, Catal. Sci. Technol. 8 (2018) 3044-3051. DOI: 10.1039/C8CY00712H [25] W. Gac M. Greluk G. Słowik Y. Millot L. Valentin S. Dzwigaj Effects of dealumination on the performance of Ni-containing BEA catalysts in bioethanol steam reforming Appl. Catal. B 237 2018 94 109 10.1016/j.apcatb.2018.05.040 W. Gac, M. Greluk, G. Słowik, Y. Millot, L. Valentin, S. Dzwigaj, Effects of dealumination on the performance of Ni-containing BEA catalysts in bioethanol steam reforming, Appl. Catal. B 237 (2018) 94-109. DOI: 10.1016/j.apcatb.2018.05.040 [26] B. Tang W. Dai X. Sun N. Guan L. Li M. Hunger A procedure for the preparation of Ti-Beta zeolites for catalytic epoxidation with hydrogen peroxide Green Chem. 16 2014 2281 2291 10.1039/c3gc42534g B. Tang, W. Dai, X. Sun, N. Guan, L. Li, M. Hunger, A procedure for the preparation of Ti-Beta zeolites for catalytic epoxidation with hydrogen peroxide, Green Chem. 16 (2014) 2281-2291. DOI: 10.1039/c3gc42534g [27] Y. Chai L. Xie Z. Yu W. Dai G. Wu N. Guan L. Li Lead-containing Beta zeolites as versatile Lewis acid catalysts for the aminolysis of epoxides Micropor. Mesopor. Mater. 264 2018 230 239 10.1016/j.micromeso.2018.01.033 Y. Chai, L. Xie, Z. Yu, W. Dai, G. Wu, N. Guan, L. Li, Lead-containing Beta zeolites as versatile Lewis acid catalysts for the aminolysis of epoxides, Micropor. Mesopor. Mater. 264 (2018) 230-239. DOI: 10.1016/j.micromeso.2018.01.033 [28] Y. Yan Z. Zhang S.-M. Bak S. Yao X. Hu Z. Shadike C.-L. Do-Thanh F. Zhang H. Chen X. Lyu K. Chen Y. Zhu X. Lu P. Ouyang J. Fu S. Dai Confinement of ultrasmall cobalt oxide clusters within silicalite-1 crystals for efficient conversion of fructose into methyl lactate ACS Catal. 9 2018 1923 1930 10.1021/acscatal.8b03230 Y. Yan, Z. Zhang, S.-M. Bak, S. Yao, X. Hu, Z. Shadike, C.-L. Do-Thanh, F. Zhang, H. Chen, X. Lyu, K. Chen, Y. Zhu, X. Lu, P. Ouyang, J. Fu, S. Dai, Confinement of Ultrasmall Cobalt Oxide Clusters within Silicalite-1 Crystals for Efficient Conversion of Fructose into Methyl Lactate, ACS Catal. 9 (2018) 1923-1930. DOI: 10.1021/acscatal.8b03230 [29] X.-L. Zhang D.-X. Zhang G.-G. Chang X.-C. Ma J. Wu Y. Wang H.-Z. Yu G. Tian J. Chen X.-Y. Yang Bimetallic (Zn/Co) MOFs-derived highly dispersed metallic Co/HPC for completely hydrolytic dehydrogenation of ammonia-borane Ind. Eng. Chem. Res. 58 2019 7209 7216 10.1021/acs.iecr.9b00897 X.-L. Zhang, D.-X. Zhang, G.-G. Chang, X.-C. Ma, J. Wu, Y. Wang, H.-Z. Yu, G. Tian, J. Chen, X.-Y. Yang, Bimetallic (Zn/Co) MOFs-Derived Highly Dispersed Metallic Co/HPC for Completely Hydrolytic Dehydrogenation of Ammonia–Borane, Ind. Eng. Chem. Res. 58 (2019) 7209-7216. DOI: 10.1021/acs.iecr.9b00897 [30] Y. Ji Z. Zhao A. Duan G. Jiang J. Liu Comparative study on the formation and reduction of bulk and Al2O3-supported cobalt oxides by H2-TPR technique J. Phys. Chem. C 113 2009 7186 7199 10.1021/jp8107057 Y. Ji, Z. Zhao, A. Duan, G. Jiang, J. Liu, Comparative Study on the Formation and Reduction of Bulk and Al2O3-Supported Cobalt Oxides by H2-TPR Technique, J. Phys. Chem. C 113 (2009) 7186-7199. DOI: 10.1021/jp8107057 [31] T. Otto S.I. Zones Y. Hong E. Iglesia Synthesis of highly dispersed cobalt oxide clusters encapsulated within LTA zeolites J. Catal. 356 2017 173 185 10.1016/j.jcat.2017.10.017 T. Otto, S.I. Zones, Y. Hong, E. Iglesia, Synthesis of highly dispersed cobalt oxide clusters encapsulated within LTA zeolites, J. Catal. 356 (2017) 173-185. DOI: 10.1016/j.jcat.2017.10.017 [32] Q. Cheng Y. Tian S. Lyu N. Zhao K. Ma T. Ding Z. Jiang L. Wang J. Zhang L. Zheng F. Gao L. Dong N. Tsubaki X. Li Confined small-sized cobalt catalysts stimulate carbon-chain growth reversely by modifying ASF law of Fischer-Tropsch synthesis Nat. Comm. 9 2018 3250 10.1038/s41467-018-05755-8 Q. Cheng, Y. Tian, S. Lyu, N. Zhao, K. Ma, T. Ding, Z. Jiang, L. Wang, J. Zhang, L. Zheng, F. Gao, L. Dong, N. Tsubaki, X. Li, Confined small-sized cobalt catalysts stimulate carbon-chain growth reversely by modifying ASF law of Fischer-Tropsch synthesis, Nat. Comm. 9 (2018) 3250. DOI: 10.1038/s41467-018-05755-8 [33] A. Rokicinska M. Drozdek B. Dudek B. Gil P. Michorczyk D. Brouri S. Dzwigaj P. Kustrowski Cobalt-containing BEA zeolite for catalytic combustion of toluene Appl. Catal. B 212 2017 59 67 10.1016/j.apcatb.2017.04.067 A. Rokicínska, M. Drozdek, B. Dudek, B. Gil, P. Michorczyk, D. Brouri, S. Dzwigaj, P. Kústrowski, Cobalt-containing BEA zeolite for catalytic combustion of toluene, Appl. Catal. B 212 (2017) 59-67. DOI: 10.1016/j.apcatb.2017.04.067 [34] G. Jacobs T.K. Das Y. Zhang J. Li G. Racoillet B.H. Davis Fischer-Tropsch synthesis: support, loading, and promoter effects on the reducibility of cobalt catalysts Appl. Catal. A 233 2002 263 281 10.1016/S0926-860X(02)00195-3 G. Jacobs, T.K. Das, Y. Zhang, J. Li, G. Racoillet, B.H. Davis, Fischer-Tropsch synthesis: support, loading, and promoter effects on the reducibility of cobalt catalysts, Appl. Catal. A 233 (2002) 263-281. DOI: 10.1016/S0926-860X(02)00195-3 [35] A.L.C. Pereira J.M. González-Carballo F.J. Pérez-Alonso S. Rojas J.L.G. Fierro M.d.C. Rangel Effect of the mesostructuration of the beta zeolite support on the properties of cobalt catalysts for Fischer-Tropsch synthesis Top. Catal. 54 2011 179 189 10.1007/s11244-011-9637-6 A.L.C. Pereira, J.M. González-Carballo, F.J. Pérez-Alonso, S. Rojas, J.L.G. Fierro, M.d.C. Rangel, Effect of the Mesostructuration of the Beta Zeolite Support on the Properties of Cobalt Catalysts for Fischer–Tropsch Synthesis, Top. Catal. 54 (2011) 179-189. DOI: 10.1007/s11244-011-9637-6 [36] A. Martínez-Hernández G.A. Fuentes Redistribution of cobalt species in Co-ZSM5 during operation under wet conditions in the reduction of NO x by propane Appl. Catal. B 57 2005 167 174 10.1016/j.apcatb.2004.10.018 A. Martínez-Hernández, G.A. Fuentes, Redistribution of cobalt species in Co-ZSM5 during operation under wet conditions in the reduction of NOx by propane, Appl. Catal. B 57 (2005) 167-174. DOI: 10.1016/j.apcatb.2004.10.018 [37] A.A. Verberckmoes B.M. Weckhuysen R.A. Schoonheydt Spectroscopy and coordination chemistry of cobalt in molecular sieves Micropor. Mesopor. Mater. 22 1998 165 178 10.1016/S1387-1811(98)00091-2 A.A. Verberckmoes, B. M.Weckhuysen, R.A. Schoonheydt, Spectroscopy and coordination chemistry of cobalt in molecular sieves, Micropor. Mesopor. Mater. 22 (1998) 165-178. DOI: 10.1016/S1387-1811(98)00091-2 [38] A. Bellmann H. Atia U. Bentrup A. Brückner Mechanism of the selective reduction of NO x by methane over Co-ZSM-5 Appl. Catal. B 230 2018 184 193 10.1016/j.apcatb.2018.02.051 A. Bellmann, H. Atia, U. Bentrup, A. Brückner, Mechanism of the selective reduction of NOx by methane over Co-ZSM-5, Appl. Catal. B 230 (2018) 184-193. DOI: 10.1016/j.apcatb.2018.02.051 [39] K. Kojima H. Taguchi J. Matsuda Optical and magnetic properties of Co2+ ions in dried and heated silica gels prepared by the soffiel process J. Phys. Chem. 95 1991 7595 7598 10.1021/j100173a009 K. Kojima, H. Taguchi, J. Matsuda, Optical and Magnetic Properties of Co2+ Ions in Dried and Heated Silica Gels Prepared by the Soffiel Process, J. Phys. Chem. 95 (1991) 7595-7598. DOI: 10.1021/j100173a009 [40] X.Y. Zhang Y.Y. Guan Y. Xiong Y. Zhao S.Q. Zhang Nitrous oxide decomposition over Co/SBA-15 catalysts: the influence of metal loading, cobalt precursor, and solvent effect Mater. Res. Innovations 20 2016 487 494 10.1179/1433075X15Y.0000000062 X.Y. Zhang, Y.Y. Guan, Y. Xiong, Y. Zhao, S.Q. Zhang, Nitrous oxide decomposition over Co/SBA-15 catalysts: the influence of metal loading, cobalt precursor, and solvent effect, Mater. Res. Innovations 20 (2016) 487-494. DOI: 10.1179/1433075X15Y.0000000062 [41] Z. Chen S. Miao J. Guan F. Zhang C. Li Sub-2 nm cobalt oxide cluster catalyst supported on alumina for efficient water oxidation Appl. Catal. A 521 2016 154 159 10.1016/j.apcata.2015.11.039 Z. Chen, S. Miao, J. Guan, F. Zhang, C. Li, Sub-2 nm cobalt oxide cluster catalyst supported on alumina for efficient water oxidation, Appl. Catal. A 521 (2016) 154-159. DOI: 10.1016/j.apcata.2015.11.039 [42] P. Selvam S. Mohapatra Synthesis and characterization of divalent cobalt-substituted mesoporous aluminophosphate molecular sieves and their application as novel heterogeneous catalysts for the oxidation of cycloalkanes J. Catal. 233 2005 276 287 10.1016/j.jcat.2005.04.036 P. Selvam, S. Mohapatra, Synthesis and characterization of divalent cobalt-substituted mesoporous aluminophosphate molecular sieves and their application as novel heterogeneous catalysts for the oxidation of cycloalkanes, J. Catal. 233 (2005) 276-287. DOI: 10.1016/j.jcat.2005.04.036 [43] T. Tsoncheva L. Ivanova J. Rosenholm M. Linden Cobalt oxide species supported on SBA-15, KIT-5 and KIT-6 mesoporous silicas for ethyl acetate total oxidation Appl. Catal. B 89 2009 365 374 10.1016/j.apcatb.2008.12.015 T. Tsoncheva, L. Ivanova, J. Rosenholm, M. Linden, Cobalt oxide species supported on SBA-15, KIT-5 and KIT-6 mesoporous silicas for ethyl acetate total oxidation, Appl. Catal. B 89 (2009) 365-374. DOI: 10.1016/j.apcatb.2008.12.015 [44] R. Koirala O.V. Safonova S.E. Pratsinis A. Baiker Effect of cobalt loading on structure and catalytic behavior of CoO x /SiO2 in CO2-assisted dehydrogenation of ethane Appl. Catal. A 552 2018 77 85 10.1016/j.apcata.2017.12.025 R. Koirala, O.V. Safonova, S.E. Pratsinis, A. Baiker, Effect of cobalt loading on structure and catalytic behavior of CoOx/SiO2 in CO2-assisted dehydrogenation of ethane, Appl. Catal. A 552 (2018) 77-85. DOI: 10.1016/j.apcata.2017.12.025 [45] Q.-X. Luo L.-P. Guo S.-Y. Yao J. Bao Z.-T. Liu Z.-W. Liu Cobalt nanoparticles confined in carbon matrix for probing the size dependence in Fischer-Tropsch synthesis J. Catal. 369 2019 143 156 10.1016/j.jcat.2018.11.002 Q.-X. Luo, L.-P. Guo, S.-Y. Yao, J. Bao, Z.-T. Liu, Z.-W. Liu, Cobalt nanoparticles confined in carbon matrix for probing the size dependence in Fischer-Tropsch synthesis, J. Catal. 369 (2019) 143-156. DOI: 10.1016/j.jcat.2018.11.002 [46] L. Kuboňová P. Peikertová K. Mamulová Kutláková K. Jirátová G. Słowik L. Obalová P. Cool Catalytic activity of cobalt grafted on ordered mesoporous silica materials in N2O decomposition and CO oxidation Mol. Catal. 437 2017 57 72 10.1016/j.mcat.2017.04.037 L. Kuboňová, P. Peikertová, K. Mamulová Kutláková, K. Jirátová, G. Słowik, L. Obalová, P. Cool, Catalytic activity of cobalt grafted on ordered mesoporous silica materials in N2O decomposition and CO oxidation, Mol. Catal. 437 (2017) 57-72. DOI: 10.1016/j.mcat.2017.04.037 [47] X. He X. Song W. Qiao Z. Li X. Zhang S. Yan W. Zhong Y. Du Phase- and size-dependent optical and magnetic properties of CoO nanoparticles J. Phys. Chem. C 119 2015 9550 9559 10.1021/jp5127909 X. He, X. Song, W. Qiao, Z. Li, X. Zhang, S. Yan, W. Zhong, Y. Du, Phase- and Size-Dependent Optical and Magnetic Properties of CoO Nanoparticles, J. Phys. Chem. C 119 (2015) 9550-9559. DOI: 10.1021/jp5127909 [48] L. Liu P. Concepción A. Corma Non-noble metal catalysts for hydrogenation: a facile method for preparing Co nanoparticles covered with thin layered carbon J. Catal. 340 2016 1 9 10.1016/j.jcat.2016.04.006 L. Liu, P. Concepción, A. Corma, Non-noble metal catalysts for hydrogenation: A facile method for preparing Co nanoparticles covered with thin layered carbon, J. Catal. 340 (2016) 1-9. DOI: 10.1016/j.jcat.2016.04.006 [49] L. Ren P. Wang Y. Han C. Hu B. Wei Synthesis of CoC2O4·2H2O nanorods and their thermal decomposition to Co3O4 nanoparticles Chem. Phys. Lett. 476 2009 78 83 10.1016/j.cplett.2009.06.015 L. Ren, P. Wang, Y. Han, C. Hu, B. Wei, Synthesis of CoC2O4·2H2O nanorods and their thermal decomposition to Co3O4 nanoparticles, Chem. Phys. Lett. 476 (2009) 78-83. DOI: 10.1016/j.cplett.2009.06.015 [50] Q. Tang Q. Zhang Y.W. Ping Wang H. Wan Characterizations of cobalt oxide nanoparticles within faujasite zeolites and the formation of metallic cobalt Chem. Mater. 16 2004 1967 1976 10.1021/cm030626z Q. Tang, Q. Zhang, Y.W. Ping Wang, H. Wan, Characterizations of Cobalt Oxide Nanoparticles within Faujasite Zeolites and the Formation of Metallic Cobalt, Chem. Mater. 16 (2004) 1967-1976. DOI: 10.1021/cm030626z [51] G. Jacobs K.D. TaPan Y. Zhang J. Li G. Racoillet H.D. Burtron Fischer-Tropsch synthesis: support, loading, and promoter effects on the reducibility of cobalt catalysts Appl. Catal. A 233 2002 10.1016/S0926-860X(02)00195-3 G. Jacobs, K.D. TaPan, Y. Zhang, J. Li, G. Racoillet, H. D. Burtron, Fischer–Tropsch synthesis: support, loading, and promoter effects on the reducibility of cobalt catalysts, Appl. Catal. A 233 (2002). DOI: 10.1016/S0926-860X(02)00195-3 [52] B. Paweł L. Chmielarz S. Casale C. Calers J.-M. Krafft S. Dzwigaj Effect of Co content on the catalytic activity of CoSiBEA zeolites in N2O decomposition and SCR of NO with ammonia Catal. Today 258 2015 507 517 10.1016/j.cattod.2014.12.001 B. Paweł, L. Chmielarz, S. Casale, C. Calers, J-M Krafft, S. Dzwigaj, Effect of Co content on the catalytic activity of CoSiBEA zeolites in N2O decomposition and SCR of NO with ammonia, Catal. Today 258 (2015) 507-517. DOI: 10.1016/j.cattod.2014.12.001 [53] R. Baran J.-M. Krafft T. Onfroy T. Grzybek S. Dzwigaj Influence of the nature and environment of cobalt on the catalytic activity of Co-BEA zeolites in selective catalytic reduction of NO with ammonia Micropor. Mesopor. Mater. 225 2016 515 523 10.1016/j.micromeso.2015.12.061 R. Baran, J.-M. Krafft, T. Onfroy, T. Grzybek, S. Dzwigaj, Influence of the nature and environment of cobalt on the catalytic activity of Co-BEA zeolites in selective catalytic reduction of NO with ammonia, Micropor. Mesopor. Mater. 225 (2016) 515-523. DOI: 10.1016/j.micromeso.2015.12.061 [54] G. Zhang D. Wang P. Feng S. Shi C. Wang A. Zheng G. Lü Z. Tian Synthesis of zeolite Beta containing ultra-small CoO particles for ethylbenzene oxidation Chin. J. Catal. 38 2017 1207 1215 10.1016/s1872-2067(17)62853-5 G. Zhang, D. Wang, P. Feng, S. Shi, C. Wang, A. Zheng, G. Lü, Z. Tian, Synthesis of zeolite Beta containing ultra-small CoO particles for ethylbenzene oxidation, Chin. J. Catal. 38 (2017) 1207-1215. DOI: 10.1016/s1872-2067(17)62853-5 [55] D. Gu C.J. Jia C. Weidenthaler H.J. Bongard B. Spliethoff W. Schmidt F. Schuth Highly ordered mesoporous cobalt-containing oxides: structure, catalytic properties, and active sites in oxidation of carbon monoxide J. Am. Chem. Soc. 137 2015 11407 11418 10.1021/jacs.5b06336 D. Gu, C.J. Jia, C. Weidenthaler, H.J. Bongard, B. Spliethoff, W. Schmidt, F. Schuth, Highly Ordered Mesoporous Cobalt-Containing Oxides: Structure, Catalytic Properties, and Active Sites in Oxidation of Carbon Monoxide, J. Am. Chem. Soc. 137 (2015) 11407-11418. DOI: 10.1021/jacs.5b06336 [56] R. Xiang Y. Duan L. Peng Y. Wang C. Tong L. Zhang Z. Wei Three-dimensional Core@Shell Co@CoMoO4 nanowire arrays as efficient alkaline hydrogen evolution electro-catalysts Appl. Catal. B 246 2019 41 49 10.1016/j.apcatb.2019.01.035 R. Xiang, Y. Duan, L. Peng, Y. Wang, C. Tong, L. Zhang, Z. Wei, Three-dimensional Core@Shell Co@CoMoO4 nanowire arrays as efficient alkaline hydrogen evolution electro-catalysts, Appl. Catal. B 246 (2019) 41-49. DOI: 10.1016/j.apcatb.2019.01.035 [57] X. Wang H.-Y. Chen W.M.H. Sachtler Catalytic reduction of NO x by hydrocarbons over Co/ZSM-5 catalysts prepared with different methods Appl. Catal. B 26 2000 227 239 10.1016/S0926-3373(00)00125-9 X. Wang, H.-Y. Chen, W.M.H. Sachtler, Catalytic reduction of NOx by hydrocarbons over Co/ZSM-5 catalysts prepared with different methods, Appl. Catal. B 26 (2000) 227-239. DOI: 10.1016/S0926-3373(00)00125-9",
      "scopus-id": "85078297339",
      "coredata": {
        "eid": "1-s2.0-S0021951719306426",
        "dc:description": "CoO x within dealuminated Beta (SiBeta) zeolite developing into ultrasmall-sized Co particles under H2 or reactant gas is highly efficient for catalyzing direct dehydrogenation of propane (PDH) to propylene reaction. The existence of highly dispersed CoO x species is identified, and the easily reducible CoO x species are confined in the created T-sites (silanols) of SiBeta support. The CoSiBeta catalysts with or without prereduction treatments show similar catalytic performance but different induction periods, implying that the metallic Co formed in situ during the reaction are the active sites. Co in SiBeta zeolite (0.5 wt%) showed state-of-the-art propylene productivity with propane conversion of about 72% and propylene selectivity of over 92% at 600 °C, which is far better than that of the other reported Co catalysts and comparable to that of industrial catalysts. This work proves the high catalytic ability and product selectivity of small confined Co particles, as well as providing novel inspiration for the design of low-cost, ecofriendly, and advanced catalysts for PDH.",
        "openArchiveArticle": "false",
        "prism:coverDate": "2020-03-31",
        "openaccessUserLicense": null,
        "prism:aggregationType": "Journal",
        "prism:url": "https://api.elsevier.com/content/article/pii/S0021951719306426",
        "dc:creator": [
          {
            "@_fa": "true",
            "$": "Chen, Chong"
          },
          {
            "@_fa": "true",
            "$": "Zhang, Shoumin"
          },
          {
            "@_fa": "true",
            "$": "Wang, Zheng"
          },
          {
            "@_fa": "true",
            "$": "Yuan, Zhong-Yong"
          }
        ],
        "link": [
          {
            "@_fa": "true",
            "@rel": "self",
            "@href": "https://api.elsevier.com/content/article/pii/S0021951719306426"
          },
          {
            "@_fa": "true",
            "@rel": "scidir",
            "@href": "https://www.sciencedirect.com/science/article/pii/S0021951719306426"
          }
        ],
        "dc:format": "application/json",
        "openaccessType": null,
        "pii": "S0021-9517(19)30642-6",
        "prism:volume": "383",
        "prism:publisher": "Elsevier Inc.",
        "dc:title": "Ultrasmall Co confined in the silanols of dealuminated beta zeolite: A highly active and selective catalyst for direct dehydrogenation of propane to propylene",
        "prism:copyright": "© 2020 Elsevier Inc. All rights reserved.",
        "openaccess": "0",
        "prism:issn": "00219517",
        "dcterms:subject": [
          {
            "@_fa": "true",
            "$": "Propane dehydrogenation"
          },
          {
            "@_fa": "true",
            "$": "CoSiBeta catalyst"
          },
          {
            "@_fa": "true",
            "$": "Active sites"
          },
          {
            "@_fa": "true",
            "$": "Confined Co particles"
          },
          {
            "@_fa": "true",
            "$": "Silanols"
          }
        ],
        "openaccessArticle": "false",
        "prism:publicationName": "Journal of Catalysis",
        "openaccessSponsorType": null,
        "prism:pageRange": "77-87",
        "prism:endingPage": "87",
        "pubType": "fla",
        "prism:coverDisplayDate": "March 2020",
        "prism:doi": "10.1016/j.jcat.2019.12.037",
        "prism:startingPage": "77",
        "dc:identifier": "doi:10.1016/j.jcat.2019.12.037",
        "openaccessSponsorName": null
      },
      "objects": {
        "object": [
          {
            "@category": "standard",
            "@height": "238",
            "@width": "578",
            "@_fa": "true",
            "$": "https://api.elsevier.com/content/object/eid/1-s2.0-S0021951719306426-gr1.jpg?httpAccept=%2A%2F%2A",
            "@multimediatype": "JPEG image file",
            "@type": "IMAGE-DOWNSAMPLED",
            "@size": "26931",
            "@ref": "gr1",
            "@mimetype": "image/jpeg"
          },
          {
            "@category": "standard",
            "@height": "260",
            "@width": "369",
            "@_fa": "true",
            "$": "https://api.elsevier.com/content/object/eid/1-s2.0-S0021951719306426-gr10.jpg?httpAccept=%2A%2F%2A",
            "@multimediatype": "JPEG image file",
            "@type": "IMAGE-DOWNSAMPLED",
            "@size": "24421",
            "@ref": "gr10",
            "@mimetype": "image/jpeg"
          },
          {
            "@category": "standard",
            "@height": "242",
            "@width": "621",
            "@_fa": "true",
            "$": "https://api.elsevier.com/content/object/eid/1-s2.0-S0021951719306426-gr11.jpg?httpAccept=%2A%2F%2A",
            "@multimediatype": "JPEG image file",
            "@type": "IMAGE-DOWNSAMPLED",
            "@size": "31450",
            "@ref": "gr11",
            "@mimetype": "image/jpeg"
          },
          {
            "@category": "standard",
            "@height": "232",
            "@width": "576",
            "@_fa": "true",
            "$": "https://api.elsevier.com/content/object/eid/1-s2.0-S0021951719306426-gr2.jpg?httpAccept=%2A%2F%2A",
            "@multimediatype": "JPEG image file",
            "@type": "IMAGE-DOWNSAMPLED",
            "@size": "29456",
            "@ref": "gr2",
            "@mimetype": "image/jpeg"
          },
          {
            "@category": "standard",
            "@height": "244",
            "@width": "575",
            "@_fa": "true",
            "$": "https://api.elsevier.com/content/object/eid/1-s2.0-S0021951719306426-gr3.jpg?httpAccept=%2A%2F%2A",
            "@multimediatype": "JPEG image file",
            "@type": "IMAGE-DOWNSAMPLED",
            "@size": "37829",
            "@ref": "gr3",
            "@mimetype": "image/jpeg"
          },
          {
            "@category": "standard",
            "@height": "293",
            "@width": "347",
            "@_fa": "true",
            "$": "https://api.elsevier.com/content/object/eid/1-s2.0-S0021951719306426-gr4.jpg?httpAccept=%2A%2F%2A",
            "@multimediatype": "JPEG image file",
            "@type": "IMAGE-DOWNSAMPLED",
            "@size": "35297",
            "@ref": "gr4",
            "@mimetype": "image/jpeg"
          },
          {
            "@category": "standard",
            "@height": "218",
            "@width": "762",
            "@_fa": "true",
            "$": "https://api.elsevier.com/content/object/eid/1-s2.0-S0021951719306426-gr5.jpg?httpAccept=%2A%2F%2A",
            "@multimediatype": "JPEG image file",
            "@type": "IMAGE-DOWNSAMPLED",
            "@size": "60729",
            "@ref": "gr5",
            "@mimetype": "image/jpeg"
          },
          {
            "@category": "standard",
            "@height": "388",
            "@width": "578",
            "@_fa": "true",
            "$": "https://api.elsevier.com/content/object/eid/1-s2.0-S0021951719306426-gr6.jpg?httpAccept=%2A%2F%2A",
            "@multimediatype": "JPEG image file",
            "@type": "IMAGE-DOWNSAMPLED",
            "@size": "88647",
            "@ref": "gr6",
            "@mimetype": "image/jpeg"
          },
          {
            "@category": "standard",
            "@height": "226",
            "@width": "755",
            "@_fa": "true",
            "$": "https://api.elsevier.com/content/object/eid/1-s2.0-S0021951719306426-gr7.jpg?httpAccept=%2A%2F%2A",
            "@multimediatype": "JPEG image file",
            "@type": "IMAGE-DOWNSAMPLED",
            "@size": "49369",
            "@ref": "gr7",
            "@mimetype": "image/jpeg"
          },
          {
            "@category": "standard",
            "@height": "735",
            "@width": "578",
            "@_fa": "true",
            "$": "https://api.elsevier.com/content/object/eid/1-s2.0-S0021951719306426-gr8.jpg?httpAccept=%2A%2F%2A",
            "@multimediatype": "JPEG image file",
            "@type": "IMAGE-DOWNSAMPLED",
            "@size": "63465",
            "@ref": "gr8",
            "@mimetype": "image/jpeg"
          },
          {
            "@category": "standard",
            "@height": "240",
            "@width": "575",
            "@_fa": "true",
            "$": "https://api.elsevier.com/content/object/eid/1-s2.0-S0021951719306426-gr9.jpg?httpAccept=%2A%2F%2A",
            "@multimediatype": "JPEG image file",
            "@type": "IMAGE-DOWNSAMPLED",
            "@size": "36784",
            "@ref": "gr9",
            "@mimetype": "image/jpeg"
          },
          {
            "@category": "standard",
            "@height": "200",
            "@width": "435",
            "@_fa": "true",
            "$": "https://api.elsevier.com/content/object/eid/1-s2.0-S0021951719306426-ga1.jpg?httpAccept=%2A%2F%2A",
            "@multimediatype": "JPEG image file",
            "@type": "IMAGE-DOWNSAMPLED",
            "@size": "27094",
            "@ref": "ga1",
            "@mimetype": "image/jpeg"
          },
          {
            "@category": "thumbnail",
            "@height": "90",
            "@width": "219",
            "@_fa": "true",
            "$": "https://api.elsevier.com/content/object/eid/1-s2.0-S0021951719306426-gr1.sml?httpAccept=%2A%2F%2A",
            "@multimediatype": "GIF image file",
            "@type": "IMAGE-THUMBNAIL",
            "@size": "4733",
            "@ref": "gr1",
            "@mimetype": "image/gif"
          },
          {
            "@category": "thumbnail",
            "@height": "154",
            "@width": "219",
            "@_fa": "true",
            "$": "https://api.elsevier.com/content/object/eid/1-s2.0-S0021951719306426-gr10.sml?httpAccept=%2A%2F%2A",
            "@multimediatype": "GIF image file",
            "@type": "IMAGE-THUMBNAIL",
            "@size": "12135",
            "@ref": "gr10",
            "@mimetype": "image/gif"
          },
          {
            "@category": "thumbnail",
            "@height": "85",
            "@width": "219",
            "@_fa": "true",
            "$": "https://api.elsevier.com/content/object/eid/1-s2.0-S0021951719306426-gr11.sml?httpAccept=%2A%2F%2A",
            "@multimediatype": "GIF image file",
            "@type": "IMAGE-THUMBNAIL",
            "@size": "4961",
            "@ref": "gr11",
            "@mimetype": "image/gif"
          },
          {
            "@category": "thumbnail",
            "@height": "88",
            "@width": "219",
            "@_fa": "true",
            "$": "https://api.elsevier.com/content/object/eid/1-s2.0-S0021951719306426-gr2.sml?httpAccept=%2A%2F%2A",
            "@multimediatype": "GIF image file",
            "@type": "IMAGE-THUMBNAIL",
            "@size": "5175",
            "@ref": "gr2",
            "@mimetype": "image/gif"
          },
          {
            "@category": "thumbnail",
            "@height": "93",
            "@width": "219",
            "@_fa": "true",
            "$": "https://api.elsevier.com/content/object/eid/1-s2.0-S0021951719306426-gr3.sml?httpAccept=%2A%2F%2A",
            "@multimediatype": "GIF image file",
            "@type": "IMAGE-THUMBNAIL",
            "@size": "6188",
            "@ref": "gr3",
            "@mimetype": "image/gif"
          },
          {
            "@category": "thumbnail",
            "@height": "164",
            "@width": "194",
            "@_fa": "true",
            "$": "https://api.elsevier.com/content/object/eid/1-s2.0-S0021951719306426-gr4.sml?httpAccept=%2A%2F%2A",
            "@multimediatype": "GIF image file",
            "@type": "IMAGE-THUMBNAIL",
            "@size": "19329",
            "@ref": "gr4",
            "@mimetype": "image/gif"
          },
          {
            "@category": "thumbnail",
            "@height": "63",
            "@width": "219",
            "@_fa": "true",
            "$": "https://api.elsevier.com/content/object/eid/1-s2.0-S0021951719306426-gr5.sml?httpAccept=%2A%2F%2A",
            "@multimediatype": "GIF image file",
            "@type": "IMAGE-THUMBNAIL",
            "@size": "6947",
            "@ref": "gr5",
            "@mimetype": "image/gif"
          },
          {
            "@category": "thumbnail",
            "@height": "147",
            "@width": "219",
            "@_fa": "true",
            "$": "https://api.elsevier.com/content/object/eid/1-s2.0-S0021951719306426-gr6.sml?httpAccept=%2A%2F%2A",
            "@multimediatype": "GIF image file",
            "@type": "IMAGE-THUMBNAIL",
            "@size": "23336",
            "@ref": "gr6",
            "@mimetype": "image/gif"
          },
          {
            "@category": "thumbnail",
            "@height": "65",
            "@width": "219",
            "@_fa": "true",
            "$": "https://api.elsevier.com/content/object/eid/1-s2.0-S0021951719306426-gr7.sml?httpAccept=%2A%2F%2A",
            "@multimediatype": "GIF image file",
            "@type": "IMAGE-THUMBNAIL",
            "@size": "5742",
            "@ref": "gr7",
            "@mimetype": "image/gif"
          },
          {
            "@category": "thumbnail",
            "@height": "164",
            "@width": "129",
            "@_fa": "true",
            "$": "https://api.elsevier.com/content/object/eid/1-s2.0-S0021951719306426-gr8.sml?httpAccept=%2A%2F%2A",
            "@multimediatype": "GIF image file",
            "@type": "IMAGE-THUMBNAIL",
            "@size": "5144",
            "@ref": "gr8",
            "@mimetype": "image/gif"
          },
          {
            "@category": "thumbnail",
            "@height": "91",
            "@width": "219",
            "@_fa": "true",
            "$": "https://api.elsevier.com/content/object/eid/1-s2.0-S0021951719306426-gr9.sml?httpAccept=%2A%2F%2A",
            "@multimediatype": "GIF image file",
            "@type": "IMAGE-THUMBNAIL",
            "@size": "7004",
            "@ref": "gr9",
            "@mimetype": "image/gif"
          },
          {
            "@category": "thumbnail",
            "@height": "101",
            "@width": "219",
            "@_fa": "true",
            "$": "https://api.elsevier.com/content/object/eid/1-s2.0-S0021951719306426-ga1.sml?httpAccept=%2A%2F%2A",
            "@multimediatype": "GIF image file",
            "@type": "IMAGE-THUMBNAIL",
            "@size": "9089",
            "@ref": "ga1",
            "@mimetype": "image/gif"
          },
          {
            "@category": "high",
            "@height": "1056",
            "@width": "2560",
            "@_fa": "true",
            "$": "https://api.elsevier.com/content/object/eid/1-s2.0-S0021951719306426-gr1_lrg.jpg?httpAccept=%2A%2F%2A",
            "@multimediatype": "JPEG image file",
            "@type": "IMAGE-HIGH-RES",
            "@size": "191354",
            "@ref": "gr1",
            "@mimetype": "image/jpeg"
          },
          {
            "@category": "high",
            "@height": "1152",
            "@width": "1635",
            "@_fa": "true",
            "$": "https://api.elsevier.com/content/object/eid/1-s2.0-S0021951719306426-gr10_lrg.jpg?httpAccept=%2A%2F%2A",
            "@multimediatype": "JPEG image file",
            "@type": "IMAGE-HIGH-RES",
            "@size": "143504",
            "@ref": "gr10",
            "@mimetype": "image/jpeg"
          },
          {
            "@category": "high",
            "@height": "1072",
            "@width": "2752",
            "@_fa": "true",
            "$": "https://api.elsevier.com/content/object/eid/1-s2.0-S0021951719306426-gr11_lrg.jpg?httpAccept=%2A%2F%2A",
            "@multimediatype": "JPEG image file",
            "@type": "IMAGE-HIGH-RES",
            "@size": "198640",
            "@ref": "gr11",
            "@mimetype": "image/jpeg"
          },
          {
            "@category": "high",
            "@height": "1029",
            "@width": "2553",
            "@_fa": "true",
            "$": "https://api.elsevier.com/content/object/eid/1-s2.0-S0021951719306426-gr2_lrg.jpg?httpAccept=%2A%2F%2A",
            "@multimediatype": "JPEG image file",
            "@type": "IMAGE-HIGH-RES",
            "@size": "205366",
            "@ref": "gr2",
            "@mimetype": "image/jpeg"
          },
          {
            "@category": "high",
            "@height": "1080",
            "@width": "2547",
            "@_fa": "true",
            "$": "https://api.elsevier.com/content/object/eid/1-s2.0-S0021951719306426-gr3_lrg.jpg?httpAccept=%2A%2F%2A",
            "@multimediatype": "JPEG image file",
            "@type": "IMAGE-HIGH-RES",
            "@size": "277897",
            "@ref": "gr3",
            "@mimetype": "image/jpeg"
          },
          {
            "@category": "high",
            "@height": "1296",
            "@width": "1537",
            "@_fa": "true",
            "$": "https://api.elsevier.com/content/object/eid/1-s2.0-S0021951719306426-gr4_lrg.jpg?httpAccept=%2A%2F%2A",
            "@multimediatype": "JPEG image file",
            "@type": "IMAGE-HIGH-RES",
            "@size": "308789",
            "@ref": "gr4",
            "@mimetype": "image/jpeg"
          },
          {
            "@category": "high",
            "@height": "968",
            "@width": "3376",
            "@_fa": "true",
            "$": "https://api.elsevier.com/content/object/eid/1-s2.0-S0021951719306426-gr5_lrg.jpg?httpAccept=%2A%2F%2A",
            "@multimediatype": "JPEG image file",
            "@type": "IMAGE-HIGH-RES",
            "@size": "474247",
            "@ref": "gr5",
            "@mimetype": "image/jpeg"
          },
          {
            "@category": "high",
            "@height": "1720",
            "@width": "2559",
            "@_fa": "true",
            "$": "https://api.elsevier.com/content/object/eid/1-s2.0-S0021951719306426-gr6_lrg.jpg?httpAccept=%2A%2F%2A",
            "@multimediatype": "JPEG image file",
            "@type": "IMAGE-HIGH-RES",
            "@size": "819923",
            "@ref": "gr6",
            "@mimetype": "image/jpeg"
          },
          {
            "@category": "high",
            "@height": "1000",
            "@width": "3344",
            "@_fa": "true",
            "$": "https://api.elsevier.com/content/object/eid/1-s2.0-S0021951719306426-gr7_lrg.jpg?httpAccept=%2A%2F%2A",
            "@multimediatype": "JPEG image file",
            "@type": "IMAGE-HIGH-RES",
            "@size": "373935",
            "@ref": "gr7",
            "@mimetype": "image/jpeg"
          },
          {
            "@category": "high",
            "@height": "3256",
            "@width": "2560",
            "@_fa": "true",
            "$": "https://api.elsevier.com/content/object/eid/1-s2.0-S0021951719306426-gr8_lrg.jpg?httpAccept=%2A%2F%2A",
            "@multimediatype": "JPEG image file",
            "@type": "IMAGE-HIGH-RES",
            "@size": "481594",
            "@ref": "gr8",
            "@mimetype": "image/jpeg"
          },
          {
            "@category": "high",
            "@height": "1064",
            "@width": "2547",
            "@_fa": "true",
            "$": "https://api.elsevier.com/content/object/eid/1-s2.0-S0021951719306426-gr9_lrg.jpg?httpAccept=%2A%2F%2A",
            "@multimediatype": "JPEG image file",
            "@type": "IMAGE-HIGH-RES",
            "@size": "290769",
            "@ref": "gr9",
            "@mimetype": "image/jpeg"
          },
          {
            "@category": "high",
            "@height": "531",
            "@width": "1155",
            "@_fa": "true",
            "$": "https://api.elsevier.com/content/object/eid/1-s2.0-S0021951719306426-ga1_lrg.jpg?httpAccept=%2A%2F%2A",
            "@multimediatype": "JPEG image file",
            "@type": "IMAGE-HIGH-RES",
            "@size": "83794",
            "@ref": "ga1",
            "@mimetype": "image/jpeg"
          },
          {
            "@category": "standard",
            "@_fa": "true",
            "$": "https://api.elsevier.com/content/object/eid/1-s2.0-S0021951719306426-mmc1.docx?httpAccept=%2A%2F%2A",
            "@multimediatype": "Microsoft Word file",
            "@type": "APPLICATION",
            "@size": "6493627",
            "@ref": "mmc1",
            "@mimetype": "application/word"
          },
          {
            "@category": "thumbnail",
            "@_fa": "true",
            "$": "https://api.elsevier.com/content/object/eid/1-s2.0-S0021951719306426-si1.svg?httpAccept=%2A%2F%2A",
            "@multimediatype": "Scalable Vector Graphics file",
            "@type": "ALTIMG",
            "@size": "27337",
            "@ref": "si1",
            "@mimetype": "image/svg+xml"
          },
          {
            "@category": "thumbnail",
            "@_fa": "true",
            "$": "https://api.elsevier.com/content/object/eid/1-s2.0-S0021951719306426-si2.svg?httpAccept=%2A%2F%2A",
            "@multimediatype": "Scalable Vector Graphics file",
            "@type": "ALTIMG",
            "@size": "29815",
            "@ref": "si2",
            "@mimetype": "image/svg+xml"
          },
          {
            "@category": "thumbnail",
            "@_fa": "true",
            "$": "https://api.elsevier.com/content/object/eid/1-s2.0-S0021951719306426-si3.svg?httpAccept=%2A%2F%2A",
            "@multimediatype": "Scalable Vector Graphics file",
            "@type": "ALTIMG",
            "@size": "28021",
            "@ref": "si3",
            "@mimetype": "image/svg+xml"
          },
          {
            "@category": "standard",
            "@_fa": "true",
            "$": "https://api.elsevier.com/content/object/eid/1-s2.0-S0021951719306426-am.pdf?httpAccept=%2A%2F%2A",
            "@multimediatype": "Acrobat PDF file",
            "@type": "AAM-PDF",
            "@size": "1149869",
            "@ref": "am",
            "@mimetype": "application/pdf"
          }
        ]
      },
      "link": {
        "@rel": "abstract",
        "@href": "https://api.elsevier.com/content/abstract/scopus_id/85078297339"
      }
    }
  }
}