{
  "metadata": {
    "title": "Heterokaryotic transition-metal dimers embedded monolayer g-C<ce:inf loc=post>3</ce:inf>N<ce:inf loc=post>3</ce:inf> as promising anchoring and electrocatalytic materials for lithium-sulfur battery: First-principles calculations",
    "authors": "; ; ",
    "journal": "Journal of Catalysis",
    "date": "2024-05-31",
    "doi": "10.1016/j.jcat.2024.115449",
    "abstract": "",
    "uri": "https://api.elsevier.com/content/article/pii/S0021951724001623",
    "pii": "S0021951724001623"
  },
  "fulltext": {
    "full-text-retrieval-response": {
      "scopus-eid": "2-s2.0-85189171092",
      "originalText": "serial JL 272561 291210 291744 291809 31 Journal of Catalysis JOURNALCATALYSIS 2024-03-28 2024-03-28 2024-03-30 2024-03-30 2024-09-10T00:47:03 1-s2.0-S0021951724001623 S0021-9517(24)00162-3 S0021951724001623 10.1016/j.jcat.2024.115449 S300 S300.1 FULL-TEXT 1-s2.0-S0021951724X00056 2024-09-10T00:25:04.944999Z 0 0 20240501 20240531 2024 2024-03-28T17:19:18.928639Z absattachment articleinfo articlenumber articletitlenorm authfirstinitialnorm authfirstsurnamenorm cid cids contenttype copyright crossmark dateloaded dateloadedtxt datesearch datesort dateupdated dco docsubtype doctype doi eid ewtransactionid hubeid indexeddate issn issnnorm itemstage itemtransactionid itemweight openaccess openarchive pg pgfirst pii piinorm pubdateend pubdatestart pubdatetxt pubyr sectiontitle sortorder srctitle srctitlenorm srctype ssids alllist content subj subheadings suppl tomb volfirst volissue volumelist webpdf webpdfpagecount yearnav figure e-component body mmlmath acknowledge affil appendices articletitle auth authfirstini authfull authkeywords authlast highlightsabst primabst ref specialabst 0021-9517 00219517 true 433 433 C Volume 433 5 115449 115449 115449 202405 May 2024 2024-05-01 2024-05-31 2024 Regular Articles article fla © 2024 Elsevier Inc. All rights reserved. HETEROKARYOTICTRANSITIONMETALDIMERSEMBEDDEDMONOLAYERGC3N3PROMISINGANCHORINGELECTROCATALYTICMATERIALSFORLITHIUMSULFURBATTERYFIRSTPRINCIPLESCALCULATIONS DONG W 1 Introduction 2 Result 2.1 Structural and electronic structure of TM-TM@g-C3N3 2.2 Adsorption structure and adsorption energy 2.3 The electron structure of the adsorption configuration 2.4 Gibbs free energy 3 Conclusion 3.1 Calculation method CRediT authorship contribution statement Acknowledgements Appendix A Supplementary material References ZHANG 2021 537 546 B LIM 2019 18746 18757 W PANG 2016 16132 Q YIN 2013 13186 13200 Y HONG 2020 144 168 X LIANG 2022 2200102 Z LONG 2016 3868 3880 B PAN 2020 78 110 Y CHEN 2019 3492 3515 Z CHEN 2017 3463 3468 Z SUN 2023 291 X PAN 2023 155507 Y XIAO 2018 396 403 M HAN 2021 2105947 Z XU 2018 339 348 H CUI 2015 10652 10658 X LINDER 2015 307 315 J MISIORNY 2013 801 805 M FAROOQ 2015 25 30 M GAO 2014 2577 2581 D LI 2006 1593 1600 J KUHN 2008 3450 3453 P MUHAMMAD 2020 I KATRIEL 1977 143 185 J KAPLAN 2020 320 I DONG 2023 W ZHENG 2018 596 603 Y YIN 2016 203 210 L RAO 2016 207 214 D PENG 2017 23 33 Y WU 2018 2984 2994 J ZHANG 2018 11446 11452 X HE 2020 2299 2307 Q ZHANG 2022 140118 Y KRESSE 1999 1758 G PERDEW 1996 3865 J PERDEW 1992 6671 J ANISIMOV 1997 767 V BLOCHL 1994 17953 P ZHOU 2011 15113 15119 J OKABAYASHI 1998 R4211 J PANCHMATIA 2008 47 60 P BERNIEN 2009 047202 M SHICK 2004 125207 A MONKHORST 1976 5188 H BADER 1991 893 928 R HENKELMAN 2006 354 360 G SANVILLE 2007 899 908 E TANG 2009 084204 W DRONSKOWSKI 1993 8617 8624 R DERINGER 2011 5461 5466 V MAINTZ 2013 2557 2567 S DONGX2024X115449 DONGX2024X115449XW 2026-03-30T00:00:00.000Z 2026-03-30T00:00:00.000Z http://creativecommons.org/licenses/by-nc-nd/4.0/ © 2024 Elsevier Inc. All rights reserved. 2024-04-13T16:35:55.592Z http://vtw.elsevier.com/data/voc/AddOnTypes/50.7/aggregated-refined 101300213 2023JH2 http://sws.geonames.org/1814991 LJKZ0339 Liaoning Province Educational Department http://data.elsevier.com/vocabulary/SciValFunders/501100007620 http://sws.geonames.org/1814991 National Natural Science Foundation of China 21808095 52174253 NSFC National Natural Science Foundation of China http://data.elsevier.com/vocabulary/SciValFunders/501100001809 http://sws.geonames.org/1814991 Guangdong Basic and Applied Basic Research Foundation 2022A1515140159 Basic and Applied Basic Research Foundation of Guangdong Province http://data.elsevier.com/vocabulary/SciValFunders/501100021171 http://sws.geonames.org/1814991/ Basic Scientific Research Project of Colleges and Universities in Liaoning Province JYTQN2023209 http://sws.geonames.org/1814991 General Scientific Research Projects of Liaoning Province Education Department Liaoning Province Applied Basic Research Program Project The authors acknowledge funding support from the National Natural Science Foundation of China (52174253, 21808095) and General Scientific Research Projects of Liaoning Province Education Department (LJKZ0339), Liaoning Province Applied Basic Research Program Project (2023JH2, 101300213), and Guangdong Basic and Applied Basic Research Foundation (2022A1515140159), Basic Scientific Research Project of Colleges and Universities in Liaoning Province (JYTQN2023209). https://doi.org/10.15223/policy-017 https://doi.org/10.15223/policy-037 https://doi.org/10.15223/policy-012 https://doi.org/10.15223/policy-029 https://doi.org/10.15223/policy-004 item S0021-9517(24)00162-3 S0021951724001623 1-s2.0-S0021951724001623 10.1016/j.jcat.2024.115449 272561 2024-09-10T00:25:04.944999Z 2024-05-01 2024-05-31 1-s2.0-S0021951724001623-main.pdf https://s3-eu-west-1.amazonaws.com/prod-ucs-content-store-eu-west/content/pii:S0021951724001623/MAIN/application/pdf/010d8ba15655edf46911f12db9e5964d/main.pdf main.pdf pdf true 8972750 MAIN 11 1-s2.0-S0021951724001623-main_1.png https://s3-eu-west-1.amazonaws.com/prod-ucs-content-store-eu-west/content/pii:S0021951724001623/PREVIEW/image/png/113b832e3c557cc5e5869610c606cc94/main_1.png main_1.png png 54562 849 656 IMAGE-WEB-PDF 1 1-s2.0-S0021951724001623-gr4.jpg https://s3-eu-west-1.amazonaws.com/prod-ucs-content-store-eu-west/content/pii:S0021951724001623/gr4/DOWNSAMPLED/image/jpeg/811702aea42cd9b2e6e2bb2ac05c45ef/gr4.jpg gr4 gr4.jpg jpg 33730 205 535 IMAGE-DOWNSAMPLED 1-s2.0-S0021951724001623-gr5.jpg https://s3-eu-west-1.amazonaws.com/prod-ucs-content-store-eu-west/content/pii:S0021951724001623/gr5/DOWNSAMPLED/image/jpeg/178932f59123813bc4b1793d55538628/gr5.jpg gr5 gr5.jpg jpg 176477 910 642 IMAGE-DOWNSAMPLED 1-s2.0-S0021951724001623-gr6.jpg https://s3-eu-west-1.amazonaws.com/prod-ucs-content-store-eu-west/content/pii:S0021951724001623/gr6/DOWNSAMPLED/image/jpeg/4f6be923d5f1e53168bfa0224a450ade/gr6.jpg gr6 gr6.jpg jpg 143037 948 535 IMAGE-DOWNSAMPLED 1-s2.0-S0021951724001623-gr7.jpg https://s3-eu-west-1.amazonaws.com/prod-ucs-content-store-eu-west/content/pii:S0021951724001623/gr7/DOWNSAMPLED/image/jpeg/58b8a3a24613adc1c49713d01a118bae/gr7.jpg gr7 gr7.jpg jpg 57396 293 771 IMAGE-DOWNSAMPLED 1-s2.0-S0021951724001623-gr1.jpg https://s3-eu-west-1.amazonaws.com/prod-ucs-content-store-eu-west/content/pii:S0021951724001623/gr1/DOWNSAMPLED/image/jpeg/3a99d6f571c447f92e2cccca386d0da1/gr1.jpg gr1 gr1.jpg jpg 81953 477 535 IMAGE-DOWNSAMPLED 1-s2.0-S0021951724001623-gr2.jpg https://s3-eu-west-1.amazonaws.com/prod-ucs-content-store-eu-west/content/pii:S0021951724001623/gr2/DOWNSAMPLED/image/jpeg/b514c649646d8291e2ed1a408b20a316/gr2.jpg gr2 gr2.jpg jpg 221256 979 686 IMAGE-DOWNSAMPLED 1-s2.0-S0021951724001623-ga1.jpg https://s3-eu-west-1.amazonaws.com/prod-ucs-content-store-eu-west/content/pii:S0021951724001623/ga1/DOWNSAMPLED/image/jpeg/94e02ac8e3fa71339d0dd28f3407f493/ga1.jpg ga1 true ga1.jpg jpg 18149 199 258 IMAGE-DOWNSAMPLED 1-s2.0-S0021951724001623-gr3.jpg https://s3-eu-west-1.amazonaws.com/prod-ucs-content-store-eu-west/content/pii:S0021951724001623/gr3/DOWNSAMPLED/image/jpeg/06812ba1532a19366035445d5561409d/gr3.jpg gr3 gr3.jpg jpg 122704 683 535 IMAGE-DOWNSAMPLED 1-s2.0-S0021951724001623-gr4.sml https://s3-eu-west-1.amazonaws.com/prod-ucs-content-store-eu-west/content/pii:S0021951724001623/gr4/THUMBNAIL/image/gif/cd2c9370c869d2d234484cca7973a62e/gr4.sml gr4 gr4.sml sml 9167 84 219 IMAGE-THUMBNAIL 1-s2.0-S0021951724001623-gr5.sml https://s3-eu-west-1.amazonaws.com/prod-ucs-content-store-eu-west/content/pii:S0021951724001623/gr5/THUMBNAIL/image/gif/a17b34b80e02886ff85453dcd4462212/gr5.sml gr5 gr5.sml sml 9487 163 115 IMAGE-THUMBNAIL 1-s2.0-S0021951724001623-gr6.sml https://s3-eu-west-1.amazonaws.com/prod-ucs-content-store-eu-west/content/pii:S0021951724001623/gr6/THUMBNAIL/image/gif/78f4e5505e5110d50722a9e6fcf7de84/gr6.sml gr6 gr6.sml sml 7586 163 92 IMAGE-THUMBNAIL 1-s2.0-S0021951724001623-gr7.sml https://s3-eu-west-1.amazonaws.com/prod-ucs-content-store-eu-west/content/pii:S0021951724001623/gr7/THUMBNAIL/image/gif/6035c92112eeb970a7dcf3af4b92cbf8/gr7.sml gr7 gr7.sml sml 7209 83 219 IMAGE-THUMBNAIL 1-s2.0-S0021951724001623-gr1.sml https://s3-eu-west-1.amazonaws.com/prod-ucs-content-store-eu-west/content/pii:S0021951724001623/gr1/THUMBNAIL/image/gif/92777949635b13f34fcd2dd875c1a73a/gr1.sml gr1 gr1.sml sml 12455 164 184 IMAGE-THUMBNAIL 1-s2.0-S0021951724001623-gr2.sml https://s3-eu-west-1.amazonaws.com/prod-ucs-content-store-eu-west/content/pii:S0021951724001623/gr2/THUMBNAIL/image/gif/bf7b20d43f35800aa978542c101154a0/gr2.sml gr2 gr2.sml sml 11053 164 115 IMAGE-THUMBNAIL 1-s2.0-S0021951724001623-ga1.sml https://s3-eu-west-1.amazonaws.com/prod-ucs-content-store-eu-west/content/pii:S0021951724001623/ga1/THUMBNAIL/image/gif/284b7d723b54c2ae650ed8a50a210a80/ga1.sml ga1 true ga1.sml sml 11254 164 212 IMAGE-THUMBNAIL 1-s2.0-S0021951724001623-gr3.sml https://s3-eu-west-1.amazonaws.com/prod-ucs-content-store-eu-west/content/pii:S0021951724001623/gr3/THUMBNAIL/image/gif/927b3cb221cd0e07aa86a7c81c9b4127/gr3.sml gr3 gr3.sml sml 9901 163 128 IMAGE-THUMBNAIL 1-s2.0-S0021951724001623-gr4_lrg.jpg https://s3-eu-west-1.amazonaws.com/prod-ucs-content-store-eu-west/content/pii:S0021951724001623/HIGHRES/image/jpeg/042dcd0beaffde82ecb3643f2d664287/gr4_lrg.jpg gr4 gr4_lrg.jpg jpg 238505 906 2368 IMAGE-HIGH-RES 1-s2.0-S0021951724001623-gr5_lrg.jpg https://s3-eu-west-1.amazonaws.com/prod-ucs-content-store-eu-west/content/pii:S0021951724001623/HIGHRES/image/jpeg/6f43ca545f57a1f795fb4494bfbad608/gr5_lrg.jpg gr5 gr5_lrg.jpg jpg 1237367 4030 2844 IMAGE-HIGH-RES 1-s2.0-S0021951724001623-gr6_lrg.jpg https://s3-eu-west-1.amazonaws.com/prod-ucs-content-store-eu-west/content/pii:S0021951724001623/HIGHRES/image/jpeg/531d784343c483d79f933344a227f5e6/gr6_lrg.jpg gr6 gr6_lrg.jpg jpg 867953 4194 2368 IMAGE-HIGH-RES 1-s2.0-S0021951724001623-gr7_lrg.jpg https://s3-eu-west-1.amazonaws.com/prod-ucs-content-store-eu-west/content/pii:S0021951724001623/HIGHRES/image/jpeg/f0e04107910b21eb991e71b447effd73/gr7_lrg.jpg gr7 gr7_lrg.jpg jpg 355581 1295 3412 IMAGE-HIGH-RES 1-s2.0-S0021951724001623-gr1_lrg.jpg https://s3-eu-west-1.amazonaws.com/prod-ucs-content-store-eu-west/content/pii:S0021951724001623/HIGHRES/image/jpeg/5fce598a4b5873abc86c2bc8889fb826/gr1_lrg.jpg gr1 gr1_lrg.jpg jpg 505827 2113 2368 IMAGE-HIGH-RES 1-s2.0-S0021951724001623-gr2_lrg.jpg https://s3-eu-west-1.amazonaws.com/prod-ucs-content-store-eu-west/content/pii:S0021951724001623/HIGHRES/image/jpeg/e4470704f4fc5f5359598c25937cbe60/gr2_lrg.jpg gr2 gr2_lrg.jpg jpg 1446669 4337 3038 IMAGE-HIGH-RES 1-s2.0-S0021951724001623-ga1_lrg.jpg https://s3-eu-west-1.amazonaws.com/prod-ucs-content-store-eu-west/content/pii:S0021951724001623/HIGHRES/image/jpeg/0604829f2a55359162ed8c40cf0a9009/ga1_lrg.jpg ga1 true ga1_lrg.jpg jpg 137388 886 1146 IMAGE-HIGH-RES 1-s2.0-S0021951724001623-gr3_lrg.jpg https://s3-eu-west-1.amazonaws.com/prod-ucs-content-store-eu-west/content/pii:S0021951724001623/HIGHRES/image/jpeg/d3ce670ffb47e319ad927f1063cf9a75/gr3_lrg.jpg gr3 gr3_lrg.jpg jpg 860960 3022 2368 IMAGE-HIGH-RES 1-s2.0-S0021951724001623-mmc1.pdf https://s3-eu-west-1.amazonaws.com/prod-ucs-content-store-eu-west/content/pii:S0021951724001623/mmc1/MAIN/application/pdf/df04266dfa231a407519c9cc8ec685ad/mmc1.pdf mmc1 mmc1.pdf pdf false 451218 APPLICATION 1-s2.0-S0021951724001623-si1.svg https://s3-eu-west-1.amazonaws.com/prod-ucs-content-store-eu-west/content/pii:S0021951724001623/image/svg+xml/ab1bef3da3bc8934f709f69a11e15800/si1.svg si1 si1.svg svg 3212 ALTIMG 1-s2.0-S0021951724001623-si10.svg https://s3-eu-west-1.amazonaws.com/prod-ucs-content-store-eu-west/content/pii:S0021951724001623/image/svg+xml/7365aabdb6472f3d5e983fdc11a076c4/si10.svg si10 si10.svg svg 6680 ALTIMG 1-s2.0-S0021951724001623-si11.svg https://s3-eu-west-1.amazonaws.com/prod-ucs-content-store-eu-west/content/pii:S0021951724001623/image/svg+xml/9284fd264736149f17f3037b002ae39a/si11.svg si11 si11.svg svg 11337 ALTIMG 1-s2.0-S0021951724001623-si12.svg https://s3-eu-west-1.amazonaws.com/prod-ucs-content-store-eu-west/content/pii:S0021951724001623/image/svg+xml/d7e8a031a135190b83aaeed0a16aa4f3/si12.svg si12 si12.svg svg 16206 ALTIMG 1-s2.0-S0021951724001623-si13.svg https://s3-eu-west-1.amazonaws.com/prod-ucs-content-store-eu-west/content/pii:S0021951724001623/image/svg+xml/43226ca1564acfd50bfb334a721b533e/si13.svg si13 si13.svg svg 13462 ALTIMG 1-s2.0-S0021951724001623-si14.svg https://s3-eu-west-1.amazonaws.com/prod-ucs-content-store-eu-west/content/pii:S0021951724001623/image/svg+xml/28363f04719275dfa4aa7984d5a1073c/si14.svg si14 si14.svg svg 30272 ALTIMG 1-s2.0-S0021951724001623-si2.svg https://s3-eu-west-1.amazonaws.com/prod-ucs-content-store-eu-west/content/pii:S0021951724001623/image/svg+xml/246ca8b6686c282fbf6eab3d1ba775c3/si2.svg si2 si2.svg svg 19922 ALTIMG 1-s2.0-S0021951724001623-si3.svg https://s3-eu-west-1.amazonaws.com/prod-ucs-content-store-eu-west/content/pii:S0021951724001623/image/svg+xml/0118953a21a29f3d43c444d806f3a032/si3.svg si3 si3.svg svg 3829 ALTIMG 1-s2.0-S0021951724001623-si4.svg https://s3-eu-west-1.amazonaws.com/prod-ucs-content-store-eu-west/content/pii:S0021951724001623/image/svg+xml/2a78a8f37529bc5e54f447b75ba3fe81/si4.svg si4 si4.svg svg 4361 ALTIMG 1-s2.0-S0021951724001623-si5.svg https://s3-eu-west-1.amazonaws.com/prod-ucs-content-store-eu-west/content/pii:S0021951724001623/image/svg+xml/c5bd9dc2214d9b21f8ba8b04cbf8470c/si5.svg si5 si5.svg svg 13193 ALTIMG 1-s2.0-S0021951724001623-si6.svg https://s3-eu-west-1.amazonaws.com/prod-ucs-content-store-eu-west/content/pii:S0021951724001623/image/svg+xml/f084d954aec5b4be4cb2f044cb9a0919/si6.svg si6 si6.svg svg 1731 ALTIMG 1-s2.0-S0021951724001623-si7.svg https://s3-eu-west-1.amazonaws.com/prod-ucs-content-store-eu-west/content/pii:S0021951724001623/image/svg+xml/940b47536f0d08bf496e374621f818e7/si7.svg si7 si7.svg svg 23539 ALTIMG 1-s2.0-S0021951724001623-si8.svg https://s3-eu-west-1.amazonaws.com/prod-ucs-content-store-eu-west/content/pii:S0021951724001623/image/svg+xml/8e296d2e6999216704a41bc5123ef25c/si8.svg si8 si8.svg svg 5217 ALTIMG 1-s2.0-S0021951724001623-si9.svg https://s3-eu-west-1.amazonaws.com/prod-ucs-content-store-eu-west/content/pii:S0021951724001623/image/svg+xml/2d7ef5669222cb5d77ac80a13786647b/si9.svg si9 si9.svg svg 12224 ALTIMG 1-s2.0-S0021951724001623-am.pdf https://s3-eu-west-1.amazonaws.com/prod-ucs-content-store-eu-west/content/egi:10J9M11HKBZ/MAIN/application/pdf/47790020dbb60aae882f284cf7017840/am.pdf am am.pdf pdf false 1818004 AAM-PDF YJCAT 115449 115449 S0021-9517(24)00162-3 10.1016/j.jcat.2024.115449 Elsevier Inc. Fig. 1 Structural model of TM-TM@g-C3N3, Bader Charge Analysis, and Electron Localization Function (Isosurfaces = 0.03 eV). Fig. 2 Density of States and Crystal Orbital Hamilton Populations of MT-MT@g-C3N3, (a)-(j) are Mn-Mn@g-C3N3, Fe-Fe@g-C3N3, Co-Co@g-C3N3, Ni-Ni@g-C3N3, Fe-Co@g-C3N3, Fe-Ni@g-C3N3, Mn-Fe@g-C3N3, Co-Ni@g-C3N3, Mn-Co@g-C3N3, Mn-Ni@g-C3N3 respectively. Fig. 3 Stable adsorption structure of polysulfide on surface of TM-TM@g-C3N3. Fig. 4 Adsorption energy of polysulfide on the surface of homonuclear (a) and heterokaryosis (b) DACs. Fig. 5 Charge density difference of adsorption structure (Isosurfaces = 0.003 eV). Fig. 6 PDOS of S_p-orbitals and MT_d-orbitals for Li2S adsorbs structures on the surface of MT-MT@g-C3N3, (a)-(j) are Mn-Mn@g-C3N3, Fe-Fe@g-C3N3, Co-Co@g-C3N3,Ni-Ni@g-C3N3, Fe-Co@g-C3N3, Fe-Ni@g-C3N3, Mn-Fe@g-C3N3, Co-Ni@g-C3N3, Mn-Co@g-C3N3, Mn-Ni@g-C3N3 respectively. Fig. 7 (a) The free energy plots of Li2Sn/S8 conversion reactions on TM-TM@g-C3N3; (b) Reaction mechanism diagram. Heterokaryotic transition-metal dimers embedded monolayer g-C3N3 as promising anchoring and electrocatalytic materials for lithium-sulfur battery: First-principles calculations Wei Dong a b ⁎ Xuanyi Zhu Data curation Conceptualization a Mingyuan Zhao Resources c Qiming Chang Resources a Hao Gu Validation a Fang Yang Validation a Ding Shen Visualization a ⁎ Shuwei Tang Software a d Xiaodong Hong Resources e Xu Zhang Resources a Shuang Wei Resources a Ziwen Dong Resources f Shaobin Yang Visualization a a College of Material Science and Engineering, Liaoning Technical University, Fuxin 123000, China College of Material Science and Engineering Liaoning Technical University Fuxin 123000 China College of Material Science and Engineering, Liaoning Technical University, Fuxin 123000, China b Key Laboratory of Mineral High Value Conversion and Energy Storage Materials of Liaoning Province, Fuxin 123000, China Key Laboratory of Mineral High Value Conversion and Energy Storage Materials of Liaoning Province Fuxin 123000 China Key Laboratory of Mineral High Value Conversion and Energy Storage Materials of Liaoning Province, Fuxin 123000, China c State Key Laboratory of Advanced Brazing Filler Metals & Technology, Zhengzhou Research Institute of Mechanical Engineering, Zhengzhou 450001, China State Key Laboratory of Advanced Brazing Filler Metals & Technology Zhengzhou Research Institute of Mechanical Engineering Zhengzhou 450001 China State Key Laboratory of Advanced Brazing Filler Metals & Technology, Zhengzhou Research Institute of Mechanical Engineering, Zhengzhou 450001, China d Faculty of Chemistry, Northeast Normal University, Changchun, Changchun 130024, China Faculty of Chemistry Northeast Normal University, Changchun Changchun 130024 China Faculty of Chemistry, Northeast Normal University, Changchun, Changchun 130024, China e School of Materials Science and Hydrogen Energy, Foshan University, Foshan 528000, China School of Materials Science and Hydrogen Energy Foshan University Foshan 528000 China School of Materials Science and Hydrogen Energy, Foshan University, Foshan 528000, China f School of Safety Engineering, Ningbo University of Technology, Ningbo 315211, China School of Safety Engineering Ningbo University of Technology Ningbo 315211 China School of Safety Engineering, Ningbo University of Technology, Ningbo 315211, China ⁎ Corresponding authors. Graphical abstract g-C3N3 not only has high content of pyridine nitrogen, but also has a special two-dimensional porous structure, which is an ideal diatomic catalytic host materials. In this work, homonuclear and heteronuclear dual-atom catalysts (DACs, TM-TM@g-C3N3, TM = Mn, Fe, Co, Ni) were constructed using single-layer g-C3N3 as the carrier material of DACs, and their potential as sulfur-hosting materials and electrocatalytic materials for lithium-sulfur batteries was explored through first principles comprehensively. The results show that the coupling between the two metal atoms in heteronuclear DACs can regulate the spin state of each other's d-electrons, so that the anchoring and catalytic effects of heteronuclear DACs on polysulfide are more excellent than that of homonuclear DACs. Co-Mn@g-C3N3, when utilized as the cathode material in lithium-sulfur batteries, offers exceptional properties due to the hybridization between Mn2+ high-spin state d electron and Co2+ half-filled dz 2 orbital. This unique interaction not only enables the polysulfide to exhibit the lowest Gibbs free energy during conversion, but also results in the lowest reaction energy barrier of 0.26 eV for the conversion of Li2S2 to Li2S. Furthermore, it is found that when 3d transition metal atoms act as heteronuclear DACs, the coupling between metal ions with high-spin states at the active site and metal ions with empty orbitals or half-full d-electrons has the most significant catalytic effect on polysulfides. Keywords Dual-atom catalysts Single-layer g-C3N3 Cathode material Lithium-sulfur batteries Data availability Data will be made available on request. 1 Introduction Lithium-sulfur batteries (LSBs) are one of the most promising rechargeable energy storage devices, and the 16-electrons transfer from the cathode active sulfur substance (S8) to Li2S and the non-topological reaction mechanism of the electrode material achieve a high theoretical energy density of 2600 Wh/g [1,2]. However, the low conductivity of the sulfur cathode, the shuttle effect of polysulfide (LiPSs), and the slow kinetics of sulfur reduction (SRR) reaction still hinder the practical application of LSBs [3–6]. Therefore, the development of sulfur-hosting materials with excellent anchoring and catalytic effects on LiPSs has long been the research topic of many scholars. Since the single atom catalyst (SACs) was proposed in 2011, it has been widely developed. Although there is no traditional metal–metal bond in the coordination mode, the unique coordination configuration of single atom makes SACs have very high catalytic activity in almost all types of catalytic reactions such as hydrogenation reaction, water vapor conversion, photocatalysis and electrocatalysis [7]. However, in SACs, the contact area between the single atom and the carrier is small, the interaction is weak, and the load is relatively low. The microstructure of SACs not only changes the activity, but also changes the selectivity of different products [8]. Therefore, it is crucial to manipulate the catalyst structure with high precision and design catalysts with different active sites. On the basis of single atomic sites, more complex systems such as diatomic sites, multiatomic sites and atomic interfaces have been conceived and constructed to improve the catalytic activity of catalysts [9]. Among them, diatomic catalysts (DACs) have become a new frontier in heterogeneous catalysis because they can produce synergistic effect between adjacent active sites, and improve catalytic activity while maintaining high utilization rate, good selectivity, atomic dispersion and high stability [10]. Compared with SACs, DACs can increase the number of single atom load and thus increase the number of active centers [11]. Existing studies have shown that catalysts usually involve the hybridization of d orbitals of transition metal atoms with adsorbed LiPSs intermediates, reducing the reaction energy barrier by changing their electronic structure. For example, Xun et al. [12] prepared hollow carbon spheres supported by Fe-Co atomically dispersed DACs with bi-functional catalytic activity as sulfur hosting materials for LSBs. The unique two-site structure not only enhances the anchoring effect of LiPSs, but also accelerates the transformation of LiPSs and promotes the decomposition of Li2S. Pan et al. [13] adopted the first principles, using single-layer C2N as DACs carrier, and introducing Cu, V, Co, Fe, and Ni homonuclear dimers to form sulfur hosting materials for LSBs. The results show that these DACs not only have excellent anchoring ability for polysulfide, but also reduce the free energy of sulfur reduction reaction to 1.22 ∼ 1.46 eV, and the decomposition energy barrier of electrochemical conversion to 0.82 ∼ 1.29 eV, which effectively improves the conversion efficiency during discharge/charging. Further research on DACs has focused on other areas, such as strong REDOX reaction (ORR), oxygen evolution reaction (OER), hydrogen evolution reaction (HER), atmospheric nitrogen reduction (NRR) and carbon dioxide reduction (CO2RR) [9]. Xing et al. [14] prepared DACs with the novel dual-nuclear active site structure of Co2NxCy, and the activity of the ORR reaction was about 12 times higher than that of the traditional CoN4 site. Fe-Cu diatomic site catalyst N4Fe-CuN3 with unique coordination structure prepared by Feng et al. [15]. The synergistic effect of Fe-Cu diatoms effectively regulates the position of the d-band center, which can effectively reduce the formation of *COOH intermediates and the energy barrier of *CO desorption, and promote the generation of CO. Carriers play a crucial role in the study of DASs due to the size effect and ligand effect of catalysts. Metal oxides were used as carriers of SACs and DACs in earlier years, but due to the difficulty of preparation, there were few and insufficient researches [16]. As the carrier materials of DACs are relatively limited, rational use of the quantum confinement effect of porous materials may be an effective strategy to overcome the above problems [17]. In the present study, two-dimensional CN materials with flat surface structure have received extensive attention due to their low dimension and special electronic properties [18,19], and can be used as carriers for SACs and DACs catalysts due to their excellent spintronic properties [20–23]. Among them, g-C3N3 not only has a relatively high content of pyridine nitrogen, but also has a special two-dimensional porous structure, and the structure is stable [24]. Therefore, g-C3N3 is expected to be an excellent carrier of metal single atom and dimer. In recent years, it has been found that the orbital hybridization between the d-orbital of the transition metal and the p-orbital of the S atom can enhance the bonding strength when the carbon nitrogen compounds containing transition metals interact with LiPSs. Therefore, different unpaired electron filling states on the leading orbits of dz 2, dxz, and dyz can produce different spin state, changing the interaction with LiPSs. Here, based on the first principles, this work proposed to study the structural and electronic properties of DACs dimers of homonuclear and heteronuclear transition metals (TM-TM@g-C3N3, TM = Mn, Fe, Co, Ni) and their potential as sulfur-hosting materials for LSBs, using g-C3N3 as a carrier. The results show that the catalytic activity of heteronuclear diatomic dimer DACs on polysulfide is superior to that of homonuclear diatomic dimer DACs. Due to the synergistic effect between the high-spin state of the d electron of Mn2+ and the half-full state of the dz 2 orbital of Co2+, Co-Mn@g-C3N3, when used as the positive electrode material of LSBs, not only can the polysulfide have the lowest Gibbs free energy during the conversion process, The reaction energy barrier of Li2S2 to Li2S is the lowest (0.26 eV). Further study on the electronic structure shows that when 3d transition metal atoms act as heteronuclear diatomic catalysts, the coupling between metal ions with high-spin states and metal atoms with half-full d-electrons at the active site has the most significant catalytic effect on polysulfide. 2 Result 2.1 Structural and electronic structure of TM-TM@g-C3N3 Fig. 1 shows the stable configuration of TM-TM@g-C3N3, bader charge analysis (see Table S1 for specific data), and electron localization function (ELF). As shown in the figure, each TM atom is bound to two N atoms [15], and only Co-Co@g-C3N3, Fe-Mn@ g-C3N3 and Co-Ni@g-C3N3 are completely planar structures. TM atoms in other structures have protrprotrations to varying degrees, and the TM-N bond length decreases gradually with the increase of metal atomic number (Table S2). This is due to differences in the size of the TM ion, the available d electrons, and the nature of the bond [24]. The results of bader charge analysis showed a pattern of Fe-Mn > Mn-Mn > Fe-Co > Co-Mn > Co-Co > Co-Ni > Fe-Fe > Ni-Mn > Fe-Ni > Ni-Ni. In the homonuclear dimer DACs, the number of electrons transferred from Mn-Mn to g-C3N3 was the highest (1.25 |e|), while the number of electrons transferred from Ni-Ni to g-C3N3 was the lowest (0.86 |e|). In the heteronuclear dimer DACs, the maximum number of electrons transferred from Fe-Mn to g-C3N3 is 1.37 |e|, and Fe-Mn > Mn-Mn > Fe-Fe. It can be seen that Fe-Mn dimers can promote electron transfer between each other. The map of ELF shows that in the homonuclear dimer DACs, the electron cloud density between metal atoms decreases significantly with the increase of atomic number. In the heteronuclear dimer DACs, a similar phenomenon is also shown, that is, the larger the sum of the atomic numbers of the two metals, the smaller the electron cloud between the atoms. Moreover, in the heteronuclear dimer DACs with adjacent atomic numbers (such as Fe-Mn, Fe-Co, Co-Ni), the electron cloud is mainly concentrated in the center of the bimetallic atoms. In the non-adjacent heteronuclear dimer DACs (such as Co-Mn, Ni-Mn, Fe-Ni), the electron cloud is mainly biased to the side with the smaller atomic number, and the greater the atomic number distance, the more obvious this phenomenon is. The reason for the above phenomenon is that the number of d electrons of Mn2+, Fe2+, Co2+ and Ni2+ is 5, 6, 7 and 8, respectively. With the increase of the number of d electrons, the binding of the nucleus on the electrons is enhanced, and the degree of electron localization is stronger. Two metal atoms with the same or adjacent atomic numbers have similar electron binding abilities. Among them, the four d-orbitals of Ni2+ are full states, and the electron localization is the strongest, which is difficult to contribute electrons. Fig. 2 shows the projected density of state (PDOS) TM-TM@g-C3N3 and the Crystal Orbital Hamilton Populations (COHP), and Fig. S1 shows the detailed PDOS of d-orbitals of transition metal atoms. In homonuclear dimer DACs, the PDOS of N atomic shows obvious delocalization, and the density of transition metal d-orbital PDOS shows obvious localization, which is due to the weak electron localization of s-orbitals and p-orbitals, and the strong electron localization of 3d-orbitals. As can be seen from Fig. S1, the valence band tops of the d orbitals of TM in Fe-Fe@g-C3N3, Co-Co@g-C3N3 and Ni-Ni@g-C3N3 are contributed by the dxz/z 2, dxz/yz and dxy/yz/z 2 orbitals, which are double and triple degeneracies, respectively. The valence band top of the d orbital of Mn in Mn-Mn@g-C3N3 is contributed by five orbitals at the same time, and no obvious orbital splitting occurs. The density curve of N atomic states overlaps with the density curve of d-orbital states of metal atoms. The d-orbital of TM is obviously coupled with the p-orbital of N atom, which indicates that there is a solid bond cooperation between TM and N atom. Among them, the coupling effect between Ni and N atoms is the strongest, the coupling effect between Fe and Co atoms and N atoms is similar and weaker than Ni atoms, and the coupling effect between Mn and N atoms is the weakest. At the same time, the crystal orbital Hamiltonian shows that TM and N atoms bond at low energy levels, and the bond between the two TM atoms occurs near the Fermi level. This is because the d-orbital electrons of Mn2+ only have upper spin states, and according to the Hund rule [25] and Pauli exclusion principle [26], its d-orbitals are half full and in high-spin states. The d-orbital electrons of Fe2+, Co2+ and Ni2+ atoms have two spin states, spin up and spin down, and belong to the low spin state. Therefore, Fe2+, Co2+, Ni2+ and N atoms are more likely to form bonding orbitals, while Mn2+ are more likely to form antibonding orbitals. Compared with homonuclear dimer DACs, the peak density of metal atoms' d-orbital states in heteronuclear dimer DACs decreases, and the d-electron localization decreases. The -COHP peaks of TM-N bonds were increased, and the bond interaction was enhanced. Compared with the state densities of Fe-Fe and Co-Co, the peak of the d-orbital state density in Fe-Co@g-C3N3 disappears near the fermi level, and the peak value at the low energy level also decreases, but the peak width increases. Meanwhile, the bonding level of Fe-Co in -COHP is lower than that of Fe-Fe and Co-Co. The valence band tops of d-orbitals of Fe2+ in Fe-Co@g-C3N3, Fe-Ni@g-C3N3 and Fe-Mn@g-C3N3 are contributed by dz 2, dxz and dyz/z 2, respectively. The valence band tops of d-orbitals of Co2+ in Fe-Co@g-C3N3, Co-Ni@g-C3N3 and Co-Mn@g-C3N3 are contributed by dz 2, dz 2 and dxz, respectively. The d valence band tops of Ni atoms in Fe-Ni@g-C3N3, Co-Ni@g-C3N3 and Ni-Mn@g-C3N3 are all contributed by dxz/yz/z 2. -COHP shows that the electrons between metal atoms and pyridine nitrogen are all in bonding states and all occur between −8 and −6 eV. In both homonuclear dimer and heteronuclear dimer, there are coupling phenomena between the two atoms to different degrees. The orbital energy level of coupling between metal atoms in homonuclear dimer is higher, while the orbital energy level of coupling between metal atoms in heteronuclear dimer is lower, indicating that the DACs configuration of heteronuclear dimer is more conducive to the stability of the structure. For Fe2+, ICOHP coupled with heteronuclear atom is weakened. For Co2+, ICOHP is enhanced after coupling with Ni2+ and Mn2+, while ICOHP is weakened between Co2+ and Fe2+. The ICOHP of the Ni-Fe bond is stronger than that of the Ni-Ni bond and weaker than that of the Ni-Mn bond. In a word, the coupling between Co-Ni is the strongest (ICOHP = -2.64 eV). It can be seen that the degeneracy and splitting of d-orbitals change after the coupling between heteronuclear dimer. It is mainly show in the disappearance of double and triple degeneracy from homonuclear dimer DACs to heteronuclear dimer DACs. This will lead to the conversion of electrons from low-spin states to high-spin states, enhancing activity of electron. In addition, Mulliken population analuysis (Table S3) data show that after TM bonds with N atoms, the number of d electrons is greater than the theoretical number of d electrons of its 2-valent ions. This shows that TM and N atoms share electron and orbitals rather than just simple ionic bonds. In general, since ions with a larger number of charges have a smaller radius, the closer the ligand is to the central ion results in an increase in repulsion. Therefore, the more charge in the same period element, the greater the ligand-field splitting parameter. Therefore, the crystal field splitting energy of the four elements in this paper shows the law of Mn2+<Ni2+<Co2+<Fe2+. Because they are similar to tetragonal crystal fields, the ligand-field splitting parameter is less than pairing energy, so they are weak fields, electrons are in high spin configuration, g-C3N3 and metal atoms belong to outer orbital complexes, crystal field energy is high, and electronic activity is strong. The coordination environment for a transition metal atom anchored by two nitrogen atoms can be approximated to a C4v crystal field, with five d-orbitals splitting into four d states: dz 2, dxy, dxz/yz (double degenerate), and dx 2 -y 2. The dz 2 orbitals are hybridized with the pz orbitals of S to form σ and σ* bonds with strong splitting energy. The double degeneracies dxz/yz hybridizes with the px/y orbitals to form relatively weak π and π* bonds. The dxy and dx 2 -y 2 orbitals are not active compared to the other d-states and are considered non-bonding orbitals [4]. 2.2 Adsorption structure and adsorption energy In LSBs, the orthorhombic α-S8 at room temperature is chosen as the model of crystalline sulfur, which is a crown-like ring structure. In the discharging progress, (Li2S8, Li2S6, and Li2S4) and short-chain insoluble LiPSs (Li2S2 and Li2S) will be formed upon the incorporation of additional Li atoms. It is found that the Li-S bond lengths of long-chain soluble LiPSs are longer than short-chain insoluble LiPSs. These results are well consistent with the previous investigations 错误!未定义书签。. Fig. 3 shows the different adsorption structure of LiPSs on the surface of TM-TM@g-C3N3. As shown in Fig. 3, all S atoms form chemical bonds with transition metal atoms, indicating that transition metal atoms play a crucial role in the anchoring process of S8 molecules. S8 molecule still maintains a closed ring structure on the surfaces of Co-Co@g-C3N3, Fe-Co@g-C3N3 and Co-Ni@g-C3N3. On the surface of Fe-Fe@g-C3N3, Ni-Ni@g-C3N3, Mn-Mn@g-C3N3, Fe-Ni@ g-C3N3, Fe-Mn@g-C3N3, Co-Mn@g-C3N3 and Ni-Mn@g-C3N3, S-S bond breakage occurs. This is due to the strong TM-S bond between DACs and LiPSs weakening the S-S bond in the sulfur chain [1]. When the S8 molecule reacts with the lithium atom to form Li2S8, the chemical bond between the S atom and the transition metal remains. Compared with S8, the molecular breakage of Li2S8 on Fe-Fe@g-C3N3, Mn-Mn@g-C3N3, Fe-Co@g-C3N3, Fe-Ni@g-C3N3, Fe-Mn@g-C3N3, Co-Mn@g-C3N3 and Ni-Mn@g-C3N3 are more serious. Li atom forms Li-bond with pyridine nitrogen in Li2S8 on Co-Co@g-C3N3, Ni-Ni@g-C3N3, Fe-Co@g-C3N3, Co-Ni@g-C3N3 and Co-Mn@g-C3N3 [27]. With the progress of discharge, the adsorption structure of Li2S6, Li2S4, Li2S2 and Li2S that gradually transformed from Li2S8 are similar on each substrate, and TM-S and Li-bond are still present. In each structure, LiPSs forms end-group or bridge adsorption with transition metal atoms. These two adsorption configurations are most conducive to the REDOX reaction between LiPSs. This adsorption mechanism can promote the occurrence of REDOX, but the breaking of S-S bonds in LiPSs molecules is also attributed to this adsorption mechanism. The π electron orbitals in LiPSs are laterally coordinated with the dx 2 -y 2 orbitals of the transition metal atoms, while the filled dxz or dyz electrons feed back into the π* orbitals of LiPSs. The adsorption energy E a between the sulfur-containing clusters and the TM-TM@g-C3N3 is further examined according to the following equation [13]: E a = E tot - E PS - E TM - T M @ g - C 3 N 3 where E tot , E PS , and E TM - T M @ g - C 3 N 3 represent the energy of the adsorbed systems, the isolated sulfur-containing clusters, and the TM-TM@g-C3N3 systems, respectively. Fig. 4 shows the adsorption energy column diagram, where Fig. 4a is the adsorption energy of homonuclear dimer DACs for S8 and LiPSs, and Fig. 4b is the adsorption energy of heteronuclear dimer DACs for S8 and LiPSs. Among the homonuclear dimer DACs, Mn-Mn@g-C3N3 exhibits the highest adsorption energy for polysulfides. The adsorption energy of S8 shows the regularity of Mn-Mn@g-C3N3 < Fe-Fe@g-C3N3 < Ni-Ni@g-C3N3 < Co-Co@g-C3N3. The adsorption energies of Mn-Mn@g-C3N3 and Fe-Fe@g-C3N3 for Li2S8, Li2S6 and Li2S4 still show strong anchoring effects, while the adsorption energies of Ni-Ni@g-C3N3 and Co-Co@g-C3N3 are weak relatively. For the adsorption of short chain polar molecules Li2S2 and Li2S, Mn-Mn@g-C3N3 has the largest adsorption energy, while Fe-Fe@g-C3N3, Co-Co@g-C3N3 and Ni-Ni@g-C3N3 are small relatively and have little difference. In the adsorption structure of polysulfide on the surface of heteronuclear dimer DACs (Fig. 4b), the most prominent adsorption energies are Ni-Mn@g-C3N3, Co-Mn@g-C3N3 and Fe-Mn@g-C3N3. However, compared with homonuclear dimer DACs, the adsorption energy of heteronuclear dimer DACs is weakened in different degrees. This phenomenon fully shows that the coupling between the two atoms in the heteronuclear dimer does change the arrangement and spin state of d electrons to some extent, thus affecting the interaction between TM-TM@g-C3N3 and LiPSs. For the adsorption of S8 molecules, the adsorption energies of Fe-Co@g-C3N3 and Co-Ni@g-C3N3 are small, so it can be seen that the breaking of S-S bond in S8 molecule is closely related to the strong interaction [27]. In general, the adsorption strength of TM-TM@g-C3N3 with sulfur-hosting clusters is much higher than that of the intrinsic C2N, C3N, C3N3, graphene, and N-doped graphene [28–31], implying that the coexistence of Lewis acid TM sites and Lewis base N atoms in TM-TM@g-C3N3 could enhance the adsorption. And they still remains negative and less than that of the electrolyte solvents (DME and DOL) (-0.77 to −0.87 eV) [15], indicating that LiPSs are more easily adsorbed on the surface of the TM-TM@g-C3N3 systems rather than dissolved in the solvent. 2.3 The electron structure of the adsorption configuration The charge density difference Δ ρ before and after the adsorption of the LiPSs cluster on the TM-TM@g-C3N3 systems is also studied, which is defined as the following equation [13]: Δ ρ = ρ total - ρ LiPSs - ρ TM - T M @ g - C 3 N 3 where ρ total , ρ TM - T M @ g - C 3 N 3 and ρ LiPSs are the charge density of the adsorbed systems with LiPSs, the TM-TM@g-C3N3 systems, and the LiPSs cluster, respectively. The calculated results of charge density difference are shown in Fig. 5 . Electron transfer occurs not only inside the LiPSs, but also between LiPSs and DACs. The blue electron cloud is mainly concentrated near the S and transition metal atoms, and the yellow electron cloud is mainly concentrated between the Li-N bonds and the TM-S bonds. This shows that Li-N bond and TM-S bond play a leading role in adsorption behavior. The Li-N bond is formed by the Li atom providing electrons and the N atom providing electron orbitals. Between the TM atom and the S atom, the electrons of the TM atom are transferred to the TM-S bond, while the S atom gains a few electrons, which is a typical characteristic of ionic bonding. To investigate the underlying interaction mechanism between sulfur-hosting and dimer DACs, taking Li2S as an example we further explore the atomic structure evolution of Li2S and its electronic properties [15]. Fig. 6 shows the PDOS of p-orbitals of S atom and d-orbitals of metal atom. The p-orbital density of S atom shows obvious delocalization characteristics, and the d-orbital density of TM atom increases relative to the delocalization state before polysulfide adsorption. In the structure of Fe-Fe@g-C3N4, Co-Co@g-C3N4, Ni-Ni@g-C3N4, Mn-Mn@g-C3N4, Fe-Co@g-C3N4 and Co-Ni@g-C3N4, the d electrons are all bonded, and have different degrees of coupling with the p orbitals of S atoms. The d-orbital of Ni2+ in Fe-Ni, d-orbital of Fe2+ in Fe-Mn@g-C3N4, d-orbital of Co2+ in Co-Mn@g-C3N4, and d-orbital of Mn2+ in Ni-Mn@g-C3N4 have anti-bonding states, but they show the strongest adsorption on polysulfide. In the PDOS of Ni-Mn@g-C3N4, the p-orbitals of N overlaps with d-orbitals of Mn in the range of −6 ∼ -4 eV, indicating that the bonding between S atom and Ni2+ and Mn2+ is strong, which is also the reason for its maximum adsorption capacity for polysulfide. This can be attributed to the fact that the d-orbitals of Mn2+ are initially half full, with only the upper spin d electron, and the dz 2 of Co2+ has only one electron, which is relatively active. When the two hybride with the p-orbital of S atom, the d electron of the high energy orbital is transformed into a low spin state, and the dx 2 -y 2 becomes an empty orbital, and the electronic structure is more stable. The d-orbitals of Ni2+ are full states and can provide electrons to the d-orbitals of metal atoms which coupled with Ni2+. In Fe2+, dx 2 -y 2 is the empty orbital, and in Co2+, dxy is the semi-filled state. Therefore, Mn2+, Ni2+, Fe2+ and Co2+ can adjust each other's d-state electronic structure through the d-d transition between adjacent metal atoms when the coupling occurs. We have further calculated the d-band center, the calculation formula of the d-band center is as follows: ε d = ∫ - ∞ ∞ n d ( ε ) ε d ε ∫ - ∞ ∞ n d ( ε ) d ε The results show that the coupling of heteronuclear diatoms also has a significant regulatory effect on d-band center. For detailed data, see Table S4 in the supporting information. In Fe-Fe@g-C3N4 (-4.095 eV), Fe-Ni@g-C3N4 (-1.719 eV), Fe-Co@g-C3N4 (-1.524 eV) and Fe-Mn@g-C3N4 (-1.229 eV), the d-band center increased significantly successively. The reason why the adsorption energy of Fe-Mn@g-C3N4 to polysulfide is significantly lower than that of Mn-Mn@g-C3N4 is that the coupling between Fe2+ and Mn2+ makes the isolated d electron of Fe2+ transition to the d-orbital of Mn2+, resulting in the increase of the empty orbital of Fe2+. 2.4 Gibbs free energy For the Gibbs free energy calculations, the equations for the reduction of S8 to Li2S process can be presented as follows: S8*+16Li++2e- →Li2S8*+14Li+ Li2S8*+14Li++2e- →Li2S6*+Li2S2 + 12Li+ Li2S6*+ Li2S2 + 12Li++2e- →Li2S4*+2Li2S2 + 10Li+ Li2S4*+2Li2S2 + 10Li++2e- →Li2S2*+3Li2S2 + 8Li+ Li2S2*+3Li2S2 + 8Li++2e- →Li2S*+7Li2S where the star “*” represents the state of being absorbed on TM-TM@g-C3N3, the energy of (Li++e- ) is considered to be equal to the energy of one Li atom in the Li bulk metal. The Gibbs free energy of S8 and Li2Sn is defined as: G = H - T S = E DFT + Z P E + E H - T ∗ S where H, T, S, EDFT , ZPE and EH are the enthalpy, temperature, entropy, total energy after atomic relaxation by DFT, zero-point energy and enthalpy contribution in the Li2Sn systems, respectively. In the solvent phase, the enthalpy will be different from the gas phase, so it needs to be further discussed. S = S vib + S trans + S rot S vib T = R ∑ i hvi kT e - h v i kT 1 - e - h v i kT - ln 1 - e - h v i kT For the entropy calculation, the entropy is defined as above, where Svib , Strans and Srot are vibrational, translational and rotational entropies, respectively, and R is the universal gas constant, k stands for the Boltzmann constant, h is Plank’s constant, vi represents the frequency of the normal mode. Given that the chemical bonds between the substrate adsorbed Li2Sn and S8 molecules restrict the translational and rotational degrees of freedom of the adsorbed molecules, the contributions of translational and rotational degrees to entropy and enthalpy will be reduced, so here we ignore the actual contribution of the surface translation and rotation [32]. The Gibbs free energy changes (ΔG) of each reaction on TM-TM@g-C3N3 have been calculated according to the above equations [33,34]. This section focuses on the analysis of the reaction free energy of polysulfides in heteronuclear dimer DACs. As shown in the Fig. 7 (a). The process from S8 to Li2S is exothermic on the surface of all six structures and can be spontaneous. A certain energy barrier needs to be overcome on other surfaces. Fortunately, only 0.03 eV reaction energy barrier needs to be overcome on Co-Ni@g-C3N3 surface, while larger reaction potential barrier needs to be overcome on the other three surfaces. The liquid-phase reaction Li2S6 to Li2S4 is flat, with the lowest Gibbs free energy of −0.10 eV (Fe-Co@g-C3N3). The solid–liquid conversion process from Li2S4 to Li2S2 is the rate-limiting step in the charge–discharge process, which is also the main reason for the decrease of the utilization rate of active substances and the formation of dead sulfur [17,35]. It occurs spontaneously on Co-Ni@g-C3N3 and Fe-Co@g-C3N3 with Gibbs free energies of −0.12 eV and −0.05 eV, respectively. Other surfaces are endothermic reactions. The solid state reaction of Li2S2 to Li2S is endothermic on all substrates, among which the lowest Gibbs free energy is Co-Mn@g-C3N3, which is only 0.26 eV. To sum up, as shown in Fig. 7(b), at the diatomic site, such as Co-Mn@g-C3N3, Fe-Co@g-C3N3, and Co-Ni@g-C3N3, the high energy d-orbital of one transition metal ion (e.g. TM2) has a single d electron. And adjacent transition metal ions (such as TM1) have empty d orbitals or half-full d orbitals. When the two are coupled, the single electron in TM2 will transition to the empty d-orbital or the half-full d-orbital in TM1, which makes the catalyst have higher activity. 3 Conclusion In summary, the performance of a series of TM (TM = Mn, Fe, Co, and Ni) dimers embedded in monolayer g-C3N3 for the LiPSs anchored and catalytic conversion as polar hosts for cathodes is systematically investigated by DFT calculation. The results reveal that the monolayer g-C3N3 serves as a substrate to stabilize TM atoms, while the TM dimers dictate the metallic electronic structure. Due to the presence of TM-S bonds, all DACs have excellent anchoring effects on LiPSs. The electron regulation between the two metallic atoms in the heteronuclear dimer results in the superiority of the heteronuclear dimer DACs in catalysis. Among them, Co-Mn@g-C3N3 has the best catalytic effect for the REDOX reaction of LiPSs. Moreover, due to the d-orbital coupling of the bimetallic atoms in Co-Mn@g-C3N3, Fe-Co@g-C3N3 and Co-Ni@g-C3N3, the single electron on the dz 2 orbital of Co2+ can transition between the two atoms, so that its catalytic effect is obviously better than that of other dimer DACs. Therefore, when 3d transition metal atoms act as heteronuclear diatomic catalysts, the coupling between metal ions with high spin states at the active site and metal atoms with empty orbitals or half-full d-electrons has the most significant catalytic effect on LiPSs. In addition, the hybridization of the p-orbital of S in LiPSs with the d-orbital of the transition metal to form TM-S bond can promote the REDOX reaction of LiPSs, so the heteronuclear diatomic system has more possibilities and controllability when catalyzed by LiPSs. This work offers theoretical guidance for the synthesis of metal catalysts and greatly reduces the workload of selecting TM atoms, which provides opportunities for the DACs catalytic materials in the development of LSBs. 3.1 Calculation method Spin-polarized density functional theory (DFT) calculations are carried out as implemented in the Vienna Ab initio Simulation Package (VASP) [36]. The Perdew-Burke-Ernzerhof (PBE) exchange–correlation functional within the generalized gradient approximation (GGA) [37,38] is used for our calculations. Projected augmented wave (PAW) method [39,40] is employed using an energy cut-off of 450 eV to describe the electronic wave functions. We have adopted GGA + U method to properly describe the strongly correlated electrons in the partially filled d-orbitals [41]. All the calculations are carried our using GGA + U method [42]. Here, the delocalized s and p electrons are defined by the GGA method and the localized d electrons are described by the Coulomb and exchange corrections. This method improves both the excited-state (e.g. energy gaps) and the ground-state properties (e.g. magnetic moments and interatomic exchange parameters). We have used correlation energy (U) of 4 eV and exchange energy (J) of 1 eV for TM 3d-orbitals. These U and J values have been well tested experimentally as well as theoretically in similar systems [43–45]. We have taken a vacuum of 30 Å along the z-axis to avoid any interaction between the two adjacent layers. A Monkhorst-pack [46] generated set of 3 × 3 × 1 K-point is used to get the minimum energy structure. The convergence criteria for energy and force are set at 10-5 eV and 10-2 eV/Å, respectively. Bader charge analysis is performed [47–49] with the help of the Henkelman programme [50] using near-grid algorithm refine-edge method to understand the charge transfer process between the atoms. To analyze the electronic structure, Crystal Occupation Hamilton Population (COHP) analysis was performed on LOBSTER software [51–53]. CRediT authorship contribution statement Wei Dong: . Xuanyi Zhu: Data curation, Conceptualization. Mingyuan Zhao: Resources. Qiming Chang: Resources. Hao Gu: Validation. Fang Yang: Validation. Ding Shen: Visualization. Shuwei Tang: Software. Xiaodong Hong: Resources. Xu Zhang: Resources. Shuang Wei: Resources. Ziwen Dong: Resources. Shaobin Yang: Visualization. Declaration of competing interest The authors declare that they have no known competing financial interests or personal relationships that could have appeared to influence the work reported in this paper. Acknowledgements The authors acknowledge funding support from the National Natural Science Foundation of China (52174253, 21808095) and General Scientific Research Projects of Liaoning Province Education Department (LJKZ0339), Liaoning Province Applied Basic Research Program Project (2023JH2, 101300213), and Guangdong Basic and Applied Basic Research Foundation (2022A1515140159), Basic Scientific Research Project of Colleges and Universities in Liaoning Province (JYTQN2023209). Appendix A Supplementary material Supplementary data to this article can be found online at https://doi.org/10.1016/j.jcat.2024.115449. Appendix A Supplementary material The following are the Supplementary data to this article: Supplementary data 1 References [1] B. Zhang J. Wu J. Gu The fundamental understanding of lithium polysulfides in ether-based electrolyte for lithium-sulfur batteries[J] ACS Energy Lett. 6 2 2021 537 546 Zhang B, Wu J, Gu J, et al. The fundamental understanding of lithium polysulfides in ether-based electrolyte for lithium-sulfur batteries[J]. ACS Energy Letters, 2021, 6(2): 537-546. [2] W.G. Lim S. Kim C. Jo A comprehensive review of materials with catalytic effects in li-S batteries: enhanced redox kinetics[J] Angew. Chem. Int. Ed. 58 52 2019 18746 18757 Lim W G, Kim S, Jo C, et al. A comprehensive review of materials with catalytic effects in Li-S batteries: enhanced redox kinetics[J]. Angewandte Chemie International Edition, 2019, 58(52): 18746-18757. [3] Q. Pang X. Liang C.Y. Kwok L.F. Nazar Advances in lithium-sulfur batteries based on multifunctional cathodes and electrolytes Nat. Energy 1 2016 16132 Q. Pang, X. Liang, C.Y. Kwok, L.F. Nazar, Advances in lithium-sulfur batteries based on multifunctional cathodes and electrolytes, Nat. Energy 1 (2016) 16132. [4] Y.X. Yin S. Xin Y.G. Guo Lithium-sulfur batteries: electrochemistry, materials, and prospects[J] Angew. Chem. Int. Ed. 52 50 2013 13186 13200 Yin Y X, Xin S, Guo Y G, et al. Lithium-sulfur batteries: electrochemistry, materials, and prospects[J]. Angewandte Chemie International Edition, 2013, 52(50): 13186-13200. [5] X. Hong R. Wang Y. Liu Recent advances in chemical adsorption and catalytic conversion materials for li-S batteries[J] J. Energy Chem. 42 2020 144 168 Hong X, Wang R, Liu Y, et al. Recent advances in chemical adsorption and catalytic conversion materials for Li-S batteries[J]. Journal of Energy Chemistry, 2020, 42: 144-168. [6] Z. Liang J. Shen X. Xu Advances in the development of single-atom catalysts for high-energy-density lithium-sulfur batteries[J] Adv. Mater. 34 30 2022 2200102 Liang Z, Shen J, Xu X, et al. Advances in the Development of Single‐Atom Catalysts for High‐Energy‐Density Lithium–Sulfur Batteries[J]. Advanced Materials, 2022, 34(30): 2200102. [7] B. Long Y. Tang J. Li New mechanistic pathways for CO oxidation catalyzed by single-atom catalysts: supported and doped Au1/ThO2[J] Nano Res. 9 2016 3868 3880 Long B, Tang Y, Li J. New mechanistic pathways for CO oxidation catalyzed by single-atom catalysts: Supported and doped Au1/ThO2[J]. Nano Research, 2016, 9: 3868-3880. [8] K. Ding, A. Gulec, A.M. Johnson, et al. Identification of active sites in CO oxidation and water-gas shift over supported Pt catalysts. Science 350, 189-192. [9] Y. Pan C. Zhang Z. Liu Structural regulation with atomic-level precision: from single-atomic site to diatomic and atomic interface catalysis[J] Matter 2 1 2020 78 110 Pan Y, Zhang C, Liu Z, et al. Structural regulation with atomic-level precision: From single-atomic site to diatomic and atomic interface catalysis[J]. Matter, 2020, 2(1): 78-110. [10] Z.W. Chen L.X. Chen C.C. Yang Atomic (single, double, and triple atoms) catalysis: frontiers, opportunities, and challenges[J] J. Mater. Chem. A 7 8 2019 3492 3515 Chen Z W, Chen L X, Yang C C, et al. Atomic (single, double, and triple atoms) catalysis: frontiers, opportunities, and challenges[J]. Journal of Materials Chemistry A, 2019, 7(8): 3492-3515. [11] Z.W. Chen Z. Wen Q. Jiang Rational design of Ag38 cluster supported by graphdiyne for catalytic CO oxidation[J] J. Phys. Chem. C 121 6 2017 3463 3468 Chen Z W, Wen Z, Jiang Q. Rational design of Ag38 cluster supported by graphdiyne for catalytic CO oxidation[J]. The Journal of Physical Chemistry C, 2017, 121(6): 3463-3468. [12] X. Sun Y. Qiu B. Jiang Isolated fe-co heteronuclear diatomic sites as efficient bifunctional catalysts for high-performance lithium-sulfur batteries[J] Nat. Commun. 14 1 2023 291 Sun X, Qiu Y, Jiang B, et al. Isolated Fe-Co heteronuclear diatomic sites as efficient bifunctional catalysts for high-performance lithium-sulfur batteries[J]. Nature Communications, 2023, 14(1): 291. [13] Y. Pan Y. Zhu Y. Li Homonuclear transition-metal dimers embedded monolayer C2N as promising anchoring and electrocatalytic materials for lithium-sulfur battery: first-principles calculations[J] Appl. Surf. Sci. 610 2023 155507 Pan Y, Zhu Y, Li Y, et al. Homonuclear transition-metal dimers embedded monolayer C2N as promising anchoring and electrocatalytic materials for lithium-sulfur battery: First-principles calculations[J]. Applied Surface Science, 2023, 610: 155507. [14] M. Xiao H. Zhang Y. Chen Identification of binuclear Co2N5 active sites for oxygen reduction reaction with more than one magnitude higher activity than single atom CoN4 site[J] Nano Energy 46 2018 396 403 Xiao M, Zhang H, Chen Y, et al. Identification of binuclear Co2N5 active sites for oxygen reduction reaction with more than one magnitude higher activity than single atom CoN4 site[J]. Nano energy, 2018, 46: 396-403. [15] Z. Han S. Zhao J. Xiao Engineering d-p orbital hybridization in single-atom metal-embedded three-dimensional electrodes for li-S batteries[J] Adv. Mater. 33 44 2021 2105947 Han Z, Zhao S, Xiao J, et al. Engineering d‐p orbital hybridization in single‐atom metal‐embedded three‐dimensional electrodes for Li-S batteries[J]. Advanced Materials, 2021, 33(44): 2105947. [16] H. Xu D. Cheng D. Cao A universal principle for a rational design of single-atom electrocatalysts[J] Nat. Catal. 1 5 2018 339 348 Xu H, Cheng D, Cao D, et al. A universal principle for a rational design of single-atom electrocatalysts[J]. Nature Catalysis, 2018, 1(5): 339-348. [17] X. Cui Y. Li S. Bachmann Synthesis and characterization of iron-nitrogen-doped graphene/core-shell catalysts: efficient oxidative dehydrogenation of N-heterocycles[J] J. Am. Chem. Soc. 137 33 2015 10652 10658 Cui X, Li Y, Bachmann S, et al. Synthesis and characterization of iron-nitrogen-doped graphene/core-shell catalysts: efficient oxidative dehydrogenation of N-heterocycles[J]. Journal of the American Chemical Society, 2015, 137(33): 10652-10658. [18] J. Linder J.W.A. Robinson Superconducting spintronics[J] Nat. Phys. 11 4 2015 307 315 Linder J, Robinson J W A. Superconducting spintronics[J]. Nature Physics, 2015, 11(4): 307-315. [19] M. Misiorny M. Hell M.R. Wegewijs Spintronic magnetic anisotropy[J] Nat. Phys. 9 12 2013 801 805 Misiorny M, Hell M, Wegewijs M R. Spintronic magnetic anisotropy[J]. Nature Physics, 2013, 9(12): 801-805. [20] M.U. Farooq A. Hashmi J. Hong Thickness dependent optical properties of multilayer BN/graphene/BN[J] Surf. Sci. 634 2015 25 30 Farooq M U, Hashmi A, Hong J. Thickness dependent optical properties of multilayer BN/graphene/BN[J]. Surface Science, 2015, 634: 25-30. [21] D. Gao Q. Xu J. Zhang Defect-related ferromagnetism in ultrathin metal-free g-C3N4 nanosheets[J] Nanoscale 6 5 2014 2577 2581 Gao D, Xu Q, Zhang J, et al. Defect-related ferromagnetism in ultrathin metal-free g-C3N4 nanosheets[J]. Nanoscale, 2014, 6(5): 2577-2581. [22] J. Li C. Cao J. Hao Self-assembled one-dimensional carbon nitride architectures[J] Diam. Relat. Mater. 15 10 2006 1593 1600 Li J, Cao C, Hao J, et al. Self-assembled one-dimensional carbon nitride architectures[J]. Diamond and related materials, 2006, 15(10): 1593-1600. [23] P. Kuhn M. Antonietti A. Thomas Porous, covalent triazine-based frameworks prepared by ionothermal synthesis[J] Angew. Chem. Int. Ed. 47 18 2008 3450 3453 Kuhn P, Antonietti M, Thomas A. Porous, covalent triazine‐based frameworks prepared by ionothermal synthesis[J]. Angewandte Chemie International Edition, 2008, 47(18): 3450-3453. [24] I. Muhammad U. Younis H. Xie Y. Kawazoe Graphdiyne-based monolayers as promising anchoring materials for lithium-sulfur batteries: a theoretical study Adv. Theory 3 2020 I. Muhammad, U. Younis, H. Xie, Y. Kawazoe, et al. Graphdiyne-based monolayers as promising anchoring materials for lithium-sulfur batteries: a theoretical study, Adv. Theory 3 (2020). [25] J. Katriel R. Pauncz Theoretical interpretation of hund's rule[M]//Advances in quantum chemistry Academic Press 10 1977 143 185 Katriel J, Pauncz R. Theoretical interpretation of Hund's rule[M]//Advances in quantum chemistry. Academic Press, 1977, 10: 143-185. [26] I.G. Kaplan The pauli exclusion principle and the problems of its experimental verification[J] Symmetry 12 2 2020 320 Kaplan I G. The Pauli exclusion principle and the problems of its experimental verification[J]. Symmetry, 2020, 12(2): 320. [27] W. Dong X. Zhu D. Shen Uncovering the lithium-embedded behavior and catalytic mechanism of g-C3N4 as a sulfur host of lithium-sulfur batteries in the initial discharge reaction[J] Diam. Relat. Mater. 110534 2023 Dong W, Zhu X, Shen D, et al. Uncovering the lithium-embedded behavior and catalytic mechanism of g-C3N4 as a sulfur host of lithium-sulfur batteries in the initial discharge reaction[J]. Diamond and Related Materials, 2023: 110534. [28] Y. Zheng H. Li H. Yuan Understanding the anchoring effect of graphene, BN, C2N and C3N4 monolayers for lithium-polysulfides in li-S batteries Appl. Surf. Sci. 434 2018 596 603 Y. Zheng, H. Li, H. Yuan, et al. Understanding the anchoring effect of Graphene, BN, C2N and C3N4 monolayers for lithium-polysulfides in Li-S batteries, Appl. Surf. Sci. 434 (2018) 596-603. [29] L.C. Yin J. Liang G.M. Zhou Understanding the interactions between lithium polysulfides and N-doped graphene using density functional theory calculations Nano Energy 25 2016 203 210 L.C. Yin, J. Liang, G.M. Zhou, et al. Understanding the interactions between lithium polysulfides and N-doped graphene using density functional theory calculations, Nano Energy 25 (2016) 203-210. [30] D. Rao Y. Wang L. Zhang Mechanism of polysulfide immobilization on defective graphene sheets with N-substitution Carbon 110 2016 207 214 D. Rao, Y. Wang, L. Zhang, et al. Mechanism of polysulfide immobilization on defective graphene sheets with N-substitution, Carbon 110 (2016) 207-214. [31] Y. Peng Y. Zhang J. Huang Nitrogen and oxygen dual-doped hollow carbon nanospheres derived from catechol/polyamine as sulfur hosts for advanced lithium sulfur batteries Carbon 124 2017 23 33 Y. Peng, Y. Zhang, J. Huang, et al. Nitrogen and oxygen dual-doped hollow carbon nanospheres derived from catechol/polyamine as sulfur hosts for advanced lithium sulfur batteries, Carbon 124 (2017) 23-33. [32] J. Wu L.-W. Wang 2D framework C2N as a potential cathode for lithium–sulfur batteries: anab initiodensity functional study J. Mater. Chem. A 6 2018 2984 2994 J. Wu, L.-W. Wang, 2D framework C2N as a potential cathode for lithium–sulfur batteries: anab initiodensity functional study, J. Mater. Chem. A6 (2018) 2984-2994. [33] X. Zhang A. Chen Z. Zhang Transition metal anchored C2N monolayers as efficient bifunctional electrocatalysts for hydrogen and oxygen evolution reactions J. Mater. Chem. A 6 2018 11446 11452 X. Zhang, A. Chen, Z. Zhang, et al. Transition metal anchored C2N monolayers as efficient bifunctional electrocatalysts for hydrogen and oxygen evolution reactions, J. Mater. Chem. A6 (2018) 11446-11452. [34] Q. He B. Yu H. Wang Oxygen defects boost polysulfides immobilization and catalytic conversion: first-principles computational characterization and experimental design Nano Res. 13 2020 2299 2307 Q. He, B. Yu, H. Wang, et al. Oxygen defects boost polysulfides immobilization and catalytic conversion: first-principles computational characterization and experimental design, Nano Res. 13 (2020) 2299-2307. [35] Y. Zhang S. Lu K. Ugochukwu Transition Metal−N/Graphene for advanced lithium-sulfur batteries: a first principles study[J] Chem. Phys. Lett. 808 2022 140118 Zhang Y, Lu S, Ugochukwu K, et al. Transition Metal−N/Graphene for advanced Lithium-Sulfur Batteries: A first principles study[J]. Chemical Physics Letters, 808 (2022) 140118. [36] G. Kresse D. Joubert From ultrasoft pseudopotentials to the projector augmented-wave method[J] Phys. Rev. B 59 3 1999 1758 Kresse G, Joubert D. From ultrasoft pseudopotentials to the projector augmented-wave method[J]. Physical review b, 59 (3) (1999) 1758. [37] J.P. Perdew K. Burke M. Ernzerhof Generalized gradient approximation made simple[J] Phys. Rev. Lett. 77 18 1996 3865 Perdew J P, Burke K, Ernzerhof M. Generalized gradient approximation made simple[J]. Physical review letters, 77 (18) (1996) 3865. [38] J.P. Perdew J.A. Chevary S.H. Vosko Atoms, molecules, solids, and surfaces: applications of the generalized gradient approximation for exchange and correlation[J] Phys. Rev. B 46 11 1992 6671 Perdew J P, Chevary J A, Vosko S H, et al. Atoms, molecules, solids, and surfaces: Applications of the generalized gradient approximation for exchange and correlation[J]. Physical review B, 46 (11) (1992) 6671. [39] V.I. Anisimov F. Aryasetiawan A.I. Lichtenstein First-principles calculations of the electronic structure and spectra of strongly correlated systems: the LDA+ U method[J] J. Phys. Condens. Matter 9 4 1997 767 Anisimov V I, Aryasetiawan F, Lichtenstein A I. First-principles calculations of the electronic structure and spectra of strongly correlated systems: the LDA+ U method[J]. Journal of Physics: Condensed Matter, 9 (4) (1997) 767. [40] P.E. Blöchl Projector augmented-wave method[J] Phys. Rev. B 50 24 1994 17953 Blöchl P E. Projector augmented-wave method[J]. Physical review B, 50 (24) (1994) 17953. [41] J. Zhou Q. Sun Magnetism of phthalocyanine-based organometallic single porous sheet[J] J. Am. Chem. Soc. 133 38 2011 15113 15119 Zhou J, Sun Q. Magnetism of phthalocyanine-based organometallic single porous sheet[J]. Journal of the American Chemical Society, 2011, 133(38): 15113-15119. [42] J. Okabayashi A. Kimura O. Rader Core-level photoemission study of Ga1-xMnxAs[J] Phys. Rev. B 58 8 1998 R4211 Okabayashi J, Kimura A, Rader O, et al. Core-level photoemission study of Ga1-xMnxAs[J]. Physical Review B, 58 (8) (1998) R4211. [43] P.M. Panchmatia B. Sanyal P.M. Oppeneer GGA+ U modeling of structural, electronic, and magnetic properties of iron porphyrin-type molecules[J] Chem. Phys. 343 1 2008 47 60 Panchmatia P M, Sanyal B, Oppeneer P M. GGA+ U modeling of structural, electronic, and magnetic properties of iron porphyrin-type molecules[J]. Chemical Physics, 343 (1) (2008) 47-60. [44] M. Bernien J. Miguel C. Weis Tailoring the nature of magnetic coupling of fe-porphyrin molecules to ferromagnetic substrates[J] Phys. Rev. Lett. 102 4 2009 047202 Bernien M, Miguel J, Weis C, et al. Tailoring the nature of magnetic coupling of Fe-porphyrin molecules to ferromagnetic substrates[J]. Physical review letters, 102 (4) (2009) 047202. [45] A.B. Shick J. Kudrnovský V. Drchal Coulomb correlation effects on the electronic structure of III-V diluted magnetic semiconductors[J] Phys. Rev. B 69 12 2004 125207 Shick A B, Kudrnovský J, Drchal V. Coulomb correlation effects on the electronic structure of III-V diluted magnetic semiconductors[J]. Physical Review B, 69 (12) (2004) 125207. [46] H.J. Monkhorst J.D. Pack Special points for brillouin-zone integrations[J] Phys. Rev. B 13 12 1976 5188 Monkhorst H J, Pack J D. Special points for Brillouin-zone integrations[J]. Physical review B, 13 (12) (1976) 5188. [47] R.F.W. Bader A quantum theory of molecular structure and its applications[J] Chem. Rev. 91 5 1991 893 928 Bader R F W. A quantum theory of molecular structure and its applications[J]. Chemical Reviews, 91 (5) (1991) 893-928. [48] G. Henkelman A. Arnaldsson Jónsson H[J] Comput. Mater. Sci 36 3 2006 354 360 Henkelman G. Arnaldsson A. Jónsson H[J]. Comput. Mater. Sci, 36 (3) (2006) 354-360. [49] E. Sanville S.D. Kenny R. Smith Improved grid-based algorithm for bader charge allocation[J] J. Comput. Chem. 28 5 2007 899 908 Sanville E, Kenny S D, Smith R, et al. Improved grid‐based algorithm for Bader charge allocation[J]. Journal of computational chemistry, 28 (5) (2007) 899-908. [50] W. Tang E. Sanville G. Henkelman A grid-based bader analysis algorithm without lattice bias[J] J. Phys. Condens. Matter 21 8 2009 084204 Tang W, Sanville E, Henkelman G. A grid-based Bader analysis algorithm without lattice bias[J]. Journal of Physics: Condensed Matter, 21 (8) (2009) 084204. [51] R. Dronskowski P.E. Blöchl Crystal orbital Hamilton populations (COHP): energy-resolved visualization of chemical bonding in solids based on density-functional calculations[J] J. Phys. Chem. 97 33 1993 8617 8624 Dronskowski R, Blöchl P E. Crystal orbital Hamilton populations (COHP): energy-resolved visualization of chemical bonding in solids based on density-functional calculations[J]. The Journal of Physical Chemistry, 97 (33) (1993) 8617-8624. [52] V.L. Deringer A.L. Tchougréeff R. Dronskowski Crystal orbital Hamilton population (COHP) analysis as projected from plane-wave basis sets[J] Chem. A Eur. J. 115 21 2011 5461 5466 Deringer V L, Tchougréeff A L, Dronskowski R. Crystal orbital Hamilton population (COHP) analysis as projected from plane-wave basis sets[J]. The journal of physical chemistry A, 115 (21) (2011) 5461-5466. [53] S. Maintz V.L. Deringer A.L. Tchougréeff Analytic projection from plane-wave and PAW wavefunctions and application to chemical-bonding analysis in solids[J] J. Comput. Chem. 34 29 2013 2557 2567 Maintz S, Deringer V L, Tchougréeff A L, et al. Analytic projection from plane‐wave and PAW wavefunctions and application to chemical‐bonding analysis in solids[J]. Journal of computational chemistry, 34 (29) (2013) 2557-2567.",
      "scopus-id": "85189171092",
      "coredata": {
        "eid": "1-s2.0-S0021951724001623",
        "dc:description": "g-C3N3 not only has high content of pyridine nitrogen, but also has a special two-dimensional porous structure, which is an ideal diatomic catalytic host materials. In this work, homonuclear and heteronuclear dual-atom catalysts (DACs, TM-TM@g-C3N3, TM = Mn, Fe, Co, Ni) were constructed using single-layer g-C3N3 as the carrier material of DACs, and their potential as sulfur-hosting materials and electrocatalytic materials for lithium-sulfur batteries was explored through first principles comprehensively. The results show that the coupling between the two metal atoms in heteronuclear DACs can regulate the spin state of each other's d-electrons, so that the anchoring and catalytic effects of heteronuclear DACs on polysulfide are more excellent than that of homonuclear DACs. Co-Mn@g-C3N3, when utilized as the cathode material in lithium-sulfur batteries, offers exceptional properties due to the hybridization between Mn2+ high-spin state d electron and Co2+ half-filled dz 2 orbital. This unique interaction not only enables the polysulfide to exhibit the lowest Gibbs free energy during conversion, but also results in the lowest reaction energy barrier of 0.26 eV for the conversion of Li2S2 to Li2S. Furthermore, it is found that when 3d transition metal atoms act as heteronuclear DACs, the coupling between metal ions with high-spin states at the active site and metal ions with empty orbitals or half-full d-electrons has the most significant catalytic effect on polysulfides.",
        "openArchiveArticle": "false",
        "prism:coverDate": "2024-05-31",
        "openaccessUserLicense": null,
        "prism:aggregationType": "Journal",
        "prism:url": "https://api.elsevier.com/content/article/pii/S0021951724001623",
        "dc:creator": [
          {
            "@_fa": "true",
            "$": "Dong, Wei"
          },
          {
            "@_fa": "true",
            "$": "Zhu, Xuanyi"
          },
          {
            "@_fa": "true",
            "$": "Zhao, Mingyuan"
          },
          {
            "@_fa": "true",
            "$": "Chang, Qiming"
          },
          {
            "@_fa": "true",
            "$": "Gu, Hao"
          },
          {
            "@_fa": "true",
            "$": "Yang, Fang"
          },
          {
            "@_fa": "true",
            "$": "Shen, Ding"
          },
          {
            "@_fa": "true",
            "$": "Tang, Shuwei"
          },
          {
            "@_fa": "true",
            "$": "Hong, Xiaodong"
          },
          {
            "@_fa": "true",
            "$": "Zhang, Xu"
          },
          {
            "@_fa": "true",
            "$": "Wei, Shuang"
          },
          {
            "@_fa": "true",
            "$": "Dong, Ziwen"
          },
          {
            "@_fa": "true",
            "$": "Yang, Shaobin"
          }
        ],
        "link": [
          {
            "@_fa": "true",
            "@rel": "self",
            "@href": "https://api.elsevier.com/content/article/pii/S0021951724001623"
          },
          {
            "@_fa": "true",
            "@rel": "scidir",
            "@href": "https://www.sciencedirect.com/science/article/pii/S0021951724001623"
          }
        ],
        "dc:format": "application/json",
        "openaccessType": null,
        "pii": "S0021-9517(24)00162-3",
        "prism:volume": "433",
        "articleNumber": "115449",
        "prism:publisher": "Elsevier Inc.",
        "dc:title": "Heterokaryotic transition-metal dimers embedded monolayer g-C3N3 as promising anchoring and electrocatalytic materials for lithium-sulfur battery: First-principles calculations",
        "prism:copyright": "© 2024 Elsevier Inc. All rights reserved.",
        "openaccess": "0",
        "prism:issn": "00219517",
        "dcterms:subject": [
          {
            "@_fa": "true",
            "$": "Dual-atom catalysts"
          },
          {
            "@_fa": "true",
            "$": "Single-layer g-C3N3"
          },
          {
            "@_fa": "true",
            "$": "Cathode material"
          },
          {
            "@_fa": "true",
            "$": "Lithium-sulfur batteries"
          }
        ],
        "openaccessArticle": "false",
        "prism:publicationName": "Journal of Catalysis",
        "openaccessSponsorType": null,
        "prism:pageRange": "115449",
        "pubType": "fla",
        "prism:coverDisplayDate": "May 2024",
        "prism:doi": "10.1016/j.jcat.2024.115449",
        "prism:startingPage": "115449",
        "dc:identifier": "doi:10.1016/j.jcat.2024.115449",
        "openaccessSponsorName": null
      },
      "objects": {
        "object": [
          {
            "@category": "standard",
            "@height": "205",
            "@width": "535",
            "@_fa": "true",
            "$": "https://api.elsevier.com/content/object/eid/1-s2.0-S0021951724001623-gr4.jpg?httpAccept=%2A%2F%2A",
            "@multimediatype": "JPEG image file",
            "@type": "IMAGE-DOWNSAMPLED",
            "@size": "33730",
            "@ref": "gr4",
            "@mimetype": "image/jpeg"
          },
          {
            "@category": "standard",
            "@height": "910",
            "@width": "642",
            "@_fa": "true",
            "$": "https://api.elsevier.com/content/object/eid/1-s2.0-S0021951724001623-gr5.jpg?httpAccept=%2A%2F%2A",
            "@multimediatype": "JPEG image file",
            "@type": "IMAGE-DOWNSAMPLED",
            "@size": "176477",
            "@ref": "gr5",
            "@mimetype": "image/jpeg"
          },
          {
            "@category": "standard",
            "@height": "948",
            "@width": "535",
            "@_fa": "true",
            "$": "https://api.elsevier.com/content/object/eid/1-s2.0-S0021951724001623-gr6.jpg?httpAccept=%2A%2F%2A",
            "@multimediatype": "JPEG image file",
            "@type": "IMAGE-DOWNSAMPLED",
            "@size": "143037",
            "@ref": "gr6",
            "@mimetype": "image/jpeg"
          },
          {
            "@category": "standard",
            "@height": "293",
            "@width": "771",
            "@_fa": "true",
            "$": "https://api.elsevier.com/content/object/eid/1-s2.0-S0021951724001623-gr7.jpg?httpAccept=%2A%2F%2A",
            "@multimediatype": "JPEG image file",
            "@type": "IMAGE-DOWNSAMPLED",
            "@size": "57396",
            "@ref": "gr7",
            "@mimetype": "image/jpeg"
          },
          {
            "@category": "standard",
            "@height": "477",
            "@width": "535",
            "@_fa": "true",
            "$": "https://api.elsevier.com/content/object/eid/1-s2.0-S0021951724001623-gr1.jpg?httpAccept=%2A%2F%2A",
            "@multimediatype": "JPEG image file",
            "@type": "IMAGE-DOWNSAMPLED",
            "@size": "81953",
            "@ref": "gr1",
            "@mimetype": "image/jpeg"
          },
          {
            "@category": "standard",
            "@height": "979",
            "@width": "686",
            "@_fa": "true",
            "$": "https://api.elsevier.com/content/object/eid/1-s2.0-S0021951724001623-gr2.jpg?httpAccept=%2A%2F%2A",
            "@multimediatype": "JPEG image file",
            "@type": "IMAGE-DOWNSAMPLED",
            "@size": "221256",
            "@ref": "gr2",
            "@mimetype": "image/jpeg"
          },
          {
            "@category": "standard",
            "@height": "199",
            "@width": "258",
            "@_fa": "true",
            "$": "https://api.elsevier.com/content/object/eid/1-s2.0-S0021951724001623-ga1.jpg?httpAccept=%2A%2F%2A",
            "@multimediatype": "JPEG image file",
            "@type": "IMAGE-DOWNSAMPLED",
            "@size": "18149",
            "@ref": "ga1",
            "@mimetype": "image/jpeg"
          },
          {
            "@category": "standard",
            "@height": "683",
            "@width": "535",
            "@_fa": "true",
            "$": "https://api.elsevier.com/content/object/eid/1-s2.0-S0021951724001623-gr3.jpg?httpAccept=%2A%2F%2A",
            "@multimediatype": "JPEG image file",
            "@type": "IMAGE-DOWNSAMPLED",
            "@size": "122704",
            "@ref": "gr3",
            "@mimetype": "image/jpeg"
          },
          {
            "@category": "thumbnail",
            "@height": "84",
            "@width": "219",
            "@_fa": "true",
            "$": "https://api.elsevier.com/content/object/eid/1-s2.0-S0021951724001623-gr4.sml?httpAccept=%2A%2F%2A",
            "@multimediatype": "GIF image file",
            "@type": "IMAGE-THUMBNAIL",
            "@size": "9167",
            "@ref": "gr4",
            "@mimetype": "image/gif"
          },
          {
            "@category": "thumbnail",
            "@height": "163",
            "@width": "115",
            "@_fa": "true",
            "$": "https://api.elsevier.com/content/object/eid/1-s2.0-S0021951724001623-gr5.sml?httpAccept=%2A%2F%2A",
            "@multimediatype": "GIF image file",
            "@type": "IMAGE-THUMBNAIL",
            "@size": "9487",
            "@ref": "gr5",
            "@mimetype": "image/gif"
          },
          {
            "@category": "thumbnail",
            "@height": "163",
            "@width": "92",
            "@_fa": "true",
            "$": "https://api.elsevier.com/content/object/eid/1-s2.0-S0021951724001623-gr6.sml?httpAccept=%2A%2F%2A",
            "@multimediatype": "GIF image file",
            "@type": "IMAGE-THUMBNAIL",
            "@size": "7586",
            "@ref": "gr6",
            "@mimetype": "image/gif"
          },
          {
            "@category": "thumbnail",
            "@height": "83",
            "@width": "219",
            "@_fa": "true",
            "$": "https://api.elsevier.com/content/object/eid/1-s2.0-S0021951724001623-gr7.sml?httpAccept=%2A%2F%2A",
            "@multimediatype": "GIF image file",
            "@type": "IMAGE-THUMBNAIL",
            "@size": "7209",
            "@ref": "gr7",
            "@mimetype": "image/gif"
          },
          {
            "@category": "thumbnail",
            "@height": "164",
            "@width": "184",
            "@_fa": "true",
            "$": "https://api.elsevier.com/content/object/eid/1-s2.0-S0021951724001623-gr1.sml?httpAccept=%2A%2F%2A",
            "@multimediatype": "GIF image file",
            "@type": "IMAGE-THUMBNAIL",
            "@size": "12455",
            "@ref": "gr1",
            "@mimetype": "image/gif"
          },
          {
            "@category": "thumbnail",
            "@height": "164",
            "@width": "115",
            "@_fa": "true",
            "$": "https://api.elsevier.com/content/object/eid/1-s2.0-S0021951724001623-gr2.sml?httpAccept=%2A%2F%2A",
            "@multimediatype": "GIF image file",
            "@type": "IMAGE-THUMBNAIL",
            "@size": "11053",
            "@ref": "gr2",
            "@mimetype": "image/gif"
          },
          {
            "@category": "thumbnail",
            "@height": "164",
            "@width": "212",
            "@_fa": "true",
            "$": "https://api.elsevier.com/content/object/eid/1-s2.0-S0021951724001623-ga1.sml?httpAccept=%2A%2F%2A",
            "@multimediatype": "GIF image file",
            "@type": "IMAGE-THUMBNAIL",
            "@size": "11254",
            "@ref": "ga1",
            "@mimetype": "image/gif"
          },
          {
            "@category": "thumbnail",
            "@height": "163",
            "@width": "128",
            "@_fa": "true",
            "$": "https://api.elsevier.com/content/object/eid/1-s2.0-S0021951724001623-gr3.sml?httpAccept=%2A%2F%2A",
            "@multimediatype": "GIF image file",
            "@type": "IMAGE-THUMBNAIL",
            "@size": "9901",
            "@ref": "gr3",
            "@mimetype": "image/gif"
          },
          {
            "@category": "high",
            "@height": "906",
            "@width": "2368",
            "@_fa": "true",
            "$": "https://api.elsevier.com/content/object/eid/1-s2.0-S0021951724001623-gr4_lrg.jpg?httpAccept=%2A%2F%2A",
            "@multimediatype": "JPEG image file",
            "@type": "IMAGE-HIGH-RES",
            "@size": "238505",
            "@ref": "gr4",
            "@mimetype": "image/jpeg"
          },
          {
            "@category": "high",
            "@height": "4030",
            "@width": "2844",
            "@_fa": "true",
            "$": "https://api.elsevier.com/content/object/eid/1-s2.0-S0021951724001623-gr5_lrg.jpg?httpAccept=%2A%2F%2A",
            "@multimediatype": "JPEG image file",
            "@type": "IMAGE-HIGH-RES",
            "@size": "1237367",
            "@ref": "gr5",
            "@mimetype": "image/jpeg"
          },
          {
            "@category": "high",
            "@height": "4194",
            "@width": "2368",
            "@_fa": "true",
            "$": "https://api.elsevier.com/content/object/eid/1-s2.0-S0021951724001623-gr6_lrg.jpg?httpAccept=%2A%2F%2A",
            "@multimediatype": "JPEG image file",
            "@type": "IMAGE-HIGH-RES",
            "@size": "867953",
            "@ref": "gr6",
            "@mimetype": "image/jpeg"
          },
          {
            "@category": "high",
            "@height": "1295",
            "@width": "3412",
            "@_fa": "true",
            "$": "https://api.elsevier.com/content/object/eid/1-s2.0-S0021951724001623-gr7_lrg.jpg?httpAccept=%2A%2F%2A",
            "@multimediatype": "JPEG image file",
            "@type": "IMAGE-HIGH-RES",
            "@size": "355581",
            "@ref": "gr7",
            "@mimetype": "image/jpeg"
          },
          {
            "@category": "high",
            "@height": "2113",
            "@width": "2368",
            "@_fa": "true",
            "$": "https://api.elsevier.com/content/object/eid/1-s2.0-S0021951724001623-gr1_lrg.jpg?httpAccept=%2A%2F%2A",
            "@multimediatype": "JPEG image file",
            "@type": "IMAGE-HIGH-RES",
            "@size": "505827",
            "@ref": "gr1",
            "@mimetype": "image/jpeg"
          },
          {
            "@category": "high",
            "@height": "4337",
            "@width": "3038",
            "@_fa": "true",
            "$": "https://api.elsevier.com/content/object/eid/1-s2.0-S0021951724001623-gr2_lrg.jpg?httpAccept=%2A%2F%2A",
            "@multimediatype": "JPEG image file",
            "@type": "IMAGE-HIGH-RES",
            "@size": "1446669",
            "@ref": "gr2",
            "@mimetype": "image/jpeg"
          },
          {
            "@category": "high",
            "@height": "886",
            "@width": "1146",
            "@_fa": "true",
            "$": "https://api.elsevier.com/content/object/eid/1-s2.0-S0021951724001623-ga1_lrg.jpg?httpAccept=%2A%2F%2A",
            "@multimediatype": "JPEG image file",
            "@type": "IMAGE-HIGH-RES",
            "@size": "137388",
            "@ref": "ga1",
            "@mimetype": "image/jpeg"
          },
          {
            "@category": "high",
            "@height": "3022",
            "@width": "2368",
            "@_fa": "true",
            "$": "https://api.elsevier.com/content/object/eid/1-s2.0-S0021951724001623-gr3_lrg.jpg?httpAccept=%2A%2F%2A",
            "@multimediatype": "JPEG image file",
            "@type": "IMAGE-HIGH-RES",
            "@size": "860960",
            "@ref": "gr3",
            "@mimetype": "image/jpeg"
          },
          {
            "@category": "standard",
            "@_fa": "true",
            "$": "https://api.elsevier.com/content/object/eid/1-s2.0-S0021951724001623-mmc1.pdf?httpAccept=%2A%2F%2A",
            "@multimediatype": "Acrobat PDF file",
            "@type": "APPLICATION",
            "@size": "451218",
            "@ref": "mmc1",
            "@mimetype": "application/pdf"
          },
          {
            "@category": "thumbnail",
            "@_fa": "true",
            "$": "https://api.elsevier.com/content/object/eid/1-s2.0-S0021951724001623-si1.svg?httpAccept=%2A%2F%2A",
            "@multimediatype": "Scalable Vector Graphics file",
            "@type": "ALTIMG",
            "@size": "3212",
            "@ref": "si1",
            "@mimetype": "image/svg+xml"
          },
          {
            "@category": "thumbnail",
            "@_fa": "true",
            "$": "https://api.elsevier.com/content/object/eid/1-s2.0-S0021951724001623-si10.svg?httpAccept=%2A%2F%2A",
            "@multimediatype": "Scalable Vector Graphics file",
            "@type": "ALTIMG",
            "@size": "6680",
            "@ref": "si10",
            "@mimetype": "image/svg+xml"
          },
          {
            "@category": "thumbnail",
            "@_fa": "true",
            "$": "https://api.elsevier.com/content/object/eid/1-s2.0-S0021951724001623-si11.svg?httpAccept=%2A%2F%2A",
            "@multimediatype": "Scalable Vector Graphics file",
            "@type": "ALTIMG",
            "@size": "11337",
            "@ref": "si11",
            "@mimetype": "image/svg+xml"
          },
          {
            "@category": "thumbnail",
            "@_fa": "true",
            "$": "https://api.elsevier.com/content/object/eid/1-s2.0-S0021951724001623-si12.svg?httpAccept=%2A%2F%2A",
            "@multimediatype": "Scalable Vector Graphics file",
            "@type": "ALTIMG",
            "@size": "16206",
            "@ref": "si12",
            "@mimetype": "image/svg+xml"
          },
          {
            "@category": "thumbnail",
            "@_fa": "true",
            "$": "https://api.elsevier.com/content/object/eid/1-s2.0-S0021951724001623-si13.svg?httpAccept=%2A%2F%2A",
            "@multimediatype": "Scalable Vector Graphics file",
            "@type": "ALTIMG",
            "@size": "13462",
            "@ref": "si13",
            "@mimetype": "image/svg+xml"
          },
          {
            "@category": "thumbnail",
            "@_fa": "true",
            "$": "https://api.elsevier.com/content/object/eid/1-s2.0-S0021951724001623-si14.svg?httpAccept=%2A%2F%2A",
            "@multimediatype": "Scalable Vector Graphics file",
            "@type": "ALTIMG",
            "@size": "30272",
            "@ref": "si14",
            "@mimetype": "image/svg+xml"
          },
          {
            "@category": "thumbnail",
            "@_fa": "true",
            "$": "https://api.elsevier.com/content/object/eid/1-s2.0-S0021951724001623-si2.svg?httpAccept=%2A%2F%2A",
            "@multimediatype": "Scalable Vector Graphics file",
            "@type": "ALTIMG",
            "@size": "19922",
            "@ref": "si2",
            "@mimetype": "image/svg+xml"
          },
          {
            "@category": "thumbnail",
            "@_fa": "true",
            "$": "https://api.elsevier.com/content/object/eid/1-s2.0-S0021951724001623-si3.svg?httpAccept=%2A%2F%2A",
            "@multimediatype": "Scalable Vector Graphics file",
            "@type": "ALTIMG",
            "@size": "3829",
            "@ref": "si3",
            "@mimetype": "image/svg+xml"
          },
          {
            "@category": "thumbnail",
            "@_fa": "true",
            "$": "https://api.elsevier.com/content/object/eid/1-s2.0-S0021951724001623-si4.svg?httpAccept=%2A%2F%2A",
            "@multimediatype": "Scalable Vector Graphics file",
            "@type": "ALTIMG",
            "@size": "4361",
            "@ref": "si4",
            "@mimetype": "image/svg+xml"
          },
          {
            "@category": "thumbnail",
            "@_fa": "true",
            "$": "https://api.elsevier.com/content/object/eid/1-s2.0-S0021951724001623-si5.svg?httpAccept=%2A%2F%2A",
            "@multimediatype": "Scalable Vector Graphics file",
            "@type": "ALTIMG",
            "@size": "13193",
            "@ref": "si5",
            "@mimetype": "image/svg+xml"
          },
          {
            "@category": "thumbnail",
            "@_fa": "true",
            "$": "https://api.elsevier.com/content/object/eid/1-s2.0-S0021951724001623-si6.svg?httpAccept=%2A%2F%2A",
            "@multimediatype": "Scalable Vector Graphics file",
            "@type": "ALTIMG",
            "@size": "1731",
            "@ref": "si6",
            "@mimetype": "image/svg+xml"
          },
          {
            "@category": "thumbnail",
            "@_fa": "true",
            "$": "https://api.elsevier.com/content/object/eid/1-s2.0-S0021951724001623-si7.svg?httpAccept=%2A%2F%2A",
            "@multimediatype": "Scalable Vector Graphics file",
            "@type": "ALTIMG",
            "@size": "23539",
            "@ref": "si7",
            "@mimetype": "image/svg+xml"
          },
          {
            "@category": "thumbnail",
            "@_fa": "true",
            "$": "https://api.elsevier.com/content/object/eid/1-s2.0-S0021951724001623-si8.svg?httpAccept=%2A%2F%2A",
            "@multimediatype": "Scalable Vector Graphics file",
            "@type": "ALTIMG",
            "@size": "5217",
            "@ref": "si8",
            "@mimetype": "image/svg+xml"
          },
          {
            "@category": "thumbnail",
            "@_fa": "true",
            "$": "https://api.elsevier.com/content/object/eid/1-s2.0-S0021951724001623-si9.svg?httpAccept=%2A%2F%2A",
            "@multimediatype": "Scalable Vector Graphics file",
            "@type": "ALTIMG",
            "@size": "12224",
            "@ref": "si9",
            "@mimetype": "image/svg+xml"
          },
          {
            "@category": "standard",
            "@_fa": "true",
            "$": "https://api.elsevier.com/content/object/eid/1-s2.0-S0021951724001623-am.pdf?httpAccept=%2A%2F%2A",
            "@multimediatype": "Acrobat PDF file",
            "@type": "AAM-PDF",
            "@size": "1818004",
            "@ref": "am",
            "@mimetype": "application/pdf"
          }
        ]
      },
      "link": {
        "@rel": "abstract",
        "@href": "https://api.elsevier.com/content/abstract/scopus_id/85189171092"
      }
    }
  }
}