{
  "metadata": {
    "title": "Suppression of inactive sites in NiMo@amorphous alumina catalysts for hydrodesulfurization reaction: Effect of Ga doping",
    "authors": "; ; ",
    "journal": "Journal of Catalysis",
    "date": "2024-06-30",
    "doi": "10.1016/j.jcat.2024.115501",
    "abstract": "",
    "uri": "https://api.elsevier.com/content/article/pii/S0021951724002148",
    "pii": "S0021951724002148"
  },
  "fulltext": {
    "full-text-retrieval-response": {
      "scopus-eid": "2-s2.0-85190891828",
      "originalText": "serial JL 272561 291210 291744 291809 31 Journal of Catalysis JOURNALCATALYSIS 2024-04-21 2024-04-21 2024-04-23 2024-04-23 2024-12-16T16:44:33 1-s2.0-S0021951724002148 S0021-9517(24)00214-8 S0021951724002148 10.1016/j.jcat.2024.115501 S300 S300.1 FULL-TEXT 1-s2.0-S0021951724X00068 2024-12-16T17:26:55.993611Z 0 0 20240601 20240630 2024 2024-04-21T06:11:50.275189Z absattachment articleinfo articlenumber articletitlenorm authfirstinitialnorm authfirstsurnamenorm cid cids contenttype copyright crossmark dateloaded dateloadedtxt datesearch datesort dateupdated dco docsubtype doctype doi eid ewtransactionid hubeid indexeddate issn issnnorm itemstage itemtransactionid itemweight openaccess openarchive pg pgfirst pii piinorm pubdateend pubdatestart pubdatetxt pubyr sectiontitle sortorder srctitle srctitlenorm srctype ssids alllist content subj subheadings suppl tomb volfirst volissue volumelist webpdf webpdfpagecount yearnav figure table e-component body mmlmath acknowledge affil appendices articletitle auth authfirstini authfull authlast highlightsabst primabst pubtype ref specialabst 0021-9517 00219517 true 434 434 C Volume 434 4 115501 115501 115501 202406 June 2024 2024-06-01 2024-06-30 2024 Regular Articles article fla © 2024 Elsevier Inc. All rights reserved. SUPPRESSIONINACTIVESITESINNIMOAMORPHOUSALUMINACATALYSTSFORHYDRODESULFURIZATIONREACTIONEFFECTGADOPING ARORA S 1 Introduction 2 Experimental details 2.1 Material 2.2 NiMo nanocluster synthesis 2.3 Support synthesis 2.4 Catalyst synthesis 2.5 Comparison procedure for various prepared samples 2.6 Catalyst characterization 2.7 Computational method 2.8 Catalytic activity 3 Result and discussion 3.1 Characterization 3.2 Computational modelling of the Ga doping in MoS2/Ni doped MoS2 in crystalline and amorphous alumina surfaces 3.3 Catalytic activity 3.4 Stability 3.5 Kinetics 3.6 Discussion 4 Conclusion CRediT authorship contribution statement Acknowledgement Appendix A Supplementary material References ALTAMIRANO 2008 292 298 E SINGH 2020 749 757 R TANIMU 2019 2810 2838 A SACHDEVA 2010 1133 1138 T TOPSOE 1984 395 420 H LIU 2010 1958 1962 D SINGH 2016 163 173 R SINGH 2016 5949 5960 R NINH 2011 29 39 T DAAGE 1994 414 427 M BERHAULT 2008 80 88 G ALTAMIRANO 2005 403 412 E DIAZDELEON 2012 311 321 J EIJSBOUTS 2005 352 364 S EIJSBOUTS 2007 3945 3954 S YOUSFI 2010 3367 3380 O MARGI 2021 111362 N YADAV 2004 145 161 G ZHOU 2018 152 163 W ZHOU 2017 7665 7679 W ZHOU 2017 9369 9382 W GANIYU 2017 428 441 S DING 2007 25 37 L SHI 2020 15576 15585 Y HAN 2017 58 66 W DING 2006 241 250 L RANA 2007 1254 1262 M MINATO 2001 79 84 Y GONG 2010 1419 1422 S WANG 2011 18 24 L LIU 2007 7396 7402 F WANG 2018 1891 1902 X WAGENHOFER 2020 1 11 M ZHANG 2024 115255 H ZOU 2023 115092 Y YU 2022 128 143 K FERDOUS 2004 153 162 D SAHA 2021 106685 B ARORA 2023 8539 8551 S ARORA 2023 S GUPTA 2016 246 254 M FRICKE 2000 2303 2405 R ZHOU 2017 9369 9382 W SHIMIZU 1999 1681 1682 K ZEPEDA 2012 10 19 T JANG 2019 181 188 J NISHI 1998 10190 10195 K HENSEN 2001 224 235 E BLOCHL 1994 17953 17979 P IONESCU 2003 8490 8497 A JOUBERT 1999 1758 1775 D KREBS 2008 276 287 E ARROUVEL 2005 161 178 C LIZARRAGA 2011 1 9 R HANEDA 2000 137 148 M GAO 2011 538 543 Q RAMOS 2012 164 178 M ZHOU 2020 118428 W GOLDSMITH 2017 7543 7557 B MAVRIC 2019 119493 A ARORAX2024X115501 ARORAX2024X115501XS 2026-04-23T00:00:00.000Z 2026-04-23T00:00:00.000Z http://creativecommons.org/licenses/by-nc-nd/4.0/ © 2024 Elsevier Inc. All rights reserved. 2024-04-25T00:35:57.441Z http://vtw.elsevier.com/data/voc/AddOnTypes/50.7/aggregated-refined DST DST Department of Science and Technology, Ministry of Science and Technology, India http://data.elsevier.com/vocabulary/SciValFunders/501100001409 http://sws.geonames.org/1269750/ Hindustan Petroleum Corporation Limited HP Hindustan Petroleum http://data.elsevier.com/vocabulary/SciValFunders/501100020351 http://sws.geonames.org/1269750/ CHE CHE Division of Chemistry http://data.elsevier.com/vocabulary/SciValFunders/100000165 http://sws.geonames.org/6252001/ IIT Kanpur IITK Indian Institute of Technology Kanpur http://data.elsevier.com/vocabulary/SciValFunders/501100001403 http://sws.geonames.org/1269750/ SERB SERB Science and Engineering Research Board http://data.elsevier.com/vocabulary/SciValFunders/501100001843 http://sws.geonames.org/1269750/ The financial support provided by Hindustan Petroleum Corporation Limited, Mumbai, SERB/DST projects, FIST grant (PGRL, CHE, IIT Kanpur) and Uchchatar Avishkar yojana is gratefully acknowledged. We acknowledge Dr. G. Valavarasu (HPCL, R&D, Bangalore) for his fruitful scientific discussions. https://doi.org/10.15223/policy-017 https://doi.org/10.15223/policy-037 https://doi.org/10.15223/policy-012 https://doi.org/10.15223/policy-029 https://doi.org/10.15223/policy-004 item S0021-9517(24)00214-8 S0021951724002148 1-s2.0-S0021951724002148 10.1016/j.jcat.2024.115501 272561 2024-12-16T17:26:55.993611Z 2024-06-01 2024-06-30 1-s2.0-S0021951724002148-main.pdf https://s3-eu-west-1.amazonaws.com/prod-ucs-content-store-eu-west/content/pii:S0021951724002148/MAIN/application/pdf/a39dd36000ad58f53d557449bdc2d121/main.pdf main.pdf pdf true 11008158 MAIN 15 1-s2.0-S0021951724002148-main_1.png https://s3-eu-west-1.amazonaws.com/prod-ucs-content-store-eu-west/content/pii:S0021951724002148/PREVIEW/image/png/4d26c5a335aafde222c2dfffc1a85871/main_1.png main_1.png png 62654 849 656 IMAGE-WEB-PDF 1 1-s2.0-S0021951724002148-gr13.jpg https://s3-eu-west-1.amazonaws.com/prod-ucs-content-store-eu-west/content/pii:S0021951724002148/gr13/DOWNSAMPLED/image/jpeg/c5a00e1e3258023547793e00ed0a0c95/gr13.jpg gr13 gr13.jpg jpg 52772 319 535 IMAGE-DOWNSAMPLED 1-s2.0-S0021951724002148-gr14.jpg https://s3-eu-west-1.amazonaws.com/prod-ucs-content-store-eu-west/content/pii:S0021951724002148/gr14/DOWNSAMPLED/image/jpeg/18b8812a14a03428b9f9cd6ed7e82d8a/gr14.jpg gr14 gr14.jpg jpg 32119 392 535 IMAGE-DOWNSAMPLED 1-s2.0-S0021951724002148-gr11.jpg https://s3-eu-west-1.amazonaws.com/prod-ucs-content-store-eu-west/content/pii:S0021951724002148/gr11/DOWNSAMPLED/image/jpeg/fc92900137792529220e921a45318c97/gr11.jpg gr11 gr11.jpg jpg 51467 386 535 IMAGE-DOWNSAMPLED 1-s2.0-S0021951724002148-gr12.jpg https://s3-eu-west-1.amazonaws.com/prod-ucs-content-store-eu-west/content/pii:S0021951724002148/gr12/DOWNSAMPLED/image/jpeg/c4e5a17e35645f55d511ddd5294d2b0d/gr12.jpg gr12 gr12.jpg jpg 30029 273 383 IMAGE-DOWNSAMPLED 1-s2.0-S0021951724002148-gr10.jpg https://s3-eu-west-1.amazonaws.com/prod-ucs-content-store-eu-west/content/pii:S0021951724002148/gr10/DOWNSAMPLED/image/jpeg/60fa646ee65bbf6b80204b571878021e/gr10.jpg gr10 gr10.jpg jpg 53360 366 535 IMAGE-DOWNSAMPLED 1-s2.0-S0021951724002148-ga1.jpg https://s3-eu-west-1.amazonaws.com/prod-ucs-content-store-eu-west/content/pii:S0021951724002148/ga1/DOWNSAMPLED/image/jpeg/5ef33ff199323c63bd716fd2216ed1b0/ga1.jpg ga1 true ga1.jpg jpg 22272 200 378 IMAGE-DOWNSAMPLED 1-s2.0-S0021951724002148-gr1.jpg https://s3-eu-west-1.amazonaws.com/prod-ucs-content-store-eu-west/content/pii:S0021951724002148/gr1/DOWNSAMPLED/image/jpeg/929e73f4248a06b9feb2deadf8002713/gr1.jpg gr1 gr1.jpg jpg 28569 320 383 IMAGE-DOWNSAMPLED 1-s2.0-S0021951724002148-gr2.jpg https://s3-eu-west-1.amazonaws.com/prod-ucs-content-store-eu-west/content/pii:S0021951724002148/gr2/DOWNSAMPLED/image/jpeg/01203c4772d08703d6e6bc7bd66eee35/gr2.jpg gr2 gr2.jpg jpg 67586 436 535 IMAGE-DOWNSAMPLED 1-s2.0-S0021951724002148-gr3.jpg https://s3-eu-west-1.amazonaws.com/prod-ucs-content-store-eu-west/content/pii:S0021951724002148/gr3/DOWNSAMPLED/image/jpeg/4ed1328381f2e35ec464f112523c4773/gr3.jpg gr3 gr3.jpg jpg 38632 323 383 IMAGE-DOWNSAMPLED 1-s2.0-S0021951724002148-gr4.jpg https://s3-eu-west-1.amazonaws.com/prod-ucs-content-store-eu-west/content/pii:S0021951724002148/gr4/DOWNSAMPLED/image/jpeg/59770ce8e0f9291ce52ae8fe9fc692fa/gr4.jpg gr4 gr4.jpg jpg 66539 555 628 IMAGE-DOWNSAMPLED 1-s2.0-S0021951724002148-gr5.jpg https://s3-eu-west-1.amazonaws.com/prod-ucs-content-store-eu-west/content/pii:S0021951724002148/gr5/DOWNSAMPLED/image/jpeg/a04014fe809459972d097252625182f6/gr5.jpg gr5 gr5.jpg jpg 87693 537 680 IMAGE-DOWNSAMPLED 1-s2.0-S0021951724002148-gr6.jpg https://s3-eu-west-1.amazonaws.com/prod-ucs-content-store-eu-west/content/pii:S0021951724002148/gr6/DOWNSAMPLED/image/jpeg/b3071b305c93e45e15281ae57e14e242/gr6.jpg gr6 gr6.jpg jpg 53457 480 535 IMAGE-DOWNSAMPLED 1-s2.0-S0021951724002148-gr7.jpg https://s3-eu-west-1.amazonaws.com/prod-ucs-content-store-eu-west/content/pii:S0021951724002148/gr7/DOWNSAMPLED/image/jpeg/9d8e12ee874a302a03e6adeeb9032348/gr7.jpg gr7 gr7.jpg jpg 37267 427 535 IMAGE-DOWNSAMPLED 1-s2.0-S0021951724002148-gr8.jpg https://s3-eu-west-1.amazonaws.com/prod-ucs-content-store-eu-west/content/pii:S0021951724002148/gr8/DOWNSAMPLED/image/jpeg/c81a5af7b086354584f972c27d7ef106/gr8.jpg gr8 gr8.jpg jpg 269026 733 796 IMAGE-DOWNSAMPLED 1-s2.0-S0021951724002148-gr9.jpg https://s3-eu-west-1.amazonaws.com/prod-ucs-content-store-eu-west/content/pii:S0021951724002148/gr9/DOWNSAMPLED/image/jpeg/d2ece9c1cd173e6baa0bedaaef622fa4/gr9.jpg gr9 gr9.jpg jpg 75604 403 535 IMAGE-DOWNSAMPLED 1-s2.0-S0021951724002148-gr13.sml https://s3-eu-west-1.amazonaws.com/prod-ucs-content-store-eu-west/content/pii:S0021951724002148/gr13/THUMBNAIL/image/gif/8d854e3621ea7394e3ca3870699c76e7/gr13.sml gr13 gr13.sml sml 9907 130 219 IMAGE-THUMBNAIL 1-s2.0-S0021951724002148-gr14.sml https://s3-eu-west-1.amazonaws.com/prod-ucs-content-store-eu-west/content/pii:S0021951724002148/gr14/THUMBNAIL/image/gif/f7f4980f6e7f5be22acb2386b2385702/gr14.sml gr14 gr14.sml sml 6350 161 219 IMAGE-THUMBNAIL 1-s2.0-S0021951724002148-gr11.sml https://s3-eu-west-1.amazonaws.com/prod-ucs-content-store-eu-west/content/pii:S0021951724002148/gr11/THUMBNAIL/image/gif/58f02597007c7acc4a273b6313539e6d/gr11.sml gr11 gr11.sml sml 10194 158 219 IMAGE-THUMBNAIL 1-s2.0-S0021951724002148-gr12.sml https://s3-eu-west-1.amazonaws.com/prod-ucs-content-store-eu-west/content/pii:S0021951724002148/gr12/THUMBNAIL/image/gif/55a0cb163217b528e603060851216fdc/gr12.sml gr12 gr12.sml sml 8872 156 219 IMAGE-THUMBNAIL 1-s2.0-S0021951724002148-gr10.sml https://s3-eu-west-1.amazonaws.com/prod-ucs-content-store-eu-west/content/pii:S0021951724002148/gr10/THUMBNAIL/image/gif/40d96666c2e780266bfe8992858f4821/gr10.sml gr10 gr10.sml sml 10622 150 219 IMAGE-THUMBNAIL 1-s2.0-S0021951724002148-ga1.sml https://s3-eu-west-1.amazonaws.com/prod-ucs-content-store-eu-west/content/pii:S0021951724002148/ga1/THUMBNAIL/image/gif/ab5f781ebe88e3e3bbdab30f4b7b82e4/ga1.sml ga1 true ga1.sml sml 9574 116 219 IMAGE-THUMBNAIL 1-s2.0-S0021951724002148-gr1.sml https://s3-eu-west-1.amazonaws.com/prod-ucs-content-store-eu-west/content/pii:S0021951724002148/gr1/THUMBNAIL/image/gif/97ed529359092e6e52bd2b6d605e3601/gr1.sml gr1 gr1.sml sml 6614 164 196 IMAGE-THUMBNAIL 1-s2.0-S0021951724002148-gr2.sml https://s3-eu-west-1.amazonaws.com/prod-ucs-content-store-eu-west/content/pii:S0021951724002148/gr2/THUMBNAIL/image/gif/c604be5e5181d7366e89772ae7c4eac6/gr2.sml gr2 gr2.sml sml 10050 164 201 IMAGE-THUMBNAIL 1-s2.0-S0021951724002148-gr3.sml https://s3-eu-west-1.amazonaws.com/prod-ucs-content-store-eu-west/content/pii:S0021951724002148/gr3/THUMBNAIL/image/gif/7c99e8488f4c64e5117ed118f6204462/gr3.sml gr3 gr3.sml sml 9243 164 195 IMAGE-THUMBNAIL 1-s2.0-S0021951724002148-gr4.sml https://s3-eu-west-1.amazonaws.com/prod-ucs-content-store-eu-west/content/pii:S0021951724002148/gr4/THUMBNAIL/image/gif/a727dc4b1b0fb8dbb738346a6d0f86e8/gr4.sml gr4 gr4.sml sml 8748 164 185 IMAGE-THUMBNAIL 1-s2.0-S0021951724002148-gr5.sml https://s3-eu-west-1.amazonaws.com/prod-ucs-content-store-eu-west/content/pii:S0021951724002148/gr5/THUMBNAIL/image/gif/627838722b444d3ebaa02fc1fa76296e/gr5.sml gr5 gr5.sml sml 12464 164 207 IMAGE-THUMBNAIL 1-s2.0-S0021951724002148-gr6.sml https://s3-eu-west-1.amazonaws.com/prod-ucs-content-store-eu-west/content/pii:S0021951724002148/gr6/THUMBNAIL/image/gif/b2a1b5dcd96771c369b8866e22194b48/gr6.sml gr6 gr6.sml sml 9275 164 183 IMAGE-THUMBNAIL 1-s2.0-S0021951724002148-gr7.sml https://s3-eu-west-1.amazonaws.com/prod-ucs-content-store-eu-west/content/pii:S0021951724002148/gr7/THUMBNAIL/image/gif/5aba33a679b40f33b449072c4f03d87b/gr7.sml gr7 gr7.sml sml 8103 164 205 IMAGE-THUMBNAIL 1-s2.0-S0021951724002148-gr8.sml https://s3-eu-west-1.amazonaws.com/prod-ucs-content-store-eu-west/content/pii:S0021951724002148/gr8/THUMBNAIL/image/gif/55052270e28b6c6c4380a6d80e234d3a/gr8.sml gr8 gr8.sml sml 22943 164 178 IMAGE-THUMBNAIL 1-s2.0-S0021951724002148-gr9.sml https://s3-eu-west-1.amazonaws.com/prod-ucs-content-store-eu-west/content/pii:S0021951724002148/gr9/THUMBNAIL/image/gif/10dbb76bb7c356fc220c948e7fa52d0f/gr9.sml gr9 gr9.sml sml 17244 164 217 IMAGE-THUMBNAIL 1-s2.0-S0021951724002148-gr13_lrg.jpg https://s3-eu-west-1.amazonaws.com/prod-ucs-content-store-eu-west/content/pii:S0021951724002148/HIGHRES/image/jpeg/6a1b36ad4293db79e18f55dd23902c89/gr13_lrg.jpg gr13 gr13_lrg.jpg jpg 377626 1411 2368 IMAGE-HIGH-RES 1-s2.0-S0021951724002148-gr14_lrg.jpg https://s3-eu-west-1.amazonaws.com/prod-ucs-content-store-eu-west/content/pii:S0021951724002148/HIGHRES/image/jpeg/5779e475792e23e5cb10a32bf482526f/gr14_lrg.jpg gr14 gr14_lrg.jpg jpg 199950 1737 2368 IMAGE-HIGH-RES 1-s2.0-S0021951724002148-gr11_lrg.jpg https://s3-eu-west-1.amazonaws.com/prod-ucs-content-store-eu-west/content/pii:S0021951724002148/HIGHRES/image/jpeg/26a294e8771c4232878a24f502518ea4/gr11_lrg.jpg gr11 gr11_lrg.jpg jpg 382332 1710 2368 IMAGE-HIGH-RES 1-s2.0-S0021951724002148-gr12_lrg.jpg https://s3-eu-west-1.amazonaws.com/prod-ucs-content-store-eu-west/content/pii:S0021951724002148/HIGHRES/image/jpeg/4c157bef5c60f2b5fd3f447bf52b849a/gr12_lrg.jpg gr12 gr12_lrg.jpg jpg 214243 1213 1699 IMAGE-HIGH-RES 1-s2.0-S0021951724002148-gr10_lrg.jpg https://s3-eu-west-1.amazonaws.com/prod-ucs-content-store-eu-west/content/pii:S0021951724002148/HIGHRES/image/jpeg/01b4f9bde9206e0fb15d24cfcbe2b2c4/gr10_lrg.jpg gr10 gr10_lrg.jpg jpg 423373 1621 2368 IMAGE-HIGH-RES 1-s2.0-S0021951724002148-ga1_lrg.jpg https://s3-eu-west-1.amazonaws.com/prod-ucs-content-store-eu-west/content/pii:S0021951724002148/HIGHRES/image/jpeg/1abeb384dca19d2e09ec7e6ed707fd5d/ga1_lrg.jpg ga1 true ga1_lrg.jpg jpg 129482 886 1674 IMAGE-HIGH-RES 1-s2.0-S0021951724002148-gr1_lrg.jpg https://s3-eu-west-1.amazonaws.com/prod-ucs-content-store-eu-west/content/pii:S0021951724002148/HIGHRES/image/jpeg/5ec8dd286c779dab6870a9ca8bb2013c/gr1_lrg.jpg gr1 gr1_lrg.jpg jpg 198147 1418 1699 IMAGE-HIGH-RES 1-s2.0-S0021951724002148-gr2_lrg.jpg https://s3-eu-west-1.amazonaws.com/prod-ucs-content-store-eu-west/content/pii:S0021951724002148/HIGHRES/image/jpeg/1c9386ecbc6986a520231e1afd0aac68/gr2_lrg.jpg gr2 gr2_lrg.jpg jpg 489183 1929 2368 IMAGE-HIGH-RES 1-s2.0-S0021951724002148-gr3_lrg.jpg https://s3-eu-west-1.amazonaws.com/prod-ucs-content-store-eu-west/content/pii:S0021951724002148/HIGHRES/image/jpeg/b1ab5f3ad0358e81213ac452c959cfc1/gr3_lrg.jpg gr3 gr3_lrg.jpg jpg 274745 1431 1699 IMAGE-HIGH-RES 1-s2.0-S0021951724002148-gr4_lrg.jpg https://s3-eu-west-1.amazonaws.com/prod-ucs-content-store-eu-west/content/pii:S0021951724002148/HIGHRES/image/jpeg/c69e997988b29e21f52d3377321dab70/gr4_lrg.jpg gr4 gr4_lrg.jpg jpg 466464 2459 2782 IMAGE-HIGH-RES 1-s2.0-S0021951724002148-gr5_lrg.jpg https://s3-eu-west-1.amazonaws.com/prod-ucs-content-store-eu-west/content/pii:S0021951724002148/HIGHRES/image/jpeg/4c11c37a6bf165a57fa9b2179fd595f3/gr5_lrg.jpg gr5 gr5_lrg.jpg jpg 617186 2377 3009 IMAGE-HIGH-RES 1-s2.0-S0021951724002148-gr6_lrg.jpg https://s3-eu-west-1.amazonaws.com/prod-ucs-content-store-eu-west/content/pii:S0021951724002148/HIGHRES/image/jpeg/3e034c20121b629fc4c6b4416a5ffa1e/gr6_lrg.jpg gr6 gr6_lrg.jpg jpg 372613 2124 2368 IMAGE-HIGH-RES 1-s2.0-S0021951724002148-gr7_lrg.jpg https://s3-eu-west-1.amazonaws.com/prod-ucs-content-store-eu-west/content/pii:S0021951724002148/HIGHRES/image/jpeg/90307d7372adcd20442d4307326058b8/gr7_lrg.jpg gr7 gr7_lrg.jpg jpg 260753 1891 2368 IMAGE-HIGH-RES 1-s2.0-S0021951724002148-gr8_lrg.jpg https://s3-eu-west-1.amazonaws.com/prod-ucs-content-store-eu-west/content/pii:S0021951724002148/HIGHRES/image/jpeg/347753f27a034d0a3afd2b6b01e3ae11/gr8_lrg.jpg gr8 gr8_lrg.jpg jpg 1123974 1948 2115 IMAGE-HIGH-RES 1-s2.0-S0021951724002148-gr9_lrg.jpg https://s3-eu-west-1.amazonaws.com/prod-ucs-content-store-eu-west/content/pii:S166398121500169X/HIGHRES/image/jpeg/56fb54eb8b0f1c8c43e21da3c8ab293e/gr9_lrg.jpg gr9 gr9_lrg.jpg jpg 524085 1785 2368 IMAGE-HIGH-RES 1-s2.0-S0021951724002148-mmc1.docx https://s3-eu-west-1.amazonaws.com/prod-ucs-content-store-eu-west/content/pii:S0021951724002148/mmc1/MAIN/application/vnd.openxmlformats-officedocument.wordprocessingml.document/b9cf555b20ac4606fd1c9abc5085ba62/mmc1.docx mmc1 mmc1.docx docx 3328133 APPLICATION 1-s2.0-S0021951724002148-si1.svg https://s3-eu-west-1.amazonaws.com/prod-ucs-content-store-eu-west/content/pii:S0021951724002148/image/svg+xml/4516cf1b8f085532bbaa1752a5d4c83a/si1.svg si1 si1.svg svg 17131 ALTIMG 1-s2.0-S0021951724002148-si10.svg https://s3-eu-west-1.amazonaws.com/prod-ucs-content-store-eu-west/content/pii:S0021951724002148/image/svg+xml/e66fc329ff84b182f3d5acc354dd4904/si10.svg si10 si10.svg svg 8377 ALTIMG 1-s2.0-S0021951724002148-si11.svg https://s3-eu-west-1.amazonaws.com/prod-ucs-content-store-eu-west/content/pii:S0021951724002148/image/svg+xml/37ad020eba08dc18e5530fb19c8fb3bb/si11.svg si11 si11.svg svg 9301 ALTIMG 1-s2.0-S0021951724002148-si2.svg https://s3-eu-west-1.amazonaws.com/prod-ucs-content-store-eu-west/content/pii:S0021951724002148/image/svg+xml/a20880c56116ebd8eb2d977a6e03828d/si2.svg si2 si2.svg svg 17085 ALTIMG 1-s2.0-S0021951724002148-si3.svg https://s3-eu-west-1.amazonaws.com/prod-ucs-content-store-eu-west/content/pii:S0021951724002148/image/svg+xml/40e64b852dc5ef4fc93f9532e5567129/si3.svg si3 si3.svg svg 18008 ALTIMG 1-s2.0-S0021951724002148-si4.svg https://s3-eu-west-1.amazonaws.com/prod-ucs-content-store-eu-west/content/pii:S0021951724002148/image/svg+xml/5d5e4b6d6b46fd1c231a39de06d30d93/si4.svg si4 si4.svg svg 8795 ALTIMG 1-s2.0-S0021951724002148-si5.svg https://s3-eu-west-1.amazonaws.com/prod-ucs-content-store-eu-west/content/pii:S0021951724002148/image/svg+xml/0bd4b9f9ebca8aea81fa7e7d4cec8fdb/si5.svg si5 si5.svg svg 17634 ALTIMG 1-s2.0-S0021951724002148-si6.svg https://s3-eu-west-1.amazonaws.com/prod-ucs-content-store-eu-west/content/pii:S0021951724002148/image/svg+xml/76f67418b5316734c55c466698bc6898/si6.svg si6 si6.svg svg 27351 ALTIMG 1-s2.0-S0021951724002148-si7.svg https://s3-eu-west-1.amazonaws.com/prod-ucs-content-store-eu-west/content/pii:S0021951724002148/image/svg+xml/fe371433f4ff77f07e5049c9613fc227/si7.svg si7 si7.svg svg 35429 ALTIMG 1-s2.0-S0021951724002148-si8.svg https://s3-eu-west-1.amazonaws.com/prod-ucs-content-store-eu-west/content/pii:S0021951724002148/image/svg+xml/b998aac494847380414127d379f16b35/si8.svg si8 si8.svg svg 18622 ALTIMG 1-s2.0-S0021951724002148-si9.svg https://s3-eu-west-1.amazonaws.com/prod-ucs-content-store-eu-west/content/pii:S0021951724002148/image/svg+xml/a19719a2a82d9d4831ec5d2e409dc363/si9.svg si9 si9.svg svg 14017 ALTIMG 1-s2.0-S0021951724002148-am.pdf https://s3-eu-west-1.amazonaws.com/prod-ucs-content-store-eu-west/content/egi:10ZBNFFRJ6R/MAIN/application/pdf/11204299a7521a911abbb547b2c90731/am.pdf am am.pdf pdf false 2865502 AAM-PDF YJCAT 115501 115501 S0021-9517(24)00214-8 10.1016/j.jcat.2024.115501 Elsevier Inc. Fig. 1 XRD pattern of various prepared catalyst supports. Fig. 2 XRD pattern of prepared catalyst samples. Fig. 3 TPR profile of various prepared catalyst samples (5 % (v/v) H2 in N2 gas, flowrate-10 ml/min at 40–900 °C). Fig. 4 Ga3d XPS spectra for prepared catalysts (a) NiMo@(0.75)Ga-A-Al2O3 (b) NiMo@(1)Ga-A-Al2O3 (c) NiMo@(1.5)Ga-A-Al2O3 (d) NiMo@(2.1)Ga-A-Al2O3 (The sulfided samples were stored in inert atmosphere before characterization because the samples may again oxidize, if exposed to air). Fig.5 Ni2p XPS for prepared catalyst samples a) NiMo@γ-Al2O3-Wet b) NiMo@A-Al2O3 c) NiMo@(1)Ga-A-Al2O3 d) L-NiMo@(1)Ga-A-Al2O3 (The sulfided samples were stored in inert atmosphere before characterization because the samples may again oxidize, if exposed to air). Fig. 6 Mo3d XPS spectra for prepared sulfided catalysts (a) L-NiMo@(1)Ga-A-Al2O3 (b) NiMo@(1)Ga-A-Al2O3 (c) NiMo@(1)Ga-γ-Al2O3-W-Wet (The sulfided samples were stored in inert atmosphere before characterization because the samples may again oxidize, if exposed to air). Fig. 7 Sulfidation degree bar graphs for prepared catalyst samples (sulfidation degree – MoS2 XPS peak area/ (MoO3 + MoS2) XPS peak area) (The sulfided samples were stored in inert atmosphere before characterization because the samples may again oxidize, if exposed to air). Fig. 8 HRTEM images of prepared catalysts a) NiMo@(1)Ga-A-Al2O3 b) sul-NiMo@(1)Ga-A-Al2O3 c) sul-NiMo@(1)Ga-γ-Al2O3-W-Wet d) L-NiMo@(1)Ga-A-Al2O3 (The sulfided samples were stored in inert atmosphere before characterization because the samples may again oxidize, if exposed to air). Fig. 9 Ga doping in (a (top) and (b) side) (110) surface of crystalline alumina with bare MoS2 adsorbent, ((c (top) and (d) side) (110) surface of crystalline alumina with Ni doped MoS2 adsorbent, ((e) (top) and (f) side) amorphous alumina surface with bare MoS2 adsorbent, and (g (top) and (h (side)) amorphous alumina surface with Ni doped MoS2 adsorbent. Fig. 10 DBT conversion vs temperature plot for prepared Ga-doped catalyst samples (sulfiding conditions are given in Fig. S1, pressure-30 bar, catalyst weight-150 mg, feed flowrate-0.17 ml/min). Fig. 11 Comparison of catalytic activity for prepared Ga-doped and control catalyst samples (sulfiding conditions are given in Fig. S1, pressure-30 bar, catalyst weight-150 mg, feed flowrate-0.17 ml/min). Fig. 12 4,6 DMDBT conversion vs temperature plot for selected catalyst samples (sulfiding conditions are given in Fig. S1, pressure-30 bar, catalyst weight-150 mg, feed flowrate-0.17 ml/min). Fig. 13 Product selectivity distribution for prepared Ga-doped catalysts (sulfiding conditions are given in Fig. S1, pressure-30 bar, catalyst weight-150 mg, feed flowrate-0.17 ml/min). Fig. 14 Stability plot using DBT as a reactant for catalyst at NiMo@(1)Ga-A-Al2O3 335 ℃. Table 1 Surface area, pore size, Mo edge site dispersion (for selected samples) and elemental composition values for the prepared catalysts. S.N. Catalyst Surf. area (m2/g) Pore vol. (cm3/g) Pore size (nm) Ga wt.% Dispersion (fMo) 1. NiMo@(2.1)Ga-A-Al2O3 214.3 0.21 4.2 2.0 0.35 2. NiMo@(1.5)Ga-A-Al2O3 218.6 0.22 4.6 1.48 − 3. NiMo@(1)Ga-A-Al2O3 230.5 0.25 4.5 1.01 0.38 4. NiMo@(0.75)Ga-A-Al2O3 220.5 0.26 5.0 0.74 − 5. NiMo@(2.1)Ga-A-Al2O3-W 213.5 0.2 5.9 1.70 − 6. NiMo@(1.5)Ga-A-Al2O3-W 215.8 0.21 4.1 1.30 − 7. NiMo@(1)Ga-A-Al2O3-W 223.2 0.24 5.4 0.85 − 8. NiMo@(0.75)Ga-A-Al2O3-W 214.7 0.25 4.1 0.62 − 9. NiMo@(1)Ga-γ-Al2O3 −W 140.5 0.29 5.1 1.05 − 10. NiMo@(1)Ga-A-Al2O3-Wet 220.7 0.25 4.8 1.0 − 11. NiMo@(1)Ga-γ-Al2O3-W-Wet 161.6 0.28 4.7 1.07 0.33 12. NiMo@A-Al2O3 240.5 0.26 5.2 0 0.36 13. A-Al2O3 315.2 0.45 5.1 − − 14. γ-Al2O3 201.5 0.56 8.5 − − Note: (NiMo supported on Ga doped γ-Al2O3/A-Al2O3 catalysts, where L-leached sample, W-Ga doping by wet impregnation otherwise insitu doping, Wet- catalyst preparation by wet impregnation otherwise prepared by colloidal synthesis). Table 2 NiMoS sites for various prepared catalyst samples. S.No. Catalyst NiMoS area (%) NiAl2O4area (%) NiMoS sites (1022 sites/g) 1. NiMo@γ-Al2O3-Wet 65 21.5 12.5 2. NiMo@A-Al2O3 81 14.5 14.9 3. NiMo@(1)Ga-A-Al2O3 88 5.0 16.3 L-NiMo@(1)Ga-A-Al2O3 93 4.5 17.1 Note: (NiMo supported on Ga doped γ-Al2O3/A-Al2O3 catalysts, where L-leached sample, W-Ga doping by wet impregnation otherwise insitu doping, Wet- catalyst preparation by wet impregnation otherwise prepared by colloidal synthesis). Table 3 Adsorption energy (in eV) of bare MoS2 and Ni doped MoS2 on (110) surface of crystalline alumina and surface of amorphous alumina. S. No. Surface adsorption of bare MoS2 (eV) adsorption of Ni doped MoS2 (eV) 1. (110) surface of crystalline alumina −3.74 −3.23 2. surface of amorphous alumina −2.18 −1.57 3. Ga doped (110) surface of crystalline alumina −2.95 −2.45 4. Ga doped surface of amorphous alumina −2.12 −1.09 Table 4 Reaction kinetics and TOF results for prepared HDS catalysts (Temperature- 290 ℃, pressure-30 bar, catalyst weight-150 mg, feed flowrate-0.17 ml/min). S. R Catalyst HDS Reaction Constant kHDS (μmol/h) TOF (10-4 s−1) DDS pathway reaction constant kDDS (μmol/h) HYD pathway reaction constant kHYD (μmol/h) kHYD/kHDS 1. NiMo@(1)Ga-A-Al2O3 1107.1 2.41 670.7 436.4 0.65 2. NiMo@(1)Ga-γ-Al2O3 –W-Wet 689 2.08 466.9 222.1 0.48 3. NiMo@(1)Ga-A-Al2O3 –Wet 895 2.33 566.2 328.8 0.58 4. NiMo@(1)Ga-γ-Al2O3-W 974.7 2.36 606.6 368.1 0.61 5. L-NiMo@(1)Ga-A-Al2O3 1516.1 2.55 860.4 655.7 0.76 6. NiMo@A-Al2O3 742.7 2.2 482.8 260 0.35 7. NiMo@γ-Al2O3-Wet 514.5 1.8 375.5 139 0.27 Note: (NiMo supported on Ga doped γ-Al2O3/A-Al2O3 catalysts, where L-leached sample, W-Ga doping by wet impregnation otherwise insitu doping, Wet- catalyst preparation by wet impregnation otherwise prepared by colloidal synthesis). Research article Suppression of inactive sites in NiMo@amorphous alumina catalysts for hydrodesulfurization reaction: Effect of Ga doping Shalini Arora Writing – review & editing Writing – original draft Project administration Methodology Investigation Conceptualization a Rashmi Writing – review & editing Software Methodology b Sri Sivakumar Writing – review & editing Supervision Resources Funding acquisition a b c ⁎ a Department of Chemical Engineering, Indian Institute of Technology Kanpur, Kanpur 208016, UP, India Department of Chemical Engineering Indian Institute of Technology Kanpur Kanpur UP 208016 India Department of Chemical Engineering, Indian Institute of Technology Kanpur, Kanpur 208016, UP, India b Materials Science Programme, Indian Institute of Technology Kanpur, Kanpur 208016, UP, India Materials Science Programme Indian Institute of Technology Kanpur Kanpur UP 208016 India Materials Science Programme, Indian Institute of Technology Kanpur, Kanpur 208016, UP, India c DST Thematic Unit of Excellence on Soft Nanofabrication, Centre for Environmental Science & Engineering, Indian Institute of Technology Kanpur, Kanpur 208016, UP, India DST Thematic Unit of Excellence on Soft Nanofabrication Centre for Environmental Science & Engineering Indian Institute of Technology Kanpur Kanpur UP 208016 India DST Thematic Unit of Excellence on Soft Nanofabrication, Centre for Environmental Science & Engineering, Indian Institute of Technology Kanpur, Kanpur 208016, UP, India ⁎ Corresponding author. Graphical abstract Hydrodesulfurization (HDS) reaction activity depends on the formation of active NiMoS (completely sulfided multilayer type 2 sites) and inactive NiAl2O4/NixSy phases on the catalyst surface. These inactive phases not only itself inactive for the reaction but also hinder the formation of active NiMoS phases. In addition, the formation of strong Mo-O-Al bonds also lowers the reducibility of the catalyst, suggesting lesser catalytic activity (type 1 sites, partially sulfided single-layer sites). To this end, we report the formation of NiMo/Ga doped amorphous alumina (A-Al2O3) catalysts prepared by the colloidal synthesis method. A-Al2O3 was chosen as a support because it has lower surface energy, better physicochemical properties, and enhanced acidic sites than the crystalline alumina phase, which favours the formation of type 2 sites or weak metal-support interaction (completely sulfided multilayer NiMoS sites). Further, the Ga doping in A-Al2O3 support substitute the tetrahedral Al sites and form GaAl2O4 phases by reducing NiAl2O4 inactive sites, and the free Ni decorate the edges of MoS2 to form HDS active NiMoS sites. Therefore, NiMo/Ga doped A-Al2O3 catalyst (at 1 wt% Ga loading) reported enhanced HDS catalytic activity (25%), HDS reaction rate constant (kHDS-2.15 times) and turn over frequency (TOF-1.3 times) than the conventional NiMo/γ-Al2O3 catalysts. Data availability No data was used for the research described in the article. 1 Introduction Hydrodesulfurization (HDS) is a catalytic process, which is used in petroleum refineries to reach zero sulfur level of energy fuels due to its higher rate and activity for desulfurization [1–3]. For NiMo-based HDS catalysts (e.g., NiMo@support), NiMoS (Ni doped MoS2 or Ni-MoS2) sites are considered as the active sites [4] which form during the sulfidation process of the prepared oxide phase catalysts (Ni-MoO3). [5,6] The formation of active NiMoS sites further depends on the reducibility of the catalysts.[2,3,7–9] For conventional catalysts (NiMo/CoMo@γ-Al2O3), strong metal support interaction of Mo with γ-Al2O3 support forming strong Mo-O-Al bond hinders the conversion of Ni-MoO3 to Ni-MoS2 which leads to low formation of active NiMoS sites.[10,11] In addition, the interaction of the Ni promoter with the supports producing inactive spinels (i.e., NiAl2O4) also limits the formation of active NiMoS sites.[12,13] Furthermore, the inactive NixSy phases (which block the NiMoS sites at the perimeter) segregate and form on the catalyst surface due to their thermodynamically favorable nature in the given HDS conditions. [14–16] Therefore, the conventional available catalysts (NiMo/CoMo@γ-Al2O3) are not active enough for the complete removal of sulfur compounds from energy fuels due to strong metal-support interaction, inactive sites formation and poor active metal dispersion [17,18] (low control over particle size and growth) [13,19]. Various approaches were explored to target these challenges, such as 1) the use of different catalyst supports, e.g., zeolite [3,20,21], SBA 15 or SBA 16 [22], composite of zeolite and alumina/SBA 15 [22–27] etc., 2) preparation techniques for better control over size and dispersion properties as sol–gel [28,29], co-precipitation [30,31], hydrothermal [20,24], self-assembly, [32] colloidal synthesis [2,7,8] etc., and 3) Ni sulfide segregates removal was also treated through acid leaching for unsupported NiMo catalysts [33]. Recently, some reports discussed a series of new composites such as NiS2-MoS2 flower like hybrid catalysts having minimum slab length to stacking degree ratio and enhanced NiMo interactions [34], NiMo/dendritic silica catalysts containing dendritic open channels, high surface area and acidic sites [35], NiMo/Al modified yolk shell silica (moderate shell size and small yolk which give better structure stability and moderate metal-support interaction) particles [36]. These catalyst compositions showed enhanced activity for HDS reaction at given conditions. However, the catalysts are still unable to reach the desired sulfur limit [37,38]. Our previous articles [39,40] reported the formation of highly active NiMo supported on amorphous alumina (A-Al2O3) catalysts using a colloidal synthesis approach for HDS reaction[41]. These reports proved that the structure of prepared amorphous alumina possesses four [Al]4 and five [Al]5 coordinated sites dominantly (95 %) along with few six [Al]6 coordinated sites, which leads to more unsaturated lewis acid sites available on the surface than γ-Al2O3 (consist of [Al]4 and [Al]6 sites). A-Al2O3 also showed lower surface energy (offering lesser driving force for interactions towards any external molecule; see previous articles [39,40]) and higher surface area than γ-Al2O3. Due to this, A-Al2O3 supported catalysts represented higher acidic sites and weak-metal support interactions (higher Ni-Mo interaction producing NiMoS sites), leading to enhanced type 2 sites, higher sulfidation and dispersion properties, which ultimately showed enhanced HDS catalytic activity than NiMo/γ-Al2O3 catalysts [40]. Further, doping of various metals (Ir, Ga and Zr) into γ-Al2O3 support was explored to suppress the formation of inactive spinels so that the free Ni can interact with Mo to form active NiMoS sites [12,13,19,42,43]. Among all, Ga is considered the most appropriate dopant because of its physical and chemical similarities to Al, i.e., Ga is a trivalent element from group 13 (same as Al) having average electron negativity (1.59) lower than Al (1.74), and Ga also possesses smaller size than Al due to its poor shielding effect [13,19–21,42–47]. Therefore, Ga has a higher affinity to replace the tetrahedral Al sites in alumina support. Many articles reported that the Ga doping technique in γ-Al2O3 for HDS catalysts avoids the Ni participation in inactive spinel formation (NiAl2O4) by reacting with alumina. Also, Ga doping in zeolite supports showed enhanced HDS performance by controlling its acidic properties via Al/Si ratio reduction (Ga replaces Al sites) [20,21,43]. To the best of our knowledge, no report is available in the literature addressing simultaneously all these problems mentioned above (strong metal-support interactions, inactive NiAl2O4 and NixSy phases, control over particle size and dispersion) in a single HDS catalyst so that it can overcome all the barriers combinedly and show superior HDS performance. It is worth noting here that the very first mentioned challenge (strong MoOAl bond) can be easily addressed by replacing the γ-Al2O3 support with A-Al2O3 and the last two challenges can be targeted by using acid leaching method (removal of inactive NixSy phases) along with preparing the catalysts via colloidal synthesis approach (higher dispersion of active metal). Further, inactive NiAl2O4 spinels can be targeted by doping Ga in A-Al2O3 support. To this end, this work report the formation of NiMo supported on Ga doped amorphous alumina (Ga-A-Al2O3) catalysts by a colloidal synthesis approach. Our previous work summarized that for 20 % metal oxide composition, NiMo/A-Al2O3 catalyst synthesized by one step colloidal synthesis method, exhibited highest activity enhancement (15 %) than conventional wet impregnated NiMo/γ-Al2O3 catalysts. Adopting these superior properties of this catalyst, Ga doping (Ga wt.% varied from 0.75-2.1 wt% through two different ways) in A-Al2O3 is studied in this work and showed that Ga successfully replaced the tetrahedral Al sites in A-Al2O3 (confirmed by XPS, TPR and XRD, see the following sections) and enhanced the formation of NiMoS sites due to higher NiMo interactions. However, it is noticed that the activity increased first for 0.75–1 wt% Ga doping and then decreased for 1–2.1 wt% range, suggesting that a small amount of Ga enhances Ni-Mo interaction by avoiding the formation of strong Mo-O-Al bond and inactive NiAl2O4 spinels, but it starts to form strong Mo-O-Ga and nickel gallium spinels along with isolated Ga2O3 phases at higher Ga doping. The DFT studies are also performed to support the importance of Ga doping experimental studies, and the calculated adsorption energy values suggested that the metal support interaction is weaker for Ga doped alumina surfaces as compared to bare alumina surfaces for both bare MoS2 and Ni-doped MoS2 adsorbates. Further, along with the Ga doping study, this work also proposed a NiMo/Ga-A-Al2O3 catalyst treated via acid leaching method to selectively remove the inactive NixSy segregates to further enhance the HDS activity. The detailed study of these NixSy segregates is available in our second report [39], which showed the drastic shoot up of HDS performance for these catalysts. This proposed catalyst is prepared by combining three strategies (A-Al2O3 support, Ga doping and acid treatment), simultaneously enabling it to address all the mentioned problems (lower reducibility, control over size and dispersion, inactive spinels and inactive Ni sulfide segregates). 2 Experimental details 2.1 Material All analytical grade materials and chemicals were used in this work, and no further treatment was performed on these supplied chemicals before they were used in the experiments. To prepare Ga doped NiMo supported on A-Al2O3 catalysts, nickel acetylacetonate (Ni(acc)2 Sigma Aldrich, 95 %), molybdenum hexacarbonyl (Mo(CO)6, Sigma Aldrich, 98 %), aluminium nitrate (Al(NO3)3·9H2O, Thomas Baker, 99 %)) and gallium nitrate (Ga(NO3)2, 99.9 %) precursors were used as source of Ni, Mo, Al and Ga respectively. Along with these precursors, three surfactants trioctylphosphine (TOP, Sigma Aldrich, 97 %), oleic acid (OA, Sigma Aldrich, 99 %) and olylamine (OAM, Sigma Aldrich, 70 %) were also used in catalyst preparation process. 2.2 NiMo nanocluster synthesis First NiMo nanoclusters were prepared, starting with the addition of Ni and Mo precursors in the required amount (0.16 gm Ni(acc)2 and 0.42 gm Mo(CO)6) and the surfactants (0.5 ml TOP, 0.5 ml OA and 15 ml OAM) in a three-neck flask, which was heated to 230 ℃ with vigorous stirring at 5 K/min heating rate. At 230 ℃, the sample was maintained at the same condition for 10 min, and then heating was stopped to cool the sample immediately. The sample was collected in a separate container after it was washed with acetone and dried overnight. These nanoclusters are used to prepare other samples; no calcination was performed for these nanoclusters to avoid the agglomeration of particles [2,7,8]. 2.3 Support synthesis Bare A-Al2O3 support was also prepared separately by using the above-mentioned colloidal synthesis method (which was used to prepare NiMo nanoclusters) in which only aluminium nitrate (Al(NO3)3·9H2O, Thomas Baker 99 %, amount calculated based on the required amount of alumina, 20 wt% NiMo and 80 wt% alumina) precursor was added with the surfactants (0.5 ml TOP, 0.5 ml OA and 15 ml OAM). After washing and drying, the collected sample was also calcined at 550 ℃ for 2 h to remove the surfactants. Two different doping methods (in-situ and wet impregnation) were explored by varying the Ga doping content from 0.75-2.1 wt%. First, in-situ Ga-doped A-Al2O3 (named Ga-A-Al2O3) support was prepared by adding Ga(NO3)2 (0.75–2.1 wt%) and (Al(NO3)3·9H2O, Thomas Baker)) precursor with all three surfactants (0.5 ml TOP, 0.5 ml OA and 15 ml OAM) in three a neck flask, which was heated to 230 ℃ and after staying at this point for 10 min, the sample is cooled immediately. Then the material was washed, dried and finally calcined at 550 ℃ for 2 h. Second, the Ga doping was performed by wet impregnation method in A-Al2O3 and commercially available γ-Al2O3, then these supports Ga-A-Al2O3-W/Ga-γ-Al2O3-W (where, W-Ga doping by wet impregnation method) were used to prepare the NiMo catalysts. In this typical procedure, an aqueous solution of Ga(NO3)2 was added dropwise to the required amount of separately prepared bare A-Al2O3/supplied γ-Al2O3 and stirred for 1 h vigorously. After evaporating the excess solvent, the collected sample was dried for 2 h at 100 ℃. 2.4 Catalyst synthesis For NiMo supported on Ga-doped alumina catalysts, the prepared NiMo nanoclusters were mixed physically with synthesized Ga-A-Al2O3/Ga-A-Al2O3-W/Ga-γ-Al2O3-W supports (where, W-Ga doping by wet impregnation method). In this procedure, the required nanoclusters and support were dispersed in excess hexane and stirred continuously for 12 h to distribute the clusters uniformly on the surface of the support. Then, the sample was washed with acetone and dried overnight in the oven at 100 ℃. Finally, the catalyst sample was calcined at 550 ℃ for 2 h. The final prepared samples were named NiMo@(x)Ga-A-Al2O3, where x is the Ga wt.% dopped in amorphous alumina. Ga doping varied from 0.75-2.1 wt%, NiMo metal oxide content was fixed at 20 wt% with constant Ni/Ni + Mo ratio-0.31 or Ni/Mo-0.4, and total Ga doped support is 80 wt% in all the prepared samples. One undoped sample was also prepared for comparison by using bare A-Al2O3. This sample is named NiMo@A-Al2O3. Two control catalysts NiMo supported on Ga doped alumina (A-Al2O3/γ-Al2O3) named NiMo@(1)-Ga-A-Al2O3-Wet and NiMo@(1)-Ga-γ-Al2O3-W-Wet were prepared by wet impregnation method (where W-Ga doping by wet impregnation method and Wet-catalyst prepared by wet impregnation method). For this preparation process, required amounts of Ni and Mo precursors were added in citric acid aqueous solution (0.21 gm/ml), and this final solution was added dropwise in the required amount of support (separately prepared Ga-A-Al2O3 and Ga-γ-Al2O3-W) and stirred for 1 h vigorously. Then, after evaporating the excess solvent, the sample was dried for 2 h. The final material was collected by calcining it at 550 ℃ for 2 h. One undoped NiMo@γ-Al2O3-Wet catalyst was also prepared by the same wet impregnation method using supplied γ-Al2O3 support without doping. Finally NiMo supported on Ga doped alumina after leaching (L-NiMo@(1)Ga-A-Al2O3 catalyst, where L-leached catalyst samples) was prepared by performing the acid leaching method of the sulfided NiMo@(1)Ga-A-Al2O3 catalyst (sulfiding procedure given in the following section). In this method, the sulfided catalyst sample was treated with concentrated HCl acid for 1 h in an inert atmosphere and then washed with water, followed by acetone washing. This process was repeated 3 more times, and finally, the collected material was dried in a vacuum and directly used for HDS reaction. 2.5 Comparison procedure for various prepared samples (1) Various composition NiMo@(x)Ga-A-Al2O3 as well as NiMo@(x)Ga-A-Al2O3-W samples are compared to screen the optimized composition sample for both types of doping. (2) NiMo@(x)Ga-A-Al2O3 and NiMo@(x)Ga-A-Al2O3-W are compared to each other at fixed x value to study the better doping technique. (3) NiMo@(1)Ga-A-Al2O3 and NiMo@A-Al2O3 as well as NiMo@(1)Ga-γ-Al2O3-W-wet and NiMo@(1)γ-Al2O3-Wet analysed together to see the doping effect. (4) NiMo@(1)Ga-γ-Al2O3-W and NiMo@(1)Ga-A-Al2O3-W are studied to analyse the samples with respect to support. (5) NiMo@(1)-Ga-A-Al2O3-Wet and NiMo@(1)-Ga-A-Al2O3 are analysed with respect to the preparation method. (6) NiMo@(1)Ga-A-Al2O3 and L-NiMo@(1)Ga-A-Al2O3 are analysed together to study the acid leaching effect. (7) The best catalyst is screened by comparing the current approach with conventional wet-impregnated sample NiMo@γ-Al2O3-Wet. 2.6 Catalyst characterization At 77 K, N2 adsorption–desorption test was performed on prepared catalyst samples (oxide phase/unsulfided catalysts) on Autosorb-1C (Model: AS1-C, Quantachrome, USA) instrument. This approach was used to calculate the pore size, pore volume, and specific surface area. Prior to the test, samples were degassed at 280 °C for a minimum of three hours. Several catalyst samples (oxide phase/unsulfided catalysts) were analysed for elemental compositions using X-ray fluorescence (XRF, ZSX Primus II XRF spectrometer by Rigaku) machine. Under 15–20 bar of pressure, catalyst samples were pelletized in a hydraulic machine using boric acid as a substrate. At 100 mA and 30 kV, Al was found, while Ni/Mo was detected at 60 mA and 50 kV. X-ray diffraction (XRD) was used to characterize the produced catalyst (oxide phase/unsulfided catalysts) using a PAN analytical X-ray diffractometer with Ni-filtered K radiation and a Cu target (=1.541841). All patterns were recorded between 10 and 80 degrees at a scan rate of 3 degrees per minute. Utilizing X-ray photoelectron spectroscopy (PHI Versa Probe II scanning XPS microprobe), the various chemical states of sulfided and unsulfided catalyst samples were determined. The sulfided samples were stored in inert atmosphere before characterization because the samples may again oxidize, if exposed to air. XPS 4.1 peak software was used to fit the various peaks of the samples. FTIR spectroscopy was performed using a spectrum II PerkinElmer instrument in attenuated total reflectance (ATR) mode with a germanium (Ge) crystal from 500 to 4000 cm−1. Using high resolution transmission electron microscopy (HRTEM) and a Tecnai TM G2 U-Twin (200 kV, FEI) instrument equipped with an energy-dispersive spectroscopy (EDS) detector, the morphology and average particle size of several catalyst samples (unsulfided and sulfided samples stored in inert atmosphere before characterization) were analysed. After ultrasonically treating a drop of this dispersed liquid sample, HRTEM samples were created by dispersing the catalyst sample in ethanol solvent and placing a drop of this sample on a carbon-coated copper grid. The sample was then vacuum-dried. The average particle size of metal oxide nanoclusters was determined using the following formula (Eq. (1)), where ni is the number of nanoclusters with size di. (1) size avg = ∑ i = 1 n n i d i ∑ i = 1 n n i These evaluations were made with six HRTEM images with 50 nanoclusters per image (total 300 clusters). HRTEM images of sulfided catalyst samples were utilized to calculate the average slab size (Lavg) of MoS2 slabs present in the sample and the stacking degree using the following equation: (Navg). (2) L avg = ∑ i = 1 n n i L i ∑ i = 1 n n i ; N avg = ∑ i = 1 n n i N i ∑ i = 1 n n i where ni is the number of stacks of slab length li and Ni is the number of layers within each stack. fMo is the Mo edge sites fraction (Eqs. (3)–(4)), which represents the proportion of Mo atoms present at the edge sites. It was also approximated via statistically calculated methods assuming MoS2 crystallites were perfect hexagons [48]: (3) f Mo = ∑ i = 1 . . . t 6 n i - 6 / ∑ i = 1 . . . t 3 n i 2 - 3 n i + 1 (4) n i = L 6.4 + 0.5 Turn over frequency (TOF) was calculated using Eq. (5) based on the edge MoS2 dispersion (calculated from Eq. (3)) which is basically the fraction of available edge sites over total Mo sites present at the surface of the catalyst. (5) TOF = F × N × X Moe = F × N × X N Mo × N × f Mo = F × X N Mo × f Mo where, X is the DBT conversion at a given temperature, NMo is the mol of molybdenum, fMo is the Mo edge sites fraction, N is Avogadro number and F is the molar flow rate of DBT. Using the Temperature-Programmed Reduction (TPR) method, the reducibility of the various produced materials (oxide phase/unsulfided catalysts) was determined. All TPR studies were conducted using the Quantachrome instrument and 5 % (v/v) H2 in N2 gas. Before the experiments, the TPR samples were degassed in He atmosphere at 200 °C for 2 h, and after cooling to room temperature in an inert gas atmosphere, 5 %H2 in N2 gas was purged at 10 ml/min at 40 °C. In addition, samples were heated continuously from 40 °C to 1000 °C at a rate of 15 °C/min. Utilizing the thermal conductivity detector (TCD), the H2 consumption values were calculated. 2.7 Computational method We have adopted the methodology given in our previous paper to compute the adsorption of bare MoS2 and Ni-doped MoS2 on Ga doped crystalline and amorphous alumina (A-Al2O3) surfaces [49]. A brief discussion of the computational method is as follows: All the calculations were performed by density functional theory (DFT) using a projected augmented wave method −generalized gradient approximation (GGA) of Perdew-Burke-Ernzerh functional (PBE), as implemented in the Vienna Ab Initio Simulation Package (VASP) [50]. A Plane wave cut-off energy was set 1.3 times the maximum default value to get a complete basis set for all calculations (bulk, surface and adsorption of the molecule on surfaces) [51–53]. For Brillouin zone integration, we have employed a Monkhorst-Pack grid of (8 × 8 × 8) for both the bulk crystalline and amorphous Al2O3. The amorphous alumina was constructed using the method reported by Lizarraga et al. and quantum ATK simulation software, which has been well explored in literature [54]. The cubic box for the amorphous structure has a volume of 1000 cm3 and a density 3.1 g/cm3. Further, fully optimized crystalline and amorphous bulk unit cells have been considered for surface calculations with a vacuum thickness of ∼20 A0. For surface calculations, Brillouin zone sampling was performed using MP grid of (6 × 4 × 1) for crystalline, (4 × 4 × 1) for amorphous, and (8 × 8 × 1) for MoS2. Further, 1 wt% Ga doping has been done in both the (110) surface of crystalline alumina and amorphous alumina surfaces (decided based on the results of experimental work). The adsorption energy of bare MoS2 and Ni-doped MoS2 on Ga-doped crystalline and amorphous alumina has been calculated by following equation: (6) E adsorption = E Slab + a d s o r b a t e - E slab - E adsorbate where, Eslab+adsorbate is the combined energy of molecule adsorbed on the crystal slab, Eslab is the energy of the clean slab, and Eadsorbate is the energy of the isolated adsorbate (molecule). 2.8 Catalytic activity As the sulfided phase of the catalyst is believed to be the active phase for the HDS reaction, the metal oxide catalysts were sulfided (sulfidation procedure Fig. S1) in the stainless steel reactor (Fig. S2). The catalyst was sulfided in the presence of hydrogen (H2) at a flow rate of 120 ml/min at a pressure of 30 bar using a solution of 10 mol% dimethyl disulfide (DMDS) in n-heptane as the sulfiding agent. The flow rate of the sulfiding solution was maintained at 0.17 ml/min throughout all trials. All HDS reactions were conducted at a pressure of 30 bar, 150 mg of catalyst weight and a temperature range of 275–335 °C with a 1.68 wt% DBT solution in n-decane, and a 0.80 wt% 4, 6 DMDBT solution in n-decalin. To maintain 30 bar H2 pressure in the reactor, initially, the pressure was increased to 10 bar using helium gas, then helium gas was gently replaced with H2 gas and the pressure was increased to 30 bar with a combined flow of 120 ml/min of H2 and 0.17 ml/min of liquid feed solution. Before collecting the product sample corresponding to a specific temperature, the sample was allowed to stay at that temperature for at least one hour to stabilize it properly. All samples were evaluated using a gas chromatography (GC) machine with a Petrocol DH capillary column (length-100 m and diameter-0.25 mm) and a flame ionization detectot (FID) to calculate the conversion values (Eq. (7)) at different temperatures. (7) Conversion % = Moles of reactant in - M o l e s o f r e a c t a n t o u t Moles of reactant in × 100 3 Result and discussion 3.1 Characterization The prepared catalyst samples were characterized by N2 adsorption–desorption BET test to evaluate the material surface area and pore size values (Table 1 ). Table 1 shows the samples representing two ways of Ga doping: 1) in-situ within the support (A-Al2O3) preparation and 2) wet impregnation, along with control catalysts. Both doping techniques were used to prepare four samples each by varying Ga content from 0.75-2.1 wt%. It is clear from the table that all the samples reported surface area in the range of 210–240 m2/g, pore volume 0.25–0.30 and pore size 4–5 nm. No significant change was observed in the whole series of samples, but the surface area and volume were still decreased to approx. 8–9 % for 2.1 wt% doping samples. This finding is well reported in the literature [19,43,45,46,55]. This leads to fact that all the physicochemical properties are maintained unaffected by substitution of Ga3+ to Al3+ ions in the catalyst support. However, γ-Al2O3 supported catalyst showed lower surface area based on the γ-Al2O3 support properties (possess lower surface area than A-Al2O3). Table 1 also shows the doped Ga wt.% content in all prepared catalyst samples, and the Ga wt.% values almost match the theoretical values for in-situ doping samples, but the samples prepared through wet impregnation doping showed a significant loss of Ga. Therefore, the in-situ doping technique seems to be a more accurate method than the wet impregnation. Ni/Ni + Mo atomic ratio was maintained fixed (0.30, well-known optimum range 0.28–0.32) for all samples [56]. The synthesized supports and catalyst samples were characterized by XRD technique and shown in Figs. 1 and 2 , respectively. The support XRD pattern (Fig. 1) represents that the Ga doping (both techniques) has not affected the structure of the bare support (for both crystalline, γ-Al2O3 (JCPDS 10–0425) and amorphous alumina). Additionally, for A-Al2O3 support, the formation of alumina is further confirmed by XPS, as its amorphous nature cannot only be confirmed by XRD (Fig. S3). In Fig. 2, all the Ga-doped catalyst samples represent a major peak at phase angle 26.5° matching with NiMoO4 (JCPDS 45-0142) phase along with γ-Al2O3 support peaks for control catalyst NiMo@(1)Ga-γ-Al2O3-W-Wet and no other peak corresponding the support for A-Al2O3 alumina supported catalyst. However, no peak was observed for separate Ga2O3 phase even for the 2.1 wt% sample, which leads to the possibility of Ga substitution to the Al tetrahedral sites. But it may also happen due to the highly dispersed small crystallite size (<4 nm) of the Ga2O3 phase, which is out of the XRD detectable limit. This thing is further analyzed using the XPS characterization method and discussed in the following sections. The TPR profile of all synthesized catalyst samples is shown in Fig. 3 . All the prepared catalyst samples represent two main reduction peaks in the temperature range of 200–900 ℃. The lower temperature peak corresponds to the reduction of Mo+6 to Mo+4, and the higher temperature peak refers to the reduction step of Mo+4 to Mo0. Compared to undoped samples (NiMo@A-Al2O3), the Ga-doped samples possess easier reduction for 0.75–1 wt% doping as the reduction peaks are shifted to lower temperatures. Then again, reducibility decreased for 1–2.1 wt% Ga doped samples i.e., NiMo@(2.1)Ga-A-Al2O3 represent 16 ℃ temperature shift towards higher temperature value from NiMo@(1)Ga-A-Al2O3. It suggest that Ga doping in catalyst support has reduced the metal-support interaction (well supported by DFT studies, see the following section), and maximum reducibility was observed for 1 wt% Ga doped (NiMo@(1)Ga-A-Al2O3) catalyst sample. These findings are well supported by literature reports [19,20,45,46,55]. The expected reason behind this observed trend may be the substitution of Ga for tetrahedral Al sites up to 1 wt% and Ga concentration > 1 wt%, it started replacing the octahedral Al sites and forming separate Ga2O3 phases, strong Mo-O-Ga bonds and inactive nickel gallium spinels. Therefore, the formation of inactive NiAl2O4 (metal-support interaction) is expected to be minimum for 1 wt% Ga-doped samples. In addition, NiMo@(1)Ga-A-Al2O3 represent reduction peaks at lower temperatures than NiMo@(1)Ga-A-Al2O3-W catalyst sample, which confirms the easier reducibility of in-situ doped samples than wet impregnation doped samples. Ga 3d, Ni 2p and Mo 3d XPS patterns for prepared Ga-doped catalyst samples are shown in Figs. 4, 5 and 6 , respectively. For all (Ga wt.% −0.75, 1.0, 1.5 and 2.1) catalyst samples, Ga 3d XPS profile represent three main peaks positioned at 21.2 eV, 24.4 eV and 27.1 eV binding energy values corresponding to Ga-O-Ga (may also come Ga2O3 species or Ga substitution to Al site) Ga-O-Al (Ga substituting Al sites in Al-O-Al bonds of alumina) and Ga-OH (Ga substituting Al-OH groups of alumina) bonds respectively [21]. It is noticed that the Ga-O-Al bond formation peak is the dominant one in all prepared samples, which confirms that Ga has a high affinity to replace Al sites. In addition, the content of Ga-O-Ga increased (1 to 8 % based on XPS area) as Ga doping increased from 0.75 wt% to 2.1 wt% (Fig. 4a-4d) along with almost similar Ga-OH content (a little higher for 2.1 wt% sample) which suggest that Ga substitution to Al sites increase continuously with Ga content and isolated inactive Ga2O3 species content also increase in the sample for higher Ga doping concentrations. This clearly indicates that higher (>1 wt%) Ga doping concentrations ultimately lead to the formation of strong Mo-O-Ga and nickel gallium spinels, which again reduce the HDS activity [21]. Therefore, XPS results suggest that 1 wt% Ga-doped catalyst samples possess higher active sites than all other catalyst samples. In addition, Fig. 5a to d showed Ni 2p XPS profile for NiMo conventional catalyst sample, NiMo@A-Al2O3 sample, NiMo@(1)Ga-A-Al2O3 sample after Ga doping and acid treated Ga doped sample L-NiMo@(1)Ga-A-Al2O3 respectively. It is noted from the figure that four different peaks at ∼ 855.5 eV, 852–853 eV, ∼860 eV and 862–863 eV binding energy values are represented in all the samples corresponding to NiMoS, NixSy, NiAl2O4 for and Ni2p satellite phases respectively[19,45]. Based on the Ni2p XPS pattern, NiMoS sites are calculated for various prepared catalyst samples at the same loading by using the following equation (see Table 2 ): (8) NiMoSsites = N Ni × A NiMoS × N W where NNi is the moles of Ni, N is Avagadro number, ANiMoS is the area ratio of NiMoS evaluated using Ni2p XPS (area ratio of NiMoS/(NiMoS + NixSy + NiAl2O4)) and W is the weight of catalyst. The peak corresponding to NiMoS active site is dominant in all the samples (see Table 2). However, NiMoS concentration enhanced significantly (1) By using A-Al2O3 support along with a colloidal synthesis approach (Fig. 5a to b) (2) After Ga doping in A-Al2O3 support (Fig. 5b to c) and (3) After acid leaching treatment of the Ga doped catalyst sample (Fig. 5c to d). Therefore, Ga doping in A-Al2O3 support has successfully replaced the Al tetrahedral sites and reduced the formation of inactive NiAl2O4 spinels. The maximum active sites (93 %) were measured for optimized L-NiMo@(1)Ga-A-Al2O3 sample, which makes this material a potential HDS catalyst. For sulfided catalyst samples (Fig. 6a–c), Mo 3d XPS pattern shows five major peaks at around 226.3, 229.5, 232.2, 233.1 and 235.6 eV binding energy values corresponding to S2-, Mo4+ 3d 5/2, Mo4+ 3d 3/2, Mo6+ 3d 5/2 and Mo6+ 3d 3/2 respectively. The presence of Mo4+ oxidation state confirms the formation of MoS2 phase as well as Mo6+ refers to unconverted MoO3 phase during sulfidation process. The sulfidation degree (Fig. 7 ) was calculated based on this Mo 3d XPS spectra, and it described that Ga doping in alumina support enhanced 4–5 % sulfidation degree for NiMo supported catalyst along with maximum sulfidation degree (84 %) for NiMo@(1)Ga-A-Al2O3 (1 wt% doped samples, XPS pattern in Fig. 6a) catalyst than other Ga composition catalysts. This may be due to its higher reducibility (confirmed by TPR, DFT studies) and Ga-O-Al species (confirmed by Ga 3d XPS). In addition, the acid leached catalyst sample L-NiMo@(1)Ga-A-Al2O3 (XPS pattern in Fig. 6b) showed further increment in sulfidation degree (89 %) due to the selective removal of inactive Ni sulfide segregates (confirmed by TEM given in the following section). Further, Ga doped γ-Al2O3 supported control catalyst (NiMo@(1)Ga- γ-Al2O3-W-Wet, XPS pattern in Fig. 6c) also represented enhanced sulfidation degree (75 %) after 1 wt% Ga doping but still it is almost 10 % lesser than NiMo@(1)Ga-A-Al2O3 catalyst. Fig. S4 represents the FTIR pattern of synthesized catalysts, and the absence of any COOH, CO, or OH group confirms the removal of all the surfactants after calcination [7,8]. The peak at 980 cm−1 is assigned to the stretching vibration of the MoO bond of the MoO3 phase. Fig. 8 a–d shows the HRTEM images of 1 wt% Ga doped calcined oxide phase (NiMo@(1)Ga-A-Al2O3), sulfided phase (sul-NiMo@(1)Ga-A-Al2O3), wet impregnated control (NiMo@(1)Ga-γ-Al2O3-W-Wet) and acid leached (L-NiMo@(1)Ga-A-Al2O3) catalyst samples respectively. The HRTEM image (Fig. 8a) confirms the presence of Ni-doped MoO3 (Ni-MoO3) nanoclusters supported on A-Al2O3 with average size 2–3 nm (Eq. (2)). In addition, Fig.S5 also represent the HRTEM images of NiMo nanoclusters before calcination and supported nanoclusters after calcination to confirm that the particles are not agglomerated after calcination. These nanoclusters are sulfided at 30 bar H2 pressure, and all the sulfided samples (Fig. 8b–c) clearly represent the formation NiMoS slabs (Ni doped MoS2 layers) along with inactive NixSy segregates (black patches). In addition, the acid-leached catalyst sample (Fig. 7d) shows the selective removal of inactive Ni sulfide phases and the catalyst possesses a higher number of NiMoS sites. The average stacking distribution/degree, fraction of Mo edge atoms (dispersion) and slab length distribution were also evaluated using HRTEM images of sulfided samples (Eqs. (3)–(5)) and given in Table S1 and Fig. S6. The undoped sulfided catalyst (NiMo@A-Al2O3) reported Mo edge site dispersion (also shown in Table 1) 36 % which is increased to 38 % for 1 wt% Ga doped sample (NiMo@(1)Ga-A-Al2O3), and it is further enhanced to 41 % for acid leached L-NiMo@(1)Ga-A-Al2O3 catalyst sample. In addition, all samples reported average slab length of 3–4 nm and stacking degree of 2–3, which are in the desired range for HDS catalysts [2,12,19,42]. This clearly suggests that the prepared Ga doped catalyst samples possess enhanced active metal dispersion along with optimum stacking degree for HDS reaction. 3.2 Computational modelling of the Ga doping in MoS2/Ni doped MoS2 in crystalline and amorphous alumina surfaces The computed lattice parameters (Table S2) and crystal structures of bulk materials (Fig. S7) are given in supporting information. Further, surface energy values of (110) surface of crystalline alumina, amorphous alumina surface, and (100) surface of MoS2 are given in Table S3. In contrast, structures of all surfaces have been shown in Fig. S8. Ga doping has been performed in above mentioned surfaces i.e., in (110) surface of crystalline alumina and amorphous alumina surfaces with bare MoS2 and Ni-doped MoS2 adsorbent. The top and side view of Ga Ga-doped substrate with bare MoS2 and Ni-doped MoS2 adsorbent is shown in Fig. 9 , which represents a minimal change in the atomic position during the relaxation of the system. The adsorption energy values of bare MoS2 and Ni-doped MoS2 on Ga doped crystalline ((110) surface) and amorphous substrate are given in Table 3 along with both substrates without Ga doping. The adsorption energy values of bare MoS2 suggest that its adsorption on Ga-doped amorphous surface has the lowest energy (−2.12 eV) in comparison to crystalline alumina (−3.74 eV) as well as Ga-doped crystalline alumina (−2.95 eV). These results suggest that the interaction of bare MoS2 is weaker at amorphous alumina than crystalline alumina. Further, the adsorption of Ni-doped MoS2 on both the Ga-doped crystalline and amorphous alumina surfaces also follow the same trend i.e., Ni-doped MoS2 adsorbent posses weaker interaction on Ga-doped amorphous alumina surface as compared to Ga doped crystalline (110) surface. In addition, these results also confirm that the metal support interaction is weaker for Ga-doped alumina surfaces than bare alumina surfaces, suggesting that the Ga doping increased the reducibility of the substrate. 3.3 Catalytic activity The catalytic activity results for synthesized catalyst samples are shown in Figs. 10–12 for dibenzothiophene (DBT) and 4,6 dimethyl dibenzothiophene (4,6 DMDBT) reactant molecules. Before starting the activity tests, the catalyst particles were made in the optimized size range 0.25–0.30 mm using 52–60 mesh sieves to avoid the effect of internal and external mass transfer resistances. All the reaction runs were performed at fixed flowrate 0.17 ml/min and pressure 30 bar; however, the temperature was varied in the range 275-335 ℃. The activity results of DBT reactant molecule for various Ga-doped catalyst samples represent that the conversion increased with temperature (rate constant is proportional to temperature), and it became almost the same for all catalysts at higher temperature values (320–335 ℃) because the reaction rate is only dependent on temperature in this region. It is observed in Fig. 10 that 1 wt% Ga-doped samples report higher DBT conversion than all other (0.75–2.1 wt%) Ga-doped samples for both types of doping (in-situ and wet impregnation) samples. However, at fixed Ga doping content, NiMo@(1)Ga-A-Al2O3 catalyst prepared by in-situ doping possess enhanced activity than NiMo@(1)Ga-A-Al2O3-W catalyst synthesized via wet impregnation doping. It concludes that the potential catalyst synthesis method is in-situ Ga doping. Therefore, NiMo@(1)Ga-A-Al2O3 was screened and compared further to all the prepared control and reference catalysts in Fig. 11, which shows that it exhibits 14 % and 28 % increment in DBT conversion from undoped reference samples NiMo@A-Al2O3 and NiMo@γ-Al2O3-Wet respectively. In addition, this catalyst (NiMo@(1)Ga-A-Al2O3) also reported 18 % and 8 % activity increment from Ga-doped wet impregnated control samples NiMo@(1)Ga-A-Al2O3-Wet and NiMo@(1)Ga-γ-Al2O3-W-Wet respectively. Further, this catalyst, after acid leaching treatment (L-NiMo@(1)Ga-A-Al2O3) showed remarkable DBT conversion (91 % at 275 ℃) values. This suggest that the activity is affected by all the parameters such as preparation method, catalyst support, acid treatment and Ga doping. In this regard, this higher activity may be demonstrated due to the A-Al2O3 support as well as Ga doping in A-Al2O3 ensuring weak-metal support interaction leading to higher sulfidation degree and Ni availability for NiMoS site formation (confirmed by TPR, DFT and XPS), colloidal synthesis approach producing higher active metal dispersion (confirmed by HRTEM) and removal of inactive Ni sulfides through acid leaching (confirmed by HRTEM). The highly active screened catalysts (NiMo@(1)Ga-A-Al2O3 and L-NiMo@(1)Ga-A-Al2O3) were also tested for HDS reaction of heavier molecule like 4, 6 DMDBT and compared with prepared control catalysts (Fig. 12). It is noticed that the maximum conversion was observed for L-NiMo@(1)Ga-A-Al2O3 catalyst (40 % higher than undoped convention catalyst NiMo@γ-Al2O3-Wet at 275 ℃) and a significant activity increment was noticed from 28 % to 42 % for NiMo@A-Al2O3 catalysts after Ga doping. Therefore, it is clear that the prepared catalysts are active enough to target the refractory heavier sulfur compounds, making these catalysts a potential solution for SOx emissions. As described earlier, HDS reaction can follow two different routs 1) Direct desulfurization (DDS) 2) Hydrogenation followed by desulfurization (HYD). Biphenyl (BP) and cyclohexylbenzene (CHB) are the two major products of DDS and HYD pathways respectively for HDS reaction of DBT [2,8,9,57]. In this regard, the collected products of HDS reaction for DBT reactant, were analyzed using GC and the product selectivity graph is shown in Fig. 13 . The production distribution clearly describe that BP is the dominant product for all catalyst samples and its content decreases continuously with temperature. This may be due to the enhanced hydrogenation ability of the catalysts with temperature, which generate higher CHB consequently reducing BP formation. In addition, it is noticed that at fixed temperature, NiMo@(1)Ga-A-Al2O3 catalyst possesses higher HYD selectivity than all the control conventional samples and it is increased further after acid treatment (L-NiMo@(1)Ga-A-Al2O3). Therefore, it is worth to mention the higher activity of the prepared Ga-doped catalyst samples is based on the enhanced type 2 NiMoS sites (confirmed by TPR, XPS, DFT and HRTEM) which actually favor HYD pathways as these sites are more suitable for planar adsorption than type 1 sites. 3.4 Stability Based on the properties and activity test of DBT and 4,6 DMDBT reactant molecules, NiMo@(1)Ga-A-Al2O3 catalyst sample was screened for longer reaction run stability test experiment. Fig. 14 clearly represents that no significant changes were observed in DBT conversion as well as the product distribution for 80-hour reaction run period at 335 ℃. This suggests that the prepared catalyst sample is highly stable for long reaction runs, making it an potential catalyst for the HDS industrial process. 3.5 Kinetics To understand the catalysts performance in detail, the reaction rate constant for both reaction pathways as well as the turnover frequency (TOF, Eq. (5)) were also calculated and shown in Table 4 . The pseudo first order HDS reaction was performed in a fixed bed reactor following the plug flow reactor characteristics and the proposed rate law is given here in Eqs. (9)–(11). (9) ln 1 1 - X = k HDS W F (10) k DDS = k HDS × S DDS (11) k HYD = k HDS × S HYD Here, kHDS is the reaction rate constant for HDS process, W is the catalyst weight, X is the DBT conversion at a given temperature, NMo is the mol of molybdenum, fMo is the Mo edge sites fraction, N is Avogadro number, kDDS and kHYD are the rate constant for DDS and HYD pathways, SDDS and SHYD are the selectivity for DDS and HYD reaction pathways (determined by the fraction of BP and CHB formation respectively (product distribution)). and F the molar flow rate of the reactant [58]. Table 4 clearly showed that the reaction rate constant (kHDS) for reference NiMo@A-Al2O3 and NiMo@γ-Al2O3--Wet catalysts without Ga doping, were 742.6 and 514.5 μmol/h which increased to 1107.1 and 689 μmol/h after doping 1 wt% Ga in catalyst supports respectively. In addition, as described earlier based on the activity trend, A-Al2O3 supported catalysts (NiMo@(1)Ga-A-Al2O3) represent higher rate constant (1107.1 μmol/h) than γ-Al2O3 supported catalyst (NiMo@(1)Ga-γ-Al2O3-W, 974.7 μmol/h). However, A-Al2O3 supported catalyst prepared by wet impregnation method (NiMo@(1)Ga-A-Al2O3 –Wet) posses lower rate constant (689 μmol/h) than NiMo@(1)Ga-A-Al2O3 prepared by colloidal synthesis. This clearly describe that the 1 wt% Ga doped A-Al2O3 supported catalysts prepared by colloidal synthesis method (NiMo@(1)Ga-A-Al2O3), demonstrate superior HDS reaction constant which further enhanced to 1516.1 μmol/h after acid leaching treatment. The extensive shoot up of HDS performance can be directly related to higher number of NiMoS active sites produced through greater participation of Ni promoter in NiMoS site formation via Ga doping, higher reducibility or sulfidation degree of A-Al2O3 support and better MoS2 dispersion along with selective removal of inactive Ni sulfide segregates. Further, kDDS and kHYD constants explained that the HDS reaction favored the DDS pathways dominantly for all catalyst samples but the kHYD constant enhanced significantly after Ga doping and acid leaching treatment. It is worth to notice that the higher performance of NiMo@(1)Ga-A-Al2O3 and L-NiMo@(1)Ga-A-Al2O3 catalyst may be related to their higher HYD selectivity which is ultimately controlled by type 2 NiMoS active sites which enable the planar adsorption of bigger sulfur compounds. TOF further supported the catalytic activity and reaction rate constant trend for prepared catalyst samples and demonstrated that the maximum TOF was reported for L-NiMo@(1)Ga-A-Al2O3 (2.55x10-4 s−1) as well as enhanced TOF was observed for NiMo@(1)Ga-A-Al2O3 catalyst (2.41x10-4 s−1) than reference NiMo@A-Al2O3 catalyst without Ga doping (A TOF comparison table is also given as Table S4). Therefore, it may be summarized that the Ga doping approach in catalyst support along with acid leaching treatment has shown remarkable performance for HDS reaction. 3.6 Discussion Ga-doped NiMo supported on amorphous alumina catalysts were successfully prepared using a colloidal synthesis approach. In this work, catalysts were compared based on the (1) Preparation method (wet impregnation and colloidal synthesis), (2) Support (γ-Al2O3 and A-Al2O3) (3) Ga doping effects and (4) Removal of inactive NixSy sites. (1) In colloidal synthesis approach, NiMo oxide nanocatalysts are solution grown nanometer size particles stabilized by surfactants layer over the surface of the particles. It is very controlled/stable way of synthesizing nanocatalysts. However, in wet impregnation method, metals are deposited on the support surface by evaporating the excess precursor solutions and it generally suffers the lack of control over the particle size of the catalysts. In this work, ultrasmall bimetallic catalysts prepared by colloidal synthesis approach possess higher surface area and better control over particle size/growth (confirmed by BET), compared to the conventional impregnated samples. This leads to enhanced active metal dispersion/uniformity for the prepared catalysts. (2) Various characterization (BET, TPR, HRTEM) results confirmed that A-Al2O3 supported catalysts possess low surface energy/higher reducibility than γ-Al2O3 supported catalysts [54,59,60]. Because A-Al2O3 structure comprises of four [Al]4 and (undercoordinated) five [Al]5 coordinated sites dominantly (95 %) along with few six [Al]6 coordinated sites, which leads to more unsaturated lewis acid sites compared to γ-Al2O3 (structure consists of [Al]4 and [Al]6 sites). This generates enhanced Ni-Mo interactions (NiMoS active sites) or weak Mo-Al2O3 (Mo-O-Al) interactions. (3) During Ga doping, it substituted the tetrahedral Al sites in A-Al2O3 support (confirmed by XPS) and formed GaAl2O4 phases, which made the Ni promoter free from support (by inhibiting the formation of inactive NiAl2O4 species, Ni2p XPS), leading to its enhanced participation in the formation of NiMoS active sites. Adding an optimized Ga amount also further increased the Mo sulfidation degree due to its higher reducibility (lower metal-support interactions) and dispersion on the catalyst surface [21,36]. (4) Finally, the inactive isolated NixSy segregates were removed by acid leaching method for Ga-doped sulfided NiMo catalysts and it increased the number of active NiMoS sites for HDS reaction. Because earlier these sites were covered by inactive NixSy segregates and not participating in the reaction. All these points conclude that this catalyst simultaneously addressed all the following problems:inactive NiAl2O4 species, inactive NixSy segregates and strong Mo-O-Al bond, for superior HDS activity [12,20,21]. 4 Conclusion Ga doping study has successfully carried out for prepared NiMo@A-Al2O3 catalysts and represented that Ga addition enhanced the HDS activity not only by increasing the NiMo interactions through replacement of Ga at Al sites but also promoting Mo sulfidation. However, higher amount of Ga prefers to form strong Mo-O-Ga bond along with Ga2O3 isolated phases which decrease the HDS activity. The DFT studies are also performed to support the importance of Ga doping experimental studies and the calculated adsorption energy values suggested that the metal support interaction is weaker for Ga doped alumina surfaces as compared to bare alumina surfaces for both bare MoS2 and Ni doped MoS2 adsorbates. This work also proposed acid leached L-NiMo@(1)Ga-A-Al2O3 catalyst, which further increased the HDS performance by removing inactive Ni sulfide phases from catalyst surface. CRediT authorship contribution statement Shalini Arora: Writing – review & editing, Writing – original draft, Project administration, Methodology, Investigation, Conceptualization. Rashmi: Writing – review & editing, Software, Methodology. Sri Sivakumar: Writing – review & editing, Supervision, Resources, Funding acquisition. Declaration of competing interest The authors declare that they have no known competing financial interests or personal relationships that could have appeared to influence the work reported in this paper. Acknowledgement The financial support provided by Hindustan Petroleum Corporation Limited, Mumbai, SERB/DST projects, FIST grant (PGRL, CHE, IIT Kanpur) and Uchchatar Avishkar yojana is gratefully acknowledged. We acknowledge Dr. G. Valavarasu (HPCL, R&D, Bangalore) for his fruitful scientific discussions. Appendix A Supplementary material Supplementary data to this article can be found online at https://doi.org/10.1016/j.jcat.2024.115501. Appendix A Supplementary material The following are the Supplementary data to this article: Supplementary Data 1 References [1] E. Altamirano J.A. de los Reyes F. Murrieta M. Vrinat Hydrodesulfurization of 4,6-dimethyldibenzothiophene over Co(Ni)MoS2 catalysts supported on alumina: effect of gallium as an additive Catal. Today. 133–135 2008 292 298 E. Altamirano, J.A. de los Reyes, F. Murrieta, M. Vrinat, Hydrodesulfurization of 4,6-dimethyldibenzothiophene over Co(Ni)MoS2 catalysts supported on alumina: Effect of gallium as an additive, Catal. Today. 133–135 (2008) 292–298. [2] R. Singh S. Arora D. Kunzru S. Sivakumar Ultrasmall Ni-promoted WS2 nanocatalyst with enhanced number of edge atoms for hydrodesulfurization Energy and Fuels. 34 2020 749 757 R. Singh, S. Arora, D. Kunzru, S. Sivakumar, Ultrasmall Ni-Promoted WS2 Nanocatalyst with Enhanced Number of Edge Atoms for Hydrodesulfurization, Energy and Fuels. 34 (2020) 749–757. [3] A. Tanimu K. Alhooshani Advanced hydrodesulfurization catalysts: a review of design and synthesis Energy Fuels 33 2019 2810 2838 A. Tanimu, K. Alhooshani, Advanced Hydrodesulfurization Catalysts: A Review of Design and Synthesis, Energy and Fuels. 33 (2019) 2810–2838. [4] T.O. Sachdeva K.K. Pant Deep desulfurization of diesel via peroxide oxidation using phosphotungstic acid as phase transfer catalyst Fuel Process. Technol. 91 2010 1133 1138 T.O. Sachdeva, K.K. Pant, Deep desulfurization of diesel via peroxide oxidation using phosphotungstic acid as phase transfer catalyst, Fuel Process. Technol. 91 (2010) 1133–1138. [5] H. TopsøE B.S. Clausen Importance of Co-Mo-S type structures in hydrodesulfurization Catal. Rev. 26 1984 395 420 H. TopsøE, B.S. Clausen, Importance of Co-Mo-S Type Structures in Hydrodesulfurization, Catal. Rev. 26 (1984) 395–420. [6] D. Liu M. Li W. Deng G. Que Reactivity and composition of dispersed NI catalyst for slurry-phase residue hydrocracking Energy Fuels 24 2010 1958 1962 D. Liu, M. Li, W. Deng, G. Que, Reactivity and composition of dispersed NI catalyst for slurry-phase residue hydrocracking, Energy and Fuels. 24 (2010) 1958–1962. [7] R. Singh D. Kunzru S. Sivakumar Monodispersed ultrasmall NiMo metal oxide nanoclusters as hydrodesulfurization catalyst Appl. Catal. B Environ. 185 2016 163 173 R. Singh, D. Kunzru, S. Sivakumar, Monodispersed ultrasmall NiMo metal oxide nanoclusters as hydrodesulfurization catalyst, Appl. Catal. B Environ. 185 (2016) 163–173. [8] R. Singh D. Kunzru S. Sivakumar Co-promoted MoO3 nanoclusters for hydrodesulfurization Catal. Sci. Technol. 6 2016 5949 5960 R. Singh, D. Kunzru, S. Sivakumar, Co-promoted MoO3 nanoclusters for hydrodesulfurization, Catal. Sci. Technol. 6 (2016) 5949–5960. [9] T.K.T. Ninh L. Massin D. Laurenti M. Vrinat A new approach in the evaluation of the support effect for NiMo hydrodesulfurization catalysts Appl. Catal. A Gen. 407 2011 29 39 T.K.T. Ninh, L. Massin, D. Laurenti, M. Vrinat, A new approach in the evaluation of the support effect for NiMo hydrodesulfurization catalysts, Appl. Catal. A Gen. 407 (2011) 29–39. [10] M. Daage R.R. Chianelli Structure-function relations in molybdenum sulfide catalysts: the Rim edge model J. Catal. 149 1994 414 427 M. Daage, R.R. Chianelli, Structure-Function relations in molybdenum sulfide catalysts: The Rim edge model, J. Catal. 149 (1994) 414-427. [11] G. Berhault M. Perez De la Rosa A. Mehta M.J. Yácaman R.R. Chianelli The single-layered morphology of supported MoS2-based catalysts-The role of the cobalt promoter and its effects in the hydrodesulfurization of dibenzothiophene Appl. Catal. A Gen. 345 2008 80 88 G. Berhault, M. Perez De la Rosa, A. Mehta, M.J. Yácaman, R.R. Chianelli, The single-layered morphology of supported MoS2-based catalysts-The role of the cobalt promoter and its effects in the hydrodesulfurization of dibenzothiophene, Appl. Catal. A Gen. 345 (2008) 80–88. [12] E. Altamirano J.A. De Los Reyes F. Murrieta M. Vrinat Hydrodesulfurization of dibenzothiophene and 4,6-dimethyl-dibenzothiophene: gallium effect over NiMo/Al2O3 sulfided catalysts J. Catal. 235 2005 403 412 E. Altamirano, J.A. De Los Reyes, F. Murrieta, M. Vrinat, Hydrodesulfurization of dibenzothiophene and 4,6-dimethyl-dibenzothiophene: Gallium effect over NiMo/Al2O3 sulfided catalysts, J. Catal. 235 (2005) 403–412. [13] J.N. Díaz De León M. Picquart L. Massin M. Vrinat J.A. De Los Reyes Hydrodesulfurization of sulfur refractory compounds: effect of gallium as an additive in NiWS/γ-Al2O3 catalysts J. Mol. Catal. A Chem. 363–364 2012 311 321 J.N. Díaz De León, M. Picquart, L. Massin, M. Vrinat, J.A. De Los Reyes, Hydrodesulfurization of sulfur refractory compounds: Effect of gallium as an additive in NiWS/γ-Al2O3 catalysts, J. Mol. Catal. A Chem. 363–364 (2012) 311–321. [14] S. Eijsbouts L.C.A. Van Den Oetelaar R.R. Van Puijenbroek MoS2 morphology and promoter segregation in commercial Type 2 Ni-Mo/Al2O3 and Co-Mo/Al2O3 hydroprocessing catalysts J. Catal. 229 2005 352 364 S. Eijsbouts, L.C.A. Van Den Oetelaar, R.R. Van Puijenbroek, MoS2 morphology and promoter segregation in commercial Type 2 Ni-Mo/Al2O3 and Co-Mo/Al2O3 hydroprocessing catalysts, J. Catal. 229 (2005) 352–364. [15] S. Eijsbouts L.C.A. Van Den Oetelaar J.N. Louwen R.R. Van Puijenbroek G.C. Van Leerdam Changes of MoS2 morphology and the degree of Co segregation during the sulfidation and deactivation of commercial Co-Mo/Al2O3 hydroprocessing catalysts Ind. Eng. Chem. Res. 46 2007 3945 3954 S. Eijsbouts, L.C.A. Van Den Oetelaar, J.N. Louwen, R.R. Van Puijenbroek, G.C. Van Leerdam, Changes of MoS2 morphology and the degree of Co segregation during the sulfidation and deactivation of commercial Co-Mo/Al2O3 hydroprocessing catalysts, Ind. Eng. Chem. Res. 46 (2007) 3945–3954. [16] O. Yousfi P. Donnadieu Y. Bréchet F. Robaut F. Charlot A. Kasper F. Serruys Phase transformations in nickel sulphide: microstructures and mechanisms Acta Mater. 58 2010 3367 3380 O. Yousfi, P. Donnadieu, Y. Bréchet, F. Robaut, F. Charlot, A. Kasper, F. Serruys, Phase transformations in nickel sulphide: Microstructures and mechanisms, Acta Mater. 58 (2010) 3367–3380. [17] N.H. Margi G.D. Yadav Molybdenum oxide modified montmorillonite K10 clay as novel solid acid for flow synthesis of ionone isomers Mol. Catal. 501 2021 111362 N.H. Margi, G.D. Yadav, Molybdenum oxide modified montmorillonite K10 clay as novel solid acid for flow synthesis of ionone isomers, Mol. Catal. 501 (2021) 111362. [18] G.D. Yadav Insight into green phase transfer catalysis Top. Catal. 29 2004 145 161 G.D. Yadav, Insight into green phase transfer catalysis, Top. Catal. 29 (2004) 145–161. [19] W. Zhou Y. Zhang X. Tao Y. Zhou Q. Wei S. Ding Effects of gallium addition to mesoporous alumina by impregnation on dibenzothiophene hydrodesulfurization performances of the corresponding NiMo supported catalysts Fuel 228 2018 152 163 W. Zhou, Y. Zhang, X. Tao, Y. Zhou, Q. Wei, S. Ding, Effects of gallium addition to mesoporous alumina by impregnation on dibenzothiophene hydrodesulfurization performances of the corresponding NiMo supported catalysts, Fuel. 228 (2018) 152–163. [20] W. Zhou M. Liu Q. Zhang Q. Wei S. Ding Y. Zhou Synthesis of NiMo catalysts supported on gallium-containing mesoporous y zeolites with different gallium contents and their high activities in the hydrodesulfurization of 4,6-dimethyldibenzothiophene ACS Catal. 7 2017 7665 7679 W. Zhou, M. Liu, Q. Zhang, Q. Wei, S. Ding, Y. Zhou, Synthesis of NiMo Catalysts Supported on Gallium-Containing Mesoporous y Zeolites with Different Gallium Contents and Their High Activities in the Hydrodesulfurization of 4,6-Dimethyldibenzothiophene, ACS Catal. 7 (2017) 7665–7679. [21] W. Zhou Y. Zhou Q. Wei L. Du S. Ding S. Jiang Y. Zhang Q. Zhang Gallium modified HUSY zeolite as an effective co-support for NiMo hydrodesulfurization activity and the catalyst's high isomerization activity Chem. Eur. J. 23 2017 9369 9382 W. Zhou, Y. Zhou, Q. Wei, L. Du, S. Ding, S. Jiang,Y. Zhang, and Q. Zhang, Gallium Modified HUSY Zeolite as an Effective Co‐support for NiMo hydrodesulfurization activity and the catalyst's high isomerization activity, Chem. Eur. J. 23, (2017) 9369 –9382. [22] S.A. Ganiyu K. Alhooshani S.A. Ali Single-pot synthesis of Ti-SBA-15-NiMo hydrodesulfurization catalysts: role of calcination temperature on dispersion and activity Appl. Catal. B Environ. 203 2017 428 441 S.A. Ganiyu, K. Alhooshani, S.A. Ali, Single-pot synthesis of Ti-SBA-15-NiMo hydrodesulfurization catalysts: Role of calcination temperature on dispersion and activity, Appl. Catal. B Environ. 203 (2017) 428–441. [23] L. Ding Y. Zheng Z. Zhang Z. Ring J. Chen HDS, HDN, HDA, and hydrocracking of model compounds over Mo-Ni catalysts with various acidities Appl. Catal. A Gen. 319 2007 25 37 L. Ding, Y. Zheng, Z. Zhang, Z. Ring, J. Chen, HDS, HDN, HDA, and hydrocracking of model compounds over Mo-Ni catalysts with various acidities, Appl. Catal. A Gen. 319 (2007) 25–37. [24] Y. Shi G. Wang J. Mei C. Xiao D. Hu A. Wang Y. Song Y. Ni G. Jiang A. Duan The influence of pore structure and acidity on the hydrodesulfurization of dibenzothiophene over NiMo-supported catalysts ACS Omega. 5 2020 15576 15585 Y. Shi, G. Wang, J. Mei, C. Xiao, D. Hu, A. Wang, Y. Song, Y. Ni, G. Jiang, A. Duan, The Influence of Pore Structure and Acidity on the Hydrodesulfurization of Dibenzothiophene over NiMo-Supported Catalysts, ACS Omega. 5 (2020) 15576–15585. [25] W. Han H. Nie X. Long M. Li Q. Yang D. Li Effects of the support Br Ønsted acidity on the hydrodesulfurization and hydrodenitrogention activity of sulfided NiMo/Al2O3 catalysts Catal. Today. 292 2017 58 66 W. Han, H. Nie, X. Long, M. Li, Q. Yang, D. Li, Effects of the support BrØnsted acidity on the hydrodesulfurization and hydrodenitrogention activity of sulfided NiMo/Al2O3 catalysts, Catal. Today. 292 (2017) 58–66. [26] L. Ding Z. Zhang Y. Zheng Z. Ring J. Chen Effect of fluorine and boron modification on the HDS, HDN and HDA activity of hydrotreating catalysts Appl. Catal. A Gen. 301 2006 241 250 L. Ding, Z. Zhang, Y. Zheng, Z. Ring, J. Chen, Effect of fluorine and boron modification on the HDS, HDN and HDA activity of hydrotreating catalysts, Appl. Catal. A Gen. 301 (2006) 241–250. [27] M.S. Rana E.M.R. Capitaine C. Leyva J. Ancheyta Effect of catalyst preparation and support composition on hydrodesulfurization of dibenzothiophene and Maya crude oil Fuel 86 2007 1254 1262 M.S. Rana, E.M.R. Capitaine, C. Leyva, J. Ancheyta, Effect of catalyst preparation and support composition on hydrodesulfurization of dibenzothiophene and Maya crude oil, Fuel. 86 (2007) 1254–1262. [28] Y. Minato K. Aoki M. Shirai M. Arai Cobalt-based catalysts prepared by a sol-gel method for thiophene hydrodesulfurization Appl. Catal. A Gen. 209 2001 79 84 Y. Minato, K. Aoki, M. Shirai, M. Arai, Cobalt-based catalysts prepared by a sol-gel method for thiophene hydrodesulfurization, Appl. Catal. A Gen. 209 (2001) 79–84. [29] S. Gong L. Liu H. He Q. Cui Dibenzothiophene hydrodesulfurization over MoP/SiO2 catalyst prepared with sol-gel method Korean J. Chem. Eng. 27 2010 1419 1422 S. Gong, L. Liu, H. He, Q. Cui, Dibenzothiophene hydrodesulfurization over MoP/SiO2 catalyst prepared with sol-gel method, Korean J. Chem. Eng. 27 (2010) 1419–1422. [30] L. Wang Y. Zhang Y. Zhang P. Liu H. Han M. Yang Z. Jiang C. Li Hydrodesulfurization of 4,6-DMDBT on a multi-metallic sulfide catalyst with layered structure Appl. Catal. A Gen. 394 2011 18 24 L. Wang, Y. Zhang, Y. Zhang, P. Liu, H. Han, M. Yang, Z. Jiang, C. Li, Hydrodesulfurization of 4,6-DMDBT on a multi-metallic sulfide catalyst with layered structure, Appl. Catal. A Gen. 394 (2011) 18–24. [31] F. Liu S. Xu L. Cao Y. Chi T. Zhang D. Xue A comparison of NiMo/Al2O3 catalysts prepared by impregnation and coprecipitation methods for hydrodesulfurization of dibenzothiophene J. Phys. Chem. c. 111 2007 7396 7402 F. Liu, S. Xu, L. Cao, Y. Chi, T. Zhang, D. Xue, A comparison of NiMo/Al2O3 catalysts prepared by impregnation and coprecipitation methods for hydrodesulfurization of dibenzothiophene, J. Phys. Chem. C. 111 (2007) 7396–7402. [32] X. Wang J. Mei Z. Zhao P. Zheng Z. Chen D. Gao J. Fu J. Fan A. Duan C. Xu Self-assembly of hierarchically porous ZSM-5/SBA-16 with different morphologies and its high isomerization performance for hydrodesulfurization of dibenzothiophene and 4,6-dimethyldibenzothiophene ACS Catal. 8 2018 1891 1902 X. Wang, J. Mei, Z. Zhao, P. Zheng, Z. Chen, D. Gao, J. Fu, J. Fan, A. Duan, C. Xu, Self-Assembly of Hierarchically Porous ZSM-5/SBA-16 with Different Morphologies and Its High Isomerization Performance for Hydrodesulfurization of Dibenzothiophene and 4,6-Dimethyldibenzothiophene, ACS Catal. 8 (2018) 1891–1902. [33] M.F. Wagenhofer H. Shi O.Y. Gutiérrez A. Jentys J.A. Lercher Enhancing hydrogenation activity of Ni-Mo sulfide hydrodesulfurization catalysts Sci. Adv. 6 2020 1 11 M.F. Wagenhofer, H. Shi, O.Y. Gutiérrez, A. Jentys, J.A. Lercher, Enhancing hydrogenation activity of Ni-Mo sulfide hydrodesulfurization catalysts, Sci. Adv. 6 (2020) 1–11. [34] H. Zhang Q. Zhang G.R. Qian H. Liu J. Zhang Y. Yue C.Q. Gao W. Ying Li R. Sen Jing In situ synthesis of mesoporous NiS2-MoS2 sphere-flower hybrid for hydrodesulfurization of thiophene and 4,6-dimethyl-dibenzothiophene J. Catal. 429 2024 115255 H. Zhang, Q. Zhang, G.R. Qian, H. Liu, J. Zhang, Y. Yue, C.Q. Gao, W. ying Li, R. Sen Jing, In situ synthesis of mesoporous NiS2-MoS2 sphere-flower hybrid for hydrodesulfurization of thiophene and 4,6-dimethyl-dibenzothiophene, J. Catal. 429 (2024) 115255. [35] Y. Zou C. Xiao D. Li A. Wang D. Gao H. Shang C. Wang A. Duan C. Xu X. Wang Dendritic micro-mesoporous composites via nano-assembly strategy towards high-efficiency catalysts for hydrodesulfurization of dibenzothiophenes J. Catal. 427 2023 115092 Y. Zou, C. Xiao, D. Li, A. Wang, D. Gao, H. Shang, C. Wang, A. Duan, C. Xu, X. Wang, Dendritic micro-mesoporous composites via nano-assembly strategy towards high-efficiency catalysts for hydrodesulfurization of dibenzothiophenes, J. Catal. 427 (2023) 115092. [36] K. Yu W. Kong Z. Zhao A. Duan L. Kong X. Wang Hydrodesulfurization of dibenzothiophene and 4,6-dimethyldibenzothiophene over NiMo supported on yolk-shell silica catalysts with adjustable shell thickness and yolk size J. Catal. 410 2022 128 143 K. Yu, W. Kong, Z. Zhao, A. Duan, L. Kong, X. Wang, Hydrodesulfurization of dibenzothiophene and 4,6-dimethyldibenzothiophene over NiMo supported on yolk-shell silica catalysts with adjustable shell thickness and yolk size, J. Catal. 410 (2022) 128–143. [37] D. Ferdous A.K. Dalai J. Adjaye A series of NiMo/Al2O3 catalysts containing boron and phosphorus: part II. Hydrodenitrogenation and hydrodesulfurization using heavy gas oil derived from Athabasca bitumen Appl. Catal. A Gen. 260 2004 153 162 D. Ferdous, A.K. Dalai, J. Adjaye, A series of NiMo/Al2O3 catalysts containing boron and phosphorus: Part II. Hydrodenitrogenation and hydrodesulfurization using heavy gas oil derived from Athabasca bitumen, Appl. Catal. A Gen. 260 (2004) 153–162. [38] B. Saha S. Vedachalam A.K. Dalai Review on recent advances in adsorptive desulfurization Fuel Process. Technol. 214 2021 106685 B. Saha, S. Vedachalam, A.K. Dalai, Review on recent advances in adsorptive desulfurization, Fuel Process. Technol. 214 (2021) 106685. [39] S. Arora S. Sivakumar Unblocking of NiMo active sites for hydrodesulfurization catalysts: a study focused on inactive NixSy segregation Energy Fuels 37 2023 8539 8551 S. Arora, S. Sivakumar, Unblocking of NiMo Active Sites for Hydrodesulfurization Catalysts: A Study Focused on Inactive NixSy Segregation, Energy and Fuels. 37 (2023) 8539–8551. [40] S. Arora S. Sivakumar NiMo@Amorphous-Al2O3 nanocatalysts for hydrodesulfurization reactions: a catalyst with uniformly dispersed enhanced type 2 sites Fuel 2023 S. Arora, Rashmi, S. Sivakumar, NiMo@Amorphous-Al2O3 nanocatalysts for hydrodesulfurization reactions : A catalyst with uniformly dispersed enhanced type 2 sites, Fuel (2023). [41] M. Gupta J. He T. Nguyen F. Petzold D. Fonseca J.B. Jasinski M.K. Sunkara Nanowire catalysts for ultra-deep hydro-desulfurization and aromatic hydrogenation Appl. Catal. B Environ. 180 2016 246 254 M. Gupta, J. He, T. Nguyen, F. Petzold, D. Fonseca, J.B. Jasinski, M.K. Sunkara, “Nanowire catalysts for ultra-deep hydro-desulfurization and aromatic hydrogenation,” Appl. Catal. B Environ. 180 (2016) 246–254. [42] R. Fricke H. Kosslick G. Lischke M. Richter Incorporation of gallium into zeolites: syntheses, properties and catalytic application Chem. Rev. 100 2000 2303 2405 R. Fricke, H. Kosslick, G. Lischke, M. Richter, Incorporation of gallium into zeolites: syntheses, properties and catalytic application, Chem. Rev. 100 (2000) 2303–2405. [43] W. Zhou Y. Zhou Q. Wei L. Du S. Ding S. Jiang Y. Zhang Q. Zhang Gallium modified HUSY zeolite as an effective co-support for NiMo hydrodesulfurization catalyst and the catalyst’s high isomerization selectivity Chem. - A Eur. J. 23 2017 9369 9382 W. Zhou, Y. Zhou, Q. Wei, L. Du, S. Ding, S. Jiang, Y. Zhang, Q. Zhang, Gallium Modified HUSY Zeolite as an Effective Co-support for NiMo Hydrodesulfurization Catalyst and the Catalyst’s High Isomerization Selectivity, Chem. - A Eur. J. 23 (2017) 9369–9382. [44] K.I. Shimizu Y. Kato T. Yoshida H. Yoshida A. Satsuma T. Hattori Al K-edge XANES study for the quantification of aluminium coordinations in alumina Chem. Commun. 1999 1681 1682 K.I. Shimizu, Y. Kato, T. Yoshida, H. Yoshida, A. Satsuma, T. Hattori, Al K-edge XANES study for the quantification of aluminium coordinations in alumina, Chem. Commun. (1999) 1681–1682. [45] T.A. Zepeda B. Pawelec J.N. Díaz de León J.A. de los Reyes A. Olivas Effect of gallium loading on the hydrodesulfurization activity of unsupported Ga2S3/WS2 catalysts Appl. Catal. B Environ. 111–112 2012 10 19 T.A. Zepeda, B. Pawelec, J.N. Díaz de León, J.A. de los Reyes, A. Olivas, Effect of gallium loading on the hydrodesulfurization activity of unsupported Ga2S3/WS2 catalysts, Appl. Catal. B Environ. 111–112 (2012) 10–19. [46] J.G. Jang Y.K. Lee Promotional effect of Ga for Ni2P catalyst on hydrodesulfurization of 4,6-DMDBT Appl. Catal. B Environ. 250 2019 181 188 J.G. Jang, Y.K. Lee, Promotional effect of Ga for Ni2P catalyst on hydrodesulfurization of 4,6-DMDBT, Appl. Catal. B Environ. 250 (2019) 181–188. [47] K. Nishi K.I. Shimizu M. Takamatsu H. Yoshida A. Satsuma T. Tanaka S. Yoshida T. Hattori Deconvolution analysis of Ga K-Edge XANES for quantification of gallium coordinations in oxide environments J. Phys. Chem. B. 102 1998 10190 10195 K. Nishi, K.I. Shimizu, M. Takamatsu, H. Yoshida, A. Satsuma, T. Tanaka, S. Yoshida, T. Hattori, Deconvolution analysis of Ga K-Edge XANES for quantification of gallium coordinations in oxide environments, J. Phys. Chem. B. 102 (1998) 10190–10195. [48] E.J.M. Hensen P.J. Kooyman Y. Van der Meer A.M. Van der Kraan V.H.J. De Beer J.A.R. Van Veen R.A. Van Santen P.J. Kooyman Y. Van der Meer A.M. Van der Kraan The relation between morphology and hydrotreating activity for supported MoS2 particles J. Catal. 199 2001 224 235 E.J.M. Hensen, P.J. Kooyman, Y. Van der Meer, A.M. Van der Kraan, V.H.J. De Beer, J.A.R. Van Veen, R.A. Van Santen, P.J. Kooyman, Y. Van der Meer, A.M. Van der Kraan, The relation between morphology and hydrotreating activity for supported MoS2 particles, J. Catal. 199 (2001) 224–235. [49] P.E. Blöchl Projector augmented-wave method Phys. Rev. B. 50 1994 17953 17979 P.E. Blöchl, Projector augmented-wave method, Phys. Rev. B. 50 (1994) 17953–17979. [50] A. Ionescu A. Allouche J.P. Aycard M. Rajzmann R. Le Gall Study of γ-alumina-supported hydrotreating catalyst: I. Adsorption of bare MoS2 sheets on γ-alumina surfaces J. Phys. Chem. b. 107 2003 8490 8497 A. Ionescu, A. Allouche, J.P. Aycard, M. Rajzmann, R. Le Gall, Study of γ-alumina-supported hydrotreating catalyst: I. Adsorption of bare MoS2 sheets on γ-alumina surfaces, J. Phys. Chem. B. 107 (2003) 8490–8497. [51] D. Joubert From ultrasoft pseudopotentials to the projector augmented-wave method Phys. Rev. B - Condens. Matter Mater. Phys. 59 1999 1758 1775 D. Joubert, From ultrasoft pseudopotentials to the projector augmented-wave method, Phys. Rev. B - Condens. Matter Mater. Phys. 59 (1999) 1758–1775. [52] E. Krebs B. Silvi A. Daudin P. Raybaud A DFT study of the origin of the HDS/HydO selectivity on Co(Ni)MoS active phases J. Catal. 260 2008 276 287 E. Krebs, B. Silvi, A. Daudin, P. Raybaud, A DFT study of the origin of the HDS/HydO selectivity on Co(Ni)MoS active phases, J. Catal. 260 (2008) 276–287. [53] C. Arrouvel M. Breysse H. Toulhoat P. Raybaud A density functional theory comparison of anatase (TiO2)- and γ-Al2O3-supported MoS2 catalysts J. Catal. 232 2005 161 178 C. Arrouvel, M. Breysse, H. Toulhoat, P. Raybaud, A density functional theory comparison of anatase (TiO2)- and γ-Al2O3-supported MoS2 catalysts, J. Catal. 232 (2005) 161–178. [54] R. Lizárraga E. Holmström S.C. Parker C. Arrouvel Structural characterization of amorphous alumina and its polymorphs from first-principles XPS and NMR calculations Phys. Rev. B - Condens. Matter Mater. Phys. 83 2011 1 9 R. Lizárraga, E. Holmström, S.C. Parker, C. Arrouvel, Structural characterization of amorphous alumina and its polymorphs from first-principles XPS and NMR calculations, Phys. Rev. B - Condens. Matter Mater. Phys. 83 (2011) 1–9. [55] M. Haneda Y. Kintaichi H. Shimada H. Hamada Selective reduction of NO with propene over Ga2O3-Al2O3: effect of sol-gel method on the catalytic performance J. Catal. 192 2000 137 148 M. Haneda, Y. Kintaichi, H. Shimada, H. Hamada, Selective reduction of NO with propene over Ga2O3-Al2O3: Effect of sol-gel method on the catalytic performance, J. Catal. 192 (2000) 137–148. [56] Q. Gao T.N.K. Ofosu S.G. Ma V.G. Komvokis C.T. Williams K. Segawa Catalyst development for ultra-deep hydrodesulfurization (HDS) of dibenzothiophenes. I: effects of Ni promotion in molybdenum-based catalysts Catal. Today. 164 2011 538 543 Q. Gao, T.N.K. Ofosu, S.G. Ma, V.G. Komvokis, C.T. Williams, K. Segawa, Catalyst development for ultra-deep hydrodesulfurization (HDS) of dibenzothiophenes. I: Effects of Ni promotion in molybdenum-based catalysts, Catal. Today. 164 (2011) 538–543. [57] M. Ramos G. Berhault D.A. Ferrer B. Torres R.R. Chianelli HRTEM and molecular modeling of the MoS2-Co9S8 interface: understanding the promotion effect in bulk HDS catalysts Catal. Sci. Technol. 2 2012 164 178 M. Ramos, G. Berhault, D.A. Ferrer, B. Torres, R.R. Chianelli, HRTEM and molecular modeling of the MoS2-Co9S8 interface: Understanding the promotion effect in bulk HDS catalysts, Catal. Sci. Technol. 2 (2012) 164–178. [58] W. Zhou L. Yang L. Liu Z. Chen A. Zhou Y. Zhang X. He F. Shi Z. Zhao Synthesis of novel NiMo catalysts supported on highly ordered TiO2-Al2O3 composites and their superior catalytic performance for 4,6-dimethyldibenzothiophene hydrodesulfurization Appl. Catal. B Environ. 268 2020 118428 W. Zhou, L. Yang, L. Liu, Z. Chen, A. Zhou, Y. Zhang, X. He, F. Shi, Z. Zhao, Synthesis of novel NiMo catalysts supported on highly ordered TiO2-Al2O3 composites and their superior catalytic performance for 4,6-dimethyldibenzothiophene hydrodesulfurization, Appl. Catal. B Environ. 268 (2020) 118428. [59] B.R. Goldsmith B. Peters J.K. Johnson B.C. Gates S.L. Scott Beyond ordered materials: understanding catalytic sites on amorphous solids ACS Catal. 7 2017 7543 7557 B.R. Goldsmith, B. Peters, J.K. Johnson, B.C. Gates, S.L. Scott, Beyond Ordered Materials: Understanding Catalytic Sites on Amorphous Solids, ACS Catal. 7 (2017) 7543–7557. [60] A. Mavrič M. Valant C. Cui Z.M. Wang Advanced applications of amorphous alumina: from nano to bulk J. Non. Cryst. Solids. 521 2019 119493 A. Mavrič, M. Valant, C. Cui, Z.M. Wang, Advanced applications of amorphous alumina : From nano to bulk, J. Non. Cryst. Solids. 521 (2019) 119493.",
      "scopus-id": "85190891828",
      "coredata": {
        "eid": "1-s2.0-S0021951724002148",
        "dc:description": "Hydrodesulfurization (HDS) reaction activity depends on the formation of active NiMoS (completely sulfided multilayer type 2 sites) and inactive NiAl2O4/NixSy phases on the catalyst surface. These inactive phases not only itself inactive for the reaction but also hinder the formation of active NiMoS phases. In addition, the formation of strong Mo-O-Al bonds also lowers the reducibility of the catalyst, suggesting lesser catalytic activity (type 1 sites, partially sulfided single-layer sites). To this end, we report the formation of NiMo/Ga doped amorphous alumina (A-Al2O3) catalysts prepared by the colloidal synthesis method. A-Al2O3 was chosen as a support because it has lower surface energy, better physicochemical properties, and enhanced acidic sites than the crystalline alumina phase, which favours the formation of type 2 sites or weak metal-support interaction (completely sulfided multilayer NiMoS sites). Further, the Ga doping in A-Al2O3 support substitute the tetrahedral Al sites and form GaAl2O4 phases by reducing NiAl2O4 inactive sites, and the free Ni decorate the edges of MoS2 to form HDS active NiMoS sites. Therefore, NiMo/Ga doped A-Al2O3 catalyst (at 1 wt% Ga loading) reported enhanced HDS catalytic activity (25%), HDS reaction rate constant (kHDS-2.15 times) and turn over frequency (TOF-1.3 times) than the conventional NiMo/γ-Al2O3 catalysts.",
        "openArchiveArticle": "false",
        "prism:coverDate": "2024-06-30",
        "openaccessUserLicense": null,
        "prism:aggregationType": "Journal",
        "prism:url": "https://api.elsevier.com/content/article/pii/S0021951724002148",
        "dc:creator": [
          {
            "@_fa": "true",
            "$": "Arora, Shalini"
          },
          {
            "@_fa": "true",
            "$": "Rashmi,"
          },
          {
            "@_fa": "true",
            "$": "Sivakumar, Sri"
          }
        ],
        "link": [
          {
            "@_fa": "true",
            "@rel": "self",
            "@href": "https://api.elsevier.com/content/article/pii/S0021951724002148"
          },
          {
            "@_fa": "true",
            "@rel": "scidir",
            "@href": "https://www.sciencedirect.com/science/article/pii/S0021951724002148"
          }
        ],
        "dc:format": "application/json",
        "openaccessType": null,
        "pii": "S0021-9517(24)00214-8",
        "prism:volume": "434",
        "articleNumber": "115501",
        "prism:publisher": "Elsevier Inc.",
        "dc:title": "Suppression of inactive sites in NiMo@amorphous alumina catalysts for hydrodesulfurization reaction: Effect of Ga doping",
        "prism:copyright": "© 2024 Elsevier Inc. All rights reserved.",
        "openaccess": "0",
        "prism:issn": "00219517",
        "openaccessArticle": "false",
        "prism:publicationName": "Journal of Catalysis",
        "openaccessSponsorType": null,
        "prism:pageRange": "115501",
        "pubType": "fla",
        "prism:coverDisplayDate": "June 2024",
        "prism:doi": "10.1016/j.jcat.2024.115501",
        "prism:startingPage": "115501",
        "dc:identifier": "doi:10.1016/j.jcat.2024.115501",
        "openaccessSponsorName": null
      },
      "objects": {
        "object": [
          {
            "@category": "standard",
            "@height": "319",
            "@width": "535",
            "@_fa": "true",
            "$": "https://api.elsevier.com/content/object/eid/1-s2.0-S0021951724002148-gr13.jpg?httpAccept=%2A%2F%2A",
            "@multimediatype": "JPEG image file",
            "@type": "IMAGE-DOWNSAMPLED",
            "@size": "52772",
            "@ref": "gr13",
            "@mimetype": "image/jpeg"
          },
          {
            "@category": "standard",
            "@height": "392",
            "@width": "535",
            "@_fa": "true",
            "$": "https://api.elsevier.com/content/object/eid/1-s2.0-S0021951724002148-gr14.jpg?httpAccept=%2A%2F%2A",
            "@multimediatype": "JPEG image file",
            "@type": "IMAGE-DOWNSAMPLED",
            "@size": "32119",
            "@ref": "gr14",
            "@mimetype": "image/jpeg"
          },
          {
            "@category": "standard",
            "@height": "386",
            "@width": "535",
            "@_fa": "true",
            "$": "https://api.elsevier.com/content/object/eid/1-s2.0-S0021951724002148-gr11.jpg?httpAccept=%2A%2F%2A",
            "@multimediatype": "JPEG image file",
            "@type": "IMAGE-DOWNSAMPLED",
            "@size": "51467",
            "@ref": "gr11",
            "@mimetype": "image/jpeg"
          },
          {
            "@category": "standard",
            "@height": "273",
            "@width": "383",
            "@_fa": "true",
            "$": "https://api.elsevier.com/content/object/eid/1-s2.0-S0021951724002148-gr12.jpg?httpAccept=%2A%2F%2A",
            "@multimediatype": "JPEG image file",
            "@type": "IMAGE-DOWNSAMPLED",
            "@size": "30029",
            "@ref": "gr12",
            "@mimetype": "image/jpeg"
          },
          {
            "@category": "standard",
            "@height": "366",
            "@width": "535",
            "@_fa": "true",
            "$": "https://api.elsevier.com/content/object/eid/1-s2.0-S0021951724002148-gr10.jpg?httpAccept=%2A%2F%2A",
            "@multimediatype": "JPEG image file",
            "@type": "IMAGE-DOWNSAMPLED",
            "@size": "53360",
            "@ref": "gr10",
            "@mimetype": "image/jpeg"
          },
          {
            "@category": "standard",
            "@height": "200",
            "@width": "378",
            "@_fa": "true",
            "$": "https://api.elsevier.com/content/object/eid/1-s2.0-S0021951724002148-ga1.jpg?httpAccept=%2A%2F%2A",
            "@multimediatype": "JPEG image file",
            "@type": "IMAGE-DOWNSAMPLED",
            "@size": "22272",
            "@ref": "ga1",
            "@mimetype": "image/jpeg"
          },
          {
            "@category": "standard",
            "@height": "320",
            "@width": "383",
            "@_fa": "true",
            "$": "https://api.elsevier.com/content/object/eid/1-s2.0-S0021951724002148-gr1.jpg?httpAccept=%2A%2F%2A",
            "@multimediatype": "JPEG image file",
            "@type": "IMAGE-DOWNSAMPLED",
            "@size": "28569",
            "@ref": "gr1",
            "@mimetype": "image/jpeg"
          },
          {
            "@category": "standard",
            "@height": "436",
            "@width": "535",
            "@_fa": "true",
            "$": "https://api.elsevier.com/content/object/eid/1-s2.0-S0021951724002148-gr2.jpg?httpAccept=%2A%2F%2A",
            "@multimediatype": "JPEG image file",
            "@type": "IMAGE-DOWNSAMPLED",
            "@size": "67586",
            "@ref": "gr2",
            "@mimetype": "image/jpeg"
          },
          {
            "@category": "standard",
            "@height": "323",
            "@width": "383",
            "@_fa": "true",
            "$": "https://api.elsevier.com/content/object/eid/1-s2.0-S0021951724002148-gr3.jpg?httpAccept=%2A%2F%2A",
            "@multimediatype": "JPEG image file",
            "@type": "IMAGE-DOWNSAMPLED",
            "@size": "38632",
            "@ref": "gr3",
            "@mimetype": "image/jpeg"
          },
          {
            "@category": "standard",
            "@height": "555",
            "@width": "628",
            "@_fa": "true",
            "$": "https://api.elsevier.com/content/object/eid/1-s2.0-S0021951724002148-gr4.jpg?httpAccept=%2A%2F%2A",
            "@multimediatype": "JPEG image file",
            "@type": "IMAGE-DOWNSAMPLED",
            "@size": "66539",
            "@ref": "gr4",
            "@mimetype": "image/jpeg"
          },
          {
            "@category": "standard",
            "@height": "537",
            "@width": "680",
            "@_fa": "true",
            "$": "https://api.elsevier.com/content/object/eid/1-s2.0-S0021951724002148-gr5.jpg?httpAccept=%2A%2F%2A",
            "@multimediatype": "JPEG image file",
            "@type": "IMAGE-DOWNSAMPLED",
            "@size": "87693",
            "@ref": "gr5",
            "@mimetype": "image/jpeg"
          },
          {
            "@category": "standard",
            "@height": "480",
            "@width": "535",
            "@_fa": "true",
            "$": "https://api.elsevier.com/content/object/eid/1-s2.0-S0021951724002148-gr6.jpg?httpAccept=%2A%2F%2A",
            "@multimediatype": "JPEG image file",
            "@type": "IMAGE-DOWNSAMPLED",
            "@size": "53457",
            "@ref": "gr6",
            "@mimetype": "image/jpeg"
          },
          {
            "@category": "standard",
            "@height": "427",
            "@width": "535",
            "@_fa": "true",
            "$": "https://api.elsevier.com/content/object/eid/1-s2.0-S0021951724002148-gr7.jpg?httpAccept=%2A%2F%2A",
            "@multimediatype": "JPEG image file",
            "@type": "IMAGE-DOWNSAMPLED",
            "@size": "37267",
            "@ref": "gr7",
            "@mimetype": "image/jpeg"
          },
          {
            "@category": "standard",
            "@height": "733",
            "@width": "796",
            "@_fa": "true",
            "$": "https://api.elsevier.com/content/object/eid/1-s2.0-S0021951724002148-gr8.jpg?httpAccept=%2A%2F%2A",
            "@multimediatype": "JPEG image file",
            "@type": "IMAGE-DOWNSAMPLED",
            "@size": "269026",
            "@ref": "gr8",
            "@mimetype": "image/jpeg"
          },
          {
            "@category": "standard",
            "@height": "403",
            "@width": "535",
            "@_fa": "true",
            "$": "https://api.elsevier.com/content/object/eid/1-s2.0-S0021951724002148-gr9.jpg?httpAccept=%2A%2F%2A",
            "@multimediatype": "JPEG image file",
            "@type": "IMAGE-DOWNSAMPLED",
            "@size": "75604",
            "@ref": "gr9",
            "@mimetype": "image/jpeg"
          },
          {
            "@category": "thumbnail",
            "@height": "130",
            "@width": "219",
            "@_fa": "true",
            "$": "https://api.elsevier.com/content/object/eid/1-s2.0-S0021951724002148-gr13.sml?httpAccept=%2A%2F%2A",
            "@multimediatype": "GIF image file",
            "@type": "IMAGE-THUMBNAIL",
            "@size": "9907",
            "@ref": "gr13",
            "@mimetype": "image/gif"
          },
          {
            "@category": "thumbnail",
            "@height": "161",
            "@width": "219",
            "@_fa": "true",
            "$": "https://api.elsevier.com/content/object/eid/1-s2.0-S0021951724002148-gr14.sml?httpAccept=%2A%2F%2A",
            "@multimediatype": "GIF image file",
            "@type": "IMAGE-THUMBNAIL",
            "@size": "6350",
            "@ref": "gr14",
            "@mimetype": "image/gif"
          },
          {
            "@category": "thumbnail",
            "@height": "158",
            "@width": "219",
            "@_fa": "true",
            "$": "https://api.elsevier.com/content/object/eid/1-s2.0-S0021951724002148-gr11.sml?httpAccept=%2A%2F%2A",
            "@multimediatype": "GIF image file",
            "@type": "IMAGE-THUMBNAIL",
            "@size": "10194",
            "@ref": "gr11",
            "@mimetype": "image/gif"
          },
          {
            "@category": "thumbnail",
            "@height": "156",
            "@width": "219",
            "@_fa": "true",
            "$": "https://api.elsevier.com/content/object/eid/1-s2.0-S0021951724002148-gr12.sml?httpAccept=%2A%2F%2A",
            "@multimediatype": "GIF image file",
            "@type": "IMAGE-THUMBNAIL",
            "@size": "8872",
            "@ref": "gr12",
            "@mimetype": "image/gif"
          },
          {
            "@category": "thumbnail",
            "@height": "150",
            "@width": "219",
            "@_fa": "true",
            "$": "https://api.elsevier.com/content/object/eid/1-s2.0-S0021951724002148-gr10.sml?httpAccept=%2A%2F%2A",
            "@multimediatype": "GIF image file",
            "@type": "IMAGE-THUMBNAIL",
            "@size": "10622",
            "@ref": "gr10",
            "@mimetype": "image/gif"
          },
          {
            "@category": "thumbnail",
            "@height": "116",
            "@width": "219",
            "@_fa": "true",
            "$": "https://api.elsevier.com/content/object/eid/1-s2.0-S0021951724002148-ga1.sml?httpAccept=%2A%2F%2A",
            "@multimediatype": "GIF image file",
            "@type": "IMAGE-THUMBNAIL",
            "@size": "9574",
            "@ref": "ga1",
            "@mimetype": "image/gif"
          },
          {
            "@category": "thumbnail",
            "@height": "164",
            "@width": "196",
            "@_fa": "true",
            "$": "https://api.elsevier.com/content/object/eid/1-s2.0-S0021951724002148-gr1.sml?httpAccept=%2A%2F%2A",
            "@multimediatype": "GIF image file",
            "@type": "IMAGE-THUMBNAIL",
            "@size": "6614",
            "@ref": "gr1",
            "@mimetype": "image/gif"
          },
          {
            "@category": "thumbnail",
            "@height": "164",
            "@width": "201",
            "@_fa": "true",
            "$": "https://api.elsevier.com/content/object/eid/1-s2.0-S0021951724002148-gr2.sml?httpAccept=%2A%2F%2A",
            "@multimediatype": "GIF image file",
            "@type": "IMAGE-THUMBNAIL",
            "@size": "10050",
            "@ref": "gr2",
            "@mimetype": "image/gif"
          },
          {
            "@category": "thumbnail",
            "@height": "164",
            "@width": "195",
            "@_fa": "true",
            "$": "https://api.elsevier.com/content/object/eid/1-s2.0-S0021951724002148-gr3.sml?httpAccept=%2A%2F%2A",
            "@multimediatype": "GIF image file",
            "@type": "IMAGE-THUMBNAIL",
            "@size": "9243",
            "@ref": "gr3",
            "@mimetype": "image/gif"
          },
          {
            "@category": "thumbnail",
            "@height": "164",
            "@width": "185",
            "@_fa": "true",
            "$": "https://api.elsevier.com/content/object/eid/1-s2.0-S0021951724002148-gr4.sml?httpAccept=%2A%2F%2A",
            "@multimediatype": "GIF image file",
            "@type": "IMAGE-THUMBNAIL",
            "@size": "8748",
            "@ref": "gr4",
            "@mimetype": "image/gif"
          },
          {
            "@category": "thumbnail",
            "@height": "164",
            "@width": "207",
            "@_fa": "true",
            "$": "https://api.elsevier.com/content/object/eid/1-s2.0-S0021951724002148-gr5.sml?httpAccept=%2A%2F%2A",
            "@multimediatype": "GIF image file",
            "@type": "IMAGE-THUMBNAIL",
            "@size": "12464",
            "@ref": "gr5",
            "@mimetype": "image/gif"
          },
          {
            "@category": "thumbnail",
            "@height": "164",
            "@width": "183",
            "@_fa": "true",
            "$": "https://api.elsevier.com/content/object/eid/1-s2.0-S0021951724002148-gr6.sml?httpAccept=%2A%2F%2A",
            "@multimediatype": "GIF image file",
            "@type": "IMAGE-THUMBNAIL",
            "@size": "9275",
            "@ref": "gr6",
            "@mimetype": "image/gif"
          },
          {
            "@category": "thumbnail",
            "@height": "164",
            "@width": "205",
            "@_fa": "true",
            "$": "https://api.elsevier.com/content/object/eid/1-s2.0-S0021951724002148-gr7.sml?httpAccept=%2A%2F%2A",
            "@multimediatype": "GIF image file",
            "@type": "IMAGE-THUMBNAIL",
            "@size": "8103",
            "@ref": "gr7",
            "@mimetype": "image/gif"
          },
          {
            "@category": "thumbnail",
            "@height": "164",
            "@width": "178",
            "@_fa": "true",
            "$": "https://api.elsevier.com/content/object/eid/1-s2.0-S0021951724002148-gr8.sml?httpAccept=%2A%2F%2A",
            "@multimediatype": "GIF image file",
            "@type": "IMAGE-THUMBNAIL",
            "@size": "22943",
            "@ref": "gr8",
            "@mimetype": "image/gif"
          },
          {
            "@category": "thumbnail",
            "@height": "164",
            "@width": "217",
            "@_fa": "true",
            "$": "https://api.elsevier.com/content/object/eid/1-s2.0-S0021951724002148-gr9.sml?httpAccept=%2A%2F%2A",
            "@multimediatype": "GIF image file",
            "@type": "IMAGE-THUMBNAIL",
            "@size": "17244",
            "@ref": "gr9",
            "@mimetype": "image/gif"
          },
          {
            "@category": "high",
            "@height": "1411",
            "@width": "2368",
            "@_fa": "true",
            "$": "https://api.elsevier.com/content/object/eid/1-s2.0-S0021951724002148-gr13_lrg.jpg?httpAccept=%2A%2F%2A",
            "@multimediatype": "JPEG image file",
            "@type": "IMAGE-HIGH-RES",
            "@size": "377626",
            "@ref": "gr13",
            "@mimetype": "image/jpeg"
          },
          {
            "@category": "high",
            "@height": "1737",
            "@width": "2368",
            "@_fa": "true",
            "$": "https://api.elsevier.com/content/object/eid/1-s2.0-S0021951724002148-gr14_lrg.jpg?httpAccept=%2A%2F%2A",
            "@multimediatype": "JPEG image file",
            "@type": "IMAGE-HIGH-RES",
            "@size": "199950",
            "@ref": "gr14",
            "@mimetype": "image/jpeg"
          },
          {
            "@category": "high",
            "@height": "1710",
            "@width": "2368",
            "@_fa": "true",
            "$": "https://api.elsevier.com/content/object/eid/1-s2.0-S0021951724002148-gr11_lrg.jpg?httpAccept=%2A%2F%2A",
            "@multimediatype": "JPEG image file",
            "@type": "IMAGE-HIGH-RES",
            "@size": "382332",
            "@ref": "gr11",
            "@mimetype": "image/jpeg"
          },
          {
            "@category": "high",
            "@height": "1213",
            "@width": "1699",
            "@_fa": "true",
            "$": "https://api.elsevier.com/content/object/eid/1-s2.0-S0021951724002148-gr12_lrg.jpg?httpAccept=%2A%2F%2A",
            "@multimediatype": "JPEG image file",
            "@type": "IMAGE-HIGH-RES",
            "@size": "214243",
            "@ref": "gr12",
            "@mimetype": "image/jpeg"
          },
          {
            "@category": "high",
            "@height": "1621",
            "@width": "2368",
            "@_fa": "true",
            "$": "https://api.elsevier.com/content/object/eid/1-s2.0-S0021951724002148-gr10_lrg.jpg?httpAccept=%2A%2F%2A",
            "@multimediatype": "JPEG image file",
            "@type": "IMAGE-HIGH-RES",
            "@size": "423373",
            "@ref": "gr10",
            "@mimetype": "image/jpeg"
          },
          {
            "@category": "high",
            "@height": "886",
            "@width": "1674",
            "@_fa": "true",
            "$": "https://api.elsevier.com/content/object/eid/1-s2.0-S0021951724002148-ga1_lrg.jpg?httpAccept=%2A%2F%2A",
            "@multimediatype": "JPEG image file",
            "@type": "IMAGE-HIGH-RES",
            "@size": "129482",
            "@ref": "ga1",
            "@mimetype": "image/jpeg"
          },
          {
            "@category": "high",
            "@height": "1418",
            "@width": "1699",
            "@_fa": "true",
            "$": "https://api.elsevier.com/content/object/eid/1-s2.0-S0021951724002148-gr1_lrg.jpg?httpAccept=%2A%2F%2A",
            "@multimediatype": "JPEG image file",
            "@type": "IMAGE-HIGH-RES",
            "@size": "198147",
            "@ref": "gr1",
            "@mimetype": "image/jpeg"
          },
          {
            "@category": "high",
            "@height": "1929",
            "@width": "2368",
            "@_fa": "true",
            "$": "https://api.elsevier.com/content/object/eid/1-s2.0-S0021951724002148-gr2_lrg.jpg?httpAccept=%2A%2F%2A",
            "@multimediatype": "JPEG image file",
            "@type": "IMAGE-HIGH-RES",
            "@size": "489183",
            "@ref": "gr2",
            "@mimetype": "image/jpeg"
          },
          {
            "@category": "high",
            "@height": "1431",
            "@width": "1699",
            "@_fa": "true",
            "$": "https://api.elsevier.com/content/object/eid/1-s2.0-S0021951724002148-gr3_lrg.jpg?httpAccept=%2A%2F%2A",
            "@multimediatype": "JPEG image file",
            "@type": "IMAGE-HIGH-RES",
            "@size": "274745",
            "@ref": "gr3",
            "@mimetype": "image/jpeg"
          },
          {
            "@category": "high",
            "@height": "2459",
            "@width": "2782",
            "@_fa": "true",
            "$": "https://api.elsevier.com/content/object/eid/1-s2.0-S0021951724002148-gr4_lrg.jpg?httpAccept=%2A%2F%2A",
            "@multimediatype": "JPEG image file",
            "@type": "IMAGE-HIGH-RES",
            "@size": "466464",
            "@ref": "gr4",
            "@mimetype": "image/jpeg"
          },
          {
            "@category": "high",
            "@height": "2377",
            "@width": "3009",
            "@_fa": "true",
            "$": "https://api.elsevier.com/content/object/eid/1-s2.0-S0021951724002148-gr5_lrg.jpg?httpAccept=%2A%2F%2A",
            "@multimediatype": "JPEG image file",
            "@type": "IMAGE-HIGH-RES",
            "@size": "617186",
            "@ref": "gr5",
            "@mimetype": "image/jpeg"
          },
          {
            "@category": "high",
            "@height": "2124",
            "@width": "2368",
            "@_fa": "true",
            "$": "https://api.elsevier.com/content/object/eid/1-s2.0-S0021951724002148-gr6_lrg.jpg?httpAccept=%2A%2F%2A",
            "@multimediatype": "JPEG image file",
            "@type": "IMAGE-HIGH-RES",
            "@size": "372613",
            "@ref": "gr6",
            "@mimetype": "image/jpeg"
          },
          {
            "@category": "high",
            "@height": "1891",
            "@width": "2368",
            "@_fa": "true",
            "$": "https://api.elsevier.com/content/object/eid/1-s2.0-S0021951724002148-gr7_lrg.jpg?httpAccept=%2A%2F%2A",
            "@multimediatype": "JPEG image file",
            "@type": "IMAGE-HIGH-RES",
            "@size": "260753",
            "@ref": "gr7",
            "@mimetype": "image/jpeg"
          },
          {
            "@category": "high",
            "@height": "1948",
            "@width": "2115",
            "@_fa": "true",
            "$": "https://api.elsevier.com/content/object/eid/1-s2.0-S0021951724002148-gr8_lrg.jpg?httpAccept=%2A%2F%2A",
            "@multimediatype": "JPEG image file",
            "@type": "IMAGE-HIGH-RES",
            "@size": "1123974",
            "@ref": "gr8",
            "@mimetype": "image/jpeg"
          },
          {
            "@category": "high",
            "@height": "1785",
            "@width": "2368",
            "@_fa": "true",
            "$": "https://api.elsevier.com/content/object/eid/1-s2.0-S0021951724002148-gr9_lrg.jpg?httpAccept=%2A%2F%2A",
            "@multimediatype": "JPEG image file",
            "@type": "IMAGE-HIGH-RES",
            "@size": "524085",
            "@ref": "gr9",
            "@mimetype": "image/jpeg"
          },
          {
            "@category": "standard",
            "@_fa": "true",
            "$": "https://api.elsevier.com/content/object/eid/1-s2.0-S0021951724002148-mmc1.docx?httpAccept=%2A%2F%2A",
            "@multimediatype": "Microsoft Word file",
            "@type": "APPLICATION",
            "@size": "3328133",
            "@ref": "mmc1",
            "@mimetype": "application/word"
          },
          {
            "@category": "thumbnail",
            "@_fa": "true",
            "$": "https://api.elsevier.com/content/object/eid/1-s2.0-S0021951724002148-si1.svg?httpAccept=%2A%2F%2A",
            "@multimediatype": "Scalable Vector Graphics file",
            "@type": "ALTIMG",
            "@size": "17131",
            "@ref": "si1",
            "@mimetype": "image/svg+xml"
          },
          {
            "@category": "thumbnail",
            "@_fa": "true",
            "$": "https://api.elsevier.com/content/object/eid/1-s2.0-S0021951724002148-si10.svg?httpAccept=%2A%2F%2A",
            "@multimediatype": "Scalable Vector Graphics file",
            "@type": "ALTIMG",
            "@size": "8377",
            "@ref": "si10",
            "@mimetype": "image/svg+xml"
          },
          {
            "@category": "thumbnail",
            "@_fa": "true",
            "$": "https://api.elsevier.com/content/object/eid/1-s2.0-S0021951724002148-si11.svg?httpAccept=%2A%2F%2A",
            "@multimediatype": "Scalable Vector Graphics file",
            "@type": "ALTIMG",
            "@size": "9301",
            "@ref": "si11",
            "@mimetype": "image/svg+xml"
          },
          {
            "@category": "thumbnail",
            "@_fa": "true",
            "$": "https://api.elsevier.com/content/object/eid/1-s2.0-S0021951724002148-si2.svg?httpAccept=%2A%2F%2A",
            "@multimediatype": "Scalable Vector Graphics file",
            "@type": "ALTIMG",
            "@size": "17085",
            "@ref": "si2",
            "@mimetype": "image/svg+xml"
          },
          {
            "@category": "thumbnail",
            "@_fa": "true",
            "$": "https://api.elsevier.com/content/object/eid/1-s2.0-S0021951724002148-si3.svg?httpAccept=%2A%2F%2A",
            "@multimediatype": "Scalable Vector Graphics file",
            "@type": "ALTIMG",
            "@size": "18008",
            "@ref": "si3",
            "@mimetype": "image/svg+xml"
          },
          {
            "@category": "thumbnail",
            "@_fa": "true",
            "$": "https://api.elsevier.com/content/object/eid/1-s2.0-S0021951724002148-si4.svg?httpAccept=%2A%2F%2A",
            "@multimediatype": "Scalable Vector Graphics file",
            "@type": "ALTIMG",
            "@size": "8795",
            "@ref": "si4",
            "@mimetype": "image/svg+xml"
          },
          {
            "@category": "thumbnail",
            "@_fa": "true",
            "$": "https://api.elsevier.com/content/object/eid/1-s2.0-S0021951724002148-si5.svg?httpAccept=%2A%2F%2A",
            "@multimediatype": "Scalable Vector Graphics file",
            "@type": "ALTIMG",
            "@size": "17634",
            "@ref": "si5",
            "@mimetype": "image/svg+xml"
          },
          {
            "@category": "thumbnail",
            "@_fa": "true",
            "$": "https://api.elsevier.com/content/object/eid/1-s2.0-S0021951724002148-si6.svg?httpAccept=%2A%2F%2A",
            "@multimediatype": "Scalable Vector Graphics file",
            "@type": "ALTIMG",
            "@size": "27351",
            "@ref": "si6",
            "@mimetype": "image/svg+xml"
          },
          {
            "@category": "thumbnail",
            "@_fa": "true",
            "$": "https://api.elsevier.com/content/object/eid/1-s2.0-S0021951724002148-si7.svg?httpAccept=%2A%2F%2A",
            "@multimediatype": "Scalable Vector Graphics file",
            "@type": "ALTIMG",
            "@size": "35429",
            "@ref": "si7",
            "@mimetype": "image/svg+xml"
          },
          {
            "@category": "thumbnail",
            "@_fa": "true",
            "$": "https://api.elsevier.com/content/object/eid/1-s2.0-S0021951724002148-si8.svg?httpAccept=%2A%2F%2A",
            "@multimediatype": "Scalable Vector Graphics file",
            "@type": "ALTIMG",
            "@size": "18622",
            "@ref": "si8",
            "@mimetype": "image/svg+xml"
          },
          {
            "@category": "thumbnail",
            "@_fa": "true",
            "$": "https://api.elsevier.com/content/object/eid/1-s2.0-S0021951724002148-si9.svg?httpAccept=%2A%2F%2A",
            "@multimediatype": "Scalable Vector Graphics file",
            "@type": "ALTIMG",
            "@size": "14017",
            "@ref": "si9",
            "@mimetype": "image/svg+xml"
          },
          {
            "@category": "standard",
            "@_fa": "true",
            "$": "https://api.elsevier.com/content/object/eid/1-s2.0-S0021951724002148-am.pdf?httpAccept=%2A%2F%2A",
            "@multimediatype": "Acrobat PDF file",
            "@type": "AAM-PDF",
            "@size": "2865502",
            "@ref": "am",
            "@mimetype": "application/pdf"
          }
        ]
      },
      "link": {
        "@rel": "abstract",
        "@href": "https://api.elsevier.com/content/abstract/scopus_id/85190891828"
      }
    }
  }
}