{
  "metadata": {
    "title": "Ti<ce:inf loc=post>3</ce:inf>C<ce:inf loc=post>2</ce:inf> MXene as heterogeneous catalyst for carbodiimides guanylation with over 10<ce:sup loc=post>2</ce:sup> h<ce:sup loc=post>−1</ce:sup> turnover frequencies",
    "authors": "; ; ",
    "journal": "Journal of Catalysis",
    "date": "2025-10-31",
    "doi": "10.1016/j.jcat.2025.116328",
    "abstract": "",
    "uri": "https://api.elsevier.com/content/article/pii/S002195172500394X",
    "pii": "S002195172500394X"
  },
  "fulltext": {
    "full-text-retrieval-response": {
      "scopus-eid": "2-s2.0-105011295015",
      "originalText": "serial JL 272561 291210 291744 291809 31 90 Journal of Catalysis JOURNALCATALYSIS 2025-07-17 2025-07-17 2025-07-24 2025-07-24 2025-08-08T04:43:02 1-s2.0-S002195172500394X S0021-9517(25)00394-X S002195172500394X 10.1016/j.jcat.2025.116328 S300 S300.1 FULL-TEXT 1-s2.0-S0021951725X00087 2025-08-08T03:54:43.289086Z 0 0 20251001 20251031 2025 2025-07-17T01:27:05.988725Z absattachment articleinfo articlenumber articletitlenorm authfirstinitialnorm authfirstsurnamenorm cid cids contenttype copyright crossmark dateloaded dateloadedtxt datesearch datesort dateupdated dco docsubtype doctype doi eid ewtransactionid fundingbodyid hubeid indexeddate issn issnnorm itemstage itemtransactionid itemweight oauserlicense openaccess openarchive pg pgfirst pii piinorm pubdateend pubdatestart pubdatetxt pubyr sectiontitle sortorder sponsoredaccesstype srctitle srctitlenorm srctype ssids alllist content oa subj subheadings suppl tomb volfirst volissue volumelist webpdf webpdfpagecount yearnav figure table e-component body mmlmath acknowledge affil appendices articletitle auth authfirstini authfull authkeywords authlast grantnumber grantsponsor grantsponsorid highlightsabst orcid primabst pubtype ref specialabst 0021-9517 00219517 UNLIMITED SPCRUEHY25 true 450 450 C Volume 450 83 116328 116328 116328 202510 October 2025 2025-10-01 2025-10-31 2025 Regular Articles article fla © 2025 The Author(s). Published by Elsevier Inc. TI3C2MXENEHETEROGENEOUSCATALYSTFORCARBODIIMIDESGUANYLATIONOVER102H1TURNOVERFREQUENCIES ANOUAR A 1 Introduction 2 Results and discussion 2.1 Catalytic activity 2.2 Nature of the active sites 2.3 Reaction scope 2.4 DFT calculations 2.4.1 Energetic profile of the reaction coordinate 3 Conclusions 4 Materials and methods CRediT authorship contribution statement Acknowledgements Appendix A Supplementary material References HUANG 2017 695 702 L ALONSOMORENO 2014 3406 3425 C PROTASOV 2017 2543 2551 A WANG 2024 102393 J KURZER 1967 107 152 F HOPKINS 2002 167 174 T ZHANG 2015 254 265 W VARDHANAPU 2018 2602 2608 P GRIRRANE 2013 1455 1462 A GAO 2021 5324 5329 Y KARMAKAR 2022 4501 4509 H SCHEUER 1995 2627 2629 S ELORRIAGA 2013 8223 8230 D XU 2015 1787 1801 L ONG 2003 8100 8101 T FRINDY 2016 3863 3869 S KANTAM 2012 5730 5737 M ABBASI 2017 e3695 S GRIRRANE 2012 14934 14938 A AUGUSTINE 2017 81 90 R HETEROGENEOUSCATALYSISINORGANICSYNTHESISINCATALYSISORGANICREACTIONS NAGUIB 2021 2103393 M SCHULTZ 2019 6590 6597 T GHIDIU 2014 78 81 M RAMIREZGRAU 2025 3315 3332 R MASHTALIR 2023 359 377 O MXENES INTERCALATIONDELAMINATIONLAYEREDCARBIDESCARBONITRIDES KVASHINA 2020 592 594 T LIM 2022 601 614 K IBRAGIMOVA 2022 2896 2906 R ZHANG 2024 134561 H LIPATOV 2016 1600255 A KRUGER 2024 2307106 D HAYASHI 1997 724 732 S NAGUIB 2013 15966 15969 M GRAU 2023 20314 20323 R DHAKSHINAMOORTHY 2024 e202400576 A ALHABEB 2017 7633 7644 M ZAMAN 2021 e2108325118 W ALONZO 2024 S LIU 2021 111 118 L DRISCOLL 2018 10419 10429 N HE 2020 119006 F NATU 2021 1224 1251 V DHAKSHINAMOORTHY 2023 e202204016 A MASHTALIR 2013 1716 O WROBEL 2002 135 138 N NIETHER 2019 117 D MALAKI 2019 10843 10857 M MARQUIS 2023 16 E SEREDYCH 2019 3324 3332 M BYUN 2022 860 868 M ARENA 1998 127 137 F SELIG 2013 703 718 P XIA 2019 23330 23337 F MENGXIA 2002 2817 2826 X KHAZAEI 2017 2488 2503 M ANOUARX2025X116328 ANOUARX2025X116328XA Full 2025-07-15T15:27:18Z ElsevierWaived Spain (CRUE): Core Hybrid journals RAP 2025 http://creativecommons.org/licenses/by-nc-nd/4.0/ 2027-07-24T00:00:00.000Z 2027-07-24T00:00:00.000Z http://creativecommons.org/licenses/by-nc-nd/4.0/ This is an open access article under the CC BY-NC-ND license. © 2025 The Author(s). Published by Elsevier Inc. 2025-07-26T01:32:49.908Z http://vtw.elsevier.com/data/voc/AddOnTypes/50.7/aggregated-refined 2021/038 Generalitat of Valencia http://data.elsevier.com/vocabulary/SciValFunders/501100003359 http://sws.geonames.org/2510769 Spanish Ministry of Science and Innovation CEX-2021-001230-S MICINN Ministerio de Ciencia e Innovación http://data.elsevier.com/vocabulary/SciValFunders/501100004837 http://sws.geonames.org/2510769/ ERC 101141466 ERC European Research Council http://data.elsevier.com/vocabulary/SciValFunders/501100000781 http://sws.geonames.org/6695072/ PDI2021-0126071-OB-CO21 Agencia Estatal de Investigacion http://data.elsevier.com/vocabulary/SciValFunders/501100011033 http://sws.geonames.org/2510769 European Union EU European Commission http://data.elsevier.com/vocabulary/SciValFunders/501100000780 http://sws.geonames.org/6695072/ Directorate-General XII, Science, Research, and Development http://data.elsevier.com/vocabulary/SciValFunders/501100012517 http://sws.geonames.org/2921044 Financial support by the Spanish Ministry of Science and Innovation ( CEX-2021-001230-S and PDI2021-0126071-OB-CO21 funded by MCIN/AEI/ 10.13039/501100011033 ), Generalitat Valenciana (Prometeo 2021/038 and Advanced Materials programme Graphica MFA/2022/023 with funding from European Union NextGenerationEU PRTR-C17.I1 ) and European Commission through the ERC Adv . Grant 101141466 DISCOVERY is gratefully acknowledged. Pablo Garc\\u00EDa-Aznarand Germ\\u00E1n Sastre f would like to thank ASIC-UPV and SGAI-CSIC for the use of their computational facilities. We also thank MICIN for the Severo Ochoa Excellence Research Grant. item S0021-9517(25)00394-X S002195172500394X 1-s2.0-S002195172500394X 10.1016/j.jcat.2025.116328 272561 2025-08-08T03:54:43.289086Z 2025-10-01 2025-10-31 UNLIMITED SPCRUEHY25 1-s2.0-S002195172500394X-main.pdf https://s3-eu-west-1.amazonaws.com/prod-ucs-content-store-eu-west/content/pii:S002195172500394X/MAIN/application/pdf/1b4812547b4ec73024461dace10e0a18/main.pdf main.pdf pdf true 9637482 MAIN 13 1-s2.0-S002195172500394X-main_1.png https://s3-eu-west-1.amazonaws.com/prod-ucs-content-store-eu-west/content/pii:S002195172500394X/PREVIEW/image/png/3f114fa360b3bd340e8128db3c1dfae3/main_1.png main_1.png png 58066 928 656 IMAGE-WEB-PDF 1 1-s2.0-S002195172500394X-sc1.jpg https://s3-eu-west-1.amazonaws.com/prod-ucs-content-store-eu-west/content/pii:S002195172500394X/sc1/DOWNSAMPLED/image/jpeg/a127ca6bc60c1a89c85dcb0b2efe2ecb/sc1.jpg sc1 sc1.jpg jpg 61930 397 685 IMAGE-DOWNSAMPLED 1-s2.0-S002195172500394X-sc2.jpg https://s3-eu-west-1.amazonaws.com/prod-ucs-content-store-eu-west/content/pii:S002195172500394X/sc2/DOWNSAMPLED/image/jpeg/8130ed98197da9661d58c6938934a652/sc2.jpg sc2 sc2.jpg jpg 36203 396 704 IMAGE-DOWNSAMPLED 1-s2.0-S002195172500394X-gr1.jpg https://s3-eu-west-1.amazonaws.com/prod-ucs-content-store-eu-west/content/pii:S002195172500394X/gr1/DOWNSAMPLED/image/jpeg/44885beec0e2c4a5bdcad24cbf2537ab/gr1.jpg gr1 gr1.jpg jpg 117793 548 749 IMAGE-DOWNSAMPLED 1-s2.0-S002195172500394X-gr2.jpg https://s3-eu-west-1.amazonaws.com/prod-ucs-content-store-eu-west/content/pii:S002195172500394X/gr2/DOWNSAMPLED/image/jpeg/88fbc16be9fdfd9fc0cd046e5472e0c9/gr2.jpg gr2 gr2.jpg jpg 80105 382 778 IMAGE-DOWNSAMPLED 1-s2.0-S002195172500394X-gr3.jpg https://s3-eu-west-1.amazonaws.com/prod-ucs-content-store-eu-west/content/pii:S002195172500394X/gr3/DOWNSAMPLED/image/jpeg/27b5ec75eb20c7498da399530decf0cc/gr3.jpg gr3 gr3.jpg jpg 37214 291 766 IMAGE-DOWNSAMPLED 1-s2.0-S002195172500394X-fx1.jpg https://s3-eu-west-1.amazonaws.com/prod-ucs-content-store-eu-west/content/pii:S002195172500394X/fx1/DOWNSAMPLED/image/jpeg/46b1fc7f82e0b8b4576238c1e72cff68/fx1.jpg fx1 fx1.jpg jpg 14443 258 698 IMAGE-DOWNSAMPLED 1-s2.0-S002195172500394X-ga1.jpg https://s3-eu-west-1.amazonaws.com/prod-ucs-content-store-eu-west/content/pii:S002195172500394X/ga1/DOWNSAMPLED/image/jpeg/aeec03ca0ee1ab3d4730e52f038accc1/ga1.jpg ga1 true ga1.jpg jpg 22587 179 500 IMAGE-DOWNSAMPLED 1-s2.0-S002195172500394X-gr4.jpg https://s3-eu-west-1.amazonaws.com/prod-ucs-content-store-eu-west/content/pii:S002195172500394X/gr4/DOWNSAMPLED/image/jpeg/ceb35dfdb98a0bf3241991e6fb0270c8/gr4.jpg gr4 gr4.jpg jpg 19741 222 534 IMAGE-DOWNSAMPLED 1-s2.0-S002195172500394X-gr5.jpg https://s3-eu-west-1.amazonaws.com/prod-ucs-content-store-eu-west/content/pii:S002195172500394X/gr5/DOWNSAMPLED/image/jpeg/54f4ec2a02a3e0cf5ae3911ef20d8ada/gr5.jpg gr5 gr5.jpg jpg 85331 761 793 IMAGE-DOWNSAMPLED 1-s2.0-S002195172500394X-gr6.jpg https://s3-eu-west-1.amazonaws.com/prod-ucs-content-store-eu-west/content/pii:S002195172500394X/gr6/DOWNSAMPLED/image/jpeg/4000b376a22dacc509c303988902fe95/gr6.jpg gr6 gr6.jpg jpg 32535 200 714 IMAGE-DOWNSAMPLED 1-s2.0-S002195172500394X-gr7.jpg https://s3-eu-west-1.amazonaws.com/prod-ucs-content-store-eu-west/content/pii:S002195172500394X/gr7/DOWNSAMPLED/image/jpeg/43ec2ef9d5eeb37eb027bebb0f37380b/gr7.jpg gr7 gr7.jpg jpg 15968 310 628 IMAGE-DOWNSAMPLED 1-s2.0-S002195172500394X-gr8.jpg https://s3-eu-west-1.amazonaws.com/prod-ucs-content-store-eu-west/content/pii:S002195172500394X/gr8/DOWNSAMPLED/image/jpeg/a5dc81b6650d80042e9413a0249eea8a/gr8.jpg gr8 gr8.jpg jpg 28147 352 706 IMAGE-DOWNSAMPLED 1-s2.0-S002195172500394X-sc1.sml https://s3-eu-west-1.amazonaws.com/prod-ucs-content-store-eu-west/content/pii:S002195172500394X/sc1/THUMBNAIL/image/gif/5c6ed3bafb44a2592cd77bf577f306ec/sc1.sml sc1 sc1.sml sml 10546 127 219 IMAGE-THUMBNAIL 1-s2.0-S002195172500394X-sc2.sml https://s3-eu-west-1.amazonaws.com/prod-ucs-content-store-eu-west/content/pii:S002195172500394X/sc2/THUMBNAIL/image/gif/3a3b44c891c4f28514b5e60927132955/sc2.sml sc2 sc2.sml sml 4389 123 219 IMAGE-THUMBNAIL 1-s2.0-S002195172500394X-gr1.sml https://s3-eu-west-1.amazonaws.com/prod-ucs-content-store-eu-west/content/pii:S002195172500394X/gr1/THUMBNAIL/image/gif/12645eeb65cc77a27b78d69390e0f4df/gr1.sml gr1 gr1.sml sml 19249 160 219 IMAGE-THUMBNAIL 1-s2.0-S002195172500394X-gr2.sml https://s3-eu-west-1.amazonaws.com/prod-ucs-content-store-eu-west/content/pii:S002195172500394X/gr2/THUMBNAIL/image/gif/622ead90237725fd7bd4e9104d9a31d2/gr2.sml gr2 gr2.sml sml 8530 107 219 IMAGE-THUMBNAIL 1-s2.0-S002195172500394X-gr3.sml https://s3-eu-west-1.amazonaws.com/prod-ucs-content-store-eu-west/content/pii:S002195172500394X/gr3/THUMBNAIL/image/gif/b3d201eebb4de337ead0349d4b0f1aef/gr3.sml gr3 gr3.sml sml 4334 83 219 IMAGE-THUMBNAIL 1-s2.0-S002195172500394X-fx1.sml https://s3-eu-west-1.amazonaws.com/prod-ucs-content-store-eu-west/content/pii:S002195172500394X/fx1/THUMBNAIL/image/gif/0f50799ff352d3117ce71ec7a19a574e/fx1.sml fx1 fx1.sml sml 1719 81 219 IMAGE-THUMBNAIL 1-s2.0-S002195172500394X-ga1.sml https://s3-eu-west-1.amazonaws.com/prod-ucs-content-store-eu-west/content/pii:S002195172500394X/ga1/THUMBNAIL/image/gif/50796d8801fc4fc68d28ad1479d32ece/ga1.sml ga1 true ga1.sml sml 6040 79 219 IMAGE-THUMBNAIL 1-s2.0-S002195172500394X-gr4.sml https://s3-eu-west-1.amazonaws.com/prod-ucs-content-store-eu-west/content/pii:S002195172500394X/gr4/THUMBNAIL/image/gif/80584fde7a50e26cd374825b1bc2935a/gr4.sml gr4 gr4.sml sml 3997 91 219 IMAGE-THUMBNAIL 1-s2.0-S002195172500394X-gr5.sml https://s3-eu-west-1.amazonaws.com/prod-ucs-content-store-eu-west/content/pii:S002195172500394X/gr5/THUMBNAIL/image/gif/cb5cc9614cb9468f6a174fd2bfaeb334/gr5.sml gr5 gr5.sml sml 8500 164 171 IMAGE-THUMBNAIL 1-s2.0-S002195172500394X-gr6.sml https://s3-eu-west-1.amazonaws.com/prod-ucs-content-store-eu-west/content/pii:S002195172500394X/gr6/THUMBNAIL/image/gif/336346a624d8f60e447704a1c39fb9bb/gr6.sml gr6 gr6.sml sml 4943 61 219 IMAGE-THUMBNAIL 1-s2.0-S002195172500394X-gr7.sml https://s3-eu-west-1.amazonaws.com/prod-ucs-content-store-eu-west/content/pii:S002195172500394X/gr7/THUMBNAIL/image/gif/fae22d0bf82b028d502c98270b4ec14b/gr7.sml gr7 gr7.sml sml 2362 108 219 IMAGE-THUMBNAIL 1-s2.0-S002195172500394X-gr8.sml https://s3-eu-west-1.amazonaws.com/prod-ucs-content-store-eu-west/content/pii:S002195172500394X/gr8/THUMBNAIL/image/gif/45ad63c1c5cbf7feb3489f1ea1c34584/gr8.sml gr8 gr8.sml sml 4158 109 219 IMAGE-THUMBNAIL 1-s2.0-S002195172500394X-sc1_lrg.jpg https://s3-eu-west-1.amazonaws.com/prod-ucs-content-store-eu-west/content/pii:S002195172500394X/HIGHRES/image/jpeg/1c9fb22986cf19e6640e8aca2961a338/sc1_lrg.jpg sc1 sc1_lrg.jpg jpg 331531 1759 3035 IMAGE-HIGH-RES 1-s2.0-S002195172500394X-sc2_lrg.jpg https://s3-eu-west-1.amazonaws.com/prod-ucs-content-store-eu-west/content/pii:S002195172500394X/HIGHRES/image/jpeg/8ef856b5dba6a377940e35cb830c8a87/sc2_lrg.jpg sc2 sc2_lrg.jpg jpg 167406 1753 3116 IMAGE-HIGH-RES 1-s2.0-S002195172500394X-gr1_lrg.jpg https://s3-eu-west-1.amazonaws.com/prod-ucs-content-store-eu-west/content/pii:S002195172500394X/HIGHRES/image/jpeg/2e776ce316eadeaa1fbf44858b7fa81f/gr1_lrg.jpg gr1 gr1_lrg.jpg jpg 1003378 2428 3318 IMAGE-HIGH-RES 1-s2.0-S002195172500394X-gr2_lrg.jpg https://s3-eu-west-1.amazonaws.com/prod-ucs-content-store-eu-west/content/pii:S002195172500394X/HIGHRES/image/jpeg/aaca53b1d26f8924d7bd631375c5fc86/gr2_lrg.jpg gr2 gr2_lrg.jpg jpg 443905 1690 3445 IMAGE-HIGH-RES 1-s2.0-S002195172500394X-gr3_lrg.jpg https://s3-eu-west-1.amazonaws.com/prod-ucs-content-store-eu-west/content/pii:S002195172500394X/HIGHRES/image/jpeg/6c3b53e92db1c88162c62c945f614e16/gr3_lrg.jpg gr3 gr3_lrg.jpg jpg 256468 1289 3391 IMAGE-HIGH-RES 1-s2.0-S002195172500394X-fx1_lrg.jpg https://s3-eu-west-1.amazonaws.com/prod-ucs-content-store-eu-west/content/pii:S002195172500394X/HIGHRES/image/jpeg/540d5068a4c7f24ac699ecde2ecb13e3/fx1_lrg.jpg fx1 fx1_lrg.jpg jpg 98256 1142 3091 IMAGE-HIGH-RES 1-s2.0-S002195172500394X-ga1_lrg.jpg https://s3-eu-west-1.amazonaws.com/prod-ucs-content-store-eu-west/content/pii:S002195172500394X/HIGHRES/image/jpeg/3f0b6c16695ace1e611d6c06b658b167/ga1_lrg.jpg ga1 true ga1_lrg.jpg jpg 127279 794 2213 IMAGE-HIGH-RES 1-s2.0-S002195172500394X-gr4_lrg.jpg https://s3-eu-west-1.amazonaws.com/prod-ucs-content-store-eu-west/content/pii:S002195172500394X/HIGHRES/image/jpeg/d33bd578a6fa6b132dc91e446254483f/gr4_lrg.jpg gr4 gr4_lrg.jpg jpg 129014 983 2363 IMAGE-HIGH-RES 1-s2.0-S002195172500394X-gr5_lrg.jpg https://s3-eu-west-1.amazonaws.com/prod-ucs-content-store-eu-west/content/pii:S002195172500315X/HIGHRES/image/jpeg/fb485443a68103816a795ec1a774b0be/gr5_lrg.jpg gr5 gr5_lrg.jpg jpg 443249 3372 3512 IMAGE-HIGH-RES 1-s2.0-S002195172500394X-gr6_lrg.jpg https://s3-eu-west-1.amazonaws.com/prod-ucs-content-store-eu-west/content/pii:S002195172500394X/HIGHRES/image/jpeg/d1312c46181ba2766ec2a2d00e46b30d/gr6_lrg.jpg gr6 gr6_lrg.jpg jpg 151118 777 2774 IMAGE-HIGH-RES 1-s2.0-S002195172500394X-gr7_lrg.jpg https://s3-eu-west-1.amazonaws.com/prod-ucs-content-store-eu-west/content/pii:S002195172500394X/HIGHRES/image/jpeg/1858b5049d51496dbdacf85a67d273e8/gr7_lrg.jpg gr7 gr7_lrg.jpg jpg 87436 1375 2782 IMAGE-HIGH-RES 1-s2.0-S002195172500394X-gr8_lrg.jpg https://s3-eu-west-1.amazonaws.com/prod-ucs-content-store-eu-west/content/pii:S002195172500315X/HIGHRES/image/jpeg/18ba10ed2339a28a57fa961fa54a39ba/gr8_lrg.jpg gr8 gr8_lrg.jpg jpg 147324 1556 3124 IMAGE-HIGH-RES 1-s2.0-S002195172500394X-mmc1.docx https://s3-eu-west-1.amazonaws.com/prod-ucs-content-store-eu-west/content/pii:S002195172500394X/mmc1/MAIN/application/vnd.openxmlformats-officedocument.wordprocessingml.document/aa9694f94b59fa5b2d200d115a4cbbaa/mmc1.docx mmc1 mmc1.docx docx 40127538 APPLICATION 1-s2.0-S002195172500394X-si1.svg https://s3-eu-west-1.amazonaws.com/prod-ucs-content-store-eu-west/content/pii:S002195172500394X/image/svg+xml/f728506274c483633837fbb875c10fda/si1.svg si1 si1.svg svg 1578 ALTIMG YJCAT 116328 116328 S0021-9517(25)00394-X 10.1016/j.jcat.2025.116328 The Author(s) Fig. 1 (a) XRD patterns of Ti3AlC2, Ti3C2-ML and Ti3C2-DMSO, (b) AFM frontal view of Ti3C2-ML. The values indicate the thickness of the MXene particles on which the colored lines appear. (c) From left to right, HRTEM image of Ti3C2-DMSO (the inset corresponds to Fast Fourier transformed of the whole HRTEM image showing the (0 1 ¯ 10) facet of Ti3C2 MXene) and HAADF-STEM images of Ti3C2-DMSO at 5 and 1 nm scale length. Fig. 2 High resolution XP spectra corresponding to the experimental C 1s, Ti 2p, O 1s, F 1s, Cl 2p and N 1s core levels for Ti3C2-DMSO MXene (plotted in black) as well as their best fit to individual components whose assignment and binding energy are indicated in the plots. Fig. 3 Time-yield plot of 1,3-diisopropyl-2-(p-tolyl)guanidine in presence of a) Ti3C2-DMSO and b) Ti3C2-ML at ■ 90 °C (black), ● 100 °C (red), ▲ 110 °C (blue), ▾120 °C (pink) and 130 °C (green). Reaction conditions: 7.5 mg of the catalyst, p-toluidine (0.25 mmol), diisopropylcarbodiimide (0.35 mmol), toluene as solvent. (For interpretation of the references to colour in this figure legend, the reader is referred to the web version of this article.) Fig. 4 Time-yield plots of 1,3-diisopropyl-2-(p-tolyl)guanidine formation catalyzed by a) ■ Ti3C2-DMSO (red), ● Ti3C2-HCl (green), ▲ Ti3C2-APS (blue) and ▾ Ti3C2-TBAOH (magenta) at 100 °C; b) Time-yield of 1,3-diisopropyl-2-(p-tolyl)guanidine in presence of ■ Ti3C2-ML (black) ● Ti3C2-FL (purple) and ▲ Ti3C2-FL-500 (pink) at 130 °C. Reaction conditions: 7.5 mg of the catalyst, p-toluidine (0.25 mmol), diisopropylcarbodiimide (0.35 mmol), toluene (1.5 mL). (For interpretation of the references to colour in this figure legend, the reader is referred to the web version of this article.) Fig. 5 Top 35-atom model MXene cluster (MXene), from two different views. Distances of two Ti-Ti and Ti-C bonds shown explicitly. Bottom: Structure of the deprotonated toluidine attached to the MXene cluster model (MXene catalyst). Also shown the adsorption of DIC. Blue = N, Red = O, White = H, Green = F, Gray (small) = C, Gray (big) = Ti. Some atoms of MXene on the DIC adsorption structure have been omitted for the sake of clarity. The distance is indicated in Å. (For interpretation of the references to colour in this figure legend, the reader is referred to the web version of this article.) Fig. 6 Cycloaddition TS (TS1), intermediate 1 and aniline adsorption (2) on the MXene cluster. Some atoms of MXene structure have been omitted for the sake of clarity. Distances are indicated in Å. Fig. 7 First part of the DFT calculated reaction pathway for the guanylation of DIC by p-toluidine First TS has an activation energy (Ea) of 121.7 kJ/mol. The adsorption of p-toluidine is exothermic with an energy of –96.6kJ/mol. Key steps are represented schematically. Numbers 1 and 2 refer to intermediates whose structure is shown in Fig. 6. Fig. 8 Second part of the DFT calculated reaction pathway for the guanylation of DIC by p–toluidine. TS2a involving hydrogen transfer between the N atoms of the two p-toluidine moieties in intermediate 2 of Fig. 6 has an Ea of 112.2 kJ/mol, while hydrogen transfer from toluidine to the N atom of carbodiimide has an Ea for TS2b of 100.4 kJ/mol. Subsequent Ea for the second hydrogen transfer from toluidine to the N atom of toluidine moiety (TS3a) has an Ea of 60.2 kJ/mol, or (TS3b) 116.0 kJ/mol depending on the first hydrogen transfer and 21.8 kJ/mol if the two consecutive hydrogen transfers from toluidine occur each of the N atoms of the carbodiimide (TS3c). Key steps are represented schematically. Scheme 1 Ti3C2 samples evaluated as guanylation catalysts and their preparation procedure. Scheme 2 Accepted reaction pathways for the guanylation reaction of carbodiimide for molecular Ti complexes [2]. TS1, TS2 and TS3 indicated in the arrows correspond to the reaction transition states whose geometries and energies are presented below. Table 1 List of MXene catalysts used in the present study and their surface composition determined by XPS analysis. MXene O (%) F (%) N (%) Cl (%) Ti3C2-ML a 20.7 4.11 0.76 1.06 Ti3C2-ML-R b 22.9 1.18 1.6 0.36 Ti3C2-DMSO 24 4.7 0.6 1.7 Ti3C2-HCl 22 − − 2.4 Ti3C2-APS 32.4 5.2 0.8 − Ti3C2-TBAOH 22.5 2.9 0.7 − a ML stands to multi-layer. b ML-R means multi-layer and reused. Table 2 Overview of catalysts used in the guanylation reaction. Catalyst Amine Carbodiimide Temperature (oC) TON TOF (h−1) Reference Cu/G Aniline N,N'-DIC 150 °C 12 2,4 [16] Ti3C2-DMSO Aniline N,N'DIC 100 °C 81.9 73.2 This work Ti3C2-ML Aniline N,N'-DIC 130 °C 71.7 105.9 This work Nano ZnO Aniline N,N'-DCC 80 °C 4.9 0.6125 [17] Nano CeO2 Aniline N,N'-DCC 80 °C 3.8 0.475 [17] Nano TiO2 Aniline N,N'-DCC 80 °C 3.9 0.4875 [17] Nano NiO Aniline N,N'-DCC 80 °C 3.1 0.3875 [17] CuO@γ-Fe2O3 Aniline N,N'-DCC 80 °C 5 0.83 [18] Ti3C2-DMSO Aniline N,N'-DCC 100 °C 48 23.6 This work Ti3C2-ML Aniline N,N'-DCC 130 °C 57.5 121.4 This work Nano ZnO p-toluidine N,N'-DCC 80 °C 4.75 0.59375 [17] Ti3C2-DMSO p-toluidine N,N'-DCC 100 °C 48.1 23.7 This work Ti3C2-ML p-toluidine N,N'-DCC 130 °C 57.5 121.4 This work Nano ZnO p-toluidine N,N'-DIC 80 °C 4.9 0.6125 [17] Ti3C2-DMSO p-toluidine N,N'-DIC 100 °C 66.8 19.5 This work Ti3C2-ML p-toluidine N,N'-DIC 100 °C 49.4 29.9 This work Ti3C2-DMSO p-toluidine N,N'-DIC 130 °C 88.8 78.3 This work Ti3C2-ML p-toluidine N,N'-DIC 130 °C 101.4 113.9 This work Nano ZnO 4-anisidine N,N'-DCC 80 °C 4.9 0.6125 [17] Ti3C2-DMSO 4-anisidine N,N'-DCC 100 °C 35.6 2.86 This work Ti3C2-ML 4-anisidine N,N'-DCC 130 °C 128.6 166.5 This work Nano-ZnO 4-bromoaniline N,N'-DCC 80 °C 4.85 0.60625 [17] Ti3C2-DMSO 4-bromoaniline N,N'-DCC 100 °C 16.8 36.4 This work Ti3C2-ML 4-bromoaniline N,N'-DCC 130 °C 42.7 79.1 This work Nano ZnO pyrrolidine N,N'-DIC 110 °C 4.4 0,44 [17] Ti3C2-DMSO pyrrolidine N,N'-DIC 100 °C 606.1 311.8 This work Ti3C2-ML pyrrolidine N,N'-DIC 130 °C 337 1448 This work Pd/MgO 4-iodoaniline N,N'-DIC 130 °C 98 11 [19] Ti3C2-DMSO 4-iodoaniline N,N'-DIC 100 °C 53.8 18.4 This work Ti3C2-ML 4-iodoaniline N,N'-DIC 130 °C 58.5 281.2 This work Table 3 Scope of Ti3C2-ML as guanylation catalyst. Entry Amine Carbodiimide Conversion (%) Yield (%) TON TOF (h−1) 1 a p-toluidine N,N'-diisopropylcarbodiimide 41 30 101 114 2 a aniline 26 21 72 106 3 a 4-anisidine 40 38 127 122.5 4 a 4-iodoaniline 22 17 58.5 281 5 a 4-bromoaniline 20 13 43.1 90.3 6 a o-toluidine 17 11 35 112 7 a 4-vinylaniline 71 16 53 50.4 8 b pyrrolidine − 67 − − 9 c pyrrolidine − 99 337 1448 10 a morpholine − 68 228 65.2 11 c piperidine − 66 223 172 12 a p-toluidine N,N'-dicyclohexylcarbodiimide 16 12 74 102.4 13 a aniline 11 8 57.5 121.4 14 a 4-anisidine 50 38 129 166 15 a 4-iodoaniline 39 24 80 354 16 a 4-bromoaniline 27 13 42.7 79.1 17 d pyrrolidine − 99 336 589 a Reaction conditions: amine (0.25 mmol), carbodiimide (0.35 mmol), 1.5 ml of toluene, 7.5 mg of MXene, 130 °C, 24 h. Conversion and yield were determined by GC analysis with n-C14H30 as internal standard; b Reaction conditions: blank experiment, same reagents and temperature as footnote “a”, but without catalyst and reaction time 6 h; c Reaction conditions: same reagents as footnote “a”, time 6 h. d Reaction conditions: same reagents as footnote “a”, time 3 h. Research article Ti3C2 MXene as heterogeneous catalyst for carbodiimides guanylation with over 102 h−1 turnover frequencies Aicha Anouar Investigation Elena Romero Salicio Investigation Pablo García-Aznar Investigation Abdessamad Grirrane Investigation Amparo Forneli Investigation German Sastre Supervision Hermenegildo Garcia Writing – original draft Conceptualization ⁎ Ana Primo Supervision Conceptualization ⁎ Instituto Universitario de Tecnología Química, Consejo Superior de Investigaciones Científicas -Universitat Politécnica de Valencia, Universitat Politécnica de Valencia, Av. De los Naranjos s/n, Valencia 46022, Spain Instituto Universitario de Tecnología Química Consejo Superior de Investigaciones Científicas -Universitat Politécnica de Valencia Universitat Politécnica de Valencia Av. De los Naranjos s/n Valencia 46022 Spain Instituto Universitario de Tecnología Química, Consejo Superior de Investigaciones Científicas -Universitat Politécnica de Valencia, Universitat Politécnica de Valencia, Av. De los Naranjos s/n, Valencia 46022, Spain ⁎ Corresponding authors. Graphical abstract A series of Ti3C2 samples has been prepared from Ti3AlC2 by NH4F-HCl etching, followed by subsequent post-treatments, such as DMSO expansion, ultrasound exfoliation, thermal annealing at 500 °C, surface modification by ammonium persulfate, tetrabutylammonium hydroxide and hydrochloric acid. These Ti3C2 samples have been tested as heterogeneous catalysts for guanylation of symmetrical carbodiimides by aromatic and secondary aliphatic amines, observing the formation of the corresponding guanidines, accompanied by dialkylureas. The initial reaction rates between N,N’-diisopropylcarbodiimide and p-toluidine correlate linearly with the density of weak strength acid sites of the Ti3C2 sample measured by NH3 thermo-programed desorption. This has led us to propose these weak acid sites as active centers of the reaction. Based on the population of weak acid sites, the estimated turnover numbers and frequencies were calculated to be 101 and 114 h−1 for the most active Ti3C2 sample. These values rank Ti3C2 among the most active noble metal-free solid guanylation catalysts reported so far. Upon reuse, the Ti3C2 sample undergoes gradual deactivation, characterization of the four-times used Ti3C2 sample indicates that the crystallinity is preserved. Catalyst deactivation derives from deposition of the reaction products on the surface and/or from the increase of the oxygenated surface functional groups upon reuse. Deactivation can be partially reversed by thermal product desorption. DFT calculations indicate that the rate determining step in the reaction mechanism is the cycloaddition between the carbodiimide and the deprotonated toluidine anchored to the Ti3C2 surface. The present results illustrate the potential that MXenes have as solid catalysts for organic reactions, particularly Ti MXenes to promote reactions requiring amine activation, such as the present guanylation reaction. Keywords Heterogeneous Catalysis MXenes as catalysts Ti3C2 as catalyst Guanylation of aromatic amines Data availability Data will be made available on request. 1 Introduction Guanidines are widespread compounds in medicinal chemistry, since this structure appears in aminoacids and nucleobases [1]. Several guanidine-containing drugs such as Rosuvastatin, Imatinib, Cimetidine, and Zanamivir are among the best-selling pharmaceuticals, used in a wide range of treatments, including cholesterol control, oncology, gastroprotection, and antihypertensive treatment [2]. Some guanidine polymers are also used as anti-fouling agents in paints for marine protection [3,4]. Among the various possible synthetic approaches, addition of amines to carbodiimides is one of the most appealing routes since it has a complete atom efficiency without the generation of by-products [2]. Symmetric carbodiimides are easily accessible by decarboxylative dimerization of isocyanates [5]. However, although primary aliphatic amines can undergo guanylation by reacting with carbodiimides at high temperatures in the absence of catalysts, [6] more encumbered secondary amines or less nucleophilic aromatic amines do require the presence of catalysts to form guanidines [7]. Most of the reported catalysts for guanylation of aromatic amines are molecular complexes of early transition metals, [8–13] particularly organometallic titanium complexes [14,15]. The use of heterogeneous catalysts for guanylation of aromatic amines is almost unexplored with only a few examples related to supported Lewis acids, such as supported ZnO, Cu2O or Cu nanoparticles [16–19]. Compared to soluble molecular complexes, solid catalysts could offer the advantage of an easy separation from the reaction mixture, the possibility to reuse the material for consecutive runs and the design of continuous flow reactions. For this reason, it is of interest to implement organic syntheses using solid catalysts [20]. Herein, the catalytic activity of Ti3C2 MXenes as heterogeneous catalysts for guanylation of aromatic amines with carbodiimides is presented. The most active sample, multilayered Ti3C2 clay, reaches high turnover frequencies (TOFs) in the order of 102 h−1, higher or comparable to the best solid catalysts so far reported. MXenes are novel 2D nanomaterials constituted by alternating layers of an early transition metal and a carbide or nitride layer [21]. The upper and bottom external surface of MXenes always correspond to metallic sheets that are covered by surface functional groups whose nature depends on the preparation procedure [22]. In the present study and considering that Ti molecular complexes are among the most active homogeneous guanylation catalysts, [2] it will be shown that the multilayered accordion-form of Ti3C2 (Ti3C2–ML, ML corresponding to multi-layer) readily obtained by fluoride etching of Ti3AlC2 MAX precursor exhibits as catalyst a wide substrate scope for guanylation of anilines and secondary aliphatic amines with high TOF values. DFT calculations indicate that the catalytic activity derives from surface defects that allow the interaction of under-coordinated Ti atoms with the aromatic amine. 2 Results and discussion The samples used as catalysts were prepared according to the procedure reported in the literature consisting in the etching of commercially available Ti3AlC2 with a mixture of NH4F and HCl as etching agents [23,24]. After removal of Al, several forms of Ti3C2 samples were screened as catalysts, including the multilayered accordion-like Ti3C2 clay (Ti3C2-ML), DMSO-expanded Ti3C2 clay (Ti3C2-DMSO) and the exfoliated few layers Ti3C2 form (Ti3C2-FL). In the preparation of the exfoliated few layers Ti3C2, DMSO was used as expanding agent to increase the interlayer distance in the initial accordion-like MXene clay directly obtained in the Al etching, facilitating subsequent exfoliation of the individual sheets by ultrasounds [25]. Scheme 1 illustrates the Ti3C2 sample preparation. It is known that the nature and distribution of the termination groups present on the surface of the MXene depends on the synthetic route used to prepare the material. When using NH4F and HCl as Al etchants, F and Cl atoms are installed on the surface of Ti3C2, along with OH and −O − groups coming from the aqueous medium [26,27]. The etching process also introduces defects on the Ti3C2 structure, including under coordinated Ti atoms and Ti vacancies [28]. After Al etching, the surface functional groups can be altered, at least in part, by post-synthetic treatment. It was one of the hypotheses of the present study that the nature of these surface terminations and their vacancies should play a key role in the catalysis, making possible the coordination of the reagents with Ti atoms acting as Lewis sites. For this reason, as indicated in Scheme 1, in addition to the Ti3C2-ML clay, DMSO-expanded Ti3C2-DMSO and exfoliated Ti3C2-FL sheets, other Ti3C2 samples were prepared by post-synthetic treatment of the DMSO-expanded sample. Thus, Ti3C2-DMSO acted as a precursor of three additional Ti3C2 samples in which Ti3C2-DMSO was reacted either with hydrochloric acid (HCl) to introduce further Ti vacancies and −Cl atoms, or with ammonium persulfate (APS) to increase the proportion of −O- groups [29] or tetrabutyl ammonium hydroxide (TBAOH) that is a reagent known to install –OH terminations [30,31]. As reported, surface characterization by XPS analysis provides a strong evidence of the alteration of the nature and distribution of the surface groups. Fig. S1 in supporting information provides EDX analysis of the Ti3C2 samples under study. Additionally, the presence of DMSO in Ti3C2-DMSO was confirmed by solid-state 13C NMR spectroscopy, which showed a signal at 46.09 ppm corresponding to the methyl (CH3) carbon atoms of DMSO (Fig. S2) [32]. For the sake of comparison of the activity of Ti3C2 with that of other MXenes, Nb2C and V2C were also prepared by analogous fluoride salts and HCl etching of their corresponding Nb2AlC and V2AlC precursors following reported procedures [33–35]. Supporting information provides a detailed description of the preparation of all MXene samples used in the present study as heterogeneous catalysts and appropriate characterization data. The list of samples and their main analytical parameters are given in Table 1 . The MXene samples were characterized by XRD, TEM, AFM and XPS. Thus, the success of Al etching was confirmed by XRD in which the diffraction patterns of the MAX phase precursor changed during the etching process giving the expected peaks at 18.5°, 27° and 36° corresponding to the (004), (006) and (008) planes reported for the accordion-like form of the corresponding MXenes [36,37]. Fig. 1 (a) compares the XRD patterns of the Ti3AlC2 precursor, the resulting Ti3C2-ML and expanded Ti3C2-DMSO to illustrate the remarkable changes occurring during the Al etching and the effect of DMSO intercalation. Based on the 2θ value of the (002 peak (Fig. 1 a and Table S1), the interlayer distance in the stacking was estimated as 1.11 and 1.12 nm for the Ti3C2-ML and Ti3C2-DMSO samples, respectively. These interlayer distance values are in the range of those values reported in the literature for these Ti3C2 MXene forms. It should be noted, however, that the actual interlayer distance in a Ti3C2 sample is known to depend also on the exact exfoliation conditions, particularly the time of the etching treatment [38]. Also, the interlayer distances measured for Ti3C2-APS and Ti3C2-HCl of 1.08 and 1.13 nm coincide with the reported value for these samples [36]. Interestingly, in the case of Ti3C2-TBAOH, a significantly larger interlayer distance of 1.49 nm based on XRD (Fig. S3) was determined probably indicating the intercalation of large quaternary ammonium ions in the material, therefore resulting in an expansion between neighbor sheets [39]. In this regard, the presence of N atoms on the composition of some of the Ti3C2 samples prepared in this study (see Table 1) should derive from the use in their preparation of NH4F for Ti3C2–DMSO, and both NH4F and NH4SO5H for Ti3C2–APS or NH4F and TBA+ for Ti3C2–TBAOH. In the case of DMSO-expanded and exfoliated Ti3C2 samples, the average thickness of the 2D nanosheets was determined by AFM measurements with subnanometric vertical resolution by determining the height of a statistically relevant number of particles, resulting for Ti3C2-DMSO an average sheet thickness of 4.1 ± 1.2 nm that corresponds approximately to the stacking of four MXene layers as average. In contrast, Fig. 1 b shows the thickness of multi-layer Ti3C2-ML showing a broad thickness distribution for this sample [40]. These images also showed that the lateral particle size of the Ti3C2 samples is of a few hundreds of nanometers, much smaller that other micrometric MXene flakes reported in the literature. However, it has to be noted that for the purpose of using these samples in catalysis, smaller lateral flakes are more appropriate since catalytic activity frequently increases as the particle size decreases. Similar average thickness was also determined for Ti3C2-HCl after exfoliation. However, in the case of the other two samples derived from Ti3C2-DMSO by post-synthetic treatment, namely Ti3C2-APS and Ti3C2-TBAOH, the surface modification process apparently produced agglomeration of the MXene particles, resulting in much thicker aggregates ranging from 22 to even 150 nm (Fig. S4). It could be that this post-synthetic treatment diminishes the surface charge of the particles or increases their interaction, therefore, favoring stacking or agglomeration of the primary individual particles into much larger aggregates. Crystallinity of the present MXene samples and average lateral size dimensions were determined by transmission electron microscopy. Fig. 1 (c) shows representative TEM images taken for Ti3C2-DMSO showing the lattice fringes with a spacing of 0.261 nm corresponding to the (0 1 ¯ 10) plane in XRD [41]. In addition, selected area electron diffraction also shows the characteristic hexagonal pattern indicating the single crystalline domain of the particle. By recording selected area electron diffraction (SAED) in different parts of the image field at lower resolution, the high crystallinity of the Ti3C2-ML and Ti3C2-DMSO sample was confirmed. Similar images were also taken for the other samples under study indicating that post-synthetic treatment to alter the nature of the surface groups does not affect the crystal structure of the MXene (Fig. S5). SAED allowed to estimate the interplanar distance for some of the crystallographic planes of Ti3C2 MXenes observed by TEM. Table S1 provides these values, showing good agreement between the interplanar distance measured by SAED with some of the XRD peaks. Fig. 2 shows the high-resolution XP spectra of C 1s, O 1s, and Ti 2p core levels of Ti3C2-DMSO. Fitting of the experimental C 1s spectrum indicates four components corresponding to C bonded to Ti (281.2 eV), graphitic carbon and C atoms of DMSO (284.5 eV), C bonded to O (286.5 eV) and COOH carboxylate (288.3 eV). The XPS Ti 2p core level was adequately deconvoluted into several peaks corresponding to Ti bonded to C (454.3 eV), to O (455.6 eV), and to F (458.4 eV). The high resolution O 1s peak displays two components assigned to Ti-O (529.8 eV) and residual H2O/CO3 = (532.2 eV). The F 1s spectrum was fit in two components corresponding to –F terminations (Ti-F, 684 eV and C-F, 685.3 eV). All the previous XPS data are in good agreement with the literature [42]. XPS analysis also indicates the presence of Cl on the sample. The Cl 2p core level has two peaks at 198.2 and 200.0 eV attributable to Ti-Cl and C-Cl. Finally, the presence of N in low proportion was also detectable by XPS that shows a distribution of N atoms between Ti-N and N–H components appearing at 399.4 and 401.0 eV, respectively. The most likely origin of Cl and N are HCl and NH4F reagents using for Al etching. XP spectra of Ti3C2-ML, Ti3C2-HCl, Ti3C2-APS and Ti3C2-TBAOH are presented in Fig. S6 of the supplementary material and were also in agreement with the reported data [42]. 2.1 Catalytic activity The reaction of p-toluidine with N,N'-diisopropylcarbodiimide was selected as benchmark reaction performing the addition under conditions in which variations in activity due to higher or lower catalytic performance can occur. Preliminary blank controls in the absence of catalyst showed that p-toluidine does not react with N, N'-diisopropylcarbodiimide in toluene at reflux temperature in 24 h. In contrast, the presence of MXene in the medium promotes the formation of the corresponding 1,3-diisopropyl-2-(p-tolyl)guanidine, accompanied by N, N'-diisopropylurea, as indicated in eq. (1) . While guanidine corresponds to the reaction of carbodiimide with p-toluidine, N,N'-diisopropylurea derives from the addition of water present on the MXene catalysts, in the solvent or in the medium [37]. The initial reaction rate of guanidine formation and final p-toluidine conversion at 24 h depended on the composition and preparation procedure of the MXene used as catalyst. Fig. S7 in the supporting information displays the temporal profiles of p-toluidine conversion (Fig. S7(a)) and guanylation of N,N'-diisopropylcarbodiimide to 1,3-diisopropyl-2-(p-tolyl)guanidine (Fig. S7(b)) using Ti3C2-ML, Ti3C2-DMSO, V2C and Nb2C as catalysts at 100 °C. Transition metal complexes such as titanium or vanadium imido complexes have been previously reported to catalyze the guanylation of primary aromatic amines with inactivated carbodiimides, with Ti complexes being the best performing ones [2]. When comparing the activity of the different MXene catalysts, it was found that Ti3C2 displays the best activity for the guanylation reaction, followed by Nb2C and V2C, thus agreeing with the activity reported for their homogeneous counterparts [12,13,15]. Note that the three MXenes were prepared following analogous etching procedures and, therefore, it can be assumed that they must have similar surface functional groups. (1) Having found Ti3C2-DMSO as a suitable guanylation catalyst, further studies were aimed at improving its catalytic activity and to learn more about the influence of surface functional groups. In this regard, the effect of interlayer expansion using DMSO followed by ultrasound exfoliation in comparison with the multilayered Ti3C2-ML accordion-form directly resulting from the NH4F/HCl etching was studied. The results plotted in Fig. S7(b) show that the exfoliation procedure is detrimental for the catalytic activity with the most active Ti3C2 form being the sample resulting directly from Al etching (Ti3C2-ML). Since exfoliation should be beneficial in terms of larger specific surface area and better site exposure, the lower catalytic activity of Ti3C2-DMSO respect to pristine Ti3C2-ML can be attributed to the negative effect caused by the presence of adsorbed DMSO that remains on the Ti3C2-DMSO sample used as catalyst, as detected by solid-state 13C NMR spectroscopy in the Ti3C2-DMSO sample before the reaction (Fig. S2). DMSO could be blocking some active sites and it should also increase hydrophilicity favoring N,N'-diisopropylurea formation. To assess the effect of MXene surface termination on the catalytic activity, the catalytic activity of Ti3C2-DMSO with Ti3C2-HCl, Ti3C2-APS and Ti3C2-TBAOH was compared. Note that, as indicated in Scheme 1, Ti3C2-HCl, Ti3C2-APS and Ti3C2-TBAOH derive directly from Ti3C2-DMSO by further post-synthetic treatment. Ti3C2-HCl was obtained by treating Ti3C2-DMSO by HCl to generate further Ti atom vacancies and introducing Ti-Cl terminations at the same time. Fig. 4 (a) and S8 show the temporal profiles of 1,3-diisopropyl-2-(p-tolyl)guanidine yield and p-toluidine conversion respectively, using post-synthetically modified Ti3C2. From this data, it can be concluded that although all the Ti3C2 samples exhibit catalytic activity, post-synthetic treatments exert a negative influence in the Ti3C2 performance, the most active sample being Ti3C2-DMSO. These results indicate that surface functionality plays an important role on the catalytic activity and that oxygenated surface groups introduced by APS or TBAOH treatments are not the active sites [43]. In the case of the Ti3C2-HCl sample, generation of additional Ti atom vacancies appears to be compensated by formation of Ti-Cl terminations, resulting the balance in a similar catalytic activity for Ti3C2-HCl and Ti3C2-DMSO. The catalytic performance of Ti3C2-based materials is closely linked to their surface chemistry and acid site distribution as summarized in Table S3. Analysis of the catalyst series reveals that weak acidity correlates linearly with guanidine formation, suggesting that acidity plays a pivotal role in the catalysis. This is evident for Ti3C2-ML, which possesses the highest population of weak acid sites (0.099 mmol/g) and achieves the highest guanidine yield (14.7 %) at 100 °C. In contrast, catalysts dominated by strong acidity, such as Ti3C2-TBAOH (2.238 mmol/g of strong acid sites, 0 mmol/g weak acidity), exhibit markedly lower guanidine yields (5.2 %), suggesting that excessive strong acid sites may lead to undesirable side reactions, such as urea formation. Ti3C2-DMSO, with a distribution of acid sites from strong, moderate and weak strength, exhibits a preferent selectivity for 1,3-diisopropylurea (21.2 % yield) formation. This indicates that moderate and strong acidity enhances urea formation, whereas guanidine synthesis benefits from a higher population of weak acidity and diminished strong acid density. Surface oxygen content, primarily from –O and –OH functionalities, correlates with total acidity but does not independently predict catalytic performance. Thus, Ti3C2-APS, with the highest oxygen content (32.4 %), shows poor catalytic activity. Furthermore, the presence of surface chlorine (e.g., in Ti3C2-ML and Ti3C2-HCl) may contribute to slightly enhanced guanidine yields, potentially through stabilization of reactive intermediates. These findings underscore the critical influence of tailored surface functionalization and acid site strength tuning on the catalytic selectivity in guanidine synthesis. Table S3 summarizes these findings. To better rank the relative activity of Ti3C2-DMSO and Ti3C2-ML, the activity as guanylation catalysts of both samples was compared at different temperatures in the range from 90 °C to 130 °C. Fig. 3 presents a comparison of the temporal profiles of the 1,3-diisopropyl-2-(p-tolyl)guanidine yield using Ti3C2-ML and Ti3C2-DMSO as catalysts. As it can be seen in Fig. 3, although the overall reaction yields at 90 °C and 100 °C for both samples are comparable (Fig. 3), Ti3C2-ML exhibits superior activity toward guanidine formation. This trend is accompanied by a significantly lower 1,3-diisopropylurea yield (10.2 % for Ti3C2-ML vs. 21.2 % for Ti3C2-DMSO) (Fig. S9). At 130 °C, the guanidine yield with Ti3C2-ML further increases to 29.6 %, more than double that of Ti3C2-DMSO (14.6 %), underscoring the enhanced catalytic efficiency and selectivity of the ML catalyst. The reduced guanidine formation in Ti3C2-DMSO is attributed to its pronounced hygroscopic nature, [44] derived from the presence of DMSO. This hydrophilicity will favor water uptake, promoting the hydrolysis of carbodiimide intermediates to urea. Additionally, temperature-programmed NH3 desorption (NH3-TPD) analysis indicates a higher density of strong acid sites in Ti3C2-DMSO (Table S2), which can further catalyze the hydrolysis of carbodiimides, [45,46] thus favoring 1,3-diisopropylurea formation. These combined effects of greater moisture retention and increased acidity account for the diminished guanidine selectivity in Ti3C2-DMSO and highlight the advantageous properties of Ti3C2-ML as a more selective catalyst in guanidine synthesis. Having found that the Ti3C2-ML clay resulting directly from Al-etching of Ti3AlC2 was the most active sample and that 130 °C is a convenient temperature affording high guanidine yield while still having room for improvement, exfoliation treatment of Ti3C2-ML avoiding the use of any expansion agent by sonication in pure H2O was performed, observing also in this case a decrease in the catalytic activity (Fig. 4 (b)). Ultrasound treatment is able to break the 2D nanosheets of the Ti3C2-ML clay resulting in a significant decrease in the lateral size of the particles [47]. However, this treatment also introduces oxygenated surface groups, healing surface termination vacancies by further exposure to H2O [48]. The balance of these opposite effects, i.e., larger surface area by exfoliation and unwanted alteration of surface functional groups, leads in the present case to a decrease in catalytic activity of the Ti3C2-ML sample after sonication. Additionally, Ti3C2-ML after sonication was submitted to a further thermal treatment at 500 °C under Ar atmosphere. From the information provided by thermogravimetry and analysis of the molecules evolved in the process, [49] it was determined that pristine Ti3C2-ML directly obtained in the Al etching from the Ti3AlC2 phase evolves some surface functional groups, particularly some H2O formed by condensation of two neighbor Ti-OH groups and formation of Ti-O-Ti oxo bridges. Accordingly, it was of interest to determine the influence of this treatment on the catalytic activity of the resulting Ti3C2-FL-500. The results presented in Fig. 4 (b) and S10 show a notable decrease in the catalytic activity of Ti3C2-FL-500 for 1,3-diisopropyl-2-(p-tolyl)guanidine formation and p-toluidine conversion respectively. It is proposed that the observed decrease in catalytic activity is a consequence of the healing of defects and formation of surface oxo bridges in the heating treatment. The heterogeneous nature of the catalytic activity was determined by carrying out a hot filtration test. In this test, two twin reactions start under the general conditions, but in one of them the Ti3C2-ML catalyst is filtered at 1 h at the reaction temperature once the conversion has reached 5 %. The resulting clear solution is allowed to react further in the absence of solid catalyst. Fig. S11 shows the results of the hot filtration test. It was observed that after filtration of the Ti3C2-ML catalyst the reaction stops, while in the twin reaction p-toluidine conversion progresses up to 29 %. In addition, ICP analysis of the clear solution at the end of the reaction showed that the Ti content was about 0.5 % of the initial Ti content present in the Ti3C2-ML catalyst. These data support that the reaction requires the presence of Ti3C2-ML solid to occur and that Ti3C2-ML is not leaching active species to the liquid phase. 2.2 Nature of the active sites At this point and after having measured the catalytic activity of a series of Ti3C2 samples for p-toluidine guanylation, it was desirable to find a technique to correlate their activity with some properties of the material. Particularly, catalytic activity of solids is frequently related to the acid-base properties of the surface. Acidity and basicity of solids can be routinely quantified by temperature-programmed desorption (TPD) measurements of ammonia and CO2, respectively. In the present case, the use of NH3 as probe molecule is particularly relevant considering the structural similarity between the functional groups of amines and NH3. In other words, it is reasonable to propose that the sites on Ti3C2 that are able to interact with p-toluidine– should also adsorb NH3· NH3-TPD measurements for the Ti3C2 samples is provided in Fig. S12. As seen in the NH3​ desorption profiles, three relative NH3 desorption maxima are observed at approximately 175 °C, 400 °C, and 570 °C, corresponding to sites with weak, medium, and strong basicity strength, respectively [50,51]. The corresponding amount of desorbed NH3 at each temperature is indicated in Table S2. To know if any of these sites, either weak, medium or strong, are the active sites, the initial guanidine formation rate was plotted against the amount of these sites as determined by NH3-TPD analyses. The results are presented in Fig. S13. As shown there, while the strong acid sites do not correlate with the initial reaction rate for Ti3C2-ML samples, the plot of the initial guanylation rate vs. the population of weak acid sites exhibits a reasonable linear relationship for samples derived from Ti3C2-ML and Ti3C2-DMSO under different reaction conditions. Thus, the increase in the population of weak acid sites leads to a proportional growth of guanylation rate. Based on this, it is proposed that the catalytic activity of the MXene samples for guanylation of carbodiimide by p-toluidine derives from Lewis acid sites of weak strength. This is in agreement with the previous knowledge in the catalysis of this reaction, in which control of the Lewis acid strength is necessary to achieve an optimal guanylation reaction performance [2]. For sites of stronger acidity, product desorption can be disfavored, particularly considering that guanidines can behave as superbases [52]. In fact it was noticed in some time-yield plots that the reaction rate decreases considerably once a certain product yield is achieved (see Figs. 3 and 4). This fact can be rationalized assuming that the reaction product acts as a poison of the active sites, competing with toluidine for the active site and blocking Lewis acid sites. To provide some support to the poisoning effect of guanidine for the MXene active sites, while reinforcing the proposal of Lewis acid sites, even with weak strength as active sites, three catalytic tests using Ti3C2-ML were carried out by adding purposely at initial time 1,3–diisopropyl-2-(p-tolyl)guanidine at two different concentrations in the range of those formed at around 8 and 21 h of reaction. The results presented in Fig. S14 show a linear decrease in the initial guanylation reaction rate as a function of the guanidine concentration, thereby confirming the poisoning effect of the reaction product. Regarding the poisoning effect of guanidine, it has to be commented that this product has much lower toluene solubility than the starting materials. This lower solubility, due to the presence of polar N–H groups that can form strong hydrogen bonds, is responsible for the observation of some product precipitation upon cooling the reaction mixture when the concentration of the products is high and can also contribute to surface poisoning. Aliphatic and aromatic amines have obviously larger molecular size than NH3 used as probe molecule in NH3-TPD. Therefore, it is reasonable to assume that some of the Lewis acid sites probed by NH3 are sterically too encumbered to interact with amines and cannot perform as active sites in the guanylation reaction. However, taking the population of weak acid sites quantified by NH3-TPD as the number of active sites, a lower estimate for the turnover number (TON) and turnover frequency (TOF) of Ti3C2-ML can be determined. It is likely that the number of weak strength sites quantified by NH3 overestimates the number of sites that promote guanylation, but the TON and TOF values can serve as initial rough data to rank Ti3C2-ML activity with respect to reported homogeneous and heterogeneous catalysts. These values are given in Table 2 . Although comparison of the catalytic activity based on literature data is always problematic due to the disparity in the reaction conditions in which the values are measured, the data shown in Table 2 clearly points to a high intrinsic Ti3C2-ML catalytic activity frequently two or more orders of magnitude higher than conventional solid catalysts. Worth noting is that in comparison to other reported guanylation catalysts Ti3C2-ML does not contain precious or critical metals in its composition. The influence on the reaction rate of the reaction temperature in the range from 90 °C to 130 °C is given in Fig. 3 . From these data, the Arrhenius plot allows to calculate the activation energy using Ti3C2-ML as catalysts. The value of 71.3 ± 11.7 kJ/mol mol−1 (Fig. S15) indicates a moderate activation barrier for the transition state, which is consistent with the good performance of Ti3C2-ML compared to other reported catalysts. 2.3 Reaction scope The general catalytic activity of Ti3C2-ML to promote guanylation of amines was confirmed by screening several para- and ortho-substituted aromatic amines as well as secondary aliphatic amines for different symmetrical carbodiimides. Table 3 shows the products obtained and the corresponding conversion and product yields, while Figs. S16 to S19 shows the time-yield plots of these reactions. All the reaction products were isolated by flash chromatography with yields close to the values determined by GC analyses. The corresponding 1H NMR spectra in CD2Cl2 solution are provided Figs. S33-S49 in supporting information. As it can be seen in Table 3, Ti3C2-ML promotes the formation of a variety of guanidines. In the case of aromatic amines, electron donor substituents increase substrate conversion and guanidine yield (Table 3, entries 1 and 3), while the opposite occurs for electron withdrawing substituents (Table 3, entries 4 and 5). This trend is in agreement with the positive effect of the electronic density on the N lone electron pair on aniline reactivity. In the case of aminostyrene, occurrence of C=C polymerization in a significant extent competing with guanylation was observed, resulting in high conversion of the aromatic amine, but low p-styryl guanidine yield (Table 3, entry 7). Steric encumbrance around the –NH2 group decreases considerably the conversion and product yield as seen in the case of o-toluidine (Table 3, entry 6). As expected in view of their high reactivity and large nucleophilicity, secondary amines such as pyrrolidine, morpholine and piperidine, were far more reactive than aromatic amines and excellent yields were achieved for the corresponding guanidines at shorter times. To demonstrate the role of the catalyst in the guanylation of pyrrolidine with N,N'-diisopropylcarbodiimide at 130 °C, a blank experiment without the catalyst was performed, yielding 67 % after 6 h. In contrast, the presence of Ti3C2-ML resulted in a 99 % yield under the same conditions and time. Thus, the catalytic activity of Ti3C2-ML is much lower for encumbered aromatic amines, aromatic amines having electron withdrawing substituents or reactive functional groups. This trend is the one expected considering the general reactivity of aromatic amines. Besides N,N-diisopropylcarbodiimide, larger molecular weight N,N'-dicyclohexylcarbodiimide was also used as substrate, observing the formation of the corresponding guanidines with similar conversions and yields as for the isopropyl analog. To assess the reusability of Ti3C2-ML, the reaction was scaled up to use a larger Ti3C2-ML amount that could allow easier recovery of the catalyst and reuse the same sample in successive runs under the same conditions. In this way four consecutive uses of the same Ti3C2-ML sample were carried out. Each run was performed for 24 h. As it can be seen in Fig. S20, a gradual decrease in the catalytic activity was observed under these conditions going from 30 % guanidine yield at final time for the fresh sample to 5 % in the fourth use. Between catalytic cycles, the used catalyst was washed twice with toluene, once with dichloromethane, and then dried at ambient temperature prior to reuse. Under these conditions, the guanidine yield dropped by approximately half in the second run and subsequently exhibited a slight, gradual deactivation over further reuses. Considering the solubility of both reaction products, guanidine and urea, it is proposed that the Ti3C2-ML sample becomes poisoned by these products as the reaction progresses, decreasing the reaction rate. Besides poisoning, alteration of the surface terminal groups and, particularly, healing of surface group vacancies that are presumed to behave as active sites would also contribute to this deactivation. As already commented when discussing the catalytic activity of post-synthetically modified Ti3C2-APS and Ti3C2-TBAOH, the guanylation catalytic activity largely depends on the nature of these surface terminations and the presence of defects. Then, upon reuse, the original surface of the pristine Ti3C2-ML sample would be altered by product deposition and exposure to moisture and ambient humidity, resulting in an increase of oxygenated surface termination. This proposal on Ti3C2-ML deactivation upon reuse is reasonable considering the strong adsorption of nitrogenated products and reagents and the tendency of Ti3C2 to undergo oxidation [16,53]. To provide some support to this proposal of poisoning by product deposition and surface modification, XPS analysis of the four times used Ti3C2-ML sample was performed. The corresponding XPS data as well as the best deconvolution to the individual components are presented in Fig. S21. Although there are many similarities between the four times used sample and the pristine Ti3C2-ML material, some specific changes were noted. First the percentage of C, O and N atoms on the surface undergoes a significant increase with respect to the fresh sample. In addition, the C 1s showed a decrease in the proportion of the C-Ti component at 281.3 eV, that is also accompanied by an increase in the proportion of the TiO2–xF2x/TiO2 components in the deconvolution of the Ti 2p core level. These variations indicate an enrichment of C, N and O on the catalyst surface compatible with the deposition of some reaction products adsorbed on the surface and remaining in the sample after the washings and with the higher population of −O- groups with respect to −F and −Cl surface atoms. It is proposed that these changes are responsible for the observed catalyst deactivation. Further quantification of the organic material deposited on Ti3C2-ML was made by thermogravimetric analysis under air of the four times used Ti3C2-ML sample. A 40 % weight loss was measured in the temperature range from ambient temperature to 400 °C for the four times used Ti3C2-ML sample that should correspond to the adsorbed organic matter. Fig. S22 provides the thermogravimetric profile of the four times used Ti3C2-ML in comparison to the pristine material. To confirm that the 2D crystal structure of MXene is maintained under the reaction conditions, the Ti3C2-ML sample used four times was further characterized by TEM and XRD. The results are presented in Figs. S23 and S24, respectively. Although some deterioration of the crystallinity cannot be excluded, both characterization techniques confirm that the four times used Ti3C2-ML sample is still a crystalline material. Based on the thermogravimetric profile of the Ti3C2-ML after four uses, the solid was calcined in air at 200 °C for 30 min to remove the adsorbed organic residues. The diffractograms presented in Fig. S24 confirm that the material retains its crystal structure and that Ti3C2-ML does not transform into TiO2 at this temperature even in the presence of air. Fig. S25 displays the FTIR spectra of Ti3C2-ML, Ti3C2-ML-R and Ti3C2-ML-Cal, showing that calcination at 200 °C removes a major part of the organic matter that was adsorbed on the reused material. In addition, XPS of Ti3C2-ML-Calc (Fig. S26) shows that thermal regeneration induces marked, element-specific modifications in Ti3C2 consisting in a drop of the Ti-C carbide signal from 14.9 % to 12.5 % in C 1s, and a concomitant loss of ≤ 8 % Ti-C in the Ti 2p at 454.6 eV, confirming conversion of up to one-tenth of the outermost carbide layer to TiOx. Correspondingly, Ti-F terminations decrease by 4 %, while Ti-Cl falls by 3 %. N 1s peak remains largely intact. Overall, the XPS analysis shows significant surface oxidation and partial loss of halide terminations. The calcined material was then tested for the guanylation of p-toluidine, yielding 22 % after 24 h compared to the 17 % yield in the second use, indicating a significant regeneration of the catalytic activity after four uses. These findings further validate that the strong adsorption of organic matter is a major contributing factor for catalyst deactivation. To gain deeper insight into the adsorption of both the aromatic amine and the resulting guanidine formed during the guanylation of aromatic amines with aliphatic carbodiimides, an in-situ FTIR spectroscopy study of the guanylation reaction occurring on the surface of Ti3C2-ML was conducted. Detailed experimental procedures for these in situ adsorption measurements are provided in the supporting information. A slight bathochromic shift of about 4 cm−1 is observed when aniline adsorbs onto the surface of Ti3C2-ML. This shift may be attributed to the interaction between aniline NH2 groups and the MXene surface groups. For example, the stretching bands of aniline, originally observed at 3422, 3351, and 3213 cm–1, shift to 3419, 3347, and 3209 cm–1, respectively, as shown in Fig. S27 (a–d). Additionally, the NH2 bending vibration shifts from 1620 to 1616 cm–1, further confirming the interaction between aniline and the MXene. Moreover, the broadening of the stretching band around 3422 cm–1 provides further evidence of hydrogen bonding between aniline and the catalyst [54]. Subsequently diiisopropylcarbodiimide was added to the sample of adsorbed aniline and Ti3C2-ML and heated at 130 °C, while monitoring the evolution of the system over the time by FTIR spectroscopy. IR spectra reveal that during the reaction, new features emerge in the 2360–2340 cm–1 region of the IR spectrum recorded at 30 min, a time sufficiently long to observe the evolution of intermediates. The IR spectral changes are presented in Fig. S28 (a-c). These spectral features in the region corresponding to accumulated N=C=N bonds and aromatic overtones that do not correspond to aniline, carbodiimide or guanidine supports the appearance of a reaction intermediate when both reagents are adsorbed onto the Ti3C2 surface, most probably in which the accumulated N=C=N is still present. 2.4 DFT calculations Further understanding on the reaction mechanism and the nature of the active sites can be obtained by theoretical modelling and calculations. Theoretical calculations on Ti3C2 usually employs Ti2C as model to save computational cost, while providing reasonable similarity in the local environments at the MXene surface [55]. In the present case a model of 35 atoms based on Ti2CTx, with T corresponding to the surface terminal groups in the experimental proportion determined by XPS for Ti3C2-ML was used for the calculations. Employing this Ti2CTx model, the initial mechanistic proposal was based on the accepted guanylation mechanism using molecular Ti complexes as catalysts as indicated in Scheme 2 [2,14]. In this mechanism, the first step is the adsorption of activation of p-toluidine on the MXene surface via double deprotonation and nitrogen binding to the Ti atoms. Once p-toluidine deprotonation with the spill over of two protons on MXene surface has occurred, the following steps will lead to the reaction product, regenerating the catalyst for the subsequent reaction cycles. This mechanism based on Scheme 2 was computed on the 35-atom model cluster of the MXene surface, shown in Fig. 5 , which includes O2–, (OH)- and F- functionalities, that are present in the experimental characterization. According to Scheme 2, the key step of the mechanism corresponds to the cycloaddition of the N,N'-diisopropylcarbodiimide (DIC), yielding intermediate 1 (shown on Fig. 6 ). After this step, the following intermediate corresponds to the adsorption of another toluidine molecule on the MXene surface (intermediate 2). From intermediate 2, the reaction proceeds from transferring two protons from adsorbed p-toluidine to adsorbed guanidine, there being three possibilities depending on which N atom of the adsorbed guanidine is receiving the first and which the second proton. All these three possibilities were computed and the geometry and energy of the corresponding intermediates, differing in the position of the protons were determined. Figs. S29-S32 in the supporting information shows the structures of these intermediates. As these Figs. S29-S32 show, the last product formed regenerates the MXene catalyst structure shown on Fig. 5 , forming the corresponding expected products. 2.4.1 Energetic profile of the reaction coordinate As shown in Scheme 2, the first part of the catalytic cycle leading to the cycloadduct is common regardless the subsequent order of proton transfer from p-toluidine to the adsorbed carbodiimide. The energy of the transition states (TS) in these elementary pathways is presented in Fig. 7 . The cycloaddition reaction between the MXene catalyst and DIC forming intermediate 1 is endothermic by 57.7 kJ/mol, probably because during reaction the adsorbed deprotonated p-toluidine must lose coordination, since it must go from coordinating to three Ti atoms on the surface to only two. This “vacancy” is then filled with another p-toluidine, in an exothermic step, leading from intermediate 1 to intermediate 2. As indicated in Scheme 2, from intermediate 2 there are three possible proton transfer pathways with three possible intermediates. Fig. 8 shows that the predicted favored pathway implies a first hydrogen transfer from toluidine to the N atom of the carbodiimide, followed by a second hydrogen transfer from p-toluidine to the other N atom of carbodiimide. As indicated in Fig. 8, both hydrogen transfers are exothermic with activation barriers for TS2b and TS3c of 100.4 and 20.8 kJ × mol−1, respectively. Lastly, the second hydrogen transfer is always exothermic, no matter to which N atom was transferred the first hydrogen from toluidine. Overall, the present calculations indicate that p-toluidine addition to carbodiimide on the MXene follows a reaction mechanism analogous to the one accepted to occur for molecular complexes with the main difference that while in the homogeneous catalyst the Ti atom can have up to three coordination positions involved in product formation (see intermediates 2, 3 and 4 in Scheme 2), this is not possible in the case of MXene surface in which Ti atoms can offer only a single coordination position to the reaction mechanism and, as consequence, the mechanism require the involvement of up to three neighbour Ti atoms to promote the addition. 3 Conclusions It has been shown that MXenes can catalyze guanylation of carbodiimides by aromatic and secondary amines forming the corresponding 2-substituted guanidines. The process is accompanied by formation of dialkylurea resulting from addition to the carbodiimide of H2O present in the MXene or/and from the ambient. Ti3C2 performs better than Nb2C or V2C and the preparation procedure and post-treatment of the Ti3C2 sample exerts a notable influence on the catalytic activity, depending on the surface terminal groups. Among the various Ti3C2 samples, the clay resulting directly from NH4F-HCl etching of the Ti3AlC2 was found to be the most active one, expansion by DMSO, exfoliation by ultrasounds, and the installation of oxygenated groups being detrimental for the catalytic activity. A linear relationship between the initial reaction rate and the density of weak strength acid sites, suggest that these Lewis sites related to surface functional groups vacancies and defects are responsible for the catalytic activity. Estimation of the TON and TOF values based on the population of weak strength acid sites give values of 101 and 114 h−1, respectively, that are among the highest values reported for guanylation catalysts. The Ti3C2 sample undergoes gradual deactivation upon reuse due to the deposition of guanidine and urea on the MXene surface and the gradual alteration of the Ti3C2 surface by introduction of oxygenated groups. DFT calculations support a mechanism analogous to that accepted for molecular complexes, but in which the amine becomes deprotonated and attached to three neighbor Ti atoms on the surface and the rate determining step being the cycloaddition of carbodiimide by the deprotonated toluidine. Overall, the present results show the potential of MXenes as heterogenous catalysts for organic reactions. Particularly the present data indicates that Ti MXenes can be general catalysts for those reactions involving amines as reagents in which a fine tuning of the acid strength and the cooperation of more than one transition metal on the surface are required to activate these molecules. 4 Materials and methods All the information regarding materials and methods used in this study is provided in the Supporting Information. CRediT authorship contribution statement Aicha Anouar: Investigation. Elena Romero Salicio: Investigation. Pablo García-Aznar: Investigation. Abdessamad Grirrane: Investigation. Amparo Forneli: Investigation. German Sastre: Supervision. Hermenegildo Garcia: Writing – original draft, Conceptualization. Ana Primo: Supervision, Conceptualization. Declaration of competing interest The authors declare that they have no known competing financial interests or personal relationships that could have appeared to influence the work reported in this paper. Acknowledgements Financial support by the Spanish Ministry of Science and Innovation (CEX-2021-001230-S and PDI2021-0126071-OB-CO21 funded by MCIN/AEI/ 10.13039/501100011033), Generalitat Valenciana (Prometeo 2021/038 and Advanced Materials programme Graphica MFA/2022/023 with funding from European Union NextGenerationEU PRTR-C17.I1) and European Commission through the ERC Adv. Grant 101141466 DISCOVERY is gratefully acknowledged. Pablo García-Aznarand Germán Sastre f would like to thank ASIC-UPV and SGAI-CSIC for the use of their computational facilities. We also thank MICIN for the Severo Ochoa Excellence Research Grant. Appendix A Supplementary material Supplementary information has a detailed description of materials preparation, additional characterization, time-conversion plots under different conditions, substrate scope, mechanistic characterization and NMR data of isolated guanidines. Supplementary data to this article can be found online at https://doi.org/10.1016/j.jcat.2025.116328. Appendix A Supplementary material The following are the Supplementary data to this article: Supplementary Data 1 References [1] L. Huang J. Wang D.M.J. Lilley The structure of the guanidine-II riboswitch Cell Chem. Biol. 24 6 2017 695 702 e2 Huang, L.; Wang, J.; Lilley, D. M. J., The Structure of the Guanidine-II Riboswitch. Cell Chemical Biology 2017, 24 (6), 695-702.e2. [2] C. Alonso-Moreno A. Antiñolo F. Carrillo-Hermosilla A. Otero Guanidines: from classical approaches to efficient catalytic syntheses Chem. Soc. Rev. 43 10 2014 3406 3425 Alonso-Moreno, C.; Antiñolo, A.; Carrillo-Hermosilla, F.; Otero, A., Guanidines: from classical approaches to efficient catalytic syntheses. Chemical Society Reviews 2014, 43 (10), 3406-3425. [3] A. Protasov J.-F. Bardeau I. Morozovskaya M. Boretska T. Cherniavska L. Petrus O. Tarasyuk L. Metelytsia I. Kopernyk L. Kalashnikova O. Dzhuzha S. Rogalsky New promising antifouling agent based on polymeric biocide polyhexamethylene guanidine molybdate Environ. Toxicol. Chem. 36 9 2017 2543 2551 Protasov, A.; Bardeau, J.-F.; Morozovskaya, I.; Boretska, M.; Cherniavska, T.; Petrus, L.; Tarasyuk, O.; Metelytsia, L.; Kopernyk, I.; Kalashnikova, L.; Dzhuzha, O.; Rogalsky, S., New promising antifouling agent based on polymeric biocide polyhexamethylene guanidine molybdate. Environmental Toxicology and Chemistry 2017, 36 (9), 2543-2551. [4] J. Wang W. Yu W. Liu G. Wang J. Shi H. Wang Enhancing the marine antifouling property of high-density polyethylene through melt grafting of poly (hexamethylene guanidine) Aquac. Eng. 106 2024 102393 Wang, J.; Yu, W.; Liu, W.; Wang, G.; Shi, J.; Wang, H., Enhancing the marine antifouling property of high-density polyethylene through melt grafting of poly (hexamethylene guanidine). Aquacultural Engineering 2024, 106, 102393. [5] F. Kurzer K. Douraghi-Zadeh Advances in the chemistry of carbodiimides Chem. Rev. 67 2 1967 107 152 Kurzer, F.; Douraghi-Zadeh, K., Advances in the Chemistry of Carbodiimides. Chemical Reviews 1967, 67 (2), 107-152. [6] T.P. Hopkins J.M. Dener A.M. Boldi Solid-phase synthesis of trisubsituted guanidines J. Comb. Chem. 4 2 2002 167 174 Hopkins, T. P.; Dener, J. M.; Boldi, A. M., Solid-Phase Synthesis of Trisubsituted Guanidines. Journal of Combinatorial Chemistry 2002, 4 (2), 167-174. [7] W.-X. Zhang L. Xu Z. Xi Recent development of synthetic preparation methods for guanidines via transition metal catalysis Chem. Commun. 51 2 2015 254 265 Zhang, W.-X.; Xu, L.; Xi, Z., Recent development of synthetic preparation methods for guanidines via transition metal catalysis. Chemical Communications 2015, 51 (2), 254-265. [8] P.K. Vardhanapu V. Bheemireddy M. Bhunia G. Vijaykumar S.K. Mandal Cyclic (Alkyl)amino carbene complex of Aluminum(III) in catalytic guanylation reaction of carbodiimides Organometallics 37 15 2018 2602 2608 Vardhanapu, P. K.; Bheemireddy, V.; Bhunia, M.; Vijaykumar, G.; Mandal, S. K., Cyclic (Alkyl)amino Carbene Complex of Aluminum(III) in Catalytic Guanylation Reaction of Carbodiimides. Organometallics 2018, 37 (15), 2602-2608. [9] A. Grirrane H. Garcia E. Álvarez Isolation and X-ray characterization of palladium–n complexes in the guanylation of aromatic amines. mechanistic implications Beilstein J. Org. Chem. 9 2013 1455 1462 Grirrane, A.; Garcia, H.; Álvarez, E., Isolation and X-ray characterization of palladium–N complexes in the guanylation of aromatic amines. Mechanistic implications. Beilstein Journal of Organic Chemistry 2013, 9, 1455-1462. [10] Y. Gao V. Carta M. Pink J.M. Smith Catalytic carbodiimide guanylation by a nucleophilic, high spin iron(II) imido complex J. Am. Chem. Soc. 143 14 2021 5324 5329 Gao, Y.; Carta, V.; Pink, M.; Smith, J. M., Catalytic Carbodiimide Guanylation by a Nucleophilic, High Spin Iron(II) Imido Complex. Journal of the American Chemical Society 2021, 143 (14), 5324-5329. [11] H. Karmakar S. Anga T.K. Panda V. Chandrasekhar Aluminium alkyl complexes supported by imino-phosphanamide ligand as precursors for catalytic guanylation reactions of carbodiimides RSC Adv. 12 8 2022 4501 4509 Karmakar, H.; Anga, S.; Panda, T. K.; Chandrasekhar, V., Aluminium alkyl complexes supported by imino-phosphanamide ligand as precursors for catalytic guanylation reactions of carbodiimides. RSC Advances 2022, 12 (8), 4501-4509. [12] S. Scheuer J. Fischer J. Kress Synthesis, structure, and olefin polymerization activity of vanadium(V) catalysts stabilized by imido and hydrotris(pyrazolyl)borato ligands Organometallics 14 6 1995 2627 2629 Scheuer, S.; Fischer, J.; Kress, J., Synthesis, Structure, and Olefin Polymerization Activity of Vanadium(V) Catalysts Stabilized by Imido and Hydrotris(pyrazolyl)borato Ligands. Organometallics 1995, 14 (6), 2627-2629. [13] D. Elorriaga F. Carrillo-Hermosilla A. Antiñolo F.J. Suárez I. López-Solera R. Fernández-Galán E. Villaseñor Asymmetric niobium guanidinates as intermediates in the catalytic guanylation of amines Dalton Trans. 42 23 2013 8223 8230 Elorriaga, D.; Carrillo-Hermosilla, F.; Antiñolo, A.; Suárez, F. J.; López-Solera, I.; Fernández-Galán, R.; Villaseñor, E., Asymmetric niobium guanidinates as intermediates in the catalytic guanylation of amines. Dalton Transactions 2013, 42 (23), 8223-8230. [14] L. Xu W.-X. Zhang Z. Xi Mechanistic considerations of the catalytic guanylation reaction of amines with carbodiimides for guanidine synthesis Organometallics 34 10 2015 1787 1801 Xu, L.; Zhang, W.-X.; Xi, Z., Mechanistic Considerations of the Catalytic Guanylation Reaction of Amines with Carbodiimides for Guanidine Synthesis. Organometallics 2015, 34 (10), 1787-1801. [15] T.-G. Ong G.P.A. Yap D.S. Richeson Catalytic construction and reconstruction of guanidines: Ti-mediated guanylation of amines and transamination of guanidines J. Am. Chem. Soc. 125 27 2003 8100 8101 Ong, T.-G.; Yap, G. P. A.; Richeson, D. S., Catalytic Construction and Reconstruction of Guanidines: Ti-Mediated Guanylation of Amines and Transamination of Guanidines. Journal of the American Chemical Society 2003, 125 (27), 8100-8101. [16] S. Frindy A. El Kadib M. Lahcini A. Primo H. García Isotropic and oriented copper nanoparticles supported on graphene as aniline guanylation catalysts ACS Catal. 6 6 2016 3863 3869 Frindy, S.; El Kadib, A.; Lahcini, M.; Primo, A.; García, H., Isotropic and Oriented Copper Nanoparticles Supported on Graphene as Aniline Guanylation Catalysts. ACS Catalysis 2016, 6 (6), 3863-3869. [17] M.L. Kantam S. Priyadarshini P.J. Amal Joseph P. Srinivas A. Vinu K.J. Klabunde Y. Nishina Catalytic guanylation of aliphatic, aromatic, heterocyclic primary and secondary amines using nanocrystalline zinc(II) oxide Tetrahedron 68 29 2012 5730 5737 Kantam, M. L.; Priyadarshini, S.; Amal Joseph, P. J.; Srinivas, P.; Vinu, A.; Klabunde, K. J.; Nishina, Y., Catalytic guanylation of aliphatic, aromatic, heterocyclic primary and secondary amines using nanocrystalline zinc(II) oxide. Tetrahedron 2012, 68 (29), 5730-5737. [18] S. Abbasi D. Saberi A. Heydari Copper oxide supported on magnetic nanoparticles (CuO@γ-Fe2O3): an efficient and magnetically separable nanocatalyst for addition of amines to carbodiimides towards synthesis of substituted guanidines Appl. Organomet. Chem. 31 9 2017 e3695 Abbasi, S.; Saberi, D.; Heydari, A., Copper oxide supported on magnetic nanoparticles (CuO@γ-Fe2O3): An efficient and magnetically separable nanocatalyst for addition of amines to carbodiimides towards synthesis of substituted guanidines. Applied Organometallic Chemistry 2017, 31 (9), e3695. [19] A. Grirrane H. Garcia A. Corma E. Álvarez Orthogonal C–N plus C–C tandem reaction of iodoanilines leading to styrylguanidines catalyzed by supported palladium nanoparticles Chem. Eur. J. 18 47 2012 14934 14938 Grirrane, A.; Garcia, H.; Corma, A.; Álvarez, E., Orthogonal C–N Plus C–C Tandem Reaction of Iodoanilines Leading to Styrylguanidines Catalyzed by Supported Palladium Nanoparticles. Chemistry – A European Journal 2012, 18 (47), 14934-14938. [20] R. Augustine L. Doyle S. Malhotra L. Posner S. O’Leary S. Roberto S. Tanielyan Heterogeneous catalysis in organic synthesis. in catalysis of organic reactions 2017 Routledge 81 90 Augustine, R.; Doyle, L.; Malhotra, S.; Posner, L.; O’Leary, S.; Roberto, S.; Tanielyan, S., Heterogeneous catalysis in organic synthesis. In Catalysis of Organic Reactions, Routledge: 2017; pp 81-90. [21] M. Naguib M.W. Barsoum Y. Gogotsi Ten years of progress in the synthesis and development of MXenes Adv. Mater. 33 39 2021 2103393 Naguib, M.; Barsoum, M. W.; Gogotsi, Y., Ten years of progress in the synthesis and development of MXenes. Advanced Materials 2021, 33 (39), 2103393. [22] T. Schultz N.C. Frey K. Hantanasirisakul S. Park S.J. May V.B. Shenoy Y. Gogotsi N. Koch Surface termination dependent work function and electronic properties of Ti3C2T x MXene Chem. Mater. 31 17 2019 6590 6597 Schultz, T.; Frey, N. C.; Hantanasirisakul, K.; Park, S.; May, S. J.; Shenoy, V. B.; Gogotsi, Y.; Koch, N., Surface termination dependent work function and electronic properties of Ti3C2T x MXene. Chemistry of Materials 2019, 31 (17), 6590-6597. [23] M. Ghidiu M.R. Lukatskaya M.-Q. Zhao Y. Gogotsi M.W. Barsoum Conductive two-dimensional titanium carbide ‘clay’with high volumetric capacitance Nature 516 7529 2014 78 81 Ghidiu, M.; Lukatskaya, M. R.; Zhao, M.-Q.; Gogotsi, Y.; Barsoum, M. W., Conductive two-dimensional titanium carbide ‘clay’with high volumetric capacitance. Nature 2014, 516 (7529), 78-81. [24] R. Ramírez Grau P. Garcia-Aznar G. Sastre S. Goberna-Ferrón O. Pavel A. Tirsoaga B. Cojocaru D.G. Popescu V.I. Parvulescu A. Primo H. García MXenes as heterogeneous thermal catalysts: regioselective anti-markovnikov hydroamination of terminal alkynes with 102 h–1 turnover frequencies J. Am. Chem. Soc. 147 4 2025 3315 3332 Ramírez Grau, R.; Garcia-Aznar, P.; Sastre, G.; Goberna-Ferrón, S.; Pavel, O.; Tirsoaga, A.; Cojocaru, B.; Popescu, D. G.; Parvulescu, V. I.; Primo, A.; García, H., MXenes as Heterogeneous Thermal Catalysts: Regioselective Anti-Markovnikov Hydroamination of Terminal Alkynes with 102 h–1 Turnover Frequencies. Journal of the American Chemical Society 2025, 147 (4), 3315-3332. [25] O. Mashtalir M. Naguib V.N. Mochalin Y. Dall'Agnese M. Heon M.W. Barsoum Y. Gogotsi Intercalation and delamination of layered carbides and carbonitrides MXenes 2023 Jenny Stanford Publishing 359 377 Mashtalir, O.; Naguib, M.; Mochalin, V. N.; Dall'Agnese, Y.; Heon, M.; Barsoum, M. W.; Gogotsi, Y., Intercalation and delamination of layered carbides and carbonitrides. In MXenes, Jenny Stanford Publishing: 2023; pp 359-377. [26] T.S. Kvashina N.F. Uvarov M.A. Korchagin Y.L. Krutskiy A.V. Ukhina Synthesis of MXene Ti3C2 by selective etching of MAX-phase Ti3AlC2 Mater. Today Proc. 31 2020 592 594 Kvashina, T. S.; Uvarov, N. F.; Korchagin, M. A.; Krutskiy, Y. L.; Ukhina, A. V., Synthesis of MXene Ti3C2 by selective etching of MAX-phase Ti3AlC2. Materials Today: Proceedings 2020, 31, 592-594. [27] K.R.G. Lim M. Shekhirev B.C. Wyatt B. Anasori Y. Gogotsi Z.W. Seh Fundamentals of MXene synthesis Nat. Synth. 1 8 2022 601 614 Lim, K. R. G.; Shekhirev, M.; Wyatt, B. C.; Anasori, B.; Gogotsi, Y.; Seh, Z. W., Fundamentals of MXene synthesis. Nature Synthesis 2022, 1 (8), 601-614. [28] R. Ibragimova P. Rinke H.-P. Komsa Native vacancy defects in MXenes at etching conditions Chem. Mater. 34 7 2022 2896 2906 Ibragimova, R.; Rinke, P.; Komsa, H.-P., Native Vacancy Defects in MXenes at Etching Conditions. Chemistry of Materials 2022, 34 (7), 2896-2906. [29] H. Zhang L. Tian J. Han Z. Wei Z. Wu Y. Zhu Q. Guo Y. Tang Y. Cao Z. Zhang Insights into the PMS activation towards phenol removal mechanism by a Ti3C2-MXene doped BiVO4 photocatalyst Colloids Surf. A Physicochem. Eng. Asp. 2024 134561 Zhang, H.; Tian, L.; Han, J.; Wei, Z.; Wu, Z.; Zhu, Y.; Guo, Q.; Tang, Y.; Cao, Y.; Zhang, Z., Insights into the PMS activation towards phenol removal mechanism by a Ti3C2-MXene doped BiVO4 photocatalyst. Colloids and Surfaces A: Physicochemical and Engineering Aspects 2024, 134561. [30] A. Lipatov M. Alhabeb M.R. Lukatskaya A. Boson Y. Gogotsi A. Sinitskii Effect of synthesis on quality, electronic properties and environmental stability of individual monolayer Ti3C2 MXene flakes Adv. Electron. Mater. 2 12 2016 1600255 Lipatov, A.; Alhabeb, M.; Lukatskaya, M. R.; Boson, A.; Gogotsi, Y.; Sinitskii, A., Effect of synthesis on quality, electronic properties and environmental stability of individual monolayer Ti3C2 MXene flakes. Advanced Electronic Materials 2016, 2 (12), 1600255. [31] D.D. Kruger H. García A. Primo Molten salt derived MXenes: synthesis and applications Adv. Sci. 2024 2307106 Kruger, D. D.; García, H.; Primo, A., Molten Salt Derived MXenes: Synthesis and Applications. Advanced Science 2024, 2307106. [32] S. Hayashi NMR Study of dynamics and evolution of guest molecules in kaolinite/dimethyl sulfoxide intercalation compound Clay Clay Miner. 45 5 1997 724 732 Hayashi, S., NMR Study of Dynamics and Evolution of Guest Molecules in Kaolinite/Dimethyl Sulfoxide Intercalation Compound. Clays and Clay Minerals 1997, 45 (5), 724-732. [33] M. Naguib J. Halim J. Lu K.M. Cook L. Hultman Y. Gogotsi M.W. Barsoum New two-dimensional niobium and vanadium carbides as promising materials for Li-ion batteries J. Am. Chem. Soc. 135 43 2013 15966 15969 Naguib, M.; Halim, J.; Lu, J.; Cook, K. M.; Hultman, L.; Gogotsi, Y.; Barsoum, M. W., New two-dimensional niobium and vanadium carbides as promising materials for Li-ion batteries. Journal of the American Chemical Society 2013, 135 (43), 15966-15969. [34] R.R. Grau A. Lewandowska-Andralojc A. Primo H. García Enhancement of the photocatalytic hydrogen production with the exfoliation degree of Nb2C cocatalyst Int. J. Hydrogen Energy 48 53 2023 20314 20323 Grau, R. R.; Lewandowska-Andralojc, A.; Primo, A.; García, H., Enhancement of the photocatalytic hydrogen production with the exfoliation degree of Nb2C cocatalyst. International Journal of Hydrogen Energy 2023, 48 (53), 20314-20323. [35] A. Dhakshinamoorthy R. Ramírez-Grau H. Garcia A. Primo Opportunities of MXenes in heterogeneous catalysis: V2C as aerobic oxidation catalyst Chem. Eur. J. 30 37 2024 e202400576 Dhakshinamoorthy, A.; Ramírez-Grau, R.; Garcia, H.; Primo, A., Opportunities of MXenes in Heterogeneous Catalysis: V2C as Aerobic Oxidation Catalyst. Chemistry – A European Journal 2024, 30 (37), e202400576. [36] M. Alhabeb K. Maleski B. Anasori P. Lelyukh L. Clark S. Sin Y. Gogotsi Guidelines for synthesis and processing of two-dimensional titanium carbide (Ti3C2Tx MXene) Chem. Mater. 29 18 2017 7633 7644 Alhabeb, M.; Maleski, K.; Anasori, B.; Lelyukh, P.; Clark, L.; Sin, S.; Gogotsi, Y., Guidelines for Synthesis and Processing of Two-Dimensional Titanium Carbide (Ti3C2Tx MXene). Chemistry of Materials 2017, 29 (18), 7633-7644. [37] W. Zaman R.A. Matsumoto M.W. Thompson Y.-H. Liu Y. Bootwala M.B. Dixit S. Nemsak E. Crumlin M.C. Hatzell P.T. Cummings K.B. Hatzell In situ investigation of water on MXene interfaces Proc. Natl. Acad. Sci. 118 49 2021 e2108325118 Zaman, W.; Matsumoto, R. A.; Thompson, M. W.; Liu, Y.-H.; Bootwala, Y.; Dixit, M. B.; Nemsak, S.; Crumlin, E.; Hatzell, M. C.; Cummings, P. T.; Hatzell, K. B., In situ investigation of water on MXene interfaces. Proceedings of the National Academy of Sciences 2021, 118 (49), e2108325118. [38] S.M.M. Alonzo R. Dahal M.D. Ashie B.P. Bastakoti Effect of acid etching time in Ti3C2 MXene’s interlayer spacing and conductivity Microsc. Microanal. 30 Suppl. 1 2024 Alonzo, S. M. M.; Dahal, R.; Ashie, M. D.; Bastakoti, B. P., Effect of Acid Etching Time in Ti3C2 MXene’s Interlayer Spacing and Conductivity. Microscopy and Microanalysis 2024, 30 (Supplement_1). [39] L. Liu M. Orbay S. Luo S. Duluard H. Shao J. Harmel P. Rozier P.-L. Taberna P. Simon Exfoliation and delamination of Ti3C2T x MXene prepared via molten salt etching route ACS Nano 16 1 2021 111 118 Liu, L.; Orbay, M.; Luo, S.; Duluard, S.; Shao, H.; Harmel, J.; Rozier, P.; Taberna, P.-L.; Simon, P., Exfoliation and delamination of Ti3C2T x MXene prepared via molten salt etching route. ACS nano 2021, 16 (1), 111-118. [40] N. Driscoll A.G. Richardson K. Maleski B. Anasori O. Adewole P. Lelyukh L. Escobedo D.K. Cullen T.H. Lucas Y. Gogotsi F. Vitale Two-dimensional Ti3C2 MXene for high-resolution neural interfaces ACS Nano 12 10 2018 10419 10429 Driscoll, N.; Richardson, A. G.; Maleski, K.; Anasori, B.; Adewole, O.; Lelyukh, P.; Escobedo, L.; Cullen, D. K.; Lucas, T. H.; Gogotsi, Y.; Vitale, F., Two-Dimensional Ti3C2 MXene for High-Resolution Neural Interfaces. ACS Nano 2018, 12 (10), 10419-10429. [41] F. He B. Zhu B. Cheng J. Yu W. Ho W. Macyk 2D/2D/0D TiO2/C3N4/Ti3C2 MXene composite S-scheme photocatalyst with enhanced CO2 reduction activity Appl. Catal. B 272 2020 119006 He, F.; Zhu, B.; Cheng, B.; Yu, J.; Ho, W.; Macyk, W., 2D/2D/0D TiO2/C3N4/Ti3C2 MXene composite S-scheme photocatalyst with enhanced CO2 reduction activity. Applied Catalysis B: Environmental 2020, 272, 119006. [42] V. Natu M. Benchakar C. Canaff A. Habrioux S. Célérier M.W. Barsoum A critical analysis of the X-ray photoelectron spectra of Ti3C2Tz MXenes Matter 4 4 2021 1224 1251 Natu, V.; Benchakar, M.; Canaff, C.; Habrioux, A.; Célérier, S.; Barsoum, M. W., A critical analysis of the X-ray photoelectron spectra of Ti3C2Tz MXenes. Matter 2021, 4 (4), 1224-1251. [43] A. Dhakshinamoorthy A.M. Asiri H. Garcia New opportunities in metal‐organic framework catalysis: from bifunctional to frustrated lewis pairs catalysis Chem. Eur. J. 29 38 2023 e202204016 Dhakshinamoorthy, A.; Asiri, A. M.; Garcia, H., New Opportunities in Metal‐Organic Framework Catalysis: From Bifunctional to Frustrated Lewis Pairs Catalysis. Chemistry–A European Journal 2023, 29 (38), e202204016. [44] O. Mashtalir M. Naguib V.N. Mochalin Y. Dall’Agnese M. Heon M.W. Barsoum Y. Gogotsi Intercalation and delamination of layered carbides and carbonitrides Nat. Commun. 4 1 2013 1716 Mashtalir, O.; Naguib, M.; Mochalin, V. N.; Dall’Agnese, Y.; Heon, M.; Barsoum, M. W.; Gogotsi, Y., Intercalation and delamination of layered carbides and carbonitrides. Nature Communications 2013, 4 (1), 1716. [45] N. Wrobel M. Schinkinger V.M. Mirsky A novel ultraviolet assay for testing side reactions of carbodiimides Anal. Biochem. 305 2 2002 135 138 Wrobel, N.; Schinkinger, M.; Mirsky, V. M., A Novel Ultraviolet Assay for Testing Side Reactions of Carbodiimides. Analytical Biochemistry 2002, 305 (2), 135-138. [46] D. Niether S. Wiegand Thermodiffusion and hydrolysis of 1-Ethyl-3-(3-dimethylaminopropyl)carbodiimide (EDC) Eur. Phys. J. E 42 9 2019 117 Niether, D.; Wiegand, S., Thermodiffusion and hydrolysis of 1-Ethyl-3-(3-dimethylaminopropyl)carbodiimide (EDC). The European Physical Journal E 2019, 42 (9), 117. [47] M. Malaki A. Maleki R.S. Varma MXenes and ultrasonication J. Mater. Chem. A 7 18 2019 10843 10857 Malaki, M.; Maleki, A.; Varma, R. S., MXenes and ultrasonication. Journal of Materials Chemistry A 2019, 7 (18), 10843-10857. [48] E. Marquis F. Benini B. Anasori A. Rosenkranz M.C. Righi Effect of vacancies and edges in promoting water chemisorption on titanium-based MXenes Nano Converg. 10 1 2023 16 Marquis, E.; Benini, F.; Anasori, B.; Rosenkranz, A.; Righi, M. C., Effect of vacancies and edges in promoting water chemisorption on titanium-based MXenes. Nano Convergence 2023, 10 (1), 16. [49] M. Seredych C.E. Shuck D. Pinto M. Alhabeb E. Precetti G. Deysher B. Anasori N. Kurra Y. Gogotsi High-temperature behavior and surface chemistry of carbide MXenes studied by thermal analysis Chem. Mater. 31 9 2019 3324 3332 Seredych, M.; Shuck, C. E.; Pinto, D.; Alhabeb, M.; Precetti, E.; Deysher, G.; Anasori, B.; Kurra, N.; Gogotsi, Y., High-Temperature Behavior and Surface Chemistry of Carbide MXenes Studied by Thermal Analysis. Chemistry of Materials 2019, 31 (9), 3324-3332. [50] M.Y. Byun Y.E. Kim J.H. Baek J. Jae M.S. Lee Effect of surface properties of TiO2 on the performance of Pt/TiO2 catalysts for furfural hydrogenation RSC Adv. 12 2 2022 860 868 Byun, M. Y.; Kim, Y. E.; Baek, J. H.; Jae, J.; Lee, M. S., Effect of surface properties of TiO2 on the performance of Pt/TiO2 catalysts for furfural hydrogenation. RSC Advances 2022, 12 (2), 860-868. [51] F. Arena R. Dario A. Parmaliana A characterization study of the surface acidity of solid catalysts by temperature programmed methods Appl. Catal. A 170 1 1998 127 137 Arena, F.; Dario, R.; Parmaliana, A., A characterization study of the surface acidity of solid catalysts by temperature programmed methods. Applied Catalysis A: General 1998, 170 (1), 127-137. [52] P. Selig Guanidine Organocatalysis Synthesis 45 06 2013 703 718 Selig, P., Guanidine Organocatalysis. Synthesis 2013, 45 (06), 703-718. [53] F. Xia J. Lao R. Yu X. Sang J. Luo Y. Li J. Wu Ambient oxidation of Ti3C2 MXene initialized by atomic defects Nanoscale 11 48 2019 23330 23337 Xia, F.; Lao, J.; Yu, R.; Sang, X.; Luo, J.; Li, Y.; Wu, J., Ambient oxidation of Ti 3 C 2 MXene initialized by atomic defects. Nanoscale 2019, 11 (48), 23330-23337. [54] X. Meng-Xia L. Yuan Studies on the hydrogen bonding of aniline's derivatives by FT-IR Spectrochim. Acta A Mol. Biomol. Spectrosc. 58 13 2002 2817 2826 Meng-Xia, X.; Yuan, L., Studies on the hydrogen bonding of aniline's derivatives by FT-IR. Spectrochimica Acta Part A: Molecular and Biomolecular Spectroscopy 2002, 58 (13), 2817-2826. [55] M. Khazaei A. Ranjbar M. Arai T. Sasaki S. Yunoki Electronic properties and applications of MXenes: a theoretical review J. Mater. Chem. C 5 10 2017 2488 2503 Khazaei, M.; Ranjbar, A.; Arai, M.; Sasaki, T.; Yunoki, S., Electronic properties and applications of MXenes: a theoretical review. Journal of Materials Chemistry C 2017, 5 (10), 2488-2503.",
      "scopus-id": "105011295015",
      "coredata": {
        "eid": "1-s2.0-S002195172500394X",
        "dc:description": "A series of Ti3C2 samples has been prepared from Ti3AlC2 by NH4F-HCl etching, followed by subsequent post-treatments, such as DMSO expansion, ultrasound exfoliation, thermal annealing at 500 °C, surface modification by ammonium persulfate, tetrabutylammonium hydroxide and hydrochloric acid. These Ti3C2 samples have been tested as heterogeneous catalysts for guanylation of symmetrical carbodiimides by aromatic and secondary aliphatic amines, observing the formation of the corresponding guanidines, accompanied by dialkylureas. The initial reaction rates between N,N’-diisopropylcarbodiimide and p-toluidine correlate linearly with the density of weak strength acid sites of the Ti3C2 sample measured by NH3 thermo-programed desorption. This has led us to propose these weak acid sites as active centers of the reaction. Based on the population of weak acid sites, the estimated turnover numbers and frequencies were calculated to be 101 and 114 h−1 for the most active Ti3C2 sample. These values rank Ti3C2 among the most active noble metal-free solid guanylation catalysts reported so far. Upon reuse, the Ti3C2 sample undergoes gradual deactivation, characterization of the four-times used Ti3C2 sample indicates that the crystallinity is preserved. Catalyst deactivation derives from deposition of the reaction products on the surface and/or from the increase of the oxygenated surface functional groups upon reuse. Deactivation can be partially reversed by thermal product desorption. DFT calculations indicate that the rate determining step in the reaction mechanism is the cycloaddition between the carbodiimide and the deprotonated toluidine anchored to the Ti3C2 surface. The present results illustrate the potential that MXenes have as solid catalysts for organic reactions, particularly Ti MXenes to promote reactions requiring amine activation, such as the present guanylation reaction.",
        "openArchiveArticle": "false",
        "prism:coverDate": "2025-10-31",
        "openaccessUserLicense": "http://creativecommons.org/licenses/by-nc-nd/4.0/",
        "prism:aggregationType": "Journal",
        "prism:url": "https://api.elsevier.com/content/article/pii/S002195172500394X",
        "dc:creator": [
          {
            "@_fa": "true",
            "$": "Anouar, Aicha"
          },
          {
            "@_fa": "true",
            "$": "Romero Salicio, Elena"
          },
          {
            "@_fa": "true",
            "$": "García-Aznar, Pablo"
          },
          {
            "@_fa": "true",
            "$": "Grirrane, Abdessamad"
          },
          {
            "@_fa": "true",
            "$": "Forneli, Amparo"
          },
          {
            "@_fa": "true",
            "$": "Sastre, German"
          },
          {
            "@_fa": "true",
            "$": "Garcia, Hermenegildo"
          },
          {
            "@_fa": "true",
            "$": "Primo, Ana"
          }
        ],
        "link": [
          {
            "@_fa": "true",
            "@rel": "self",
            "@href": "https://api.elsevier.com/content/article/pii/S002195172500394X"
          },
          {
            "@_fa": "true",
            "@rel": "scidir",
            "@href": "https://www.sciencedirect.com/science/article/pii/S002195172500394X"
          }
        ],
        "dc:format": "application/json",
        "openaccessType": "Full",
        "pii": "S0021-9517(25)00394-X",
        "prism:volume": "450",
        "articleNumber": "116328",
        "prism:publisher": "The Author(s). Published by Elsevier Inc.",
        "dc:title": "Ti3C2 MXene as heterogeneous catalyst for carbodiimides guanylation with over 102 h−1 turnover frequencies",
        "prism:copyright": "© 2025 The Author(s). Published by Elsevier Inc.",
        "openaccess": "1",
        "prism:issn": "00219517",
        "dcterms:subject": [
          {
            "@_fa": "true",
            "$": "Heterogeneous Catalysis"
          },
          {
            "@_fa": "true",
            "$": "MXenes as catalysts"
          },
          {
            "@_fa": "true",
            "$": "Ti3C2 as catalyst"
          },
          {
            "@_fa": "true",
            "$": "Guanylation of aromatic amines"
          }
        ],
        "openaccessArticle": "true",
        "prism:publicationName": "Journal of Catalysis",
        "openaccessSponsorType": "ElsevierWaived",
        "prism:pageRange": "116328",
        "pubType": "fla",
        "prism:coverDisplayDate": "October 2025",
        "prism:doi": "10.1016/j.jcat.2025.116328",
        "prism:startingPage": "116328",
        "dc:identifier": "doi:10.1016/j.jcat.2025.116328",
        "openaccessSponsorName": "Spain (CRUE): Core Hybrid journals RAP 2025"
      },
      "objects": {
        "object": [
          {
            "@category": "standard",
            "@height": "397",
            "@width": "685",
            "@_fa": "true",
            "$": "https://api.elsevier.com/content/object/eid/1-s2.0-S002195172500394X-sc1.jpg?httpAccept=%2A%2F%2A",
            "@multimediatype": "JPEG image file",
            "@type": "IMAGE-DOWNSAMPLED",
            "@size": "61930",
            "@ref": "sc1",
            "@mimetype": "image/jpeg"
          },
          {
            "@category": "standard",
            "@height": "396",
            "@width": "704",
            "@_fa": "true",
            "$": "https://api.elsevier.com/content/object/eid/1-s2.0-S002195172500394X-sc2.jpg?httpAccept=%2A%2F%2A",
            "@multimediatype": "JPEG image file",
            "@type": "IMAGE-DOWNSAMPLED",
            "@size": "36203",
            "@ref": "sc2",
            "@mimetype": "image/jpeg"
          },
          {
            "@category": "standard",
            "@height": "548",
            "@width": "749",
            "@_fa": "true",
            "$": "https://api.elsevier.com/content/object/eid/1-s2.0-S002195172500394X-gr1.jpg?httpAccept=%2A%2F%2A",
            "@multimediatype": "JPEG image file",
            "@type": "IMAGE-DOWNSAMPLED",
            "@size": "117793",
            "@ref": "gr1",
            "@mimetype": "image/jpeg"
          },
          {
            "@category": "standard",
            "@height": "382",
            "@width": "778",
            "@_fa": "true",
            "$": "https://api.elsevier.com/content/object/eid/1-s2.0-S002195172500394X-gr2.jpg?httpAccept=%2A%2F%2A",
            "@multimediatype": "JPEG image file",
            "@type": "IMAGE-DOWNSAMPLED",
            "@size": "80105",
            "@ref": "gr2",
            "@mimetype": "image/jpeg"
          },
          {
            "@category": "standard",
            "@height": "291",
            "@width": "766",
            "@_fa": "true",
            "$": "https://api.elsevier.com/content/object/eid/1-s2.0-S002195172500394X-gr3.jpg?httpAccept=%2A%2F%2A",
            "@multimediatype": "JPEG image file",
            "@type": "IMAGE-DOWNSAMPLED",
            "@size": "37214",
            "@ref": "gr3",
            "@mimetype": "image/jpeg"
          },
          {
            "@category": "standard",
            "@height": "258",
            "@width": "698",
            "@_fa": "true",
            "$": "https://api.elsevier.com/content/object/eid/1-s2.0-S002195172500394X-fx1.jpg?httpAccept=%2A%2F%2A",
            "@multimediatype": "JPEG image file",
            "@type": "IMAGE-DOWNSAMPLED",
            "@size": "14443",
            "@ref": "fx1",
            "@mimetype": "image/jpeg"
          },
          {
            "@category": "standard",
            "@height": "179",
            "@width": "500",
            "@_fa": "true",
            "$": "https://api.elsevier.com/content/object/eid/1-s2.0-S002195172500394X-ga1.jpg?httpAccept=%2A%2F%2A",
            "@multimediatype": "JPEG image file",
            "@type": "IMAGE-DOWNSAMPLED",
            "@size": "22587",
            "@ref": "ga1",
            "@mimetype": "image/jpeg"
          },
          {
            "@category": "standard",
            "@height": "222",
            "@width": "534",
            "@_fa": "true",
            "$": "https://api.elsevier.com/content/object/eid/1-s2.0-S002195172500394X-gr4.jpg?httpAccept=%2A%2F%2A",
            "@multimediatype": "JPEG image file",
            "@type": "IMAGE-DOWNSAMPLED",
            "@size": "19741",
            "@ref": "gr4",
            "@mimetype": "image/jpeg"
          },
          {
            "@category": "standard",
            "@height": "761",
            "@width": "793",
            "@_fa": "true",
            "$": "https://api.elsevier.com/content/object/eid/1-s2.0-S002195172500394X-gr5.jpg?httpAccept=%2A%2F%2A",
            "@multimediatype": "JPEG image file",
            "@type": "IMAGE-DOWNSAMPLED",
            "@size": "85331",
            "@ref": "gr5",
            "@mimetype": "image/jpeg"
          },
          {
            "@category": "standard",
            "@height": "200",
            "@width": "714",
            "@_fa": "true",
            "$": "https://api.elsevier.com/content/object/eid/1-s2.0-S002195172500394X-gr6.jpg?httpAccept=%2A%2F%2A",
            "@multimediatype": "JPEG image file",
            "@type": "IMAGE-DOWNSAMPLED",
            "@size": "32535",
            "@ref": "gr6",
            "@mimetype": "image/jpeg"
          },
          {
            "@category": "standard",
            "@height": "310",
            "@width": "628",
            "@_fa": "true",
            "$": "https://api.elsevier.com/content/object/eid/1-s2.0-S002195172500394X-gr7.jpg?httpAccept=%2A%2F%2A",
            "@multimediatype": "JPEG image file",
            "@type": "IMAGE-DOWNSAMPLED",
            "@size": "15968",
            "@ref": "gr7",
            "@mimetype": "image/jpeg"
          },
          {
            "@category": "standard",
            "@height": "352",
            "@width": "706",
            "@_fa": "true",
            "$": "https://api.elsevier.com/content/object/eid/1-s2.0-S002195172500394X-gr8.jpg?httpAccept=%2A%2F%2A",
            "@multimediatype": "JPEG image file",
            "@type": "IMAGE-DOWNSAMPLED",
            "@size": "28147",
            "@ref": "gr8",
            "@mimetype": "image/jpeg"
          },
          {
            "@category": "thumbnail",
            "@height": "127",
            "@width": "219",
            "@_fa": "true",
            "$": "https://api.elsevier.com/content/object/eid/1-s2.0-S002195172500394X-sc1.sml?httpAccept=%2A%2F%2A",
            "@multimediatype": "GIF image file",
            "@type": "IMAGE-THUMBNAIL",
            "@size": "10546",
            "@ref": "sc1",
            "@mimetype": "image/gif"
          },
          {
            "@category": "thumbnail",
            "@height": "123",
            "@width": "219",
            "@_fa": "true",
            "$": "https://api.elsevier.com/content/object/eid/1-s2.0-S002195172500394X-sc2.sml?httpAccept=%2A%2F%2A",
            "@multimediatype": "GIF image file",
            "@type": "IMAGE-THUMBNAIL",
            "@size": "4389",
            "@ref": "sc2",
            "@mimetype": "image/gif"
          },
          {
            "@category": "thumbnail",
            "@height": "160",
            "@width": "219",
            "@_fa": "true",
            "$": "https://api.elsevier.com/content/object/eid/1-s2.0-S002195172500394X-gr1.sml?httpAccept=%2A%2F%2A",
            "@multimediatype": "GIF image file",
            "@type": "IMAGE-THUMBNAIL",
            "@size": "19249",
            "@ref": "gr1",
            "@mimetype": "image/gif"
          },
          {
            "@category": "thumbnail",
            "@height": "107",
            "@width": "219",
            "@_fa": "true",
            "$": "https://api.elsevier.com/content/object/eid/1-s2.0-S002195172500394X-gr2.sml?httpAccept=%2A%2F%2A",
            "@multimediatype": "GIF image file",
            "@type": "IMAGE-THUMBNAIL",
            "@size": "8530",
            "@ref": "gr2",
            "@mimetype": "image/gif"
          },
          {
            "@category": "thumbnail",
            "@height": "83",
            "@width": "219",
            "@_fa": "true",
            "$": "https://api.elsevier.com/content/object/eid/1-s2.0-S002195172500394X-gr3.sml?httpAccept=%2A%2F%2A",
            "@multimediatype": "GIF image file",
            "@type": "IMAGE-THUMBNAIL",
            "@size": "4334",
            "@ref": "gr3",
            "@mimetype": "image/gif"
          },
          {
            "@category": "thumbnail",
            "@height": "81",
            "@width": "219",
            "@_fa": "true",
            "$": "https://api.elsevier.com/content/object/eid/1-s2.0-S002195172500394X-fx1.sml?httpAccept=%2A%2F%2A",
            "@multimediatype": "GIF image file",
            "@type": "IMAGE-THUMBNAIL",
            "@size": "1719",
            "@ref": "fx1",
            "@mimetype": "image/gif"
          },
          {
            "@category": "thumbnail",
            "@height": "79",
            "@width": "219",
            "@_fa": "true",
            "$": "https://api.elsevier.com/content/object/eid/1-s2.0-S002195172500394X-ga1.sml?httpAccept=%2A%2F%2A",
            "@multimediatype": "GIF image file",
            "@type": "IMAGE-THUMBNAIL",
            "@size": "6040",
            "@ref": "ga1",
            "@mimetype": "image/gif"
          },
          {
            "@category": "thumbnail",
            "@height": "91",
            "@width": "219",
            "@_fa": "true",
            "$": "https://api.elsevier.com/content/object/eid/1-s2.0-S002195172500394X-gr4.sml?httpAccept=%2A%2F%2A",
            "@multimediatype": "GIF image file",
            "@type": "IMAGE-THUMBNAIL",
            "@size": "3997",
            "@ref": "gr4",
            "@mimetype": "image/gif"
          },
          {
            "@category": "thumbnail",
            "@height": "164",
            "@width": "171",
            "@_fa": "true",
            "$": "https://api.elsevier.com/content/object/eid/1-s2.0-S002195172500394X-gr5.sml?httpAccept=%2A%2F%2A",
            "@multimediatype": "GIF image file",
            "@type": "IMAGE-THUMBNAIL",
            "@size": "8500",
            "@ref": "gr5",
            "@mimetype": "image/gif"
          },
          {
            "@category": "thumbnail",
            "@height": "61",
            "@width": "219",
            "@_fa": "true",
            "$": "https://api.elsevier.com/content/object/eid/1-s2.0-S002195172500394X-gr6.sml?httpAccept=%2A%2F%2A",
            "@multimediatype": "GIF image file",
            "@type": "IMAGE-THUMBNAIL",
            "@size": "4943",
            "@ref": "gr6",
            "@mimetype": "image/gif"
          },
          {
            "@category": "thumbnail",
            "@height": "108",
            "@width": "219",
            "@_fa": "true",
            "$": "https://api.elsevier.com/content/object/eid/1-s2.0-S002195172500394X-gr7.sml?httpAccept=%2A%2F%2A",
            "@multimediatype": "GIF image file",
            "@type": "IMAGE-THUMBNAIL",
            "@size": "2362",
            "@ref": "gr7",
            "@mimetype": "image/gif"
          },
          {
            "@category": "thumbnail",
            "@height": "109",
            "@width": "219",
            "@_fa": "true",
            "$": "https://api.elsevier.com/content/object/eid/1-s2.0-S002195172500394X-gr8.sml?httpAccept=%2A%2F%2A",
            "@multimediatype": "GIF image file",
            "@type": "IMAGE-THUMBNAIL",
            "@size": "4158",
            "@ref": "gr8",
            "@mimetype": "image/gif"
          },
          {
            "@category": "high",
            "@height": "1759",
            "@width": "3035",
            "@_fa": "true",
            "$": "https://api.elsevier.com/content/object/eid/1-s2.0-S002195172500394X-sc1_lrg.jpg?httpAccept=%2A%2F%2A",
            "@multimediatype": "JPEG image file",
            "@type": "IMAGE-HIGH-RES",
            "@size": "331531",
            "@ref": "sc1",
            "@mimetype": "image/jpeg"
          },
          {
            "@category": "high",
            "@height": "1753",
            "@width": "3116",
            "@_fa": "true",
            "$": "https://api.elsevier.com/content/object/eid/1-s2.0-S002195172500394X-sc2_lrg.jpg?httpAccept=%2A%2F%2A",
            "@multimediatype": "JPEG image file",
            "@type": "IMAGE-HIGH-RES",
            "@size": "167406",
            "@ref": "sc2",
            "@mimetype": "image/jpeg"
          },
          {
            "@category": "high",
            "@height": "2428",
            "@width": "3318",
            "@_fa": "true",
            "$": "https://api.elsevier.com/content/object/eid/1-s2.0-S002195172500394X-gr1_lrg.jpg?httpAccept=%2A%2F%2A",
            "@multimediatype": "JPEG image file",
            "@type": "IMAGE-HIGH-RES",
            "@size": "1003378",
            "@ref": "gr1",
            "@mimetype": "image/jpeg"
          },
          {
            "@category": "high",
            "@height": "1690",
            "@width": "3445",
            "@_fa": "true",
            "$": "https://api.elsevier.com/content/object/eid/1-s2.0-S002195172500394X-gr2_lrg.jpg?httpAccept=%2A%2F%2A",
            "@multimediatype": "JPEG image file",
            "@type": "IMAGE-HIGH-RES",
            "@size": "443905",
            "@ref": "gr2",
            "@mimetype": "image/jpeg"
          },
          {
            "@category": "high",
            "@height": "1289",
            "@width": "3391",
            "@_fa": "true",
            "$": "https://api.elsevier.com/content/object/eid/1-s2.0-S002195172500394X-gr3_lrg.jpg?httpAccept=%2A%2F%2A",
            "@multimediatype": "JPEG image file",
            "@type": "IMAGE-HIGH-RES",
            "@size": "256468",
            "@ref": "gr3",
            "@mimetype": "image/jpeg"
          },
          {
            "@category": "high",
            "@height": "1142",
            "@width": "3091",
            "@_fa": "true",
            "$": "https://api.elsevier.com/content/object/eid/1-s2.0-S002195172500394X-fx1_lrg.jpg?httpAccept=%2A%2F%2A",
            "@multimediatype": "JPEG image file",
            "@type": "IMAGE-HIGH-RES",
            "@size": "98256",
            "@ref": "fx1",
            "@mimetype": "image/jpeg"
          },
          {
            "@category": "high",
            "@height": "794",
            "@width": "2213",
            "@_fa": "true",
            "$": "https://api.elsevier.com/content/object/eid/1-s2.0-S002195172500394X-ga1_lrg.jpg?httpAccept=%2A%2F%2A",
            "@multimediatype": "JPEG image file",
            "@type": "IMAGE-HIGH-RES",
            "@size": "127279",
            "@ref": "ga1",
            "@mimetype": "image/jpeg"
          },
          {
            "@category": "high",
            "@height": "983",
            "@width": "2363",
            "@_fa": "true",
            "$": "https://api.elsevier.com/content/object/eid/1-s2.0-S002195172500394X-gr4_lrg.jpg?httpAccept=%2A%2F%2A",
            "@multimediatype": "JPEG image file",
            "@type": "IMAGE-HIGH-RES",
            "@size": "129014",
            "@ref": "gr4",
            "@mimetype": "image/jpeg"
          },
          {
            "@category": "high",
            "@height": "3372",
            "@width": "3512",
            "@_fa": "true",
            "$": "https://api.elsevier.com/content/object/eid/1-s2.0-S002195172500394X-gr5_lrg.jpg?httpAccept=%2A%2F%2A",
            "@multimediatype": "JPEG image file",
            "@type": "IMAGE-HIGH-RES",
            "@size": "443249",
            "@ref": "gr5",
            "@mimetype": "image/jpeg"
          },
          {
            "@category": "high",
            "@height": "777",
            "@width": "2774",
            "@_fa": "true",
            "$": "https://api.elsevier.com/content/object/eid/1-s2.0-S002195172500394X-gr6_lrg.jpg?httpAccept=%2A%2F%2A",
            "@multimediatype": "JPEG image file",
            "@type": "IMAGE-HIGH-RES",
            "@size": "151118",
            "@ref": "gr6",
            "@mimetype": "image/jpeg"
          },
          {
            "@category": "high",
            "@height": "1375",
            "@width": "2782",
            "@_fa": "true",
            "$": "https://api.elsevier.com/content/object/eid/1-s2.0-S002195172500394X-gr7_lrg.jpg?httpAccept=%2A%2F%2A",
            "@multimediatype": "JPEG image file",
            "@type": "IMAGE-HIGH-RES",
            "@size": "87436",
            "@ref": "gr7",
            "@mimetype": "image/jpeg"
          },
          {
            "@category": "high",
            "@height": "1556",
            "@width": "3124",
            "@_fa": "true",
            "$": "https://api.elsevier.com/content/object/eid/1-s2.0-S002195172500394X-gr8_lrg.jpg?httpAccept=%2A%2F%2A",
            "@multimediatype": "JPEG image file",
            "@type": "IMAGE-HIGH-RES",
            "@size": "147324",
            "@ref": "gr8",
            "@mimetype": "image/jpeg"
          },
          {
            "@category": "standard",
            "@_fa": "true",
            "$": "https://api.elsevier.com/content/object/eid/1-s2.0-S002195172500394X-mmc1.docx?httpAccept=%2A%2F%2A",
            "@multimediatype": "Microsoft Word file",
            "@type": "APPLICATION",
            "@size": "40127538",
            "@ref": "mmc1",
            "@mimetype": "application/word"
          },
          {
            "@category": "thumbnail",
            "@_fa": "true",
            "$": "https://api.elsevier.com/content/object/eid/1-s2.0-S002195172500394X-si1.svg?httpAccept=%2A%2F%2A",
            "@multimediatype": "Scalable Vector Graphics file",
            "@type": "ALTIMG",
            "@size": "1578",
            "@ref": "si1",
            "@mimetype": "image/svg+xml"
          }
        ]
      },
      "link": {
        "@rel": "abstract",
        "@href": "https://api.elsevier.com/content/abstract/scopus_id/105011295015"
      }
    }
  }
}