{
  "metadata": {
    "title": "Unveiling the significant promoting effect of SO<ce:inf loc=post>2</ce:inf> on Ir/SiO<ce:inf loc=post>2</ce:inf> catalyst for the CO-SCR of NO<ce:inf loc=post>x</ce:inf> in the presence of O<ce:inf loc=post>2</ce:inf>",
    "authors": "; ; ",
    "journal": "Journal of Catalysis",
    "date": "2024-02-29",
    "doi": "10.1016/j.jcat.2024.115336",
    "abstract": "",
    "uri": "https://api.elsevier.com/content/article/pii/S0021951724000496",
    "pii": "S0021951724000496"
  },
  "fulltext": {
    "full-text-retrieval-response": {
      "scopus-eid": "2-s2.0-85183947468",
      "originalText": "serial JL 272561 291210 291744 291809 31 Journal of Catalysis JOURNALCATALYSIS 2024-01-30 2024-01-30 2024-02-01 2024-02-01 2024-05-13T12:44:40 1-s2.0-S0021951724000496 S0021-9517(24)00049-6 S0021951724000496 10.1016/j.jcat.2024.115336 S300 S300.1 FULL-TEXT 1-s2.0-S0021951724X00020 2024-05-13T12:09:44.85016Z 0 0 20240201 20240229 2024 2024-01-30T16:54:07.10184Z absattachment articleinfo articlenumber articletitlenorm authfirstinitialnorm authfirstsurnamenorm cid cids contenttype copyright crossmark dateloaded dateloadedtxt datesearch datesort dateupdated dco docsubtype doctype doi eid ewtransactionid hubeid indexeddate issn issnnorm itemstage itemtransactionid itemweight openaccess openarchive pg pgfirst pii piinorm pubdateend pubdatestart pubdatetxt pubyr sectiontitle sortorder srctitle srctitlenorm srctype ssids alllist content subj subheadings suppl tomb volfirst volissue volumelist webpdf webpdfpagecount yearnav figure table e-component body mmlmath acknowledge affil appendices articletitle auth authfirstini authfull authkeywords authlast footnotes grantnumber grantsponsor grantsponsorid highlightsabst orcid primabst ref specialabst 0021-9517 00219517 true 430 430 C Volume 430 29 115336 115336 115336 202402 February 2024 2024-02-01 2024-02-29 2024 Regular Articles article fla © 2024 Elsevier Inc. All rights reserved. UNVEILINGSIGNIFICANTPROMOTINGEFFECTSO2IRSIO2CATALYSTFORCOSCRNOXINPRESENCEO2 LI R 1 Introduction 2 Experimental 2.1 Materials 2.2 Catalyst preparation 2.3 Catalytic performance measurement 2.4 Catalyst characterization 3 Results and discussion 3.1 Basic catalyst characterization 3.1.1 Physical structure analysis 3.1.2 XPS analysis 3.1.3 NOx-TPD 3.2 CO-SCR performance 3.3 Advanced characterization 3.3.1 In situ XAFS analysis 3.3.2 In situ DRIFTS studies 4 Conclusions CRediT authorship contribution statement Acknowledgments Appendix A Supplementary data References XIE 2022 2441 2453 S LIU 2012 8799 8814 Z LIU 2006 43 89 Z HAN 2019 10916 10976 L GHOLAMI 2021 68 119 Z ZOU 2015 334 343 W JI 2023 1230 1239 Y TAMAI 2007 885 888 T SONG 2020 2120 2136 J HEO 2020 8344 8351 I SONG 2020 J JI 2023 224 236 Y HANEDA 2010 39 49 M YAMAMOTO 2002 2449 2458 T ZENG 2020 34 41 J LIU 2022 72 86 S TAYLOR 1980 53 71 K WANG 2003 319 329 A INOMATA 2008 783 789 H OGURA 2000 146 147 M JI 2022 Y HANEDA 2005 197 205 M YOSHINARI 2001 155 158 T MIAO 2012 2115 2121 X DUAN 2015 618 626 K JIANG 2018 39161 39167 B XU 2020 222 233 Y JIANG 2010 3132 3137 H CAO 2019 161 172 W JIA 2021 10 22 A YANG 2013 19 28 S LIN 2013 15314 15317 J ZHANG 2018 Y DEO 1971 270 281 A BUSCA 1999 723 736 G MORROW 1991 1695 1701 B BOUNECHADA 2014 29713 29723 D YOU 2021 119374 Y IOJOIU 2004 39 48 E HANEDA 2006 423 426 M LIN 2014 142 149 J LIU 2016 255 262 Z LIU 2018 179 186 Z YOSHINARI 2003 157 169 T OKUMURA 2006 577 583 K ALI 1997 13 22 A GUSTAFSON 2018 4438 4445 J YANG 2021 12446 12468 W GRACIA 2005 372 387 F SHIN 2018 102 107 H TAIRA 2016 9773 9780 K LIX2024X115336 LIX2024X115336XR 2026-02-01T00:00:00.000Z 2026-02-01T00:00:00.000Z http://creativecommons.org/licenses/by-nc-nd/4.0/ © 2024 Elsevier Inc. All rights reserved. 2024-02-06T06:23:10.988Z http://vtw.elsevier.com/data/voc/AddOnTypes/50.7/aggregated-refined National Natural Science Foundation of China 21876009 22211530066 22276010 NSFC National Natural Science Foundation of China http://data.elsevier.com/vocabulary/SciValFunders/501100001809 http://sws.geonames.org/1814991/ Fundamental Research Funds for the Central Universities JD2110 PY2103 Fundamental Research Funds for the Central Universities http://data.elsevier.com/vocabulary/SciValFunders/501100012226 http://sws.geonames.org/1814991/ Fundamental Research Funds for the Central Universities http://data.elsevier.com/vocabulary/SciValFunders/501100013804 http://sws.geonames.org/1814991 This work was financially supported by the National Natural Science Foundation of China [ 22276010 , 22211530066 , 21876009 ], and the Fundamental Research Funds for the Central Universities [ PY2103 , JD2110 ]. https://doi.org/10.15223/policy-017 https://doi.org/10.15223/policy-037 https://doi.org/10.15223/policy-012 https://doi.org/10.15223/policy-029 https://doi.org/10.15223/policy-004 item S0021-9517(24)00049-6 S0021951724000496 1-s2.0-S0021951724000496 10.1016/j.jcat.2024.115336 272561 2024-05-13T12:09:44.85016Z 2024-02-01 2024-02-29 1-s2.0-S0021951724000496-main.pdf https://s3-eu-west-1.amazonaws.com/prod-ucs-content-store-eu-west/content/pii:S0021951724000496/MAIN/application/pdf/5b6ee3b4a72b15943a1efedd5f5910cd/main.pdf main.pdf pdf true 7267899 MAIN 10 1-s2.0-S0021951724000496-main_1.png https://s3-eu-west-1.amazonaws.com/prod-ucs-content-store-eu-west/content/pii:S0021951724000496/PREVIEW/image/png/1fbc180fd635325f59d184cd7b2a161d/main_1.png main_1.png png 58864 849 656 IMAGE-WEB-PDF 1 1-s2.0-S0021951724000496-gr2.jpg https://s3-eu-west-1.amazonaws.com/prod-ucs-content-store-eu-west/content/pii:S0021951724000496/gr2/DOWNSAMPLED/image/jpeg/8e45ce1ab2b238a2363e88f158dc98df/gr2.jpg gr2 gr2.jpg jpg 95470 618 727 IMAGE-DOWNSAMPLED 1-s2.0-S0021951724000496-gr3.jpg https://s3-eu-west-1.amazonaws.com/prod-ucs-content-store-eu-west/content/pii:S0021951724000496/gr3/DOWNSAMPLED/image/jpeg/7e1c886b7b73e537181407e65098a532/gr3.jpg gr3 gr3.jpg jpg 19334 298 382 IMAGE-DOWNSAMPLED 1-s2.0-S0021951724000496-gr4.jpg https://s3-eu-west-1.amazonaws.com/prod-ucs-content-store-eu-west/content/pii:S0021951724000496/gr4/DOWNSAMPLED/image/jpeg/61f9510df28a7d4680dd25fbcd2646e8/gr4.jpg gr4 gr4.jpg jpg 37287 530 382 IMAGE-DOWNSAMPLED 1-s2.0-S0021951724000496-gr5.jpg https://s3-eu-west-1.amazonaws.com/prod-ucs-content-store-eu-west/content/pii:S0021951724000496/gr5/DOWNSAMPLED/image/jpeg/6e3b1d4383c6afc87d79f8e651121a20/gr5.jpg gr5 gr5.jpg jpg 73663 896 382 IMAGE-DOWNSAMPLED 1-s2.0-S0021951724000496-gr13.jpg https://s3-eu-west-1.amazonaws.com/prod-ucs-content-store-eu-west/content/pii:S0021951724000496/gr13/DOWNSAMPLED/image/jpeg/94a3443501ffb8bc9874c9cbb4a1f06b/gr13.jpg gr13 gr13.jpg jpg 71416 525 380 IMAGE-DOWNSAMPLED 1-s2.0-S0021951724000496-gr14.jpg https://s3-eu-west-1.amazonaws.com/prod-ucs-content-store-eu-west/content/pii:S0021951724000496/gr14/DOWNSAMPLED/image/jpeg/fbcacba0a97566af68c4e97bde44feb2/gr14.jpg gr14 gr14.jpg jpg 58520 351 733 IMAGE-DOWNSAMPLED 1-s2.0-S0021951724000496-gr1.jpg https://s3-eu-west-1.amazonaws.com/prod-ucs-content-store-eu-west/content/pii:S0021951724000496/gr1/DOWNSAMPLED/image/jpeg/794249c639e9024fdfa92895059ec4b3/gr1.jpg gr1 gr1.jpg jpg 144177 790 656 IMAGE-DOWNSAMPLED 1-s2.0-S0021951724000496-gr6.jpg https://s3-eu-west-1.amazonaws.com/prod-ucs-content-store-eu-west/content/pii:S0021951724000496/gr6/DOWNSAMPLED/image/jpeg/824578f035df8c8c20a36462ddec07d8/gr6.jpg gr6 gr6.jpg jpg 26054 290 382 IMAGE-DOWNSAMPLED 1-s2.0-S0021951724000496-gr7.jpg https://s3-eu-west-1.amazonaws.com/prod-ucs-content-store-eu-west/content/pii:S0021951724000496/gr7/DOWNSAMPLED/image/jpeg/ffb90f71bae55ad0f5eaf95f2a0db85f/gr7.jpg gr7 gr7.jpg jpg 22276 286 382 IMAGE-DOWNSAMPLED 1-s2.0-S0021951724000496-gr8.jpg https://s3-eu-west-1.amazonaws.com/prod-ucs-content-store-eu-west/content/pii:S0021951724000496/gr8/DOWNSAMPLED/image/jpeg/f0205a61eaca19b73c24f94f5595e160/gr8.jpg gr8 gr8.jpg jpg 23726 253 382 IMAGE-DOWNSAMPLED 1-s2.0-S0021951724000496-gr9.jpg https://s3-eu-west-1.amazonaws.com/prod-ucs-content-store-eu-west/content/pii:S0021951724000496/gr9/DOWNSAMPLED/image/jpeg/78a3493d5668ff23f566e29561c0cf34/gr9.jpg gr9 gr9.jpg jpg 26724 292 382 IMAGE-DOWNSAMPLED 1-s2.0-S0021951724000496-ga1.jpg https://s3-eu-west-1.amazonaws.com/prod-ucs-content-store-eu-west/content/pii:S0021951724000496/ga1/DOWNSAMPLED/image/jpeg/e4109be39ea838c91b26d1451b99ce84/ga1.jpg ga1 true ga1.jpg jpg 16966 245 301 IMAGE-DOWNSAMPLED 1-s2.0-S0021951724000496-gr10.jpg https://s3-eu-west-1.amazonaws.com/prod-ucs-content-store-eu-west/content/pii:S0021951724000496/gr10/DOWNSAMPLED/image/jpeg/13116bbc8500b5601c514b481e88e491/gr10.jpg gr10 gr10.jpg jpg 25018 278 382 IMAGE-DOWNSAMPLED 1-s2.0-S0021951724000496-gr11.jpg https://s3-eu-west-1.amazonaws.com/prod-ucs-content-store-eu-west/content/pii:S0021951724000496/gr11/DOWNSAMPLED/image/jpeg/850a24b9b871f0de5180879fb2a98a1a/gr11.jpg gr11 gr11.jpg jpg 29588 290 382 IMAGE-DOWNSAMPLED 1-s2.0-S0021951724000496-gr12.jpg https://s3-eu-west-1.amazonaws.com/prod-ucs-content-store-eu-west/content/pii:S0021951724000496/gr12/DOWNSAMPLED/image/jpeg/e1bcf9f42dda2f993cad28c336d68cdf/gr12.jpg gr12 gr12.jpg jpg 69171 627 382 IMAGE-DOWNSAMPLED 1-s2.0-S0021951724000496-gr2.sml https://s3-eu-west-1.amazonaws.com/prod-ucs-content-store-eu-west/content/pii:S0021951724000496/gr2/THUMBNAIL/image/gif/1c12cce30423b7553a6184bd462f73ac/gr2.sml gr2 gr2.sml sml 12200 164 193 IMAGE-THUMBNAIL 1-s2.0-S0021951724000496-gr3.sml https://s3-eu-west-1.amazonaws.com/prod-ucs-content-store-eu-west/content/pii:S0021951724000496/gr3/THUMBNAIL/image/gif/2fda92de05c9ef7866e5c5b21113e374/gr3.sml gr3 gr3.sml sml 5618 164 210 IMAGE-THUMBNAIL 1-s2.0-S0021951724000496-gr4.sml https://s3-eu-west-1.amazonaws.com/prod-ucs-content-store-eu-west/content/pii:S0021951724000496/gr4/THUMBNAIL/image/gif/10a55b92b449e4f15c07cace5dfb1c40/gr4.sml gr4 gr4.sml sml 4581 164 118 IMAGE-THUMBNAIL 1-s2.0-S0021951724000496-gr5.sml https://s3-eu-west-1.amazonaws.com/prod-ucs-content-store-eu-west/content/pii:S0021951724000496/gr5/THUMBNAIL/image/gif/58d232cf8e5a5432412d283ebc56daf2/gr5.sml gr5 gr5.sml sml 4064 164 70 IMAGE-THUMBNAIL 1-s2.0-S0021951724000496-gr13.sml https://s3-eu-west-1.amazonaws.com/prod-ucs-content-store-eu-west/content/pii:S0021951724000496/gr13/THUMBNAIL/image/gif/baeb00a9c4b977a71755a33d33f408b0/gr13.sml gr13 gr13.sml sml 8785 163 118 IMAGE-THUMBNAIL 1-s2.0-S0021951724000496-gr14.sml https://s3-eu-west-1.amazonaws.com/prod-ucs-content-store-eu-west/content/pii:S0021951724000496/gr14/THUMBNAIL/image/gif/b1b416f14f1c9b589f0fe4c4176c2cbc/gr14.sml gr14 gr14.sml sml 8109 105 219 IMAGE-THUMBNAIL 1-s2.0-S0021951724000496-gr1.sml https://s3-eu-west-1.amazonaws.com/prod-ucs-content-store-eu-west/content/pii:S0021951724000496/gr1/THUMBNAIL/image/gif/3f7dd309d10ca64e76bf3616432a5eab/gr1.sml gr1 gr1.sml sml 12715 164 136 IMAGE-THUMBNAIL 1-s2.0-S0021951724000496-gr6.sml https://s3-eu-west-1.amazonaws.com/prod-ucs-content-store-eu-west/content/pii:S0021951724000496/gr6/THUMBNAIL/image/gif/cdde09c5f1a0cf3ef1d857eba601ce6f/gr6.sml gr6 gr6.sml sml 7223 164 216 IMAGE-THUMBNAIL 1-s2.0-S0021951724000496-gr7.sml https://s3-eu-west-1.amazonaws.com/prod-ucs-content-store-eu-west/content/pii:S0021951724000496/gr7/THUMBNAIL/image/gif/2302a0f967351efaf2e5e09eb1ca1882/gr7.sml gr7 gr7.sml sml 6307 164 219 IMAGE-THUMBNAIL 1-s2.0-S0021951724000496-gr8.sml https://s3-eu-west-1.amazonaws.com/prod-ucs-content-store-eu-west/content/pii:S0021951724000496/gr8/THUMBNAIL/image/gif/5ad445c3b858a5f9b87e9061cea3fc5c/gr8.sml gr8 gr8.sml sml 7038 145 219 IMAGE-THUMBNAIL 1-s2.0-S0021951724000496-gr9.sml https://s3-eu-west-1.amazonaws.com/prod-ucs-content-store-eu-west/content/pii:S0021951724000496/gr9/THUMBNAIL/image/gif/b237f6341730d9c1d6a2959fea24832d/gr9.sml gr9 gr9.sml sml 7368 164 214 IMAGE-THUMBNAIL 1-s2.0-S0021951724000496-ga1.sml https://s3-eu-west-1.amazonaws.com/prod-ucs-content-store-eu-west/content/pii:S0021951724000496/ga1/THUMBNAIL/image/gif/62ba541fb96c5409ed2bc7970ca5a1a1/ga1.sml ga1 true ga1.sml sml 6690 164 201 IMAGE-THUMBNAIL 1-s2.0-S0021951724000496-gr10.sml https://s3-eu-west-1.amazonaws.com/prod-ucs-content-store-eu-west/content/pii:S0021951724000496/gr10/THUMBNAIL/image/gif/8456692a2363b417678493c99c6c1854/gr10.sml gr10 gr10.sml sml 8091 159 219 IMAGE-THUMBNAIL 1-s2.0-S0021951724000496-gr11.sml https://s3-eu-west-1.amazonaws.com/prod-ucs-content-store-eu-west/content/pii:S0021951724000496/gr11/THUMBNAIL/image/gif/2dfdb8153f17bd94a45833a6612d895e/gr11.sml gr11 gr11.sml sml 8588 164 216 IMAGE-THUMBNAIL 1-s2.0-S0021951724000496-gr12.sml https://s3-eu-west-1.amazonaws.com/prod-ucs-content-store-eu-west/content/pii:S0021951724000496/gr12/THUMBNAIL/image/gif/41dc3e9ff4cfd3dfa1d78768bcbdc54e/gr12.sml gr12 gr12.sml sml 5995 164 100 IMAGE-THUMBNAIL 1-s2.0-S0021951724000496-gr2_lrg.jpg https://s3-eu-west-1.amazonaws.com/prod-ucs-content-store-eu-west/content/pii:S0021951724000496/HIGHRES/image/jpeg/cb9b21a2df586632f561227547ea4870/gr2_lrg.jpg gr2 gr2_lrg.jpg jpg 907351 2738 3221 IMAGE-HIGH-RES 1-s2.0-S0021951724000496-gr3_lrg.jpg https://s3-eu-west-1.amazonaws.com/prod-ucs-content-store-eu-west/content/pii:S0021951724000496/HIGHRES/image/jpeg/36e9aa2969c6273d0b785eb586f0c2b2/gr3_lrg.jpg gr3 gr3_lrg.jpg jpg 150443 1319 1693 IMAGE-HIGH-RES 1-s2.0-S0021951724000496-gr4_lrg.jpg https://s3-eu-west-1.amazonaws.com/prod-ucs-content-store-eu-west/content/pii:S0021951724000496/HIGHRES/image/jpeg/d5d4c0167ad224b2ecfc0010d7013ebe/gr4_lrg.jpg gr4 gr4_lrg.jpg jpg 275986 2348 1693 IMAGE-HIGH-RES 1-s2.0-S0021951724000496-gr5_lrg.jpg https://s3-eu-west-1.amazonaws.com/prod-ucs-content-store-eu-west/content/pii:S0021951724000496/HIGHRES/image/jpeg/d68fd8bbfc4f6d68c3c4dda7aeb128cf/gr5_lrg.jpg gr5 gr5_lrg.jpg jpg 587612 3972 1693 IMAGE-HIGH-RES 1-s2.0-S0021951724000496-gr13_lrg.jpg https://s3-eu-west-1.amazonaws.com/prod-ucs-content-store-eu-west/content/pii:S0021951724000496/HIGHRES/image/jpeg/052f561909334ff0b84d154df81c9626/gr13_lrg.jpg gr13 gr13_lrg.jpg jpg 559876 2324 1683 IMAGE-HIGH-RES 1-s2.0-S0021951724000496-gr14_lrg.jpg https://s3-eu-west-1.amazonaws.com/prod-ucs-content-store-eu-west/content/pii:S0021951724000496/HIGHRES/image/jpeg/13d81276cc48c2c42e1df268828893b6/gr14_lrg.jpg gr14 gr14_lrg.jpg jpg 391708 1554 3244 IMAGE-HIGH-RES 1-s2.0-S0021951724000496-gr1_lrg.jpg https://s3-eu-west-1.amazonaws.com/prod-ucs-content-store-eu-west/content/pii:S0021951724000496/HIGHRES/image/jpeg/94781c880a85dd0a79c09ac280d759d9/gr1_lrg.jpg gr1 gr1_lrg.jpg jpg 1275735 3497 2904 IMAGE-HIGH-RES 1-s2.0-S0021951724000496-gr6_lrg.jpg https://s3-eu-west-1.amazonaws.com/prod-ucs-content-store-eu-west/content/pii:S0021951724000496/HIGHRES/image/jpeg/d64c5fe98409309ab8a624b20630c188/gr6_lrg.jpg gr6 gr6_lrg.jpg jpg 200228 1284 1693 IMAGE-HIGH-RES 1-s2.0-S0021951724000496-gr7_lrg.jpg https://s3-eu-west-1.amazonaws.com/prod-ucs-content-store-eu-west/content/pii:S0021951724000496/HIGHRES/image/jpeg/fad9e910e0ab70d90d72d81e67ddf178/gr7_lrg.jpg gr7 gr7_lrg.jpg jpg 167654 1267 1693 IMAGE-HIGH-RES 1-s2.0-S0021951724000496-gr8_lrg.jpg https://s3-eu-west-1.amazonaws.com/prod-ucs-content-store-eu-west/content/pii:S0021951724000496/HIGHRES/image/jpeg/13e7d697fe05812ed5fc8e59a1d45143/gr8_lrg.jpg gr8 gr8_lrg.jpg jpg 179842 1120 1693 IMAGE-HIGH-RES 1-s2.0-S0021951724000496-gr9_lrg.jpg https://s3-eu-west-1.amazonaws.com/prod-ucs-content-store-eu-west/content/pii:S0021951724000496/HIGHRES/image/jpeg/2467ce907e7c27d3df9f23af87175454/gr9_lrg.jpg gr9 gr9_lrg.jpg jpg 202670 1295 1693 IMAGE-HIGH-RES 1-s2.0-S0021951724000496-ga1_lrg.jpg https://s3-eu-west-1.amazonaws.com/prod-ucs-content-store-eu-west/content/pii:S0021951724000496/HIGHRES/image/jpeg/2b713e19bbe79aeead694f8efae277e8/ga1_lrg.jpg ga1 true ga1_lrg.jpg jpg 106877 1085 1333 IMAGE-HIGH-RES 1-s2.0-S0021951724000496-gr10_lrg.jpg https://s3-eu-west-1.amazonaws.com/prod-ucs-content-store-eu-west/content/pii:S0021951724000496/HIGHRES/image/jpeg/58e082ea7963f65a09e2d61114f2a08a/gr10_lrg.jpg gr10 gr10_lrg.jpg jpg 204157 1232 1693 IMAGE-HIGH-RES 1-s2.0-S0021951724000496-gr11_lrg.jpg https://s3-eu-west-1.amazonaws.com/prod-ucs-content-store-eu-west/content/pii:S0021951724000496/HIGHRES/image/jpeg/03343e611f9f62ecb36caa7831cb6a18/gr11_lrg.jpg gr11 gr11_lrg.jpg jpg 232240 1287 1693 IMAGE-HIGH-RES 1-s2.0-S0021951724000496-gr12_lrg.jpg https://s3-eu-west-1.amazonaws.com/prod-ucs-content-store-eu-west/content/pii:S0021951724000496/HIGHRES/image/jpeg/4ac7aee4ce4735fd606e912f545800da/gr12_lrg.jpg gr12 gr12_lrg.jpg jpg 525468 2780 1693 IMAGE-HIGH-RES 1-s2.0-S0021951724000496-mmc1.docx https://s3-eu-west-1.amazonaws.com/prod-ucs-content-store-eu-west/content/pii:S0021951724000496/mmc1/MAIN/application/vnd.openxmlformats-officedocument.wordprocessingml.document/6adb3c4ca134987ccf83b958a0c1097f/mmc1.docx mmc1 mmc1.docx docx 173650 APPLICATION 1-s2.0-S0021951724000496-si1.svg https://s3-eu-west-1.amazonaws.com/prod-ucs-content-store-eu-west/content/pii:S0021951724000496/image/svg+xml/c77b09cc080f42c9ee75e6f0b7236d27/si1.svg si1 si1.svg svg 26870 ALTIMG 1-s2.0-S0021951724000496-si2.svg https://s3-eu-west-1.amazonaws.com/prod-ucs-content-store-eu-west/content/pii:S0021951724000496/image/svg+xml/0bb9de2b4747a34bd62af9bae57260f2/si2.svg si2 si2.svg svg 24675 ALTIMG 1-s2.0-S0021951724000496-si3.svg https://s3-eu-west-1.amazonaws.com/prod-ucs-content-store-eu-west/content/pii:S0021951724000496/image/svg+xml/5ff59f0f10f36dbaf15cce5ac637c6d7/si3.svg si3 si3.svg svg 30462 ALTIMG 1-s2.0-S0021951724000496-si4.svg https://s3-eu-west-1.amazonaws.com/prod-ucs-content-store-eu-west/content/pii:S0021951724000496/image/svg+xml/9edef15e1eac9b25edf39818c270e227/si4.svg si4 si4.svg svg 22329 ALTIMG 1-s2.0-S0021951724000496-si5.svg https://s3-eu-west-1.amazonaws.com/prod-ucs-content-store-eu-west/content/pii:S0021951724000496/image/svg+xml/a2cc169665d0f7bb1ac1992a968c1d21/si5.svg si5 si5.svg svg 24247 ALTIMG 1-s2.0-S0021951724000496-am.pdf https://s3-eu-west-1.amazonaws.com/prod-ucs-content-store-eu-west/content/egi:10S97XLD7CW/MAIN/application/pdf/fa09be7affabab83ed9d5759a4978af7/am.pdf am am.pdf pdf false 2246634 AAM-PDF YJCAT 115336 115336 S0021-9517(24)00049-6 10.1016/j.jcat.2024.115336 Elsevier Inc. Fig. 1 SEM image(a), TEM image(b) and HRTEM image(c) of Ir/SiO2 catalyst. Fig. 2 Comparison of the TEM images and particle size distribution of the fresh Ir/SiO2 (a, c) and used Ir/SiO2(S) (b, d) catalysts. Fig. 3 XRD patterns of SiO2 and Ir/SiO2. Fig. 4 XPS spectra of Ir 4f (a) for the fresh and used Ir/SiO2(S) catalysts and S 2p(b) for the used Ir/SiO2(S). Fig. 5 Effect of SO2 on the NOx conversion (a), CO conversion (b), and N2 selectivity (c) over Ir/SiO2 catalyst in the CO-SCR of NOx. Reaction conditions: 1000 ppm NO, 6000 ppm CO, 5 % O2, 0 or different concentrations of SO2 (10–50 ppm), He balance, GHSV = 20000 h−1. Fig. 6 Comparison of the TOFs over Ir/SiO2 catalyst in the absence and presence of SO2. Fig. 7 Temperature dependence of CO-SCR reaction rate over Ir/SiO2 in the absence and presence of 20 ppm SO2. Fig. 8 The effect of SO2 on the CO-SCR activity of Ir/SiO2 catalyst at 200 °C. Reaction conditions: 1000 ppm NO, 6000 ppm CO, 5 % O2, 0 or 20 ppm SO2, He balance, GHSV = 20000 h−1. Fig. 9 Effect of O2 on the CO-SCR activity of Ir/SiO2 catalyst. Reaction conditions: 1000 ppm NO, 6000 ppm CO, 2–10 % O2, 20 ppm SO2, He balance, GHSV = 20000 h−1. Fig. 10 In situ Ir L3 XANES spectra for Ir/SiO2 catalyst under different atmosphere and temperatures. Fig. 11 In situ DRIFT spectra of SO2 + O2 adsorption over Ir/SiO2 catalyst at 225 °C. Conditions: 20 ppm SO2, 5 % O2, He balance. Fig. 12 The dynamic changes of in situ DRIFT spectra of CO adsorption over Ir/SiO2 catalyst at 225 °C under different atmosphere (a: addition of SO2; b: removal of SO2). Fig. 13 In situ DRIFT spectra of surface species in the steady state over Ir/SiO2 catalyst at different temperatures (a and b: NO + CO + O2; c and d: NO + CO + O2 + SO2). Scheme 1 Illustration of the promotional mechanism of SO2 on Ir/SiO2 catalyst for the CO-SCR of NOx in the presence of O2. Table 1 The catalytic performance comparison of different Ir-based catalysts. Catalyst Temperature(℃) Reaction conditions TOF(S-1) Reference Ir/SiO2 200 1000 ppm NO, 6000 ppm CO, 5 % O2, 20 ppm SO2, He balance 3.43 × 10-2 This work Ir/SiO2 200 1000 ppm NO, 6000 ppm CO, 5 % O2, He balance 2.45 × 10-2 This work Irn/KIT-6 280 1000 ppm NO, 4000 ppm CO, 1 %O2, Ar balance 3.97 × 10-3 [21] IrW-WO3/KIT-6 250 1000 ppm NO, 4000 ppm CO, 1 %O2, Ar balance 8.06 × 10-3 [21] Irn-WO3/KIT-6 280 1000 ppm NO, 4000 ppm CO, 1 %O2, Ar balance 5.80 × 10-3 [21] Unveiling the significant promoting effect of SO2 on Ir/SiO2 catalyst for the CO-SCR of NOx in the presence of O2 Ruoyuan Li Writing – original draft Investigation a b 1 Aixia Li Writing – original draft Investigation a b 1 Junhua Li Formal analysis c Yao Wang Formal analysis a b Zhiming Liu Writing – review & editing Supervision Project administration Formal analysis Conceptualization a b ⁎ a State Key Laboratory of Chemical Resource Engineering, Beijing University of Chemical Technology, Beijing 100029, China State Key Laboratory of Chemical Resource Engineering Beijing University of Chemical Technology Beijing 100029 China State Key Laboratory of Chemical Resource Engineering, Beijing University of Chemical Technology, Beijing 100029, China b Beijing Key Laboratory of Energy Environmental Catalysis, Beijing University of Chemical Technology, Beijing 100029, China Beijing Key Laboratory of Energy Environmental Catalysis Beijing University of Chemical Technology Beijing 100029 China Beijing Key Laboratory of Energy Environmental Catalysis, Beijing University of Chemical Technology, Beijing 100029, China c State Key Joint Laboratory of Environment Simulation and Pollution Control, School of Environment, Tsinghua University, Beijing 100084, China State Key Joint Laboratory of Environment Simulation and Pollution Control School of Environment Tsinghua University Beijing 100084 China State Key Joint Laboratory of Environment Simulation and Pollution Control, School of Environment, Tsinghua University, Beijing 100084, China ⁎ Corresponding author. 1 These authors contributed equally to this work. Graphical abstract Selective catalytic reduction of NOx by CO (CO-SCR) in the presence of O2 is challenging because in this process CO is prone to being oxidized by O2, thus inhibiting NOx reduction by CO. Furthermore, SO2 typically leads to the deactivation of the CO-SCR catalyst. Herein, a significant promoting effect of SO2 on Ir/SiO2 catalyst for the CO-SCR of NOx in the presence of O2 is reported. In-situ X-ray Absorption Fine Structure (XAFS) and X-ray photoelectron spectroscopy (XPS) analysis showed that SO2 does not affect the chemical nature of Ir0 under reaction conditions. However, SO2 can be oxidized to sulfate and deposit on the catalyst surface. In situ diffuse reflectance infrared Fourier transform spectroscopy (DRIFTS) analysis demonstrated that the presence of SO2 can inhibit the CO + O2 reaction, thus leaving more CO available to reduce NOx over the active Ir0 sites. As a result, the reduction of NOx is remarkably promoted even in the presence of O2 and SO2. Keywords NOx reduction CO-SCR Ir/SiO2 catalyst SO2 effect Data availability Data will be made available on request. 1 Introduction Nitrogen oxides (NOx) from both mobile and stationary sources can cause serious environmental issues, such as haze and acid rain [1]. Selective catalytic reduction (SCR) of NOx by the appropriate reducing agent has proven to be an effective method for addressing these issues, and the commonly used reducing agent is NH3 [2,3]. However, many problems are encountered in the NH3-SCR technology, such as NH3 slip, fouling of air heaters, and the complexity of the after-treatment system [4]. As emissions regulations become increasingly stringent, the control of multiple pollutants remains to be one of the challenging tasks. Recently, selective catalytic reduction of NOx by CO(CO-SCR) has attracted more and more attention because in this process NOx and CO can be removed simultaneously [5–7]. A variety of catalysts, including noble metal [8–13] and metal oxide [14–16] catalysts, have been investigated for the CO-SCR of NOx. Although some metal oxide catalysts are active for the reduction of NOx by CO in the absence of O2, they are no longer effective for the removal of NOx in the presence of O2 due to the competitive reaction between NO + CO and CO + O2 [15,16]. The latter reaction leads to the consumption of CO, leaving little CO available to reduce NOx. Taylor and Schlatter [17] investigated the noble metal (Pt, Pd, Rh, and Ir) catalysts for the CO-SCR of NOx in the presence of O2, and found that Ir catalyst is active for the removal of NOx. Wang et al. [18] also reported that Ir/ZSM-5 catalyst is more active than other noble catalysts (Pt, Pd, and Rh/ZSM-5) for the CO-SCR of NOx in the presence of 2 % O2. Previous research has shown that Ir-based catalyst is the most active for the CO-SCR reaction in the presence of O2. Since O2 and SO2 are typically co-present in actual exhaust, the catalytic performance of the CO-SCR catalyst in the presence of both O2 and SO2 has been investigated [10,19]. For Ir/Al2O3 catalyst, the presence of SO2 led to a decrease of the activity, and the poisoning effect is irreversible [20]. The formation of Al2(SO4)3 on the catalyst was proposed to be responsible for the deactivation. The recent research by Ji et al. [21] has shown that IrW-WO3/KIT-6 catalyst exhibited high tolerance to SO2, with only a slight decrease in activity in the presence of 50 ppm SO2. Haneda et al. [22,23] reported that the presence of 20 ppm SO2 can promote the CO-SCR reaction over Ir/SiO2 catalyst. Furthermore, when the SO2 was removed from the reaction stream, the promoting effect was almost completely lost [22]. However, the promoting effect of SO2 is not yet clear. Therefore, revealing the enhancement mechanism is crucial for the development of highly efficient CO-SCR catalyst. In the present study, we have fabricated nanosphere SiO2 supported Ir catalyst and investigated its catalytic performance for the CO-SCR of NOx in the presence of O2. Interestingly, a remarkable promoting effect of SO2 was observed, and the enhancement was still maintained even when SO2 was excluded from the reaction gas. Based on the in situ X-ray Absorption Fine Structure (XAFS) and in situ diffuse reflectance infrared Fourier transform spectroscopy (DRIFTS), the cause of the promotional effect of SO2 on Ir/SiO2 catalyst has been revealed. This research provides novel insights into the mechanistic role of SO2 on Ir/SiO2 catalyst for CO-SCR of NOx. 2 Experimental 2.1 Materials Ethanol (≥99.7 %), NH3·H2O solution (25 ∼ 28 %) and tetraethyl orthosilic (TEOS) (≥98.5 %) are purchased from Beijing Tongguang Fine Chemicals Co., Ltd. IrCl3(55.47 % Ir, Aladdin) was used in the catalyst preparation. The gas used were 2.03 % NO/He (certified mixture grade), 3.98 % CO/He (certified mixture grade), 3.96 % H2/He (certified mixture grade), 1493 ppm SO2/He (certified mixture grade), He (99.999 %) and O2 (99.999 %), and all were supplied by Beijing Haipu Gas Co., Ltd. 2.2 Catalyst preparation SiO2 nanosphere was prepared by the Stöber method [24]. After mixing 7.67 mol of ethanol, 300 ml of NH3·H2O solution (containing 4.01 mol NH3), and 1.66 mol of deionized water, 0.16 mol TEOS was added to the solution. Subsequently, the mixture was refluxed at 60 °C for 2 h. The obtained turbid suspension was collected by centrifugation, washed with ethanol and dried at 120 °C for 10 h. Then SiO2 nanosphere was obtained. Ir/SiO2 catalyst with a Ir loading of 0.5 wt% was prepared by the impregnation method. In a typical synthesis, 1 g SiO2 nanosphere was impregnated with 1.49 ml 1.74 mol/L IrCl3 solution. Then the mixture was dried at 120 °C for 10 h and calcined at 500 °C in air for 4 h. 2.3 Catalytic performance measurement The catalytic performance was evaluated in a fixed-bed quartz reactor with the reactant gas consisting of 1000 ppm NO, 6000 ppm CO, 5 % O2, 10–50 ppm SO2 (when used) and He (the balance gas). The concentrations of these gases are similar to those in the previous research [22]. 0.2 g catalyst (40–60 meshes) is used, and the total flow rate is 100 ml/min, corresponding to a gas hourly space velocity (GHSV) of 20000 h−1. The catalyst was first pretreated in a 4 % H2/He flow at 400 ℃ for 1 h before each test, unless otherwise stated. The catalyst after the reaction in the presence of 20 ppm SO2 was denoted as the used Ir/SiO2(S) catalyst. The concentrations of the gases were measured online by chemiluminescence NO/NO2 analyzer (Thermo Scientific, model 42i-HL) and a FITR spectrometer (Gasmet FTIR DX4000). The NOx conversion, CO conversion and N2 selectivity were calculated using the following equations. (1) N O x c o n v e r s i o n = N O x in - N O x out [ N O x ] in × 100 % (2) CO conversion = [ C O ] in - [ C O ] out [ C O ] in × 100 % (3) N 2 s e l e c t i v i t y = [ N O x ] in - [ N O x ] out - 2 [ N 2 O ] out [ N O x ] in - [ N O x ] out × 100 % The reaction rate (k) and turnover frequency (TOF) for the CO-SCR of NOx were obtained using the differential reactor over which the NOx conversion was kept below 15 %. Before the kinetic experiments, the absence of mass transport resistances was checked (supporting information). (4) k ( μ m o l / g · s ) = F Y NOx X NOx m cat (5) TOF ( s - 1 ) = 192.2 F Y NOx X NOx LD m cat where F is the total molar flow rate (mol/s), YNOx is the molar fraction of NOx in the feed, XNOx is the conversion of NOx, L is the actual weight loading of Ir, D is the dispersion of Ir, mcat is the weight of catalyst (g) used in the reaction, and 192.2 is the molar mass of Ir (g/mol). 2.4 Catalyst characterization The N2 adsorption–desorption was carried out on a Quantachrome Nova automated gas sorption system. X-ray diffraction (XRD) was conducted on a Bruker D8 ADVANCE system with Cu Kα radiation. Scanning electron microscope(SEM) images were taken by a Hitachi S-4800 instrument. Transmission electron microscopy (TEM) images were obtained on JEM-2100 instrument. X-ray photoelectron spectroscopy (XPS) analysis was performed on the electron spectrometer (VG Scientific, ESCALab220i-XL) with Al Kα radiation and C 1 s signal (284.8 eV) as the reference. Temperature programmed desorption of NOx (NOx-TPD) was conducted using the same procedure as described in our previous work [25]. Ir/SiO2 was first pretreated in a 4 % H2/He flow at 400 ℃ for 1 h prior to the SEM, TEM, XPS, and NOx-TPD characterizations. CO pulse chemisorption was conducted using AutoChem1 ΙΙ 2920, in which the doses of CO to the sample were measured after being treated in 4 %H2/He at 400 °C for 1 h. The content of Ir was determined by a PerkinElmer Optima 5300 DV inductively coupled plasma optical emission spectrometry. In situ XAFS data were measured at the beam lines 1W1B of Beijing Synchrotron radiation facility (BSRF) with an electron beam energy of 2.2 GeV and a current of 50 mA. A Si (111) double crystal monochromator was used for energy scan. In situ XAFS cell is a proportional integral derivative (PID) controlled heating reactor equipped with polyimide windows. The cell can be fed with different gases, and the outer shell is fitted with water cooling to protect the polyimide window. The detailed in situ XAFS experiment procedure was as follows: 0.4 g powdered sample was pressed into wafer, whose thickness and diameter are 1.1 mm and 13 mm, respectively, and loaded into an in situ reaction cell. Then the sample was subjected to a 4 % H2/He flow at 400 ℃ for 1 h, and subsequently, the spectra was taken and denoted as H2-400 ℃. Afterward, the temperature was decreased to 225 ℃, and the reaction gas (1000 ppm NO, 6000 ppm CO, 5 % O2, and He as the balance gas) was fed and maintained at this temperature for 1 h, then the spectra was taken and designated as NO + CO + O2-225 ℃. Next, 20 ppm SO2 was added to the reaction gas and maintained for 1 h, after which the spectra were taken and designated as NO + CO + O2 + SO2-225 ℃. Subsequently, SO2 was excluded from the reaction gas and maintained for 1 h, and then the spectra were taken and designated as NO + CO + O2-225 ℃. The resultant data were analyzed by Athena from Ifeffit 0.9.20 software package (Demeter © Bruce Ravel). The catalysts were also studied by in situ DRIFTS experiment under different reaction conditions, and the IR spectra were collected on a Nicolet iS50 FTIR spectrometer with a highly sensitive MCT detector. Prior to the experiment, the sample was pre-treated in a 4 % H2/He flow at 400 ℃ for 1 h, then purging with He and take the background spectrum at the desired temperature. The spectra were obtained by subtracting the corresponding background. 3 Results and discussion 3.1 Basic catalyst characterization 3.1.1 Physical structure analysis The physical properties of SiO2, Ir/SiO2, and the used Ir/SiO2(S) are presented in Table S1. It can be seen that the specific surface areas of these samples are low. The SEM analysis illustrated that Ir/SiO2 catalyst exhibits a nanosphere morphology with a diameter of about 400–500 nm (Fig. 1 a). The TEM image (Fig. 1b) showed that Ir particles are dispersed on the SiO2 nanosphere. From the high resolution TEM (HRTEM) image, it can be seen that a lattice spacing of 0.22 nm is mainly present, which is assigned to the plane of Ir (111) [26,27]. The particle size of Ir on the used Ir/SiO2(S) catalyst (8.3 nm) is only slightly larger than that on the fresh Ir/SiO2 catalyst (7.4 nm) (Fig. 2 ), which indicates the catalyst is stable in the presence of SO2. The XRD patterns of SiO2 and Ir/SiO2 are shown in Fig. 3 . The strong peak centered at 21.8° can be assigned to amorphous SiO2 [28]. The diffraction peak assigned to Ir species is absent, indicating that Ir is highly dispersed on the SiO2 support, or the loading amount was lower than the limit of XRD detection. 3.1.2 XPS analysis XPS analysis was conducted to elucidate the chemical nature of the fresh Ir/SiO2 and used Ir/SiO2(S) catalysts. As illustrated in Fig. 4 a, Ir 4f XPS spectra can be fitted into four peaks centered at ∼ 60.9, 61.8, 63.8 and 64.6 eV, which are ascribed to Ir0 (60.9 and 63.8 eV) and Irδ+ (61.8 and 64.6 eV) [29,30], respectively. On the fresh and used Ir/SiO2(S), both the peaks assigned to metallic Ir0 and Irδ+ can be observed. Over the used Ir/SiO2(S) the ratio of Ir0 (Ir0/(Ir0 + Irδ+)) is 57.1 %, which is similar to that over the fresh Ir/SiO2 (58.8 %). This indicates that after the reaction in the presence of SO2, the chemical nature of Ir is little changed. In addition, a weak peak of S 2p XPS spectra at 167.9 eV, which is ascribed to the sulphate species [31], can be observed over the used Ir/SiO2(S) (Fig. 4b). This demonstrated that surface sulfate species can be formed on Ir/SiO2 during the CO-SCR reaction in the presence of SO2. 3.1.3 NOx-TPD NOx-TPD profiles of Ir/SiO2 and used Ir/SiO2(S) catalysts are illustrated in Figure S1. It is noted that the desorption curves are similar for both catalysts, and all the NOx was desorbed in the form of NO. This indicates that NO2 is rarely formed over the catalysts. The first desorption peak is at about 160 ℃, and the second broad peak is located between 250 and 450 ℃. The amount of desorbed NOx from Ir/SiO2 is 5.13 μmol gcat -1, which is slightly higher than that from the used Ir/SiO2(S) catalyst (4.77 μmol gcat -1). This suggests that the presence of trace sulfate slightly inhibits the adsorption of NOx, and the used Ir/SiO2(S) catalyst still retains good NOx adsorption capacity. 3.2 CO-SCR performance Fig. 5 shows the effect of SO2 on the catalytic performance of Ir/SiO2 catalyst in the CO-SCR of NOx in the presence of O2. As presented in Fig. 5a, the activity of Ir/SiO2 catalyst is very poor in the absence of SO2, with a maximum NOx conversion of 20 % at 175 ℃. Intriguingly, the introduction of 10 ppm SO2 results in a significant enhancement in its activity. A maximum NOx conversion of 93 % can be achieved at 225 ℃, and the activity temperature window is broadened. Further increasing the concentration of feeding SO2, the activity is little changed. This suggests that the presence of SO2 can exert a significant promoting effect on the CO-SCR of NOx. Different from the NOx conversion, CO conversion was suppressed in the presence of SO2. CO was totally converted at 175 ℃ in the absence of SO2. However, due to the presence of SO2, only approximately 15–18 % CO conversion is obtained at this temperature. Furthermore, the complete CO conversion temperature shifts to 225 °C regardless of the concentration of SO2 (Fig. 5b). It is worth noting that the peak NOx conversion temperature is in accordance with the temperature of CO complete conversion. This indicates the conversion of NOx is closely related to the CO conversion. CO conversion was inhibited but the NOx conversion was promoted due to the addition of SO2, suggesting that the presence of SO2 can inhibit the CO + O2 reaction while promoting the NOx + CO reaction. Although the N2 selectivity is decreased between 200 and 300 ℃ in the presence of SO2, the selectivity is still high (>88 %) (Fig. 5c). Figure S2 compares the specific reaction rate of NOx reduction over Ir/SiO2 catalyst at different temperatures. As indicated, the presence of SO2 exhibited a promoting effect on the reaction rate. Moreover, the turnover frequencies (TOFs) have also been calculated based on the Ir surface sites (Table S1). As illustrated in Fig. 6 , the TOFs in the presence of SO2 are noticeably higher than those in the absence of SO2, and the TOF does not vary with the SO2 level. This maybe because the formed sulfate is little changed, even when the SO2 concentration is varied, and the trace sulfate would inhibit the CO + O2 reaction. Therefore, more CO is available for the NOx reduction. This demonstrates that the presence of CO is crucial for the NOx reduction in the presence of O2. Fig. 7 illustrates the temperature dependence of CO-SCR reaction rate over Ir/SiO2 in the absence and presence of SO2. It is clear that the apparent activation energy (Ea) in the presence of SO2 (66 kJ/mol) is lower than that in the absence of SO2 (119 kJ/mol). The lower Ea means the reduction of NOx proceeds more easily due to the presence of SO2. The CO-SCR activities of the fresh Ir/SiO2 and used Ir/SiO2(S) catalysts in the presence and absence of SO2 were also compared. As shown in Figure S3, the used Ir/SiO2(S) catalyst still exhibited much higher activity than the fresh catalyst in the absence of SO2. Moreover, the activity of the used catalyst is similar in both the absence and presence of SO2, indicating that the formed sulfate still present on the used Ir/SiO2(S) catalyst contributes to its high activity even in the absence of SO2. Therefore, the promoting effect of SO2 is irreversible. The response of NOx conversion and CO conversion to the intermittent feeding of SO2 over Ir/SiO2 catalyst at 200 °C is exhibited in Fig. 8 . Upon the introduction of 20 ppm SO2 into the reaction stream, NOx conversion is significantly improved from 15 % to 65 %. As the reaction proceeded, NOx conversion is little changed, indicating the activity of the catalyst is stable in the presence of SO2. After excluding SO2 from the reactant, NOx conversion is only slightly decreased. In contrast to NOx conversion, CO conversion was decreased due to the presence of SO2. This indicates that the presence of SO2 can inhibit the CO + O2 reaction, leading to more CO available for reducing NOx and thereby promoting the NOx reduction. Both the results shown in Figure S3 and Fig. 8 demonstrate that the promoting effect of SO2 is irreversible. This is different from Haneda’s report [22], in which the promoting effect is lost after the removal of SO2. The concentration of O2 plays an important role in the CO-SCR of NOx. Therefore, the effect of O2 on the catalytic performance of Ir/SiO2 catalyst has been investigated. As shown in Fig. 9 , increasing O2 concentration from 2 % to 5 % leads to a decrease of NOx conversion, and the NOx conversion was further decreased as the O2 concentration is increased to 10 %. With increasing the O2 concentration, the CO + O2 reaction was promoted (Figure S4), thus resulting in the decrease of the NOx conversion. N2 selectivity remains similar in the presence of 2 % and 5 % O2, and it decreases slightly as the O2 concentration is increased to 10 % (Figure S4). The catalytic performance comparison of different Ir-based catalysts is shown in Table 1 . The TOFs of Ir/SiO2 are significantly higher than those of the previously reported Ir-based catalysts [21]. Therefore, the results from the present work are promising. 3.3 Advanced characterization 3.3.1 In situ XAFS analysis The intensity of the white line in the Ir L3 XANES spectra is dependent on the density of unoccupied states and is often used as the fingerprint for the changes in the valence of Ir [21,32,33]. In order to better reveal the effect of SO2 on the chemical nature of Ir, in situ Ir L3 XANES spectra were recorded under different gas flows, and the evolution of the spectra is illustrated in Fig. 10 . As the catalyst is reduced in H2 at 400 ℃ for 1 h, the intensity of the white line is lower than that of IrO2 but higher than that of Ir foil, indicating the co-existence of Ir0 and Irδ+. After that the temperature was decreased to 225 ℃, and the gas was switched to the reaction gas (1000 ppm NO + 6000 ppm CO + 5 % O2) and kept for 1 h. Interestingly, the intensity of the white line is little changed, indicating that the chemical nature of Ir is stable even in the reaction gas. Subsequently, 20 ppm SO2 was introduced into the gas and maintained for 1 h, and no change in the intensity of the white line is observed, which suggests the presence of SO2 exerts no effect on the chemical nature of Ir. As the gas was switched to the original reaction gas again, the white line is not changed either. These phenomena demonstrated that in the reaction gas (NO + CO + O2) the chemical nature of Ir was not oxidized due to the presence of O2, and the presence of SO2 exerts no effect on the chemical nature. This is in accordance with the XPS analysis. 3.3.2 In situ DRIFTS studies In order to reveal the interaction between SO2 and Ir/SiO2 catalyst, the adsorption of SO2 + O2 at 225 ℃ was studied by in situ DRIFTS, and the results are shown in Fig. 11 . After the catalyst was exposed to SO2 + O2, a peak at 3648 cm−1 can be observed, which is ascribed to the sulfate species [34]. Meanwhile, negative peaks at 3726 and 3697 cm−1 appeared. This indicates that the formed sulfate species bonds the H atom in the surface hydroxyl groups on SiO2 through one or two atoms of sulfate [35,36]. Therefore, SO2 could be first oxidized to SO3 on Ir sites, followed by the spillover of SO3 to the support and formation of SO4 2- species in hydroxyl positions on SiO2 [37]. The presence of SO2 can inhibit the oxidation of CO (Fig. 5b). Therefore, the effect of SO2 on the adsorption of CO + O2 was further investigated by in situ DRIFTS. As illustrated in Fig. 12 a, when only CO was fed for 30 min, three peaks assigned to gas phase CO (2175 cm−1) [38], CO adsorbed on Irδ+ (2115 cm−1) [39,40], and linear CO adsorbed on Ir0 (2073 cm−1) [22,41] can be observed on Ir/SiO2 catalyst. When O2 was introduced into the reaction gas for 30 min, the peak assigned to linear CO on Ir0 is significantly decreased, and the other two peaks disappear. This suggests that the adsorbed CO and gaseous CO can be oxidized by O2. As SO2 was added to the gas, the peaks related to the gas phase CO and CO adsorbed on Irδ+ appeared again in 2 min, and the peak ascribed to linear CO on Ir0 is increased noticeably. As the exposure time is prolonged to 30 min, the intensities of these three peaks rarely changed. Even after SO2 was removed from the CO + O2 + SO2 (Fig. 12b), the peaks attributed to CO remain unchanged. This fact suggests that the presence of SO2 can inhibit the oxidation of CO, leaving more CO available for reducing NOx. And the inhibiting effect on CO oxidation still can be observed even after SO2 was excluded. This could be due to the presence of formed sulfate on the catalyst surface, which can prevent the reaction of CO + O2. This also explain why the promoting effect of SO2 is irreversible (Figure S3 and Fig. 8). Fig. 13 illustrates in situ DRIFT spectra over Ir/SiO2 catalyst at different temperatures. After the reaction of NO + CO + O2 for 1 h (Fig. 13a and b), a weak peak assigned to gas phase CO is observed at 175 ℃, and this peak disappears above 200 ℃. The intensity of the peak ascribed monodentate nitrate (1283 cm−1) [42,43] is rarely changed with increasing temperature from 175 to 275 ℃. The noise signals appear at 1300–1440 cm−1, which are caused by SiO2 [44]. Whereas under the reaction of NO + CO + O2 + SO2 (Fig. 13c and d), the peaks assigned to gas phase CO, CO adsorbed on Irδ+ and linear CO adsorbed on Ir0 can be observed, while the peak related to the monodentate nitrate is absent. This further demonstrated that the presence of SO2 can inhibit the oxidation of CO by O2, leaving more CO available for the reaction with the adsorbed monodentate nitrate. For the CO-SCR of NOx in the presence of O2, there are two competitive reactions (NOx + CO and CO + O2). The CO + O2 reaction is preferred, consuming the reducing agent CO and leaving only a limited amount to reduce NOx, resulting in low NOx conversion. Therefore, inhibiting the CO + O2 reaction while promoting the NOx + CO reaction is a challenging task. Herein, the presence of SO2 leads to a significant enhancement in the CO-SCR activity. In situ XANES spectra combined with XPS analysis demonstrated that after reducing Ir/SiO2 at 400 ℃, both Ir0 and Irδ+ are present, and they remained stable in their chemical nature even in the reaction gas of CO + NO + O2 or CO + NO + O2 + SO2. The presence of CO could play an important role in keeping the chemical nature of Ir. Similar to this report, Al2O3-SiO2 support can maintain the metallic or less oxidized Pt or Pd species even at high concentrations of O2 [45,46]. Haneda et al. [22] report that Ir0 is almost completely oxidized in the CO-SCR of NOx in the absence of SO2, whereas the existed SO2 can create Ir0 species thus showing a promoting effect. In the present study, different cause for the promoting effect of SO2 has been revealed, and the promotional mechanism of SO2 is illustrated in Scheme 1 . In the presence of O2, CO + O2 reaction is dominant. Most of CO is consumed by O2, leaving little CO available for reducing NOx, thus suppressing the NO + CO reaction. Once SO2 is introduced, on one hand, SO2 is of “oxygen scavenging” ability [47,48], it can consume the active O species used to oxidize CO. On the other hand, SO2 was oxidized by O and form sulfate, which can limit the transfer of O2 and the CO oxidation [49–51]. Therefore, the oxidation of CO was suppressed, allowing more CO to be available for the reduction of NOx over the active Ir0 sites [22]. As a result, the CO-SCR of NOx process has been facilitated remarkably. 4 Conclusions Nanosphere SiO2 supported Ir catalyst has been investigated for the CO-SCR of NOx in the presence of O2. Ir/SiO2 catalyst is inactive for the reduction of NOx in the absence of SO2, with a maximum NOx conversion of only about 20 %. However, the CO-SCR activity is remarkably improved in the presence of SO2, with a maximum NOx conversion of 93 % achievable at 225 ℃. The activity rarely changed as the concentration of SO2 was further increased from 10 ppm to 20 or 50 ppm. In situ XAFS and XPS analysis revealed that SO2 does not affect the chemical nature of Ir0 under the reaction conditions. In situ DRIFTS analysis demonstrated that the presence of SO2 can inhibit the CO + O2 reaction, which is caused by the formed sulfate in the presence of SO2. Therefore, more remaining CO can reduce NOx over the active Ir0 sites, thus leading to enhanced CO-SCR activity. The present research provides new insight into the promotional effect SO2 on the CO-SCR of NOx in the presence of O2. CRediT authorship contribution statement Ruoyuan Li: Writing – original draft, Investigation. Aixia Li: Writing – original draft, Investigation. Junhua Li: Formal analysis. Yao Wang: Formal analysis. Zhiming Liu: Writing – review & editing, Supervision, Project administration, Formal analysis, Conceptualization. Declaration of competing interest The authors declare that they have no known competing financial interests or personal relationships that could have appeared to influence the work reported in this paper. Acknowledgments This work was financially supported by the National Natural Science Foundation of China [22276010, 22211530066, 21876009], and the Fundamental Research Funds for the Central Universities [PY2103, JD2110]. Appendix A Supplementary data Supplementary data to this article can be found online at https://doi.org/10.1016/j.jcat.2024.115336. Appendix A Supplementary data The following are the Supplementary data to this article: Supplementary data 1 References [1] S.H. Xie W. Tan Y.J. Li L. Ma S.N. Ehrlich J.G. Deng P. Xu F. Gao L. Dong F.D. Liu Copper single atom-triggered niobia-ceria catalyst for efficient low-temperature reduction of nitrogen oxides ACS Catal. 12 2022 2441 2453 10.1021/acscatal.1c05661 S. H. Xie, W. Tan, Y. J. Li, L. Ma, S. N. Ehrlich, J. G. Deng, P. Xu, F. Gao, L. Dong, F. D. Liu, Copper single atom-triggered niobia-ceria catalyst for efficient low-temperature reduction of nitrogen oxides. ACS Catal. 12 (2022) 2441-2453. http://doi.org/10.1021/acscatal.1c05661. [2] Z.M. Liu J.H. Li S.I. Woo Recent advances in the selective catalytic reduction of NOx by hydrogen in the presence of oxygen Enery Environ. Sci. 5 2012 8799 8814 10.1039/c2ee22190j Z. M. Liu, J. H. Li, S. I. Woo, Recent advances in the selective catalytic reduction of NOx by hydrogen in the presence of oxygen. Enery Environ. Sci. 5 (2012) 8799-8814. http://doi.org/10.1039/c2ee22190j [3] Z.M. Liu S.I. Woo Recent advances in catalytic DeNOx science and technology Catal. Rev. 48 2006 43 89 10.1080/01614940500439891 Z. M. Liu, S. I. Woo, Recent advances in catalytic DeNOx science and technology. Catal. Rev. 48 (2006) 43-89. http://doi.org/10.1080/01614940500439891 [4] L.P. Han S.X. Cai M. Gao J. Hasegawa P.L. Wang J.P. Zhang L.Y. Shi D.S. Zhang Selective catalytic reduction of NOx with NH3 by using novel catalysts: state of the art and future prospects Chem. Rev. 119 2019 10916 10976 10.1021/acs.chemrev.9b00202 L. P. Han, S. X. Cai, M. Gao, J. Hasegawa, P. L. Wang, J. P. Zhang, L. Y. Shi, D. S. Zhang, Selective catalytic reduction of NOx with NH3 by using novel catalysts: State of the art and future prospects. Chem. Rev. 119 (2019) 10916-10976. http://doi.org/10.1021/acs.chemrev.9b00202 [5] Z. Gholami G.H. Luo F. Gholami F. Yang Recent advances in selective catalytic reduction of NOx by carbon monoxide for flue gas cleaning process: a review Catal. Rev. 63 2021 68 119 10.1080/01614940.2020.1753972 Z. Gholami, G. H. Luo, F. Gholami, F. Yang, Recent advances in selective catalytic reduction of NOx by carbon monoxide for flue gas cleaning process: a review. Catal. Rev. 63 (2021) 68-119. http://doi.org/10.1080/01614940.2020.1753972 [6] W.X. Zou L.C. Liu L. Zhang L.L. Li Y. Cao X.B. Wang C.J. Tang F. Gao L. Dong Crystal-plane effects on surface and catalytic properties of Cu2O nanocrystals for NO reduction by CO Appl. Catal. A 505 2015 334 343 10.1016/j.apcata.2015.08.021 W. X. Zou, L. C. Liu, L. Zhang, L. L. Li, Y. Cao, X. B. Wang, C. J. Tang, F. Gao, L. Dong, Crystal-plane effects on surface and catalytic properties of Cu2O nanocrystals for NO reduction by CO. Appl. Catal. A 505 (2015) 334-343. http://doi.org/10.1016/j.apcata.2015.08.021 [7] Y.J. Ji X.L. Chen S.M. Liu S.J. Song W.Q. Xu R.H. Jiang W.X. Chen H.F. Li T.Y. Zhu Z.X. Li Z.Y. Zhong D.S. Wang G.W. Xu F.B. Su Tailoring the electronic structure of single Ag atoms in Ag/WO3 for efficient NO reduction by CO in the presence of O2 ACS Catal. 13 2023 1230 1239 10.1021/acscatal.2c05048 Y. J. Ji, X. L. Chen, S. M. Liu, S. J. Song, W. Q. Xu, R. H. Jiang, W. X. Chen, H. F. Li, T. Y. Zhu, Z. X. Li, Z. Y. Zhong, D. S. Wang, G. W. Xu, F. B. Su, Tailoring the electronic structure of single Ag atoms in Ag/WO3 for efficient NO reduction by CO in the presence of O2. ACS Catal. 13 (2023) 1230-1239. http://doi.org/10.1021/acscatal.2c05048 [8] T. Tamai M. Haneda T. Fujitani H. Hamada Promotive effect of Nb2O5 on the catalytic activity of Ir/SiO2 for NO reduction with CO under oxygen-rich conditions Catal. Commun. 8 2007 885 888 10.1016/j.catcom.2006.09.004 T. Tamai, M. Haneda, T. Fujitani, H. Hamada, Promotive effect of Nb2O5 on the catalytic activity of Ir/SiO2 for NO reduction with CO under oxygen-rich conditions. Catal. Commun. 8 (2007) 885-888. http://doi.org/10.1016/j.catcom.2006.09.004 [9] J.H. Song D.C. Park Y.-W. You T.S. Chang I. Heo D.H. Kim Lean NOx reduction by CO at low temperature over bimetallic IrRu/Al2O3 catalysts with different Ir: Ru ratios Catal. Sci. Technol. 10 2020 2120 2136 10.1039/c9cy02289a J. H. Song, D. C. Park, Y.-W. You, T. S. Chang, I. Heo, D. H. Kim, Lean NOx reduction by CO at low temperature over bimetallic IrRu/Al2O3 catalysts with different Ir: Ru ratios. Catal. Sci. Technol. 10 (2020) 2120-2136. http://doi.org/10.1039/c9cy02289a [10] I. Heo Y.W. You J.H. Lee S.J. Schmieg D. Yoon C.H. Kim Urealess NOx reduction by carbon monoxide in simulated Lean-Burn exhausts Environ. Sci. Technol. 54 2020 8344 8351 10.1021/acs.est.9b07935 I. Heo, Y. W. You, J. H. Lee, S. J. Schmieg, D. Yoon, C. H. Kim, Urealess NOx reduction by carbon monoxide in simulated Lean-Burn exhausts. Environ. Sci. Technol. 54 (2020) 8344-8351. http://doi.org/10.1021/acs.est.9b07935 [11] J.H. Song D.C. Park Y.W. You Y.J. Kim S.M. Kim I. Heo D.H. Kim Kinetic and DRIFTS studies of IrRu/Al2O3 catalysts for lean NOx reduction by CO at low temperature Catal. Sci. Technol. 10 2020 10.1039/d0cy01835j J. H. Song, D. C. Park, Y. W. You, Y. J. Kim, S. M. Kim, I. Heo, D. H. Kim, Kinetic and DRIFTS studies of IrRu/Al2O3 catalysts for lean NOx reduction by CO at low temperature. Catal. Sci. Technol. 10 (2020). http://doi.org/10.1039/d0cy01835j [12] Y.J. Ji S.M. Liu S.J. Song W.Q. Xu L. Li Y. Zhang W.X. Chen H.F. Li J.G. Jiang T.Y. Zhu Z.X. Li Z.Y. Zhong D.S. Wang G.W. Xu F.B. Su Negatively charged single-atom Pt catalyst shows superior SO2 tolerance in NOx reduction by CO ACS Catal. 13 2023 224 236 10.1021/acscatal.2c04918 Y. J. Ji, S. M. Liu, S. J. Song, W. Q. Xu, L. Li, Y. Zhang, W. X. Chen, H. F. Li, J. G. Jiang, T. Y. Zhu, Z. X. Li, Z. Y. Zhong, D. S. Wang, G. W. Xu, F. B. Su, Negatively charged single-atom Pt catalyst shows superior SO2 tolerance in NOx reduction by CO. ACS Catal. 13 (2023) 224-236. http://doi.org/10.1021/acscatal.2c04918 [13] M. Haneda H. Hamada Promotional role of H2O in the selective catalytic reduction of NO with CO over Ir/WO3/SiO2 catalyst J. Catal. 273 2010 39 49 10.1016/j.jcat.2010.04.021 M. Haneda, H. Hamada, Promotional role of H2O in the selective catalytic reduction of NO with CO over Ir/WO3/SiO2 catalyst. J. Catal. 273 (2010) 39-49. http://doi.org/10.1016/j.jcat.2010.04.021 [14] T. Yamamoto T. Tanaka R. Kuma S. Suzuki F. Amano Y. Shimooka Y. Kohno T. Funabiki S. Yoshida NO reduction with CO in the presence of O2 over Al2O3-supported and Cu-based catalysts Phys. Chem. Chem. Phys. 2002 2449 2458 10.1039/b201120b T. Yamamoto, T. Tanaka, R. Kuma, S. Suzuki, F. Amano, Y. Shimooka, Y. Kohno, T. Funabiki, S. Yoshida, NO reduction with CO in the presence of O2 over Al2O3-supported and Cu-based catalysts. Phys. Chem. Chem. Phys. (2002) 2449-2458. http://doi.org/10.1039/b201120b [15] J. Zeng X.M. Zhong J. Yu T. Zhang Y.Z. Wang H.Z. Chang Promotional effect of preparation methods on catalytic reduction of NO by CO over CoCeOx, Catalysts Ind. Eng. Chem. Res. 59 2020 34 41 10.1021/acs.iecr.9b04232 J. Zeng, X. M. Zhong, J. Yu, T. Zhang, Y. Z. Wang, H. Z. Chang, Promotional effect of preparation methods on catalytic reduction of NO by CO over CoCeOx, Catalysts. Ind. Eng. Chem. Res. 59 (2020) 34-41. https://doi.org/10.1021/acs.iecr.9b04232 [16] S.M. Liu Y.J. Ji W.Q. Xu J.L. Zhang R.H. Jiang L. Li L.H. Jia Z.Y. Zhong G.W. Xu T.Y. Zhu F.B. Su Hierarchically interconnected porous MnxCo3-xO4 spinels for Low-temperature catalytic reduction of NO by CO J. Catal. 406 2022 72 86 10.1016/j.jcat.2021.12.023 S. M. Liu, Y. J. Ji, W. Q. Xu, J. L. Zhang, R. H. Jiang, L. Li, L. H. Jia, Z. Y. Zhong, G. W. Xu, T. Y. Zhu, F. B. Su, Hierarchically interconnected porous MnxCo3-xO4 spinels for Low-temperature catalytic reduction of NO by CO. J. Catal. 406 (2022) 72-86. http://doi.org/10.1016/j.jcat.2021.12.023 [17] K.C. Taylor J.C. Schlatter Selective reduction of nitric oxide over noble metals J. Catal. 63 1980 53 71 10.1016/0021-9517(80)90059-7 K. C. Taylor, J. C. Schlatter, Selective reduction of nitric oxide over noble metals. J. Catal. 63 (1980) 53-71. https://doi.org/10.1016/0021-9517(80)90059-7 [18] A.Q. Wang L. Ma Y. Cong T. Zhang D.B. Liang Unique properties of Ir/ZSM-5 catalyst for NO reduction with CO in the presence of excess oxygen Appl. Catal. B 40 2003 319 329 10.1016/S0926-3373(02)00157-1 A. Q. Wang, L. Ma, Y. Cong, T. Zhang, D. B. Liang, Unique properties of Ir/ZSM-5 catalyst for NO reduction with CO in the presence of excess oxygen. Appl. Catal. B 40 (2003) 319-329. http://doi.org/10.1016/S0926-3373(02)00157-1 [19] H. Inomata M. Shimokawabe A. Kuwana M. Arai Selective reduction of NO with CO in the presence of O2 with Ir/WO3 catalysts: influence of preparation variables on the catalytic performance Appl. Catal. B 84 2008 783 789 10.1016/j.apcatb.2008.06.011 H. Inomata, M. Shimokawabe, A. Kuwana, M. Arai, Selective reduction of NO with CO in the presence of O2 with Ir/WO3 catalysts: Influence of preparation variables on the catalytic performance. Appl. Catal. B 84 (2008) 783-789. http://doi.org/10.1016/j.apcatb.2008.06.011 [20] M. Ogura A. Kawamura M. Matsukata E. Kikuchi Catalytic activity of Ir for NO-CO reaction in the presence of SO2 and excess oxygen Chem. Lett. 2 2000 146 147 10.1246/cl.2000.146 M. Ogura, A. Kawamura, M. Matsukata, E. Kikuchi, Catalytic activity of Ir for NO-CO reaction in the presence of SO2 and excess oxygen. Chem. Lett. 2 (2000) 146-147. http://doi.org/10.1246/cl.2000.146 [21] Y.J. Ji S.M. Liu H.D. Zhu W.Q. Xu R.H. Jiang Y. Zhang J. Yu W.X. Chen L.H. Jia J.G. Jiang T.Y. Zhu Z.Y. Zhong D.S. Wang G.W. Xu F.B. Su Isolating contiguous Ir atoms and forming Ir-W intermetallics with negatively charged Ir for efficient NO reduction by CO Adv. Mater. 34 2022 10.1002/adma.202205703 Y. J. Ji, S. M. Liu, H. D. Zhu, W. Q. Xu, R. H. Jiang, Y. Zhang, J. Yu, W. X. Chen, L. H. Jia, J. G. Jiang, T. Y. Zhu, Z. Y. Zhong, D. S. Wang, G. W. Xu, F. B. Su, Isolating contiguous Ir atoms and forming Ir-W intermetallics with negatively charged Ir for efficient NO reduction by CO. Adv. Mater. 34 (2022). http://doi.org/10.1002/adma.202205703 [22] M. Haneda Y. Pusparatu I. Kintaichi M. Nakamura T. Sasaki H. Fujitani Hamada, Promotional effect of SO2 on the activity of Ir/SiO2 for NO reduction with CO under oxygen-rich conditions J. Catal. 229 2005 197 205 10.1016/j.jcat.2004.10.022 M. Haneda, Pusparatu, Y. Kintaichi, I. Nakamura, M. Sasaki, T. Fujitani, H. Hamada, Promotional effect of SO2 on the activity of Ir/SiO2 for NO reduction with CO under oxygen-rich conditions. J. Catal. 229 (2005) 197-205. http://doi.org/10.1016/j.jcat.2004.10.022 [23] T. Yoshinari K. Sato M. Haneda Y. Kintaichi H. Hamada Remarkable promoting effect of coexisting SO2 on the catalytic activity of Ir/SiO2 for NO reduction in the presence of oxygen Catal. Commun. 2 2001 155 158 10.1016/S1566-7367(01)00025-5 T. Yoshinari, K. Sato, M. Haneda, Y. Kintaichi, H. Hamada, Remarkable promoting effect of coexisting SO2 on the catalytic activity of Ir/SiO2 for NO reduction in the presence of oxygen. Catal. Commun. 2 (2001) 155-158. https://doi.org/10.1016/S1566-7367(01)00025-5 [24] X.L. Miao Y.G. Li Q.H. Zhang M.F. Zhu H.Z. Wang Low shrinkage light curable dental nanocomposites using SiO2 microspheres as fillers Mat. Sci. Eng. C 32 2012 2115 2121 10.1016/j.msec.2012.05.053 X. L. Miao, Y. G. Li, Q. H. Zhang, M. F. Zhu, H. Z. Wang, Low shrinkage light curable dental nanocomposites using SiO2 microspheres as fillers. Mat. Sci. Eng. C 32 (2012) 2115-2121. https://doi.org/10.1016/j.msec.2012.05.053 [25] K. Duan B. Chen T. Zhu Z. Liu Mn promoted Pd/TiO2-Al2O3 catalyst for the selective catalytic reduction of NOx by H2 Appl. Catal. B 176-177 2015 618 626 10.1016/j.apcatb.2015.04.048 K. Duan, B. Chen, T. Zhu, Z. Liu, Mn promoted Pd/TiO2-Al2O3 catalyst for the selective catalytic reduction of NOx by H2, Appl. Catal. B 176-177 (2015) 618-626. http:// doi.org/10.1016/j.apcatb.2015.04.048. [26] B.B. Jiang T. Wang Y.F. Cheng F. Liao K.L. Wu M.W. Shao Ir/g-C3N4/Nitrogen-Doped graphene nanocomposites as bifunctional electrocatalysts for overall water splitting in acidic electrolytes ACS Appl. Mater. Interfaces 10 2018 39161 39167 10.1021/acsami.8b11970 B. B. Jiang, T. Wang, Y. F. Cheng, F. Liao, K. L. Wu, M. W. Shao, Ir/g-C3N4/Nitrogen-Doped graphene nanocomposites as bifunctional electrocatalysts for overall water splitting in acidic electrolytes. ACS Appl. Mater. Interfaces 10 (2018) 39161-39167. https://doi.org/10.1021/acsami.8b11970 [27] Y.M. Xu W.B. Zheng Y.M. Hu C. Tang A.P. Jia J.Q. Lu The effects of MoOx decoration on the selective hydrogenation of crotonaldehyde over MoOx-promoted Ir/TUD-1 catalysts J. Catal. 381 2020 222 233 10.1016/j.jcat.2019.11.007 Y. M. Xu, W. B. Zheng, Y. M. Hu, C. Tang, A. P. Jia, J. Q. Lu, The effects of MoOx decoration on the selective hydrogenation of crotonaldehyde over MoOx-promoted Ir/TUD-1 catalysts. J. Catal. 381 (2020) 222-233. https://doi.org/10.1016/j.jcat.2019.11.007 [28] H.L. Jiang T. Umegaki T. Akita X.B. Zhang M. Haruta Q. Xu Bimetallic Au-Ni nanoparticles embedded in SiO2 nanospheres: synergetic catalysis in hydrolytic dehydrogenation of Ammonia Borane Chem-Eur. J. 16 2010 3132 3137 10.1002/chem.200902829 H. L. Jiang, T. Umegaki, T. Akita, X. B. Zhang, M. Haruta, Q. Xu, Bimetallic Au-Ni nanoparticles embedded in SiO2 nanospheres: synergetic catalysis in hydrolytic dehydrogenation of Ammonia Borane. Chem-Eur. J. 16 (2010) 3132-3137. https://doi.org/10.1002/chem.200902829 [29] W.X. Cao L. Lin H.F. Qi Q. He Z.J. Wu A.Q. Wang W.H. Luo T. Zhang In-situ synthesis of single-atom Ir by utilizing metal-organic frameworks: an acid-resistant catalyst for hydrogenation of levulinic acid to gamma-valerolactone J. Catal. 373 2019 161 172 10.1016/j.jcat.2019.03.035 W. X. Cao, L. Lin, H. F. Qi, Q. He, Z. J. Wu, A. Q. Wang, W. H. Luo, T. Zhang, In-situ synthesis of single-atom Ir by utilizing metal-organic frameworks: An acid-resistant catalyst for hydrogenation of levulinic acid to gamma-valerolactone. J. Catal. 373 (2019) 161-172. https://doi.org/10.1016/j.jcat.2019.03.035 [30] A.P. Jia Y.S. Zhang T.Y. Song Z.H. Zhang C. Tang Y.M. Hu W.B. Zheng M.F. Luo J.Q. Lu W.X. Huang Crystal-plane effects of anatase TiO2 on the selective hydrogenation of crotonaldehyde over Ir/TiO2 catalysts J. Catal. 395 2021 10 22 10.1016/j.jcat.2020.12.012 A. P. Jia, Y. S. Zhang, T. Y. Song, Z. H. Zhang, C. Tang, Y. M. Hu, W. B. Zheng, M. F. Luo, J. Q. Lu, W. X. Huang, Crystal-plane effects of anatase TiO2 on the selective hydrogenation of crotonaldehyde over Ir/TiO2 catalysts. J. Catal. 395 (2021) 10-22. https://doi.org/10.1016/j.jcat.2020.12.012 [31] S.J. Yang Y.F. Guo H.Z. Chang L. Ma Y. Peng Z. Qu N.Q. Yan C.Z. Wang J.H. Li Novel effect of SO2 on the SCR reaction over CeO2: mechanism and significance Appl. Catal. B 136 2013 19 28 10.1016/j.apcatb.2013.01.028 S. J. Yang, Y. F. Guo, H. Z. Chang, L. Ma, Y. Peng, Z. Qu, N. Q. Yan, C. Z. Wang, J. H. Li, Novel effect of SO2 on the SCR reaction over CeO2: Mechanism and significance. Appl. Catal. B 136 (2013) 19-28. https://doi.org/10.1016/j.apcatb.2013.01.028 [32] J. Lin A.Q. Wang B.T. Qiao X.Y. Liu X.F. Yang X.D. Wang J.X. Liang J.X. Li J.Y. Liu T. Zhang Remarkable performance of Ir1/FeOx single-atom catalyst in water gas shift reaction J. Am. Chem. Soc. 135 2013 15314 15317 10.1021/ja408574m J. Lin, A. Q. Wang, B. T. Qiao, X. Y. Liu, X. F. Yang, X. D. Wang, J. X. Liang, J. X. Li, J. Y. Liu, T. Zhang, Remarkable performance of Ir1/FeOx single-atom catalyst in water gas shift reaction. J. Am. Chem. Soc. 135 (2013) 15314-15317. https://doi.org/10.1021/ja408574m [33] Y.K. Zhang C.Q. Wu H.L. Jiang Y.X. Lin H.J. Liu Q. He S.M. Chen T. Duan L. Song Atomic iridium incorporated in cobalt hydroxide for efficient oxygen evolution catalysis in neutral electrolyte Adv. Mater. 30 2018 10.1002/adma.201707522 Y. K. Zhang, C. Q. Wu, H. L. Jiang, Y. X. Lin, H. J. Liu, Q. He, S. M. Chen, T. Duan, L. Song, Atomic iridium incorporated in cobalt hydroxide for efficient oxygen evolution catalysis in neutral electrolyte. Adv. Mater. 30 (2018). https://doi.org/10.1002/adma.201707522 [34] A.V. Deo I.G.D. Lana H.W. Habgood Infrared studies of the adsorption and surface reactions of hydrogen sulfide and sulfur dioxide on some aluminas and zeolites J. Catal. 21 1971 270 281 10.1016/0021-9517(71)90146-1 A.V. DEO, I.G.D. Lana, H.W. Habgood, Infrared studies of the adsorption and surface reactions of hydrogen sulfide and sulfur dioxide on some aluminas and zeolites, J. Catal. 21 (1971) 270-281. https://doi.org/10.1016/0021-9517(71)90146-1 [35] G. Busca The surface acidity of solid oxides and its characterization by IR spectroscopic methods. an attempt at systematization Phys. Chem. Chem. Phys. 1 1999 723 736 10.1039/A808366E G. Busca, The surface acidity of solid oxides and its characterization by IR spectroscopic methods. An attempt at systematization. Phys. Chem. Chem. Phys.1(1999) 723-736. https://doi.org/10.1039/A808366E [36] B.A. Morrow A.J. McFarlan Infrared and gravimetric study of an aerosil and a precipitated silica using chemical and H/D exchange probes Langmuir 7 1991 1695 1701 10.1021/la00056a022 B. A. Morrow, A. J. McFarlan, Infrared and gravimetric study of an aerosil and a precipitated silica using chemical and H/D exchange probes. Langmuir 7(1991)1695-1701. https://doi.org/10.1021/la00056a022 [37] D. Bounechada Z. Darmastuti M. Andersson L. Ojamäe A. Lloyd Spetz M. Skoglundh P.A. Carlsson Vibrational study of SOx adsorption on Pt/SiO2 J. Phys. Chem. C 118 2014 29713 29723 10.1021/jp506644w D. Bounechada, Z. Darmastuti, M. Andersson, L. Ojamäe, A. Lloyd Spetz, M. Skoglundh, P. A. Carlsson, Vibrational study of SOx adsorption on Pt/SiO2, J. Phys. Chem. C 118 (2014) 29713-29723. https://doi.org/10.1021/jp506644w [38] Y.W. You Y.J. Kim J.H. Lee M.W. Arshad S.K. Kim S.M. Kim H. Lee L.T. Thompson I. Heo Unraveling the origin of extraordinary lean NOx reduction by CO over Ir-Ru bimetallic catalyst at low temperature Appl. Catal. B 280 2021 119374 10.1016/j.apcatb.2020.119374 Y. W.You, Y. J. Kim, J. H. Lee, M. W. Arshad, S. K. Kim, S. M. Kim, H. Lee, L. T. Thompson, I. Heo, Unraveling the origin of extraordinary lean NOx reduction by CO over Ir-Ru bimetallic catalyst at low temperature. Appl. Catal. B 280 (2021) 119374. https://doi.org/10.1016/j.apcatb.2020.119374 [39] E. Iojoiu P. Gelin H. Praliaud M. Primet Reduction of NO by propene over supported iridium catalysts under lean-burn conditions: an in situ FTIR study Appl. Catal. A 263 2004 39 48 10.1016/j.apcata.2003.11.038 E. Iojoiu, P. Gelin, H. Praliaud, M. Primet, Reduction of NO by propene over supported iridium catalysts under lean-burn conditions: an in situ FTIR study. Appl. Catal. A 263 (2004) 39-48. https://doi.org/10.1016/j.apcata.2003.11.038 [40] M. Haneda H. Kudo Y. Nagao T. Fujitani H. Hamada Enhanced activity of Ba-doped Ir/SiO2 catalyst for NO reduction with CO in the presence of O2 and SO2 Catal. Commun. 7 2006 423 426 10.1016/j.catcom.2005.12.020 M. Haneda, H. Kudo, Y. Nagao, T. Fujitani, H. Hamada, Enhanced activity of Ba-doped Ir/SiO2 catalyst for NO reduction with CO in the presence of O2 and SO2. Catal. Commun. 7 (2006) 423-426. https://doi.org/10.1016/j.catcom.2005.12.020 [41] J. Lin B.T. Qiao L. Li H.L. Guan C.Y. Ruan A.Q. Wang W.S. Zhang X.D. Wang T. Zhang Remarkable effects of hydroxyl species on low-temperature CO (preferential) oxidation over Ir/Fe(OH)x catalyst J. Catal. 319 2014 142 149 10.1016/j.jcat.2014.08.011 J. Lin, B. T. Qiao, L. Li, H. L. Guan, C. Y. Ruan, A. Q. Wang, W. S. Zhang, X. D. Wang, T. Zhang, Remarkable effects of hydroxyl species on low-temperature CO (preferential) oxidation over Ir/Fe(OH)x catalyst. J. Catal. 319 (2014) 142-149. https://doi.org/10.1016/j.jcat.2014.08.011 [42] Z. Liu H. Su B. Chen J. Li S.I. Woo Activity enhancement of WO3 modified Fe2O3 catalyst for the selective catalytic reduction of NOx by NH3 Chem. Eng. J. 299 2016 255 262 10.1016/j.cej.2016.04.100 Z. Liu, H. Su, B. Chen, J. Li, S. I. Woo, Activity enhancement of WO3 modified Fe2O3 catalyst for the selective catalytic reduction of NOx by NH3, Chem. Eng. J. 299 (2016) 255-262. http://dx.doi.org/10.1016/j.cej.2016.04.100 [43] Z. Liu H. Liu X. Feng L. Ma X. Cao B. Wang Ni-Ce-Ti as a superior catalyst for the selective catalytic reduction of NOx with NH3 Mol. Catal. 445 2018 179 186 10.1016/j.mcat.2017.11.028 Z. Liu, H. Liu, X. Feng, L. Ma, X. Cao, B. Wang, Ni-Ce-Ti as a superior catalyst for the selective catalytic reduction of NOx with NH3, Mol. Catal. 445 (2018) 179-186. http://dx.doi.org/10.1016/j.mcat.2017.11.028 [44] T. Yoshinari K. Sato M. Haneda Y. Kintaichi H. Hamada Positive effect of coexisting SO2 on the activity of supported iridium catalysts for NO reduction in the presence of oxygen Appl. Catal. B 41 2003 157 169 10.1016/S0926-3373(02)00208-4 T. Yoshinari, K. Sato, M. Haneda, Y. Kintaichi, H. Hamada, Positive effect of coexisting SO2 on the activity of supported iridium catalysts for NO reduction in the presence of oxygen, Appl. Catal. B 41 (2003) 157-169. https://doi.org/10.1016/S0926-3373(02)00208-4 [45] K. Okumura E. Shinohara M. Niwa Pd loaded on high silica beta support active for the total oxidation of diluted methane in the presence of water vapor Catal. Today 117 2006 577 583 10.1016/j.cattod.2006.06.008 K. Okumura, E. Shinohara, M. Niwa, Pd loaded on high silica beta support active for the total oxidation of diluted methane in the presence of water vapor. Catal. Today 117 (2006) 577-583. https://doi.org/10.1016/j.cattod.2006.06.008 [46] A. Ali W. Alvarez C.J. Loughran D.E. Resasco State of Pd on H-ZSM-5 and other acidic supports during the selective reduction of NO by CH4 studied by EXAFS/XANES Appl. Catal. B 14 1997 13 22 10.1016/S0926-3373(97)00008-8 A. Ali, W. Alvarez, C. J. Loughran, D. E. Resasco, State of Pd on H-ZSM-5 and other acidic supports during the selective reduction of NO by CH4 studied by EXAFS/XANES. Appl. Catal. B 14 (1997) 13-22. https://doi.org/10.1016/S0926-3373(97)00008-8 [47] J. Gustafson O. Balmes C. Zhang M. Shipilin A. Schaefer B. Hagman L.R. Merte N.M. Martin P.-A. Carlsson M. Jankowski E.J. Crumlin E. Lundgren The role of oxides in catalytic CO oxidation over rhodium and palladium ACS Catal. 8 2018 4438 4445 10.1021/acscatal.8b00498 J. Gustafson, O. Balmes, C. Zhang, M. Shipilin, A. Schaefer, B. Hagman, L. R. Merte, N. M. Martin, P.-A. Carlsson, M. Jankowski, E. J. Crumlin, E. Lundgren, The role of oxides in catalytic CO oxidation over rhodium and palladium. ACS Catal. 8 (2018) 4438- 4445. https://doi.org/10.1021/acscatal.8b00498 [48] W. Yang J. Gong X. Wang Z. Bao Y. Guo Z. Wu A review on the impact of SO2 on the oxidation of NO, hydrocarbons, and CO in diesel emission control catalysis ACS Catal. 11 2021 12446 12468 10.1021/acscatal.1c03013 W. Yang, J. Gong, X. Wang, Z. Bao, Y. Guo, Z. Wu, A review on the impact of SO2 on the oxidation of NO, hydrocarbons, and CO in diesel emission control catalysis. ACS Catal. 11(2021)12446-12468. https://doi.org/10.1021/acscatal.1c03013 [49] F. Gracia S. Guerrero E. Wolf J. Miller A. Kropf Kinetics, operando FTIR, and controlled atmosphere EXAFS study of the effect of sulfur on Pt-supported catalysts during CO oxidation J. Catal. 233 2005 372 387 10.1016/j.jcat.2005.04.016 F. Gracia, S. Guerrero, E. Wolf, J. Miller, A. Kropf, Kinetics, operando FTIR, and controlled atmosphere EXAFS study of the effect of sulfur on Pt-supported catalysts during CO oxidation. J. Catal. 233 (2005) 372-387. https://doi.org/10.1016/j.jcat.2005.04.016 [50] H. Shin M. Baek Y. Ro C. Song K.-Y. Lee I.K. Song Improvement of sulfur resistance of Pd/Ce-Zr-Al-O catalysts for CO oxidation Appl. Surf. Sci. 429 2018 102 107 10.1016/j.apsusc.2017.05.198 H. Shin, M. Baek, Y. Ro, C. Song, K.-Y. Lee, I. K. Song, Improvement of sulfur resistance of Pd/Ce-Zr-Al-O catalysts for CO oxidation. Appl. Surf. Sci. 429 (2018) 102-107. https://doi.org/10.1016/j.apsusc.2017.05.198 [51] K. Taira K. Nakao K. Suzuki H. Einaga SOx tolerant Pt/TiO2 catalysts for CO oxidation and the effect of TiO2 supports on catalytic activity Environ. Sci. Technol. 50 2016 9773 9780 10.1021/acs.est.6b01652 K. Taira, K. Nakao, K. Suzuki, H. Einaga, SOx tolerant Pt/TiO2 catalysts for CO oxidation and the effect of TiO2 supports on catalytic activity. Environ. Sci. Technol. 50 (2016) 9773-9780. https://doi.org/10.1021/acs.est.6b01652",
      "scopus-id": "85183947468",
      "coredata": {
        "eid": "1-s2.0-S0021951724000496",
        "dc:description": "Selective catalytic reduction of NOx by CO (CO-SCR) in the presence of O2 is challenging because in this process CO is prone to being oxidized by O2, thus inhibiting NOx reduction by CO. Furthermore, SO2 typically leads to the deactivation of the CO-SCR catalyst. Herein, a significant promoting effect of SO2 on Ir/SiO2 catalyst for the CO-SCR of NOx in the presence of O2 is reported. In-situ X-ray Absorption Fine Structure (XAFS) and X-ray photoelectron spectroscopy (XPS) analysis showed that SO2 does not affect the chemical nature of Ir0 under reaction conditions. However, SO2 can be oxidized to sulfate and deposit on the catalyst surface. In situ diffuse reflectance infrared Fourier transform spectroscopy (DRIFTS) analysis demonstrated that the presence of SO2 can inhibit the CO + O2 reaction, thus leaving more CO available to reduce NOx over the active Ir0 sites. As a result, the reduction of NOx is remarkably promoted even in the presence of O2 and SO2.",
        "openArchiveArticle": "false",
        "prism:coverDate": "2024-02-29",
        "openaccessUserLicense": null,
        "prism:aggregationType": "Journal",
        "prism:url": "https://api.elsevier.com/content/article/pii/S0021951724000496",
        "dc:creator": [
          {
            "@_fa": "true",
            "$": "Li, Ruoyuan"
          },
          {
            "@_fa": "true",
            "$": "Li, Aixia"
          },
          {
            "@_fa": "true",
            "$": "Li, Junhua"
          },
          {
            "@_fa": "true",
            "$": "Wang, Yao"
          },
          {
            "@_fa": "true",
            "$": "Liu, Zhiming"
          }
        ],
        "link": [
          {
            "@_fa": "true",
            "@rel": "self",
            "@href": "https://api.elsevier.com/content/article/pii/S0021951724000496"
          },
          {
            "@_fa": "true",
            "@rel": "scidir",
            "@href": "https://www.sciencedirect.com/science/article/pii/S0021951724000496"
          }
        ],
        "dc:format": "application/json",
        "openaccessType": null,
        "pii": "S0021-9517(24)00049-6",
        "prism:volume": "430",
        "articleNumber": "115336",
        "prism:publisher": "Elsevier Inc.",
        "dc:title": "Unveiling the significant promoting effect of SO2 on Ir/SiO2 catalyst for the CO-SCR of NOx in the presence of O2",
        "prism:copyright": "© 2024 Elsevier Inc. All rights reserved.",
        "openaccess": "0",
        "prism:issn": "00219517",
        "dcterms:subject": [
          {
            "@_fa": "true",
            "$": "NOx reduction"
          },
          {
            "@_fa": "true",
            "$": "CO-SCR"
          },
          {
            "@_fa": "true",
            "$": "Ir/SiO2 catalyst"
          },
          {
            "@_fa": "true",
            "$": "SO2 effect"
          }
        ],
        "openaccessArticle": "false",
        "prism:publicationName": "Journal of Catalysis",
        "openaccessSponsorType": null,
        "prism:pageRange": "115336",
        "pubType": "fla",
        "prism:coverDisplayDate": "February 2024",
        "prism:doi": "10.1016/j.jcat.2024.115336",
        "prism:startingPage": "115336",
        "dc:identifier": "doi:10.1016/j.jcat.2024.115336",
        "openaccessSponsorName": null
      },
      "objects": {
        "object": [
          {
            "@category": "standard",
            "@height": "618",
            "@width": "727",
            "@_fa": "true",
            "$": "https://api.elsevier.com/content/object/eid/1-s2.0-S0021951724000496-gr2.jpg?httpAccept=%2A%2F%2A",
            "@multimediatype": "JPEG image file",
            "@type": "IMAGE-DOWNSAMPLED",
            "@size": "95470",
            "@ref": "gr2",
            "@mimetype": "image/jpeg"
          },
          {
            "@category": "standard",
            "@height": "298",
            "@width": "382",
            "@_fa": "true",
            "$": "https://api.elsevier.com/content/object/eid/1-s2.0-S0021951724000496-gr3.jpg?httpAccept=%2A%2F%2A",
            "@multimediatype": "JPEG image file",
            "@type": "IMAGE-DOWNSAMPLED",
            "@size": "19334",
            "@ref": "gr3",
            "@mimetype": "image/jpeg"
          },
          {
            "@category": "standard",
            "@height": "530",
            "@width": "382",
            "@_fa": "true",
            "$": "https://api.elsevier.com/content/object/eid/1-s2.0-S0021951724000496-gr4.jpg?httpAccept=%2A%2F%2A",
            "@multimediatype": "JPEG image file",
            "@type": "IMAGE-DOWNSAMPLED",
            "@size": "37287",
            "@ref": "gr4",
            "@mimetype": "image/jpeg"
          },
          {
            "@category": "standard",
            "@height": "896",
            "@width": "382",
            "@_fa": "true",
            "$": "https://api.elsevier.com/content/object/eid/1-s2.0-S0021951724000496-gr5.jpg?httpAccept=%2A%2F%2A",
            "@multimediatype": "JPEG image file",
            "@type": "IMAGE-DOWNSAMPLED",
            "@size": "73663",
            "@ref": "gr5",
            "@mimetype": "image/jpeg"
          },
          {
            "@category": "standard",
            "@height": "525",
            "@width": "380",
            "@_fa": "true",
            "$": "https://api.elsevier.com/content/object/eid/1-s2.0-S0021951724000496-gr13.jpg?httpAccept=%2A%2F%2A",
            "@multimediatype": "JPEG image file",
            "@type": "IMAGE-DOWNSAMPLED",
            "@size": "71416",
            "@ref": "gr13",
            "@mimetype": "image/jpeg"
          },
          {
            "@category": "standard",
            "@height": "351",
            "@width": "733",
            "@_fa": "true",
            "$": "https://api.elsevier.com/content/object/eid/1-s2.0-S0021951724000496-gr14.jpg?httpAccept=%2A%2F%2A",
            "@multimediatype": "JPEG image file",
            "@type": "IMAGE-DOWNSAMPLED",
            "@size": "58520",
            "@ref": "gr14",
            "@mimetype": "image/jpeg"
          },
          {
            "@category": "standard",
            "@height": "790",
            "@width": "656",
            "@_fa": "true",
            "$": "https://api.elsevier.com/content/object/eid/1-s2.0-S0021951724000496-gr1.jpg?httpAccept=%2A%2F%2A",
            "@multimediatype": "JPEG image file",
            "@type": "IMAGE-DOWNSAMPLED",
            "@size": "144177",
            "@ref": "gr1",
            "@mimetype": "image/jpeg"
          },
          {
            "@category": "standard",
            "@height": "290",
            "@width": "382",
            "@_fa": "true",
            "$": "https://api.elsevier.com/content/object/eid/1-s2.0-S0021951724000496-gr6.jpg?httpAccept=%2A%2F%2A",
            "@multimediatype": "JPEG image file",
            "@type": "IMAGE-DOWNSAMPLED",
            "@size": "26054",
            "@ref": "gr6",
            "@mimetype": "image/jpeg"
          },
          {
            "@category": "standard",
            "@height": "286",
            "@width": "382",
            "@_fa": "true",
            "$": "https://api.elsevier.com/content/object/eid/1-s2.0-S0021951724000496-gr7.jpg?httpAccept=%2A%2F%2A",
            "@multimediatype": "JPEG image file",
            "@type": "IMAGE-DOWNSAMPLED",
            "@size": "22276",
            "@ref": "gr7",
            "@mimetype": "image/jpeg"
          },
          {
            "@category": "standard",
            "@height": "253",
            "@width": "382",
            "@_fa": "true",
            "$": "https://api.elsevier.com/content/object/eid/1-s2.0-S0021951724000496-gr8.jpg?httpAccept=%2A%2F%2A",
            "@multimediatype": "JPEG image file",
            "@type": "IMAGE-DOWNSAMPLED",
            "@size": "23726",
            "@ref": "gr8",
            "@mimetype": "image/jpeg"
          },
          {
            "@category": "standard",
            "@height": "292",
            "@width": "382",
            "@_fa": "true",
            "$": "https://api.elsevier.com/content/object/eid/1-s2.0-S0021951724000496-gr9.jpg?httpAccept=%2A%2F%2A",
            "@multimediatype": "JPEG image file",
            "@type": "IMAGE-DOWNSAMPLED",
            "@size": "26724",
            "@ref": "gr9",
            "@mimetype": "image/jpeg"
          },
          {
            "@category": "standard",
            "@height": "245",
            "@width": "301",
            "@_fa": "true",
            "$": "https://api.elsevier.com/content/object/eid/1-s2.0-S0021951724000496-ga1.jpg?httpAccept=%2A%2F%2A",
            "@multimediatype": "JPEG image file",
            "@type": "IMAGE-DOWNSAMPLED",
            "@size": "16966",
            "@ref": "ga1",
            "@mimetype": "image/jpeg"
          },
          {
            "@category": "standard",
            "@height": "278",
            "@width": "382",
            "@_fa": "true",
            "$": "https://api.elsevier.com/content/object/eid/1-s2.0-S0021951724000496-gr10.jpg?httpAccept=%2A%2F%2A",
            "@multimediatype": "JPEG image file",
            "@type": "IMAGE-DOWNSAMPLED",
            "@size": "25018",
            "@ref": "gr10",
            "@mimetype": "image/jpeg"
          },
          {
            "@category": "standard",
            "@height": "290",
            "@width": "382",
            "@_fa": "true",
            "$": "https://api.elsevier.com/content/object/eid/1-s2.0-S0021951724000496-gr11.jpg?httpAccept=%2A%2F%2A",
            "@multimediatype": "JPEG image file",
            "@type": "IMAGE-DOWNSAMPLED",
            "@size": "29588",
            "@ref": "gr11",
            "@mimetype": "image/jpeg"
          },
          {
            "@category": "standard",
            "@height": "627",
            "@width": "382",
            "@_fa": "true",
            "$": "https://api.elsevier.com/content/object/eid/1-s2.0-S0021951724000496-gr12.jpg?httpAccept=%2A%2F%2A",
            "@multimediatype": "JPEG image file",
            "@type": "IMAGE-DOWNSAMPLED",
            "@size": "69171",
            "@ref": "gr12",
            "@mimetype": "image/jpeg"
          },
          {
            "@category": "thumbnail",
            "@height": "164",
            "@width": "193",
            "@_fa": "true",
            "$": "https://api.elsevier.com/content/object/eid/1-s2.0-S0021951724000496-gr2.sml?httpAccept=%2A%2F%2A",
            "@multimediatype": "GIF image file",
            "@type": "IMAGE-THUMBNAIL",
            "@size": "12200",
            "@ref": "gr2",
            "@mimetype": "image/gif"
          },
          {
            "@category": "thumbnail",
            "@height": "164",
            "@width": "210",
            "@_fa": "true",
            "$": "https://api.elsevier.com/content/object/eid/1-s2.0-S0021951724000496-gr3.sml?httpAccept=%2A%2F%2A",
            "@multimediatype": "GIF image file",
            "@type": "IMAGE-THUMBNAIL",
            "@size": "5618",
            "@ref": "gr3",
            "@mimetype": "image/gif"
          },
          {
            "@category": "thumbnail",
            "@height": "164",
            "@width": "118",
            "@_fa": "true",
            "$": "https://api.elsevier.com/content/object/eid/1-s2.0-S0021951724000496-gr4.sml?httpAccept=%2A%2F%2A",
            "@multimediatype": "GIF image file",
            "@type": "IMAGE-THUMBNAIL",
            "@size": "4581",
            "@ref": "gr4",
            "@mimetype": "image/gif"
          },
          {
            "@category": "thumbnail",
            "@height": "164",
            "@width": "70",
            "@_fa": "true",
            "$": "https://api.elsevier.com/content/object/eid/1-s2.0-S0021951724000496-gr5.sml?httpAccept=%2A%2F%2A",
            "@multimediatype": "GIF image file",
            "@type": "IMAGE-THUMBNAIL",
            "@size": "4064",
            "@ref": "gr5",
            "@mimetype": "image/gif"
          },
          {
            "@category": "thumbnail",
            "@height": "163",
            "@width": "118",
            "@_fa": "true",
            "$": "https://api.elsevier.com/content/object/eid/1-s2.0-S0021951724000496-gr13.sml?httpAccept=%2A%2F%2A",
            "@multimediatype": "GIF image file",
            "@type": "IMAGE-THUMBNAIL",
            "@size": "8785",
            "@ref": "gr13",
            "@mimetype": "image/gif"
          },
          {
            "@category": "thumbnail",
            "@height": "105",
            "@width": "219",
            "@_fa": "true",
            "$": "https://api.elsevier.com/content/object/eid/1-s2.0-S0021951724000496-gr14.sml?httpAccept=%2A%2F%2A",
            "@multimediatype": "GIF image file",
            "@type": "IMAGE-THUMBNAIL",
            "@size": "8109",
            "@ref": "gr14",
            "@mimetype": "image/gif"
          },
          {
            "@category": "thumbnail",
            "@height": "164",
            "@width": "136",
            "@_fa": "true",
            "$": "https://api.elsevier.com/content/object/eid/1-s2.0-S0021951724000496-gr1.sml?httpAccept=%2A%2F%2A",
            "@multimediatype": "GIF image file",
            "@type": "IMAGE-THUMBNAIL",
            "@size": "12715",
            "@ref": "gr1",
            "@mimetype": "image/gif"
          },
          {
            "@category": "thumbnail",
            "@height": "164",
            "@width": "216",
            "@_fa": "true",
            "$": "https://api.elsevier.com/content/object/eid/1-s2.0-S0021951724000496-gr6.sml?httpAccept=%2A%2F%2A",
            "@multimediatype": "GIF image file",
            "@type": "IMAGE-THUMBNAIL",
            "@size": "7223",
            "@ref": "gr6",
            "@mimetype": "image/gif"
          },
          {
            "@category": "thumbnail",
            "@height": "164",
            "@width": "219",
            "@_fa": "true",
            "$": "https://api.elsevier.com/content/object/eid/1-s2.0-S0021951724000496-gr7.sml?httpAccept=%2A%2F%2A",
            "@multimediatype": "GIF image file",
            "@type": "IMAGE-THUMBNAIL",
            "@size": "6307",
            "@ref": "gr7",
            "@mimetype": "image/gif"
          },
          {
            "@category": "thumbnail",
            "@height": "145",
            "@width": "219",
            "@_fa": "true",
            "$": "https://api.elsevier.com/content/object/eid/1-s2.0-S0021951724000496-gr8.sml?httpAccept=%2A%2F%2A",
            "@multimediatype": "GIF image file",
            "@type": "IMAGE-THUMBNAIL",
            "@size": "7038",
            "@ref": "gr8",
            "@mimetype": "image/gif"
          },
          {
            "@category": "thumbnail",
            "@height": "164",
            "@width": "214",
            "@_fa": "true",
            "$": "https://api.elsevier.com/content/object/eid/1-s2.0-S0021951724000496-gr9.sml?httpAccept=%2A%2F%2A",
            "@multimediatype": "GIF image file",
            "@type": "IMAGE-THUMBNAIL",
            "@size": "7368",
            "@ref": "gr9",
            "@mimetype": "image/gif"
          },
          {
            "@category": "thumbnail",
            "@height": "164",
            "@width": "201",
            "@_fa": "true",
            "$": "https://api.elsevier.com/content/object/eid/1-s2.0-S0021951724000496-ga1.sml?httpAccept=%2A%2F%2A",
            "@multimediatype": "GIF image file",
            "@type": "IMAGE-THUMBNAIL",
            "@size": "6690",
            "@ref": "ga1",
            "@mimetype": "image/gif"
          },
          {
            "@category": "thumbnail",
            "@height": "159",
            "@width": "219",
            "@_fa": "true",
            "$": "https://api.elsevier.com/content/object/eid/1-s2.0-S0021951724000496-gr10.sml?httpAccept=%2A%2F%2A",
            "@multimediatype": "GIF image file",
            "@type": "IMAGE-THUMBNAIL",
            "@size": "8091",
            "@ref": "gr10",
            "@mimetype": "image/gif"
          },
          {
            "@category": "thumbnail",
            "@height": "164",
            "@width": "216",
            "@_fa": "true",
            "$": "https://api.elsevier.com/content/object/eid/1-s2.0-S0021951724000496-gr11.sml?httpAccept=%2A%2F%2A",
            "@multimediatype": "GIF image file",
            "@type": "IMAGE-THUMBNAIL",
            "@size": "8588",
            "@ref": "gr11",
            "@mimetype": "image/gif"
          },
          {
            "@category": "thumbnail",
            "@height": "164",
            "@width": "100",
            "@_fa": "true",
            "$": "https://api.elsevier.com/content/object/eid/1-s2.0-S0021951724000496-gr12.sml?httpAccept=%2A%2F%2A",
            "@multimediatype": "GIF image file",
            "@type": "IMAGE-THUMBNAIL",
            "@size": "5995",
            "@ref": "gr12",
            "@mimetype": "image/gif"
          },
          {
            "@category": "high",
            "@height": "2738",
            "@width": "3221",
            "@_fa": "true",
            "$": "https://api.elsevier.com/content/object/eid/1-s2.0-S0021951724000496-gr2_lrg.jpg?httpAccept=%2A%2F%2A",
            "@multimediatype": "JPEG image file",
            "@type": "IMAGE-HIGH-RES",
            "@size": "907351",
            "@ref": "gr2",
            "@mimetype": "image/jpeg"
          },
          {
            "@category": "high",
            "@height": "1319",
            "@width": "1693",
            "@_fa": "true",
            "$": "https://api.elsevier.com/content/object/eid/1-s2.0-S0021951724000496-gr3_lrg.jpg?httpAccept=%2A%2F%2A",
            "@multimediatype": "JPEG image file",
            "@type": "IMAGE-HIGH-RES",
            "@size": "150443",
            "@ref": "gr3",
            "@mimetype": "image/jpeg"
          },
          {
            "@category": "high",
            "@height": "2348",
            "@width": "1693",
            "@_fa": "true",
            "$": "https://api.elsevier.com/content/object/eid/1-s2.0-S0021951724000496-gr4_lrg.jpg?httpAccept=%2A%2F%2A",
            "@multimediatype": "JPEG image file",
            "@type": "IMAGE-HIGH-RES",
            "@size": "275986",
            "@ref": "gr4",
            "@mimetype": "image/jpeg"
          },
          {
            "@category": "high",
            "@height": "3972",
            "@width": "1693",
            "@_fa": "true",
            "$": "https://api.elsevier.com/content/object/eid/1-s2.0-S0021951724000496-gr5_lrg.jpg?httpAccept=%2A%2F%2A",
            "@multimediatype": "JPEG image file",
            "@type": "IMAGE-HIGH-RES",
            "@size": "587612",
            "@ref": "gr5",
            "@mimetype": "image/jpeg"
          },
          {
            "@category": "high",
            "@height": "2324",
            "@width": "1683",
            "@_fa": "true",
            "$": "https://api.elsevier.com/content/object/eid/1-s2.0-S0021951724000496-gr13_lrg.jpg?httpAccept=%2A%2F%2A",
            "@multimediatype": "JPEG image file",
            "@type": "IMAGE-HIGH-RES",
            "@size": "559876",
            "@ref": "gr13",
            "@mimetype": "image/jpeg"
          },
          {
            "@category": "high",
            "@height": "1554",
            "@width": "3244",
            "@_fa": "true",
            "$": "https://api.elsevier.com/content/object/eid/1-s2.0-S0021951724000496-gr14_lrg.jpg?httpAccept=%2A%2F%2A",
            "@multimediatype": "JPEG image file",
            "@type": "IMAGE-HIGH-RES",
            "@size": "391708",
            "@ref": "gr14",
            "@mimetype": "image/jpeg"
          },
          {
            "@category": "high",
            "@height": "3497",
            "@width": "2904",
            "@_fa": "true",
            "$": "https://api.elsevier.com/content/object/eid/1-s2.0-S0021951724000496-gr1_lrg.jpg?httpAccept=%2A%2F%2A",
            "@multimediatype": "JPEG image file",
            "@type": "IMAGE-HIGH-RES",
            "@size": "1275735",
            "@ref": "gr1",
            "@mimetype": "image/jpeg"
          },
          {
            "@category": "high",
            "@height": "1284",
            "@width": "1693",
            "@_fa": "true",
            "$": "https://api.elsevier.com/content/object/eid/1-s2.0-S0021951724000496-gr6_lrg.jpg?httpAccept=%2A%2F%2A",
            "@multimediatype": "JPEG image file",
            "@type": "IMAGE-HIGH-RES",
            "@size": "200228",
            "@ref": "gr6",
            "@mimetype": "image/jpeg"
          },
          {
            "@category": "high",
            "@height": "1267",
            "@width": "1693",
            "@_fa": "true",
            "$": "https://api.elsevier.com/content/object/eid/1-s2.0-S0021951724000496-gr7_lrg.jpg?httpAccept=%2A%2F%2A",
            "@multimediatype": "JPEG image file",
            "@type": "IMAGE-HIGH-RES",
            "@size": "167654",
            "@ref": "gr7",
            "@mimetype": "image/jpeg"
          },
          {
            "@category": "high",
            "@height": "1120",
            "@width": "1693",
            "@_fa": "true",
            "$": "https://api.elsevier.com/content/object/eid/1-s2.0-S0021951724000496-gr8_lrg.jpg?httpAccept=%2A%2F%2A",
            "@multimediatype": "JPEG image file",
            "@type": "IMAGE-HIGH-RES",
            "@size": "179842",
            "@ref": "gr8",
            "@mimetype": "image/jpeg"
          },
          {
            "@category": "high",
            "@height": "1295",
            "@width": "1693",
            "@_fa": "true",
            "$": "https://api.elsevier.com/content/object/eid/1-s2.0-S0021951724000496-gr9_lrg.jpg?httpAccept=%2A%2F%2A",
            "@multimediatype": "JPEG image file",
            "@type": "IMAGE-HIGH-RES",
            "@size": "202670",
            "@ref": "gr9",
            "@mimetype": "image/jpeg"
          },
          {
            "@category": "high",
            "@height": "1085",
            "@width": "1333",
            "@_fa": "true",
            "$": "https://api.elsevier.com/content/object/eid/1-s2.0-S0021951724000496-ga1_lrg.jpg?httpAccept=%2A%2F%2A",
            "@multimediatype": "JPEG image file",
            "@type": "IMAGE-HIGH-RES",
            "@size": "106877",
            "@ref": "ga1",
            "@mimetype": "image/jpeg"
          },
          {
            "@category": "high",
            "@height": "1232",
            "@width": "1693",
            "@_fa": "true",
            "$": "https://api.elsevier.com/content/object/eid/1-s2.0-S0021951724000496-gr10_lrg.jpg?httpAccept=%2A%2F%2A",
            "@multimediatype": "JPEG image file",
            "@type": "IMAGE-HIGH-RES",
            "@size": "204157",
            "@ref": "gr10",
            "@mimetype": "image/jpeg"
          },
          {
            "@category": "high",
            "@height": "1287",
            "@width": "1693",
            "@_fa": "true",
            "$": "https://api.elsevier.com/content/object/eid/1-s2.0-S0021951724000496-gr11_lrg.jpg?httpAccept=%2A%2F%2A",
            "@multimediatype": "JPEG image file",
            "@type": "IMAGE-HIGH-RES",
            "@size": "232240",
            "@ref": "gr11",
            "@mimetype": "image/jpeg"
          },
          {
            "@category": "high",
            "@height": "2780",
            "@width": "1693",
            "@_fa": "true",
            "$": "https://api.elsevier.com/content/object/eid/1-s2.0-S0021951724000496-gr12_lrg.jpg?httpAccept=%2A%2F%2A",
            "@multimediatype": "JPEG image file",
            "@type": "IMAGE-HIGH-RES",
            "@size": "525468",
            "@ref": "gr12",
            "@mimetype": "image/jpeg"
          },
          {
            "@category": "standard",
            "@_fa": "true",
            "$": "https://api.elsevier.com/content/object/eid/1-s2.0-S0021951724000496-mmc1.docx?httpAccept=%2A%2F%2A",
            "@multimediatype": "Microsoft Word file",
            "@type": "APPLICATION",
            "@size": "173650",
            "@ref": "mmc1",
            "@mimetype": "application/word"
          },
          {
            "@category": "thumbnail",
            "@_fa": "true",
            "$": "https://api.elsevier.com/content/object/eid/1-s2.0-S0021951724000496-si1.svg?httpAccept=%2A%2F%2A",
            "@multimediatype": "Scalable Vector Graphics file",
            "@type": "ALTIMG",
            "@size": "26870",
            "@ref": "si1",
            "@mimetype": "image/svg+xml"
          },
          {
            "@category": "thumbnail",
            "@_fa": "true",
            "$": "https://api.elsevier.com/content/object/eid/1-s2.0-S0021951724000496-si2.svg?httpAccept=%2A%2F%2A",
            "@multimediatype": "Scalable Vector Graphics file",
            "@type": "ALTIMG",
            "@size": "24675",
            "@ref": "si2",
            "@mimetype": "image/svg+xml"
          },
          {
            "@category": "thumbnail",
            "@_fa": "true",
            "$": "https://api.elsevier.com/content/object/eid/1-s2.0-S0021951724000496-si3.svg?httpAccept=%2A%2F%2A",
            "@multimediatype": "Scalable Vector Graphics file",
            "@type": "ALTIMG",
            "@size": "30462",
            "@ref": "si3",
            "@mimetype": "image/svg+xml"
          },
          {
            "@category": "thumbnail",
            "@_fa": "true",
            "$": "https://api.elsevier.com/content/object/eid/1-s2.0-S0021951724000496-si4.svg?httpAccept=%2A%2F%2A",
            "@multimediatype": "Scalable Vector Graphics file",
            "@type": "ALTIMG",
            "@size": "22329",
            "@ref": "si4",
            "@mimetype": "image/svg+xml"
          },
          {
            "@category": "thumbnail",
            "@_fa": "true",
            "$": "https://api.elsevier.com/content/object/eid/1-s2.0-S0021951724000496-si5.svg?httpAccept=%2A%2F%2A",
            "@multimediatype": "Scalable Vector Graphics file",
            "@type": "ALTIMG",
            "@size": "24247",
            "@ref": "si5",
            "@mimetype": "image/svg+xml"
          },
          {
            "@category": "standard",
            "@_fa": "true",
            "$": "https://api.elsevier.com/content/object/eid/1-s2.0-S0021951724000496-am.pdf?httpAccept=%2A%2F%2A",
            "@multimediatype": "Acrobat PDF file",
            "@type": "AAM-PDF",
            "@size": "2246634",
            "@ref": "am",
            "@mimetype": "application/pdf"
          }
        ]
      },
      "link": {
        "@rel": "abstract",
        "@href": "https://api.elsevier.com/content/abstract/scopus_id/85183947468"
      }
    }
  }
}