{
  "metadata": {
    "title": "Surface modification of SiO<ce:inf loc=post>2</ce:inf> support with N-containing polymer for enantioselective hydrogenation over Pt catalyst",
    "authors": "; ; ",
    "journal": "Journal of Catalysis",
    "date": "2025-09-30",
    "doi": "10.1016/j.jcat.2025.116232",
    "abstract": "",
    "uri": "https://api.elsevier.com/content/article/pii/S0021951725002970",
    "pii": "S0021951725002970"
  },
  "fulltext": {
    "full-text-retrieval-response": {
      "scopus-eid": "2-s2.0-105005956576",
      "originalText": "serial JL 272561 291210 291744 291809 31 Journal of Catalysis JOURNALCATALYSIS 2025-05-21 2025-05-21 2025-05-27 2025-05-27 2025-09-02T04:45:33 1-s2.0-S0021951725002970 S0021-9517(25)00297-0 S0021951725002970 10.1016/j.jcat.2025.116232 S300 S300.1 FULL-TEXT 1-s2.0-S0021951725X00075 2025-09-02T04:08:10.820082Z 0 0 20250901 20250930 2025 2025-05-21T23:27:29.428247Z absattachment articleinfo articlenumber articletitlenorm authfirstinitialnorm authfirstsurnamenorm cid cids contenttype copyright crossmark dateloaded dateloadedtxt datesearch datesort dateupdated dco docsubtype doctype doi eid ewtransactionid hubeid indexeddate issn issnnorm itemstage itemtransactionid itemweight openaccess openarchive pg pgfirst pii piinorm pubdateend pubdatestart pubdatetxt pubyr sectiontitle sortorder srctitle srctitlenorm srctype ssids alllist content subj subheadings suppl tomb volfirst volissue volumelist webpdf webpdfpagecount yearnav figure table e-component body mmlmath acknowledge affil appendices articletitle auth authfirstini authfull authkeywords authlast grantnumber grantsponsor grantsponsorid highlightsabst orcid primabst pubtype ref specialabst 0021-9517 00219517 true 449 449 C Volume 449 14 116232 116232 116232 202509 September 2025 2025-09-01 2025-09-30 2025 Regular Articles article fla © 2025 Elsevier Inc. All rights are reserved, including those for text and data mining, AI training, and similar technologies. SURFACEMODIFICATIONSIO2SUPPORTNCONTAININGPOLYMERFORENANTIOSELECTIVEHYDROGENATIONOVERPTCATALYST YUN M 1 Introduction 2 Experimental 2.1 Chemicals and materials 2.2 Catalyst preparation 2.3 Characterization 2.4 Catalytic performance tests 3 Results and discussion 3.1 Characterization of the Pt/PEI-SiO2-t catalysts 3.2 Catalytic performances of the Pt/SiO2 and Pt/PEI-SiO2-t catalysts in the enantioselective MP hydrogenation 3.3 Versatility and reusability of the Pt/PEI-SiO2-3 catalyst for the enantioselective hydrogenation 4 Conclusions CRediT authorship contribution statement Acknowledgments Appendix A Supplementary data References MEEMKEN 2017 11522 11569 F BAIKER 2015 7449 7464 A MALLAT 2007 4863 4890 T ATTARD 2001 3158 3167 G SCHOENBAUM 2014 1438 1445 C MALLAT 2000 3 22 T HAN 2006 318 328 D CHEN 2013 84 93 P KOH 2017 16150 16161 K COAN 2018 6637 6647 P JENKINS 2021 4080 4090 A ELLIS 2017 8351 8357 L ZHANG 2018 148 155 J GONG 2024 16245 16255 Y REDONDO 2016 2983 2988 A DASILVA 2017 6014 6022 F MARSHALL 2010 853 858 S CARGNELLO 2015 6906 6911 M LU 2021 6020 6058 L WU 2018 255 W SCHOENBAUM 2013 92 99 C KASPRZYKHORDERN 2010 4466 4503 B FARINA 2006 2734 2793 V MEEMKEN 2014 8784 8788 F BLASER 1997 441 463 H MCMORN 2004 108 122 P BAIKER 2005 159 170 A MEEMKEN 2018 996 1001 F ZHAN 2015 650 659 E KYRIAKOU 2011 9687 9695 G BLASER 2000 12675 12682 H KIM 2021 81 91 J BAI 2016 15656 15661 L ELMERAGAWI 2020 24800 24811 S DENG 2005 2167 2177 S LI 2019 275 284 J KIM 2023 6144 6153 J BATOOL 2024 112271 I ZHANG 2001 56 59 Q SAKTHISABARIMOORTHI 2018 271 282 A ALOWEINI 2009 140 145 R LONG 2013 1700 1708 W KASPRZAK 2017 53 65 A KOUTSIANOS 2017 21772 21781 A XU 2016 810 817 Y LIANG 2023 141980 W ZHANG 2025 10 H JIA 2013 94 102 L PODYACHEVA 2012 42 47 O SONG 2024 2620 2630 B FERRI 2001 1172 1173 D FERRI 2001 12074 12084 D SCHMIDT 2007 8087 8093 E COLLIERE 2024 e202302131 V VONARX 2002 75 87 M YUNX2025X116232 YUNX2025X116232XM 2027-05-27T00:00:00.000Z 2027-05-27T00:00:00.000Z http://creativecommons.org/licenses/by-nc-nd/4.0/ © 2025 Elsevier Inc. All rights are reserved, including those for text and data mining, AI training, and similar technologies. 2025-05-29T01:20:00.855Z http://vtw.elsevier.com/data/voc/AddOnTypes/50.7/aggregated-refined National Research Foundation of Korea NRF National Research Foundation of Korea http://data.elsevier.com/vocabulary/SciValFunders/501100003725 http://sws.geonames.org/1835841/ MSIT 2022R1A2C4001411 RS-2025-00553789 2021R1A5A1084921 MSIT Ministry of Science and ICT, South Korea http://data.elsevier.com/vocabulary/SciValFunders/501100014188 http://sws.geonames.org/1835841/ This work was supported by a National Research Foundation of Korea (NRF) grant funded by the Korean government (MSIT) (No. 2022R1A2C4001411, RS-2025-00553789 and 2021R1A5A1084921). https://doi.org/10.15223/policy-017 https://doi.org/10.15223/policy-037 https://doi.org/10.15223/policy-012 https://doi.org/10.15223/policy-029 https://doi.org/10.15223/policy-004 item S0021-9517(25)00297-0 S0021951725002970 1-s2.0-S0021951725002970 10.1016/j.jcat.2025.116232 272561 2025-09-02T04:08:10.820082Z 2025-09-01 2025-09-30 1-s2.0-S0021951725002970-main.pdf https://s3-eu-west-1.amazonaws.com/prod-ucs-content-store-eu-west/content/pii:S0021951725002970/MAIN/application/pdf/ff6fb95682c0ccdd4cccd502ebffb7ce/main.pdf main.pdf pdf true 9319949 MAIN 10 1-s2.0-S0021951725002970-main_1.png https://s3-eu-west-1.amazonaws.com/prod-ucs-content-store-eu-west/content/pii:S0021951725002970/PREVIEW/image/png/270cda9024069a2fbc2937095eb33547/main_1.png main_1.png png 58559 928 656 IMAGE-WEB-PDF 1 1-s2.0-S0021951725002970-gr7.jpg https://s3-eu-west-1.amazonaws.com/prod-ucs-content-store-eu-west/content/pii:S0021951725002970/gr7/DOWNSAMPLED/image/jpeg/bc4abcbe88f281a172bd161400a967c1/gr7.jpg gr7 gr7.jpg jpg 38716 229 676 IMAGE-DOWNSAMPLED 1-s2.0-S0021951725002970-gr6.jpg https://s3-eu-west-1.amazonaws.com/prod-ucs-content-store-eu-west/content/pii:S0021951725002970/gr6/DOWNSAMPLED/image/jpeg/9b4acf99853fb2e1d3f617d0cb6d0cc9/gr6.jpg gr6 gr6.jpg jpg 16040 297 383 IMAGE-DOWNSAMPLED 1-s2.0-S0021951725002970-gr9.jpg https://s3-eu-west-1.amazonaws.com/prod-ucs-content-store-eu-west/content/pii:S0021951725002970/gr9/DOWNSAMPLED/image/jpeg/1990dffc23982a0f18c19ae5eefb2492/gr9.jpg gr9 gr9.jpg jpg 56854 244 535 IMAGE-DOWNSAMPLED 1-s2.0-S0021951725002970-gr8.jpg https://s3-eu-west-1.amazonaws.com/prod-ucs-content-store-eu-west/content/pii:S0021951725002970/gr8/DOWNSAMPLED/image/jpeg/e0f855c3af33fe3f2646c3e5d86e8b26/gr8.jpg gr8 gr8.jpg jpg 33573 262 625 IMAGE-DOWNSAMPLED 1-s2.0-S0021951725002970-sc1.jpg https://s3-eu-west-1.amazonaws.com/prod-ucs-content-store-eu-west/content/pii:S0021951725002970/sc1/DOWNSAMPLED/image/jpeg/979cc3a29bae3abbdb379fc6150237c9/sc1.jpg sc1 sc1.jpg jpg 34066 268 625 IMAGE-DOWNSAMPLED 1-s2.0-S0021951725002970-gr1.jpg https://s3-eu-west-1.amazonaws.com/prod-ucs-content-store-eu-west/content/pii:S0021951725002970/gr1/DOWNSAMPLED/image/jpeg/c59f0b309d379b27d28ea476e90b1a49/gr1.jpg gr1 gr1.jpg jpg 142708 469 711 IMAGE-DOWNSAMPLED 1-s2.0-S0021951725002970-gr3.jpg https://s3-eu-west-1.amazonaws.com/prod-ucs-content-store-eu-west/content/pii:S0021951725002970/gr3/DOWNSAMPLED/image/jpeg/a1caff97b23e2c635729c3a39517def8/gr3.jpg gr3 gr3.jpg jpg 58834 475 330 IMAGE-DOWNSAMPLED 1-s2.0-S0021951725002970-gr2.jpg https://s3-eu-west-1.amazonaws.com/prod-ucs-content-store-eu-west/content/pii:S0021951725002970/gr2/DOWNSAMPLED/image/jpeg/8ac2f5b53e5b6434f2e25d94f7ee8008/gr2.jpg gr2 gr2.jpg jpg 41930 305 534 IMAGE-DOWNSAMPLED 1-s2.0-S0021951725002970-ga1.jpg https://s3-eu-west-1.amazonaws.com/prod-ucs-content-store-eu-west/content/pii:S0021951725002970/ga1/DOWNSAMPLED/image/jpeg/00eb0185049e088d7b5f06d071417e24/ga1.jpg ga1 true ga1.jpg jpg 26041 200 466 IMAGE-DOWNSAMPLED 1-s2.0-S0021951725002970-gr5.jpg https://s3-eu-west-1.amazonaws.com/prod-ucs-content-store-eu-west/content/pii:S0021951725002970/gr5/DOWNSAMPLED/image/jpeg/8b13fd5d3699b85fab0d7a966108d7b5/gr5.jpg gr5 gr5.jpg jpg 23115 272 383 IMAGE-DOWNSAMPLED 1-s2.0-S0021951725002970-gr4.jpg https://s3-eu-west-1.amazonaws.com/prod-ucs-content-store-eu-west/content/pii:S0021951725002970/gr4/DOWNSAMPLED/image/jpeg/078e9b1312aee2f012f103d8c7ce8f02/gr4.jpg gr4 gr4.jpg jpg 70029 380 802 IMAGE-DOWNSAMPLED 1-s2.0-S0021951725002970-gr7.sml https://s3-eu-west-1.amazonaws.com/prod-ucs-content-store-eu-west/content/pii:S0021951725002970/gr7/THUMBNAIL/image/gif/7b6a6a950f47c322da9246165ce0304c/gr7.sml gr7 gr7.sml sml 6796 74 219 IMAGE-THUMBNAIL 1-s2.0-S0021951725002970-gr6.sml https://s3-eu-west-1.amazonaws.com/prod-ucs-content-store-eu-west/content/pii:S0021951725002970/gr6/THUMBNAIL/image/gif/761372f8d436c3d0ecc3a42214cee9d1/gr6.sml gr6 gr6.sml sml 3997 164 212 IMAGE-THUMBNAIL 1-s2.0-S0021951725002970-gr9.sml https://s3-eu-west-1.amazonaws.com/prod-ucs-content-store-eu-west/content/pii:S0021951725002970/gr9/THUMBNAIL/image/gif/23d5b5b3955765f69cc347dab9d37408/gr9.sml gr9 gr9.sml sml 15890 100 219 IMAGE-THUMBNAIL 1-s2.0-S0021951725002970-gr8.sml https://s3-eu-west-1.amazonaws.com/prod-ucs-content-store-eu-west/content/pii:S0021951725002970/gr8/THUMBNAIL/image/gif/99ce6b6fa27561b5ac947a6e64c7743a/gr8.sml gr8 gr8.sml sml 4269 92 219 IMAGE-THUMBNAIL 1-s2.0-S0021951725002970-sc1.sml https://s3-eu-west-1.amazonaws.com/prod-ucs-content-store-eu-west/content/pii:S0021951725002970/sc1/THUMBNAIL/image/gif/adaa764b21b7cd3d1cbcc4e703460d7e/sc1.sml sc1 sc1.sml sml 4623 94 219 IMAGE-THUMBNAIL 1-s2.0-S0021951725002970-gr1.sml https://s3-eu-west-1.amazonaws.com/prod-ucs-content-store-eu-west/content/pii:S0021951725002970/gr1/THUMBNAIL/image/gif/82d8e7f9b96b904d2a3a60312c581c78/gr1.sml gr1 gr1.sml sml 23521 145 219 IMAGE-THUMBNAIL 1-s2.0-S0021951725002970-gr3.sml https://s3-eu-west-1.amazonaws.com/prod-ucs-content-store-eu-west/content/pii:S0021951725002970/gr3/THUMBNAIL/image/gif/d375d07d9640dbae82abca870509e1ac/gr3.sml gr3 gr3.sml sml 8543 164 114 IMAGE-THUMBNAIL 1-s2.0-S0021951725002970-gr2.sml https://s3-eu-west-1.amazonaws.com/prod-ucs-content-store-eu-west/content/pii:S0021951725002970/gr2/THUMBNAIL/image/gif/899bb2f59ea4495e93f9fb47255d9c09/gr2.sml gr2 gr2.sml sml 8207 125 219 IMAGE-THUMBNAIL 1-s2.0-S0021951725002970-ga1.sml https://s3-eu-west-1.amazonaws.com/prod-ucs-content-store-eu-west/content/pii:S0021951725002970/ga1/THUMBNAIL/image/gif/9922ef4d487e86948386b26408e5b73b/ga1.sml ga1 true ga1.sml sml 7666 94 219 IMAGE-THUMBNAIL 1-s2.0-S0021951725002970-gr5.sml https://s3-eu-west-1.amazonaws.com/prod-ucs-content-store-eu-west/content/pii:S0021951725002970/gr5/THUMBNAIL/image/gif/74d2c610692fec545a8259c19178c9c6/gr5.sml gr5 gr5.sml sml 6931 155 219 IMAGE-THUMBNAIL 1-s2.0-S0021951725002970-gr4.sml https://s3-eu-west-1.amazonaws.com/prod-ucs-content-store-eu-west/content/pii:S0021951725002970/gr4/THUMBNAIL/image/gif/10e41343a1a123ff556dbbe1366df2da/gr4.sml gr4 gr4.sml sml 5636 104 219 IMAGE-THUMBNAIL 1-s2.0-S0021951725002970-gr7_lrg.jpg https://s3-eu-west-1.amazonaws.com/prod-ucs-content-store-eu-west/content/pii:S0021951725002970/HIGHRES/image/jpeg/30408d27c9962bedc51016eb30e72691/gr7_lrg.jpg gr7 gr7_lrg.jpg jpg 208978 1015 2992 IMAGE-HIGH-RES 1-s2.0-S0021951725002970-gr6_lrg.jpg https://s3-eu-west-1.amazonaws.com/prod-ucs-content-store-eu-west/content/pii:S0021951725002970/HIGHRES/image/jpeg/ddd1812a40825aa16e1f568d3b792f06/gr6_lrg.jpg gr6 gr6_lrg.jpg jpg 74977 1316 1699 IMAGE-HIGH-RES 1-s2.0-S0021951725002970-gr9_lrg.jpg https://s3-eu-west-1.amazonaws.com/prod-ucs-content-store-eu-west/content/pii:S0021951725002970/HIGHRES/image/jpeg/866c539b6150e259608f61e17d1886ba/gr9_lrg.jpg gr9 gr9_lrg.jpg jpg 380486 761 1667 IMAGE-HIGH-RES 1-s2.0-S0021951725002970-gr8_lrg.jpg https://s3-eu-west-1.amazonaws.com/prod-ucs-content-store-eu-west/content/pii:S0021951725002970/HIGHRES/image/jpeg/c3dd8f8e1170c09f38017832b8c045c4/gr8_lrg.jpg gr8 gr8_lrg.jpg jpg 156321 994 2368 IMAGE-HIGH-RES 1-s2.0-S0021951725002970-sc1_lrg.jpg https://s3-eu-west-1.amazonaws.com/prod-ucs-content-store-eu-west/content/pii:S0021951725002970/HIGHRES/image/jpeg/a8d68828e5a1c35a6a3f761a7964688b/sc1_lrg.jpg sc1 sc1_lrg.jpg jpg 147209 1017 2368 IMAGE-HIGH-RES 1-s2.0-S0021951725002970-gr1_lrg.jpg https://s3-eu-west-1.amazonaws.com/prod-ucs-content-store-eu-west/content/pii:S0021951725002970/HIGHRES/image/jpeg/95c38a1503e983e68dd63973392ab4a3/gr1_lrg.jpg gr1 gr1_lrg.jpg jpg 650284 1248 1890 IMAGE-HIGH-RES 1-s2.0-S0021951725002970-gr3_lrg.jpg https://s3-eu-west-1.amazonaws.com/prod-ucs-content-store-eu-west/content/pii:S0021951725002970/HIGHRES/image/jpeg/d2301a8236315c05cc17cfa13f6fa2d6/gr3_lrg.jpg gr3 gr3_lrg.jpg jpg 315855 2106 1463 IMAGE-HIGH-RES 1-s2.0-S0021951725002970-gr2_lrg.jpg https://s3-eu-west-1.amazonaws.com/prod-ucs-content-store-eu-west/content/pii:S0021951725002970/HIGHRES/image/jpeg/b18ad0e232e66ad979782713a7f0b1fd/gr2_lrg.jpg gr2 gr2_lrg.jpg jpg 238747 1350 2367 IMAGE-HIGH-RES 1-s2.0-S0021951725002970-ga1_lrg.jpg https://s3-eu-west-1.amazonaws.com/prod-ucs-content-store-eu-west/content/pii:S0021951725002970/HIGHRES/image/jpeg/e17c49b5a22f7c7d91b238dc806aca70/ga1_lrg.jpg ga1 true ga1_lrg.jpg jpg 152835 886 2064 IMAGE-HIGH-RES 1-s2.0-S0021951725002970-gr5_lrg.jpg https://s3-eu-west-1.amazonaws.com/prod-ucs-content-store-eu-west/content/pii:S0021951725002970/HIGHRES/image/jpeg/96b93f0a49c1277b874792993467624c/gr5_lrg.jpg gr5 gr5_lrg.jpg jpg 108344 1206 1699 IMAGE-HIGH-RES 1-s2.0-S0021951725002970-gr4_lrg.jpg https://s3-eu-west-1.amazonaws.com/prod-ucs-content-store-eu-west/content/pii:S0021951725002970/HIGHRES/image/jpeg/929d81653527449ea5579b04b549fb44/gr4_lrg.jpg gr4 gr4_lrg.jpg jpg 329440 1437 3033 IMAGE-HIGH-RES 1-s2.0-S0021951725002970-mmc1.docx https://s3-eu-west-1.amazonaws.com/prod-ucs-content-store-eu-west/content/pii:S0021951725002970/mmc1/MAIN/application/vnd.openxmlformats-officedocument.wordprocessingml.document/46d4f55497370e4cd023b94b07bbdf9a/mmc1.docx mmc1 mmc1.docx docx 2233810 APPLICATION 1-s2.0-S0021951725002970-si1.svg https://s3-eu-west-1.amazonaws.com/prod-ucs-content-store-eu-west/content/pii:S0021951725002970/image/svg+xml/5692e5cc8c820ee05b4f38c18bea7fbe/si1.svg si1 si1.svg svg 20583 ALTIMG 1-s2.0-S0021951725002970-si2.svg https://s3-eu-west-1.amazonaws.com/prod-ucs-content-store-eu-west/content/pii:S0021951725002970/image/svg+xml/823d9b982edd76da1310b161bb7ea9c4/si2.svg si2 si2.svg svg 14714 ALTIMG YJCAT 116232 116232 S0021-9517(25)00297-0 10.1016/j.jcat.2025.116232 Elsevier Inc. Fig. 1 TEM images and size distributions of the Pt NPs of the (a) Pt/SiO2, (b) Pt/PEI-SiO2-1, (c) Pt/PEI-SiO2-2, (d) Pt/PEI-SiO2-3, (e) Pt/PEI-SiO2-4, and (f) Pt/PEI-SiO2-5 catalysts. Fig. 2 FTIR transmittance spectra of the Pt/SiO2 and Pt/PEI-SiO2-t catalysts in the regions (a) 3100–2600 cm−1 and (b) 1900–1300 cm−1. Fig. 3 XPS spectra of Pt 4f for the Pt/SiO2 and Pt/PEI-SiO2-t catalysts. Fig. 4 Conversion (■) and ee (▾) plotted against reaction time in the enantioselective MP hydrogenation over the (a) Pt/SiO2, (b) Pt/PEI-SiO2-1, (c) Pt/PEI-SiO2-2, (d) Pt/PEI-SiO2-3, (e) Pt/PEI-SiO2-4, and (f) Pt/PEI-SiO2-5 catalysts. Fig. 5 Correlation between the proportion of positively charged Pt species (Pt2+ and Pt x +), p (%), and the ee at full conversion for the Pt/SiO2 and Pt/PEI-SiO2-t catalysts. Fig. 6 Effect of the H2 pressure on the enantioselectivities of the Pt/SiO2 and Pt/PEI-SiO2-3 catalysts in the MP hydrogenation using CD as a chiral modifier. Fig. 7 Reusability test of the Pt/PEI-SiO2-3 catalyst in the enantioselective MP hydrogenation at (a) 0.1 MPa H2 and (b) at 1.0 MPa H2. Fig. 8 FTIR transmittance spectra of the fresh and spent Pt/PEI-SiO2-3 catalysts in the regions (a) 3100–2600 cm−1 and (b) 1900–1300 cm−1. Fig. 9 TEM images of the (a) fresh and (b) spent Pt/PEI-SiO2-3 catalysts. Scheme 1 Enantioselective hydrogenation of α-keto esters over a cinchona alkaloid-modified Pt catalyst. Table 1 Pt contents, S BET values, Ptsurface/Pttotal ratios, and d CO and d TEM values obtained for the Pt/SiO2 and Pt/PEI-SiO2-t catalysts. Sample Pt content (wt.%) a S BET (m2/g) b Ptsurface/Pttotal c d CO (nm) c d TEM (nm) d Pt/SiO2 1.3 375 0.43 2.0 1.6 Pt/PEI-SiO2-1 1.2 216 0.08 14.7 1.7 Pt/PEI-SiO2-2 1.2 237 0.15 8.0 1.7 Pt/PEI-SiO2-3 1.1 247 0.17 6.6 1.7 Pt/PEI-SiO2-4 1.1 256 0.17 6.4 1.7 Pt/PEI-SiO2-5 1.3 276 0.21 6.2 1.7 a The Pt content was measured by ICP-OES. b S BET was estimated from N2 physisorption measurements. c Ptsurface and d CO were estimated from CO chemisorption experiments. d d TEM was determined by TEM imaging. Table 2 C and N contents in the Pt/SiO2 and Pt/PEI-SiO2-t catalysts. Sample C(wt.%) a N(wt.%) a Pt/SiO2 0.1 0.0 Pt/PEI-SiO2-1 5.4 2.1 Pt/PEI-SiO2-2 4.5 1.8 Pt/PEI-SiO2-3 4.0 1.7 Pt/PEI-SiO2-4 3.8 1.5 Pt/PEI-SiO2-5 3.3 1.4 a The C and N contents were determined by elemental analysis. Table 3 Pt 4f7/2 binding energies, and the corresponding fractions of the Pt0, Pt2+, and Pt x + (2 < x < 4) species for the Pt/SiO2 and Pt/PEI-SiO2-t catalysts. Sample Pt binding energy(eV) Fraction (%) (Pt2++Pt x +)/Pt0 Pt0 Pt2+ Pt x + (2 < x < 4) Pt/SiO2 71.3 52.7 47.3 0 0.9 Pt/PEI-SiO2-1 72.1 32.8 61.4 5.9 2.1 Pt/PEI-SiO2-2 72.3 27.0 68.0 5.0 2.7 Pt/PEI-SiO2-3 72.3 26.7 68.5 4.9 2.8 Pt/PEI-SiO2-4 71.9 35.3 60.0 4.7 1.8 Pt/PEI-SiO2-5 71.7 38.7 56.8 4.5 1.6 Table 4 Catalytic performances of the Pt/SiO2 and Pt/PEI-SiO2-t catalysts in the enantioselective MP hydrogenation without and with CD. Sample Without CD With CD Conversion (%) a TOF(×102 h−1) b ee (%) c Conversion (%) a TOF(×102 h−1) b ee (%) c Pt/SiO2 10.0 (±0.5) 1.8 (±0.1) 0 12.1 (±0.6) 21.6 (±1.0) 78.8 (±0.2) Pt/PEI-SiO2-1 9.4 (±0.5) 10.9 (±0.5) 9.2 (±1.0) 106.7 (±7.2) 84.9 (±0.5) Pt/PEI-SiO2-2 10.8 (±0.1) 7.0 (±0.4) 11.3 (±0.5) 71.2 (±3.1) 88.5 (±0.7) Pt/PEI-SiO2-3 11.9 (±0.7) 6.0 (±0.4) 15.1 (±0.5) 85.8 (±3.0) 90.9 (±0.2) Pt/PEI-SiO2-4 9.6 (±1.0) 5.5 (±1.0) 9.7 (±0.4) 55.1 (±2.4) 86.1 (±1.0) Pt/PEI-SiO2-5 8.2 (±0.1) 3.7 (±0.5) 8.0 (±0.8) 36.6 (±3.4) 84.9 (±0.5) a Conversion was measured after 20 min of reaction without CD and after 2 min of reaction with CD. b TOF values were determined from the bare surface Pt sites estimated from CO chemisorption. c ee values were obtained at full conversion. Table 5 Enantioselectivities of the Pt/SiO2 and Pt/PEI-SiO2-3 catalysts in the MP hydrogenation using different chiral modifiers. Chiral modifier Major product Sample ee (%) CD (R)-methyl lactate Pt/SiO2 78.8 (±0.2) Pt/PEI-SiO2-3 90.9 (±0.2) CN (S)-methyl lactate Pt/SiO2 56.5 (±0.8) Pt/PEI-SiO2-3 69.2 (±0.8) QD (S)-methyl lactate Pt/SiO2 66.3 (±0.7) Pt/PEI-SiO2-3 79.8 (±0.9) QN (R)-methyl lactate Pt/SiO2 85.4 (±0.9) Pt/PEI-SiO2-3 90.9 (±0.8) Table 6 Enantioselectivities of the Pt/SiO2 and Pt/PEI-SiO2-3 catalysts in the hydrogenation of MP, EP, MBF and EOPB using CD as a chiral modifier. Substrate Sample ee (%)a MP Pt/SiO2 78.8 (±0.2) Pt/PEI-SiO2-3 90.9 (±0.2) EP Pt/SiO2 64.9 (±0.6) Pt/PEI-SiO2-3 76.6 (±0.3) MBF Pt/SiO2 51.8 (±0.2) Pt/PEI-SiO2-3 65.9 (±0.6) EOPB Pt/SiO2 58.7 (±0.2) Pt/PEI-SiO2-3 67.4 (±0.3) Research article Surface modification of SiO2 support with N-containing polymer for enantioselective hydrogenation over Pt catalyst Minji Yun Writing – original draft Investigation Conceptualization a Jeongmyeong Kim Investigation b Byeongju Song Investigation b Hyunjun Jeong Investigation b Dongmin Lee Investigation b Christopher W. Jones Writing – review & editing Supervision Conceptualization c ⁎ Yongju Yun Writing – review & editing Supervision Conceptualization a b ⁎ a Division of Interdisciplinary Bioscience and Bioengineering, Pohang University of Science and Technology (POSTECH), Pohang, Gyeongbuk 37673, Republic of Korea Division of Interdisciplinary Bioscience and Bioengineering Pohang University of Science and Technology (POSTECH) Pohang Gyeongbuk 37673 Republic of Korea Division of Interdisciplinary Bioscience and Bioengineering, Pohang University of Science and Technology (POSTECH), Pohang, Gyeongbuk 37673, Republic of Korea b Department of Chemical Engineering, Pohang University of Science and Technology (POSTECH), Pohang, Gyeongbuk 37673, Republic of Korea Department of Chemical Engineering Pohang University of Science and Technology (POSTECH) Pohang Gyeongbuk 37673 Republic of Korea Department of Chemical Engineering, Pohang University of Science and Technology (POSTECH), Pohang, Gyeongbuk 37673, Republic of Korea c School of Chemical & Biomolecular Engineering, Georgia Institute of Technology, 311, Ferst Drive, Atlanta, GA 30332, United States School of Chemical & Biomolecular Engineering Georgia Institute of Technology 311, Ferst Drive Atlanta GA 30332 United States School of Chemical & Biomolecular Engineering, Georgia Institute of Technology, 311, Ferst Drive, Atlanta, GA 30332, United States ⁎ Corresponding authors. Graphical abstract The design of highly enantioselective heterogeneous catalysts offers an efficient route for the production of enantiopure chiral molecules, which are crucial intermediates in the pharmaceutical, agrochemical, and fine chemical industries. In this study, we present a strategy to enhance the enantioselectivity of supported Pt catalysts for the hydrogenation of α-keto esters by modifying SiO2 supports with poly(ethyleneimine) (PEI), a nitrogen-rich polymer. By adjusting the heat-treatment time, the quantity of PEI-derived residues on the support was successfully controlled, thereby fine-tuning the electronic state of Pt through electron-transfer interactions, and resulting in the generation of positively charged Pt species. Catalytic evaluations showed that the Pt/PEI-SiO2 catalysts exhibited superior enantioselectivities compared to the unmodified Pt/SiO2, with an optimal performance of 96.1% enantiomeric excess (ee). In addition, the Pt/PEI-SiO2 catalysts exhibited high enantioselectivities using various α-keto esters, chiral modifiers, and H2 pressures, as well as an excellent reusability over ten consecutive cycles. The observed correlation between the higher proportion of positively charged Pt species and the increased ee suggests that the improved enantioselectivity of the Pt/PEI-SiO2 catalyst system is driven by the enhanced adsorption of chiral modifiers, which is facilitated by interactions between the anchoring moiety and the electron-deficient Pt surface. These findings highlight the essential role of interactions between the active metals and the modifying organic species bound to support materials in enhancing the enantioselectivity. Moreover, they provide valuable insights for catalyst design through electronic tuning of the active metal surface with organic-modified supports. Keywords Enantioselective hydrogenation α-keto ester Supported Pt catalyst Modified SiO2 support Poly(ethyleneimine) Data availability Data will be made available on request. 1 Introduction The development of highly selective catalysts is crucial in the field of heterogeneous catalysis, particularly for applications in the pharmaceutical, agrochemical, and fine chemical industries, where precise control over the product distribution is essential [1–4]. A promising strategy for modulating the selectivity of active metal nanoparticles (NPs) involves modifying the support materials with organic molecules [5–13]. Such organic modifications can significantly influence the interactions between the support and the active metal NPs, thereby altering the electronic and chemical states of the NPs [9,14]. Additionally, strong interactions of the functional groups of organic molecules with the NPs can improve the overall NP dispersion and stability [8,9,15]. Furthermore, the wide availability of organic molecules with varying chain lengths, steric constraints, and functional groups, further allows tailoring of the surface environment surrounding the active NPs [9–11]. Consequently, organic-modified supports provide a unique platform for optimizing catalytic performances, opening new opportunities to enhance selectivities in targeted reactions. An important consideration in the design of organic-modified supports is achieving a delicate balance between the amount of organic modifier interacting with the active metal NPs and sufficient exposure of the NP surface to promote the catalytic reaction [11,16,17]. More specifically, despite the improved selectivities achieved using such organic modifiers, excessive blockage of the NP active sites can prevent reactant molecules from accessing the catalytic sites, significantly reducing the activity of the catalyst [16,18–21]. Conversely, insufficient organic modification may fail to provide the desired electronic or stabilization effects. Thus, to achieve the desired balance and optimize both the catalyst selectivity and the activity, heat treatment of the modified supports under mild conditions has been demonstrated as an effective approach [12,16]. Although some partial decomposition and removal of the organic molecules occurs, this heat-treatment process leaves thermally stabilized organic residues on the support materials, ensuring sufficient exposure of the active sites, while retaining the beneficial electronic and structural properties imparted by the organic residues [16–21]. The enantioselective hydrogenation of α-keto esters is a delicate but essential reaction for the production of enantiopure chiral alcohols, which are crucial intermediates in various pharmaceuticals and fine chemicals (Scheme 1 ) [22,23]. To achieve high enantioselectivities using heterogeneous catalysts, such as supported Pt catalysts, it is necessary to impart chirality to the metal surface. This is typically achieved by introducing chiral modifiers, such as cinchona alkaloids [24–28]. The chiral modifiers adsorbed on the Pt surface interact with the α-keto esters, forming enantiodifferentiating surface complexes that drive the enantioselective hydrogenation process [28–31]. Thus, facilitating the adsorption of chiral modifier molecules onto the metal surface is a key strategy for improving the enantioselectivities of supported Pt catalysts. Notably, the interactions between cinchona alkaloids and Pt NPs are highly dependent on the electronic state of Pt, with electron-deficient Pt species promoting the effective adsorption of chiral modifiers via quinoline [29,32,33]. Thus, we herein report a strategy for modulating of the electronic properties of Pt NPs by modifying a SiO2 support with poly(ethyleneimine) (PEI), a nitrogen-rich polymer that readily forms layers on the support surface [34–36]. To optimize the accessibility of the bare (active) Pt surface for the adsorption of both reactants and chiral modifiers, while also harnessing the beneficial properties imparted by the organic molecules, the PEI-modified SiO2 support is thermally treated under mild conditions with variations in the heat-treatment time. The catalytic performance and reusability of the supported Pt catalysts are subsequently evaluated in the asymmetric hydrogenation of α-keto esters. In addition, the promoting effect of the PEI-modified SiO2 support is compared with that of an unmodified SiO2 support using various reactants, chiral modifiers, and H2 pressures. Furthermore, the correlation between the enantioselectivity of the supported Pt catalyst and the chemical state of the Pt NPs is investigated, revealing the role of the PEI-modified SiO2 support. These findings offer insights into enhancing catalytic performance through organic-inorganic interactions by modulating the electronic states of active metal NPs using organic-modified supports. 2 Experimental 2.1 Chemicals and materials The PEI-modified SiO2 supports were prepared using fumed SiO2 powder (specific surface area = 419 m2/g, Sigma-Aldrich) and PEI (branched, molecular weight = ∼800, Sigma-Aldrich). Platinum (II) acetylacetonate (Pt(acac)2, 98%, Acros) was used as the Pt precursor for preparing Pt/PEI-SiO2 catalysts. For the asymmetric hydrogenation of α-keto esters, the following substrates were used as reactants: methyl pyruvate (MP, >97%, TCI), ethyl pyruvate (EP, 98%, TCI), methyl benzoylformate (MBF, 99%, Acros) and ethyl 2-oxo-4-phenylbutyrate (EOPB, 97%, Sigma-Aldrich). Cinchona alkaloids such as cinchonidine (CD; 96%, Sigma-Aldrich), cinchonine (CN; 98%, Alfa Aesar), quinidine (QD; 98%, Alfa Aesar), and quinine (QN; >98%, Sigma-Aldrich) were used as chiral modifiers. Acetic acid (AcOH, 99.7%, Samchun Pure Chemical) and n-tetradecane (>99%, Alfa Aesar) were used as the solvent and internal standard, respectively. 2.2 Catalyst preparation The PEI-modified SiO2 supports were prepared as follows: 1 g of fumed SiO2 was dispersed in 6 mL of deionized water, and then, a solution containing 2 g of PEI in 2 mL of deionized water was added. After stirring at 298 K for 1 h, the solution was dried at 373 K for 12 h and the dried powder was then calcined in a furnace at 623 K for t = 1–5 h (t indicates calcination time) in air to vary the amount of PEI on the SiO2 surface. The calcined supports were designated PEI-SiO2-t. Pt/PEI-SiO2-t catalysts were synthesized by impregnating the prepared PEI-SiO2-t supports with a Pt precursor. The PEI-SiO2-t supports were suspended in an acetone solution of 1 wt.% Pt(acac)2, and the solvent was removed by evaporation at 313 K with stirring. The resultant powder was dried at 353 K for 12 h and heat-treated under Ar at 623 K for 3 h. As a reference catalyst, Pt/SiO2 was prepared using the same method but with a SiO2 support without PEI modification. 2.3 Characterization To measure the Brunauer–Emmett–Teller (BET) surface area (S BET), N2 physisorption was performed at 77 K after the pretreatment of the sample at 473 K for 12 h in vacuum. To confirm the presence of organic species on Pt/PEI-SiO2-t, Fourier transform infrared (FTIR) spectroscopy was performed using the sample pelleted with KBr. FTIR transmittance spectra were obtained from 400 to 4000 cm−1 with 128 scans at a spectral resolution of 4 cm−1 at 298 K. The Pt content of the Pt/PEI-SiO2-t catalysts was determined by inductively coupled plasma-optical emission spectroscopy (ICP-OES). X-ray diffraction (XRD) analysis was performed using Cu Kα radiation generated at 40 kV and 20 mA. A transmission electron microscopy (TEM) analysis was carried out to measure the Pt particle size (d TEM) at an acceleration voltage of 200 kV at the Korea Basic Science Institute (KBSI), Gwangju, South Korea. Derivative thermogravimetry (DTG) curves were obtained using a HITACHI STA 7300 analyzer between 373 and 1073 K under air flow. The nitrogen and carbon content in the PEI-SiO2-t supports and Pt/PEI-SiO2-t catalysts was quantified using a Vario MICRO cube instrument. CO pulse chemisorption on the Pt surface of Pt/PEI-SiO2-t catalysts was carried out at 323 K. Prior to measurement, the sample was pretreated with a stream of H2 at 473 K for 2 h. The amount of bare Pt sites on the surface of the Pt NPs available for catalysis (Ptsurface), i.e., surface Pt sites not covered by PEI residues, and Pt particle size (d CO) were quantified by measuring the moles of CO adsorbed on the exposed Pt surface sites (COads) and assuming a COads/Ptsurface adsorption stoichiometry of 1. X-ray photoelectron spectroscopy (XPS) analysis was conducted using monochromatic Al Kα radiation (1486.6 eV) at the Korea Basic Science Institute (KBSI), Busan, South Korea. The C 1s peak at 284.6 eV was used as the reference for all binding energies. 2.4 Catalytic performance tests Prior to the catalytic tests, the Pt/PEI-SiO2-t catalysts were pre-reduced at 473 K in a 5% H2/Ar flow for 2 h. The catalytic tests were carried out at 298 K in a 250 mL three-way flask at an H2 pressure of 0.1 MPa and in an autoclave with a 100 mL glass liner at an H2 pressure of 0.5–5.0 MPa. First, the pre-reduced Pt/PEI-SiO2-t catalysts (30 mg) were dispersed in AcOH (5 mL). A solution of chiral modifier (0.7 × 10–2 mmol) in AcOH (3 mL) was then injected into the reactor under stirring. After purging the reactor with H2 for 15 min at 298 K, the reaction was initiated by adding a solution of α-keto ester (0.55 mmol) and internal standard (0.1 mL) in AcOH (2 mL) under stirring. At the end of the reaction, the spent catalyst powder was separated using a syringe filter. Aliquots of the resulting solution were taken and analyzed on a gas chromatograph equipped with a flame ionization detector and chiral capillary column (Chirasil-Dex CB, CP7502, Agilent). Initial turnover frequencies (TOFs) were determined using equation (1) at a conversion level of 8–15%. (1) TOF h - 1 = N × x × V CO ads × s × W × t Here, N, x, V, COads , s, W, and t represent the number of moles of α-keto esters, measured conversion of the reactants, volume per mole at standard conditions (22414 cm3·mol−1), volume of CO adsorbed on the Pt surface (measured by chemisorption), adsorption stoichiometry of CO/Pt (= 1), weight of the catalyst sample, and reaction time, respectively. The enantiomeric excess (ee) value was calculated using equation (2). (2) e e % = R - [ S ] R + [ S ] × 100 % Here, [R] and [S] represent the concentrations of the (R)- and (S)-alcohols, respectively, which are the hydrogenation products of α-keto esters. The standard deviations of TOF and ee were determined based on three or more replicate runs. 3 Results and discussion 3.1 Characterization of the Pt/PEI-SiO2-t catalysts A series of PEI-modified SiO2 supports, PEI-SiO2-t, was prepared by controlling the heat-treatment time, t = 1–5 h, at 623 K under an air atmosphere. Gentle heat-treatment resulted in the partial decomposition and removal of PEI from the SiO2 surface, leaving organic residues. For preparation of the Pt/SiO2 and Pt/PEI-SiO2-t catalysts, 1 wt.% Pt was deposited on the unmodified SiO2 and PEI-SiO2-t supports, respectively. As outlined in Table 1 , all supported Pt catalysts contained similar Pt contents of 1.1–1.3 wt.%. Although the N2 physisorption results for the Pt/SiO2 and Pt/PEI-SiO2-t catalysts showed similar adsorption/desorption isotherms, different S BET were obtained (Table 1 and Fig. S1). More specifically, it was found that all modified Pt/PEI-SiO2-t catalysts possessed lower surface areas (S BET = 216–276 m2/g) than the unmodified Pt/SiO2 catalyst (S BET = 375 m2/g), indicating successful modification of the SiO2 support by PEI, and confirming the presence of organic residues on the SiO2 surfaces. A comparison of the S BET values between the different Pt/PEI-SiO2-t catalysts showed that a longer heat-treatment time led to a higher S BET value, due to the gradual decomposition and elimination of PEI from the SiO2 surface. The TEM images for the Pt/SiO2 and Pt/PEI-SiO2-t catalysts confirm that the Pt particles are well-dispersed on the supports, with similar average NPs sizes of 1.6–1.7 nm (Fig. 1 ). In addition, the observation of no peaks corresponding to Pt crystallites in XRD patterns of the prepared catalysts also indicates the presence of highly dispersed and non-aggregated Pt particles on both the unmodified SiO2 and PEI-SiO2-t supports (Fig. S2). These observations suggest that the PEI-derived species present on the SiO2 support has no appreciable effect on the Pt particle size. Moreover, the EDS mapping images of a representative Pt/PEI-SiO2-t catalyst showed that C and N were uniformly distributed on the SiO2 support, thereby confirming the uniform distribution of the PEI-derived species (Fig. S3). Heat treatment of pristine PEI on SiO2 in air led to the thermal decomposition of PEI starting around 473 K, suggesting the formation of thermally decomposed PEI residues during preparation of Pt/PEI-SiO2-t catalysts (Fig. S4). The contents of the PEI-derived C and N atoms in the Pt/PEI-SiO2-t catalysts were quantitatively measured using elemental analysis (Table 2 ). The presence of PEI residues was confirmed by the measurable amounts of C and N compared to the negligible amounts detected for Pt/SiO2. The as-prepared Pt/PEI-SiO2 initially contained 30.7 wt.% C and 15.1 wt.% N. Upon heat treatment and extended treatment time, the C and N contents decreased due to the decomposition and partial removal of PEI. However, Pt/PEI-SiO2-5, which had been subjected to the longest heat-treatment time, still contained 3.3 wt.% C and 1.4 wt.% N, confirming that PEI residues were retained on all Pt/PEI-SiO2-t catalysts. The presence of PEI residues was also confirmed by comparing the FTIR transmittance spectra of the unmodified Pt/SiO2 and modified Pt/PEI-SiO2-t catalysts (Fig. 2 ). All catalysts exhibited a strong absorption band at 1633 cm−1, corresponding to the hydroxyl groups on the SiO2 surface [37–40]. In the full FTIR transmittance spectra, additional peaks associated with the SiO2 surface were observed, including bands at 3100–3700 cm−1 (surface or adsorbed OH), 1633 cm−1 (Si–OH), 1105 cm−1 (Si–O–Si asymmetric stretch), and 810 and 473 cm−1 (symmetric stretch and bending modes of Si–O–Si, respectively) (Fig. S5) [39–41]. Compared to Pt/SiO2, Pt/PEI-SiO2-t showed additional peaks at 2935, 2850, and 1385 cm−1, corresponding to the CH2 bending vibrations originating from PEI (Fig. S6) [42–44]. These peaks became weaker with longer heat-treatment times owing to the partial removal of the organic residues, leaving only a faint peak at 1385 cm−1 for the Pt/PEI-SiO2-5 catalyst. These observations are consistent with the results of the C and N elemental analyses. DTG analysis of PEI-SiO2-t samples indicated that the PEI residues formed after heat treatment likely differ in nature from pristine PEI, exhibiting higher thermal stability. This is evidenced by the weight loss observed in the DTG profiles at significantly higher temperatures (673–973 K) compared to that of pristine PEI (473–573 K) (Fig. S4). Despite difficulty in specifying the exact nature of the PEI residues on Pt/PEI-SiO2-t due to the complexity of thermally decomposed products, XPS analysis was conducted on as-prepared PEI-SiO2 and heat-treated Pt/PEI-SiO2-t samples to obtain relevant information (Fig. S7). As-prepared PEI-SiO2 exhibited a peak at 398.1 eV in the N 1 s region, attributed to the N atoms of pristine PEI. In contrast, Pt/PEI-SiO2-t exhibited a noticeably broader peak at higher binding energies (∼399.0 eV) compared to as-prepared PEI-SiO2, with additional components emerging. This broad peak can be deconvoluted into three distinct nitrogen species: pyridinic N (398.2 eV), pyrrolic N (399.8 eV), and graphitic N (401.3 eV) (Table S1) [45,46]. These species are likely attributed to the thermal decomposition of pristine PEI, followed by partial cyclization and dehydrogenation of the resulting residues, predominantly forming pyridinic N and pyrrolic N, along with a moderate amount of graphitic N. The organic species present on support materials often cover the surfaces of the active NPs and inhibit the adsorption of reactant molecules. Therefore, the number of bare Pt sites on the surface of the Pt NPs for catalysis (Ptsurface), i.e., the surface Pt sites not covered by organic residues, was quantified by measuring the number of moles of CO adsorbed on the exposed Pt surface sites (COads), assuming a COads/Ptsurface adsorption stoichiometry of 1:1. Consequently, the unmodified Pt/SiO2 gave a Ptsurface/Pttotal ratio of 0.43, with d CO = 2.0 nm, wherein d CO reflects the Pt NPs size estimated by CO chemisorption (Table 1). Notably, the d CO value was similar to the Pt NPs size measured by TEM imaging (d TEM), i.e., 1.6 nm. In contrast, the Pt/PEI-SiO2-t catalysts with similar Pt contents and d TEM values to those of Pt/SiO2 exhibited significantly lower Ptsurface/Pttotal ratios of 0.08–0.21. These results suggest that CO chemisorption on the Pt surface sites of the Pt/PEI-SiO2-t catalysts was prevented by partial surface blocking by the PEI residues, resulting in an underestimation of the Ptsurface and therefore, a significant overestimation of d CO compared to d TEM. Moreover, it was found that the Ptsurface/Pttotal ratios of the Pt/PEI-SiO2-t catalysts increased with an increasing heat-treatment time because of the reduced amount of PEI, as observed by FTIR spectroscopy and elemental analysis. Interaction between the PEI residues and the Pt NPs not only affects the number of bare Pt sites available for the catalysis, but it also influences the electronic properties of the Pt NPs. To investigate this further, XPS was performed for the Pt/PEI-SiO2-t and unmodified Pt/SiO2 catalysts (Fig. 3 ). Prior to XPS analysis, all catalysts were pre-reduced with H2 under the same pretreatment conditions used prior to the performance tests. As outlined in Table 3 , the unmodified Pt/SiO2 showed a Pt 4f7/2 peak with a binding energy of 71.3 eV, while the corresponding peaks for the Pt/PEI-SiO2-t catalysts shifted by 0.4–1.0 eV to slightly higher binding energies. This indicates that the strong interactions between the organic residues and the Pt NPs reduced the electron density on the Pt surface [32,47]. As mentioned above, the XPS spectra of the Pt/PEI-SiO2-t catalysts in the N 1 s region indicated the predominant formation of PEI-derived residues with binding energies corresponding to pyrrolic and pyridinic N (Fig. S7). These observations suggest that both pyrrolic and pyridinic N species withdraw electrons from Pt, leading to a positive shift in the Pt 4f binding energy, consistent with the electron density change of Pt on N-doped carbon supports [47–49]. Specifically, Pt/PEI-SiO2-t catalysts treated for 1–3 h exhibited higher binding energies (72.1–72.3 eV), whereas those treated for 4–5 h showed reduced binding energies (71.7–71.9 eV) due to the removal of PEI residues. To further investigate the change in the chemical state of Pt due to its interaction with the PEI residues, the Pt 4f spectra were deconvoluted into metallic Pt species, i.e., Pt0, and positively charged Pt species, i.e., Pt2+ and Pt x + (2 < x < 4). As presented in Table 3, the unmodified Pt/SiO2 showed comparable amounts of Pt0 and Pt2+ species, resulting in a 0.9 ratio of positively charged Pt species to metallic Pt0 species (i.e., (Pt2++Pt x +)/Pt0). However, the strong interactions between the PEI residues and the Pt NPs in the Pt/PEI-SiO2-t catalysts resulted in the presence of not only Pt0 and Pt2+ species, but also more positively charged Pt x + (2 < x < 4) species. Consequently, the (Pt2++Pt x +)/Pt0 ratio increased to 2.8 for Pt/PEI-SiO2-3 and then gradually decreased to 1.6 for Pt/PEI-SiO2-5. This result confirms that the electronic states of the Pt NPs were tuned by the PEI content, which was in turn controlled by the heat-treatment time. 3.2 Catalytic performances of the Pt/SiO2 and Pt/PEI-SiO2-t catalysts in the enantioselective MP hydrogenation The performances of the Pt/SiO2 and Pt/PEI-SiO2-t catalysts were subsequently compared in the enantioselective MP hydrogenation at 0.1 MPa H2 (Scheme 1). CD was used as a chiral modifier to impart enantioselectivity to the Pt surface. The conversion of MP and the ee of the product were measured as a function of the reaction time, and the results are presented in Fig. 4 . All catalysts demonstrated almost linear increases in conversion during the initial phase of the reaction, reaching full conversion within 30 min. More specifically, Pt/PEI-SiO2-3 achieved 100% conversion after 15 min, whereas Pt/SiO2 achieved full conversion after 30 min, thereby confirming the improved activity of Pt/PEI-SiO2-3. The use of CD as a chiral modifier resulted in the formation of (R)-methyl lactate as the main product, and after the early determination of the reaction enantioselectivity, no further reduction in the ee was observed for the remainder of the reaction. Interestingly, upon reaching full conversion, all Pt/PEI-SiO2-t catalysts led to higher ee values than the unmodified Pt/SiO2, demonstrating the positive effect imparted by the residual PEI on the SiO2 support. The activities and enantioselectivities of the Pt/PEI-SiO2-t catalysts were further investigated without and with chiral modifiers (Table 4 ). More specifically, without CD, the Pt/PEI-SiO2-t catalysts showed similar initial conversions of ∼10% after 20 min of reaction compared to the Pt/SiO2 catalyst, despite the lower number of available bare Pt sites on their NPs surfaces. Consequently, the Pt/PEI-SiO2-t catalysts gave higher TOFs, which were determined from the number of available surface Pt sites. In the absence of CD, no enantioselectivity was observed for any of the catalysts, confirming the critical role of the chiral modifier in the generation of chiral active sites upon adsorption on the Pt surface. With the use of CD, all Pt catalysts achieved initial conversions similar to those obtained in the absence of CD after only 2 min of reaction, with a 10-fold increase in TOF. This result is consistent with previous observations of rate acceleration by chiral modifiers in this catalytic system [37,50]. The enantioselectivity gradually increased when the PEI-modified SiO2 support was incorporated, and with increases in the heat-treatment time up to 3 h, giving ee values of 78.7, 84.9, 88.5, and 90.9% for the Pt/SiO2, Pt/PEI-SiO2-1, Pt/PEI-SiO2-2, and Pt/PEI-SiO2-3 catalysts, respectively. However, upon further increasing the heat-treatment time beyond 3 h, the enantioselectivity decreased, giving ee values of 86.1 and 84.9% for the Pt/PEI-SiO2-4 and Pt/PEI-SiO2-5 catalysts, respectively. Notably, despite containing the lowest amount of residual PEI among the Pt/PEI-SiO2-t catalysts, Pt/PEI-SiO2-5 exhibited a higher enantioselectivity than unmodified Pt/SiO2. This trend confirms not only the beneficial effect of PEI residues, but also the importance of controlling their amount on the Pt catalyst surface. In the heterogeneous enantioselective hydrogenation over cinchona alkaloid-modified Pt catalysts, the adsorption of the chiral modifier onto the Pt surface is a prerequisite for the induction of enantioselectivity, as it forms an enantiodifferentiating surface complex with the substrate [51,52]. Previous studies have shown that the electron-deficient nature of Pt NPs enhances the adsorption of quinoline [29,33]. Thus, considering that the quinoline moieties of cinchona alkaloids anchor onto the Pt surfaces, this observation suggests that positively charged Pt species can contribute to improving the enantioselectivities of the Pt/PEI-SiO2-t catalysts [29,32]. Therefore, the change in the proportion of positively charged Pt species (Pt2+ and Pt x +), p (%), of the supported Pt catalysts, estimated by XPS, was compared with the change in ee values. As presented in Fig. 5 , the increased enantioselectivity observed for the Pt/PEI-SiO2-t catalysts correlated with the proportion of positively charged Pt species. These results confirm that the presence of PEI residues, which strongly interact with the Pt NPs, can facilitate the adsorption of CD on the Pt surface by generating positively charged Pt species, with Pt/PEI-SiO2-3 achieving the highest ee of 90.9%. However, in addition to this beneficial effect, excess or longer PEI residues resulting from shorter heat-treatment times can also inhibit CD adsorption by covering the Pt surface and reducing the number of bare Pt sites available for CD. Therefore, despite a similar proportion of positively charged Pt species in Pt/PEI-SiO2-2 and Pt/PEI-SiO2-3, the former showed lower enantioselectivity. A similar trend was observed between Pt/PEI-SiO2-1 and Pt/PEI-SiO2-5. These observations suggest that both the electronic state of the Pt species and the availability of bare Pt sites on the NP surface should be considered simultaneously in the design and preparation of Pt catalysts modified by organic molecules. 3.3 Versatility and reusability of the Pt/PEI-SiO2-3 catalyst for the enantioselective hydrogenation For the Pt/PEI-SiO2-3 catalyst with the highest performance in the enantioselective MP hydrogenation, its versatility was investigated using different chiral modifiers, H2 pressures, or substrates. First, in addition to CD, other cinchona alkaloids, including CN, QD, and QN were used in MP hydrogenation and the enantioselectivities of the Pt/SiO2 and Pt/PEI-SiO2-3 catalysts were compared (Table 5 ). Notably, CD (QN) and CN (QD), which exhibit diastereomeric relationships, produced the (R)- and (S)-enantiomers, respectively, as the main chiral products. Regardless of the chiral modifier, Pt/PEI-SiO2-3 achieved a higher ee than Pt/SiO2, demonstrating the enhanced enantioselectivity resulting from the modification of the SiO2 support with PEI and further confirming the versatility of the prepared Pt/PEI-SiO2-3 catalyst. In the enantioselective MP hydrogenation using CD as a chiral modifier, the ee values of the Pt/SiO2 and Pt/PEI-SiO2-3 catalysts were further compared at various H2 pressures between 0.1–5.0 MPa. As shown in Fig. 6 , the Pt/PEI-SiO2-3 catalyst exhibited a higher enantioselectivity than Pt/SiO2 at all H2 pressures, confirming its superiority even under different operating conditions. Up to a H2 pressure of 1.0 MPa, the enantioselectivities of both catalysts increased with an increasing H2 pressure, reaching a maximum of 87.0% ee for Pt/SiO2 and 96.1% ee for Pt/PEI-SiO2-3. A further increase in the H2 pressure caused the enantioselectivity of Pt/SiO2 to decrease, giving a value of 83.1% ee at 5.0 MPa. This reduction appeared to be due to hydrogenation of the quinoline moiety of the chiral modifier at high H2 pressures, leading to unstable adsorption of the chiral modifier on the Pt surface [53–55]. However, Pt/PEI-SiO2-3 retained a high enantioselectivity (i.e., 96.1% ee) at 5.0 MPa, confirming that stable modification of the Pt NPs was achieved by the PEI residues, even at elevated H2 pressures. The enhanced enantioselectivity and versatility of the Pt/PEI-SiO2-3 catalyst was further demonstrated in the hydrogenation of several substrates, including EP, MBF, and EOPB (Table 6 ). Depending on the substrate, the ee values achieved at full conversion decreased in the following order: MP > EP > EOPB > MBF. Importantly, the Pt/PEI-SiO2-3 catalyst exhibited an ∼9–14% higher ee than Pt/SiO2 regardless of the substrate, confirming the improved performance of the Pt/PEI-SiO2-3 in the enantioselective hydrogenation of all substrates. To evaluate the reusability of the Pt/PEI-SiO2-3 catalyst, ten consecutive catalytic cycles of MP hydrogenation were performed at both 0.1 MPa H2 and 1.0 MPa H2 (Fig. 7 ). After each cycle, the used catalyst was separated from the product via centrifugation and washed three times with the solvent (AcOH). Some loss of catalyst was inevitable during the repeated separation steps. Therefore, to measure the enantioselectivity at full conversion, a 3.3-fold higher catalyst loading (100 mg) was used to ensure 100% conversion in the final cycle. The subsequent cycle was performed using the recovered catalyst, fresh substrate, fresh chiral modifier, and fresh solvent under identical conditions. It is noteworthy that under full conversion conditions at 0.1 MPa H2, high enantioselectivity was maintained throughout the catalytic cycles, with an ee of 90.5% even after the last cycle, indicating a minimal loss of less than 1% compared to the first cycle (90.9% ee). To further assess the stability of the catalyst system under a different regime, we conducted a reusability test under controlled low-conversion conditions across ten consecutive reactions (Fig. S8). The results showed consistent values for both conversion and ee, confirming the catalyst’s robustness under both high- and low-conversion conditions. Furthermore, even at an elevated H2 pressure of 1.0 MPa, the highest ee of 96.1% was maintained over 10 consecutive cycles, thereby highlighting the potential of the Pt/PEI-SiO2-3 catalyst for use as a reusable and enantioselective heterogeneous catalyst. Following these reusability tests, the spent catalyst was further characterized to investigate the stabilities of the PEI residues and Pt NPs on the Pt/PEI-SiO2-3 catalyst. As observed for the fresh Pt/PEI-SiO2-3 catalyst, the presence of PEI residues on the catalyst surface was confirmed by FTIR spectroscopy, with peaks being observed at 2850, 2935, and 1385 cm−1 (Fig. 8 ). In addition, the XPS spectra of the spent catalyst revealed that positively charged Pt species remained relatively abundant even after consecutive reactions, indicating that the electron-deficient state of the Pt surface was retained under reaction conditions (Fig. S9). These results, together with the high enantioselectivity maintained throughout successive reaction cycles, demonstrate the high stability of the PEI residues. The Pt NPs in the spent Pt/PEI-SiO2-3 catalyst remained stable, with only minimal Pt leaching observed during cycling (Table S2). Moreover, the TEM image of the spent catalyst shows the presence of well-dispersed Pt NPs with an average size of 1.7 nm, which is consistent with that of the fresh catalyst (Fig. 9 ). The observation of no peaks corresponding to Pt crystallites also confirmed that there was no aggregation of Pt NPs (Fig. S10). Furthermore, the EDS mapping images of the spent Pt/PEI-SiO2-3 catalyst that Pt, C and N remain homogeneously dispersed (Fig. S11), emphasizing the excellent catalyst stability, and demonstrating the potential of this support modification strategy for designing highly enantioselective and stable heterogeneous catalysts. 4 Conclusions In this study, SiO2 supports were modified with the N-rich polymer PEI to design highly enantioselective Pt catalysts for the hydrogenation of α-keto esters. To investigate the role of PEI and its beneficial effects on the enantioselectivity, the heat-treatment time was varied to control the amount of the PEI on the SiO2 support. The PEI-derived organic residues generated after heat-treatment strongly interacted with the Pt NPs in the Pt/PEI-SiO2 catalysts, partially covering the active Pt surface sites and modulating the electronic states of the NPs. More specifically, electron transfer from the Pt surface to the PEI residues resulted in the formation of more positively charged Pt species. Notably, all Pt/PEI-SiO2 catalysts demonstrated superior enantioselectivities compared to the unmodified Pt/SiO2 catalyst in the enantioselective MP hydrogenation at a H2 pressure of 0.1 MPa, thereby demonstrating the promoting effect of the PEI residues. Furthermore, the optimized Pt/PEI-SiO2 catalyst consistently outperformed the Pt/SiO2 catalyst over a wide range of reactants, chiral modifiers, and H2 pressures, achieving the highest enantioselectivity of 96.1%. Moreover, the enhanced enantioselectivity was maintained over ten consecutive cycles, even at a higher H2 pressure of 1.0 MPa, confirming the stability of the modified catalyst. Notably, the positive correlation between the proportion of positively charged Pt species and the enantioselectivity suggests that the excellent enantioselectivities obtained with the Pt/PEI-SiO2 catalysts are due to the enhanced adsorption of chiral modifiers via the quinoline moiety on the electron-deficient Pt surface. This work provides insight into organic-inorganic interactions in heterogeneous catalysts using support materials modified with organic molecules, and into the strategy for improving enantioselectivity by fine-tuning the electronic states of the active NPs. CRediT authorship contribution statement Minji Yun: Writing – original draft, Investigation, Conceptualization. Jeongmyeong Kim: Investigation. Byeongju Song: Investigation. Hyunjun Jeong: Investigation. Dongmin Lee: Investigation. Christopher W. Jones: Writing – review & editing, Supervision, Conceptualization. Yongju Yun: Writing – review & editing, Supervision, Conceptualization. Declaration of competing interest The authors declare that they have no known competing financial interests or personal relationships that could have appeared to influence the work reported in this paper. Acknowledgments This work was supported by a National Research Foundation of Korea (NRF) grant funded by the Korean government (MSIT) (No. 2022R1A2C4001411, RS-2025-00553789 and 2021R1A5A1084921). Appendix A Supplementary data Supplementary data to this article can be found online at https://doi.org/10.1016/j.jcat.2025.116232. XPS spectra of N 1 s for the as-prepared PEI-SiO2 and Pt/PEI-SiO2-t catalysts, and Pt 4f for the fresh and spent Pt/PEI-SiO2-3 catalysts, Pt content by ICP-OES, N2 isotherms of the Pt/SiO2 and Pt/PEI-SiO2-t catalysts, XRD patterns of the unmodified Pt/SiO2, Pt/PEI-SiO2-t and spent Pt/PEI-SiO2-3 catalysts, TEM images of the fresh and spent Pt/PEI-SiO2-3 catalysts and the corresponding EDS elemental mapping images for Si, O, C, N, and Pt, DTG curves of as-prepared PEI-SiO2 and Pt/PEI-SiO2-t catalysts, FTIR transmittance spectra of the Pt/SiO2, Pt/PEI-SiO2-t catalysts and PEI, Reusability test of the Pt/PEI-SiO2-3 under low conversion conditions. Appendix A Supplementary data The following are the Supplementary data to this article: Supplementary Data 1 References [1] F. Meemken A. Baiker Recent progress in heterogeneous asymmetric hydrogenation of C═O and C═C bonds on supported noble metal catalysts Chem. Rev., 117 2017 11522 11569 10.1021/acs.chemrev.7b00272 F. Meemken, A. Baiker, Recent progress in heterogeneous asymmetric hydrogenation of C═O and C═C bonds on supported noble metal catalysts, Chem. Rev., 117 (2017) 11522–11569. DOI: 10.1021/acs.chemrev.7b00272. [2] A. Baiker Crucial aspects in the design of chirally modified noble metal catalysts for asymmetric hydrogenation of activated ketones Chem. Soc. Rev., 44 2015 7449 7464 10.1039/C4CS00462K A. Baiker, Crucial aspects in the design of chirally modified noble metal catalysts for asymmetric hydrogenation of activated ketones, Chem. Soc. Rev., 44 (2015) 7449–7464. DOI: 10.1039/C4CS00462K. [3] T. Mallat E. Orglmeister A. Baiker Asymmetric catalysis at chiral metal surfaces Chem. Rev., 107 2007 4863 4890 10.1021/cr0683663 T. Mallat, E. Orglmeister, A. Baiker, Asymmetric catalysis at chiral metal surfaces, Chem. Rev., 107 (2007) 4863–4890. DOI: 10.1021/cr0683663. [4] G.A. Attard Electrochemical studies of enantioselectivity at chiral metal surfaces J. Phys. Chem. B 105 2001 3158 3167 10.1021/jp0041508 G.A. Attard, Electrochemical studies of enantioselectivity at chiral metal surfaces, J. Phys. Chem. B, 105 (2001), 3158–3167. DOI: 10.1021/jp0041508. [5] C.A. Schoenbaum D.K. Schwartz J.W. Medlin Controlling the surface environment of heterogeneous catalysts using self-assembled monolayers Acc. Chem. Res., 47 2014 1438 1445 10.1021/ar500029y C.A. Schoenbaum, D.K. Schwartz, J.W. Medlin, Controlling the surface environment of heterogeneous catalysts using self-assembled monolayers, Acc. Chem. Res., 47 (2014) 1438–1445. DOI: 10.1021/ar500029y. [6] T. Mallat A. Baiker Selectivity enhancement in heterogeneous catalysis induced by reaction modifiers Appl. Catal., A 200 2000 3 22 10.1016/S0926-860X(00)00645-1 T. Mallat, A. Baiker, Selectivity enhancement in heterogeneous catalysis induced by reaction modifiers, Appl. Catal., A, 200 (2000) 3–22. DOI: 10.1016/S0926-860X(00)00645-1. [7] D. Han X. Li H. Zhang Z. Liu J. Li C. Li Heterogeneous asymmetric hydroformylation of olefins on chirally modified Rh/SiO2 catalysts J. Catal., 243 2006 318 328 10.1016/j.jcat.2006.08.003 D. Han, X. Li, H. Zhang, Z. Liu, J. Li, C. Li, Heterogeneous asymmetric hydroformylation of olefins on chirally modified Rh/SiO2 catalysts, J. Catal., 243 (2006) 318–328. DOI: 10.1016/j.jcat.2006.08.003. [8] P. Chen L.M. Chew W. Xia The influence of the residual growth catalyst in functionalized carbon nanotubes on supported Pt nanoparticles applied in selective olefin hydrogenation J. Catal., 307 2013 84 93 10.1016/j.jcat.2013.06.030 P. Chen, L.M. Chew, W. Xia, The influence of the residual growth catalyst in functionalized carbon nanotubes on supported Pt nanoparticles applied in selective olefin hydrogenation, J. Catal., 307 (2013) 84–93. DOI: 10.1016/j.jcat.2013.06.030. [9] K. Koh M. Jeon C.W. Yoon T. Asefa Formic acid dehydrogenation over Pd NPs supported on amine-functionalized SBA-15 catalysts: structure-activity relationships J. Mater. Chem. A 5 2017 16150 16161 10.1039/C7TA02040F K. Koh, M. Jeon, C.W. Yoon, T. Asefa, Formic acid dehydrogenation over Pd NPs supported on amine-functionalized SBA-15 catalysts: Structure-activity relationships, J. Mater. Chem. A, 5 (2017) 16150–16161. DOI: 10.1039/C7TA02040F. [10] P.D. Coan L.D. Ellis M.B. Griffin D.K. Schwartz J.W. Medlin Enhancing cooperativity in bifunctional acid-Pd catalysts with carboxylic acid-functionalized organic monolayers J. Phys. Chem. C 122 2018 6637 6647 10.1021/acs.jpcc.7b12442 P.D. Coan, L.D. Ellis, M.B. Griffin, D.K. Schwartz, J.W. Medlin, Enhancing cooperativity in bifunctional acid-Pd catalysts with carboxylic acid-functionalized organic monolayers, J. Phys. Chem. C, 122 (2018) 6637–6647. DOI: 10.1021/acs.jpcc.7b12442. [11] A.H. Jenkins J.W. Medlin Controlling heterogeneous catalysis with organic monolayers on metal oxides Acc. Chem. Res., 54 2021 4080 4090 10.1021/acs.accounts.1c00469 A.H. Jenkins, J.W. Medlin, Controlling heterogeneous catalysis with organic monolayers on metal oxides, Acc. Chem. Res., 54 (2021) 4080–4090. DOI: 10.1021/acs.accounts.1c00469. [12] L.D. Ellis R.M. Trottier C.B. Musgrave D.K. Schwartz J.W. Medlin Controlling the surface reactivity of titania via electronic tuning of self-assembled monolayers ACS Catal., 7 2017 8351 8357 10.1021/acscatal.7b02789 L.D. Ellis, R.M. Trottier, C.B. Musgrave, D.K. Schwartz, J.W. Medlin, Controlling the surface reactivity of titania via electronic tuning of self-assembled monolayers, ACS Catal., 7 (2017) 8351–8357. DOI: 10.1021/acscatal.7b02789. [13] J. Zhang L.D. Ellis B. Wang M.J. Dzara C. Sievers S. Pylypenko E. Nikolla J.W. Medlin Control of interfacial acid-metal catalysis with organic monolayers Nat. Catal., 1 2018 148 155 10.1038/s41929-017-0019-8 J. Zhang, L.D. Ellis, B. Wang, M.J. Dzara, C. Sievers, S. Pylypenko, E. Nikolla, J.W. Medlin, Control of interfacial acid-metal catalysis with organic monolayers, Nat. Catal., 1 (2018) 148–155. DOI: 10.1038/s41929-017-0019-8. [14] Y. Gong J. Lin C. Yu R. Li C. Tang Y. Huang Pd nanoparticles anchored on amine-functionalized boron nitride co-doped with carbon and oxygen as catalysts for formic acid dehydrogenation ACS Appl. Nano Mater., 7 2024 16245 16255 10.1021/acsanm.4c02173 Y. Gong, J. Lin, C. Yu, R. Li, C. Tang, Y. Huang, Pd nanoparticles anchored on amine-functionalized boron nitride co-doped with carbon and oxygen as catalysts for formic acid dehydrogenation, ACS Appl. Nano Mater., 7 (2024) 16245–16255. DOI: 10.1021/acsanm.4c02173. [15] A.B. Redondo M. Ranocchiari J.A. van Bokhoven Synthesis of sub-nanometer gold particles on modified silica Dalton Trans., 45 2016 2983 2988 10.1039/C5DT04957A A.B. Redondo, M. Ranocchiari, J.A. van Bokhoven, Synthesis of sub-nanometer gold particles on modified silica, Dalton Trans., 45 (2016) 2983–2988. DOI: 10.1039/C5DT04957A. [16] F.P. Da Silva J.L. Fiorio L.M. Rossi Tuning the catalytic activity and selectivity of Pd nanoparticles using ligand-modified supports and surfaces ACS Omega 2 2017 6014 6022 10.1021/acsomega.7b00836 F.P. Da Silva, J.L. Fiorio, L.M. Rossi, Tuning the catalytic activity and selectivity of Pd nanoparticles using ligand-modified supports and surfaces, ACS omega, 2 (2017) 6014–6022. DOI: 10.1021/acsomega.7b00836. [17] S.T. Marshall M. O’Brien B. Oetter A. Corpuz R.M. Richards D.K. Schwartz J.W. Medlin Controlled selectivity for palladium catalysts using self-assembled monolayers Nat. Mater., 9 2010 853 858 10.1038/nmat2849 S.T. Marshall, M. O’Brien, B. Oetter, A. Corpuz, R.M. Richards, D.K. Schwartz, J.W. Medlin, Controlled selectivity for palladium catalysts using self-assembled monolayers, Nat. Mater., 9 (2010) 853–858. DOI: 10.1038/nmat2849. [18] M. Cargnello C. Chen B.T. Diroll V.V. Doan-Nguyen R.J. Gorte C.B. Murray Efficient removal of organic ligands from supported nanocrystals by fast thermal annealing enables catalytic studies on well-defined active phases J. Am. Chem. Soc., 137 2015 6906 6911 10.1021/jacs.5b03333 M. Cargnello, C. Chen, B.T. Diroll, V.V. Doan-Nguyen, R.J. Gorte, C.B. Murray, Efficient removal of organic ligands from supported nanocrystals by fast thermal annealing enables catalytic studies on well-defined active phases, J. Am. Chem. Soc., 137 (2015) 6906–6911. DOI: 10.1021/jacs.5b03333. [19] L. Lu S. Zou B. Fang The critical impacts of ligands on heterogeneous nanocatalysis: a review ACS Catal., 11 2021 6020 6058 10.1021/acscatal.1c00903 L. Lu, S. Zou, B. Fang, The critical impacts of ligands on heterogeneous nanocatalysis: A review, ACS Catal., 11 (2021) 6020–6058. DOI: 10.1021/acscatal.1c00903. [20] W. Wu E.V. Shevchenko The surface science of nanoparticles for catalysis: electronic and steric effects of organic ligands J. Nanopart. Res., 20 2018 255 10.1007/s11051-018-4319-y W. Wu, E.V. Shevchenko, The surface science of nanoparticles for catalysis: Electronic and steric effects of organic ligands, J. Nanopart. Res., 20 (2018) 255. DOI: 10.1007/s11051-018-4319-y. [21] C.A. Schoenbaum D.K. Schwartz J.W. Medlin Controlling surface crowding on a Pd catalyst with thiolate self-assembled monolayers J. Catal., 303 2013 92 99 10.1016/j.jcat.2013.03.012 C.A. Schoenbaum, D.K. Schwartz, J.W. Medlin, Controlling surface crowding on a Pd catalyst with thiolate self-assembled monolayers, J. Catal., 303 (2013) 92–99. DOI: 10.1016/j.jcat.2013.03.012. [22] B. Kasprzyk-Hordern Pharmacologically active compounds in the environment and their chirality Chem. Soc. Rev., 39 2010 4466 4503 10.1039/C000408C B. Kasprzyk-Hordern, Pharmacologically active compounds in the environment and their chirality, Chem. Soc. Rev., 39 (2010) 4466–4503. DOI: 10.1039/C000408C. [23] V. Farina J.T. Reeves C.H. Senanayake J.J. Song Asymmetric synthesis of active pharmaceutical ingredients Chem. Rev., 106 2006 2734 2793 10.1021/cr040700c V. Farina, J.T. Reeves, C.H. Senanayake, J.J. Song, Asymmetric synthesis of active pharmaceutical ingredients, Chem. Rev., 106 (2006) 2734–2793. DOI: 10.1021/cr040700c. [24] F. Meemken K. Hungerbühler A. Baiker Monitoring surface processes during heterogeneous asymmetric hydrogenation of ketones on a chirally modified platinum catalyst by operando spectroscopy Angew. Chem., 126 2014 8784 8788 10.1002/ange.201402981 F. Meemken, K. Hungerbühler, A. Baiker, Monitoring surface processes during heterogeneous asymmetric hydrogenation of ketones on a chirally modified platinum catalyst by operando spectroscopy, Angew. Chem., 126 (2014) 8784–8788. DOI: 10.1002/ange.201402981. [25] H.-U. Blaser H.-P. Jalett M. Müller M. Studer Enantioselective hydrogenation of α-ketoesters using cinchona modified platinum catalysts and related systems: a review Catal. Today 37 1997 441 463 10.1016/S0920-5861(97)00026-6 H.-U. Blaser, H.-P. Jalett, M. Müller, M. Studer, Enantioselective hydrogenation of α-ketoesters using cinchona modified platinum catalysts and related systems: A review, Catal. today, 37 (1997) 441–463. DOI: 10.1016/S0920-5861(97)00026-6. [26] P. McMorn G.J. Hutchings Heterogeneous enantioselective catalysts: strategies for the immobilisation of homogeneous catalysts Chem. Soc. Rev., 33 2004 108 122 10.1039/B200387M P. McMorn, G.J. Hutchings, Heterogeneous enantioselective catalysts: Strategies for the immobilisation of homogeneous catalysts, Chem. Soc. Rev., 33 (2004) 108–122. DOI: 10.1039/B200387M. [27] A. Baiker Reflections on chiral metal surfaces and their potential for catalysis Catal. Today 100 2005 159 170 10.1016/j.cattod.2004.12.001 A. Baiker, Reflections on chiral metal surfaces and their potential for catalysis, Catal. today, 100 (2005) 159–170. DOI: 10.1016/j.cattod.2004.12.001. [28] F. Meemken L. Rodríguez-García Revealing catalytically relevant surface species by kinetic isotope effect spectroscopy: H-bonding to ester carbonyl of trans-ethyl pyruvate controls enantioselectivity on a cinchona-modified Pt catalyst J. Phys. Chem. Lett., 9 2018 996 1001 10.1021/acs.jpclett.7b03360 F. Meemken, L. Rodríguez-García, Revealing catalytically relevant surface species by kinetic isotope effect spectroscopy: H-bonding to ester carbonyl of trans-ethyl pyruvate controls enantioselectivity on a cinchona-modified Pt catalyst, J. Phys. Chem. Lett., 9 (2018) 996–1001. DOI: 10.1021/acs.jpclett.7b03360. [29] E. Zhan C. Chen Y. Li W. Shen Heterogeneous asymmetric hydrogenation over chiral molecule-modified metal particles Catal. Sci. Technol., 5 2015 650 659 10.1039/C4CY00900B E. Zhan, C. Chen, Y. Li, W. Shen, Heterogeneous asymmetric hydrogenation over chiral molecule-modified metal particles, Catal. Sci. Technol., 5 (2015) 650–659. DOI: 10.1039/C4CY00900B. [30] G. Kyriakou S.K. Beaumont R.M. Lambert Aspects of heterogeneous enantioselective catalysis by metals Langmuir 27 2011 9687 9695 10.1021/la200009w G. Kyriakou, S.K. Beaumont, R.M. Lambert, Aspects of heterogeneous enantioselective catalysis by metals, Langmuir, 27 (2011) 9687–9695. DOI: 10.1021/la200009w. [31] H. Blaser H. Jalett W. Lottenbach M. Studer Heterogeneous enantioselective hydrogenation of ethyl pyruvate catalyzed by cinchona-modified Pt catalysts: effect of modifier structure J. Am. Chem. Soc., 122 2000 12675 12682 10.1021/ja003259q H. Blaser, H. Jalett, W. Lottenbach, M. Studer, Heterogeneous enantioselective hydrogenation of ethyl pyruvate catalyzed by cinchona-modified Pt catalysts: Effect of modifier structure, J. Am. Chem. Soc., 122 (2000) 12675–12682. DOI: 10.1021/ja003259q. [32] J. Kim B. Song I. Chung J. Park Y. Yun High-performance Pt catalysts supported on amine-functionalized silica for enantioselective hydrogenation of α-keto ester J. Catal., 396 2021 81 91 10.1016/j.jcat.2021.02.001 J. Kim, B. Song, I. Chung, J. Park, Y. Yun, High-performance Pt catalysts supported on amine-functionalized silica for enantioselective hydrogenation of α-keto ester, J. Catal., 396 (2021) 81–91. DOI: 10.1016/j.jcat.2021.02.001. [33] L. Bai X. Wang Q. Chen Y. Ye H. Zheng J. Guo Y. Yin C. Gao Explaining the size dependence in platinum‐nanoparticle‐catalyzed hydrogenation reactions Angew. Chem. Int. Ed., 55 2016 15656 15661 10.1002/anie.201609663 L. Bai, X. Wang, Q. Chen, Y. Ye, H. Zheng, J. Guo, Y. Yin, C. Gao, Explaining the size dependence in platinum‐nanoparticle‐catalyzed hydrogenation reactions, Angew. Chem. Int. Ed., 55 (2016) 15656–15661. DOI: 10.1002/anie.201609663. [34] S. El Meragawi A. Akbari S. Hernandez M.S. Mirshekarloo D. Bhattacharyya A. Tanksale M. Majumder Enhanced permselective separation of per-fluorooctanoic acid in graphene oxide membranes by a simple PEI modification J. Mater. Chem. A 8 2020 24800 24811 10.1039/D0TA06523D S. El Meragawi, A. Akbari, S. Hernandez, M.S. Mirshekarloo, D. Bhattacharyya, A. Tanksale, M. Majumder, Enhanced permselective separation of per-fluorooctanoic acid in graphene oxide membranes by a simple PEI modification, J. Mater. Chem. A, 8 (2020) 24800–24811. DOI: 10.1039/D0TA06523D. [35] S. Deng Y.-P. Ting Characterization of PEI-modified biomass and biosorption of Cu (II), Pb (II) and Ni (II) Water Res. 39 2005 2167 2177 10.1016/j.watres.2005.03.033 S. Deng, Y.-P. Ting, Characterization of PEI-modified biomass and biosorption of Cu (II), Pb (II) and Ni (II), Water research, 39 (2005) 2167–2177. DOI: 10.1016/j.watres.2005.03.033. [36] J. Li S. Yuan J. Zhu B. Van der Bruggen High-flux, antibacterial composite membranes via polydopamine-assisted PEI-TiO2/Ag modification for dye removal Chem. Eng. J., 373 2019 275 284 10.1016/j.cej.2019.05.048 J. Li, S. Yuan, J. Zhu, B. Van der Bruggen, High-flux, antibacterial composite membranes via polydopamine-assisted PEI-TiO2/Ag modification for dye removal, Chem. Eng. J., 373 (2019) 275–284. DOI: 10.1016/j.cej.2019.05.048. [37] J. Kim M. Yun B. Song W.B. Kim Y. Yun Pt/B-SiO2 as a facile and efficient heterogeneous catalyst for enantioselective hydrogenation: effect of support modification with boron ACS Catal., 13 2023 6144 6153 10.1021/acscatal.3c00998 J. Kim, M. Yun, B. Song, W.B. Kim, Y. Yun, Pt/B-SiO2 as a facile and efficient heterogeneous catalyst for enantioselective hydrogenation: Effect of support modification with boron, ACS Catal., 13 (2023) 6144–6153. DOI: 10.1021/acscatal.3c00998. [38] I. Batool N. Shahzad R. Shahzad A.N. Satti R. Liaquat A. Waqas M.I. Shahzad Self-cleaning study of SiO2 modified TiO2 nanofibrous thin films prepared via electrospinning for application in solar cells Sol. Energy 268 2024 112271 10.1016/j.solener.2023.112271 I. Batool, N. Shahzad, R. Shahzad, A.N. Satti, R. Liaquat, A. Waqas, M.I. Shahzad, Self-cleaning study of SiO2 modified TiO2 nanofibrous thin films prepared via electrospinning for application in solar cells, Sol. Energy, 268 (2024) 112271. DOI: 10.1016/j.solener.2023.112271. [39] Q. Zhang J. Wang G. Wu J. Shen S. Buddhudu Interference coating by hydrophobic aerogel-like SiO2 thin films Mater. Chem. Phys., 72 2001 56 59 10.1016/S0254-0584(01)00322-4 Q. Zhang, J. Wang, G. Wu, J. Shen, S. Buddhudu, Interference coating by hydrophobic aerogel-like SiO2 thin films, Mater. Chem. Phys., 72 (2001) 56–59. DOI: 10.1016/S0254-0584(01)00322-4. [40] A. Sakthisabarimoorthi S.M.B. Dhas M. Jose Electrical impedance spectroscopic investigations of monodispersed SiO2 nanospheres Superlattices Microstruct., 113 2018 271 282 10.1016/j.spmi.2017.11.001 A. Sakthisabarimoorthi, S.M.B. Dhas, M. Jose, Electrical impedance spectroscopic investigations of monodispersed SiO2 nanospheres, Superlattices Microstruct., 113 (2018) 271–282. DOI: 10.1016/j.spmi.2017.11.001. [41] R. Al-Oweini H. El-Rassy Synthesis and characterization by FTIR spectroscopy of silica aerogels prepared using several Si(OR)4 and R''Si(OR')3 precursors J. Mol. Struct., 919 2009 140 145 10.1016/j.molstruc.2008.08.025 R. Al-Oweini, H. El-Rassy, Synthesis and characterization by FTIR spectroscopy of silica aerogels prepared using several Si(OR)4 and R''Si(OR')3 precursors, J. Mol. Struct., 919 (2009), 140–145. DOI: 10.1016/j.molstruc.2008.08.025. [42] W. Long N.A. Brunelli S.A. Didas E.W. Ping C.W. Jones Aminopolymer-silica composite-supported Pd catalysts for selective hydrogenation of alkynes ACS Catal., 3 2013 1700 1708 10.1021/cs3007395 W. Long, N.A. Brunelli, S.A. Didas, E.W. Ping, C.W. Jones, Aminopolymer-silica composite-supported Pd catalysts for selective hydrogenation of alkynes, ACS Catal., 3 (2013) 1700–1708. DOI: 10.1021/cs3007395. [43] A. Kasprzak M. Poplawska H. Krawczyk S. Molchanov M. Kozlowski M. Bystrzejewski Novel non-covalent stable supramolecular ternary system comprising of cyclodextrin and branched polyethylenimine J. Inclusion Phenom. Macrocyclic Chem., 87 2017 53 65 10.1007/s10847-016-0677-1 A. Kasprzak, M. Poplawska, H. Krawczyk, S. Molchanov, M. Kozlowski, M. Bystrzejewski, Novel non-covalent stable supramolecular ternary system comprising of cyclodextrin and branched polyethylenimine, J. Inclusion Phenom. Macrocyclic Chem., 87 (2017) 53–65. DOI: 10.1007/s10847-016-0677-1. [44] A. Koutsianos A.R. Barron E. Andreoli CO2 capture partner molecules in highly loaded PEI sorbents J. Phys. Chem. C 121 2017 21772 21781 10.1021/acs.jpcc.7b07541 A. Koutsianos, A.R. Barron, E. Andreoli, CO2 capture partner molecules in highly loaded PEI sorbents, J. Phys. Chem. C, 121 (2017) 21772–21781. DOI: 10.1021/acs.jpcc.7b07541. [45] Y. Xu Y. Mo J. Tian P. Wang H. Yu J. Yu The synergistic effect of graphitic N and pyrrolic N for the enhanced photocatalytic performance of nitrogen-doped graphene/TiO2 nanocomposites Appl. Catal., B 181 2016 810 817 10.1016/j.apcatb.2015.08.049 Y. Xu, Y. Mo, J. Tian, P. Wang, H. Yu, J. Yu, The synergistic effect of graphitic N and pyrrolic N for the enhanced photocatalytic performance of nitrogen-doped graphene/TiO2 nanocomposites, Appl. Catal., B, 181 (2016) 810–817. DOI: 10.1016/j.apcatb.2015.08.049. [46] W. Liang Z. Luo D. Zhou Z. Liu X. Wei W. Cai Granular nitrogen-doped carbons with ultra-high C2H2/CO2 adsorption selectivity for C2H2 purification Chem. Eng. J., 461 2023 141980 10.1016/j.cej.2023.141980 W. Liang, Z. Luo, D. Zhou, Z. Liu, X. Wei, W. Cai, Granular nitrogen-doped carbons with ultra-high C2H2/CO2 adsorption selectivity for C2H2 purification, Chem. Eng. J., 461 (2023) 141980. DOI: 10.1016/j.cej.2023.141980. [47] H. Zhang H. Li X. Zhang S. Yu S. Wang G. Sun Enhanced metal-support interaction of nitrogen-doped carbon supported Pt nanoparticles with high activity for electrocatalytic oxygen reduction reaction Carbon Neutrality 4 2025 10 10.1007/s43979-025-00122-1 H. Zhang, H. Li, X. Zhang, S. Yu, S. Wang, G. Sun, Enhanced metal-support interaction of nitrogen-doped carbon supported Pt nanoparticles with high activity for electrocatalytic oxygen reduction reaction, Carbon Neutrality, 4 (2025) 10. DOI: 10.1007/s43979-025-00122-1. [48] L. Jia D.A. Bulushev O.Y. Podyacheva A.I. Boronin L.S. Kibis E.Y. Gerasimov S. Beloshapkin I.A. Seryak Z.R. Ismagilov J.R. Ross Pt nanoclusters stabilized by N-doped carbon nanofibers for hydrogen production from formic acid J. Catal., 307 2013 94 102 10.1016/j.jcat.2013.07.008 L. Jia, D. A. Bulushev, O. Y. Podyacheva, A. I. Boronin, L. S. Kibis, E. Y. Gerasimov, S. Beloshapkin, I. A. Seryak, Z. R. Ismagilov, J. R. Ross, Pt nanoclusters stabilized by N-doped carbon nanofibers for hydrogen production from formic acid. J. Catal., 307 (2013) 94–102. DOI: 10.1016/j.jcat.2013.07.008. [49] O.Y. Podyacheva Z. Ismagilov A. Boronin L. Kibis E. Slavinskaya A. Noskov N. Shikina V. Ushakov A. Ischenko Platinum nanoparticles supported on nitrogen-containing carbon nanofibers Catal. Today 186 2012 42 47 10.1016/j.cattod.2011.08.031 O.Y. Podyacheva, Z. Ismagilov, A. Boronin, L. Kibis, E. Slavinskaya, A. Noskov, N. Shikina, V. Ushakov, A. Ischenko, Platinum nanoparticles supported on nitrogen-containing carbon nanofibers, Catal. Today, 186 (2012) 42–47. DOI: 10.1016/j.cattod.2011.08.031. [50] B. Song D. Lee H. Jeong M. Yun Y. Yun Designing highly enantioselective heterogeneous Pt catalysts: selective exposure of active sites via surface modification using amines ACS Catal., 14 2024 2620 2630 10.1021/acscatal.4c00040 B. Song, D. Lee, H. Jeong, M. Yun, Y. Yun, Designing highly enantioselective heterogeneous Pt catalysts: Selective exposure of active sites via surface modification using amines, ACS Catal., 14 (2024) 2620–2630. DOI: 10.1021/acscatal.4c00040. [51] D. Ferri T. Bürgi A. Baiker Chiral modification of platinum catalysts by cinchonidine adsorption studied by in situ ATR-IR spectroscopy Chem. Commun., 13 2001 1172 1173 10.1039/B102884G D. Ferri, T. Bürgi, A. Baiker, Chiral modification of platinum catalysts by cinchonidine adsorption studied by in situ ATR-IR spectroscopy, Chem. Commun., 13 (2001) 1172–1173. DOI: 10.1039/B102884G. [52] D. Ferri T. Bürgi An in situ attenuated total reflection infrared study of a chiral catalytic solid-liquid interface: cinchonidine adsorption on Pt J. Am. Chem. Soc., 123 2001 12074 12084 10.1021/ja011769u D. Ferri, T. Bürgi, An in situ attenuated total reflection infrared study of a chiral catalytic solid-liquid interface: Cinchonidine adsorption on Pt, J. Am. Chem. Soc., 123 (2001) 12074–12084. DOI: 10.1021/ja011769u. [53] E. Schmidt D. Ferri A. Baiker Surface processes occurring on Rh/alumina during chiral modification by cinchonidine: an ATR-IR spectroscopy study Langmuir 23 2007 8087 8093 10.1021/la700835j E. Schmidt, D. Ferri, A. Baiker, Surface processes occurring on Rh/alumina during chiral modification by cinchonidine: An ATR-IR spectroscopy study, Langmuir, 23 (2007) 8087–8093. DOI: 10.1021/la700835j. [54] V. Colliere M. Verelst P. Lecante M.R. Axet Colloidal ruthenium catalysts for selective quinaldine hydrogenation: ligand and solvent effects Chem. Eur. J., 30 2024 e202302131 10.1002/chem.202302131 V. Colliere, M. Verelst, P. Lecante, M.R. Axet, Colloidal ruthenium catalysts for selective quinaldine hydrogenation: Ligand and solvent effects, Chem. Eur. J., 30 (2024) e202302131. DOI: 10.1002/chem.202302131. [55] M. Von Arx T. Mallat A. Baiker Asymmetric hydrogenation of activated ketones on platinum: relevant and spectator species Top. Catal., 19 2002 75 87 10.1023/A:1013885300523 M. Von Arx, T. Mallat, A. Baiker, Asymmetric hydrogenation of activated ketones on platinum: Relevant and spectator species, Top. Catal., 19 (2002) 75–87. DOI: 10.1023/A:1013885300523.",
      "scopus-id": "105005956576",
      "coredata": {
        "eid": "1-s2.0-S0021951725002970",
        "dc:description": "The design of highly enantioselective heterogeneous catalysts offers an efficient route for the production of enantiopure chiral molecules, which are crucial intermediates in the pharmaceutical, agrochemical, and fine chemical industries. In this study, we present a strategy to enhance the enantioselectivity of supported Pt catalysts for the hydrogenation of α-keto esters by modifying SiO2 supports with poly(ethyleneimine) (PEI), a nitrogen-rich polymer. By adjusting the heat-treatment time, the quantity of PEI-derived residues on the support was successfully controlled, thereby fine-tuning the electronic state of Pt through electron-transfer interactions, and resulting in the generation of positively charged Pt species. Catalytic evaluations showed that the Pt/PEI-SiO2 catalysts exhibited superior enantioselectivities compared to the unmodified Pt/SiO2, with an optimal performance of 96.1% enantiomeric excess (ee). In addition, the Pt/PEI-SiO2 catalysts exhibited high enantioselectivities using various α-keto esters, chiral modifiers, and H2 pressures, as well as an excellent reusability over ten consecutive cycles. The observed correlation between the higher proportion of positively charged Pt species and the increased ee suggests that the improved enantioselectivity of the Pt/PEI-SiO2 catalyst system is driven by the enhanced adsorption of chiral modifiers, which is facilitated by interactions between the anchoring moiety and the electron-deficient Pt surface. These findings highlight the essential role of interactions between the active metals and the modifying organic species bound to support materials in enhancing the enantioselectivity. Moreover, they provide valuable insights for catalyst design through electronic tuning of the active metal surface with organic-modified supports.",
        "openArchiveArticle": "false",
        "prism:coverDate": "2025-09-30",
        "openaccessUserLicense": null,
        "prism:aggregationType": "Journal",
        "prism:url": "https://api.elsevier.com/content/article/pii/S0021951725002970",
        "dc:creator": [
          {
            "@_fa": "true",
            "$": "Yun, Minji"
          },
          {
            "@_fa": "true",
            "$": "Kim, Jeongmyeong"
          },
          {
            "@_fa": "true",
            "$": "Song, Byeongju"
          },
          {
            "@_fa": "true",
            "$": "Jeong, Hyunjun"
          },
          {
            "@_fa": "true",
            "$": "Lee, Dongmin"
          },
          {
            "@_fa": "true",
            "$": "Jones, Christopher W."
          },
          {
            "@_fa": "true",
            "$": "Yun, Yongju"
          }
        ],
        "link": [
          {
            "@_fa": "true",
            "@rel": "self",
            "@href": "https://api.elsevier.com/content/article/pii/S0021951725002970"
          },
          {
            "@_fa": "true",
            "@rel": "scidir",
            "@href": "https://www.sciencedirect.com/science/article/pii/S0021951725002970"
          }
        ],
        "dc:format": "application/json",
        "openaccessType": null,
        "pii": "S0021-9517(25)00297-0",
        "prism:volume": "449",
        "articleNumber": "116232",
        "prism:publisher": "Elsevier Inc. All rights are reserved, including those for text and data mining, AI training, and similar technologies.",
        "dc:title": "Surface modification of SiO2 support with N-containing polymer for enantioselective hydrogenation over Pt catalyst",
        "prism:copyright": "© 2025 Elsevier Inc. All rights are reserved, including those for text and data mining, AI training, and similar technologies.",
        "openaccess": "0",
        "prism:issn": "00219517",
        "dcterms:subject": [
          {
            "@_fa": "true",
            "$": "Enantioselective hydrogenation"
          },
          {
            "@_fa": "true",
            "$": "α-keto ester"
          },
          {
            "@_fa": "true",
            "$": "Supported Pt catalyst"
          },
          {
            "@_fa": "true",
            "$": "Modified SiO2 support"
          },
          {
            "@_fa": "true",
            "$": "Poly(ethyleneimine)"
          }
        ],
        "openaccessArticle": "false",
        "prism:publicationName": "Journal of Catalysis",
        "openaccessSponsorType": null,
        "prism:pageRange": "116232",
        "pubType": "fla",
        "prism:coverDisplayDate": "September 2025",
        "prism:doi": "10.1016/j.jcat.2025.116232",
        "prism:startingPage": "116232",
        "dc:identifier": "doi:10.1016/j.jcat.2025.116232",
        "openaccessSponsorName": null
      },
      "objects": {
        "object": [
          {
            "@category": "standard",
            "@height": "229",
            "@width": "676",
            "@_fa": "true",
            "$": "https://api.elsevier.com/content/object/eid/1-s2.0-S0021951725002970-gr7.jpg?httpAccept=%2A%2F%2A",
            "@multimediatype": "JPEG image file",
            "@type": "IMAGE-DOWNSAMPLED",
            "@size": "38716",
            "@ref": "gr7",
            "@mimetype": "image/jpeg"
          },
          {
            "@category": "standard",
            "@height": "297",
            "@width": "383",
            "@_fa": "true",
            "$": "https://api.elsevier.com/content/object/eid/1-s2.0-S0021951725002970-gr6.jpg?httpAccept=%2A%2F%2A",
            "@multimediatype": "JPEG image file",
            "@type": "IMAGE-DOWNSAMPLED",
            "@size": "16040",
            "@ref": "gr6",
            "@mimetype": "image/jpeg"
          },
          {
            "@category": "standard",
            "@height": "244",
            "@width": "535",
            "@_fa": "true",
            "$": "https://api.elsevier.com/content/object/eid/1-s2.0-S0021951725002970-gr9.jpg?httpAccept=%2A%2F%2A",
            "@multimediatype": "JPEG image file",
            "@type": "IMAGE-DOWNSAMPLED",
            "@size": "56854",
            "@ref": "gr9",
            "@mimetype": "image/jpeg"
          },
          {
            "@category": "standard",
            "@height": "262",
            "@width": "625",
            "@_fa": "true",
            "$": "https://api.elsevier.com/content/object/eid/1-s2.0-S0021951725002970-gr8.jpg?httpAccept=%2A%2F%2A",
            "@multimediatype": "JPEG image file",
            "@type": "IMAGE-DOWNSAMPLED",
            "@size": "33573",
            "@ref": "gr8",
            "@mimetype": "image/jpeg"
          },
          {
            "@category": "standard",
            "@height": "268",
            "@width": "625",
            "@_fa": "true",
            "$": "https://api.elsevier.com/content/object/eid/1-s2.0-S0021951725002970-sc1.jpg?httpAccept=%2A%2F%2A",
            "@multimediatype": "JPEG image file",
            "@type": "IMAGE-DOWNSAMPLED",
            "@size": "34066",
            "@ref": "sc1",
            "@mimetype": "image/jpeg"
          },
          {
            "@category": "standard",
            "@height": "469",
            "@width": "711",
            "@_fa": "true",
            "$": "https://api.elsevier.com/content/object/eid/1-s2.0-S0021951725002970-gr1.jpg?httpAccept=%2A%2F%2A",
            "@multimediatype": "JPEG image file",
            "@type": "IMAGE-DOWNSAMPLED",
            "@size": "142708",
            "@ref": "gr1",
            "@mimetype": "image/jpeg"
          },
          {
            "@category": "standard",
            "@height": "475",
            "@width": "330",
            "@_fa": "true",
            "$": "https://api.elsevier.com/content/object/eid/1-s2.0-S0021951725002970-gr3.jpg?httpAccept=%2A%2F%2A",
            "@multimediatype": "JPEG image file",
            "@type": "IMAGE-DOWNSAMPLED",
            "@size": "58834",
            "@ref": "gr3",
            "@mimetype": "image/jpeg"
          },
          {
            "@category": "standard",
            "@height": "305",
            "@width": "534",
            "@_fa": "true",
            "$": "https://api.elsevier.com/content/object/eid/1-s2.0-S0021951725002970-gr2.jpg?httpAccept=%2A%2F%2A",
            "@multimediatype": "JPEG image file",
            "@type": "IMAGE-DOWNSAMPLED",
            "@size": "41930",
            "@ref": "gr2",
            "@mimetype": "image/jpeg"
          },
          {
            "@category": "standard",
            "@height": "200",
            "@width": "466",
            "@_fa": "true",
            "$": "https://api.elsevier.com/content/object/eid/1-s2.0-S0021951725002970-ga1.jpg?httpAccept=%2A%2F%2A",
            "@multimediatype": "JPEG image file",
            "@type": "IMAGE-DOWNSAMPLED",
            "@size": "26041",
            "@ref": "ga1",
            "@mimetype": "image/jpeg"
          },
          {
            "@category": "standard",
            "@height": "272",
            "@width": "383",
            "@_fa": "true",
            "$": "https://api.elsevier.com/content/object/eid/1-s2.0-S0021951725002970-gr5.jpg?httpAccept=%2A%2F%2A",
            "@multimediatype": "JPEG image file",
            "@type": "IMAGE-DOWNSAMPLED",
            "@size": "23115",
            "@ref": "gr5",
            "@mimetype": "image/jpeg"
          },
          {
            "@category": "standard",
            "@height": "380",
            "@width": "802",
            "@_fa": "true",
            "$": "https://api.elsevier.com/content/object/eid/1-s2.0-S0021951725002970-gr4.jpg?httpAccept=%2A%2F%2A",
            "@multimediatype": "JPEG image file",
            "@type": "IMAGE-DOWNSAMPLED",
            "@size": "70029",
            "@ref": "gr4",
            "@mimetype": "image/jpeg"
          },
          {
            "@category": "thumbnail",
            "@height": "74",
            "@width": "219",
            "@_fa": "true",
            "$": "https://api.elsevier.com/content/object/eid/1-s2.0-S0021951725002970-gr7.sml?httpAccept=%2A%2F%2A",
            "@multimediatype": "GIF image file",
            "@type": "IMAGE-THUMBNAIL",
            "@size": "6796",
            "@ref": "gr7",
            "@mimetype": "image/gif"
          },
          {
            "@category": "thumbnail",
            "@height": "164",
            "@width": "212",
            "@_fa": "true",
            "$": "https://api.elsevier.com/content/object/eid/1-s2.0-S0021951725002970-gr6.sml?httpAccept=%2A%2F%2A",
            "@multimediatype": "GIF image file",
            "@type": "IMAGE-THUMBNAIL",
            "@size": "3997",
            "@ref": "gr6",
            "@mimetype": "image/gif"
          },
          {
            "@category": "thumbnail",
            "@height": "100",
            "@width": "219",
            "@_fa": "true",
            "$": "https://api.elsevier.com/content/object/eid/1-s2.0-S0021951725002970-gr9.sml?httpAccept=%2A%2F%2A",
            "@multimediatype": "GIF image file",
            "@type": "IMAGE-THUMBNAIL",
            "@size": "15890",
            "@ref": "gr9",
            "@mimetype": "image/gif"
          },
          {
            "@category": "thumbnail",
            "@height": "92",
            "@width": "219",
            "@_fa": "true",
            "$": "https://api.elsevier.com/content/object/eid/1-s2.0-S0021951725002970-gr8.sml?httpAccept=%2A%2F%2A",
            "@multimediatype": "GIF image file",
            "@type": "IMAGE-THUMBNAIL",
            "@size": "4269",
            "@ref": "gr8",
            "@mimetype": "image/gif"
          },
          {
            "@category": "thumbnail",
            "@height": "94",
            "@width": "219",
            "@_fa": "true",
            "$": "https://api.elsevier.com/content/object/eid/1-s2.0-S0021951725002970-sc1.sml?httpAccept=%2A%2F%2A",
            "@multimediatype": "GIF image file",
            "@type": "IMAGE-THUMBNAIL",
            "@size": "4623",
            "@ref": "sc1",
            "@mimetype": "image/gif"
          },
          {
            "@category": "thumbnail",
            "@height": "145",
            "@width": "219",
            "@_fa": "true",
            "$": "https://api.elsevier.com/content/object/eid/1-s2.0-S0021951725002970-gr1.sml?httpAccept=%2A%2F%2A",
            "@multimediatype": "GIF image file",
            "@type": "IMAGE-THUMBNAIL",
            "@size": "23521",
            "@ref": "gr1",
            "@mimetype": "image/gif"
          },
          {
            "@category": "thumbnail",
            "@height": "164",
            "@width": "114",
            "@_fa": "true",
            "$": "https://api.elsevier.com/content/object/eid/1-s2.0-S0021951725002970-gr3.sml?httpAccept=%2A%2F%2A",
            "@multimediatype": "GIF image file",
            "@type": "IMAGE-THUMBNAIL",
            "@size": "8543",
            "@ref": "gr3",
            "@mimetype": "image/gif"
          },
          {
            "@category": "thumbnail",
            "@height": "125",
            "@width": "219",
            "@_fa": "true",
            "$": "https://api.elsevier.com/content/object/eid/1-s2.0-S0021951725002970-gr2.sml?httpAccept=%2A%2F%2A",
            "@multimediatype": "GIF image file",
            "@type": "IMAGE-THUMBNAIL",
            "@size": "8207",
            "@ref": "gr2",
            "@mimetype": "image/gif"
          },
          {
            "@category": "thumbnail",
            "@height": "94",
            "@width": "219",
            "@_fa": "true",
            "$": "https://api.elsevier.com/content/object/eid/1-s2.0-S0021951725002970-ga1.sml?httpAccept=%2A%2F%2A",
            "@multimediatype": "GIF image file",
            "@type": "IMAGE-THUMBNAIL",
            "@size": "7666",
            "@ref": "ga1",
            "@mimetype": "image/gif"
          },
          {
            "@category": "thumbnail",
            "@height": "155",
            "@width": "219",
            "@_fa": "true",
            "$": "https://api.elsevier.com/content/object/eid/1-s2.0-S0021951725002970-gr5.sml?httpAccept=%2A%2F%2A",
            "@multimediatype": "GIF image file",
            "@type": "IMAGE-THUMBNAIL",
            "@size": "6931",
            "@ref": "gr5",
            "@mimetype": "image/gif"
          },
          {
            "@category": "thumbnail",
            "@height": "104",
            "@width": "219",
            "@_fa": "true",
            "$": "https://api.elsevier.com/content/object/eid/1-s2.0-S0021951725002970-gr4.sml?httpAccept=%2A%2F%2A",
            "@multimediatype": "GIF image file",
            "@type": "IMAGE-THUMBNAIL",
            "@size": "5636",
            "@ref": "gr4",
            "@mimetype": "image/gif"
          },
          {
            "@category": "high",
            "@height": "1015",
            "@width": "2992",
            "@_fa": "true",
            "$": "https://api.elsevier.com/content/object/eid/1-s2.0-S0021951725002970-gr7_lrg.jpg?httpAccept=%2A%2F%2A",
            "@multimediatype": "JPEG image file",
            "@type": "IMAGE-HIGH-RES",
            "@size": "208978",
            "@ref": "gr7",
            "@mimetype": "image/jpeg"
          },
          {
            "@category": "high",
            "@height": "1316",
            "@width": "1699",
            "@_fa": "true",
            "$": "https://api.elsevier.com/content/object/eid/1-s2.0-S0021951725002970-gr6_lrg.jpg?httpAccept=%2A%2F%2A",
            "@multimediatype": "JPEG image file",
            "@type": "IMAGE-HIGH-RES",
            "@size": "74977",
            "@ref": "gr6",
            "@mimetype": "image/jpeg"
          },
          {
            "@category": "high",
            "@height": "761",
            "@width": "1667",
            "@_fa": "true",
            "$": "https://api.elsevier.com/content/object/eid/1-s2.0-S0021951725002970-gr9_lrg.jpg?httpAccept=%2A%2F%2A",
            "@multimediatype": "JPEG image file",
            "@type": "IMAGE-HIGH-RES",
            "@size": "380486",
            "@ref": "gr9",
            "@mimetype": "image/jpeg"
          },
          {
            "@category": "high",
            "@height": "994",
            "@width": "2368",
            "@_fa": "true",
            "$": "https://api.elsevier.com/content/object/eid/1-s2.0-S0021951725002970-gr8_lrg.jpg?httpAccept=%2A%2F%2A",
            "@multimediatype": "JPEG image file",
            "@type": "IMAGE-HIGH-RES",
            "@size": "156321",
            "@ref": "gr8",
            "@mimetype": "image/jpeg"
          },
          {
            "@category": "high",
            "@height": "1017",
            "@width": "2368",
            "@_fa": "true",
            "$": "https://api.elsevier.com/content/object/eid/1-s2.0-S0021951725002970-sc1_lrg.jpg?httpAccept=%2A%2F%2A",
            "@multimediatype": "JPEG image file",
            "@type": "IMAGE-HIGH-RES",
            "@size": "147209",
            "@ref": "sc1",
            "@mimetype": "image/jpeg"
          },
          {
            "@category": "high",
            "@height": "1248",
            "@width": "1890",
            "@_fa": "true",
            "$": "https://api.elsevier.com/content/object/eid/1-s2.0-S0021951725002970-gr1_lrg.jpg?httpAccept=%2A%2F%2A",
            "@multimediatype": "JPEG image file",
            "@type": "IMAGE-HIGH-RES",
            "@size": "650284",
            "@ref": "gr1",
            "@mimetype": "image/jpeg"
          },
          {
            "@category": "high",
            "@height": "2106",
            "@width": "1463",
            "@_fa": "true",
            "$": "https://api.elsevier.com/content/object/eid/1-s2.0-S0021951725002970-gr3_lrg.jpg?httpAccept=%2A%2F%2A",
            "@multimediatype": "JPEG image file",
            "@type": "IMAGE-HIGH-RES",
            "@size": "315855",
            "@ref": "gr3",
            "@mimetype": "image/jpeg"
          },
          {
            "@category": "high",
            "@height": "1350",
            "@width": "2367",
            "@_fa": "true",
            "$": "https://api.elsevier.com/content/object/eid/1-s2.0-S0021951725002970-gr2_lrg.jpg?httpAccept=%2A%2F%2A",
            "@multimediatype": "JPEG image file",
            "@type": "IMAGE-HIGH-RES",
            "@size": "238747",
            "@ref": "gr2",
            "@mimetype": "image/jpeg"
          },
          {
            "@category": "high",
            "@height": "886",
            "@width": "2064",
            "@_fa": "true",
            "$": "https://api.elsevier.com/content/object/eid/1-s2.0-S0021951725002970-ga1_lrg.jpg?httpAccept=%2A%2F%2A",
            "@multimediatype": "JPEG image file",
            "@type": "IMAGE-HIGH-RES",
            "@size": "152835",
            "@ref": "ga1",
            "@mimetype": "image/jpeg"
          },
          {
            "@category": "high",
            "@height": "1206",
            "@width": "1699",
            "@_fa": "true",
            "$": "https://api.elsevier.com/content/object/eid/1-s2.0-S0021951725002970-gr5_lrg.jpg?httpAccept=%2A%2F%2A",
            "@multimediatype": "JPEG image file",
            "@type": "IMAGE-HIGH-RES",
            "@size": "108344",
            "@ref": "gr5",
            "@mimetype": "image/jpeg"
          },
          {
            "@category": "high",
            "@height": "1437",
            "@width": "3033",
            "@_fa": "true",
            "$": "https://api.elsevier.com/content/object/eid/1-s2.0-S0021951725002970-gr4_lrg.jpg?httpAccept=%2A%2F%2A",
            "@multimediatype": "JPEG image file",
            "@type": "IMAGE-HIGH-RES",
            "@size": "329440",
            "@ref": "gr4",
            "@mimetype": "image/jpeg"
          },
          {
            "@category": "standard",
            "@_fa": "true",
            "$": "https://api.elsevier.com/content/object/eid/1-s2.0-S0021951725002970-mmc1.docx?httpAccept=%2A%2F%2A",
            "@multimediatype": "Microsoft Word file",
            "@type": "APPLICATION",
            "@size": "2233810",
            "@ref": "mmc1",
            "@mimetype": "application/word"
          },
          {
            "@category": "thumbnail",
            "@_fa": "true",
            "$": "https://api.elsevier.com/content/object/eid/1-s2.0-S0021951725002970-si1.svg?httpAccept=%2A%2F%2A",
            "@multimediatype": "Scalable Vector Graphics file",
            "@type": "ALTIMG",
            "@size": "20583",
            "@ref": "si1",
            "@mimetype": "image/svg+xml"
          },
          {
            "@category": "thumbnail",
            "@_fa": "true",
            "$": "https://api.elsevier.com/content/object/eid/1-s2.0-S0021951725002970-si2.svg?httpAccept=%2A%2F%2A",
            "@multimediatype": "Scalable Vector Graphics file",
            "@type": "ALTIMG",
            "@size": "14714",
            "@ref": "si2",
            "@mimetype": "image/svg+xml"
          }
        ]
      },
      "link": {
        "@rel": "abstract",
        "@href": "https://api.elsevier.com/content/abstract/scopus_id/105005956576"
      }
    }
  }
}