{
  "metadata": {
    "title": "Enhanced CO<ce:inf loc=post>2</ce:inf> photoreduction via tuning halides in perovskites",
    "authors": "; ; ",
    "journal": "Journal of Catalysis",
    "date": "2019-01-31",
    "doi": "10.1016/j.jcat.2018.11.004",
    "abstract": "",
    "uri": "https://api.elsevier.com/content/article/pii/S0021951718304342",
    "pii": "S0021951718304342"
  },
  "fulltext": {
    "full-text-retrieval-response": {
      "scopus-eid": "2-s2.0-85056884980",
      "originalText": "serial JL 272561 291210 291744 291809 31 Journal of Catalysis JOURNALCATALYSIS 2018-11-22 2018-11-22 2018-11-22 2018-11-22 2021-01-16T04:42:38 1-s2.0-S0021951718304342 S0021-9517(18)30434-2 S0021951718304342 10.1016/j.jcat.2018.11.004 S300 S300.2 FULL-TEXT 1-s2.0-S0021951718X00128 2021-01-16T05:43:59.523458Z 0 0 20190101 20190131 2019 2018-11-22T23:42:25.955081Z absattachment articleinfo articletitlenorm authfirstinitialnorm authfirstsurnamenorm cid cids contenttype copyright crossmark dateloaded dateloadedtxt datesearch datesort dateupdated dco docsubtype doctype doi eid ewtransactionid hubeid indexeddate issn issnnorm itemstage itemtransactionid itemweight openaccess openarchive pg pgfirst pglast pii piinorm pubdateend pubdatestart pubdatetxt pubyr sectiontitle sortorder srctitle srctitlenorm srctype ssids alllist content subj subheadings suppl tomb volfirst volissue volumelist webpdf webpdfpagecount yearnav figure table e-component body mmlmath acknowledge affil appendices articletitle auth authfirstini authfull authkeywords authlast grantnumber grantsponsor grantsponsorid highlightsabst primabst ref specialabst 0021-9517 00219517 true 369 369 C Volume 369 22 201 208 201 208 201901 January 2019 2019-01-01 2019-01-31 2019 Regular Articles article fla © 2018 Elsevier Inc. All rights reserved. ENHANCEDCO2PHOTOREDUCTIONVIATUNINGHALIDESINPEROVSKITES GUO S 1 Introduction 2 Experimental section 2.1 Materials 2.2 Synthesis 2.3 Materials characterization 2.4 Electrochemistry measurements 2.5 Photocatalytic reaction 3 Results and discussion 4 Conclusion Acknowledgements Appendix A Supplementary material References KAPILASHRAMI 2014 9662 9707 M ZHANG 2015 10307 10377 N MENG 2018 566 571 N YU 2014 8839 8842 J MA 2014 9987 10043 Y QAMAR 2016 692 698 S WANG 2017 17305 17308 S ONG 2016 7159 7329 W KURIKI 2016 5159 5170 R GAO 2016 6485 6490 C JIANG 2018 1706108 Z KURIKI 2017 4945 4949 R KUEHNEL 2017 7217 7223 M SEKIZAWA 2018 1405 1416 K ZHOU 2017 11689 11695 J SUN 2018 2357 2364 C ZHAO 2017 12498 12505 J WANG 2017 4393 4402 F CHEN 2018 284003 M KWEON 2014 4051 4056 K WHITE 2015 12888 12935 J WANG 2015 9146 9152 Z WANG 2018 38 41 Y YAN 2015 4460 4468 K OHMANN 2015 16049 16054 R SALIBA 2016 206 209 M SWARNKAR 2016 92 95 A YANG 2017 12471 12475 B SUN 2018 2805 2811 C TIDHAR 2014 13249 13256 Y PRASANNA 2017 11117 11124 R SONG 2015 7162 7167 J ZHANG 2016 1415 1420 X PAN 2018 562 565 J PAN 2017 726 732 W SHOAIB 2017 15592 15595 M YANG 2018 1704333 Z KOJIMA 2009 6050 6051 A YANG 2017 1376 1379 W PARK 2016 16185 S CHEN 2017 12267 12273 K XU 2017 5660 5663 Y HUANG 2018 755 759 H WU 2018 1704342 Y WANG 2018 1994 1997 L HOU 2017 9481 9485 J WANG 2015 7101 7108 Y PROTESESCU 2016 14202 14205 L DEBROYE 2017 340 346 E CHANG 2013 13836 13844 J LIU 2015 970 974 J PROTESESCU 2015 3692 3696 L CHEN 2011 746 750 X GUOX2019X201 GUOX2019X201X208 GUOX2019X201XS GUOX2019X201X208XS 2020-11-22T00:00:00.000Z 2020-11-22T00:00:00.000Z http://creativecommons.org/licenses/by-nc-nd/4.0/ © 2018 Elsevier Inc. All rights reserved. 2020-03-08T19:34:54.072Z http://vtw.elsevier.com/data/voc/AddOnTypes/50.7/nlp S0021951718304342 China Postdoctoral Science Foundation 2017M611295 China Postdoctoral Science Foundation http://data.elsevier.com/vocabulary/SciValFunders/501100002858 http://sws.geonames.org/1814991/ NSFC of China 21471027 21771035 21671034 21601032 This work was financially supported by the NSFC of China (Nos. 21601032 , 21471027 , 21671034 , 21771035 ), China Postdoctoral Science Foundation (No. 2017M611295 ). item S0021-9517(18)30434-2 S0021951718304342 1-s2.0-S0021951718304342 10.1016/j.jcat.2018.11.004 272561 2021-01-16T05:43:59.523458Z 2019-01-01 2019-01-31 1-s2.0-S0021951718304342-main.pdf https://s3-eu-west-1.amazonaws.com/prod-ucs-content-store-eu-west/content/pii:S0021951718304342/MAIN/application/pdf/4ba6e419711000885d8c2573ef63936e/main.pdf main.pdf pdf true 2846733 MAIN 8 1-s2.0-S0021951718304342-main_1.png https://s3-eu-west-1.amazonaws.com/prod-ucs-content-store-eu-west/content/pii:S0021951718304342/PREVIEW/image/png/9dfea3a6f2c1cd6e4050fba0735f1501/main_1.png main_1.png png 61578 849 656 IMAGE-WEB-PDF 1 1-s2.0-S0021951718304342-ga1.jpg https://s3-eu-west-1.amazonaws.com/prod-ucs-content-store-eu-west/content/pii:S0021951718304342/ga1/DOWNSAMPLED/image/jpeg/f8ec41f32d4fbf241f46d293337e4d52/ga1.jpg ga1 true ga1.jpg jpg 29199 200 404 IMAGE-DOWNSAMPLED 1-s2.0-S0021951718304342-gr1.jpg https://s3-eu-west-1.amazonaws.com/prod-ucs-content-store-eu-west/content/pii:S0021951718304342/gr1/DOWNSAMPLED/image/jpeg/0e182b97db3da88ddac157764865097b/gr1.jpg gr1 gr1.jpg jpg 29795 241 355 IMAGE-DOWNSAMPLED 1-s2.0-S0021951718304342-gr2.jpg https://s3-eu-west-1.amazonaws.com/prod-ucs-content-store-eu-west/content/pii:S0021951718304342/gr2/DOWNSAMPLED/image/jpeg/a42ae0a12e429f048b9d5b9c3cae2cc2/gr2.jpg gr2 gr2.jpg jpg 189436 805 547 IMAGE-DOWNSAMPLED 1-s2.0-S0021951718304342-gr3.jpg https://s3-eu-west-1.amazonaws.com/prod-ucs-content-store-eu-west/content/pii:S0021951718304342/gr3/DOWNSAMPLED/image/jpeg/ebcbbd9941cd7f151f7678a9dc4f6c8b/gr3.jpg gr3 gr3.jpg jpg 111381 441 546 IMAGE-DOWNSAMPLED 1-s2.0-S0021951718304342-gr4.jpg https://s3-eu-west-1.amazonaws.com/prod-ucs-content-store-eu-west/content/pii:S0021951718304342/gr4/DOWNSAMPLED/image/jpeg/c00f96aa24a115b7cf0ef543b3b78f2a/gr4.jpg gr4 gr4.jpg jpg 79636 442 542 IMAGE-DOWNSAMPLED 1-s2.0-S0021951718304342-gr5.jpg https://s3-eu-west-1.amazonaws.com/prod-ucs-content-store-eu-west/content/pii:S0021951718304342/gr5/DOWNSAMPLED/image/jpeg/a866e3c36011e1b4c4a909bb12d2536c/gr5.jpg gr5 gr5.jpg jpg 29208 200 543 IMAGE-DOWNSAMPLED 1-s2.0-S0021951718304342-gr6.jpg https://s3-eu-west-1.amazonaws.com/prod-ucs-content-store-eu-west/content/pii:S0021951718304342/gr6/DOWNSAMPLED/image/jpeg/58f9dbb3eec0de17b353bf4a1588c238/gr6.jpg gr6 gr6.jpg jpg 7432 248 311 IMAGE-DOWNSAMPLED 1-s2.0-S0021951718304342-gr7.jpg https://s3-eu-west-1.amazonaws.com/prod-ucs-content-store-eu-west/content/pii:S0021951718304342/gr7/DOWNSAMPLED/image/jpeg/a91f0b319945d9c0144390ea3890e403/gr7.jpg gr7 gr7.jpg jpg 64716 560 364 IMAGE-DOWNSAMPLED 1-s2.0-S0021951718304342-ga1.sml https://s3-eu-west-1.amazonaws.com/prod-ucs-content-store-eu-west/content/pii:S0021951718304342/ga1/THUMBNAIL/image/gif/1cbbb58b098ab6633042a9d455813c5b/ga1.sml ga1 true ga1.sml sml 13365 108 219 IMAGE-THUMBNAIL 1-s2.0-S0021951718304342-gr1.sml https://s3-eu-west-1.amazonaws.com/prod-ucs-content-store-eu-west/content/pii:S0021951718304342/gr1/THUMBNAIL/image/gif/66d57f95933b3d3563185a88e300de44/gr1.sml gr1 gr1.sml sml 17188 149 219 IMAGE-THUMBNAIL 1-s2.0-S0021951718304342-gr2.sml https://s3-eu-west-1.amazonaws.com/prod-ucs-content-store-eu-west/content/pii:S0021951718304342/gr2/THUMBNAIL/image/gif/c5eeb501b8ac58f14e404cd1fcd66200/gr2.sml gr2 gr2.sml sml 11669 163 111 IMAGE-THUMBNAIL 1-s2.0-S0021951718304342-gr3.sml https://s3-eu-west-1.amazonaws.com/prod-ucs-content-store-eu-west/content/pii:S0021951718304342/gr3/THUMBNAIL/image/gif/bb2131ab72e48a4fa8f8ba84f352bdf1/gr3.sml gr3 gr3.sml sml 16212 164 203 IMAGE-THUMBNAIL 1-s2.0-S0021951718304342-gr4.sml https://s3-eu-west-1.amazonaws.com/prod-ucs-content-store-eu-west/content/pii:S0021951718304342/gr4/THUMBNAIL/image/gif/5955dbc442af9d7059ad01170590a713/gr4.sml gr4 gr4.sml sml 11933 164 201 IMAGE-THUMBNAIL 1-s2.0-S0021951718304342-gr5.sml https://s3-eu-west-1.amazonaws.com/prod-ucs-content-store-eu-west/content/pii:S0021951718304342/gr5/THUMBNAIL/image/gif/9def521db4d7bd3e83a415919d7a3b6a/gr5.sml gr5 gr5.sml sml 5301 81 219 IMAGE-THUMBNAIL 1-s2.0-S0021951718304342-gr6.sml https://s3-eu-west-1.amazonaws.com/prod-ucs-content-store-eu-west/content/pii:S0021951718304342/gr6/THUMBNAIL/image/gif/39f1ceddecb2d2d0183bf53f1d1cc01e/gr6.sml gr6 gr6.sml sml 3247 163 205 IMAGE-THUMBNAIL 1-s2.0-S0021951718304342-gr7.sml https://s3-eu-west-1.amazonaws.com/prod-ucs-content-store-eu-west/content/pii:S0021951718304342/gr7/THUMBNAIL/image/gif/1079a46c97fb7f2b1d960460dbf86236/gr7.sml gr7 gr7.sml sml 7911 163 106 IMAGE-THUMBNAIL 1-s2.0-S0021951718304342-ga1_lrg.jpg https://s3-eu-west-1.amazonaws.com/prod-ucs-content-store-eu-west/content/pii:S0021951718304342/ga1/HIGHRES/image/jpeg/61fe564eac3bafa50932f91dffb31948/ga1_lrg.jpg ga1 true ga1_lrg.jpg jpg 94326 531 1073 IMAGE-HIGH-RES 1-s2.0-S0021951718304342-gr1_lrg.jpg https://s3-eu-west-1.amazonaws.com/prod-ucs-content-store-eu-west/content/pii:S0021951718304342/gr1/HIGHRES/image/jpeg/aeec67ed24c4c609402688853e72ac9f/gr1_lrg.jpg gr1 gr1_lrg.jpg jpg 198270 1069 1575 IMAGE-HIGH-RES 1-s2.0-S0021951718304342-gr2_lrg.jpg https://s3-eu-west-1.amazonaws.com/prod-ucs-content-store-eu-west/content/pii:S0021951718304342/gr2/HIGHRES/image/jpeg/8e8846b1b608ee08a9b3ca5606f976e4/gr2_lrg.jpg gr2 gr2_lrg.jpg jpg 1399422 3562 2421 IMAGE-HIGH-RES 1-s2.0-S0021951718304342-gr3_lrg.jpg https://s3-eu-west-1.amazonaws.com/prod-ucs-content-store-eu-west/content/pii:S0021951718304342/gr3/HIGHRES/image/jpeg/722c4bc44f1cfd6fa3881f70c5179886/gr3_lrg.jpg gr3 gr3_lrg.jpg jpg 767534 1955 2418 IMAGE-HIGH-RES 1-s2.0-S0021951718304342-gr4_lrg.jpg https://s3-eu-west-1.amazonaws.com/prod-ucs-content-store-eu-west/content/pii:S0021951718304342/gr4/HIGHRES/image/jpeg/117c679dc3974edbe19651161ecd7c85/gr4_lrg.jpg gr4 gr4_lrg.jpg jpg 502122 1959 2402 IMAGE-HIGH-RES 1-s2.0-S0021951718304342-gr5_lrg.jpg https://s3-eu-west-1.amazonaws.com/prod-ucs-content-store-eu-west/content/pii:S0021951718304342/gr5/HIGHRES/image/jpeg/e94bc1191bcae6c52e6e97ec11b707b9/gr5_lrg.jpg gr5 gr5_lrg.jpg jpg 174702 887 2406 IMAGE-HIGH-RES 1-s2.0-S0021951718304342-gr6_lrg.jpg https://s3-eu-west-1.amazonaws.com/prod-ucs-content-store-eu-west/content/pii:S0021951718304342/gr6/HIGHRES/image/jpeg/f7323c2bbebf1e91deb1be682b1c1a51/gr6_lrg.jpg gr6 gr6_lrg.jpg jpg 55204 1099 1378 IMAGE-HIGH-RES 1-s2.0-S0021951718304342-gr7_lrg.jpg https://s3-eu-west-1.amazonaws.com/prod-ucs-content-store-eu-west/content/pii:S0021951718304342/gr7/HIGHRES/image/jpeg/fee2ebbec5e75a77fb4a0badd6b11f4a/gr7_lrg.jpg gr7 gr7_lrg.jpg jpg 459949 2481 1614 IMAGE-HIGH-RES 1-s2.0-S0021951718304342-mmc1.doc https://s3-eu-west-1.amazonaws.com/prod-ucs-content-store-eu-west/content/pii:S0021951718304342/mmc1/MAIN/application/msword/4c7373ab37c1da8264f595049aeb927f/mmc1.doc mmc1 mmc1.doc doc 2339758 APPLICATION 1-s2.0-S0021951718304342-si1.gif https://s3-eu-west-1.amazonaws.com/prod-ucs-content-store-eu-west/content/pii:S0021951718304342/STRIPIN/image/gif/db3e46cc3d70a4539bbefa3d2b8d6841/si1.gif si1 si1.gif gif 517 18 107 ALTIMG 1-s2.0-S0021951718304342-am.pdf https://s3-eu-west-1.amazonaws.com/prod-ucs-content-store-eu-west/content/egi:10ZG1CJH4ZS/MAIN/application/pdf/50c76e2d13457bb08ecf3721c1224843/am.pdf https://s3.amazonaws.com/prod-ucs-content-store-us-east/content/egi:10ZG1CJH4ZS/MAIN/application/pdf/50c76e2d13457bb08ecf3721c1224843/am.pdf am am.pdf pdf false 3532449 AAM-PDF YJCAT 13011 S0021-9517(18)30434-2 10.1016/j.jcat.2018.11.004 Elsevier Inc. Fig. 1 Scheme of photocatalytic CO2 reduction based on CsPb(Brx/Cl1−x)3 (x = 0.7, 0.5, 0.3) nanocrystals under Xe-300 lamp illumination with AM 1.5 filter. Fig. 2 (a, b) TEM and HRTEM images of CsPb(Br0.5/Cl0.5)3 materials. (c) Size distribution of CsPb(Br0.5/Cl0.5)3 materials. (d) EDX mapping images of CsPb(Br0.5/Cl0.5)3 materials. (e) PXRD patterns of CsPb(Brx/Cl1−x)3 (x = 1, 0.7, 0.5, 0.3, 0) materials (PDF#54-0752). Fig. 3 (a) Cs 3d, (b) Pb 4f, (c) Br 3d, (d) Cl 2p XPS spectra of CsPb(Brx/Cl1−x)3 (x = 1, 0.7, 0.5, 0.3, 0) materials. Fig. 4 (a) UV–vis absorption spectra and (b) (αhυ)2 versus hυ curves of CsPb(Brx/Cl1−x)3 (x = 1, 0.7, 0.5, 0.3, 0) materials. (c) VB XPS spectrum of CsPb(Br0.5/Cl0.5)3 materials. (d) Emission spectra of CsPb(Brx/Cl1−x)3 (x = 1, 0.7, 0.5, 0.3, 0) materials. Fig. 5 (a) Yields of CO2 reduction using CsPb(Brx/Cl1−x)3 (x = 1, 0.7, 0.5, 0.3, 0) nanocrystals as catalysts under 9 h Xe lamp irradiation with AM 1.5 filter. (b) The generation rates of CO and CH4 using CsPb(Br0.5/Cl0.5)3 as catalyst. Fig. 6 The GC-MS result of an isotopic experiment with 13CO2 as carbon sources using CsPb(Br0.5/Cl0.5)3 as the catalyst. Fig. 7 (a) PXRD patterns of CsPb(Brx/Cl1−x)3 (x = 1, 0.7, 0.5, 0.3, 0) nanocrystals after photocatalysis (PDF#54-0752). (b) Transient photocurrent responses of mixed-halide CsPb(Brx/Cl1−x)3 (x = 0.7, 0.5, 0.3) nanocrystals. Table 1 Optical band gap, E VB and E CB of CsPb(Brx/Cl1−x)3 (x = 1, 0.7, 0.5, 0.3, 0) materials. Samples E g (eV) E VB (eV) E CB (eV) CsPbBr3 2.33 0.58 −1.75 CsPb(Br0.7/Cl0.3)3 2.51 0.75 −1.76 CsPb(Br0.5/Cl0.5)3 2.67 0.90 −1.77 CsPb(Br0.3/Cl0.7)3 2.83 1.04 −1.79 CsPbCl3 2.98 1.18 −1.80 Enhanced CO2 photoreduction via tuning halides in perovskites Shao-Hong Guo a Jie Zhou b Xue Zhao b Chun-Yi Sun b ⁎ Si-Qi You b Xin-Long Wang b ⁎ Zhong-Min Su a b ⁎ a College of Chemistry, Jilin University, Changchun, Jilin 130012, China College of Chemistry Jilin University Changchun Jilin 130012 China b Key Laboratory of Polyoxometalate Science of Ministry of Education, National & Local United Engineering Laboratory for Power Battery, Department of Chemistry, Northeast Normal University Changchun, Jilin 130024, China Key Laboratory of Polyoxometalate Science of Ministry of Education National & Local United Engineering Laboratory for Power Battery Department of Chemistry Northeast Normal University Changchun Jilin 130024 China ⁎ Corresponding authors at: College of Chemistry, Jilin University, Changchun, Jilin 130012, China (Z.-M. Su). College of Chemistry Jilin University Changchun Jilin 130012 China Graphical abstract Development of efficient, selective and low-cost photocatalysts, ideally constructed from Earth-abundant elements, is still a big challenge for CO2 photoreduction. Herein, adopting mixed halides strategy, the activity of all-inorganic perovskites toward CO2 reduction is enhanced sharply under simulated sunlight without photosensitizer, meanwhile maintaining high selectivity of CO and CH4 production. Via regulating ratio of Br and Cl, the yield of CO and CH4 changes obviously and the optimized catalyst is CsPb(Br0.5/Cl0.5)3 with a total yield of CO and CH4 up to 875 μmol/g (selectivity of 99%) which outperforms any other reported halide perovskites and is 4.5 and 9.1 folds higher than that of CsPbBr3 and CsPbCl3 under the same condition. The efficient charge separation and moderate stability in mixed-halide perovskites may account for the excellent performance in CO2 reduction. This study may provide a new strategy in design of high performance and low-cost halide perovskite materials for photocatalysis. Keywords Mixed-halide perovskites CO2 reduction Photocatalysis Simulated sunlight 1 Introduction For the large consumption of limited fossil fuels and release of carbon dioxide (CO2), the demand for clean and renewable energy is urgently increasing [1–3]. Of particular interest is the innovation of artificial photosynthesis which lays a solid foundation for the production of renewable fuels by harvesting solar energy [4,5]. Recently, a variety of materials, including metal oxides, sulfides, and organic semiconductor materials, have been employed as photocatalysts for CO2 reduction [6–10]. Although significant progress has been made in CO2 reduction with these materials as photocatalysts [11–19], most of them can only be active in the range of ultraviolet (UV) light and usually exhibit poor selectivity [20–22]. Moreover, the demand for photosensitizer (usually noble-metal complexes) is indispensable in most CO2 photoreduction systems [21,23]. Furthermore, the unrecyclable utilization of the substance will be a negative impact on the economy and environment. Thus, development of efficient, selective and low-cost photocatalysts for photocatalytic CO2 reduction without additional additive is of great importance. Recently, halide perovskite materials have attracted enormous attention for their outstanding electronic and optical properties [24–29] and shown promising optoelectronic applications, especially in photovoltaics [30,31], light-emitting diodes [32–34] and photodetectors [35–37]. By tuning the compositions or modifying synthesis methods, high stability, good crystallinity and low trap densities of halide perovskite materials could be achieved [24,26]. The power conversion efficiency of perovskite solar cells has developed rapidly from 3.8 to 22.1% within a few years [38,39]. Benefiting from their excellent optical properties and unique electronic structures, recently, halide perovskite materials have been applied for photocatalysts. For example, in 2016, Nam and co-workers firstly realized photocatalytic hydrogen iodide (HI) splitting using methylammonium lead iodide (MAPbI3) as catalyst in saturated aqueous solutions [40]. Subsequently, Tüysüz et al. found that the polymerization of 2,2,5,2″-ter-3,4-ethylenedioxythiophene could be promoted using cesium lead iodide perovskite quantum dots (CsPbI3 QDs) as photocatalysts under visible light illumination [41]. Su and colleagues firstly reported CsPbBr3 QDs as photocatalysts for converting CO2 into solar fuels in nonaqueous media [42]. Although halide perovskite materials have exhibited attractive performance in photocatalysis [40–46], they are still in the initial stage. Especially for CO2 photoreduction, the yield is still limited in tens of micromole per gram of catalyst. Herein, mixed halides strategy was adopted to promote the activity of all-inorganic perovskites in CO2 photoreduction. A serial of mixed-halide perovskites CsPb(Brx/Cl1−x)3 (x = 0.7, 0.5, 0.3) with a cubic phase are explored as photocatalysts and high efficiency and selectivity in converting CO2 into CO and CH4 are achieved under simulated sunlight and absence of photosensitizer (Fig. 1 ). The ratio of Br and Cl in CsPb(Brx/Cl1−x)3 has a significant impact on the catalytic efficiency. The optimized catalyst is CsPb(Br0.5/Cl0.5)3 with a total yield of CO and CH4 up to 875 μmol/g (selectivity of 99%) which is around 4.5 and 9.1 times higher than the performance of CsPbBr3 and CsPbCl3 in the same phase and outperforms any other reported perovskites. 2 Experimental section 2.1 Materials All chemicals were directly used without further purification. Cesium carbonate (Cs2CO3, 99%, Aladdin), lead (II) bromide (PbBr2, 99.5%, Aladdin), lead (II) chloride (PbCl2, 99.5%, Aladdin), oleylamine (OAm, technical grade 90%, Aladdin), oleic acid (OA, technical grade 90%, Alfa Aesar), 1-octadecene (ODE, technical grade 90%, Aladdin), trioctylphosphine (TOP, Strem, 97%), ethyl acetate (AR, Aladdin), hexanes (AR, Aladdin), dimethyl formamide (DMF, AR), toluene (AR, Aladdin), hexanoic acid (AR, Aladdin), octylamine (AR, Aladdin). 2.2 Synthesis Preparation of Cs-oleate. Firstly, Cs2CO3 (0.8140 g), OA (2.5 mL) and ODE (10 mL) were added into a 50-mL 2-neck round bottomed flask, and then the flask was evacuated for about 5 min at room temperature. Then the flask was refilled with nitrogen and evacuated at 120 °C for 30 min, then maintaining 120 °C until obtaining the transparent solution. Before using, the Cs-oleate solution was heated until totally dissolved. Synthesis of colloidal CsPb(Brx/Cl1−x)3 (x = 1, 0.7, 0.5, 0.3, 0) nanocrystals. The halide perovskite CsPb(Brx/Cl1−x)3 (x = 1, 0.7, 0.5, 0.3, 0) nanocrystals were prepared according to the reported literature [47]. Take CsPbBr3 nanocrystals as an example. PbBr2 (0.0661 g), OAm (0.8 mL), OA (0.8 mL), and ODE (5 mL) were added to a 50-mL 2-neck round bottomed flask. The flask was evacuated and refilled with N2 when the solution was heated to 120 °C for 30 min. After that, the solution was increased to 185 °C. At 185 °C, dried OAm (0.8 mL) and dried OA (0.8 mL) was injected to solubilize the solution. Then the Cs-oleate (0.064 mL) was swiftly injected into the reaction system and after 5 s the solution was cooled with an ice bath. The nanocrystals were collected by centrifugation at 8000 rpm for 5 min, and then washed with hexane and ethyl acetate for five times. For CsPbCl3 nanocrystals, 1 mL of TOP was required to solubilize PbCl2. Synthesis of CsPbBr3 quantum dots with the orthorhombic phase [42]. Firstly, PbBr2 (367.01 mg) was fully dissolved in the mixture of DMF (20 mL), hexanoic acid (232.32 mg) and octylamine (258.48 mg). Subsequently, 1 mL of Cs-oleate solution was added to this solution. Finally, 0.5 mL of the mixed solution was added into a flask with 20 mL of toluene, followed centrifuging and washing process (by ethyl acetate) twice. 2.3 Materials characterization The powder X-ray diffraction patterns (PXRD) were recorded on a SmartLab X-ray diffractometer. The morphology and nanostructure were investigated on transmission electron microscope (TEM) and high-resolution TEM (HRTEM) (JEM-2100Plus). X-ray photoelectron spectroscopy (XPS) characterizations were performed on an Escalab 250 instrument with a monochromatized Al Kα X-ray sources. The absorption behavior of the samples was studied by the UV–vis spectrometer (Shimadzu UV-2600). UV–vis diffuse reflection spectroscopy (DRS) was obtained on a U-3010 spectrophotometer (Hitachi, Japan). Photoluminescence (PL) spectra were scanned on a photoluminescence spectrometer (Hitachi F-4600), under an excitation wavelength of 362 nm except for CsPbCl3 nanocrystals (excited by 320 nm). The elemental analysis is carried out by inductively coupled plasma mass spectrometry (ICP-MS). The film thickness of photoelectrode was determined by Scanning Electron Microscope (SEM). The product of the photocatalytic reaction was tested by the GC-9800 spectrometer. The HP 6890GC-5973MSD gas chromatography-mass spectrometer (GC-MS) was employed to analyze the CO product generated from the 13CO2 (98% enriched) isotope experiments. 2.4 Electrochemistry measurements Fabrication of the CsPb(Brx/Cl1−x)3 (x = 0.7, 0.5, 0.3) photoelectrodes. The ITO substrate was cleaned by sonicating sequentially in deionized water, alcohol and acetone, each for 10 min. The ITO substrate was divided into the size of approximately 1 cm × 1 cm. A fixed amount of CsPb(Brx/Cl1−x)3 (x = 1, 0.7, 0.5, 0.3, 0) toluene suspension was subsequently dropped onto the ITO substrate. The as-prepared photoelectrodes were subsequently dried at room temperature overnight. All the photoelectrochemical characterizations were performed on the electrochemical workstation (CHI660e, CH Instruments, Inc., USA) with a three-electrode configuration with the assembled photoelectrodes as the working electrode, the Pt mesh as the counter electrode and the Ag/AgCl (in 3 M KCl) as the reference electrode. The ethyl acetate with 0.1 M tetrabutylammonium hexafluorophosphate (TBAPF6) was filled in the cell as electrolyte. The light source and the light density were identical with that in the photocatalytic CO2 reduction test. 2.5 Photocatalytic reaction Photocatalytic performance tests. The photocatalytic CO2 reduction was conducted in a homemade 75 mL sealed cell with 0.5 mg CsPb(Brx/Cl1−x)3 (x = 1, 0.7, 0.5, 0.3, 0) nanocrystals as the catalysts and 6 mL ethyl acetate as the solvent. Before the reduction, high purity CO2 (99.99%) gas was bubbled in the ethyl acetate solvent for around 20 min until the CO2 concentration reached saturation and dissolved oxygen was removed completely. A 300 W Xenon lamp with AM 1.5 filter was used as the light source. The distance between the homemade sealed cell and the 300 W xenon lamp is about 8 cm and the sample geometry of irradiation was about 2 cm × 3 cm. The light intensity was around 200 mW/cm2. All of the experiments were carried out under ambient pressure and the reaction system was kept at 20 °C under a cooling water system. The gaseous products generated during CO2 photocatalytic reduction were collected by a 1 mL syringe and then immediately analyzed by GC-9800 equipped with a flame ionization detector (FID), and a thermal conductivity detector (TCD) after 9 h. Control experiments. The control experiment was conducted in a homemade 75 mL sealed cell with 0.5 mg CsPb(Br0.5/Cl0.5)3 nanocrystals as the catalysts and 6 mL ethyl acetate as the solvent. Before the reduction, high purity Ar (99.99%) gas was bubbled in the ethyl acetate solvent for around 20 min until the dissolved oxygen was removed completely. A 300 W xenon lamp with AM 1.5 filter was used as the light source. After 9 h, the gaseous products were collected by a 1 mL syringe and then immediately analyzed by GC-9800 equipped with a flame ionization detector (FID), and a thermal conductivity detector (TCD). Isotopic experiment. The isotopic experiment was conducted in a homemade 75 mL sealed cell with 0.5 mg CsPb(Br0.5/Cl0.5)3 nanocrystals as the catalysts and 6 mL ethyl acetate as the solvent. Before the reduction, 13CO2 (98%) gas was bubbled in the ethyl acetate solvent for around 20 min until the dissolved oxygen was removed completely. A 300 W xenon lamp with AM 1.5 filter was used as the light source. After 9 h, the 13C-labeled product was tested by GC-MS. 3 Results and discussion The monodispersed mixed-halide perovskites CsPb(Brx/Cl1−x)3 (x = 0.7, 0.5, 0.3) were synthesized according to the well-developed hot injection method [47]. As control in catalytic experiment, CsPbBr3 and CsPbCl3 nanocrystals were also prepared through the same approach. Powder X-ray diffraction (PXRD) patterns show a pure cubic phase of the as-prepared CsPb(Brx/Cl1−x)3 (x = 1, 0.7, 0.5, 0.3, 0) nanocrystals (Fig. 2 e), which is consistent with the previous reports [47,48]. Transmission electron microscopy (TEM) images presented in Fig. 2a and Fig. S1† exhibit that all CsPb(Brx/Cl1−x)3 (x = 1, 0.7, 0.5, 0.3, 0) crystals are cubic shape with a size around 10.5 nm (Fig. 2c). Such small particle size will provide guarantee of a large specific surface area for catalysis. Depending on the high-resolution TEM (HRTEM) image (Fig. 2b), the lattice parameter of the CsPb(Br0.5/Cl0.5)3 materials is 0.57 nm suggesting the as-prepared materials are highly crystalline in perovskite structure. Moreover, the energy-dispersive X-ray (EDX) spectra reveal the existence of Cs, Pb, Br and Cl elements in CsPb(Br0.5/Cl0.5)3 materials (Fig. 2d). We examined the surface chemical binding of CsPb(Brx/Cl1−x)3 (x = 1, 0.7, 0.5, 0.3, 0) materials with X-ray photoelectron spectroscopy (XPS) (Fig. S2†). The peaks of Cs 3d of CsPbBr3 (x = 1) at 724.0 and 738.1 eV are gradually red-shift to 723.8 and 737.8 eV (CsPbCl3, x = 0), respectively (Fig. 3 a). For the peaks of Pb 4f, they individually exhibit blue-shift from 137.8 and 142.7 eV of CsPbBr3 to 138.0 and 142.9 eV of CsPbCl3 (Fig. 3b). These indicate that bonding environment of Cs and Pb atoms is changed via tuning the ratios of Br/Cl. The peaks of Br 3d and/or Cl 2p in CsPb(Brx/Cl1−x)3 (x = 1, 0.7, 0.5, 0.3, 0) are almost unchanged (Fig. 3c, d). To better understand the actual ratio of Br/Cl in the synthesized perovskites, the elemental analysis is carried out by ICP-MS (Table S1†), which indicates that the actual ratio is generally consistent with the molar feed ratio. In the following experiments, we studied the optical properties of CsPb(Brx/Cl1−x)3 materials. Firstly, using ethyl acetate as a solvent, light absorption property of CsPb(Brx/Cl1−x)3 was measured. CsPb(Brx/Cl1−x)3 exhibit a good absorption toward the visible light, ranging from 400 to 700 nm (Fig. 4 a), which is quite wider than the typical semiconductors, such as TiO2, ZnO [6,49,50]. With x value increases, the absorption peaking at 520 nm (CsPbBr3) gradually shifts to 420 nm (CsPbCl3). For semiconductor, the band edge positions have a significant influence on the catalytic reactivity. Hence, the band edge positions of CsPb(Brx/Cl1−x)3 (x = 1, 0.7, 0.5, 0.3, 0) materials were studied. First, the band gap (E g) of them was decided by UV–vis diffuse reflection spectroscopy (DRS, Fig. S3†) based on Tauc method [51]. Fig. 4b shows the (αhν)2 versus hν curves of CsPb(Brx/Cl1−x)3 (x = 1, 0.7, 0.5, 0.3, 0) materials with a direct band gap [52]. The E g values of CsPb(Brx/Cl1−x)3 (x = 1, 0.7, 0.5, 0.3, 0) were from 2.33 to 2.98 eV (Table 1 ) based on the X-axis intercept of the Tauc plot. The valence band (E VB) of CsPb(Brx/Cl1−x)3 (x = 1, 0.7, 0.5, 0.3, 0) materials are determined by Valence-band XPS (VB XPS, Fig. 4c and Fig. S4†). The conduction band (E CB) are determined by the equation [53]: E CB = E VB - E g According to the band edge positions in Table 1, we can find that E VB enhanced with the increase of Cl content in CsPb(Brx/Cl1−x)3, while very little change of E CB was observed. Thus, the E VB depends more strongly on the halide composition than E CB. In addition, E CB levels of all as-prepared halide perovskites are higher than the reductive potential of CO2 to CO (−0.5 eV). Under the excitation of 362 nm (except CsPbCl3 which was excited by 320 nm), emission spectra of CsPb(Brx/Cl1−x)3 (x = 1, 0.7, 0.5, 0.3, 0) materials were collected. The emission band peaking at 517 nm is observed on CsPbBr3 and with the enhancement of Cl content, the peak is gradually shifted to 413 nm (Fig. 4d). To investigate the catalytic activity of mixed-halide perovskite toward CO2 reduction, the catalytic experiment was carried out following the reaction condition reported by Su and co-workers in which only perovskites and ethyl acetate were used in the system [42]. As a control experiment, the catalytic activity of CsPbBr3 and CsPbCl3 was also investigated. Firstly, a certain amount of halide perovskites was put into a quartz tube containing 6 mL ethyl acetate. After irradiation by Xe-300 lamp with AM 1.5 filter within 9 h, CO and CH4 are generated as the main gas product and the yield is changed with the alteration of Br/Cl ratios in perovskites (Fig. 5 a, Tables S2† and S3†). With CsPbBr3 as a catalyst, the yield of CO and CH4 is 135 and 60 μmol/g, respectively. After displacing Br with Cl at x = 0.7, the yield of CO and CH4 enhances slightly up to 156 and 72 μmol/g. When using CsPb(Br0.5/Cl0.5)3 as a catalyst, the CO generation undergoes a sharp increase to 767 μmol/g which is 5.7-fold and 4.9-fold higher than that of pure CsPbBr3 and CsPb(Br0.7/Cl0.3)3, while CH4 only exhibits a slight enhancement (108 μmol/g) (Fig. S5a†). However, further enhancing the Cl content (x = 0.3 or 0), the production amount of CO and CH4 in CsPb(Br0.3/Cl0.7)3 or CsPbCl3 presents an obvious decrease. From these results, we can find Cl introduction has a significant influence on the activity of CO2 reduction in this photocatalytic system. The optimal catalyst is CsPb(Br0.5/Cl0.5)3 with a total catalytic yield of CO and CH4 up to 875 μmol/g which is around 4.5 and 9.1 times higher than the performance of CsPbBr3 and CsPbCl3 materials. What’s more, the common byproduct H2 is avoided in all of CsPb(Brx/Cl1−x)3 catalyst and the selectivity toward CO and CH4 is up to 99%. CsPbBr3 QDs with the orthorhombic phase are first reported as a photocatalyst for CO2 photoreduction [42]. To get an unambiguous evaluation about mixed-halide strategy in CO2 photoreduction, the orthorhombic CsPbBr3 sample was employed as a catalyst in our experimental condition (Fig. S5b†). After 9 h reaction, around 112 μmol/g CO and 33 μmol/g CH4 are produced and the total generation amount (145 μmol/g) is 1/6 of CsPb(Br0.5/Cl0.5)3 and comparable with that of cubic CsPbBr3 (195 μmol/g). Compared with the mixed-halide strategy, crystal phase (orthorhombic or cubic) has a little effect on the CO2 photoreduction performance. Moreover, the total yield of CsPb(Br0.5/Cl0.5)3 perovskite toward CO2 reduction is much better than that of reported popular catalysts, such as TiO2, CdS and g-C3N4 under similar condition (Table S4†). To better confirm the advantage of CsPb(Br0.5/Cl0.5)3 perovskite over these materials in CO2 reduction, the activity of g-C3N4 nanosheets and TiO2 (P25) were studied under the same catalytic condition (Table S5†). The photocatalytic results demonstrate that the reactivity of g-C3N4 nanosheets and TiO2 (P25) is around 10-fold and 5-fold lower than that of CsPb(Br0.5/Cl0.5)3 respectively. The CO2 photoreduction activity of CsPb(Br0.5/Cl0.5)3 materials within different time was investigated by detecting the amounts of CO and CH4 every three hours (Fig. 5b). Within the period, the outputs of CO and CH4 are 250 ± 20 and 25.0 ± 2 μmol/g, respectively. These results present that CO and CH4 almost linearly increase during the 9 h irradiation. These results imply that CsPb(Br0.5/Cl0.5)3 materials might have a moderate stability during photocatalysis. To compare the performance of different catalysts via tuning ratios of Br/Cl during different reaction time, the experiments were carried out (Fig. S6†). The higher generation speed of CO than that of CH4 may result from the needed multi-electrons pathway in CH4 formation. The decrease of CH4 amount after 9 h reaction may ascribe to the discontinuous irradiation which severely affects electrons accumulation to feed 8 electrons route. The control experiment was investigated to determine the source of the gas product under an inert Ar gas atmosphere. After 9 h irradiation, CO and CO2 were generated with the amount of 94 and 430 μmol/g by CsPb(Br0.5/Cl0.5)3, respectively. The CO yield under Ar is around one-in-eight of that under saturated CO2 (767 μmol/g) which means that a small quantity of CO generated from the photosynthesis system due to partial photooxidation of ethyl acetate. To further make sure the carbon source of the reaction product, gas chromatography-mass spectrometer (GC-MS) was used to detect CO under 13CO2 atmosphere using CsPb(Br0.5/Cl0.5)3 as catalysts (Fig. 6 ). The result of isotopic experiment indicates that about 85% of CO comes from 13CO2 photoreduction. Besides activity, the stability of a catalyst is another significant factor affecting the catalytic efficiency. To illuminate the stability of mixed-halide perovskite materials, we studied the crystalline phase after photocatalysis. No obvious changes in PXRD patterns of CsPb(Brx/Cl1−x)3 (x = 0.7, 0.5, 0.3) are observed after photocatalysis. Contrast to mixed-halide perovskite, the PXRD pattern of CsPbCl3 after catalysis was kept intact but the one of CsPbBr3 (Fig. 7 a) shows a few new peaks (CsPb2Br5). These results imply mixed-halide perovskite materials may have better stability than that of bare CsPbBr3, and indicate that the introduction of Cl in halide perovskite could be a promising way to enhance the stability of perovskite in CO2 photoreduction to some extent. Considering the PXRD results, the reusable experiment was conducted (Fig. S7†). After second recycle (corresponding to 18 h reaction), around 42% and 56% decrease in CO and CH4 generation with CsPb(Br0.5/Cl0.5)3 as catalyst was observed, however, after third recycle (corresponding to 27 h reaction), the yield of both CO and CH4 sharply reduced to 38% and 23%. The decrease of catalytic activity may result from the moderate durability of perovskite materials under the long-time irradiation. For other CsPb(Brx/Cl1−x)3 (x = 0, 0.3, 0.7, 1), with the Cl content enhanced, the reduced degree in reactivity decreased. According to these experiments, the ratio of Br and Cl at 0.5:0.5 should be the most active rather than the most stable. The advantage in band energy and the moderate stability of CsPb(Br0.5/Cl0.5)3 may make it be the most appropriate catalyst for CO2 photoreduction. Given that charge separation plays a crucial role in the redox reaction, transient photocurrent responses were employed to reveal the rooted reason behind the predominant photocatalytic performance of CsPb(Br0.5/Cl0.5)3 materials in CO2 reduction. First, the photoelectrodes were prepared and the thickness of the film cross-section was determined by SEM image of CsPb(Br0.5/Cl0.5)3 photoelectrode (Fig. S8†). The photocurrent responses were collected under Xe-300 lamp with AM 1.5 filter under dark and light conditions. In Fig. 7b, the photocurrent density of CsPb(Br0.5/Cl0.5)3 elevates rapidly up to 4.4 μA/cm2 during light irradiation and then decreases sharply under the dark condition, which can be successively implemented for multiple times. Other mixed-halide perovskites CsPb(Brx/Cl1−x)3 (x = 0.7, 0.3) have similar phenomena during on-off irradiation but with low photocurrent density. These results illuminate the charge separation of CsPb(Br0.5/Cl0.5)3 is more efficient than the other two mixed-halide perovskites. Together with the band energy and the advantage in moderate stability, CsPb(Br0.5/Cl0.5)3 may be the most appropriate catalyst for CO2 photoreduction. 4 Conclusion In summary, we provide a strategy to enhance the CO2 photoreduction efficiency, exploring low-cost and selective mixed-halide perovskite CsPb(Brx/Cl1−x)3 (x = 0.7, 0.5, 0.3) materials as catalysts. Via hot-injection method, these mixed-halide perovskites with cubic phase and a size of 10.5 nm are prepared, which exhibit excellent visible-light absorption property. The E g of these mixed-halide perovskite ranges from 2.51 to 2.83 eV which is smaller than classical semiconductors, such as TiO2 and ZnO. The E CB of them is all around −1.70 eV, higher than the reductive potential of CO2 to CO (−0.5 eV) which provides the guarantee for CO2 photoreduction. Under simulated sunlight and absence of additive of the photosensitizer, mixed-halide perovskites exhibit excellent photocatalytic efficiency and selectivity in converting CO2 to CO and CH4. The ratio of Br and Cl in perovskite materials has a significant effect on the photocatalytic performance. The optimized catalyst is CsPb(Br0.5/Cl0.5)3 with a total amount of 875 μmol/g of CO and CH4 (selectivity of 99%) which is 4.5, 9.1 and 6 folds higher than the yield of CsPbBr3, CsPbCl3 and CsPbBr3 with orthorhombic phase under the same condition. The moderate stability and appropriate band energy of mixed-halide perovskite may account for the high yield of CsPb(Brx/Cl1−x)3. The more efficient charge separation of CsPb(Br0.5/Cl0.5)3 than that of CsPb(Br0.7/Cl0.3)3 and CsPb(Br0.3/Cl0.7)3 may lead to the higher activity of CsPb(Br0.5/Cl0.5)3. What’s more, this activity and selectivity of CsPb(Br0.5/Cl0.5)3 outperform popular semiconductor catalysts, such as TiO2, CdS and g-C3N4. We believe that these findings pave new routes in designing efficient, selective and low-cost perovskite for CO2 photoreduction. Acknowledgements This work was financially supported by the NSFC of China (Nos. 21601032, 21471027, 21671034, 21771035), China Postdoctoral Science Foundation (No. 2017M611295). Appendix A Supplementary material Supplementary data to this article can be found online at https://doi.org/10.1016/j.jcat.2018.11.004. Appendix A Supplementary material The following are the Supplementary data to this article: Supplementary Data 1 References [1] M. Kapilashrami Y.F. Zhang Y.S. Liu A. Hagfeldt J.H. Guo Chem. Rev. 114 2014 9662 9707 [2] N. Zhang M.Q. Yang S.Q. Liu Y.G. Sun Y.J. Xu Chem. Rev. 115 2015 10307 10377 [3] N.N. Meng J. Ren Y. Liu Y. Huang T. Petit B. Zhang Energy Environ. Sci. 11 2018 566 571 [4] J.G. Yu J.X. Low W. Xiao P. Zhou M. Jaroniec J. Am. Chem. Soc. 136 2014 8839 8842 [5] Y. Ma X.L. Wang Y.S. Jia X.B. Chen H.X. Han C. Li Chem. Rev. 114 2014 9987 10043 [6] S. Qamar F.C. Lei L. Liang S. Gao K.T. Liu Y.F. Sun W.X. Ni Y. Xie Nano Energy 26 2016 692 698 [7] S.B. Wang B.Y. Guan Y. Lu X.W. Lou J. Am. Chem. Soc. 139 2017 17305 17308 [8] W.J. Ong L.L. Tan Y.H. Ng S.T. Yong S.P. Chai Chem. Rev. 116 2016 7159 7329 [9] R. Kuriki H. Matsunaga T. Nakashima K. Wada A. Yamakata O. Ishitani K. Maeda J. Am. Chem. Soc. 138 2016 5159 5170 [10] C. Gao Q.Q. Meng K. Zhao H.J. Yin D.W. Wang J. Guo S.L. Zhao L. Chang M. He Q.X. Li H.J. Zhao X.J. Huang Y. Gao Z.Y. Tang Adv. Mater. 28 2016 6485 6490 [11] Z.F. Jiang W.M. Wan H.M. Li S.Q. Yuan H.J. Zhao P.K. Wong Adv. Mater. 30 2018 1706108 [12] R. Kuriki M. Yamamoto K. Higuchi Y. Yamamoto M. Akatsuka D.L. Lu S. Yagi T. Yoshida O. Ishitani K. Maeda Angew. Chem. Int. Ed. 129 2017 4945 4949 [13] M.F. Kuehnel K.L. Orchard K.E. Dalle E. Reisner J. Am. Chem. Soc. 139 2017 7217 7223 [14] K. Sekizawa S. Sato T. Arai T. Morikawa ACS Catal. 8 2018 1405 1416 [15] J. Zhou W.C. Chen C.Y. Sun L. Han C. Qin M.M. Chen X.L. Wang E.B. Wang Z.M. Su ACS Appl. Mater. Interfaces 9 2017 11689 11695 [16] C.Y. Sun W.P. To F.F. Hung X.L. Wang Z.M. Su C.M. Che Chem. Sci. 9 2018 2357 2364 [17] J. Zhao Q. Wang C.Y. Sun T.T. Zheng L.K. Yan M.T. Li K.Z. Shao X.L. Wang Z.M. Su J. Mater. Chem. A 5 2017 12498 12505 [18] F. Wang ChemSusChem 10 2017 4393 4402 [19] M.M. Chen L. Han J. Zhou C.Y. Sun C.Y. Hu X.L. Wang Z.M. Su Nanotechnology 29 2018 284003 [20] K.E. Kweon D. Manogaran G.S. Hwang ACS Catal. 4 2014 4051 4056 [21] J.L. White M.F. Baruch J.E. Pander Y. Hu I.C. Fortmeyer J.E. Park T. Zhang K. Liao J. Gu Y. Yan T.W. Shaw E. Abelev A.B. Bocarsly Chem. Rev. 115 2015 12888 12935 [22] Z.Q. Wang B. Wen Q.Q. Hao L.M. Liu C.Y. Zhou X.C. Mao X.F. Lang W.J. Yin D.X. Dai A. Selloni X.M. Yang J. Am. Chem. Soc. 137 2015 9146 9152 [23] Y. Wang N.Y. Huang J.Q. Shen P.Q. Liao X.M. Chen J.P. Zhang J. Am. Chem. Soc. 140 2018 38 41 [24] K.Y. Yan M.Z. Long T.K. Zhang Z.H. Wei H.N. Chen S.H. Yang J.B. Xu J. Am. Chem. Soc. 137 2015 4460 4468 [25] R. Ohmann L.K. Ono H.S. Kim H.P. Lin M.V. Lee Y.Y. Li N.G. Park Y.B. Qi J. Am. Chem. Soc. 137 2015 16049 16054 [26] M. Saliba T. Matsui K. Domanski J.Y. Seo A. Ummadisingu S.M. Zakeeruddin J.P. Correa-Baena W.R. Tress A. Abate A. Hagfeldt M. Grätzel Science 354 2016 206 209 [27] A. Swarnkar A.R. Marshall E.M. Sanehira B.D. Chernomordik D.T. Moore J.A. Christians T. Chakrabarti J.M. Luther Science 354 2016 92 95 [28] B. Yang J.S. Chen F. Hong X. Mao K.B. Zheng S.Q. Yang Y.J. Li T. Pullerits W.Q. Deng K.L. Han Angew. Chem. Int. Ed. 56 2017 12471 12475 [29] C. Sun G. Xu X.M. Jiang G.E. Wang P.Y. Guo M.S. Wang G.C. Guo J. Am. Chem. Soc. 140 2018 2805 2811 [30] Y. Tidhar E. Edri H. Weissman D. Zohar G. Hodes D. Cahen B. Rybtchinski S. Kirmayer J. Am. Chem. Soc. 136 2014 13249 13256 [31] R. Prasanna A. Gold-Parker T. Leijtens B. Conings A. Babayigit H.G. Boyen M.F. Toney M.D. McGehee J. Am. Chem. Soc. 139 2017 11117 11124 [32] J.Z. Song J.H. Li X.M. Li L.M. Xu Y.H. Dong H.B. Zeng Adv. Mater. 27 2015 7162 7167 [33] X.Y. Zhang H. Lin H. Huang C. Reckmeier Y. Zhang W.C.H. Choy A.L. Rogach Nano Lett. 16 2016 1415 1420 [34] J. Pan Y.Q. Shang J. Yin M.D. Bastiani W. Peng I. Dursun L. Sinatra A.M. El-Zohry M.N. Hedhili A.H. Emwas O.F. Mohammed Z.J. Ning O.M. Bakr J. Am. Chem. Soc. 140 2018 562 565 [35] W.C. Pan H.D. Wu J.J. Luo Z.Z. Deng C. Ge C. Chen X.W. Jiang W.J. Yin G.D. Niu L.J. Zhu L.X. Yin Y. Zhou Q.G. Xie X.X. Ke M.L. Sui J. Tang Nat. Photon. 11 2017 726 732 [36] M. Shoaib X.H. Zhang X.X. Wang H. Zhou T. Xu X. Wang X.L. Hu H.W. Liu X.P. Fan W.H. Zheng T.F. Yang S.Z. Yang Q.L. Zhang X.L. Zhu L.T. Sun A.L. Pan J. Am. Chem. Soc. 139 2017 15592 15595 [37] Z.Q. Yang Y.H. Deng X.W. Zhang S. Wang H.Z. Chen S. Yang J. Khurgin N.X. Fang X. Zhang R.M. Ma Adv. Mater. 30 2018 1704333 [38] A. Kojima K. Teshima Y. Shirai T. Miyasaka J. Am. Chem. Soc. 131 2009 6050 6051 [39] W.S. Yang B.W. Park E.H. Jung N.J. Jeon Y.C. Kim D.U. Lee S.S. Shin J. Seo E.K. Kim J.H. Noh S. Seok Science 356 2017 1376 1379 [40] S. Park W.J. Chang C.W. Lee S. Park H.Y. Ahn K.T. Nam Nat. Energy 2 2016 16185 [41] K. Chen X.H. Deng G. Dodekatos H. Tüysüz J. Am. Chem. Soc. 139 2017 12267 12273 [42] Y.F. Xu M.Z. Yang B.X. Chen X.D. Wang H.Y. Chen D.B. Kuang C.Y. Su J. Am. Chem. Soc. 139 2017 5660 5663 [43] H. Huang H. Yuan K.P.F. Janssen G. Solís-Fernandez Y. Wang C.Y.X. Tan D. Jonckheere E. Debroye J. Long J. Hendrix J. Hofkens J.A. Steele M.B.J. Roeffaers ACS Energy Lett. 3 2018 755 759 [44] Y.Q. Wu P. Wang X.L. Zhu Q.Q. Zhang Z.Y. Wang Y.Y. Liu G.Z. Zou Y. Dai M.H. Whangbo B.B. Huang Adv. Mater. 30 2018 1704342 [45] L. Wang H. Xiao T. Cheng Y.Y. Li W.A. Goddard J. Am. Chem. Soc. 140 2018 1994 1997 [46] J.G. Hou S.Y. Cao Y.Z. Wu Z.M. Gao F. Liang Y.Q. Sun Z.S. Lin L.C. Sun Chem. Eur. J. 23 2017 9481 9485 [47] Y. Wang X.M. Li J.Z. Song L. Xiao H.B. Zeng H.D. Sun Adv. Mater. 27 2015 7101 7108 [48] L. Protesescu S. Yakunin M.I. Bodnarchuk F. Bertolotti N. Masciocchi A. Guagliardi M.V. Kovalenko J. Am. Chem. Soc. 138 2016 14202 14205 [49] E. Debroye J.V. Loon H.F. Yuan K.P.F. Janssen Z.Z. Lou S. Kim T. Majima M.B.J. Roeffaers J. Phys. Chem. Lett. 8 2017 340 346 [50] J. Chang R. Ahmed H.X. Wang H.W. Liu R.Z. Li P. Wang E.R. Waclawik J. Phys. Chem. C 117 2013 13836 13844 [51] J. Liu Y. Liu N.Y. Liu Y.Z. Han X. Zhang H. Huang Y. Lifshitz S.T. Lee J. Zhong Z.H. Kang Science 347 2015 970 974 [52] L. Protesescu S. Yakunin M.I. Bodnarchuk F. Krieg R. Caputo C.H. Hendon R.X. Yang A. Walsh M.V. Kovalenko Nano Lett. 15 2015 3692 3696 [53] X.B. Chen L. Liu P.Y. Yu S.S. Mao Science 331 2011 746 750",
      "scopus-id": "85056884980",
      "coredata": {
        "eid": "1-s2.0-S0021951718304342",
        "dc:description": "Development of efficient, selective and low-cost photocatalysts, ideally constructed from Earth-abundant elements, is still a big challenge for CO2 photoreduction. Herein, adopting mixed halides strategy, the activity of all-inorganic perovskites toward CO2 reduction is enhanced sharply under simulated sunlight without photosensitizer, meanwhile maintaining high selectivity of CO and CH4 production. Via regulating ratio of Br and Cl, the yield of CO and CH4 changes obviously and the optimized catalyst is CsPb(Br0.5/Cl0.5)3 with a total yield of CO and CH4 up to 875 μmol/g (selectivity of 99%) which outperforms any other reported halide perovskites and is 4.5 and 9.1 folds higher than that of CsPbBr3 and CsPbCl3 under the same condition. The efficient charge separation and moderate stability in mixed-halide perovskites may account for the excellent performance in CO2 reduction. This study may provide a new strategy in design of high performance and low-cost halide perovskite materials for photocatalysis.",
        "openArchiveArticle": "false",
        "prism:coverDate": "2019-01-31",
        "openaccessUserLicense": null,
        "prism:aggregationType": "Journal",
        "prism:url": "https://api.elsevier.com/content/article/pii/S0021951718304342",
        "dc:creator": [
          {
            "@_fa": "true",
            "$": "Guo, Shao-Hong"
          },
          {
            "@_fa": "true",
            "$": "Zhou, Jie"
          },
          {
            "@_fa": "true",
            "$": "Zhao, Xue"
          },
          {
            "@_fa": "true",
            "$": "Sun, Chun-Yi"
          },
          {
            "@_fa": "true",
            "$": "You, Si-Qi"
          },
          {
            "@_fa": "true",
            "$": "Wang, Xin-Long"
          },
          {
            "@_fa": "true",
            "$": "Su, Zhong-Min"
          }
        ],
        "link": [
          {
            "@_fa": "true",
            "@rel": "self",
            "@href": "https://api.elsevier.com/content/article/pii/S0021951718304342"
          },
          {
            "@_fa": "true",
            "@rel": "scidir",
            "@href": "https://www.sciencedirect.com/science/article/pii/S0021951718304342"
          }
        ],
        "dc:format": "application/json",
        "openaccessType": null,
        "pii": "S0021-9517(18)30434-2",
        "prism:volume": "369",
        "prism:publisher": "Elsevier Inc.",
        "dc:title": "Enhanced CO2 photoreduction via tuning halides in perovskites",
        "prism:copyright": "© 2018 Elsevier Inc. All rights reserved.",
        "openaccess": "0",
        "prism:issn": "00219517",
        "dcterms:subject": [
          {
            "@_fa": "true",
            "$": "Mixed-halide perovskites"
          },
          {
            "@_fa": "true",
            "$": "CO2 reduction"
          },
          {
            "@_fa": "true",
            "$": "Photocatalysis"
          },
          {
            "@_fa": "true",
            "$": "Simulated sunlight"
          }
        ],
        "openaccessArticle": "false",
        "prism:publicationName": "Journal of Catalysis",
        "openaccessSponsorType": null,
        "prism:pageRange": "201-208",
        "prism:endingPage": "208",
        "pubType": "fla",
        "prism:coverDisplayDate": "January 2019",
        "prism:doi": "10.1016/j.jcat.2018.11.004",
        "prism:startingPage": "201",
        "dc:identifier": "doi:10.1016/j.jcat.2018.11.004",
        "openaccessSponsorName": null
      },
      "objects": {
        "object": [
          {
            "@category": "standard",
            "@height": "200",
            "@width": "404",
            "@_fa": "true",
            "$": "https://api.elsevier.com/content/object/eid/1-s2.0-S0021951718304342-ga1.jpg?httpAccept=%2A%2F%2A",
            "@multimediatype": "JPEG image file",
            "@type": "IMAGE-DOWNSAMPLED",
            "@size": "29199",
            "@ref": "ga1",
            "@mimetype": "image/jpeg"
          },
          {
            "@category": "standard",
            "@height": "241",
            "@width": "355",
            "@_fa": "true",
            "$": "https://api.elsevier.com/content/object/eid/1-s2.0-S0021951718304342-gr1.jpg?httpAccept=%2A%2F%2A",
            "@multimediatype": "JPEG image file",
            "@type": "IMAGE-DOWNSAMPLED",
            "@size": "29795",
            "@ref": "gr1",
            "@mimetype": "image/jpeg"
          },
          {
            "@category": "standard",
            "@height": "805",
            "@width": "547",
            "@_fa": "true",
            "$": "https://api.elsevier.com/content/object/eid/1-s2.0-S0021951718304342-gr2.jpg?httpAccept=%2A%2F%2A",
            "@multimediatype": "JPEG image file",
            "@type": "IMAGE-DOWNSAMPLED",
            "@size": "189436",
            "@ref": "gr2",
            "@mimetype": "image/jpeg"
          },
          {
            "@category": "standard",
            "@height": "441",
            "@width": "546",
            "@_fa": "true",
            "$": "https://api.elsevier.com/content/object/eid/1-s2.0-S0021951718304342-gr3.jpg?httpAccept=%2A%2F%2A",
            "@multimediatype": "JPEG image file",
            "@type": "IMAGE-DOWNSAMPLED",
            "@size": "111381",
            "@ref": "gr3",
            "@mimetype": "image/jpeg"
          },
          {
            "@category": "standard",
            "@height": "442",
            "@width": "542",
            "@_fa": "true",
            "$": "https://api.elsevier.com/content/object/eid/1-s2.0-S0021951718304342-gr4.jpg?httpAccept=%2A%2F%2A",
            "@multimediatype": "JPEG image file",
            "@type": "IMAGE-DOWNSAMPLED",
            "@size": "79636",
            "@ref": "gr4",
            "@mimetype": "image/jpeg"
          },
          {
            "@category": "standard",
            "@height": "200",
            "@width": "543",
            "@_fa": "true",
            "$": "https://api.elsevier.com/content/object/eid/1-s2.0-S0021951718304342-gr5.jpg?httpAccept=%2A%2F%2A",
            "@multimediatype": "JPEG image file",
            "@type": "IMAGE-DOWNSAMPLED",
            "@size": "29208",
            "@ref": "gr5",
            "@mimetype": "image/jpeg"
          },
          {
            "@category": "standard",
            "@height": "248",
            "@width": "311",
            "@_fa": "true",
            "$": "https://api.elsevier.com/content/object/eid/1-s2.0-S0021951718304342-gr6.jpg?httpAccept=%2A%2F%2A",
            "@multimediatype": "JPEG image file",
            "@type": "IMAGE-DOWNSAMPLED",
            "@size": "7432",
            "@ref": "gr6",
            "@mimetype": "image/jpeg"
          },
          {
            "@category": "standard",
            "@height": "560",
            "@width": "364",
            "@_fa": "true",
            "$": "https://api.elsevier.com/content/object/eid/1-s2.0-S0021951718304342-gr7.jpg?httpAccept=%2A%2F%2A",
            "@multimediatype": "JPEG image file",
            "@type": "IMAGE-DOWNSAMPLED",
            "@size": "64716",
            "@ref": "gr7",
            "@mimetype": "image/jpeg"
          },
          {
            "@category": "thumbnail",
            "@height": "108",
            "@width": "219",
            "@_fa": "true",
            "$": "https://api.elsevier.com/content/object/eid/1-s2.0-S0021951718304342-ga1.sml?httpAccept=%2A%2F%2A",
            "@multimediatype": "GIF image file",
            "@type": "IMAGE-THUMBNAIL",
            "@size": "13365",
            "@ref": "ga1",
            "@mimetype": "image/gif"
          },
          {
            "@category": "thumbnail",
            "@height": "149",
            "@width": "219",
            "@_fa": "true",
            "$": "https://api.elsevier.com/content/object/eid/1-s2.0-S0021951718304342-gr1.sml?httpAccept=%2A%2F%2A",
            "@multimediatype": "GIF image file",
            "@type": "IMAGE-THUMBNAIL",
            "@size": "17188",
            "@ref": "gr1",
            "@mimetype": "image/gif"
          },
          {
            "@category": "thumbnail",
            "@height": "163",
            "@width": "111",
            "@_fa": "true",
            "$": "https://api.elsevier.com/content/object/eid/1-s2.0-S0021951718304342-gr2.sml?httpAccept=%2A%2F%2A",
            "@multimediatype": "GIF image file",
            "@type": "IMAGE-THUMBNAIL",
            "@size": "11669",
            "@ref": "gr2",
            "@mimetype": "image/gif"
          },
          {
            "@category": "thumbnail",
            "@height": "164",
            "@width": "203",
            "@_fa": "true",
            "$": "https://api.elsevier.com/content/object/eid/1-s2.0-S0021951718304342-gr3.sml?httpAccept=%2A%2F%2A",
            "@multimediatype": "GIF image file",
            "@type": "IMAGE-THUMBNAIL",
            "@size": "16212",
            "@ref": "gr3",
            "@mimetype": "image/gif"
          },
          {
            "@category": "thumbnail",
            "@height": "164",
            "@width": "201",
            "@_fa": "true",
            "$": "https://api.elsevier.com/content/object/eid/1-s2.0-S0021951718304342-gr4.sml?httpAccept=%2A%2F%2A",
            "@multimediatype": "GIF image file",
            "@type": "IMAGE-THUMBNAIL",
            "@size": "11933",
            "@ref": "gr4",
            "@mimetype": "image/gif"
          },
          {
            "@category": "thumbnail",
            "@height": "81",
            "@width": "219",
            "@_fa": "true",
            "$": "https://api.elsevier.com/content/object/eid/1-s2.0-S0021951718304342-gr5.sml?httpAccept=%2A%2F%2A",
            "@multimediatype": "GIF image file",
            "@type": "IMAGE-THUMBNAIL",
            "@size": "5301",
            "@ref": "gr5",
            "@mimetype": "image/gif"
          },
          {
            "@category": "thumbnail",
            "@height": "163",
            "@width": "205",
            "@_fa": "true",
            "$": "https://api.elsevier.com/content/object/eid/1-s2.0-S0021951718304342-gr6.sml?httpAccept=%2A%2F%2A",
            "@multimediatype": "GIF image file",
            "@type": "IMAGE-THUMBNAIL",
            "@size": "3247",
            "@ref": "gr6",
            "@mimetype": "image/gif"
          },
          {
            "@category": "thumbnail",
            "@height": "163",
            "@width": "106",
            "@_fa": "true",
            "$": "https://api.elsevier.com/content/object/eid/1-s2.0-S0021951718304342-gr7.sml?httpAccept=%2A%2F%2A",
            "@multimediatype": "GIF image file",
            "@type": "IMAGE-THUMBNAIL",
            "@size": "7911",
            "@ref": "gr7",
            "@mimetype": "image/gif"
          },
          {
            "@category": "high",
            "@height": "531",
            "@width": "1073",
            "@_fa": "true",
            "$": "https://api.elsevier.com/content/object/eid/1-s2.0-S0021951718304342-ga1_lrg.jpg?httpAccept=%2A%2F%2A",
            "@multimediatype": "JPEG image file",
            "@type": "IMAGE-HIGH-RES",
            "@size": "94326",
            "@ref": "ga1",
            "@mimetype": "image/jpeg"
          },
          {
            "@category": "high",
            "@height": "1069",
            "@width": "1575",
            "@_fa": "true",
            "$": "https://api.elsevier.com/content/object/eid/1-s2.0-S0021951718304342-gr1_lrg.jpg?httpAccept=%2A%2F%2A",
            "@multimediatype": "JPEG image file",
            "@type": "IMAGE-HIGH-RES",
            "@size": "198270",
            "@ref": "gr1",
            "@mimetype": "image/jpeg"
          },
          {
            "@category": "high",
            "@height": "3562",
            "@width": "2421",
            "@_fa": "true",
            "$": "https://api.elsevier.com/content/object/eid/1-s2.0-S0021951718304342-gr2_lrg.jpg?httpAccept=%2A%2F%2A",
            "@multimediatype": "JPEG image file",
            "@type": "IMAGE-HIGH-RES",
            "@size": "1399422",
            "@ref": "gr2",
            "@mimetype": "image/jpeg"
          },
          {
            "@category": "high",
            "@height": "1955",
            "@width": "2418",
            "@_fa": "true",
            "$": "https://api.elsevier.com/content/object/eid/1-s2.0-S0021951718304342-gr3_lrg.jpg?httpAccept=%2A%2F%2A",
            "@multimediatype": "JPEG image file",
            "@type": "IMAGE-HIGH-RES",
            "@size": "767534",
            "@ref": "gr3",
            "@mimetype": "image/jpeg"
          },
          {
            "@category": "high",
            "@height": "1959",
            "@width": "2402",
            "@_fa": "true",
            "$": "https://api.elsevier.com/content/object/eid/1-s2.0-S0021951718304342-gr4_lrg.jpg?httpAccept=%2A%2F%2A",
            "@multimediatype": "JPEG image file",
            "@type": "IMAGE-HIGH-RES",
            "@size": "502122",
            "@ref": "gr4",
            "@mimetype": "image/jpeg"
          },
          {
            "@category": "high",
            "@height": "887",
            "@width": "2406",
            "@_fa": "true",
            "$": "https://api.elsevier.com/content/object/eid/1-s2.0-S0021951718304342-gr5_lrg.jpg?httpAccept=%2A%2F%2A",
            "@multimediatype": "JPEG image file",
            "@type": "IMAGE-HIGH-RES",
            "@size": "174702",
            "@ref": "gr5",
            "@mimetype": "image/jpeg"
          },
          {
            "@category": "high",
            "@height": "1099",
            "@width": "1378",
            "@_fa": "true",
            "$": "https://api.elsevier.com/content/object/eid/1-s2.0-S0021951718304342-gr6_lrg.jpg?httpAccept=%2A%2F%2A",
            "@multimediatype": "JPEG image file",
            "@type": "IMAGE-HIGH-RES",
            "@size": "55204",
            "@ref": "gr6",
            "@mimetype": "image/jpeg"
          },
          {
            "@category": "high",
            "@height": "2481",
            "@width": "1614",
            "@_fa": "true",
            "$": "https://api.elsevier.com/content/object/eid/1-s2.0-S0021951718304342-gr7_lrg.jpg?httpAccept=%2A%2F%2A",
            "@multimediatype": "JPEG image file",
            "@type": "IMAGE-HIGH-RES",
            "@size": "459949",
            "@ref": "gr7",
            "@mimetype": "image/jpeg"
          },
          {
            "@category": "standard",
            "@_fa": "true",
            "$": "https://api.elsevier.com/content/object/eid/1-s2.0-S0021951718304342-mmc1.doc?httpAccept=%2A%2F%2A",
            "@multimediatype": "Microsoft Word file",
            "@type": "APPLICATION",
            "@size": "2339758",
            "@ref": "mmc1",
            "@mimetype": "application/word"
          },
          {
            "@category": "thumbnail",
            "@height": "18",
            "@width": "107",
            "@_fa": "true",
            "$": "https://api.elsevier.com/content/object/eid/1-s2.0-S0021951718304342-si1.gif?httpAccept=%2A%2F%2A",
            "@multimediatype": "GIF image file",
            "@type": "ALTIMG",
            "@size": "517",
            "@ref": "si1",
            "@mimetype": "image/gif"
          },
          {
            "@category": "standard",
            "@_fa": "true",
            "$": "https://api.elsevier.com/content/object/eid/1-s2.0-S0021951718304342-am.pdf?httpAccept=%2A%2F%2A",
            "@multimediatype": "Acrobat PDF file",
            "@type": "AAM-PDF",
            "@size": "3532449",
            "@ref": "am",
            "@mimetype": "application/pdf"
          }
        ]
      },
      "link": {
        "@rel": "abstract",
        "@href": "https://api.elsevier.com/content/abstract/scopus_id/85056884980"
      }
    }
  }
}