{
  "metadata": {
    "title": "Structure-activity relationships of carbon-supported platinum-bismuth and platinum-antimony oxidation catalysts",
    "authors": "; ; ",
    "journal": "Journal of Catalysis",
    "date": "2017-04-30",
    "doi": "10.1016/j.jcat.2017.02.003",
    "abstract": "",
    "uri": "https://api.elsevier.com/content/article/pii/S0021951717300374",
    "pii": "S0021951717300374"
  },
  "fulltext": {
    "full-text-retrieval-response": {
      "scopus-eid": "2-s2.0-85014352288",
      "originalText": "serial JL 272561 291210 291744 291809 31 Journal of Catalysis JOURNALCATALYSIS 2017-03-06 2017-03-06 2017-03-06 2017-03-06 2017-12-14T13:19:41 1-s2.0-S0021951717300374 S0021-9517(17)30037-4 S0021951717300374 10.1016/j.jcat.2017.02.003 S300 S300.3 FULL-TEXT 1-s2.0-S0021951717X00031 2017-12-14T13:59:43.52726Z 0 0 20170401 20170430 2017 2017-03-06T11:38:24.855489Z absattachment articleinfo articletitlenorm authfirstinitialnorm authfirstsurnamenorm cid cids contenttype copyright crossmark dateloaded dateloadedtxt datesearch datesort dateupdated dco docsubtype doctype doi eid ewtransactionid hubeid indexeddate issn issnnorm itemstage itemtransactionid itemweight openaccess openarchive pg pgfirst pglast pii piinorm pubdateend pubdatestart pubdatetxt pubyr sectiontitle sortorder srctitle srctitlenorm srctype ssids alllist content subj subheadings suppl tomb volfirst volissue volumelist webpdf webpdfpagecount yearnav figure table e-component body mmlmath acknowledge affil appendices articletitle auth authfirstini authfull authkeywords authlast grantsponsor highlightsabst otherkwds primabst ref specialabst 0021-9517 00219517 true 348 348 C Volume 348 11 47 58 47 58 201704 April 2017 2017-04-01 2017-04-30 2017 Regular Articles article fla © 2017 Elsevier Inc. All rights reserved. STRUCTUREACTIVITYRELATIONSHIPSCARBONSUPPORTEDPLATINUMBISMUTHPLATINUMANTIMONYOXIDATIONCATALYSTS MAPHORU M 1 Introduction 2 Experimental 2.1 Materials 2.2 Synthesis of nanocomposites 2.3 Characterization of nanocomposites 2.4 Oxidation reactions, product separation, product characterization and determination of catalyst performance 3 Results and discussion 3.1 Characterization of the nanocomposites 3.2 Thermal analysis of the AC support and the nanocomposite materials 3.3 Oxidation of 2-methyl-1-naphthol 4 Conclusions Acknowledgements Appendix A Supplementary material MOL files References RODRIGUEZREINOSO 1998 159 F AUER 1998 259 E ZHANG 2004 3209 S ANTOLINI 2009 1 E YU 2010 7354 X CAMPELO 2009 18 J AMIN 2011 4572 R FRANCESCO 2014 2784 I WU 2014 2762 Z CHEN 2005 124 W KO 2005 727 F LI 2013 2996 H KAWASAKI 2013 5 H DAILLY 2002 4207 A JI 2010 286 X YU 2011 7951 X PAN 2011 6228 C MONIZ 2012 328 S MALLAT 1995 131 T MALLAT 2004 3037 T HAAN 2010 11665 J VIDALIGLESIAS 2013 964 F MAPHORU 2014 99 M MAPHORU 2016 M LANGA 2016 755 S HASSAN 2002 1359 J TAKEYA 2004 10681 T MATVEEV 1996 151 K ZALOMAEVA 2007 185 O SELVARAJ 2010 377 M SELVARAJ 2012 9633 M WEBER 2003 155 F ULLMANNSENCYCLOPEDIAINDUSTRIALCHEMISTRY KHOLDEEVA 2005 62 O STRUKUL 2009 162 G KRAL 1993 1401 A ZHU 2010 2118 Y WELHAM 1998 1309 N HUSSAIN 2000 177 R MALOBELA 2014 13910 L MOONEYSLATER 1962 371 R CHEN 2013 328 H BROCKNER 2002 1911 W GENG 2005 8503 J LI 2014 344 Z AREPALLI 2004 1783 S MATHUR 2007 132 R JIANG 2000 85 W HONG 2006 266 K CHAJARA 2010 2275 K CHARSLEY 1982 382 E LAINE 1963 2030 N KOZUCH 2012 2787 S LENTE 2013 381 G ANDERSON 2003 517 R KREJA 1984 247 L HASNAT 2010 286 M MAPHORUX2017X47 MAPHORUX2017X47X58 MAPHORUX2017X47XM MAPHORUX2017X47X58XM 2019-03-06T00:00:00.000Z UnderEmbargo http://creativecommons.org/licenses/by-nc-nd/4.0/ © 2017 Elsevier Inc. All rights reserved. item S0021-9517(17)30037-4 S0021951717300374 1-s2.0-S0021951717300374 10.1016/j.jcat.2017.02.003 272561 2017-12-14T13:59:43.52726Z 2017-04-01 2017-04-30 1-s2.0-S0021951717300374-main.pdf https://s3-eu-west-1.amazonaws.com/prod-ucs-content-store-eu-west/content/pii:S0021951717300374/MAIN/application/pdf/aa6977bf09a2fb60e2a074ea8064df50/main.pdf https://s3.amazonaws.com/prod-ucs-content-store-us-east/content/pii:S0021951717300374/MAIN/application/pdf/aa6977bf09a2fb60e2a074ea8064df50/main.pdf main.pdf pdf true 7345888 MAIN 12 1-s2.0-S0021951717300374-main_1.png https://s3-eu-west-1.amazonaws.com/prod-ucs-content-store-eu-west/content/pii:S0021951717300374/PREVIEW/image/png/ec7c60a5dff806825f4f8b25aad6521a/main_1.png https://s3.amazonaws.com/prod-ucs-content-store-us-east/content/pii:S0021951717300374/PREVIEW/image/png/ec7c60a5dff806825f4f8b25aad6521a/main_1.png main_1.png png 55689 849 656 IMAGE-WEB-PDF 1 1-s2.0-S0021951717300374-fx1.sml https://s3-eu-west-1.amazonaws.com/prod-ucs-content-store-eu-west/content/pii:S0021951717300374/fx1/THUMBNAIL/image/gif/db00a71dec7489269c7b1de660e38189/fx1.sml https://s3.amazonaws.com/prod-ucs-content-store-us-east/content/pii:S0021951717300374/fx1/THUMBNAIL/image/gif/db00a71dec7489269c7b1de660e38189/fx1.sml fx1 true fx1.sml sml 9947 88 219 IMAGE-THUMBNAIL 1-s2.0-S0021951717300374-gr1.sml https://s3-eu-west-1.amazonaws.com/prod-ucs-content-store-eu-west/content/pii:S0021951717300374/gr1/THUMBNAIL/image/gif/437b98f8511b8ceececdb5f8e0619ab8/gr1.sml https://s3.amazonaws.com/prod-ucs-content-store-us-east/content/pii:S0021951717300374/gr1/THUMBNAIL/image/gif/437b98f8511b8ceececdb5f8e0619ab8/gr1.sml gr1 gr1.sml sml 6674 89 219 IMAGE-THUMBNAIL 1-s2.0-S0021951717300374-gr10.sml https://s3-eu-west-1.amazonaws.com/prod-ucs-content-store-eu-west/content/pii:S0021951717300374/gr10/THUMBNAIL/image/gif/34e93ed3d71d2114ad0f62a81efa90d1/gr10.sml https://s3.amazonaws.com/prod-ucs-content-store-us-east/content/pii:S0021951717300374/gr10/THUMBNAIL/image/gif/34e93ed3d71d2114ad0f62a81efa90d1/gr10.sml gr10 gr10.sml sml 6732 88 219 IMAGE-THUMBNAIL 1-s2.0-S0021951717300374-gr11.sml https://s3-eu-west-1.amazonaws.com/prod-ucs-content-store-eu-west/content/pii:S0021951717300374/gr11/THUMBNAIL/image/gif/d2fa6ce4f4b8e05e0fe4fa3f03b4e6ea/gr11.sml https://s3.amazonaws.com/prod-ucs-content-store-us-east/content/pii:S0021951717300374/gr11/THUMBNAIL/image/gif/d2fa6ce4f4b8e05e0fe4fa3f03b4e6ea/gr11.sml gr11 gr11.sml sml 3740 92 219 IMAGE-THUMBNAIL 1-s2.0-S0021951717300374-gr2.sml https://s3-eu-west-1.amazonaws.com/prod-ucs-content-store-eu-west/content/pii:S0021951717300374/gr2/THUMBNAIL/image/gif/20bec1caba5c501ddd0ab30e3ce2df8f/gr2.sml https://s3.amazonaws.com/prod-ucs-content-store-us-east/content/pii:S0021951717300374/gr2/THUMBNAIL/image/gif/20bec1caba5c501ddd0ab30e3ce2df8f/gr2.sml gr2 gr2.sml sml 12843 163 136 IMAGE-THUMBNAIL 1-s2.0-S0021951717300374-gr3.sml https://s3-eu-west-1.amazonaws.com/prod-ucs-content-store-eu-west/content/pii:S0021951717300374/gr3/THUMBNAIL/image/gif/5d73dead24426a8cfedab70ed3b032d6/gr3.sml https://s3.amazonaws.com/prod-ucs-content-store-us-east/content/pii:S0021951717300374/gr3/THUMBNAIL/image/gif/5d73dead24426a8cfedab70ed3b032d6/gr3.sml gr3 gr3.sml sml 16524 163 133 IMAGE-THUMBNAIL 1-s2.0-S0021951717300374-gr4.sml https://s3-eu-west-1.amazonaws.com/prod-ucs-content-store-eu-west/content/pii:S0021951717300374/gr4/THUMBNAIL/image/gif/d4d6b6b5f03779fc424e7fa0c1e89376/gr4.sml https://s3.amazonaws.com/prod-ucs-content-store-us-east/content/pii:S0021951717300374/gr4/THUMBNAIL/image/gif/d4d6b6b5f03779fc424e7fa0c1e89376/gr4.sml gr4 gr4.sml sml 9060 58 219 IMAGE-THUMBNAIL 1-s2.0-S0021951717300374-gr5.sml https://s3-eu-west-1.amazonaws.com/prod-ucs-content-store-eu-west/content/pii:S0021951717300374/gr5/THUMBNAIL/image/gif/35e40f343962edc188ee0d0193ee3842/gr5.sml https://s3.amazonaws.com/prod-ucs-content-store-us-east/content/pii:S0021951717300374/gr5/THUMBNAIL/image/gif/35e40f343962edc188ee0d0193ee3842/gr5.sml gr5 gr5.sml sml 15866 164 196 IMAGE-THUMBNAIL 1-s2.0-S0021951717300374-gr6.sml https://s3-eu-west-1.amazonaws.com/prod-ucs-content-store-eu-west/content/pii:S0021951717300374/gr6/THUMBNAIL/image/gif/72dc472238e752dbb83e72663ad5aad4/gr6.sml https://s3.amazonaws.com/prod-ucs-content-store-us-east/content/pii:S0021951717300374/gr6/THUMBNAIL/image/gif/72dc472238e752dbb83e72663ad5aad4/gr6.sml gr6 gr6.sml sml 23072 164 206 IMAGE-THUMBNAIL 1-s2.0-S0021951717300374-gr7.sml https://s3-eu-west-1.amazonaws.com/prod-ucs-content-store-eu-west/content/pii:S0021951717300374/gr7/THUMBNAIL/image/gif/100ba4ae45ddc6b46ffde09aec36340d/gr7.sml https://s3.amazonaws.com/prod-ucs-content-store-us-east/content/pii:S0021951717300374/gr7/THUMBNAIL/image/gif/100ba4ae45ddc6b46ffde09aec36340d/gr7.sml gr7 gr7.sml sml 6865 98 219 IMAGE-THUMBNAIL 1-s2.0-S0021951717300374-gr8.sml https://s3-eu-west-1.amazonaws.com/prod-ucs-content-store-eu-west/content/pii:S0021951717300374/gr8/THUMBNAIL/image/gif/a5467c332efede3100f6e71c068b41a3/gr8.sml https://s3.amazonaws.com/prod-ucs-content-store-us-east/content/pii:S0021951717300374/gr8/THUMBNAIL/image/gif/a5467c332efede3100f6e71c068b41a3/gr8.sml gr8 gr8.sml sml 4524 130 219 IMAGE-THUMBNAIL 1-s2.0-S0021951717300374-gr9.sml https://s3-eu-west-1.amazonaws.com/prod-ucs-content-store-eu-west/content/pii:S0021951717300374/gr9/THUMBNAIL/image/gif/4b12941265cea48885aae839a03f9529/gr9.sml https://s3.amazonaws.com/prod-ucs-content-store-us-east/content/pii:S0021951717300374/gr9/THUMBNAIL/image/gif/4b12941265cea48885aae839a03f9529/gr9.sml gr9 gr9.sml sml 5208 125 219 IMAGE-THUMBNAIL 1-s2.0-S0021951717300374-fx1.jpg https://s3-eu-west-1.amazonaws.com/prod-ucs-content-store-eu-west/content/pii:S0021951717300374/fx1/DOWNSAMPLED/image/jpeg/1f3f90223c0ca42de066ca53a068a9ab/fx1.jpg https://s3.amazonaws.com/prod-ucs-content-store-us-east/content/pii:S0021951717300374/fx1/DOWNSAMPLED/image/jpeg/1f3f90223c0ca42de066ca53a068a9ab/fx1.jpg fx1 true fx1.jpg jpg 23469 200 500 IMAGE-DOWNSAMPLED 1-s2.0-S0021951717300374-gr1.jpg https://s3-eu-west-1.amazonaws.com/prod-ucs-content-store-eu-west/content/pii:S0021951717300374/gr1/DOWNSAMPLED/image/jpeg/50219dae17cd7792de742a7d82cd0f55/gr1.jpg https://s3.amazonaws.com/prod-ucs-content-store-us-east/content/pii:S0021951717300374/gr1/DOWNSAMPLED/image/jpeg/50219dae17cd7792de742a7d82cd0f55/gr1.jpg gr1 gr1.jpg jpg 43649 236 582 IMAGE-DOWNSAMPLED 1-s2.0-S0021951717300374-gr10.jpg https://s3-eu-west-1.amazonaws.com/prod-ucs-content-store-eu-west/content/pii:S0021951717300374/gr10/DOWNSAMPLED/image/jpeg/071a0406a5f856c93c9dcc4811a4399a/gr10.jpg https://s3.amazonaws.com/prod-ucs-content-store-us-east/content/pii:S0021951717300374/gr10/DOWNSAMPLED/image/jpeg/071a0406a5f856c93c9dcc4811a4399a/gr10.jpg gr10 gr10.jpg jpg 52351 268 667 IMAGE-DOWNSAMPLED 1-s2.0-S0021951717300374-gr11.jpg https://s3-eu-west-1.amazonaws.com/prod-ucs-content-store-eu-west/content/pii:S0021951717300374/gr11/DOWNSAMPLED/image/jpeg/269f46b5479aeaf9dd1fc5849ee38ba7/gr11.jpg https://s3.amazonaws.com/prod-ucs-content-store-us-east/content/pii:S0021951717300374/gr11/DOWNSAMPLED/image/jpeg/269f46b5479aeaf9dd1fc5849ee38ba7/gr11.jpg gr11 gr11.jpg jpg 19688 225 533 IMAGE-DOWNSAMPLED 1-s2.0-S0021951717300374-gr2.jpg https://s3-eu-west-1.amazonaws.com/prod-ucs-content-store-eu-west/content/pii:S0021951717300374/gr2/DOWNSAMPLED/image/jpeg/70bebf0aef3efb47263797328abef0a1/gr2.jpg https://s3.amazonaws.com/prod-ucs-content-store-us-east/content/pii:S0021951717300374/gr2/DOWNSAMPLED/image/jpeg/70bebf0aef3efb47263797328abef0a1/gr2.jpg gr2 gr2.jpg jpg 194123 881 734 IMAGE-DOWNSAMPLED 1-s2.0-S0021951717300374-gr3.jpg https://s3-eu-west-1.amazonaws.com/prod-ucs-content-store-eu-west/content/pii:S0021951717300374/gr3/DOWNSAMPLED/image/jpeg/694dbb0ae0777c40c1259c56103b2712/gr3.jpg https://s3.amazonaws.com/prod-ucs-content-store-us-east/content/pii:S0021951717300374/gr3/DOWNSAMPLED/image/jpeg/694dbb0ae0777c40c1259c56103b2712/gr3.jpg gr3 gr3.jpg jpg 193693 709 578 IMAGE-DOWNSAMPLED 1-s2.0-S0021951717300374-gr4.jpg https://s3-eu-west-1.amazonaws.com/prod-ucs-content-store-eu-west/content/pii:S0021951717300374/gr4/DOWNSAMPLED/image/jpeg/306076955caf85f3596671ba947d28e9/gr4.jpg https://s3.amazonaws.com/prod-ucs-content-store-us-east/content/pii:S0021951717300374/gr4/DOWNSAMPLED/image/jpeg/306076955caf85f3596671ba947d28e9/gr4.jpg gr4 gr4.jpg jpg 45404 165 622 IMAGE-DOWNSAMPLED 1-s2.0-S0021951717300374-gr5.jpg https://s3-eu-west-1.amazonaws.com/prod-ucs-content-store-eu-west/content/pii:S0021951717300374/gr5/DOWNSAMPLED/image/jpeg/c55686e9cf2bf01a4ef35e4a9730ad29/gr5.jpg https://s3.amazonaws.com/prod-ucs-content-store-us-east/content/pii:S0021951717300374/gr5/DOWNSAMPLED/image/jpeg/c55686e9cf2bf01a4ef35e4a9730ad29/gr5.jpg gr5 gr5.jpg jpg 139951 610 729 IMAGE-DOWNSAMPLED 1-s2.0-S0021951717300374-gr6.jpg https://s3-eu-west-1.amazonaws.com/prod-ucs-content-store-eu-west/content/pii:S0021951717300374/gr6/DOWNSAMPLED/image/jpeg/9b28f37f61b065efc8ca14666a2dcfea/gr6.jpg https://s3.amazonaws.com/prod-ucs-content-store-us-east/content/pii:S0021951717300374/gr6/DOWNSAMPLED/image/jpeg/9b28f37f61b065efc8ca14666a2dcfea/gr6.jpg gr6 gr6.jpg jpg 117555 459 578 IMAGE-DOWNSAMPLED 1-s2.0-S0021951717300374-gr7.jpg https://s3-eu-west-1.amazonaws.com/prod-ucs-content-store-eu-west/content/pii:S0021951717300374/gr7/DOWNSAMPLED/image/jpeg/1d8066ec041f85f9c6a25dacd35e9893/gr7.jpg https://s3.amazonaws.com/prod-ucs-content-store-us-east/content/pii:S0021951717300374/gr7/DOWNSAMPLED/image/jpeg/1d8066ec041f85f9c6a25dacd35e9893/gr7.jpg gr7 gr7.jpg jpg 39409 240 533 IMAGE-DOWNSAMPLED 1-s2.0-S0021951717300374-gr8.jpg https://s3-eu-west-1.amazonaws.com/prod-ucs-content-store-eu-west/content/pii:S0021951717300374/gr8/DOWNSAMPLED/image/jpeg/0ccdcec7a90559b8596fd8f1d4ee92fe/gr8.jpg https://s3.amazonaws.com/prod-ucs-content-store-us-east/content/pii:S0021951717300374/gr8/DOWNSAMPLED/image/jpeg/0ccdcec7a90559b8596fd8f1d4ee92fe/gr8.jpg gr8 gr8.jpg jpg 13201 209 353 IMAGE-DOWNSAMPLED 1-s2.0-S0021951717300374-gr9.jpg https://s3-eu-west-1.amazonaws.com/prod-ucs-content-store-eu-west/content/pii:S0021951717300374/gr9/DOWNSAMPLED/image/jpeg/16f2c5e04f3c49b4aa29605e373e0f8a/gr9.jpg https://s3.amazonaws.com/prod-ucs-content-store-us-east/content/pii:S0021951717300374/gr9/DOWNSAMPLED/image/jpeg/16f2c5e04f3c49b4aa29605e373e0f8a/gr9.jpg gr9 gr9.jpg jpg 16519 211 371 IMAGE-DOWNSAMPLED 1-s2.0-S0021951717300374-fx1_lrg.jpg https://s3-eu-west-1.amazonaws.com/prod-ucs-content-store-eu-west/content/pii:S0021951717300374/fx1/HIGHRES/image/jpeg/623225f0b770362733ed624e7ac0dcac/fx1_lrg.jpg https://s3.amazonaws.com/prod-ucs-content-store-us-east/content/pii:S0021951717300374/fx1/HIGHRES/image/jpeg/623225f0b770362733ed624e7ac0dcac/fx1_lrg.jpg fx1 true fx1_lrg.jpg jpg 142635 886 2213 IMAGE-HIGH-RES 1-s2.0-S0021951717300374-gr1_lrg.jpg https://s3-eu-west-1.amazonaws.com/prod-ucs-content-store-eu-west/content/pii:S0021951717300374/gr1/HIGHRES/image/jpeg/e3a7db404d39ddc382c16d3aee62c6f0/gr1_lrg.jpg https://s3.amazonaws.com/prod-ucs-content-store-us-east/content/pii:S0021951717300374/gr1/HIGHRES/image/jpeg/e3a7db404d39ddc382c16d3aee62c6f0/gr1_lrg.jpg gr1 gr1_lrg.jpg jpg 348835 1043 2576 IMAGE-HIGH-RES 1-s2.0-S0021951717300374-gr10_lrg.jpg https://s3-eu-west-1.amazonaws.com/prod-ucs-content-store-eu-west/content/pii:S0021951717300374/gr10/HIGHRES/image/jpeg/0f1feffaa04d666c378f3b8342aa2b2f/gr10_lrg.jpg https://s3.amazonaws.com/prod-ucs-content-store-us-east/content/pii:S0021951717300374/gr10/HIGHRES/image/jpeg/0f1feffaa04d666c378f3b8342aa2b2f/gr10_lrg.jpg gr10 gr10_lrg.jpg jpg 498606 1189 2955 IMAGE-HIGH-RES 1-s2.0-S0021951717300374-gr11_lrg.jpg https://s3-eu-west-1.amazonaws.com/prod-ucs-content-store-eu-west/content/pii:S0021951717300374/gr11/HIGHRES/image/jpeg/8fda95d56de714d2b0f715001d469bb6/gr11_lrg.jpg https://s3.amazonaws.com/prod-ucs-content-store-us-east/content/pii:S0021951717300374/gr11/HIGHRES/image/jpeg/8fda95d56de714d2b0f715001d469bb6/gr11_lrg.jpg gr11 gr11_lrg.jpg jpg 141616 996 2362 IMAGE-HIGH-RES 1-s2.0-S0021951717300374-gr2_lrg.jpg https://s3-eu-west-1.amazonaws.com/prod-ucs-content-store-eu-west/content/pii:S0021951717300374/gr2/HIGHRES/image/jpeg/f8341c5e7d766735df527b3cae8d5280/gr2_lrg.jpg https://s3.amazonaws.com/prod-ucs-content-store-us-east/content/pii:S0021951717300374/gr2/HIGHRES/image/jpeg/f8341c5e7d766735df527b3cae8d5280/gr2_lrg.jpg gr2 gr2_lrg.jpg jpg 1490886 3898 3248 IMAGE-HIGH-RES 1-s2.0-S0021951717300374-gr3_lrg.jpg https://s3-eu-west-1.amazonaws.com/prod-ucs-content-store-eu-west/content/pii:S0021951717300374/gr3/HIGHRES/image/jpeg/824a90765a326edf40a993762a248e95/gr3_lrg.jpg https://s3.amazonaws.com/prod-ucs-content-store-us-east/content/pii:S0021951717300374/gr3/HIGHRES/image/jpeg/824a90765a326edf40a993762a248e95/gr3_lrg.jpg gr3 gr3_lrg.jpg jpg 1859949 3141 2559 IMAGE-HIGH-RES 1-s2.0-S0021951717300374-gr4_lrg.jpg https://s3-eu-west-1.amazonaws.com/prod-ucs-content-store-eu-west/content/pii:S0021951717300374/gr4/HIGHRES/image/jpeg/b1b447f60d99def5f22eada770c8f047/gr4_lrg.jpg https://s3.amazonaws.com/prod-ucs-content-store-us-east/content/pii:S0021951717300374/gr4/HIGHRES/image/jpeg/b1b447f60d99def5f22eada770c8f047/gr4_lrg.jpg gr4 gr4_lrg.jpg jpg 343937 731 2756 IMAGE-HIGH-RES 1-s2.0-S0021951717300374-gr5_lrg.jpg https://s3-eu-west-1.amazonaws.com/prod-ucs-content-store-eu-west/content/pii:S0021951717300374/gr5/HIGHRES/image/jpeg/c4fb8e6aff9be651573ed077ce71419a/gr5_lrg.jpg https://s3.amazonaws.com/prod-ucs-content-store-us-east/content/pii:S0021951717300374/gr5/HIGHRES/image/jpeg/c4fb8e6aff9be651573ed077ce71419a/gr5_lrg.jpg gr5 gr5_lrg.jpg jpg 1077890 2703 3228 IMAGE-HIGH-RES 1-s2.0-S0021951717300374-gr6_lrg.jpg https://s3-eu-west-1.amazonaws.com/prod-ucs-content-store-eu-west/content/pii:S0021951717300374/gr6/HIGHRES/image/jpeg/37a6476beee4aa61222be2a0f87916a0/gr6_lrg.jpg https://s3.amazonaws.com/prod-ucs-content-store-us-east/content/pii:S0021951717300374/gr6/HIGHRES/image/jpeg/37a6476beee4aa61222be2a0f87916a0/gr6_lrg.jpg gr6 gr6_lrg.jpg jpg 1058655 2034 2559 IMAGE-HIGH-RES 1-s2.0-S0021951717300374-gr7_lrg.jpg https://s3-eu-west-1.amazonaws.com/prod-ucs-content-store-eu-west/content/pii:S0021951717300374/gr7/HIGHRES/image/jpeg/a6a8f46e32622f2573a1566af797b1a5/gr7_lrg.jpg https://s3.amazonaws.com/prod-ucs-content-store-us-east/content/pii:S0021951717300374/gr7/HIGHRES/image/jpeg/a6a8f46e32622f2573a1566af797b1a5/gr7_lrg.jpg gr7 gr7_lrg.jpg jpg 310615 1062 2362 IMAGE-HIGH-RES 1-s2.0-S0021951717300374-gr8_lrg.jpg https://s3-eu-west-1.amazonaws.com/prod-ucs-content-store-eu-west/content/pii:S0021951717300374/gr8/HIGHRES/image/jpeg/47e6ed39c564a6b6baac33cfe76bc146/gr8_lrg.jpg https://s3.amazonaws.com/prod-ucs-content-store-us-east/content/pii:S0021951717300374/gr8/HIGHRES/image/jpeg/47e6ed39c564a6b6baac33cfe76bc146/gr8_lrg.jpg gr8 gr8_lrg.jpg jpg 100383 926 1563 IMAGE-HIGH-RES 1-s2.0-S0021951717300374-gr9_lrg.jpg https://s3-eu-west-1.amazonaws.com/prod-ucs-content-store-eu-west/content/pii:S0021951717300374/gr9/HIGHRES/image/jpeg/4c3980d859216ee6db90f69a4443eb8b/gr9_lrg.jpg https://s3.amazonaws.com/prod-ucs-content-store-us-east/content/pii:S0021951717300374/gr9/HIGHRES/image/jpeg/4c3980d859216ee6db90f69a4443eb8b/gr9_lrg.jpg gr9 gr9_lrg.jpg jpg 120274 934 1642 IMAGE-HIGH-RES 1-s2.0-S0021951717300374-mol.zip https://s3-eu-west-1.amazonaws.com/prod-ucs-content-store-eu-west/content/pii:S0021951717300374/mol/MAIN/application/zip/92ca5f5312c6a462ca8c561e759456f5/mol.zip https://s3.amazonaws.com/prod-ucs-content-store-us-east/content/pii:S0021951717300374/mol/MAIN/application/zip/92ca5f5312c6a462ca8c561e759456f5/mol.zip mol mol.zip zip 2257 APPLICATION 1-s2.0-S0021951717300374-mmc1.docx https://s3-eu-west-1.amazonaws.com/prod-ucs-content-store-eu-west/content/pii:S0021951717300374/mmc1/MAIN/application/vnd.openxmlformats-officedocument.wordprocessingml.document/4423af6c9df5b6d2245cef1ca19f77b4/mmc1.docx https://s3.amazonaws.com/prod-ucs-content-store-us-east/content/pii:S0021951717300374/mmc1/MAIN/application/vnd.openxmlformats-officedocument.wordprocessingml.document/4423af6c9df5b6d2245cef1ca19f77b4/mmc1.docx mmc1 mmc1.docx docx 5269648 APPLICATION 1-s2.0-S0021951717300374-si1.gif https://s3-eu-west-1.amazonaws.com/prod-ucs-content-store-eu-west/content/pii:S0021951717300374/STRIPIN/image/gif/4508bc38115c6d298dd5239f69aec04f/si1.gif https://s3.amazonaws.com/prod-ucs-content-store-us-east/content/pii:S0021951717300374/STRIPIN/image/gif/4508bc38115c6d298dd5239f69aec04f/si1.gif si1 si1.gif gif 223 13 19 ALTIMG 1-s2.0-S0021951717300374-si2.gif https://s3-eu-west-1.amazonaws.com/prod-ucs-content-store-eu-west/content/pii:S0021951717300374/STRIPIN/image/gif/70a0c6ec2bb4b74694e687b479f4ef09/si2.gif https://s3.amazonaws.com/prod-ucs-content-store-us-east/content/pii:S0021951717300374/STRIPIN/image/gif/70a0c6ec2bb4b74694e687b479f4ef09/si2.gif si2 si2.gif gif 235 15 20 ALTIMG 1-s2.0-S0021951717300374-si3.gif https://s3-eu-west-1.amazonaws.com/prod-ucs-content-store-eu-west/content/pii:S0021951717300374/STRIPIN/image/gif/ef9d3a04a9fce2ae13dc7701c89376df/si3.gif https://s3.amazonaws.com/prod-ucs-content-store-us-east/content/pii:S0021951717300374/STRIPIN/image/gif/ef9d3a04a9fce2ae13dc7701c89376df/si3.gif si3 si3.gif gif 213 13 18 ALTIMG 1-s2.0-S0021951717300374-si4.gif https://s3-eu-west-1.amazonaws.com/prod-ucs-content-store-eu-west/content/pii:S0021951717300374/STRIPIN/image/gif/ae19229d92c8fd4fdb4fc8e94cac471a/si4.gif https://s3.amazonaws.com/prod-ucs-content-store-us-east/content/pii:S0021951717300374/STRIPIN/image/gif/ae19229d92c8fd4fdb4fc8e94cac471a/si4.gif si4 si4.gif gif 234 15 20 ALTIMG YJCAT 12341 S0021-9517(17)30037-4 10.1016/j.jcat.2017.02.003 Elsevier Inc. Fig. 1 XRD patterns of AC, VDPt and Pt-Bi nanocomposites (a); and AC, VDPt and Pt-Sb nanocomposites (b). Fig. 2 SEM images, HRTEM images and PSDs for VDPt (a), VDBi (b), ODBi (c), and MWBi (d). Fig. 3 “Point and shoot” EDX analysis (a) and SEM-EDX elemental mapping (b) of VDBi. Fig. 4 Models for the particle distribution in two-component supported systems, A phase segregated, B partially segregated (or partially associated), C full association of only one component (in our case Bi or Sb=red spheres), D full association of both components. Fig. 5 SEM and HRTEM images (and PSD) for VDSb (a), ODSb (b) and MWSb (c). (Due to the nanochain-like morphology, PSDs could not be determined for a and b.) Fig. 6 “Point and shoot” EDX analysis (top) and SEM-EDX elemental mapping (bottom) of ODSb. Fig. 7 TGA curves of AC, VDPt, and Pt-Bi nanocomposites (a); and AC, VDPt, and Pt-Sb nanocomposites (b). Fig. 8 First-derivative-peak temperature of non-graphitic carbon (T pn) as a function of the total surface area of the materials. Fig. 9 Influence of the particle size of the catalytically active component on the first-derivative-peak temperature of non-graphitic carbon (T pn) determined by TGA (curve a), and on the TOF determined for the conversion of 2-methyl-1-naphthol at r.t. in MeOH (curve b). Fig. 10 TOFs calculated for the catalytic oxidation of 2-methyl-1-naphthol in different solvents at r.t. or under reflux. Scheme 1 Oxidation and oxidative coupling of 2-methyl-1-naphthol (1) using H2O2 as the oxidant. Table 1 Preparation methods, drying conditions, metal loadings and physisorption data of samples. Sample Sample designation Prep. method Drying method Drying temp. Drying time Pt Bi Sb S PV APD (°C) (h) (mass%) (m2/g) (m3/g) (nm) Activated carbon AC – – – – – – – 1195 0.82 4.6 VD 5%Pt/AC VD Pt ED VD r.t. 4 5.0 – – 865 0.66 5.5 VD 5%Pt-5%Bi/AC VD Bi ED VD r.t. 4 4.9 4.8 – 655 0.45 5.7 OD 5%Pt-5%Bi/AC OD Bi ED OD 140 24 4.9 4.9 – 535 0.55 8.1 MW 5%Pt-5%Bi/AC MW Bi MW AD r.t. 24 5.0 4.9 – 860 0.56 5.5 VD 5%Pt-5%Sb/AC VD Sb ED VD r.t. 4 5.0 – 4.8 625 0.44 5.8 OD 5%Pt-5%Sb/AC OD Sb ED OD 140 24 4.8 – 4.8 620 0.54 5.7 MW 5%Pt-5%Sb/AC MW Sb MW AD r.t. 24 5.0 – 4.9 855 0.54 5.4 Table 2 Structural properties of the AC supported composites. Sample designation Bi phases a Sb phases a APS b (nm) Morphology c Particle distribution d VDPt – – 36.5 Pt: agglomerated spheres – VDBi BiPO4(h) – 8.03 Pt: partially agglom. NPs; Bi: partially agglom. nanorods; Pt and Bi partially segregated B ODBi BiPO4(mm) – 3.09 Pt: NPs; Bi: agglomerates; Pt mostly ass. with Bi and Bi always ass. with Pt C MWBi BiPO4(nm) PtBi – 5.74 Pt: partially agglom. NPs; Bi: agglomerates; Pt partially ass. with Bi and Bi always ass. with Pt C VDSb – amorph. – agglom. Pt-Sb nanochains D ODSb – amorph. – agglom. Pt-Sb nanochains D MWSb – PtSb 7.88 Pt-Sb NPs and agglomerates; Pt and Sb always associated D a Determined by XRD, Pt is always present as fcc Pt(0). b Determined by HRTEM. c Determined by SEM, HRTEM and EDX. d According to Fig. 4. Table 3 Thermogravimetric data of AC and metal-loaded AC. Sample designation Amorph. carbon Non-graphitic carbon Residue (wt%) T ia (°C) T fa T in (°C) T pn T fn AC – – 464 647 808 5.10 VDPt 214 434 464 635 763 9.40 VDBi 161 411 411 536 663 8.65 ODBi – – 340 483 619 10.2 MWBi – – 421 555 651 15.9 VDSb 229 431 431 506 569 8.65 ODSb 276 454 466 559 680 12.9 MWSb – – 437 553 635 13.4 Table 4 Oxidative coupling of 2-methyl-1-naphthol catalyzed by AC-supported 5%Pt, 5%Pt-5%Bi and 5%Pt-5%Sb prepared by different methods. Entry Sample designation Solvent T (°C) Conv. (%) Selectivity (mol%) 2 3 4 1 VDPt MeOH r.t. 28.9 67.1 30.6 – 2 VDBi MeOH r.t. 61.4 91.5 4.89 – 3 ODBi MeOH r.t. 100 96.0 – – 4 MWBi MeOH r.t. 86.0 75.1 24.3 – 5 VDSb MeOH r.t. 14.7 89.1 – – 6 ODSb MeOH r.t. 9.60 93.8 – – 7 MWSb MeOH r.t. 75.2 85.6 12.3 – 8 VDPt MeOH 60 100 11.4 85.6 2.90 9 VDBi MeOH 60 100 23.3 68.0 8.30 10.1 ODBi MeOH 60 100 – 83.0 16.2 10.2 a ODBi MeOH 60 100 1.4 86.4 11.7 11 MWBi MeOH 60 100 5.7 82.9 11.0 12 VDSb MeOH 60 33.9 96.8 – – 13 ODSb MeOH 60 12.2 89.1 – – 14 MWSb MeOH 60 100 20.1 71.6 8.20 15 VDBi MeNO2 r.t. 89.6 98.3 – Trace 16 b ODBi MeNO2 r.t. 100 62.1 – 22.5 17 MWBi MeNO2 r.t. 86.8 98.3 – – 18 VDSb MeNO2 r.t. 20.5 91.2 – – 19 ODSb MeNO2 r.t. 8.14 89.7 – – 20 MWSb MeNO2 r.t. 69.1 99.7 – – a Recycled catalyst containing 4.70% Pt. b Black deposits together with other by-products formed. Structure-activity relationships of carbon-supported platinum-bismuth and platinum-antimony oxidation catalysts Mabuatsela V. Maphoru a Sreejarani Kesavan Pillai b Josef Heveling a c ⁎ a Department of Chemistry, Tshwane University of Technology, Pretoria 0001, South Africa Department of Chemistry Tshwane University of Technology Pretoria 0001 South Africa b National Centre for Nano-Structured Materials, Council for Scientific and Industrial Research, Pretoria 0001, South Africa National Centre for Nano-Structured Materials Council for Scientific and Industrial Research Pretoria 0001 South Africa c Institute for NanoEngineering Research, Tshwane University of Technology, Pretoria 0001, South Africa Institute for NanoEngineering Research Tshwane University of Technology Pretoria 0001 South Africa ⁎ Corresponding author at: Department of Chemistry, Tshwane University of Technology, Pretoria 0001, South Africa. Department of Chemistry Tshwane University of Technology Pretoria 0001 South Africa Graphical abstract Compositional and morphological studies on supported platinum are important for the improvement and expanded use of catalysts for oxidative coupling reactions. Nanocomposites consisting of 5% Pt supported on activated carbon and promoted with 5% Bi or Sb were prepared by electroless deposition and microwave-assisted (MW) methods. Addition of promoters significantly increases the dispersion of Pt. Bismuth reacts with residual phosphorus of the support to form various phases of BiPO4, while Sb cannot be detected by XRD. However, samples prepared by the MW method are unique in that they contain crystalline PtBi or PtSb alloys as part of the phase matrix. The thermal stability of the samples in air and the TOFs for the oxidation of 2-methyl-1-naphthol correlate with the metal dispersion. Since the oxidation reaction is understood to take place on the surface of metals with high standard electrode potentials, sufficient Pt exposure is one of the key performance parameters. Keywords Nanocomposite Platinum Activated carbon Promoter Oxidative coupling Autocatalytic oxidation InChIKeys MJVAVZPDRWSRRC-UHFFFAOYSA-N SRJCJJKWVSSELL-UHFFFAOYSA-N STSFANLVDDHGLG-UHFFFAOYSA-N UYODZOJQCRDXII-FMQUCBEESA-N 1 Introduction The IUPAC nomenclature [1] distinguishes between amorphous carbon (no long-range crystalline order), non-graphitic carbon (two-dimensional long-range order of the carbon atoms in planar hexagonal networks), and graphitic carbon (three-dimensional hexagonal crystalline long-range order). In principal, activated carbon (AC) consists of non-graphitic carbon, as any tarry and amorphous carbon is removed during the manufacturing (activation) process, and graphite is normally absent [2,3]. AC has a highly porous texture and is characterized by high thermal stability (in the absence of air), a large surface area, and phenomenal adsorptive properties [2]. AC can intercalate metal nanoparticles (NPs) to form composite materials that are useful in water purification, fuel cells and general catalysis [3–6]. AC has the added advantage of supporting the product life cycle: carbon burns readily when heated in air, allowing supported metals to be easily recovered and recycled [3]. Metal/AC composites can be prepared with the help of chemical and physical methods. Chemical methods include impregnation and electroless (reductive) deposition (ED). Physical methods make use of lasers, sonication, microwave (MW) and UV irradiation, as well as plasma technology and supercritical fluids [7]. The method of preparation has a decisive influence on the structure and morphology of the final product [8]. Depending on the synthesis conditions, different metal and oxide phases can be generated, which allows tuning of the sample properties to the requirements of the envisaged application. The shape and size distribution of NPs are also important, e.g. in catalysis the particle size has often a crucial influence on catalyst activity and selectivity [9,10]. Precipitation of metals onto supports by deposition methods results frequently in an extended particle-size distribution (PSD), accompanied by agglomeration [7]. In contrast, use of MW irradiation during synthesis can be expected to create homogeneous nucleation sites, resulting in a narrow PSD with a high metal dispersion and uniform particle shapes [10,11]. In addition, MW irradiation offers shorter reaction times and reduced energy consumption [10,12]. In combination with ethylene glycol it is a very convenient, fast and efficient method of metal deposition onto supports [13], as glycol can act both as the solvent and as the reducing agent for metal precursors [14]. Pt-Bi and Pt-Sb composites have applications in thermoelectronics and batteries [15–17]. Carbon-supported Pt-Sb is a promising material for direct formic-acid and methanol fuel cells [6,17,18]. Pt-Bi2O3 was found by Moniz et al. [19] to facilitate the photolysis of water, which neither Pt nor Bi2O3 can accomplish on their own. Pt-Bi/AC is a commercially available catalyst for electrocatalysis and selective oxidation reactions. With respect to the latter application, it is speculated that Bi exerts a geometric blocking effect on Pt, thus decreasing the active site ensembles of Pt. These minimized sites still allow for the desired chemical reaction to proceed, but they are inactive for unwanted side reactions [20–23]. In our previous studies, 5%Pt-5%Bi/AC was used for the oxidation and oxidative coupling of 1-naphthols [24,25], while 5%Pt-5%Sb/AC was shown to have superior selectivity for the oxidation of cinnamyl alcohol to cinnamaldehyde in comparison with corresponding Bi-containing catalysts [26]. In the present study, the properties of 5%Pt-5%Bi/AC and 5%Pt-5%Sb/AC composite materials prepared by ED, including MW-assisted glycol reduction, are described. The different nanofeatures obtained under varying synthesis conditions have an influence on the autocatalytic oxidation of the composite materials. In addition, they have an impact on the catalytic activities and selectivities of chemical oxidation reactions; this is demonstrated by example of the oxidative coupling of 2-methyl-1-naphthol (Scheme 1 ). The oxidative coupling of naphthols is an important method for the formation of new CC bonds [27,28]. Apart from other reaction parameters, the outcome depends on the composition and the properties of the catalyst, as well as on the electronic and steric nature of the substrate. The formation of coupled products occurs often concurrently with the formation of mono-quinones. Only a limited amount of work described in the literature is dedicated to the heterogeneous catalytic oxidation of 2-methyl-1-naphthol (Scheme 1). Most of these studies are aimed at the conversion of 1 to menadione (4), and the coupled products (2 and 3) are considered to be by-products [29–32]. Menadione is a blood coagulating agent (vitamin K3) [33]. The development of a viable and environmentally sustainable catalytic route to this molecule is of great commercial interest. High yields of 4 can be obtained over oxide catalysts in combination with hydrogen peroxide, e.g. Ti-MMM-2 (mesoporous titanium-silicate): 78% [34], Nb2O5-SiO2: 42% [35], Ti-SBA-15: 93% [31], Nb-SBA-15: 97% [32]. However, isolated yields were not reported, and the mass of the catalyst in relation to the mass of the starting material (SM) is always high (SM/cat.=0.9–2.0m/m). In contrast to oxides, metallic-state catalysts favor the formation of coupled products [24,25]. Depending on the reaction conditions and the solvent used, 2 or 3 can be obtained in high yields over Pt supported on AC (96–97%, SM/cat.=25m/m). Previously, Kral and Laatsch obtained 3 with a yield of 72% by the coupling of 1 with stoichiometric amounts of AgO as the oxidant [36]. The maximum menadione yield obtained over Pt is 30.5% [25]. 2 Experimental 2.1 Materials Activated carbon (Darko KB-G 174), bismuth(III) nitrate pentahydrate (98%), antimony chloride (99%), hydrazine monohydrate (98%), nitromethane (95%) and silica gel for column chromatography (pore size 60Å, 70–230 mesh) were purchased from Sigma-Aldrich. Hexachloroplatinic acid (metal content 40.31%) was bought from SA Precious Metals. Hydrogen peroxide (30%), dichloromethane (99.5%), ethyl acetate (99%), methanol (99.5%) and petroleum ether (90%) were obtained from SMM Instruments, ethylene glycol (99.5%) from Promark Chemicals, and Triton X-100 (98–102%) from BDH. 2-Methyl-1-naphthol was prepared as described previously [24]. 2.2 Synthesis of nanocomposites Electroless deposition (ED): for the preparation of 5%Pt-5%Bi on AC, H2PtCl6∙6H2O (0.1328g, 0.2564mmol Pt) and Bi(NO3)3∙5H2O (0.1162g, 0.2396mmol Bi) were dissolved in 50% H2O/50% CH3OH (v/v, 100ml). Triton X-100 (3ml) was added, and the mixture was placed in an ultrasonic bath for 2h to completely dissolve the bismuth nitrate. After addition of the AC support (0.9005g), the mixture was stirred using a magnetic stirrer. After 10min a 98% aqueous solution of N2H4∙H2O (0.2ml, 4.041mmol) was added dropwise with a syringe to reduce the metal ions. Stirring continued for 28h. Each sample was filtered and washed with deionized water to pH 7, and finally washed with CH3OH. By testing with AgNO3, the final aqueous filtrate was found to be free of chloride. Samples were dried under different conditions, i.e. at room temperature (r.t.) under vacuum for 4h (VD), or in an oven at 140°C for 24h (OD). The same procedure was used to prepare VD 5%Pt/AC, as well as VD and OD5%Pt-5%Sb/AC; SbCl3 (0.1228g, 0.4108mmol) was the precursor for Sb. Microwave-assisted loading (MW): for the preparation of MW5%Pt-5%Bi/AC, H2PtCl6·6H2O (0.1328g, 0.2564mmol) and Bi(NO3)3·5H2O (0.1161g, 0.2393mmol) were transferred into a 100mL beaker containing ethylene glycol (20mL), followed by ultrasonication for 10min to completely dissolve the salts. To this mixture, AC (0.9001g) was added, followed by ultrasonication for 1h prior to MW irradiation. The MW-assisted metal loading was conducted in a Mars Xpress MW system at 600W and 190°C in a closed Teflon vessel. The time to reach the final temperature was set at 5min, and irradiation continued for 10min at 190°C to allow for the complete reduction of Pt(IV) to Pt(0). Samples were centrifuged, washed with deionized water, and left to air-dry (AD) for 24h. The same method was followed to prepare MW5%Pt-5%Sb/AC; SbCl3 (0.1228g, 0.4111mmol) was used as the precursor for Sb. The designations used for the different samples (depending on the preparation/drying methods) are given in Table 1 . 2.3 Characterization of nanocomposites Elemental analyses (Pt, Bi, Sb and P) were performed on a Spectro Arcos FHS ICP-OES instrument. The amount of metal loaded onto the AC support was quantified indirectly by determining the amount of metal that remained in solution during sample preparation. A Bruker D8 Advance powder X-ray diffractometer was employed with Ni-filtered Cu Kα radiation (λ =0.15418nm) at 40kV and 40mA to analyze the crystallographic structure of the composites. The samples were scanned at r.t. at a scan speed of 0.1s/step in the 2θ range of 10–100°. The phases were identified using the Bruker DIFFRACplus evaluation software (EVA) in combination with the ICDD powder diffraction database (International Centre for Diffraction Data). Nitrogen-physisorption measurements (BET) were carried out using a Micrometrics ASAP 2020 surface area and porosity analyzer. Approximately 0.05g of each sample was degassed for 6h at 150°C and analyzed at −196°C (77K) for 5h in the pressure range 0.866–87.1kPa using nitrogen as the adsorbent. Pore volumes and average pore diameters were calculated using the BJH method. Sample morphologies and elementary compositions were analyzed by means of a JEOL JSM-7500F field-emission scanning electron microscope, equipped with a secondary electron detector and a ThermoScientific ultradry X-ray detector. An electron accelerating voltage of 2.00kV or 3.00kV was used for imaging, and 15.0kV was used for imaging, energy dispersive X-ray (EDX) analysis and mapping. All samples were sputter coated with carbon to avoid charging. High-resolution transmission electron microscopy (HRTEM) and selected area electron diffraction (SAED) were performed on a JEOL JEM-2100 HRTEM instrument. The electron acceleration voltage was 200kV. The samples were dispersed in ethanol for 1min using an ultrasonic bath, and supported on carbon-coated copper grids (200mesh). Particle sizes were measured with the help of the ImageJ software. For each sample 500 particles were measured using four to six different images per sample. The thermal behavior of materials was assessed using a Perkin Elmer TGA 4000 thermogravimetric analyzer at an air flow of 20ml/min and a heating rate of 10°C/min in the temperature range of 50–1000°C. 2.4 Oxidation reactions, product separation, product characterization and determination of catalyst performance Oxidative coupling reactions were carried out at r.t. and at 60°C by placing 2-methyl-1-naphthol (6.34mmol) and the catalyst (0.0401g) into a 100ml round-bottomed flask, equipped with a condenser. A solvent (25ml) was added. The mixture was stirred with a magnetic stirring bar. While stirring, 30% aqueous H2O2 (3.1ml, 22.1mmol) was added dropwise over 40min directly into the solution using a peristaltic pump. The catalyst was filtered off, washed under suction with CH2Cl2, followed by MeOH, and left to air dry. Column chromatography was used to separate the reaction mixtures [25]. Product selectivities were calculated as mole percentages based on the moles of SM incorporated into each product. The full characterization of 2-methyl-1-naphthol (1), 3,3′-dimethyl-1,1′-binaphthalenyl-4,4′-diol (2), 3,3′-dimethyl-1,1′-binaphthalenylidene-4,4′-dione (3) and 2-methyl-1,4-naphthoquinone (4) was reported previously [24,25]. Turnover frequencies (TOFs) were calculated as moles of converted SM per mole of Pt present on the catalyst over the total reaction time (min–1). Catalysts recycling was tested under conditions identical to those used for fresh catalysts; that is, the molar ratios of all reaction ingredients were kept constant in relation to the amount of the reused catalyst. 3 Results and discussion 3.1 Characterization of the nanocomposites The synthesis methods, the drying conditions, and the physisorption data obtained for all samples are shown in Table 1. Independent of the synthesis method used, the metal loadings are always near to the targeted values. The BET surface area of the AC support is close to 1200m2/g. Lower total surface areas (S) and lower pore volumes (PV) are always found after metal loading, probably due to some pore blockage. Obviously, smaller pores are blocked preferentially, resulting in increased average pore diameters (APD) of the composite materials. Restructuring of AC during sample preparation could also influence the surface area. For instance, Zhu and coworkers reported the efficient use of MW treatment for the exfoliation of graphite, accompanied by a considerable increase in surface area [37]. Similarly, our metal-loaded composites prepared by the MW method distinguish themselves by relatively higher surface areas (855–860m2/g) compared to the VD and OD samples. XRD patterns of AC, VDPt and the bimetallic composites are shown in Fig.1 a and b. The XRD trace of carbon (α) is typical for activated carbon [38,39]; reflections for graphite [38–40] are absent. The peaks at 2θ =39.9, 46.9, 68.4, 81.6 and 86.3° correspond to the (111), (200), (220), (311) and (222) planes of face-centered cubic (fcc) Pt(0), corresponding to the powder diffraction file (PDF) 01-089-7382. Bi has a low reduction potential (E 0 =0.320V) and cannot be expected to be present in a fully reduced state. On VDBi (Fig.1a) a hexagonal phase of bismuth phosphate [BiPO4(h), ximengite, PDF01-080-0208] is found, while for the OD and MWBi samples monoclinic polymorphs of space group P21/m [BiPO4(mm), PDF 01-077-2208] and P21/n [BiPO4(nm), monazite, PDF 01-080-0209] are formed, respectively. According to the product specification of the supplier, the chosen AC support contains ≤3.5% PO4 3−. In our batch 0.77% P was found, which corresponds to 2.4% PO4 3−. This means that the support would contain sufficient phosphate to convert all the Bi of the5%Pt-5%Bi samples into BiPO4. This is possibly the case for the VD and OD composites, as no other Bi peaks are present. A study on BiPO4 crystals conducted by Mooney-Slater [41] found that the BiPO4 phase formed depends on the preparation and treatment temperature. Ximengite has a highly symmetrical arrangement of chains, which forms an open framework. It is stable at relatively low temperatures and loses half of its water molecules between 75 and 175°C. Between 200 and 250°C ximengite undergoes an exothermic chain reorientation to form monoclinic monazite of space group P21/n. Monazite has a less symmetrical chain arrangement, resulting in a compact space-filling network. When monazite is exposed to temperatures between 600 and 700°C, it transforms into another monoclinic modification (space group P21/m). In our case, the preparation conditions used during synthesis affect the BiPO4 phases formed. The composite dried at r.t. under vacuum (VDBi) produces ximengite, the composite prepared in the same way, but dried at 140°C (ODBi) forms monoclinic BiPO4 of space group P21/m, and the MW method results in the formation of monazite. As observed for the Pt-Bi samples, the Pt-Sb composites (refer Fig.1b) show broad XRD reflections of fcc Pt(0). In this regard, SAED (Fig. S1, Supporting information) confirms the presence of crystalline material in the VDSb sample; a few diffraction spots are visible, which are attributed to Pt, since Sb is amorphous. By XRD, Sb is not detectable on the VD and OD samples. This is not exceptional for supported Sb, e.g. Yu and Pickup [6,17] could not find any diffraction peaks for Sb-containing phases on carbon-supported Pt-Sb prepared by reduction with NaBH4. Likewise, Dailly et al. [15] did not see any Sb peaks on an antimony-graphite composite material prepared by reduction of SbCl5 with NaH. Of our three synthesis procedures used, the MW-assisted method is unique in that it creates hexagonal PtBi (PDF01-072-5643) and PtSb (PDF 03-065-3432, stumpflite) alloys as part of the phase matrix. The alloy peaks are small and broad, suggesting that the alloys are almost amorphous. MW-assisted polyol reduction simultaneously reduces and deposits metals onto the support. In the case of bimetallic systems, this can indeed result in alloy formation [42]. In contrast to the Pt-Bi samples (Fig.1a), phosphates (SbPO4) are not observed in the Pt-Sb composites (Fig.1b). SbPO4 can be prepared at temperatures >650°C by the reaction of meta-phosphoric acid with Sb to give antimony meta-phosphate, which thermally decomposes to SbPO4 at 900°C [43]. This means, the formation of SbPO4 is favored at high temperatures. Evidently, our conditions of sample preparation are not conducive for the formation of SbPO4. It is noted, that the presence of phosphorus (or nitrogen) can be an advantage for certain applications. For our intended use (catalysts for selective oxidation reactions) significant improvements in reaction rate or selectivity were observed after addition of P- or N-containing compounds that adsorb strongly on the Pt surface [21]. In addition, combinations of Pt-group metals with phosphates are more promising catalyst formulations for oxidation reactions than, for example, Cu2(OH)PO4 or Cu4O(PO4)2, which are only of low activity [21]. SEM and TEM images of VDPt and the bimetallic Pt-Bi nanocomposites are shown in Fig. 2 . For monometallic VDPt the SEM image (Fig.2a′) indicates the presence of highly agglomerated spherical Pt particles. This is confirmed by HRTEM (Fig.2a″). An average particle size (APS) of 36.5nm with a relatively broad PSD (18–80nm) was determined (Fig.2 a ‴ ). The agglomerated NPs leave vacant spaces on the carbon carrier, contributing to a relatively high PV and a total surface area of 865m2/g (Table 1). The addition of Bi to VDPt significantly improves the dispersion of Pt (Fig.2b″). By adding 5% Bi, the APS decreases to 8.03nm (Fig.2 b ‴ ), and some of the Pt NPs are isolated and others are associated with the Bi containing features, which appear as nanorods (Fig.2b′). The elemental composition of the prominent features with respect to Pt, Bi, P and oxygen was examined by “point and shoot” EDX analysis. Although the EDX peak for Pt at ∼2.048keV overlaps with the peak for P at ∼2.013keV, the results (Fig.3 a) confirm that P is present in significant amounts. Points 1–5, 7 and 10 are positioned on rods and contain a high amount of Bi, associated with substantial amounts of P and O. Points 6, 8 and 9 are rich in Pt and do not contain P. This suggests that the rods consist of the BiPO4(h) phase found by XRD (Fig.1a). The association and presence of Bi and P on the nanorods are also confirmed by SEM-EDX elemental mapping (Fig.3b), while Pt is seen to be more evenly distributed over the catalyst surface. Hexagonal BiPO4 nanorods were previously prepared from BiNO3 and Na2PO4 in nitric acid and characterized by several methods, including XRD, SEM and HRTEM [44,45]. The images of VDBi in Figs.2b′–b″ and 3 show that there is some variation with respect to the location of Pt relative to Bi. In a somewhat simplified approach, the structures of two-component supported composite materials can be categorized according to the models shown in Fig. 4 . Using this system, VDBi would fit Model B. The images of Figs.2c′–c″ and S2 point to the presence of particles of different sizes and shapes on ODBi. In addition to agglomerates, SEM shows isolated NPs, which contain mainly Pt (Fig. S2). The NPs are highly dispersed and have an APS of 3.09nm (Fig.2 c ‴ ). Small particles are possibly more effective in blocking some of the narrow pores of the AC support. Accordingly, ODBi has the lowest surface area (535m2/g) of all the materials shown in Table 1 and an exceptionally high APD (8.1nm). Rod-like features of BiPO4 (like those in Fig.2b′) are not observed, but the agglomerates are rich in both Bi and P (Fig. S2). Probably, the agglomerates contain the monoclinic BiPO4(mm) phase found by XRD (Fig.1a). In contrast to VDBi, the particles are closely attached to or engraved into the surface of the AC. Hence, oven-drying seems to promote the anchoring of small particles onto the surface or into the pores of the support. Overall, the structure of ODBi corresponds to Model C of Fig. 4. For MWBi an APS of 5.74nm was determined (Fig.2 d ‴ ). The particles are less uniform compared to the particles observed for ODBi. Like ODBi, MWBi shows no (or rather few) rod-like features. NPs and larger agglomerates are seen by SEM (Fig.2d′). The NPs are rich in Pt, while the agglomerates consist mainly of Bi and P associated with Pt (Fig. S3). Most likely, the agglomerates contain the monazite phase BiPO4(nm) that was identified by XRD (Fig.1a). The overall structure is best described by Model C of Fig. 4. For VDSb, SEM (Fig.5 a′–a″) points to homogeneously dispersed NPs that consist of Pt and Sb in somewhat varying proportions (Fig. S4). For carbon-supported Pt-Sb (35–39% Pt and 5–16% Sb) Yu and Pickup [6] also found that Pt and Sb are always associated. Interestingly, in our sample agglomerated chain-like structures with a diameter of ∼11.6nm are observed by HRTEM (Fig.5 a ‴ ). EDX analysis (Fig. S5) indicates that the nanochains contain both Pt and Sb. No fringes were detectable on the HRTEM images. This suggests the presence of almost amorphous Pt embedded in amorphous Sb or vice versa, thus forming a nearly amorphous matrix, corresponding to Model D of Fig. 4. The morphology of ODSb (Fig.5b) is similar to that observed for VDSb. In the SEM image, spherical particles are seen on the surface of AC (Fig.5b′–b″), while a chain-like morphology emerges by HRTEM (Fig.5 b ‴ ). As for VDSb, the nanochains contain both Pt and Sb (Fig. 6 ). Compared to VD, OD leads to particles that are more firmly attached to or embedded into the surface of AC. This was also observed for ODBi (Fig.2c′). The SEM image of MWSb (Fig.5c′) indicates the presence of NPs and agglomerates. According to Fig. S6, all features contain Pt and Sb (corresponding to Model D of Fig. 4). Uniform crystalline cubic particles containing Pt and Sb are seen by HRTEM (Fig.5c″), and an APS of 7.88nm was calculated (5 c ‴ ). Nanochain-like structures are not observed. As for MWBi, the total surface area (855m2/g) remains relatively high (Table 1). The structural properties of all composites are summarized in Table 2 . 3.2 Thermal analysis of the AC support and the nanocomposite materials The thermal stabilities of AC and of the composite materials were assessed by TGA in air (Fig. 7 ). The initial temperatures T i (temperature at which the materials start losing carbon), the 1st-derivative-peak temperatures T p (minimum of the first derivative curve), and the final temperatures T f (temperature at which the mass loss is complete) are listed in Table 3 . It is well known that different structural forms of carbon exhibit different oxidation behaviors. Higher oxidation temperatures are associated with purer, less defective samples [46,47]. Less ordered or “amorphous” carbons tend to oxidize around 350°C, and there seems to be a consensus on an oxidation temperature of ca. 400°C [47]. An even lower decomposition temperature (ca. 190°C) was reported by Ko et al. [12]. (Unfortunately, the literature does not clearly distinguish between amorphous carbon and non-graphitic carbon as defined by IUPAC [1].) A well graphitized structure starts to oxidize at relatively higher temperatures of 600–800°C [38,40,47,48]. In any case, in the presence of oxidation catalysts, such as Pt, the oxidation temperatures must be expected to shift to lower values [49,50]. Therefore, as seen in Fig. 7, the decomposition temperatures for the non-graphitic carbon of our Pt-loaded composite materials are never higher than that of AC itself. The TGA curve of AC is indicative of a high quality, non-graphitic material that contains no amorphous carbon. This finding is in agreement with the XRD (Fig. 1) and the Raman spectrum shown in Ref. [40]. After oxidation of all the combustibles, AC leaves a residue of 5.1%, corresponding to the ash content. The residues found for the metal containing composites must be expected to vary with the total remaining ash content of the support, the metal loadings, and the final oxidation states. According to the thermograms of Fig.7a the temperature for the loss of non-graphitic carbon increases in the order ODBi<VDBi<MWBi<VDPt<AC. Only VDBi shows a significant mass loss in the temperature region that could be assigned to the oxidation of amorphous carbon. Obviously, the amorphous carbon is formed from non-graphitic carbon of AC under the catalyst synthesis conditions. Hardly any loss of amorphous carbon is seen for MWBi. This is not surprising, as MW irradiation is an efficient method for the removal of “amorphous” carbon from, e.g. carbon nanotubes [51]. It can therefore be expected that during the MW-assisted synthesis any amorphous carbon formed is removed from the sample. This could also contribute to the high ash content observed for the MW composites (Fig. 7), as the selective removal of some carbon would result in an increase in the ash/carbon ratio. VDPt shows the highest T pn of all the metal-loaded samples (635°C, Table 3). It contains large agglomerated Pt particles (Fig.2a′–a″), and it is conceivable that during the TGA run the relatively small amount of exposed Pt gets over-oxidized (poisoned) by oxygen. This would retard the further oxidation of carbon. Over-oxidation of the catalytically active metal surface is one of the major deactivation mechanisms anticipated for (unpromoted) precious-metal oxidation catalysts [21]. The thermograms of the Pt-Sb composites (Fig.7b) display similar trends to those observed for Pt-Bi. Again, a considerable mass loss in the temperature region for the oxidation of amorphous carbon is mainly observed for the VDsample, and loss of amorphous carbon is particularly low for MWSb. The temperature for the decomposition of non-graphitic carbon increases in the order VDSb<MWSb≅ODSb<VDPt<AC. Fig. 8 shows a correlation between the total surface area and T pn for all samples (including AC), and it is found that T pn increases with the surface area. This is in contrast to the situation found on pure carbons, for which an inverse relationship is observed [48,52]; that is, the temperature at which 15% carbon weight is lost (T 15) decreases with an increase in surface area. However, the active surface area and not the total surface area is the important parameter controlling the oxidation rate of carbons [53]. Nevertheless, this situation must be expected to change fundamentally when catalytically active material (e.g. Pt) is present. In such a case, the genuine influence on the oxidation behavior is more likely exerted by the type and the structure of the catalyst. In fact, Fig. 9 (curve a) shows that the T pn of our samples is influenced by the particle size (Table 2), and more highly dispersed Pt oxidizes carbon at lower temperatures. Therefore, apart from the sample composition, the particle size must be regarded as an important factor that contributes to the overruling of the surface area effect observed by Jiang and Charsley for pure carbons [48,52]. 3.3 Oxidation of 2-methyl-1-naphthol When 2-methyl-1-naphthol (1) is oxidatively coupled over Pt/AC, Pt-Bi/AC and Pt-Sb/AC catalysts in MeOH or MeNO2 as the solvent, 3,3′-dimethyl-1,1′-binaphthalenyl-4,4′-diol (2) and 3,3′-dimethyl-1,1′-binaphthalenylidene-4,4′-dione (3) are the principal products, accompanied by varying amounts of 2-methyl-1,4-naphthoquinone (menadione, 4) as a possible side product (Scheme 1). The binaphthol 2 is regarded as the intermediate to the binaphthone 3, while the formation of menadione is a parallel reaction, competing with the formation of 2 [25]. The reactions are supposed to be irreversible; in each step water is released. The specific outcome depends on the catalyst morphology, the promoter (Bi or Sb), the solvent, and the reaction temperature (Table 4 ). The TOFs are plotted in Fig. 10 . These are based on the total amount (mol) of Pt present on each catalyst. Under comparable reaction conditions this should lead to TOFs reflecting the relative activities of the catalysts [54,55]. Hydrogen peroxide is used as the oxidizing agent. Ideally, the addition rate of the oxidant should match the rate of its consumption [56], as any excess of H2O2 must be expected to decompose on the catalyst surface [57,58] and may lead to over-oxidation of the catalytically active metal [21]. For each test 3.5 equivalents of the oxidant were added in a dropwise manner over 40min, which is sufficient to achieve total conversions over the catalyst with the highest Pt dispersion (ODBi) at r.t. and under reflux. This condition should be met, as the catalyst with the highest Pt surface area must also be expected to exhibit the highest decomposition rate for H2O2. In refluxing MeOH (Table 4, entries 8–14) all catalysts, except VD and ODSb, convert 100% of 1 into various proportions of 2, 3 and 4. ODBi is the most active sample; all of the intermediate binaphthol 2 is converted further to the binaphthone 3 (entry 10.1). VD and ODSb are clearly the least active samples; conversions are 33.9 and 12.2%, respectively (entries 12 and 13). In contrast, MWSb (entry 14) shows a reaction pattern similar to that of VD and MWBi. Reactions carried out at r.t., that is under the condition of partial conversion (entries 1–7), confirm the activity trends seen under reflux. Complete conversion of 1 is only obtained over the most active ODBi, which forms 2 with a yield of 96% (entry 3); any further conversion to 3 is absent. At r.t. 2 is the main product over all seven catalysts and menadione (4) is not observed. The catalyst activity increases in the order ODSb<VDSb<VD Pt<VDBi<MWSb<MWBi<ODBi. In nitromethane at r.t. (entries 15–20), the catalyst activity increases in a similar order (ODSb<VDSb<MWSb<MWBi=VDBi<ODBi). As at r.t. in methanol, complete conversion is only observed for ODBi, and again, ODand VDSb are the least active samples. Except for ODBi (entry 16), 2 is the sole product formed. Typically, over ODBi high yields of menadione (4) can be obtained: 16.2% in MeOH at 60°C (entry 10.1), and 22.5% in MeNO2 at r.t. (entry 16). With respect to the catalytic activity, the most relevant findings are as follows: the sample with the lowest APS (ODBi, 3.1nm) displays consistently high TOFs (Fig. 10), and the conversion of the SM over that catalyst is always complete (Table 4). ODBi shows also the lowest temperature (T pn) for the autocatalytic oxidation of the AC support (Table 3). As seen in Fig. 9, T pn increases with the particle size (curve a), while the TOFs determined for the oxidation of 1, decrease with the particle size (curve b). Composites with a chain-like morphology (VD and ODSb) always exhibit inferior catalytic activities (TOF=1.3–5.2min–1, Fig. 10). These materials are low in exposed Pt. As the reaction is thought to take place on the surface of metals with high standard electrode potentials [24], sufficient metal exposure/dispersion is a key performance parameter. Therefore, the inferior catalytic activity of the VD and ODSb composites is in agreement with the metallic-state reaction mechanism proposed earlier [24]. Entry 10.2 of Table 4 demonstrates catalyst recyclability by example of the most active ODBi catalyst. Due to a small loss of Pt during the first run (entry 10.1) the TOF increases from 15.7 to 16.4min−1. In a control test no activity of leached metal was found [25]. The impact of the reaction conditions (temperature, substrate concentration, peroxide/2-methyl-naphthol ratio, and amount of catalyst used) on product selectivity, in particular on the formation of menadione, was described in a previous paper [25]. There, a detailed account of solvent effects (using the ODBi catalyst) can also be found. 4 Conclusions The structure of the composites depends on the preparation method and the promoter used (Bi or Sb). On all samples platinum is present as fcc Pt(0). The addition of Bi or Sb significantly increases the dispersion of Pt. The lowest APS (3.09nm) is found for OD Bi. On the Pt-Sb samples Sb is always associated with Pt, and Sb is not detectable by XRD. However, a PtSb alloy is seen on MWSb. VD and ODSb form Pt- and Sb-containing nanochains (HRTEM), which have little exposed Pt. The chosen AC contains residual phosphate, and on all the composites containing 5%Pt-5%Bi, bismuth phosphate is formed. The identified BiPO4 phase depends on the preparation method, and is different for VD, OD and MW. There is no indication for the formation of SbPO4 on Sb containing samples. The MW method is unique in that it creates crystalline PtBi and PtSb alloys as part of the phase matrix. In addition, amorphous carbon (that would burn in a TGA at low temperature) is not detected. Furthermore, the MW samples distinguish themselves by relatively high remaining total surface areas (855–860m2/g). In contrast, oven-drying (OD) promotes the anchoring of small particles onto the surface or into the pores of the support, resulting in a reduced total surface area. The thermal stability of the composites at high temperature and the TOFs for the oxidation of 2-methyl-1-naphthol are strongly influenced by the metal dispersion. That is, the temperature for the autocatalytic oxidation of non-graphitic carbon (T pn) increases with the particle size, while the TOFs decrease with the particle size. ODBi (APS=3.09nm) shows the lowest and VDPt (APS=36.5nm) the highest T pn. Similarly, ODBi displays a high TOF (15.7min−1) for the oxidation of 1, and the conversion of 1 over that catalyst is always complete. In contrast, the TOF measured for VDPt is only 4.5min−1 (in MeOH at r.t.). Most interestingly, composites with a chain-like morphology (VD and ODSb) exhibit the poorest catalytic activities of all samples (at r.t. TOF=1.5–2.3min−1). These materials are low in exposed Pt. As the reaction is understood to take place on the surface of metals with high standard electrode potentials, sufficient metal exposure (dispersion) is a key performance parameter. Therefore, the inferior catalytic activity of VDPt, VDSb and OD Sb composites is in agreement with a reaction mechanism that proceeds on the Pt surface. The most active catalyst (ODBi) was recycled, and the TOF of the reused catalyst remained close to 16min−1. Acknowledgements M. V. Maphoru is grateful for financial support by a DAAD-NRF bursary. The authors thank Dr. Sabine Verryn (XRD Analytical and Consulting, Pretoria) for help with the interpretation of X-ray diffraction data, and Ms. Charity Maepa and Ms. Rirandzu Rikhotso (CSIR, Pretoria) for SEM and TEM characterization. Appendix A Supplementary material Supplementary data associated with this article can be found, in the online version, at http://dx.doi.org/10.1016/j.jcat.2017.02.003. These data include MOL files and InChiKeys of the most important compounds described in this article. Appendix A Supplementary material Supplementary data 1 Fig. S1. SAED of VDSb. Fig. S2. “Point and shoot” EDX (a) and SEM-EDX mapping (b) of ODBi. Fig. S3. “Point and shoot” EDX analysis (a) and SEM-EDX mapping (b) of MWBi. Fig. S4. “Point and shoot” EDX analysis (a) and SEM-EDX mapping (b) of VDSb. Fig. S5. HRTEM-EDX spectrum of VDSb. Fig. S6. “Point and shoot” EDX analysis (a) and SEM-EDX mapping (b) of MWSb. Fig. S7a–h: TGA-DTG curves for AC and the composite materials. MOL files The following ZIP file contains the MOL files of the most important compounds referred to in this article. MOL files ZIP file containing the MOL files of the most important compounds in this article. References [1] https://goldbook.iupac.org/index-alpha.html (accessed 2017-01-14). [2] F. Rodríguez-Reinoso Carbon 36 1998 159 [3] E. Auer A. Freund J. Pietsch T. Tacke Appl. Catal. A 173 1998 259 [4] S. Zhang R. Fu D. Wu W. Xu Q. Ye Z. Chen Carbon 42 2004 3209 [5] E. Antolini Appl. Catal. B 88 2009 1 [6] X. Yu P.G. Pickup Electrochim. Acta 55 2010 7354 [7] J.M. Campelo D. Luna R. Luque J.M. Marinas A.A. Romero ChemSusChem 2 2009 18 [8] R.S. Amin A.A. Elzatahry K.M. El-Khatib M. Elsayed Youssef Int. J. Electrochem. Sci. 6 2011 4572 [9] I.N. Francesco F. Fontaine-Vive S. Antoniotti ChemCatChem 6 2014 2784 [10] Z. Wu E. Borretto J. Medlock W. Bonrath G. Cravotto ChemCatChem 6 2014 2762 [11] W. Chen J. Zhao J.Y. Lee Z. Liu Mater. Chem. Phys. 91 2005 124 [12] F. Ko C. Lee C. Ko T. Chu Carbon 43 2005 727 [13] H. Li S. Zhang S. Yan Y. Lin Y. Ren Int. J. Electrochem. Sci. 8 2013 2996 [14] H. Kawasaki Nanotechnol. Rev. 2 2013 5 [15] A. Dailly R. Schneider D. Billaud Y. Fort P. Willmann Electrochim. Acta 47 2002 4207 [16] X. Ji K.T. Lee R. Holden L. Zhang J. Zhang G.A. Botton M. Couillard L.F. Nazar Nat. Chem. 2 2010 286 [17] X. Yu P.G. Pickup J. Power Sources 196 2011 7951 [18] C. Pan Y. Li Y. Ma X. Zhao Q. Zhang J. Power Sources 196 2011 6228 [19] S.J.A. Moniz D. Bhachu C.S. Blackman A.J. Cross S. Elouali D. Pugh R.Q. Cabrera S. Vallejos Inorg. Chim. Acta 380 2012 328 [20] T. Mallat Z. Bodnar P. Hug A. Baiker J. Catal. 153 1995 131 [21] T. Mallat A. Baiker Chem. Rev. 104 2004 3037 [22] J.L. Haan K.M. Stafford R.I. Masel J. Phys. Chem. C 114 2010 11665 [23] F.J. Vidal-Iglesias A. López-Cudero J. Solla-Gullón J.M. Feliu Angew. Chem. Int. Ed. 52 2013 964 [24] M.V. Maphoru J. Heveling S.K. Pillai ChemPlusChem 79 2014 99 [25] M.V. Maphoru J. Heveling S. Kesavan Pillai Eur. J. Org. Chem. 331 2016 [26] S. Langa B.C. Nyamunda J. Heveling Catal. Lett. 146 2016 755 [27] J. Hassan M. Sevignon C. Gozzi E. Schulz M. Lemaire Chem. Rev. 2002 1359 [28] T. Takeya T. Otsuka I. Okamoto E. Kotani Tetrahedron 60 2004 10681 [29] K.I. Matveev V.F. Odyakov E.G. Zhizhina J. Mol. Catal. A 114 1996 151 [30] O.V. Zalomaeva N.N. Trukhan I.D. Ivanchikova A.A. Panchenko E. Roduner E.P. Talsi A.B. Sorokin V.A. Rogov O.A. Kholdeeva J. Mol. Catal. A 277 2007 185 [31] M. Selvaraj M. Kandaswamy D.W. Park C.S. Ha Catal. Today 158 2010 377 [32] M. Selvaraj D.-W. Park I. Kim S. Kawi C.S. Ha Dalton Trans. 41 2012 9633 [33] F. Weber A. Rüttimann Ullmann’s Encyclopedia of Industrial Chemistry vol. 38 2003 Wiley-VCH Weinheim 155 [34] O.A. Kholdeeva O.V. Zalomaeva A.N. Shmakov M.S. Melgunov A.B. Sorokin J. Catal. 236 2005 62 [35] G. Strukul F. Somma N. Ballarini F. Cavani A. Frattini S. Guidetti D. Morselli Appl. Catal. A 356 2009 162 [36] A. Kral H. Laatsch Z. Naturforsch. B 48 1993 1401 [37] Y. Zhu S. Murali M.D. Stoller A. Velamakanni R.D. Piner R.S. Ruoff Carbon 48 2010 2118 [38] N.J. Welham J.S. Williams Carbon 36 1998 1309 [39] R. Hussain R. Qadeer M. Ahmad M. Saleem Turk. J. Chem. 24 2000 177 [40] L.J. Malobela J. Heveling W.G. Augustyn L.M. Cele Ind. Eng. Chem. Res. 53 2014 13910 [41] R.C.L. Mooney-Slater Z. Kristallogr. 117 1962 371 [42] H. Chen Q. Tang Y. Chen C. Yan Z. Guo X. Jia Y. Yang Catal. Sci. Technol. 3 2013 328 [43] W. Brockner L.P. Hoyer Spectrochim. Acta A 58 2002 1911 [44] J. Geng W.-H. Hou Y.-N. Lv J.-J. Zhu H.-Y. Chen Inorg. Chem. 44 2005 8503 [45] Z. Li S. Yang J. Zhou D. Li X. Zhou C. Ge Y. Fang Chem. Eng. J. 241 2014 344 [46] S. Arepalli P. Nikolaev O. Gorelik V.G. Hadjiev W. Holmes B. Files L. Yowell Carbon 42 2004 1783 [47] R.B. Mathur S. Seth C. Lal R. Rao B.P. Singh T.L. Dhami A.M. Rao Carbon 45 2007 132 [48] W. Jiang G. Nadeau K. Zaghib K. Kinoshita Thermochim. Acta 351 2000 85 [49] J.E. Mudd, T.J. Gardner, A.G. Sault, Sand Report, Sandia National Laboratories, USA, SAND2001-3118, 2001. [50] K.B. Hong A.A.B. Ismail M.E.B.M. Mahayuddin A.R. Mohamed S.H.S. Zeiri J. Nat. Gas Chem. 15 2006 266 [51] K. Chajara C.-H. Andersson J. Lu E. Widenkvist H. Grennberg New J. Chem. 34 2010 2275 [52] E.L. Charsley J.G. Dunn Rubber Chem. Technol. 55 1982 382 [53] N. Laine F. Vastola P. Walker J. Phys. Chem. 67 1963 2030 [54] S. Kozuch J.M.L. Martin ACS Catal. 2 2012 2787 [55] G. Lente ACS Catal. 3 2013 381 [56] R. Anderson K. Griffin P. Johnston P.L. Alsters Adv. Synth. Catal. 345 2003 517 [57] L. Kreja Z. Phys Chem. (Munich) 140 1984 247 [58] M.A. Hasnat M.M. Rahman S.M. Borhanuddin A. Siddiqua N.M. Bahadur M.R. Karim Catal. Commun. 12 2010 286",
      "scopus-id": "85014352288",
      "coredata": {
        "eid": "1-s2.0-S0021951717300374",
        "dc:description": "Compositional and morphological studies on supported platinum are important for the improvement and expanded use of catalysts for oxidative coupling reactions. Nanocomposites consisting of 5% Pt supported on activated carbon and promoted with 5% Bi or Sb were prepared by electroless deposition and microwave-assisted (MW) methods. Addition of promoters significantly increases the dispersion of Pt. Bismuth reacts with residual phosphorus of the support to form various phases of BiPO4, while Sb cannot be detected by XRD. However, samples prepared by the MW method are unique in that they contain crystalline PtBi or PtSb alloys as part of the phase matrix. The thermal stability of the samples in air and the TOFs for the oxidation of 2-methyl-1-naphthol correlate with the metal dispersion. Since the oxidation reaction is understood to take place on the surface of metals with high standard electrode potentials, sufficient Pt exposure is one of the key performance parameters.",
        "openArchiveArticle": "false",
        "prism:coverDate": "2017-04-30",
        "openaccessUserLicense": null,
        "prism:aggregationType": "Journal",
        "prism:url": "https://api.elsevier.com/content/article/pii/S0021951717300374",
        "dc:creator": [
          {
            "@_fa": "true",
            "$": "Maphoru, Mabuatsela V."
          },
          {
            "@_fa": "true",
            "$": "Kesavan Pillai, Sreejarani"
          },
          {
            "@_fa": "true",
            "$": "Heveling, Josef"
          }
        ],
        "link": [
          {
            "@_fa": "true",
            "@rel": "self",
            "@href": "https://api.elsevier.com/content/article/pii/S0021951717300374"
          },
          {
            "@_fa": "true",
            "@rel": "scidir",
            "@href": "https://www.sciencedirect.com/science/article/pii/S0021951717300374"
          }
        ],
        "dc:format": "application/json",
        "openaccessType": null,
        "pii": "S0021-9517(17)30037-4",
        "prism:volume": "348",
        "prism:publisher": "Elsevier Inc.",
        "dc:title": "Structure-activity relationships of carbon-supported platinum-bismuth and platinum-antimony oxidation catalysts",
        "prism:copyright": "© 2017 Elsevier Inc. All rights reserved.",
        "openaccess": "0",
        "prism:issn": "00219517",
        "dcterms:subject": [
          {
            "@_fa": "true",
            "$": "Nanocomposite"
          },
          {
            "@_fa": "true",
            "$": "Platinum"
          },
          {
            "@_fa": "true",
            "$": "Activated carbon"
          },
          {
            "@_fa": "true",
            "$": "Promoter"
          },
          {
            "@_fa": "true",
            "$": "Oxidative coupling"
          },
          {
            "@_fa": "true",
            "$": "Autocatalytic oxidation"
          }
        ],
        "openaccessArticle": "false",
        "prism:publicationName": "Journal of Catalysis",
        "openaccessSponsorType": null,
        "prism:pageRange": "47-58",
        "prism:endingPage": "58",
        "pubType": "fla",
        "prism:coverDisplayDate": "April 2017",
        "prism:doi": "10.1016/j.jcat.2017.02.003",
        "prism:startingPage": "47",
        "dc:identifier": "doi:10.1016/j.jcat.2017.02.003",
        "openaccessSponsorName": null
      },
      "objects": {
        "object": [
          {
            "@category": "thumbnail",
            "@height": "88",
            "@width": "219",
            "@_fa": "true",
            "$": "https://api.elsevier.com/content/object/eid/1-s2.0-S0021951717300374-fx1.sml?httpAccept=%2A%2F%2A",
            "@multimediatype": "GIF image file",
            "@type": "IMAGE-THUMBNAIL",
            "@size": "9947",
            "@ref": "fx1",
            "@mimetype": "image/gif"
          },
          {
            "@category": "thumbnail",
            "@height": "89",
            "@width": "219",
            "@_fa": "true",
            "$": "https://api.elsevier.com/content/object/eid/1-s2.0-S0021951717300374-gr1.sml?httpAccept=%2A%2F%2A",
            "@multimediatype": "GIF image file",
            "@type": "IMAGE-THUMBNAIL",
            "@size": "6674",
            "@ref": "gr1",
            "@mimetype": "image/gif"
          },
          {
            "@category": "thumbnail",
            "@height": "88",
            "@width": "219",
            "@_fa": "true",
            "$": "https://api.elsevier.com/content/object/eid/1-s2.0-S0021951717300374-gr10.sml?httpAccept=%2A%2F%2A",
            "@multimediatype": "GIF image file",
            "@type": "IMAGE-THUMBNAIL",
            "@size": "6732",
            "@ref": "gr10",
            "@mimetype": "image/gif"
          },
          {
            "@category": "thumbnail",
            "@height": "92",
            "@width": "219",
            "@_fa": "true",
            "$": "https://api.elsevier.com/content/object/eid/1-s2.0-S0021951717300374-gr11.sml?httpAccept=%2A%2F%2A",
            "@multimediatype": "GIF image file",
            "@type": "IMAGE-THUMBNAIL",
            "@size": "3740",
            "@ref": "gr11",
            "@mimetype": "image/gif"
          },
          {
            "@category": "thumbnail",
            "@height": "163",
            "@width": "136",
            "@_fa": "true",
            "$": "https://api.elsevier.com/content/object/eid/1-s2.0-S0021951717300374-gr2.sml?httpAccept=%2A%2F%2A",
            "@multimediatype": "GIF image file",
            "@type": "IMAGE-THUMBNAIL",
            "@size": "12843",
            "@ref": "gr2",
            "@mimetype": "image/gif"
          },
          {
            "@category": "thumbnail",
            "@height": "163",
            "@width": "133",
            "@_fa": "true",
            "$": "https://api.elsevier.com/content/object/eid/1-s2.0-S0021951717300374-gr3.sml?httpAccept=%2A%2F%2A",
            "@multimediatype": "GIF image file",
            "@type": "IMAGE-THUMBNAIL",
            "@size": "16524",
            "@ref": "gr3",
            "@mimetype": "image/gif"
          },
          {
            "@category": "thumbnail",
            "@height": "58",
            "@width": "219",
            "@_fa": "true",
            "$": "https://api.elsevier.com/content/object/eid/1-s2.0-S0021951717300374-gr4.sml?httpAccept=%2A%2F%2A",
            "@multimediatype": "GIF image file",
            "@type": "IMAGE-THUMBNAIL",
            "@size": "9060",
            "@ref": "gr4",
            "@mimetype": "image/gif"
          },
          {
            "@category": "thumbnail",
            "@height": "164",
            "@width": "196",
            "@_fa": "true",
            "$": "https://api.elsevier.com/content/object/eid/1-s2.0-S0021951717300374-gr5.sml?httpAccept=%2A%2F%2A",
            "@multimediatype": "GIF image file",
            "@type": "IMAGE-THUMBNAIL",
            "@size": "15866",
            "@ref": "gr5",
            "@mimetype": "image/gif"
          },
          {
            "@category": "thumbnail",
            "@height": "164",
            "@width": "206",
            "@_fa": "true",
            "$": "https://api.elsevier.com/content/object/eid/1-s2.0-S0021951717300374-gr6.sml?httpAccept=%2A%2F%2A",
            "@multimediatype": "GIF image file",
            "@type": "IMAGE-THUMBNAIL",
            "@size": "23072",
            "@ref": "gr6",
            "@mimetype": "image/gif"
          },
          {
            "@category": "thumbnail",
            "@height": "98",
            "@width": "219",
            "@_fa": "true",
            "$": "https://api.elsevier.com/content/object/eid/1-s2.0-S0021951717300374-gr7.sml?httpAccept=%2A%2F%2A",
            "@multimediatype": "GIF image file",
            "@type": "IMAGE-THUMBNAIL",
            "@size": "6865",
            "@ref": "gr7",
            "@mimetype": "image/gif"
          },
          {
            "@category": "thumbnail",
            "@height": "130",
            "@width": "219",
            "@_fa": "true",
            "$": "https://api.elsevier.com/content/object/eid/1-s2.0-S0021951717300374-gr8.sml?httpAccept=%2A%2F%2A",
            "@multimediatype": "GIF image file",
            "@type": "IMAGE-THUMBNAIL",
            "@size": "4524",
            "@ref": "gr8",
            "@mimetype": "image/gif"
          },
          {
            "@category": "thumbnail",
            "@height": "125",
            "@width": "219",
            "@_fa": "true",
            "$": "https://api.elsevier.com/content/object/eid/1-s2.0-S0021951717300374-gr9.sml?httpAccept=%2A%2F%2A",
            "@multimediatype": "GIF image file",
            "@type": "IMAGE-THUMBNAIL",
            "@size": "5208",
            "@ref": "gr9",
            "@mimetype": "image/gif"
          },
          {
            "@category": "standard",
            "@height": "200",
            "@width": "500",
            "@_fa": "true",
            "$": "https://api.elsevier.com/content/object/eid/1-s2.0-S0021951717300374-fx1.jpg?httpAccept=%2A%2F%2A",
            "@multimediatype": "JPEG image file",
            "@type": "IMAGE-DOWNSAMPLED",
            "@size": "23469",
            "@ref": "fx1",
            "@mimetype": "image/jpeg"
          },
          {
            "@category": "standard",
            "@height": "236",
            "@width": "582",
            "@_fa": "true",
            "$": "https://api.elsevier.com/content/object/eid/1-s2.0-S0021951717300374-gr1.jpg?httpAccept=%2A%2F%2A",
            "@multimediatype": "JPEG image file",
            "@type": "IMAGE-DOWNSAMPLED",
            "@size": "43649",
            "@ref": "gr1",
            "@mimetype": "image/jpeg"
          },
          {
            "@category": "standard",
            "@height": "268",
            "@width": "667",
            "@_fa": "true",
            "$": "https://api.elsevier.com/content/object/eid/1-s2.0-S0021951717300374-gr10.jpg?httpAccept=%2A%2F%2A",
            "@multimediatype": "JPEG image file",
            "@type": "IMAGE-DOWNSAMPLED",
            "@size": "52351",
            "@ref": "gr10",
            "@mimetype": "image/jpeg"
          },
          {
            "@category": "standard",
            "@height": "225",
            "@width": "533",
            "@_fa": "true",
            "$": "https://api.elsevier.com/content/object/eid/1-s2.0-S0021951717300374-gr11.jpg?httpAccept=%2A%2F%2A",
            "@multimediatype": "JPEG image file",
            "@type": "IMAGE-DOWNSAMPLED",
            "@size": "19688",
            "@ref": "gr11",
            "@mimetype": "image/jpeg"
          },
          {
            "@category": "standard",
            "@height": "881",
            "@width": "734",
            "@_fa": "true",
            "$": "https://api.elsevier.com/content/object/eid/1-s2.0-S0021951717300374-gr2.jpg?httpAccept=%2A%2F%2A",
            "@multimediatype": "JPEG image file",
            "@type": "IMAGE-DOWNSAMPLED",
            "@size": "194123",
            "@ref": "gr2",
            "@mimetype": "image/jpeg"
          },
          {
            "@category": "standard",
            "@height": "709",
            "@width": "578",
            "@_fa": "true",
            "$": "https://api.elsevier.com/content/object/eid/1-s2.0-S0021951717300374-gr3.jpg?httpAccept=%2A%2F%2A",
            "@multimediatype": "JPEG image file",
            "@type": "IMAGE-DOWNSAMPLED",
            "@size": "193693",
            "@ref": "gr3",
            "@mimetype": "image/jpeg"
          },
          {
            "@category": "standard",
            "@height": "165",
            "@width": "622",
            "@_fa": "true",
            "$": "https://api.elsevier.com/content/object/eid/1-s2.0-S0021951717300374-gr4.jpg?httpAccept=%2A%2F%2A",
            "@multimediatype": "JPEG image file",
            "@type": "IMAGE-DOWNSAMPLED",
            "@size": "45404",
            "@ref": "gr4",
            "@mimetype": "image/jpeg"
          },
          {
            "@category": "standard",
            "@height": "610",
            "@width": "729",
            "@_fa": "true",
            "$": "https://api.elsevier.com/content/object/eid/1-s2.0-S0021951717300374-gr5.jpg?httpAccept=%2A%2F%2A",
            "@multimediatype": "JPEG image file",
            "@type": "IMAGE-DOWNSAMPLED",
            "@size": "139951",
            "@ref": "gr5",
            "@mimetype": "image/jpeg"
          },
          {
            "@category": "standard",
            "@height": "459",
            "@width": "578",
            "@_fa": "true",
            "$": "https://api.elsevier.com/content/object/eid/1-s2.0-S0021951717300374-gr6.jpg?httpAccept=%2A%2F%2A",
            "@multimediatype": "JPEG image file",
            "@type": "IMAGE-DOWNSAMPLED",
            "@size": "117555",
            "@ref": "gr6",
            "@mimetype": "image/jpeg"
          },
          {
            "@category": "standard",
            "@height": "240",
            "@width": "533",
            "@_fa": "true",
            "$": "https://api.elsevier.com/content/object/eid/1-s2.0-S0021951717300374-gr7.jpg?httpAccept=%2A%2F%2A",
            "@multimediatype": "JPEG image file",
            "@type": "IMAGE-DOWNSAMPLED",
            "@size": "39409",
            "@ref": "gr7",
            "@mimetype": "image/jpeg"
          },
          {
            "@category": "standard",
            "@height": "209",
            "@width": "353",
            "@_fa": "true",
            "$": "https://api.elsevier.com/content/object/eid/1-s2.0-S0021951717300374-gr8.jpg?httpAccept=%2A%2F%2A",
            "@multimediatype": "JPEG image file",
            "@type": "IMAGE-DOWNSAMPLED",
            "@size": "13201",
            "@ref": "gr8",
            "@mimetype": "image/jpeg"
          },
          {
            "@category": "standard",
            "@height": "211",
            "@width": "371",
            "@_fa": "true",
            "$": "https://api.elsevier.com/content/object/eid/1-s2.0-S0021951717300374-gr9.jpg?httpAccept=%2A%2F%2A",
            "@multimediatype": "JPEG image file",
            "@type": "IMAGE-DOWNSAMPLED",
            "@size": "16519",
            "@ref": "gr9",
            "@mimetype": "image/jpeg"
          },
          {
            "@category": "high",
            "@height": "886",
            "@width": "2213",
            "@_fa": "true",
            "$": "https://api.elsevier.com/content/object/eid/1-s2.0-S0021951717300374-fx1_lrg.jpg?httpAccept=%2A%2F%2A",
            "@multimediatype": "JPEG image file",
            "@type": "IMAGE-HIGH-RES",
            "@size": "142635",
            "@ref": "fx1",
            "@mimetype": "image/jpeg"
          },
          {
            "@category": "high",
            "@height": "1043",
            "@width": "2576",
            "@_fa": "true",
            "$": "https://api.elsevier.com/content/object/eid/1-s2.0-S0021951717300374-gr1_lrg.jpg?httpAccept=%2A%2F%2A",
            "@multimediatype": "JPEG image file",
            "@type": "IMAGE-HIGH-RES",
            "@size": "348835",
            "@ref": "gr1",
            "@mimetype": "image/jpeg"
          },
          {
            "@category": "high",
            "@height": "1189",
            "@width": "2955",
            "@_fa": "true",
            "$": "https://api.elsevier.com/content/object/eid/1-s2.0-S0021951717300374-gr10_lrg.jpg?httpAccept=%2A%2F%2A",
            "@multimediatype": "JPEG image file",
            "@type": "IMAGE-HIGH-RES",
            "@size": "498606",
            "@ref": "gr10",
            "@mimetype": "image/jpeg"
          },
          {
            "@category": "high",
            "@height": "996",
            "@width": "2362",
            "@_fa": "true",
            "$": "https://api.elsevier.com/content/object/eid/1-s2.0-S0021951717300374-gr11_lrg.jpg?httpAccept=%2A%2F%2A",
            "@multimediatype": "JPEG image file",
            "@type": "IMAGE-HIGH-RES",
            "@size": "141616",
            "@ref": "gr11",
            "@mimetype": "image/jpeg"
          },
          {
            "@category": "high",
            "@height": "3898",
            "@width": "3248",
            "@_fa": "true",
            "$": "https://api.elsevier.com/content/object/eid/1-s2.0-S0021951717300374-gr2_lrg.jpg?httpAccept=%2A%2F%2A",
            "@multimediatype": "JPEG image file",
            "@type": "IMAGE-HIGH-RES",
            "@size": "1490886",
            "@ref": "gr2",
            "@mimetype": "image/jpeg"
          },
          {
            "@category": "high",
            "@height": "3141",
            "@width": "2559",
            "@_fa": "true",
            "$": "https://api.elsevier.com/content/object/eid/1-s2.0-S0021951717300374-gr3_lrg.jpg?httpAccept=%2A%2F%2A",
            "@multimediatype": "JPEG image file",
            "@type": "IMAGE-HIGH-RES",
            "@size": "1859949",
            "@ref": "gr3",
            "@mimetype": "image/jpeg"
          },
          {
            "@category": "high",
            "@height": "731",
            "@width": "2756",
            "@_fa": "true",
            "$": "https://api.elsevier.com/content/object/eid/1-s2.0-S0021951717300374-gr4_lrg.jpg?httpAccept=%2A%2F%2A",
            "@multimediatype": "JPEG image file",
            "@type": "IMAGE-HIGH-RES",
            "@size": "343937",
            "@ref": "gr4",
            "@mimetype": "image/jpeg"
          },
          {
            "@category": "high",
            "@height": "2703",
            "@width": "3228",
            "@_fa": "true",
            "$": "https://api.elsevier.com/content/object/eid/1-s2.0-S0021951717300374-gr5_lrg.jpg?httpAccept=%2A%2F%2A",
            "@multimediatype": "JPEG image file",
            "@type": "IMAGE-HIGH-RES",
            "@size": "1077890",
            "@ref": "gr5",
            "@mimetype": "image/jpeg"
          },
          {
            "@category": "high",
            "@height": "2034",
            "@width": "2559",
            "@_fa": "true",
            "$": "https://api.elsevier.com/content/object/eid/1-s2.0-S0021951717300374-gr6_lrg.jpg?httpAccept=%2A%2F%2A",
            "@multimediatype": "JPEG image file",
            "@type": "IMAGE-HIGH-RES",
            "@size": "1058655",
            "@ref": "gr6",
            "@mimetype": "image/jpeg"
          },
          {
            "@category": "high",
            "@height": "1062",
            "@width": "2362",
            "@_fa": "true",
            "$": "https://api.elsevier.com/content/object/eid/1-s2.0-S0021951717300374-gr7_lrg.jpg?httpAccept=%2A%2F%2A",
            "@multimediatype": "JPEG image file",
            "@type": "IMAGE-HIGH-RES",
            "@size": "310615",
            "@ref": "gr7",
            "@mimetype": "image/jpeg"
          },
          {
            "@category": "high",
            "@height": "926",
            "@width": "1563",
            "@_fa": "true",
            "$": "https://api.elsevier.com/content/object/eid/1-s2.0-S0021951717300374-gr8_lrg.jpg?httpAccept=%2A%2F%2A",
            "@multimediatype": "JPEG image file",
            "@type": "IMAGE-HIGH-RES",
            "@size": "100383",
            "@ref": "gr8",
            "@mimetype": "image/jpeg"
          },
          {
            "@category": "high",
            "@height": "934",
            "@width": "1642",
            "@_fa": "true",
            "$": "https://api.elsevier.com/content/object/eid/1-s2.0-S0021951717300374-gr9_lrg.jpg?httpAccept=%2A%2F%2A",
            "@multimediatype": "JPEG image file",
            "@type": "IMAGE-HIGH-RES",
            "@size": "120274",
            "@ref": "gr9",
            "@mimetype": "image/jpeg"
          },
          {
            "@category": "standard",
            "@_fa": "true",
            "$": "https://api.elsevier.com/content/object/eid/1-s2.0-S0021951717300374-mol.zip?httpAccept=%2A%2F%2A",
            "@multimediatype": "ZIP file",
            "@type": "APPLICATION",
            "@size": "2257",
            "@ref": "mol",
            "@mimetype": "application/zip"
          },
          {
            "@category": "standard",
            "@_fa": "true",
            "$": "https://api.elsevier.com/content/object/eid/1-s2.0-S0021951717300374-mmc1.docx?httpAccept=%2A%2F%2A",
            "@multimediatype": "Microsoft Word file",
            "@type": "APPLICATION",
            "@size": "5269648",
            "@ref": "mmc1",
            "@mimetype": "application/word"
          },
          {
            "@category": "thumbnail",
            "@height": "13",
            "@width": "19",
            "@_fa": "true",
            "$": "https://api.elsevier.com/content/object/eid/1-s2.0-S0021951717300374-si1.gif?httpAccept=%2A%2F%2A",
            "@multimediatype": "GIF image file",
            "@type": "ALTIMG",
            "@size": "223",
            "@ref": "si1",
            "@mimetype": "image/gif"
          },
          {
            "@category": "thumbnail",
            "@height": "15",
            "@width": "20",
            "@_fa": "true",
            "$": "https://api.elsevier.com/content/object/eid/1-s2.0-S0021951717300374-si2.gif?httpAccept=%2A%2F%2A",
            "@multimediatype": "GIF image file",
            "@type": "ALTIMG",
            "@size": "235",
            "@ref": "si2",
            "@mimetype": "image/gif"
          },
          {
            "@category": "thumbnail",
            "@height": "13",
            "@width": "18",
            "@_fa": "true",
            "$": "https://api.elsevier.com/content/object/eid/1-s2.0-S0021951717300374-si3.gif?httpAccept=%2A%2F%2A",
            "@multimediatype": "GIF image file",
            "@type": "ALTIMG",
            "@size": "213",
            "@ref": "si3",
            "@mimetype": "image/gif"
          },
          {
            "@category": "thumbnail",
            "@height": "15",
            "@width": "20",
            "@_fa": "true",
            "$": "https://api.elsevier.com/content/object/eid/1-s2.0-S0021951717300374-si4.gif?httpAccept=%2A%2F%2A",
            "@multimediatype": "GIF image file",
            "@type": "ALTIMG",
            "@size": "234",
            "@ref": "si4",
            "@mimetype": "image/gif"
          }
        ]
      },
      "link": {
        "@rel": "abstract",
        "@href": "https://api.elsevier.com/content/abstract/scopus_id/85014352288"
      }
    }
  }
}