{
  "metadata": {
    "title": "Atomically dispersed Zn sites on N-doped carbon boosted transesterification of symmetrical organic carbonates with biomass-derived alcohols",
    "authors": "; ; ",
    "journal": "Journal of Catalysis",
    "date": "2024-11-30",
    "doi": "10.1016/j.jcat.2024.115763",
    "abstract": "",
    "uri": "https://api.elsevier.com/content/article/pii/S0021951724004767",
    "pii": "S0021951724004767"
  },
  "fulltext": {
    "full-text-retrieval-response": {
      "scopus-eid": "2-s2.0-85204223562",
      "originalText": "serial JL 272561 291210 291744 291809 31 Journal of Catalysis JOURNALCATALYSIS 2024-09-17 2024-09-17 2024-09-19 2024-09-19 2024-11-04T20:43:04 1-s2.0-S0021951724004767 S0021-9517(24)00476-7 S0021951724004767 10.1016/j.jcat.2024.115763 S300 S300.1 FULL-TEXT 1-s2.0-S0021951724X00111 2024-11-04T22:20:23.112199Z 0 0 20241101 20241130 2024 2024-09-17T16:47:43.50441Z absattachment articleinfo articlenumber articletitlenorm authfirstinitialnorm authfirstsurnamenorm cid cids contenttype copyright crossmark dateloaded dateloadedtxt datesearch datesort dateupdated dco docsubtype doctype doi eid ewtransactionid hubeid indexeddate issn issnnorm itemstage itemtransactionid itemweight openaccess openarchive pg pgfirst pii piinorm pubdateend pubdatestart pubdatetxt pubyr sectiontitle sortorder srctitle srctitlenorm srctype ssids alllist content subj subheadings suppl tomb volfirst volissue volumelist webpdf webpdfpagecount yearnav figure table e-component body acknowledge affil appendices articletitle auth authfirstini authfull authkeywords authlast grantnumber grantsponsor grantsponsorid highlightsabst orcid primabst pubtype ref specialabst 0021-9517 00219517 true 439 439 C Volume 439 20 115763 115763 115763 202411 November 2024 2024-11-01 2024-11-30 2024 Regular Articles article fla © 2024 Elsevier Inc. All rights are reserved, including those for text and data mining, AI training, and similar technologies. ATOMICALLYDISPERSEDZNSITESNDOPEDCARBONBOOSTEDTRANSESTERIFICATIONSYMMETRICALORGANICCARBONATESBIOMASSDERIVEDALCOHOLS PANG Y 1 Introduction 2 Materials and methods 2.1 Materials 2.2 Construction of Zn@C-T catalysts 2.3 Catalysts characterization 2.4 The process to conduct the transesterification 2.5 Reusability of the Zn@C-900 3 Results and discussion 3.1 Fabrication and characterization of the Zn@C-T materials 3.2 Catalytic activity of the Zn@C-T on transesterification of DEC 3.3 Optimization of reaction conditions 3.4 Scope of biomass-derived alcohols 3.5 Reaction mechanism 4 Conclusions CRediT authorship contribution statement Acknowledgements Appendix A Supplementary material References SHI 2022 62 71 J AOMCHAD 2021 1077 1113 V SAINI 2021 12800 12803 S VETTER 2003 338 342 J BURK 1993 395 398 R SALVATORE 2000 2797 2800 R FUJITA 2001 87 91 S VELDURTHY 2005 1972 1976 B VELDURTHY 2004 734 735 B KANTAM 2007 1671 1675 M MUTLU 2012 1728 1735 H CARLONI 2002 199 204 S ZHOU 2010 939 945 Y SONG 2011 922 927 J FU 2022 11955 11959 X SONG 2022 2204638 J WANG 2021 23154 23158 H ZHANG 2021 21751 21755 L PAN 2024 123275 S CHENG 2021 12673 12681 H DERITA 2019 746 751 L WANG 2018 7113 7119 Y HAN 2022 681 688 L SUN 2022 W ZHOU 2023 120570 C CUI 2019 1679 1685 X LI 2022 2202892 X LIN 2022 11573 11585 X ZHONG 2021 119891 X PU 2015 25373 25377 Y WINTER 2005 91 100 F SUN 2015 13 22 G SUN 2021 126 134 H WANG 2024 2166 T SUN 2017 372 379 J XIE 2021 4823 C ZENG 2018 515 522 R LIU 2010 467 473 G WANG 2019 172 181 Y ADAM 2011 87 90 F PANGX2024X115763 PANGX2024X115763XY 2026-09-19T00:00:00.000Z 2026-09-19T00:00:00.000Z http://creativecommons.org/licenses/by-nc-nd/4.0/ © 2024 Elsevier Inc. All rights are reserved, including those for text and data mining, AI training, and similar technologies. 2024-09-21T12:25:41.351Z http://vtw.elsevier.com/data/voc/AddOnTypes/50.7/aggregated-refined Guangdong Basic and Applied Basic Research Foundation 2023A1515011251 Basic and Applied Basic Research Foundation of Guangdong Province http://data.elsevier.com/vocabulary/SciValFunders/501100021171 http://sws.geonames.org/1814991/ National Natural Science Foundation of China 22372043 22072157 NSFC National Natural Science Foundation of China http://data.elsevier.com/vocabulary/SciValFunders/501100001809 http://sws.geonames.org/1814991/ This work was financially supported by Guangdong Basic and Applied Basic Research Foundation (2023A1515011251), and the National Natural Science Foundation of China (22372043, and 22072157). https://doi.org/10.15223/policy-017 https://doi.org/10.15223/policy-037 https://doi.org/10.15223/policy-012 https://doi.org/10.15223/policy-029 https://doi.org/10.15223/policy-004 item S0021-9517(24)00476-7 S0021951724004767 1-s2.0-S0021951724004767 10.1016/j.jcat.2024.115763 272561 2024-11-04T22:20:23.112199Z 2024-11-01 2024-11-30 1-s2.0-S0021951724004767-main.pdf https://s3-eu-west-1.amazonaws.com/prod-ucs-content-store-eu-west/content/pii:S0021951724004767/MAIN/application/pdf/0240816e7983db79d3df293a54f56cfe/main.pdf main.pdf pdf true 5200003 MAIN 10 1-s2.0-S0021951724004767-main_1.png https://s3-eu-west-1.amazonaws.com/prod-ucs-content-store-eu-west/content/pii:S0021951724004767/PREVIEW/image/png/f1dd331a24f61fa6fdaeb991b34e1493/main_1.png main_1.png png 57976 849 656 IMAGE-WEB-PDF 1 1-s2.0-S0021951724004767-fx15.jpg https://s3-eu-west-1.amazonaws.com/prod-ucs-content-store-eu-west/content/pii:S0021951724004767/fx15/DOWNSAMPLED/image/jpeg/463a2adf06544e0f5599a5ad4b67360f/fx15.jpg fx15 fx15.jpg jpg 2076 63 117 IMAGE-DOWNSAMPLED 1-s2.0-S0021951724004767-fx14.jpg https://s3-eu-west-1.amazonaws.com/prod-ucs-content-store-eu-west/content/pii:S0021951724004767/fx14/DOWNSAMPLED/image/jpeg/c49adb46a19310e8fe885c710dad2a4b/fx14.jpg fx14 fx14.jpg jpg 1709 41 82 IMAGE-DOWNSAMPLED 1-s2.0-S0021951724004767-fx13.jpg https://s3-eu-west-1.amazonaws.com/prod-ucs-content-store-eu-west/content/pii:S0021951724004767/fx13/DOWNSAMPLED/image/jpeg/8556f25dfd1888c71100c5ecbc05a01b/fx13.jpg fx13 fx13.jpg jpg 1689 47 103 IMAGE-DOWNSAMPLED 1-s2.0-S0021951724004767-fx12.jpg https://s3-eu-west-1.amazonaws.com/prod-ucs-content-store-eu-west/content/pii:S0021951724004767/fx12/DOWNSAMPLED/image/jpeg/99a85cce3825b825dc1ebba2cf8ba276/fx12.jpg fx12 fx12.jpg jpg 1176 31 64 IMAGE-DOWNSAMPLED 1-s2.0-S0021951724004767-fx11.jpg https://s3-eu-west-1.amazonaws.com/prod-ucs-content-store-eu-west/content/pii:S0021951724004767/fx11/DOWNSAMPLED/image/jpeg/8f139c457ef558f9fe0f1d5b3b072a00/fx11.jpg fx11 fx11.jpg jpg 1719 57 77 IMAGE-DOWNSAMPLED 1-s2.0-S0021951724004767-fx1.jpg https://s3-eu-west-1.amazonaws.com/prod-ucs-content-store-eu-west/content/pii:S0021951724004767/fx1/DOWNSAMPLED/image/jpeg/5035faef6333070d4b98edb34116314d/fx1.jpg fx1 fx1.jpg jpg 4706 35 449 IMAGE-DOWNSAMPLED 1-s2.0-S0021951724004767-fx10.jpg https://s3-eu-west-1.amazonaws.com/prod-ucs-content-store-eu-west/content/pii:S0021951724004767/fx10/DOWNSAMPLED/image/jpeg/2448f265f09333eb1707753c03fd642c/fx10.jpg fx10 fx10.jpg jpg 1239 56 42 IMAGE-DOWNSAMPLED 1-s2.0-S0021951724004767-ga1.jpg https://s3-eu-west-1.amazonaws.com/prod-ucs-content-store-eu-west/content/pii:S0021951724004767/ga1/DOWNSAMPLED/image/jpeg/7902ee6b08faa4d712e949e139d0560c/ga1.jpg ga1 true ga1.jpg jpg 18258 166 500 IMAGE-DOWNSAMPLED 1-s2.0-S0021951724004767-gr5.jpg https://s3-eu-west-1.amazonaws.com/prod-ucs-content-store-eu-west/content/pii:S0021951724004767/gr5/DOWNSAMPLED/image/jpeg/1cbb4d0df7622913f4904f7adf332a50/gr5.jpg gr5 gr5.jpg jpg 77900 626 739 IMAGE-DOWNSAMPLED 1-s2.0-S0021951724004767-gr6.jpg https://s3-eu-west-1.amazonaws.com/prod-ucs-content-store-eu-west/content/pii:S0021951724004767/gr6/DOWNSAMPLED/image/jpeg/698836a34d3961fac843fa5dd2ba6beb/gr6.jpg gr6 gr6.jpg jpg 23844 273 382 IMAGE-DOWNSAMPLED 1-s2.0-S0021951724004767-gr3.jpg https://s3-eu-west-1.amazonaws.com/prod-ucs-content-store-eu-west/content/pii:S0021951724004767/gr3/DOWNSAMPLED/image/jpeg/0ab87e4df59121edad011b8ced37287a/gr3.jpg gr3 gr3.jpg jpg 63524 412 535 IMAGE-DOWNSAMPLED 1-s2.0-S0021951724004767-gr4.jpg https://s3-eu-west-1.amazonaws.com/prod-ucs-content-store-eu-west/content/pii:S0021951724004767/gr4/DOWNSAMPLED/image/jpeg/313b9a615f11f9bdb0f87989fa558c45/gr4.jpg gr4 gr4.jpg jpg 59970 534 535 IMAGE-DOWNSAMPLED 1-s2.0-S0021951724004767-fx4.jpg https://s3-eu-west-1.amazonaws.com/prod-ucs-content-store-eu-west/content/pii:S0021951724004767/fx4/DOWNSAMPLED/image/jpeg/37e4c7cd232310cb787c6c204d63667e/fx4.jpg fx4 fx4.jpg jpg 1194 28 81 IMAGE-DOWNSAMPLED 1-s2.0-S0021951724004767-fx5.jpg https://s3-eu-west-1.amazonaws.com/prod-ucs-content-store-eu-west/content/pii:S0021951724004767/fx5/DOWNSAMPLED/image/jpeg/8a56d48466bf45655c2d0b44658215a6/fx5.jpg fx5 fx5.jpg jpg 1541 41 110 IMAGE-DOWNSAMPLED 1-s2.0-S0021951724004767-fx2.jpg https://s3-eu-west-1.amazonaws.com/prod-ucs-content-store-eu-west/content/pii:S0021951724004767/fx2/DOWNSAMPLED/image/jpeg/b7ff82a14a312d81b9d1c650516d7e8f/fx2.jpg fx2 fx2.jpg jpg 1040 28 58 IMAGE-DOWNSAMPLED 1-s2.0-S0021951724004767-fx3.jpg https://s3-eu-west-1.amazonaws.com/prod-ucs-content-store-eu-west/content/pii:S0021951724004767/fx3/DOWNSAMPLED/image/jpeg/655b297a710c4773de6d0cf5f03a2bd9/fx3.jpg fx3 fx3.jpg jpg 1446 41 88 IMAGE-DOWNSAMPLED 1-s2.0-S0021951724004767-gr1.jpg https://s3-eu-west-1.amazonaws.com/prod-ucs-content-store-eu-west/content/pii:S0021951724004767/gr1/DOWNSAMPLED/image/jpeg/13c29b2ded662d42a4e6d5adde3211a6/gr1.jpg gr1 gr1.jpg jpg 98696 434 740 IMAGE-DOWNSAMPLED 1-s2.0-S0021951724004767-fx8.jpg https://s3-eu-west-1.amazonaws.com/prod-ucs-content-store-eu-west/content/pii:S0021951724004767/fx8/DOWNSAMPLED/image/jpeg/a93daa80cb0cc5dc45b964c816e75b44/fx8.jpg fx8 fx8.jpg jpg 955 31 47 IMAGE-DOWNSAMPLED 1-s2.0-S0021951724004767-gr2.jpg https://s3-eu-west-1.amazonaws.com/prod-ucs-content-store-eu-west/content/pii:S0021951724004767/gr2/DOWNSAMPLED/image/jpeg/ab72b0c2af7dcd65e69ece0e800af319/gr2.jpg gr2 gr2.jpg jpg 53576 293 778 IMAGE-DOWNSAMPLED 1-s2.0-S0021951724004767-fx9.jpg https://s3-eu-west-1.amazonaws.com/prod-ucs-content-store-eu-west/content/pii:S0021951724004767/fx9/DOWNSAMPLED/image/jpeg/0d28a3a30f6ccaf577d518af4234e9f2/fx9.jpg fx9 fx9.jpg jpg 1532 31 84 IMAGE-DOWNSAMPLED 1-s2.0-S0021951724004767-fx6.jpg https://s3-eu-west-1.amazonaws.com/prod-ucs-content-store-eu-west/content/pii:S0021951724004767/fx6/DOWNSAMPLED/image/jpeg/bb6a92df9a6be27256520c6694da75aa/fx6.jpg fx6 fx6.jpg jpg 1010 25 59 IMAGE-DOWNSAMPLED 1-s2.0-S0021951724004767-fx7.jpg https://s3-eu-west-1.amazonaws.com/prod-ucs-content-store-eu-west/content/pii:S0021951724004767/fx7/DOWNSAMPLED/image/jpeg/c6efb44594adac2b4b71df5c286c9da0/fx7.jpg fx7 fx7.jpg jpg 1474 37 95 IMAGE-DOWNSAMPLED 1-s2.0-S0021951724004767-fx15.sml https://s3-eu-west-1.amazonaws.com/prod-ucs-content-store-eu-west/content/pii:S0021951724004767/fx15/THUMBNAIL/image/gif/b2260849428a66e42b712f292a2590b1/fx15.sml fx15 fx15.sml sml 3371 117 219 IMAGE-THUMBNAIL 1-s2.0-S0021951724004767-fx14.sml https://s3-eu-west-1.amazonaws.com/prod-ucs-content-store-eu-west/content/pii:S0021951724004767/fx14/THUMBNAIL/image/gif/17cd4939c619858fc1d8b318ac42e4e3/fx14.sml fx14 fx14.sml sml 4099 109 219 IMAGE-THUMBNAIL 1-s2.0-S0021951724004767-fx13.sml https://s3-eu-west-1.amazonaws.com/prod-ucs-content-store-eu-west/content/pii:S0021951724004767/fx13/THUMBNAIL/image/gif/81716d798dc8e2c3165d59091e7060c3/fx13.sml fx13 fx13.sml sml 3711 101 219 IMAGE-THUMBNAIL 1-s2.0-S0021951724004767-fx12.sml https://s3-eu-west-1.amazonaws.com/prod-ucs-content-store-eu-west/content/pii:S0021951724004767/fx12/THUMBNAIL/image/gif/b93686a783464188decfcae6f0885154/fx12.sml fx12 fx12.sml sml 4940 106 219 IMAGE-THUMBNAIL 1-s2.0-S0021951724004767-fx11.sml https://s3-eu-west-1.amazonaws.com/prod-ucs-content-store-eu-west/content/pii:S0021951724004767/fx11/THUMBNAIL/image/gif/1f9b43d7e178d53d1ddb896d32a7ca34/fx11.sml fx11 fx11.sml sml 5145 162 219 IMAGE-THUMBNAIL 1-s2.0-S0021951724004767-fx1.sml https://s3-eu-west-1.amazonaws.com/prod-ucs-content-store-eu-west/content/pii:S0021951724004767/fx1/THUMBNAIL/image/gif/726aa9fed054a0bcf4fd96ea8e5dc588/fx1.sml fx1 fx1.sml sml 1216 17 219 IMAGE-THUMBNAIL 1-s2.0-S0021951724004767-fx10.sml https://s3-eu-west-1.amazonaws.com/prod-ucs-content-store-eu-west/content/pii:S0021951724004767/fx10/THUMBNAIL/image/gif/938abeeaee943198154ed60849f8b7b2/fx10.sml fx10 fx10.sml sml 4769 252 189 IMAGE-THUMBNAIL 1-s2.0-S0021951724004767-ga1.sml https://s3-eu-west-1.amazonaws.com/prod-ucs-content-store-eu-west/content/pii:S0021951724004767/ga1/THUMBNAIL/image/gif/1e9683c4fba3d956c04fa591fd08812d/ga1.sml ga1 true ga1.sml sml 7815 73 219 IMAGE-THUMBNAIL 1-s2.0-S0021951724004767-gr5.sml https://s3-eu-west-1.amazonaws.com/prod-ucs-content-store-eu-west/content/pii:S0021951724004767/gr5/THUMBNAIL/image/gif/dde5747b9ac8f0ebbc8e741b9b684ba3/gr5.sml gr5 gr5.sml sml 11627 164 194 IMAGE-THUMBNAIL 1-s2.0-S0021951724004767-gr6.sml https://s3-eu-west-1.amazonaws.com/prod-ucs-content-store-eu-west/content/pii:S0021951724004767/gr6/THUMBNAIL/image/gif/908558071b5ae26779f512f9ccf30682/gr6.sml gr6 gr6.sml sml 6911 157 219 IMAGE-THUMBNAIL 1-s2.0-S0021951724004767-gr3.sml https://s3-eu-west-1.amazonaws.com/prod-ucs-content-store-eu-west/content/pii:S0021951724004767/gr3/THUMBNAIL/image/gif/ffde90d3dcf35a6ce999854e9457edf0/gr3.sml gr3 gr3.sml sml 14032 164 213 IMAGE-THUMBNAIL 1-s2.0-S0021951724004767-gr4.sml https://s3-eu-west-1.amazonaws.com/prod-ucs-content-store-eu-west/content/pii:S0021951724004767/gr4/THUMBNAIL/image/gif/3892d9df6f16472316a458a3a85f8ce6/gr4.sml gr4 gr4.sml sml 9865 164 164 IMAGE-THUMBNAIL 1-s2.0-S0021951724004767-fx4.sml https://s3-eu-west-1.amazonaws.com/prod-ucs-content-store-eu-west/content/pii:S0021951724004767/fx4/THUMBNAIL/image/gif/515cf3d35f5a32dfc2629dd49ece7d16/fx4.sml fx4 fx4.sml sml 3046 76 219 IMAGE-THUMBNAIL 1-s2.0-S0021951724004767-fx5.sml https://s3-eu-west-1.amazonaws.com/prod-ucs-content-store-eu-west/content/pii:S0021951724004767/fx5/THUMBNAIL/image/gif/9713294c713ec41a1d99357a47ec0d1d/fx5.sml fx5 fx5.sml sml 2865 82 219 IMAGE-THUMBNAIL 1-s2.0-S0021951724004767-fx2.sml https://s3-eu-west-1.amazonaws.com/prod-ucs-content-store-eu-west/content/pii:S0021951724004767/fx2/THUMBNAIL/image/gif/4e5ad7cb59dcbb5db93dfb2a79f8f0bc/fx2.sml fx2 fx2.sml sml 3742 107 219 IMAGE-THUMBNAIL 1-s2.0-S0021951724004767-fx3.sml https://s3-eu-west-1.amazonaws.com/prod-ucs-content-store-eu-west/content/pii:S0021951724004767/fx3/THUMBNAIL/image/gif/4d0bf2ac9f99a88749696cbdd08617db/fx3.sml fx3 fx3.sml sml 3343 101 219 IMAGE-THUMBNAIL 1-s2.0-S0021951724004767-gr1.sml https://s3-eu-west-1.amazonaws.com/prod-ucs-content-store-eu-west/content/pii:S0021951724004767/gr1/THUMBNAIL/image/gif/4585b25afad143e2f013ece40e16a1a7/gr1.sml gr1 gr1.sml sml 17581 128 219 IMAGE-THUMBNAIL 1-s2.0-S0021951724004767-fx8.sml https://s3-eu-west-1.amazonaws.com/prod-ucs-content-store-eu-west/content/pii:S0021951724004767/fx8/THUMBNAIL/image/gif/d80c0ffc4a7e9ab712eadfa9a19c3045/fx8.sml fx8 fx8.sml sml 3321 137 209 IMAGE-THUMBNAIL 1-s2.0-S0021951724004767-gr2.sml https://s3-eu-west-1.amazonaws.com/prod-ucs-content-store-eu-west/content/pii:S0021951724004767/gr2/THUMBNAIL/image/gif/0da9a832f11ce083e96e64143c53e8f8/gr2.sml gr2 gr2.sml sml 5934 82 219 IMAGE-THUMBNAIL 1-s2.0-S0021951724004767-fx9.sml https://s3-eu-west-1.amazonaws.com/prod-ucs-content-store-eu-west/content/pii:S0021951724004767/fx9/THUMBNAIL/image/gif/b7fad4e8dc7be469308d89b372bda49d/fx9.sml fx9 fx9.sml sml 3676 82 219 IMAGE-THUMBNAIL 1-s2.0-S0021951724004767-fx6.sml https://s3-eu-west-1.amazonaws.com/prod-ucs-content-store-eu-west/content/pii:S0021951724004767/fx6/THUMBNAIL/image/gif/e32adbbf1776491010816a906bc4c98f/fx6.sml fx6 fx6.sml sml 4365 93 219 IMAGE-THUMBNAIL 1-s2.0-S0021951724004767-fx7.sml https://s3-eu-west-1.amazonaws.com/prod-ucs-content-store-eu-west/content/pii:S0021951724004767/fx7/THUMBNAIL/image/gif/9adc229ab39dea7c00143ffc73745c50/fx7.sml fx7 fx7.sml sml 3449 84 219 IMAGE-THUMBNAIL 1-s2.0-S0021951724004767-fx15_lrg.jpg https://s3-eu-west-1.amazonaws.com/prod-ucs-content-store-eu-west/content/pii:S0021951724004767/HIGHRES/image/jpeg/ead397aeb5a00f21f0244df8dcfcafb7/fx15_lrg.jpg fx15 fx15_lrg.jpg jpg 14281 280 522 IMAGE-HIGH-RES 1-s2.0-S0021951724004767-fx14_lrg.jpg https://s3-eu-west-1.amazonaws.com/prod-ucs-content-store-eu-west/content/pii:S0021951724004767/HIGHRES/image/jpeg/58d2324e652addc88afdf72e6251a07d/fx14_lrg.jpg fx14 fx14_lrg.jpg jpg 10652 182 365 IMAGE-HIGH-RES 1-s2.0-S0021951724004767-fx13_lrg.jpg https://s3-eu-west-1.amazonaws.com/prod-ucs-content-store-eu-west/content/pii:S0021951724004767/HIGHRES/image/jpeg/f80a14fb40540685dde7e3b00ed92113/fx13_lrg.jpg fx13 fx13_lrg.jpg jpg 12112 210 456 IMAGE-HIGH-RES 1-s2.0-S0021951724004767-fx12_lrg.jpg https://s3-eu-west-1.amazonaws.com/prod-ucs-content-store-eu-west/content/pii:S0021951724004767/HIGHRES/image/jpeg/f64801994bf36db3954cd08b972f2a42/fx12_lrg.jpg fx12 fx12_lrg.jpg jpg 8062 138 286 IMAGE-HIGH-RES 1-s2.0-S0021951724004767-fx11_lrg.jpg https://s3-eu-west-1.amazonaws.com/prod-ucs-content-store-eu-west/content/pii:S0021951724004767/HIGHRES/image/jpeg/9716bca0dc9ff3abb76c2c1017b04c69/fx11_lrg.jpg fx11 fx11_lrg.jpg jpg 11471 252 341 IMAGE-HIGH-RES 1-s2.0-S0021951724004767-fx1_lrg.jpg https://s3-eu-west-1.amazonaws.com/prod-ucs-content-store-eu-west/content/pii:S0021951724004767/HIGHRES/image/jpeg/a4fd6f60e46475dd3dfe8c4fa6d09205/fx1_lrg.jpg fx1 fx1_lrg.jpg jpg 31962 154 1989 IMAGE-HIGH-RES 1-s2.0-S0021951724004767-fx10_lrg.jpg https://s3-eu-west-1.amazonaws.com/prod-ucs-content-store-eu-west/content/pii:S0021951724004767/HIGHRES/image/jpeg/0dd10f6f7f9695e3d22af5138ac5d62a/fx10_lrg.jpg fx10 fx10_lrg.jpg jpg 8091 252 189 IMAGE-HIGH-RES 1-s2.0-S0021951724004767-ga1_lrg.jpg https://s3-eu-west-1.amazonaws.com/prod-ucs-content-store-eu-west/content/pii:S0021951724004767/HIGHRES/image/jpeg/b6e1baa2fe9e369ff4d5e2d804fe2f8f/ga1_lrg.jpg ga1 true ga1_lrg.jpg jpg 97928 736 2213 IMAGE-HIGH-RES 1-s2.0-S0021951724004767-gr5_lrg.jpg https://s3-eu-west-1.amazonaws.com/prod-ucs-content-store-eu-west/content/pii:S0021951724004767/HIGHRES/image/jpeg/6f04bb4a06350490d63cf8ab9e16cdd4/gr5_lrg.jpg gr5 gr5_lrg.jpg jpg 409916 2769 3271 IMAGE-HIGH-RES 1-s2.0-S0021951724004767-gr6_lrg.jpg https://s3-eu-west-1.amazonaws.com/prod-ucs-content-store-eu-west/content/pii:S0021951724004767/HIGHRES/image/jpeg/82ad8d86f887010cd05e77958b9bfbac/gr6_lrg.jpg gr6 gr6_lrg.jpg jpg 173850 1211 1693 IMAGE-HIGH-RES 1-s2.0-S0021951724004767-gr3_lrg.jpg https://s3-eu-west-1.amazonaws.com/prod-ucs-content-store-eu-west/content/pii:S0021951724004767/HIGHRES/image/jpeg/f22a542846fdc521a8be28673e46a166/gr3_lrg.jpg gr3 gr3_lrg.jpg jpg 377660 1825 2368 IMAGE-HIGH-RES 1-s2.0-S0021951724004767-gr4_lrg.jpg https://s3-eu-west-1.amazonaws.com/prod-ucs-content-store-eu-west/content/pii:S0021951724004767/HIGHRES/image/jpeg/71f3a869393e68420d18c38089fb4a84/gr4_lrg.jpg gr4 gr4_lrg.jpg jpg 327649 2364 2368 IMAGE-HIGH-RES 1-s2.0-S0021951724004767-fx4_lrg.jpg https://s3-eu-west-1.amazonaws.com/prod-ucs-content-store-eu-west/content/pii:S0021951724004767/HIGHRES/image/jpeg/28a7e69bad657983f6c6f08418a999ae/fx4_lrg.jpg fx4 fx4_lrg.jpg jpg 7050 125 361 IMAGE-HIGH-RES 1-s2.0-S0021951724004767-fx5_lrg.jpg https://s3-eu-west-1.amazonaws.com/prod-ucs-content-store-eu-west/content/pii:S0021951724004767/HIGHRES/image/jpeg/c5b94b8de2121280bfd73915a7bd63da/fx5_lrg.jpg fx5 fx5_lrg.jpg jpg 9941 184 490 IMAGE-HIGH-RES 1-s2.0-S0021951724004767-fx2_lrg.jpg https://s3-eu-west-1.amazonaws.com/prod-ucs-content-store-eu-west/content/pii:S0021951724004767/HIGHRES/image/jpeg/f7169054382cc202d0e982a3a63ce6ca/fx2_lrg.jpg fx2 fx2_lrg.jpg jpg 5456 125 257 IMAGE-HIGH-RES 1-s2.0-S0021951724004767-fx3_lrg.jpg https://s3-eu-west-1.amazonaws.com/prod-ucs-content-store-eu-west/content/pii:S0021951724004767/HIGHRES/image/jpeg/e660ba9c3233e7e51715d1e69118c618/fx3_lrg.jpg fx3 fx3_lrg.jpg jpg 8423 181 392 IMAGE-HIGH-RES 1-s2.0-S0021951724004767-gr1_lrg.jpg https://s3-eu-west-1.amazonaws.com/prod-ucs-content-store-eu-west/content/pii:S0021951724004767/HIGHRES/image/jpeg/1d89a3b34b4d29a3315a7bffa7ecf93f/gr1_lrg.jpg gr1 gr1_lrg.jpg jpg 365552 1154 1967 IMAGE-HIGH-RES 1-s2.0-S0021951724004767-fx8_lrg.jpg https://s3-eu-west-1.amazonaws.com/prod-ucs-content-store-eu-west/content/pii:S0021951724004767/HIGHRES/image/jpeg/3e0ca44856c8bded2963aca200d77949/fx8_lrg.jpg fx8 fx8_lrg.jpg jpg 5266 137 209 IMAGE-HIGH-RES 1-s2.0-S0021951724004767-gr2_lrg.jpg https://s3-eu-west-1.amazonaws.com/prod-ucs-content-store-eu-west/content/pii:S0021951724004986/HIGHRES/image/jpeg/896331e293d96deb9b81904a477980df/gr2_lrg.jpg gr2 gr2_lrg.jpg jpg 272127 1296 3446 IMAGE-HIGH-RES 1-s2.0-S0021951724004767-fx9_lrg.jpg https://s3-eu-west-1.amazonaws.com/prod-ucs-content-store-eu-west/content/pii:S0021951724004767/HIGHRES/image/jpeg/94a5f2e2b50d2e560a796ea0fbbc27ad/fx9_lrg.jpg fx9 fx9_lrg.jpg jpg 8997 139 372 IMAGE-HIGH-RES 1-s2.0-S0021951724004767-fx6_lrg.jpg https://s3-eu-west-1.amazonaws.com/prod-ucs-content-store-eu-west/content/pii:S0021951724004767/HIGHRES/image/jpeg/e8fe0cb15b4476f58cf33821cd60b465/fx6_lrg.jpg fx6 fx6_lrg.jpg jpg 6252 111 262 IMAGE-HIGH-RES 1-s2.0-S0021951724004767-fx7_lrg.jpg https://s3-eu-west-1.amazonaws.com/prod-ucs-content-store-eu-west/content/pii:S0021951724004986/HIGHRES/image/jpeg/372af5c091096973f91e9d103c01604c/fx7_lrg.jpg fx7 fx7_lrg.jpg jpg 9817 162 421 IMAGE-HIGH-RES 1-s2.0-S0021951724004767-mmc1.docx https://s3-eu-west-1.amazonaws.com/prod-ucs-content-store-eu-west/content/pii:S0021951724004767/mmc1/MAIN/application/vnd.openxmlformats-officedocument.wordprocessingml.document/c55e9f3d4a0290c75ea6fff9bb24dc6c/mmc1.docx mmc1 mmc1.docx docx 6220347 APPLICATION YJCAT 115763 115763 S0021-9517(24)00476-7 10.1016/j.jcat.2024.115763 Elsevier Inc. Fig. 1 Characterization of the synthesized Zn@C-900. (a) SEM image, (b, and c) HR-TEM images, (d) Aberration-corrected HAADF-STEM image, and (e, and f) EDS mapping images. Fig. 2 (a) XRD patterns, and (b) N2 adsorption–desorption isotherms. Fig. 3 (a) XPS spectra of Zn 2p, and (b) XPS spectra of N 1s. Fig. 4 (a) FT-EXAFS of the Zn@C-900, (b) Zn K-edge XANES spectra, (c) Zn K-edge EXAFS k2 χ(k) oscillation functions, and (d) WT-EXAFS of the Zn@C-900. Fig. 5 (a) Effect of rection temperature, (b) Influence of catalyst usage, (c) Effect of reaction time, and (d) Recyclability of Zn@C-900. Reaction conditions: DEC, 33 mmol; 1-hexanol, 2 mmol; reaction temperature, 80 °C (for b, c, and d); reaction time, 6 h (for a, b, and d); Zn@C-900, 100 mg (for a, c, and d). Scheme 1 Possible mechanism for the production of unsymmetrical organic carbonates via transesterification of DEC and alcohols over Zn@C-900. Table 1 Transesterification of DEC with 1-hexanol catalyzed by different catalysts. a Entry Catalyst Conversion of 1-hexanol (%) b Yield (%) b Selectivity (%) 1 None 0 0 − 2 Zn@C-600 75 56 75 3 Zn@C-700 74 55 74 4 Zn@C-800 85 72 85 5 Zn@C-900 96 95 99 6 Zn@C-1000 97 93 96 7 c ZnO 14 5 35 8 d N-doped Carbon 8 7 93 9 Zn@C-1200 10 9 90 a Reaction conditions: DEC, 33 mmol; 1-hexanol, 2 mmol; catalyst, 100 mg; reaction temperature, 80 °C; reaction time, 6 h. b The conversion and the yield were determined by GC using tetradecane as the internal standard. c ZnO was prepared by the direct pyrolysis of ZnCl2 at 900 °C. d N-doped carbon was prepared by the direct pyrolysis of chitosan at 900 °C. Table 2 Transesterification of DEC and different alcohols to produce various unsymmetrical organic over Zn@C-900. a Entry Alcohol Product Temperature (℃) Time (h) Alcohol conversion (%) b Selectivity (%) Yield (%) b 1 110 3 99 99 98 2 110 3 99 99 98 3 130 3 99 99 98 4 130 9 81 99 80 5 130 9 41 98 40 6 80 10 99 97 96 7c 130 9 97 99 96 a Reaction conditions: DEC, 33 mmol; alcohol, 2 mmol; catalyst, 100 mg. b The conversion and the yield were determined by GC using tetradecane as the internal standard (Fig. S31-S38). Research article Atomically dispersed Zn sites on N-doped carbon boosted transesterification of symmetrical organic carbonates with biomass-derived alcohols Yayun Pang Writing – original draft Visualization Methodology Investigation Conceptualization a Long Tao Writing – review & editing Investigation Formal analysis a Ziyang Wang Investigation Formal analysis a Chenglei Xiao Writing – review & editing Investigation Formal analysis a Kaili Wang Investigation Formal analysis a Kongqian Liang Investigation Data curation a Jinliang Song Writing – review & editing Supervision Funding acquisition Conceptualization a b c ⁎ Tiejun Wang Writing – review & editing Supervision a b c ⁎ a School of Chemical Engineering and Light Industry, Guangdong University of Technology, Guangzhou 510006, China School of Chemical Engineering and Light Industry Guangdong University of Technology Guangzhou 510006 China School of Chemical Engineering and Light Industry, Guangdong University of Technology, Guangzhou 510006, China b Guangdong Laboratory of Chemistry and Fine Chemical Industry Jieyang Center, Jieyang 515548, China Guangdong Laboratory of Chemistry and Fine Chemical Industry Jieyang Center Jieyang 515548 China Guangdong Laboratory of Chemistry and Fine Chemical Industry Jieyang Center, Jieyang 515548, China c Guangdong Provincial Key Laboratory of Plant Resources Biorefinery, Guangzhou 510006, China Guangdong Provincial Key Laboratory of Plant Resources Biorefinery Guangzhou 510006 China Guangdong Provincial Key Laboratory of Plant Resources Biorefinery, Guangzhou 510006, China ⁎ Corresponding authors at: School of Chemical Engineering and Light Industry, Guangdong University of Technology, Guangzhou 510006, China. School of Chemical Engineering and Light Industry Guangdong University of Technology Guangzhou 510006 China Graphical abstract Transesterification of symmetrical organic carbonates with alcohols to access the unsymmetrical ones is a highly attractive strategy for upgrading biomass-derived alcohols. Robust, facile-prepared, and cost-effective catalytic materials remain highly desirable for this route. Herein, we designed several Zn-based catalysts (denoted as Zn@C-T, where T represented the pyrolysis temperature) by the pyrolysis of Zn-based coordination polymer at different temperatures. Very interestingly, the prepared Zn@C-900 could efficiently catalyze the transesterification of diethyl carbonate (DEC) with various biomass-derived alcohols to synthesize the corresponding unsymmetrical organic carbonates with high yields (>95 %), resulting from the atomically dispersed ZnNx sites on the N-doped carbon. Notably, good catalytic activity could be obtained at a low temperature of 80 °C, representing the major breakthrough. Detailed investigations indicated that the excellent performance of Zn@C-900 originated mainly from the synergistic effect of Zn (to activate DEC) and N (to activate the alcohols) in the ZnNx sites. This work provided a promising efficient catalyst for low-temperature production of unsymmetrical organic carbonates via transesterification of DEC. Keywords Single-atom catalyst Biomass-derived alcohols Unsymmetrical organic carbonates Transesterification Synergistic effect Data availability Data will be made available on request. 1 Introduction Organic carbonates are an important class of valuable chemicals extensively applied as fuel additives, polar aprotic solvents, electrolytes for lithium-ion batteries, versatile intermediates for synthesizing agricultural chemicals, pharmaceuticals and lubricants, and important monomers for organic glass [1–3]. Generally, unsymmetrical organic carbonates show better performance in practical applications than the symmetrical ones [4]. Thereby, development of efficient catalytic systems for synthesizing unsymmetrical organic carbonates has gained much attention. Traditionally, toxic reagents, e.g., phosgene, dimethyl sulfate, and pyridine, were indispensable for the synthesis of unsymmetrical organic carbonates [5]. With the rapid development of green chemistry, several simpler and more eco-friendly strategies have been proposed, including the coupling of alcohols, CO2, and alkyl halides [6], the direct reaction of CO2 and alcohols [7], and transesterification of symmetrical organic carbonates with alcohols. Among these developed strategies, transesterification of symmetrical organic carbonates with alcohols is a very attractive approach because this approach not only avoids the use of halogenated compounds but also possesses much higher activity and product selectivity than the route of direct reaction between CO2 and alcohols. Notably, with the significant development of biorefineries, diverse alcohols can be generated from transformation of renewable biomass. These features afford transesterification of symmetrical organic carbonates with alcohols being a cost-effective and environment-friendly approach to produce unsymmetrical organic carbonates. Various catalysts have been developed for the synthesis of unsymmetrical organic carbonates via transesterification of symmetrical organic carbonates (e.g., diethyl carbonate, and dimethyl carbonate) with alcohols. For example, CsF/α-Al2O3 was employed as a heterogeneous basic catalyst for the production of unsymmetrical organic carbonates by the transesterification of diethyl carbonate (DEC) at 120 °C [8]. Several MgO-based catalysts were developed to catalyze the transesterification of DEC at the reaction temperature of 120–130 °C [9]. Moreover, Mg/La metal oxide [10], homogeneous TBD (1,5,7-triazabicyclo[4.4.0]dec-5-ene) [11], and MCM-41-TBD could also be used as basic catalysts for the transesterification of DEC [12]. Besides these basic catalysts, Zn-based metal–organic framework (MOF) [13] and organotin-oxomolybdate coordinated polymer [14] as bifunctional catalysts could efficiently catalyze the production of unsymmetrical organic carbonates via the transesterification of DEC. In spite of these achievements, most of the developed catalysts were still limited by some drawbacks, including harsh reaction temperatures (>120 °C), long reaction time (>10 h), high usage of metal elements, and unsatisfied stability (especially for the basic catalysts), etc. Undoubtedly, from the practical perspective, robust, heterogeneous, and stable catalysts are still highly desirable for the synthesis of unsymmetrical organic carbonates via transesterification of DEC with different alcohols under mild conditions. For transesterification of DEC and alcohols, most of the developed metal-based catalysts were heterogeneous. The main challenge of these heterogeneous catalysts was the partial embedding of catalytically active sites in the bulk body, resulting in the difficulty on the interaction between these active sites and reactants as well as their insufficient utilization. Generally, the accessibility of catalytically active sites in heterogeneous catalysts could be significantly enhanced by constructing advanced structures, such as hierarchically porous structures, nanosheets, and atomic dispersion of catalytic sites [15–19]. Especially, the catalysts with atomically dispersed active sites, called as single-atom catalysts (SACs), have drawn significant interest in catalysis community owing to the inherent merits, i.e., highly dense distribution of active sites, tunable electronic structures, high atomic utilization efficiency, and efficient mass transfer [20–25]. These merits afforded SACs being the ideal choice for diverse catalytic transformations [26–28]. Based on the previously reported results, transesterification of DEC and alcohols could be catalyzed by acidic catalysts. In SACs, the atomic metal species could potentially play the role of acidic sites to promote the transesterification. Thus, there was a great opportunity that transesterification of DEC and alcohols could be efficiently and mildly promoted by constructing innovative SACs. Encouraged by the merits of SACs, in this work, we prepared atomic Zn catalytic materials (denoted as Zn@C-T, where T represented the pyrolysis temperature) by pyrolyzing Zn-based coordination polymer formed from ZnCl2 and 4,4′-bipyridine. It was observed that the synthesized Zn@C-900 as a single-atom catalyst showed outstanding catalytic activity on the production of unsymmetrical organic carbonates by the transesterification of DEC and various biomass-derived alcohols. Especially, Zn@C-900 still exhibited good performance for the reaction at a low temperature of 80 °C, which represented a major breakthrough for the acid-catalyzed transesterification of DEC. To the best of our knowledge, this was the first time to achieve low-temperature (<100 °C) transesterification of DEC and alcohols to access unsymmetrical organic carbonates over SACs. 2 Materials and methods 2.1 Materials Ethanol (99.8 %), tetradecane (99 %), veratryl alcohol (98 %), 4,4′-bipyridine (98 %), diethyl carbonate (99 %), 1-hexanol (98 %), 2-ethylhexanol (>99 %), 2-ethyl-1-butanol (98 %), tetrahydrofurfuryl alcohol (≥98 %), menthol (99 %), benzyl alcohol (≥99 %), and cyclohexanol (≥98.5 %) were obtained from Shanghai Macklin Biochemical Technology Co., Ltd. Zinc chloride (ZnCl2, ≥98 %) was purchased from Guangzhou Chemical Reagent Factory. Chitosan (91.8 %, 310CPS) was provided by Shandong Aokang Biotechnology Co., Ltd. Argon (99.999 %) were obtained from Generally Yuejia Gas Co., Ltd. Dimethicone (100 cst) was purchased from Guangzhou Kerong Biological Co., Ltd. 2.2 Construction of Zn@C-T catalysts To prepare Zn@C-T, the Zn-based coordination polymer was initially synthesized. In a typical synthetic route, 4,4′-bipyridine (40 mmol) and ZnCl2 (30 mmol) were dissolved in 300 mL ethanol. The mixture was stirred at room temperature for 4 h. Finally, the desired coordination polymer was obtained by centrifugation, washed by ethanol, and dried at 60 °C for 12 h. Subsequently, the obtained Zn-based coordination polymer was pyrolyzed in a furnace for 3 h at 900 °C (or 600, 700, 800, and 1000 °C) at the heating rate of 5 °C/min under Ar gas flow, and then naturally cooled to room temperature to obtain the Zn@C-T, in which T represented the treatment temperature. For comparison, N-doped carbon material or ZnO were obtained at 900 °C using chitosan or ZnCl2 as the raw material, respectively. Other conditions were the same as the route of preparing Zn@C-T. 2.3 Catalysts characterization Scanning electron microscope (SEM) measurements were conducted on the Quattro S instrument. Transmission electron microscopy (TEM) images were taken with JEM-F200. Aberration-corrected high-angle annular dark field STEM (HAADF-STEM) tests were conducted on Titan Cubed Themis G2300 300kv. X-ray diffraction (XRD) patterns were performed on an X-ray diffractometer (MiniFlex II, Rigaku) operated at Cu Kα radiation with a scanning rate of 10° min−1 in the range of 5–80°. X-ray photoelectron spectroscopy (XPS) was collected on an ESCAL Lab 220i-XL spectrometer with Al Kα as the excitation source and operated at 15 kV and 20 mA. The content of Zn in the prepared catalysts was determined by inductively coupled plasma optical emission spectrometer (ICP-OES) (Thermo Fisher iCAP 7400). N2 adsorption–desorption examinations were collected on a Micromeritics ASAP 2046 (USA) surface area analyzer at 77.35 K. X-ray absorption spectroscopy (XAS) measurements were carried out at the 4B9A beamline at Beijing Synchrotron Radiation Facility (BSRF), China. Extended X-ray absorption fine structure (EXAFS) spectra were obtained using the Athena software package. Temperature-programmed desorption of carbon dioxide (CO2-TPD) was conducted on the BELCAT-A instrument, and the detailed route for CO2-TPD was described as follows. Initially, after adding the sample (100 mg) to one quartz instrument, the temperature was increased from room temperature to 300 °C under a flow of He (30 mL/min). The temperature was kept at 300 °C for 1h and then decreased to 50 °C. Then, 10 % CO2 (30–50 mL/min) was introduced into the quartz instrument at 50 °C for 1h to ensure the adsorption saturation of CO2. After the physically adsorbed CO2 was removed by He (30 mL/min), the temperature was increased from 50 to 700 °C at a heating rate of 10 °C/min under He atmosphere, and the outgoing gas was detected by TCD. Finally, the basicity could be obtained based on the CO2-TPD results. Temperature-programmed desorption of ammonia (NH3-TPD) was conducted on the BELCAT-A instrument, and the detailed route for NH3-TPD was described as follows. Initially, after adding the sample (100 mg) to one quartz instrument, the temperature was increased from room temperature to 300 °C under a flow of He (30 mL/min). The temperature was kept at 300 °C for 1 h and then decreased to 50 °C. Then, 10 % NH3/He mixture (30–50 mL/min) was introduced into the quartz instrument at 50 °C for 1 h to ensure the adsorption saturation of NH3. After the physically adsorbed NH3 was removed by He (30 mL/min), the temperature was increased from 50 to 600 °C at a heating rate of 10 °C/min under He atmosphere, and the outgoing gas was detected by TCD. Finally, the acidity could be obtained based on the NH3-TPD results. 2.4 The process to conduct the transesterification All the reactions were conducted in a flask of 25 mL with a reflux condenser. In a typical experiment, the alcohol (2 mmol), DEC (33 mmol, 4 mL), and the catalyst with desired amounts were added into the flask, which was then placed into an oil bath with a desired constant temperature. After the reaction was performed for the desired time, the reaction was stopped by taking the flask out of the oil bath. Finally, the unreacted alcohol and the generated products were analyzed by a gas chromatography (GC, Shimadzu 2010 Pro, using tetradecane as the internal standard) equipped with a flame-ionized detector and an RB-5 capillary column (0.25 mm in diameter and 30 m in length), and the products were also confirmed by GC–MS (Shimadzu QP 2010PLUS). 2.5 Reusability of the Zn@C-900 In the experiments to determine the reusability, the spent Zn@C-900 was separated via centrifugation and washed with ethanol (3 × 5 mL) to remove the unconverted reactant and the product. After being dried at 80 °C under vacuum for 3 h, the recovered Zn@C-900 was directly reused in the next catalytic cycle. 3 Results and discussion 3.1 Fabrication and characterization of the Zn@C-T materials The desired Zn@C-T catalysts were fabricated by the pyrolysis of Zn-based coordination polymer, and the detailed route was described in the experimental section. Initially, the prepared Zn-based coordination polymer was characterized by SEM and TEM techniques (Fig. S1). No uniform morphology was observed in the SEM image of synthesized Zn-based coordination polymer (Fig. S1a). Nonetheless, there were plenty of pores on the Zn-based coordination polymer based on the TEM result (Fig. S1b). Besides, elemental mapping images indicated that Zn, C and N elements in the fabricated Zn-based coordination polymer were distributed uniformly (Fig. S1d). Moreover, the thermal decomposition of the Zn-based coordination polymer was determined by thermogravimetric analysis (TGA). As shown in Fig. S2, the weight of the Zn-based coordination polymer remained almost constant before 400 °C. The Zn-based coordination polymer rapidly decomposed from 400 to 600 °C, resulting from the decomposition of the organic component (4,4′-bipyridine). The weight loss (8.62 wt%) after 600 °C predominantly originated from the volatilization of Zn based on the elemental contents in the prepared materials obtained at different pyrolysis temperatures (Table S1). These results confirmed the feasibility of fabricating the desired catalytic materials by the pyrolysis of the Zn-based coordination polymer at different temperatures. The morphology and properties of the prepared Zn@C-T materials were examined by several typical techniques. The SEM images indicated that the five obtained materials, i.e., Zn@C-600, Zn@C-700, Zn@C-800, Zn@C-900, and Zn@C-1000, showed no uniform morphology (Fig. 1 , and S3-S6). Nevertheless, small particles on the material surface were observed when the materials (e.g., Zn@C-600, and Zn@C-700) were prepared at lower temperatures (Fig. S3a and S4a), while these particles disappeared at the higher fabricated temperatures (Fig. 1a, S5a, and S6a). As characterized by TEM, no obvious agglomeration of Zn particles could be found in the Zn@C-700 (Fig. S4b-c), Zn@C-800 (Fig. S5b-c), Zn@C-900 (Fig. 1b-c), and Zn@C-1000 (Fig. S6b-c). Especially, the HAADF-STEM analysis revealed that the Zn species were atomically dispersed in Zn@C-900 (Fig. 1d), indicating the successful synthesis of Zn single atoms (bright white dots, highlighted by red circles) [29]. In contrast, characteristic lattice fringes for ZnO could be clearly observed at the interplanar distance of 0.24 nm for (101) plane and 0.28 nm for (100) plane in the TEM image of Zn@C-600 (Fig. S3b-c), implying the existence of ZnO particles [30]. Moreover, as shown in these TEM images, all these five materials possessed a large number of honeycomb pores. Elemental mapping images demonstrated the uniform distribution of Zn, O, and N elements in the five catalytic materials (Fig. 1e-f, S3d-e, S4d-e, S5d-e, and S6d-e). In addition, as determined by ICP-OES, the content of Zn in the five catalysts decreased with the increase of the pyrolysis temperature (Table S1) owing to the evaporation of Zn at the temperature of above 600 °C. The XRD patterns of Zn@C-T catalysts with different Zn contents were shown in Fig. 2 a. All samples exhibited two broad peaks at around 26 and 44°, which was ascribed to (002) and (101) planes of graphitic carbon [31,32]. More importantly, there was no extra diffractions of Zn species in the XRD patterns, suggesting that the introduced Zn species should be highly dispersed on the surface of the carbon carrier. Additionally, Zn@C-900 showed very similar XRD pattern with the N-doped carbon material prepared from the pyrolysis of chitosan at 900 °C (Fig. S7), further implying the high dispersion of Zn species in Zn@C-T. The N2 adsorption–desorption isotherms of Zn@C-T (Fig. 2b) showed the mode of type I (for Zn@C-600) or type IV (Fig. S8-12) (for Zn@C-700, Zn@C-800, Zn@C-900, and Zn@C-1000), revealing the presence of abundant mesopores in the synthesized five materials. Meanwhile, the BET surface area of the prepared Zn@C-T increased with the increase of pyrolysis temperature from 600 to 900 °C, and then decreased when the pyrolysis temperature was further increased to 1000 °C (Table S2). Besides, the pore size showed no obvious difference (Table S2). The fine structure of Zn@C-T was further characterized by X-ray photoelectron spectroscopy (XPS). The full XPS spectra (Figs. S13a, S14a, S15a, S16a, S17a) showed the coexistence of Zn, N, O, and C in the five catalysts, suggesting that Zn and N were successfully doped. High-resolution XPS spectra of Zn 2p showed that there were two peaks at ca. 1022 (for Zn 2p3/2) and 1045 eV (for Zn 2p1/2), implying that Zn was in an ionic state (Fig. 3 a) [33]. The binding energy of Zn 2p for the five catalytic materials slightly decreased as the following tendency: Zn@C-600 > Zn@C-700 > Zn@C-800 > Zn@C-900 ≈ Zn@C-1000, implying that the valence of Zn species decreased gradually (Fig. S18). Among these materials, Zn@C-600 showed the close binding energy of Zn 2p with ZnO, suggesting the Zn species in Zn@C-600 were mainly ZnO, which was consistent with the results of HR-TEM (Fig. S3). The gradually decreased binding energies of Zn 2p in other four materials indicated that the valence of Zn species (Znδ+, 0 < δ < 2) in these materials became lower, indicating the interaction between Zn species and N species became stronger. Especially, Zn@C-900 and Zn@C-1000 showed the lowest binding energy of Zn 2p, probably owing to the formation of much more atomically dispersed ZnNx species [34]. Moreover, in the XPS spectra of N 1s (Fig. 3b), besides three characteristic N-species, i.e., pyridine-type N (398.0 eV), pyrrole-type N (399.5 eV), and graphitic-type N (401.2 eV) [35], a new peak located at 399.4 eV was observed in Zn@C-700, Zn@C-800, Zn@C-900, and Zn@C-1000, assigned to the N-species coordinated with the Zn sites [36]. The contents of the four N species in the five materials varied with the prepared temperatures, which significantly affected the formation of Zn-N4 sites. Importantly, the peak area for Zn-N species decreased as follows: Zn@C-900 > Zn@C-1000 > Zn@C-800 > Zn@C-700, suggesting that Zn@C-900 showed the highest content of Zn-N species. In contrast, there were no Zn-N species in Zn@C-600. The difference on the content of Zn-N species was the probable reason for their different catalytic activity, as discussed below. Besides, XPS spectra of C 1s indicated that there were three carbon species with the corresponding binding energies at 284.8, 285.9 and 288.3 eV (Fig. S16b), which attributed to sp2 CC in the framework, CN species, and OCO/quinone group groups, respectively [37]. For the XPS spectra of O 1s (Fig. S16c), only one peak at 531.9 eV was mainly attributed to hydroxyl COH or ether (531.8–532.1 eV), suggesting that there were many O-containing groups on the surface of the prepared catalysts [38]. Fourier-transformed (FT) k3 -weighted extended X-ray absorption fine structure (EXAFS) spectra was collected to further reveal the fine structure of the prepared samples. FT-EXAFS spectra showed that there were two coordination peaks at ca. 1.53 (for Zn-O/Zn-N coordination peak) and ca. 2.91 Å (for Zn-Zn coordination peak) in the Zn@C-600 (Fig. S19). Based on the contents of Zn and N in Zn@C-600 (Table S1), most of the atoms coordinated with Zn should be O atoms rather than N atoms. Thus, deduced from the results of elemental content and FT-EXAFS spectra, Zn species in the Zn@C-600 mainly was ZnO, agreeing with the TEM result (Fig. S3). With the increase of pyrolysis temperature, the peak Zn-Zn coordination peak gradually decreased and disappeared in the Zn@C-900 and Zn@C-1000 (Fig. 4 a and S19-S22), confirming that the ZnO would be transformed into atomically dispersed Zn species bonded by N or O. As shown in Fig. 3b, the content of Zn-Nx sites increased. Thus, we deduced that more N atoms were bonded with Zn atoms to form Zn-Nx sites at higher pyrolysis temperature. Zn K-edge X-ray absorption near-edge structure (XANES) showed that the absorption edge of all the five fabricated samples was not consistent with ZnO and Zn foil, but the absorption threshold was more closed to that of ZnO (Fig. 4b and S19-S22), indicating the valence state of Zn species was between 0 and +2 (close to +2). Moreover, based on the results for Zn K-edge EXAFS (Fig. 4c and S19-S22), Zn@C-600 and Zn@C-700 showed very similar spectra with ZnO, implying that Zn-O was the major coordination in these two samples. In comparison, Zn@C-900 and Zn@C-1000 showed different spectra with ZnO, implying Zn-N coordination became the predominate one. Zn@C-900 and Zn@C-1000 exhibited a single intensity maximum around 3.90 Å−1 (Fig. 4c and S19-S23), corresponding to the first nearest neighbor shell of the coordination between Zn and N, while there was no Zn-Zn signal, confirming the isolated nature of the Zn atom in Zn@C-900 and Zn@C-1000. Besides, wavelet transform extended X-ray absorption fine structure (WT-EXAFS) analysis revealed the coordination number of the Zn atom was calculated to be 3.8–4.3 (Fig. 4d, S19-S22, and Table S3). Especially, the coordination number decreased with the pyrolysis temperature: Zn@C-600 (4.3) > Zn@C-700 (4.2) > Zn@C-800 (4.1) > Zn@C-900 (4.0) > Zn@C-1000 (3.8). These results above confirmed the generation of well-defined in-plane ZnN4 sites in Zn@C-900 and Zn@C-1000, and the coordination environment of Zn could be well adjusted by the pyrolysis temperature of preparing the catalytic materials. 3.2 Catalytic activity of the Zn@C-T on transesterification of DEC The catalytic activity of the fabricated Zn@C-T catalysts was initially evaluated using the transesterification of DEC with 1-hexanol (an alcohol that could be synthesized from the conversion of glucose or bioethanol) as the model reaction (Table 1 ). It was observed that no reaction occurred in the absence of any catalyst (Table 1, entry 1). The reaction proceeded smoothly using Zn@C-T as the catalysts at a low temperature of 80 °C (Table 1, entries 2–6). To our delight, the yield of the desired unsymmetrical organic carbonate could reach 95 % and 93 % over Zn@C-900 (Table 1, entry 5) and Zn@C-1000 (Table 1, entry 6) as the catalysts, respectively. Especially, Zn@C-900 provided slightly higher product yield and selectivity than Zn@C-1000, suggesting that Zn@C-900 was the optimal catalyst. In comparison, ZnO (Fig. S24) prepared by the pyrolysis of ZnCl2 showed very poor catalytic performance for the reaction (Table 1, entry 7), implying that the properties of Zn species in Zn@C-900 were different with those in ZnO. Considering that the catalytic activity of Zn@C-900 may originate from the N sites (as the basic sites), N-doped carbon material was obtained by the pyrolysis of chitosan. Unfortunately, the yield of the desired product was only 7 % over this N-doped carbon material (Table 1, entry 8). Besides, Zn@C-1200 was constructed to ensure complete volatilization of Zn, and the Zn content in Zn@C-1200 was below 0.05 wt% based on the ICP-OES results. It was observed that the catalytic activity of Zn@C-1200 was very low (Table 1, entry 9). These results above confirmed that Zn species were indispensable. It is widely accepted that transesterification could be catalyzed by acidic or basic sites [39]. Therefore, we determined the acidity and basicity of all the prepared Zn@C-T materials. First, as determined by NH3-TPD, two peaks were observed (Fig. S25), corresponding to weak acidic sites (at the desorption temperature of around 127 °C), and strong acidic sites (at the desorption temperature of 300–400 °C). It was observed that Zn@C-600, Zn@C-800, Zn@C-900, and Zn@C-1000 possessed both types of acidic sites, while Zn@C-700 only had weak acidic sites. Besides, Zn@C-800, Zn@C-900, and Zn@C-1000 showed a higher desorption temperature than Zn@C-600 for the strong acidic sites (Fig. S25), implying the acid-strength in the Zn@C-800, Zn@C-900, and Zn@C-1000 was much higher. Although the total content of acidic sites in Zn@C-600 and Zn@C-700 was much larger (Table S4), their catalytic activity was unsatisfactory. The lower catalytic activity of Zn@C-700 was probably caused by the lack of strong acidic sites, indicating that the strong acidic sites were more efficient to promote the reaction. Although Zn@C-600 possessed the highest strong acidic sites (Table S4), its surface area was only 5.2 m2/g (Table S2), limiting the exposure of catalytically active sites and the mass transfer, which would significantly lower its catalytic activity. In comparison, Zn@C-900 possessed the highest content of strong acidic sites (Table S4) and relatively high surface area. Higher content of strong acidic sites was beneficial for activating the reactants, and the high surface area was favorable for the exposure of catalytic sites to interact with the reactants. These two parameters afforded Zn@C-900 possessing the highest catalytic activity. Second, the CO2-TPD results suggested that the basicity of the five Zn@C-T materials showed no significant difference on the total content of basic sites (Table S5). Nevertheless, Zn@C-800, Zn@C-900, and Zn@C-1000 had much higher desorption temperature than Zn@C-600 and Zn@C-700 (Fig. S26), suggesting that the strength for the basic sites on Zn@C-800, Zn@C-900, and Zn@C-1000 was higher than Zn@C-600 and Zn@C-700, which may be positively related with their catalytic activity. However, the N-doped carbon (Table 1, entry 8) with similar content and strength of basic sites (Fig. S26) showed low catalytic activity. These CO2-TPD results implied that the basic sites were probably not the dominated sites for the transesterification of DEC in our prepared materials. Third, as well-accepted, the defects of carbon-based materials could also be the catalytically active sites. Based on the results of Raman spectra (Fig. S27), the intensity ratio of D and G bands (ID /IG ) in the five catalytic materials decreased with the increase of the pyrolysis temperature from 600 to 1000 °C, indicating the decreased content of the defects in the corresponding catalysts with the increased pyrolysis temperature. However, the catalytic activity of these five catalysts increased with the decreased ID /IG , implying that the defects on the catalysts were not the decisive catalytically active sites in the prepared five catalysts. Additionally, the poor catalytic activity of ZnO (Table 1, entry 7) and the N-doped carbon material (Table 1, entry 8) implied that the signal Zn or N sites were not the actual catalytic sites. More importantly, the catalytic activity of the synthesized materials was proportional to the relative content of the Zn-Nx species (Table 1, and Fig. 3b). These results confirmed that the Zn-Nx species (atomically dispersed Zn sites) were indeed responsible for the high catalytic activity of Zn@C-900. Considering its best performance, Zn@C-900 was selected as the optimal catalyst to optimize the reaction conditions. 3.3 Optimization of reaction conditions Generally, the reaction temperature could significantly affect the catalytic efficiency, and thus we investigated the effect of reaction temperature on transesterification of DEC with 1-hexanol over Zn@C-900 (Fig. 5 a). As expected, the yield of the desired product increased with the increase of the reaction temperature from 50 to 80 °C, and there was no obvious change on the reaction results when the reaction temperature was further increased to 90 °C, indicating that 80 °C was the optimal temperature for our catalytic system. At 80 °C, the yield of the corresponding unsymmetrical organic carbonate could reach 95 %. Zn@C-900 still showed high catalytic activity at a such low temperature (80 °C), which was lower than previously reported results (Table S6) [8–10,12–14,40], verifying the superior of Zn@C-900 on the transesterification of DEC. Subsequently, the influence of the catalyst usage was determined (Fig. 5b). It was observed that the yield of the product increased with the increasing catalyst usage from 0 to 100 mg because there were more catalytically active sites with more catalyst usage. Thus, 100 mg would be an appropriate catalyst amount in our catalytic system. Moreover, the yield of the corresponding product continually increased with the prolonging reaction time from 0 to 6 h (Fig. 5c), and the maximum yield of 95 % could be obtained with a reaction time of 6 h. When the reaction time was prolonged to 8 h, the yield and selectivity of the unsymmetrical organic carbonate maintained at 95 % and 98 %, respectively. Finally, the recyclability of Zn@C-900 was examined. To our delight, Zn@C-900 can be recycled at least 4 times without significant loss of catalytic activity (Fig. 5d). The recovered Zn@C-900 was characterized by XRD (Fig. S28), and the results showed that there was no considerable change on the properties between the fresh Zn@C-900 and the recovered one. Meanwhile, SEM and TEM images (Fig. S29) indicated that the morphology of the recovered Zn@C-900 after four catalytic cycles remained unchanged in comparison with the fresh catalyst. Besides, as determined by ICP-OES technique, the Zn content in the recovered Zn@C-900 was ca. 1.25 wt%, which was very similar with that in the fresh Zn@C-900. Particularly, the EXAFS spectra (Fig. S30) showed that no obvious difference was found between the virgin and recovered Zn@C-900. These results above confirmed the excellent stability of Zn@C-900 for the reaction. In addition, we should point out that disubstituted carbonate was generated as the by-product in the reaction process although its amount was very low (<3 %). 3.4 Scope of biomass-derived alcohols Encouraged by its excellent performance on transesterification of DEC with 1-hexanol, Zn@C-900 was further employed to catalyze the transesterification of DEC with other biomass-derived alcohols, including aliphatic alcohols (i.e., 2-ethylbutanol, and 2-ethylhexanol, synthesized from bioethanol upgrading), alicyclic alcohols (i.e., tetrahydrofurfuryl alcohol from the hydrogenation of furfural, cyclohexanol obtained from conversion of some lignin-based derivatives, and menthol extracted from some plants), and aromatic alcohols (i.e., benzyl alcohol and veratryl alcohol, potentially obtained from lignin conversion). It was observed that Zn@C-900 could convert various alcohols to the corresponding unsymmetrical carbonates at 80 °C (Table S7). From the viewpoint of practical applications, it would be more favorable to complete the reaction at relatively short reaction time under satisfactory reaction conditions. Thus, we modified the reaction temperature for different alcohols. To our delight, all the examined alcohols (Table 2 ) could be efficiently converted into the corresponding unsymmetrical carbonates with high selectivity (97–99 %) at the temperature of 80–130 °C. The reactivity of the examined alcohols decreased as follows: aliphatic alcohols > aromatic alcohols > alicyclic alcohols, which were mainly caused by the steric hindrance and electronic effects of the alcohols [14]. The lower reactivity of aromatic alcohols (Table 2, entries 6 and 7) than alkyl alcohols originated from the delocalization of electrons in the benzene ring, which reduced the nucleophilicity of the generated alkoxide ion and its interaction with the catalytic sites. In the case of alicyclic alcohols (Table 2, entries 3–5), their lowest reactivity was due to the steric hindrance of the ring. 3.5 Reaction mechanism As well-accepted, transesterification of DEC with alcohols could be carried out via the nucleophilic mechanism on basic catalysts [10,40]. However, as discussed above, the catalytically active sites in Zn@C-900 were the atomic ZnNx sites, in which the Zn atom acted as the Lewis acidic sites to activate the DEC, and the N atoms played the role of basic sites for activating the alcohols. The synergistic cooperation between these two sites resulted in the excellent activity of Zn@C-900 at 80 °C. Based on the experimental results and the reported knowledge, a possible reaction mechanism was proposed for the transesterification of DEC with various alcohols (Scheme 1 ). Initially, the Zn atom in the ZnNx site interacted with the O atom in the carbonyl group of DEC, thereby activating the carbonyl group. Simultaneously, the hydroxyl group in the alcohol was activated by the ZnNx site by the formation of hydrogen bonding between the H atom in the hydroxyl group and the N atom in the ZnNx site. Subsequently, the O atom in the activated hydroxyl group of the alcohol attacked the C atom in the carbonyl group of DEC to generate a six-link intermediate. Finally, the desired unsymmetrical organic carbonate could be generated from this intermediate by releasing the ethanol (EtOH) and the catalyst. 4 Conclusions In conclusion, robust Zn-based catalysts (Zn@C-T) were fabricated by pyrolysis of Zn-based coordination polymer. The prepared Zn@C-T could efficiently catalyze the transesterification of DEC with various biomass-derived alcohols to synthesize unsymmetrical organic carbonates. The catalytic performance of the prepared Zn@C-T was significantly affected by the pyrolysis temperature, and the catalyst Zn@C-900 with atomically dispersed Zn sites showed the highest catalytic activity for the transesterification. Various alcohols, including aliphatic alcohols, alicyclic alcohols, and aromatic alcohols, could be selectively converted into the corresponding unsymmetrical organic carbonates, and the yields and selectivities were >95 % and 99 %, respectively. More importantly, Zn@C-900 could also show good catalytic activity at a low temperature of 80 °C. Systematic study revealed that both Zn and N were indispensable, and the atomic ZnNx sites were the catalytically active sites. The excellent performance of Zn@C-900 originated from the synergistic effect of Zn and N in the atomically dispersed ZnNx sites. We believe that the prepared Zn@C-900 could be potentially applied as one robust single atom catalytic material for the transesterification of DEC and biomass-derived alcohols to produce unsymmetrical organic carbonates. CRediT authorship contribution statement Yayun Pang: Writing – original draft, Visualization, Methodology, Investigation, Conceptualization. Long Tao: Writing – review & editing, Investigation, Formal analysis. Ziyang Wang: Investigation, Formal analysis. Chenglei Xiao: Writing – review & editing, Investigation, Formal analysis. Kaili Wang: Investigation, Formal analysis. Kongqian Liang: Investigation, Data curation. Jinliang Song: Writing – review & editing, Supervision, Funding acquisition, Conceptualization. Tiejun Wang: Writing – review & editing, Supervision. Declaration of competing interest The authors declare that they have no known competing financial interests or personal relationships that could have appeared to influence the work reported in this paper. Acknowledgements This work was financially supported by Guangdong Basic and Applied Basic Research Foundation (2023A1515011251), and the National Natural Science Foundation of China (22372043, and 22072157). Appendix A Supplementary material Supplementary data to this article can be found online at https://doi.org/10.1016/j.jcat.2024.115763. Appendix A Supplementary material The following are the Supplementary data to this article: Supplementary Data 1 References [1] J.H. Shi H. Wang Y.Z. Cui C.L. Liu C.B. Li H. Sun M.J. Jia Highly efficient synthesis of unsymmetrical organic carbonates from alcohols and diethyl carbonate over mesoporous carbon-supported MgO catalysts J. Catal. 411 2022 62 71 10.1016/j.jcat.2022.05.007 J.H. Shi, H. Wang, Y.Z. Cui, C.L. Liu, C.B. Li, H. Sun, M.J. Jia, Highly efficient synthesis of unsymmetrical organic carbonates from alcohols and diethyl carbonate over mesoporous carbon-supported MgO catalysts, J. Catal. 411 (2022) 62-71. DOI: 10.1016/j.jcat.2022.05.007. [2] V. Aomchad A. Cristòfol F. Della Monica B. Limburg V. D'elia A.W. Kleij Recent progress in the catalytic transformation of carbon dioxide into biosourced organic carbonates Green Chem. 23 2021 1077 1113 10.1039/d0gc03824e V. Aomchad, A. Cristòfol, F. Della Monica, B. Limburg, V. D'Elia, A.W. Kleij, Recent progress in the catalytic transformation of carbon dioxide into biosourced organic carbonates, Green Chem. 23 (2021) 1077-1113. DOI: 10.1039/d0gc03824e. [3] S. Saini N.K. Gour S.R. Khan R.C. Deka S.L. Jain Light-induced synthesis of unsymmetrical organic carbonates from alcohols, methanol and CO2 under ambient conditions Chem. Commun. 57 2021 12800 12803 10.1039/d1cc05833a S. Saini, N.K. Gour, S.R. Khan, R.C. Deka, S.L. Jain, Light-induced synthesis of unsymmetrical organic carbonates from alcohols, methanol and CO2 under ambient conditions, Chem. Commun. 57 (2021) 12800-12803. DOI: 10.1039/d1cc05833a. [4] J. Vetter P. Novák Novel alkyl methyl carbonate solvents for lithium-ion batteries J. Power Sources 119 2003 338 342 10.1016/s0378-7753(03)00151-4 J. Vetter, P. Novák, Novel alkyl methyl carbonate solvents for lithium-ion batteries, J. Power Sources 119 (2003) 338-342. DOI: 10.1016/s0378-7753(03)00151-4. [5] R.M. Burk M.B. Roof A Safe and efficient method for conversion of 1,2-doils and 1,3-doils to cyclic carbonates utilizng triphosegene Tetrahedron Lett. 34 1993 395 398 10.1016/0040-4039(93)85085-b R.M. Burk, M.B. Roof, A Safe and efficient method for conversion of 1,2-doils and 1,3-doils to cyclic carbonates utilizng triphosegene, Tetrahedron Lett. 34 (1993) 395-398. DOI: 10.1016/0040-4039(93)85085-b. [6] R.N. Salvatore V.L. Flanders D. Ha K.W. Jung Cs2CO3-promoted efficient carbonate and carbamate synthesis on solid phase Org. Lett. 2 2000 2797 2800 10.1021/ol006212i R.N. Salvatore, V.L. Flanders, D. Ha, K.W. Jung, Cs2CO3-promoted efficient carbonate and carbamate synthesis on solid phase, Org. Lett. 2 (2000) 2797-2800. DOI: 10.1021/ol006212i. [7] S. Fujita B.M. Bhanage Y. Ikushima M. Arai Synthesis of dimethyl carbonate from carbon dioxide and methanol in the presence of methyl iodide and base catalysts under mild conditions: effect of reaction conditions and reaction mechanism Green Chem. 3 2001 87 91 10.1039/b100363l S. Fujita, B.M. Bhanage, Y. Ikushima, M. Arai, Synthesis of dimethyl carbonate from carbon dioxide and methanol in the presence of methyl iodide and base catalysts under mild conditions: effect of reaction conditions and reaction mechanism, Green Chem. 3 (2001) 87-91. DOI: 10.1039/b100363l. [8] B. Veldurthy J.M. Clacens F. Figueras New highly active and selective heterogeneous catalytic system for the synthesis of unsymmetrical organic carbonates: a green protocol Eur. J. Org. Chem. 2005 2005 1972 1976 10.1002/ejoc.200400888 B. Veldurthy, J.M. Clacens, F. Figueras, New highly active and selective heterogeneous catalytic system for the synthesis of unsymmetrical organic carbonates: A green protocol, Eur. J. Org. Chem. 2005 (2005) 1972-1976. DOI: 10.1002/ejoc.200400888. [9] B. Veldurthy F.O. Figueras An efficient synthesis of organic carbonates: atom economic protocol with a new catalytic system Chem. Commun. 2004 734 735 10.1039/b316050e B. Veldurthy, F.O. Figueras, An efficient synthesis of organic carbonates: atom economic protocol with a new catalytic system, Chem. Commun. (2004) 734-735. DOI: 10.1039/b316050e. [10] M.L. Kantam U. Pal B. Sreedhar B.M. Choudary An efficient synthesis of organic carbonates using nanocrystalline magnesium oxide Adv. Synth. Catal. 349 2007 1671 1675 10.1002/adsc.200600525 M.L. Kantam, U. Pal, B. Sreedhar, B.M. Choudary, An efficient synthesis of organic carbonates using nanocrystalline magnesium oxide, Adv. Synth. Catal. 349 (2007) 1671-1675. DOI: 10.1002/adsc.200600525. [11] H. Mutlu J. Ruiz S.C. Solleder M.A.R. Meier TBD catalysis with dimethyl carbonate: a fruitful and sustainable alliance Green Chem. 14 2012 1728 1735 10.1039/c2gc35191a H. Mutlu, J. Ruiz, S.C. Solleder, M.A.R. Meier, TBD catalysis with dimethyl carbonate: a fruitful and sustainable alliance, Green Chem. 14 (2012) 1728-1735. DOI: 10.1039/c2gc35191a. [12] S. Carloni D.E. De Vos P.A. Jacobs R. Maggi G. Sartori R. Sartorio Catalytic activity of MCM-41-TBD in the selective preparation of carbamates and unsymmetrical alkyl carbonates from diethyl carbonate J. Catal. 205 2002 199 204 10.1006/jcat.2001.3439 S. Carloni, D.E. De Vos, P.A. Jacobs, R. Maggi, G. Sartori, R. Sartorio, Catalytic activity of MCM-41-TBD in the selective preparation of carbamates and unsymmetrical alkyl carbonates from diethyl carbonate, J. Catal. 205 (2002) 199-204. DOI: 10.1006/jcat.2001.3439. [13] Y.X. Zhou S.G. Liang J.L. Song T.B. Wu S.Q. Hu H.Z. Liu T. Jiang B.X. Han Synthesis of asymmetrical organic carbonates catalyzed by metal organic frameworks Acta Phys.-Chim. Sin. 26 2010 939 945 10.3866/pku.Whxb20100406 Y.X. Zhou, S.G. Liang, J.L. Song, T.B. Wu, S.Q. Hu, H.Z. Liu, T. Jiang, B.X. Han, Synthesis of asymmetrical organic carbonates catalyzed by metal organic frameworks, Acta Phys.-Chim. Sin. 26 (2010) 939-945. DOI: 10.3866/pku.Whxb20100406. [14] J.L. Song B.B. Zhang T.B. Wu G.Y. Yang B.X. Han Organotin-oxomolybdate coordination polymer as catalyst for synthesis of unsymmetrical organic carbonates Green Chem. 13 2011 922 927 10.1039/c0gc00765j J.L. Song, B.B. Zhang, T.B. Wu, G.Y. Yang, B.X. Han, Organotin-oxomolybdate coordination polymer as catalyst for synthesis of unsymmetrical organic carbonates, Green Chem. 13 (2011) 922-927. DOI: 10.1039/c0gc00765j. [15] X.B. Fu J.H. Zhang S.Q. Zhan F.J. Xia C.J. Wang D.S. Ma Q. Yue J.S. Wu Y.J. Kang High-entropy alloy nanosheets for fine-tuning hydrogen evolution ACS Catal. 12 2022 11955 11959 10.1021/acscatal.2c02778 X.B. Fu, J.H. Zhang, S.Q. Zhan, F.J. Xia, C.J. Wang, D.S. Ma, Q. Yue, J.S. Wu, Y.J. Kang, High-entropy alloy nanosheets for fine-tuning hydrogen evolution, ACS Catal. 12 (2022) 11955-11959. DOI: 10.1021/acscatal.2c02778. [16] J.T. Song Z.X. Chen X.B. Cai X. Zhou G.L. Zhan R.L. Li P.P. Wei N. Yan S.B. Xi K.P. Loh Promoting dinuclear-type catalysis in Cu1-C3N4 single-atom catalysts Adv. Mater. 34 2022 2204638 10.1002/adma.202204638 J.T. Song, Z.X. Chen, X.B. Cai, X. Zhou, G.L. Zhan, R.L. Li, P.P. Wei, N. Yan, S.B. Xi, K.P. Loh, Promoting dinuclear-type catalysis in Cu1-C3N4 single-atom catalysts, Adv. Mater. 34 (2022) 2204638. DOI: 10.1002/adma.202204638. [17] H.L. Wang X. Wang J. Pan L.L. Zhang M. Zhao J. Xu B. Liu W.D. Shi S.Y. Song H.J. Zhang Ball-milling induced debonding of surface atoms from metal bulk for construing high-performance dual-site single-atom catalysts Angew. Chem.-Int. Ed. 60 2021 23154 23158 10.1002/anie.202109356 H.L. Wang, X. Wang, J. Pan, L.L. Zhang, M. Zhao, J. Xu, B. Liu, W.D. Shi, S.Y. Song, H.J. Zhang, Ball-milling induced debonding of surface atoms from metal bulk for construing high-performance dual-site single-atom catalysts, Angew. Chem.-Int. Ed. 60 (2021) 23154-23158. DOI: 10.1002/anie.202109356. [18] L.S. Zhang X.H. Jiang Z.A. Zhong L. Tian Q. Sun Y.T. Cui X. Lu J.P. Zou S.L. Luo Carbon nitride supported high-loading Fe single-atom catalyst for activating of peroxymonosulfate to generate 1O2 with 100 % selectivity Angew. Chem.-Int. Ed. 60 2021 21751 21755 10.1002/anie.202109488 L.S. Zhang, X.H. Jiang, Z.A. Zhong, L. Tian, Q. Sun, Y.T. Cui, X. Lu, J.P. Zou, S.L. Luo, Carbon nitride supported high-loading Fe single-atom catalyst for activating of peroxymonosulfate to generate 1O2 with 100 % selectivity, Angew. Chem.-Int. Ed. 60 (2021) 21751-21755. DOI: 10.1002/anie.202109488. [19] S.Y. Pan C. Li T.T. Xiong Y.H. Xie F. Luo Z.H. Yang Hydrogen spillover in MoOXRh hierarchical nanosheets boosts alkaline HER catalytic activity Appl. Catal. b: Environ. 341 2024 123275 10.1016/j.apcatb.2023.123275 S.Y. Pan, C. Li, T.T. Xiong, Y.H. Xie, F. Luo, Z.H. Yang, Hydrogen spillover in MoOXRh hierarchical nanosheets boosts alkaline HER catalytic activity, Appl. Catal. B: Environ. 341 (2024) 123275. DOI: 10.1016/j.apcatb.2023.123275. [20] H.Y. Cheng X.M. Wu M.M. Feng X.C. Li G.P. Lei Z.H. Fan D.W. Pan F.J. Cui G.H. He Atomically dispersed Ni/Cu dual sites for boosting the CO2 reduction reaction ACS Catal. 11 2021 12673 12681 10.1021/acscatal.1c02319 H.Y. Cheng, X.M. Wu, M.M. Feng, X.C. Li, G.P. Lei, Z.H. Fan, D.W. Pan, F.J. Cui, G.H. He, Atomically dispersed Ni/Cu dual sites for boosting the CO2 reduction reaction, ACS Catal. 11 (2021) 12673-12681. DOI: 10.1021/acscatal.1c02319. [21] L. DeRita J. Resasco S. Dai A. Boubnov H.V. Thang A.S. Hoffman I. Ro G.W. Graham S.R. Bare G. Pacchioni X.Q. Pan P. Christopher Structural evolution of atomically dispersed Pt catalysts dictates reactivity Nat. Mater. 18 2019 746 751 10.1038/s41563-019-0349-9 L. DeRita, J. Resasco, S. Dai, A. Boubnov, H.V. Thang, A.S. Hoffman, I. Ro, G.W. Graham, S.R. Bare, G. Pacchioni, X.Q. Pan, P. Christopher, Structural evolution of atomically dispersed Pt catalysts dictates reactivity, Nat. Mater. 18 (2019) 746-751. DOI: 10.1038/s41563-019-0349-9. [22] Y.F. Wang Z. Chen P. Han Y.H. Du Z.X. Gu X. Xu G.F. Zheng Single-atomic Cu with multiple oxygen vacancies on ceria for electrocatalytic CO2 reduction to CH4 ACS Catal. 8 2018 7113 7119 10.1021/acscatal.8b01014 Y.F. Wang, Z. Chen, P. Han, Y.H. Du, Z.X. Gu, X. Xu, G.F. Zheng, Single-atomic Cu with multiple oxygen vacancies on ceria for electrocatalytic CO2 reduction to CH4, ACS Catal. 8 (2018) 7113-7119. DOI: 10.1021/acscatal.8b01014. [23] L.L. Han H. Cheng W. Liu H.Q. Li P.F. Ou R.Q. Lin H.T. Wang C.W. Pao A.R. Head C.H. Wang X. Tong C.J. Sun W.F. Pong J. Luo J.C. Zheng H.L.L. Xin A single-atom library for guided monometallic and concentration-complex multimetallic designs Nat. Mater. 21 2022 681 688 10.1038/s41563-022-01252-y L.L. Han, H. Cheng, W. Liu, H.Q. Li, P.F. Ou, R.Q. Lin, H.T. Wang, C.W. Pao, A.R. Head, C.H. Wang, X. Tong, C.J. Sun, W.F. Pong, J. Luo, J.C. Zheng, H.L.L. Xin, A single-atom library for guided monometallic and concentration-complex multimetallic designs, Nat. Mater. 21 (2022) 681-688. DOI: 10.1038/s41563-022-01252-y. [24] W.Y. Sun L.J. Feng J.C. Zhang K. Lin H. Wang B.J. Yan T.T. Feng M. Cao T. Liu Y.H. Yuan N. Wang Amidoxime group-anchored single cobalt atoms for anti-biofouling during uranium extraction from seawater Adv. Sci. 9 2022 10.1002/advs.202105008 W.Y. Sun, L.J. Feng, J.C. Zhang, K. Lin, H. Wang, B.J. Yan, T.T. Feng, M. Cao, T. Liu, Y.H. Yuan, N. Wang, Amidoxime Group-Anchored Single Cobalt Atoms for Anti-Biofouling during Uranium Extraction from Seawater, Adv. Sci. 9 (2022). DOI: 10.1002/advs.202105008. [25] C.Y. Zhou C. Zhang T. Zhang J.F. Zhang P.F. Ma Y.S. Yu Z.X. Zhang G.G.X. Wang Single-atom solutions promote carbon dioxide capture Appl. Energ. 332 2023 120570 10.1016/j.apenergy.2022.120570 C.Y. Zhou, C. Zhang, T. Zhang, J.F. Zhang, P.F. Ma, Y.S. Yu, Z.X. Zhang, G.G.X. Wang, Single-atom solutions promote carbon dioxide capture, Appl. Energ. 332 (2023) 120570. DOI: 10.1016/j.apenergy.2022.120570. [26] X.J. Cui X.C. Dai A.E. Surkus K. Junge C. Kreyenschulte G. Agostini N. Rockstroh M. Beller Zinc single atoms on N-doped carbon: an efficient and stable catalyst for CO2 fixation and conversion Chin. J. Catal. 40 2019 1679 1685 10.1016/s1872-2067(19)63316-4 X.J. Cui, X.C. Dai, A.E. Surkus, K. Junge, C. Kreyenschulte, G. Agostini, N. Rockstroh, M. Beller, Zinc single atoms on N-doped carbon: An efficient and stable catalyst for CO2 fixation and conversion, Chin. J. Catal. 40 (2019) 1679-1685. DOI: 10.1016/s1872-2067(19)63316-4. [27] X. Li W.B. Ye P. Xu H.H. Huang J.M. Fan R.M. Yuan M.S. Zheng M.S. Wang Q.F. Dong An encapsulation-based sodium storage via Zn-single-atom implanted carbon nanotubes Adv. Mater. 34 2022 2202892 10.1002/adma.202202898 X. Li, W.B. Ye, P. Xu, H.H. Huang, J.M. Fan, R.M. Yuan, M.S. Zheng, M.S. Wang, Q.F. Dong, An encapsulation-based sodium storage via Zn-single-atom implanted carbon nanotubes, Adv. Mater. 34 (2022) 2202892. DOI: 10.1002/adma.202202898. [28] X.L. Lin X. Fei D.L. Chen Y. Qi Q.Z. Xu Y.C. Liu Q. Zhang S. Li T.J. Wang Y.L. Qin X.Q. Qiu Efficient catalytic upgrading of ethanol to higher alcohols via inhibiting C-C cleavage and promoting C-C coupling over biomass-derived NiZn@NC catalysts ACS Catal. 12 2022 11573 11585 10.1021/acscatal.2c02440 X.L. Lin, X. Fei, D.L. Chen, Y. Qi, Q.Z. Xu, Y.C. Liu, Q. Zhang, S. Li, T.J. Wang, Y.L. Qin, X.Q. Qiu, Efficient catalytic upgrading of ethanol to higher alcohols via inhibiting C-C cleavage and promoting C-C coupling over biomass-derived NiZn@NC catalysts, ACS Catal. 12 (2022) 11573-11585. DOI: 10.1021/acscatal.2c02440. [29] X.W. Zhong S.L. Ye J. Tang Y.M. Zhu D.J. Wu M. Gu H. Pan B.M. Xu Engineering Pt and Fe dual-metal single atoms anchored on nitrogen-doped carbon with high activity and durability towards oxygen reduction reaction for zinc-air battery Appl. Catal. B: Environ. 286 2021 119891 10.1016/j.apcatb.2021.119891 X.W. Zhong, S.L. Ye, J. Tang, Y.M. Zhu, D.J. Wu, M. Gu, H. Pan, B.M. Xu, Engineering Pt and Fe dual-metal single atoms anchored on nitrogen-doped carbon with high activity and durability towards oxygen reduction reaction for zinc-air battery, Appl. Catal. B: Environ. 286 (2021) 119891. DOI: 10.1016/j.apcatb.2021.119891. [30] Y.J. Pu N. Morishita T. Chiba S. Ohisa M. Igarashi A. Masuhara J. Kido Efficient electron injection by size- and shape-controlled zinc oxide nanoparticles in organic light-emitting devices ACS Appl. Mater. Interfaces 7 2015 25373 25377 10.1021/acsami.5b07742 Y.J. Pu, N. Morishita, T. Chiba, S. Ohisa, M. Igarashi, A. Masuhara, J. Kido, Efficient electron injection by size- and shape-controlled zinc oxide nanoparticles in organic light-emitting devices, ACS Appl. Mater. Interfaces 7 (2015) 25373-25377. DOI: 10.1021/acsami.5b07742. [31] F. Winter V. Koot A.J. van Dillen J.W. Geus K.P. de Jong Hydrotalcites supported on carbon nanofibers as solid base catalysts for the synthesis of MlBK J. Catal. 236 2005 91 100 10.1016/j.jcat.2005.09.020 F. Winter, V. Koot, A.J. van Dillen, J.W. Geus, K.P. de Jong, Hydrotalcites supported on carbon nanofibers as solid base catalysts for the synthesis of MlBK, J. Catal. 236 (2005) 91-100. DOI: 10.1016/j.jcat.2005.09.020. [32] G.L. Sun B. Li J.B. Ran X.Y. Shen H. Tong Three-dimensional hierarchical porous carbon/graphene composites derived from graphene oxide-chitosan hydrogels for high performance supercapacitors Electrochim. Acta 171 2015 13 22 10.1016/j.electacta.2015.05.009 G.L. Sun, B. Li, J.B. Ran, X.Y. Shen, H. Tong, Three-dimensional hierarchical porous carbon/graphene composites derived from graphene oxide-chitosan hydrogels for high performance supercapacitors, Electrochim. Acta 171 (2015) 13-22. DOI: 10.1016/j.electacta.2015.05.009. [33] H. Sun H. Li X.Y. Chang S.S. Miao X.L. Yuan W.X. Zhang M.J. Jia Nitrogen-doped carbon supported ZnO as highly stable heterogeneous catalysts for transesterification synthesis of ethyl methyl carbonate J. Colloid Interface Sci. 581 2021 126 134 10.1016/j.jcis.2020.07.095 H. Sun, H. Li, X.Y. Chang, S.S. Miao, X.L. Yuan, W.X. Zhang, M.J. Jia, Nitrogen-doped carbon supported ZnO as highly stable heterogeneous catalysts for transesterification synthesis of ethyl methyl carbonate, J. Colloid Interface Sci. 581 (2021) 126-134. DOI: 10.1016/j.jcis.2020.07.095. [34] T.J. Wang Y. Xin B.F. Chen B. Zhang S. Luan M.H. Dong Y.X. Wu X.M. Cheng Y. Liu H.Z. Liu B.X. Han Selective hydrodeoxygenation of α, β-unsaturated carbonyl compounds to alkenes Nat. Commun. 15 2024 2166 10.1038/s41467-024-46383-9 T.J. Wang, Y. Xin, B.F. Chen, B. Zhang, S. Luan, M.H. Dong, Y.X. Wu, X.M. Cheng, Y. Liu, H.Z. Liu, B.X. Han, Selective hydrodeoxygenation of α, β-unsaturated carbonyl compounds to alkenes, Nat. Commun. 15 (2024) 2166. DOI: 10.1038/s41467-024-46383-9. [35] J.T. Sun Z.P. Zhang J. Ji M.L. Dou F. Wang Removal of Cr6+ from wastewater via adsorption with high-specific-surface-area nitrogen-doped hierarchical porous carbon derived from silkworm cocoon Appl. Surf. Sci. 405 2017 372 379 10.1016/j.apsusc.2017.02.044 J.T. Sun, Z.P. Zhang, J. Ji, M.L. Dou, F. Wang, Removal of Cr6+ from wastewater via adsorption with high-specific-surface-area nitrogen-doped hierarchical porous carbon derived from silkworm cocoon, Appl. Surf. Sci. 405 (2017) 372-379. DOI: 10.1016/j.apsusc.2017.02.044. [36] C. Xie L.F. Lin L. Huang Z.X. Wang Z.W. Jiang Z.H. Zhang B.X. Han Zn-Nx sites on N-doped carbon for aerobic oxidative cleavage and esterification of C(CO)-C bonds Nat. Commun. 12 2021 4823 10.1038/s41467-021-25118-0 C. Xie, L.F. Lin, L. Huang, Z.X. Wang, Z.W. Jiang, Z.H. Zhang, B.X. Han, Zn-Nx sites on N-doped carbon for aerobic oxidative cleavage and esterification of C(CO)-C bonds, Nat. Commun. 12 (2021) 4823. DOI: 10.1038/s41467-021-25118-0. [37] R. Zeng X.N. Tang B.Y. Huang K. Yuan Y.W. Chen Nitrogen-doped hierarchically porous carbon materials with enhanced performance for supercapacitor ChemElectroChem 5 2018 515 522 10.1002/celc.201701021 R. Zeng, X.N. Tang, B.Y. Huang, K. Yuan, Y.W. Chen, Nitrogen-doped hierarchically porous carbon materials with enhanced performance for supercapacitor, ChemElectroChem 5 (2018) 515-522. DOI: 10.1002/celc.201701021. [38] G. Liu Y. Liu X.Y. Zhang X.L. Yuan M. Zhang W.X. Zhang M.J. Jia Characterization and catalytic performance of porous carbon prepared using in situ-formed aluminophosphate framework as template J. Colloid Interface Sci. 342 2010 467 473 10.1016/j.jcis.2009.10.036 G. Liu, Y. Liu, X.Y. Zhang, X.L. Yuan, M. Zhang, W.X. Zhang, M.J. Jia, Characterization and catalytic performance of porous carbon prepared using in situ-formed aluminophosphate framework as template, J. Colloid Interface Sci. 342 (2010) 467-473. DOI: 10.1016/j.jcis.2009.10.036. [39] Y.T. Wang Z. Fang F. Zhang Esterification of oleic acid to biodiesel catalyzed by a highly acidic carbonaceous catalyst Catal. Today 319 2019 172 181 10.1016/j.cattod.2018.06.041 Y.T. Wang, Z. Fang, F. Zhang, Esterification of oleic acid to biodiesel catalyzed by a highly acidic carbonaceous catalyst, Catal. Today 319 (2019) 172-181. DOI: 10.1016/j.cattod.2018.06.041. [40] F. Adam M.S. Wong The synthesis of organic carbonates over nanocrystalline CaO prepared via microemulsion technique Catal. Commun. 13 2011 87 90 10.1016/j.catcom.2011.06.023 F. Adam, M.S. Wong, The synthesis of organic carbonates over nanocrystalline CaO prepared via microemulsion technique, Catal. Commun. 13 (2011) 87-90. DOI: 10.1016/j.catcom.2011.06.023.",
      "scopus-id": "85204223562",
      "coredata": {
        "eid": "1-s2.0-S0021951724004767",
        "dc:description": "Transesterification of symmetrical organic carbonates with alcohols to access the unsymmetrical ones is a highly attractive strategy for upgrading biomass-derived alcohols. Robust, facile-prepared, and cost-effective catalytic materials remain highly desirable for this route. Herein, we designed several Zn-based catalysts (denoted as Zn@C-T, where T represented the pyrolysis temperature) by the pyrolysis of Zn-based coordination polymer at different temperatures. Very interestingly, the prepared Zn@C-900 could efficiently catalyze the transesterification of diethyl carbonate (DEC) with various biomass-derived alcohols to synthesize the corresponding unsymmetrical organic carbonates with high yields (>95 %), resulting from the atomically dispersed ZnNx sites on the N-doped carbon. Notably, good catalytic activity could be obtained at a low temperature of 80 °C, representing the major breakthrough. Detailed investigations indicated that the excellent performance of Zn@C-900 originated mainly from the synergistic effect of Zn (to activate DEC) and N (to activate the alcohols) in the ZnNx sites. This work provided a promising efficient catalyst for low-temperature production of unsymmetrical organic carbonates via transesterification of DEC.",
        "openArchiveArticle": "false",
        "prism:coverDate": "2024-11-30",
        "openaccessUserLicense": null,
        "prism:aggregationType": "Journal",
        "prism:url": "https://api.elsevier.com/content/article/pii/S0021951724004767",
        "dc:creator": [
          {
            "@_fa": "true",
            "$": "Pang, Yayun"
          },
          {
            "@_fa": "true",
            "$": "Tao, Long"
          },
          {
            "@_fa": "true",
            "$": "Wang, Ziyang"
          },
          {
            "@_fa": "true",
            "$": "Xiao, Chenglei"
          },
          {
            "@_fa": "true",
            "$": "Wang, Kaili"
          },
          {
            "@_fa": "true",
            "$": "Liang, Kongqian"
          },
          {
            "@_fa": "true",
            "$": "Song, Jinliang"
          },
          {
            "@_fa": "true",
            "$": "Wang, Tiejun"
          }
        ],
        "link": [
          {
            "@_fa": "true",
            "@rel": "self",
            "@href": "https://api.elsevier.com/content/article/pii/S0021951724004767"
          },
          {
            "@_fa": "true",
            "@rel": "scidir",
            "@href": "https://www.sciencedirect.com/science/article/pii/S0021951724004767"
          }
        ],
        "dc:format": "application/json",
        "openaccessType": null,
        "pii": "S0021-9517(24)00476-7",
        "prism:volume": "439",
        "articleNumber": "115763",
        "prism:publisher": "Elsevier Inc. All rights are reserved, including those for text and data mining, AI training, and similar technologies.",
        "dc:title": "Atomically dispersed Zn sites on N-doped carbon boosted transesterification of symmetrical organic carbonates with biomass-derived alcohols",
        "prism:copyright": "© 2024 Elsevier Inc. All rights are reserved, including those for text and data mining, AI training, and similar technologies.",
        "openaccess": "0",
        "prism:issn": "00219517",
        "dcterms:subject": [
          {
            "@_fa": "true",
            "$": "Single-atom catalyst"
          },
          {
            "@_fa": "true",
            "$": "Biomass-derived alcohols"
          },
          {
            "@_fa": "true",
            "$": "Unsymmetrical organic carbonates"
          },
          {
            "@_fa": "true",
            "$": "Transesterification"
          },
          {
            "@_fa": "true",
            "$": "Synergistic effect"
          }
        ],
        "openaccessArticle": "false",
        "prism:publicationName": "Journal of Catalysis",
        "openaccessSponsorType": null,
        "prism:pageRange": "115763",
        "pubType": "fla",
        "prism:coverDisplayDate": "November 2024",
        "prism:doi": "10.1016/j.jcat.2024.115763",
        "prism:startingPage": "115763",
        "dc:identifier": "doi:10.1016/j.jcat.2024.115763",
        "openaccessSponsorName": null
      },
      "objects": {
        "object": [
          {
            "@category": "standard",
            "@height": "63",
            "@width": "117",
            "@_fa": "true",
            "$": "https://api.elsevier.com/content/object/eid/1-s2.0-S0021951724004767-fx15.jpg?httpAccept=%2A%2F%2A",
            "@multimediatype": "JPEG image file",
            "@type": "IMAGE-DOWNSAMPLED",
            "@size": "2076",
            "@ref": "fx15",
            "@mimetype": "image/jpeg"
          },
          {
            "@category": "standard",
            "@height": "41",
            "@width": "82",
            "@_fa": "true",
            "$": "https://api.elsevier.com/content/object/eid/1-s2.0-S0021951724004767-fx14.jpg?httpAccept=%2A%2F%2A",
            "@multimediatype": "JPEG image file",
            "@type": "IMAGE-DOWNSAMPLED",
            "@size": "1709",
            "@ref": "fx14",
            "@mimetype": "image/jpeg"
          },
          {
            "@category": "standard",
            "@height": "47",
            "@width": "103",
            "@_fa": "true",
            "$": "https://api.elsevier.com/content/object/eid/1-s2.0-S0021951724004767-fx13.jpg?httpAccept=%2A%2F%2A",
            "@multimediatype": "JPEG image file",
            "@type": "IMAGE-DOWNSAMPLED",
            "@size": "1689",
            "@ref": "fx13",
            "@mimetype": "image/jpeg"
          },
          {
            "@category": "standard",
            "@height": "31",
            "@width": "64",
            "@_fa": "true",
            "$": "https://api.elsevier.com/content/object/eid/1-s2.0-S0021951724004767-fx12.jpg?httpAccept=%2A%2F%2A",
            "@multimediatype": "JPEG image file",
            "@type": "IMAGE-DOWNSAMPLED",
            "@size": "1176",
            "@ref": "fx12",
            "@mimetype": "image/jpeg"
          },
          {
            "@category": "standard",
            "@height": "57",
            "@width": "77",
            "@_fa": "true",
            "$": "https://api.elsevier.com/content/object/eid/1-s2.0-S0021951724004767-fx11.jpg?httpAccept=%2A%2F%2A",
            "@multimediatype": "JPEG image file",
            "@type": "IMAGE-DOWNSAMPLED",
            "@size": "1719",
            "@ref": "fx11",
            "@mimetype": "image/jpeg"
          },
          {
            "@category": "standard",
            "@height": "35",
            "@width": "449",
            "@_fa": "true",
            "$": "https://api.elsevier.com/content/object/eid/1-s2.0-S0021951724004767-fx1.jpg?httpAccept=%2A%2F%2A",
            "@multimediatype": "JPEG image file",
            "@type": "IMAGE-DOWNSAMPLED",
            "@size": "4706",
            "@ref": "fx1",
            "@mimetype": "image/jpeg"
          },
          {
            "@category": "standard",
            "@height": "56",
            "@width": "42",
            "@_fa": "true",
            "$": "https://api.elsevier.com/content/object/eid/1-s2.0-S0021951724004767-fx10.jpg?httpAccept=%2A%2F%2A",
            "@multimediatype": "JPEG image file",
            "@type": "IMAGE-DOWNSAMPLED",
            "@size": "1239",
            "@ref": "fx10",
            "@mimetype": "image/jpeg"
          },
          {
            "@category": "standard",
            "@height": "166",
            "@width": "500",
            "@_fa": "true",
            "$": "https://api.elsevier.com/content/object/eid/1-s2.0-S0021951724004767-ga1.jpg?httpAccept=%2A%2F%2A",
            "@multimediatype": "JPEG image file",
            "@type": "IMAGE-DOWNSAMPLED",
            "@size": "18258",
            "@ref": "ga1",
            "@mimetype": "image/jpeg"
          },
          {
            "@category": "standard",
            "@height": "626",
            "@width": "739",
            "@_fa": "true",
            "$": "https://api.elsevier.com/content/object/eid/1-s2.0-S0021951724004767-gr5.jpg?httpAccept=%2A%2F%2A",
            "@multimediatype": "JPEG image file",
            "@type": "IMAGE-DOWNSAMPLED",
            "@size": "77900",
            "@ref": "gr5",
            "@mimetype": "image/jpeg"
          },
          {
            "@category": "standard",
            "@height": "273",
            "@width": "382",
            "@_fa": "true",
            "$": "https://api.elsevier.com/content/object/eid/1-s2.0-S0021951724004767-gr6.jpg?httpAccept=%2A%2F%2A",
            "@multimediatype": "JPEG image file",
            "@type": "IMAGE-DOWNSAMPLED",
            "@size": "23844",
            "@ref": "gr6",
            "@mimetype": "image/jpeg"
          },
          {
            "@category": "standard",
            "@height": "412",
            "@width": "535",
            "@_fa": "true",
            "$": "https://api.elsevier.com/content/object/eid/1-s2.0-S0021951724004767-gr3.jpg?httpAccept=%2A%2F%2A",
            "@multimediatype": "JPEG image file",
            "@type": "IMAGE-DOWNSAMPLED",
            "@size": "63524",
            "@ref": "gr3",
            "@mimetype": "image/jpeg"
          },
          {
            "@category": "standard",
            "@height": "534",
            "@width": "535",
            "@_fa": "true",
            "$": "https://api.elsevier.com/content/object/eid/1-s2.0-S0021951724004767-gr4.jpg?httpAccept=%2A%2F%2A",
            "@multimediatype": "JPEG image file",
            "@type": "IMAGE-DOWNSAMPLED",
            "@size": "59970",
            "@ref": "gr4",
            "@mimetype": "image/jpeg"
          },
          {
            "@category": "standard",
            "@height": "28",
            "@width": "81",
            "@_fa": "true",
            "$": "https://api.elsevier.com/content/object/eid/1-s2.0-S0021951724004767-fx4.jpg?httpAccept=%2A%2F%2A",
            "@multimediatype": "JPEG image file",
            "@type": "IMAGE-DOWNSAMPLED",
            "@size": "1194",
            "@ref": "fx4",
            "@mimetype": "image/jpeg"
          },
          {
            "@category": "standard",
            "@height": "41",
            "@width": "110",
            "@_fa": "true",
            "$": "https://api.elsevier.com/content/object/eid/1-s2.0-S0021951724004767-fx5.jpg?httpAccept=%2A%2F%2A",
            "@multimediatype": "JPEG image file",
            "@type": "IMAGE-DOWNSAMPLED",
            "@size": "1541",
            "@ref": "fx5",
            "@mimetype": "image/jpeg"
          },
          {
            "@category": "standard",
            "@height": "28",
            "@width": "58",
            "@_fa": "true",
            "$": "https://api.elsevier.com/content/object/eid/1-s2.0-S0021951724004767-fx2.jpg?httpAccept=%2A%2F%2A",
            "@multimediatype": "JPEG image file",
            "@type": "IMAGE-DOWNSAMPLED",
            "@size": "1040",
            "@ref": "fx2",
            "@mimetype": "image/jpeg"
          },
          {
            "@category": "standard",
            "@height": "41",
            "@width": "88",
            "@_fa": "true",
            "$": "https://api.elsevier.com/content/object/eid/1-s2.0-S0021951724004767-fx3.jpg?httpAccept=%2A%2F%2A",
            "@multimediatype": "JPEG image file",
            "@type": "IMAGE-DOWNSAMPLED",
            "@size": "1446",
            "@ref": "fx3",
            "@mimetype": "image/jpeg"
          },
          {
            "@category": "standard",
            "@height": "434",
            "@width": "740",
            "@_fa": "true",
            "$": "https://api.elsevier.com/content/object/eid/1-s2.0-S0021951724004767-gr1.jpg?httpAccept=%2A%2F%2A",
            "@multimediatype": "JPEG image file",
            "@type": "IMAGE-DOWNSAMPLED",
            "@size": "98696",
            "@ref": "gr1",
            "@mimetype": "image/jpeg"
          },
          {
            "@category": "standard",
            "@height": "31",
            "@width": "47",
            "@_fa": "true",
            "$": "https://api.elsevier.com/content/object/eid/1-s2.0-S0021951724004767-fx8.jpg?httpAccept=%2A%2F%2A",
            "@multimediatype": "JPEG image file",
            "@type": "IMAGE-DOWNSAMPLED",
            "@size": "955",
            "@ref": "fx8",
            "@mimetype": "image/jpeg"
          },
          {
            "@category": "standard",
            "@height": "293",
            "@width": "778",
            "@_fa": "true",
            "$": "https://api.elsevier.com/content/object/eid/1-s2.0-S0021951724004767-gr2.jpg?httpAccept=%2A%2F%2A",
            "@multimediatype": "JPEG image file",
            "@type": "IMAGE-DOWNSAMPLED",
            "@size": "53576",
            "@ref": "gr2",
            "@mimetype": "image/jpeg"
          },
          {
            "@category": "standard",
            "@height": "31",
            "@width": "84",
            "@_fa": "true",
            "$": "https://api.elsevier.com/content/object/eid/1-s2.0-S0021951724004767-fx9.jpg?httpAccept=%2A%2F%2A",
            "@multimediatype": "JPEG image file",
            "@type": "IMAGE-DOWNSAMPLED",
            "@size": "1532",
            "@ref": "fx9",
            "@mimetype": "image/jpeg"
          },
          {
            "@category": "standard",
            "@height": "25",
            "@width": "59",
            "@_fa": "true",
            "$": "https://api.elsevier.com/content/object/eid/1-s2.0-S0021951724004767-fx6.jpg?httpAccept=%2A%2F%2A",
            "@multimediatype": "JPEG image file",
            "@type": "IMAGE-DOWNSAMPLED",
            "@size": "1010",
            "@ref": "fx6",
            "@mimetype": "image/jpeg"
          },
          {
            "@category": "standard",
            "@height": "37",
            "@width": "95",
            "@_fa": "true",
            "$": "https://api.elsevier.com/content/object/eid/1-s2.0-S0021951724004767-fx7.jpg?httpAccept=%2A%2F%2A",
            "@multimediatype": "JPEG image file",
            "@type": "IMAGE-DOWNSAMPLED",
            "@size": "1474",
            "@ref": "fx7",
            "@mimetype": "image/jpeg"
          },
          {
            "@category": "thumbnail",
            "@height": "117",
            "@width": "219",
            "@_fa": "true",
            "$": "https://api.elsevier.com/content/object/eid/1-s2.0-S0021951724004767-fx15.sml?httpAccept=%2A%2F%2A",
            "@multimediatype": "GIF image file",
            "@type": "IMAGE-THUMBNAIL",
            "@size": "3371",
            "@ref": "fx15",
            "@mimetype": "image/gif"
          },
          {
            "@category": "thumbnail",
            "@height": "109",
            "@width": "219",
            "@_fa": "true",
            "$": "https://api.elsevier.com/content/object/eid/1-s2.0-S0021951724004767-fx14.sml?httpAccept=%2A%2F%2A",
            "@multimediatype": "GIF image file",
            "@type": "IMAGE-THUMBNAIL",
            "@size": "4099",
            "@ref": "fx14",
            "@mimetype": "image/gif"
          },
          {
            "@category": "thumbnail",
            "@height": "101",
            "@width": "219",
            "@_fa": "true",
            "$": "https://api.elsevier.com/content/object/eid/1-s2.0-S0021951724004767-fx13.sml?httpAccept=%2A%2F%2A",
            "@multimediatype": "GIF image file",
            "@type": "IMAGE-THUMBNAIL",
            "@size": "3711",
            "@ref": "fx13",
            "@mimetype": "image/gif"
          },
          {
            "@category": "thumbnail",
            "@height": "106",
            "@width": "219",
            "@_fa": "true",
            "$": "https://api.elsevier.com/content/object/eid/1-s2.0-S0021951724004767-fx12.sml?httpAccept=%2A%2F%2A",
            "@multimediatype": "GIF image file",
            "@type": "IMAGE-THUMBNAIL",
            "@size": "4940",
            "@ref": "fx12",
            "@mimetype": "image/gif"
          },
          {
            "@category": "thumbnail",
            "@height": "162",
            "@width": "219",
            "@_fa": "true",
            "$": "https://api.elsevier.com/content/object/eid/1-s2.0-S0021951724004767-fx11.sml?httpAccept=%2A%2F%2A",
            "@multimediatype": "GIF image file",
            "@type": "IMAGE-THUMBNAIL",
            "@size": "5145",
            "@ref": "fx11",
            "@mimetype": "image/gif"
          },
          {
            "@category": "thumbnail",
            "@height": "17",
            "@width": "219",
            "@_fa": "true",
            "$": "https://api.elsevier.com/content/object/eid/1-s2.0-S0021951724004767-fx1.sml?httpAccept=%2A%2F%2A",
            "@multimediatype": "GIF image file",
            "@type": "IMAGE-THUMBNAIL",
            "@size": "1216",
            "@ref": "fx1",
            "@mimetype": "image/gif"
          },
          {
            "@category": "thumbnail",
            "@height": "252",
            "@width": "189",
            "@_fa": "true",
            "$": "https://api.elsevier.com/content/object/eid/1-s2.0-S0021951724004767-fx10.sml?httpAccept=%2A%2F%2A",
            "@multimediatype": "GIF image file",
            "@type": "IMAGE-THUMBNAIL",
            "@size": "4769",
            "@ref": "fx10",
            "@mimetype": "image/gif"
          },
          {
            "@category": "thumbnail",
            "@height": "73",
            "@width": "219",
            "@_fa": "true",
            "$": "https://api.elsevier.com/content/object/eid/1-s2.0-S0021951724004767-ga1.sml?httpAccept=%2A%2F%2A",
            "@multimediatype": "GIF image file",
            "@type": "IMAGE-THUMBNAIL",
            "@size": "7815",
            "@ref": "ga1",
            "@mimetype": "image/gif"
          },
          {
            "@category": "thumbnail",
            "@height": "164",
            "@width": "194",
            "@_fa": "true",
            "$": "https://api.elsevier.com/content/object/eid/1-s2.0-S0021951724004767-gr5.sml?httpAccept=%2A%2F%2A",
            "@multimediatype": "GIF image file",
            "@type": "IMAGE-THUMBNAIL",
            "@size": "11627",
            "@ref": "gr5",
            "@mimetype": "image/gif"
          },
          {
            "@category": "thumbnail",
            "@height": "157",
            "@width": "219",
            "@_fa": "true",
            "$": "https://api.elsevier.com/content/object/eid/1-s2.0-S0021951724004767-gr6.sml?httpAccept=%2A%2F%2A",
            "@multimediatype": "GIF image file",
            "@type": "IMAGE-THUMBNAIL",
            "@size": "6911",
            "@ref": "gr6",
            "@mimetype": "image/gif"
          },
          {
            "@category": "thumbnail",
            "@height": "164",
            "@width": "213",
            "@_fa": "true",
            "$": "https://api.elsevier.com/content/object/eid/1-s2.0-S0021951724004767-gr3.sml?httpAccept=%2A%2F%2A",
            "@multimediatype": "GIF image file",
            "@type": "IMAGE-THUMBNAIL",
            "@size": "14032",
            "@ref": "gr3",
            "@mimetype": "image/gif"
          },
          {
            "@category": "thumbnail",
            "@height": "164",
            "@width": "164",
            "@_fa": "true",
            "$": "https://api.elsevier.com/content/object/eid/1-s2.0-S0021951724004767-gr4.sml?httpAccept=%2A%2F%2A",
            "@multimediatype": "GIF image file",
            "@type": "IMAGE-THUMBNAIL",
            "@size": "9865",
            "@ref": "gr4",
            "@mimetype": "image/gif"
          },
          {
            "@category": "thumbnail",
            "@height": "76",
            "@width": "219",
            "@_fa": "true",
            "$": "https://api.elsevier.com/content/object/eid/1-s2.0-S0021951724004767-fx4.sml?httpAccept=%2A%2F%2A",
            "@multimediatype": "GIF image file",
            "@type": "IMAGE-THUMBNAIL",
            "@size": "3046",
            "@ref": "fx4",
            "@mimetype": "image/gif"
          },
          {
            "@category": "thumbnail",
            "@height": "82",
            "@width": "219",
            "@_fa": "true",
            "$": "https://api.elsevier.com/content/object/eid/1-s2.0-S0021951724004767-fx5.sml?httpAccept=%2A%2F%2A",
            "@multimediatype": "GIF image file",
            "@type": "IMAGE-THUMBNAIL",
            "@size": "2865",
            "@ref": "fx5",
            "@mimetype": "image/gif"
          },
          {
            "@category": "thumbnail",
            "@height": "107",
            "@width": "219",
            "@_fa": "true",
            "$": "https://api.elsevier.com/content/object/eid/1-s2.0-S0021951724004767-fx2.sml?httpAccept=%2A%2F%2A",
            "@multimediatype": "GIF image file",
            "@type": "IMAGE-THUMBNAIL",
            "@size": "3742",
            "@ref": "fx2",
            "@mimetype": "image/gif"
          },
          {
            "@category": "thumbnail",
            "@height": "101",
            "@width": "219",
            "@_fa": "true",
            "$": "https://api.elsevier.com/content/object/eid/1-s2.0-S0021951724004767-fx3.sml?httpAccept=%2A%2F%2A",
            "@multimediatype": "GIF image file",
            "@type": "IMAGE-THUMBNAIL",
            "@size": "3343",
            "@ref": "fx3",
            "@mimetype": "image/gif"
          },
          {
            "@category": "thumbnail",
            "@height": "128",
            "@width": "219",
            "@_fa": "true",
            "$": "https://api.elsevier.com/content/object/eid/1-s2.0-S0021951724004767-gr1.sml?httpAccept=%2A%2F%2A",
            "@multimediatype": "GIF image file",
            "@type": "IMAGE-THUMBNAIL",
            "@size": "17581",
            "@ref": "gr1",
            "@mimetype": "image/gif"
          },
          {
            "@category": "thumbnail",
            "@height": "137",
            "@width": "209",
            "@_fa": "true",
            "$": "https://api.elsevier.com/content/object/eid/1-s2.0-S0021951724004767-fx8.sml?httpAccept=%2A%2F%2A",
            "@multimediatype": "GIF image file",
            "@type": "IMAGE-THUMBNAIL",
            "@size": "3321",
            "@ref": "fx8",
            "@mimetype": "image/gif"
          },
          {
            "@category": "thumbnail",
            "@height": "82",
            "@width": "219",
            "@_fa": "true",
            "$": "https://api.elsevier.com/content/object/eid/1-s2.0-S0021951724004767-gr2.sml?httpAccept=%2A%2F%2A",
            "@multimediatype": "GIF image file",
            "@type": "IMAGE-THUMBNAIL",
            "@size": "5934",
            "@ref": "gr2",
            "@mimetype": "image/gif"
          },
          {
            "@category": "thumbnail",
            "@height": "82",
            "@width": "219",
            "@_fa": "true",
            "$": "https://api.elsevier.com/content/object/eid/1-s2.0-S0021951724004767-fx9.sml?httpAccept=%2A%2F%2A",
            "@multimediatype": "GIF image file",
            "@type": "IMAGE-THUMBNAIL",
            "@size": "3676",
            "@ref": "fx9",
            "@mimetype": "image/gif"
          },
          {
            "@category": "thumbnail",
            "@height": "93",
            "@width": "219",
            "@_fa": "true",
            "$": "https://api.elsevier.com/content/object/eid/1-s2.0-S0021951724004767-fx6.sml?httpAccept=%2A%2F%2A",
            "@multimediatype": "GIF image file",
            "@type": "IMAGE-THUMBNAIL",
            "@size": "4365",
            "@ref": "fx6",
            "@mimetype": "image/gif"
          },
          {
            "@category": "thumbnail",
            "@height": "84",
            "@width": "219",
            "@_fa": "true",
            "$": "https://api.elsevier.com/content/object/eid/1-s2.0-S0021951724004767-fx7.sml?httpAccept=%2A%2F%2A",
            "@multimediatype": "GIF image file",
            "@type": "IMAGE-THUMBNAIL",
            "@size": "3449",
            "@ref": "fx7",
            "@mimetype": "image/gif"
          },
          {
            "@category": "high",
            "@height": "280",
            "@width": "522",
            "@_fa": "true",
            "$": "https://api.elsevier.com/content/object/eid/1-s2.0-S0021951724004767-fx15_lrg.jpg?httpAccept=%2A%2F%2A",
            "@multimediatype": "JPEG image file",
            "@type": "IMAGE-HIGH-RES",
            "@size": "14281",
            "@ref": "fx15",
            "@mimetype": "image/jpeg"
          },
          {
            "@category": "high",
            "@height": "182",
            "@width": "365",
            "@_fa": "true",
            "$": "https://api.elsevier.com/content/object/eid/1-s2.0-S0021951724004767-fx14_lrg.jpg?httpAccept=%2A%2F%2A",
            "@multimediatype": "JPEG image file",
            "@type": "IMAGE-HIGH-RES",
            "@size": "10652",
            "@ref": "fx14",
            "@mimetype": "image/jpeg"
          },
          {
            "@category": "high",
            "@height": "210",
            "@width": "456",
            "@_fa": "true",
            "$": "https://api.elsevier.com/content/object/eid/1-s2.0-S0021951724004767-fx13_lrg.jpg?httpAccept=%2A%2F%2A",
            "@multimediatype": "JPEG image file",
            "@type": "IMAGE-HIGH-RES",
            "@size": "12112",
            "@ref": "fx13",
            "@mimetype": "image/jpeg"
          },
          {
            "@category": "high",
            "@height": "138",
            "@width": "286",
            "@_fa": "true",
            "$": "https://api.elsevier.com/content/object/eid/1-s2.0-S0021951724004767-fx12_lrg.jpg?httpAccept=%2A%2F%2A",
            "@multimediatype": "JPEG image file",
            "@type": "IMAGE-HIGH-RES",
            "@size": "8062",
            "@ref": "fx12",
            "@mimetype": "image/jpeg"
          },
          {
            "@category": "high",
            "@height": "252",
            "@width": "341",
            "@_fa": "true",
            "$": "https://api.elsevier.com/content/object/eid/1-s2.0-S0021951724004767-fx11_lrg.jpg?httpAccept=%2A%2F%2A",
            "@multimediatype": "JPEG image file",
            "@type": "IMAGE-HIGH-RES",
            "@size": "11471",
            "@ref": "fx11",
            "@mimetype": "image/jpeg"
          },
          {
            "@category": "high",
            "@height": "154",
            "@width": "1989",
            "@_fa": "true",
            "$": "https://api.elsevier.com/content/object/eid/1-s2.0-S0021951724004767-fx1_lrg.jpg?httpAccept=%2A%2F%2A",
            "@multimediatype": "JPEG image file",
            "@type": "IMAGE-HIGH-RES",
            "@size": "31962",
            "@ref": "fx1",
            "@mimetype": "image/jpeg"
          },
          {
            "@category": "high",
            "@height": "252",
            "@width": "189",
            "@_fa": "true",
            "$": "https://api.elsevier.com/content/object/eid/1-s2.0-S0021951724004767-fx10_lrg.jpg?httpAccept=%2A%2F%2A",
            "@multimediatype": "JPEG image file",
            "@type": "IMAGE-HIGH-RES",
            "@size": "8091",
            "@ref": "fx10",
            "@mimetype": "image/jpeg"
          },
          {
            "@category": "high",
            "@height": "736",
            "@width": "2213",
            "@_fa": "true",
            "$": "https://api.elsevier.com/content/object/eid/1-s2.0-S0021951724004767-ga1_lrg.jpg?httpAccept=%2A%2F%2A",
            "@multimediatype": "JPEG image file",
            "@type": "IMAGE-HIGH-RES",
            "@size": "97928",
            "@ref": "ga1",
            "@mimetype": "image/jpeg"
          },
          {
            "@category": "high",
            "@height": "2769",
            "@width": "3271",
            "@_fa": "true",
            "$": "https://api.elsevier.com/content/object/eid/1-s2.0-S0021951724004767-gr5_lrg.jpg?httpAccept=%2A%2F%2A",
            "@multimediatype": "JPEG image file",
            "@type": "IMAGE-HIGH-RES",
            "@size": "409916",
            "@ref": "gr5",
            "@mimetype": "image/jpeg"
          },
          {
            "@category": "high",
            "@height": "1211",
            "@width": "1693",
            "@_fa": "true",
            "$": "https://api.elsevier.com/content/object/eid/1-s2.0-S0021951724004767-gr6_lrg.jpg?httpAccept=%2A%2F%2A",
            "@multimediatype": "JPEG image file",
            "@type": "IMAGE-HIGH-RES",
            "@size": "173850",
            "@ref": "gr6",
            "@mimetype": "image/jpeg"
          },
          {
            "@category": "high",
            "@height": "1825",
            "@width": "2368",
            "@_fa": "true",
            "$": "https://api.elsevier.com/content/object/eid/1-s2.0-S0021951724004767-gr3_lrg.jpg?httpAccept=%2A%2F%2A",
            "@multimediatype": "JPEG image file",
            "@type": "IMAGE-HIGH-RES",
            "@size": "377660",
            "@ref": "gr3",
            "@mimetype": "image/jpeg"
          },
          {
            "@category": "high",
            "@height": "2364",
            "@width": "2368",
            "@_fa": "true",
            "$": "https://api.elsevier.com/content/object/eid/1-s2.0-S0021951724004767-gr4_lrg.jpg?httpAccept=%2A%2F%2A",
            "@multimediatype": "JPEG image file",
            "@type": "IMAGE-HIGH-RES",
            "@size": "327649",
            "@ref": "gr4",
            "@mimetype": "image/jpeg"
          },
          {
            "@category": "high",
            "@height": "125",
            "@width": "361",
            "@_fa": "true",
            "$": "https://api.elsevier.com/content/object/eid/1-s2.0-S0021951724004767-fx4_lrg.jpg?httpAccept=%2A%2F%2A",
            "@multimediatype": "JPEG image file",
            "@type": "IMAGE-HIGH-RES",
            "@size": "7050",
            "@ref": "fx4",
            "@mimetype": "image/jpeg"
          },
          {
            "@category": "high",
            "@height": "184",
            "@width": "490",
            "@_fa": "true",
            "$": "https://api.elsevier.com/content/object/eid/1-s2.0-S0021951724004767-fx5_lrg.jpg?httpAccept=%2A%2F%2A",
            "@multimediatype": "JPEG image file",
            "@type": "IMAGE-HIGH-RES",
            "@size": "9941",
            "@ref": "fx5",
            "@mimetype": "image/jpeg"
          },
          {
            "@category": "high",
            "@height": "125",
            "@width": "257",
            "@_fa": "true",
            "$": "https://api.elsevier.com/content/object/eid/1-s2.0-S0021951724004767-fx2_lrg.jpg?httpAccept=%2A%2F%2A",
            "@multimediatype": "JPEG image file",
            "@type": "IMAGE-HIGH-RES",
            "@size": "5456",
            "@ref": "fx2",
            "@mimetype": "image/jpeg"
          },
          {
            "@category": "high",
            "@height": "181",
            "@width": "392",
            "@_fa": "true",
            "$": "https://api.elsevier.com/content/object/eid/1-s2.0-S0021951724004767-fx3_lrg.jpg?httpAccept=%2A%2F%2A",
            "@multimediatype": "JPEG image file",
            "@type": "IMAGE-HIGH-RES",
            "@size": "8423",
            "@ref": "fx3",
            "@mimetype": "image/jpeg"
          },
          {
            "@category": "high",
            "@height": "1154",
            "@width": "1967",
            "@_fa": "true",
            "$": "https://api.elsevier.com/content/object/eid/1-s2.0-S0021951724004767-gr1_lrg.jpg?httpAccept=%2A%2F%2A",
            "@multimediatype": "JPEG image file",
            "@type": "IMAGE-HIGH-RES",
            "@size": "365552",
            "@ref": "gr1",
            "@mimetype": "image/jpeg"
          },
          {
            "@category": "high",
            "@height": "137",
            "@width": "209",
            "@_fa": "true",
            "$": "https://api.elsevier.com/content/object/eid/1-s2.0-S0021951724004767-fx8_lrg.jpg?httpAccept=%2A%2F%2A",
            "@multimediatype": "JPEG image file",
            "@type": "IMAGE-HIGH-RES",
            "@size": "5266",
            "@ref": "fx8",
            "@mimetype": "image/jpeg"
          },
          {
            "@category": "high",
            "@height": "1296",
            "@width": "3446",
            "@_fa": "true",
            "$": "https://api.elsevier.com/content/object/eid/1-s2.0-S0021951724004767-gr2_lrg.jpg?httpAccept=%2A%2F%2A",
            "@multimediatype": "JPEG image file",
            "@type": "IMAGE-HIGH-RES",
            "@size": "272127",
            "@ref": "gr2",
            "@mimetype": "image/jpeg"
          },
          {
            "@category": "high",
            "@height": "139",
            "@width": "372",
            "@_fa": "true",
            "$": "https://api.elsevier.com/content/object/eid/1-s2.0-S0021951724004767-fx9_lrg.jpg?httpAccept=%2A%2F%2A",
            "@multimediatype": "JPEG image file",
            "@type": "IMAGE-HIGH-RES",
            "@size": "8997",
            "@ref": "fx9",
            "@mimetype": "image/jpeg"
          },
          {
            "@category": "high",
            "@height": "111",
            "@width": "262",
            "@_fa": "true",
            "$": "https://api.elsevier.com/content/object/eid/1-s2.0-S0021951724004767-fx6_lrg.jpg?httpAccept=%2A%2F%2A",
            "@multimediatype": "JPEG image file",
            "@type": "IMAGE-HIGH-RES",
            "@size": "6252",
            "@ref": "fx6",
            "@mimetype": "image/jpeg"
          },
          {
            "@category": "high",
            "@height": "162",
            "@width": "421",
            "@_fa": "true",
            "$": "https://api.elsevier.com/content/object/eid/1-s2.0-S0021951724004767-fx7_lrg.jpg?httpAccept=%2A%2F%2A",
            "@multimediatype": "JPEG image file",
            "@type": "IMAGE-HIGH-RES",
            "@size": "9817",
            "@ref": "fx7",
            "@mimetype": "image/jpeg"
          },
          {
            "@category": "standard",
            "@_fa": "true",
            "$": "https://api.elsevier.com/content/object/eid/1-s2.0-S0021951724004767-mmc1.docx?httpAccept=%2A%2F%2A",
            "@multimediatype": "Microsoft Word file",
            "@type": "APPLICATION",
            "@size": "6220347",
            "@ref": "mmc1",
            "@mimetype": "application/word"
          }
        ]
      },
      "link": {
        "@rel": "abstract",
        "@href": "https://api.elsevier.com/content/abstract/scopus_id/85204223562"
      }
    }
  }
}