{
  "metadata": {
    "title": "Janus effect of O<ce:inf loc=post>2</ce:inf> plasma modification on the electrocatalytic hydrogen evolution reaction of MoS<ce:inf loc=post>2</ce:inf>",
    "authors": "; ; ",
    "journal": "Journal of Catalysis",
    "date": "2018-05-31",
    "doi": "10.1016/j.jcat.2018.03.018",
    "abstract": "",
    "uri": "https://api.elsevier.com/content/article/pii/S0021951718301192",
    "pii": "S0021951718301192"
  },
  "fulltext": {
    "full-text-retrieval-response": {
      "scopus-eid": "2-s2.0-85044573066",
      "originalText": "serial JL 272561 291210 291744 291809 31 Journal of Catalysis JOURNALCATALYSIS 2018-04-05 2018-04-05 2018-04-05 2018-04-05 2020-11-09T08:43:21 1-s2.0-S0021951718301192 S0021-9517(18)30119-2 S0021951718301192 10.1016/j.jcat.2018.03.018 S300 S300.4 FULL-TEXT 1-s2.0-S0021951718X00049 2021-04-03T16:59:40.965938Z 0 0 20180501 20180531 2018 2018-04-05T17:43:39.443703Z absattachment articleinfo articletitlenorm authfirstinitialnorm authfirstsurnamenorm cid cids contenttype copyright crossmark dateloaded dateloadedtxt datesearch datesort dateupdated dco docsubtype doctype doi eid ewtransactionid hubeid indexeddate issn issnnorm itemstage itemtransactionid itemweight openaccess openarchive pg pgfirst pglast pii piinorm pubdateend pubdatestart pubdatetxt pubyr sectiontitle sortorder srctitle srctitlenorm srctype ssids alllist content subj subheadings suppl tomb volfirst volissue volumelist webpdf webpdfpagecount yearnav figure e-component body acknowledge affil appendices articletitle auth authfirstini authfull authkeywords authlast grantnumber grantsponsor grantsponsorid highlightsabst primabst ref specialabst 0021-9517 00219517 true 361 361 C Volume 361 41 384 392 384 392 201805 May 2018 2018-05-01 2018-05-31 2018 Regular Articles article fla © 2018 Elsevier Inc. All rights reserved. JANUSEFFECTO2PLASMAMODIFICATIONELECTROCATALYTICHYDROGENEVOLUTIONREACTIONMOS2 ZHANG C 1 Introduction 2 Results and discussion 3 Conclusion Acknowledgements Appendix A Supplementary material References STRMCNIK 2013 300 306 D JIAO 2015 2060 2086 Y HU 2017 5995 6012 J WANG 2017 163 166 S HU 2016 9294 9300 J HU 2014 151602 J LAURSEN 2012 5577 5591 A HUANG 2013 1934 1946 X WANG 2013 19701 19706 H HU 2017 593 603 J HINNEMANN 2005 5308 5309 B LI 2011 7296 7299 Y ZHENG 2014 2344 2353 X MORALESGUIO 2014 2671 2681 C KIBSGAARD 2012 963 969 J XIE 2013 5807 5813 J LUKOWSKI 2013 10274 10277 M VOIRY 2013 6222 6227 D WANG 2014 4940 4947 H LI 2016 48 54 H XIE 2013 17881 17888 J ZHOU 2016 33681 33689 J GUO 2015 195 200 J LIU 2016 25210 25218 A TAO 2015 7470 7473 L HU 2014 211 217 J HU 2014 831 838 J WANG 2017 5867 5871 Y XIAO 2017 2563 2569 Z TAO 2017 417 425 L ZHANG 2011 10230 10232 C ISLAM 2014 10033 10039 M KONG 2013 1341 1347 D MURUGAN 2000 2157 2162 R YUAN 2012 4592 4597 C SAJI 2012 1146 1161 V MCCRORY 2015 4347 4357 C MERKI 2012 2515 2525 D CUMMINS 2016 11857 D YE 2016 1097 1103 G ZHANGX2018X384 ZHANGX2018X384X392 ZHANGX2018X384XC ZHANGX2018X384X392XC 2020-04-05T00:00:00.000Z http://creativecommons.org/licenses/by-nc-nd/4.0/ © 2018 Elsevier Inc. All rights reserved. 2021-03-12T08:27:10.520Z http://vtw.elsevier.com/data/voc/AddOnTypes/50.7/nlp S0021951718301192 Kunming University of Science and Technology KKKP201707010 KKKP201752011 Analysis and Testing Foundation of Kunming University of Science and Technology http://data.elsevier.com/vocabulary/SciValFunders/501100005194 http://sws.geonames.org/1814991/ Shenzhen Knowledge Innovation Program JCYJ20160428154632404 Shenzhen Knowledge Innovation Program http://data.elsevier.com/vocabulary/SciValFunders/501100017609 http://sws.geonames.org/1814991/ The authors acknowledge the financial support from the Kunming University of Science and Technology (No. KKKP201707010 and KKKP201752011 ) and Shenzhen Knowledge Innovation Program (Basic Research, JCYJ20160428154632404 ). item S0021-9517(18)30119-2 S0021951718301192 1-s2.0-S0021951718301192 10.1016/j.jcat.2018.03.018 272561 2020-11-09T08:57:28.468369Z 2018-05-01 2018-05-31 1-s2.0-S0021951718301192-main.pdf https://s3-eu-west-1.amazonaws.com/prod-ucs-content-store-eu-west/content/pii:S0021951718301192/MAIN/application/pdf/ccec6e0dd6acfef837e265cfef69c750/main.pdf main.pdf pdf true 2975783 MAIN 9 1-s2.0-S0021951718301192-main_1.png https://s3-eu-west-1.amazonaws.com/prod-ucs-content-store-eu-west/content/pii:S0021951718301192/PREVIEW/image/png/0e873fad2b0a0542b8f69a76b678fc8c/main_1.png main_1.png png 58397 849 656 IMAGE-WEB-PDF 1 1-s2.0-S0021951718301192-fx1.jpg https://s3-eu-west-1.amazonaws.com/prod-ucs-content-store-eu-west/content/pii:S0021951718301192/fx1/DOWNSAMPLED/image/jpeg/54e191458c29d2abbe82414424c9459b/fx1.jpg fx1 true fx1.jpg jpg 30081 200 459 IMAGE-DOWNSAMPLED 1-s2.0-S0021951718301192-gr1.jpg https://s3-eu-west-1.amazonaws.com/prod-ucs-content-store-eu-west/content/pii:S0021951718301192/gr1/DOWNSAMPLED/image/jpeg/43955c8298a73077a33d0ae9acf8a6b7/gr1.jpg gr1 gr1.jpg jpg 79226 494 578 IMAGE-DOWNSAMPLED 1-s2.0-S0021951718301192-gr10.jpg https://s3-eu-west-1.amazonaws.com/prod-ucs-content-store-eu-west/content/pii:S0021951718301192/gr10/DOWNSAMPLED/image/jpeg/f5f07362c0cce39bf0a240fcb146d4e9/gr10.jpg gr10 gr10.jpg jpg 61337 285 623 IMAGE-DOWNSAMPLED 1-s2.0-S0021951718301192-gr2.jpg https://s3-eu-west-1.amazonaws.com/prod-ucs-content-store-eu-west/content/pii:S0021951718301192/gr2/DOWNSAMPLED/image/jpeg/3d6d3eb418a68c0dfb0a678eda2838b2/gr2.jpg gr2 gr2.jpg jpg 59243 267 578 IMAGE-DOWNSAMPLED 1-s2.0-S0021951718301192-gr3.jpg https://s3-eu-west-1.amazonaws.com/prod-ucs-content-store-eu-west/content/pii:S0021951718301192/gr3/DOWNSAMPLED/image/jpeg/2bc2ba94ae0fc333d3e8c547b7070865/gr3.jpg gr3 gr3.jpg jpg 24104 254 310 IMAGE-DOWNSAMPLED 1-s2.0-S0021951718301192-gr4.jpg https://s3-eu-west-1.amazonaws.com/prod-ucs-content-store-eu-west/content/pii:S0021951718301192/gr4/DOWNSAMPLED/image/jpeg/90bc3744cb7536ff41dd38ef30e2e36f/gr4.jpg gr4 gr4.jpg jpg 49453 248 623 IMAGE-DOWNSAMPLED 1-s2.0-S0021951718301192-gr5.jpg https://s3-eu-west-1.amazonaws.com/prod-ucs-content-store-eu-west/content/pii:S0021951718301192/gr5/DOWNSAMPLED/image/jpeg/0e93c0f392dd7fe5dd03767aa23eb743/gr5.jpg gr5 gr5.jpg jpg 53221 259 623 IMAGE-DOWNSAMPLED 1-s2.0-S0021951718301192-gr6.jpg https://s3-eu-west-1.amazonaws.com/prod-ucs-content-store-eu-west/content/pii:S0021951718301192/gr6/DOWNSAMPLED/image/jpeg/8861d7df7e6bb10c44420421d31afd14/gr6.jpg gr6 gr6.jpg jpg 85698 505 678 IMAGE-DOWNSAMPLED 1-s2.0-S0021951718301192-gr7.jpg https://s3-eu-west-1.amazonaws.com/prod-ucs-content-store-eu-west/content/pii:S0021951718301192/gr7/DOWNSAMPLED/image/jpeg/7ded814a7e1ded171bfff974974f326f/gr7.jpg gr7 gr7.jpg jpg 71210 517 689 IMAGE-DOWNSAMPLED 1-s2.0-S0021951718301192-gr8.jpg https://s3-eu-west-1.amazonaws.com/prod-ucs-content-store-eu-west/content/pii:S0021951718301192/gr8/DOWNSAMPLED/image/jpeg/c6e2bdfab5e5d1ef226a51e91f0ccccf/gr8.jpg gr8 gr8.jpg jpg 42641 268 619 IMAGE-DOWNSAMPLED 1-s2.0-S0021951718301192-gr9.jpg https://s3-eu-west-1.amazonaws.com/prod-ucs-content-store-eu-west/content/pii:S0021951718301192/gr9/DOWNSAMPLED/image/jpeg/27a46b4e0b61c3fa0cb80fce451cda25/gr9.jpg gr9 gr9.jpg jpg 82684 534 578 IMAGE-DOWNSAMPLED 1-s2.0-S0021951718301192-fx1.sml https://s3-eu-west-1.amazonaws.com/prod-ucs-content-store-eu-west/content/pii:S0021951718301192/fx1/THUMBNAIL/image/gif/6d73eac312522244c430bdcae3ccddef/fx1.sml fx1 true fx1.sml sml 10741 95 219 IMAGE-THUMBNAIL 1-s2.0-S0021951718301192-gr1.sml https://s3-eu-west-1.amazonaws.com/prod-ucs-content-store-eu-west/content/pii:S0021951718301192/gr1/THUMBNAIL/image/gif/c7ee1267911cb473e38b66983da785ca/gr1.sml gr1 gr1.sml sml 19900 164 192 IMAGE-THUMBNAIL 1-s2.0-S0021951718301192-gr10.sml https://s3-eu-west-1.amazonaws.com/prod-ucs-content-store-eu-west/content/pii:S0021951718301192/gr10/THUMBNAIL/image/gif/df07c7ac7c0ae119455a12bd163a6a4d/gr10.sml gr10 gr10.sml sml 12670 100 219 IMAGE-THUMBNAIL 1-s2.0-S0021951718301192-gr2.sml https://s3-eu-west-1.amazonaws.com/prod-ucs-content-store-eu-west/content/pii:S0021951718301192/gr2/THUMBNAIL/image/gif/bbacd85b25defd394b97e4938e3e0877/gr2.sml gr2 gr2.sml sml 17400 101 219 IMAGE-THUMBNAIL 1-s2.0-S0021951718301192-gr3.sml https://s3-eu-west-1.amazonaws.com/prod-ucs-content-store-eu-west/content/pii:S0021951718301192/gr3/THUMBNAIL/image/gif/18203d905550665a54a8c60807b677a3/gr3.sml gr3 gr3.sml sml 10699 164 200 IMAGE-THUMBNAIL 1-s2.0-S0021951718301192-gr4.sml https://s3-eu-west-1.amazonaws.com/prod-ucs-content-store-eu-west/content/pii:S0021951718301192/gr4/THUMBNAIL/image/gif/32839c202da1ec2f182868f5ec6dc86b/gr4.sml gr4 gr4.sml sml 7417 87 219 IMAGE-THUMBNAIL 1-s2.0-S0021951718301192-gr5.sml https://s3-eu-west-1.amazonaws.com/prod-ucs-content-store-eu-west/content/pii:S0021951718301192/gr5/THUMBNAIL/image/gif/f80409ad39535abfb2dbf5dfddcb32fb/gr5.sml gr5 gr5.sml sml 7425 91 219 IMAGE-THUMBNAIL 1-s2.0-S0021951718301192-gr6.sml https://s3-eu-west-1.amazonaws.com/prod-ucs-content-store-eu-west/content/pii:S0021951718301192/gr6/THUMBNAIL/image/gif/7295e4049b34a5d8a4b24aa06e2d7635/gr6.sml gr6 gr6.sml sml 10383 163 219 IMAGE-THUMBNAIL 1-s2.0-S0021951718301192-gr7.sml https://s3-eu-west-1.amazonaws.com/prod-ucs-content-store-eu-west/content/pii:S0021951718301192/gr7/THUMBNAIL/image/gif/893079c6073741773a38c5cdc52de1cf/gr7.sml gr7 gr7.sml sml 9450 164 218 IMAGE-THUMBNAIL 1-s2.0-S0021951718301192-gr8.sml https://s3-eu-west-1.amazonaws.com/prod-ucs-content-store-eu-west/content/pii:S0021951718301192/gr8/THUMBNAIL/image/gif/1f7074531163d8dd61862764e9d52867/gr8.sml gr8 gr8.sml sml 6646 95 219 IMAGE-THUMBNAIL 1-s2.0-S0021951718301192-gr9.sml https://s3-eu-west-1.amazonaws.com/prod-ucs-content-store-eu-west/content/pii:S0021951718301192/gr9/THUMBNAIL/image/gif/d1c710f7498f6068f3608e78537a110c/gr9.sml gr9 gr9.sml sml 18691 164 177 IMAGE-THUMBNAIL 1-s2.0-S0021951718301192-fx1_lrg.jpg https://s3-eu-west-1.amazonaws.com/prod-ucs-content-store-eu-west/content/pii:S0021951718301192/fx1/HIGHRES/image/jpeg/966b94994e9def409f60b5d334b4960e/fx1_lrg.jpg fx1 true fx1_lrg.jpg jpg 129036 531 1221 IMAGE-HIGH-RES 1-s2.0-S0021951718301192-gr1_lrg.jpg https://s3-eu-west-1.amazonaws.com/prod-ucs-content-store-eu-west/content/pii:S0021951718301192/gr1/HIGHRES/image/jpeg/9f2f6c9f801814ec4135f00a6bda7b81/gr1_lrg.jpg gr1 gr1_lrg.jpg jpg 239583 1312 1535 IMAGE-HIGH-RES 1-s2.0-S0021951718301192-gr10_lrg.jpg https://s3-eu-west-1.amazonaws.com/prod-ucs-content-store-eu-west/content/pii:S0021951718301192/gr10/HIGHRES/image/jpeg/d18f0b62db14c56aeb7d1e4b970f7951/gr10_lrg.jpg gr10 gr10_lrg.jpg jpg 215252 756 1654 IMAGE-HIGH-RES 1-s2.0-S0021951718301192-gr2_lrg.jpg https://s3-eu-west-1.amazonaws.com/prod-ucs-content-store-eu-west/content/pii:S0021951718301192/gr2/HIGHRES/image/jpeg/974a1693857cb138d7f8eb309ff7311a/gr2_lrg.jpg gr2 gr2_lrg.jpg jpg 231248 710 1535 IMAGE-HIGH-RES 1-s2.0-S0021951718301192-gr3_lrg.jpg https://s3-eu-west-1.amazonaws.com/prod-ucs-content-store-eu-west/content/pii:S0021951718301192/gr3/HIGHRES/image/jpeg/eb8a01ebd5f4fac306063e184c740325/gr3_lrg.jpg gr3 gr3_lrg.jpg jpg 86345 675 824 IMAGE-HIGH-RES 1-s2.0-S0021951718301192-gr4_lrg.jpg https://s3-eu-west-1.amazonaws.com/prod-ucs-content-store-eu-west/content/pii:S0021951718301192/gr4/HIGHRES/image/jpeg/916b9b391d33c9d6e2ebd00e10c5d509/gr4_lrg.jpg gr4 gr4_lrg.jpg jpg 161316 660 1655 IMAGE-HIGH-RES 1-s2.0-S0021951718301192-gr5_lrg.jpg https://s3-eu-west-1.amazonaws.com/prod-ucs-content-store-eu-west/content/pii:S0021951718301192/gr5/HIGHRES/image/jpeg/e6ea4013e0d7089b344578a8dd4b0fd2/gr5_lrg.jpg gr5 gr5_lrg.jpg jpg 164426 688 1654 IMAGE-HIGH-RES 1-s2.0-S0021951718301192-gr6_lrg.jpg https://s3-eu-west-1.amazonaws.com/prod-ucs-content-store-eu-west/content/pii:S0021951718301192/gr6/HIGHRES/image/jpeg/768510aeacf83a5e3f4f0736eb24f83c/gr6_lrg.jpg gr6 gr6_lrg.jpg jpg 282371 1429 1920 IMAGE-HIGH-RES 1-s2.0-S0021951718301192-gr7_lrg.jpg https://s3-eu-west-1.amazonaws.com/prod-ucs-content-store-eu-west/content/pii:S0021951718301192/gr7/HIGHRES/image/jpeg/ad163633ba355115568c2e2d5ea1b1b2/gr7_lrg.jpg gr7 gr7_lrg.jpg jpg 212537 1373 1830 IMAGE-HIGH-RES 1-s2.0-S0021951718301192-gr8_lrg.jpg https://s3-eu-west-1.amazonaws.com/prod-ucs-content-store-eu-west/content/pii:S0021951718301192/gr8/HIGHRES/image/jpeg/640331ba51fa275ac03f4c8924b96751/gr8_lrg.jpg gr8 gr8_lrg.jpg jpg 134052 713 1645 IMAGE-HIGH-RES 1-s2.0-S0021951718301192-gr9_lrg.jpg https://s3-eu-west-1.amazonaws.com/prod-ucs-content-store-eu-west/content/pii:S0021951718301192/gr9/HIGHRES/image/jpeg/eb3744793a68f47f8224baff1085e4be/gr9_lrg.jpg gr9 gr9_lrg.jpg jpg 252423 1418 1535 IMAGE-HIGH-RES 1-s2.0-S0021951718301192-mmc1.docx https://s3-eu-west-1.amazonaws.com/prod-ucs-content-store-eu-west/content/pii:S0021951718301192/mmc1/MAIN/application/vnd.openxmlformats-officedocument.wordprocessingml.document/00a6372a5db860b58f5c3facde2028e5/mmc1.docx mmc1 mmc1.docx docx 7335569 APPLICATION YJCAT 12760 S0021-9517(18)30119-2 10.1016/j.jcat.2018.03.018 Elsevier Inc. Fig. 1 FESEM images of (a) MoS2; (b) MoS2 O2-plasma 30 s; (c) MoS2 O2-plasma 60 s; and (d) MoS2 O2-plasma 120 s. Fig. 2 High- and (inset) low-magnification TEM images of (a) MoS2; and (b) MoS2 O2-plasma 60 s. Fig. 3 Raman spectra within the range of 350–450 cm−1 for the MoS2 and O2-plasma treated MoS2 samples. The intensity ratios of the A1g mode to E2g 1 mode for all the MoS2 samples are shown in the figure. Fig. 4 (a) Raman spectra within the range of 100–1100 cm−1 for the MoS2 and O2-plasma treated MoS2 samples. (b) XRD patterns of the O2-plasma treated MoS2 samples, together with the standard pattern of 2H MoS2 (JCPDS 75-1539). Fig. 5 High resolution of XPS (a) O 1s and (b) Mo 3d spectra for MoS2 and O2-plasma treated MoS2 samples. Fig. 6 (a) Polarization curves of the commercial MoS2 and O2 plasma treated MoS2 catalysts in 0.5 M H2SO4 solution at a scan rate of 5 mV/s. (b) Charging current density differences plotted against scan rate of the O2 plasma treated MoS2 catalysts, Cdl is equivalent to the slope of the fitted line. (c) Tafel plots for the O2 plasma treated MoS2 catalysts derived from (a). (d) Nyquist plots of the O2 plasma treated MoS2 catalysts at the overpotential of 200 mV and the corresponding equivalent circuit that fits the electrochemical impedance spectroscopy (EIS) data. Fig. 7 Polarization curves recorded from the (a) MoS2, (b) MoS2 O2-plasma 30 s, (c) MoS2 O2-plasma 60 s, and (d) MoS2 O2-plasma 120 s catalysts at a scan rate of 5 mV/s before and after the chronopotentiometry test. Inset: chronopotentiometry responses (η ∼ t) recorded at a constant current density of −10 mA/cm2. Fig. 8 High resolution of XPS Mo 3d spectra for (a) MoS2 O2-plasma 60 s and (b) MoS2 O2-plasma 120 s catalysts before and after the chronopotentiometry test at −10 mA/cm2 for 20 h. Fig. 9 FESEM images of (a) MoS2; (b) MoS2 O2-plasma 30 s; (c) MoS2 O2-plasma 60 s; and (d) MoS2 O2-plasma 120 s catalysts after the chronopotentiometry test at −10 mA/cm2 for 20 h. Fig. 10 (a) TEM image of the MoS2 O2-plasma 60 s sample after the chronopotentiometry test at −10 mA/cm2 for 20 h. (b) Raman spectra of the O2-plasma treated MoS2 samples after the chronopotentiometry test at −10 mA/cm2 for 20 h. The intensity ratios of the A1g mode to E2g 1 mode for all the MoS2 samples are shown in the figure. Janus effect of O2 plasma modification on the electrocatalytic hydrogen evolution reaction of MoS2 Chengxu Zhang a Lin Jiang b Yingjie Zhang a Jue Hu b ⁎ Michael K.H. Leung c d ⁎ a The Engineering Laboratory of Advanced Battery and Materials of Yunnan Province, Faculty of Metallurgical and Energy Engineering, Kunming University of Science and Technology, Kunming, China The Engineering Laboratory of Advanced Battery and Materials of Yunnan Province Faculty of Metallurgical and Energy Engineering Kunming University of Science and Technology Kunming China b Faculty of Science, Kunming University of Science and Technology, Kunming, China Faculty of Science Kunming University of Science and Technology Kunming China c Ability R&D Energy Research Centre, School of Energy and Environment, City University of Hong Kong, Hong Kong, China Ability R&D Energy Research Centre School of Energy and Environment City University of Hong Kong Hong Kong, China d The City University of Hong Kong Shenzhen Research Institute, Shenzhen, China The City University of Hong Kong Shenzhen Research Institute Shenzhen China ⁎ Corresponding authors at: Faculty of Science, Kunming University of Science and Technology, Kunming, China (J. Hu); Ability R&D Energy Research Centre, School of Energy and Environment, City University of Hong Kong, Hong Kong, China (M.K.H. Leung). Faculty of Science Kunming University of Science and Technology Kunming China Graphical abstract Oxygen incorporation is a promising and effective way for simultaneously engineering the edge and planar sites of MoS2 to fabricate high-performance HER electrocatalysts. However, the insulating MoO3 species are inevitably generated during the oxygen incorporation process. Here, controlled plasma exposure time has been designed to explore the influence of MoO3 species on the HER performance for the O2 plasma modified MoS2 catalysts. We find that the MoO3 species in MoS2 are not conductive to the HER electrocatalysis. More importantly, the Raman spectrum, X-ray photoelectron spectroscopy, energy-disperse X-ray spectrum and transmission electron microscope analyses demonstrate that these co-generated MoO3 species are reduced and resolved from the MoS2 lattice during the electrocatalytic hydrogen evolution, leading to a holey structure in the MoS2 nanosheets and thus a significant improvement of its hydrogen evolution stability. This work not only helps to understand the electrocatalytic influence of the co-generated MoO3 species in MoS2, but also presents a methodological improvement in designing defect-rich, oxygen incorporated and holey MoS2 nanosheets for highly efficient hydrogen evolution. Keywords Hydrogen evolution reaction MoS2 Oxygen incorporation MoO3 species Janus effect Plasma modification 1 Introduction Hydrogen (H2), with the highest gravimetric energy density among the currently wildly used fuels and zero carbon content leading water as the sole product from its oxidation reaction, has been recognized as the most ideal and clean energy carrier to resolve the growing concern about energy crisis, environmental pollution and global warming, and fulfill our need for the future fuel applications [1–4]. The hydrogen evolution reaction (HER) is the cathodic half reaction of electrocatalytic water splitting and is thus highly desirable to power the “hydrogen-based economy”. In electrolysis, noble metals, e.g. platinum (Pt) is still the best catalysts for the HER due to their high electrocatalytic activity. However, the widespread applications of Pt-based noble metal catalysts are hindered by their high cost, scarcity and insufficient stability [5,6]. Therefore, central to the electrocatalysis are efficient and robust electrocatalysts based on nonprecious metals, which are urgently needed for satisfying the hydrogen-based industry. Earth-abundant MoS2 has emerged as a promising HER catalyst with high electrocatalytic activity and stability due to its unique physical and chemical properties [7–9]. In the electronic structure of MoS2, the orbitals of HOMO states are mainly localized at the edged S sites, so that the localized electrons are mainly at the edge of MoS2 for charge exchange of proton [10]. DFT calculations have elucidated that the MoS2 plane sites are HER-catalytically inert with the hydrogen adsorption energy (ΔG H) of is ∼1.9 eV, while edge sites especially the [1 0 1 0] Mo edges are HER-catalytically active with a near-optimal ΔG H as ∼0.08 eV, which is even closer to 0 eV than that of the state-of-the-art Pt surfaces (ΔG H is ∼−0.1 eV) [11]. Inspired by this understanding, great efforts have been devoted to developing high-performance MoS2 nanostructures. On one hand, noteworthy MoS2 nanostructures including nanoparticle [12], nanosheet [13], amorphous MoS2 [14], film with ordered double-gyroid network [15], defect-rich nanosheet [16], and vertically aligned stepped edge terminated MoS2 sheet arrays [10] have been developed to maximizing the active edge sites and illustrated to have enhanced HER performance. On the other hand, optimizing the hydrogen adsorption on the inert planar sites by converting the 2H phase to the 1 T phase of MoS2 layers [17–19], distorting the MoS2 plane and introducing S-vacancy in the MoS2 planar sites [20] significantly facilitates the hydrogen binding and thus increases the HER activity. Therefore, simultaneous optimization of both the edge and planar sites of MoS2 materials is of great importance to fabricate the high-performance HER electrocatalyst. Xie and co-workers have recently reported a novel oxygen-incorporated MoS2 ultrathin nanosheet system, in which the oxygen incorporation could effectively reduce the bandgap, increase the intrinsic conductivity of MoS2 catalyst, and thus enhance its HER performance [21]. In addition, it was believed that such enhancement of HER performance for O-incorporated MoS2 catalyst could be attributed to not only the enhanced intrinsic conductivity and expanded interlayer spaces, but also the modulated hydrogen binding free energy on the inert planar sites [21–24]. More recently, O2 plasma was used to engineer the defect-rich and oxygen incorporated structure of MoS2 to enhance its electrocatalytic activity for HER [25]. Plasma modification is a mild and efficient way to introduce disordered structure and functional foreign atoms on the materials’ surface [26–31]. It is believed that there are a variety of reactive species (e.g. electrons, ions and neutral radicals, etc.) generated during the plasma discharge [32,33]. The high-energy electrons in O2 plasma contribute to the plasma bombardment and ablation, leading to the cracking of the basal planes of MoS2 and thus defect-rich edge structure. At the same time, the O-species (oxygen ions and oxygen radicals) in O2 plasma would incorporate into the MoS2 lattice due to their highly oxidative activity [34]. However, the generation of MoO3 species is found to be inevitable during the O2 plasma treatment or other O-incorporation processes [23,25,35]. The influence of these insulating MoO3 species on the HER activity and stability of MoS2 and its structure changes after long-term electrocatalytic reaction, which are significant to understand the HER electrocatalysis on the O-incorporated MoS2 catalysts, however, are still unknown. Herein, we used the one-step O2 plasma modification to simultaneously engineer the edge and planar structure of MoS2 to fabricate the high-performance MoS2 electrocatalyst with defect-rich edge and oxygen-doped planar structure. As expected, the O2 plasma modified MoS2 catalysts possess a smaller HER onset potential and Tafel slope than that of the non-treated MoS2 catalyst, as well as the excellent long-term durability. To investigate the influence of MoO3 species on the HER performance, chemical structure and HER performance of the O2-plasma modified MoS2 catalysts before and after the long-term durability test were carefully analyzed. 2 Results and discussion We fabricated the O2 plasma modified MoS2 catalysts via a two-step process. The MoS2 spheres were firstly synthesized by hydrothermal reaction, and then modified by O2 plasma with different plasma treatment time of 30 s (MoS2 O2-plasma 30 s), 60 s (MoS2 O2-plasma 60 s) and 120 s (MoS2 O2-plasma 120 s). The morphology of the as-synthesized MoS2 and O2 plasma treated MoS2 catalysts was characterized by field-emission scanning electron microscopy (FESEM) shown in Fig. 1 . The FESEM images clearly reveal the great difference among various MoS2 samples. Fig. 1a indicates that the hydrothermal synthesized 3D MoS2 microsphere is built from large quantities of uniform nanosheets with the edge length of 300–600 nm. Obviously, smaller edge length of the MoS2 nanosheets can be observed from Fig. 1b–d of the O2 plasma treated MoS2 samples, indicating more cracks in the MoS2 nanosheets comparing to the non-treated MoS2, and thus more exposed active edge sites on the O2 plasma treated MoS2 surface. The transmission electron microscopy (TEM) imageshave confirmed the ultrathin nanosheet morphology ofas-grown MoS2 samples. It can be clearly seen from the TEM image in Fig. 2 a that the MoS2 nanosheets were connected to each other through the center to form the 3D microsphere structure. As shown in the high-magnification TEM images, the MoS2 nanosheets exhibit an interlayer separation of 0.63 nm for both the MoS2 and MoS2 O2-plasma 60 s samples, corresponding to the (0 0 2) facet of 2H-MoS2 crystal (also see the XRD analysis below). Careful investigation of the TEM image reveals that the crystal fringes along the edge of the MoS2 O2-plasma 60 s sample are dislocated and discontinuous (indexed in Fig. 2b), suggesting a defect-rich structure for the plasma treated MoS2. The dislocated atomic arrangement causes the cracking of the basal planes and thus results in the formation of additional edges [16]. In addition, the corresponding Raman spectra as shown in Fig. 3 for all the MoS2 samples exhibited two distinct peaks at ∼405 cm−1 referred to the out-of-plane Mo-S phonon mode (A1g) and at ∼379 cm−1 corresponded to the in-plane Mo-S phonon mode (E2g 1) of typical MoS2 layer structure [36]. The relatively high intensity of the A1g mode for the O2 plasma modified MoS2 samples confirms more edge-terminated sites generated during plasma treatment process, which is in consistent with the SEM and TEM observations [37]. The energy-dispersive spectroscopy (EDS) spectrum of the as-grown MoS2 (see Fig. S1) reveals that the ratio of S to Mo is close to 2, confirming the successful synthesis of MoS2. It is worth noting that after the O2 plasma modification, O content in MoS2 samples becomes larger over the plasma processing time (Figs. S2–4), indicating that O2 plasma modification is an effective way to introduce oxygen species onto the MoS2 surfaces. To characterize those oxygen species, Raman spectra with large range were recorded for all the MoS2 samples, shown in Fig. 4 a. The spectra of all the MoS2 samples display two strong vibrational bands at ∼379 cm−1 and ∼405 cm−1, which are attributed to the Mo-S phonon mode of MoS2. Clearly, the Raman spectra of the MoS2 O2-plasma 30 s and non-treated MoS2 samples are similar, indicating the similar chemical structure between them. However, there are three newly developed bands at 666 cm−1, 820 cm−1 and 995 cm−1 for MoS2 O2-plasma 60 s and MoS2 O2-plasma 120 s, not present for MoS2 O2-plasma 30 s sample, which are responsible for the layered structure of the α-phase MoO3. The crystal structure of α-phase MoO3 contains three nonequivalent oxygen atoms in the MoO6 octahedral unit, which are edge sharing triply coordinated oxygen (O–Mo3), doubly coordinated oxygen (MoOMo), and terminal oxygen (MoO). The stretching mode for these three oxygen is located at 666 cm−1 for OMo3, 820 cm−1 for MoOMo and 995 cm−1 for MoO with the relative intensity ratio of 0.2:1:0.5 [38]. Nevertheless, the Raman spectra analysis indicates the formation of MoO3 species in the MoS2 O2-plasma 60 s and MoS2 O2-plasma 120 s samples. Moreover, the intensity of these three bands dramatically increased when increasing the plasma processing time from 60 s to 120 s, indicating that much more surface MoO3 species formed. The chemical structure of MoS2 and O2 plasma modified MoS2 samples are further studied by X-ray diffraction (XRD) and X-ray photoelectron spectroscopy (XPS). As shown in Fig. 4b, the XRD peaks observed at 2θ = 14.1°, 32.9°, 39.5° and 58.8° of all the MoS2 samples can be indexed to (0 0 2), (1 0 0), (1 0 3) and (1 1 0) facets of 2H-MoS2 crystal, respectively (JCPDS No. 75-1539, JCPDS = Joint Committee on Powder Diffraction Standards). In agreement with the Raman analysis, the XRD patterns further evidence the present of α-phase MoO3 (marked using star in Fig. 4b) in the MoS2 O2-plasma 60 s and MoS2 O2-plasma 120 s samples, not present for MoS2 O2-plasma 30 s sample, which show peaks at 2θ = 12.7° and 27.3° indexed to (0 2 0) and (0 2 1) facets of the α-phase MoO3, respectively (JCPDS No. 05-0508). The high-resolution TEM image in Fig. S5 of the MoS2 O2-plasma 60 s sample exhibits an interlayer separation of 0.35 nm, corresponding to the (0 4 0) facet of MoO3 crystal and the lattice fringes of 0.23 nm and 0.28 nm, which are agree well with the (1 0 3) and (1 0 0) lattice spacing of the 2H-MoS2 crystal, respectively. In consistent with the Raman and XRD results, the TEM image shows the direct evidence for the generation of the MoO3 in the O2 plasma modified MoS2 matrix. The asymmetric XPS O 1s spectrum of the as-grown MoS2 (Figs. 5 a and S6) can be divided into four distinct peaks: peak O1 at 530.1 eV corresponded to metal–oxygen bonds; peak O2 at 531 eV attributed to oxygen in OH− groups; peak O3 at 532.1 eV assigned to oxygen component with a higher number of defect sites but low oxygen coordination; and peak O4 at 533.1 eV referred to multiplicity of physi- and chemi-sorbed water at the surface [6,39]. In comparison, the O 1s spectra for the MoS2 O2-plasma 60 s and MoS2 O2-plasma 120 s samples show a significant increase of a peak at 530.2 eV attributed to metal-oxygen bonds, verifying the successful O incorporation in the MoS2 lattice [21]. The Mo 3d spectrum of the as-synthesized MoS2 shows strong spin-orbit doublet peaks at 229.0 eV and 232.1 eV assigned to Mo4+ 3d5/2 and Mo4+ 3d3/2, respectively. The doublet peaks at 232.7 eV and 235.8 eV which are related to Mo6+ suggest a small amount of MoO3 species exist on the as-synthesized MoS2 surface, as shown in Fig. 5b [10]. After the plasma modification, the intensity of this doublet peaks significantly increased, confirming additional surface MoO3 species for the MoS2 O2-plasma 60 s and MoS2 O2-plasma 120 s samples. Moreover, the XPS analyses also prove that the formation of the surface MoO3 species via O2 plasma treatment are highly relevant to the plasma processing time, which is in good consistent with the Raman and XRD results. Electrocatalytic performance of various MoS2 samples were investigated in 0.5 M H2SO4 solution using a three-electrode setup with the same loading of 3 mg/cm2 on carbon fiber paper substrate. During the electrochemical measurement, high-purity H2 is continuously purged into the electrolyte to saturate the electrolyte and fix the reversible hydrogen potential. As shown in Fig. 6 a, the O2 plasma modified MoS2 samples give a relatively low overpotential to the non-treated MoS2 at 10 mA/cm2. Among them, the MoS2 O2-plasma 60 s catalyst exhibits a further boosted HER activity with the overpotential as low as 131 mV at the current density of 10 mA/cm2. It can be clearly seen that there is a redox peak at around −0.16 V vs. RHE for MoS2 O2-plasma 60 s and MoS2 O2-plasma 120 s catalysts, which is ascribed to the insertion of hydrogen ions into the α-phase MoO3 lattice during the cathodic potential scan and then forming the MoO3-x with lower state of Mo [40]. Electrochemical double layer capacitances (Cdl), which is known to be proportional to the electrochemical surface area (ECSA) has been derived from the cyclic voltammetry curves in the potential range of 0.1–0.2 V vs. RHE with different scan rate in the potential range where no faradic current was observed (Fig. 6b) [41]. The halves of the positive and negative current density differences at the center of the scanning potential range (Δj 0.15V/2) are plotted versus the scan rate shown in Fig. S7. The Cdl of the O2-plasma modified MoS2 catalysts become larger than that of the non-treated MoS2 due to the newly generated active sites during plasma bombardment. It can be clearly found that the Cdl of the MoS2 O2-plasma 60 s (95 mF/cm2) is higher than that of the non-treated MoS2 (52 mF/cm2), MoS2 O2-plasma 30 s (60 mF/cm2) and MoS2 O2-plasma 120 s (77 mF/cm2) catalysts, indicating a much higher electrochemical surface area of the MoS2 O2-plasma 60 s catalyst, and thus the superior HER activity. The ECSA normalized HER performance, as shown in Fig. S8, was analyzed to investigate a surface area corrected improvement of HER kinetics for these O2 plasma modified MoS2 catalysts. Among them, the MoS2 O2-plasma 30 s catalyst exhibits a highest ECSA normalized HER electrocatalytic activity, indicating that the MoO3 species in MoS2 is not conductive to the HER electrocatalysis. As shown in Fig. 6c, the Tafel slopes of MoS2, MoS2 O2-plasma 30 s, MoS2 O2-plasma 60 s and MoS2 O2-plasma 120 s catalysts were determined to be 83, 69, 74 and 77 mV/dec, respectively. Tafel analysis has been used to distinguish between different mechanistic pathways. The Tafel slopes of all the MoS2 catalysts are within the range of 39–116 mV/dec, indicate that the charge transfer steps govern the HER kinetics, where the Volmer step and Heyrovsky step become kinetically comparable [42]. The lower Tafel slope value of O2 plasma modified MoS2 catalysts than that of non-treated MoS2 indicates a superior HER kinetics. This was confirmed by the electrochemical impedance spectroscopy (EIS) as shown in Fig. 6d. The Nyquist plots at the overpotential of 200 mV show that the MoS2 O2-plasma 60 s catalyst has the smallest charge transfer resistance (Rct) of only 3.3 Ω, indicating the ultrafast Faradaic process and thus a superior HER kinetics. The slightly higher Rs (serial resistance) of the O2 plasma modified MoS2 catalysts may be due to the new generated cracking in the MoS2 layers and insulating MoO3 species. The electrocatalytic performances including the overpotential, Tafel slope, Cdl and charge transfer resistance of all the O2 plasma modified MoS2 samples were summarized in Table S1. Based on the morphology and chemical structure analyses, O2 plasma modification can effectively introduce additional active edge sites on the MoS2 nanostructure and incorporate O into the MoS2 lattice, both of which are benefit for the hydrogen evolution catalysis. After short time O2 plasma modification, the MoS2 O2-plasma 30 s catalyst possesses more active edge sites in the MoS2 lattice, and thus exhibits superior HER activity than the as-grown MoS2 catalyst. Besides the defect-rich edge structure, there is confirmed structural evidence showing the successful O incorporation into the MoS2 lattice for MoS2 O2-plasma 60 s catalyst. However, it is obvious that too much MoO3 species were introduced on the MoS2 surface when further extending the plasma exposure time to 120 s based on the Raman, EDS and XPS analyses, indicating a Janus effect of O-incorporation on HER properties of MoS2. The inferior HER activity of the MoS2 O2-plasma 120 s catalyst than MoS2 O2-plasma 60 s suggests that MoO3 species in MoS2 is not conductive to the HER electrocatalysis. Therefore, the MoS2 O2-plasma 60 s catalyst, which possesses the highest degree of defects and moderate degree of O incorporation exhibits the highest HER activity among these four MoS2 catalysts. Long-term stability of MoS2 was assayed by mean of chronopotentiometry measurement (η ∼ t). The process was performed at a constant current density of −10 mA/cm2 for 20 h for all the MoS2 catalysts. From the inset pictures of Fig. 7 , it is clear that all the MoS2 catalysts show accepted stability with less than 10 mV increase of the overpotential after biased galvanostatically at −10 mA/cm2 for 20 h. In addition, after the chronopotentiometry measurement, the polarization curves of the MoS2 O2-plasma 30 s and MoS2 O2-plasma 120 s catalysts show smaller negative shift from the initial one than that of the non-treated MoS2 catalyst, indicating an improvement of the HER stability. The redox peak at around −0.16 V vs. RHE for MoS2 O2-plasma 60 s and MoS2 O2-plasma 120 s catalysts disappeared after the chronopotentiometry test, indicating the reduction of MoO3 species because of the electrochemical reduction characteristics during HER. It is worth noting from Fig. 7c that the cathodic overpotential required to maintain the current density of −10 mA/cm2 for MoS2 O2-plasma 60 s catalyst decrease about 15 mv. Moreover, there is no negative shift of the polarization curve after the chronopotentiometry measurement relative to the initial one, further manifesting the striking long-term durability of the MoS2 O2-plasma 60 s catalyst on HER. In order to better compare the HER kinetics with the recently reported highly active MoS2-based catalysts, the overpotentials required for maintaining the HER current density of −10 mA/cm2 of most active MoS2-based catalysts were listed, as shown in Table S2. the MoS2 O2-plasma 60 s catalyst exhibits a boosted HER activity with the overpotential as low as 131 mV at the current density of 10 mA/cm2 and striking long-term durability, better than most reported MoS2-based catalysts. SEM, TEM, EDS, XPS and Raman analyses were carried out on MoS2 catalysts to investigate the chemical structural and morphological changes of the those electrocatalysts after the long-term durability measurement, as shown in Figs. 8, 9 and S8–11. The Raman spectrum of the MoS2 O2-plasma 30 s catalyst after electrochemical testing essentially the same as that of the initial one (Fig. S9), suggesting no obvious structural changes of the MoS2 O2-plasma 30 s catalyst during the HER catalysis. However, it is obvious that the intensity of stretching mode for MoO3 components in the MoS2 O2-plasma 60 s and MoS2 O2-plasma 120 s catalysts decreased, indicating the decrease of MoO3 species in MoS2. Further studying the SEM-EDS elementary analysis in Figs. S10–12, we can find that the O content in all the O2 plasma modified MoS2 samples, especially MoS2 O2-plasma 60 s and MoS2 O2-plasma 120 s, significantly decreased and the S/Mo ratio became close to 2:1 after the electrochemical testing, demonstrating the decrease of the MoO3 species in MoS2 during the long-term chronopotentiometry test, which is well consistent with the electrochemical analysis. The XPS spectra of the Mo 3d region for MoS2 O2-plasma 60 s and MoS2 O2-plasma 120 s catalysts after the chronopotentiometry test are shown in Fig. 8. The intensity of the doublet peaks at 232.7 eV and 235.8 eV which are related to Mo6+ 3d5/2 and Mo4+ 3d3/2, respectively, markedly decreased. Accordingly, there are increased doublet peaks at 229 eV and 232.1 eV related to Mo4+, and doublet peaks at 230.0 eV and 233.4 eV attributed to MoO3-x, confirming the electro-reduction of the Mo6+ species during the hydrogen evolution catalysis [10,43]. The doublet peaks at 230.0 eV and 233.4 eV for MoO3-x can be seen in Fig. 9 for both the MoS2 O2-plasma 60 s and MoS2 O2-plasma 120 s catalysts, verifying still an amount of incorporated O retained in the MoS2 lattice even after long-term durability test. Fig. 9 presents the SEM images of all the MoS2 samples, when comparing with the SEM images before chronopotentiometry test we can see that: (i) there is no difference in the morphology of the non-treated MoS2 catalyst after 20 h at −10 mA/cm2; (ii) the layered MoS2 morphology with basal planes cracked structure of the MoS2 O2-plasma 30 s and MoS2 O2-plasma 60 s samples were highly preserved after the long-term durability test; and (iii) there is a significant difference in the morphology between the MoS2 O2-plasma 120 s catalyst before and after the long-term durability measurement due to the reduction and resolution of large amount of MoO3 species. Interestingly, the TEM images of the MoS2 O2-plasma 60 s sample after the durability test shown in Fig. 10 , display a holey structure of the MoS2 nanosheet. This holey structure of the MoS2 O2-plasma 60 s sample which is attributed to the reduction and resolution of MoO3 species in MoS2 lattice can provide more additional active edge sites in the MoS2 nanostructure [44]. From the Raman spectra shown in Fig. 10b, the relatively high intensity ratios of the A1g mode to E2g 1 mode for MoS2 O2-plasma 60 s and MoS2 O2-plasma 120 s samples after the durability test confirms more edge-terminated sites generated after MoO3 species reduction and resolution, which is in consistent with the TEM observations. The increase of the active edge sites during the long-term HER process may result the significant improvement of the hydrogen evolution stability for the O2 plasma modified MoS2 catalysts. 3 Conclusion By engineering the defects and O-incorporation in the nanostructure of MoS2 through O2 plasma modification, the HER electrocatalytic activities including the electrochemical surface area, current density, onset potential, Tafel slope and charge transfer resistance can be improved effectively. Controlled plasma exposure time has been designed to explore the influence of MoO3 species on the HER performance of O2 plasma modified MoS2 catalysts. We found that the degree of O-incorporation as well as the amount of MoO3 species increases with extending the plasma exposure time. MoO3 species in MoS2 is not conductive to the HER electrocatalysis. Therefore, the MoS2 O2-plasma 60 s catalyst, which possesses the highest degree of defects and moderate degree of O incorporation exhibits the highest HER activity among the O2 plasma modified MoS2 catalysts. Moreover, the MoS2 O2-plasma 60 s catalyst exhibits unfading catalytic performance after 20 h chronopotentiometry testing, manifesting the striking long-term durability on HER. More importantly, the MoS2 O2-plasma 60 s catalyst shows a holey structure after the long-term durability test due to the electro-reduction and resolution of the MoO3 species from MoS2 lattice, which provides more additional active edge sites in the MoS2 nanostructure, and thus, high HER activity and stability. Acknowledgements The authors acknowledge the financial support from the Kunming University of Science and Technology (No. KKKP201707010 and KKKP201752011) and Shenzhen Knowledge Innovation Program (Basic Research, JCYJ20160428154632404). Appendix A Supplementary material Supplementary data associated with this article can be found, in the online version, at https://doi.org/10.1016/j.jcat.2018.03.018. Appendix A Supplementary material Supplementary data 1 References [1] D. Strmcnik M. Uchimura C. Wang R. Subbaraman N. Danilovic V. van der A.P. Paulikas V.R. Stamenkovic N.M. Markovic Improving the hydrogen oxidation reaction rate by promotion of hydroxyl adsorption Nat. Chem. 5 2013 300 306 [2] Y. Jiao Y. Zheng M.T. Jaroniec S.Z. Qiao Design of electrocatalysts for oxygen- and hydrogen-involving energy conversion reactions Chem. Soc. Rev. 44 2015 2060 2086 [3] J. Hu C. Zhang X. Meng H. Lin C. Hu X. Long S. Yang Hydrogen evolution electrocatalysis with binary-nonmetal transition metal compounds J. Mater. Chem. A 5 2017 5995 6012 [4] S. Wang S.P. Jiang Prospects of fuel cell technologies Natl. Sci. Rev. 4 2017 163 166 [5] J. Hu L. Wu K.A. Kuttiyiel K.R. Goodman C. Zhang Y. Zhu M.B. Vukmirovic M.G. White K. Sasaki R.R. Adzic Increasing stability and activity of core–shell catalysts by preferential segregation of oxide on edges and vertexes: oxygen reduction on Ti–Au@Pt/C J. Am. Chem. Soc. 138 2016 9294 9300 [6] J. Hu L. Jiang C. Zhang X. Zhang Y. Meng X. Wang Enhanced Pt performance with H2O plasma modified carbon nanofiber support Appl. Phys. Lett. 104 2014 151602 [7] A.B. Laursen S. Kegnaes S. Dahl I. Chorkendorff Molybdenum sulfides-efficient and viable materials for electro- and photoelectrocatalytic hydrogen evolution Energy Environ. Sci. 5 2012 5577 5591 [8] X. Huang Z. Zeng H. Zhang Metal dichalcogenide nanosheets: preparation, properties and applications Chem. Soc. Rev. 42 2013 1934 1946 [9] H.T. Wang Z.Y. Lu S.C. Xu D.S. Kong J.J. Cha G.Y. Zheng P.C. Hsu K. Yan D. Bradshaw F.B. Prinz Y. Cui Electrochemical tuning of vertically aligned MoS2 nanofilms and its application in improving hydrogen evolution reaction Proc. Natl. Acad. Sci. USA 110 2013 19701 19706 [10] J. Hu B. Huang C. Zhang Z. Wang Y. An D. Zhou H. Lin M.K.H. Leung S. Yang Engineering stepped edge surface structures of MoS2 sheet stacks to accelerate the hydrogen evolution reaction Energy Environ. Sci. 10 2017 593 603 [11] B. Hinnemann P.G. Moses J. Bonde K.P. Jørgensen J.H. Nielsen S. Horch I. Chorkendorff J.K. Nørskov Biomimetic hydrogen evolution: MoS2 nanoparticles as catalyst for hydrogen evolution J. Am. Chem. Soc. 127 2005 5308 5309 [12] Y. Li H. Wang L. Xie Y. Liang G. Hong H. Dai MoS2 nanoparticles grown on graphene: an advanced catalyst for the hydrogen evolution reaction J. Am. Chem. Soc. 133 2011 7296 7299 [13] X.L. Zheng J.B. Xu K.Y. Yan H. Wang Z.L. Wang S.H. Yang Space-confined growth of MoS2 nanosheets within graphite: the layered hybrid of MoS2 and graphene as an active catalyst for hydrogen evolution reaction Chem. Mater. 26 2014 2344 2353 [14] C.G. Morales-Guio X. Hu Amorphous molybdenum sulfides as hydrogen evolution catalysts Acc. Chem. Res. 47 2014 2671 2681 [15] J. Kibsgaard Z. Chen B.N. Reinecke T.F. Jaramillo Engineering the surface structure of MoS2 to preferentially expose active edge sites for electrocatalysis Nat. Mater. 11 2012 963 969 [16] J. Xie H. Zhang S. Li R. Wang X. Sun M. Zhou J. Zhou X.W. Lou Y. Xie Defect-rich MoS2 ultrathin nanosheets with additional active edge sites for enhanced electrocatalytic hydrogen evolution Adv. Mater. 25 2013 5807 5813 [17] M.A. Lukowski A.S. Daniel F. Meng A. Forticaux L.S. Li S. Jin Enhanced hydrogen evolution catalysis from chemically exfoliated metallic MoS2 nanosheets J. Am. Chem. Soc. 135 2013 10274 10277 [18] D. Voiry M. Salehi R. Silva T. Fujita M.W. Chen T. Asefa V.B. Shenoy G. Eda M. Chhowalla Conducting MoS2 nanosheets as catalysts for hydrogen evolution reaction Nano Lett. 13 2013 6222 6227 [19] H. Wang Z. Lu D. Kong J. Sun T.M. Hymel Y. Cui Electrochemical tuning of MoS2 nanoparticles on three-dimensional substrate for efficient hydrogen evolution ACS Nano 8 2014 4940 4947 [20] H. Li C. Tsai A.L. Koh L.L. Cai A.W. Contryman A.H. Fragapane J.H. Zhao H.S. Han H.C. Manoharan F. Abild-Pedersen J.K. Norskov X.L. Zheng Activating and optimizing MoS2 basal planes for hydrogen evolution through the formation of strained sulphur vacancies Nat. Mater. 15 2016 48 54 [21] J.F. Xie J.J. Zhang S. Li F. Grote X.D. Zhang H. Zhang R.X. Wang Y. Lei B.C. Pan Y. Xie Controllable disorder engineering in oxygen-incorporated MoS2 ultrathin nanosheets for efficient hydrogen evolution J. Am. Chem. Soc. 135 2013 17881 17888 [22] J. Zhou G. Fang A. Pan S. Liang Oxygen-incorporated MoS2 nanosheets with expanded interlayers for hydrogen evolution reaction and pseudocapacitor applications ACS Appl. Mater. Interfaces 8 2016 33681 33689 [23] J. Guo F. Li Y. Sun X. Zhang L. Tang Oxygen-incorporated MoS2 ultrathin nanosheets grown on graphene for efficient electrochemical hydrogen evolution J. Power Sources 291 2015 195 200 [24] A. Liu L. Zhao J. Zhang L. Lin H. Wu Solvent-assisted oxygen incorporation of vertically aligned MoS2 ultrathin nanosheets decorated on reduced graphene oxide for improved electrocatalytic hydrogen evolution ACS Appl. Mater. Interfaces 8 2016 25210 25218 [25] L. Tao X. Duan C. Wang X. Duan S. Wang Plasma-engineered MoS2 thin-film as an efficient electrocatalyst for hydrogen evolution reaction Chem. Commun. 51 2015 7470 7473 [26] J. Hu C. Zhang X. Zhang L. Chen L. Jiang Y. Meng X. Wang A green approach for preparing anion exchange membrane based on cardo polyetherketone powders J. Power Sources 272 2014 211 217 [27] J. Hu C.X. Zhang L. Jiang S.D. Fang X.D. Zhang X.K. Wang Y.D. Meng Plasma graft-polymerization for synthesis of highly stable hydroxide exchange membrane J. Power Sources 248 2014 831 838 [28] R. Liu, Y. Wang, D. Liu, Y. Zou, S. Wang, Water-plasma-enabled exfoliation of ultrathin layered double hydroxide nanosheets with multivacancies for water oxidation, Adv. Mater. 29 (2017) 1701546-n/a. [29] Y. Wang Y. Zhang Z. Liu C. Xie S. Feng D. Liu M. Shao S. Wang Layered double hydroxide nanosheets with multiple vacancies obtained by dry exfoliation as highly efficient oxygen evolution electrocatalysts Angew. Chem. Int. Ed. 56 2017 5867 5871 [30] Z. Xiao Y. Wang Y.-C. Huang Z. Wei C.-L. Dong J. Ma S. Shen Y. Li S. Wang Filling the oxygen vacancies in Co3O4 with phosphorus: an ultra-efficient electrocatalyst for overall water splitting Energy Environ. Sci. 10 2017 2563 2569 [31] L. Tao C.-Y. Lin S. Dou S. Feng D. Chen D. Liu J. Huo Z. Xia S. Wang Creating coordinatively unsaturated metal sites in metal-organic-frameworks as efficient electrocatalysts for the oxygen evolution reaction: Insights into the active centers Nano Energy 41 2017 417 425 [32] Y. Wang, C. Xie, Z. Zhang, D. Liu, R. Chen, S. Wang, In situ exfoliated, n-doped, and edge-rich ultrathin layered double hydroxides nanosheets for oxygen evolution reaction, Adv. Funct. Mater. 28 (2018) 1703363-n/a. [33] S. Dou, C.-L. Dong, Z. Hu, Y.-C. Huang, J.-l. Chen, L. Tao, D. Yan, D. Chen, S. Shen, S. Chou, S. Wang, Atomic-scale CoOx species in metal–organic frameworks for oxygen evolution reaction, Adv. Funct. Mater. 27 (2017) 1702546-n/a. [34] C. Zhang J. Hu Y. Meng M. Nagatsu H. Toyoda Preparation of high-performance hydroxide exchange membrane by a novel ablation restriction plasma polymerization approach Chem. Commun. 47 2011 10230 10232 [35] M.R. Islam N. Kang U. Bhanu H.P. Paudel M. Erementchouk L. Tetard M.N. Leuenberger S.I. Khondaker Tuning the electrical property via defect engineering of single layer MoS2 by oxygen plasma Nanoscale 6 2014 10033 10039 [36] D. Kong H. Wang J.J. Cha M. Pasta K.J. Koski J. Yao Y. Cui Synthesis of MoS2 and MoSe2 films with vertically aligned layers Nano Lett. 13 2013 1341 1347 [37] M.-R. Gao, M.K.Y. Chan, Y. Sun, Edge-terminated molybdenum disulfide with a 9.4-A interlayer spacing for electrochemical hydrogen production, Nat. Common. 6 (2015) 7493–7500. [38] R. Murugan A. Ghule C. Bhongale H. Chang Thermo-Raman investigations on structural transformations in hydrated MoO J. Mater. Chem. 10 2000 2157 2162 [39] C. Yuan J. Li L. Hou X. Zhang L. Shen X.W. Lou Ultrathin mesoporous NiCo2O4 nanosheets supported on Ni foam as advanced electrodes for supercapacitors Adv. Funct. Mater. 22 2012 4592 4597 [40] V.S. Saji C.-W. Lee Molybdenum, molybdenum oxides, and their electrochemistry Chemsuschem 5 2012 1146 1161 [41] C.C.L. McCrory S. Jung I.M. Ferrer S.M. Chatman J.C. Peters T.F. Jaramillo Benchmarking hydrogen evolving reaction and oxygen evolving reaction electrocatalysts for solar water splitting devices J. Am. Chem. Soc. 137 2015 4347 4357 [42] D. Merki H. Vrubel L. Rovelli S. Fierro X. Hu Fe Co, and Ni ions promote the catalytic activity of amorphous molybdenum sulfide films for hydrogen evolution Chem. Sci. 3 2012 2515 2525 [43] D.R. Cummins U. Martinez A. Sherehiy R. Kappera A. Martinez-Garcia R.K. Schulze J. Jasinski J. Zhang R.K. Gupta J. Lou M. Chhowalla G. Sumanasekera A.D. Mohite M.K. Sunkara G. Gupta Efficient hydrogen evolution in transition metal dichalcogenides via a simple one-step hydrazine reaction Nat. Commun. 7 2016 11857 [44] G. Ye Y. Gong J. Lin B. Li Y. He S.T. Pantelides W. Zhou R. Vajtai P.M. Ajayan Defects engineered monolayer MoS2 for improved hydrogen evolution reaction Nano Lett. 16 2016 1097 1103",
      "scopus-id": "85044573066",
      "coredata": {
        "eid": "1-s2.0-S0021951718301192",
        "dc:description": "Oxygen incorporation is a promising and effective way for simultaneously engineering the edge and planar sites of MoS2 to fabricate high-performance HER electrocatalysts. However, the insulating MoO3 species are inevitably generated during the oxygen incorporation process. Here, controlled plasma exposure time has been designed to explore the influence of MoO3 species on the HER performance for the O2 plasma modified MoS2 catalysts. We find that the MoO3 species in MoS2 are not conductive to the HER electrocatalysis. More importantly, the Raman spectrum, X-ray photoelectron spectroscopy, energy-disperse X-ray spectrum and transmission electron microscope analyses demonstrate that these co-generated MoO3 species are reduced and resolved from the MoS2 lattice during the electrocatalytic hydrogen evolution, leading to a holey structure in the MoS2 nanosheets and thus a significant improvement of its hydrogen evolution stability. This work not only helps to understand the electrocatalytic influence of the co-generated MoO3 species in MoS2, but also presents a methodological improvement in designing defect-rich, oxygen incorporated and holey MoS2 nanosheets for highly efficient hydrogen evolution.",
        "openArchiveArticle": "false",
        "prism:coverDate": "2018-05-31",
        "openaccessUserLicense": null,
        "prism:aggregationType": "Journal",
        "prism:url": "https://api.elsevier.com/content/article/pii/S0021951718301192",
        "dc:creator": [
          {
            "@_fa": "true",
            "$": "Zhang, Chengxu"
          },
          {
            "@_fa": "true",
            "$": "Jiang, Lin"
          },
          {
            "@_fa": "true",
            "$": "Zhang, Yingjie"
          },
          {
            "@_fa": "true",
            "$": "Hu, Jue"
          },
          {
            "@_fa": "true",
            "$": "Leung, Michael K.H."
          }
        ],
        "link": [
          {
            "@_fa": "true",
            "@rel": "self",
            "@href": "https://api.elsevier.com/content/article/pii/S0021951718301192"
          },
          {
            "@_fa": "true",
            "@rel": "scidir",
            "@href": "https://www.sciencedirect.com/science/article/pii/S0021951718301192"
          }
        ],
        "dc:format": "application/json",
        "openaccessType": null,
        "pii": "S0021-9517(18)30119-2",
        "prism:volume": "361",
        "prism:publisher": "Elsevier Inc.",
        "dc:title": "Janus effect of O2 plasma modification on the electrocatalytic hydrogen evolution reaction of MoS2",
        "prism:copyright": "© 2018 Elsevier Inc. All rights reserved.",
        "openaccess": "0",
        "prism:issn": "00219517",
        "dcterms:subject": [
          {
            "@_fa": "true",
            "$": "Hydrogen evolution reaction"
          },
          {
            "@_fa": "true",
            "$": "MoS2"
          },
          {
            "@_fa": "true",
            "$": "Oxygen incorporation"
          },
          {
            "@_fa": "true",
            "$": "MoO3 species"
          },
          {
            "@_fa": "true",
            "$": "Janus effect"
          },
          {
            "@_fa": "true",
            "$": "Plasma modification"
          }
        ],
        "openaccessArticle": "false",
        "prism:publicationName": "Journal of Catalysis",
        "openaccessSponsorType": null,
        "prism:pageRange": "384-392",
        "prism:endingPage": "392",
        "pubType": "fla",
        "prism:coverDisplayDate": "May 2018",
        "prism:doi": "10.1016/j.jcat.2018.03.018",
        "prism:startingPage": "384",
        "dc:identifier": "doi:10.1016/j.jcat.2018.03.018",
        "openaccessSponsorName": null
      },
      "objects": {
        "object": [
          {
            "@category": "standard",
            "@height": "200",
            "@width": "459",
            "@_fa": "true",
            "$": "https://api.elsevier.com/content/object/eid/1-s2.0-S0021951718301192-fx1.jpg?httpAccept=%2A%2F%2A",
            "@multimediatype": "JPEG image file",
            "@type": "IMAGE-DOWNSAMPLED",
            "@size": "30081",
            "@ref": "fx1",
            "@mimetype": "image/jpeg"
          },
          {
            "@category": "standard",
            "@height": "494",
            "@width": "578",
            "@_fa": "true",
            "$": "https://api.elsevier.com/content/object/eid/1-s2.0-S0021951718301192-gr1.jpg?httpAccept=%2A%2F%2A",
            "@multimediatype": "JPEG image file",
            "@type": "IMAGE-DOWNSAMPLED",
            "@size": "79226",
            "@ref": "gr1",
            "@mimetype": "image/jpeg"
          },
          {
            "@category": "standard",
            "@height": "285",
            "@width": "623",
            "@_fa": "true",
            "$": "https://api.elsevier.com/content/object/eid/1-s2.0-S0021951718301192-gr10.jpg?httpAccept=%2A%2F%2A",
            "@multimediatype": "JPEG image file",
            "@type": "IMAGE-DOWNSAMPLED",
            "@size": "61337",
            "@ref": "gr10",
            "@mimetype": "image/jpeg"
          },
          {
            "@category": "standard",
            "@height": "267",
            "@width": "578",
            "@_fa": "true",
            "$": "https://api.elsevier.com/content/object/eid/1-s2.0-S0021951718301192-gr2.jpg?httpAccept=%2A%2F%2A",
            "@multimediatype": "JPEG image file",
            "@type": "IMAGE-DOWNSAMPLED",
            "@size": "59243",
            "@ref": "gr2",
            "@mimetype": "image/jpeg"
          },
          {
            "@category": "standard",
            "@height": "254",
            "@width": "310",
            "@_fa": "true",
            "$": "https://api.elsevier.com/content/object/eid/1-s2.0-S0021951718301192-gr3.jpg?httpAccept=%2A%2F%2A",
            "@multimediatype": "JPEG image file",
            "@type": "IMAGE-DOWNSAMPLED",
            "@size": "24104",
            "@ref": "gr3",
            "@mimetype": "image/jpeg"
          },
          {
            "@category": "standard",
            "@height": "248",
            "@width": "623",
            "@_fa": "true",
            "$": "https://api.elsevier.com/content/object/eid/1-s2.0-S0021951718301192-gr4.jpg?httpAccept=%2A%2F%2A",
            "@multimediatype": "JPEG image file",
            "@type": "IMAGE-DOWNSAMPLED",
            "@size": "49453",
            "@ref": "gr4",
            "@mimetype": "image/jpeg"
          },
          {
            "@category": "standard",
            "@height": "259",
            "@width": "623",
            "@_fa": "true",
            "$": "https://api.elsevier.com/content/object/eid/1-s2.0-S0021951718301192-gr5.jpg?httpAccept=%2A%2F%2A",
            "@multimediatype": "JPEG image file",
            "@type": "IMAGE-DOWNSAMPLED",
            "@size": "53221",
            "@ref": "gr5",
            "@mimetype": "image/jpeg"
          },
          {
            "@category": "standard",
            "@height": "505",
            "@width": "678",
            "@_fa": "true",
            "$": "https://api.elsevier.com/content/object/eid/1-s2.0-S0021951718301192-gr6.jpg?httpAccept=%2A%2F%2A",
            "@multimediatype": "JPEG image file",
            "@type": "IMAGE-DOWNSAMPLED",
            "@size": "85698",
            "@ref": "gr6",
            "@mimetype": "image/jpeg"
          },
          {
            "@category": "standard",
            "@height": "517",
            "@width": "689",
            "@_fa": "true",
            "$": "https://api.elsevier.com/content/object/eid/1-s2.0-S0021951718301192-gr7.jpg?httpAccept=%2A%2F%2A",
            "@multimediatype": "JPEG image file",
            "@type": "IMAGE-DOWNSAMPLED",
            "@size": "71210",
            "@ref": "gr7",
            "@mimetype": "image/jpeg"
          },
          {
            "@category": "standard",
            "@height": "268",
            "@width": "619",
            "@_fa": "true",
            "$": "https://api.elsevier.com/content/object/eid/1-s2.0-S0021951718301192-gr8.jpg?httpAccept=%2A%2F%2A",
            "@multimediatype": "JPEG image file",
            "@type": "IMAGE-DOWNSAMPLED",
            "@size": "42641",
            "@ref": "gr8",
            "@mimetype": "image/jpeg"
          },
          {
            "@category": "standard",
            "@height": "534",
            "@width": "578",
            "@_fa": "true",
            "$": "https://api.elsevier.com/content/object/eid/1-s2.0-S0021951718301192-gr9.jpg?httpAccept=%2A%2F%2A",
            "@multimediatype": "JPEG image file",
            "@type": "IMAGE-DOWNSAMPLED",
            "@size": "82684",
            "@ref": "gr9",
            "@mimetype": "image/jpeg"
          },
          {
            "@category": "thumbnail",
            "@height": "95",
            "@width": "219",
            "@_fa": "true",
            "$": "https://api.elsevier.com/content/object/eid/1-s2.0-S0021951718301192-fx1.sml?httpAccept=%2A%2F%2A",
            "@multimediatype": "GIF image file",
            "@type": "IMAGE-THUMBNAIL",
            "@size": "10741",
            "@ref": "fx1",
            "@mimetype": "image/gif"
          },
          {
            "@category": "thumbnail",
            "@height": "164",
            "@width": "192",
            "@_fa": "true",
            "$": "https://api.elsevier.com/content/object/eid/1-s2.0-S0021951718301192-gr1.sml?httpAccept=%2A%2F%2A",
            "@multimediatype": "GIF image file",
            "@type": "IMAGE-THUMBNAIL",
            "@size": "19900",
            "@ref": "gr1",
            "@mimetype": "image/gif"
          },
          {
            "@category": "thumbnail",
            "@height": "100",
            "@width": "219",
            "@_fa": "true",
            "$": "https://api.elsevier.com/content/object/eid/1-s2.0-S0021951718301192-gr10.sml?httpAccept=%2A%2F%2A",
            "@multimediatype": "GIF image file",
            "@type": "IMAGE-THUMBNAIL",
            "@size": "12670",
            "@ref": "gr10",
            "@mimetype": "image/gif"
          },
          {
            "@category": "thumbnail",
            "@height": "101",
            "@width": "219",
            "@_fa": "true",
            "$": "https://api.elsevier.com/content/object/eid/1-s2.0-S0021951718301192-gr2.sml?httpAccept=%2A%2F%2A",
            "@multimediatype": "GIF image file",
            "@type": "IMAGE-THUMBNAIL",
            "@size": "17400",
            "@ref": "gr2",
            "@mimetype": "image/gif"
          },
          {
            "@category": "thumbnail",
            "@height": "164",
            "@width": "200",
            "@_fa": "true",
            "$": "https://api.elsevier.com/content/object/eid/1-s2.0-S0021951718301192-gr3.sml?httpAccept=%2A%2F%2A",
            "@multimediatype": "GIF image file",
            "@type": "IMAGE-THUMBNAIL",
            "@size": "10699",
            "@ref": "gr3",
            "@mimetype": "image/gif"
          },
          {
            "@category": "thumbnail",
            "@height": "87",
            "@width": "219",
            "@_fa": "true",
            "$": "https://api.elsevier.com/content/object/eid/1-s2.0-S0021951718301192-gr4.sml?httpAccept=%2A%2F%2A",
            "@multimediatype": "GIF image file",
            "@type": "IMAGE-THUMBNAIL",
            "@size": "7417",
            "@ref": "gr4",
            "@mimetype": "image/gif"
          },
          {
            "@category": "thumbnail",
            "@height": "91",
            "@width": "219",
            "@_fa": "true",
            "$": "https://api.elsevier.com/content/object/eid/1-s2.0-S0021951718301192-gr5.sml?httpAccept=%2A%2F%2A",
            "@multimediatype": "GIF image file",
            "@type": "IMAGE-THUMBNAIL",
            "@size": "7425",
            "@ref": "gr5",
            "@mimetype": "image/gif"
          },
          {
            "@category": "thumbnail",
            "@height": "163",
            "@width": "219",
            "@_fa": "true",
            "$": "https://api.elsevier.com/content/object/eid/1-s2.0-S0021951718301192-gr6.sml?httpAccept=%2A%2F%2A",
            "@multimediatype": "GIF image file",
            "@type": "IMAGE-THUMBNAIL",
            "@size": "10383",
            "@ref": "gr6",
            "@mimetype": "image/gif"
          },
          {
            "@category": "thumbnail",
            "@height": "164",
            "@width": "218",
            "@_fa": "true",
            "$": "https://api.elsevier.com/content/object/eid/1-s2.0-S0021951718301192-gr7.sml?httpAccept=%2A%2F%2A",
            "@multimediatype": "GIF image file",
            "@type": "IMAGE-THUMBNAIL",
            "@size": "9450",
            "@ref": "gr7",
            "@mimetype": "image/gif"
          },
          {
            "@category": "thumbnail",
            "@height": "95",
            "@width": "219",
            "@_fa": "true",
            "$": "https://api.elsevier.com/content/object/eid/1-s2.0-S0021951718301192-gr8.sml?httpAccept=%2A%2F%2A",
            "@multimediatype": "GIF image file",
            "@type": "IMAGE-THUMBNAIL",
            "@size": "6646",
            "@ref": "gr8",
            "@mimetype": "image/gif"
          },
          {
            "@category": "thumbnail",
            "@height": "164",
            "@width": "177",
            "@_fa": "true",
            "$": "https://api.elsevier.com/content/object/eid/1-s2.0-S0021951718301192-gr9.sml?httpAccept=%2A%2F%2A",
            "@multimediatype": "GIF image file",
            "@type": "IMAGE-THUMBNAIL",
            "@size": "18691",
            "@ref": "gr9",
            "@mimetype": "image/gif"
          },
          {
            "@category": "high",
            "@height": "531",
            "@width": "1221",
            "@_fa": "true",
            "$": "https://api.elsevier.com/content/object/eid/1-s2.0-S0021951718301192-fx1_lrg.jpg?httpAccept=%2A%2F%2A",
            "@multimediatype": "JPEG image file",
            "@type": "IMAGE-HIGH-RES",
            "@size": "129036",
            "@ref": "fx1",
            "@mimetype": "image/jpeg"
          },
          {
            "@category": "high",
            "@height": "1312",
            "@width": "1535",
            "@_fa": "true",
            "$": "https://api.elsevier.com/content/object/eid/1-s2.0-S0021951718301192-gr1_lrg.jpg?httpAccept=%2A%2F%2A",
            "@multimediatype": "JPEG image file",
            "@type": "IMAGE-HIGH-RES",
            "@size": "239583",
            "@ref": "gr1",
            "@mimetype": "image/jpeg"
          },
          {
            "@category": "high",
            "@height": "756",
            "@width": "1654",
            "@_fa": "true",
            "$": "https://api.elsevier.com/content/object/eid/1-s2.0-S0021951718301192-gr10_lrg.jpg?httpAccept=%2A%2F%2A",
            "@multimediatype": "JPEG image file",
            "@type": "IMAGE-HIGH-RES",
            "@size": "215252",
            "@ref": "gr10",
            "@mimetype": "image/jpeg"
          },
          {
            "@category": "high",
            "@height": "710",
            "@width": "1535",
            "@_fa": "true",
            "$": "https://api.elsevier.com/content/object/eid/1-s2.0-S0021951718301192-gr2_lrg.jpg?httpAccept=%2A%2F%2A",
            "@multimediatype": "JPEG image file",
            "@type": "IMAGE-HIGH-RES",
            "@size": "231248",
            "@ref": "gr2",
            "@mimetype": "image/jpeg"
          },
          {
            "@category": "high",
            "@height": "675",
            "@width": "824",
            "@_fa": "true",
            "$": "https://api.elsevier.com/content/object/eid/1-s2.0-S0021951718301192-gr3_lrg.jpg?httpAccept=%2A%2F%2A",
            "@multimediatype": "JPEG image file",
            "@type": "IMAGE-HIGH-RES",
            "@size": "86345",
            "@ref": "gr3",
            "@mimetype": "image/jpeg"
          },
          {
            "@category": "high",
            "@height": "660",
            "@width": "1655",
            "@_fa": "true",
            "$": "https://api.elsevier.com/content/object/eid/1-s2.0-S0021951718301192-gr4_lrg.jpg?httpAccept=%2A%2F%2A",
            "@multimediatype": "JPEG image file",
            "@type": "IMAGE-HIGH-RES",
            "@size": "161316",
            "@ref": "gr4",
            "@mimetype": "image/jpeg"
          },
          {
            "@category": "high",
            "@height": "688",
            "@width": "1654",
            "@_fa": "true",
            "$": "https://api.elsevier.com/content/object/eid/1-s2.0-S0021951718301192-gr5_lrg.jpg?httpAccept=%2A%2F%2A",
            "@multimediatype": "JPEG image file",
            "@type": "IMAGE-HIGH-RES",
            "@size": "164426",
            "@ref": "gr5",
            "@mimetype": "image/jpeg"
          },
          {
            "@category": "high",
            "@height": "1429",
            "@width": "1920",
            "@_fa": "true",
            "$": "https://api.elsevier.com/content/object/eid/1-s2.0-S0021951718301192-gr6_lrg.jpg?httpAccept=%2A%2F%2A",
            "@multimediatype": "JPEG image file",
            "@type": "IMAGE-HIGH-RES",
            "@size": "282371",
            "@ref": "gr6",
            "@mimetype": "image/jpeg"
          },
          {
            "@category": "high",
            "@height": "1373",
            "@width": "1830",
            "@_fa": "true",
            "$": "https://api.elsevier.com/content/object/eid/1-s2.0-S0021951718301192-gr7_lrg.jpg?httpAccept=%2A%2F%2A",
            "@multimediatype": "JPEG image file",
            "@type": "IMAGE-HIGH-RES",
            "@size": "212537",
            "@ref": "gr7",
            "@mimetype": "image/jpeg"
          },
          {
            "@category": "high",
            "@height": "713",
            "@width": "1645",
            "@_fa": "true",
            "$": "https://api.elsevier.com/content/object/eid/1-s2.0-S0021951718301192-gr8_lrg.jpg?httpAccept=%2A%2F%2A",
            "@multimediatype": "JPEG image file",
            "@type": "IMAGE-HIGH-RES",
            "@size": "134052",
            "@ref": "gr8",
            "@mimetype": "image/jpeg"
          },
          {
            "@category": "high",
            "@height": "1418",
            "@width": "1535",
            "@_fa": "true",
            "$": "https://api.elsevier.com/content/object/eid/1-s2.0-S0021951718301192-gr9_lrg.jpg?httpAccept=%2A%2F%2A",
            "@multimediatype": "JPEG image file",
            "@type": "IMAGE-HIGH-RES",
            "@size": "252423",
            "@ref": "gr9",
            "@mimetype": "image/jpeg"
          },
          {
            "@category": "standard",
            "@_fa": "true",
            "$": "https://api.elsevier.com/content/object/eid/1-s2.0-S0021951718301192-mmc1.docx?httpAccept=%2A%2F%2A",
            "@multimediatype": "Microsoft Word file",
            "@type": "APPLICATION",
            "@size": "7335569",
            "@ref": "mmc1",
            "@mimetype": "application/word"
          }
        ]
      },
      "link": {
        "@rel": "abstract",
        "@href": "https://api.elsevier.com/content/abstract/scopus_id/85044573066"
      }
    }
  }
}