{
  "metadata": {
    "title": "Performance of supported Co<ce:inf loc=post>3</ce:inf>O<ce:inf loc=post>4</ce:inf> catalysts in the preferential oxidation of carbon monoxide: Effect of support type and synthesis method",
    "authors": "; ; ",
    "journal": "Journal of Catalysis",
    "date": "2025-02-28",
    "doi": "10.1016/j.jcat.2024.115777",
    "abstract": "",
    "uri": "https://api.elsevier.com/content/article/pii/S0021951724004901",
    "pii": "S0021951724004901"
  },
  "fulltext": {
    "full-text-retrieval-response": {
      "scopus-eid": "2-s2.0-85205464098",
      "originalText": "serial JL 272561 291210 291744 291809 31 Journal of Catalysis JOURNALCATALYSIS 2024-09-26 2024-09-26 2025-01-10 2025-01-10 2025-01-10T20:44:47 1-s2.0-S0021951724004901 S0021-9517(24)00490-1 S0021951724004901 10.1016/j.jcat.2024.115777 S300 S300.1 FULL-TEXT 1-s2.0-S0021951724X00147 2025-01-10T21:30:12.918748Z 0 0 20250201 20250228 2025 2024-09-26T17:29:00.532729Z absattachment articleinfo articlenumber articletitlenorm authfirstinitialnorm authfirstsurnamenorm cid cids contenttype copyright crossmark dateloaded dateloadedtxt datesearch datesort dateupdated dco docsubtype doctype doi eid ewtransactionid hubeid indexeddate issn issnnorm itemstage itemtransactionid itemweight openaccess openarchive pg pgfirst pii piinorm pubdateend pubdatestart pubdatetxt pubyr sectiontitle sortorder srctitle srctitlenorm srctype ssids alllist content subj subheadings suppl tomb volfirst volissue volumelist webpdf webpdfpagecount yearnav figure table e-component body mmlmath acknowledge affil appendices articletitle auth authfirstini authfull authkeywords authlast grantnumber grantsponsor grantsponsorid highlightsabst orcid primabst pubtype ref specialabst 0021-9517 00219517 true 442 442 C Volume 442 59 115777 115777 115777 202502 February 2025 2025-02-01 2025-02-28 2025 Regular Articles article fla © 2024 Published by Elsevier Inc. PERFORMANCESUPPORTEDCO3O4CATALYSTSINPREFERENTIALOXIDATIONCARBONMONOXIDEEFFECTSUPPORTTYPESYNTHESISMETHOD FADLALLA M 1 Introduction 2 Materials and methods 2.1 Catalyst synthesis 2.2 Catalyst characterisation 2.2.1 Ex situ characterisation 2.2.2 In situ XRD-based reduction under hydrogen 2.3 Catalyst evaluation 3 Results and discussion 3.1 Catalyst characterisation 3.2 Catalyst evaluation 4 Summary and conclusion CRediT authorship contribution statement Acknowledgements Appendix A Supplementary data References CHOUDHARY 2002 65 78 T NYATHI 2020 11892 11911 T MISHRA 2011 1 14 A QWABE 2015 167 177 L QWABE 2019 102827 102838 L FIORENZA 2018 203 221 R FIUZA 2020 923 934 T MOHAMED 2016 687 697 Z CHAGAS 2016 139 145 C CAO 2020 S LI 2021 29940 29950 X ZLOTEA 2018 1059 1065 C NYATHI 2024 e202400285 T CHAGAS 2022 8858 8866 C FADLALLA 2022 118 130 M QWABE 2016 2144 2153 L BEJAOUI 2021 15 M CHAGAS 2016 257 265 C KHASU 2017 4806 4817 M NYATHI 2021 120450 120471 T NYATHI 2019 7166 7178 T DONGIL 2016 6118 6127 A WANG 2006 223 230 C ZHAO 2008 1465 1471 Z WANG 2005 59 63 C BARBATO 2016 13039 13048 P NYATHI 2017 269 285 T REUEL 1984 78 88 R GIRARDON 2005 339 352 J FISCHER 2012 830 837 N AYASTUY 2016 19546 19555 J MIRANDACRUZ 2019 272 278 A PATIL 2002 507 512 K PATIL 1997 158 165 K ARUNA 2008 44 50 S VARMA 2016 14493 14586 A PUROHIT 2001 2711 2721 R MARINSEK 2002 178 188 M AVGOUROPOULOS 2003 155 167 G GURBANI 2010 11582 11590 A YANG 2009 458 466 W SEDMAK 2003 135 150 G RIETVELD 1969 65 71 H COELHO 2003 86 95 A DENT 2009 012039 A RAVEL 2005 537 541 B NEWVILLE 2001 322 324 M FISCHER 2011 174 179 N WOLF 2018 305 312 M KARMAOUI 2013 4277 4283 M WOLF 2019 13858 13868 M FISCHER 2016 149 154 N FAURGHENCIU 2002 389 399 A VANSTEEN 2005 3575 3577 E JACOBS 2007 177 191 G POLSTER 2009 308 319 C MURUGAN 2005 3983 3993 B LABUSCHAGNE 2016 2 10 J WOLF 2017 243 268 M LUKASHUK 2016 1 15 L FISCHER 2020 293001 N SLAWINSKI 2018 2316 2325 W KLUGMANN 1994 803 813 E RAM 2001 923 927 S DUCREUX 2009 49 62 O DUPLESSIS 2016 30183 30188 H PRICE 2017 e1602838 e1602848 S MARS 1954 41 59 P PERTI 1985 1435 1440 D IABLOKOV 2015 5714 5718 V LUKASHUK 2018 8630 8641 L LIU 2013 16284 16287 J FADLALLAX2025X115777 FADLALLAX2025X115777XM 2027-01-10T00:00:00.000Z 2027-01-10T00:00:00.000Z http://creativecommons.org/licenses/by-nc-nd/4.0/ © 2024 Published by Elsevier Inc. 2024-10-23T00:46:35.512Z http://vtw.elsevier.com/data/voc/AddOnTypes/50.7/aggregated-refined National Research Foundation 129833 NRF National Research Foundation http://data.elsevier.com/vocabulary/SciValFunders/501100001321 http://sws.geonames.org/953987/ UCT-based Analytical Laboratory BAG2021-024 DSI-NRF Science and Technology Facilities Council ST/R002754/1 STFC Science and Technology Facilities Council http://data.elsevier.com/vocabulary/SciValFunders/501100000271 http://sws.geonames.org/2635167/ The authors are grateful for the financial support from the DSI-NRF Centre of Excellence in Catalysis (c*change), Science and Technology Facilities Council (STFC) via the Global Challenges Research Fund - Synchrotron Techniques for African Research and Technology (GCRF-START, grant number: ST/R002754/1), and the National Research Foundation - Thuthuka programme (grant number: 129833). Furthermore, the authors thank the UCT-based Analytical Laboratory team for the N2 physisorption and ICP-OES analyses, as well as Diamond Light Source for granting beamtime access to perform ex situ XAS analyses on beamline B18 (session BAG2021-024). https://doi.org/10.15223/policy-017 https://doi.org/10.15223/policy-037 https://doi.org/10.15223/policy-012 https://doi.org/10.15223/policy-029 https://doi.org/10.15223/policy-004 item S0021-9517(24)00490-1 S0021951724004901 1-s2.0-S0021951724004901 10.1016/j.jcat.2024.115777 272561 2025-01-10T21:03:22.356565Z 2025-02-01 2025-02-28 1-s2.0-S0021951724004901-main.pdf https://s3-eu-west-1.amazonaws.com/prod-ucs-content-store-eu-west/content/pii:S0021951724004901/MAIN/application/pdf/a0ce5691b147298c567d0b84192a3643/main.pdf main.pdf pdf true 7904697 MAIN 14 1-s2.0-S0021951724004901-main_1.png https://s3-eu-west-1.amazonaws.com/prod-ucs-content-store-eu-west/content/pii:S0021951724004901/PREVIEW/image/png/34811957386855fce9df8a5f951e2415/main_1.png main_1.png png 59280 849 656 IMAGE-WEB-PDF 1 1-s2.0-S0021951724004901-gr7.jpg https://s3-eu-west-1.amazonaws.com/prod-ucs-content-store-eu-west/content/pii:S0021951724004901/gr7/DOWNSAMPLED/image/jpeg/77c4fc8e1a8e8bff140e55b3fed9e1f6/gr7.jpg gr7 gr7.jpg jpg 135799 747 680 IMAGE-DOWNSAMPLED 1-s2.0-S0021951724004901-gr5.jpg https://s3-eu-west-1.amazonaws.com/prod-ucs-content-store-eu-west/content/pii:S0021951724004901/gr5/DOWNSAMPLED/image/jpeg/d14c80d3ea960d1401a6cb8ad929c04b/gr5.jpg gr5 gr5.jpg jpg 138262 828 695 IMAGE-DOWNSAMPLED 1-s2.0-S0021951724004901-gr6.jpg https://s3-eu-west-1.amazonaws.com/prod-ucs-content-store-eu-west/content/pii:S0021951724004901/gr6/DOWNSAMPLED/image/jpeg/22863814ff5d928ea74f666043f5e7ef/gr6.jpg gr6 gr6.jpg jpg 148256 802 673 IMAGE-DOWNSAMPLED 1-s2.0-S0021951724004901-gr3.jpg https://s3-eu-west-1.amazonaws.com/prod-ucs-content-store-eu-west/content/pii:S0021951724004901/gr3/DOWNSAMPLED/image/jpeg/b05f66fe5ce6e76d2d16d970bb8acb5e/gr3.jpg gr3 gr3.jpg jpg 85946 775 535 IMAGE-DOWNSAMPLED 1-s2.0-S0021951724004901-gr4.jpg https://s3-eu-west-1.amazonaws.com/prod-ucs-content-store-eu-west/content/pii:S0021951724004901/gr4/DOWNSAMPLED/image/jpeg/c6c57112208b8a147057c10616c1a49c/gr4.jpg gr4 gr4.jpg jpg 82115 728 535 IMAGE-DOWNSAMPLED 1-s2.0-S0021951724004901-gr1.jpg https://s3-eu-west-1.amazonaws.com/prod-ucs-content-store-eu-west/content/pii:S0021951724004901/gr1/DOWNSAMPLED/image/jpeg/941866d4e02e138c942136993b76042f/gr1.jpg gr1 gr1.jpg jpg 45516 462 535 IMAGE-DOWNSAMPLED 1-s2.0-S0021951724004901-gr2.jpg https://s3-eu-west-1.amazonaws.com/prod-ucs-content-store-eu-west/content/pii:S0021951724004901/gr2/DOWNSAMPLED/image/jpeg/968d4128afa35c9fec8ce569b1d28076/gr2.jpg gr2 gr2.jpg jpg 49644 468 535 IMAGE-DOWNSAMPLED 1-s2.0-S0021951724004901-ga1.jpg https://s3-eu-west-1.amazonaws.com/prod-ucs-content-store-eu-west/content/pii:S0021951724004901/ga1/DOWNSAMPLED/image/jpeg/dc41eb3ab10647fecac5386b96f9fab7/ga1.jpg ga1 true ga1.jpg jpg 24402 200 443 IMAGE-DOWNSAMPLED 1-s2.0-S0021951724004901-gr7.sml https://s3-eu-west-1.amazonaws.com/prod-ucs-content-store-eu-west/content/pii:S0021951724004901/gr7/THUMBNAIL/image/gif/6f91258a3e3f635e80c39d31b3a19f6a/gr7.sml gr7 gr7.sml sml 10185 164 149 IMAGE-THUMBNAIL 1-s2.0-S0021951724004901-gr5.sml https://s3-eu-west-1.amazonaws.com/prod-ucs-content-store-eu-west/content/pii:S0021951724004901/gr5/THUMBNAIL/image/gif/ed38a194226ba8c5d894be564b683520/gr5.sml gr5 gr5.sml sml 9949 163 137 IMAGE-THUMBNAIL 1-s2.0-S0021951724004901-gr6.sml https://s3-eu-west-1.amazonaws.com/prod-ucs-content-store-eu-west/content/pii:S0021951724004901/gr6/THUMBNAIL/image/gif/b0eea124a8146e9d87b366ef08d9e90b/gr6.sml gr6 gr6.sml sml 10303 163 137 IMAGE-THUMBNAIL 1-s2.0-S0021951724004901-gr3.sml https://s3-eu-west-1.amazonaws.com/prod-ucs-content-store-eu-west/content/pii:S0021951724004901/gr3/THUMBNAIL/image/gif/d950fb3c247cdae7c0b6a9e1d75a8a49/gr3.sml gr3 gr3.sml sml 7390 164 113 IMAGE-THUMBNAIL 1-s2.0-S0021951724004901-gr4.sml https://s3-eu-west-1.amazonaws.com/prod-ucs-content-store-eu-west/content/pii:S0021951724004901/gr4/THUMBNAIL/image/gif/2628c7a0e50be1d6620d7be983c980e0/gr4.sml gr4 gr4.sml sml 7470 163 120 IMAGE-THUMBNAIL 1-s2.0-S0021951724004901-gr1.sml https://s3-eu-west-1.amazonaws.com/prod-ucs-content-store-eu-west/content/pii:S0021951724004901/gr1/THUMBNAIL/image/gif/e638e72863d595cd778f1756bee58978/gr1.sml gr1 gr1.sml sml 7862 164 190 IMAGE-THUMBNAIL 1-s2.0-S0021951724004901-gr2.sml https://s3-eu-west-1.amazonaws.com/prod-ucs-content-store-eu-west/content/pii:S0021951724006171/gr2/THUMBNAIL/image/gif/e722a06cc53cdace8d566200e1c5b66f/gr2.sml gr2 gr2.sml sml 8061 164 187 IMAGE-THUMBNAIL 1-s2.0-S0021951724004901-ga1.sml https://s3-eu-west-1.amazonaws.com/prod-ucs-content-store-eu-west/content/pii:S0021951724006171/ga1/THUMBNAIL/image/gif/4e66bc613346ec8561ff8b55cf2c710f/ga1.sml ga1 true ga1.sml sml 7996 99 219 IMAGE-THUMBNAIL 1-s2.0-S0021951724004901-gr7_lrg.jpg https://s3-eu-west-1.amazonaws.com/prod-ucs-content-store-eu-west/content/pii:S0021951724004901/HIGHRES/image/jpeg/719e01dc76eec55e3d4fd7dd6d5bd9f1/gr7_lrg.jpg gr7 gr7_lrg.jpg jpg 689234 3305 3009 IMAGE-HIGH-RES 1-s2.0-S0021951724004901-gr5_lrg.jpg https://s3-eu-west-1.amazonaws.com/prod-ucs-content-store-eu-west/content/pii:S0021951724004901/HIGHRES/image/jpeg/02f4ac56f3096a0ad7a14259609753c8/gr5_lrg.jpg gr5 gr5_lrg.jpg jpg 778994 3663 3076 IMAGE-HIGH-RES 1-s2.0-S0021951724004901-gr6_lrg.jpg https://s3-eu-west-1.amazonaws.com/prod-ucs-content-store-eu-west/content/pii:S0021951724004901/HIGHRES/image/jpeg/34491f116aeb2a79f07d18d0d8892527/gr6_lrg.jpg gr6 gr6_lrg.jpg jpg 819200 3549 2979 IMAGE-HIGH-RES 1-s2.0-S0021951724004901-gr3_lrg.jpg https://s3-eu-west-1.amazonaws.com/prod-ucs-content-store-eu-west/content/pii:S0021951724004901/HIGHRES/image/jpeg/f7706da996584b80475f0b6c079bb6af/gr3_lrg.jpg gr3 gr3_lrg.jpg jpg 434916 3432 2368 IMAGE-HIGH-RES 1-s2.0-S0021951724004901-gr4_lrg.jpg https://s3-eu-west-1.amazonaws.com/prod-ucs-content-store-eu-west/content/pii:S0021951724004901/HIGHRES/image/jpeg/4c5358e2d76e1d4cacf8bf2f90fcb6e9/gr4_lrg.jpg gr4 gr4_lrg.jpg jpg 425974 3221 2368 IMAGE-HIGH-RES 1-s2.0-S0021951724004901-gr1_lrg.jpg https://s3-eu-west-1.amazonaws.com/prod-ucs-content-store-eu-west/content/pii:S0021951724006171/HIGHRES/image/jpeg/c03445f6f4347eef8860a31f672cc765/gr1_lrg.jpg gr1 gr1_lrg.jpg jpg 237272 2044 2368 IMAGE-HIGH-RES 1-s2.0-S0021951724004901-gr2_lrg.jpg https://s3-eu-west-1.amazonaws.com/prod-ucs-content-store-eu-west/content/pii:S0021951724006171/HIGHRES/image/jpeg/0be76e4884df84a9afc6f22f648261b3/gr2_lrg.jpg gr2 gr2_lrg.jpg jpg 258580 2072 2368 IMAGE-HIGH-RES 1-s2.0-S0021951724004901-ga1_lrg.jpg https://s3-eu-west-1.amazonaws.com/prod-ucs-content-store-eu-west/content/pii:S0021951724006171/HIGHRES/image/jpeg/07e634e67c474fe55af28f252c6b17fb/ga1_lrg.jpg ga1 true ga1_lrg.jpg jpg 195009 886 1963 IMAGE-HIGH-RES 1-s2.0-S0021951724004901-mmc1.docx https://s3-eu-west-1.amazonaws.com/prod-ucs-content-store-eu-west/content/pii:S0021951724004901/mmc1/MAIN/application/vnd.openxmlformats-officedocument.wordprocessingml.document/b2fe4c212e77066c4a6f5fa107dc8e83/mmc1.docx mmc1 mmc1.docx docx 966978 APPLICATION 1-s2.0-S0021951724004901-si1.svg https://s3-eu-west-1.amazonaws.com/prod-ucs-content-store-eu-west/content/pii:S0021951724004901/image/svg+xml/33c727905365a573de67e9ee1b91d366/si1.svg si1 si1.svg svg 27694 ALTIMG 1-s2.0-S0021951724004901-si2.svg https://s3-eu-west-1.amazonaws.com/prod-ucs-content-store-eu-west/content/pii:S0021951724004901/image/svg+xml/f6a9d6f395ed0b2a002c7f55b4d3843d/si2.svg si2 si2.svg svg 25125 ALTIMG 1-s2.0-S0021951724004901-si3.svg https://s3-eu-west-1.amazonaws.com/prod-ucs-content-store-eu-west/content/pii:S0021951724004901/image/svg+xml/3c06ed0ab3af7332761dd7485d669200/si3.svg si3 si3.svg svg 27759 ALTIMG YJCAT 115777 115777 S0021-9517(24)00490-1 10.1016/j.jcat.2024.115777 Fig. 1 XRD patterns of the fresh Co3O4/Al2O3_WI, Co3O4/SiC_WI, Co3O4/Al2O3_SCS, and Co3O4/SiC_SCS catalysts acquired before conducting CO-PrOx. Also included is the reference pattern for Co3O4 (ICDD card number 01–073-1701). Refer to Figures S1 and S2 for the Rietveld refinement results and the recorded patterns for the bare supports plotted with reference patterns, respectively. Fig. 2 XRD patterns of the spent Co3O4/Al2O3_WI, Co3O4/SiC_WI, Co3O4/Al2O3_SCS, and Co3O4/SiC_SCS catalysts acquired after conducting CO-PrOx. Also included are the reference patterns for Co3O4, CoO, and fcc Co0 obtained from ICDD card numbers 01–073-1701, 00–043-1004, and 00–015-0806, respectively. Refer to Figures S3 for the Rietveld refinement results. Fig. 3 First derivative XANES spectra of the reference samples Co3O4, CoO, CoAl2O4, and Co metal foil (a), first derivative XANES spectra of the fresh (b), Co3O4/Al2O3_WI, (c) Co3O4/Al2O3_SCS, (d) Co3O4/SiC_WI, and (e) Co3O4/SiC_SCS catalysts acquired before conducting CO-PrOx. Included in (b) – (e) are the LCF results and reference spectra used, which have been scaled according to their contribution to the LCF. Fig. 4 First derivative XANES spectra of the reference samples Co3O4, CoO, CoAl2O4, and Co metal foil (a), first derivative XANES spectra of the spent (b) Co3O4/Al2O3_WI, (c) Co3O4/Al2O3_SCS, (d) Co3O4/SiC_WI, and (e) Co3O4/SiC_SCS catalysts acquired after conducting CO-PrOx. Included in (b) – (e) are the LCF results and reference spectra used, which have been scaled according to their contribution to the LCF. Fig. 5 Effect of the synthesis method (WI vs. SCS) on the ((a) and (b)) reduction pathway of Co3O4/Al2O3 and the (c) crystallite sizes of the Co-based phases formed during reduction in H2, as determined via in situ XRD analysis. Fig. 6 Effect of the synthesis method (WI vs. SCS) on the ((a) and (b)) reduction pathway of Co3O4/SiC and the (c) crystallite sizes of the Co-based phases formed during reduction in H2, as determined via in situ XRD analysis. Fig. 7 Effects of the synthesis method (WI vs. SCS) and support nature (Al2O3 vs. SiC) on the CO-PrOx performance of Co3O4 in the temperature range of 50–––250 °C and feed composition of 1 % CO, 1 % O2, 50 % H2, and 48 % N2 at atmospheric pressure. (a) CO conversion, (b) O2 conversion, (c) H2 conversion, (d) CO2 yield, (e) CH4 yield, (f) O2 selectivity to CO2. Table 1 BET surface areas and ICP-OES-derived Co loadings of the prepared supported catalysts. The BET surface areas of the bare supports have also been included for comparison. Sample name ICP-OES-derived Co loading (wt.-%) BET surface area (m2/g) Al2O3 n.a. 150.0 SiC n.a. 27.9 Co3O4/Al2O3_WI 15.9 140.3 Co3O4/Al2O3_SCS 15.6 194.1 Co3O4/SiC_WI 17.6 28.9 Co3O4/SiC_SCS 19.4 28.9 Table 2 Relative weight fractions (and associated errors) of the Co-based phases (reported on a Co basis) present in the fresh and spent catalysts as determined using Rietveld refinement. Sample name Co3O4 (wt.-%) CoO (wt.-%) fcc Co (wt.-%) Rwp (%) Co3O4/Al2O3_WI-fresh 100.0 − − 5.0 Co3O4/Al2O3_SCS-fresh 100.0 − − 4.2 Co3O4/SiC_WI-fresh 100.0 − − 5.0 Co3O4/SiC_SCS-fresh 100.0 − − 5.3 Co3O4/Al2O3_WI-spent 68.9 ± 1.1 31.1 ± 1.1 − 4.5 Co3O4/Al2O3_SCS-spent 85.3 ± 2.3 14.7 ± 1.1 − 3.8 Co3O4/SiC_WI-spent − 65.7 ± 5.7 34.3 ± 4.3 6.6 Co3O4/SiC_SCS-spent − 93.4 ± 1.8 6.6 ± 1.7 5.2 Table 3 Crystallite sizes (and associated errors) of the Co-based phases present in the fresh and spent catalysts as determined using Rietveld refinement. Sample name Co3O4 (nm) CoO (nm) fcc Co (nm) Rwp (%) Co3O4/Al2O3_WI-fresh 14.4 ± 0.2 − − 5.0 Co3O4/Al2O3_SCS-fresh 6.7 ± 1.0 − − 4.2 Co3O4/SiC_WI-fresh 29.8 ± 0.5 − − 5.0 Co3O4/SiC_SCS-fresh 19.5 ± 0.4 − − 5.3 Co3O4/Al2O3_WI-spent 7.1 ± 0.2 8.7 ± 0.4 − 4.5 Co3O4/Al2O3_SCS-spent 5.6 ± 1.3 6.3 ± 0.6 − 3.8 Co3O4/SiC_WI-spent − 12.8 ± 1.5 12.0 ± 0.2 6.6 Co3O4/SiC_SCS-spent − 13.2 ± 0.4 11.0 ± 0.4 5.2 Table 4 Relative fraction of Co species (reported on a Co basis) in the fresh and spent catalysts as determined via linear combination fitting. Relative fractions that are below 100% have an associated error. Sample name Co3O4 (%) CoO (%) Co0 (%) CoxMyOz * (%) R-factor (−) Co3O4/Al2O3_WI-fresh 90.8 ± 0.9 − − 9.2 ± 0.6 0.015 Co3O4/Al2O3_SCS-fresh 89.0 ± 0.7 − − 11.0 ± 0.4 0.007 Co3O4/SiC_WI-fresh 100.0 − − − 0.004 Co3O4/SiC_SCS-fresh 100.0 − − − 0.005 Co3O4/Al2O3_WI-spent 34.0 ± 0.4 47.2 ± 3.3 9.8 ± 0.4 9.0 ± 0.4 0.004 Co3O4/Al2O3_SCS-spent 65.5 ± 0.6 18.9 ± 5.7 3.0 ± 0.6 12.5 ± 0.5 0.008 Co3O4/SiC_WI-spent 6.5 ± 0.5 48.2 ± 2.3 45.4 ± 0.5 − 0.007 Co3O4/SiC_SCS-spent − 85.9 ± 0.5 14.1 ± 1.0 − 0.010 * M = Al or Si. Research article Performance of supported Co3O4 catalysts in the preferential oxidation of carbon monoxide: Effect of support type and synthesis method Mohamed I. Fadlalla Writing – original draft Visualization Methodology Funding acquisition Formal analysis Conceptualization a ⁎ Thulani M. Nyathi Writing – original draft Visualization Methodology Formal analysis Conceptualization a Majid D. Farahani Writing – original draft Methodology b c Ying Zheng Writing – review & editing Conceptualization c Peter P. Wells d e f Holger B. Friedrich Writing – review & editing Funding acquisition Conceptualization b Michael Claeys Writing – review & editing Supervision Funding acquisition Conceptualization a ⁎ a Catalysis Institute, Department of Chemical Engineering, University of Cape Town, Rondebosch 7700, Cape Town, South Africa Catalysis Institute Department of Chemical Engineering University of Cape Town Rondebosch 7700 Cape Town South Africa Catalysis Institute, Department of Chemical Engineering, University of Cape Town, Rondebosch 7700, Cape Town, South Africa b School of Chemistry and Physics, University of KwaZulu-Natal, Private Bag X54001, Durban 4000, South Africa School of Chemistry and Physics University of KwaZulu-Natal Private Bag X54001 Durban 4000 South Africa School of Chemistry and Physics, University of KwaZulu-Natal, Private Bag X54001, Durban 4000, South Africa c Department of Chemical and Biochemical Engineering, Western University, 1150 Richmond Street, London, ON N6A 3K7, Canada Department of Chemical and Biochemical Engineering Western University 1150 Richmond Street London ON N6A 3K7 Canada Department of Chemical and Biochemical Engineering, Western University, 1150 Richmond Street, London, ON N6A 3K7, Canada d UK Catalysis Hub, Research Complex at Harwell, Rutherford Appleton Laboratory, Harwell, Oxon OX11 0FA, United Kingdom UK Catalysis Hub Research Complex at Harwell Rutherford Appleton Laboratory, Harwell Oxon OX11 0FA United Kingdom UK Catalysis Hub, Research Complex at Harwell, Rutherford Appleton Laboratory, Harwell, Oxon OX11 0FA, United Kingdom e School of Chemistry, University of Southampton, University Road, Southampton SO17 1BJ, United Kingdom School of Chemistry University of Southampton University Road Southampton SO17 1BJ United Kingdom School of Chemistry, University of Southampton, University Road, Southampton SO17 1BJ, United Kingdom f Diamond Light Source Ltd., Harwell Science and Innovation Campus, Chilton, Didcot OX11 0DE, United Kingdom Diamond Light Source Ltd. Harwell Science and Innovation Campus Chilton Didcot OX11 0DE United Kingdom Diamond Light Source Ltd., Harwell Science and Innovation Campus, Chilton, Didcot OX11 0DE, United Kingdom ⁎ Corresponding authors. Graphical abstract This study investigated the performance of supported Co3O4 catalysts during the preferential oxidation of carbon monoxide (CO-PrOx) in a H2-rich environment, focusing on the effects of different catalyst synthesis methods, namely, wetness impregnation (WI) and solution combustion synthesis (SCS), and different support materials, namely, Al2O3 and SiC. During CO-PrOx, the SiC-supported Co3O4 catalysts attained higher CO2 yields when compared with the Al2O3-supported Co3O4 catalysts possibly because of the existence of weaker interactions between Co3O4 and SiC. Moreover, the catalysts prepared via SCS achieved higher CO2 yields than the catalysts prepared via WI likely due to the presence of smaller and well-dispersed Co3O4 particles in the SCS-prepared catalysts. Significantly high amounts of unwanted CH4 were produced over the SiC-supported catalysts between 225 and 250 °C. The high CO methanation activity was also attributed to the weaker Co3O4-SiC interactions, which enabled the easier reduction of Co3O4 to methanation active metallic Co. Keywords CO-PrOx Co3O4 Catalyst synthesis methods Support type CO2 and CH4 yields Catalyst reduction Data availability Data will be made available on request. 1 Introduction Proton-exchange membrane fuel cells (PEMFCs) generate electricity for mobile and stationary applications using hydrogen (H2) as an energy source. The H2 is generated via steam-assisted hydrocarbon reforming to produce a H2-rich reformate gas mixture containing carbon monoxide (CO, ca. 10 %) among other gases. It is important to note that CO is poisonous to the platinum (Pt)-based anode catalyst of the PEMFC as it binds more strongly to the surface of this catalyst than H2, thus, mitigating the dissociative adsorption of H2 and subsequent charge transfer processes of the PEMFC [1]. Therefore, after the hydrocarbon reforming step, the CO concentration in the reformate mixture is decreased via the high- and low-temperature water–gas shift reactions (HTWGS and LTWGS, respectively) [2,3]. However, after this two-step process, the CO concentration in the product stream is still too high (i.e., 0.5 – 2 %) and should be further decreased to levels below 0.01 % (or 100 ppm). The preferential oxidation of CO (CO-PrOx) to carbon dioxide (CO2), using oxygen (O2) in the form of air, is a promising catalytic process for further decreasing the CO content prior to feeding the H2-rich reformate gas into the PEMFC. Noble metals, such as Au [4–7], Ru [6], Pt [8–10], and Pd [11,12], have demonstrated very good activity and selectivity during CO-PrOx at low reaction temperatures (typically below 150 °C), while at elevated reaction temperatures, these catalysts become more selective to water (H2O) formation (via H2 oxidation) and methane (CH4) formation (via CO hydrogenation). Because of these reasons, and the high cost of noble metals, researchers have shifted their focus to the development of non-noble metal-based catalysts [13] such as Ni [8,9,14], Fe [4,9,15–17], Cu [7,14,18], and Co [2,9,15,19–21] (as well as their corresponding oxides). Co-based catalysts are extensively investigated owing to their promising activity and selectivity in CO-PrOx, and aspects such as promoter effects [22], support effects [20,23,24], effects of different synthesis methods [25,26], and crystallite size effects [27] have been of great research interest. In heterogeneous catalysis, active nanoparticles often are anchored on a support material to improve nanoparticle dispersion and catalytic performance [28]. The nature/type of support material and catalyst preparation method determine the physicochemical properties of the final catalyst, including the strength of the nanoparticle-support interactions (NPSI) [29–31]. Nyathi et al. [21] studied the effect of different methods for anchoring Co3O4 nanoparticles (prepared via the reverse microemulsion technique) on an Al2O3 support on CO-PrOx performance. Depending on the anchoring method used, the strength of the interaction between Co3O4 and Al2O3 could be tuned. More specifically, they showed that the Co3O4/Al2O3 catalyst with weak NPSI achieved higher CO2 yields but was reduced to a greater extent from Co3O4 to metallic Co (Co0), which resulted in high yields of unwanted CH4 being formed at elevated temperatures (i.e., above 250 °C). Nyathi et al. [20] also studied the performance of Co3O4 nanoparticles anchored on different support materials, namely, ZrO2, SiC, SiO2, CeO2, and Al2O3, and observed higher CO2 yields over the supported catalysts with weak NPSI (i.e., Co3O4/ZrO2 and Co3O4/SiC). In both studies, the weak NPSI were reported to have a positive influence on the (surface) redox properties of Co3O4, which play a key role in the oxidation of CO to CO2 via the Mars-van Krevelen (MvK) mechanism. However, these weak NPSI were also thought to be the cause of the undesired early reduction of Co3O4 to Co0 and coincidental formation of CH4, which results in the loss of valuable H2. Another parameter that can influence catalytic activity in CO-PrOx is the catalyst synthesis method [26,29,31,32]. The combustion synthesis (CS) is a preparation method characterized by a fast-heating rate, high temperature, and short reaction time [33,34]. The CS can be classified into gel-combustion, sol–gel combustion, self-propagating high-temperature synthesis (SHS), low-temperature combustion synthesis (LCS), and solution combustion synthesis (SCS) [35,36]. The main advantages of CS are the simplicity of the equipment required, low cost, realisation of a high purity and high surface area product (due to the rapid heating and cooling characteristic of the combustion synthesis conditions), and ability to tune the crystallite size (which is also due to the fast heating and cooling via the rapid release of large volumes of gas) [37–39]. Owing to these advantages, CS has been utilized to prepare various catalysts, ceramics, alloys, composites, and nanomaterials [33,34,36]. For example, the effects of different synthesis methods (viz., combustion synthesis, co-precipitation, and impregnation) on the performance of the CuO-CeO2 catalyst system in CO-PrOx and the physicochemical properties of the final catalysts have been investigated [26,40–42]. In general, the catalyst prepared via combustion synthesis display higher CO-PrOx performance than the catalysts prepared via co-precipitation and impregnation [26,39,42]. Barbato et al. [26] reported that CuO/CeO2 exhibits higher CO-PrOx activity (i.e., CO conversion to CO2) when synthesised via SCS in comparison with CuO/CeO2 synthesised via classical impregnation. This was attributed to the SCS method resulting in good interactions and distribution of the CuO particles over the CeO2 support, which was determined via the kinetic modelling (according to the Polanyi-Winger equation under the Redhead approximation) of CO2-temperature programmed desorption as a function of the catalytic site. Gurbani et al. [40] studied the synthesis method effect, exploring co-precipitation (CP), sol–gel (SG), and urea-nitrate combustion (UC), on the redox properties and catalytic performance of CuO/CeO2 during CO-PrOx. The T50 values (i.e., the temperature at which a catalyst achieves 50 % conversion), for CuCe-SG and CuCe-UC were almost identical (XCO = 50 % at 417 and 425 K, respectively), but both were lower than that of CuCe-CP (XCO = 50 % at 488 K), indicating that SG and UC preparation methods yield catalysts with greater CO-PrOx activity. This trend in T50 as a function of the synthesis method was attributed to the high surface area, high Cu dispersion, and low content of the solid solution CuCeO2 in the catalysts prepared via SG and UC, resulting in the availability of CuOx particles to catalyse CO oxidation. On the other hand, the low CO oxidation activity over CuO-CeO2-CP is attributed to the high content of the CuCeO2 solid solution, resulting in a low dispersion and availability of CuOx for CO oxidation. Although the synthesis method is reported to have a paramount influence on the performance of the final catalyst, in the context of CO-PrOx, the synthesis method effect has mainly been investigated in CuO- and CeO2-containing systems. However, studying the synthesis method effect in catalyst systems containing other active metal oxide nanoparticles and support materials is equally important. In this study, we aimed at investigating different support materials (viz., Al2O3 and SiC) and synthesis methods (viz., wetness impregnation (WI) and solution combustion synthesis (SCS)) for preparing supported Co3O4 catalysts. More specifically, our study focused on determining the physicochemical properties of Co3O4 as a function of the support nature and synthesis method, and how the resultant physicochemical properties influence the performance of Co3O4 in CO-PrOx. 2 Materials and methods 2.1 Catalyst synthesis Synthesis of Co3O4/Al2O3 and Co3O4/SiC catalysts via wetness impregnation (WI). Co3O4/Al2O3 and Co3O4/SiC catalysts were synthesized via a two-step wetness impregnation (WI) method, with each step targeting a 10 wt-% loading of Co. The required mass of cobalt(II) nitrate hexahydrate (Co(NO3)2·6H2O, Merck, >98 %) was dissolved in double-distilled water. The cobalt nitrate solution was added dropwise to a slurry of the gamma-alumina support (γ-Al2O3, Puralox, BET surface area of 150 m2/g, from SASOL performance chemicals) or beta-silicon carbide support (β-SiC, BET surface area of 27.9 m2/g, from SiCAT). The slurry was left in a beaker on a hot plate (set at 150 °C) until a ‘catalyst-precursor-support cake’ was formed; thereafter, the impregnated support was dried in an oven under stagnant air at 120 °C overnight. The dried catalyst was then calcined in a muffle furnace under stagnant air at 350 °C for 4 h using a heating rate of 3 °C/min. The calcined catalyst (with a Co loading of 10 wt-%) was then made into a slurry using double-distilled water, and the synthesis steps mentioned above were repeated to obtain a target Co loading of 20 wt-%. Note that the catalysts prepared via WI have been named Co3O4/Al2O3_WI and Co3O4/SiC_WI. Synthesis of Co3O4/Al2O3 and Co3O4/SiC catalysts via solution combustion synthesis (SCS). Co3O4/Al2O3 and Co3O4/SiC catalysts were prepared via solution combustion synthesis (SCS). To synthesise the supported catalysts, the required amount of Co(NO3)2·6H2O (Merck, >98 %) and a stoichiometric amount of urea (Merck) to combust Co(NO3)2·6H2O, were dissolved in 200 mL of double-distilled water in a 500 mL borosilicate dish. After the complete dissolution of the cobalt precursor and urea, the support (Al2O3 or SiC) was added to the solution, and the suspension was stirred (500 rpm) for 1 h. The borosilicate dish with the suspension was weighed, and the total mass before dehydration was recorded. After that, the suspension was left on a hotplate (set at 150 °C) under magnetic stirring. The dehydration of this suspension was monitored until a thick gel was formed. The mass of the container after dehydration was also recorded. The mass of the suspension before dehydration and after gel formation were subtracted for each synthesis to establish if the gel contained the same amount of water before proceeding with the gel combustion. The formed gel was placed in a muffle furnace preheated at 80 °C to obtain a xerogel. After forming a xerogel, the temperature was raised to 350 °C (heating rate: 3 °C/min), which was held for 1 h for ignition and combustion. Thereafter, the sample was removed and ground using a mortar and pestle. Finally, the sample was calcined at 350 °C (heating rate: 4 °C/min) for 4 h to improve the thermal stability of the final catalyst. Note that the catalysts prepared via SCS have been named Co3O4/Al2O3_SCS and Co3O4/SiC_SCS. 2.2 Catalyst characterisation The physicochemical properties of the fresh supported catalysts prepared via WI and SCS were determined using ex situ and in situ characterisation techniques. Additionally, the effect of the CO-PrOx reaction environment on the prepared catalysts was determined by characterising the spent catalysts using selected ex situ characterisation techniques. More specifically, the spent catalysts were recovered after completion of the CO-PrOx reaction and analysed using XRD and XAS. It is important to note that in each case, the entire spent catalyst was characterized as a single entity and could not be separated into its spatial fractions (i.e., top, middle, and bottom fractions of the bed). Recovering spatial fractions of the catalyst was not possible because of the small dimensions of the integral fixed-bed reactor used in this study (see section 2.3). 2.2.1 Ex situ characterisation The crystallographic phases present in each catalyst were identified using X-ray diffraction (XRD). The XRD measurements were carried out in a Bruker D8 Advance diffractometer equipped with a cobalt source (Kα1 = 0.179 nm) and a position-sensitive LYNXEYE XE detector. The optics were set to Bragg-Brentano geometry. A step size of 0.043°, scan range of 20 − 120° (or 1/d range of 1.9 – 9.7 nm−1, where “d” is the d-spacing), time per step of 0.75 s, resulting in a scan duration of 29 min and 50 s, were utilised. Phase composition and crystallite size information for each catalyst was determined using Rietveld refinement [43] conducted in the Bruker AXS TOPAS 5.0 software package [44]. The BET (Brunauer–Emmett–Teller) surface area of each catalyst was determined via nitrogen (N2) physisorption in a Micromeritics TriStar II 3020. Each catalyst (ca. 200 mg) was degassed in a Micromeritics FlowPrep 060 instrument at 200 °C overnight. The measurements were conducted at liquid N2 temperature. The elemental composition of each catalyst was determined via inductively coupled plasma-optical emission spectroscopy (ICP-OES). Before the analysis, approximately 50 mg of the catalyst was digested completely in an acid mixture of HClO3, HNO3, and HCl/HF (4:1) and diluted to the target volume with deionised H2O. The ICP-OES signal was calibrated with a multi-element standard solution containing the elements of interest. X-ray absorption spectroscopy (XAS) measurements were carried out at the Co K-edge (7709 eV) on beamline B18 at Diamond Light Source (United Kingdom), operating with a ring energy of 3 GeV and a ring current of 300 mA [45]. A Co foil was used for energy calibration. Scans were recorded in quick extended X-ray absorption fine structure (QEXAFS) mode from 7509 to 8559 eV, with a resolution of 0.3 eV/point, and each scan was approximately 3 min. Three scans were recorded for each sample to check reproducibility and obtain a good signal-to-noise ratio. The samples were diluted with cellulose and pressed into discs prior to being measured in transmission mode. Data processing was performed using the Athena software, which is part of the open-source software package Demeter [46] (based on the IFEFFIT library [47]). Linear combination fitting (LCF) was performed between 7700 and 7800 eV (i.e., −25 eV before the edge and + 75 eV after the edge) on the first derivative XANES (X-ray absorption near edge structure) spectra. The reference spectra considered for the LCF were of Co3O4 [48], CoO [49], CoAl2O4 [50,51], and Co foil [45]. These reference samples were synthesised according to the procedures outlined in the cited literature. 2.2.2 In situ XRD-based reduction under hydrogen The influence of the synthesis method (i.e., WI and SCS) and support type (i.e., Al2O3 and SiC) on the reduction temperature and pathway of Co3O4 in H2 was evaluated using an in-house developed capillary-based in situ XRD reaction cell [52,53]. The in situ XRD cell was mounted in a D8 Advance Bruker diffractometer equipped with a molybdenum X-ray source (Kα1 = 0.071 nm) and a position-sensitive VANTEC detector. The optics were set to parallel beam geometry. XRD patterns were measured at 5-min intervals in the 2θ range of 15 − 30° (corresponding to 3.7 ≤ 1/d ≤ 7.3 nm−1), using a step size of 0.019° (4.7 x 10-3 nm−1) and time per step of 0.2 s. The catalyst (18 mg), under a flow of H2 (2 mL(NTP)/min), was heated from 50 to 450 °C at a rate of 1 °C/min. The TOPAS 5.0 software package [44] was used to perform Rietveld refinement [43] to obtain phase composition and crystallite size information for each catalyst as a function of temperature. 2.3 Catalyst evaluation The prepared supported catalysts were evaluated under model (or “dry”) CO-PrOx conditions, which involved co-feeding 1 % CO, 1 % O2, 50 % H2, and 48 % N2 at atmospheric pressure through a ¼-inch U-shaped stainless steel fixed-bed integral reactor (22 cm in length). We note that the gases H2O and CO2 are also components of a typical CO-PrOx feed; however, these gases were not co-fed as their effects have been reported in our previous publications [2,20]. The mass of supported catalyst loaded in the reactor varied between 95 and 120 mg due to the slight differences in the Co loadings (as determined using ICP-OES – see Table 1 ). The gas flow was kept constant at 25 mL(NTP)/min, resulting in a gas-hourly space velocity (GHSV) of 60000 mL(NTP)/gCo3O4/h through each catalyst. The reaction temperature was varied between 50 and 250 °C at a heating rate of 1 °C/min, while holding the temperature every 25 °C for 60 min. The lower and upper limits of the reaction temperature range chosen represent the operating temperatures for the PEMFC (60 – 80 °C) and the LTWGS process (200 – 300 °C) [1,3,54], respectively. We note that the integral reactor used in this study has a single gas sampling point, which is downstream of the catalyst bed, i.e., at the reactor outlet. The reactor effluent gas was analysed using on-line gas chromatography (GC) in a Varian CP-4900 micro-GC (Agilent) fitted with thermal conductivity detectors (TCD) for analysing CO, O2, H2, CO2, CH4, and N2 in three different columns (see Table S1 for the identity of the columns used, and the full set of parameters applied to achieve gas separation). The water formed during the experiments could not be quantified as it was condensed in a cold trapping vessel before the micro-GC sampled the other gases. The processing of the chromatographic analyses was performed using the Varian Galaxie Chromatography Data System (version 1.9.3.2). The inlet and outlet flow rates of each gas (see Equations S1 and S2) were used to calculate the CO, O2, and H2 conversions (Equations S3, S4, and S5, respectively), CO2 and CH4 yields (Equations S6 and S7, respectively), and O2 selectivity to CO2 (Equation S8). The formation of water could be inferred from these equations and the knowledge of the reactions that can occur during CO-PrOx. 3 Results and discussion 3.1 Catalyst characterisation N2 physisorption and ICP-OES. The effects of the synthesis methods (i.e., WI and SCS) and support type (i.e., Al2O3 and SiC) on the catalyst surface area and cobalt loading were determined via N2 physisorption and ICP-OES, respectively. Regardless of the synthesis method, the catalysts supported on Al2O3 show surface areas that are approximately five-fold higher than those of the catalysts supported on SiC (Table 1). This could be attributed to the higher surface area of the bare Al2O3 support when compared with that of the bare SiC support. However, Co3O4/Al2O3_SCS shows a higher BET surface area than Co3O4/Al2O3_WI, which is in line with literature reports showing that CS results in materials with a higher surface area when compared with materials prepared via impregnation and co-precipitation [40,41]. Regarding Co loading, as determined using ICP-OES (Table 1), there is no clear effect of the synthesis method. However, the Al2O3-supported catalysts exhibit lower Co loadings than those of the SiC-supported catalysts, the reason is unclear at this stage. X-ray diffraction The effects of the synthesis method and support type on the chemical nature and crystallite size of the crystallographic phases present in the prepared catalysts were evaluated using ex situ XRD. The XRD patterns of the as prepared/fresh catalysts (Fig. 1 ) show the presence of Co3O4 and the corresponding support (i.e., Al2O3 or SiC (with the latter being present as α- and β-SiC in a 1:9 ratio [20])), which implies a 100 wt-% of Co3O4 on a cobalt basis as determined using Rietveld refinement (Table 2 ). Furthermore, the results from Rietveld refinement indicate the presence of larger crystallites of Co3O4 on the SiC support than those supported on Al2O3 (Table 3 ). This may be due to the differences in the surface areas of bare Al2O3 (150 m2/g) and bare SiC (27.9 m2/g). The larger surface area of Al2O3 possibly allows for a better distribution of the cobalt precursor, resulting in the formation of smaller Co3O4 crystallites. In terms of the synthesis method effect, the catalysts synthesised via WI possess larger crystallites of Co3O4 than those synthesised via SCS. This is in line with previous studies [26,39,40] reporting that catalysts synthesised via SCS have higher surface areas and smaller crystallites due to the rapid heating and cooling of the sample during the synthesis. After the CO-PrOx reaction, the catalysts were recovered and analysed using XRD (Fig. 2 ) (ex-situ) to determine phase composition (Table 2) and crystallite size (Table 3) changes after exposure to the CO-PrOx reaction environment between 50 and 250 °C. The spent catalysts supported on Al2O3 were partially reduced from Co3O4 to CoO, while the spent catalysts supported on SiC were reduced from Co3O4 to a combination of CoO and Co0. These observations can be attributed to the differences in the strengths of the NPSI in each catalyst; more specifically, the interaction of Co3O4 with SiC is weaker than that between Co3O4 and Al2O3, making it possible for Co3O4 to completely reduce to CoO and Co0 over the SiC support. This trend was also reported by Nyathi et al. [20] Furthermore, the catalysts prepared via WI have a lower content of Co3O4 (on Al2O3) or CoO (on SiC) than the catalysts prepared via SCS (Table 3), which indicates that the WI catalysts undergo a higher degree of reduction during CO-PrOx. As previously mentioned, these observations can be attributed to the differences in NPSI between Co3O4 crystals and the supports dictated by preparation technique, resulting in formation of larger Co3O4 crystals being formed in the case of WI when compared to SCS (Table 3). This crystallite size-dependent reduction trend is supported by previous theoretical [55] and experimental studies [27]. X-ray absorption spectroscopy. The bulk composition of each fresh supported catalyst was also determined via ex situ XAS, with the primary goal of confirming if all the Co was present in the form of Co3O4 (whether crystalline or amorphous). Fig. 3 (a) shows the first derivative XANES spectra of the relevant reference/standard samples (Co3O4, CoO, CoAl2O4, and Co0) and Fig. 3(b) – 3(e) show the corresponding spectra for the fresh Al2O3- and SiC-supported Co3O4 catalysts. Also included in Fig. 3(b) – 3(e) are the linear combination fits (LCFs) produced from the individual spectra of the Co-based phases (i.e., the reference samples) that are likely present in each fresh catalyst. Fig. S4(a) shows the normalised XANES spectra for the fresh supported catalysts; however, we note that the first derivative XANES spectra (Fig. 3(a) – 3(e)) better show the unique features of each (reference) component present in the fresh catalysts, in agreement with previously reported studies on similar materials [56,57]. The R-factors of most LCFs are below 0.015, which indicates that the chosen reference spectra for each LCF are appropriate. It can also be observed that Co3O4/Al2O3_WI and Co3O4/Al2O3_SCS contain 90.8 % and 89.0 % Co3O4 (on a Co basis), respectively, with the rest of the Co being present in the form of CoAl2O4 (9.2 % and 11.0 %, respectively, see Table 4 ). We note that the presence of CoAl2O4 could not be confirmed using XRD because of the similarity of its diffraction pattern with that of Co3O4. Co3O4/Al2O3_SCS contains a slightly higher amount of CoAl2O4 than Co3O4/Al2O3_WI, suggesting that more Co species react with the Al2O3 support during SCS, possibly because of the highly exothermic nature of SCS. Murugan et al. [58] reported a similar observation, that is, the highest content of the Ce1-xMnxO2-δ solid solution/metal-support compound formed during SCS when preparing Ce1-xMnxO2-δ (x = 0.01, 0.02, 0.03, 0.04, 0.05, 0.1 and 0.2) via different synthesis methods, namely, wet impregnation, coprecipitation, solid-state synthesis, and solution combustion synthesis. In the fresh SiC-supported catalysts, Co3O4 is the only Co-based phase present, implying that Co species do not react with the SiC support to form metal-support compounds during both catalyst synthesis methods (i.e., WI and SCS) owing to the inertness of SiC. Ex situ XAS measurements were also conducted on the spent CO-PrOx catalysts. The first derivative spectra of the reference samples and spent supported catalysts are presented in Fig. 4 (a) – 4(e). Linear combination fitting was also used to quantify the Co-based phases present in each spent sample. The results of the LCF are included in Fig. 4(b) – 4(e) and Table 4. Fig. S4(b) shows the normalised XANES spectra for the spent supported catalysts. The amounts of CoAl2O4 in the fresh and spent Co3O4/Al2O3_WI catalysts are similar (9.2 % and 9.0 %, respectively), while a slight increase in the CoAl2O4 amount (from 11.0 % to 12.5 %) is observed for Co3O4/Al2O3_SCS after the CO-PrOx reaction, suggesting that a small amount of Co species in Co3O4/Al2O3_SCS reacts with the Al2O3 support during CO-PrOx. We also observe that the Co3O4 nanoparticles in both Al2O3-supported catalysts underwent partial reduction during CO-PrOx to form CoO and Co0, which is an undesired conversion. The amounts of CoO and Co0 in the spent Co3O4/Al2O3_WI catalyst (47.2 % and 9.8 %, respectively) are higher than those in the spent Co3O4/Al2O3_SCS catalyst (18.9 % and 3.0 %, respectively). Correspondingly, the amount of Co3O4 remaining in Co3O4/Al2O3_WI (34.0 %) is lower than that in Co3O4/Al2O3_SCS (65.5 %), indicating that Co3O4/Al2O3_WI reduces to a greater extent than Co3O4/Al2O3_SCS during CO-PrOx. The Co3O4 nanoparticles in the SiC-supported catalysts also underwent undesired reduction to CoO and Co0 during CO-PrOx, but no metal-support compounds were formed. The amount of Co0 in the spent Co3O4/SiC_WI catalyst (45.4 %) is higher than that in the spent Co3O4/SiC_SCS catalyst (14.1 %). Correspondingly, a lower amount of CoO is present in Co3O4/SiC_WI (48.2 %) than that in Co3O4/SiC_SCS (89.5 %), but a relatively small amount of Co3O4 (6.5 %) remains only in the spent Co3O4/SiC_WI catalyst. Nonetheless, observing the different amounts of CoO and Co0 in the spent SiC-supported catalysts suggests that Co3O4/SiC_WI is less resistant to reduction by H2 leading to Co0. Noteworthy, the amounts of Co0 in both spent SiC-supported samples are higher than those in the spent Al2O3-supported samples. Furthermore, the extent to which Co0 is formed during CO-PrOx is greater when the supported catalyst is synthesised via WI than when it is synthesised via SCS. Two main factors could contribute to the abovementioned reducibility trends. First, Al2O3 is known to interact more strongly with cobalt oxide (Co3O4 or CoO) nanoparticles than SiC, which often limits the reducibility of the cobalt oxides [20,59]. Second, the starting crystallite sizes of Co3O4 in the fresh catalysts prepared via WI are larger than those of the corresponding catalysts prepared via SCS (see Table 4). Since large crystallites are easier to reduce than small ones [30,48,55,60], this could explain the reducibility trends based on the different catalyst synthesis techniques used. In situ XRD-based reduction under hydrogen. As mentioned earlier, the catalytic performance of Co3O4 during CO-PrOx can be affected by the loss of the active phase via reduction caused by H2, which is abundant in a typical CO-PrOx feed (40 – 75 %) [19–21,27,61]. Therefore, it was necessary to first investigate the phase stability of the prepared catalysts in a H2 environment before the CO-PrOx experiments. The reducibility of the supported catalysts was studied under a flow of pure H2 in a capillary-based in situ XRD reaction cell [52,53,62] at atmospheric pressure between 50 and 450 °C. Fig. 5 (a) and 6(a) display an on-top view (or the view along the “Intensity” axis) of the measured XRD patterns for each catalyst as a function of temperature. This view allows for a better visualisation of the disappearing and appearing reflections (or ‘peaks’) as the H2 is flowed and the temperature is increased. Fig. 5(b) and 6(b) show the calculated relative weight fractions of each Co-based phase detected in each catalyst, while Fig. 5(c) and 6(c) show the average volume-based crystallite sizes of the detected Co-based phases. The relative weight fractions reported are on a Co basis, i.e., the weight fraction of SiC or Al2O3 is not reported. Owing to the differences in the measurement parameters chosen for the ex situ and in situ XRD experiments (such as the 2θ (or 1/d) scan range, step size, and time per step – see Sections 2.2.1. and 2.2.2.), the crystallite sizes calculated for Co3O4 between both measurement modes are different [2,20] (see the sizes in Table 4 as well as in Fig. 5(c) and 6(c) for each catalyst). For all four catalysts, the reduction of Co3O4 takes place via two steps – the first involves the formation of CoO and the second involves reducing CoO to metallic Co (see Fig. 5(a) and 6(a)). The formation of CoO is first observed in Co3O4/SiC_WI at 180 °C, followed by Co3O4/SiC_SCS at 205 °C, and then by Co3O4/Al2O3_WI and Co3O4/Al2O3_SCS at 220 °C. Complete reduction of Co3O4 to CoO (i.e., the formation of 100 wt-% CoO) is only reached in the Co3O4/SiC_SCS (Fig. 6 (b) right), Co3O4/Al2O3_WI (Fig. 5(b) left), and Co3O4/Al2O3_SCS (Fig. 5(b) right) catalysts. On the other hand, the CoO formed in Co3O4/SiC_WI is reduced to metallic Co while the Co3O4 phase is also undergoing reduction (i.e., CoO reaches a maximum weight fraction of 73.5 wt-% at 225 °C – see Fig. 6(b) left). These observations indicate that the Co3O4 crystallites in each catalyst interact differently with the different supports. More specifically, the NPSI between SiC and Co3O4 are generally considered weaker than those existing between Al2O3 and Co3O4 [20,59], which explains the earlier formation of CoO in the SiC-supported catalysts. The CoO phase is formed later in Co3O4/SiC_SCS (205 °C) than in Co3O4/SiC_WI (180 °C), which can be attributed to the smaller size of the starting Co3O4 crystallites in Co3O4/SiC_SCS (average: 31.5 nm) than those in Co3O4/SiC_WI (average: 53.8 nm) [30,48,55,60]. The presence of smaller crystallites can also strengthen the NPSI, resulting in a more reduction-resistant catalyst [30]. Moreover, the CoO crystallites formed in all four catalysts are much smaller than the starting Co3O4 crystallites (Fig. 5(c) and 6(c)), indicating the absence of sintering. The formation of metallic Co is first observed in Co3O4/SiC_WI at 235 °C, followed by Co3O4/SiC_SCS at 255 °C, Co3O4/Al2O3_WI at 305 °C, and Co3O4/Al2O3_SCS at 340 °C. Interestingly, the metallic Co formed on SiC exists in the fcc and hcp crystal forms, while only fcc Co0 crystallites are formed on Al2O3. The CoO phase completely reduces to fcc and hcp Co0 in both SiC-supported catalysts before reaching 450 °C, but only partially reduces to fcc Co0 in both Al2O3-supported catalysts (Fig. 5(b) and 6(b)). This may also be due to the weaker NPSI existing between SiC and CoO than those existing between Al2O3 and CoO [20,59]. Furthermore, the CoO crystallites on SiC are generally larger than those on Al2O3, making the CoO crystallites on SiC easier to reduce [30,48,55,60]. In reference to the catalyst synthesis methods used, Co3O4/SiC_WI forms fcc and hcp Co0 (235 °C) slightly earlier than Co3O4/SiC_SCS (255 °C), and similarly, Co3O4/Al2O3_WI forms fcc Co0 (305 °C) earlier than Co3O4/Al2O3_SCS (340 °C). Additionally, the Co3O4/Al2O3_WI catalyst contains more fcc Co0 (58.3 wt-%) than Co3O4/Al2O3_SCS (40.5 wt-%) at 450 °C. The lower amount of fcc Co0 formed in Co3O4/Al2O3_SCS could be attributed to the strong interaction of Co3O4 and Al2O3 established during SCS [26]. The reduction of CoO in the Al2O3-supported catalysts formed fcc Co0 crystallites that are larger than the parent CoO crystallites, confirming the occurrence of sintering during this reduction step. However, the metallic crystallites formed were similar in size to the starting Co3O4 crystallites. Similarly, the formation of fcc Co0 in Co3O4/SiC_SCS resulted in crystallites that were larger than the parent CoO crystallites but smaller than the starting Co3O4 ones. In Co3O4/SiC_WI, the fcc Co crystallites were much larger than the parent CoO and Co3O4 crystallites, indicating extensive sintering. On the other hand, the hcp phase is formed as very small crystallites (ca. 3 nm) relative to CoO in both SiC-supported catalysts. The significant sintering in Co3O4/SiC_WI can be explained by the presence of weaker NPSI when compared with Co3O4/SiC_SCS, Co3O4/Al2O3_WI, and Co3O4/Al2O3_SCS [20,30]. According to literature, the simultaneous formation of fcc and hcp Co0 can be determined by the average size (or entire size distribution) of the parent oxide particles [63]. Moreover, pure fcc Co0 is thermodynamically stable below 20 nm and pure hcp Co0 is stable above 20 nm [64,65]. However, it is thought that fcc Co0 crystallites larger than 20 nm and hcp crystallites smaller than 20 nm may be stabilised if both phases are (partially) intergrown [63,66–68]. Therefore, it is possible that the metallic crystallites formed on SiC contain intergrown crystalline domains of fcc and hcp Co0, even though we were unable to account for this intergrowth when performing Rietveld refinement. Nonetheless, Co3O4/SiC_WI exhibits a higher hcp:fcc Co0 ratio (4:1) than Co3O4/SiC_SCS (3:1). At this stage, the reasons for the different ratios are unclear. The formation of pure fcc Co0 on Al2O3 may be due to the absence of significant sintering as fcc Co0 is thermodynamically stable below 20 nm (see Fig. 5(c)). 3.2 Catalyst evaluation An evaluation of the performance (i.e., activity and selectivity) of all four catalysts was carried out under model/dry CO-PrOx conditions between 50 and 250 °C at atmospheric pressure. Plotted in Fig. 7 (a) – 7(c) are the CO, O2, and H2 conversions, respectively, then Fig. 7(d) and 7(e) show the CO2 and CH4 yields, respectively, and Fig. 7(f) shows the O2 selectivity to CO2. It can be seen in Fig. 7(a) and 7(d) that the SiC-supported catalysts exhibit higher CO conversions and CO2 yields than the Al2O3-supported catalysts between 50 and 225 °C. This agrees with our previous observations where Co3O4/SiC and Co3O4/Al2O3 catalysts (with lower Co3O4 loadings (ca. 10 wt-%)) were also tested under similar reaction conditions [20]. Assuming the Mars-van Krevelen (MvK) mechanism for CO oxidation, which involves the Co3O4 surface undergoing reduction–oxidation (redox) cycles [20,24,69–72], it is possible that the higher CO conversions/CO2 yields achieved over the SiC-supported catalysts are a result of weak NPSI, which allow for a more facile redox cycle on the Co3O4 surface. A comparison of the CO2 yields in terms of the synthesis methods investigated shows that the catalysts prepared via SCS perform better than those prepared via WI between 50 and 225 °C. The higher activity of the SCS-prepared catalysts could be a result of forming smaller and well-dispersed Co3O4 nanoparticles on the support materials (see Table 3). The higher oxidation activity of the SCS-prepared catalyst (on the same support) could be due to the smaller crystallite size (see Table 3), which agrees with the work reported by Nyathi et al. [27]. However, although Co3O4-Al2O3-SCS has the smallest Co3O4 crystallite size (6.7 nm, see Table 3) its does not have the highest CO oxidation activity. This suggests that the performance trend observed in our current study demonstrates other effects, such as the nature of the support material and nanoparticle-support interactions (NPSI). The NPSI are dependent on the type of support and synthesis method used. We generally observed better CO oxidation activity over SCS-prepared catalysts and SiC-supported catalysts. This was also reported for copper-ceria catalysts [26,40]. However, at 250 °C, the Al2O3-supported catalysts achieve higher CO2 yields than the SiC-supported catalysts. It is important to note that XRD and XAS analyses of the spent catalysts showed high amounts of Co3O4 (on a cobalt basis) in the Al2O3-supported catalysts, and little-to-no Co3O4 in the SiC-supported catalysts after CO-PrOx (see Tables 2 and 4). Therefore, the high CO2 yields attained by the Al2O3-supported catalysts at 250 °C are attributed to the presence of high amounts of the CO oxidation active Co3O4 phase [2,20]. We note that all four catalysts achieve CO2 yields, at GHSV of 60000 mL(NTP)/gCo3O4/h used in this study, that are below the desired minimum yield of 99 % (for decreasing the CO concentration below 100 ppm) [1,3,54]. Furthermore, the catalysts reach their maximum CO2 yields at different temperatures (Fig. 7(d)): Co3O4/SiC_SCS (89.1 % at 175 °C), Co3O4/SiC_WI (84.6 % at 200 °C), Co3O4/Al2O3_SCS (31.1 % at 250 °C), and Co3O4/Al2O3_WI (40.3 % at 250 °C). This is caused by the occurrence of unwanted side reactions, namely, H2 oxidation and CO methanation, that are kinetically favoured at elevated temperatures [2,19–21,27,61]. The CO:O2 ratio in the feed was 1:1 (see section 2.3), implying a theoretical O2 conversion that is half the conversion of CO, assuming that CO oxidation is the only reaction taking place (see Equation (1). However, the conversion of O2 ultimately reaches 100 % over all four catalysts at different temperatures (Fig. 7(b)): 200 °C for Co3O4/SiC_SCS and Co3O4/SiC_WI, and 250 °C for Co3O4/Al2O3_SCS and Co3O4/Al2O3_WI. This observation suggests the simultaneous occurrence of H2 oxidation (Equation (2), as also confirmed by the H2 conversion plot in Fig. 7(c), which shows significant amounts of H2 being converted above 125 °C over the SiC-supported catalysts, and above 150 °C over the Al2O3-supported catalysts. Below these temperatures, the amounts of H2 converted are too low to detect using our micro-GC instrument. However, further evidence of H2 oxidation can be observed through the O2 selectivity to CO2, which is lower than 100 % at all temperatures over all four catalysts (Fig. 7(f)). As mentioned earlier, in the absence of H2 oxidation, the conversion of O2 should be half the conversion of CO at any given temperature since CO and O2 are present in a 1:1 ratio in the feed. The eventual depletion of O2 as the temperature is increased leaves the catalyst vulnerable to surface and bulk reduction owing to the high abundance of H2 in the feed. In fact, the study by Nyathi et al. [2] showed that in the absence of H2, Co3O4 remained chemically intact between 50 and 450 °C during CO oxidation, in accordance with the MvK mechanism. However, the reduction of Co3O4 was observed when CO (1 %), O2 (1 %), and H2 (50 %) were co-feed to perform CO-PrOx, and the onset of reduction (to the CoO phase) seemed to coincide with the temperature at which full O2 conversion was reached. Therefore, it is possible that at 200 °C for Co3O4/SiC_SCS and Co3O4/SiC_WI, and 250 °C for Co3O4/Al2O3_SCS and Co3O4/Al2O3_WI, the Co3O4 particles in each catalyst begin to reduce to CoO. The possible earlier reduction of the SiC-supported catalysts during CO-PrOx (from 200 °C) is supported by the observations made during the in situ XRD-based reduction studies performed in pure H2 (see section 3.1). More specifically, under pure H2 and a CO-PrOx environment, the weak NPSI in the SiC-supported catalysts enabled the earlier reduction of Co3O4. (1) C O g + 1 / 2 O 2 g → C O 2 g Δ H 298.15 K o = - 283.0 k J / m o l (2) H 2 g + 1 / 2 O 2 g → H 2 O g Δ H 298.15 K o = - 241.9 k J / m o l As stated earlier, the maximum reaction temperature reached was 250 °C; however, the SiC-supported catalysts reached their maximum CO2 yields at lower temperatures (Fig. 7(d)), even though the CO conversion continued to increase up to 100 % at 250 °C (Fig. 7(a)). This is due to the occurrence of undesired CO methanation (Equation (3), which starts at 225 °C over the SiC-supported catalysts, but forms at a higher rate and to a greater extent over Co3O4/SiC_WI (Fig. 7(e)). Furthermore, the SiC-supported catalysts reach their maximum CH4 yields at 250 °C, with Co3O4/SiC_WI obtaining a lower yield (86.0 %) than Co3O4/SiC_SCS (93 %). Regarding the Al2O3-supported catalysts, Co3O4/Al2O3_WI starts forming CH4 at 250 °C (max. yield: 2.8 %), while Co3O4/Al2O3_SCS did not form detectable amounts of CH4. The high formation of CH4 over the SiC-supported catalysts also increases the H2 conversion up to approximately 10 %, whereas the conversion of H2 over the Al2O3-supported catalysts increases up to approximately 4 % because negligible amounts of CH4 are formed. We note that in addition to CH4 formation, H2 oxidation also contributes to the observed conversion of H2 over all catalysts up to 250 °C (also see the plots for the O2 selectivity to CO2 in Fig. 7(f)). Furthermore, the formation rate vs. temperature plots (Figure S5) show an identical trend as that shown by the CO2 yield, H2 conversion, and CH4 yield plots in Fig. 7. For example, the SiC-supported catalysts display higher CO2 and H2O formation rates at and below 225 °C than the Al2O3-supported catalysts, while the SCS-prepared catalysts display higher CO2 formation rates than the WI-prepared catalysts. The SiC-supported catalysts are the ones that form significant amounts of CH4 than the Al2O3-supported catalysts. When comparing the formation rates of CO2 (CO oxidation) and H2O (H2 oxidation), see Fig. S5(d), the SiC-supported catalysts form higher amounts of H2O than CO2 (in terms of mmol) from 175 °C. For the Al2O3-supported catalysts, higher amounts of H2O than CO2 are formed above 200 °C. This agrees well with the observed decreases in O2 selectivity to CO2 at the abovementioned temperatures in Fig. 7(f). (3) C O g + 3 H 2 g → C H 4 g + H 2 O g Δ H 298.15 K o = - 206.2 k J / m o l According to previous in situ studies carried out under CO-PrOx conditions [2,19–21,27,61], CO methanation takes place over metallic Co, suggesting that Co3O4 is reduced to metallic Co during CO-PrOx. Based on the XAS results shown earlier (Table 4), Co0 is formed during CO-PrOx in Co3O4/SiC_WI (45.4 %), Co3O4/SiC_SCS (14.1 %), and Co3O4/Al2O3_WI (9.8 %), which explains the formation of CH4 over these three catalysts (max. yields at 250 °C: 93.5 %, 86.0 %, and 2.8 %, respectively), while the Co0 in Co3O4/Al2O3_SCS (3.0 %) did not result in the production of detectable amounts of CH4 possibly due to the low concentration of Co0 formed. We note that the trend of the maximum CH4 yields follows that of the amount of Co0 detected using XAS, implying that the formation of CH4 likely depends on the amount of Co0 formed during CO-PrOx. Moreover, reducibility is an indicator of the ability of a catalyst to dissociate H2, which can influence the H2 oxidation and CO methanation activity of that catalyst. Therefore, the H2 conversion and CH4 yield trends observed (Fig. 7(c) and 7(e), respectively) may also be a result of the differences in the H2 dissociation abilities of the catalysts, with Co3O4/SiC_WI displaying superior H2 dissociation ability and Co3O4/Al2O3_SCS showing the lowest ability. Spent catalyst XRD analysis did not show the presence of Co0 in the Al2O3-supported catalysts (see Table 3) possibly due to the low amounts of metal formed during CO-PrOx (which were only detectable using XAS). However, XRD detected relatively high amounts of Co0 in the spent SiC-supported catalysts (Table 3). Interestingly, the metal detected was in the form of fcc Co0 only. In contrast, during the in situ XRD-based reduction studies performed in pure H2 (section 3.1), Co0 was present in the fcc and hcp crystal forms after Co3O4 o3O4 reduction. Sławiński et al. [63] and Nyathi et al. [2] showed experimental evidence that the gas environment in which Co3O4 is reduced can determine the hcp:fcc Co0 ratio. However, the authors did not provide an explanation for how different reducing environments alter the final hcp:fcc Co0 ratio after Co3O4 reduction. Nonetheless, in this study, we propose that the observed sole presence of fcc Co0 in the spent SiC-supported catalysts was a result of the CO-PrOx environment that contains the reactants CO, O2, and H2, as well as the products CO2, H2O, and CH4. Generally, CH4 formation is facile over both fcc and hcp Co0 [73]; therefore, the observed CH4 over the SiC-supported catalysts is thought to be independent of the Co0 allotrope, i.e., not a result of the sole presence of fcc Co0. 4 Summary and conclusion We have demonstrated that the synthesis method (WI and SCS) and nature of the support material (Al2O3 and SiC) influences the physicochemical properties and CO-PrOx performance of Co3O4. More specifically, N2 physisorption analysis showed higher surface areas for the catalysts supported on Al2O3, but more so for the Al2O3-supported catalyst prepared via SCS, while the synthesis method did not affect the surface area of the SiC-supported catalysts. XAS analysis indicated the formation of metal-support compounds (CoxMyOz) only during the synthesis (via WI and SCS) of the Al2O3-supported catalysts. This was attributed to the higher reactivity of Al2O3 (with Con+ species) when compared with that of SiC. Regarding CO-PrOx performance, in general, the catalysts supported on SiC attained higher CO2 yields than those attained by the catalysts supported on Al2O3 between 50 and 250 °C. Furthermore, over the same support materials, the catalysts prepared via SCS achieved higher CO2 yields than those achieved by the catalysts prepared via WI. This could be due to the smaller and well-dispersed Co3O4 particles in the catalysts prepared via SCS and the weak nanoparticle-support interactions in the catalysts supported on SiC. However, the SiC-supported catalysts obtained the highest CH4 yields between 225 and 250 °C, while CH4 yields obtained with the Al2O3-supported catalysts were below 3 % at 250 °C. The catalysts prepared via WI attained marginally higher CH4 yields when compared with the counterpart catalyst prepared via SCS. It is important to note that the highest concentrations of CoO and Co0 were observed in the spent SiC-supported catalysts, possibly due to the weaker interactions between Co3O4 and SiC, which allow for easier reduction of the Co3O4 phase. Furthermore, higher CoO and Co0 concentrations were detected in the spent catalysts prepared via WI because of their larger starting crystallite sizes of Co3O4, which also make it easier for Co3O4 to reduce. There exists a good correlation between the amount of Co0 detected in each spent catalyst and the amount of CH4 (in terms of yield) formed during CO-PrOx as a function of the synthesis method and support type. This is also in line with previous studies that report Co0 as being responsible for CO methanation during CO-PrOx. Based on our findings, the SCS method and SiC support result in the formation of a supported Co3O4 catalyst that attains the highest CO2 yields, while the Al2O3 support helps limit the unwanted formation of Co0 and CH4. Further development of the Co3O4/SiC-SCS and/or Co3O4/Al2O3-SCS catalysts can lead to improved CO2 yields (ideally above 99 %) over a wider reaction temperature window, while minimising or preventing Co0 and CH4 formation. CRediT authorship contribution statement Mohamed I. Fadlalla: Writing – original draft, Visualization, Methodology, Funding acquisition, Formal analysis, Conceptualization. Thulani M. Nyathi: Writing – original draft, Visualization, Methodology, Formal analysis, Conceptualization. Majid D. Farahani: Writing – original draft, Methodology. Ying Zheng: Writing – review & editing, Conceptualization. Peter P. Wells: . Holger B. Friedrich: Writing – review & editing, Funding acquisition, Conceptualization. Michael Claeys: Writing – review & editing, Supervision, Funding acquisition, Conceptualization. Declaration of competing interest The authors declare that they have no known competing financial interests or personal relationships that could have appeared to influence the work reported in this paper. Acknowledgements The authors are grateful for the financial support from the DSI-NRF Centre of Excellence in Catalysis (c*change), Science and Technology Facilities Council (STFC) via the Global Challenges Research Fund - Synchrotron Techniques for African Research and Technology (GCRF-START, grant number: ST/R002754/1), and the National Research Foundation - Thuthuka programme (grant number: 129833). Furthermore, the authors thank the UCT-based Analytical Laboratory team for the N2 physisorption and ICP-OES analyses, as well as Diamond Light Source for granting beamtime access to perform ex situ XAS analyses on beamline B18 (session BAG2021-024). Appendix A Supplementary data Supplementary data to this article can be found online at https://doi.org/10.1016/j.jcat.2024.115777. Appendix A Supplementary data The following are the Supplementary data to this article: Supplementary data 1 References [1] T.V. Choudhary D.W. Goodman CO-free fuel processing for fuel cell applications Catal. Today 77 2002 65 78 T.V. Choudhary, D.W. Goodman, CO-free fuel processing for fuel cell applications, Catal. Today, 77 (2002) 65-78. [2] T.M. Nyathi N. Fischer A.P.E. York M. Claeys Environment-dependent catalytic performance and phase stability of Co3O4 in the preferential oxidation of carbon monoxide studied in Situ ACS Catal. 10 2020 11892 11911 T.M. Nyathi, N. Fischer, A.P.E. York, M. Claeys, Environment-Dependent Catalytic Performance and Phase Stability of Co3O4 in the Preferential Oxidation of Carbon Monoxide Studied In Situ, ACS Catal., 10 (2020) 11892-11911. [3] A. Mishra R. Prasad A review on preferential oxidation of carbon monoxide in hydrogen rich gases Bull. Chem. React. Eng. 6 2011 1 14 A. Mishra, R. Prasad, A review on preferential oxidation of carbon monoxide in hydrogen rich gases, Bull. Chem. React. Eng., 6 (2011) 1-14. [4] L.Q. Qwabe H.B. Friedrich S. Singh Preferential oxidation of CO in a hydrogen rich feed stream using Co–Fe mixed metal oxide catalysts prepared from hydrotalcite precursors J. Mol. Catal. a: Chem. 404–405 2015 167 177 L.Q. Qwabe, H.B. Friedrich, S. Singh, Preferential oxidation of CO in a hydrogen rich feed stream using Co–Fe mixed metal oxide catalysts prepared from hydrotalcite precursors, J. Mol. Catal. A: Chem., 404-405 (2015) 167-177. [5] L.Q. Qwabe H.B. Friedrich S. Singh Remediation of CO by oxidation over Au nanoparticles supported on mixed metal oxides J. Environ. Chem. Eng. 7 2019 102827 102838 L.Q. Qwabe, H.B. Friedrich, S. Singh, Remediation of CO by oxidation over Au nanoparticles supported on mixed metal oxides, J. Environ. Chem. Eng., 7 (2019) 102827-102838. [6] R. Fiorenza L. Spitaleri A. Gulino S. Scirè Ru–Pd Bimetallic Catalysts Supported on CeO2-MnOX Oxides as Efficient Systems for H2 Purification through CO Preferential Oxidation Catalysts 8 2018 203 221 R. Fiorenza, L. Spitaleri, A. Gulino, S. Scirè, Ru–Pd Bimetallic Catalysts Supported on CeO2-MnOX Oxides as Efficient Systems for H2 Purification through CO Preferential Oxidation, Catalysts, 8 (2018) 203-221. [7] T.E.R. Fiuza D. Zanchet Supported AuCu Alloy Nanoparticles for the Preferential Oxidation of CO (CO-PROX) ACS Appl. Nano Mater. 3 2020 923 934 T.E.R. Fiuza, D. Zanchet, Supported AuCu Alloy Nanoparticles for the Preferential Oxidation of CO (CO-PROX), ACS Appl. Nano Mater., 3 (2020) 923-934. [8] Z. Mohamed V.D.B.C. Dasireddy S. Singh H.B. Friedrich The preferential oxidation of CO in hydrogen rich streams over platinum doped nickel oxide catalysts Appl. Catal. b: Environ. 180 2016 687 697 Z. Mohamed, V.D.B.C. Dasireddy, S. Singh, H.B. Friedrich, The preferential oxidation of CO in hydrogen rich streams over platinum doped nickel oxide catalysts, Appl. Catal. B: Environ., 180 (2016) 687-697. [9] C.A. Chagas E.F. de Souza M.C.N.A. de Carvalho R.L. Martins M. Schmal Cobalt ferrite nanoparticles for the preferential oxidation of CO Appl. Catal. a: Gen. 519 2016 139 145 C.A. Chagas, E.F. de Souza, M.C.N.A. de Carvalho, R.L. Martins, M. Schmal, Cobalt ferrite nanoparticles for the preferential oxidation of CO, Appl. Catal. A: Gen., 519 (2016) 139-145. [10] S. Cao Y. Zhao S. Lee S. Yang J. Liu G. Giannakakis M. Li M. Ouyang D. Wang E.C.H. Sykes M. Flytzani-Stephanopoulos High-loading single Pt atom sites [Pt-O(OH)x] catalyze the CO PROX reaction with high activity and selectivity at mild conditions Sci. Adv. 6 2020 eaba3809-3816 S. Cao, Y. Zhao, S. Lee, S. Yang, J. Liu, G. Giannakakis, M. Li, M. Ouyang, D. Wang, E.C.H. Sykes, M. Flytzani-Stephanopoulos, High-loading single Pt atom sites [Pt-O(OH)x] catalyze the CO PROX reaction with high activity and selectivity at mild conditions, Sci. Adv., 6 (2020) eaba3809-3816. [11] X. Li L. Xing W. Zhao Y. Wang Y. Zhao Low-temperature CO preferential oxidation in H2-rich stream over iron modified Pd–Cu/hydroxyapatite catalyst Int. J. Hydrog. Energy 46 2021 29940 29950 X. Li, L. Xing, W. Zhao, Y. Wang, Y. Zhao, Low-temperature CO preferential oxidation in H2-rich stream over iron modified Pd–Cu/hydroxyapatite catalyst, Int. J. Hydrog. Energy, 46 (2021) 29940-29950. [12] C. Zlotea Y. Oumellal K. Provost F. Morfin L. Piccolo Role of hydrogen absorption in supported Pd nanocatalysts during CO-PROX: Insights from operando X-ray absorption spectroscopy Appl. Catal. b: Environ. 237 2018 1059 1065 C. Zlotea, Y. Oumellal, K. Provost, F. Morfin, L. Piccolo, Role of hydrogen absorption in supported Pd nanocatalysts during CO-PROX: Insights from operando X-ray absorption spectroscopy, Appl. Catal. B: Environ., 237 (2018) 1059-1065. [13] T.M. Nyathi M.I. Fadlalla M. Claeys In situ and Operando Characterisation in the Preferential Oxidation of Carbon Monoxide over Base Metal Oxide Catalysts: A Review ChemCatChem 16 2024 e202400285 T.M. Nyathi, M.I. Fadlalla, M. Claeys, In situ and Operando Characterisation in the Preferential Oxidation of Carbon Monoxide over Base Metal Oxide Catalysts: A Review, ChemCatChem, 16 (2024) e202400285. [14] C.A. Chagas M. Schmal The effect of copper oxide on the CuO–NiO/CeO2 structure and its influence on the CO-PROX reaction Int. J. Hydrog. Energy 47 2022 8858 8866 C.A. Chagas, M. Schmal, The effect of copper oxide on the CuO–NiO/CeO2 structure and its influence on the CO-PROX reaction, Int. J. Hydrog. Energy, 47 (2022) 8858-8866. [15] M.I. Fadlalla T.M. Nyathi M. Claeys Magnesium as a Methanation Suppressor for Iron- and Cobalt-Based Oxide Catalysts during the Preferential Oxidation of Carbon Monoxide Catalysts 12 2022 118 130 M.I. Fadlalla, T.M. Nyathi, M. Claeys, Magnesium as a Methanation Suppressor for Iron- and Cobalt-Based Oxide Catalysts during the Preferential Oxidation of Carbon Monoxide, Catalysts, 12 (2022) 118-130. [16] L.Q. Qwabe V.D.B.C. Dasireddy S. Singh H.B. Friedrich Preferential CO oxidation in a hydrogen-rich stream over gold supported on Ni–Fe mixed metal oxides for fuel cell applications Int. J. Hydrog. Energy 41 2016 2144 2153 L.Q. Qwabe, V.D.B.C. Dasireddy, S. Singh, H.B. Friedrich, Preferential CO oxidation in a hydrogen-rich stream over gold supported on Ni–Fe mixed metal oxides for fuel cell applications, Int. J. Hydrog. Energy, 41 (2016) 2144-2153. [17] M. Béjaoui A. Elmhamdi L. Pascual P. Pérez-Bailac K. Nahdi A. Martínez-Arias Preferential Oxidation of CO over CoFe2O4 and M/CoFe2O4 (M = Ce Co, Cu or Zr) Catalysts Catalysts 11 2021 15 M. Béjaoui, A. Elmhamdi, L. Pascual, P. Pérez-Bailac, K. Nahdi, A. Martínez-Arias, Preferential Oxidation of CO over CoFe2O4 and M/CoFe2O4 (M = Ce, Co, Cu or Zr) Catalysts, Catalysts, 11 (2021) 15. [18] C.A. Chagas E.F. de Souza R.L. Manfro S.M. Landi M.M.V.M. Souza M. Schmal Copper as promoter of the NiO–CeO2 catalyst in the preferential CO oxidation Appl. Catal. b: Environ. 182 2016 257 265 C.A. Chagas, E.F. de Souza, R.L. Manfro, S.M. Landi, M.M.V.M. Souza, M. Schmal, Copper as promoter of the NiO–CeO2 catalyst in the preferential CO oxidation, Appl. Catal. B: Environ., 182 (2016) 257-265. [19] M. Khasu T. Nyathi D.J. Morgan G.J. Hutchings M. Claeys N. Fischer CO3O4 Morphology in the Preferential Oxidation of CO, Catal Sci. Technol. 7 2017 4806 4817 M. Khasu, T. Nyathi, D.J. Morgan, G.J. Hutchings, M. Claeys, N. Fischer, CO3O4 Morphology in the Preferential Oxidation of CO, Catal. Sci. Technol., 7 (2017) 4806-4817. [20] T.M. Nyathi M.I. Fadlalla N. Fischer A.P.E. York E.J. Olivier E.K. Gibson P.P. Wells M. Claeys Support and gas environment effects on the preferential oxidation of carbon monoxide over Co3O4 catalysts studied in situ Appl. Catal. b: Environ. 297 2021 120450 120471 T.M. Nyathi, M.I. Fadlalla, N. Fischer, A.P.E. York, E.J. Olivier, E.K. Gibson, P.P. Wells, M. Claeys, Support and gas environment effects on the preferential oxidation of carbon monoxide over Co3O4 catalysts studied in situ, Appl. Catal. B: Environ., 297 (2021) 120450-120471. [21] T.M. Nyathi N. Fischer A.P. York D.J. Morgan G.J. Hutchings E.K. Gibson P.P. Wells C.R.A. Catlow M. Claeys Impact of nanoparticle–support interactions in Co3O4/Al2O3 catalysts for the preferential oxidation of carbon monoxide ACS Catal. 9 2019 7166 7178 T.M. Nyathi, N. Fischer, A.P. York, D.J. Morgan, G.J. Hutchings, E.K. Gibson, P.P. Wells, C.R.A. Catlow, M. Claeys, Impact of nanoparticle–support interactions in Co3O4/Al2O3 catalysts for the preferential oxidation of carbon monoxide, ACS Catal., 9 (2019) 7166-7178. [22] A.B. Dongil B. Bachiller-Baeza E. Castillejos N. Escalona A. Guerrero-Ruiz I. Rodríguez-Ramos The promoter effect of potassium in CuO/CeO2 systems supported on carbon nanotubes and graphene for the CO-PROX reaction, Catal Sci. Technol. 6 2016 6118 6127 A.B. Dongil, B. Bachiller-Baeza, E. Castillejos, N. Escalona, A. Guerrero-Ruiz, I. Rodríguez-Ramos, The promoter effect of potassium in CuO/CeO2 systems supported on carbon nanotubes and graphene for the CO-PROX reaction, Catal. Sci. Technol., 6 (2016) 6118-6127. [23] C.-B. Wang C.-W. Tang H.-C. Tsai S.-H. Chien Characterization and Catalytic Oxidation of Carbon Monoxide Over Supported Cobalt Catalysts Catal. Lett. 107 2006 223 230 C.-B. Wang, C.-W. Tang, H.-C. Tsai, S.-H. Chien, Characterization and Catalytic Oxidation of Carbon Monoxide Over Supported Cobalt Catalysts, Catal. Lett., 107 (2006) 223-230. [24] Z. Zhao M.M. Yung U.S. Ozkan Effect of support on the preferential oxidation of CO over cobalt catalysts Catal. Commun. 9 2008 1465 1471 Z. Zhao, M.M. Yung, U.S. Ozkan, Effect of support on the preferential oxidation of CO over cobalt catalysts, Catal. Commun., 9 (2008) 1465-1471. [25] C.-B. Wang C.-W. Tang S.-J. Gau S.-H. Chien Effect of the surface area of cobaltic oxide on carbon monoxide oxidation Catal. Lett. 101 2005 59 63 C.-B. Wang, C.-W. Tang, S.-J. Gau, S.-H. Chien, Effect of the surface area of cobaltic oxide on carbon monoxide oxidation, Catal. Lett., 101 (2005) 59-63. [26] P.S. Barbato S. Colussi A. Di Benedetto G. Landi L. Lisi J. Llorca A. Trovarelli Origin of High Activity and Selectivity of CuO/CeO2 Catalysts Prepared by Solution Combustion Synthesis in CO-PROX Reaction J. Phys. Chem. C 120 2016 13039 13048 P.S. Barbato, S. Colussi, A. Di Benedetto, G. Landi, L. Lisi, J. Llorca, A. Trovarelli, Origin of High Activity and Selectivity of CuO/CeO2 Catalysts Prepared by Solution Combustion Synthesis in CO-PROX Reaction, J. Phys. Chem. C, 120 (2016) 13039-13048. [27] T.M. Nyathi N. Fischer A.P. York M. Claeys Effect of crystallite size on the performance and phase transformation of Co3O4/Al2O3 catalysts during CO-PrOx–an in situ study Faraday Discuss. 197 2017 269 285 T.M. Nyathi, N. Fischer, A.P. York, M. Claeys, Effect of crystallite size on the performance and phase transformation of Co3O4/Al2O3 catalysts during CO-PrOx–an in situ study, Faraday Discuss., 197 (2017) 269-285. [28] R.C. Reuel C.H. Bartholomew Effects of support and dispersion on the CO hydrogenation activity/selectivity properties of cobalt J. Catal. 85 1984 78 88 R.C. Reuel, C.H. Bartholomew, Effects of support and dispersion on the CO hydrogenation activity/selectivity properties of cobalt, J. Catal., 85 (1984) 78-88. [29] J.-S. Girardon A.S. Lermontov L. Gengembre P.A. Chernavskii A. Griboval-Constant A.Y. Khodakov Effect of cobalt precursor and pretreatment conditions on the structure and catalytic performance of cobalt silica-supported Fischer-Tropsch catalysts J. Catal. 230 2005 339 352 J.-S. Girardon, A.S. Lermontov, L. Gengembre, P.A. Chernavskii, A. Griboval-Constant, A.Y. Khodakov, Effect of cobalt precursor and pretreatment conditions on the structure and catalytic performance of cobalt silica-supported Fischer–Tropsch catalysts, J. Catal., 230 (2005) 339-352. [30] N. Fischer M. Minnermann M. Baeumer E. Van Steen M. Claeys Metal support interactions in Co3O4/Al2O3 catalysts prepared from w/o microemulsions Catal. Lett. 142 2012 830 837 N. Fischer, M. Minnermann, M. Baeumer, E. Van Steen, M. Claeys, Metal support interactions in Co3O4/Al2O3 catalysts prepared from w/o microemulsions, Catal. Lett., 142 (2012) 830-837. [31] J.L. Ayastuy A. Gurbani M.A. Gutiérrez-Ortiz Effect of calcination temperature on catalytic properties of Au/Fe2O3 catalysts in CO-PROX Int. J. Hydrog. Energy 41 2016 19546 19555 J.L. Ayastuy, A. Gurbani, M.A. Gutiérrez-Ortiz, Effect of calcination temperature on catalytic properties of Au/Fe2O3 catalysts in CO-PROX, Int. J. Hydrog. Energy, 41 (2016) 19546-19555. [32] A.R. Miranda Cruz E.M. Assaf J.F. Gomes J.M. Assaf New insights about the effect of the synthesis method on the CuOCeO2 redox properties and catalytic performance towards CO-PROX reaction for fuel cell applications J. Environ. Manage. 242 2019 272 278 A.R. Miranda Cruz, E.M. Assaf, J.F. Gomes, J.M. Assaf, New insights about the effect of the synthesis method on the CuOCeO2 redox properties and catalytic performance towards CO-PROX reaction for fuel cell applications, J. Environ. Manage., 242 (2019) 272-278. [33] K.C. Patil S.T. Aruna T. Mimani Combustion synthesis: an update Curr. Opin. Solid State Mater. Sci. 6 2002 507 512 K.C. Patil, S.T. Aruna, T. Mimani, Combustion synthesis: an update, Curr. Opin. Solid State Mater. Sci., 6 (2002) 507-512. [34] K.C. Patil S.T. Aruna S. Ekambaram Combustion synthesis Curr. Opin. Solid State Mater. Sci. 2 1997 158 165 K.C. Patil, S.T. Aruna, S. Ekambaram, Combustion synthesis, Curr. Opin. Solid State Mater. Sci., 2 (1997) 158-165. [35] S.T. Aruna A.S. Mukasyan Combustion synthesis and nanomaterials Curr. Opin. Solid State Mater. Sci. 12 2008 44 50 S.T. Aruna, A.S. Mukasyan, Combustion synthesis and nanomaterials, Curr. Opin. Solid State Mater. Sci., 12 (2008) 44-50. [36] A. Varma A.S. Mukasyan A.S. Rogachev K.V. Manukyan Solution Combustion Synthesis of Nanoscale Materials Chem. Rev. 116 2016 14493 14586 A. Varma, A.S. Mukasyan, A.S. Rogachev, K.V. Manukyan, Solution Combustion Synthesis of Nanoscale Materials, Chem. Rev., 116 (2016) 14493-14586. [37] R.D. Purohit B.P. Sharma K.T. Pillai A.K. Tyagi Ultrafine ceria powders via glycine-nitrate combustion Mater. Res. Bull. 36 2001 2711 2721 R.D. Purohit, B.P. Sharma, K.T. Pillai, A.K. Tyagi, Ultrafine ceria powders via glycine-nitrate combustion, Mater. Res. Bull., 36 (2001) 2711-2721. [38] M. Marinšek K. Zupan J. Maèek Ni–YSZ cermet anodes prepared by citrate/nitrate combustion synthesis J. Power Sources 106 2002 178 188 M. Marinšek, K. Zupan, J. Maèek, Ni–YSZ cermet anodes prepared by citrate/nitrate combustion synthesis, J. Power Sources, 106 (2002) 178-188. [39] G. Avgouropoulos T. Ioannides Selective CO oxidation over CuO-CeO2 catalysts prepared via the urea–nitrate combustion method Appl. Catal. a: Gen. 244 2003 155 167 G. Avgouropoulos, T. Ioannides, Selective CO oxidation over CuO-CeO2 catalysts prepared via the urea–nitrate combustion method, Appl. Catal. A: Gen., 244 (2003) 155-167. [40] A. Gurbani J.L. Ayastuy M.P. González-Marcos M.A. Gutiérrez-Ortiz CuO–CeO2 catalysts synthesized by various methods: Comparative study of redox properties Int. J. Hydrog. Energy 35 2010 11582 11590 A. Gurbani, J.L. Ayastuy, M.P. González-Marcos, M.A. Gutiérrez-Ortiz, CuO–CeO2 catalysts synthesized by various methods: Comparative study of redox properties, Int. J. Hydrog. Energy, 35 (2010) 11582-11590. [41] W. Yang D. Li D. Xu X. Wang Effect of CeO2 preparation method and Cu loading on CuO/CeO2 catalysts for methane combustion J. Nat. Gas Chem. 18 2009 458 466 W. Yang, D. Li, D. Xu, X. Wang, Effect of CeO2 preparation method and Cu loading on CuO/CeO2 catalysts for methane combustion, J. Nat. Gas Chem., 18 (2009) 458-466. [42] G. Sedmak S. Hočevar J. Levec Kinetics of selective CO oxidation in excess of H2 over the nanostructured Cu0.1Ce0.9O2−y catalyst J. Catal. 213 2003 135 150 G. Sedmak, S. Hočevar, J. Levec, Kinetics of selective CO oxidation in excess of H2 over the nanostructured Cu0.1Ce0.9O2−y catalyst, J. Catal., 213 (2003) 135-150. [43] H.M. Rietveld A profile refinement method for nuclear and magnetic structures J. Appl. Crystallogr. 2 1969 65 71 H.M. Rietveld, A profile refinement method for nuclear and magnetic structures, J. Appl. Crystallogr., 2 (1969) 65-71. [44] A. Coelho Indexing of powder diffraction patterns by iterative use of singular value decomposition J. Appl. Crystallogr. 36 2003 86 95 A. Coelho, Indexing of powder diffraction patterns by iterative use of singular value decomposition, J. Appl. Crystallogr., 36 (2003) 86-95. [45] A.J. Dent G. Cibin S. Ramos A.D. Smith S.M. Scott L. Varandas M.R. Pearson N.A. Krumpa C.P. Jones P.E. Robbins B18: A core XAS spectroscopy beamline for Diamond JPCS 190 2009 012039 A.J. Dent, G. Cibin, S. Ramos, A.D. Smith, S.M. Scott, L. Varandas, M.R. Pearson, N.A. Krumpa, C.P. Jones, P.E. Robbins, B18: A core XAS spectroscopy beamline for Diamond, JPCS, 190 (2009) 012039. [46] B. Ravel M. Newville ATHENA, ARTEMIS, HEPHAESTUS: data analysis for X-ray absorption spectroscopy using IFEFFIT J. Synchrotron Radiat. 12 2005 537 541 B. Ravel, M. Newville, ATHENA, ARTEMIS, HEPHAESTUS: data analysis for X-ray absorption spectroscopy using IFEFFIT, J. Synchrotron Radiat., 12 (2005) 537-541. [47] M. Newville IFEFFIT : interactive XAFS analysis and FEFF fitting J. Synchrotron Radiat. 8 2001 322 324 M. Newville, IFEFFIT : interactive XAFS analysis and FEFF fitting, J. Synchrotron Radiat., 8 (2001) 322-324. [48] N. Fischer E. van Steen M. Claeys Preparation of supported nano-sized cobalt oxide and fcc cobalt crystallites Catal. Today 171 2011 174 179 N. Fischer, E. van Steen, M. Claeys, Preparation of supported nano-sized cobalt oxide and fcc cobalt crystallites, Catal. Today, 171 (2011) 174-179. [49] M. Wolf N. Fischer M. Claeys Surfactant-free synthesis of monodisperse cobalt oxide nanoparticles of tunable size and oxidation state developed by factorial design Mater. Chem. Phys. 213 2018 305 312 M. Wolf, N. Fischer, M. Claeys, Surfactant-free synthesis of monodisperse cobalt oxide nanoparticles of tunable size and oxidation state developed by factorial design, Mater. Chem. Phys., 213 (2018) 305-312. [50] M. Karmaoui N.J.O. Silva V.S. Amaral A. Ibarra Á. Millán F. Palacio Synthesis of cobalt aluminate nanopigments by a non-aqueous sol–gel route Nanoscale 5 2013 4277 4283 M. Karmaoui, N.J.O. Silva, V.S. Amaral, A. Ibarra, Á. Millán, F. Palacio, Synthesis of cobalt aluminate nanopigments by a non-aqueous sol–gel route, Nanoscale, 5 (2013) 4277-4283. [51] M. Wolf S.J. Roberts W. Marquart E.J. Olivier N.T.J. Luchters E.K. Gibson C.R.A. Catlow J.H. Neethling N. Fischer M. Claeys Synthesis, characterisation and water–gas shift activity of nano-particulate mixed-metal (Al, Ti) cobalt oxides Dalton Trans. 48 2019 13858 13868 M. Wolf, S.J. Roberts, W. Marquart, E.J. Olivier, N.T.J. Luchters, E.K. Gibson, C.R.A. Catlow, J.H. Neethling, N. Fischer, M. Claeys, Synthesis, characterisation and water–gas shift activity of nano-particulate mixed-metal (Al, Ti) cobalt oxides, Dalton Trans., 48 (2019) 13858-13868. [52] M.C.M. Claeys, N.F. Fischer, Sample presentation device for radiation-based analytical equipment, US8597598B2, (2013). [53] N. Fischer M. Claeys Phase changes studied under in situ conditions—A novel cell Catal. Today 275 2016 149 154 N. Fischer, M. Claeys, Phase changes studied under in situ conditions—A novel cell, Catal. Today, 275 (2016) 149-154. [54] A. Faur Ghenciu Review of fuel processing catalysts for hydrogen production in PEM fuel cell systems Curr. Opin. Solid State Mater. Sci. 6 2002 389 399 A. Faur Ghenciu, Review of fuel processing catalysts for hydrogen production in PEM fuel cell systems, Curr. Opin. Solid State Mater. Sci., 6 (2002) 389-399. [55] E. van Steen M. Claeys M.E. Dry J. van de Loosdrecht E.L. Viljoen J.L. Visagie Stability of Nanocrystals: Thermodynamic Analysis of Oxidation and Re-reduction of Cobalt in Water/Hydrogen Mixtures J. Phys. Chem. B 109 2005 3575 3577 E. van Steen, M. Claeys, M.E. Dry, J. van de Loosdrecht, E.L. Viljoen, J.L. Visagie, Stability of Nanocrystals: Thermodynamic Analysis of Oxidation and Re-reduction of Cobalt in Water/Hydrogen Mixtures, J. Phys. Chem. B, 109 (2005) 3575-3577. [56] G. Jacobs Y. Ji B.H. Davis D. Cronauer A.J. Kropf C.L. Marshall Fischer-Tropsch synthesis: Temperature programmed EXAFS/XANES investigation of the influence of support type, cobalt loading, and noble metal promoter addition to the reduction behavior of cobalt oxide particles Appl. Catal. a: Gen. 333 2007 177 191 G. Jacobs, Y. Ji, B.H. Davis, D. Cronauer, A.J. Kropf, C.L. Marshall, Fischer–Tropsch synthesis: Temperature programmed EXAFS/XANES investigation of the influence of support type, cobalt loading, and noble metal promoter addition to the reduction behavior of cobalt oxide particles, Appl. Catal. A: Gen., 333 (2007) 177-191. [57] C.S. Polster H. Nair C.D. Baertsch Study of active sites and mechanism responsible for highly selective CO oxidation in H2 rich atmospheres on a mixed Cu and Ce oxide catalyst J. Catal. 266 2009 308 319 C.S. Polster, H. Nair, C.D. Baertsch, Study of active sites and mechanism responsible for highly selective CO oxidation in H2 rich atmospheres on a mixed Cu and Ce oxide catalyst, J. Catal., 266 (2009) 308-319. [58] B. Murugan A.V. Ramaswamy D. Srinivas C.S. Gopinath V. Ramaswamy Nature of Manganese Species in Ce1-xMnxO2-δ Solid Solutions Synthesized by the Solution Combustion Route Chem. Mater. 17 2005 3983 3993 B. Murugan, A.V. Ramaswamy, D. Srinivas, C.S. Gopinath, V. Ramaswamy, Nature of Manganese Species in Ce1-xMnxO2-δ Solid Solutions Synthesized by the Solution Combustion Route, Chem. Mater., 17 (2005) 3983-3993. [59] J. Labuschagne R. Meyer Z. Chonco J. Botha D. Moodley Application of water-tolerant Co/β-SiC catalysts in slurry phase Fischer-Tropsch synthesis Catal. Today 275 2016 2 10 J. Labuschagne, R. Meyer, Z. Chonco, J. Botha, D. Moodley, Application of water-tolerant Co/β-SiC catalysts in slurry phase Fischer–Tropsch synthesis, Catal. Today, 275 (2016) 2-10. [60] M. Wolf H. Kotzé N. Fischer M. Claeys Size dependent stability of cobalt nanoparticles on silica under high conversion Fischer-Tropsch environment Faraday Discuss. 197 2017 243 268 M. Wolf, H. Kotzé, N. Fischer, M. Claeys, Size dependent stability of cobalt nanoparticles on silica under high conversion Fischer–Tropsch environment, Faraday Discuss., 197 (2017) 243-268. [61] L. Lukashuk K. Föttinger E. Kolar C. Rameshan D. Teschner M. Hävecker A. Knop-Gericke N. Yigit H. Li E. McDermott Operando XAS and NAP-XPS studies of preferential CO oxidation on Co3O4 and CeO2-Co3O4 catalysts J. Catal. 344 2016 1 15 L. Lukashuk, K. Föttinger, E. Kolar, C. Rameshan, D. Teschner, M. Hävecker, A. Knop-Gericke, N. Yigit, H. Li, E. McDermott, Operando XAS and NAP-XPS studies of preferential CO oxidation on Co3O4 and CeO2-Co3O4 catalysts, J. Catal., 344 (2016) 1-15. [62] N. Fischer M. Claeys In situ characterization of Fischer-Tropsch catalysts: A review J. Phys. d: Appl. Phys. 53 2020 293001 N. Fischer, M. Claeys, In situ characterization of Fischer–Tropsch catalysts: A review, J. Phys. D: Appl. Phys., 53 (2020) 293001. [63] W.A. Sławiński E. Zacharaki H. Fjellvåg A.O. Sjåstad Structural arrangement in close-packed cobalt polytypes Cryst. Growth Des. 18 2018 2316 2325 W.A. Sławiński, E. Zacharaki, H. Fjellvåg, A.O. Sjåstad, Structural arrangement in close-packed cobalt polytypes, Cryst. Growth Des., 18 (2018) 2316-2325. [64] E. Klugmann H. Blythe F. Walz Investigation of Thermomagnetic Effects in Monocrystalline Cobalt near the Martensitic Phase Transition, Physica Status Solidi (a) 146 1994 803 813 E. Klugmann, H. Blythe, F. Walz, Investigation of thermomagnetic effects in monocrystalline cobalt near the martensitic phase transition, physica status solidi (a), 146 (1994) 803-813. [65] S. Ram Allotropic phase transformations in HCP, FCC and BCC metastable structures in Co-nanoparticles Mater. Sci. Eng., A 304 2001 923 927 S. Ram, Allotropic phase transformations in HCP, FCC and BCC metastable structures in Co-nanoparticles, Mater. Sci. Eng., A, 304 (2001) 923-927. [66] O. Ducreux B. Rebours J. Lynch M. Roy-Auberger D. Bazin Microstructure of supported cobalt Fischer-Tropsch catalysts Oil & Gas Science and Technology-Revue De l'IFP 64 2009 49 62 O. Ducreux, B. Rebours, J. Lynch, M. Roy-Auberger, D. Bazin, Microstructure of supported cobalt Fischer-Tropsch catalysts, Oil & Gas Science and Technology-Revue de l'IFP, 64 (2009) 49-62. [67] H. Du Plessis J. De Villiers A. Tuling E. Olivier Stacking disorder in silicon carbide supported cobalt crystallites: an X-ray diffraction, electron diffraction and high resolution electron microscopy study PCCP 18 2016 30183 30188 H. Du Plessis, J. De Villiers, A. Tuling, E. Olivier, Stacking disorder in silicon carbide supported cobalt crystallites: an X-ray diffraction, electron diffraction and high resolution electron microscopy study, PCCP, 18 (2016) 30183-30188. [68] S.W. Price D.J. Martin A.D. Parsons W.A. Sławiński A. Vamvakeros S.J. Keylock A.M. Beale J.F.W. Mosselmans Chemical imaging of Fischer-Tropsch catalysts under operating conditions Sci. Adv. 3 2017 e1602838 e1602848 S.W. Price, D.J. Martin, A.D. Parsons, W.A. Sławiński, A. Vamvakeros, S.J. Keylock, A.M. Beale, J.F.W. Mosselmans, Chemical imaging of Fischer-Tropsch catalysts under operating conditions, Sci. Adv., 3 (2017) e1602838-1602848. [69] P. Mars D.W. Van Krevelen Oxidations carried out by means of vanadium oxide catalysts Chem. Eng. Sci. 3 1954 41 59 P. Mars, D.W. Van Krevelen, Oxidations carried out by means of vanadium oxide catalysts, Chem. Eng. Sci., 3 (1954) 41-59. [70] D. Perti R. Kabel G. McCarthy Kinetics of CO oxidation over Co3O4/γ-Al2O3 Part III: Mechanism, AlChE J. 31 1985 1435 1440 D. Perti, R. Kabel, G. McCarthy, Kinetics of CO oxidation over Co3O4/γ‐Al2O3. Part III: Mechanism, AlChE J., 31 (1985) 1435-1440. [71] V. Iablokov R. Barbosa G. Pollefeyt I. Van Driessche S. Chenakin N. Kruse Catalytic CO oxidation over well-defined cobalt oxide nanoparticles: size-reactivity correlation ACS Catal. 5 2015 5714 5718 V. Iablokov, R. Barbosa, G. Pollefeyt, I. Van Driessche, S. Chenakin, N. Kruse, Catalytic CO oxidation over well-defined cobalt oxide nanoparticles: size-reactivity correlation, ACS Catal., 5 (2015) 5714-5718. [72] L. Lukashuk N. Yigit R. Rameshan E. Kolar D. Teschner M. Hävecker A. Knop-Gericke R. Schlögl K. Föttinger G.n. Rupprechter Operando insights into CO oxidation on cobalt oxide catalysts by NAP-XPS, FTIR, and XRD ACS Catal. 8 2018 8630 8641 L. Lukashuk, N. Yigit, R. Rameshan, E. Kolar, D. Teschner, M. Hävecker, A. Knop-Gericke, R. Schlögl, K. Föttinger, G.n. Rupprechter, Operando insights into CO oxidation on cobalt oxide catalysts by NAP-XPS, FTIR, and XRD, ACS Catal., 8 (2018) 8630-8641. [73] J.-X. Liu H.-Y. Su D.-P. Sun B.-Y. Zhang W.-X. Li Crystallographic Dependence of CO activation on cobalt catalysts: HCP versus FCC J. Am. Chem. Soc. 135 2013 16284 16287 J.-X. Liu, H.-Y. Su, D.-P. Sun, B.-Y. Zhang, W.-X. Li, Crystallographic Dependence of CO Activation on Cobalt Catalysts: HCP versus FCC, Journal of the American Chemical Society, 135 (2013) 16284-16287.",
      "scopus-id": "85205464098",
      "coredata": {
        "eid": "1-s2.0-S0021951724004901",
        "dc:description": "This study investigated the performance of supported Co3O4 catalysts during the preferential oxidation of carbon monoxide (CO-PrOx) in a H2-rich environment, focusing on the effects of different catalyst synthesis methods, namely, wetness impregnation (WI) and solution combustion synthesis (SCS), and different support materials, namely, Al2O3 and SiC. During CO-PrOx, the SiC-supported Co3O4 catalysts attained higher CO2 yields when compared with the Al2O3-supported Co3O4 catalysts possibly because of the existence of weaker interactions between Co3O4 and SiC. Moreover, the catalysts prepared via SCS achieved higher CO2 yields than the catalysts prepared via WI likely due to the presence of smaller and well-dispersed Co3O4 particles in the SCS-prepared catalysts. Significantly high amounts of unwanted CH4 were produced over the SiC-supported catalysts between 225 and 250 °C. The high CO methanation activity was also attributed to the weaker Co3O4-SiC interactions, which enabled the easier reduction of Co3O4 to methanation active metallic Co.",
        "openArchiveArticle": "false",
        "prism:coverDate": "2025-02-28",
        "openaccessUserLicense": null,
        "prism:aggregationType": "Journal",
        "prism:url": "https://api.elsevier.com/content/article/pii/S0021951724004901",
        "dc:creator": [
          {
            "@_fa": "true",
            "$": "Fadlalla, Mohamed I."
          },
          {
            "@_fa": "true",
            "$": "Nyathi, Thulani M."
          },
          {
            "@_fa": "true",
            "$": "Farahani, Majid D."
          },
          {
            "@_fa": "true",
            "$": "Zheng, Ying"
          },
          {
            "@_fa": "true",
            "$": "Wells, Peter P."
          },
          {
            "@_fa": "true",
            "$": "Friedrich, Holger B."
          },
          {
            "@_fa": "true",
            "$": "Claeys, Michael"
          }
        ],
        "link": [
          {
            "@_fa": "true",
            "@rel": "self",
            "@href": "https://api.elsevier.com/content/article/pii/S0021951724004901"
          },
          {
            "@_fa": "true",
            "@rel": "scidir",
            "@href": "https://www.sciencedirect.com/science/article/pii/S0021951724004901"
          }
        ],
        "dc:format": "application/json",
        "openaccessType": null,
        "pii": "S0021-9517(24)00490-1",
        "prism:volume": "442",
        "articleNumber": "115777",
        "prism:publisher": "Published by Elsevier Inc.",
        "dc:title": "Performance of supported Co3O4 catalysts in the preferential oxidation of carbon monoxide: Effect of support type and synthesis method",
        "prism:copyright": "© 2024 Published by Elsevier Inc.",
        "openaccess": "0",
        "prism:issn": "00219517",
        "dcterms:subject": [
          {
            "@_fa": "true",
            "$": "CO-PrOx"
          },
          {
            "@_fa": "true",
            "$": "Co3O4"
          },
          {
            "@_fa": "true",
            "$": "Catalyst synthesis methods"
          },
          {
            "@_fa": "true",
            "$": "Support type"
          },
          {
            "@_fa": "true",
            "$": "CO2 and CH4 yields"
          },
          {
            "@_fa": "true",
            "$": "Catalyst reduction"
          }
        ],
        "openaccessArticle": "false",
        "prism:publicationName": "Journal of Catalysis",
        "openaccessSponsorType": null,
        "prism:pageRange": "115777",
        "pubType": "fla",
        "prism:coverDisplayDate": "February 2025",
        "prism:doi": "10.1016/j.jcat.2024.115777",
        "prism:startingPage": "115777",
        "dc:identifier": "doi:10.1016/j.jcat.2024.115777",
        "openaccessSponsorName": null
      },
      "objects": {
        "object": [
          {
            "@category": "standard",
            "@height": "747",
            "@width": "680",
            "@_fa": "true",
            "$": "https://api.elsevier.com/content/object/eid/1-s2.0-S0021951724004901-gr7.jpg?httpAccept=%2A%2F%2A",
            "@multimediatype": "JPEG image file",
            "@type": "IMAGE-DOWNSAMPLED",
            "@size": "135799",
            "@ref": "gr7",
            "@mimetype": "image/jpeg"
          },
          {
            "@category": "standard",
            "@height": "828",
            "@width": "695",
            "@_fa": "true",
            "$": "https://api.elsevier.com/content/object/eid/1-s2.0-S0021951724004901-gr5.jpg?httpAccept=%2A%2F%2A",
            "@multimediatype": "JPEG image file",
            "@type": "IMAGE-DOWNSAMPLED",
            "@size": "138262",
            "@ref": "gr5",
            "@mimetype": "image/jpeg"
          },
          {
            "@category": "standard",
            "@height": "802",
            "@width": "673",
            "@_fa": "true",
            "$": "https://api.elsevier.com/content/object/eid/1-s2.0-S0021951724004901-gr6.jpg?httpAccept=%2A%2F%2A",
            "@multimediatype": "JPEG image file",
            "@type": "IMAGE-DOWNSAMPLED",
            "@size": "148256",
            "@ref": "gr6",
            "@mimetype": "image/jpeg"
          },
          {
            "@category": "standard",
            "@height": "775",
            "@width": "535",
            "@_fa": "true",
            "$": "https://api.elsevier.com/content/object/eid/1-s2.0-S0021951724004901-gr3.jpg?httpAccept=%2A%2F%2A",
            "@multimediatype": "JPEG image file",
            "@type": "IMAGE-DOWNSAMPLED",
            "@size": "85946",
            "@ref": "gr3",
            "@mimetype": "image/jpeg"
          },
          {
            "@category": "standard",
            "@height": "728",
            "@width": "535",
            "@_fa": "true",
            "$": "https://api.elsevier.com/content/object/eid/1-s2.0-S0021951724004901-gr4.jpg?httpAccept=%2A%2F%2A",
            "@multimediatype": "JPEG image file",
            "@type": "IMAGE-DOWNSAMPLED",
            "@size": "82115",
            "@ref": "gr4",
            "@mimetype": "image/jpeg"
          },
          {
            "@category": "standard",
            "@height": "462",
            "@width": "535",
            "@_fa": "true",
            "$": "https://api.elsevier.com/content/object/eid/1-s2.0-S0021951724004901-gr1.jpg?httpAccept=%2A%2F%2A",
            "@multimediatype": "JPEG image file",
            "@type": "IMAGE-DOWNSAMPLED",
            "@size": "45516",
            "@ref": "gr1",
            "@mimetype": "image/jpeg"
          },
          {
            "@category": "standard",
            "@height": "468",
            "@width": "535",
            "@_fa": "true",
            "$": "https://api.elsevier.com/content/object/eid/1-s2.0-S0021951724004901-gr2.jpg?httpAccept=%2A%2F%2A",
            "@multimediatype": "JPEG image file",
            "@type": "IMAGE-DOWNSAMPLED",
            "@size": "49644",
            "@ref": "gr2",
            "@mimetype": "image/jpeg"
          },
          {
            "@category": "standard",
            "@height": "200",
            "@width": "443",
            "@_fa": "true",
            "$": "https://api.elsevier.com/content/object/eid/1-s2.0-S0021951724004901-ga1.jpg?httpAccept=%2A%2F%2A",
            "@multimediatype": "JPEG image file",
            "@type": "IMAGE-DOWNSAMPLED",
            "@size": "24402",
            "@ref": "ga1",
            "@mimetype": "image/jpeg"
          },
          {
            "@category": "thumbnail",
            "@height": "164",
            "@width": "149",
            "@_fa": "true",
            "$": "https://api.elsevier.com/content/object/eid/1-s2.0-S0021951724004901-gr7.sml?httpAccept=%2A%2F%2A",
            "@multimediatype": "GIF image file",
            "@type": "IMAGE-THUMBNAIL",
            "@size": "10185",
            "@ref": "gr7",
            "@mimetype": "image/gif"
          },
          {
            "@category": "thumbnail",
            "@height": "163",
            "@width": "137",
            "@_fa": "true",
            "$": "https://api.elsevier.com/content/object/eid/1-s2.0-S0021951724004901-gr5.sml?httpAccept=%2A%2F%2A",
            "@multimediatype": "GIF image file",
            "@type": "IMAGE-THUMBNAIL",
            "@size": "9949",
            "@ref": "gr5",
            "@mimetype": "image/gif"
          },
          {
            "@category": "thumbnail",
            "@height": "163",
            "@width": "137",
            "@_fa": "true",
            "$": "https://api.elsevier.com/content/object/eid/1-s2.0-S0021951724004901-gr6.sml?httpAccept=%2A%2F%2A",
            "@multimediatype": "GIF image file",
            "@type": "IMAGE-THUMBNAIL",
            "@size": "10303",
            "@ref": "gr6",
            "@mimetype": "image/gif"
          },
          {
            "@category": "thumbnail",
            "@height": "164",
            "@width": "113",
            "@_fa": "true",
            "$": "https://api.elsevier.com/content/object/eid/1-s2.0-S0021951724004901-gr3.sml?httpAccept=%2A%2F%2A",
            "@multimediatype": "GIF image file",
            "@type": "IMAGE-THUMBNAIL",
            "@size": "7390",
            "@ref": "gr3",
            "@mimetype": "image/gif"
          },
          {
            "@category": "thumbnail",
            "@height": "163",
            "@width": "120",
            "@_fa": "true",
            "$": "https://api.elsevier.com/content/object/eid/1-s2.0-S0021951724004901-gr4.sml?httpAccept=%2A%2F%2A",
            "@multimediatype": "GIF image file",
            "@type": "IMAGE-THUMBNAIL",
            "@size": "7470",
            "@ref": "gr4",
            "@mimetype": "image/gif"
          },
          {
            "@category": "thumbnail",
            "@height": "164",
            "@width": "190",
            "@_fa": "true",
            "$": "https://api.elsevier.com/content/object/eid/1-s2.0-S0021951724004901-gr1.sml?httpAccept=%2A%2F%2A",
            "@multimediatype": "GIF image file",
            "@type": "IMAGE-THUMBNAIL",
            "@size": "7862",
            "@ref": "gr1",
            "@mimetype": "image/gif"
          },
          {
            "@category": "thumbnail",
            "@height": "164",
            "@width": "187",
            "@_fa": "true",
            "$": "https://api.elsevier.com/content/object/eid/1-s2.0-S0021951724004901-gr2.sml?httpAccept=%2A%2F%2A",
            "@multimediatype": "GIF image file",
            "@type": "IMAGE-THUMBNAIL",
            "@size": "8061",
            "@ref": "gr2",
            "@mimetype": "image/gif"
          },
          {
            "@category": "thumbnail",
            "@height": "99",
            "@width": "219",
            "@_fa": "true",
            "$": "https://api.elsevier.com/content/object/eid/1-s2.0-S0021951724004901-ga1.sml?httpAccept=%2A%2F%2A",
            "@multimediatype": "GIF image file",
            "@type": "IMAGE-THUMBNAIL",
            "@size": "7996",
            "@ref": "ga1",
            "@mimetype": "image/gif"
          },
          {
            "@category": "high",
            "@height": "3305",
            "@width": "3009",
            "@_fa": "true",
            "$": "https://api.elsevier.com/content/object/eid/1-s2.0-S0021951724004901-gr7_lrg.jpg?httpAccept=%2A%2F%2A",
            "@multimediatype": "JPEG image file",
            "@type": "IMAGE-HIGH-RES",
            "@size": "689234",
            "@ref": "gr7",
            "@mimetype": "image/jpeg"
          },
          {
            "@category": "high",
            "@height": "3663",
            "@width": "3076",
            "@_fa": "true",
            "$": "https://api.elsevier.com/content/object/eid/1-s2.0-S0021951724004901-gr5_lrg.jpg?httpAccept=%2A%2F%2A",
            "@multimediatype": "JPEG image file",
            "@type": "IMAGE-HIGH-RES",
            "@size": "778994",
            "@ref": "gr5",
            "@mimetype": "image/jpeg"
          },
          {
            "@category": "high",
            "@height": "3549",
            "@width": "2979",
            "@_fa": "true",
            "$": "https://api.elsevier.com/content/object/eid/1-s2.0-S0021951724004901-gr6_lrg.jpg?httpAccept=%2A%2F%2A",
            "@multimediatype": "JPEG image file",
            "@type": "IMAGE-HIGH-RES",
            "@size": "819200",
            "@ref": "gr6",
            "@mimetype": "image/jpeg"
          },
          {
            "@category": "high",
            "@height": "3432",
            "@width": "2368",
            "@_fa": "true",
            "$": "https://api.elsevier.com/content/object/eid/1-s2.0-S0021951724004901-gr3_lrg.jpg?httpAccept=%2A%2F%2A",
            "@multimediatype": "JPEG image file",
            "@type": "IMAGE-HIGH-RES",
            "@size": "434916",
            "@ref": "gr3",
            "@mimetype": "image/jpeg"
          },
          {
            "@category": "high",
            "@height": "3221",
            "@width": "2368",
            "@_fa": "true",
            "$": "https://api.elsevier.com/content/object/eid/1-s2.0-S0021951724004901-gr4_lrg.jpg?httpAccept=%2A%2F%2A",
            "@multimediatype": "JPEG image file",
            "@type": "IMAGE-HIGH-RES",
            "@size": "425974",
            "@ref": "gr4",
            "@mimetype": "image/jpeg"
          },
          {
            "@category": "high",
            "@height": "2044",
            "@width": "2368",
            "@_fa": "true",
            "$": "https://api.elsevier.com/content/object/eid/1-s2.0-S0021951724004901-gr1_lrg.jpg?httpAccept=%2A%2F%2A",
            "@multimediatype": "JPEG image file",
            "@type": "IMAGE-HIGH-RES",
            "@size": "237272",
            "@ref": "gr1",
            "@mimetype": "image/jpeg"
          },
          {
            "@category": "high",
            "@height": "2072",
            "@width": "2368",
            "@_fa": "true",
            "$": "https://api.elsevier.com/content/object/eid/1-s2.0-S0021951724004901-gr2_lrg.jpg?httpAccept=%2A%2F%2A",
            "@multimediatype": "JPEG image file",
            "@type": "IMAGE-HIGH-RES",
            "@size": "258580",
            "@ref": "gr2",
            "@mimetype": "image/jpeg"
          },
          {
            "@category": "high",
            "@height": "886",
            "@width": "1963",
            "@_fa": "true",
            "$": "https://api.elsevier.com/content/object/eid/1-s2.0-S0021951724004901-ga1_lrg.jpg?httpAccept=%2A%2F%2A",
            "@multimediatype": "JPEG image file",
            "@type": "IMAGE-HIGH-RES",
            "@size": "195009",
            "@ref": "ga1",
            "@mimetype": "image/jpeg"
          },
          {
            "@category": "standard",
            "@_fa": "true",
            "$": "https://api.elsevier.com/content/object/eid/1-s2.0-S0021951724004901-mmc1.docx?httpAccept=%2A%2F%2A",
            "@multimediatype": "Microsoft Word file",
            "@type": "APPLICATION",
            "@size": "966978",
            "@ref": "mmc1",
            "@mimetype": "application/word"
          },
          {
            "@category": "thumbnail",
            "@_fa": "true",
            "$": "https://api.elsevier.com/content/object/eid/1-s2.0-S0021951724004901-si1.svg?httpAccept=%2A%2F%2A",
            "@multimediatype": "Scalable Vector Graphics file",
            "@type": "ALTIMG",
            "@size": "27694",
            "@ref": "si1",
            "@mimetype": "image/svg+xml"
          },
          {
            "@category": "thumbnail",
            "@_fa": "true",
            "$": "https://api.elsevier.com/content/object/eid/1-s2.0-S0021951724004901-si2.svg?httpAccept=%2A%2F%2A",
            "@multimediatype": "Scalable Vector Graphics file",
            "@type": "ALTIMG",
            "@size": "25125",
            "@ref": "si2",
            "@mimetype": "image/svg+xml"
          },
          {
            "@category": "thumbnail",
            "@_fa": "true",
            "$": "https://api.elsevier.com/content/object/eid/1-s2.0-S0021951724004901-si3.svg?httpAccept=%2A%2F%2A",
            "@multimediatype": "Scalable Vector Graphics file",
            "@type": "ALTIMG",
            "@size": "27759",
            "@ref": "si3",
            "@mimetype": "image/svg+xml"
          }
        ]
      },
      "link": {
        "@rel": "abstract",
        "@href": "https://api.elsevier.com/content/abstract/scopus_id/85205464098"
      }
    }
  }
}