{
  "metadata": {
    "title": "Synthesis of NiBTC metal-organic framework thin layers on nickel foam by different electrochemical methods: A comparative study for hydrogen evolution reaction",
    "authors": "; ",
    "journal": "Applied Catalysis A: General",
    "date": "2023-10-25",
    "doi": "10.1016/j.apcata.2023.119463",
    "abstract": "",
    "uri": "https://api.elsevier.com/content/article/pii/S0926860X2300443X",
    "pii": "S0926860X2300443X"
  },
  "fulltext": {
    "full-text-retrieval-response": {
      "scopus-eid": "2-s2.0-85174689584",
      "originalText": "serial JL 271346 291210 291744 291809 31 Applied Catalysis A: General APPLIEDCATALYSISAGENERAL 2023-10-18 2023-10-18 2023-10-21 2023-10-21 2023-10-31T20:53:05 1-s2.0-S0926860X2300443X S0926-860X(23)00443-X S0926860X2300443X 10.1016/j.apcata.2023.119463 S300 S300.1 FULL-TEXT 1-s2.0-S0926860X23X00180 2024-01-01T12:35:59.692098Z 0 0 20231025 2023 2023-10-18T15:31:16.624818Z absattachment articleinfo articlenumber articletitlenorm authfirstinitialnorm authfirstsurnamenorm cid cids contenttype copyright crossmark dateloaded dateloadedtxt datesearch datesort dateupdated dco docsubtype doctype doi eid ewtransactionid hubeid indexeddate issn issnnorm itemstage itemtransactionid itemweight openaccess openarchive pg pgfirst pii piinorm pubdatestart pubdatetxt pubyr sortorder srctitle srctitlenorm srctype ssids alllist content subj subheadings suppl tomb volfirst volissue volumelist webpdf webpdfpagecount yearnav figure table e-component body mmlmath acknowledge affil appendices articletitle auth authfirstini authfull authkeywords authlast grantsponsor highlightsabst orcid primabst ref specialabst 0926-860X 0926860X true 667 667 C Volume 667 11 119463 119463 119463 20231025 25 October 2023 2023-10-25 2023 article fla © 2023 Elsevier B.V. All rights reserved. SYNTHESISNIBTCMETALORGANICFRAMEWORKTHINLAYERSNICKELFOAMBYDIFFERENTELECTROCHEMICALMETHODSACOMPARATIVESTUDYFORHYDROGENEVOLUTIONREACTION SADEGHI A 1 Introduction 2 Experimental 2.1 Materials 2.2 Apparatus and software 2.3 Electrochemical synthesis of MOF 3 Results and discussion 3.1 Surface morphology and elemental analysis 3.2 XRD analysis 3.3 FTIR analysis 3.4 BET analysis 3.5 Application in HER 4 Conclusion CRediT authorship contribution statement Acknowledgment Appendix A Supplementary material References LEE 2013 1667 1680 Y MUTHURASU 2023 122523 A SHAIKHUTDINOV 2023 1 17 I LIU 2023 464032 C GONG 2022 3737 3745 W LI 2022 4608 4618 Y MARANESCU 2022 4458 B MALLAKPOUR 2022 214262 S WEI 2023 4388 H ZULIANI 2023 2005 2023 A ADEGOKE 2023 102412 K DEVI 2022 13573 13590 B MO 2023 335 354 G PENG 2022 102732 Y HE 2022 10087 10125 B BHOITE 2023 124192 A ZHENG 2022 e202212797 R ZHU 2022 119912 X PHAN 2023 352 P LI 2022 11488 11506 Y ALIZADEH 2017 4753 4761 S JIA 2021 310 320 H CAMPAGNOL 2016 3914 3925 N REN 2022 e202200196 H GHOORCHIAN 2020 177 195 A METALORGANICFRAMEWORKSFORBIOMEDICALAPPLICATIONS ELECTROCHEMICALSYNTHESISMOFS ALKUTUBI 2015 462 474 H MARTINEZJOARISTI 2012 3489 3498 A CAMPAGNOL 2013 5827 5830 N JABARIAN 2019 1565 1574 S AI 2020 114161 Y LI 2018 34494 34501 Z HAN 2023 14 21 D JI 2022 475 482 S CHHETRI 2022 100146 K HOSSEINI 2022 11 12 S XU 2022 33677 33698 X CLOUGH 2015 118 121 A MING 2016 15148 15155 F LU 2016 5065 5069 J GOJGIC 2023 119312 J KE 2019 547 555 X KANDEL 2022 109992 M YANG 2014 19648 19652 G KANDEL 2023 122680 M ZHANG 2023 816 824 J AZADBAKHT 2016 479 487 A YAGHI 1996 9096 9101 O NIRMAL 2020 030617 N SIVAGAMI 2022 110054 M LESTARI 2017 012064 W ISRAR 2016 669 675 F ALOTHMAN 2012 2874 2902 Z VOIRY 2018 0105 D ABDOLLAHI 2023 168400 A RAOOF 2015 1075 1081 J QIN 2015 7169 7177 J DAI 2016 12539 12548 X HOD 2015 8304 I SADEGHIX2023X119463 SADEGHIX2023X119463XA 2025-10-21T00:00:00.000Z 2025-10-21T00:00:00.000Z http://creativecommons.org/licenses/by-nc-nd/4.0/ © 2023 Elsevier B.V. All rights reserved. 2023-10-28T03:52:03.441Z http://vtw.elsevier.com/data/voc/AddOnTypes/50.7/aggregated-refined https://doi.org/10.15223/policy-017 https://doi.org/10.15223/policy-037 https://doi.org/10.15223/policy-012 https://doi.org/10.15223/policy-029 https://doi.org/10.15223/policy-004 item S0926-860X(23)00443-X S0926860X2300443X 1-s2.0-S0926860X2300443X 10.1016/j.apcata.2023.119463 271346 2024-01-01T12:35:59.692098Z 2023-10-25 1-s2.0-S0926860X2300443X-main.pdf https://s3-eu-west-1.amazonaws.com/prod-ucs-content-store-eu-west/content/pii:S0926860X2300443X/MAIN/application/pdf/9e07b4dc16b626e24b07a7144900685e/main.pdf main.pdf pdf true 9140442 MAIN 9 1-s2.0-S0926860X2300443X-main_1.png https://s3-eu-west-1.amazonaws.com/prod-ucs-content-store-eu-west/content/pii:S0926860X2300443X/PREVIEW/image/png/9ec8cb90b569936e7974cf3bed2779b1/main_1.png main_1.png png 58049 849 656 IMAGE-WEB-PDF 1 1-s2.0-S0926860X2300443X-sc1.jpg https://s3-eu-west-1.amazonaws.com/prod-ucs-content-store-eu-west/content/pii:S0926860X2300443X/sc1/DOWNSAMPLED/image/jpeg/a16a5f0b1886ec69b9999ec8b54bfcf0/sc1.jpg sc1 sc1.jpg jpg 47270 281 678 IMAGE-DOWNSAMPLED 1-s2.0-S0926860X2300443X-gr9.jpg https://s3-eu-west-1.amazonaws.com/prod-ucs-content-store-eu-west/content/pii:S0926860X2300443X/gr9/DOWNSAMPLED/image/jpeg/256dffcc29d3b4a88ff4517cd4c14f16/gr9.jpg gr9 gr9.jpg jpg 19494 303 299 IMAGE-DOWNSAMPLED 1-s2.0-S0926860X2300443X-gr8.jpg https://s3-eu-west-1.amazonaws.com/prod-ucs-content-store-eu-west/content/pii:S0926860X2300443X/gr8/DOWNSAMPLED/image/jpeg/fe7c18a806588eed84e77e558a211415/gr8.jpg gr8 gr8.jpg jpg 149486 969 715 IMAGE-DOWNSAMPLED 1-s2.0-S0926860X2300443X-gr7.jpg https://s3-eu-west-1.amazonaws.com/prod-ucs-content-store-eu-west/content/pii:S0926860X2300443X/gr7/DOWNSAMPLED/image/jpeg/adc929ccaf54f8ffb971256893d3695c/gr7.jpg gr7 gr7.jpg jpg 35615 185 565 IMAGE-DOWNSAMPLED 1-s2.0-S0926860X2300443X-gr6.jpg https://s3-eu-west-1.amazonaws.com/prod-ucs-content-store-eu-west/content/pii:S0926860X2300443X/gr6/DOWNSAMPLED/image/jpeg/ba296190503370e482c68edb6b85258c/gr6.jpg gr6 gr6.jpg jpg 54601 488 678 IMAGE-DOWNSAMPLED 1-s2.0-S0926860X2300443X-gr5.jpg https://s3-eu-west-1.amazonaws.com/prod-ucs-content-store-eu-west/content/pii:S0926860X2300443X/gr5/DOWNSAMPLED/image/jpeg/e3769c648e188a7634a4bd27e44b30fb/gr5.jpg gr5 gr5.jpg jpg 24306 345 376 IMAGE-DOWNSAMPLED 1-s2.0-S0926860X2300443X-gr4.jpg https://s3-eu-west-1.amazonaws.com/prod-ucs-content-store-eu-west/content/pii:S0926860X2300443X/gr4/DOWNSAMPLED/image/jpeg/9fb130186ff4b848b386c90d4a197425/gr4.jpg gr4 gr4.jpg jpg 22351 254 508 IMAGE-DOWNSAMPLED 1-s2.0-S0926860X2300443X-gr3.jpg https://s3-eu-west-1.amazonaws.com/prod-ucs-content-store-eu-west/content/pii:S0926860X2300443X/gr3/DOWNSAMPLED/image/jpeg/e8d0a4c2bb17d138fb2ee329e946be02/gr3.jpg gr3 gr3.jpg jpg 39800 582 376 IMAGE-DOWNSAMPLED 1-s2.0-S0926860X2300443X-gr2.jpg https://s3-eu-west-1.amazonaws.com/prod-ucs-content-store-eu-west/content/pii:S0926860X2300443X/gr2/DOWNSAMPLED/image/jpeg/45b3468fd29e7bbb954b39596f48b709/gr2.jpg gr2 gr2.jpg jpg 120806 339 678 IMAGE-DOWNSAMPLED 1-s2.0-S0926860X2300443X-ga1.jpg https://s3-eu-west-1.amazonaws.com/prod-ucs-content-store-eu-west/content/pii:S0926860X2300443X/ga1/DOWNSAMPLED/image/jpeg/d0bada64c2ee4a1ebfd6bba5ab189d83/ga1.jpg ga1 true ga1.jpg jpg 16910 200 271 IMAGE-DOWNSAMPLED 1-s2.0-S0926860X2300443X-gr1.jpg https://s3-eu-west-1.amazonaws.com/prod-ucs-content-store-eu-west/content/pii:S0926860X2300443X/gr1/DOWNSAMPLED/image/jpeg/245e365698741ab16be8668e1f9669cc/gr1.jpg gr1 gr1.jpg jpg 117023 339 678 IMAGE-DOWNSAMPLED 1-s2.0-S0926860X2300443X-sc1.sml https://s3-eu-west-1.amazonaws.com/prod-ucs-content-store-eu-west/content/pii:S0926860X2300443X/sc1/THUMBNAIL/image/gif/3dafc1110b1d3a63818ca0fa710f9aa4/sc1.sml sc1 sc1.sml sml 9109 91 219 IMAGE-THUMBNAIL 1-s2.0-S0926860X2300443X-gr9.sml https://s3-eu-west-1.amazonaws.com/prod-ucs-content-store-eu-west/content/pii:S0926860X2300443X/gr9/THUMBNAIL/image/gif/6989eaf7aead29f90221ed58b1e62ec7/gr9.sml gr9 gr9.sml sml 5663 163 161 IMAGE-THUMBNAIL 1-s2.0-S0926860X2300443X-gr8.sml https://s3-eu-west-1.amazonaws.com/prod-ucs-content-store-eu-west/content/pii:S0926860X2300443X/gr8/THUMBNAIL/image/gif/caa4576b6020e3e55a447a1333d63a20/gr8.sml gr8 gr8.sml sml 8440 164 121 IMAGE-THUMBNAIL 1-s2.0-S0926860X2300443X-gr7.sml https://s3-eu-west-1.amazonaws.com/prod-ucs-content-store-eu-west/content/pii:S0926860X2300443X/gr7/THUMBNAIL/image/gif/b02cfc274436985a26821d6b7bed4814/gr7.sml gr7 gr7.sml sml 10389 72 219 IMAGE-THUMBNAIL 1-s2.0-S0926860X2300443X-gr6.sml https://s3-eu-west-1.amazonaws.com/prod-ucs-content-store-eu-west/content/pii:S0926860X2300443X/gr6/THUMBNAIL/image/gif/d8d48deab7170b011210b1757dd85d35/gr6.sml gr6 gr6.sml sml 7363 158 219 IMAGE-THUMBNAIL 1-s2.0-S0926860X2300443X-gr5.sml https://s3-eu-west-1.amazonaws.com/prod-ucs-content-store-eu-west/content/pii:S0926860X2300443X/gr5/THUMBNAIL/image/gif/05fa4eba51b06e2cbb9d16d93ce8f5fc/gr5.sml gr5 gr5.sml sml 6291 164 179 IMAGE-THUMBNAIL 1-s2.0-S0926860X2300443X-gr4.sml https://s3-eu-west-1.amazonaws.com/prod-ucs-content-store-eu-west/content/pii:S0926860X2300443X/gr4/THUMBNAIL/image/gif/17b875d42d53215ec531dc741c5cac30/gr4.sml gr4 gr4.sml sml 5411 110 219 IMAGE-THUMBNAIL 1-s2.0-S0926860X2300443X-gr3.sml https://s3-eu-west-1.amazonaws.com/prod-ucs-content-store-eu-west/content/pii:S0926860X2300443X/gr3/THUMBNAIL/image/gif/9819a2a874c8632df0768b2b0051c05e/gr3.sml gr3 gr3.sml sml 5509 164 106 IMAGE-THUMBNAIL 1-s2.0-S0926860X2300443X-gr2.sml https://s3-eu-west-1.amazonaws.com/prod-ucs-content-store-eu-west/content/pii:S0926860X2300443X/gr2/THUMBNAIL/image/gif/71c6b941375cf11af56f92bb7d55ebdb/gr2.sml gr2 gr2.sml sml 20813 110 219 IMAGE-THUMBNAIL 1-s2.0-S0926860X2300443X-ga1.sml https://s3-eu-west-1.amazonaws.com/prod-ucs-content-store-eu-west/content/pii:S0926860X2300443X/ga1/THUMBNAIL/image/gif/ec7dab44afacb5d74b68ecc0b2c77553/ga1.sml ga1 true ga1.sml sml 14731 162 219 IMAGE-THUMBNAIL 1-s2.0-S0926860X2300443X-gr1.sml https://s3-eu-west-1.amazonaws.com/prod-ucs-content-store-eu-west/content/pii:S0926860X2300443X/gr1/THUMBNAIL/image/gif/43617fdf34e4af5b1cdb4280c47d2222/gr1.sml gr1 gr1.sml sml 20777 109 219 IMAGE-THUMBNAIL 1-s2.0-S0926860X2300443X-sc1_lrg.jpg https://s3-eu-west-1.amazonaws.com/prod-ucs-content-store-eu-west/content/pii:S0926860X2300443X/HIGHRES/image/jpeg/10092ef78f3f75ffc4768f891a62fb5e/sc1_lrg.jpg sc1 sc1_lrg.jpg jpg 232160 1241 2994 IMAGE-HIGH-RES 1-s2.0-S0926860X2300443X-gr9_lrg.jpg https://s3-eu-west-1.amazonaws.com/prod-ucs-content-store-eu-west/content/pii:S0926860X2300443X/HIGHRES/image/jpeg/9ba73757dd349f4af5f829016f23f1e7/gr9_lrg.jpg gr9 gr9_lrg.jpg jpg 102688 1350 1330 IMAGE-HIGH-RES 1-s2.0-S0926860X2300443X-gr8_lrg.jpg https://s3-eu-west-1.amazonaws.com/prod-ucs-content-store-eu-west/content/pii:S0926860X2300443X/HIGHRES/image/jpeg/ee5e28426c7d8400807cc26dae6e40f6/gr8_lrg.jpg gr8 gr8_lrg.jpg jpg 828686 4282 3160 IMAGE-HIGH-RES 1-s2.0-S0926860X2300443X-gr7_lrg.jpg https://s3-eu-west-1.amazonaws.com/prod-ucs-content-store-eu-west/content/pii:S0926860X2300443X/HIGHRES/image/jpeg/0cd61f5db81c5dc9b9adadc7fcb8ad0d/gr7_lrg.jpg gr7 gr7_lrg.jpg jpg 243084 818 2495 IMAGE-HIGH-RES 1-s2.0-S0926860X2300443X-gr6_lrg.jpg https://s3-eu-west-1.amazonaws.com/prod-ucs-content-store-eu-west/content/pii:S0926860X2300443X/HIGHRES/image/jpeg/2674034d5f137670bbc449f0964b3fe2/gr6_lrg.jpg gr6 gr6_lrg.jpg jpg 254600 2157 2994 IMAGE-HIGH-RES 1-s2.0-S0926860X2300443X-gr5_lrg.jpg https://s3-eu-west-1.amazonaws.com/prod-ucs-content-store-eu-west/content/pii:S0926860X2300443X/HIGHRES/image/jpeg/32731bca97a7f5f29c518fac6d9d3683/gr5_lrg.jpg gr5 gr5_lrg.jpg jpg 120706 1524 1663 IMAGE-HIGH-RES 1-s2.0-S0926860X2300443X-gr4_lrg.jpg https://s3-eu-west-1.amazonaws.com/prod-ucs-content-store-eu-west/content/pii:S0926860X2300443X/HIGHRES/image/jpeg/9b670803f05266edd3d0983429f9e612/gr4_lrg.jpg gr4 gr4_lrg.jpg jpg 112114 1124 2245 IMAGE-HIGH-RES 1-s2.0-S0926860X2300443X-gr3_lrg.jpg https://s3-eu-west-1.amazonaws.com/prod-ucs-content-store-eu-west/content/pii:S0926860X2300443X/HIGHRES/image/jpeg/2f9085d1f19a6153db683376b23917f9/gr3_lrg.jpg gr3 gr3_lrg.jpg jpg 222684 2575 1663 IMAGE-HIGH-RES 1-s2.0-S0926860X2300443X-gr2_lrg.jpg https://s3-eu-west-1.amazonaws.com/prod-ucs-content-store-eu-west/content/pii:S0926860X2300443X/HIGHRES/image/jpeg/4763552463c5c346271dd0903f17e99d/gr2_lrg.jpg gr2 gr2_lrg.jpg jpg 827967 1497 2994 IMAGE-HIGH-RES 1-s2.0-S0926860X2300443X-ga1_lrg.jpg https://s3-eu-west-1.amazonaws.com/prod-ucs-content-store-eu-west/content/pii:S0926860X2300443X/HIGHRES/image/jpeg/d5a7337001ae17ebaf6b3f45ebea7ee1/ga1_lrg.jpg ga1 true ga1_lrg.jpg jpg 150086 886 1200 IMAGE-HIGH-RES 1-s2.0-S0926860X2300443X-gr1_lrg.jpg https://s3-eu-west-1.amazonaws.com/prod-ucs-content-store-eu-west/content/pii:S0926860X2300443X/HIGHRES/image/jpeg/f33426580ff8d651f83b61a974d9f43f/gr1_lrg.jpg gr1 gr1_lrg.jpg jpg 741793 1496 2994 IMAGE-HIGH-RES 1-s2.0-S0926860X2300443X-mmc1.docx https://s3-eu-west-1.amazonaws.com/prod-ucs-content-store-eu-west/content/pii:S0926860X2300443X/mmc1/MAIN/application/vnd.openxmlformats-officedocument.wordprocessingml.document/f0624cec866f6a8c7cf7b057bd19cea4/mmc1.docx mmc1 mmc1.docx docx 15635152 APPLICATION 1-s2.0-S0926860X2300443X-si0001.svg https://s3-eu-west-1.amazonaws.com/prod-ucs-content-store-eu-west/content/pii:S0926860X2300443X/image/svg+xml/6eeb0618fe392d689dea3ef223f372cc/si0001.svg si0001 si0001.svg svg 1790 ALTIMG 1-s2.0-S0926860X2300443X-am.pdf am am.pdf pdf 3259548 AAM-PDF https://s3-eu-west-1.amazonaws.com/prod-ucs-content-store-eu-west/content/egi:101H2T3BHN2/MAIN/application/pdf/09585fac61f726e951ab885fd3652e27/am.pdf APCATA 119463 119463 S0926-860X(23)00443-X 10.1016/j.apcata.2023.119463 Elsevier B.V. Fig. 1 FESEM images for electrochemical synthesis of NiBTC by: (a-c) CV method at 5; 10 and 25 mV/s, respectively; (d-g) LSV method at 0.5, 1, and 2 mV/s, respectively; (h) elemental distribution of active materials at 2 mV/s with LSV method. Fig. 1 Fig. 2 (a-d) TEM and (e-g) HRTEM of NiBTC MOF electrode material by LSV3; (h) Inverse fast Fourier transform (IFFT) images of the regions A-D in 2 g. Fig. 2 Fig. 3 XRD patterns of synthesized NiBTC by LSV with different scan rates: (a) 2; (b) 0.5; (c) 1 and (d) 4 mV/s, respectively. Fig. 3 Fig. 4 FTIR spectrum of synthesized NiBTC by LSV technique (LSV3). Fig. 4 Fig. 5 N2 adsorption-desorption isotherms and BJH pore size distribution (inset) of LSV3. Fig. 5 Fig. 6 (a) LSV plots for the HER on bare and modified Ni foams in comparison to platinum disc electrode in 0.1 M NaOH solution (scan rate: 5 mV/s); (b) Tafel plots; (c) Nyquist plots of bare Ni foam and LSV3 in 0.1 M NaOH solution (inset is the fitted equivalent circuit); (d) Chronopotentiogram of LSV3 electrode during 30 h at −20 mA/cm2 to examine the stability of HER. Fig. 6 Fig. 7 (a, b) FESEM images and (c) elemental mapping of the optimal electrode (LSV3) after the stability test for HER. Fig. 7 Fig. 8 CV plots at different scan rates (Mv/s) in 0.1 M NaOH for (a) bare Ni foam and synthesized NiBTC MOF by electrochemical methods: (b) CV5; (c) CV10; (d) CV25; (e) LSV5 and (f) LSV3, respectively. Fig. 8 Fig. 9 Plots for calculating double-layer capacitance (C dl ). Fig. 9 Scheme 1 Representation of electrochemical synthesis procedures. Scheme 1 Table 1 Nomenclature of synthesized electrode materials. Table 1 Electrode name Method Scan rate (mV/s) Potential range (V) CV5 CV 5 0–3 CV10 CV 10 0–3 CV25 CV 25 0–3 LSV3 LSV 2 0–3 LSV5 LSV 2 0–5 Synthesis of NiBTC metal-organic framework thin layers on nickel foam by different electrochemical methods: A comparative study for hydrogen evolution reaction Ali Sadeghi Formal analysis Visualization Validation Writing – original draft a b Ali Ghaffarinejad Supervision Project administration Writing – review & editing a b ⁎ a Research Laboratory of Real Samples Analysis, Faculty of Chemistry, Iran University of Science and Technology, Tehran 1684613114, Iran Research Laboratory of Real Samples Analysis, Faculty of Chemistry, Iran University of Science and Technology Tehran 1684613114 Iran Research Laboratory of Real Samples Analysis, Faculty of Chemistry, Iran University of Science and Technology, Tehran 1684613114, Iran b Electroanalytical Chemistry Research Center, Iran University of Science and Technology, Tehran 1684613114, Iran Electroanalytical Chemistry Research Center, Iran University of Science and Technology Tehran 1684613114 Iran Electroanalytical Chemistry Research Center, Iran University of Science and Technology, Tehran 1684613114, Iran ⁎ Corresponding author at: Research Laboratory of Real Samples Analysis, Faculty of Chemistry, Iran University of Science and Technology, Tehran 1684613114, Iran. Research Laboratory of Real Samples Analysis, Faculty of Chemistry, Iran University of Science and Technology Tehran 1684613114 Iran In this study, for the first time two electrochemical synthesis techniques including cyclic voltammetry (CV) and linear sweep voltammetry (LSV) were used for MOF synthesis. The Ni3(BTC)2 electrocatalyst was synthesized and deposited without any binder, for a short time and at ambient temperature on the nickel foam substrate. Morphology studies showed that the LSV method leads to preserving the 3D structure of nickel foam which promotes the catalytic activity. It should be noted that two parameters, such as voltage range and scan rate, were optimized during the LSV method. Moreover, X-ray diffraction (XRD) and Fourier transform infrared (FTIR) spectroscopy were used to confirm the MOF's structural integrity. Furthermore, the Brunauer-Emmett-Teller (BET) method verified the porous structure of NiBTC MOF. Additionally, the performance of bare and modified nickel foams was also examined for the hydrogen evolution reaction (HER) which demonstrated the tremendous potential of NiBTC/Ni foam in HER catalytic activity. Graphical Abstract ga1 Keywords Electrochemical synthesis Hydrogen evolution reaction Metal-organic framework Ni3(BTC)2 Nickel foam Thin film Data availability No data was used for the research described in the article. 1 Introduction The development of metal-organic frameworks (MOFs), an area of organic-inorganic hybrid materials, has attracted a lot of attention in recent years. These materials provide high surface areas, adequate pore volumes, and adjustable architectures due to the metal clusters and organic linkers that make up their composition which cause consistent and numerous active sites accompanied by well-defined morphologies to promote electron transfer [1,2]. Because of existing these features, MOFs can be used for a variety of purposes, including chromatography [3,4], gas adsorption and separation [5,6], medication administration [7,8], sensing [9,10], electrocatalysis [11,12], photocatalysis [13], and energy storage [14,15]. Therefore, many techniques for creating these materials, including solvothermal [16], liquid phase [17], evaporation [18], microwave [19], and gel layer [20] were enhanced. As it is obvious, these methods cause the preparation of MOFs which are not controllable and selective and require high magnitudes of vacuum, pressure, and temperature. Additionally, they take a lot of time including numerous stages, and their morphology is not uniform [21]. Contrarily, electrochemical procedures can be controlled by applying voltage and current and are also capable of being carried out at room temperature and pressure while requiring little time for synthesis. Moreover, these techniques received particular attention due to their cost-effectiveness, ease of use, and high sensitivity [22]. The synthesis of MOFs in thin layers can be aided by anodic or cathodic deposition techniques [23,24]. During anodic electrosynthesis, the electrode (anode) is submerged in an electrolyte made of organic linkers. The metal ions are then released while an oxidation voltage is being applied, reacting with organic ligands close to the electrode surface to create a thin layer of MOF. By employing optimal electrochemical conditions, this method was used to conveniently control MOF characteristics [25]. The electrosynthesis of MOF depends on a variety of factors, including the electrolyte, solvent, time, voltage, and current. However, the concentration of metal ions and the size of crystals will be controlled during the change in applied voltage magnitude [26]. Different MOFs, including MIL-53 (Al) [27], MIL-100 (Fe) [28], Ni3(BTC)2 [29], HKUST-1 [30], and ZIF-67 [31] were created using the aforementioned process. Because of increasing concerns about fossil fuels, climate changes, and carbon dioxide emissions, various alternatives such as sustainable and clean energy sources attracted great attention [32,33]. In this way, the high energy density and high combustion heat of hydrogen make it a promising and fascinating fuel source [34]. Thus, producing hydrogen on a wide scale and cheaply could serve as a substitute for fossil fuels [35,36]. This phenomenon caused numerous attempts to use various electrodes for the hydrogen evolution reaction (HER) as well as the introduction of various types of affordable MOFs [37,38]. Additionally, a variety of materials can be utilized as the substrate, however, nickel metal and foam are regarded as affordable HER catalysts and stable substrates in various electrolytes, respectively [39,40]. The low cost and 3D interconnected porous structure of nickel foam with 99% porosity makes it appropriate for sufficient electrical conductivity with a resistance of 69 nΩ/m [41]. Hence, these aspects lead to a larger surface area and better contact of active materials to the electrolyte which can improve the diffusion of the electrolyte and reduce the agglomeration of electrocatalysts [42,43]. Additionally, due to the existence of metal frames inside of the substrate, the electron transfer length is shorter than the 2D type substrate where the substrate is at the back side of all active materials [44]. Therefore, the combination of MOF and Ni foam can enhance their catalytic activity for HER process and enable their use as electrocatalyst because of the high porosity and wide surface area in the structure of MOF. It should be noticed that various noble metal-based electrocatalysts are used for this goal due to their particular activity and better availability, but their high cost and scarcity limit their further application. Thus, earth-abundant transition metal (e.g.: Ni, Co, …) based electrocatalysts are considered as outstanding alternatives for these materials because they can present high catalytic activity with high specific surface area [45,46]. Hence, this study presented new techniques for the uniform electrosynthesis of MOF while maintaining the porous skeleton of the nickel foam as working and graphite sheet as cheap counter electrodes, respectively. So, for the first time, two electrochemical techniques (CV and LSV) were used for MOF electrosynthesis and were compared. In addition, 1,3,5-benzene tricarboxylic acid (BTC) (98%) and tributyl methylammonium methyl sulfate (MTBS) (99%) were used as organic linkers to obtain Ni3(BTC)2 ( Scheme 1). Then, based on this composition and techniques, plate-shaped and homogeneous NiBTC MOF nanostructures were prepared by the LSV method which has been verified by FESEM results and performed best as an electrocatalyst in the HER procedure in an alkaline media. Also, important parameters such as scan rate and voltage ranges were optimized during the project. 2 Experimental 2.1 Materials 1,3,5-benzene tricarboxylic acid (BTC) and tributyl methylammonium methyl sulfate (MTBS) were obtained from Acros (Belgium) and Kimiaexir (Iran), respectively. Nickel foam (> 99%) was purchased from Nano-bazar (Iran). Also, absolute ethanol (99%), sodium hydroxide, and hydrochloric acid (37%) were prepared from Merck (Germany). Additionally, deionized water was used for the H2O-EtOH solution. All materials were utilized without further purification and had analytical grades. 2.2 Apparatus and software Electrochemical studies were done by the potentiostat/galvanostat model of Autolab PGSTAT30 (Echo Chemie, B.V. ααand the Netherlands) and the software was Nova version 1.11. Also, impedance analysis was performed by ZView software to obtain an equivalent circuit. The three-electrode system consisted of Ni foam and graphite sheet with a surface area of 0.5 cm2 as working and counter electrodes, respectively accompanied by Ag/AgCl (3 M KCl) as reference electrode were used for electrosynthesis of MOF. Moreover, HER processes were performed with the three-electrode system including bare Ni and NiBTC/Ni foams as the working electrodes with a surface area of 0.5 cm2, Ag/AgCl (3 M KCl) and Pt rod as reference and counter electrodes, respectively. Nickel foams were immersed in HCl (1 M) in an ultrasonic bath for 5 min, and then they were washed with deionized water and absolute ethanol to remove the surface oxide layer. X-ray diffraction (XRD) analysis was done at ambient temperature (25 °C) by X-ray diffractometer model of Bruker D8 advance (Germany) by Cu–Kα radiation source (λ = 1.5418 Å) generated at 40 kV and 25 mA, and the step time of 0.06°/s. Then, FTIR spectra were taken between 400 and 4000 cm−1 with a Shimadzu S8400 FTIR spectrophotometer. Furthermore, Field emission scanning electron microscopy (FESEM) figures were obtained by the FESEM instrument model of VEGA/TESCAN (Czech Republic). Moreover, Brunauer–Emmett–Teller (BET) nitrogen adsorption–desorption measurement was done at 77 K by the BET instrument model of ASAPT micropolitics 2020. 2.3 Electrochemical synthesis of MOF Synthesis of Ni3(BTC)2 was carried out by electrochemical techniques. These techniques were done in the potentiostatic module. Then, the synthesis solution was obtained by dissolving 15 mmol of BTC and 33 mmol of MTBS in 100 mL of EtOH/H2O (with a ratio of 70:30 for EtOH/H2O based on ref [27]). 3 mL of this solution was used for the electrosynthesis of NiBTC MOF. For the cyclic voltammetry test, 0–3 V was used as the potential range accompanied by different scan rates (5, 10, 25 mV/s, cycle number = 1, 5). Also, during LSV, two potential ranges between 0 and 3 V and 0–5 V with three scan rates of 0.5, 1, and 2 mV/s were applied. Table 1 depicts the nomenclature of synthesized electrodes. After the synthesis, the NiBTC/Ni foam was mildly washed with ethanol. For FESEM images, XRD analysis, and FTIR spectroscopy, the samples were dried under the vacuum at 60 °C for 12 h. 3 Results and discussion 3.1 Surface morphology and elemental analysis To characterize MOF morphology on Ni foam, some FESEM images were obtained. First of all, cyclic voltammetry was performed to deposit MOF nanoparticles. Thus, different procedures were programmed to synthesize the MOF, and two important parameters such as scan rate and cycle number were investigated during the processes. It should be noted that all CV tests were performed from 0 to 3 V. Then, 5 mV/s was used for 1 and 5-cycle numbers. As exhibited in Fig. 1a, needle-like NiBTC was obtained by CV test, and increasing the number of cycles not only did not make a homogeneous structure but also led to brittle morphology and exfoliated MOF particles (Fig. S1). Also, this phenomenon happened with utilizing 10 and 25 mV/s as scan rates and nonuniform MOF structure was obtained which resulted in cracking on the particles and unsuitable elemental distribution (Fig. 1b, c). This form of precipitation can ban the penetration of electrolytes to the network of Ni foam and prohibit further application of this composition. In addition, oxidation and reduction of MOF nanoparticles during potential scanning at CV tests reduced the cohesion of active materials and their adhesion to the substrate (Fig. S2, S3). Then, some LSV tests were examined with variations in two parameters such as potential range and scan rate. According to this procedure, different LSV tests were examined by 0.5 and 1 mV/s during 0–3 and 5 V, respectively which illustrated the blocking of Ni foam porosity and unsuitable coverage of the substrate (Fig. 1d, e and S4, S5). Therefore, the LSV test was applied from 0 to 3 V with 2 mV/s to electrosynthesis of NiBTC. As it is obvious in Fig. 1f and g, suitable coverage of MOF particles was obtained by this method that provided sufficient availability of the electrolyte to the Ni foam. In addition, the plate-like morphology of active materials can enhance the surface area and supply appropriate elemental distribution (Fig. 1h). The origin of sulfur was attributed to MTBS which acted as an organic linker. Also, the effect of increasing potential up to 5 V was examined which led to needle-like NiBTC particles and deterioration of nickel foam without sufficient adhesion of active materials to the substrate (Fig. S6). Thus, according to FESEM results and to obtain a thin layer of NiBTC on Ni foam, the LSV method during 0–3 V with 2 mV/s resulted in the best performance. Moreover, transmission electron microscopy (TEM) was performed to interpret the morphology and nanostructure of the LSV3 electrode. As it is obvious in Figs. 2a to 2d with different magnifications, the nanostructure of MOF materials was obtained by the LSV method which provides sufficient porosity. The high-resolution TEM (HRTEM) reveals the formation of nanoparticles in Figs. 2e to 2 g. According to Fig. 2 h, distinct fringes with interplanar spacings of 0.351 nm (region A) and 0.220 nm (region B) are observed which correspond to [021] and [022] planes, respectively. Additionally, the interplanar spacings of 0.206 nm (region C) and 0.293 nm (region D) are attributed to [331] and [202] planes of NiBTC MOF, respectively. These results are in accordance with XRD spectra and confirm the nanoporous structure of the LSV3 electrode. 3.2 XRD analysis XRD analysis was performed to characterize the purity and crystallinity of the product obtained by LSV. In this way, the modified Ni foams by NiBTC with different scan rates were compared by references [47,48] and as demonstrated in Fig. 3, the most suitable correlation between resulted in NiBTC/Ni was observed by applying 2 mV/s for electrosynthesis of MOF nanoparticles in comparison to other scan rates. As illustrated in other patterns, different peaks not only implied the presence of non-purity in the product but also showed non-sufficient crystallinity of the MOF nanoparticles. Major peaks found at 2θ of 17.29, 20.57, 21.89, 22.37, 24.97, 31.69, 33.37, 38.05, and 38.25° which corresponded to [111], [220], [111], [021], [400], [202], [112], [022] and [331] crystal planes, respectively. Slight deviations observed in the synthesized NiBTC pattern were acceptable in XRD analysis. This composition consists of zigzag chains of tetra-aqua nickel (II) benzene dicarboxylate which creates hydrogen bonding to fabricate a 3D network [47]. The crystallite size has been computed by Debye-Scherer’s equation: (1) D = K λ β cos θ Based on this equation, D, K, λ, β, θ correspond to crystallite size, Scherer’s constant, wavelength of X-ray, full-width half maxima of a diffraction peak, and diffraction angle, respectively [49,50]. Table S1 shows corresponding parameters calculated by this equation which confirmed the formation of NiBTC MOF nanostructure synthesized by LSV3. 3.3 FTIR analysis FTIR analysis was carried out and admitted the formation of NiBTC on Ni foam for LSV3 in Fig. 4 [29,51,52]. The observed peak at 724 cm−1 is ascribed to the stretching vibration of Ni-O. Moreover, other peaks at 753 and 1089 cm−1 are due to in-plane as well as out-of-plane deformation vibration of the C-H groups and stretching vibration of C-C groups in the benzene ring, respectively [49]. The appeared peak at 1375 cm−1 refers to the stretching vibration of C-O in the carboxyl group. Also, the peak at 1437 cm−1 is attributed to O-H bending vibration which is due to the presence of the carboxylic acid group in the structure as the linker of MOF. It should be mentioned that because of the stretching vibration of CO and the bathochromic effect, the resulting peak at 1720 cm−1 in H3BTC is observed at 1625 cm−1 [29]. Furthermore, the broad peak at 2800–3700 cm−1 implied the coordinated water molecules in Ni3(BTC)2. 3.4 BET analysis To investigate the inherent morphology and surface area of modified Ni foam with NiBTC (LSV3), the N2 adsorption/desorption was performed. N2 isotherm and volume pores (BJH) demonstrated in Fig. 5 exhibited that the synthesized NiBTC has an IV-type isotherm which implied the mesoporous network of MOF. Moreover, the H3-type hysteresis depicted the slit model for this loop. This isotherm exhibited no limitation for adsorption in high pressure of P/P 0 which is the reason for the non-brittle deposition of MOF nanoparticles [53]. According to pore volume distribution, the average pore size is equal to 3.91 nm. Also, 32.011 m2/g as surface area was obtained for BET in addition to 28.711 mm3/g as pore volume which is much higher than the reference [29] based on Table S2. 3.5 Application in HER The NiBTC/Ni foams obtained by CV and LSV methods were employed for the HER in NaOH solution (0.1 M). These tests were performed at room temperature with a scan rate of 5 mV/s. It should be noted that the potential versus reversible hydrogen electrode (RHE) was calculated via this equation: (2) E RHE = E Ref + 0·059 pH + E 0 Ref As it is obvious in Fig. 6a, the modified Ni foam by the LSV3 has higher current density and lower onset potential than the others which illustrates the uniform morphology of MOF precipitations and implies that the presence of NiBTC on Ni foam can promote the performance of HER. Table S3 shows the data obtained from the LSV and Tafel plots (Fig. 6b). As demonstrated in this Table, among the modified electrodes, the LSV3 has a lower Tafel slope which indicates the higher kinetic for the HER on this electrode due to the great surface area obtained by the LSV method. This reason causes the reactions to be performed comfortably [54,55]. Also, this electrode has the lowest overvoltage (η) at 5 and 10 mA/cm2. Also, the EIS was performed to investigate the magnitude of charge transfer resistance for HER in the bare and modified Ni foam (Fig. 6c). In this project, the EIS was conducted in a frequency range of 105-10−1 Hz and applying −1.1 V DC potential with the amplitude of 0.01 V. Table S4 reveals the comparison of different parameters based on fitting Nyquist plot and Randle’s circuit. In this circuit, CPE is a constant phase element and R s depicts the solution resistance. As demonstrated in Table S4, the charge transfer resistance (R CT ) of HER for LSV3 in alkaline media is 3 times lower than bare Ni foam which again exhibited the great effect of NiBTC in the evolution of hydrogen atoms. Moreover, the greater magnitude of electrochemical capacitance for NiBTC/Ni is attributed to the promoted active surface area. One of the best strategies to determine the stability of the electrode in HER is employing the chronopotentiometry technique. Thus, − 20 mA/cm2 was applied to modified Ni foam by LSV3 in alkaline media for 30 h. As shown in Fig. 6d, the potential of the modified electrode didn’t alter after 30 h which exhibited suitable stability and robustness of the modified electrode. Hence, as illustrated in Fig. 7, the electrode morphology was examined after the CP test and active materials on the surface had suitable adhesion to the substrate with sufficient elemental distribution. The comparison between onset potentials in this study can be observed in Table S5 which depicts the predominance of the LSV method over the others [56–59]. It should be noted that the C dl of bare Ni foam and modified NiBTC/Ni foams were determined by Eq. 3 [55] and applying cyclic voltammograms at different scan rates ( Fig. 8): (3) C dl = Δj / υ Based on this equation, υ depicted as the value of scan rate and Δj is the difference between anodic and cathodic current densities. Fig. 9 illustrates the plot of Δj vs. υ to determine the magnitude of ECSA based on Eq. 4 : (4) ECSA = C dl / C s where C s is the specific surface capacitance (20 µF/cm2). Since, ECSA is proportion to C dl , a larger amount of C dl demonstrates an increase in ECSA which is due to the improvement of active sites in the substrate. Therefore, based on Fig. 9, the LSV3 electrode can promote surface activity. The C dl values for bare and modified Ni foams are presented in Table S6. 4 Conclusion During this project, different electrochemical methods were compared together to form a thin layer of Ni3(BTC)2 on Ni foam (at room temperature and short synthesis time), thus, the LSV technique with 2 mV/s during 0–3 V resulted in the best consequence. Moreover, no blocking of cavities was found on Ni foam based on FESEM results. After electrosynthesis of MOF on Ni foam, its performance in HER procedure compared with the bare and other modified Ni foams depicted the great potential of LSV3. Also, the current density and onset potential of the optimal electrode were higher and lower than the others, respectively. Furthermore, R CT for LSV3 in alkaline media is 3 times lower than bare Ni foam. In addition, according to the CP test, the stability of the optimal electrode is satisfactory and obviously, the current density for modified Ni foam is greater than the bare one. All of these results demonstrated that LSV3 has higher electrocatalytic activity than the others without blocking the cavities. In addition, NiBTC MOF can be used for further applications such as supercapacitors, batteries, etc. CRediT authorship contribution statement Ali Sadeghi: Formal analysis, Visualization, Validation, Writing – original draft. Ali Ghaffarinejad: Supervision, Project administration, Writing – review & editing. Declaration of Competing Interest The authors declare that they have no known competing financial interests or personal relationships that could have appeared to influence the work reported in this paper. Acknowledgment We gratefully acknowledge the partial support of this work from the Research Council of the Iran University of Science and Technology. Appendix A Supporting information Supplementary data associated with this article can be found in the online version at doi:10.1016/j.apcata.2023.119463. Appendix A Supplementary material Table S1 Supplementary material . References [1] Y.-R. Lee J. Kim W.-S. Ahn Synthesis of metal-organic frameworks: a mini review Korean J. Chem. Eng. 30 2013 1667 1680 Lee, Y.-R., J. Kim, and W.-S. Ahn, Synthesis of metal-organic frameworks: A mini review. Korean Journal of Chemical Engineering, 2013. 30: p. 1667–1680. [2] A. Muthurasu Partial selenium surface modulation of metal organic framework assisted cobalt sulfide hollow spheres for high performance bifunctional oxygen electrocatalysis and rechargeable zinc-air batteries Appl. Catal., B: Environ. 330 2023 122523 Muthurasu, A., et al., Partial selenium surface modulation of metal organic framework assisted cobalt sulfide hollow spheres for high performance bifunctional oxygen electrocatalysis and rechargeable zinc-air batteries. Applied Catalysis B: Environmental, 2023. 330. [3] I.K. Shaikhutdinov Application of metal-organic frameworks to high-performance liquid chromatography J. Anal. Chem. 78 1 2023 1 17 Shaikhutdinov, I.K., et al., Application of Metal-Organic Frameworks to High-Performance Liquid Chromatography. Journal of Analytical Chemistry, 2023. 78(1): p. 1–17. [4] C. Liu Chiral metal-organic frameworks and their composites as stationary phases for liquid chromatography chiral separation: a mini review J. Chromatogr. A 2023 464032 Liu, C., et al., Chiral metal-organic frameworks and their composites as stationary phases for liquid chromatography chiral separation: A minireview. Journal of Chromatography A, 2023: p. 464032. [5] W. Gong Creating optimal pockets in a clathrochelate-based metal–organic framework for gas adsorption and separation: experimental and computational studies J. Am. Chem. Soc. 144 8 2022 3737 3745 Gong, W., et al., Creating optimal pockets in a clathrochelate-based metal–organic framework for gas adsorption and separation: experimental and computational studies. Journal of the American Chemical Society, 2022. 144(8): p. 3737–3745. [6] Y. Li Flexible metal–organic frameworks for gas storage and separation Dalton Trans. 51 12 2022 4608 4618 Li, Y., et al., Flexible metal–organic frameworks for gas storage and separation. Dalton Transactions, 2022. 51(12): p. 4608–4618. [7] B. Maranescu A. Visa Applications of metal-organic frameworks as drug delivery systems Int. J. Mol. Sci. 23 8 2022 4458 Maranescu, B. and A. Visa, Applications of metal-organic frameworks as drug delivery systems. International journal of molecular sciences, 2022. 23(8): p. 4458. [8] S. Mallakpour E. Nikkhoo C.M. Hussain Application of MOF materials as drug delivery systems for cancer therapy and dermal treatment Coord. Chem. Rev. 451 2022 214262 Mallakpour, S., E. Nikkhoo, and C.M. Hussain, Application of MOF materials as drug delivery systems for cancer therapy and dermal treatment. Coordination Chemistry Reviews, 2022. 451: p. 214262. [9] H. Wei Metal–Organic Framework (MOF) derivatives as promising chemiresistive gas sensing materials: a review Int. J. Environ. Res. Public Health 20 5 2023 4388 Wei, H., et al., Metal–Organic Framework (MOF) derivatives as promising chemiresistive gas sensing materials: A Review. International Journal of Environmental Research and Public Health, 2023. 20(5): p. 4388. [10] A. Zuliani N. Khiar C. Carrillo-Carrión Recent progress of metal–organic frameworks as sensors in (bio) analytical fields: towards real-world applications Anal. Bioanal. Chem. 415 11 2023 2005 2023 Zuliani, A., N. Khiar, and C. Carrillo-Carrión, Recent progress of metal–organic frameworks as sensors in (bio) analytical fields: towards real-world applications. Analytical and Bioanalytical Chemistry, 2023. 415(11): p. 2005–2023. [11] K.A. Adegoke N.W. Maxakato Electrocatalytic CO2 conversion on metal-organic frameworks derivative electrocatalysts J. CO2 Util. 69 2023 102412 Adegoke, K.A. and N.W. Maxakato, Electrocatalytic CO2 conversion on metal-organic frameworks derivative electrocatalysts. Journal of CO2 Utilization, 2023. 69: p. 102412. [12] B. Devi R.R. Koner S. Kurungot Recent advances in the metal-organic framework-based electrocatalysts for trifunctional electrocatalysis Dalton Trans 51 2022 13573 13590 Devi, B., R.R. Koner, and S. Kurungot, Recent advances in the metal-organic framework-based electrocatalysts for trifunctional electrocatalysis. Dalton Transactions, 2022. [13] G. Mo Artificial and semi‐artificial photosynthesis (AP and SAP) systems based on metal‐organic frameworks Chin. J. Chem. 41 3 2023 335 354 Mo, G., et al., Artificial and Semi‐artificial Photosynthesis (AP and SAP) Systems Based on Metal‐Organic Frameworks. Chinese Journal of Chemistry, 2023. 41(3): p. 335–354. [14] Y. Peng Metal-organic framework (MOF) composites as promising materials for energy storage applications Adv. Colloid Interface Sci. 307 2022 102732 Peng, Y., et al., Metal-organic framework (MOF) composites as promising materials for energy storage applications. Advances in Colloid and Interface Science, 2022. 307: p. 102732. [15] B. He Freestanding metal–organic frameworks and their derivatives: an emerging platform for electrochemical energy storage and conversion Chem. Rev. 122 11 2022 10087 10125 He, B., et al., Freestanding metal–organic frameworks and their derivatives: an emerging platform for electrochemical energy storage and conversion. Chemical Reviews, 2022. 122(11): p. 10087–10125. [16] A.A. Bhoite Solvothermal synthesis of binder free Ni-MOF thin films for supercapacitor electrodes J. Solid State Chem. 326 2023 124192 Bhoite, A.A., et al., Solvothermal synthesis of binder free Ni-MOF thin films for supercapacitor electrodes. Journal of Solid State Chemistry, 2023. 326. [17] R. Zheng The growth mechanism of a conductive MOF thin film in spray-based layer-by-layer liquid phase epitaxy Angew. Chem. Int. Ed. Engl. 61 43 2022 e202212797 Zheng, R., et al., The Growth Mechanism of a Conductive MOF Thin Film in Spray-based Layer-by-layer Liquid Phase Epitaxy. Angew Chem Int Ed Engl, 2022. 61(43): p. e202212797. [18] X. Zhu Metal organic framework enabled wood evaporator for solar-driven water purification Sep. Purif. Technol. 281 2022 119912 Zhu, X., et al., Metal organic framework enabled wood evaporator for solar-driven water purification. Separation and Purification Technology, 2022. 281. [19] P.T. Phan The properties of microwave-assisted synthesis of metal-organic frameworks and their applications Nanomaterials 13 2 2023 352 Phan, P.T., et al., The Properties of Microwave-Assisted Synthesis of Metal-Organic Frameworks and Their Applications. Nanomaterials (Basel), 2023. 13(2). [20] Y. Li Synthesis and shaping of metal-organic frameworks: a review Chem. Commun. 58 82 2022 11488 11506 Li, Y., et al., Synthesis and shaping of metal-organic frameworks: a review. Chem Commun (Camb), 2022. 58(82): p. 11488–11506. [21] S. Alizadeh D. Nematollahi Electrochemically assisted self-assembly technique for the fabrication of mesoporous metal-organic framework thin films: composition of 3D Hexagonally packed crystals with 2D honeycomb-like mesopores J. Am. Chem. Soc. 139 13 2017 4753 4761 Alizadeh, S. and D. Nematollahi, Electrochemically Assisted Self-Assembly Technique for the Fabrication of Mesoporous Metal-Organic Framework Thin Films: Composition of 3D Hexagonally Packed Crystals with 2D Honeycomb-like Mesopores. J Am Chem Soc, 2017. 139(13): p. 4753–4761. [22] H. Jia Facile preparation of Ni nanoparticle embedded on mesoporous carbon nanorods for non-enzymatic glucose detection J. Colloid Interface Sci. 583 2021 310 320 Jia, H., et al., Facile preparation of Ni nanoparticle embedded on mesoporous carbon nanorods for non-enzymatic glucose detection. J Colloid Interface Sci, 2021. 583: p. 310–320. [23] N. Campagnol On the electrochemical deposition of metal–organic frameworks J. Mater. Chem. A 4 10 2016 3914 3925 Campagnol, N., et al., On the electrochemical deposition of metal–organic frameworks. Journal of Materials Chemistry A, 2016. 4(10): p. 3914–3925. [24] H. Ren T.W Electrochemical synthesis methods of metal‐organic frameworks and their environmental analysis applications: a review ChemElectroChem 9 13 2022 e202200196 H. Ren, T.W., Electrochemical Synthesis Methods of Metal‐Organic Frameworks and Their Environmental Analysis Applications: A Review. ChemElectroChem, 2022. [25] A. Ghoorchian Electrochemical synthesis of MOFs Metal-Organic Frameworks for Biomedical Applications 2020 Woodhead Publishing 177 195 Ghoorchian, A., et al., Electrochemical synthesis of MOFs, in Metal-Organic Frameworks for Biomedical Applications. 2020, Elsevier. p. 177–195. [26] H. Al-Kutubi Electrosynthesis of metal-organic frameworks: challenges and opportunities ChemElectroChem 2 4 2015 462 474 Al-Kutubi, H., et al., Electrosynthesis of Metal-Organic Frameworks: Challenges and Opportunities. ChemElectroChem, 2015. 2(4): p. 462–474. [27] A. Martinez Joaristi Electrochemical synthesis of some archetypical Zn2+, Cu2+, and Al3+ metal organic frameworks Cryst. Growth Des. 12 7 2012 3489 3498 Martinez Joaristi, A., et al., Electrochemical Synthesis of Some Archetypical Zn2+, Cu2+, and Al3+ Metal Organic Frameworks. Crystal Growth & Design, 2012. 12(7): p. 3489–3498. [28] N. Campagnol High pressure, high temperature electrochemical synthesis of metal–organic frameworks: films of MIL-100 (Fe) and HKUST-1 in different morphologies J. Mater. Chem. A 1 19 2013 5827 5830 Campagnol, N., et al., High pressure, high temperature electrochemical synthesis of metal–organic frameworks: films of MIL-100 (Fe) and HKUST-1 in different morphologies. Journal of Materials Chemistry A, 2013. 1(19). [29] S. Jabarian A. Ghaffarinejad Electrochemical synthesis of NiBTC metal organic framework thin layer on nickel foam: An efficient electrocatalyst for the hydrogen evolution reaction J. Inorg. Organomet. Polym. Mater. 29 5 2019 1565 1574 Jabarian, S. and A. Ghaffarinejad, Electrochemical Synthesis of NiBTC Metal Organic Framework Thin Layer on Nickel Foam: An Efficient Electrocatalyst for the Hydrogen Evolution Reaction. Journal of Inorganic and Organometallic Polymers and Materials, 2019. 29(5): p. 1565–1574. [30] Y. Ai Electrosynthesis of HKUST-1 on a carbon-nanotube-modified electrode and its application for detection of dihydroxybenzene isomers J. Electroanal. Chem. 872 2020 114161 Ai, Y., et al., Electrosynthesis of HKUST-1 on a carbon-nanotube-modified electrode and its application for detection of dihydroxybenzene isomers. Journal of Electroanalytical Chemistry, 2020. 872. [31] Z. Li Electrosynthesis of well-defined metal-organic framework films and the carbon nanotube network derived from them toward electrocatalytic applications ACS Appl. Mater. Interfaces 10 40 2018 34494 34501 Li, Z., et al., Electrosynthesis of Well-Defined Metal-Organic Framework Films and the Carbon Nanotube Network Derived from Them toward Electrocatalytic Applications. ACS Appl Mater Interfaces, 2018. 10(40): p. 34494–34501. [32] D. Han Facile synthesis of Co-Ni layered double hydroxides nanosheets wrapped on a prism-like metal-organic framework for efficient oxygen evolution reaction J. Colloid Interface Sci. 634 2023 14 21 Han, D., et al., Facile synthesis of Co-Ni layered double hydroxides nanosheets wrapped on a prism-like metal-organic framework for efficient oxygen evolution reaction. J Colloid Interface Sci, 2023. 634: p. 14–21. [33] S.M. Ji Metal-organic framework assisted vanadium oxide nanorods as efficient electrode materials for water oxidation J. Colloid Interface Sci. 618 2022 475 482 Ji, S.M., et al., Metal-organic framework assisted vanadium oxide nanorods as efficient electrode materials for water oxidation. J Colloid Interface Sci, 2022. 618: p. 475–482. [34] K. Chhetri Engineering the abundant heterointerfaces of integrated bimetallic sulfide-coupled 2D MOF-derived mesoporous CoS2 nanoarray hybrids for electrocatalytic water splitting Mater. Today Nano 17 2022 100146 Chhetri, K., et al., Engineering the abundant heterointerfaces of integrated bimetallic sulfide-coupled 2D MOF-derived mesoporous CoS2 nanoarray hybrids for electrocatalytic water splitting. Materials Today Nano, 2022. 17. [35] S.E. Hosseini Hydrogen has found its way to become the fuel of the future Future Energy 1 3 2022 11 12 Hosseini, S.E., Hydrogen has found its way to become the fuel of the future. Future Energy, 2022. 1(3): p. 11–12. [36] X. Xu Q. Zhou D. Yu The future of hydrogen energy: bio-hydrogen production technology Int. J. Hydrog. Energy 47 79 2022 33677 33698 Xu, X., Q. Zhou, and D. Yu, The future of hydrogen energy: Bio-hydrogen production technology. International Journal of Hydrogen Energy, 2022. 47(79): p. 33677–33698. [37] A.J. Clough Two-dimensional metal-organic surfaces for efficient hydrogen evolution from water J. Am. Chem. Soc. 137 1 2015 118 121 Clough, A.J., et al., Two-dimensional metal-organic surfaces for efficient hydrogen evolution from water. J Am Chem Soc, 2015. 137(1): p. 118–121. [38] F. Ming MOF-derived Co-doped nickel selenide/C electrocatalysts supported on Ni foam for overall water splitting J. Mater. Chem. A 4 39 2016 15148 15155 Ming, F., et al., MOF-derived Co-doped nickel selenide/C electrocatalysts supported on Ni foam for overall water splitting. Journal of Materials Chemistry A, 2016. 4(39): p. 15148–15155. [39] J. Lu Metal Nickel Foam as an efficient and stable electrode for hydrogen evolution reaction in acidic electrolyte under reasonable overpotentials ACS Appl. Mater. Interfaces 8 8 2016 5065 5069 Lu, J., et al., Metal Nickel Foam as an Efficient and Stable Electrode for Hydrogen Evolution Reaction in Acidic Electrolyte under Reasonable Overpotentials. ACS Appl Mater Interfaces, 2016. 8(8): p. 5065–5069. [40] J.D. Gojgić Hydrogen evolution at Ni foam electrodes and Ni-Sn coated Ni foam electrodes Appl. Catal. A: Gen. 663 2023 119312 Gojgić, J.D., et al., Hydrogen evolution at Ni foam electrodes and Ni-Sn coated Ni foam electrodes. Applied Catalysis A: General, 2023. 663. [41] American Elements. 2023; Available from: https://www.americanelements.com/nickel-foam-7440–02-0. [42] X. Ke Surface engineering of commercial Ni foams for stable Li metal anodes Energy Storage Mater. 23 2019 547 555 Ke, X., et al., Surface engineering of commercial Ni foams for stable Li metal anodes. Energy Storage Materials, 2019. 23: p. 547–555. [43] M.R. Kandel Hybridized bimetallic phosphides of Ni–Mo, Co–Mo, and Co–Ni in a single ultrathin-3D-nanosheets for efficient HER and OER in alkaline media Compos. Part B: Eng. 239 2022 109992 Kandel, M.R., et al., Hybridized bimetallic phosphides of Ni–Mo, Co–Mo, and Co–Ni in a single ultrathin-3D-nanosheets for efficient HER and OER in alkaline media. Composites Part B: Engineering, 2022. 239. [44] G.F. Yang K.Y. Song S.K. Joo A metal foam as a current collector for high power and high capacity lithium iron phosphate batteries J. Mater. Chem. A 2 46 2014 19648 19652 Yang, G.F., K.Y. Song, and S.K. Joo, A metal foam as a current collector for high power and high capacity lithium iron phosphate batteries. J. Mater. Chem. A, 2014. 2(46): p. 19648–19652. [45] M.R. Kandel Unique heterointerface engineering of Ni2P−MnP nanosheets coupled Co2P nanoflowers as hierarchical dual-functional electrocatalyst for highly proficient overall water-splitting Appl. Catal. B: Environ. 331 2023 122680 Kandel, M.R., et al., Unique heterointerface engineering of Ni2P−MnP nanosheets coupled Co2P nanoflowers as hierarchical dual-functional electrocatalyst for highly proficient overall water-splitting. Applied Catalysis B: Environmental, 2023. 331. [46] J. Zhang Facile synthesis of Co-Fe layered double hydroxide nanosheets wrapped on Ni-doped nanoporous carbon nanorods for oxygen evolution reaction J. Colloid Interface Sci. 650 2023 816 824 Zhang, J., et al., Facile synthesis of Co-Fe layered double hydroxide nanosheets wrapped on Ni-doped nanoporous carbon nanorods for oxygen evolution reaction. J Colloid Interface Sci, 2023. 650(Pt A): p. 816–824. [47] A. Azadbakht A.R. Abbasi N. Noori Layer-by-layer synthesis of nanostructure NiBTC porous coordination polymer for iodine removal from wastewater J. Inorg. Organomet. Polym. Mater. 26 2 2016 479 487 Azadbakht, A., A.R. Abbasi, and N. Noori, Layer-by-Layer Synthesis of Nanostructure NiBTC Porous Coordination Polymer for Iodine Removal from Wastewater. Journal of Inorganic and Organometallic Polymers and Materials, 2016. 26(2): p. 479–487. [48] O. Yaghi H. Li T. Groy Construction of porous solids from hydrogen-bonded metal complexes of 1, 3, 5-benzenetricarboxylic acid J. Am. Chem. Soc. 118 38 1996 9096 9101 Yaghi, O., H. Li, and T. Groy, Construction of porous solids from hydrogen-bonded metal complexes of 1, 3, 5-benzenetricarboxylic acid. Journal of the American Chemical Society, 1996. 118(38): p. 9096–9101. [49] N. Nirmal Synthesis and characterization of Ni-BTC MOF for supercapacitor electrode AIP Conf. Proc. 2265 1 2020 030617 N. Nirmal, et al., Synthesis and characterization of Ni-BTC MOF for supercapacitor electrode, AIP Conference Proceedings 2265(1) (2020) 030617. [50] M. Sivagami I. Asharani Phyto-mediated Ni/NiO NPs and their catalytic applications-a short review Inorg. Chem. Commun. 145 2022 110054 Sivagami, M. and I. Asharani, Phyto-mediated Ni/NiO NPs and their catalytic applications-a short review. Inorganic Chemistry Communications, 2022: p. 110054. [51] W.W. Lestari I.D. Winarni F. Rahmawati Electrosynthesis of metal-organic frameworks (MOFs)based on Nickel(II) and benzene 1,3,5-tri carboxylic Acid (H3BTC): an optimization reaction condition IOP Conf. Ser.: Mater. Sci. Eng. 172 1 2017 012064 Lestari, W.W., I.D. Winarni, and F. Rahmawati, Electrosynthesis of Metal-Organic Frameworks (MOFs)Based on Nickel(II) and Benzene 1,3,5-Tri Carboxylic Acid (H3BTC): An Optimization Reaction Condition. IOP Conference Series: Materials Science and Engineering, 2017. 172. [52] F. Israr Scope of various solvents and their effects on solvothermal synthesis of Ni-BTC Quím. Nova 39 2016 669 675 Israr, F., et al., SCOPE OF VARIOUS SOLVENTS AND THEIR EFFECTS ON SOLVOTHERMAL SYNTHESIS OF Ni-BTC. Química Nova, 2016. [53] Z. Alothman A review: fundamental aspects of silicate mesoporous materials Materials 5 12 2012 2874 2902 Alothman, Z., A Review: Fundamental Aspects of Silicate Mesoporous Materials. Materials, 2012. 5(12): p. 2874–2902. [54] D. Voiry Low-dimensional catalysts for hydrogen evolution and CO2 reduction Nat. Rev. Chem. 2 1 2018 0105 Voiry, D., et al., Low-dimensional catalysts for hydrogen evolution and CO2 reduction. Nature Reviews Chemistry, 2018. 2(1): p. 0105. [55] A. Abdollahi A. Ghaffarinejad M. Arabi Electrodeposition of Ni - Fe on graphite rod as an efficient and binder-free electrocatalyst for oxygen and hydrogen evolution reactions J. Alloy. Compd. 937 2023 168400 Abdollahi, A., A. Ghaffarinejad, and M. Arabi, Electrodeposition of Ni - Fe on graphite rod as an efficient and binder-free electrocatalyst for oxygen and hydrogen evolution reactions. Journal of Alloys and Compounds, 2023. 937. [56] J.-B. Raoof MOF-derived Cu/nanoporous carbon composite and its application for electro-catalysis of hydrogen evolution reaction Energy 90 2015 1075 1081 Raoof, J.-B., et al., MOF-derived Cu/nanoporous carbon composite and its application for electro-catalysis of hydrogen evolution reaction. Energy, 2015. 90: p. 1075–1081. [57] J.S. Qin Ultrastable polymolybdate-based metal-organic frameworks as highly active electrocatalysts for hydrogen generation from water J. Am. Chem. Soc. 137 22 2015 7169 7177 Qin, J.S., et al., Ultrastable Polymolybdate-Based Metal-Organic Frameworks as Highly Active Electrocatalysts for Hydrogen Generation from Water. J Am Chem Soc, 2015. 137(22): p. 7169–7177. [58] X. Dai Molybdenum polysulfide anchored on Porous Zr-metal organic framework to enhance the performance of hydrogen evolution reaction J. Phys. Chem. C. 120 23 2016 12539 12548 Dai, X., et al., Molybdenum Polysulfide Anchored on Porous Zr-Metal Organic Framework To Enhance the Performance of Hydrogen Evolution Reaction. The Journal of Physical Chemistry C, 2016. 120(23): p. 12539–12548. [59] I. Hod A porous proton-relaying metal-organic framework material that accelerates electrochemical hydrogen evolution Nat. Commun. 6 1 2015 8304 Hod, I., et al., A porous proton-relaying metal-organic framework material that accelerates electrochemical hydrogen evolution. Nat Commun, 2015. 6: p. 8304.",
      "scopus-id": "85174689584",
      "coredata": {
        "eid": "1-s2.0-S0926860X2300443X",
        "dc:description": "In this study, for the first time two electrochemical synthesis techniques including cyclic voltammetry (CV) and linear sweep voltammetry (LSV) were used for MOF synthesis. The Ni3(BTC)2 electrocatalyst was synthesized and deposited without any binder, for a short time and at ambient temperature on the nickel foam substrate. Morphology studies showed that the LSV method leads to preserving the 3D structure of nickel foam which promotes the catalytic activity. It should be noted that two parameters, such as voltage range and scan rate, were optimized during the LSV method. Moreover, X-ray diffraction (XRD) and Fourier transform infrared (FTIR) spectroscopy were used to confirm the MOF's structural integrity. Furthermore, the Brunauer-Emmett-Teller (BET) method verified the porous structure of NiBTC MOF. Additionally, the performance of bare and modified nickel foams was also examined for the hydrogen evolution reaction (HER) which demonstrated the tremendous potential of NiBTC/Ni foam in HER catalytic activity.",
        "openArchiveArticle": "false",
        "prism:coverDate": "2023-10-25",
        "openaccessUserLicense": null,
        "prism:aggregationType": "Journal",
        "prism:url": "https://api.elsevier.com/content/article/pii/S0926860X2300443X",
        "dc:creator": [
          {
            "@_fa": "true",
            "$": "Sadeghi, Ali"
          },
          {
            "@_fa": "true",
            "$": "Ghaffarinejad, Ali"
          }
        ],
        "link": [
          {
            "@_fa": "true",
            "@rel": "self",
            "@href": "https://api.elsevier.com/content/article/pii/S0926860X2300443X"
          },
          {
            "@_fa": "true",
            "@rel": "scidir",
            "@href": "https://www.sciencedirect.com/science/article/pii/S0926860X2300443X"
          }
        ],
        "dc:format": "application/json",
        "openaccessType": null,
        "pii": "S0926-860X(23)00443-X",
        "prism:volume": "667",
        "articleNumber": "119463",
        "prism:publisher": "Elsevier B.V.",
        "dc:title": "Synthesis of NiBTC metal-organic framework thin layers on nickel foam by different electrochemical methods: A comparative study for hydrogen evolution reaction",
        "prism:copyright": "© 2023 Elsevier B.V. All rights reserved.",
        "openaccess": "0",
        "prism:issn": "0926860X",
        "dcterms:subject": [
          {
            "@_fa": "true",
            "$": "Electrochemical synthesis"
          },
          {
            "@_fa": "true",
            "$": "Hydrogen evolution reaction"
          },
          {
            "@_fa": "true",
            "$": "Metal-organic framework"
          },
          {
            "@_fa": "true",
            "$": "Ni3(BTC)2"
          },
          {
            "@_fa": "true",
            "$": "Nickel foam"
          },
          {
            "@_fa": "true",
            "$": "Thin film"
          }
        ],
        "openaccessArticle": "false",
        "prism:publicationName": "Applied Catalysis A: General",
        "openaccessSponsorType": null,
        "prism:pageRange": "119463",
        "pubType": "fla",
        "prism:coverDisplayDate": "25 October 2023",
        "prism:doi": "10.1016/j.apcata.2023.119463",
        "prism:startingPage": "119463",
        "dc:identifier": "doi:10.1016/j.apcata.2023.119463",
        "openaccessSponsorName": null
      },
      "objects": {
        "object": [
          {
            "@category": "standard",
            "@height": "281",
            "@width": "678",
            "@_fa": "true",
            "$": "https://api.elsevier.com/content/object/eid/1-s2.0-S0926860X2300443X-sc1.jpg?httpAccept=%2A%2F%2A",
            "@multimediatype": "JPEG image file",
            "@type": "IMAGE-DOWNSAMPLED",
            "@size": "47270",
            "@ref": "sc1",
            "@mimetype": "image/jpeg"
          },
          {
            "@category": "standard",
            "@height": "303",
            "@width": "299",
            "@_fa": "true",
            "$": "https://api.elsevier.com/content/object/eid/1-s2.0-S0926860X2300443X-gr9.jpg?httpAccept=%2A%2F%2A",
            "@multimediatype": "JPEG image file",
            "@type": "IMAGE-DOWNSAMPLED",
            "@size": "19494",
            "@ref": "gr9",
            "@mimetype": "image/jpeg"
          },
          {
            "@category": "standard",
            "@height": "969",
            "@width": "715",
            "@_fa": "true",
            "$": "https://api.elsevier.com/content/object/eid/1-s2.0-S0926860X2300443X-gr8.jpg?httpAccept=%2A%2F%2A",
            "@multimediatype": "JPEG image file",
            "@type": "IMAGE-DOWNSAMPLED",
            "@size": "149486",
            "@ref": "gr8",
            "@mimetype": "image/jpeg"
          },
          {
            "@category": "standard",
            "@height": "185",
            "@width": "565",
            "@_fa": "true",
            "$": "https://api.elsevier.com/content/object/eid/1-s2.0-S0926860X2300443X-gr7.jpg?httpAccept=%2A%2F%2A",
            "@multimediatype": "JPEG image file",
            "@type": "IMAGE-DOWNSAMPLED",
            "@size": "35615",
            "@ref": "gr7",
            "@mimetype": "image/jpeg"
          },
          {
            "@category": "standard",
            "@height": "488",
            "@width": "678",
            "@_fa": "true",
            "$": "https://api.elsevier.com/content/object/eid/1-s2.0-S0926860X2300443X-gr6.jpg?httpAccept=%2A%2F%2A",
            "@multimediatype": "JPEG image file",
            "@type": "IMAGE-DOWNSAMPLED",
            "@size": "54601",
            "@ref": "gr6",
            "@mimetype": "image/jpeg"
          },
          {
            "@category": "standard",
            "@height": "345",
            "@width": "376",
            "@_fa": "true",
            "$": "https://api.elsevier.com/content/object/eid/1-s2.0-S0926860X2300443X-gr5.jpg?httpAccept=%2A%2F%2A",
            "@multimediatype": "JPEG image file",
            "@type": "IMAGE-DOWNSAMPLED",
            "@size": "24306",
            "@ref": "gr5",
            "@mimetype": "image/jpeg"
          },
          {
            "@category": "standard",
            "@height": "254",
            "@width": "508",
            "@_fa": "true",
            "$": "https://api.elsevier.com/content/object/eid/1-s2.0-S0926860X2300443X-gr4.jpg?httpAccept=%2A%2F%2A",
            "@multimediatype": "JPEG image file",
            "@type": "IMAGE-DOWNSAMPLED",
            "@size": "22351",
            "@ref": "gr4",
            "@mimetype": "image/jpeg"
          },
          {
            "@category": "standard",
            "@height": "582",
            "@width": "376",
            "@_fa": "true",
            "$": "https://api.elsevier.com/content/object/eid/1-s2.0-S0926860X2300443X-gr3.jpg?httpAccept=%2A%2F%2A",
            "@multimediatype": "JPEG image file",
            "@type": "IMAGE-DOWNSAMPLED",
            "@size": "39800",
            "@ref": "gr3",
            "@mimetype": "image/jpeg"
          },
          {
            "@category": "standard",
            "@height": "339",
            "@width": "678",
            "@_fa": "true",
            "$": "https://api.elsevier.com/content/object/eid/1-s2.0-S0926860X2300443X-gr2.jpg?httpAccept=%2A%2F%2A",
            "@multimediatype": "JPEG image file",
            "@type": "IMAGE-DOWNSAMPLED",
            "@size": "120806",
            "@ref": "gr2",
            "@mimetype": "image/jpeg"
          },
          {
            "@category": "standard",
            "@height": "200",
            "@width": "271",
            "@_fa": "true",
            "$": "https://api.elsevier.com/content/object/eid/1-s2.0-S0926860X2300443X-ga1.jpg?httpAccept=%2A%2F%2A",
            "@multimediatype": "JPEG image file",
            "@type": "IMAGE-DOWNSAMPLED",
            "@size": "16910",
            "@ref": "ga1",
            "@mimetype": "image/jpeg"
          },
          {
            "@category": "standard",
            "@height": "339",
            "@width": "678",
            "@_fa": "true",
            "$": "https://api.elsevier.com/content/object/eid/1-s2.0-S0926860X2300443X-gr1.jpg?httpAccept=%2A%2F%2A",
            "@multimediatype": "JPEG image file",
            "@type": "IMAGE-DOWNSAMPLED",
            "@size": "117023",
            "@ref": "gr1",
            "@mimetype": "image/jpeg"
          },
          {
            "@category": "thumbnail",
            "@height": "91",
            "@width": "219",
            "@_fa": "true",
            "$": "https://api.elsevier.com/content/object/eid/1-s2.0-S0926860X2300443X-sc1.sml?httpAccept=%2A%2F%2A",
            "@multimediatype": "GIF image file",
            "@type": "IMAGE-THUMBNAIL",
            "@size": "9109",
            "@ref": "sc1",
            "@mimetype": "image/gif"
          },
          {
            "@category": "thumbnail",
            "@height": "163",
            "@width": "161",
            "@_fa": "true",
            "$": "https://api.elsevier.com/content/object/eid/1-s2.0-S0926860X2300443X-gr9.sml?httpAccept=%2A%2F%2A",
            "@multimediatype": "GIF image file",
            "@type": "IMAGE-THUMBNAIL",
            "@size": "5663",
            "@ref": "gr9",
            "@mimetype": "image/gif"
          },
          {
            "@category": "thumbnail",
            "@height": "164",
            "@width": "121",
            "@_fa": "true",
            "$": "https://api.elsevier.com/content/object/eid/1-s2.0-S0926860X2300443X-gr8.sml?httpAccept=%2A%2F%2A",
            "@multimediatype": "GIF image file",
            "@type": "IMAGE-THUMBNAIL",
            "@size": "8440",
            "@ref": "gr8",
            "@mimetype": "image/gif"
          },
          {
            "@category": "thumbnail",
            "@height": "72",
            "@width": "219",
            "@_fa": "true",
            "$": "https://api.elsevier.com/content/object/eid/1-s2.0-S0926860X2300443X-gr7.sml?httpAccept=%2A%2F%2A",
            "@multimediatype": "GIF image file",
            "@type": "IMAGE-THUMBNAIL",
            "@size": "10389",
            "@ref": "gr7",
            "@mimetype": "image/gif"
          },
          {
            "@category": "thumbnail",
            "@height": "158",
            "@width": "219",
            "@_fa": "true",
            "$": "https://api.elsevier.com/content/object/eid/1-s2.0-S0926860X2300443X-gr6.sml?httpAccept=%2A%2F%2A",
            "@multimediatype": "GIF image file",
            "@type": "IMAGE-THUMBNAIL",
            "@size": "7363",
            "@ref": "gr6",
            "@mimetype": "image/gif"
          },
          {
            "@category": "thumbnail",
            "@height": "164",
            "@width": "179",
            "@_fa": "true",
            "$": "https://api.elsevier.com/content/object/eid/1-s2.0-S0926860X2300443X-gr5.sml?httpAccept=%2A%2F%2A",
            "@multimediatype": "GIF image file",
            "@type": "IMAGE-THUMBNAIL",
            "@size": "6291",
            "@ref": "gr5",
            "@mimetype": "image/gif"
          },
          {
            "@category": "thumbnail",
            "@height": "110",
            "@width": "219",
            "@_fa": "true",
            "$": "https://api.elsevier.com/content/object/eid/1-s2.0-S0926860X2300443X-gr4.sml?httpAccept=%2A%2F%2A",
            "@multimediatype": "GIF image file",
            "@type": "IMAGE-THUMBNAIL",
            "@size": "5411",
            "@ref": "gr4",
            "@mimetype": "image/gif"
          },
          {
            "@category": "thumbnail",
            "@height": "164",
            "@width": "106",
            "@_fa": "true",
            "$": "https://api.elsevier.com/content/object/eid/1-s2.0-S0926860X2300443X-gr3.sml?httpAccept=%2A%2F%2A",
            "@multimediatype": "GIF image file",
            "@type": "IMAGE-THUMBNAIL",
            "@size": "5509",
            "@ref": "gr3",
            "@mimetype": "image/gif"
          },
          {
            "@category": "thumbnail",
            "@height": "110",
            "@width": "219",
            "@_fa": "true",
            "$": "https://api.elsevier.com/content/object/eid/1-s2.0-S0926860X2300443X-gr2.sml?httpAccept=%2A%2F%2A",
            "@multimediatype": "GIF image file",
            "@type": "IMAGE-THUMBNAIL",
            "@size": "20813",
            "@ref": "gr2",
            "@mimetype": "image/gif"
          },
          {
            "@category": "thumbnail",
            "@height": "162",
            "@width": "219",
            "@_fa": "true",
            "$": "https://api.elsevier.com/content/object/eid/1-s2.0-S0926860X2300443X-ga1.sml?httpAccept=%2A%2F%2A",
            "@multimediatype": "GIF image file",
            "@type": "IMAGE-THUMBNAIL",
            "@size": "14731",
            "@ref": "ga1",
            "@mimetype": "image/gif"
          },
          {
            "@category": "thumbnail",
            "@height": "109",
            "@width": "219",
            "@_fa": "true",
            "$": "https://api.elsevier.com/content/object/eid/1-s2.0-S0926860X2300443X-gr1.sml?httpAccept=%2A%2F%2A",
            "@multimediatype": "GIF image file",
            "@type": "IMAGE-THUMBNAIL",
            "@size": "20777",
            "@ref": "gr1",
            "@mimetype": "image/gif"
          },
          {
            "@category": "high",
            "@height": "1241",
            "@width": "2994",
            "@_fa": "true",
            "$": "https://api.elsevier.com/content/object/eid/1-s2.0-S0926860X2300443X-sc1_lrg.jpg?httpAccept=%2A%2F%2A",
            "@multimediatype": "JPEG image file",
            "@type": "IMAGE-HIGH-RES",
            "@size": "232160",
            "@ref": "sc1",
            "@mimetype": "image/jpeg"
          },
          {
            "@category": "high",
            "@height": "1350",
            "@width": "1330",
            "@_fa": "true",
            "$": "https://api.elsevier.com/content/object/eid/1-s2.0-S0926860X2300443X-gr9_lrg.jpg?httpAccept=%2A%2F%2A",
            "@multimediatype": "JPEG image file",
            "@type": "IMAGE-HIGH-RES",
            "@size": "102688",
            "@ref": "gr9",
            "@mimetype": "image/jpeg"
          },
          {
            "@category": "high",
            "@height": "4282",
            "@width": "3160",
            "@_fa": "true",
            "$": "https://api.elsevier.com/content/object/eid/1-s2.0-S0926860X2300443X-gr8_lrg.jpg?httpAccept=%2A%2F%2A",
            "@multimediatype": "JPEG image file",
            "@type": "IMAGE-HIGH-RES",
            "@size": "828686",
            "@ref": "gr8",
            "@mimetype": "image/jpeg"
          },
          {
            "@category": "high",
            "@height": "818",
            "@width": "2495",
            "@_fa": "true",
            "$": "https://api.elsevier.com/content/object/eid/1-s2.0-S0926860X2300443X-gr7_lrg.jpg?httpAccept=%2A%2F%2A",
            "@multimediatype": "JPEG image file",
            "@type": "IMAGE-HIGH-RES",
            "@size": "243084",
            "@ref": "gr7",
            "@mimetype": "image/jpeg"
          },
          {
            "@category": "high",
            "@height": "2157",
            "@width": "2994",
            "@_fa": "true",
            "$": "https://api.elsevier.com/content/object/eid/1-s2.0-S0926860X2300443X-gr6_lrg.jpg?httpAccept=%2A%2F%2A",
            "@multimediatype": "JPEG image file",
            "@type": "IMAGE-HIGH-RES",
            "@size": "254600",
            "@ref": "gr6",
            "@mimetype": "image/jpeg"
          },
          {
            "@category": "high",
            "@height": "1524",
            "@width": "1663",
            "@_fa": "true",
            "$": "https://api.elsevier.com/content/object/eid/1-s2.0-S0926860X2300443X-gr5_lrg.jpg?httpAccept=%2A%2F%2A",
            "@multimediatype": "JPEG image file",
            "@type": "IMAGE-HIGH-RES",
            "@size": "120706",
            "@ref": "gr5",
            "@mimetype": "image/jpeg"
          },
          {
            "@category": "high",
            "@height": "1124",
            "@width": "2245",
            "@_fa": "true",
            "$": "https://api.elsevier.com/content/object/eid/1-s2.0-S0926860X2300443X-gr4_lrg.jpg?httpAccept=%2A%2F%2A",
            "@multimediatype": "JPEG image file",
            "@type": "IMAGE-HIGH-RES",
            "@size": "112114",
            "@ref": "gr4",
            "@mimetype": "image/jpeg"
          },
          {
            "@category": "high",
            "@height": "2575",
            "@width": "1663",
            "@_fa": "true",
            "$": "https://api.elsevier.com/content/object/eid/1-s2.0-S0926860X2300443X-gr3_lrg.jpg?httpAccept=%2A%2F%2A",
            "@multimediatype": "JPEG image file",
            "@type": "IMAGE-HIGH-RES",
            "@size": "222684",
            "@ref": "gr3",
            "@mimetype": "image/jpeg"
          },
          {
            "@category": "high",
            "@height": "1497",
            "@width": "2994",
            "@_fa": "true",
            "$": "https://api.elsevier.com/content/object/eid/1-s2.0-S0926860X2300443X-gr2_lrg.jpg?httpAccept=%2A%2F%2A",
            "@multimediatype": "JPEG image file",
            "@type": "IMAGE-HIGH-RES",
            "@size": "827967",
            "@ref": "gr2",
            "@mimetype": "image/jpeg"
          },
          {
            "@category": "high",
            "@height": "886",
            "@width": "1200",
            "@_fa": "true",
            "$": "https://api.elsevier.com/content/object/eid/1-s2.0-S0926860X2300443X-ga1_lrg.jpg?httpAccept=%2A%2F%2A",
            "@multimediatype": "JPEG image file",
            "@type": "IMAGE-HIGH-RES",
            "@size": "150086",
            "@ref": "ga1",
            "@mimetype": "image/jpeg"
          },
          {
            "@category": "high",
            "@height": "1496",
            "@width": "2994",
            "@_fa": "true",
            "$": "https://api.elsevier.com/content/object/eid/1-s2.0-S0926860X2300443X-gr1_lrg.jpg?httpAccept=%2A%2F%2A",
            "@multimediatype": "JPEG image file",
            "@type": "IMAGE-HIGH-RES",
            "@size": "741793",
            "@ref": "gr1",
            "@mimetype": "image/jpeg"
          },
          {
            "@category": "standard",
            "@_fa": "true",
            "$": "https://api.elsevier.com/content/object/eid/1-s2.0-S0926860X2300443X-mmc1.docx?httpAccept=%2A%2F%2A",
            "@multimediatype": "Microsoft Word file",
            "@type": "APPLICATION",
            "@size": "15635152",
            "@ref": "mmc1",
            "@mimetype": "application/word"
          },
          {
            "@category": "thumbnail",
            "@_fa": "true",
            "$": "https://api.elsevier.com/content/object/eid/1-s2.0-S0926860X2300443X-si0001.svg?httpAccept=%2A%2F%2A",
            "@multimediatype": "Scalable Vector Graphics file",
            "@type": "ALTIMG",
            "@size": "1790",
            "@ref": "si0001",
            "@mimetype": "image/svg+xml"
          },
          {
            "@category": "standard",
            "@_fa": "true",
            "$": "https://api.elsevier.com/content/object/eid/1-s2.0-S0926860X2300443X-am.pdf?httpAccept=%2A%2F%2A",
            "@multimediatype": "Acrobat PDF file",
            "@type": "AAM-PDF",
            "@size": "3259548",
            "@ref": "am",
            "@mimetype": "application/pdf"
          }
        ]
      },
      "link": {
        "@rel": "abstract",
        "@href": "https://api.elsevier.com/content/abstract/scopus_id/85174689584"
      }
    }
  }
}