{
  "metadata": {
    "title": "Reversible ionic liquids (RevILs) for the preparation of thermally stable SBA-15 supported gold nanoparticle catalysts",
    "authors": "; ; ",
    "journal": "Applied Catalysis A: General",
    "date": "2022-08-05",
    "doi": "10.1016/j.apcata.2022.118725",
    "abstract": "",
    "uri": "https://api.elsevier.com/content/article/pii/S0926860X22002484",
    "pii": "S0926860X22002484"
  },
  "fulltext": {
    "full-text-retrieval-response": {
      "scopus-eid": "2-s2.0-85132321199",
      "originalText": "serial JL 271346 291210 291744 291809 31 Applied Catalysis A: General APPLIEDCATALYSISAGENERAL 2022-06-12 2022-06-12 2022-06-15 2022-06-15 2022-10-16T00:55:09 1-s2.0-S0926860X22002484 S0926-860X(22)00248-4 S0926860X22002484 10.1016/j.apcata.2022.118725 S300 S300.1 FULL-TEXT 1-s2.0-S0926860X22X00148 2024-01-01T12:34:28.416125Z 0 0 20220805 2022 2022-06-12T06:08:10.738777Z absattachment articleinfo articlenumber articletitlenorm authfirstinitialnorm authfirstsurnamenorm cid cids contenttype copyright crossmark dateloaded dateloadedtxt datesearch datesort dateupdated dco docsubtype doctype doi eid ewtransactionid hubeid indexeddate issn issnnorm itemstage itemtransactionid itemweight openaccess openarchive pg pgfirst pii piinorm pubdatestart pubdatetxt pubyr sortorder srctitle srctitlenorm srctype ssids alllist content subj subheadings suppl tomb volfirst volissue volumelist webpdf webpdfpagecount yearnav figure table e-component body mmlmath acknowledge affil appendices articletitle auth authfirstini authfull authkeywords authlast footnotes grantnumber grantsponsor grantsponsorid highlightsabst otherkwds primabst ref specialabst 0926-860X 0926860X true 643 643 C Volume 643 3 118725 118725 118725 20220805 5 August 2022 2022-08-05 2022 article fla © 2022 Elsevier B.V. All rights reserved. REVERSIBLEIONICLIQUIDSREVILSFORPREPARATIONTHERMALLYSTABLESBA15SUPPORTEDGOLDNANOPARTICLECATALYSTS SUN Z 1 Introduction 2 Materials and methods 2.1 Materials 2.2 Synthesis of SBA-15 2.3 Synthesis of the molecular liquids and conversion to reversible ionic liquids (RevILs) 2.4 Synthesis of the reversible ionic liquid (RevIL)-stabilized nanoparticles 2.5 Deposition of the RevIL-stabilized nanoparticles on the non-porous SiO2 2.6 Deposition of nanoparticles in the prepared SBA-15 mesoporous silica 2.7 Thermal treatment 2.8 Thermogravimetric analysis (TGA) 2.9 Catalyst characterization 2.10 Catalytic activity evaluation 3 Results and discussion 3.1 Physical properties of the prepared SBA-15 mesoporous silica 3.2 Determination of the location of the nanoparticles in the Au/SBA-15/A.S. preparations 3.3 Effect of deposition on nanoparticle size 3.4 ATR-FTIR analysis 3.5 Calcination experiments 3.6 Catalytic activity evaluation 3.7 The catalytic activities of the Au/SBA-15/A.S. and the Au/SBA-15/100 °C preparations 3.8 The activities of the non-porous and porous gold catalysts before and after a 230 °C calcination 4 Conclusion CRediT authorship contribution statement Acknowledgement Appendix A Supplementary material References SHAMZHY 2019 1095 1149 M MONDLOCH 2012 1 38 J HU 2007 277 283 J SONG 2006 3027 3037 H GUTIERREZ 2011 L MA 2009 202 208 C KUMAR 2015 1714 1724 A CHU 2015 X BRYANT 2017 K BRYANT 2019 58 64 K BRYANT 2021 K SU 2017 9456 9462 Y SANKAR 2020 M ZHU 2013 Y GLOMM 2005 729 744 W XIE 2018 177 182 F MARIACHONG 2003 12650 12657 A ZHAO 2020 J BOUCHET 2006 4305 4311 J ZHAO 1998 1556 1561 X MERCIER 2000 188 196 L MOHAPATRA 2017 P HARUTA 2002 M SHEPIDA 2019 M LOUIS 2016 C SHARMA 2016 A BJORK 2017 91 94 E VIERHELLER 2014 110 126 J SWITZER 2013 J MITTAL 2015 207 220 N YANG 2015 164 172 G HANSEN 2013 1720 1730 T BORE 2005 M LIU 2017 163 175 N CHEN 2013 871 879 J LIU 2017 J GOMMES 2019 C CHOUDHARY 2005 768 770 V CHOUDHARY 2007 267 272 V ADNAN 2015 1323 1333 R MA 2010 246 251 C FERRAZ 2016 25279 25285 C CARABINEIRO 2019 S MIEDZIAK 2011 315 319 P HAMMONDPEREIRA 2020 1939 1949 E SUCHOMEL 2018 P SUNX2022X118725 SUNX2022X118725XZ CHU_NSF publishAcceptedManuscriptIndexable http://www.elsevier.com/open-access/userlicense/1.0/ 2023-06-15T00:00:00.000Z http://creativecommons.org/licenses/by-nc-nd/4.0/ © 2022 Elsevier B.V. All rights reserved. 2022-06-25T02:54:45.559Z http://vtw.elsevier.com/data/voc/AddOnTypes/50.7/aggregated-refined 0 https://doi.org/10.15223/policy-017 https://doi.org/10.15223/policy-037 https://doi.org/10.15223/policy-012 https://doi.org/10.15223/policy-029 https://doi.org/10.15223/policy-004 item S0926-860X(22)00248-4 S0926860X22002484 1-s2.0-S0926860X22002484 10.1016/j.apcata.2022.118725 271346 2024-01-01T12:34:28.416125Z 2022-08-05 1-s2.0-S0926860X22002484-main.pdf https://s3-eu-west-1.amazonaws.com/prod-ucs-content-store-eu-west/content/pii:S0926860X22002484/MAIN/application/pdf/129931a456b2e82b9dcbd4e5377f2294/main.pdf main.pdf pdf true 3757161 MAIN 8 1-s2.0-S0926860X22002484-main_1.png https://s3-eu-west-1.amazonaws.com/prod-ucs-content-store-eu-west/content/pii:S0926860X22002484/PREVIEW/image/png/fbea134d2074d3ce13bef8b1b5577640/main_1.png main_1.png png 56231 849 656 IMAGE-WEB-PDF 1 1-s2.0-S0926860X22002484-gr5.jpg https://s3-eu-west-1.amazonaws.com/prod-ucs-content-store-eu-west/content/pii:S0926860X22002484/gr5/DOWNSAMPLED/image/jpeg/9d198af32b764578e447d1e0559693ab/gr5.jpg gr5 gr5.jpg jpg 13355 239 356 IMAGE-DOWNSAMPLED 1-s2.0-S0926860X22002484-gr4.jpg https://s3-eu-west-1.amazonaws.com/prod-ucs-content-store-eu-west/content/pii:S0926860X22002484/gr4/DOWNSAMPLED/image/jpeg/603090395745f0eb9e50c3116ba8dff8/gr4.jpg gr4 gr4.jpg jpg 117981 860 376 IMAGE-DOWNSAMPLED 1-s2.0-S0926860X22002484-gr3.jpg https://s3-eu-west-1.amazonaws.com/prod-ucs-content-store-eu-west/content/pii:S0926860X22002484/gr3/DOWNSAMPLED/image/jpeg/6fbf81a8d5fd592faaf780e4bfd4eb7b/gr3.jpg gr3 gr3.jpg jpg 23855 177 376 IMAGE-DOWNSAMPLED 1-s2.0-S0926860X22002484-gr2.jpg https://s3-eu-west-1.amazonaws.com/prod-ucs-content-store-eu-west/content/pii:S0926860X22002484/gr2/DOWNSAMPLED/image/jpeg/73632195e9d1fdab7cb51c5056c08a85/gr2.jpg gr2 gr2.jpg jpg 75772 470 376 IMAGE-DOWNSAMPLED 1-s2.0-S0926860X22002484-ga1.jpg https://s3-eu-west-1.amazonaws.com/prod-ucs-content-store-eu-west/content/pii:S0926860X22002484/ga1/DOWNSAMPLED/image/jpeg/48a6068f39a4fa68e874bd227e05eac5/ga1.jpg ga1 true ga1.jpg jpg 31936 200 499 IMAGE-DOWNSAMPLED 1-s2.0-S0926860X22002484-gr1.jpg https://s3-eu-west-1.amazonaws.com/prod-ucs-content-store-eu-west/content/pii:S0926860X22002484/gr1/DOWNSAMPLED/image/jpeg/a3af23a9b3afd7581985642324829dd5/gr1.jpg gr1 gr1.jpg jpg 64491 471 376 IMAGE-DOWNSAMPLED 1-s2.0-S0926860X22002484-sc2.jpg https://s3-eu-west-1.amazonaws.com/prod-ucs-content-store-eu-west/content/pii:S0926860X22002484/sc2/DOWNSAMPLED/image/jpeg/e29d807174334ef72bedd34d9ee7fbf4/sc2.jpg sc2 sc2.jpg jpg 10390 72 508 IMAGE-DOWNSAMPLED 1-s2.0-S0926860X22002484-sc1.jpg https://s3-eu-west-1.amazonaws.com/prod-ucs-content-store-eu-west/content/pii:S0926860X22002484/sc1/DOWNSAMPLED/image/jpeg/29e1530b6225735b2411846151bded6f/sc1.jpg sc1 sc1.jpg jpg 7645 62 508 IMAGE-DOWNSAMPLED 1-s2.0-S0926860X22002484-gr5.sml https://s3-eu-west-1.amazonaws.com/prod-ucs-content-store-eu-west/content/pii:S0926860X22002484/gr5/THUMBNAIL/image/gif/fbf8150481361e1bea78312930ea848e/gr5.sml gr5 gr5.sml sml 5685 147 219 IMAGE-THUMBNAIL 1-s2.0-S0926860X22002484-gr4.sml https://s3-eu-west-1.amazonaws.com/prod-ucs-content-store-eu-west/content/pii:S0926860X22002484/gr4/THUMBNAIL/image/gif/f0aed47f6acf4f7031e1ba86aa397308/gr4.sml gr4 gr4.sml sml 8634 162 71 IMAGE-THUMBNAIL 1-s2.0-S0926860X22002484-gr3.sml https://s3-eu-west-1.amazonaws.com/prod-ucs-content-store-eu-west/content/pii:S0926860X22002484/gr3/THUMBNAIL/image/gif/3406706d8f95c5c0752df771d1eaa756/gr3.sml gr3 gr3.sml sml 8598 103 219 IMAGE-THUMBNAIL 1-s2.0-S0926860X22002484-gr2.sml https://s3-eu-west-1.amazonaws.com/prod-ucs-content-store-eu-west/content/pii:S0926860X22002484/gr2/THUMBNAIL/image/gif/f939232e954aa4ae1ad76450b9352874/gr2.sml gr2 gr2.sml sml 14016 164 131 IMAGE-THUMBNAIL 1-s2.0-S0926860X22002484-ga1.sml https://s3-eu-west-1.amazonaws.com/prod-ucs-content-store-eu-west/content/pii:S0926860X22002484/ga1/THUMBNAIL/image/gif/56763307f8d92b1664bb1ea188b0d220/ga1.sml ga1 true ga1.sml sml 11284 88 219 IMAGE-THUMBNAIL 1-s2.0-S0926860X22002484-gr1.sml https://s3-eu-west-1.amazonaws.com/prod-ucs-content-store-eu-west/content/pii:S0926860X22002484/gr1/THUMBNAIL/image/gif/09b6c615941549837b011b2fbdcc2d8c/gr1.sml gr1 gr1.sml sml 14537 164 131 IMAGE-THUMBNAIL 1-s2.0-S0926860X22002484-sc2.sml https://s3-eu-west-1.amazonaws.com/prod-ucs-content-store-eu-west/content/pii:S0926860X22002484/sc2/THUMBNAIL/image/gif/1ed675966c8acc5c15c8cb7c4954fcb7/sc2.sml sc2 sc2.sml sml 2087 31 219 IMAGE-THUMBNAIL 1-s2.0-S0926860X22002484-sc1.sml https://s3-eu-west-1.amazonaws.com/prod-ucs-content-store-eu-west/content/pii:S0926860X22002484/sc1/THUMBNAIL/image/gif/45738fbc9850b4ee0e6c0b2270c98785/sc1.sml sc1 sc1.sml sml 2118 27 219 IMAGE-THUMBNAIL 1-s2.0-S0926860X22002484-gr5_lrg.jpg https://s3-eu-west-1.amazonaws.com/prod-ucs-content-store-eu-west/content/pii:S0926860X22002484/gr5/HIGHRES/image/jpeg/526f850819203eca015b4f3c8a1d7a1d/gr5_lrg.jpg gr5 gr5_lrg.jpg jpg 70566 1061 1579 IMAGE-HIGH-RES 1-s2.0-S0926860X22002484-gr4_lrg.jpg https://s3-eu-west-1.amazonaws.com/prod-ucs-content-store-eu-west/content/pii:S0926860X22002484/gr4/HIGHRES/image/jpeg/d3133d7e30d8dadadf6b1649eaf871a3/gr4_lrg.jpg gr4 gr4_lrg.jpg jpg 687437 3804 1663 IMAGE-HIGH-RES 1-s2.0-S0926860X22002484-gr3_lrg.jpg https://s3-eu-west-1.amazonaws.com/prod-ucs-content-store-eu-west/content/pii:S0926860X22002484/gr3/HIGHRES/image/jpeg/8bdf22d972c413c6594d4970c06126e9/gr3_lrg.jpg gr3 gr3_lrg.jpg jpg 131003 781 1663 IMAGE-HIGH-RES 1-s2.0-S0926860X22002484-gr2_lrg.jpg https://s3-eu-west-1.amazonaws.com/prod-ucs-content-store-eu-west/content/pii:S0926860X22002484/gr2/HIGHRES/image/jpeg/34f0acf5fd91476ee31154799fbb39c7/gr2_lrg.jpg gr2 gr2_lrg.jpg jpg 450483 2077 1663 IMAGE-HIGH-RES 1-s2.0-S0926860X22002484-ga1_lrg.jpg https://s3-eu-west-1.amazonaws.com/prod-ucs-content-store-eu-west/content/pii:S0926860X22002484/ga1/HIGHRES/image/jpeg/7921af13b7e1547e7173fca82ca3895c/ga1_lrg.jpg ga1 true ga1_lrg.jpg jpg 230112 886 2211 IMAGE-HIGH-RES 1-s2.0-S0926860X22002484-gr1_lrg.jpg https://s3-eu-west-1.amazonaws.com/prod-ucs-content-store-eu-west/content/pii:S0926860X22002484/gr1/HIGHRES/image/jpeg/5f93f27636124a3cb9a9379d9f270fcb/gr1_lrg.jpg gr1 gr1_lrg.jpg jpg 351362 2082 1663 IMAGE-HIGH-RES 1-s2.0-S0926860X22002484-sc2_lrg.jpg https://s3-eu-west-1.amazonaws.com/prod-ucs-content-store-eu-west/content/pii:S0926860X22002484/sc2/HIGHRES/image/jpeg/b5108568b2bc2915c6d56748ebb22bf2/sc2_lrg.jpg sc2 sc2_lrg.jpg jpg 50613 319 2245 IMAGE-HIGH-RES 1-s2.0-S0926860X22002484-sc1_lrg.jpg https://s3-eu-west-1.amazonaws.com/prod-ucs-content-store-eu-west/content/pii:S0926860X22002484/sc1/HIGHRES/image/jpeg/47dee573d41cfd4d2f16dc5da153b3bd/sc1_lrg.jpg sc1 sc1_lrg.jpg jpg 35360 272 2245 IMAGE-HIGH-RES 1-s2.0-S0926860X22002484-mmc1.pdf https://s3-eu-west-1.amazonaws.com/prod-ucs-content-store-eu-west/content/pii:S0926860X22002484/mmc1/MAIN/application/pdf/43dbcd150aa38bc1eeb1ec9fa3b2ef48/mmc1.pdf mmc1 mmc1.pdf pdf false 1282277 APPLICATION 1-s2.0-S0926860X22002484-si0001.svg https://s3-eu-west-1.amazonaws.com/prod-ucs-content-store-eu-west/content/pii:S0926860X22002484/STRIPIN/image/svg+xml/2d2aaed25d213c9be73e5597e5c570f4/si0001.svg si0001 si0001.svg svg 2787 ALTIMG 1-s2.0-S0926860X22002484-si0002.svg https://s3-eu-west-1.amazonaws.com/prod-ucs-content-store-eu-west/content/pii:S0926860X22002484/STRIPIN/image/svg+xml/28dc7f25dbc9528486930842634e42fd/si0002.svg si0002 si0002.svg svg 3456 ALTIMG 1-s2.0-S0926860X22002484-si0003.svg https://s3-eu-west-1.amazonaws.com/prod-ucs-content-store-eu-west/content/pii:S0926860X22002484/STRIPIN/image/svg+xml/2d6962922fcbf02c4b649a05bc947b3f/si0003.svg si0003 si0003.svg svg 3444 ALTIMG 1-s2.0-S0926860X22002484-si0004.svg https://s3-eu-west-1.amazonaws.com/prod-ucs-content-store-eu-west/content/pii:S0926860X22002484/STRIPIN/image/svg+xml/d22e47e6614422ed7efb6d0a44ac2366/si0004.svg si0004 si0004.svg svg 1491 ALTIMG 1-s2.0-S0926860X22002484-si0005.svg https://s3-eu-west-1.amazonaws.com/prod-ucs-content-store-eu-west/content/pii:S0926860X22002484/STRIPIN/image/svg+xml/698f6167196ec09d403a1f946e2ef6ee/si0005.svg si0005 si0005.svg svg 2338 ALTIMG 1-s2.0-S0926860X22002484-si0006.svg https://s3-eu-west-1.amazonaws.com/prod-ucs-content-store-eu-west/content/pii:S0926860X22002484/STRIPIN/image/svg+xml/7ce463052d8297599190902103a5ca6b/si0006.svg si0006 si0006.svg svg 2775 ALTIMG 1-s2.0-S0926860X22002484-si0007.svg https://s3-eu-west-1.amazonaws.com/prod-ucs-content-store-eu-west/content/pii:S0926860X22002484/STRIPIN/image/svg+xml/5035c21e623b147011b042f96acb79c8/si0007.svg si0007 si0007.svg svg 1697 ALTIMG 1-s2.0-S0926860X22002484-am.pdf https://s3-eu-west-1.amazonaws.com/prod-ucs-content-store-eu-west/content/egi:10PTXND62WB/MAIN/application/pdf/6c448ef875587337f5ffde167c6db101/am.pdf am am.pdf pdf false 2215242 AAM-PDF APCATA 118725 118725 S0926-860X(22)00248-4 10.1016/j.apcata.2022.118725 Elsevier B.V. Fig. 1 The TEM micrographs of the Au/SBA-15/A.S. preparations. (B) was obtained by rotating (A) to +20 degrees. Fig. 1 Fig. 2 The representative TEM micrographs of (A) colloidal RevIL-stabilized nanoparticles, and (B) Au/SBA-15/A.S. preparations. Fig. 2 Fig. 3 ATR-FTIR spectra of all the synthesis components, catalyst preparations, and prepared SBA-15 mesoporous silica. Note: Au/SBA-15/100 °C and Prepared SBA-15 are shown at a greater magnification to show greater detail. Fig. 3 Fig. 4 The representative TEM micrographs of (A) Au/SiO2/A.S. preparations, (B) Au/SiO2/230 °C preparations, (C) Au/SBA-15/A.S. preparations, and (D) Au/SBA-15/230 °C preparations. Fig. 4 Fig. 5 The product yields using the Au/SiO2/A.S., Au/SiO2/230 oC, Au/SBA-15/A.S., Au/SBA-15/100 oC, and Au/SBA-15/230 oC preparations. Reaction conditions: gold loadings of all catalyst preparations were maintained at 0.0559 µmol, 15 mg of K2CO3 for all reactions, 99.9 % O2, 1 h, 600 rpm, 100 ℃. Fig. 5 Scheme 1 The reversible reaction of silylamine molecular liquids with CO2 to form reversible ionic liquids. Scheme 1 Scheme 2 Gold-catalyzed sequential oxidation of (A) benzyl alcohol into (B) benzaldehyde, (C) benzoic acid, and (D) benzyl benzoate. Scheme 2 Table 1 Nanoparticle size, gold loading, and number of gold surface atoms/g catalyst for all catalyst preparations. All nanoparticle size distributions are available in the Supporting Information. Table 1 Catalyst sample naming Average nanoparticle diameter (nm) Gold loading (mg Au/ g catalyst) Au surface atoms/g catalysts x 1018 Colloidal nanoparticles 3.46 ± 0.53 Au/SBA-15/A.S. 3.28 ± 0.42 0.734 0.754 Au/SBA-15/100 °C 3.48 ± 0.58 0.898 0.847 Au/SBA-15/230 °C 3.65 ± 0.57 0.966 0.868 Au/SiO 2 /A.S. 2.62 ± 0.75 0.678 0.753 Au/SiO 2 /230 °C 7.41 ± 3.02 0.753 0.277 Table 2 A molar and surface turnover frequency of each catalyst preparation in the selective oxidation of benzyl alcohol. Table 2 Catalyst sample TOFM (s-1) TOFS (s-1) Au/SBA-15/A.S. 8.89 26.4 Au/SBA-15/100 °C 9.75 31.5 Au/SBA-15/230 °C 6.44 21.9 Au/SiO 2 /A.S. 7.54 20.7 Au/SiO 2 /230 °C 2.00 16.5 Reversible ionic liquids (RevILs) for the preparation of thermally stable SBA-15 supported gold nanoparticle catalysts Zengran Sun Methodology Validation Formal analysis Investigation Data curation Writing – original draft Writing – review & editing Visualization a Ellis Hammond-Pereira Formal analysis Writing – review & editing a Xianghui Zhang Investigation Validation Formal analysis Writing – review & editing a b Di Wu Resources Writing – review & editing a b c d Steven R. Saunders Conceptualization Writing – review & editing Supervision Project administration Funding acquisition a c ⁎ 1 a The Gene and Linda Voiland School of Chemical Engineering and Bioengineering, Washington State University, Pullman, WA 99164, United States The Gene and Linda Voiland School of Chemical Engineering and Bioengineering, Washington State University Pullman WA 99164 United States The Gene and Linda Voiland School of Chemical Engineering and Bioengineering, Washington State University, Pullman, Washington 99164, United States b Alexandra Navrotsky Institute for Experimental Thermodynamics, Washington State University, Pullman, WA 99164, United States Alexandra Navrotsky Institute for Experimental Thermodynamics, Washington State University Pullman WA 99164 United States Alexandra Navrotsky Institute for Experimental Thermodynamics, Washington State University, Pullman, Washington 99164, United States c Department of Chemistry, Washington State University, Pullman, WA 99164, United States Department of Chemistry, Washington State University Pullman WA 99164 United States Department of Chemistry, Washington State University, Pullman, Washington 99164, United States d Materials Science and Engineering, Washington State University, Pullman, WA 99164, United States Materials Science and Engineering, Washington State University Pullman WA 99164 United States Materials Science and Engineering, Washington State University, Pullman, Washington 99164, United States ⁎ Corresponding author at: The Gene and Linda Voiland School of Chemical Engineering and Bioengineering, Washington State University, Pullman, WA 99164, United States. The Gene and Linda Voiland School of Chemical Engineering and Bioengineering, Washington State University Pullman WA 99164 United States 1 http://orcid.org/0000-0001-6714-7435. Reversible ionic liquids (RevILs) are ionic liquids that can be switched between molecular and ionic forms via two stimuli, and they can assist in the synthesis of colloidal gold nanoparticles. The RevIL-stabilized gold nanoparticles are deposited in the pores of SBA-15 mesoporous silica via incipient wetness without the functionalization of the SBA-15 surface. The location of nanoparticles inside the pores was confirmed by transmission electron microscopy technique and by a measured increase in the thermal stability of the nanoparticles in SBA-15 compared to non-porous silica. The porous gold catalysts are active in the selective oxidation of benzyl alcohol without calcination due to the absence of the ligands on the gold surface after deposition. Additionally, they are more active than the non-porous gold catalysts, indicating that the pore geometry enhances catalytic performance. Ultimately, the catalysts prepared by RevIL technique are thermally stable and active and show fine control over particle size. Graphical Abstract ga1 Abbreviations RevIL Reversible ionic liquid APTES 3-aminopropyltriethylsilane A.S. as-synthesized Keywords Switchable nature of reversible ionic liquids Gold nanoparticles SBA-15 mesoporous silica Thermal stability 1 Introduction The modern catalyst design approach aims to prepare catalysts with dual functionalities: the highly active surface of metallic nanoparticles with the beneficial in-pore orientation and confinement effects afforded by high-surface area mesoporous silica [1–3]. Mesoporous silica contained metallic nanoparticle catalysts are commonly prepared by: 1. incorporating nanoparticles before the growth of pores (this leads to potential mass transport issues due to blocked pores) [4], 2. synthesizing nanoparticles within the pores [5], or 3. depositing nanoparticles inside the pores. However, all of these methods require surface modification of mesoporous silica to tether the nanoparticles (or their precursors) then necessitates calcination that leads to the deterioration of the nanoparticle morphology before the catalyst is even used [3,6–8]. Reversible Ionic Liquids (RevILs) have been shown to facilitate the preparation of SiO2-supported gold nanoparticle catalysts by eliminating the need for calcination [9–11]. RevILs are ionic liquids that can be switched between a molecular (or non-ionic form) and ionic form via two different stimuli. RevILs are formed from a reaction of silylamine molecular liquids (e.g., 3-aminopropyltriehtylsilane, APTES) with CO2, which forms an ammonium−carbamate ion pair ( Scheme 1). Upon removal of CO2 (via sparging with an inert or gentle heating), RevILs reverse to APTES molecular liquids. RevILs facilitate the preparation and deposition of surface-clean nanoparticles onto the surface of non-porous SiO2 [9,10]. Additionally, RevILs have been shown to lessen the extent of sintering of nanoparticles during calcination compared to traditional thiol ligands [10]. However, the nanoparticles supported on a surface have facile pathways for particle migration and coalescence (PMC) or Ostwald ripening (OR) [12], inevitably increasing the occurrence of sintering during use or calcination. These catalysts could theoretically be further improved by replacing the non-porous silica with that of a structured, mesoporous silica. The pore geometry of mesoporous supports (e.g., SBA-15) can create geometric barriers to inhibit the sintering of nanoparticles [13]. An SBA-15 mesoporous silica is an ideal candidate-host for metallic nanoparticles due to its large surface area and pore volume, adjustable pore size, and various morphology [14]. Traditionally, SBA-15 supported gold nanoparticle catalysts are prepared in one of two methods: nucleation and growth of the nanoparticles within the pores or depositing prepared nanoparticles in the pores [15]. Both methods require the functionalization of the SBA-15 surface with aminosilanes before nanoparticle synthesis or deposition, where the terminal amines bind to the tetrachloroaurate ions (AuCl4 −1) or the already-prepared nanoparticles [16–18]. Calcination removes the aminosilanes for catalyst activation [19]. Functionalizing the SBA-15 surface is time-consuming and creates potential mass-transport barriers [17,20,21]. Calcination often does not fully remove the ligands and results in the sintering of nanoparticles [22]. Furthermore, the gold nanoparticle catalysts prepared with traditional methods have a large particle size (> 30 nm), poor dispersion, or wide size distribution [23–26]. Herein, we demonstrate an improved SBA-15 supported gold nanoparticle catalyst preparation—the RevIL-stabilized gold nanoparticles are deposited in the prepared SBA-15 mesoporous silica via an incipient wetness (IW) technique, leveraging the switchable nature of RevILs. This will provide two clear improvements compared to traditional methods: 1. removing the need to modify the mesoporous silica surface, and 2. eliminating the need for calcination, thus improving the control over nanoparticle size. 2 Materials and methods 2.1 Materials Gold (III) chloride trihydrate (HAuCl40.3H2O; ≥ 99.9 % trace metal basis), allylamine (C3H5NH2; 98 %), hydrochloric acid (HCl; 37 %; ACS Reagent), poly(ethylene glycol) -block-poly(propylene glycol)-block-poly(ethylene glycol) (P123, C3H3O[C2H4O]x[C3H6O]y[C2H4O]zC3H3O2; average Mn ~5800), tetraethyl-orthosilicate (TEOS, Si(OC2H5)4; ≥ 99.0%), toluene (C7H8; 99.8 %, ACS), and hexane (CH3(CH2)4CH3; ≥98.5 %; HPLC grade) were obtained from Sigma. Silica-gel, (SiO2; 0.060–0.2 mm), benzyl alcohol (C7H8O; 99+ %, ACS), benzyl benzoate (C14H12O2; 99+ %), benzaldehyde (C7H6O; 99 + %), biphenyl (C12H10; 99 %), and potassium carbonate (K2CO3; 99.0 %, ACS) were obtained from Alfa Aesar. Triethylsilane (C6H16Si; 99%) and sodium borohydride (NaBH4; 99%, Tracemetal) were obtained from ACROS ORGANICS. Nitric acid (HNO3; 67–70 %, Tracemetal™) was obtained from Fisher Chemical. Platinum−divinyltetramethyldisiloxane complex (C24H54O3Pt2Si6; ∼2 % Pt in xylene) was obtained from Gelest. Reagent grade water was obtained from Thermo Scientific. Compressed nitrogen gas (N2, ≥ 99.9 %) and compressed oxygen gas (O2, ≥ 99.5 %) were supplied by A-L Compressed Gases, INC. Compressed carbon dioxide gas (CO2, ≥ 99.9 %) was purchased from NorLAB. Carbon/formvar-coated copper TEM grids were purchased from Ted Pella. Toluene was dried over molecular sieves for at least 24 h before usage. The silica-gel was dried in a vacuum oven for 24 h at 150 ℃ before deposition. All other materials were used without any further purification or processing. 2.2 Synthesis of SBA-15 An SBA-15 mesoporous silica was synthesized following a literature procedure [27], and is described in the Supporting Information. The obtained solid materials will be referred to as the “prepared SBA-15 mesoporous silica”. 2.3 Synthesis of the molecular liquids and conversion to reversible ionic liquids (RevILs) The APTES molecular liquid was synthesized following a literature procedure [9], which is described in the Supporting Information. The RevILs are formed by sparging the molecular liquid with CO2 in a nitrogen-purged vial under magnetic stirring. The mass of the vial was measured every 10 min. Sparging was stopped when no mass change was observed in three consecutive measurements (2 h). 2.4 Synthesis of the reversible ionic liquid (RevIL)-stabilized nanoparticles The RevIL-stabilized gold nanoparticles were synthesized using a modified method available in the literature [9,10]. HAuCl40.3 H2O (0.0298 g; 0.076 mmol) was dissolved in the RevIL (3.7665 g; 0.00943 mmol). 17.6 mL of hexane was added, and the solution was mixed at 600 rpm until the HAuCl4 was completely dissolved. 400 µL of a 0.1 M NaBH4 aqueous solution was added to the vial while stirring. The solution was stirred at 600 rpm for 30 min to completely reduce the gold precursors. The nanoparticles prepared in this manner will be referred to as “colloidal RevIL-stabilized nanoparticles.” 2.5 Deposition of the RevIL-stabilized nanoparticles on the non-porous SiO2 This deposition is followed in a literature procedure [9]; the deposition procedures are presented in the Supporting Information. The prepared materials will be referred to as “Au/SiO2/A.S.”, for gold nanoparticles deposited on non-porous SiO2 as synthesized. 2.6 Deposition of nanoparticles in the prepared SBA-15 mesoporous silica The deposition of the RevIL-stabilized gold nanoparticles in SBA-15 mesoporous silica was conducted via an incipient wetness (IW) technique. In a typical deposition, the RevIL-stabilized nanoparticles are first diluted with hexane (1:1—RevIL-stabilized nanoparticles:hexane by volume). The diluted nanoparticle dispersion is then added dropwise to the prepared SBA-15 mesoporous silica with constant mechanical stirring of the solid. The constant stirring ensures that the nanoparticle solution is equally distributed across the SBA-15 mesoporous silica, preventing isolated locations from becoming oversaturated. It takes approximately 40 min to saturate the SBA-15 mesoporous silica fully; the SBA-15 mesoporous silica changes to a pinkish color, implying that the nanoparticles are deposited on the SBA-15 mesoporous silica. The saturated SBA-15 mesoporous silica is left in a loosely capped vial overnight, allowing for complete deposition. The vial is then placed in a vacuum oven until the solid is completely dry the next day. The vacuum oven is regulated at 0.44 atma and 45 °C. The prepared solid materials will be referred to as “Au/SBA-15/A.S.” for gold nanoparticles deposited in SBA-15 mesoporous silica, as synthesized. It is noted that adding solution too quickly and without constant stirring often results in the appearance of bulk liquid, indicating that the SBA-15 mesoporous silica is over-saturated. The saturated pores prevent the entrance of nanoparticles, leading to the accumulation of nanoparticles on the external surface of SBA-15 (a failed deposition). It should be noted that it is possible to increase the gold loading by repeating the deposition process. The efficiency of this deposition method is approximately 96 %, which is comparable to SBA-15 surface-modified methods (~ 99 %) [6]. 2.7 Thermal treatment When indicated, the supported nanoparticles were exposed to a vacuum treatment at 100 °C or a 230 °C calcination at ambient pressure. In the vacuum treatment, 0.03 g of the Au/SBA-15/A.S. preparations were placed in a vacuum oven regulated under 0.44 atma for 24 h at 100 °C. The prepared solid materials are named “Au/SBA-15/100 °C”, for the Au/SBA-15/A.S. preparations with an additional 100 °C vacuum calcination. In a typical 230 °C calcination, 0.05 g of Au/SBA-15/A.S. or Au/SiO2/A.S. preparations were calcined in air using a Thermolyne Benchtop 1100 C Muffle Furnace. The calcination conditions are as follows: the temperature was ramped at 5 °C min−1 to 230 °C from the room temperature, held for 180 min, and then allowed to cool to the room temperature. The prepared solid materials are named “Au/SBA-15/230 °C”, for the Au/SBA-15/A.S. preparations with additional 230 °C calcination and “Au/SiO2/230 °C” for the Au/SiO2 preparations with additional 230 °C calcination. 2.8 Thermogravimetric analysis (TGA) TGA was performed to measure the mass fraction of the remaining APTES molecular liquids. In a typical TGA experiment, 0.002 mg of the Au/SBA-15/A.S. or the Au/SBA-15/100 °C preparations were placed in a platinum pan attached to a TA Instruments Q50. The TGA conditions are as follows: the temperature was ramped at 5 ℃ min−1 to 230 °C from an equilibrium temperature (40 °C), held for 180 min, and then allowed to cool to 40 °C. 2.9 Catalyst characterization Nanoparticle size was determined using transmission electron microscopy (TEM) utilizing an FEI Technai G2 T20 Twin TEM with an operating voltage of 200 kV. Samples were dispersed in hexane and drop-cast onto a 75-mesh, Cu grid. Image analysis was performed using ImageJ software with at least 200 particles sized. The nanoparticle gold loadings of catalyst preparations were determined using the Total Reflection X-Ray Fluorescence (TRXF) analysis using a Bruker S4 TSTAR spectrometer. 0.052 g of Au/SBA-15/230 ℃ preparations or 0.054 g of Au/SiO2/A.S. preparations were dissolved in 1 mL of HNO3 then submerged in a 40 ℃ water bath for 25 min until no pink color was observed. 40 µL of 1000 mg/L Vanadium (V) (internal standard) in HNO3 was subsequently added and mixed using vortex-mixer. 10 µL of solution was cast-drop onto a clean quartz disk. The quantification measurement method is as follows: Si (Silicon), Mo (Molybdenum), and Ar (Argon) are assigned as the deconvoluted elements; V (Vanadium) is assigned as the standard element; Au (Gold) is used for quantification. The acquisition is as follows: Mo 17.5 excitation, air, and 1000 s with the “Escape,” “Pile up,” and “Background” corrections following the profile setting Mo-K. Attenuated Total Reflectance (ATR) Fourier Transform Infrared Spectroscopy (FTIR) was used to characterize the chemical state of the APTES molecular liquids and RevILs in the catalyst preparations and prepared SBA-15 mesoporous silica utilizing a ThermoScientific Nicolet IS10. The spectra were collected from 650 to 4000 cm−1 and scanned 512 times at a resolution of 4 cm−1. Brunauer-Emmett-Teller (BET) surface area and pore dimension analyses were performed via N2 adsorption-desorption. A complete isotherm analysis was performed at liquid nitrogen temperature (77 K) using a commercial gas adsorption analyzer (Micromeritics 3Flex). Before the isotherm measurement, the bare SBA-15 mesoporous silica samples (60 mg) were de-gassed in-situ at 150 ℃ at the analysis port for 15 h to remove all the adsorbates from their surface. 2.10 Catalytic activity evaluation The catalytic activities of all the catalyst preparations were tested in the oxidation of benzyl alcohol. ( Scheme 2). All the reactions were reacted with a base (K2CO3) to increase the total rate of reaction. The base (15 mg) and the gold nanoparticle catalysts were added into a 9 mL sealed glass reaction vessel. The total amount of gold was maintained at 0.0559 µmol, accounting for the different mass loadings: 15 mg Au/SBA-15/A.S., 12.3 mg Au/SBA-15/100 ℃, 11.4 mg Au/SBA-15/230 ℃, 16.3 mg Au/SiO2/A.S., or 14.7 mg Au/SiO2/230 ℃. Finally, a stock solution of benzyl alcohol (9.6 mmol) and biphenyl (10 µmol, internal standard) was added to the gold catalyst and the base. The glass vial was sealed, sonicated for one minute to mix all species, and then attached to a pressurized O2 cylinder. The vessel was pressurized to 6 bars of O2 before venting. The pressurization/venting cycle was repeated three times and allowed to remove all air. Once reduced to atmospheric pressure (~ 99.5 % O2), the vial was submerged in a 100 ℃ oil bath and magnetically stirred at 600 rpm. After a three-minute thermal equilibration period, the pressure of headspace was raised to 6 bar (> 99.9 % O2) and the reaction was allowed to react for one hour under 600 rpm stirring. It should be noted that the glass vial was maintained at 6 bar for the duration of the reaction. The reaction was quenched by submerging vials into room temperature water, reduced to atmospheric pressure, and then centrifuged at 6000 rpm for 6 min before taking a 0.5 mL sample for Gas Chromatography with Flame Ionization Detection (GC-FID) analysis. All reactions were performed in triplicate. GC-FID was conducted using a Thermo Scientific Trace 1310 gas chromograph with an SGE Analytical Science BP5 column (30 m x 0.25 mm x 0.25 µm). A 1.0 µL sample was injected at 300 ℃ under constant pressure mode (25 psi) with a split flow of 90 mL and the following temperature profile: initial temperature 40 ℃, ramp at 7.5 ℃ min−1 to 70 ℃, ramp at 15 ℃ min−1 to 145 ℃, ramp at 45 ℃ min−1 to 280 ℃, and hold for 3 min. The concentrations of all species are determined based upon the calibration curve (Fig. S2) compared to biphenyl internal standard. 3 Results and discussion To explore the effectiveness of this new nanoparticle deposition technique, we analyzed the location of the nanoparticles (e.g., in the pores of the mesoporous silica vs. on the external surface), studied the impact of the deposition technique on the morphology of nanoparticles, investigated the impacts of various thermal treatment to understand how the reversible ionic liquids’ switchable nature is leveraged, and, finally, investigated the impact of the new deposition method on the catalytic activities of the prepared catalysts. 3.1 Physical properties of the prepared SBA-15 mesoporous silica SBA-15 mesoporous silica was synthesized as the quality of commercial mesoporous silica was not sufficient for fundamental material characterization. We found that the commercial SBA-15 mesoporous silica was difficult to microscopically observe nanoparticles inside pores as there was generally low alignment and there were large amorphous regions. The surface area and average pore diameter of the prepared SBA-15 mesoporous silica was determined via an N2 adsorption-desorption isotherm (Fig. S3). The average pore diameter and surface areas are as follows: 6.63 nm, 665 m2/g (macro), and 152 m2/g (micro). 3.2 Determination of the location of the nanoparticles in the Au/SBA-15/A.S. preparations We needed to confirm that this RevIL deposition technique was able to deposit nanoparticles in the pores of SBA-15 mesoporous silica and not only on the external surface of SBA-15. Fig. 1A is a TEM micrograph showing the nanoparticles aligning with the channels of mesoporous silica. However, simply demonstrating the alignment of nanoparticles with the channel is insufficient to conclude that nanoparticles are inside the pores (e.g., they could be on the external surface of the SBA-15 mesoporous silica). By tilting the TEM platform, we confirm that the observed nanoparticles that align with the channels are inside the pores by then observing the same nanoparticles from a different perspective. The TEM platform was then rotated to +20 degrees to obtain Fig. 1B. Fig. 1B shows that the nanoparticles aligned with the channels in Fig. 1A are in the interior of the pore. This confirms that we can use this RevIL deposition technique to easily deposit nanoparticles in the pores of SBA-15 mesoporous silica without the needs for functionalizing the SBA-15 surface. 3.3 Effect of deposition on nanoparticle size After confirming that this RevIL deposition technique can deposit nanoparticles in the pores of SBA-15 mesoporous silica, we need to confirm, similar to our prior experience [9], that this RevIL technique is able to maintain the nanoparticle size throughout the deposition, providing a level of size control. Fig. 2A is a TEM micrograph of the colloidal RevIL-stabilized nanoparticles with 3.46 ± 0.53 nm average diameter ( Table 1). The histograms of all nanoparticle size distributions are available in the Supporting Information. Fig. 2B is a representative TEM micrograph of the Au/SBA-15/A.S. preparations used for nanoparticle sizing. The gold nanoparticles in the Au/SBA-15/A.S. preparations were determined to be 3.28 ± 0.42 nm average diameter. There was no significant statistical change (determined by a single-factor ANOVA analysis and Tukey HSD [28] with p > 0.05 in all cases) in the particle size from the colloidal RevIL-stabilized gold nanoparticles to the Au/SBA-15/A.S. preparations. The ANOVA analysis is presented in the Supporting Information. Hence, we can conclude that this RevIL deposition technique is able to maintain the nanoparticle size throughout deposition. 3.4 ATR-FTIR analysis The ATR-FTIR spectrums of APTES molecular liquids, RevILs, colloidal nanoparticles, catalyst preparations, and prepared SBA-15 mesoporous silica are shown in Fig. 3. The APTES molecular liquids are identifiable by the CH2 peaks at 2900 cm-1 and the N-H stretching of amine at 3250–3370 cm-1 [29]. The CH2 peaks are seen again in the RevIL spectrum as the reaction of APTES molecular liquids with CO2 forms RevILs. The RevILs are characterized by the asymmetric NCO2 - stretch of the carbamate ion at 1575 cm-1 [29]. The colloidal nanoparticles are only stabilized by RevILs as the N-H stretching of amine is absent. The absence of the asymmetric NCO2 - stretch of the carbamate ion, and the presence of the CH2 peaks are observed in the Au/SBA-15/A.S. spectrum, suggesting that vacuum-oven drying was sufficient to reverse the RevILs to the APTES molecular liquids. The full-scale NCO2 - and N-H stretches are shown in Fig. S7 (A) and (B), respectively. It should be noted that the peak towards 1650 cm-1 for the Au/SBA-15/A.S., Au/SBA-15/100 ℃, and prepared SBA-15 is likely ascribed to the adsorbed water [30] and does not belong to carbamate ions. Furthermore, the N-H stretching of amine (3250–3370 cm-1) is observed in the Au/SBA-15/A.S. spectrum. This implies that at least some APTES molecular liquids do not bind with gold nanoparticles as the N-H stretch of amine should disappear when amines interact with gold nanoparticles [31]. However, we cannot exclude the possibility that some APTES molecular liquids bind to the gold nanoparticles. Previous analysis [10] using x-ray photoelectron spectroscopy (XPS) has concluded that these reversal conditions result in the gold surface being effectively bare without any APTES molecular liquids. Comparatively, the N-H stretch of molecular liquids was not observed in the Au/SBA-15/100 °C spectrum. In comparing the 3100–3500 cm-1 regions in the prepared SBA-15 and the Au/SBA-15/100 °C spectrums, we see a broad water peak. This broad water peak overlaps with the N-H stretching of amine, leading to the underrepresentation of the intensity of the N-H stretching of the amine in the Au/SBA-15/100 °C spectrum. In summary, the FTIR results indicate that the incipient wetness RevIL catalyst synthesis technique is sufficient to completely reverse RevILs to APTES molecular liquids, and if this is in an agreement with previous results, should be catalytically active. Additionally, the further reduction of the molecular liquids during low-temperature calcination should further increase catalytic activity due to greater surface accessibility. 3.5 Calcination experiments One major benefit of catalyst designs leveraging nanoparticles inside the pores of mesoporous silica is the improved thermal stability. Furthermore, it has been demonstrated that RevIL-prepared catalysts reduce the sintering of nanoparticles during calcination compared to traditionally prepared thiol-stabilized nanoparticles [10]. The calcination experiments are used to determine if leveraging the pore structure of SBA-15 would improve the thermal stability, resulting in less change in nanoparticle size. As a control, the Au/SiO2/A.S. preparations ( Fig. 4A) can be compared to the Au/SiO2/230 °C preparations (Fig. 4B) to investigate the expected degree of nanoparticle sintering in the absence of a pore environment. The Au/SiO2/230 °C preparations show much larger nanoparticles than the Au/SiO2/A.S. preparations where the calcination leads to a 183 % (7.41 ± 3.02 nm vs. 2.62 ± 0.75 nm) increase in the average diameter of Au/SiO2/230 °C preparations (Table 1). Previous work indicated that the RevIL promotes sinter-resistance compared to traditionally prepared thiol-stabilized nanoparticles exposed to the same calcination [10]. The growth of these nanoparticles likely proceed via a particle migration and coalescence and/or Ostwald Ripening mechanism during calcination [32,33]; therefore, the sintering of the gold nanoparticles in the SiO2 preparations is thermodynamically favorable. Comparatively, no practical nanoparticle morphology changes were observed between the Au/SBA-15/A.S. preparations ( Fig. 5C) and the Au/SBA-15/230 °C preparations (Fig. 5D). The calcination results in an 11.3 % (3.65 ± 0.57 nm vs. 3.28 ± 0.42 nm) increase in the average diameter of the Au/SBA-15/230 °C preparations (Table 1). This indicates that the pore structure of SBA-15 improves the nanoparticles’ thermal stability under calcination conditions compared to the non-porous SiO2, thus providing an additional confirmation that the nanoparticles are inside the pores of SBA-15. Furthermore, Fig. 5C shows that the nanoparticles are far from each other as they are geometrically separated by the pores—the SBA-15 pore structure has created the additional energy barriers for inhibiting the sintering rate of nanoparticles [13,34,35]. These results agree with literature—the gold catalysts supported by mesoporous material have superior thermal stability compared to those prepared on high surface metal oxide supports [13,36,37]. 3.6 Catalytic activity evaluation The catalytic activities of all the catalyst preparations were evaluated in the oxidation of benzyl alcohol. This reaction has been used as a popular model catalytic test due to simple setup and handling procedures and relatively mild reaction conditions [38–40]. More importantly, this reaction is a benchmark to assess the activities of gold catalysts for promoting selective oxidation of benzyl alcohol [41]. The conversion of benzyl alcohols and the selectivity and yield of benzaldehyde and benzyl benzoate are reported as percentages and defined in Eqs. (1–4): (1) X = n BnOH _ I − n BnOH n BnOH _ I (2) S BnCHO = n BnCHO n BnOCO + n BnCHO (3) S BnOCO = n BnOCO n BnOCO + n BnCHO (4) Y i = X · S i Where X is the conversion of benzyl alcohol, n BnOH is the number of moles of benzyl alcohol at the conclusion of the reaction, n BnOH_I is the initial number of moles of benzyl alcohol, S BnCHO is the selectivity towards benzaldehyde, n BnCHO is the number of moles of benzaldehyde after the reaction, n BnOCO is the number of moles of benzyl benzoate after the reaction, S BnOCO is the selectivity towards benzyl benzoate, and Y is the yield of benzaldehyde or benzyl benzoate. Furthermore, the sum of the yields of benzaldehyde and benzyl benzoate is considered as the conversion of benzyl alcohol as the overall mass balance is less than 5 % different from the stock solution. The molar turnover frequency (TOF M ) is shown in Table 2 and defined as: (5) TOF M = n BnOH n Au · t Where n Au is the total moles of gold that were determined based on the TRXF and TGA results, and t is the time of reaction. A TOFM value is often reported as a “turnover frequency” in the literature [42–44], making it a useful comparison when the nanoparticle size is similar [45]. However, such comparison is not normalized based upon the active sites. To compare the fundamental catalysis, the turnover frequency on the surface atom basis was calculated for each catalyst preparation (Table 2). A surface turnover frequency (TOFS) is defined in Eq. 6: (6) TOF S = n BnOH n A u Surface · t Where n A u Surface represents the number of moles of gold surface atoms across the total surface area of the active phase in a given reaction. The surface gold atoms are calculated geometrically based upon gold loading (determined by the TRXF and TGA results), average nanoparticle size, and population polydispersity (Table 1). A demonstration of such calculation can be found in the Surface Atom Calcination Method section of the Supporting Information. 3.7 The catalytic activities of the Au/SBA-15/A.S. and the Au/SBA-15/100 °C preparations It should be noted that the selective oxidation of benzyl alcohol does not proceed in the absence of catalyst. The benzyl alcohol conversions using the Au/SBA-15/A.S. and Au/SBA-15/100 °C preparations are shown in Fig. 5. The Au/SBA-15/A.S. preparations show an 18.6 % conversion and 79.0 % selectivity toward benzaldehyde. The Au/SBA-15/A.S. preparations are catalytically active, indicating that calcination is not needed to remove the ligands from the gold surface, in agreement with the FTIR results. Additionally, they show a statistically significant decrease in the conversion (determined by a single-factor ANOVA analysis and Tukey HSD [28] with p < 0.05 in all cases, except cycle 3 vs. cycle 4) during four consecutive cycles, where cycle 1 is statistically significant from cycles 2–4; cycle 2 is statistically significant from cycles 3–4, which do not show a statistical significance. The ANOVA statistical analysis is presented in the Supporting Information. The conversion reduces in cycles 1–2, from 18.0 % to 9.80 % (approximately 53.5 % of initial conversion), and then remains roughly constant for the subsequent consecutive runs (Fig. S9). The apparent decrease in the conversion can be explained by the reaction-induced growth of nanoparticles as a 56 % increase (3.28 ± 0.42 nm to 5.12 ± 0.92 nm) in the particle size is observed during the reaction (Fig. S6). While there are practical impacts that reduce the conversion, the fundamental measurement of activity (TOFS) indicates that the activity remains relatively constant from cycle 1 (TOFS = 25.5 s-1) to cycle 2 (TOFS = 22.2 s-1). Comparatively, the Au/SBA-15/100 °C preparations show an increase in conversion (20.4 %) without sacrificing the selectivity toward benzaldehyde (79.5 %). Additionally, the TOF values of the Au/SBA-15/100 °C preparations (TOFM = 9.75 s-1, TOFS = 31.5 s-1) are higher than that of the Au/SBA-15/A.S. preparations (TOFM = 8.89 s-1, TOFS = 26.4 s-1). These differences in TOF values can be explained due to the presence of some APTES molecular liquids remaining on the catalyst’s surface. The FTIR results (Fig. 3) have demonstrated the presence of APTES molecules on the catalyst surface; however, FTIR cannot distinguish if they are chemisorbed to the gold surface, are chemisorbed to the SBA-15 silica, or are physisorbed to the catalyst surface. Furthermore, a previous work [10] using XPS has demonstrated that the APTES molecular liquids are not chemisorbed to the gold surface but are chemisorbed to the non-porous silica. However, this XPS result cannot eliminate the possibility that some APTES molecular liquids are physisorbed to the gold surface to block sites, thus reducing the number of active sites. The TGA results show a 250 % greater mass loss for the Au/SBA-15/A.S. preparations than the Au/SBA-15/100 °C preparations, indicating that a 100 ℃-calcination is sufficient to remove the APTES molecular liquids and effectively increases the total number of surface sites. The TGA results are shown in Fig. S8. Since the surface area used in the TOF calculation is a geometric determination and not a measurement, we are likely overestimating the number of sites for the Au/SBA-15/A.S. preparation, thus decreasing the true TOF value. Therefore, the number of sites and TOF value for the Au/SBA-15/100 ℃ preparation are more accurate. 3.8 The activities of the non-porous and porous gold catalysts before and after a 230 °C calcination The catalytic activities of the Au/SiO2/A.S. preparations and the Au/SBA-15/A.S. preparations are compared to investigate the impacts of pore and non-pore environments on the catalytic activities. The catalytic activities of the Au/SBA-15/230 oC preparations and the Au/SiO2/230 oC are compared to investigate the impact of particle size on the catalytic activities. The conversion using the Au/SiO2/A.S., Au/SiO2/230 ℃, Au/SBA-15/A.S., and Au/SBA-15/230 ℃ preparations are shown in Fig. 5. The Au/SiO2/A.S. preparations show a 15.8 % conversion and 83.3 % selectivity toward benzaldehyde. Comparatively, the Au/SBA-15/A.S. preparations show a higher conversion (18.6 %) and a 79.0 % selectivity toward benzaldehyde. Furthermore, the TOF values of the Au/SBA-15/A.S. preparations (TOFM = 8.89 s-1, TOFS = 26.4 s-1) are higher than that of the Au/SiO2/A.S. preparations (TOFM = 7.54 s-1, TOFS = 20.7 s-1), implying that there is an improved fundamental catalytic-activity after correcting for any impacts of loading or differences in the number of surface sites. Since the gold surface is effectively the same, all the other impacts must be due to the SBA-15 pore environment. Furthermore, the data is practically and statistically significant for activity analysis (determined by a single-factor ANOVA analysis and Tukey HSD [28] with p < 0.05 in all cases). The ANOVA statistical analysis is presented in the Supporting Information. Hence, the improved activity and the statistical significance in the data support the enhancement of catalytic activity induced by the SBA-15 pore geometry. The Au/SiO2/230 oC preparations show only a 4.20 % conversion and 98.0 % selectivity toward benzaldehydes; the increase (98.0 % vs. 83.3 %) in the benzaldehyde’s selectivity (compared to the Au/SiO2/A.S. preparations) is consistent with this. The nature of thermodynamically favorable reactions in series inherently leads to an increase in selectivity towards the intermediate products at lower conversions [45]. Additionally, the TOF values of the Au/SiO2/230 ℃ preparations (TOFM = 2.00 s-1, TOFS = 16.5 s-1) are significantly smaller than that of the Au/SiO2/A.S. preparations (TOFM = 7.54 s-1, TOFS = 20.7 s-1), implying the significant reduction in the activities of the non-porous gold catalysts after a 230 ℃ calcination. Such dramatic reduction in the activities can be attributed to a particle size effect (183 % increase in the particle size after a 230 ℃ calcination) in which the larger nanoparticles are fundamentally less active, likely due to significant reductions in the true active sites [46]. Comparatively, the Au/SBA-15/230 oC preparations show a 13.5 % conversion and 91.8 % selectivity toward benzaldehydes. Compared to the Au/SBA-15/A.S. preparations, the TOF values of Au/SBA-15/230 oC preparations (TOFM = 6.44 s-1, TOFS = 21.9 s-1) were slightly reduced; however, they are still as active as the Au/SiO2/A.S. preparations (TOFM = 7.54 s-1, TOFS = 20.7 s-1) and are significantly more active than the Au/SiO2/230 oC preparations (TOFM = 2.00 s-1, TOFS = 16.5 s-1). 4 Conclusion We have demonstrated that without the needs of the SBA-15 surface functionalization, the RevIL catalyst synthesis technique can deposit the RevIL-stabilized gold nanoparticles inside the pores of the SBA-15 mesoporous silica. The nanoparticles inside the SBA-15 pores show improved thermal stability under a 230 ℃ calcination compared to those supported on the surface of non-porous SiO2. Nanoparticles sintered on the surface of the non-porous SiO2, where the sintering was evidenced by TEM images and a 183 % increase in particle size. As the FTIR results indicated, vacuum-oven drying has completely reversed the RevILs to the APTES molecular liquids. Hence, the as-synthesized porous gold catalysts are active in the selective oxidation of benzyl alcohol without calcination. Additionally, they are more active than the as-synthesized non-porous gold catalysts, indicating that the pore geometry enhances catalytic activities. Furthermore, catalysts’ activities were improved following a 100 ℃ calcination, which is significantly milder than a 500 ℃-calcination benchmark. Up to a 230 ℃ calcination, the calcined porous gold catalysts are as active as the as-synthesized non-porous gold catalysts and are significantly more active than the calcined non-porous gold catalysts. The significant reduction in the activities of the calcined non-porous gold catalysts is likely due to the particle size effect (an 183 % increase in particle size). Lastly, the perceived benefits of this RevIL catalyst synthesis technique and the catalytic performance of the gold catalysts prepared by the RevIL technique are summarized. The RevIL technique is able to deposit gold nanoparticles in the pores of SBA-15 mesoporous silica, evidenced by the representative TEM images (Fig. 1) and the measured increase in the thermal stability from the porous SBA-15 silica to the non-porous silica. Additionally, the RevIL technique has effectively eliminated the needs for passivating the catalyst surface, potentially leading to more advanced catalyst structures that leverage triple-phase boundaries or strong metal-support interactions (SMSI), allowing for this technique to be translated to other types of mesoporous supports with minimal effort. Furthermore, the RevIL technique is able to provide a fine control over the nanoparticle size during deposition, agreeing with our previous results [9]. The as-synthesized gold catalysts prepared by the RevIL technique do not require calcination for catalysis, as they are immediately active in the selective oxidation of benzyl alcohol reaction due to the bare surface sites after deposition [10]. Additionally, the porous SBA-15 supported gold catalysts show a statistically significant increase in activity compared to the non-porous silica supported gold catalysts, implying that the pore geometry enhances catalytic performance. Furthermore, their activity does increase after a low-temperature (e.g., 100 ℃) calcination treatment—likely due to the removal of unbounded APTES molecular liquids; it should be noted that a 100 ℃-calcination is significantly milder than the 500 ℃-benchmark calcination. CRediT authorship contribution statement Zengran Sun: Methodology, Validation, Formal analysis, Investigation, Data curation, Writing – original draft, Writing – review & editing, Visualization. Ellis Hammond-Pereira: Formal analysis, Writing – review & editing. Xianghui Zhang: Investigation, Validation, Formal analysis, Writing – review & editing. Di Wu: Resources, Writing – review & editing. Steven R. Saunders: Conceptualization, Writing – review & editing, Supervision, Project administration, Funding acquisition. Declaration of Competing Interest The authors declare that they have no known competing financial interests or personal relationships that could have appeared to influence the work reported in this paper. Acknowledgement This work was supported by the National Science Foundation, USA under grant CAREER-1651597. The authors acknowledge the institutional funds from the Gene and Linda Voiland School of Chemical Engineering and Bioengineering and Alexandra Navrotsky Institute for Experimental Thermodynamics at Washington State University, USA. The authors thank the Franceschi Microscopy & Imaging Center and the Nuclear Magnetic Resonance Center to make the material characterization studies become possible. The authors thank Dr. Nobert Kruse’s generosity and Rui Zhang’s assistance on muffle furnace. The material synthesis of APTES, RevILs, and non-porous gold catalysts was completed with the assistance of Dr. Kristin Bryant. Appendix A Supporting information Supplementary data associated with this article can be found in the online version at doi:10.1016/j.apcata.2022.118725. Appendix A Supplementary material Supplementary material . References [1] M. Shamzhy M. Opanasenko P. Concepción A. Martínez Chem. Soc. Rev. 48 4 2019 1095 1149 10.1039/c8cs00887f Shamzhy, M.; Opanasenko, M.; Concepción, P.; Martínez, A. New Trends in Tailoring Active Sites in Zeolite-Based Catalysts. Chem. Soc. Rev. 2019, 48 (4), 1095–1149. https://doi.org/10.1039/c8cs00887f. [2] J.E. Mondloch E. Bayram R.G. Finke J. Mol. Catal. A Chem. 355 2012 1 38 10.1016/j.molcata.2011.11.011 Mondloch, J.E.; Bayram, E.; Finke, R.G. A Review of the Kinetics and Mechanisms of Formation of Supported-Nanoparticle Heterogeneous Catalysts. J. Mol. Catal. A Chem. 2012, 355, 1–38. https://doi.org/10.1016/j.molcata.2011.11.011. [3] J. Hu L. Chen K. Zhu A. Suchopar R. Richards Catal. Today 122 3–4 2007 277 283 10.1016/j.cattod.2007.01.012 Hu, J.; Chen, L.; Zhu, K.; Suchopar, A.; Richards, R. Aerobic Oxidation of Alcohols Catalyzed by Gold Nano-Particles Confined in the Walls of Mesoporous Silica. Catal. Today 2007, 122 (3–4), 277–283. https://doi.org/10.1016/j.cattod.2007.01.012. [4] H. Song R.M. Rioux J.D. Hoefelmeyer R. Komor K. Niesz M. Grass P. Yang G.A. Somorjai J. Am. Chem. Soc. 128 9 2006 3027 3037 10.1021/ja057383r Song, H.; Rioux, R.M.; Hoefelmeyer, J.D.; Komor, R.; Niesz, K.; Grass, M.; Yang, P.; Somorjai, G.A. Hydrothermal Growth of Mesoporous SBA-15 Silica in the Presence of PVP-Stabilized Pt Nanoparticles: Synthesis, Characterization, and Catalytic Properties. J. Am. Chem. Soc. 2006, 128 (9), 3027–3037. https://doi.org/10.1021/ja057383r. [5] L.F. Gutiérrez S. Hamoudi K. Belkacemi Catalysts 2011 10.3390/catal1010097 Gutiérrez, L.F.; Hamoudi, S.; Belkacemi, K. Synthesis of Gold Catalysts Supported on Mesoporous Silica Materials: Recent Developments. Catalysts. 2011. https://doi.org/10.3390/catal1010097. [6] C.Y. Ma B.J. Dou J.J. Li J. Cheng Q. Hu Z.P. Hao S.Z. Qiao Appl. Catal. B Environ. 92 1–2 2009 202 208 10.1016/j.apcatb.2009.07.007 Ma, C.Y.; Dou, B.J.; Li, J.J.; Cheng, J.; Hu, Q.; Hao, Z.P.; Qiao, S.Z. Catalytic Oxidation of Benzyl Alcohol on Au or Au-Pd Nanoparticles Confined in Mesoporous Silica. Appl. Catal. B Environ. 2009, 92 (1–2), 202–208. https://doi.org/10.1016/j.apcatb.2009.07.007. [7] A. Kumar B. Sreedhar K.V.R. Chary J. Nanosci. Nanotechnol. 15 2 2015 1714 1724 10.1166/jnn.2015.9022 Kumar, A.; Sreedhar, B.; Chary, K.V. R. Highly Dispersed Gold Nanoparticles Supported on SBA-15 for Vapor Phase Aerobic Oxidation of Benzyl Alcohol. J. Nanosci. Nanotechnol. 2015, 15 (2), 1714–1724. https://doi.org/10.1166/jnn.2015.9022. [8] X. Chu C. Wang L. Guo Y. Chi X. Gao X. Yang J. Chem. 2015 2015 10.1155/2015/737921 Chu, X.; Wang, C.; Guo, L.; Chi, Y.; Gao, X.; Yang, X. Mesoporous Silica Supported Au Nanoparticles with Controlled Size as Efficient Heterogeneous Catalyst for Aerobic Oxidation of Alcohols. J. Chem. 2015, 2015. https://doi.org/10.1155/2015/737921. [9] K. Bryant G. Ibrahim S.R. Saunders Langmuir 2017 10.1021/acs.langmuir.7b02983 Bryant, K.; Ibrahim, G.; Saunders, S.R. Switchable Surfactants for the Preparation of Monodisperse, Supported Nanoparticle Catalysts. Langmuir 2017. https://doi.org/10.1021/acs.langmuir.7b02983. [10] K. Bryant C.W. West S.R. Saunders Appl. Catal. A Gen. 579 February 2019 58 64 10.1016/j.apcata.2019.04.016 Bryant, K.; West, C.W.; Saunders, S.R. Impacts of Calcination on Surface-Clean Supported Nanoparticle Catalysts. Appl. Catal. A Gen. 2019, 579 (February), 58–64. https://doi.org/10.1016/j.apcata.2019.04.016. [11] K. Bryant E. Hammond-Pereira S.R. Saunders J. Phys. Chem. B 2021 10.1021/acs.jpcb.0c08908 Bryant, K.; Hammond-Pereira, E.; Saunders, S.R. Ionic Liquid Aggregation Mechanism for Nanoparticle Synthesis. J. Phys. Chem. B 2021. https://doi.org/10.1021/acs.jpcb.0c08908. [12] Y.Q. Su J.X. Liu I.A.W. Filot E.J.M. Hensen Chem. Mater. 29 21 2017 9456 9462 10.1021/acs.chemmater.7b03555 Su, Y.Q.; Liu, J.X.; Filot, I.A. W.; Hensen, E.J. M. Theoretical Study of Ripening Mechanisms of Pd Clusters on Ceria. Chem. Mater. 2017, 29 (21), 9456–9462. https://doi.org/10.1021/acs.chemmater.7b03555. [13] M. Sankar Q. He R.V. Engel M.A. Sainna A.J. Logsdail A. Roldan D.J. Willock N. Agarwal C.J. Kiely G.J. Hutchings Chem. Rev. 2020 10.1021/acs.chemrev.9b00662 Sankar, M.; He, Q.; Engel, R.V.; Sainna, M.A.; Logsdail, A.J.; Roldan, A.; Willock, D.J.; Agarwal, N.; Kiely, C.J.; Hutchings, G.J. Role of the Support in Gold-Containing Nanoparticles as Heterogeneous Catalysts. Chemical Reviews. 2020. https://doi.org/10.1021/acs.chemrev.9b00662. [14] Y. Zhu D. Wang L. Zhang F. Sun J. Xu S. Jiang Q. Yu RSC Adv. 2013 10.1039/c3ra41338a Zhu, Y.; Wang, D.; Zhang, L.; Sun, F.; Xu, J.; Jiang, S.; Yu, Q. In Situ Controlled Growth of Well-Dispersed Au Nanoparticles inside the Channels of SBA-15 Using a Simple, Bio-Inspired Method for Surface-Enhanced Raman Spectroscopy. RSC Adv. 2013. https://doi.org/10.1039/c3ra41338a. [15] W.R. Glomm G. Øye J. Walmsley J. Sjöblom J. Dispers. Sci. Technol. 26 6 2005 729 744 10.1081/DIS-200063041 Glomm, W.R.; Øye, G.; Walmsley, J.; Sjöblom, J. Synthesis and Characterization of Gold Nanoparticle-Functionalized Ordered Mesoporous Materials. J. Dispers. Sci. Technol. 2005, 26 (6), 729–744. https://doi.org/10.1081/DIS-200063041. [16] F. Xie Z. Xie P. Liu Y. Yuan J. Li S. Chen F. Guo J. Chen Z. Gu Microporous Mesoporous Mater. 266 March 2018 177 182 10.1016/j.micromeso.2018.03.001 Xie, F.; Xie, Z.; Liu, P.; Yuan, Y.; Li, J.; Chen, S.; Guo, F.; Chen, J.; Gu, Z. A Highly Organic Functionalized Three-Connected Periodic Mesoporous Silica by Co-Condensation with Hydridosilica. Microporous Mesoporous Mater. 2018, 266 (March), 177–182. https://doi.org/10.1016/j.micromeso.2018.03.001. [17] A.S. Maria Chong X.S. Zhao J. Phys. Chem. B 107 46 2003 12650 12657 10.1021/jp035877 Maria Chong, A.S.; Zhao, X.S. Functionalization of SBA-15 with APTES and Characterization of Functionalized Materials. J. Phys. Chem. B 2003, 107 (46), 12650–12657. https://doi.org/10.1021/jp035877+. [18] J. Zhao H. Yuan X. Qin K. Tian Y. Liu C. Wei Z. Zhang L. Zhou S. Fang Catal. Lett. 2020 10.1007/s10562-020-03190-3 Zhao, J.; Yuan, H.; Qin, X.; Tian, K.; Liu, Y.; Wei, C.; Zhang, Z.; Zhou, L.; Fang, S. Au Nanoparticles Confined in SBA-15 as a Highly Efficient and Stable Catalyst for Hydrogenation of Quinoline to 1,2,3,4-Tetrahydroquinoline. Catal. Letters 2020. https://doi.org/10.1007/s10562–020-03190–3. [19] J. Bouchet G. Rochat Y. Leterrier J.A.E. Månson P. Fayet Surf. Coat. Technol. 200 14–15 2006 4305 4311 10.1016/j.surfcoat.2005.02.148 Bouchet, J.; Rochat, G.; Leterrier, Y.; Månson, J.A. E.; Fayet, P. The Role of the Amino-Organosilane/SiOx Interphase in the Barrier and Mechanical Performance of Nanocomposites. Surf. Coatings Technol. 2006, 200 (14–15), 4305–4311. https://doi.org/10.1016/j.surfcoat.2005.02.148. [20] X.S. Zhao G.Q. Lu J. Phys. Chem. B 102 9 1998 1556 1561 10.1021/jp972788m Zhao, X.S.; Lu, G.Q. Modification of MCM-41 by Surface Silylation with Trimethylchlorosilane and Adsorption Study. J. Phys. Chem. B 1998, 102 (9), 1556–1561. https://doi.org/10.1021/jp972788m. [21] L. Mercier T.J. Pinnavaia Chem. Mater. 12 1 2000 188 196 10.1021/cm990532i Mercier, L.; Pinnavaia, T.J. Direct Synthesis of Hybrid Organic-Inorganic Nanoporous Silica by a Neutral Amine Assembly Route: Structure-Function Control by Stoichiometric Incorporation of Organosiloxane Molecules. Chem. Mater. 2000, 12 (1), 188–196. https://doi.org/10.1021/cm990532i. [22] P. Mohapatra S. Shaw D. Mendivelso-Perez J.M. Bobbitt T.F. Silva F. Naab B. Yuan X. Tian E.A. Smith L. Cademartiri Nat. Commun. 8 1 2017 10.1038/s41467-017-02267-9 Mohapatra, P.; Shaw, S.; Mendivelso-Perez, D.; Bobbitt, J.M.; Silva, T.F.; Naab, F.; Yuan, B.; Tian, X.; Smith, E.A.; Cademartiri, L. Calcination Does Not Remove All Carbon from Colloidal Nanocrystal Assemblies. Nat. Commun. 2017, 8 (1). https://doi.org/10.1038/s41467–017-02267–9. [23] M. Haruta CATTECH 2002 10.1023/A:1020181423055 Haruta, M. Catalysis of Gold Nanoparticles Deposited on Metal Oxides. CATTECH 2002. https://doi.org/10.1023/A:1020181423055. [24] M. Shepida O. Kuntyi S. Nichkalo G. Zozulya S. Korniy Adv. Mater. Sci. Eng. 2019 10.1155/2019/2629464 Shepida, M.; Kuntyi, O.; Nichkalo, S.; Zozulya, G.; Korniy, S. Deposition of Gold Nanoparticles via Galvanic Replacement in DMSO and Their Influence on Formation of Silicon Nanostructures. Adv. Mater. Sci. Eng. 2019. https://doi.org/10.1155/2019/2629464. [25] C. Louis Catalysts 2016 10.3390/catal6080110 Louis, C. Chemical Preparation of Supported Bimetallic Catalysts. Gold-Based Bimetallic, a Case Study. Catalysts. 2016. https://doi.org/10.3390/catal6080110. [26] A.S. Sharma H. Kaur D. Shah RSC Adv. 2016 10.1039/c5ra25646a Sharma, A.S.; Kaur, H.; Shah, D. Selective Oxidation of Alcohols by Supported Gold Nanoparticles: Recent Advances. RSC Advances. 2016. https://doi.org/10.1039/c5ra25646a. [27] E.M. Björk J. Chem. Educ. 94 1 2017 91 94 10.1021/acs.jchemed.5b01033 Björk, E.M. Synthesizing and Characterizing Mesoporous Silica SBA-15: A Hands-on Laboratory Experiment for Undergraduates Using Various Instrumental Techniques. J. Chem. Educ. 2017, 94 (1), 91–94. https://doi.org/10.1021/acs.jchemed.5b01033. [28] J. Vierheller Commun. Comput. Inf. Sci. 500 2014 110 126 10.1007/978-3-662-45006-2_9 Vierheller, J. Exploratory Data Analysis. Commun. Comput. Inf. Sci. 2014, 500, 110–126. https://doi.org/10.1007/978–3-662–45006-2_9. [29] J.R. Switzer A.L. Ethier K.M. Flack E.J. Biddinger L. Gelbaum P. Pollet C.A. Eckert C.L. Liotta Ind. Eng. Chem. Res. 2013 10.1021/ie4018836 Switzer, J.R.; Ethier, A.L.; Flack, K.M.; Biddinger, E.J.; Gelbaum, L.; Pollet, P.; Eckert, C.A.; Liotta, C.L. Reversible Ionic Liquid Stabilized Carbamic Acids: A Pathway toward Enhanced CO2 Capture. Ind. Eng. Chem. Res. 2013. https://doi.org/10.1021/ie4018836. [30] N. Mittal A. Samanta P. Sarkar R. Gupta Energy Sci. Eng. 3 3 2015 207 220 10.1002/ese3.64 Mittal, N.; Samanta, A.; Sarkar, P.; Gupta, R. Postcombustion CO2 Capture Using N-(3-Trimethoxysilylpropyl)Diethylenetriamine-Grafted Solid Adsorbent. Energy Sci. Eng. 2015, 3 (3), 207–220. https://doi.org/10.1002/ese3.64. [31] G. Yang W.S. Chang D.T. Hallinan J. Colloid Interface Sci. 460 2015 164 172 10.1016/j.jcis.2015.08.054 Yang, G.; Chang, W.S.; Hallinan, D.T. A Convenient Phase Transfer Protocol to Functionalize Gold Nanoparticles with Short Alkylamine Ligands. J. Colloid Interface Sci. 2015, 460, 164–172. https://doi.org/10.1016/j.jcis.2015.08.054. [32] T.W. Hansen A.T. Delariva S.R. Challa A.K. Datye Acc. Chem. Res. 46 8 2013 1720 1730 10.1021/ar3002427 Hansen, T.W.; Delariva, A.T.; Challa, S.R.; Datye, A.K. Sintering of Catalytic Nanoparticles: Particle Migration or Ostwald Ripening? Acc. Chem. Res. 2013, 46 (8), 1720–1730. https://doi.org/10.1021/ar3002427. [33] M.T. Bore H.N. Pham E.E. Switzer T.L. Ward A. Fukuoka A.K. Datye J. Phys. Chem. B 2005 10.1021/jp045917p Bore, M.T.; Pham, H.N.; Switzer, E.E.; Ward, T.L.; Fukuoka, A.; Datye, A.K. The Role of Pore Size and Structure on the Thermal Stability of Gold Nanoparticles within Mesoporous Silica. J. Phys. Chem. B 2005. https://doi.org/10.1021/jp045917p. [34] N. Liu G. Chen W. Dong C. Liu C. Xu Gold Bull. 50 2 2017 163 175 10.1007/s13404-017-0206-z Liu, N.; Chen, G.; Dong, W.; Liu, C.; Xu, C. Preparation of Au Nanoparticles with High Dispersion and Thermal Stability by a Controlled Impregnation Method for Alcohol Oxidation. Gold Bull. 2017, 50 (2), 163–175. https://doi.org/10.1007/s13404–017-0206-z. [35] J. Chen R. Zhang L. Han B. Tu D. Zhao Nano Res. 6 12 2013 871 879 10.1007/s12274-013-0363-1 Chen, J.; Zhang, R.; Han, L.; Tu, B.; Zhao, D. One-Pot Synthesis of Thermally Stable Gold@mesoporous Silica Core-Shell Nanospheres with Catalytic Activity. Nano Res. 2013, 6 (12), 871–879. https://doi.org/10.1007/s12274–013-0363–1. [36] J. Liu Q. Ji T. Imai K. Ariga H. Abe Sci. Rep. 2017 10.1038/srep41773 Liu, J.; Ji, Q.; Imai, T.; Ariga, K.; Abe, H. Sintering-Resistant Nanoparticles in Wide-Mouthed Compartments for Sustained Catalytic Performance. Sci. Rep. 2017. https://doi.org/10.1038/srep41773. [37] C.J. Gommes Nanoscale 2019 10.1039/c9nr01349k Gommes, C.J. Ostwald Ripening of Confined Nanoparticles: Chemomechanical Coupling in Nanopores. Nanoscale 2019. https://doi.org/10.1039/c9nr01349k. [38] V.R. Choudhary A. Dhar P. Jana R. Jha B.S. Uphade Green Chem. 7 11 2005 768 770 10.1039/b509003b Choudhary, V.R.; Dhar, A.; Jana, P.; Jha, R.; Uphade, B.S. A Green Process for Chlorine-Free Benzaldehyde from the Solvent-Free Oxidation of Benzyl Alcohol with Molecular Oxygen over a Supported Nano-Size Gold Catalyst. Green Chem. 2005, 7 (11), 768–770. https://doi.org/10.1039/b509003b. [39] V.R. Choudhary R. Jha P. Jana Green Chem. 9 3 2007 267 272 10.1039/b608304h Choudhary, V.R.; Jha, R.; Jana, P. Solvent-Free Selective Oxidation of Benzyl Alcohol by Molecular Oxygen over Uranium Oxide Supported Nano-Gold Catalyst for the Production of Chlorine-Free Benzaldehyde. Green Chem. 2007, 9 (3), 267–27. https://doi.org/10.1039/b608304h. [40] R.H. Adnan G.G. Andersson M.I.J. Polson G.F. Metha V.B. Golovko Catal. Sci. Technol. 5 2 2015 1323 1333 10.1039/c4cy01168f Adnan, R.H.; Andersson, G.G.; Polson, M.I. J.; Metha, G.F.; Golovko, V.B. Factors Influencing the Catalytic Oxidation of Benzyl Alcohol Using Supported Phosphine-Capped Gold Nanoparticles. Catal. Sci. Technol. 2015, 5 (2), 1323–1333. https://doi.org/10.1039/c4cy01168f. [41] C.Y. Ma J. Cheng H.L. Wang Q. Hu H. Tian C. He Z.P. Hao Catal. Today 158 3–4 2010 246 251 10.1016/j.cattod.2010.03.080 Ma, C.Y.; Cheng, J.; Wang, H.L.; Hu, Q.; Tian, H.; He, C.; Hao, Z.P. Characteristics of Au/HMS Catalysts for Selective Oxidation of Benzyl Alcohol to Benzaldehyde. Catal. Today 2010, 158 (3–4), 246–251. https://doi.org/10.1016/j.cattod.2010.03.080. [42] C.P. Ferraz M.A.S. Garcia É. Teixeira-Neto L.M. Rossi RSC Adv. 6 30 2016 25279 25285 10.1039/c6ra01795a Ferraz, C.P.; Garcia, M.A. S.; Teixeira-Neto, É.; Rossi, L.M. Oxidation of Benzyl Alcohol Catalyzed by Gold Nanoparticles under Alkaline Conditions: Weak vs. Strong Bases. RSC Adv. 2016, 6 (30), 25279–25285. https://doi.org/10.1039/c6ra01795a. [43] S.A.C. Carabineiro Front. Chem. 2019 10.3389/fchem.2019.00702 Carabineiro, S.A. C. Supported Gold Nanoparticles as Catalysts for the Oxidation of Alcohols and Alkanes. Frontiers in Chemistry. 2019. https://doi.org/10.3389/fchem.2019.00702. [44] P. Miedziak M. Sankar N. Dimitratos J.A. Lopez-Sanchez A.F. Carley D.W. Knight S.H. Taylor C.J. Kiely G.J. Hutchings Catal. Today 164 1 2011 315 319 10.1016/j.cattod.2010.10.028 Miedziak, P.; Sankar, M.; Dimitratos, N.; Lopez-Sanchez, J.A.; Carley, A.F.; Knight, D.W.; Taylor, S.H.; Kiely, C.J.; Hutchings, G.J. Oxidation of Benzyl Alcohol Using Supported Gold-Palladium Nanoparticles. Catal. Today 2011, 164 (1), 315–319. https://doi.org/10.1016/j.cattod.2010.10.028. [45] E. Hammond-Pereira K. Bryant T.R. Graham C. Yang S. Mergelsberg D. Wu S.R. Saunders React. Chem. Eng. 5 10 2020 1939 1949 10.1039/d0re00198h Hammond-Pereira, E.; Bryant, K.; Graham, T.R.; Yang, C.; Mergelsberg, S.; Wu, D.; Saunders, S.R. Mesoporous Silica-Encapsulated Gold Core-Shell Nanoparticles for Active Solvent-Free Benzyl Alcohol Oxidation. React. Chem. Eng. 2020, 5 (10), 1939–1949. https://doi.org/10.1039/d0re00198h. [46] P. Suchomel L. Kvitek R. Prucek A. Panacek A. Halder S. Vajda R. Zboril Sci. Rep. 2018 10.1038/s41598-018-22976-5 Suchomel, P.; Kvitek, L.; Prucek, R.; Panacek, A.; Halder, A.; Vajda, S.; Zboril, R. Simple Size-Controlled Synthesis of Au Nanoparticles and Their Size-Dependent Catalytic Activity. Sci. Rep. 2018. https://doi.org/10.1038/s41598–018-22976–5.",
      "scopus-id": "85132321199",
      "coredata": {
        "eid": "1-s2.0-S0926860X22002484",
        "dc:description": "Reversible ionic liquids (RevILs) are ionic liquids that can be switched between molecular and ionic forms via two stimuli, and they can assist in the synthesis of colloidal gold nanoparticles. The RevIL-stabilized gold nanoparticles are deposited in the pores of SBA-15 mesoporous silica via incipient wetness without the functionalization of the SBA-15 surface. The location of nanoparticles inside the pores was confirmed by transmission electron microscopy technique and by a measured increase in the thermal stability of the nanoparticles in SBA-15 compared to non-porous silica. The porous gold catalysts are active in the selective oxidation of benzyl alcohol without calcination due to the absence of the ligands on the gold surface after deposition. Additionally, they are more active than the non-porous gold catalysts, indicating that the pore geometry enhances catalytic performance. Ultimately, the catalysts prepared by RevIL technique are thermally stable and active and show fine control over particle size.",
        "openArchiveArticle": "false",
        "prism:coverDate": "2022-08-05",
        "openaccessUserLicense": null,
        "prism:aggregationType": "Journal",
        "prism:url": "https://api.elsevier.com/content/article/pii/S0926860X22002484",
        "dc:creator": [
          {
            "@_fa": "true",
            "$": "Sun, Zengran"
          },
          {
            "@_fa": "true",
            "$": "Hammond-Pereira, Ellis"
          },
          {
            "@_fa": "true",
            "$": "Zhang, Xianghui"
          },
          {
            "@_fa": "true",
            "$": "Wu, Di"
          },
          {
            "@_fa": "true",
            "$": "Saunders, Steven R."
          }
        ],
        "link": [
          {
            "@_fa": "true",
            "@rel": "self",
            "@href": "https://api.elsevier.com/content/article/pii/S0926860X22002484"
          },
          {
            "@_fa": "true",
            "@rel": "scidir",
            "@href": "https://www.sciencedirect.com/science/article/pii/S0926860X22002484"
          }
        ],
        "dc:format": "application/json",
        "openaccessType": null,
        "pii": "S0926-860X(22)00248-4",
        "prism:volume": "643",
        "articleNumber": "118725",
        "prism:publisher": "Elsevier B.V.",
        "dc:title": "Reversible ionic liquids (RevILs) for the preparation of thermally stable SBA-15 supported gold nanoparticle catalysts",
        "prism:copyright": "© 2022 Elsevier B.V. All rights reserved.",
        "openaccess": "0",
        "prism:issn": "0926860X",
        "dcterms:subject": [
          {
            "@_fa": "true",
            "$": "Switchable nature of reversible ionic liquids"
          },
          {
            "@_fa": "true",
            "$": "Gold nanoparticles"
          },
          {
            "@_fa": "true",
            "$": "SBA-15 mesoporous silica"
          },
          {
            "@_fa": "true",
            "$": "Thermal stability"
          }
        ],
        "openaccessArticle": "false",
        "prism:publicationName": "Applied Catalysis A: General",
        "openaccessSponsorType": null,
        "prism:pageRange": "118725",
        "pubType": "fla",
        "prism:coverDisplayDate": "5 August 2022",
        "prism:doi": "10.1016/j.apcata.2022.118725",
        "prism:startingPage": "118725",
        "dc:identifier": "doi:10.1016/j.apcata.2022.118725",
        "openaccessSponsorName": null
      },
      "objects": {
        "object": [
          {
            "@category": "standard",
            "@height": "239",
            "@width": "356",
            "@_fa": "true",
            "$": "https://api.elsevier.com/content/object/eid/1-s2.0-S0926860X22002484-gr5.jpg?httpAccept=%2A%2F%2A",
            "@multimediatype": "JPEG image file",
            "@type": "IMAGE-DOWNSAMPLED",
            "@size": "13355",
            "@ref": "gr5",
            "@mimetype": "image/jpeg"
          },
          {
            "@category": "standard",
            "@height": "860",
            "@width": "376",
            "@_fa": "true",
            "$": "https://api.elsevier.com/content/object/eid/1-s2.0-S0926860X22002484-gr4.jpg?httpAccept=%2A%2F%2A",
            "@multimediatype": "JPEG image file",
            "@type": "IMAGE-DOWNSAMPLED",
            "@size": "117981",
            "@ref": "gr4",
            "@mimetype": "image/jpeg"
          },
          {
            "@category": "standard",
            "@height": "177",
            "@width": "376",
            "@_fa": "true",
            "$": "https://api.elsevier.com/content/object/eid/1-s2.0-S0926860X22002484-gr3.jpg?httpAccept=%2A%2F%2A",
            "@multimediatype": "JPEG image file",
            "@type": "IMAGE-DOWNSAMPLED",
            "@size": "23855",
            "@ref": "gr3",
            "@mimetype": "image/jpeg"
          },
          {
            "@category": "standard",
            "@height": "470",
            "@width": "376",
            "@_fa": "true",
            "$": "https://api.elsevier.com/content/object/eid/1-s2.0-S0926860X22002484-gr2.jpg?httpAccept=%2A%2F%2A",
            "@multimediatype": "JPEG image file",
            "@type": "IMAGE-DOWNSAMPLED",
            "@size": "75772",
            "@ref": "gr2",
            "@mimetype": "image/jpeg"
          },
          {
            "@category": "standard",
            "@height": "200",
            "@width": "499",
            "@_fa": "true",
            "$": "https://api.elsevier.com/content/object/eid/1-s2.0-S0926860X22002484-ga1.jpg?httpAccept=%2A%2F%2A",
            "@multimediatype": "JPEG image file",
            "@type": "IMAGE-DOWNSAMPLED",
            "@size": "31936",
            "@ref": "ga1",
            "@mimetype": "image/jpeg"
          },
          {
            "@category": "standard",
            "@height": "471",
            "@width": "376",
            "@_fa": "true",
            "$": "https://api.elsevier.com/content/object/eid/1-s2.0-S0926860X22002484-gr1.jpg?httpAccept=%2A%2F%2A",
            "@multimediatype": "JPEG image file",
            "@type": "IMAGE-DOWNSAMPLED",
            "@size": "64491",
            "@ref": "gr1",
            "@mimetype": "image/jpeg"
          },
          {
            "@category": "standard",
            "@height": "72",
            "@width": "508",
            "@_fa": "true",
            "$": "https://api.elsevier.com/content/object/eid/1-s2.0-S0926860X22002484-sc2.jpg?httpAccept=%2A%2F%2A",
            "@multimediatype": "JPEG image file",
            "@type": "IMAGE-DOWNSAMPLED",
            "@size": "10390",
            "@ref": "sc2",
            "@mimetype": "image/jpeg"
          },
          {
            "@category": "standard",
            "@height": "62",
            "@width": "508",
            "@_fa": "true",
            "$": "https://api.elsevier.com/content/object/eid/1-s2.0-S0926860X22002484-sc1.jpg?httpAccept=%2A%2F%2A",
            "@multimediatype": "JPEG image file",
            "@type": "IMAGE-DOWNSAMPLED",
            "@size": "7645",
            "@ref": "sc1",
            "@mimetype": "image/jpeg"
          },
          {
            "@category": "thumbnail",
            "@height": "147",
            "@width": "219",
            "@_fa": "true",
            "$": "https://api.elsevier.com/content/object/eid/1-s2.0-S0926860X22002484-gr5.sml?httpAccept=%2A%2F%2A",
            "@multimediatype": "GIF image file",
            "@type": "IMAGE-THUMBNAIL",
            "@size": "5685",
            "@ref": "gr5",
            "@mimetype": "image/gif"
          },
          {
            "@category": "thumbnail",
            "@height": "162",
            "@width": "71",
            "@_fa": "true",
            "$": "https://api.elsevier.com/content/object/eid/1-s2.0-S0926860X22002484-gr4.sml?httpAccept=%2A%2F%2A",
            "@multimediatype": "GIF image file",
            "@type": "IMAGE-THUMBNAIL",
            "@size": "8634",
            "@ref": "gr4",
            "@mimetype": "image/gif"
          },
          {
            "@category": "thumbnail",
            "@height": "103",
            "@width": "219",
            "@_fa": "true",
            "$": "https://api.elsevier.com/content/object/eid/1-s2.0-S0926860X22002484-gr3.sml?httpAccept=%2A%2F%2A",
            "@multimediatype": "GIF image file",
            "@type": "IMAGE-THUMBNAIL",
            "@size": "8598",
            "@ref": "gr3",
            "@mimetype": "image/gif"
          },
          {
            "@category": "thumbnail",
            "@height": "164",
            "@width": "131",
            "@_fa": "true",
            "$": "https://api.elsevier.com/content/object/eid/1-s2.0-S0926860X22002484-gr2.sml?httpAccept=%2A%2F%2A",
            "@multimediatype": "GIF image file",
            "@type": "IMAGE-THUMBNAIL",
            "@size": "14016",
            "@ref": "gr2",
            "@mimetype": "image/gif"
          },
          {
            "@category": "thumbnail",
            "@height": "88",
            "@width": "219",
            "@_fa": "true",
            "$": "https://api.elsevier.com/content/object/eid/1-s2.0-S0926860X22002484-ga1.sml?httpAccept=%2A%2F%2A",
            "@multimediatype": "GIF image file",
            "@type": "IMAGE-THUMBNAIL",
            "@size": "11284",
            "@ref": "ga1",
            "@mimetype": "image/gif"
          },
          {
            "@category": "thumbnail",
            "@height": "164",
            "@width": "131",
            "@_fa": "true",
            "$": "https://api.elsevier.com/content/object/eid/1-s2.0-S0926860X22002484-gr1.sml?httpAccept=%2A%2F%2A",
            "@multimediatype": "GIF image file",
            "@type": "IMAGE-THUMBNAIL",
            "@size": "14537",
            "@ref": "gr1",
            "@mimetype": "image/gif"
          },
          {
            "@category": "thumbnail",
            "@height": "31",
            "@width": "219",
            "@_fa": "true",
            "$": "https://api.elsevier.com/content/object/eid/1-s2.0-S0926860X22002484-sc2.sml?httpAccept=%2A%2F%2A",
            "@multimediatype": "GIF image file",
            "@type": "IMAGE-THUMBNAIL",
            "@size": "2087",
            "@ref": "sc2",
            "@mimetype": "image/gif"
          },
          {
            "@category": "thumbnail",
            "@height": "27",
            "@width": "219",
            "@_fa": "true",
            "$": "https://api.elsevier.com/content/object/eid/1-s2.0-S0926860X22002484-sc1.sml?httpAccept=%2A%2F%2A",
            "@multimediatype": "GIF image file",
            "@type": "IMAGE-THUMBNAIL",
            "@size": "2118",
            "@ref": "sc1",
            "@mimetype": "image/gif"
          },
          {
            "@category": "high",
            "@height": "1061",
            "@width": "1579",
            "@_fa": "true",
            "$": "https://api.elsevier.com/content/object/eid/1-s2.0-S0926860X22002484-gr5_lrg.jpg?httpAccept=%2A%2F%2A",
            "@multimediatype": "JPEG image file",
            "@type": "IMAGE-HIGH-RES",
            "@size": "70566",
            "@ref": "gr5",
            "@mimetype": "image/jpeg"
          },
          {
            "@category": "high",
            "@height": "3804",
            "@width": "1663",
            "@_fa": "true",
            "$": "https://api.elsevier.com/content/object/eid/1-s2.0-S0926860X22002484-gr4_lrg.jpg?httpAccept=%2A%2F%2A",
            "@multimediatype": "JPEG image file",
            "@type": "IMAGE-HIGH-RES",
            "@size": "687437",
            "@ref": "gr4",
            "@mimetype": "image/jpeg"
          },
          {
            "@category": "high",
            "@height": "781",
            "@width": "1663",
            "@_fa": "true",
            "$": "https://api.elsevier.com/content/object/eid/1-s2.0-S0926860X22002484-gr3_lrg.jpg?httpAccept=%2A%2F%2A",
            "@multimediatype": "JPEG image file",
            "@type": "IMAGE-HIGH-RES",
            "@size": "131003",
            "@ref": "gr3",
            "@mimetype": "image/jpeg"
          },
          {
            "@category": "high",
            "@height": "2077",
            "@width": "1663",
            "@_fa": "true",
            "$": "https://api.elsevier.com/content/object/eid/1-s2.0-S0926860X22002484-gr2_lrg.jpg?httpAccept=%2A%2F%2A",
            "@multimediatype": "JPEG image file",
            "@type": "IMAGE-HIGH-RES",
            "@size": "450483",
            "@ref": "gr2",
            "@mimetype": "image/jpeg"
          },
          {
            "@category": "high",
            "@height": "886",
            "@width": "2211",
            "@_fa": "true",
            "$": "https://api.elsevier.com/content/object/eid/1-s2.0-S0926860X22002484-ga1_lrg.jpg?httpAccept=%2A%2F%2A",
            "@multimediatype": "JPEG image file",
            "@type": "IMAGE-HIGH-RES",
            "@size": "230112",
            "@ref": "ga1",
            "@mimetype": "image/jpeg"
          },
          {
            "@category": "high",
            "@height": "2082",
            "@width": "1663",
            "@_fa": "true",
            "$": "https://api.elsevier.com/content/object/eid/1-s2.0-S0926860X22002484-gr1_lrg.jpg?httpAccept=%2A%2F%2A",
            "@multimediatype": "JPEG image file",
            "@type": "IMAGE-HIGH-RES",
            "@size": "351362",
            "@ref": "gr1",
            "@mimetype": "image/jpeg"
          },
          {
            "@category": "high",
            "@height": "319",
            "@width": "2245",
            "@_fa": "true",
            "$": "https://api.elsevier.com/content/object/eid/1-s2.0-S0926860X22002484-sc2_lrg.jpg?httpAccept=%2A%2F%2A",
            "@multimediatype": "JPEG image file",
            "@type": "IMAGE-HIGH-RES",
            "@size": "50613",
            "@ref": "sc2",
            "@mimetype": "image/jpeg"
          },
          {
            "@category": "high",
            "@height": "272",
            "@width": "2245",
            "@_fa": "true",
            "$": "https://api.elsevier.com/content/object/eid/1-s2.0-S0926860X22002484-sc1_lrg.jpg?httpAccept=%2A%2F%2A",
            "@multimediatype": "JPEG image file",
            "@type": "IMAGE-HIGH-RES",
            "@size": "35360",
            "@ref": "sc1",
            "@mimetype": "image/jpeg"
          },
          {
            "@category": "standard",
            "@_fa": "true",
            "$": "https://api.elsevier.com/content/object/eid/1-s2.0-S0926860X22002484-mmc1.pdf?httpAccept=%2A%2F%2A",
            "@multimediatype": "Acrobat PDF file",
            "@type": "APPLICATION",
            "@size": "1282277",
            "@ref": "mmc1",
            "@mimetype": "application/pdf"
          },
          {
            "@category": "thumbnail",
            "@_fa": "true",
            "$": "https://api.elsevier.com/content/object/eid/1-s2.0-S0926860X22002484-si0001.svg?httpAccept=%2A%2F%2A",
            "@multimediatype": "Scalable Vector Graphics file",
            "@type": "ALTIMG",
            "@size": "2787",
            "@ref": "si0001",
            "@mimetype": "image/svg+xml"
          },
          {
            "@category": "thumbnail",
            "@_fa": "true",
            "$": "https://api.elsevier.com/content/object/eid/1-s2.0-S0926860X22002484-si0002.svg?httpAccept=%2A%2F%2A",
            "@multimediatype": "Scalable Vector Graphics file",
            "@type": "ALTIMG",
            "@size": "3456",
            "@ref": "si0002",
            "@mimetype": "image/svg+xml"
          },
          {
            "@category": "thumbnail",
            "@_fa": "true",
            "$": "https://api.elsevier.com/content/object/eid/1-s2.0-S0926860X22002484-si0003.svg?httpAccept=%2A%2F%2A",
            "@multimediatype": "Scalable Vector Graphics file",
            "@type": "ALTIMG",
            "@size": "3444",
            "@ref": "si0003",
            "@mimetype": "image/svg+xml"
          },
          {
            "@category": "thumbnail",
            "@_fa": "true",
            "$": "https://api.elsevier.com/content/object/eid/1-s2.0-S0926860X22002484-si0004.svg?httpAccept=%2A%2F%2A",
            "@multimediatype": "Scalable Vector Graphics file",
            "@type": "ALTIMG",
            "@size": "1491",
            "@ref": "si0004",
            "@mimetype": "image/svg+xml"
          },
          {
            "@category": "thumbnail",
            "@_fa": "true",
            "$": "https://api.elsevier.com/content/object/eid/1-s2.0-S0926860X22002484-si0005.svg?httpAccept=%2A%2F%2A",
            "@multimediatype": "Scalable Vector Graphics file",
            "@type": "ALTIMG",
            "@size": "2338",
            "@ref": "si0005",
            "@mimetype": "image/svg+xml"
          },
          {
            "@category": "thumbnail",
            "@_fa": "true",
            "$": "https://api.elsevier.com/content/object/eid/1-s2.0-S0926860X22002484-si0006.svg?httpAccept=%2A%2F%2A",
            "@multimediatype": "Scalable Vector Graphics file",
            "@type": "ALTIMG",
            "@size": "2775",
            "@ref": "si0006",
            "@mimetype": "image/svg+xml"
          },
          {
            "@category": "thumbnail",
            "@_fa": "true",
            "$": "https://api.elsevier.com/content/object/eid/1-s2.0-S0926860X22002484-si0007.svg?httpAccept=%2A%2F%2A",
            "@multimediatype": "Scalable Vector Graphics file",
            "@type": "ALTIMG",
            "@size": "1697",
            "@ref": "si0007",
            "@mimetype": "image/svg+xml"
          },
          {
            "@category": "standard",
            "@_fa": "true",
            "$": "https://api.elsevier.com/content/object/eid/1-s2.0-S0926860X22002484-am.pdf?httpAccept=%2A%2F%2A",
            "@multimediatype": "Acrobat PDF file",
            "@type": "AAM-PDF",
            "@size": "2215242",
            "@ref": "am",
            "@mimetype": "application/pdf"
          }
        ]
      },
      "link": {
        "@rel": "abstract",
        "@href": "https://api.elsevier.com/content/abstract/scopus_id/85132321199"
      }
    }
  }
}