{
  "metadata": {
    "title": "Au and Pt nanoparticle supported catalysts tailored for H<ce:inf loc=post>2</ce:inf> production: From models to powder catalysts",
    "authors": "; ; ",
    "journal": "Applied Catalysis A: General",
    "date": "2016-05-25",
    "doi": "10.1016/j.apcata.2015.12.012",
    "abstract": "",
    "uri": "https://api.elsevier.com/content/article/pii/S0926860X15302866",
    "pii": "S0926860X15302866"
  },
  "fulltext": {
    "full-text-retrieval-response": {
      "scopus-eid": "2-s2.0-84950341965",
      "originalText": "serial JL 271346 291210 291744 291809 31 Applied Catalysis A: General APPLIEDCATALYSISAGENERAL 2015-12-10 2015-12-10 2016-04-29 2016-04-29 2019-10-26T16:43:45 1-s2.0-S0926860X15302866 S0926-860X(15)30286-6 S0926860X15302866 10.1016/j.apcata.2015.12.012 S300 S300.3 FULL-TEXT 1-s2.0-S0926860X16X00087 2024-01-01T12:31:47.592716Z 0 0 20160525 2016 2015-12-10T16:06:34.800001Z absattachment articleinfo articletitlenorm authfirstinitialnorm authfirstsurnamenorm cid cids confeditor contenttype copyright crossmark dateloaded dateloadedtxt datesearch datesort dateupdated dco docsubtype doctype doi eid ewtransactionid hubeid indexeddate issn issnnorm itemstage itemtransactionid itemweight openaccess openarchive pg pgfirst pglast pii piinorm pubdatestart pubdatetxt pubyr sectiontitle sortorder srctitle srctitlenorm srctype ssids alllist content subj subheadings suppl tomb vol volfirst volissue volumelist webpdf webpdfpagecount yearnav figure body mmlmath acknowledge affil articletitle auth authfirstini authfull authkeywords authlast grantnumber grantsponsor grantsponsorid highlightsabst primabst ref specialabst 0926-860X 0926860X true 518 518 C Volume 518 5 18 47 18 47 20160525 25 May 2016 2016-05-25 2016 Hydrogen from Oxygenated Molecules Dr. Gerardo Colón Dr. Sanjaya D. Senanayake Dr. Anna E. Kubacka Articles article fla © 2015 Elsevier B.V. All rights reserved. AUPTNANOPARTICLESUPPORTEDCATALYSTSTAILOREDFORH2PRODUCTIONMODELSPOWDERCATALYSTS NGUYENPHAN T 1 Introduction 2 Surface science and DFT models 3 Powder nanocatalysts 3.1 Synthesis approaches of NPs supported catalysts 3.2 Structure-reactivity correlation and mechanistic insights 3.2.1 Water–gas shift reaction 3.2.2 Oxygenate steam reforming reaction 3.2.3 Solar-assisted H2 production 4 Conclusions and future outlook Acknowledgements References ERTL 2008 G HANDBOOKHETEROGENEOUSCATALYSIS OZKAN 2009 U DESIGNHETEROGENEOUSCATALYSIS STACCHIOLA 2001 11233 11239 D SENANAYAKE 2009 19536 19544 S LIN 2011 18582 18588 C LUO 2012 4149 4156 Q TENNEY 2011 11112 11123 S GALHENAGE 2012 24616 24629 R TENNEY 2013 26998 27006 S SENANAYAKE 2008 9744 9752 S VOHS 2013 4136 4163 J MULLER 2014 1576 1586 K STAUDT 2011 8716 8724 T YANG 2011 10198 10202 F STACCHIOLA 2013 4373 4390 D RODRIGUEZ 2009 8191 8194 J SENANAYAKE 2010 392 400 S SENANAYAKE 2013 1702 1711 S SENANAYAKE 2014 25057 25064 S OYAMA 1996 S CHEMISTRYTRANSITIONMETALCARBIDESNITRIDES RODRIGUEZ 2000 L413 L420 J LIU 2003 247 252 P HORN 2005 44 47 J RODRIGUEZ 2009 8595 8602 J POSADAPEREZ 2015 159 173 S KUSHMERICK 2000 2980 2988 J KANDEL 2001 8102 8106 S RODRIGUEZ 2003 276 285 J GRACIANI 2007 244713 J GRACIANI 2008 12056 12063 J MULLINS 1999 186 198 D LU 2007 8 16 J RODRIGUEZ 2007 1329 1332 J BRUIX 2012 8968 8974 A FLAHERTY 2011 278 288 D ZHOU 2010 11853 11860 Y SPIRIDIS 2001 99 105 N GALHENAGE 2013 7191 7201 R IDDIR 2005 081407 H MATTHEY 2007 1692 1696 D PARK 2009 4975 4980 J PARK 2010 356 363 J STACCHIOLA 2013 4373 4390 D FISHER 1980 683 686 G BEDURFTIG 1999 11147 11154 K IDDIR 2006 039902 H RODRIGUEZ 2009 7364 7370 J BRANDA 2009 094702 M BROWN 2010 4064 4065 M BROWN 2011 10668 10676 M LIN 2010 7745 7749 X LIN 2009 206801 X GIORDANO 2007 144713 L SICOLO 2009 10256 10263 S HERZING 2008 1331 1335 A YOSHIDA 2012 317 319 H WILLIAMS 2010 14018 14020 W SHEKHAR 2012 4700 4708 M CARGNELLO 2013 771 773 M FU 2003 935 938 Q JANSSENS 2007 15 26 T FUJITANI 2009 9515 9518 T BOCCUZZI 2001 256 267 F HARUTA 2002 102 115 M SINATRA 2015 109 117 L THOMAS 2011 588 594 J FLYTZANISTEPHANOPOULOS 2012 545 574 M ZHANG 2012 5520 5551 Z YANG 2013 1740 1748 X YANG 2015 183 201 F TOMPOS 2008 348 356 A HARUTA 1989 301 309 M QIAO 2015 2913 2924 B QIAO 2011 634 641 B POMPEO 2010 8912 8920 F SU 2012 6284 6292 R SANCHEZ 1999 9573 9578 A TABAKOVA 2003 385 397 T YAN 2005 1604 1605 Z HARTADI 2015 456 465 Y DENG 2007 199 208 W RODRIGUEZ 2002 5242 5250 J FROST 1988 577 580 J WANG 2005 221101 X BURCH 2006 5483 5500 R RODRIGUEZ 2011 3 10 J GUZMAN 2003 690 693 J GUZMAN 2004 111 119 J ZHANG 2005 7132 7135 X ZHAI 2010 1633 1636 Y ZHANG 2012 9628 9632 C YANG 2013 3768 3771 M YANG 2014 1498 1501 M LOPEZ 2004 232 235 N BAMWENDA 1995 177 189 G HARUTA 1997 153 166 M ZANELLA 2005 768 777 R AUPRETRE 2002 263 267 F BREEN 2002 65 74 J LIGURAS 2003 345 354 D NURUNNABI 2005 272 280 M DUAN 2005 6381 6386 S YANG 2006 217 222 Z ERDOHELYI 2006 367 376 A BASAGIANNIS 2008 2 12 A SANCHEZSANCHEZ 2010 3873 3882 M ROSSELER 2010 179 190 O AVILANETO 2012 124 137 C XU 2012 117 126 W KUNDU 2012 14062 14070 S CASTANO 2014 1 9 M LUO 2015 2669 2679 S JACOBS 2004 203 214 G PIERRE 2007 363 373 D PROFETI 2009 5049 5060 L BILAL 2013 754 766 M ANDREEVA 2002 51 57 D JACOBS 2003 935 938 G CHENU 2004 203 214 E JACOBS 2005 229 243 G DOZZI 2009 7171 7180 M SILVA 2011 595 602 C MURDOCH 2011 489 492 M SI 2012 23547 23555 R QIAN 2013 679 687 K TABAKOVA 2013 70 80 T ZHANG 2012 331 338 P ARROYORAMIREZ 2014 19509 19514 L XIA 2015 11824 11832 W LI 2013 2005 Y NALDONI 2013 239 248 A LONG 2014 973 977 J JOO 2014 7942 7947 J NALDONI 2015 4864 4869 A WANG 2015 3924 3931 F COMOTTI 2006 917 924 M CHIARELLO 2010 182 190 G YOO 2015 47 54 S LIU 2005 81 88 Z CHEN 2012 10057 10063 L PILGER 2015 3530 3539 F YUAN 2009 169 178 Q KANDIEL 2010 2050 2060 T MAICU 2011 275 283 M FANG 2012 17853 17861 J GARTNER 2012 530 533 F LIU 2012 61 66 G SPELTINI 2014 1410 1419 A ZHANG 2014 1446 1452 L BERA 2003 6122 6130 P IVANOVA 2006 278 283 S MIZUKOSHI 2007 387 392 Y ZHOU 2010 4998 4999 H REINA 2013 779 787 T LIU 2007 164705 P BUNLUESIN 1998 107 114 T SATO 2005 80 89 Y GONZALEZ 2010 372 379 I YANG 2007 075421 Z ACERBI 2013 7737 7741 N HAMMER 1995 238 240 B GRABOW 2008 4608 4617 L RATNASAMY 2009 325 440 C PHATAK 2009 7269 7276 A SUTTON 2001 155 173 D DAVDA 2005 171 186 R SA 2010 43 57 S DASILVA 2011 2057 2075 A MATTOS 2012 4094 4123 L ZANCHET 2015 3841 3863 D JACOBS 2005 43 49 G DOMOK 2007 262 272 M JACOBS 2007 326 337 G LI 1990 445 455 C SHIDO 1992 493 503 T BINET 1994 6392 6398 C BINET 1999 207 225 C BARTHOLOMEW 2001 17 60 C CHOUDHARY 1995 752 754 V ZHANG 2003 251 259 J PARIZOTTO 2007 12 22 N SHENG 2007 313 321 P CROY 2008 207 216 J KOH 2009 5691 5703 A BARBOSA 2013 6143 6150 R SHENG 2004 1652 1658 P SHENG 2004 171 181 P FARTARIA 2007 2169 2177 R ALCALA 2003 178 190 R WANG 2009 6681 6688 J SUTTON 2013 4691 4706 J HARYANTO 2005 2098 2106 A NI 2007 3238 3247 M GU 2014 3886 3890 X GAZSI 2009 33 41 A JAKOB 2003 353 358 M LIDE 2007 D CRCHANDBOOKCHEMISTRYPHYSICS GRATZEL 2001 338 344 M LINSEBIGLER 1995 735 758 A LINIC 2011 911 921 S KOWALSKA 2010 2344 2355 E LINIC 2011 911 921 S ZENG 2013 1128 1133 S DHARA 2003 254 260 S PARAYIL 2013 16850 16862 S LIU 2003 266102 Z SHINDLER 1990 8222 8226 K YAMAKATA 2007 133 137 A KATOH 2008 238 241 R HURUM 2003 4545 4549 D SUN 2003 3151 3156 B SCANLON 2013 798 801 D KINSINGER 2013 6247 6254 N LUO 2015 6 17 Z LI 2014 9130 X HE 2014 16981 16985 L NGUYENPHANX2016X18 NGUYENPHANX2016X18X47 NGUYENPHANX2016X18XT NGUYENPHANX2016X18X47XT https://vtw.elsevier.com/content/oragreement/10131 CHU_DOE publishAcceptedManuscriptIndexable 2017-04-29T00:00:00Z http://www.elsevier.com/open-access/userlicense/1.0/ 2017-04-29T00:00:00Z http://creativecommons.org/licenses/by-nc-nd/4.0/ © 2015 Elsevier B.V. All rights reserved. 2019-03-17T03:30:48.317Z http://vtw.elsevier.com/data/voc/AddOnTypes/50.7/nlp S0926860X15302866 Office of Basic Energy Sciences Basic Energy Sciences http://data.elsevier.com/vocabulary/SciValFunders/100006151 http://sws.geonames.org/6252001/ Office of Science Office of Science http://data.elsevier.com/vocabulary/SciValFunders/100006132 http://sws.geonames.org/6252001/ U.S. Department of Energy U.S. Department of Energy http://data.elsevier.com/vocabulary/SciValFunders/100000015 http://sws.geonames.org/6252001/ Catalysis Science Program Brookhaven National Laboratory Brookhaven National Laboratory http://data.elsevier.com/vocabulary/SciValFunders/100006231 http://sws.geonames.org/6252001/ The work carried out at Brookhaven National Laboratory was supported by the U.S. Department of Energy , Office of Science , Office of Basic Energy Sciences , and Catalysis Science Program under contract No. DE-SC0012704. item S0926-860X(15)30286-6 S0926860X15302866 1-s2.0-S0926860X15302866 10.1016/j.apcata.2015.12.012 271346 2024-01-01T12:31:47.592716Z 2016-05-25 1-s2.0-S0926860X15302866-main.pdf https://s3.amazonaws.com/prod-ucs-content-store-us-east/content/pii:S0926860X15302866/MAIN/application/pdf/d8f93be9a24b39bcd3901a2a1bc94680/main.pdf main.pdf pdf true 11007407 MAIN 30 1-s2.0-S0926860X15302866-main_1.png https://s3.amazonaws.com/prod-ucs-content-store-us-east/content/pii:S0926860X15302866/PREVIEW/image/png/9777ac1a285aff0b14e998e7356dac16/main_1.png main_1.png png 53339 849 656 IMAGE-WEB-PDF 1 1-s2.0-S0926860X15302866-fx1.sml https://s3.amazonaws.com/prod-ucs-content-store-us-east/content/pii:S0926860X15302866/fx1/THUMBNAIL/image/gif/26b7ef8b1b27f896aba91c6160c9bc1c/fx1.sml fx1 true fx1.sml sml 6050 88 219 IMAGE-THUMBNAIL 1-s2.0-S0926860X15302866-gr1.sml https://s3.amazonaws.com/prod-ucs-content-store-us-east/content/pii:S0926860X15302866/gr1/THUMBNAIL/image/gif/c67200594776ee7fbe6c824103c83a00/gr1.sml gr1 gr1.sml sml 7610 164 208 IMAGE-THUMBNAIL 1-s2.0-S0926860X15302866-gr10.sml https://s3.amazonaws.com/prod-ucs-content-store-us-east/content/pii:S0926860X15302866/gr10/THUMBNAIL/image/gif/2739f3c986fc74d39b33301908e61aaa/gr10.sml gr10 gr10.sml sml 21338 137 219 IMAGE-THUMBNAIL 1-s2.0-S0926860X15302866-gr11.sml https://s3.amazonaws.com/prod-ucs-content-store-us-east/content/pii:S0926860X15302866/gr11/THUMBNAIL/image/gif/8bf20b1cedfa7840a226a17dabc3fa2a/gr11.sml gr11 gr11.sml sml 30052 164 203 IMAGE-THUMBNAIL 1-s2.0-S0926860X15302866-gr12.sml https://s3.amazonaws.com/prod-ucs-content-store-us-east/content/pii:S0926860X15302866/gr12/THUMBNAIL/image/gif/0c25972e57f1fad68d6ab1cd64865657/gr12.sml gr12 gr12.sml sml 24104 164 208 IMAGE-THUMBNAIL 1-s2.0-S0926860X15302866-gr13.sml https://s3.amazonaws.com/prod-ucs-content-store-us-east/content/pii:S0926860X15302866/gr13/THUMBNAIL/image/gif/afe6f8678fa7bcd09a4b8a5aaaae8a3a/gr13.sml gr13 gr13.sml sml 13429 164 200 IMAGE-THUMBNAIL 1-s2.0-S0926860X15302866-gr14.sml https://s3.amazonaws.com/prod-ucs-content-store-us-east/content/pii:S0926860X15302866/gr14/THUMBNAIL/image/gif/c7a723ab662c612e527c503305e7e8ec/gr14.sml gr14 gr14.sml sml 11274 155 219 IMAGE-THUMBNAIL 1-s2.0-S0926860X15302866-gr15.sml https://s3.amazonaws.com/prod-ucs-content-store-us-east/content/pii:S0926860X15302866/gr15/THUMBNAIL/image/gif/b26b6b8a4a8abe48eedfe08fc2e7c6d8/gr15.sml gr15 gr15.sml sml 11067 163 109 IMAGE-THUMBNAIL 1-s2.0-S0926860X15302866-gr16.sml https://s3.amazonaws.com/prod-ucs-content-store-us-east/content/pii:S0926860X15302866/gr16/THUMBNAIL/image/gif/b1bb22214b51e256ad9a3b055bbb0ea1/gr16.sml gr16 gr16.sml sml 16399 136 219 IMAGE-THUMBNAIL 1-s2.0-S0926860X15302866-gr17.sml https://s3.amazonaws.com/prod-ucs-content-store-us-east/content/pii:S0926860X15302866/gr17/THUMBNAIL/image/gif/0d8124285e7e53890dc022228ecc9e3a/gr17.sml gr17 gr17.sml sml 13771 109 219 IMAGE-THUMBNAIL 1-s2.0-S0926860X15302866-gr18.sml https://s3.amazonaws.com/prod-ucs-content-store-us-east/content/pii:S0926860X15302866/gr18/THUMBNAIL/image/gif/9043d0dc2eb1be77f420e61cae9da8b5/gr18.sml gr18 gr18.sml sml 7135 164 177 IMAGE-THUMBNAIL 1-s2.0-S0926860X15302866-gr19.sml https://s3.amazonaws.com/prod-ucs-content-store-us-east/content/pii:S0926860X15302866/gr19/THUMBNAIL/image/gif/7b3620da0f1f0275d83b54ac40771269/gr19.sml gr19 gr19.sml sml 12186 164 219 IMAGE-THUMBNAIL 1-s2.0-S0926860X15302866-gr2.sml https://s3.amazonaws.com/prod-ucs-content-store-us-east/content/pii:S0926860X15302866/gr2/THUMBNAIL/image/gif/aca62fb9060ae38d85bac044938c0ee8/gr2.sml gr2 gr2.sml sml 6219 164 198 IMAGE-THUMBNAIL 1-s2.0-S0926860X15302866-gr20.sml https://s3.amazonaws.com/prod-ucs-content-store-us-east/content/pii:S0926860X15302866/gr20/THUMBNAIL/image/gif/b22aefbbd46aabaf6ddd0ddd971ec480/gr20.sml gr20 gr20.sml sml 9163 155 219 IMAGE-THUMBNAIL 1-s2.0-S0926860X15302866-gr21.sml https://s3.amazonaws.com/prod-ucs-content-store-us-east/content/pii:S0926860X15302866/gr21/THUMBNAIL/image/gif/4269be33613e003224b7b13f7f958767/gr21.sml gr21 gr21.sml sml 4473 163 102 IMAGE-THUMBNAIL 1-s2.0-S0926860X15302866-gr22.sml https://s3.amazonaws.com/prod-ucs-content-store-us-east/content/pii:S0926860X15302866/gr22/THUMBNAIL/image/gif/ceb2172d87364015c71c4be084dcfc88/gr22.sml gr22 gr22.sml sml 9340 163 125 IMAGE-THUMBNAIL 1-s2.0-S0926860X15302866-gr23.sml https://s3.amazonaws.com/prod-ucs-content-store-us-east/content/pii:S0926860X15302866/gr23/THUMBNAIL/image/gif/642963fdee40f91a3f63071b05ebfc8e/gr23.sml gr23 gr23.sml sml 10112 150 219 IMAGE-THUMBNAIL 1-s2.0-S0926860X15302866-gr24.sml https://s3.amazonaws.com/prod-ucs-content-store-us-east/content/pii:S0926860X15302866/gr24/THUMBNAIL/image/gif/e160449dbc2cd68ae4b273c951135c79/gr24.sml gr24 gr24.sml sml 12767 145 219 IMAGE-THUMBNAIL 1-s2.0-S0926860X15302866-gr25.sml https://s3.amazonaws.com/prod-ucs-content-store-us-east/content/pii:S0926860X15302866/gr25/THUMBNAIL/image/gif/41292a417bf547567e5d97d2b31f4123/gr25.sml gr25 gr25.sml sml 7359 164 140 IMAGE-THUMBNAIL 1-s2.0-S0926860X15302866-gr26.sml https://s3.amazonaws.com/prod-ucs-content-store-us-east/content/pii:S0926860X15302866/gr26/THUMBNAIL/image/gif/234c3d1621440eaafa4d8238c570ab8d/gr26.sml gr26 gr26.sml sml 5181 163 123 IMAGE-THUMBNAIL 1-s2.0-S0926860X15302866-gr27.sml https://s3.amazonaws.com/prod-ucs-content-store-us-east/content/pii:S0926860X15302866/gr27/THUMBNAIL/image/gif/940d3a482d49445603ca484a53dfab8f/gr27.sml gr27 gr27.sml sml 10127 126 219 IMAGE-THUMBNAIL 1-s2.0-S0926860X15302866-gr28.sml https://s3.amazonaws.com/prod-ucs-content-store-us-east/content/pii:S0926860X15302866/gr28/THUMBNAIL/image/gif/22e9d20fe6e80a040ddc5c6b524c1015/gr28.sml gr28 gr28.sml sml 9507 141 219 IMAGE-THUMBNAIL 1-s2.0-S0926860X15302866-gr29.sml https://s3.amazonaws.com/prod-ucs-content-store-us-east/content/pii:S0926860X15302866/gr29/THUMBNAIL/image/gif/edee305f125590f576d86a21231cf70a/gr29.sml gr29 gr29.sml sml 12560 114 219 IMAGE-THUMBNAIL 1-s2.0-S0926860X15302866-gr3.sml https://s3.amazonaws.com/prod-ucs-content-store-us-east/content/pii:S0926860X15302866/gr3/THUMBNAIL/image/gif/637bf85d39cc7f75dcff1d037f136d78/gr3.sml gr3 gr3.sml sml 13095 74 219 IMAGE-THUMBNAIL 1-s2.0-S0926860X15302866-gr30.sml https://s3.amazonaws.com/prod-ucs-content-store-us-east/content/pii:S0926860X15302866/gr30/THUMBNAIL/image/gif/300348d9848b1554369a9fe961c7358b/gr30.sml gr30 gr30.sml sml 9859 163 156 IMAGE-THUMBNAIL 1-s2.0-S0926860X15302866-gr31.sml https://s3.amazonaws.com/prod-ucs-content-store-us-east/content/pii:S0926860X15302866/gr31/THUMBNAIL/image/gif/debb16ebd3045b60eaba2ce9962af6d2/gr31.sml gr31 gr31.sml sml 15380 147 219 IMAGE-THUMBNAIL 1-s2.0-S0926860X15302866-gr32.sml https://s3.amazonaws.com/prod-ucs-content-store-us-east/content/pii:S0926860X15302866/gr32/THUMBNAIL/image/gif/c2ab6866ac7e809397f9d47355b39e33/gr32.sml gr32 gr32.sml sml 10677 108 219 IMAGE-THUMBNAIL 1-s2.0-S0926860X15302866-gr33.sml https://s3.amazonaws.com/prod-ucs-content-store-us-east/content/pii:S0926860X15302866/gr33/THUMBNAIL/image/gif/7f0951c35fd549be9b7607f474206930/gr33.sml gr33 gr33.sml sml 10918 164 196 IMAGE-THUMBNAIL 1-s2.0-S0926860X15302866-gr34.sml https://s3.amazonaws.com/prod-ucs-content-store-us-east/content/pii:S0926860X15302866/gr34/THUMBNAIL/image/gif/a4ef04e9edae1199f9567cf7703bc025/gr34.sml gr34 gr34.sml sml 10615 164 201 IMAGE-THUMBNAIL 1-s2.0-S0926860X15302866-gr35.sml https://s3.amazonaws.com/prod-ucs-content-store-us-east/content/pii:S0926860X15302866/gr35/THUMBNAIL/image/gif/3ac549b30b28cf28c478782ff799c682/gr35.sml gr35 gr35.sml sml 6391 164 124 IMAGE-THUMBNAIL 1-s2.0-S0926860X15302866-gr36.sml https://s3.amazonaws.com/prod-ucs-content-store-us-east/content/pii:S0926860X15302866/gr36/THUMBNAIL/image/gif/440ca4cc46de5822874bf3386998ca0b/gr36.sml gr36 gr36.sml sml 17058 164 211 IMAGE-THUMBNAIL 1-s2.0-S0926860X15302866-gr37.sml https://s3.amazonaws.com/prod-ucs-content-store-us-east/content/pii:S0926860X15302866/gr37/THUMBNAIL/image/gif/1de2b3f23a60bba38d615d0fcf1d314a/gr37.sml gr37 gr37.sml sml 9707 158 219 IMAGE-THUMBNAIL 1-s2.0-S0926860X15302866-gr4.sml https://s3.amazonaws.com/prod-ucs-content-store-us-east/content/pii:S0926860X15302866/gr4/THUMBNAIL/image/gif/644b949a35275c039f22b39d4bc2d18d/gr4.sml gr4 gr4.sml sml 23933 108 219 IMAGE-THUMBNAIL 1-s2.0-S0926860X15302866-gr5.sml https://s3.amazonaws.com/prod-ucs-content-store-us-east/content/pii:S0926860X15302866/gr5/THUMBNAIL/image/gif/bc42a8659aabb12d67a145e42854c3d4/gr5.sml gr5 gr5.sml sml 17512 138 219 IMAGE-THUMBNAIL 1-s2.0-S0926860X15302866-gr6.sml https://s3.amazonaws.com/prod-ucs-content-store-us-east/content/pii:S0926860X15302866/gr6/THUMBNAIL/image/gif/140a0ce91f1c55d71bd3d4319e1a959b/gr6.sml gr6 gr6.sml sml 20439 163 188 IMAGE-THUMBNAIL 1-s2.0-S0926860X15302866-gr7.sml https://s3.amazonaws.com/prod-ucs-content-store-us-east/content/pii:S0926860X15302866/gr7/THUMBNAIL/image/gif/78ece5a4f6f1ee75fe9106b106f820b6/gr7.sml gr7 gr7.sml sml 13363 164 130 IMAGE-THUMBNAIL 1-s2.0-S0926860X15302866-gr8.sml https://s3.amazonaws.com/prod-ucs-content-store-us-east/content/pii:S0926860X15302866/gr8/THUMBNAIL/image/gif/be4e8e9e69db0f564bf8490a87d049d4/gr8.sml gr8 gr8.sml sml 22961 164 179 IMAGE-THUMBNAIL 1-s2.0-S0926860X15302866-gr9.sml https://s3.amazonaws.com/prod-ucs-content-store-us-east/content/pii:S0926860X15302866/gr9/THUMBNAIL/image/gif/f96cbecd8030351a1052da2d0a709a3f/gr9.sml gr9 gr9.sml sml 8807 126 219 IMAGE-THUMBNAIL 1-s2.0-S0926860X15302866-fx1.jpg https://s3.amazonaws.com/prod-ucs-content-store-us-east/content/pii:S0926860X15302866/fx1/DOWNSAMPLED/image/jpeg/ad21c5a9a68d125b9573fe355b718f84/fx1.jpg fx1 true fx1.jpg jpg 17127 200 500 IMAGE-DOWNSAMPLED 1-s2.0-S0926860X15302866-gr1.jpg https://s3.amazonaws.com/prod-ucs-content-store-us-east/content/pii:S0926860X15302866/gr1/DOWNSAMPLED/image/jpeg/48a3105f0b1c8694161fbf350076a644/gr1.jpg gr1 gr1.jpg jpg 37066 385 489 IMAGE-DOWNSAMPLED 1-s2.0-S0926860X15302866-gr10.jpg https://s3.amazonaws.com/prod-ucs-content-store-us-east/content/pii:S0926860X15302866/gr10/DOWNSAMPLED/image/jpeg/209f093db6a650cd4c87e8837cf98ee5/gr10.jpg gr10 gr10.jpg jpg 34772 293 470 IMAGE-DOWNSAMPLED 1-s2.0-S0926860X15302866-gr11.jpg https://s3.amazonaws.com/prod-ucs-content-store-us-east/content/pii:S0926860X15302866/gr11/DOWNSAMPLED/image/jpeg/95278f0304b8d4ac46f33a64e9e31395/gr11.jpg gr11 gr11.jpg jpg 91224 457 565 IMAGE-DOWNSAMPLED 1-s2.0-S0926860X15302866-gr12.jpg https://s3.amazonaws.com/prod-ucs-content-store-us-east/content/pii:S0926860X15302866/gr12/DOWNSAMPLED/image/jpeg/0aa360baea82d5e47adce371c59ad865/gr12.jpg gr12 gr12.jpg jpg 94601 446 565 IMAGE-DOWNSAMPLED 1-s2.0-S0926860X15302866-gr13.jpg https://s3.amazonaws.com/prod-ucs-content-store-us-east/content/pii:S0926860X15302866/gr13/DOWNSAMPLED/image/jpeg/bc7e3728942e88c9ec78f005469fac25/gr13.jpg gr13 gr13.jpg jpg 66511 431 527 IMAGE-DOWNSAMPLED 1-s2.0-S0926860X15302866-gr14.jpg https://s3.amazonaws.com/prod-ucs-content-store-us-east/content/pii:S0926860X15302866/gr14/DOWNSAMPLED/image/jpeg/761b20d9b37697085a5e5cb31696aae9/gr14.jpg gr14 gr14.jpg jpg 42173 334 470 IMAGE-DOWNSAMPLED 1-s2.0-S0926860X15302866-gr15.jpg https://s3.amazonaws.com/prod-ucs-content-store-us-east/content/pii:S0926860X15302866/gr15/DOWNSAMPLED/image/jpeg/61b88dc719e5b04f8e2b2ba143a36571/gr15.jpg gr15 gr15.jpg jpg 143069 846 565 IMAGE-DOWNSAMPLED 1-s2.0-S0926860X15302866-gr16.jpg https://s3.amazonaws.com/prod-ucs-content-store-us-east/content/pii:S0926860X15302866/gr16/DOWNSAMPLED/image/jpeg/8007cd35eda2741cbe5280564e3fbbf4/gr16.jpg gr16 gr16.jpg jpg 50145 352 565 IMAGE-DOWNSAMPLED 1-s2.0-S0926860X15302866-gr17.jpg https://s3.amazonaws.com/prod-ucs-content-store-us-east/content/pii:S0926860X15302866/gr17/DOWNSAMPLED/image/jpeg/1524c9b0d1c2e2fba7dfaf5064d678db/gr17.jpg gr17 gr17.jpg jpg 89823 329 659 IMAGE-DOWNSAMPLED 1-s2.0-S0926860X15302866-gr18.jpg https://s3.amazonaws.com/prod-ucs-content-store-us-east/content/pii:S0926860X15302866/gr18/DOWNSAMPLED/image/jpeg/034f5c891719210413459320d03250d8/gr18.jpg gr18 gr18.jpg jpg 91137 698 753 IMAGE-DOWNSAMPLED 1-s2.0-S0926860X15302866-gr19.jpg https://s3.amazonaws.com/prod-ucs-content-store-us-east/content/pii:S0926860X15302866/gr19/DOWNSAMPLED/image/jpeg/83a3fa96c4349d8a81c046851b3f8c16/gr19.jpg gr19 gr19.jpg jpg 97210 563 753 IMAGE-DOWNSAMPLED 1-s2.0-S0926860X15302866-gr2.jpg https://s3.amazonaws.com/prod-ucs-content-store-us-east/content/pii:S0926860X15302866/gr2/DOWNSAMPLED/image/jpeg/976503431dfb547939e4442c4497ff95/gr2.jpg gr2 gr2.jpg jpg 21882 312 376 IMAGE-DOWNSAMPLED 1-s2.0-S0926860X15302866-gr20.jpg https://s3.amazonaws.com/prod-ucs-content-store-us-east/content/pii:S0926860X15302866/gr20/DOWNSAMPLED/image/jpeg/c1c36257f58749daf908536d48c827f2/gr20.jpg gr20 gr20.jpg jpg 37420 332 470 IMAGE-DOWNSAMPLED 1-s2.0-S0926860X15302866-gr21.jpg https://s3.amazonaws.com/prod-ucs-content-store-us-east/content/pii:S0926860X15302866/gr21/DOWNSAMPLED/image/jpeg/5cef7da6e7997186f7d7a271dc2ebccc/gr21.jpg gr21 gr21.jpg jpg 76312 782 489 IMAGE-DOWNSAMPLED 1-s2.0-S0926860X15302866-gr22.jpg https://s3.amazonaws.com/prod-ucs-content-store-us-east/content/pii:S0926860X15302866/gr22/DOWNSAMPLED/image/jpeg/b080221efdcecc60729084f14858dfe0/gr22.jpg gr22 gr22.jpg jpg 93699 614 470 IMAGE-DOWNSAMPLED 1-s2.0-S0926860X15302866-gr23.jpg https://s3.amazonaws.com/prod-ucs-content-store-us-east/content/pii:S0926860X15302866/gr23/DOWNSAMPLED/image/jpeg/d04f16ed703327ea1ad581e3b9ec2ba7/gr23.jpg gr23 gr23.jpg jpg 92066 515 753 IMAGE-DOWNSAMPLED 1-s2.0-S0926860X15302866-gr24.jpg https://s3.amazonaws.com/prod-ucs-content-store-us-east/content/pii:S0926860X15302866/gr24/DOWNSAMPLED/image/jpeg/08e3405108c595ffe3d661ace6c5a81f/gr24.jpg gr24 gr24.jpg jpg 119690 497 753 IMAGE-DOWNSAMPLED 1-s2.0-S0926860X15302866-gr25.jpg https://s3.amazonaws.com/prod-ucs-content-store-us-east/content/pii:S0926860X15302866/gr25/DOWNSAMPLED/image/jpeg/ddcc4b38c6469d8f1116c3ac66966114/gr25.jpg gr25 gr25.jpg jpg 45805 440 376 IMAGE-DOWNSAMPLED 1-s2.0-S0926860X15302866-gr26.jpg https://s3.amazonaws.com/prod-ucs-content-store-us-east/content/pii:S0926860X15302866/gr26/DOWNSAMPLED/image/jpeg/64dbd2799ad277c851ceb8300bf0147c/gr26.jpg gr26 gr26.jpg jpg 115228 978 737 IMAGE-DOWNSAMPLED 1-s2.0-S0926860X15302866-gr27.jpg https://s3.amazonaws.com/prod-ucs-content-store-us-east/content/pii:S0926860X15302866/gr27/DOWNSAMPLED/image/jpeg/b92c1f03d3d4a90522eec0dba0002232/gr27.jpg gr27 gr27.jpg jpg 28331 280 489 IMAGE-DOWNSAMPLED 1-s2.0-S0926860X15302866-gr28.jpg https://s3.amazonaws.com/prod-ucs-content-store-us-east/content/pii:S0926860X15302866/gr28/DOWNSAMPLED/image/jpeg/eacf8598a14ad94b721a3efd090d93d5/gr28.jpg gr28 gr28.jpg jpg 36381 315 489 IMAGE-DOWNSAMPLED 1-s2.0-S0926860X15302866-gr29.jpg https://s3.amazonaws.com/prod-ucs-content-store-us-east/content/pii:S0926860X15302866/gr29/DOWNSAMPLED/image/jpeg/9aef5a5a93f9721e7659763f37f9de33/gr29.jpg gr29 gr29.jpg jpg 18009 166 320 IMAGE-DOWNSAMPLED 1-s2.0-S0926860X15302866-gr3.jpg https://s3.amazonaws.com/prod-ucs-content-store-us-east/content/pii:S0926860X15302866/gr3/DOWNSAMPLED/image/jpeg/f8d3c8f6e6520943777837a4e4fb9829/gr3.jpg gr3 gr3.jpg jpg 50539 221 659 IMAGE-DOWNSAMPLED 1-s2.0-S0926860X15302866-gr30.jpg https://s3.amazonaws.com/prod-ucs-content-store-us-east/content/pii:S0926860X15302866/gr30/DOWNSAMPLED/image/jpeg/93bd798ad23a096f85a3ed05575d289d/gr30.jpg gr30 gr30.jpg jpg 87258 690 659 IMAGE-DOWNSAMPLED 1-s2.0-S0926860X15302866-gr31.jpg https://s3.amazonaws.com/prod-ucs-content-store-us-east/content/pii:S0926860X15302866/gr31/DOWNSAMPLED/image/jpeg/6c420c5e1c79fc9e0ad8d1bc0aa0228e/gr31.jpg gr31 gr31.jpg jpg 89360 505 753 IMAGE-DOWNSAMPLED 1-s2.0-S0926860X15302866-gr32.jpg https://s3.amazonaws.com/prod-ucs-content-store-us-east/content/pii:S0926860X15302866/gr32/DOWNSAMPLED/image/jpeg/fd59a10cd4bfdbedd6d6ff8cfdcfb9b2/gr32.jpg gr32 gr32.jpg jpg 49650 279 565 IMAGE-DOWNSAMPLED 1-s2.0-S0926860X15302866-gr33.jpg https://s3.amazonaws.com/prod-ucs-content-store-us-east/content/pii:S0926860X15302866/gr33/DOWNSAMPLED/image/jpeg/3fa3b5bb8b1a17e8a36d0526756ee461/gr33.jpg gr33 gr33.jpg jpg 84287 551 659 IMAGE-DOWNSAMPLED 1-s2.0-S0926860X15302866-gr34.jpg https://s3.amazonaws.com/prod-ucs-content-store-us-east/content/pii:S0926860X15302866/gr34/DOWNSAMPLED/image/jpeg/7fa5d3122fc9c0f76d91c39ebb31ac1d/gr34.jpg gr34 gr34.jpg jpg 79262 538 659 IMAGE-DOWNSAMPLED 1-s2.0-S0926860X15302866-gr35.jpg https://s3.amazonaws.com/prod-ucs-content-store-us-east/content/pii:S0926860X15302866/gr35/DOWNSAMPLED/image/jpeg/99b3977baef8a41ea001e7a81f5e502b/gr35.jpg gr35 gr35.jpg jpg 44416 496 376 IMAGE-DOWNSAMPLED 1-s2.0-S0926860X15302866-gr36.jpg https://s3.amazonaws.com/prod-ucs-content-store-us-east/content/pii:S0926860X15302866/gr36/DOWNSAMPLED/image/jpeg/b6f3cf7d2e16490efbb91e026f69a22d/gr36.jpg gr36 gr36.jpg jpg 70049 439 565 IMAGE-DOWNSAMPLED 1-s2.0-S0926860X15302866-gr37.jpg https://s3.amazonaws.com/prod-ucs-content-store-us-east/content/pii:S0926860X15302866/gr37/DOWNSAMPLED/image/jpeg/be20e03ae265dea4231e4d14687e661c/gr37.jpg gr37 gr37.jpg jpg 78163 544 753 IMAGE-DOWNSAMPLED 1-s2.0-S0926860X15302866-gr4.jpg https://s3.amazonaws.com/prod-ucs-content-store-us-east/content/pii:S0926860X15302866/gr4/DOWNSAMPLED/image/jpeg/03ed45ac5c5ab9a980eb922d2d526018/gr4.jpg gr4 gr4.jpg jpg 75860 279 565 IMAGE-DOWNSAMPLED 1-s2.0-S0926860X15302866-gr5.jpg https://s3.amazonaws.com/prod-ucs-content-store-us-east/content/pii:S0926860X15302866/gr5/DOWNSAMPLED/image/jpeg/966100e15de871ac956cbc8f190a0239/gr5.jpg gr5 gr5.jpg jpg 70778 356 565 IMAGE-DOWNSAMPLED 1-s2.0-S0926860X15302866-gr6.jpg https://s3.amazonaws.com/prod-ucs-content-store-us-east/content/pii:S0926860X15302866/gr6/DOWNSAMPLED/image/jpeg/9f144ca56105218fca9345d558f7e108/gr6.jpg gr6 gr6.jpg jpg 101270 491 565 IMAGE-DOWNSAMPLED 1-s2.0-S0926860X15302866-gr7.jpg https://s3.amazonaws.com/prod-ucs-content-store-us-east/content/pii:S0926860X15302866/gr7/DOWNSAMPLED/image/jpeg/7261dfb13c1673c11fd918e14cbabaa5/gr7.jpg gr7 gr7.jpg jpg 108040 617 489 IMAGE-DOWNSAMPLED 1-s2.0-S0926860X15302866-gr8.jpg https://s3.amazonaws.com/prod-ucs-content-store-us-east/content/pii:S0926860X15302866/gr8/DOWNSAMPLED/image/jpeg/dbdf2347df6362f88be0f63a991ee2f6/gr8.jpg gr8 gr8.jpg jpg 103356 482 527 IMAGE-DOWNSAMPLED 1-s2.0-S0926860X15302866-gr9.jpg https://s3.amazonaws.com/prod-ucs-content-store-us-east/content/pii:S0926860X15302866/gr9/DOWNSAMPLED/image/jpeg/5e312102de10cbfd1c2019830703237f/gr9.jpg gr9 gr9.jpg jpg 36175 269 470 IMAGE-DOWNSAMPLED 1-s2.0-S0926860X15302866-fx1_lrg.jpg https://s3.amazonaws.com/prod-ucs-content-store-us-east/content/pii:S0926860X15302866/fx1/HIGHRES/image/jpeg/8a6ca41ce41b6e67f651959a234534b0/fx1_lrg.jpg fx1 true fx1_lrg.jpg jpg 133698 886 2213 IMAGE-HIGH-RES 1-s2.0-S0926860X15302866-gr1_lrg.jpg https://s3.amazonaws.com/prod-ucs-content-store-us-east/content/pii:S0926860X15302866/gr1/HIGHRES/image/jpeg/9f0d39ce137d1a75b0ba66f14601874f/gr1_lrg.jpg gr1 gr1_lrg.jpg jpg 264921 1708 2167 IMAGE-HIGH-RES 1-s2.0-S0926860X15302866-gr10_lrg.jpg https://s3.amazonaws.com/prod-ucs-content-store-us-east/content/pii:S0926860X15302866/gr10/HIGHRES/image/jpeg/fc84394b627082adb36525f2556adb7d/gr10_lrg.jpg gr10 gr10_lrg.jpg jpg 338670 1299 2083 IMAGE-HIGH-RES 1-s2.0-S0926860X15302866-gr11_lrg.jpg https://s3.amazonaws.com/prod-ucs-content-store-us-east/content/pii:S0926860X15302866/gr11/HIGHRES/image/jpeg/e655c1b9632fd1f746188e282cfd6755/gr11_lrg.jpg gr11 gr11_lrg.jpg jpg 951896 2021 2500 IMAGE-HIGH-RES 1-s2.0-S0926860X15302866-gr12_lrg.jpg https://s3.amazonaws.com/prod-ucs-content-store-us-east/content/pii:S0926860X15302866/gr12/HIGHRES/image/jpeg/98960bcd4b1c4436ae253c553839aea1/gr12_lrg.jpg gr12 gr12_lrg.jpg jpg 1055056 1972 2500 IMAGE-HIGH-RES 1-s2.0-S0926860X15302866-gr13_lrg.jpg https://s3.amazonaws.com/prod-ucs-content-store-us-east/content/pii:S0926860X15302866/gr13/HIGHRES/image/jpeg/204baec6cd368b6b823fc61afa67a98a/gr13_lrg.jpg gr13 gr13_lrg.jpg jpg 515395 1910 2333 IMAGE-HIGH-RES 1-s2.0-S0926860X15302866-gr14_lrg.jpg https://s3.amazonaws.com/prod-ucs-content-store-us-east/content/pii:S0926860X15302866/gr14/HIGHRES/image/jpeg/bb79dc63d969fc9142ea16656d98d392/gr14_lrg.jpg gr14 gr14_lrg.jpg jpg 382941 1479 2083 IMAGE-HIGH-RES 1-s2.0-S0926860X15302866-gr15_lrg.jpg https://s3.amazonaws.com/prod-ucs-content-store-us-east/content/pii:S0926860X15302866/gr15/HIGHRES/image/jpeg/9a0f787705d466cab707c749423fb6f3/gr15_lrg.jpg gr15 gr15_lrg.jpg jpg 1268351 3743 2500 IMAGE-HIGH-RES 1-s2.0-S0926860X15302866-gr16_lrg.jpg https://s3.amazonaws.com/prod-ucs-content-store-us-east/content/pii:S0926860X15302866/gr16/HIGHRES/image/jpeg/078e23c714db6519f769b007faeb8d94/gr16_lrg.jpg gr16 gr16_lrg.jpg jpg 468112 1556 2500 IMAGE-HIGH-RES 1-s2.0-S0926860X15302866-gr17_lrg.jpg https://s3.amazonaws.com/prod-ucs-content-store-us-east/content/pii:S0926860X15302866/gr17/HIGHRES/image/jpeg/d95080edd0901f62a1947305e42956d8/gr17_lrg.jpg gr17 gr17_lrg.jpg jpg 867052 1458 2917 IMAGE-HIGH-RES 1-s2.0-S0926860X15302866-gr18_lrg.jpg https://s3.amazonaws.com/prod-ucs-content-store-us-east/content/pii:S0926860X15302866/gr18/HIGHRES/image/jpeg/1a0587326162bbd990b26a83cad343c4/gr18_lrg.jpg gr18 gr18_lrg.jpg jpg 716941 3090 3333 IMAGE-HIGH-RES 1-s2.0-S0926860X15302866-gr19_lrg.jpg https://s3.amazonaws.com/prod-ucs-content-store-us-east/content/pii:S0926860X15302866/gr19/HIGHRES/image/jpeg/429088b90ad7118c8519904ffd39b0ca/gr19_lrg.jpg gr19 gr19_lrg.jpg jpg 872319 2493 3333 IMAGE-HIGH-RES 1-s2.0-S0926860X15302866-gr2_lrg.jpg https://s3.amazonaws.com/prod-ucs-content-store-us-east/content/pii:S0926860X15302866/gr2/HIGHRES/image/jpeg/fbcebc733d770eb1ba8f1713f23aaadf/gr2_lrg.jpg gr2 gr2_lrg.jpg jpg 254308 1382 1667 IMAGE-HIGH-RES 1-s2.0-S0926860X15302866-gr20_lrg.jpg https://s3.amazonaws.com/prod-ucs-content-store-us-east/content/pii:S0926860X15302866/gr20/HIGHRES/image/jpeg/d6db6d2a485ed1ac44c00fcef7c47507/gr20_lrg.jpg gr20 gr20_lrg.jpg jpg 253385 1472 2083 IMAGE-HIGH-RES 1-s2.0-S0926860X15302866-gr21_lrg.jpg https://s3.amazonaws.com/prod-ucs-content-store-us-east/content/pii:S0926860X15302866/gr21/HIGHRES/image/jpeg/e95f2eaef2b698357e0f45a7761263d7/gr21_lrg.jpg gr21 gr21_lrg.jpg jpg 504567 3465 2167 IMAGE-HIGH-RES 1-s2.0-S0926860X15302866-gr22_lrg.jpg https://s3.amazonaws.com/prod-ucs-content-store-us-east/content/pii:S0926860X15302866/gr22/HIGHRES/image/jpeg/e45fa25925601a6764aa6c00158c9c59/gr22_lrg.jpg gr22 gr22_lrg.jpg jpg 1073987 2722 2083 IMAGE-HIGH-RES 1-s2.0-S0926860X15302866-gr23_lrg.jpg https://s3.amazonaws.com/prod-ucs-content-store-us-east/content/pii:S0926860X15302866/gr23/HIGHRES/image/jpeg/1071169381c9f60000a2974af2bdb790/gr23_lrg.jpg gr23 gr23_lrg.jpg jpg 639840 2278 3333 IMAGE-HIGH-RES 1-s2.0-S0926860X15302866-gr24_lrg.jpg https://s3.amazonaws.com/prod-ucs-content-store-us-east/content/pii:S0926860X15302866/gr24/HIGHRES/image/jpeg/40eff41a62bb5486be3c81d2588410bb/gr24_lrg.jpg gr24 gr24_lrg.jpg jpg 930420 2201 3333 IMAGE-HIGH-RES 1-s2.0-S0926860X15302866-gr25_lrg.jpg https://s3.amazonaws.com/prod-ucs-content-store-us-east/content/pii:S0926860X15302866/gr25/HIGHRES/image/jpeg/2fd46e179ec4fbfb1a539051878e91ef/gr25_lrg.jpg gr25 gr25_lrg.jpg jpg 341463 1951 1667 IMAGE-HIGH-RES 1-s2.0-S0926860X15302866-gr26_lrg.jpg https://s3.amazonaws.com/prod-ucs-content-store-us-east/content/pii:S0926860X15302866/gr26/HIGHRES/image/jpeg/e0bfc17ccf557eb679a1c19ad165d474/gr26_lrg.jpg gr26 gr26_lrg.jpg jpg 801018 4333 3264 IMAGE-HIGH-RES 1-s2.0-S0926860X15302866-gr27_lrg.jpg https://s3.amazonaws.com/prod-ucs-content-store-us-east/content/pii:S0926860X15302866/gr27/HIGHRES/image/jpeg/ef17bbfd0a9312fadec42ed49bf40815/gr27_lrg.jpg gr27 gr27_lrg.jpg jpg 206303 1243 2167 IMAGE-HIGH-RES 1-s2.0-S0926860X15302866-gr28_lrg.jpg https://s3.amazonaws.com/prod-ucs-content-store-us-east/content/pii:S0926860X15302866/gr28/HIGHRES/image/jpeg/d541e3532ea63eefea835ad92cb76d8d/gr28_lrg.jpg gr28 gr28_lrg.jpg jpg 268121 1396 2167 IMAGE-HIGH-RES 1-s2.0-S0926860X15302866-gr29_lrg.jpg https://s3.amazonaws.com/prod-ucs-content-store-us-east/content/pii:S0926860X15302866/gr29/HIGHRES/image/jpeg/11f835bbe5e0ed8ca7c273d8139b3e6b/gr29_lrg.jpg gr29 gr29_lrg.jpg jpg 161161 736 1417 IMAGE-HIGH-RES 1-s2.0-S0926860X15302866-gr3_lrg.jpg https://s3.amazonaws.com/prod-ucs-content-store-us-east/content/pii:S0926860X15302866/gr3/HIGHRES/image/jpeg/c80d7e3ce65a26a32cbb0ff81e4680d4/gr3_lrg.jpg gr3 gr3_lrg.jpg jpg 489962 979 2917 IMAGE-HIGH-RES 1-s2.0-S0926860X15302866-gr30_lrg.jpg https://s3.amazonaws.com/prod-ucs-content-store-us-east/content/pii:S0926860X15302866/gr30/HIGHRES/image/jpeg/8623138be98559cf2315f39b6537e086/gr30_lrg.jpg gr30 gr30_lrg.jpg jpg 706799 3056 2917 IMAGE-HIGH-RES 1-s2.0-S0926860X15302866-gr31_lrg.jpg https://s3.amazonaws.com/prod-ucs-content-store-us-east/content/pii:S0926860X15302866/gr31/HIGHRES/image/jpeg/b3bb8ed449a7a4e09ef11b97c50bda52/gr31_lrg.jpg gr31 gr31_lrg.jpg jpg 769296 2236 3333 IMAGE-HIGH-RES 1-s2.0-S0926860X15302866-gr32_lrg.jpg https://s3.amazonaws.com/prod-ucs-content-store-us-east/content/pii:S0926860X15302866/gr32/HIGHRES/image/jpeg/99e5a2f0f6fd0890a9daac6f49d159c8/gr32_lrg.jpg gr32 gr32_lrg.jpg jpg 465445 1236 2500 IMAGE-HIGH-RES 1-s2.0-S0926860X15302866-gr33_lrg.jpg https://s3.amazonaws.com/prod-ucs-content-store-us-east/content/pii:S0926860X15302866/gr33/HIGHRES/image/jpeg/1eb10749f9b644b0cf07bd468b270688/gr33_lrg.jpg gr33 gr33_lrg.jpg jpg 771826 2438 2917 IMAGE-HIGH-RES 1-s2.0-S0926860X15302866-gr34_lrg.jpg https://s3.amazonaws.com/prod-ucs-content-store-us-east/content/pii:S0926860X15302866/gr34/HIGHRES/image/jpeg/9631677606e88cd59fcebe41be096296/gr34_lrg.jpg gr34 gr34_lrg.jpg jpg 638247 2382 2917 IMAGE-HIGH-RES 1-s2.0-S0926860X15302866-gr35_lrg.jpg https://s3.amazonaws.com/prod-ucs-content-store-us-east/content/pii:S0926860X15302866/gr35/HIGHRES/image/jpeg/9b9e5f3a7df745347f7cc07ed52c13fd/gr35_lrg.jpg gr35 gr35_lrg.jpg jpg 302795 2201 1667 IMAGE-HIGH-RES 1-s2.0-S0926860X15302866-gr36_lrg.jpg https://s3.amazonaws.com/prod-ucs-content-store-us-east/content/pii:S0926860X15302866/gr36/HIGHRES/image/jpeg/48de00fd2e302607d9e7e66a17f07d85/gr36_lrg.jpg gr36 gr36_lrg.jpg jpg 586092 1944 2500 IMAGE-HIGH-RES 1-s2.0-S0926860X15302866-gr37_lrg.jpg https://s3.amazonaws.com/prod-ucs-content-store-us-east/content/pii:S0926860X15302866/gr37/HIGHRES/image/jpeg/9508544d9cd8eec257ffe3928a0f904b/gr37_lrg.jpg gr37 gr37_lrg.jpg jpg 632885 2410 3333 IMAGE-HIGH-RES 1-s2.0-S0926860X15302866-gr4_lrg.jpg https://s3.amazonaws.com/prod-ucs-content-store-us-east/content/pii:S0926860X15302866/gr4/HIGHRES/image/jpeg/e52cbe96c4a42fe9be571d26b4e33630/gr4_lrg.jpg gr4 gr4_lrg.jpg jpg 640516 1236 2500 IMAGE-HIGH-RES 1-s2.0-S0926860X15302866-gr5_lrg.jpg https://s3.amazonaws.com/prod-ucs-content-store-us-east/content/pii:S0926860X15302866/gr5/HIGHRES/image/jpeg/ebaa3606f76fda8b924c9e899d3acdb2/gr5_lrg.jpg gr5 gr5_lrg.jpg jpg 557436 1576 2500 IMAGE-HIGH-RES 1-s2.0-S0926860X15302866-gr6_lrg.jpg https://s3.amazonaws.com/prod-ucs-content-store-us-east/content/pii:S0926860X15302866/gr6/HIGHRES/image/jpeg/6d93074a42aee46dc63f9309d475fbe0/gr6_lrg.jpg gr6 gr6_lrg.jpg jpg 859777 2174 2500 IMAGE-HIGH-RES 1-s2.0-S0926860X15302866-gr7_lrg.jpg https://s3.amazonaws.com/prod-ucs-content-store-us-east/content/pii:S0926860X15302866/gr7/HIGHRES/image/jpeg/127962d31fbc1cfc8dde9c071be247df/gr7_lrg.jpg gr7 gr7_lrg.jpg jpg 843494 2736 2167 IMAGE-HIGH-RES 1-s2.0-S0926860X15302866-gr8_lrg.jpg https://s3.amazonaws.com/prod-ucs-content-store-us-east/content/pii:S0926860X15302866/gr8/HIGHRES/image/jpeg/8a76b25605922ea6429714859188cdcf/gr8_lrg.jpg gr8 gr8_lrg.jpg jpg 941697 2132 2333 IMAGE-HIGH-RES 1-s2.0-S0926860X15302866-gr9_lrg.jpg https://s3.amazonaws.com/prod-ucs-content-store-us-east/content/pii:S0926860X15302866/gr9/HIGHRES/image/jpeg/98178c9928c520273c22b35910e16bc1/gr9_lrg.jpg gr9 gr9_lrg.jpg jpg 287033 1194 2083 IMAGE-HIGH-RES 1-s2.0-S0926860X15302866-si1.gif https://s3.amazonaws.com/prod-ucs-content-store-us-east/content/pii:S0926860X15302866/STRIPIN/image/gif/818059c200fe557c4a8618376ac3d163/si1.gif si1 si1.gif gif 1465 30 384 ALTIMG 1-s2.0-S0926860X15302866-si2.gif https://s3.amazonaws.com/prod-ucs-content-store-us-east/content/pii:S0926860X15302866/STRIPIN/image/gif/fcb106f770cfbb92b1e847540e0d6d62/si2.gif si2 si2.gif gif 686 31 152 ALTIMG 1-s2.0-S0926860X15302866-si3.gif https://s3.amazonaws.com/prod-ucs-content-store-us-east/content/pii:S0926860X15302866/STRIPIN/image/gif/7f0018c94456efc9f477fc38500a4e1e/si3.gif si3 si3.gif gif 695 19 176 ALTIMG 1-s2.0-S0926860X15302866-Thuy_Duong_Nguyen_Phan_supported_catalyst_2016_P15.jpg https://s3-eu-west-1.amazonaws.com/prod-ucs-content-store-eu-west/content/egi:10V5T1RWZV7/PAGE-IMAGE/image/jpg/f80d7f54de85fc975817cad538918130/Thuy_Duong_Nguyen_Phan_supported_catalyst_2016_P15.jpg https://s3.amazonaws.com/prod-ucs-content-store-us-east/content/egi:10V5T1RWZV7/PAGE-IMAGE/image/jpg/f80d7f54de85fc975817cad538918130/Thuy_Duong_Nguyen_Phan_supported_catalyst_2016_P15.jpg https://ucs.elsevier.com/asset/de86cf9b-7cbc-407e-9851-403b2fb9285d Thuy_Duong_Nguyen_Phan_supported_catalyst_2016_P15 Thuy_Duong_Nguyen_Phan_supported_catalyst_2016_P15.jpg jpg 589822 ALTIMG 1-s2.0-S0926860X15302866-Thuy_Duong_Nguyen_Phan_supported_catalyst_2016_P36.jpg https://s3-eu-west-1.amazonaws.com/prod-ucs-content-store-eu-west/content/egi:10V5T1RWZV7/PAGE-IMAGE/image/jpg/4d2eab614e4fd9e8e9f48aea911694e5/Thuy_Duong_Nguyen_Phan_supported_catalyst_2016_P36.jpg https://s3.amazonaws.com/prod-ucs-content-store-us-east/content/egi:10V5T1RWZV7/PAGE-IMAGE/image/jpg/4d2eab614e4fd9e8e9f48aea911694e5/Thuy_Duong_Nguyen_Phan_supported_catalyst_2016_P36.jpg https://ucs.elsevier.com/asset/9a87d9bd-8deb-4b04-a354-18bdac5d01b5 Thuy_Duong_Nguyen_Phan_supported_catalyst_2016_P36 Thuy_Duong_Nguyen_Phan_supported_catalyst_2016_P36.jpg jpg 312228 ALTIMG 1-s2.0-S0926860X15302866-Thuy_Duong_Nguyen_Phan_supported_catalyst_2016_P14.jpg https://s3-eu-west-1.amazonaws.com/prod-ucs-content-store-eu-west/content/egi:10V5T1RWZV7/PAGE-IMAGE/image/jpg/8c00795c4902297c0cf446564f473a4f/Thuy_Duong_Nguyen_Phan_supported_catalyst_2016_P14.jpg https://s3.amazonaws.com/prod-ucs-content-store-us-east/content/egi:10V5T1RWZV7/PAGE-IMAGE/image/jpg/8c00795c4902297c0cf446564f473a4f/Thuy_Duong_Nguyen_Phan_supported_catalyst_2016_P14.jpg https://ucs.elsevier.com/asset/f6459645-a863-4b9a-bbb6-6c8d7ea52811 Thuy_Duong_Nguyen_Phan_supported_catalyst_2016_P14 Thuy_Duong_Nguyen_Phan_supported_catalyst_2016_P14.jpg jpg 661572 ALTIMG 1-s2.0-S0926860X15302866-Thuy_Duong_Nguyen_Phan_supported_catalyst_2016_P13.jpg https://s3-eu-west-1.amazonaws.com/prod-ucs-content-store-eu-west/content/egi:10V5T1RWZV7/PAGE-IMAGE/image/jpg/013e2f6ac3b17b9f406485cc9e798906/Thuy_Duong_Nguyen_Phan_supported_catalyst_2016_P13.jpg https://s3.amazonaws.com/prod-ucs-content-store-us-east/content/egi:10V5T1RWZV7/PAGE-IMAGE/image/jpg/013e2f6ac3b17b9f406485cc9e798906/Thuy_Duong_Nguyen_Phan_supported_catalyst_2016_P13.jpg https://ucs.elsevier.com/asset/d96d036e-b8bd-49e8-87a6-5a936204438d Thuy_Duong_Nguyen_Phan_supported_catalyst_2016_P13 Thuy_Duong_Nguyen_Phan_supported_catalyst_2016_P13.jpg jpg 481631 ALTIMG 1-s2.0-S0926860X15302866-Thuy_Duong_Nguyen_Phan_supported_catalyst_2016_P12.jpg https://s3-eu-west-1.amazonaws.com/prod-ucs-content-store-eu-west/content/egi:10V5T1RWZV7/PAGE-IMAGE/image/jpg/45588c2c1e6a41843d8bf91f671f5b2d/Thuy_Duong_Nguyen_Phan_supported_catalyst_2016_P12.jpg https://s3.amazonaws.com/prod-ucs-content-store-us-east/content/egi:10V5T1RWZV7/PAGE-IMAGE/image/jpg/45588c2c1e6a41843d8bf91f671f5b2d/Thuy_Duong_Nguyen_Phan_supported_catalyst_2016_P12.jpg https://ucs.elsevier.com/asset/435912af-bd4c-4198-b3d4-31fe1ea63d8f Thuy_Duong_Nguyen_Phan_supported_catalyst_2016_P12 Thuy_Duong_Nguyen_Phan_supported_catalyst_2016_P12.jpg jpg 491176 ALTIMG 1-s2.0-S0926860X15302866-Thuy_Duong_Nguyen_Phan_supported_catalyst_2016_P50.jpg https://s3-eu-west-1.amazonaws.com/prod-ucs-content-store-eu-west/content/egi:10V5T1RWZV7/PAGE-IMAGE/image/jpg/e4fea91344cf768a377c5c2eec303cdf/Thuy_Duong_Nguyen_Phan_supported_catalyst_2016_P50.jpg https://s3.amazonaws.com/prod-ucs-content-store-us-east/content/egi:10V5T1RWZV7/PAGE-IMAGE/image/jpg/e4fea91344cf768a377c5c2eec303cdf/Thuy_Duong_Nguyen_Phan_supported_catalyst_2016_P50.jpg https://ucs.elsevier.com/asset/2ce8673b-f6ee-47fc-9ab3-d6dca7c10300 Thuy_Duong_Nguyen_Phan_supported_catalyst_2016_P50 Thuy_Duong_Nguyen_Phan_supported_catalyst_2016_P50.jpg jpg 709920 ALTIMG 1-s2.0-S0926860X15302866-Thuy_Duong_Nguyen_Phan_supported_catalyst_2016_P26.jpg https://s3-eu-west-1.amazonaws.com/prod-ucs-content-store-eu-west/content/egi:10V5T1RWZV7/PAGE-IMAGE/image/jpg/e074b09298e46f21be3b2ab269bd5b10/Thuy_Duong_Nguyen_Phan_supported_catalyst_2016_P26.jpg https://s3.amazonaws.com/prod-ucs-content-store-us-east/content/egi:10V5T1RWZV7/PAGE-IMAGE/image/jpg/e074b09298e46f21be3b2ab269bd5b10/Thuy_Duong_Nguyen_Phan_supported_catalyst_2016_P26.jpg https://ucs.elsevier.com/asset/a36abcc7-1153-4cd7-8cdf-940ae84770af Thuy_Duong_Nguyen_Phan_supported_catalyst_2016_P26 Thuy_Duong_Nguyen_Phan_supported_catalyst_2016_P26.jpg jpg 648068 ALTIMG 1-s2.0-S0926860X15302866-Thuy_Duong_Nguyen_Phan_supported_catalyst_2016_P08.jpg https://s3-eu-west-1.amazonaws.com/prod-ucs-content-store-eu-west/content/egi:10V5T1RWZV7/PAGE-IMAGE/image/jpg/8dc528c44ede47b05d0f6bb02bb1022f/Thuy_Duong_Nguyen_Phan_supported_catalyst_2016_P08.jpg https://s3.amazonaws.com/prod-ucs-content-store-us-east/content/egi:10V5T1RWZV7/PAGE-IMAGE/image/jpg/8dc528c44ede47b05d0f6bb02bb1022f/Thuy_Duong_Nguyen_Phan_supported_catalyst_2016_P08.jpg https://ucs.elsevier.com/asset/a021a95c-e0a9-46db-a30e-5d400db1e08e Thuy_Duong_Nguyen_Phan_supported_catalyst_2016_P08 Thuy_Duong_Nguyen_Phan_supported_catalyst_2016_P08.jpg jpg 572091 ALTIMG 1-s2.0-S0926860X15302866-Thuy_Duong_Nguyen_Phan_supported_catalyst_2016_P60.jpg https://s3-eu-west-1.amazonaws.com/prod-ucs-content-store-eu-west/content/egi:10V5T1RWZV7/PAGE-IMAGE/image/jpg/740e70c656dd1be3bc899a834d2a5db7/Thuy_Duong_Nguyen_Phan_supported_catalyst_2016_P60.jpg https://s3.amazonaws.com/prod-ucs-content-store-us-east/content/egi:10V5T1RWZV7/PAGE-IMAGE/image/jpg/740e70c656dd1be3bc899a834d2a5db7/Thuy_Duong_Nguyen_Phan_supported_catalyst_2016_P60.jpg https://ucs.elsevier.com/asset/250d21e8-98a4-4753-a162-0cf712ff92c5 Thuy_Duong_Nguyen_Phan_supported_catalyst_2016_P60 Thuy_Duong_Nguyen_Phan_supported_catalyst_2016_P60.jpg jpg 543104 ALTIMG 1-s2.0-S0926860X15302866-Thuy_Duong_Nguyen_Phan_supported_catalyst_2016_P25.jpg https://s3-eu-west-1.amazonaws.com/prod-ucs-content-store-eu-west/content/egi:10V5T1RWZV7/PAGE-IMAGE/image/jpg/8ee4bc69f95573c9fad872b0e24bbbe6/Thuy_Duong_Nguyen_Phan_supported_catalyst_2016_P25.jpg https://s3.amazonaws.com/prod-ucs-content-store-us-east/content/egi:10V5T1RWZV7/PAGE-IMAGE/image/jpg/8ee4bc69f95573c9fad872b0e24bbbe6/Thuy_Duong_Nguyen_Phan_supported_catalyst_2016_P25.jpg https://ucs.elsevier.com/asset/63e41bae-d727-4bf2-89d5-60fc847798ec Thuy_Duong_Nguyen_Phan_supported_catalyst_2016_P25 Thuy_Duong_Nguyen_Phan_supported_catalyst_2016_P25.jpg jpg 593121 ALTIMG 1-s2.0-S0926860X15302866-Thuy_Duong_Nguyen_Phan_supported_catalyst_2016_P24.jpg https://s3-eu-west-1.amazonaws.com/prod-ucs-content-store-eu-west/content/egi:10V5T1RWZV7/PAGE-IMAGE/image/jpg/3ab05bd3e04e91862d05219fc09d490a/Thuy_Duong_Nguyen_Phan_supported_catalyst_2016_P24.jpg https://s3.amazonaws.com/prod-ucs-content-store-us-east/content/egi:10V5T1RWZV7/PAGE-IMAGE/image/jpg/3ab05bd3e04e91862d05219fc09d490a/Thuy_Duong_Nguyen_Phan_supported_catalyst_2016_P24.jpg https://ucs.elsevier.com/asset/1102f46d-5a45-47ff-bba1-47ab7dfac554 Thuy_Duong_Nguyen_Phan_supported_catalyst_2016_P24 Thuy_Duong_Nguyen_Phan_supported_catalyst_2016_P24.jpg jpg 760734 ALTIMG 1-s2.0-S0926860X15302866-Thuy_Duong_Nguyen_Phan_supported_catalyst_2016_P53.jpg https://s3-eu-west-1.amazonaws.com/prod-ucs-content-store-eu-west/content/egi:10V5T1RWZV7/PAGE-IMAGE/image/jpg/7f9dc46dfc94f5880ffba7740029b2e8/Thuy_Duong_Nguyen_Phan_supported_catalyst_2016_P53.jpg https://s3.amazonaws.com/prod-ucs-content-store-us-east/content/egi:10V5T1RWZV7/PAGE-IMAGE/image/jpg/7f9dc46dfc94f5880ffba7740029b2e8/Thuy_Duong_Nguyen_Phan_supported_catalyst_2016_P53.jpg https://ucs.elsevier.com/asset/ff9c425c-4efe-4a6a-98c8-fd2be1be9c6e Thuy_Duong_Nguyen_Phan_supported_catalyst_2016_P53 Thuy_Duong_Nguyen_Phan_supported_catalyst_2016_P53.jpg jpg 401777 ALTIMG 1-s2.0-S0926860X15302866-Thuy_Duong_Nguyen_Phan_supported_catalyst_2016_P67.jpg https://s3-eu-west-1.amazonaws.com/prod-ucs-content-store-eu-west/content/egi:10V5T1RWZV7/PAGE-IMAGE/image/jpg/e27613ad4419234f999aa78a80a79e8d/Thuy_Duong_Nguyen_Phan_supported_catalyst_2016_P67.jpg https://s3.amazonaws.com/prod-ucs-content-store-us-east/content/egi:10V5T1RWZV7/PAGE-IMAGE/image/jpg/e27613ad4419234f999aa78a80a79e8d/Thuy_Duong_Nguyen_Phan_supported_catalyst_2016_P67.jpg https://ucs.elsevier.com/asset/48560c66-d764-47d3-8152-a49f9c5604da Thuy_Duong_Nguyen_Phan_supported_catalyst_2016_P67 Thuy_Duong_Nguyen_Phan_supported_catalyst_2016_P67.jpg jpg 536926 ALTIMG 1-s2.0-S0926860X15302866-Thuy_Duong_Nguyen_Phan_supported_catalyst_2016_P19.jpg https://s3-eu-west-1.amazonaws.com/prod-ucs-content-store-eu-west/content/egi:10V5T1RWZV7/PAGE-IMAGE/image/jpg/32d3556cad66be6da07a2db359b6ed13/Thuy_Duong_Nguyen_Phan_supported_catalyst_2016_P19.jpg https://s3.amazonaws.com/prod-ucs-content-store-us-east/content/egi:10V5T1RWZV7/PAGE-IMAGE/image/jpg/32d3556cad66be6da07a2db359b6ed13/Thuy_Duong_Nguyen_Phan_supported_catalyst_2016_P19.jpg https://ucs.elsevier.com/asset/09c3344d-f4e5-4293-b5f2-feade6220956 Thuy_Duong_Nguyen_Phan_supported_catalyst_2016_P19 Thuy_Duong_Nguyen_Phan_supported_catalyst_2016_P19.jpg jpg 606245 ALTIMG 1-s2.0-S0926860X15302866-Thuy_Duong_Nguyen_Phan_supported_catalyst_2016_P10.jpg https://s3-eu-west-1.amazonaws.com/prod-ucs-content-store-eu-west/content/egi:10V5T1RWZV7/PAGE-IMAGE/image/jpg/ff64d13e2c5cf818883b20cc9f84e688/Thuy_Duong_Nguyen_Phan_supported_catalyst_2016_P10.jpg https://s3.amazonaws.com/prod-ucs-content-store-us-east/content/egi:10V5T1RWZV7/PAGE-IMAGE/image/jpg/ff64d13e2c5cf818883b20cc9f84e688/Thuy_Duong_Nguyen_Phan_supported_catalyst_2016_P10.jpg https://ucs.elsevier.com/asset/0207098f-f3ec-47f8-9aff-b175b116b463 Thuy_Duong_Nguyen_Phan_supported_catalyst_2016_P10 Thuy_Duong_Nguyen_Phan_supported_catalyst_2016_P10.jpg jpg 618819 ALTIMG 1-s2.0-S0926860X15302866-Thuy_Duong_Nguyen_Phan_supported_catalyst_2016_P55.jpg https://s3-eu-west-1.amazonaws.com/prod-ucs-content-store-eu-west/content/egi:10V5T1RWZV7/PAGE-IMAGE/image/jpg/5636b1345f9d9c53baa68f429a1e7569/Thuy_Duong_Nguyen_Phan_supported_catalyst_2016_P55.jpg https://s3.amazonaws.com/prod-ucs-content-store-us-east/content/egi:10V5T1RWZV7/PAGE-IMAGE/image/jpg/5636b1345f9d9c53baa68f429a1e7569/Thuy_Duong_Nguyen_Phan_supported_catalyst_2016_P55.jpg https://ucs.elsevier.com/asset/8081c18c-afc5-416b-9e09-77f20a9d9c05 Thuy_Duong_Nguyen_Phan_supported_catalyst_2016_P55 Thuy_Duong_Nguyen_Phan_supported_catalyst_2016_P55.jpg jpg 542520 ALTIMG 1-s2.0-S0926860X15302866-Thuy_Duong_Nguyen_Phan_supported_catalyst_2016_P71.jpg https://s3-eu-west-1.amazonaws.com/prod-ucs-content-store-eu-west/content/egi:10V5T1RWZV7/PAGE-IMAGE/image/jpg/4b06475fe2e4ff9bfe541d8b2a241999/Thuy_Duong_Nguyen_Phan_supported_catalyst_2016_P71.jpg https://s3.amazonaws.com/prod-ucs-content-store-us-east/content/egi:10V5T1RWZV7/PAGE-IMAGE/image/jpg/4b06475fe2e4ff9bfe541d8b2a241999/Thuy_Duong_Nguyen_Phan_supported_catalyst_2016_P71.jpg https://ucs.elsevier.com/asset/9f0689c9-06d8-4e47-a010-17442216e2c4 Thuy_Duong_Nguyen_Phan_supported_catalyst_2016_P71 Thuy_Duong_Nguyen_Phan_supported_catalyst_2016_P71.jpg jpg 177803 ALTIMG 1-s2.0-S0926860X15302866-Thuy_Duong_Nguyen_Phan_supported_catalyst_2016_P06.jpg https://s3-eu-west-1.amazonaws.com/prod-ucs-content-store-eu-west/content/egi:10V5T1RWZV7/PAGE-IMAGE/image/jpg/e6051f21e097bf2d666adeed7ec185a8/Thuy_Duong_Nguyen_Phan_supported_catalyst_2016_P06.jpg https://s3.amazonaws.com/prod-ucs-content-store-us-east/content/egi:10V5T1RWZV7/PAGE-IMAGE/image/jpg/e6051f21e097bf2d666adeed7ec185a8/Thuy_Duong_Nguyen_Phan_supported_catalyst_2016_P06.jpg https://ucs.elsevier.com/asset/7e57129f-4f94-49a8-be63-b61b8a8d5715 Thuy_Duong_Nguyen_Phan_supported_catalyst_2016_P06 Thuy_Duong_Nguyen_Phan_supported_catalyst_2016_P06.jpg jpg 489794 ALTIMG 1-s2.0-S0926860X15302866-Thuy_Duong_Nguyen_Phan_supported_catalyst_2016_P28.jpg https://s3-eu-west-1.amazonaws.com/prod-ucs-content-store-eu-west/content/egi:10V5T1RWZV7/PAGE-IMAGE/image/jpg/f22518d484fff320e5615442eefd0e87/Thuy_Duong_Nguyen_Phan_supported_catalyst_2016_P28.jpg https://s3.amazonaws.com/prod-ucs-content-store-us-east/content/egi:10V5T1RWZV7/PAGE-IMAGE/image/jpg/f22518d484fff320e5615442eefd0e87/Thuy_Duong_Nguyen_Phan_supported_catalyst_2016_P28.jpg https://ucs.elsevier.com/asset/6364c688-3cb7-47c9-a473-33019da1f2e7 Thuy_Duong_Nguyen_Phan_supported_catalyst_2016_P28 Thuy_Duong_Nguyen_Phan_supported_catalyst_2016_P28.jpg jpg 741357 ALTIMG 1-s2.0-S0926860X15302866-Thuy_Duong_Nguyen_Phan_supported_catalyst_2016_P44.jpg https://s3-eu-west-1.amazonaws.com/prod-ucs-content-store-eu-west/content/egi:10V5T1RWZV7/PAGE-IMAGE/image/jpg/c94e0979448a3acc2d0d0b3742e95cbc/Thuy_Duong_Nguyen_Phan_supported_catalyst_2016_P44.jpg https://s3.amazonaws.com/prod-ucs-content-store-us-east/content/egi:10V5T1RWZV7/PAGE-IMAGE/image/jpg/c94e0979448a3acc2d0d0b3742e95cbc/Thuy_Duong_Nguyen_Phan_supported_catalyst_2016_P44.jpg https://ucs.elsevier.com/asset/2b96f452-7cfa-4a77-a7cc-7f0e950997cb Thuy_Duong_Nguyen_Phan_supported_catalyst_2016_P44 Thuy_Duong_Nguyen_Phan_supported_catalyst_2016_P44.jpg jpg 492048 ALTIMG 1-s2.0-S0926860X15302866-Thuy_Duong_Nguyen_Phan_supported_catalyst_2016_P18.jpg https://s3-eu-west-1.amazonaws.com/prod-ucs-content-store-eu-west/content/egi:10V5T1RWZV7/PAGE-IMAGE/image/jpg/387ca2d9e90a4c53263313f5293b4b7f/Thuy_Duong_Nguyen_Phan_supported_catalyst_2016_P18.jpg https://s3.amazonaws.com/prod-ucs-content-store-us-east/content/egi:10V5T1RWZV7/PAGE-IMAGE/image/jpg/387ca2d9e90a4c53263313f5293b4b7f/Thuy_Duong_Nguyen_Phan_supported_catalyst_2016_P18.jpg https://ucs.elsevier.com/asset/e76dce2d-65e5-4ab8-b7e1-dfb685a4175c Thuy_Duong_Nguyen_Phan_supported_catalyst_2016_P18 Thuy_Duong_Nguyen_Phan_supported_catalyst_2016_P18.jpg jpg 512699 ALTIMG 1-s2.0-S0926860X15302866-Thuy_Duong_Nguyen_Phan_supported_catalyst_2016_P09.jpg https://s3-eu-west-1.amazonaws.com/prod-ucs-content-store-eu-west/content/egi:10V5T1RWZV7/PAGE-IMAGE/image/jpg/4f95f25eb5bebe3b79135f7af8fcb81c/Thuy_Duong_Nguyen_Phan_supported_catalyst_2016_P09.jpg https://s3.amazonaws.com/prod-ucs-content-store-us-east/content/egi:10V5T1RWZV7/PAGE-IMAGE/image/jpg/4f95f25eb5bebe3b79135f7af8fcb81c/Thuy_Duong_Nguyen_Phan_supported_catalyst_2016_P09.jpg https://ucs.elsevier.com/asset/8172c5a0-057e-4b74-b99a-37c810d9af82 Thuy_Duong_Nguyen_Phan_supported_catalyst_2016_P09 Thuy_Duong_Nguyen_Phan_supported_catalyst_2016_P09.jpg jpg 506486 ALTIMG 1-s2.0-S0926860X15302866-Thuy_Duong_Nguyen_Phan_supported_catalyst_2016_P57.jpg https://s3-eu-west-1.amazonaws.com/prod-ucs-content-store-eu-west/content/egi:10V5T1RWZV7/PAGE-IMAGE/image/jpg/1af9e5d4de419674c414a20286c1d0f1/Thuy_Duong_Nguyen_Phan_supported_catalyst_2016_P57.jpg https://s3.amazonaws.com/prod-ucs-content-store-us-east/content/egi:10V5T1RWZV7/PAGE-IMAGE/image/jpg/1af9e5d4de419674c414a20286c1d0f1/Thuy_Duong_Nguyen_Phan_supported_catalyst_2016_P57.jpg https://ucs.elsevier.com/asset/27125f6f-6cf3-4534-b502-d64dc5b2f760 Thuy_Duong_Nguyen_Phan_supported_catalyst_2016_P57 Thuy_Duong_Nguyen_Phan_supported_catalyst_2016_P57.jpg jpg 476379 ALTIMG 1-s2.0-S0926860X15302866-Thuy_Duong_Nguyen_Phan_supported_catalyst_2016_P58.jpg https://s3-eu-west-1.amazonaws.com/prod-ucs-content-store-eu-west/content/egi:10V5T1RWZV7/PAGE-IMAGE/image/jpg/8a99287339343dfdc7ca92094f2d8428/Thuy_Duong_Nguyen_Phan_supported_catalyst_2016_P58.jpg https://s3.amazonaws.com/prod-ucs-content-store-us-east/content/egi:10V5T1RWZV7/PAGE-IMAGE/image/jpg/8a99287339343dfdc7ca92094f2d8428/Thuy_Duong_Nguyen_Phan_supported_catalyst_2016_P58.jpg https://ucs.elsevier.com/asset/2bacb01c-128e-49c7-b4f5-fc50a28e96ce Thuy_Duong_Nguyen_Phan_supported_catalyst_2016_P58 Thuy_Duong_Nguyen_Phan_supported_catalyst_2016_P58.jpg jpg 507203 ALTIMG 1-s2.0-S0926860X15302866-Thuy_Duong_Nguyen_Phan_supported_catalyst_2016_P27.jpg https://s3-eu-west-1.amazonaws.com/prod-ucs-content-store-eu-west/content/egi:10V5T1RWZV7/PAGE-IMAGE/image/jpg/fd6ab8657f1a81e1569447f08ecc7570/Thuy_Duong_Nguyen_Phan_supported_catalyst_2016_P27.jpg https://s3.amazonaws.com/prod-ucs-content-store-us-east/content/egi:10V5T1RWZV7/PAGE-IMAGE/image/jpg/fd6ab8657f1a81e1569447f08ecc7570/Thuy_Duong_Nguyen_Phan_supported_catalyst_2016_P27.jpg https://ucs.elsevier.com/asset/2fd9219d-a862-429c-9b23-23e75631b434 Thuy_Duong_Nguyen_Phan_supported_catalyst_2016_P27 Thuy_Duong_Nguyen_Phan_supported_catalyst_2016_P27.jpg jpg 717948 ALTIMG 1-s2.0-S0926860X15302866-Thuy_Duong_Nguyen_Phan_supported_catalyst_2016_P49.jpg https://s3-eu-west-1.amazonaws.com/prod-ucs-content-store-eu-west/content/egi:10V5T1RWZV7/PAGE-IMAGE/image/jpg/17adaea1e1c73df69d21a8155f41eafb/Thuy_Duong_Nguyen_Phan_supported_catalyst_2016_P49.jpg https://s3.amazonaws.com/prod-ucs-content-store-us-east/content/egi:10V5T1RWZV7/PAGE-IMAGE/image/jpg/17adaea1e1c73df69d21a8155f41eafb/Thuy_Duong_Nguyen_Phan_supported_catalyst_2016_P49.jpg https://ucs.elsevier.com/asset/728d3b1d-0eb3-4ce2-9280-e5a61822e6a3 Thuy_Duong_Nguyen_Phan_supported_catalyst_2016_P49 Thuy_Duong_Nguyen_Phan_supported_catalyst_2016_P49.jpg jpg 650978 ALTIMG 1-s2.0-S0926860X15302866-Thuy_Duong_Nguyen_Phan_supported_catalyst_2016_P63.jpg https://s3-eu-west-1.amazonaws.com/prod-ucs-content-store-eu-west/content/egi:10V5T1RWZV7/PAGE-IMAGE/image/jpg/7bc06466727a83054da0e2cc455e544f/Thuy_Duong_Nguyen_Phan_supported_catalyst_2016_P63.jpg https://s3.amazonaws.com/prod-ucs-content-store-us-east/content/egi:10V5T1RWZV7/PAGE-IMAGE/image/jpg/7bc06466727a83054da0e2cc455e544f/Thuy_Duong_Nguyen_Phan_supported_catalyst_2016_P63.jpg https://ucs.elsevier.com/asset/a6c2382f-4690-4958-85ea-1d7cf71aacd9 Thuy_Duong_Nguyen_Phan_supported_catalyst_2016_P63 Thuy_Duong_Nguyen_Phan_supported_catalyst_2016_P63.jpg jpg 489648 ALTIMG 1-s2.0-S0926860X15302866-Thuy_Duong_Nguyen_Phan_supported_catalyst_2016_P05.jpg https://s3-eu-west-1.amazonaws.com/prod-ucs-content-store-eu-west/content/egi:10V5T1RWZV7/PAGE-IMAGE/image/jpg/1abe03368f246cc1a382a193f426f47a/Thuy_Duong_Nguyen_Phan_supported_catalyst_2016_P05.jpg https://s3.amazonaws.com/prod-ucs-content-store-us-east/content/egi:10V5T1RWZV7/PAGE-IMAGE/image/jpg/1abe03368f246cc1a382a193f426f47a/Thuy_Duong_Nguyen_Phan_supported_catalyst_2016_P05.jpg https://ucs.elsevier.com/asset/5bd607d3-2af4-443a-9a7c-2b7b38381c6a Thuy_Duong_Nguyen_Phan_supported_catalyst_2016_P05 Thuy_Duong_Nguyen_Phan_supported_catalyst_2016_P05.jpg jpg 494601 ALTIMG 1-s2.0-S0926860X15302866-Thuy_Duong_Nguyen_Phan_supported_catalyst_2016_P34.jpg https://s3-eu-west-1.amazonaws.com/prod-ucs-content-store-eu-west/content/egi:10V5T1RWZV7/PAGE-IMAGE/image/jpg/17ebc2b4043aa0e90bafb22e4158505c/Thuy_Duong_Nguyen_Phan_supported_catalyst_2016_P34.jpg https://s3.amazonaws.com/prod-ucs-content-store-us-east/content/egi:10V5T1RWZV7/PAGE-IMAGE/image/jpg/17ebc2b4043aa0e90bafb22e4158505c/Thuy_Duong_Nguyen_Phan_supported_catalyst_2016_P34.jpg https://ucs.elsevier.com/asset/15ce529c-d00c-4313-bdd2-1f786e011335 Thuy_Duong_Nguyen_Phan_supported_catalyst_2016_P34 Thuy_Duong_Nguyen_Phan_supported_catalyst_2016_P34.jpg jpg 740661 ALTIMG 1-s2.0-S0926860X15302866-Thuy_Duong_Nguyen_Phan_supported_catalyst_2016_P56.jpg https://s3-eu-west-1.amazonaws.com/prod-ucs-content-store-eu-west/content/egi:10V5T1RWZV7/PAGE-IMAGE/image/jpg/b86be42f975de5856ef50a747632cbe4/Thuy_Duong_Nguyen_Phan_supported_catalyst_2016_P56.jpg https://s3.amazonaws.com/prod-ucs-content-store-us-east/content/egi:10V5T1RWZV7/PAGE-IMAGE/image/jpg/b86be42f975de5856ef50a747632cbe4/Thuy_Duong_Nguyen_Phan_supported_catalyst_2016_P56.jpg https://ucs.elsevier.com/asset/f5a60e64-5e14-4e52-94df-18977e2e46a0 Thuy_Duong_Nguyen_Phan_supported_catalyst_2016_P56 Thuy_Duong_Nguyen_Phan_supported_catalyst_2016_P56.jpg jpg 467872 ALTIMG 1-s2.0-S0926860X15302866-Thuy_Duong_Nguyen_Phan_supported_catalyst_2016_P20.jpg https://s3-eu-west-1.amazonaws.com/prod-ucs-content-store-eu-west/content/egi:10V5T1RWZV7/PAGE-IMAGE/image/jpg/669e2343bf612d27bdfda9a4900797b7/Thuy_Duong_Nguyen_Phan_supported_catalyst_2016_P20.jpg https://s3.amazonaws.com/prod-ucs-content-store-us-east/content/egi:10V5T1RWZV7/PAGE-IMAGE/image/jpg/669e2343bf612d27bdfda9a4900797b7/Thuy_Duong_Nguyen_Phan_supported_catalyst_2016_P20.jpg https://ucs.elsevier.com/asset/ffc233ad-50a9-4355-b93c-d44f140e56df Thuy_Duong_Nguyen_Phan_supported_catalyst_2016_P20 Thuy_Duong_Nguyen_Phan_supported_catalyst_2016_P20.jpg jpg 555417 ALTIMG 1-s2.0-S0926860X15302866-Thuy_Duong_Nguyen_Phan_supported_catalyst_2016_P40.jpg https://s3-eu-west-1.amazonaws.com/prod-ucs-content-store-eu-west/content/egi:10V5T1RWZV7/PAGE-IMAGE/image/jpg/d5c39b92911973486b51e29041f8d3ee/Thuy_Duong_Nguyen_Phan_supported_catalyst_2016_P40.jpg https://s3.amazonaws.com/prod-ucs-content-store-us-east/content/egi:10V5T1RWZV7/PAGE-IMAGE/image/jpg/d5c39b92911973486b51e29041f8d3ee/Thuy_Duong_Nguyen_Phan_supported_catalyst_2016_P40.jpg https://ucs.elsevier.com/asset/15078991-ba3d-460a-a18e-b04a55f7d492 Thuy_Duong_Nguyen_Phan_supported_catalyst_2016_P40 Thuy_Duong_Nguyen_Phan_supported_catalyst_2016_P40.jpg jpg 473522 ALTIMG 1-s2.0-S0926860X15302866-Thuy_Duong_Nguyen_Phan_supported_catalyst_2016_P45.jpg https://s3-eu-west-1.amazonaws.com/prod-ucs-content-store-eu-west/content/egi:10V5T1RWZV7/PAGE-IMAGE/image/jpg/8cd3b15f5a63fbdaae391641d2b0b634/Thuy_Duong_Nguyen_Phan_supported_catalyst_2016_P45.jpg https://s3.amazonaws.com/prod-ucs-content-store-us-east/content/egi:10V5T1RWZV7/PAGE-IMAGE/image/jpg/8cd3b15f5a63fbdaae391641d2b0b634/Thuy_Duong_Nguyen_Phan_supported_catalyst_2016_P45.jpg https://ucs.elsevier.com/asset/4edd3245-f4ac-45c3-a0eb-36bd3145ffe6 Thuy_Duong_Nguyen_Phan_supported_catalyst_2016_P45 Thuy_Duong_Nguyen_Phan_supported_catalyst_2016_P45.jpg jpg 424539 ALTIMG 1-s2.0-S0926860X15302866-Thuy_Duong_Nguyen_Phan_supported_catalyst_2016_P01.jpg https://s3-eu-west-1.amazonaws.com/prod-ucs-content-store-eu-west/content/egi:10V5T1RWZV7/PAGE-IMAGE/image/jpg/4cce9c3809f12144f0af12404fb3e09f/Thuy_Duong_Nguyen_Phan_supported_catalyst_2016_P01.jpg https://s3.amazonaws.com/prod-ucs-content-store-us-east/content/egi:10V5T1RWZV7/PAGE-IMAGE/image/jpg/4cce9c3809f12144f0af12404fb3e09f/Thuy_Duong_Nguyen_Phan_supported_catalyst_2016_P01.jpg https://ucs.elsevier.com/asset/337f54ed-5d11-4a99-adfe-4eed5da93f0f Thuy_Duong_Nguyen_Phan_supported_catalyst_2016_P01 Thuy_Duong_Nguyen_Phan_supported_catalyst_2016_P01.jpg jpg 221309 ALTIMG 1-s2.0-S0926860X15302866-Thuy_Duong_Nguyen_Phan_supported_catalyst_2016_P52.jpg https://s3-eu-west-1.amazonaws.com/prod-ucs-content-store-eu-west/content/egi:10V5T1RWZV7/PAGE-IMAGE/image/jpg/53cae1ae8e9231dbea058bdc99253727/Thuy_Duong_Nguyen_Phan_supported_catalyst_2016_P52.jpg https://s3.amazonaws.com/prod-ucs-content-store-us-east/content/egi:10V5T1RWZV7/PAGE-IMAGE/image/jpg/53cae1ae8e9231dbea058bdc99253727/Thuy_Duong_Nguyen_Phan_supported_catalyst_2016_P52.jpg https://ucs.elsevier.com/asset/f6e890f0-4ef7-44a4-a6e2-e689c0545be4 Thuy_Duong_Nguyen_Phan_supported_catalyst_2016_P52 Thuy_Duong_Nguyen_Phan_supported_catalyst_2016_P52.jpg jpg 502008 ALTIMG 1-s2.0-S0926860X15302866-Thuy_Duong_Nguyen_Phan_supported_catalyst_2016_P54.jpg https://s3-eu-west-1.amazonaws.com/prod-ucs-content-store-eu-west/content/egi:10V5T1RWZV7/PAGE-IMAGE/image/jpg/4aceaf43baa628f2d1ee4fea8385efa7/Thuy_Duong_Nguyen_Phan_supported_catalyst_2016_P54.jpg https://s3.amazonaws.com/prod-ucs-content-store-us-east/content/egi:10V5T1RWZV7/PAGE-IMAGE/image/jpg/4aceaf43baa628f2d1ee4fea8385efa7/Thuy_Duong_Nguyen_Phan_supported_catalyst_2016_P54.jpg https://ucs.elsevier.com/asset/4bf1e66d-29c7-44c9-bec5-7c1358616182 Thuy_Duong_Nguyen_Phan_supported_catalyst_2016_P54 Thuy_Duong_Nguyen_Phan_supported_catalyst_2016_P54.jpg jpg 292785 ALTIMG 1-s2.0-S0926860X15302866-Thuy_Duong_Nguyen_Phan_supported_catalyst_2016_P38.jpg https://s3-eu-west-1.amazonaws.com/prod-ucs-content-store-eu-west/content/egi:10V5T1RWZV7/PAGE-IMAGE/image/jpg/0ecad215a9f85210a61418e671536045/Thuy_Duong_Nguyen_Phan_supported_catalyst_2016_P38.jpg https://s3.amazonaws.com/prod-ucs-content-store-us-east/content/egi:10V5T1RWZV7/PAGE-IMAGE/image/jpg/0ecad215a9f85210a61418e671536045/Thuy_Duong_Nguyen_Phan_supported_catalyst_2016_P38.jpg https://ucs.elsevier.com/asset/eef9aa6a-5259-486f-a9a5-3747d521d5f1 Thuy_Duong_Nguyen_Phan_supported_catalyst_2016_P38 Thuy_Duong_Nguyen_Phan_supported_catalyst_2016_P38.jpg jpg 601255 ALTIMG 1-s2.0-S0926860X15302866-Thuy_Duong_Nguyen_Phan_supported_catalyst_2016_P64.jpg https://s3-eu-west-1.amazonaws.com/prod-ucs-content-store-eu-west/content/egi:10V5T1RWZV7/PAGE-IMAGE/image/jpg/a5523fc6f02be9d955215aa8f8eecce5/Thuy_Duong_Nguyen_Phan_supported_catalyst_2016_P64.jpg https://s3.amazonaws.com/prod-ucs-content-store-us-east/content/egi:10V5T1RWZV7/PAGE-IMAGE/image/jpg/a5523fc6f02be9d955215aa8f8eecce5/Thuy_Duong_Nguyen_Phan_supported_catalyst_2016_P64.jpg https://ucs.elsevier.com/asset/905d57c2-2a58-41c1-b93f-22ed75e4dcbd Thuy_Duong_Nguyen_Phan_supported_catalyst_2016_P64 Thuy_Duong_Nguyen_Phan_supported_catalyst_2016_P64.jpg jpg 543403 ALTIMG 1-s2.0-S0926860X15302866-Thuy_Duong_Nguyen_Phan_supported_catalyst_2016_P07.jpg https://s3-eu-west-1.amazonaws.com/prod-ucs-content-store-eu-west/content/egi:10V5T1RWZV7/PAGE-IMAGE/image/jpg/b4179a0e3379201f97b7e78383def1a9/Thuy_Duong_Nguyen_Phan_supported_catalyst_2016_P07.jpg https://s3.amazonaws.com/prod-ucs-content-store-us-east/content/egi:10V5T1RWZV7/PAGE-IMAGE/image/jpg/b4179a0e3379201f97b7e78383def1a9/Thuy_Duong_Nguyen_Phan_supported_catalyst_2016_P07.jpg https://ucs.elsevier.com/asset/16e401a5-5439-47a0-badb-059c595b9741 Thuy_Duong_Nguyen_Phan_supported_catalyst_2016_P07 Thuy_Duong_Nguyen_Phan_supported_catalyst_2016_P07.jpg jpg 554400 ALTIMG 1-s2.0-S0926860X15302866-Thuy_Duong_Nguyen_Phan_supported_catalyst_2016_P21.jpg https://s3-eu-west-1.amazonaws.com/prod-ucs-content-store-eu-west/content/egi:10V5T1RWZV7/PAGE-IMAGE/image/jpg/6c6dc1e6210a40157c45aeeb5b12f1fe/Thuy_Duong_Nguyen_Phan_supported_catalyst_2016_P21.jpg https://s3.amazonaws.com/prod-ucs-content-store-us-east/content/egi:10V5T1RWZV7/PAGE-IMAGE/image/jpg/6c6dc1e6210a40157c45aeeb5b12f1fe/Thuy_Duong_Nguyen_Phan_supported_catalyst_2016_P21.jpg https://ucs.elsevier.com/asset/45f2ff04-af75-42cd-86e8-3c73de314163 Thuy_Duong_Nguyen_Phan_supported_catalyst_2016_P21 Thuy_Duong_Nguyen_Phan_supported_catalyst_2016_P21.jpg jpg 552213 ALTIMG 1-s2.0-S0926860X15302866-Thuy_Duong_Nguyen_Phan_supported_catalyst_2016_P65.jpg https://s3-eu-west-1.amazonaws.com/prod-ucs-content-store-eu-west/content/egi:10V5T1RWZV7/PAGE-IMAGE/image/jpg/b7433581ac4d4c0ec61b5942fb8ea295/Thuy_Duong_Nguyen_Phan_supported_catalyst_2016_P65.jpg https://s3.amazonaws.com/prod-ucs-content-store-us-east/content/egi:10V5T1RWZV7/PAGE-IMAGE/image/jpg/b7433581ac4d4c0ec61b5942fb8ea295/Thuy_Duong_Nguyen_Phan_supported_catalyst_2016_P65.jpg https://ucs.elsevier.com/asset/1c455860-21a3-43de-b2b4-b5ae593c83a2 Thuy_Duong_Nguyen_Phan_supported_catalyst_2016_P65 Thuy_Duong_Nguyen_Phan_supported_catalyst_2016_P65.jpg jpg 520556 ALTIMG 1-s2.0-S0926860X15302866-Thuy_Duong_Nguyen_Phan_supported_catalyst_2016_P61.jpg https://s3-eu-west-1.amazonaws.com/prod-ucs-content-store-eu-west/content/egi:10V5T1RWZV7/PAGE-IMAGE/image/jpg/4995ae3b88ab2abfda172ed03f9242e1/Thuy_Duong_Nguyen_Phan_supported_catalyst_2016_P61.jpg https://s3.amazonaws.com/prod-ucs-content-store-us-east/content/egi:10V5T1RWZV7/PAGE-IMAGE/image/jpg/4995ae3b88ab2abfda172ed03f9242e1/Thuy_Duong_Nguyen_Phan_supported_catalyst_2016_P61.jpg https://ucs.elsevier.com/asset/5dac593c-9e44-4c9c-b117-f2b2aaab697a Thuy_Duong_Nguyen_Phan_supported_catalyst_2016_P61 Thuy_Duong_Nguyen_Phan_supported_catalyst_2016_P61.jpg jpg 578223 ALTIMG 1-s2.0-S0926860X15302866-Thuy_Duong_Nguyen_Phan_supported_catalyst_2016_P02.jpg https://s3-eu-west-1.amazonaws.com/prod-ucs-content-store-eu-west/content/egi:10V5T1RWZV7/PAGE-IMAGE/image/jpg/8df785729865bac9abbe2afdc1604bba/Thuy_Duong_Nguyen_Phan_supported_catalyst_2016_P02.jpg https://s3.amazonaws.com/prod-ucs-content-store-us-east/content/egi:10V5T1RWZV7/PAGE-IMAGE/image/jpg/8df785729865bac9abbe2afdc1604bba/Thuy_Duong_Nguyen_Phan_supported_catalyst_2016_P02.jpg https://ucs.elsevier.com/asset/e71d3dde-1376-4de3-bdec-a283033b7707 Thuy_Duong_Nguyen_Phan_supported_catalyst_2016_P02 Thuy_Duong_Nguyen_Phan_supported_catalyst_2016_P02.jpg jpg 333309 ALTIMG 1-s2.0-S0926860X15302866-Thuy_Duong_Nguyen_Phan_supported_catalyst_2016_P46.jpg https://s3-eu-west-1.amazonaws.com/prod-ucs-content-store-eu-west/content/egi:10V5T1RWZV7/PAGE-IMAGE/image/jpg/9acd550139cdc27e23abc4bfe9fa772c/Thuy_Duong_Nguyen_Phan_supported_catalyst_2016_P46.jpg https://s3.amazonaws.com/prod-ucs-content-store-us-east/content/egi:10V5T1RWZV7/PAGE-IMAGE/image/jpg/9acd550139cdc27e23abc4bfe9fa772c/Thuy_Duong_Nguyen_Phan_supported_catalyst_2016_P46.jpg https://ucs.elsevier.com/asset/fa85a584-d68f-4acb-b705-9131e2d23865 Thuy_Duong_Nguyen_Phan_supported_catalyst_2016_P46 Thuy_Duong_Nguyen_Phan_supported_catalyst_2016_P46.jpg jpg 770578 ALTIMG 1-s2.0-S0926860X15302866-Thuy_Duong_Nguyen_Phan_supported_catalyst_2016_P35.jpg https://s3-eu-west-1.amazonaws.com/prod-ucs-content-store-eu-west/content/egi:10V5T1RWZV7/PAGE-IMAGE/image/jpg/d5964002be5b9b86dc163fcee4c8a01e/Thuy_Duong_Nguyen_Phan_supported_catalyst_2016_P35.jpg https://s3.amazonaws.com/prod-ucs-content-store-us-east/content/egi:10V5T1RWZV7/PAGE-IMAGE/image/jpg/d5964002be5b9b86dc163fcee4c8a01e/Thuy_Duong_Nguyen_Phan_supported_catalyst_2016_P35.jpg https://ucs.elsevier.com/asset/b72f7e45-de0d-49b1-a1a2-f1a5fcec6c14 Thuy_Duong_Nguyen_Phan_supported_catalyst_2016_P35 Thuy_Duong_Nguyen_Phan_supported_catalyst_2016_P35.jpg jpg 417811 ALTIMG 1-s2.0-S0926860X15302866-Thuy_Duong_Nguyen_Phan_supported_catalyst_2016_P17.jpg https://s3-eu-west-1.amazonaws.com/prod-ucs-content-store-eu-west/content/egi:10V5T1RWZV7/PAGE-IMAGE/image/jpg/49d5dff23c88ae86eb6734c9b6209f89/Thuy_Duong_Nguyen_Phan_supported_catalyst_2016_P17.jpg https://s3.amazonaws.com/prod-ucs-content-store-us-east/content/egi:10V5T1RWZV7/PAGE-IMAGE/image/jpg/49d5dff23c88ae86eb6734c9b6209f89/Thuy_Duong_Nguyen_Phan_supported_catalyst_2016_P17.jpg https://ucs.elsevier.com/asset/9f53d127-9e82-4474-b761-542642a75733 Thuy_Duong_Nguyen_Phan_supported_catalyst_2016_P17 Thuy_Duong_Nguyen_Phan_supported_catalyst_2016_P17.jpg jpg 630158 ALTIMG 1-s2.0-S0926860X15302866-Thuy_Duong_Nguyen_Phan_supported_catalyst_2016_P33.jpg https://s3-eu-west-1.amazonaws.com/prod-ucs-content-store-eu-west/content/egi:10V5T1RWZV7/PAGE-IMAGE/image/jpg/e73d87fcabd04b6e8cb24f0f0f956ae4/Thuy_Duong_Nguyen_Phan_supported_catalyst_2016_P33.jpg https://s3.amazonaws.com/prod-ucs-content-store-us-east/content/egi:10V5T1RWZV7/PAGE-IMAGE/image/jpg/e73d87fcabd04b6e8cb24f0f0f956ae4/Thuy_Duong_Nguyen_Phan_supported_catalyst_2016_P33.jpg https://ucs.elsevier.com/asset/5748e7f8-7bac-4b8c-a52f-08e16906ec64 Thuy_Duong_Nguyen_Phan_supported_catalyst_2016_P33 Thuy_Duong_Nguyen_Phan_supported_catalyst_2016_P33.jpg jpg 529116 ALTIMG 1-s2.0-S0926860X15302866-Thuy_Duong_Nguyen_Phan_supported_catalyst_2016_P39.jpg https://s3-eu-west-1.amazonaws.com/prod-ucs-content-store-eu-west/content/egi:10V5T1RWZV7/PAGE-IMAGE/image/jpg/f0d536b272cc5bdc9722258014cde639/Thuy_Duong_Nguyen_Phan_supported_catalyst_2016_P39.jpg https://s3.amazonaws.com/prod-ucs-content-store-us-east/content/egi:10V5T1RWZV7/PAGE-IMAGE/image/jpg/f0d536b272cc5bdc9722258014cde639/Thuy_Duong_Nguyen_Phan_supported_catalyst_2016_P39.jpg https://ucs.elsevier.com/asset/a8ff8e55-bbfb-460f-9dc4-10a8630021a3 Thuy_Duong_Nguyen_Phan_supported_catalyst_2016_P39 Thuy_Duong_Nguyen_Phan_supported_catalyst_2016_P39.jpg jpg 625572 ALTIMG 1-s2.0-S0926860X15302866-Thuy_Duong_Nguyen_Phan_supported_catalyst_2016_P37.jpg https://s3-eu-west-1.amazonaws.com/prod-ucs-content-store-eu-west/content/egi:10V5T1RWZV7/PAGE-IMAGE/image/jpg/cb6518b1d002de7f943b6698f7d6df4f/Thuy_Duong_Nguyen_Phan_supported_catalyst_2016_P37.jpg https://s3.amazonaws.com/prod-ucs-content-store-us-east/content/egi:10V5T1RWZV7/PAGE-IMAGE/image/jpg/cb6518b1d002de7f943b6698f7d6df4f/Thuy_Duong_Nguyen_Phan_supported_catalyst_2016_P37.jpg https://ucs.elsevier.com/asset/e774816e-89a9-40d8-87fa-3e434cba4497 Thuy_Duong_Nguyen_Phan_supported_catalyst_2016_P37 Thuy_Duong_Nguyen_Phan_supported_catalyst_2016_P37.jpg jpg 637622 ALTIMG 1-s2.0-S0926860X15302866-Thuy_Duong_Nguyen_Phan_supported_catalyst_2016_P23.jpg https://s3-eu-west-1.amazonaws.com/prod-ucs-content-store-eu-west/content/egi:10V5T1RWZV7/PAGE-IMAGE/image/jpg/9e670bfd8bf750df450f63f8a0dcd971/Thuy_Duong_Nguyen_Phan_supported_catalyst_2016_P23.jpg https://s3.amazonaws.com/prod-ucs-content-store-us-east/content/egi:10V5T1RWZV7/PAGE-IMAGE/image/jpg/9e670bfd8bf750df450f63f8a0dcd971/Thuy_Duong_Nguyen_Phan_supported_catalyst_2016_P23.jpg https://ucs.elsevier.com/asset/41a1a0e3-a6e5-41c4-bcc8-d5c2a368d01a Thuy_Duong_Nguyen_Phan_supported_catalyst_2016_P23 Thuy_Duong_Nguyen_Phan_supported_catalyst_2016_P23.jpg jpg 470680 ALTIMG 1-s2.0-S0926860X15302866-Thuy_Duong_Nguyen_Phan_supported_catalyst_2016_P30.jpg https://s3-eu-west-1.amazonaws.com/prod-ucs-content-store-eu-west/content/egi:10V5T1RWZV7/PAGE-IMAGE/image/jpg/3daab2fa4402f6a21b9387a8e91cd7b4/Thuy_Duong_Nguyen_Phan_supported_catalyst_2016_P30.jpg https://s3.amazonaws.com/prod-ucs-content-store-us-east/content/egi:10V5T1RWZV7/PAGE-IMAGE/image/jpg/3daab2fa4402f6a21b9387a8e91cd7b4/Thuy_Duong_Nguyen_Phan_supported_catalyst_2016_P30.jpg https://ucs.elsevier.com/asset/bba895fc-8593-401a-8b55-1fc57cff8845 Thuy_Duong_Nguyen_Phan_supported_catalyst_2016_P30 Thuy_Duong_Nguyen_Phan_supported_catalyst_2016_P30.jpg jpg 382832 ALTIMG 1-s2.0-S0926860X15302866-Thuy_Duong_Nguyen_Phan_supported_catalyst_2016_P04.jpg https://s3-eu-west-1.amazonaws.com/prod-ucs-content-store-eu-west/content/egi:10V5T1RWZV7/PAGE-IMAGE/image/jpg/2249170e5997e6dd20de13f026c01e90/Thuy_Duong_Nguyen_Phan_supported_catalyst_2016_P04.jpg https://s3.amazonaws.com/prod-ucs-content-store-us-east/content/egi:10V5T1RWZV7/PAGE-IMAGE/image/jpg/2249170e5997e6dd20de13f026c01e90/Thuy_Duong_Nguyen_Phan_supported_catalyst_2016_P04.jpg https://ucs.elsevier.com/asset/f35867e6-0fdd-4b77-a8ce-03262b777296 Thuy_Duong_Nguyen_Phan_supported_catalyst_2016_P04 Thuy_Duong_Nguyen_Phan_supported_catalyst_2016_P04.jpg jpg 640772 ALTIMG 1-s2.0-S0926860X15302866-Thuy_Duong_Nguyen_Phan_supported_catalyst_2016_P47.jpg https://s3-eu-west-1.amazonaws.com/prod-ucs-content-store-eu-west/content/egi:10V5T1RWZV7/PAGE-IMAGE/image/jpg/a867f2308cd3c18d11223e61ecf1e5a6/Thuy_Duong_Nguyen_Phan_supported_catalyst_2016_P47.jpg https://s3.amazonaws.com/prod-ucs-content-store-us-east/content/egi:10V5T1RWZV7/PAGE-IMAGE/image/jpg/a867f2308cd3c18d11223e61ecf1e5a6/Thuy_Duong_Nguyen_Phan_supported_catalyst_2016_P47.jpg https://ucs.elsevier.com/asset/0ab8246d-fc85-4371-9a95-29c98b4bcc79 Thuy_Duong_Nguyen_Phan_supported_catalyst_2016_P47 Thuy_Duong_Nguyen_Phan_supported_catalyst_2016_P47.jpg jpg 414301 ALTIMG 1-s2.0-S0926860X15302866-Thuy_Duong_Nguyen_Phan_supported_catalyst_2016_P66.jpg https://s3-eu-west-1.amazonaws.com/prod-ucs-content-store-eu-west/content/egi:10V5T1RWZV7/PAGE-IMAGE/image/jpg/2a4bd3301cb1303c15998fc569d74115/Thuy_Duong_Nguyen_Phan_supported_catalyst_2016_P66.jpg https://s3.amazonaws.com/prod-ucs-content-store-us-east/content/egi:10V5T1RWZV7/PAGE-IMAGE/image/jpg/2a4bd3301cb1303c15998fc569d74115/Thuy_Duong_Nguyen_Phan_supported_catalyst_2016_P66.jpg https://ucs.elsevier.com/asset/d5c2598f-5659-4c1e-829b-cdec4a44f2d9 Thuy_Duong_Nguyen_Phan_supported_catalyst_2016_P66 Thuy_Duong_Nguyen_Phan_supported_catalyst_2016_P66.jpg jpg 543904 ALTIMG 1-s2.0-S0926860X15302866-Thuy_Duong_Nguyen_Phan_supported_catalyst_2016_P59.jpg https://s3-eu-west-1.amazonaws.com/prod-ucs-content-store-eu-west/content/egi:10V5T1RWZV7/PAGE-IMAGE/image/jpg/fd34caadbb51527f13b4a9f7c18f98c5/Thuy_Duong_Nguyen_Phan_supported_catalyst_2016_P59.jpg https://s3.amazonaws.com/prod-ucs-content-store-us-east/content/egi:10V5T1RWZV7/PAGE-IMAGE/image/jpg/fd34caadbb51527f13b4a9f7c18f98c5/Thuy_Duong_Nguyen_Phan_supported_catalyst_2016_P59.jpg https://ucs.elsevier.com/asset/5f9a5030-4494-46f8-8432-c573a160ef89 Thuy_Duong_Nguyen_Phan_supported_catalyst_2016_P59 Thuy_Duong_Nguyen_Phan_supported_catalyst_2016_P59.jpg jpg 503515 ALTIMG 1-s2.0-S0926860X15302866-Thuy_Duong_Nguyen_Phan_supported_catalyst_2016_P69.jpg https://s3-eu-west-1.amazonaws.com/prod-ucs-content-store-eu-west/content/egi:10V5T1RWZV7/PAGE-IMAGE/image/jpg/c6d392b8a3badab759a496640568af70/Thuy_Duong_Nguyen_Phan_supported_catalyst_2016_P69.jpg https://s3.amazonaws.com/prod-ucs-content-store-us-east/content/egi:10V5T1RWZV7/PAGE-IMAGE/image/jpg/c6d392b8a3badab759a496640568af70/Thuy_Duong_Nguyen_Phan_supported_catalyst_2016_P69.jpg https://ucs.elsevier.com/asset/7e1fcf09-1770-421a-9a65-d3ff5810dd4d Thuy_Duong_Nguyen_Phan_supported_catalyst_2016_P69 Thuy_Duong_Nguyen_Phan_supported_catalyst_2016_P69.jpg jpg 555764 ALTIMG 1-s2.0-S0926860X15302866-Thuy_Duong_Nguyen_Phan_supported_catalyst_2016_P03.jpg https://s3-eu-west-1.amazonaws.com/prod-ucs-content-store-eu-west/content/egi:10V5T1RWZV7/PAGE-IMAGE/image/jpg/868ec45d1aa555778986ca8d600e4408/Thuy_Duong_Nguyen_Phan_supported_catalyst_2016_P03.jpg https://s3.amazonaws.com/prod-ucs-content-store-us-east/content/egi:10V5T1RWZV7/PAGE-IMAGE/image/jpg/868ec45d1aa555778986ca8d600e4408/Thuy_Duong_Nguyen_Phan_supported_catalyst_2016_P03.jpg https://ucs.elsevier.com/asset/2734b044-2f5a-4291-b9e0-4143cc88f7e9 Thuy_Duong_Nguyen_Phan_supported_catalyst_2016_P03 Thuy_Duong_Nguyen_Phan_supported_catalyst_2016_P03.jpg jpg 646317 ALTIMG 1-s2.0-S0926860X15302866-Thuy_Duong_Nguyen_Phan_supported_catalyst_2016_P62.jpg https://s3-eu-west-1.amazonaws.com/prod-ucs-content-store-eu-west/content/egi:10V5T1RWZV7/PAGE-IMAGE/image/jpg/f1dc86d6c090f5f63ebca961c8efcd83/Thuy_Duong_Nguyen_Phan_supported_catalyst_2016_P62.jpg https://s3.amazonaws.com/prod-ucs-content-store-us-east/content/egi:10V5T1RWZV7/PAGE-IMAGE/image/jpg/f1dc86d6c090f5f63ebca961c8efcd83/Thuy_Duong_Nguyen_Phan_supported_catalyst_2016_P62.jpg https://ucs.elsevier.com/asset/4a2c4d4d-6aac-44dd-be3e-a310984c3c87 Thuy_Duong_Nguyen_Phan_supported_catalyst_2016_P62 Thuy_Duong_Nguyen_Phan_supported_catalyst_2016_P62.jpg jpg 546326 ALTIMG 1-s2.0-S0926860X15302866-Thuy_Duong_Nguyen_Phan_supported_catalyst_2016_P51.jpg https://s3-eu-west-1.amazonaws.com/prod-ucs-content-store-eu-west/content/egi:10V5T1RWZV7/PAGE-IMAGE/image/jpg/1564328aae795b7b5f98c9cc15a9707f/Thuy_Duong_Nguyen_Phan_supported_catalyst_2016_P51.jpg https://s3.amazonaws.com/prod-ucs-content-store-us-east/content/egi:10V5T1RWZV7/PAGE-IMAGE/image/jpg/1564328aae795b7b5f98c9cc15a9707f/Thuy_Duong_Nguyen_Phan_supported_catalyst_2016_P51.jpg https://ucs.elsevier.com/asset/dae21fcc-e4a0-40a2-9f87-8dc0e7f8232c Thuy_Duong_Nguyen_Phan_supported_catalyst_2016_P51 Thuy_Duong_Nguyen_Phan_supported_catalyst_2016_P51.jpg jpg 349471 ALTIMG 1-s2.0-S0926860X15302866-Thuy_Duong_Nguyen_Phan_supported_catalyst_2016_P29.jpg https://s3-eu-west-1.amazonaws.com/prod-ucs-content-store-eu-west/content/egi:10V5T1RWZV7/PAGE-IMAGE/image/jpg/bb90f64bfeac3819b1f3ba421ad25b7c/Thuy_Duong_Nguyen_Phan_supported_catalyst_2016_P29.jpg https://s3.amazonaws.com/prod-ucs-content-store-us-east/content/egi:10V5T1RWZV7/PAGE-IMAGE/image/jpg/bb90f64bfeac3819b1f3ba421ad25b7c/Thuy_Duong_Nguyen_Phan_supported_catalyst_2016_P29.jpg https://ucs.elsevier.com/asset/e2587b11-2054-4eb1-b840-52133935b171 Thuy_Duong_Nguyen_Phan_supported_catalyst_2016_P29 Thuy_Duong_Nguyen_Phan_supported_catalyst_2016_P29.jpg jpg 306770 ALTIMG 1-s2.0-S0926860X15302866-Thuy_Duong_Nguyen_Phan_supported_catalyst_2016_P16.jpg https://s3-eu-west-1.amazonaws.com/prod-ucs-content-store-eu-west/content/egi:10V5T1RWZV7/PAGE-IMAGE/image/jpg/127cde741638000c881f2edad2aff848/Thuy_Duong_Nguyen_Phan_supported_catalyst_2016_P16.jpg https://s3.amazonaws.com/prod-ucs-content-store-us-east/content/egi:10V5T1RWZV7/PAGE-IMAGE/image/jpg/127cde741638000c881f2edad2aff848/Thuy_Duong_Nguyen_Phan_supported_catalyst_2016_P16.jpg https://ucs.elsevier.com/asset/eac9b54b-2240-4a53-93da-ecb7ffe80406 Thuy_Duong_Nguyen_Phan_supported_catalyst_2016_P16 Thuy_Duong_Nguyen_Phan_supported_catalyst_2016_P16.jpg jpg 546661 ALTIMG 1-s2.0-S0926860X15302866-Thuy_Duong_Nguyen_Phan_supported_catalyst_2016_P43.jpg https://s3-eu-west-1.amazonaws.com/prod-ucs-content-store-eu-west/content/egi:10V5T1RWZV7/PAGE-IMAGE/image/jpg/9f26e88682304cf14adfdc090bc88d08/Thuy_Duong_Nguyen_Phan_supported_catalyst_2016_P43.jpg https://s3.amazonaws.com/prod-ucs-content-store-us-east/content/egi:10V5T1RWZV7/PAGE-IMAGE/image/jpg/9f26e88682304cf14adfdc090bc88d08/Thuy_Duong_Nguyen_Phan_supported_catalyst_2016_P43.jpg https://ucs.elsevier.com/asset/7c1be767-0d7c-4335-8c46-5c6e7c265fab Thuy_Duong_Nguyen_Phan_supported_catalyst_2016_P43 Thuy_Duong_Nguyen_Phan_supported_catalyst_2016_P43.jpg jpg 323004 ALTIMG 1-s2.0-S0926860X15302866-Thuy_Duong_Nguyen_Phan_supported_catalyst_2016_P11.jpg https://s3-eu-west-1.amazonaws.com/prod-ucs-content-store-eu-west/content/egi:10V5T1RWZV7/PAGE-IMAGE/image/jpg/81b4fd75f851dfef0594fc90ba67a4cc/Thuy_Duong_Nguyen_Phan_supported_catalyst_2016_P11.jpg https://s3.amazonaws.com/prod-ucs-content-store-us-east/content/egi:10V5T1RWZV7/PAGE-IMAGE/image/jpg/81b4fd75f851dfef0594fc90ba67a4cc/Thuy_Duong_Nguyen_Phan_supported_catalyst_2016_P11.jpg https://ucs.elsevier.com/asset/0c7c84b3-60ce-4012-b0a8-1ccc3c6f5880 Thuy_Duong_Nguyen_Phan_supported_catalyst_2016_P11 Thuy_Duong_Nguyen_Phan_supported_catalyst_2016_P11.jpg jpg 471354 ALTIMG 1-s2.0-S0926860X15302866-Thuy_Duong_Nguyen_Phan_supported_catalyst_2016_P32.jpg https://s3-eu-west-1.amazonaws.com/prod-ucs-content-store-eu-west/content/egi:10V5T1RWZV7/PAGE-IMAGE/image/jpg/7008f94865b975363d00904543a8c5e5/Thuy_Duong_Nguyen_Phan_supported_catalyst_2016_P32.jpg https://s3.amazonaws.com/prod-ucs-content-store-us-east/content/egi:10V5T1RWZV7/PAGE-IMAGE/image/jpg/7008f94865b975363d00904543a8c5e5/Thuy_Duong_Nguyen_Phan_supported_catalyst_2016_P32.jpg https://ucs.elsevier.com/asset/257b1043-2987-43c6-952f-7183b7828553 Thuy_Duong_Nguyen_Phan_supported_catalyst_2016_P32 Thuy_Duong_Nguyen_Phan_supported_catalyst_2016_P32.jpg jpg 518623 ALTIMG 1-s2.0-S0926860X15302866-Thuy_Duong_Nguyen_Phan_supported_catalyst_2016_P41.jpg https://s3-eu-west-1.amazonaws.com/prod-ucs-content-store-eu-west/content/egi:10V5T1RWZV7/PAGE-IMAGE/image/jpg/65c6bc106c3c41cf0e3a851e64bfdeea/Thuy_Duong_Nguyen_Phan_supported_catalyst_2016_P41.jpg https://s3.amazonaws.com/prod-ucs-content-store-us-east/content/egi:10V5T1RWZV7/PAGE-IMAGE/image/jpg/65c6bc106c3c41cf0e3a851e64bfdeea/Thuy_Duong_Nguyen_Phan_supported_catalyst_2016_P41.jpg https://ucs.elsevier.com/asset/e342150b-d1e9-429d-9a92-3adafb8dd5da Thuy_Duong_Nguyen_Phan_supported_catalyst_2016_P41 Thuy_Duong_Nguyen_Phan_supported_catalyst_2016_P41.jpg jpg 736709 ALTIMG 1-s2.0-S0926860X15302866-Thuy_Duong_Nguyen_Phan_supported_catalyst_2016_P22.jpg https://s3-eu-west-1.amazonaws.com/prod-ucs-content-store-eu-west/content/egi:10V5T1RWZV7/PAGE-IMAGE/image/jpg/78f51356e7d32ba7ecd897eb4ba99356/Thuy_Duong_Nguyen_Phan_supported_catalyst_2016_P22.jpg https://s3.amazonaws.com/prod-ucs-content-store-us-east/content/egi:10V5T1RWZV7/PAGE-IMAGE/image/jpg/78f51356e7d32ba7ecd897eb4ba99356/Thuy_Duong_Nguyen_Phan_supported_catalyst_2016_P22.jpg https://ucs.elsevier.com/asset/b12fa606-2b95-4c93-8f97-1d76260a104e Thuy_Duong_Nguyen_Phan_supported_catalyst_2016_P22 Thuy_Duong_Nguyen_Phan_supported_catalyst_2016_P22.jpg jpg 773851 ALTIMG 1-s2.0-S0926860X15302866-Thuy_Duong_Nguyen_Phan_supported_catalyst_2016_P70.jpg https://s3-eu-west-1.amazonaws.com/prod-ucs-content-store-eu-west/content/egi:10V5T1RWZV7/PAGE-IMAGE/image/jpg/929d2b6d523e8332a37bd85e37afe4a3/Thuy_Duong_Nguyen_Phan_supported_catalyst_2016_P70.jpg https://s3.amazonaws.com/prod-ucs-content-store-us-east/content/egi:10V5T1RWZV7/PAGE-IMAGE/image/jpg/929d2b6d523e8332a37bd85e37afe4a3/Thuy_Duong_Nguyen_Phan_supported_catalyst_2016_P70.jpg https://ucs.elsevier.com/asset/08641518-7166-435d-b5ed-a543acd79178 Thuy_Duong_Nguyen_Phan_supported_catalyst_2016_P70 Thuy_Duong_Nguyen_Phan_supported_catalyst_2016_P70.jpg jpg 391249 ALTIMG 1-s2.0-S0926860X15302866-Thuy_Duong_Nguyen_Phan_supported_catalyst_2016_P48.jpg https://s3-eu-west-1.amazonaws.com/prod-ucs-content-store-eu-west/content/egi:10V5T1RWZV7/PAGE-IMAGE/image/jpg/07cd0c827ca8e1a4380dc1b64baf5bf2/Thuy_Duong_Nguyen_Phan_supported_catalyst_2016_P48.jpg https://s3.amazonaws.com/prod-ucs-content-store-us-east/content/egi:10V5T1RWZV7/PAGE-IMAGE/image/jpg/07cd0c827ca8e1a4380dc1b64baf5bf2/Thuy_Duong_Nguyen_Phan_supported_catalyst_2016_P48.jpg https://ucs.elsevier.com/asset/6fbf7169-42b3-4538-a1a2-7146503ce9af Thuy_Duong_Nguyen_Phan_supported_catalyst_2016_P48 Thuy_Duong_Nguyen_Phan_supported_catalyst_2016_P48.jpg jpg 544764 ALTIMG 1-s2.0-S0926860X15302866-Thuy_Duong_Nguyen_Phan_supported_catalyst_2016_P31.jpg https://s3-eu-west-1.amazonaws.com/prod-ucs-content-store-eu-west/content/egi:10V5T1RWZV7/PAGE-IMAGE/image/jpg/e5760900097246e37c22b4145e9a536f/Thuy_Duong_Nguyen_Phan_supported_catalyst_2016_P31.jpg https://s3.amazonaws.com/prod-ucs-content-store-us-east/content/egi:10V5T1RWZV7/PAGE-IMAGE/image/jpg/e5760900097246e37c22b4145e9a536f/Thuy_Duong_Nguyen_Phan_supported_catalyst_2016_P31.jpg https://ucs.elsevier.com/asset/22cd77f0-da10-4f06-9914-59c55cb8b4c8 Thuy_Duong_Nguyen_Phan_supported_catalyst_2016_P31 Thuy_Duong_Nguyen_Phan_supported_catalyst_2016_P31.jpg jpg 589115 ALTIMG 1-s2.0-S0926860X15302866-Thuy_Duong_Nguyen_Phan_supported_catalyst_2016_P42.jpg https://s3-eu-west-1.amazonaws.com/prod-ucs-content-store-eu-west/content/egi:10V5T1RWZV7/PAGE-IMAGE/image/jpg/1ed8fb30fa61c84b7d9d587f44868c16/Thuy_Duong_Nguyen_Phan_supported_catalyst_2016_P42.jpg https://s3.amazonaws.com/prod-ucs-content-store-us-east/content/egi:10V5T1RWZV7/PAGE-IMAGE/image/jpg/1ed8fb30fa61c84b7d9d587f44868c16/Thuy_Duong_Nguyen_Phan_supported_catalyst_2016_P42.jpg https://ucs.elsevier.com/asset/09c0f1fb-5c86-47ec-bc71-41944fa37ecf Thuy_Duong_Nguyen_Phan_supported_catalyst_2016_P42 Thuy_Duong_Nguyen_Phan_supported_catalyst_2016_P42.jpg jpg 206239 ALTIMG 1-s2.0-S0926860X15302866-Thuy_Duong_Nguyen_Phan_supported_catalyst_2016_P68.jpg https://s3-eu-west-1.amazonaws.com/prod-ucs-content-store-eu-west/content/egi:10V5T1RWZV7/PAGE-IMAGE/image/jpg/1f5cd75282def8f6f1e7593ec33e893a/Thuy_Duong_Nguyen_Phan_supported_catalyst_2016_P68.jpg https://s3.amazonaws.com/prod-ucs-content-store-us-east/content/egi:10V5T1RWZV7/PAGE-IMAGE/image/jpg/1f5cd75282def8f6f1e7593ec33e893a/Thuy_Duong_Nguyen_Phan_supported_catalyst_2016_P68.jpg https://ucs.elsevier.com/asset/69a87317-8915-4fc9-a32c-1e6271a62b1f Thuy_Duong_Nguyen_Phan_supported_catalyst_2016_P68 Thuy_Duong_Nguyen_Phan_supported_catalyst_2016_P68.jpg jpg 530597 ALTIMG 1-s2.0-S0926860X15302866-am.pdf am am.pdf pdf 7945816 AAM-PDF https://s3-eu-west-1.amazonaws.com/prod-ucs-content-store-eu-west/content/egi:10V5T1RWZV7/MAIN/application/pdf/a44d894b1293f332ab91ed0da02f4b97/am.pdf APCATA 15685 S0926-860X(15)30286-6 10.1016/j.apcata.2015.12.012 Elsevier B.V. Fig. 1 Pt and Au catalysts outperform other metals at lower coverages for the water gas shift reaction when supported on ceria. Reprinted with permission from Bruix et al. [34]. Copyright (2012) American Chemical Society. Fig. 2 Au/ceria is more active for the WGS reaction than the industrial standard, Cu/ZnO. Reproduced from Rodriguez et al. [33]. With permission of Wiley. Fig. 3 STM images showing coverage dependence of Au on TiO2(110): (a) 0.013ML Au; (b) 0.08ML Au and (c) 0.2ML Au. Reprinted with permission from Spiridis et al. [37]. Copyright (2001) Elsevier. Fig. 4 STM images of 0.25ML of (a) Au and (b) Pt supported on TiO2(110), after RT-deposition. Reprinted with permission from Galhenage et al. [38]. Copyright (2013) American Chemical Society. Fig. 5 (a) STM images of reduced-, hydrated- and oxidized-TiO2(100) surface before and after 3% ML Au exposure at RT (bridging oxygen vacancies Obr in square, H adatoms on Obr sites in hexagon and oxygen adatom Oot in Ti troughs in circle). (b) DFT-based adhesion potential energy profiles for Au1 cluster diffusion on stoichiometric-, hydrated-, reduced-, and oxidized-TiO2(110). The minima at which Au1 is trapped at the point defects on r- and o-TiO2(110) are indicated (arrows; vac. means vacancy). Au1 diffuses along the Obr rows on s- and o-TiO2(110), whereas, on h- and r-TiO2(110), Au1 diffuses along the Ti troughs. Reproduced from Matthey et al. [40]. With permission of AAAS. Fig. 6 STM images of CeOx/TiO2(110) under O2 atmosphere (a) at RM and (b) after heating to 600K and subsequent annealing at 900K. (c) STM image of ∼0.15ML of Pt deposited on CeOx/TiO2(110) at 300K; and (d) submonolayer coverages of CeOx on TiO2 enhance the hydrogen production over Pt NPs compared to larger CeOx coverages, no ceria, and the industrial standard of Cu/ZnO. Reproduced from Park et al. [42] and Bruix et al. [34]. With permission of American Chemical Society. Fig. 7 DFT-calculated structures for adsorbed H2O, transition state (TS), and adsorbed HO+H along with the corresponding energy parameters [Eads, ΔE(TS), Ereac] for water dissociation over Pt(111) surface, free Pt79 cluster, Pt8 cluster, Pt8 clusters deposited on CeO2(111) surface, and Pt8 clusters deposited on Ce40O80 NP. Pt, O, Ce and H atoms are in blue, red, cream and white spheres, respectively. Reproduced from Bruix et al. [34]. With permission of American Chemical Society. Fig. 8 STM images show the Au NP size and dispersion on MgO(001) vs. hydroxylated MgO (MgOhydro(l)) at two coverages. 0.04ML of Au on MgO (a) and hydroxylated MgO (b); 0.2ML of Au after RT deposition on MgO (d), hydroxylated MgO (e), 0.2 ML of Au after annealing to 600K to demonstrate thermal stability on MgO (g) and hydroxylated MgO (h); and each respective NP size dispersion is shown at the bottom panels (c, f, i). Reprinted with permission from Brown et al. [50]. Copyright (2011) American Chemical Society. Fig. 9 XPS spectra of (a) Au 4f and (b) O 1s spectral regions for 0.04 ML Au (i) deposited at RT on 13ML MgO(001)/Ag(001) and (ii) after subsequent hydroxylation at 1mbar of D2O. (iii) Spectra obtained after deposition of 0.04ML Au on hydroxylated (1mbar of D2O) 13ML MgO(001)/Ag(001). Reprinted with permission from Brown et al. [50]. Copyright (2011) American Chemical Society. Fig. 10 Adsorption of CO on Au/MgO model catalysts using STM: (a) CO imaged as a depression with a metallic tip; (b) CO imaged as a protrusion with a CO-terminated tip; (c) CO at the only perimeter of the Au island. Reprinted with permission from Lin et al. [51]. Copyright (2010) American Chemical Society. Fig. 11 (a) STM topographic image of a Au NP supported on MgO with CO in the vicinity, imaging as depressions; (b) d 2 I/dV 2 image at a voltage of −55meV shows limited contrast, whereas voltages of (c) −45meV and (d) +45 meV expose adsorbed CO at the perimeter of the Au island. Reprinted with permission from Lin et al. [51]. Copyright (2010) American Chemical Society. Fig. 12 Atomic view of a gold NP supported on ceria reconstruction under a vacuum and CO/air environment, imaged used aberration-corrected ETEM. Reprinted with permission from Yoshida et al. [56]. Copyright (2012) AAAS. Fig. 13 Top panels show a high-angle annual dark-field/scanning transmission electron microscopy (HAADF/STEM) image of Au supported on rutile TiO2, and the corresponding models of Au NPs. The truncated cubo-octahedral Au clusters contain 25, 119, and 331 atoms. Bottom panel reveals the comparison between the experimental H2 production rates as a function of Au NP size with the models considering various active sites, of which the corner atom active site was the best fit. Reproduced from Williams et al. [57]. With permission of American Chemical Society. Fig. 14 Relationship between the activity and diameter of NPs, indicating the active sites are perimeter sites at the interface of CeO2 support and NP. The similarity in slope between the model corner sites and the experimental data shows that the corner atoms are the most active site. Reprinted with permission from Cargnello et al. [59]. Copyright (2013) AAAS. Fig. 15 (a, b) HAADF/STEM images showing single Pt atoms well dispersed on Fe2O3 support; and (c) proposed reaction pathways for CO oxidation on Pt1/Fe2O3 catalyst. Reproduced from Qiao et al. [74]. With permission of Nature Publishing Group. Fig. 16 (a) Synthesis procedure of DP method to load Au NPs onto the oxide support; (b) TEM images showing the distribution of ultrafine, well-dispersed Au NPs supported on TiO2 by DP method with different Au contents. Reproduced from Haruta [64] and Murdoch et al. [123]. With permission of Springer and Nature Publishing Group. Fig. 17 Top panel illustrates the synthesis protocol of Pt/CeO2@SiO2 core@shell nanospheres and Pt/CeO2 hetero-nanocomposites by microemulsion-mediated method. Bottom panels show TEM images and high resolution TEM images of (a, b) Pt/CeO2@SiO2 and (c) Pt/CeO2 hetero-nanocomposites. Reproduced from Zhou et al. [153]. With permission of American Chemical Society. Fig. 18 (a, b) CO conversion at high and low space velocity conditions, respectively; and (c, d) intermediate determination by in situ DRIFTS during WGS over 2.5Au/ceria and 2.5Pt/ceria, respectively. Reproduced from Jacobs et al. [120]. With permission of Elsevier. Fig. 19 WGS activity over PtRu-CeO2 catalyst: (a) TEM image of PTRu-CeO2, (b) CO conversion, and (c) in situ DRIFTS spectra. Reproduced from Xu et al. [109]. With permission of Elsevier. Fig. 20 Inverse “volcano”-type correlation between the temperature of the promoted reduction of surface ceria and the calculated center of the noble metal d-band in CeO2/noble metal/Al2O3 and CeO2/noble metal/SiO2. Reproduced from Acerbi et al. [160]. With permission of Wiley. Fig. 21 Proposed mechanism of methanol steam reforming reaction over Pt/ceria catalyst. Reproduced from Jacobs et al. [171]. With permission of Elsevier. Fig. 22 (a) Ethanol conversion and (b–d) molar selectivity of gas products at different temperatures over Pt/Al2O3 catalyst. Reproduced from Bilal et al. [116]. With permission of Royal Chemistry Society. Fig. 23 Influence of reaction temperature on (a) ethanol conversion and (b, c) product selectivities (H2, CO and CO2) obtained over different noble metals loading on γ-Al2O3 support. Reproduced from Liguras et al. [100]. With permission of Elsevier. Fig. 24 (a–c) In situ DRIFT spectra and (d–f) product distribution of ethanol steam reforming over Pt/Al2O3, Ni/Al2O3 and PtNi/Al2O3 (1% Ethanol/3%H2O in a He flow of 30mL/min, T =673K, P =1atm). Reproduced from Sanchez-Sanchez et al. [106]. With permission of American Chemical Society. Fig. 25 (a) Relative decrease in activity of methanol decomposition with the concentration of Pt0 and PtO states for Pt-M catalysts (M=Au, Ru, Pd, Fe); (b) Illustration of surface segregation phenomena over Pt-M alloys supported ZrO2 where the oxygen affinity of M dominates its distribution onto the support (open and solid circles represent Pt and M atoms, respectively). Reproduced from Croy et al. [183]. With permission of Elsevier. Fig. 26 (a) Reaction pathways for H2 production and (b) lateral products of glycerol steam reforming reaction over Pt based catalysts identified by gas chromatography/mass spectrometry (GC/MS). Reproduced from Pompeo et al. [75]. With permission of Elsevier. Fig. 27 Schematic illustration of photocatalytic water splitting (WS) over TiO2 photocatalyst loaded with Pt NPs. Fig. 28 Proposed mechanisms and electronic transitions to explain the role of Au NPs in the photocatalytic water splitting with TiO2: (A) Au NPs acts as an electron trap that physically separates the excited electron used for proton reduction from the oxidation step that occurs on TiO2 surface; (B) H+ reduction occurs at TiO2 sites but that the resulting hydrogen atoms need to migrate to Au NPs to recombine and produce H2 product. Reprinted with permission from Joo et al. [133]. Copyright (2014) PNAS. Fig. 29 Schematic diagram of plasmon-induced charge separation and associated photochemistry at the metal/semiconductor heterojunction. Here the electron charge separated in the metal is transferred to the semiconductor. Reprinted with permission from Zhang et al. [68]. Copyright (2012) American Chemical Society. Fig. 30 (a, b) Comparison in H2 production over Pt and Au photocatalysts under the irradiation of (a) UV–visible and (b) visible light (λ >420nm); (c) proposed mechanism of plasmonic metal-semiconductor for H2 generation under visible light excitation. Reproduced from Fang et al. [145]. With permission of Elsevier. Fig. 31 (a, b) Structure and (c) CL spectra of Au supported black TiO2 catalyst; (d, e) H2 production rates obtained using the black TiO2 support in photocatalytic methanol steam reforming. Reproduced from Naldoni et al. [134]. With permission of Royal Society of Chemistry. Fig. 32 Schottky barrier formation at the n-type semiconductor/metal interface showing the transfer of Au hot electrons due to SPR excitation or interband transitions. Reproduced from Naldoni et al. [134]. With permission of Royal Society of Chemistry. Fig. 33 (a) STEM image of PtO-clusters on TiO2 nanosheets; (b, c) H2 and O2 evolution from water over PtO/TiO2 and Pt/TiO2 under UV–visible light irradiation (λ >300nm) and dark condition. Reproduced from Li et al. [130]. With permission of Nature Publishing Group. Fig. 34 (a) Illustration of photocatalytic H2 evolution and back-reaction processes on PtO-clusters and metallic Pt NPs co-catalysts; and (b, c) standard Gibbs free energy profile of: (b) H2 evolution reaction in aqueous solution on Pt8O2/TiO2, and (c) H2 reacting with O2 on Pt8O8/TiO2 and Pt12/TiO2 surfaces in gas phase. Reproduced from Li et al. [130]. With permission of Nature Publishing Group. Fig. 35 (a) Pathway of charge carriers in mixed-phase TiO2; and (b) Total and ion-decomposed electronic density of states of anatase and rutile TiO2 calculated using the HSE06 hybrid density functional. Reproduced from Hurum et al. [210] and Scanlon et al. [212]. With permission of American Chemical Society and Nature Publishing Group. Fig. 36 (a) TEM image, (b) H2 evolution of Au/ZnO NPs, and (c) mechanism of H2 generation on the surface of Au/ZnO NPs under visible light exposure. Reproduced from He et al. [216]. With permission of Royal Chemical Society. Fig. 37 (a) Photocatalytic H2 generation activity over WO3/SiO2 composite under full-arc irradiation of Xe lamp; (b) XPS valence band; (c) Mott-Schottky plot and (d) electronic structure of WO3/SiO2 and its photoexcitation mechanism for H2 evolution. Reproduced from Liu et al. [147]. With permission of Elsevier. Au and Pt nanoparticle supported catalysts tailored for H2 production: From models to powder catalysts Thuy-Duong Nguyen-Phan a ⁎ Ashleigh E. Baber b José A. Rodriguez a c Sanjaya D. Senanayake a ⁎ a Chemistry Department, Brookhaven National Laboratory, Upton, NY 11973, United States Chemistry Department Brookhaven National Laboratory Upton NY 11973 United States b Department of Chemistry and Biochemistry, James Madison University, Harrisonburg, VA 22807, United States Department of Chemistry and Biochemistry James Madison University Harrisonburg VA 22807 United States c Department of Chemistry, Stony Brook University, Stony Brook, NY 11794, United States Department of Chemistry Stony Brook University Stony Brook NY 11794 United States ⁎ Corresponding authors. Graphical abstract The use of metal nanoparticles (NPs), including Au and Pt, supported over oxides has been pivotal, and is ever increasing in enabling catalytic reactions which target the production of hydrogen. We review here the most recent works pertaining to the fundamental understanding of the structure, morphology, growth, characterization, and intrinsic phenomenological properties of Au- and Pt-based catalysts that influence the reactivity and selectivity to target hydrogen production. We draw on surface science and theoretical methods of model and powder catalysts using high resolution imaging, spectroscopy, scattering experiments, and theoretical studies. Based on these insights we identify key aspects of studies of supported metal nanoparticle (NP) catalysts for several reactions. The main focus of this review is on the intersection of catalytic chemistry related to the water-gas shift (WGS), oxygenate steam reforming (OSR), and solar-assisted reactions (SAR). Keywords Gold Platinum Supported catalyst Water–gas shift Steam reforming Water splitting 1 Introduction Heterogeneous catalysis makes use of a large range of noble metal-based catalysts that are essential for achieving industrially and commercially relevant applications specific to the ever emergent H2 economy. Whether in the production of H2 from reforming reactions (methane, syn gas, biofuels) or in the consumption of H2 in fuel cells, NH3 synthesis, hydrogenation, or methanation, we find Pt, Au and other noble metals used extensively as the active ingredient. As a result, the role of metals such as Pt and Au has been the intense focus of numerous scientific studies targeting the catalytic conversion of reactants directly to H2. These studies have evolved over time with the generation of many fundamental aspects specific to the structure, chemical nature, morphology, and the chemical behavior of these materials under reaction conditions, which gives rise to the tailoring of key steps in the catalytic process leading to H2. Though some features are ubiquitous to fundamental material properties of Pt or Au, it is now possible to influence or steer many reactions by the use of novel catalysts that can be designed to specifically target the most essential steps leading to conversion. Deactivation of reactions can also be carefully mitigated by ensuring that sufficient concentrations of the active agents are protected from the harsh conditions of a reaction. The water-gas shift reaction (Eq. (1)), oxygenate steam reforming (Eq. (2)), and solar-assisted reactions, including solar water splitting (Eq. (3)) and photocatalytic methanol reforming (Eq. (4)), are well established processes utilizing water in the feed to produce hydrogen-rich gas with high efficiency. Although Au- and Pt- supported oxide catalysts dramatically enhance the (photo) catalytic activity, the nature of active phase, in terms of size, geometry, electronic structure, in these metal/oxide systems, as well as the influence of metal↔support interactions are still ambiguous. In this review, we highlight the latest discoveries pertaining to these metals and discuss the importance of morphology, metal/support interactions, and redox states that distinguish Pt and Au from each other, and other metals, in the manifest of unique selectivity and activity. (1) WGS: CO+H2O→H2 +CO2 (2) OSR : C x H y O z + ( 2 x − z ) H 2 O → xCO 2 + ( y 2 + 2 x − z ) H 2 (3) SAR : H 2 O → hv H 2 + 1 2 O 2 (4) CH 3 OH + H 2 O → hv 3 H 2 + CO 2 This review is divided in two sections. The first part describes studies using model systems. Surface science and density functional theory (DFT) models can provide invaluable insights into the intrinsic phenomena that prevail during a heterogeneous catalytic process. In the fundamental investigation of Pt and Au materials numerous studies of well-defined metal surfaces (i.e. Pt(111), Au(111)) and supported metal NPs (i.e. Pt/CeOx, Pt/TiO2, Pt/CeOx/TiO2, Au/CeOx, Au/TiO2, Au/MgO) have provided ideal benchmarks for looking at individual steps that pertain to the conversion of oxygenated molecules to H2. Challenges exist in the transfer of knowledge obtained at model conditions to those applied to more complex powder catalysts under reaction conditions. However, an ever increasing range of methods and tools from in situ microscopy, spectroscopy and scattering, as well as time-dependent DFT methods can help bridge what has come to be known as the ‘materials and pressure’ gaps. The results of these studies can explain data for complex systems and help to predict and enable new directions in the design and understanding of high-surface-area powder catalysts. The second part of the review is focused on the rational design of real powder catalysts, paying particular attention to their synthesis, characterization and catalytic performance. 2 Surface science and DFT models Here we begin reviewing recent surface science investigations of Pt and Au model catalysts, paying specific attention to the growth, morphology, and oxidation state of the materials, before taking a closer look at the active site identification at the atomic level and with individual probe molecules. The use of models to interpret and unravel catalytic processes is an important strategy in reducing the complexity of high surface area powder catalysts and the multitude of cascading transformations that occur at steady state [1,2]. The ability to reduce the structural model down to the atomic level detail and mechanisms down to individual chemical activation steps is insightful and also critical. The use of single crystal and thin film substrates has been particularly versatile as benchmarks in these studies that can extend to mono-metals [3–6], bi and tri-metallic [7–9], oxides [10–12], mixed oxides [13–15], inverse catalysts [16–19], carbides [20–25], sulphides [21,26–28] and nitride [20,22,29,30] based catalysts. One of the most extensively studied systems is the ceria-based model, a catalytic powerhouse material, where the bulk, nano, and supported nature of a very commonly used support can readily be investigated. To mimic ceria substrates, ceria films are grown on metals in UHV. The deposition of cerium in an oxygen background leads to the formation of atomically flat ceria thin films on bulk single crystals. In one common procedure, ceria (6 monolayers (ML)) was vapor-deposited onto well-cleaned Ru(0001) substrates at elevated temperatures (790K) in an oxygen environment (1×10−7 mbar O2), and subsequently annealed to 980K in 4×10−7 mbar O2 [31,32]. Au or other metal NPs were then deposited at 300K in ultra-high vacuum (UHV) onto the ceria films via electron beam assisted evaporation from a W crucible or wire. On ceria, Au NPs were preferentially located in order of the following positions: terrace point defects, step edges, and finally, at high Au coverages, on flat terraces [32]. Before testing for WGS activity, the ceria-supported nanoparticles were annealed to the WGS reaction temperature after the deposition of Au at room temperature (RT) [33]. CeO2(111) [34] and Au(111) [33] are inactive toward the water–gas shift reaction while the Pt(111) surface exhibits a greater activity than the model system standard (Cu(111)), but is rapidly poisoned by carbon deposits [35]. Maximum WGS activity (20torr CO, 10torr H2O, 625K) was achieved on Pt/CeO2(111) with 0.2ML Pt coverage on ceria, which corresponds to Pt NPs <1.7nm in diameter, and <0.4nm in height [34]. The smaller Pt NPs that resulted from low coverages of Pt exhibited a lower density of states near the Fermi level for the Pt 5d states, as compared to the larger Pt coverages, which had a lower WGS activity and a density of states that appeared more metallic-like (shown in Fig. 1 ) [34]. This result indicates a decrease in activity as the Pt NPs become more bulk-like or metallic. Pt/CeO2(111) outperformed other metal/ceria WGS catalysts, including Au, Cu, and Ni [34]. While the Pt/CeO2 system was more active for the WGS than Au/CeO2, the Au system showed greater activity than Pt when the metal coverage was >0.5ML, and importantly, Au/CeO2 model catalysts are more active for hydrogen production via the WGS reaction than the industrial standard, Cu/ZnO, as depicted in Fig. 2 [33]. As shown in Fig. 1, the greatest WGS activity for Au/CeO2(111) occurred with 0.4–0.5ML of Au coverage [34]. The dispersion of Pt NPs is enhanced when ceria is partially reduced (CeO1.88(111)), due to the increase in the number of terrace oxygen defects which can act as preferential nucleation sites for NP growth [36]. In comparison with another reducible oxide TiO2, Au behaves uniquely upon interaction with the support. The growth and diffusion of Au NPs supported titania have been well-investigated in recent studies. The deposition of Au on TiO2(110) at room temperature resulted in Au island nucleation at step edges, and with increasing coverages of Au, 3D island growth occurred as indicated in scanning tunneling microscopy (STM) images in Fig. 3 [37]. Metallic NPs deposited on clean TiO2(110) at room temperature under UHV conditions are highly dispersed across terraces and step edges until exposed to an oxygen background (5×10−7 mbar) at 1000K. Upon oxidation at elevated temperatures, the particles migrated, and the sintering of the particles and the degree of diffusion were related to the binding energy of the metal particle to the substrate using DFT calculations [38]. As seen in Fig. 4 , Au atoms have the greatest mobility on TiO2(110) due to the largest average height (12.7±4.3Å) and the lowest density (3.02×1012 clusters/cm2) of their clusters compared to Pt. The DFT calculations of metal atoms on TiO2 surface demonstrate that the metal atoms bind preferentially at the oxygen vacancies where the binding of Pt is much stronger than Au, so that the growth of surface defects is crucial for nucleation of Au and Pt clusters [38,39]. Also, the calculated oxygen binding energies on (111) surfaces of Au and Pt imply the metal–titania binding energies are correctly predicted by the admetal–oxygen bond strengths. The oxidation state of the TiO2(110) substrate plays a large role in the dispersion of NPs deposited at room temperature. Upon cleaning via Ar+ sputtering and UHV-annealing cycles, the TiO2(110) surface contains oxygen vacancies and is in a reduced state. After oxidation (exposing the surface to O2), the surface contains little to no oxygen vacancies, whereas after hydration (exposure to water), the surface is hydroxylated. The degree of oxidation of the TiO2(110) substrate affects the diffusion rates for the metal particles at elevated temperatures [38]. For both Pt and Au, the particles diffused less on the oxidized TiO2 as compared to reduced TiO2, due to a larger barrier to diffusion, resulting in smaller cluster size, and a greater cluster density [38]. Interestingly, the hydroxylated surface exhibited a decreased barrier to Au diffusion on the hydrated surface as compared to the others (Fig. 5 ), as indicated by the presence of fairly large Au clusters predominately on the high-coordination step edges, rather than small, well-dispersed clusters across terraces of reduced and oxidized TiO2. Complementary DFT calculations predict the adhesion strength (and therefore the diffusion energy) of the NPs is related to the bond strength between the metal and the substrate [38,40]. These results identify that the metals interact uniquely with redox states of the support and are strong indicators of metal-support interaction. In light of the experimental and computational findings, Au NPs dispersed on reducible oxides are better catalysts than those supported on nonreducible ones since reducible oxides are more capable of forming O-rich Au-support interface where the adhesion of Au oxide (or cationic Au) and support is much stronger. Mixed oxides are a growing area of investigation with the ability to obtain new chemistries where mono-oxides were not able to achieve. To prepare mixed oxide substrates for instance in the case of CeOx/TiO2, cerium is deposited onto TiO2(110) in an O2 environment (1×10−7 torr) at 600K [41–43]. TiO2 imposes on CeO2 NPs nontypical coordination modes with a subsequent alteration in relative stability of Ce3+/Ce4+ states, resulting in remarkable catalytic activity enhancement [41,42]. Pt NPs 1–2 atoms high formed after the evaporation of metallic Pt on to the substrate at 300K [34]. The STM image in Fig. 6 shows features related to the individual counterparts of the catalyst. The position (a) represents ceria “wires” on the TiO2(110) substrate, meanwhile region (b) shows the position of Pt NPs on top of ceria and region (c) indicates Pt NPs residing directly on the TiO2(110); all of which were characterized by their respective topographic heights in the STM image. This provides a versatile and complex Pt/CeOx/TiO2 catalyst that shows good activity for the production of H2. The activity for the WGS reaction (20 torr CO and 10 torr H2O) was greatly enhanced for Pt NPs supported on titania when ceria was added to the TiO2(110) surface, as shown in the right panel of Fig. 6. The greatest activities were achieved on the catalysts containing miniscule coverage of Pt (<0.3ML) and 11% CeOx [34]. The Pt↔CeOx interactions where small Pt clusters electronically perturbed by interactions with ceria are much stronger, enabling the admetal to adsorb water and fully dissociate. The DFT calculations show that the corner atoms of Pt8 in contact with CeO2(111) surface or with Ce40O80 NP are strongly bound to oxygen sites of support with a net Pt→ceria charge transfer, therefore enhancing the ability to cleave OH bonds and eventually yielding H2 and CO2 via the WGS reaction (Fig. 7 ) [34,42,44,45]. This is not the case of the Au admetal (0.15 ML) where the catalytic activity of Au/CeOx/TiO2(110) was somewhat lower than Pt/CeOx/TiO2(110) [41,42]. The theoretical calculations indicate a very weak interaction of Au (with larger average height and diameter) with TiO2(110) and a negligible charge transfer while stronger electronic perturbation is observed for CeO2(111) support [40–42,46–48]. In addition, comparisons in the behavior of metal NPs with different supports can be studied. Among popular oxide materials, MgO is critical in the investigation of the effect of hydroxylation on the surface upon NP stabilization. Freund and coworkers investigated the structure and stability of Au NPs on MgO(001), paying particular attention to the effect of the presence of hydroxyl groups [49,50]. MgO(001) thin films (10 ML) were grown on Ag(001) substrates by depositing Mg in an O2 background (1×10−6 mbar) at 573K. In order to produce the hydroxylated MgO surface, water was dosed directly onto the surface at RT at a local pressure of 1×10−3 mbar, resulting in a hydroxyl coverage of 0.4ML. The hydroxyl groups enhances the stability of the Au NPs anchored onto the surface, due to the formation of strong Au-O interfacial bonds, thereby oxidizing Au NPs to small AuxOy aggregates and hampering diffusion and sintering of Au at elevated temperatures. Post-annealed Au NPs on MgO, on the other hand, exhibited larger particles with a smaller density, as shown in Fig. 8 . Beyond simply the morphology, the chemical nature of the as-prepared metal NPs is important. Fig. 9 shows the corresponding X-ray photoelectron spectroscopy (XPS) spectra in which both MgO and the hydroxylated surface are covered by 0.4 ML Au. The Au NPs on MgO remain in their metallic state (Au 4f 7/2 peak is located at 84.0eV) in Fig. 9 a(i), whereas the Au NPs are oxidized on the hydroxylated surface (the Au peak is shifted to higher binding energies) in Figs. 9 a(ii) and 9a(iii). Fig. 9 b shows the O 1s region of the XPS spectra, indicating the presence of OH groups on the surface after the exposure to water at RT. The alteration in chemical nature of Au NPs can be attributed to chemisorption of hydroxyl groups stemming from direct interaction between water and small Au NPs and/or from spillover of hydroxyl groups from MgO support [50]. Furthermore, the reaction with common reactants can be titrated over these systems. For example, the adsorption of CO on MgO-supported Au clusters was imaged using STM and infrared-reflection-absorption spectroscopy (IRAS). The CO molecules preferentially adsorbed to the perimeter of the Au island, rather than on top of the particle, as shown in Fig. 10 [51]. Preferential binding sites of model catalysts can point to the active site of the material, and here CO is used as a probe molecule, as its adsorption and interaction with the surface is critical for the WGS reaction. Two-dimensional second derivative (d2 I/dV 2) maps correspond to the vibrational energy recorded at every point in a normal (topographic) STM image. A signal of ±45meV was monitored in order to investigate CO, as shown in Fig. 11 . Second-derivative images recorded at a voltage outside of the ±45meV optimal voltage for CO result in low-contrast images like that seen in Fig. 11 b, while the images recorded at ±45meV show high contrast at the perimeter of the Au island, where the CO is adsorbed. Herein, the preferential CO binding to Au island perimeter can be assigned to either the low-coordinated boundary atoms or edge atoms as opposed to those enclosed in the Au island plane, or due to the localized electrons transferred from MgO/Ag at island perimeter [51,52]. The experimental observation is consistent with DFT calculations [53,54] where CO absorbs with lower binding energy (0.72eV) to 3-fold coordinated edge atoms of negatively charged Au12 island on MgO/Ag(001) and the increase in CO-Au repulsion due to the charge donation from CO 5σ into Au. Understanding the vital roles of structural, geometric and electronic properties of active phase, oxide support, metal-oxide interface and their interaction on the atomic and molecular levels, associated with theoretical calculations is fundamental to our better understanding of heterogeneous surface reactions on supported catalyst. As a consequence, the nexus between surface science models and real-world supported catalysts is successfully established, hence not only providing new insights into the fascinating complex world of heterogeneous catalysis but also emerging mechanistic aspects to rationally design realistic, efficient supported catalysts. 3 Powder nanocatalysts It is worth noting that atomic views of model and real catalysts can shed more light on critical active sites for catalysis, yet these measurements are not trivial to make. The intersection of surface science with catalysis aims to close the pressure and materials gap by understanding chemistry on an atomic scale of real catalysts under reaction conditions. Numerous reports have highlighted the advances made in imaging real catalysts under high pressure conditions by means of using aberration-corrected environmental transmission electron microscopy (ETEM) [55–59]. Perimeter sites, low-coordination corner sites, cationic gold and bilayers of gold have been proposed as the active species in literature concerning gold catalysis [55,57,60–62]. Yoshida et al. [56] observed a reconstruction of the exposed Au{100} facets on CeO2 in the presence of 1 volume% CO in air environment, as seen in Fig. 12 . In the reconstructed surface, the Au atoms on the topmost surface layer form an undulating hexagonal lattice while those on the second topmost surface layer form a normal square lattice with slight distortion, allowing CO molecules to adsorb at higher surface coverages. Such in situ reconstruction accompanied with ab initio calculations is an important finding because it was though that a flat facet of a Au NP cannot accommodate CO molecules in high density [63,64] due to the intrinsic weak adsorption of CO molecules and the repulsive intermolecular interactions. A combination of transmission electron microscopy (TEM) and physical modeling was also used to gain insight on the active site on an atomic scale of supported metallic NPs, citing that the catalytic activity is dependent on metal corner atoms in a NP, as highlighted in Fig. 13 [57–59]. The most essential factor influencing the adsorption and reaction properties of Au atoms is their coordination with other atoms [65]. The number of corner atoms does not increase as the particle size increases above 1nm, indicating that the turnover rate is dependent on the number of particles rather than the size of the particles. Note that the number of particles will be maximized with smaller particles for any given gold loading. Continuing studies with Pt supported on ceria also shows the strong relationship between corner atom sites and the catalytic activity. Careful steps were taken by the Cargnello et al. [59] to monitor structural changes to the size and shape (of which there were none) of the NPs due to the deposition and calcination processes via TEM. Post-mortem TEM images revealed that minimal sintering or coalescence of the particles occurred, indicated by the lack of change in size, cubo-octahedron shape, or distribution of the particles. Ceria-supported catalysts show a relationship between NP diameter and activity, revealing the importance of the atoms, perimeter or corner atoms, at the metal-support interface, yet their model supports the theory that the corner atoms are the most catalytically active site due to their low coordination number compared to the other perimeter atoms [57–59], as shown in Fig. 14 . Such a conclusion is quite consistent with the observation from surface science models aforementioned. 3.1 Synthesis approaches of NPs supported catalysts Employing a suitable synthesis method to produce ultrafine, small Au and Pt NPs highly dispersed on the support is of the utmost importance for the high reactivity, selectivity and stability of supported catalysts. Isolated single atoms, subnano-sized metal clusters and nanosized particles have been elucidated to significantly improve the catalytic performance in different aspects: (i) strong metal-support interaction, (ii) intimate interfacial contact, (iii) quantum size effect, (iv) increased surface-to-volume ratio, (v) low-coordination environment of metal centers, and (vi) band alignment [66–70]. Almost no activity was obtained over bulk Au catalysts whereas uniformly dispersed, ultrafine Au NPs smaller than 10nm became highly active for H2 and CO oxidation as well as other reactions as proven by surface science studies. It is attributed to the electronic states of the outer surface gold atoms composed about 40% of total atom content for hemispherical Au NPs of diameter 4nm as well as the strong-metal-support interaction between Au and transition metal oxides [71,72]. Isolated Au single atoms supported on Fe2O3 are much more resistant to sintering than Au nanostructures due to the formation of strong covalent metal–support interaction, exhibiting ultra-stability and remarkable catalytic performance [72,73]. Similarly, size effect is crucial over Pt supported catalysts where isolated single Pt atoms anchored to the surfaces of Fe2O3 nanocrystallites exhibited excellent stability and high activity for CO oxidation arising from the partially vacant 5d orbitals of the positively charged, high-valent Pt atoms that help to reduce both the CO adsorption energy and the activation barriers for CO oxidation (shown in Fig. 15 ) [74,75]. Otherwise, the sintering or agglomeration of Pt and Au NPs to form larger particles via either Ostwald ripening or coalescence dramatically suppresses the overall activity or selectivity of the catalysts over a period time under catalytic reaction conditions and even during catalyst synthesis. It is noteworthy that the choice of a proper support plays a critical role in stabilizing the dispersed noble metal NPs and thus preventing such phenomena by means of the metal–support interaction and interfacial surface. Reducible oxides such as TiO2, CeO2 and Fe2O3 are considered active supports whereas non-reducible Al2O3, MgO and SiO2 are declared to be inert or passive [71,72,75–81]. Among these supports, titania and ceria are most widely used in the catalytic production of H2, particularly in the water-gas shift reaction at low temperature, oxygenate steam reforming and solar-assisted production, because of their oxygen storage capacity. The support might affect the shape of the noble metal NPs, resulting in faceting and possibly inducing defect sites [77,78,82]. The “junction effect” arising from the strong contact between support and noble metal NPs efficiently enhanced the catalytic activity since the electronic interaction between them reduced the enthalpy for oxygen vacancy formation, thus forming the catalytic active sites [83]. The metallic Au clusters in close contact with surface oxygen-vacancy defects of CeO2 and the fast Ce4+ ↔Ce3+ transfer are crucial in activity and stability improvement [78]. Similarly, the oxygen-vacancy F-center defects in or near the MgO surface plays an essential role in the activation of Au clusters by serving to anchor Au clusters and to partially transfer the electronic charge from the substrate F-center to Au cluster, therefore promoting the catalytic activity [77,79]. By contrast, the charge transfer also occurs across the interface from Au to various oxide supports, i.e. CeO2, TiO2, ZrO2, ZnO, Al2O3, to facilitate the catalysis reactions [78,80,81]. In addition, the oxidation state of active Au and Pt plays a crucial role in heterogeneous catalytic reactions. Numerous studies have pointed out the importance of metallic gold and platinum during WGS reaction [78,84–86]. Negatively charged gold sites (Auδ−) exposed at the surface of small clusters (<1nm) were observed on the freshly reduced sample and under working conditions whereas they became neutral after WGS reaction [78]. On the contrary, the activity for the low temperature water-gas shift reaction was found to arise from the oxidized metal embedded in the support as opposed to the metallic NPs supported on the ceria [60]. Gold cations are keys for an active catalyst where the oxidized gold species, Aun δ+, showed much lower activity for low temperature CO oxidation than that of well dispersed Au0 NPs, while oxidized gold clusters were needed to activate the WGS reaction due to the formation of active oxidized [Aun-O-Ce] and [Aun-O-Fe] species on the surface and subsurface layers of the catalysts [81]. The isolated surface-type Au3+ ions are the most active sites not only for the WGS reaction but also for the hydrogenation of 1,3-butadiene and ethylene irrespective of supports due to their ability to activate carbon–carbon double and triple bonds [87–89]. The catalytic activity was also reported to be enhanced for alkali-promoted oxidized Pt atoms complexed with OH groups on alumina, silica and titania supports [90,91]. The atomically dispersed Pt-alkali-Ox(OH)y species are explored to be the active sites, opening a new low-temperature reaction pathway. Similarly, stabilization of atomic, oxidized Au-O(OH)x by alkali ions also catalyzes the low-temperature WGS reaction, and the activity is unaffected by the nature (i.e. the reducibility) of the support [92,93]. It is obvious that the nature of Pt and Au NPs, including the composition (mono- or bimetallic), particle size, geometry, dispersity and electronic environment, on the support plays an essential role in the structure-activity correlation, product selectivity and catalyst stability arising from the metal-oxide interaction as well as the alteration in electronic configuration. Reducible and non-reducible oxides, such as SiO2, TiO2, CeO2, Fe2O3, ZrO2, Al2O3, MgO, and mixed metal oxides have been widely used as supports due to theirs high specific surface areas, high thermal and mechanical stability, and earth-abundance [72,75,77,78,80,81,94]. The preparation method has been reported to significantly affect the performance of Pt- and Au-based catalysts [95–97]. Accordingly, the gold-based catalysts are only active when in a highly dispersed state whereas the pretreatment of Pt-based catalysts is an important factor. The loading of Pt, Au, and Pt-Au alloys on various supports have been conducted by several methods including impregnation, deposition-precipitation, wet chemical reduction, photoreduction and polyol-assisted process. Chloroauric acid, gold chloride, gold acetylacetonate, nitrato (triphenylphosphine) gold (I), hexachloroplatinic acid, tetrammonium nitrate platinate, and platinum acetylacetonate are commonly used as metal precursors. The impregnation techniques, including wetness impregnation [75,98–112] and incipient wetness impregnation (or dry impregnation) followed by drying are the most commonly used methods due to their simplicity and low waste streams [60,113–116]. The precious metal ions can be reduced to their metallic state by post-treatment in different atmospheres. However, large particle sizes (8–20nm) result from sintering due to the weak interaction between the NPs and the support. Otherwise, deposition-precipitation (DP) is considered as one of the most successful techniques [64,65,78,96] to deposit highly dispersed, catalytically active noble metal NPs (NPs), particularly Au, on metal oxides with an isoelectric point (IEP) above 5 (IEPTiO2 =6–6.5, IEPCeO2 =6.7–8.6, IEPγ-Al2O3 =7–8, IEPMgO =9.8–12.7, IEPα-Fe2O3 =8.4–8.5). The precipitation method follows the principles of nucleation and growth using aqueous sodium hydroxide, ammonia, urea, and sodium carbonate as precipitating agents (shown in Fig. 16 ) [56,57,64,65,73,80,81,96,97,117–126]. The gradual decomposition of urea or ammonia during the process results in a slower, more homogeneous precipitation, therefore minimizing the aggregation of precipitates and the loss of noble metal. The gold uptake during precipitation strongly depends on pH, temperature and specific surface area of the support. The deposition at a pH above the IEP of the support involves an increasingly negative charge of the support, inducing an electrostatic repulsion of gold-containing anions, thereby limiting the deposition of Au on the solid [97]. Another efficient approach is wet-chemical reduction by adding a reducing agent, i.e. sodium borohydride, hydrazine, ascorbic acid, oleyamine or citrate, to the metal precursor solution [127–138]. The adsorption of noble metal ions onto the support surface followed by the reduction induces highly dispersed metal NPs (Au, Pt, Au-Pt alloy) in intimate contact with the support [130,131,134,135]. Naldoni et al. [134] loaded Au and Pt NPs (3-4nm) well dispersed on core (highly defective)-shell (stoichiometric) black TiO2 (80% anatase −20% rutile) nanocrystals by using aqueous sodium borohydride solution as reducing agent. Similarly, uniform dispersion of fine Au, Pt and Au-Pt alloyed NPs (2–3nm) with 1wt% of total metal content onto active TiO2 was prepared by Wang et al. [135]. The formation of homogeneous alloyed-structure in the Au-Pt solid solution was obtained in which Pt metal, with a low heat of surface energy compared to Au, has a tendency to accumulate on the surface, inducing the Au@Pt core@shell structure. Several studies have reported the combinations of impregnation and reduction method, deposition-precipitation and reduction methods as well as reduction and impregnation methods to further control the size and shape of noble metal NPs [77,81,121,130,136–138]. For example, Naldoni et al. [131] combined the wetness impregnation and reduction by NaBH4 to homogeneously grow spherical Au (3.6nm) and Pt (2.9nm) NPs over the whole TiO2 surface with a narrow size distribution. On the other hand, the polyol process using ethylene glycol solution of the metal precursor has been employed extensively to produce metal NPs supported on different oxides [139–141]. Such glycolate-metal complexes are decomposed by reflux or microwave radiation to yield in situ generated reducing species to produce colloidal metals which are subsequently captured by a support material suspended in the solution. Photoreduction or in situ photodeposition is also an appropriate and convenient process for the deposition of Au and Pt onto the surface of semiconductor support, particularly TiO2, through the generation of electron/hole pairs by UV irradiation that simultaneously oxidizes the sacrificial solvent or organic compound in the solution (i.e. alcohol, oxalic acid, glacial acetic acid) and reduces noble metal NPs [142–149]. Apart from the methods aforementioned, the deposition of Au and Pt has been conducted by other techniques such as flame spray pyrolysis, galvanic replacement, sonochemical method, microemulsion technique, direct ionic exchange and solution combustion method (Fig. 17 ) [65,137,150–153]. 3.2 Structure-reactivity correlation and mechanistic insights 3.2.1 Water–gas shift reaction The catalytic WGS reaction is one of the most important industrial processes to produce clean hydrogen. Among several classes of catalysts, noble-metal-support oxide catalysts, particularly Pt and Au based ones, are commonly studied. Burch [85] overviewed the advantages and drawbacks of gold catalysts by comparing that of platinum catalysts for the WGS reaction. Gold catalysts can offer some advantages in the low-temperature range (180–250°C) where the platinum analogs are insufficiently active; and by contrast, the properly activated platinum catalysts exhibits much higher activity than that of gold at higher temperatures. Jacobs et al. [113,120] have reported that it required approximately 20-times more of a 5% Au/CeO2 catalyst to produce the same lightoff curve as found for a 5% Pt/CeO2. Au reduction in H2 was significantly hindered at low loadings where metal-support interaction between Au and ceria were the greatest. Similar behavior was observed in the study from Si et al. [124] where the strong interaction between Au and ceria-titania support efficiently prevented the massive agglomeration of Au NPs from sintering, resulting in only ∼15% drop of conversion after 20h under WGS conditions. Temperature-programmed reduction (TPR), in situ X-ray absorption near edge structure (XANES) and in situ diffuse reflectance infrared Fourier transform spectroscopy (DRIFTS) studies showed that the extent of ceria reduction at lower temperatures over Pt catalyst was higher and deeper than in the case of Au, facilitating the formation of germinal OH groups (serving as the active sites) on the surface of ceria and therefore, yielding higher formate concentrations upon the addition of CO (as shown in Fig. 18 ). They concluded that one should not select a Pt catalyst with a low Pt loading and test it in a low temperature shift range where the catalyst is not in an active state [113,120]. It is noteworthy that the enhanced activity of CeO2 supported noble metal catalysts is frequently ascribed to the ability of ceria to undergo fast storage/release of oxygen cycles via a reversible conversion between Ce4+ and Ce3+ oxidation species [154]. These redox cycles imply a mechanism of oxygen vacancy formation that is indirectly correlated with the catalyst ability to activate oxygen species through electronic transfer and thus, to the catalytic activity in oxidation reactions. Apart from stabilizing small Au NPs, the presence of Ce3+ facilitated the dissociation of water during the WGS reaction that happens at the surface of oxide support or at the interface of oxide-gold [78,124,155]. It has also been reported that Pt NPs exhibit identical function, assisting the dehydrogenation of the formate intermediate or dissociating H2O to promote the decomposition of these mobile species [109,120]. The activity comparison between monometallic Pt and Pt-alloy structures has also been investigated extensively [109,156–158]. The intimate contact between Pt and second metal drastically promotes the catalytic reactions. In comparison with Pt-CeO2 and Ru-CeO2, the Pt-Ru alloyed catalyst with a mean particle size of 2nm induced a small reduction in the intrinsic catalytic activity; meanwhile the alloyed structure was beneficial to the overall selectivity toward WGS reaction due to the prevention of CO bond cleavage and subsequent hydrogenation of C to methane (Fig. 19 ) [109]. Such alloying substantially inhibited the formation of gaseous methane and metal-bound formate species on the surface without diminishing the WGS activity or impacting the apparent activation energy. Castaño et al. [111] have evaluated the supports (γ-Al2O3, CeO2/γ-Al2O3, Ce0.8Fe0.2/γ-Al2O3), the nature of the metal (Pt, Au), the dispersion, and the stream composition to find they each directly influence the WGS performance due to their modification of the materials' electronic properties. Stronger metal-support contact between NPs (Au or Pt) and CeO2 and Ce-Fe solid solution has been elucidated, in comparison with weaker interaction between γ-Al2O3 support and NPs, via: (i) the rearrangement of band gap structure due to the formation of partially reduced ceria (Ce3+ ions) and oxygen vacancies, and the presence of metal induced gap states; (ii) the broadening and shifting of the F2g Raman signal to lower wavenumbers; and (iii) local morphology of Au and Pt NPs on Ce0.8Fe0.2/γ-Al2O3 where Pt atoms sit on oxygen vacancies and the partially filled f states of Ce3+ act as donors and 5d states of Pt as acceptor levels [111,154,155,158,159]. They also stated that at low temperature, gold catalysts are always more active than the corresponding platinum catalysts, but the reverse is true for temperatures above 200°C [111]. It is very important that the solid solution support not only facilitates the electron transfer but also increases the number of oxygen vacancies, hence promoting the redox WGS mechanism [154]. Furthermore, Acerbi et al. [160] rationalized the electronic interactions at the interface occurring in noble metal/ceria/alumina systems (Pt, Pd, Rh, Ru, Ag, Au) using Nørskov’s d-band center theory [161]. As shown in Fig. 20 , an inverse “volcano” type correlation between the d-band centers of noble metals and the enhancement in ceria reducibility was found. They suggested that the d-band center is a more effective electronic descriptor of the noble metal than the work function since it takes into account how the H2 chemisorption is affected by the metal structure. Although the promoted reduction of surface ceria reduction is limited by H2 dissociation on Au NPs and Pt to ceria reduction is limited by its affinity to O2 as a non-dissociative reducing agent was used (i.e. CO in the WGS stream), both Au and Pt NPs could allow a promoted ceria reduction at lower temperatures. The differences in activity between Au and Pt catalysts may be explained by different reaction pathways where the adsorption/activation of CO, the creation of oxygen vacancies at the metal-support interface and the water dissociation are crucial [109,124,126,162–164]. As mentioned above, numerous reports have found that nonmetallic or oxidized Pt and Au species in nanosized support can play the role of active sites for WGS activity whereas Pt or Au NPs are spectator species [60,81,90–93,109,114]. Ionic states of Au (+1, +3) and Pt (+2, +4) co-exist in clusters of atoms in which Aun-O-Ce, Ptn-O-Ce structures and surface Pt-O phases strongly bound to ceria support are stable after 15h of WGS condition [60]. As a result, Au increases the concentration of reactive surface oxygen in ceria which occurs through partial lattice filling of vacant Ce sites with Ptδ+ or Auδ+, creating additional oxygen vacancies on the surface of Ce4+-O2 fluorite-like structure. Thus, the chemistry takes place on these atomically dispersed oxidized species and involves the neighboring OH groups. Otherwise, in situ Fourier transform infrared spectroscopy (FTIR) study elucidated that the WGS reaction sites appear to be the sites at the boundary of very small Au clusters (<1nm) highly dispersed at the surface of defective ceria (CeO2−x) [78]. The active sites could be located only on the supported Au NPs or on the perimeter of gold-oxide interface [82,84,86]. CO is mainly adsorbed on Auδ− sites initially, and these Au clusters become Au0 and partially Auδ+ in the presence of water as a consequence of water dissociation on ceria defects [78,86]. However, in situ time-resolved X-ray absorption spectroscopy (TR-XAS) and in situ time-resolved X-ray diffraction (TR-XRD) indicate that cationic Auδ+ species cannot be the key sites responsible for WGS activity in spite of Au0 and Au3+ states in as-prepared catalyst [84]. The full reduction of gold oxide at the Au-CeO2 interface and partial reduction of ceria support occur simultaneously under reaction condition, leading to the disappearance of Auδ+ and the generation of Ce3+ and oxygen vacancies. 3.2.2 Oxygenate steam reforming reaction The use of oxygenated hydrocarbons or biofuels (i.e. ethanol, methanol, biomethanol, n-butanol, glycerol) for hydrogen production by steam reforming has been a great advantage over other processes due to the neutral of CO2—a greenhouse gas that causes the global warming. Steam reforming (SR) of oxygenated hydrocarbons is thermodynamically favorable at lower temperatures than non-oxygenated hydrocarbons because it is more exothermic [165–169]. In order to maximize the H2 production, the formation of byproducts and carbon accumulation must be minimized during the SR reaction. Several materials comprised of non-noble metal and noble metal supported catalysts have been developed for such a reaction and it is noteworthy that the nature of both the metal and the support is a key factor to enhance the catalytic performance of SR catalysts [98–102,104–106,108,115,116,128,165–173]. Noble metals, particularly Pt, as active phases deposited on metal oxide or mixed metal oxide supports have been widely studied [98–100,115,116,170–173]. Duan and Senkan [102] prepared libraries of catalytic materials comprised γ-Al2O3, SiO2, TiO2, CeO2 and Y-ZrO2 pellets impregnated with 42 elements from the periodic table at 4 different loadings (0.5, 1, 2.5 and 5 wt%) for ethanol SR reaction screening. They found that Pt/TiO2 and Pt/CeO2 were the most significant new leads, exhibiting the highest ethanol conversions (+90%) and hydrogen selectivities (∼30%) at 300°C among all 840 single component catalytic materials explored. In spite of much lower surface area, the competitive performance of Pt/CeO2 compared to Pt/TiO2 could be attributed to higher oxygen storage capacity of CeO2, preserving the high dispersion of Pt during the repeated oxidation-reduction cycles. Additionally, the carbon deposition was also prevented after 5–6h duration, stabilizing their catalytic activities. However, CH4 (1.5–2%) and CO (0.5%) were also formed as byproducts over these supported Pt catalysts. Obviously, Pt promotes the reduction of ceria support, facilitating the generation of Type II bridging OH groups on ceria surface [171,173–177]. It can be ascribed to either vacancy formation, followed by dissociation of water, or by direct dissociation and spillover of hydrogen from Pt to the ceria surface. As illustrated in Fig. 21 , Jacobs and Davis [171] proposed that SR of methanol undergoes four steps: (i) dissociative adsorption of methanol to produce Type II methoxy species and adsorbed hydrogen; (ii) oxidative decomposition of methoxy groups by adsorbed water to liberate two hydrogen molecules and generate surface formate; (iii) water-assisted decomposition of formate to hydrogen and unidentate carbonate; and (iv) decomposition of carbonate to carbon dioxide. The SR of ethanol proceeds via the dehydrogenation and dehydration reactions in which the former are promoted at the metal particles and metal-support interface [105,169]. Otherwise, it has been elucidated that Pt supported Al2O3 is much more effective at converting secondary liquid products, either by decomposition or reaction, to simple gas phase components (Fig. 22 ) [116,172]. Accordingly, carbon monoxide is reacting with steam via the WGS reaction faster than it does with hydrogen via methanation, therefore reducing the carbon monoxide level but maintaining high hydrogen selectivity. The presence of coke in form of whisker carbon/carbon nanotube was observed but did not significantly deactivate under reaction conditions at 873K possibly due to a higher H:C ratio of the deposit on Pt/Al2O3 and/or the ability of ethanol to efficiently clean amorphous carbon from the surface. Comparing Pt with other noble metals, the H2 and CO selectivities for SR of ethanol followed the order: Rh>>Pt>Ru≈Pd as loaded on Al2O3 (seen in Fig. 23 ) [100]. The order of Pt>Pd>Rh>Ru was achieved from Erdőhelyi and Basagiannis’s reports [104,105] where dispersed metallic Pt exhibited much higher activity and selectivity toward H2 production and long term stability at low temperatures. On the contrary, considering both the influence of metal nature (Rh, Pt, Ni, Cu, Zn, Fe) and the role of support (γ-Al2O3, 12%CeO2-Al2O3, CeO2, Ce0.63Zr0.37O2), Auprêtre et al. [98] observed lower activities and selectivities towards CO2 using Pt/Al2O3 compared to Rh and Ni catalysts, suggesting that the most selective catalyst in SR of ethanol should contain no WGS promoters. The support may promote the migration of OH groups toward the metal particles, catalyze the reforming reaction or stabilize the metals at high temperatures under steam [98,105]. It can be concluded that the different nature of both metal loading and oxide carrier can be drastically contributed to such differences in the catalytic performance. The addition of small amounts of Pt to Ni, Cu, or Co catalysts significantly lowers the formation of coke deposits by dehydrogenation of CxHy intermediates [178] and thus, increases the stability for the bimetallic catalysts [106,108,179–181]. Profeti et al. [115] investigated the catalytic activity of Ni/CeO2-Al2O3 catalysts promoted with noble metals (Pt, Ir, Pd and Ru) at low contents (0.3wt%) for the SR of ethanol (at 450 and 600°C) and glycerol (at 700°C). The bimetallic systems containing Pt and noble metals efficiently decreased the reduction temperature of nickel surface species interacting with the support, owing to a hydrogen spillover effect. These noble metals also stabilized the Ni sites in the reduced state along with the reforming reaction, increasing the conversion of oxygenated hydrocarbons and H2 yield, and suppressing the coke formation. Furthermore, the interaction between Ni and noble metal NPs may alter the electronic structure of the catalyst, arising from a shift in the d-band center that causes a change of the adsorption strength of reaction intermediates, thus facilitating the scission of CC bond. Similarly, the presence of Pt caused an increase in the exposition of Ni metal atoms on Al2O3 support (shown in Fig. 24 ) [106]. Electronic interaction between Pt and Ni active phases in the bimetallic formulation induced higher activity in the CC bond rupture of ethanol or C2 intermediate molecules, revealing better stability and superior catalytic performance in ethanol steam reforming than Ni and Pt monometallic counterparts. Ethylene hydrogenation over Pt competed with ethylene dehydrogenation over Ni particles, minimizing the coke formation; meanwhile, the higher activity of Ni in the CC bond breakage released hydrogen that allows Pt to hydrogenate the ethylene formed on Al2O3. Similarly, Ávila-Neto et al. [108] indicated that the fraction of metallic Co under reaction conditions was dependent on either the nature of the support (Al2O3, La2O3/Al2O3, CeO2/Al2O3 and CeO2/MgAl2O4) or the existence of Pt promoter. H2 was activated on metallic Pt sites in lieu of oxygen vacancies in Co oxides, generating atomic hydrogen which migrates to the surface of CoO and Co3O4 by hydrogen spillover mechanism, and thus facilitating the reduction of Con+ to Co0. Such controlling of Co2+/Co0 ratio was helpful to equilibrium the steps of ethanol activation and carbon oxidation, stabilizing the catalysts. Reversely, the steam reforming activity of Pt is strongly affected by the addition of secondary metals such as Au, Pd, Ru, In, Fe, Rh [182–185]. Pt-Fe/ZrO2 outperformed in methanol steam reforming reaction compared to other bi- and mono-metallic counterparts owing the surface segregation of Fe due to its high affinity of Fe for oxygen during calcination, leading to Pt-rich core containing ∼60% Pt0 content apart from surface Pt-oxide states like PtO and PtO2 (Fig. 25 ) [183]. However, Pt-Ru supported by γ-Al2O3 has been elucidated to be a highly efficient ethanol steam reforming catalyst [184]. Pt-Rh/CeO2 is also an active catalyst for ethanol steam reforming because very small Rh clusters efficiently dissociated the terminal CH bond and CC bond, thus increasing H2 selectivity [182]. On the other hand, the fact that Au supported oxide catalysts have been elucidated to be active for either WGS or CO oxidation at low temperature has motivated the reactivity for ethanol reaction [186–188]. By means of XPS, FT-IR, temperature programmed desorption (TPD), Idriss and coworkers [186,187] have proven that the addition of Au onto CeO2 efficiently suppressed the exclusive formation of surface acetaldehyde and acetate species as well as partially reduced CeO2 surface even at ambient conditions, hindering the capacity of support to further oxidize ethanol in stoichiometric conditions. Moreover, Au NPs stabilized ethoxide species and favored the formation of CO2 and H2. However, the DFT-computed higher dissociation barrier of the transition state for CC, CO, CH and OH bond cleavages for Au(111) (group 11) compared to Pt(111) (group 10) and other noble metals (i.e. Rh, Ir) suggests poor catalytic properties for ethanol steam reforming [189–191]. Also, much lower density of state (DOS) distribution near the Fermi level of Au(111) surface revealed relatively less active catalyst for redox reactions [190]. Considering both the computed results, (111) surface of Au is expected to be less efficient data explains in SR of ethanol, explaining why Au metal or Au supported catalyst has infrequently been reported in the hydrogen production from ethanol steam reforming [192,193]. However, Au catalysts work well in methanol steam reforming [171,194]. Taking into account the influence of the support, Pompeo et al. [75] found that the support with neutral character, like SiO2, favored the dehydrogenation and subsequent cleavage of CC bonds towards glycerol steam reforming performance, exhibiting excellent activity levels to gaseous products, high selectivity to H2, and good stability, whereas the acidity-rich supports, such as γ-Al2O3, ZrO2 and Ce4Zr1/α-Al2O3, promoted the lateral reactions of dehydration, dehydrogenation, hydrogenolysis and condensation, thus facilitating the catalyst deactivation due to coke formation and demonstrating low conversion to gaseous products (Fig. 26 ). However, Gazsi et al. [195] observed the highest activity toward methanol steam reforming over the catalyst containing Au dispersed on CeO2 support (H2 yield of ∼97%), followed by MgO and TiO2 support, and the lowest for SiO2; meanwhile using an Al2O3 support favored the dehydration reaction that yielded other products. It can be ascribed to the interface between Au NPs and partially reduced CeOx where the electronic interaction occurred between reactive Au and n-type CeO2 semiconductors. Similarly, loading platinum@zinc oxide core-shell NPs onto SiO2–Al2O3 support led to comparable methanol steam reforming activity and selectivity for CO2 as a conventional Pt/ZnO catalyst and much higher than those obtained over conventional Pt/Al2O3 and Pd-based catalysts, owing to a Pt-Zn alloy formation upon reduction due to the intimate contact between these materials [128]. 3.2.3 Solar-assisted H2 production Apart from the WGS and SR processes, H2 can be photocatalytically produced from water, wastewater or chemical compounds; and TiO2 is the most well-known photocatalyst for water splitting due to its nontoxicity, cheapness, stability, and earth-abundance. However, its wide band gap allowing the photoactivity only under UV region and the fast recombination of photoinduced electron/hole pairs significantly limits the performance of bare TiO2. The deposition of Pt and Au NPs with larger work functions (Φ) (lower Fermi level) onto the surface of TiO2 and other semiconductor oxides facilitates the efficient separation of charge carriers due to the trapping of photoinduced electrons to be involved in the reduction of hydrogen ions, the formation of a space charge layer at the metal-semiconductor interface [196], improving the charge separation and thus the photocatalytic hydrogen evolution (shown in Fig. 27 ). The greater the difference between the work function of the noble metal (ΦPt =−5.93eV, ΦAu =−5.31eV versus vacuum) [197] and of TiO2 support (ΦTiO2 =4.2eV) [198], the higher the Schottky barrier with consequent increased efficiency of photoinduced electron transfer and trapping by the metal NPs, leading to higher H2 evolution rate [137,199]. Alternatively, Joo et al. [133] proposed a new thinking about the reduction of protons on the semiconductor surface, not Au NPs. The reduced atomic hydrogen subsequently migrates to Au and recombines to yield H2 as seen in Fig. 28 . Pt has been widely employed as a co-catalyst for H2 production under UV light excitation due to its highest work function and low overpotential toward the reduction of protons to generate H2 [95,137,198,199]. However, plasmonic Au NPs not only harvest visible light and convert the photons to free energetic electrons but also promote the solar-to-hydrogen conversion by increasing the separation of electron-hole pair driven by the plasmonic resonant energy transfer (PRET) which would occur between the electromagnetic, generated by surface plasmonic resonance (SPR), and the resonant electronic levels of semiconductors [68,131–134,200]. A diagram in Fig. 29 illustrates the model of SPR-induced charge carrier formation and subsequent charge transfer mechanism [68]. Increasing Au loading on anatase TiO2 to optimal values results in the increased rate of H2 production most likely due to a geometric rather than an electronic effect, particularly, a reduction in the available metal-support sites where both metal and support are needed for the photocatalytic reaction [121,123,145]. However, the lower activity and faster deactivation in H2 production was observed on Pt-based catalysts compared to the equivalent gold catalyst due to a more rapid poisoning of the active sites which possibly stems from oxygen species strongly adsorbed on the surface of metallic NPs [107]. While Pt introduced ohmic contact, Au NPs underwent charging, storage and transport of interfacial electrons at the Au-oxide interface, inducing Fermi level equilibrium [107]. Additionally, the H2 evolution rates from aqueous ascorbic acid solution over Au/TiO2 under the light irradiation >420nm was three-times greater than Pt/TiO2 due to SPR-enhanced charge separation as shown in Fig. 30 [145]. It is worth mentioning that the size of Au contributes differently to SPR-mediated enhancement via the different absorption and scattering efficiency. The greater SPR absorption over a wider wavelength range is pronounced for larger Au particle size, resulting in larger number of absorbed photons and higher activity [201]. However, too large NP size (>40–50nm) induces much stronger radiative scattering of resonant photons than the absorption and smaller one (<20–30nm) can create the energetic charge carriers, leading to surface plasmon decay [202,203]. The electron ‘spillout’ effect can occur for Au clusters smaller than 5nm due to a reduction of average electron density [201,204]. Otherwise, larger particle size reduces the available noble metal-oxide support sites for the necessary reaction [123]. Naldoni et al. [134] studied the energy transfer mechanisms over Au and Pt loaded on core (highly defective)-shell (stoichiometric) black TiO2 nanocrystals by means of cathodoluminescence (CL) spectroscopy. Pt NPs induced a dramatic quenching of CL signals compared to black TiO2 due to the better separation of electron–hole pairs generated by the electron beam whereas in the case of Au/TiO2, the strong emission enhancement is associated with an increased density of charge carriers that recombine through radiative pathways (shown in Fig. 31 ). The deposition of Au NPs (1wt%) resulted in higher H2 production rates in the photocatalytic methanol steam reforming compared to Pt NPs due to the synergistic effect between the intragap electronic states related to abundant oxygen vacancies of black TiO2 and the interband transition of Au, and the SPR transitions under visible light as indicated in Fig. 32 . The superiority of Au-based catalysts for photocatalytic H2 production compared to Pt ones is consistent with the literature [103,123]. However, such observations are in apparent contrast with previous studies where platinum is reported as a better co-catalyst than gold [131,137]. Accordingly, the better performance of Pt/TiO2 was ascribed to the greater ability of Pt, with respect to Au, in acting as an effective electron sink, therefore limiting the electron-hole recombination to a larger extent. The more efficient the separation between photoinduced charge carriers, the more efficient are not only the conduction band electrons involved in the reduction path to produce H2, but also the valence band holes initiated complete methanol oxidation to CO2 [137]. The in situ electron spin resonance (ESR) spectroscopy demonstrated the easier electron transfer from Ti3+ to Pt, where the H+ reduction to H2 occurs, than the others under UV–vis irradiation due to less amount of Ti3+ active sites (following the order TiO2 >Au/TiO2 >>Pt/TiO2) [131]. Nevertheless, excessive Pt loading (beyond the optimal content, 0.5∼1wt%) results in the larger aggregated particles and lower dispersity on the oxide support surface. It not only shields the active surface for light activation but also becomes the recombination centers that trap photogenerated electrons, hence diminishing the charge carrier separation and decreasing the photoactivity. Recently, Wang et al. [135] have reported that the homogeneous Au@Pt core@shell structure showed a flattening of the Au SPR band in the visible light region due to the strong metal–metal interactions at the alloy interface. Au-Pt/TiO2 catalyst produced 3550μmole of H2 within 3h irradiation that is almost 2.4-, 1.7- and 9.8-fold increase compared to Au/TiO2, Pt/TiO2 and bare TiO2, respectively. Such enhancement in photocatalytic activity is attributed to stronger interaction between Au-Pt and TiO2 support, higher electron population on the alloyed structure and greatly improved photoinduced charge separation in the bimetallic system. However, Li et al. [130] have found that sub-nanometer, ultrafine particle size and high dispersion of PtO-clusters containing 6 - 10 Pt atoms on anatase TiO2{001} nanosheets demonstrated remarkable hydrogen oxidation reaction suppression ability whereas its hydrogen evolution capacity is still comparable to that of metallic Pt cocatalyst (depicted in Fig. 33 ). DFT calculations on Pt8O8/TiO2(001) and Pt12/TiO2(001) indicate that the activation of O2/H2 to generate surface H* and O* is much more difficult on Pt-oxide compared with metallic Pt cluster on TiO2(001) surface, thus indicating a higher suppression ability relative to Pt-clusters in dissociating the evolved H2 into H+ and e− reversibly or activating O2 molecules (Fig. 34 ). Parayil et al. [205] believed that Pt0 more efficiently accepts photogenerated electrons than oxidized platinum counterparts (PtO2). However, if PtO2 and TiO2 are in close enough contact to create the heterojunction, PtO2, a p-type semiconductor, works as electron trap to facilitate the electron propagation from conduction band of TiO2 to PtO2, prolonging the lifetime of charge carriers, minimizing the electron-hole recombination and hence improving the H2 evolution activity. More importantly, such findings possibly pave the way for developing other highly-efficient heterogeneous Pt-based catalysts for clean energy and environmental applications. The existence of Au NPs on {001} facets of anatase TiO2 nanosheets exhibited 64-fold improved efficiency of solar-to-hydrogen conversion arising from the SPR-mediated electron transfer path of energetic electron generated under visible light illumination (λ >420nm) coupled with the electromagnetic near-field effect [132]. A new Fermi level equilibrium is created due to the shift of Fermi level of Au and TiO2 to more negative and more positive potentials, respectively, thereby allowing the transfer of high-energy plasmon electrons of Au NPs across an energy barrier to TiO2 conduction band [206]. The in situ ESR spectra revealed that the plasmonic electrons are shallowed-trapped on surface Ti4+, which are not paired with single electron-trapped oxygen vacancies; therefore the electrons are more readily released [206]. The nature of the support has been of vital importance in the photocatalytic H2 production activity. In this review, because of the complexity of abundant H2-evolved photocatalyst systems including transition metal oxides, mixed metal oxides, perovskites, spinels, ilmenites, nitrides, oxynitrides, sulfides, oxysulfides, only simple oxides and mixed metal oxides are mentioned. Murdoch et al. [123] found that Au NPs on TiO2 anatase are about two orders of magnitude more active than those of a similar size on rutile support due to faster rate of electron-hole recombination for rutile, thus shorter lifetimes of photoinduced charge carriers [207–209]. Numerous studies have reported that the mixture of different TiO2 polymorphs, i.e. anatase and rutile, anatase and brookite, brookite and rutile, titanate and anatase, gains advantage to the photocatalytic activity over its individual counterparts due to the formation of a large homo-junction area between two phases or the intimate contact in the interface of two phases (space charge region), efficiently promoting the charge separation [210–214]. Such a synergistic effect arising from the band alignment enhances the interfacial electron transfer rate in two aspects: (i) a passive electron sink and (ii) antenna effect. For instance, in case of the most famous commercial TiO2 (Degussa P25) photocatalyst, the charge produced on rutile are stabilized via the electron transfer to lower energy anatase lattice trapping sites and very importantly, rutile acts as an antenna to extend the photoresponse into visible wavelength (Fig. 35 a) [210]. It almost coincides with the mechanism elucidated by Scanlon et al. [212] via the combination of theory and experiment as illustrated in Fig. 35 b,c. Kandiel et al. [143] demonstrated that a mixture of brookite nanorods and anatase particles in the presence of Pt NPs exhibited much greater H2 generation rate than single anatase due to the facilitation of interfacial electron transfer across the brookite-anatase junction. Apart from TiO2, different transitional metal oxides and mixed oxides have been employed as the supports for photocatalytic H2 production, such as Cu2O, CeO2, ZnO, Fe2O3, WO3/SiO2, CeO2/TiO2, TiO2/ZrO2 [10,112,142,147,149,215,216]. Recently, He et al. [216] synthesized Au/ZnO NPs template by yellow fluorescent glutathione-Au nanoclusters/zeolitic imidazolate framework-8 NPs, as seen in Fig. 36 . The great improvement in H2 production could be ascribed to the role of Au NPs as a sink for the photoinduced electron storage and the Fermi level shift towards more negative potentials apart from the SPR effect. CeOx-TiO2 mixed oxides with different ceria contents and geometries are unravelled to be a potential candidate for water splitting due to the hierarchical heterogeneity at the interface as well as the strong interaction between CeOx and TiO2 via the electronic perturbation [110,112]. The observation on powder catalysts is well consistent with our previous surface science studies [41–43]. Moreover, the presence of Pt NPs imposed a significant reduction of CeO2 dispersed on TiO2, creating and stabilizing Ce3+ centers on the outermost surface or near the oxide–oxide interface that not only dissociated water but also acted as the hole scavengers, drastically enhanced the formation of electron/hole pairs and efficiently suppressing the surface charge recombination. Liu et al. [147] unexpectedly observed high H2 generation onto Pt/WO3/SiO2 materials due to the quantum confinement effect of highly dispersed WO3 NPs (2–4nm) and the formation of the interface W-O-Si like species (Fig. 37 ). Note that Pt/WO3 has been considered as an efficient visible-light-driven O2 evolution catalyst. SiO2 is a high cation electronegativity support and in such composite materials, silica could be regarded as a positive center for WO3 NPs, causing the distortion of adjacent WO3 structure and altering the electronic band structure via the upshift of conduction band minimum for W-O-Si species, thus meeting the thermodynamic potentials for proton production. Metallic Pt dispersed on highly ordered mesoporous TiO2-ZrO2 possessing large surface areas and pore volume, narrow pore size distributions and abundant surface Lewis acid sites, exhibited good H2 production performance due to the cooperative effect of large surface-to-volume ratio, porosity and crystallinity that induced the easier separation of electrons and holes [142]. 4 Conclusions and future outlook In this review, we have identified and highlighted important studies that provide valuable insights into the role of supported metal catalysts of Pt and Au on the catalytic production of H2 from numerous chemical conversion processes. There are many challenges to exploit the structural, electronic and chemical properties of nanostructured Pt and Au towards optimum conversion of reactants such as H2O (WGS, SAR) and oxygenates (SR) to H2. The key factors to bringing together convergent principles that are common to catalyzing these reactions is a fundamental understanding of the nature of the active state of the catalyst that facilitates H2 production and an appreciation for the mitigation of deactivation. It is clear from numerous studies that this is a product of a combination of effects with a collective contribution of size, geometric, electronic and metal-support interactions for both Pt and Au catalysts. In general, Pt is more reactive than Au, facilitating easier chemical activation processes; however, Pt is more prone to poisoning while Au remains inert due to various deactivation processes. In both materials, the role of the active state is specific to the nature of the reactants and reaction conditions, where the metallic state is more reactive than the oxide of both metals. Both Au and Pt do however exhibit structural instability through sintering under harsh reaction conditions but can be anchored onto the supports. Furthermore, the effect of the supports on these metals can be very specific to the reaction; however, it is clear that the chemistry of both metals can be tuned through the metal-support interactions. With this in mind the ability to extended H2 production further, we propose several key strategies: (1) The atomic control of catalyst geometry to optimize the presence and protection of active sites. (2) The identification of electronic and support effects so as to selectively tune the reactivity. (3) The determination of the reaction mechanism to steer appropriate pathways that can deliver products. (4) The understanding of the deactivation processes that can prevent production of H2 and formulate catalyst structure to prevent it. Acknowledgements The work carried out at Brookhaven National Laboratory was supported by the U.S. Department of Energy, Office of Science, Office of Basic Energy Sciences, and Catalysis Science Program under contract No. DE-SC0012704. References [1] G. Ertl H. Knözinger F. Schüth J. Weitkamp Handbook of Heterogeneous Catalysis 2nd edition 2008 Wiley-VCH Weinheim [2] U.S. Ozkan Design of Heterogeneous Catalysis 2009 Wiley-VCH Weinheim [3] D. Stacchiola S. Azad L. Burkholder W.T. Tysoe J. Phys. Chem. B 105 2001 11233 11239 [4] S.D. Senanayake D. Stacchiola P. Liu C.B. Mullins J. Hrbek J.A. Rodriguez J. Phys. Chem. C 113 2009 19536 19544 [5] C.-H. Lin C.-L. Chen J.-H. Wang J. Phys. Chem. C 115 2011 18582 18588 [6] Q. Luo G. Feng M. Beller H. Jiao J. Phys. Chem. C 116 2012 4149 4156 [7] S.A. Tenney W. He C.C. Roberts J.S. Ratliff S.I. Shah G.S. Shafai V. Turkowski T.S. Rahman D.A. Chen J. Phys. Chem. C 115 2011 11112 11123 [8] R.P. Galhenage S.C. Ammal H. Yan A.S. Duke S.A. Tenney A. Heyden D.A. Chen J. Phys. Chem. C 116 2012 24616 24629 [9] S.A. Tenney S.I. Shah H. Yan B.A. Cagg M.S. Levine T.S. Rahman D.A. Chen J. Phys. Chem. C 117 2013 26998 27006 [10] S.D. Senanayake D.R. Mullins J. Phys. Chem. C 112 2008 9744 9752 [11] J.M. Vohs Chem. Rev. 113 2013 4136 4163 [12] K. Müller D. Lu S.D. Senanayake D.E. Starr J. Phys. Chem. C 118 2014 1576 1586 [13] T. Staudt Y. Lykhach N. Tsud T. Skála K.C. Prince V. Matolín J. Libuda Electronic J. Phys. Chem. C 115 2011 8716 8724 [14] F. Yang S. Kundu A.B. Vidal J. Graciani P.J. Ramírez S.D. Senanayake D. Stacchiola J. Evans P. Liu J.F. Sanz J.A. Rodriguez Angew. Chem. Int. Ed. 50 2011 10198 10202 [15] D.J. Stacchiola S.D. Senanayake P. Liu J.A. Rodriguez Chem. Rev. 113 2013 4373 4390 [16] J.A. Rodriguez J. Graciani J. Evans J.B. Park F. Yang D. Stacchiola S.D. Senanayake S. Ma M. Pérez P. Liu J.F. Sanz J. Hrbek Angew. Chem. Int. Ed. 121 2009 8191 8194 [17] S.D. Senanayake D. Stacchiola J. Evans M. Estrella L. Barrio M. Pérez J. Hrbek J.A. Rodrigueza J. Catal. 271 2010 392 400 [18] S.D. Senanayake D. Stacchiola J.A. Rodriguez Acc. Chem. Res. 46 2013 1702 1711 [19] S.D. Senanayake K. Mudiyanselage A. Bruix S. Agnoli J. Hrbek D. Stacchiola J.A. Rodriguez J. Phys. Chem. C 118 2014 25057 25064 [20] S.T. Oyama The Chemistry of Transition Metal Carbides and Nitrides 1st ed. 1996 Blackie Academic & Professional, Chapman & Hall UK [21] J.A. Rodriguez J. Dvorak T. Jirsak Surf. Sci. 457 2000 L413 L420 [22] P. Liu J.A. Rodriguez Catal. Lett. 91 2003 247 252 [23] J.M. Horn Z. Song D.V. Potapenko J. Hrbek M.G. White J. Phys. Chem. B 109 2005 44 47 [24] J.A. Rodriguez P. Liu Y. Takahashi K. Nakamura F. Viñes F. Illas J. Am. Chem. Soc. 131 2009 8595 8602 [25] S. Posada-Pérez F. Viñes J.A. Rodriguez F. Illas Top. Catal. 58 2015 159 173 [26] J.G. Kushmerick S.A. Kandel P. Han J.A. Johnson P.S. Weiss J. Phys. Chem. B 104 2000 2980 2988 [27] S.A. Kandel P.S. Weiss J. Phys. Chem. B 105 2001 8102 8106 [28] J.A. Rodriguez J. Dvorak T. Jirsak G. Liu J. Hrbek Y. Aray C. Gonzalez J. Am. Chem. Soc. 125 2003 276 285 [29] J. Graciani J.F. Sanz T. Asaki K. Nakamura J.A. Rodriguez J. Chem. Phys. 126 2007 244713 [30] J. Graciani A. Nambu J. Evans J.A. Rodriguez J.F. Sanz J. Am. Chem. Soc. 130 2008 12056 12063 [31] D.R. Mullins P.V. Radulovic S.H. Overbury Surf. Sci. 429 1999 186 198 [32] J.-L. Lu H.-J. Gao S. Shaikhutdinov H.-J. Freund Catal. Lett. 114 2007 8 16 [33] J.A. Rodriguez P. Liu J. Hrbek J. Evans M. Pérez Angew. Chem. Int. Ed. 46 2007 1329 1332 [34] A. Bruix J.A. Rodriguez P.J. Ramírez S.D. Senanayake J. Evans J.B. Park D. Stacchiola P. Liu J. Hrbek F. Illas J. Am. Chem. Soc. 134 2012 8968 8974 [35] D.W. Flaherty W.-Y. Yu Z.D. Pozun G. Henkelman C.B. Mullins J. Catal. 282 2011 278 288 [36] Y. Zhou J.M. Perket J. Zhou J. Phys. Chem. C 114 2010 11853 11860 [37] N. Spiridis J. Haber J. Korecki Vacuum 63 2001 99 105 [38] R.P. Galhenage H. Yan S.A. Tenney N. Park G. Henkelman P. Albrecht D.R. Mullins D.A. Chen J. Phys. Chem. C 117 2013 7191 7201 [39] H. Iddir S. Öğüt N.D. Browning M.M. Disko Phys. Rev. B 72 2005 081407 [40] D. Matthey J.G. Wang S. Wendt J. Matthiesen R. Schaub E. Lægsgaard B. Hammer F. Besenbacher Science 315 2007 1692 1696 [41] J.B. Park J. Graciani J. Evans D. Stacchiola S. Ma P. Liu A. Nambu J.F. Sanz J. Hrbek J.A. Rodriguez Proc. Natl. Acad. Sci. U. S. A. 106 2009 4975 4980 [42] J.B. Park J. Graciani J. Evans D. Stacchiola S.D. Senanayake L. Barrio P. Liu J.F. Sanz J. Hrbek J.A. Rodriguez J. Am. Chem. Soc. 132 2010 356 363 [43] D.J. Stacchiola S.D. Senanayake P. Liu J.A. Rodriguez Chem. Rev. 113 2013 4373 4390 [44] G.B. Fisher B.A. Sexton Phys. Rev. Lett. 44 1980 683 686 [45] K. Bedürftig S. Völkening Y. Wang J. Wintterlin K. Jacobi G. Ertl J. Chem. Phys. 111 1999 11147 11154 [46] H. Iddir S. Öğüt N.D. Browning M.M. Disko Phys. Rev. B 73 2006 039902 [47] J.A. Rodríguez J. Evans J. Graciani J.-B. Park P. Liu J. Hrbek J.F. Sanz J. Phys. Chem. C 113 2009 7364 7370 [48] M.M. Branda N.J. Castellani R. Grau-Crespo N.H. de Leeuw N.C. Hernandez J.F. Sanz K.M. Neyman F. Illas J. Chem. Phys. 131 2009 094702 [49] M.A. Brown E. Carrasco M. Sterrer H.-J. Freund J. Am. Chem. Soc. 132 2010 4064 4065 [50] M.A. Brown Y. Fujimori F. Ringleb X. Shao F. Stavale N. Nilius M. Sterrer H.-J. Freund J. Am. Chem. Soc. 133 2011 10668 10676 [51] X. Lin B. Yang H.-M. Benia P. Myrach M. Yulikov A. Aumer M.A. Brown M. Sterrer O. Bondarchuk E. Kieseritzky J. Rocker T. Risse H.-J. Gao N. Nilius H.-J. Freund J. Am. Chem. Soc. 132 2010 7745 7749 [52] X. Lin N. Nilius H.-J. Freund M. Walter P. Frondelius K. Honkala H. Hakkinen Phys. Rev. Lett. 102 2009 206801 [53] L. Giordano U. Martinez S. Sicolo G. Pacchioni J. Chem. Phys. 127 2007 144713 [54] S. Sicolo L. Giordano G. Pacchioni J. Phys. Chem. C 113 2009 10256 10263 [55] A.A. Herzing C.J. Kiely A.F. Carley P. Landon G.J. Hutchings Science 321 2008 1331 1335 [56] H. Yoshida Y. Kuwauchi J.R. Jinschek K. Sun S. Tanaka M. Kohyama S. Shimada M. Haruta S. Takeda Science 335 2012 317 319 [57] W.D. Williams M. Shekhar W.-S. Lee V. Kispersky W.N. Delgass F.H. Ribeiro S.M. Kim E.A. Stach J.T. Miller L.F. Allard J. Am. Chem. Soc. 132 2010 14018 14020 [58] M. Shekhar J. Wang W.-S. Lee W.D. Williams S.M. Kim E.A. Stach J.T. Miller W.N. Delgass F.H. Ribeiro J. Am. Chem. Soc. 134 2012 4700 4708 [59] M. Cargnello V.V.T. Doan-Nguyen T.R. Gordon R.E. Diaz E.A. Stach R.J. Gorte P. Fornasiero C.B. Murray Science 341 2013 771 773 [60] Q. Fu H. Saltsburg M. Flytzani-Stephanopoulos Science 301 2003 935 938 [61] T.V.W. Janssens B.S. Clausen B. Hvolbaek H. Falsig C.H. Christensen T. Bligaard J.K. Norskov Top. Catal. 44 2007 15 26 [62] T. Fujitani I. Nakamura T. Akita M. Okumura M. Haruta Angew. Chem. Int. Ed. 48 2009 9515 9518 [63] F. Boccuzzi A. Chiorino M. Manzoli P. Lu T. Akita S. Ichikawa M. Haruta J. Catal. 202 2001 256 267 [64] M. Haruta Cattech 6 2002 102 115 [65] L. Sinatra A.P. Lagrow W. Peng A.R. Kirmani A. Amassian H. Idriss O.M. Bakr J. Catal. 322 2015 109 117 [66] J.M. Thomas Z. Saghi P.L. Gai Top. Catal. 54 2011 588 594 [67] M. Flytzani-Stephanopoulos B.C. Gates Annu. Rev. Chem. Biomol. Eng. 3 2012 545 574 [68] Z. Zhang J.T. Yates Jr. Chem. Rev. 112 2012 5520 5551 [69] X.-F. Yang A. Wang B. Qiao J. Li J. Liu T. Zhang Acc. Chem. Res. 46 2013 1740 1748 [70] F. Yang D. Deng X. Pan Q. Fu X. Bao Natl. Sci. Rev. 1 2015 183 201 [71] A. Tompos M. Hegedűs J.L. Margitfalvi E.G. Szabó L. Végvári Appl. Catal. A Gen. 334 2008 348 356 [72] M. Haruta N. Yamada T. Kobayashi S. Iijima J. Catal. 115 1989 301 309 [73] B. Qiao J.-X. Liang A. Wang C.-Q. Xu J. Li T. Zhang J.J. Liu Nano Res. 8 2015 2913 2924 [74] B. Qiao A. Wang X. Yang L.F. Allard Z. Jiang Y. Cui J. Liu J. Li T. Zhang Nat. Chem. 3 2011 634 641 [75] F. Pompeo G. Santori N.N. Nichio Int. J. Hydrogen Energy 35 2010 8912 8920 [76] R. Su R. Tiruvalam Q. He N. Dimitratos L. Kesavan C. Hammond J.A. Lopez-Sanchez R. Bechstein C.J. Kiely G.J. Hutchings F. Besenbacher ACS Nano 6 2012 6284 6292 [77] A. Sanchez S. Abbet U. Heiz W.-D. Schneider H. Haekkinen R.N. Barnett U. Landman J. Phys. Chem. A 103 1999 9573 9578 [78] T. Tabakova F. Boccuzzi M. Manzoli D. Andreeva Appl. Catal. A Gen. 252 2003 385 397 [79] Z. Yan S. Chinta A.A. Mohamed J.P. Fackler Jr. D.W. Goodman J. Am. Chem. Soc. 127 2005 1604 1605 [80] Y. Hartadi D. Widmann R.J. Behm ChemSusChem 8 2015 456 465 [81] W. Deng C. Carpenter N. Yi M. Flytzani-Stephanopoulos Top. Catal. 44 2007 199 208 [82] J.A. Rodriguez G. Liu T. Jirsak J. Hrbek Z. Chang J. Dvorak A. Maiti J. Am. Chem. Soc. 124 2002 5242 5250 [83] J.S. Frost Nature 334 1988 577 580 [84] X. Wang J.A. Rodriguez J.C. Hanson M. Pérez J. Evans J. Chem. Phys. 123 2005 221101 [85] R. Burch Phys. Chem. Chem. Phys. 47 2006 5483 5500 [86] J.A. Rodriguez Catal. Today 160 2011 3 10 [87] J. Guzman B.C. Gates Angew. Chem. Int. Ed. 42 2003 690 693 [88] J. Guzman B.C. Gates J. Catal. 226 2004 111 119 [89] X. Zhang H. Shi B.-Q. Xu Angew. Chem. Int. Ed. 44 2005 7132 7135 [90] Y. Zhai D. Pierre R. Si W. Deng P. Ferrin A.U. Nilekar G. Peng J.A. Herron D.C. Bell H. Saltsburg M. Mavrikakis M. Flytzani-Stephanopoulos Science 329 2010 1633 1636 [91] C. Zhang F. Liu Y. Zhai H. Ariga N. Yi Y. Liu K. Asakura M. Flytzani-Stephanopoulos H. He Angew. Chem. Int. Ed. 51 2012 9628 9632 [92] M. Yang L.F. Allard M. Flytzani-Stephanopoulos J. Am. Chem. Soc. 135 2013 3768 3771 [93] M. Yang S. Li Y. Wang J.A. Herron Y. Xu L.F. Allard S. Lee J. Huang M. Mavrikakis M. Flytzani-Stephanopoulos Science 346 2014 1498 1501 [94] N. Lopez T.V.W. Janssens B.S. Clausen Y. Xu M. Mavrikakis T. Bligaard J.K. Norskov J. Catal. 223 2004 232 235 [95] G.R. Bamwenda S. Tsubota T. Nakamura M. Haruta J. Photochem. Photobiol. A Chem. 89 1995 177 189 [96] M. Haruta Catal. Today 36 1997 153 166 [97] R. Zanella C. Louis Catal. Today 107–108 2005 768 777 [98] F. Auprêtre C. Descorme D. Duprez Catal. Commun. 3 2002 263 267 [99] J.P. Breen R. Burch H.M. Coleman Appl. Catal. B Environ. 39 2002 65 74 [100] D.K. Liguras D.I. Kondarides X.E. Verykios Appl. Catal. B Environ. 43 2003 345 354 [101] M. Nurunnabi B. Li K. Kunimori K. Suzuki K.-I. Fujimoto K. Tomishige Appl. Catal. A Gen. 292 2005 272 280 [102] S. Duan S. Senkan Ind. Eng. Chem. Res. 44 2005 6381 6386 [103] Z. Yang C.-H. Chang H. Idriss Appl. Catal. B Environ. 67 2006 217 222 [104] A. Erdőhelyi J. Raskó T. Kecskés M. Tóth M. Dömök K. Baán Catal. Today 116 2006 367 376 [105] A.C. Basagiannis P. Panagiotopoulou X.E. Verykios Top. Catal. 51 2008 2 12 [106] M.C. Sanchez-Sanchez R.M.N. Yerga D.I. Kondarides X.E. Verykios J.L.G. Fierro J. Phys. Chem. A 114 2010 3873 3882 [107] O. Rosseler M.V. Shankar M. Karkmaz-Le Du L. Schmidlin N. Keller V. Keller J. Catal. 269 2010 179 190 [108] C.N. Ávila-Neto J.W.C. Liberatori A.M. da Silva D. Zanchet C.E. Hori F.B. Noronha J.M.C. Bueno J. Catal. 287 2012 124 137 [109] W. Xu R. Si S.D. Senanayake J. Llorca H. Idriss D. Stacchiola J.C. Hanson J.A. Rodriguez J. Catal. 291 2012 117 126 [110] S. Kundu J. Ciston S.D. Senanayake D.A. Arena E. Fujita D. Stacchiola L. Barrio R.M. Navarro J.L.G. Fierro J.A. Rodriguez J. Phys. Chem. C 116 2012 14062 14070 [111] M.G. Castaño T.R. Reina S. Ivanova M.A. Centeno J.A. Odriozola J. Catal. 314 2014 1 9 [112] S. Luo T.-D. Nguyen-Phan A.C. Johnston-Peck L. Barrio S. Sallis D.A. Arena S. Kundu W. Xu L.F.J. Piper E.A. Stach D.E. Polyansky E. Fujita J.A. Rodriguez S.D. Senanayake J. Phys. Chem. C 119 2015 2669 2679 [113] G. Jacobs E. Chenu P.M. Patterson L. Williams D. Sparks G. Thomas B.H. Davis Appl. Catal. A 258 2004 203 214 [114] D. Pierre W. Deng M. Flytzani-Stephanopoulos Top. Catal. 46 2007 363 373 [115] L.P.R. Profeti E.A. Ticianelli E.M. Assaf Int. J. Hydrogen Energy 34 2009 5049 5060 [116] M. Bilal S.D. Jackson Catal. Sci. Technol. 3 2013 754 766 [117] D. Andreeva V. Idakiev T. Tabakova L. Ilieva P. Falaras A. Bourlinos A. Travlos Catal. Today 72 2002 51 57 [118] G. Jacobs Q. Fu H. Saltsburg M. Flytzani-Stephanopoulos Science 301 2003 935 938 [119] E. Chenu P.M. Patterson L. Williams D. Sparks G. Thomas B.H. Davis Appl. Catal. A 258 2004 203 214 [120] G. Jacobs S. Ricote P.M. Patterson U.M. Graham A. Dozier S. Khalid E. Rhodus B.H. Davis Appl. Catal. A 292 2005 229 243 [121] M.V. Dozzi L. Prati P. Canton E. Selli Phys. Chem. Chem. Phys. 11 2009 7171 7180 [122] C.G. Silva R. Juárez T. Marino R. Molinari H. García J. Am. Chem. Soc. 133 2011 595 602 [123] M. Murdoch G.I.N. Waterhouse M.A. Nadeem J.B. Metson M.A. Keane R.F. Howe J. Llorca H. Idriss Nat. Chem. 3 2011 489 492 [124] R. Si J. Tao J. Evans J.B. Park L. Barrio J.C. Hanson Y. Zhu J. Hrbek J.A. Rodriguez J. Phys. Chem. C 116 2012 23547 23555 [125] K. Qian L. Luo H. Bao Q. Hua Z. Jiang W. Huang Catal. Sci. Technol. 3 2013 679 687 [126] T. Tabakova L. Ilieva I. Ivanov R. Zanella J.W. Sobczak W. Lisowski Z. Kaszkur D. Andreeva Appl. Catal. B Environ. 136–137 2013 70 80 [127] P. Zhang C. Shao X. Li M. Zhang X. Zhang Y. Sun Y. Liu J. Hazard. Mater. 237 2012 331 338 [128] L. Arroyo-Ramírez C. Chen M. Cargnello C.B. Murray P. Fornasiero R.J. Gorte J. Mater. Chem. A 2 2014 19509 19514 [129] W. Xia C. Mei X. Zeng G. Fan J. Lu X. Meng X. Shen ACS Appl. Mater. Interfaces 7 2015 11824 11832 [130] Y.H. Li J. Xing Z.J. Chen Z. Li F. Tian L.R. Zheng H.F. Wang P. Hu H.J. Zhao H.G. Yang Nat. Commun. 4 2013 2005 [131] A. Naldoni M. D'Arienzo M. Altomare M. Marelli R. Scotti F. Morazzoni E. Selli V. Dal Santo Appl. Catal. B Environ. 130–131 2013 239 248 [132] J. Long H. Chang Q. Gu J. Xu L. Fan S. Wang Y. Zhou W. Wei L. Huang X. Wang P. Liu W. Huang Energy Environ. Sci. 7 2014 973 977 [133] J.B. Joo R. Dillon I. Lee Y. Yin C.J. Bardeen F. Zaera Proc. Natl. Acad. Sci. 111 2014 7942 7947 [134] A. Naldoni F. Fabbri M. Altomare M. Marelli R. Psaro E. Selli G. Salviati V. Dal Santo Phys. Chem. Chem. Phys. 17 2015 4864 4869 [135] F. Wang Y. Jiang D.J. Lawes G.E. Ball C. Zhou Z. Liu R. Amal ACS Catal. 5 2015 3924 3931 [136] M. Comotti W.-C. Li B. Spliethoff F. Schüth J. Am. Chem. Soc. 128 2006 917 924 [137] G.L. Chiarello M.H. Aguirre E. Selli J. Catal. 273 2010 182 190 [138] S.M. Yoo S.B. Rawal J.E. Lee J. Kim H.-Y. Ryu D.-W. Park W.I. Lee Appl. Catal. A Gen. 499 2015 47 54 [139] Z. Liu B. Guo L. Hong H. Jiang J. Photochem. Photobiol. A Chem. 172 2005 81 88 [140] L. Chen F. Li B. Ni J. Xu Z. Fu Y. Lu RSC Adv. 2 2012 10057 10063 [141] F. Pilger A. Testino M.A. Lucchini A. Kambolis M. Tarik M.E. Kazzi Y. Arroyo M.D. Rossell C. Ludwig J. Nanosci. Nanotechnol. 15 2015 3530 3539 [142] Q. Yuan Y. Liu L.-L. Li Z.-X. Li C.-J. Fang W.-T. Duan X.-G. Li C.-H. Yan Micropor. Mesopor. Mater. 124 2009 169 178 [143] T.A. Kandiel A. Feldhoff L. Robben R. Dillert D.W. Bahnemann Chem. Mater. 22 2010 2050 2060 [144] M. Maicu M.C. Hidalgo G. Colón J.A. Navío J. Photochem. Photobio. A Chem. 217 2011 275 283 [145] J. Fang S.-W. Cao Z. Wang M.M. Shahjamali S.C.J. Loo J. Barber C. Xue Int. J. Hydrogen Energy 37 2012 17853 17861 [146] F. Gärtner S. Losse A. Boddien M.-M. Pohl S. Denurra H. Junge M. Beller ChemSusChem 5 2012 530 533 [147] G. Liu X. Wang X. Wang H. Han C. Li J. Catal. 293 2012 61 66 [148] A. Speltini M. Sturini D. Dondi E. Annovazzi F. Maraschi V. Caratto A. Profumo A. Buttafava Photochem. Photobiol. Sci. 13 2014 1410 1419 [149] L. Zhang D. Jing L. Guo X. Yao ACS Sustainable Chem. Eng. 2 2014 1446 1452 [150] P. Bera A. Gayen M.S. Hegde N.P. Lalla L. Spadaro F. Frusteri F. Arena J. Phys. Chem. B 107 2003 6122 6130 [151] S. Ivanova V. Pitchon C. Petit J. Mol. Catal. A Chem. 256 2006 278 283 [152] Y. Mizukoshi Y. Makise T. Shuto J. Hu A. Tominaga S. Shironita S. Tanabe Ultrason. Sonochem. 14 2007 387 392 [153] H.-P. Zhou H.-S. Wu J. Shen A.-X. Yin L.-D. Sun C.-H. Yan J. Am. Chem. Soc. 132 2010 4998 4999 [154] T.R. Reina S. Ivanova V. Idakiev J.J. Delgado I. Ivanov T. Tabakova M.A. Centeno J.A. Odriozola Catal. Sci. Technol. 3 2013 779 787 [155] P. Liu J.A. Rodriguez J. Chem. Phys. 126 2007 164705 [156] T. Bunluesin R.J. Gorte G.W. Graham Appl. Catal. B Environ. 15 1998 107 114 [157] Y. Sato K. Terada S. Hasegawa T. Miyao S. Naito Appl. Catal. A Gen. 296 2005 80 89 [158] I.D. Gonzalez R.M. Navarro W. Wen N. Marinkovic J.A. Rodriguez F. Rosa J.L.G. Fierro Catal. Today 149 2010 372 379 [159] Z. Yang Z. Lu G. Luo Phys. Rev. B 76 2007 075421 [160] N. Acerbi S.C.E. Tsang G. Jones S. Golunski P. Collier Angew. Chem. Int. Ed. 52 2013 7737 7741 [161] B. Hammer J.K. Nørskov Nature 376 1995 238 240 [162] L.C. Grabow A.A. Gokhale S.T. Evans J.A. Dumesic M. Mavrikakis J. Phys. Chem. C 112 2008 4608 4617 [163] C. Ratnasamy J. Wagner Catal. Rev. Sci. Eng. 51 2009 325 440 [164] A.A. Phatak W.N. Delgass F.H. Ribeiro W.F. Schneider J. Phys. Chem. C 113 2009 7269 7276 [165] D. Sutton B. Kelleher J. Ross Fuel Process. Technol. 73 2001 155 173 [166] R. Davda J. Shabaker G. Huber R. Cortright J. Dumesic Appl. Catal. B Environ. 56 2005 171 186 [167] S. Sá H. Silva L. Brandão J.M. Sousa A. Mendes Appl. Catal. B Environ. 99 2010 43 57 [168] A.L. da Silva I.L. Müller Int. J. Hydrogen Energy 36 2011 2057 2075 [169] L.V. Mattos G. Jacobs B.H. Davis F.B. Noronha Chem. Rev. 112 2012 4094 4123 [170] D. Zanchet J.B.O. Santos S. Damyanova J.M.R. Gallo J.M.C. Bueno ACS Catal. 5 2015 3841 3863 [171] G. Jacobs B.H. Davis Appl. Catal. A Gen. 285 2005 43 49 [172] M. Dömök M. Tóth J. Raskó A. Erdőhelyi Appl. Catal. B Environ. 69 2007 262 272 [173] G. Jacobs R.A. Keogh B.H. Davis J. Catal. 245 2007 326 337 [174] C. Li K. Domen K.I. Maruya T. Onishi J. Catal. 125 1990 445 455 [175] T. Shido Y. Iwasawa J. Catal. 136 1992 493 503 [176] C. Binet A. Badri J.C. Lavalley J. Phys. Chem. 98 1994 6392 6398 [177] C. Binet M. Daturi J.C. Lavalley Catal. Today 50 1999 207 225 [178] C.H. Bartholomew Appl. Catal. A Gen. 212 2001 17 60 [179] V.R. Choudhary B. Prabhakar A.M. Rajput J. Catal. 157 1995 752 754 [180] J. Zhang Y. Wang R. Ma D. Wu Appl. Catal. A Gen. 243 2003 251 259 [181] N.V. Parizotto K.O. Rocha S. Damyanova F.B. Passos D. Zanchet C.M.P. Marques J.M.C. Bueno Appl. Catal. A Gen. 330 2007 12 22 [182] P.Y. Sheng W.W. Chiu A. Yee S.J. Morrison H. Idriss Catal. Today 129 2007 313 321 [183] J.R. Croy S. Mostafa L. Hickman H. Heinrich B.R. Cuenya Appl. Catal. A Gen. 350 2008 207 216 [184] A.C.W. Koh L. Chen W.K. Leong T.P. Ang B.F.G. Johnson T. Khimyak J. Lin Int. J. Hydrogen Energy 34 2009 5691 5703 [185] R.L. Barbosa V. Papaefthimiou Y.T. Law D. Teschner M. Hävecker A. Knop-Gericke R. Zapf G. Kolb R. Schlögl S. Zafeiratos J. Phys Chem. C 117 2013 6143 6150 [186] P.Y. Sheng H. Idriss J. Vac. Sci. Technol. A 252 2004 1652 1658 [187] P.-Y. Sheng G.A. Bowmaker H. Idriss Appl. Catal. A 261 2004 171 181 [188] R.P.S. Fartaria F.F.M. Freitas F.M.S.S. Fernandes Int. J. Quantum Chem. 107 2007 2169 2177 [189] R. Alcalá M. Mavrikakis J.A. Dumesic J. Catal. 218 2003 178 190 [190] J.-H. Wang C.S. Lee M.C. Lin J. Phys. Chem. C 113 2009 6681 6688 [191] J.E. Sutton P. Panagiotopoulou X.E. Verykios D.G. Vlachos J. Phys. Chem. C 117 2013 4691 4706 [192] A. Haryanto S. Fernando N. Murali S. Adhikari Energy Fuels 19 2005 2098 2106 [193] M. Ni D.Y.C. Leung M.K.H. Leung Int. J. Hydrogen Energy 32 2007 3238 3247 [194] X.-K. Gu B. Qiao C.-Q. Huang W.-C. Ding K. Sun E. Zhan T. Zhang J. Liu W.-X. Li ACS Catal. 4 2014 3886 3890 [195] A. Gazsi T. Bánsági F. Solymosi Catal. Lett. 131 2009 33 41 [196] M. Jakob H. Levanon P.V. Kamat Nano Lett. 3 2003 353 358 [197] D.R. Lide CRC Handbook of Chemistry and Physics 87th ed. 2007 Taylor & Francis [198] M. Grätzel Nature 414 2001 338 344 [199] A.L. Linsebigler G. Lu J.T. Yates Chem. Rev. 95 1995 735 758 [200] S. Linic P. Christopher D.B. Ingram Nat. Mater. 10 2011 911 921 [201] E. Kowalska O.O.P. Mahaney R. Abe B. Ohtani Phys. Chem. Chem. Phys. 12 2010 2344 2355 [202] S. Linic P. Christopher D.B. Ingram Nat. Mater. 10 2011 911 921 [203] S. Zeng X. Yu W.-C. Law Y. Zhang R. Hu X.-Q. Dinh H.-P. Ho K.-T. Yong Sensor. Actuat. B Chem. 176 2013 1128 1133 [204] S. Dhara R. Kesavamoorthy P. Magudapathy M. Premila B.K. Panigrahi K.G.M. Nair C.T. Wu K.H. Chen L.C. Chen Chem. Phys. Lett. 370 2003 254 260 [205] S.K. Parayil H.S. Kibombo C.-M. Wu R. Peng T. Kindle S. Mishra S.P. Ahrenkiel J. Baltrusaitis N.M. Dimitrijevic T. Rajh R.T. Koodali J. Phys. Chem. C 117 2013 16850 16862 [206] Z.-P. Liu X.-Q. Gong J. Kohanoff C. Sanchez P. Hu Phys. Rev. Lett. 91 2003 266102 [207] K.-M. Shindler M. Kunst J. Phys. Chem. 94 1990 8222 8226 [208] A. Yamakata T.-A. Ishibashi H. Onishi Chem. Phys. 339 2007 133 137 [209] R. Katoh M. Mural A. Furube Chem. Phys. Lett. 461 2008 238 241 [210] D.C. Hurum A.G. Agrios K.A. Gray T. Rajh M.C. Thurnauer J. Phys. Chem. B 107 2003 4545 4549 [211] B. Sun A.V. Vorontsov P.G. Smirniotis Langmuir 19 2003 3151 3156 [212] D.O. Scanlon C.W. Dunnill J. Buckeridge S.A. Shevlin A.J. Logsdail S.M. Woodley C.R.A. Catlow M.J. Powell R.G. Palgrave I.P. Parkin G.W. Watson T.W. Keal P. Sherwood A. Walsh A.A. Sokol Nat. Mater. 12 2013 798 801 [213] N.M. Kinsinger A. Dudchenko A. Wong D. Kisailus ACS Appl. Mater. Interfaces 5 2013 6247 6254 [214] Z. Luo A.S. Poyraz C.-H. Kuo R. Miao Y. Meng S.-Y. Chen T. Jiang C. Wenos S.L. Suib Chem. Mater. 27 2015 6 17 [215] X. Li Z. Wang Z. Zhang L. Chen J. Cheng W. Ni B. Wang E. Xie Sci. Rep. 5 2014 9130 [216] L. He L. Li T. Wang H. Gao G. Li X. Wu Z. Su C. Wang Dalton Trans. 43 2014 16981 16985",
      "scopus-id": "84950341965",
      "coredata": {
        "eid": "1-s2.0-S0926860X15302866",
        "dc:description": "The use of metal nanoparticles (NPs), including Au and Pt, supported over oxides has been pivotal, and is ever increasing in enabling catalytic reactions which target the production of hydrogen. We review here the most recent works pertaining to the fundamental understanding of the structure, morphology, growth, characterization, and intrinsic phenomenological properties of Au- and Pt-based catalysts that influence the reactivity and selectivity to target hydrogen production. We draw on surface science and theoretical methods of model and powder catalysts using high resolution imaging, spectroscopy, scattering experiments, and theoretical studies. Based on these insights we identify key aspects of studies of supported metal nanoparticle (NP) catalysts for several reactions. The main focus of this review is on the intersection of catalytic chemistry related to the water-gas shift (WGS), oxygenate steam reforming (OSR), and solar-assisted reactions (SAR).",
        "openArchiveArticle": "false",
        "prism:coverDate": "2016-05-25",
        "openaccessUserLicense": null,
        "prism:aggregationType": "Journal",
        "prism:url": "https://api.elsevier.com/content/article/pii/S0926860X15302866",
        "dc:creator": [
          {
            "@_fa": "true",
            "$": "Nguyen-Phan, Thuy-Duong"
          },
          {
            "@_fa": "true",
            "$": "Baber, Ashleigh E."
          },
          {
            "@_fa": "true",
            "$": "Rodriguez, José A."
          },
          {
            "@_fa": "true",
            "$": "Senanayake, Sanjaya D."
          }
        ],
        "link": [
          {
            "@_fa": "true",
            "@rel": "self",
            "@href": "https://api.elsevier.com/content/article/pii/S0926860X15302866"
          },
          {
            "@_fa": "true",
            "@rel": "scidir",
            "@href": "https://www.sciencedirect.com/science/article/pii/S0926860X15302866"
          }
        ],
        "dc:format": "application/json",
        "openaccessType": null,
        "pii": "S0926-860X(15)30286-6",
        "prism:volume": "518",
        "prism:publisher": "Elsevier B.V.",
        "dc:title": "Au and Pt nanoparticle supported catalysts tailored for H2 production: From models to powder catalysts",
        "prism:copyright": "© 2015 Elsevier B.V. All rights reserved.",
        "prism:issueName": "Hydrogen from Oxygenated Molecules",
        "openaccess": "0",
        "prism:issn": "0926860X",
        "dcterms:subject": [
          {
            "@_fa": "true",
            "$": "Gold"
          },
          {
            "@_fa": "true",
            "$": "Platinum"
          },
          {
            "@_fa": "true",
            "$": "Supported catalyst"
          },
          {
            "@_fa": "true",
            "$": "Water–gas shift"
          },
          {
            "@_fa": "true",
            "$": "Steam reforming"
          },
          {
            "@_fa": "true",
            "$": "Water splitting"
          }
        ],
        "openaccessArticle": "false",
        "prism:publicationName": "Applied Catalysis A: General",
        "openaccessSponsorType": null,
        "prism:pageRange": "18-47",
        "prism:endingPage": "47",
        "pubType": "fla",
        "prism:coverDisplayDate": "25 May 2016",
        "prism:doi": "10.1016/j.apcata.2015.12.012",
        "prism:startingPage": "18",
        "dc:identifier": "doi:10.1016/j.apcata.2015.12.012",
        "openaccessSponsorName": null
      },
      "objects": {
        "object": [
          {
            "@category": "thumbnail",
            "@height": "88",
            "@width": "219",
            "@_fa": "true",
            "$": "https://api.elsevier.com/content/object/eid/1-s2.0-S0926860X15302866-fx1.sml?httpAccept=%2A%2F%2A",
            "@multimediatype": "GIF image file",
            "@type": "IMAGE-THUMBNAIL",
            "@size": "6050",
            "@ref": "fx1",
            "@mimetype": "image/gif"
          },
          {
            "@category": "thumbnail",
            "@height": "164",
            "@width": "208",
            "@_fa": "true",
            "$": "https://api.elsevier.com/content/object/eid/1-s2.0-S0926860X15302866-gr1.sml?httpAccept=%2A%2F%2A",
            "@multimediatype": "GIF image file",
            "@type": "IMAGE-THUMBNAIL",
            "@size": "7610",
            "@ref": "gr1",
            "@mimetype": "image/gif"
          },
          {
            "@category": "thumbnail",
            "@height": "137",
            "@width": "219",
            "@_fa": "true",
            "$": "https://api.elsevier.com/content/object/eid/1-s2.0-S0926860X15302866-gr10.sml?httpAccept=%2A%2F%2A",
            "@multimediatype": "GIF image file",
            "@type": "IMAGE-THUMBNAIL",
            "@size": "21338",
            "@ref": "gr10",
            "@mimetype": "image/gif"
          },
          {
            "@category": "thumbnail",
            "@height": "164",
            "@width": "203",
            "@_fa": "true",
            "$": "https://api.elsevier.com/content/object/eid/1-s2.0-S0926860X15302866-gr11.sml?httpAccept=%2A%2F%2A",
            "@multimediatype": "GIF image file",
            "@type": "IMAGE-THUMBNAIL",
            "@size": "30052",
            "@ref": "gr11",
            "@mimetype": "image/gif"
          },
          {
            "@category": "thumbnail",
            "@height": "164",
            "@width": "208",
            "@_fa": "true",
            "$": "https://api.elsevier.com/content/object/eid/1-s2.0-S0926860X15302866-gr12.sml?httpAccept=%2A%2F%2A",
            "@multimediatype": "GIF image file",
            "@type": "IMAGE-THUMBNAIL",
            "@size": "24104",
            "@ref": "gr12",
            "@mimetype": "image/gif"
          },
          {
            "@category": "thumbnail",
            "@height": "164",
            "@width": "200",
            "@_fa": "true",
            "$": "https://api.elsevier.com/content/object/eid/1-s2.0-S0926860X15302866-gr13.sml?httpAccept=%2A%2F%2A",
            "@multimediatype": "GIF image file",
            "@type": "IMAGE-THUMBNAIL",
            "@size": "13429",
            "@ref": "gr13",
            "@mimetype": "image/gif"
          },
          {
            "@category": "thumbnail",
            "@height": "155",
            "@width": "219",
            "@_fa": "true",
            "$": "https://api.elsevier.com/content/object/eid/1-s2.0-S0926860X15302866-gr14.sml?httpAccept=%2A%2F%2A",
            "@multimediatype": "GIF image file",
            "@type": "IMAGE-THUMBNAIL",
            "@size": "11274",
            "@ref": "gr14",
            "@mimetype": "image/gif"
          },
          {
            "@category": "thumbnail",
            "@height": "163",
            "@width": "109",
            "@_fa": "true",
            "$": "https://api.elsevier.com/content/object/eid/1-s2.0-S0926860X15302866-gr15.sml?httpAccept=%2A%2F%2A",
            "@multimediatype": "GIF image file",
            "@type": "IMAGE-THUMBNAIL",
            "@size": "11067",
            "@ref": "gr15",
            "@mimetype": "image/gif"
          },
          {
            "@category": "thumbnail",
            "@height": "136",
            "@width": "219",
            "@_fa": "true",
            "$": "https://api.elsevier.com/content/object/eid/1-s2.0-S0926860X15302866-gr16.sml?httpAccept=%2A%2F%2A",
            "@multimediatype": "GIF image file",
            "@type": "IMAGE-THUMBNAIL",
            "@size": "16399",
            "@ref": "gr16",
            "@mimetype": "image/gif"
          },
          {
            "@category": "thumbnail",
            "@height": "109",
            "@width": "219",
            "@_fa": "true",
            "$": "https://api.elsevier.com/content/object/eid/1-s2.0-S0926860X15302866-gr17.sml?httpAccept=%2A%2F%2A",
            "@multimediatype": "GIF image file",
            "@type": "IMAGE-THUMBNAIL",
            "@size": "13771",
            "@ref": "gr17",
            "@mimetype": "image/gif"
          },
          {
            "@category": "thumbnail",
            "@height": "164",
            "@width": "177",
            "@_fa": "true",
            "$": "https://api.elsevier.com/content/object/eid/1-s2.0-S0926860X15302866-gr18.sml?httpAccept=%2A%2F%2A",
            "@multimediatype": "GIF image file",
            "@type": "IMAGE-THUMBNAIL",
            "@size": "7135",
            "@ref": "gr18",
            "@mimetype": "image/gif"
          },
          {
            "@category": "thumbnail",
            "@height": "164",
            "@width": "219",
            "@_fa": "true",
            "$": "https://api.elsevier.com/content/object/eid/1-s2.0-S0926860X15302866-gr19.sml?httpAccept=%2A%2F%2A",
            "@multimediatype": "GIF image file",
            "@type": "IMAGE-THUMBNAIL",
            "@size": "12186",
            "@ref": "gr19",
            "@mimetype": "image/gif"
          },
          {
            "@category": "thumbnail",
            "@height": "164",
            "@width": "198",
            "@_fa": "true",
            "$": "https://api.elsevier.com/content/object/eid/1-s2.0-S0926860X15302866-gr2.sml?httpAccept=%2A%2F%2A",
            "@multimediatype": "GIF image file",
            "@type": "IMAGE-THUMBNAIL",
            "@size": "6219",
            "@ref": "gr2",
            "@mimetype": "image/gif"
          },
          {
            "@category": "thumbnail",
            "@height": "155",
            "@width": "219",
            "@_fa": "true",
            "$": "https://api.elsevier.com/content/object/eid/1-s2.0-S0926860X15302866-gr20.sml?httpAccept=%2A%2F%2A",
            "@multimediatype": "GIF image file",
            "@type": "IMAGE-THUMBNAIL",
            "@size": "9163",
            "@ref": "gr20",
            "@mimetype": "image/gif"
          },
          {
            "@category": "thumbnail",
            "@height": "163",
            "@width": "102",
            "@_fa": "true",
            "$": "https://api.elsevier.com/content/object/eid/1-s2.0-S0926860X15302866-gr21.sml?httpAccept=%2A%2F%2A",
            "@multimediatype": "GIF image file",
            "@type": "IMAGE-THUMBNAIL",
            "@size": "4473",
            "@ref": "gr21",
            "@mimetype": "image/gif"
          },
          {
            "@category": "thumbnail",
            "@height": "163",
            "@width": "125",
            "@_fa": "true",
            "$": "https://api.elsevier.com/content/object/eid/1-s2.0-S0926860X15302866-gr22.sml?httpAccept=%2A%2F%2A",
            "@multimediatype": "GIF image file",
            "@type": "IMAGE-THUMBNAIL",
            "@size": "9340",
            "@ref": "gr22",
            "@mimetype": "image/gif"
          },
          {
            "@category": "thumbnail",
            "@height": "150",
            "@width": "219",
            "@_fa": "true",
            "$": "https://api.elsevier.com/content/object/eid/1-s2.0-S0926860X15302866-gr23.sml?httpAccept=%2A%2F%2A",
            "@multimediatype": "GIF image file",
            "@type": "IMAGE-THUMBNAIL",
            "@size": "10112",
            "@ref": "gr23",
            "@mimetype": "image/gif"
          },
          {
            "@category": "thumbnail",
            "@height": "145",
            "@width": "219",
            "@_fa": "true",
            "$": "https://api.elsevier.com/content/object/eid/1-s2.0-S0926860X15302866-gr24.sml?httpAccept=%2A%2F%2A",
            "@multimediatype": "GIF image file",
            "@type": "IMAGE-THUMBNAIL",
            "@size": "12767",
            "@ref": "gr24",
            "@mimetype": "image/gif"
          },
          {
            "@category": "thumbnail",
            "@height": "164",
            "@width": "140",
            "@_fa": "true",
            "$": "https://api.elsevier.com/content/object/eid/1-s2.0-S0926860X15302866-gr25.sml?httpAccept=%2A%2F%2A",
            "@multimediatype": "GIF image file",
            "@type": "IMAGE-THUMBNAIL",
            "@size": "7359",
            "@ref": "gr25",
            "@mimetype": "image/gif"
          },
          {
            "@category": "thumbnail",
            "@height": "163",
            "@width": "123",
            "@_fa": "true",
            "$": "https://api.elsevier.com/content/object/eid/1-s2.0-S0926860X15302866-gr26.sml?httpAccept=%2A%2F%2A",
            "@multimediatype": "GIF image file",
            "@type": "IMAGE-THUMBNAIL",
            "@size": "5181",
            "@ref": "gr26",
            "@mimetype": "image/gif"
          },
          {
            "@category": "thumbnail",
            "@height": "126",
            "@width": "219",
            "@_fa": "true",
            "$": "https://api.elsevier.com/content/object/eid/1-s2.0-S0926860X15302866-gr27.sml?httpAccept=%2A%2F%2A",
            "@multimediatype": "GIF image file",
            "@type": "IMAGE-THUMBNAIL",
            "@size": "10127",
            "@ref": "gr27",
            "@mimetype": "image/gif"
          },
          {
            "@category": "thumbnail",
            "@height": "141",
            "@width": "219",
            "@_fa": "true",
            "$": "https://api.elsevier.com/content/object/eid/1-s2.0-S0926860X15302866-gr28.sml?httpAccept=%2A%2F%2A",
            "@multimediatype": "GIF image file",
            "@type": "IMAGE-THUMBNAIL",
            "@size": "9507",
            "@ref": "gr28",
            "@mimetype": "image/gif"
          },
          {
            "@category": "thumbnail",
            "@height": "114",
            "@width": "219",
            "@_fa": "true",
            "$": "https://api.elsevier.com/content/object/eid/1-s2.0-S0926860X15302866-gr29.sml?httpAccept=%2A%2F%2A",
            "@multimediatype": "GIF image file",
            "@type": "IMAGE-THUMBNAIL",
            "@size": "12560",
            "@ref": "gr29",
            "@mimetype": "image/gif"
          },
          {
            "@category": "thumbnail",
            "@height": "74",
            "@width": "219",
            "@_fa": "true",
            "$": "https://api.elsevier.com/content/object/eid/1-s2.0-S0926860X15302866-gr3.sml?httpAccept=%2A%2F%2A",
            "@multimediatype": "GIF image file",
            "@type": "IMAGE-THUMBNAIL",
            "@size": "13095",
            "@ref": "gr3",
            "@mimetype": "image/gif"
          },
          {
            "@category": "thumbnail",
            "@height": "163",
            "@width": "156",
            "@_fa": "true",
            "$": "https://api.elsevier.com/content/object/eid/1-s2.0-S0926860X15302866-gr30.sml?httpAccept=%2A%2F%2A",
            "@multimediatype": "GIF image file",
            "@type": "IMAGE-THUMBNAIL",
            "@size": "9859",
            "@ref": "gr30",
            "@mimetype": "image/gif"
          },
          {
            "@category": "thumbnail",
            "@height": "147",
            "@width": "219",
            "@_fa": "true",
            "$": "https://api.elsevier.com/content/object/eid/1-s2.0-S0926860X15302866-gr31.sml?httpAccept=%2A%2F%2A",
            "@multimediatype": "GIF image file",
            "@type": "IMAGE-THUMBNAIL",
            "@size": "15380",
            "@ref": "gr31",
            "@mimetype": "image/gif"
          },
          {
            "@category": "thumbnail",
            "@height": "108",
            "@width": "219",
            "@_fa": "true",
            "$": "https://api.elsevier.com/content/object/eid/1-s2.0-S0926860X15302866-gr32.sml?httpAccept=%2A%2F%2A",
            "@multimediatype": "GIF image file",
            "@type": "IMAGE-THUMBNAIL",
            "@size": "10677",
            "@ref": "gr32",
            "@mimetype": "image/gif"
          },
          {
            "@category": "thumbnail",
            "@height": "164",
            "@width": "196",
            "@_fa": "true",
            "$": "https://api.elsevier.com/content/object/eid/1-s2.0-S0926860X15302866-gr33.sml?httpAccept=%2A%2F%2A",
            "@multimediatype": "GIF image file",
            "@type": "IMAGE-THUMBNAIL",
            "@size": "10918",
            "@ref": "gr33",
            "@mimetype": "image/gif"
          },
          {
            "@category": "thumbnail",
            "@height": "164",
            "@width": "201",
            "@_fa": "true",
            "$": "https://api.elsevier.com/content/object/eid/1-s2.0-S0926860X15302866-gr34.sml?httpAccept=%2A%2F%2A",
            "@multimediatype": "GIF image file",
            "@type": "IMAGE-THUMBNAIL",
            "@size": "10615",
            "@ref": "gr34",
            "@mimetype": "image/gif"
          },
          {
            "@category": "thumbnail",
            "@height": "164",
            "@width": "124",
            "@_fa": "true",
            "$": "https://api.elsevier.com/content/object/eid/1-s2.0-S0926860X15302866-gr35.sml?httpAccept=%2A%2F%2A",
            "@multimediatype": "GIF image file",
            "@type": "IMAGE-THUMBNAIL",
            "@size": "6391",
            "@ref": "gr35",
            "@mimetype": "image/gif"
          },
          {
            "@category": "thumbnail",
            "@height": "164",
            "@width": "211",
            "@_fa": "true",
            "$": "https://api.elsevier.com/content/object/eid/1-s2.0-S0926860X15302866-gr36.sml?httpAccept=%2A%2F%2A",
            "@multimediatype": "GIF image file",
            "@type": "IMAGE-THUMBNAIL",
            "@size": "17058",
            "@ref": "gr36",
            "@mimetype": "image/gif"
          },
          {
            "@category": "thumbnail",
            "@height": "158",
            "@width": "219",
            "@_fa": "true",
            "$": "https://api.elsevier.com/content/object/eid/1-s2.0-S0926860X15302866-gr37.sml?httpAccept=%2A%2F%2A",
            "@multimediatype": "GIF image file",
            "@type": "IMAGE-THUMBNAIL",
            "@size": "9707",
            "@ref": "gr37",
            "@mimetype": "image/gif"
          },
          {
            "@category": "thumbnail",
            "@height": "108",
            "@width": "219",
            "@_fa": "true",
            "$": "https://api.elsevier.com/content/object/eid/1-s2.0-S0926860X15302866-gr4.sml?httpAccept=%2A%2F%2A",
            "@multimediatype": "GIF image file",
            "@type": "IMAGE-THUMBNAIL",
            "@size": "23933",
            "@ref": "gr4",
            "@mimetype": "image/gif"
          },
          {
            "@category": "thumbnail",
            "@height": "138",
            "@width": "219",
            "@_fa": "true",
            "$": "https://api.elsevier.com/content/object/eid/1-s2.0-S0926860X15302866-gr5.sml?httpAccept=%2A%2F%2A",
            "@multimediatype": "GIF image file",
            "@type": "IMAGE-THUMBNAIL",
            "@size": "17512",
            "@ref": "gr5",
            "@mimetype": "image/gif"
          },
          {
            "@category": "thumbnail",
            "@height": "163",
            "@width": "188",
            "@_fa": "true",
            "$": "https://api.elsevier.com/content/object/eid/1-s2.0-S0926860X15302866-gr6.sml?httpAccept=%2A%2F%2A",
            "@multimediatype": "GIF image file",
            "@type": "IMAGE-THUMBNAIL",
            "@size": "20439",
            "@ref": "gr6",
            "@mimetype": "image/gif"
          },
          {
            "@category": "thumbnail",
            "@height": "164",
            "@width": "130",
            "@_fa": "true",
            "$": "https://api.elsevier.com/content/object/eid/1-s2.0-S0926860X15302866-gr7.sml?httpAccept=%2A%2F%2A",
            "@multimediatype": "GIF image file",
            "@type": "IMAGE-THUMBNAIL",
            "@size": "13363",
            "@ref": "gr7",
            "@mimetype": "image/gif"
          },
          {
            "@category": "thumbnail",
            "@height": "164",
            "@width": "179",
            "@_fa": "true",
            "$": "https://api.elsevier.com/content/object/eid/1-s2.0-S0926860X15302866-gr8.sml?httpAccept=%2A%2F%2A",
            "@multimediatype": "GIF image file",
            "@type": "IMAGE-THUMBNAIL",
            "@size": "22961",
            "@ref": "gr8",
            "@mimetype": "image/gif"
          },
          {
            "@category": "thumbnail",
            "@height": "126",
            "@width": "219",
            "@_fa": "true",
            "$": "https://api.elsevier.com/content/object/eid/1-s2.0-S0926860X15302866-gr9.sml?httpAccept=%2A%2F%2A",
            "@multimediatype": "GIF image file",
            "@type": "IMAGE-THUMBNAIL",
            "@size": "8807",
            "@ref": "gr9",
            "@mimetype": "image/gif"
          },
          {
            "@category": "standard",
            "@height": "200",
            "@width": "500",
            "@_fa": "true",
            "$": "https://api.elsevier.com/content/object/eid/1-s2.0-S0926860X15302866-fx1.jpg?httpAccept=%2A%2F%2A",
            "@multimediatype": "JPEG image file",
            "@type": "IMAGE-DOWNSAMPLED",
            "@size": "17127",
            "@ref": "fx1",
            "@mimetype": "image/jpeg"
          },
          {
            "@category": "standard",
            "@height": "385",
            "@width": "489",
            "@_fa": "true",
            "$": "https://api.elsevier.com/content/object/eid/1-s2.0-S0926860X15302866-gr1.jpg?httpAccept=%2A%2F%2A",
            "@multimediatype": "JPEG image file",
            "@type": "IMAGE-DOWNSAMPLED",
            "@size": "37066",
            "@ref": "gr1",
            "@mimetype": "image/jpeg"
          },
          {
            "@category": "standard",
            "@height": "293",
            "@width": "470",
            "@_fa": "true",
            "$": "https://api.elsevier.com/content/object/eid/1-s2.0-S0926860X15302866-gr10.jpg?httpAccept=%2A%2F%2A",
            "@multimediatype": "JPEG image file",
            "@type": "IMAGE-DOWNSAMPLED",
            "@size": "34772",
            "@ref": "gr10",
            "@mimetype": "image/jpeg"
          },
          {
            "@category": "standard",
            "@height": "457",
            "@width": "565",
            "@_fa": "true",
            "$": "https://api.elsevier.com/content/object/eid/1-s2.0-S0926860X15302866-gr11.jpg?httpAccept=%2A%2F%2A",
            "@multimediatype": "JPEG image file",
            "@type": "IMAGE-DOWNSAMPLED",
            "@size": "91224",
            "@ref": "gr11",
            "@mimetype": "image/jpeg"
          },
          {
            "@category": "standard",
            "@height": "446",
            "@width": "565",
            "@_fa": "true",
            "$": "https://api.elsevier.com/content/object/eid/1-s2.0-S0926860X15302866-gr12.jpg?httpAccept=%2A%2F%2A",
            "@multimediatype": "JPEG image file",
            "@type": "IMAGE-DOWNSAMPLED",
            "@size": "94601",
            "@ref": "gr12",
            "@mimetype": "image/jpeg"
          },
          {
            "@category": "standard",
            "@height": "431",
            "@width": "527",
            "@_fa": "true",
            "$": "https://api.elsevier.com/content/object/eid/1-s2.0-S0926860X15302866-gr13.jpg?httpAccept=%2A%2F%2A",
            "@multimediatype": "JPEG image file",
            "@type": "IMAGE-DOWNSAMPLED",
            "@size": "66511",
            "@ref": "gr13",
            "@mimetype": "image/jpeg"
          },
          {
            "@category": "standard",
            "@height": "334",
            "@width": "470",
            "@_fa": "true",
            "$": "https://api.elsevier.com/content/object/eid/1-s2.0-S0926860X15302866-gr14.jpg?httpAccept=%2A%2F%2A",
            "@multimediatype": "JPEG image file",
            "@type": "IMAGE-DOWNSAMPLED",
            "@size": "42173",
            "@ref": "gr14",
            "@mimetype": "image/jpeg"
          },
          {
            "@category": "standard",
            "@height": "846",
            "@width": "565",
            "@_fa": "true",
            "$": "https://api.elsevier.com/content/object/eid/1-s2.0-S0926860X15302866-gr15.jpg?httpAccept=%2A%2F%2A",
            "@multimediatype": "JPEG image file",
            "@type": "IMAGE-DOWNSAMPLED",
            "@size": "143069",
            "@ref": "gr15",
            "@mimetype": "image/jpeg"
          },
          {
            "@category": "standard",
            "@height": "352",
            "@width": "565",
            "@_fa": "true",
            "$": "https://api.elsevier.com/content/object/eid/1-s2.0-S0926860X15302866-gr16.jpg?httpAccept=%2A%2F%2A",
            "@multimediatype": "JPEG image file",
            "@type": "IMAGE-DOWNSAMPLED",
            "@size": "50145",
            "@ref": "gr16",
            "@mimetype": "image/jpeg"
          },
          {
            "@category": "standard",
            "@height": "329",
            "@width": "659",
            "@_fa": "true",
            "$": "https://api.elsevier.com/content/object/eid/1-s2.0-S0926860X15302866-gr17.jpg?httpAccept=%2A%2F%2A",
            "@multimediatype": "JPEG image file",
            "@type": "IMAGE-DOWNSAMPLED",
            "@size": "89823",
            "@ref": "gr17",
            "@mimetype": "image/jpeg"
          },
          {
            "@category": "standard",
            "@height": "698",
            "@width": "753",
            "@_fa": "true",
            "$": "https://api.elsevier.com/content/object/eid/1-s2.0-S0926860X15302866-gr18.jpg?httpAccept=%2A%2F%2A",
            "@multimediatype": "JPEG image file",
            "@type": "IMAGE-DOWNSAMPLED",
            "@size": "91137",
            "@ref": "gr18",
            "@mimetype": "image/jpeg"
          },
          {
            "@category": "standard",
            "@height": "563",
            "@width": "753",
            "@_fa": "true",
            "$": "https://api.elsevier.com/content/object/eid/1-s2.0-S0926860X15302866-gr19.jpg?httpAccept=%2A%2F%2A",
            "@multimediatype": "JPEG image file",
            "@type": "IMAGE-DOWNSAMPLED",
            "@size": "97210",
            "@ref": "gr19",
            "@mimetype": "image/jpeg"
          },
          {
            "@category": "standard",
            "@height": "312",
            "@width": "376",
            "@_fa": "true",
            "$": "https://api.elsevier.com/content/object/eid/1-s2.0-S0926860X15302866-gr2.jpg?httpAccept=%2A%2F%2A",
            "@multimediatype": "JPEG image file",
            "@type": "IMAGE-DOWNSAMPLED",
            "@size": "21882",
            "@ref": "gr2",
            "@mimetype": "image/jpeg"
          },
          {
            "@category": "standard",
            "@height": "332",
            "@width": "470",
            "@_fa": "true",
            "$": "https://api.elsevier.com/content/object/eid/1-s2.0-S0926860X15302866-gr20.jpg?httpAccept=%2A%2F%2A",
            "@multimediatype": "JPEG image file",
            "@type": "IMAGE-DOWNSAMPLED",
            "@size": "37420",
            "@ref": "gr20",
            "@mimetype": "image/jpeg"
          },
          {
            "@category": "standard",
            "@height": "782",
            "@width": "489",
            "@_fa": "true",
            "$": "https://api.elsevier.com/content/object/eid/1-s2.0-S0926860X15302866-gr21.jpg?httpAccept=%2A%2F%2A",
            "@multimediatype": "JPEG image file",
            "@type": "IMAGE-DOWNSAMPLED",
            "@size": "76312",
            "@ref": "gr21",
            "@mimetype": "image/jpeg"
          },
          {
            "@category": "standard",
            "@height": "614",
            "@width": "470",
            "@_fa": "true",
            "$": "https://api.elsevier.com/content/object/eid/1-s2.0-S0926860X15302866-gr22.jpg?httpAccept=%2A%2F%2A",
            "@multimediatype": "JPEG image file",
            "@type": "IMAGE-DOWNSAMPLED",
            "@size": "93699",
            "@ref": "gr22",
            "@mimetype": "image/jpeg"
          },
          {
            "@category": "standard",
            "@height": "515",
            "@width": "753",
            "@_fa": "true",
            "$": "https://api.elsevier.com/content/object/eid/1-s2.0-S0926860X15302866-gr23.jpg?httpAccept=%2A%2F%2A",
            "@multimediatype": "JPEG image file",
            "@type": "IMAGE-DOWNSAMPLED",
            "@size": "92066",
            "@ref": "gr23",
            "@mimetype": "image/jpeg"
          },
          {
            "@category": "standard",
            "@height": "497",
            "@width": "753",
            "@_fa": "true",
            "$": "https://api.elsevier.com/content/object/eid/1-s2.0-S0926860X15302866-gr24.jpg?httpAccept=%2A%2F%2A",
            "@multimediatype": "JPEG image file",
            "@type": "IMAGE-DOWNSAMPLED",
            "@size": "119690",
            "@ref": "gr24",
            "@mimetype": "image/jpeg"
          },
          {
            "@category": "standard",
            "@height": "440",
            "@width": "376",
            "@_fa": "true",
            "$": "https://api.elsevier.com/content/object/eid/1-s2.0-S0926860X15302866-gr25.jpg?httpAccept=%2A%2F%2A",
            "@multimediatype": "JPEG image file",
            "@type": "IMAGE-DOWNSAMPLED",
            "@size": "45805",
            "@ref": "gr25",
            "@mimetype": "image/jpeg"
          },
          {
            "@category": "standard",
            "@height": "978",
            "@width": "737",
            "@_fa": "true",
            "$": "https://api.elsevier.com/content/object/eid/1-s2.0-S0926860X15302866-gr26.jpg?httpAccept=%2A%2F%2A",
            "@multimediatype": "JPEG image file",
            "@type": "IMAGE-DOWNSAMPLED",
            "@size": "115228",
            "@ref": "gr26",
            "@mimetype": "image/jpeg"
          },
          {
            "@category": "standard",
            "@height": "280",
            "@width": "489",
            "@_fa": "true",
            "$": "https://api.elsevier.com/content/object/eid/1-s2.0-S0926860X15302866-gr27.jpg?httpAccept=%2A%2F%2A",
            "@multimediatype": "JPEG image file",
            "@type": "IMAGE-DOWNSAMPLED",
            "@size": "28331",
            "@ref": "gr27",
            "@mimetype": "image/jpeg"
          },
          {
            "@category": "standard",
            "@height": "315",
            "@width": "489",
            "@_fa": "true",
            "$": "https://api.elsevier.com/content/object/eid/1-s2.0-S0926860X15302866-gr28.jpg?httpAccept=%2A%2F%2A",
            "@multimediatype": "JPEG image file",
            "@type": "IMAGE-DOWNSAMPLED",
            "@size": "36381",
            "@ref": "gr28",
            "@mimetype": "image/jpeg"
          },
          {
            "@category": "standard",
            "@height": "166",
            "@width": "320",
            "@_fa": "true",
            "$": "https://api.elsevier.com/content/object/eid/1-s2.0-S0926860X15302866-gr29.jpg?httpAccept=%2A%2F%2A",
            "@multimediatype": "JPEG image file",
            "@type": "IMAGE-DOWNSAMPLED",
            "@size": "18009",
            "@ref": "gr29",
            "@mimetype": "image/jpeg"
          },
          {
            "@category": "standard",
            "@height": "221",
            "@width": "659",
            "@_fa": "true",
            "$": "https://api.elsevier.com/content/object/eid/1-s2.0-S0926860X15302866-gr3.jpg?httpAccept=%2A%2F%2A",
            "@multimediatype": "JPEG image file",
            "@type": "IMAGE-DOWNSAMPLED",
            "@size": "50539",
            "@ref": "gr3",
            "@mimetype": "image/jpeg"
          },
          {
            "@category": "standard",
            "@height": "690",
            "@width": "659",
            "@_fa": "true",
            "$": "https://api.elsevier.com/content/object/eid/1-s2.0-S0926860X15302866-gr30.jpg?httpAccept=%2A%2F%2A",
            "@multimediatype": "JPEG image file",
            "@type": "IMAGE-DOWNSAMPLED",
            "@size": "87258",
            "@ref": "gr30",
            "@mimetype": "image/jpeg"
          },
          {
            "@category": "standard",
            "@height": "505",
            "@width": "753",
            "@_fa": "true",
            "$": "https://api.elsevier.com/content/object/eid/1-s2.0-S0926860X15302866-gr31.jpg?httpAccept=%2A%2F%2A",
            "@multimediatype": "JPEG image file",
            "@type": "IMAGE-DOWNSAMPLED",
            "@size": "89360",
            "@ref": "gr31",
            "@mimetype": "image/jpeg"
          },
          {
            "@category": "standard",
            "@height": "279",
            "@width": "565",
            "@_fa": "true",
            "$": "https://api.elsevier.com/content/object/eid/1-s2.0-S0926860X15302866-gr32.jpg?httpAccept=%2A%2F%2A",
            "@multimediatype": "JPEG image file",
            "@type": "IMAGE-DOWNSAMPLED",
            "@size": "49650",
            "@ref": "gr32",
            "@mimetype": "image/jpeg"
          },
          {
            "@category": "standard",
            "@height": "551",
            "@width": "659",
            "@_fa": "true",
            "$": "https://api.elsevier.com/content/object/eid/1-s2.0-S0926860X15302866-gr33.jpg?httpAccept=%2A%2F%2A",
            "@multimediatype": "JPEG image file",
            "@type": "IMAGE-DOWNSAMPLED",
            "@size": "84287",
            "@ref": "gr33",
            "@mimetype": "image/jpeg"
          },
          {
            "@category": "standard",
            "@height": "538",
            "@width": "659",
            "@_fa": "true",
            "$": "https://api.elsevier.com/content/object/eid/1-s2.0-S0926860X15302866-gr34.jpg?httpAccept=%2A%2F%2A",
            "@multimediatype": "JPEG image file",
            "@type": "IMAGE-DOWNSAMPLED",
            "@size": "79262",
            "@ref": "gr34",
            "@mimetype": "image/jpeg"
          },
          {
            "@category": "standard",
            "@height": "496",
            "@width": "376",
            "@_fa": "true",
            "$": "https://api.elsevier.com/content/object/eid/1-s2.0-S0926860X15302866-gr35.jpg?httpAccept=%2A%2F%2A",
            "@multimediatype": "JPEG image file",
            "@type": "IMAGE-DOWNSAMPLED",
            "@size": "44416",
            "@ref": "gr35",
            "@mimetype": "image/jpeg"
          },
          {
            "@category": "standard",
            "@height": "439",
            "@width": "565",
            "@_fa": "true",
            "$": "https://api.elsevier.com/content/object/eid/1-s2.0-S0926860X15302866-gr36.jpg?httpAccept=%2A%2F%2A",
            "@multimediatype": "JPEG image file",
            "@type": "IMAGE-DOWNSAMPLED",
            "@size": "70049",
            "@ref": "gr36",
            "@mimetype": "image/jpeg"
          },
          {
            "@category": "standard",
            "@height": "544",
            "@width": "753",
            "@_fa": "true",
            "$": "https://api.elsevier.com/content/object/eid/1-s2.0-S0926860X15302866-gr37.jpg?httpAccept=%2A%2F%2A",
            "@multimediatype": "JPEG image file",
            "@type": "IMAGE-DOWNSAMPLED",
            "@size": "78163",
            "@ref": "gr37",
            "@mimetype": "image/jpeg"
          },
          {
            "@category": "standard",
            "@height": "279",
            "@width": "565",
            "@_fa": "true",
            "$": "https://api.elsevier.com/content/object/eid/1-s2.0-S0926860X15302866-gr4.jpg?httpAccept=%2A%2F%2A",
            "@multimediatype": "JPEG image file",
            "@type": "IMAGE-DOWNSAMPLED",
            "@size": "75860",
            "@ref": "gr4",
            "@mimetype": "image/jpeg"
          },
          {
            "@category": "standard",
            "@height": "356",
            "@width": "565",
            "@_fa": "true",
            "$": "https://api.elsevier.com/content/object/eid/1-s2.0-S0926860X15302866-gr5.jpg?httpAccept=%2A%2F%2A",
            "@multimediatype": "JPEG image file",
            "@type": "IMAGE-DOWNSAMPLED",
            "@size": "70778",
            "@ref": "gr5",
            "@mimetype": "image/jpeg"
          },
          {
            "@category": "standard",
            "@height": "491",
            "@width": "565",
            "@_fa": "true",
            "$": "https://api.elsevier.com/content/object/eid/1-s2.0-S0926860X15302866-gr6.jpg?httpAccept=%2A%2F%2A",
            "@multimediatype": "JPEG image file",
            "@type": "IMAGE-DOWNSAMPLED",
            "@size": "101270",
            "@ref": "gr6",
            "@mimetype": "image/jpeg"
          },
          {
            "@category": "standard",
            "@height": "617",
            "@width": "489",
            "@_fa": "true",
            "$": "https://api.elsevier.com/content/object/eid/1-s2.0-S0926860X15302866-gr7.jpg?httpAccept=%2A%2F%2A",
            "@multimediatype": "JPEG image file",
            "@type": "IMAGE-DOWNSAMPLED",
            "@size": "108040",
            "@ref": "gr7",
            "@mimetype": "image/jpeg"
          },
          {
            "@category": "standard",
            "@height": "482",
            "@width": "527",
            "@_fa": "true",
            "$": "https://api.elsevier.com/content/object/eid/1-s2.0-S0926860X15302866-gr8.jpg?httpAccept=%2A%2F%2A",
            "@multimediatype": "JPEG image file",
            "@type": "IMAGE-DOWNSAMPLED",
            "@size": "103356",
            "@ref": "gr8",
            "@mimetype": "image/jpeg"
          },
          {
            "@category": "standard",
            "@height": "269",
            "@width": "470",
            "@_fa": "true",
            "$": "https://api.elsevier.com/content/object/eid/1-s2.0-S0926860X15302866-gr9.jpg?httpAccept=%2A%2F%2A",
            "@multimediatype": "JPEG image file",
            "@type": "IMAGE-DOWNSAMPLED",
            "@size": "36175",
            "@ref": "gr9",
            "@mimetype": "image/jpeg"
          },
          {
            "@category": "high",
            "@height": "886",
            "@width": "2213",
            "@_fa": "true",
            "$": "https://api.elsevier.com/content/object/eid/1-s2.0-S0926860X15302866-fx1_lrg.jpg?httpAccept=%2A%2F%2A",
            "@multimediatype": "JPEG image file",
            "@type": "IMAGE-HIGH-RES",
            "@size": "133698",
            "@ref": "fx1",
            "@mimetype": "image/jpeg"
          },
          {
            "@category": "high",
            "@height": "1708",
            "@width": "2167",
            "@_fa": "true",
            "$": "https://api.elsevier.com/content/object/eid/1-s2.0-S0926860X15302866-gr1_lrg.jpg?httpAccept=%2A%2F%2A",
            "@multimediatype": "JPEG image file",
            "@type": "IMAGE-HIGH-RES",
            "@size": "264921",
            "@ref": "gr1",
            "@mimetype": "image/jpeg"
          },
          {
            "@category": "high",
            "@height": "1299",
            "@width": "2083",
            "@_fa": "true",
            "$": "https://api.elsevier.com/content/object/eid/1-s2.0-S0926860X15302866-gr10_lrg.jpg?httpAccept=%2A%2F%2A",
            "@multimediatype": "JPEG image file",
            "@type": "IMAGE-HIGH-RES",
            "@size": "338670",
            "@ref": "gr10",
            "@mimetype": "image/jpeg"
          },
          {
            "@category": "high",
            "@height": "2021",
            "@width": "2500",
            "@_fa": "true",
            "$": "https://api.elsevier.com/content/object/eid/1-s2.0-S0926860X15302866-gr11_lrg.jpg?httpAccept=%2A%2F%2A",
            "@multimediatype": "JPEG image file",
            "@type": "IMAGE-HIGH-RES",
            "@size": "951896",
            "@ref": "gr11",
            "@mimetype": "image/jpeg"
          },
          {
            "@category": "high",
            "@height": "1972",
            "@width": "2500",
            "@_fa": "true",
            "$": "https://api.elsevier.com/content/object/eid/1-s2.0-S0926860X15302866-gr12_lrg.jpg?httpAccept=%2A%2F%2A",
            "@multimediatype": "JPEG image file",
            "@type": "IMAGE-HIGH-RES",
            "@size": "1055056",
            "@ref": "gr12",
            "@mimetype": "image/jpeg"
          },
          {
            "@category": "high",
            "@height": "1910",
            "@width": "2333",
            "@_fa": "true",
            "$": "https://api.elsevier.com/content/object/eid/1-s2.0-S0926860X15302866-gr13_lrg.jpg?httpAccept=%2A%2F%2A",
            "@multimediatype": "JPEG image file",
            "@type": "IMAGE-HIGH-RES",
            "@size": "515395",
            "@ref": "gr13",
            "@mimetype": "image/jpeg"
          },
          {
            "@category": "high",
            "@height": "1479",
            "@width": "2083",
            "@_fa": "true",
            "$": "https://api.elsevier.com/content/object/eid/1-s2.0-S0926860X15302866-gr14_lrg.jpg?httpAccept=%2A%2F%2A",
            "@multimediatype": "JPEG image file",
            "@type": "IMAGE-HIGH-RES",
            "@size": "382941",
            "@ref": "gr14",
            "@mimetype": "image/jpeg"
          },
          {
            "@category": "high",
            "@height": "3743",
            "@width": "2500",
            "@_fa": "true",
            "$": "https://api.elsevier.com/content/object/eid/1-s2.0-S0926860X15302866-gr15_lrg.jpg?httpAccept=%2A%2F%2A",
            "@multimediatype": "JPEG image file",
            "@type": "IMAGE-HIGH-RES",
            "@size": "1268351",
            "@ref": "gr15",
            "@mimetype": "image/jpeg"
          },
          {
            "@category": "high",
            "@height": "1556",
            "@width": "2500",
            "@_fa": "true",
            "$": "https://api.elsevier.com/content/object/eid/1-s2.0-S0926860X15302866-gr16_lrg.jpg?httpAccept=%2A%2F%2A",
            "@multimediatype": "JPEG image file",
            "@type": "IMAGE-HIGH-RES",
            "@size": "468112",
            "@ref": "gr16",
            "@mimetype": "image/jpeg"
          },
          {
            "@category": "high",
            "@height": "1458",
            "@width": "2917",
            "@_fa": "true",
            "$": "https://api.elsevier.com/content/object/eid/1-s2.0-S0926860X15302866-gr17_lrg.jpg?httpAccept=%2A%2F%2A",
            "@multimediatype": "JPEG image file",
            "@type": "IMAGE-HIGH-RES",
            "@size": "867052",
            "@ref": "gr17",
            "@mimetype": "image/jpeg"
          },
          {
            "@category": "high",
            "@height": "3090",
            "@width": "3333",
            "@_fa": "true",
            "$": "https://api.elsevier.com/content/object/eid/1-s2.0-S0926860X15302866-gr18_lrg.jpg?httpAccept=%2A%2F%2A",
            "@multimediatype": "JPEG image file",
            "@type": "IMAGE-HIGH-RES",
            "@size": "716941",
            "@ref": "gr18",
            "@mimetype": "image/jpeg"
          },
          {
            "@category": "high",
            "@height": "2493",
            "@width": "3333",
            "@_fa": "true",
            "$": "https://api.elsevier.com/content/object/eid/1-s2.0-S0926860X15302866-gr19_lrg.jpg?httpAccept=%2A%2F%2A",
            "@multimediatype": "JPEG image file",
            "@type": "IMAGE-HIGH-RES",
            "@size": "872319",
            "@ref": "gr19",
            "@mimetype": "image/jpeg"
          },
          {
            "@category": "high",
            "@height": "1382",
            "@width": "1667",
            "@_fa": "true",
            "$": "https://api.elsevier.com/content/object/eid/1-s2.0-S0926860X15302866-gr2_lrg.jpg?httpAccept=%2A%2F%2A",
            "@multimediatype": "JPEG image file",
            "@type": "IMAGE-HIGH-RES",
            "@size": "254308",
            "@ref": "gr2",
            "@mimetype": "image/jpeg"
          },
          {
            "@category": "high",
            "@height": "1472",
            "@width": "2083",
            "@_fa": "true",
            "$": "https://api.elsevier.com/content/object/eid/1-s2.0-S0926860X15302866-gr20_lrg.jpg?httpAccept=%2A%2F%2A",
            "@multimediatype": "JPEG image file",
            "@type": "IMAGE-HIGH-RES",
            "@size": "253385",
            "@ref": "gr20",
            "@mimetype": "image/jpeg"
          },
          {
            "@category": "high",
            "@height": "3465",
            "@width": "2167",
            "@_fa": "true",
            "$": "https://api.elsevier.com/content/object/eid/1-s2.0-S0926860X15302866-gr21_lrg.jpg?httpAccept=%2A%2F%2A",
            "@multimediatype": "JPEG image file",
            "@type": "IMAGE-HIGH-RES",
            "@size": "504567",
            "@ref": "gr21",
            "@mimetype": "image/jpeg"
          },
          {
            "@category": "high",
            "@height": "2722",
            "@width": "2083",
            "@_fa": "true",
            "$": "https://api.elsevier.com/content/object/eid/1-s2.0-S0926860X15302866-gr22_lrg.jpg?httpAccept=%2A%2F%2A",
            "@multimediatype": "JPEG image file",
            "@type": "IMAGE-HIGH-RES",
            "@size": "1073987",
            "@ref": "gr22",
            "@mimetype": "image/jpeg"
          },
          {
            "@category": "high",
            "@height": "2278",
            "@width": "3333",
            "@_fa": "true",
            "$": "https://api.elsevier.com/content/object/eid/1-s2.0-S0926860X15302866-gr23_lrg.jpg?httpAccept=%2A%2F%2A",
            "@multimediatype": "JPEG image file",
            "@type": "IMAGE-HIGH-RES",
            "@size": "639840",
            "@ref": "gr23",
            "@mimetype": "image/jpeg"
          },
          {
            "@category": "high",
            "@height": "2201",
            "@width": "3333",
            "@_fa": "true",
            "$": "https://api.elsevier.com/content/object/eid/1-s2.0-S0926860X15302866-gr24_lrg.jpg?httpAccept=%2A%2F%2A",
            "@multimediatype": "JPEG image file",
            "@type": "IMAGE-HIGH-RES",
            "@size": "930420",
            "@ref": "gr24",
            "@mimetype": "image/jpeg"
          },
          {
            "@category": "high",
            "@height": "1951",
            "@width": "1667",
            "@_fa": "true",
            "$": "https://api.elsevier.com/content/object/eid/1-s2.0-S0926860X15302866-gr25_lrg.jpg?httpAccept=%2A%2F%2A",
            "@multimediatype": "JPEG image file",
            "@type": "IMAGE-HIGH-RES",
            "@size": "341463",
            "@ref": "gr25",
            "@mimetype": "image/jpeg"
          },
          {
            "@category": "high",
            "@height": "4333",
            "@width": "3264",
            "@_fa": "true",
            "$": "https://api.elsevier.com/content/object/eid/1-s2.0-S0926860X15302866-gr26_lrg.jpg?httpAccept=%2A%2F%2A",
            "@multimediatype": "JPEG image file",
            "@type": "IMAGE-HIGH-RES",
            "@size": "801018",
            "@ref": "gr26",
            "@mimetype": "image/jpeg"
          },
          {
            "@category": "high",
            "@height": "1243",
            "@width": "2167",
            "@_fa": "true",
            "$": "https://api.elsevier.com/content/object/eid/1-s2.0-S0926860X15302866-gr27_lrg.jpg?httpAccept=%2A%2F%2A",
            "@multimediatype": "JPEG image file",
            "@type": "IMAGE-HIGH-RES",
            "@size": "206303",
            "@ref": "gr27",
            "@mimetype": "image/jpeg"
          },
          {
            "@category": "high",
            "@height": "1396",
            "@width": "2167",
            "@_fa": "true",
            "$": "https://api.elsevier.com/content/object/eid/1-s2.0-S0926860X15302866-gr28_lrg.jpg?httpAccept=%2A%2F%2A",
            "@multimediatype": "JPEG image file",
            "@type": "IMAGE-HIGH-RES",
            "@size": "268121",
            "@ref": "gr28",
            "@mimetype": "image/jpeg"
          },
          {
            "@category": "high",
            "@height": "736",
            "@width": "1417",
            "@_fa": "true",
            "$": "https://api.elsevier.com/content/object/eid/1-s2.0-S0926860X15302866-gr29_lrg.jpg?httpAccept=%2A%2F%2A",
            "@multimediatype": "JPEG image file",
            "@type": "IMAGE-HIGH-RES",
            "@size": "161161",
            "@ref": "gr29",
            "@mimetype": "image/jpeg"
          },
          {
            "@category": "high",
            "@height": "979",
            "@width": "2917",
            "@_fa": "true",
            "$": "https://api.elsevier.com/content/object/eid/1-s2.0-S0926860X15302866-gr3_lrg.jpg?httpAccept=%2A%2F%2A",
            "@multimediatype": "JPEG image file",
            "@type": "IMAGE-HIGH-RES",
            "@size": "489962",
            "@ref": "gr3",
            "@mimetype": "image/jpeg"
          },
          {
            "@category": "high",
            "@height": "3056",
            "@width": "2917",
            "@_fa": "true",
            "$": "https://api.elsevier.com/content/object/eid/1-s2.0-S0926860X15302866-gr30_lrg.jpg?httpAccept=%2A%2F%2A",
            "@multimediatype": "JPEG image file",
            "@type": "IMAGE-HIGH-RES",
            "@size": "706799",
            "@ref": "gr30",
            "@mimetype": "image/jpeg"
          },
          {
            "@category": "high",
            "@height": "2236",
            "@width": "3333",
            "@_fa": "true",
            "$": "https://api.elsevier.com/content/object/eid/1-s2.0-S0926860X15302866-gr31_lrg.jpg?httpAccept=%2A%2F%2A",
            "@multimediatype": "JPEG image file",
            "@type": "IMAGE-HIGH-RES",
            "@size": "769296",
            "@ref": "gr31",
            "@mimetype": "image/jpeg"
          },
          {
            "@category": "high",
            "@height": "1236",
            "@width": "2500",
            "@_fa": "true",
            "$": "https://api.elsevier.com/content/object/eid/1-s2.0-S0926860X15302866-gr32_lrg.jpg?httpAccept=%2A%2F%2A",
            "@multimediatype": "JPEG image file",
            "@type": "IMAGE-HIGH-RES",
            "@size": "465445",
            "@ref": "gr32",
            "@mimetype": "image/jpeg"
          },
          {
            "@category": "high",
            "@height": "2438",
            "@width": "2917",
            "@_fa": "true",
            "$": "https://api.elsevier.com/content/object/eid/1-s2.0-S0926860X15302866-gr33_lrg.jpg?httpAccept=%2A%2F%2A",
            "@multimediatype": "JPEG image file",
            "@type": "IMAGE-HIGH-RES",
            "@size": "771826",
            "@ref": "gr33",
            "@mimetype": "image/jpeg"
          },
          {
            "@category": "high",
            "@height": "2382",
            "@width": "2917",
            "@_fa": "true",
            "$": "https://api.elsevier.com/content/object/eid/1-s2.0-S0926860X15302866-gr34_lrg.jpg?httpAccept=%2A%2F%2A",
            "@multimediatype": "JPEG image file",
            "@type": "IMAGE-HIGH-RES",
            "@size": "638247",
            "@ref": "gr34",
            "@mimetype": "image/jpeg"
          },
          {
            "@category": "high",
            "@height": "2201",
            "@width": "1667",
            "@_fa": "true",
            "$": "https://api.elsevier.com/content/object/eid/1-s2.0-S0926860X15302866-gr35_lrg.jpg?httpAccept=%2A%2F%2A",
            "@multimediatype": "JPEG image file",
            "@type": "IMAGE-HIGH-RES",
            "@size": "302795",
            "@ref": "gr35",
            "@mimetype": "image/jpeg"
          },
          {
            "@category": "high",
            "@height": "1944",
            "@width": "2500",
            "@_fa": "true",
            "$": "https://api.elsevier.com/content/object/eid/1-s2.0-S0926860X15302866-gr36_lrg.jpg?httpAccept=%2A%2F%2A",
            "@multimediatype": "JPEG image file",
            "@type": "IMAGE-HIGH-RES",
            "@size": "586092",
            "@ref": "gr36",
            "@mimetype": "image/jpeg"
          },
          {
            "@category": "high",
            "@height": "2410",
            "@width": "3333",
            "@_fa": "true",
            "$": "https://api.elsevier.com/content/object/eid/1-s2.0-S0926860X15302866-gr37_lrg.jpg?httpAccept=%2A%2F%2A",
            "@multimediatype": "JPEG image file",
            "@type": "IMAGE-HIGH-RES",
            "@size": "632885",
            "@ref": "gr37",
            "@mimetype": "image/jpeg"
          },
          {
            "@category": "high",
            "@height": "1236",
            "@width": "2500",
            "@_fa": "true",
            "$": "https://api.elsevier.com/content/object/eid/1-s2.0-S0926860X15302866-gr4_lrg.jpg?httpAccept=%2A%2F%2A",
            "@multimediatype": "JPEG image file",
            "@type": "IMAGE-HIGH-RES",
            "@size": "640516",
            "@ref": "gr4",
            "@mimetype": "image/jpeg"
          },
          {
            "@category": "high",
            "@height": "1576",
            "@width": "2500",
            "@_fa": "true",
            "$": "https://api.elsevier.com/content/object/eid/1-s2.0-S0926860X15302866-gr5_lrg.jpg?httpAccept=%2A%2F%2A",
            "@multimediatype": "JPEG image file",
            "@type": "IMAGE-HIGH-RES",
            "@size": "557436",
            "@ref": "gr5",
            "@mimetype": "image/jpeg"
          },
          {
            "@category": "high",
            "@height": "2174",
            "@width": "2500",
            "@_fa": "true",
            "$": "https://api.elsevier.com/content/object/eid/1-s2.0-S0926860X15302866-gr6_lrg.jpg?httpAccept=%2A%2F%2A",
            "@multimediatype": "JPEG image file",
            "@type": "IMAGE-HIGH-RES",
            "@size": "859777",
            "@ref": "gr6",
            "@mimetype": "image/jpeg"
          },
          {
            "@category": "high",
            "@height": "2736",
            "@width": "2167",
            "@_fa": "true",
            "$": "https://api.elsevier.com/content/object/eid/1-s2.0-S0926860X15302866-gr7_lrg.jpg?httpAccept=%2A%2F%2A",
            "@multimediatype": "JPEG image file",
            "@type": "IMAGE-HIGH-RES",
            "@size": "843494",
            "@ref": "gr7",
            "@mimetype": "image/jpeg"
          },
          {
            "@category": "high",
            "@height": "2132",
            "@width": "2333",
            "@_fa": "true",
            "$": "https://api.elsevier.com/content/object/eid/1-s2.0-S0926860X15302866-gr8_lrg.jpg?httpAccept=%2A%2F%2A",
            "@multimediatype": "JPEG image file",
            "@type": "IMAGE-HIGH-RES",
            "@size": "941697",
            "@ref": "gr8",
            "@mimetype": "image/jpeg"
          },
          {
            "@category": "high",
            "@height": "1194",
            "@width": "2083",
            "@_fa": "true",
            "$": "https://api.elsevier.com/content/object/eid/1-s2.0-S0926860X15302866-gr9_lrg.jpg?httpAccept=%2A%2F%2A",
            "@multimediatype": "JPEG image file",
            "@type": "IMAGE-HIGH-RES",
            "@size": "287033",
            "@ref": "gr9",
            "@mimetype": "image/jpeg"
          },
          {
            "@category": "thumbnail",
            "@height": "30",
            "@width": "384",
            "@_fa": "true",
            "$": "https://api.elsevier.com/content/object/eid/1-s2.0-S0926860X15302866-si1.gif?httpAccept=%2A%2F%2A",
            "@multimediatype": "GIF image file",
            "@type": "ALTIMG",
            "@size": "1465",
            "@ref": "si1",
            "@mimetype": "image/gif"
          },
          {
            "@category": "thumbnail",
            "@height": "31",
            "@width": "152",
            "@_fa": "true",
            "$": "https://api.elsevier.com/content/object/eid/1-s2.0-S0926860X15302866-si2.gif?httpAccept=%2A%2F%2A",
            "@multimediatype": "GIF image file",
            "@type": "ALTIMG",
            "@size": "686",
            "@ref": "si2",
            "@mimetype": "image/gif"
          },
          {
            "@category": "thumbnail",
            "@height": "19",
            "@width": "176",
            "@_fa": "true",
            "$": "https://api.elsevier.com/content/object/eid/1-s2.0-S0926860X15302866-si3.gif?httpAccept=%2A%2F%2A",
            "@multimediatype": "GIF image file",
            "@type": "ALTIMG",
            "@size": "695",
            "@ref": "si3",
            "@mimetype": "image/gif"
          },
          {
            "@category": "thumbnail",
            "@_fa": "true",
            "$": "https://api.elsevier.com/content/object/eid/1-s2.0-S0926860X15302866-Thuy_Duong_Nguyen_Phan_supported_catalyst_2016_P15.jpg?httpAccept=%2A%2F%2A",
            "@multimediatype": "JPEG image file",
            "@type": "ALTIMG",
            "@size": "589822",
            "@ref": "Thuy_Duong_Nguyen_Phan_supported_catalyst_2016_P15",
            "@mimetype": "image/jpeg"
          },
          {
            "@category": "thumbnail",
            "@_fa": "true",
            "$": "https://api.elsevier.com/content/object/eid/1-s2.0-S0926860X15302866-Thuy_Duong_Nguyen_Phan_supported_catalyst_2016_P36.jpg?httpAccept=%2A%2F%2A",
            "@multimediatype": "JPEG image file",
            "@type": "ALTIMG",
            "@size": "312228",
            "@ref": "Thuy_Duong_Nguyen_Phan_supported_catalyst_2016_P36",
            "@mimetype": "image/jpeg"
          },
          {
            "@category": "thumbnail",
            "@_fa": "true",
            "$": "https://api.elsevier.com/content/object/eid/1-s2.0-S0926860X15302866-Thuy_Duong_Nguyen_Phan_supported_catalyst_2016_P14.jpg?httpAccept=%2A%2F%2A",
            "@multimediatype": "JPEG image file",
            "@type": "ALTIMG",
            "@size": "661572",
            "@ref": "Thuy_Duong_Nguyen_Phan_supported_catalyst_2016_P14",
            "@mimetype": "image/jpeg"
          },
          {
            "@category": "thumbnail",
            "@_fa": "true",
            "$": "https://api.elsevier.com/content/object/eid/1-s2.0-S0926860X15302866-Thuy_Duong_Nguyen_Phan_supported_catalyst_2016_P13.jpg?httpAccept=%2A%2F%2A",
            "@multimediatype": "JPEG image file",
            "@type": "ALTIMG",
            "@size": "481631",
            "@ref": "Thuy_Duong_Nguyen_Phan_supported_catalyst_2016_P13",
            "@mimetype": "image/jpeg"
          },
          {
            "@category": "thumbnail",
            "@_fa": "true",
            "$": "https://api.elsevier.com/content/object/eid/1-s2.0-S0926860X15302866-Thuy_Duong_Nguyen_Phan_supported_catalyst_2016_P12.jpg?httpAccept=%2A%2F%2A",
            "@multimediatype": "JPEG image file",
            "@type": "ALTIMG",
            "@size": "491176",
            "@ref": "Thuy_Duong_Nguyen_Phan_supported_catalyst_2016_P12",
            "@mimetype": "image/jpeg"
          },
          {
            "@category": "thumbnail",
            "@_fa": "true",
            "$": "https://api.elsevier.com/content/object/eid/1-s2.0-S0926860X15302866-Thuy_Duong_Nguyen_Phan_supported_catalyst_2016_P50.jpg?httpAccept=%2A%2F%2A",
            "@multimediatype": "JPEG image file",
            "@type": "ALTIMG",
            "@size": "709920",
            "@ref": "Thuy_Duong_Nguyen_Phan_supported_catalyst_2016_P50",
            "@mimetype": "image/jpeg"
          },
          {
            "@category": "thumbnail",
            "@_fa": "true",
            "$": "https://api.elsevier.com/content/object/eid/1-s2.0-S0926860X15302866-Thuy_Duong_Nguyen_Phan_supported_catalyst_2016_P26.jpg?httpAccept=%2A%2F%2A",
            "@multimediatype": "JPEG image file",
            "@type": "ALTIMG",
            "@size": "648068",
            "@ref": "Thuy_Duong_Nguyen_Phan_supported_catalyst_2016_P26",
            "@mimetype": "image/jpeg"
          },
          {
            "@category": "thumbnail",
            "@_fa": "true",
            "$": "https://api.elsevier.com/content/object/eid/1-s2.0-S0926860X15302866-Thuy_Duong_Nguyen_Phan_supported_catalyst_2016_P08.jpg?httpAccept=%2A%2F%2A",
            "@multimediatype": "JPEG image file",
            "@type": "ALTIMG",
            "@size": "572091",
            "@ref": "Thuy_Duong_Nguyen_Phan_supported_catalyst_2016_P08",
            "@mimetype": "image/jpeg"
          },
          {
            "@category": "thumbnail",
            "@_fa": "true",
            "$": "https://api.elsevier.com/content/object/eid/1-s2.0-S0926860X15302866-Thuy_Duong_Nguyen_Phan_supported_catalyst_2016_P60.jpg?httpAccept=%2A%2F%2A",
            "@multimediatype": "JPEG image file",
            "@type": "ALTIMG",
            "@size": "543104",
            "@ref": "Thuy_Duong_Nguyen_Phan_supported_catalyst_2016_P60",
            "@mimetype": "image/jpeg"
          },
          {
            "@category": "thumbnail",
            "@_fa": "true",
            "$": "https://api.elsevier.com/content/object/eid/1-s2.0-S0926860X15302866-Thuy_Duong_Nguyen_Phan_supported_catalyst_2016_P25.jpg?httpAccept=%2A%2F%2A",
            "@multimediatype": "JPEG image file",
            "@type": "ALTIMG",
            "@size": "593121",
            "@ref": "Thuy_Duong_Nguyen_Phan_supported_catalyst_2016_P25",
            "@mimetype": "image/jpeg"
          },
          {
            "@category": "thumbnail",
            "@_fa": "true",
            "$": "https://api.elsevier.com/content/object/eid/1-s2.0-S0926860X15302866-Thuy_Duong_Nguyen_Phan_supported_catalyst_2016_P24.jpg?httpAccept=%2A%2F%2A",
            "@multimediatype": "JPEG image file",
            "@type": "ALTIMG",
            "@size": "760734",
            "@ref": "Thuy_Duong_Nguyen_Phan_supported_catalyst_2016_P24",
            "@mimetype": "image/jpeg"
          },
          {
            "@category": "thumbnail",
            "@_fa": "true",
            "$": "https://api.elsevier.com/content/object/eid/1-s2.0-S0926860X15302866-Thuy_Duong_Nguyen_Phan_supported_catalyst_2016_P53.jpg?httpAccept=%2A%2F%2A",
            "@multimediatype": "JPEG image file",
            "@type": "ALTIMG",
            "@size": "401777",
            "@ref": "Thuy_Duong_Nguyen_Phan_supported_catalyst_2016_P53",
            "@mimetype": "image/jpeg"
          },
          {
            "@category": "thumbnail",
            "@_fa": "true",
            "$": "https://api.elsevier.com/content/object/eid/1-s2.0-S0926860X15302866-Thuy_Duong_Nguyen_Phan_supported_catalyst_2016_P67.jpg?httpAccept=%2A%2F%2A",
            "@multimediatype": "JPEG image file",
            "@type": "ALTIMG",
            "@size": "536926",
            "@ref": "Thuy_Duong_Nguyen_Phan_supported_catalyst_2016_P67",
            "@mimetype": "image/jpeg"
          },
          {
            "@category": "thumbnail",
            "@_fa": "true",
            "$": "https://api.elsevier.com/content/object/eid/1-s2.0-S0926860X15302866-Thuy_Duong_Nguyen_Phan_supported_catalyst_2016_P19.jpg?httpAccept=%2A%2F%2A",
            "@multimediatype": "JPEG image file",
            "@type": "ALTIMG",
            "@size": "606245",
            "@ref": "Thuy_Duong_Nguyen_Phan_supported_catalyst_2016_P19",
            "@mimetype": "image/jpeg"
          },
          {
            "@category": "thumbnail",
            "@_fa": "true",
            "$": "https://api.elsevier.com/content/object/eid/1-s2.0-S0926860X15302866-Thuy_Duong_Nguyen_Phan_supported_catalyst_2016_P10.jpg?httpAccept=%2A%2F%2A",
            "@multimediatype": "JPEG image file",
            "@type": "ALTIMG",
            "@size": "618819",
            "@ref": "Thuy_Duong_Nguyen_Phan_supported_catalyst_2016_P10",
            "@mimetype": "image/jpeg"
          },
          {
            "@category": "thumbnail",
            "@_fa": "true",
            "$": "https://api.elsevier.com/content/object/eid/1-s2.0-S0926860X15302866-Thuy_Duong_Nguyen_Phan_supported_catalyst_2016_P55.jpg?httpAccept=%2A%2F%2A",
            "@multimediatype": "JPEG image file",
            "@type": "ALTIMG",
            "@size": "542520",
            "@ref": "Thuy_Duong_Nguyen_Phan_supported_catalyst_2016_P55",
            "@mimetype": "image/jpeg"
          },
          {
            "@category": "thumbnail",
            "@_fa": "true",
            "$": "https://api.elsevier.com/content/object/eid/1-s2.0-S0926860X15302866-Thuy_Duong_Nguyen_Phan_supported_catalyst_2016_P71.jpg?httpAccept=%2A%2F%2A",
            "@multimediatype": "JPEG image file",
            "@type": "ALTIMG",
            "@size": "177803",
            "@ref": "Thuy_Duong_Nguyen_Phan_supported_catalyst_2016_P71",
            "@mimetype": "image/jpeg"
          },
          {
            "@category": "thumbnail",
            "@_fa": "true",
            "$": "https://api.elsevier.com/content/object/eid/1-s2.0-S0926860X15302866-Thuy_Duong_Nguyen_Phan_supported_catalyst_2016_P06.jpg?httpAccept=%2A%2F%2A",
            "@multimediatype": "JPEG image file",
            "@type": "ALTIMG",
            "@size": "489794",
            "@ref": "Thuy_Duong_Nguyen_Phan_supported_catalyst_2016_P06",
            "@mimetype": "image/jpeg"
          },
          {
            "@category": "thumbnail",
            "@_fa": "true",
            "$": "https://api.elsevier.com/content/object/eid/1-s2.0-S0926860X15302866-Thuy_Duong_Nguyen_Phan_supported_catalyst_2016_P28.jpg?httpAccept=%2A%2F%2A",
            "@multimediatype": "JPEG image file",
            "@type": "ALTIMG",
            "@size": "741357",
            "@ref": "Thuy_Duong_Nguyen_Phan_supported_catalyst_2016_P28",
            "@mimetype": "image/jpeg"
          },
          {
            "@category": "thumbnail",
            "@_fa": "true",
            "$": "https://api.elsevier.com/content/object/eid/1-s2.0-S0926860X15302866-Thuy_Duong_Nguyen_Phan_supported_catalyst_2016_P44.jpg?httpAccept=%2A%2F%2A",
            "@multimediatype": "JPEG image file",
            "@type": "ALTIMG",
            "@size": "492048",
            "@ref": "Thuy_Duong_Nguyen_Phan_supported_catalyst_2016_P44",
            "@mimetype": "image/jpeg"
          },
          {
            "@category": "thumbnail",
            "@_fa": "true",
            "$": "https://api.elsevier.com/content/object/eid/1-s2.0-S0926860X15302866-Thuy_Duong_Nguyen_Phan_supported_catalyst_2016_P18.jpg?httpAccept=%2A%2F%2A",
            "@multimediatype": "JPEG image file",
            "@type": "ALTIMG",
            "@size": "512699",
            "@ref": "Thuy_Duong_Nguyen_Phan_supported_catalyst_2016_P18",
            "@mimetype": "image/jpeg"
          },
          {
            "@category": "thumbnail",
            "@_fa": "true",
            "$": "https://api.elsevier.com/content/object/eid/1-s2.0-S0926860X15302866-Thuy_Duong_Nguyen_Phan_supported_catalyst_2016_P09.jpg?httpAccept=%2A%2F%2A",
            "@multimediatype": "JPEG image file",
            "@type": "ALTIMG",
            "@size": "506486",
            "@ref": "Thuy_Duong_Nguyen_Phan_supported_catalyst_2016_P09",
            "@mimetype": "image/jpeg"
          },
          {
            "@category": "thumbnail",
            "@_fa": "true",
            "$": "https://api.elsevier.com/content/object/eid/1-s2.0-S0926860X15302866-Thuy_Duong_Nguyen_Phan_supported_catalyst_2016_P57.jpg?httpAccept=%2A%2F%2A",
            "@multimediatype": "JPEG image file",
            "@type": "ALTIMG",
            "@size": "476379",
            "@ref": "Thuy_Duong_Nguyen_Phan_supported_catalyst_2016_P57",
            "@mimetype": "image/jpeg"
          },
          {
            "@category": "thumbnail",
            "@_fa": "true",
            "$": "https://api.elsevier.com/content/object/eid/1-s2.0-S0926860X15302866-Thuy_Duong_Nguyen_Phan_supported_catalyst_2016_P58.jpg?httpAccept=%2A%2F%2A",
            "@multimediatype": "JPEG image file",
            "@type": "ALTIMG",
            "@size": "507203",
            "@ref": "Thuy_Duong_Nguyen_Phan_supported_catalyst_2016_P58",
            "@mimetype": "image/jpeg"
          },
          {
            "@category": "thumbnail",
            "@_fa": "true",
            "$": "https://api.elsevier.com/content/object/eid/1-s2.0-S0926860X15302866-Thuy_Duong_Nguyen_Phan_supported_catalyst_2016_P27.jpg?httpAccept=%2A%2F%2A",
            "@multimediatype": "JPEG image file",
            "@type": "ALTIMG",
            "@size": "717948",
            "@ref": "Thuy_Duong_Nguyen_Phan_supported_catalyst_2016_P27",
            "@mimetype": "image/jpeg"
          },
          {
            "@category": "thumbnail",
            "@_fa": "true",
            "$": "https://api.elsevier.com/content/object/eid/1-s2.0-S0926860X15302866-Thuy_Duong_Nguyen_Phan_supported_catalyst_2016_P49.jpg?httpAccept=%2A%2F%2A",
            "@multimediatype": "JPEG image file",
            "@type": "ALTIMG",
            "@size": "650978",
            "@ref": "Thuy_Duong_Nguyen_Phan_supported_catalyst_2016_P49",
            "@mimetype": "image/jpeg"
          },
          {
            "@category": "thumbnail",
            "@_fa": "true",
            "$": "https://api.elsevier.com/content/object/eid/1-s2.0-S0926860X15302866-Thuy_Duong_Nguyen_Phan_supported_catalyst_2016_P63.jpg?httpAccept=%2A%2F%2A",
            "@multimediatype": "JPEG image file",
            "@type": "ALTIMG",
            "@size": "489648",
            "@ref": "Thuy_Duong_Nguyen_Phan_supported_catalyst_2016_P63",
            "@mimetype": "image/jpeg"
          },
          {
            "@category": "thumbnail",
            "@_fa": "true",
            "$": "https://api.elsevier.com/content/object/eid/1-s2.0-S0926860X15302866-Thuy_Duong_Nguyen_Phan_supported_catalyst_2016_P05.jpg?httpAccept=%2A%2F%2A",
            "@multimediatype": "JPEG image file",
            "@type": "ALTIMG",
            "@size": "494601",
            "@ref": "Thuy_Duong_Nguyen_Phan_supported_catalyst_2016_P05",
            "@mimetype": "image/jpeg"
          },
          {
            "@category": "thumbnail",
            "@_fa": "true",
            "$": "https://api.elsevier.com/content/object/eid/1-s2.0-S0926860X15302866-Thuy_Duong_Nguyen_Phan_supported_catalyst_2016_P34.jpg?httpAccept=%2A%2F%2A",
            "@multimediatype": "JPEG image file",
            "@type": "ALTIMG",
            "@size": "740661",
            "@ref": "Thuy_Duong_Nguyen_Phan_supported_catalyst_2016_P34",
            "@mimetype": "image/jpeg"
          },
          {
            "@category": "thumbnail",
            "@_fa": "true",
            "$": "https://api.elsevier.com/content/object/eid/1-s2.0-S0926860X15302866-Thuy_Duong_Nguyen_Phan_supported_catalyst_2016_P56.jpg?httpAccept=%2A%2F%2A",
            "@multimediatype": "JPEG image file",
            "@type": "ALTIMG",
            "@size": "467872",
            "@ref": "Thuy_Duong_Nguyen_Phan_supported_catalyst_2016_P56",
            "@mimetype": "image/jpeg"
          },
          {
            "@category": "thumbnail",
            "@_fa": "true",
            "$": "https://api.elsevier.com/content/object/eid/1-s2.0-S0926860X15302866-Thuy_Duong_Nguyen_Phan_supported_catalyst_2016_P20.jpg?httpAccept=%2A%2F%2A",
            "@multimediatype": "JPEG image file",
            "@type": "ALTIMG",
            "@size": "555417",
            "@ref": "Thuy_Duong_Nguyen_Phan_supported_catalyst_2016_P20",
            "@mimetype": "image/jpeg"
          },
          {
            "@category": "thumbnail",
            "@_fa": "true",
            "$": "https://api.elsevier.com/content/object/eid/1-s2.0-S0926860X15302866-Thuy_Duong_Nguyen_Phan_supported_catalyst_2016_P40.jpg?httpAccept=%2A%2F%2A",
            "@multimediatype": "JPEG image file",
            "@type": "ALTIMG",
            "@size": "473522",
            "@ref": "Thuy_Duong_Nguyen_Phan_supported_catalyst_2016_P40",
            "@mimetype": "image/jpeg"
          },
          {
            "@category": "thumbnail",
            "@_fa": "true",
            "$": "https://api.elsevier.com/content/object/eid/1-s2.0-S0926860X15302866-Thuy_Duong_Nguyen_Phan_supported_catalyst_2016_P45.jpg?httpAccept=%2A%2F%2A",
            "@multimediatype": "JPEG image file",
            "@type": "ALTIMG",
            "@size": "424539",
            "@ref": "Thuy_Duong_Nguyen_Phan_supported_catalyst_2016_P45",
            "@mimetype": "image/jpeg"
          },
          {
            "@category": "thumbnail",
            "@_fa": "true",
            "$": "https://api.elsevier.com/content/object/eid/1-s2.0-S0926860X15302866-Thuy_Duong_Nguyen_Phan_supported_catalyst_2016_P01.jpg?httpAccept=%2A%2F%2A",
            "@multimediatype": "JPEG image file",
            "@type": "ALTIMG",
            "@size": "221309",
            "@ref": "Thuy_Duong_Nguyen_Phan_supported_catalyst_2016_P01",
            "@mimetype": "image/jpeg"
          },
          {
            "@category": "thumbnail",
            "@_fa": "true",
            "$": "https://api.elsevier.com/content/object/eid/1-s2.0-S0926860X15302866-Thuy_Duong_Nguyen_Phan_supported_catalyst_2016_P52.jpg?httpAccept=%2A%2F%2A",
            "@multimediatype": "JPEG image file",
            "@type": "ALTIMG",
            "@size": "502008",
            "@ref": "Thuy_Duong_Nguyen_Phan_supported_catalyst_2016_P52",
            "@mimetype": "image/jpeg"
          },
          {
            "@category": "thumbnail",
            "@_fa": "true",
            "$": "https://api.elsevier.com/content/object/eid/1-s2.0-S0926860X15302866-Thuy_Duong_Nguyen_Phan_supported_catalyst_2016_P54.jpg?httpAccept=%2A%2F%2A",
            "@multimediatype": "JPEG image file",
            "@type": "ALTIMG",
            "@size": "292785",
            "@ref": "Thuy_Duong_Nguyen_Phan_supported_catalyst_2016_P54",
            "@mimetype": "image/jpeg"
          },
          {
            "@category": "thumbnail",
            "@_fa": "true",
            "$": "https://api.elsevier.com/content/object/eid/1-s2.0-S0926860X15302866-Thuy_Duong_Nguyen_Phan_supported_catalyst_2016_P38.jpg?httpAccept=%2A%2F%2A",
            "@multimediatype": "JPEG image file",
            "@type": "ALTIMG",
            "@size": "601255",
            "@ref": "Thuy_Duong_Nguyen_Phan_supported_catalyst_2016_P38",
            "@mimetype": "image/jpeg"
          },
          {
            "@category": "thumbnail",
            "@_fa": "true",
            "$": "https://api.elsevier.com/content/object/eid/1-s2.0-S0926860X15302866-Thuy_Duong_Nguyen_Phan_supported_catalyst_2016_P64.jpg?httpAccept=%2A%2F%2A",
            "@multimediatype": "JPEG image file",
            "@type": "ALTIMG",
            "@size": "543403",
            "@ref": "Thuy_Duong_Nguyen_Phan_supported_catalyst_2016_P64",
            "@mimetype": "image/jpeg"
          },
          {
            "@category": "thumbnail",
            "@_fa": "true",
            "$": "https://api.elsevier.com/content/object/eid/1-s2.0-S0926860X15302866-Thuy_Duong_Nguyen_Phan_supported_catalyst_2016_P07.jpg?httpAccept=%2A%2F%2A",
            "@multimediatype": "JPEG image file",
            "@type": "ALTIMG",
            "@size": "554400",
            "@ref": "Thuy_Duong_Nguyen_Phan_supported_catalyst_2016_P07",
            "@mimetype": "image/jpeg"
          },
          {
            "@category": "thumbnail",
            "@_fa": "true",
            "$": "https://api.elsevier.com/content/object/eid/1-s2.0-S0926860X15302866-Thuy_Duong_Nguyen_Phan_supported_catalyst_2016_P21.jpg?httpAccept=%2A%2F%2A",
            "@multimediatype": "JPEG image file",
            "@type": "ALTIMG",
            "@size": "552213",
            "@ref": "Thuy_Duong_Nguyen_Phan_supported_catalyst_2016_P21",
            "@mimetype": "image/jpeg"
          },
          {
            "@category": "thumbnail",
            "@_fa": "true",
            "$": "https://api.elsevier.com/content/object/eid/1-s2.0-S0926860X15302866-Thuy_Duong_Nguyen_Phan_supported_catalyst_2016_P65.jpg?httpAccept=%2A%2F%2A",
            "@multimediatype": "JPEG image file",
            "@type": "ALTIMG",
            "@size": "520556",
            "@ref": "Thuy_Duong_Nguyen_Phan_supported_catalyst_2016_P65",
            "@mimetype": "image/jpeg"
          },
          {
            "@category": "thumbnail",
            "@_fa": "true",
            "$": "https://api.elsevier.com/content/object/eid/1-s2.0-S0926860X15302866-Thuy_Duong_Nguyen_Phan_supported_catalyst_2016_P61.jpg?httpAccept=%2A%2F%2A",
            "@multimediatype": "JPEG image file",
            "@type": "ALTIMG",
            "@size": "578223",
            "@ref": "Thuy_Duong_Nguyen_Phan_supported_catalyst_2016_P61",
            "@mimetype": "image/jpeg"
          },
          {
            "@category": "thumbnail",
            "@_fa": "true",
            "$": "https://api.elsevier.com/content/object/eid/1-s2.0-S0926860X15302866-Thuy_Duong_Nguyen_Phan_supported_catalyst_2016_P02.jpg?httpAccept=%2A%2F%2A",
            "@multimediatype": "JPEG image file",
            "@type": "ALTIMG",
            "@size": "333309",
            "@ref": "Thuy_Duong_Nguyen_Phan_supported_catalyst_2016_P02",
            "@mimetype": "image/jpeg"
          },
          {
            "@category": "thumbnail",
            "@_fa": "true",
            "$": "https://api.elsevier.com/content/object/eid/1-s2.0-S0926860X15302866-Thuy_Duong_Nguyen_Phan_supported_catalyst_2016_P46.jpg?httpAccept=%2A%2F%2A",
            "@multimediatype": "JPEG image file",
            "@type": "ALTIMG",
            "@size": "770578",
            "@ref": "Thuy_Duong_Nguyen_Phan_supported_catalyst_2016_P46",
            "@mimetype": "image/jpeg"
          },
          {
            "@category": "thumbnail",
            "@_fa": "true",
            "$": "https://api.elsevier.com/content/object/eid/1-s2.0-S0926860X15302866-Thuy_Duong_Nguyen_Phan_supported_catalyst_2016_P35.jpg?httpAccept=%2A%2F%2A",
            "@multimediatype": "JPEG image file",
            "@type": "ALTIMG",
            "@size": "417811",
            "@ref": "Thuy_Duong_Nguyen_Phan_supported_catalyst_2016_P35",
            "@mimetype": "image/jpeg"
          },
          {
            "@category": "thumbnail",
            "@_fa": "true",
            "$": "https://api.elsevier.com/content/object/eid/1-s2.0-S0926860X15302866-Thuy_Duong_Nguyen_Phan_supported_catalyst_2016_P17.jpg?httpAccept=%2A%2F%2A",
            "@multimediatype": "JPEG image file",
            "@type": "ALTIMG",
            "@size": "630158",
            "@ref": "Thuy_Duong_Nguyen_Phan_supported_catalyst_2016_P17",
            "@mimetype": "image/jpeg"
          },
          {
            "@category": "thumbnail",
            "@_fa": "true",
            "$": "https://api.elsevier.com/content/object/eid/1-s2.0-S0926860X15302866-Thuy_Duong_Nguyen_Phan_supported_catalyst_2016_P33.jpg?httpAccept=%2A%2F%2A",
            "@multimediatype": "JPEG image file",
            "@type": "ALTIMG",
            "@size": "529116",
            "@ref": "Thuy_Duong_Nguyen_Phan_supported_catalyst_2016_P33",
            "@mimetype": "image/jpeg"
          },
          {
            "@category": "thumbnail",
            "@_fa": "true",
            "$": "https://api.elsevier.com/content/object/eid/1-s2.0-S0926860X15302866-Thuy_Duong_Nguyen_Phan_supported_catalyst_2016_P39.jpg?httpAccept=%2A%2F%2A",
            "@multimediatype": "JPEG image file",
            "@type": "ALTIMG",
            "@size": "625572",
            "@ref": "Thuy_Duong_Nguyen_Phan_supported_catalyst_2016_P39",
            "@mimetype": "image/jpeg"
          },
          {
            "@category": "thumbnail",
            "@_fa": "true",
            "$": "https://api.elsevier.com/content/object/eid/1-s2.0-S0926860X15302866-Thuy_Duong_Nguyen_Phan_supported_catalyst_2016_P37.jpg?httpAccept=%2A%2F%2A",
            "@multimediatype": "JPEG image file",
            "@type": "ALTIMG",
            "@size": "637622",
            "@ref": "Thuy_Duong_Nguyen_Phan_supported_catalyst_2016_P37",
            "@mimetype": "image/jpeg"
          },
          {
            "@category": "thumbnail",
            "@_fa": "true",
            "$": "https://api.elsevier.com/content/object/eid/1-s2.0-S0926860X15302866-Thuy_Duong_Nguyen_Phan_supported_catalyst_2016_P23.jpg?httpAccept=%2A%2F%2A",
            "@multimediatype": "JPEG image file",
            "@type": "ALTIMG",
            "@size": "470680",
            "@ref": "Thuy_Duong_Nguyen_Phan_supported_catalyst_2016_P23",
            "@mimetype": "image/jpeg"
          },
          {
            "@category": "thumbnail",
            "@_fa": "true",
            "$": "https://api.elsevier.com/content/object/eid/1-s2.0-S0926860X15302866-Thuy_Duong_Nguyen_Phan_supported_catalyst_2016_P30.jpg?httpAccept=%2A%2F%2A",
            "@multimediatype": "JPEG image file",
            "@type": "ALTIMG",
            "@size": "382832",
            "@ref": "Thuy_Duong_Nguyen_Phan_supported_catalyst_2016_P30",
            "@mimetype": "image/jpeg"
          },
          {
            "@category": "thumbnail",
            "@_fa": "true",
            "$": "https://api.elsevier.com/content/object/eid/1-s2.0-S0926860X15302866-Thuy_Duong_Nguyen_Phan_supported_catalyst_2016_P04.jpg?httpAccept=%2A%2F%2A",
            "@multimediatype": "JPEG image file",
            "@type": "ALTIMG",
            "@size": "640772",
            "@ref": "Thuy_Duong_Nguyen_Phan_supported_catalyst_2016_P04",
            "@mimetype": "image/jpeg"
          },
          {
            "@category": "thumbnail",
            "@_fa": "true",
            "$": "https://api.elsevier.com/content/object/eid/1-s2.0-S0926860X15302866-Thuy_Duong_Nguyen_Phan_supported_catalyst_2016_P47.jpg?httpAccept=%2A%2F%2A",
            "@multimediatype": "JPEG image file",
            "@type": "ALTIMG",
            "@size": "414301",
            "@ref": "Thuy_Duong_Nguyen_Phan_supported_catalyst_2016_P47",
            "@mimetype": "image/jpeg"
          },
          {
            "@category": "thumbnail",
            "@_fa": "true",
            "$": "https://api.elsevier.com/content/object/eid/1-s2.0-S0926860X15302866-Thuy_Duong_Nguyen_Phan_supported_catalyst_2016_P66.jpg?httpAccept=%2A%2F%2A",
            "@multimediatype": "JPEG image file",
            "@type": "ALTIMG",
            "@size": "543904",
            "@ref": "Thuy_Duong_Nguyen_Phan_supported_catalyst_2016_P66",
            "@mimetype": "image/jpeg"
          },
          {
            "@category": "thumbnail",
            "@_fa": "true",
            "$": "https://api.elsevier.com/content/object/eid/1-s2.0-S0926860X15302866-Thuy_Duong_Nguyen_Phan_supported_catalyst_2016_P59.jpg?httpAccept=%2A%2F%2A",
            "@multimediatype": "JPEG image file",
            "@type": "ALTIMG",
            "@size": "503515",
            "@ref": "Thuy_Duong_Nguyen_Phan_supported_catalyst_2016_P59",
            "@mimetype": "image/jpeg"
          },
          {
            "@category": "thumbnail",
            "@_fa": "true",
            "$": "https://api.elsevier.com/content/object/eid/1-s2.0-S0926860X15302866-Thuy_Duong_Nguyen_Phan_supported_catalyst_2016_P69.jpg?httpAccept=%2A%2F%2A",
            "@multimediatype": "JPEG image file",
            "@type": "ALTIMG",
            "@size": "555764",
            "@ref": "Thuy_Duong_Nguyen_Phan_supported_catalyst_2016_P69",
            "@mimetype": "image/jpeg"
          },
          {
            "@category": "thumbnail",
            "@_fa": "true",
            "$": "https://api.elsevier.com/content/object/eid/1-s2.0-S0926860X15302866-Thuy_Duong_Nguyen_Phan_supported_catalyst_2016_P03.jpg?httpAccept=%2A%2F%2A",
            "@multimediatype": "JPEG image file",
            "@type": "ALTIMG",
            "@size": "646317",
            "@ref": "Thuy_Duong_Nguyen_Phan_supported_catalyst_2016_P03",
            "@mimetype": "image/jpeg"
          },
          {
            "@category": "thumbnail",
            "@_fa": "true",
            "$": "https://api.elsevier.com/content/object/eid/1-s2.0-S0926860X15302866-Thuy_Duong_Nguyen_Phan_supported_catalyst_2016_P62.jpg?httpAccept=%2A%2F%2A",
            "@multimediatype": "JPEG image file",
            "@type": "ALTIMG",
            "@size": "546326",
            "@ref": "Thuy_Duong_Nguyen_Phan_supported_catalyst_2016_P62",
            "@mimetype": "image/jpeg"
          },
          {
            "@category": "thumbnail",
            "@_fa": "true",
            "$": "https://api.elsevier.com/content/object/eid/1-s2.0-S0926860X15302866-Thuy_Duong_Nguyen_Phan_supported_catalyst_2016_P51.jpg?httpAccept=%2A%2F%2A",
            "@multimediatype": "JPEG image file",
            "@type": "ALTIMG",
            "@size": "349471",
            "@ref": "Thuy_Duong_Nguyen_Phan_supported_catalyst_2016_P51",
            "@mimetype": "image/jpeg"
          },
          {
            "@category": "thumbnail",
            "@_fa": "true",
            "$": "https://api.elsevier.com/content/object/eid/1-s2.0-S0926860X15302866-Thuy_Duong_Nguyen_Phan_supported_catalyst_2016_P29.jpg?httpAccept=%2A%2F%2A",
            "@multimediatype": "JPEG image file",
            "@type": "ALTIMG",
            "@size": "306770",
            "@ref": "Thuy_Duong_Nguyen_Phan_supported_catalyst_2016_P29",
            "@mimetype": "image/jpeg"
          },
          {
            "@category": "thumbnail",
            "@_fa": "true",
            "$": "https://api.elsevier.com/content/object/eid/1-s2.0-S0926860X15302866-Thuy_Duong_Nguyen_Phan_supported_catalyst_2016_P16.jpg?httpAccept=%2A%2F%2A",
            "@multimediatype": "JPEG image file",
            "@type": "ALTIMG",
            "@size": "546661",
            "@ref": "Thuy_Duong_Nguyen_Phan_supported_catalyst_2016_P16",
            "@mimetype": "image/jpeg"
          },
          {
            "@category": "thumbnail",
            "@_fa": "true",
            "$": "https://api.elsevier.com/content/object/eid/1-s2.0-S0926860X15302866-Thuy_Duong_Nguyen_Phan_supported_catalyst_2016_P43.jpg?httpAccept=%2A%2F%2A",
            "@multimediatype": "JPEG image file",
            "@type": "ALTIMG",
            "@size": "323004",
            "@ref": "Thuy_Duong_Nguyen_Phan_supported_catalyst_2016_P43",
            "@mimetype": "image/jpeg"
          },
          {
            "@category": "thumbnail",
            "@_fa": "true",
            "$": "https://api.elsevier.com/content/object/eid/1-s2.0-S0926860X15302866-Thuy_Duong_Nguyen_Phan_supported_catalyst_2016_P11.jpg?httpAccept=%2A%2F%2A",
            "@multimediatype": "JPEG image file",
            "@type": "ALTIMG",
            "@size": "471354",
            "@ref": "Thuy_Duong_Nguyen_Phan_supported_catalyst_2016_P11",
            "@mimetype": "image/jpeg"
          },
          {
            "@category": "thumbnail",
            "@_fa": "true",
            "$": "https://api.elsevier.com/content/object/eid/1-s2.0-S0926860X15302866-Thuy_Duong_Nguyen_Phan_supported_catalyst_2016_P32.jpg?httpAccept=%2A%2F%2A",
            "@multimediatype": "JPEG image file",
            "@type": "ALTIMG",
            "@size": "518623",
            "@ref": "Thuy_Duong_Nguyen_Phan_supported_catalyst_2016_P32",
            "@mimetype": "image/jpeg"
          },
          {
            "@category": "thumbnail",
            "@_fa": "true",
            "$": "https://api.elsevier.com/content/object/eid/1-s2.0-S0926860X15302866-Thuy_Duong_Nguyen_Phan_supported_catalyst_2016_P41.jpg?httpAccept=%2A%2F%2A",
            "@multimediatype": "JPEG image file",
            "@type": "ALTIMG",
            "@size": "736709",
            "@ref": "Thuy_Duong_Nguyen_Phan_supported_catalyst_2016_P41",
            "@mimetype": "image/jpeg"
          },
          {
            "@category": "thumbnail",
            "@_fa": "true",
            "$": "https://api.elsevier.com/content/object/eid/1-s2.0-S0926860X15302866-Thuy_Duong_Nguyen_Phan_supported_catalyst_2016_P22.jpg?httpAccept=%2A%2F%2A",
            "@multimediatype": "JPEG image file",
            "@type": "ALTIMG",
            "@size": "773851",
            "@ref": "Thuy_Duong_Nguyen_Phan_supported_catalyst_2016_P22",
            "@mimetype": "image/jpeg"
          },
          {
            "@category": "thumbnail",
            "@_fa": "true",
            "$": "https://api.elsevier.com/content/object/eid/1-s2.0-S0926860X15302866-Thuy_Duong_Nguyen_Phan_supported_catalyst_2016_P70.jpg?httpAccept=%2A%2F%2A",
            "@multimediatype": "JPEG image file",
            "@type": "ALTIMG",
            "@size": "391249",
            "@ref": "Thuy_Duong_Nguyen_Phan_supported_catalyst_2016_P70",
            "@mimetype": "image/jpeg"
          },
          {
            "@category": "thumbnail",
            "@_fa": "true",
            "$": "https://api.elsevier.com/content/object/eid/1-s2.0-S0926860X15302866-Thuy_Duong_Nguyen_Phan_supported_catalyst_2016_P48.jpg?httpAccept=%2A%2F%2A",
            "@multimediatype": "JPEG image file",
            "@type": "ALTIMG",
            "@size": "544764",
            "@ref": "Thuy_Duong_Nguyen_Phan_supported_catalyst_2016_P48",
            "@mimetype": "image/jpeg"
          },
          {
            "@category": "thumbnail",
            "@_fa": "true",
            "$": "https://api.elsevier.com/content/object/eid/1-s2.0-S0926860X15302866-Thuy_Duong_Nguyen_Phan_supported_catalyst_2016_P31.jpg?httpAccept=%2A%2F%2A",
            "@multimediatype": "JPEG image file",
            "@type": "ALTIMG",
            "@size": "589115",
            "@ref": "Thuy_Duong_Nguyen_Phan_supported_catalyst_2016_P31",
            "@mimetype": "image/jpeg"
          },
          {
            "@category": "thumbnail",
            "@_fa": "true",
            "$": "https://api.elsevier.com/content/object/eid/1-s2.0-S0926860X15302866-Thuy_Duong_Nguyen_Phan_supported_catalyst_2016_P42.jpg?httpAccept=%2A%2F%2A",
            "@multimediatype": "JPEG image file",
            "@type": "ALTIMG",
            "@size": "206239",
            "@ref": "Thuy_Duong_Nguyen_Phan_supported_catalyst_2016_P42",
            "@mimetype": "image/jpeg"
          },
          {
            "@category": "thumbnail",
            "@_fa": "true",
            "$": "https://api.elsevier.com/content/object/eid/1-s2.0-S0926860X15302866-Thuy_Duong_Nguyen_Phan_supported_catalyst_2016_P68.jpg?httpAccept=%2A%2F%2A",
            "@multimediatype": "JPEG image file",
            "@type": "ALTIMG",
            "@size": "530597",
            "@ref": "Thuy_Duong_Nguyen_Phan_supported_catalyst_2016_P68",
            "@mimetype": "image/jpeg"
          },
          {
            "@category": "standard",
            "@_fa": "true",
            "$": "https://api.elsevier.com/content/object/eid/1-s2.0-S0926860X15302866-am.pdf?httpAccept=%2A%2F%2A",
            "@multimediatype": "Acrobat PDF file",
            "@type": "AAM-PDF",
            "@size": "7945816",
            "@ref": "am",
            "@mimetype": "application/pdf"
          }
        ]
      },
      "link": {
        "@rel": "abstract",
        "@href": "https://api.elsevier.com/content/abstract/scopus_id/84950341965"
      }
    }
  }
}