{
  "metadata": {
    "title": "Fabrication of small <ce:small-caps>l</ce:small-caps>-threonine capped nickel nanoparticles and their catalytic application",
    "authors": "; ; ",
    "journal": "Applied Catalysis A: General",
    "date": "2013-02-26",
    "doi": "10.1016/j.apcata.2012.12.005",
    "abstract": "",
    "uri": "https://api.elsevier.com/content/article/pii/S0926860X12007545",
    "pii": "S0926860X12007545"
  },
  "fulltext": {
    "full-text-retrieval-response": {
      "scopus-eid": "2-s2.0-84873626258",
      "originalText": "serial JL 271346 291210 291744 291809 31 Applied Catalysis A: General APPLIEDCATALYSISAGENERAL 2012-12-16 2012-12-16 2013-02-09T16:06:13 1-s2.0-S0926860X12007545 S0926-860X(12)00754-5 S0926860X12007545 10.1016/j.apcata.2012.12.005 S300 S300.1 FULL-TEXT 1-s2.0-S0926860X13X0002X 2024-01-01T12:29:14.622205Z 0 0 20130226 2013 2012-12-16T00:00:00Z articleinfo crossmark dco dateupdated tomb dateloaded datesearch indexeddate volumelist yearnav absattachment articletitlenorm authfirstinitialnorm authfirstsurnamenorm cid cids contenttype copyright dateloadedtxt docsubtype doctype doi eid ewtransactionid hubeid issn issnnorm itemstage itemtransactionid itemweight openaccess openarchive pg pgfirst pglast pii piinorm pubdatestart pubdatetxt pubyr sectiontitle sortorder srctitle srctitlenorm srctype subheadings suppl volfirst volissue webpdf webpdfpagecount figure body acknowledge affil articletitle auth authfirstini authfull authkeywords authlast primabst ref specialabst alllist content subj ssids 0926-860X 0926860X false 453 453 C Volume 453 9 54 59 54 59 20130226 26 February 2013 2013-02-26 2013 Articles article fla Copyright © 2012 Elsevier B.V. Published by Elsevier B.V. All rights reserved. FABRICATIONSMALLLTHREONINECAPPEDNICKELNANOPARTICLESCATALYTICAPPLICATION KALWAR N 1 Introduction 2 Experimental 2.1 Chemicals and reagents 2.2 Preparation of stock solutions 2.3 Procedure for fabrication of Ni NPs and sample preparation for UV–vis spectroscopy 2.4 Nanoparticle separation 2.5 Instrumentation 2.6 Sample preparation for FTIR studies 2.7 Sample preparation for AFM studies 2.8 Sample preparation for TEM studies 2.9 Catalytic test for reduction of dye 3 Results and discussions 3.1 UV–vis spectroscopy 3.2 Fourier transform infrared (FTIR) spectroscopy 3.3 Atomic force microscopy (AFM) 3.4 Transmission electron microscopy (TEM) 3.5 Chemical properties of congo red 3.6 Catalytic activity 3.7 Recovery and reuse of Ni NPs catalyst 4 Conclusions Acknowledgments References HUTCHISON 2008 395 402 J ANDREW 2008 14195 14202 L YU 2007 1859 1862 C FARAMARZI 2011 18958 18966 A BOUDJAHEM 2004 325 334 A LAAKSONEN 2009 5185 5192 P XIAOMING 2011 7414 7417 M XIAOMING 2012 467 477 M KALWAR 2011 215 220 N AHMED 1992 79 86 M MACKAY 1998 24 28 G QUARADAWI 2002 161 168 S SAUER 2002 147 154 G KAMEL 2009 412 422 D FRID 2007 135 160 P GAO 2004 455 456 X HOBART 1986 W INSTRUMENTALMETHODSANALYSIS JANARDHANAN 2009 2522 2530 R SINGLA 2007 51 57 M TANASE 2001 155 158 M WANG 2000 1153 1175 Z LI 2006 1510 1517 D HASSAN 2011 1030 1036 S SLADEWSKI 2006 985 987 T KALWARX2013X54 KALWARX2013X54X59 KALWARX2013X54XN KALWARX2013X54X59XN item S0926-860X(12)00754-5 S0926860X12007545 1-s2.0-S0926860X12007545 10.1016/j.apcata.2012.12.005 271346 2024-01-01T12:29:14.622205Z 2013-02-26 1-s2.0-S0926860X12007545-main.pdf https://s3.amazonaws.com/prod-ucs-content-store-us-east/content/pii:S0926860X12007545/MAIN/application/pdf/a894275f6e2bfe3a3f8149fef521a509/main.pdf https://s3-eu-west-1.amazonaws.com/prod-ucs-content-store-eu-west/content/pii:S0926860X12007545/MAIN/application/pdf/a894275f6e2bfe3a3f8149fef521a509/main.pdf main.pdf pdf true 682803 MAIN 6 1-s2.0-S0926860X12007545-main_1.png https://s3-eu-west-1.amazonaws.com/prod-ucs-content-store-eu-west/content/pii:S0926860X12007545/PREVIEW/image/png/5c71cd800e06749ff08e73f0b06d3ffe/main_1.png https://s3.amazonaws.com/prod-ucs-content-store-us-east/content/pii:S0926860X12007545/PREVIEW/image/png/5c71cd800e06749ff08e73f0b06d3ffe/main_1.png main_1.png png 58252 849 656 IMAGE-WEB-PDF 1 1-s2.0-S0926860X12007545-fx1_lrg.jpg https://s3.amazonaws.com/prod-ucs-content-store-us-east/content/pii:S0926860X12007545/fx1/HIGHRES/image/jpeg/61cf9ca606237aea5f98a67cda41936f/fx1_lrg.jpg https://s3-eu-west-1.amazonaws.com/prod-ucs-content-store-eu-west/content/pii:S0926860X12007545/fx1/HIGHRES/image/jpeg/61cf9ca606237aea5f98a67cda41936f/fx1_lrg.jpg fx1 true fx1_lrg.jpg jpg 132648 886 1016 IMAGE-HIGH-RES 1-s2.0-S0926860X12007545-gr5_lrg.jpg https://s3.amazonaws.com/prod-ucs-content-store-us-east/content/pii:S0926860X12007545/gr5/HIGHRES/image/jpeg/6f893bd4a89e6f8c469361ab57bb46eb/gr5_lrg.jpg https://s3-eu-west-1.amazonaws.com/prod-ucs-content-store-eu-west/content/pii:S0926860X12007545/gr5/HIGHRES/image/jpeg/6f893bd4a89e6f8c469361ab57bb46eb/gr5_lrg.jpg gr5 gr5_lrg.jpg jpg 132107 725 950 IMAGE-HIGH-RES 1-s2.0-S0926860X12007545-gr4_lrg.jpg https://s3.amazonaws.com/prod-ucs-content-store-us-east/content/pii:S0926860X12007545/gr4/HIGHRES/image/jpeg/778d38c2048706d0e74e7e890313d64d/gr4_lrg.jpg https://s3-eu-west-1.amazonaws.com/prod-ucs-content-store-eu-west/content/pii:S0926860X12007545/gr4/HIGHRES/image/jpeg/778d38c2048706d0e74e7e890313d64d/gr4_lrg.jpg gr4 gr4_lrg.jpg jpg 180861 1216 1435 IMAGE-HIGH-RES 1-s2.0-S0926860X12007545-gr3_lrg.jpg https://s3.amazonaws.com/prod-ucs-content-store-us-east/content/pii:S0926860X12007545/gr3/HIGHRES/image/jpeg/23d08a71522f9f8d7aca725b0fd05d50/gr3_lrg.jpg https://s3-eu-west-1.amazonaws.com/prod-ucs-content-store-eu-west/content/pii:S0926860X12007545/gr3/HIGHRES/image/jpeg/23d08a71522f9f8d7aca725b0fd05d50/gr3_lrg.jpg gr3 gr3_lrg.jpg jpg 467806 2102 1350 IMAGE-HIGH-RES 1-s2.0-S0926860X12007545-gr8_lrg.jpg https://s3.amazonaws.com/prod-ucs-content-store-us-east/content/pii:S0926860X12007545/gr8/HIGHRES/image/jpeg/b61985ec304b38fe6b8f6caeb4ec16bf/gr8_lrg.jpg https://s3-eu-west-1.amazonaws.com/prod-ucs-content-store-eu-west/content/pii:S0926860X12007545/gr8/HIGHRES/image/jpeg/b61985ec304b38fe6b8f6caeb4ec16bf/gr8_lrg.jpg gr8 gr8_lrg.jpg jpg 86231 1070 1390 IMAGE-HIGH-RES 1-s2.0-S0926860X12007545-gr7_lrg.jpg https://s3.amazonaws.com/prod-ucs-content-store-us-east/content/pii:S0926860X12007545/gr7/HIGHRES/image/jpeg/5749953ae505c071c184fd1d0322f51b/gr7_lrg.jpg https://s3-eu-west-1.amazonaws.com/prod-ucs-content-store-eu-west/content/pii:S0926860X12007545/gr7/HIGHRES/image/jpeg/5749953ae505c071c184fd1d0322f51b/gr7_lrg.jpg gr7 gr7_lrg.jpg jpg 327790 2344 1504 IMAGE-HIGH-RES 1-s2.0-S0926860X12007545-gr6_lrg.jpg https://s3.amazonaws.com/prod-ucs-content-store-us-east/content/pii:S0926860X12007545/gr6/HIGHRES/image/jpeg/4cea2d1806f2fc6b59cef64aaac9df66/gr6_lrg.jpg https://s3-eu-west-1.amazonaws.com/prod-ucs-content-store-eu-west/content/pii:S0926860X12007545/gr6/HIGHRES/image/jpeg/4cea2d1806f2fc6b59cef64aaac9df66/gr6_lrg.jpg gr6 gr6_lrg.jpg jpg 203433 1425 1583 IMAGE-HIGH-RES 1-s2.0-S0926860X12007545-gr2_lrg.jpg https://s3.amazonaws.com/prod-ucs-content-store-us-east/content/pii:S0926860X12007545/gr2/HIGHRES/image/jpeg/a21c9d704359b7f2c2cf8d1f13fdc53d/gr2_lrg.jpg https://s3-eu-west-1.amazonaws.com/prod-ucs-content-store-eu-west/content/pii:S0926860X12007545/gr2/HIGHRES/image/jpeg/a21c9d704359b7f2c2cf8d1f13fdc53d/gr2_lrg.jpg gr2 gr2_lrg.jpg jpg 179477 1124 1468 IMAGE-HIGH-RES 1-s2.0-S0926860X12007545-gr1_lrg.jpg https://s3.amazonaws.com/prod-ucs-content-store-us-east/content/pii:S0926860X12007545/gr1/HIGHRES/image/jpeg/8bd7ce0ff5da888196dd340c36b05b62/gr1_lrg.jpg https://s3-eu-west-1.amazonaws.com/prod-ucs-content-store-eu-west/content/pii:S0926860X12007545/gr1/HIGHRES/image/jpeg/8bd7ce0ff5da888196dd340c36b05b62/gr1_lrg.jpg gr1 gr1_lrg.jpg jpg 177163 1192 1463 IMAGE-HIGH-RES 1-s2.0-S0926860X12007545-fx1.jpg https://s3.amazonaws.com/prod-ucs-content-store-us-east/content/pii:S0926860X12007545/fx1/DOWNSAMPLED/image/jpeg/afd08290ed44a3455c35793e2dc97a35/fx1.jpg https://s3-eu-west-1.amazonaws.com/prod-ucs-content-store-eu-west/content/pii:S0926860X12007545/fx1/DOWNSAMPLED/image/jpeg/afd08290ed44a3455c35793e2dc97a35/fx1.jpg fx1 true fx1.jpg jpg 15223 200 229 IMAGE-DOWNSAMPLED 1-s2.0-S0926860X12007545-gr5.jpg https://s3.amazonaws.com/prod-ucs-content-store-us-east/content/pii:S0926860X12007545/gr5/DOWNSAMPLED/image/jpeg/e131db8b6c90c49170efafb368f83d41/gr5.jpg https://s3-eu-west-1.amazonaws.com/prod-ucs-content-store-eu-west/content/pii:S0926860X12007545/gr5/DOWNSAMPLED/image/jpeg/e131db8b6c90c49170efafb368f83d41/gr5.jpg gr5 gr5.jpg jpg 37217 272 357 IMAGE-DOWNSAMPLED 1-s2.0-S0926860X12007545-gr4.jpg https://s3.amazonaws.com/prod-ucs-content-store-us-east/content/pii:S0926860X12007545/gr4/DOWNSAMPLED/image/jpeg/1370d57f1edb9d073ae4def5e686b56e/gr4.jpg https://s3-eu-west-1.amazonaws.com/prod-ucs-content-store-eu-west/content/pii:S0926860X12007545/gr4/DOWNSAMPLED/image/jpeg/1370d57f1edb9d073ae4def5e686b56e/gr4.jpg gr4 gr4.jpg jpg 31684 275 324 IMAGE-DOWNSAMPLED 1-s2.0-S0926860X12007545-gr3.jpg https://s3.amazonaws.com/prod-ucs-content-store-us-east/content/pii:S0926860X12007545/gr3/DOWNSAMPLED/image/jpeg/bbfe95411e604a51b369181270f1c0d3/gr3.jpg https://s3-eu-west-1.amazonaws.com/prod-ucs-content-store-eu-west/content/pii:S0926860X12007545/gr3/DOWNSAMPLED/image/jpeg/bbfe95411e604a51b369181270f1c0d3/gr3.jpg gr3 gr3.jpg jpg 50066 475 305 IMAGE-DOWNSAMPLED 1-s2.0-S0926860X12007545-gr8.jpg https://s3.amazonaws.com/prod-ucs-content-store-us-east/content/pii:S0926860X12007545/gr8/DOWNSAMPLED/image/jpeg/e2d2795204ea20b414abf81f4f45fccc/gr8.jpg https://s3-eu-west-1.amazonaws.com/prod-ucs-content-store-eu-west/content/pii:S0926860X12007545/gr8/DOWNSAMPLED/image/jpeg/e2d2795204ea20b414abf81f4f45fccc/gr8.jpg gr8 gr8.jpg jpg 11584 242 314 IMAGE-DOWNSAMPLED 1-s2.0-S0926860X12007545-gr7.jpg https://s3.amazonaws.com/prod-ucs-content-store-us-east/content/pii:S0926860X12007545/gr7/DOWNSAMPLED/image/jpeg/be628749d26f3ea5aac82c1df8986d08/gr7.jpg https://s3-eu-west-1.amazonaws.com/prod-ucs-content-store-eu-west/content/pii:S0926860X12007545/gr7/DOWNSAMPLED/image/jpeg/be628749d26f3ea5aac82c1df8986d08/gr7.jpg gr7 gr7.jpg jpg 34321 528 339 IMAGE-DOWNSAMPLED 1-s2.0-S0926860X12007545-gr6.jpg https://s3.amazonaws.com/prod-ucs-content-store-us-east/content/pii:S0926860X12007545/gr6/DOWNSAMPLED/image/jpeg/0cee5ee06ca593dcabdac56b093a92f0/gr6.jpg https://s3-eu-west-1.amazonaws.com/prod-ucs-content-store-eu-west/content/pii:S0926860X12007545/gr6/DOWNSAMPLED/image/jpeg/0cee5ee06ca593dcabdac56b093a92f0/gr6.jpg gr6 gr6.jpg jpg 23287 321 357 IMAGE-DOWNSAMPLED 1-s2.0-S0926860X12007545-gr2.jpg https://s3.amazonaws.com/prod-ucs-content-store-us-east/content/pii:S0926860X12007545/gr2/DOWNSAMPLED/image/jpeg/f31082f7b9c7355fbeaea8976c845eb5/gr2.jpg https://s3-eu-west-1.amazonaws.com/prod-ucs-content-store-eu-west/content/pii:S0926860X12007545/gr2/DOWNSAMPLED/image/jpeg/f31082f7b9c7355fbeaea8976c845eb5/gr2.jpg gr2 gr2.jpg jpg 20709 253 331 IMAGE-DOWNSAMPLED 1-s2.0-S0926860X12007545-gr1.jpg https://s3.amazonaws.com/prod-ucs-content-store-us-east/content/pii:S0926860X12007545/gr1/DOWNSAMPLED/image/jpeg/16d35cb2118f2c4c79955da450a5db6c/gr1.jpg https://s3-eu-west-1.amazonaws.com/prod-ucs-content-store-eu-west/content/pii:S0926860X12007545/gr1/DOWNSAMPLED/image/jpeg/16d35cb2118f2c4c79955da450a5db6c/gr1.jpg gr1 gr1.jpg jpg 18854 269 330 IMAGE-DOWNSAMPLED 1-s2.0-S0926860X12007545-fx1.sml https://s3.amazonaws.com/prod-ucs-content-store-us-east/content/pii:S0926860X12007545/fx1/THUMBNAIL/image/gif/9ab66c1b68c4f4f44b22d6ed96a18e1b/fx1.sml https://s3-eu-west-1.amazonaws.com/prod-ucs-content-store-eu-west/content/pii:S0926860X12007545/fx1/THUMBNAIL/image/gif/9ab66c1b68c4f4f44b22d6ed96a18e1b/fx1.sml fx1 true fx1.sml sml 8404 164 188 IMAGE-THUMBNAIL 1-s2.0-S0926860X12007545-gr5.sml https://s3.amazonaws.com/prod-ucs-content-store-us-east/content/pii:S0926860X12007545/gr5/THUMBNAIL/image/gif/a8e2c75281998396a4106690517e8e4f/gr5.sml https://s3-eu-west-1.amazonaws.com/prod-ucs-content-store-eu-west/content/pii:S0926860X12007545/gr5/THUMBNAIL/image/gif/a8e2c75281998396a4106690517e8e4f/gr5.sml gr5 gr5.sml sml 9306 164 215 IMAGE-THUMBNAIL 1-s2.0-S0926860X12007545-gr4.sml https://s3.amazonaws.com/prod-ucs-content-store-us-east/content/pii:S0926860X12007545/gr4/THUMBNAIL/image/gif/36b8e26ef5de17973527af2310255dcb/gr4.sml https://s3-eu-west-1.amazonaws.com/prod-ucs-content-store-eu-west/content/pii:S0926860X12007545/gr4/THUMBNAIL/image/gif/36b8e26ef5de17973527af2310255dcb/gr4.sml gr4 gr4.sml sml 7916 164 193 IMAGE-THUMBNAIL 1-s2.0-S0926860X12007545-gr3.sml https://s3.amazonaws.com/prod-ucs-content-store-us-east/content/pii:S0926860X12007545/gr3/THUMBNAIL/image/gif/14949d6e462cb090875d250379b25dbe/gr3.sml https://s3-eu-west-1.amazonaws.com/prod-ucs-content-store-eu-west/content/pii:S0926860X12007545/gr3/THUMBNAIL/image/gif/14949d6e462cb090875d250379b25dbe/gr3.sml gr3 gr3.sml sml 6138 163 105 IMAGE-THUMBNAIL 1-s2.0-S0926860X12007545-gr8.sml https://s3.amazonaws.com/prod-ucs-content-store-us-east/content/pii:S0926860X12007545/gr8/THUMBNAIL/image/gif/3f8feb3b6e3750aa0a7c11acec029eb5/gr8.sml https://s3-eu-west-1.amazonaws.com/prod-ucs-content-store-eu-west/content/pii:S0926860X12007545/gr8/THUMBNAIL/image/gif/3f8feb3b6e3750aa0a7c11acec029eb5/gr8.sml gr8 gr8.sml sml 5371 164 213 IMAGE-THUMBNAIL 1-s2.0-S0926860X12007545-gr7.sml https://s3.amazonaws.com/prod-ucs-content-store-us-east/content/pii:S0926860X12007545/gr7/THUMBNAIL/image/gif/29dde885e790ecc5f86d0789a705df99/gr7.sml https://s3-eu-west-1.amazonaws.com/prod-ucs-content-store-eu-west/content/pii:S0926860X12007545/gr7/THUMBNAIL/image/gif/29dde885e790ecc5f86d0789a705df99/gr7.sml gr7 gr7.sml sml 3778 164 105 IMAGE-THUMBNAIL 1-s2.0-S0926860X12007545-gr6.sml https://s3.amazonaws.com/prod-ucs-content-store-us-east/content/pii:S0926860X12007545/gr6/THUMBNAIL/image/gif/6fd9437b40cd491d77fdeb2008a073ad/gr6.sml https://s3-eu-west-1.amazonaws.com/prod-ucs-content-store-eu-west/content/pii:S0926860X12007545/gr6/THUMBNAIL/image/gif/6fd9437b40cd491d77fdeb2008a073ad/gr6.sml gr6 gr6.sml sml 4443 164 182 IMAGE-THUMBNAIL 1-s2.0-S0926860X12007545-gr2.sml https://s3.amazonaws.com/prod-ucs-content-store-us-east/content/pii:S0926860X12007545/gr2/THUMBNAIL/image/gif/434b774cca0ca3c612fb21353c01c144/gr2.sml https://s3-eu-west-1.amazonaws.com/prod-ucs-content-store-eu-west/content/pii:S0926860X12007545/gr2/THUMBNAIL/image/gif/434b774cca0ca3c612fb21353c01c144/gr2.sml gr2 gr2.sml sml 5687 164 214 IMAGE-THUMBNAIL 1-s2.0-S0926860X12007545-gr1.sml https://s3.amazonaws.com/prod-ucs-content-store-us-east/content/pii:S0926860X12007545/gr1/THUMBNAIL/image/gif/aa2e1f65dfa82c58be903ea455ae466b/gr1.sml https://s3-eu-west-1.amazonaws.com/prod-ucs-content-store-eu-west/content/pii:S0926860X12007545/gr1/THUMBNAIL/image/gif/aa2e1f65dfa82c58be903ea455ae466b/gr1.sml gr1 gr1.sml sml 5373 164 201 IMAGE-THUMBNAIL APCATA 13996 S0926-860X(12)00754-5 10.1016/j.apcata.2012.12.005 Elsevier B.V. Fig. 1 UV–vis spectra of fresh samples of Ni NPs prepared in aqueous environments by varying the concentration of reducing agent. (For interpretation of the references to colour in this figure legend, the reader is referred to the web version of this article.) Fig. 2 FTIR spectra of (a) standard l-threonine and (b) l-threonine capped Ni NPs obtained after separation by centrifugation method. (For interpretation of the references to colour in this figure legend, the reader is referred to the web version of this article.) Fig. 3 AFM images of well dispersed l-threonine capped Ni NPs at (a) low magnification and (b) high magnification. Fig. 4 Size distribution, formation and schematic of Ni NPs capped with l-threonine molecules. AFM and TEM micrographs were used for size calculations. Fig. 5 TEM images of l-threonine capped Ni NPs mounted on carbon coated Cu grids. The scale bar in the image is equal to 100nm. Fig. 6 Linear molecular structures of (a) CR dye, (b) its sulfonazo form and (c) chinone form produced during the course of reaction. Fig. 7 UV–vis spectra showing (a) CR dye (20μM) in Milli-Q water and (b) catalytic degradation of dye (20μM) with Ni NPs (0.2mg) deposited on glass cover slips in the presence of NaBH4 (0.1M). (For interpretation of the references to colour in this figure legend, the reader is referred to the web version of this article.) Fig. 8 Recovery of l-threonine capped Ni NPs for four times to carry out reduction/degradation of congo red dye with negligible loss of efficiency. Fabrication of small l-threonine capped nickel nanoparticles and their catalytic application Nazar Hussain Kalwar a ⁎ Sirajuddin a Syed Tufail Hussain Sherazi a Abdul Rauf Khaskheli a Keith Richard Hallam b Thomas Bligh Scott b Zulfiqar Ali Tagar a Syeda Sara Hassan a Razium Ali Soomro a a National Centre of Excellence in Analytical Chemistry, University of Sindh, Jamshoro, 76080, Pakistan b Interface Analysis Centre, University of Bristol, Bristol BS2 8BS, United Kingdom ⁎ Corresponding author. Tel.: +92 22 9213430; fax: +92 22 9213431. Graphical abstract Highlights ► Present study describes a new and simple approach to fabricate l-threonine capped Ni NPs. ► Our experiments showed development of highly efficient heterogeneous catalysts for reduction degradation of congo red dye. ► Congo red dye has been used as model compound as it gives different color shades in degraded and undegraded forms. ► Electron microscopy results in the formation of very small Ni NPs with homogeneous sizes and shapes and narrower size distributions. A facile and green seed mediated growth approach for fabrication of well dispersed l-threonine derived nickel nanoparticles (Ni NPs) in an aqueous medium via a modified borohydride reduction method is described. l-Threonine molecules served to organize the nanoscale composites in the form of well dispersed Ni NPs. The basic pH 8.5 was found to favor the formation of spherical and well dispersed Ni NPs as shown in transmission electron microscopy (TEM) micrographs. Freshly prepared Ni NPs possess the nanoscale dimension of 1.68–5.06nm, as determined from atomic force microscopy (AFM) and TEM data. The Ni NPs thus prepared were used for their catalytic potential in the reduction of congo red (CR) dye selected as a model reagent. The results revealed negligible reduction of dye in the absence of Ni NPs. Conversely the addition of only 0.2mg Ni NPs produced 100% reduction/degradation efficiency. The used Ni NPs were recovered and reutilized several times for reducing CR without any loss of activity. The current findings are equally extendable for safeguarding the aquatic environment against the pollution caused by other dyes via a facile, highly economical, rapid and efficient reduction/degradation method based on the catalytic potential of Ni NPs. Keywords l-Threonine Sodium borohydride Nickel nanoparticles Catalytic degradation Congo red 1 Introduction Nanotechnology continues to present newer materials and unique nanostructures with enhanced applications to benefit society in a greener way due to positive interactions of nanosized structures on health and environment. In view of the vast production of new materials, nanotechnologists are currently facing numerous challenges to encounter and discriminate potential harmful effects of nanomaterials [1]. Nanoscale objects with metallic, magnetic, conducting and semiconducting nature in a wide range of shapes and sizes have been easily fabricated by solution based synthetic routes [2]. Among all metal nanostructures Ni NPs have been found to be pragmatic for a number of applications, e.g. microwave absorbing materials, commercial batteries, magnetic recording media and formation catalysts [3]. The preparation of Ni NPs and their use as catalysts have been mentioned by many workers [4,5]. These procedures need high energy and special equipments for the formation of Ni nanoparticles. These nanoscale nickel catalysts are mainly synthesized by chemical reduction routes using different stabilizing agents such as polymers, surfactants, ligands, heterogeneous supports and bimolecular agents which are utilized to prevent the nanoscale objects from agglomerating [5]. The fabrication of materials with nanoscale dimensions having homogenous size distribution has also been explored by controlling surface binding interactions. Targeting nanoparticles to utilize them for special applications with enhanced catalytic, electronic, optical and magnetic properties is highly dependent on organizing and positioning them in functional context [6], which may find optimum use in devices with high catalytic performance. Preparation of functionalized cells has been carried out to produce biogenic CaCO3 nanoscale scaffolds and it is mentioned that such nanoparticles possess enviable properties of functionalized cells in order to meet the principle of use in many fields such as medicine, environmental and material sciences [7]. Similarly hierarchical CaCO3–maltose materials were also prepared to investigate their decontamination capacities for removal of pollutants from waters, such nanostructures found to highly active for remediation of many metal ions [8]. In our previous report method l-mehonine was used as capping agent for the synthesis of Ni NWs for the catalytic transfer hydrogenation of isopropyl alcohol to acetone [9]. Whereas in the present work we applied organic dye (Congo red) as model compound to monitor the catalytic efficiency of fabricated l-threonine capped Ni NPs. Regarding the toxic effect of dyes, studies have been carried out that show the extensive release of a number of azo dyes (such as CR) from effluents of the textile industry and many other sources which cause aquatic environmental pollution leading to severe health complications in amphibians and aquatic life [10]. Several methodologies have been introduced to decontaminate waters including biodegradation, ion exchange and adsorption on activated carbon and clays [11–13]. However, these pollution control processes are insufficient because they simply transfer the hazards from one phase to another and require further costs for treatments (e.g. incineration or land filling) to destroy the end product [14]. On the other hand a common exploitation of CR dye is its histological use for amyloid detection. Its specificity of staining results from the affinity for the binding of CR dye with fibril proteins in the β-sheet conformation. It has recently been observed that the dye also interferes in processes such as protein misfolding and aggregation, stabilizing partially folded intermediates and native protein monomers, during decrease in concentration of additional toxic protein oligomers [15]. A more advantageous application of CR analogs is their use in development of imaging probes. The small molecular size and penetrability of CR congeners through blood-brain barriers provide the basis to utilize the dye for in vivo and antemortem visualization and brain amyloid quantification [15]. Despite its useful aspects, CR is a highly objectionable dye due to its extensive contribution to aquatic pollution by producing unwanted colored water that is a real threat for aquatic life and for use by humans. Considering the hazardous impacts of the dye, we have synthesized small Ni NPs via a greener route that possess tremendous potential as catalytic materials to completely degrade CR dye, which can be taken as a model for other degradable dyes. Moreover the fabricated Ni NPs are easy to recover and can be reused without any loss in activity suggesting the non-poisonous aspect of Ni NPs with high economy. The fabrication route does not require high energy, extended preparation time or special equipment and the resulting Ni NPs are of small size with highly narrow size distributions and homogeneous morphologies. 2 Experimental 2.1 Chemicals and reagents Nanoparticle synthesis and application was carried out using NiCl2·6H2O (97%), purchased from E. Merck, l-threonine (99%), from Fluka Chemicals, and NaBH4 (98%), NaOH (98%), HCl (37%) and CR dye (99%), from Sigma–Aldrich. All chemicals were of analytical grade and used without further purification. Pure Milli-Q water was used as the preparatory medium. 2.2 Preparation of stock solutions Stock solutions of 0.1M NiCl2·6H2O, 0.1M l-threonine and 0.5M NaBH4 were prepared in 100ml volumetric flasks using the required quantities of each and diluted to the mark with Milli-Q water. Further 1M NaOH and 1M HCl were also prepared to adjust the pH of freshly prepared sample solutions of Ni NPs in aqueous media. CR dye was dissolved in Milli-Q water to prepare 1mM of its stock solution to carry out experiments for the catalytic performance of Ni NPs for reduction/degradation of dye. 2.3 Procedure for fabrication of Ni NPs and sample preparation for UV–vis spectroscopy In a typical experiment, a 10ml sample of Ni NPs in Milli-Q water was prepared by mixing 0.1ml (0.1M) NiCl2·6H2O and 0.5ml (0.5M) NaBH4 under gentle stirring using a magnetic stirrer. The solution turned dark brown in color during the addition of the reducing agent (NaBH4). Then 1.2ml (0.05M) of l-threonine was mixed in the solution instantly and the pH of the solution was adjusted to 8.5 using the required amounts of 1M NaOH. The mixture was left for 10–15min to ensure the completion of reduction and encapsulation of nickel ions to form neutral nanoscale objects. The solution was analyzed by UV–vis spectroscopy and it was found that the as-prepared sample of Ni NPs was stable for several hours. 2.4 Nanoparticle separation As-prepared l-threonine capped Ni NPs obtained in an aqueous medium were separated by means of high speed centrifugation using a KUBOTA 7780 refrigerated centrifuge, operated at 22,000rpm. The Ni NPs were collected at the bottom of the centrifuge tube, separated by decanting off the solvent and washed several times with Milli-Q water followed by thorough washing with acetone. These Ni NPs were obtained with 99% purity by density gradient ultracentrifugation from an aqueous medium and redispersed in ethanol by sonication on an ultrasonic device and collected in separate glass bottles, remaining stable for several days. 2.5 Instrumentation The UV–vis spectroscopy measurements taken during experiments to fabricate Ni NPs samples were performed using a double beam Lambda 35 spectrophotometer (Perkin Elmer) equipped with a cell of 1.0cm path length. Fourier transform infrared (FTIR) spectra of standard l-threonine and of Ni NPs capped with l-threonine molecules were recorded using a Nicolet 5700 (Thermo) using KBr discs of solid state amino acid standard and nanopowders. Atomic force microscopy (AFM) images were recorded using a Dimension 3100 AFM and Nanoscope IV controller (Veeco Instruments). Transmission electron micrographs (TEM) were taken with a JEOL JEM 1200 EX MKI operated at 120kV and magnifications up to 500,000. 2.6 Sample preparation for FTIR studies Solid state Ni NPs capped with l-threonine were separated from colloidal dispersions by putting large quantities of these products into petri dishes and drying within a hot water bath set to 80°C until complete evaporation of the solvent, with further drying in an oven at 100°C for 30min to confirm evaporation of residual solvent and water molecules. As-obtained Ni NPs samples were collected by scratching the NPs from surface of petri dishes and processed for FTIR spectroscopy. 2.7 Sample preparation for AFM studies 10μl volumes of colloidal l-threonine capped Ni NPs dispersions in ethanol solvent were put on glass cover slips and vacuum dried in a desiccator followed by air drying for 30min to ensure binding of Ni NPs with the glass surface and thorough loss of water molecules. 2.8 Sample preparation for TEM studies Small quantities of colloidal dispersions of l-threonine capped Ni NPs in ethanol solvent were mounted on carbon coated copper grids (300 mesh Cu, EM Science) by a dip coating method and forwarded for vacuum drying in a desiccator for 30min to ensure that solvent water/ethanol had been removed. 2.9 Catalytic test for reduction of dye The catalytic activity of newly synthesized l-threonine capped Ni NPs was investigated for reduction/degradation of CR by putting a solution having 20μM concentration of dye and 100mM NaBH4 in quartz cells and diagnosed with the help of UV–vis spectroscopy. Ni NPs were first deposited on broken pieces of glass cover slips and dried by heating to get fine attachment with the surface of glass. These glass cover slips were weighed before and after deposition of Ni NPs to find out the weight of deposited Ni nanocatalysts. The cover slips with appropriate weight were put inside the quartz cell containing the dye and NaBH4 containing solution. UV–vis spectra were recorded for various experiments to see the reduction of the CR dye. Optimizations of various parameters like molar concentration of dye (20μM CR), reducing agent (100mM NaBH4), loading quantity of the catalyst (0.2mg Ni NPs), reaction time (50s) and yield of reduction (100%) at fixed NPs quantity were carried out. 3 Results and discussions We introduced a method for fabrication of well dispersed spherical Ni NPs consisting of amino acid layers on the nanoparticle surfaces. Evidence for fabrication of Ni NPs has been demonstrated by several characterization techniques. 3.1 UV–vis spectroscopy UV–vis spectra based on the variation of l-threonine concentrations with respect to the constant concentration of precursor Ni are shown in Fig. 1 . A continuous blue is recorded upon the increase in concentration of l-threonine which indicates the formation of smaller Ni NPs at high concentration of capping agent. In the absence of capping agent the reduced nickel ions form atomic nickel which then undergoes nucleation to produce strongly bound homo atomic aggregates of tiny black particles. On the other hand, the addition of l-threonine immediately after the addition of sodium borohydride to nickel chloride solution resulted in the formation of relatively stable black colloidal dispersions. The l-threonine molecules were naturally sorbed on the surface of nanocomposites via the amino group which subsequently helped in the growth patterning of these nanocomposites into spherical shapes. As-obtained colloidal dispersions of Ni NPs in aqueous environments were then separated by high speed centrifugation and redispersed into ethanol and found to be highly stable for several months; however, freshly fabricated Ni NPs were comparatively unstable in aqueous environments. The physisorption of l-threonine molecules onto the particle surfaces showed strong dependency on the solution medium, which might be due to the zwitterionic property of amino acid molecules, that is their tendency to form doubly charged ions. This is necessarily the case in favor of smaller non-covalently bonded l-threonine molecules at the surface of Ni NPs. 3.2 Fourier transform infrared (FTIR) spectroscopy FTIR spectra for l-threonine and Ni NPs capped with l-threonine molecules are shown in Fig. 2 . These spectra provide supporting evidence for nanofabricated architectures estimated by underlying homogeneous distributions realized through UV–vis spectroscopic studies and those shown in AFM images. The FTIR spectrum of pure l-threonine (Fig. 2a) illustrates a zwitterionic band at 2050cm−1 that is absent in the FTIR spectrum of Ni NPs (Fig. 2b). IR spectra of nickel nanocomposites show two broad and strong signals at 1630cm−1 and 1390cm−1 which can be assigned to hydroxyl groups [16,17]. Similar peaks have been seen at 1651cm−1 and 1382cm−1 by other workers [18]. The complex spectral bands below 1500cm−1 are assigned to CH bending vibrations resulting from methylene and methyl groups and the weak IR signals in the range 1200–1050cm−1 can be attributed to CN stretching due to the presence of amino groups [19]. This is also clear from the FTIR spectra recorded for standard l-threonine and Ni NPs as shown in Fig. 2. That one broad band above 3000cm−1 is present with no changes corresponding to the presence of OH (3400cm−1) and NH (3170cm−1) stretching frequencies experienced by –COOH and –NH2 groups. This confirms the surface binding of nanoscale nickel composites via amino linkages. In the light of the whole study it is confirmed that the amino group of the amino acid is interacted with Ni NPs and hence this group is responsible for the formation of nanoparticles. 3.3 Atomic force microscopy (AFM) AFM micrographs present highly distributed Ni NPs grown after capping with l-threonine molecules on glass cover slips as shown in Fig. 3 . One of the most useful aspects of atomic force microscopy is its ability to measure quantitative special dimensions of a variety of surface features like small particles deposited on a substrate or etch pits. Size homogeneity and nanoscale dimensions of the as prepared Ni NPs were examined using AFM as well as TEM data which were found to be in good agreement. Fig. 4 presents the size distribution, color changes in Ni NPs solution and mechanistic diagram of the formation of Ni NPs via specific interactions. AFM analysis reveals that the products correspond to well dispersed and roughened surface nanoscale nickel particles. We present different colors and percent numbers to state the size distribution of l-threonine capped Ni NPs, revealing a major contribution of 34.66% of Ni NPs with sizes 5.08nm, 30.75% of 4.49nm, 23.06% of 3.37nm and 11.51% of 1.68nm respectively. Each amino acid molecule could be individually attached at the surface of small nanocomposites and the final structure undoubtedly follows a similar shape. 3.4 Transmission electron microscopy (TEM) High resolution TEM is used to examine the size and shape of very small nanoscale objects and is also helpful to investigate the structure and chemistry of nanomaterials [20,21]. A sample of powdered Ni NPs dispersed in ethanol using an ultrasonic device and mounted on carbon coated copper grids was prepared to carry out TEM characterization as presented in Fig. 5 . The nanoscale nickel structures are known to have a tendency to connect with each other through their magnetic dipole interaction [22]. Therefore, it is very difficult to prepare isolated magnetic nanoparticles as the particles undergo agglomeration easily [15]. In order to stop agglomeration, we employed l-threonine to cap the Ni NPs via nitrogen atoms which resulted in the formation of one dimensional assemblies of reduced nickel atoms and agglomeration was minimized as evidenced by the AFM images. The variation in structure and assembly apparent in the AFM and TEM images is due to the use of different substrates, glass in the case of AFM and carbon coated copper grids for the TEM. Similar variations based on differences in the substrate nature have been reported with SEM and TEM [23]. 3.5 Chemical properties of congo red Congo red (C32H22N6O6S2, MW-696.7) is a linear symmetrical molecule. It possesses a hydrophobic center made up of two phenyl rings bound together via diazo (–NN–) linkages with two charged terminal naphthalene moieties which contain sulfonic acid (–HSO3) and amino (–NH2) groups as shown in Fig. 6 . The CR dye molecule is approximately 2.1nm in diameter which on dissociation via diazo linkages produces chinone and sulfonazo forms [15] as depicted in Fig. 6b and c. 3.6 Catalytic activity UV–vis spectral studies were carried out to check the performance of freshly prepared Ni NPs for the catalytic reduction/degradation of CR dye as illustrated in Fig. 7 . We observed high catalytic efficiency of the l threonine capped Ni NPs fabricated by our newly introduced rapid and inexpensive synthetic route. Fig. 7a reveals the absorption profile of CR dye in Milli-Q water. It is observed that peaks at 498nm, 348nm and 238nm were stable and did not undergo structural transformations initially under UV–vis irradiations alone even after one hour of irradiation. However, we observed the process of decolorization/degradation of dye after addition of Ni NPs catalyst, in the presence of sodium borohydride. The spectra are shown with respect to time (Fig. 7b). The UV–vis spectral studies suggest the complete degradation of the CR dye within 50s which highlights the exceptional catalytic potential of the Ni NPs. The degradation of the dye was characterized by a steady decrease in absorption at 498nm and 348nm which are estimated to be attacked by electrons on the nitrogen double bonds located principally at 348nm [24]. The UV–vis spectra were recorded periodically and we found gradual decreases in absorption at 498nm and 348nm, whereas completely inverse behavior at 278nm and 249nm (regular increases) was observed, which is attributed to the formation of smaller structural units. This characteristic behavior of CR dye resulted from the addition of NaBH4 under the influence of Ni NPs catalyst. UV–vis spectra also showed isobestic points in the spectral profiles around 300nm, a clear indication for degradation of large dye molecules to smaller fragments, i.e. low molecular weight compounds. 3.7 Recovery and reuse of Ni NPs catalyst The newly devised protocol to fabricate and use l-threonine capped Ni NPs for catalytic reduction degradation of congo red dye demonstrates simple and effortless recovery to reuse these nanoparticles several times. A bar graph presenting the clear picture of high catalytic efficiency of l-threonine capped Ni NPs after even five times use is shown in Fig. 8 . The same NPs reduced/degraded 20μM congo red dye within 50s each time. Ni NPs used for catalytic application were deposited on pieces of glass cover slips which were easily recovered after use and washed with sufficient quantity of deionized water followed by drying on hot plate already set at 100°C (for 10min) to remove water vapors. We observed negligible/no loss of activity for the reduction reaction. 4 Conclusions It is suggested that simplicity, cost effectiveness and safety of the present nanoparticle fabrication route supersedes numerous procedures to manufacture well dispersed Ni NPs with spherical shapes. Appropriate amounts of NaOH/HCl were added to adjust the pH in the range 2.6–11.3; however, the basic pH 8.5 was found to favor the formation of spherical and well dispersed Ni NPs as shown in TEM micrographs. The microscope studies reveal that bigger Ni NPs are formed from small individual nanocomposites with fine crystalline structures. Freshly prepared Ni NPs deposited on glass surfaces produce significantly high yields for catalytic performance. We observed complete degradation of 20μM concentrations of dye with 0.1M NaBH4 within 50s during the course of reaction under UV–vis irradiation in the presence of nanoparticles. The Ni NPs have been found easy to recover and reuse several times without loss of activity. Acknowledgments We acknowledge the Higher Education Commission, Islamabad, Pakistan and the University of Bristol, Bristol, United Kingdom for provision of funding and facilities during this research. Thanks go to Dr. Sean Davis and Dr. Loren Picco of the University of Bristol, Bristol, United Kingdom for their kind assistance with microscopy studies. References [1] J.E. Hutchison ACS Nano 2 2008 395 402 [2] L.H. Andrew W.E. Mary Langmuir 24 2008 14195 14202 [3] C. Yu Y. Yu H. Sun T. Xu X. Li W. Li Mater. Lett. 61 2007 1859 1862 [4] A. Faramarzi S. Sanjabi J. Phys. Chem. C 115 2011 18958 18966 [5] A.G. Boudjahem S. Monteverdi M. Mercy M.M. Bettahar J. Catal. 221 2004 325 334 [6] P. Laaksonen J. Kivioja A. Paananen M. Kainlauri K. Kontturi J. Ahopelto M.B. Linder Langmuir 25 2009 5185 5192 [7] M. Xiaoming C. Huifeng Y. Lin W. Kui G. Yuming Y. Lan Angew. Chem. Int. Ed. Engl. 50 2011 7414 7417 [8] M. Xiaoming L. Liping Y. Lin S. Caiyun W. Kui Y. Shibao Z. Jianguo J. Hazard. Mater. 209–210 2012 467 477 [9] N.H. Kalwar Sirajuddin S.T.H. Sherazi M.I. Abro Z.A. Tagar S.S. Hassan Y. Junejo M.I. Khattak Appl Catal A. 400 2011 215 220 [10] M.N. Ahmed R.N. Ram Environ. Pollut. 77 1992 79 86 [11] G. MacKay B.A.A. Al-Duri Colourage 35 1998 24 28 [12] S.A. Quaradawi R.S. Salaman J. Photochem. Photobiol. A: Chem. 48 2002 161 168 [13] G. Sauer G.C. Neto H.J. Jose R.F.P.M. Moreira J. Photochem. Photobiol. A: Chem. 14 2002 147 154 [14] D. Kamel A. Sihem C. Halima S. Tahar Desalination 247 2009 412 422 [15] P. Frid S.V. Anisimov N. Popovic Brain Res. Rev. 53 2007 135 160 [16] X.Y. Gao S.Y. Wang J. Li Y.X. Zheng R.J. Zhang P. Zhou Y.M. Yang L.Y. Chen Thin Solid Films 438 2004 455 456 [17] W.H. Hobart M.L. Lynne Jr. J.A. Dean F.A. Settle Instrumental Methods of Analysis seventh ed. 1986 CBS Publishers and Distributors New Delhi [18] R. Janardhanan M. Karuppaiah N. Hebalkar T.N. Rao Polyhedron 28 2009 2522 2530 [19] M.L. Singla A. Negi V. Mahajan K.C. Singh D.V.S. Jain Appl. Catal. A. 323 2007 51 57 [20] M. Tanase L.A. Bauer A. Hultgren D.M. Silevitch L. Sun D.H. Reich P.C. Searson G.J. Meyer Nano Lett. 1 2001 155 158 [21] Z.L. Wang J. Phys. Chem. B 104 2000 1153 1175 [22] D. Li S. Komarneni J. Am. Ceram. Soc. 89 2006 1510 1517 [23] S.S. Hassan Sirajuddin A.R. Solangi M.H. Agheem Y. Junejo N.H. Kalwar Z.A. Tagar J. Hazard. Mater. 190 2011 1030 1036 [24] T.E. Sladewski A.S. Shafer C.M. Hoag Spectrochim. Acta. Part A. 65 2006 985 987",
      "scopus-id": "84873626258",
      "coredata": {
        "eid": "1-s2.0-S0926860X12007545",
        "dc:description": "A facile and green seed mediated growth approach for fabrication of well dispersed l-threonine derived nickel nanoparticles (Ni NPs) in an aqueous medium via a modified borohydride reduction method is described. l-Threonine molecules served to organize the nanoscale composites in the form of well dispersed Ni NPs. The basic pH 8.5 was found to favor the formation of spherical and well dispersed Ni NPs as shown in transmission electron microscopy (TEM) micrographs. Freshly prepared Ni NPs possess the nanoscale dimension of 1.68–5.06nm, as determined from atomic force microscopy (AFM) and TEM data. The Ni NPs thus prepared were used for their catalytic potential in the reduction of congo red (CR) dye selected as a model reagent. The results revealed negligible reduction of dye in the absence of Ni NPs. Conversely the addition of only 0.2mg Ni NPs produced 100% reduction/degradation efficiency. The used Ni NPs were recovered and reutilized several times for reducing CR without any loss of activity. The current findings are equally extendable for safeguarding the aquatic environment against the pollution caused by other dyes via a facile, highly economical, rapid and efficient reduction/degradation method based on the catalytic potential of Ni NPs.",
        "openArchiveArticle": "false",
        "prism:coverDate": "2013-02-26",
        "openaccessUserLicense": null,
        "prism:aggregationType": "Journal",
        "prism:url": "https://api.elsevier.com/content/article/pii/S0926860X12007545",
        "dc:creator": [
          {
            "@_fa": "true",
            "$": "Kalwar, Nazar Hussain"
          },
          {
            "@_fa": "true",
            "$": "Sirajuddin,"
          },
          {
            "@_fa": "true",
            "$": "Sherazi, Syed Tufail Hussain"
          },
          {
            "@_fa": "true",
            "$": "Khaskheli, Abdul Rauf"
          },
          {
            "@_fa": "true",
            "$": "Hallam, Keith Richard"
          },
          {
            "@_fa": "true",
            "$": "Scott, Thomas Bligh"
          },
          {
            "@_fa": "true",
            "$": "Tagar, Zulfiqar Ali"
          },
          {
            "@_fa": "true",
            "$": "Hassan, Syeda Sara"
          },
          {
            "@_fa": "true",
            "$": "Soomro, Razium Ali"
          }
        ],
        "link": [
          {
            "@_fa": "true",
            "@rel": "self",
            "@href": "https://api.elsevier.com/content/article/pii/S0926860X12007545"
          },
          {
            "@_fa": "true",
            "@rel": "scidir",
            "@href": "https://www.sciencedirect.com/science/article/pii/S0926860X12007545"
          }
        ],
        "dc:format": "application/json",
        "openaccessType": null,
        "pii": "S0926-860X(12)00754-5",
        "prism:volume": "453",
        "prism:publisher": "Elsevier B.V. Published by Elsevier B.V.",
        "dc:title": "Fabrication of small l-threonine capped nickel nanoparticles and their catalytic application",
        "prism:copyright": "Copyright © 2012 Elsevier B.V. Published by Elsevier B.V. All rights reserved.",
        "openaccess": "0",
        "prism:issn": "0926860X",
        "dcterms:subject": [
          {
            "@_fa": "true",
            "$": "l-Threonine"
          },
          {
            "@_fa": "true",
            "$": "Sodium borohydride"
          },
          {
            "@_fa": "true",
            "$": "Nickel nanoparticles"
          },
          {
            "@_fa": "true",
            "$": "Catalytic degradation"
          },
          {
            "@_fa": "true",
            "$": "Congo red"
          }
        ],
        "openaccessArticle": "false",
        "prism:publicationName": "Applied Catalysis A: General",
        "openaccessSponsorType": null,
        "prism:pageRange": "54-59",
        "prism:endingPage": "59",
        "pubType": "fla",
        "prism:coverDisplayDate": "26 February 2013",
        "prism:doi": "10.1016/j.apcata.2012.12.005",
        "prism:startingPage": "54",
        "dc:identifier": "doi:10.1016/j.apcata.2012.12.005",
        "openaccessSponsorName": null
      },
      "objects": {
        "object": [
          {
            "@category": "high",
            "@height": "886",
            "@width": "1016",
            "@_fa": "true",
            "$": "https://api.elsevier.com/content/object/eid/1-s2.0-S0926860X12007545-fx1_lrg.jpg?httpAccept=%2A%2F%2A",
            "@multimediatype": "JPEG image file",
            "@type": "IMAGE-HIGH-RES",
            "@size": "132648",
            "@ref": "fx1",
            "@mimetype": "image/jpeg"
          },
          {
            "@category": "high",
            "@height": "725",
            "@width": "950",
            "@_fa": "true",
            "$": "https://api.elsevier.com/content/object/eid/1-s2.0-S0926860X12007545-gr5_lrg.jpg?httpAccept=%2A%2F%2A",
            "@multimediatype": "JPEG image file",
            "@type": "IMAGE-HIGH-RES",
            "@size": "132107",
            "@ref": "gr5",
            "@mimetype": "image/jpeg"
          },
          {
            "@category": "high",
            "@height": "1216",
            "@width": "1435",
            "@_fa": "true",
            "$": "https://api.elsevier.com/content/object/eid/1-s2.0-S0926860X12007545-gr4_lrg.jpg?httpAccept=%2A%2F%2A",
            "@multimediatype": "JPEG image file",
            "@type": "IMAGE-HIGH-RES",
            "@size": "180861",
            "@ref": "gr4",
            "@mimetype": "image/jpeg"
          },
          {
            "@category": "high",
            "@height": "2102",
            "@width": "1350",
            "@_fa": "true",
            "$": "https://api.elsevier.com/content/object/eid/1-s2.0-S0926860X12007545-gr3_lrg.jpg?httpAccept=%2A%2F%2A",
            "@multimediatype": "JPEG image file",
            "@type": "IMAGE-HIGH-RES",
            "@size": "467806",
            "@ref": "gr3",
            "@mimetype": "image/jpeg"
          },
          {
            "@category": "high",
            "@height": "1070",
            "@width": "1390",
            "@_fa": "true",
            "$": "https://api.elsevier.com/content/object/eid/1-s2.0-S0926860X12007545-gr8_lrg.jpg?httpAccept=%2A%2F%2A",
            "@multimediatype": "JPEG image file",
            "@type": "IMAGE-HIGH-RES",
            "@size": "86231",
            "@ref": "gr8",
            "@mimetype": "image/jpeg"
          },
          {
            "@category": "high",
            "@height": "2344",
            "@width": "1504",
            "@_fa": "true",
            "$": "https://api.elsevier.com/content/object/eid/1-s2.0-S0926860X12007545-gr7_lrg.jpg?httpAccept=%2A%2F%2A",
            "@multimediatype": "JPEG image file",
            "@type": "IMAGE-HIGH-RES",
            "@size": "327790",
            "@ref": "gr7",
            "@mimetype": "image/jpeg"
          },
          {
            "@category": "high",
            "@height": "1425",
            "@width": "1583",
            "@_fa": "true",
            "$": "https://api.elsevier.com/content/object/eid/1-s2.0-S0926860X12007545-gr6_lrg.jpg?httpAccept=%2A%2F%2A",
            "@multimediatype": "JPEG image file",
            "@type": "IMAGE-HIGH-RES",
            "@size": "203433",
            "@ref": "gr6",
            "@mimetype": "image/jpeg"
          },
          {
            "@category": "high",
            "@height": "1124",
            "@width": "1468",
            "@_fa": "true",
            "$": "https://api.elsevier.com/content/object/eid/1-s2.0-S0926860X12007545-gr2_lrg.jpg?httpAccept=%2A%2F%2A",
            "@multimediatype": "JPEG image file",
            "@type": "IMAGE-HIGH-RES",
            "@size": "179477",
            "@ref": "gr2",
            "@mimetype": "image/jpeg"
          },
          {
            "@category": "high",
            "@height": "1192",
            "@width": "1463",
            "@_fa": "true",
            "$": "https://api.elsevier.com/content/object/eid/1-s2.0-S0926860X12007545-gr1_lrg.jpg?httpAccept=%2A%2F%2A",
            "@multimediatype": "JPEG image file",
            "@type": "IMAGE-HIGH-RES",
            "@size": "177163",
            "@ref": "gr1",
            "@mimetype": "image/jpeg"
          },
          {
            "@category": "standard",
            "@height": "200",
            "@width": "229",
            "@_fa": "true",
            "$": "https://api.elsevier.com/content/object/eid/1-s2.0-S0926860X12007545-fx1.jpg?httpAccept=%2A%2F%2A",
            "@multimediatype": "JPEG image file",
            "@type": "IMAGE-DOWNSAMPLED",
            "@size": "15223",
            "@ref": "fx1",
            "@mimetype": "image/jpeg"
          },
          {
            "@category": "standard",
            "@height": "272",
            "@width": "357",
            "@_fa": "true",
            "$": "https://api.elsevier.com/content/object/eid/1-s2.0-S0926860X12007545-gr5.jpg?httpAccept=%2A%2F%2A",
            "@multimediatype": "JPEG image file",
            "@type": "IMAGE-DOWNSAMPLED",
            "@size": "37217",
            "@ref": "gr5",
            "@mimetype": "image/jpeg"
          },
          {
            "@category": "standard",
            "@height": "275",
            "@width": "324",
            "@_fa": "true",
            "$": "https://api.elsevier.com/content/object/eid/1-s2.0-S0926860X12007545-gr4.jpg?httpAccept=%2A%2F%2A",
            "@multimediatype": "JPEG image file",
            "@type": "IMAGE-DOWNSAMPLED",
            "@size": "31684",
            "@ref": "gr4",
            "@mimetype": "image/jpeg"
          },
          {
            "@category": "standard",
            "@height": "475",
            "@width": "305",
            "@_fa": "true",
            "$": "https://api.elsevier.com/content/object/eid/1-s2.0-S0926860X12007545-gr3.jpg?httpAccept=%2A%2F%2A",
            "@multimediatype": "JPEG image file",
            "@type": "IMAGE-DOWNSAMPLED",
            "@size": "50066",
            "@ref": "gr3",
            "@mimetype": "image/jpeg"
          },
          {
            "@category": "standard",
            "@height": "242",
            "@width": "314",
            "@_fa": "true",
            "$": "https://api.elsevier.com/content/object/eid/1-s2.0-S0926860X12007545-gr8.jpg?httpAccept=%2A%2F%2A",
            "@multimediatype": "JPEG image file",
            "@type": "IMAGE-DOWNSAMPLED",
            "@size": "11584",
            "@ref": "gr8",
            "@mimetype": "image/jpeg"
          },
          {
            "@category": "standard",
            "@height": "528",
            "@width": "339",
            "@_fa": "true",
            "$": "https://api.elsevier.com/content/object/eid/1-s2.0-S0926860X12007545-gr7.jpg?httpAccept=%2A%2F%2A",
            "@multimediatype": "JPEG image file",
            "@type": "IMAGE-DOWNSAMPLED",
            "@size": "34321",
            "@ref": "gr7",
            "@mimetype": "image/jpeg"
          },
          {
            "@category": "standard",
            "@height": "321",
            "@width": "357",
            "@_fa": "true",
            "$": "https://api.elsevier.com/content/object/eid/1-s2.0-S0926860X12007545-gr6.jpg?httpAccept=%2A%2F%2A",
            "@multimediatype": "JPEG image file",
            "@type": "IMAGE-DOWNSAMPLED",
            "@size": "23287",
            "@ref": "gr6",
            "@mimetype": "image/jpeg"
          },
          {
            "@category": "standard",
            "@height": "253",
            "@width": "331",
            "@_fa": "true",
            "$": "https://api.elsevier.com/content/object/eid/1-s2.0-S0926860X12007545-gr2.jpg?httpAccept=%2A%2F%2A",
            "@multimediatype": "JPEG image file",
            "@type": "IMAGE-DOWNSAMPLED",
            "@size": "20709",
            "@ref": "gr2",
            "@mimetype": "image/jpeg"
          },
          {
            "@category": "standard",
            "@height": "269",
            "@width": "330",
            "@_fa": "true",
            "$": "https://api.elsevier.com/content/object/eid/1-s2.0-S0926860X12007545-gr1.jpg?httpAccept=%2A%2F%2A",
            "@multimediatype": "JPEG image file",
            "@type": "IMAGE-DOWNSAMPLED",
            "@size": "18854",
            "@ref": "gr1",
            "@mimetype": "image/jpeg"
          },
          {
            "@category": "thumbnail",
            "@height": "164",
            "@width": "188",
            "@_fa": "true",
            "$": "https://api.elsevier.com/content/object/eid/1-s2.0-S0926860X12007545-fx1.sml?httpAccept=%2A%2F%2A",
            "@multimediatype": "GIF image file",
            "@type": "IMAGE-THUMBNAIL",
            "@size": "8404",
            "@ref": "fx1",
            "@mimetype": "image/gif"
          },
          {
            "@category": "thumbnail",
            "@height": "164",
            "@width": "215",
            "@_fa": "true",
            "$": "https://api.elsevier.com/content/object/eid/1-s2.0-S0926860X12007545-gr5.sml?httpAccept=%2A%2F%2A",
            "@multimediatype": "GIF image file",
            "@type": "IMAGE-THUMBNAIL",
            "@size": "9306",
            "@ref": "gr5",
            "@mimetype": "image/gif"
          },
          {
            "@category": "thumbnail",
            "@height": "164",
            "@width": "193",
            "@_fa": "true",
            "$": "https://api.elsevier.com/content/object/eid/1-s2.0-S0926860X12007545-gr4.sml?httpAccept=%2A%2F%2A",
            "@multimediatype": "GIF image file",
            "@type": "IMAGE-THUMBNAIL",
            "@size": "7916",
            "@ref": "gr4",
            "@mimetype": "image/gif"
          },
          {
            "@category": "thumbnail",
            "@height": "163",
            "@width": "105",
            "@_fa": "true",
            "$": "https://api.elsevier.com/content/object/eid/1-s2.0-S0926860X12007545-gr3.sml?httpAccept=%2A%2F%2A",
            "@multimediatype": "GIF image file",
            "@type": "IMAGE-THUMBNAIL",
            "@size": "6138",
            "@ref": "gr3",
            "@mimetype": "image/gif"
          },
          {
            "@category": "thumbnail",
            "@height": "164",
            "@width": "213",
            "@_fa": "true",
            "$": "https://api.elsevier.com/content/object/eid/1-s2.0-S0926860X12007545-gr8.sml?httpAccept=%2A%2F%2A",
            "@multimediatype": "GIF image file",
            "@type": "IMAGE-THUMBNAIL",
            "@size": "5371",
            "@ref": "gr8",
            "@mimetype": "image/gif"
          },
          {
            "@category": "thumbnail",
            "@height": "164",
            "@width": "105",
            "@_fa": "true",
            "$": "https://api.elsevier.com/content/object/eid/1-s2.0-S0926860X12007545-gr7.sml?httpAccept=%2A%2F%2A",
            "@multimediatype": "GIF image file",
            "@type": "IMAGE-THUMBNAIL",
            "@size": "3778",
            "@ref": "gr7",
            "@mimetype": "image/gif"
          },
          {
            "@category": "thumbnail",
            "@height": "164",
            "@width": "182",
            "@_fa": "true",
            "$": "https://api.elsevier.com/content/object/eid/1-s2.0-S0926860X12007545-gr6.sml?httpAccept=%2A%2F%2A",
            "@multimediatype": "GIF image file",
            "@type": "IMAGE-THUMBNAIL",
            "@size": "4443",
            "@ref": "gr6",
            "@mimetype": "image/gif"
          },
          {
            "@category": "thumbnail",
            "@height": "164",
            "@width": "214",
            "@_fa": "true",
            "$": "https://api.elsevier.com/content/object/eid/1-s2.0-S0926860X12007545-gr2.sml?httpAccept=%2A%2F%2A",
            "@multimediatype": "GIF image file",
            "@type": "IMAGE-THUMBNAIL",
            "@size": "5687",
            "@ref": "gr2",
            "@mimetype": "image/gif"
          },
          {
            "@category": "thumbnail",
            "@height": "164",
            "@width": "201",
            "@_fa": "true",
            "$": "https://api.elsevier.com/content/object/eid/1-s2.0-S0926860X12007545-gr1.sml?httpAccept=%2A%2F%2A",
            "@multimediatype": "GIF image file",
            "@type": "IMAGE-THUMBNAIL",
            "@size": "5373",
            "@ref": "gr1",
            "@mimetype": "image/gif"
          }
        ]
      },
      "link": {
        "@rel": "abstract",
        "@href": "https://api.elsevier.com/content/abstract/scopus_id/84873626258"
      }
    }
  }
}