{
  "metadata": {
    "title": "Kinetic studies of methanol steam reforming over Pd/ZnO catalyst using a microchannel reactor",
    "authors": "; ; ",
    "journal": "Applied Catalysis A: General",
    "date": "2004-05-10",
    "doi": "10.1016/j.apcata.2003.11.043",
    "abstract": "",
    "uri": "https://api.elsevier.com/content/article/pii/S0926860X03010032",
    "pii": "S0926860X03010032"
  },
  "fulltext": {
    "full-text-retrieval-response": {
      "scopus-eid": "2-s2.0-1942477667",
      "originalText": "serial JL 271346 291210 291744 291809 31 Applied Catalysis A: General APPLIEDCATALYSISAGENERAL 2004-03-02 2004-03-02 2010-11-13T22:12:05 1-s2.0-S0926860X03010032 S0926-860X(03)01003-2 S0926860X03010032 10.1016/j.apcata.2003.11.043 S300 S300.1 FULL-TEXT 1-s2.0-S0926860X00X0302X 2024-01-01T12:23:09.046435Z 0 0 20040510 2004 2004-03-02T00:00:00Z articleinfo crossmark dco dateupdated tomb dateloaded datesearch indexeddate issuelist volumelist yearnav absattachment articletitlenorm authfirstinitialnorm authfirstsurnamenorm cid cids contenttype copyright dateloadedtxt docsubtype doctype doi eid ewtransactionid hubeid issfirst issn issnnorm itemstage itemtransactionid itemweight openaccess openarchive pg pgfirst pglast pii piinorm pubdatestart pubdatetxt pubyr sortorder srctitle srctitlenorm srctype subheadings volfirst volissue webpdf webpdfpagecount figure table body acknowledge affil articletitle auth authfirstini authfull authkeywords authlast primabst ref alllist content subj ssids 0926-860X 0926860X 262 262 1 1 Volume 262, Issue 1 4 19 29 19 29 20040510 10 May 2004 2004-05-10 2004 converted-article fla Copyright © 2004 Elsevier B.V. All rights reserved. KINETICSTUDIESMETHANOLSTEAMREFORMINGOVERPDZNOCATALYSTUSINGAMICROCHANNELREACTOR CAO C 1 Introduction 2 Experimental 3 Results and discussion 3.1 Kinetics of steam reforming of methanol 3.2 Performance comparison between the microchannel reactor and a conventional fixed bed reactor—evaluate catalyst at isothermal conditions 4 Conclusions Acknowledgements References HOLLADAY 2002 21 27 J PEPPLEY 1999 21 29 B PEPPLEY 1999 31 49 B JIANG 1993 245 255 C JIANG 1993 145 158 C SAMMS 2002 13 29 S ASPREY 1999 51 70 S TAKEZAWA 1997 45 56 N IWASA 2000 355 360 N IWASA 1995 145 157 N CHIN 2002 79 88 Y HU 2003 55 60 J CHIN 2003 193 201 Y IWASA 1993 211 216 N SEHR 1958 145 R CAOX2004X19 CAOX2004X19X29 CAOX2004X19XC CAOX2004X19X29XC item S0926-860X(03)01003-2 S0926860X03010032 1-s2.0-S0926860X03010032 10.1016/j.apcata.2003.11.043 271346 2024-01-01T12:23:09.046435Z 2004-05-10 1-s2.0-S0926860X03010032-main.pdf https://s3.amazonaws.com/prod-ucs-content-store-us-east/content/pii:S0926860X03010032/MAIN/application/pdf/3ae44e99288b208f7ccec1d4709d5d5e/main.pdf https://s3-eu-west-1.amazonaws.com/prod-ucs-content-store-eu-west/content/pii:S0926860X03010032/MAIN/application/pdf/3ae44e99288b208f7ccec1d4709d5d5e/main.pdf main.pdf pdf true 984025 MAIN 11 1-s2.0-S0926860X03010032-main_1.png https://s3.amazonaws.com/prod-ucs-content-store-us-east/content/pii:S0926860X03010032/PREVIEW/image/png/3cd966e43ff290b0863c7be0e88f49e2/main_1.png https://s3-eu-west-1.amazonaws.com/prod-ucs-content-store-eu-west/content/pii:S0926860X03010032/PREVIEW/image/png/3cd966e43ff290b0863c7be0e88f49e2/main_1.png main_1.png png 65440 849 656 IMAGE-WEB-PDF 1 1-s2.0-S0926860X03010032-si9.gif https://s3.amazonaws.com/prod-ucs-content-store-us-east/content/pii:S0926860X03010032/STRIPIN/image/gif/b167188e7596887e6341d72b618984c2/si9.gif https://s3-eu-west-1.amazonaws.com/prod-ucs-content-store-eu-west/content/pii:S0926860X03010032/STRIPIN/image/gif/b167188e7596887e6341d72b618984c2/si9.gif si9 si9.gif gif 721 20 182 ALTIMG 1-s2.0-S0926860X03010032-si8.gif https://s3.amazonaws.com/prod-ucs-content-store-us-east/content/pii:S0926860X03010032/STRIPIN/image/gif/fa82314a562fdaba44b861757291a2b6/si8.gif https://s3-eu-west-1.amazonaws.com/prod-ucs-content-store-eu-west/content/pii:S0926860X03010032/STRIPIN/image/gif/fa82314a562fdaba44b861757291a2b6/si8.gif si8 si8.gif gif 2072 50 402 ALTIMG 1-s2.0-S0926860X03010032-si7.gif https://s3.amazonaws.com/prod-ucs-content-store-us-east/content/pii:S0926860X03010032/STRIPIN/image/gif/c1506ac8db54fee006dc6f2c90c2e854/si7.gif https://s3-eu-west-1.amazonaws.com/prod-ucs-content-store-eu-west/content/pii:S0926860X03010032/STRIPIN/image/gif/c1506ac8db54fee006dc6f2c90c2e854/si7.gif si7 si7.gif gif 2090 44 411 ALTIMG 1-s2.0-S0926860X03010032-si6.gif https://s3.amazonaws.com/prod-ucs-content-store-us-east/content/pii:S0926860X03010032/STRIPIN/image/gif/62d595ccbf69810d693d7874befd2429/si6.gif https://s3-eu-west-1.amazonaws.com/prod-ucs-content-store-eu-west/content/pii:S0926860X03010032/STRIPIN/image/gif/62d595ccbf69810d693d7874befd2429/si6.gif si6 si6.gif gif 1559 39 285 ALTIMG 1-s2.0-S0926860X03010032-si5.gif https://s3.amazonaws.com/prod-ucs-content-store-us-east/content/pii:S0926860X03010032/STRIPIN/image/gif/d4477c5ef361c9e68bb10702c47874bd/si5.gif https://s3-eu-west-1.amazonaws.com/prod-ucs-content-store-eu-west/content/pii:S0926860X03010032/STRIPIN/image/gif/d4477c5ef361c9e68bb10702c47874bd/si5.gif si5 si5.gif gif 626 17 126 ALTIMG 1-s2.0-S0926860X03010032-si4.gif https://s3.amazonaws.com/prod-ucs-content-store-us-east/content/pii:S0926860X03010032/STRIPIN/image/gif/a0302de9a184557b420a3e220661cb08/si4.gif https://s3-eu-west-1.amazonaws.com/prod-ucs-content-store-eu-west/content/pii:S0926860X03010032/STRIPIN/image/gif/a0302de9a184557b420a3e220661cb08/si4.gif si4 si4.gif gif 1847 43 363 ALTIMG 1-s2.0-S0926860X03010032-si3.gif https://s3.amazonaws.com/prod-ucs-content-store-us-east/content/pii:S0926860X03010032/STRIPIN/image/gif/038d3289a746ae0e8f004d00006babf0/si3.gif https://s3-eu-west-1.amazonaws.com/prod-ucs-content-store-eu-west/content/pii:S0926860X03010032/STRIPIN/image/gif/038d3289a746ae0e8f004d00006babf0/si3.gif si3 si3.gif gif 883 42 135 ALTIMG 1-s2.0-S0926860X03010032-si21.gif https://s3.amazonaws.com/prod-ucs-content-store-us-east/content/pii:S0926860X03010032/STRIPIN/image/gif/f6c5ea0a78dba66aecf7116c88b4ee70/si21.gif https://s3-eu-west-1.amazonaws.com/prod-ucs-content-store-eu-west/content/pii:S0926860X03010032/STRIPIN/image/gif/f6c5ea0a78dba66aecf7116c88b4ee70/si21.gif si21 si21.gif gif 2215 36 563 ALTIMG 1-s2.0-S0926860X03010032-si20.gif https://s3.amazonaws.com/prod-ucs-content-store-us-east/content/pii:S0926860X03010032/STRIPIN/image/gif/4e5480b1c480ae12b06c9e69a1e7238e/si20.gif https://s3-eu-west-1.amazonaws.com/prod-ucs-content-store-eu-west/content/pii:S0926860X03010032/STRIPIN/image/gif/4e5480b1c480ae12b06c9e69a1e7238e/si20.gif si20 si20.gif gif 818 12 227 ALTIMG 1-s2.0-S0926860X03010032-si2.gif https://s3.amazonaws.com/prod-ucs-content-store-us-east/content/pii:S0926860X03010032/STRIPIN/image/gif/49de841b7803c586c92b1899200809d0/si2.gif https://s3-eu-west-1.amazonaws.com/prod-ucs-content-store-eu-west/content/pii:S0926860X03010032/STRIPIN/image/gif/49de841b7803c586c92b1899200809d0/si2.gif si2 si2.gif gif 568 14 144 ALTIMG 1-s2.0-S0926860X03010032-si19.gif https://s3.amazonaws.com/prod-ucs-content-store-us-east/content/pii:S0926860X03010032/STRIPIN/image/gif/1d2f42b164768f1f375c6de4f39dc171/si19.gif https://s3-eu-west-1.amazonaws.com/prod-ucs-content-store-eu-west/content/pii:S0926860X03010032/STRIPIN/image/gif/1d2f42b164768f1f375c6de4f39dc171/si19.gif si19 si19.gif gif 1790 21 443 ALTIMG 1-s2.0-S0926860X03010032-si18.gif https://s3.amazonaws.com/prod-ucs-content-store-us-east/content/pii:S0926860X03010032/STRIPIN/image/gif/aca6a130e492cfa399617305f6f1247d/si18.gif https://s3-eu-west-1.amazonaws.com/prod-ucs-content-store-eu-west/content/pii:S0926860X03010032/STRIPIN/image/gif/aca6a130e492cfa399617305f6f1247d/si18.gif si18 si18.gif gif 1088 36 198 ALTIMG 1-s2.0-S0926860X03010032-si17.gif https://s3.amazonaws.com/prod-ucs-content-store-us-east/content/pii:S0926860X03010032/STRIPIN/image/gif/afc5f875a272829021eae3a89acf1490/si13.gif https://s3-eu-west-1.amazonaws.com/prod-ucs-content-store-eu-west/content/pii:S0926860X03010032/STRIPIN/image/gif/afc5f875a272829021eae3a89acf1490/si13.gif si17 si17.gif gif 163 18 15 ALTIMG 1-s2.0-S0926860X03010032-si16.gif https://s3.amazonaws.com/prod-ucs-content-store-us-east/content/pii:S0926860X03010032/STRIPIN/image/gif/acdcb1c099ebdad3b07d38bbf0db13ea/si16.gif https://s3-eu-west-1.amazonaws.com/prod-ucs-content-store-eu-west/content/pii:S0926860X03010032/STRIPIN/image/gif/acdcb1c099ebdad3b07d38bbf0db13ea/si16.gif si16 si16.gif gif 201 21 25 ALTIMG 1-s2.0-S0926860X03010032-si15.gif https://s3.amazonaws.com/prod-ucs-content-store-us-east/content/pii:S0926860X03010032/STRIPIN/image/gif/75273196396615d55e12628ffbd7cca9/si15.gif https://s3-eu-west-1.amazonaws.com/prod-ucs-content-store-eu-west/content/pii:S0926860X03010032/STRIPIN/image/gif/75273196396615d55e12628ffbd7cca9/si15.gif si15 si15.gif gif 476 22 105 ALTIMG 1-s2.0-S0926860X03010032-si14.gif https://s3.amazonaws.com/prod-ucs-content-store-us-east/content/pii:S0926860X03010032/STRIPIN/image/gif/323ff23749823b137d2cb2f8fd540304/si12.gif https://s3-eu-west-1.amazonaws.com/prod-ucs-content-store-eu-west/content/pii:S0926860X03010032/STRIPIN/image/gif/323ff23749823b137d2cb2f8fd540304/si12.gif si14 si14.gif gif 180 21 15 ALTIMG 1-s2.0-S0926860X03010032-si13.gif https://s3.amazonaws.com/prod-ucs-content-store-us-east/content/pii:S0926860X03010032/STRIPIN/image/gif/afc5f875a272829021eae3a89acf1490/si13.gif https://s3-eu-west-1.amazonaws.com/prod-ucs-content-store-eu-west/content/pii:S0926860X03010032/STRIPIN/image/gif/afc5f875a272829021eae3a89acf1490/si13.gif si13 si13.gif gif 163 18 15 ALTIMG 1-s2.0-S0926860X03010032-si12.gif https://s3.amazonaws.com/prod-ucs-content-store-us-east/content/pii:S0926860X03010032/STRIPIN/image/gif/323ff23749823b137d2cb2f8fd540304/si12.gif https://s3-eu-west-1.amazonaws.com/prod-ucs-content-store-eu-west/content/pii:S0926860X03010032/STRIPIN/image/gif/323ff23749823b137d2cb2f8fd540304/si12.gif si12 si12.gif gif 180 21 15 ALTIMG 1-s2.0-S0926860X03010032-si11.gif https://s3.amazonaws.com/prod-ucs-content-store-us-east/content/pii:S0926860X03010032/STRIPIN/image/gif/fd181de2c1c1691ea0a22ba4829105d0/si11.gif https://s3-eu-west-1.amazonaws.com/prod-ucs-content-store-eu-west/content/pii:S0926860X03010032/STRIPIN/image/gif/fd181de2c1c1691ea0a22ba4829105d0/si11.gif si11 si11.gif gif 182 25 15 ALTIMG 1-s2.0-S0926860X03010032-si10.gif https://s3.amazonaws.com/prod-ucs-content-store-us-east/content/pii:S0926860X03010032/STRIPIN/image/gif/b391668f8363f51a50fa15929687ef55/si10.gif https://s3-eu-west-1.amazonaws.com/prod-ucs-content-store-eu-west/content/pii:S0926860X03010032/STRIPIN/image/gif/b391668f8363f51a50fa15929687ef55/si10.gif si10 si10.gif gif 1217 25 314 ALTIMG 1-s2.0-S0926860X03010032-si1.gif https://s3.amazonaws.com/prod-ucs-content-store-us-east/content/pii:S0926860X03010032/STRIPIN/image/gif/12c009b3822aade342c2fe7bad81e227/si1.gif https://s3-eu-west-1.amazonaws.com/prod-ucs-content-store-eu-west/content/pii:S0926860X03010032/STRIPIN/image/gif/12c009b3822aade342c2fe7bad81e227/si1.gif si1 true si1.gif gif 1792 21 443 ALTIMG 1-s2.0-S0926860X03010032-gr1.sml https://s3.amazonaws.com/prod-ucs-content-store-us-east/content/pii:S0926860X03010032/gr1/THUMBNAIL/image/gif/7e85607815b2c41a5d4be7f0eb318430/gr1.sml https://s3-eu-west-1.amazonaws.com/prod-ucs-content-store-eu-west/content/pii:S0926860X03010032/gr1/THUMBNAIL/image/gif/7e85607815b2c41a5d4be7f0eb318430/gr1.sml gr1 gr1.sml sml 1755 93 95 IMAGE-THUMBNAIL 1-s2.0-S0926860X03010032-gr1.jpg https://s3.amazonaws.com/prod-ucs-content-store-us-east/content/pii:S0926860X03010032/gr1/DOWNSAMPLED/image/jpeg/9823fd92ede9d37a9291a8579768bc3b/gr1.jpg https://s3-eu-west-1.amazonaws.com/prod-ucs-content-store-eu-west/content/pii:S0926860X03010032/gr1/DOWNSAMPLED/image/jpeg/9823fd92ede9d37a9291a8579768bc3b/gr1.jpg gr1 gr1.jpg jpg 14023 273 279 IMAGE-DOWNSAMPLED 1-s2.0-S0926860X03010032-gr2.sml https://s3.amazonaws.com/prod-ucs-content-store-us-east/content/pii:S0926860X03010032/gr2/THUMBNAIL/image/gif/fefebb5f7bdedc86d907a454d03a7cb9/gr2.sml https://s3-eu-west-1.amazonaws.com/prod-ucs-content-store-eu-west/content/pii:S0926860X03010032/gr2/THUMBNAIL/image/gif/fefebb5f7bdedc86d907a454d03a7cb9/gr2.sml gr2 gr2.sml sml 2730 90 125 IMAGE-THUMBNAIL 1-s2.0-S0926860X03010032-gr2.gif https://s3.amazonaws.com/prod-ucs-content-store-us-east/content/pii:S0926860X03010032/gr2/DOWNSAMPLED/image/gif/7433dde4fa2cf1e1023753b99db5e117/gr2.gif https://s3-eu-west-1.amazonaws.com/prod-ucs-content-store-eu-west/content/pii:S0926860X03010032/gr2/DOWNSAMPLED/image/gif/7433dde4fa2cf1e1023753b99db5e117/gr2.gif gr2 gr2.gif gif 13812 315 439 IMAGE-DOWNSAMPLED 1-s2.0-S0926860X03010032-gr3.sml https://s3.amazonaws.com/prod-ucs-content-store-us-east/content/pii:S0926860X03010032/gr3/THUMBNAIL/image/gif/7131daed3282127cbbfcb0642f2002ba/gr3.sml https://s3-eu-west-1.amazonaws.com/prod-ucs-content-store-eu-west/content/pii:S0926860X03010032/gr3/THUMBNAIL/image/gif/7131daed3282127cbbfcb0642f2002ba/gr3.sml gr3 gr3.sml sml 3072 73 125 IMAGE-THUMBNAIL 1-s2.0-S0926860X03010032-gr3.gif https://s3.amazonaws.com/prod-ucs-content-store-us-east/content/pii:S0926860X03010032/gr3/DOWNSAMPLED/image/gif/3d81ba199063146db7b736c9976a4fe6/gr3.gif https://s3-eu-west-1.amazonaws.com/prod-ucs-content-store-eu-west/content/pii:S0926860X03010032/gr3/DOWNSAMPLED/image/gif/3d81ba199063146db7b736c9976a4fe6/gr3.gif gr3 gr3.gif gif 16471 266 457 IMAGE-DOWNSAMPLED 1-s2.0-S0926860X03010032-gr4.sml https://s3.amazonaws.com/prod-ucs-content-store-us-east/content/pii:S0926860X03010032/gr4/THUMBNAIL/image/gif/2a8b312703780b53da66cad8e8667572/gr4.sml https://s3-eu-west-1.amazonaws.com/prod-ucs-content-store-eu-west/content/pii:S0926860X03010032/gr4/THUMBNAIL/image/gif/2a8b312703780b53da66cad8e8667572/gr4.sml gr4 gr4.sml sml 2584 67 125 IMAGE-THUMBNAIL 1-s2.0-S0926860X03010032-gr4.gif https://s3.amazonaws.com/prod-ucs-content-store-us-east/content/pii:S0926860X03010032/gr4/DOWNSAMPLED/image/gif/bb35c3b8a35df5e85a5eeee2711e00c2/gr4.gif https://s3-eu-west-1.amazonaws.com/prod-ucs-content-store-eu-west/content/pii:S0926860X03010032/gr4/DOWNSAMPLED/image/gif/bb35c3b8a35df5e85a5eeee2711e00c2/gr4.gif gr4 gr4.gif gif 12498 237 445 IMAGE-DOWNSAMPLED 1-s2.0-S0926860X03010032-gr5.sml https://s3.amazonaws.com/prod-ucs-content-store-us-east/content/pii:S0926860X03010032/gr5/THUMBNAIL/image/gif/d1119cd28296c9574a07b19ae9e7d1cd/gr5.sml https://s3-eu-west-1.amazonaws.com/prod-ucs-content-store-eu-west/content/pii:S0926860X03010032/gr5/THUMBNAIL/image/gif/d1119cd28296c9574a07b19ae9e7d1cd/gr5.sml gr5 gr5.sml sml 1914 83 125 IMAGE-THUMBNAIL 1-s2.0-S0926860X03010032-gr5.gif https://s3.amazonaws.com/prod-ucs-content-store-us-east/content/pii:S0926860X03010032/gr5/DOWNSAMPLED/image/gif/a4b003722534acb2b2f30018a2e7155f/gr5.gif https://s3-eu-west-1.amazonaws.com/prod-ucs-content-store-eu-west/content/pii:S0926860X03010032/gr5/DOWNSAMPLED/image/gif/a4b003722534acb2b2f30018a2e7155f/gr5.gif gr5 gr5.gif gif 6429 277 415 IMAGE-DOWNSAMPLED 1-s2.0-S0926860X03010032-gr6.sml https://s3.amazonaws.com/prod-ucs-content-store-us-east/content/pii:S0926860X03010032/gr6/THUMBNAIL/image/gif/2f752369faaa2b43b33d37cfa0c661b1/gr6.sml https://s3-eu-west-1.amazonaws.com/prod-ucs-content-store-eu-west/content/pii:S0926860X03010032/gr6/THUMBNAIL/image/gif/2f752369faaa2b43b33d37cfa0c661b1/gr6.sml gr6 gr6.sml sml 2795 83 125 IMAGE-THUMBNAIL 1-s2.0-S0926860X03010032-gr6.gif https://s3.amazonaws.com/prod-ucs-content-store-us-east/content/pii:S0926860X03010032/gr6/DOWNSAMPLED/image/gif/707268383038d9bca30e66e31efb8df9/gr6.gif https://s3-eu-west-1.amazonaws.com/prod-ucs-content-store-eu-west/content/pii:S0926860X03010032/gr6/DOWNSAMPLED/image/gif/707268383038d9bca30e66e31efb8df9/gr6.gif gr6 gr6.gif gif 9962 236 354 IMAGE-DOWNSAMPLED 1-s2.0-S0926860X03010032-gr7.sml https://s3.amazonaws.com/prod-ucs-content-store-us-east/content/pii:S0926860X03010032/gr7/THUMBNAIL/image/gif/f4aa358e3a0953c2d48574e2eabfb7ae/gr7.sml https://s3-eu-west-1.amazonaws.com/prod-ucs-content-store-eu-west/content/pii:S0926860X03010032/gr7/THUMBNAIL/image/gif/f4aa358e3a0953c2d48574e2eabfb7ae/gr7.sml gr7 gr7.sml sml 2505 86 125 IMAGE-THUMBNAIL 1-s2.0-S0926860X03010032-gr7.jpg https://s3.amazonaws.com/prod-ucs-content-store-us-east/content/pii:S0926860X03010032/gr7/DOWNSAMPLED/image/jpeg/107c62026aca7f7749aec8dda064eeaa/gr7.jpg https://s3-eu-west-1.amazonaws.com/prod-ucs-content-store-eu-west/content/pii:S0926860X03010032/gr7/DOWNSAMPLED/image/jpeg/107c62026aca7f7749aec8dda064eeaa/gr7.jpg gr7 gr7.jpg jpg 50530 414 605 IMAGE-DOWNSAMPLED 1-s2.0-S0926860X03010032-gr8.sml https://s3.amazonaws.com/prod-ucs-content-store-us-east/content/pii:S0926860X03010032/gr8/THUMBNAIL/image/gif/5c50123a2286057c7a1bffea92d994e4/gr8.sml https://s3-eu-west-1.amazonaws.com/prod-ucs-content-store-eu-west/content/pii:S0926860X03010032/gr8/THUMBNAIL/image/gif/5c50123a2286057c7a1bffea92d994e4/gr8.sml gr8 gr8.sml sml 1853 78 125 IMAGE-THUMBNAIL 1-s2.0-S0926860X03010032-gr8.gif https://s3.amazonaws.com/prod-ucs-content-store-us-east/content/pii:S0926860X03010032/gr8/DOWNSAMPLED/image/gif/0f0b265ffe6fbb32084530f5f8ae8e40/gr8.gif https://s3-eu-west-1.amazonaws.com/prod-ucs-content-store-eu-west/content/pii:S0926860X03010032/gr8/DOWNSAMPLED/image/gif/0f0b265ffe6fbb32084530f5f8ae8e40/gr8.gif gr8 gr8.gif gif 11599 260 419 IMAGE-DOWNSAMPLED 1-s2.0-S0926860X03010032-gr9.sml https://s3.amazonaws.com/prod-ucs-content-store-us-east/content/pii:S0926860X03010032/gr9/THUMBNAIL/image/gif/73f88c84d00e75393e22701e6e226848/gr9.sml https://s3-eu-west-1.amazonaws.com/prod-ucs-content-store-eu-west/content/pii:S0926860X03010032/gr9/THUMBNAIL/image/gif/73f88c84d00e75393e22701e6e226848/gr9.sml gr9 gr9.sml sml 3272 93 92 IMAGE-THUMBNAIL 1-s2.0-S0926860X03010032-gr9.jpg https://s3.amazonaws.com/prod-ucs-content-store-us-east/content/pii:S0926860X03010032/gr9/DOWNSAMPLED/image/jpeg/24020d88554e6fcf90d73e897f5177c5/gr9.jpg https://s3-eu-west-1.amazonaws.com/prod-ucs-content-store-eu-west/content/pii:S0926860X03010032/gr9/DOWNSAMPLED/image/jpeg/24020d88554e6fcf90d73e897f5177c5/gr9.jpg gr9 gr9.jpg jpg 26730 284 280 IMAGE-DOWNSAMPLED 1-s2.0-S0926860X03010032-gr10.sml https://s3.amazonaws.com/prod-ucs-content-store-us-east/content/pii:S0926860X03010032/gr10/THUMBNAIL/image/gif/bffbef75e95bf3d3b3fc235ca3bf2fd9/gr10.sml https://s3-eu-west-1.amazonaws.com/prod-ucs-content-store-eu-west/content/pii:S0926860X03010032/gr10/THUMBNAIL/image/gif/bffbef75e95bf3d3b3fc235ca3bf2fd9/gr10.sml gr10 gr10.sml sml 3344 71 125 IMAGE-THUMBNAIL 1-s2.0-S0926860X03010032-gr10.jpg https://s3.amazonaws.com/prod-ucs-content-store-us-east/content/pii:S0926860X03010032/gr10/DOWNSAMPLED/image/jpeg/5aed87ff1a7fa63fe4a596b74f404ba0/gr10.jpg https://s3-eu-west-1.amazonaws.com/prod-ucs-content-store-eu-west/content/pii:S0926860X03010032/gr10/DOWNSAMPLED/image/jpeg/5aed87ff1a7fa63fe4a596b74f404ba0/gr10.jpg gr10 gr10.jpg jpg 35077 246 436 IMAGE-DOWNSAMPLED 1-s2.0-S0926860X03010032-gr11.sml https://s3.amazonaws.com/prod-ucs-content-store-us-east/content/pii:S0926860X03010032/gr11/THUMBNAIL/image/gif/e8bdad0a25243bec335b732df0336af2/gr11.sml https://s3-eu-west-1.amazonaws.com/prod-ucs-content-store-eu-west/content/pii:S0926860X03010032/gr11/THUMBNAIL/image/gif/e8bdad0a25243bec335b732df0336af2/gr11.sml gr11 gr11.sml sml 2388 93 45 IMAGE-THUMBNAIL 1-s2.0-S0926860X03010032-gr11.jpg https://s3.amazonaws.com/prod-ucs-content-store-us-east/content/pii:S0926860X03010032/gr11/DOWNSAMPLED/image/jpeg/ea96ce253532442265d7bc9e6719cca2/gr11.jpg https://s3-eu-west-1.amazonaws.com/prod-ucs-content-store-eu-west/content/pii:S0926860X03010032/gr11/DOWNSAMPLED/image/jpeg/ea96ce253532442265d7bc9e6719cca2/gr11.jpg gr11 gr11.jpg jpg 23442 363 176 IMAGE-DOWNSAMPLED 1-s2.0-S0926860X03010032-gr12.sml https://s3.amazonaws.com/prod-ucs-content-store-us-east/content/pii:S0926860X03010032/gr12/THUMBNAIL/image/gif/0749233735c180fdc47d64ce2c70d2b0/gr12.sml https://s3-eu-west-1.amazonaws.com/prod-ucs-content-store-eu-west/content/pii:S0926860X03010032/gr12/THUMBNAIL/image/gif/0749233735c180fdc47d64ce2c70d2b0/gr12.sml gr12 gr12.sml sml 2251 87 125 IMAGE-THUMBNAIL 1-s2.0-S0926860X03010032-gr12.jpg https://s3.amazonaws.com/prod-ucs-content-store-us-east/content/pii:S0926860X03010032/gr12/DOWNSAMPLED/image/jpeg/c1bb9e7e8aafd449618e1866b5a57d75/gr12.jpg https://s3-eu-west-1.amazonaws.com/prod-ucs-content-store-eu-west/content/pii:S0926860X03010032/gr12/DOWNSAMPLED/image/jpeg/c1bb9e7e8aafd449618e1866b5a57d75/gr12.jpg gr12 gr12.jpg jpg 44810 421 603 IMAGE-DOWNSAMPLED APCATA 9063 S0926-860X(03)01003-2 10.1016/j.apcata.2003.11.043 Elsevier B.V. Fig. 1 Reactor assembly. Fig. 2 Schematic of reactor system process diagram. Fig. 3 Catalytic performance of Pd/ZnO catalyst in a microchannel reactor. Fig. 4 Isothermal lines of the microchannel reactor with Pd/ZnO catalyst. Fig. 5 Comparison between predicted rate and measured rate. Fig. 6 Steam partial pressure effect on MSR reaction rate in a differential reactor (T=210°C, p MeOH=34.2kPa). Fig. 7 Performance comparison of the tubular and the microchannel reactors (WHSV=4.53gMeOH/gcat/h). Fig. 8 Three-dimensional pseudo-homogenous model simulation sequence for methanol steam reformation. Fig. 9 Temperature profiles of the tubular reactor and the microchannel catalyst slab bed (wall temperature at 220°C, WHSV=4.53gMeOH/gcat/h). Fig. 10 Temperature profiles of the tubular reactor at different furnace temperatures (WHSV=4.53gMeOH/gcat/h). Fig. 11 Temperature profile of the microchannel reactor at high methanol conversion (WHSV=4.53gMeOH/gcat/h). Fig. 12 Temperature distribution along the catalytic bed in the microchannel reactor. Table 1 Measured reaction rate of steam reforming of methanol on Pd/ZnO catalyst T (°C) p MeOH (Pa) p H2O (Pa) −r MeOH (mmol/kgcat/s) 200 28395 28438 15.6360 200 28061 28104 15.4810 200 26072 26115 12.3506 200 23488 43585 14.0644 200 22543 42640 12.9670 200 21046 41143 12.8025 210 14712 34809 16.7242 210 19100 39197 19.8010 210 20520 40616 21.1594 210 23678 23722 22.2800 210 25988 26032 23.9855 210 26309 26353 25.8756 230 4130 24227 15.9968 230 10909 10952 23.4277 230 11615 31712 32.9046 230 14970 35067 40.8728 230 16363 16407 31.7301 230 19507 19551 46.1897 240 6969 27066 39.1951 240 11744 31841 52.2594 240 13680 33777 58.7933 240 4492 4535 19.9242 240 11871 11915 49.1613 240 16844 16888 64.0193 Table 2 Parameters of the rate equation E a (kJ/mol) 94.8 k 0 mmol/(kgcat·s·kPa0.803) 2.9047 × 1010 a 0.715 b 0.088 Kinetic studies of methanol steam reforming over Pd/ZnO catalyst using a microchannel reactor Chunshe Cao ∗ Gordon Xia Jamie Holladay Evan Jones Yong Wang Pacific Northwest National Laboratory, 902 Battelle Boulevard, MSIN: K8-93, Richland, WA 99352, USA * Corresponding author. A microchannel reactor with effective heat exchange has been developed to evaluate catalyst performance and measure reaction kinetics. The reactor provides an isothermal environment for rate measurement of the endothermic methanol steam reforming reactions over a Pd/ZnO catalyst in a wide temperature range (160–310°C). The apparent activation energy and rate equation have been determined to fit the power law expression: −r A (mmol/kg cat /s)=2.9047×1010 e −94800/RTp MeOH 0.715p H 2 O 0.088 This result provides kinetic data for the design of a miniature fuel processor for small fuel cell applications. The rate equation has been applied to a three-dimensional pseudo-homogeneous model to simulate temperature profiles in both microchannel and conventional fixed bed reactors. Keywords Kinetics Methanol steam reforming Microchannel reactor Pd/ZnO catalyst 1 Introduction Hydrocarbons such as gasoline, diesel, methanol, and ethanol have much higher energy densities than batteries in powering microelectronic devices [1,2]. However, optimizing the use of these energy sources requires a highly efficient fuel processor that extracts hydrogen from these fuels by processes such as catalytic steam reforming. The technology discussed here centers on the development of a miniature fuel processor for a small fuel cell application (<500mW), whereby a clean hydrogen-rich gas stream is generated with multistage processes (fuel vaporization, steam reforming, carbon monoxide reduction) within the integrated device [3]. For this technology, methanol was selected as the hydrogen source due to its “sweetness” (sulfur-free) and readiness of being activated at relatively low temperature (under 250°C). Low-temperature operation in such a miniature power device reduces the heat loss and insulation, thus improving the power density of the entire system. As part of the development work, kinetic measurements of the methanol steam reforming reaction were made to provide the direct rate information needed for reactor design and optimization. Kinetic data are conventionally collected from fixed bed reactors, typically a quartz microtubular reactor heated in a furnace. However, a significant drawback in such experiments is the non-isothermality of the catalytic bed caused by the strongly endothermic steam reforming reaction. In this paper, a microchannel integral reactor is developed to provide a completely isothermal environment to evaluate catalysts and measure intrinsic kinetics. In determining kinetics, it is of utmost importance that the catalyst be evaluated at conditions that are free of concentration and temperature gradients in the reactor. However, achieving this goal is often difficult due to substantial heat demands in many exothermic or endothermic chemical reactions. In such cases, a significant degree of coupling of transport phenomena with chemical reactions occurs, which leads to complications and difficulties in characterizing intrinsic catalyst activity. Temperature gradients in a packed bed catalytic reactor with endothermic reactions, known as “cold spots”, usually result in underestimation of the catalyst activity. For highly endothermic chemical reactions, such as steam reforming of methanol, temperature and concentration may vary considerably from point to point in a packed catalyst bed. Typically, a temperature profile in a catalytic reactor shows a large heat sink in the inlet zone of the bed because of a high reaction rate. These local cold spots can cause low local carbon conversion and less hydrogen yield. Analysis of the integrated data obtained from such a system indicates transport limitations and introduces complexity to intrinsic kinetic measurements. For practical applications such as fuel processing, this also suggests that a tremendous portion of the catalyst in the conventional fixed bed is not utilized efficiently. In such cases, without decreasing the space velocity, the reforming reactor must be operated at high temperature to achieve high conversion. However, in addition to the increased energy loss to the environment and the potential of catalyst deactivation, this high-temperature operation possibly generates more carbon monoxide which is favored at high temperature. The high carbon monoxide concentration in the reformate increases the load to the catalytic carbon monoxide clean-up portion of the device and potentially poisons the fuel cell electrodes. Therefore, maintaining temperature uniformity in this process becomes critical in improving hydrogen one-pass productivity and selectivity. Previous kinetic studies have mainly focused on Cu-based catalysts [4–9]. It is believed that methanol is dehydrogenated to methyl formate over Cu catalysts [6,7,10–12]. This mechanism seems to explain why Cu catalysts exhibit high selectivity in steam reforming of methanol. However, Cu-based catalysts have poor thermal stability and are pyrophoric, which are not suitable for fuel cell applications. Recent catalyst development in our laboratory [1,13–15] and elsewhere [10–12,16] has verified that Pd supported on ZnO exhibits high activity and selectivity in producing hydrogen with a comparable amount of carbon monoxide formation versus Cu-based catalysts. It is non-pyrophoric and has an advantage in thermal stability over the Cu-based catalyst [13]. Different reaction mechanism in steam reforming of methanol may exist for the Pd/ZnO catalysts [10,12,16]. However, kinetic data for these new catalysts have not been reported. In this paper, a microchannel reactor is used to provide accurate intrinsic kinetic information without heat and mass transport limitations over the highly active Pd/ZnO catalyst, as well as the empirical rate equation for reactor design. 2 Experimental A microchannel reactor system with active heat exchange has been developed to decouple transport phenomena with chemical reactions for intrinsic kinetics study. The application is especially important to keep isothermal conditions in the catalyst bed for highly endothermic reactions. This reactor provides high heat transfer efficiency, incorporating a built-in preheating zone, and accurate catalyst bed temperature measurement. Fig. 1 shows schematics of the reactor assembly. The catalytic portion of the reactor is a microchannel slot with the gap width of 0.508mm. The catalyst is located in the lower portion of the channel so that the reactants can be preheated to a desired temperature in the upper portion of the channel before entering the catalyst bed. The microchannel is “sandwiched” by two separated oil-heating channels, which are designed to allow oil to circulate at a high rate and maintain a high heat transfer coefficient at the same time. A schematic of the kinetic testing unit (KTU) system setup is shown in Fig. 2 . Pretreatment gases and other carrier/tracer gases can be precisely controlled and delivered into the reactor using mass flow controllers. A liquid methanol and water mixture is pumped into a microchannel vaporizer with precise flow rate settings. The methanol and water vapor are then blended with N2 carrier gas, passing a 25ml surge tank, where the reactants are preheated to the process temperature and which holds some head pressure for steady operation. Steam reforming reactions take place in the catalyst bed with uniform reactor temperature. Reactor effluent is quenched, and unreacted methanol and water are collected in a chilled vessel. Gaseous product samples can be taken by a microgas chromatograph (GC) (Agilent QUADH G2891A) to determine conversion and product selectivity. The micro-GC is equipped with Molsieve 5A (10m), PoraPlotQ (8m), OV-1 (2μm, 10m) and OV-1 (1.2μm, 4m) columns to quantify carbon monoxide, carbon dioxide, hydrogen, methane, ethane, ethylene, propane, and propylene. The analysis of the whole reformer effluent gas products takes less than 2min. Overall carbon balance and hydrogen balance are better than 97%. This reactor unit has efficient collection-bypass, and an instrumentation system for better control and operation. All process data, such as temperature, pressure, and flow rates, are recorded with a LabView 6.2 data acquisition system in a computer and displayed in real time. The γ-alumina supported Pd/ZnO catalyst was fabricated using an incipient-wetness impregnation method. Neutral γ-alumina (60–120mesh, Engelhard) was pre-treated at 500°C in air for 2h prior to the impregnation. A nitric acid solution of palladium nitrate (Engelhard, 20.19wt.% PM) and zinc nitrate hydrate (Aldrich) was introduced onto the γ-Al2O3 support in a glass vial, and the sample was shaken at 60°C for 1h before being dried in a vacuum oven overnight. The dried sample was calcined at 350°C in air for 3h. The final formulated catalyst contains 8.9wt.% Pd, 17.6wt.% ZnO, with a surface area of 168m2/g and pore volume of 0.48cm3/g. The catalyst was activated by flowing 50sccm hydrogen gas through the reactor at 400°C for 2h. The reactor temperature was ramped with a 10°C/min rate from the room temperature. The methanol used in the entire experiment is from Aldrich with capillary GC grade (>99.9% purity). The experiments were carried out at atmospheric pressure over a wide range of temperature (160–310°C). The steam-to-carbon molar ratio was varied from 0.6 to 1.78. The partial pressure of N2 varied from 9 to 35kPa as a carrier gas and a GC internal standard. In this paper, bed residence times are reported as inverse gas hourly space velocity defined as feed flow rate at standard conditions per total reactor volume. The gas hourly velocity ranges from 9850 to 31,000h−1. Carbon processing rate is based on weight of methanol per gram of catalyst per unit time, known as weight hourly space velocity (WHSV). In this study, WHSV ranges from 2 to 20gMeOH/gcat/h. Reforming rate is reported as negative catalyst-time yield (mmolmethanolconverted/kgcat/s), i.e. methanol disappearing rate. 3 Results and discussion 3.1 Kinetics of steam reforming of methanol The microchannel reactor presents a highly isothermal environment for the catalyst evaluation, and it is ideal for use in studying reaction kinetics. Traditionally, bed dilution is used to mitigate temperature gradients when the reaction is strongly endothermic or exothermic. However, in addition to the possible influence of the diluting material (usually SiC) on the reaction, catalyst dilution usually changes hydrodynamic behavior and causes a large pressure drop. The global effect is that as the bed volume increases, the space–time yield decreases due to lower gas hourly space velocity. Moreover, it is not clear whether the longer free distance of molecule collision with a catalytic site in the diluted bed would change product selectivity. Therefore, the microchannel reactor approach provides a unique solution to such problems, in which the catalyst can be kinetically characterized. Equilibrium calculation showed that the methanol steam reforming reactions have no appreciable thermodynamic limitations. Blank tests were also conducted with a methanol–water mixture fed into the heated microchannel reactor. Results showed that the stainless steel reactor was inactive for reactions between water and methanol over the temperature range of interest (160–310°C). In addition, pre-experiments varying catalyst loading and methanol–water feed rate showed that external diffusion limitation does not exist over a range of weight hourly space velocity from 2 to 20gMeOH/gcat/h. With an average catalyst particle size of 200μm used for the experiments, the effectiveness factor is close to unity due to its small Thiele modulus (<0.002). Therefore, the internal diffusion limitation is negligible in this kinetic study. The activity of the Pd/ZnO catalyst measured by temperature scanning at various weight hourly space velocities is shown in Fig. 3 . The steam-to-carbon molar ratio in this particular run was 1.78, and the initial partial pressure of methanol and water was 25.8 and 45.9kPa, respectively. Carbon conversion data are collected when the microchannel reactor with active heat exchange is operated at integral mode. It is not unusual that the methanol conversion decreases with increase of weight hourly space velocity (WHSV) but not proportionally at a certain temperature, which suggests that the reaction is not zero order to methanol partial pressure. The conversion reaches 100% at 240, 260, 270, and 278°C at WHSV of 4.53, 9.06, 13.59, and 18.12, correspondingly. The residence time distribution (RTD) analysis shows that Peclet numbers are large (>100) in all experimental conditions. Thus, the axial dispersion in the channel is negligible and the flow in the channel is very close to plug flow. Material balance in any differential bed segment of a plug flow reactor (PFR) yields the relationship between the reaction rate and conversion: −r A dW=F A0 dx A where F A0 is the mole flow rate of reactant A, in our case, methanol; dW is the weight the catalyst element (g); and −r A represents the disappearance of methanol in mole per catalyst weight per unit time. The integral form over the whole reactor is W F A0 = ∫ 0 X Af dX A −r A Reversing the above equation and then multiplying the molecular weight of the reactant A to both sides of the equation gives the WHSV in the reactor: WHSV (g A /g cat /h)= M A F A0 W = M A ∫ 0 X Af dX A /−r A Therefore, the methanol conversion is a function of temperature and WHSV when internal and external diffusion are excluded: X A =f(T,WHSV) Plotting experimental data with methanol conversion x A versus space time of methanol, 1/WHSV, gives isothermal curves, as shown in Fig. 4 . The slope at any point on the isothermal curve represents the rate of reaction at that certain condition (T, partial pressure of reactants): −r A = dx A d(W/F A0) = 1 M A dx A d(1/WHSV) Polynomial regression of data usually improves precision of curve differential analysis: x A =a 1 WHSV +b 1 WHSV 2+c 1 WHSV 3+⋯ The reaction rate then becomes −r A = 1 M A a+2b 1 WHSV +3c 1 WHSV 2+⋯ Therefore, the rate at any point on the curve can be determined in such a way. Table 1 lists partial experimental data of the steam reforming of methanol at four different temperatures. Without a good understanding of the functionality of the PdZn alloy sites in catalyzing steam reforming of methanol reaction, formulating a rate correlation with the traditional Langmuir–Hinshelwood adsorption-reaction model becomes difficult. Since the reaction mechanism of these bi-molecules on supported precious metals can be significantly different from that in the Cu-based catalyst system [10,11], many parameters must be empirically adjusted. Thus, the correlation of rate data in a power-rate law with an Arrhenius expression is practical in reactor design and in predicting the effects of operating condition changes on performance. Now that the rate equation is expressed as −r A =k0 e −E a /RTp A ap B b parameters are determined with an optimization method. Assuming the model is linear in the parameters, for n observations of rate (dependent variable), − r → A = f → (p A ,p B ) g → (a,b,k0,E a )+ ε → where f → and g → are independent variable and parameter vectors, respectively, and ε → is the experimental error vector associated with the n observations. Parameter g → is determined by minimization of the sum of squares of residuals: ε → T ε → →min where ε → T is the transpose of ε → . The final values of parameters calculated above are tabulated in Table 2 . For n=158 experimental observations used in the parameter estimation, the average relative error between the predicted rate and the experimentally measured rate is 5.71%, and the standard deviation is 0.06. Fig. 5 indicates that the determined power law expression is sufficient for representing the kinetics of methanol steam reforming in the reaction rates from 0.5 to 80mmol/kgcat/s. To test the accuracy of the kinetic rate expression, especially to verify the water partial pressure effect since the 0.088 exponent for water is not statistically different from zero, the KTU was operated at differential mode in which the conversion was controlled below 10%. Methanol partial pressure of 34.2kPa was maintained and the weight hourly space velocity was 28gMeOH/gcat/h. The microchannel reactor was run at 210°C. The steam partial pressure was varied by feeding different methanol–water mixtures: steam-to-carbon molar ratio 1.8, 1.2, 1.0, and 0.6, respectively. In the differential mode, it is assumed there is no concentration gradient due to the low conversion. The reaction rate is determined by −r A = F A0x A W = WHSV M A x A and the rate is corresponding to half of the conversion measured at the reactor exit (x A/2). As shown in Fig. 6 , in the double log plot of reaction rate versus steam partial pressure, the slope gives the order of reaction to steam as 0.09. This agrees with the results when the reactor is operated in integral mode. Similarly, when the steam pressure remains the same, varying methanol partial pressure in the reactor differential mode, the slope of rate–partial pressure double log plot gives the reaction order of 0.75, which is very close to the integral result. Therefore, the overall rate equation for steam reforming of methanol is expressed as follows: −r A (mmol/kg cat /s)=2.9047×1010 e −94800/RTp MeOH 0.715p H 2 O 0.088 where methanol and steam partial pressure have units in kPa. The apparent activation energy is 94.8kJ/mol. 3.2 Performance comparison between the microchannel reactor and a conventional fixed bed reactor—evaluate catalyst at isothermal conditions Side-by-side comparison experiments were carried out in a 6.35mm o.d. quartz tube reactor and the microchannel reactor. Each reactor has a 0.2g catalyst loading. The same feedstocks and experimental procedures were applied to both reactors. The conventional fixed bed reactor has the catalyst bed height of 19mm with 4mm i.d., while the microchannel reactor gives a geometry of 0.508 mm×12.7 mm×37.3 mm catalyst packing. The microchannel reactor is made of stainless steel. For the conventional fixed bed reactor testing, the quartz tube reactor was heated by a furnace, while the heat required for the endothermic reaction was supplied with heat transfer fluid in the microchannel reactor. Fig. 7 shows that at the same weight hourly space velocity (WHSV=4.53gMeOH/gcat/h), the microchannel reactor generally yields higher methanol conversion at the same inlet temperature. This confirms that catalysts in the microchannel reactor “see” higher temperature than in the conventional fixed bed reactor. In another words, the average temperature in the conventional fixed bed reactor is lower than that measured at the reactor inlet due to the endothermic effect. This effect becomes more significant when the conversion is greater than 10% at higher temperature, since high conversion generates more heat sinks and the local conversion at cold spots contribute to low integral total conversion at the reactor exit. Such heat transfer resistance, however, can be significantly reduced or eliminated in a microchannel reactor, in which temperature gradients are minimized. In order to reveal the temperature profile inside the catalyst bed and further interpret the experimental data obtained from these two reactors, a three-dimensional homogeneous model was developed using the obtained kinetic data to describe the energy transfer and reactions. This model allows adjustment of parameters, such as the pre-exponential term of the intrinsic rate constant, activation energy, effective thermal conductivity and mass diffusivity of the catalyst bed, so that the reactor performance can be simulated with different catalyst activities and selectivities. Partial differential equations describing conservation of mass and energy can be expressed as follows: ∂ci ∂t +∇(−Di∇ci+ci u → )=Ri, ρCp ∂T ∂t +∇(−k∇T+ρCpT u → )=Q where Ri is the formation rate of component i, which is function of component concentration (or partial pressure) and temperature; Q the heat generation rate per unit volume of the catalyst bed, which is the function of reaction rate and heat of reaction; k the effective conductivity of the catalyst bed; D the effective diffusivity; u the linear velocity; c the species concentration; and T is the temperature. The reaction rate parameters are determined by independent kinetic measurement with the microchannel reactor, as described in Section 3.1. The effective diffusivity is a combined effect of the molecular diffusion, Knudsen diffusion, and bed tortuosity [17]. In the model, these parameters are associated with temperature, compositions, and catalyst properties. The effective thermal conductivity of the catalyst bed is of interest primarily for calculating the temperature in the bed during reaction. Supported metal on porous materials presents different thermal conductivity with different loading and synthesis methods. Empirical values from the literature have been taken to evaluate the reforming process [18,19]. The model is constructed and solved with a commercial software FEMLab® package using the finite element approach. The routine sequence is established in Fig. 8 . First, the catalyst bed dimensions are illustrated in the draw mode with the exact reactor geometry. The geometries are meshed according to the calculation tolerance. Jiggle mesh with a growth rate of 1.4 is used to generate meshes in the domain bodies. Then the parameters are filled-in to represent mass and energy principles, in which reaction kinetics and transport properties are taken into account. After assigning boundary conditions and initial value, the routines are set to converge. Results give the temperature and conversion profiles. Steady state is assumed in this paper, so that the time-dependent terms are dropped to simplify the problem. Simulation results show that, in general, large temperature gradients exist in the furnace-heated conventional tubular reactor, especially at the high conversion level. Fig. 9 shows that with reactor wall temperature at 220°C, and other conditions the same (steam-to-carbon molar ratio=1.78, WHSV=4.53gMeOH/gcat/h), the tubular reactor has a large heat sink area compared to the microchannel catalyst slab bed. Because the catalysts “see” lower average temperature in the tubular reactor than in the microchannel reactor, a general low conversion level in the tubular bed reactor (43%) occurs compared to that in microchannel reactor (60%). Such an endothermic effect is not significant when the reactor is operated at low conversion level. However, when the reactor temperature and space velocity increases, leading to high productivity, the catalyst bed temperature gradient becomes large. As shown in Fig. 10 , with a fixed WHSV of 4.53gMeOH/gcat/h, at a furnace temperature of 180°C, there is only about 1°C temperature gradient in the bed, resulting in an 11% carbon conversion, very close to that in the microchannel reactor. However, when the furnace temperature goes up to 220°C, the coupled endothermic reactions cause a temperature drop as large as 7°C in the bed, resulting in a 43% carbon conversion versus a 60% conversion for the microchannel reactor. When the furnace temperature is raised to 240°C, the cold spot can be as low as 218°C, resulting in only 66% integral conversion compared to the 100% conversion that should occur in an isothermal reactor. In contrast, simulation results indicate that the microchannel reactor is essentially isothermal. Shown in Fig. 11 , even at an extreme condition for the microchannel reactor when the 100% methanol conversion is reached and the degree of heat sink maximizes its value, the maximum possible temperature difference in the bed is only 1.2°C. Experiments have validated such prediction. As shown in Fig. 12 , four thermocouple readings in the bed indicate that the maximum temperature difference is 0.8°C. At any other milder conditions (low T, low conversion), such difference is almost invisible (<0.1°C). The performance test has demonstrated that this reactor unit provides a very narrow temperature limit for strongly endothermic reactions. Plugging the rate equation described in Section 3.1 into the three-dimensional homogeneous model yields local temperature and conversion profiles. The temperature gradient simulated with this kinetics agrees with the experimental observations in both microchannel and conventional tubular fixed bed reactors. The integral conversions based on modeling agree with the experimental data very well. The model is flexible and accurate in any operating conditions in a large space velocity range (WHSV=2–20gMeOH/gcat/h). 4 Conclusions A microchannel reactor has been developed to evaluate catalyst performance and measure reaction kinetics. The reactor can be operated in either integral mode or differential mode with very narrow temperature gradient (<1°C) even for strongly endothermic reactions such as methanol steam reforming. The kinetics of methanol steam reformation over Pd/ZnO catalyst has been studied using a microchannel reactor at atmospheric pressure over a wide temperature range. The apparent activation energy and rate equation have been obtained and applied in the three-dimensional pseudo-homogeneous model. The precision of model has been validated with experimental observations. Acknowledgements The authors gratefully acknowledge the support of the Defense Advanced Research Projects Agency. This work was performed in the Environmental Molecular Sciences Laboratory, a national scientific user facility sponsored by the US Department of Energy’s Office of Biological and Environmental Research and located at Pacific Northwest National Laboratory in Richland, WA. References [1] J.D. Holladay E.O. Jones M. Phelps J. Hu J. Power Sour. 108 2002 21 27 [2] D. Linden (Ed.), Handbook of Batteries, McGraw-Hill, New York, 1995, p. 36.1. [3] J.D. Holladay, E.O. Jones, J. Cao, G. Xia, R.A. Dagle, M.R. Phelps, Y. Wang, Presentation at the American Chemical Society Symposium, New York, 2003. [4] B.A. Peppley J.C. Amphlett L.M. Kearns R.F. Mann Appl. Catal. A: Gen. 179 1999 21 29 [5] B.A. Peppley J.C. Amphlett L.M. Kearns R.F. Mann Appl. Catal. A: Gen. 179 1999 31 49 [6] C.J. Jiang D.L. Trimm M.S. Wainwright Appl. Catal. A: Gen. 93 1993 245 255 [7] C.J. Jiang D.L. Trimm M.S. Wainwright Appl. Catal. A: Gen. 97 1993 145 158 [8] S.R. Samms R.F. Savinell J. Power Sour. 112 2002 13 29 [9] S.P. Asprey B.W. Wojciechowski B.A. Peppley Appl. Catal. A: Gen. 179 1999 51 70 [10] N. Takezawa N. Iwasa Catal. Today 36 1997 45 56 [11] N. Iwasa T. Mayanagi N. Takezawa React. Kinet. Catal. Lett. 69 2 2000 355 360 [12] N. Iwasa S. Masuda N. Ogawa N. Takezawa Appl. Catal. 125 1995 145 157 [13] Y. Chin R. Dagle J. Hu A.C. Dohnalkova Y. Wang Catal. Today 77 2002 79 88 [14] J. Hu Y. Wang D. Vanderwiel C. Chin D.R. Palo R. Rozmiarek R. Dagle J. Cao J. Holladay E. Baker Chem. Eng. J. 93 2003 55 60 [15] Y. Chin Y. Wang R. Dagle X.S. Li Fuel Process. Technol. 83 2003 193 201 [16] N. Iwasa S. Kudo H. Takahashi S. Masuda N. Takezawa Catal. Lett. 19 1993 211 216 [17] G.F. Froment, K.B. Bischoff, Chemical Reactor Analysis and Design, 2nd ed., Wiley, New York, 1990. [18] C.N. Satterfield, Heterogeneous Catalysis in Industrial Practice, 2nd ed., McGraw-Hill, New York. [19] R.A. Sehr Chem. Eng. Sci. 9 1958 145",
      "scopus-id": "1942477667",
      "coredata": {
        "eid": "1-s2.0-S0926860X03010032",
        "dc:description": "A microchannel reactor with effective heat exchange has been developed to evaluate catalyst performance and measure reaction kinetics. The reactor provides an isothermal environment for rate measurement of the endothermic methanol steam reforming reactions over a Pd/ZnO catalyst in a wide temperature range (160–310°C). The apparent activation energy and rate equation have been determined to fit the power law expression: −r A (mmol/kg cat /s)=2.9047×1010 e −94800/RTp MeOH 0.715p H 2 O 0.088 This result provides kinetic data for the design of a miniature fuel processor for small fuel cell applications. The rate equation has been applied to a three-dimensional pseudo-homogeneous model to simulate temperature profiles in both microchannel and conventional fixed bed reactors.",
        "openArchiveArticle": "false",
        "prism:coverDate": "2004-05-10",
        "openaccessUserLicense": null,
        "prism:aggregationType": "Journal",
        "prism:url": "https://api.elsevier.com/content/article/pii/S0926860X03010032",
        "dc:creator": [
          {
            "@_fa": "true",
            "$": "Cao, Chunshe"
          },
          {
            "@_fa": "true",
            "$": "Xia, Gordon"
          },
          {
            "@_fa": "true",
            "$": "Holladay, Jamie"
          },
          {
            "@_fa": "true",
            "$": "Jones, Evan"
          },
          {
            "@_fa": "true",
            "$": "Wang, Yong"
          }
        ],
        "link": [
          {
            "@_fa": "true",
            "@rel": "self",
            "@href": "https://api.elsevier.com/content/article/pii/S0926860X03010032"
          },
          {
            "@_fa": "true",
            "@rel": "scidir",
            "@href": "https://www.sciencedirect.com/science/article/pii/S0926860X03010032"
          }
        ],
        "dc:format": "application/json",
        "openaccessType": null,
        "pii": "S0926-860X(03)01003-2",
        "prism:volume": "262",
        "prism:publisher": "Elsevier B.V.",
        "dc:title": "Kinetic studies of methanol steam reforming over Pd/ZnO catalyst using a microchannel reactor",
        "prism:copyright": "Copyright © 2004 Elsevier B.V. All rights reserved.",
        "openaccess": "0",
        "prism:issn": "0926860X",
        "prism:issueIdentifier": "1",
        "dcterms:subject": [
          {
            "@_fa": "true",
            "$": "Kinetics"
          },
          {
            "@_fa": "true",
            "$": "Methanol steam reforming"
          },
          {
            "@_fa": "true",
            "$": "Microchannel reactor"
          },
          {
            "@_fa": "true",
            "$": "Pd/ZnO catalyst"
          }
        ],
        "openaccessArticle": "false",
        "prism:publicationName": "Applied Catalysis A: General",
        "prism:number": "1",
        "openaccessSponsorType": null,
        "prism:pageRange": "19-29",
        "prism:endingPage": "29",
        "pubType": "fla",
        "prism:coverDisplayDate": "10 May 2004",
        "prism:doi": "10.1016/j.apcata.2003.11.043",
        "prism:startingPage": "19",
        "dc:identifier": "doi:10.1016/j.apcata.2003.11.043",
        "openaccessSponsorName": null
      },
      "objects": {
        "object": [
          {
            "@category": "thumbnail",
            "@height": "20",
            "@width": "182",
            "@_fa": "true",
            "$": "https://api.elsevier.com/content/object/eid/1-s2.0-S0926860X03010032-si9.gif?httpAccept=%2A%2F%2A",
            "@multimediatype": "GIF image file",
            "@type": "ALTIMG",
            "@size": "721",
            "@ref": "si9",
            "@mimetype": "image/gif"
          },
          {
            "@category": "thumbnail",
            "@height": "50",
            "@width": "402",
            "@_fa": "true",
            "$": "https://api.elsevier.com/content/object/eid/1-s2.0-S0926860X03010032-si8.gif?httpAccept=%2A%2F%2A",
            "@multimediatype": "GIF image file",
            "@type": "ALTIMG",
            "@size": "2072",
            "@ref": "si8",
            "@mimetype": "image/gif"
          },
          {
            "@category": "thumbnail",
            "@height": "44",
            "@width": "411",
            "@_fa": "true",
            "$": "https://api.elsevier.com/content/object/eid/1-s2.0-S0926860X03010032-si7.gif?httpAccept=%2A%2F%2A",
            "@multimediatype": "GIF image file",
            "@type": "ALTIMG",
            "@size": "2090",
            "@ref": "si7",
            "@mimetype": "image/gif"
          },
          {
            "@category": "thumbnail",
            "@height": "39",
            "@width": "285",
            "@_fa": "true",
            "$": "https://api.elsevier.com/content/object/eid/1-s2.0-S0926860X03010032-si6.gif?httpAccept=%2A%2F%2A",
            "@multimediatype": "GIF image file",
            "@type": "ALTIMG",
            "@size": "1559",
            "@ref": "si6",
            "@mimetype": "image/gif"
          },
          {
            "@category": "thumbnail",
            "@height": "17",
            "@width": "126",
            "@_fa": "true",
            "$": "https://api.elsevier.com/content/object/eid/1-s2.0-S0926860X03010032-si5.gif?httpAccept=%2A%2F%2A",
            "@multimediatype": "GIF image file",
            "@type": "ALTIMG",
            "@size": "626",
            "@ref": "si5",
            "@mimetype": "image/gif"
          },
          {
            "@category": "thumbnail",
            "@height": "43",
            "@width": "363",
            "@_fa": "true",
            "$": "https://api.elsevier.com/content/object/eid/1-s2.0-S0926860X03010032-si4.gif?httpAccept=%2A%2F%2A",
            "@multimediatype": "GIF image file",
            "@type": "ALTIMG",
            "@size": "1847",
            "@ref": "si4",
            "@mimetype": "image/gif"
          },
          {
            "@category": "thumbnail",
            "@height": "42",
            "@width": "135",
            "@_fa": "true",
            "$": "https://api.elsevier.com/content/object/eid/1-s2.0-S0926860X03010032-si3.gif?httpAccept=%2A%2F%2A",
            "@multimediatype": "GIF image file",
            "@type": "ALTIMG",
            "@size": "883",
            "@ref": "si3",
            "@mimetype": "image/gif"
          },
          {
            "@category": "thumbnail",
            "@height": "36",
            "@width": "563",
            "@_fa": "true",
            "$": "https://api.elsevier.com/content/object/eid/1-s2.0-S0926860X03010032-si21.gif?httpAccept=%2A%2F%2A",
            "@multimediatype": "GIF image file",
            "@type": "ALTIMG",
            "@size": "2215",
            "@ref": "si21",
            "@mimetype": "image/gif"
          },
          {
            "@category": "thumbnail",
            "@height": "12",
            "@width": "227",
            "@_fa": "true",
            "$": "https://api.elsevier.com/content/object/eid/1-s2.0-S0926860X03010032-si20.gif?httpAccept=%2A%2F%2A",
            "@multimediatype": "GIF image file",
            "@type": "ALTIMG",
            "@size": "818",
            "@ref": "si20",
            "@mimetype": "image/gif"
          },
          {
            "@category": "thumbnail",
            "@height": "14",
            "@width": "144",
            "@_fa": "true",
            "$": "https://api.elsevier.com/content/object/eid/1-s2.0-S0926860X03010032-si2.gif?httpAccept=%2A%2F%2A",
            "@multimediatype": "GIF image file",
            "@type": "ALTIMG",
            "@size": "568",
            "@ref": "si2",
            "@mimetype": "image/gif"
          },
          {
            "@category": "thumbnail",
            "@height": "21",
            "@width": "443",
            "@_fa": "true",
            "$": "https://api.elsevier.com/content/object/eid/1-s2.0-S0926860X03010032-si19.gif?httpAccept=%2A%2F%2A",
            "@multimediatype": "GIF image file",
            "@type": "ALTIMG",
            "@size": "1790",
            "@ref": "si19",
            "@mimetype": "image/gif"
          },
          {
            "@category": "thumbnail",
            "@height": "36",
            "@width": "198",
            "@_fa": "true",
            "$": "https://api.elsevier.com/content/object/eid/1-s2.0-S0926860X03010032-si18.gif?httpAccept=%2A%2F%2A",
            "@multimediatype": "GIF image file",
            "@type": "ALTIMG",
            "@size": "1088",
            "@ref": "si18",
            "@mimetype": "image/gif"
          },
          {
            "@category": "thumbnail",
            "@height": "18",
            "@width": "15",
            "@_fa": "true",
            "$": "https://api.elsevier.com/content/object/eid/1-s2.0-S0926860X03010032-si17.gif?httpAccept=%2A%2F%2A",
            "@multimediatype": "GIF image file",
            "@type": "ALTIMG",
            "@size": "163",
            "@ref": "si17",
            "@mimetype": "image/gif"
          },
          {
            "@category": "thumbnail",
            "@height": "21",
            "@width": "25",
            "@_fa": "true",
            "$": "https://api.elsevier.com/content/object/eid/1-s2.0-S0926860X03010032-si16.gif?httpAccept=%2A%2F%2A",
            "@multimediatype": "GIF image file",
            "@type": "ALTIMG",
            "@size": "201",
            "@ref": "si16",
            "@mimetype": "image/gif"
          },
          {
            "@category": "thumbnail",
            "@height": "22",
            "@width": "105",
            "@_fa": "true",
            "$": "https://api.elsevier.com/content/object/eid/1-s2.0-S0926860X03010032-si15.gif?httpAccept=%2A%2F%2A",
            "@multimediatype": "GIF image file",
            "@type": "ALTIMG",
            "@size": "476",
            "@ref": "si15",
            "@mimetype": "image/gif"
          },
          {
            "@category": "thumbnail",
            "@height": "21",
            "@width": "15",
            "@_fa": "true",
            "$": "https://api.elsevier.com/content/object/eid/1-s2.0-S0926860X03010032-si14.gif?httpAccept=%2A%2F%2A",
            "@multimediatype": "GIF image file",
            "@type": "ALTIMG",
            "@size": "180",
            "@ref": "si14",
            "@mimetype": "image/gif"
          },
          {
            "@category": "thumbnail",
            "@height": "18",
            "@width": "15",
            "@_fa": "true",
            "$": "https://api.elsevier.com/content/object/eid/1-s2.0-S0926860X03010032-si13.gif?httpAccept=%2A%2F%2A",
            "@multimediatype": "GIF image file",
            "@type": "ALTIMG",
            "@size": "163",
            "@ref": "si13",
            "@mimetype": "image/gif"
          },
          {
            "@category": "thumbnail",
            "@height": "21",
            "@width": "15",
            "@_fa": "true",
            "$": "https://api.elsevier.com/content/object/eid/1-s2.0-S0926860X03010032-si12.gif?httpAccept=%2A%2F%2A",
            "@multimediatype": "GIF image file",
            "@type": "ALTIMG",
            "@size": "180",
            "@ref": "si12",
            "@mimetype": "image/gif"
          },
          {
            "@category": "thumbnail",
            "@height": "25",
            "@width": "15",
            "@_fa": "true",
            "$": "https://api.elsevier.com/content/object/eid/1-s2.0-S0926860X03010032-si11.gif?httpAccept=%2A%2F%2A",
            "@multimediatype": "GIF image file",
            "@type": "ALTIMG",
            "@size": "182",
            "@ref": "si11",
            "@mimetype": "image/gif"
          },
          {
            "@category": "thumbnail",
            "@height": "25",
            "@width": "314",
            "@_fa": "true",
            "$": "https://api.elsevier.com/content/object/eid/1-s2.0-S0926860X03010032-si10.gif?httpAccept=%2A%2F%2A",
            "@multimediatype": "GIF image file",
            "@type": "ALTIMG",
            "@size": "1217",
            "@ref": "si10",
            "@mimetype": "image/gif"
          },
          {
            "@category": "thumbnail",
            "@height": "21",
            "@width": "443",
            "@_fa": "true",
            "$": "https://api.elsevier.com/content/object/eid/1-s2.0-S0926860X03010032-si1.gif?httpAccept=%2A%2F%2A",
            "@multimediatype": "GIF image file",
            "@type": "ALTIMG",
            "@size": "1792",
            "@ref": "si1",
            "@mimetype": "image/gif"
          },
          {
            "@category": "thumbnail",
            "@height": "93",
            "@width": "95",
            "@_fa": "true",
            "$": "https://api.elsevier.com/content/object/eid/1-s2.0-S0926860X03010032-gr1.sml?httpAccept=%2A%2F%2A",
            "@multimediatype": "GIF image file",
            "@type": "IMAGE-THUMBNAIL",
            "@size": "1755",
            "@ref": "gr1",
            "@mimetype": "image/gif"
          },
          {
            "@category": "standard",
            "@height": "273",
            "@width": "279",
            "@_fa": "true",
            "$": "https://api.elsevier.com/content/object/eid/1-s2.0-S0926860X03010032-gr1.jpg?httpAccept=%2A%2F%2A",
            "@multimediatype": "JPEG image file",
            "@type": "IMAGE-DOWNSAMPLED",
            "@size": "14023",
            "@ref": "gr1",
            "@mimetype": "image/jpeg"
          },
          {
            "@category": "thumbnail",
            "@height": "90",
            "@width": "125",
            "@_fa": "true",
            "$": "https://api.elsevier.com/content/object/eid/1-s2.0-S0926860X03010032-gr2.sml?httpAccept=%2A%2F%2A",
            "@multimediatype": "GIF image file",
            "@type": "IMAGE-THUMBNAIL",
            "@size": "2730",
            "@ref": "gr2",
            "@mimetype": "image/gif"
          },
          {
            "@category": "standard",
            "@height": "315",
            "@width": "439",
            "@_fa": "true",
            "$": "https://api.elsevier.com/content/object/eid/1-s2.0-S0926860X03010032-gr2.gif?httpAccept=%2A%2F%2A",
            "@multimediatype": "GIF image file",
            "@type": "IMAGE-DOWNSAMPLED",
            "@size": "13812",
            "@ref": "gr2",
            "@mimetype": "image/gif"
          },
          {
            "@category": "thumbnail",
            "@height": "73",
            "@width": "125",
            "@_fa": "true",
            "$": "https://api.elsevier.com/content/object/eid/1-s2.0-S0926860X03010032-gr3.sml?httpAccept=%2A%2F%2A",
            "@multimediatype": "GIF image file",
            "@type": "IMAGE-THUMBNAIL",
            "@size": "3072",
            "@ref": "gr3",
            "@mimetype": "image/gif"
          },
          {
            "@category": "standard",
            "@height": "266",
            "@width": "457",
            "@_fa": "true",
            "$": "https://api.elsevier.com/content/object/eid/1-s2.0-S0926860X03010032-gr3.gif?httpAccept=%2A%2F%2A",
            "@multimediatype": "GIF image file",
            "@type": "IMAGE-DOWNSAMPLED",
            "@size": "16471",
            "@ref": "gr3",
            "@mimetype": "image/gif"
          },
          {
            "@category": "thumbnail",
            "@height": "67",
            "@width": "125",
            "@_fa": "true",
            "$": "https://api.elsevier.com/content/object/eid/1-s2.0-S0926860X03010032-gr4.sml?httpAccept=%2A%2F%2A",
            "@multimediatype": "GIF image file",
            "@type": "IMAGE-THUMBNAIL",
            "@size": "2584",
            "@ref": "gr4",
            "@mimetype": "image/gif"
          },
          {
            "@category": "standard",
            "@height": "237",
            "@width": "445",
            "@_fa": "true",
            "$": "https://api.elsevier.com/content/object/eid/1-s2.0-S0926860X03010032-gr4.gif?httpAccept=%2A%2F%2A",
            "@multimediatype": "GIF image file",
            "@type": "IMAGE-DOWNSAMPLED",
            "@size": "12498",
            "@ref": "gr4",
            "@mimetype": "image/gif"
          },
          {
            "@category": "thumbnail",
            "@height": "83",
            "@width": "125",
            "@_fa": "true",
            "$": "https://api.elsevier.com/content/object/eid/1-s2.0-S0926860X03010032-gr5.sml?httpAccept=%2A%2F%2A",
            "@multimediatype": "GIF image file",
            "@type": "IMAGE-THUMBNAIL",
            "@size": "1914",
            "@ref": "gr5",
            "@mimetype": "image/gif"
          },
          {
            "@category": "standard",
            "@height": "277",
            "@width": "415",
            "@_fa": "true",
            "$": "https://api.elsevier.com/content/object/eid/1-s2.0-S0926860X03010032-gr5.gif?httpAccept=%2A%2F%2A",
            "@multimediatype": "GIF image file",
            "@type": "IMAGE-DOWNSAMPLED",
            "@size": "6429",
            "@ref": "gr5",
            "@mimetype": "image/gif"
          },
          {
            "@category": "thumbnail",
            "@height": "83",
            "@width": "125",
            "@_fa": "true",
            "$": "https://api.elsevier.com/content/object/eid/1-s2.0-S0926860X03010032-gr6.sml?httpAccept=%2A%2F%2A",
            "@multimediatype": "GIF image file",
            "@type": "IMAGE-THUMBNAIL",
            "@size": "2795",
            "@ref": "gr6",
            "@mimetype": "image/gif"
          },
          {
            "@category": "standard",
            "@height": "236",
            "@width": "354",
            "@_fa": "true",
            "$": "https://api.elsevier.com/content/object/eid/1-s2.0-S0926860X03010032-gr6.gif?httpAccept=%2A%2F%2A",
            "@multimediatype": "GIF image file",
            "@type": "IMAGE-DOWNSAMPLED",
            "@size": "9962",
            "@ref": "gr6",
            "@mimetype": "image/gif"
          },
          {
            "@category": "thumbnail",
            "@height": "86",
            "@width": "125",
            "@_fa": "true",
            "$": "https://api.elsevier.com/content/object/eid/1-s2.0-S0926860X03010032-gr7.sml?httpAccept=%2A%2F%2A",
            "@multimediatype": "GIF image file",
            "@type": "IMAGE-THUMBNAIL",
            "@size": "2505",
            "@ref": "gr7",
            "@mimetype": "image/gif"
          },
          {
            "@category": "standard",
            "@height": "414",
            "@width": "605",
            "@_fa": "true",
            "$": "https://api.elsevier.com/content/object/eid/1-s2.0-S0926860X03010032-gr7.jpg?httpAccept=%2A%2F%2A",
            "@multimediatype": "JPEG image file",
            "@type": "IMAGE-DOWNSAMPLED",
            "@size": "50530",
            "@ref": "gr7",
            "@mimetype": "image/jpeg"
          },
          {
            "@category": "thumbnail",
            "@height": "78",
            "@width": "125",
            "@_fa": "true",
            "$": "https://api.elsevier.com/content/object/eid/1-s2.0-S0926860X03010032-gr8.sml?httpAccept=%2A%2F%2A",
            "@multimediatype": "GIF image file",
            "@type": "IMAGE-THUMBNAIL",
            "@size": "1853",
            "@ref": "gr8",
            "@mimetype": "image/gif"
          },
          {
            "@category": "standard",
            "@height": "260",
            "@width": "419",
            "@_fa": "true",
            "$": "https://api.elsevier.com/content/object/eid/1-s2.0-S0926860X03010032-gr8.gif?httpAccept=%2A%2F%2A",
            "@multimediatype": "GIF image file",
            "@type": "IMAGE-DOWNSAMPLED",
            "@size": "11599",
            "@ref": "gr8",
            "@mimetype": "image/gif"
          },
          {
            "@category": "thumbnail",
            "@height": "93",
            "@width": "92",
            "@_fa": "true",
            "$": "https://api.elsevier.com/content/object/eid/1-s2.0-S0926860X03010032-gr9.sml?httpAccept=%2A%2F%2A",
            "@multimediatype": "GIF image file",
            "@type": "IMAGE-THUMBNAIL",
            "@size": "3272",
            "@ref": "gr9",
            "@mimetype": "image/gif"
          },
          {
            "@category": "standard",
            "@height": "284",
            "@width": "280",
            "@_fa": "true",
            "$": "https://api.elsevier.com/content/object/eid/1-s2.0-S0926860X03010032-gr9.jpg?httpAccept=%2A%2F%2A",
            "@multimediatype": "JPEG image file",
            "@type": "IMAGE-DOWNSAMPLED",
            "@size": "26730",
            "@ref": "gr9",
            "@mimetype": "image/jpeg"
          },
          {
            "@category": "thumbnail",
            "@height": "71",
            "@width": "125",
            "@_fa": "true",
            "$": "https://api.elsevier.com/content/object/eid/1-s2.0-S0926860X03010032-gr10.sml?httpAccept=%2A%2F%2A",
            "@multimediatype": "GIF image file",
            "@type": "IMAGE-THUMBNAIL",
            "@size": "3344",
            "@ref": "gr10",
            "@mimetype": "image/gif"
          },
          {
            "@category": "standard",
            "@height": "246",
            "@width": "436",
            "@_fa": "true",
            "$": "https://api.elsevier.com/content/object/eid/1-s2.0-S0926860X03010032-gr10.jpg?httpAccept=%2A%2F%2A",
            "@multimediatype": "JPEG image file",
            "@type": "IMAGE-DOWNSAMPLED",
            "@size": "35077",
            "@ref": "gr10",
            "@mimetype": "image/jpeg"
          },
          {
            "@category": "thumbnail",
            "@height": "93",
            "@width": "45",
            "@_fa": "true",
            "$": "https://api.elsevier.com/content/object/eid/1-s2.0-S0926860X03010032-gr11.sml?httpAccept=%2A%2F%2A",
            "@multimediatype": "GIF image file",
            "@type": "IMAGE-THUMBNAIL",
            "@size": "2388",
            "@ref": "gr11",
            "@mimetype": "image/gif"
          },
          {
            "@category": "standard",
            "@height": "363",
            "@width": "176",
            "@_fa": "true",
            "$": "https://api.elsevier.com/content/object/eid/1-s2.0-S0926860X03010032-gr11.jpg?httpAccept=%2A%2F%2A",
            "@multimediatype": "JPEG image file",
            "@type": "IMAGE-DOWNSAMPLED",
            "@size": "23442",
            "@ref": "gr11",
            "@mimetype": "image/jpeg"
          },
          {
            "@category": "thumbnail",
            "@height": "87",
            "@width": "125",
            "@_fa": "true",
            "$": "https://api.elsevier.com/content/object/eid/1-s2.0-S0926860X03010032-gr12.sml?httpAccept=%2A%2F%2A",
            "@multimediatype": "GIF image file",
            "@type": "IMAGE-THUMBNAIL",
            "@size": "2251",
            "@ref": "gr12",
            "@mimetype": "image/gif"
          },
          {
            "@category": "standard",
            "@height": "421",
            "@width": "603",
            "@_fa": "true",
            "$": "https://api.elsevier.com/content/object/eid/1-s2.0-S0926860X03010032-gr12.jpg?httpAccept=%2A%2F%2A",
            "@multimediatype": "JPEG image file",
            "@type": "IMAGE-DOWNSAMPLED",
            "@size": "44810",
            "@ref": "gr12",
            "@mimetype": "image/jpeg"
          }
        ]
      },
      "link": {
        "@rel": "abstract",
        "@href": "https://api.elsevier.com/content/abstract/scopus_id/1942477667"
      }
    }
  }
}