{
  "metadata": {
    "title": "Enhanced catalytic performance of B-doped SiC supported Ni catalysts for the hydrogenation of nitroarenes",
    "authors": "; ; ",
    "journal": "Applied Catalysis A: General",
    "date": "2024-05-25",
    "doi": "10.1016/j.apcata.2024.119726",
    "abstract": "",
    "uri": "https://api.elsevier.com/content/article/pii/S0926860X24001704",
    "pii": "S0926860X24001704"
  },
  "fulltext": {
    "full-text-retrieval-response": {
      "scopus-eid": "2-s2.0-85189633580",
      "originalText": "serial JL 271346 291210 291744 291809 31 Applied Catalysis A: General APPLIEDCATALYSISAGENERAL 2024-04-05 2024-04-05 2024-04-08 2024-04-08 2024-04-18T16:52:59 1-s2.0-S0926860X24001704 S0926-860X(24)00170-4 S0926860X24001704 10.1016/j.apcata.2024.119726 S300 S300.1 FULL-TEXT 1-s2.0-S0926860X24X0006X 2024-05-23T23:41:26.775068Z 0 0 20240525 2024 2024-04-05T10:11:30.178413Z absattachment articleinfo articlenumber articletitlenorm authfirstinitialnorm authfirstsurnamenorm cid cids contenttype copyright crossmark dateloaded dateloadedtxt datesearch datesort dateupdated dco docsubtype doctype doi eid ewtransactionid hubeid indexeddate issn issnnorm itemstage itemtransactionid itemweight openaccess openarchive pg pgfirst pii piinorm pubdatestart pubdatetxt pubyr sortorder srctitle srctitlenorm srctype ssids alllist content subj subheadings suppl tomb volfirst volissue volumelist webpdf webpdfpagecount yearnav figure table e-component body acknowledge affil appendices articletitle auth authfirstini authfull authkeywords authlast grantnumber grantsponsor grantsponsorid highlightsabst orcid primabst ref specialabst 0926-860X 0926860X true 678 678 C Volume 678 7 119726 119726 119726 20240525 25 May 2024 2024-05-25 2024 article fla © 2024 Elsevier B.V. All rights reserved. ENHANCEDCATALYTICPERFORMANCEBDOPEDSICSUPPORTEDNICATALYSTSFORHYDROGENATIONNITROARENES ZHAO J 1 Introduction 2 Results and discussions 3 Conclusion CRediT authorship contribution statement Acknowledgements Appendix A Supplementary material References SERNA 2015 7114 7121 P LI 2021 3026 3039 M HE 2009 9538 9541 L LIN 2019 354 361 L ZHU 2022 18753 18760 Z ZHANG 2020 10350 10363 Q LI 2022 121462 Z LENG 2016 6018 6024 F LIU 2018 4981 5079 L CHEN 2014 1478 1486 P LI 2016 4199 4202 Y MILLAN 2018 19 30 R LIU 2016 1 9 L ZHANG 2022 121566 X Y 2023 139361 W HOU 2020 146616 D JIAO 2020 517 524 Z TUCI 2021 10559 10665 G HAO 2018 23029 23036 C ZHANG 2016 2629 2637 S DONG 2014 135 140 L AGATHOPOULOS 2012 3309 3315 S YANG 2015 8955 8961 T OSWALD 1999 136 141 S WANG 2018 C GALI 2000 4926 4929 A XU 2017 7600 7609 M LI 2012 501 507 H SERNA 2009 19 25 P ARADI 2001 245202 B KRISHNAKUMAR 2012 196 204 V GAO 2018 664 672 R CHEN 2015 6181 6189 X YANG 2018 55 62 F HABER 1898 506 514 F ZHAOX2024X119726 ZHAOX2024X119726XJ 2026-04-08T00:00:00.000Z 2026-04-08T00:00:00.000Z http://creativecommons.org/licenses/by-nc-nd/4.0/ © 2024 Elsevier B.V. All rights reserved. 2024-04-26T04:29:59.070Z http://vtw.elsevier.com/data/voc/AddOnTypes/50.7/aggregated-refined National Natural Science Foundation of China 22202019 NSFC National Natural Science Foundation of China http://data.elsevier.com/vocabulary/SciValFunders/501100001809 http://sws.geonames.org/1814991 Natural Science Research of Jiangsu Higher Education Institutions of China 22KJB150017 Natural Science Research of Jiangsu Higher Education Institutions of China http://data.elsevier.com/vocabulary/SciValFunders/501100010023 http://sws.geonames.org/1814991 This work was supported by the National Natural Science Foundation of China (22202019) and the Natural Science Research of Jiangsu Higher Education Institutions of China (22KJB150017). https://doi.org/10.15223/policy-017 https://doi.org/10.15223/policy-037 https://doi.org/10.15223/policy-012 https://doi.org/10.15223/policy-029 https://doi.org/10.15223/policy-004 item S0926-860X(24)00170-4 S0926860X24001704 1-s2.0-S0926860X24001704 10.1016/j.apcata.2024.119726 271346 2024-05-23T23:41:26.775068Z 2024-05-25 1-s2.0-S0926860X24001704-main.pdf https://s3-eu-west-1.amazonaws.com/prod-ucs-content-store-eu-west/content/pii:S0926860X24001704/MAIN/application/pdf/2943a5707cd7fd2f56c3e989ab1a6642/main.pdf main.pdf pdf true 6469897 MAIN 8 1-s2.0-S0926860X24001704-main_1.png https://s3-eu-west-1.amazonaws.com/prod-ucs-content-store-eu-west/content/pii:S0926860X24001704/PREVIEW/image/png/7cf6211285e3bad323469f7458d680f5/main_1.png main_1.png png 59243 849 656 IMAGE-WEB-PDF 1 1-s2.0-S0926860X24001704-gr9.jpg https://s3-eu-west-1.amazonaws.com/prod-ucs-content-store-eu-west/content/pii:S0926860X24001704/gr9/DOWNSAMPLED/image/jpeg/c670daf9a20e6d5dd44f111fd5503014/gr9.jpg gr9 gr9.jpg jpg 19636 250 339 IMAGE-DOWNSAMPLED 1-s2.0-S0926860X24001704-gr8.jpg https://s3-eu-west-1.amazonaws.com/prod-ucs-content-store-eu-west/content/pii:S0926860X24001704/gr8/DOWNSAMPLED/image/jpeg/7215f77728df5eaf2483789d795dd223/gr8.jpg gr8 gr8.jpg jpg 40394 231 678 IMAGE-DOWNSAMPLED 1-s2.0-S0926860X24001704-gr7.jpg https://s3-eu-west-1.amazonaws.com/prod-ucs-content-store-eu-west/content/pii:S0926860X24001704/gr7/DOWNSAMPLED/image/jpeg/e0cbda57e40fb5ed3f2a45216e1bfc4b/gr7.jpg gr7 gr7.jpg jpg 30572 251 678 IMAGE-DOWNSAMPLED 1-s2.0-S0926860X24001704-gr6.jpg https://s3-eu-west-1.amazonaws.com/prod-ucs-content-store-eu-west/content/pii:S0926860X24001704/gr6/DOWNSAMPLED/image/jpeg/5c0c42fa4843c9c67de5c04693778af6/gr6.jpg gr6 gr6.jpg jpg 50850 267 678 IMAGE-DOWNSAMPLED 1-s2.0-S0926860X24001704-gr5.jpg https://s3-eu-west-1.amazonaws.com/prod-ucs-content-store-eu-west/content/pii:S0926860X24001704/gr5/DOWNSAMPLED/image/jpeg/8e2d33a85ce5864e841a20124d3a0af5/gr5.jpg gr5 gr5.jpg jpg 18527 234 299 IMAGE-DOWNSAMPLED 1-s2.0-S0926860X24001704-gr4.jpg https://s3-eu-west-1.amazonaws.com/prod-ucs-content-store-eu-west/content/pii:S0926860X24001704/gr4/DOWNSAMPLED/image/jpeg/072c131cf006c2c597fbf623c7fb2adf/gr4.jpg gr4 gr4.jpg jpg 131565 562 678 IMAGE-DOWNSAMPLED 1-s2.0-S0926860X24001704-gr3.jpg https://s3-eu-west-1.amazonaws.com/prod-ucs-content-store-eu-west/content/pii:S0926860X24001704/gr3/DOWNSAMPLED/image/jpeg/b311f5d82b5d10ec89a25d9b8fb23616/gr3.jpg gr3 gr3.jpg jpg 61461 545 678 IMAGE-DOWNSAMPLED 1-s2.0-S0926860X24001704-fx12.jpg https://s3-eu-west-1.amazonaws.com/prod-ucs-content-store-eu-west/content/pii:S0926860X24001704/fx12/DOWNSAMPLED/image/jpeg/e4997417fe7dec233e373f3d225db64f/fx12.jpg fx12 fx12.jpg jpg 1484 28 102 IMAGE-DOWNSAMPLED 1-s2.0-S0926860X24001704-ga1.jpg https://s3-eu-west-1.amazonaws.com/prod-ucs-content-store-eu-west/content/pii:S0926860X24001704/ga1/DOWNSAMPLED/image/jpeg/f39aa8901d72cecdd84ac684b08ee2ba/ga1.jpg ga1 true ga1.jpg jpg 18618 200 298 IMAGE-DOWNSAMPLED 1-s2.0-S0926860X24001704-fx11.jpg https://s3-eu-west-1.amazonaws.com/prod-ucs-content-store-eu-west/content/pii:S0926860X24001704/fx11/DOWNSAMPLED/image/jpeg/ac25fa0e24bd4478451deb3dfcdd70fa/fx11.jpg fx11 fx11.jpg jpg 1532 31 102 IMAGE-DOWNSAMPLED 1-s2.0-S0926860X24001704-fx10.jpg https://s3-eu-west-1.amazonaws.com/prod-ucs-content-store-eu-west/content/pii:S0926860X24001704/fx10/DOWNSAMPLED/image/jpeg/b8c82b8f97ea4c91ad741d99c1ffb720/fx10.jpg fx10 fx10.jpg jpg 1575 33 102 IMAGE-DOWNSAMPLED 1-s2.0-S0926860X24001704-fx1.jpg https://s3-eu-west-1.amazonaws.com/prod-ucs-content-store-eu-west/content/pii:S0926860X24001704/fx1/DOWNSAMPLED/image/jpeg/1d9394c7827e8f8edd92519e0b6c351c/fx1.jpg fx1 fx1.jpg jpg 1551 32 103 IMAGE-DOWNSAMPLED 1-s2.0-S0926860X24001704-fx9.jpg https://s3-eu-west-1.amazonaws.com/prod-ucs-content-store-eu-west/content/pii:S0926860X24001704/fx9/DOWNSAMPLED/image/jpeg/e95c041af16aa132df8a695d7c1b1d94/fx9.jpg fx9 fx9.jpg jpg 1582 33 102 IMAGE-DOWNSAMPLED 1-s2.0-S0926860X24001704-gr2.jpg https://s3-eu-west-1.amazonaws.com/prod-ucs-content-store-eu-west/content/pii:S0926860X24001704/gr2/DOWNSAMPLED/image/jpeg/c8ebb62b9aa17e64644e9ecdf0921abf/gr2.jpg gr2 gr2.jpg jpg 73485 537 678 IMAGE-DOWNSAMPLED 1-s2.0-S0926860X24001704-fx8.jpg https://s3-eu-west-1.amazonaws.com/prod-ucs-content-store-eu-west/content/pii:S0926860X24001704/fx8/DOWNSAMPLED/image/jpeg/2f16441a6a4e252d773a68fe290c5eb5/fx8.jpg fx8 fx8.jpg jpg 1573 30 109 IMAGE-DOWNSAMPLED 1-s2.0-S0926860X24001704-gr1.jpg https://s3-eu-west-1.amazonaws.com/prod-ucs-content-store-eu-west/content/pii:S0926860X24001704/gr1/DOWNSAMPLED/image/jpeg/6e73d8e1f8cb9f3b5112628ff2cf3358/gr1.jpg gr1 gr1.jpg jpg 33119 307 395 IMAGE-DOWNSAMPLED 1-s2.0-S0926860X24001704-fx7.jpg https://s3-eu-west-1.amazonaws.com/prod-ucs-content-store-eu-west/content/pii:S0926860X24001704/fx7/DOWNSAMPLED/image/jpeg/2d46538a2ba91a517cc984941670ca26/fx7.jpg fx7 fx7.jpg jpg 1588 30 109 IMAGE-DOWNSAMPLED 1-s2.0-S0926860X24001704-fx6.jpg https://s3-eu-west-1.amazonaws.com/prod-ucs-content-store-eu-west/content/pii:S0926860X24001704/fx6/DOWNSAMPLED/image/jpeg/14ccd52f6ac2e7743eb53d09b4272090/fx6.jpg fx6 fx6.jpg jpg 1723 35 106 IMAGE-DOWNSAMPLED 1-s2.0-S0926860X24001704-fx5.jpg https://s3-eu-west-1.amazonaws.com/prod-ucs-content-store-eu-west/content/pii:S0926860X24001704/fx5/DOWNSAMPLED/image/jpeg/073828f1d467c1d5457d0c5aa1b2df8c/fx5.jpg fx5 fx5.jpg jpg 1626 35 108 IMAGE-DOWNSAMPLED 1-s2.0-S0926860X24001704-fx4.jpg https://s3-eu-west-1.amazonaws.com/prod-ucs-content-store-eu-west/content/pii:S0926860X24001704/fx4/DOWNSAMPLED/image/jpeg/52c8ca176b25734ef4d3369d89b92963/fx4.jpg fx4 fx4.jpg jpg 1497 30 101 IMAGE-DOWNSAMPLED 1-s2.0-S0926860X24001704-fx3.jpg https://s3-eu-west-1.amazonaws.com/prod-ucs-content-store-eu-west/content/pii:S0926860X24001704/fx3/DOWNSAMPLED/image/jpeg/0c60a126c8d1af47393f87dfbbc872c0/fx3.jpg fx3 fx3.jpg jpg 1511 30 101 IMAGE-DOWNSAMPLED 1-s2.0-S0926860X24001704-fx2.jpg https://s3-eu-west-1.amazonaws.com/prod-ucs-content-store-eu-west/content/pii:S0926860X24001704/fx2/DOWNSAMPLED/image/jpeg/5609a5b094b5f374f863b52f88394805/fx2.jpg fx2 fx2.jpg jpg 1526 31 102 IMAGE-DOWNSAMPLED 1-s2.0-S0926860X24001704-gr9.sml https://s3-eu-west-1.amazonaws.com/prod-ucs-content-store-eu-west/content/pii:S0926860X24001704/gr9/THUMBNAIL/image/gif/12212ed0d169f3bf33855adf7e948692/gr9.sml gr9 gr9.sml sml 14367 162 219 IMAGE-THUMBNAIL 1-s2.0-S0926860X24001704-gr8.sml https://s3-eu-west-1.amazonaws.com/prod-ucs-content-store-eu-west/content/pii:S0926860X24001704/gr8/THUMBNAIL/image/gif/798e5801c7601307781f3f9d97848932/gr8.sml gr8 gr8.sml sml 7851 74 219 IMAGE-THUMBNAIL 1-s2.0-S0926860X24001704-gr7.sml https://s3-eu-west-1.amazonaws.com/prod-ucs-content-store-eu-west/content/pii:S0926860X24001704/gr7/THUMBNAIL/image/gif/86d2b5e5f657042c2a1741c82353a9fa/gr7.sml gr7 gr7.sml sml 4068 81 219 IMAGE-THUMBNAIL 1-s2.0-S0926860X24001704-gr6.sml https://s3-eu-west-1.amazonaws.com/prod-ucs-content-store-eu-west/content/pii:S0926860X24001704/gr6/THUMBNAIL/image/gif/ffd097150ee618a3d9e2f58adb4396f1/gr6.sml gr6 gr6.sml sml 7207 86 219 IMAGE-THUMBNAIL 1-s2.0-S0926860X24001704-gr5.sml https://s3-eu-west-1.amazonaws.com/prod-ucs-content-store-eu-west/content/pii:S0926860X24001704/gr5/THUMBNAIL/image/gif/31a8374b1ce4406c94e9c36a6cea3efd/gr5.sml gr5 gr5.sml sml 8615 164 209 IMAGE-THUMBNAIL 1-s2.0-S0926860X24001704-gr4.sml https://s3-eu-west-1.amazonaws.com/prod-ucs-content-store-eu-west/content/pii:S0926860X24001704/gr4/THUMBNAIL/image/gif/12b5d6890568eb55a451948aaed3ed63/gr4.sml gr4 gr4.sml sml 21128 164 198 IMAGE-THUMBNAIL 1-s2.0-S0926860X24001704-gr3.sml https://s3-eu-west-1.amazonaws.com/prod-ucs-content-store-eu-west/content/pii:S0926860X24001704/gr3/THUMBNAIL/image/gif/c383fe97bbddd6af76bd1d28336603fb/gr3.sml gr3 gr3.sml sml 10037 164 204 IMAGE-THUMBNAIL 1-s2.0-S0926860X24001704-fx12.sml https://s3-eu-west-1.amazonaws.com/prod-ucs-content-store-eu-west/content/pii:S0926860X24001704/fx12/THUMBNAIL/image/gif/fe3ec3a9751954a99e051a407ba6028f/fx12.sml fx12 fx12.sml sml 3377 60 219 IMAGE-THUMBNAIL 1-s2.0-S0926860X24001704-ga1.sml https://s3-eu-west-1.amazonaws.com/prod-ucs-content-store-eu-west/content/pii:S0926860X24001704/ga1/THUMBNAIL/image/gif/908c06daf30194e31b9e377f27541aaa/ga1.sml ga1 true ga1.sml sml 17699 147 219 IMAGE-THUMBNAIL 1-s2.0-S0926860X24001704-fx11.sml https://s3-eu-west-1.amazonaws.com/prod-ucs-content-store-eu-west/content/pii:S0926860X24001704/fx11/THUMBNAIL/image/gif/01d8baab94df2588e478e57e27018eac/fx11.sml fx11 fx11.sml sml 3498 68 219 IMAGE-THUMBNAIL 1-s2.0-S0926860X24001704-fx10.sml https://s3-eu-west-1.amazonaws.com/prod-ucs-content-store-eu-west/content/pii:S0926860X24001704/fx10/THUMBNAIL/image/gif/90676e0c7a1b7ab5db20b9032b97220a/fx10.sml fx10 fx10.sml sml 3618 71 219 IMAGE-THUMBNAIL 1-s2.0-S0926860X24001704-fx1.sml https://s3-eu-west-1.amazonaws.com/prod-ucs-content-store-eu-west/content/pii:S0926860X24001704/fx1/THUMBNAIL/image/gif/d4fa09628158a5945c035b6b22123089/fx1.sml fx1 fx1.sml sml 3581 67 219 IMAGE-THUMBNAIL 1-s2.0-S0926860X24001704-fx9.sml https://s3-eu-west-1.amazonaws.com/prod-ucs-content-store-eu-west/content/pii:S0926860X24001704/fx9/THUMBNAIL/image/gif/06ed1438d918a026c63670a9b57471d5/fx9.sml fx9 fx9.sml sml 3591 71 219 IMAGE-THUMBNAIL 1-s2.0-S0926860X24001704-gr2.sml https://s3-eu-west-1.amazonaws.com/prod-ucs-content-store-eu-west/content/pii:S0926860X24001704/gr2/THUMBNAIL/image/gif/c34dd6372968e1cc1a127e28ac225c13/gr2.sml gr2 gr2.sml sml 11209 164 207 IMAGE-THUMBNAIL 1-s2.0-S0926860X24001704-fx8.sml https://s3-eu-west-1.amazonaws.com/prod-ucs-content-store-eu-west/content/pii:S0926860X24001704/fx8/THUMBNAIL/image/gif/6ea09cfe8b60e31c6796f2d947c57a6c/fx8.sml fx8 fx8.sml sml 3428 61 219 IMAGE-THUMBNAIL 1-s2.0-S0926860X24001704-gr1.sml https://s3-eu-west-1.amazonaws.com/prod-ucs-content-store-eu-west/content/pii:S0926860X24001704/gr1/THUMBNAIL/image/gif/337d31822b4b29516bffc2bffd37ec02/gr1.sml gr1 gr1.sml sml 10794 164 211 IMAGE-THUMBNAIL 1-s2.0-S0926860X24001704-fx7.sml https://s3-eu-west-1.amazonaws.com/prod-ucs-content-store-eu-west/content/pii:S0926860X24001704/fx7/THUMBNAIL/image/gif/967c7717e8c036695f28f187dc1ddbaa/fx7.sml fx7 fx7.sml sml 3423 61 219 IMAGE-THUMBNAIL 1-s2.0-S0926860X24001704-fx6.sml https://s3-eu-west-1.amazonaws.com/prod-ucs-content-store-eu-west/content/pii:S0926860X24001704/fx6/THUMBNAIL/image/gif/256c2d4dc00dfd75d56b72d931ec4c05/fx6.sml fx6 fx6.sml sml 3563 72 219 IMAGE-THUMBNAIL 1-s2.0-S0926860X24001704-fx5.sml https://s3-eu-west-1.amazonaws.com/prod-ucs-content-store-eu-west/content/pii:S0926860X24001704/fx5/THUMBNAIL/image/gif/ddeab71e2dbc488f406dfa2302f18d1d/fx5.sml fx5 fx5.sml sml 3643 72 219 IMAGE-THUMBNAIL 1-s2.0-S0926860X24001704-fx4.sml https://s3-eu-west-1.amazonaws.com/prod-ucs-content-store-eu-west/content/pii:S0926860X24001704/fx4/THUMBNAIL/image/gif/6057ac7632fb89716c0494b7d651f8e2/fx4.sml fx4 fx4.sml sml 3552 66 219 IMAGE-THUMBNAIL 1-s2.0-S0926860X24001704-fx3.sml https://s3-eu-west-1.amazonaws.com/prod-ucs-content-store-eu-west/content/pii:S0926860X24001704/fx3/THUMBNAIL/image/gif/6fd577e13d87c2aa63d1fa1b4888af3c/fx3.sml fx3 fx3.sml sml 3537 66 219 IMAGE-THUMBNAIL 1-s2.0-S0926860X24001704-fx2.sml https://s3-eu-west-1.amazonaws.com/prod-ucs-content-store-eu-west/content/pii:S0926860X24001704/fx2/THUMBNAIL/image/gif/4a07bd56087ec91aa2fbb389bde6539d/fx2.sml fx2 fx2.sml sml 3531 67 219 IMAGE-THUMBNAIL 1-s2.0-S0926860X24001704-gr9_lrg.jpg https://s3-eu-west-1.amazonaws.com/prod-ucs-content-store-eu-west/content/pii:S0926860X24001704/HIGHRES/image/jpeg/b0d80dfe676a0373aa0487d2ff533d77/gr9_lrg.jpg gr9 gr9_lrg.jpg jpg 114217 1105 1497 IMAGE-HIGH-RES 1-s2.0-S0926860X24001704-gr8_lrg.jpg https://s3-eu-west-1.amazonaws.com/prod-ucs-content-store-eu-west/content/pii:S0926860X24001704/HIGHRES/image/jpeg/a126356a011e0786f07d589176c8cd96/gr8_lrg.jpg gr8 gr8_lrg.jpg jpg 177365 1018 2994 IMAGE-HIGH-RES 1-s2.0-S0926860X24001704-gr7_lrg.jpg https://s3-eu-west-1.amazonaws.com/prod-ucs-content-store-eu-west/content/pii:S0926860X24001704/HIGHRES/image/jpeg/e296e41f765a01e2dc1b6d20a88fb88e/gr7_lrg.jpg gr7 gr7_lrg.jpg jpg 144508 1107 2994 IMAGE-HIGH-RES 1-s2.0-S0926860X24001704-gr6_lrg.jpg https://s3-eu-west-1.amazonaws.com/prod-ucs-content-store-eu-west/content/pii:S0926860X24001704/HIGHRES/image/jpeg/6261d6cedbb061cff04a41c6eeee77f4/gr6_lrg.jpg gr6 gr6_lrg.jpg jpg 224415 1177 2994 IMAGE-HIGH-RES 1-s2.0-S0926860X24001704-gr5_lrg.jpg https://s3-eu-west-1.amazonaws.com/prod-ucs-content-store-eu-west/content/pii:S0926860X24001704/HIGHRES/image/jpeg/effdd160363322354ac49694a6b3f08b/gr5_lrg.jpg gr5 gr5_lrg.jpg jpg 90265 1042 1330 IMAGE-HIGH-RES 1-s2.0-S0926860X24001704-gr4_lrg.jpg https://s3-eu-west-1.amazonaws.com/prod-ucs-content-store-eu-west/content/pii:S0926860X24001704/HIGHRES/image/jpeg/10ed38da1900e3ccbce756a24fc2f259/gr4_lrg.jpg gr4 gr4_lrg.jpg jpg 627532 2483 2994 IMAGE-HIGH-RES 1-s2.0-S0926860X24001704-gr3_lrg.jpg https://s3-eu-west-1.amazonaws.com/prod-ucs-content-store-eu-west/content/pii:S0926860X24001704/HIGHRES/image/jpeg/d9009f3a53218e9e6f95ba12f4cec68b/gr3_lrg.jpg gr3 gr3_lrg.jpg jpg 290515 2405 2994 IMAGE-HIGH-RES 1-s2.0-S0926860X24001704-fx12_lrg.jpg https://s3-eu-west-1.amazonaws.com/prod-ucs-content-store-eu-west/content/pii:S0926860X24001704/HIGHRES/image/jpeg/4dc416933c3112bf348895853cb18e8f/fx12_lrg.jpg fx12 fx12_lrg.jpg jpg 7294 124 456 IMAGE-HIGH-RES 1-s2.0-S0926860X24001704-ga1_lrg.jpg https://s3-eu-west-1.amazonaws.com/prod-ucs-content-store-eu-west/content/pii:S0926860X24001704/HIGHRES/image/jpeg/937a5560288fba72b4bba26b95498741/ga1_lrg.jpg ga1 true ga1_lrg.jpg jpg 122988 886 1320 IMAGE-HIGH-RES 1-s2.0-S0926860X24001704-fx11_lrg.jpg https://s3-eu-west-1.amazonaws.com/prod-ucs-content-store-eu-west/content/pii:S0926860X24001704/HIGHRES/image/jpeg/9315553a35cf1ad46ea0b74a34e8d472/fx11_lrg.jpg fx11 fx11_lrg.jpg jpg 7613 141 457 IMAGE-HIGH-RES 1-s2.0-S0926860X24001704-fx10_lrg.jpg https://s3-eu-west-1.amazonaws.com/prod-ucs-content-store-eu-west/content/pii:S0926860X24001704/HIGHRES/image/jpeg/fbf856ba9de69f32a845a5dcfb2c5aa7/fx10_lrg.jpg fx10 fx10_lrg.jpg jpg 7928 147 456 IMAGE-HIGH-RES 1-s2.0-S0926860X24001704-fx1_lrg.jpg https://s3-eu-west-1.amazonaws.com/prod-ucs-content-store-eu-west/content/pii:S0926860X24001704/HIGHRES/image/jpeg/29850a8f7db30af74b67ee0880d8d4b0/fx1_lrg.jpg fx1 fx1_lrg.jpg jpg 7791 141 459 IMAGE-HIGH-RES 1-s2.0-S0926860X24001704-fx9_lrg.jpg https://s3-eu-west-1.amazonaws.com/prod-ucs-content-store-eu-west/content/pii:S0926860X24001704/HIGHRES/image/jpeg/0f5550abc322253c2107c40992ac2d40/fx9_lrg.jpg fx9 fx9_lrg.jpg jpg 8008 147 456 IMAGE-HIGH-RES 1-s2.0-S0926860X24001704-gr2_lrg.jpg https://s3-eu-west-1.amazonaws.com/prod-ucs-content-store-eu-west/content/pii:S0926860X24001704/HIGHRES/image/jpeg/c8f5a646c35faa0297f3b8d6e433f9a7/gr2_lrg.jpg gr2 gr2_lrg.jpg jpg 348222 2373 2994 IMAGE-HIGH-RES 1-s2.0-S0926860X24001704-fx8_lrg.jpg https://s3-eu-west-1.amazonaws.com/prod-ucs-content-store-eu-west/content/pii:S0926860X24001704/HIGHRES/image/jpeg/7c467ef633a9f0228fd52b239e29ff50/fx8_lrg.jpg fx8 fx8_lrg.jpg jpg 8328 137 490 IMAGE-HIGH-RES 1-s2.0-S0926860X24001704-gr1_lrg.jpg https://s3-eu-west-1.amazonaws.com/prod-ucs-content-store-eu-west/content/pii:S0926860X24001704/HIGHRES/image/jpeg/67bbbe4c526967e9f414f7d304d8619e/gr1_lrg.jpg gr1 gr1_lrg.jpg jpg 171798 1357 1746 IMAGE-HIGH-RES 1-s2.0-S0926860X24001704-fx7_lrg.jpg https://s3-eu-west-1.amazonaws.com/prod-ucs-content-store-eu-west/content/pii:S0926860X24001704/HIGHRES/image/jpeg/acb4762359ad48e142d6b88e371750d5/fx7_lrg.jpg fx7 fx7_lrg.jpg jpg 8319 137 490 IMAGE-HIGH-RES 1-s2.0-S0926860X24001704-fx6_lrg.jpg https://s3-eu-west-1.amazonaws.com/prod-ucs-content-store-eu-west/content/pii:S0926860X24001704/HIGHRES/image/jpeg/1727d6eaf3f3c2969d95f50a1c58ae13/fx6_lrg.jpg fx6 fx6_lrg.jpg jpg 8570 156 477 IMAGE-HIGH-RES 1-s2.0-S0926860X24001704-fx5_lrg.jpg https://s3-eu-west-1.amazonaws.com/prod-ucs-content-store-eu-west/content/pii:S0926860X24001704/HIGHRES/image/jpeg/3bad9cb43706c44c66f18d87dc4ecaf3/fx5_lrg.jpg fx5 fx5_lrg.jpg jpg 8833 157 480 IMAGE-HIGH-RES 1-s2.0-S0926860X24001704-fx4_lrg.jpg https://s3-eu-west-1.amazonaws.com/prod-ucs-content-store-eu-west/content/pii:S0926860X24001704/HIGHRES/image/jpeg/68fa81397a99fe2ae489f36f87bc2e91/fx4_lrg.jpg fx4 fx4_lrg.jpg jpg 7469 137 454 IMAGE-HIGH-RES 1-s2.0-S0926860X24001704-fx3_lrg.jpg https://s3-eu-west-1.amazonaws.com/prod-ucs-content-store-eu-west/content/pii:S0926860X24001704/HIGHRES/image/jpeg/a64b5af19eb0572557b9725083a7e126/fx3_lrg.jpg fx3 fx3_lrg.jpg jpg 7545 137 454 IMAGE-HIGH-RES 1-s2.0-S0926860X24001704-fx2_lrg.jpg https://s3-eu-west-1.amazonaws.com/prod-ucs-content-store-eu-west/content/pii:S0926860X24001704/HIGHRES/image/jpeg/6c431367c67682837205dd4ed67c92cc/fx2_lrg.jpg fx2 fx2_lrg.jpg jpg 7631 140 457 IMAGE-HIGH-RES 1-s2.0-S0926860X24001704-mmc1.docx https://s3-eu-west-1.amazonaws.com/prod-ucs-content-store-eu-west/content/pii:S0926860X24001704/mmc1/MAIN/application/vnd.openxmlformats-officedocument.wordprocessingml.document/93cce2d77dade12bc7ba3ed468937744/mmc1.docx mmc1 mmc1.docx docx 1468247 APPLICATION 1-s2.0-S0926860X24001704-am.pdf am am.pdf pdf 1461019 AAM-PDF https://s3-eu-west-1.amazonaws.com/prod-ucs-content-store-eu-west/content/egi:10K3D6SXDKS/MAIN/application/pdf/bc3ed66774eeb6ec3219ed6e20147006/am.pdf APCATA 119726 119726 S0926-860X(24)00170-4 10.1016/j.apcata.2024.119726 Elsevier B.V. Fig. 1 Performances of Ni/SiC-B x catalysts for nitrobenzene hydrogenation under the condition of 80 °C, 1 MPa H2 and 5 h. Fig. 1 Fig. 2 XRD patterns of SiC-B x (a: x is 0, 0.1, 0.3, 0.5, 1 and 2 from A to F) and XPS results of B 1 s in SiC-B x samples(b-d). Fig. 2 Fig. 3 Si 2p XPS results of SiC(a), SiC-B0.1(b), SiC-B0.3(c) and SiC-B0.5(d). Fig. 3 Fig. 4 TEM images of Ni/SiC (a and c) and Ni/SiC-B0.5 (b and d). Fig. 4 Fig. 5 TPR profiles of Ni/SiC and Ni/SiC-B0.5. Fig. 5 Fig. 6 In situ FTIR spectra of nitrobenzene adsorbed on SiC-based (a) and non-SiC-based (b) catalysts. Fig. 6 Fig. 7 In-situ FTIR spectra of the effluent gases on fresh (a) and CO-poisoned (b) Ni/SiC-B0.5 catalyst. Fig. 7 Fig. 8 Time dependences of nitrobenzene conversion and product selectivity over Ni/SiC (a) and Ni/SiC-B0.5 (b). Fig. 8 Fig. 9 Recyclability of Ni/SiC-B0.5 catalyst for nitrobenzene hydrogenation. Fig. 9 Table 1 Lattice constants a and inter-planar distances d between the planes (111) of SiC, calculated from the diffractograms of Fig. 2a. Table 1 x a/nm d/nm 0 0.4364 0.2520 0.1 0.4361 0.2518 0.3 0.4358 0.2516 0.5 0.4349 0.2511 1 0.4348 0.2510 2 0.4346 0.2509 Table 2 Hydrogenation of nitroarenes to anilines over Ni/SiC-B0.5 catalyst. Table 2 Entry Reactant Main product Conv. (%) Select. (%) 1 Image 1 Image 2 93.5 99.9 2 Image 3 Image 4 94.5 99.9 3 Image 5 Image 6 95.5 99.9 4 Image 7 Image 8 92.6 95.6 5 Image 9 Image 10 70.1 99.9 6 Image 11 Image 12 70.3 99.9 Enhanced catalytic performance of B-doped SiC supported Ni catalysts for the hydrogenation of nitroarenes Ji-Xiao Zhao Writing – original draft Methodology Investigation Conceptualization Dan Yao Investigation Data curation Visualization Writing – original draft Lei Li Formal analysis Methodology Jia-Hang Li Data curation Zhi-Feng Jiao Funding acquisition Supervision Writing – review & editing ⁎ Xiang-Yun Guo Project administration Supervision Validation Writing – review & editing ⁎ Jiangsu Key Laboratory of Advanced Catalytic Materials and Technology, School of Petrochemical Engineering, Changzhou University, Changzhou 213164, China Jiangsu Key Laboratory of Advanced Catalytic Materials and Technology, School of Petrochemical Engineering, Changzhou University Changzhou 213164 China Jiangsu Key Laboratory of Advanced Catalytic Materials and Technology, School of Petrochemical Engineering, Changzhou University, Changzhou 213164, China ⁎ Corresponding authors. SiC and B-doped SiC were prepared and employed to support Ni components for the catalytic hydrogenation of nitroarenes. The B-doping of SiC evidently improved the catalytic activity of Ni/SiC, and the activity of Ni/SiC-B0.5 catalyst was 2.4 times higher than that of undoped Ni/SiC. Further investigations revealed that the incorporation of B substituted some Si atoms in SiC lattice and thus produced carbon vacancies. These vacancies will result in a heterogeneous distribution of surface charges on SiC, thereby enhancing the adsorption and activation of nitroarenes on the support surface. In addition, the carbon vacancies can also act as donor centers for capturing dissociated hydrogen species, thus enhancing the hydrogen spillover from Ni to SiC surface. Graphical Abstract Keywords Ni/SiC catalysts B doping Hydrogenation of nitroarenes Data availability Data will be made available on request. 1 Introduction Aniline and its derivatives are valuable intermediates broadly used in the synthesis of organic dyes, pigments, pharmaceuticals and pesticides [1–3]. The production methods of aniline include iron powder reduction, hydrazine hydrate reduction, catalytic hydrogenation, etc. Among these methods, the catalytic hydrogenation of nitroarenes is an efficient and environmentally friendly route that has received widespread attention [4]. Noble metal catalysts such as Au [5], Pt [6], Pd [7], Ru [8] exhibited efficient catalytic performance for the hydrogenation of nitrobenzene. However, the expense and scarcity of precious metals have greatly limited their industrial applications. Therefore, the development of cheap and resource-rich non-noble metal catalysts for the important hydrogenation process is of great importance. Non-precious metal catalysts for nitrobenzene hydrogenation have been studied deeply [9]. Supported Co [10], Fe [11], and Ni [12] catalysts have exhibited good catalytic performance for the process. Liu et al. employed thin carbon layers to protect the chemical state of active component Co, and achieved efficient hydrogenation of nitroarenes to corresponding anilines [13]. Zhang et al. developed multi-layer N-doped graphene encapsulated Ni catalysts for the hydrogenation of nitroarenes containing sulfur impurities [14]. Wei et al. found that the electron was transferred from Ni to graphene after some oxygen-containing functional groups were modified, allowing electron-rich graphene to activate and hydrogenate chloronitrobenzene [15]. The properties of supports have significant impacts on the performance of supported catalysts. SiC is a novel carrier material, and it can not only disperse metal active components, but also provide active sites for some reactants [16–18]. In the nitrobenzene hydrogenation on Pd-Au/SiC catalyst, H2 was dissociated on the Pd surface and then migrated to the SiC surface where it reacted with nitrobenzene molecules adsorbed there [19]. It is established that electron-deficient nitro group (-NO2) is easily adsorbed on electron-rich sites [20]. Therefore, the construction of electron-rich sites on SiC surface would help improve the catalytic activity of SiC supported catalysts for nitrobenzene hydrogenation. The B doping to SiC can change the intrinsic electric structure of SiC, and B-doped SiC has shown enhanced activity for photocatalytic water splitting [21]. In this work, we reported that the B doping increased the electric density of Si sites and thus the surface of B-doped SiC became more beneficial to hydrogen spillover and nitrobenzene adsorption. As a result, the catalytic activity of B-doped SiC supported Ni increased by 2.4 times in comparison with Ni/SiC. 2 Results and discussions Under the reaction conditions described in 1.3 of the experimental section (see the supporting information), the selectivity of various SiC-based catalysts for aniline can reach 99.9%, but the catalytic activity (nitrobenzene conversion) is various for different catalysts. When Ni/SiC is used as the catalyst, the nitrobenzene conversion is only 32.5%, and the reaction rate is 1.5 mol nitrobenzene/(mol Ni·h). When using Ni/SiC-B x catalysts, the nitrobenzene conversion is significantly improved. Among them, the Ni/SiC-B0.5 catalyst can give a reaction rate of 3.6 mol nitrobenzene/(mol Ni·h), which is 2.4 times of that of Ni/SiC under identical conditions. Subsequently, the influences of different B doping levels on the catalytic performance were studied, as shown in Fig. 1. As the doping level of B in SiC increases, the nitrobenzene conversion gradually increases. When the B doping level is 0.5, the catalyst shows the highest activity. As the B doping level continues to increase, the corresponding catalysts show a declined catalytic activity. By raising the reaction temperature to 90 °C, the Ni/SiC-B0.5 catalyst can achieve a nitrobenzene conversion of nearly 100% (the reaction rate is 4.9 mol nitrobenzene/(mol Ni·h)). The results indicate that the B doping in the SiC support has an important role in the enhancement of the catalytic activity of Ni nanoparticles. When the amount of substrate is increased to 10 mmol, the conversion rate is ∼29.6 mol nitrobenzene/(mol Ni·h). In comparison with the reported non-noble metal-based catalysts (Table S1), the Ni/SiC-B0.5 is one of the most excellent catalysts for nitrobenzene hydrogenation under mild conditions (90°C, 1 MPa H2). The XRD patterns of as-prepared SiC and SiC-B x (x=0.1, 0.3, 0.5, 1, 2) samples are shown in Fig. 2a. From the patterns, all the strong diffraction peaks can be attributed to the different facets of β-SiC. Besides these peaks, no other diffraction peaks are observed in all samples, this indicates that B doping does not alter the phase structure of β-SiC. However, as the B doping level increased, the characteristic peaks of β-SiC shifted to higher 2θ values, indicating an obvious lattice shrinkage. The detailed magnifying of the diffraction peak (111) is illustrated as inset in Fig. 2a. Table 1 shows the lattice constant a and interplanar spacing d of the (111) planes of SiC, which are obtained from the diffractograms of Fig. 2a. Both the values of a and d decrease with the increase of B doping level, further confirming the lattice shrinkage. With increasing B doping, the SiC lattice shrinks, indicating that B is preferentially accommodated in Si sites. Because B has a smaller atomic radius (0.095 nm) than Si (0.134 nm), the replacement of Si by B will result in the lattice shrinkage [22]. The above results suggest that B has been doped into the lattice of SiC [23]. The chemical state and surface properties of SiC-Bx samples were determined using X-ray photoelectron spectroscopy (XPS). The B 1 s XPS results of SiC-B x samples are shown in Fig. 2b-d and Fig S1a. According to literature, the binding energy (BE) of B 1 s in silicon shows a sharp peak at 187.4 eV, it will shift to a higher BE when B is doped in SiC [24]. The peak at 192–193 eV is attributed to the B-O bond of B2O3 [25]. In Fig. 2b-d and Fig. S1a, the BEs in the range of 192–193 eV and ∼190 eV can be ascribed to B-O and B-C bonds, respectively. Increasing the B doping level, the percentage of B-C bonds on samples also increases. Specifically, the B-C proportion in SiC-Bx gradually increases from 46% (SiC-B0.1) to 58% (SiC-B0.3), 73% (SiC-B0.5) and 77% (SiC-B1). The above results also suggest that B has been successfully doped into SiC and replaced some Si sites in SiC. The BEs of Si 2p in different SiC-B x samples were also investigated by XPS. As shown in Fig. 3 and Fig. S1b, the BE value of Si 2p shifts slightly from 101.5 eV (SiC) to 101.2 eV (SiC-B0.1), 100.8 eV (SiC-B0.3), 100.4 eV (SiC-B0.5), and 98.9 eV (SiC-B1), suggesting an electron enrichment on Si atoms. In the SiC lattice, each C atom is bonded to four adjacent Si atoms, and each Si atom is bonded to four C atoms. When some Si sites in SiC are replaced by B, there will form carbon vacancies adjacent to the B due to the different valence of B3+ and Si4+. The Si atoms adjacent to the carbon vacancies will generate dangling bonds, which increase the electron density around the Si atoms and form electron-rich Si sites. Theoretical calculations have indicated that the carbon vacancies in SiC will form donor centers, which easily capture hydrogen and form Si-H bonds [26]. According to the inductively coupled plasma optical emission spectrometer (ICP-OES)results, the Ni contents are 4.1 wt%, 4.3 wt%, 4.8 wt%, 4.7 wt% and 4.5 wt% for Ni/SiC, Ni/SiC-B0.1, Ni/SiC-B0.3, Ni/SiC-B0.5 and Ni/SiC-B1, respectively, suggesting Ni particles can be successfully loaded on SiC and B doped SiC supports. The transmission electron microscopic (TEM) images show that the average particle sizes of Ni in Ni/SiC and Ni/SiC-B0.5 are 4.4 nm ( Figs. 4a) and 4.0 nm (Fig. 4b), respectively. The interplanar spacings of Ni particles are 0.203 nm, corresponding to the Ni (111) plane for both samples (Fig. 4c and d). However, no diffraction peaks of Ni or NiO can be found in the XRD patterns of either of the two catalysts. (Fig. S2), this may be due to the small size of Ni particles. The above results suggest that the B doping does not significantly affect the size of Ni particles. From the Ni 2p XPS results of Ni/SiC and Ni/SiC-B x (Fig. S3), Ni components mainly exist in the oxidized state in Ni/SiC and Ni/SiC-B0.1. However, Ni0 species appear both in Ni/SiC-B0.3 and Ni/SiC-B0.5. With the increase of B doping, the metallic Ni disappears in Ni/SiC-B1. These results indicate that the doping of a suitable amount of B into SiC can alter the interaction between Ni and SiC. The TPR profiles of Ni/SiC and Ni/SiC-B0.5 catalysts are shown in Fig. 5. As can be seen, the catalysts display two reduction peaks. The first peak of Ni/SiC catalyst appears at 291 °C. This is the reduction peak of the amorphous NiO, which has a weak interaction with SiC. The second peak appears at 547 °C, which is the reduction peak of NiO with strong interaction with SiC [27,28]. For the Ni/SiC-B0.5 catalyst, the first peak appears at 189 °C, which is far lower than that of Ni/SiC. Meanwhile, the hydrogen consumption in this region also significantly increases. Because the pre-reduction temperature of Ni/SiC and Ni/SiC-B is only 450 °C, catalytically active Ni components mainly originate from those reduced at lower temperature. Obviously, there are more active Ni components in Ni/SiC-B0.5 catalyst. Therefore, the B doping has greatly promoted the reduction of NiO and the formation of more active Ni components. H2 dissociation is usually the rate-determining step in nitrobenzene hydrogenation, and a catalyst with high hydrogen dissociation capacity tends to have a high level of hydrogenation activity [29]. The adsorption capacity of Ni/SiC and Ni/SiC-B0.5 catalysts for H2 were measured by pulse adsorption at 30 °C. The saturation adsorption of H2 on Ni/SiC was 1.8 μmol/g, whereas it was 31.2 μmol/g for Ni/SiC-B0.5. The adsorption capacity of Ni/SiC-B0.5 for H2 is greatly higher than that of Ni/SiC, and this may be attributed to the B-doping resulted carbon vacancies [26]. The enhanced H2 adsorption is consistent with the high reactivity of Ni/SiC-B0.5. Additionally, we introduced an H2 flow (30 mL/min) to the mixture of WO3 with Ni/SiC or Ni/SiC-B0.5 catalysts at 30 °C for 40 min, a significant color change of the mixture of Ni/SiC-B0.5 and WO3 was observed, while the color of the mixture of Ni/SiC and WO3 remained almost unchanged (Fig. S4). These results indicate that the B doping can indeed enhance hydrogen spillover from Ni to the surface of SiC. The IR spectra of H2-treated Ni/SiC and Ni/SiC-B0.5 catalysts were also recorded (Fig. S5). An adsorption band at 3014 cm−1 was observed from the infrared spectra of H2-treated Ni/SiC-B0.5 catalyst, which can be assigned to the vibration absorption of C-H bond. However, the same adsorption band was not found in the Ni/SiC catalyst. This also proves that the B doping can enhance the hydrogen spillover on the SiC surface [30]. However, the characteristic absorption of Si-H bond was not observed, which may be due to its weak IR absorption. In summary, the B doping results in the appearance of electron-rich Si sites on the SiC surface, which are beneficial to the reduction of NiO and hydrogen spillover. According to our previous work on photocatalytic hydrogenation of nitrobenzene, nitrobenzene is adsorbed and activated on the surface of SiC [19]. Therefore, in-situ FTIR was used to study the adsorption of nitrobenzene over different catalysts, and the results are shown in Fig. 6. For nitrobenzene, the absorption bands caused by the asymmetric and symmetric stretching vibration of -NO2 are in the range of 1625–1540 cm−1 (v asym) and 1400–1360 cm−1 (v sym), respectively [31,32]. As shown in Fig. 6a, the adsorption of nitrobenzene on both SiC and Ni/SiC exhibits two distinct absorption bands at ∼1521 cm−1 and ∼1347 cm−1, corresponding to the v asym and v sym of N-O bonds in the -NO2 group. After nitrobenzene was adsorbed on SiC-B x and Ni/SiC-B x , both the v asym and v sym of N-O bonds were blue-shifted to ∼1532 cm−1 and ∼1347 cm−1 respectively. The blue shift of the v asym and v sym of N-O bonds is due to the enhancement of N-O and C-N bonds, respectively [33]. This indicates that electrons transfer from the SiC-Bx surface to the electron-withdrawing -NO2 group. In addition, the absorption bands of nitrobenzene on pure SiC-B x and it supported Ni catalyst are identical, suggesting that nitrobenzene is mainly adsorbed on the surface of SiC support. The adsorption of nitrobenzene molecules on other different carriers and their Ni catalysts were also studied, and the results are shown in Fig. 6b. The -NO2 absorption bands are not clearly observed on pure Al2O3 and SBA-15. In comparison, the v sym (NO) and v asym (NO) bands are found at 1342 cm−1 and 1517 cm−1 on Ni/ SBA-15, and 1343 cm−1 and 1518 cm−1 on Ni/Al2O3. The above results indicate that nitrobenzene mainly adsorbed on the Ni particles surface, this is clearly different from the adsorption on SiC based catalysts. CO poisoning experiments were employed to explore the surface reaction processes of nitrobenzene hydrogenation. Ni/SiC-B0.5 catalyst was firstly treated at 150 °C in 0.5 MPa CO for 30 min, and then used for the nitrobenzene hydrogenation under the given conditions for 1 h. The nitrobenzene conversion in this case was only 1.7%, which was 1/14 of the conversion on fresh Ni/SiC-B0.5 catalyst under the same conditions. This means that the CO treatment can make the Ni/SiC-B0.5 catalyst poisoned. Next, a temperature-programmed reaction process was used to confirm the role of surface species in the hydrogenation reaction [34]. First, 50 mg catalyst was sandwiched in quartz wool in a quartz tube, and reduced at 150 °C for 30 min under H2/N2 flow (VH2=10%) (step A). In the process, H2 was dissociated on Ni surface and the dissociated H species then migrated to the surface of SiC. Second, Ar was used to purge the catalyst for 30 min to remove the physically adsorbed H2 on the catalyst surface (step B). Then, the nitrobenzene was fed into the reactor tube via an Ar flow, and the exhaust gas was analyzed by in-situ FTIR (step C). For the fresh Ni/SiC-B0.5 catalyst, the vibration band of –NO2 (1540 cm−1) in gaseous nitrobenzene and the ring stretching vibration band (1506 cm−1) in gaseous aniline produced by the nitrobenzene hydrogenation can be clearly seen in the infrared spectra after 5 min, as shown in Fig. 7a. This indicates that the chemo-adsorbed hydrogen on the catalyst surface can hydrogenate nitrobenzene to aniline. To further demonstrate that the nitrobenzene molecules are activated on the surface of SiC-B x support, CO was fed into the reactor tube to poison Ni after step A. Surprisingly, the adsorption band of –NO2 and the ring stretching vibration band of aniline can also be observed in the infrared spectra after 5 min of the mixed gas of CO/nitrobenzene injection, the results are shown in Fig. 7b. Since the Ni surface has been poisoned by CO, the above control experiments suggest that the SiC-B surface is capable of activating nitrobenzene molecules. To confirm the activation of nitrobenzene on the surface of support, dilution experiments were carried out according to the following processes. Firstly, 300 mg of SiC-B0.5 was dispersed in an ethanol (5 mL) solution of nitrobenzene (1 mmol) under stirring for 1 h, then the suspension was dried to obtain a sample of SiC-B0.5 with nitrobenzene adsorbed on its surface, and the sample was marked as NB/SiC-B0.5. Subsequently, 15 mg of Ni/SiC-B0.5 catalyst was mixed with different masses of NB/SiC-B0.5 for the dilution experiments carried out under the condition of 90 °C, 1 MPa H2 and 30 min. After the reaction, the mixture of catalyst and NB/SiC-B0.5 was again dispersed in ethanol (3 mL) and gas chromatography was employed to analyze the content of aniline in ethanol. The results of above experiments (Fig. S6) further confirm that the SiC-B0.5 carrier can activate nitrobenzene and the hydrogenation process is realized through the reaction between nitrobenzene adsorbed on the support surface and spillover hydrogen dissociated on Ni surface. Under optimal reaction conditions, except the quantity of reactants is 2 mmol, the kinetic behaviors of nitrobenzene hydrogenation on Ni/SiC-B0.5 and Ni/SiC were studied and the results are shown in Fig. 8. The kinetic profile of Ni/SiC for nitrobenzene hydrogenation (Fig. 8a) suggests that nitrobenzene could be converted into aniline with initially a nearly zero-order in concentration, and no other intermediate was observed. From the kinetic curve of Ni/SiC-B0.5 (Fig. 8b), it can be seen that it also conforms to the characteristics of a zero-order reaction in the initial stage (within 1 h). Besides aniline, other intermediates such as nitrosobenzene, azoxybenzene and azobenzene can also be observed. As the reaction time lengthens, the selectivity of aniline gradually increases while the selectivities of other products continuously decrease. Haber first proposed a reaction network for nitrobenzene hydrogenation including direct and condensation pathways based on electrochemical reduction experiments [35], and the mechanism has been widely used to explain the experimental results of nitrobenzene hydrogenation [6]. From the kinetic profiles of Ni/SiC-B0.5 and Ni/SiC, it can be concluded that Ni/SiC catalyzed hydrogenation of nitrobenzene follows a direct reaction pathway, while the reaction pathway over Ni/SiC-B0.5 changes to the condensation pathway, which may be attributed to the adsorption behaviors changes of reactant and immediate when B doped to SiC. Then, different kinds of substituted nitroarenes were used as substrates to investigate the general applicability of Ni/ SiC-B0.5 for the hydrogenation of nitroarenes. As shown in Table 2, Ni/SiC-B0.5 can transform all of these nitro compounds to corresponding anilines with high activity and selectivity. The electron-withdrawing nitroarenes (entries 1–4) showed higher activity than the electron-donating ones (entries 5−6). Especially for nitroaromatic hydrocarbons (entries 2–4) containing sensitive groups such as -CN, -CHO, and -COOH, they can also be selectively converted into corresponding anilines. Reaction conditions: 1 mmol of reactant, 50 mg of Ni/SiC-B0.5 catalyst in 10 mL of anhydrous ethanol. 1 MPa H2 and 90 °C. One of the advantages of heterogeneous catalysts is their good reusability. The stability tests were carried out and the results are shown in Fig. 9. It can be seen that the selectivity of aniline shows no decrease during the 5 times used, while the activity of Ni/SiC-B0.5 appears an obvious degradation. The catalyst after 5 tests was analyzed by ICP-OES and TEM. Compared with the fresh catalyst (4.7 wt%, Ni), the Ni content of the used catalyst decreased to 3.7 wt%. TEM images of the used catalyst showed that the mean size of Ni particles had grown from 4.0 nm to 9.4 nm (Fig. S7). Therefore, the Ni loss and particle growth may result in the declined catalytic activity. 3 Conclusion We have shown that Ni supported on B doped SiC exhibits good performance for the hydrogenation of nitroarenes to anilines with molecular hydrogen. The excellent catalytic activity originates from the electron-rich Si sites that generated by the B doping. In B doped SiC, the replacement of Si atoms by B leads to the generation of carbon vacancies and electron-rich Si sites adjacent to the vacancies. During the catalytic hydrogenation, metallic Ni component performs the dissociation of H2 and the support surface activates nitrobenzene. The dissociated hydrogen species then migrate to the support surface and react with adsorbed nitrobenzene. The B doping can enhance the reduction of Ni oxides and the hydrogen spillover on SiC surface. Therefore, the Ni supported on B doped SiC shows improved catalytic activity for the nitroarenes hydrogenation. This study offers a novel idea and reference for designing new catalysts for the selective hydrogenation of nitroarenes. CRediT authorship contribution statement Ji-Xiao Zhao: Writing – original draft, Methodology, Investigation, Conceptualization. Dan Yao: Investigation, Data curation, Visualization, Writing – original draft. Lei Li: Formal analysis, Methodology. Jia-Hang Li: Data curation. Zhi-Feng Jiao: Funding acquisition, Supervision, Writing – review & editing. Xiang-Yun Guo: Project administration, Supervision, Validation, Writing – review & editing. Declaration of Competing Interest The authors declare that they have no known competing financial interests or personal relationships that could have appeared to influence the work reported in this paper. Acknowledgements This work was supported by the National Natural Science Foundation of China (22202019) and the Natural Science Research of Jiangsu Higher Education Institutions of China (22KJB150017). Appendix A Supporting information Supplementary data associated with this article can be found in the online version at doi:10.1016/j.apcata.2024.119726. Appendix A Supplementary material Supplementary material. References [1] P. Serna A. Corma Transforming nano metal nonselective particulates into chemoselective catalysts for hydrogenation of substituted nitrobenzenes ACS Catal. 5 2015 7114 7121 P. Serna and A. Corma. Transforming nano metal nonselective particulates into chemoselective catalysts for hydrogenation of substituted nitrobenzenes. ACS Catal. 2015, 5, 7114–7121. [2] M.H. Li S.Y. Chen Q.K. Jiang Q.L. Chen X. Wang Y. Yan J. Liu C.C. Lv W.P. Ding X.F. Guo Origin of the activity of Co–N–C catalysts for chemoselective hydrogenation of nitroarenes ACS Catal. 11 2021 3026 3039 M.H. Li, S.Y. Chen, Q.K. Jiang, Q.L. Chen, X. Wang, Y. Yan, J. Liu, C.C. Lv, W.P. Ding and X.F. Guo. Origin of the activity of Co–N–C catalysts for chemoselective hydrogenation of nitroarenes. ACS Catal. 2021, 11, 3026–3039. [3] L. He L.C. Wang H. Sun J. Ni Y. Cao H.Y. He K.N. Fan Efficient and selective room-temperature gold-catalyzed reduction of nitro compounds with CO and H2O as the hydrogen source Angew. Chem., Int. Ed. 48 2009 9538 9541 L. He, L.C. Wang, H. Sun, J. Ni, Y. Cao, H.Y. He and K.N. Fan. Efficient and selective room-temperature gold-catalyzed reduction of nitro compounds with CO and H2O as the hydrogen source. Angew. Chem., Int. Ed., 2009, 48, 9538–9541. [4] L.L. Lin S.Y. Yao R. Gao X. Liang Q.L. Yu Y.C. Deng J.J. Lin M. Peng Z. Jiang S.W. Li Y.W. Li X.D. Wen W. Zhou D. Ma A highly CO-tolerant atomically dispersed Pt catalyst for chemoselective hydrogenation Nat. Nanotechnol. 14 2019 354 361 L.L. Lin, S.Y. Yao, R. Gao, X. Liang, Q.L. Yu, Y.C. Deng, J.J. Lin, M. Peng, Z. Jiang, S.W. Li, Y.W. Li, X.D. Wen, W. Zhou and D. Ma. A highly CO-tolerant atomically dispersed Pt catalyst for chemoselective hydrogenation. Nat. Nanotechnol. 2019, 14, 354–361. [5] Z.H. Zhu H.C. Tao Y.T. Zhou Using density functional theory to unravel the size-dependent effect of Au nanoparticles and Au single atoms adsorbed on carbon nitride for the hydrogenation of nitrobenzene ACS Appl. Nano Mater. 5 2022 18753 18760 Z.H. Zhu, H.C. Tao and Y.T. Zhou. Using density functional theory to unravel the size-dependent effect of Au nanoparticles and Au single atoms adsorbed on carbon nitride for the hydrogenation of nitrobenzene. ACS Appl. Nano Mater. 2022, 5, 18753−18760. [6] Q.S. Zhang J.H. Bu J.D. Wang C.Y. Sun D.Y. Zhao G.Z. Sheng X.W. Xie M. Sun L. Yu Highly efficient hydrogenation of nitrobenzene to aniline over Pt/CeO2 catalysts: the shape effect of the support and key role of additional Ce3+ sites ACS Catal. 10 2020 10350 10363 Q.S. Zhang, J.H. Bu, J.D. Wang, C.Y. Sun, D.Y. Zhao, G.Z. Sheng, X.W. Xie, M. Sun and L. Yu. Highly efficient hydrogenation of nitrobenzene to aniline over Pt/CeO2 catalysts: the shape effect of the support and key role of additional Ce3+ sites. ACS Catal. 2020, 10, 10350–10363. [7] Z.J. Li M.Y. Zhang X.L. Dong S.Q. Ji L.L. Zhang L.P. Leng H.H. Li J.H. Horton Q. Xu J.F. Zhu Strong electronic interaction of indium oxide with palladium single atoms induced by quenching toward enhanced hydrogenation of nitrobenzene Appl. Catal., B-Environ. 313 2022 121462 Z.J. Li, M.Y. Zhang, X.L. Dong, S.Q. Ji, L.L. Zhang, L.P. Leng, H.H. Li, J.H. Horton, Q. Xu and J.F. Zhu. Strong electronic interaction of indium oxide with palladium single atoms induced by quenching toward enhanced hydrogenation of nitrobenzene. Appl. Catal, B-Environ. 2022, 313, 121462. [8] F.Q. Leng I.C. Gerber P. Lecante S. Moldovan M. Girleanu M.R. Axet P. Serp Controlled and chemoselective hydrogenation of nitrobenzene over Ru@C60 Catalysts ACS Catal. 6 2016 6018 6024 F.Q. Leng, I.C. Gerber, P. Lecante, S. Moldovan, M. Girleanu, M.R. Axet and P. Serp. Controlled and Chemoselective Hydrogenation of Nitrobenzene over Ru@C60 Catalysts. ACS Catal. 2016, 6, 6018–6024. [9] L.C. Liu A. Corma Metal catalysts for heterogeneous catalysis: from single atoms to nanoclusters and nanoparticles Chem. Rev. 118 2018 4981 5079 L.C. Liu and A. Corma. Metal catalysts for heterogeneous catalysis: from single atoms to nanoclusters and nanoparticles. Chem. Rev. 2018, 118, 4981–5079. [10] P.R. Chen F.K. Yang A. Kostka W. Xia Interaction of cobalt nanoparticles with oxygen- and nitrogen-functionalized carbon nanotubes and impact on nitrobenzene hydrogenation catalysis ACS Catal. 4 2014 1478 1486 P.R. Chen, F.K. Yang, A. Kostka and W. Xia. Interaction of cobalt nanoparticles with oxygen- and nitrogen-functionalized carbon nanotubes and impact on nitrobenzene hydrogenation catalysis. ACS Catal. 2014, 4, 1478–1486. [11] Y. Li Y.X. Zhou X. Ma H.L. Jiang A metal–organic framework-templated synthesis of γ-Fe2O3 nanoparticles encapsulated in porous carbon for efficient and chemoselective hydrogenation of nitro compounds Chem. Commun. 52 2016 4199 4202 Y. Li, Y.X. Zhou, X. Ma and H.L. Jiang. A metal–organic framework-templated synthesis of γ-Fe2O3 nanoparticles encapsulated in porous carbon for efficient and chemoselective hydrogenation of nitro compounds. Chem. Commun. 2016, 52, 4199–4202. [12] R. Millán L.C. Liu M. Boronat A. Corma A new molecular pathway allows the chemoselective reduction of nitroaromatics on non-noble metal catalysts J. Catal. 364 2018 19 30 R. Millán, L.C. Liu, M. Boronat, and A. Corma. A new molecular pathway allows the chemoselective reduction of nitroaromatics on non-noble metal catalysts. J. Catal. 2018, 364, 19–30. [13] L.C. Liu P. Concepción and A. Corma. Non-noble metal catalysts for hydrogenation: a facile method for preparing Co nanoparticles covered with thin layered carbon J. Catal. 340 2016 1 9 L.C. Liu, P. Concepción and A. Corma. Non-noble metal catalysts for hydrogenation: A facile method for preparing Co nanoparticles covered with thin layered carbon. J. Catal. 2016, 340, 1–9. [14] X.J. Zhang Y.B. Zhou G.W. Li L. Zhang C.Y. Yin Y.Y. Yang H.Z. Wang F. Feng L.W. Wei Q.F. Zhang F. Yang L.L. Lin C.S. Lu X.N. Li A highly sulfur resistant and stable heterogeneous catalyst for liquid-phase hydrogenation Appl. Catal. B-Environ. 315 2022 121566 X.J. Zhang, Y.B. Zhou, G.W. Li, L. Zhang, C.Y. Yin, Y.Y. Yang, H.Z. Wang, F. Feng, L.W. Wei, Q.F. Zhang, F. Yang, L.L. Lin, C.S. Lu and X.N. Li. A highly sulfur resistant and stable heterogeneous catalyst for liquid-phase hydrogenation. Appl. Catal. B-Environ. 2022, 315, 121566 [15] W. Y F.Z. Xiao X. Li W. He Y.Y. Yao D.C. Wan X. Liu Y. Liu F. Feng Q.F. Zhang C.S. Lu X.N. Li Nickel and oxygen-containing functional groups co-decorated graphene-like shells as catalytic sites with excellent selective hydrogenation activity and robust stability Chem. Eng. J. 452 2023 139361 W. Y, F.Z. Xiao, X. Li, W. He, Y.Y. Yao, D.C. Wan, X. Liu, Y. Liu, F. Feng, Q.F. Zhang, C.S. Lu and X.N. Li. Nickel and oxygen-containing functional groups co-decorated graphene-like shells as catalytic sites with excellent selective hydrogenation activity and robust stability. Chem. Eng. J. 2023, 452, 139361. [16] D.F. Hou Z.F. Jiao Z.P. Liang Y.W. Wang X.N. Guo X.Y. Guo Selectivity control of Pt/SiC catalysts for photothermocatalytic hydrogenation of 3-nitrostyrene Appl. Surf. Sci. 526 2020 146616 D.F., Hou, Z.F. Jiao, Z.P. Liang, Y.W. Wang, X.N. Guo and X.Y. Guo. Selectivity control of Pt/SiC catalysts for photothermocatalytic hydrogenation of 3-nitrostyrene. Appl. Surf. Sci. 2020, 526, 146616. [17] Z.F. Jiao Y.M. Tian B. Zhang C.H. Hao Y. Qiao Y.X. Wang Y. Qin U. Radius H. Braunschweig T.B. Marder X.N. Guo X.Y. Guo High photocatalytic activity of a NiO nanodot-decorated Pd/SiC catalyst for the Suzuki-Miyaura cross-coupling of aryl bromides and chlorides in air under visible light J. Catal. 389 2020 517 524 Z.F. Jiao, Y.M. Tian, B. Zhang, C.H. Hao, Y. Qiao, Y.X. Wang, Y. Qin, U. Radius, H. Braunschweig, T.B. Marder, X.N. Guo and X.Y. Guo. High photocatalytic activity of a NiO nanodot-decorated Pd/SiC catalyst for the Suzuki-Miyaura cross-coupling of aryl bromides and chlorides in air under visible light. J. Catal. 2020, 389, 517–524. [18] G.L. Tuci Y.F. Liu A. Rossin X.Y. Guo C. Pham G. Giambastiani C. Pham-Huu Porous Silicon Carbide (SiC): a chance for improving catalysts or just another active-phase carrier? Chem. Rev. 121 2021 10559 10665 G.L. Tuci, Y.F. Liu, A. Rossin, X.Y. Guo, C. Pham, G. Giambastiani and C. Pham-Huu, Porous Silicon Carbide (SiC): A Chance for Improving Catalysts or Just Another Active-Phase Carrier? Chem. Rev. 2021, 121, 10559–10665. [19] C.H. Hao X.N. Guo M. Sankar H. Yang B. Ma Y.F. Zhang X.L. Tong G.Q. Jin X.Y. Guo Synergistic effect of segregated Pd and Au nanoparticles on semiconducting SiC for efficient photocatalytic hydrogenation of nitroarenes ACS Appl. Mater. Inter. 10 2018 23029 23036 C.H. Hao, X.N. Guo, M. Sankar, H. Yang, B. Ma, Y.F. Zhang, X.L. Tong, G.Q. Jin and X.Y. Guo, Synergistic effect of segregated Pd and Au nanoparticles on semiconducting SiC for efficient photocatalytic hydrogenation of nitroarenes. ACS Appl. Mater. Inter. 2018, 10, 23029–23036. [20] S. Zhang C.R. Chang Z.Q. Huang J. Li Z.M. Wu Y.Y. Ma Z.Y. Zhang Y. Wang Y.Q. Qu High catalytic activity and chemoselectivity of sub-nanometric Pd clusters on porous nanorods of CeO2 for hydrogenation of nitroarenes J. Am. Chem. Soc. 138 2016 2629 2637 S. Zhang, C.R. Chang, Z.Q. Huang, J. Li, Z.M. Wu, Y.Y. Ma, Z.Y. Zhang, Y. Wang and Y.Q. Qu. High catalytic activity and chemoselectivity of sub-nanometric Pd clusters on porous nanorods of CeO2 for hydrogenation of nitroarenes. J. Am. Chem. Soc. 2016, 138, 2629–2637. [21] L.L. Dong Y.Y. Wang X.L. Tong. G. Q. Jin X.Y. Guo Synthesis and characterization of boron-doped SiC for visible light driven hydrogen production Acta Phys. -Chim. Sin. 30 2014 135 140 L.L. Dong, Y.Y. Wang, X.L. Tong. G. Q. Jin and X.Y. Guo. Synthesis and Characterization of Boron-Doped SiC for Visible Light Driven Hydrogen Production. Acta Phys. -Chim. Sin. 2014, 30, 135–140. [22] S. Agathopoulos Influence of synthesis process on the dielectric properties of B-doped SiC powders Ceram. Int. 38 2012 3309 3315 S. Agathopoulos. Influence of synthesis process on the dielectric properties of B-doped SiC powders. Ceram. Int. 2012, 38, 3309–3315. [23] T. Yang X.W. Chang J.H. Chen K. Chou X.M. Hou B-doped 3C-SiC nanowires with a finned microstructure for efficient visible light-driven photocatalytic hydrogen production Nanoscale 7 2015 8955 8961 T. Yang, X.W. Chang, J.H. Chen, K. Chou and X.M. Hou. B-doped 3C-SiC nanowires with a finned microstructure for efficient visible light-driven photocatalytic hydrogen production. Nanoscale, 2015, 7, 8955–8961. [24] S. Oswald H. Wirth Core-level shifts at B-and Al-doped 6H-SiC studied by XPS Surf. Interface Anal. 27 1999 136 141 S. Oswald and H. Wirth. Core-level shifts at B-and Al-doped 6H-SiC studied by XPS. Surf. Interface Anal. 1999, 27, 136–141. [25] C.L. Wang X.G. Zhang J.S. Wang Y.J. Ma S.X. Lv J.Y. Xiang M.N. Chu T. Sun C.L. Qin Boron/nitrogen/oxygen co-doped carbon with high volumetric performance for aqueous symmetric supercapacitors J. Electrochem. Soc. 165 2018 A858−A866 C.L. Wang, X.G. Zhang, J.S. Wang, Y.J. Ma, S.X. Lv, J.Y. Xiang, M.N. Chu, T. Sun, and C.L. Qin. Boron/nitrogen/oxygen co-doped carbon with high volumetric performance for aqueous symmetric supercapacitors. J. Electrochem. Soc. 2018, 165, A858−A866. [26] A. Gali B. Aradi P. Deák Overcoordinated hydrogens in the carbon vacancy: donor centers of SiC Phys. Rev. Lett. 84 2000 4926 4929 A. Gali, B. Aradi and P. Deák. Overcoordinated hydrogens in the carbon vacancy: donor centers of SiC. Phys. Rev. Lett. 2000, 84, 4926–4929. [27] M. Xu S. He H. Chen G.Q. Cui L.R. Zheng B. Wang M. Wei TiO2-x-modified Ni nanocatalyst with tunable metal–support interaction for water–gas shift reaction ACS Catal. 7 2017 7600 7609 M. Xu, S. He, H. Chen, G.Q. Cui, L.R. Zheng, B. Wang and M. Wei. TiO2-x-modified Ni nanocatalyst with tunable metal–support interaction for water–gas shift reaction. ACS Catal. 2017, 7, 7600–7609. [28] H.T. Li Y.X. Zhao C.G. Gao Y.Z. Wang Z.J. Sun X.Y. Liang Study on deactivation of Ni/Al2O3 catalyst for liquid phase hydrogenation of crude 1,4-butanediol aqueous solution Chem. Eng. J. 181-182 2012 501 507 H.T. Li, Y.X. Zhao, C.G. Gao, Y.Z. Wang, Z.J. Sun and X.Y. Liang. Study on deactivation of Ni/Al2O3 catalyst for liquid phase hydrogenation of crude 1,4-butanediol aqueous solution. Chem. Eng. J, 2012, 181-182, 501–507. [29] P. Serna P. Concepcion A. Corma Design of highly active and chemoselective bimetallic gold–platinum hydrogenation catalysts through kinetic and isotopic studies J. Catal. 265 2009 19 25 P. Serna, P. Concepcion and A. Corma. Design of highly active and chemoselective bimetallic gold–platinum hydrogenation catalysts through kinetic and isotopic studies. J. Catal., 2009, 265, 19–25. [30] B. Aradi A. Gali P. Deák J.E. Lowther N.T. Son E. Janzén W.J. Choyke Ab initio density-functional supercell calculations of hydrogen defects in cubic SiC Phy. Rev. B 63 2001 245202 B. Aradi, A. Gali, P. Deák, J.E. Lowther, N.T. Son, E. Janzén, and W.J. Choyke. Ab initio density-functional supercell calculations of hydrogen defects in cubic SiC. Phy. Rev. B, 2001, 63, 245202. [31] V. Krishnakumar D. Barathi R. Mathammal Molecular structure, vibrational spectra, HOMO, LUMO and NMR studies of 1,2-dichloro-4-nitrobenzene and 2,3,5,6-tetrachloro-1-nitrobenzene based on density functional calculations Spectrochim. Acta Part A 86 2012 196 204 V. Krishnakumar, D. Barathi and R. Mathammal. Molecular structure, vibrational spectra, HOMO, LUMO and NMR studies of 1,2-dichloro-4-nitrobenzene and 2,3,5,6-tetrachloro-1-nitrobenzene based on density functional calculations. Spectrochim. Acta. Part A 2012, 86, 196–204. [32] R.J. Gao L. Pan Z. W. Li X.W. Zhang L. Wang J.J. Zou Cobalt nanoparticles encapsulated in nitrogen-doped carbon for room-temperature selective hydrogenation of nitroarenes Chin. J. Catal. 39 2018 664 672 R.J. Gao, L. Pan, Z. W. Li, X.W. Zhang, L. Wang and J.J. Zou. Cobalt nanoparticles encapsulated in nitrogen-doped carbon for room-temperature selective hydrogenation of nitroarenes. Chin. J. Catal. 2018, 39, 664–672. [33] X.X. Chen B. Chen Macroscopic and spectroscopic investigations of the adsorption of nitroaromatic compounds on graphene oxide, reduced graphene gxide, and graphene Nanosheets Environ. Sci. Technol. 49 2015 6181 6189 X.X. Chen and B. Chen. Macroscopic and spectroscopic investigations of the adsorption of nitroaromatic compounds on graphene oxide, reduced graphene gxide, and graphene Nanosheets. Environ. Sci. Technol. 2015, 49, 6181–6189. [34] F.K. Yang B. Hu W. Xia B.X. Peng J.Y. Shen M. Muhler On the nature of spillover hydrogen species on platinum/nitrogen-doped mesoporous carbon composites: a temperature-programmed nitrobenzene desorption study J. Catal. 365 2018 55 62 F.K. Yang, B. Hu, W. Xia, B.X. Peng, J.Y. Shen and M. Muhler. On the nature of spillover hydrogen species on platinum/nitrogen-doped mesoporous carbon composites: A temperature-programmed nitrobenzene desorption study. J. Catal. 2018, 365, 55–62. [35] F. Haber Über stufenweise Reduktion des nitrobenzols mit begrenztem kathodenpotential Z. Elektrochem. 4 1898 506 514 F. Haber, Über stufenweise Reduktion des Nitrobenzols mit begrenztem Kathodenpotential. Z. Elektrochem. 1898, 4, 506-514.",
      "scopus-id": "85189633580",
      "coredata": {
        "eid": "1-s2.0-S0926860X24001704",
        "dc:description": "SiC and B-doped SiC were prepared and employed to support Ni components for the catalytic hydrogenation of nitroarenes. The B-doping of SiC evidently improved the catalytic activity of Ni/SiC, and the activity of Ni/SiC-B0.5 catalyst was 2.4 times higher than that of undoped Ni/SiC. Further investigations revealed that the incorporation of B substituted some Si atoms in SiC lattice and thus produced carbon vacancies. These vacancies will result in a heterogeneous distribution of surface charges on SiC, thereby enhancing the adsorption and activation of nitroarenes on the support surface. In addition, the carbon vacancies can also act as donor centers for capturing dissociated hydrogen species, thus enhancing the hydrogen spillover from Ni to SiC surface.",
        "openArchiveArticle": "false",
        "prism:coverDate": "2024-05-25",
        "openaccessUserLicense": null,
        "prism:aggregationType": "Journal",
        "prism:url": "https://api.elsevier.com/content/article/pii/S0926860X24001704",
        "dc:creator": [
          {
            "@_fa": "true",
            "$": "Zhao, Ji-Xiao"
          },
          {
            "@_fa": "true",
            "$": "Yao, Dan"
          },
          {
            "@_fa": "true",
            "$": "Li, Lei"
          },
          {
            "@_fa": "true",
            "$": "Li, Jia-Hang"
          },
          {
            "@_fa": "true",
            "$": "Jiao, Zhi-Feng"
          },
          {
            "@_fa": "true",
            "$": "Guo, Xiang-Yun"
          }
        ],
        "link": [
          {
            "@_fa": "true",
            "@rel": "self",
            "@href": "https://api.elsevier.com/content/article/pii/S0926860X24001704"
          },
          {
            "@_fa": "true",
            "@rel": "scidir",
            "@href": "https://www.sciencedirect.com/science/article/pii/S0926860X24001704"
          }
        ],
        "dc:format": "application/json",
        "openaccessType": null,
        "pii": "S0926-860X(24)00170-4",
        "prism:volume": "678",
        "articleNumber": "119726",
        "prism:publisher": "Elsevier B.V.",
        "dc:title": "Enhanced catalytic performance of B-doped SiC supported Ni catalysts for the hydrogenation of nitroarenes",
        "prism:copyright": "© 2024 Elsevier B.V. All rights reserved.",
        "openaccess": "0",
        "prism:issn": "0926860X",
        "dcterms:subject": [
          {
            "@_fa": "true",
            "$": "Ni/SiC catalysts"
          },
          {
            "@_fa": "true",
            "$": "B doping"
          },
          {
            "@_fa": "true",
            "$": "Hydrogenation of nitroarenes"
          }
        ],
        "openaccessArticle": "false",
        "prism:publicationName": "Applied Catalysis A: General",
        "openaccessSponsorType": null,
        "prism:pageRange": "119726",
        "pubType": "fla",
        "prism:coverDisplayDate": "25 May 2024",
        "prism:doi": "10.1016/j.apcata.2024.119726",
        "prism:startingPage": "119726",
        "dc:identifier": "doi:10.1016/j.apcata.2024.119726",
        "openaccessSponsorName": null
      },
      "objects": {
        "object": [
          {
            "@category": "standard",
            "@height": "250",
            "@width": "339",
            "@_fa": "true",
            "$": "https://api.elsevier.com/content/object/eid/1-s2.0-S0926860X24001704-gr9.jpg?httpAccept=%2A%2F%2A",
            "@multimediatype": "JPEG image file",
            "@type": "IMAGE-DOWNSAMPLED",
            "@size": "19636",
            "@ref": "gr9",
            "@mimetype": "image/jpeg"
          },
          {
            "@category": "standard",
            "@height": "231",
            "@width": "678",
            "@_fa": "true",
            "$": "https://api.elsevier.com/content/object/eid/1-s2.0-S0926860X24001704-gr8.jpg?httpAccept=%2A%2F%2A",
            "@multimediatype": "JPEG image file",
            "@type": "IMAGE-DOWNSAMPLED",
            "@size": "40394",
            "@ref": "gr8",
            "@mimetype": "image/jpeg"
          },
          {
            "@category": "standard",
            "@height": "251",
            "@width": "678",
            "@_fa": "true",
            "$": "https://api.elsevier.com/content/object/eid/1-s2.0-S0926860X24001704-gr7.jpg?httpAccept=%2A%2F%2A",
            "@multimediatype": "JPEG image file",
            "@type": "IMAGE-DOWNSAMPLED",
            "@size": "30572",
            "@ref": "gr7",
            "@mimetype": "image/jpeg"
          },
          {
            "@category": "standard",
            "@height": "267",
            "@width": "678",
            "@_fa": "true",
            "$": "https://api.elsevier.com/content/object/eid/1-s2.0-S0926860X24001704-gr6.jpg?httpAccept=%2A%2F%2A",
            "@multimediatype": "JPEG image file",
            "@type": "IMAGE-DOWNSAMPLED",
            "@size": "50850",
            "@ref": "gr6",
            "@mimetype": "image/jpeg"
          },
          {
            "@category": "standard",
            "@height": "234",
            "@width": "299",
            "@_fa": "true",
            "$": "https://api.elsevier.com/content/object/eid/1-s2.0-S0926860X24001704-gr5.jpg?httpAccept=%2A%2F%2A",
            "@multimediatype": "JPEG image file",
            "@type": "IMAGE-DOWNSAMPLED",
            "@size": "18527",
            "@ref": "gr5",
            "@mimetype": "image/jpeg"
          },
          {
            "@category": "standard",
            "@height": "562",
            "@width": "678",
            "@_fa": "true",
            "$": "https://api.elsevier.com/content/object/eid/1-s2.0-S0926860X24001704-gr4.jpg?httpAccept=%2A%2F%2A",
            "@multimediatype": "JPEG image file",
            "@type": "IMAGE-DOWNSAMPLED",
            "@size": "131565",
            "@ref": "gr4",
            "@mimetype": "image/jpeg"
          },
          {
            "@category": "standard",
            "@height": "545",
            "@width": "678",
            "@_fa": "true",
            "$": "https://api.elsevier.com/content/object/eid/1-s2.0-S0926860X24001704-gr3.jpg?httpAccept=%2A%2F%2A",
            "@multimediatype": "JPEG image file",
            "@type": "IMAGE-DOWNSAMPLED",
            "@size": "61461",
            "@ref": "gr3",
            "@mimetype": "image/jpeg"
          },
          {
            "@category": "standard",
            "@height": "28",
            "@width": "102",
            "@_fa": "true",
            "$": "https://api.elsevier.com/content/object/eid/1-s2.0-S0926860X24001704-fx12.jpg?httpAccept=%2A%2F%2A",
            "@multimediatype": "JPEG image file",
            "@type": "IMAGE-DOWNSAMPLED",
            "@size": "1484",
            "@ref": "fx12",
            "@mimetype": "image/jpeg"
          },
          {
            "@category": "standard",
            "@height": "200",
            "@width": "298",
            "@_fa": "true",
            "$": "https://api.elsevier.com/content/object/eid/1-s2.0-S0926860X24001704-ga1.jpg?httpAccept=%2A%2F%2A",
            "@multimediatype": "JPEG image file",
            "@type": "IMAGE-DOWNSAMPLED",
            "@size": "18618",
            "@ref": "ga1",
            "@mimetype": "image/jpeg"
          },
          {
            "@category": "standard",
            "@height": "31",
            "@width": "102",
            "@_fa": "true",
            "$": "https://api.elsevier.com/content/object/eid/1-s2.0-S0926860X24001704-fx11.jpg?httpAccept=%2A%2F%2A",
            "@multimediatype": "JPEG image file",
            "@type": "IMAGE-DOWNSAMPLED",
            "@size": "1532",
            "@ref": "fx11",
            "@mimetype": "image/jpeg"
          },
          {
            "@category": "standard",
            "@height": "33",
            "@width": "102",
            "@_fa": "true",
            "$": "https://api.elsevier.com/content/object/eid/1-s2.0-S0926860X24001704-fx10.jpg?httpAccept=%2A%2F%2A",
            "@multimediatype": "JPEG image file",
            "@type": "IMAGE-DOWNSAMPLED",
            "@size": "1575",
            "@ref": "fx10",
            "@mimetype": "image/jpeg"
          },
          {
            "@category": "standard",
            "@height": "32",
            "@width": "103",
            "@_fa": "true",
            "$": "https://api.elsevier.com/content/object/eid/1-s2.0-S0926860X24001704-fx1.jpg?httpAccept=%2A%2F%2A",
            "@multimediatype": "JPEG image file",
            "@type": "IMAGE-DOWNSAMPLED",
            "@size": "1551",
            "@ref": "fx1",
            "@mimetype": "image/jpeg"
          },
          {
            "@category": "standard",
            "@height": "33",
            "@width": "102",
            "@_fa": "true",
            "$": "https://api.elsevier.com/content/object/eid/1-s2.0-S0926860X24001704-fx9.jpg?httpAccept=%2A%2F%2A",
            "@multimediatype": "JPEG image file",
            "@type": "IMAGE-DOWNSAMPLED",
            "@size": "1582",
            "@ref": "fx9",
            "@mimetype": "image/jpeg"
          },
          {
            "@category": "standard",
            "@height": "537",
            "@width": "678",
            "@_fa": "true",
            "$": "https://api.elsevier.com/content/object/eid/1-s2.0-S0926860X24001704-gr2.jpg?httpAccept=%2A%2F%2A",
            "@multimediatype": "JPEG image file",
            "@type": "IMAGE-DOWNSAMPLED",
            "@size": "73485",
            "@ref": "gr2",
            "@mimetype": "image/jpeg"
          },
          {
            "@category": "standard",
            "@height": "30",
            "@width": "109",
            "@_fa": "true",
            "$": "https://api.elsevier.com/content/object/eid/1-s2.0-S0926860X24001704-fx8.jpg?httpAccept=%2A%2F%2A",
            "@multimediatype": "JPEG image file",
            "@type": "IMAGE-DOWNSAMPLED",
            "@size": "1573",
            "@ref": "fx8",
            "@mimetype": "image/jpeg"
          },
          {
            "@category": "standard",
            "@height": "307",
            "@width": "395",
            "@_fa": "true",
            "$": "https://api.elsevier.com/content/object/eid/1-s2.0-S0926860X24001704-gr1.jpg?httpAccept=%2A%2F%2A",
            "@multimediatype": "JPEG image file",
            "@type": "IMAGE-DOWNSAMPLED",
            "@size": "33119",
            "@ref": "gr1",
            "@mimetype": "image/jpeg"
          },
          {
            "@category": "standard",
            "@height": "30",
            "@width": "109",
            "@_fa": "true",
            "$": "https://api.elsevier.com/content/object/eid/1-s2.0-S0926860X24001704-fx7.jpg?httpAccept=%2A%2F%2A",
            "@multimediatype": "JPEG image file",
            "@type": "IMAGE-DOWNSAMPLED",
            "@size": "1588",
            "@ref": "fx7",
            "@mimetype": "image/jpeg"
          },
          {
            "@category": "standard",
            "@height": "35",
            "@width": "106",
            "@_fa": "true",
            "$": "https://api.elsevier.com/content/object/eid/1-s2.0-S0926860X24001704-fx6.jpg?httpAccept=%2A%2F%2A",
            "@multimediatype": "JPEG image file",
            "@type": "IMAGE-DOWNSAMPLED",
            "@size": "1723",
            "@ref": "fx6",
            "@mimetype": "image/jpeg"
          },
          {
            "@category": "standard",
            "@height": "35",
            "@width": "108",
            "@_fa": "true",
            "$": "https://api.elsevier.com/content/object/eid/1-s2.0-S0926860X24001704-fx5.jpg?httpAccept=%2A%2F%2A",
            "@multimediatype": "JPEG image file",
            "@type": "IMAGE-DOWNSAMPLED",
            "@size": "1626",
            "@ref": "fx5",
            "@mimetype": "image/jpeg"
          },
          {
            "@category": "standard",
            "@height": "30",
            "@width": "101",
            "@_fa": "true",
            "$": "https://api.elsevier.com/content/object/eid/1-s2.0-S0926860X24001704-fx4.jpg?httpAccept=%2A%2F%2A",
            "@multimediatype": "JPEG image file",
            "@type": "IMAGE-DOWNSAMPLED",
            "@size": "1497",
            "@ref": "fx4",
            "@mimetype": "image/jpeg"
          },
          {
            "@category": "standard",
            "@height": "30",
            "@width": "101",
            "@_fa": "true",
            "$": "https://api.elsevier.com/content/object/eid/1-s2.0-S0926860X24001704-fx3.jpg?httpAccept=%2A%2F%2A",
            "@multimediatype": "JPEG image file",
            "@type": "IMAGE-DOWNSAMPLED",
            "@size": "1511",
            "@ref": "fx3",
            "@mimetype": "image/jpeg"
          },
          {
            "@category": "standard",
            "@height": "31",
            "@width": "102",
            "@_fa": "true",
            "$": "https://api.elsevier.com/content/object/eid/1-s2.0-S0926860X24001704-fx2.jpg?httpAccept=%2A%2F%2A",
            "@multimediatype": "JPEG image file",
            "@type": "IMAGE-DOWNSAMPLED",
            "@size": "1526",
            "@ref": "fx2",
            "@mimetype": "image/jpeg"
          },
          {
            "@category": "thumbnail",
            "@height": "162",
            "@width": "219",
            "@_fa": "true",
            "$": "https://api.elsevier.com/content/object/eid/1-s2.0-S0926860X24001704-gr9.sml?httpAccept=%2A%2F%2A",
            "@multimediatype": "GIF image file",
            "@type": "IMAGE-THUMBNAIL",
            "@size": "14367",
            "@ref": "gr9",
            "@mimetype": "image/gif"
          },
          {
            "@category": "thumbnail",
            "@height": "74",
            "@width": "219",
            "@_fa": "true",
            "$": "https://api.elsevier.com/content/object/eid/1-s2.0-S0926860X24001704-gr8.sml?httpAccept=%2A%2F%2A",
            "@multimediatype": "GIF image file",
            "@type": "IMAGE-THUMBNAIL",
            "@size": "7851",
            "@ref": "gr8",
            "@mimetype": "image/gif"
          },
          {
            "@category": "thumbnail",
            "@height": "81",
            "@width": "219",
            "@_fa": "true",
            "$": "https://api.elsevier.com/content/object/eid/1-s2.0-S0926860X24001704-gr7.sml?httpAccept=%2A%2F%2A",
            "@multimediatype": "GIF image file",
            "@type": "IMAGE-THUMBNAIL",
            "@size": "4068",
            "@ref": "gr7",
            "@mimetype": "image/gif"
          },
          {
            "@category": "thumbnail",
            "@height": "86",
            "@width": "219",
            "@_fa": "true",
            "$": "https://api.elsevier.com/content/object/eid/1-s2.0-S0926860X24001704-gr6.sml?httpAccept=%2A%2F%2A",
            "@multimediatype": "GIF image file",
            "@type": "IMAGE-THUMBNAIL",
            "@size": "7207",
            "@ref": "gr6",
            "@mimetype": "image/gif"
          },
          {
            "@category": "thumbnail",
            "@height": "164",
            "@width": "209",
            "@_fa": "true",
            "$": "https://api.elsevier.com/content/object/eid/1-s2.0-S0926860X24001704-gr5.sml?httpAccept=%2A%2F%2A",
            "@multimediatype": "GIF image file",
            "@type": "IMAGE-THUMBNAIL",
            "@size": "8615",
            "@ref": "gr5",
            "@mimetype": "image/gif"
          },
          {
            "@category": "thumbnail",
            "@height": "164",
            "@width": "198",
            "@_fa": "true",
            "$": "https://api.elsevier.com/content/object/eid/1-s2.0-S0926860X24001704-gr4.sml?httpAccept=%2A%2F%2A",
            "@multimediatype": "GIF image file",
            "@type": "IMAGE-THUMBNAIL",
            "@size": "21128",
            "@ref": "gr4",
            "@mimetype": "image/gif"
          },
          {
            "@category": "thumbnail",
            "@height": "164",
            "@width": "204",
            "@_fa": "true",
            "$": "https://api.elsevier.com/content/object/eid/1-s2.0-S0926860X24001704-gr3.sml?httpAccept=%2A%2F%2A",
            "@multimediatype": "GIF image file",
            "@type": "IMAGE-THUMBNAIL",
            "@size": "10037",
            "@ref": "gr3",
            "@mimetype": "image/gif"
          },
          {
            "@category": "thumbnail",
            "@height": "60",
            "@width": "219",
            "@_fa": "true",
            "$": "https://api.elsevier.com/content/object/eid/1-s2.0-S0926860X24001704-fx12.sml?httpAccept=%2A%2F%2A",
            "@multimediatype": "GIF image file",
            "@type": "IMAGE-THUMBNAIL",
            "@size": "3377",
            "@ref": "fx12",
            "@mimetype": "image/gif"
          },
          {
            "@category": "thumbnail",
            "@height": "147",
            "@width": "219",
            "@_fa": "true",
            "$": "https://api.elsevier.com/content/object/eid/1-s2.0-S0926860X24001704-ga1.sml?httpAccept=%2A%2F%2A",
            "@multimediatype": "GIF image file",
            "@type": "IMAGE-THUMBNAIL",
            "@size": "17699",
            "@ref": "ga1",
            "@mimetype": "image/gif"
          },
          {
            "@category": "thumbnail",
            "@height": "68",
            "@width": "219",
            "@_fa": "true",
            "$": "https://api.elsevier.com/content/object/eid/1-s2.0-S0926860X24001704-fx11.sml?httpAccept=%2A%2F%2A",
            "@multimediatype": "GIF image file",
            "@type": "IMAGE-THUMBNAIL",
            "@size": "3498",
            "@ref": "fx11",
            "@mimetype": "image/gif"
          },
          {
            "@category": "thumbnail",
            "@height": "71",
            "@width": "219",
            "@_fa": "true",
            "$": "https://api.elsevier.com/content/object/eid/1-s2.0-S0926860X24001704-fx10.sml?httpAccept=%2A%2F%2A",
            "@multimediatype": "GIF image file",
            "@type": "IMAGE-THUMBNAIL",
            "@size": "3618",
            "@ref": "fx10",
            "@mimetype": "image/gif"
          },
          {
            "@category": "thumbnail",
            "@height": "67",
            "@width": "219",
            "@_fa": "true",
            "$": "https://api.elsevier.com/content/object/eid/1-s2.0-S0926860X24001704-fx1.sml?httpAccept=%2A%2F%2A",
            "@multimediatype": "GIF image file",
            "@type": "IMAGE-THUMBNAIL",
            "@size": "3581",
            "@ref": "fx1",
            "@mimetype": "image/gif"
          },
          {
            "@category": "thumbnail",
            "@height": "71",
            "@width": "219",
            "@_fa": "true",
            "$": "https://api.elsevier.com/content/object/eid/1-s2.0-S0926860X24001704-fx9.sml?httpAccept=%2A%2F%2A",
            "@multimediatype": "GIF image file",
            "@type": "IMAGE-THUMBNAIL",
            "@size": "3591",
            "@ref": "fx9",
            "@mimetype": "image/gif"
          },
          {
            "@category": "thumbnail",
            "@height": "164",
            "@width": "207",
            "@_fa": "true",
            "$": "https://api.elsevier.com/content/object/eid/1-s2.0-S0926860X24001704-gr2.sml?httpAccept=%2A%2F%2A",
            "@multimediatype": "GIF image file",
            "@type": "IMAGE-THUMBNAIL",
            "@size": "11209",
            "@ref": "gr2",
            "@mimetype": "image/gif"
          },
          {
            "@category": "thumbnail",
            "@height": "61",
            "@width": "219",
            "@_fa": "true",
            "$": "https://api.elsevier.com/content/object/eid/1-s2.0-S0926860X24001704-fx8.sml?httpAccept=%2A%2F%2A",
            "@multimediatype": "GIF image file",
            "@type": "IMAGE-THUMBNAIL",
            "@size": "3428",
            "@ref": "fx8",
            "@mimetype": "image/gif"
          },
          {
            "@category": "thumbnail",
            "@height": "164",
            "@width": "211",
            "@_fa": "true",
            "$": "https://api.elsevier.com/content/object/eid/1-s2.0-S0926860X24001704-gr1.sml?httpAccept=%2A%2F%2A",
            "@multimediatype": "GIF image file",
            "@type": "IMAGE-THUMBNAIL",
            "@size": "10794",
            "@ref": "gr1",
            "@mimetype": "image/gif"
          },
          {
            "@category": "thumbnail",
            "@height": "61",
            "@width": "219",
            "@_fa": "true",
            "$": "https://api.elsevier.com/content/object/eid/1-s2.0-S0926860X24001704-fx7.sml?httpAccept=%2A%2F%2A",
            "@multimediatype": "GIF image file",
            "@type": "IMAGE-THUMBNAIL",
            "@size": "3423",
            "@ref": "fx7",
            "@mimetype": "image/gif"
          },
          {
            "@category": "thumbnail",
            "@height": "72",
            "@width": "219",
            "@_fa": "true",
            "$": "https://api.elsevier.com/content/object/eid/1-s2.0-S0926860X24001704-fx6.sml?httpAccept=%2A%2F%2A",
            "@multimediatype": "GIF image file",
            "@type": "IMAGE-THUMBNAIL",
            "@size": "3563",
            "@ref": "fx6",
            "@mimetype": "image/gif"
          },
          {
            "@category": "thumbnail",
            "@height": "72",
            "@width": "219",
            "@_fa": "true",
            "$": "https://api.elsevier.com/content/object/eid/1-s2.0-S0926860X24001704-fx5.sml?httpAccept=%2A%2F%2A",
            "@multimediatype": "GIF image file",
            "@type": "IMAGE-THUMBNAIL",
            "@size": "3643",
            "@ref": "fx5",
            "@mimetype": "image/gif"
          },
          {
            "@category": "thumbnail",
            "@height": "66",
            "@width": "219",
            "@_fa": "true",
            "$": "https://api.elsevier.com/content/object/eid/1-s2.0-S0926860X24001704-fx4.sml?httpAccept=%2A%2F%2A",
            "@multimediatype": "GIF image file",
            "@type": "IMAGE-THUMBNAIL",
            "@size": "3552",
            "@ref": "fx4",
            "@mimetype": "image/gif"
          },
          {
            "@category": "thumbnail",
            "@height": "66",
            "@width": "219",
            "@_fa": "true",
            "$": "https://api.elsevier.com/content/object/eid/1-s2.0-S0926860X24001704-fx3.sml?httpAccept=%2A%2F%2A",
            "@multimediatype": "GIF image file",
            "@type": "IMAGE-THUMBNAIL",
            "@size": "3537",
            "@ref": "fx3",
            "@mimetype": "image/gif"
          },
          {
            "@category": "thumbnail",
            "@height": "67",
            "@width": "219",
            "@_fa": "true",
            "$": "https://api.elsevier.com/content/object/eid/1-s2.0-S0926860X24001704-fx2.sml?httpAccept=%2A%2F%2A",
            "@multimediatype": "GIF image file",
            "@type": "IMAGE-THUMBNAIL",
            "@size": "3531",
            "@ref": "fx2",
            "@mimetype": "image/gif"
          },
          {
            "@category": "high",
            "@height": "1105",
            "@width": "1497",
            "@_fa": "true",
            "$": "https://api.elsevier.com/content/object/eid/1-s2.0-S0926860X24001704-gr9_lrg.jpg?httpAccept=%2A%2F%2A",
            "@multimediatype": "JPEG image file",
            "@type": "IMAGE-HIGH-RES",
            "@size": "114217",
            "@ref": "gr9",
            "@mimetype": "image/jpeg"
          },
          {
            "@category": "high",
            "@height": "1018",
            "@width": "2994",
            "@_fa": "true",
            "$": "https://api.elsevier.com/content/object/eid/1-s2.0-S0926860X24001704-gr8_lrg.jpg?httpAccept=%2A%2F%2A",
            "@multimediatype": "JPEG image file",
            "@type": "IMAGE-HIGH-RES",
            "@size": "177365",
            "@ref": "gr8",
            "@mimetype": "image/jpeg"
          },
          {
            "@category": "high",
            "@height": "1107",
            "@width": "2994",
            "@_fa": "true",
            "$": "https://api.elsevier.com/content/object/eid/1-s2.0-S0926860X24001704-gr7_lrg.jpg?httpAccept=%2A%2F%2A",
            "@multimediatype": "JPEG image file",
            "@type": "IMAGE-HIGH-RES",
            "@size": "144508",
            "@ref": "gr7",
            "@mimetype": "image/jpeg"
          },
          {
            "@category": "high",
            "@height": "1177",
            "@width": "2994",
            "@_fa": "true",
            "$": "https://api.elsevier.com/content/object/eid/1-s2.0-S0926860X24001704-gr6_lrg.jpg?httpAccept=%2A%2F%2A",
            "@multimediatype": "JPEG image file",
            "@type": "IMAGE-HIGH-RES",
            "@size": "224415",
            "@ref": "gr6",
            "@mimetype": "image/jpeg"
          },
          {
            "@category": "high",
            "@height": "1042",
            "@width": "1330",
            "@_fa": "true",
            "$": "https://api.elsevier.com/content/object/eid/1-s2.0-S0926860X24001704-gr5_lrg.jpg?httpAccept=%2A%2F%2A",
            "@multimediatype": "JPEG image file",
            "@type": "IMAGE-HIGH-RES",
            "@size": "90265",
            "@ref": "gr5",
            "@mimetype": "image/jpeg"
          },
          {
            "@category": "high",
            "@height": "2483",
            "@width": "2994",
            "@_fa": "true",
            "$": "https://api.elsevier.com/content/object/eid/1-s2.0-S0926860X24001704-gr4_lrg.jpg?httpAccept=%2A%2F%2A",
            "@multimediatype": "JPEG image file",
            "@type": "IMAGE-HIGH-RES",
            "@size": "627532",
            "@ref": "gr4",
            "@mimetype": "image/jpeg"
          },
          {
            "@category": "high",
            "@height": "2405",
            "@width": "2994",
            "@_fa": "true",
            "$": "https://api.elsevier.com/content/object/eid/1-s2.0-S0926860X24001704-gr3_lrg.jpg?httpAccept=%2A%2F%2A",
            "@multimediatype": "JPEG image file",
            "@type": "IMAGE-HIGH-RES",
            "@size": "290515",
            "@ref": "gr3",
            "@mimetype": "image/jpeg"
          },
          {
            "@category": "high",
            "@height": "124",
            "@width": "456",
            "@_fa": "true",
            "$": "https://api.elsevier.com/content/object/eid/1-s2.0-S0926860X24001704-fx12_lrg.jpg?httpAccept=%2A%2F%2A",
            "@multimediatype": "JPEG image file",
            "@type": "IMAGE-HIGH-RES",
            "@size": "7294",
            "@ref": "fx12",
            "@mimetype": "image/jpeg"
          },
          {
            "@category": "high",
            "@height": "886",
            "@width": "1320",
            "@_fa": "true",
            "$": "https://api.elsevier.com/content/object/eid/1-s2.0-S0926860X24001704-ga1_lrg.jpg?httpAccept=%2A%2F%2A",
            "@multimediatype": "JPEG image file",
            "@type": "IMAGE-HIGH-RES",
            "@size": "122988",
            "@ref": "ga1",
            "@mimetype": "image/jpeg"
          },
          {
            "@category": "high",
            "@height": "141",
            "@width": "457",
            "@_fa": "true",
            "$": "https://api.elsevier.com/content/object/eid/1-s2.0-S0926860X24001704-fx11_lrg.jpg?httpAccept=%2A%2F%2A",
            "@multimediatype": "JPEG image file",
            "@type": "IMAGE-HIGH-RES",
            "@size": "7613",
            "@ref": "fx11",
            "@mimetype": "image/jpeg"
          },
          {
            "@category": "high",
            "@height": "147",
            "@width": "456",
            "@_fa": "true",
            "$": "https://api.elsevier.com/content/object/eid/1-s2.0-S0926860X24001704-fx10_lrg.jpg?httpAccept=%2A%2F%2A",
            "@multimediatype": "JPEG image file",
            "@type": "IMAGE-HIGH-RES",
            "@size": "7928",
            "@ref": "fx10",
            "@mimetype": "image/jpeg"
          },
          {
            "@category": "high",
            "@height": "141",
            "@width": "459",
            "@_fa": "true",
            "$": "https://api.elsevier.com/content/object/eid/1-s2.0-S0926860X24001704-fx1_lrg.jpg?httpAccept=%2A%2F%2A",
            "@multimediatype": "JPEG image file",
            "@type": "IMAGE-HIGH-RES",
            "@size": "7791",
            "@ref": "fx1",
            "@mimetype": "image/jpeg"
          },
          {
            "@category": "high",
            "@height": "147",
            "@width": "456",
            "@_fa": "true",
            "$": "https://api.elsevier.com/content/object/eid/1-s2.0-S0926860X24001704-fx9_lrg.jpg?httpAccept=%2A%2F%2A",
            "@multimediatype": "JPEG image file",
            "@type": "IMAGE-HIGH-RES",
            "@size": "8008",
            "@ref": "fx9",
            "@mimetype": "image/jpeg"
          },
          {
            "@category": "high",
            "@height": "2373",
            "@width": "2994",
            "@_fa": "true",
            "$": "https://api.elsevier.com/content/object/eid/1-s2.0-S0926860X24001704-gr2_lrg.jpg?httpAccept=%2A%2F%2A",
            "@multimediatype": "JPEG image file",
            "@type": "IMAGE-HIGH-RES",
            "@size": "348222",
            "@ref": "gr2",
            "@mimetype": "image/jpeg"
          },
          {
            "@category": "high",
            "@height": "137",
            "@width": "490",
            "@_fa": "true",
            "$": "https://api.elsevier.com/content/object/eid/1-s2.0-S0926860X24001704-fx8_lrg.jpg?httpAccept=%2A%2F%2A",
            "@multimediatype": "JPEG image file",
            "@type": "IMAGE-HIGH-RES",
            "@size": "8328",
            "@ref": "fx8",
            "@mimetype": "image/jpeg"
          },
          {
            "@category": "high",
            "@height": "1357",
            "@width": "1746",
            "@_fa": "true",
            "$": "https://api.elsevier.com/content/object/eid/1-s2.0-S0926860X24001704-gr1_lrg.jpg?httpAccept=%2A%2F%2A",
            "@multimediatype": "JPEG image file",
            "@type": "IMAGE-HIGH-RES",
            "@size": "171798",
            "@ref": "gr1",
            "@mimetype": "image/jpeg"
          },
          {
            "@category": "high",
            "@height": "137",
            "@width": "490",
            "@_fa": "true",
            "$": "https://api.elsevier.com/content/object/eid/1-s2.0-S0926860X24001704-fx7_lrg.jpg?httpAccept=%2A%2F%2A",
            "@multimediatype": "JPEG image file",
            "@type": "IMAGE-HIGH-RES",
            "@size": "8319",
            "@ref": "fx7",
            "@mimetype": "image/jpeg"
          },
          {
            "@category": "high",
            "@height": "156",
            "@width": "477",
            "@_fa": "true",
            "$": "https://api.elsevier.com/content/object/eid/1-s2.0-S0926860X24001704-fx6_lrg.jpg?httpAccept=%2A%2F%2A",
            "@multimediatype": "JPEG image file",
            "@type": "IMAGE-HIGH-RES",
            "@size": "8570",
            "@ref": "fx6",
            "@mimetype": "image/jpeg"
          },
          {
            "@category": "high",
            "@height": "157",
            "@width": "480",
            "@_fa": "true",
            "$": "https://api.elsevier.com/content/object/eid/1-s2.0-S0926860X24001704-fx5_lrg.jpg?httpAccept=%2A%2F%2A",
            "@multimediatype": "JPEG image file",
            "@type": "IMAGE-HIGH-RES",
            "@size": "8833",
            "@ref": "fx5",
            "@mimetype": "image/jpeg"
          },
          {
            "@category": "high",
            "@height": "137",
            "@width": "454",
            "@_fa": "true",
            "$": "https://api.elsevier.com/content/object/eid/1-s2.0-S0926860X24001704-fx4_lrg.jpg?httpAccept=%2A%2F%2A",
            "@multimediatype": "JPEG image file",
            "@type": "IMAGE-HIGH-RES",
            "@size": "7469",
            "@ref": "fx4",
            "@mimetype": "image/jpeg"
          },
          {
            "@category": "high",
            "@height": "137",
            "@width": "454",
            "@_fa": "true",
            "$": "https://api.elsevier.com/content/object/eid/1-s2.0-S0926860X24001704-fx3_lrg.jpg?httpAccept=%2A%2F%2A",
            "@multimediatype": "JPEG image file",
            "@type": "IMAGE-HIGH-RES",
            "@size": "7545",
            "@ref": "fx3",
            "@mimetype": "image/jpeg"
          },
          {
            "@category": "high",
            "@height": "140",
            "@width": "457",
            "@_fa": "true",
            "$": "https://api.elsevier.com/content/object/eid/1-s2.0-S0926860X24001704-fx2_lrg.jpg?httpAccept=%2A%2F%2A",
            "@multimediatype": "JPEG image file",
            "@type": "IMAGE-HIGH-RES",
            "@size": "7631",
            "@ref": "fx2",
            "@mimetype": "image/jpeg"
          },
          {
            "@category": "standard",
            "@_fa": "true",
            "$": "https://api.elsevier.com/content/object/eid/1-s2.0-S0926860X24001704-mmc1.docx?httpAccept=%2A%2F%2A",
            "@multimediatype": "Microsoft Word file",
            "@type": "APPLICATION",
            "@size": "1468247",
            "@ref": "mmc1",
            "@mimetype": "application/word"
          },
          {
            "@category": "standard",
            "@_fa": "true",
            "$": "https://api.elsevier.com/content/object/eid/1-s2.0-S0926860X24001704-am.pdf?httpAccept=%2A%2F%2A",
            "@multimediatype": "Acrobat PDF file",
            "@type": "AAM-PDF",
            "@size": "1461019",
            "@ref": "am",
            "@mimetype": "application/pdf"
          }
        ]
      },
      "link": {
        "@rel": "abstract",
        "@href": "https://api.elsevier.com/content/abstract/scopus_id/85189633580"
      }
    }
  }
}