{
  "metadata": {
    "title": "Constructing magnetic single-atom catalysts with high activity and stability via an in situ nitrogen doping modulation strategy for the hydroformylation of 1-dodecene",
    "authors": "; ; ",
    "journal": "Applied Catalysis A: General",
    "date": "2025-06-05",
    "doi": "10.1016/j.apcata.2025.120264",
    "abstract": "",
    "uri": "https://api.elsevier.com/content/article/pii/S0926860X25001656",
    "pii": "S0926860X25001656"
  },
  "fulltext": {
    "full-text-retrieval-response": {
      "scopus-eid": "2-s2.0-105002043921",
      "originalText": "serial JL 271346 291210 291744 291809 31 Applied Catalysis A: General APPLIEDCATALYSISAGENERAL 2025-04-04 2025-04-04 2025-04-13 2025-04-13 2025-04-22T04:52:45 1-s2.0-S0926860X25001656 S0926-860X(25)00165-6 S0926860X25001656 10.1016/j.apcata.2025.120264 S300 S300.1 FULL-TEXT 1-s2.0-S0926860X25X00077 2025-04-22T03:58:04.967943Z 0 0 20250605 2025 2025-04-04T16:09:50.452065Z absattachment articleinfo articlenumber articletitlenorm authfirstinitialnorm authfirstsurnamenorm cid cids contenttype copyright crossmark dateloaded dateloadedtxt datesearch datesort dateupdated dco docsubtype doctype doi eid ewtransactionid hubeid indexeddate issn issnnorm itemstage itemtransactionid itemweight openaccess openarchive pg pgfirst pii piinorm pubdatestart pubdatetxt pubyr sortorder srctitle srctitlenorm srctype ssids alllist content subj subheadings suppl tomb volfirst volissue volumelist webpdf webpdfpagecount yearnav figure table e-component body mmlmath acknowledge affil appendices articletitle auth authfirstini authfull authkeywords authlast grantnumber grantsponsor grantsponsorid highlightsabst orcid primabst ref specialabst 0926-860X 0926860X true 699 699 C Volume 699 12 120264 120264 120264 20250605 5 June 2025 2025-06-05 2025 article fla © 2025 Elsevier B.V. All rights are reserved, including those for text and data mining, AI training, and similar technologies. CONSTRUCTINGMAGNETICSINGLEATOMCATALYSTSHIGHACTIVITYSTABILITYVIAINSITUNITROGENDOPINGMODULATIONSTRATEGYFORHYDROFORMYLATION1DODECENE CHENG L 1 Introduction 2 Experimental section 2.1 Chemicals and materials 2.2 Synthetic methods 2.3 Characterisation techniques 2.4 Catalytic tests 2.5 DFT calculation 3 Discussion 3.1 Structural characterisation 3.2 Catalytic performance 3.2.1 Evaluation of reaction kinetics 3.2.2 Magnetic separation and recycling 3.3 Mechanism research 3.3.1 Interaction between FCN catalyst and reactants 3.3.2 DFT calculation 4 Conclusion CRediT authorship contribution statement Acknowledgements Appendix A Supplementary material References LIU 2022 2630 2658 B BATES 2013 187 223 R HYDROFORMYLATIONFORORGANICSYNTHESIS HYDROFORMYLATIONINNATURALPRODUCTSYNTHESIS FRANKE 2012 5675 5732 R REN 2017 310 313 X GONSALVI 2013 1 47 L HYDROFORMYLATIONFORORGANICSYNTHESIS ROLEMETALSLIGANDSINORGANICHYDROFORMYLATION GORBUNOV 2024 119538 D SCHLOGL 2015 3465 3520 R DESCORME 2012 1897 1906 C VANVU 2013 410 417 T LIU 2018 4981 5079 L YAO 2024 e18425 C TAO 2023 106183 S LIU 2017 34 59 J LANG 2020 11986 12043 R WANG 2018 65 81 A LIANG 2022 18155 18174 X LIU 2018 477 505 J HU 2021 1360 1365 S ZHAO 2015 3528 3539 K LI 2019 14515 14519 J GAO 2023 2209654 Y TANG 2020 9256 9261 C MU 2023 2305823 J LUO 2020 163 X HAI 2022 174 181 X HU 2022 2107721 B GOLUB 2025 120035 F ZHAO 2021 1250 1270 M FU 2020 J RO 2019 10899 10912 I FARPON 2023 e202214048 M ZHANG 2024 3706 3711 Y ROSSI 2014 2906 L GARCIA 2015 1566 1572 M WANG 2014 6949 6985 D ZHU 2010 365 374 Y ZHAO 2022 2110455 L HAN 2013 313 321 J DELLEY 2000 7756 7764 B PERDEW 1996 3865 3868 J PERDEW 1996 16533 16539 J DELLEY 2002 155125 B SHANG 2023 1526 1539 W DELLEY 1990 508 517 B CHADI 1977 1746 1747 D HALGREN 1977 225 232 T PIELESZ 2001 2637 2646 A KACZMARCZYK 2013 179 184 B WANG 2016 14036 L ZHAO 2023 7174 M FEDOROVA 2023 2862 2874 E XIAO 2019 17763 17770 M PENG 2024 e506 J CHEN 2017 1605785 Z LI 2023 122677 R ARRIGO 2010 9616 9630 R MA 2022 M HUANG 2020 18771 18780 N WEI 2021 15113 15121 B ZHENG 2024 115394 Y GAO 2021 4698 P ZHAO 2021 321 330 K AMSLER 2020 5087 5096 J WEI 2022 101016 B CHEN 2021 20907 20915 M LIU 2017 34 59 J ALBRAHIM 2023 e202308002 M GRIMME 2004 1463 1473 S MALTA 2017 1399 1403 G WEI 2022 2066 2076 B BEDEKOVITS 2010 2029 2045 A WANG 2020 5715 5722 G CHENGX2025X120264 CHENGX2025X120264XL 2027-04-13T00:00:00.000Z 2027-04-13T00:00:00.000Z http://creativecommons.org/licenses/by-nc-nd/4.0/ © 2025 Elsevier B.V. All rights are reserved, including those for text and data mining, AI training, and similar technologies. 2025-04-11T02:56:21.514Z http://vtw.elsevier.com/data/voc/AddOnTypes/50.7/aggregated-refined National Natural Science Foundation of China 2021YFA1500010 224030 NSFC National Natural Science Foundation of China http://data.elsevier.com/vocabulary/SciValFunders/501100001809 http://sws.geonames.org/1814991/ This work was supported by the National Natural Science Foundation of China (2021YFA1500010) and Sinopec program (224030). The authors would like to thank Shiyanjialab (www.shiyanjia.com) for the language editing service. https://doi.org/10.15223/policy-017 https://doi.org/10.15223/policy-037 https://doi.org/10.15223/policy-012 https://doi.org/10.15223/policy-029 https://doi.org/10.15223/policy-004 item S0926-860X(25)00165-6 S0926860X25001656 1-s2.0-S0926860X25001656 10.1016/j.apcata.2025.120264 271346 2025-04-22T03:58:04.967943Z 2025-06-05 1-s2.0-S0926860X25001656-main.pdf https://s3-eu-west-1.amazonaws.com/prod-ucs-content-store-eu-west/content/pii:S0926860X25001656/MAIN/application/pdf/8d89f2eb1cee41b2e52b9955a418a06d/main.pdf main.pdf pdf true 5661483 MAIN 11 1-s2.0-S0926860X25001656-main_1.png https://s3-eu-west-1.amazonaws.com/prod-ucs-content-store-eu-west/content/pii:S0926860X25001656/PREVIEW/image/png/9911392fff233e754998a804f8f9a722/main_1.png main_1.png png 57415 849 656 IMAGE-WEB-PDF 1 1-s2.0-S0926860X25001656-gr1.jpg https://s3-eu-west-1.amazonaws.com/prod-ucs-content-store-eu-west/content/pii:S0926860X25001656/gr1/DOWNSAMPLED/image/jpeg/46ad1cdaf1a8086c8e7c152b12897e10/gr1.jpg gr1 gr1.jpg jpg 92550 518 565 IMAGE-DOWNSAMPLED 1-s2.0-S0926860X25001656-gr2.jpg https://s3-eu-west-1.amazonaws.com/prod-ucs-content-store-eu-west/content/pii:S0926860X25001656/gr2/DOWNSAMPLED/image/jpeg/4037d7437f91a583c91c29eef7cb505b/gr2.jpg gr2 gr2.jpg jpg 97227 528 796 IMAGE-DOWNSAMPLED 1-s2.0-S0926860X25001656-ga1.jpg https://s3-eu-west-1.amazonaws.com/prod-ucs-content-store-eu-west/content/pii:S0926860X25001656/ga1/DOWNSAMPLED/image/jpeg/fd6557edd9cd7a115054cf5ca0868d2c/ga1.jpg ga1 true ga1.jpg jpg 24569 200 349 IMAGE-DOWNSAMPLED 1-s2.0-S0926860X25001656-gr3.jpg https://s3-eu-west-1.amazonaws.com/prod-ucs-content-store-eu-west/content/pii:S0926860X25001656/gr3/DOWNSAMPLED/image/jpeg/fe5a7201037ae1406bbc5accb7c7600b/gr3.jpg gr3 gr3.jpg jpg 96638 644 796 IMAGE-DOWNSAMPLED 1-s2.0-S0926860X25001656-gr4.jpg https://s3-eu-west-1.amazonaws.com/prod-ucs-content-store-eu-west/content/pii:S0926860X25001656/gr4/DOWNSAMPLED/image/jpeg/6adb282dd4c77350669b8f3fbafadf88/gr4.jpg gr4 gr4.jpg jpg 52644 331 791 IMAGE-DOWNSAMPLED 1-s2.0-S0926860X25001656-gr5.jpg https://s3-eu-west-1.amazonaws.com/prod-ucs-content-store-eu-west/content/pii:S0926860X25001656/gr5/DOWNSAMPLED/image/jpeg/70bc43e1622efcae592b22a362510b91/gr5.jpg gr5 gr5.jpg jpg 49616 208 796 IMAGE-DOWNSAMPLED 1-s2.0-S0926860X25001656-gr6.jpg https://s3-eu-west-1.amazonaws.com/prod-ucs-content-store-eu-west/content/pii:S0926860X25001656/gr6/DOWNSAMPLED/image/jpeg/07590c92b0f84c71adfcec868137c417/gr6.jpg gr6 gr6.jpg jpg 134446 969 678 IMAGE-DOWNSAMPLED 1-s2.0-S0926860X25001656-gr1.sml https://s3-eu-west-1.amazonaws.com/prod-ucs-content-store-eu-west/content/pii:S0926860X25001656/gr1/THUMBNAIL/image/gif/55739d0881e98ebb3a4f8e7f459047b7/gr1.sml gr1 gr1.sml sml 16653 164 179 IMAGE-THUMBNAIL 1-s2.0-S0926860X25001656-gr2.sml https://s3-eu-west-1.amazonaws.com/prod-ucs-content-store-eu-west/content/pii:S0926860X25001656/gr2/THUMBNAIL/image/gif/dd0c59c4b52a942c46c3eb2da5665a01/gr2.sml gr2 gr2.sml sml 12639 145 219 IMAGE-THUMBNAIL 1-s2.0-S0926860X25001656-ga1.sml https://s3-eu-west-1.amazonaws.com/prod-ucs-content-store-eu-west/content/pii:S0926860X25001656/ga1/THUMBNAIL/image/gif/2c2b7e8c8544e8e2fbd4f55d2483d8b7/ga1.sml ga1 true ga1.sml sml 13515 126 219 IMAGE-THUMBNAIL 1-s2.0-S0926860X25001656-gr3.sml https://s3-eu-west-1.amazonaws.com/prod-ucs-content-store-eu-west/content/pii:S0926860X25001656/gr3/THUMBNAIL/image/gif/29451a561ca93f7a740d2799013bfc68/gr3.sml gr3 gr3.sml sml 10931 163 202 IMAGE-THUMBNAIL 1-s2.0-S0926860X25001656-gr4.sml https://s3-eu-west-1.amazonaws.com/prod-ucs-content-store-eu-west/content/pii:S0926860X25001656/gr4/THUMBNAIL/image/gif/e1c98e2b6ae8a9043e3102f71a65058f/gr4.sml gr4 gr4.sml sml 9028 92 219 IMAGE-THUMBNAIL 1-s2.0-S0926860X25001656-gr5.sml https://s3-eu-west-1.amazonaws.com/prod-ucs-content-store-eu-west/content/pii:S0926860X25001656/gr5/THUMBNAIL/image/gif/bcbb29d7eb9dd20dbbde8ed379c6e79c/gr5.sml gr5 gr5.sml sml 5275 57 219 IMAGE-THUMBNAIL 1-s2.0-S0926860X25001656-gr6.sml https://s3-eu-west-1.amazonaws.com/prod-ucs-content-store-eu-west/content/pii:S0926860X25001851/gr6/THUMBNAIL/image/gif/9667315d938d5995c6225e9290075283/gr6.sml gr6 gr6.sml sml 6622 163 114 IMAGE-THUMBNAIL 1-s2.0-S0926860X25001656-gr1_lrg.jpg https://s3-eu-west-1.amazonaws.com/prod-ucs-content-store-eu-west/content/pii:S0926860X25001656/HIGHRES/image/jpeg/726050f6a80765b84d973318c3996839/gr1_lrg.jpg gr1 gr1_lrg.jpg jpg 749904 2286 2495 IMAGE-HIGH-RES 1-s2.0-S0926860X25001656-gr2_lrg.jpg https://s3-eu-west-1.amazonaws.com/prod-ucs-content-store-eu-west/content/pii:S0926860X25001656/HIGHRES/image/jpeg/e1cc48793703ccae60e1587e447c6000/gr2_lrg.jpg gr2 gr2_lrg.jpg jpg 535786 2336 3525 IMAGE-HIGH-RES 1-s2.0-S0926860X25001656-ga1_lrg.jpg https://s3-eu-west-1.amazonaws.com/prod-ucs-content-store-eu-west/content/pii:S0926860X25001656/HIGHRES/image/jpeg/8bba34b4bdcde2f0264170d6d07267bb/ga1_lrg.jpg ga1 true ga1_lrg.jpg jpg 209088 886 1545 IMAGE-HIGH-RES 1-s2.0-S0926860X25001656-gr3_lrg.jpg https://s3-eu-west-1.amazonaws.com/prod-ucs-content-store-eu-west/content/pii:S0926860X25001851/HIGHRES/image/jpeg/b158c9aac1825db7c6a5348dd0049d69/gr3_lrg.jpg gr3 gr3_lrg.jpg jpg 501564 2853 3525 IMAGE-HIGH-RES 1-s2.0-S0926860X25001656-gr4_lrg.jpg https://s3-eu-west-1.amazonaws.com/prod-ucs-content-store-eu-west/content/pii:S0926860X25001851/HIGHRES/image/jpeg/cf6a125689bf4f2ac1a93342ebcd6ec4/gr4_lrg.jpg gr4 gr4_lrg.jpg jpg 282678 1463 3493 IMAGE-HIGH-RES 1-s2.0-S0926860X25001656-gr5_lrg.jpg https://s3-eu-west-1.amazonaws.com/prod-ucs-content-store-eu-west/content/pii:S0926860X25001851/HIGHRES/image/jpeg/e2c6d57485ce3ab10644497cf1888a88/gr5_lrg.jpg gr5 gr5_lrg.jpg jpg 274664 920 3525 IMAGE-HIGH-RES 1-s2.0-S0926860X25001656-gr6_lrg.jpg https://s3-eu-west-1.amazonaws.com/prod-ucs-content-store-eu-west/content/pii:S0926860X25001851/HIGHRES/image/jpeg/937ba40f38f508a5bcb67aa393fd5cc2/gr6_lrg.jpg gr6 gr6_lrg.jpg jpg 761560 4280 2994 IMAGE-HIGH-RES 1-s2.0-S0926860X25001656-mmc1.docx https://s3-eu-west-1.amazonaws.com/prod-ucs-content-store-eu-west/content/pii:S0926860X25001656/mmc1/MAIN/application/vnd.openxmlformats-officedocument.wordprocessingml.document/28e41f4a638d87eefe91cd3b7e162b5f/mmc1.docx mmc1 mmc1.docx docx 2586115 APPLICATION 1-s2.0-S0926860X25001656-si0001.svg https://s3-eu-west-1.amazonaws.com/prod-ucs-content-store-eu-west/content/pii:S0926860X25001656/image/svg+xml/17ed55c4a575e527ceca35322999c78b/si0001.svg si0001 si0001.svg svg 3403 ALTIMG 1-s2.0-S0926860X25001656-si0002.svg https://s3-eu-west-1.amazonaws.com/prod-ucs-content-store-eu-west/content/pii:S0926860X25001656/image/svg+xml/e556118ae5e2b52c66e3ffea8bb3bac8/si0002.svg si0002 si0002.svg svg 1815 ALTIMG 1-s2.0-S0926860X25001656-si0003.svg https://s3-eu-west-1.amazonaws.com/prod-ucs-content-store-eu-west/content/pii:S0926860X25001656/image/svg+xml/f342d2d5d323f54efdbd0842f460eb22/si0003.svg si0003 si0003.svg svg 1243 ALTIMG 1-s2.0-S0926860X25001656-si0004.svg https://s3-eu-west-1.amazonaws.com/prod-ucs-content-store-eu-west/content/pii:S0926860X25001656/image/svg+xml/f09d38f0f7f3379ff526911521c7630d/si0004.svg si0004 si0004.svg svg 1665 ALTIMG 1-s2.0-S0926860X25001656-si0005.svg https://s3-eu-west-1.amazonaws.com/prod-ucs-content-store-eu-west/content/pii:S0926860X25001656/image/svg+xml/c5a9bf7574f627bb3ad7b3092a0b859d/si0005.svg si0005 si0005.svg svg 2293 ALTIMG 1-s2.0-S0926860X25001656-si0006.svg https://s3-eu-west-1.amazonaws.com/prod-ucs-content-store-eu-west/content/pii:S0926860X25001656/image/svg+xml/077b75ce62ccb161dade584231fb4fd7/si0006.svg si0006 si0006.svg svg 1235 ALTIMG 1-s2.0-S0926860X25001656-si0007.svg https://s3-eu-west-1.amazonaws.com/prod-ucs-content-store-eu-west/content/pii:S0926860X25001656/image/svg+xml/4859c7c91827a051181661fba8453bbf/si0007.svg si0007 si0007.svg svg 1219 ALTIMG APCATA 120264 120264 S0926-860X(25)00165-6 10.1016/j.apcata.2025.120264 Elsevier B.V. Fig. 1 (a) TEM image of RhCo/FCN-500 (FCN-500), (b-c) HAADF-STEM images of the FCN-500 sample, where Rh/Co single atoms, marked with yellow circles, are uniformly distributed on Fe3O4. (d-g) EDS elemental mapping of FCN-500 for different elements: (d) N, (e) Rh, (f) Co, (g) Fe. Fig. 1 Fig. 2 Characterization of the FCN catalyst structure. (a) FTIR spectra and (b) XRD patterns of RhCo/FCN-500 (FCN-500), RhCo/FCN-650 (FCN-650), RhCo/FCN-800 (FCN-800). XPS spectra of (c) Rh 3d for FCN-500, (d) Rh 3d for Rh/FCN-500 and (e) N 1 s for FCNs. Fig. 2 Fig. 3 Catalytic performance in the hydroformylation of 1-dodecene. (a-b) Catalytic performance of catalysts modified with active metals such as RhCo, Rh and Co under different conditions. (c) 1-dodecene conversion and TOFs of the Fe3O4-based catalysts. (d-e) Product yields of FCN-500 under various reaction conditions: reaction pressures ranging from 2 to 10 MPa and reaction temperatures ranging from 50 to 130 °C. Hydroformylation of catalysts FCN-500, FCN-650 and FCN-800 with different reaction times: (f) conversion of 1-dodecene and (g) selectivity towards tridecanal (n/iso = 0.93) (conducted at 90 °C, 8 MPa). All reactions were performed with 8 mL of 1-dodecene, 50 mg of catalyst, 4 mL of toluene as an internal standard, and a H2/CO ratio of 1:1. Fig. 3 Fig. 4 (a) Magnetic catalyst before and after the magnetic separation process. (b) Evaluation of catalyst FCN-500 performance over 10 successive reaction cycles. Fig. 4 Fig. 5 (a) DRIFT spectra of CO adsorption at 40 °C. The spectra were collected on the Rh/FCN, RhCo/FCN-500 (FCN-500) and RhCo/FCN-800 (FCN-800) catalysts after CO adsorption for 40 min, followed by N2 purging for 30 min. Time-dependent IR spectra of reactants (CO, H2, and 1-dodecene) adsorbed on the FCN catalyst during the reaction process: (b) FCN-500, (c) FCN-800, with data recorded at 10-min intervals. Fig. 5 Fig. 6 DFT calculations of FCNs in 1-dodecene hydroformylation. (a) Adsorption energies of (I) CO, (II) H2, and (III) 1-dodecene. (b) Charge density distribution mapping for different RhCo-N models. (c) Reaction mechanism diagram. (d) Free-energy diagrams of the reaction pathways for RhCo-pyridicN and RhCo-graphiteN models. Fig. 6 Table 1 Summary of the application of SACs for hydroformylation of olefins. Table 1 catalyst substrate TOF(h−1) selectivity(%) ref. 0.24 %Rh-Co P/ZnO styrene 1457 80 [59] 0.10 %Rh/SnO2 ethylene 225 > 95 [31] 0.06 %Rh/Xantphos(P)3-CeO2 1-octene 407 31 [60] 0.50 %Rh/PNP-ND 1-octene 103 90 [61] 0.81 %Rh1/Y 1-hexene 106 100 [43] Rh@POP-PTBA-HA−50 1-octene 801 96.3 [62] Rh/CeO2 styrene 130 97.0 [63] Co1/β-Mo2C propene 749 95 [64] RhCo/FCN−500 1-dodecene 1250 98.6 this work Constructing magnetic single-atom catalysts with high activity and stability via an in situ nitrogen doping modulation strategy for the hydroformylation of 1-dodecene Lu Cheng Writing – review & editing Writing – original draft Visualization Validation Supervision Software Resources Project administration Methodology Investigation Funding acquisition Formal analysis Data curation Conceptualization ⁎ Xingtao Ren Investigation Funding acquisition Formal analysis Data curation Conceptualization ⁎ Shiyao Lu Methodology Investigation Formal analysis Data curation Writing – review & editing Writing – original draft Visualization Validation Supervision Software Resources Project administration Methodology Investigation Funding acquisition Formal analysis Data curation Conceptualization Dameng Gao Project administration Conceptualization Jing Yue Supervision Resources Methodology Investigation Data curation National Engineering Research Center for Synthesis of Novel Rubber and Plastic Materials, Yanshan Branch of Beijing Research Institute of Chemical Industry, SINOPEC, Beijing 102500, China National Engineering Research Center for Synthesis of Novel Rubber and Plastic Materials, Yanshan Branch of Beijing Research Institute of Chemical Industry, SINOPEC Beijing 102500 China National Engineering Research Center for Synthesis of Novel Rubber and Plastic Materials, Yanshan Branch of Beijing Research Institute of Chemical Industry, SINOPEC, Beijing 102500, China ⁎ Corresponding authors. Regulating the hydroformylation capacity of heterogeneous catalysts is essential for efficiently converting higher olefins into aldehydes. In this study, a magnetic single-atom rhodium-cobalt-based catalyst (RhCo SACs) was synthesised by modifying Fe3O4 with polymerised carbon nitride. Maintaining a constant metal single-atom loading, the catalytic activity in 1-dodecene hydroformylation was modulated by adjusting the type of N species in the support. The distribution of single atoms and valence states was characterised. At the same time, density functional theory (DFT) calculations were conducted to evaluate substrate binding energies and reaction-free energy barriers, providing insights into reaction mechanisms and pathways. The RhCo-pyridinic N configuration lowered the Gibbs free energy of the rate-determining and hydrogenation steps, enhancing substrate reaction activity. Compared to RhCo-graphitic N, RhCo-pyridinic N demonstrated superior performance, achieving a 1-dodecene conversion rate of 98.3 % and aldehyde selectivity of 98.6 %. Furthermore, the catalyst was magnetically recovered without loss of activity or mass and maintained stable performance over 10 reuse cycles. These findings present a novel and efficient strategy for the precise design of magnetic single-atom catalysts with potential practical applications in the hydroformylation of high-carbon olefins. Graphical Abstract Keywords Magnetic single-atom catalyst High-carbon olefin Hydroformylation Nitrogen doping Pyridine N Circular recycling Data Availability Data will be made available on request. 1 Introduction Hydroformylation of olefins is a fundamental industrial process, producing over 10 million tons of products annually. This reaction demonstrates 100 % atom economy, with aldehyde products serving as key intermediates in the synthesis of high-value bulk fine chemicals such as alcohols, esters, and amines [1–3]. The petrochemical industry generates significant quantities of C12 or higher high-carbon olefin by-products, which are converted via hydroformylation into aldehydes or alcohols with improved economic efficiency. However, hydroformylation of these high-carbon olefins presents greater challenges due to increased steric hindrance from their extended chain structures, which affects the interaction between the substrate and the catalyst’s active site. Consequently, the structural design requirements for catalysts are more stringent. Hydroformylation reactions are conducted using homogeneous catalytic systems involving Rh or Co complexes with phosphine ligands [4–6]. Although these homogeneous catalysts offer high efficiency, their separation from the reaction medium remains a significant challenge. The complex catalyst separation, purification, and recovery processes substantially increase industrial costs. Additionally, these ligands are expensive, highly sensitive to air and moisture, susceptible to deactivation at elevated temperatures, and require meticulous handling. For high-carbon products with high boiling points, separation from the catalyst necessitates high-temperature flash evaporation, exacerbating catalyst decomposition and deactivation. Efficient catalyst recovery is, therefore, essential in the hydroformylation of high-carbon olefins. Heterogeneous hydroformylation offers a more economically viable and sustainable alternative, leading to increased interest in the development of efficient ligand-free heterogeneous catalysts [7,8]. Heterogeneous catalysts facilitate easier separation and reuse, significantly contributing to the economic and environmental sustainability of the hydroformylation process, making them a promising alternative, particularly for high-carbon olefin hydroformylation reactions [9]. Metal nanoparticles, nanoclusters, and supported metal nanoparticles have been explored as potential candidates for heterogeneous hydroformylation reactions, exhibiting reactivity toward various alkene substrates [10,11]. However, these heterogeneous catalysts face challenges primarily due to the low utilisation efficiency of metal active centres, limited catalytic activity, and reduced selectivity for oxygen-containing products, as side reactions such as hydrogenation and isomerisation of alkenes often occur. Reducing metal size to the atomic level enhances the surface atom ratio of active centres, thereby improving metal utilisation efficiency [12–14]. Single-atom catalysts (SACs) provide an effective link between heterogeneous and homogeneous catalysis, enabling highly utilised and uniformly dispersed metal species with homogeneous-like electronic states, facilitating the heterogenisation of homogeneous catalysts[15–17]. The atomic dispersion of metals and their local coordination environments play a crucial role in determining catalyst activity, selectivity, and stability. Investigating the structure-performance relationship of active centres with their supports, optimising the coordination environment on the support surface, and regulating metal-support interactions are essential for balancing catalyst stability and activity [18,19]. A rational structural design of SACs is necessary to enhance catalytic performance and support industrial applications [20–23]. For the structural design of single-atom catalysts, various metals (Pd, Ag, Pt, or Ir) are immobilised as isolated atoms onto supports such as metal oxides and activated carbon through two primary pathways: direct methods, including co-polymerisation and in-situ doping, and post-synthesis techniques like wet deposition and microwave-assisted treatments combined with chemical reduction [24–27]. The selection of the metal introduction method plays a critical role in determining the charge distribution around the metal centres embedded within the support matrix, a well-established phenomenon. Moreover, the accessibility and electronic properties of the adsorbed metal species can be regulated by modifying the morphology and porosity of the graphitic carbon nitride material [28,29]. Owing to their exceptional catalytic performance, rhodium-based single-atom catalysts (Rh-SACs) have emerged as a focal point in advanced catalyst design. Ro et al.[30] designed heteroatom Rh-ReOx by manipulating the local electronic environment of atomically dispersed Rh single sites. The targeted deposition of Rh precursors near atomically dispersed Lewis acidic ReOx on γ-Al2O3, promoted the concentration of vacant sites under reaction conditions and, in turn, catalytic activity. Prieto et al.[31] developed SACs with isolated Rh atoms stabilized on oxygen-defective SnO2. They modulate the direct coordination environment at SA sites via the exploitation of the surface chemistry of the oxide support. The catalyst exhibited excellent performance in the hydroformylation of ethylene. Zhang et al.[32] reported atomically dispersed bifunctional Rh and Co double-atom catalysts via the ball milling method. The catalyst exhibited superior synergistic catalytic performance in tandem hydroformylation/hydrogenation reactions (>95 % olefin conversion and >80 % alcohol selectivity). On this basis, single-atom catalysts utilizing magnetic carriers offer a combination of high catalytic efficiency and effective recovery capability [33,34]. Magnetic catalysis, widely recognised as an advanced technique, provides the distinct advantage of utilising magnetic fields to enable the rapid and highly efficient separation of catalysts from complex reaction systems [35,36]. This approach effectively addresses the persistent challenge of intricate separation and recovery procedures associated with conventional multiphase catalysts, significantly improving the economic feasibility and sustainability of the catalytic process. Consequently, the precise structural design and systematic optimisation of magnetic catalysts are essential to fully realising their potential [37]. Magnetic-supported single-atom catalysts with exceptional performance in high-carbon α-olefin hydroformylation are introduced. Modification of magnetic carriers with polymer carbon nitride effectively enhances the capture sites of active centres and achieves a high dispersion of single-atom metal active sites. By adjusting the type of N species to regulate metal-carrier interactions, the adsorption behaviour of CO and other substrate molecules was characterised using in situ diffuse reflectance infrared Fourier transform spectroscopy (DRIFTS) to investigate the catalytic active site interactions. The results indicate that the RhCo-pyridine N mode facilitates the adsorption of substrate molecules on the catalyst surface. Furthermore, the reaction pathway and mechanism of 1-dodecene hydroformylation were theoretically analysed through Density Functional Theory (DFT) calculations. The simulations illustrate the role of different N species in the carrier in regulating the adsorption mode of reactants and their influence on catalyst activity and selectivity. The DFT findings suggest that adjusting the type of N-doping effectively regulates the electron density distribution of the loaded metal, thereby influencing the adsorption state of reactant molecules on the catalyst surface. The RhCo-pyridine N mode lowers the activation energy barriers of both pathways in the 1-dodecene hydroformylation reaction, facilitating the reaction process. Additionally, these catalysts exhibit excellent magnetic separation capability. Magnetic separation is readily achieved by applying an external magnetic field, significantly reducing catalyst loss. Cyclic experiments demonstrate that catalyst performance remains stable after 10 consecutive cycles, confirming its durability and potential for practical applications. 2 Experimental section 2.1 Chemicals and materials Rhodium chloride trihydrate (RhCl3·3H2O), cobaltous nitrate hexahydrate (Co(NO3)2·6H2O, 98.5 %), hexadecyl trimethyl ammonium bromide (CTAB), and iron(II,III) oxide were obtained from Aladdin. o-Phenylenediamine, aniline, and hydrogen peroxide were sourced from TCI, while the CO/H2 mixture (50:50 v/v) was supplied by DALIAN SPECIAL GASES CO., LTD. All chemicals were used as received without further purification. 2.2 Synthetic methods During the standard synthesis procedure, 5 g of Fe3O4 was combined with 0.5 g of o-phenylenediamine and 0.32 g of aniline in 200 mL of CTAB aqueous solution (10 mM), followed by the addition of 2.5 mL of 30 % hydrogen peroxide. After thorough mixing, the solution was stirred at 40 °C for 2 h to modify the surface of the magnetic Fe3O4 particles. The obtained solid was subsequently dispersed in 30 mL of distilled water containing RhCl3·3 H2O (300 ppm) and Co(NO3)2·6 H2O (200 ppm) and stirred for 20 h. The resulting product underwent heat treatment in a tubular furnace under an inert nitrogen atmosphere. Within the experimental range, the Rhodium (Rh) and Cobalt (Co) loadings were maintained consistently at 0.6 % and 0.2 %, respectively, which were relative to the total catalyst mass. The specimens were prepared using a segmented temperature-programmed method, with final heat treatment temperatures set at 500 °C, 650 °C, and 800 °C. The resulting samples were designated as RhCo/FCN-500 (FCN-500), RhCo/FCN-650 (FCN-650), and RhCo/FCN-800 (RhCo/FCN-800). For comparison, Rh/FCN-500 (without Co loading) and Co/FCN-500 (without Rh loading) were also prepared. For the naming convention of catalysts (FCN-X), “F” represents the magnetic carrier Fe3O4, “C” and “N” represent the surface of the carrier coated with a shell containing carbon and nitrogen, and “X” represents different treatment temperatures. O-Phenylenediamine and aniline are aromatic monomers that form a polymer skeleton and introduce N-functional groups; hydrogen peroxide is a free radical initiator that initiates the polymerization process; and hexadecyl trimethyl ammonium bromide (CTAB) is a surfactant. CTAB self-assembled via charge effects to form a “soft template” and direct the growth of the polymer to form a better core-shell structure; Fe3O4 can catalyse the oxidation of aromatic monomers and promote polymer layer formation on its surface [38]. 2.3 Characterisation techniques HAADF-STEM images were obtained using a JEOL ARM-200 F field-emission transmission electron microscope operating at an accelerating voltage of 200 kV. TEM images were acquired with an FEI Talos F200x equipped with an EDS: Super X detector. X-ray diffraction (XRD) patterns were recorded using a Bruker D8 diffractometer. X-ray photoelectron spectroscopy (XPS) measurements were conducted with a ThermoFisher ESCALAB 250Xi under a vacuum of 8 × 10–10 Pa, utilising Al Kα rays (hν = 1486.6 eV) as the excitation source. The charge shift was corrected by referencing all binding energies to the C1s peak at 284.6 eV. FTIR spectra were recorded using a NICOLET iS50 FT-IR spectrometer. The metal loadings were tested via inductively coupled plasma optical emission spectroscopy (ICP-OES) with a PE Avio 200 instrument. The mass contents of carbon and nitrogen were determined with a vario EL cube elemental analyser (Elementar). The metal dispersion was determined via a Micrometeric autochem 2920-hiden HPR20. In situ DRIFT experiments were performed using an elevated-pressure cell (DiffusIR Accessory PN 041–10XX) coupled with a Fourier transform infrared spectrometer (TENSOR II Sample Compartment RT-DLaTGS) at 100 °C. The sample was first exposed to a flow of N2 at 1 atm and a rate of 30 sccm for 1 h. After cooling to 50 °C, the background spectrum of the sample was recorded. The sample was subsequently treated with 1 atm of 5 % CO/He for at least 1 h, followed by the collection of DRIFT spectra post-treatment. For in situ heating experiments, the sample was heated to 130 °C, and a mixture of H2 and gaseous 1-dodecene was introduced into the cell for 1 h. In situ DRIFT spectra were then collected after exposure to different gases. 2.4 Catalytic tests The hydroformylation of 1-dodecene was conducted in a 100 mL stainless-steel autoclave. A Teflon inlet containing 20 mL of 1-dodecene and the catalyst was placed inside the autoclave, which was then pressurised with a CO/H2 gas mixture (1:1) to 80 bar. For FCN-500, FCN-650, and FCN-800, the catalyst loading was maintained at 60 mg. The reaction was carried out at 90 °C with stirring at 300 rpm for 4 h. Upon completion, the liquid phase of the reaction mixture was separated using a magnet. The product composition was determined by GC-FID and further analysed by GC–MS using toluene as the internal standard. 2.5 DFT calculation All calculations in this study were conducted using the Dmol3 code integrated into the Materials Studio software [39]. The generalised gradient approximation with the Perdew-Burke-Ernzerhof (GGA+PBE) functional was employed to describe exchange and correlation effects [40,41]. The core electrons were treated using the DFT semi-core pseudopotential (DSPP), and the Grimme DFT-D2 method was applied to account for dispersion interactions [42,43]. The double numerical plus polarisation (DNP) basis set with an atomic orbital basis of 4.4 was utilised [44]. The reciprocal space was sampled using a (2 × 2 × 1) k-point grid, generated automatically via the Monkhorst-Pack method for relaxation calculations [45]. Convergence tolerances for geometry optimisation were set at 10–5 Ha (1 Ha = 27.21 eV) for energy, 0.002 Ha/Å for maximum force, and 0.005 Å for maximum displacement. The electronic SCF tolerance was set to 10–6 Ha. A smearing of 0.005 Ha was applied to orbital occupations to enhance electronic convergence. Additionally, the complete linear synchronous transit (LST)/quadratic synchronous transit (QST) methods in the Dmol3 code were used to locate transition states (TS) [46]. To further interpret the experimental results, the qualitative effects of different N-doping types and Co metal atoms on Rh-catalysed 1-dodecene oxidation were investigated. Pyridine N, graphite N-doped graphene, and graphene models were constructed for supporting highly dispersed Rh/Co atoms, along with a single-atom Rh-loaded pyridine N-doped graphene model. For model construction, the bulk graphite structure was first optimised, followed by cutting along the (001) crystal plane to create a (7 × 7) supercell, yielding a monolayer graphene structure. The pyridine N and graphite N-doped graphene models were developed by selectively removing or replacing carbon atoms on the graphene surface. A 20 Å vacuum layer was introduced to prevent mirror image interactions between atomic layers. The adsorption energy of small molecules on the catalyst surface was determined using the following formula: (1) ∆ E molecular = E sur + molecular − E sur − E molecular where the E sur + molecular is the total energy of the surface model with the adsorbed small molecule, E sur denotes the total energy of the surface model, and E molecular corresponds to the energy of a single small molecule in a vacuum. The transition state energy barriers for each catalytic reaction were determined using Eq. 2: (2) ∆ E barrier = E TS − E IS where the E TS represents the total energy of the transition state structure, and E IS is the total energy of the initial state structure. Additionally, the charge density differences of the catalyst model were quantified using Perl scripting. 3 Discussion 3.1 Structural characterisation The morphology of the samples is presented in Fig. 1a and S1. The catalyst exhibits a typical core-shell structure, where magnetic Fe3O4 functions as the core, and an aromatic amine layer undergoes oxidative polymerisation on the outer surface to form a polymer coating. Nitrogen doping is incorporated through amino and imino groups. Following thermal treatment and carbonisation, the polymer layer is converted into a nitrogen-doped carbon layer, as illustrated in Fig. 1a. By adjusting the amount of aromatic amine and the reaction duration, the catalyst size distribution is effectively controlled within the range of 2–16 nm (Figure S2). High-angle annular dark-field scanning transmission electron microscopy (HAADF-STEM) images with spherical aberration correction are displayed in Fig. 1b. The circled regions in these images distinctly reveal the presence of individual Rh and Co metal atoms, demonstrating their high-density and uniform dispersion. The absence of metal particles or larger crystalline phases suggests the successful formation of atomically dispersed metal species. Additionally, energy-dispersive X-ray spectroscopy (EDS) elemental mapping (Fig. 1d-g) confirms the homogeneous distribution of N, Rh, and Co across the surface. An EDS line scan at the edge position further illustrates the element distribution in FCN-500, as shown in Figure S3. Collectively, these findings verify the successful synthesis of the RhCo/Fe3O4 single-atom catalyst. The mass contents of Rh, Co, C and N in the catalysts are listed in Tables S1-S2. FTIR spectroscopy was employed to characterise the chemical composition of the catalyst. As shown in Fig. 2a, the FTIR spectra of aromatic amines exhibit broad absorption bands at 1622–1633 cm–1, corresponding to the CC stretching vibrations of aromatic rings. Regardless of the structure of the aromatic ring bonded to nitrogen atoms, the CN stretching bands appear at about 1225 and 1242 cm–1 for aromatic polymers with one and two ortho-substituted positions on the phenyl rings, respectively [47]. Additionally, characteristic N-H stretching bands are observed in the regions of 3391–3468 cm–1 and 3315–3372 cm–1, respectively [48]. These FTIR results confirm the successful incorporation of nitrogen-containing functional groups on the catalyst surface and effective surface modification. Furthermore, the crystal structure of the catalyst was analysed using X-ray diffraction (XRD). As shown in the XRD patterns in Fig. 2b, the crystalline phase of Fe3O4 is clearly identifiable, while no diffraction peaks corresponding to Rh and Co crystallisation standard references are detected. This absence indicates that Rh and Co do not form crystalline phases, providing additional evidence for the successful synthesis of single-atom catalysts. To further investigate the electronic properties of FCNs, X-ray photoelectron spectroscopy (XPS) was performed to analyse the valence states of Rh, Co, and N. The XPS full-spectrum scan of FCN-500 is shown in Figure S4. High-resolution Rh 3d spectra of FCN-500, FCN-650 and FCN-800 were recorded, as presented in Fig. 2c and S5. For FCN-500, the energy bands of Rh 3d3/2 and Rh 3d5/2 were observed at 313.78 eV and 309.06 eV, respectively, confirming the presence of Rh3+ oxidation states in Rh single atoms. In contrast, the energy bands at 312.07 eV (Rh 3d3/2) and 307.35 eV (Rh 3d5/2) were assigned to Rh0 metallic states [49]. The coexistence of Rh metallic (Rh0) and oxidation states (Rh3+) is essential for the reaction process, as Rh0 is highly reactive during the initial stages because it facilitates the activation of reactants, whereas Rh3+ serves as a coordination site in subsequent stages, enhancing reactant absorption at the active site and promoting aldehyde formation [50,51]. The tunability of the electronic properties of Rh and the synergy between different oxidation states of rhodium (Rh0 and Rh3+) are essential for enhancing the activity of hydroformylation. On the basis of the XPS fitting results, the relative atomic proportions of different Rh species were calculated. The activity of the catalysts decreases sequentially from that of FCN-500 (Rh3+ 50.7 % and Rh0 49.3 %) to that of FCN-650 (Rh3+ 47.4 % and Rh0 52.6 %) to that of FCN-800 (Rh3+ 44.0 % and Rh0 56.0 %). The results indicate that under almost equivalent contents of Rh3+ and Rh0, a slight increase in Rh3+ is beneficial for improving the catalytic activity of the catalyst (Figure S6). Fig. 2d shows the Rh 3d spectra of Rh/FCN-500 without Co loading. The energy bands of Rh 3d3/2 and Rh 3d5/2 of the Rh3+ species are determined to be 314.61 eV and 309.95 eV, respectively, which corresponds to a 0.83 eV shift toward a higher binding energy than that of FCN-500. The Co 2p spectrum of FCN-500 displayed a binding energy of 782.42 eV, corresponding to Co 2p3/2 of Co2+, along with weak satellite peaks characteristic of Co2+. For Co/FCN-500 catalyst, the energy bands of Co 2p3/2 were identified as 781.72 eV, attributed to Co2+ species (oxidation states), along with satellite peak at 787.24 eV (Figure S7). Overall, the Co 2p spectra of Co/FCN-500 shifted to lower binding energy compared with FCN-500, which revealed the fact that there was a charge transfer between Rh and Co species, thereby increasing the electron density in the d orbitals of Rh and forming electron-rich Rh species. The lone pair electrons of pyridinic nitrogen (pyridinic N) do not participate in the conjugated π-system, resulting in a higher localized electron density that confers Lewis basicity, enabling it to function as an electron donor. These lone pair electrons can form strong coordination bonds with transition metals in structures such as M-Nₓ, thereby anchoring metal active centres [52] . Through its electron-donating effects, pyridinic N modulates the electronic structure of metal centres, optimizing reactant adsorption and enhancing catalytic activity [53]. The lone pair electrons of graphitic nitrogen (N) integrated into the conjugated π-system of the carbon matrix engage in weak π-metal interactions with metallic species and induce a lower localized electron density at graphitic N sites. Graphitic N has a limited adsorption strength for direct metal anchoring, but it may facilitate the homogeneous dispersion and stabilization of single-atom metals by reducing their surface energy [54]. The high-resolution N 1 s spectrum was deconvoluted, revealing peaks attributed to pyridine-N (N1, 398.1 eV) and graphitic-N (N2, 401.2 eV) [55,56]. As shown in Fig. 2e, FCN-500 exhibited the highest content of N1 species. With an increase in heat treatment temperature, the proportion of N1 within the carbon matrix progressively declined, while the fraction of N2 increased correspondingly. This trend likely results from the lower thermal stability of the N1 component at elevated temperatures and the concurrent reorganisation of the carbon network. These findings highlight the tunability of nitrogen species in polymeric nitrogen-doped carbon through controlled thermal treatment. The regulation of N species significantly affects the interaction between immobilised metal active centres and carrier electrons, thereby influencing the overall catalytic activity [57]. The elevated N1 content in FCN-500 (N1 100 % and N2 0 %) significantly enhances single-atom metal immobilization. With equivalent Rh/Co loading amounts of FCN-500, FCN-650 and FCN-800, FCN-500 demonstrated superior 1-dodecene conversion (98.92 %) and TOF values (1250 h–1), confirming the crucial role of N1 in catalytic enhancement. 3.2 Catalytic performance 3.2.1 Evaluation of reaction kinetics The synthesised atomic-scale catalyst was employed to evaluate its catalytic performance in the hydroformylation of high-carbon α-olefins, specifically 1-dodecene. The efficiency and chemoselectivity of hydroformylation were strongly dependent on the reaction conditions. Higher temperatures promote higher reaction rates but also accelerate catalyst deactivation. Lower reaction temperatures (<100 °C) preferentially favour the formation of linear aldehydes, which is directly related to the lower activation energy of the transition state. Too low of a temperature and pressure lead to a decrease in the reaction site activity, whereas too high of a temperature and increased pressure enhance the production of branched aldehyde isomers, accompanied by significant alkene isomerization side reactions[1]. Therefore, selecting suitable reaction conditions is necessary to achieve high conversion rates and aldehyde selectivity. A temperature range of 70–120 °C and a pressure range of 2–10 MPa were selected to investigate the performance of the catalyst in the hydroformylation reaction. The catalyst containing RhCo bimetallic active centres exhibited the highest catalytic efficiency. Previous studies have demonstrated that the synergistic interaction between Rh and Co enhances catalytic activity. The incorporation of Co into Rh alters CO adsorption modes, increases both catalytic activity and selectivity toward oxygenates, and improves the efficiency of Rh active sites [58] This finding was further validated through earlier experiments, where catalysts with either Rh or Co as separate active centres were tested in the hydroformylation reaction ( Fig. 3a-b). Fig. 3c illustrates the correlation between catalytic reactivity and nitrogen species distribution. The red data points represent the conversion rate of 1-dodecene, while the blue points indicate the selectivity toward tridecanal. Notably, FCN-500 exhibited the highest TOF value of 1250 h–1 and the highest 1-dodecene conversion efficiency of 98.3 %. In comparison, FCN-650 and FCN-800 achieved conversion efficiencies of 91.2 % and 80.1 %, respectively. The pyridine nitrogen content in FCN-500, FCN-650, and FCN-800 was measured at 100 %, 45.0 %, and 19.6 %, respectively. A decrease in pyridine nitrogen content was correlated with a decrease in catalyst activity, indicating that pyridine nitrogen plays a critical role in enhancing the activity of hydroformylation. Fig. 3d-e depict the product distribution in the hydroformylation reaction and the influence of reaction parameters, such as temperature and pressure, on catalytic performance. The primary products consisted of n-tridecanal, iso-tridecanal, and minor amounts of tridecanol. The results indicate that optimal reaction conditions for achieving a high yield of aldehyde products are 8 MPa and 90 °C. During the reaction, ongoing tests were conducted to establish a kinetic profile of the catalyst's performance over time (Fig. 3f-g). Throughout the continuous reaction process, samples were periodically extracted and analysed at specific time intervals. FCN-500 consistently exhibited a superior reaction rate. Within the first 0.5 h, the olefin substrate achieved a conversion rate of 57 %, followed by a significant increase around the 1-h mark. The conversion rate then stabilised after about 2 h of reaction. FCN-650 and FCN-800 showed relatively lower substrate conversion rates while following a similar temporal trend in substrate transformation. During the reaction, catalyst selectivity exhibited a gradual decline. However, FCN-500 maintained a selectivity toward tridecanal above 95 %, while the selectivity of the other two catalysts was slightly lower. The catalytic performance of RhCo/FCN-500 has been comprehensively evaluated in hydroformylation reactions involving various olefins. Under standardized reaction conditions, the catalyst achieved 99.1 % conversion for 1-hexene and 94.5 % conversion for 1-octadecene (Table S3). Notably, both the conversion efficiency and aldehyde selectivity gradually decreased with increasing carbon chain length of the olefins. This observed trend can be attributed to the enhanced steric hindrance associated with larger molecular structures. Collectively, these results demonstrate the robust catalytic ability of RhCo/FCN-500 in facilitating hydroformylation across a spectrum of olefin substrates. 3.2.2 Magnetic separation and recycling The efficient and lossless separation of magnetic catalysts under an external magnetic field enhances their practicality in applications. After the completion of the catalytic cycle, an external magnet was used to recover the catalyst, and FCN-500 was subjected to recycling experiments to evaluate its stability over extended use. Throughout the process, the catalyst was easily adsorbed and reclaimed using magnetic separation, significantly reducing the losses typically associated with multiphase catalysts, as illustrated in Fig. 4a. As shown in Fig. 4b, the initial conversion rate and aldehyde selectivity were 53.5 % and 99.1 %, respectively. The catalyst was separated from the product using a magnet and subsequently reused in repeated reaction cycles. After 10 consecutive cycles, the conversion rate and aldehyde selectivity remained at 50.3 % and 98.3 %, respectively, demonstrating that the magnetic catalyst maintained stable performance during the recycling process. Additionally, morphological characterisation of the catalyst after multiple cycles confirmed the absence of metal agglomeration (Figures S8-S9), the XPS spectra of the Rh 3d spectra of recycled FCN-500 after recycling experiments are shown in Figure S5c. Furthermore, the loading amounts of Rh and Co exhibited minimal reductions of 1.20 % and 3.17 %, respectively, after 10 cycles of recyclability experiments (Table S4). These results indicated the good stability of the catalyst. Single-atom catalysts (SACs) with supports such as metal oxides, zeolites, metal-organic frameworks (MOFs), porous organic polymers (POPs), and carbon-based materials have been widely used in hydroformylation reactions. The performances of various SACs with different supports in the hydroformylation of olefins were compared and are listed in Table 1. The RhCo/FCN-500 catalyst investigated in this study demonstrated notable advantages, with a high TOF value (1250 h–1) and high aldehyde selectivity (98.6 %). 3.3 Mechanism research 3.3.1 Interaction between FCN catalyst and reactants In situ diffuse reflectance infrared Fourier transform (DRIFT) spectroscopy was performed to examine the surface properties of adsorbed reactants on FCN catalysts [65]. To simulate reaction conditions, FCN-500 (primarily composed of pyridine N) and FCN-800 (primarily composed of graphite N) were selected as model catalysts and exposed to a mixture of H2, CO, and atomised 1-dodecene gas at 100 °C. Subsequently, the in situ heating process was analysed using DRIFT spectroscopy. In heterogeneous hydroformylation reactions, CO adsorption and insertion are considered key steps [66]. As shown in Fig. 5a, the featured CO frequency on Rh/FCN-500 appeared at 2120 cm−1. For RhCo/FCN-500 (FCN-500), two CO frequencies were observed at 2107 and 2063 cm−1, respectively, assignable to the symmetric and asymmetric vibration of CO molecules on Rh(CO) species[67]. The band shift from 2120 to 2107 cm−1 can be ascribed to charge charge transfer from Co to Rh atoms, consistent with XPS results. The CO band at 2063 cm–1 corresponds to the stretching vibration of linearly adsorbed CO on Rh single atoms. The higher intensity of the RhCo band in FCN-500 compared to FCN-800 indicates a greater abundance of single-atom RhCo species in FCN-500. This finding suggests that CO molecules exhibit stronger interactions with Rh single atoms in FCN-500. After CO adsorption, FCN specimens were exposed to a gas mixture of H2 and 1-dodecene to conduct the in situ heating experiment, effectively simulating the actual reaction environment. The in situ DRIFT spectra were recorded at 10-min intervals. The peaks observed at 2923 cm–1, 1704 cm–1, 1456 cm–1, and 985 cm–1 correspond to the stretching vibration of C-H, the stretching vibration of CC, the scissoring vibration of C-H, and the bending vibration of C-H in 1-dodecene, respectively. Throughout the heating process, no significant shift in the absorption peaks was detected, indicating that the adsorption mechanism of the reactants remained unchanged. However, when comparing the absorption peak intensities under identical conditions, the peak at 2923 cm–1 exhibited a notably higher absorption intensity for FCN-500 than for FCN-800. This finding suggests a stronger interaction between FCN-500 and the 1-dodecene substrate molecule. These results collectively indicate that, in the interaction mode involving single-atom Rh and polymer nitrogen-doped carbon, particularly in the presence of pyridine N, the adsorption of CO and 1-dodecene molecules on active sites is enhanced. This conclusion is consistent with the experimental catalytic performance evaluations. 3.3.2 DFT calculation To gain a fundamental understanding of the catalytic activity in 1-dodecene hydroformylation, density functional theory (DFT) calculations were performed based on previous studies on the RhCo/FCN catalyst mechanism during hydroformylation [68]. According to prior research, the key steps in olefin hydroformylation involve olefin coordination, H2 oxidative addition, olefin insertion, CO coordination, CO insertion, and reductive elimination of aldehyde products [69,70]. A similar mechanistic framework was employed to validate the feasibility of the proposed reaction pathways. To further elucidate the role of different nitrogen species (pyridine N and graphiteN) and their potential promoting effects, three distinct catalyst structural models were constructed: RhCo-pyridicN, RhCo-graphite, and Rh-pyridicN. Based on first-principles calculations, the adsorption energy of each reactant, including H2, CO, and 1-dodecene, at the RhCo active site was determined. As shown in Fig. 6a and S10–S15, the adsorption energy of 1-dodecene molecules indicates that RhCo-pyridicN exhibits the strongest adsorption energy (–2.89 eV), exceeding that of RhCo-graphiteN and Rh-pyridicN by 0.63 eV and 1.58 eV, respectively. This suggests that RhCo-pyridicN possesses superior adsorption and activation capabilities for 1-dodecene molecules. Additionally, RhCo-pyridicN exhibits favourable CO adsorption energy (–2.69 eV), which is higher than that of RhCo graphiteN (–2.6 eV) and Rh pyridicN (–1.07 eV). Furthermore, the introduction of Co atoms significantly enhances the adsorption capacity of RhCo-pyridine N and RhCo-graphiteN for CO and H2 compared to Rh-pyridine N, which is expected to accelerate the oxidative addition of 1-dodecene molecules. A comparison between RhCo-pyridine N and RhCo-graphiteN models reveals that the variation in nitrogen species has a limited effect on CO adsorption but significantly influences the adsorption of H2 molecules. This suggests that nitrogen species play a critical role in the catalytic process of 1-dodecene hydrogenation. Further evidence was obtained from charge density calculations for the RhCo-pyridicN model (Fig. 6b). In this model, charge transfer occurs from Rh atoms to the support matrix, leading to enhanced charge connectivity across the entire support, resulting in charge redistribution and a broader positive charge state. The charge density exhibits a wider and stronger distribution, facilitating electron transfer and generating a higher binding energy with substrate molecules. In contrast, the charge distribution in RhCo-graphiteN and Rh-pyridicN is primarily localised around individual atoms, resulting in weaker interactions with the carrier. This leads to lower electron accumulation near the carrier region and reduced adsorption strength for substrate molecules in these configurations. Further DFT calculations were conducted to investigate the reaction pathways and free energy barriers [71]. The hydroformylation reaction is divided into three main steps: the activation and dissociation of H2 at the RhCo-N site, the attack of H atoms on 1-dodecene along the CC bond to generate hydrides bonded to the RhCo site, and CO insertion from the side, leading to the formation of n-tridecanal and iso-tridecanal (Fig. 6c). Fig. 6d illustrates the Gibbs free energy diagram, depicting the energy variation path for the RhCo-pyridicN and RhCo-graphiteN models in 1-dodecene hydroformylation. In the RhCo-pyridicN model, the activation energies of TS1 and TS3 are 0.186 eV and 0.181 eV, respectively, both lower than the activation energy of TS2 (0.377 eV). A similar trend is observed in the RhCo-graphiteN model, confirming that CO insertion is the rate-determining step in the hydroformylation process. Additionally, a comparison of the transition state activation energies between the RhCo-pyridincN and RhCo-graphiteN models indicates that the energy barrier of TS1 in the RhCo-graphiteN model is 0.235 eV, which is 0.049 eV higher than that of RhCo-pyridincN. The RhCo-pyridicN model exhibits lower free energy barriers in three critical steps: H2 oxidation, addition, and CO insertion, suggesting that the oxidation of 1-dodecene occurs more readily on the RhCo-pyridicN surface, aligning with previous experimental findings. Overall, the DFT simulations indicate that the RhCo-pyridine N site in SACs effectively lowers the Gibbs free energy of the rate-determining step, thereby facilitating the hydrogenation process. The interaction mode between RhCo-pyridine N contributes to the regulation of electron density at the single-atom active centres, reducing the free energy barrier and promoting reaction progression [72]. Under identical metal loading conditions, the catalytic active centre can be modulated by adjusting the type of N species, providing a valuable model for the design of polymer nitrogen-carbon-loaded single-atom catalysts. 4 Conclusion In conclusion, a facile synthesis of a magnetic single-atom catalyst with exceptional catalytic performance in the hydroformylation of α-olefins was reported. The catalyst demonstrated significant magnetic separation properties, facilitating efficient recovery and reuse. The influence of the RhCo-N interaction mode on catalytic performance was investigated under identical Rh and Co single-atom loadings. The RhCo-pyridine N configuration enhanced 1-dodecene hydroformylation, achieving a conversion efficiency of 98.3 % and selectivity (98.6 %) towards tridecanal. Additionally, catalyst loss was minimised through magnetic separation, and the recovery performance remained stable after 10 reuse cycles. Mechanistic studies revealed that tuning the type of N species regulates the adsorption energy of reactants at single-atom active centres, thereby improving reactant adsorption and activation. Density functional theory simulations confirmed that CO insertion into the CC bond represents the highest free energy barrier and the rate-determining step in hydroformylation. The RhCo-pyridine N configuration effectively lowers the Gibbs free energy of the rate-determining step and hydrogenation, leading to enhanced substrate reactivity. This study not only broadens the industrial application potential of magnetic multiphase catalysts but also provides deeper insights into the interaction between metal active centres and supports. These findings offer a foundation for the rational structural design of single-atom catalysts. CRediT authorship contribution statement Lu Shiyao: Methodology, Investigation, Formal analysis, Data curation. Gao Dameng: Project administration, Conceptualization. Yue Jing: Supervision, Resources, Methodology, Investigation, Data curation. Cheng Lu: Writing – review & editing, Writing – original draft, Visualization, Validation, Supervision, Software, Resources, Project administration, Methodology, Investigation, Funding acquisition, Formal analysis, Data curation, Conceptualization. Ren Xingtao: Investigation, Funding acquisition, Formal analysis, Data curation, Conceptualization. Declaration of Competing Interest The authors declare that they have no known competing financial interests or personal relationships that could have appeared to influence the work reported in this paper. Acknowledgements This work was supported by the National Natural Science Foundation of China (2021YFA1500010) and Sinopec program (224030). The authors would like to thank Shiyanjialab (www.shiyanjia.com) for the language editing service. Appendix A Supporting information Supplementary data associated with this article can be found in the online version at doi:10.1016/j.apcata.2025.120264. Appendix A Supplementary material Supplementary material References [1] B. Liu Y. Wang N. Huang X. Lan Z. Xie J.G. Chen T. Wang Heterogeneous hydroformylation of alkenes by Rh-based catalysts Chem 8 2022 2630 2658 10.1016/j.chempr.2022.07.020 Liu B., Wang Y., Huang N., Lan X., Xie Z., Chen J.G., Wang T., Heterogeneous hydroformylation of alkenes by Rh-based catalysts, Chem 8 (2022) 2630–2658. https://doi.org/10.1016/j.chempr.2022.07.020. [2] R.W. Bates S. Kasinathan Hydroformylation in natural product synthesis M. Taddei A. Mann Hydroformylation for Organic Synthesis 342 2013 Springer Berlin Heidelberg Berlin, Heidelberg 187 223 10.1007/128_2013_428 Bates R.W., Kasinathan S., Hydroformylation in Natural Product Synthesis. In: Taddei M., Mann A., editors. Hydroformylation for Organic Synthesis, vol. 342, Berlin, Heidelberg: Springer Berlin Heidelberg; (2013), p. 187–223. https://doi.org/10.1007/128_2013_428. [3] R. Franke D. Selent A. Börner Applied hydroformylation Chem. Rev. 112 2012 5675 5732 10.1021/cr3001803 Franke R., Selent D., Börner A., Applied Hydroformylation, Chem Rev 112 (2012) 5675–5732. https://doi.org/10.1021/cr3001803. [4] X. Ren Z. Zheng L. Zhang Z. Wang C. Xia K. Ding Rhodium-complex-catalyzed hydroformylation of olefins with CO 2 and hydrosilane Angew. Chem. Int Ed. 56 2017 310 313 10.1002/anie.201608628 Ren X., Zheng Z., Zhang L., Wang Z., Xia C., Ding K., Rhodium-Complex-Catalyzed Hydroformylation of Olefins with CO 2 and Hydrosilane, Angew Chem Int Ed 56 (2017) 310–313. https://doi.org/10.1002/anie.201608628. [5] L. Gonsalvi A. Guerriero E. Monflier F. Hapiot M. Peruzzini The Role of Metals and Ligands in Organic Hydroformylation M. Taddei A. Mann Hydroformylation for Organic Synthesis 342 2013 Springer Berlin Heidelberg Berlin, Heidelberg 1 47 10.1007/128_2013_430 Gonsalvi L., Guerriero A., Monflier E., Hapiot F., Peruzzini M., The Role of Metals and Ligands in Organic Hydroformylation. In: Taddei M., Mann A., editors. Hydroformylation for Organic Synthesis, vol. 342, Berlin, Heidelberg: Springer Berlin Heidelberg; (2013), p. 1–47. https://doi.org/10.1007/128_2013_430. [6] D. Gorbunov M. Nenasheva A. Maximov E. Karakhanov The synthesis of propanol from ethylene over homogeneous Rh/amine catalytic system via auto-tandem reductive hydroformylation Appl. Catal. A: Gen. 670 2024 119538 10.1016/j.apcata.2023.119538 Gorbunov D., Nenasheva M., Maximov A., Karakhanov E., The synthesis of propanol from ethylene over homogeneous Rh/amine catalytic system via auto-tandem reductive hydroformylation, Applied Catalysis A: General 670 (2024) 119538. https://doi.org/10.1016/j.apcata.2023.119538. [7] R. Schlögl Heterogeneous catalysis Angew. Chem. Int Ed. 54 2015 3465 3520 10.1002/anie.201410738 Schlögl R., Heterogeneous Catalysis, Angew Chem Int Ed 54 (2015) 3465–3520. https://doi.org/10.1002/anie.201410738. [8] C. Descorme P. Gallezot C. Geantet C. George Heterogeneous catalysis: a key tool toward sustainability ChemCatChem 4 2012 1897 1906 10.1002/cctc.201200483 Descorme C., Gallezot P., Geantet C., George C., Heterogeneous Catalysis: A Key Tool toward Sustainability, ChemCatChem 4 (2012) 1897–1906. https://doi.org/10.1002/cctc.201200483. [9] T. Van Vu H. Kosslick A. Schulz J. Harloff E. Paetzold M. Schneider J. Radnik N. Steinfeldt G. Fulda U. Kragl Selective hydroformylation of olefins over the rhodium supported large porous metal–organic framework MIL-101 Appl. Catal. A: Gen. 468 2013 410 417 10.1016/j.apcata.2013.09.011 Van Vu T., Kosslick H., Schulz A., Harloff J., Paetzold E., Schneider M., Radnik J., Steinfeldt N., Fulda G., Kragl U., Selective hydroformylation of olefins over the rhodium supported large porous metal–organic framework MIL-101, Applied Catalysis A: General 468 (2013) 410–417. https://doi.org/10.1016/j.apcata.2013.09.011. [10] L. Liu A. Corma Metal catalysts for heterogeneous catalysis: from single atoms to nanoclusters and nanoparticles Chem. Rev. 118 2018 4981 5079 10.1021/acs.chemrev.7b00776 Liu L., Corma A., Metal Catalysts for Heterogeneous Catalysis: From Single Atoms to Nanoclusters and Nanoparticles, Chem Rev 118 (2018) 4981–5079. https://doi.org/10.1021/acs.chemrev.7b00776. [11] C. Yao W. Xiong H. Sun X. Wang Z. Zhang X. Hu Mesoporous coordinated polymers with single-metal-site iridium for efficient catalysis in propylene hydroformylation AIChE J. 2024 e18425 10.1002/aic.18425 Yao C., Xiong W., Sun H., Wang X., Zhang Z., Hu X., Mesoporous coordinated polymers with single-metal-site iridium for efficient catalysis in propylene hydroformylation, AIChE Journal (2024) e18425. https://doi.org/10.1002/aic.18425. [12] S. Tao D. Yang M. Wang G. Sun G. Xiong W. Gao Y. Zhang Y. Pan Single-atom catalysts for hydroformylation of olefins iScience 26 2023 106183 10.1016/j.isci.2023.106183 Tao S., Yang D., Wang M., Sun G., Xiong G., Gao W., Zhang Y., Pan Y., Single-atom catalysts for hydroformylation of olefins, iScience 26 (2023) 106183. https://doi.org/10.1016/j.isci.2023.106183. [13] J. Liu Catalysis by supported single metal atoms ACS Catal. 7 2017 34 59 10.1021/acscatal.6b01534 Liu J., Catalysis by Supported Single Metal Atoms, ACS Catal 7 (2017) 34–59. https://doi.org/10.1021/acscatal.6b01534. [14] R. Lang X. Du Y. Huang X. Jiang Q. Zhang Y. Guo K. Liu B. Qiao A. Wang T. Zhang Single-atom catalysts based on the metal–oxide interaction Chem. Rev. 120 2020 11986 12043 10.1021/acs.chemrev.0c00797 Lang R., Du X., Huang Y., Jiang X., Zhang Q., Guo Y., Liu K., Qiao B., Wang A., Zhang T., Single-Atom Catalysts Based on the Metal–Oxide Interaction, Chem Rev 120 (2020) 11986–12043. https://doi.org/10.1021/acs.chemrev.0c00797. [15] A. Wang J. Li T. Zhang Heterogeneous single-atom catalysis Nat. Rev. Chem. 2 2018 65 81 10.1038/s41570-018-0010-1 Wang A., Li J., Zhang T., Heterogeneous single-atom catalysis, Nat Rev Chem 2 (2018) 65–81. https://doi.org/10.1038/s41570-018-0010-1. [16] X. Liang N. Fu S. Yao Z. Li Y. Li The progress and outlook of metal single-atom-site catalysis J. Am. Chem. Soc. 144 2022 18155 18174 10.1021/jacs.1c12642 Liang X., Fu N., Yao S., Li Z., Li Y., The Progress and Outlook of Metal Single-Atom-Site Catalysis, J Am Chem Soc 144 (2022) 18155–18174. https://doi.org/10.1021/jacs.1c12642. [17] J. Liu B.R. Bunes L. Zang C. Wang Supported single-atom catalysts: synthesis, characterization, properties, and applications Environ. Chem. Lett. 16 2018 477 505 10.1007/s10311-017-0679-2 Liu J., Bunes B.R., Zang L., Wang C., Supported single-atom catalysts: synthesis, characterization, properties, and applications, ENVIRONMENTAL CHEMISTRY LETTERS 16 (2018) 477–505. https://doi.org/10.1007/s10311-017-0679-2. [18] S. Hu W.-X. Li Sabatier principle of metal-support interaction for design of ultrastable metal nanocatalysts Science 374 2021 1360 1365 10.1126/science.abi9828 Hu S., Li W.-X., Sabatier principle of metal-support interaction for design of ultrastable metal nanocatalysts, Science 374 (2021) 1360–1365. https://doi.org/10.1126/science.abi9828. [19] K. Zhao H. Tang B. Qiao L. Li J. Wang High Activity of Au/γ-Fe 2 O 3 for CO oxidation: effect of support crystal phase in catalyst design ACS Catal. 5 2015 3528 3539 10.1021/cs5020496 Zhao K., Tang H., Qiao B., Li L., Wang J., High Activity of Au/γ-Fe 2 O 3 for CO Oxidation: Effect of Support Crystal Phase in Catalyst Design, ACS Catal 5 (2015) 3528–3539. https://doi.org/10.1021/cs5020496. [20] J. Li Q. Guan H. Wu W. Liu Y. Lin Z. Sun X. Ye X. Zheng H. Pan J. Zhu S. Chen W. Zhang S. Wei J. Lu Highly active and stable metal single-atom catalysts achieved by strong electronic metal–support interactions J. Am. Chem. Soc. 141 2019 14515 14519 10.1021/jacs.9b06482 Li J., Guan Q., Wu H., Liu W., Lin Y., Sun Z., Ye X., Zheng X., Pan H., Zhu J., Chen S., Zhang W., Wei S., Lu J., Highly Active and Stable Metal Single-Atom Catalysts Achieved by Strong Electronic Metal–Support Interactions, J Am Chem Soc 141 (2019) 14515–14519. https://doi.org/10.1021/jacs.9b06482. [21] Y. Gao B. Liu D. Wang Microenvironment engineering of single/dual-atom catalysts for electrocatalytic application Adv. Mater. 2023 2209654 10.1002/adma.202209654 Gao Y., Liu B., Wang D., Microenvironment Engineering of Single/Dual-atom Catalysts for Electrocatalytic Application, Advanced Materials (2023) 2209654. https://doi.org/10.1002/adma.202209654. [22] C. Tang Y. Jiao B. Shi J. Liu Z. Xie X. Chen Q. Zhang S. Qiao Coordination tunes selectivity: two-electron oxygen reduction on high-loading molybdenum single-atom catalysts Angew. Chem. 132 2020 9256 9261 10.1002/ange.202003842 Tang C., Jiao Y., Shi B., Liu J., Xie Z., Chen X., Zhang Q., Qiao S., Coordination Tunes Selectivity: Two-Electron Oxygen Reduction on High-Loading Molybdenum Single-Atom Catalysts, Angew Chem 132 (2020) 9256–9261. https://doi.org/10.1002/ange.202003842. [23] J. Mu G. Long X. Song S. Feng X. Li Q. Yuan B. Li Z. Jiang L. Yan Y. Ding Engineering the coordination environment of single-Rh-Site with N and S atoms for efficient methanol carbonylation Adv. Funct. Mater. 2023 2305823 10.1002/adfm.202305823 Mu J., Long G., Song X., Feng S., Li X., Yuan Q., Li B., Jiang Z., Yan L., Ding Y., Engineering the Coordination Environment of Single-Rh-Site with N and S Atoms for Efficient Methanol Carbonylation, Adv Funct Materials (2023) 2305823. https://doi.org/10.1002/adfm.202305823. [24] X. Luo X. Wei H. Wang W. Gu T. Kaneko Y. Yoshida X. Zhao C. Zhu Secondary-atom-doping enables robust Fe–N–C single-atom catalysts with enhanced oxygen reduction reaction Nano-Micro Lett. 12 2020 163 10.1007/s40820-020-00502-5 Luo X., Wei X., Wang H., Gu W., Kaneko T., Yoshida Y., Zhao X., Zhu C., Secondary-Atom-Doping Enables Robust Fe–N–C Single-Atom Catalysts with Enhanced Oxygen Reduction Reaction, Nano-Micro Lett 12 (2020) 163. https://doi.org/10.1007/s40820-020-00502-5. [25] X. Hai S. Xi S. Mitchell K. Harrath H. Xu D.F. Akl D. Kong J. Li Z. Li T. Sun H. Yang Y. Cui C. Su X. Zhao J. Li J. Pérez-Ramírez J. Lu Scalable two-step annealing method for preparing ultra-high-density single-atom catalyst libraries Nat. Nanotechnol. 17 2022 174 181 10.1038/s41565-021-01022-y Hai X., Xi S., Mitchell S., Harrath K., Xu H., Akl D.F., Kong D., Li J., Li Z., Sun T., Yang H., Cui Y., Su C., Zhao X., Li J., Pérez-Ramírez J., Lu J., Scalable two-step annealing method for preparing ultra-high-density single-atom catalyst libraries, Nat Nanotechnol 17 (2022) 174–181. https://doi.org/10.1038/s41565-021-01022-y. [26] B. Hu K. Sun Z. Zhuang Z. Chen S. Liu W. Cheong C. Chen M. Hu X. Cao J. Ma R. Tu X. Zheng H. Xiao X. Chen Y. Cui Q. Peng C. Chen Y. Li Distinct crystal-facet-dependent behaviors for single-atom palladium-on-ceria catalysts: enhanced stabilization and catalytic properties Adv. Mater. 34 2022 2107721 10.1002/adma.202107721 Hu B., Sun K., Zhuang Z., Chen Z., Liu S., Cheong W., Chen C., Hu M., Cao X., Ma J., Tu R., Zheng X., Xiao H., Chen X., Cui Y., Peng Q., Chen C., Li Y., Distinct Crystal-Facet-Dependent Behaviors for Single-Atom Palladium-On-Ceria Catalysts: Enhanced Stabilization and Catalytic Properties, Advanced Materials 34 (2022) 2107721. https://doi.org/10.1002/adma.202107721. [27] F.S. Golub Q. Xiang D.A. Bulushev Single-atom catalysts supported on covalent triazine frameworks Appl. Catal. A: Gen. 690 2025 120035 10.1016/j.apcata.2024.120035 Golub F.S., Xiang Q., Bulushev D.A., Single-atom catalysts supported on covalent triazine frameworks, Applied Catalysis A: General 690 (2025) 120035. https://doi.org/10.1016/j.apcata.2024.120035. [28] M. Zhao J. Feng W. Yang S. Song H. Zhang Recent advances in graphitic carbon nitride supported single-atom catalysts for energy conversion CHEMCATCHEM 13 2021 1250 1270 10.1002/cctc.202001517 Zhao M., Feng J., Yang W., Song S., Zhang H., Recent advances in graphitic carbon nitride supported single-atom catalysts for energy conversion, CHEMCATCHEM 13 (2021) 1250–1270. https://doi.org/10.1002/cctc.202001517. [29] J. Fu S. Wang Z. Wang K. Liu H. Li H. Liu J. Hu X. Xu H. Li M. Liu Graphitic carbon nitride based single-atom photocatalysts Front. Phys. 15 2020 10.1007/s11467-019-0950-z Fu J., Wang S., Wang Z., Liu K., Li H., Liu H., Hu J., Xu X., Li H., Liu M., Graphitic carbon nitride based single-atom photocatalysts, FRONTIERS OF PHYSICS 15 (2020). https://doi.org/10.1007/s11467-019-0950-z. [30] I. Ro M. Xu G.W. Graham X. Pan P. Christopher Synthesis of heteroatom Rh–ReO x atomically dispersed species on Al2 O3 and their tunable catalytic reactivity in ethylene hydroformylation ACS Catal. 9 2019 10899 10912 10.1021/acscatal.9b02111 Ro I., Xu M., Graham G.W., Pan X., Christopher P., Synthesis of Heteroatom Rh–ReO x Atomically Dispersed Species on Al2 O3 and Their Tunable Catalytic Reactivity in Ethylene Hydroformylation, ACS Catal 9 (2019) 10899–10912. https://doi.org/10.1021/acscatal.9b02111. [31] M.G. Farpón W. Henao P.N. Plessow E. Andrés R. Arenal C. Marini G. Agostini F. Studt G. Prieto Rhodium single-atom catalyst design through oxide support modulation for selective gas-phase ethylene hydroformylation Angew. Chem. Int Ed. 62 2023 e202214048 10.1002/anie.202214048 Farpón M.G., Henao W., Plessow P.N., Andrés E., Arenal R., Marini C., Agostini G., Studt F., Prieto G., Rhodium Single-Atom Catalyst Design through Oxide Support Modulation for Selective Gas-Phase Ethylene Hydroformylation, Angew Chem Int Ed 62 (2023) e202214048. https://doi.org/10.1002/anie.202214048. [32] Y. Zhang L. Liu Z. Wang X. Zhang X. He H. Ji Tandem hydroformylation/hydrogenation of olefins to alcohols using atomically dispersed bifunctional catalysts Sci. China Chem. 67 2024 3706 3711 10.1007/s11426-024-2135-y Zhang Y., Liu L., Wang Z., Zhang X., He X., Ji H., Tandem hydroformylation/hydrogenation of olefins to alcohols using atomically dispersed bifunctional catalysts, Sci China Chem 67 (2024) 3706–3711. https://doi.org/10.1007/s11426-024-2135-y. [33] L.M. Rossi N.J.S. Costa F.P. Silva R. Wojcieszak Magnetic nanomaterials in catalysis: advanced catalysts for magnetic separation and beyond Green. Chem. 16 2014 2906 10.1039/c4gc00164h Rossi L.M., Costa N.J.S., Silva F.P., Wojcieszak R., Magnetic nanomaterials in catalysis: advanced catalysts for magnetic separation and beyond, Green Chem 16 (2014) 2906. https://doi.org/10.1039/c4gc00164h. [34] M.A.S. Garcia K.C.B. Oliveira J.C.S. Costa P. Corio E.V. Gusevskaya E.N. dos Santos L.M. Rossi Rhodium nanoparticles as precursors for the preparation of an efficient and recyclable hydroformylation catalyst ChemCatChem 7 2015 1566 1572 10.1002/cctc.201500065 Garcia M.A.S., Oliveira K.C.B., Costa J.C.S., Corio P., Gusevskaya E.V., dos Santos E.N., Rossi L.M., Rhodium Nanoparticles as Precursors for the Preparation of an Efficient and Recyclable Hydroformylation Catalyst, ChemCatChem 7 (2015) 1566–1572. https://doi.org/10.1002/cctc.201500065. [35] D. Wang D. Astruc Fast-growing field of magnetically recyclable nanocatalysts Chem. Rev. 114 2014 6949 6985 10.1021/cr500134h Wang D., Astruc D., Fast-Growing Field of Magnetically Recyclable Nanocatalysts, Chem Rev 114 (2014) 6949–6985. https://doi.org/10.1021/cr500134h. [36] Y. Zhu L.P. Stubbs F. Ho R. Liu C.P. Ship J.A. Maguire N.S. Hosmane Magnetic nanocomposites: a new perspective in catalysis ChemCatChem 2 2010 365 374 10.1002/cctc.200900314 Zhu Y., Stubbs L.P., Ho F., Liu R., Ship C.P., Maguire J.A., Hosmane N.S., Magnetic Nanocomposites: A New Perspective in Catalysis, ChemCatChem 2 (2010) 365–374. https://doi.org/10.1002/cctc.200900314. [37] L. Zhao X. Qin X. Zhang X. Cai F. Huang Z. Jia J. Diao D. Xiao Z. Jiang R. Lu N. Wang H. Liu D. Ma A magnetically separable pd single-atom catalyst for efficient selective hydrogenation of phenylacetylene Adv. Mater. 34 2022 2110455 10.1002/adma.202110455 Zhao L., Qin X., Zhang X., Cai X., Huang F., Jia Z., Diao J., Xiao D., Jiang Z., Lu R., Wang N., Liu H., Ma D., A Magnetically Separable Pd Single-Atom Catalyst for Efficient Selective Hydrogenation of Phenylacetylene, Advanced Materials 34 (2022) 2110455. https://doi.org/10.1002/adma.202110455. [38] J. Han J. Dai C. Zhou R. Guo Dilute cationic surfactant-assisted synthesis of polyaniline nanotubes and application as reactive support for various noble metal nanocatalysts Polym. Chem. 4 2013 313 321 10.1039/C2PY20536J Han J., Dai J., Zhou C., Guo R., Dilute cationic surfactant-assisted synthesis of polyaniline nanotubes and application as reactive support for various noble metal nanocatalysts, Polym Chem 4 (2013) 313–321. https://doi.org/10.1039/C2PY20536J. [39] B. Delley From molecules to solids with the DMol3 approach J. Chem. Phys. 113 2000 7756 7764 10.1063/1.1316015 Delley B., From molecules to solids with the DMol3 approach, The Journal of Chemical Physics 113 (2000) 7756–7764. https://doi.org/10.1063/1.1316015. [40] J.P. Perdew K. Burke M. Ernzerhof Generalized gradient approximation made simple Phys. Rev. Lett. 77 1996 3865 3868 10.1103/PhysRevLett.77.3865 Perdew J.P., Burke K., Ernzerhof M., Generalized Gradient Approximation Made Simple, Phys Rev Lett 77 (1996) 3865–3868. https://doi.org/10.1103/PhysRevLett.77.3865. [41] J.P. Perdew K. Burke Y. Wang Generalized gradient approximation for the exchange-correlation hole of a many-electron system Phys. Rev. B 54 1996 16533 16539 10.1103/PhysRevB.54.16533 Perdew J.P., Burke K., Wang Y., Generalized gradient approximation for the exchange-correlation hole of a many-electron system, Phys Rev B 54 (1996) 16533–16539. https://doi.org/10.1103/PhysRevB.54.16533. [42] B. Delley Hardness conserving semilocal pseudopotentials Phys. Rev. B 66 2002 155125 10.1103/PhysRevB.66.155125 Delley B., Hardness conserving semilocal pseudopotentials, Phys Rev B 66 (2002) 155125. https://doi.org/10.1103/PhysRevB.66.155125. [43] W. Shang B. Qin M. Gao X. Qin Y. Chai G. Wu N. Guan D. Ma L. Li Efficient heterogeneous hydroformylation over zeolite-encaged isolated rhodium ions CCS Chem. 5 2023 1526 1539 10.31635/ccschem.022.202202043 Shang W., Qin B., Gao M., Qin X., Chai Y., Wu G., Guan N., Ma D., Li L., Efficient Heterogeneous Hydroformylation over Zeolite-Encaged Isolated Rhodium Ions, CCS Chem 5 (2023) 1526–1539. https://doi.org/10.31635/ccschem.022.202202043. [44] B. Delley An all-electron numerical method for solving the local density functional for polyatomic molecules J. Chem. Phys. 92 1990 508 517 10.1063/1.458452 Delley B., An all-electron numerical method for solving the local density functional for polyatomic molecules, The Journal of Chemical Physics 92 (1990) 508–517. https://doi.org/10.1063/1.458452. [45] D.J. Chadi Special points for Brillouin-zone integrations Phys. Rev. B 16 1977 1746 1747 10.1103/PhysRevB.16.1746 Chadi D.J., Special points for Brillouin-zone integrations, Phys Rev B 16 (1977) 1746–1747. https://doi.org/10.1103/PhysRevB.16.1746. [46] T.A. Halgren W.N. Lipscomb The synchronous-transit method for determining reaction pathways and locating molecular transition states Chem. Phys. Lett. 49 1977 225 232 10.1016/0009-2614(77)80574-5 Halgren T.A., Lipscomb W.N., The synchronous-transit method for determining reaction pathways and locating molecular transition states, Chemical Physics Letters 49 (1977) 225–232. https://doi.org/10.1016/0009-2614(77)80574-5. [47] A. Pielesz A. Włochowicz Semiempirical infrared spectra simulations for some aromatic amines of interest for azo dye chemistry Spectrochim. Acta Part A: Mol. Biomol. Spectrosc. 57 2001 2637 2646 10.1016/S1386-1425(01)00452-8 Pielesz A., Włochowicz A., Semiempirical infrared spectra simulations for some aromatic amines of interest for azo dye chemistry, Spectrochimica Acta Part A: Molecular and Biomolecular Spectroscopy 57 (2001) 2637–2646. https://doi.org/10.1016/S1386-1425(01)00452-8. [48] B. Kaczmarczyk FTIR study of conjugation in selected aromatic polyazomethines J. Mol. Struct. 1048 2013 179 184 10.1016/j.molstruc.2013.05.036 Kaczmarczyk B., FTIR study of conjugation in selected aromatic polyazomethines, Journal of Molecular Structure 1048 (2013) 179–184. https://doi.org/10.1016/j.molstruc.2013.05.036. [49] L. Wang W. Zhang S. Wang Z. Gao Z. Luo X. Wang R. Zeng A. Li H. Li M. Wang X. Zheng J. Zhu W. Zhang C. Ma R. Si J. Zeng Atomic-level insights in optimizing reaction paths for hydroformylation reaction over Rh/CoO single-atom catalyst Nat. Commun. 7 2016 14036 10.1038/ncomms14036 Wang L., Zhang W., Wang S., Gao Z., Luo Z., Wang X., Zeng R., Li A., Li H., Wang M., Zheng X., Zhu J., Zhang W., Ma C., Si R., Zeng J., Atomic-level insights in optimizing reaction paths for hydroformylation reaction over Rh/CoO single-atom catalyst, Nat Commun 7 (2016) 14036. https://doi.org/10.1038/ncomms14036. [50] M. Zhao C. Li D. Gómez F. Gonell V.M. Diaconescu L. Simonelli M.L. Haro J.J. Calvino D.M. Meira P. Concepción A. Corma Low-temperature hydroformylation of ethylene by phosphorous stabilized Rh sites in a one-pot synthesized Rh-(O)-P-MFI zeolite Nat. Commun. 14 2023 7174 10.1038/s41467-023-42938-4 Zhao M., Li C., Gómez D., Gonell F., Diaconescu V.M., Simonelli L., Haro M.L., Calvino J.J., Meira D.M., Concepción P., Corma A., Low-temperature hydroformylation of ethylene by phosphorous stabilized Rh sites in a one-pot synthesized Rh-(O)-P-MFI zeolite, Nat Commun 14 (2023) 7174. https://doi.org/10.1038/s41467-023-42938-4. [51] E.A. Fedorova T.Yu Kardash L.S. Kibis O.A. Stonkus E.M. Slavinskaya V.A. Svetlichnyi S. Pollastri A.I. Boronin Unraveling the low-temperature activity of Rh–CeO2 catalysts in CO oxidation: probing the local structure and Red-Ox transformation of Rh3+ species Phys. Chem. Chem. Phys. 25 2023 2862 2874 10.1039/D2CP04503F Fedorova E.A., Kardash T.Yu, Kibis L.S., Stonkus O.A., Slavinskaya E.M., Svetlichnyi V.A., Pollastri S., Boronin A.I., Unraveling the low-temperature activity of Rh–CeO2 catalysts in CO oxidation: probing the local structure and Red-Ox transformation of Rh3+ species, Phys Chem Chem Phys 25 (2023) 2862–2874. https://doi.org/10.1039/D2CP04503F. [52] M. Xiao Y. Chen J. Zhu H. Zhang X. Zhao L. Gao X. Wang J. Zhao J. Ge Z. Jiang S. Chen C. Liu W. Xing Climbing the apex of the ORR volcano plot via binuclear site construction: electronic and geometric engineering J. Am. Chem. Soc. 141 2019 17763 17770 10.1021/jacs.9b08362 Xiao M., Chen Y., Zhu J., Zhang H., Zhao X., Gao L., Wang X., Zhao J., Ge J., Jiang Z., Chen S., Liu C., Xing W., Climbing the Apex of the ORR Volcano Plot via Binuclear Site Construction: Electronic and Geometric Engineering, J Am Chem Soc 141 (2019) 17763–17770. https://doi.org/10.1021/jacs.9b08362. [53] J. Peng Y. Li Y. Cheng F. Li B. Cao Q. Wang X. Yue G. Lai Y. Wang J. Gu Metal–N4 model single-atom catalyst with electroneutral quadri-pyridine macrocyclic ligand for CO2 electroreduction Carbon Energy 6 2024 e506 10.1002/cey2.506 Peng J., Li Y., Cheng Y., Li F., Cao B., Wang Q., Yue X., Lai G., Wang Y., Gu J., Metal–N4 model single-atom catalyst with electroneutral quadri-pyridine macrocyclic ligand for CO2 electroreduction, Carbon Energy 6 (2024) e506. https://doi.org/10.1002/cey2.506. [54] Z. Chen S. Mitchell E. Vorobyeva R.K. Leary R. Hauert T. Furnival Q.M. Ramasse J.M. Thomas P.A. Midgley D. Dontsova M. Antonietti S. Pogodin N. López J. Pérez-Ramírez Stabilization of single metal atoms on graphitic carbon nitride Adv. Funct. Mater. 27 2017 1605785 10.1002/adfm.201605785 Chen Z., Mitchell S., Vorobyeva E., Leary R.K., Hauert R., Furnival T., Ramasse Q.M., Thomas J.M., Midgley P.A., Dontsova D., Antonietti M., Pogodin S., López N., Pérez-Ramírez J., Stabilization of Single Metal Atoms on Graphitic Carbon Nitride, Adv Funct Materials 27 (2017) 1605785. https://doi.org/10.1002/adfm.201605785. [55] R. Li T. Gao P. Wang W. Qiu K. Liu Y. Liu Z. Jin P. Li The origin of selective nitrate-to-ammonia electroreduction on metal-free nitrogen-doped carbon aerogel catalysts Appl. Catal. B: Environ. 331 2023 122677 10.1016/j.apcatb.2023.122677 Li R., Gao T., Wang P., Qiu W., Liu K., Liu Y., Jin Z., Li P., The origin of selective nitrate-to-ammonia electroreduction on metal-free nitrogen-doped carbon aerogel catalysts, Applied Catalysis B: Environmental 331 (2023) 122677. https://doi.org/10.1016/j.apcatb.2023.122677. [56] R. Arrigo M. Hävecker S. Wrabetz R. Blume M. Lerch J. McGregor E.P.J. Parrott J.A. Zeitler L.F. Gladden A. Knop-Gericke R. Schlögl D.S. Su Tuning the acid/base properties of nanocarbons by functionalization via amination J. Am. Chem. Soc. 132 2010 9616 9630 10.1021/ja910169v Arrigo R., Hävecker M., Wrabetz S., Blume R., Lerch M., McGregor J., Parrott E.P.J., Zeitler J.A., Gladden L.F., Knop-Gericke A., Schlögl R., Su D.S., Tuning the Acid/Base Properties of Nanocarbons by Functionalization via Amination, J Am Chem Soc 132 (2010) 9616–9630. https://doi.org/10.1021/ja910169v. [57] M. Ma X. Cheng Z. Shi C. Zhang Y. Li Y. Yang C. Gong Z. Zhang H. Fei C. Zhu Y. He E. Xie Role of N in transition-metal-nitrides for anchoring platinum-group metal atoms toward single-atom catalysis SMALL METHODS 6 2022 10.1002/smtd.202200295 Ma M., Cheng X., Shi Z., Zhang C., Li Y., Yang Y., Gong C., Zhang Z., Fei H., Zhu C., He Y., Xie E., Role of N in transition-metal-nitrides for anchoring platinum-group metal atoms toward single-atom catalysis, SMALL METHODS 6 (2022). https://doi.org/10.1002/smtd.202200295. [58] N. Huang B. Liu X. Lan T. Wang Insights into the Bimetallic Effects of a RhCo Catalyst for Ethene Hydroformylation: experimental and DFT Investigations Ind. Eng. Chem. Res 59 2020 18771 18780 10.1021/acs.iecr.0c03437 Huang N., Liu B., Lan X., Wang T., Insights into the Bimetallic Effects of a RhCo Catalyst for Ethene Hydroformylation: Experimental and DFT Investigations, Ind Eng Chem Res 59 (2020) 18771–18780. https://doi.org/10.1021/acs.iecr.0c03437. [59] B. Wei X. Liu K. Hua Y. Deng H. Wang Y. Sun Effectively regulating the microenvironment of atomically dispersed rh through co and pi to promote the selectivity in olefin hydroformylation ACS Appl. Mater. Interfaces 13 2021 15113 15121 10.1021/acsami.0c21749 Wei B., Liu X., Hua K., Deng Y., Wang H., Sun Y., Effectively Regulating the Microenvironment of Atomically Dispersed Rh through Co and Pi to Promote the Selectivity in Olefin Hydroformylation, ACS Appl Mater Interfaces 13 (2021) 15113–15121. https://doi.org/10.1021/acsami.0c21749. [60] Y. Zheng Q. Yang S. Wang S. Furukawa P. Wang M. Li N. Yan X. Ma Enhanced regioselectivity in propylene hydroformylation using Xantphos-modified single-atom Rh/CeO2 catalyst J. Catal. 431 2024 115394 10.1016/j.jcat.2024.115394 Zheng Y., Yang Q., Wang S., Furukawa S., Wang P., Li M., Yan N., Ma X., Enhanced regioselectivity in propylene hydroformylation using Xantphos-modified single-atom Rh/CeO2 catalyst, Journal of Catalysis 431 (2024) 115394. https://doi.org/10.1016/j.jcat.2024.115394. [61] P. Gao G. Liang T. Ru X. Liu H. Qi A. Wang F.-E. Chen Phosphorus coordinated Rh single-atom sites on nanodiamond as highly regioselective catalyst for hydroformylation of olefins Nat. Commun. 12 2021 4698 10.1038/s41467-021-25061-0 Gao P., Liang G., Ru T., Liu X., Qi H., Wang A., Chen F.-E., Phosphorus coordinated Rh single-atom sites on nanodiamond as highly regioselective catalyst for hydroformylation of olefins, Nat Commun 12 (2021) 4698. https://doi.org/10.1038/s41467-021-25061-0. [62] K. Zhao H. Wang X. Wang T. Li X. Dai L. Zhang X. Cui F. Shi Confinement of atomically dispersed Rh catalysts within porous monophosphine polymers for regioselective hydroformylation of alkenes J. Catal. 401 2021 321 330 10.1016/j.jcat.2021.08.004 Zhao K., Wang H., Wang X., Li T., Dai X., Zhang L., Cui X., Shi F., Confinement of atomically dispersed Rh catalysts within porous monophosphine polymers for regioselective hydroformylation of alkenes, Journal of Catalysis 401 (2021) 321–330. https://doi.org/10.1016/j.jcat.2021.08.004. [63] J. Amsler B.B. Sarma G. Agostini G. Prieto P.N. Plessow F. Studt Prospects of heterogeneous hydroformylation with supported single atom catalysts J. Am. Chem. Soc. 142 2020 5087 5096 10.1021/jacs.9b12171 Amsler J., Sarma B.B., Agostini G., Prieto G., Plessow P.N., Studt F., Prospects of Heterogeneous Hydroformylation with Supported Single Atom Catalysts, J Am Chem Soc 142 (2020) 5087–5096. https://doi.org/10.1021/jacs.9b12171. [64] B. Wei J. Chen X. Liu K. Hua L. Li S. Zhang H. Luo H. Wang Y. Sun Achieving rhodium-like activity for olefin hydroformylation by electronic metal-support interaction of single atomic cobalt catalyst Cell Rep. Phys. Sci. 3 2022 101016 10.1016/j.xcrp.2022.101016 Wei B., Chen J., Liu X., Hua K., Li L., Zhang S., Luo H., Wang H., Sun Y., Achieving rhodium-like activity for olefin hydroformylation by electronic metal-support interaction of single atomic cobalt catalyst, Cell Reports Physical Science 3 (2022) 101016. https://doi.org/10.1016/j.xcrp.2022.101016. [65] M. Chen G. Gupta C.W. Ordonez A.R. Lamkins C.J. Ward C.A. Abolafia B. Zhang L.T. Roling W. Huang Intermetallic nanocatalyst for highly active heterogeneous hydroformylation J. Am. Chem. Soc. 143 2021 20907 20915 10.1021/jacs.1c09665 Chen M., Gupta G., Ordonez C.W., Lamkins A.R., Ward C.J., Abolafia C.A., Zhang B., Roling L.T., Huang W., Intermetallic Nanocatalyst for Highly Active Heterogeneous Hydroformylation, J Am Chem Soc 143 (2021) 20907–20915. https://doi.org/10.1021/jacs.1c09665. [66] J. Liu Catalysis by supported single metal atoms ACS Catal. 7 2017 34 59 10.1021/acscatal.6b01534 Liu J., Catalysis by supported single metal atoms, ACS CATALYSIS 7 (2017) 34–59. https://doi.org/10.1021/acscatal.6b01534. [67] M.A. Albrahim A. Shrotri R.R. Unocic A.S. Hoffman S.R. Bare A.M. Karim Size-dependent dispersion of rhodium clusters into isolated single atoms at low temperature and the consequences for co oxidation activity Angew. Chem. Int Ed. 62 2023 e202308002 10.1002/anie.202308002 Albrahim M.A., Shrotri A., Unocic R.R., Hoffman A.S., Bare S.R., Karim A.M., Size-Dependent Dispersion of Rhodium Clusters into Isolated Single Atoms at Low Temperature and the Consequences for CO Oxidation Activity, Angew Chem Int Ed 62 (2023) e202308002. https://doi.org/10.1002/anie.202308002. [68] S. Grimme Accurate description of van der Waals complexes by density functional theory including empirical corrections J. Comput. Chem. 25 2004 1463 1473 10.1002/jcc.20078 Grimme S., Accurate description of van der Waals complexes by density functional theory including empirical corrections, J Comput Chem 25 (2004) 1463–1473. https://doi.org/10.1002/jcc.20078. [69] G. Malta S.A. Kondrat S.J. Freakley C.J. Davies L. Lu S. Dawson A. Thetford E.K. Gibson D.J. Morgan W. Jones P.P. Wells P. Johnston C.R.A. Catlow C.J. Kiely G.J. Hutchings Identification of single-site gold catalysis in acetylene hydrochlorination Science 355 2017 1399 1403 10.1126/science.aal3439 Malta G., Kondrat S.A., Freakley S.J., Davies C.J., Lu L., Dawson S., Thetford A., Gibson E.K., Morgan D.J., Jones W., Wells P.P., Johnston P., Catlow C.R.A., Kiely C.J., Hutchings G.J., Identification of single-site gold catalysis in acetylene hydrochlorination, Science 355 (2017) 1399–1403. https://doi.org/10.1126/science.aal3439. [70] B. Wei X. Liu Q. Chang S. Li H. Luo K. Hua S. Zhang J. Chen Z. Shao C. Huang H. Wang Y. Sun Single-atom gold species within zeolite for efficient hydroformylation Chem. Catal. 2 2022 2066 2076 10.1016/j.checat.2022.06.008 Wei B., Liu X., Chang Q., Li S., Luo H., Hua K., Zhang S., Chen J., Shao Z., Huang C., Wang H., Sun Y., Single-atom gold species within zeolite for efficient hydroformylation, Chem Catalysis 2 (2022) 2066–2076. https://doi.org/10.1016/j.checat.2022.06.008. [71] A. Bedekovits L. Kollár T. Kégl Mechanistic investigation of platinum-catalysed hydroformylation of propene: a density functional study Inorg. Chim. Acta 363 2010 2029 2045 10.1016/j.ica.2009.12.013 Bedekovits A., Kollár L., Kégl T., Mechanistic investigation of platinum-catalysed hydroformylation of propene: A density functional study, Inorganica Chimica Acta 363 (2010) 2029–2045. https://doi.org/10.1016/j.ica.2009.12.013. [72] G. Wang T. Zhang W. Yu R. Si Y. Liu Z. Zhao Modulating location of single copper atoms in polymeric carbon nitride for enhanced photoredox catalysis ACS Catal. 10 2020 5715 5722 10.1021/acscatal.0c01099 Wang G., Zhang T., Yu W., Si R., Liu Y., Zhao Z., Modulating location of single copper atoms in polymeric carbon nitride for enhanced photoredox catalysis, ACS CATALYSIS 10 (2020) 5715–5722. https://doi.org/10.1021/acscatal.0c01099.",
      "scopus-id": "105002043921",
      "coredata": {
        "eid": "1-s2.0-S0926860X25001656",
        "dc:description": "Regulating the hydroformylation capacity of heterogeneous catalysts is essential for efficiently converting higher olefins into aldehydes. In this study, a magnetic single-atom rhodium-cobalt-based catalyst (RhCo SACs) was synthesised by modifying Fe3O4 with polymerised carbon nitride. Maintaining a constant metal single-atom loading, the catalytic activity in 1-dodecene hydroformylation was modulated by adjusting the type of N species in the support. The distribution of single atoms and valence states was characterised. At the same time, density functional theory (DFT) calculations were conducted to evaluate substrate binding energies and reaction-free energy barriers, providing insights into reaction mechanisms and pathways. The RhCo-pyridinic N configuration lowered the Gibbs free energy of the rate-determining and hydrogenation steps, enhancing substrate reaction activity. Compared to RhCo-graphitic N, RhCo-pyridinic N demonstrated superior performance, achieving a 1-dodecene conversion rate of 98.3 % and aldehyde selectivity of 98.6 %. Furthermore, the catalyst was magnetically recovered without loss of activity or mass and maintained stable performance over 10 reuse cycles. These findings present a novel and efficient strategy for the precise design of magnetic single-atom catalysts with potential practical applications in the hydroformylation of high-carbon olefins.",
        "openArchiveArticle": "false",
        "prism:coverDate": "2025-06-05",
        "openaccessUserLicense": null,
        "prism:aggregationType": "Journal",
        "prism:url": "https://api.elsevier.com/content/article/pii/S0926860X25001656",
        "dc:creator": [
          {
            "@_fa": "true",
            "$": "Cheng, Lu"
          },
          {
            "@_fa": "true",
            "$": "Ren, Xingtao"
          },
          {
            "@_fa": "true",
            "$": "Lu, Shiyao"
          },
          {
            "@_fa": "true",
            "$": "Gao, Dameng"
          },
          {
            "@_fa": "true",
            "$": "Yue, Jing"
          }
        ],
        "link": [
          {
            "@_fa": "true",
            "@rel": "self",
            "@href": "https://api.elsevier.com/content/article/pii/S0926860X25001656"
          },
          {
            "@_fa": "true",
            "@rel": "scidir",
            "@href": "https://www.sciencedirect.com/science/article/pii/S0926860X25001656"
          }
        ],
        "dc:format": "application/json",
        "openaccessType": null,
        "pii": "S0926-860X(25)00165-6",
        "prism:volume": "699",
        "articleNumber": "120264",
        "prism:publisher": "Elsevier B.V. All rights are reserved, including those for text and data mining, AI training, and similar technologies.",
        "dc:title": "Constructing magnetic single-atom catalysts with high activity and stability via an in situ nitrogen doping modulation strategy for the hydroformylation of 1-dodecene",
        "prism:copyright": "© 2025 Elsevier B.V. All rights are reserved, including those for text and data mining, AI training, and similar technologies.",
        "openaccess": "0",
        "prism:issn": "0926860X",
        "dcterms:subject": [
          {
            "@_fa": "true",
            "$": "Magnetic single-atom catalyst"
          },
          {
            "@_fa": "true",
            "$": "High-carbon olefin"
          },
          {
            "@_fa": "true",
            "$": "Hydroformylation"
          },
          {
            "@_fa": "true",
            "$": "Nitrogen doping"
          },
          {
            "@_fa": "true",
            "$": "Pyridine N"
          },
          {
            "@_fa": "true",
            "$": "Circular recycling"
          }
        ],
        "openaccessArticle": "false",
        "prism:publicationName": "Applied Catalysis A: General",
        "openaccessSponsorType": null,
        "prism:pageRange": "120264",
        "pubType": "fla",
        "prism:coverDisplayDate": "5 June 2025",
        "prism:doi": "10.1016/j.apcata.2025.120264",
        "prism:startingPage": "120264",
        "dc:identifier": "doi:10.1016/j.apcata.2025.120264",
        "openaccessSponsorName": null
      },
      "objects": {
        "object": [
          {
            "@category": "standard",
            "@height": "518",
            "@width": "565",
            "@_fa": "true",
            "$": "https://api.elsevier.com/content/object/eid/1-s2.0-S0926860X25001656-gr1.jpg?httpAccept=%2A%2F%2A",
            "@multimediatype": "JPEG image file",
            "@type": "IMAGE-DOWNSAMPLED",
            "@size": "92550",
            "@ref": "gr1",
            "@mimetype": "image/jpeg"
          },
          {
            "@category": "standard",
            "@height": "528",
            "@width": "796",
            "@_fa": "true",
            "$": "https://api.elsevier.com/content/object/eid/1-s2.0-S0926860X25001656-gr2.jpg?httpAccept=%2A%2F%2A",
            "@multimediatype": "JPEG image file",
            "@type": "IMAGE-DOWNSAMPLED",
            "@size": "97227",
            "@ref": "gr2",
            "@mimetype": "image/jpeg"
          },
          {
            "@category": "standard",
            "@height": "200",
            "@width": "349",
            "@_fa": "true",
            "$": "https://api.elsevier.com/content/object/eid/1-s2.0-S0926860X25001656-ga1.jpg?httpAccept=%2A%2F%2A",
            "@multimediatype": "JPEG image file",
            "@type": "IMAGE-DOWNSAMPLED",
            "@size": "24569",
            "@ref": "ga1",
            "@mimetype": "image/jpeg"
          },
          {
            "@category": "standard",
            "@height": "644",
            "@width": "796",
            "@_fa": "true",
            "$": "https://api.elsevier.com/content/object/eid/1-s2.0-S0926860X25001656-gr3.jpg?httpAccept=%2A%2F%2A",
            "@multimediatype": "JPEG image file",
            "@type": "IMAGE-DOWNSAMPLED",
            "@size": "96638",
            "@ref": "gr3",
            "@mimetype": "image/jpeg"
          },
          {
            "@category": "standard",
            "@height": "331",
            "@width": "791",
            "@_fa": "true",
            "$": "https://api.elsevier.com/content/object/eid/1-s2.0-S0926860X25001656-gr4.jpg?httpAccept=%2A%2F%2A",
            "@multimediatype": "JPEG image file",
            "@type": "IMAGE-DOWNSAMPLED",
            "@size": "52644",
            "@ref": "gr4",
            "@mimetype": "image/jpeg"
          },
          {
            "@category": "standard",
            "@height": "208",
            "@width": "796",
            "@_fa": "true",
            "$": "https://api.elsevier.com/content/object/eid/1-s2.0-S0926860X25001656-gr5.jpg?httpAccept=%2A%2F%2A",
            "@multimediatype": "JPEG image file",
            "@type": "IMAGE-DOWNSAMPLED",
            "@size": "49616",
            "@ref": "gr5",
            "@mimetype": "image/jpeg"
          },
          {
            "@category": "standard",
            "@height": "969",
            "@width": "678",
            "@_fa": "true",
            "$": "https://api.elsevier.com/content/object/eid/1-s2.0-S0926860X25001656-gr6.jpg?httpAccept=%2A%2F%2A",
            "@multimediatype": "JPEG image file",
            "@type": "IMAGE-DOWNSAMPLED",
            "@size": "134446",
            "@ref": "gr6",
            "@mimetype": "image/jpeg"
          },
          {
            "@category": "thumbnail",
            "@height": "164",
            "@width": "179",
            "@_fa": "true",
            "$": "https://api.elsevier.com/content/object/eid/1-s2.0-S0926860X25001656-gr1.sml?httpAccept=%2A%2F%2A",
            "@multimediatype": "GIF image file",
            "@type": "IMAGE-THUMBNAIL",
            "@size": "16653",
            "@ref": "gr1",
            "@mimetype": "image/gif"
          },
          {
            "@category": "thumbnail",
            "@height": "145",
            "@width": "219",
            "@_fa": "true",
            "$": "https://api.elsevier.com/content/object/eid/1-s2.0-S0926860X25001656-gr2.sml?httpAccept=%2A%2F%2A",
            "@multimediatype": "GIF image file",
            "@type": "IMAGE-THUMBNAIL",
            "@size": "12639",
            "@ref": "gr2",
            "@mimetype": "image/gif"
          },
          {
            "@category": "thumbnail",
            "@height": "126",
            "@width": "219",
            "@_fa": "true",
            "$": "https://api.elsevier.com/content/object/eid/1-s2.0-S0926860X25001656-ga1.sml?httpAccept=%2A%2F%2A",
            "@multimediatype": "GIF image file",
            "@type": "IMAGE-THUMBNAIL",
            "@size": "13515",
            "@ref": "ga1",
            "@mimetype": "image/gif"
          },
          {
            "@category": "thumbnail",
            "@height": "163",
            "@width": "202",
            "@_fa": "true",
            "$": "https://api.elsevier.com/content/object/eid/1-s2.0-S0926860X25001656-gr3.sml?httpAccept=%2A%2F%2A",
            "@multimediatype": "GIF image file",
            "@type": "IMAGE-THUMBNAIL",
            "@size": "10931",
            "@ref": "gr3",
            "@mimetype": "image/gif"
          },
          {
            "@category": "thumbnail",
            "@height": "92",
            "@width": "219",
            "@_fa": "true",
            "$": "https://api.elsevier.com/content/object/eid/1-s2.0-S0926860X25001656-gr4.sml?httpAccept=%2A%2F%2A",
            "@multimediatype": "GIF image file",
            "@type": "IMAGE-THUMBNAIL",
            "@size": "9028",
            "@ref": "gr4",
            "@mimetype": "image/gif"
          },
          {
            "@category": "thumbnail",
            "@height": "57",
            "@width": "219",
            "@_fa": "true",
            "$": "https://api.elsevier.com/content/object/eid/1-s2.0-S0926860X25001656-gr5.sml?httpAccept=%2A%2F%2A",
            "@multimediatype": "GIF image file",
            "@type": "IMAGE-THUMBNAIL",
            "@size": "5275",
            "@ref": "gr5",
            "@mimetype": "image/gif"
          },
          {
            "@category": "thumbnail",
            "@height": "163",
            "@width": "114",
            "@_fa": "true",
            "$": "https://api.elsevier.com/content/object/eid/1-s2.0-S0926860X25001656-gr6.sml?httpAccept=%2A%2F%2A",
            "@multimediatype": "GIF image file",
            "@type": "IMAGE-THUMBNAIL",
            "@size": "6622",
            "@ref": "gr6",
            "@mimetype": "image/gif"
          },
          {
            "@category": "high",
            "@height": "2286",
            "@width": "2495",
            "@_fa": "true",
            "$": "https://api.elsevier.com/content/object/eid/1-s2.0-S0926860X25001656-gr1_lrg.jpg?httpAccept=%2A%2F%2A",
            "@multimediatype": "JPEG image file",
            "@type": "IMAGE-HIGH-RES",
            "@size": "749904",
            "@ref": "gr1",
            "@mimetype": "image/jpeg"
          },
          {
            "@category": "high",
            "@height": "2336",
            "@width": "3525",
            "@_fa": "true",
            "$": "https://api.elsevier.com/content/object/eid/1-s2.0-S0926860X25001656-gr2_lrg.jpg?httpAccept=%2A%2F%2A",
            "@multimediatype": "JPEG image file",
            "@type": "IMAGE-HIGH-RES",
            "@size": "535786",
            "@ref": "gr2",
            "@mimetype": "image/jpeg"
          },
          {
            "@category": "high",
            "@height": "886",
            "@width": "1545",
            "@_fa": "true",
            "$": "https://api.elsevier.com/content/object/eid/1-s2.0-S0926860X25001656-ga1_lrg.jpg?httpAccept=%2A%2F%2A",
            "@multimediatype": "JPEG image file",
            "@type": "IMAGE-HIGH-RES",
            "@size": "209088",
            "@ref": "ga1",
            "@mimetype": "image/jpeg"
          },
          {
            "@category": "high",
            "@height": "2853",
            "@width": "3525",
            "@_fa": "true",
            "$": "https://api.elsevier.com/content/object/eid/1-s2.0-S0926860X25001656-gr3_lrg.jpg?httpAccept=%2A%2F%2A",
            "@multimediatype": "JPEG image file",
            "@type": "IMAGE-HIGH-RES",
            "@size": "501564",
            "@ref": "gr3",
            "@mimetype": "image/jpeg"
          },
          {
            "@category": "high",
            "@height": "1463",
            "@width": "3493",
            "@_fa": "true",
            "$": "https://api.elsevier.com/content/object/eid/1-s2.0-S0926860X25001656-gr4_lrg.jpg?httpAccept=%2A%2F%2A",
            "@multimediatype": "JPEG image file",
            "@type": "IMAGE-HIGH-RES",
            "@size": "282678",
            "@ref": "gr4",
            "@mimetype": "image/jpeg"
          },
          {
            "@category": "high",
            "@height": "920",
            "@width": "3525",
            "@_fa": "true",
            "$": "https://api.elsevier.com/content/object/eid/1-s2.0-S0926860X25001656-gr5_lrg.jpg?httpAccept=%2A%2F%2A",
            "@multimediatype": "JPEG image file",
            "@type": "IMAGE-HIGH-RES",
            "@size": "274664",
            "@ref": "gr5",
            "@mimetype": "image/jpeg"
          },
          {
            "@category": "high",
            "@height": "4280",
            "@width": "2994",
            "@_fa": "true",
            "$": "https://api.elsevier.com/content/object/eid/1-s2.0-S0926860X25001656-gr6_lrg.jpg?httpAccept=%2A%2F%2A",
            "@multimediatype": "JPEG image file",
            "@type": "IMAGE-HIGH-RES",
            "@size": "761560",
            "@ref": "gr6",
            "@mimetype": "image/jpeg"
          },
          {
            "@category": "standard",
            "@_fa": "true",
            "$": "https://api.elsevier.com/content/object/eid/1-s2.0-S0926860X25001656-mmc1.docx?httpAccept=%2A%2F%2A",
            "@multimediatype": "Microsoft Word file",
            "@type": "APPLICATION",
            "@size": "2586115",
            "@ref": "mmc1",
            "@mimetype": "application/word"
          },
          {
            "@category": "thumbnail",
            "@_fa": "true",
            "$": "https://api.elsevier.com/content/object/eid/1-s2.0-S0926860X25001656-si0001.svg?httpAccept=%2A%2F%2A",
            "@multimediatype": "Scalable Vector Graphics file",
            "@type": "ALTIMG",
            "@size": "3403",
            "@ref": "si0001",
            "@mimetype": "image/svg+xml"
          },
          {
            "@category": "thumbnail",
            "@_fa": "true",
            "$": "https://api.elsevier.com/content/object/eid/1-s2.0-S0926860X25001656-si0002.svg?httpAccept=%2A%2F%2A",
            "@multimediatype": "Scalable Vector Graphics file",
            "@type": "ALTIMG",
            "@size": "1815",
            "@ref": "si0002",
            "@mimetype": "image/svg+xml"
          },
          {
            "@category": "thumbnail",
            "@_fa": "true",
            "$": "https://api.elsevier.com/content/object/eid/1-s2.0-S0926860X25001656-si0003.svg?httpAccept=%2A%2F%2A",
            "@multimediatype": "Scalable Vector Graphics file",
            "@type": "ALTIMG",
            "@size": "1243",
            "@ref": "si0003",
            "@mimetype": "image/svg+xml"
          },
          {
            "@category": "thumbnail",
            "@_fa": "true",
            "$": "https://api.elsevier.com/content/object/eid/1-s2.0-S0926860X25001656-si0004.svg?httpAccept=%2A%2F%2A",
            "@multimediatype": "Scalable Vector Graphics file",
            "@type": "ALTIMG",
            "@size": "1665",
            "@ref": "si0004",
            "@mimetype": "image/svg+xml"
          },
          {
            "@category": "thumbnail",
            "@_fa": "true",
            "$": "https://api.elsevier.com/content/object/eid/1-s2.0-S0926860X25001656-si0005.svg?httpAccept=%2A%2F%2A",
            "@multimediatype": "Scalable Vector Graphics file",
            "@type": "ALTIMG",
            "@size": "2293",
            "@ref": "si0005",
            "@mimetype": "image/svg+xml"
          },
          {
            "@category": "thumbnail",
            "@_fa": "true",
            "$": "https://api.elsevier.com/content/object/eid/1-s2.0-S0926860X25001656-si0006.svg?httpAccept=%2A%2F%2A",
            "@multimediatype": "Scalable Vector Graphics file",
            "@type": "ALTIMG",
            "@size": "1235",
            "@ref": "si0006",
            "@mimetype": "image/svg+xml"
          },
          {
            "@category": "thumbnail",
            "@_fa": "true",
            "$": "https://api.elsevier.com/content/object/eid/1-s2.0-S0926860X25001656-si0007.svg?httpAccept=%2A%2F%2A",
            "@multimediatype": "Scalable Vector Graphics file",
            "@type": "ALTIMG",
            "@size": "1219",
            "@ref": "si0007",
            "@mimetype": "image/svg+xml"
          }
        ]
      },
      "link": {
        "@rel": "abstract",
        "@href": "https://api.elsevier.com/content/abstract/scopus_id/105002043921"
      }
    }
  }
}