{
  "metadata": {
    "title": "Carbon nitride doped V<ce:inf loc=post><ce:italic>x</ce:italic></ce:inf>O<ce:inf loc=post><ce:italic>y</ce:italic></ce:inf>/SBA-15 as highly efficient catalysts for the oxidation of ethyl lactate to ethyl pyruvate",
    "authors": "; ; ",
    "journal": "Applied Catalysis A: General",
    "date": "2024-02-05",
    "doi": "10.1016/j.apcata.2024.119577",
    "abstract": "",
    "uri": "https://api.elsevier.com/content/article/pii/S0926860X24000218",
    "pii": "S0926860X24000218"
  },
  "fulltext": {
    "full-text-retrieval-response": {
      "scopus-eid": "2-s2.0-85184506175",
      "originalText": "serial JL 271346 291210 291744 291809 31 Applied Catalysis A: General APPLIEDCATALYSISAGENERAL 2024-01-19 2024-01-19 2024-01-22 2024-01-22 2024-02-07T08:53:17 1-s2.0-S0926860X24000218 S0926-860X(24)00021-8 S0926860X24000218 10.1016/j.apcata.2024.119577 S300 S300.1 FULL-TEXT 1-s2.0-S0926860X23X00222 2024-03-05T05:48:43.423945Z 0 0 20240205 2024 2024-01-19T04:15:57.492421Z absattachment articleinfo articlenumber articletitlenorm authfirstinitialnorm authfirstsurnamenorm cid cids contenttype copyright crossmark dateloaded dateloadedtxt datesearch datesort dateupdated dco docsubtype doctype doi eid ewtransactionid hubeid indexeddate issn issnnorm itemstage itemtransactionid itemweight openaccess openarchive pg pgfirst pii piinorm pubdatestart pubdatetxt pubyr sortorder srctitle srctitlenorm srctype ssids alllist content subj subheadings suppl tomb volfirst volissue volumelist webpdf webpdfpagecount yearnav figure table e-component body acknowledge affil appendices articletitle auth authfirstini authfull authkeywords authlast footnotes grantnumber grantsponsor grantsponsorid highlightsabst orcid primabst ref specialabst 0926-860X 0926860X true 671 671 C Volume 671 6 119577 119577 119577 20240205 5 February 2024 2024-02-05 2024 article fla © 2024 Elsevier B.V. All rights reserved. CARBONNITRIDEDOPEDVXOYSBA15HIGHLYEFFICIENTCATALYSTSFOROXIDATIONETHYLLACTATEETHYLPYRUVATE LIU Z 1 Introduction 2 Experimental 2.1 Catalyst preparation 2.2 Catalyst characterization 2.3 Catalytic reaction 3 Results and discussion 3.1 Materials Characterization 3.1.1 Structural characterization 3.1.2 Redox properties 3.2 Catalytic performance 3.2.1 Activity evaluation of different catalysts 3.2.2 Effect of reaction parameters 3.2.3 Reusability of the catalyst 3.2.4 Effect of additives and the catalytic mechanism 4 Conclusion CRediT authorship contribution statement Acknowledgments Appendix A Supplementary material References CHHEDA 2007 7164 7183 J LIU 2020 111098 Z YAN 2020 17417 17428 B YAN 2017 538 550 B LU 2023 8624 8632 S HUANG 2023 302 313 Y WANG 2016 2739 2744 Y MURLYKINA 2015 4481 4492 M SUGIYAMA 1991 12 18 S LU 2023 122329 S CHU 2021 14397 14409 Y WANG 2020 96 101 D LU 2018 1287 1296 T ZHANG 2018 1866 1873 W ZHANG 2023 113066 Y ZHANG 2013 1593 P SLOT 2016 12307 12311 T XU 2023 5582 5591 J LIU 2023 13196 13207 Z LIU 2024 129631 Z WEI 2015 145 148 Y CHEN 2010 196 205 S LIU 2022 1875 1884 Z WU 2022 118677 F YU 2023 119432 L BOJDYS 2008 8177 8182 M LIU 2022 4883 4900 N VERMA 2016 1094 1098 S WANG 2015 3602 3610 C SHEN 2023 3864 3874 Z PONGTHAWORNSAKUN 2018 1414 1423 B GUO 2010 439 445 H BOSCH 1984 2479 2488 H KORANNE 1994 369 377 M LIU 2004 417 428 Y PENA 2001 155 164 M XU 2009 354 360 J DOKE 2019 117246 D ZHANG 2018 2365 2374 W CHIZARI 2010 72 80 K TAO 2020 117813 L LIU 2020 197 X LU 2022 211 220 S LU 2022 103 111 T WU 2020 16200 16207 J HAYASHI 1993 207 217 H ZHANG 2019 3381 3387 W JU 2019 1281 Y WANG 2023 1 14 R VERMA 2016 2333 2336 S LIUX2024X119577 LIUX2024X119577XZ 2026-01-22T00:00:00.000Z 2026-01-22T00:00:00.000Z http://creativecommons.org/licenses/by-nc-nd/4.0/ © 2024 Elsevier B.V. All rights reserved. 2024-02-11T04:25:54.814Z http://vtw.elsevier.com/data/voc/AddOnTypes/50.7/aggregated-refined Foundation of Social Development of Changzhou CE20225063 Jiangsu Province Engineering Research Center of Biodegradable Materials KF2305 NERC Biomass of Changzhou University Shiyanjia Lab National Natural Science Foundation of China 22278041 22302016 NSFC National Natural Science Foundation of China http://data.elsevier.com/vocabulary/SciValFunders/501100001809 http://sws.geonames.org/1814991/ Tsinghua University THU Tsinghua University http://data.elsevier.com/vocabulary/SciValFunders/501100004147 http://sws.geonames.org/1814991/ This work was supported by the National Natural Science Foundation of China ( 22302016 , and 22278041 ), the Foundation of Social Development of Changzhou ( CE20225063 ), the Jiangsu Province Engineering Research Center of Biodegradable Materials ( KF2305 ), and the Open Fund of the Key Lab of Organic Optoelectronics &amp; Molecular Engineering. We would like to thank Yi Li and Kang Li (Tsinghua University) for assistance with O 2 -TPD and H 2 -TPR measurements, respectively. We thank the Shiyanjia Lab ( www.shiyanjia.com ) for the XPS characterization. We also thank the Analysis and Testing Center, NERC Biomass of Changzhou University for other characterization. This work was supported by the National Natural Science Foundation of China (22302016, and 22278041), the Foundation of Social Development of Changzhou (CE20225063), the Jiangsu Province Engineering Research Center of Biodegradable Materials (KF2305), and the Open Fund of the Key Lab of Organic Optoelectronics &amp; Molecular Engineering. We would like to thank Yi Li and Kang Li (Tsinghua University) for assistance with O2-TPD and H2-TPR measurements, respectively. We thank the Shiyanjia Lab (www.shiyanjia.com) for the XPS characterization. We also thank the Analysis and Testing Center, NERC Biomass of Changzhou University for other characterization. The Supporting Information is available free of charge at https://pubs.acs.org/doi/. Preparation of SBA-15; detailed characterization methods; Catalyst characterization results of XPS; The effect of reaction time on the wVxOy/CN-SBA-15 (w=0.5–4.8) catalytic performance, and the effect of solvent on the catalytic performance of 2.6VxOy/CN-SBA-15. https://doi.org/10.15223/policy-017 https://doi.org/10.15223/policy-037 https://doi.org/10.15223/policy-012 https://doi.org/10.15223/policy-029 https://doi.org/10.15223/policy-004 item S0926-860X(24)00021-8 S0926860X24000218 1-s2.0-S0926860X24000218 10.1016/j.apcata.2024.119577 271346 2024-03-05T05:48:43.423945Z 2024-02-05 1-s2.0-S0926860X24000218-main.pdf https://s3-eu-west-1.amazonaws.com/prod-ucs-content-store-eu-west/content/pii:S0926860X24000218/MAIN/application/pdf/5405ad882bc2b5bf4afc219f1f98159d/main.pdf main.pdf pdf true 5387295 MAIN 11 1-s2.0-S0926860X24000218-main_1.png https://s3-eu-west-1.amazonaws.com/prod-ucs-content-store-eu-west/content/pii:S0926860X24000218/PREVIEW/image/png/ac583e69a876251c5a63982edc9aeaa5/main_1.png main_1.png png 55628 849 656 IMAGE-WEB-PDF 1 1-s2.0-S0926860X24000218-gr6.jpg https://s3-eu-west-1.amazonaws.com/prod-ucs-content-store-eu-west/content/pii:S0926860X24000218/gr6/DOWNSAMPLED/image/jpeg/df5cca8ec4d5b88f6d2859ddd1d51f7d/gr6.jpg gr6 gr6.jpg jpg 146411 624 678 IMAGE-DOWNSAMPLED 1-s2.0-S0926860X24000218-gr7.jpg https://s3-eu-west-1.amazonaws.com/prod-ucs-content-store-eu-west/content/pii:S0926860X24000218/gr7/DOWNSAMPLED/image/jpeg/09d7b2a818b00800caac62b2e0f88c0e/gr7.jpg gr7 gr7.jpg jpg 32017 277 678 IMAGE-DOWNSAMPLED 1-s2.0-S0926860X24000218-gr4.jpg https://s3-eu-west-1.amazonaws.com/prod-ucs-content-store-eu-west/content/pii:S0926860X24000218/gr4/DOWNSAMPLED/image/jpeg/e70658604cad5a21331fc9e5eb714eab/gr4.jpg gr4 gr4.jpg jpg 12344 323 395 IMAGE-DOWNSAMPLED 1-s2.0-S0926860X24000218-gr5.jpg https://s3-eu-west-1.amazonaws.com/prod-ucs-content-store-eu-west/content/pii:S0926860X24000218/gr5/DOWNSAMPLED/image/jpeg/19511a8f23274069db74a176d1a7c327/gr5.jpg gr5 gr5.jpg jpg 77699 725 678 IMAGE-DOWNSAMPLED 1-s2.0-S0926860X24000218-gr8.jpg https://s3-eu-west-1.amazonaws.com/prod-ucs-content-store-eu-west/content/pii:S0926860X24000218/gr8/DOWNSAMPLED/image/jpeg/f60f3cd220a5065e0edb611fe55da261/gr8.jpg gr8 gr8.jpg jpg 45522 420 508 IMAGE-DOWNSAMPLED 1-s2.0-S0926860X24000218-sc1.jpg https://s3-eu-west-1.amazonaws.com/prod-ucs-content-store-eu-west/content/pii:S0926860X24000218/sc1/DOWNSAMPLED/image/jpeg/99f7dd8825c6419ab43ee2b191e0891a/sc1.jpg sc1 sc1.jpg jpg 73054 637 678 IMAGE-DOWNSAMPLED 1-s2.0-S0926860X24000218-gr2.jpg https://s3-eu-west-1.amazonaws.com/prod-ucs-content-store-eu-west/content/pii:S0926860X24000218/gr2/DOWNSAMPLED/image/jpeg/e6be80f220c7bb5f37b9022b76a97620/gr2.jpg gr2 gr2.jpg jpg 114099 509 678 IMAGE-DOWNSAMPLED 1-s2.0-S0926860X24000218-ga1.jpg https://s3-eu-west-1.amazonaws.com/prod-ucs-content-store-eu-west/content/pii:S0926860X24000218/ga1/DOWNSAMPLED/image/jpeg/68b07425907551b20fb002ade8981766/ga1.jpg ga1 true ga1.jpg jpg 27736 200 412 IMAGE-DOWNSAMPLED 1-s2.0-S0926860X24000218-gr3.jpg https://s3-eu-west-1.amazonaws.com/prod-ucs-content-store-eu-west/content/pii:S0926860X24000218/gr3/DOWNSAMPLED/image/jpeg/9050d0fc887d477c4b28fd3b9c2ab984/gr3.jpg gr3 gr3.jpg jpg 49296 306 678 IMAGE-DOWNSAMPLED 1-s2.0-S0926860X24000218-gr1.jpg https://s3-eu-west-1.amazonaws.com/prod-ucs-content-store-eu-west/content/pii:S0926860X24000218/gr1/DOWNSAMPLED/image/jpeg/5eb934c4bc3cd3885f16ed83c1cc7295/gr1.jpg gr1 gr1.jpg jpg 150826 589 781 IMAGE-DOWNSAMPLED 1-s2.0-S0926860X24000218-gr6.sml https://s3-eu-west-1.amazonaws.com/prod-ucs-content-store-eu-west/content/pii:S0926860X24000218/gr6/THUMBNAIL/image/gif/4ea273fd9549dd946fe17f65404732ad/gr6.sml gr6 gr6.sml sml 11185 164 178 IMAGE-THUMBNAIL 1-s2.0-S0926860X24000218-gr7.sml https://s3-eu-west-1.amazonaws.com/prod-ucs-content-store-eu-west/content/pii:S0926860X24000218/gr7/THUMBNAIL/image/gif/c0d11f7c47046010f1db4acce90cb54e/gr7.sml gr7 gr7.sml sml 4968 90 219 IMAGE-THUMBNAIL 1-s2.0-S0926860X24000218-gr4.sml https://s3-eu-west-1.amazonaws.com/prod-ucs-content-store-eu-west/content/pii:S0926860X24000218/gr4/THUMBNAIL/image/gif/06e291d98a71bbe64d632e1b8d93e6c2/gr4.sml gr4 gr4.sml sml 3546 164 200 IMAGE-THUMBNAIL 1-s2.0-S0926860X24000218-gr5.sml https://s3-eu-west-1.amazonaws.com/prod-ucs-content-store-eu-west/content/pii:S0926860X24000218/gr5/THUMBNAIL/image/gif/fb0e2e730aeb110d16def453b1dc0efd/gr5.sml gr5 gr5.sml sml 5706 164 153 IMAGE-THUMBNAIL 1-s2.0-S0926860X24000218-gr8.sml https://s3-eu-west-1.amazonaws.com/prod-ucs-content-store-eu-west/content/pii:S0926860X24000218/gr8/THUMBNAIL/image/gif/e2013afee40edd4d2c51a0011bea5779/gr8.sml gr8 gr8.sml sml 9393 164 198 IMAGE-THUMBNAIL 1-s2.0-S0926860X24000218-sc1.sml https://s3-eu-west-1.amazonaws.com/prod-ucs-content-store-eu-west/content/pii:S0926860X24000218/sc1/THUMBNAIL/image/gif/2eadbc44502da8610e58495b1d42f2b4/sc1.sml sc1 sc1.sml sml 10591 163 174 IMAGE-THUMBNAIL 1-s2.0-S0926860X24000218-gr2.sml https://s3-eu-west-1.amazonaws.com/prod-ucs-content-store-eu-west/content/pii:S0926860X24000218/gr2/THUMBNAIL/image/gif/8151afe251d026cef1a9bf42666b1244/gr2.sml gr2 gr2.sml sml 23162 164 218 IMAGE-THUMBNAIL 1-s2.0-S0926860X24000218-ga1.sml https://s3-eu-west-1.amazonaws.com/prod-ucs-content-store-eu-west/content/pii:S0926860X24000218/ga1/THUMBNAIL/image/gif/ba20d7638e280fda7e2a2d4fd99779da/ga1.sml ga1 true ga1.sml sml 11414 106 219 IMAGE-THUMBNAIL 1-s2.0-S0926860X24000218-gr3.sml https://s3-eu-west-1.amazonaws.com/prod-ucs-content-store-eu-west/content/pii:S0926860X24000218/gr3/THUMBNAIL/image/gif/d53648b7a00702f88b97f409ac632d29/gr3.sml gr3 gr3.sml sml 6012 99 219 IMAGE-THUMBNAIL 1-s2.0-S0926860X24000218-gr1.sml https://s3-eu-west-1.amazonaws.com/prod-ucs-content-store-eu-west/content/pii:S0926860X24000218/gr1/THUMBNAIL/image/gif/151d56b1817ddaddc81caf5323a95750/gr1.sml gr1 gr1.sml sml 15215 164 217 IMAGE-THUMBNAIL 1-s2.0-S0926860X24000218-gr6_lrg.jpg https://s3-eu-west-1.amazonaws.com/prod-ucs-content-store-eu-west/content/pii:S0926860X24000218/HIGHRES/image/jpeg/002f62b603c4e5b05d494cb645cc961a/gr6_lrg.jpg gr6 gr6_lrg.jpg jpg 1284505 2754 2994 IMAGE-HIGH-RES 1-s2.0-S0926860X24000218-gr7_lrg.jpg https://s3-eu-west-1.amazonaws.com/prod-ucs-content-store-eu-west/content/pii:S0926860X24000218/HIGHRES/image/jpeg/27c83e768552d76be20de8b1d9e8a7a5/gr7_lrg.jpg gr7 gr7_lrg.jpg jpg 179233 1224 2994 IMAGE-HIGH-RES 1-s2.0-S0926860X24000218-gr4_lrg.jpg https://s3-eu-west-1.amazonaws.com/prod-ucs-content-store-eu-west/content/pii:S0926860X24000218/HIGHRES/image/jpeg/51635a73369209077f544aa9d1679f0d/gr4_lrg.jpg gr4 gr4_lrg.jpg jpg 74372 1429 1746 IMAGE-HIGH-RES 1-s2.0-S0926860X24000218-gr5_lrg.jpg https://s3-eu-west-1.amazonaws.com/prod-ucs-content-store-eu-west/content/pii:S0926860X24000218/HIGHRES/image/jpeg/14f1a9eb6f374dbba69ca1b65e4f4b45/gr5_lrg.jpg gr5 gr5_lrg.jpg jpg 475835 3202 2994 IMAGE-HIGH-RES 1-s2.0-S0926860X24000218-gr8_lrg.jpg https://s3-eu-west-1.amazonaws.com/prod-ucs-content-store-eu-west/content/pii:S0926860X24000218/HIGHRES/image/jpeg/49a82b13321de8f5f156cb0faff610a4/gr8_lrg.jpg gr8 gr8_lrg.jpg jpg 262575 1857 2245 IMAGE-HIGH-RES 1-s2.0-S0926860X24000218-sc1_lrg.jpg https://s3-eu-west-1.amazonaws.com/prod-ucs-content-store-eu-west/content/pii:S0926860X24000218/HIGHRES/image/jpeg/73c02376ed7cf17c811e8d041b17c02e/sc1_lrg.jpg sc1 sc1_lrg.jpg jpg 328807 2812 2994 IMAGE-HIGH-RES 1-s2.0-S0926860X24000218-gr2_lrg.jpg https://s3-eu-west-1.amazonaws.com/prod-ucs-content-store-eu-west/content/pii:S0926860X24000218/HIGHRES/image/jpeg/9d1e8720d58da5084f6f4e49447021e2/gr2_lrg.jpg gr2 gr2_lrg.jpg jpg 598358 2246 2994 IMAGE-HIGH-RES 1-s2.0-S0926860X24000218-ga1_lrg.jpg https://s3-eu-west-1.amazonaws.com/prod-ucs-content-store-eu-west/content/pii:S0926860X24000218/HIGHRES/image/jpeg/2c056814751926520704a1b982ac8eae/ga1_lrg.jpg ga1 true ga1_lrg.jpg jpg 208643 886 1824 IMAGE-HIGH-RES 1-s2.0-S0926860X24000218-gr3_lrg.jpg https://s3-eu-west-1.amazonaws.com/prod-ucs-content-store-eu-west/content/pii:S0926860X24000218/HIGHRES/image/jpeg/9c592fd088383a2e4cac3a94e8f50681/gr3_lrg.jpg gr3 gr3_lrg.jpg jpg 320861 1351 2994 IMAGE-HIGH-RES 1-s2.0-S0926860X24000218-gr1_lrg.jpg https://s3-eu-west-1.amazonaws.com/prod-ucs-content-store-eu-west/content/pii:S0926860X24000218/HIGHRES/image/jpeg/612bc64f30239abfa6c4601d454e03b6/gr1_lrg.jpg gr1 gr1_lrg.jpg jpg 978270 2608 3457 IMAGE-HIGH-RES 1-s2.0-S0926860X24000218-mmc1.doc https://s3-eu-west-1.amazonaws.com/prod-ucs-content-store-eu-west/content/pii:S0926860X24000218/mmc1/MAIN/application/msword/70bfeda6ae9df9fb692befc9f8545b5d/mmc1.doc mmc1 mmc1.doc doc 77824 APPLICATION 1-s2.0-S0926860X24000218-am.pdf am am.pdf pdf 910393 AAM-PDF https://s3-eu-west-1.amazonaws.com/prod-ucs-content-store-eu-west/content/egi:10HMGX3FWHH/MAIN/application/pdf/b1076fec5b4ed729111e4db41dfc3f64/am.pdf APCATA 119577 119577 S0926-860X(24)00021-8 10.1016/j.apcata.2024.119577 Elsevier B.V. Fig. 1 The XRD patterns (a), N2 adsorption–desorption isotherms (b), pore size distributions (c), FTIR spectra (d), XPS survey scan (e), and V 2p 3/2 XPS spectra of the prepared samples. Fig. 1 Fig. 2 SEM image of SBA-15 (a), CN-SBA-15 (b), 0.5 VxOy/CN-SBA-15 (c), 2.6 VxOy/CN-SBA-15 (d). Fig. 2 Fig. 3 The O2-TPD (a) and H2-TPR (b) spectra of the V2O5, V x O y /SBA-15 and V x O y /CN-SBA-15 catalysts. Fig. 3 Fig. 4 The relationship between TOF and V4+/(V4++V5+). Fig. 4 Fig. 5 Effect of reaction temperature and time on EL conversion (a) and EP yield (b) over 2.6 V x O y /CN-SBA-15. The first-order kinetic fit for the EL reaction at different temperatures (c) and Arrhenius plots (d). Other conditions: 2 mmol EL, 15 mL acetonitrile, 50 mg catalyst, under 0.8 MPa O2. Fig. 5 Fig. 6 Effect of mass ratio of CN to SBA-15 (a), calcination temperature (b), atmosphere (c), and catalyst weight (d) on the catalytic performance of 2.6 V x O y /CN-SBA-15 catalyst. Other conditions: 2 mmol EL, 15 mL acetonitrile, 50 mg catalyst, under 0.8 MPa O2, reaction temperature 130 °C, reaction time 3 h. Fig. 6 Fig. 7 The recyclability results (a) and hot filtration test (b) on the catalytic performance of the 2.6 V x O y /CN-SBA-15 catalyst. Conditions: 2 mmol EL, 15 mL diethyl succinate, 50 mg catalyst, 0.8 MPa O2, 130 °C, 3 h. Fig. 7 Fig. 8 Effect of pyridine and pyrrole on the catalytic performance of the 2.7 V x O y /SBA-15 catalyst. Reaction conditions: 2 mmol EL, 15 mL acetonitrile, 50 mg catalyst, under 0.8 MPa O2, reaction temperature 130 °C, reaction time 2 h. Fig. 8 Scheme 1 The proposed catalytic mechanism for the oxidation of EL to EP over V x O y /CN-SBA-15. Scheme 1 Table 1 Textural properties and composition of the prepared samples. Table 1 Catalyst V loading(wt%)[a] BET surface area(m2 g−1) Pore volume(cm3 g−1) Pore diameter(nm) V4+/ (V4++V5+) SBA-15 - 607 1.06 9.54 - CN/SBA-15 - 534 0.99 9.53 - 2.7 V x O y /CN - 19 0.05 2.47 - 2.7 V x O y /SBA-15 2.65 535 0.98 9.42 0.12 0.5 V x O y /CN-SBA-15 0.52 603 1.1 9.52 0.43 1.0 V x O y /CN-SBA-15 1.04 569 1.05 9.46 0.52 2.6 V x O y /CN-SBA-15 2.61 553 0.99 9.61 0.39 4.8 V x O y /CN-SBA-15 4.84 456 0.86 9.06 0.33 [a] determined by ICP Table 2 The redox properties of the prepared catalysts. Table 2 Sample O2-TPD H2-TPR Peak temperature (°C) O2 desorption (mmol/gcat) Peak temperature (°C) H2 consumption (mmol/gcat) V2O5 150, 740 0.6 685, 786, 894 5.7 2.7 V x O y /SBA-15 121, 730 5.9 572 0.36 2.6 V x O y /CN-SBA-15 135, 675 9.1 573 0.54 Table 3 Catalytic performance of prepared catalysts in the oxidation of EL[a]. Table 3 Catalyst EL conversion (%) EP selectivity (%) EP yield (%) TOF[b] (h−1) CN-SBA-15 - - - - V2O5 30.5 97.3 34.5 0.4 2.7 V x O y /CN 27.3 98.3 26.8 6.9 2.7 V x O y /SBA-15 61.6 (12.0) 94.8 (90.2) 58.4 (10.8) 18.1 0.5 V x O y /CN-SBA-15 26.8 (2.5) 97.0 (90.1) 26.0 (2.2) 20.1 1 V x O y /CN-SBA-15 62.2 (6.2) 98.2 (92.2) 61.1 (5.7) 25.1 2.6 V x O y /CN-SBA-15 93.0 (13.6) 98.7 (97.0) 91.8 (13.2) 21.3 4.8 V x O y /CN-SBA-15 99.8 (24.8) 96.9 (96.9) 96.8 (24.0) 21.1 [a] Reaction conditions: 2 mmol EL, 15 mL acetonitrile, 50 mg catalyst, under 0.8 MPa O2, reaction temperature 130 °C, reaction time 3 h (data outside the bracket) and 0.5 h (data in the bracket). [b] TOF was calculated as moles of EL consumed/moles of V/time (0.5 h for 2.7 V x O y /SBA-15 and V x O y /CN-SBA-15, and 3 h for V2O5 and 2.7 V x O y /CN). Table 4 Comparison of the catalytic performance of 2.6 V x O y /CN-SBA-15 and other reported catalysts for the EL to EP reaction in the presence of molecular oxygen. Table 4 Catalyst Temp. (℃) Time (h) Conv. (%) Sel. (%) Reference VO x /P4V4 130 8 84 90 [14] VO x /C 130 4 34 84 [14] NH4VO3 @VTN (0.6 wt%V) 130 4 35 89 [39] Na-OMS-2-2.5 mol% 50 12 78 95 [41] V2O5/g‑C3N4 130 4 96 86 [45] SnO2-MoO3 130 5 62 80 [46] V-NCNs 130 9 95 85 [47] Zn(NO3)2/VOC2O4 80 4 98 98 [48] 5.9 V x O y /SBA-15 130 4 96 99 [18] 2.6 V x O y /CN-SBA-15 130 3 93 99 This work Carbon nitride doped V x O y /SBA-15 as highly efficient catalysts for the oxidation of ethyl lactate to ethyl pyruvate Zonghui Liu Writing – original draft Supervision Conceptualization a 1 Jing Xu Investigation Formal analysis Conceptualization a Chao Cai Validation Investigation a Jiahao Cai Investigation a Qiaoling Dai Validation b Mingyang Du Investigation a Zhe Wen Validation a Bing Yan Validation a Bing Xue Supervision a ⁎ 2 a Jiangsu Key Laboratory of Advanced Catalytic Materials and Technology, School of Petrochemical Engineering, Changzhou University, Changzhou 213164, Jiangsu, China Jiangsu Key Laboratory of Advanced Catalytic Materials and Technology, School of Petrochemical Engineering, Changzhou University Changzhou Jiangsu 213164 China Jiangsu Key Laboratory of Advanced Catalytic Materials and Technology, School of Petrochemical Engineering, Changzhou University, Changzhou 213164, Jiangsu, China b Sinopec Research Institute of Petroleum Processing, 18 Xueyuan Road, Beijing 100083, China Sinopec Research Institute of Petroleum Processing 18 Xueyuan Road Beijing 100083 China Sinopec Research Institute of Petroleum Processing, 18 Xueyuan Road, Beijing 100083, PR China ⁎ Corresponding author. 1 ORCID: 0000-0002-7253-3960 2 ORCID: 0000-0001-6740-4665; Development of high-performance heterogeneous catalysts for the selective oxidation of ethyl lactate (EL) to ethyl pyruvate (EP) is very important in the field of sustainable chemistry. In this work, a series of carbon nitride (CN) doped wV x O y /CN-SBA-15 (w = 0.5–4.8%) catalysts were prepared. The doping of CN could significantly enhance the activity of V x O y /CN-SBA-15 catalyst due to the synergistic effect of V species, CN and SBA-15. The 2.6 V x O y /CN-SBA-15 was identified as the most optimum catalyst, offering a high EL conversion (93.0%) and EP selectivity (98.7%) at 130 °C after 3 h of reaction. The O2-TPD and H2-TPR results confirmed that the redox properties of 2.6 V x O y /CN-SBA-15 are significantly improved compared with 2.7 V x O y /SBA-15, which plays an important role in the oxidation reaction. In addition, the control experiments indicated that the pyridinic-N rather than pyrrolic-N of the VxOy/CN-SBA-15 catalyst accelerated the oxidation of EL to EP. Graphical Abstract ga1 Keywords Ethyl lactate Ethyl pyruvate Oxidation reaction Carbon nitride Vanadia Data availability Data will be made available on request. 1 Introduction Catalytic conversion of biomass platform molecular into value-added chemicals and liquid fuels is one of the effective ways to replace the current production of chemicals using fossil energy as the feedstock [1]. For example, lactic acid and lactate as important biomass platform molecules could be easily obtained through the fermentation of biomass resources (cellulose, starch, sugars, and glycerol, etc.), which can be further converted to many fine chemicals such as acrylic acid, acrylate, lactide, and pyruvate [2–6]. Among them, pyruvate as an important chemical intermediate has been widely used in food additives, plastics, drugs, and other fields, and thus obtained much attention [7,8]. Commercially, pyruvate is mainly produced by the dehydration and decarboxylation of tartaric acid, in which a large amount of KHSO4 is required as a dehydrating agent, resulting in environmental pollution [9]. Direct catalytic oxidation of lactate to pyruvate is one of the most promising methods. In addition, the structure of lactate is similar to that of pyruvate and thus has a higher atomic efficiency by this oxidation route. The production of pyruvate by oxidative dehydrogenation of lactate has been widely reported in both gas-phase and liquid-phase reactions over various solid catalysts. Very recently, Lu et al. [10] prepared a Cu/SiO2-HP (hydrolysis–precipitation method) catalyst with highly dispersed Cu nanoparticles for the gas-phase oxidation of ethyl lactate (EL) to ethyl pyruvate (EP), an 85.4% EL conversion and 91.1% EP selectivity was obtained at 320 °C under O2-free conditions. The synergistic effect of the Cu0/Cu+ interface activates the O-H and C-H bonds of the reactant. They also found that cesium-exchanged Al-rich Beta zeolite (Cs-Beta) was very effective for the oxidation of methyl lactate (ML) to methyl pyruvate (MP), and the yield of methyl lactate was 87.4% (full methyl lactate conversion) at 340 °C [5]. In the gas phase, a higher reaction temperature (above 200 °C) was required to vaporize the feedstock, and the higher temperature not only increased the production cost but also formed more side products. From the economic point of view, it is important to develop an efficient solid catalyst for liquid phase oxidation of lactate to pyruvate under mild conditions. Chu et al. [11] prepared a series of noble-metal catalysts such as Pt/AC, Pd/AC, Rh/AC, Ru/AC, and Au/AC and applied them in the liquid-phase oxidation of ML to MP. Among these catalysts, Ru/AC showed the highest EP selectivity (ca. 90%), while the EL conversion was only 19.4%. The kinetic study based on the Langir-Hinshelwood model indicated that the surface reaction between adsorbed mL and oxygen of Ru/AC was the rate-determining step of the reaction. Considering the high cost of noble-metal catalysts, non-precious metal catalysts have been widely prepared and used in this reaction. For example, Wang et al. [12] used oxidized multi-wall carbon nanotube (oCNT) as catalysts for the oxidation of EL to EP reaction using TBHP as the oxidant, giving a 39% EL conversion and 93.6% EP selectivity at 90 °C in 6 h. Although TBHP as an oxidant can efficiently catalyze the lactate to pyruvate, it is easy to decompose at high temperatures, which increases the difficulty of product separation·H2O2 and O2 as the cheap and green oxidants are also widely used in this oxidation reaction. Lu et al. [13] reported the oxidation of EL to EP over TS-1 zeolite using H2O2 (30 wt%) as the oxidant, achieving a 97.8% EP yield at 50 °C after 9 h. Based on the kinetic analysis, they found that the formation of Ti(OOH) is the rate-determining step. Zhang et al. [14] found that the EL conversion and EP selectivity were significantly improved when pyridine-type additives were added to the reaction solution. They thus loaded the vanadia sites on a pyridine–rich carbonaceous support and this catalyst gives a 90% EP selectivity at 80% EL conversion at 130 °C and 1 atm oxygen. Very recently, Tong’s group reported that using a trace of HBr (ca. 0.009 equiv.) as the homogeneous catalyst, a 99% EP yield was obtained after 4 h in the presence of O2 under visible light [15]. Although many catalysts have been applied in the oxidation of lactate to pyruvate reaction, developing effective catalysts with high pyruvate selectivity at low temperatures and short time is still essential. It is known that doping nitrogen to carbon materials can improve oxidation reactions due to the action of pyridinic or pyrrolic nitrogen groups [14,16,17]. In this work, carbon nitride was doped into the V x O y /SBA-15 catalyst by a post-impregnation method and used for the oxidation of EL to EP. The conversion of EL increased with increasing the vanadia loading, while the selectivity of EP was almost unchanged. The results also showed that the doping of carbon nitride significantly increased the activity of the V x O y /SBA-15 catalyst, and the EL conversion increased from 61.6% of 2.7 V x O y /SBA-15 to 93% of 2.6 V x O y /CN-SBA-15 catalyst. The results of O2-TPD and H2-TPR showed that the doping of carbon nitride improved the reducibility of V x O y /SBA-15 catalysts. In addition, the nitrogen-containing additive (pyridine or pyrrole) was also added to the reaction solution to study the role of CN. 2 Experimental 2.1 Catalyst preparation The SBA-15 was synthesized according to our previous report [18,19] (see Supporting Information for details). The wV x O y /CN-SBA-15 was prepared by a two-step impregnation method. The first impregnation step: a certain amount of dicyandiamide was dissolved into 20 mL ethanol, and 1 g of SBA-15 was added to the above solution and then stirred for 30 min at room temperature. The above solution was then heated to 80 °C to remove ethanol. The obtained power was finally calcined at a specified temperature for 4 h in a Muffle furnace and denoted as CN-SBA-15. The second impregnation step was similar to the first step: a certain amount of VO(acac)2 was dissolved in 20 mL ethanol, 1 g of CN-SBA-15 was added to above solution, followed by stirring, drying, and calcination, and denoted as wV x O y /CN-SBA-15_m_T. where the w, m and T refer to the weight loading of V (0.5–5%), mass ratio of CN to SBA-15 (0.04–0.9) and calcination temperature (300–500 °C), respectively. Unless specified, the mass ratio of CN to SBA-15 was 0.45, and the calcination temperature was 400 °C. It should be noted that the calcination temperature of these two steps was the same. 2.2 Catalyst characterization The properties of catalysts were characterized by X-ray diffraction (XRD), N2 adsorption–desorption technique, Fourier transforms infrared (FTIR) spectra, Scanning electron microscopy (SEM), X-ray photoelectron spectroscopy (XPS), O2-temperature-programmed desorption (TPD) and H2-temperature-programmed reduction (TPR). Detailed analytic methods are provided in the Supporting Information. 2.3 Catalytic reaction The oxidation reaction of EL was performed in a stainless-steel autoclave. Typically, 50 mg catalyst, 2 mmol EL, and 15 mL CH3CN were added into the autoclave, respectively. The reactor was then sealed and introduced 0.8 MPa O2 into the autoclave after purging with O2 three times. The reactor was then heated to the reaction temperature under stirring. After the reaction, the reactor was immediately cooled, and the products were analyzed by GC equipped with an FFAP capillary column and a flame ionization detector. 3 Results and discussion 3.1 Materials Characterization 3.1.1 Structural characterization We first investigated the structural characteristics of the prepared catalysts. Fig. 1a shows the small-angle XRD of the parent SBA-15, CN-SBA-15, and V x O y /CN-SBA-15 catalysts. It can be seen that all samples showed three diffraction peaks, corresponding to the (100), (110), and (200) planes of SBA-15 [18–20]. While no reflection of carbon nitride and vanadium species appeared in the CN-SBA-15 and V x O y /CN-SBA-15 catalysts. This may be because the carbon nitride and vanadium species were highly dispersed on SBA-15 or the loading of carbon nitride and vanadium species was very low. In addition, the XRD results also showed that the ordered structure of SBA-15 was not destroyed after loading with carbon nitride and vanadium species. SEM images also showed that the morphology of SBA-15 did not change after loading carbon nitride and/or vanadium species ( Fig. 2). The porous properties of the prepared catalysts were analyzed by N2-adsorption-desorption and the results were shown in Fig. 1b. The parent SBA-15 showed type-IV isotherm with an H1 hysteresis loop at P/P0 around 0.70–0.85, suggesting that the SBA-15 is a highly ordered mesoporous material, which is consistent with the literature [21,22]. The curves of CN-SBA-15 and V x O y /CN-SBA-15 samples were similar to those of SBA-15, suggesting that the structure of SBA-15 was not damaged after loading carbon nitride or/and vanadium. The 2.7 V x O y /CN presented an IV isotherm with an H1 hysteresis loop at a higher P/P0 = 0.80–1.0. Moreover, the pore size distribution of these SBA-15-based samples was narrow and concentrated at about 9.5 nm (Fig. 1c). The specific BET surface area, pore volumes, and pore diameter are listed in Table 1. The SBA-15 showed the highest surface area (607 m2 g−1) and pore volumes (1.06 cm3 g−1), and gradually decreased with the increase of V x O y loading. The pore diameter of these samples was around 9.5 nm, except for V x O y /CN-SBA-15 samples (9.06 nm). As expected, the V x O y /CN showed the lowest surface area (19 m2 g−1), pore volumes (0.05 cm3 g−1), and Pore diameter (2.7 nm), these values are consistent with the results of CN in the literature [23–25]. In addition, the actual V loading was also measured by ICP and the results are listed in Table 1. FTIR analysis was then performed for all wV x O y /CN-SBA-15 samples to analyze the chemical functional group of these samples (Fig. 1d). For comparison, the FTIR of parent SBA-15 and pure CN were also presented. For CN and 2.7 V x O y /CN samples, the peak located at approximately 800 cm−1 was attributed to the breathing mode of heptazine units; the several bands in 1200 to 1600 cm−1 corresponded to the stretching vibration of aromatic CN heterocycles; and the broad peaks around 3200 cm−1 were ascribed to the stretching vibrations of amino group and adsorbed water [26,27]. For SBA-15 support, three obvious peaks at about 470, 800, and 1080 cm−1 corresponded to the Si–O–Si vibrations of SBA-15; and a small peak at 970 cm−1was also found, which is attributed to the Si-OH group of SBA-15. It should be noted that small peaks at 1200 to 1600 cm−1 were also observed in V x O y /CN-SBA-15 catalysts, indicating that the CN was successfully loaded on SBA-15. While, the peak of heptazine units in V x O y /CN-SBA-15 overlaps with the Si–O–Si vibrations in SBA-15. FTIR results also indicated that the framework of SBA-15 was not damaged after loading CN and vanadium species, which is consistent with the data of small-angle XRD. To characterize the compositions and valence state of V x O y /CN-SBA-15, the XPS was performed. It can be seen from the survey scan that the spectrum of CN-SBA-15 showed five clear peaks with the binding energies of 532, 400, 286, 150, and 103 eV, corresponding to the O 1 s, N 1 s, C 1 s, Si 2 s and Si 2p, respectively (Fig. 1e). The V 2p spectra was also observed in all V x O y /CN-SBA-15 samples, indicating that the vanadium species was successfully loaded on SBA-15. Moreover, the signal located at 398 eV, associated with the nitrogen element, was also detected in the spectra of V x O y /CN-SBA-15 (Fig. 1e inset), confirming that the nitrogen carbon has been successfully supported on the surface of SBA-15. The high-resolution V 2p spectra of 4.8 V x O y /CN-SBA-15 and V2O5 were further recorded to elucidate the chemical environment of V species on CN-SBA-15 and the results were presented in Fig. S1. Both the spectra showed two signals at about 524 and 517 eV, corresponded to 2p1/2 and 2p 3/2 orbits of V species. For the 4.8 V x O y /CN-SBA-15 sample, the position of these two peaks shifted to lower binding energies compared to V2O5, indicating the interaction between V and CN-SBA-15. Similar results have also been found in other supported vanadia catalysts [18,28]. In order to characterize the valence state of V, the deconvoluted V 2p3/2 spectra of V x O y /CN-SBA-15 were presented in Fig. 1f. The V2p3/2 spectra can be divided into two peaks, the binding energy of 515.7 and 517.1 eV are ascribed to V4+ and V5+, respectively. In addition, the ratio of V4+/(V4++V5+) was also calculated and listed in the last column of Table 1. The percentage of V4+ first increased from 0.43 to 0.52 with increasing the V loading from 0.5 to 1.0% and then decreased to 0.33 when the V loading further increased to 4.8%. The effect of the V4+/(V4++V5+) on catalytic performance will be discussed in the next section. 3.1.2 Redox properties The redox properties of the prepared catalysts were then characterized by O2-TPD and H2-TPR, and the results are shown in Fig. 3. The O2-TPD experiment is the main method to analyze the oxygen capture and release of the sample. Typically, the physical adsorption oxygen (O2(ad)) is first desorbed from the catalyst surface at a relatively low temperature. With the increase in temperature, chemically adsorbed oxygen (O2- (ad) and O- (ad)) and lattice oxygen (O2- (latt)) are gradually desorbed from the surface of the catalyst [29–31]. It can be seen that curves of V2O5, V x O y /SBA-15, and V x O y /CN-SBA-15 are different (Fig. 3a). For V2O5, a very small peak at about 150 °C was observed, corresponding to the desorption of O2(ad). With the increase in temperature, the O2- (latt) started desorption at 700 °C and reached the maximum at about 740 °C. After loading 2.7%V x O y on SBA-15, the peak areas of O2(ad) and O2- (latt) increased significantly, indicating that the amount of O2(ad) and O2- (latt) increased. On the other hand, the initial desorption temperature and peak temperature of O2- (latt) decreased from 700 to 500 °C and 740 to 730 °C, respectively, confirming that the activity of O2- (latt) was improved. When CN was further doped to 2.6 V x O y /SBA-15, the peak area of O2- (latt) was further increased, and the peak temperature was significantly reduced from 730 to 675 °C, suggesting that the oxidation properties of catalysts were further improved. Moreover, the amount of O2 desorption from the catalyst surface was also calculated and the results were listed in Table 2. The V2O5 showed the lowest amount of O2 desorption (0.6 mmol/gcat). When 2.7% V x O y was loaded on SBA-15, the O2 desorption amount increased to 5.9 mmol/gcat, and further increased to 9.1 mmol/gcat when CN was doped on V x O y /SBA-15 catalyst. These data also showed that the oxidation properties were significantly improved after CN was doped on V x O y /SBA-15 catalyst. The reducibility of the prepared catalysts was also studied by H2-TPR measurement (Fig. 3b). It can be seen that the bulk V2O5 has three H2 consumption peaks, corresponding to the valence changes of vanadia: V2O5 to V6O13 (685 °C), V6O13 to V2O4 (786 °C), and V2O4 to V2O3 (894 °C), respectively[32–34]. When 2.7 V x O y was supported on SBA-15, the H2 consumption peak merged into one peak and the peak shifted to a lower temperature (572 °C), which indicated that there was a strong interaction between V x O y and SBA-15. In addition, the peak intensity was significantly enhanced after CN was doped on V x O y /SBA-15, indicating that the reducibility of the catalyst has been improved. Similar results were also reported on other silica-supported vanadia catalysts [18,35–37]. It should be noted that due to the low content of V x O y (< 3%), it is understandable that the peak area of 2.7 V x O y /SBA-15 and 2.6 V x O y /CN-SBA-15 are smaller than that of V2O5. In addition, the V2O5 showed the highest H2 consumption, followed by 2.6 V x O y /CN-SBA-15 (0.54 mmol/gcat) and 2.7 V x O y /SBA-15 (0.36 mmol/gcat). Combined with the results of O2-TPD and H2-TPR, it can be seen that the redox properties of 2.6 V x O y /CN-SBA-15 are significantly improved compared with 2.7 V x O y /SBA-15, which plays an important role in the oxidation of EL to EP reaction. 3.2 Catalytic performance 3.2.1 Activity evaluation of different catalysts Catalytic oxidative conversion of EL to EP reaction in the presence of molecular oxygen was carried out over synthesized catalysts, and the results are presented in Table 3. As anticipated, no EL conversion was observed over the CN-SBA-15 sample, indicating that CN could not catalyze this reaction. When V2O5 was used as the catalyst, a 30.5% EL conversion and 97.3% EP selectivity were achieved at 130 °C for 3 h. Doke et al. [38] also found that V2O5 could effectively catalyze EL to EP by using TBHP as the oxidant, however, significant TBHP decomposition was observed under the reaction conditions, which made it difficult to separate and purification of the target products. When 2.7% vanadia was supported on CN, the EL conversion seemed to decrease slightly, while the TOF significantly increased from 0.4 to 6.9, indicating that the proportion of vanadium available has increased. Moreover, the EL conversion increased to 61.6% after loading vanadia with SBA-15, possibly because the V x O y /SBA-15 has a much higher surface area than V x O y /CN (Table 1). When similar content of vanadia was supported on both CN and SBA-15 (2.6 V x O y /CN-SBA-15), the EL conversion was remarkably increased to 93.0%, indicating that the synergistic action of vanadia, CN, and SBA-15 improved the activity of catalyst. Specifically: Vanadia as the active site can catalyze the oxidation of EL to EP, CN acts as an additive, and SBA-15 provides a large surface area to support and disperse CN and vanadia species. In addition, the effect of VxOy loading on the catalytic performance was also performed. When a small amount of VxOy (ca. 0.5%) was loaded on CN-SBA-15, the EL conversion (26.8%) was even equal to that of 2.7 V x O y /CN (27.3%). With the VxOy content gradually increased to 4.8%, the EL conversion increased to 99.8%, while the TOF value first increased and then decreased, and reached the maximum when the V x O y loading was 1%. An attempt was then made to correlate the TOF with V4+/(V4++V5+) of 2.7 V x O y /SBA-15 and wV x O y /CN-SBA-15 (w = 0.5–4.8). Fig. 4 Shows that the TOF was positively correlated with the molar ratio of V4+/(V4++V5+). In general, the amount of V4+ ions are correlated with the oxidation reaction. A similar relationship was also observed over VxOy/SBA-15 [18] and mesoporous vanadia–titania catalysts for the same reaction [39]. The effect of time on the catalytic performance of all these wV x O y /CN-SBA-15 was also studied (Fig. S2). With the extension of time, the conversion of EL increased gradually. When the reaction time increased to 3 h, the value of EL conversion was similar on 2.6 V x O y /CN-SBA-15 and 4.8 V x O y /CN-SBA-15 samples. Thus, 2.6 V x O y /CN-SBA-15 was then used as the optimal catalyst to study the effect of reaction variables on the EL reaction. Moreover, it should be mentioned that the EP selectivity was always higher than 90% over all these catalysts, indicating that the vanadium-based catalysts have very high selectivity for EP. 3.2.2 Effect of reaction parameters The reaction temperature (100–130 °C) and time (0.5–3 h) on the EL reaction were then studied over 2.6 V x O y /CN-SBA-15 catalyst. It can be seen from Fig. 5a that the 2.6 V x O y /CN-SBA-15 has a high catalytic activity for EL conversion. A 4.5% EL conversion was obtained even at 100 °C for 0.5 h, and with the prolongation of reaction time to 3 h, the EL conversion increased to 34.9%. The reaction temperature also has a big influence on the catalytic performance of the catalyst, especially after 3 h of the reaction. When the reaction temperature increased from 100 to 130 °C, the EL conversion increased from 34.9 to 93%, respectively. A similar trend was also found in EP yield, and the values of EP yield were close to the EL conversion (Fig. 5b), suggesting that the selectivity of EP was always above 90% at different temperatures and times. The optimized reaction temperature and time were determined as 130 °C and 3 h, respectively. To get more insights into this reaction, the kinetics of this reaction on 2.6 V x O y /CN-SBA-15 was studied at four reaction temperatures of 100, 110, 120, and 130 °C. Due to the excess of CH3CN (n(CH3CN/EL) = 14.4), we assumed that the reaction rate was not affected by CH3CN concentration, but mainly by the concentration of EL. Fig. 5c shows the plot of ln(1-x) versus time for the EL to EP reaction over 2.6 V x O y /CN-SBA-15 catalyst, in which x is the conversion of EL. It is seen that the reaction can be regarded as pseudo-first-order kinetics, and the reaction rate constant (k) was estimated to be 0.1482, 0.2502, 0.5434, and 0.8363 h-1 for the temperatures 100, 110, 120, and 130, respectively. The activation energy (Ea) could be calculated from the dependence of k on reaction temperature via the Arrhenius equation, and the value of Ea was estimated to be 74.6 kJ/mol over 2.6 V x O y /CN-SBA-15 catalyst for the EL to EP reaction in the presence of molecular oxygen (Fig. 5d). It should be mentioned that V x O y /CN-SBA-15 catalyst exhibit a lower Ea than that of V x O y /SBA-15 (84.8 kJ/mol)[18], indicating that the doping of carbon nitride may be more conducive to the oxidation of EL reaction. In addition, the Ea value was also much higher than other solid catalysts in the literature, such as TS-1 (103.4 kJ/mol) [13], and oCNT (119.1 kJ/mol) [12] catalyst. The effect of other variables such as catalyst production process (mass ratio of CN to SBA-15 and calcination temperature) and reaction conditions (atmosphere and catalyst weight) on the catalytic performance of 2.6 V x O y /CN-SBA-15 catalyst at 130 °C for 3 h were also studied, and the results were shown in Fig. 6. The mass ratio of CN to SBA-15 was controlled by fixing the amount of SBA-15 and changing the amount of dicyandiamide. To accurately study the effect of CN doping, other variables in the catalyst preparation process such as calcination temperature (400 °C) and vanadia loading (about 2.6%) were kept consistent. It can be seen from Fig. 6a that the mass ratio of CN to SBA-15 has a significant effect on the catalytic performance of the catalysts. When a small amount of CN was added to V x O y /SBA-15 (CN: SBA-15 = 0.038), the EL conversion and EP selectivity increased from 61.6 to 80% and 94.8 to 98.2%, respectively. With the further increase of CN amount, the EL conversion first increased and then decreased, and reached the maximum value (93%) when CN: SBA-15 = 0.45. The doping amount of CN has little effect on the selectivity of EP, and the EP selectivity is above 98% over all these catalysts, the improvement of catalytic performance may be related to the pyridinic or pyrrolic nitrogen groups in CN. However, the N1s peaks were very small in this study (Fig. 1e), making it difficult to calculate the amount of pyridinic or pyrrolic nitrogen in these V x O y /CN-SBA-15 catalysts. On the other hand, the interaction between nitrogen species and active components (V x O y ) can effectively increase the dispersion of active species, and then improve their redox properties [40]. The calcination temperature is also an important factor affecting the catalytic performance of the catalyst. Fig. 6b shows the effect of calcination temperature (300–500 °C) on the catalytic performance of 2.6 V x O y /CN-SBA-15. The results showed that the calcination temperature has a great effect on EL conversion, but little effect on EP selectivity (above 95%). When the calcination temperature was increased from 300 to 400 °C, the EL conversion increased from 41 to 93%; the EL conversion then dropped to 84% with increasing the calcination temperature to 500 °C. A similar trend was also observed on the V x O y /SBA-15 catalyst [18]. Thus, the optimum calcination temperature for EL to EP reaction on 2.6 V x O y /CN-SBA-15 catalyst is 400 °C. The effect of the atmosphere (N2, Air, and O2) was also studied on the catalytic performance of 2.6 V x O y /CN-SBA-15, and the results were shown in Fig. 6c. A 6% EL conversion and 92% EP selectivity were achieved under N2 conditions. This may be because a small amount of molecular oxygen adsorbed on the catalyst. A low EL conversion was also observed under anaerobic conditions on other solid catalysts [18,41]. When air replaced N2 as the oxidant, the EL conversion and EP selectivity improved to 27% and 98%. Obviously, the highest EL conversion (93%) was obtained in the presence of pure oxygen, which may be due to the higher oxygen content than air. Therefore, molecular oxygen was the best oxidant for the EL to EP reaction. As expected, the catalyst weight has little effect on the EP selectivity, but a big effect on the EL conversion (Fig. 6d). When the catalyst weight was increased from 10 to 50 mg, the EL conversion increased from 47 to 93%. Thus, the optimal amount of catalyst is 50 mg for this EL to EP reaction. For comparison, we summarize the catalytic performance of other reported catalysts for the liquid phase catalytic oxidation of EL to EP in the presence of molecular oxygen. It should be mentioned that the gas phase [5,6,10,42,43], liquid phase using TBHP [12,38] or H2O2 [13] as the oxidant and photocatalytic [15,44] oxidation of alkyl lactate to alkyl pyruvate have also been extensively studied in the recent years. These catalyst systems are not included in this comparison. Table 4 shows that most of the reaction temperature adopted for this reaction is 130 °C, except for Na-OMS-2–2.5 mol% and Zn(NO3)2/VOC2O4 catalyst. For Na-OMS catalyst, a longer reaction time (12 h) was required to obtain a higher conversion. For Zn(NO3)2/VOC2O4 catalyst, the VOC2O4 as the organic compound could be dissolved in solvents, making it difficult to separate the catalyst. On the other hand, the vanadium-based catalysts showed much higher activity than the molybdenum-based catalyst (SnO2-MoO3) under similar reaction conditions. It is worth noting that the 2.6 V x O y /CN-SBA-15 catalyst in this work not only provided high EL conversion and EP selectivity in a short reaction time (3 h) but also had only half the vanadium loading of the 5.9 V x O y /SBA-15 catalyst. Considering both catalytic performance and economy, the 2.6 V x O y /CN-SBA-15 catalyst prepared in this work would be more suitable for EP production from EL. 3.2.3 Reusability of the catalyst The stability of catalyst is very important in heterogeneous catalysis. The reusability of catalyst was carried out by using 2 mmol of EL and 50 mg of 2.6 V x O y /CN-SBA-15. Before the next cycle, the spent catalyst was washed with ethanol to remove any residue on the catalyst, and dried at 100 °C for 12 h. To our surprise, when acetonitrile was used as the solvent, the EL conversion dropped from 93% to 78% on the first cycle, possibly due to the CN being dissolved into acetonitrile. Therefore, several other solvents (acetone, N,N-dimethylformamide and diethyl succinate) were selected and studied their effects on the reaction (Table S1). The results showed that diethyl succinate as the solvent could offered the highest EL conversion (95.7%) and EP selectivity (99%), and thus was selected to study the reusability of catalyst. As shown in Fig. 7a, the EL conversion and EP selectivity remained fairly stable for the five successive cycles. Subsequently, to confirm the heterogeneous nature of the 2.6 V x O y /CN-SBA-15 catalyst, a hot filtration test was performed. After 1 h of the reaction, the EL conversion reached 29% (Fig. 7b), and the catalyst was removed from the solution by filtration, the filtrate continued to react at 130 °C for 2 h, and the EL conversion was almost unchanged, which proved that the active site was not dissolved into the reaction solution. Above results showed that the 2.6 V x O y /CN-SBA-15 catalyst has good activity and stability in the EL to EP reaction. 3.2.4 Effect of additives and the catalytic mechanism Previous studies have shown that doping nitrogen atoms in carbon materials could facilitate the oxidation reaction due to the action of pyridinic or pyrrolic nitrogen groups [14,17]. To further study the role of CN (the type of nitrogen) in V x O y /CN-SBA-15 catalyst, nitrogen-containing additives such as pyridine and pyrrole was added, respectively, to the reaction solution with 2.7 V x O y /SBA-15 as the catalyst. To clearly show the effect of the addition on the reaction, we decreased the EL conversion to 43.6% by shortening the reaction time to 2 h. It can be seen from Fig. 8 that adding a small amount of pyridine (e.g., pyridine/EL = 0.1) to the solution could significantly increase the EL conversion, and the EL conversion increased from 43.6 to 68.7%. Meanwhile, the EP selectivity increased slightly from 93.5 to 98.9%. When the ratio of pyridine to EL increased slowly to 1.0, the EL conversion gradually increased to 91.5% and further increased the amount of pyridine (e.g., pyridine/EL = 2.0), the EL conversion decreased slightly to 88.3%, while the selectivity of EP was almost unchanged. Surprisingly, when a small amount of pyrrole (pyrrole /EL = 0.1) was added to the reaction, the EL conversion decreased rapidly from 43.6 to 13.1%, and the reaction was almost completely suppressed at a pyrrole /EL = 1.0. These results may indicate that the pyridinic-N rather than pyrrolic-N of the V x O y /CN-SBA-15 catalyst accelerates the oxidation of EL to EP. A possible structure of V x O y /CN-SBA-15 ( Scheme 1) was then proposed based on the relevant literature on carbon nitride supported vanadia [49,50] and the present characterization result. In V x O y /CN-SBA-15, the V4+ cations were connected to Nb species of CN via coordinate-like interaction. According to the reported literature [14,18,41] and the above experiment, the possible catalytic mechanism was proposed and shown in Scheme 1. The reactant EL first interacts with pyridinic-N of CN via the hydrogen bonding (step I), and the oxygen atom of hydroxyl group was adsorbed on the V5+ of catalyst (step II). The β-hydrogen atom was then captured by the lattice oxygen of V x O y /CN-SBA-15 to form a five-membered intermediate (Step III). Finally, the desired product EP was formed by eliminating the β-hydrogen and the oxygen vacancy of the catalyst, accompanied by the generation of H2O (step IV and V). 4 Conclusion In summary, a series of highly efficient wV x O y /CN-SBA-15 catalysts were prepared by a simple impregnation method and employed for the oxidation of EL to EP reaction. The conversion of EL increased from 26.8 to 99.8% with increasing the vanadia loading from 0.5 to 4.8%, while the selectivity of EP was almost unchanged (about 98%). The 2.6V x O y /CN-SBA-15 was regarded as the optimum catalyst, giving a very high EL conversion (93.0%) under optimized reaction conditions (130 °C, 3 h in CH3CN), which was much higher than 2.7V x O y /SBA-15 (61.6%) and 2.7V x O y /CN (27.3%) catalysts. The catalyst characterization showed that the redox properties of 2.6V x O y /CN-SBA-15 were significantly improved after doping of CN, and thus improved the catalyst activity. Moreover, the addition of pyridine and pyrrole to the reaction solution increased and decreased the activity of the V x O y /SBA-15 catalyst, respectively, indicating that pyridinic-N of V x O y /CN-SBA-15 catalyst may accelerate the oxidation of EL to EP. This study could provide a basis for not only developing more efficient solid catalysts for the oxidation of EL to EP reaction but also a good application in industry. CRediT authorship contribution statement Yan Bing: Validation. Xue Bing: Supervision. Du Mingyang: Investigation. We Zhe: Validation. Cai Jiahao: Investigation. dai qiaoling: Validation. Xu jing: Investigation, Formal analysis, Conceptualization. Cai Chao: Validation, Investigation. Liu Zonghui: Writing – original draft, Supervision, Conceptualization. Declaration of Competing Interest The authors declare that they have no known competing financial interests or personal relationships that could have appeared to influence the work reported in this paper. Acknowledgments This work was supported by the National Natural Science Foundation of China (22302016, and 22278041), the Foundation of Social Development of Changzhou (CE20225063), the Jiangsu Province Engineering Research Center of Biodegradable Materials (KF2305), and the Open Fund of the Key Lab of Organic Optoelectronics & Molecular Engineering. We would like to thank Yi Li and Kang Li (Tsinghua University) for assistance with O2-TPD and H2-TPR measurements, respectively. We thank the Shiyanjia Lab (www.shiyanjia.com) for the XPS characterization. We also thank the Analysis and Testing Center, NERC Biomass of Changzhou University for other characterization. Appendix A. Supplementary material The Supporting Information is available free of charge at https://pubs.acs.org/doi/. Preparation of SBA-15; detailed characterization methods; Catalyst characterization results of XPS; The effect of reaction time on the wV x O y /CN-SBA-15 (w=0.5–4.8) catalytic performance, and the effect of solvent on the catalytic performance of 2.6V x O y /CN-SBA-15. Appendix A Supporting information Supplementary data associated with this article can be found in the online version at doi:10.1016/j.apcata.2024.119577. Appendix A Supplementary material Supplementary material . References [1] J.N. Chheda G.W. Huber J.A. Dumesic Liquid-phase catalytic processing of biomass-derived oxygenated hydrocarbons to fuels and chemicals Angew. Chem. Int Ed. 46 38 2007 7164 7183 Chheda J.N., Huber G.W., Dumesic J.A. Liquid-Phase Catalytic Processing of Biomass-Derived Oxygenated Hydrocarbons to Fuels and Chemicals. Angew Chem Int Ed 2007;46(38):7164–7183. [2] Z.-H. Liu B. Yan Y. Liang B.-Q. Xu Comparative study of gas-phase “dehydration” of alkyl lactates and lactic acid for acrylic acid production over hydroxyapatite catalysts Mol. Catal. 494 2020 111098 Liu Z.-H., Yan B., Liang Y., Xu B.-Q. Comparative study of gas-phase “dehydration” of alkyl lactates and lactic acid for acrylic acid production over hydroxyapatite catalysts. Mol Catal 2020;494:111098. [3] B. Yan Z.-H. Liu Y. Liang B.-Q. Xu Acrylic acid production by gas-phase dehydration of lactic acid over K+-exchanged ZSM-5: reaction variable effects, kinetics, and new evidence for cooperative acid–base bifunctional catalysis Ind. Eng. Chem. Res. 59 39 2020 17417 17428 Yan B., Liu Z.-H., Liang Y., Xu B.-Q. Acrylic Acid Production by Gas-Phase Dehydration of Lactic Acid over K+-Exchanged ZSM-5: Reaction Variable Effects, Kinetics, and New Evidence for Cooperative Acid–Base Bifunctional Catalysis. Ind Eng Chem Res 2020;59(39):17417–17428. [4] B. Yan L.-Z. Tao A. Mahmood Y. Liang B.-Q. Xu Potassium-ion-exchanged zeolites for sustainable production of acrylic acid by gas-phase dehydration of lactic acid ACS Catal. 7 1 2017 538 550 Yan B., Tao L.-Z., Mahmood A., Liang Y., Xu B.-Q. Potassium-Ion-Exchanged Zeolites for Sustainable Production of Acrylic Acid by Gas-Phase Dehydration of Lactic Acid. ACS Catal 2017;7(1):538–550. [5] S. Lu J. Zhang H. Meng X. Qin J. Huang Y. Liang Efficient conversion of methyl lactate to methyl acrylate over cesium-modified Al-Rich beta zeolites ACS Sustain Chem. Eng. 11 23 2023 8624 8632 Lu S., Zhang J., Meng H., Qin X., Huang J., Liang Y., et al. Efficient Conversion of Methyl Lactate to Methyl Acrylate over Cesium-Modified Al-Rich Beta Zeolites. ACS Sustain Chem Eng 2023;11(23):8624–8632. [6] Y. Huang D. Xiong S. Wu Z. Huang W. Shen H. Xu Preparation of a Nanorod-like Mo-VOx catalyst for gas phase selective oxidation of methyl lactate with air Ind. Eng. Chem. Res. 62 1 2023 302 313 Huang Y., Xiong D., Wu S., Huang Z., Shen W., Xu H. Preparation of a Nanorod-like Mo-VOx Catalyst for Gas Phase Selective Oxidation of Methyl Lactate with Air. Ind Eng Chem Res 2023;62(1):302–313. [7] Y. Wang J.D. Lewis Y. Román-Leshkov Synthesis of itaconic acid ester analogues via self-aldol condensation of ethyl pyruvate catalyzed by hafnium BEA zeolites ACS Catal. 6 5 2016 2739 2744 Wang Y., Lewis J.D., Román-Leshkov Y. Synthesis of Itaconic Acid Ester Analogues via Self-Aldol Condensation of Ethyl Pyruvate Catalyzed by Hafnium BEA Zeolites. ACS Catal 2016;6(5):2739–2744. [8] M.V. Murlykina Y.I. Sakhno S.M. Desenko S.V. Shishkina O.V. Shishkin D.O. Sysoiev Study of the chemoselectivity of multicomponent heterocyclizations involving 3-amino-1,2,4-triazole and pyruvic acids as key reagents, and biological activity of the reaction products Eur. J. Org. Chem. 2015 20 2015 4481 4492 Murlykina M.V., Sakhno Y.I., Desenko S.M., Shishkina S.V., Shishkin O.V., Sysoiev D.O., et al. Study of the Chemoselectivity of Multicomponent Heterocyclizations Involving 3-Amino-1,2,4-triazole and Pyruvic Acids as Key Reagents, and Biological Activity of the Reaction Products. Eur J Org Chem 2015;2015(20):4481–4492. [9] S. Sugiyama S. Fukunaga K. Ito S. Ohigashi H. Hayashi Catalysts for vapor-phase dehydration of ethylene glycol and their application to pyruvic acid synthesis J. Catal. 129 1 1991 12 18 Sugiyama S., Fukunaga S., Ito K., Ohigashi S., Hayashi H. Catalysts for vapor-phase dehydration of ethylene glycol and their application to pyruvic acid synthesis. J Catal 1991;129(1):12–18. [10] S. Lu J. Zhang H. Meng X. Qin J. Huang Y. Liang Catalytic direct dehydrogenation of ethyl lactate to produce ethyl pyruvate over a synergetic Cu0/Cu+ interface Appl. Catal. B 325 2023 122329 Lu S., Zhang J., Meng H., Qin X., Huang J., Liang Y., et al. Catalytic direct dehydrogenation of ethyl lactate to produce ethyl pyruvate over a synergetic Cu0/Cu+ interface. Appl Catal, B 2023;325:122329. [11] Y. Chu B. Yan X. Yang S. Wang P. Cao T. Li Selective oxidation of methyl lactate over carbon-supported noble metal catalysts under base-free conditions Ind. Eng. Chem. Res. 60 40 2021 14397 14409 Chu Y., Yan B., Yang X., Wang S., Cao P., Li T., et al. Selective Oxidation of Methyl Lactate over Carbon-Supported Noble Metal Catalysts under Base-Free Conditions. Ind Eng Chem Res 2021;60(40):14397–14409. [12] D. Wang W. Liu Z. Xie S. Tian D. Su W. Qi Oxidative dehydrogenation of ethyl lactate over nanocarbon catalysts: effect of oxygen functionalities and defects Catal. Today 347 2020 96 101 Wang D., Liu W., Xie Z., Tian S., Su D., Qi W. Oxidative dehydrogenation of ethyl lactate over nanocarbon catalysts: Effect of oxygen functionalities and defects. Catal Today 2020;347:96–101. [13] T. Lu J. Zou Y. Zhan X. Yang Y. Wen X. Wang Highly efficient oxidation of ethyl lactate to ethyl pyruvate catalyzed by TS-1 under mild conditions ACS Catal. 8 2 2018 1287 1296 Lu T., Zou J., Zhan Y., Yang X., Wen Y., Wang X., et al. Highly Efficient Oxidation of Ethyl Lactate to Ethyl Pyruvate Catalyzed by TS-1 Under Mild Conditions. ACS Catal 2018;8(2):1287–1296. [14] W. Zhang B. Ensing G. Rothenberg N. Raveendran Shiju Designing effective solid catalysts for biomass conversion: aerobic oxidation of ethyl lactate to ethyl pyruvate Green. Chem. 20 8 2018 1866 1873 Zhang W., Ensing B., Rothenberg G., Raveendran Shiju N. Designing effective solid catalysts for biomass conversion: aerobic oxidation of ethyl lactate to ethyl pyruvate. Green Chem 2018;20(8):1866–1873. [15] Y. Zhang S. Liao H. Zhang R. Liu X. Tong The selective aerobic oxidation of ethyl lactate to ethyl pyruvate mediated by a trace of HBr with visible light Mol. Catal. 540 2023 113066 Zhang Y., Liao S., Zhang H., Liu R., Tong X. The selective aerobic oxidation of ethyl lactate to ethyl pyruvate mediated by a trace of HBr with visible light. Mol Catal 2023;540:113066. [16] P. Zhang Y. Gong H. Li Z. Chen Y. Wang Solvent-free aerobic oxidation of hydrocarbons and alcohols with Pd@N-doped carbon from glucose Nat. Commun. 4 1 2013 1593 Zhang P., Gong Y., Li H., Chen Z., Wang Y. Solvent-free aerobic oxidation of hydrocarbons and alcohols with Pd@N-doped carbon from glucose. Nature Communications 2013;4(1):1593. [17] T.K. Slot D. Eisenberg D. van Noordenne P. Jungbacker G. Rothenberg Cooperative catalysis for selective alcohol oxidation with molecular oxygen Chem. A Eur. J. 22 35 2016 12307 12311 Slot T.K., Eisenberg D., van Noordenne D., Jungbacker P., Rothenberg G. Cooperative Catalysis for Selective Alcohol Oxidation with Molecular Oxygen. Chemistry – A European Journal 2016;22(35):12307–12311. [18] J. Xu Z. Liu Y. Zhou R. Fu Z. Wen B. Yan Highly efficient oxidation of ethyl lactate to ethyl pyruvate with molecular oxygen over VxOy/SBA-15 catalysts Catal. Sci. Technol. 13 19 2023 5582 5591 Xu J., Liu Z., Zhou Y., Fu R., Wen Z., Yan B., et al. Highly efficient oxidation of ethyl lactate to ethyl pyruvate with molecular oxygen over VxOy/SBA-15 catalysts. Catal Sci Technol 2023;13(19):5582–5591. [19] Z. Liu Z. Zhang R. Fu J. Xu J. Lu Z. Wen One-pot conversion of furfural to gamma-valerolactone over Zr-SBA-15: cooperation of lewis and brønsted acidic sites ACS Appl. Nano Mater. 6 14 2023 13196 13207 Liu Z., Zhang Z., Fu R., Xu J., Lu J., Wen Z., et al. One-Pot Conversion of Furfural to Gamma-Valerolactone over Zr-SBA-15: Cooperation of Lewis and Brønsted Acidic Sites. ACS Appl Nano Mater 2023;6(14):13196–13207. [20] Z. Liu Z. Zhang Y. Zhou Z. Wang M. Du Z. Wen Phosphotungstic acid supported on Zr-SBA-15 as an efficient catalyst for one-pot conversion of furfural to γ-valerolactone Fuel 356 2024 129631 Liu Z., Zhang Z., Zhou Y., Wang Z., Du M., Wen Z., et al. Phosphotungstic acid supported on Zr-SBA-15 as an efficient catalyst for one-pot conversion of furfural to γ-valerolactone. Fuel 2024;356:129631. [21] Y. Wei Y. Li Y. Tan J. Zhou Z. Wu Y. Liu A facile route for one-pot synthesis of short-channeled bimetallic Zr–Al–SBA-15 Mater. Lett. 141 2015 145 148 Wei Y., Li Y., Tan Y., Zhou J., Wu Z., Liu Y. A facile route for one-pot synthesis of short-channeled bimetallic Zr–Al–SBA-15. Mater Lett 2015;141:145–148. [22] S.-Y. Chen J.-F. Lee S. Cheng Pinacol-type rearrangement catalyzed by Zr-incorporated SBA-15 J. Catal. 270 1 2010 196 205 Chen S.-Y., Lee J.-F., Cheng S. Pinacol-type rearrangement catalyzed by Zr-incorporated SBA-15. J Catal 2010;270(1):196–205. [23] Z. Liu Z. Zhang D. Xie X. Guan F. Wang B. Xue Preparation of graphitic carbon nitride g-C3N4-HMCM-22 composite catalysts and enhanced para-selectivity in m-xylene isomerization Chem. Pap. 76 3 2022 1875 1884 Liu Z., Zhang Z., Xie D., Guan X., Wang F., Xue B. Preparation of graphitic carbon nitride g-C3N4-HMCM-22 composite catalysts and enhanced para-selectivity in m-xylene isomerization. Chemical Papers 2022;76(3):1875–1884. [24] F. Wu J. Du N. Liu J. Xu B. Xue Potassium-doped carbon nitride supported on SBA-15 for enhanced catalytic Knoevenagel condensation under mild conditions Appl. Catal. A 641 2022 118677 Wu F., Du J., Liu N., Xu J., Xue B. Potassium-doped carbon nitride supported on SBA-15 for enhanced catalytic Knoevenagel condensation under mild conditions. Appl Catal, A 2022;641:118677. [25] L.-Z. Yu X.-H. Sun F. Wang B. Xue J. Xu Acid–base bifunctional ZnNbCl/eg-C3N4 materials towards catalytic synthesis of dimethyl carbonate via transesterification of ethylene carbonate Appl. Catal. A 666 2023 119432 Yu L.-Z., Sun X.-H., Wang F., Xue B., Xu J. Acid–base bifunctional ZnNbCl/eg-C3N4 materials towards catalytic synthesis of dimethyl carbonate via transesterification of ethylene carbonate. Appl Catal, A 2023;666:119432. [26] M.J. Bojdys J.-O. Müller M. Antonietti A. Thomas Ionothermal synthesis of crystalline, condensed, graphitic carbon nitride Chem. A Eur. J. 14 27 2008 8177 8182 Bojdys M.J., Müller J.-O., Antonietti M., Thomas A. Ionothermal Synthesis of Crystalline, Condensed, Graphitic Carbon Nitride. Chemistry – A European Journal 2008;14(27):8177–8182. [27] N. Liu J. Du J. Xu B. Xue J. Luo Efficient synthesis of cyclic carbonate via transformation of CO2 catalyzed by solid-base bifunctional graphitic carbon nitride materials Res Chem. Inter. 48 12 2022 4883 4900 Liu N., Du J., Xu J., Xue B., Luo J. Efficient synthesis of cyclic carbonate via transformation of CO2 catalyzed by solid-base bifunctional graphitic carbon nitride materials. Res Chem Intermed 2022;48(12):4883–4900. [28] S. Verma R.B.N. Baig M.N. Nadagouda R.S. Varma Selective oxidation of alcohols using photoactive VO@g-C3N4 ACS Sustain Chem. Eng. 4 3 2016 1094 1098 Verma S., Baig R.B.N., Nadagouda M.N., Varma R.S. Selective Oxidation of Alcohols Using Photoactive VO@g-C3N4. ACS Sustain Chem Eng 2016;4(3):1094–1098. [29] C. Wang J.-G. Chen T. Xing Z.-T. Liu Z.-W. Liu J. Jiang Vanadium oxide supported on titanosilicates for the oxidative dehydrogenation of n-butane Ind. Eng. Chem. Res. 54 14 2015 3602 3610 Wang C., Chen J.-G., Xing T., Liu Z.-T., Liu Z.-W., Jiang J., et al. Vanadium Oxide Supported on Titanosilicates for the Oxidative Dehydrogenation of n-Butane. Ind Eng Chem Res 2015;54(14):3602–3610. [30] Z. Shen E. Gao X. Meng J. Xu Y. Sun J. Zhu Mechanistic insight into catalytic combustion of ethyl acetate on modified CeO2 nanobelts: hydrolysis–oxidation process and shielding effect of acetates/alcoholates Environ. Sci. Technol. 57 9 2023 3864 3874 Shen Z., Gao E., Meng X., Xu J., Sun Y., Zhu J., et al. Mechanistic Insight into Catalytic Combustion of Ethyl Acetate on Modified CeO2 Nanobelts: Hydrolysis–Oxidation Process and Shielding Effect of Acetates/Alcoholates. Environmental Science & Technology 2023;57(9):3864–3874. [31] B. Pongthawornsakun S. Phatyenchuen J. Panpranot P. Praserthdam The low temperature selective oxidation of H2S to elemental sulfur on TiO2 supported V2O5 catalysts J. Environ. Chem. Eng. 6 1 2018 1414 1423 Pongthawornsakun B., Phatyenchuen S., Panpranot J., Praserthdam P. The low temperature selective oxidation of H2S to elemental sulfur on TiO2 supported V2O5 catalysts. Journal of Environmental Chemical Engineering 2018;6(1):1414–1423. [32] H. Guo D. Li D. Jiang H. Xiao W. Li Y. Sun Characterization and performance of V2O5–TiO2 catalysts prepared by rapid combustion method Catal. Today 158 3 2010 439 445 Guo H., Li D., Jiang D., Xiao H., Li W., Sun Y. Characterization and performance of V2O5–TiO2 catalysts prepared by rapid combustion method. Catal Today 2010;158(3):439–445. [33] H. Bosch B.J. Kip J.G. van Ommen P.J. Gellings Factors influencing the temperature-programmed reduction profiles of vanadium pentoxide J. Chem. Soc., Faraday Trans. 1 Phys. Chem. Condens. Phases 80 9 1984 2479 2488 Bosch H., Kip B.J., van Ommen J.G., Gellings P.J. Factors influencing the temperature-programmed reduction profiles of vanadium pentoxide. Journal of the Chemical Society, Faraday Transactions 1: Physical Chemistry in Condensed Phases 1984;80(9):2479–2488. [34] M.M. Koranne J.G. Goodwin G. Marcelin Characterization of silica- and alumina-supported vanadia catalysts using temperature programmed reduction J. Catal. 148 1 1994 369 377 Koranne M.M., Goodwin J.G., Marcelin G. Characterization of Silica- and Alumina-Supported Vanadia Catalysts Using Temperature Programmed Reduction. J Catal 1994;148(1):369–377. [35] Y.-M. Liu Y. Cao N. Yi W.-L. Feng W.-L. Dai S.-R. Yan Vanadium oxide supported on mesoporous SBA-15 as highly selective catalysts in the oxidative dehydrogenation of propane J. Catal. 224 2 2004 417 428 Liu Y.-M., Cao Y., Yi N., Feng W.-L., Dai W.-L., Yan S.-R., et al. Vanadium oxide supported on mesoporous SBA-15 as highly selective catalysts in the oxidative dehydrogenation of propane. J Catal 2004;224(2):417–428. [36] M.L. Peña A. Dejoz V. Fornés F. Rey M.I. Vázquez J.M. López Nieto V-containing MCM-41 and MCM-48 catalysts for the selective oxidation of propane in gas phase Appl. Catal. A 209 1 2001 155 164 Peña M.L., Dejoz A., Fornés V., Rey F., Vázquez M.I., López Nieto J.M. V-containing MCM-41 and MCM-48 catalysts for the selective oxidation of propane in gas phase. Appl Catal, A 2001;209(1):155–164. [37] J. Xu M. Chen Y.-M. Liu Y. Cao H.-Y. He K.-N. Fan Vanadia supported on H2O2-detemplated mesoporous SBA-15 as new effective catalysts for the oxidative dehydrogenation of propane Microporous Mesoporous Mater. 118 1 2009 354 360 Xu J., Chen M., Liu Y.-M., Cao Y., He H.-Y., Fan K.-N. Vanadia supported on H2O2-detemplated mesoporous SBA-15 as new effective catalysts for the oxidative dehydrogenation of propane. Microporous Mesoporous Mater 2009;118(1):354–360. [38] D.S. Doke S.B. Khomane S.L. Pandhare M.K. Dongare F. Dumeignil S.B. Umbarkar Vanadium-based highly active and selective catalysts for oxidative dehydrogenation of ethyl lactate to ethyl pyruvate Appl. Catal. A 587 2019 117246 Doke D.S., Khomane S.B., Pandhare S.L., Dongare M.K., Dumeignil F., Umbarkar S.B. Vanadium-based highly active and selective catalysts for oxidative dehydrogenation of ethyl lactate to ethyl pyruvate. Appl Catal, A 2019;587:117246. [39] W. Zhang G. Innocenti P. Oulego V. Gitis H. Wu B. Ensing Highly selective oxidation of ethyl lactate to ethyl pyruvate catalyzed by mesoporous vanadia–titania ACS Catal. 8 3 2018 2365 2374 Zhang W., Innocenti G., Oulego P., Gitis V., Wu H., Ensing B., et al. Highly Selective Oxidation of Ethyl Lactate to Ethyl Pyruvate Catalyzed by Mesoporous Vanadia–Titania. ACS Catal 2018;8(3):2365–2374. [40] K. Chizari I. Janowska M. Houllé I. Florea O. Ersen T. Romero Tuning of nitrogen-doped carbon nanotubes as catalyst support for liquid-phase reaction Appl. Catal. A 380 1 2010 72 80 Chizari K., Janowska I., Houllé M., Florea I., Ersen O., Romero T., et al. Tuning of nitrogen-doped carbon nanotubes as catalyst support for liquid-phase reaction. Appl Catal, A 2010;380(1):72–80. [41] L. Tao X. Bi L. Zhang G. Chen P. Zhao J.-L. Yang Na-doped OMS-2-catalzyed highly selective aerobic oxidation of ethyl lactate to ethyl pyruvate under mild conditions Appl. Catal. A 605 2020 117813 Tao L., Bi X., Zhang L., Chen G., Zhao P., Yang J.-L., et al. Na-doped OMS-2-catalzyed highly selective aerobic oxidation of ethyl lactate to ethyl pyruvate under mild conditions. Appl Catal, A 2020;605:117813. [42] X. Liu Q. Wang C. Liu X. Wang C. Peng R. Liu High-performance vapor-phase selective oxidation of ethyl lactate to ethyl pyruvate over SiO2 supported PMoVNb oxides Catalysts 10 2 2020 197 Liu X., Wang Q., Liu C., Wang X., Peng C., Liu R., et al. High-Performance Vapor-Phase Selective Oxidation of Ethyl Lactate to Ethyl Pyruvate over SiO2 Supported PMoVNb Oxides. Catalysts 2020;10(2):197. [43] S. Lu J. Zhang Z. Wu Z. Su J. Huang Y. Liang Catalytic oxidation of ethyl lactate to ethyl pyruvate over Au-based catalyst using authentic air as oxidant Catal. Surv. Asia 26 3 2022 211 220 Lu S., Zhang J., Wu Z., Su Z., Huang J., Liang Y., et al. Catalytic Oxidation of Ethyl Lactate to Ethyl Pyruvate over Au-Based Catalyst Using Authentic Air as Oxidant. Catalysis Surveys from Asia 2022;26(3):211–220. [44] T. Lu Z. Yang H. Li H. Chen J. Xu C.C. Xu Selective oxidation of ethyl lactate to ethyl pyruvate by a photocatalytic strategy under room temperature J. Catal. 410 2022 103 111 Lu T., Yang Z., Li H., Chen H., Xu J., Xu C.C., et al. Selective oxidation of ethyl lactate to ethyl pyruvate by a photocatalytic strategy under room temperature. J Catal 2022;410:103–111. [45] J. Wu W. Hua Y. Yue Z. Gao Efficient aerobic oxidation of ethyl lactate to ethyl pyruvate over V2O5/g-C3N4 catalysts ACS Omega 5 26 2020 16200 16207 Wu J., Hua W., Yue Y., Gao Z. Efficient Aerobic Oxidation of Ethyl Lactate to Ethyl Pyruvate over V2O5/g-C3N4 Catalysts. ACS Omega 2020;5(26):16200–16207. [46] H. Hayashi S. Sugiyama Y. Katayama K. Sakai M. Sugino N. Shigemoto Liquid-phase oxidation of ethyl lactate to pyruvate over suspended oxide catalysts J. Mol. Catal. 83 1 1993 207 217 Hayashi H., Sugiyama S., Katayama Y., Sakai K., Sugino M., Shigemoto N. Liquid-phase oxidation of ethyl lactate to pyruvate over suspended oxide catalysts. J Mol Catal 1993;83(1):207–217. [47] W. Zhang P. Oulego T.K. Slot G. Rothenberg N.R. Shiju Selective aerobic oxidation of lactate to pyruvate catalyzed by vanadium-nitrogen-doped carbon nanosheets ChemCatChem 11 15 2019 3381 3387 Zhang W., Oulego P., Slot T.K., Rothenberg G., Shiju N.R. Selective Aerobic Oxidation of Lactate to Pyruvate Catalyzed by Vanadium-Nitrogen-Doped Carbon Nanosheets. ChemCatChem 2019;11(15):3381–3387. [48] Y. Ju Z. Du C. Xiao X. Li S. Li Novel effect of zinc nitrate/vanadyl oxalate for selective catalytic oxidation of α-hydroxy esters to α-keto esters with molecular oxygen: an in situ ATR-IR study Molecules 24 7 2019 1281 Ju Y., Du Z., Xiao C., Li X., Li S. Novel Effect of Zinc Nitrate/Vanadyl Oxalate for Selective Catalytic Oxidation of α-Hydroxy Esters to α-Keto Esters with Molecular Oxygen: An In Situ ATR-IR Study. Molecules 2019;24(7):1281. [49] R.-M. Wang M. Feng F. Wang B. Xue J. Xu Vanadia catalysts supported on carbon nitride for selective oxidation of benzyl alcohol under atmospheric oxygen Catal. Lett. 2023 1 14 Wang R.-M., Feng M., Wang F., Xue B., Xu J. Vanadia Catalysts Supported on Carbon Nitride for Selective Oxidation of Benzyl Alcohol Under Atmospheric Oxygen. Catal Lett 2023:1–14. [50] S. Verma R. Nasir Baig M.N. Nadagouda R.S. Varma Photocatalytic C–H activation of hydrocarbons over VO@ g-C3N4 ACS Sustain Chem. Eng. 4 4 2016 2333 2336 Verma S., Nasir Baig R., Nadagouda M.N., Varma R.S. Photocatalytic C–H Activation of Hydrocarbons over VO@ g-C3N4. ACS Sustain Chem Eng 2016;4(4):2333–2336.",
      "scopus-id": "85184506175",
      "coredata": {
        "eid": "1-s2.0-S0926860X24000218",
        "dc:description": "Development of high-performance heterogeneous catalysts for the selective oxidation of ethyl lactate (EL) to ethyl pyruvate (EP) is very important in the field of sustainable chemistry. In this work, a series of carbon nitride (CN) doped wV x O y /CN-SBA-15 (w = 0.5–4.8%) catalysts were prepared. The doping of CN could significantly enhance the activity of V x O y /CN-SBA-15 catalyst due to the synergistic effect of V species, CN and SBA-15. The 2.6 V x O y /CN-SBA-15 was identified as the most optimum catalyst, offering a high EL conversion (93.0%) and EP selectivity (98.7%) at 130 °C after 3 h of reaction. The O2-TPD and H2-TPR results confirmed that the redox properties of 2.6 V x O y /CN-SBA-15 are significantly improved compared with 2.7 V x O y /SBA-15, which plays an important role in the oxidation reaction. In addition, the control experiments indicated that the pyridinic-N rather than pyrrolic-N of the VxOy/CN-SBA-15 catalyst accelerated the oxidation of EL to EP.",
        "openArchiveArticle": "false",
        "prism:coverDate": "2024-02-05",
        "openaccessUserLicense": null,
        "prism:aggregationType": "Journal",
        "prism:url": "https://api.elsevier.com/content/article/pii/S0926860X24000218",
        "dc:creator": [
          {
            "@_fa": "true",
            "$": "Liu, Zonghui"
          },
          {
            "@_fa": "true",
            "$": "Xu, Jing"
          },
          {
            "@_fa": "true",
            "$": "Cai, Chao"
          },
          {
            "@_fa": "true",
            "$": "Cai, Jiahao"
          },
          {
            "@_fa": "true",
            "$": "Dai, Qiaoling"
          },
          {
            "@_fa": "true",
            "$": "Du, Mingyang"
          },
          {
            "@_fa": "true",
            "$": "Wen, Zhe"
          },
          {
            "@_fa": "true",
            "$": "Yan, Bing"
          },
          {
            "@_fa": "true",
            "$": "Xue, Bing"
          }
        ],
        "link": [
          {
            "@_fa": "true",
            "@rel": "self",
            "@href": "https://api.elsevier.com/content/article/pii/S0926860X24000218"
          },
          {
            "@_fa": "true",
            "@rel": "scidir",
            "@href": "https://www.sciencedirect.com/science/article/pii/S0926860X24000218"
          }
        ],
        "dc:format": "application/json",
        "openaccessType": null,
        "pii": "S0926-860X(24)00021-8",
        "prism:volume": "671",
        "articleNumber": "119577",
        "prism:publisher": "Elsevier B.V.",
        "dc:title": "Carbon nitride doped V x O y /SBA-15 as highly efficient catalysts for the oxidation of ethyl lactate to ethyl pyruvate",
        "prism:copyright": "© 2024 Elsevier B.V. All rights reserved.",
        "openaccess": "0",
        "prism:issn": "0926860X",
        "dcterms:subject": [
          {
            "@_fa": "true",
            "$": "Ethyl lactate"
          },
          {
            "@_fa": "true",
            "$": "Ethyl pyruvate"
          },
          {
            "@_fa": "true",
            "$": "Oxidation reaction"
          },
          {
            "@_fa": "true",
            "$": "Carbon nitride"
          },
          {
            "@_fa": "true",
            "$": "Vanadia"
          }
        ],
        "openaccessArticle": "false",
        "prism:publicationName": "Applied Catalysis A: General",
        "openaccessSponsorType": null,
        "prism:pageRange": "119577",
        "pubType": "fla",
        "prism:coverDisplayDate": "5 February 2024",
        "prism:doi": "10.1016/j.apcata.2024.119577",
        "prism:startingPage": "119577",
        "dc:identifier": "doi:10.1016/j.apcata.2024.119577",
        "openaccessSponsorName": null
      },
      "objects": {
        "object": [
          {
            "@category": "standard",
            "@height": "624",
            "@width": "678",
            "@_fa": "true",
            "$": "https://api.elsevier.com/content/object/eid/1-s2.0-S0926860X24000218-gr6.jpg?httpAccept=%2A%2F%2A",
            "@multimediatype": "JPEG image file",
            "@type": "IMAGE-DOWNSAMPLED",
            "@size": "146411",
            "@ref": "gr6",
            "@mimetype": "image/jpeg"
          },
          {
            "@category": "standard",
            "@height": "277",
            "@width": "678",
            "@_fa": "true",
            "$": "https://api.elsevier.com/content/object/eid/1-s2.0-S0926860X24000218-gr7.jpg?httpAccept=%2A%2F%2A",
            "@multimediatype": "JPEG image file",
            "@type": "IMAGE-DOWNSAMPLED",
            "@size": "32017",
            "@ref": "gr7",
            "@mimetype": "image/jpeg"
          },
          {
            "@category": "standard",
            "@height": "323",
            "@width": "395",
            "@_fa": "true",
            "$": "https://api.elsevier.com/content/object/eid/1-s2.0-S0926860X24000218-gr4.jpg?httpAccept=%2A%2F%2A",
            "@multimediatype": "JPEG image file",
            "@type": "IMAGE-DOWNSAMPLED",
            "@size": "12344",
            "@ref": "gr4",
            "@mimetype": "image/jpeg"
          },
          {
            "@category": "standard",
            "@height": "725",
            "@width": "678",
            "@_fa": "true",
            "$": "https://api.elsevier.com/content/object/eid/1-s2.0-S0926860X24000218-gr5.jpg?httpAccept=%2A%2F%2A",
            "@multimediatype": "JPEG image file",
            "@type": "IMAGE-DOWNSAMPLED",
            "@size": "77699",
            "@ref": "gr5",
            "@mimetype": "image/jpeg"
          },
          {
            "@category": "standard",
            "@height": "420",
            "@width": "508",
            "@_fa": "true",
            "$": "https://api.elsevier.com/content/object/eid/1-s2.0-S0926860X24000218-gr8.jpg?httpAccept=%2A%2F%2A",
            "@multimediatype": "JPEG image file",
            "@type": "IMAGE-DOWNSAMPLED",
            "@size": "45522",
            "@ref": "gr8",
            "@mimetype": "image/jpeg"
          },
          {
            "@category": "standard",
            "@height": "637",
            "@width": "678",
            "@_fa": "true",
            "$": "https://api.elsevier.com/content/object/eid/1-s2.0-S0926860X24000218-sc1.jpg?httpAccept=%2A%2F%2A",
            "@multimediatype": "JPEG image file",
            "@type": "IMAGE-DOWNSAMPLED",
            "@size": "73054",
            "@ref": "sc1",
            "@mimetype": "image/jpeg"
          },
          {
            "@category": "standard",
            "@height": "509",
            "@width": "678",
            "@_fa": "true",
            "$": "https://api.elsevier.com/content/object/eid/1-s2.0-S0926860X24000218-gr2.jpg?httpAccept=%2A%2F%2A",
            "@multimediatype": "JPEG image file",
            "@type": "IMAGE-DOWNSAMPLED",
            "@size": "114099",
            "@ref": "gr2",
            "@mimetype": "image/jpeg"
          },
          {
            "@category": "standard",
            "@height": "200",
            "@width": "412",
            "@_fa": "true",
            "$": "https://api.elsevier.com/content/object/eid/1-s2.0-S0926860X24000218-ga1.jpg?httpAccept=%2A%2F%2A",
            "@multimediatype": "JPEG image file",
            "@type": "IMAGE-DOWNSAMPLED",
            "@size": "27736",
            "@ref": "ga1",
            "@mimetype": "image/jpeg"
          },
          {
            "@category": "standard",
            "@height": "306",
            "@width": "678",
            "@_fa": "true",
            "$": "https://api.elsevier.com/content/object/eid/1-s2.0-S0926860X24000218-gr3.jpg?httpAccept=%2A%2F%2A",
            "@multimediatype": "JPEG image file",
            "@type": "IMAGE-DOWNSAMPLED",
            "@size": "49296",
            "@ref": "gr3",
            "@mimetype": "image/jpeg"
          },
          {
            "@category": "standard",
            "@height": "589",
            "@width": "781",
            "@_fa": "true",
            "$": "https://api.elsevier.com/content/object/eid/1-s2.0-S0926860X24000218-gr1.jpg?httpAccept=%2A%2F%2A",
            "@multimediatype": "JPEG image file",
            "@type": "IMAGE-DOWNSAMPLED",
            "@size": "150826",
            "@ref": "gr1",
            "@mimetype": "image/jpeg"
          },
          {
            "@category": "thumbnail",
            "@height": "164",
            "@width": "178",
            "@_fa": "true",
            "$": "https://api.elsevier.com/content/object/eid/1-s2.0-S0926860X24000218-gr6.sml?httpAccept=%2A%2F%2A",
            "@multimediatype": "GIF image file",
            "@type": "IMAGE-THUMBNAIL",
            "@size": "11185",
            "@ref": "gr6",
            "@mimetype": "image/gif"
          },
          {
            "@category": "thumbnail",
            "@height": "90",
            "@width": "219",
            "@_fa": "true",
            "$": "https://api.elsevier.com/content/object/eid/1-s2.0-S0926860X24000218-gr7.sml?httpAccept=%2A%2F%2A",
            "@multimediatype": "GIF image file",
            "@type": "IMAGE-THUMBNAIL",
            "@size": "4968",
            "@ref": "gr7",
            "@mimetype": "image/gif"
          },
          {
            "@category": "thumbnail",
            "@height": "164",
            "@width": "200",
            "@_fa": "true",
            "$": "https://api.elsevier.com/content/object/eid/1-s2.0-S0926860X24000218-gr4.sml?httpAccept=%2A%2F%2A",
            "@multimediatype": "GIF image file",
            "@type": "IMAGE-THUMBNAIL",
            "@size": "3546",
            "@ref": "gr4",
            "@mimetype": "image/gif"
          },
          {
            "@category": "thumbnail",
            "@height": "164",
            "@width": "153",
            "@_fa": "true",
            "$": "https://api.elsevier.com/content/object/eid/1-s2.0-S0926860X24000218-gr5.sml?httpAccept=%2A%2F%2A",
            "@multimediatype": "GIF image file",
            "@type": "IMAGE-THUMBNAIL",
            "@size": "5706",
            "@ref": "gr5",
            "@mimetype": "image/gif"
          },
          {
            "@category": "thumbnail",
            "@height": "164",
            "@width": "198",
            "@_fa": "true",
            "$": "https://api.elsevier.com/content/object/eid/1-s2.0-S0926860X24000218-gr8.sml?httpAccept=%2A%2F%2A",
            "@multimediatype": "GIF image file",
            "@type": "IMAGE-THUMBNAIL",
            "@size": "9393",
            "@ref": "gr8",
            "@mimetype": "image/gif"
          },
          {
            "@category": "thumbnail",
            "@height": "163",
            "@width": "174",
            "@_fa": "true",
            "$": "https://api.elsevier.com/content/object/eid/1-s2.0-S0926860X24000218-sc1.sml?httpAccept=%2A%2F%2A",
            "@multimediatype": "GIF image file",
            "@type": "IMAGE-THUMBNAIL",
            "@size": "10591",
            "@ref": "sc1",
            "@mimetype": "image/gif"
          },
          {
            "@category": "thumbnail",
            "@height": "164",
            "@width": "218",
            "@_fa": "true",
            "$": "https://api.elsevier.com/content/object/eid/1-s2.0-S0926860X24000218-gr2.sml?httpAccept=%2A%2F%2A",
            "@multimediatype": "GIF image file",
            "@type": "IMAGE-THUMBNAIL",
            "@size": "23162",
            "@ref": "gr2",
            "@mimetype": "image/gif"
          },
          {
            "@category": "thumbnail",
            "@height": "106",
            "@width": "219",
            "@_fa": "true",
            "$": "https://api.elsevier.com/content/object/eid/1-s2.0-S0926860X24000218-ga1.sml?httpAccept=%2A%2F%2A",
            "@multimediatype": "GIF image file",
            "@type": "IMAGE-THUMBNAIL",
            "@size": "11414",
            "@ref": "ga1",
            "@mimetype": "image/gif"
          },
          {
            "@category": "thumbnail",
            "@height": "99",
            "@width": "219",
            "@_fa": "true",
            "$": "https://api.elsevier.com/content/object/eid/1-s2.0-S0926860X24000218-gr3.sml?httpAccept=%2A%2F%2A",
            "@multimediatype": "GIF image file",
            "@type": "IMAGE-THUMBNAIL",
            "@size": "6012",
            "@ref": "gr3",
            "@mimetype": "image/gif"
          },
          {
            "@category": "thumbnail",
            "@height": "164",
            "@width": "217",
            "@_fa": "true",
            "$": "https://api.elsevier.com/content/object/eid/1-s2.0-S0926860X24000218-gr1.sml?httpAccept=%2A%2F%2A",
            "@multimediatype": "GIF image file",
            "@type": "IMAGE-THUMBNAIL",
            "@size": "15215",
            "@ref": "gr1",
            "@mimetype": "image/gif"
          },
          {
            "@category": "high",
            "@height": "2754",
            "@width": "2994",
            "@_fa": "true",
            "$": "https://api.elsevier.com/content/object/eid/1-s2.0-S0926860X24000218-gr6_lrg.jpg?httpAccept=%2A%2F%2A",
            "@multimediatype": "JPEG image file",
            "@type": "IMAGE-HIGH-RES",
            "@size": "1284505",
            "@ref": "gr6",
            "@mimetype": "image/jpeg"
          },
          {
            "@category": "high",
            "@height": "1224",
            "@width": "2994",
            "@_fa": "true",
            "$": "https://api.elsevier.com/content/object/eid/1-s2.0-S0926860X24000218-gr7_lrg.jpg?httpAccept=%2A%2F%2A",
            "@multimediatype": "JPEG image file",
            "@type": "IMAGE-HIGH-RES",
            "@size": "179233",
            "@ref": "gr7",
            "@mimetype": "image/jpeg"
          },
          {
            "@category": "high",
            "@height": "1429",
            "@width": "1746",
            "@_fa": "true",
            "$": "https://api.elsevier.com/content/object/eid/1-s2.0-S0926860X24000218-gr4_lrg.jpg?httpAccept=%2A%2F%2A",
            "@multimediatype": "JPEG image file",
            "@type": "IMAGE-HIGH-RES",
            "@size": "74372",
            "@ref": "gr4",
            "@mimetype": "image/jpeg"
          },
          {
            "@category": "high",
            "@height": "3202",
            "@width": "2994",
            "@_fa": "true",
            "$": "https://api.elsevier.com/content/object/eid/1-s2.0-S0926860X24000218-gr5_lrg.jpg?httpAccept=%2A%2F%2A",
            "@multimediatype": "JPEG image file",
            "@type": "IMAGE-HIGH-RES",
            "@size": "475835",
            "@ref": "gr5",
            "@mimetype": "image/jpeg"
          },
          {
            "@category": "high",
            "@height": "1857",
            "@width": "2245",
            "@_fa": "true",
            "$": "https://api.elsevier.com/content/object/eid/1-s2.0-S0926860X24000218-gr8_lrg.jpg?httpAccept=%2A%2F%2A",
            "@multimediatype": "JPEG image file",
            "@type": "IMAGE-HIGH-RES",
            "@size": "262575",
            "@ref": "gr8",
            "@mimetype": "image/jpeg"
          },
          {
            "@category": "high",
            "@height": "2812",
            "@width": "2994",
            "@_fa": "true",
            "$": "https://api.elsevier.com/content/object/eid/1-s2.0-S0926860X24000218-sc1_lrg.jpg?httpAccept=%2A%2F%2A",
            "@multimediatype": "JPEG image file",
            "@type": "IMAGE-HIGH-RES",
            "@size": "328807",
            "@ref": "sc1",
            "@mimetype": "image/jpeg"
          },
          {
            "@category": "high",
            "@height": "2246",
            "@width": "2994",
            "@_fa": "true",
            "$": "https://api.elsevier.com/content/object/eid/1-s2.0-S0926860X24000218-gr2_lrg.jpg?httpAccept=%2A%2F%2A",
            "@multimediatype": "JPEG image file",
            "@type": "IMAGE-HIGH-RES",
            "@size": "598358",
            "@ref": "gr2",
            "@mimetype": "image/jpeg"
          },
          {
            "@category": "high",
            "@height": "886",
            "@width": "1824",
            "@_fa": "true",
            "$": "https://api.elsevier.com/content/object/eid/1-s2.0-S0926860X24000218-ga1_lrg.jpg?httpAccept=%2A%2F%2A",
            "@multimediatype": "JPEG image file",
            "@type": "IMAGE-HIGH-RES",
            "@size": "208643",
            "@ref": "ga1",
            "@mimetype": "image/jpeg"
          },
          {
            "@category": "high",
            "@height": "1351",
            "@width": "2994",
            "@_fa": "true",
            "$": "https://api.elsevier.com/content/object/eid/1-s2.0-S0926860X24000218-gr3_lrg.jpg?httpAccept=%2A%2F%2A",
            "@multimediatype": "JPEG image file",
            "@type": "IMAGE-HIGH-RES",
            "@size": "320861",
            "@ref": "gr3",
            "@mimetype": "image/jpeg"
          },
          {
            "@category": "high",
            "@height": "2608",
            "@width": "3457",
            "@_fa": "true",
            "$": "https://api.elsevier.com/content/object/eid/1-s2.0-S0926860X24000218-gr1_lrg.jpg?httpAccept=%2A%2F%2A",
            "@multimediatype": "JPEG image file",
            "@type": "IMAGE-HIGH-RES",
            "@size": "978270",
            "@ref": "gr1",
            "@mimetype": "image/jpeg"
          },
          {
            "@category": "standard",
            "@_fa": "true",
            "$": "https://api.elsevier.com/content/object/eid/1-s2.0-S0926860X24000218-mmc1.doc?httpAccept=%2A%2F%2A",
            "@multimediatype": "Microsoft Word file",
            "@type": "APPLICATION",
            "@size": "77824",
            "@ref": "mmc1",
            "@mimetype": "application/word"
          },
          {
            "@category": "standard",
            "@_fa": "true",
            "$": "https://api.elsevier.com/content/object/eid/1-s2.0-S0926860X24000218-am.pdf?httpAccept=%2A%2F%2A",
            "@multimediatype": "Acrobat PDF file",
            "@type": "AAM-PDF",
            "@size": "910393",
            "@ref": "am",
            "@mimetype": "application/pdf"
          }
        ]
      },
      "link": {
        "@rel": "abstract",
        "@href": "https://api.elsevier.com/content/abstract/scopus_id/85184506175"
      }
    }
  }
}