{
  "metadata": {
    "title": "Methane reforming to synthesis gas over Ni catalysts modified with noble metals",
    "authors": "; ; ",
    "journal": "Applied Catalysis A: General",
    "date": "2011-11-28",
    "doi": "10.1016/j.apcata.2011.09.018",
    "abstract": "",
    "uri": "https://api.elsevier.com/content/article/pii/S0926860X11005552",
    "pii": "S0926860X11005552"
  },
  "fulltext": {
    "full-text-retrieval-response": {
      "scopus-eid": "2-s2.0-80054933565",
      "originalText": "serial JL 271346 291210 291744 291809 31 Applied Catalysis A: General APPLIEDCATALYSISAGENERAL 2011-09-21 2011-09-21 2011-10-21T21:00:23 1-s2.0-S0926860X11005552 S0926-860X(11)00555-2 S0926860X11005552 10.1016/j.apcata.2011.09.018 S300 S300.1 FULL-TEXT 1-s2.0-S0926860X11X00170 2024-01-01T12:28:01.610683Z 0 0 20111128 2011 2011-09-21T00:00:00Z articleinfo crossmark dco dateupdated tomb dateloaded datesearch indexeddate issuelist volumelist yearnav absattachment articletitlenorm authfirstinitialnorm authfirstsurnamenorm cid cids contenttype copyright dateloadedtxt docsubtype doctype doi eid ewtransactionid hubeid issfirst issn issnnorm itemstage itemtransactionid itemweight openaccess openarchive pg pgfirst pglast pii piinorm pubdatestart pubdatetxt pubyr sectiontitle sortorder srctitle srctitlenorm srctype subheadings volfirst volissue webpdf webpdfpagecount figure table body affil articletitle auth authfirstini authfull authkeywords authlast primabst pubtype ref specialabst alllist content subj ssids 0926-860X 0926860X 408 408 1 2 1 2 Volume 408, Issues 1–2 3 1 24 1 24 20111128 28 November 2011 2011-11-28 2011 Review article rev Copyright © 2011 Elsevier B.V. All rights reserved. METHANEREFORMINGSYNTHESISGASOVERNICATALYSTSMODIFIEDNOBLEMETALS LI D 1 Introduction 2 Preparation and structure of Ni metal particles modified with small amounts of noble metals 2.1 Ni metal particles modified with noble metals supported on γ-Al2O3 2.2 Ni metal particles modified with noble metals supported on α-Al2O3 and NiO–MgO solid solutions 2.3 Ni metal particles modified with noble metals supported on other supports 3 Activity 4 Suppression of Ni oxidation and promotion of Ni reduction 4.1 Suppression of deactivation due to oxidation of Ni metals 4.2 Suppression of hot spot formation 5 Suppression of carbon formation 6 Catalyst activation by the reactants under mild conditions: self-activation behavior 7 Sustainability in the daily startup and shutdown operation 8 Conclusions References PENA 1996 7 57 M AASBERGPETERSEN 2001 379 387 K ROSTRUPNIELSEN 1993 305 324 J LUNSFORD 2000 165 174 J ARMOR 1999 159 176 J ROSTRUPNIELSEN 2002 150 159 J DICKS 1996 113 124 A AHMED 2001 291 301 S BROWN 2001 381 397 L DIBBERN 1986 71 74 H QIN 1994 551 560 D DYBKJAER 1995 85 107 I ROSTRUPNIELSEN 1977 155 165 J TRIMM 1997 233 238 D TRIMM 1999 3 10 D ROSTRUPNIELSEN 1984 J CATALYTICSTEAMREFORMINGCATALYSISSCIENCETECHNOLOGY EDWARDS 1995 269 289 J WANG 1996 896 904 S ROSTRUPNIELSEN 2002 243 247 J HU 2004 297 345 Y YORK 2003 345 358 A ASHCROFT 1991 225 226 A TOMISHIGE 2007 287 298 K CHOUDHARY 2008 1828 1847 T DRY 2002 227 241 M YANG 2007 99 105 G LI 2009 26 34 X TSUBAKI 2001 224 227 N KUNG 1980 235 259 H LANGE 2001 3 8 J FAURGHENCIU 2002 389 399 A OHI 2006 194 203 T ZHOU 2009 101 107 L SASAKI 2006 1 3823 T SASAKI 2007 140 149 T WEI 2004 370 383 J ROSTRUPNIELSEN 1993 38 49 J NAVARRO 2007 3952 3991 R FRENI 2000 28 38 S CHEN 1996 91 95 Y CHEN 1997 335 347 Y BECERRA 2002 385 392 A CRISAFULLI 1999 21 26 C CRISAFULLI 2002 1 9 C PAWELEC 2007 188 201 B DAMYANOVA 2009 250 261 S RIVAS 2008 10 19 M HORVATH 2011 102 111 A HOU 2003 193 197 Z HOU 2006 555 561 Z OZKARAAYDINOGLU 2011 2950 2959 S GARCIADIEGUEZ 2010 136 145 M GARCIADIEGUEZ 2010 11 20 M ARAUJO 2008 129 135 G GARCIADIEGUEZ 2010 191 199 M BASILE 2002 215 223 F MIYATA 2006 97 104 T MIYATA 2007 447 451 T LI 2007 299 312 D LI 2007 98 109 D LI 2008 225 236 D LI 2009 169 179 D ZHAN 2009 147 154 Y JEONG 2006 151 156 J FOLETTO 2006 531 534 E LUNA 1999 247 252 E PARIZOTTO 2009 122 129 N ENGER 2010 13 23 B JI 2001 45 48 Y BASILE 2001 21 30 F CHOUDHARY 1995 752 754 V NURUNNABI 2006 488 493 M NURUNNABI 2006 1 12 M NURUNNABI 2006 73 78 M NURUNNABI 2006 145 156 M KADO 2007 59 72 S NURUNNABI 2005 277 281 M NURUNNABI 2005 272 280 M LI 2006 62 71 B MUKAINAKANO 2007 252 264 Y NURUNNABI 2007 154 162 M NURUNNABI 2006 1072 1073 M YOSHIDA 2009 186 192 K YOSHIDA 2008 217 225 K MUKAINAKANO 2008 101 108 Y MUKAINAKANO 2008 4891 4901 Y LI 2007 144 155 B NAGAOKA 2005 185 196 K DIAS 2004 106 110 J DIAS 2005 176 181 J DIAS 2008 243 250 J OPOKUGYAMFI 1999 113 122 K TOMISHIGE 2002 69 74 K TOMISHIGE 2003 71 82 K REED 1971 T FREEENERGYFORMATIONBINARYCOMPOUNDS CONNER 1995 759 788 W TOMISHIGE 2000 383 393 K UEDA 2000 14 22 R HU 1996 163 169 C PONCELET 2005 232 242 G UECKERT 1997 75 85 T JABLONSKI 1999 189 198 E LIU 2001 155 160 D LI 2003 63 70 X YAMAZAKI 1996 49 56 O CHEN 1999 479 490 Y SHEU 1989 4890 4894 L LIOTTA 1996 322 333 L BERTARIONE 2004 3603 3613 S TOMISHIGE 1998 3 15 K LI 2005 36 45 B LI 2004 157 172 B TOMISHIGE 2002 35 44 K NAITO 2008 138 146 S TANAKA 2009 1 8 H TANAKA 2010 175 186 H TANAKA 2010 187 194 H WANG 1998 271 280 S CHENG 2001 31 36 Z LI 2006 16 24 G LI 2005 7 17 B TOMISHIGE 2000 1891 1897 K NAGAOKA 2004 151 158 K NAGAOKA 2003 13 21 K NAGAOKA 2002 6 1007 K MATSUO 2000 439 445 Y TOMISHIGE 2001 11 15 K TOMISHIGE 2002 225 238 K TOMISHIGE 1999 91 103 K BESENBACHER 1998 1913 1915 F TOMISHIGE 1998 35 39 K NAKAMURA 2009 36 44 K TAKEHIRA 2004 43 54 K TAKEHIRA 2003 3801 3810 K SHISHIDO 2002 35 42 T SHISHIDO 2002 752 753 T SEHESTED 2006 237 246 J RASMUSSEN 2004 165 173 F CHRISTENSEN 2006 9 22 K SEHESTED 2001 200 209 J SEHESTED 2003 417 426 J SEHESTED 2004 432 443 J LIX2011X1 LIX2011X1X24 LIX2011X1XD LIX2011X1X24XD item S0926-860X(11)00555-2 S0926860X11005552 1-s2.0-S0926860X11005552 10.1016/j.apcata.2011.09.018 271346 2024-01-01T12:28:01.610683Z 2011-11-28 1-s2.0-S0926860X11005552-main.pdf https://s3.amazonaws.com/prod-ucs-content-store-us-east/content/pii:S0926860X11005552/MAIN/application/pdf/90396129d7ad44d09eeded371d86225b/main.pdf https://s3-eu-west-1.amazonaws.com/prod-ucs-content-store-eu-west/content/pii:S0926860X11005552/MAIN/application/pdf/90396129d7ad44d09eeded371d86225b/main.pdf main.pdf pdf true 2696237 MAIN 24 1-s2.0-S0926860X11005552-main_1.png https://s3-eu-west-1.amazonaws.com/prod-ucs-content-store-eu-west/content/pii:S0926860X11005552/PREVIEW/image/png/932a3b61d99d738ed57e49bb16574354/main_1.png https://s3.amazonaws.com/prod-ucs-content-store-us-east/content/pii:S0926860X11005552/PREVIEW/image/png/932a3b61d99d738ed57e49bb16574354/main_1.png main_1.png png 46779 849 656 IMAGE-WEB-PDF 1 1-s2.0-S0926860X11005552-fx1.jpg https://s3.amazonaws.com/prod-ucs-content-store-us-east/content/pii:S0926860X11005552/fx1/DOWNSAMPLED/image/jpeg/f86977f898e3daef94ba0bd2b38a231c/fx1.jpg https://s3-eu-west-1.amazonaws.com/prod-ucs-content-store-eu-west/content/pii:S0926860X11005552/fx1/DOWNSAMPLED/image/jpeg/f86977f898e3daef94ba0bd2b38a231c/fx1.jpg fx1 true fx1.jpg jpg 19874 200 500 IMAGE-DOWNSAMPLED 1-s2.0-S0926860X11005552-fx1.sml https://s3.amazonaws.com/prod-ucs-content-store-us-east/content/pii:S0926860X11005552/fx1/THUMBNAIL/image/gif/f8592088c18b64143b7895d8a30b52fa/fx1.sml https://s3-eu-west-1.amazonaws.com/prod-ucs-content-store-eu-west/content/pii:S0926860X11005552/fx1/THUMBNAIL/image/gif/f8592088c18b64143b7895d8a30b52fa/fx1.sml fx1 true fx1.sml sml 3479 88 219 IMAGE-THUMBNAIL 1-s2.0-S0926860X11005552-fx1_lrg.jpg https://s3.amazonaws.com/prod-ucs-content-store-us-east/content/pii:S0926860X11005552/fx1/HIGHRES/image/jpeg/b4ac6d1d8053db707b7b33471ba7dd0a/fx1_lrg.jpg https://s3-eu-west-1.amazonaws.com/prod-ucs-content-store-eu-west/content/pii:S0926860X11005552/fx1/HIGHRES/image/jpeg/b4ac6d1d8053db707b7b33471ba7dd0a/fx1_lrg.jpg fx1 fx1_lrg.jpg jpg 149500 886 2213 IMAGE-HIGH-RES 1-s2.0-S0926860X11005552-gr1.jpg https://s3.amazonaws.com/prod-ucs-content-store-us-east/content/pii:S0926860X11005552/gr1/DOWNSAMPLED/image/jpeg/3b174336435bead8327347de7d06b48c/gr1.jpg https://s3-eu-west-1.amazonaws.com/prod-ucs-content-store-eu-west/content/pii:S0926860X11005552/gr1/DOWNSAMPLED/image/jpeg/3b174336435bead8327347de7d06b48c/gr1.jpg gr1 gr1.jpg jpg 63429 841 321 IMAGE-DOWNSAMPLED 1-s2.0-S0926860X11005552-gr1.sml https://s3.amazonaws.com/prod-ucs-content-store-us-east/content/pii:S0926860X11005552/gr1/THUMBNAIL/image/gif/c33aeed4390cae67a39c271572605e85/gr1.sml https://s3-eu-west-1.amazonaws.com/prod-ucs-content-store-eu-west/content/pii:S0926860X11005552/gr1/THUMBNAIL/image/gif/c33aeed4390cae67a39c271572605e85/gr1.sml gr1 gr1.sml sml 2086 162 62 IMAGE-THUMBNAIL 1-s2.0-S0926860X11005552-gr1_lrg.jpg https://s3.amazonaws.com/prod-ucs-content-store-us-east/content/pii:S0926860X11005552/gr1/HIGHRES/image/jpeg/42c2b58f8b67bfeb4fa7de2fa7a02302/gr1_lrg.jpg https://s3-eu-west-1.amazonaws.com/prod-ucs-content-store-eu-west/content/pii:S0926860X11005552/gr1/HIGHRES/image/jpeg/42c2b58f8b67bfeb4fa7de2fa7a02302/gr1_lrg.jpg gr1 gr1_lrg.jpg jpg 472280 3730 1424 IMAGE-HIGH-RES 1-s2.0-S0926860X11005552-gr10.jpg https://s3.amazonaws.com/prod-ucs-content-store-us-east/content/pii:S0926860X11005552/gr10/DOWNSAMPLED/image/jpeg/86532a0f2de4b44fcd4d5cf5fc7265a1/gr10.jpg https://s3-eu-west-1.amazonaws.com/prod-ucs-content-store-eu-west/content/pii:S0926860X11005552/gr10/DOWNSAMPLED/image/jpeg/86532a0f2de4b44fcd4d5cf5fc7265a1/gr10.jpg gr10 gr10.jpg jpg 21615 330 302 IMAGE-DOWNSAMPLED 1-s2.0-S0926860X11005552-gr10.sml https://s3.amazonaws.com/prod-ucs-content-store-us-east/content/pii:S0926860X11005552/gr10/THUMBNAIL/image/gif/2212f3ef824de74959da2b7c14044402/gr10.sml https://s3-eu-west-1.amazonaws.com/prod-ucs-content-store-eu-west/content/pii:S0926860X11005552/gr10/THUMBNAIL/image/gif/2212f3ef824de74959da2b7c14044402/gr10.sml gr10 gr10.sml sml 4344 164 150 IMAGE-THUMBNAIL 1-s2.0-S0926860X11005552-gr10_lrg.jpg https://s3.amazonaws.com/prod-ucs-content-store-us-east/content/pii:S0926860X11005552/gr10/HIGHRES/image/jpeg/26de00c156e4ac0da12d7e7bbcc4b87f/gr10_lrg.jpg https://s3-eu-west-1.amazonaws.com/prod-ucs-content-store-eu-west/content/pii:S0926860X11005552/gr10/HIGHRES/image/jpeg/26de00c156e4ac0da12d7e7bbcc4b87f/gr10_lrg.jpg gr10 gr10_lrg.jpg jpg 191188 1464 1339 IMAGE-HIGH-RES 1-s2.0-S0926860X11005552-gr11.jpg https://s3.amazonaws.com/prod-ucs-content-store-us-east/content/pii:S0926860X11005552/gr11/DOWNSAMPLED/image/jpeg/1e446e8ac871806e5cb2b0344e9a8cc9/gr11.jpg https://s3-eu-west-1.amazonaws.com/prod-ucs-content-store-eu-west/content/pii:S0926860X11005552/gr11/DOWNSAMPLED/image/jpeg/1e446e8ac871806e5cb2b0344e9a8cc9/gr11.jpg gr11 gr11.jpg jpg 26525 322 320 IMAGE-DOWNSAMPLED 1-s2.0-S0926860X11005552-gr11.sml https://s3.amazonaws.com/prod-ucs-content-store-us-east/content/pii:S0926860X11005552/gr11/THUMBNAIL/image/gif/13ad015c015d2a5c5707106717bd4981/gr11.sml https://s3-eu-west-1.amazonaws.com/prod-ucs-content-store-eu-west/content/pii:S0926860X11005552/gr11/THUMBNAIL/image/gif/13ad015c015d2a5c5707106717bd4981/gr11.sml gr11 gr11.sml sml 2925 164 163 IMAGE-THUMBNAIL 1-s2.0-S0926860X11005552-gr11_lrg.jpg https://s3.amazonaws.com/prod-ucs-content-store-us-east/content/pii:S0926860X11005552/gr11/HIGHRES/image/jpeg/1c51d2d2732edb3ae6789b0283b8a0c9/gr11_lrg.jpg https://s3-eu-west-1.amazonaws.com/prod-ucs-content-store-eu-west/content/pii:S0926860X11005552/gr11/HIGHRES/image/jpeg/1c51d2d2732edb3ae6789b0283b8a0c9/gr11_lrg.jpg gr11 gr11_lrg.jpg jpg 150510 1424 1417 IMAGE-HIGH-RES 1-s2.0-S0926860X11005552-gr12.jpg https://s3.amazonaws.com/prod-ucs-content-store-us-east/content/pii:S0926860X11005552/gr12/DOWNSAMPLED/image/jpeg/9c796f19f06a771130d4a61400f7f575/gr12.jpg https://s3-eu-west-1.amazonaws.com/prod-ucs-content-store-eu-west/content/pii:S0926860X11005552/gr12/DOWNSAMPLED/image/jpeg/9c796f19f06a771130d4a61400f7f575/gr12.jpg gr12 gr12.jpg jpg 53839 340 556 IMAGE-DOWNSAMPLED 1-s2.0-S0926860X11005552-gr12.sml https://s3.amazonaws.com/prod-ucs-content-store-us-east/content/pii:S0926860X11005552/gr12/THUMBNAIL/image/gif/762ddea16a9c8433ca6c5d5431b64946/gr12.sml https://s3-eu-west-1.amazonaws.com/prod-ucs-content-store-eu-west/content/pii:S0926860X11005552/gr12/THUMBNAIL/image/gif/762ddea16a9c8433ca6c5d5431b64946/gr12.sml gr12 gr12.sml sml 10194 134 219 IMAGE-THUMBNAIL 1-s2.0-S0926860X11005552-gr12_lrg.jpg https://s3.amazonaws.com/prod-ucs-content-store-us-east/content/pii:S0926860X11005552/gr12/HIGHRES/image/jpeg/cc10c35d1010138a6520bcac05a17a7e/gr12_lrg.jpg https://s3-eu-west-1.amazonaws.com/prod-ucs-content-store-eu-west/content/pii:S0926860X11005552/gr12/HIGHRES/image/jpeg/cc10c35d1010138a6520bcac05a17a7e/gr12_lrg.jpg gr12 gr12_lrg.jpg jpg 466139 1507 2463 IMAGE-HIGH-RES 1-s2.0-S0926860X11005552-gr13.jpg https://s3.amazonaws.com/prod-ucs-content-store-us-east/content/pii:S0926860X11005552/gr13/DOWNSAMPLED/image/jpeg/a10f6caeb96519c7beb0528d99e7a89f/gr13.jpg https://s3-eu-west-1.amazonaws.com/prod-ucs-content-store-eu-west/content/pii:S0926860X11005552/gr13/DOWNSAMPLED/image/jpeg/a10f6caeb96519c7beb0528d99e7a89f/gr13.jpg gr13 gr13.jpg jpg 30323 235 342 IMAGE-DOWNSAMPLED 1-s2.0-S0926860X11005552-gr13.sml https://s3.amazonaws.com/prod-ucs-content-store-us-east/content/pii:S0926860X11005552/gr13/THUMBNAIL/image/gif/10f21b5c59548720040f174ebfa306d2/gr13.sml https://s3-eu-west-1.amazonaws.com/prod-ucs-content-store-eu-west/content/pii:S0926860X11005552/gr13/THUMBNAIL/image/gif/10f21b5c59548720040f174ebfa306d2/gr13.sml gr13 gr13.sml sml 5087 150 219 IMAGE-THUMBNAIL 1-s2.0-S0926860X11005552-gr13_lrg.jpg https://s3.amazonaws.com/prod-ucs-content-store-us-east/content/pii:S0926860X11005552/gr13/HIGHRES/image/jpeg/7a0e2acce2bbe2b88273eafbfe0b39fd/gr13_lrg.jpg https://s3-eu-west-1.amazonaws.com/prod-ucs-content-store-eu-west/content/pii:S0926860X11005552/gr13/HIGHRES/image/jpeg/7a0e2acce2bbe2b88273eafbfe0b39fd/gr13_lrg.jpg gr13 gr13_lrg.jpg jpg 199396 1041 1517 IMAGE-HIGH-RES 1-s2.0-S0926860X11005552-gr14.jpg https://s3.amazonaws.com/prod-ucs-content-store-us-east/content/pii:S0926860X11005552/gr14/DOWNSAMPLED/image/jpeg/8ffe812fe865e3e42bd2d485a069585e/gr14.jpg https://s3-eu-west-1.amazonaws.com/prod-ucs-content-store-eu-west/content/pii:S0926860X11005552/gr14/DOWNSAMPLED/image/jpeg/8ffe812fe865e3e42bd2d485a069585e/gr14.jpg gr14 gr14.jpg jpg 24889 289 338 IMAGE-DOWNSAMPLED 1-s2.0-S0926860X11005552-gr14.sml https://s3.amazonaws.com/prod-ucs-content-store-us-east/content/pii:S0926860X11005552/gr14/THUMBNAIL/image/gif/27541cdbf082b62b81dcfb8cbe6173e0/gr14.sml https://s3-eu-west-1.amazonaws.com/prod-ucs-content-store-eu-west/content/pii:S0926860X11005552/gr14/THUMBNAIL/image/gif/27541cdbf082b62b81dcfb8cbe6173e0/gr14.sml gr14 gr14.sml sml 5805 163 191 IMAGE-THUMBNAIL 1-s2.0-S0926860X11005552-gr14_lrg.jpg https://s3.amazonaws.com/prod-ucs-content-store-us-east/content/pii:S0926860X11005552/gr14/HIGHRES/image/jpeg/5c78c7b326f53a045203885a60b5b339/gr14_lrg.jpg https://s3-eu-west-1.amazonaws.com/prod-ucs-content-store-eu-west/content/pii:S0926860X11005552/gr14/HIGHRES/image/jpeg/5c78c7b326f53a045203885a60b5b339/gr14_lrg.jpg gr14 gr14_lrg.jpg jpg 200404 1280 1496 IMAGE-HIGH-RES 1-s2.0-S0926860X11005552-gr15.jpg https://s3.amazonaws.com/prod-ucs-content-store-us-east/content/pii:S0926860X11005552/gr15/DOWNSAMPLED/image/jpeg/4852a208dff3936b55aa30aad83daf0b/gr15.jpg https://s3-eu-west-1.amazonaws.com/prod-ucs-content-store-eu-west/content/pii:S0926860X11005552/gr15/DOWNSAMPLED/image/jpeg/4852a208dff3936b55aa30aad83daf0b/gr15.jpg gr15 gr15.jpg jpg 31074 243 384 IMAGE-DOWNSAMPLED 1-s2.0-S0926860X11005552-gr15.sml https://s3.amazonaws.com/prod-ucs-content-store-us-east/content/pii:S0926860X11005552/gr15/THUMBNAIL/image/gif/6a14c170c6089b083585fa44f72361c7/gr15.sml https://s3-eu-west-1.amazonaws.com/prod-ucs-content-store-eu-west/content/pii:S0926860X11005552/gr15/THUMBNAIL/image/gif/6a14c170c6089b083585fa44f72361c7/gr15.sml gr15 gr15.sml sml 5984 139 219 IMAGE-THUMBNAIL 1-s2.0-S0926860X11005552-gr15_lrg.jpg https://s3.amazonaws.com/prod-ucs-content-store-us-east/content/pii:S0926860X11005552/gr15/HIGHRES/image/jpeg/ed13206ca4d411d762643ad6feaf92a5/gr15_lrg.jpg https://s3-eu-west-1.amazonaws.com/prod-ucs-content-store-eu-west/content/pii:S0926860X11005552/gr15/HIGHRES/image/jpeg/ed13206ca4d411d762643ad6feaf92a5/gr15_lrg.jpg gr15 gr15_lrg.jpg jpg 197251 1077 1702 IMAGE-HIGH-RES 1-s2.0-S0926860X11005552-gr16.jpg https://s3.amazonaws.com/prod-ucs-content-store-us-east/content/pii:S0926860X11005552/gr16/DOWNSAMPLED/image/jpeg/de4313d5c60e2e27280ba6fad2efa17e/gr16.jpg https://s3-eu-west-1.amazonaws.com/prod-ucs-content-store-eu-west/content/pii:S0926860X11005552/gr16/DOWNSAMPLED/image/jpeg/de4313d5c60e2e27280ba6fad2efa17e/gr16.jpg gr16 gr16.jpg jpg 45093 418 533 IMAGE-DOWNSAMPLED 1-s2.0-S0926860X11005552-gr16.sml https://s3.amazonaws.com/prod-ucs-content-store-us-east/content/pii:S0926860X11005552/gr16/THUMBNAIL/image/gif/6ce71abd32b6c78152b2263e6f0f8664/gr16.sml https://s3-eu-west-1.amazonaws.com/prod-ucs-content-store-eu-west/content/pii:S0926860X11005552/gr16/THUMBNAIL/image/gif/6ce71abd32b6c78152b2263e6f0f8664/gr16.sml gr16 gr16.sml sml 4357 164 209 IMAGE-THUMBNAIL 1-s2.0-S0926860X11005552-gr16_lrg.jpg https://s3.amazonaws.com/prod-ucs-content-store-us-east/content/pii:S0926860X11005552/gr16/HIGHRES/image/jpeg/c0fee4c368681d5612247a9b62864ae3/gr16_lrg.jpg https://s3-eu-west-1.amazonaws.com/prod-ucs-content-store-eu-west/content/pii:S0926860X11005552/gr16/HIGHRES/image/jpeg/c0fee4c368681d5612247a9b62864ae3/gr16_lrg.jpg gr16 gr16_lrg.jpg jpg 305695 1854 2362 IMAGE-HIGH-RES 1-s2.0-S0926860X11005552-gr17.jpg https://s3.amazonaws.com/prod-ucs-content-store-us-east/content/pii:S0926860X11005552/gr17/DOWNSAMPLED/image/jpeg/3ad21b8957df1414c447f5053bedcac3/gr17.jpg https://s3-eu-west-1.amazonaws.com/prod-ucs-content-store-eu-west/content/pii:S0926860X11005552/gr17/DOWNSAMPLED/image/jpeg/3ad21b8957df1414c447f5053bedcac3/gr17.jpg gr17 gr17.jpg jpg 61355 356 558 IMAGE-DOWNSAMPLED 1-s2.0-S0926860X11005552-gr17.sml https://s3.amazonaws.com/prod-ucs-content-store-us-east/content/pii:S0926860X11005552/gr17/THUMBNAIL/image/gif/ba41939749ece06dd78705bc515aa339/gr17.sml https://s3-eu-west-1.amazonaws.com/prod-ucs-content-store-eu-west/content/pii:S0926860X11005552/gr17/THUMBNAIL/image/gif/ba41939749ece06dd78705bc515aa339/gr17.sml gr17 gr17.sml sml 6300 140 219 IMAGE-THUMBNAIL 1-s2.0-S0926860X11005552-gr17_lrg.jpg https://s3.amazonaws.com/prod-ucs-content-store-us-east/content/pii:S0926860X11005552/gr17/HIGHRES/image/jpeg/ad03f299f5db87f62e17458e532afd91/gr17_lrg.jpg https://s3-eu-west-1.amazonaws.com/prod-ucs-content-store-eu-west/content/pii:S0926860X11005552/gr17/HIGHRES/image/jpeg/ad03f299f5db87f62e17458e532afd91/gr17_lrg.jpg gr17 gr17_lrg.jpg jpg 487385 1577 2472 IMAGE-HIGH-RES 1-s2.0-S0926860X11005552-gr18.jpg https://s3.amazonaws.com/prod-ucs-content-store-us-east/content/pii:S0926860X11005552/gr18/DOWNSAMPLED/image/jpeg/2191a42ba62a34ab9bd29d448092fdf0/gr18.jpg https://s3-eu-west-1.amazonaws.com/prod-ucs-content-store-eu-west/content/pii:S0926860X11005552/gr18/DOWNSAMPLED/image/jpeg/2191a42ba62a34ab9bd29d448092fdf0/gr18.jpg gr18 gr18.jpg jpg 29009 360 378 IMAGE-DOWNSAMPLED 1-s2.0-S0926860X11005552-gr18.sml https://s3.amazonaws.com/prod-ucs-content-store-us-east/content/pii:S0926860X11005552/gr18/THUMBNAIL/image/gif/9d4a7545c24cc00754ba9f979fe33460/gr18.sml https://s3-eu-west-1.amazonaws.com/prod-ucs-content-store-eu-west/content/pii:S0926860X11005552/gr18/THUMBNAIL/image/gif/9d4a7545c24cc00754ba9f979fe33460/gr18.sml gr18 gr18.sml sml 4624 164 172 IMAGE-THUMBNAIL 1-s2.0-S0926860X11005552-gr18_lrg.jpg https://s3.amazonaws.com/prod-ucs-content-store-us-east/content/pii:S0926860X11005552/gr18/HIGHRES/image/jpeg/95b3ceb424425f585b1145ee18c55536/gr18_lrg.jpg https://s3-eu-west-1.amazonaws.com/prod-ucs-content-store-eu-west/content/pii:S0926860X11005552/gr18/HIGHRES/image/jpeg/95b3ceb424425f585b1145ee18c55536/gr18_lrg.jpg gr18 gr18_lrg.jpg jpg 241879 1594 1675 IMAGE-HIGH-RES 1-s2.0-S0926860X11005552-gr19.jpg https://s3.amazonaws.com/prod-ucs-content-store-us-east/content/pii:S0926860X11005552/gr19/DOWNSAMPLED/image/jpeg/e6b44143191e76275a2304c1e53aca3f/gr19.jpg https://s3-eu-west-1.amazonaws.com/prod-ucs-content-store-eu-west/content/pii:S0926860X11005552/gr19/DOWNSAMPLED/image/jpeg/e6b44143191e76275a2304c1e53aca3f/gr19.jpg gr19 gr19.jpg jpg 32223 378 419 IMAGE-DOWNSAMPLED 1-s2.0-S0926860X11005552-gr19.sml https://s3.amazonaws.com/prod-ucs-content-store-us-east/content/pii:S0926860X11005552/gr19/THUMBNAIL/image/gif/7f7f447ac4c57afc4f91f019cbff0bc7/gr19.sml https://s3-eu-west-1.amazonaws.com/prod-ucs-content-store-eu-west/content/pii:S0926860X11005552/gr19/THUMBNAIL/image/gif/7f7f447ac4c57afc4f91f019cbff0bc7/gr19.sml gr19 gr19.sml sml 4729 163 181 IMAGE-THUMBNAIL 1-s2.0-S0926860X11005552-gr19_lrg.jpg https://s3.amazonaws.com/prod-ucs-content-store-us-east/content/pii:S0926860X11005552/gr19/HIGHRES/image/jpeg/890f615f362293a5964fee53674ee3c5/gr19_lrg.jpg https://s3-eu-west-1.amazonaws.com/prod-ucs-content-store-eu-west/content/pii:S0926860X11005552/gr19/HIGHRES/image/jpeg/890f615f362293a5964fee53674ee3c5/gr19_lrg.jpg gr19 gr19_lrg.jpg jpg 277964 1674 1854 IMAGE-HIGH-RES 1-s2.0-S0926860X11005552-gr2.jpg https://s3.amazonaws.com/prod-ucs-content-store-us-east/content/pii:S0926860X11005552/gr2/DOWNSAMPLED/image/jpeg/a51ba4e43a3e1b1d4395d5f2020d3c3f/gr2.jpg https://s3-eu-west-1.amazonaws.com/prod-ucs-content-store-eu-west/content/pii:S0926860X11005552/gr2/DOWNSAMPLED/image/jpeg/a51ba4e43a3e1b1d4395d5f2020d3c3f/gr2.jpg gr2 gr2.jpg jpg 23646 429 319 IMAGE-DOWNSAMPLED 1-s2.0-S0926860X11005552-gr2.sml https://s3.amazonaws.com/prod-ucs-content-store-us-east/content/pii:S0926860X11005552/gr2/THUMBNAIL/image/gif/6f9201fb02c6aea2ca1e208a09aa683d/gr2.sml https://s3-eu-west-1.amazonaws.com/prod-ucs-content-store-eu-west/content/pii:S0926860X11005552/gr2/THUMBNAIL/image/gif/6f9201fb02c6aea2ca1e208a09aa683d/gr2.sml gr2 gr2.sml sml 3486 164 122 IMAGE-THUMBNAIL 1-s2.0-S0926860X11005552-gr2_lrg.jpg https://s3.amazonaws.com/prod-ucs-content-store-us-east/content/pii:S0926860X11005552/gr2/HIGHRES/image/jpeg/fb6cbe039e43eb5840f458cfbdb3683a/gr2_lrg.jpg https://s3-eu-west-1.amazonaws.com/prod-ucs-content-store-eu-west/content/pii:S0926860X11005552/gr2/HIGHRES/image/jpeg/fb6cbe039e43eb5840f458cfbdb3683a/gr2_lrg.jpg gr2 gr2_lrg.jpg jpg 177501 1900 1413 IMAGE-HIGH-RES 1-s2.0-S0926860X11005552-gr20.jpg https://s3.amazonaws.com/prod-ucs-content-store-us-east/content/pii:S0926860X11005552/gr20/DOWNSAMPLED/image/jpeg/48bc9a1b5a407a25423c4ed39a56608c/gr20.jpg https://s3-eu-west-1.amazonaws.com/prod-ucs-content-store-eu-west/content/pii:S0926860X11005552/gr20/DOWNSAMPLED/image/jpeg/48bc9a1b5a407a25423c4ed39a56608c/gr20.jpg gr20 gr20.jpg jpg 21732 324 346 IMAGE-DOWNSAMPLED 1-s2.0-S0926860X11005552-gr20.sml https://s3.amazonaws.com/prod-ucs-content-store-us-east/content/pii:S0926860X11005552/gr20/THUMBNAIL/image/gif/f89a65002221ef5dd6110d804459c763/gr20.sml https://s3-eu-west-1.amazonaws.com/prod-ucs-content-store-eu-west/content/pii:S0926860X11005552/gr20/THUMBNAIL/image/gif/f89a65002221ef5dd6110d804459c763/gr20.sml gr20 gr20.sml sml 4443 164 175 IMAGE-THUMBNAIL 1-s2.0-S0926860X11005552-gr20_lrg.jpg https://s3.amazonaws.com/prod-ucs-content-store-us-east/content/pii:S0926860X11005552/gr20/HIGHRES/image/jpeg/d5721fc36a0309117603ad3634f333e4/gr20_lrg.jpg https://s3-eu-west-1.amazonaws.com/prod-ucs-content-store-eu-west/content/pii:S0926860X11005552/gr20/HIGHRES/image/jpeg/d5721fc36a0309117603ad3634f333e4/gr20_lrg.jpg gr20 gr20_lrg.jpg jpg 175229 1434 1531 IMAGE-HIGH-RES 1-s2.0-S0926860X11005552-gr21.jpg https://s3.amazonaws.com/prod-ucs-content-store-us-east/content/pii:S0926860X11005552/gr21/DOWNSAMPLED/image/jpeg/f5bc9335d20a6aef3cf7c469d2a6a0f6/gr21.jpg https://s3-eu-west-1.amazonaws.com/prod-ucs-content-store-eu-west/content/pii:S0926860X11005552/gr21/DOWNSAMPLED/image/jpeg/f5bc9335d20a6aef3cf7c469d2a6a0f6/gr21.jpg gr21 gr21.jpg jpg 22904 312 332 IMAGE-DOWNSAMPLED 1-s2.0-S0926860X11005552-gr21.sml https://s3.amazonaws.com/prod-ucs-content-store-us-east/content/pii:S0926860X11005552/gr21/THUMBNAIL/image/gif/1d5cc25baea08f01ba98da478953cf57/gr21.sml https://s3-eu-west-1.amazonaws.com/prod-ucs-content-store-eu-west/content/pii:S0926860X11005552/gr21/THUMBNAIL/image/gif/1d5cc25baea08f01ba98da478953cf57/gr21.sml gr21 gr21.sml sml 4787 164 174 IMAGE-THUMBNAIL 1-s2.0-S0926860X11005552-gr21_lrg.jpg https://s3.amazonaws.com/prod-ucs-content-store-us-east/content/pii:S0926860X11005552/gr21/HIGHRES/image/jpeg/6884958cfe59d85f5d4822ec1410820d/gr21_lrg.jpg https://s3-eu-west-1.amazonaws.com/prod-ucs-content-store-eu-west/content/pii:S0926860X11005552/gr21/HIGHRES/image/jpeg/6884958cfe59d85f5d4822ec1410820d/gr21_lrg.jpg gr21 gr21_lrg.jpg jpg 185962 1383 1471 IMAGE-HIGH-RES 1-s2.0-S0926860X11005552-gr22.jpg https://s3.amazonaws.com/prod-ucs-content-store-us-east/content/pii:S0926860X11005552/gr22/DOWNSAMPLED/image/jpeg/320ce4b34640c3f256975576d80d818b/gr22.jpg https://s3-eu-west-1.amazonaws.com/prod-ucs-content-store-eu-west/content/pii:S0926860X11005552/gr22/DOWNSAMPLED/image/jpeg/320ce4b34640c3f256975576d80d818b/gr22.jpg gr22 gr22.jpg jpg 20761 273 324 IMAGE-DOWNSAMPLED 1-s2.0-S0926860X11005552-gr22.sml https://s3.amazonaws.com/prod-ucs-content-store-us-east/content/pii:S0926860X11005552/gr22/THUMBNAIL/image/gif/97da02f71e883d4bcb56bd7b70082433/gr22.sml https://s3-eu-west-1.amazonaws.com/prod-ucs-content-store-eu-west/content/pii:S0926860X11005552/gr22/THUMBNAIL/image/gif/97da02f71e883d4bcb56bd7b70082433/gr22.sml gr22 gr22.sml sml 5289 164 195 IMAGE-THUMBNAIL 1-s2.0-S0926860X11005552-gr22_lrg.jpg https://s3.amazonaws.com/prod-ucs-content-store-us-east/content/pii:S0926860X11005552/gr22/HIGHRES/image/jpeg/65a7725d8042aa9331da32139e1946f8/gr22_lrg.jpg https://s3-eu-west-1.amazonaws.com/prod-ucs-content-store-eu-west/content/pii:S0926860X11005552/gr22/HIGHRES/image/jpeg/65a7725d8042aa9331da32139e1946f8/gr22_lrg.jpg gr22 gr22_lrg.jpg jpg 168430 1209 1436 IMAGE-HIGH-RES 1-s2.0-S0926860X11005552-gr23.jpg https://s3.amazonaws.com/prod-ucs-content-store-us-east/content/pii:S0926860X11005552/gr23/DOWNSAMPLED/image/jpeg/3fd56e6b5f0445cbdd308ae780a4d5ca/gr23.jpg https://s3-eu-west-1.amazonaws.com/prod-ucs-content-store-eu-west/content/pii:S0926860X11005552/gr23/DOWNSAMPLED/image/jpeg/3fd56e6b5f0445cbdd308ae780a4d5ca/gr23.jpg gr23 gr23.jpg jpg 41620 286 357 IMAGE-DOWNSAMPLED 1-s2.0-S0926860X11005552-gr23.sml https://s3.amazonaws.com/prod-ucs-content-store-us-east/content/pii:S0926860X11005552/gr23/THUMBNAIL/image/gif/eab72f6a7ce7e042ff5e2421ef79e245/gr23.sml https://s3-eu-west-1.amazonaws.com/prod-ucs-content-store-eu-west/content/pii:S0926860X11005552/gr23/THUMBNAIL/image/gif/eab72f6a7ce7e042ff5e2421ef79e245/gr23.sml gr23 gr23.sml sml 5739 164 205 IMAGE-THUMBNAIL 1-s2.0-S0926860X11005552-gr23_lrg.jpg https://s3.amazonaws.com/prod-ucs-content-store-us-east/content/pii:S0926860X11005552/gr23/HIGHRES/image/jpeg/d33b9ff3474a28c2a48bb27ba1653725/gr23_lrg.jpg https://s3-eu-west-1.amazonaws.com/prod-ucs-content-store-eu-west/content/pii:S0926860X11005552/gr23/HIGHRES/image/jpeg/d33b9ff3474a28c2a48bb27ba1653725/gr23_lrg.jpg gr23 gr23_lrg.jpg jpg 275979 1266 1583 IMAGE-HIGH-RES 1-s2.0-S0926860X11005552-gr24.jpg https://s3.amazonaws.com/prod-ucs-content-store-us-east/content/pii:S0926860X11005552/gr24/DOWNSAMPLED/image/jpeg/7528c5ca138cd5bac8a0eb787b459823/gr24.jpg https://s3-eu-west-1.amazonaws.com/prod-ucs-content-store-eu-west/content/pii:S0926860X11005552/gr24/DOWNSAMPLED/image/jpeg/7528c5ca138cd5bac8a0eb787b459823/gr24.jpg gr24 gr24.jpg jpg 45270 336 527 IMAGE-DOWNSAMPLED 1-s2.0-S0926860X11005552-gr24.sml https://s3.amazonaws.com/prod-ucs-content-store-us-east/content/pii:S0926860X11005552/gr24/THUMBNAIL/image/gif/0718932b00878a97725e888cf407dee7/gr24.sml https://s3-eu-west-1.amazonaws.com/prod-ucs-content-store-eu-west/content/pii:S0926860X11005552/gr24/THUMBNAIL/image/gif/0718932b00878a97725e888cf407dee7/gr24.sml gr24 gr24.sml sml 4574 140 219 IMAGE-THUMBNAIL 1-s2.0-S0926860X11005552-gr24_lrg.jpg https://s3.amazonaws.com/prod-ucs-content-store-us-east/content/pii:S0926860X11005552/gr24/HIGHRES/image/jpeg/3b8aab9da45598810434f504c027f983/gr24_lrg.jpg https://s3-eu-west-1.amazonaws.com/prod-ucs-content-store-eu-west/content/pii:S0926860X11005552/gr24/HIGHRES/image/jpeg/3b8aab9da45598810434f504c027f983/gr24_lrg.jpg gr24 gr24_lrg.jpg jpg 328890 1487 2333 IMAGE-HIGH-RES 1-s2.0-S0926860X11005552-gr25.jpg https://s3.amazonaws.com/prod-ucs-content-store-us-east/content/pii:S0926860X11005552/gr25/DOWNSAMPLED/image/jpeg/f0b1949b485fac19526cb08c236e8a66/gr25.jpg https://s3-eu-west-1.amazonaws.com/prod-ucs-content-store-eu-west/content/pii:S0926860X11005552/gr25/DOWNSAMPLED/image/jpeg/f0b1949b485fac19526cb08c236e8a66/gr25.jpg gr25 gr25.jpg jpg 27103 309 376 IMAGE-DOWNSAMPLED 1-s2.0-S0926860X11005552-gr25.sml https://s3.amazonaws.com/prod-ucs-content-store-us-east/content/pii:S0926860X11005552/gr25/THUMBNAIL/image/gif/098d47126c83b0aa6735b14f8e20788c/gr25.sml https://s3-eu-west-1.amazonaws.com/prod-ucs-content-store-eu-west/content/pii:S0926860X11005552/gr25/THUMBNAIL/image/gif/098d47126c83b0aa6735b14f8e20788c/gr25.sml gr25 gr25.sml sml 3611 164 199 IMAGE-THUMBNAIL 1-s2.0-S0926860X11005552-gr25_lrg.jpg https://s3.amazonaws.com/prod-ucs-content-store-us-east/content/pii:S0926860X11005552/gr25/HIGHRES/image/jpeg/a29c2dc53ffd2d0c98cb8ae01f71765a/gr25_lrg.jpg https://s3-eu-west-1.amazonaws.com/prod-ucs-content-store-eu-west/content/pii:S0926860X11005552/gr25/HIGHRES/image/jpeg/a29c2dc53ffd2d0c98cb8ae01f71765a/gr25_lrg.jpg gr25 gr25_lrg.jpg jpg 189720 1370 1667 IMAGE-HIGH-RES 1-s2.0-S0926860X11005552-gr26.jpg https://s3.amazonaws.com/prod-ucs-content-store-us-east/content/pii:S0926860X11005552/gr26/DOWNSAMPLED/image/jpeg/962e9826f152f686c07177e83ad81562/gr26.jpg https://s3-eu-west-1.amazonaws.com/prod-ucs-content-store-eu-west/content/pii:S0926860X11005552/gr26/DOWNSAMPLED/image/jpeg/962e9826f152f686c07177e83ad81562/gr26.jpg gr26 gr26.jpg jpg 28906 316 335 IMAGE-DOWNSAMPLED 1-s2.0-S0926860X11005552-gr26.sml https://s3.amazonaws.com/prod-ucs-content-store-us-east/content/pii:S0926860X11005552/gr26/THUMBNAIL/image/gif/8bdd4f9580600df9df30591e45f11f1e/gr26.sml https://s3-eu-west-1.amazonaws.com/prod-ucs-content-store-eu-west/content/pii:S0926860X11005552/gr26/THUMBNAIL/image/gif/8bdd4f9580600df9df30591e45f11f1e/gr26.sml gr26 gr26.sml sml 3273 164 174 IMAGE-THUMBNAIL 1-s2.0-S0926860X11005552-gr26_lrg.jpg https://s3.amazonaws.com/prod-ucs-content-store-us-east/content/pii:S0926860X11005552/gr26/HIGHRES/image/jpeg/7cbefe250bbcffafe1ddc4e2b8922da8/gr26_lrg.jpg https://s3-eu-west-1.amazonaws.com/prod-ucs-content-store-eu-west/content/pii:S0926860X11005552/gr26/HIGHRES/image/jpeg/7cbefe250bbcffafe1ddc4e2b8922da8/gr26_lrg.jpg gr26 gr26_lrg.jpg jpg 173297 1400 1485 IMAGE-HIGH-RES 1-s2.0-S0926860X11005552-gr27.jpg https://s3.amazonaws.com/prod-ucs-content-store-us-east/content/pii:S0926860X11005552/gr27/DOWNSAMPLED/image/jpeg/e7648609f6d78b55ab479055df84ea4d/gr27.jpg https://s3-eu-west-1.amazonaws.com/prod-ucs-content-store-eu-west/content/pii:S0926860X11005552/gr27/DOWNSAMPLED/image/jpeg/e7648609f6d78b55ab479055df84ea4d/gr27.jpg gr27 gr27.jpg jpg 10331 230 210 IMAGE-DOWNSAMPLED 1-s2.0-S0926860X11005552-gr27.sml https://s3.amazonaws.com/prod-ucs-content-store-us-east/content/pii:S0926860X11005552/gr27/THUMBNAIL/image/gif/86843b12a5d847732b76178927c93da2/gr27.sml https://s3-eu-west-1.amazonaws.com/prod-ucs-content-store-eu-west/content/pii:S0926860X11005552/gr27/THUMBNAIL/image/gif/86843b12a5d847732b76178927c93da2/gr27.sml gr27 gr27.sml sml 4479 164 150 IMAGE-THUMBNAIL 1-s2.0-S0926860X11005552-gr27_lrg.jpg https://s3.amazonaws.com/prod-ucs-content-store-us-east/content/pii:S0926860X11005552/gr27/HIGHRES/image/jpeg/e7a92806ec3fe15becd4f6eae5f8ddfc/gr27_lrg.jpg https://s3-eu-west-1.amazonaws.com/prod-ucs-content-store-eu-west/content/pii:S0926860X11005552/gr27/HIGHRES/image/jpeg/e7a92806ec3fe15becd4f6eae5f8ddfc/gr27_lrg.jpg gr27 gr27_lrg.jpg jpg 78293 1020 933 IMAGE-HIGH-RES 1-s2.0-S0926860X11005552-gr28.jpg https://s3.amazonaws.com/prod-ucs-content-store-us-east/content/pii:S0926860X11005552/gr28/DOWNSAMPLED/image/jpeg/b15d3423ba0467d661569a5917685234/gr28.jpg https://s3-eu-west-1.amazonaws.com/prod-ucs-content-store-eu-west/content/pii:S0926860X11005552/gr28/DOWNSAMPLED/image/jpeg/b15d3423ba0467d661569a5917685234/gr28.jpg gr28 gr28.jpg jpg 51457 642 329 IMAGE-DOWNSAMPLED 1-s2.0-S0926860X11005552-gr28.sml https://s3.amazonaws.com/prod-ucs-content-store-us-east/content/pii:S0926860X11005552/gr28/THUMBNAIL/image/gif/0e27eaf1c844fe35280efb7827fc4282/gr28.sml https://s3-eu-west-1.amazonaws.com/prod-ucs-content-store-eu-west/content/pii:S0926860X11005552/gr28/THUMBNAIL/image/gif/0e27eaf1c844fe35280efb7827fc4282/gr28.sml gr28 gr28.sml sml 2498 164 84 IMAGE-THUMBNAIL 1-s2.0-S0926860X11005552-gr28_lrg.jpg https://s3.amazonaws.com/prod-ucs-content-store-us-east/content/pii:S0926860X11005552/gr28/HIGHRES/image/jpeg/dc31e50ed6f857d732e558a80de79ba2/gr28_lrg.jpg https://s3-eu-west-1.amazonaws.com/prod-ucs-content-store-eu-west/content/pii:S0926860X11005552/gr28/HIGHRES/image/jpeg/dc31e50ed6f857d732e558a80de79ba2/gr28_lrg.jpg gr28 gr28_lrg.jpg jpg 394288 2847 1458 IMAGE-HIGH-RES 1-s2.0-S0926860X11005552-gr29.jpg https://s3.amazonaws.com/prod-ucs-content-store-us-east/content/pii:S0926860X11005552/gr29/DOWNSAMPLED/image/jpeg/021c582155a1e86777e121a01252d133/gr29.jpg https://s3-eu-west-1.amazonaws.com/prod-ucs-content-store-eu-west/content/pii:S0926860X11005552/gr29/DOWNSAMPLED/image/jpeg/021c582155a1e86777e121a01252d133/gr29.jpg gr29 gr29.jpg jpg 31968 314 329 IMAGE-DOWNSAMPLED 1-s2.0-S0926860X11005552-gr29.sml https://s3.amazonaws.com/prod-ucs-content-store-us-east/content/pii:S0926860X11005552/gr29/THUMBNAIL/image/gif/bab9234c1d5e56469702ea5366c05aa0/gr29.sml https://s3-eu-west-1.amazonaws.com/prod-ucs-content-store-eu-west/content/pii:S0926860X11005552/gr29/THUMBNAIL/image/gif/bab9234c1d5e56469702ea5366c05aa0/gr29.sml gr29 gr29.sml sml 3830 164 172 IMAGE-THUMBNAIL 1-s2.0-S0926860X11005552-gr29_lrg.jpg https://s3.amazonaws.com/prod-ucs-content-store-us-east/content/pii:S0926860X11005552/gr29/HIGHRES/image/jpeg/939c44fe40e127cb53049153263a2990/gr29_lrg.jpg https://s3-eu-west-1.amazonaws.com/prod-ucs-content-store-eu-west/content/pii:S0926860X11005552/gr29/HIGHRES/image/jpeg/939c44fe40e127cb53049153263a2990/gr29_lrg.jpg gr29 gr29_lrg.jpg jpg 202632 1391 1458 IMAGE-HIGH-RES 1-s2.0-S0926860X11005552-gr3.jpg https://s3.amazonaws.com/prod-ucs-content-store-us-east/content/pii:S0926860X11005552/gr3/DOWNSAMPLED/image/jpeg/8c2a1cf681212465625aee95b2c9d17f/gr3.jpg https://s3-eu-west-1.amazonaws.com/prod-ucs-content-store-eu-west/content/pii:S0926860X11005552/gr3/DOWNSAMPLED/image/jpeg/8c2a1cf681212465625aee95b2c9d17f/gr3.jpg gr3 gr3.jpg jpg 32803 253 376 IMAGE-DOWNSAMPLED 1-s2.0-S0926860X11005552-gr3.sml https://s3.amazonaws.com/prod-ucs-content-store-us-east/content/pii:S0926860X11005552/gr3/THUMBNAIL/image/gif/e27e76200cb884e21c9fef5e18f6677a/gr3.sml https://s3-eu-west-1.amazonaws.com/prod-ucs-content-store-eu-west/content/pii:S0926860X11005552/gr3/THUMBNAIL/image/gif/e27e76200cb884e21c9fef5e18f6677a/gr3.sml gr3 gr3.sml sml 5955 148 219 IMAGE-THUMBNAIL 1-s2.0-S0926860X11005552-gr3_lrg.jpg https://s3.amazonaws.com/prod-ucs-content-store-us-east/content/pii:S0926860X11005552/gr3/HIGHRES/image/jpeg/26b5852317fef0a29b2f81c0be3b3696/gr3_lrg.jpg https://s3-eu-west-1.amazonaws.com/prod-ucs-content-store-eu-west/content/pii:S0926860X11005552/gr3/HIGHRES/image/jpeg/26b5852317fef0a29b2f81c0be3b3696/gr3_lrg.jpg gr3 gr3_lrg.jpg jpg 230892 1123 1667 IMAGE-HIGH-RES 1-s2.0-S0926860X11005552-gr4.jpg https://s3.amazonaws.com/prod-ucs-content-store-us-east/content/pii:S0926860X11005552/gr4/DOWNSAMPLED/image/jpeg/0c6d727051529d0926a54873ff867463/gr4.jpg https://s3-eu-west-1.amazonaws.com/prod-ucs-content-store-eu-west/content/pii:S0926860X11005552/gr4/DOWNSAMPLED/image/jpeg/0c6d727051529d0926a54873ff867463/gr4.jpg gr4 gr4.jpg jpg 50720 502 561 IMAGE-DOWNSAMPLED 1-s2.0-S0926860X11005552-gr4.sml https://s3.amazonaws.com/prod-ucs-content-store-us-east/content/pii:S0926860X11005552/gr4/THUMBNAIL/image/gif/a7fa6339e240a256a46125ae8b0a38e6/gr4.sml https://s3-eu-west-1.amazonaws.com/prod-ucs-content-store-eu-west/content/pii:S0926860X11005552/gr4/THUMBNAIL/image/gif/a7fa6339e240a256a46125ae8b0a38e6/gr4.sml gr4 gr4.sml sml 3557 164 183 IMAGE-THUMBNAIL 1-s2.0-S0926860X11005552-gr4_lrg.jpg https://s3.amazonaws.com/prod-ucs-content-store-us-east/content/pii:S0926860X11005552/gr4/HIGHRES/image/jpeg/ba2ff9bb612745b96fbd10b2b2d742f7/gr4_lrg.jpg https://s3-eu-west-1.amazonaws.com/prod-ucs-content-store-eu-west/content/pii:S0926860X11005552/gr4/HIGHRES/image/jpeg/ba2ff9bb612745b96fbd10b2b2d742f7/gr4_lrg.jpg gr4 gr4_lrg.jpg jpg 378969 2224 2483 IMAGE-HIGH-RES 1-s2.0-S0926860X11005552-gr5.jpg https://s3.amazonaws.com/prod-ucs-content-store-us-east/content/pii:S0926860X11005552/gr5/DOWNSAMPLED/image/jpeg/641339798dd9890a81bbd2a4196c6444/gr5.jpg https://s3-eu-west-1.amazonaws.com/prod-ucs-content-store-eu-west/content/pii:S0926860X11005552/gr5/DOWNSAMPLED/image/jpeg/641339798dd9890a81bbd2a4196c6444/gr5.jpg gr5 gr5.jpg jpg 26682 312 304 IMAGE-DOWNSAMPLED 1-s2.0-S0926860X11005552-gr5.sml https://s3.amazonaws.com/prod-ucs-content-store-us-east/content/pii:S0926860X11005552/gr5/THUMBNAIL/image/gif/565c038c204715d8819c91c58df71121/gr5.sml https://s3-eu-west-1.amazonaws.com/prod-ucs-content-store-eu-west/content/pii:S0926860X11005552/gr5/THUMBNAIL/image/gif/565c038c204715d8819c91c58df71121/gr5.sml gr5 gr5.sml sml 4970 163 159 IMAGE-THUMBNAIL 1-s2.0-S0926860X11005552-gr5_lrg.jpg https://s3.amazonaws.com/prod-ucs-content-store-us-east/content/pii:S0926860X11005552/gr5/HIGHRES/image/jpeg/e2f42e4c5212e5718da0c7eb7c4f88f8/gr5_lrg.jpg https://s3-eu-west-1.amazonaws.com/prod-ucs-content-store-eu-west/content/pii:S0926860X11005552/gr5/HIGHRES/image/jpeg/e2f42e4c5212e5718da0c7eb7c4f88f8/gr5_lrg.jpg gr5 gr5_lrg.jpg jpg 215324 1385 1349 IMAGE-HIGH-RES 1-s2.0-S0926860X11005552-gr6.jpg https://s3.amazonaws.com/prod-ucs-content-store-us-east/content/pii:S0926860X11005552/gr6/DOWNSAMPLED/image/jpeg/e7843012ba52575181959a228c2ce5c8/gr6.jpg https://s3-eu-west-1.amazonaws.com/prod-ucs-content-store-eu-west/content/pii:S0926860X11005552/gr6/DOWNSAMPLED/image/jpeg/e7843012ba52575181959a228c2ce5c8/gr6.jpg gr6 gr6.jpg jpg 59160 561 522 IMAGE-DOWNSAMPLED 1-s2.0-S0926860X11005552-gr6.sml https://s3.amazonaws.com/prod-ucs-content-store-us-east/content/pii:S0926860X11005552/gr6/THUMBNAIL/image/gif/8ed2837a79664a74670ec35886b0472a/gr6.sml https://s3-eu-west-1.amazonaws.com/prod-ucs-content-store-eu-west/content/pii:S0926860X11005552/gr6/THUMBNAIL/image/gif/8ed2837a79664a74670ec35886b0472a/gr6.sml gr6 gr6.sml sml 3433 163 152 IMAGE-THUMBNAIL 1-s2.0-S0926860X11005552-gr6_lrg.jpg https://s3.amazonaws.com/prod-ucs-content-store-us-east/content/pii:S0926860X11005552/gr6/HIGHRES/image/jpeg/0552408552d5a9d8f472e503c6346316/gr6_lrg.jpg https://s3-eu-west-1.amazonaws.com/prod-ucs-content-store-eu-west/content/pii:S0926860X11005552/gr6/HIGHRES/image/jpeg/0552408552d5a9d8f472e503c6346316/gr6_lrg.jpg gr6 gr6_lrg.jpg jpg 468787 2483 2312 IMAGE-HIGH-RES 1-s2.0-S0926860X11005552-gr7.jpg https://s3.amazonaws.com/prod-ucs-content-store-us-east/content/pii:S0926860X11005552/gr7/DOWNSAMPLED/image/jpeg/4e51e2494c62fb963f3be6f519331443/gr7.jpg https://s3-eu-west-1.amazonaws.com/prod-ucs-content-store-eu-west/content/pii:S0926860X11005552/gr7/DOWNSAMPLED/image/jpeg/4e51e2494c62fb963f3be6f519331443/gr7.jpg gr7 gr7.jpg jpg 26194 413 320 IMAGE-DOWNSAMPLED 1-s2.0-S0926860X11005552-gr7.sml https://s3.amazonaws.com/prod-ucs-content-store-us-east/content/pii:S0926860X11005552/gr7/THUMBNAIL/image/gif/3b459c456bad9baca02eaf014fc46b1b/gr7.sml https://s3-eu-west-1.amazonaws.com/prod-ucs-content-store-eu-west/content/pii:S0926860X11005552/gr7/THUMBNAIL/image/gif/3b459c456bad9baca02eaf014fc46b1b/gr7.sml gr7 gr7.sml sml 3831 164 127 IMAGE-THUMBNAIL 1-s2.0-S0926860X11005552-gr7_lrg.jpg https://s3.amazonaws.com/prod-ucs-content-store-us-east/content/pii:S0926860X11005552/gr7/HIGHRES/image/jpeg/9f497478600248e25a0fc8682ffbab7b/gr7_lrg.jpg https://s3-eu-west-1.amazonaws.com/prod-ucs-content-store-eu-west/content/pii:S0926860X11005552/gr7/HIGHRES/image/jpeg/9f497478600248e25a0fc8682ffbab7b/gr7_lrg.jpg gr7 gr7_lrg.jpg jpg 209010 1831 1419 IMAGE-HIGH-RES 1-s2.0-S0926860X11005552-gr8.jpg https://s3.amazonaws.com/prod-ucs-content-store-us-east/content/pii:S0926860X11005552/gr8/DOWNSAMPLED/image/jpeg/f52ae7f707ed8c23575cf1ab7c5cb56c/gr8.jpg https://s3-eu-west-1.amazonaws.com/prod-ucs-content-store-eu-west/content/pii:S0926860X11005552/gr8/DOWNSAMPLED/image/jpeg/f52ae7f707ed8c23575cf1ab7c5cb56c/gr8.jpg gr8 gr8.jpg jpg 29680 334 371 IMAGE-DOWNSAMPLED 1-s2.0-S0926860X11005552-gr8.sml https://s3.amazonaws.com/prod-ucs-content-store-us-east/content/pii:S0926860X11005552/gr8/THUMBNAIL/image/gif/5d45a7a6ac89237e66783cf132d6e60f/gr8.sml https://s3-eu-west-1.amazonaws.com/prod-ucs-content-store-eu-west/content/pii:S0926860X11005552/gr8/THUMBNAIL/image/gif/5d45a7a6ac89237e66783cf132d6e60f/gr8.sml gr8 gr8.sml sml 5399 164 182 IMAGE-THUMBNAIL 1-s2.0-S0926860X11005552-gr8_lrg.jpg https://s3.amazonaws.com/prod-ucs-content-store-us-east/content/pii:S0926860X11005552/gr8/HIGHRES/image/jpeg/bb4ab983772749a43b77715d6177d5cf/gr8_lrg.jpg https://s3-eu-west-1.amazonaws.com/prod-ucs-content-store-eu-west/content/pii:S0926860X11005552/gr8/HIGHRES/image/jpeg/bb4ab983772749a43b77715d6177d5cf/gr8_lrg.jpg gr8 gr8_lrg.jpg jpg 234363 1481 1644 IMAGE-HIGH-RES 1-s2.0-S0926860X11005552-gr9.jpg https://s3.amazonaws.com/prod-ucs-content-store-us-east/content/pii:S0926860X11005552/gr9/DOWNSAMPLED/image/jpeg/ebc97df4a963d8b75754152ab0074d86/gr9.jpg https://s3-eu-west-1.amazonaws.com/prod-ucs-content-store-eu-west/content/pii:S0926860X11005552/gr9/DOWNSAMPLED/image/jpeg/ebc97df4a963d8b75754152ab0074d86/gr9.jpg gr9 gr9.jpg jpg 21377 282 298 IMAGE-DOWNSAMPLED 1-s2.0-S0926860X11005552-gr9.sml https://s3.amazonaws.com/prod-ucs-content-store-us-east/content/pii:S0926860X11005552/gr9/THUMBNAIL/image/gif/be90b99981c55f8db577a93bf15801d9/gr9.sml https://s3-eu-west-1.amazonaws.com/prod-ucs-content-store-eu-west/content/pii:S0926860X11005552/gr9/THUMBNAIL/image/gif/be90b99981c55f8db577a93bf15801d9/gr9.sml gr9 gr9.sml sml 4820 163 173 IMAGE-THUMBNAIL 1-s2.0-S0926860X11005552-gr9_lrg.jpg https://s3.amazonaws.com/prod-ucs-content-store-us-east/content/pii:S0926860X11005552/gr9/HIGHRES/image/jpeg/d970194dac29042b92c24e50ef0b76f7/gr9_lrg.jpg https://s3-eu-west-1.amazonaws.com/prod-ucs-content-store-eu-west/content/pii:S0926860X11005552/gr9/HIGHRES/image/jpeg/d970194dac29042b92c24e50ef0b76f7/gr9_lrg.jpg gr9 gr9_lrg.jpg jpg 171045 1247 1320 IMAGE-HIGH-RES APCATA 13335 S0926-860X(11)00555-2 10.1016/j.apcata.2011.09.018 Elsevier B.V. Fig. 1 (A) Temperature-programmed reduction profiles of Ni(0.9)/γ-Al2O3, Pd(0.1)+Ni(0.9)/γ-Al2O3, and Pd(0.1)/Ni(0.9)/γ-Al2O3; (B) temperature dependence of CNPd–O in the in situ QXAFS analysis; (C) temperature dependence of CNPd–Pd (square), CNPd–Ni (triangle), and CNPd–Ni/(CNPd–Pd +CNPd–Ni) (diamond) in the in situ QXAFS analysis [85]. Fig. 2 Temperature-programmed reduction profiles of Ni and Pt–Ni catalysts supported on γ-Al2O3 [87]. TPR conditions: 5% H2/Ar; 10Kmin−1; catalyst weight, 0.01g. Intensity of H2 consumption is normalized by the catalysts’ Ni content. Fig. 3 FTIR spectra of CO adsorption and structural model of Pt–Ni metal particles [87]. Adsorption condition: CO 0.13kPa, evacuation at room temperature. Pretreatment: 1123K, H2 reduction. Fig. 4 Model of the formation mechanism of noble metal–Ni bimetallic particles during the reduction pretreatment on Pd(0.1)+Ni(0.9)/γ-Al2O3 and Pd(0.1)/Ni(0.9)/γ-Al2O3. Fig. 5 Temperature-programmed reduction profiles of Ni and noble metal–modified Ni catalysts supported on α-Al2O3 [83]. TPR conditions: catalyst weight, 0.03g; heating rate, 10Kmin−1; 5% H2/Ar, 30mlmin−1. Fig. 6 Model of the formation mechanism of noble metal–Ni bimetallic particles during the reduction pretreatment on Pd(0.2)+Ni(10.6)/α-Al2O3 and Pd(0.5)/Ni0.2Mg0.8O. Fig. 7 Temperature-programmed reduction profiles of Pd/Ni0.2Mg0.8O, Ni0.2Mg0.8O, and Pd/MgO catalysts [73]. TPR conditions: sample weight, 150mg; 5% H2/Ar, 30mlmin−1; heating rate, 10Kmin−1; temperature range, 283–1123K. The temperature was kept at 1123K for 0.5h. Fig. 8 FTIR spectra of CO adsorbed on Pd/Ni0.2Mg0.8O, Ni0.2Mg0.8O, and Pd/MgO catalysts reduced at 1073K [73]. Measurement conditions: room temperature, evacuation after the CO adsorption at P CO =0.13kPa, 4cm−1 resolution. Fig. 9 Effect of combustion gas (CH4/O2 =2/4) addition to methane steam reforming gas (CH4/H2O=30/30) (A→F) on methane conversion over Pt(0.1)/Ni(2.6)/γ-Al2O3, Ni(2.6)/γ-Al2O3, and Pt(0.1)/γ-Al2O3 [86]. Partial pressure conditions: (A) CH4/H2O/O2/Ar=30/30/0/40, (B) 32/30/4/34, (C) 34/30/8/28, (D) 36/30/12/22, (E) 38/30/16/16, and (F) 40/30/20/10. Reaction conditions: temperature, 1073K; W/F =0.16ghmol−1; total pressure, 0.1MPa; catalyst weight, 0.08g; H2 pretreatment, 1123K. The dotted line represents methane conversion attributable to combustion. Fig. 10 Dependence of methane conversion with contact time in oxidative steam reforming of methane over Ni0.2Mg0.8O, Rh(0.035)/Ni0.2Mg0.8O, and Rh(0.035)/MgO [75]. W/F was changed from lower to higher values after it was changed from higher to lower values, as shown by the arrows. Reaction conditions: catalyst weight, 30mg; CH4/H2O/O2 =40/30/20; reaction temperature, 1073K; total pressure, 0.1MPa; H2 reduction pretreatment, 1073K. The dotted line represents methane conversion attributable to combustion. Fig. 11 Dependence of methane conversion in oxidative steam reforming of methane as a function of the temperature of the thermocouple (T TC) over Ni(0.9)/γ-Al2O3 and Pt(0.2)/Ni(0.9)/γ-Al2O3 [87]. Solid line: decreasing temperature, dotted line: increasing temperature. Reaction conditions: CH4/H2O/O2/Ar=40/30/20/10; W/F =0.16ghmol−1; total pressure, 0.1MPa; catalyst weight, 0.08g; H2 pretreatment, 1123K. Fig. 12 A diagram of the fixed-bed reactor and the experimental setup for the IR thermographical observation [111]. Fig. 13 The effect of loading amount on the bed temperature in the oxidative steam reforming of methane over the Ni and Pt monometallic catalysts supported on γ-Al2O3 at W/F =0.12ghmol−1 [79]. Reaction conditions: CH4/H2O/O2/Ar=40/30/20/10; reaction temperature, 1123K; total pressure, 0.1MPa; catalyst weight, 0.08g; H2 pretreatment, 1123K. Fig. 14 Catalyst bed temperature profile in oxidative steam reforming of methane over Pt(0.1)/Ni(2.6), Pt(0.1)+Ni(2.6), Ni (2.6), and Pt(0.1) supported on γ-Al2O3 at W/F =0.07ghmol−1 [79]. Reaction conditions: CH4/H2O/O2/Ar=40/30/20/10; reaction temperature, 1123K; total pressure, 0.1MPa; catalyst weight, 0.08g; H2 pretreatment, 1123K. Fig. 15 Highest catalyst bed temperature and methane conversion in oxidative steam reforming of methane over various catalysts supported on γ-Al2O3 at W/F =0.07ghmol−1 [23]. Pt/Ni, Pd/Ni: sequential impregnation method; Pt+Ni, Pd+Ni: co-impregnation method. Reaction conditions: CH4/H2O/O2/Ar=40/30/20/10; reaction temperature, 1123K; total pressure, 0.1MPa; catalyst weight, 0.08g; H2 pretreatment, 1123K. Fig. 16 Temperature-programmed reduction profiles of Ni(2.6), Pt(0.1)+Ni(2.6), and Pt(0.1)/Ni(2.6) supported on γ-Al2O3 after the oxidative steam reforming of methane: catalysts near the bed inlet and outlet [87]. Values near each peak are nickel-based reduction degree. TPR conditions: 5% H2/Ar; 10Kmin−1; catalyst weight, 0.01g. Reaction conditions: CH4/H2O/O2/Ar=40/30/20/10; reaction temperature, 1123K; total pressure, 0.1MPa; catalyst weight, 0.08g; H2 pretreatment, 1123K; W/F =0.16ghmol−1. Fig. 17 Hot spot formation mechanism on Ni catalysts (a) and suppression mechanism of hot spot formation on Ni catalysts modified with Pt and Pd by sequential impregnation method (b) [23]. Fig. 18 Relation between average particle size and highest bed temperature in oxidative steam reforming over the catalysts supported on α-Al2O3 [84]. Reaction conditions: CH4/H2O/O2/Ar=40/30/20/10; reaction temperature, 1123K; total pressure, 0.1MPa; catalyst weight, 0.045g; H2 pretreatment, 1123K; W/F =0.04ghmol−1. Fig. 19 Relation between average particle size and highest bed temperature in oxidative steam reforming over the catalysts supported on α-Al2O3 [83]. C: chloride precursor, N: nitrate precursor, Ac: acetate precursor. Reaction conditions: CH4/H2O/O2/Ar=40/30/20/10; reaction temperature, 1123K; total pressure, 0.1MPa; catalyst weight, 0.045g; H2 pretreatment, 1123K; W/F =0.04ghmol−1. Fig. 20 Relation between carbon deposition and deactivation rate over Pd/Ni0.2Mg0.8O, Ni0.2Mg0.8O, and Pd/MgO catalysts in oxidative steam reforming of methane under pressurized conditions [23]. Reaction conditions: CH4/H2O/O2 =40/30/20; W/F =0.43ghmol−1; catalyst weight, 0.03g; reaction temperature, 973K; total pressure, 1.0MPa; H2 pretreatment, 1073K. Fig. 21 Relation between carbon deposition and deactivation rate in steam reforming (CH4/H2O=1/1), dry reforming (CH4/CO2 =1/1), and oxidative steam reforming (CH4/H2O/O2 =2/1.5/1) of methane under pressurized conditions [23]. Reforming agents: H2O for steam reforming, CO2 for dry reforming, O2 +H2O for oxidative steam reforming. Reaction conditions: catalyst weight, 0.03g; reaction temperature, 973K; total pressure, 1.0MPa; W/F =0.43ghmol−1; H2 pretreatment, 1073K. Fig. 22 CH4 conversion in oxidative steam reforming of methane during the reaction temperature increasing over Pt(0.1)/Ni0.2Mg0.8O, Ni0.2Mg0.8O, and Pt(0.1)/MgO without H2 pretreatment [78]. Reaction conditions: catalyst weight, 0.03g; CH4/H2O/O2 =2/1.5/1; W/F =0.43ghmol−1; total pressure, 0.1MPa. The dotted line represents methane conversion due to methane combustion. Fig. 23 Self-activation of Pt-, Rh- and Ru-Ni0.5/Mg2.5(Al)O with various loading amounts in stationary SR of CH4 [61]. Reaction conditions: CH4/H2O/N2 =50/100/25mlmin−1, temperature, 973K; catalyst, 50mg. Fig. 24 CH4 steam reforming over supported Rh catalysts under steam purged DSS-like operation conditions [57]. Reaction conditions: CH4/H2O/N2 =50/100/25mlmin−1; temperature, 973K; catalyst, 50mg. The reaction was started at 973K after the catalyst was pre-reduced in a H2/N2 mixed gas at 1173K for 30min. After the reaction at 973K, the reactor was cooled to 473K under steam purging with a H2O/N2 (100/25mlmin−1) mixed gas. The reactor was maintained at 473K for 30min, and then the temperature was again increased to 973K still under the purging conditions. When the temperature reached 973K, the reaction was again started by adding CH4 into the purging gas. The cycle reaction was repeated four times to perform the DSS like operation. Fig. 25 Effects of Rh, Pd, Pt, and Ru loading on the sustainability of supported Ni catalysts in the CH4 steam reforming under steam purged DSS-like operation [57,58]. Reaction conditions: CH4/H2O/N2 =50/100/25mlmin−1; temperature, 973K; catalyst, 50mg. Fig. 26 Comparison of the activities of Ni0.5/Mg2.5(Al)O and Ru(0.1)-Ni0.5/Mg2.5(Al)O catalysts before and after steaming in the steam-purged DSS SR of CH4 [59]. Ni0.5/Mg2.5(Al)O, before (×), after (+); Ru(0.1)-Ni0.5/Mg2.5(Al)O, before (●), after (○). Reaction conditions: CH4/H2O/N2 =50/100/25mlmin−1; temperature, 973K; catalyst, 50mg. Fig. 27 A scheme of the self-regenerative activity of Ru-Ni/Mg(Al)O catalysts in the DSS-like operation of steam reforming of methane [59]. Fig. 28 Comparison of the activities of Pt-Ni0.5/Mg2.5(Al)O and Ru-Ni0.5/Mg2.5(Al)O in DSS SR of CH4 under various purging conditions [61]. Air purging, air (973 K→473K)–air (at 473K)–air (473K→973K); air–steam–air purging, air (973K→473K)–steam (at 473K)–air (473K→973K); steam–air–steam purging, steam (973K→473K)–air (at 473K)–steam (473K→973K). Reaction conditions: CH4/H2O/N2 =50/100/25mlmin−1; temperature, 973K; catalyst, 50mg. Fig. 29 Comparison of the activities of Pt-Ni0.5/Mg2.5(Al)O and Ru-Ni0.5/Mg2.5(Al)O in the steam-purged DSS ATR of CH4 [61]. Reaction conditions: CH4/H2O/O2/N2 =50/100/25/25mlmin−1, temperature, 973K; catalysts, 50mg. Table 1 List of Ni catalysts modified with noble metals. Catalyst Noble metal Ni content (wt%) Molar ratio (M/Ni) Reaction Additive effect of noble metal Ref. M/Ni0.03Mg0.97O Pt, Pd, Rh 4.3 0.007 DR A, R, C [40,41] Rh/Ni/Al2O3 Rh 10–18 0.0016–0.011 DR A [42] M+Ni/SiO2 Ru, Pd 2 0.17 DR A [43] Ni+Ru/SiO2 Ru 2 0.058–0.17 DR A [44] Ni+Ru/H-ZSM5 Ru 2 0.058–0.17 DR A [44] Pt-Ni/ZSM-5 Pt 1–12 0.016–0.15 DR A, C [45] Pd/Ni/MCM-41 Pd 5.4–10.8 0.05–0.025 DR A, C [46] LaNi0.95Rh0.05O3 (sol–gel) Rh 22.5 0.053 DR A [47] LaNi0.95Rh0.05O3 (cp) Rh 22.5 0.053 DR A [47] NiRh/CeO2-ZrO2 (sol–gel) Rh 4.5 0.063 DR A, C [48] Rh+Ni/α-Al2O3 Rh 10 0.01–0.1 DR A, C [49] RhNi/Al2O3 Rh 10 0.01–0.1 DR A, C [50] Pt/Ni/δ-Al2O3 Pt 10–15 0.004–0.009 DR A, C [51] Pt+Ni/nanofibrous γ-Al2O3 Pt 10 0.01–0.1 DR A, C [52,53] LaNi0.8Ru0.2O3 (citrate) Ru 18.5 0.25 DR C [54] PtNi/γ-Al2O3 (ME) Pt 10 0.012 DR C [55] MNi/Mg/Al (cp) Ru, Ir, Rh 7.7 0.017 DR, PO A, R, C [56] M/Ni0.5/Mg2.5(Al)O Rh, Pt, Pd 15.5 0.00003–0.0003 SR R, S [57] Ru/Ni0.5/Mg2.5(Al)O Ru 15.5 0.00038–0.019 SR R [58,59] Rh/Ni0.5/Mg2.5(Al)O Rh 15.5 0.0018–0.018 SR R, S [60] Pt/Ni0.5/Mg2.5(Al)O Pt 15.5 0.00019–0.01 SR R, S [61] Pt-Ni/[Mg x Al]O Pt 10–16 0.0015–0.0019 SR R [62,63] Ru-Ni/γ-Al2O3 Ru 20 0.015 SR A, R, C, S [64] Ru/Ni/MgAl2O4 Ru 20 0.015 SR A, R, C, S [64] Pt/Ni/MgAl2O4 Pt 15 0.001–0.006 SR A [65] Rh/Ni/Al2O3 Rh 10.2–18 0.0016–0.011 SR A [66] Pt/Ni/Al2O3 Pt 15 0.001 PO, ATR R [67] Pt/Ni/La2O3-Al2O3 Pt 15 0.001 PO, ATR R [67] M+Ni/γ-Al2O3 Ru, Rh, Pd, Pt 0.5 0.003–0.0058 PO R [68] Pt/Ni/γ-Al2O3 Pt 8 0.0038 PO R, S [69] RhNi/Mg/Al (cp) Rh 7.7 0.017 PO R [70] M/Ni/Al2O3 Ru, Pd, Pt 18.7 0.0016–0.078 PO A, R, S [71] Pd/Ni0.2Mg0.8O Pd 25 0.002–0.01 OSR A, R, C [72,73] M/Ni0.2Mg0.8O Rh, Pt, Pd 25 0.001 OSR A, R, C [74] M/Ni0.2Mg0.8O Rh, Pt, Pd 25 0.0008–0.01 OSR A, R, C [75] M/Ni0.2Mg0.8O Rh, Pd 25 0.0008–0.01 OSR A, C [76] Pt/Ni0.2Mg0.8O Pt 25 0.0012 OSR A, R [77] Pt/NiO–MgO Pt 7–25 0.001–0.004 OSR A, R [78] Pt-Ni/γ-Al2O3 Pt 2.6 0.01–0.1 OSR R, H [79] M-Ni/γ-Al2O3 Pd, Rh 0.9–2.6 0.01–0.06 OSR A, R. H [80] Pd/Ni0.2Mg0.8Al2O4 Pd 7.9 0.007 OSR A, R, C, S [81,82] M+Ni/α-Al2O3 Ru, Rh, Pd, Ir, Pt, Au 10.6 0.0036–0.011 OSR R, H [83] M-Ni/α-Al2O3 Pd, Pt 10.6 0.0036–0.011 OSR R, H [84] Pd–Ni/γ-Al2O3 Pd 0.9 0.06 OSR A, R, H [85] Pt-Ni/γ-Al2O3 Pt 2.6 0.11 OSR R [86] Pt-Ni/γ-Al2O3 Pt 0.9–2.6 0.011–0.067 OSR A, R, H [87] NiRh/Mg/Al (cp) Rh 25 0.02 ATR A, R [88] M/Ni/γ-Al2O3 Pt, Pd, Ir 5 0.001–0.009 ATR A [89] M/Ni/γ-Al2O3 Pt, Pd, Ir 15 0.001–0.009 ATR R [90] Pd/Ni/γ-Al2O3 Pd 15 0.0037–0.011 ATR A, R, H [91] Pt/NiO/δ-Al2O3 Pt 10 0.003 ATR A [92] Pt-Ni/γ-Al2O3 Pt 10 0.009 ODR A, R, H [93,94] M/Ni, sequential impregnation; M+Ni, co-impregnation; M-Ni, sequential and co-impregnation; cp, co-precipitation; citrate, thermal decomposion of citrate precursors; ME, microemulsion method; SR, steam reforming; DR, dry reforming; PO, partial oxidation; OSR, oxidative steam reforming; ODR, oxidative dry reforming; ATR, autothermal reforming; A, activity; R, reducibility; C, coke resistance; H, hot spot suppression; S, self-activation. Table 2 Curve-fitting results of Pd K-edge EXAFS of various Pd–Ni bimetallic catalysts after the reduction. Catalysts Reduction temperature (K) Shells C.N. a R (×10−1 nm b ) CNPd–Pd/CNPd–Ni Molar ratio Pd/Ni0 Ref. Pd(0.1)+Ni(0.9)/γ-Al2O3 1123 Pd–Ni 7.1 2.54 0.0 0.06 [85] Pd(0.1)/Ni(0.9)/γ-Al2O3 1123 Pd–NiPd–Pd 5.42.5 2.532.73 0.46 0.06 [85] Pd(0.2)+Ni(10.6)/α-Al2O3 1123 Pd–NiPd–Pd 4.15.0 2.532.68 1.2 0.01 [83] Pd(0.5)/Ni0.2Mg0.8O 1073 Pd–NiPd–Pd 2.78.6 2.532.71 3.2 0.2 [73] a Coordination number. b Bond distance. Table 3 Results of Ni K-edge EXAFS analysis [87]. Catalyst Pretreatment Shell C.N. a R (×10−1 nm b ) Ni(0.9)/γ-Al2O3 Reduction Ni–Ni 11.1 2.49 Passivation Ni–Ni 10.5 2.49 Pt(0.2)+Ni(0.9)/γ-Al2O3 Reduction Ni–Ni 10.2 2.50 Passivation Ni–Ni 8.5 2.49 Pt(0.2)/Ni(0.9)/γ-Al2O3 Reduction Ni–Ni 10.3 2.50 Passivation Ni–Ni 10.3 2.50 Ni foil Ni–Ni 12 2.49 Sample treatment: reduction (H2, 1123K, 0.5h), passivation (0.5% O2, 298K, 1h). a Coordination number. b Bond length. Table 4 Catalysts and catalyst properties [23]. Catalysts Support materials (BET surface area/m2 g−1) Preparation method a Precursor Composition Reduction degree of Ni b Molar ratio of noble metals to Ni0 Average metal particle size (nm c ) Steam reforming d Ni Pt CH4 conversion CO selectivity H2/CO wt% ×10−3 mol/g-cat wt% ×10−5 mol/g-cat % % Pt(0.1)/Ni(2.6) γ-Al2O3 (110) SI Ni(NO3)2, Pt(acac)2 2.6 0.45 0.1 0.45 100 0.01 5.0±0.4 41 68 4.9 Pt(0.1)+Ni(2.6) CI Ni(NO3)2, H2PtCl6 2.6 0.45 0.1 0.45 100 0.01 4.5±0.4 55 80 4.0 Pt(0.1) I H2PtCl6 – – 0.1 0.45 – – – 32 60 5.7 Ni(2.6) I Ni(NO3)2 2.6 0.45 – – 100 0.0 4.8±0.4 58 82 3.9 a SI: sequential impregnation, CI: co-impregnation, I: impregnation. b Based on temperature-programmed reduction with hydrogen. c TEM observation. d Reaction conditions: CH4/H2O/Ar=30/30/40, temperature 1023K for steam reforming; total pressure 0.1MPa; catalyst weight 0.08g; H2 pretreatment 1123K, W/F =0.16/ghmol−1. Table 5 Properties of noble metal promoted NiO–MgO solid solution catalysts and their catalytic performance in oxidative steam reforming of methane under pressurized conditions. Catalysts Ni content (×10−4 mol/g) M content (×10−6 mol/g) D red (%) M/Ni H2 ad (×10−6 mol/g) D disp (%) Particle size (nm) Oxidative steam reforming of methane Ref. CH4 conversion (%) Deactivation rate (%) Coke (%) Ni0.2Mg0.8O 42.4 0 3.4 0 5.7 7.8 12.4 (6.2T) 56 5.4 7.5 [73] Rh(0.035)/Ni0.2Mg0.8O 42.4 3.4 6.0 0.01 9.5 7.4 13.1 65 0 n.d. [74] Rh(0.035)/MgO 42.4 3.4 – – – – – 41 0 n.d. [74] Pt(0.1)/Ni0.2Mg0.8O 42.4 5.1 3.4 0.04 9.0 12.0 8.1 63 0 0.8 [74] Pt(0.1)/MgO 42.4 5.1 – – – – – 39 2.6 n.d. [74] Pd(0.05)/Ni0.2Mg0.8O 42.4 4.7 4.5 0.03 6.0 6.2 15.6 58 5.2 3.3 [73] Pd(0.1)/Ni0.2Mg0.8O 42.4 9.4 4.8 0.05 6.6 6.2 4.7 (T) 62 0 0 [73] Pd(0.15)/Ni0.2Mg0.8O 42.4 14.1 – – – – – 62 0 0 [73] Pd(0.3)/Ni0.2Mg0.8O 42.4 28.2 – – – – – 57 7.3 10.0 [73] Pd(0.5)/Ni0.2Mg0.8O 42.4 47.0 5.6 0.20 8.7 6.1 15.9 (7.6T) 52 13.4 23.0 [73] Pd(0.05)/MgO 0 4.7 – – – – – 37 13.5 9.0 [73] Pd(0.1)/MgO 0 9.4 – – 2.6 55 – 37 13.5 11.0 [73] Pd(0.15)/MgO 0 14.1 – – – – – 38 16.5 15.1 [73] Pd(0.3)/MgO 0 28.2 – – – – – 39 21.0 29.2 [73] Pd(0.5)/MgO 0 47.0 – – 5.7 24 – 41 24.1 41.6 [73] Ni0.2Mg0.8Al2O4 13.4 0 61 0 20.4 5.0 19.4 71 7.2 48.5 [81] Pd(0.1)/Ni0.2Mg0.8Al2O4 13.4 9.4 90 0.008 56.2 9.2 10.6 (10.7T) 85 0 0 [81] Pd(0.1)/MgAl2O4 0 9.4 – – 4.2 – – 55 21.2 66.0 [81] Reaction conditions: catalyst weight: 0.3g, CH4/H2O/O2 =2/1.5/1, W/F=0.43ghmol−1, reaction temperature: 973K, total pressure: 1.0MPa, H2 reduction pretreatment: 1073K. Table 6 Particle size and dispersion of Ni metals on noble metal–Ni catalysts before and after steaming, and after steaming followed by DSS SR of methane. Catalyst Particle size of Ni metals a (nm) Dispersion b (%) Ref. Before After After DSS Before After Ni0.5/Mg2.5(Al)O 6.9 18.4 n.d. 11.0 3.7 [59] Ru(0.1)-Ni0.5/Mg2.5(Al)O 5.2 16.8 8.3 20.3 5.3 [59] Rh(0.1)-Ni0.5/Mg2.5(Al)O 6.0 16.8 9.4 15.3 6.4 [60] Pt(0.1)-Ni0.5/Mg2.5(Al)O 5.5 16.5 10.0 20.6 4.0 [61] a Calculated from the full width at half maximum of the reflection of Ni(200) in the XRD using the Scherrer equation. b Calculated from the H2 uptake. Review Methane reforming to synthesis gas over Ni catalysts modified with noble metals Dalin Li a b Yoshinao Nakagawa a Keiichi Tomishige a ⁎ a Department of Applied Chemistry, School of Engineering, Tohoku University, 6-6-07, Aoba, Aramaki, Aoba-ku, Sendai 980-8579, Japan b National Engineering Research Center of Chemical Fertilizer Catalyst, Fuzhou University, Gongye Road 523, Fuzhou 350002, Fujian, PR China ⁎ Corresponding author. Tel.: +81 22 795 7214; fax: +81 22 795 7214. Graphical abstract Highlights ► Addition of noble metals to Ni catalysts gives noble metal–Ni bimetallic particles. ► The structure of bimetallic particles is influenced by the preparation method. ► Noble metal–modified Ni catalysts show high performances by the synergetic effect. ► Activity, stability, hot spot, activation, and regeneration properties are improved. Nickel is an effective component for the steam reforming of methane in terms of the catalytic activity and the catalyst cost. When Ni catalysts are applied to dry reforming, oxidative reforming, and catalytic partial oxidation, it is necessary to add the properties of high resistance to oxidation, hot spot formation, and coke deposition, to the Ni catalysts. An efficient method for giving these properties while considering the catalyst cost is the modification of Ni metal particles with small amounts of noble metals. An important point is that preparation methods can affect the structure of noble metal–Ni bimetallic particles, which is connected to the catalytic performances. The additive effects of noble metals on the catalytic performances are summarized in terms of activity, suppression of Ni oxidation, carbon formation, self-activation, and sustainability in the daily startup and shutdown operations. Keywords Methane reforming, Synthesis gas, Ni catalyst, Noble metal, Ni oxidation, Hot spot, Carbon formation, Self-activation, Daily startup and shut down 1 Introduction Production of synthesis gas from natural gas is one of the important technologies in the chemical industry because the synthesis gas can be converted to useful liquid fuels and chemicals such as Fischer–Tropsch oil, methanol, and dimethyl ether [1–4]. Hydrogen is practically produced from natural gas, and the produced hydrogen is mainly used for the ammonia synthesis [1,5,6]. In particular, much attention has been paid to the hydrogen production relating to the fuel cell technology [7–9]. Reforming reactions of methane, which is the main component of natural gas, play a key in the production of synthesis gas and hydrogen from natural gas. It is known that methane reforming has two major types, i.e., steam reforming and carbon dioxide reforming. The latter is also called as dry reforming. (1) CH4 +H2O→CO+3H2,ΔH 298K°=+206kJmol−1 (2) CH4 +CO2 →2CO+2H2,ΔH 298K°=+286kJmol−1 Steam reforming of methane (Eq. (1)) gives synthesis gas with high H2 to CO ratio (H2/CO), and dry reforming of methane (Eq. (2)) gives the gas with lower H2 to CO ratio. As is known, the combination of steam reforming with dry reforming enables the adjustment of H2/CO of the produced synthesis gas [3,10,11]. In the practical process of methane reforming for the large-scale gas-to-liquid and small-scale fuel cell technologies, tubular reactors have been applied. Since both steam and dry reforming of methane are highly endothermic reactions, as indicated above (Eqs. (1) and (2)), it is necessary to supply the heat to the reactor tube from the reactor outside with a combustion reaction (Eq. (3)) [3,6,12]. (3) CH4 +2O2 →CO2 +2H2O,ΔH 298K°=−806kJmol−1 Both steam and CO2 reforming of methane are reversible and methane conversion and the effluent gas composition are controlled by the reaction equilibrium. High temperature (for example, higher than 1073K) at the catalyst bed is needed for high methane conversion. This demands the heat resistant catalysts. It has been pointed out that one problem in methane reforming is carbon deposition on the catalyst surface, which causes the catalyst deactivation, plugging of the reactor, and breakdown of the catalyst granules [3,13–15]. There are two major routes for the carbon formation. One is methane decomposition (Eq. (4)) and the other is CO disproportionation (Eq. (5)) [3,13–15]. (4) CH4 →C+2H2,ΔH 298K°=+75kJmol−1 (5) 2CO→C+CO2,ΔH 298K°=−172kJmol−1 The tendency of carbon deposition can be expected by the atomic ratios of O/C and H/C in the feed gas. Lower O/C and H/C ratios correspond to higher tendency toward carbon deposition [16]. In the stoichiometric steam reforming of methane (H2O/CH4 =1/1), O/C and H/C ratios are calculated to be 1 and 6, respectively. In fact, in the industrial steam reforming of methane, the partial pressure of steam is higher than the stoichiometry, for example H2O/CH4 =2/1 (O/C=2, H/C=8) [1,5]. This is because stable operation is difficult over the conventional steam reforming catalyst at H2O/CH4 =1/1 due to the carbon deposition. In contrast, in the stoichiometric dry reforming of methane (CO2/CH4 =1/1), O/C and H/C ratios are calculated to be 1 and 2, respectively, which are much lower than those in the steam reforming of methane. This means that the tendency of carbon deposition in the dry reforming of methane is much higher than that in the steam reforming of methane [17]. In addition, it has been reported that the increase of total pressure remarkably enhances the carbon deposition tendency [5,17,18]. A large-scale synthesis gas production method with higher energy efficiency than steam reforming of methane is required. Since the endothermic heat due to reforming reactions is supplied from the reactor outside, the reaction rate is limited by the heat transfer. Therefore, higher productivity cannot be realized by the increase of the reactor tube diameter, but by the increase of the reactor tube number. The scale merit of the syngas production by this method is low. Oxygen-blown ATR (autothermal reforming) has recently been the preferred technology for large-scale GTL plants [19]. ATR is cheaper than steam reforming because of a more favorable economy of scale for oxygen plants than for the tubular reformer. In the ATR process, oxygen is fed together with natural gas and steam. The added oxygen engenders exothermic reactions such as non-catalytic partial oxidation (CH4 +1/2O2 →CO+2H2) and combustion of methane using a burner in the non-catalytic reaction zone; this heat is supplied for the catalytic reforming reaction on the catalysts. Here, the contact between the reforming catalysts with oxygen is inhibited to suppress hot spot formation. Hot spot formation is a common problem in the reforming of hydrocarbons to synthesis gas using oxygen as mentioned below, especially for monometallic Ni catalysts [20,21]. The ATR process is adiabatic and needs no external heating, so it enables high productivity using a large single reactor. Oxidative reforming of methane, in which O2 is introduced to the catalyst bed together with methane, steam and CO2, is a promising method for synthesis gas production because the reaction conditions can be adjusted to those of an autothermal system [22–24]. In the oxidative reforming process, exothermic combustion on the catalyst surface is combined with endothermic reforming. Oxidative steam reforming of methane can also be more energy-efficient than conventional steam reforming of methane like the ATR process. Problems of the oxidative reforming include deactivation by oxidation, hot spot formation and carbon deposition [23,24]. As explained below, oxidative reforming of methane consists of the oxidizing atmosphere near the catalyst bed inlet and the reducing atmosphere downstream in the bed. The oxidizing atmosphere is due to the presence of O2 in the gas phase, and the reducing atmosphere is due to the absence of O2. In the oxidizing region, exothermic oxidation reactions proceed and they enhance the catalyst bed temperature, which is connected to hot spot formation. The oxidative reforming of methane will be more feasible after the development of catalysts with high resistance to hot spot formation. In the ATR process and oxidative reforming of methane, some equipment for the oxygen production from air is needed, particularly in the case of GTL and methanol synthesis. This is because the reaction of Fischer–Tropsch [25–27] and methanol syntheses [28–30] has been carried out under high pressure of synthesis gas. When air is used in the synthesis gas production process, the partial pressure of the produced synthesis gas is decreased by the presence of nitrogen. The high cost for the equipment of the oxygen production is compensated by the effect of the high pressure of synthesis gas in the large-scale plant. The utilization of oxygen in the synthesis gas production method with smaller scale for the fuel cell system becomes more feasible by more economical oxygen production. In recent decades, much attention has been paid to the technology for hydrogen production using the reforming reaction with much smaller scale than the GTL and methanol plants, in relation to the fuel cell technology [7–9]. The operation time of the fuel cell process is much shorter than that of large plants, and daily startup and shutdown (DSS) operations are often carried out. Therefore, catalytic performance should be maintained during the operation including DSS [8,31]. In particular, the daily startup procedure includes the catalyst activation, and the DSS procedure can accelerate the catalyst deactivation via oxidation and sintering [32,33]. The resistance to the DSS operation should be added to the catalysts. It is well known that methane is one of the most stable hydrocarbon molecules and it has lower reactivity than other hydrocarbons. Therefore, the dissociation of the C–H bond is an important step in the activation of methane, which is catalyzed by the surfaces of various metals. The reaction order regarding the partial pressure of methane in the dissociative adsorption of methane over noble-metal surface is lower than 1.0, such as 0.6, when the methane molecules with higher translational and vibrational energy using molecular beam technique were applied [34,35]. However, in most cases, the low reactivity of methane is connected to the first reaction order with respect to the partial pressure of methane in the steam and dry reforming of methane [36]. Reforming of methane with steam and CO2 is catalyzed by various base and noble metals such as Ni, Co, Ru, Rh, Pd, Pt and so on. The order of the catalytic activity of metal catalysts supported on Al2O3-MgO was reported to be Ru>Rh>Ir>Ni>Pt [37]. Pt clusters also show the most reactive surfaces for the C–H bond activation compared to Ir, Ni, Rh and Ru catalysts supported on various oxides [36]. The activity order per the surface site has not agreed well in various reports; however, important points are that Ni has a comparable activity to noble-metal catalysts, and that the higher loading amount of Ni is feasible in terms of the catalyst cost in order to increase the activity per the volume of the catalyst. However, Ni is inferior to noble metals regarding the resistance to carbon deposition and catalyst oxidation, and the ability of the catalyst activation [17,24,38,39]. In fact, noble metals have a problem in the limited availability and high cost, and noble metals are not utilized practically unless the loading amount of noble metals is much smaller than that of Ni. This review article is related to the attempts to give high resistance to carbon deposition and catalyst oxidation and to give high ability of catalyst activation to Ni catalysts by the addition of very small amounts of noble metals. Table 1 lists some examples of the catalysts for methane reforming and the additive effect of noble metals [40–94]. 2 Preparation and structure of Ni metal particles modified with small amounts of noble metals 2.1 Ni metal particles modified with noble metals supported on γ-Al2O3 When metal catalysts modified with much smaller amounts of another metal are prepared, we have to pay much attention to the preparation method in order to bring out high catalytic performances for the modified catalysts. A typical preparation method is the co-impregnation method using an aqueous solution containing two precursors. Sequential (two-step) impregnation method is another candidate for the preparation. Structural differences of the catalysts prepared by the co-impregnation and the sequential impregnation methods are described using Pd–Ni/γ-Al2O3 as an example [79,80,85–87]. A commercially available γ-Al2O3 (JRC-ALO-1) (Catalysis Society of Japan, S BET =143m2 g−1, grain size of 2–3mm) was calcined at 1123K in air for 3h; it was used as a support material. The resulting support had a specific surface area of 110m2 g−1. It was crushed and sieved to particle sizes between 180 and 250μm before impregnation. Supported monometallic Ni and Pd catalysts were prepared using the impregnation method with the aqueous solution of Ni(NO3)2·6H2O and PdCl2, respectively. After removal of the solvent by heating and evaporation at 353K, the resulting product was dried in an oven at 383K for 12h. Subsequently, the sample was calcined at 773K in air for 3h. Bimetallic catalysts (Pd–Ni) were prepared using two methods. One is the sequential impregnation method. The calcined monometallic nickel catalyst was reduced at 1123K for 0.5h under H2 flow, and then the treated sample was impregnated with the acetone solution of Pd(C5H7O2)2 under air atmosphere. After removal of the acetone solvent, the catalyst was dried at 383K for 12h and calcined in air at 573K for 3h. The resultant catalyst is denoted as Pd/Ni. The other method is co-impregnation. The precursor solution is a mixed aqueous one of Ni(NO3)2·6H2O and PdCl2. After co-impregnation, the sample was dried at 383K for 12h, followed by calcination at 773K in air for 3h. This resultant catalyst is denoted as Pd+Ni. All catalysts were reduced in the H2 flow at 1123K for 0.5h prior to activity tests. The numbers in parentheses refer to the weight percent of the catalyst's metallic component. Different Pd precursors are used in these two preparation methods. In the case of the sequential impregnation, we were afraid that the oxidized and metallic Ni species would be soluble to the acidic Pd solution. During the reduction pretreatment, the metallic particles are formed. Temperature-programmed reduction profiles gave useful information on the additive effect of noble metals. Since the reducibility of noble metals is much higher than that of Ni species, noble metal addition can promote the reduction of Ni species [95]. Fig. 1 (A) shows the temperature-programmed reduction profiles of Ni(0.9), Pd(0.1)+Ni(0.9), and Pd(0.1)/Ni(0.9) supported on γ-Al2O3 [85]. If we judge from the very low molar ratio of Pd to Ni (Pd/Ni=1/17), most H2 consumption is due to the reduction of Ni species. The Ni species on Pd(0.1)+Ni(0.9) are more reducible than those on Ni(0.9). The Ni species on Pd(0.1)/Ni(0.9) have very high reducibility. In-situ quick-scanning EXAFS (QXAFS) analysis gave us the information on the reduction of Pd species. Fig. 1(B) and (C) shows the temperature dependences of the coordination numbers of Pd–O, Pd–Pd, and Pd–Ni bonds on Pd(0.1)+Ni(0.9) and Pd(0.1)/Ni(0.9) in the in situ QXAFS analysis [85]. The coordination number of the Pd–O bond (CNPd–O) almost disappeared on both catalysts at 433K, at the same time, the CNPd–Pd increased drastically. This indicates that the Pd species on Pd(0.1)+Ni(0.9) and Pd(0.1)/Ni(0.9) are similar and that the reduction profiles of the Pd species are also similar. In addition, it is clear that the CNPd–Pd at 433K was much smaller than 12, which is the CN of bulk Pd metal, if one consider the contributions of small CNPd–O. This also indicates the formation of highly dispersed Pd metal clusters. At 563K, the CNPd–Pd on Pd(0.1)/Ni(0.9) decreased more significantly than that on Pd(0.1)+Ni(0.9). At this temperature, the Ni species on Pd(0.1)/Ni(0.9) started to be reduced, in contrast, the Ni species on Pd(0.1)+Ni(0.9) were not reduced. Therefore, the difference in CNPd–Pd at 563K is caused by the different states of Ni species. At higher reduction temperature, the CNPd–Pd on both catalysts was not changed drastically. An important point is the behavior of Pd–Ni bonds. At 663K, most Ni species on Pd(0.1)/Ni(0.9) were already reduced; in contrast, most Ni species on Pd(0.1)+Ni(0.9) were not reduced yet. However, the contribution of CNPd–Ni on Pd(0.1)+Ni(0.9) was higher than that on Pd(0.1)/Ni(0.9). In addition, the coordination number ratio of CNPd–Ni/(CNPd–Pd +CNPd–Ni) on Pd(0.1)+Ni(0.9) is much higher than that on Pd(0.1)/Ni(0.9). The coordination number ratio of CNPd–Ni/(CNPd–Pd +CNPd–Ni) is reflected by the degree of mixture in the Pd–Ni bimetallic particles which are formed during the reduction. In the case of Pd(0.1)+Ni(0.9), the reduction of Ni species proceeds by the incorporation into small Pd metal particles of the highly dispersed Ni species that interact with γ-Al2O3 surface. In contrast, in the case of Pd(0.1)/Ni(0.9), the interaction between Ni species and γ-Al2O3 surface is weakened during the preparation procedure and NiO particles are formed as described below. Therefore, the reduction of Ni species can proceed without the incorporation of Ni into Pd metal particles. Furthermore, the CNPd–Pd +CNPd–Ni on both catalysts was much smaller than 12, indicating that the ratio of surface Pd atoms on the metal particles is high. Table 2 lists the Pd K-edge EXAFS analysis of the Pd–Ni bimetallic catalysts after the reduction as mentioned above [85]. On Pd(0.1)+Ni(0.9)/γ-Al2O3, the presence of the Pd–Ni bond without the detection of the Pd–Pd bond indicates that the Pd metal atoms are highly dispersed in the Ni metal particles. This tendency is also suggested by the high coordination number ratio of CNPd–Ni/(CNPd–Pd +CNPd–Ni) in the results of in situ QXAFS during the reduction (Fig. 1C). In the reduction process, Pd metal particles are formed at first, and then highly (atomically) dispersed Ni ion species on γ-Al2O3 are incorporated into Pd metal particles and reduced to metallic Ni. This is connected to the breaking of the Pd–Pd bonds and the formation of Pd–Ni bond. At higher reduction temperature, the ratio of Pd atoms in the Pd–Ni bimetallic particles becomes relatively smaller, and the contribution of the Pd–Pd bond is negligible. As a result, well-mixed Pd–Ni alloy particles are formed on Pd(0.1)+Ni(0.9)/γ-Al2O3. On the other hand, the presence of the Pd–Pd bond as well as the Pd–Ni bond on Pd(0.1)/Ni(0.9)/γ-Al2O3, is related to the low coordination number ratio of CNPd–Ni/(CNPd–Pd +CNPd–Ni) in the in situ QXAFS result (Fig. 1C). One possible interpretation of the small coordination number ratio of CNPd–Ni/(CNPd–Pd +CNPd–Ni) on Pd(0.1)/Ni(0.9) is that the Pd–Ni bonds are present between the Ni metal particles and very small Pd metal particles. Fig. 2 shows the temperature-programmed reduction profiles of Pt(0.2)/Ni(0.9), Pt(0.2)+Ni(0.9) and related catalysts, which are prepared in the similar way to the case of Pd–Ni [87]. The TPR results are also similar. Here, Ni(0.9) after the reduction at 1123K and the subsequent calcination at 573K is also shown, and the reduction procedure forms Ni metal particles and then the subsequent calcination causes the oxidation of Ni metal particles to NiO oxide particles. The high reduction temperature in the TPR results on Ni(0.9) is due to highly dispersed Ni ion species interacting with γ-Al2O3 surfaces, and the low reduction temperature on Ni(0.9) after the reduction at 1123K and the subsequent calcination at 573K is assigned to larger NiO particles formed on the γ-Al2O3 surfaces. In addition, the addition of Pt promoted the reduction of NiO further. The promoting effect of noble metals on the reduction of Ni species can be interpreted by the hydrogen spillover phenomenon. On the metallic surface, H2 molecules dissociate to hydrogen species, which are diffused to different species via the support surface [96–98]. The formation mechanism of noble metal–Ni bimetallic particles influences the surface segregation of noble-metal atoms. Temperature-programmed reduction and in situ EXAFS as described above give little information about the surface of bimetallic particles. In order to get this information, we carried out the EXAFS analysis of the catalysts after the passivation and the FTIR observation of CO adsorption as a probe of surface atom determination. Table 3 lists the curve fitting results of the Ni K-edge EXAFS spectra of Pt(0.2)/Ni(0.9) and Pt(0.2)+Ni(0.9) supported on γ-Al2O3 after the reduction and passivation (the oxidation of the surface with low-concentration oxygen) at room temperature [87]. In the case of Pt(0.2)+Ni(0.9), the CN of the Ni–Ni bond decreased remarkably with the passivation procedure, which is due to the breaking of the Ni–Ni bonds by the oxidation. On the other hand, the CN of the Ni–Ni bond on Pt(0.2)/Ni(0.9) was not changed by the oxidation, and this means that metal particles on Pt(0.2)/Ni(0.9) have resistance to the oxidation. This suggests the surface segregation of Pt atoms on the bimetallic Pt–Ni particles. It was verified that the size of the metal particle size on Pt(0.2)/Ni(0.9) was similar to that on Pt(0.2)+Ni(0.9), indicating that the difference in the resistance to the oxidation cannot be explained by the metal particle size. The FTIR spectra of CO adsorption were measured to characterize surface properties of Pt–Ni bimetallic particles; Fig. 3 shows the results [87]. The bands at 2070cm−1 and 2048cm−1 on the monometallic Ni catalyst (Ni(2.6)) are attributable to the linear CO on Ni metal [99,100]; the band at about 1940cm−1 is assigned to the bridge CO [101]. Only one band at 2070cm−1 was observed on the monometallic Pt catalyst (Pt(0.1)); this band is assigned to linear CO [102–104]. Two broad bands at 2070 and 2048cm−1 with similar intensity were observed in the case of Pt(0.1)+Ni(2.6). The bands resembled those of Ni(2.6). In contrast, for Pt(0.1)/Ni(2.6), the intensity of the 2070cm−1 band was much stronger than that of the 2048cm−1 band. The difference in the spectra between Pt(0.1)/Ni(2.6) and Ni(2.6) is attributable to the intensity of the 2070cm−1 band, which may be caused by linear CO on Pt. Judging from the FTIR of CO adsorption, we conclude that the Pt atoms are located on the surface of metal particles more preferentially on the catalyst prepared by the sequential impregnation method. The mechanism of the formation of the bimetallic particles prepared by two different methods is described in Fig. 4 on the basis of the above characterization results. Very small Pd clusters on Pd(0.1)/Ni(0.9) are located on the surface of bimetallic particles. 2.2 Ni metal particles modified with noble metals supported on α-Al2O3 and NiO–MgO solid solutions The comparison between the Ni/γ-Al2O3 catalysts modified with small amount of noble metals by two different preparation methods (the sequential impregnation and co-impregnation methods) indicates that the structure of bimetallic particles is strongly influenced by the precursor state of Ni species, and that the NiO oxide particles are more preferable for the preparation of the bimetallic particles with the surface segregation of noble-metal atoms than the highly dispersed Ni species. The interaction of Ni species with α-Al2O3 is not as strong as that with γ-Al2O3. Ni catalysts supported on α-Al2O3 modified with noble metals were prepared [83,84]. The α-Al2O3 support (8m2 g−1) was prepared by the calcination of JRC-ALO-1 (provided by Catalysis Society of Japan, 143m2 g−1, grain size of 2–3mm) in air at 1423K for 3h. It was crushed and sieved to particle sizes between 180 and 250mm before impregnation. Supported monometallic Ni catalysts were prepared by an impregnation method using an aqueous solution of Ni(NO3)2·6H2O. Supported monometallic noble-metal catalysts were prepared by an impregnation method using an aqueous solution of PdCl2, H2PtCl6·6H2O, HAuCl4·4H2O, H2IrCl6, RhCl3·3H2O, and RuCl3·nH2O. After removal of the solvent by heating and evaporation at 353K, the resulting product was dried in an oven at 383K for 12h. Subsequently, the sample was calcined at 773K in air for 3h. Bimetallic catalysts were prepared by the co-impregnation method using mixed aqueous solutions of the precursors. After co-impregnation, the preparation procedure is identical to that of monometallic catalysts. Fig. 5 shows the temperature-programmed reduction profiles of Ni(10.6)/α-Al2O3 samples modified with small amounts of noble metals, which were prepared by the co-impregnation method [83]. The reduction of the Ni species on Ni(10.6) proceeded in the temperature range of 623–923K, which was much lower than the reduction of the Ni species on γ-Al2O3. The H2 consumption peak was shifted to lower temperature by the addition of noble metals, and this indicates that the addition of noble metals enhanced the reducibility of Ni species. The order of the catalyst reducibility is as follows: Pt(0.4)+Ni(10.6)>Pd(0.2)+Ni(10.6)>Rh(0.2)+Ni(10.6)>Ru(0.2)+Ni(10.6)>Ir(0.4)+Ni(10.6)>Au(0.4)+Ni(10.6)>Ni(10.6). According to the results of the temperature profile in the catalyst bed during the reaction in the oxidative steam reforming of methane, the addition of small amount of noble metals by the co-impregnation method is effective for the suppression of the hot spot formation, which is related to the presence of noble-metal atoms on the surface of bimetallic particles [83]. The EXAFS result of Pd(0.2)+Ni(10.6)/α-Al2O3 indicates a larger coordination number ratio of CNPd–Pd/CNPd–Ni than in the case of two γ-Al2O3-supported catalysts in spite of the lower molar ratio of Pd to Ni (Table 2) [83]. The formation of Pd metal particles at the first step in the reduction process is expected and the size of the Pd metal particles on α-Al2O3 can be much larger than that on γ-Al2O3. Based on this expectation, the Pd-cluster–embedded Ni metal particles are formed on Pd(0.2)+Ni(10.6)/α-Al2O3 as illustrated in Fig. 6 (a). Next, we consider the additive effect of noble metals to NiO–MgO solid solution catalysts. The interaction between Ni species and MgO is so strong that NiO–MgO solid solution is formed, and the reducibility of NiO–MgO is lower than that of Ni/γ-Al2O3 and Ni/α-Al2O3 [105]. Ni0.2Mg0.8O solid solution was prepared by the solid reaction method from NiO and MgO [72–75,77,78]. The mixture of NiO with MgO was calcined in air at 1423K for 12h. The formation of Ni0.2Mg0.8O solid solution was identified by X-ray diffraction (XRD). After the calcination, the BET surface area of Ni0.2Mg0.8O was determined to be 2.6m2 g−1. As a reference, MgO was calcined at the same temperature and the BET surface area of MgO was determined to be 5.7m2 g−1. The loading of Pd on Ni0.2Mg0.8O and MgO was performed by the impregnation of Ni0.2Mg0.8O and MgO with aqueous solutions of Pd(NO3)2. After removal of the solvent by heating, the catalysts were dried overnight at 383K and then calcined in air at 773K for 3h. The loading amount of Pd is in the parentheses. Fig. 7 shows the temperature-programmed reduction profiles of Pd(0.1, 0.5)/Ni0.2Mg0.8O and related catalysts [73]. Hydrogen consumption was observed above about 523K over Ni0.2Mg0.8O, and the consumption amount was increased by the addition of Pd, although the reduction started at a similar temperature. On Pd(0.5)/Ni0.2Mg0.8O, the peak at 353K was also observed in the same manner as that on Pd(0.5)/MgO, indicating the reduction of Pd. In fact, the amount of hydrogen consumption was much smaller than the loading amount of Pd. This is due to the reduction of Pd during the purging of the reactor cell with hydrogen at room temperature. The molar ratios of Pd to reduced Ni are calculated to be 0.05 and 0.20 on Pd(0.1)/Ni0.2Mg0.8O and Pd(0.5)/Ni0.2Mg0.8O, respectively [73]. From the Pd K-edge EXAFS analysis of Pd(0.5)/Ni0.2Mg0.8O listed in Table 2 [73], we find that the CN ratio of CNPd–Pd/CNPd–Ni is much higher than that on Pd(0.2)+Ni(10.6)/α-Al2O3. This is interpreted as due to the large size of Pd metal phase in the Pd-cluster–embedded Ni metal particles (Fig. 6(b)). The size of Pd metal particles formed at the first step in the reduction process becomes larger because NiO–MgO solid solution has lower reducibility than NiO supported on α-Al2O3, judging from the TPR profiles, and so the aggregation of Pd metal particles proceeds at higher temperature without the interaction with Ni species. It should be noted that the much higher molar ratio of Pd to reduced Ni (Pd/Ni0) on Pd(0.5)/Ni0.2Mg0.8O than that on Pd(0.2)+Ni(10.6)/α-Al2O3 can also be related to the increase of the ratio of CNPd–Pd/CNPd–Ni. From the viewpoint of the additive effect, noble-metal atoms should be located near the surface. The presence of the Pd atoms on the surface can be verified by FTIR of the CO adsorption. Fig. 8 shows FTIR spectra of CO adsorption on reduced Ni0.2Mg0.8O, Pd/Ni0.2Mg0.8O and Pd/MgO catalysts [73]. In the case of Ni0.2Mg0.8O, we observed two peaks; one at 2050cm−1 due to linear CO on Ni and the other at 1940cm−1 due to bridging CO species on Ni [106]. One characteristic is that the intensity of bridging CO is relatively strong compared to that of linear CO over Ni0.2Mg0.8O. However, the CO adsorption profile was drastically changed when Pd was added on Ni0.2Mg0.8O. On Pd/Ni0.2Mg0.8O catalysts, one new peak at 1980cm−1 appeared. As a reference, the spectrum of Pd/MgO is also shown in Fig. 8. According to the previous reports, the peak at 1970cm−1 is assigned to bridging CO on Pd and the peak at 1900cm−1 is assigned to CO adsorbed on the three-fold hollow site of Pd surface [107–109]. From the comparison with Pd/MgO, the peak that appeared on Pd/Ni0.2Mg0.8O at 1968cm−1 can be assigned to bridging CO on Pd. The intensity of this peak increased with increasing Pd content in Pd/Ni0.2Mg0.8O. This supports the presence of Pd particles on the surface of the Pd-cluster–embedded Ni metal particles, as illustrated in Fig. 6(b). 2.3 Ni metal particles modified with noble metals supported on other supports Li et al. [57–61] have prepared various noble metal-doped Ni/Mg(Al)O catalysts by adopting the “memory effect” of Mg–Al hydrotalcite (HT). In these studies, Mg(Ni)–Al hydrotalcite was prepared by coprecipitation and calcined to form Mg(Ni,Al)O periclase. When Mg(Ni,Al)O periclase was dipped in an aqueous solution of noble-metal nitrate, the HT was reconstituted due to the “memory effect”. During the reconstitution, noble-metal ions were incorporated or trapped in the layer structure of the HT, which led to the formation of highly dispersed noble metal–Ni supported catalysts after the calcination, followed by the reduction. EXAFS studies of Ru-doped Ni/Mg(Al)O catalysts after the reduction confirm the formation of Ru-Ni alloy particles where the Ru is located in the surface layer of Ni metal particles [59]. A similar noble-metal location was also observed for Rh- and Pt-Ni/Mg(Al)O; Pt is more deeply incorporated into Ni particles than Ru and Rh on Ru-Ni/Mg(Al)O and Rh-Ni/Mg(Al)O [61]. By using co-precipitation, Nagaoka et al. [88] prepared a NiRh/MgAl bimetallic catalyst from a hydrotalcite precursor, in which a part of Mg2+ and Al3+ was replaced by Ni2+ and Rh3+, respectively. It was reported that NiRh alloy particles are formed and that the surface of the NiRh alloy particles is enriched in Ni, as confirmed by EXAFS and IR of adsorbed CO. Crisafulli et al. [43] prepared SiO2 supported Ni–Ru and Ni–Pd bimetallic catalysts from nitrate and chloride precursors by incipient wet co-impregnation. Ni(NO3)2 was used as the Ni precursor, and the nitrate or chloride salts were used as precursors of Ru and Pd. In the case of Ni–Ru catalysts, a strong Ni–Ru interaction takes place with formation of Ni–Ru bimetallic particles that have a surface mainly covered by Ni. The amount of Ni on the surface is lower for the chloride Ni–Ru catalyst than that for the nitrate Ni–Ru catalyst, probably due to the formation of larger clusters of Ru on the chloride samples, limiting the dispersion of nickel. On the other hand, in the case of Ni–Pd catalysts, the interaction between Ni and Pd is rather low and these metals tend to form separate aggregates. The formation of separate metallic aggregates is also suggested by Crisafulli et al. when H-ZSM5 is used as a support for Ni–Ru bimetallic catalysts [44]. The weak Ni–Ru interaction on H-ZSM5 supported catalysts is probably due to a strong metal–support interaction, which somewhat hinders the possibility of the formation of bimetallic phase. 3 Activity Table 4 lists the results of the activity test of Pt(0.1), Ni(2.6), Pt(0.1)+Ni(2.6), Pt(0.1)/Ni(2.6) supported on γ-Al2O3 in the steam reforming of methane, and characterization results are also shown [23]. The activity of methane steam reforming of Pt(0.1)+Ni(2.6) was comparable to that of Ni(2.6), and Pt(0.1)/Ni(2.6) has lower activity than Pt(0.1)+Ni(2.6) and Ni(2.6). Metal particle sizes of Ni(2.6), Pt(0.1)+Ni(2.6) and Pt(0.1)/Ni(2.6) were almost the same, and the difference of activity can be due to the surface composition. As mentioned in the previous section, Pt atoms are well-mixed with Ni on Pt(0.1)+Ni(2.6), and the surface concentration of Pt is low, and Ni is the main component on the surface; these factors can explain the comparable activity of Pt(0.1)+Ni(2.6) to that of Ni(2.6). Based on the result that Pt atoms are segregated to the surface on Pt(0.1)/Ni(2.6), lower activity can be caused by the surface Pt atoms. In fact, the small Pt clusters may exhibit the high activity, but it is thought that the surface Pt atoms on Pt(0.1)+Ni(2.6) become less active than the surface Ni atoms on much larger particles. Pt(0.1)/Ni(2.6) showed lower activity in the steam reforming of methane; in contrast, it showed higher performance in the oxidative steam reforming of methane as mentioned below [87]. Luna et al. [66] reported that the addition of small amounts of Rh to Ni/Al2O3 catalysts increased the number of metal atoms exposed on the surface. The activity of methane steam reforming was proportional to the number of metal surface atoms, and this means that the turnover frequencies were almost constant for promoted and unpromoted catalysts and that the apparent activation energy was unchanged. We conclude that Rh acts as a dispersion promoter for Ni. Foletto et al. [65] reported that the addition of small amounts of Pt to Ni/MgAl2O4 by the sequential impregnation method promoted an increase in surface area of Ni metal and caused a considerable increase in methane conversion in the steam reforming of methane. The addition of Pt, Pd and Rh to Ni0.03Mg0.97O solid solution catalyst enhanced the activity and stability in the methane reforming with CO2. The addition of noble metals increased the reduction degree of Ni species in the solid solution and the amount of H2 adsorption; the results suggest the formation of noble-metal alloy. The surface of the alloy particles gives higher turnover frequency than that of monometallic Ni metal particles. The kinetic analysis suggests that the alloy formation facilitate the methane dissociation. In addition, the addition of noble metals suppresses the coke formation [40,41,110]. Rh-promoted Ni/α-Al2O3 catalysts prepared by a co-impregnation method were reported to show higher activity than Ni/α-Al2O3 and Rh/α-Al2O3 catalysts and to exhibit excellent coke resistance ability in methane reforming with CO2 [49]. Becerra et al. [42] reported that the addition of small amounts of Rh to Ni/γ-Al2O3 catalyst by a sequential impregnation method produces an increase in the metal surface area, accompanied by an increase of the methane dry reforming rate. However, the Rh addition has no influence on the turnover frequencies, suggesting that the activity increase is predominantly caused by the increase of the number of active sites rather than by the electronic effect. Crisafulli et al. [43] studied the effect of noble-metal addition (Ru,Pd) to Ni/SiO2 catalysts, which were prepared by co-impregnation method, for the CO2 reforming of methane. It was found that the catalytic behavior of the Ni–Ru and Ni–Pd bimetallic catalysts strongly depends both on the noble metal and the precursor used. In the case of Ni-based bimetallic samples prepared from nitrate precursors of the noble metal, the presence of Ru strongly improved the catalytic activity and stability. The addition of Pd to supported Ni catalyst caused just a slight increase in the reaction rate; however, the deactivation rate is higher than that observed on the monometallic Ni catalyst. On Ni-based bimetallic samples prepared starting from the chloride precursors, the presence of the noble metal (Ru or Pd) causes a moderate decrease in the catalytic activity. The best results in terms of activity and stability are obtained on the nitrate-derived Ni–Ru catalyst. The different catalytic performance between Ni–Ru and Ni–Pd bimetallic catalysts is mainly related to the different degrees of metal-metal interactions occurring on the catalysts. The strong improvements in the activity and stability observed in the case of ex-nitrate Ni–Ru catalysts has been attributed to the formation of Ni–Ru bimetallic clusters with a surface mainly covered by nickel. This leads to an increase in the metallic dispersion of Ni and favors the formation of a more reactive intermediate carbonaceous species, thus inhibiting the deactivation of the catalyst. In a later study [44], Crisafulli et al. compared the catalytic performance of SiO2 and H-ZSM zeolite supported Ni–Ru bimetallic catalysts in the CO2 reforming of methane. Ni–Ru/SiO2 catalysts are much active and stable than Ni–Ru/H-ZSM catalysts. The strong improvement in the activity and stability observed on SiO2 supported Ni–Ru bimetallic catalysts has been attributed to an increase in the dispersion of Ni metal as a consequence of the formation of Ni–Ru clusters with the surface mainly covered by Ni. Pawelec et al. [45] investigated the effect of the preparation method and the Ni content on the surface and catalytic properties of PtNi/ZSM-5 for the dry reforming of methane. Pt(0.5)/Ni(6) prepared by sequential impregnation was reported to exhibit the best performance in terms of activity and stability. The addition of Pt leads to the formation of small and easily reducible NiO particles. The improvements of catalytic activity and stability for Pt(0.5)/Ni(6) catalyst were attributed to an increase of the Ni metal dispersion caused by the intimate contact between Ni and Pt. Ni/MCM-41 catalysts modified with a small amount of Pd are also reported by Pawelec et al. to show high activity and stability in the dry reforming of methane [46]. The superior catalytic performance of Pd-promoted Ni catalyst is attributed to the synergy effect between Ni and Pd, which leads to high reduction degree and high metallic surface area due to increase of the dispersion. In a recent study by Özkara-Aydinoğlu et al. [51], it was reported that the catalytic performance of Pt/Ni/δ-Al2O3 in the dry reforming of methane strongly depended on the metal loadings and Pt/Ni ratio. Among all the catalysts, Pt(0.3)/Ni(10)/Al2O3 with the highest Pt/Ni ratio exhibited the highest catalytic activity and stability. We suggest that the high Pt/Ni ratio of Pt(0.3)/Ni(10)/Al2O3 led to a relatively easy reduction of NiO and to smaller-sized Ni particles due to the intimate interaction between Pt and Ni. 4 Suppression of Ni oxidation and promotion of Ni reduction 4.1 Suppression of deactivation due to oxidation of Ni metals The addition of noble metals to Ni catalyst can enhance the catalytic activity by the direct increase of the number of surface Ni atoms. Another additive effect is to increase the conversion by the enhancement of the catalyst reducibility. This behavior has been observed remarkably in the oxidative reforming of methane. Fig. 9 shows the additive effect of the gases for the combustion reaction (CH4/O2 = x/2x; x =2–10), which is called as the combustion gas, to methane steam reforming gas (CH4/H2O=30/30) on methane conversion over Ni(2.6), Pt(0.1), and Pt(0.1)/Ni(2.6) supported on γ-Al2O3 [86]. In this experiment, the partial pressure condition of A corresponds to the steam reforming of methane without the addition of oxygen. The order of methane conversion at A is as follows: Ni(2.6)>Pt(0.1)/Ni(2.6)>Pt(0.1) as mentioned in Table 4. At this partial pressure condition, methane conversion at the reaction equilibrium is 92%. Methane conversion decreased drastically over Ni(2.6), which was comparable to the conversion given by the combustion reaction when the combustion gas was introduced. This behavior is interpreted as due to the deactivation of Ni metal species. Methane conversion over Pt(0.1) was low in steam reforming of methane. However, the addition of the combustion gas enhanced methane conversion. Methane conversion at F (oxidative steam reforming) over Pt(0.1) was much higher than that over Ni(2.6). This high activity of Pt(0.1) in oxidative steam reforming can be related to the high reducibility of Pt compared to Ni. Although methane conversion on Pt(0.1)/Ni(2.6) at the A condition was located between Ni(2.6) and Pt(0.1), the highest methane conversion was given by Pt(0.1)/Ni(2.6) at the F condition. Modification of Ni with Pt by sequential impregnation method enhanced the performance in the oxidative steam reforming of methane through inhibition of Ni oxidation. Fig. 10 shows the contact time (W/F) dependence of methane conversion in oxidative steam reforming of methane over Ni0.2Mg0.8O, Rh(0.035)/Ni0.2Mg0.8O, and Rh(0.035)/MgO [75]. In these experiments, W/F was changed from higher to lower, then reverted to higher values. Hysteresis of catalytic performance with respect to W/F decreasing and increasing in oxidative steam reforming of methane was observed over Ni0.2Mg0.8O. This behavior is reflected by deactivation due to oxidation under low W/F conditions. In particular, the methane conversion was decreased from about 100% to 40% when the W/F was decreased from 0.4 to 0.2ghmol−1. When the state of catalyst is unchanged, conversion is proportional to W/F in the low conversion range. The decrease of the methane conversion on Ni0.2Mg0.8O is too steep, indicating that the state of catalyst drastically changed by the oxidation. On the other hand, hysteresis was not observed on Rh(0.035)/Ni0.2Mg0.8O and Rh(0.035)/MgO. Another important point is that Rh(0.035)/Ni0.2Mg0.8O showed much higher conversion than Ni0.2Mg0.8O and Rh(0.035)/MgO, particularly at low W/F values. One additive effect of Rh is to enhance the reduction degree of Ni species in Ni0.2Mg0.8O. However, the enhancement of the reduction degree cannot explain the great difference in the activity at low W/F. Similar behavior was also observed in the case of Pt and Pd addition [74]. The results indicate that the synergy between Rh and NiO–MgO can contribute to inhibition of oxidation deactivation even at the shorter contact time. Fig. 11 shows the dependence of methane conversion in oxidative steam reforming of methane over Ni(0.9) and Pt(0.2)/Ni(0.9) supported on γ-Al2O3 as a function of the temperature of thermocouple (T TC) [87]. In the activity test, after the catalyst was reduced in H2 flow at 1123K for 0.5h, T TC was first decreased from 1123 to 773K; subsequently it was increased from 773 to 1123K. In the profile of T TC decreasing over Ni(0.9), methane conversion decreased drastically at T TC =923K, which is due to the oxidation of active Ni species. It dropped to about zero when T TC was below 873K, where Ni catalyst lost its methane reforming and combustion activity. On the other hand, in the profile of T TC increasing, the catalytic activity of Ni(0.9) was not recovered until 1023K. When T TC was beyond 1023K, methane conversion increased gradually, however it did not reach the same conversion level as in the profile of T TC decreasing. An important point on Ni(0.9) is that methane conversion showed the severe hysteresis with respect to T TC decreasing and increasing. In contrast, in the case of Pt(0.2)/Ni(0.9) catalyst, the hysteresis was not observed; the behaviors in the profiles of increasing and decreasing temperature were almost identical. The addition of Pt was also effective for resistance to the oxidation of Ni even when the reaction temperature was rather low. The addition of noble metals to Ni catalysts enhanced the resistance to the deactivation by oxidation drastically under higher oxygen partial pressure, shorter contact time, and lower reaction temperature, as a result, the conversion was enhanced. In the oxidative steam reforming, the catalyst near the catalyst inlet is oxidized because O2 is present in the gas phase, and this oxidized zone becomes larger at higher oxygen partial pressure, shorter contact time, and lower reaction temperature. On the other hand, the amount of the reduced catalyst in the downstream becomes smaller, and methane conversion decreased because methane reforming is catalyzed by the reduced catalyst. The amount of the catalyst in the oxidized and reduced states is determined by the oxidation rate and the reduction rate of the catalysts and the addition of noble metals to Ni catalysts can enhance the reduction rate, as is suggested from the temperature-programmed reduction. A synergy effect of noble metals and Ni in the oxidative steam reforming is interpreted as due to the high activity of Ni metal species whose state is maintained by the presence of noble metals with high reducibility. The enhanced resistance to the Ni oxidation by the addition of noble metals is also reported by Nagaoka et al. [88] where autothermal reforming of methane was carried out at very high space velocities (1.7×102 to 1.2×104 lg−1 h−1) and at a cycle of temperature (1073–773–1073K). The activity of Ni/MgAl was completely lost at 773K at very high space velocities due to the oxidation of Ni and was not recovered even if the temperature was increased to 1073K. The oxidation of Ni was suppressed efficiently by the addition of small amounts of Rh (Ni/Rh=49) by co-precipitation method. Two explanations of the role of Rh in suppressing the oxidation of Ni are suggested. One is related to the high catalytic activity due to the larger amount of metals exposed, which leads to more reductive atmosphere. The other possibility is the H2 spillover from Rh to the NiRh alloy particles. 4.2 Suppression of hot spot formation In the case of the conventional steam reforming of methane, the heat transfer from the outside limits the productivity of synthesis gas. On the other hand, the feeding rate of the reactants in the oxidative steam reforming of methane can be higher than that in steam reforming. This is because the oxidative steam reforming of methane can be an internal heat supplying system, and this can be connected to much higher productivity of the synthesis gas. However, oxidative steam reforming of methane under a higher feeding rate has a problem of hot spot formation near the catalyst bed inlet, because the hot spot increases the catalyst temperature and this can cause the catalyst deactivation via sintering and aggregation of metal particles. Catalyst development for the suppression of hot spot formation contributes to higher productivity. In order to evaluate the suppressing effect of the hot spot formation, one must measure the temperature gradient in the catalyst bed during the oxidative steam reforming of methane. Fig. 12 shows an example of the experimental setup using IR thermography [111]. It has been found that the temperature gradient of Pt and Rh was much smaller than that of Ni catalyst in oxidative steam reforming of methane [112,113]. This behavior is related to the oxygen affinity of Rh and Pt being lower than that of Ni; the small temperature gradient in the catalyst bed is explained by the overlap of the combustion reaction zone with the reforming reaction zone, as explained below. On the other hand, although Pd has low oxygen affinity, it showed a larger temperature gradient than Ni catalyst because of the very low reforming activity of Pd catalysts. Fig. 13 shows the effect of loading amount on the bed temperature in the oxidative steam reforming of methane over the Ni and Pt monometallic catalysts supported on γ-Al2O3 [79]. In the case of Ni catalysts, the highest bed temperature is insensitive to the Ni loading amount, indicating that the hot spot cannot be suppressed by varying the Ni loading. In the case of Pt catalysts, considering the high cost and limited availability of Pt, a decreased loading amount is desired. However, it is difficult to obtain high activity and high resistance to hot spot formation on the monometallic noble-metal catalysts with a very small loading amount. One of the strategies of catalyst development for oxidative reforming of methane with high resistance to hot spot formation is the combination of high reforming activity of Ni with high reducibility of a small amount of Pt [93,94]. In addition, an intermetallic compound and alloy have been known to form between Pt and Ni, which is caused by their strong interaction. The structure of the bimetallic particles can be influenced by the preparation method as described above, so the effects of noble-metal addition by two different preparation methods can be compared. Fig. 14 shows the catalyst bed temperature profile in oxidative steam reforming of methane over Pt(0.1)/Ni(2.6), Pt(0.1)+Ni(2.6), Ni(2.6), and Pt(0.1) supported on γ-Al2O3 at the same contact time [79]. A very high temperature region near the catalyst bed inlet and much lower temperature region in the downstream were observed over Ni(2.6). This large temperature gradient is caused by separation of the combustion and reforming reaction zones, as explained below. Pt(0.1) exhibited a flatter temperature profile than Ni(2.6). However, the temperature at the inlet was rather high. The temperature profile on Pt(0.1)+Ni(2.6) was similar to that on Ni(2.6), which indicates that the additive effect of Pt introduced by the co-impregnation method is small. In contrast, the temperature on Pt(0.1)/Ni(2.6) is much lower than that for the other three catalysts, which means that the additive effect of Pt introduced by the sequential impregnation method is remarkable, in spite of the lower activity in the steam reforming of methane without the addition of oxygen (Table 4). The additive effect of Pt can be strongly dependent on the preparation method and the structure of bimetallic particles. We have reported that the temperature profile of Pt(0.1)/Ni(2.6) in the oxidative steam reforming of methane was almost the same during 8h [86]. In addition, the FTIR spectrum of CO adsorption on the used Pt(0.1)/Ni(2.6) for 8h was similar to that on the fresh catalyst [86]. These results indicate the stability of Pt(0.1)/Ni(2.6). The structure of the Pt–Ni bimetallic particles on Pt(0.1)/Ni(2.6) can be stable under the reaction conditions. On the other hand, the surface Pt atoms may be incorporated into the bulk because of the strong interaction between Pt and Ni. It may be expected that a well-mixed structure like the bimetallic particles prepared by the co-impregnation method is more thermodynamically stable than the segregated structure. At present, the activation energy in the conversion of segregated structure to well-mixed structure is thought be so high that the metastable segregated structure can be maintained. One reason for the high activation energy can be that the metal bonding radius of Pt is larger than that of Ni. Fig. 15 shows the highest catalyst bed temperature and methane conversion in oxidative steam reforming of methane over Pt–Ni, Pd–Ni, monometallic Pt, Pd, and Ni catalysts supported on γ-Al2O3 [23]. In fact, Pd(0.05) showed low methane conversion and high bed temperature; this result indicates that Pd(0.05) has high combustion activity and low reforming activity. The highest bed temperature on Pd(0.05)+Ni(2.6) was almost identical to that on Ni(2.6). In contrast, the highest bed temperature on Pd(0.05)/Ni(2.6) was much lower than those on Ni(2.6), Pd(0.05) and Pd(0.05)+Ni(2.6). Similar behavior of Pt–Ni and Pd–Ni in oxidative steam reforming of methane in terms of the superiority of the sequential impregnation method suggests that the additive effect of Pt and Pd is caused by surface segregation structure and high reducibility, not by catalytic properties of Pt and Pd themselves such as high combustion activity of Pd metal. The Pt(0.1)/Ni(2.6) showed a little higher resistance to hot spot formation than Pd(0.05)/Ni(2.6), and this can be interpreted by the different metal particle size of 5.0nm for Pt(0.1)/Ni(2.6) (Table 4) and 8.1nm for Pd(0.05)/Ni(2.6) [80]. The effect of metal particle size on the hot spot formation is discussed in the topics of α-Al2O3 supported catalysts. Comparison between the sequential and co-impregnation catalysts indicates that higher surface ratio of Pt or Pd to Ni is connected to higher resistance to the catalyst oxidation and hot spot formation. On the other hand, the order of the highest bed temperature was Rh(0.05)<Rh(0.05)/Ni(2.6)<Rh(0.05)+Ni(2.6)≈Ni(2.6) [80]. Except for Rh(0.05), the tendency was similar to that of Pd containing Ni(2.6)-based catalysts. The addition of Rh was effective to the suppression of hot spot formation on Ni; however, the performance of the monometallic Rh catalyst was higher than those of the bimetallic catalysts. This can be due to the superiority of Rh itself, which is known to be very effective for the catalytic partial oxidation of methane at much shorter contact times [114–117]. In order to elucidate the suppression mechanism of the hot spot formation, it is necessary to understand the state of the catalysts near the catalyst bed inlet. Here, the temperature-programmed reduction profiles of the catalyst near the inlet and outlet were obtained separately [87]. The state of the catalysts near the catalyst bed outlet is also important as a reference because all the catalysts are in the reduced state at the high partial pressure of synthesis gas and in the absence of oxygen. In this experiment, the catalyst was purged with Ar after the reaction (CH4/H2O/O2/Ar=40/30/20/10, W/F =0.16ghmol−1, 1123K, W =0.08g), and then cooled rapidly from the reaction temperature to room temperature. Then the catalysts at the bed inlet and outlet were divided carefully. The amount of the divided catalysts was 0.01g. Judging from the catalyst bed temperature profiles (Fig. 14), we found that the size of the high temperature zone was as large as a quarter of the catalyst bed, where the total amount of the catalyst was 0.08g. Fig. 16 shows the temperature-programmed reduction profiles of the catalysts near the bed inlet and outlet [87]. The lower temperature peak (650–760K) is assignable to NiO, which interacts weakly with the Al2O3 surface [118]. The higher temperature peak at 1150K is attributed to the reduction of NiAl2O4 compound [119,120], which can be formed by a solid-state reaction between NiO and Al2O3. The respective H2 consumption values for reduction of NiO and NiAl2O4 were determined as 70% and 29% on Ni(2.6) at the inlet, indicating that almost all of the Ni species at the catalyst bed inlet were oxidized during the reaction. On the other hand, in the case of Ni(2.6) at the bed outlet, the peak at 470K is attributable to the reduction of adsorbed oxygen species on the metallic Ni surface, where the catalysts were oxidized during the sample transfers from the reactor to the TPR cell. The TPR result at the outlet indicates that the metallic Ni species were present on the catalyst at the outlet under the reaction condition. The amount of H2 consumption in the lower temperature peak was decreased to 59% on Pt(0.1)+Ni(2.6) at the bed inlet. In addition, the maximum reduction of Ni oxide was observed at 630K, which is about 40K lower than the reduction of Ni on Ni(2.6). An important point is that the reduction peak shifted to a much lower temperature region (530–610K) on Pt(0.1)/Ni(2.6) at the catalyst bed inlet, which corresponded to 44% of the amount of Ni. These results indicate that the addition of Pt by sequential impregnation method greatly increased the amount of reduced Ni at the catalyst bed inlet, even in the presence of gas-phase O2 during oxidative steam reforming of methane. The surface Pt atoms segregated on the surface of Pt–Ni bimetallic particles on Pt(0.1)/Ni(2.6) gave high reducibility to the catalyst and the high resistance to the catalyst oxidation. Fig. 17 illustrates the hot spot formation mechanism on Ni catalysts and the suppression mechanism of hot spot formation on Ni catalysts modified with Pt and Pd [23]. A large temperature gradient over Ni catalysts in oxidative steam reforming of methane was observed. Most Ni species were oxidized in the presence of oxygen at the catalyst bed inlet because the rate of Ni oxidation by O2 is much higher than the rate of reduction of oxidized Ni species with reducing agents like CH4, CO, and H2. Consequently, the oxidized Ni species loses reforming activity and only has combustion activity. Therefore, at the catalyst bed inlet, only the exothermic reaction can proceed, which increases the catalyst bed temperature. On the other hand, in the region with no oxygen at the catalyst bed outlet, the Ni species can be maintained in the metallic state; the Ni species presents the reforming activity. In this reaction zone, only the endothermic reaction can proceed and the catalyst bed temperature decreases, which can result in a large temperature gradient. In contrast, on the Pt/Ni and Pd/Ni catalysts, the ratio of reduced to oxidized species can be much higher in the presence of oxygen because of the modification effect. In particular, the reduced species can also serve as the active site for methane reforming as well as combustion, even in the presence of oxygen. The reforming reaction can contribute to a temperature decrease at the catalyst bed inlet. Here, the exothermic heat by the combustion reaction can be transferred to the endothermic reforming reaction directly at the same region in the catalyst bed and at the same catalyst surface, which is called “direct heat supplying system”. The highest bed temperature in the oxidative steam reforming is influenced by the metal particle size on Ni/α-Al2O3 [121]. In order to evaluate the effect of the Ni metal particle size of monometallic Ni catalysts, we prepared and tested the Ni catalysts with different precursors, because it has been reported that different precursors (chloride, nitrate, acetate) brought about different metal dispersion values [121]. The Ni/α-Al2O3 catalysts with lower dispersion gave the higher bed temperature; this can be explained by lower reforming activity of the catalysts with lower dispersion. The addition of Pd and Pt to Ni/α-Al2O3 catalysts also affects the metal particle size. Therefore, it is necessary to compare the data including the size of bimetallic particles. Here, the relation between the highest bed temperature in oxidative steam reforming of methane and the average particle size estimated from H2 adsorption amount over various catalysts is shown in Fig. 18 [84]. The tendency that the catalyst with smaller metal particles is more effective to the suppression of hot spot formation was also observed on almost all the bimetallic catalysts. The addition of Pd is totally more effective to the decrease of the highest bed temperature than Pt, and it is concluded that the co-impregnation method using PdCl2 and Ni(NO3)2 is most effective, and the smaller loading amount of Pd is also more effective. The preparation method by sequential impregnation gave larger average metal particles size and this tendency can be caused by the surface ratio of Pt or Pd to Ni being higher than that by co-impregnation method, probably because the interaction between noble metals and α-Al2O3 is weaker than that between Ni and α-Al2O3. Smaller metal particle size is more favorable, and at the same time, higher surface ratio of Pt or Pd to Ni is also more favorable. However, a higher surface ratio of Pt or Pd tends to increase the metal particle size. Therefore, the additive amount should be optimized. It is thought that smaller metal particle size and higher surface ratio of a noble metal are more compatible in the case of Pd+Ni compared to the case of Pt+Ni. An important point is that Pd is more effective than Pt considering the particle size of bimetallic particles. Based on the results, Ni/α-Al2O3 catalysts modified with various noble metals using corresponding noble-metal chloride precursors were prepared by the co-impregnation method and tested in the oxidative steam reforming of methane, as shown in Fig. 19 [83]. The addition of a larger amount of noble-metal changes the metal particle size: the increase was observed in the case of Ru, Rh, and Pd, and the decrease was observed in the case of Ir, Pt, and Au. The reason for the different tendency has not been elucidated and further investigation is necessary, although it may be affected by the ionic state of precursor salts such as anions ([IrCl6]2−, [PtCl6]2−, [AuCl4]−) and cations (Ru3+, Rh3+, Pd2+). The highest bed temperature decreased with decreasing metal particle size over the monometallic Ni catalysts, as mentioned above. Similar tendency was obtained on Ir+Ni, Pt+Ni, and Pd+Ni catalysts. It is characteristic that the monometallic noble-metal catalysts such as Ir(0.14), Pt(0.14), and Pd(0.07) have much lower activity in oxidative steam reforming, which suggests that the main active species on Ir+Ni, Pt+Ni, and Pd+Ni can be Ni. On the other hand, a different tendency was observed on Ru+Ni and Rh+Ni catalysts, and the corresponding monometallic catalysts such as Ru(0.07) and Rh(0.07) have higher activity in oxidative steam reforming. Therefore, the main active species on Ru+Ni and Rh+Ni can be Ru and Rh, and these noble metals have higher resistance to hot spot formation. The temperature decrease can be explained by compensation of particle size increase with larger amount of noble-metal addition in the case of Ru+Ni and Rh+Ni catalysts. In the case of Au+Ni, the addition of larger amount of Au decreased the particle size, but increased the bed temperature. This can be due to very low activity of Au itself. From the comparison, we conclude that Pd is the most effective among noble metals. The temperature measurement system using thermocouples was applied to the oxidative reforming of methane with CO2 over similar bimetallic catalysts. The result indicates that the sequential impregnation Pt/Ni catalyst is more effective to the suppression of the hot spot formation than the co-impregnation Pt+Ni catalyst in the oxidative reforming with CO2 when a small amount of Pt is added to Ni catalysts [93,94,113]. The effect of noble-metal addition on the catalyst bed temperature in the partial oxidation of methane was reported by Basile et al. [56,70] where IR thermography was also used to monitor the surface temperature. In their studies, the partial oxidation of methane was carried out under autothermal conditions without external heat supply. The temperature at the beginning of the catalyst bed is found to be Rh/Ni>Ni, while the temperature at the exit of the catalyst bed is this opposite. This is because Ni is deactivated in oxygen rich conditions by the oxidation of Ni metals, while the presence of Rh in the Rh/Ni catalyst prevents the Ni oxidation and consequently gives higher activity in the oxidation conditions. 5 Suppression of carbon formation In the GTL and methanol synthesis process, the industrial production of synthesis gas by the reforming of natural gas under pressurized conditions is preferable because the natural gas has high pressure underground and the reactions of Fischer–Tropsch and methanol synthesis are also carried out under pressurized conditions. Methane reforming to synthesis gas under more pressurized conditions can save the energy for the compression of the synthesis gas more significantly. Therefore, the evaluation of the catalytic performance under pressurized conditions has been important. For example, a large amount of carbon was deposited under the pressured dry reforming of methane on the catalyst with high resistance to the coke deposition in the dry reforming at atmospheric pressure [122]. In particular, the rate of carbon deposition in the methane reforming increased drastically with increasing the reaction pressure as reported previously [122–128], and this can be connected to the catalyst deactivation. Oxidative steam reforming of methane was carried out in a horizontal fixed-bed flow reaction system under the pressurized condition [75]. A quartz tube (inner diameter, 4.4mm) inside a stainless steel tube (inner diameter, 7.4mm) was used as the reactor, and the quartz tube was sealed by a silicon rubber gasket. At the outlet of the catalyst bed, the reaction temperature was monitored by a thermocouple, which was inserted into a thin quartz tube. Catalysts were reduced with hydrogen at atmospheric pressure at 1073K for 0.5h in each experiment. The partial pressure ratio of reactants was CH4/H2O/O2 =2/1.5/1. Steam reforming (CH4/H2O=1/1) and dry reforming (CH4/CO2 =1/1) of methane were also carried out in the same apparatus. The total pressure was 1.0MPa; 30mg of catalyst was used for each experiment. The length of the catalyst bed was about 4mm. Contact time W/F was 0.43ghmol−1, where methane conversion did not reach the equilibrium level in order to evaluate the catalyst deactivation from the decrease of methane conversion. In all these experiments, all the oxygen was converted, and the water gas shift reaction reached the equilibrium. Therefore, higher methane conversion is related to high CO selectivity and lower H2/CO ratio. Here, the deactivation rate is defined as follow; ((CH4 conversion at 0.5h)−(CH4 conversion at 8h))/(CH4 conversion at 0.5h)×100%. Thermogravimetric analysis (TGA) for the estimation of carbon amount was carried out by using a Shimadzu DTG-60 apparatus. The analysis was done with 10mg of catalysts under flowing air (20cm3 min−1) at 15Kmin−1 heating rate. The amount of carbon was estimated from the exothermic weight loss between 800K and 1000K. Table 5 lists the properties of noble-metal added NiO–MgO solid solution catalysts and their catalytic performances in oxidative steam reforming of methane under pressurized conditions [72–75]. It is characteristic that Rh(0.035)/Ni0.2Mg0.8O, Rh(0.035)/MgO, Pt(0.1)/Ni0.2Mg0.8O, and Pt(0.1)/MgO gave almost no carbon deposition and very low deactivation rate. Comparing with the behavior of Ni0.2Mg0.8O without the modification of Rh and Pt, the addition of Rh and Pt to NiO–MgO solid solution is effective for the inhibition of carbon deposition, which originates from the properties of Rh and Pt themselves because there is no coke and no deactivation of Rh/MgO and Pt/MgO. The behavior of Pd-added Ni0.2Mg0.8O solid solution catalysts was different from that of Rh- and Pt-added catalysts, and low resistance to carbon deposition of Pd/MgO can explain the difference. Fig. 20 shows a relationship between carbon deposition and deactivation rate in oxidative steam reforming of methane over Pd/Ni0.2Mg0.8O, Ni0.2Mg0.8O, and Pd/MgO [23]. An important point is that Pd(0.1)/Ni0.2Mg0.8O has high resistance to coke deposition and no catalyst deactivation, although the coke deposition and the catalyst deactivation were clearly observed on Pd(0.1)/MgO and Ni0.2Mg0.8O. Table 5 also lists the catalytic performance of Pd/MgO with various Pd loading amounts [73]. The amount of carbon deposition and the deactivation rate increased with increasing the loading amount of Pd. On the other hand, the loading amount of Pd should be optimized because Pd/Ni0.2Mg0.8O with Pd content <0.1wt% and >0.15wt% has lower resistance to coke formation and the catalyst deactivation. The differences in metal particle size are quite small, and the resistance to carbon deposition cannot be explained using the differences in the metal particle size. The interaction between Pd and Ni species is thought to contribute to the suppression of carbon formation. The structure of Pd–Ni bimetallic particles and surface composition can affect the performance. The similar tendency was observed on the system of Pd(0.1)/Ni0.2Mg0.8Al2O4 [81]. On the basis of the catalyst characterization, Pd clusters embedded into Ni metal particles are formed on Pd/Ni0.2Mg0.8O catalysts. The promoting effect of Pd addition can be also influenced by the size of embedded Pd clusters, and large Pd clusters lose the resistance to coke formation through its synergy with Ni. Fig. 21 shows the relation between carbon deposition and the deactivation rate in steam, dry, and the oxidative steam reforming over Pd(0.1)/Ni0.2Mg0.8O, Pd(0.1)/MgO, and Ni0.2Mg0.8O [23]. The amount of carbon deposition was in the order of dry, steam, and oxidative reforming of methane. The carbon amount on Pd(0.1)/Ni0.2Mg0.8O was smaller than that on Ni0.2Mg0.8O and Pd(0.1)/MgO, although Pd(0.1)/Ni0.2Mg0.8O gave about 10wt% carbon in dry and steam reforming. However, it should be noted that Pd(0.1)/Ni0.2Mg0.8O can suppress carbon deposition in oxidative reforming of methane. The oxidative steam reforming of methane consists of methane combustion on the catalyst near the catalyst bed inlet and methane reforming with steam and CO2 on the catalyst at the downstream, where CO2 and a part of steam are the products of the combustion reaction. Therefore, it seems that the carbon was formed on the catalyst at the downstream, but no carbon was observed. This can be explained by the catalyst bed temperature. In the case of methane reforming with steam and CO2, the catalyst bed temperature is lower than the temperature of the bed outlet at which the thermocouple is located. In contrast, the catalyst bed temperature is higher than the temperature bed outlet judging from the IR thermographical observation as indicated above. The rate of carbon deposition is sensitive to the catalyst temperature, and the carbon deposition is more favorable at lower temperature [129]. The resistance to coke deposition in oxidative steam reforming is related to the higher catalyst temperature. It has been reported that the Ni–Au catalyst showed no deactivation in the steam reforming of n-butane and almost no coke deposition. This performance was explained by the decrease in the stability of the adsorbed carbon atom and the increase in its reactivity with adsorbed oxygen by the formation of the Ni–Au surface alloy [130]. This explanation is applicable to the effect of the modification with small amounts of noble metals on the suppression of coke formation in the oxidative steam reforming of methane under pressurized conditions. 6 Catalyst activation by the reactants under mild conditions: self-activation behavior The interaction of Ni species with support materials such as Al2O3 and MgO is much stronger than that of noble metals, and this strong interaction can be related to low reducibility of the supported Ni catalysts. The Ni species on Al2O3 can form NiAl2O4 with low reducibility. In particular, the interaction between Ni and MgO is so strong that the oxidized Ni and MgO are easily converted to NiO–MgO solid solution in any composition by the solid reaction. Since MgO is an effective support and additive in order to suppress the coke deposition [105,106,129,131], MgO has been utilized in the catalysts for the methane reforming. On the other hand, the reducibility of Ni species is decreased significantly by the addition of relatively small amounts of MgO to the Ni catalyst [132]. NiO–MgO solid solution with low Ni content required H2 reduction at 1123K [105]. In a practical process, it is difficult to reduce the catalysts with pure H2. The catalyst should be reduced and activated by the reactants, for example, methane, oxygen, and steam in the case of the oxidative steam reforming of methane. Fig. 22 shows the dependence of Pt addition on the catalyst activation in oxidative steam reforming of methane over Ni0.2Mg0.8O solid solution [78]. In this experiment, the reactant gas (CH4/H2O/O2 =2/1.5/1) was introduced onto the catalyst without H2 pretreatment. At first, the catalyst was heated at 773K under Ar flowing, and then the reactant gases (CH4 +H2O+O2) for oxidative steam reforming of methane were introduced at 773K. The performance was observed at the reaction temperature for 30min. After 30min, the temperature was increased to 823K. Furthermore, the catalyst was heated stepwise up to 1073K by 50K steps. At each temperature, the performance was observed for 30min. In the case of Pt(0.1)/Ni0.2Mg0.8O, methane conversion was 25% and the main carbon-containing product was CO2 at 773K. This result indicates that only the methane combustion reaction proceeded. At a reaction temperature higher than 773K, methane conversion was beyond 25%, and it increased with increasing the reaction temperature. This behavior indicates that the reforming reaction proceeded and that the synthesis gas was formed under these reaction conditions. Methane conversion over Pt(0.1)/Ni0.2Mg0.8O increased smoothly with increasing the temperature. On the other hand, in the case of Pt(0.1)/MgO, in the range of 773–973K, methane conversion was much lower than 25%, this indicates that Pt(0.1)/MgO has low activity of methane combustion and reforming. At 1023K, methane conversion reached about 50%, although it was lower than that over Pt(0.1)/Ni0.2Mg0.8O. In addition, in the case of Ni0.2Mg0.8O in all the temperature ranges, methane conversion did not reach 25%. This means that Ni0.2Mg0.8O cannot be activated by CH4 +H2O+O2. From this comparison, we conclude that the addition of Pt to Ni0.2Mg0.8O enables the catalyst activation under mild conditions such as low temperature [78]. The addition of Rh and Pd to NiO–MgO solid solution catalysts also enables the catalyst activation by the reactant gas in the oxidative steam reforming of methane like the case of Pt addition [74,75]. The activation of Pd/Ni0:2Mg0:8Al2O4 in the oxidative steam reforming of methane is facilitated by the presence of Pd [81,82]. The self-activation of noble metal–Ni catalysts is influenced by various factors such as the type of noble metal, loading amount, precursor, and preparation method. Fig. 23 shows the effect of the doping amount of Pt, Rh, and Ru on the self-activation of Ni0.5Mg2.5(Al)O in the steam reforming of methane [61]. The reaction was conducted in a CH4/H2O/N2 (50/100/25mlmin−1) gas mixture at 973K for 180min, after heating the catalyst from room temperature to 973K in N2 gas flow. All Pt/Ni0.5Mg2.5(Al)O exhibited high CH4 conversion just after starting the reaction, although Pt(0.05)/Ni0.5Mg2.5(Al)O needed a short induction period. Rh was effective only with the doping amount above 0.10wt%, while Ru showed no reforming activity for 3h even with 0.50wt% doping. The ability of noble metals for the self-activation was deduced to be Pt>Rh≫Ru. This is probably due to the strong ability of Pt followed by Rh to promote CH4 dissociation to produce hydrogen. The order of noble metals for the self-activation in the partial oxidation of methane was also found to be Pt>Rh≫Ru [61]. Choudhary et al. [71] reported that the addition of noble metal (Pt, Pd, or Ru) to Ni/Al2O3 catalyst led to a large decrease in the light off temperature in the partial oxidation of methane, depending on the noble metal and its concentration. The light off temperature decreased in the order of Ru>Pt>Pd and decreased with increasing noble-metal concentration. Increases in both catalytic activity and CO selectivity were observed for the case of Pt or Ru addition, but substantial decreases in the activity, selectivity for CO and H2, and CO productivity were observed with increasing concentration of Pd in the catalyst. Jeong et al. [64] reported that Ru(0.5)/Ni(20)/Al2O3 catalyst prepared by sequentially impregnating showed higher activity than Ru(0.5)+Ni(20)/Al2O3 catalyst prepared by the co-impregnation in the steam reforming of methane without pre-reduction. The difference between the two Ru-promoted Ni catalysts in the degree of auto-activation was attributed to the availability of small clusters of RuO x laid over the surface of Ni-oxides for the Ru(0.5)/Ni(20)/Al2O3. Moreover, it is found that MgAl2O4-supported catalysts were more active than Al2O3-supported catalysts. Most of the Ni on the MgAl2O4 support was finely dispersed NiO clusters, while the Ni on the Al2O3 support was hard-to-reduce NiAl2O4. The presence of Ru in a highly dispersed state appears to facilitate the reduction of such Ni-oxides in the steam reforming of CH4. Dias and Assaf [91] investigated the effect of different Pd precursors on the ignition of Ni/γ-Al2O3 in the autothermal reforming of methane. In this study, the catalysts were heated to 823K in air flow, after which the methane+steam feed was started. The temperature was then raised to 873K and this temperature was maintained during the analyses; after approximately one hour, the methane+steam feed stopped and the catalyst was exposed to the air flow again at 823K. The whole process was repeated five times. It is found that Pd/Ni/Al2O3 prepared from Pd(NO3)2 precursor catalyzed the autothermal reforming of methane without the reduction pretreatment. On the other hand, the Pd/Ni/Al2O3 prepared from PdCl2 precursor only catalyzed the methane combustion. This tendency indicates that Pd/Ni/Al2O3 prepared from Pd(NO3)2 can be reduced by methane. In this case, palladium species are reduced by methane and they decompose methane to produce atomic hydrogen, which reduces nickel species and activates the catalyst. The Pd species interact strongly with the support on Pd/Ni/Al2O3 prepared from chloride by the formation of Pd x Cl y O z compounds, which cannot be reduced by methane. 7 Sustainability in the daily startup and shutdown operation In contrast to the large-scale use of reformers in the industry under typical operating conditions, the temperature varied frequently at startup and shutdown, i.e., daily startup and shutdown, for the operation in hydrogen production for polymer electrolyte fuel cells [8]. Between shutdown and startup in each DSS operation, the catalyst bed in the reformer must be purged by a sufficiently inert and an economically available gas for preserving the safety. Thus, the catalyst must be able to withstand multiple cycles under those conditions and must also tolerate operation under such unusual transient conditions without deterioration. In a study of DSS operations in steam reforming of CH4 over Ni/Mg(Al)O catalysts [32], which were prepared by using Mg(Ni)-Al hydrotalcite as the precursor, the results showed that the Ni0.5/Mg2.5(Al)O catalyst was severely deactivated although this catalyst showed high and stable activity in the steady state CH4 reforming [133–136]. The deactivation took place by the oxidation of Ni metal not only by air but also by steam during the DSS operation. It has been reported that the addition of noble metals (Ru, Rh, Pd, and Pt) to the Ni0.5/Mg2.5(Al)O catalyst effectively suppressed the deactivation, leading to high sustainability during the DSS-like operation [57–63]. Fig. 24 shows the results of Ni0.5/Mg2.5(Al)O, Rh-Ni0.5/Mg2.5(Al)O, and Rh/Mg3(Al)O catalysts under the steam-purged DSS-like operation in the steam reforming of CH4 [57]. The Ni0.5/Mg2.5(Al)O catalyst was totally deactivated even after the first steam purging, which was due to the oxidation of Ni metal by steam. The deactivation was perfectly suppressed during the four-cycled DSS operation when 0.1wt% Rh was added to the Ni0.5/Mg2.5(Al)O catalyst. The addition of Rh to the Ni0.5/Mg2.5(Al)O catalyst was quite effective; even when the Rh loading decreased from 0.1 to 0.05wt%, the deactivation was completely suppressed. Further decrease in the Rh loading to 0.01wt%, however, caused the heavy deactivation after the third steam purging. In the absence of Ni, the CH4 conversion over Rh/Mg3(Al)O catalyst was low due to the low Rh loading, and the CH4 conversion continuously decreased irrespectively of the DSS cycle. It must be emphasized that Rh alone was not active enough with such small loadings and the activity of the Rh-Ni0.5/Mg2.5(Al)O catalysts depended mainly upon the Ni species. It is suggested that Rh keeps the reduced state during the steam purging and dissociates CH4 to form hydrogen atoms after the reaction was started again at 973K. The hydrogen atoms migrate to the oxidized Ni species by spillover and reduce them to the active Ni metals. The effects of various noble metals, i.e., Rh, Pd, Pt, and Ru addition on the sustainability of the Ni0.5/Mg2.5(Al)O catalyst in the DSS-like operations are summarized in Fig. 25 [57,58], as the CH4 conversion at the fourth cycle versus the loading amount of each noble metal. All of Rh, Pt, and Ru are effective for enhancing the stability of the Ni0.5/Mg2.5(Al)O catalyst even with the loading of 0.05wt%. Pd is not so effective and the loading of 0.1wt% is required for enhancing the catalyst stability in the DSS operation of CH4 steam reforming. The high durability of noble metal–Ni/Mg(Al)O catalysts in the DSS-like operation was observed not only for the fresh catalysts, but also for the severely sintered catalysts after the steam treatment. Steaming was carried out at 1173K for 10h in a mixed gas flow of H2/H2O/N2 (20/100/25mlmin−1) after pre-reduction of the catalyst at 1173K for 0.5h. It is known that such steam treatment causes a severe sintering of supported metal catalysts and is often used to evaluate the catalyst life [137–142]. Fig. 26 shows the results of DSS SR of methane over Ni0.5/Mg2.5(Al)O and Ru(0.1)-Ni0.5/Mg2.5(Al)O before and after steaming [59]. The Ni0.5/Mg2.5(Al)O catalyst was deactivated by steaming and showed a total deactivation just after the first steam purging. On the other hand, the Ru(0.1)-Ni0.5/Mg2.5(Al)O catalyst showed a stable activity during DSS SR of methane even after steaming. Interestingly, the time course of methane conversion during the DSS operation revealed that Ru(0.1)-Ni0.5/Mg2.5(Al)O was rather stabilized after steaming; a sudden decrease in methane conversion observed just after each steam purging disappeared and methane conversion became rather constant throughout the DSS operation after steaming. A similar result was obtained over Rh(0.1)-Ni0.5/Mg2.5(Al)O and Pt(0.1)-Ni0.5/Mg2.5(Al)O after steaming. Table 6 shows the sizes of Ni particles on the Ni0.5/Mg2.5(Al)O, Ru-, Rh-, and Pt-Ni0.5/Mg2.5(Al)O catalysts before and after steaming, and after steaming followed by DSS SR of methane [59–61]. After the steaming, the sizes of Ni particles on all catalysts significantly increased, indicating an occurring of heavy sintering of Ni particles. Ni0.5/Mg2.5(Al)O exhibited no Ni metal reflection in the XRD after the DSS SR of methane. This indicates that Ni was totally oxidized during DSS SR of methane. It must be noticed that, on noble metal (0.1)-Ni0.5/Mg2.5(Al)O catalysts after steaming, the sizes of Ni particles substantially decreased after DSS SR and returned close to the original value. All these catalysts exhibited sustainable activity during the DSS SR of methane. Such prominent catalytic performance of the noble metal–Ni/Mg(Al)O system is likely to be achieved by the continuous self-regeneration of active Ni metal species. Ni2+ ions in Mg(Ni, Al)O periclase were reduced by hydrogen spillover from noble metal to form fine Ni0 particles on the surface of periclase. Conversely, surface Ni0 particles were oxidized to Ni2+ by steam and incorporated into the periclase. Such reduction-oxidation between Ni0 and Ni2+ on/in Mg(Ni,Al)O periclase aided by hydrogen spillover on noble metal or noble metal–Ni alloy effectively contributed to the regeneration of activity on the noble metal–Ni/Mg(Al)O catalysts during the SRM DSS operation. A scheme of the self-regenerative activity of Ru-Ni/Mg(Al)O is shown in Fig. 27 [59]. Fig. 28 compares the activities of Ru(0.1)- and Pt(0.1)-Ni0.5/Mg2.5(Al)O in the DSS SR of CH4 under air or air–steam combined purging [61]. Under air purging, both catalysts showed high and stable activity in the DSS SR of CH4 (Fig. 28A). This indicates that air, or oxygen, as purging gas did not oxidize Ni on either catalyst like the case of steam during DSS operation. However, the combination of air and steam as purging gas quickly deactivated Ru(0.1)-Ni0.5/Mg2.5(Al)O catalyst; both combined purging of air–steam-air and steam-air–steam totally deactivated the catalyst after the first purging (Fig. 28B). On the contrary, Pt(0.1)-Ni0.5/Mg2.5(Al)O catalyst was not deactivated by such combined purging (Fig. 28B). This indicates that Pt addition is more effective than Ru addition for the catalyst sustainability under air–steam combined purging. In addition to SR, ATR is also considered as a hopeful candidate for the production of hydrogen for polymer electrolyte fuel cells. Fig. 29 compares the activities of Pt- and Ru-Ni0.5/Mg2.5(Al)O catalysts in the DSS ATR of methane under steam purging [61]. Ru(0.1)-Ni0.5/Mg2.5(Al)O catalyst exhibited significant deactivation just after the first steam purging. Even when Ru addition was increased to 0.5wt%, the activity decreased significantly after the first steam purging. This result indicates that Ru-Ni0.5/Mg2.5(Al)O was not suitable for the DSS ATR of methane. Contrarily, Pt(0.1)-Ni0.5/Mg2.5(Al)O was sustainable enough for the steam-purged DSS ATR of CH4. We conclude that Pt-Ni/Mg(Al)O is more sustainable than Ru-Ni/Mg(Al)O not only in the air–steam-purged DSS SR of methane but also in the steam-purged DSS ATR of methane. 8 Conclusions The addition of a small amount of noble metals to Ni catalysts significantly modifies the properties of Ni metal particles by the formation of noble metal–Ni bimetallic particles. By carefully choosing the preparation method, one can obtain bimetallic particles with different structures. In particular, the addition of a small amount of noble metals to γ-Al2O3-supported Ni catalysts by the sequential impregnation method leads to the formation of segregated noble-metal atoms on the surface of the bimetallic particles, while the co-impregnation method results in a well-mixed structure. Bimetallic particles with noble metals enriched on the surface are also formed on other supported catalysts such as α-Al2O3-supported catalysts and NiO–MgO. Compared to monometallic Ni catalysts, noble metal–modified Ni catalysts exhibit superior performances in the methane reforming reactions, i.e., high activity, suppression of Ni oxidation and hot spot formation, high resistance to carbon deposition, and self-activation with the reactant gas. In addition, noble metal–modified Ni/Mg(Al)O catalysts show high stability and regenerative activity in the DSS-like operation of methane reforming. The improved performance of Ni catalysts modified with noble metals can be attributed to the synergic effect between noble metal and Ni by the formation of noble metal–Ni bimetallic particles. Functions of each noble metal in the modification of Ni are summarized. The Pt modification tends to promote the Ni reduction connecting to the suppression of hot spot formation, self-activation, and sustainability in the DSS operation, although the contribution of Pt modification on the steam reforming activity was small. The Pt modification also gives the resistance to coke deposition. The promoting effect of Pd on the reduction is similar to the case of Pt. The properties of Pd itself are high combustion activity and low reforming activity; however, Pd–Ni catalysts suppressed the hot spot formation effectively. In order to get high resistance to coke deposition with Pd modification, the additive amount should be optimized carefully. The Rh modification tends to enhance the catalyst reducibility connecting to self-activation and sustainability in the DSS operation. Since Rh itself has high reforming activity and high resistance to hot spot formation, high performance of Rh-Ni catalysts can be caused by the properties of Rh itself. Small amount of Rh modification is also effective to the suppression of coke deposition. The effect of Ru modification can be similar to that of Rh. The effect on the suppression of the coke deposition was not investigated; however, the suppressing effect of Ru can be promising. Other noble metals such as Ir and Au were also effective to the promotion in the catalyst reducibility; however, the effect is not so remarkable as that of Pt, Pd, Rh, and Ru. Modification effect with noble metals is also influenced by the bimetallic particles and the surface composition which are dependent on preparation method, the type of noble metal, and its combination with support material. The modification of Ni catalysts with a small amount of noble metals is demonstrated to be a promising approach to design catalysts with excellent performances for the methane reforming. References [1] M.A. Pena J.P. Gómez J.L.G. Fierro Appl. Catal. A: Gen. 144 1996 7 57 [2] K. Aasberg-Petersen J.H. Bak Hansen T.S. Christensen I. Dybkjaer P.S. Christensen C. Stub Nielsen S.E.L. Winter Madsen J.R. Rostrup-Nielsen Appl. Catal. A: Gen. 221 2001 379 387 [3] J.R. Rostrup-Nielsen Catal. Today 18 1993 305 324 [4] J.H. Lunsford Catal. Today 63 2000 165 174 [5] J.N. Armor Appl. Catal. A: Gen. 176 1999 159 176 [6] J.R. Rostrup-Nielsen T. Rostrup-Nielsen CATTECH 6 2002 150 159 [7] A.L. Dicks J. Power Sources 61 1996 113 124 [8] S. Ahmed M. Krumpelt Int. J. Hydrogen Energy 26 2001 291 301 [9] L.F. Brown Int. J. Hydrogen Energy 26 2001 381 397 [10] H.C. Dibbern P. Olesen J.R. Rostrup-Nielsen P.B. Tottrup N.R. Udengaard Hydrocarbon Process. 65 1986 71 74 [11] D. Qin J. Lapszewicz Catal. Today 21 1994 551 560 [12] I. Dybkjaer Fuel Process. Technol. 42 1995 85 107 [13] J. Rostrup-Nielsen D.L. Trimm J. Catal. 48 1977 155 165 [14] D.L. Trimm Catal. Today 37 1997 233 238 [15] D.L. Trimm Catal. Today 49 1999 3 10 [16] J.R. Rostrup-Nielsen J.R. Anderson M. Baudart Catalytic Steam Reforming, Catalysis, Science and Technology vol. 5 1984 Springer Berlin chap. 1 [17] J.H. Edwards A.M. Maitra Fuel Process. Technol. 42 1995 269 289 [18] S. Wang G.Q. Lu G.J. Millar Energy Fuels 10 1996 896 904 [19] J.R. Rostrup-Nielsen Catal. Today 71 2002 243 247 [20] Y.H. Hu E. Ruckenstein Adv. Catal. 48 2004 297 345 [21] A.P.E. York T. Xiao M.L.H. Green Top. Catal. 22 2003 345 358 [22] A.T. Ashcroft A.K. Cheetham M.L.H. Green P.D.F. Vernon Nature 352 1991 225 226 [23] K. Tomishige J. Jpn. Petrol. Inst. 50 2007 287 298 [24] T.V. Choudhary V.R. Choudhary Angew. Chem. Int. Ed. 47 2008 1828 1847 [25] M.E. Dry Catal. Today 71 2002 227 241 [26] G. Yang J. He Y. Yoneyama Y. Tan Y. Han N. Tsubaki Appl. Catal. A: Gen. 329 2007 99 105 [27] X. Li J. He M. Meng Y. Yoneyama N. Tsubaki J. Catal. 265 2009 26 34 [28] N. Tsubaki M. Ito K. Fujimoto J. Catal. 197 2001 224 227 [29] H.H. Kung Catal. Rev.-Sci. Eng. 22 1980 235 259 [30] J.P. Lange Catal. Today 64 2001 3 8 [31] A. Faur Ghenciu Curr. Opin Solid State Mater. Sci. 6 2002 389 399 [32] T. Ohi T. Miyata D. Li T. Shishido T. Kawabata T. Sano K. Takehira Appl. Catal. A: Gen. 308 2006 194 203 [33] L. Zhou Y. Guo M. Sakurai H. Kameyama Appl. Catal. A: Gen. 364 2009 101 107 [34] T. Sasaki K. Nakao K. Tomishige K. Kunimori Chem. Commun. 382 2006 1 3823 [35] T. Sasaki K. Nakao K. Tomishige K. Kunimori Appl. Catal. A: Gen. 328 2007 140 149 [36] J. Wei E. Iglesia J. Catal. 224 2004 370 383 [37] J.R. Rostrup-Nielsen J.H.B. Hansen J. Catal. 144 1993 38 49 [38] R.M. Navarro M.A. Peña J.L.G. Fierro Chem. Rev. 107 2007 3952 3991 [39] S. Freni G. Calogero S. Cavallaro J. Power Sources 87 2000 28 38 [40] Y.G. Chen O. Yamazaki K. Tomishige K. Fujimoto Catal. Lett. 39 1996 91 95 [41] Y.G. Chen K. Tomishige K. Yokoyama K. Fujimoto Appl. Catal. A: Gen. 165 1997 335 347 [42] A. Becerra M.E. Iriarte M. Dimitrjewits A. Castro-Luna Bol. Soc. Chil. Quim. 47 2002 385 392 [43] C. Crisafulli S. Scirè R. Maggiore S. Minicò S. Galvagno Catal. Lett. 59 1999 21 26 [44] C. Crisafulli S. Scirè S. Minicò L. Solarino Appl. Catal. A: Gen. 225 2002 1 9 [45] B. Pawelec S. Damyanova K. Arishtirova J.L.G. Fierro L. Petrov Appl. Catal. A: Gen. 323 2007 188 201 [46] S. Damyanova B. Pawelec K. Arishtirova J.L.G. Fierro C. Sener T. Dogu Appl. Catal. B: Environ. 92 2009 250 261 [47] M.E. Rivas J.L.G. Fierro M.R. Goldwasser E. Pietri M.J. Pérez-Zurita A. Griboval-Constant G. Leclercq Appl. Catal. A: Gen. 344 2008 10 19 [48] A. Horváth G. Stefler O. Geszti A. Kienneman A. Pietraszek L. Guczi Catal. Today 169 2011 102 111 [49] Z.Y. Hou T. Yashima Catal. Lett. 89 2003 193 197 [50] Z. Hou P. Chen H. Fang X. Zheng T. Yashima Int. J. Hydrogen Energy 31 2006 555 561 [51] S. Özkara-Aydinoğlu A.E. Aksoylu Int. J. Hydrogen Energy 36 2011 2950 2959 [52] M. García-Diéguez I.S. Pieta M.C. Herrera M.A. Larrubia L.J. Alemany J. Catal. 270 2010 136 145 [53] M. García-Diéguez E. Finocchio M.Á. Larrubia L.J. Alemany G. Busca J. Catal. 274 2010 11 20 [54] G.C. Araujo S.M. Lima J.M. Assaf M.A. Peña J.L.G. Fierro M. Carmo Rangel Catal. Today 133–135 2008 129 135 [55] M. García-Diéguez I.S. Pieta M.C. Herrera M.A. Larrubia L.J. Alemany Appl. Catal. A: Gen. 377 2010 191 199 [56] F. Basile G. Fornasari F. Trifiro A. Vaccari Catal. Today 77 2002 215 223 [57] T. Miyata D. Li M. Shiraga T. Shishido Y. Oumi T. Sano K. Takehira Appl. Catal. A: Gen. 310 2006 97 104 [58] T. Miyata M. Shiraga D. Li I. Atake T. Shishido Y. Oumi T. Sano K. Takehira Catal. Commun. 8 2007 447 451 [59] D. Li I. Atake T. Shishido Y. Oumi T. Sano K. Takehira J. Catal. 250 2007 299 312 [60] D. Li T. Shishido Y. Oumi T. Sano K. Takehira Appl. Catal. A: Gen. 332 2007 98 109 [61] D. Li K. Nishida Y. Zhan T. Shishido Y. Oumi T. Sano K. Takehira Appl. Catal. A: Gen. 350 2008 225 236 [62] D. Li Y. Zhan K. Nishida Y. Oumi T. Sano T. Shishido K. Takehira Appl. Catal. A: Gen. 363 2009 169 179 [63] Y. Zhan D. Li K. Nishida T. Shishido Y. Oumi T. Sano K. Takehira Appl. Clay Sci. 45 2009 147 154 [64] J.H. Jeong J.W. Lee D.J. Seo Y. Seo W.L. Yoon D.K. Lee D.H. Kim Appl. Catal. A: Gen. 302 2006 151 156 [65] E.L. Foletto R.W. Alves S.L. Jahn J. Power Sources 161 2006 531 534 [66] E.C. Luna A.M. Becerra M.I. Dimitrijewits React. Kinet. Catal. Lett. 67 1999 247 252 [67] N.V. Parizotto D. Zanchet K.O. Rocha C.M.P. Marques J.M.C. Bueno Appl. Catal. A: Gen. 366 2009 122 129 [68] B.C. Enger R. Lodeng A. Holmen Catal. Lett. 134 2010 13 23 [69] Y. Ji W. Li H. Xu Y. Chen Catal. Lett. 71 2001 45 48 [70] F. Basile G. Fornasari F. Trifiro A. Vaccari Catal. Today 64 2001 21 30 [71] V.R. Choudhary B. Prabhakar A.M. Rajput J. Catal. 157 1995 752 754 [72] M. Nurunnabi S. Kado K. Suzuki K. Fujimoto K. Kunimori K. Tomishige Catal. Commun. 7 2006 488 493 [73] M. Nurunnabi Y. Mukainakano S. Kado T. Miyazawa K. Okumura T. Miyao S. Naito K. Suzuki K. Fujimoto K. Kunimori K. Tomishige Appl. Catal. A: Gen. 308 2006 1 12 [74] M. Nurunnabi K. Fujimoto K. Suzuki B. Li S. Kado K. Kunimori K. Tomishige Catal. Commun. 7 2006 73 78 [75] M. Nurunnabi Y. Mukainakano S. Kado B. Li K. Kunimori K. Suzuki K. Fujimoto K. Tomishige Appl. Catal. A: Gen. 299 2006 145 156 [76] S. Kado M. Nurunnabi Y. Mukainakano T. Miyazawa K. Nakao K. Okumura T. Miyao S. Naito K. Suzuki K. Fujimoto K. Kunimori K. Tomishige ACS Symp. Ser. 959 2007 59 72 [77] M. Nurunnabi B. Li K. Kunimori K. Suzuki K. Fujimoto K. Tomishige Catal. Lett. 103 2005 277 281 [78] M. Nurunnabi B. Li K. Kunimori K. Suzuki K. Fujimoto K. Tomishige Appl. Catal. A: Gen. 292 2005 272 280 [79] B. Li S. Kado Y. Mukainakano M. Nurunnabi T. Miyao S. Naito K. Kunimori K. Tomishige Appl. Catal. A: Gen. 304 2006 62 71 [80] Y. Mukainakano B. Li S. Kado T. Miyazawa K. Okumura T. Miyao S. Naito K. Kunimori K. Tomishige Appl. Catal. A: Gen. 318 2007 252 264 [81] M. Nurunnabi Y. Mukainakano S. Kado T. Miyao S. Naito K. Okumura K. Kunimori K. Tomishige Appl. Catal. A: Gen. 325 2007 154 162 [82] M. Nurunnabi Y. Mukainakano S. Kado K. Kunimori K. Tomishige Chem. Lett. 35 2006 1072 1073 [83] K. Yoshida N. Begum S. Ito K. Tomishige Appl. Catal. A: Gen. 358 2009 186 192 [84] K. Yoshida K. Okumura T. Miyao S. Naito S. Ito K. Kunimori K. Tomishige Appl. Catal. A: Gen. 351 2008 217 225 [85] Y. Mukainakano K. Yoshida K. Okumura K. Kunimori K. Tomishige Catal. Today 132 2008 101 108 [86] Y. Mukainakano K. Yoshida S. Kado K. Okumura K. Kunimori K. Tomishige Chem. Eng. Sci. 63 2008 4891 4901 [87] B. Li S. Kado Y. Mukainakano T. Miyazawa T. Miyao S. Naito K. Okumura K. Kunimori K. Tomishige J. Catal. 245 2007 144 155 [88] K. Nagaoka A. Jentys J.A. Lercher J. Catal. 229 2005 185 196 [89] J.A.C. Dias J.M. Assaf J. Power Sources 130 2004 106 110 [90] J.A.C. Dias J.M. Assaf J. Power Sources 139 2005 176 181 [91] J.A.C. Dias J.M. Assaf Appl. Catal. A: Gen. 334 2008 243 250 [92] K. Opoku-Gyamfi A.A. Adesina Appl. Catal. A: Gen. 180 1999 113 122 [93] K. Tomishige S. Kanazawa M. Sato K. Ikushima K. Kunimori Catal. Lett. 84 2002 69 74 [94] K. Tomishige S. Kanazawa S. Ito K. Kunimori Appl. Catal. A: Gen. 244 2003 71 82 [95] T.B. Reed Free Energy Formation of Binary Compounds 1971 MIT Press Cambridge, MA p. 67 [96] W.C. Conner J.L. Falconer Chem. Rev. 95 1995 759 788 [97] K. Tomishige A. Okabe K. Fujimoto Appl. Catal. A: Gen. 194–195 2000 383 393 [98] R. Ueda T. Kusakari K. Tomishige K. Fujimoto J. Catal. 194 2000 14 22 [99] C. Hu Y. Chen P. Li H. Min Y. Chen A. Tian J. Mol. Catal. A. Chem. 110 1996 163 169 [100] G. Poncelet M.A. Centeno R. Molina Appl. Catal. A: Gen. 288 2005 232 242 [101] T. Ueckert R. Lamber N.I. Jaeger U. Schubert Appl. Catal. A: Gen. 155 1997 75 85 [102] E.L. Jablonski A.A. Castro O.A. Scelza S.R. de Miguel Appl. Catal. A: Gen. 183 1999 189 198 [103] D. Liu G. Que Z. Wang Z. Yan Catal. Today 68 2001 155 160 [104] X. Li X. You P. Ying J. Xiao C. Li Top. Catal. 25 2003 63 70 [105] O. Yamazaki K. Tomishige K. Fujimoto Appl. Catal. A: Gen. 136 1996 49 56 [106] Y. Chen K. Tomishige K. Yokoyama K. Fujimoto J. Catal. 184 1999 479 490 [107] L.L. Sheu Z. Karpinski W.M.H. Sachtler J. Phys. Chem. 93 1989 4890 4894 [108] L.F. Liotta G.A. Martin G. Deganello J. Catal. 164 1996 322 333 [109] S. Bertarione D. Scarano A. Zecchina V. Johánek J. Hoffmann S. Schauermann M.M. Frank J. Libuda G. Rupprechter H. Freund J. Phys. Chem. B 108 2004 3603 3613 [110] K. Tomishige K. Fujimoto Catal. Surv. Jpn. 2 1998 3 15 [111] B. Li R. Watanabe K. Maruyama M. Nurunnabi K. Kunimori K. Tomishige Appl. Catal. A: Gen. 290 2005 36 45 [112] B. Li K. Maruyama M. Nurunnabi K. Kunimori K. Tomishige Appl. Catal. A: Gen. 275 2004 157 172 [113] K. Tomishige S. Kanazawa K. Suzuki M. Asadullah M. Sato K. Ikushima K. Kunimori Appl. Catal. A: Gen. 233 2002 35 44 [114] S. Naito H. Tanaka S. Kado T. Miyao S. Naito K. Okumura K. Kunimori K. Tomishige J. Catal. 259 2008 138 146 [115] H. Tanaka R. Kaino K. Okumura T. Kizuka K. Tomishige J. Catal. 268 2009 1 8 [116] H. Tanaka R. Kaino K. Okumura T. Kizuka Y. Nakagawa K. Tomishige Appl. Catal. A: Gen. 378 2010 175 186 [117] H. Tanaka R. Kaino Y. Nakagawa K. Tomishige Appl. Catal. A: Gen. 378 2010 187 194 [118] S. Wang G.Q. Lu Appl. Catal. A: Gen. 169 1998 271 280 [119] Z.X. Cheng X.G. Zhao J.L. Li Q.M. Zhu Appl. Catal. A: Gen. 205 2001 31 36 [120] G. Li L. Hu J.M. Hill Appl. Catal. A: Gen. 301 2006 16 24 [121] B. Li R. Watanabe K. Maruyama K. Kunimori K. Tomishige Catal. Today 104 2005 7 17 [122] K. Tomishige Y. Himeno Y. Matsuo Y. Yoshinaga K. Fujimoto Ind. Eng. Chem. Res. 39 2000 1891 1897 [123] K. Nagaoka K. Takanabe K. Aika Appl. Catal. A: Gen. 268 2004 151 158 [124] K. Nagaoka K. Takanabe K. Aika Appl. Catal. A: Gen. 255 2003 13 21 [125] K. Nagaoka K. Takanabe K. Aika Chem. Commun. 100 2002 6 1007 [126] Y. Matsuo Y. Yoshinaga Y. Sekine K. Tomishige K. Fujimoto Catal. Today 63 2000 439 445 [127] K. Tomishige Y. Matsuo Y. Sekine K. Fujimoto Catal. Commun. 2 2001 11 15 [128] K. Tomishige Y. Matsuo Y. Yoshinaga Y. Sekine M. Asadullah K. Fujimoto Appl. Catal. A: Gen. 223 2002 225 238 [129] K. Tomishige Y. Chen K. Fujimoto J. Catal. 181 1999 91 103 [130] F. Besenbacher I. Chorkendorff B. Clausen B. Hammer A.M. Molenbroek J.K. Nrskov I. Stensgaard Science 279 1998 1913 1915 [131] K. Tomishige O. Yamazaki Y. Chen K. Yokoyama X. Li K. Fujimoto Catal. Today 45 1998 35 39 [132] K. Nakamura T. Miyazawa T. Sakurai T. Miyao S. Naito N. Begum K. Kunimori K. Tomishige Appl. Catal. B: Environ. 86 2009 36 44 [133] K. Takehira T. Shishido P. Wang T. Kosaka K. Takaki J. Catal. 221 2004 43 54 [134] K. Takehira T. Shishido P. Wang T. Kosaka K. Takaki Phys. Chem. Chem. Phys. 5 2003 3801 3810 [135] T. Shishido M. Sukenobu H. Morioka M. Kondo Y. Wang K. Takaki K. Takehira Appl. Catal. A: Gen. 223 2002 35 42 [136] T. Shishido P. Wang T. Kosaka K. Takehira Chem. Lett. 31 2002 752 753 [137] J. Sehested J.A.P. Gelten S. Helveg Appl. Catal. A: Gen. 309 2006 237 246 [138] F.B. Rasmussen J. Sehested H.T. Teunissen A.M. Molenbroek B.S. Clausen Appl. Catal. A: Gen. 267 2004 165 173 [139] K.O. Christensen D. Chen R. Lødeng A. Holmen Appl. Catal. A: Gen. 314 2006 9 22 [140] J. Sehested A. Carlsson T.V.W. Janssens P.L. Hansen A.K. Datye J. Catal. 197 2001 200 209 [141] J. Sehested J. Catal. 217 2003 417 426 [142] J. Sehested J.A.P. Gelten I.N. Remediakis H. Bengaard J.K. Nørskov J. Catal. 223 2004 432 443",
      "scopus-id": "80054933565",
      "coredata": {
        "eid": "1-s2.0-S0926860X11005552",
        "dc:description": "Nickel is an effective component for the steam reforming of methane in terms of the catalytic activity and the catalyst cost. When Ni catalysts are applied to dry reforming, oxidative reforming, and catalytic partial oxidation, it is necessary to add the properties of high resistance to oxidation, hot spot formation, and coke deposition, to the Ni catalysts. An efficient method for giving these properties while considering the catalyst cost is the modification of Ni metal particles with small amounts of noble metals. An important point is that preparation methods can affect the structure of noble metal–Ni bimetallic particles, which is connected to the catalytic performances. The additive effects of noble metals on the catalytic performances are summarized in terms of activity, suppression of Ni oxidation, carbon formation, self-activation, and sustainability in the daily startup and shutdown operations.",
        "openArchiveArticle": "false",
        "prism:coverDate": "2011-11-28",
        "openaccessUserLicense": null,
        "prism:aggregationType": "Journal",
        "prism:url": "https://api.elsevier.com/content/article/pii/S0926860X11005552",
        "dc:creator": [
          {
            "@_fa": "true",
            "$": "Li, Dalin"
          },
          {
            "@_fa": "true",
            "$": "Nakagawa, Yoshinao"
          },
          {
            "@_fa": "true",
            "$": "Tomishige, Keiichi"
          }
        ],
        "link": [
          {
            "@_fa": "true",
            "@rel": "self",
            "@href": "https://api.elsevier.com/content/article/pii/S0926860X11005552"
          },
          {
            "@_fa": "true",
            "@rel": "scidir",
            "@href": "https://www.sciencedirect.com/science/article/pii/S0926860X11005552"
          }
        ],
        "dc:format": "application/json",
        "openaccessType": null,
        "pii": "S0926-860X(11)00555-2",
        "prism:volume": "408",
        "prism:publisher": "Elsevier B.V.",
        "dc:title": "Methane reforming to synthesis gas over Ni catalysts modified with noble metals",
        "prism:copyright": "Copyright © 2011 Elsevier B.V. All rights reserved.",
        "openaccess": "0",
        "prism:issn": "0926860X",
        "prism:issueIdentifier": "1-2",
        "dcterms:subject": [
          {
            "@_fa": "true",
            "$": "Methane reforming, Synthesis gas, Ni catalyst, Noble metal, Ni oxidation, Hot spot, Carbon formation, Self-activation, Daily startup and shut down"
          }
        ],
        "openaccessArticle": "false",
        "prism:publicationName": "Applied Catalysis A: General",
        "prism:number": "1-2",
        "openaccessSponsorType": null,
        "prism:pageRange": "1-24",
        "prism:endingPage": "24",
        "pubType": "rev",
        "prism:coverDisplayDate": "28 November 2011",
        "prism:doi": "10.1016/j.apcata.2011.09.018",
        "prism:startingPage": "1",
        "dc:identifier": "doi:10.1016/j.apcata.2011.09.018",
        "openaccessSponsorName": null
      },
      "objects": {
        "object": [
          {
            "@category": "standard",
            "@height": "200",
            "@width": "500",
            "@_fa": "true",
            "$": "https://api.elsevier.com/content/object/eid/1-s2.0-S0926860X11005552-fx1.jpg?httpAccept=%2A%2F%2A",
            "@multimediatype": "JPEG image file",
            "@type": "IMAGE-DOWNSAMPLED",
            "@size": "19874",
            "@ref": "fx1",
            "@mimetype": "image/jpeg"
          },
          {
            "@category": "thumbnail",
            "@height": "88",
            "@width": "219",
            "@_fa": "true",
            "$": "https://api.elsevier.com/content/object/eid/1-s2.0-S0926860X11005552-fx1.sml?httpAccept=%2A%2F%2A",
            "@multimediatype": "GIF image file",
            "@type": "IMAGE-THUMBNAIL",
            "@size": "3479",
            "@ref": "fx1",
            "@mimetype": "image/gif"
          },
          {
            "@category": "high",
            "@height": "886",
            "@width": "2213",
            "@_fa": "true",
            "$": "https://api.elsevier.com/content/object/eid/1-s2.0-S0926860X11005552-fx1_lrg.jpg?httpAccept=%2A%2F%2A",
            "@multimediatype": "JPEG image file",
            "@type": "IMAGE-HIGH-RES",
            "@size": "149500",
            "@ref": "fx1",
            "@mimetype": "image/jpeg"
          },
          {
            "@category": "standard",
            "@height": "841",
            "@width": "321",
            "@_fa": "true",
            "$": "https://api.elsevier.com/content/object/eid/1-s2.0-S0926860X11005552-gr1.jpg?httpAccept=%2A%2F%2A",
            "@multimediatype": "JPEG image file",
            "@type": "IMAGE-DOWNSAMPLED",
            "@size": "63429",
            "@ref": "gr1",
            "@mimetype": "image/jpeg"
          },
          {
            "@category": "thumbnail",
            "@height": "162",
            "@width": "62",
            "@_fa": "true",
            "$": "https://api.elsevier.com/content/object/eid/1-s2.0-S0926860X11005552-gr1.sml?httpAccept=%2A%2F%2A",
            "@multimediatype": "GIF image file",
            "@type": "IMAGE-THUMBNAIL",
            "@size": "2086",
            "@ref": "gr1",
            "@mimetype": "image/gif"
          },
          {
            "@category": "high",
            "@height": "3730",
            "@width": "1424",
            "@_fa": "true",
            "$": "https://api.elsevier.com/content/object/eid/1-s2.0-S0926860X11005552-gr1_lrg.jpg?httpAccept=%2A%2F%2A",
            "@multimediatype": "JPEG image file",
            "@type": "IMAGE-HIGH-RES",
            "@size": "472280",
            "@ref": "gr1",
            "@mimetype": "image/jpeg"
          },
          {
            "@category": "standard",
            "@height": "330",
            "@width": "302",
            "@_fa": "true",
            "$": "https://api.elsevier.com/content/object/eid/1-s2.0-S0926860X11005552-gr10.jpg?httpAccept=%2A%2F%2A",
            "@multimediatype": "JPEG image file",
            "@type": "IMAGE-DOWNSAMPLED",
            "@size": "21615",
            "@ref": "gr10",
            "@mimetype": "image/jpeg"
          },
          {
            "@category": "thumbnail",
            "@height": "164",
            "@width": "150",
            "@_fa": "true",
            "$": "https://api.elsevier.com/content/object/eid/1-s2.0-S0926860X11005552-gr10.sml?httpAccept=%2A%2F%2A",
            "@multimediatype": "GIF image file",
            "@type": "IMAGE-THUMBNAIL",
            "@size": "4344",
            "@ref": "gr10",
            "@mimetype": "image/gif"
          },
          {
            "@category": "high",
            "@height": "1464",
            "@width": "1339",
            "@_fa": "true",
            "$": "https://api.elsevier.com/content/object/eid/1-s2.0-S0926860X11005552-gr10_lrg.jpg?httpAccept=%2A%2F%2A",
            "@multimediatype": "JPEG image file",
            "@type": "IMAGE-HIGH-RES",
            "@size": "191188",
            "@ref": "gr10",
            "@mimetype": "image/jpeg"
          },
          {
            "@category": "standard",
            "@height": "322",
            "@width": "320",
            "@_fa": "true",
            "$": "https://api.elsevier.com/content/object/eid/1-s2.0-S0926860X11005552-gr11.jpg?httpAccept=%2A%2F%2A",
            "@multimediatype": "JPEG image file",
            "@type": "IMAGE-DOWNSAMPLED",
            "@size": "26525",
            "@ref": "gr11",
            "@mimetype": "image/jpeg"
          },
          {
            "@category": "thumbnail",
            "@height": "164",
            "@width": "163",
            "@_fa": "true",
            "$": "https://api.elsevier.com/content/object/eid/1-s2.0-S0926860X11005552-gr11.sml?httpAccept=%2A%2F%2A",
            "@multimediatype": "GIF image file",
            "@type": "IMAGE-THUMBNAIL",
            "@size": "2925",
            "@ref": "gr11",
            "@mimetype": "image/gif"
          },
          {
            "@category": "high",
            "@height": "1424",
            "@width": "1417",
            "@_fa": "true",
            "$": "https://api.elsevier.com/content/object/eid/1-s2.0-S0926860X11005552-gr11_lrg.jpg?httpAccept=%2A%2F%2A",
            "@multimediatype": "JPEG image file",
            "@type": "IMAGE-HIGH-RES",
            "@size": "150510",
            "@ref": "gr11",
            "@mimetype": "image/jpeg"
          },
          {
            "@category": "standard",
            "@height": "340",
            "@width": "556",
            "@_fa": "true",
            "$": "https://api.elsevier.com/content/object/eid/1-s2.0-S0926860X11005552-gr12.jpg?httpAccept=%2A%2F%2A",
            "@multimediatype": "JPEG image file",
            "@type": "IMAGE-DOWNSAMPLED",
            "@size": "53839",
            "@ref": "gr12",
            "@mimetype": "image/jpeg"
          },
          {
            "@category": "thumbnail",
            "@height": "134",
            "@width": "219",
            "@_fa": "true",
            "$": "https://api.elsevier.com/content/object/eid/1-s2.0-S0926860X11005552-gr12.sml?httpAccept=%2A%2F%2A",
            "@multimediatype": "GIF image file",
            "@type": "IMAGE-THUMBNAIL",
            "@size": "10194",
            "@ref": "gr12",
            "@mimetype": "image/gif"
          },
          {
            "@category": "high",
            "@height": "1507",
            "@width": "2463",
            "@_fa": "true",
            "$": "https://api.elsevier.com/content/object/eid/1-s2.0-S0926860X11005552-gr12_lrg.jpg?httpAccept=%2A%2F%2A",
            "@multimediatype": "JPEG image file",
            "@type": "IMAGE-HIGH-RES",
            "@size": "466139",
            "@ref": "gr12",
            "@mimetype": "image/jpeg"
          },
          {
            "@category": "standard",
            "@height": "235",
            "@width": "342",
            "@_fa": "true",
            "$": "https://api.elsevier.com/content/object/eid/1-s2.0-S0926860X11005552-gr13.jpg?httpAccept=%2A%2F%2A",
            "@multimediatype": "JPEG image file",
            "@type": "IMAGE-DOWNSAMPLED",
            "@size": "30323",
            "@ref": "gr13",
            "@mimetype": "image/jpeg"
          },
          {
            "@category": "thumbnail",
            "@height": "150",
            "@width": "219",
            "@_fa": "true",
            "$": "https://api.elsevier.com/content/object/eid/1-s2.0-S0926860X11005552-gr13.sml?httpAccept=%2A%2F%2A",
            "@multimediatype": "GIF image file",
            "@type": "IMAGE-THUMBNAIL",
            "@size": "5087",
            "@ref": "gr13",
            "@mimetype": "image/gif"
          },
          {
            "@category": "high",
            "@height": "1041",
            "@width": "1517",
            "@_fa": "true",
            "$": "https://api.elsevier.com/content/object/eid/1-s2.0-S0926860X11005552-gr13_lrg.jpg?httpAccept=%2A%2F%2A",
            "@multimediatype": "JPEG image file",
            "@type": "IMAGE-HIGH-RES",
            "@size": "199396",
            "@ref": "gr13",
            "@mimetype": "image/jpeg"
          },
          {
            "@category": "standard",
            "@height": "289",
            "@width": "338",
            "@_fa": "true",
            "$": "https://api.elsevier.com/content/object/eid/1-s2.0-S0926860X11005552-gr14.jpg?httpAccept=%2A%2F%2A",
            "@multimediatype": "JPEG image file",
            "@type": "IMAGE-DOWNSAMPLED",
            "@size": "24889",
            "@ref": "gr14",
            "@mimetype": "image/jpeg"
          },
          {
            "@category": "thumbnail",
            "@height": "163",
            "@width": "191",
            "@_fa": "true",
            "$": "https://api.elsevier.com/content/object/eid/1-s2.0-S0926860X11005552-gr14.sml?httpAccept=%2A%2F%2A",
            "@multimediatype": "GIF image file",
            "@type": "IMAGE-THUMBNAIL",
            "@size": "5805",
            "@ref": "gr14",
            "@mimetype": "image/gif"
          },
          {
            "@category": "high",
            "@height": "1280",
            "@width": "1496",
            "@_fa": "true",
            "$": "https://api.elsevier.com/content/object/eid/1-s2.0-S0926860X11005552-gr14_lrg.jpg?httpAccept=%2A%2F%2A",
            "@multimediatype": "JPEG image file",
            "@type": "IMAGE-HIGH-RES",
            "@size": "200404",
            "@ref": "gr14",
            "@mimetype": "image/jpeg"
          },
          {
            "@category": "standard",
            "@height": "243",
            "@width": "384",
            "@_fa": "true",
            "$": "https://api.elsevier.com/content/object/eid/1-s2.0-S0926860X11005552-gr15.jpg?httpAccept=%2A%2F%2A",
            "@multimediatype": "JPEG image file",
            "@type": "IMAGE-DOWNSAMPLED",
            "@size": "31074",
            "@ref": "gr15",
            "@mimetype": "image/jpeg"
          },
          {
            "@category": "thumbnail",
            "@height": "139",
            "@width": "219",
            "@_fa": "true",
            "$": "https://api.elsevier.com/content/object/eid/1-s2.0-S0926860X11005552-gr15.sml?httpAccept=%2A%2F%2A",
            "@multimediatype": "GIF image file",
            "@type": "IMAGE-THUMBNAIL",
            "@size": "5984",
            "@ref": "gr15",
            "@mimetype": "image/gif"
          },
          {
            "@category": "high",
            "@height": "1077",
            "@width": "1702",
            "@_fa": "true",
            "$": "https://api.elsevier.com/content/object/eid/1-s2.0-S0926860X11005552-gr15_lrg.jpg?httpAccept=%2A%2F%2A",
            "@multimediatype": "JPEG image file",
            "@type": "IMAGE-HIGH-RES",
            "@size": "197251",
            "@ref": "gr15",
            "@mimetype": "image/jpeg"
          },
          {
            "@category": "standard",
            "@height": "418",
            "@width": "533",
            "@_fa": "true",
            "$": "https://api.elsevier.com/content/object/eid/1-s2.0-S0926860X11005552-gr16.jpg?httpAccept=%2A%2F%2A",
            "@multimediatype": "JPEG image file",
            "@type": "IMAGE-DOWNSAMPLED",
            "@size": "45093",
            "@ref": "gr16",
            "@mimetype": "image/jpeg"
          },
          {
            "@category": "thumbnail",
            "@height": "164",
            "@width": "209",
            "@_fa": "true",
            "$": "https://api.elsevier.com/content/object/eid/1-s2.0-S0926860X11005552-gr16.sml?httpAccept=%2A%2F%2A",
            "@multimediatype": "GIF image file",
            "@type": "IMAGE-THUMBNAIL",
            "@size": "4357",
            "@ref": "gr16",
            "@mimetype": "image/gif"
          },
          {
            "@category": "high",
            "@height": "1854",
            "@width": "2362",
            "@_fa": "true",
            "$": "https://api.elsevier.com/content/object/eid/1-s2.0-S0926860X11005552-gr16_lrg.jpg?httpAccept=%2A%2F%2A",
            "@multimediatype": "JPEG image file",
            "@type": "IMAGE-HIGH-RES",
            "@size": "305695",
            "@ref": "gr16",
            "@mimetype": "image/jpeg"
          },
          {
            "@category": "standard",
            "@height": "356",
            "@width": "558",
            "@_fa": "true",
            "$": "https://api.elsevier.com/content/object/eid/1-s2.0-S0926860X11005552-gr17.jpg?httpAccept=%2A%2F%2A",
            "@multimediatype": "JPEG image file",
            "@type": "IMAGE-DOWNSAMPLED",
            "@size": "61355",
            "@ref": "gr17",
            "@mimetype": "image/jpeg"
          },
          {
            "@category": "thumbnail",
            "@height": "140",
            "@width": "219",
            "@_fa": "true",
            "$": "https://api.elsevier.com/content/object/eid/1-s2.0-S0926860X11005552-gr17.sml?httpAccept=%2A%2F%2A",
            "@multimediatype": "GIF image file",
            "@type": "IMAGE-THUMBNAIL",
            "@size": "6300",
            "@ref": "gr17",
            "@mimetype": "image/gif"
          },
          {
            "@category": "high",
            "@height": "1577",
            "@width": "2472",
            "@_fa": "true",
            "$": "https://api.elsevier.com/content/object/eid/1-s2.0-S0926860X11005552-gr17_lrg.jpg?httpAccept=%2A%2F%2A",
            "@multimediatype": "JPEG image file",
            "@type": "IMAGE-HIGH-RES",
            "@size": "487385",
            "@ref": "gr17",
            "@mimetype": "image/jpeg"
          },
          {
            "@category": "standard",
            "@height": "360",
            "@width": "378",
            "@_fa": "true",
            "$": "https://api.elsevier.com/content/object/eid/1-s2.0-S0926860X11005552-gr18.jpg?httpAccept=%2A%2F%2A",
            "@multimediatype": "JPEG image file",
            "@type": "IMAGE-DOWNSAMPLED",
            "@size": "29009",
            "@ref": "gr18",
            "@mimetype": "image/jpeg"
          },
          {
            "@category": "thumbnail",
            "@height": "164",
            "@width": "172",
            "@_fa": "true",
            "$": "https://api.elsevier.com/content/object/eid/1-s2.0-S0926860X11005552-gr18.sml?httpAccept=%2A%2F%2A",
            "@multimediatype": "GIF image file",
            "@type": "IMAGE-THUMBNAIL",
            "@size": "4624",
            "@ref": "gr18",
            "@mimetype": "image/gif"
          },
          {
            "@category": "high",
            "@height": "1594",
            "@width": "1675",
            "@_fa": "true",
            "$": "https://api.elsevier.com/content/object/eid/1-s2.0-S0926860X11005552-gr18_lrg.jpg?httpAccept=%2A%2F%2A",
            "@multimediatype": "JPEG image file",
            "@type": "IMAGE-HIGH-RES",
            "@size": "241879",
            "@ref": "gr18",
            "@mimetype": "image/jpeg"
          },
          {
            "@category": "standard",
            "@height": "378",
            "@width": "419",
            "@_fa": "true",
            "$": "https://api.elsevier.com/content/object/eid/1-s2.0-S0926860X11005552-gr19.jpg?httpAccept=%2A%2F%2A",
            "@multimediatype": "JPEG image file",
            "@type": "IMAGE-DOWNSAMPLED",
            "@size": "32223",
            "@ref": "gr19",
            "@mimetype": "image/jpeg"
          },
          {
            "@category": "thumbnail",
            "@height": "163",
            "@width": "181",
            "@_fa": "true",
            "$": "https://api.elsevier.com/content/object/eid/1-s2.0-S0926860X11005552-gr19.sml?httpAccept=%2A%2F%2A",
            "@multimediatype": "GIF image file",
            "@type": "IMAGE-THUMBNAIL",
            "@size": "4729",
            "@ref": "gr19",
            "@mimetype": "image/gif"
          },
          {
            "@category": "high",
            "@height": "1674",
            "@width": "1854",
            "@_fa": "true",
            "$": "https://api.elsevier.com/content/object/eid/1-s2.0-S0926860X11005552-gr19_lrg.jpg?httpAccept=%2A%2F%2A",
            "@multimediatype": "JPEG image file",
            "@type": "IMAGE-HIGH-RES",
            "@size": "277964",
            "@ref": "gr19",
            "@mimetype": "image/jpeg"
          },
          {
            "@category": "standard",
            "@height": "429",
            "@width": "319",
            "@_fa": "true",
            "$": "https://api.elsevier.com/content/object/eid/1-s2.0-S0926860X11005552-gr2.jpg?httpAccept=%2A%2F%2A",
            "@multimediatype": "JPEG image file",
            "@type": "IMAGE-DOWNSAMPLED",
            "@size": "23646",
            "@ref": "gr2",
            "@mimetype": "image/jpeg"
          },
          {
            "@category": "thumbnail",
            "@height": "164",
            "@width": "122",
            "@_fa": "true",
            "$": "https://api.elsevier.com/content/object/eid/1-s2.0-S0926860X11005552-gr2.sml?httpAccept=%2A%2F%2A",
            "@multimediatype": "GIF image file",
            "@type": "IMAGE-THUMBNAIL",
            "@size": "3486",
            "@ref": "gr2",
            "@mimetype": "image/gif"
          },
          {
            "@category": "high",
            "@height": "1900",
            "@width": "1413",
            "@_fa": "true",
            "$": "https://api.elsevier.com/content/object/eid/1-s2.0-S0926860X11005552-gr2_lrg.jpg?httpAccept=%2A%2F%2A",
            "@multimediatype": "JPEG image file",
            "@type": "IMAGE-HIGH-RES",
            "@size": "177501",
            "@ref": "gr2",
            "@mimetype": "image/jpeg"
          },
          {
            "@category": "standard",
            "@height": "324",
            "@width": "346",
            "@_fa": "true",
            "$": "https://api.elsevier.com/content/object/eid/1-s2.0-S0926860X11005552-gr20.jpg?httpAccept=%2A%2F%2A",
            "@multimediatype": "JPEG image file",
            "@type": "IMAGE-DOWNSAMPLED",
            "@size": "21732",
            "@ref": "gr20",
            "@mimetype": "image/jpeg"
          },
          {
            "@category": "thumbnail",
            "@height": "164",
            "@width": "175",
            "@_fa": "true",
            "$": "https://api.elsevier.com/content/object/eid/1-s2.0-S0926860X11005552-gr20.sml?httpAccept=%2A%2F%2A",
            "@multimediatype": "GIF image file",
            "@type": "IMAGE-THUMBNAIL",
            "@size": "4443",
            "@ref": "gr20",
            "@mimetype": "image/gif"
          },
          {
            "@category": "high",
            "@height": "1434",
            "@width": "1531",
            "@_fa": "true",
            "$": "https://api.elsevier.com/content/object/eid/1-s2.0-S0926860X11005552-gr20_lrg.jpg?httpAccept=%2A%2F%2A",
            "@multimediatype": "JPEG image file",
            "@type": "IMAGE-HIGH-RES",
            "@size": "175229",
            "@ref": "gr20",
            "@mimetype": "image/jpeg"
          },
          {
            "@category": "standard",
            "@height": "312",
            "@width": "332",
            "@_fa": "true",
            "$": "https://api.elsevier.com/content/object/eid/1-s2.0-S0926860X11005552-gr21.jpg?httpAccept=%2A%2F%2A",
            "@multimediatype": "JPEG image file",
            "@type": "IMAGE-DOWNSAMPLED",
            "@size": "22904",
            "@ref": "gr21",
            "@mimetype": "image/jpeg"
          },
          {
            "@category": "thumbnail",
            "@height": "164",
            "@width": "174",
            "@_fa": "true",
            "$": "https://api.elsevier.com/content/object/eid/1-s2.0-S0926860X11005552-gr21.sml?httpAccept=%2A%2F%2A",
            "@multimediatype": "GIF image file",
            "@type": "IMAGE-THUMBNAIL",
            "@size": "4787",
            "@ref": "gr21",
            "@mimetype": "image/gif"
          },
          {
            "@category": "high",
            "@height": "1383",
            "@width": "1471",
            "@_fa": "true",
            "$": "https://api.elsevier.com/content/object/eid/1-s2.0-S0926860X11005552-gr21_lrg.jpg?httpAccept=%2A%2F%2A",
            "@multimediatype": "JPEG image file",
            "@type": "IMAGE-HIGH-RES",
            "@size": "185962",
            "@ref": "gr21",
            "@mimetype": "image/jpeg"
          },
          {
            "@category": "standard",
            "@height": "273",
            "@width": "324",
            "@_fa": "true",
            "$": "https://api.elsevier.com/content/object/eid/1-s2.0-S0926860X11005552-gr22.jpg?httpAccept=%2A%2F%2A",
            "@multimediatype": "JPEG image file",
            "@type": "IMAGE-DOWNSAMPLED",
            "@size": "20761",
            "@ref": "gr22",
            "@mimetype": "image/jpeg"
          },
          {
            "@category": "thumbnail",
            "@height": "164",
            "@width": "195",
            "@_fa": "true",
            "$": "https://api.elsevier.com/content/object/eid/1-s2.0-S0926860X11005552-gr22.sml?httpAccept=%2A%2F%2A",
            "@multimediatype": "GIF image file",
            "@type": "IMAGE-THUMBNAIL",
            "@size": "5289",
            "@ref": "gr22",
            "@mimetype": "image/gif"
          },
          {
            "@category": "high",
            "@height": "1209",
            "@width": "1436",
            "@_fa": "true",
            "$": "https://api.elsevier.com/content/object/eid/1-s2.0-S0926860X11005552-gr22_lrg.jpg?httpAccept=%2A%2F%2A",
            "@multimediatype": "JPEG image file",
            "@type": "IMAGE-HIGH-RES",
            "@size": "168430",
            "@ref": "gr22",
            "@mimetype": "image/jpeg"
          },
          {
            "@category": "standard",
            "@height": "286",
            "@width": "357",
            "@_fa": "true",
            "$": "https://api.elsevier.com/content/object/eid/1-s2.0-S0926860X11005552-gr23.jpg?httpAccept=%2A%2F%2A",
            "@multimediatype": "JPEG image file",
            "@type": "IMAGE-DOWNSAMPLED",
            "@size": "41620",
            "@ref": "gr23",
            "@mimetype": "image/jpeg"
          },
          {
            "@category": "thumbnail",
            "@height": "164",
            "@width": "205",
            "@_fa": "true",
            "$": "https://api.elsevier.com/content/object/eid/1-s2.0-S0926860X11005552-gr23.sml?httpAccept=%2A%2F%2A",
            "@multimediatype": "GIF image file",
            "@type": "IMAGE-THUMBNAIL",
            "@size": "5739",
            "@ref": "gr23",
            "@mimetype": "image/gif"
          },
          {
            "@category": "high",
            "@height": "1266",
            "@width": "1583",
            "@_fa": "true",
            "$": "https://api.elsevier.com/content/object/eid/1-s2.0-S0926860X11005552-gr23_lrg.jpg?httpAccept=%2A%2F%2A",
            "@multimediatype": "JPEG image file",
            "@type": "IMAGE-HIGH-RES",
            "@size": "275979",
            "@ref": "gr23",
            "@mimetype": "image/jpeg"
          },
          {
            "@category": "standard",
            "@height": "336",
            "@width": "527",
            "@_fa": "true",
            "$": "https://api.elsevier.com/content/object/eid/1-s2.0-S0926860X11005552-gr24.jpg?httpAccept=%2A%2F%2A",
            "@multimediatype": "JPEG image file",
            "@type": "IMAGE-DOWNSAMPLED",
            "@size": "45270",
            "@ref": "gr24",
            "@mimetype": "image/jpeg"
          },
          {
            "@category": "thumbnail",
            "@height": "140",
            "@width": "219",
            "@_fa": "true",
            "$": "https://api.elsevier.com/content/object/eid/1-s2.0-S0926860X11005552-gr24.sml?httpAccept=%2A%2F%2A",
            "@multimediatype": "GIF image file",
            "@type": "IMAGE-THUMBNAIL",
            "@size": "4574",
            "@ref": "gr24",
            "@mimetype": "image/gif"
          },
          {
            "@category": "high",
            "@height": "1487",
            "@width": "2333",
            "@_fa": "true",
            "$": "https://api.elsevier.com/content/object/eid/1-s2.0-S0926860X11005552-gr24_lrg.jpg?httpAccept=%2A%2F%2A",
            "@multimediatype": "JPEG image file",
            "@type": "IMAGE-HIGH-RES",
            "@size": "328890",
            "@ref": "gr24",
            "@mimetype": "image/jpeg"
          },
          {
            "@category": "standard",
            "@height": "309",
            "@width": "376",
            "@_fa": "true",
            "$": "https://api.elsevier.com/content/object/eid/1-s2.0-S0926860X11005552-gr25.jpg?httpAccept=%2A%2F%2A",
            "@multimediatype": "JPEG image file",
            "@type": "IMAGE-DOWNSAMPLED",
            "@size": "27103",
            "@ref": "gr25",
            "@mimetype": "image/jpeg"
          },
          {
            "@category": "thumbnail",
            "@height": "164",
            "@width": "199",
            "@_fa": "true",
            "$": "https://api.elsevier.com/content/object/eid/1-s2.0-S0926860X11005552-gr25.sml?httpAccept=%2A%2F%2A",
            "@multimediatype": "GIF image file",
            "@type": "IMAGE-THUMBNAIL",
            "@size": "3611",
            "@ref": "gr25",
            "@mimetype": "image/gif"
          },
          {
            "@category": "high",
            "@height": "1370",
            "@width": "1667",
            "@_fa": "true",
            "$": "https://api.elsevier.com/content/object/eid/1-s2.0-S0926860X11005552-gr25_lrg.jpg?httpAccept=%2A%2F%2A",
            "@multimediatype": "JPEG image file",
            "@type": "IMAGE-HIGH-RES",
            "@size": "189720",
            "@ref": "gr25",
            "@mimetype": "image/jpeg"
          },
          {
            "@category": "standard",
            "@height": "316",
            "@width": "335",
            "@_fa": "true",
            "$": "https://api.elsevier.com/content/object/eid/1-s2.0-S0926860X11005552-gr26.jpg?httpAccept=%2A%2F%2A",
            "@multimediatype": "JPEG image file",
            "@type": "IMAGE-DOWNSAMPLED",
            "@size": "28906",
            "@ref": "gr26",
            "@mimetype": "image/jpeg"
          },
          {
            "@category": "thumbnail",
            "@height": "164",
            "@width": "174",
            "@_fa": "true",
            "$": "https://api.elsevier.com/content/object/eid/1-s2.0-S0926860X11005552-gr26.sml?httpAccept=%2A%2F%2A",
            "@multimediatype": "GIF image file",
            "@type": "IMAGE-THUMBNAIL",
            "@size": "3273",
            "@ref": "gr26",
            "@mimetype": "image/gif"
          },
          {
            "@category": "high",
            "@height": "1400",
            "@width": "1485",
            "@_fa": "true",
            "$": "https://api.elsevier.com/content/object/eid/1-s2.0-S0926860X11005552-gr26_lrg.jpg?httpAccept=%2A%2F%2A",
            "@multimediatype": "JPEG image file",
            "@type": "IMAGE-HIGH-RES",
            "@size": "173297",
            "@ref": "gr26",
            "@mimetype": "image/jpeg"
          },
          {
            "@category": "standard",
            "@height": "230",
            "@width": "210",
            "@_fa": "true",
            "$": "https://api.elsevier.com/content/object/eid/1-s2.0-S0926860X11005552-gr27.jpg?httpAccept=%2A%2F%2A",
            "@multimediatype": "JPEG image file",
            "@type": "IMAGE-DOWNSAMPLED",
            "@size": "10331",
            "@ref": "gr27",
            "@mimetype": "image/jpeg"
          },
          {
            "@category": "thumbnail",
            "@height": "164",
            "@width": "150",
            "@_fa": "true",
            "$": "https://api.elsevier.com/content/object/eid/1-s2.0-S0926860X11005552-gr27.sml?httpAccept=%2A%2F%2A",
            "@multimediatype": "GIF image file",
            "@type": "IMAGE-THUMBNAIL",
            "@size": "4479",
            "@ref": "gr27",
            "@mimetype": "image/gif"
          },
          {
            "@category": "high",
            "@height": "1020",
            "@width": "933",
            "@_fa": "true",
            "$": "https://api.elsevier.com/content/object/eid/1-s2.0-S0926860X11005552-gr27_lrg.jpg?httpAccept=%2A%2F%2A",
            "@multimediatype": "JPEG image file",
            "@type": "IMAGE-HIGH-RES",
            "@size": "78293",
            "@ref": "gr27",
            "@mimetype": "image/jpeg"
          },
          {
            "@category": "standard",
            "@height": "642",
            "@width": "329",
            "@_fa": "true",
            "$": "https://api.elsevier.com/content/object/eid/1-s2.0-S0926860X11005552-gr28.jpg?httpAccept=%2A%2F%2A",
            "@multimediatype": "JPEG image file",
            "@type": "IMAGE-DOWNSAMPLED",
            "@size": "51457",
            "@ref": "gr28",
            "@mimetype": "image/jpeg"
          },
          {
            "@category": "thumbnail",
            "@height": "164",
            "@width": "84",
            "@_fa": "true",
            "$": "https://api.elsevier.com/content/object/eid/1-s2.0-S0926860X11005552-gr28.sml?httpAccept=%2A%2F%2A",
            "@multimediatype": "GIF image file",
            "@type": "IMAGE-THUMBNAIL",
            "@size": "2498",
            "@ref": "gr28",
            "@mimetype": "image/gif"
          },
          {
            "@category": "high",
            "@height": "2847",
            "@width": "1458",
            "@_fa": "true",
            "$": "https://api.elsevier.com/content/object/eid/1-s2.0-S0926860X11005552-gr28_lrg.jpg?httpAccept=%2A%2F%2A",
            "@multimediatype": "JPEG image file",
            "@type": "IMAGE-HIGH-RES",
            "@size": "394288",
            "@ref": "gr28",
            "@mimetype": "image/jpeg"
          },
          {
            "@category": "standard",
            "@height": "314",
            "@width": "329",
            "@_fa": "true",
            "$": "https://api.elsevier.com/content/object/eid/1-s2.0-S0926860X11005552-gr29.jpg?httpAccept=%2A%2F%2A",
            "@multimediatype": "JPEG image file",
            "@type": "IMAGE-DOWNSAMPLED",
            "@size": "31968",
            "@ref": "gr29",
            "@mimetype": "image/jpeg"
          },
          {
            "@category": "thumbnail",
            "@height": "164",
            "@width": "172",
            "@_fa": "true",
            "$": "https://api.elsevier.com/content/object/eid/1-s2.0-S0926860X11005552-gr29.sml?httpAccept=%2A%2F%2A",
            "@multimediatype": "GIF image file",
            "@type": "IMAGE-THUMBNAIL",
            "@size": "3830",
            "@ref": "gr29",
            "@mimetype": "image/gif"
          },
          {
            "@category": "high",
            "@height": "1391",
            "@width": "1458",
            "@_fa": "true",
            "$": "https://api.elsevier.com/content/object/eid/1-s2.0-S0926860X11005552-gr29_lrg.jpg?httpAccept=%2A%2F%2A",
            "@multimediatype": "JPEG image file",
            "@type": "IMAGE-HIGH-RES",
            "@size": "202632",
            "@ref": "gr29",
            "@mimetype": "image/jpeg"
          },
          {
            "@category": "standard",
            "@height": "253",
            "@width": "376",
            "@_fa": "true",
            "$": "https://api.elsevier.com/content/object/eid/1-s2.0-S0926860X11005552-gr3.jpg?httpAccept=%2A%2F%2A",
            "@multimediatype": "JPEG image file",
            "@type": "IMAGE-DOWNSAMPLED",
            "@size": "32803",
            "@ref": "gr3",
            "@mimetype": "image/jpeg"
          },
          {
            "@category": "thumbnail",
            "@height": "148",
            "@width": "219",
            "@_fa": "true",
            "$": "https://api.elsevier.com/content/object/eid/1-s2.0-S0926860X11005552-gr3.sml?httpAccept=%2A%2F%2A",
            "@multimediatype": "GIF image file",
            "@type": "IMAGE-THUMBNAIL",
            "@size": "5955",
            "@ref": "gr3",
            "@mimetype": "image/gif"
          },
          {
            "@category": "high",
            "@height": "1123",
            "@width": "1667",
            "@_fa": "true",
            "$": "https://api.elsevier.com/content/object/eid/1-s2.0-S0926860X11005552-gr3_lrg.jpg?httpAccept=%2A%2F%2A",
            "@multimediatype": "JPEG image file",
            "@type": "IMAGE-HIGH-RES",
            "@size": "230892",
            "@ref": "gr3",
            "@mimetype": "image/jpeg"
          },
          {
            "@category": "standard",
            "@height": "502",
            "@width": "561",
            "@_fa": "true",
            "$": "https://api.elsevier.com/content/object/eid/1-s2.0-S0926860X11005552-gr4.jpg?httpAccept=%2A%2F%2A",
            "@multimediatype": "JPEG image file",
            "@type": "IMAGE-DOWNSAMPLED",
            "@size": "50720",
            "@ref": "gr4",
            "@mimetype": "image/jpeg"
          },
          {
            "@category": "thumbnail",
            "@height": "164",
            "@width": "183",
            "@_fa": "true",
            "$": "https://api.elsevier.com/content/object/eid/1-s2.0-S0926860X11005552-gr4.sml?httpAccept=%2A%2F%2A",
            "@multimediatype": "GIF image file",
            "@type": "IMAGE-THUMBNAIL",
            "@size": "3557",
            "@ref": "gr4",
            "@mimetype": "image/gif"
          },
          {
            "@category": "high",
            "@height": "2224",
            "@width": "2483",
            "@_fa": "true",
            "$": "https://api.elsevier.com/content/object/eid/1-s2.0-S0926860X11005552-gr4_lrg.jpg?httpAccept=%2A%2F%2A",
            "@multimediatype": "JPEG image file",
            "@type": "IMAGE-HIGH-RES",
            "@size": "378969",
            "@ref": "gr4",
            "@mimetype": "image/jpeg"
          },
          {
            "@category": "standard",
            "@height": "312",
            "@width": "304",
            "@_fa": "true",
            "$": "https://api.elsevier.com/content/object/eid/1-s2.0-S0926860X11005552-gr5.jpg?httpAccept=%2A%2F%2A",
            "@multimediatype": "JPEG image file",
            "@type": "IMAGE-DOWNSAMPLED",
            "@size": "26682",
            "@ref": "gr5",
            "@mimetype": "image/jpeg"
          },
          {
            "@category": "thumbnail",
            "@height": "163",
            "@width": "159",
            "@_fa": "true",
            "$": "https://api.elsevier.com/content/object/eid/1-s2.0-S0926860X11005552-gr5.sml?httpAccept=%2A%2F%2A",
            "@multimediatype": "GIF image file",
            "@type": "IMAGE-THUMBNAIL",
            "@size": "4970",
            "@ref": "gr5",
            "@mimetype": "image/gif"
          },
          {
            "@category": "high",
            "@height": "1385",
            "@width": "1349",
            "@_fa": "true",
            "$": "https://api.elsevier.com/content/object/eid/1-s2.0-S0926860X11005552-gr5_lrg.jpg?httpAccept=%2A%2F%2A",
            "@multimediatype": "JPEG image file",
            "@type": "IMAGE-HIGH-RES",
            "@size": "215324",
            "@ref": "gr5",
            "@mimetype": "image/jpeg"
          },
          {
            "@category": "standard",
            "@height": "561",
            "@width": "522",
            "@_fa": "true",
            "$": "https://api.elsevier.com/content/object/eid/1-s2.0-S0926860X11005552-gr6.jpg?httpAccept=%2A%2F%2A",
            "@multimediatype": "JPEG image file",
            "@type": "IMAGE-DOWNSAMPLED",
            "@size": "59160",
            "@ref": "gr6",
            "@mimetype": "image/jpeg"
          },
          {
            "@category": "thumbnail",
            "@height": "163",
            "@width": "152",
            "@_fa": "true",
            "$": "https://api.elsevier.com/content/object/eid/1-s2.0-S0926860X11005552-gr6.sml?httpAccept=%2A%2F%2A",
            "@multimediatype": "GIF image file",
            "@type": "IMAGE-THUMBNAIL",
            "@size": "3433",
            "@ref": "gr6",
            "@mimetype": "image/gif"
          },
          {
            "@category": "high",
            "@height": "2483",
            "@width": "2312",
            "@_fa": "true",
            "$": "https://api.elsevier.com/content/object/eid/1-s2.0-S0926860X11005552-gr6_lrg.jpg?httpAccept=%2A%2F%2A",
            "@multimediatype": "JPEG image file",
            "@type": "IMAGE-HIGH-RES",
            "@size": "468787",
            "@ref": "gr6",
            "@mimetype": "image/jpeg"
          },
          {
            "@category": "standard",
            "@height": "413",
            "@width": "320",
            "@_fa": "true",
            "$": "https://api.elsevier.com/content/object/eid/1-s2.0-S0926860X11005552-gr7.jpg?httpAccept=%2A%2F%2A",
            "@multimediatype": "JPEG image file",
            "@type": "IMAGE-DOWNSAMPLED",
            "@size": "26194",
            "@ref": "gr7",
            "@mimetype": "image/jpeg"
          },
          {
            "@category": "thumbnail",
            "@height": "164",
            "@width": "127",
            "@_fa": "true",
            "$": "https://api.elsevier.com/content/object/eid/1-s2.0-S0926860X11005552-gr7.sml?httpAccept=%2A%2F%2A",
            "@multimediatype": "GIF image file",
            "@type": "IMAGE-THUMBNAIL",
            "@size": "3831",
            "@ref": "gr7",
            "@mimetype": "image/gif"
          },
          {
            "@category": "high",
            "@height": "1831",
            "@width": "1419",
            "@_fa": "true",
            "$": "https://api.elsevier.com/content/object/eid/1-s2.0-S0926860X11005552-gr7_lrg.jpg?httpAccept=%2A%2F%2A",
            "@multimediatype": "JPEG image file",
            "@type": "IMAGE-HIGH-RES",
            "@size": "209010",
            "@ref": "gr7",
            "@mimetype": "image/jpeg"
          },
          {
            "@category": "standard",
            "@height": "334",
            "@width": "371",
            "@_fa": "true",
            "$": "https://api.elsevier.com/content/object/eid/1-s2.0-S0926860X11005552-gr8.jpg?httpAccept=%2A%2F%2A",
            "@multimediatype": "JPEG image file",
            "@type": "IMAGE-DOWNSAMPLED",
            "@size": "29680",
            "@ref": "gr8",
            "@mimetype": "image/jpeg"
          },
          {
            "@category": "thumbnail",
            "@height": "164",
            "@width": "182",
            "@_fa": "true",
            "$": "https://api.elsevier.com/content/object/eid/1-s2.0-S0926860X11005552-gr8.sml?httpAccept=%2A%2F%2A",
            "@multimediatype": "GIF image file",
            "@type": "IMAGE-THUMBNAIL",
            "@size": "5399",
            "@ref": "gr8",
            "@mimetype": "image/gif"
          },
          {
            "@category": "high",
            "@height": "1481",
            "@width": "1644",
            "@_fa": "true",
            "$": "https://api.elsevier.com/content/object/eid/1-s2.0-S0926860X11005552-gr8_lrg.jpg?httpAccept=%2A%2F%2A",
            "@multimediatype": "JPEG image file",
            "@type": "IMAGE-HIGH-RES",
            "@size": "234363",
            "@ref": "gr8",
            "@mimetype": "image/jpeg"
          },
          {
            "@category": "standard",
            "@height": "282",
            "@width": "298",
            "@_fa": "true",
            "$": "https://api.elsevier.com/content/object/eid/1-s2.0-S0926860X11005552-gr9.jpg?httpAccept=%2A%2F%2A",
            "@multimediatype": "JPEG image file",
            "@type": "IMAGE-DOWNSAMPLED",
            "@size": "21377",
            "@ref": "gr9",
            "@mimetype": "image/jpeg"
          },
          {
            "@category": "thumbnail",
            "@height": "163",
            "@width": "173",
            "@_fa": "true",
            "$": "https://api.elsevier.com/content/object/eid/1-s2.0-S0926860X11005552-gr9.sml?httpAccept=%2A%2F%2A",
            "@multimediatype": "GIF image file",
            "@type": "IMAGE-THUMBNAIL",
            "@size": "4820",
            "@ref": "gr9",
            "@mimetype": "image/gif"
          },
          {
            "@category": "high",
            "@height": "1247",
            "@width": "1320",
            "@_fa": "true",
            "$": "https://api.elsevier.com/content/object/eid/1-s2.0-S0926860X11005552-gr9_lrg.jpg?httpAccept=%2A%2F%2A",
            "@multimediatype": "JPEG image file",
            "@type": "IMAGE-HIGH-RES",
            "@size": "171045",
            "@ref": "gr9",
            "@mimetype": "image/jpeg"
          }
        ]
      },
      "link": {
        "@rel": "abstract",
        "@href": "https://api.elsevier.com/content/abstract/scopus_id/80054933565"
      }
    }
  }
}