{
  "metadata": {
    "title": "Tailoring manganese oxide catalysts for the total oxidation of pollutants in gas and liquid phase",
    "authors": "; ; ",
    "journal": "Applied Catalysis A: General",
    "date": "2021-01-25",
    "doi": "10.1016/j.apcata.2020.117917",
    "abstract": "",
    "uri": "https://api.elsevier.com/content/article/pii/S0926860X2030510X",
    "pii": "S0926860X2030510X"
  },
  "fulltext": {
    "full-text-retrieval-response": {
      "scopus-eid": "2-s2.0-85096966258",
      "originalText": "serial JL 271346 291210 291744 291809 31 Applied Catalysis A: General APPLIEDCATALYSISAGENERAL 2020-11-11 2020-11-11 2020-12-02 2020-12-02 2021-01-18T12:52:28 1-s2.0-S0926860X2030510X S0926-860X(20)30510-X S0926860X2030510X 10.1016/j.apcata.2020.117917 S300 S300.1 FULL-TEXT 1-s2.0-S0926860X20X00202 2024-01-01T12:34:28.416125Z 0 0 20210125 2021 2020-11-11T16:35:57.26156Z absattachment articleinfo articlenumber articletitlenorm authfirstinitialnorm authfirstsurnamenorm cid cids contenttype copyright crossmark dateloaded dateloadedtxt datesearch datesort dateupdated dco docsubtype doctype doi eid ewtransactionid hubeid indexeddate issn issnnorm itemstage itemtransactionid itemweight openaccess openarchive pg pgfirst pii piinorm pubdatestart pubdatetxt pubyr sortorder srctitle srctitlenorm srctype ssids alllist content subj subheadings suppl tomb volfirst volissue volumelist webpdf webpdfpagecount yearnav figure table e-component body mmlmath acknowledge affil appendices articletitle auth authfirstini authfull authkeywords authlast highlightsabst orcid primabst ref specialabst 0926-860X 0926860X true 610 610 C Volume 610 4 117917 117917 117917 20210125 25 January 2021 2021-01-25 2021 article fla © 2020 Elsevier B.V. All rights reserved. TAILORINGMANGANESEOXIDECATALYSTSFORTOTALOXIDATIONPOLLUTANTSINGASLIQUIDPHASE ARENA F 1 Introduction 2 Materials and methods 2.1 Catalyst preparation 2.2 Catalyst characterization 2.3 Catalyst testing 3 RESULTS and DISCUSSION 3.1 Effect of composition on the activity pattern 3.2 Effect of composition and preparation method on catalyst structure 3.3 Speciation and reduction pattern of the active phase 3.4 Active sites 3.5 Structure-activity relationships 4 Conclusions CRediT authorship contribution statement Acknowledgement Appendix A Supplementary data References FEKETE 2013 2222 2232 M POKHREL 2015 8384 8387 R HUYNH 2015 14887 14904 M PICKRAHN 2012 1269 1277 K SELVAKUMAR 2015 6604 6618 K EON 2018 4034 4040 C LIMA 2006 152 160 F XU 2017 8879 8892 H LIANG 2008 5307 5315 S LI 2017 20911 20921 K GAO 2016 82 90 J FREY 2012 30 36 K PARK 2015 250 257 J ARENA 2017 14 22 F XU 2013 225 234 J RONG 2018 3435 3446 S LI 2014 26796 26803 D YANG 2017 2350 2357 Y ZHU 2017 212 221 L LIU 2016 54 69 C MING 2019 122287 S ATRIBAK 2010 267 273 I ARENA 2015 260 267 F BISWAS 2015 731 741 S HAYASHI 2019 890 900 E ARENA 2014 1890 1898 F ARENA 2009 2822 28299 F VENKATASWAMY 2015 122 132 P ARENA 2019 259 265 F ZOU 2010 468 477 Z ZHANG 2016 179 191 X DINH 2015 65 72 M ZHANG 2015 1 10 P WU 2010 170 175 Y HE 2018 134 142 H HONG 2011 208 216 W GENG 2020 117774 L ARENA 2007 6724 6731 F ARENA 2008 40 47 F LARACHI 2005 109 134 F ELMACI 2017 56 59 G ELMACI 2020 3157 3166 G BOYOMTATCHEMO 2020 118159 F LI 2015 8987 W HSU 2013 433 441 L CEN 2012 5769 5777 W ZHANG 2013 4443 4449 X GARCIAPINTOS 2013 18063 18073 D YANG 2018 184 193 W ARENA 2014 292 299 F GAO 2008 13134 13140 T LI 2016 5371 5379 Y JULIEN 2003 345 356 C WANG 2003 300 306 X FAZIO 2011 1583 1588 B ARENA 2007 2269 2276 F LAVALLEY 1996 377 401 J LABERTY 2001 266 276 C LI 1989 929 943 C BUSCA 1982 89 126 G ARENA 2017 803 809 F ARENA 2018 293 300 F GUECI 2020 119812 L ARENAX2021X117917 ARENAX2021X117917XF 2022-12-02T00:00:00.000Z 2022-12-02T00:00:00.000Z http://creativecommons.org/licenses/by-nc-nd/4.0/ © 2020 Elsevier B.V. All rights reserved. 2020-12-05T00:09:07.024Z http://vtw.elsevier.com/data/voc/AddOnTypes/50.7/nlp-car This work is dedicated to our dear friend and colleague Prof. Gianmario Martra who has passed away on Sept. 29th 2020, leaving a great human and professional void in all of us. item S0926-860X(20)30510-X S0926860X2030510X 1-s2.0-S0926860X2030510X 10.1016/j.apcata.2020.117917 271346 2024-01-01T12:34:28.416125Z 2021-01-25 1-s2.0-S0926860X2030510X-main.pdf https://s3-eu-west-1.amazonaws.com/prod-ucs-content-store-eu-west/content/pii:S0926860X2030510X/MAIN/application/pdf/8bddcf073db9b4d62e020deed91d6504/main.pdf main.pdf pdf true 6549786 MAIN 10 1-s2.0-S0926860X2030510X-main_1.png https://s3-eu-west-1.amazonaws.com/prod-ucs-content-store-eu-west/content/pii:S0926860X2030510X/PREVIEW/image/png/a071adff541cfb1519d242f8de2c92f0/main_1.png main_1.png png 56373 849 656 IMAGE-WEB-PDF 1 1-s2.0-S0926860X2030510X-gr8.jpg https://s3-eu-west-1.amazonaws.com/prod-ucs-content-store-eu-west/content/pii:S0926860X2030510X/gr8/DOWNSAMPLED/image/jpeg/9207cb3a35e29da785dc948a319fb1f0/gr8.jpg gr8 gr8.jpg jpg 47758 438 566 IMAGE-DOWNSAMPLED 1-s2.0-S0926860X2030510X-gr9.jpg https://s3-eu-west-1.amazonaws.com/prod-ucs-content-store-eu-west/content/pii:S0926860X2030510X/gr9/DOWNSAMPLED/image/jpeg/35f5bfb504f67edbf4cb1388c01ede44/gr9.jpg gr9 gr9.jpg jpg 35968 228 566 IMAGE-DOWNSAMPLED 1-s2.0-S0926860X2030510X-gr10.jpg https://s3-eu-west-1.amazonaws.com/prod-ucs-content-store-eu-west/content/pii:S0926860X2030510X/gr10/DOWNSAMPLED/image/jpeg/dc7919e55b97fbd7904d528d29d2b72e/gr10.jpg gr10 gr10.jpg jpg 57328 695 566 IMAGE-DOWNSAMPLED 1-s2.0-S0926860X2030510X-gr4.jpg https://s3-eu-west-1.amazonaws.com/prod-ucs-content-store-eu-west/content/pii:S0926860X2030510X/gr4/DOWNSAMPLED/image/jpeg/647859bd0c8ca0d744bab34117134288/gr4.jpg gr4 gr4.jpg jpg 213295 838 566 IMAGE-DOWNSAMPLED 1-s2.0-S0926860X2030510X-gr5.jpg https://s3-eu-west-1.amazonaws.com/prod-ucs-content-store-eu-west/content/pii:S0926860X2030510X/gr5/DOWNSAMPLED/image/jpeg/8b0e2f1c611dd3f05b753c844d60e023/gr5.jpg gr5 gr5.jpg jpg 28417 416 340 IMAGE-DOWNSAMPLED 1-s2.0-S0926860X2030510X-gr6.jpg https://s3-eu-west-1.amazonaws.com/prod-ucs-content-store-eu-west/content/pii:S0926860X2030510X/gr6/DOWNSAMPLED/image/jpeg/f7744f87080040a39a88d96ae98239a9/gr6.jpg gr6 gr6.jpg jpg 63361 374 566 IMAGE-DOWNSAMPLED 1-s2.0-S0926860X2030510X-gr7.jpg https://s3-eu-west-1.amazonaws.com/prod-ucs-content-store-eu-west/content/pii:S0926860X2030510X/gr7/DOWNSAMPLED/image/jpeg/0ed3918e850f74c9d058054ffe90860a/gr7.jpg gr7 gr7.jpg jpg 36737 348 566 IMAGE-DOWNSAMPLED 1-s2.0-S0926860X2030510X-gr1.jpg https://s3-eu-west-1.amazonaws.com/prod-ucs-content-store-eu-west/content/pii:S0926860X2030510X/gr1/DOWNSAMPLED/image/jpeg/27130197b2eff802d21a6bb3b9f45d6b/gr1.jpg gr1 gr1.jpg jpg 40862 442 340 IMAGE-DOWNSAMPLED 1-s2.0-S0926860X2030510X-gr2.jpg https://s3-eu-west-1.amazonaws.com/prod-ucs-content-store-eu-west/content/pii:S0926860X2030510X/gr2/DOWNSAMPLED/image/jpeg/bc3705b71159499e661d1ce19bca6d5d/gr2.jpg gr2 gr2.jpg jpg 27202 477 340 IMAGE-DOWNSAMPLED 1-s2.0-S0926860X2030510X-ga1.jpg https://s3-eu-west-1.amazonaws.com/prod-ucs-content-store-eu-west/content/pii:S0926860X2030510X/ga1/DOWNSAMPLED/image/jpeg/fbc934300bb14b4c9c82c7248180f7e1/ga1.jpg ga1 true ga1.jpg jpg 18665 245 220 IMAGE-DOWNSAMPLED 1-s2.0-S0926860X2030510X-gr3.jpg https://s3-eu-west-1.amazonaws.com/prod-ucs-content-store-eu-west/content/pii:S0926860X2030510X/gr3/DOWNSAMPLED/image/jpeg/98f4a7a7e16df4ec00e0a4bfb472ea1c/gr3.jpg gr3 gr3.jpg jpg 31447 244 341 IMAGE-DOWNSAMPLED 1-s2.0-S0926860X2030510X-gr8.sml https://s3-eu-west-1.amazonaws.com/prod-ucs-content-store-eu-west/content/pii:S0926860X2030510X/gr8/THUMBNAIL/image/gif/f06cc36d069b91bc881993adc00954d9/gr8.sml gr8 gr8.sml sml 7823 164 212 IMAGE-THUMBNAIL 1-s2.0-S0926860X2030510X-gr9.sml https://s3-eu-west-1.amazonaws.com/prod-ucs-content-store-eu-west/content/pii:S0926860X2030510X/gr9/THUMBNAIL/image/gif/31feef63bf72f60ff7515534da1b6b98/gr9.sml gr9 gr9.sml sml 7452 88 219 IMAGE-THUMBNAIL 1-s2.0-S0926860X2030510X-gr10.sml https://s3-eu-west-1.amazonaws.com/prod-ucs-content-store-eu-west/content/pii:S0926860X2030510X/gr10/THUMBNAIL/image/gif/754380c1a7bc51120c58d48bccfea351/gr10.sml gr10 gr10.sml sml 4980 163 133 IMAGE-THUMBNAIL 1-s2.0-S0926860X2030510X-gr4.sml https://s3-eu-west-1.amazonaws.com/prod-ucs-content-store-eu-west/content/pii:S0926860X2030510X/gr4/THUMBNAIL/image/gif/6081a8103827e646ae823b407d1488ea/gr4.sml gr4 gr4.sml sml 11909 163 110 IMAGE-THUMBNAIL 1-s2.0-S0926860X2030510X-gr5.sml https://s3-eu-west-1.amazonaws.com/prod-ucs-content-store-eu-west/content/pii:S0926860X2030510X/gr5/THUMBNAIL/image/gif/7fbfdc3af600a2d0d052c768b4251da1/gr5.sml gr5 gr5.sml sml 4614 164 134 IMAGE-THUMBNAIL 1-s2.0-S0926860X2030510X-gr6.sml https://s3-eu-west-1.amazonaws.com/prod-ucs-content-store-eu-west/content/pii:S0926860X2030510X/gr6/THUMBNAIL/image/gif/b58780d5dfc7454386b8a66bb2d344c8/gr6.sml gr6 gr6.sml sml 12563 145 219 IMAGE-THUMBNAIL 1-s2.0-S0926860X2030510X-gr7.sml https://s3-eu-west-1.amazonaws.com/prod-ucs-content-store-eu-west/content/pii:S0926860X2030510X/gr7/THUMBNAIL/image/gif/8d2b4e0e5c47d8e5b4016f457f9d75b7/gr7.sml gr7 gr7.sml sml 7465 135 219 IMAGE-THUMBNAIL 1-s2.0-S0926860X2030510X-gr1.sml https://s3-eu-west-1.amazonaws.com/prod-ucs-content-store-eu-west/content/pii:S0926860X2030510X/gr1/THUMBNAIL/image/gif/298428ad87a3008c89ea58bf172f43ca/gr1.sml gr1 gr1.sml sml 6472 164 126 IMAGE-THUMBNAIL 1-s2.0-S0926860X2030510X-gr2.sml https://s3-eu-west-1.amazonaws.com/prod-ucs-content-store-eu-west/content/pii:S0926860X2030510X/gr2/THUMBNAIL/image/gif/6b3fd228b9139ae9197b6d391fe03a30/gr2.sml gr2 gr2.sml sml 4630 164 117 IMAGE-THUMBNAIL 1-s2.0-S0926860X2030510X-ga1.sml https://s3-eu-west-1.amazonaws.com/prod-ucs-content-store-eu-west/content/pii:S0926860X2030510X/ga1/THUMBNAIL/image/gif/44da4b2a79405988a24744d228d21741/ga1.sml ga1 true ga1.sml sml 15570 164 147 IMAGE-THUMBNAIL 1-s2.0-S0926860X2030510X-gr3.sml https://s3-eu-west-1.amazonaws.com/prod-ucs-content-store-eu-west/content/pii:S0926860X2030510X/gr3/THUMBNAIL/image/gif/7901275fcb11a4de6b4f8f3001470b31/gr3.sml gr3 gr3.sml sml 14923 156 219 IMAGE-THUMBNAIL 1-s2.0-S0926860X2030510X-gr8_lrg.jpg https://s3-eu-west-1.amazonaws.com/prod-ucs-content-store-eu-west/content/pii:S0926860X2030510X/gr8/HIGHRES/image/jpeg/30ea871d101c1c047cf95949f525c4af/gr8_lrg.jpg gr8 gr8_lrg.jpg jpg 381796 1942 2508 IMAGE-HIGH-RES 1-s2.0-S0926860X2030510X-gr9_lrg.jpg https://s3-eu-west-1.amazonaws.com/prod-ucs-content-store-eu-west/content/pii:S0926860X2030510X/gr9/HIGHRES/image/jpeg/dd5315cc63b1992c5c180177b713e65c/gr9_lrg.jpg gr9 gr9_lrg.jpg jpg 346178 1012 2508 IMAGE-HIGH-RES 1-s2.0-S0926860X2030510X-gr10_lrg.jpg https://s3-eu-west-1.amazonaws.com/prod-ucs-content-store-eu-west/content/pii:S0926860X2030510X/gr10/HIGHRES/image/jpeg/b1eef6af64038cfc244a7530a5a920d8/gr10_lrg.jpg gr10 gr10_lrg.jpg jpg 426533 3078 2508 IMAGE-HIGH-RES 1-s2.0-S0926860X2030510X-gr4_lrg.jpg https://s3-eu-west-1.amazonaws.com/prod-ucs-content-store-eu-west/content/pii:S0926860X2030510X/gr4/HIGHRES/image/jpeg/55ca9001f17afbba0ccb4632174626cd/gr4_lrg.jpg gr4 gr4_lrg.jpg jpg 2744058 3715 2508 IMAGE-HIGH-RES 1-s2.0-S0926860X2030510X-gr5_lrg.jpg https://s3-eu-west-1.amazonaws.com/prod-ucs-content-store-eu-west/content/pii:S0926860X2030510X/gr5/HIGHRES/image/jpeg/3f8fae72450d23b2ff18e21824f5c0b2/gr5_lrg.jpg gr5 gr5_lrg.jpg jpg 230338 1844 1508 IMAGE-HIGH-RES 1-s2.0-S0926860X2030510X-gr6_lrg.jpg https://s3-eu-west-1.amazonaws.com/prod-ucs-content-store-eu-west/content/pii:S0926860X2030510X/gr6/HIGHRES/image/jpeg/fb698a3e4b3720d92bd838f771de8079/gr6_lrg.jpg gr6 gr6_lrg.jpg jpg 933020 1656 2508 IMAGE-HIGH-RES 1-s2.0-S0926860X2030510X-gr7_lrg.jpg https://s3-eu-west-1.amazonaws.com/prod-ucs-content-store-eu-west/content/pii:S0926860X2030510X/gr7/HIGHRES/image/jpeg/029f04b127240371f7f37d75b0b50abd/gr7_lrg.jpg gr7 gr7_lrg.jpg jpg 287249 1543 2508 IMAGE-HIGH-RES 1-s2.0-S0926860X2030510X-gr1_lrg.jpg https://s3-eu-west-1.amazonaws.com/prod-ucs-content-store-eu-west/content/pii:S0926860X2030510X/gr1/HIGHRES/image/jpeg/64b5fe7285397e8e28ce3db876528e34/gr1_lrg.jpg gr1 gr1_lrg.jpg jpg 291593 1960 1508 IMAGE-HIGH-RES 1-s2.0-S0926860X2030510X-gr2_lrg.jpg https://s3-eu-west-1.amazonaws.com/prod-ucs-content-store-eu-west/content/pii:S0926860X2030510X/gr2/HIGHRES/image/jpeg/477c856746f6e51bf05677b758678b45/gr2_lrg.jpg gr2 gr2_lrg.jpg jpg 228787 2114 1508 IMAGE-HIGH-RES 1-s2.0-S0926860X2030510X-ga1_lrg.jpg https://s3-eu-west-1.amazonaws.com/prod-ucs-content-store-eu-west/content/pii:S0926860X2030510X/ga1/HIGHRES/image/jpeg/af82ae9f7a2738550ce906582f872dc7/ga1_lrg.jpg ga1 true ga1_lrg.jpg jpg 212368 1085 975 IMAGE-HIGH-RES 1-s2.0-S0926860X2030510X-gr3_lrg.jpg https://s3-eu-west-1.amazonaws.com/prod-ucs-content-store-eu-west/content/pii:S0926860X2030510X/gr3/HIGHRES/image/jpeg/e9be4c9af56f5fd4c6383305c3397af8/gr3_lrg.jpg gr3 gr3_lrg.jpg jpg 221741 1079 1510 IMAGE-HIGH-RES 1-s2.0-S0926860X2030510X-mmc1.docx https://s3-eu-west-1.amazonaws.com/prod-ucs-content-store-eu-west/content/pii:S0926860X2030510X/mmc1/MAIN/application/vnd.openxmlformats-officedocument.wordprocessingml.document/2fc37406e3ced89efccc216fb1eea663/mmc1.docx mmc1 mmc1.docx docx 6424923 APPLICATION 1-s2.0-S0926860X2030510X-si1.svg https://s3-eu-west-1.amazonaws.com/prod-ucs-content-store-eu-west/content/pii:S0926860X2030510X/STRIPIN/image/svg+xml/6824af846a875edef29ed624cd0b2e2f/si1.svg si1 si1.svg svg 29321 ALTIMG 1-s2.0-S0926860X2030510X-am.pdf https://s3-eu-west-1.amazonaws.com/prod-ucs-content-store-eu-west/content/egi:10DTP19H9Z2/MAIN/application/pdf/8f912d74dfb62c239c5d7a517d28b735/am.pdf am am.pdf pdf false 4296405 AAM-PDF APCATA 117917 117917 S0926-860X(20)30510-X 10.1016/j.apcata.2020.117917 Elsevier B.V. Fig. 1 (A) Activity pattern of the M1C1(A) catalyst in the CWAO of phenol; (B) Stability pattern of the M1C1(A) catalyst during seven consecutive reaction cycles (Reaction conditions: T, 423 K; P, 1.4 MPa; pO2, 0.9 MPa; wcat,wPhOH, 5). Fig. 1 Fig. 2 Influence of catalyst composition on the CO2 yield (YCO2) in the CO oxidation (GHSV, 180,000 h−1; pC O=pO2 , 2.5 kPa) and in the CWAO of phenol (P, 1.4 MPa; pO2 , 0.9 MPa; wcat/wPhOH, 5) at 423 K (data taken from Tab. S1 of SI). Fig. 2 Fig. 3 XRD patterns of “A” (black lines) and “B” (red lines) catalysts. Dotted lines show the main cerianite reflexes (JCPDS 34-394) with the relative Miller indices, while the Miller indices of the α-MnO2 (JCPDS 44-0141) and δ-MnO2 (JCPDS 18-0802) species are indicated in black and red, respectively (For interpretation of the references to colour in this figure legend, the reader is referred to the web version of this article). Fig. 3 Fig. 4 TEM micrographs of the M1C1(B) (A, B), M1C1(A) (C, D) and M5C1(A) (E, F) samples at different magnification. Fig. 4 Fig. 5 Raman spectra (A) and effect of composition on the surface Mn/Ce atomic ratio (XPS) of “A” and “B” catalysts (B). Fig. 5 Fig. 6 Effect of composition (A) and preparation method (B) on the TPR profiles of the untreated “A” and “B” catalysts. Fig. 6 Fig. 7 Effect of composition on: (A) percentage of Mn(II), Mn(III) and Mn(IV) atoms; (B) abundance of surface Mn(II) atoms and amount of Ce(IV) ions reduced at T≤723 K. Fig. 7 Fig. 8 Effect of composition (A) and preparation method (B) on the TPR profiles of catalysts pretreated in situ in O2 flow (673 K). Dotted lines show the profiles of the untreated samples (see Fig. 6 ). Fig. 8 Fig. 9 (A) IR spectra of M5C1(A) (a), M1C1(A) (b) and M1C3(A) (c) in interaction with the CO-O2 mixture (pCO = pO2 , 25 mbar) for 30 min at 298 K; (B) IR spectra of the M5C1(A) catalyst in interaction with CO2 at increasing pressure (0-25 mbar, spectra a-o) compared with the spectrum obtained after 30 min of contact with the CO-O2 mixture (spectrum a’). Fig. 9 Fig. 10 Effect of catalyst composition on: (A) the CO2 MnOx-site time-yield (styMnOx ); (B) the CO2 surface time-yield (ssty); (C) the fraction and (D) the abundance of surface Mn(II), Mn(III) and Mn(IV) atoms, respectively. Fig. 10 Table 1 List of the catalysts. Table 1 Code a (MxCy) Composition Mn/Ceb (at/at) χMn a,b (x/(x + y)) [Mn]b (wt %) K/Mnb (at/at) SSA (m2⋅ g−1) PV (cm3⋅ g−1) APD (nm) M(A) MnO2 – 1.00 59.5 0.12 94 0.34 31 M5C1(A) MnCeOx 4.6 0.82 42.3 0.12 159 0.56 30 M3C1(A) MnCeOx 3.2 0.76 37.8 0.10 184 0.61 27 M1C1(A) MnCeOx 1.0 0.51 21.7 0.01 190 0.49 25 M1C3(A) MnCeOx 0.3 0.25 8.9 0.00 204 0.55 24 C(A) CeO2 0.0 0.00 – 0.00 132 0.10 3 M(B) MnO2 – 1.00 59.2 0.22 61 0.38 30 M3C1(B) MnCeOx 2.7 0.73 36.8 0.23 114 0.46 24 M1C1(B) MnCeOx 1.0 0.49 21.0 0.15 154 0.49 7 M1C3(B) MnCeOx 0.3 0.24 9.1 0.02 167 0.28 4 C(B) CeO2 0.0 0.00 – 0.00 115 0.13 3 a) x and y refer to the number of Mn and Ce atoms, respectively; b) chemical composition data obtained by XRF analysis. Tailoring manganese oxide catalysts for the total oxidation of pollutants in gas and liquid phase Francesco Arena Writing - original draft Conceptualization Methodology Supervision a b * Roberto Di Chio Investigation Data curation a Alessandra Palella Investigation b Lorenzo Spadaro Investigation Data curation b Leone Frusteri Investigation Data curation b Barbara Fazio Investigation Data curation c Sara Morandi Investigation Data curation Writing - review & editing d ** Gianmario Martra Writing - original draft Methodology Supervision d a Department of Engineering, University of Messina, C.da Di Dio, I-98166, S. Agata, Messina, Italy Department of Engineering University of Messina C.da Di Dio S. Agata Messina I-98166 Italy Department of Engineering, University of Messina, C.da Di Dio, I-98166 S. Agata (Messina), Italy b CNR-ITAE Institute “Nicola Giordano”, Salita S. Lucia 39, I-98126, S. Lucia, Messina, Italy CNR-ITAE Institute “Nicola Giordano” Salita S. Lucia 39 S. Lucia Messina I-98126 Italy CNR-ITAE Institute “Nicola Giordano”, Salita S. Lucia 39, I-98126 S. Lucia (Messina), Italy c CNR–IPCF Institute, Viale F. Stagno D’Alcontres 37, I-98158, S. Agata, Messina, Italy CNR–IPCF Institute Viale F. Stagno D’Alcontres 37 S. Agata Messina I-98158 Italy CNR–IPCF Institute, Viale F. Stagno D’Alcontres 37, I-98158 S. Agata (Messina), Italy d Department of Chemistry and Centre for “Nanostructured Interfaces and Surfaces-NIS”, University of Torino, Via P. Giuria 7, I-10125, Torino, Italy Department of Chemistry and Centre for “Nanostructured Interfaces and Surfaces-NIS” University of Torino Via P. Giuria 7 Torino I-10125 Italy Department of Chemistry and Centre for “Nanostructured Interfaces and Surfaces-NIS”, University of Torino, Via P. Giuria 7, I-10125 Torino, Italy ⁎ Corresponding author at: Department of Engineering, University of Messina, C.da Di Dio, I-98166, S. Agata, Messina, Italy. Department of Engineering University of Messina C.da Di Dio S. Agata Messina I-98166 Italy ⁎⁎ Corresponding author at: Department of Chemistry and Centre for “Nanostructured Interfaces and Surfaces-NIS”, University of Torino, Via P. Giuria 7, I-10125, Torino, Italy. Department of Chemistry and Centre for “Nanostructured Interfaces and Surfaces-NIS” University of Torino Via P. Giuria 7 Torino I-10125 Italy Graphical abstract Substitutional Mn(II) and surface Mn(IV) centers shape the reactivity of bare and Ce-promoted MnOx catalysts in gas and liquid phase. Bare and ceria-promoted MnOx catalysts (0 ≤ χMn≤1) were prepared by redox-precipitation reactions of Mn(VII), Mn(II) and Ce(III) or Ce(IV) precursors in slightly acidic (pH, 4.5) or basic (pH, 8.0) environment to assess genesis, nature, and functionality of surface active sites. Both synthesis protocols yield nanostructured materials with large surface area and exposure of Mn sites, featuring high activity in the CO oxidation and the phenol wet-air-oxidation (CWAO) model reactions (T, 423 K). High oxide dispersion prompts an extensive incorporation of Mn(II) ions into ceria substitutional solid-solution structures, forming oxygen-vacancies with stronger oxidation activity than surface Mn(IV) sites. Basic structure-activity relationships indicate that the superior CO oxidation performance of the pristine α-MnO2 system relies on large exposure of very reducible Mn(IV) active sites, while O2-adsorption onto Mn(II)/O-vacancy active centres generates very reactive surface oxygen-species boosting the efficiency of composite MnCeOx catalysts in the CWAO of phenol. Keywords Manganese oxide catalysts Active sites CO oxidation Phenol wet air oxidation (CWAO) Structure-activity relationships Catalyst design 1 Introduction Since several decades, manganese oxides attract great attention as catalytic materials because of the Mn abundance on Earth, low cost, no significant toxicity, and performance comparable to noble-metal catalysts in several environmental, energy and green-chemistry reactions. In this respect, numerous studies evidenced a remarkable electro-catalytic activity of engineered MnOx materials in the oxygen evolution reaction (OER) [1–4], which also show high performances in the oxygen reduction reaction (ORR) [4–7]. Moreover, MnOx catalysts are quite efficient in the oxidative removal of CO [8–15] and VOC’s [16–19], the selective reduction of NOx (SCR) [8,20,21], the soot oxidation [22] and the green selective oxidation of organic substrates [23–25]. Further, remarkable promoting effects of ceria [14,19,23,26–40] and iron oxides [23,41,42] on the functionality of the MnOx phase have been documented. Thus, innovative synthesis routes were adopted for tailoring nanocomposite catalysts very active in gas and liquid phase reactions [14,23,26–42]. Strongly oxidizing Mn(IV) sites generally account for the reactivity of the unpromoted MnOx catalysts although phase structure [1–10,16–22,25,43], crystal facets [5,10,16,31,44], texture and morphology [1,5,12,14,17,18,21] and dopants [8,11,14,19,21,23,24,29–48] affect type and availability of surface active sites. Then, it has been claimed that Mn(III) centres could be crucial owing to distorted coordination geometry and high reactivity of d4 ions [2,15,37]. Moreover, synergistic interactions of the oxide phases determine the peculiar physico-chemical properties and the activity pattern of composite systems [26,41,42]. In particular, both computational and experimental studies addressed the interactions of ceria with Mn atoms to ascertain the chemistry behind the reactivity of Mn-doped ceria systems [45,30–48]. Although this is generally ascribed to high reducibility of surface Mn(IV) atoms in interaction with ceria carrier [12,14,19,23,27,30–34,37–40,45–47], the role of surface Mn(III) and Mn(II) centres on the functionality of MnCeOx systems remains still matter of debate [28,35–37,40,48]. In addition, structural defects and oxygen-vacancies are crucial for the reactivity of bare and promoted MnOx systems, owing to positive effects on O2-activation and lattice-oxygen mobility [9–11,19–21,24,28,31,35,37,47,49]. Overall, these evidences document a rough knowledge of active sites, reflecting on a substantial unpredictability of catalyst requirements, since also remarkable effects of preparation method [1–6,16–18,27,29,31,31,32,33,34,37–39,44] and testing conditions [2,31] on the functionality of bare and promoted MnOx systems have been ascertained. Therefore, this study is aimed at shedding light into the genesis and the chemistry of surface manganese sites, shaping the functionality of bare and ceria-promoted MnOx catalysts in the CO oxidation and phenol wet air oxidation (CWAO) model reactions (T, 423 K). Characterization and activity data unveil basic structure-activity relationships highlighting the benchmarks of MnOx catalyst design for environmental applications in gas and liquid phase. 2 Materials and methods 2.1 Catalyst preparation The redox-precipitation technique was applied for the preparation of two series of MxCy materials with different Mn-to-Ce atomic ratio (i.e., x/y) in slightly acidic and basic solution, labelled with “A” and “B” respectively. Namely, the “A” catalysts were prepared by titration in acidic solution (pH, 4.5 ± 0.5) of the Mn(NO3)2 salt with solutions of Ce(NH3)2(NO3)6 and KMnO4 precursors [14,29], while “B” catalysts were obtained by titration in basic environment (pH, 8.0 ± 0.5) of the KMnO4 precursor with solutions of the Mn(NO3)2 and Ce(NO3)3 salts [26,38,39]. After titration, the solids were filtered, washed, dried at 373 K (16 h) and then calcined in air at 673 K (6 h). Codes, composition, and textural properties of the catalysts are summarized in Table 1 , while further details of design and preparation can be found in the App. A of SI. 2.2 Catalyst characterization X-Ray Fluorescence (XRF) analyses were performed to obtain the composition of catalysts. Nitrogen Adsorption Isotherms were acquired by a Micromeritics Instrument ASAP 2010 adsorption device (77 K), after sample degassing at 423 K (12 h). The isotherms were elaborated by the BET and BJH methods to obtain the specific surface area (SA), the pore volume (PV) and the average pore diameter (APD) data. X-Ray Diffraction (XRD) patterns were obtained at scan rate of 0.1°⋅ min−1 by a Philips X-Pert diffractometer, using the Ni β-filtered Cu Kα radiation (40 kV; 30 mA). Laser Raman Scattering spectroscopy analyses were performed using a He-Ne laser (λ, 632.8 nm) at a power beam of 30 μW, focused on the sample by a 50× objective at long focal distance over a 1.5 μm diameter spot, with a resolution of 3 cm−1 [14]. Transmission Electron Microscopy (TEM) analyses were performed by a PHILIPS CM12 microscope operated at 200 kV on catalyst samples ultrasonically dispersed in isopropanol and deposited over a thin carbon-film supported on a standard Cu-grid. X-ray Photoelectron Spectroscopy (XPS) data were obtained using a Physical Electronics GMBH PHI 5800-01 spectrometer operating with a mono-chromatized Al-Kα radiation (300 W). The BE regions of Mn2p (635−680 eV), Ce3d (870−935 eV) and O1s (525−535 eV) were calibrated using the C1s line (284.8 eV) as reference [14]. Infrared absorption-transmission (IR) spectra were run on a Perkin-Elmer FTIR System 2000 spectrometer equipped with Hg-Cd-Te cryo-detector, with a resolution of 2 cm−1, averaging 100 scans. Catalyst powders were compressed in self-supporting pellets (∼10 mg cm-2) and placed in a conventional IR cell equipped with KBr windows. After a treatment in vacuum (p<5⋅10-4 mbar) at 673 K for 30 min and, then, in O2 (40 mbar) at the same temperature (30 min), the samples were cooled down to 298 K and further outgassed to a residual pressure of 5⋅10-4 mbar. The IR spectra were recorded at 298 K during the interaction with a CO-O2 mixture (pCO , 25 mbar; pCO /pO2 , 1) or with CO2 at increasing pressure (0−25 mbar) and normalized for the specific surface area of the samples. Temperature Programmed Reduction (TPR) analyses in the range of 293−1073 K of catalyst samples (∼20 mg), untreated and pre-treated in situ in 5% O2/He flow at 673 K (1 h), were carried out in a quartz reactor (i.d., 4 mm), fed with a 5% H2/Ar carrier (60 stp mL⋅ min−1) and heated at the rate of 12 K⋅ min−1. The H2 consumption was monitored by a TCD and normalized for the MnOx content of the catalysts. 2.3 Catalyst testing CO oxidation activity data at 423 K were obtained using the above quartz reactor (wcat, 20 mg) fed with a CO/O2/He mixture (1/1/38) at the rate of 60 stp mL⋅ min−1 (GHSV, 180,000 h−1). Before tests the catalysts were treated in 5% O2/He flow at 423 K, while the reaction stream has been analysed by a QMS as elsewhere described [14,27,29]. Catalytic Wet Air Oxidation (CWAO) of phenol tests were carried out in (semi)batch mode, at a pressure of 1.4 MPa (pO2, 0.9 MPa), using a PTF-lined autoclave (0.25 L) equipped with a magnetic stirrer (∼800 rpm). The reactor was loaded with an aqueous solution (0.15 L) of phenol (1 g/L) and 0.75 g of powdered catalyst (wcat/wPhOH, 5), fed with a continuous O2 flow (0.1 stp L⋅ min−1) and then heated at 423 K. The tests were run for 6 h and the solution was periodically analysed with respect to pH, phenol and total organic carbon (TOC) concentration. Moreover, the mineralization activity (YCO2) was probed by gravimetric analyses of CO2 in the outlet reaction stream [38,39,50], the CO2 space-time-yield (YCO2<15 %) being obtained by the formula (1) s t y = Δ Y C O 2 Δ t ∙ C a t m o l P h e n ∙ w P h e n P M P h e n ∙ 1 w c a t = Δ Y C O 2 Δ t ∙ 0.0128 m o l C O 2 ∙ g c a t - 1 ∙ s - 1 Catalyst stability was evaluated during seven consecutive reaction cycles of six hours, carried out at the end of each run under the same conditions without any intermediate catalyst treatment. 3 RESULTS and DISCUSSION 3.1 Effect of composition on the activity pattern The effects of composition on the gas and liquid phase oxidation activity were comparatively probed by catalytic tests in the CO oxidation and phenol CWAO model reactions (T, 423 K), using tubular continuous-flow [14,29] and stirred batch [38,39] reactors, respectively. The stationary regime of the first implies the full consistency of CO conversion (XCO) and CO2 yield (YCO2) data, while all the catalysts exhibit an unchanging CWAO pattern involving continuous changes of phenol (XPhOH) and TOC (XTOC) concentration, of pH and CO2 yield (YCO2) during 6 h of reaction time (Fig. S3 of SI). These features mirror a classic L-H reaction path, limited by the surface oxidation step (r.d.s.), since a fast adsorption of the substrate accounts for XPhOH and XTOC while the slow oxidation of adsorbed species causes the side-formation of C1-C2 acidic intermediates, leading to progressive decrease of XTOC and pH, and build-up of C-deposits on the catalyst surface [37–40,50]. These evidences substantiate the reliability of CO2 yield data to probe the oxidative functionality in liquid phase (see Tab. S1 of SI). On this account, Fig. 1 A shows that the most effective M1C1(A) catalyst prompts a full conversion of phenol and TOC in ca. 15 min, attaining an almost complete carbon mineralization (YCO2∼90 %) in 6 h. The remarkable water purification efficiency of the M1C1 catalyst is also evident from a slight formation of C1-C2 acids, accounting for final residual TOC traces (XTOC, 95 %) and a pH value of ca. 5 [39,50]. Consequence of an almost complete substrate mineralization hindering the growth of carbonaceous deposits and the consequent fouling of active sites [39,50], the M1C1(A) catalyst features also a substantial stability during seven reusability tests (Fig. 1B), as indicated by: i) a full phenol removal (XPhOH, 100 %) throughout all the reaction cycles; ii) a TOC abatement (XTOC) lowering from 95 to 70 % after four cycles and keeping unchanged thereafter; and iii) a CO2 yield (YCO2) decreasing from 90 to 45 % during the first five cycles, levelling off thereafter. A minor influence of the preparation method is evident from the similar activity pattern of the M1C1(B) catalyst (YCO2∼85 %), while the M1C3(A) sample ensures a slightly lower CO2 yield (YCO2∼80 %) higher than M3C1(A) and M5C1(A) ones (YCO2∼65 %) (Fig. S3 of SI). Finally, slow rate of phenol and TOC removal (∼1 h) and, mostly, final YCO2 (45 %), XTOC (80 %) and pH (∼3) values signal the worst CWAO performance of the bare M(A) catalyst. Thus, the final YCO2 values (6 h) depict a volcano-shaped trend with Mn loading (Fig. 2 ), indicating an optimum catalyst composition including similar amount of manganese and cerium atoms (i.e., M1C1) [26,40]. Despite a very short contact time (GHSV, 180,000 h−1), YCO2 values between 10 and 30 % indicate that bare and promoted catalysts also feature a remarkable activity in the CO oxidation (Tab. S1 of SI). However, contrarily to what observed in the CWAO of phenol, the M(A) sample features the highest activity, while the M1C1(B), M1C1(A), M3C1(A) and M5C1(A) catalysts have similar performances, better than the M1C3(A) sample [14,29]. The catalyst stability has been previously assessed [14,27], while YCO2 data depict a peculiar increasing trend with Mn loading that, compared with that in the CWAO of phenol (Fig. 2), discloses a strong influence of the reaction environment on the functionality of bare and promoted MnOx catalysts. 3.2 Effect of composition and preparation method on catalyst structure As a rule, bare oxides and composite MnCeOx materials feature type-IV adsorption-desorption isotherms typical of mesoporous materials, while the desorption branches depict type H2-H3 hysteresis loops, depending on pore size distribution (Fig. S4 of SI). In particular, the composite MnCeOx systems are characterised by specific surface area (SSA) values larger than each oxide component, showing a maximum for χMn in-between 0.25 (M1C3) and 0.5 (M1C1) that is diagnostic of synergistic structural effects of the oxide phases (Fig. S5 of SI). In particular, the SSA of the pristine M(B) and C(B) systems is equal to 61 and 115 m2/g respectively, ranging between 115 (M3C1(B)) and 167 m2/g (M1C3(B)) for the composite MnCeOx catalysts (Table 1). Although the synthesis in acidic solution favours a larger surface development (Table 1), a trend similar to “B” counterparts is observed also for “A” catalysts (Fig. S5 of SI). Furthermore, both series of catalysts are characterized by similar pore volume (PV), although the average pore diameter (APD) of “A” catalysts keeps unchanged (24-3124−31 nm) growing with Mn loading (4−24 nm) for “B” ones (Table 1). According to literature data (Fig. S4 of SI), such findings show a decisive influence of the preparation method on catalyst surface area while an unchanging composition-effect is the result of a strong oxide synergism, deeply affecting the structure of MnCeOx materials [19,30–37,40]. Indeed, the XRD patterns of promoted “B” catalysts feature two broad signals in the range of 20−80°, being diagnostic of a negligible crystalline order of both CeO2 and MnOx phases (Fig. 3 ). In particular, TEM images show that the M1C1(B) sample consists of aggregates of tiny (<10 nm) particles (Fig. 4 A), including very irregular and defective ceria clusters (yellow circles) stuck by an amorphous array of the MnOx phase (Fig. 4B). Despite broad peaks at 28.5, 33, 47.5 and 56.5° denote some higher crystallinity of catalysts obtained in acidic solution (Fig. 3), the M1C1(A) catalyst features morphology (Fig. 4C) and structure (Fig. 4D) similar to the M1C1(B) counterpart. The fading of ceria lines occurring at higher Mn loading renders similar the patterns of M3C1 catalysts, while a weak reflex at ca. 37° reveals an incipient crystallization of the MnO2 phase in the M3C1(A) sample. This is more evident for the M5C1(A) catalyst showing, in fact, nanofibers/nanorods morphology (Fig. 4E) and a “layered” structure (red circles) of catalyst particles (Fig. 4F), typical of MnO2 materials. Consistent with this trend, the XRD pattern of the pristine M(A) sample matches that of α-MnO2 polymorphs with tunnel-structure including K+ ions (JCPDS 44-0141), while the genesis in alkaline solution accounts for the birnessite-type arrangement of the M(B) sample (JCPDS 18-0802). In fact, the potassium content of the pristine M(A) and M(B) samples (Table 1) matches the chemical composition of the α-MnO2 (K0.12MnO2) and δ-MnO2 (K0.23MnO2) phases, respectively [9,16,22,41,47–50]. Further clues on the short-range structure and dispersion of the oxide phases are available from Raman (Fig. 5 A) and XPS (Fig. 5B) analyses. In particular, the Raman spectrum of the bare M(A) sample shows three Raman signals at 187, 584 and 635 cm−1 that are characteristic of α-MnO2 and/or cryptomelane polymorphs [5,14,16,22,43,49,51], while the lack of the first peak and the slight shifts of the others at higher wavenumbers (575 cm-1 and 649 cm-1) substantiate the low crystallinity of MnO2 domains in the M3C1(A) and M5C1(A) samples [32,37]. However, such Raman features can be also related to a birnessite-type arrangement of MnO2 domains (Fig. 4F) [37], since cerium ions likely hinder the layer-to-tunnel transition from “δ” to α-MnO2 phase [19,21,52–54]. Finally, the absence of Mn-O bonds (620−660 cm−1) and F 2g cerianite (460 cm-1) fingerprints reveals the lack of any short-range order in both M1C3(A) and M1C1(A) samples (Fig. 5A) [55]. These data suggest that the redox interactions of the precursors (see App. A of SI) prompt the formation of nanostructures with high inter-dispersion of the oxide species, as confirmed by the homogeneous concentration profile of Mn and Ce atoms across catalyst particles, irrespective of the preparation method (Fig. 5B). 3.3 Speciation and reduction pattern of the active phase The TPR analysis discloses a high reducibility of bare and promoted catalysts in the range of 373−723 K, mostly due to the redox functionality of the MnOx phase (Fig. 6 ). Indeed, the TPR pattern of the bare M(A) sample shows two resolved peaks centred at 565 and 613 K, in a ratio of 2:1, arising from the stepwise reduction of MnO2 domains to Mn3O4 and MnO, respectively. While a small peak at 773 K and the subsequent H2 consumption account for the poor reducibility of ceria at the surface and in the bulk, respectively (Fig. 6A) [23,27,30,33,38]. Consistent with such patterns, the M1C3(A) and M1C1(A) catalysts feature a sharp TM1 peak due to the reduction of surface Mn(IV) atoms to Mn(II), while the TM2 peak of Mn2O3-Mn3O4 species is almost absent [14,23,27,56]. In fact, a lowering intensity with Mn loading proves that the shoulder at 660 K (TM3) is due to an early reduction of surface Ce(IV) ions, owing to the promoting effect of the MnOx phase on ceria lattice oxygen mobility [19,27,30,33,39,40]. The lack of the sharp TM1 maximum reflects lower amounts of Mn(IV) atoms in the M1C3(B) and M1C1(B) catalysts, although the same initial reduction rate of M3C1 samples indicates that the concentration of Mn(IV) atoms grows with Mn loading, regardless of the preparation method (Fig. 6B). Further, the upward TM1 shift and the growth of TM2 peak observed at high Mn loading (Fig. 6) reflect the progressive clustering of Mn(IV) atoms into MnO2 domains, while minor changes in the onset reduction (Tab. S2 of SI) rule out any chemical effect of ceria on the reactivity of surface Mn(IV) atoms. Although the TPR profiles shed light into the redox properties of Mn(IV) atoms, the concomitant reduction of ceria determines unsystematic H2 consumption data (Tab. S2 of SI) concealing further clues on the speciation of the active MnOx phase. Thus, a deconvolution analysis of the XPS Mn 2p peaks (see App. B of SI) was applied to shed light into the surface chemistry of the studied systems. Shown in Fig. 7 A, such data indicate that: • Mn(II) atoms (25–35 %) abound at low Mn loading (χMn≤0.5), decaying at trace levels thereafter (2–6 %); • large extents of Mn(III) atoms (30–40 %) are present on the promoted catalysts, although a significant fraction (∼15 %) is also present on the pristine M(A) sample; • Mn(IV) atoms (60–85 %) prevail at high Mn loading (χMn>0.5). Hence, beside to the remarkable effects on texture, structure and oxide dispersion, XPS data unveil a strong influence of ceria matrix on the chemistry of the MnOx phase, consistent with the formation of solid-solution structures [26–28,30–40,46–48]. In this respect, the incorporation of Mn(III) (d, 0.65 Å) and Mn(IV) (d, 0.58 Å) ions into ceria lattice should be hindered by size compatibility issues, while larger Mn(II) ions (d, 0.83 Å) can replace Ce(IV) ones (d, 0.97 Å) up to a maximum cationic content of 15 % (i.e., Mn(II)/(Mn + Ce)), forming substitutional solid-solution structures [36,48]. Percentages of Mn(II) atoms in the M1C3(A) and M1C1(A) catalysts (Fig. 7A) corresponding to cationic contents of 10 and 14 % respectively, support theoretical predictions [36,48]. The replacement implies the formation of O-vacancies for charge balance that lower the stability of ceria lattice, promoting the reduction of cerium atoms (Fig. 6). Quantitative TPR (Tab. S2 of SI) prove the key-role of Mn(II) ions on the early reduction of ceria, since the H2 consumption exceeding that expected from the Mn AON provided by the XPS analysis (see Fig. S7 of SI) corresponds to amounts of reduced Ce(IV) ions following a trend analogous to the abundance of Mn(II) atoms in the various catalysts (Fig. 7B). Moreover, the Mn(II)/Ce(IV) replacement determines a lattice-shrinking effect that forces the stabilization of Mn(III) atoms onto the surface defective positions of ceria particles [36,44], while Mn(IV) atoms form MnO2 over-layers (e.g., patches, islands) evolving into crystalline domains at high Mn loading. 3.4 Active sites Although the high reactivity of MnCeOx catalysts depends on solid solution sites, the stability of Mn(II) atoms under reducing conditions hinders their fingerprint in the TPR pattern of the untreated samples (Fig. 6). In fact, a pretreatment in O2 (673 K) causes the appearance of a new peak, labeled as TM0 (Fig. 8 ), accounting for a proportionally larger H2 consumption (Tab. S2 of SI). In particular, the amplitude of the TM0 peak decreases systematically with Mn loading (Fig. 8A), being comparable for M1C1(A) and M1C1(B) catalysts (Fig. 8B). Thus, low temperature maximum (∼423 K), being diagnostic of a strong oxidizing power, and a trend similar to the percentage of Mn(II) atoms (Fig. 7A) disclose that the TM0 component is produced by solid solution sites. In fact, it is likely that the dehydration of Mn(II)/O-vacancy centers favors the O2 adsorption, producing very reactive surface oxygen-species (i.e., O2 −, O2 =) yielding the TM0 peak [30]. On this account, a comparative IR study of the interactions of M5C1(A), M1C1(A) and M1C3(A) catalysts with a CO-O2 mixture (Fig. 9 A) and CO2 (Fig. 9B) provides further evidence of the functionality of Mn(II) and surface Mn(IV) sites. In particular, the spectra of the catalysts contacted for 30 min with the CO-O2 (1/1) mixture show complex envelopes of bands in the range of 1700−800 cm-1 (Fig. 9A). Although the intensity depends on the material, the absorption features are very similar with few exceptions. In fact, in the light of literature data [30,31,57–59] and of the CO2 adsorption spectra (v. infra), all the absorption bands can be assigned to surface carbonate species. Moreover, the spectral features are much like those of carbonates adsorbed on MnOx materials [30,31,58], rather than to carbonate species in interaction with CeO2 [31,59]. Thus, the spectra can be rationalized as follows: • the bands at 1608, 1398 and 1216 cm−1 are assigned to the ν(CO), ν(CO) and δ(OH) modes of hydrogen-carbonates, respectively; • the bands at 1510, 1327 and 1050 cm−1 are due to the ν asym(OCO), ν sym(OCO) and ν(CO) modes of monodentate-carbonates, respectively; • the bands at 1576, 1303 and 1050 cm−1 are assigned to ν(CO), ν asym(OCO) and ν sym(OCO) modes of bidentate-carbonates, respectively. The components at 1616 and 1272 cm−1, more evident for the M5C1-RM4 sample, are also attributable to the ν(CO) and ν asym(OCO) modes of bidentate-carbonates. Further, the band at 857 cm−1 can be related to the δ(OCO) mode of both monodentate and bidentate carbonates. Finally, a small amount of bridged carbonates, producing bands at 1680 and 1248 cm−1 (ν(CO) and ν asym(OCO) modes, respectively, being the third ν sym(OCO) mode in the envelope at ∼1050 cm−1) is observed only for M5C1(A). It is likely that the latter species could form on poorly crystalline MnO2 domains of the M5C1(A) catalyst [60,61]. On the other hand, the amorphous character of the MnOx phase in the three catalysts accounts for the heterogeneity of surface sites evidenced by the formation of monodentate and two families of bidentate carbonates. Formed by the surface interactions of CO and O2 and by the chemisorption of the CO2 product, these confirm the ability of the three catalysts to drive the CO oxidation at 298 K [14,29–31,43,44,61]. However, considering that the intensity of adsorbed carbonate species rises in the order M5C1(A) < M1C1(A) < M1C3(A), the occurrence of larger carbonate amounts at low Mn loading seems contradictory. This apparent inconsistency is explained by the spectral features of the M5C1(A) catalyst during CO2 adsorption at increasing pressure, which are compared with the spectrum obtained in CO-O2 after 30 min (Fig. 10 B). This shows a much higher intensity of the carbonate bands when dosing CO2, suggesting that the intensity of the pattern in the latter case is not limited by the availability of adsorption sites, rather depending on the amount of CO2 produced by the CO oxidation. In other words, the intensity of the surface carbonates bands reflects the CO oxidation activity at 298 K [14,29,31]. Matching the intensity of the TM0 peak (Fig. 8A), thus, IR data substantiate a stronger CO oxidation activity of Mn(II) sites, which are prevalent on M1C3(A) and M1C1(A) catalysts. 3.5 Structure-activity relationships Consistent with the YCO2 trend in Fig. 1, kinetic data (Tab. S1 of SI) indicate an unchanging CO oxidation activity scale referred to both weight (space-time-yield, STY) and catalyst surface area (specific surface-time-yield, ssty) M(A) > M1C1(A) ≈ M1C1(B) ≈ M5C1(A) > M1C3(A). First evidence of higher gas phase activity of the pristine α-MnO2 system than composite MnCeOx catalysts [19,26,31–34,36,40], this depends on the effectiveness of the synthesis route to generate MnO2 nanoparticles with large surface exposure of Mn(IV) active sites [14,23,26,29,56]. Despite much lower surface availability of Mn(IV) sites (Fig. 7A), however, the similar activity of M1C1(A), M1C1(B) and M5C1(A) catalysts suggests that surface Mn(II)/Mn(III) atoms enhance the oxidative strength of composite systems, determining a very different activity scale in the CWAO of phenol (Tab. S1 of SI): M1C1(A) ≈ M1C1(B) > M1C3(A) > M5C1(A) > M(A). These findings indicate a decisive influence of the reaction environment on the catalytic activity that depends on the functionality of the various surface sites, as unveiled by the comparison of the CO2 MnOx-site (Fig. 10A) and surface (Fig. 10B) time-yield (Tab. S1 of SI) with the percentage (Fig. 10A’) and surface abundance (Fig. 10B’) of manganese atoms. Although the MnOx-site time-yield values (sty MnOx) in the CWAO of phenol are lower by more than one order of magnitude (5⋅10−5-4⋅10-4 s-1) than in the CO oxidation (1.3⋅10-3-3.5⋅10-3 s-1), both data sets describe analogous decreasing trends with Mn loading (Fig. 10A), mirroring the fraction of Mn(II) atoms of the various catalysts (Fig. 10A’). Similarly to that found for the NO decomposition reaction [36], these structure-activity relationships prove the decisive role of Mn(II) solid solution centres on the reactivity of MnCeOx systems. Indeed, the surface abundance of Mn(II) sites (Fig. 10B’) accounts for the highest surface specific activity (i.e., ssty) of M1C1 catalysts in the CWAO of phenol, also explaining ssty values comparing to M3C1(A) and M5C1(A) catalysts in the CO oxidation (Fig. 10B). At variance, similar exponential-rising trends prove that surface Mn(IV) sites (Fig. 10B’) determine the superior surface CO oxidation activity of the pristine α-MnO2 sample (Fig. 10B) [62]. However, a stronger negative effect of the aqueous environment on the functionality of Mn(IV) active sites is evident from the steeper decrease of the sty MnOx in the CWAO of phenol at high Mn loading (Fig. 10A) [13,31]. Notably, these findings also explain the best performance of the M(A) catalyst in the non-aqueous green selective oxidation of benzyl alcohol [23,63], while the lack of correlations infers a negligible role of Mn(III) atoms, if any, on the reactivity pattern of the studied systems (Fig. 10). 4 Conclusions Nanostructured MnO2 and MnCeOx catalysts were prepared via different protocols of the redox-precipitation technique to assess nature, genesis and functionality of surface active sites. Large surface area and very high oxide dispersion promote the incorporation of Mn(II) ions into ceria solid-solution structures leading to the formation of surface oxygen-vacancies. Surface Mn(IV) and solid solution Mn(II)/O-vacancy are the active sites shaping the oxidative functionality of bare and ceria-promoted MnOx catalysts in gas and liquid phase. Oxygen adsorption onto substitutional solid solution Mn(II)/O-vacancy centres generates very reactive O2-species boosting the performance of MnCeOx catalysts in the CWAO of phenol. Large availability of easily reducible Mn(IV) active sites determines the superior efficiency of the pristine MnO2 system in the gas phase CO oxidation. Preparation method and end application are benchmarks of MnOx catalyst design for environmental applications in gas and liquid phase. CRediT authorship contribution statement Francesco Arena: Writing - original draft, Conceptualization, Methodology, Supervision. Roberto Di Chio: Investigation, Data curation. Alessandra Palella: Investigation. Lorenzo Spadaro: Investigation, Data curation. Leone Frusteri: Investigation, Data curation. Barbara Fazio: Investigation, Data curation. Sara Morandi: Investigation, Data curation, Writing - review & editing. Gianmario Martra: Writing - original draft, Methodology, Supervision. Declaration of Competing Interest The authors declare that they have no known competing financial interests or personal relationships that could have appeared to influence the work reported in this paper. Acknowledgement This work is dedicated to our dear friend and colleague Prof. Gianmario Martra who has passed away on Sept. 29th 2020, leaving a great human and professional void in all of us. Appendix A Supplementary data Supplementary material related to this article can be found, in the online version, at doi:https://doi.org/10.1016/j.apcata.2020.117917. Appendix A Supplementary data The following is Supplementary data to this article: References [1] M. Fekete R.K. Hocking S.L.Y. Chang C. Italiano A.F. Patti F. Arena L. Spiccia En. Environ. Sci. 6 2013 2222 2232 10.1039/C3EE40429C M. Fekete, R.K. Hocking, S.L.Y. Chang, C. Italiano, A.F. Patti, F. Arena, L. Spiccia, “Highly active screen-printed electrocatalysts for water oxidation based on β-manganese oxide”, En. Environ. Sci. 6 (2013) 2222–2232. https://doi.org/10.1039/C3EE40429C [2] R. Pokhrel M.K. Goetz S.E. Shaner X. Wu S.S. Stahl J. Am. Chem. Soc. 137 2015 8384 8387 10.1021/jacs.5b05093 R. Pokhrel, M.K. Goetz, S.E. Shaner, X. Wu, S.S. Stahl, “The best catalyst for water oxidation depends on the oxidation method employed: a case study of manganese oxides”, J. Am. Chem. Soc. 137 (2015) 8384–8387. https://doi.org/10.1021/jacs.5b05093 [3] M. Huynh C. Shi S.J.L. Billinge D.G. Nocera J. Am. Chem. Soc. 137 2015 14887 14904 10.1021/jacs.5b06382 M. Huynh, C. Shi, S.J.L. Billinge, D.G. Nocera, “Nature of activated manganese oxide for oxygen evolution”, J. Am. Chem. Soc. 137 (2015) 14887-14904. https://doi.org/10.1021/jacs.5b06382 [4] K.L. Pickrahn S.W. Park Y. Gorlin Lee H.-B.-R T.F. Jaramillo S.F. Bent Adv. Environ. Mater. 2 2012 1269 1277 10.1002/aenm.201200230 K.L. Pickrahn, S.W. Park, Y. Gorlin, H.-B.-R, Lee, T.F. Jaramillo, S.F. Bent, “Active MnOx electrocatalysts prepared by atomic layer deposition for oxygen evolution and oxygen reduction reactions”, Adv. En. Mater. 2 (2012) 1269–1277. https://doi.org/10.1002/aenm.201200230 [5] K. Selvakumar S.M.S. Kumar R. Thangamuthu K. Ganesan P. Murugan P. Rajput S.N. Jha D. Bhattacharyya J. Phys. Chem. C 119 2015 6604 6618 10.1021/jp5127915 K. Selvakumar, S.M.S. Kumar, R. Thangamuthu, K. Ganesan, P. Murugan, P. Rajput, S.N. Jha, D. Bhattacharyya, “Physiochemical investigation of shape-designed MnO2 nanostructures and their influence on oxygen reduction reaction activity in alkaline solution”, J. Phys. Chem. C 119 (2015) 6604–6618. https://doi.org/10.1021/jp5127915 [6] C.J. Eon D.-Y. Kuo C. Adamo E. Ju Moon S.J. May E.J. Crumlin D.G. Schlom J. Suntivich Nat. Commun. 9 2018 4034 4040 10.1038/s41467-018-06503-8 C.J. Eon, D.-Y. Kuo, C. Adamo, E. Ju Moon, S.J. May, E.J. Crumlin, D.G. Schlom, J. Suntivich, “Tailoring manganese oxide with atomic precision to increase surface site availability for oxygen reduction catalysis”, Nat. Comm. 9 (2018) 4034-4040. https://doi.org/10.1038/s41467-018-06503-8 [7] F.H.B. Lima M.L. Calegaro E.A. Ticianelli J. Electroanal. Chem. 590 2006 152 160 10.1016/j.jelechem.2006.02.029 F.H.B. Lima, M.L. Calegaro, E.A. Ticianelli, “Investigations of the catalytic properties of manganese oxides for the oxygen reduction reaction in alkaline media”, J. Electroanal. Chem. 590 (2006) 152–160. https://doi:10.1016/j.jelechem.2006.02.029 [8] H. Xu N. Yan Z. Qu W. Liu J. Mei W. Huang S. Zhao Environ. Sci. Technol. 51 2017 8879 8892 10.1021/acs.est.6b06079 H. Xu, N. Yan, Z. Qu, W. Liu, J. Mei, W. Huang, S. Zhao, “Gaseous heterogeneous catalytic reactions over Mn-based oxides for environmental applications: a critical review”, Environ. Sci. Technol. 51 (2017) 8879-8892. https://doi:10.1021/acs.est.6b06079 [9] S. Liang F. Teng G. Bulgan R. Zong Y. Zhu J. Phys. Chem. C 112 2008 5307 5315 10.1021/jp0774995 S. Liang, F. Teng, G. Bulgan, R. Zong, Y. Zhu, “Effect of phase structure of MnO2 nanorod catalyst on the activity for CO oxidation”, J. Phys. Chem. C 112 (2008) 5307-5315. https://doi.org/10.1021/jp0774995 [10] K. Li J. Chen Y. Peng W. Lin T. Yan J. Li J. Mater. Chem. A 5 2017 20911 20921 10.1039/C7TA04624C K. Li, J. Chen, Y. Peng, W. Lin, T. Yan, J. Li, “The relationship between surface open cells of α-MnO2 and CO oxidation ability from a surface point of view”, J. Mater. Chem. A 5 (2017) 20911–20921. https://doi.org/10.1039/C7TA04624C [11] J. Gao C. Jia L. Zhang H. Wang Y. Yang S.-F. Hung Y.-Y. Hsu B. Liu J. Catal. 341 2016 82 90 10.1016/j.jcat.2016.06.009 J. Gao, C. Jia, L. Zhang, H. Wang, Y. Yang, S.-F. Hung, Y.-Y. Hsu, B. Liu, “Tuning chemical bonding of MnO2 through transition-metal doping for enhanced CO oxidation”, J. Catal. 341 (2016) 82–90. https://doi.org/10.1016/j.jcat.2016.06.009 [12] K. Frey Y. Jablokov G. Sáfrán J. Osán J. Sajó R. Szukiewicz S. Chenakin N. Kruse J. Catal. 287 2012 30 36 10.1016/j.jcat.2011.11.014 K. Frey, Y. Jablokov, G. Sáfrán, J. Osán, J. Sajó, R. Szukiewicz, S. Chenakin, N. Kruse, “Nanostructured MnOx as highly active catalyst for CO oxidation”, J. Catal. 287 (2012) 30–36. https://doi.org/10.1016/j.jcat.2011.11.014 [13] J.-H. Park D.-C. Kang S.-J. Park C.-H. Shin J. Ind. Eng. Chem. 25 2015 250 257 10.1016/j.jiec.2014.11.001 J.-H. Park, D.-C. Kang, S.-J. Park, C.-H. Shin, “CO oxidation over MnO2 catalysts prepared by a simple redox method: Influence of the Mn (II) precursors”, J. Ind. Eng. Chem. 25 (2015) 250–257. https://doi.org/10.1016/j.jiec.2014.11.001 [14] F. Arena R. Di Chio B. Fazio C. Espro L. Spiccia A. Palella L. Spadaro Appl. Catal. B Environ. 210 2017 14 22 10.1016/j.apcatb.2017.03.049 F. Arena, R. Di Chio, B. Fazio, C. Espro, L. Spiccia, A. Palella, L. Spadaro, “Probing the functionality of nanostructured MnCeOx catalysts in the carbon monoxide oxidation. Part I. Influence of cerium addition on structure and CO oxidation activity”, Appl. Catal. B Environ. 210 (2017) 14–22. https://doi.org/10.1016/j.apcatb.2017.03.049 [15] J. Xu Y.-Q. Deng Y. Luo W. Mao X.-J. Yang Y.-F. Han J. Catal. 300 2013 225 234 10.1016/j.jcat.2013.01.010 J. Xu, Y.-Q. Deng, Y. Luo, W. Mao, X.-J. Yang, Y.-F. Han, “Operando Raman spectroscopy and kinetic study of low-temperature CO oxidation on α-Mn2O3 nanocatalyst”, J. Catal. 300 (2013) 225-234. https://doi.org/10.1016/j.jcat.2013.01.010 [16] S. Rong P. Zhang F. Liu Y. Yang ACS Catal. 8 2018 3435 3446 10.1021/acscatal.8b00456 S. Rong, P. Zhang, F. Liu, Y. Yang, “Engineering crystal facet of α-MnO2 nanowire for highly efficient catalytic oxidation of carcinogenic airborne formaldehyde”, ACS Catal. 8 (2018) 3435-3446. https://doi.org/10.1021/acscatal.8b00456 [17] D. Li J. Yang W. Tang X. Wu L. Wei Y. Chen RSC Adv. 4 2014 26796 26803 10.1039/C4RA01146E D. Li, J. Yang, W. Tang, X. Wu, L. Wei, and Y. Chen, “Controlled synthesis of hierarchical MnO2 microspheres with hollow interiors for the removal of benzene”, RSC Adv. 4 (2014) 26796–26803. https://doi.org/10.1039/C4RA01146E [18] Y. Yang Y. Li M. Mao M. Zeng X. Zhao ACS Appl. Mater. Interfaces 9 2017 2350 2357 10.1021/acsami.6b12819 Y. Yang, Y. Li, M. Mao, M. Zeng, and X. Zhao, “UV–Visible–Infrared light driven thermocatalysis for environmental purification on ramsdellite MnO2 hollow spheres considerably promoted by a novel photoactivation”, ACS Appl. Mater. Interf. 9 (2017) 2350–2357. https://doi.org/10.1021/acsami.6b12819 [19] L. Zhu J. Wang S. Rong H. Wang P. Zhang Appl. Catal. B: Environ. 211 2017 212 221 10.1016/j.apcatb.2017.04.025 L. Zhu, J. Wang, S. Rong, H. Wang, and P. Zhang, “Cerium modified birnessite-type MnO2 for gaseous formaldehyde oxidation at low temperature”, Appl. Catal. B: Environ. 211 (2017) 212–221. https://doi.org/10.1016/j.apcatb.2017.04.025 [20] C. Liu J.-W. Shi C. Gao C. Niu Appl. Catal. A Gen. 522 2016 54 69 10.1016/j.apcata.2016.04.023 C. Liu, J.-W. Shi, C. Gao, C. Niu, “Manganese oxide-based catalysts for low-temperature selective catalytic reduction of NOx with NH3: A review”, Appl. Catal. A: Gen. 522 (2016) 54-69. https://doi.org/10.1016/j.apcata.2016.04.023 [21] S. Ming P. Wang P. Liu J. Duan F. Mei L. Pang Z. Chen T. Li Chem. Eng. J. 379 2019 122287 10.1016/j.cej.2019.122287 S. Ming, P. Wang, P. Liu, J. Duan, F. Mei, L. Pang, Z. Chen, T. Li, “Promotional effect of metal cations doping on OMS-2 catalysts for NH3-SCR reaction”, Chem. Eng. J. 379 (2019) 122287. https://doi.org/10.1016/j.cej.2019.122287 [22] I. Atribak A. Bueno-López A. García-García P. Navarro D. Frías M. Montes Appl. Catal. B Environ. 93 2010 267 273 10.1016/j.apcatb.2009.09.038 I. Atribak, A. Bueno-López, A. García-García, P. Navarro, D. Frías, M. Montes, “Catalytic activity for soot combustion of birnessite and cryptomelane”, Appl. Catal. B Environ. 93 (2010) 267–273. https://doi.org/10.1016/j.apcatb.2009.09.038 [23] F. Arena B. Gumina A.F. Lombardo C. Espro A. Patti L. Spadaro L. Spiccia Appl. Catal. B Environ. 162 2015 260 267 10.1016/j.apcatb.2014.06.054 F. Arena, B. Gumina, A.F. Lombardo, C. Espro, A. Patti, L. Spadaro, L. Spiccia, “Nanostructured MnOx catalysts in the liquid phase selective oxidation of benzyl alcohol with oxygen: Part I. Effects of Ce and Fe addition on structure and reactivity”, Appl. Catal. B Environ. 162 (2015) 260–267. https://doi.org/10.1016/j.apcatb.2014.06.054 [24] S. Biswas A.S. Poyraz Y. Meng C.-H. Kuo C. Guild M. Tripp S.L. Suib Appl. Catal. B Environ. 165 2015 731 741 10.1016/j.apcatb.2014.10.055 S. Biswas, A.S. Poyraz, Y. Meng, C.-H. Kuo, C. Guild, M. Tripp, S.L. Suib, “Ion induced promotion of activity enhancement of mesoporous manganese oxides for aerobic oxidation reactions”, Appl. Catal. B Environ. 165 (2015) 731–741. https://doi.org/10.1016/j.apcatb.2014.10.055 [25] E. Hayashi Y. Yamaguchi K. Kamata N. Tsunoda Y. Kumagai F. Oba M. Hara J. Am. Chem. Soc. 141 2019 890 900 10.1021/jacs.8b09917 E. Hayashi, Y. Yamaguchi, K. Kamata, N. Tsunoda, Y. Kumagai, F. Oba and M. Hara, “Effect of MnO2 Crystal Structure on Aerobic Oxidation of 5‑Hydroxymethylfurfural to 2,5-Furandicarboxylic Acid”, J. Am. Chem. Soc., 141 (2019) 890-900. https://doi.org/10.1021/jacs.8b09917 [26] F. Arena Catal. Sci. Technol. 4 2014 1890 1898 10.1039/C4CY00022F F. Arena, “Multipurpose composite MnCeOx catalysts for environmental applications”, Catal. Sci. Technol. 4 (2014) 1890–1898. https://doi.org/10.1039/C4CY00022F [27] F. Arena G. Trunfio B. Fazio J. Negro L. Spadaro J. Phys. Chem. C 113 2009 2822 28299 10.1021/jp8068249 F. Arena, G. Trunfio, B. Fazio, J. Negro, L. Spadaro, “Nanosize effects, physicochemical properties and catalytic oxidation pattern of the redox-precipitated MnCeOx system”, J. Phys. Chem. C 113 (2009) 2822–28299. https://doi.org/10.1021/jp8068249 [28] P. Venkataswamy K.N. Rao D. Jampaiah B.M. Reddy Appl. Catal. B Environ. 162 2015 122 132 10.1016/j.apcatb.2014.06.038 P. Venkataswamy, K.N. Rao, D. Jampaiah, B. M. Reddy, “Nanostructured manganese doped ceria solid solutions for CO oxidation at lower temperatures”, Appl. Catal. B Environ. 162 (2015) 122–132. https://doi.org/10.1016/j.apcatb.2014.06.038 [29] F. Arena R. Di Chio C. Espro B. Fazio A. Palella L. Spadaro Top. Catal. 62 2019 259 265 10.1007/s11244-018-1113-0 F. Arena, R. Di Chio, C. Espro, B. Fazio, A. Palella, L. Spadaro, “A New Class of MnCeOx Materials for the Catalytic Gas Exhausts Emission Control: A Study of the CO Model Compound Oxidation”, Topics Catal. 62 (2019) 259–265. https://doi.org/10.1007/s11244-018-1113-0 [30] Z. Zou M. Meng Y. Zha J. Phys. Chem. C 114 2010 468 477 10.1021/jp908721a Z. Zou, M. Meng, Y. Zha, “Surfactant-assisted synthesis, characterizations, and catalytic oxidation mechanisms of the mesoporous MnOx-CeO2 and Pd/MnOx-CeO2 catalysts used for CO and C3H8 oxidation”, J. Phys. Chem. C 114 (2010) 468–477. https://doi.org/10.1021/jp908721a [31] X.-m. Zhang Y.Q. Deng P. Tian H.-H. Shang J. Xu Y.-F. Han Appl. Catal. B Environ. 191 2016 179 191 10.1016/j.apcatb.2016.03.030 X.-m. Zhang, Y.Q. Deng, P. Tian, H.-H. Shang, J. Xu, Y.-F. Han, “Dynamic active sites over binary oxide catalysts: In situ/operando spectroscopic study of low-temperature CO oxidation over MnOx-CeO2 catalysts”, Appl. Catal. B Environ. 191 (2016) 179–191. https://doi.org/10.1016/j.apcatb.2016.03.030 [32] M.T.N. Dinh J.-M. Giraudon A.M. Vandenbroucke R. Morent N. De Geyter J.-F. Lamonier Appl. Catal. B Environ. 172–173 2015 65 72 10.1016/j.apcatb.2015.02.013 M.T. N. Dinh, J.-M. Giraudon, A.M. Vandenbroucke, R. Morent, N. De Geyter, J.-F. Lamonier, “Post plasma-catalysis for total oxidation of trichloroethylene over Ce–Mn based oxides synthesized by a modified ‘redox-precipitation route”, Appl. Catal. B Environ. 172–173 (2015) 65–72. https://doi.org/10.1016/j.apcatb.2015.02.013 [33] P. Zhang H. Lu Y. Zhou L. Zhang Z. Wu S. Yang H. Shi Q. Zhu Y. Chen S. Dai Nat. Commun. 6 2015 1 10 10.1038/ncomms9446 P. Zhang. H. Lu, Y. Zhou, L. Zhang, Z. Wu, S. Yang, H. Shi, Q. Zhu, Y. Chen, S. Dai, “Mesoporous MnCeOx solid solutions for low temperature and selective oxidation of hydrocarbons”, Nat. Comm. 6 (2015) 1–10. https://doi.org/10.1038/ncomms9446 [34] Y. Wu Y. Zhang M. Liu Z. Ma Catal. Today 153 2010 170 175 10.1016/j.cattod.2010.01.064 Y. Wu, Y. Zhang, M. Liu, Z. Ma, “Complete catalytic oxidation of o-xylene over Mn–Ce oxides prepared using a redox-precipitation method”, Catal. Today 153 (2010) 170–175. https://doi.org/10.1016/j.cattod.2010.01.064 [35] H. He X. Liu S. Li Z. Wu J. Gao J. Wu W. Wen D. Ye M. Fu Appl. Catal. B Environ. 223 2018 134 142 10.1016/j.apcatb.2017.08.084 H. He, X. Liu, S. Li, Z. Wu, J. Gao, J. Wu, W. Wen, D. Ye, M. Fu, “The key surface species and oxygen vacancies in MnOx(0.4)-CeO2 toward repeated soot oxidation”, Appl. Catal. B Environ. 223 (2018) 134–142. https://doi.org/10.1016/j.apcatb.2017.08.084 [36] W.-J. Hong S. Iwamoto S. Hosokawa K. Wada H. Kanai M. Inoue J. Catal. 277 2011 208 216 10.1016/j.jcat.2010.11.007 W.-J. Hong, S. Iwamoto, S. Hosokawa, K. Wada, H. Kanai, M. Inoue, “Effect of Mn content on physical properties of CeOx–MnOy support and BaO–CeOx–MnOy catalysts for direct NO decomposition”, J. Catal. 277 (2011) 208–216. https://doi.org/10.1016/j.jcat.2010.11.007 [37] L. Geng B. Chen J. Yang C. Shui S. Ye J. Fu N. Zhang J. Xie B. Chen Appl. Catal. A Gen. 604 2020 117774 10.1016/j.apcata.2020.117774 L. Geng, B. Chen, J. Yang, C. Shui, S. Ye, J. Fu, N. Zhang, J. Xie, B. Chen, “Synergistic effect between Mn and Ce for active and stable catalytic wet air oxidation of phenol over MnCeOx”, Appl. Catal. A General 604 (2020) 117774. https://doi.org/10.1016/j.apcata.2020.117774 [38] F. Arena J. Negro A. Parmaliana L. Spadaro G. Trunfio Ind. Eng. Chem. Res. 46 2007 6724 6731 10.1021/ie0701118 F. Arena, J. Negro, A. Parmaliana, L. Spadaro, G. Trunfio, “Improved MnCeOx systems for the catalytic wet oxidation (CWO) of phenol in wastewater streams,” Ind. Eng. Chem. Res. 46 (2007) 6724–6731. https://doi.org/10.1021/ie0701118 [39] F. Arena G. Trunfio J. Negro L. Spadaro Appl. Catal. B Environ. 85 2008 40 47 10.1016/j.apcatb.2008.06.020 F. Arena, G. Trunfio, J. Negro, L. Spadaro, “Optimization of the MnCeOx system for the catalytic wet oxidation of phenol with oxygen (CWAO)”, Appl. Catal. B Environ. 85 (2008) 40–47. https://doi.org/10.1016/j.apcatb.2008.06.020 [40] F. Larachi Top. Catal. 33 2005 109 134 10.1007/s11244-005-2518-0 F. Larachi, “Catalytic wet oxidation: micro–meso–macro methodology from catalyst synthesis to reactor design”, Topics Catal. 33 (2005) 109-134. https://doi.org/10.1007/s11244-005-2518-0 [41] G. Elmaci D. Ozer B. Zumreoglu-Karan Catal. Commun. 89 2017 56 59 10.1016/j.catcom.2016.10.027 G. Elmaci, D. Ozer, B. Zumreoglu-Karan, “Liquid phase aerobic oxidation of benzyl alcohol by using manganese ferrite supported-manganese oxide nanocomposite catalyst”, Catal. Comm. 89 (2017) 56–59. https://doi.org/10.1016/j.catcom.2016.10.027 [42] G. Elmacı G. Ozgenç P. Kurz B. Zumreoglu-Karan Sustain. Energy Fuels 4 2020 3157 3166 10.1039/d0se00301h G. Elmacı, G. Ozgenç, P. Kurz, B. Zumreoglu-Karan, “Enhanced water oxidation performances of birnessite and magnetic birnessite nanocomposites by transition metal ion doping”, Sustainable Energy Fuels 2020, 4, 3157-3166. https://doi.org/10.1039/d0se00301h [43] F.W. Boyom-Tatchemo F. Devred G. Ndiffo-Yemeli S. Laminsi E.M. Gaigneaux Appl. Catal. B Environ. 260 2020 118159 10.1016/j.apcatb.2019.118159 F.W. Boyom-Tatchemo, F. Devred, G. Ndiffo-Yemeli, S. Laminsi, E.M. Gaigneaux, “Plasma-induced redox reactions synthesis of nanosized α- and γ- and δ-MnO2 catalysts for dye degradation” Appl. Catal. B Environ. 260 (2020) 118159. https://doi.org/10.1016/j.apcatb.2019.118159 [44] W. Li X. Cui R. Zeng G. Du Z. Sun R. Zheng S.P. Ringer S.-X. Dou Sci. Rep. 5 1-8 2015 8987 10.1038/srep08987 W. Li, X. Cui, R. Zeng, G. Du, Z. Sun, R. Zheng, S.P. Ringer, S.-X. Dou, “Performance modulation of α-MnO2 nanowires by crystal facet engineering”, Sci. Rep. 5 (2015) 8987 (1-8). https://doi.org/10.1038/srep08987 [45] L.-C. Hsu M.-K. Tsai Y.-H. Lu H.-T. Chen J. Phys. Chem. C 117 2013 433 441 10.1021/jp310457g L.-C. Hsu, M.-K. Tsai, Y.-H. Lu, H.-T. Chen, “Computational investigation of CO adsorption and oxidation on Mn/CeO2 (111) surface”, J. Phys. Chem. C 117 (2013) 433-441. https://doi.org/10.1021/jp310457g [46] W. Cen Y. Liu Z. Wu H. Wang X. Weng Phys. Chem. Chem. Phys. 14 2012 5769 5777 10.1039/C2CP00061J W. Cen, Y. Liu, Z. Wu, H. Wang, X. Weng, “A theoretic insight into the catalytic activity promotion of CeO2 surfaces by Mn doping”, Phys. Chem. Chem. Phys. 14 (2012) 5769-5777. https://doi.org/10.1039/C2CP00061J [47] X. Zhang J. Wei X. Liu W. Liu C. Zhang Y. Yang Eur. J. Inorg. Chem. 25 2013 4443 4449 10.1002/ejic.201300370 X. Zhang, J. Wei, X. Liu, W. Liu, C. Zhang, Y. Yang, “One‐Pot Synthesis of Mn‐Doped CeO2 Nanospheres for CO Oxidation”, Eur. J. Inorg. Chem. 25 (2013) 4443-4449. https://doi.org/10.1002/ejic.201300370 [48] D. Garcia Pintos A. Juan B. Irigoyen J. Phys. Chem. C 117 2013 18063 18073 10.1021/jp403911b D. Garcia Pintos, A. Juan, B. Irigoyen, “Mn-doped CeO2: DFT+U study of a catalyst for oxidation reactions”, J. Phys. Chem. C. 117 (2013) 18063-18073. https://doi.org/10.1021/jp403911b [49] W. Yang Y. Zhu F. You L. Yan Y. Ma C. Lu P. Gao Q. Hao W. Li Appl. Catal. B: Environ. 233 2018 184 193 10.1016/j.apcatb.2018.03.107 W. Yang, Y. Zhu, F. You, L. Yan, Y. Ma, C. Lu, P. Gao, Q. Hao, W. Li, “Insights into the surface-defect dependence of molecular oxygen activation over birnessite-type MnO2”, Appl. Catal. B: Environ. 233 (2018) 184-193. https://doi.org/10.1016/j.apcatb.2018.03.107 [50] F. Arena C. Italiano G. Drago Ferrante G. Trunfio L. Spadaro Appl. Catal. B: Environ. 144 2014 292 299 10.1016/j.apcatb.2013.07.025 F. Arena, C. Italiano, G. Drago Ferrante, G. Trunfio and L. Spadaro, “A mechanistic assessment of the wet air oxidation activity of MnCeOx catalyst toward toxic and refractory organic pollutants”, Appl. Catal. B: Environ. 144 (2014) 292-299. https://doi.org/10.1016/j.apcatb.2013.07.025 [51] T. Gao M. Glerup F. Krumeich R. Nesper H. Fjellvåg P. Norby J. Phys. Chem. C. 112 2008 13134 13140 10.1021/jp804924f T. Gao, M. Glerup, F. Krumeich, R. Nesper, H. Fjellvåg, P. Norby, “Microstructures and spectroscopic properties of cryptomelane-type manganese dioxide nanofibers,” J. Phys. Chem. C. 112 (2008) 13134–13140. https://doi.org/10.1021/jp804924f [52] Y.-F. Li S.-C. Zhu Z.-P. Liu J. Am. Chem. Soc. 138 2016 5371 5379 10.1021/jacs.6b01768 Y.-F. Li, S.-C. Zhu, Z.-P. Liu, “Reaction network of layer-to-tunnel transition of MnO2”, J. Am. Chem. Soc. 138 (2016) 5371−5379. https://doi.org/10.1021/jacs.6b01768 [53] C. Julien M. Massot R. Baddour-Hadjean S. Franger S. Bach J.P. Pereira-Ramos Sol. St. Ionics 159 2003 345 356 10.1016/S0167-2738(03)00035-3 C. Julien, M. Massot, R. Baddour-Hadjean, S. Franger, S. Bach, J.P. Pereira-Ramos, “Raman spectra of birnessite manganese dioxides”, Sol. St. Ionics 159 (2003) 345–356. https://doi.org/10.1016/S0167-2738(03)00035-3 [54] X. Wang Y. Li Chem. Eur. J. 9 2003 300 306 10.1002/chem.200390024 X. Wang, Y. Li, “Synthesis and formation mechanism of manganese dioxide nanowires/nanorods”, Chem. Eur. J., 9 (2003) 300-306. https://doi.org/10.1002/chem.200390024 [55] B. Fazio L. Spadaro G. Trunfio J. Negro F. Arena J. Raman Spectrosc. 42 2011 1583 1588 10.1002/jrs.2897 B. Fazio, L. Spadaro, G. Trunfio, J. Negro, F. Arena, “Raman scattering of MnOx-CeOx composite catalysts: structure aspects and laser-heating effects”, J. Raman Spectr. 42 (2011) 1583-1588. https://doi.org/10.1002/jrs.2897 [56] F. Arena G. Trunfio J. Negro B. Fazio L. Spadaro Chem. Mater. 19 2007 2269 2276 10.1021/cm070198n F. Arena, G. Trunfio, J. Negro, B. Fazio, L. Spadaro, “Basic evidence of the molecular dispersion of MnCeOx catalysts synthesized via a novel redox-precipitation route,” Chem. Mater. 19 (2007) 2269–2276. https://doi.org/10.1021/cm070198n [57] J.C. Lavalley Catal. Today 27 1996 377 401 J.C. Lavalley, “Infrared spectrometric studies of the surface basicity of metal oxides and zeolites using adsorbed probe molecules”, Catal. Today 27 (1996) 377-401. [58] C. Laberty C. Marquez-Alvarez C. Drouet P. Alphonse C. Mirodatos J. Catal. 198 2001 266 276 10.1006/jcat.2000.3110 C. Laberty, C. Marquez-Alvarez, C. Drouet, P. Alphonse, C. Mirodatos, “CO oxidation over nonstechiometric nickel manganite spinels”, J. Catal. 198 (2001) 266-276. https://doi.org/10.1006/jcat.2000.3110 [59] C. Li Y. Sakata T. Arai K. Domen K.-I. Maruya T. Onishi J. Chem. Soc., Faraday Trans. I 85 1989 929 943 10.1039/F19898500929 C. Li, Y. Sakata, T. Arai, K. Domen, K.-I. Maruya, T. Onishi, “Carbon monoxide and carbon dioxide adsorption on cerium oxide studied by Fourier-transform infrared spectroscopy”, J. Chem. Soc., Faraday Trans. I 85 (1989) 929-943. https://doi.org/10.1039/F19898500929 [60] G. Busca V. Lorenzelli Mater. Chem. 7 1982 89 126 G. Busca, V. Lorenzelli, “Infrared spectroscopic identification of species arising from reactive adsorption of carbon oxides on metal oxide surfaces”, Mater. Chem. 7 (1982) 89-126. [61] F. Arena R. Di Chio L. Filiciotto G. Trunfio C. Espro A. Palella A. Patti L. Spadaro Appl. Catal. B: Environ. 218 2017 803 809 10.1016/j.apcatb.2017.07.018 F. Arena, R. Di Chio, L. Filiciotto, G. Trunfio, C. Espro, A. Palella, A. Patti, L. Spadaro, “Probing the functionality of nanostructured MnCeOx catalysts in the carbon monoxide oxidation. Part II. Reaction mechanism and kinetic modelling”, Appl. Catal. B: Environ. 218 (2017) 803-809. https://doi.org/10.1016/j.apcatb.2017.07.018 [62] F. Arena R. Di Chio C. Espro A. Palella L. Spadaro React. Chem. Eng. 3 2018 293 300 10.1039/C8RE00026C F. Arena, R. Di Chio, C. Espro, A. Palella, L. Spadaro, “A definitive assessment of the CO oxidation pattern of a nanocomposite MnCeOx catalyst”, React. Chem. Eng. 3 (2018) 293-300. https://doi.org/10.1039/C8RE00026C [63] L. Gueci F. Ferrante A. Prestianni R. Di Chio A.F. Patti D. Duca F. Arena Inorg. Chim. Acta 511 2020 119812 10.1016/j.ica.2020.119812 L. Gueci, F. Ferrante, A. Prestianni, R. Di Chio, A.F. Patti, D. Duca, F. Arena. “DFT insights into the oxygen-assisted selective oxidation of benzyl alcohol on manganese dioxide catalysts”, Inorg. Chim. Acta 511 (2020) 119812. https://doi.org/10.1016/j.ica.2020.119812",
      "scopus-id": "85096966258",
      "coredata": {
        "eid": "1-s2.0-S0926860X2030510X",
        "dc:description": "Bare and ceria-promoted MnOx catalysts (0 ≤ χMn≤1) were prepared by redox-precipitation reactions of Mn(VII), Mn(II) and Ce(III) or Ce(IV) precursors in slightly acidic (pH, 4.5) or basic (pH, 8.0) environment to assess genesis, nature, and functionality of surface active sites. Both synthesis protocols yield nanostructured materials with large surface area and exposure of Mn sites, featuring high activity in the CO oxidation and the phenol wet-air-oxidation (CWAO) model reactions (T, 423 K). High oxide dispersion prompts an extensive incorporation of Mn(II) ions into ceria substitutional solid-solution structures, forming oxygen-vacancies with stronger oxidation activity than surface Mn(IV) sites. Basic structure-activity relationships indicate that the superior CO oxidation performance of the pristine α-MnO2 system relies on large exposure of very reducible Mn(IV) active sites, while O2-adsorption onto Mn(II)/O-vacancy active centres generates very reactive surface oxygen-species boosting the efficiency of composite MnCeOx catalysts in the CWAO of phenol.",
        "openArchiveArticle": "false",
        "prism:coverDate": "2021-01-25",
        "openaccessUserLicense": null,
        "prism:aggregationType": "Journal",
        "prism:url": "https://api.elsevier.com/content/article/pii/S0926860X2030510X",
        "dc:creator": [
          {
            "@_fa": "true",
            "$": "Arena, Francesco"
          },
          {
            "@_fa": "true",
            "$": "Di Chio, Roberto"
          },
          {
            "@_fa": "true",
            "$": "Palella, Alessandra"
          },
          {
            "@_fa": "true",
            "$": "Spadaro, Lorenzo"
          },
          {
            "@_fa": "true",
            "$": "Frusteri, Leone"
          },
          {
            "@_fa": "true",
            "$": "Fazio, Barbara"
          },
          {
            "@_fa": "true",
            "$": "Morandi, Sara"
          },
          {
            "@_fa": "true",
            "$": "Martra, Gianmario"
          }
        ],
        "link": [
          {
            "@_fa": "true",
            "@rel": "self",
            "@href": "https://api.elsevier.com/content/article/pii/S0926860X2030510X"
          },
          {
            "@_fa": "true",
            "@rel": "scidir",
            "@href": "https://www.sciencedirect.com/science/article/pii/S0926860X2030510X"
          }
        ],
        "dc:format": "application/json",
        "openaccessType": null,
        "pii": "S0926-860X(20)30510-X",
        "prism:volume": "610",
        "articleNumber": "117917",
        "prism:publisher": "Elsevier B.V.",
        "dc:title": "Tailoring manganese oxide catalysts for the total oxidation of pollutants in gas and liquid phase",
        "prism:copyright": "© 2020 Elsevier B.V. All rights reserved.",
        "openaccess": "0",
        "prism:issn": "0926860X",
        "dcterms:subject": [
          {
            "@_fa": "true",
            "$": "Manganese oxide catalysts"
          },
          {
            "@_fa": "true",
            "$": "Active sites"
          },
          {
            "@_fa": "true",
            "$": "CO oxidation"
          },
          {
            "@_fa": "true",
            "$": "Phenol wet air oxidation (CWAO)"
          },
          {
            "@_fa": "true",
            "$": "Structure-activity relationships"
          },
          {
            "@_fa": "true",
            "$": "Catalyst design"
          }
        ],
        "openaccessArticle": "false",
        "prism:publicationName": "Applied Catalysis A: General",
        "openaccessSponsorType": null,
        "prism:pageRange": "117917",
        "pubType": "fla",
        "prism:coverDisplayDate": "25 January 2021",
        "prism:doi": "10.1016/j.apcata.2020.117917",
        "prism:startingPage": "117917",
        "dc:identifier": "doi:10.1016/j.apcata.2020.117917",
        "openaccessSponsorName": null
      },
      "objects": {
        "object": [
          {
            "@category": "standard",
            "@height": "438",
            "@width": "566",
            "@_fa": "true",
            "$": "https://api.elsevier.com/content/object/eid/1-s2.0-S0926860X2030510X-gr8.jpg?httpAccept=%2A%2F%2A",
            "@multimediatype": "JPEG image file",
            "@type": "IMAGE-DOWNSAMPLED",
            "@size": "47758",
            "@ref": "gr8",
            "@mimetype": "image/jpeg"
          },
          {
            "@category": "standard",
            "@height": "228",
            "@width": "566",
            "@_fa": "true",
            "$": "https://api.elsevier.com/content/object/eid/1-s2.0-S0926860X2030510X-gr9.jpg?httpAccept=%2A%2F%2A",
            "@multimediatype": "JPEG image file",
            "@type": "IMAGE-DOWNSAMPLED",
            "@size": "35968",
            "@ref": "gr9",
            "@mimetype": "image/jpeg"
          },
          {
            "@category": "standard",
            "@height": "695",
            "@width": "566",
            "@_fa": "true",
            "$": "https://api.elsevier.com/content/object/eid/1-s2.0-S0926860X2030510X-gr10.jpg?httpAccept=%2A%2F%2A",
            "@multimediatype": "JPEG image file",
            "@type": "IMAGE-DOWNSAMPLED",
            "@size": "57328",
            "@ref": "gr10",
            "@mimetype": "image/jpeg"
          },
          {
            "@category": "standard",
            "@height": "838",
            "@width": "566",
            "@_fa": "true",
            "$": "https://api.elsevier.com/content/object/eid/1-s2.0-S0926860X2030510X-gr4.jpg?httpAccept=%2A%2F%2A",
            "@multimediatype": "JPEG image file",
            "@type": "IMAGE-DOWNSAMPLED",
            "@size": "213295",
            "@ref": "gr4",
            "@mimetype": "image/jpeg"
          },
          {
            "@category": "standard",
            "@height": "416",
            "@width": "340",
            "@_fa": "true",
            "$": "https://api.elsevier.com/content/object/eid/1-s2.0-S0926860X2030510X-gr5.jpg?httpAccept=%2A%2F%2A",
            "@multimediatype": "JPEG image file",
            "@type": "IMAGE-DOWNSAMPLED",
            "@size": "28417",
            "@ref": "gr5",
            "@mimetype": "image/jpeg"
          },
          {
            "@category": "standard",
            "@height": "374",
            "@width": "566",
            "@_fa": "true",
            "$": "https://api.elsevier.com/content/object/eid/1-s2.0-S0926860X2030510X-gr6.jpg?httpAccept=%2A%2F%2A",
            "@multimediatype": "JPEG image file",
            "@type": "IMAGE-DOWNSAMPLED",
            "@size": "63361",
            "@ref": "gr6",
            "@mimetype": "image/jpeg"
          },
          {
            "@category": "standard",
            "@height": "348",
            "@width": "566",
            "@_fa": "true",
            "$": "https://api.elsevier.com/content/object/eid/1-s2.0-S0926860X2030510X-gr7.jpg?httpAccept=%2A%2F%2A",
            "@multimediatype": "JPEG image file",
            "@type": "IMAGE-DOWNSAMPLED",
            "@size": "36737",
            "@ref": "gr7",
            "@mimetype": "image/jpeg"
          },
          {
            "@category": "standard",
            "@height": "442",
            "@width": "340",
            "@_fa": "true",
            "$": "https://api.elsevier.com/content/object/eid/1-s2.0-S0926860X2030510X-gr1.jpg?httpAccept=%2A%2F%2A",
            "@multimediatype": "JPEG image file",
            "@type": "IMAGE-DOWNSAMPLED",
            "@size": "40862",
            "@ref": "gr1",
            "@mimetype": "image/jpeg"
          },
          {
            "@category": "standard",
            "@height": "477",
            "@width": "340",
            "@_fa": "true",
            "$": "https://api.elsevier.com/content/object/eid/1-s2.0-S0926860X2030510X-gr2.jpg?httpAccept=%2A%2F%2A",
            "@multimediatype": "JPEG image file",
            "@type": "IMAGE-DOWNSAMPLED",
            "@size": "27202",
            "@ref": "gr2",
            "@mimetype": "image/jpeg"
          },
          {
            "@category": "standard",
            "@height": "245",
            "@width": "220",
            "@_fa": "true",
            "$": "https://api.elsevier.com/content/object/eid/1-s2.0-S0926860X2030510X-ga1.jpg?httpAccept=%2A%2F%2A",
            "@multimediatype": "JPEG image file",
            "@type": "IMAGE-DOWNSAMPLED",
            "@size": "18665",
            "@ref": "ga1",
            "@mimetype": "image/jpeg"
          },
          {
            "@category": "standard",
            "@height": "244",
            "@width": "341",
            "@_fa": "true",
            "$": "https://api.elsevier.com/content/object/eid/1-s2.0-S0926860X2030510X-gr3.jpg?httpAccept=%2A%2F%2A",
            "@multimediatype": "JPEG image file",
            "@type": "IMAGE-DOWNSAMPLED",
            "@size": "31447",
            "@ref": "gr3",
            "@mimetype": "image/jpeg"
          },
          {
            "@category": "thumbnail",
            "@height": "164",
            "@width": "212",
            "@_fa": "true",
            "$": "https://api.elsevier.com/content/object/eid/1-s2.0-S0926860X2030510X-gr8.sml?httpAccept=%2A%2F%2A",
            "@multimediatype": "GIF image file",
            "@type": "IMAGE-THUMBNAIL",
            "@size": "7823",
            "@ref": "gr8",
            "@mimetype": "image/gif"
          },
          {
            "@category": "thumbnail",
            "@height": "88",
            "@width": "219",
            "@_fa": "true",
            "$": "https://api.elsevier.com/content/object/eid/1-s2.0-S0926860X2030510X-gr9.sml?httpAccept=%2A%2F%2A",
            "@multimediatype": "GIF image file",
            "@type": "IMAGE-THUMBNAIL",
            "@size": "7452",
            "@ref": "gr9",
            "@mimetype": "image/gif"
          },
          {
            "@category": "thumbnail",
            "@height": "163",
            "@width": "133",
            "@_fa": "true",
            "$": "https://api.elsevier.com/content/object/eid/1-s2.0-S0926860X2030510X-gr10.sml?httpAccept=%2A%2F%2A",
            "@multimediatype": "GIF image file",
            "@type": "IMAGE-THUMBNAIL",
            "@size": "4980",
            "@ref": "gr10",
            "@mimetype": "image/gif"
          },
          {
            "@category": "thumbnail",
            "@height": "163",
            "@width": "110",
            "@_fa": "true",
            "$": "https://api.elsevier.com/content/object/eid/1-s2.0-S0926860X2030510X-gr4.sml?httpAccept=%2A%2F%2A",
            "@multimediatype": "GIF image file",
            "@type": "IMAGE-THUMBNAIL",
            "@size": "11909",
            "@ref": "gr4",
            "@mimetype": "image/gif"
          },
          {
            "@category": "thumbnail",
            "@height": "164",
            "@width": "134",
            "@_fa": "true",
            "$": "https://api.elsevier.com/content/object/eid/1-s2.0-S0926860X2030510X-gr5.sml?httpAccept=%2A%2F%2A",
            "@multimediatype": "GIF image file",
            "@type": "IMAGE-THUMBNAIL",
            "@size": "4614",
            "@ref": "gr5",
            "@mimetype": "image/gif"
          },
          {
            "@category": "thumbnail",
            "@height": "145",
            "@width": "219",
            "@_fa": "true",
            "$": "https://api.elsevier.com/content/object/eid/1-s2.0-S0926860X2030510X-gr6.sml?httpAccept=%2A%2F%2A",
            "@multimediatype": "GIF image file",
            "@type": "IMAGE-THUMBNAIL",
            "@size": "12563",
            "@ref": "gr6",
            "@mimetype": "image/gif"
          },
          {
            "@category": "thumbnail",
            "@height": "135",
            "@width": "219",
            "@_fa": "true",
            "$": "https://api.elsevier.com/content/object/eid/1-s2.0-S0926860X2030510X-gr7.sml?httpAccept=%2A%2F%2A",
            "@multimediatype": "GIF image file",
            "@type": "IMAGE-THUMBNAIL",
            "@size": "7465",
            "@ref": "gr7",
            "@mimetype": "image/gif"
          },
          {
            "@category": "thumbnail",
            "@height": "164",
            "@width": "126",
            "@_fa": "true",
            "$": "https://api.elsevier.com/content/object/eid/1-s2.0-S0926860X2030510X-gr1.sml?httpAccept=%2A%2F%2A",
            "@multimediatype": "GIF image file",
            "@type": "IMAGE-THUMBNAIL",
            "@size": "6472",
            "@ref": "gr1",
            "@mimetype": "image/gif"
          },
          {
            "@category": "thumbnail",
            "@height": "164",
            "@width": "117",
            "@_fa": "true",
            "$": "https://api.elsevier.com/content/object/eid/1-s2.0-S0926860X2030510X-gr2.sml?httpAccept=%2A%2F%2A",
            "@multimediatype": "GIF image file",
            "@type": "IMAGE-THUMBNAIL",
            "@size": "4630",
            "@ref": "gr2",
            "@mimetype": "image/gif"
          },
          {
            "@category": "thumbnail",
            "@height": "164",
            "@width": "147",
            "@_fa": "true",
            "$": "https://api.elsevier.com/content/object/eid/1-s2.0-S0926860X2030510X-ga1.sml?httpAccept=%2A%2F%2A",
            "@multimediatype": "GIF image file",
            "@type": "IMAGE-THUMBNAIL",
            "@size": "15570",
            "@ref": "ga1",
            "@mimetype": "image/gif"
          },
          {
            "@category": "thumbnail",
            "@height": "156",
            "@width": "219",
            "@_fa": "true",
            "$": "https://api.elsevier.com/content/object/eid/1-s2.0-S0926860X2030510X-gr3.sml?httpAccept=%2A%2F%2A",
            "@multimediatype": "GIF image file",
            "@type": "IMAGE-THUMBNAIL",
            "@size": "14923",
            "@ref": "gr3",
            "@mimetype": "image/gif"
          },
          {
            "@category": "high",
            "@height": "1942",
            "@width": "2508",
            "@_fa": "true",
            "$": "https://api.elsevier.com/content/object/eid/1-s2.0-S0926860X2030510X-gr8_lrg.jpg?httpAccept=%2A%2F%2A",
            "@multimediatype": "JPEG image file",
            "@type": "IMAGE-HIGH-RES",
            "@size": "381796",
            "@ref": "gr8",
            "@mimetype": "image/jpeg"
          },
          {
            "@category": "high",
            "@height": "1012",
            "@width": "2508",
            "@_fa": "true",
            "$": "https://api.elsevier.com/content/object/eid/1-s2.0-S0926860X2030510X-gr9_lrg.jpg?httpAccept=%2A%2F%2A",
            "@multimediatype": "JPEG image file",
            "@type": "IMAGE-HIGH-RES",
            "@size": "346178",
            "@ref": "gr9",
            "@mimetype": "image/jpeg"
          },
          {
            "@category": "high",
            "@height": "3078",
            "@width": "2508",
            "@_fa": "true",
            "$": "https://api.elsevier.com/content/object/eid/1-s2.0-S0926860X2030510X-gr10_lrg.jpg?httpAccept=%2A%2F%2A",
            "@multimediatype": "JPEG image file",
            "@type": "IMAGE-HIGH-RES",
            "@size": "426533",
            "@ref": "gr10",
            "@mimetype": "image/jpeg"
          },
          {
            "@category": "high",
            "@height": "3715",
            "@width": "2508",
            "@_fa": "true",
            "$": "https://api.elsevier.com/content/object/eid/1-s2.0-S0926860X2030510X-gr4_lrg.jpg?httpAccept=%2A%2F%2A",
            "@multimediatype": "JPEG image file",
            "@type": "IMAGE-HIGH-RES",
            "@size": "2744058",
            "@ref": "gr4",
            "@mimetype": "image/jpeg"
          },
          {
            "@category": "high",
            "@height": "1844",
            "@width": "1508",
            "@_fa": "true",
            "$": "https://api.elsevier.com/content/object/eid/1-s2.0-S0926860X2030510X-gr5_lrg.jpg?httpAccept=%2A%2F%2A",
            "@multimediatype": "JPEG image file",
            "@type": "IMAGE-HIGH-RES",
            "@size": "230338",
            "@ref": "gr5",
            "@mimetype": "image/jpeg"
          },
          {
            "@category": "high",
            "@height": "1656",
            "@width": "2508",
            "@_fa": "true",
            "$": "https://api.elsevier.com/content/object/eid/1-s2.0-S0926860X2030510X-gr6_lrg.jpg?httpAccept=%2A%2F%2A",
            "@multimediatype": "JPEG image file",
            "@type": "IMAGE-HIGH-RES",
            "@size": "933020",
            "@ref": "gr6",
            "@mimetype": "image/jpeg"
          },
          {
            "@category": "high",
            "@height": "1543",
            "@width": "2508",
            "@_fa": "true",
            "$": "https://api.elsevier.com/content/object/eid/1-s2.0-S0926860X2030510X-gr7_lrg.jpg?httpAccept=%2A%2F%2A",
            "@multimediatype": "JPEG image file",
            "@type": "IMAGE-HIGH-RES",
            "@size": "287249",
            "@ref": "gr7",
            "@mimetype": "image/jpeg"
          },
          {
            "@category": "high",
            "@height": "1960",
            "@width": "1508",
            "@_fa": "true",
            "$": "https://api.elsevier.com/content/object/eid/1-s2.0-S0926860X2030510X-gr1_lrg.jpg?httpAccept=%2A%2F%2A",
            "@multimediatype": "JPEG image file",
            "@type": "IMAGE-HIGH-RES",
            "@size": "291593",
            "@ref": "gr1",
            "@mimetype": "image/jpeg"
          },
          {
            "@category": "high",
            "@height": "2114",
            "@width": "1508",
            "@_fa": "true",
            "$": "https://api.elsevier.com/content/object/eid/1-s2.0-S0926860X2030510X-gr2_lrg.jpg?httpAccept=%2A%2F%2A",
            "@multimediatype": "JPEG image file",
            "@type": "IMAGE-HIGH-RES",
            "@size": "228787",
            "@ref": "gr2",
            "@mimetype": "image/jpeg"
          },
          {
            "@category": "high",
            "@height": "1085",
            "@width": "975",
            "@_fa": "true",
            "$": "https://api.elsevier.com/content/object/eid/1-s2.0-S0926860X2030510X-ga1_lrg.jpg?httpAccept=%2A%2F%2A",
            "@multimediatype": "JPEG image file",
            "@type": "IMAGE-HIGH-RES",
            "@size": "212368",
            "@ref": "ga1",
            "@mimetype": "image/jpeg"
          },
          {
            "@category": "high",
            "@height": "1079",
            "@width": "1510",
            "@_fa": "true",
            "$": "https://api.elsevier.com/content/object/eid/1-s2.0-S0926860X2030510X-gr3_lrg.jpg?httpAccept=%2A%2F%2A",
            "@multimediatype": "JPEG image file",
            "@type": "IMAGE-HIGH-RES",
            "@size": "221741",
            "@ref": "gr3",
            "@mimetype": "image/jpeg"
          },
          {
            "@category": "standard",
            "@_fa": "true",
            "$": "https://api.elsevier.com/content/object/eid/1-s2.0-S0926860X2030510X-mmc1.docx?httpAccept=%2A%2F%2A",
            "@multimediatype": "Microsoft Word file",
            "@type": "APPLICATION",
            "@size": "6424923",
            "@ref": "mmc1",
            "@mimetype": "application/word"
          },
          {
            "@category": "thumbnail",
            "@_fa": "true",
            "$": "https://api.elsevier.com/content/object/eid/1-s2.0-S0926860X2030510X-si1.svg?httpAccept=%2A%2F%2A",
            "@multimediatype": "Scalable Vector Graphics file",
            "@type": "ALTIMG",
            "@size": "29321",
            "@ref": "si1",
            "@mimetype": "image/svg+xml"
          },
          {
            "@category": "standard",
            "@_fa": "true",
            "$": "https://api.elsevier.com/content/object/eid/1-s2.0-S0926860X2030510X-am.pdf?httpAccept=%2A%2F%2A",
            "@multimediatype": "Acrobat PDF file",
            "@type": "AAM-PDF",
            "@size": "4296405",
            "@ref": "am",
            "@mimetype": "application/pdf"
          }
        ]
      },
      "link": {
        "@rel": "abstract",
        "@href": "https://api.elsevier.com/content/abstract/scopus_id/85096966258"
      }
    }
  }
}