{
  "metadata": {
    "title": "Photo-/electrocatalytic approaches to CO<ce:inf loc=post>2</ce:inf> conversion on Cu<ce:inf loc=post>2</ce:inf>O-based catalysts",
    "authors": "; ; ",
    "journal": "Applied Catalysis A: General",
    "date": "2023-10-25",
    "doi": "10.1016/j.apcata.2023.119445",
    "abstract": "",
    "uri": "https://api.elsevier.com/content/article/pii/S0926860X23004258",
    "pii": "S0926860X23004258"
  },
  "fulltext": {
    "full-text-retrieval-response": {
      "scopus-eid": "2-s2.0-85173875182",
      "originalText": "serial JL 271346 291210 291744 291809 31 Applied Catalysis A: General APPLIEDCATALYSISAGENERAL 2023-10-13 2023-10-13 2023-10-14 2023-10-14 2023-10-31T20:53:05 1-s2.0-S0926860X23004258 S0926-860X(23)00425-8 S0926860X23004258 10.1016/j.apcata.2023.119445 S300 S300.1 FULL-TEXT 1-s2.0-S0926860X23X00180 2024-01-01T12:35:59.692098Z 0 0 20231025 2023 2023-10-13T01:54:39.923435Z absattachment articleinfo articlenumber articletitlenorm authfirstinitialnorm authfirstsurnamenorm cid cids contenttype copyright crossmark dateloaded dateloadedtxt datesearch datesort dateupdated dco docsubtype doctype doi eid ewtransactionid hubeid indexeddate issn issnnorm itemstage itemtransactionid itemweight openaccess openarchive pg pgfirst pii piinorm pubdatestart pubdatetxt pubyr sortorder srctitle srctitlenorm srctype ssids alllist content subj subheadings suppl tomb volfirst volissue volumelist webpdf webpdfpagecount yearnav figure e-component body acknowledge affil appendices articletitle auth authfirstini authfull authkeywords authlast grantnumber grantsponsor grantsponsorid highlightsabst primabst ref specialabst 0926-860X 0926860X true 667 667 C Volume 667 4 119445 119445 119445 20231025 25 October 2023 2023-10-25 2023 article rev © 2023 Elsevier B.V. All rights reserved. PHOTOELECTROCATALYTICAPPROACHESCO2CONVERSIONCU2OBASEDCATALYSTS ZHAO Z 1 Introduction 2 Fundamentals of CO2 reduction 2.1 Photocatalytic CO2 reduction 2.2 Electrocatalytic CO2 reduction 2.3 Thermocatalytic CO2 reduction 3 Research status of Cu2O photocatalytic CO2 reduction 3.1 Advantages and shortcomings of Cu2O for photocatalytic CO2RR 3.1.1 Advantages 3.1.2 Limitations 3.2 Strategies for building efficient Cu2O-based photocatalysts 3.2.1 Morphology and crystal facet modulation 3.2.2 Heterojunction engineering 3.2.3 Carbon-based composites 3.2.4 Metal deposition 3.2.5 Elemental doping 3.3 Mechanistic study of Cu2O-based photocatalysts 4 Research status of Cu2O electrocatalytic CO2 reduction 4.1 Advantages and shortcomings of Cu2O for electrocatalytic CO2RR 4.1.1 Advantages 4.1.2 Limitations 4.2 Strategies for building efficient Cu2O-based electrocatalysts 4.2.1 Morphology and crystal facet modulation 4.2.2 Metal deposition 4.2.3 Vacancy defects and doping on the surface of Cu2O 4.3 Current status of electrocatalytic CO2 to C3 products on Cu2O 4.4 Mechanistic study of Cu2O-based electrocatalysts 5 Research status of Cu2O photo-electrocatalytic CO2 reduction 5.1 Introduction to photo-electrocatalysis 5.2 Strategies for building efficient Cu2O-based photo-electrocatalysts 5.2.1 Building a protective layer 5.2.2 Construct heterojunctions 5.2.3 Elemental doping 5.2.4 Functional modification 6 Development trend of Cu2O-based catalytic CO2RR 6.1 Research directions of new catalysts based on Cu2O 6.1.1 Single-atom catalysts 6.1.2 Double-atom catalysts 6.1.3 Three-atom catalysts 6.1.4 Fully exposed catalyst-larger clusters 6.1.5 Dual doping catalysts 6.1.6 Frustrated Lewis pairs catalyst 6.1.7 Tandem catalysts 6.2 Application studies of other copper oxides 6.3 Applications of machine learning 7 Summary and outlook Acknowledgments Appendix A Supplementary material References MIKKELSEN 2010 43 81 M LI 2020 549615 X HU 2022 5954 Y ZHAO 2022 105959 X ZHANG 2020 109799 Z LIU 2020 3541 3562 A DAS 2020 2937 3004 S ROY 2018 1938 1966 S HABISREUTINGER 2013 7372 7408 S HOU 2019 3363 3380 L YANG 2018 7724 7728 P REJ 2021 5915 5951 S TOE 2019 191 211 C XIE 2018 41 54 H LEE 2018 558 564 S YANO 2007 554 557 J LIN 2020 3525 S ZHANG 2022 4860 4865 H VERDAGUERCASADEVALL 2015 9808 9811 A XIAO 2017 6685 6688 H WANG 2023 2759 2803 L DENG 2022 121621 Z YANG 2023 112231 Z REN 2015 2814 2821 D YU 2015 33 40 X YU 2017 22081 22091 X YU 2018 20352 20362 X YU 2015 53 60 X YU 2015 1303 1311 X GUO 2022 8065 8078 Y YU 2017 803 810 X YU 2017 18652 18659 X ARANDAAGUIRRE 2020 101154 A WON 2014 217 223 D LI 2014 11380 11386 P LI 2018 6843 6853 J ZHENG 2021 1754 1761 Y CHEN 2015 161 168 C CUI 2022 152343 L FU 2020 15223 15229 W AGUIRRE 2017 485 493 M WANG 2015 8631 8639 J TANG 2022 121371 Z PAN 2020 1741 1748 H GAO 2019 18704 18714 J REN 2020 125 131 X WANG 2022 135029 W LARRAZABAL 2017 1255 1265 G YU 2019 576 582 L JUNG 2019 4624 4633 H WANG 2019 702 708 L FENG 2016 169 174 X LI 2014 504 507 C CHANG 2022 240 249 F WANG 2023 1801 1809 S BARAN 2021 7271 T ZHANG 2021 4091 4111 Y MENG 2021 2006034 Y ZHANG 2022 3820 3829 X KOVACIC 2020 14984 15007 Z FENG 2022 675 690 Q WANG 2022 7300 7316 Y BAGAL 2019 21351 21378 I WENG 2019 4642 4687 B MUIRURI 2022 118927 J SAHU 2022 13094 13104 A CHEN 2022 296 301 R WANG 2021 2984 2993 W ALI 2022 131579 S JIANG 2023 122079 W KIM 2018 4170 4177 C LOW 2017 1601694 J HAN 2015 1121 1130 C ZHOU 2014 4920 4935 P LOW 2019 1802981 J WANG 2014 17 21 J LI 2015 2229 2236 Y PARK 2016 868 875 S SHI 2019 236 242 W ZHANG 2022 21050 21058 A WANG 2022 11512 11528 J ZHONG 2009 6086 6087 D CRESPOOTERO 2015 2379 2383 R HAM 2017 35 43 Y SUN 2016 12616 12623 K ZHAO 2018 188 197 S QUAN 2018 1704531 Q JO 2018 586 598 W WANG 2017 335 346 P YANG 2022 3709 3712 G ZHOU 2020 123940 J ALI 2020 119344 S NING 2018 4857 4863 D RAZZAQ 2017 28 35 A LI 2016 320 329 F TIAN 2021 2103558 Z WANG 2012 1596 1606 X YANG 2022 12 23 Z LI 2018 552 559 H LIU 2021 126654 M ZHANG 2020 6855 6861 Y FENG 2011 13429 13433 X ZHANG 2021 2883 2890 X GAO 2018 1510 1519 D DENG 2022 4526 4533 Y JIANG 2023 4193 4229 W QUIROZ 2018 7289 7297 J CHRISTOPHER 2011 467 472 P MARIMUTHU 2013 1590 1593 A ROBATJAZI 2017 H LE 2021 6108 6115 T CHEN 2019 426 432 R NGUYENTHITHANH 2019 1 8 T QIU 2008 215703 X REHMAN 2022 2069 Z WANG 2012 11276 11281 W WANG 2021 2008008 J AGGARWAL 2021 131402 M GAO 2021 2010025 Z LI 2021 676876 J KUHL 2012 7050 7059 K NITOPI 2019 7610 7672 S GU 2018 1800121 Z YAO 2022 14005 14011 K LI 2018 4614 J XU 2021 2932 Y YANG 2018 1802227 J ROSS 2019 648 658 M CHEN 2020 6878 6883 Z ZHANG 2022 2200454 J MONTOYA 2013 737 742 J YANG 2020 6400 6408 P CHENG 2020 126868 Y FEROZE 2020 730 736 M ZHUANG 2018 946 951 T LIU 2019 171 178 S WU 2019 957 968 Y HANDOKO 2013 13017 13022 A LIU 2021 39165 39177 B LUO 2022 e202116736 H GAO 2020 1902820 Y TAN 2019 63 W ZHANG 2021 348 356 L LEE 2019 1287 1292 Y HERZOG 2021 7426 7435 A CAO 2021 2353 2364 X HE 2021 358 384 Y SEQUEDA 2022 3667 3673 I KASATKIN 2007 7324 7327 I WU 2013 84 89 H BENDAVID 2013 26048 26059 L LI 2018 1912 1923 L LEE 2017 8594 8604 S WANG 2020 204 212 M CHEN 2021 23234 23242 H RASUL 2015 2146 2150 S LUO 2018 6571 6581 W LI 2021 6846 6856 H LIU 2021 e2012649118 G YAO 2022 20914 20923 Y MA 2023 2213145 X LI 2022 1965 P CHANG 2022 5502 5512 C DU 2022 36527 36535 R WU 2023 12884 12894 Q ZHANG 2023 142052 R LEI 2020 4213 4222 Q ZHI 2021 101594 W LIU 2023 1474 1480 C ZANG 2022 e202209629 Y REN 2023 644 C MAO 2023 3292 X WANG 2019 14026 14035 Q HUANG 2021 213564 X ZHANG 2018 771 805 N WANG 2022 116252 Q GALANTE 2021 859 863 M LEE 2018 264 270 K AKBAR 2021 395707 M AKBAR 2023 114483 M ZOLI 2023 113985 M OTGONBAYAR 2023 142716 Z GUO 2023 144539 X JIA 2023 11411 11425 Y JIANG 2022 2105292 Y QIAO 2011 634 641 B YANG 2013 1740 1748 X LIU 2017 34 59 J ZHANG 2020 25970 25977 W FENG 2023 9857 9866 J LE 2023 6328 6337 T ZHANG 2019 5453 L TIAN 2021 3138 S FU 2021 1952 1961 J MA 2021 526 535 Y LI 2018 411 417 H JIAO 2019 222 228 J NI 2021 120092 W WANG 2022 640 649 Y ZHAO 2022 11412 11420 X LIANG 2023 122073 X CHENG 2021 12673 12681 H LI 2021 1729 1737 S HU 2022 2201391 C WU 2022 25463 25470 M LIU 2023 W CHEN 2019 3492 3515 Z ZHA 2021 150331 W ZHOU 2021 101245 S HAN 2022 16080 16086 B CHENG 2016 13638 N LIU 2018 4981 5079 L LIU 2015 8676 8679 C KAUFFMAN 2012 10237 10243 D WANG 2022 1761 1769 X CADIESSADEK 2018 19463 19472 A SILAGHI 2016 4501 4505 M PENG 2021 262 273 M CHEN 2022 12720 12743 X LIU 2021 25922 25926 Y HAO 2022 1477 1485 Q DONG 2022 485 493 C ZHAO 2013 1201 1204 Y FAN 2021 2003037 M GAO 2019 1805121 K XU 2018 2750 2756 K CHEN 2019 34819 34826 J LI 2020 830 838 G LIANG 2022 1880 1887 X WANG 2022 4703 4710 H JIA 2022 131554 C LIU 2016 3567 3574 L LIU 2018 3376 3381 L WELCH 2006 1124 1126 G STEPHAN 2021 20002 20014 D SHINDE 2022 G GHOUSSOUB 2016 7109 7117 M WANG 2018 1804191 X ZHANG 2022 120748 W ZHANG 2019 11353 11357 S BAN 2022 206 215 T XIE 2022 10587 10602 Y BARREAU 2023 e202302087 M DONG 2018 1700732 Y YAN 2020 6095 T WAN 2019 889 898 L JIN 2022 e202113411 S ZHU 2021 4471 4486 Y CAO 2022 9735 9752 B FAN 2023 102333 J LI 2019 570 583 Z ZHANG 2023 122190 T ZHANG 2022 202 211 T CHEN 2020 1688 1699 C MARTI 2020 2993 3006 N IYENGAR 2021 4456 4463 P ZHANG 2021 2102293 S ZHENG 2022 2201695 Y ZHANG 2022 1679 1687 Y YE 2023 156981 M NIU 2021 2175 D YANG 2022 e202116706 R XIONG 2022 121498 W CHEN 2019 15989 15999 Q DUAN 2021 111016 J LI 2014 134 140 P SAWICKACHUDY 2020 010701 P RAZALI 2018 168 171 M GUO 2021 21979 21987 W PECHENKIN 2021 1151 A YE 2022 964011 X LIU 2022 1877 W WU 2022 6666 Q NORSKOV 2009 37 46 J SCHLEDER 2019 032001 G WU 2020 19290 19299 L GUO 2021 5755 5762 Y ZHANG 2021 2100987 N ZHONG 2020 178 183 M TAMTAJI 2022 15309 15331 M ZAZA 2022 1284 1291 L WANG 2022 120991 Y NESBITT 2020 14093 14106 N LI 2022 e202208534 L NGUYEN 2020 7488 7504 T WEI 2021 3148 3155 X LI 2022 211 M ZHAOX2023X119445 ZHAOX2023X119445XZ 2025-10-14T00:00:00.000Z 2025-10-14T00:00:00.000Z http://creativecommons.org/licenses/by-nc-nd/4.0/ © 2023 Elsevier B.V. All rights reserved. 2023-10-19T06:37:48.649Z http://vtw.elsevier.com/data/voc/AddOnTypes/50.7/aggregated-refined https://doi.org/10.15223/policy-017 https://doi.org/10.15223/policy-037 https://doi.org/10.15223/policy-012 https://doi.org/10.15223/policy-029 https://doi.org/10.15223/policy-004 item S0926-860X(23)00425-8 S0926860X23004258 1-s2.0-S0926860X23004258 10.1016/j.apcata.2023.119445 271346 2024-01-01T12:35:59.692098Z 2023-10-25 1-s2.0-S0926860X23004258-main.pdf https://s3-eu-west-1.amazonaws.com/prod-ucs-content-store-eu-west/content/pii:S0926860X23004258/MAIN/application/pdf/397bcd6cb95301186edac7d79a5372fd/main.pdf main.pdf pdf true 21798841 MAIN 35 1-s2.0-S0926860X23004258-main_1.png https://s3-eu-west-1.amazonaws.com/prod-ucs-content-store-eu-west/content/pii:S0926860X23004258/PREVIEW/image/png/8743f457be1c7290105da04b30fa1e1a/main_1.png main_1.png png 57293 849 656 IMAGE-WEB-PDF 1 1-s2.0-S0926860X23004258-gr28.jpg https://s3-eu-west-1.amazonaws.com/prod-ucs-content-store-eu-west/content/pii:S0926860X23004258/gr28/DOWNSAMPLED/image/jpeg/79f9293d62a6fdfea1e754c742d788c2/gr28.jpg gr28 gr28.jpg jpg 68569 362 565 IMAGE-DOWNSAMPLED 1-s2.0-S0926860X23004258-gr27.jpg https://s3-eu-west-1.amazonaws.com/prod-ucs-content-store-eu-west/content/pii:S0926860X23004258/gr27/DOWNSAMPLED/image/jpeg/a5bcd7d20bf1d98d43ecba69b8ce7309/gr27.jpg gr27 gr27.jpg jpg 58715 283 659 IMAGE-DOWNSAMPLED 1-s2.0-S0926860X23004258-gr26.jpg https://s3-eu-west-1.amazonaws.com/prod-ucs-content-store-eu-west/content/pii:S0926860X23004258/gr26/DOWNSAMPLED/image/jpeg/2d4551a319d24638c54f66ec8033af01/gr26.jpg gr26 gr26.jpg jpg 74616 486 659 IMAGE-DOWNSAMPLED 1-s2.0-S0926860X23004258-gr25.jpg https://s3-eu-west-1.amazonaws.com/prod-ucs-content-store-eu-west/content/pii:S0926860X23004258/gr25/DOWNSAMPLED/image/jpeg/ae68e6f6f8fed77ba3ebf4ef8cb527b2/gr25.jpg gr25 gr25.jpg jpg 70730 456 565 IMAGE-DOWNSAMPLED 1-s2.0-S0926860X23004258-gr6.jpg https://s3-eu-west-1.amazonaws.com/prod-ucs-content-store-eu-west/content/pii:S0926860X23004258/gr6/DOWNSAMPLED/image/jpeg/997373a0dccf76f7dffd74535574515b/gr6.jpg gr6 gr6.jpg jpg 31459 258 565 IMAGE-DOWNSAMPLED 1-s2.0-S0926860X23004258-gr24.jpg https://s3-eu-west-1.amazonaws.com/prod-ucs-content-store-eu-west/content/pii:S0926860X23004258/gr24/DOWNSAMPLED/image/jpeg/77598bb67492bc754721814b3b36d4fc/gr24.jpg gr24 gr24.jpg jpg 36822 267 565 IMAGE-DOWNSAMPLED 1-s2.0-S0926860X23004258-gr5.jpg https://s3-eu-west-1.amazonaws.com/prod-ucs-content-store-eu-west/content/pii:S0926860X23004258/gr5/DOWNSAMPLED/image/jpeg/bc7ded13eacf3f3b6cd6d8853380491b/gr5.jpg gr5 gr5.jpg jpg 58135 341 565 IMAGE-DOWNSAMPLED 1-s2.0-S0926860X23004258-gr23.jpg https://s3-eu-west-1.amazonaws.com/prod-ucs-content-store-eu-west/content/pii:S0926860X23004258/gr23/DOWNSAMPLED/image/jpeg/b9208629ef77103bf173242adfe9e753/gr23.jpg gr23 gr23.jpg jpg 57487 356 659 IMAGE-DOWNSAMPLED 1-s2.0-S0926860X23004258-gr8.jpg https://s3-eu-west-1.amazonaws.com/prod-ucs-content-store-eu-west/content/pii:S0926860X23004258/gr8/DOWNSAMPLED/image/jpeg/996f3850baa64f836dbc7ea0fbadcf95/gr8.jpg gr8 gr8.jpg jpg 143714 729 715 IMAGE-DOWNSAMPLED 1-s2.0-S0926860X23004258-gr22.jpg https://s3-eu-west-1.amazonaws.com/prod-ucs-content-store-eu-west/content/pii:S0926860X23004258/gr22/DOWNSAMPLED/image/jpeg/0e6b008786587da96a77eb615c6f59ff/gr22.jpg gr22 gr22.jpg jpg 57714 356 565 IMAGE-DOWNSAMPLED 1-s2.0-S0926860X23004258-gr7.jpg https://s3-eu-west-1.amazonaws.com/prod-ucs-content-store-eu-west/content/pii:S0926860X23004258/gr7/DOWNSAMPLED/image/jpeg/307edaca8e00add2ff33c137444b9daa/gr7.jpg gr7 gr7.jpg jpg 15120 232 339 IMAGE-DOWNSAMPLED 1-s2.0-S0926860X23004258-gr21.jpg https://s3-eu-west-1.amazonaws.com/prod-ucs-content-store-eu-west/content/pii:S0926860X23004258/gr21/DOWNSAMPLED/image/jpeg/104f92e8cf68f393b8a95fce75757e83/gr21.jpg gr21 gr21.jpg jpg 62806 382 659 IMAGE-DOWNSAMPLED 1-s2.0-S0926860X23004258-gr20.jpg https://s3-eu-west-1.amazonaws.com/prod-ucs-content-store-eu-west/content/pii:S0926860X23004258/gr20/DOWNSAMPLED/image/jpeg/fd5f469096a6fcfa5ac38c6691efd5e9/gr20.jpg gr20 gr20.jpg jpg 28338 251 299 IMAGE-DOWNSAMPLED 1-s2.0-S0926860X23004258-gr9.jpg https://s3-eu-west-1.amazonaws.com/prod-ucs-content-store-eu-west/content/pii:S0926860X23004258/gr9/DOWNSAMPLED/image/jpeg/1a15025000d4e5e5577fe2515561a55a/gr9.jpg gr9 gr9.jpg jpg 111425 554 715 IMAGE-DOWNSAMPLED 1-s2.0-S0926860X23004258-gr2.jpg https://s3-eu-west-1.amazonaws.com/prod-ucs-content-store-eu-west/content/pii:S0926860X23004258/gr2/DOWNSAMPLED/image/jpeg/c6d27fc8ed0299558e6856358f462c13/gr2.jpg gr2 gr2.jpg jpg 20646 217 282 IMAGE-DOWNSAMPLED 1-s2.0-S0926860X23004258-gr1.jpg https://s3-eu-west-1.amazonaws.com/prod-ucs-content-store-eu-west/content/pii:S0926860X23004258/gr1/DOWNSAMPLED/image/jpeg/68e2d11c8a26f3c04c3795538847f04c/gr1.jpg gr1 gr1.jpg jpg 69835 360 565 IMAGE-DOWNSAMPLED 1-s2.0-S0926860X23004258-gr4.jpg https://s3-eu-west-1.amazonaws.com/prod-ucs-content-store-eu-west/content/pii:S0926860X23004258/gr4/DOWNSAMPLED/image/jpeg/b575dcba0f2ca67a3a941f0515b516e4/gr4.jpg gr4 gr4.jpg jpg 58088 258 791 IMAGE-DOWNSAMPLED 1-s2.0-S0926860X23004258-gr3.jpg https://s3-eu-west-1.amazonaws.com/prod-ucs-content-store-eu-west/content/pii:S0926860X23004258/gr3/DOWNSAMPLED/image/jpeg/59b190622a1f2ea2afd80edf0649a842/gr3.jpg gr3 gr3.jpg jpg 52111 287 791 IMAGE-DOWNSAMPLED 1-s2.0-S0926860X23004258-gr19.jpg https://s3-eu-west-1.amazonaws.com/prod-ucs-content-store-eu-west/content/pii:S0926860X23004258/gr19/DOWNSAMPLED/image/jpeg/9e4f08e3dfb99c094e9d6335ecd8fe45/gr19.jpg gr19 gr19.jpg jpg 33602 185 659 IMAGE-DOWNSAMPLED 1-s2.0-S0926860X23004258-gr18.jpg https://s3-eu-west-1.amazonaws.com/prod-ucs-content-store-eu-west/content/pii:S0926860X23004258/gr18/DOWNSAMPLED/image/jpeg/1c083e703387b01abd97c1b2d4ebfd7c/gr18.jpg gr18 gr18.jpg jpg 78835 437 791 IMAGE-DOWNSAMPLED 1-s2.0-S0926860X23004258-gr17.jpg https://s3-eu-west-1.amazonaws.com/prod-ucs-content-store-eu-west/content/pii:S0926860X23004258/gr17/DOWNSAMPLED/image/jpeg/53631762c2427dd89cb89c73722e07c0/gr17.jpg gr17 gr17.jpg jpg 84424 460 659 IMAGE-DOWNSAMPLED 1-s2.0-S0926860X23004258-ga1.jpg https://s3-eu-west-1.amazonaws.com/prod-ucs-content-store-eu-west/content/pii:S0926860X23004258/ga1/DOWNSAMPLED/image/jpeg/1e01b2445884d25c674b33138b1bc036/ga1.jpg ga1 true ga1.jpg jpg 25694 245 284 IMAGE-DOWNSAMPLED 1-s2.0-S0926860X23004258-gr16.jpg https://s3-eu-west-1.amazonaws.com/prod-ucs-content-store-eu-west/content/pii:S0926860X23004258/gr16/DOWNSAMPLED/image/jpeg/7b5d2bd1cac0121b9aae0914fb780ada/gr16.jpg gr16 gr16.jpg jpg 67708 551 565 IMAGE-DOWNSAMPLED 1-s2.0-S0926860X23004258-gr15.jpg https://s3-eu-west-1.amazonaws.com/prod-ucs-content-store-eu-west/content/pii:S0926860X23004258/gr15/DOWNSAMPLED/image/jpeg/1f0ed365ae066a489db00cae90f2e258/gr15.jpg gr15 gr15.jpg jpg 25964 241 376 IMAGE-DOWNSAMPLED 1-s2.0-S0926860X23004258-gr14.jpg https://s3-eu-west-1.amazonaws.com/prod-ucs-content-store-eu-west/content/pii:S0926860X23004258/gr14/DOWNSAMPLED/image/jpeg/f7410f8be0674fdab9ac7578cf1aefcb/gr14.jpg gr14 gr14.jpg jpg 63866 383 659 IMAGE-DOWNSAMPLED 1-s2.0-S0926860X23004258-gr13.jpg https://s3-eu-west-1.amazonaws.com/prod-ucs-content-store-eu-west/content/pii:S0926860X23004258/gr13/DOWNSAMPLED/image/jpeg/9a7251b88b47446bfb4d74b2e803d873/gr13.jpg gr13 gr13.jpg jpg 109360 491 715 IMAGE-DOWNSAMPLED 1-s2.0-S0926860X23004258-gr12.jpg https://s3-eu-west-1.amazonaws.com/prod-ucs-content-store-eu-west/content/pii:S0926860X23004258/gr12/DOWNSAMPLED/image/jpeg/81abb4a5ab789a5a5d9521d1fbf3dd22/gr12.jpg gr12 gr12.jpg jpg 125386 683 791 IMAGE-DOWNSAMPLED 1-s2.0-S0926860X23004258-gr11.jpg https://s3-eu-west-1.amazonaws.com/prod-ucs-content-store-eu-west/content/pii:S0926860X23004258/gr11/DOWNSAMPLED/image/jpeg/0fcbd9315d1d936329b791adc5fab68c/gr11.jpg gr11 gr11.jpg jpg 33332 205 659 IMAGE-DOWNSAMPLED 1-s2.0-S0926860X23004258-gr10.jpg https://s3-eu-west-1.amazonaws.com/prod-ucs-content-store-eu-west/content/pii:S0926860X23004258/gr10/DOWNSAMPLED/image/jpeg/6b222adedebbef6bb3c2981df05220c6/gr10.jpg gr10 gr10.jpg jpg 66312 413 791 IMAGE-DOWNSAMPLED 1-s2.0-S0926860X23004258-gr28.sml https://s3-eu-west-1.amazonaws.com/prod-ucs-content-store-eu-west/content/pii:S0926860X23004258/gr28/THUMBNAIL/image/gif/395b6832e78c0fe9ef7fd9958cfc76af/gr28.sml gr28 gr28.sml sml 15335 140 219 IMAGE-THUMBNAIL 1-s2.0-S0926860X23004258-gr27.sml https://s3-eu-west-1.amazonaws.com/prod-ucs-content-store-eu-west/content/pii:S0926860X23004258/gr27/THUMBNAIL/image/gif/0264df7bcfb668c095d3bbaa2d27a9fa/gr27.sml gr27 gr27.sml sml 12049 94 219 IMAGE-THUMBNAIL 1-s2.0-S0926860X23004258-gr26.sml https://s3-eu-west-1.amazonaws.com/prod-ucs-content-store-eu-west/content/pii:S0926860X23004258/gr26/THUMBNAIL/image/gif/7d3bcfd3624e794832809a7c251a85b9/gr26.sml gr26 gr26.sml sml 12797 161 219 IMAGE-THUMBNAIL 1-s2.0-S0926860X23004258-gr25.sml https://s3-eu-west-1.amazonaws.com/prod-ucs-content-store-eu-west/content/pii:S0926860X23004258/gr25/THUMBNAIL/image/gif/d02af5f64c07d825baa955201acb2f35/gr25.sml gr25 gr25.sml sml 15712 164 203 IMAGE-THUMBNAIL 1-s2.0-S0926860X23004258-gr6.sml https://s3-eu-west-1.amazonaws.com/prod-ucs-content-store-eu-west/content/pii:S0926860X23004258/gr6/THUMBNAIL/image/gif/5a65a6efb885a9c80748cea554ddb7e7/gr6.sml gr6 gr6.sml sml 6495 100 219 IMAGE-THUMBNAIL 1-s2.0-S0926860X23004258-gr24.sml https://s3-eu-west-1.amazonaws.com/prod-ucs-content-store-eu-west/content/pii:S0926860X23004258/gr24/THUMBNAIL/image/gif/3344578cbc59a7647531ad96c533460a/gr24.sml gr24 gr24.sml sml 8989 104 219 IMAGE-THUMBNAIL 1-s2.0-S0926860X23004258-gr5.sml https://s3-eu-west-1.amazonaws.com/prod-ucs-content-store-eu-west/content/pii:S0926860X23004258/gr5/THUMBNAIL/image/gif/27df818915446262af374f965aaee6ed/gr5.sml gr5 gr5.sml sml 14999 132 219 IMAGE-THUMBNAIL 1-s2.0-S0926860X23004258-gr23.sml https://s3-eu-west-1.amazonaws.com/prod-ucs-content-store-eu-west/content/pii:S0926860X23004258/gr23/THUMBNAIL/image/gif/343222edc2fe7a73e0cfce88a9ecb8be/gr23.sml gr23 gr23.sml sml 9872 118 219 IMAGE-THUMBNAIL 1-s2.0-S0926860X23004258-gr8.sml https://s3-eu-west-1.amazonaws.com/prod-ucs-content-store-eu-west/content/pii:S0926860X23004258/gr8/THUMBNAIL/image/gif/4b40af3103fec80d1f08eca69bc5aa45/gr8.sml gr8 gr8.sml sml 14349 164 161 IMAGE-THUMBNAIL 1-s2.0-S0926860X23004258-gr22.sml https://s3-eu-west-1.amazonaws.com/prod-ucs-content-store-eu-west/content/pii:S0926860X23004258/gr22/THUMBNAIL/image/gif/0382fb5eb4836b5138818ed5ddb03287/gr22.sml gr22 gr22.sml sml 14096 138 219 IMAGE-THUMBNAIL 1-s2.0-S0926860X23004258-gr7.sml https://s3-eu-west-1.amazonaws.com/prod-ucs-content-store-eu-west/content/pii:S0926860X23004258/gr7/THUMBNAIL/image/gif/1c6ba82e466869183cf945efad3b6054/gr7.sml gr7 gr7.sml sml 6013 150 219 IMAGE-THUMBNAIL 1-s2.0-S0926860X23004258-gr21.sml https://s3-eu-west-1.amazonaws.com/prod-ucs-content-store-eu-west/content/pii:S0926860X23004258/gr21/THUMBNAIL/image/gif/52b38a79c66461cdbc67f912daa962b3/gr21.sml gr21 gr21.sml sml 13288 127 219 IMAGE-THUMBNAIL 1-s2.0-S0926860X23004258-gr20.sml https://s3-eu-west-1.amazonaws.com/prod-ucs-content-store-eu-west/content/pii:S0926860X23004258/gr20/THUMBNAIL/image/gif/64a2a8822b56754991a659d226aaddb0/gr20.sml gr20 gr20.sml sml 19039 163 195 IMAGE-THUMBNAIL 1-s2.0-S0926860X23004258-gr9.sml https://s3-eu-west-1.amazonaws.com/prod-ucs-content-store-eu-west/content/pii:S0926860X23004258/gr9/THUMBNAIL/image/gif/3f03d8dfb4b7af4e3c5e9941333e4938/gr9.sml gr9 gr9.sml sml 17218 164 212 IMAGE-THUMBNAIL 1-s2.0-S0926860X23004258-gr2.sml https://s3-eu-west-1.amazonaws.com/prod-ucs-content-store-eu-west/content/pii:S0926860X23004258/gr2/THUMBNAIL/image/gif/1e7723c730bf33d31ddb3915de748345/gr2.sml gr2 gr2.sml sml 11694 164 213 IMAGE-THUMBNAIL 1-s2.0-S0926860X23004258-gr1.sml https://s3-eu-west-1.amazonaws.com/prod-ucs-content-store-eu-west/content/pii:S0926860X23004258/gr1/THUMBNAIL/image/gif/7463b9c89907132f97a5ef53f097f1a5/gr1.sml gr1 gr1.sml sml 11891 140 219 IMAGE-THUMBNAIL 1-s2.0-S0926860X23004258-gr4.sml https://s3-eu-west-1.amazonaws.com/prod-ucs-content-store-eu-west/content/pii:S0926860X23004258/gr4/THUMBNAIL/image/gif/1e801037aa842eac8cd83a497278d6f9/gr4.sml gr4 gr4.sml sml 6811 71 219 IMAGE-THUMBNAIL 1-s2.0-S0926860X23004258-gr3.sml https://s3-eu-west-1.amazonaws.com/prod-ucs-content-store-eu-west/content/pii:S0926860X23004258/gr3/THUMBNAIL/image/gif/5854974284e48f9608419fc9e9b7fc7e/gr3.sml gr3 gr3.sml sml 6753 79 219 IMAGE-THUMBNAIL 1-s2.0-S0926860X23004258-gr19.sml https://s3-eu-west-1.amazonaws.com/prod-ucs-content-store-eu-west/content/pii:S0926860X23004258/gr19/THUMBNAIL/image/gif/f2b735021be89bcd14d7070ba605f8e1/gr19.sml gr19 gr19.sml sml 5340 62 219 IMAGE-THUMBNAIL 1-s2.0-S0926860X23004258-gr18.sml https://s3-eu-west-1.amazonaws.com/prod-ucs-content-store-eu-west/content/pii:S0926860X23004258/gr18/THUMBNAIL/image/gif/d9e1b77730a89eeb8c9b57cc82b64d69/gr18.sml gr18 gr18.sml sml 9729 121 219 IMAGE-THUMBNAIL 1-s2.0-S0926860X23004258-gr17.sml https://s3-eu-west-1.amazonaws.com/prod-ucs-content-store-eu-west/content/pii:S0926860X23004258/gr17/THUMBNAIL/image/gif/8bb9f56b43d08b0514f0845e0dc925aa/gr17.sml gr17 gr17.sml sml 13689 153 219 IMAGE-THUMBNAIL 1-s2.0-S0926860X23004258-ga1.sml https://s3-eu-west-1.amazonaws.com/prod-ucs-content-store-eu-west/content/pii:S0926860X23004258/ga1/THUMBNAIL/image/gif/c572fd444727a58205ecc4a8881d88d2/ga1.sml ga1 true ga1.sml sml 14272 164 190 IMAGE-THUMBNAIL 1-s2.0-S0926860X23004258-gr16.sml https://s3-eu-west-1.amazonaws.com/prod-ucs-content-store-eu-west/content/pii:S0926860X23004258/gr16/THUMBNAIL/image/gif/b343eba1e627eefb81009ee88a5d6a27/gr16.sml gr16 gr16.sml sml 9372 164 168 IMAGE-THUMBNAIL 1-s2.0-S0926860X23004258-gr15.sml https://s3-eu-west-1.amazonaws.com/prod-ucs-content-store-eu-west/content/pii:S0926860X23004258/gr15/THUMBNAIL/image/gif/843cf678544c48277c7673e046076ef5/gr15.sml gr15 gr15.sml sml 11531 140 219 IMAGE-THUMBNAIL 1-s2.0-S0926860X23004258-gr14.sml https://s3-eu-west-1.amazonaws.com/prod-ucs-content-store-eu-west/content/pii:S0926860X23004258/gr14/THUMBNAIL/image/gif/2a1760f04a733b2e3abc01273749378f/gr14.sml gr14 gr14.sml sml 11701 127 219 IMAGE-THUMBNAIL 1-s2.0-S0926860X23004258-gr13.sml https://s3-eu-west-1.amazonaws.com/prod-ucs-content-store-eu-west/content/pii:S0926860X23004258/gr13/THUMBNAIL/image/gif/e8e4fd345b0d7808f38ffd6338c26d18/gr13.sml gr13 gr13.sml sml 14984 150 219 IMAGE-THUMBNAIL 1-s2.0-S0926860X23004258-gr12.sml https://s3-eu-west-1.amazonaws.com/prod-ucs-content-store-eu-west/content/pii:S0926860X23004258/gr12/THUMBNAIL/image/gif/d4141c0edeaad795b5e50a4abac004f3/gr12.sml gr12 gr12.sml sml 12577 164 190 IMAGE-THUMBNAIL 1-s2.0-S0926860X23004258-gr11.sml https://s3-eu-west-1.amazonaws.com/prod-ucs-content-store-eu-west/content/pii:S0926860X23004258/gr11/THUMBNAIL/image/gif/095699076e42dcd5d2c2b8ea193b1c8b/gr11.sml gr11 gr11.sml sml 7417 68 219 IMAGE-THUMBNAIL 1-s2.0-S0926860X23004258-gr10.sml https://s3-eu-west-1.amazonaws.com/prod-ucs-content-store-eu-west/content/pii:S0926860X23004258/gr10/THUMBNAIL/image/gif/46b81096ddf290dc61399f250573f650/gr10.sml gr10 gr10.sml sml 8896 114 219 IMAGE-THUMBNAIL 1-s2.0-S0926860X23004258-gr28_lrg.jpg https://s3-eu-west-1.amazonaws.com/prod-ucs-content-store-eu-west/content/pii:S0926860X23004258/HIGHRES/image/jpeg/4b2d9706e369126d3945bef94df7ba88/gr28_lrg.jpg gr28 gr28_lrg.jpg jpg 332288 1599 2495 IMAGE-HIGH-RES 1-s2.0-S0926860X23004258-gr27_lrg.jpg https://s3-eu-west-1.amazonaws.com/prod-ucs-content-store-eu-west/content/pii:S0926860X23004258/HIGHRES/image/jpeg/bad6245415629d4564b83ba63043f1e5/gr27_lrg.jpg gr27 gr27_lrg.jpg jpg 255800 1250 2911 IMAGE-HIGH-RES 1-s2.0-S0926860X23004258-gr26_lrg.jpg https://s3-eu-west-1.amazonaws.com/prod-ucs-content-store-eu-west/content/pii:S0926860X23004258/HIGHRES/image/jpeg/b6ac4d19dc3bcec7164eca76b3abc8fa/gr26_lrg.jpg gr26 gr26_lrg.jpg jpg 316847 2146 2911 IMAGE-HIGH-RES 1-s2.0-S0926860X23004258-gr25_lrg.jpg https://s3-eu-west-1.amazonaws.com/prod-ucs-content-store-eu-west/content/pii:S0926860X23004258/HIGHRES/image/jpeg/a74dec5a5a93e5625d0eb57bf0faf31b/gr25_lrg.jpg gr25 gr25_lrg.jpg jpg 325072 2013 2495 IMAGE-HIGH-RES 1-s2.0-S0926860X23004258-gr6_lrg.jpg https://s3-eu-west-1.amazonaws.com/prod-ucs-content-store-eu-west/content/pii:S0926860X23004258/HIGHRES/image/jpeg/620374acc5459acf805b6ae8eef83390/gr6_lrg.jpg gr6 gr6_lrg.jpg jpg 144756 1141 2495 IMAGE-HIGH-RES 1-s2.0-S0926860X23004258-gr24_lrg.jpg https://s3-eu-west-1.amazonaws.com/prod-ucs-content-store-eu-west/content/pii:S0926860X23004258/HIGHRES/image/jpeg/dc633b1dccd3f21c66ead6c010a9ecb3/gr24_lrg.jpg gr24 gr24_lrg.jpg jpg 154572 1180 2495 IMAGE-HIGH-RES 1-s2.0-S0926860X23004258-gr5_lrg.jpg https://s3-eu-west-1.amazonaws.com/prod-ucs-content-store-eu-west/content/pii:S0926860X23004258/HIGHRES/image/jpeg/749f87257bf287241a02e481c961b504/gr5_lrg.jpg gr5 gr5_lrg.jpg jpg 283120 1507 2495 IMAGE-HIGH-RES 1-s2.0-S0926860X23004258-gr23_lrg.jpg https://s3-eu-west-1.amazonaws.com/prod-ucs-content-store-eu-west/content/pii:S0926860X23004258/HIGHRES/image/jpeg/723f4005d4b2139e2d0b4de66c4b6302/gr23_lrg.jpg gr23 gr23_lrg.jpg jpg 255998 1574 2911 IMAGE-HIGH-RES 1-s2.0-S0926860X23004258-gr8_lrg.jpg https://s3-eu-west-1.amazonaws.com/prod-ucs-content-store-eu-west/content/pii:S0926860X23004258/HIGHRES/image/jpeg/056a3374c288ecd3d355252e66e2c357/gr8_lrg.jpg gr8 gr8_lrg.jpg jpg 681770 3222 3160 IMAGE-HIGH-RES 1-s2.0-S0926860X23004258-gr22_lrg.jpg https://s3-eu-west-1.amazonaws.com/prod-ucs-content-store-eu-west/content/pii:S0926860X23004258/HIGHRES/image/jpeg/2cb1fab1ad73b27dc0d1550063b4f4dd/gr22_lrg.jpg gr22 gr22_lrg.jpg jpg 265334 1570 2495 IMAGE-HIGH-RES 1-s2.0-S0926860X23004258-gr7_lrg.jpg https://s3-eu-west-1.amazonaws.com/prod-ucs-content-store-eu-west/content/pii:S0926860X23004258/HIGHRES/image/jpeg/f020f1627c59e378fdb50406e6f0f4c0/gr7_lrg.jpg gr7 gr7_lrg.jpg jpg 71835 1024 1497 IMAGE-HIGH-RES 1-s2.0-S0926860X23004258-gr21_lrg.jpg https://s3-eu-west-1.amazonaws.com/prod-ucs-content-store-eu-west/content/pii:S0926860X23004258/HIGHRES/image/jpeg/d2bdd1493c1d81827c6f7c2083cdd836/gr21_lrg.jpg gr21 gr21_lrg.jpg jpg 275141 1689 2911 IMAGE-HIGH-RES 1-s2.0-S0926860X23004258-gr20_lrg.jpg https://s3-eu-west-1.amazonaws.com/prod-ucs-content-store-eu-west/content/pii:S0926860X23004258/HIGHRES/image/jpeg/aca668033a97e2863316087421a61d1c/gr20_lrg.jpg gr20 gr20_lrg.jpg jpg 131306 1115 1330 IMAGE-HIGH-RES 1-s2.0-S0926860X23004258-gr9_lrg.jpg https://s3-eu-west-1.amazonaws.com/prod-ucs-content-store-eu-west/content/pii:S0926860X23004258/HIGHRES/image/jpeg/bdc61f7e31bab94ad712af4dcf4c05ab/gr9_lrg.jpg gr9 gr9_lrg.jpg jpg 473915 2447 3160 IMAGE-HIGH-RES 1-s2.0-S0926860X23004258-gr2_lrg.jpg https://s3-eu-west-1.amazonaws.com/prod-ucs-content-store-eu-west/content/pii:S0926860X23004258/HIGHRES/image/jpeg/28b508857e711638919d248a8d56a511/gr2_lrg.jpg gr2 gr2_lrg.jpg jpg 91049 961 1247 IMAGE-HIGH-RES 1-s2.0-S0926860X23004258-gr1_lrg.jpg https://s3-eu-west-1.amazonaws.com/prod-ucs-content-store-eu-west/content/pii:S0926860X23004258/HIGHRES/image/jpeg/754a0e2a5f2b9ecc1bde14d3d9a2bff0/gr1_lrg.jpg gr1 gr1_lrg.jpg jpg 312056 1591 2495 IMAGE-HIGH-RES 1-s2.0-S0926860X23004258-gr4_lrg.jpg https://s3-eu-west-1.amazonaws.com/prod-ucs-content-store-eu-west/content/pii:S0926860X23004258/HIGHRES/image/jpeg/566eac8d2e9d2faf1d6189a7f0506503/gr4_lrg.jpg gr4 gr4_lrg.jpg jpg 248765 1138 3493 IMAGE-HIGH-RES 1-s2.0-S0926860X23004258-gr3_lrg.jpg https://s3-eu-west-1.amazonaws.com/prod-ucs-content-store-eu-west/content/pii:S0926860X23004258/HIGHRES/image/jpeg/7270ff03a5a32a3e6d4526ec1f7d90f3/gr3_lrg.jpg gr3 gr3_lrg.jpg jpg 218137 1267 3493 IMAGE-HIGH-RES 1-s2.0-S0926860X23004258-gr19_lrg.jpg https://s3-eu-west-1.amazonaws.com/prod-ucs-content-store-eu-west/content/pii:S0926860X23004258/HIGHRES/image/jpeg/ea410a847e64848ccf6536dd4687339c/gr19_lrg.jpg gr19 gr19_lrg.jpg jpg 151528 818 2911 IMAGE-HIGH-RES 1-s2.0-S0926860X23004258-gr18_lrg.jpg https://s3-eu-west-1.amazonaws.com/prod-ucs-content-store-eu-west/content/pii:S0926860X23004258/HIGHRES/image/jpeg/30820e6f9b53535b5372254b27e8c8af/gr18_lrg.jpg gr18 gr18_lrg.jpg jpg 340202 1929 3493 IMAGE-HIGH-RES 1-s2.0-S0926860X23004258-gr17_lrg.jpg https://s3-eu-west-1.amazonaws.com/prod-ucs-content-store-eu-west/content/pii:S0926860X23004258/HIGHRES/image/jpeg/9574f5cae7f3da8c6b5562183d544ac9/gr17_lrg.jpg gr17 gr17_lrg.jpg jpg 377919 2032 2911 IMAGE-HIGH-RES 1-s2.0-S0926860X23004258-ga1_lrg.jpg https://s3-eu-west-1.amazonaws.com/prod-ucs-content-store-eu-west/content/pii:S0926860X23004258/HIGHRES/image/jpeg/d0d41f47ce7ef9064d505dfef797301d/ga1_lrg.jpg ga1 true ga1_lrg.jpg jpg 177587 1085 1260 IMAGE-HIGH-RES 1-s2.0-S0926860X23004258-gr16_lrg.jpg https://s3-eu-west-1.amazonaws.com/prod-ucs-content-store-eu-west/content/pii:S0926860X23004258/HIGHRES/image/jpeg/9ee4c5ee3fca1ba78ad9201454b21473/gr16_lrg.jpg gr16 gr16_lrg.jpg jpg 290938 2433 2495 IMAGE-HIGH-RES 1-s2.0-S0926860X23004258-gr15_lrg.jpg https://s3-eu-west-1.amazonaws.com/prod-ucs-content-store-eu-west/content/pii:S0926860X23004258/HIGHRES/image/jpeg/5a94df5a5a88a6f89c7bf8735472d6c9/gr15_lrg.jpg gr15 gr15_lrg.jpg jpg 120851 1064 1663 IMAGE-HIGH-RES 1-s2.0-S0926860X23004258-gr14_lrg.jpg https://s3-eu-west-1.amazonaws.com/prod-ucs-content-store-eu-west/content/pii:S0926860X23004258/HIGHRES/image/jpeg/9367784c7361c10c79d133046ef9d1fe/gr14_lrg.jpg gr14 gr14_lrg.jpg jpg 275464 1690 2911 IMAGE-HIGH-RES 1-s2.0-S0926860X23004258-gr13_lrg.jpg https://s3-eu-west-1.amazonaws.com/prod-ucs-content-store-eu-west/content/pii:S0926860X23004258/HIGHRES/image/jpeg/f855a6a9ba9d71c46724bc2a8e0f4737/gr13_lrg.jpg gr13 gr13_lrg.jpg jpg 496224 2168 3160 IMAGE-HIGH-RES 1-s2.0-S0926860X23004258-gr12_lrg.jpg https://s3-eu-west-1.amazonaws.com/prod-ucs-content-store-eu-west/content/pii:S0926860X23004258/HIGHRES/image/jpeg/6f59b15f3536ee7736fc735673892025/gr12_lrg.jpg gr12 gr12_lrg.jpg jpg 536988 3017 3493 IMAGE-HIGH-RES 1-s2.0-S0926860X23004258-gr11_lrg.jpg https://s3-eu-west-1.amazonaws.com/prod-ucs-content-store-eu-west/content/pii:S0926860X23004258/HIGHRES/image/jpeg/b307bc63311275adccf1196d95d1113f/gr11_lrg.jpg gr11 gr11_lrg.jpg jpg 139876 904 2911 IMAGE-HIGH-RES 1-s2.0-S0926860X23004258-gr10_lrg.jpg https://s3-eu-west-1.amazonaws.com/prod-ucs-content-store-eu-west/content/pii:S0926860X23004258/HIGHRES/image/jpeg/eaacf5d2e85d1cba20b56bfb3fa226bf/gr10_lrg.jpg gr10 gr10_lrg.jpg jpg 296278 1824 3493 IMAGE-HIGH-RES 1-s2.0-S0926860X23004258-mmc1.docx https://s3-eu-west-1.amazonaws.com/prod-ucs-content-store-eu-west/content/pii:S0926860X23004258/mmc1/MAIN/application/vnd.openxmlformats-officedocument.wordprocessingml.document/cb42e23d01948bd3f01b040a5baf8b30/mmc1.docx mmc1 mmc1.docx docx 21500522 APPLICATION 1-s2.0-S0926860X23004258-am.pdf am am.pdf pdf 4342237 AAM-PDF https://s3-eu-west-1.amazonaws.com/prod-ucs-content-store-eu-west/content/egi:10XQFQX22GD/MAIN/application/pdf/be1c4814083fdb98254a86e4c32a66a3/am.pdf APCATA 119445 119445 S0926-860X(23)00425-8 10.1016/j.apcata.2023.119445 Elsevier B.V. Fig. 1 The development of Cu2O-based catalysts in CO2RR. Fig. 1 Fig. 2 A brief schematic diagram of photo-, electro- and thermo-catalysis. Fig. 2 Fig. 3 Schematic diagram of typical (a) photocatalytic and (b) electrocatalytic CO2RR. Fig. 3 Fig. 4 (a) Mechanism of CO2 reduction reaction on Cu2O. (b) Schematic diagram of the local magnification reaction on Cu2O surface [12]. Fig. 4 Fig. 5 Relationship between the different crystal facet structures and charge distribution on Cu2O. Reprinted from [67] with the permission of Springer Nature. (a) Schematic diagram of different crystal facet structures on Cu2O; (b) Schematic of charge distribution of cubic and octahedral Cu2O; Schematic of the distribution of charges and holes on Cu2O (c)without defects, (d) with moderate and (e) with extreme defects. Fig. 5 Fig. 6 Schematic diagram of different types of photocatalyst heterojunctions. (a) type-I; (b) type-II; (c) type-III. Reprinted from [72] with the permission of John Wiley and Sons. (d) Z-type catalyst. Reprinted from [74] with the permission of John Wiley and Sons. Fig. 6 Fig. 7 Schematic diagram of the energy band structure of each semiconductor catalytic material. Fig. 7 Fig. 8 The study of CO2-to-CO reaction over different heterojunction catalysts. (a) CO emission of each material and (b) Schematic diagram of the CO2 reduction mechanism on Cu2O/TiO2 catalyst. Reprinted from [41] with the permission of Elsevier. (c) Schematic diagram of the CO2 reduction mechanism on α-Fe2O3/Cu2O catalyst and (d) yield of CO at different Cu/Fe ratios. Reprinted with permission from [42]. Copyright (2015) American Chemical Society. (e) Model diagram of BVO/C/Cu2O catalyst; (f) CO formation rate and (g) results of catalytic stability experiments of each material. Reprinted with permission from [71]. Copyright (2018) American Chemical Society. (h) Schematic diagram of the CO2 reduction mechanism; (i) Yield of each product and (j) results of catalytic stability experiments on Cu2O/WO3-001 catalyst. Reprinted from [79] with the permission of Elsevier. (k) Model diagram of PFC-45/Cu2O@CP catalyst and (l) CO emission of each material. Reprinted with permission from [80]. Copyright (2022) American Chemical Society. Fig. 8 Fig. 9 The study of CO2-to-CH4 reaction over different heterojunction catalysts. (a) Preparation process of Ag/Cu2O@rGO catalyst; (b) Schematic diagram of the mechanism of conversion of CO2 to CH4. Reprinted from [43] with the permission of Elsevier. (c) Chemical reduction method preparation process; (d) CH4 Reduction activity and (e) CO2 on each material. Reprinted from [90] with the permission of Elsevier. (f) Model diagram of Cu2O@Cu catalyst; Yields of (g) CH4 and (h) C2H4 on each material. Reprinted from [91] with the permission of Elsevier. Fig. 9 Fig. 10 The study of CO2-to- CH3OH reaction over different heterojunction catalysts. (a) Schematic diagram of the CO2 reduction mechanism on Cu2O/rGO/TNA catalyst; (b) Yield of CH3OH on each material. Reprinted from [95] with the permission of Elsevier. (c) Yield of CH3OH on each material; (d) Energy distribution of reaction intermediates and (e) Schematic diagram of reaction mechanism on Cu2O/PCN. Reprinted from [96] with the permission of John Wiley and Sons. Fig. 10 Fig. 11 Effect of metal deposition on catalytic reaction. Schematic diagram of the energy band arrangement of (a) 100Cu2O and (b) 111Cu2O. Reprinted from [103] with the permission of Royal Society of Chemistry. (c) Diagram of CO2 dissociation potential on Al@Cu2O catalyst. Reprinted with permission from [111]. Copyright (2021) American Chemical Society. Fig. 11 Fig. 12 Effect of Cl doping on the catalytic reaction. Reprinted from [49] with the permission of Elsevier. (a) Schematic diagrams of the energy band structural arrangement and photo-generated electron-hole reaction paths of pure Cu2O and Cu2O-Cl-4; Yields of CH4 and CO on (b) pure Cu2O and (c) Cu2O-Cl-4 under visible light irradiation; (d) Stability test of Cu2O-Cl-4; (e) Free energy diagram for the conversion of CO2 to CO and CH4 on pure Cu2O and Cu2O-Cl-4. Fig. 12 Fig. 13 Effect of Cu2O structure on CO2RR. FE of the reaction products on (a) electropolished Cu; (b) 0.2 μm; (c) 1.7 μm and (d) 8.8 μm Cu2O film; (e) Diagram of CO2RR mechanism. Reprinted with permission from [24]. Copyright (2015) American Chemical Society. (f) Schematic diagram of the structure mechanism of Cu2O nanocavities. Reprinted with permission from [133]. Copyright (2020) American Chemical Society. (g) Schematic diagram of the core-shell structure Cu2O@K-PBA catalyst. Reprinted from [134] with the permission of Elsevier. Fig. 13 Fig. 14 Effect of Cu2O crystal facets on the catalytic reaction. (a) Model diagram of the reaction of CO2 to C2 on Cu2O catalysts with high index crystal planes. Reprinted with permission from [40]. Copyright (2020) American Chemical Society. (b) Model diagram of hollow Cu2O catalyst. Reprinted from [18] with the permission of Royal Society of Chemistry. (c) Model diagram of the reaction of CO2 to alcohols and (d) FE of the products of Cu2O with different crystal planes. Reprinted with permission from [140]. Copyright (2021) American Chemical Society. Fig. 14 Fig. 15 Effect of edge truncated Cu2O catalyst with polycrystal facets on the reaction [142]. (a) SEM images of Cu2O nanoparticles with different crystal facets and (b) FE of C2H4 products. Fig. 15 Fig. 16 Effect of metal deposition on catalytic reaction. (a) FE of the photocathode under different metal deposition. Reprinted from [34] with the permission of Elsevier. (b) FE of CO and H2 on each material [143]. (c) Diagram of C2H4 formation pathway on Aux/Cu2O catalyst. Reprinted from [144] with the permission of Elsevier. Fig. 16 Fig. 17 Effect of vacancy defect on the catalytic reaction. FE of products on (a) Cu2O and (b) Cuv-Cu2O catalysts at different potentials (c) Surface adsorption energy of key species on Cu2O and Cuv-Cu2O catalysts. Reprinted from [46] with the permission of Elsevier. (d) FE of C2 products on Ov-Cu2O at different potentials; (e) Free energy of formation of *OC-COH intermediates and (f) model diagram of the reaction of CO2 to C2 products. Reprinted from [47] with the permission of Elsevier. Fig. 17 Fig. 18 Effect of metal doping on catalytic reaction. (a) Selectivity of products on Cu2O and Ag-Cu2O catalysts; (b)Diagram of CO-insertion mechanism on Ag-Cu2OPS and Ag-Cu2OPB. Reprinted with permission from [154]. Copyright (2017) American Chemical Society. (c) FE of CO over a series of In-Cu @ Cu2O catalysts. Reprinted from [155] with the permission of Elsevier. Free energy diagram of (d) HER and (e) CO2-to-CO reaction on Cu/Cu2O and Cu/Cu2O-Sb catalysts; (f) Diagram of CO pre-sorption mechanism on Cu/Cu2O-Sb. Reprinted from [156] with the permission of Royal Society of Chemistry. Fig. 18 Fig. 19 Effect of two-element doping on catalytic reactions [163]. FE of (a) CO; (b) Free energy diagrams of CO2-to-CH3OH and (c) HER over Ag, S-doped Cu2O-based catalysts. Fig. 19 Fig. 20 The future directions for the development of Cu2O - based catalysts for CO2RR. Fig. 20 Fig. 21 The schematic diagram of the single-atom catalytic system. (a) Schematic diagram of Sn/Cu2O catalyst preparation; (b) Reaction mechanism of Sn/Cu2O catalytic reduction of CO2. Reprinted from [190] with the permission of Royal Society of Chemistry. (c) Schematic diagram of Gd/CuOx catalyst. Reprinted with permission from [191]. Copyright (2023) American Chemical Society. Fig. 21 Fig. 22 The schematic diagram of the homonuclear diatomic catalytic system. (a) Schematic diagram of the di-mono-Co atomic site catalytic system. Reprinted from [199] with the permission of Elsevier. (b) Schematic diagram of the Fe2-N-C catalytic system. Reprinted with permission from [200]. Copyright (2022) American Chemical Society. (c) Mechanism of CO2 reaction on Ni2-NCNT. Reprinted from [202] with the permission of Elsevier. Fig. 22 Fig. 23 The schematic diagram of the heteronuclear diatomic catalytic system. (a) Schematic diagram of the Cu-Cu/Cu-Ni diatomic catalytic system. Reprinted with permission from [204]. Copyright (2021) American Chemical Society. (b) Schematic diagram of the preparation of Cu-In-NC catalyst. Reprinted from [205] with the permission of John Wiley and Sons. (c) Mechanism of CO2 reaction on Fe/Mn-N-C. Reprinted from [206] with the permission of Royal Society of Chemistry. (d) Schematic diagram of CO2 activation on Cu-Sn diatoms and Cu/Sn single atoms. Reprinted from [207] with the permission of Springer Nature. Fig. 23 Fig. 24 CO2 activated adsorption conformations on (a) 3Cu-GY, (b) 3Fe-GY and (c) 3Co-GY catalysts. Reprinted from [210] with the permission of Elsevier. Fig. 24 Fig. 25 The schematic diagram of the fully exposed cluster catalyst system (a) schematic diagram of the Cu7@[6]CPP catalyst; (b) CO reaction mechanism on Cu7@[6]CPP. Reprinted from [221] with the permission of Royal Society of Chemistry. (c) Schematic diagram of a loaded catalyst for alkane dehydrogenation. Reprinted with permission from [220]. Copyright (2022) American Chemical Society. Fig. 25 Fig. 26 The schematic diagram of the double doped catalyst system. (a) Reaction mechanism of N,S doped catalyst; (b) Free energy diagram of CO2 to CO reaction on N,S doped catalyst and N doped catalyst. Reprinted from [229] with the permission of Elsevier. (c) Schematic diagram of N,P-doped catalysts. Reprinted with permission from [230]. Copyright (2022) American Chemical Society. (d) Schematic diagram of B/P/S diatomic doped catalyst. Reprinted from [231] with the permission of Royal Society of Chemistry. Fig. 26 Fig. 27 The schematic diagram of CO2 activation on FLPs catalysts (a) Schematic diagram of FLPs on CeO2 catalyst. Reprinted with permission from [241]. Copyright (2019) American Chemical Society. (b) Schematic diagram of FLPs on TiO2 catalyst. Reprinted from [232] with the permission of Elsevier. Fig. 27 Fig. 28 The schematic diagram of CO2 reduction mechanism on tandem catalysts. (a) Schematic diagram of Cu-Ag tandem catalyst. Reprinted from [255] with the permission of Elsevier. (b) Crystal plane effect of Cu-Ag tandem catalyst. Reprinted with permission from [257]. Copyright (2021) American Chemical Society. (c) Schematic diagram of CuO/Ni tandem catalyst. Reprinted from [260] with the permission of Elsevier. (d) Schematic diagram of Cu@Cu2O tandem catalyst. Reprinted from [261] with the permission of Elsevier. Fig. 28 Photo-/electrocatalytic approaches to CO2 conversion on Cu2O-based catalysts Zixuan Zhao a Hongtao Wang a ⁎ Qi Yu b Soumendra Roy b Xiaohu Yu b ⁎ a College of Environmental Science and Engineering, Taiyuan University of Technology, Taiyuan 030024, People’s Republic of China College of Environmental Science and Engineering, Taiyuan University of Technology Taiyuan 030024 People’s Republic of China College of Environmental Science and Engineering, Taiyuan University of Technology, Taiyuan 030024, People’s Republic of China b Shaanxi Key laboratory of Catalysis and School of Chemical of Chemical & Environment Sciences, Shaanxi University of Technology, Hanzhong 723000, People’s Republic of China Shaanxi Key laboratory of Catalysis and School of Chemical of Chemical & Environment Sciences, Shaanxi University of Technology Hanzhong 723000 People’s Republic of China Shaanxi Key laboratory of Catalysis and School of Chemical of Chemical & Environment Sciences, Shaanxi University of Technology, Hanzhong 723000, People’s Republic of China ⁎ Corresponding authors. Carbon dioxide (CO2) reduction reaction (CO2RR) with renewable energy represents a promising way for effective utilization of the major anthropogenic greenhouse gas. Cuprous oxide (Cu2O)-based catalysts have attracted great attention in recent years due to abundant reserves, lower price, environmental friendliness, and higher activity of CO2RR. Moreover, Cu+ site in Cu2O plays an important role in improving the C2+ product selectivity. This paper reviews recent advances of photo- and electrocatalytic CO2RR on Cu2O-based catalysts in both experimental and computational studies. Firstly, the basic principle of photo- and electrocatalytic CO2RR on Cu2O-based catalysts is briefly reviewed. Secondly, various strategies have been adopted to improve CO2RR catalytic performance of Cu2O-based catalysts, mainly including morphology control, heterojunction engineering, metal deposition, and defective engineering. Finally, potential strategies to further promote CO2RR have also been suggested: including single atom catalyst, double atom catalyst, single cluster catalyst, and frustrated Lewis pairs, etc. We hope that the present comprehensive overview paves the way for future development of CO2RR on Cu2O-based catalysts. Graphical Abstract A comprehensive review of the development status of Cu2O-based catalysts in photo-/electrocatalytic CO2RR is given, with emphasis on the nature of Cu2O as well as modification strategies. ga1 Keywords Cu2O-Based Catalysts CO2 reduction reaction Catalyst modification C2+ product Selectivity Data Availability The data that has been used is confidential. 1 Introduction With the excessive burning of fossil fuels, including coal and oil, in the past two centuries, carbon dioxide (CO2) emissions have increased significantly. As a major greenhouse gas, its massive emissions have exacerbated the Earth's natural greenhouse phenomenon, triggering a series of problems such as global warming and sea level rise [1]. In order to decrease the serious eco-crisis and energy security issues, it is urgent to reduce the concentration of CO2 in the atmosphere [2]. Based on this, many countries have proposed the dual carbon goals of \"carbon peaking\" and \"carbon neutrality\" [3,4]. The commonly used technologies to mitigate CO2 emissions are carbon capture, utilization and storage (CCUS) [5]. Among them, catalytic CO2 reduction reaction (CO2RR) for the production of high-value chemicals has attracted great attention. However, the CO2 molecule exhibits a linear symmetric structure with the elemental carbon in the highest oxidation state. It has a short C-O bond length of 0.116 nm and has the property of a partial triple bond. It also has a high bond energy (750 kJ/mol), and a huge energy input is required to break the C-O double bond. Overall, the CO2 molecule is chemically stable, with some thermodynamic stability and kinetic inertia. So, the activation and conversion of the CO2 molecule is really difficult. In addition, the complex reaction process of CO2RR including multi-step electron transfer, hydrogenation and C-C bond coupling makes the conversion and utilization of CO2 into a high energy consumption and low efficiency dilemma [6]. Light, electricity, and heat can provide essential energy inputs in photocatalysis, electrocatalysis, and thermocatalysis of CO2RR, breaking bonds in reactant molecules (CO2, H2 and H2O) and promoting the formation of new bonds [7]. Among them, thermocatalysis of CO2RR can generate a large number of products as well as liquid fuels. But it requires high temperature and pressure operating conditions and consumes a certain amount of fossil energy [8]. In contrast to thermocatalytic processes, photo-/electrocatalysis can use solar and electrical energy to drive the reduction conversion of CO2 to C1 or C2+. One advantage of photo-/electrocatalysis is mild reaction condition, which can avoid the high temperature and pressure operating condition of direct CO2 hydrogenation reactions in industry. Another advantage is that it is green, which can directly or indirectly use renewable energy as an energy donor [9,10]. So, photo- and electrocatalysis of CO2RR are essential for achieving the sustainable use of new energy and the very promising strategies for achieving carbon neutrality. In the photo-/electrocatalytic process, complex reactions can be facilitated to reduce the reaction potential by adding catalysts. First, photocatalysts and electrocatalysts can facilitate the electron transfer process during the reaction, providing the energy required to activate CO2 molecules through light energy or electricity. Electrocatalysts can reduce the activation overpotential required for reactions. Second, the photocatalysts and electrocatalysts provides active sites that can optimize the reaction pathway. By providing new reaction pathways, the reaction activation barrier can be reduced. That is to say, the catalyst can adsorb CO2 molecules and generate new intermediates. Active sites affect the adsorption behaviour of reaction intermediates, reduce their interaction forces, and create a more favourable reaction environment. Thus, the reaction has a lower activation barrier. A suitable catalyst is the key for efficient photo- and electrocatalysis of CO2RR. Among many CO2 reduction catalysts, Cu2O, as a common semiconductor material, has received much attention from researchers because of its abundant reserves, environmental friendliness, and outstanding performance. The development of Cu2O-based catalysts in the photo-/electrocatalytic CO2RR is shown in Fig. 1. In photocatalytic CO2RR, the advantages of Cu2O catalyst are that Cu2O has the suitable band gap (2.2 eV) which is benefit to the visible light response, and it has a more negative conduction band potential, which is lower than the CO2RR potential and can theoretically catalyze the reduction of CO2 [11,12]; the disadvantages of Cu2O catalyst are the high photo-generated electron-hole complex rate and severe photo-corrosion [13]. In electrocatalytic CO2 reduction, the excellent performance of copper-based catalysts for the reduction of CO2 to C2+ products has gained the attention of researchers [14]. Among them, Cu2O catalysts have attracted much attention and have been extensively studied due to better Faraday efficiency (FE) of C2 products (C2H4, C2H5OH) [15–17]. But, in comparison, liquid products such as n-propanol have a lower FE [18]. Moreover, the variable valence state of Cu2O during the electrochemical process affects the adsorption behaviour of the intermediate products, which is conducive to lowering the reaction potential barrier [19,20]. However, the products of CO2RR are diverse, such as CO, CH4, CH3OH, C2H4, C2H5OH. Due to the similar reaction potentials [21], mixed products are sometimes generated. Moreover, the hydrogen evolution reaction (HER) acts as a competitive side reaction of the water-based CO2 reduction system, resulting in additional energy consumption and reaction inefficiency, also for Cu2O. In summary, it was shown that the ratio of copper valence states in the catalyst affect the progress of CO2RR and HER. Deng et al. [22] investigated the role of different Cu valence fractions in the CO2RR process and showed that the surface ratio of Cu fractions was linearly related to the selectivity of the corresponding products. Cu0 was the active site of CH4, while Cu2O was the active site of CO, and the stronger adsorption and activation of CO by Cu0 promoted its further conversion. Yang et al. [23] suggested that during CO2RR, Cu2+ was reduced to generate Cu0 and Cu+, Cu0 activates CO2 and promotes electron transfer, while Cu+ enhances *CO adsorption and promotes C-C coupling. The independent Cu0 site mainly generates CH4 and the mixed site favours C2H4. Ren et al. [24] showed that Cu2O with an appropriate ratio of coordinately unsaturated copper atoms after reduction optimizes the adsorption of the intermediate CHxO thereby facilitating the generation of C2H4 and C2H5OH. But an excess of coordinated unsaturated atoms will, in turn, promote HER as its binding to H atoms becomes stronger. That is, the variable valence states of Cu2O provide an opportunity for HER to occur. We need to optimize its oxidation state ratios so that the reaction proceeds in the direction we expect. In addition, in previous studies, the interactions of small molecules with Cu2O and CuO have been extensively studied [25–32]. Overall, Cu2O shows great potential in photo-/electrocatalytic CO2RR. Although its catalytic activity is limited, it is still considered as an ideal material for photo-/electrocatalysis. Besides, there are also a few studies on the application of Cu2O in the fields of photo-electric catalysis [33–36] and photo-thermal catalysis [37]. The catalytic performance of Cu2O can be further improved by modifying it to meet the practical application requirements, such as carefully designing the morphology and composition of the catalyst. A number of strategies have been reported for improving the catalytic performance of Cu2O. For example, the selection of catalyst morphology and crystal facet directly determines the light absorption capacity and catalytic sites of the catalyst [19,38–40]; the construction of heterojunction or carbon matrix composites can effectively solve the shortcomings of photo-generated electron-hole complexation and improve charge transfer efficiency [41–43]; the introduction of another metal, by creating synergy with the semiconductor, affects the adsorption behaviour of the intermediate and improves the reaction selectivity [44,45]; and defective constructions allow flexible modulation of the local electronic structure of the catalyst and are critical to the reaction as active sites [46–49]. In summary, numerous factors have been shown to have a significant impact on CO2RR, such as copper valence states, unsaturated coordination sites, grain boundaries, vacancy defects, and doping atoms [50]. All of them can act as important active sites to influence the charge carrier transport efficiency and the adsorption behaviour of intermediates on the catalyst. Or some of them can interact synergistically with the catalyst, thus improving the stability and activity of the catalyst. However, no conclusions have been reached regarding the active phase/active substance in the copper oxide-mediated CO2RR. There are many opinions on the reasons for the increased catalytic activity and selectivity of the reaction, and the following are some of the current possible explanations: (1) Increase in electrochemically active surface area (ECSA). Wang et al. [51] demonstrated that increasing the roughness factor of copper electrode can reduce CO to generate multicarbon oxygenated oxides at low overpotential. This here, the increase in ECSA not only increased the reaction yield but also modulated the reaction selectivity. (2) Stronger intermediates binding sites. Lee et al. [15] showed that the intermediate CO has stronger binding energy on the Cu2O surface compared to pure metallic copper. And the high CO coverage favours the C-C coupling. (3) Higher density of grain boundaries. The study confirms the importance of grain boundaries in improving catalytic performance, with the potential to produce surfaces of long-lasting catalytic activity [52,53]. We can design grain boundaries to improve the selectivity of the C2 product by changing the reduction method of the oxide, for example. (4) Inhibition of CO protonation. When Yano et al. [16] investigated CO2 reduction on a copper electrode, they found that the Cu2O produced on the copper electrode favoured the selective generation of C2H4. The reason for this is that the presence of Cu2O hinders the protonation process of CO, thereby facilitating the C-C coupling reaction. (5) The synergistic effect of Cu0-Cu+. The synergistic effect of Cu0-Cu+ gives high efficiency to the reaction, improves the activation of CO2 molecules and *CO dimerization, and facilitates the generation of C2H4 [20,54,55]. Furthermore, Lin et al. [17] showed that the Cu0-Cu+ mixed valence region favours the formation of surface OH species. Catalysts with Cu0-Cu+ first provided asymmetric OCCO adsorption sites and subsequently promoted C2H5OH selectivity through the carboxylate stabilization effect of the OH group. Based on the above research, it is necessary to summarize a systematic review covering various types of strategies that can effectively improve the catalytic performance of Cu2O, especially for the environmentally friendly and easy-to-operate photo-/electrocatalytic CO2RR. A number of detailed reviews based on copper-based catalysts already exist. For example, Baran et al. [56] mainly reviewed the research progress of copper-based semiconductors as photocathodes in the areas of water decomposition and CO2 reduction, etc. Zhang et al. [57] reviewed the modification strategies of Cu2O-based photocatalysts and their applications, and discussed in detail the charge transfer pathways in photocatalysis. And Meng et al. [58] reviewed some modification strategies of copper-based catalysts for electrocatalytic reduction of CO2 in recent years. In addition, for theoretical studies, Zhang et al. [59] summarized the recent progress in simulating CO2RR and briefly introduced the application of machine learning (ML) in CO2RR. And the main purpose of this review is to gain insight into the current status of research on Cu2O-based catalysts in photo-/electrocatalytic CO2RR. We would like to study systematically on the application of modification strategies for Cu2O-based catalysts in CO2RR. Compared with the existing review studies on Cu-based catalysts, we focus on the application of Cu2O in photo-/electrocatalytic CO2RR. The article ranges from the existing common modification strategies used for Cu2O to the development of new efficient catalysts in the future, which is important for the design of efficient Cu2O-based CO2 photo-/electrocatalysts. Firstly, this paper analyzes the feasibility of Cu2O photo-/electrocatalytic CO2 reduction and briefly introduces the basic principles of photo-/electrocatalytic CO2 reduction. Secondly, the article provides a comprehensive review of different modification strategies used on Cu2O catalysts in recent years, in terms of both photocatalysis and electrocatalysis. For photocatalysts, the catalytic performance is mainly improved by morphology modulation, construction heterojunction or carbon-based composites, metal deposition and elemental doping. While for electrocatalysts, the main focus is on morphology modulation, metal deposition and defect engineering strategies. This is important for an in-depth understanding of the mechanisms influencing the activity, selectivity, and stability of the reaction. The main determinants of catalytic performance lie in the active site, defects, grain boundaries, and synergistic interactions among the components, etc. Finally, the article suggests the future development trend of Cu2O catalysts. We analyzed the development potential of atomically dispersed catalysts (ADCs), dual doping catalysts, frustrated Lewis pairs (FLPs) catalysts and tandem catalysts. These new and efficient catalysts have shown great advantages but have not been widely studied and applied to Cu2O. It also provides an outlook on the application of ML in CO2RR. We hope that this work will provide a reference for the design of Cu2O-based catalysts in industry and be a guide for the future direction of catalyst development. 2 Fundamentals of CO2 reduction In this section, the basic principles of photo-, electro-, and thermocatalytic CO2RR are briefly introduced. The differences in energy donors, reaction conditions and environments lead to differences in the mechanisms of photo-, electro-, and thermocatalytic CO2 reduction. Understanding the reaction principles of CO2 reduction is an important guide for the design of catalysts. 2.1 Photocatalytic CO2 reduction The photocatalytic CO2RR can be divided into five steps [60]: (1) adsorption of CO2; (2) semiconductor light absorption; (3) separation and transfer of photo-generated electron-hole; (4) occurrence of redox reaction; (5) desorption of products. As shown in Fig. 3(a), light irradiation produces electrons and holes in the semiconductor catalyst, which subsequently migrate to the catalyst surface for the reaction. Among them, the photo-generated electrons are used for CO2 reduction and the holes are used for water oxidation. The final reaction product is desorbed on the catalyst surface and the reaction is completed. The products of photocatalytic CO2RR are mainly CO, HCOOH, CH4 and CH3OH (Table S1). The reaction conditions are mild, only solar energy is consumed during the whole reaction process, and no additional energy input is required. In photocatalysis, the photo-responsiveness of the semiconductor and the separation and transport efficiency of the photo-generated carriers have a great impact on the reaction efficiency. Then the adsorption capacity of the catalyst surface on the key intermediates affects the formation and release of products, and a suitable adsorption capacity facilitates the reaction. Therefore, photocatalysts for CO2 reduction need to have a suitable band gap, a low photo-generated electron-hole complexation rate, and high catalytic activity. 2.2 Electrocatalytic CO2 reduction The electrocatalytic CO2RR can be divided into the following four steps [61]: (1) CO2 chemisorption; (2) electron and proton transport; (3) occurrence of redox reaction; (4) desorption of products. A typical electrocatalytic reactor (proton exchange membrane reactor) is shown in Fig. 3(b). For CO2RR, the reduction of CO2 occurs at the cathode, while the oxidation of water is generally carried out at the anode, and the electrolyte should have good CO2 solubility. CO2 is first adsorbed on the catalyst surface and subsequently interacts with electrons/protons to form the corresponding products. And finally, the products are desorbed from the catalyst surface into the electrolyte. The products of electrocatalytic CO2 RR mainly include C1 products such as CO, CH4 and CH3OH, and C2 products such as C2H5OH and C2H4 (Table S1), the reaction process is relatively mild and has a wide range of products. Since electrocatalytic CO2 reduction usually occurs in aqueous solutions, it is often accompanied by competing HER, resulting in a low FE of the target product. 2.3 Thermocatalytic CO2 reduction Thermocatalytic CO2RR is the reduction decomposition of CO2 by using high temperature and catalyst, which usually refers to CO2 hydrogenation reaction and CH4 reforming reaction. As shown in Table S1, in addition to the hydrogenation of CO2 to hydrocarbons, thermal catalysis also includes the generation of synthesis gas via CH4 reforming reaction, i.e. CO/H2, which is an important feedstock for Fischer-Tropsch synthesis. For CH4 reforming reactions, the reactions usually occur at high temperatures (600 ∼ 1000 °C) due to the high stability of CO2 and CH4, and the process has a serious drawback - catalyst deactivation caused by carbon deposition; for the CO2 hydrogenation reaction, the reaction temperature is relatively mild (250 ∼ 400 °C) and the hydrogenation activation of CO2 is thermodynamically favourable, but the high stability of CO2 and the high reaction potential of C-C coupling lead to relative difficulties in generating C2 products compared to C1 [21]. Therefore, in general, unlike high-temperature CO2 hydrogenation in thermal catalysis, photo- and electrocatalysis are essentially the same. Except for the different external energy utilized, they both involve the activated adsorption of CO2 on the catalyst surface, followed by a redox reaction that converts CO2 into a useful chemical. They also have some common thermodynamic basis, differing in that electrocatalysis has a relatively more complex C2 generation process. In addition, the catalytic reduction of CO2 is essentially a multi-electron transfer process, and the reaction is more complex with more pathways for product generation. From Table S1, we can see that the CO2 molecule has a high activation potential (-1.9 V vs NHE pH=7, or -1.49 V vs RHE) and the activation of CO2 is relatively more difficult compared to the subsequent generation of some reaction intermediates. In addition, since the electrocatalytic CO2RR usually occurs in aqueous solution and the close onset potentials, the HER is a common competitive side reaction in the CO2RR process. In a word, the high overpotential and the similar reaction potential of some products give the CO2RR a low conversion efficiency and selectivity. In the face of these problems, these three technologies are still progressing and evolving, and we cannot predict which one will be dominant in the future. Our current main task is to explore and develop suitable catalysts to improve the stability, mass transfer efficiency and other properties, which will be important for the improvement of reaction activity and selectivity. 3 Research status of Cu2O photocatalytic CO2 reduction Photocatalytic CO2 reduction can directly use solar energy to achieve the reduction of CO2, simulating the photosynthesis of plants in nature. It is carried out at room temperature and pressure with mild reaction conditions, which is an effective method to alleviate current problems such as energy issues and global warming [60]. Photocatalysis technology has attracted widespread attention for its green and renewable solar energy. It has potential application value and a good development prospect. However, photocatalytic CO2 reduction also faces many problems, such as the high activation potential of CO2 molecules, complex multi-electron reaction process, unfavourable thermodynamics and low selectivity of value-added products [62]. The search for catalysts with abundant reserves, excellent performance and high plasticity is the key to solving the above problems, which is beneficial for promoting the industrial application of photocatalytic CO2 reduction. 3.1 Advantages and shortcomings of Cu2O for photocatalytic CO2RR 3.1.1 Advantages As a common p-type semiconductor, Cu2O, which is abundant and environmentally friendly, has a suitable band gap (2-2.2 eV [11]) and a maximum absorption wavelength of about 560 nm, possessing a wide visible response range. And its theoretical photoelectric conversion efficiency is up to 20%, which can effectively utilize solar energy [63]. Second, Cu2O has a favourable energy band structure and possesses a more negative conduction band potential [12]. As shown in Fig. 4, the Cu2O conduction potential (-1.15 V vs. SHE) is lower than the catalytic reduction reaction potential of CO2, which can theoretically reduce CO2 to a variety of hydrocarbons [12]. It shows an attractive prospect in the catalytic reduction of CO2. 3.1.2 Limitations The Cu2O photocatalytic CO2RR suffers from three main problems: (1) A high complexation rate between photo-generated electrons and holes. This higher complexation rate leads to a lower utilization of photo-generated electron-hole, which greatly limits the photocatalytic activity [57]. (2) Severe photo-corrosion, which leads to a catalyst with poor stability [13]. The redox potential of Cu2O is located between its band gaps (Fig. 4(b)) and undergoes autoluminescent oxidation/reduction, hindering the overall reaction performance. Studies on the photo-corrosion mechanism of semiconductors have shown that the above problems can be solved by improving the effective transport and utilization of photo-generated electrons and holes [64]. (3) Valence band potential that is not favourable for water oxidation [12]. Bifunctional catalysts are desirable. Unfortunately, the Cu2O valence band potential is lower than the water oxidation potential, and the reduction of CO2 and the oxidation of water cannot be achieved on the same catalyst (Fig. 4(b)). This requires the modulation of the Cu2O energy band structure. 3.2 Strategies for building efficient Cu2O-based photocatalysts 3.2.1 Morphology and crystal facet modulation The most common problem of the Cu2O photocatalytic CO2RR is that the photo-generated electron-hole is easy to compound or cannot be transferred and utilized in time, causing photo-corrosion. The transfer of photo-generated electrons from the interior of the catalyst to the surface is the key to the photocatalytic reaction. Modulation of catalyst morphology and crystal facet are common methods to enhance its light absorption and improve electron transport, which can effectively remedy the above problems. The morphological structure of the catalyst has an important influence on the photocatalytic efficiency. For example, nanostructured photocatalysts provide a larger effective area and reaction sites, which are favourable for CO2 capture and conversion [65]. Thin film catalysts with uniformly distributed structures can improve the utilization and stability of visible light. Compared to bulk materials, there are abundant grain boundaries on the surface of thin films, which can promote charge transport between interfaces and lead to local electric field changes, improving the activity and stability of the catalysts [66,67]. Moreover, in addition to promoting the efficient utilization of charge, grain boundaries with mixed Cu valence states will further improve the selectivity of C2 product. The main reason for this is that the synergistic effect of Cu0-Cu+ enhances the adsorption of intermediate *CO, and the active site Cu+ promotes the occurrence of C-C coupling [68,69]. Nano-sized dendritic porous structures, on the other hand, can increase the reaction area and improve light collection. And it helps to improve the efficiency of photo-generated electron-hole transport and the mass transfer efficiency of CO2. Cui et al. [39] investigated the application of 3D-porous Cu2O with dendritic structure in catalytic CO2. They confirmed that the rough dendritic porous structure significantly improved the photo-generated carrier concentration (2.5-fold increase) and photo-corrosion resistance on Cu2O with a significant increase in CO yield. Edge-truncated Cu2O catalysts containing polycrystalline facets have also received attention in recent years for CO2 reactions [66]. The difference in the work function of different crystal facets affects the electron energy band structure and charge separation. It is confirmed that the charge separation can be realized in the anisotropic surface of the crystal, thus effectively solving the problem of easy compounding of Cu2O photo-generated electron-hole. Recently, Chen et al. [67] investigated the effect of facet engineering combined with defect construction on the charge separation behaviour on Cu2O catalysts, as shown in Fig. 5(a). The built-in electric field between the crystal facets generated by facet engineering drives the accumulation of photo-generated electrons on the Cu2O (001) surface (Fig. 5(b)-(c)). The reason for this is that the (001) surface has a more significant P-type feature due to the higher Cu vacancy density. And the electric field becomes significant as the (111)/(001) ratio increases. On this basis, the researchers introduced the strategy of spatially controlled defect engineering (hydrogen-compensated Cu vacancy defects (H-VCu)). It can selectively extract holes to the (111) surface (Fig. 5(d)), while maintaining the accumulation of electrons on the (001) surface. And they showed that extreme (H-VCu) binding is not conducive to this process, leading to the disappearance of surface electrons and diffusion of holes (Fig. 5(e)). That is, anisotropic surface engineering and defect engineering simultaneously ensure the transfer of electrons between facets to catalytic surfaces and defect-induced hole transfer to spatially separated surfaces. In addition to copper vacancies, the formation of oxygen vacancies in metal oxides can modulate the reducibility of metal oxides. The catalytic performance is enhanced by affecting the light absorption reaction, the transport of photo-generated carriers, and the promotion of the reaction in three ways [70]. The strategy of morphology modulation combined with defect engineering provides a good direction for catalyst development. 3.2.2 Heterojunction engineering To improve the photocatalytic activity of Cu2O, one of the important ways is to promote charge separation efficiency. Constructing Cu2O-based heterojunctions can improve photocatalytic efficiency by improving the light absorption range and photo-generated electron-hole separation efficiency [42,71]. At the same time, newly formed Cu2O-based heterojunctions can avoid the occurrence of Cu2O photo-corrosion. In addition, both catalysts in the Cu2O-based heterojunction participate in the reaction as the main catalyst, exhibiting high stability and photocatalytic efficiency. Fig. 6(a)-(c) show the common heterojunctions, which are divided into three types according to the mid-layer method: conventional type-I, type-II and type-III photocatalysts [72]. It can be seen from the figure that one semiconductor energy band is located between another semiconductor energy band in type-I, and both electrons and holes flow from the broadband to the narrowband. The two semiconductor energy bands are interleaved in type-II, with photo-generated electrons and holes moving in opposite directions. And in type-III, the valence band of one semiconductor is located above the conduction band of another semiconductor, and there is no common energy in the forbidden band. In contrast, type-II heterojunctions have stronger charge carrier transfer efficiency and can achieve effective spatial separation and utilization of electron-hole under photoexcitation. But their optimal conduction band and valence band potentials are not utilized. Based on this, the researchers proposed a Z-type catalyst structure (Fig. 6(d)) [73,74]- consisting of a hydrogen-producing photocatalyst (PSI), an oxygen-producing photocatalyst (PSII), and a redox electric pair. In the photocatalytic reduction process, the conduction band electrons of PSII are transferred to the valence band holes of PSI through redox pairs, while the conduction band electrons of PSI and valence band holes of PSII are enriched separately. These heterojunction catalysts possess strong redox ability while reducing the semiconductor photogenerated electron-hole complex. It has been found that even without an electron mediator, we can achieve a Z-type catalyst electron transfer path by selecting a suitable semiconductor [75]. There are many materials currently used to construct heterojunctions to enhance the catalytic performance of Cu2O, such as TiO2 [41,76–78], Fe2O3 [42], BiVO4 [71], WO3 [79], reduced graphene oxide [43] and organic backbone [80]. Fig. 7 shows the schematic diagram of the energy band structure of each semiconductor catalytic material. The matching energy band structure is the key to achieve CO2 reduction and H2O oxidation. The semiconductors with good visible light response and excellent oxidation ability of valence band holes are not less than excellent materials for forming heterojunctions with Cu2O. That is, the position of its valence band favouring the oxidation of H2O and the position of the conduction band of Cu2O favouring the reduction of CO2 are of interest. By fully utilizing the advantages of both semiconductors, the redox capability and stability of the catalyst can be enhanced to achieving both CO2 reduction and H2O oxidation. Currently, for the Cu2O-catalyzed CO2RR, the study of heterojunction catalysts focuses on C1 products (CO, CH4 and CH3OH). Ⅰ The reaction of CO2 to CO. Cu2O/Ti2O heterojunction: As a common photocatalyst, TiO2 has the advantages of stability and photo-corrosion resistance [81]. And it is widely used in CO2RR. Its wide forbidden bandwidth makes it poorly responsive to visible light. But, if a heterojunction structure is formed with Cu2O, the disadvantages of both sides can be better compensated, and the catalytic activity can be enhanced. Aguirre et al. [41] prepared octahedral Cu2O/TiO2 heterostructures and demonstrated the enhanced CO2 reduction activity of the catalyst. The CO production rate of this catalyst (RCO = 2.11μmol·gcat −1h−1) is four times higher than that of pure Cu2O under UV-Vis light ( Fig. 8(a)). And the Z scheme mechanism can fully utilize the valence band potential of TiO2 for the oxidation of H2O (Fig. 8(b)). α-Fe2O3/Cu2O heterojunction: α-Fe2O3 has a band gap width of 2.2 eV that responds well to visible light and a valence band position at 2.48 eV that favours the oxidation of H2O [82]. But the conduction band position is not favourable for the reduction of CO2. Its energy band structure is exactly complementary to Cu2O, and the composite will be an efficient photocatalyst. As shown in Fig. 8(c), Wang et al. [42] prepared α-Fe2O3/Cu2O catalysts by hydrothermal deposition, which achieved effective separation of photo-generated electrons and holes. The authors showed that the Cu/Fe ratio affects the CO yield. And the highest CO yield of 5.0 μmol·gcat -1 was obtained for the catalyst with 50% Cu content after 3 h of visible light irradiation (Fig. 8(d)). In addition, the detection of hydroxyl radicals confirmed that α-Fe2O3/Cu2O was a Z-scheme heterojunction, as the results indicated that the catalyst achieved the reduction of H2O at the same time. BVO/C/Cu2O heterojunction: Bismuth nanomaterials have also attracted extensive attention in recent years, especially the ternary metal oxide BiVO4, which has a similar forbidden bandwidth to α-Fe2O3. It is also an excellent photocatalyst for H2O oxidation [83]. Kim et al. [71] constructed BVO/C/Cu2O catalysts based on 3D Cu2O nanowire arrays (NWAs) on a reticular substrate. As shown in Fig. 8(e), Cu2O nanowires have efficient photo-generated electron-hole transport efficiency due to their large specific surface area. While BiVO4 particles and conducting carbon act as water oxidation photocatalysts and electron mediators, respectively. The BVO/C/Cu2O catalyst was a typical Z-type heterojunction with high redox potential and low photo-generated electron-hole complexation rate. And its CO generation rate (3.01 μmol·g-1·h-1) increased exponentially (Fig. 8(f)). Also because of the protection of the carbon layer, the catalyst maintained 98% of the initial conversion performance after five cycles (Fig. 8(g)). Cu2O/WO3 heterojunction: WO3 with a medium band gap (2.4-2.7 eV) and high oxidation capacity of valence band cavities has also been used to construct heterojunctions with Cu2O. Shi et al. [79] prepared Cu2O/WO3-001 and Cu2O/WO3 Z-type heterojunction catalysts with and without the main (0 0 1) crystal facet. They investigated the CO2 reduction performance of the catalysts in the presence of water vapour under visible light. It was shown that the (0 0 1) crystal facet of WO3 nanosheets can achieve the oxidation of H2O during the reaction (Fig. 8(h)), illustrating the importance of the crystal facet in the reaction process. The maximum yield of CO for the Cu2O/WO3-001 catalyst was 11.7 μmol, and it still had good catalytic performance after four cycles (Fig. 8(i)- (j)). PFC-45/Cu2O@CP heterojunction: Several of the materials mentioned above are oxide semiconductors. In addition, catalysts with non-homogeneous structures with excellent charge transfer efficiency have attracted attention in recent years. Among them, hydrogen-bonded organic frameworks are porous materials with high specific surface area and well-defined structures. As shown in Fig. 8(k), Zhang et al. [80] prepared a thin film catalyst (PFC-45/Cu2O@CP) by depositing porphyrin hydrogen-bonded organic framework (PFC-45) and Cu2O on carbon paper by electrophoretic deposition. The formation of heterojunctions and the presence of carbon paper greatly enhanced the efficiency of photo-generated electron-hole separation. And the structure of the film improved the visible light absorption of the catalyst. The catalyst exhibited high catalytic activity (11.81 μmol·g-1·h-1) and selectivity (99%) (Fig. 8(l)). In general, all the above materials effectively improve the photocatalytic performance of CO2 reduction. Among them, the PFC-45/Cu2O@CP catalyst has the highest CO generation rate, and next is the BVO/C/Cu2O catalyst. Both are ternary catalysts with the presence of an electron mediator C. And both carbon paper in PFC-45/Cu2O@CP and Cu2O nanowires in BVO/C/C/Cu2O provide large specific surface area, which further increases the catalytic performance of the material. The intrinsic kinetics of these catalysts in the above experimental studies has not yet been resolved. By comparing the yield alone, it can be seen that PFC-45/Cu2O@CP and BVO/C/Cu2O have a better reactivity, attributed to their large reaction area and higher mass transfer efficiencies. Ⅱ The reaction of CO2 to CH4. CH4 is the main component of natural gas, and it can store more chemical energy compared to CO. As an important fuel, it is significant to improve the selectivity of CH4 products. Ag/Cu2O@rGO heterojunction: Plasma metals (Ag [84,85], Au [86]) have a good CO generation ability attributed to their intermediate binding strength. By forming a composite with Cu2O, it facilitates the next reaction of the intermediate CO and can be used as an energy donor. As shown in Fig. 9(a), Tang et al. [43] prepared Ag/Cu2O@rGO catalysts. Among them, graphene oxide (GO) is rich in active sites due to the unique functional groups on the surface (surface extended Π-bonds) [87–89]. That can further improve the transport and utilization of photo-generated electrons. The catalyst exhibited an excellent CH4 production rate (82.6 μmol·g-1·h-1) and selectivity (95.4%). Fig. 9(b) shows a schematic diagram of the mechanism for the conversion of CO2 to CH4. The density functional theory (DFT) calculations showed that the protonation of the intermediate *CO is the key step in the selective catalytic reduction of CO2 to CH4. Cu2O/TiO2 heterojunction: Ali et al. [92] prepared reduced TiO2-Cu2O Z-type heterojunction catalyst (RT-Cu2O), which effectively inhibited the photo-corrosion of Cu2O. Meanwhile, RT has more excellent photocatalytic properties because of Ti3+ and Ov defects [93,94]. The reaction was carried out in a continuous flow photoreactor, which allowed the continuous generation of CH4. And the catalyst remained stable after 7 cycles (42 h). As shown in Fig. 9(c), Yang et al. [90] prepared Cu2O/TiO2 composite nanorods by chemical reduction method. The CH4 yield was as high as 1.35 μmol·g-1·h-1 within 4 h irradiation, which was 15 and 3.07 times higher than that of Cu2O and TiO2 alone, respectively (Fig. 9(d)-(e)). The enhanced reaction yield was attributed to the formation of p-n heterojunctions that inhibited the complexation of photo-generated carriers. And the effective utilization of photo-generated electrons and holes prevented photo-corrosion of the catalysts. Therefore, the stability of the catalyst was enhanced. Cu /Cu2O heterojunction: As shown in Fig. 9(f), Zhou et al. [91] prepared a metallic Cu-Cu2O heterojunction (Cu2O@Cu), which can reduce CO2 to CH4 and part of C2H4 by a simple in situ reduction method. Among them, Cu2O was a one-dimensional nanorod, which guaranteed excellent visible light collection capability. The presence of in situ generated Cu enhanced the conductivity and photo-generated carrier transport ability of the catalyst. The CH4 yield of this catalyst was four times higher than that of pure Cu2O (Fig. 9(g)), and the C2H4 yield increased only 1.46 times (Fig. 9(h)). Moreover, the catalyst remained stable after several cycles. This study is also the first in situ method to synthesize metal-semiconductor heterojunctions with efficient catalytic performance, which provides a useful reference for the future development of photocatalysts. Among the above materials, the CH4 yield of Ag/Cu2O@rGO catalyst was as high as 82.6 μmol·g-1·h-1, while Cu2O/TiO2 was only 1.35 μmol·g-1·h-1. The reason is that Ag has a high CO generation capacity. CO as an important intermediate in CO2RR, its generation and conversion have important effects on other hydrocarbon products. Ⅲ The reaction of CO2 to CH3OH. Compared to CO and CH4, CH3OH is a clean liquid fuel and an intermediate for the synthesis of important chemicals. The conversion of CO2 to CH3OH has attracted increasing attention. Cu2O/TiO2 heterojunction: TiO2, a common photocatalytic material, has also been used in the reaction of CO2 to CH3OH. Compared to TiO2 particles, TiO2 nanotube arrays (TNTs) have greater specific surface area and charge transport properties. Earliest, Wang et al. [76] prepared Cu2O/TiO2 composite nanotube heterojunctions (Cu2O/TNT). The formation of heterojunctions drives the effective separation of photo-generated electrons and holes. And the results showed that Cu2O/TNT exhibited high CH3OH catalytic activity. Later, Li et al. [95] prepared a ternary Cu2O-graphene-TiO2 nanotube catalyst (Cu2O/rGO/TNA) based on a binary catalyst. Graphene as an electron conductor enhanced the transfer of photo-generated electrons. And a double-chamber reactor driven by light has been developed. As shown in Fig. 10(a), the oxidation of H2O occurred at the light-irradiated side, while the reduction of CO2 occurred at the backlit side. This further limited the compounding of photo-generated electrons and holes. The reverse reaction was also prevented because of the separation of the active site. The methanol yield of this catalyst was 45 μmol·g-1·h-1, which was much higher than the other binary catalysts (Fig. 10(b)). Cu2O/PCN heterojunction: Polymeric carbon nitride (PCN) is a very excellent metal-free semiconductor for photocatalytic CO2RR. It has a better visible light response and reduction capacity [97,98]. For example, graphitic carbon nitride (g-C3N4) is a very familiar photocatalyst that has been widely studied. Recently, Tian et al. [96] prepared polymerized carbon nitride - cuprous oxide catalyst (Cu2O/PCN), which can be used for the conversion of CO2 into pure water. As shown in Fig. 10(c), the yield of CH3OH was 276 μmol/g in 8 h, with a high selectivity of 100%. The optimal path was given by DFT calculation. Fig. 10(d)-(e) shows the schematic diagram of the energy distribution and reaction mechanism of the reaction intermediate. Ultimately its shows that the formation of CH3OH is more favourable than CO and HCOOH on this catalyst. Few Cu2O-based heterojunction materials are currently available for the reaction of CO2 to CH3OH. Similarly, Cu2O/rGO/TNA catalysts containing electron conductors have the best CH3OH yields, again illustrating the importance of efficient photogenerated electron transport in photocatalysis. Also, the double-chamber reactor provides inspiration for the design of catalytic reactors. It prevents the photo-generated electron-hole complex and the reverse reaction to some extent. In general, the construction of heterojunctions is mainly through reducing the photo-generated electron-hole complex and making full use of the valence band/conduction band positions of both semiconductors as well as their respective advantages to form catalysts with stronger redox capability and stability. Eventually, the reduction of CO2 occurs on Cu2O and the reduction of H2O on another semiconductor. The efficient transfer of charge is the key to the reaction. Suitable material combinations can improve heterojunction efficiency. Matching energy band structures can promote charge transfer utilization, e.g., material combinations with similar energy band widths can have less electron-hole scattering, thus improving photocatalytic efficiency. The metal oxides mentioned in the paper (e.g., TiO2, Fe2O3, BiVO4) all have matched energy level structures with Cu2O and can form Z-type heterojunctions. The conduction band electrons of the other metal oxide are transferred to the valence band holes of Cu2O, so that the valence band holes of the other metal oxides and the conduction band electrons of Cu2O get aggregated to have a strong redox capacity. Some of these heterogeneous structures contain electronic conductors that can better facilitate the utilization of charge transport. For the metal-Cu2O heterostructure, the presence of metal enhances the electrical conductivity and photogenerated carrier transport ability of the catalyst, and facilitates the utilization of charge transport at the interface. The presence of the Schottky barrier effectively prevents the photogenerated electron-hole complexation. And for ternary heterostructures, one of the components is usually used to act as an electron conductor to further improve the transport efficiency of the photogenerated carriers. This can be a carbon material or a metal material, which effectively traps the photogenerated electrons by improving the electrical conductivity of the catalysts or by forming an electron trap effect. In conclusion, the construction of heterojunctions is an effective strategy to improve photocatalytic performance. Although the product generation rate and the stability of Cu2O were improved, they were concentrated on the C1 product. Further research and development are needed for the generation of the C2+ product. 3.2.3 Carbon-based composites The study of heterojunctions revealed that composite catalysts containing carbonaceous materials have more efficient photocatalytic activity, such as BVO/C/Cu2O catalysts containing conductive carbon [71], PFC-45/Cu2O catalysts deposited on carbon paper [80], Ag/Cu2O catalysts coated by rGO [43], and ternary Cu2O/rGO/TNA catalysts with rGO as the electron conductor [95]. The presence of carbonaceous materials promotes the efficient transfer and utilization of charge carriers, reduces the compounding rate of photo-generated electrons and holes. It can transfer electrons to the surface for CO2 reduction in time before they react with Cu2O, avoiding the occurrence of Cu2O photo-corrosion. In addition, carbonaceous materials generally have a large specific surface area. The uniform dispersion of the catalyst on this material improves the visible light absorption of the catalyst and provides a larger reaction site and more active sites. Therefore, by combining Cu2O-based catalysts with highly conductive materials such as carbonaceous materials, the photocatalytic activity of Cu2O materials can be greatly promoted, which is of great research significance. 3.2.4 Metal deposition Besides constructing heterojunctions, metal loading can also effectively solve the disadvantages of single semiconductor catalysts, such as poor light absorption ability, easy photo-generated electron-hole complexation and poor stability [99–102]. The photo-generated electron-hole complexation is the main reason for the low photocatalytic activity of Cu2O. And the loaded metal can effectively trap the charge carriers and suppress this unfavourable complexation. This is because by loading metal catalysts, Schottky barriers can be effectively constructed. Photo-generated electrons can flow from the semiconductor surface to the loading metal through the Schottky junction, reducing the complexation of holes. Also, the efficient utilization of charge carriers improves the light corrosion resistance of Cu2O. In addition, anchoring the metal as a co-catalyst to the semiconductor surface not only generates more active sites, but also creates a synergistic effect with the semiconductor. This will affect the adsorption behaviour of the intermediate and the activation potential of the reaction, prompting the reaction to occur. Zhang et al. [103] prepared Pd-modified Cu2O photocatalysts. Pd is widely used in CO2RR, which exhibits high selectivity for CO and formate [104]. The presence of Pd was shown to increase the charge mobility and photo-corrosion resistance of the catalyst. CO is the only product, and the yield increases exponentially in the Pd/Cu2O (100). However, the change in catalyst performance cannot be achieved at the Cu2O (111). Because the (111) facet has a relatively low work function ( Fig. 11(a)-(b)), which does not allow the charge transfer between Pd and Cu2O. The authors also demonstrated by BET and CO2 adsorption experiments that the introduction of Pd also enhanced the adsorption energy of CO2. The activation of CO2 adsorption is a key step of the reaction and has a significant impact. Overall, the results of this study suggest that the selection of exposed crystal facets and the charge migration between them and the loaded metals contribute to the reduction of CO2. Deng et al. [105] demonstrated that loading Cu0 on the Cu2O(111) facet accelerated the carrier separation efficiency and avoided photo-corrosion of the catalyst. This further increased the yield (78.4 μmol·g-1·h-1) and selectivity (97%) of CH4. It is suggested that the interface with a mixed Cu state improved the catalyst activity because of its high conductivity. Moreover, the authors showed that the Cu2O (111) facet allowed the selective catalytic conversion of CO2 to CH4, while the yield of CH4 in the (100) facet is negligible. The above two works also illustrated that the choice of crystal facets has an important effect on the reaction. The difference in the work function of different facets affects the electron energy band structure and the charge separation. In addition, plasma catalysis holds very good promise [106]. It can generate charge carriers with high kinetic energy and significantly improve photocatalytic efficiency and reaction activity [107–109]. Al, as a typical plasma metal, has outstanding optical properties [110]. Le et al. [111] investigated the mechanism of direct CO2 dissociation induced by plasma Al@Cu2O core-shell structure using DFT calculations. As shown in Fig. 11(c), the CO2 dissociation potential was reduced from 3.6 eV to 1.4 eV under photon excitation. And the reaction rate was significantly higher, allowing direct dissociation at relatively low temperature and ambient pressure. The catalyst had a higher selectivity for CO than CH4. The study demonstrates the positive role of plasma in CO2RR and suggests that Ag can also be used as a plasma core for CO2 reduction on Cu2O, providing a new idea for the development and utilization of catalysts. 3.2.5 Elemental doping It has been shown that Cu2O near-surface defects can capture photo-generated charges and thus facilitate the separation of photo-generated charges, providing a strong driving force [112]. Elemental doping, as a typical point defect, refers to the introduction of other elements into the Cu2O lattice. It affects the energy band structure of the catalyst or causes lattice distortion. And it is a simple method used to enhance photocatalytic activity and semiconductor photosensitization. For semiconductors such as TiO2 and ZnO, which have wider bandgap widths, they can only absorb ultraviolet light from sunlight and are less responsive to visible light. The main purpose of elemental doping is to adjust their energy band structure to give them improved visible light absorption [113,114]. In comparison, for Cu2O, the material itself has a better visible light response and a conduction band position favourable for CO2 reduction. Therefore, the main purpose of doping is to reduce the photo-generated electron-hole complexation rate of the catalyst and increase the charge carrier mobility thus improving the photocatalytic activity. The anion (F, Cl, N) doping can significantly improve the photocatalytic performance of the material. Yu et al. [49] prepared a Cl-doped Cu2O nanorod. Cl doping modulates the energy band structure of Cu2O, enabling the reduction of CO2 and oxidation of H2O over a single catalyst. And the catalyst exhibits enhanced CO2RR activity. As shown in Fig. 12(a), the Cl doping optimized the energy band structure of Cu2O. The doped catalyst has a relatively high valence band position, which can realize the reduction of CO2 and the oxidation of H2O simultaneously. It could realize CO2 reduction and water oxidation simultaneously. Cl doping also improved the catalyst conductivity, which enhanced the CO2 adsorption capacity and the separation transfer efficiency of photo-generated carriers. The catalyst had good CH4 yield and selectivity (Fig. 12(b)-(c)) and maintained some stability after several cycles (Fig. 12(d)). It was shown by DFT calculations that the Cl-doped Cu2O facilitated the conversion of CO2 to intermediates * COOH, *CO and *CH3O compared to the pure Cu2O catalyst (Fig. 12 (e)). This reduced the difficulty of the reaction and enhanced the CO and CH4 generation activity. That is, in addition to the enhancement of catalytic activity, doping also forms new active sites that affect the adsorption behaviour of intermediates, thus promoting the improvement of product selectivity. For the photocatalytic reduction of CO2 by Cu2O, the biggest problem lies in solving its photo-generated electron-hole easy complexation and photo-corrosion, and the above methods have been effectively tried with excellent results. The compounding rate of photo-generated electrons and holes is reduced mainly by introducing a second component or a protective layer, which improves catalyst stability while providing more active sites. 3.3 Mechanistic study of Cu2O-based photocatalysts Based on the study of 3.2, we found that for photocatalysis, currently, the products are concentrated on the C1 products (CO, CH4, CH3OH). Catalysts with higher CO binding energy are expected to generate CH4/CH3OH value-added products, and the stronger binding energy promotes the next step of CO conversion. Tang et al. [43] prepared Ag/Cu2O composite catalysts in which the presence of Ag provided high CO coverage and the favourable protonation of *CO in the reaction was essential for the generation of CH4. Tian et al. [96] prepared a Cu2O/PCN catalyst, which showed that the thermodynamic potential barriers for the formation of *CHO from *CO on this catalyst were lower than those for *COH and desorption, facilitating its subsequent formation of CH3OH. Yu et al. [49] prepared Cl-doped Cu2O catalysts, where doping promoted the reduction of CO2 to the intermediates * COOH, *CO, and *CH3O, and in particular the lowering of the potential barrier of *CH3OH, which facilitated the generation of CH4. In summary, for the generation of the C1 product, which does not involve a C-C coupling process and has a relatively simple reaction pathway, it lies mainly in the competition between the *CO desorption and protonation processes. Stronger *CO adsorption energies and lower protonation reaction barriers are essential for the generation of the multivalent products CH4 and CH3OH. We can predict the desorption energy and protonation potential of *CO on the catalyst based on DFT calculations, which helps us to develop efficient catalysts. Based on the above literature research, for Cu2O, the common products are CO, CH4, and CH3OH. And based on different modification strategies and reaction conditions, the yields of CO are concentrated around 1.5∼12 μmolgcat −1h−1; CH4 yields up to 80 μmolgcat −1h−1; the yields of CH3OH are around 34∼45 μmolgcat −1h−1. Based on a single Cu2O catalyst, the yields increased exponentially. For other photocatalysts, TiO2 [115], experimental studies have shown that its CO yields are concentrated around 0.15∼14.54 μmolgcat −1h−1, which is about the same as that on Cu2O; and the CH4 yields are mainly concentrated around 1∼23 μmolgcat −1h−1 which is lower than that on Cu2O, but one study showed that a one-dimensional structured TiO2-loaded Pt nanoparticle catalyst showed a CH4 yield as high as 1361 μmolgcat −1h−1 [116], which is much higher than that of the other catalysts; the yields of CH3OH are concentrated around 10 μmolgcat −1h−1, which is lower than that on Cu2O. For metal sulfides [117], the CO yields ranged from tens to hundreds to thousands of μmolgcat −1h−1 with good CO generating capacity; CH4 yields are concentrated below 10 μmolgcat −1h−1, much lower than those on Cu2O; and CH3OH yields are concentrated below 10 μmolgcat −1h−1, lower than those on Cu2O, but the Bi2S3- and CdS-based catalysts show yields as high as around 134 and 145 μmolgcat −1h−1. For the carbon nitride-based catalysts [118], they also have high CO generation yields of 54, 77.8 and 188 μmolgcat −1h−1, but their CH4 and CH3OH yields are both much lower than those on Cu2O, which are basically below 5 μmolgcat −1h−1. Overall, the yield of CO on Cu2O is not as good as the other three catalysts compared to the other catalysts, but it is more dominant for the generation of CH4 and CH3OH, which is more attractive. The ability to generate C1 products on the Cu2O has been improved, but we still need to work on the selective generation of C2+ products. Further development is needed to find more efficient and stable Cu2O-based photocatalysts. 4 Research status of Cu2O electrocatalytic CO2 reduction Electrocatalytic CO2RR is simple in operation, mild in conditions, and has diverse reduction products [119,120]. Moreover, electrocatalysis can be powered by clean energy sources such as solar, wind and geothermal, which are green and environmentally friendly. It can realize the effective use of renewable energy in CO2 reduction and provide a broad prospect for its large-scale industrial application [121]. For example, electrocatalysis can be based on photocatalysis by using an optical semiconductor as an electrode and applying a little bias voltage to achieve the separation of electron-hole. This effectively improves the shortcomings of photo-generated electron-hole complexation. However, the electrocatalytic reduction of CO2 is still challenging, due to the chemical inertness of the CO2 molecule, complex multi-electron processes, and the competing HER. This produces many disadvantages of CO2 electrochemical reactions as the following: high reaction potentials, low FE due to competing side reactions, and low selectivity for a given product due to a plurality of formed products [122]. In addition, the following factors limit its practical application in industry. First, the stability of current catalysts still does not meet industrial requirements. Second, the current density of the C2 product is lower relative to the C1 product during the reaction. Third, it is usually at higher overpotentials that the reaction can produce a higher FE. Therefore, the development of efficient, cheap and easily available electrocatalysts has become the focus of CO2 electroreduction. 4.1 Advantages and shortcomings of Cu2O for electrocatalytic CO2RR 4.1.1 Advantages Early studies on electrocatalytic electrodes focused on metal electrodes, and Hori et al. [123] classified metal catalysts into four categories based on CO2 reduction products: (1) Au, Ag, Pd, Ga, Zn, which mainly produce CO; (2) Bi, Pb, Sn, Cd, Hg, In, Tl, which mainly produce formate; (3) Cu and Cu alloys, which can produce C2 products; (4) Ni, Ti, Pt, Fe, which favours the HER reaction. The unique properties of copper-based catalysts are thus revealed, mainly in the suitable CO binding energy and the generation of multicarbon products [124]. Various copper-based catalysts have been developed to improve the disadvantages of metallic copper such as high overpotential, slow kinetics and low stability [58]. Among them, Cu2O is of interest because of its high FE of C2 products (C2H4, C2H5OH) [15–17]. Compared to bulk flat metallic copper, Cu2O has a higher specific surface area, providing more active sites and a surface rich in defects. First, it has been shown that Cu2O has a stronger CO binding energy compared to metallic copper [15] and inhibits the CO protonation process [16], resulting in a stronger C2 product generation. Secondly, for Cu2O, its surface is prone to low-coordinated copper atoms during electrochemical processes, often in a mixed state of Cu0-Cu+, which synergistically have improved catalytic properties [20,54,55]. Yao et al. [125] showed that Cu2O formed low-coordinated surface Cu atoms during electrocatalytic CO2 reduction. DFT calculations showed that the adsorption capacity of Cu atoms for CO and COH was enhanced with a lower number of atom coordination. It has also been previously shown that low-coordinated copper atoms favour CO adsorption [126] and CO hydrogenation to CHO [127]. And for Yao's study, the CO-COH coupling barrier decreased with decreasing coordination number, which was more favourable than the CO-CO coupling mode. The FE of the C2 product was as high as 77.8% (-0.69 V, 300 mA/cm2) under alkaline conditions. Overall, Cu2O exhibits a great potential for electrocatalytic CO2 reduction. 4.1.2 Limitations First, CO2 activation to generate intermediate *CO2 - requires a high reaction potential and energy [128]. The higher activation potential increases the difficulty of the electrocatalytic reaction. Second, the products of electrochemical reduction reaction are highly dependent on the applied voltage [6]. Due to the presence of multiple adjacent reaction intermediates and complex proton-coupled electron transfer in CO2RR, the product species are sometimes not homogeneous and need to be further isolated. We can adjust the adsorption behaviour of the reaction intermediates and optimize the reaction path by modifying the catalyst to promote the selective generation of a single product. Third, Cu2O is easily reduced during the reaction process, and although Cu2O that generates low-coordinated copper atoms on the surface has an improved ability to generate C2 products, too much or too little of it affects the activity of CO2RR, resulting in reduced catalytic performance [24]. We need to optimize the number of low-ligand copper atoms to prevent catalyst deactivation. Finally, due to the close onset potentials, the HER is a common competitive side reaction in the CO2RR process [129]. Further improvement of the selectivity of high-value products on Cu2O-based catalysts by inhibiting the HER through modification of the catalysts is the focus of electrocatalytic CO2RR. 4.2 Strategies for building efficient Cu2O-based electrocatalysts 4.2.1 Morphology and crystal facet modulation I Morphological modulation. The morphological structure of the catalyst has an important influence on the CO2 reduction performance of the material. Morphology modulation achieves changes in catalyst performance by affecting the reaction area, mass transfer rate and active sites. It can effectively improve the FE of C2 products on Cu2O catalysts. Different structures have their own advantages. The common types of catalyst structures with high performance are mainly thin film structures, porous structures, and nano-cavity and core-shell structures. Film structure: Thin film catalysts with uniformly distributed structures have higher stability than powder catalysts that tend to agglomerate. And the grain boundaries on the surface of the film facilitate the improvement of C2 product selectivity. First, the presence of grain boundaries not only promotes the transport and utilization of electron, but also leads to changes in the local electric field. It also provides more active sites, which affects the adsorption behaviour of the reactive intermediates and promotes the dimerization of the C1 intermediates [130]. Secondly, the Cu2O film is easily reduced to generate Cu0 during the reaction process, forming a Cu+-Cu0 interface at the grain boundary. The synergistic effect of Cu+-Cu0 enhances the adsorption of *CO and lowers the reaction barrier, thus facilitating the C-C coupling reaction [131]. Overall, the grain boundaries on the surface of thin films can effectively improve the performance of catalysts, but we need more theoretical and experimental studies to understand the mechanism of their influence. In addition, there are various methods for thin film preparation, including electrophoretic deposition, where layers of different thicknesses can be easily formed by varying time and voltage. Ren et al. [24] prepared Cu2O thin films with different coverage thicknesses (0-8.8 μm) by electrodeposition. As can be seen in Fig. 13(a)-(d), the yield of CH4 was significantly reduced on all the Cu2O thin film catalysts. Among them, the 1.7 μm-thick catalyst has the highest FE of C2 (39% for C2H4 and 9% for C2H5OH, at 0.99 V), while the HER becomes favourable on the 8.8 μm-thick catalyst. This is due to the fact that it has an excess of ligand-unsaturated copper atoms on its surface, resulting in stronger binding to hydrogen atoms. And the study indicates that the film thickness greatly affects the reaction selectivity. Fig. 13(e) showed a schematic diagram of the mechanistic model for the reduction of CO2 to C2H4/C2H5OH. It involves the generation of the intermediate *CO and its continued hydrogenation to CH4 or dimerization-hydrogenation to C2HxO2, and C2HxO2 is further reduced to C2H4/C2H5OH. For the generation of C2H4/C2H5OH, *CH2CHO is an important common reaction intermediate. The higher FE for C2H4 in this study is attributed to the energetically favourable hydrogenation of *CH2CHO to C2H4. In addition to the effect of pH at the electrode surface, the optimized edge and step densities on this Cu2O thin-film catalyst are also critical for the dimerization of the reaction intermediates. In addition, the authors refer to studies that suggest a kinetically more favourable C-C coupling process if the direct reactant is *CHO / *CH2O rather than *CO. That is, the direct dimerization of *CO is slow and has a high reaction potential. In contrast, the first hydrogenation of *CO to form *CHO and the subsequent reaction with the other hydrogenation product (*CHxO) is kinetically more favourable [132]. That is, as also mentioned before, other C-C coupling schemes show more favourable advantages. Porous structure: The nanometer-sized dendritic porous structure can increase the reaction area, improve the current transfer efficiency and the CO2 mass transfer efficiency. And it can optimize the selectivity and activity of the reaction by affecting the adsorption behaviour of the intermediates. Feroze et al. [135] prepared Cu2O electrodes with a dendritic structure. In addition to the increase of the active surface, its rough and porous structure changed the adsorption properties of the intermediate. The results showed that the presence of this structure enhanced the stability of the catalyst and the selectivity of the C2H4 product. Nanocavity and core-shell structures: Such structures can directly or indirectly stabilize the active species Cu+ by controlling it in a certain region and preventing it from being reduced, thus facilitating the C-C coupling reaction [136]. Yang et al. [133] prepared a multi-cavity structure of Cu2O and showed that the in situ generated carbon intermediates were confined within the Cu2O cavity. The increased intermediate coverage prevented the reduction of the active species Cu+ and improved the possibility of C-C coupling (Fig. 13(f)). The FE of the C2 product of this structured Cu2O catalyst was up to more than 75%. Cheng et al. [134] also considered Cu+ as the active species for the generation of C2 products from CO2RR. And they suggested that the suitable binding energy and the stability of Cu+ on the Cu2O surface are crucial for the high selectivity of C2 products. Therefore, they prepared Cu2O@K-PBA core-shell structured electrocatalysts and showed that the K-PBA shell layer protected the Cu2O active nucleus (Fig. 13(g)). And due to the formation of a dipole field, the adsorption energy of the intermediate with dipole moment was enhanced. In other words, the change of the inherent adsorption energy of Cu2O promoted the formation of C2 products while inhibiting the production of CH4. II crystal facet modulation. Metal oxide surfaces have a more complex morphological structure than metals. The crystal faces exposed on the metal oxide particles not only determine the surface geometry but also strongly influence the selective generation of intermediates during the reaction. This is manifested by the presence of different active sites, surface structures, and atomic bond lengths on different crystal facets, which have different absorption/desorption energies for intermediates [137–139]. A deeper understanding of the active crystal facet and catalytic sites of crystals is of great importance for catalyst performance enhancement. A lot of work has been carried out to investigate the activity and selectivity of reactions on different crystal facets of Cu2O. Single crystal facet study: Fu et al. [40] prepared Cu2O nanoparticles with different morphologies and crystal facets. As shown in Fig. 14(a), abundant crystal defects/grain boundaries were observed on the reconstructed concave octahedral Cu2O surface with high index crystal facets, which may act as an active site for C-C coupling. And the reaction process would generate Cu2O nanocrystals with a smaller size to achieve efficient production of C2+ by CO2 reduction. Zhang et al. [18] also prepared hollow Cu2O with abundant defects and step facets (Fig. 14(b)). The authors showed by DFT calculations that the high index crystal facet of Cu2O and the high CO coverage on the surface are favourable for C-C coupling. In addition to the C2 product, it also has a high FE for n-propanol (8.21%). The above work shows that high index crystal facets contain a large number of grain boundaries and unsaturated atoms, resulting in high catalytic activity. Liu et al. [140] prepared Cu2O nanoparticles with different crystal facets by hydrothermal method, including Cu2O-c (cubic structure with (100) crystal facets), Cu2O-o (octahedral structure with (111) crystal facets), Cu2O-t (truncated octahedral structure with (100) and (111) crystal facets) and Cu2O-u (sea urchin-like structure with (100), (220) and (222) crystal facets), indicating that the (111) facet favours the reduction of CO2 to alcohol (Fig. 14(c)). The crystal facet-dependent effect is related to the oxygen vacancy concentration, the CO2 reduction energy barrier and the different Cu-O bond lengths on each crystal facet. As shown in Fig. 14(d), among the constructed Cu2O nanoparticles, the octahedral structure Cu2O-o with (111) crystal facet had the highest total FE (35.4%) for the alcohol product. This is due to the abundant oxygen defects and short Cu2O bonds on the (111) crystal facet that confer lower activation potential and kinetic barriers to the catalyst. And the surface reconfiguration of Cu2O made the catalyst rich in Cu0 and Cu+ sites, which could promote CO2 activation and CO* adsorption, thus enhancing C-C coupling. Luo et al. [141], on the other hand, showed that the Cu2O (322) crystal facet facilitates the selective generation of C2H4 with a FE of 74.1%. It was also shown by DFT calculations that the presence of (322) crystal facets can significantly reduce the Gibbs free energy in the C-C coupling process, thus significantly improving the selectivity of C2H4. Poly-crystal facet effect: Since the crystal anisotropic facets can realize the separation of charge transfer, the activity of Cu2O is effectively enhanced. And the synergistic effect between the crystal faces promotes the C-C coupling reaction and improves the selectivity of C2 products. In recent years, edge-truncated Cu2O catalysts containing multiple crystal facets have received attention in CO2RR. Gao et al. [142] investigated the effect of Cu2O nanoparticles with different morphologies ( Fig. 15(a)) on the electrocatalytic performance of CO2 to C2H4. As shown in Fig. 15(b), Cu2O with (111) and (100) crystal facets had the highest selectivity of C2H4 with a FE of 59%. This is because the Fermi energy level of Cu2O on the (111) face is lower than that on the (100) face, promoting the charge transfer between the Cu2O (111) and (100) faces. And it further promoted the multi-electron correlation kinetics of ethylene production. The above studies show that the modulation of the catalyst morphology and crystal facets can not only enhance the reaction activity but also significantly improve the selectivity of C2 products. For CO2 reactions with similar product reduction potentials, this strategy is very advantageous. And it is often used for electrode modulation in electrocatalytic reactions. If morphology and crystal facet modulation are used in combination with other strategies (co-catalysts or doping, etc.), more active sites can be provided. By modulating the adsorption behaviour of the reaction intermediates to have lower reaction barriers, and the reaction can also achieve higher FE at lower overpotentials. 4.2.2 Metal deposition It has been mentioned previously that metal loading can realize the separation and utilization of photo-generated electron-hole in Cu2O photocatalytic CO2RR. It can effectively solve the problem of low Cu2O photocatalytic performance. Facing the problems of high reduction potential, low energy conversion efficiency, poor selectivity and obvious competitive HER in the Cu2O electrocatalytic CO2RR, metal loading is still an effective strategy. In addition to the increase of electrical conductivity and active sites, it was shown that metals and semiconductors create synergistic effects that make possible the occurrence of complex CO2RR. This synergistic effect influenced the adsorption behaviour of the intermediates of the electrochemical reaction process and contributed to the selective generation of C2 products. Earlier, Won et al. [34] showed that loading metals catalysts on CuO/Cu2O thin films can effectively enhance the FE of CO2 conversion to fuel ( Fig. 16(a)). Later, many more studies have been carried out for the reduction of CO2 by Cu2O loaded transition metals. The type of transition metal largely determines the selectivity of the product. The following are some of the studies on the application of transition metal (TM)-Cu2O catalysts in CO2RR. Ni-Cu2O catalysts: It has been previously shown that Cu2O and Ni deposited on the surface of tin-doped indium oxide (ITO) can promote the oxygen evolution reaction (OER) in alkaline solutions [145]. The Ni-Cu2O composite catalyst would be a promising bifunctional catalyst for CO2RR and OER that is of interest. Pan et al. [44] prepared a bifunctional Ni-Cu2O electrocatalyst using electrodeposition, and it was the first reported bifunctional catalyst for CO2RR and OER. When the applied potential was switched between oxidizing and reducing conditions, the CO2RR and OER could be realized at the same electrode. The synergistic effect between Ni and Cu2O and the presence of a porous carbon substrate maximize the bimetallic active site for CO2 reduction, improving the FE of the formate and CO. At the same time, the current density of the OER increases exponentially. Ag/Cu2O catalysts: More studies have also been carried out for metal Ag-Cu composites. It is well known that transition metal Ag catalysts have high selectivity for CO [84,85], and the high coverage of CO is favourable for C-C coupling to generate C2 products. At the same time, the HER is inhibited because of the relative reduction of *H coverage. Gao et al. [45] demonstrated that Ag-covered Cu2O nanowires have high FE (76%) for C2H4 and other C2+. Both the selectivity and activity of the catalysts were effectively improved. In addition, Herzog et al. [146] uniformly loaded Ag nanoparticles on Cu2O nanocubes to study the application of Ag/Cu2O composite catalysts in electrocatalytic CO2RR. Under the same conditions, the Ag/Cu2O catalyst had double the FE of C2+ liquid fuel products (ethanol, 1-propanol and acetaldehyde) compared to the single Cu2O catalyst. And the generation of formate and H2 was inhibited, probably due to the structural rearrangement caused by the surface silver-copper alloying. The increase in the Cu-Ag atomic distance relative to the Cu-Cu distance changes the binding energy of the intermediates, which favours the formation of C2+ product alcohols/formulas. Au/Cu2O catalysts: In addition to Ag, Au metals can generate CO at low overpotentials and also show high activity for the generation of CO in electrocatalytic CO2RR [86]. That is to say, the synergistic interaction between the active centers on Ag and Au that generate CO and those on Cu2O that generate C2 further improves the selectivity of the C2 product. Earlier, Tan et al. [143] investigated the effect of cubic Cu2O@Au catalyst on electrocatalytic CO2RR. The results showed that this catalyst could improve the FE of CO by about twice as much as Cu2O and Au alone (Fig. 16(b)). The authors showed that the enhanced catalyst performance is related to the interfacial effect of the metal oxides, which enhances CO2 adsorption while facilitating charge transfer. In addition, Zhang et al. [144] prepared Aux/Cu2O composites by loading Au particles(7 nm) on hollow Cu2O nanospheres(150-180 nm). The composite catalysts significantly improved the FE of CO and C2H5OH and inhibited the HER. The increase in C2H5OH yield lies in the Au site which facilitated the formation of CO and promoted C-C coupling. Since C2H4 and C2H5OH have similar reaction pathways (Fig. 16(c)), that is, the *HOCCH to *HOCHCH hydrogenation pathway and the *HOCCH to *CCH de-hydroxylation pathway, the authors showed that the loaded metal Au content influenced the C2H4/C2H5OH ratio. After that, their research group investigated the effect of Au/Cu2O catalyst on C2H4 selectivity [147]. And the results similarly showed that the optimal Au/Cu ratio affected the effective sequential catalysis between Au and Cu2O. That can improve the selectivity of C-C coupling to C2H4 and C2H5OH, indicating that the metal loading has an important effect on the reaction products. Studies on Au/Cu2O catalysts have also shown that the structural morphology of Cu2O also affects the selectivity of the products. As shown above, the Cu2O catalysts with surface loaded metals can effectively promote the charge transfer and provide more active sites. The synergistic effect between the metal and the oxide improves the activity of the reaction and the FE of the product. Interestingly, different loading metals have different selectivity for the reaction. As in previous studies of CO2 reduction products on various pure metals, the product distribution on metal-Cu2O catalysts is strongly influenced by the loading metal. For example, the presence of Ni contributed to OER, and the Ni-Cu2O catalyst improved formate and CO selectivity, but did not promote C2 product selective generation; The presence of Ag, Au due to increase the coverage of CO, its synergistic effect with Cu2O greatly contributes to the generation of C2. We could start a study of other metals (e.g., Zn, Pd) that favour CO production and perhaps have promoted C2 production as well. 4.2.3 Vacancy defects and doping on the surface of Cu2O Surface defects have attracted extensive attention as important active sites for metal oxide-based catalysts. The construction of defects is an effective means to improve the catalyst performance, which affects the binding energy of key intermediates during the reaction. Point defects are generally studied mainly, and common crystal defects are vacancy defects and impurity defects (doping) [148]. Ⅰ Vacancy defect. Vacancy defects are the formation of Cu vacancies (Cuv) or O vacancies (Ov) on the surface of Cu2O, and the formation of vacancies can be controlled by changing the deposition potential with ease of operation [149]. Vacancies can modulate the electronic structure of the surrounding atoms and change the energy barrier of the rate-limiting step in the reaction [150]. The introduction of Cu vacancies will reduce the forbidden band width of Cu2O. The small forbidden band width makes it easier for electrons to be excited on the conduction band and enhances the electron transfer ability. It can effectively reduce the overpotential of the reaction and improve the activity of the electrocatalyst. Ren et al. [46] constructed Cu vacancies by etching during the synthesis of Cu2O catalysts to investigate its effect on the distribution of products in CO2RR. XPS and DOS results showed that the presence of Cuv changed the electronic structure and the forbidden band width of the catalyst. In addition, as shown in Fig. 17(a)-(b), the construction of Cuv also inhibited the occurrence of HER and generated C2H4 products with higher FE at a smaller overpotential. This is because the introduction of Cuv changed the adsorption energy of the intermediate species *CO, *CH2 and *COH on the catalyst surface (Fig. 17(c)). The suitable adsorption energy facilitated the next reaction of the intermediate products, reduced the Gibbs free energy of *CO hydrogenation and C-C coupling. Therefore, the conversion of CO2 to C2H4 was promoted. It is well demonstrated that the presence of Cuv facilitates the enhancement of the catalytic performance of Cu2O and improves the selectivity of the C2 product. For O vacancies, in previous studies, it was found that CO2 is non-activated adsorbed on the perfect surface of Cu2O. While it can be physically or chemically adsorbed on the defective surface in the form of molecules, carbonates or CO2-, and can even dissociate into CO molecules and lattice oxygen atoms to repair O vacancies [151–153]. In conclusion, the presence of O vacancies promotes the activated adsorption of CO2, which is very important for the reaction. Wang et al. [47] reported a method for combined modulation of Cu2O morphology and O vacancies by ionic liquids. The ionic liquid [Omim]Cl (1-octyl-3-methylimidazolium chloride) was used as a bifunctional structure guide to prepare Cu2O nanoparticles with a rough surface and rich in O vacancies. Among them, [Omim]+ played a role in regulating the Cu2O morphology, while Cl- led to the formation of O vacancies by coordination with Cu+. As shown in Fig. 17(d), the catalyst showed a high total FE of C2 of 78.5 ± 2% at 1.1 V. That because the presence of Ov enhanced the adsorption of the intermediate *CO and reduced the free energy of the reaction, thus promoting C-C coupling (Fig. 17(e)-(f)). Ⅱ Impurity defects. (1) Metal doping: For electrocatalytic reactions, we often achieve the improvement of electrocatalytic performance by doping with metal elements. The introduction of a second metal element can change the inherent nature of Cu2O. And the synergistic effect between metals has an positive impact on the catalytic performance and product selectivity. It can effectively solve the problems of complex CO2 electrochemical reactions and a large variety of products. Different metal doping has different effects. Baran et al. [56] showed that alkali metal doping is a combined effect of electronic and geometric effects leading to a reduction in the band gap; Zn, as donor impurities in Cu2O, can affect the lattice constant and band gap; Ag doping has a greater effect on conductivity and photocurrent density; Fe doping is beneficial to the formation of defects and the improvement of conductivity. In addition, there are many atoms used for doping, which are not listed here. The following are some applications of elemental doping on Cu2O. Ag doping：It was shown that the transition metal Ag has high selectivity for CO [84,85]. And the coverage of intermediate CO can be improved by Ag doping, which is conducive to the subsequent C-C coupling reaction. This plays an important role in improving the selectivity of C2 products. Lee et al. [154] prepared Ag-doped Cu2O catalysts, which exhibited high C2H5OH selectivity. The authors constructed catalysts with two different elemental arrangements: phase blending (Ag-Cu2OPB) and phase separation (Ag-Cu2OPS), and the addition of Ag inhibited the HER. As shown in Fig. 18(a), the FE of C2H5OH on Ag-Cu2OPB was three times higher than that of Cu2O catalyst alone. And showed that it was more efficient than the Ag-Cu2OPS, probably because of the presence of more Ag-Cu two-phase boundaries, which promoted the insertion of CO into the bond between CH2 and Cu (Fig. 18(b)). That is, the portion of Ag-Cu two-phase boundary promotes the CO-insertion reaction, which increases the C2H5OH production. This also illustrates the importance of crystal boundaries. In doping: In has very large potential, and it has been shown that the synergistic interaction between Cu-In can promote the adsorption of intermediates *COOH and inhibit the adsorption of *H, favouring the selective production of CO [157,158]. CO is used as an important chemical raw material to prepare a variety of chemicals and is also a good reducing agent. Larrazábal et al. [48] studied the effect of In, Sn, Ga, and Al element doping on the selectivity of the Cu2O-catalyzed CO2RR. The results showed that Sn and In-doped Cu2O further improved the current efficiency of CO (about 75% after 12 h at -0.6 V). In contrast, Al significantly altered the selectivity of the catalyst, reducing the selectivity for CO but facilitating the reduction of CO2 to C2H4, n-propanol and C2H5OH. Wang et al. [155] also showed that In-Cu@Cu2O catalysts can selectively electro-reduce CO2 to CO. The FE of CO generation reached 87.6 ± 2.2% (Fig. 18(c)) and the total current density was 11.1 ± 0.85 mA·cm2 at -0.8 V, which was better than most reported copper-based electrocatalysts. The reason is that the doped In content can regulate the Cu+/Cu0 ratio and charge distribution, etc., while the synergistic effect between Cu and In can enhance the adsorption of *COOH. Sb doping: Sb is gradually attracting attention for its ability to promote the selective production of CO [159]. Chen et al. [156] developed an antimony-doped Cu/Cu2O catalyst (Cu/Cu2O-Sb) for the electrocatalytic reduction of CO2 to CO. As shown in Fig. 18(d)-(e), the doping of Sb inhibited the HER and enhanced the activation of CO2. The pre-adsorbed *CO on its surface promoted the desorption of adjacent *CO, and it was the key to the selective catalytic reduction of CO2 to CO (Fig. 18(f)). (2) Non-metallic element doping. It has been suggested that the reduction of Cu+ active species is associated with the loss of lattice oxygen atoms in Cu2O [160]. The weak metal-oxygen bonds are prone to receiving electrons and breaking. Therefore, stabilizing the lattice oxygen in Cu2O is beneficial to enhance the performance of Cu2O catalysts in CO2RR. In response, Yao et al. [161] doped B in Cu2O and showed that B could effectively inhibit lattice oxygen in Cu2O, thus significantly improving the stability of Cu+. The activity and selectivity of CO2 conversion to C2H4 on B-Cu2O catalyst was enhanced and the product ratio after doping (C2H4/CO = 2.5) was 3.5 times higher than that of pure Cu2O. This was related to the formation of B-O bond and the enhancement of Cu-O bond, which gave the intermediate *CO a lower generation energy barrier and thus affects the generation of the product to C2. In addition, doping is also an effective means to optimize the adsorption behaviour of key intermediates in the CO2 reduction process. It can promote the selective generation of specific products. Ma et al. [162] investigated the effect of S doping on the reduction of CO2 by Cu2O. Experiments and DFT calculations showed that S doping reduced the generation energy of intermediate *OCHO, thus promoting the selective production of formate. And the Cu2O (100) crystal facet had higher formate generation activity than the (111) crystal facet. (3) Double element doping. All of the above are single element doping. Different dopant atoms play different roles. Doping two elements at the same time can further optimize the reaction, and the synergistic effect between dopant atoms will provide higher reactivity. Li et al. [163] prepared an in situ double-doped electrocatalyst(Ag,S-Cu2O/Cu) for the catalytic reduction of CO2 to CH3OH. As shown in Fig. 19(a), its FE could be as high as 67.4%. The interaction of S, Ag and Cu2O enhanced the selectivity and current density for the conversion of CO2 to CH3OH. It was shown that the anion S could modulate the electronic structure of Cu2O, while the cation Ag had an inhibitory effect on the HER (Fig. 19(b)-(c)). The double doping of anions and cations improves the activity and selectivity of CO2 to methanol, and the double-atom doping provides a new idea for the study of efficient CO2 reduction catalysts. Based on the above research applications of defect construction in the Cu2O catalytic CO2RR, we find that the construction defects directly affect the energy band structure and electronic structure of Cu2O. This can effectively improve the current density and electrocatalytic activity. Vacancies and dopant atoms are usually important to the reaction as catalyst active sites, affecting the ability to absorb and desorb key species. The type of doping elements affects the selectivity of CO2 reduction products, and the doped atoms can be selected according to the production requirements. In general, the construction of defects is not a less effective strategy to improve the catalyst performance. However, there are fewer studies for vacancy and two-element doping, which provide research directions for future development of Cu2O catalysts. 4.3 Current status of electrocatalytic CO2 to C3 products on Cu2O The formation of C2 products, such as C2H4 and C2H5OH, has been successfully achieved in Cu2O electrocatalyzed CO2RR, and the modified catalysts have shown promising performance. At the same time, the formation of a more commercially viable C2+ product is more desirable and more challenging. The diversity of protonation sites of the C1 and C2 intermediates limits the generation of C3 and allows for a more complex reaction pathway. However, in previous studies, the generation of C3 products (e.g., n-propanol [18]) was achieved over Cu2O-based catalysts. As in the previous C2 generation, higher CO coverage and longer residence time remain favourable conditions for the formation of the second C-C bond. Overall, for the generation of C3 products, we can explore the reaction paths and mechanisms, which can provide reference for the rational design of our catalysts. Chang et al. [164] demonstrated that the Cu0-Cu+ mixing region on the oxygen-depleted Cu2O (110) surface realizes the coupling of H2CCO to CO. DFT calculations showed that specific C1/C2 intermediates could be stabilized by adjusting the valence state of Cu2O (110), and that properly hydrogenated C2 intermediates were more favourable for the generation of C3, that is, H2CCO species. On this catalyst this coupling reaction had a lower activation energy and was thermodynamically more favourable. This result also demonstrated the critical role of Cu0-Cu+ synergy in the reaction. However, Cu+ substances are easily reduced to metallic Cu at high current densities, and the formation and stabilization of the Cu0-Cu+ interface is important. Du et al. [165] showed that trace halide ion adsorption could slow down the kinetics of Cu+ reduction to Cu0, allowing in situ control of the formation and stabilization of the Cu0-Cu+ interface. The abundant Cu0-Cu+ interface facilitated the C-C coupling reaction and inhibited the HER. The catalyst had a 75.7% FE (0.98 V vs RHE) for C2 and C2+ products, providing us with a simple strategy to prepare high performance catalysts. Wu et al. [166] demonstrated that Cu2O nanocubes under CO atmosphere produced Cu2O-Cu hybrid catalysts rich in nanocrystalline boundaries by thermal reduction. The abundant nanocrystalline boundary structure allowed the Cu0-Cu+ interface to be preserved at high current densities and high polarization states. It increased the adsorption density of *CO and facilitated the C-C coupling reaction, resulting in high C2+ product selectivity. Zhang et al. [167] who prepared a series of hollow Cu2O nanoreactors with different cavity sizes to stabilize Cu+ species and regulate the Cu+/Cu0 ratio. The concentration of intermediates could also be adjusted to facilitate subsequent reactions. The FE of the C2+ product on the optimally sized hollow Cu2O reactor was as high as 70.1%. The cavity size has a close relationship with the Cu+/Cu0 ratio, *CO coverage, and reaction selectivity, and this study provides a reference for catalyst design. The above studies illustrate the important role of Cu0-Cu+ mixed valence in electrocatalytic CO2RR, but researchers hold different insights into the reasons for the high selectivity of the C2+ product. Lei et al. [168] prepared copper-based electrodes with different initial oxidation states (Cu/Cu2O/CuO and Cu/Cu(OH)2) to investigate the source of the excellent selectivity of C2+. Their results concluded that the metal Cu was the active species in the reaction and that the type of catalyst starting oxidation state did not affect the selectivity results. In addition, they pre-reduced both electrodes to ensure that only Cu0 species were present in the CO2RR process, and the results showed that the pre-reduced electrodes were even slightly more selective, suggesting a key role for Cu0 species. And at the same time, the authors found that the crystal fragmentation of Cu-based electrodes to form small Cu grains during the reduction process, the formation of a large number of grain boundaries and high-index facets were also the key reasons for the high C2+ selectivity. In conclusion, the authors provide a new insight into the structural and chemical states in the electrocatalytic CO2RR of Cu-based catalysts, showing the key roles of the active substance Cu0, grain boundaries, and high-index facets. It also provides a direction for us to focus our future work. In addition to the active components, a large reaction area, good CO2 adsorption capacity and mass transfer efficiency are also critical for the reaction. We can provide better reaction environments by constructing complexes or morphological modifications, for example, and we can also stabilize the active components in this way. Zhi et al. [169] prepared Cu/Cu2O@NG catalysts with N-doped graphene (NG) having large surface area and excellent electrical conductivity. Cu/Cu2O could be uniformly dispersed on NG, providing more active sites. Due to the good mass transfer rate and abundant active sites, the catalyst exhibited better C2+ product generation. Liu et al. [170] prepared Cu2O-2D metal-organic framework catalysts (Cu2O/Cu-BDC) with abundant heterogeneous interfaces. Among them, the 2D Cu MOFs material could stabilize the active substance Cu+ and increase the stability of the catalyst. The heterogeneous interface, however, optimized the adsorption behaviour of the reaction intermediates and stabilized the *CHO/*COH intermediates, thereby facilitating the C-C coupling reaction. That is, for the generation of C3 products, a stable active component Cu0-Cu+, a good reaction environment, and an appropriate degree of protonation of C1/C2 intermediates are crucial. In addition, the high energy barrier and slow kinetics of C3 generation are still the difficulties we need to overcome. We can conduct more research to overcome these challenges based on the above results. 4.4 Mechanistic study of Cu2O-based electrocatalysts Based on the above 4.2 study, Cu2O-based electrocatalysis has a good C2 generation capability, which is limited by the complex generation path and high kinetic barrier for C-C coupling. The most studied mode of C-C coupling is the dimerization of CO, but in fact, the direct dimerization of *CO is slow and has a high reaction potential, whereas the first hydrogenation of *CO to form *CHO and the subsequent reaction with the other hydrogenation product *CHxO is kinetically more favourable [132]. Ren et al. [24] showed that CO2RR involves both direct dimerization of *CO to produce OCCO and first hydrogenation-then coupling to produce C2HxO2. It suggests that the coupling of the properly hydrogenated intermediate *CHxO is kinetically more favourable. It is also argued that for the generation of C2H4/C2H5OH, *CH2CHO is an important common reaction intermediate, and that whether *CH2CHO is hydrogenated to *C2H4 or *CH2CHOH is critical. Yao et al. [125] showed that the adsorption of CO and COH by low-coordinated Cu atoms generated of Cu2O increases with the lesser number of atomic coordination. And for their study, the CO-COH coupling barrier decreases with decreasing coordination number, which is more favourable than the CO-CO coupling mode. They also indicated that in addition to the important influence of the C-C coupling mode, pH also has an important effect on the reaction, with alkaline environments favouring the production of C2H4 and C2H5OH. Overall, for the generation of C2 products, a high coverage of *CO is a prerequisite, and the manner of *C-C coupling determines the kinetic fastness. More current studies have proposed that *CO is kinetically more favourable when coupled after proper hydrogenation. We should continue to explore the reaction mechanism to deepen our understanding and clarify the key intermediate *CHxO and the rate-limiting step. At the same time, we need to conduct a deeper study of the pH effect to promote the selective generation of C3 products. In summary, for the electrocatalytic reduction of CO2 by Cu2O, the most studied strategies for constructing efficient catalysts are mainly morphological modulation, metal deposition and defect construction. Grain boundaries, defects, active sites, and the introduction of a second component all have an important influence on the improvement of C2 product selectivity, which is mainly achieved by stabilizing the active substance, or changing the adsorption behaviour of the intermediate, or affecting the kinetics of the reaction. The selectivity of some specific products can be improved by some modification strategies. For example, (1) Catalysts with a core-shell structure can increase the generation of C2 products by stabilizing the active species Cu+, and increasing the likelihood of C-C coupling. (2) The crystallographic dependence effect causes a difference in the ease of response. High-index facets promote C-C coupling reactions due to the abundance of grain boundaries and defects; (111) facets favour the production of alcohols; and (332) facets favour the production of C2H4; In addition, charge transfer between the anisotropic faces of the crystal affects the kinetics of the reaction and enhances the FE of C2. (3) The introduction of the second component acts as an important active site and synergizes with Cu2O to promote the selective generation of C2. Ag and Au have better CO generation capacity, and the increased CO coverage favours the generation of C2, which has high selectivity for C2H4 and C2H5OH, and the appropriate composite ratio influences the selectivity of C2H4/C2H5OH; B indirectly improves the stability of Cu+ reactive species by inhibiting lattice oxygen in Cu2O, while optimizing the adsorption behaviour of *CO and enhancing the selectivity of C2H4. In addition to this, it has been shown that carbon coatings can stabilize Cu+ species in copper oxides, promote C-C coupling reactions. And it can modulate the adsorption behaviour of *HOCCH, prompting the selective generation of C2H5OH with high FE and current density [171]. And the alkaline environment in the vicinity of the electrode also favours the generation of C2 products [24,125]. In conclusion, for electrocatalytic CO2RR, in addition to the C1 products, the Cu2O-based catalysts also showed good C2 generation ability. The product distribution was mainly concentrated on CO, C2H4, C2H5OH and a small amount of n-propanol, and the FE is basically more than 75%, with some catalysts having a slightly lower effect of more than 50%. The modified Cu2O catalysts have enhanced C2 generation ability. For other CO2 reduction electrocatalysts, Ren et al. [172] reviewed the electrocatalysts used for CO2RR in recent years. Most of the studies focused on metal electrodes such as Cu, Au, Re, Co, etc., and did not show excellent C2 product generation, except for Cu-based catalysts that showed some C2 product generation, with the products being mainly CO, formate, and CH4. In addition, there are several reviews based on electrocatalytic CO2RR (graphite carbon nitride-based materials [173], metal-organic skeleton materials [174], and mesh materials [175]), which have shown better C1 generation. Thus, in short, copper-based catalysts, including Cu2O-based materials, with their excellent C2 generation capability make the materials superior and show a great potential that deserves a lot of research. 5 Research status of Cu2O photo-electrocatalytic CO2 reduction 5.1 Introduction to photo-electrocatalysis Photo-electrochemical (PEC) CO2 reduction combines the advantages of photocatalysis and electrocatalysis, it has unique advantages over single photocatalysis and electrocatalysis [176]: firstly, from the photocatalytic point of view, the presence of an external voltage promotes the effective separation of photo-generated electrons and holes and reduces the occurrence of photo-corrosion; Secondly, from an electrocatalytic point of view, solar energy provides a large charge, significantly reducing the consumption of electrical energy; Thirdly, under the synergistic effect of light-electricity, CO2RR has lower activation energy and easier reaction; Finally, PEC usually separate the cathode and anode, avoiding the mixing of CO2 reduction products and anode oxidation products. For photo-electrocatalytic reactions, the photoelectrode is usually a semiconductor material. It is immersed in an electrolyte solution and excited by light to produce photogenerated electrons and holes. Subsequently, electron-hole separation and transport are further facilitated by an applied voltage. CO2RR is carried out at the cathode surface and oxidation of water at the anode. Cu2O has a good development prospect as an excellent photoelectrode material. However, it still inevitably suffers from low stability. Photo-corrosion degrades its catalytic properties. Wang et al. [177] have investigated the photo-corrosion behaviour of Cu2O nanowire thin film catalysts during CO2RR. The results showed that the slow kinetics of CO2RR on the catalyst caused the accumulation of electrons, which was the main cause of photo-corrosion. This is manifested in the collapse of the catalyst structure, the weakening of the photo-responsiveness, and the reduction of the charge transfer capacity. By studying the photo-corrosion mechanism, we can promote the utilization of charge transport on Cu2O by rational means (e.g., constructing protective layers, introducing dopant atoms, and other strategies), and design high catalytic activity sites to develop Cu2O-based photo-electrocatalysts with higher activity and stability. 5.2 Strategies for building efficient Cu2O-based photo-electrocatalysts 5.2.1 Building a protective layer Faced with the problem that Cu2O is susceptible to photo-corrosion, a commonly used protection is the addition of corrosion-resistant layers, including MOF materials, carbon layers, and metal oxides which exhibit enhanced catalytic properties. Galante et al. [178] demonstrated that Cu2O catalysts with aminopolysiloxane protective layer exhibited enhanced photostability. It could selectively generate formate at low potentials with 61% FE. Lee et al. [179] prepared Cu2O nanowire catalysts with a Cu+ doped TiO2 overlayer, which showed enhanced photo-electrocatalytic properties and promoted the selective generation of CH3OH. However, there is no standard for the design of parameters such as deposition/cover layer thickness and temperature, and the study of the influencing mechanism is crucial for the improvement of catalytic performance. In this regard, Akbar et al. [180] investigated the role of TiO2 protective layers with different deposition temperatures and thicknesses on the photo-electrocatalytic performance of Cu2O. It showed that the TiO2 deposition thickness affected carrier transport, while the deposition temperature influenced its stability and conductivity. The results showed that the TiO2 coating with 2 nm thickness had the best effect on Cu2O at 150 °C. Subsequently, Akbar et al. indicated that Cu2O often occured as a composite catalyst, the presence of different protective layers caused a change in the active site and affected the selectivity of the reaction. The influencing factors for pure Cu2O photo-electrocatalyzed CO2RR are not clear. Therefore, Akbar et al. [181] had also investigated the structure and electrolyte composition of Cu2O. It was shown that Cu2O film thickness, cations in the electrolyte, and local pH affect the amount of the surface active substance Cu+, and that sustained Cu+ facilitates the formation of C2(CH3COOH) products, which is the key to improving selectivity. This work serves as a reference for us to carry out subsequent studies, and the development of new catalytic systems should fully consider all possible influencing factors. 5.2.2 Construct heterojunctions Heterojunction, as an important means to enhance the photocatalytic performance, also shows good promise in the enhancement of Cu2O photo-electrocatalytic performance. Aranda-Aguirre et al. [33] prepared Cu2O-Bi2Se3 heterojunction catalysts on fluorine-doped tin oxide substrates. The unique electronic properties of the topological insulator Bi2Se3 could enhance photoexcitation and electron transport on the Cu2O surface, making it an excellent catalyst for CH3OH generation. The authors also point out that pH is an important influence on the selectivity of photo-electrocatalytic CO2 reduction products. Zoli et al. [182] prepared a Cu2O-SnO2 composite catalyst and demonstrated that the presence of the n-type semiconductor SnO2 protects the Cu+ active material from photo-corrosion. The formation of p-n junctions promoted the transfer of photo-generated electrons and avoided photo-corrosion in order to obtain catalysts with the active substance Cu+ as the main copper oxidation state. In addition to this, it had also been shown that the presence of Sn acted as an influence on the size of Cu2O particles, giving them a relatively narrow size distribution. This will affect the formation of active sites and the adsorption behaviour of the reaction intermediates. Otgonbayar et al. [183] prepared a ternary composite catalytic material of Ti3C2/Cu2O/Fe3O4. Among them, 2D MXene with large specific surface area provided abundant reactive sites. And it had better carrier transport ability and reactivity than carbon materials due to the abundance of metal sites and electrical conductivity. The Cu-Fe metal oxides, as excellent CO2 reduction catalysts, could form heterogeneous structures with it, which further promoted the separation and utilization of photo-generated electrons-holes. The main products of this composite catalyst were CH3OH and C2H5OH, which showed sufficient stability even after one month. 5.2.3 Elemental doping Protective layers and heterojunctions mainly improve the photo-corrosion behaviour of catalysts and enhance the utilization of photo-generated electrons, thus enhancing the reactivity. And elemental doping, as a commonly used modification, directly affects the electronic structure of the surrounding atoms and the composition of the catalyst. Changes in the surface state affect the adsorption behaviour of the reaction intermediates, which can regulate the reaction selectivity more efficiently. Guo et al. [184] reported a Ga-doped Cu2O catalyst with good C2+ product (ethanol and propanol) generation. Ga doping promoted light absorption and electron-hole separation of the catalyst. Meanwhile the improved electronic structure and the formation of oxygen vacancies on the catalyst surface promoted the activated adsorption of CO2 and the occurrence of C-C coupling. 5.2.4 Functional modification Jia et al. [185] argued that the designed Cu2O-based photo-electrocatalytic material should satisfy each factor of the reaction process one by one, and proposed an efficient multifaceted composite catalytic material, including a hole-transporting layer (to collect holes and improve the stability of the catalyst), a Cu2O photonic crystal structure (to improve the light absorption and provide a microenvironment for the reaction), and a polypyrrole layer (to act as an electron-transferring agent and to activate the CO2 molecule). Through the synergistic action of the components, the catalyst had a CO yield of up to 46.17 mmol·h-1. This synergistic effect of multicomponent functional modifications also provides a rational scheme for carrying out catalyst design. Overall, catalyst nanostructures, protective layers, heterojunctions and doping strategies are all effective means to improve the performance of Cu2O photo-electrocatalytic CO2 reduction. We can introduce co-catalysts with efficient CO reduction activity under the premise of ensuring that the catalysts have good light absorption and effective utilization of photogenerated electrons-holes. This further reduces the reaction potential barrier and modulates the selectivity of the catalyst. That is to say, through the synergistic effect between the components, the catalyst has both efficient light utilization and more catalytic active sites. The above section of this paper summarizes the current status of Cu2O-based photo-/electrocatalysts for CO2RR applications, which exhibit improved activity and selectivity. And some researchers have shown that the Cu2O-based catalysts still have high stability after multiple reuses, but most of them are stable within 100 h. The catalysts are still affected by photo-corrosion and structural reorganization, which cause the problem of reductive oxidative inactivation of the active substances. In addition to valence effects, they may also be affected by changes in surface structure, e.g., changes in porosity, crystal facts, interfacial energies, etc., during the reaction process. The reconfiguration behaviour of a catalyst will always have a positive or negative effect over the course of a long reaction. For photocatalytic reactions, the timely transfer and utilization of photogenerated electrons is the key to improving catalytic activity and avoiding photo-corrosion, which largely maintains the stability of the catalyst. For electrocatalytic reactions, the level of the potential and the size of the catalyst affect the occurrence of surface remodeling. Cu2O-based catalysts usually undergo a complex structural reconstruction process during the electroreduction process, and may be reduced to metallic copper, presenting copper catalytic activity, or have altered crystal facts, etc. We can make an in-depth study of the reconfiguration effect, which is induced to stabilize the active substance or change it in a favourable direction. Jiang et al. [186] proposed a concept of Cu2O superparticles. During the structural remodeling process, the internal structural units of the particle generate a large number of copper grain boundaries, and the structural units of the outer shell segregate to form nanogap structures that restrict OH species to maintain an alkaline environment. This particular superstructure achieves high C2 product selectivity, and this study demonstrates the importance of catalyst precursor structure studies for the design of active center species. 6 Development trend of Cu2O-based catalytic CO2RR 6.1 Research directions of new catalysts based on Cu2O The above section of this paper summarize the existing modification strategies commonly used on Cu2O catalysts, all of which have achieved remarkable results. Currently, there are many new catalysts applied in CO2RR. They have higher catalytic activity and selectivity. But for Cu2O-based catalysts, they have not received much attention. Fig. 20 shows the possible future directions of catalysts for CO2RR, mainly including ADCs, dual doping catalysts, FLPs and tandem catalysts. A brief description will be given below. 6.1.1 Single-atom catalysts Metal catalysts, which are widely studied, have good prospects for application in CO2RR. However, it also has certain problems, most notably, easy aggregation deactivation and low atom utilization efficiency [187]. As a result, single-atom catalysts (SACs) with atomically dispersed metal centers have attracted attention. Qiao [187] first proposed the concept of SACs in 2011. It has also been more explored by researchers since then and has developed rapidly. SACs can effectively solve the disadvantages of metal catalysts that tend to aggregate and deactivate [188]. The unique advantage of atomically dispersed metal centers allows SACs to have high atom utilization efficiency and catalytic activity. Among them, the loaded single-atom metal catalysts not only promote the charge transfer but also utilize the synergistic effect of metal atoms with the carrier, which further improves the performance of the reaction [189]. Enhancing the strong interaction between the loaded metal and the carrier is significant in improving the reactivity and selectivity. Based on the current studies of SACs in Cu2O-catalyzed CO2RR, the positive role of single-atom modifiers in stabilizing the active species Cu+ has been confirmed. As shown in Fig. 21(a)-(b), the single-atom Sn indirectly promoted the adsorption of intermediate *CO and enhanced CO production by stabilizing Cu+ species, due to the enhanced charge transfer between Sn-O-Cu [190]; Gd single-atom doping not only stabilized the Cu+ species but also induced tensile strain, which could reduce the potential barrier of the C-C coupling reaction and thus promoted the formation of C2+ products, due to the positive effect of the large ionic radius and electronic structure of the lanthanide metal Gd on the reaction (Fig. 21(c)) [191]. In addition, Le et al. showed that plasma-induced direct dissociation of CO2 had a relatively low potential barrier and further investigated the catalytic performance of the composite system of plasma and Cu2O in the presence of oxygen vacancies, which showed superior performance [111,192]. The results of this study demonstrate the positive synergistic effect of plasma-excited high-energy electrons and defects in promoting CO2 reduction. SACs have relatively higher atomic utilization rates and catalytic activity compared to bulk metals. However, SACs can also suffer from particle agglomeration, low metal loading effects and difficult scale-up implementation in the context of CO2RR. New preparation methods need to be developed to improve its stability and activity and further optimize the performance. 6.1.2 Double-atom catalysts Double-atom catalysts (DACs) are atomic dimers loaded on a carrier. Compared to single-atom catalysts, DACs have dual active sites, and they can further complete more complex catalyst reactions while maintaining high atomic utilization. Loaded metal DACs can effectively modulate the electronic structure of surrounding atoms because of interatomic interactions [193]. And they can increase the possible pathways and activity of the reactions by affecting the formation of reaction intermediates [194], providing multi-locus adsorption and atomic bond breaking that cannot be achieved with single-atom catalysts, and have very good prospects for development. The commonly used catalyst substrates are mainly metal oxides, carbon materials, and MOFs materials. In addition, DACs are divided into homonuclear and heteronuclear structures. Among them, DACs with different elemental species exhibit better catalytic activity [195,196]. Because different metals have stronger synergistic effects with each other and provide different active sites and roles in the reaction. DACs have now been used for CO2RR, and the synergy between atoms and more active sites further enhances the activity and selectivity of CO2RR [197]. A brief description of recent DACs for CO2RR is given below. I Homonuclear structure of DACs: Jiao et al. [198] proposed an \"atom pair catalyst\", i.e., adjacent Cu atom catalysts with Cu1 0-Cu1 x+ structure for CO2 and H2O adsorption, respectively. It was shown that the unique adsorption structure could effectively reduce the activation energy of CO2 and exhibited better CO generation activity, selectivity and high stability at low potentials. Ni et al. [199] synthesized a catalyst with a double - single Co atom for the CO2 reaction to produce syngas ( Fig. 22(a)). They indicated that single Co sites were used for CO2RR, while double Co atomic sites were used for HER, and the synergistic effect of double single Co sites resulted in a catalyst with high activity. This dual single-atom catalyst also provides us with a reliable strategy for designing efficient catalysts. As shown in Fig. 22(b), Wang et al. [200] showed that the dual Fe atomic sites had better CO generation performance than single-atom Fe, attributed to the synergistic interaction (orbital coupling) between the dual Fe atomic sites, which improved the adsorption behaviour of *CO. And the catalyst had high CO generation FE and enhanced stability. Zhao et al. [201] also showed that the synergistic interaction between dual Fe atomic sites could enhance the CO2 activation and CO resolution of the catalysts with much higher CO generation capacity than single Fe atom catalysts. In addition, Liang et al. [202] prepared diatomic Ni catalysts and showed that the synergistic interaction between Ni-Ni sites could reduce the reaction free energy and promoted the formation of *COOH, resulting in a catalyst with high CO generation capacity (Fig. 22(c)). The above study responds to the positive effects of the synergistic interactions between the two atoms on the reaction, including the activation of CO2, the adsorption behaviour of intermediates, and the reaction potential, while integrating the advantages of the single-atom system to further improve the performance of the catalyst. II Heteronuclear structure of DACs: Cheng et al. [203] showed that Ni/Cu diatomic catalysts had an enhanced electron transport capacity and *COOH adsorption strength, as well as a low reaction potential barrier, thus promoting efficient CO production. Subsequently, Li et al. [204] developed an adjacent Cu-Cu/Cu-Ni diatomic catalyst and showed that the synergistic interaction between Cu-Cu facilitated the C-C coupling reaction to reduce CO to C2+ products with up to 91% FE ( Fig. 23(a)). This is also the inherent ability of Cu catalysts to generate C2. The Cu-Ni site, on the other hand, generated CH4 due to excessive CO adsorption. This study provides an idea to rationalize the reaction selectivity. Hu et al. [205] proposed a transition metal-main group metal diatomic catalyst (Fig. 23(b)), where the main group metal was chosen as the HER inert metal to inhibit the side reaction and the transition metal was used as the active site for CO2RR. It showed that the Cu-In catalyst had a FE of 96% for CO generation. The In atoms around the active site Cu can improve the adsorption behaviour of * COOH on Cu site and further promotes CO production. Wu et al. [206] successfully prepared Fe-Mn diatomic catalysts, and the presence of Mn enhanced the catalytic ability of Fe atoms. The study confirmed that the synergistic effect of the diatoms promoted the activated adsorption of CO2 as well as the desorption of *CO (Fig. 23(c)). In addition, as shown in Fig. 23(d), Liu et al. [207] showed that the Cu-Sn diatomic catalyst also exhibited enhanced CO2 activation, with the FE of CO for this catalyst being as high as 99.1%, much higher than that of the Cu/Sn monoatomic catalyst. In general, most of the current diatomic catalysts exhibit good CO selectivity and are less studied for other products. However, compared with single-atom catalysts, the performance improvement is obvious and has good potential for development. Cu2O is an excellent metal oxide carrier, and we believe that constructing diatomic metal catalysts on its surface can significantly improve its deficiencies and enhance the activity and product selectivity of the catalyst. 6.1.3 Three-atom catalysts Three-atom catalysts (TACs) seem to be promising catalysts at the atomic dispersion level. They further improve the coordination environment of metal atoms and provide more active sites [208]. However, their preparation is more complicated compared to SACs and DACs. This is because it is difficult to precisely control the atomic number during the synthesis process. In addition, the low coordination triatom has a high surface energy, which makes it less stable in the catalytic process. In short, the difficulty of preparation and the aggregation in the catalytic process limit the development of TACs. Based on this, the development and application of triatomic catalysts for substrate requirements is necessary important. At present, the application of TACs catalysts for CO2RR reduction is still relatively small and needs our vigorous development research. Current research on triatomic catalysts for CO2RR has focused on carbon-based materials, which are commonly used as catalyst substrates and have a special pore size structure that can better stabilize the triatomic configuration. Zha et al. [209] studied the electrocatalytic CO2 reduction performance of a transition metal triatomic system (Fe, Co, Ni and Cu) on C2N by DFT. The results showed that these catalysts were all more selective than HER for CO2RR and could complete the reaction at a lower overpotential. And the type of transition metal had an important influence on the reaction selectivity. The Cu triatomic catalysts had better CO and HCOOH selectivity, while Co3 was more favourable for the formation of CH3OH and CH4 compared to other transition metals. This study provides guidance for the rational development of polyatomic catalysts, including the rational selection of catalyst substrates and atomic species. Subsequently, Zhou et al. [210] investigated the electrocatalytic CO2 reduction performance of a transition metal triatomic system (Fe, Co, and Cu) on a graphene substrate by DFT. And structural analysis showed that the triatomic metals had high cohesion and large binding energies, indicating that graphene was an excellent substrate that ensures stability during the reaction. The electronic structure analysis showed a large amount of charge transfer between the metal atoms and the C atoms of graphene, and the synergistic interaction between the atoms promoted the activated adsorption of CO2 ( Fig. 24). Among them, the copper atom favoured the production of CH4, while the iron atom promoted the production of CH3OH, and the HER was limited with increasing potential. Han et al. [211], on the other hand, investigated triatomic catalysts composed of bimetals, which showed that the triatomic catalysts could effectively achieve activated CO2 adsorption and the Fe2Ir structure could also effectively inhibit the occurrence of HER with good CO2 reduction performance. Overall, current research on triatomic catalysts applied to CO2RR is still relatively scarce and mainly focused on theory, with experimental studies limited by difficulties in preparation. But some successful preparation methods have also been developed. Atomic layer deposition, which allows precise control of the deposition behaviour of metal atoms, has been successfully used for the preparation of atomically loaded metals [212]. In addition, catalysts with excellent pore structure are a good substrate for triatomic catalysts. We can optimize the pore structure of Cu2O by heat treatment or chemical hydrolysis so that it can stabilize the triatomic catalysts better. Moreover, the construction of vacancy defects on the surface of Cu2O is relatively easy, based on the defect anchoring strategy, which is also advantageous for the immobilization of other metal atoms. Overall, we believe that Cu2O-based triatomic catalysts can be realized in CO2RR in the future and show good catalytic performance. 6.1.4 Fully exposed catalyst-larger clusters In addition to the three atom-dispersed catalysts mentioned above, cluster catalysts have also been developed rapidly. Cluster catalysts can accommodate dozens or even tens of metal atoms while maintaining a smaller size. Compared to single-atom catalysts, they still offer excellent atom utilization and provide more active sites at the same time [213]. Metal clusters have a more complex atomic coordination environment. For the complex CO2RR, the unsaturated metal coordination and unique electronic structures of clusters are more favourable to improving the activity and selectivity of the reaction [214,215]. And the diverse active sites and interatomic synergies make the formation of complex reaction intermediates possible. Loaded metal cluster catalysts have been studied in CO2RR, such as Pt8/In2O3 [216], Nin/YSZ(111) [217], and Ni/γ-Al2O3 [218], all of which show enhanced catalyst performance. And they indicate that the metal-oxide interface is the active site. The strong interaction of metal clusters with the carrier enhances the charge transfer and facilitates the active adsorption of CO2. For cluster catalysts, there is a relatively special class of catalysts, namely, fully exposed cluster catalysts (FECCs). This type of catalyst is intermediate between SACs and nanoparticles (NPs), and all its metal atoms can be used as reactive sites for adsorption, conversion and desorption of molecules. Compared to the common large cluster catalysts, the structures are relatively dispersed and mostly layered, which have stronger interactions with the carrier surface [219]. For the preparation of FECCs, based on the current study, we can capture metal atoms by introducing surface defects, and then further regulate the distribution of atomic and electronic structures by doping with a second element to promote their dispersion and stabilization on the substrate surface [220]. Such catalysts usually exhibit high catalytic activity and stability and have been extensively studied in recent years for a variety of catalytic reactions. For example, as shown in Fig. 25(a), Liu et al. [221] designed a fully exposed Cu7 cluster catalyst for the reduction of CO, which can generate formaldehyde with high selectivity and activity (Fig. 25(b)). The authors showed that this was due to the unique electronically mixed valence state of the Cu7 cluster (neutral in the middle with a cationic state at the edges) as well as synergistic effects that alter the adsorption behaviour of the intermediates. Hao et al. [222] investigated the application of fully exposed Ni cluster catalyst in CO2RR. The catalysts had a high FE for CO formation (up to 99%), partial current density and durability. The authors showed that the synergistic effect of multiple Ni atoms accelerated the reaction kinetics, and also suggested that S-atom doping had a positive effect on the charge distribution at Ni sites, providing a reference for the regulation of fully exposed catalysts. Dong et al. [223], on the other hand, investigated the ability of fully exposed Pd cluster catalysts to produce hydrogen from nitrogen heterocycles. They compared the dehydrogenation ability of single-atom, sub-nanoclusters and nanoparticles. And the results showed that fully exposed Pd clusters could activate the reactants better and promote the desorption of the products, but the activity of single-atom Pd was almost 0. The results of this study demonstrated that fully exposed metal clusters could significantly enhance the catalytic properties and atomic utilization of metals, and their synergistic effects greatly facilitated the reactions. In addition, FECCs is also widely used for alkane dehydrogenation (Fig. 25(c)). Its special fully exposed active site has a good C-H activation capacity, while the electron-rich surface facilitates the timely desorption of H2 to improve the durability of the catalyst [220]. The excellent performance of FECC in HER and alkane dehydrogenation further demonstrates the potential capability of this structured catalyst in terms of atom utilization, reactant activation, and long-term stability, which is worthy of more in-depth study in CO2RR. Currently for Cu2O, based on the above photo- /electrocatalytic modification studies, it can be seen that the catalyst activity can be effectively enhanced by loading the metal. However, for cluster catalysts, including FECCs, there has been no application in Cu2O-catalyzed CO2RR. Based on the excellent performance of FECCs, their use as a structural form of loaded metal for the metal-Cu2O system further improves the atom utilization and provides more active sites. The highly exposed atomic structure and low electron coordination environment of FECCs allow for efficient catalytic activity. The synergistic effect of polyatoms not only facilitates the activated adsorption of reactant molecules, but also promotes the desorption of products and prevents catalyst poisoning. Thus, it seems that for CO2RR, FECCs are a promising advanced catalyst to meet the requirements of activity and selectivity of the reaction. And similar to the preparation of triatomic catalysts, we can also prepare FECCs on Cu2O by atomic layer deposition methods or defect anchoring. In addition, a second element can be introduced to modulate its coordination environment and promote its dispersion and stabilization in the substrate. Based on the above study, perhaps we can realize the successful preparation and application of FFECs on Cu2O surface with defects. 6.1.5 Dual doping catalysts Vacancy/atom doping has already been mentioned as having a positive influence on the activity and selectivity of the reaction. Doping can change the surface electronic structure of the catalyst and act as an important active site to regulate the adsorption behaviour and reaction direction of intermediates on the catalyst. Among them, two-atom doping is an interesting approach, which further exploits the synergistic effect of two dopant atoms on the basis of single-atom doping while providing different effects on the reaction [224,225]. And the anions and cations with opposite charges can play a greater role in improving the catalyst performance. The current strategy of double doping has been effectively applied in reactions such as HER and oxygen reduction (ORR) [226–228], and we believe that this is also true for CO2RR. In recent years, research on double doping strategies for CO2 reduction catalysts has focused on non-metallic carbon materials. For example, N,S double-doped carbon-based catalysts, which had lower Gibbs free energy for the formation of *COOH compared to single N doping, exhibited high CO selectivity and durability ( Fig. 26(a)-(b))[229]. The N, P-doped carbon nanosheets exhibited high FE of CO and long-lasting stability at low overpotentials (Fig. 26(c)). The N acted as the active center of the reaction, while the addition of P not only improved the pore structure of the material but also enhanced the intrinsic activity of the doped N. That is, the synergistic effect of N,P was the main reason for the excellent properties of this material [230]. The B, P-doped graphene nitride catalyst had a strong ability to convert CO to C2H4 (Fig. 26(d)). Its suitable adsorption energy of CO and C2H4 promoted the C-C coupling reaction and the timely desorption of products, and B-P acted as the active center of the reaction instead of B-N, prompting the formation of C2H4 [231]. All the above works demonstrate the excellent performance of double doping and the positive effect of using the synergy between polyatoms on the performance enhancement of catalysts. For the Cu2O catalytic system, a typical application case of the double doping strategy is mentioned in the fourth part of the paper. Li et al. [163] proposed an Ag, S double-doped Cu2O/Cu catalyst. The authors started from three considerations: first, to improve the selective generation of product methanol, and second, it should serve to inhibit HER. In addition, the durability of the material should be improved. The results also demonstrated that the anion S promoted the production of CH3OH by regulating the electronic structure of the active center Cu, and the cation Ag could inhibit HER better. It could jointly promote the reduction performance of the material by enhancing the primary reaction and inhibiting the secondary reaction in different aspects. Such catalysts are efficient and stable and are of interest. However, it has not been extensively studied for Cu2O-based catalysts. This work also provides a reference for future research design of doped catalysts, which has good prospects for development. 6.1.6 Frustrated Lewis pairs catalyst In recent years, FLPs were found to have high translational properties in CO2RR [232–234]. The concept of FLPs was first introduced by Stephan in 2006 [235]. And subsequently it was found that FLPs have a better polarization and splitting effect on small molecules, facilitating their next reaction and transformation [236,237]. This is important for the CO2RR that can effectively solve the problem of high CO2 activation potential. The catalytic principle of FLPs is that Lewis acids (rich in unoccupied orbitals) and Lewis bases (rich in lone pair electrons) form active regions due to the presence of large spatial site resistance rather than direct bonding [233]. The bonding and antibonding orbitals of the CO2 molecule interact with the empty orbitals and lone pair electrons of the Lewis acid/base in the active region, respectively, thus promoting the activation and dissociation of CO2. Many successful cases of constructing FLPs on metal oxides, such as CeO2, TiO2, have been reported so far. For example, oxygen vacancies and their nearby hydroxyl groups can form FLPs that facilitate the CO2 reduction reaction [232,238,239]. It has also been suggested that the activity of catalysts can be enhanced by shortening the distance of Lewis acid base, which can adsorb and activate CO2 more efficiently [240]. Here are some typical cases. Ⅰ CeO2 system: The CeO2(110) surface is widely studied compared to the (100) and (111) surfaces because its abundant oxygen vacancies make the construction of FLPs easy. By introducing oxygen vacancies, the O2- atoms (Lewis bases) formed FLPs with Ce3+ atoms (Lewis acids) in their vicinity, and the C in the CO2 molecule bound to O2- while the O atoms interact with Ce3+, thus facilitating the activated adsorption of CO2. The activation of CO2 is a prerequisite for the effective reduction of CO2. As shown in Fig. 27(a), Zhang et al. [241] showed that FLPs on CeO2 have great potential to induce CO2-activated adsorption. Subsequently, Ban et al. [242] designed a catalyst with a double active center for the reaction of CO2 and CH4 to acetic acid. By introducing transition metal single atoms (SA) on the CeO2(110) face, the presence of SA promoted the formation of oxygen vacancies, thus constructing the FLP site, which is the SA-FLP double active site. This special structure allowed for simultaneous activation of CO2 (FLP site) and CH4 (SA site), avoiding competitive adsorption and activation of reactant molecules with high activity. This dual active center catalyst construction also provide good inspiration. In addition, Ni serves as an excellent catalyst for CO2 methanation, and some current studies have been conducted on the construction of FLPs on Ni-CeO2 system. Xie et al. [243] found that the metal Ni could promote the dissociation of H2, and the formed H atoms contributed to the formation of FLPs by attacking the surface Ce-O building to form oxygen vacancies (Lewis acids) and OH groups (Lewis bases). The catalyst exhibited good low-temperature CO2 methanation activity. While Barreau et al. [244] showed that CeO2 loaded Ni particles can form FLP sites (Ce-O), typical Lewis pairs (CLP, Ni-O) and Ni-Ce synergistic sites, giving the catalyst excellent CH4 generation activity and selectivity. II TiO2 system: TiO2 has been widely studied as a common catalyst for CO2 reduction. Jia et al. [232] prepared TiO2-x catalysts with FLPs, and again, the surface oxygen vacancies are Lewis acid sites and the OH groups were Lewis base sites (Fig. 27(b)). The catalyst had excellent CO yield in pure water (65.1 μmolg−1h−1) and without any co-catalyst or sacrificial agent. This yield was 19.1 times higher than that of the TiO2 catalyst without FLPs, with significant performance enhancement. III In2O3 system: For the In2O3 system, recent studies have confirmed the role of doping in optimizing Lewis acidity, and doping as a commonly used modification can significantly improve the performance of the catalyst. Dong et al. [245] showed by DFT that the homocrystalline substitution of Bi3+ for In3+ significantly improved the performance of photocatalytic CO2RR. The FLPs site of this catalyst is In-OH, and the substitution doping of Bi not only improved the Lewis acidity of this catalyst, but Bi3+ also acted as an active site for H2 decomposition and further promoted CO2 reduction. Yan et al. [246], on the other hand, developed a simple one-step solvothermal synthesis method that successfully achieved the homocrystalline substitution of Bi3+ for In3+, providing a stronger Bi3+-O2- FLPs for the reaction, resulting in a catalyst with enhanced inverse water-gas shift reaction activity and CH3OH production activity. In addition, the introduction of Bi3+ single atoms adjusted the energy band structure of the catalyst, enhanced the light absorption ability, and more recently promoted the photocatalytic ability. The above study fully illustrates the possibility of metal oxide catalysts with abundant surface defects to construct FLPs with high performance, and it also shows that the reaction performance can be further improved by introducing single-atom catalysts. In conclusion, the construction of FLPs on metal oxide systems to improve their CO2 reduction performance is very promising, also for Cu2O. However, for the time being, there are relatively few studies on the construction of FLPs on Cu2O. Wan et al. [247] synthesized a Cu2O nanocube catalyst with mixed oxidation state Cu(0, 1, 2) sites, OH groups and oxygen vacancies on the surface. The catalyst could accomplish the activated adsorption of CO2 and the cleavage of H2 under mild conditions. And by adjusting the surface structure of Cu2O with SFLP Cu(0, 1, 2)-OH, the reversal of Cu2O disproportionation reaction could be realized and the disadvantage of poor stability of Cu2O could be improved. Jin et al. [248] proposed a method to activate CO2 by constructing Lewis acid-base sites based on an in-plane heterogeneous structure strategy. It was found that the Lewis acid-base site at the Cu2O/Cu heterogeneous interface can promote the dual coordination of surface C and O, thus enhancing the CO2 adsorption activity. And this structure has high electron transfer efficiency, which also gives this material excellent dimethyl carbonate generation performance. This is also a new strategy for the construction of FLPs. These studies show very good prospects for the design of Cu2O-based CO2 reduction catalysts. 6.1.7 Tandem catalysts Based on tandem catalytic reactions in multi-enzyme catalytic systems, the advantages of tandem catalysts have been discovered for the production of complex chemicals [249,250]. An advantage of tandem catalysts is the absence of intermediate product separation and purification, but the high mass transfer efficiency required for the intermediates and the mass transfer efficiency between the active sites ensures that the next step of the reaction is carried out efficiently; Another advantage is reflected in the thermodynamics, where the consumption of intermediates in the latter part of the reaction indirectly promotes the occurrence of the first part of the reaction and drives the whole reaction. Current tandem catalysts have been designed for use in CO2RR systems [251–253]. For CO2RR, the tandem catalyst provides different active sites to segment the conversion of CO2 to CO and CO to other C1 and C2+ products. As an important intermediate of CO2RR, the generation and utilization of CO is of great significance to the CO2RR reaction. We know that copper-based catalysts are excellent C-C coupling catalysts, but they still have problems such as difficult CO2 activation, poor selectivity and low yield. The application of tandem catalysts will effectively achieve the selective generation of C2 high-value products and provide a new idea for the development of Cu2O-based catalysts. The current research on copper-based tandem catalysts mainly focuses on Cu metal and CuO and Cu2O, which are described in detail below. Ⅰ Metal Cu: Studies on metallic Cu have focused on the Ag-Cu system [254–256], presumably because Ag has better CO generation properties that exactly complement the Cu properties [84,85]. Chen et al. [255] constructed Ag-Cu tandem electrocatalysts and demonstrated that the addition of Ag effectively increased the activity of C2 product generation on Cu catalysts ( Fig. 28(a)), indicating that the generation of CO on Ag and the subsequent C-C coupling reaction on Cu are crucial for efficient C2 generation. Thereafter, Iyengar et al. [257] further investigated the crystal facet dependence on Ag-Cu catalyst for efficient C2H5OH generation. The results showed that the Cu(111) nano-octahedral structure had more active sites for C2H5OH generation and better C2H5OH selectivity compared to the Cu(100) nanocubes (Fig. 28(b)). Zhang et al. [258] prepared Cu -Ag catalysts with adjustable thickness of core-shell structure to achieve optimal catalytic performance by optimizing the silver shell thickness. It showed that a suitable thickness of catalyst could significantly enhance the binding strength of CO and charge transfer efficiency at the interface and had the largest number of active sites, thus improving the selectivity of C2 products. The above study applied structural modulation to tandem catalysts, which provided insight into the development of highly selective catalysts. The metal Au also has a good ability to generate CO, there are also studies for Au-Cu catalysts, which showed the same results. And it was shown that heterogeneously linked catalysts are the most ideal choice to fully exploit the synergistic effect of both catalysts [259]. In addition to Ag and Au metals, Zhang et al. [260] prepared a CuO/Ni single-atom catalyst with Ni-Cu catalytic sites in close proximity. The catalyst achieved efficient generation and rapid consumption of CO. This catalyst showed the high FE of C2 product and high selectivity for C2H4 and C2H5OH. For CO2RR, more metal-Cu tandem catalysts should be studied and applied in addition to the heavily studied Ag, Au. For example, Zn, Pd, etc., which have also been shown to favour CO production in previous studies, in series with Cu will also potentially promote C2 production. Ⅱ CuO: The performance of tandem catalysts is mainly limited by the influence of the production and transfer utilization of CO. In response to the problem that the two active sites are too far apart to affect the reaction efficiency, Zhang et al. [260] prepared a CuO/Ni single-atom catalyst such that the two active sites, Ni (CO2 to CO) and Cu (deep reduction of CO), are adjacent to each other (Fig. 28(c)). The catalyst improved the utilization of intermediate CO, exhibiting excellent FE of C2+ product (81.4%). This work provides a new idea and inspiration for the design of tandem catalysts. Ⅲ Cu2O: The above are the research applications of Cu and CuO, and there are also a few research applications for the Cu2O system. Niu et al. [262] showed that by putting Ag in series with Cu2O, the CO generated at the Ag active site further reacted on Cu2O. The high CO coverage on Cu2O reduced the reaction potential and facilitated the formation of multi-carbon products. Therefore, the reaction activity and the FE of the products could be further improved. In addition, Yang et al. [263] then revealed the interaction of the two components in the AgI-Cu2O catalyst during the electrochemical process. It showed that the iodine ions leached in situ from AgI could inhibit the complete reduction of CuO to obtain the active components Cu0 and Cu+, which further promoted the C-C coupling to generate C2 products. Also, the residual I species could modulate the electrons on Ag and promote the production of intermediate CO. This work provides a new approach to adjust the active component of the tandem catalyst. Xiong et al. [264] also showed the positive effect of tuning the active component and structural morphology on the catalyst performance. It optimized the content of Cu-N4/Cu2O by adjusting the geometry of the precursor MOFs to find the catalyst morphology with the best performance. The FE of CH4 on this catalyst was as high as 80% and selectivity as high as 60%, and showed that the key to the performance improvement was the high coverage of CO. In addition, as shown in Fig. 28(d), Ye et al. [261] proposed a phase engineering strategy to adjust the phase ratio of Cu@Cu2O core-shell structure catalysts to improve the FE of C2 products (up to 79%) by optimizing the structure of the catalyst. The authors showed that phase engineering can modulate the adsorption behaviour of both CO2 and intermediate *CO, enhancing adsorption and promoting the transfer and deep reduction of *CO, which is important for the reaction to produce C2 products. Overall, the main role of the tandem catalyst is to promote the formation, transfer and next reaction of important intermediates of CO as a way to improve the selective production of C2 products. And the studies also show that after two catalytic components are selected, we can further modify the catalysts, such as structural modulation, optimization of the tandem approach and proper selection of the co-catalysts, so as to further improve the catalyst performance. The current studies have shown that the construction of Cu2O-based tandem catalysts can significantly improve the C2 selectivity on Cu2O catalysts, which is a very promising strategy that we should continue to study in depth and innovate. 6.2 Application studies of other copper oxides This paper mainly summarizes the research on the modification of Cu2O in CO2RR. In addition, another oxide of copper, CuO, is also of great interest. For photocatalytic CO2RR, CuO has a relatively narrower band gap structure (1.2 eV∼1.9 eV) [265], which favours the absorption of visible light. As with Cu2O, the more negative conduction band structure is favourable for CO2 reduction. However, the valence band position is not favourable for H2O oxidation and does not directly provide the H+ required for the reaction. In addition, during the photocatalytic reaction, Cu+ and Cu2+ are continuously interconverted, and holes and electrons are consumed at different times, reducing the possibility of compounding and improving the utilization of photo-generated electrons [266]. But it is still plagued by photogenerated electron-hole complexes. For Cu2O, it is directly deactivated by its own redox reaction to produce copper and CuO. The holes and electrons are consumed at the same time, and the reverse reaction cannot occur to realize the generation of Cu2O. And for electrocatalytic CO2RR, CuO has a good electrocatalytic activity and selectivity for CH3OH products and can directly reduce CO2 to CH3OH [267]. Cu2O, on the other hand, can selectively generate C2H4 and C2H5OH, and its C2 generation ability is superior to that of CuO. The CuO/Cu2O is usually reduced during the CO2RR process. And copper is in a multivalent state coexisting, the synergistic effect between multivalent copper will further promote the activity of CO2RR. For CuO, the synergistic interaction of Cu+ and Cu2+ is crucial for its generation of C2 products. Based on the previous study, the higher catalytic activity of Cu+ species favours C-C coupling, which is an advantage of Cu2O. In addition, CuO has better electrical conductivity compared to Cu2O [268] and is often used as a cover layer for Cu2O materials to facilitate charge transfer. Overall, the good photocatalytic performance and CH3OH generation ability of CuO make it show great potential in CO2RR as well. Many strategies are also currently used to improve the catalytic ability of CuO in CO2RR, mainly in energy band modulation, photogenerated electron-hole utilization, and increasing the active sites. For example, Li et al. [267] improved the photocatalytic performance of CuO by N-doping. It effectively increased the photo-generated carrier concentration and electrochemical adsorption sites with an exponential increase in CH3OH yield. Razali et al. [269] loaded CuO on TiO2 nanotubes, which significantly improved the photogenerated electron-hole separation and thus enhanced the photocatalytic performance. Guo et al. [270], on the other hand, investigated the effect of the formation of atomically dispersed Sn catalysts on CuO defective surfaces on the reaction of CO2 to CH3OH. FE of the CH3OH up to 88.6%. The authors showed that it was because of the formation of localized Lewis acid base that exhibited high conductivity and activity. It was also because the metal-oxide synergy reduced the required potential barrier for the reaction. Pechenkin et al. [271] loaded CuO-In2O3 on halloysite nanotubes (HNT) and the presence of In2O3 enhanced the conversion of CO2. while the acid center of HNT completed the dehydration of CH3OH and further formed dimethyl ether. Ye et al. [272] investigated the effect of particle size and oxygen vacancies on the reaction activity and selectivity. Catalysts with smaller particle size and more oxygen vacancies improved the electrochemical reaction activity. Its enhanced activation of CO2 adsorption and selectivity of CO. Liu et al. [273] prepared ultrathin CuO nanosheets for the electrochemical reaction of CO2. And they spontaneously formed Cu/Cu2O heterostructures during the reaction. The catalyst showed a high FE of 84.5% for the reaction of CO2 to C2H4 due to the enhanced adsorption of *OCCOH intermediates by Cu+. This study confirms that the presence of nanosheet structure and heterojunction interface enhanced the charge transfer, resulting in a stable and selective catalyst. The above studies will provide important guidance for CuO-based catalysts for CO2RR. The current CuO-based catalyst research is mainly focused on the reaction of CO2 to CH3OH, and more efforts will be devoted to the generation of other products. Perhaps in the future we can focus on CuO at the same time to develop more and more efficient CuO catalysts. 6.3 Applications of machine learning CO2RR requires the intervention of efficient catalysts. As we mentioned in the introductory section, CO2 has a certain thermodynamic stability and kinetic inertia, and its reductive conversion is difficult. The presence of a catalyst can make the occurrence of CO2RR easier. Catalysts can optimize the reaction path, thereby reducing thermodynamic barriers and accelerating the kinetic speed of the reaction. In recent years, some progress has been made in high-throughput screening of CO2 reduction catalysts, such as DFT and ML computational methods [274]. Theoretical calculations can provide reference for the development of catalysts in the laboratory. We can explore the properties of the catalysts through DFT calculations, which will help us to prove the expected mechanism, selectivity and efficiency, provide detailed reaction mechanism and save our time and cost [275]. DFT will provide great convenience for the research of Cu2O-based catalysts in CO2RR. As shown in Sections 3.3 and 4.4 above (photo-/electrocatalytic mechanism), theoretical studies on CO2RR catalyzed by Cu2O-based catalysts have been carried out by DFT, which provide some insights. For photocatalysis, DFT calculations have shown that the key to the generation of C1 high-value products on Cu2O-based catalysts lies in the competition between the desorption and the protonation process of *CO, and the stronger *CO adsorption energy and favourable protonation processes promote the selective generation of CH4, CH3OH [43,96]. For electrocatalytic reactions, Cu2O exhibits good C2 generation capability [45,161]. Through DFT studies, we know that high coverage of *CO is a prerequisite for C-C coupling [144] and the high kinetic barrier of C-C coupling limits its development [132]. Studies of the C-C coupling mode have shown that it is kinetically more favourable when *CO is properly hydrogenated and then coupled [24,125]. Theoretical studies can help us identify key intermediates and rate-limiting steps to target catalyst optimization. However, DFT computation also has its inherent drawbacks [276]. For example, the time cost is high and the presence of errors between different exchange correlation functions. As a result, ML has received a lot of attention from researchers. By using ML in combination with DFT calculations to predict catalytic activity and selectivity of catalysts, the time consumption can be greatly reduced [277,278]. In recent years, ML has been used in photocatalytic [60]and electrocatalytic [279,280] reactions of CO2. It would be of great convenience if ML were used in the design of new high-performance copper oxide catalysts. This will help us to prove the mechanism, expected selectivity and efficiency, provide a detailed reaction mechanism and save our time and cost. In addition, there is an expectation that ML will continue to progress toward large databases and generalized algorithms. By extracting previous experimental and computational data and integrating them, the speed and accuracy of screening for various types of complex catalysts can be increased [281]. 7 Summary and outlook This paper analyses and discusses the current status of the application of Cu2O-based catalysts in the photo- /electrocatalytic reduction of CO2. Firstly, the advantages and disadvantages of Cu2O catalyst materials in CO2RR are briefly reviewed. Then strategies for the modification of Cu2O-based catalysts in CO2RR are systematically reviewed. These strategies include morphology and crystal facet modulation, construction of heterojunction/carbon matrix composites, metal deposition and defect construction to enhance stability, activity and selectivity of the Cu2O-based catalyst in CO2RR. Subsequently, future directions for the development of new Cu2O-based catalysts in CO2RR are proposed. Finally, new computational tool by combining ML with DFT is also proposed to predict new Cu2O-based catalyst in CO2RR. In general, the following conclusions are drawn. (1) As a CO2 reduction photocatalyst, Cu2O has the advantage of a suitable band gap width and a conduction band position favourable for CO2 reduction. However, it also has some shortcomings, the occurrence of Cu2O photo-generated electron-hole complex and photo-corrosion has a serious negative impact on the reaction. For this, current research on the performance of Cu2O photocatalytic CO2RR focuses on the capture and utilization of photo-generated electrons, which in turn mitigates the occurrence of its photo-corrosion. Firstly, the formation of crystal anisotropic surfaces, construction of heterojunction/carbon-based composites, and introduction of a second component can effectively achieve the separation of photo-generated electrons-hole for timely transfer to the surface for reaction. Secondly, compared with other heterostructures, the Z-type heterojunctions can efficiently utilize the optimal valence band/conducting band positions of both semiconductors for simultaneous CO2 reduction and H2O oxidation. This is something that cannot be done with Cu2O catalyst alone. In addition, the introduction of the second component, i.e. metal deposition and elemental doping, usually also acts as an important active site and indirectly affects the product species by influencing the adsorption behaviour of the reaction intermediates. In general, effective light absorption and electron-hole separation are prerequisites for photocatalytic reactions, while modulation of the adsorption behaviour of reaction intermediates is the key to improving the reaction selectivity. (2) In electrocatalytic CO2 reduction, copper-based catalysts have suitable CO binding energy and the ability to generate multicarbon products. Cu2O, as a common oxide of copper, has also attracted extensive research and exhibited good CO2 reduction performance. However, its development is also limited by several problems, such as higher CO2 activation potential, unsatisfactory product selectivity and the influence of HER. For electrocatalytic reactions, current research has focused on improving the FE of products and the inhibition of HER. Firstly, the catalysts with different morphologies have different structures and exposed crystal facets. The morphological and crystal facet modulation can improve the mass transfer efficiency and adsorption performance of the catalyst, which have favourable effects on the improvement of product FE. The available results show that the types of products on different crystal facets of Cu2O are also different. Secondly, metal deposition and elemental doping not only increase the current density, but also take full advantage of the synergistic effects between components to influence the intermediate product generation and conversion pathways, which improving the selectivity of the reaction. At the same time, the introduction of some elements has a certain inhibition effect on the HER. Finally, the construction of vacancy defects can regulate the electronic structure of the atoms around the vacancy and the forbidden band width of the catalyst, which facilitates the activated adsorption of CO2. It also influences the reaction potential and regulates the type of reaction products. Overall, the available studies show that Cu2O-based electrocatalysts have demonstrated a good C2 generation capability. Although the above modification strategies have possessed significant results for the optimization of Cu2O properties, the current practical application for Cu2O still has shortcomings and a lot of room for development. First, stability problem. With the increase of reaction time, Cu2O-based catalysts will still have valence and morphology changes, resulting in catalyst deactivation and low efficiency. Although some experimental studies have shown that the stability of Cu2O-based catalysts has been improved, and the catalysts still have a certain degree of activity after many times of use, they do not meet the requirements of thousands of hours of life in the current industry, and it is still the focus of the research to further improve the stability of the catalysts. Second, energy efficiency enhancement. We still need to further strengthen the reaction process, optimize the catalyst composition, reactor and reaction conditions, etc., so as to achieve low energy consumption and high yield in practical applications, and reduce the distance from industrial requirements. Third, lack of extensive research on the reaction mechanism. An in-depth understanding of the reaction mechanism helps us to regulate the selectivity of the reduction products, avoid the problem of too many product types. There is no need for subsequent separation of the products, which reduces energy consumption. Fourth, we need to further reduce the difference between the experimental conditions and the actual application, so that it is close to the real state, in order to reduce or avoid the inefficiency or the emergence of new problems in the actual application. Whether it is experimental research or theoretical research, we need to establish a more perfect modeling plan, comprehensively consider the possible influencing factors, and achieve the lowest impact in the process of industrial amplification. To overcome these shortcomings and challenges, we propose the following research directions and perspectives. (1) Development of high-performance catalysts. First, for the new catalysts proposed in the paper, we should actively innovate and explore on the Cu2O system. For example，for single-atom/cluster catalysts, the theoretical studies are relatively mature, but their precise preparation is still difficult, and there are great difficulties to be overcome for practical applications；for the doped/loaded system, the introduction of the second component has been proven to have a positive effect on the CO2RR, we can conduct research on more types of elements and double doping/loading systems; in addition, there are also FLPs and tandem catalysts, etc. The mature application of these new catalysts is expected to break through the limitation of catalytic activity and stability of Cu2O. (2) Generation of high-value products. Second, the reduction of CO2 to C2+ high-value products is a very attractive technological mean. Compared with C1 products such as CO and HCOOH, C2 products such as C2H4 and C2H5OH have higher energy density and added value [282]. The key to the formation of C2 products is the strength of the adsorption energy of the important intermediates on the catalyst surface. A suitable adsorption energy facilitates the C-C coupling reaction without causing desorption or hinderinfg its further reaction due to too strong or too weak adsorption energy. In addition, it is required to overcome the larger reaction potential in the C-C formation process. Based on this paper, the Cu2O photocatalytic reduction of CO2 to C1 products is relatively mature, but it is still challenging for C2 products, and we need to further develop and explore new Cu2O-based catalysts. For the electrocatalytic reduction of CO2, Cu2O is inherently better at C2 generation, and it also shows some activity towards the generation of C3 products. We need to build on this foundation to further overcome the challenges of high energy barriers and slow kinetics of the reaction. In conclusion, we seek to efficiently and directionally generate products with more added value. This has been the goal of our research for a long time. (3) Application of theoretical tools (Interdisciplinary cooperation). Thirdly, the application of ML and DFT in exploring catalysts help us to prove the expected mechanism, selectivity and efficiency, provide a detailed reaction mechanism and save our time and cost. Theoretical studies of the reaction system by ML and DFT can better predict the performance of the catalyst and identify the reactive sites. And it also helps us better understand the effects of crystal facet, doping and loading on the reaction. We should strengthen the combination of theoretical calculations and experimental studies, which is essential to understand the catalytic mechanism and improve the catalytic performance. (4) Reaction Rate Enhancement. Finally, for the electrocatalytic CO2RR, the reactor design and the optimization of the electrodes are also crucial to improve the reaction efficiency, which will effectively increase the photocurrent density, accelerate the reaction kinetics, and improve the stability of the catalyst. In recent years, gas diffusion electrodes (GDEs) have been widely used in CO2RR [283–286]. As a kind of porous membrane electrode, GDEs can enhance the mass transport of CO2 to the catalyst and overcome the limitation of CO2 solubility in aqueous electrolytes. GDEs with hydrophobic and porous characteristic substrates can realize higher current density and effectively shorten the diffusion distance of CO2, which has a good development prospect. In order to ensure the stability of the gas diffusion layer (GDL), we need to pay special attention to its porosity and hydrophobicity, which are the key parameters affecting the water and gas transport, and are the focus of our material improvement research. In addition, facing the slow kinetic reaction and high energy consumption of OER at the anode in the electrocatalytic CO2RR process, we can couple CO2RR with organic oxidation reactions (methanol oxidation [287], formaldehyde oxidation [288], etc.). Building them into membrane electrode assemblies generates chemicals with higher added value. In short, optimizing the reaction environment and composition of the catalyst is of great significance to the overall performance of the catalyst. Overall, the development of catalysts with high activity, selectivity and long-term stability is an ongoing goal. In addition to the performance enhancement research, we should also consider the catalyst from the perspective of its practical application. We should pay attention to the research of catalyst deactivation mechanism to ensure that it can be stable and effective in the long term. We hope that this article can provide a systematic guide to the treatment of CO2 with Cu2O-based catalysts, which can help in the resource utilization of CO2. Declaration of Competing Interest The authors declare that they have no known competing financial interests or personal relationships that could have appeared to influence the work reported in this paper. Acknowledgments This work was supported by the National Natural Science Foundation of China (NSFC 92261203 and 22273053), NSFC Center for Single-Atom Catalysis (22388102) and Natural Science Basic Research Program of Shaanxi (Nos. 2021JCW-20 and S2020-JC-WT-0001). This paper is dedicated to Prof. Haijun Jiao on the occasion of his 60th birthday. Appendix A Supporting information Supplementary data associated with this article can be found in the online version at doi:10.1016/j.apcata.2023.119445. Appendix A Supplementary material Supplementary material References [1] M. Mikkelsen M. Jorgensen F.C. Krebs Energy Environ. Sci. 3 2010 43 81 M. Mikkelsen, M. Jorgensen, F.C. Krebs, Energy Environ. Sci. 3 (2010) 43–81. [2] X. Li T. Damartzis Z. Stadler S. Moret B. Meier M. Friedl F. Marechal Front. Energy Res. 8 2020 549615 X. Li, T. Damartzis, Z. Stadler, S. Moret, B. Meier, M. Friedl, F. Marechal, Front. Energy Res. 8 (2020) 549615. [3] Y. Hu Y. Chi W. Zhou Z. Wang Y. Yuan R. Li Energies 15 2022 5954 Y. Hu, Y. Chi, W. Zhou, Z. Wang, Y. Yuan, R. Li, Energies 15 (2022) 5954. [4] X. Zhao X. Ma B. Chen Y. Shang M. Song Resour. Conserv. Recycl. 176 2022 105959 X. Zhao, X. Ma, B. Chen, Y. Shang, M. Song, Resour. Conserv. Recycl. 176 (2022) 105959. [5] Z. Zhang S.-Y. Pan H. Li J. Cai A.G. Olabi E.J. Anthony V. Manovic Renew. Sust. Energ. Rev. 125 2020 109799 Z. Zhang, S.-Y. Pan, H. Li, J. Cai, A.G. Olabi, E.J. Anthony, V. Manovic, Renew. Sust. Energ. Rev. 125 (2020) 109799. [6] A. Liu M. Gao X. Ren F. Meng Y. Yang L. Gao Q. Yang T. Ma J. Mater. Chem. A 8 2020 3541 3562 A. Liu, M. Gao, X. Ren, F. Meng, Y. Yang, L. Gao, Q. Yang, T. Ma, J. Mater. Chem. A 8 (2020) 3541–3562. [7] S. Das J. Perez-Ramirez J. Gong N. Dewangan K. Hidajat B.C. Gates S. Kawi Chem. Soc. Rev. 49 2020 2937 3004 S. Das, J. Perez-Ramirez, J. Gong, N. Dewangan, K. Hidajat, B.C. Gates, S. Kawi, Chem. Soc. Rev. 49 (2020) 2937–3004. [8] S. Roy A. Cherevotan S.C. Peter ACS Energy Lett. 3 2018 1938 1966 S. Roy, A. Cherevotan, S.C. Peter, ACS Energy Lett. 3 (2018) 1938–1966. [9] S.N. Habisreutinger L. Schmidt-Mende J.K. Stolarczyk Angew. Chem. -Int. Ed. 52 2013 7372 7408 S.N. Habisreutinger, L. Schmidt-Mende, J.K. Stolarczyk, Angew. Chem.-Int. Edit. 52 (2013) 7372–7408. [10] L. Hou J. Yan L. Takele Y. Wang X. Yan Y. Gao Inorg. Chem. Front. 6 2019 3363 3380 L. Hou, J. Yan, L. Takele, Y. Wang, X. Yan, Y. Gao, Inorg. Chem. Front. 6 (2019) 3363–3380. [11] P. Yang Z.-J. Zhao X. Chang R. Mu S. Zha G. Zhang J. Gong Angew. Chem. -Int. Ed. 57 2018 7724 7728 P. Yang, Z.-J. Zhao, X. Chang, R. Mu, S. Zha, G. Zhang, J. Gong, Angew. Chem.-Int. Edit. 57 (2018) 7724–7728. [12] S. Rej M. Bisetto A. Naldoni P. Fornasiero J. Mater. Chem. A 9 2021 5915 5951 S. Rej, M. Bisetto, A. Naldoni, P. Fornasiero, J. Mater. Chem. A 9 (2021) 5915–5951. [13] C.Y. Toe J. Scott R. Amal Y.H. Ng J. Photochem. Photobiol. C. -Photochem. Rev. 40 2019 191 211 C.Y. Toe, J. Scott, R. Amal, Y.H. Ng, J. Photochem. Photobiol. C-Photochem. Rev. 40 (2019) 191–211. [14] H. Xie T. Wang J. Liang Q. Li S. Sun Nano Today 21 2018 41 54 H. Xie, T. Wang, J. Liang, Q. Li, S. Sun, Nano Today 21 (2018) 41–54. [15] S. Lee J. Lee Chemelectrochem 5 2018 558 564 S. Lee, J. Lee, Chemelectrochem 5 (2018) 558–564. [16] J. Yano T. Morita K. Shimano Y. Nagami S. Yamasaki J. Solid State Electrochem 11 2007 554 557 J. Yano, T. Morita, K. Shimano, Y. Nagami, S. Yamasaki, J. Solid State Electrochem. 11 (2007) 554–557. [17] S.-C. Lin C.-C. Chang S.-Y. Chiu H.-T. Pai T.-Y. Liao C.-S. Hsu W.-H. Chiang M.-K. Tsai H.M. Chen Nat. Commun. 11 2020 3525 S.-C. Lin, C.-C. Chang, S.-Y. Chiu, H.-T. Pai, T.-Y. Liao, C.-S. Hsu, W.-H. Chiang, M.-K. Tsai, H.M. Chen, Nat. Commun. 11 (2020) 3525. [18] H. Zhang Y. Qiao Y. Wang Y. Zheng H. Huang Sustain. Energ. Fuels 6 2022 4860 4865 H. Zhang, Y. Qiao, Y. Wang, Y. Zheng, H. Huang, Sustain. Energ. Fuels 6 (2022) 4860–4865. [19] A. Verdaguer-Casadevall C.W. Li T.P. Johansson S.B. Scott J.T. McKeown M. Kumar I.E.L. Stephens M.W. Kanan I. Chorkendorff J. Am. Chem. Soc. 137 2015 9808 9811 A. Verdaguer-Casadevall, C.W. Li, T.P. Johansson, S.B. Scott, J.T. McKeown, M. Kumar, I.E.L. Stephens, M.W. Kanan, I. Chorkendorff, J. Am. Chem. Soc. 137 (2015) 9808–9811. [20] H. Xiao W.A. Goddard III T. Cheng Y. Liu Proc. Natl. Acad. Sci. U. S. A. 114 2017 6685 6688 H. Xiao, W.A. Goddard, III, T. Cheng, Y. Liu, Proc. Natl. Acad. Sci. U. S. A. 114 (2017) 6685–6688. [21] L.W.S. Wang D. Wang Y. Li Energy Environ. Sci. 16 2023 2759 2803 L.W.S. Wang, D. Wang and Y. Li, Energy Environ. Sci. 16 (2023) 2759–2803. [22] Z. Deng S. Hu J. Ji S. Wu H. Xie M. Xing J. Zhang Appl. Catal. B-Environ. 316 2022 121621 Z. Deng, S. Hu, J. Ji, S. Wu, H. Xie, M. Xing, J. Zhang, Appl. Catal. B-Environ. 316 (2022) 121621. [23] Z. Yang Y. Chen X. Wen X. Guo R. Wei L. Gao X. Pan J. Zhang G. Xiao Vacuum 215 2023 112231 Z. Yang, Y. Chen, X. Wen, X. Guo, R. Wei, L. Gao, X. Pan, J. Zhang, G. Xiao, Vacuum 215 (2023) 112231. [24] D. Ren Y. Deng A.D. Handoko C.S. Chen S. Malkhandi B.S. Yeo ACS Catal. 5 2015 2814 2821 D. Ren, Y. Deng, A.D. Handoko, C.S. Chen, S. Malkhandi, B.S. Yeo, ACS Catal. 5 (2015) 2814–2821. [25] X. Yu X. Zhang S. Wang G. Feng Appl. Surf. Sci. 343 2015 33 40 X. Yu, X. Zhang, S. Wang, G. Feng, Appl. Surf. Sci. 343 (2015) 33–40. [26] X. Yu X. Zhang H. Wang Z. Wang G. Feng J. Phys. Chem. C 121 2017 22081 22091 X. Yu, X. Zhang, H. Wang, Z. Wang, G. Feng, J. Phys. Chem. C 121 (2017) 22081–22091. [27] X. Yu C. Zhao T. Zhang Z. Liu Phys. Chem. Chem. Phys. 20 2018 20352 20362 X. Yu, C. Zhao, T. Zhang, Z. Liu, Phys. Chem. Chem. Phys. 20 (2018) 20352–20362. [28] X. Yu X. Zhang X. Tian S. Wang G. Feng Appl. Surf. Sci. 324 2015 53 60 X. Yu, X. Zhang, X. Tian, S. Wang, G. Feng, Appl. Surf. Sci. 324 (2015) 53–60. [29] X. Yu X. Zhang S. Wang G. Feng Curr. Appl. Phys. 15 2015 1303 1311 X. Yu, X. Zhang, S. Wang, G. Feng, Curr. Appl. Phys. 15 (2015) 1303–1311. [30] Y. Guo X. Yu Q. Yu Y. Li Y. Liu C. Zhao L. Jin Z. Liu J. Li J. Phys. Chem. C 126 2022 8065 8078 Y. Guo, X. Yu, Q. Yu, Y. Li, Y. Liu, C. Zhao, L. Jin, Z. Liu, J. Li, J. Phys. Chem. C 126 (2022) 8065–8078. [31] X. Yu X. Zhang H. Wang G. Feng Appl. Surf. Sci. 425 2017 803 810 X. Yu, X. Zhang, H. Wang, G. Feng, Appl. Surf. Sci. 425 (2017) 803–810. [32] X. Yu X. Zhang Phys. Chem. Chem. Phys. 19 2017 18652 18659 X. Yu, X. Zhang, Phys. Chem. Chem. Phys. 19 (2017) 18652–18659. [33] A. Aranda-Aguirre J. Ojeda J.F. de Brito S. Garcia-Segura M.V. Boldrin Zanoni H. Alarcon J. CO2 Util. 39 2020 101154 A. Aranda-Aguirre, J. Ojeda, J.F. de Brito, S. Garcia-Segura, M.V. Boldrin Zanoni, H. Alarcon, J. CO2 Util. 39 (2020) 101154. [34] D.H. Won C.H. Choi J. Chung S.I. Woo Appl. Catal. B-Environ. 158 2014 217 223 D.H. Won, C.H. Choi, J. Chung, S.I. Woo, Appl. Catal. B-Environ. 158 (2014) 217–223. [35] P. Li H. Jing J. Xu C. Wu H. Peng J. Lu F. Lu Nanoscale 6 2014 11380 11386 P. Li, H. Jing, J. Xu, C. Wu, H. Peng, J. Lu, F. Lu, Nanoscale 6 (2014) 11380–11386. [36] J.-M. Li C.-W. Tsao M.-J. Fang C.-C. Chen C.-W. Liu Y.-J. Hsu ACS Appl. Nano Mater. 1 2018 6843 6853 J.-M. Li, C.-W. Tsao, M.-J. Fang, C.-C. Chen, C.-W. Liu, Y.-J. Hsu, ACS Appl. Nano Mater. 1 (2018) 6843–6853. [37] Y. Zheng L. Zhang J. Guan S. Qian Z. Zhang C.K. Ngaw S. Wan S. Wang J. Lin Y. Wang ACS Sustain. Chem. Eng. 9 2021 1754 1761 Y. Zheng, L. Zhang, J. Guan, S. Qian, Z. Zhang, C.K. Ngaw, S. Wan, S. Wang, J. Lin, Y. Wang, ACS Sustain. Chem. Eng. 9 (2021) 1754–1761. [38] C.S. Chen A.D. Handoko J.H. Wan L. Ma D. Ren B.S. Yeo Catal. Sci. Technol. 5 2015 161 168 C.S. Chen, A.D. Handoko, J.H. Wan, L. Ma, D. Ren, B.S. Yeo, Catal. Sci. Technol. 5 (2015) 161–168. [39] L. Cui L. Hu Q. Shen X. Liu H. Jia J. Xue Appl. Surf. Sci. 581 2022 152343 L. Cui, L. Hu, Q. Shen, X. Liu, H. Jia, J. Xue, Appl. Surf. Sci. 581 (2022) 152343. [40] W. Fu Z. Liu T. Wang J. Liang S. Duan L. Xie J. Han Q. Li ACS Sustain. Chem. Eng. 8 2020 15223 15229 W. Fu, Z. Liu, T. Wang, J. Liang, S. Duan, L. Xie, J. Han, Q. Li, ACS Sustain. Chem. Eng. 8 (2020) 15223–15229. [41] M.E. Aguirre R. Zhou A.J. Eugene M.I. Guzman M.A. Grela Appl. Catal. B-Environ. 217 2017 485 493 M.E. Aguirre, R. Zhou, A.J. Eugene, M.I. Guzman, M.A. Grela, Appl. Catal. B-Environ. 217 (2017) 485–493. [42] J.-C. Wang L. Zhang W.-X. Fang J. Ren Y.-Y. Li H.-C. Yao J.-S. Wang Z.-J. Li ACS Appl. Mater. Interfaces 7 2015 8631 8639 J.-C. Wang, L. Zhang, W.-X. Fang, J. Ren, Y.-Y. Li, H.-C. Yao, J.-S. Wang, Z.-J. Li, ACS Appl. Mater. Interfaces 7 (2015) 8631–8639. [43] Z. Tang W. He Y. Wang Y. Wei X. Yu J. Xiong X. Wang X. Zhang Z. Zhao J. Liu Appl. Catal. B-Environ. 311 2022 121371 Z. Tang, W. He, Y. Wang, Y. Wei, X. Yu, J. Xiong, X. Wang, X. Zhang, Z. Zhao, J. Liu, Appl. Catal. B-Environ. 311 (2022) 121371. [44] H. Pan C.J. Barile J. Mater. Chem. A 8 2020 1741 1748 H. Pan, C.J. Barile, J. Mater. Chem. A 8 (2020) 1741–1748. [45] J. Gao H. Zhang X. Guo J. Luo S.M. Zakeeruddin D. Ren M. Gratzel J. Am. Chem. Soc. 141 2019 18704 18714 J. Gao, H. Zhang, X. Guo, J. Luo, S.M. Zakeeruddin, D. Ren, M. Gratzel, J. Am. Chem. Soc. 141 (2019) 18704–18714. [46] X. Ren X. Zhang X. Cao Q. Wang J. CO2 Util. 38 2020 125 131 X. Ren, X. Zhang, X. Cao, Q. Wang, J. CO2 Util. 38 (2020) 125–131. [47] W. Wang Z. Ma X. Fei X. Wang Z. Yang Y. Wang J. Zhang H. Ning N. Tsubaki M. Wu Chem. Eng. J. 436 2022 135029 W. Wang, Z. Ma, X. Fei, X. Wang, Z. Yang, Y. Wang, J. Zhang, H. Ning, N. Tsubaki, M. Wu, Chem. Eng. J. 436 (2022) 135029. [48] G.O. Larrazabal A.J. Martin F. Krumeich R. Hauert J. Perez-Ramirez Chemsuschem 10 2017 1255 1265 G.O. Larrazabal, A.J. Martin, F. Krumeich, R. Hauert, J. Perez-Ramirez, Chemsuschem 10 (2017) 1255–1265. [49] L. Yu X. Ba M. Qiu Y. Li L. Shuai W. Zhang Z. Ren Y. Yu Nano Energy 60 2019 576 582 L. Yu, X. Ba, M. Qiu, Y. Li, L. Shuai, W. Zhang, Z. Ren, Y. Yu, Nano Energy 60 (2019) 576–582. [50] H. Jung S.Y. Lee C.W. Lee M.K. Cho D.H. Won C. Kim H.-S. Oh B.K. Min Y.J. Hwang J. Am. Chem. Soc. 141 2019 4624 4633 H. Jung, S.Y. Lee, C.W. Lee, M.K. Cho, D.H. Won, C. Kim, H.-S. Oh, B.K. Min, Y.J. Hwang, J. Am. Chem. Soc. 141 (2019) 4624–4633. [51] L. Wang S. Nitopi A.B. Wong J.L. Snider A.C. Nielander C.G. Morales-Guio M. Orazov D.C. Higgins C. Hahn T.F. Jaramillo Nat. Catal. 2 2019 702 708 L. Wang, S. Nitopi, A.B. Wong, J.L. Snider, A.C. Nielander, C.G. Morales-Guio, M. Orazov, D.C. Higgins, C. Hahn, T.F. Jaramillo, Nat. Catal. 2 (2019) 702–708. [52] X. Feng K. Jiang S. Fan M.W. Kanan ACS Cent. Sci. 2 2016 169 174 X. Feng, K. Jiang, S. Fan, M.W. Kanan, ACS Central Sci. 2 (2016) 169–174. [53] C.W. Li J. Ciston M.W. Kanan Nature 508 2014 504 507 C.W. Li, J. Ciston, M.W. Kanan, Nature 508 (2014) 504–507. [54] F. Chang Y. Liu J. Wei L. Yang Z. Bai Inorg. Chem. Front. 10 2022 240 249 F. Chang, Y. Liu, J. Wei, L. Yang, Z. Bai, Inorg. Chem. Front. 10 (2022) 240–249. [55] S. Wang D. Wang B. Tian X. Gao L. Han Y. Zhong S. Song Z. Wang Y. Li J. Gui M.G. Sendeku Y. Zhang Y. Kuang X. Sun Sci. China-Mater. 66 2023 1801 1809 S. Wang, D. Wang, B. Tian, X. Gao, L. Han, Y. Zhong, S. Song, Z. Wang, Y. Li, J. Gui, M.G. Sendeku, Y. Zhang, Y. Kuang, X. Sun, Sci. China-Mater. 66 (2023) 1801–1809. [56] T. Baran A. Visibile M. Busch X. He S. Wojtyla S. Rondinini A. Minguzzi A. Vertova Molecules 26 2021 7271 T. Baran, A. Visibile, M. Busch, X. He, S. Wojtyla, S. Rondinini, A. Minguzzi, A. Vertova, Molecules 26 (2021) 7271. [57] Y.-H. Zhang M.-M. Liu J.-L. Chen S.-M. Fang P.-P. Zhou Dalton Trans. 50 2021 4091 4111 Y.-H. Zhang, M.-M. Liu, J.-L. Chen, S.-M. Fang, P.-P. Zhou, Dalton Trans. 50 (2021) 4091–4111. [58] Y. Meng S. Kuang H. Liu Q. Fan X. Ma S. Zhang Acta Phys. -Chim. Sin. 37 2021 2006034 Y. Meng, S. Kuang, H. Liu, Q. Fan, X. Ma, S. Zhang, Acta Phys.-Chim. Sin. 37 (2021) 2006034. [59] X. Zhang Z. Zhou J. Phys. Chem. C. 126 2022 3820 3829 X. Zhang, Z. Zhou, J. Phys. Chem. C 126 (2022) 3820–3829. [60] Ž. Kovačič B. Likozar M. Huš ACS Catal. 10 2020 14984 15007 Ž. Kovačič, B. Likozar, M. Huš, ACS Catal. 10 (2020) 14984–15007. [61] Q. Feng Y. Sun X. Gu Z. Dong Electrocatalysis 13 2022 675 690 Q. Feng, Y. Sun, X. Gu, Z. Dong, Electrocatalysis 13 (2022) 675–690. [62] Y. Wang E. Chen J. Tang A.C.S. Catal 12 2022 7300 7316 Y. Wang, E. Chen, J. Tang, A.C.S. Catal. 12 (2022) 7300–7316. [63] I.V. Bagal N.R. Chodankar M.A. Hassan A. Waseem M.A. Johar D.-H. Kim S.-W. Ryu Int. J. Hydrog. Energy 44 2019 21351 21378 I.V. Bagal, N.R. Chodankar, M.A. Hassan, A. Waseem, M.A. Johar, D.-H. Kim, S.-W. Ryu, Int. J. Hydrog. Energy 44 (2019) 21351–21378. [64] B. Weng M.-Y. Qi C. Han Z.-R. Tang Y.-J. Xu ACS Catal. 9 2019 4642 4687 B. Weng, M.-Y. Qi, C. Han, Z.-R. Tang, Y.-J. Xu, ACS Catal. 9 (2019) 4642–4687. [65] J.K. Muiruri E. Ye Q. Zhu X.J. Loh Z. Li Appl. Catal. A-Gen. 648 2022 118927 J.K. Muiruri, E. Ye, Q. Zhu, X.J. Loh, Z. Li, Appl. Catal. A-Gen. 648 (2022) 118927. [66] A.K. Sahu M. Pokhriyal S. Upadhyayula X.S. Zhao J. Phys. Chem. C. 126 2022 13094 13104 A.K. Sahu, M. Pokhriyal, S. Upadhyayula, X.S. Zhao, J. Phys. Chem. C 126 (2022) 13094–13104. [67] R. Chen Z. Ren Y. Liang G. Zhang T. Dittrich R. Liu Y. Liu Y. Zhao S. Pang H. An C. Ni P. Zhou K. Han F. Fan C. Li Nature 610 2022 296 301 R. Chen, Z. Ren, Y. Liang, G. Zhang, T. Dittrich, R. Liu, Y. Liu, Y. Zhao, S. Pang, H. An, C. Ni, P. Zhou, K. Han, F. Fan, C. Li, Nature 610 (2022) 296–301. [68] W. Wang C. Deng S. Xie Y. Li W. Zhang H. Sheng C. Chen J. Zhao J. Am. Chem. Soc. 143 2021 2984 2993 W. Wang, C. Deng, S. Xie, Y. Li, W. Zhang, H. Sheng, C. Chen, J. Zhao, J. Am. Chem. Soc. 143 (2021) 2984–2993. [69] S. Ali A. Razzaq H. Kim S.-I. In Chem. Eng. J. 429 2022 131579 S. Ali, A. Razzaq, H. Kim, S.-I. In, Chem. Eng. J. 429 (2022) 131579. [70] W. Jiang H. Loh B.Q.L. Low H. Zhu J. Low J.Z.X. Heng K.Y. Tang Z. Li X.J. Loh E. Ye Y. Xiong Appl. Catal. B-Environ. 321 2023 122079 W. Jiang, H. Loh, B.Q.L. Low, H. Zhu, J. Low, J.Z.X. Heng, K.Y. Tang, Z. Li, X.J. Loh, E. Ye, Y. Xiong, Appl. Catal. B-Environ. 321 (2023) 122079. [71] C. Kim K.M. Cho A. Al-Saggaf I. Gereige H.-T. Jung ACS Catal. 8 2018 4170 4177 C. Kim, K.M. Cho, A. Al-Saggaf, I. Gereige, H.-T. Jung, ACS Catal. 8 (2018) 4170–4177. [72] J. Low J. Yu M. Jaroniec S. Wageh A.A. Al-Ghamdi Adv. Mater. 29 2017 1601694 J. Low, J. Yu, M. Jaroniec, S. Wageh, A.A. Al-Ghamdi, Adv. Mater. 29 (2017) 1601694. [73] C. Han Y.-P. Lei Y.-D. Wang J. Inorg. Mater. 30 2015 1121 1130 C. Han, Y.-P. Lei, Y.-D. Wang, J. Inorg. Mater. 30 (2015) 1121–1130. [74] P. Zhou J. Yu M. Jaroniec Adv. Mater. 26 2014 4920 4935 P. Zhou, J. Yu, M. Jaroniec, Adv. Mater. 26 (2014) 4920–4935. [75] J. Low B. Dai T. Tong C. Jiang J. Yu Adv. Mater. 31 2019 1802981 J. Low, B. Dai, T. Tong, C. Jiang, J. Yu, Adv. Mater. 31 (2019) 1802981. [76] J. Wang G. Ji Y. Liu M.A. Gondal X. Chang Catal. Commun. 46 2014 17 21 J. Wang, G. Ji, Y. Liu, M.A. Gondal, X. Chang, Catal. Commun. 46 (2014) 17–21. [77] Y. Li W. Zhang X. Shen P. Peng L. Xiong Y. Yu Chin. J. Catal. 36 2015 2229 2236 Y. Li, W. Zhang, X. Shen, P. Peng, L. Xiong, Y. Yu, Chin. J. Catal. 36 (2015) 2229–2236. [78] S.-M. Park A. Razzaq Y.H. Park S. Sorcar Y. Park C.A. Grimes S.-I. In ACS Omega 1 2016 868 875 S.-M. Park, A. Razzaq, Y.H. Park, S. Sorcar, Y. Park, C.A. Grimes, S.-I. In, ACS Omega 1 (2016) 868–875. [79] W. Shi X. Guo C. Cui K. Jiang Z. Li L. Qu J.-C. Wang Appl. Catal. B-Environ. 243 2019 236 242 W. Shi, X. Guo, C. Cui, K. Jiang, Z. Li, L. Qu, J.-C. Wang, Appl. Catal. B-Environ. 243 (2019) 236–242. [80] A.-A. Zhang Y.-L. Li Z.-B. Fang L. Xie R. Cao Y. Liu T.-F. Liu ACS Appl. Mater. Interfaces 14 2022 21050 21058 A.-A. Zhang, Y.-L. Li, Z.-B. Fang, L. Xie, R. Cao, Y. Liu, T.-F. Liu, ACS Appl. Mater. Interfaces 14 (2022) 21050–21058. [81] J. Wang R.-t Guo Z.-x Bi X. Chen X. Hu W.-g Pan Nanoscale 14 2022 11512 11528 J. Wang, R.-t Guo, Z.-x Bi, X. Chen, X. Hu, W.-g Pan, Nanoscale 14 (2022) 11512–11528. [82] D.K. Zhong J. Sun H. Inumaru D.R. Gamelin J. Am. Chem. Soc. 131 2009 6086 6087 D.K. Zhong, J. Sun, H. Inumaru, D.R. Gamelin, J. Am. Chem. Soc. 131 (2009) 6086–6087. [83] R. Crespo-Otero A. Walsh J. Phys. Chem. Lett. 6 2015 2379 2383 R. Crespo-Otero, A. Walsh, J. Phys. Chem. Lett. 6 (2015) 2379–2383. [84] Y.S. Ham S. Choe M.J. Kim T. Lim S.-K. Kim J.J. Kim Appl. Catal. B-Environ. 208 2017 35 43 Y.S. Ham, S. Choe, M.J. Kim, T. Lim, S.-K. Kim, J.J. Kim, Appl. Catal. B-Environ. 208 (2017) 35–43. [85] K. Sun L. Wu W. Qin J. Zhou Y. Hu Z. Jiang B. Shen Z. Wang J. Mater. Chem. A 4 2016 12616 12623 K. Sun, L. Wu, W. Qin, J. Zhou, Y. Hu, Z. Jiang, B. Shen, Z. Wang, J. Mater. Chem. A 4 (2016) 12616–12623. [86] S. Zhao Z. Tang S. Guo M. Han C. Zhu Y. Zhou L. Bai J. Gao H. Huang Y. Li Y. Liu Z. Kang ACS Catal. 8 2018 188 197 S. Zhao, Z. Tang, S. Guo, M. Han, C. Zhu, Y. Zhou, L. Bai, J. Gao, H. Huang, Y. Li, Y. Liu, Z. Kang, ACS Catal. 8 (2018) 188–197. [87] Q. Quan S. Xie B. Weng Y. Wang Y.-J. Xu Small 14 2018 1704531 Q. Quan, S. Xie, B. Weng, Y. Wang, Y.-J. Xu, Small 14 (2018) 1704531. [88] W.-K. Jo S. Kumar S. Eslava S. Tonda Appl. Catal. B-Environ. 239 2018 586 598 W.-K. Jo, S. Kumar, S. Eslava, S. Tonda, Appl. Catal. B-Environ. 239 (2018) 586–598. [89] P. Wang S. Zhan Y. Xia S. Ma Q. Zhou Y. Li Appl. Catal. B-Environ. 207 2017 335 346 P. Wang, S. Zhan, Y. Xia, S. Ma, Q. Zhou, Y. Li, Appl. Catal. B-Environ. 207 (2017) 335–346. [90] G. Yang P. Qiu J. Xiong X. Zhu G. Cheng Chin. Chem. Lett. 33 2022 3709 3712 G. Yang, P. Qiu, J. Xiong, X. Zhu, G. Cheng, Chin. Chem. Lett. 33 (2022) 3709–3712. [91] J. Zhou Y. Li L. Yu Z. Li D. Xie Y. Zhao Y. Yu Chem. Eng. J. 385 2020 123940 J. Zhou, Y. Li, L. Yu, Z. Li, D. Xie, Y. Zhao, Y. Yu, Chem. Eng. J. 385 (2020) 123940. [92] S. Ali J. Lee H. Kim Y. Hwang A. Razzaq J.-W. Jung C.-H. Cho S.-I. In Appl. Catal. B-Environ. 279 2020 119344 S. Ali, J. Lee, H. Kim, Y. Hwang, A. Razzaq, J.-W. Jung, C.-H. Cho, S.-I. In, Appl. Catal. B-Environ. 279 (2020) 119344. [93] D. Ning H. Wei G. Ou R. Zhang H. Wu J. Am. Ceram. Soc. 101 2018 4857 4863 D. Ning, H. Wei, G. Ou, R. Zhang, H. Wu, J. Am. Ceram. Soc. 101 (2018) 4857–4863. [94] A. Razzaq A. Sinhamahapatra T.-H. Kang C.A. Grimes J.-S. Yu S.-I. In Appl. Catal. B-Environ. 215 2017 28 35 A. Razzaq, A. Sinhamahapatra, T.-H. Kang, C.A. Grimes, J.-S. Yu, S.-I. In, Appl. Catal. B-Environ. 215 (2017) 28–35. [95] F. Li L. Zhang J. Tong Y. Liu S. Xu Y. Cao S. Cao Nano Energy 27 2016 320 329 F. Li, L. Zhang, J. Tong, Y. Liu, S. Xu, Y. Cao, S. Cao, Nano Energy 27 (2016) 320–329. [96] Z.-Y. Tian L.-H. Kong Y. Wang H.-J. Wang Y.-J. Wang S. Yao T.-B. Lu Z.-M. Zhang Small 17 2021 2103558 Z.-Y. Tian, L.-H. Kong, Y. Wang, H.-J. Wang, Y.-J. Wang, S. Yao, T.-B. Lu, Z.-M. Zhang, Small 17 (2021) 2103558. [97] X. Wang S. Blechert M. Antonietti ACS Catal. 2 2012 1596 1606 X. Wang, S. Blechert, M. Antonietti, ACS Catal. 2 (2012) 1596–1606. [98] Z. Yang Y. Zhang H. Zhang J. Zhao H. Shi M. Zhang H. Yang Z. Zheng P. Yang J. Catal. 409 2022 12 23 Z. Yang, Y. Zhang, H. Zhang, J. Zhao, H. Shi, M. Zhang, H. Yang, Z. Zheng, P. Yang, J. Catal. 409 (2022) 12–23. [99] H. Li Y. Gao Z. Xiong C. Liao K. Shih Appl. Surf. Sci. 439 2018 552 559 H. Li, Y. Gao, Z. Xiong, C. Liao, K. Shih, Appl. Surf. Sci. 439 (2018) 552–559. [100] M. Liu L. Zheng X. Bao Z. Wang P. Wang Y. Liu H. Cheng Y. Dai B. Huang Z. Zheng Chem. Eng. J. 405 2021 126654 M. Liu, L. Zheng, X. Bao, Z. Wang, P. Wang, Y. Liu, H. Cheng, Y. Dai, B. Huang, Z. Zheng, Chem. Eng. J. 405 (2021) 126654. [101] Y. Zhang Z. Zhang X. Yang R. Wang H. Duan Z. Shen L. Li Y. Su R. Yang Y. Zhang X. Su Y. Huang T. Zhang Green. Chem. 22 2020 6855 6861 Y. Zhang, Z. Zhang, X. Yang, R. Wang, H. Duan, Z. Shen, L. Li, Y. Su, R. Yang, Y. Zhang, X. Su, Y. Huang, T. Zhang, Green Chem. 22 (2020) 6855–6861. [102] X. Feng J.D. Sloppy T.J. LaTemp M. Paulose S. Komarneni N. Bao C.A. Grimes J. Mater. Chem. A 21 2011 13429 13433 X. Feng, J.D. Sloppy, T.J. LaTemp, M. Paulose, S. Komarneni, N. Bao, C.A. Grimes, J. Mater. Chem. A 21 (2011) 13429–13433. [103] X. Zhang X. Zhao K. Chen Y. Fan S. Wei W. Zhang D. Han L. Niu Nanoscale 13 2021 2883 2890 X. Zhang, X. Zhao, K. Chen, Y. Fan, S. Wei, W. Zhang, D. Han, L. Niu, Nanoscale 13 (2021) 2883–2890. [104] D. Gao H. Zhou F. Cai J. Wang G. Wang X. Bao ACS Catal. 8 2018 1510 1519 D. Gao, H. Zhou, F. Cai, J. Wang, G. Wang, X. Bao, ACS Catal. 8 (2018) 1510–1519. [105] Y. Deng C. Wan C. Li Y. Wang X. Mu W. Liu Y. Huang P.K. Wong L. Ye ACS Catal. 12 2022 4526 4533 Y. Deng, C. Wan, C. Li, Y. Wang, X. Mu, W. Liu, Y. Huang, P.K. Wong, L. Ye, ACS Catal. 12 (2022) 4526–4533. [106] W. Jiang B.Q.L. Low R. Long J. Low H. Loh K.Y. Tang C.H.T. Chai H. Zhu H. Zhu Z. Li X.J. Loh Y. Xiong E. Ye Acs Nano 17 2023 4193 4229 W. Jiang, B.Q.L. Low, R. Long, J. Low, H. Loh, K.Y. Tang, C.H.T. Chai, H. Zhu, H. Zhu, Z. Li, X.J. Loh, Y. Xiong, E. Ye, Acs Nano 17 (2023) 4193–4229. [107] J. Quiroz E.C.M. Barbosa T.P. Araujo J.L. Fiorio Y.-C. Wang Y.-C. Zou T. Mou T.V. Alves D.C. de Oliveira B. Wang S.J. Haigh L.M. Rossi P.H.C. Camargo Nano Lett. 18 2018 7289 7297 J. Quiroz, E.C.M. Barbosa, T.P. Araujo, J.L. Fiorio, Y.-C. Wang, Y.-C. Zou, T. Mou, T.V. Alves, D.C. de Oliveira, B. Wang, S.J. Haigh, L.M. Rossi, P.H.C. Camargo, Nano Lett. 18 (2018) 7289–7297. [108] P. Christopher H. Xin S. Linic Nat. Chem. 3 2011 467 472 P. Christopher, H. Xin, S. Linic, Nat. Chem. 3 (2011) 467–472. [109] A. Marimuthu J. Zhang S. Linic Science 339 2013 1590 1593 A. Marimuthu, J. Zhang, S. Linic, Science 339 (2013) 1590–1593. [110] H. Robatjazi H. Zhao D.F. Swearer N.J. Hogan L. Zhou A. Alabastri M.J. McClain P. Nordlander N.J. Halas Nat. Commun. 8 2017 〈https://doi.org/10.1038/s41467-017-00055-z〉 H. Robatjazi, H. Zhao, D.F. Swearer, N.J. Hogan, L. Zhou, A. Alabastri, M.J. McClain, P. Nordlander, N.J. Halas, Nat. Commun. 8 (2017) https://doi.org/10.1038/s41467–017-00055-z. [111] T. Le Y. Shao B. Wang J. Phys. Chem. C. 125 2021 6108 6115 T. Le, Y. Shao, B. Wang, J. Phys. Chem. C 125 (2021) 6108–6115. [112] R. Chen S. Pang H. An T. Dittrich F. Fan C. Li Nano Lett. 19 2019 426 432 R. Chen, S. Pang, H. An, T. Dittrich, F. Fan, C. Li, Nano Lett. 19 (2019) 426–432. [113] T. Nguyen Thi Thanh B. Long Giang H. Nguyen Thi P. Thanh-Dong C. Nguyen Thi Phuong Le T. Dinh Trinh N. Minh Viet N. Van Noi J. Colloid Interface Sci. 540 2019 1 8 T. Nguyen Thi Thanh, B. Long Giang, H. Nguyen Thi, P. Thanh-Dong, C. Nguyen Thi Phuong Le, T. Dinh Trinh, N. Minh Viet, N. Van Noi, J. Colloid Interface Sci. 540 (2019) 1–8. [114] X. Qiu G. Li X. Sun L. Li X. Fu Nanotechnology 19 2008 215703 X. Qiu, G. Li, X. Sun, L. Li, X. Fu, Nanotechnology 19 (2008) 215703. [115] Z.U. Rehman M. Bilal J. Hou F.K. Butt J. Ahmad S. Ali A. Hussain Molecules 27 2022 2069 Z.U. Rehman, M. Bilal, J. Hou, F.K. Butt, J. Ahmad, S. Ali, A. Hussain, Molecules 27 (2022) 2069. [116] W.-N. Wang W.-J. An B. Ramalingam S. Mukherjee D.M. Niedzwiedzki S. Gangopadhyay P. Biswas J. Am. Chem. Soc. 134 2012 11276 11281 W.-N. Wang, W.-J. An, B. Ramalingam, S. Mukherjee, D.M. Niedzwiedzki, S. Gangopadhyay, P. Biswas, J. Am. Chem. Soc. 134 (2012) 11276–11281. [117] J. Wang S. Lin N. Tian T. Ma Y. Zhang H. Huang Adv. Funct. Mater. 31 2021 2008008 J. Wang, S. Lin, N. Tian, T. Ma, Y. Zhang, H. Huang, Adv. Funct. Mater. 31 (2021) 2008008. [118] M. Aggarwal S. Basu N.P. Shetti M.N. Nadagouda E.E. Kwon Y.-K. Park T.M. Aminabhavi Chem. Eng. J. 425 2021 131402 M. Aggarwal, S. Basu, N.P. Shetti, M.N. Nadagouda, E.E. Kwon, Y.-K. Park, T.M. Aminabhavi, Chem. Eng. J. 425 (2021) 131402. [119] Z. Gao C. Wang J. Li Y. Zhu Z. Zhang W. Hu Acta Phys. -Chim. Sin. 37 2021 2010025 Z. Gao, C. Wang, J. Li, Y. Zhu, Z. Zhang, W. Hu, Acta Phys.-Chim. Sin. 37 (2021) 2010025. [120] J. Li Y. Chen Z. Fan Z. Zhang Front. Energy Res. 9 2021 676876 J. Li, Y. Chen, Z. Fan, Z. Zhang, Front. Energy Res. 9 (2021) 676876. [121] K.P. Kuhl E.R. Cave D.N. Abram T.F. Jaramillo Energy Environ. Sci. 5 2012 7050 7059 K.P. Kuhl, E.R. Cave, D.N. Abram, T.F. Jaramillo, Energy Environ. Sci. 5 (2012) 7050–7059. [122] S. Nitopi E. Bertheussen S.B. Scott X. Liu A.K. Engstfeld S. Horch B. Seger I.E.L. Stephens K. Chan C. Hahn J.K. Norskov T.F. Jaramillo I. Chorkendorff Chem. Rev. 119 2019 7610 7672 S. Nitopi, E. Bertheussen, S.B. Scott, X. Liu, A.K. Engstfeld, S. Horch, B. Seger, I.E.L. Stephens, K. Chan, C. Hahn, J.K. Norskov, T.F. Jaramillo, I. Chorkendorff, Chem. Rev. 119 (2019) 7610–7672. [123] Hori, Y., Springer New York: New York, NY, USA, 32(2016) 191–211. [124] Z. Gu H. Shen L. Shang X. Lv L. Qian G. Zheng Small Methods 2 2018 1800121 Z. Gu, H. Shen, L. Shang, X. Lv, L. Qian, G. Zheng, Small Methods 2 (2018) 1800121. [125] K. Yao J. Li H. Wang R. Lu X. Yang M. Luo N. Wang Z. Wang C. Liu T. Jing S. Chen E. Cortes S.A. Maier S. Zhang T. Li Y. Yu Y. Liu X. Kang H. Liang J. Am. Chem. Soc. 144 2022 14005 14011 K. Yao, J. Li, H. Wang, R. Lu, X. Yang, M. Luo, N. Wang, Z. Wang, C. Liu, T. Jing, S. Chen, E. Cortes, S.A. Maier, S. Zhang, T. Li, Y. Yu, Y. Liu, X. Kang, H. Liang, J. Am. Chem. Soc.144 (2022) 14005–14011. [126] J. Li F. Che Y. Pang C. Zou J.Y. Howe T. Burdyny J.P. Edwards Y. Wang F. Li Z. Wang P. De Luna D. Cao-Thang T.-T. Zhuang M.I. Saidaminov S. Cheng T. Wu Y.Z. Finfrock L. Ma S.-H. Hsieh Y.-S. Liu G.A. Botton W.-F. Pong X. Du J. Guo T.-K. Sham E.H. Sargent D. Sinton Nat. Commun. 9 2018 4614 J. Li, F. Che, Y. Pang, C. Zou, J.Y. Howe, T. Burdyny, J.P. Edwards, Y. Wang, F. Li, Z. Wang, P. De Luna, D. Cao-Thang, T.-T. Zhuang, M.I. Saidaminov, S. Cheng, T. Wu, Y.Z. Finfrock, L. Ma, S.-H. Hsieh, Y.-S. Liu, G.A. Botton, W.-F. Pong, X. Du, J. Guo, T.-K. Sham, E.H. Sargent, D. Sinton, Nat. Commun. 9 (2018) 4614. [127] Y. Xu F. Li A. Xu J.P. Edwards S.-F. Hung C.M. Gabardo C.P. O'Brien S. Liu X. Wang Y. Li J. Wicks R.K. Miao Y. Liu J. Li J.E. Huang J. Abed Y. Wang E.H. Sargent D. Sinton Nat. Commun. 12 2021 2932 Y. Xu, F. Li, A. Xu, J.P. Edwards, S.-F. Hung, C.M. Gabardo, C.P. O'Brien, S. Liu, X. Wang, Y. Li, J. Wicks, R.K. Miao, Y. Liu, J. Li, J.E. Huang, J. Abed, Y. Wang, E.H. Sargent, D. Sinton, Nat. Commun. 12 (2021) 2932. [128] J. Yang Y. Guo W. Lu R. Jiang J. Wang Adv. Mater. 30 2018 1802227 J. Yang, Y. Guo, W. Lu, R. Jiang, J. Wang, Adv. Mater. 30 (2018) 1802227. [129] M.B. Ross P. De Luna Y. Li C.-T. Dinh D. Kim P. Yang E.H. Sargent Nat. Catal. 2 2019 648 658 M.B. Ross, P. De Luna, Y. Li, C.-T. Dinh, D. Kim, P. Yang, E.H. Sargent, Nat. Catal. 2 (2019) 648–658. [130] Z. Chen T. Wang B. Liu D. Cheng C. Hu G. Zhang W. Zhu H. Wang Z.-J. Zhao J. Gong J. Am. Chem. Soc. 142 2020 6878 6883 Z. Chen, T. Wang, B. Liu, D. Cheng, C. Hu, G. Zhang, W. Zhu, H. Wang, Z.-J. Zhao, J. Gong, J. Am. Chem. Soc. 142 (2020) 6878–6883. [131] J. Zhang Y. Wang Z. Li S. Xia R. Cai L. Ma T. Zhang J. Ackley S. Yang Y. Wu J. Wu Adv. Sci. 9 2022 2200454 J. Zhang, Y. Wang, Z. Li, S. Xia, R. Cai, L. Ma, T. Zhang, J. Ackley, S. Yang, Y. Wu, J. Wu, Adv. Sci. 9 (2022) 2200454. [132] J.H. Montoya A.A. Peterson J.K. Norskov ChemCatChem 5 2013 737 742 J.H. Montoya, A.A. Peterson, J.K. Norskov, ChemCatChem 5 (2013) 737–742. [133] P.-P. Yang X.-L. Zhang F.-Y. Gao Y.-R. Zheng Z.-Z. Niu X. Yu R. Liu Z.-Z. Wu S. Qin L.-P. Chi Y. Duan T. Ma X.-S. Zheng J.-F. Zhu H.-J. Wang M.-R. Gao S.-H. Yu J. Am. Chem. Soc. 142 2020 6400 6408 P.-P. Yang, X.-L. Zhang, F.-Y. Gao, Y.-R. Zheng, Z.-Z. Niu, X. Yu, R. Liu, Z.-Z. Wu, S. Qin, L.-P. Chi, Y. Duan, T. Ma, X.-S. Zheng, J.-F. Zhu, H.-J. Wang, M.-R. Gao, S.-H. Yu, J Am. Chem. Soc. 142 (2020) 6400–6408. [134] Y.-S. Cheng H. Li M. Ling N. Li B. Jiang F.-H. Wu G. Yuan X.-W. Wei Mater. Lett. 260 2020 126868 Y.-S. Cheng, H. Li, M. Ling, N. Li, B. Jiang, F.-H. Wu, G. Yuan, X.-W. Wei, Mater. Lett. 260 (2020) 126868. [135] M.T. Feroze S.K. Sami D. Doonyapisut B. Kim C.-H. Chung Chemelectrochem 7 2020 730 736 M.T. Feroze, S.K. Sami, D. Doonyapisut, B. Kim, C.-H. Chung, Chemelectrochem 7 (2020) 730–736. [136] T.-T. Zhuang Y. Pang Z.-Q. Liang Z. Wang Y. Li C.-S. Tan J. Li D. Cao Thang P. De Luna P.-L. Hsieh T. Burdyny H.-H. Li M. Liu Y. Wang F. Li A. Proppe A. Johnston D.-H. Nam Z.-Y. Wu Y.-R. Zheng A.H. Ip H. Tan L.-J. Chen S.-H. Yu S.O. Kelley D. Sinton E.H. Sargent Nat. Catal. 1 2018 946 951 T.-T. Zhuang, Y. Pang, Z.-Q. Liang, Z. Wang, Y. Li, C.-S. Tan, J. Li, D. Cao Thang, P. De Luna, P.-L. Hsieh, T. Burdyny, H.-H. Li, M. Liu, Y. Wang, F. Li, A. Proppe, A. Johnston, D.-H. Nam, Z.-Y. Wu, Y.-R. Zheng, A.H. Ip, H. Tan, L.-J. Chen, S.-H. Yu, S.O. Kelley, D. Sinton, E.H. Sargent, Nat. Catal. 1 (2018) 946–951. [137] S.-H. Liu J.-S. Lu Y.-C. Pu H.-C. Fan J. CO2 Util. 33 2019 171 178 S.-H. Liu, J.-S. Lu, Y.-C. Pu, H.-C. Fan, J. CO2 Util. 33 (2019) 171–178. [138] Y.A. Wu I. McNulty C. Liu K.C. Lau Q. Liu A.P. Paulikas C.-J. Sun Z. Cai J.R. Guest Y. Ren V. Stamenkovic L.A. Curtiss Y. Liu T. Rajh Nat. Energy 4 2019 957 968 Y.A. Wu, I. McNulty, C. Liu, K.C. Lau, Q. Liu, A.P. Paulikas, C.-J. Sun, Z. Cai, J.R. Guest, Y. Ren, V. Stamenkovic, L.A. Curtiss, Y. Liu, T. Rajh, Nat. Energy 4 (2019) 957–968. [139] A.D. Handoko J. Tang Int. J. Hydrog. Energy 38 2013 13017 13022 A.D. Handoko, J. Tang, Int. J. Hydrog. Energy 38 (2013) 13017–13022. [140] B. Liu X. Yao Z. Zhang C. Li J. Zhang P. Wang J. Zhao Y. Guo J. Sun C. Zhao ACS Appl. Mater. Interfaces 13 2021 39165 39177 B. Liu, X. Yao, Z. Zhang, C. Li, J. Zhang, P. Wang, J. Zhao, Y. Guo, J. Sun, C. Zhao, ACS Appl. Mater. Interfaces 13 (2021) 39165–39177. [141] H. Luo B. Li J.-G. Ma P. Cheng Angew. Chem. -Int. Ed. 61 2022 e202116736 H. Luo, B. Li, J.-G. Ma, P. Cheng, Angew. Chem.-Int. Edit. 61 (2022) e202116736. [142] Y. Gao Q. Wu X. Liang Z. Wang Z. Zheng P. Wang Y. Liu Y. Dai M.-H. Whangbo B. Huang Adv. Sci. 7 2020 1902820 Y. Gao, Q. Wu, X. Liang, Z. Wang, Z. Zheng, P. Wang, Y. Liu, Y. Dai, M.-H. Whangbo, B. Huang, Adv. Sci. 7 (2020) 1902820. [143] W. Tan B. Cao W. Xiao M. Zhang S. Wang S. Xie D. Xie F. Cheng Q. Guo P. Liu Nanoscale Res. Lett. 14 2019 63 W. Tan, B. Cao, W. Xiao, M. Zhang, S. Wang, S. Xie, D. Xie, F. Cheng, Q. Guo, P. Liu, Nanoscale Res. Lett. 14 (2019) 63. [144] L. Zhang M. Li S. Zhang X. Cao J. Bo X. Zhu J. Han Q. Ge H. Wang Catal. Today 365 2021 348 356 L. Zhang, M. Li, S. Zhang, X. Cao, J. Bo, X. Zhu, J. Han, Q. Ge, H. Wang, Catal. Today 365 (2021) 348–356. [145] Y.T. Lee R.P. Gautam S.M. Islam C.J. Barile J. Phys. Chem. C. 123 2019 1287 1292 Y.T. Lee, R.P. Gautam, S.M. Islam, C.J. Barile, J. Phys. Chem. C 123 (2019) 1287–1292. [146] A. Herzog A. Bergmann H.S. Jeon J. Timoshenko S. Kuehl C. Rettenmaier M. Lopez Luna F.T. Haase B. Roldan Cuenya Angew. Chem. -Int. Ed. 60 2021 7426 7435 A. Herzog, A. Bergmann, H.S. Jeon, J. Timoshenko, S. Kuehl, C. Rettenmaier, M. Lopez Luna, F.T. Haase, B. Roldan Cuenya, Angew. Chem.-Int. Edit. 60 (2021) 7426–7435. [147] X. Cao G. Cao M. Li X. Zhu J. Han Q. Ge H. Wang Eur. J. Inorg. Chem. 2021 2021 2353 2364 X. Cao, G. Cao, M. Li, X. Zhu, J. Han, Q. Ge, H. Wang, Eur. J. Inorg. Chem. 2021 (2021) 2353–2364. [148] Y. He Q. Lei C. Li Y. Han Z. Shi S. Feng Mater. Today 50 2021 358 384 Y. He, Q. Lei, C. Li, Y. Han, Z. Shi, S. Feng, Mater. Today 50 (2021) 358–384. [149] I.N. Sequeda A.M. Melendez J. Phys. Chem. Lett. 13 2022 3667 3673 I.N. Sequeda, A.M. Melendez, J. Phys. Chem. Lett. 13 (2022) 3667–3673. [150] I. Kasatkin P. Kurr B. Kniep A. Trunschke R. Schloegl Angew. Chem. -Int. Ed. 46 2007 7324 7327 I. Kasatkin, P. Kurr, B. Kniep, A. Trunschke, R. Schloegl, Angew. Chem.-Int. Edit. 46 (2007) 7324–7327. [151] H. Wu N. Zhang H. Wang S. Hong Chem. Phys. Lett. 568 2013 84 89 H. Wu, N. Zhang, H. Wang, S. Hong, Chem. Phys. Lett. 568 (2013) 84–89. [152] L.I. Bendavid E.A. Carter J. Phys. Chem. C. 117 2013 26048 26059 L.I. Bendavid, E.A. Carter, J. Phys. Chem. C 117 (2013) 26048–26059. [153] L. Li R. Zhang J. Vinson E.L. Shirley J.P. Greeley J.R. Guest M.K.Y. Chan Chem. Mat. 30 2018 1912 1923 L. Li, R. Zhang, J. Vinson, E.L. Shirley, J.P. Greeley, J.R. Guest, M.K.Y. Chan, Chem. Mat. 30 (2018) 1912–1923. [154] S. Lee G. Park J. Lee ACS Catal. 7 2017 8594 8604 S. Lee, G. Park, J. Lee, ACS Catal. 7 (2017) 8594–8604. [155] M. Wang X. Ren G. Yuan X. Niu Q. Xu W. Gao S. Zhu Q. Wang J. CO2 Util. 37 2020 204 212 M. Wang, X. Ren, G. Yuan, X. Niu, Q. Xu, W. Gao, S. Zhu, Q. Wang, J. CO2 Util. 37 (2020) 204–212. [156] H. Chen Z. Wang S. Cao S. Liu X. Lin Y. Zhang Y. Shang Q. Zhu S. Zhou S. Wei B. Wei D. Sun X. Lu J. Mater. Chem. A 9 2021 23234 23242 H. Chen, Z. Wang, S. Cao, S. Liu, X. Lin, Y. Zhang, Y. Shang, Q. Zhu, S. Zhou, S. Wei, B. Wei, D. Sun, X. Lu, J. Mater. Chem. A 9 (2021) 23234–23242. [157] S. Rasul D.H. Anjum A. Jedidi Y. Minenkov L. Cavallo K. Takanabe Angew. Chem. -Int. Ed. 54 2015 2146 2150 S. Rasul, D.H. Anjum, A. Jedidi, Y. Minenkov, L. Cavallo, K. Takanabe, Angew. Chem.-Int. Edit. 54 (2015) 2146–2150. [158] W. Luo W. Xie R. Mutschler E. Oveisi G.L. De Gregorio R. Buonsanti A. Zuttel ACS Catal. 8 2018 6571 6581 W. Luo, W. Xie, R. Mutschler, E. Oveisi, G.L. De Gregorio, R. Buonsanti, A. Zuttel, ACS Catal. 8 (2018) 6571–6581. [159] H. Li T.-W. Jiang X. Qin J. Chen X.-Y. Ma K. Jiang X.-G. Zhang W.-B. Cai ACS Catal. 11 2021 6846 6856 H. Li, T.-W. Jiang, X. Qin, J. Chen, X.-Y. Ma, K. Jiang, X.-G. Zhang, W.-B. Cai, ACS Catal. 11 (2021) 6846–6856. [160] G. Liu M. Lee S. Kwon G. Zeng J. Eichhorn A.K. Buckley F.D. Toste W.A. Goddard III F.M. Toma Proc. Natl. Acad. Sci. U. S. A. 118 2021 e2012649118 G. Liu, M. Lee, S. Kwon, G. Zeng, J. Eichhorn, A.K. Buckley, F.D. Toste, W.A. Goddard, III, F.M. Toma, Proc. Natl. Acad. Sci. U. S. A. 118 (2021) e2012649118. [161] Y. Yao Y. Zhou X. Liu Y. Li D. Wang Xy Chi X. Wang R. Zhao H. Zhang Y. Sun Z. Yang Y. Wei Y. Yan J. Mater. Chem. A 10 2022 20914 20923 Y. Yao, Y. Zhou, X. Liu, Y. Li, D. Wang, Xy Chi, X. Wang, R. Zhao, H. Zhang, Y. Sun, Z. Yang, Y. Wei, Y. Yan, J. Mater. Chem. A 10 (2022) 20914–20923. [162] X. Ma Y. Zhang T. Fan D. Wei Z. Huang Z. Zhang Z. Zhang Y. Dong Q. Hong Z. Chen X. Yi Adv. Funct. Mater. 33 2023 2213145 X. Ma, Y. Zhang, T. Fan, D. Wei, Z. Huang, Z. Zhang, Z. Zhang, Y. Dong, Q. Hong, Z. Chen, X. Yi, Adv. Funct. Mater. 33 (2023) 2213145. [163] P. Li J. Bi J. Liu Q. Zhu C. Chen X. Sun J. Zhang B. Han Nat. Commun. 13 2022 1965 P. Li, J. Bi, J. Liu, Q. Zhu, C. Chen, X. Sun, J. Zhang, B. Han, Nat. Commun. 13 (2022) 1965. [164] C.-C. Chang M.-S. Ku W.-H. Lien S.-F. Hung J. Phys. Chem. C. 126 2022 5502 5512 C.-C. Chang, M.-S. Ku, W.-H. Lien, S.-F. Hung, J. Phys. Chem. C 126 (2022) 5502–5512. [165] R. Du T. Li Q. Wu P. Wang X. Yang Y. Fan Y. Qiu K. Yan P. Wang Y. Zhao W.-W. Zhao G. Chen ACS Appl. Mater. Interfaces 14 2022 36527 36535 R. Du, T. Li, Q. Wu, P. Wang, X. Yang, Y. Fan, Y. Qiu, K. Yan, P. Wang, Y. Zhao, W.-W. Zhao, G. Chen, ACS Appl. Mater. Interfaces 14 (2022) 36527–36535. [166] Q. Wu R. Du P. Wang G.I.N. Waterhouse J. Li Y. Qiu K. Yan Y. Zhao W.-W. Zhao H.-J. Tsai M.-C. Chen S.-F. Hung X. Wang G. Chen ACS Nano 17 2023 12884 12894 Q. Wu, R. Du, P. Wang, G.I.N. Waterhouse, J. Li, Y. Qiu, K. Yan, Y. Zhao, W.-W. Zhao, H.-J. Tsai, M.-C. Chen, S.-F. Hung, X. Wang, G. Chen, ACS Nano 17 (2023) 12884–12894. [167] R. Zhang F. Chen H. Jin Y. Zhang X. Hao Y. Liu T. Feng X. Zhang Z. Lu W. Wang F. Lu H. Dong H. Liu Y. Cheng Chem. Eng. J. 461 2023 142052 R. Zhang, F. Chen, H. Jin, Y. Zhang, X. Hao, Y. Liu, T. Feng, X. Zhang, Z. Lu, W. Wang, F. Lu, H. Dong, H. Liu, Y. Cheng, Chem. Eng. J. 461 (2023) 142052. [168] Q. Lei H. Zhu K. Song N. Wei L. Liu D. Zhang J. Yin X. Dong K. Yao N. Wang X. Li B. Davaasuren J. Wang Y. Han J. Am. Chem. Soc. 142 2020 4213 4222 Q. Lei, H. Zhu, K. Song, N. Wei, L. Liu, D. Zhang, J. Yin, X. Dong, K. Yao, N. Wang, X. Li, B. Davaasuren, J. Wang, Y. Han, J. Am. Chem. Soc. 142 (2020) 4213–4222. [169] W.-Y. Zhi Y.-T. Liu S.-L. Shan C.-J. Jiang H. Wang J.-X. Lu J. CO2 Util. 50 2021 101594 W.-Y. Zhi, Y.-T. Liu, S.-L. Shan, C.-J. Jiang, H. Wang, J.-X. Lu, J. CO2 Util. 50 (2021) 101594. [170] C. Liu M. Wang J. Ye L. Liu L. Li Y. Li X. Huang Nano Lett. 23 2023 1474 1480 C. Liu, M. Wang, J. Ye, L. Liu, L. Li, Y. Li, X. Huang, Nano Lett. 23 (2023) 1474–1480. [171] Y. Zang T. Liu P. Wei H. Li Q. Wang G. Wang X. Bao Angew. Chem. -Int. Ed. 61 2022 e202209629 Y. Zang, T. Liu, P. Wei, H. Li, Q. Wang, G. Wang, X. Bao, Angew. Chem.-Int. Edit. 61 (2022) e202209629. [172] C. Ren W. Ni H. Li Catalysts 13 2023 644 C. Ren, W. Ni, H. Li, Catalysts 13 (2023) 644. [173] X. Mao R. Guo Q. Chen H. Zhu H. Li Z. Yan Z. Guo T. Wu Molecules 28 2023 3292 X. Mao, R. Guo, Q. Chen, H. Zhu, H. Li, Z. Yan, Z. Guo, T. Wu, Molecules 28 (2023) 3292. [174] Q. Wang Y. Zhang H. Lin J. Zhu Chem. -Eur. J. 25 2019 14026 14035 Q. Wang, Y. Zhang, H. Lin, J. Zhu, Chem.-Eur. J. 25 (2019) 14026–14035. [175] X. Huang Y.-B. Zhang Coord. Chem. Rev. 2021 213564 X. Huang, Y.-B. Zhang, Coord. Chem. Rev. 427 (2021) 213564. [176] N. Zhang R. Long C. Gao Y. Xiong Sci. China-Mater. 61 2018 771 805 N. Zhang, R. Long, C. Gao, Y. Xiong, Sci. China-Mater. 61 (2018) 771–805. [177] Q. Wang Y. Zhang Y. Liu K. Wang W. Qiu L. Chen W. Li J. Li J. Electroanal. Chem. 912 2022 116252 Q. Wang, Y. Zhang, Y. Liu, K. Wang, W. Qiu, L. Chen, W. Li, J. Li, J. Electroanal. Chem. 912 (2022) 116252. [178] M.T. Galante P.V.B. Santiago V.Y. Yukuhiro L.A. Silva N.A. Dos Reis C.T.G.V.M.T. Pires N.G. Macedo L.S. Costa P.S. Fernandez C. Longo ChemCatChem 13 2021 859 863 M.T. Galante, P.V.B. Santiago, V.Y. Yukuhiro, L.A. Silva, N.A. Dos Reis, C.T.G.V.M.T. Pires, N.G. Macedo, L.S. Costa, P.S. Fernandez, C. Longo, ChemCatChem 13 (2021) 859–863. [179] K. Lee S. Lee H. Cho S. Jeong W.D. Kim S. Lee D.C. Lee J. Energy Chem. 27 2018 264 270 K. Lee, S. Lee, H. Cho, S. Jeong, W.D. Kim, S. Lee, D.C. Lee, J. Energy Chem. 27 (2018) 264–270. [180] M.B. Akbar Y. Gong Y. Wang A.R. Woldu X. Zhang T. He Nanotechnology 32 2021 395707 M.B. Akbar, Y. Gong, Y. Wang, A.R. Woldu, X. Zhang, T. He, Nanotechnology 32 (2021) 395707. [181] M.B. Akbar Y. Wang X. Zhang T. He J. Photochem. Photobiol. A-Chem. 437 2023 114483 M.B. Akbar, Y. Wang, X. Zhang, T. He, J. Photochem. Photobiol. A-Chem. 437 (2023) 114483. [182] M. Zoli D. Roldan H. Guzman M. Castellino A. Chiodoni K. Bejtka N. Russo S. Hernandez Catal. Today 413 2023 113985 M. Zoli, D. Roldan, H. Guzman, M. Castellino, A. Chiodoni, K. Bejtka, N. Russo, S. Hernandez, Catal. Today 413 (2023) 113985. [183] Z. Otgonbayar C.M. Yoon W.C. Oh Chem. Eng. J. 464 2023 142716 Z. Otgonbayar, C.M. Yoon, W.C. Oh, Chem. Eng. J. 464 (2023) 142716. [184] X. Guo C. Wang Z. Yang Y. Yang Chem. Eng. J. 471 2023 144539 X. Guo, C. Wang, Z. Yang, Y. Yang, Chem. Eng. J. 471 (2023) 144539. [185] Y. Jia Z. Tian J. Gao J. Mater. Chem. A 11 2023 11411 11425 Y. Jia, Z. Tian, J. Gao, J. Mater. Chem. A 11 (2023) 11411–11425. [186] Y. Jiang X. Wang D. Duan C. He J. Ma W. Zhang H. Liu R. Long Z. Li T. Kong X.J. Loh L. Song E. Ye Y. Xiong Adv. Sci. 9 2022 2105292 Y. Jiang, X. Wang, D. Duan, C. He, J. Ma, W. Zhang, H. Liu, R. Long, Z. Li, T. Kong, X.J. Loh, L. Song, E. Ye, Y. Xiong, Adv. Sci. 9 (2022) 2105292. [187] B. Qiao A. Wang X. Yang L.F. Allard Z. Jiang Y. Cui J. Liu J. Li T. Zhang Nat. Chem. 3 2011 634 641 B. Qiao, A. Wang, X. Yang, L.F. Allard, Z. Jiang, Y. Cui, J. Liu, J. Li, T. Zhang, Nat. Chem. 3 (2011) 634–641. [188] X.-F. Yang A. Wang B. Qiao J. Li J. Liu T. Zhang Acc. Chem. Res 46 2013 1740 1748 X.-F. Yang, A. Wang, B. Qiao, J. Li, J. Liu, T. Zhang, Accounts Chem. Res. 46 (2013) 1740–1748. [189] J. Liu ACS Catal. 7 2017 34 59 J. Liu, ACS Catal. 7 (2017) 34–59. [190] W. Zhang P. He C. Wang T. Ding T. Chen X. Liu L. Cao T. Huang X. Shen O.A. Usoltsev A.L. Bugaev Y. Lin T. Yao J. Mater. Chem. A 8 2020 25970 25977 W. Zhang, P. He, C. Wang, T. Ding, T. Chen, X. Liu, L. Cao, T. Huang, X. Shen, O.A. Usoltsev, A.L. Bugaev, Y. Lin, T. Yao, J. Mater. Chem. A 8 (2020) 25970–25977. [191] J. Feng L. Wu S. Liu L. Xu X. Song L. Zhang Q. Zhu X. Kang X. Sun B. Han J. Am. Chem. Soc. 145 2023 9857 9866 J. Feng, L. Wu, S. Liu, L. Xu, X. Song, L. Zhang, Q. Zhu, X. Kang, X. Sun, B. Han, J. Am. Chem. Soc. 145 (2023) 9857–9866. [192] T. Le T. Salavati-fard B. Wang ACS Catal. 13 2023 6328 6337 T. Le, T. Salavati-fard, B. Wang, ACS Catal. 13 (2023) 6328–6337. [193] L. Zhang R. Si H. Liu N. Chen Q. Wang K. Adair Z. Wang J. Chen Z. Song J. Li M.N. Banis R. Li T.-K. Sham M. Gu L.-M. Liu G.A. Botton X. Sun Nat. Commun. 10 2019 5453 L. Zhang, R. Si, H. Liu, N. Chen, Q. Wang, K. Adair, Z. Wang, J. Chen, Z. Song, J. Li, M.N. Banis, R. Li, T.-K. Sham, M. Gu, L.-M. Liu, G.A. Botton, X. Sun, Nat. Commun. 10 (2019) 5453. [194] S. Tian B. Wang W. Gong Z. He Q. Xu W. Chen Q. Zhang Y. Zhu J. Yang Q. Fu C. Chen Y. Bu L. Gu X. Sun H. Zhao D. Wang Y. Li Nat. Commun. 12 2021 3138 S. Tian, B. Wang, W. Gong, Z. He, Q. Xu, W. Chen, Q. Zhang, Y. Zhu, J. Yang, Q. Fu, C. Chen, Y. Bu, L. Gu, X. Sun, H. Zhao, D. Wang, Y. Li, Nat. Commun. 12 (2021) 3138. [195] J. Fu J. Dong R. Si K. Sun J. Zhang M. Li N. Yu B. Zhang M.G. Humphrey Q. Fu J. Huang ACS Catal. 11 2021 1952 1961 J. Fu, J. Dong, R. Si, K. Sun, J. Zhang, M. Li, N. Yu, B. Zhang, M.G. Humphrey, Q. Fu, J. Huang, ACS Catal. 11 (2021) 1952–1961. [196] Y. Ma H. Fan C. Wu M. Zhang J. Yu L. Song K. Li J. He Carbon 185 2021 526 535 Y. Ma, H. Fan, C. Wu, M. Zhang, J. Yu, L. Song, K. Li, J. He, Carbon 185 (2021) 526–535. [197] H. Li L. Wang Y. Dai Z. Pu Z. Lao Y. Chen M. Wang X. Zheng J. Zhu W. Zhang R. Si C. Ma J. Zeng Nat. Nanotechnol. 13 2018 411 417 H. Li, L. Wang, Y. Dai, Z. Pu, Z. Lao, Y. Chen, M. Wang, X. Zheng, J. Zhu, W. Zhang, R. Si, C. Ma, J. Zeng, Nat. Nanotechnol. 13 (2018) 411–417. [198] J. Jiao R. Lin S. Liu W.-C. Cheong C. Zhang Z. Chen Y. Pan J. Tang K. Wu S.-F. Hung H.M. Chen L. Zheng Q. Lu X. Yang B. Xu H. Xiao J. Li D. Wang Q. Peng C. Chen Y. Li Nat. Chem. 11 2019 222 228 J. Jiao, R. Lin, S. Liu, W.-C. Cheong, C. Zhang, Z. Chen, Y. Pan, J. Tang, K. Wu, S.-F. Hung, H.M. Chen, L. Zheng, Q. Lu, X. Yang, B. Xu, H. Xiao, J. Li, D. Wang, Q. Peng, C. Chen, Y. Li, Nat. Chem. 11 (2019) 222–228. [199] W. Ni Z. Liu X. Guo Y. Zhang C. Ma Y. Deng S. Zhang Appl. Catal. B-Environ. 291 2021 120092 W. Ni, Z. Liu, X. Guo, Y. Zhang, C. Ma, Y. Deng, S. Zhang, Appl. Catal. B-Environ. 291 (2021) 120092. [200] Y. Wang B.J. Park V.K. Paidi R. Huang Y. Lee K.-J. Noh K.-S. Lee J.W. Han ACS Energy Lett. 7 2022 640 649 Y. Wang, B.J. Park, V.K. Paidi, R. Huang, Y. Lee, K.-J. Noh, K.-S. Lee, J.W. Han, ACS Energy Lett. 7 (2022) 640–649. [201] X. Zhao K. Zhao Y. Liu Y. Su S. Chen H. Yu X. Quan ACS Catal. 12 2022 11412 11420 X. Zhao, K. Zhao, Y. Liu, Y. Su, S. Chen, H. Yu, X. Quan, ACS Catal. 12 (2022) 11412–11420. [202] X.-M. Liang H.-J. Wang C. Zhang D.-C. Zhong T.B. Lu Appl. Catal. B-Environ. 322 2023 122073 X.-M. Liang, H.-J. Wang, C. Zhang, D.-C. Zhong, T.B. Lu, Appl. Catal. B-Environ. 322 (2023) 122073. [203] H. Cheng X. Wu M. Feng X. Li G. Lei Z. Fan D. Pan F. Cui G. He ACS Catal. 11 2021 12673 12681 H. Cheng, X. Wu, M. Feng, X. Li, G. Lei, Z. Fan, D. Pan, F. Cui, G. He, ACS Catal. 11 (2021) 12673–12681. [204] S. Li A. Guan C. Yang C. Peng X. Lv Y. Ji Y. Quan Q. Wang L. Zhang G. Zheng ACS Mater. Lett. 3 2021 1729 1737 S. Li, A. Guan, C. Yang, C. Peng, X. Lv, Y. Ji, Y. Quan, Q. Wang, L. Zhang, G. Zheng, ACS Mater. Lett. 3 (2021) 1729–1737. [205] C. Hu Y. Wang J. Chen H.-F. Wang K. Shen K. Tang L. Chen Y. Li Small 18 2022 2201391 C. Hu, Y. Wang, J. Chen, H.-F. Wang, K. Shen, K. Tang, L. Chen, Y. Li, Small 18 (2022) 2201391. [206] M. Wu Q. Ruan H. Jiang L. Zhang D. Wang J. Zou J. Mater. Chem. A 10 2022 25463 25470 M. Wu, Q. Ruan, H. Jiang, L. Zhang, D. Wang, J. Zou, J. Mater. Chem. A 10 (2022) 25463–25470. [207] W. Liu H. Li P. Ou J. Mao L. Han J. Song J. Luo H.L. Xin Nano Res. 2023 10.1007/s12274-023-5513-5 W. Liu, H. Li, P. Ou, J. Mao, L. Han, J. Song, J. Luo, H.L. Xin, Nano Res. (2023). https://doi.org/10.1007/s12274–023-5513–5. [208] Z.W. Chen L.X. Chen C.C. Yang Q. Jiang J. Mater. Chem. A 7 2019 3492 3515 Z.W. Chen, L.X. Chen, C.C. Yang, Q. Jiang, J. Mater. Chem. A 7 (2019) 3492–3515. [209] W. Zha D. Liu Z. Ma Y. Wang Y. Wei X. Ma L. Wang Q. Zhang B. Lou R. Yuan X. Fu R. Sa Appl. Surf. Sci. 564 2021 150331 W. Zha, D. Liu, Z. Ma, Y. Wang, Y. Wei, X. Ma, L. Wang, Q. Zhang, B. Lou, R. Yuan, X. Fu, R. Sa, Appl. Surf. Sci. 564 (2021) 150331. [210] S. Zhou S. Cao S. Wei Z. Wang H. Chen X. Lin X. Chen S. Liu X. Lu Appl. Mater. Today 25 2021 101245 S. Zhou, S. Cao, S. Wei, Z. Wang, H. Chen, X. Lin, X. Chen, S. Liu, X. Lu, Appl. Mater. Today 25 (2021) 101245. [211] B. Han H. Meng F. Li Acs. Omega 7 2022 16080 16086 B. Han, H. Meng, F. Li, Acs. Omega 7 (2022) 16080–16086. [212] N. Cheng S. Stambula D. Wang M.N. Banis J. Liu A. Riese B. Xiao R. Li T.-K. Sham L.-M. Liu G.A. Botton X. Sun Nat. Commun. 7 2016 13638 N. Cheng, S. Stambula, D. Wang, M.N. Banis, J. Liu, A. Riese, B. Xiao, R. Li, T.-K. Sham, L.-M. Liu, G.A. Botton, X. Sun, Nat. Commun. 7 (2016) 13638. [213] L. Liu A. Corma Chem. Rev. 118 2018 4981 5079 L. Liu, A. Corma, Chem. Rev. 118 (2018) 4981–5079. [214] C. Liu B. Yang E. Tyo S. Seifert J. DeBartolo B. von Issendorff P. Zapol S. Vajda L.A. Curtiss J. Am. Chem. Soc. 137 2015 8676 8679 C. Liu, B. Yang, E. Tyo, S. Seifert, J. DeBartolo, B. von Issendorff, P. Zapol, S. Vajda, L.A. Curtiss, J. Am. Chem. Soc. 137 (2015) 8676–8679. [215] D.R. Kauffman D. Alfonso C. Matranga H. Qian R. Jin J. Am. Chem. Soc. 134 2012 10237 10243 D.R. Kauffman, D. Alfonso, C. Matranga, H. Qian, R. Jin, J. Am. Chem. Soc. 134 (2012) 10237–10243. [216] X. Wang J. Pan H. Wei W. Li J. Zhao Z. Hu J. Phys. Chem. C. 126 2022 1761 1769 X. Wang, J. Pan, H. Wei, W. Li, J. Zhao, Z. Hu, J. Phys. Chem. C 126 (2022) 1761–1769. [217] A. Cadi-Essadek A. Roldan X. Aparicio-Angles N.H. de Leeuw J. Phys. Chem. C. 122 2018 19463 19472 A. Cadi-Essadek, A. Roldan, X. Aparicio-Angles, N.H. de Leeuw, J. Phys. Chem. C 122 (2018) 19463–19472. [218] M.-C. Silaghi A. Comas-Vives C. Coperet ACS Catal. 6 2016 4501 4505 M.-C. Silaghi, A. Comas-Vives, C. Coperet, ACS Catal. 6 (2016) 4501–4505. [219] M. Peng C. Dong R. Gao D. Xiao H. Liu D. Ma ACS Cent. Sci. 7 2021 262 273 M. Peng, C. Dong, R. Gao, D. Xiao, H. Liu, D. Ma, ACS Central Sci. 7 (2021) 262–273. [220] X. Chen M. Peng D. Xiao H. Liu D. Ma ACS Catal. 12 2022 12720 12743 X. Chen, M. Peng, D. Xiao, H. Liu, D. Ma, ACS Catal. 12 (2022) 12720–12743. [221] Y.-Q. Liu Z.-Y. Qiu X. Zhao W.-W. Wang J.-S. Dang J. Mater. Chem. A 9 2021 25922 25926 Y.-Q. Liu, Z.-Y. Qiu, X. Zhao, W.-W. Wang, J.-S. Dang, J. Mater. Chem. A 9 (2021) 25922–25926. [222] Q. Hao Q. Tang H.-X. Zhong J.-Z. Wang D.-X. Liu X.-B. Zhang Sci. Bull. 67 2022 1477 1485 Q. Hao, Q. Tang, H.-X. Zhong, J.-Z. Wang, D.-X. Liu, X.-B. Zhang, Sci. Bull. 67 (2022) 1477–1485. [223] C. Dong Z. Gao Y. Li M. Peng M. Wang Y. Xu C. Li M. Xu Y. Deng X. Qin F. Huang X. Wei Y.-G. Wang H. Liu W. Zhou D. Ma Nat. Catal. 5 2022 485 493 C. Dong, Z. Gao, Y. Li, M. Peng, M. Wang, Y. Xu, C. Li, M. Xu, Y. Deng, X. Qin, F. Huang, X. Wei, Y.-G. Wang, H. Liu, W. Zhou, D. Ma, Nat. Catal. 5 (2022) 485–493. [224] Y. Zhao L. Yang S. Chen X. Wang Y. Ma Q. Wu Y. Jiang W. Qian Z. Hu J. Am. Chem. Soc. 135 2013 1201 1204 Y. Zhao, L. Yang, S. Chen, X. Wang, Y. Ma, Q. Wu, Y. Jiang, W. Qian, Z. Hu, J. Am. Chem. Soc. 135 (2013) 1201–1204. [225] M. Fan Z. Lin P. Zhang X. Ma K. Wu M. Liu X. Xiong Adv. Energy Mater. 11 2021 2003037 M. Fan, Z. Lin, P. Zhang, X. Ma, K. Wu, M. Liu, X. Xiong, Adv. Energy Mater. 11 (2021) 2003037. [226] K. Gao B. Wang L. Tao B.V. Cunning Z. Zhang S. Wang R.S. Ruoff L. Qu Adv. Mater. 31 2019 1805121 K. Gao, B. Wang, L. Tao, B.V. Cunning, Z. Zhang, S. Wang, R.S. Ruoff, L. Qu, Adv. Mater. 31 (2019) 1805121. [227] K. Xu Y. Sun Y. Sun Y. Zhang G. Jia Q. Zhang L. Gu S. Li Y. Li H.J. Fan ACS Energy Lett. 3 2018 2750 2756 K. Xu, Y. Sun, Y. Sun, Y. Zhang, G. Jia, Q. Zhang, L. Gu, S. Li, Y. Li, H.J. Fan, ACS Energy Lett. 3 (2018) 2750–2756. [228] J. Chen J. Chen H. Cui C. Wang ACS Appl. Mater. Interfaces 11 2019 34819 34826 J. Chen, J. Chen, H. Cui, C. Wang, ACS Appl. Mater. Interfaces 11 (2019) 34819–34826. [229] G. Li Y. Qin Y. Wu L. Pei Q. Hu H. Yang Q. Zhang J. Liu C. He Chin. J. Catal. 41 2020 830 838 G. Li, Y. Qin, Y. Wu, L. Pei, Q. Hu, H. Yang, Q. Zhang, J. Liu, C. He, Chin. J. Catal. 41 (2020) 830–838. [230] X. Liang N. Tian Z. Zhou S. Sun ACS Sustain. Chem. Eng. 10 2022 1880 1887 X. Liang, N. Tian, Z. Zhou, S. Sun, ACS Sustain. Chem. Eng. 10 (2022) 1880–1887. [231] H. Wang G. Ren Y. Zhao L. Sun J. Sun L. Yang T. Yu W. Deng L. Sun J. Mater. Chem. A 10 2022 4703 4710 H. Wang, G. Ren, Y. Zhao, L. Sun, J. Sun, L. Yang, T. Yu, W. Deng, L. Sun, J. Mater. Chem. A 10 (2022) 4703–4710. [232] C. Jia X. Kan X. Zhang G. Lin W. Liu Z. Wang S. Zhu D. Ju J. Liu Chem. Eng. J. 427 2022 131554 C. Jia, X. Kan, X. Zhang, G. Lin, W. Liu, Z. Wang, S. Zhu, D. Ju, J. Liu, Chem. Eng. J. 427 (2022) 131554. [233] L. Liu N. Vankova T. Heine Phys. Chem. Chem. Phys. 18 2016 3567 3574 L. Liu, N. Vankova, T. Heine, Phys. Chem. Chem. Phys. 18 (2016) 3567–3574. [234] L. Liu B. Lukose B. Ensing ACS Catal. 8 2018 3376 3381 L. Liu, B. Lukose, B. Ensing, ACS Catal. 8 (2018) 3376–3381. [235] G.C. Welch R.R.S. Juan J.D. Masuda D.W. Stephan Science 314 2006 1124 1126 G.C. Welch, R.R.S. Juan, J.D. Masuda, D.W. Stephan, Science 314 (2006) 1124–1126. [236] D.W. Stephan J. Am. Chem. Soc. 143 2021 20002 20014 D.W. Stephan, J. Am. Chem. Soc. 143 (2021) 20002–20014. [237] G.Y. Shinde A.S. Mote M.B. Gawande Catalysts 12 2022 〈https://doi.org/10.3390/catal12010094〉 G.Y. Shinde, A.S. Mote, M.B. Gawande, Catalysts 12 (2022). https://doi.org/10.3390/catal12010094 [238] M. Ghoussoub S. Yadav K.K. Ghuman G.A. Ozin C.V. Singh ACS Catal. 6 2016 7109 7117 M. Ghoussoub, S. Yadav, K.K. Ghuman, G.A. Ozin, C.V. Singh, ACS Catal. 6 (2016) 7109–7117. [239] X. Wang L. Lu B. Wang Z. Xu Z. Xin S. Yan Z. Geng Z. Zou Adv. Funct. Mater. 28 2018 1804191 X. Wang, L. Lu, B. Wang, Z. Xu, Z. Xin, S. Yan, Z. Geng, Z. Zou, Adv. Funct. Mater. 28 (2018) 1804191. [240] W. Zhang Z. Yang H. Wang L. Lu D. Liu T. Li S. Yan H. Qin T. Yu Z. Zou Appl. Catal. B-Environ. 300 2022 120748 W. Zhang, Z. Yang, H. Wang, L. Lu, D. Liu, T. Li, S. Yan, H. Qin, T. Yu, Z. Zou, Appl. Catal. B-Environ. 300 (2022) 120748. [241] S. Zhang Z. Xia Y. Zou F. Cao Y. Liu Y. Ma Y. Qu J. Am. Chem. Soc. 141 2019 11353 11357 S. Zhang, Z. Xia, Y. Zou, F. Cao, Y. Liu, Y. Ma, Y. Qu, J. Am. Chem. Soc. 141 (2019) 11353–11357. [242] T. Ban X.-Y. Yu H.-Z. Kang H.-X. Zhang X. Gao Z.-Q. Huang C.-R. Chang J. Catal. 408 2022 206 215 T. Ban, X.-Y. Yu, H.-Z. Kang, H.-X. Zhang, X. Gao, Z.-Q. Huang, C.-R. Chang, J. Catal. 408 (2022) 206–215. [243] Y. Xie J. Chen X. Wu J. Wen R. Zhao Z. Li G. Tian Q. Zhang P. Ning J. Hao ACS Catal. 12 2022 10587 10602 Y. Xie, J. Chen, X. Wu, J. Wen, R. Zhao, Z. Li, G. Tian, Q. Zhang, P. Ning, J. Hao, ACS Catal. 12 (2022) 10587–10602. [244] M. Barreau D. Salusso J. Li J. Zhang E. Borfecchia K. Sobczak L. Braglia J.-J. Gallet P. Torelli H. Guo S. Lin S. Zafeiratos Angew. Chem. -Int. Ed. ( 2023 e202302087 M. Barreau, D. Salusso, J. Li, J. Zhang, E. Borfecchia, K. Sobczak, L. Braglia, J.-J. Gallet, P. Torelli, H. Guo, S. Lin, S. Zafeiratos, Angew. Chem.-Int. Edit. (2023) e202302087. [245] Y. Dong K.K. Ghuman R. Popescu P.N. Duchesne W. Zhou J.Y.Y. Loh A.A. Jelle J. Jia D. Wang X. Mu C. Kuebel L. Wang L. He M. Ghoussoub Q. Wang T.E. Wood L.M. Reyes P. Zhang N.P. Kherani C.V. Singh G.A. Ozin Adv. Sci. 5 2018 1700732 Y. Dong, K.K. Ghuman, R. Popescu, P.N. Duchesne, W. Zhou, J.Y.Y. Loh, A.A. Jelle, J. Jia, D. Wang, X. Mu, C. Kuebel, L. Wang, L. He, M. Ghoussoub, Q. Wang, T.E. Wood, L.M. Reyes, P. Zhang, N.P. Kherani, C.V. Singh, G.A. Ozin, Adv. Sci. 5 (2018) 1700732. [246] T. Yan N. Li L. Wang W. Ran P.N. Duchesne L. Wan N. Nhat Truong L. Wang M. Xia G.A. Ozin Nat. Commun. 11 2020 6095 T. Yan, N. Li, L. Wang, W. Ran, P.N. Duchesne, L. Wan, N. Nhat Truong, L. Wang, M. Xia, G.A. Ozin, Nat. Commun. 11 (2020) 6095. [247] L. Wan Q. Zhou X. Wang T.E. Wood L. Wang P.N. Duchesne J. Guo X. Yan M. Xia Y.F. Lie A.A. Jelle U. Ulmer J. Jia T. Li W. Sun G.A. Ozin Nat. Catal. 2 2019 889 898 L. Wan, Q. Zhou, X. Wang, T.E. Wood, L. Wang, P.N. Duchesne, J. Guo, X. Yan, M. Xia, Y.F. Lie, A.A. Jelle, U. Ulmer, J. Jia, T. Li, W. Sun, G.A. Ozin, Nat. Catal. 2 (2019) 889–898. [248] S. Jin W. Shao S. Chen L. Li S. Shang Y. Zhao X. Zhang Y. Xie Angew. Chem. -Int. Ed. 61 2022 e202113411 S. Jin, W. Shao, S. Chen, L. Li, S. Shang, Y. Zhao, X. Zhang, Y. Xie, Angew. Chem.-Int. Edit. 61 (2022) e202113411. [249] Y. Zhu X. Cui H. Liu Z. Guo Y. Dang Z. Fan Z. Zhang W. Hu Nano Res. 14 2021 4471 4486 Y. Zhu, X. Cui, H. Liu, Z. Guo, Y. Dang, Z. Fan, Z. Zhang, W. Hu, Nano Res. 14 (2021) 4471–4486. [250] B. Cao F.-Z. Li J. Gu ACS Catal. 12 2022 9735 9752 B. Cao, F.-Z. Li, J. Gu, ACS Catal. 12 (2022) 9735–9752. [251] J. Fan L. Cheng J. Fan Q. Wang M. Gao D. Li J. Feng J. CO2 Util. 67 2023 102333 J. Fan, L. Cheng, J. Fan, Q. Wang, M. Gao, D. Li, J. Feng, J. CO2 Util. 67 (2023) 102333. [252] Z. Li Y. Qu J. Wang H. Liu M. Li S. Miao C. Li Joule 3 2019 570 583 Z. Li, Y. Qu, J. Wang, H. Liu, M. Li, S. Miao, C. Li, Joule 3 (2019) 570–583. [253] T. Zhang P. Zheng F. Gu W. Xu W. Chen T. Zhu Y.-F. Han G. Xu Z. Zhong F. Su Appl. Catal. B-Environ. 323 2023 122190 T. Zhang, P. Zheng, F. Gu, W. Xu, W. Chen, T. Zhu, Y.-F. Han, G. Xu, Z. Zhong, F. Su, Appl. Catal. B-Environ. 323 (2023) 122190. [254] T. Zhang J.C. Bui Z. Li A.T. Bell A.Z. Weber J. Wu Nat. Catal. 5 2022 202 211 T. Zhang, J.C. Bui, Z. Li, A.T. Bell, A.Z. Weber, J. Wu, Nat. Catal. 5 (2022) 202–211. [255] C. Chen Y. Li S. Yu S. Louisia J. Jin M. Li M.B. Ross P. Yang Joule 4 2020 1688 1699 C. Chen, Y. Li, S. Yu, S. Louisia, J. Jin, M. Li, M.B. Ross, P. Yang, Joule 4 (2020) 1688–1699. [256] N. Marti C. Reller C. Macauley M. Loffler A.M. Reichert T. Reichbauer K.-M. Vetter B. Schmid D. McLaughlin P. Leidinger D. Reinisch C. Vogl K.J.J. Mayrhofer I. Katsounaros G. Schmid Energy Environ. Sci. 13 2020 2993 3006 N. Marti, C. Reller, C. Macauley, M. Loffler, A.M. Reichert, T. Reichbauer, K.-M. Vetter, B. Schmid, D. McLaughlin, P. Leidinger, D. Reinisch, C. Vogl, K.J.J. Mayrhofer, I. Katsounaros, G. Schmid, Energy Environ. Sci. 13 (2020) 2993–3006. [257] P. Iyengar M.J. Kolb J.R. Pankhurst F. Calle-Vallejo R. Buonsanti ACS Catal. 11 2021 4456 4463 P. Iyengar, M.J. Kolb, J.R. Pankhurst, F. Calle-Vallejo, R. Buonsanti, ACS Catal. 11 (2021) 4456–4463. [258] S. Zhang S. Zhao D. Qu X. Liu Y. Wu Y. Chen W. Huang Small 17 2021 2102293 S. Zhang, S. Zhao, D. Qu, X. Liu, Y. Wu, Y. Chen, W. Huang, Small 17 (2021) 2102293. [259] Y. Zheng J. Zhang Z. Ma G. Zhang H. Zhang X. Fu Y. Ma F. Liu M. Liu H. Huang Small 18 2022 2201695 Y. Zheng, J. Zhang, Z. Ma, G. Zhang, H. Zhang, X. Fu, Y. Ma, F. Liu, M. Liu, H. Huang, Small 18 (2022) 2201695. [260] Y. Zhang P. Li C. Zhao G. Zhou F. Zhou Q. Zhang C. Su Y. Wu Sci. Bull. 67 2022 1679 1687 Y. Zhang, P. Li, C. Zhao, G. Zhou, F. Zhou, Q. Zhang, C. Su, Y. Wu, Sci. Bull. 67 (2022) 1679–1687. [261] M. Ye T. Shao J. Liu C. Li B. Song S. Liu Appl. Surf. Sci. 622 2023 156981 M. Ye, T. Shao, J. Liu, C. Li, B. Song, S. Liu, Appl. Surf. Sci. 622 (2023) 156981. [262] D. Niu C. Wei Z. Lu Y. Fang B. Liu D. Sun X. Hao H. Pan G. Wang Molecules 26 2021 2175 D. Niu, C. Wei, Z. Lu, Y. Fang, B. Liu, D. Sun, X. Hao, H. Pan, G. Wang, Molecules 26 (2021) 2175. [263] R. Yang J. Duan P. Dong Q. Wen M. Wu Y. Liu Y. Liu H. Li T. Zhai Angew. Chem. -Int. Ed. 61 2022 e202116706 R. Yang, J. Duan, P. Dong, Q. Wen, M. Wu, Y. Liu, Y. Liu, H. Li, T. Zhai, Angew. Chem.-Int. Edit. 61 (2022) e202116706. [264] W. Xiong D. Si J. Yi Y. Huang H. Li R. Cao Appl. Catal. B-Environ. 314 2022 121498 W. Xiong, D. Si, J. Yi, Y. Huang, H. Li, R. Cao, Appl. Catal. B-Environ. 314 (2022) 121498. [265] Q. Chen T. Wang B. Wang X. Yang F. Li Y. Wang J. Mater. Sci. -Mater. Electron. 30 2019 15989 15999 Q. Chen, T. Wang, B. Wang, X. Yang, F. Li, Y. Wang, J. Mater. Sci.-Mater. Electron. 30 (2019) 15989–15999. [266] J. Duan P. Sun H. Zhao Z. Ji D. Zhang W. Wang Opt. Mater. 115 2021 111016 J. Duan, P. Sun, H. Zhao, Z. Ji, D. Zhang, W. Wang, Opt. Mater. 115 (2021) 111016. [267] P. Li J. Xu H. Jing C. Wu H. Peng J. Lu H. Yin Appl. Catal. B-Environ. 156 2014 134 140 P. Li, J. Xu, H. Jing, C. Wu, H. Peng, J. Lu, H. Yin, Appl. Catal. B-Environ. 156 (2014) 134–140. [268] P. Sawicka-Chudy M. Sibinski E. Rybak-Wilusz M. Cholewa G. Wisz R. Yavorskyi AIP Adv. 10 2020 010701 P. Sawicka-Chudy, M. Sibinski, E. Rybak-Wilusz, M. Cholewa, G. Wisz, R. Yavorskyi, AIP Adv. 10 (2020) 010701. [269] M.H. Razali M. Yusoff Mater. Lett. 221 2018 168 171 M.H. Razali, M. Yusoff, Mater. Lett. 221 (2018) 168–171. [270] W. Guo S. Liu X. Tan R. Wu X. Yan C. Chen Q. Zhu L. Zheng J. Ma J. Zhang Y. Huang X. Sun B. Han Angew. Chem. -Int. Ed. 60 2021 21979 21987 W. Guo, S. Liu, X. Tan, R. Wu, X. Yan, C. Chen, Q. Zhu, L. Zheng, J. Ma, J. Zhang, Y. Huang, X. Sun, B. Han, Angew. Chem.-Int. Edit. 60 (2021) 21979–21987. [271] A. Pechenkin D. Potemkin M. Rubtsova P. Snytnikov P. Plyusnin A. Glotov Catalysts 11 2021 1151 A. Pechenkin, D. Potemkin, M. Rubtsova, P. Snytnikov, P. Plyusnin, A. Glotov, Catalysts 11 (2021) 1151. [272] X. Ye Y. Jiang X. Chen B. Guo S. Mao Y. Guo C. Zhao Front. Energy Res. 10 2022 964011 X. Ye, Y. Jiang, X. Chen, B. Guo, S. Mao, Y. Guo, C. Zhao, Front. Energy Res. 10 (2022) 964011. [273] W. Liu P. Zhai A. Li B. Wei K. Si Y. Wei X. Wang G. Zhu Q. Chen X. Gu R. Zhang W. Zhou Y. Gong Nat. Commun. 13 2022 1877 W. Liu, P. Zhai, A. Li, B. Wei, K. Si, Y. Wei, X. Wang, G. Zhu, Q. Chen, X. Gu, R. Zhang, W. Zhou, Y. Gong, Nat. Commun. 13 (2022) 1877. [274] Q. Wu M. Pan S. Zhang D. Sun Y. Yang D. Chen D.A. Weitz X. Gao Energies 15 2022 6666 Q. Wu, M. Pan, S. Zhang, D. Sun, Y. Yang, D. Chen, D.A. Weitz, X. Gao, Energies 15 (2022) 6666. [275] J.K. Norskov T. Bligaard J. Rossmeisl C.H. Christensen Nat. Chem. 1 2009 37 46 J.K. Norskov, T. Bligaard, J. Rossmeisl, C.H. Christensen, Nat. Chem. 1 (2009) 37–46. [276] G.R. Schleder A.C.M. Padilha C.M. Acosta M. Costa A. Fazzio J. Phys. -Mater. 2 2019 032001 G.R. Schleder, A.C.M. Padilha, C.M. Acosta, M. Costa, A. Fazzio, J. Phys.-Mater. 2 (2019) 032001. [277] L. Wu T. Guo T. Li J. Mater. Chem. A 8 2020 19290 19299 L. Wu, T. Guo, T. Li, J. Mater. Chem. A 8 (2020) 19290–19299. [278] Y. Guo X. He Y. Su Y. Dai M. Xie S. Yang J. Chen K. Wang D. Zhou C. Wang J. Am. Chem. Soc. 143 2021 5755 5762 Y. Guo, X. He, Y. Su, Y. Dai, M. Xie, S. Yang, J. Chen, K. Wang, D. Zhou, C. Wang, J. Am. Chem. Soc. 143 (2021) 5755–5762. [279] N. Zhang B. Yang K. Liu H. Li G. Chen X. Qiu W. Li J. Hu J. Fu Y. Jiang M. Liu J. Ye Small Methods 5 2021 2100987 N. Zhang, B. Yang, K. Liu, H. Li, G. Chen, X. Qiu, W. Li, J. Hu, J. Fu, Y. Jiang, M. Liu, J. Ye, Small Methods 5 (2021) 2100987. [280] M. Zhong K. Tran Y. Min C. Wang Z. Wang C.-T. Dinh P. De Luna Z. Yu A.S. Rasouli P. Brodersen S. Sun O. Voznyy C.-S. Tan M. Askerka F. Che M. Liu A. Seifitokaldani Y. Pang S.-C. Lo A. Ip Z. Ulissi E.H. Sargent Nature 581 2020 178 183 M. Zhong, K. Tran, Y. Min, C. Wang, Z. Wang, C.-T. Dinh, P. De Luna, Z. Yu, A.S. Rasouli, P. Brodersen, S. Sun, O. Voznyy, C.-S. Tan, M. Askerka, F. Che, M. Liu, A. Seifitokaldani, Y. Pang, S.-C. Lo, A. Ip, Z. Ulissi, E.H. Sargent, Nature 581 (2020) 178–183. [281] M. Tamtaji H. Gao D. Hossain P.R. Galligan H. Wong Z. Liu H. Liu Y. Cai W.A. Goddard Z. Luo J. Mater. Chem. A 10 2022 15309 15331 M. Tamtaji, H. Gao, D. Hossain, P.R. Galligan, H. Wong, Z. Liu, H. Liu, Y. Cai, W.A. Goddard, Z. Luo, J. Mater. Chem. A 10 (2022) 15309–15331. [282] L. Zaza K. Rossi R. Buonsanti ACS Energy Lett. 7 2022 1284 1291 L. Zaza, K. Rossi, R. Buonsanti, ACS Energy Lett. 7 (2022) 1284–1291. [283] Y. Wang Y. Chen Y. Zhao J. Yu Z. Liu Y. Shi H. Liu X. Li W. Zhou Appl. Catal. B-Environ. 307 2022 120991 Y. Wang, Y. Chen, Y. Zhao, J. Yu, Z. Liu, Y. Shi, H. Liu, X. Li, W. Zhou, Appl. Catal. B-Environ. 307 (2022) 120991. [284] N.T. Nesbitt T. Burdyny H. Simonson D. Salvatore D. Bohra R. Kas W.A. Smith ACS Catal. 10 2020 14093 14106 N.T. Nesbitt, T. Burdyny, H. Simonson, D. Salvatore, D. Bohra, R. Kas, W.A. Smith, ACS Catal. 10 (2020) 14093–14106. [285] L. Li J. Chen V.S.S. Mosali Y. Liang A.M. Bond Q. Gu J. Zhang Angew. Chem. -Int. Ed. 61 2022 e202208534 L. Li, J. Chen, V.S.S. Mosali, Y. Liang, A.M. Bond, Q. Gu, J. Zhang, Angew. Chem.-Int. Edit. 61 (2022) e202208534. [286] T.N. Nguyen C.-T. Dinh Chem. Soc. Rev. 49 2020 7488 7504 T.N. Nguyen, C.-T. Dinh, Chem. Soc. Rev. 49 (2020) 7488–7504. [287] X. Wei Y. Li L. Chen J. Shi Angew. Chem. -Int. Ed. 60 2021 3148 3155 X. Wei, Y. Li, L. Chen, J. Shi, Angew. Chem.-Int. Edit. 60 (2021) 3148–3155. [288] M. Li T. Wang W. Zhao S. Wang Y. Zou Nano-Micro Lett. 14 2022 211 M. Li, T. Wang, W. Zhao, S. Wang, Y. Zou, Nano-Micro Lett. 14 (2022) 211.",
      "scopus-id": "85173875182",
      "coredata": {
        "eid": "1-s2.0-S0926860X23004258",
        "dc:description": "Carbon dioxide (CO2) reduction reaction (CO2RR) with renewable energy represents a promising way for effective utilization of the major anthropogenic greenhouse gas. Cuprous oxide (Cu2O)-based catalysts have attracted great attention in recent years due to abundant reserves, lower price, environmental friendliness, and higher activity of CO2RR. Moreover, Cu+ site in Cu2O plays an important role in improving the C2+ product selectivity. This paper reviews recent advances of photo- and electrocatalytic CO2RR on Cu2O-based catalysts in both experimental and computational studies. Firstly, the basic principle of photo- and electrocatalytic CO2RR on Cu2O-based catalysts is briefly reviewed. Secondly, various strategies have been adopted to improve CO2RR catalytic performance of Cu2O-based catalysts, mainly including morphology control, heterojunction engineering, metal deposition, and defective engineering. Finally, potential strategies to further promote CO2RR have also been suggested: including single atom catalyst, double atom catalyst, single cluster catalyst, and frustrated Lewis pairs, etc. We hope that the present comprehensive overview paves the way for future development of CO2RR on Cu2O-based catalysts.",
        "openArchiveArticle": "false",
        "prism:coverDate": "2023-10-25",
        "openaccessUserLicense": null,
        "prism:aggregationType": "Journal",
        "prism:url": "https://api.elsevier.com/content/article/pii/S0926860X23004258",
        "dc:creator": [
          {
            "@_fa": "true",
            "$": "Zhao, Zixuan"
          },
          {
            "@_fa": "true",
            "$": "Wang, Hongtao"
          },
          {
            "@_fa": "true",
            "$": "Yu, Qi"
          },
          {
            "@_fa": "true",
            "$": "Roy, Soumendra"
          },
          {
            "@_fa": "true",
            "$": "Yu, Xiaohu"
          }
        ],
        "link": [
          {
            "@_fa": "true",
            "@rel": "self",
            "@href": "https://api.elsevier.com/content/article/pii/S0926860X23004258"
          },
          {
            "@_fa": "true",
            "@rel": "scidir",
            "@href": "https://www.sciencedirect.com/science/article/pii/S0926860X23004258"
          }
        ],
        "dc:format": "application/json",
        "openaccessType": null,
        "pii": "S0926-860X(23)00425-8",
        "prism:volume": "667",
        "articleNumber": "119445",
        "prism:publisher": "Elsevier B.V.",
        "dc:title": "Photo-/electrocatalytic approaches to CO2 conversion on Cu2O-based catalysts",
        "prism:copyright": "© 2023 Elsevier B.V. All rights reserved.",
        "openaccess": "0",
        "prism:issn": "0926860X",
        "dcterms:subject": [
          {
            "@_fa": "true",
            "$": "Cu2O-Based Catalysts"
          },
          {
            "@_fa": "true",
            "$": "CO2 reduction reaction"
          },
          {
            "@_fa": "true",
            "$": "Catalyst modification"
          },
          {
            "@_fa": "true",
            "$": "C2+ product"
          },
          {
            "@_fa": "true",
            "$": "Selectivity"
          }
        ],
        "openaccessArticle": "false",
        "prism:publicationName": "Applied Catalysis A: General",
        "openaccessSponsorType": null,
        "prism:pageRange": "119445",
        "pubType": "rev",
        "prism:coverDisplayDate": "25 October 2023",
        "prism:doi": "10.1016/j.apcata.2023.119445",
        "prism:startingPage": "119445",
        "dc:identifier": "doi:10.1016/j.apcata.2023.119445",
        "openaccessSponsorName": null
      },
      "objects": {
        "object": [
          {
            "@category": "standard",
            "@height": "362",
            "@width": "565",
            "@_fa": "true",
            "$": "https://api.elsevier.com/content/object/eid/1-s2.0-S0926860X23004258-gr28.jpg?httpAccept=%2A%2F%2A",
            "@multimediatype": "JPEG image file",
            "@type": "IMAGE-DOWNSAMPLED",
            "@size": "68569",
            "@ref": "gr28",
            "@mimetype": "image/jpeg"
          },
          {
            "@category": "standard",
            "@height": "283",
            "@width": "659",
            "@_fa": "true",
            "$": "https://api.elsevier.com/content/object/eid/1-s2.0-S0926860X23004258-gr27.jpg?httpAccept=%2A%2F%2A",
            "@multimediatype": "JPEG image file",
            "@type": "IMAGE-DOWNSAMPLED",
            "@size": "58715",
            "@ref": "gr27",
            "@mimetype": "image/jpeg"
          },
          {
            "@category": "standard",
            "@height": "486",
            "@width": "659",
            "@_fa": "true",
            "$": "https://api.elsevier.com/content/object/eid/1-s2.0-S0926860X23004258-gr26.jpg?httpAccept=%2A%2F%2A",
            "@multimediatype": "JPEG image file",
            "@type": "IMAGE-DOWNSAMPLED",
            "@size": "74616",
            "@ref": "gr26",
            "@mimetype": "image/jpeg"
          },
          {
            "@category": "standard",
            "@height": "456",
            "@width": "565",
            "@_fa": "true",
            "$": "https://api.elsevier.com/content/object/eid/1-s2.0-S0926860X23004258-gr25.jpg?httpAccept=%2A%2F%2A",
            "@multimediatype": "JPEG image file",
            "@type": "IMAGE-DOWNSAMPLED",
            "@size": "70730",
            "@ref": "gr25",
            "@mimetype": "image/jpeg"
          },
          {
            "@category": "standard",
            "@height": "258",
            "@width": "565",
            "@_fa": "true",
            "$": "https://api.elsevier.com/content/object/eid/1-s2.0-S0926860X23004258-gr6.jpg?httpAccept=%2A%2F%2A",
            "@multimediatype": "JPEG image file",
            "@type": "IMAGE-DOWNSAMPLED",
            "@size": "31459",
            "@ref": "gr6",
            "@mimetype": "image/jpeg"
          },
          {
            "@category": "standard",
            "@height": "267",
            "@width": "565",
            "@_fa": "true",
            "$": "https://api.elsevier.com/content/object/eid/1-s2.0-S0926860X23004258-gr24.jpg?httpAccept=%2A%2F%2A",
            "@multimediatype": "JPEG image file",
            "@type": "IMAGE-DOWNSAMPLED",
            "@size": "36822",
            "@ref": "gr24",
            "@mimetype": "image/jpeg"
          },
          {
            "@category": "standard",
            "@height": "341",
            "@width": "565",
            "@_fa": "true",
            "$": "https://api.elsevier.com/content/object/eid/1-s2.0-S0926860X23004258-gr5.jpg?httpAccept=%2A%2F%2A",
            "@multimediatype": "JPEG image file",
            "@type": "IMAGE-DOWNSAMPLED",
            "@size": "58135",
            "@ref": "gr5",
            "@mimetype": "image/jpeg"
          },
          {
            "@category": "standard",
            "@height": "356",
            "@width": "659",
            "@_fa": "true",
            "$": "https://api.elsevier.com/content/object/eid/1-s2.0-S0926860X23004258-gr23.jpg?httpAccept=%2A%2F%2A",
            "@multimediatype": "JPEG image file",
            "@type": "IMAGE-DOWNSAMPLED",
            "@size": "57487",
            "@ref": "gr23",
            "@mimetype": "image/jpeg"
          },
          {
            "@category": "standard",
            "@height": "729",
            "@width": "715",
            "@_fa": "true",
            "$": "https://api.elsevier.com/content/object/eid/1-s2.0-S0926860X23004258-gr8.jpg?httpAccept=%2A%2F%2A",
            "@multimediatype": "JPEG image file",
            "@type": "IMAGE-DOWNSAMPLED",
            "@size": "143714",
            "@ref": "gr8",
            "@mimetype": "image/jpeg"
          },
          {
            "@category": "standard",
            "@height": "356",
            "@width": "565",
            "@_fa": "true",
            "$": "https://api.elsevier.com/content/object/eid/1-s2.0-S0926860X23004258-gr22.jpg?httpAccept=%2A%2F%2A",
            "@multimediatype": "JPEG image file",
            "@type": "IMAGE-DOWNSAMPLED",
            "@size": "57714",
            "@ref": "gr22",
            "@mimetype": "image/jpeg"
          },
          {
            "@category": "standard",
            "@height": "232",
            "@width": "339",
            "@_fa": "true",
            "$": "https://api.elsevier.com/content/object/eid/1-s2.0-S0926860X23004258-gr7.jpg?httpAccept=%2A%2F%2A",
            "@multimediatype": "JPEG image file",
            "@type": "IMAGE-DOWNSAMPLED",
            "@size": "15120",
            "@ref": "gr7",
            "@mimetype": "image/jpeg"
          },
          {
            "@category": "standard",
            "@height": "382",
            "@width": "659",
            "@_fa": "true",
            "$": "https://api.elsevier.com/content/object/eid/1-s2.0-S0926860X23004258-gr21.jpg?httpAccept=%2A%2F%2A",
            "@multimediatype": "JPEG image file",
            "@type": "IMAGE-DOWNSAMPLED",
            "@size": "62806",
            "@ref": "gr21",
            "@mimetype": "image/jpeg"
          },
          {
            "@category": "standard",
            "@height": "251",
            "@width": "299",
            "@_fa": "true",
            "$": "https://api.elsevier.com/content/object/eid/1-s2.0-S0926860X23004258-gr20.jpg?httpAccept=%2A%2F%2A",
            "@multimediatype": "JPEG image file",
            "@type": "IMAGE-DOWNSAMPLED",
            "@size": "28338",
            "@ref": "gr20",
            "@mimetype": "image/jpeg"
          },
          {
            "@category": "standard",
            "@height": "554",
            "@width": "715",
            "@_fa": "true",
            "$": "https://api.elsevier.com/content/object/eid/1-s2.0-S0926860X23004258-gr9.jpg?httpAccept=%2A%2F%2A",
            "@multimediatype": "JPEG image file",
            "@type": "IMAGE-DOWNSAMPLED",
            "@size": "111425",
            "@ref": "gr9",
            "@mimetype": "image/jpeg"
          },
          {
            "@category": "standard",
            "@height": "217",
            "@width": "282",
            "@_fa": "true",
            "$": "https://api.elsevier.com/content/object/eid/1-s2.0-S0926860X23004258-gr2.jpg?httpAccept=%2A%2F%2A",
            "@multimediatype": "JPEG image file",
            "@type": "IMAGE-DOWNSAMPLED",
            "@size": "20646",
            "@ref": "gr2",
            "@mimetype": "image/jpeg"
          },
          {
            "@category": "standard",
            "@height": "360",
            "@width": "565",
            "@_fa": "true",
            "$": "https://api.elsevier.com/content/object/eid/1-s2.0-S0926860X23004258-gr1.jpg?httpAccept=%2A%2F%2A",
            "@multimediatype": "JPEG image file",
            "@type": "IMAGE-DOWNSAMPLED",
            "@size": "69835",
            "@ref": "gr1",
            "@mimetype": "image/jpeg"
          },
          {
            "@category": "standard",
            "@height": "258",
            "@width": "791",
            "@_fa": "true",
            "$": "https://api.elsevier.com/content/object/eid/1-s2.0-S0926860X23004258-gr4.jpg?httpAccept=%2A%2F%2A",
            "@multimediatype": "JPEG image file",
            "@type": "IMAGE-DOWNSAMPLED",
            "@size": "58088",
            "@ref": "gr4",
            "@mimetype": "image/jpeg"
          },
          {
            "@category": "standard",
            "@height": "287",
            "@width": "791",
            "@_fa": "true",
            "$": "https://api.elsevier.com/content/object/eid/1-s2.0-S0926860X23004258-gr3.jpg?httpAccept=%2A%2F%2A",
            "@multimediatype": "JPEG image file",
            "@type": "IMAGE-DOWNSAMPLED",
            "@size": "52111",
            "@ref": "gr3",
            "@mimetype": "image/jpeg"
          },
          {
            "@category": "standard",
            "@height": "185",
            "@width": "659",
            "@_fa": "true",
            "$": "https://api.elsevier.com/content/object/eid/1-s2.0-S0926860X23004258-gr19.jpg?httpAccept=%2A%2F%2A",
            "@multimediatype": "JPEG image file",
            "@type": "IMAGE-DOWNSAMPLED",
            "@size": "33602",
            "@ref": "gr19",
            "@mimetype": "image/jpeg"
          },
          {
            "@category": "standard",
            "@height": "437",
            "@width": "791",
            "@_fa": "true",
            "$": "https://api.elsevier.com/content/object/eid/1-s2.0-S0926860X23004258-gr18.jpg?httpAccept=%2A%2F%2A",
            "@multimediatype": "JPEG image file",
            "@type": "IMAGE-DOWNSAMPLED",
            "@size": "78835",
            "@ref": "gr18",
            "@mimetype": "image/jpeg"
          },
          {
            "@category": "standard",
            "@height": "460",
            "@width": "659",
            "@_fa": "true",
            "$": "https://api.elsevier.com/content/object/eid/1-s2.0-S0926860X23004258-gr17.jpg?httpAccept=%2A%2F%2A",
            "@multimediatype": "JPEG image file",
            "@type": "IMAGE-DOWNSAMPLED",
            "@size": "84424",
            "@ref": "gr17",
            "@mimetype": "image/jpeg"
          },
          {
            "@category": "standard",
            "@height": "245",
            "@width": "284",
            "@_fa": "true",
            "$": "https://api.elsevier.com/content/object/eid/1-s2.0-S0926860X23004258-ga1.jpg?httpAccept=%2A%2F%2A",
            "@multimediatype": "JPEG image file",
            "@type": "IMAGE-DOWNSAMPLED",
            "@size": "25694",
            "@ref": "ga1",
            "@mimetype": "image/jpeg"
          },
          {
            "@category": "standard",
            "@height": "551",
            "@width": "565",
            "@_fa": "true",
            "$": "https://api.elsevier.com/content/object/eid/1-s2.0-S0926860X23004258-gr16.jpg?httpAccept=%2A%2F%2A",
            "@multimediatype": "JPEG image file",
            "@type": "IMAGE-DOWNSAMPLED",
            "@size": "67708",
            "@ref": "gr16",
            "@mimetype": "image/jpeg"
          },
          {
            "@category": "standard",
            "@height": "241",
            "@width": "376",
            "@_fa": "true",
            "$": "https://api.elsevier.com/content/object/eid/1-s2.0-S0926860X23004258-gr15.jpg?httpAccept=%2A%2F%2A",
            "@multimediatype": "JPEG image file",
            "@type": "IMAGE-DOWNSAMPLED",
            "@size": "25964",
            "@ref": "gr15",
            "@mimetype": "image/jpeg"
          },
          {
            "@category": "standard",
            "@height": "383",
            "@width": "659",
            "@_fa": "true",
            "$": "https://api.elsevier.com/content/object/eid/1-s2.0-S0926860X23004258-gr14.jpg?httpAccept=%2A%2F%2A",
            "@multimediatype": "JPEG image file",
            "@type": "IMAGE-DOWNSAMPLED",
            "@size": "63866",
            "@ref": "gr14",
            "@mimetype": "image/jpeg"
          },
          {
            "@category": "standard",
            "@height": "491",
            "@width": "715",
            "@_fa": "true",
            "$": "https://api.elsevier.com/content/object/eid/1-s2.0-S0926860X23004258-gr13.jpg?httpAccept=%2A%2F%2A",
            "@multimediatype": "JPEG image file",
            "@type": "IMAGE-DOWNSAMPLED",
            "@size": "109360",
            "@ref": "gr13",
            "@mimetype": "image/jpeg"
          },
          {
            "@category": "standard",
            "@height": "683",
            "@width": "791",
            "@_fa": "true",
            "$": "https://api.elsevier.com/content/object/eid/1-s2.0-S0926860X23004258-gr12.jpg?httpAccept=%2A%2F%2A",
            "@multimediatype": "JPEG image file",
            "@type": "IMAGE-DOWNSAMPLED",
            "@size": "125386",
            "@ref": "gr12",
            "@mimetype": "image/jpeg"
          },
          {
            "@category": "standard",
            "@height": "205",
            "@width": "659",
            "@_fa": "true",
            "$": "https://api.elsevier.com/content/object/eid/1-s2.0-S0926860X23004258-gr11.jpg?httpAccept=%2A%2F%2A",
            "@multimediatype": "JPEG image file",
            "@type": "IMAGE-DOWNSAMPLED",
            "@size": "33332",
            "@ref": "gr11",
            "@mimetype": "image/jpeg"
          },
          {
            "@category": "standard",
            "@height": "413",
            "@width": "791",
            "@_fa": "true",
            "$": "https://api.elsevier.com/content/object/eid/1-s2.0-S0926860X23004258-gr10.jpg?httpAccept=%2A%2F%2A",
            "@multimediatype": "JPEG image file",
            "@type": "IMAGE-DOWNSAMPLED",
            "@size": "66312",
            "@ref": "gr10",
            "@mimetype": "image/jpeg"
          },
          {
            "@category": "thumbnail",
            "@height": "140",
            "@width": "219",
            "@_fa": "true",
            "$": "https://api.elsevier.com/content/object/eid/1-s2.0-S0926860X23004258-gr28.sml?httpAccept=%2A%2F%2A",
            "@multimediatype": "GIF image file",
            "@type": "IMAGE-THUMBNAIL",
            "@size": "15335",
            "@ref": "gr28",
            "@mimetype": "image/gif"
          },
          {
            "@category": "thumbnail",
            "@height": "94",
            "@width": "219",
            "@_fa": "true",
            "$": "https://api.elsevier.com/content/object/eid/1-s2.0-S0926860X23004258-gr27.sml?httpAccept=%2A%2F%2A",
            "@multimediatype": "GIF image file",
            "@type": "IMAGE-THUMBNAIL",
            "@size": "12049",
            "@ref": "gr27",
            "@mimetype": "image/gif"
          },
          {
            "@category": "thumbnail",
            "@height": "161",
            "@width": "219",
            "@_fa": "true",
            "$": "https://api.elsevier.com/content/object/eid/1-s2.0-S0926860X23004258-gr26.sml?httpAccept=%2A%2F%2A",
            "@multimediatype": "GIF image file",
            "@type": "IMAGE-THUMBNAIL",
            "@size": "12797",
            "@ref": "gr26",
            "@mimetype": "image/gif"
          },
          {
            "@category": "thumbnail",
            "@height": "164",
            "@width": "203",
            "@_fa": "true",
            "$": "https://api.elsevier.com/content/object/eid/1-s2.0-S0926860X23004258-gr25.sml?httpAccept=%2A%2F%2A",
            "@multimediatype": "GIF image file",
            "@type": "IMAGE-THUMBNAIL",
            "@size": "15712",
            "@ref": "gr25",
            "@mimetype": "image/gif"
          },
          {
            "@category": "thumbnail",
            "@height": "100",
            "@width": "219",
            "@_fa": "true",
            "$": "https://api.elsevier.com/content/object/eid/1-s2.0-S0926860X23004258-gr6.sml?httpAccept=%2A%2F%2A",
            "@multimediatype": "GIF image file",
            "@type": "IMAGE-THUMBNAIL",
            "@size": "6495",
            "@ref": "gr6",
            "@mimetype": "image/gif"
          },
          {
            "@category": "thumbnail",
            "@height": "104",
            "@width": "219",
            "@_fa": "true",
            "$": "https://api.elsevier.com/content/object/eid/1-s2.0-S0926860X23004258-gr24.sml?httpAccept=%2A%2F%2A",
            "@multimediatype": "GIF image file",
            "@type": "IMAGE-THUMBNAIL",
            "@size": "8989",
            "@ref": "gr24",
            "@mimetype": "image/gif"
          },
          {
            "@category": "thumbnail",
            "@height": "132",
            "@width": "219",
            "@_fa": "true",
            "$": "https://api.elsevier.com/content/object/eid/1-s2.0-S0926860X23004258-gr5.sml?httpAccept=%2A%2F%2A",
            "@multimediatype": "GIF image file",
            "@type": "IMAGE-THUMBNAIL",
            "@size": "14999",
            "@ref": "gr5",
            "@mimetype": "image/gif"
          },
          {
            "@category": "thumbnail",
            "@height": "118",
            "@width": "219",
            "@_fa": "true",
            "$": "https://api.elsevier.com/content/object/eid/1-s2.0-S0926860X23004258-gr23.sml?httpAccept=%2A%2F%2A",
            "@multimediatype": "GIF image file",
            "@type": "IMAGE-THUMBNAIL",
            "@size": "9872",
            "@ref": "gr23",
            "@mimetype": "image/gif"
          },
          {
            "@category": "thumbnail",
            "@height": "164",
            "@width": "161",
            "@_fa": "true",
            "$": "https://api.elsevier.com/content/object/eid/1-s2.0-S0926860X23004258-gr8.sml?httpAccept=%2A%2F%2A",
            "@multimediatype": "GIF image file",
            "@type": "IMAGE-THUMBNAIL",
            "@size": "14349",
            "@ref": "gr8",
            "@mimetype": "image/gif"
          },
          {
            "@category": "thumbnail",
            "@height": "138",
            "@width": "219",
            "@_fa": "true",
            "$": "https://api.elsevier.com/content/object/eid/1-s2.0-S0926860X23004258-gr22.sml?httpAccept=%2A%2F%2A",
            "@multimediatype": "GIF image file",
            "@type": "IMAGE-THUMBNAIL",
            "@size": "14096",
            "@ref": "gr22",
            "@mimetype": "image/gif"
          },
          {
            "@category": "thumbnail",
            "@height": "150",
            "@width": "219",
            "@_fa": "true",
            "$": "https://api.elsevier.com/content/object/eid/1-s2.0-S0926860X23004258-gr7.sml?httpAccept=%2A%2F%2A",
            "@multimediatype": "GIF image file",
            "@type": "IMAGE-THUMBNAIL",
            "@size": "6013",
            "@ref": "gr7",
            "@mimetype": "image/gif"
          },
          {
            "@category": "thumbnail",
            "@height": "127",
            "@width": "219",
            "@_fa": "true",
            "$": "https://api.elsevier.com/content/object/eid/1-s2.0-S0926860X23004258-gr21.sml?httpAccept=%2A%2F%2A",
            "@multimediatype": "GIF image file",
            "@type": "IMAGE-THUMBNAIL",
            "@size": "13288",
            "@ref": "gr21",
            "@mimetype": "image/gif"
          },
          {
            "@category": "thumbnail",
            "@height": "163",
            "@width": "195",
            "@_fa": "true",
            "$": "https://api.elsevier.com/content/object/eid/1-s2.0-S0926860X23004258-gr20.sml?httpAccept=%2A%2F%2A",
            "@multimediatype": "GIF image file",
            "@type": "IMAGE-THUMBNAIL",
            "@size": "19039",
            "@ref": "gr20",
            "@mimetype": "image/gif"
          },
          {
            "@category": "thumbnail",
            "@height": "164",
            "@width": "212",
            "@_fa": "true",
            "$": "https://api.elsevier.com/content/object/eid/1-s2.0-S0926860X23004258-gr9.sml?httpAccept=%2A%2F%2A",
            "@multimediatype": "GIF image file",
            "@type": "IMAGE-THUMBNAIL",
            "@size": "17218",
            "@ref": "gr9",
            "@mimetype": "image/gif"
          },
          {
            "@category": "thumbnail",
            "@height": "164",
            "@width": "213",
            "@_fa": "true",
            "$": "https://api.elsevier.com/content/object/eid/1-s2.0-S0926860X23004258-gr2.sml?httpAccept=%2A%2F%2A",
            "@multimediatype": "GIF image file",
            "@type": "IMAGE-THUMBNAIL",
            "@size": "11694",
            "@ref": "gr2",
            "@mimetype": "image/gif"
          },
          {
            "@category": "thumbnail",
            "@height": "140",
            "@width": "219",
            "@_fa": "true",
            "$": "https://api.elsevier.com/content/object/eid/1-s2.0-S0926860X23004258-gr1.sml?httpAccept=%2A%2F%2A",
            "@multimediatype": "GIF image file",
            "@type": "IMAGE-THUMBNAIL",
            "@size": "11891",
            "@ref": "gr1",
            "@mimetype": "image/gif"
          },
          {
            "@category": "thumbnail",
            "@height": "71",
            "@width": "219",
            "@_fa": "true",
            "$": "https://api.elsevier.com/content/object/eid/1-s2.0-S0926860X23004258-gr4.sml?httpAccept=%2A%2F%2A",
            "@multimediatype": "GIF image file",
            "@type": "IMAGE-THUMBNAIL",
            "@size": "6811",
            "@ref": "gr4",
            "@mimetype": "image/gif"
          },
          {
            "@category": "thumbnail",
            "@height": "79",
            "@width": "219",
            "@_fa": "true",
            "$": "https://api.elsevier.com/content/object/eid/1-s2.0-S0926860X23004258-gr3.sml?httpAccept=%2A%2F%2A",
            "@multimediatype": "GIF image file",
            "@type": "IMAGE-THUMBNAIL",
            "@size": "6753",
            "@ref": "gr3",
            "@mimetype": "image/gif"
          },
          {
            "@category": "thumbnail",
            "@height": "62",
            "@width": "219",
            "@_fa": "true",
            "$": "https://api.elsevier.com/content/object/eid/1-s2.0-S0926860X23004258-gr19.sml?httpAccept=%2A%2F%2A",
            "@multimediatype": "GIF image file",
            "@type": "IMAGE-THUMBNAIL",
            "@size": "5340",
            "@ref": "gr19",
            "@mimetype": "image/gif"
          },
          {
            "@category": "thumbnail",
            "@height": "121",
            "@width": "219",
            "@_fa": "true",
            "$": "https://api.elsevier.com/content/object/eid/1-s2.0-S0926860X23004258-gr18.sml?httpAccept=%2A%2F%2A",
            "@multimediatype": "GIF image file",
            "@type": "IMAGE-THUMBNAIL",
            "@size": "9729",
            "@ref": "gr18",
            "@mimetype": "image/gif"
          },
          {
            "@category": "thumbnail",
            "@height": "153",
            "@width": "219",
            "@_fa": "true",
            "$": "https://api.elsevier.com/content/object/eid/1-s2.0-S0926860X23004258-gr17.sml?httpAccept=%2A%2F%2A",
            "@multimediatype": "GIF image file",
            "@type": "IMAGE-THUMBNAIL",
            "@size": "13689",
            "@ref": "gr17",
            "@mimetype": "image/gif"
          },
          {
            "@category": "thumbnail",
            "@height": "164",
            "@width": "190",
            "@_fa": "true",
            "$": "https://api.elsevier.com/content/object/eid/1-s2.0-S0926860X23004258-ga1.sml?httpAccept=%2A%2F%2A",
            "@multimediatype": "GIF image file",
            "@type": "IMAGE-THUMBNAIL",
            "@size": "14272",
            "@ref": "ga1",
            "@mimetype": "image/gif"
          },
          {
            "@category": "thumbnail",
            "@height": "164",
            "@width": "168",
            "@_fa": "true",
            "$": "https://api.elsevier.com/content/object/eid/1-s2.0-S0926860X23004258-gr16.sml?httpAccept=%2A%2F%2A",
            "@multimediatype": "GIF image file",
            "@type": "IMAGE-THUMBNAIL",
            "@size": "9372",
            "@ref": "gr16",
            "@mimetype": "image/gif"
          },
          {
            "@category": "thumbnail",
            "@height": "140",
            "@width": "219",
            "@_fa": "true",
            "$": "https://api.elsevier.com/content/object/eid/1-s2.0-S0926860X23004258-gr15.sml?httpAccept=%2A%2F%2A",
            "@multimediatype": "GIF image file",
            "@type": "IMAGE-THUMBNAIL",
            "@size": "11531",
            "@ref": "gr15",
            "@mimetype": "image/gif"
          },
          {
            "@category": "thumbnail",
            "@height": "127",
            "@width": "219",
            "@_fa": "true",
            "$": "https://api.elsevier.com/content/object/eid/1-s2.0-S0926860X23004258-gr14.sml?httpAccept=%2A%2F%2A",
            "@multimediatype": "GIF image file",
            "@type": "IMAGE-THUMBNAIL",
            "@size": "11701",
            "@ref": "gr14",
            "@mimetype": "image/gif"
          },
          {
            "@category": "thumbnail",
            "@height": "150",
            "@width": "219",
            "@_fa": "true",
            "$": "https://api.elsevier.com/content/object/eid/1-s2.0-S0926860X23004258-gr13.sml?httpAccept=%2A%2F%2A",
            "@multimediatype": "GIF image file",
            "@type": "IMAGE-THUMBNAIL",
            "@size": "14984",
            "@ref": "gr13",
            "@mimetype": "image/gif"
          },
          {
            "@category": "thumbnail",
            "@height": "164",
            "@width": "190",
            "@_fa": "true",
            "$": "https://api.elsevier.com/content/object/eid/1-s2.0-S0926860X23004258-gr12.sml?httpAccept=%2A%2F%2A",
            "@multimediatype": "GIF image file",
            "@type": "IMAGE-THUMBNAIL",
            "@size": "12577",
            "@ref": "gr12",
            "@mimetype": "image/gif"
          },
          {
            "@category": "thumbnail",
            "@height": "68",
            "@width": "219",
            "@_fa": "true",
            "$": "https://api.elsevier.com/content/object/eid/1-s2.0-S0926860X23004258-gr11.sml?httpAccept=%2A%2F%2A",
            "@multimediatype": "GIF image file",
            "@type": "IMAGE-THUMBNAIL",
            "@size": "7417",
            "@ref": "gr11",
            "@mimetype": "image/gif"
          },
          {
            "@category": "thumbnail",
            "@height": "114",
            "@width": "219",
            "@_fa": "true",
            "$": "https://api.elsevier.com/content/object/eid/1-s2.0-S0926860X23004258-gr10.sml?httpAccept=%2A%2F%2A",
            "@multimediatype": "GIF image file",
            "@type": "IMAGE-THUMBNAIL",
            "@size": "8896",
            "@ref": "gr10",
            "@mimetype": "image/gif"
          },
          {
            "@category": "high",
            "@height": "1599",
            "@width": "2495",
            "@_fa": "true",
            "$": "https://api.elsevier.com/content/object/eid/1-s2.0-S0926860X23004258-gr28_lrg.jpg?httpAccept=%2A%2F%2A",
            "@multimediatype": "JPEG image file",
            "@type": "IMAGE-HIGH-RES",
            "@size": "332288",
            "@ref": "gr28",
            "@mimetype": "image/jpeg"
          },
          {
            "@category": "high",
            "@height": "1250",
            "@width": "2911",
            "@_fa": "true",
            "$": "https://api.elsevier.com/content/object/eid/1-s2.0-S0926860X23004258-gr27_lrg.jpg?httpAccept=%2A%2F%2A",
            "@multimediatype": "JPEG image file",
            "@type": "IMAGE-HIGH-RES",
            "@size": "255800",
            "@ref": "gr27",
            "@mimetype": "image/jpeg"
          },
          {
            "@category": "high",
            "@height": "2146",
            "@width": "2911",
            "@_fa": "true",
            "$": "https://api.elsevier.com/content/object/eid/1-s2.0-S0926860X23004258-gr26_lrg.jpg?httpAccept=%2A%2F%2A",
            "@multimediatype": "JPEG image file",
            "@type": "IMAGE-HIGH-RES",
            "@size": "316847",
            "@ref": "gr26",
            "@mimetype": "image/jpeg"
          },
          {
            "@category": "high",
            "@height": "2013",
            "@width": "2495",
            "@_fa": "true",
            "$": "https://api.elsevier.com/content/object/eid/1-s2.0-S0926860X23004258-gr25_lrg.jpg?httpAccept=%2A%2F%2A",
            "@multimediatype": "JPEG image file",
            "@type": "IMAGE-HIGH-RES",
            "@size": "325072",
            "@ref": "gr25",
            "@mimetype": "image/jpeg"
          },
          {
            "@category": "high",
            "@height": "1141",
            "@width": "2495",
            "@_fa": "true",
            "$": "https://api.elsevier.com/content/object/eid/1-s2.0-S0926860X23004258-gr6_lrg.jpg?httpAccept=%2A%2F%2A",
            "@multimediatype": "JPEG image file",
            "@type": "IMAGE-HIGH-RES",
            "@size": "144756",
            "@ref": "gr6",
            "@mimetype": "image/jpeg"
          },
          {
            "@category": "high",
            "@height": "1180",
            "@width": "2495",
            "@_fa": "true",
            "$": "https://api.elsevier.com/content/object/eid/1-s2.0-S0926860X23004258-gr24_lrg.jpg?httpAccept=%2A%2F%2A",
            "@multimediatype": "JPEG image file",
            "@type": "IMAGE-HIGH-RES",
            "@size": "154572",
            "@ref": "gr24",
            "@mimetype": "image/jpeg"
          },
          {
            "@category": "high",
            "@height": "1507",
            "@width": "2495",
            "@_fa": "true",
            "$": "https://api.elsevier.com/content/object/eid/1-s2.0-S0926860X23004258-gr5_lrg.jpg?httpAccept=%2A%2F%2A",
            "@multimediatype": "JPEG image file",
            "@type": "IMAGE-HIGH-RES",
            "@size": "283120",
            "@ref": "gr5",
            "@mimetype": "image/jpeg"
          },
          {
            "@category": "high",
            "@height": "1574",
            "@width": "2911",
            "@_fa": "true",
            "$": "https://api.elsevier.com/content/object/eid/1-s2.0-S0926860X23004258-gr23_lrg.jpg?httpAccept=%2A%2F%2A",
            "@multimediatype": "JPEG image file",
            "@type": "IMAGE-HIGH-RES",
            "@size": "255998",
            "@ref": "gr23",
            "@mimetype": "image/jpeg"
          },
          {
            "@category": "high",
            "@height": "3222",
            "@width": "3160",
            "@_fa": "true",
            "$": "https://api.elsevier.com/content/object/eid/1-s2.0-S0926860X23004258-gr8_lrg.jpg?httpAccept=%2A%2F%2A",
            "@multimediatype": "JPEG image file",
            "@type": "IMAGE-HIGH-RES",
            "@size": "681770",
            "@ref": "gr8",
            "@mimetype": "image/jpeg"
          },
          {
            "@category": "high",
            "@height": "1570",
            "@width": "2495",
            "@_fa": "true",
            "$": "https://api.elsevier.com/content/object/eid/1-s2.0-S0926860X23004258-gr22_lrg.jpg?httpAccept=%2A%2F%2A",
            "@multimediatype": "JPEG image file",
            "@type": "IMAGE-HIGH-RES",
            "@size": "265334",
            "@ref": "gr22",
            "@mimetype": "image/jpeg"
          },
          {
            "@category": "high",
            "@height": "1024",
            "@width": "1497",
            "@_fa": "true",
            "$": "https://api.elsevier.com/content/object/eid/1-s2.0-S0926860X23004258-gr7_lrg.jpg?httpAccept=%2A%2F%2A",
            "@multimediatype": "JPEG image file",
            "@type": "IMAGE-HIGH-RES",
            "@size": "71835",
            "@ref": "gr7",
            "@mimetype": "image/jpeg"
          },
          {
            "@category": "high",
            "@height": "1689",
            "@width": "2911",
            "@_fa": "true",
            "$": "https://api.elsevier.com/content/object/eid/1-s2.0-S0926860X23004258-gr21_lrg.jpg?httpAccept=%2A%2F%2A",
            "@multimediatype": "JPEG image file",
            "@type": "IMAGE-HIGH-RES",
            "@size": "275141",
            "@ref": "gr21",
            "@mimetype": "image/jpeg"
          },
          {
            "@category": "high",
            "@height": "1115",
            "@width": "1330",
            "@_fa": "true",
            "$": "https://api.elsevier.com/content/object/eid/1-s2.0-S0926860X23004258-gr20_lrg.jpg?httpAccept=%2A%2F%2A",
            "@multimediatype": "JPEG image file",
            "@type": "IMAGE-HIGH-RES",
            "@size": "131306",
            "@ref": "gr20",
            "@mimetype": "image/jpeg"
          },
          {
            "@category": "high",
            "@height": "2447",
            "@width": "3160",
            "@_fa": "true",
            "$": "https://api.elsevier.com/content/object/eid/1-s2.0-S0926860X23004258-gr9_lrg.jpg?httpAccept=%2A%2F%2A",
            "@multimediatype": "JPEG image file",
            "@type": "IMAGE-HIGH-RES",
            "@size": "473915",
            "@ref": "gr9",
            "@mimetype": "image/jpeg"
          },
          {
            "@category": "high",
            "@height": "961",
            "@width": "1247",
            "@_fa": "true",
            "$": "https://api.elsevier.com/content/object/eid/1-s2.0-S0926860X23004258-gr2_lrg.jpg?httpAccept=%2A%2F%2A",
            "@multimediatype": "JPEG image file",
            "@type": "IMAGE-HIGH-RES",
            "@size": "91049",
            "@ref": "gr2",
            "@mimetype": "image/jpeg"
          },
          {
            "@category": "high",
            "@height": "1591",
            "@width": "2495",
            "@_fa": "true",
            "$": "https://api.elsevier.com/content/object/eid/1-s2.0-S0926860X23004258-gr1_lrg.jpg?httpAccept=%2A%2F%2A",
            "@multimediatype": "JPEG image file",
            "@type": "IMAGE-HIGH-RES",
            "@size": "312056",
            "@ref": "gr1",
            "@mimetype": "image/jpeg"
          },
          {
            "@category": "high",
            "@height": "1138",
            "@width": "3493",
            "@_fa": "true",
            "$": "https://api.elsevier.com/content/object/eid/1-s2.0-S0926860X23004258-gr4_lrg.jpg?httpAccept=%2A%2F%2A",
            "@multimediatype": "JPEG image file",
            "@type": "IMAGE-HIGH-RES",
            "@size": "248765",
            "@ref": "gr4",
            "@mimetype": "image/jpeg"
          },
          {
            "@category": "high",
            "@height": "1267",
            "@width": "3493",
            "@_fa": "true",
            "$": "https://api.elsevier.com/content/object/eid/1-s2.0-S0926860X23004258-gr3_lrg.jpg?httpAccept=%2A%2F%2A",
            "@multimediatype": "JPEG image file",
            "@type": "IMAGE-HIGH-RES",
            "@size": "218137",
            "@ref": "gr3",
            "@mimetype": "image/jpeg"
          },
          {
            "@category": "high",
            "@height": "818",
            "@width": "2911",
            "@_fa": "true",
            "$": "https://api.elsevier.com/content/object/eid/1-s2.0-S0926860X23004258-gr19_lrg.jpg?httpAccept=%2A%2F%2A",
            "@multimediatype": "JPEG image file",
            "@type": "IMAGE-HIGH-RES",
            "@size": "151528",
            "@ref": "gr19",
            "@mimetype": "image/jpeg"
          },
          {
            "@category": "high",
            "@height": "1929",
            "@width": "3493",
            "@_fa": "true",
            "$": "https://api.elsevier.com/content/object/eid/1-s2.0-S0926860X23004258-gr18_lrg.jpg?httpAccept=%2A%2F%2A",
            "@multimediatype": "JPEG image file",
            "@type": "IMAGE-HIGH-RES",
            "@size": "340202",
            "@ref": "gr18",
            "@mimetype": "image/jpeg"
          },
          {
            "@category": "high",
            "@height": "2032",
            "@width": "2911",
            "@_fa": "true",
            "$": "https://api.elsevier.com/content/object/eid/1-s2.0-S0926860X23004258-gr17_lrg.jpg?httpAccept=%2A%2F%2A",
            "@multimediatype": "JPEG image file",
            "@type": "IMAGE-HIGH-RES",
            "@size": "377919",
            "@ref": "gr17",
            "@mimetype": "image/jpeg"
          },
          {
            "@category": "high",
            "@height": "1085",
            "@width": "1260",
            "@_fa": "true",
            "$": "https://api.elsevier.com/content/object/eid/1-s2.0-S0926860X23004258-ga1_lrg.jpg?httpAccept=%2A%2F%2A",
            "@multimediatype": "JPEG image file",
            "@type": "IMAGE-HIGH-RES",
            "@size": "177587",
            "@ref": "ga1",
            "@mimetype": "image/jpeg"
          },
          {
            "@category": "high",
            "@height": "2433",
            "@width": "2495",
            "@_fa": "true",
            "$": "https://api.elsevier.com/content/object/eid/1-s2.0-S0926860X23004258-gr16_lrg.jpg?httpAccept=%2A%2F%2A",
            "@multimediatype": "JPEG image file",
            "@type": "IMAGE-HIGH-RES",
            "@size": "290938",
            "@ref": "gr16",
            "@mimetype": "image/jpeg"
          },
          {
            "@category": "high",
            "@height": "1064",
            "@width": "1663",
            "@_fa": "true",
            "$": "https://api.elsevier.com/content/object/eid/1-s2.0-S0926860X23004258-gr15_lrg.jpg?httpAccept=%2A%2F%2A",
            "@multimediatype": "JPEG image file",
            "@type": "IMAGE-HIGH-RES",
            "@size": "120851",
            "@ref": "gr15",
            "@mimetype": "image/jpeg"
          },
          {
            "@category": "high",
            "@height": "1690",
            "@width": "2911",
            "@_fa": "true",
            "$": "https://api.elsevier.com/content/object/eid/1-s2.0-S0926860X23004258-gr14_lrg.jpg?httpAccept=%2A%2F%2A",
            "@multimediatype": "JPEG image file",
            "@type": "IMAGE-HIGH-RES",
            "@size": "275464",
            "@ref": "gr14",
            "@mimetype": "image/jpeg"
          },
          {
            "@category": "high",
            "@height": "2168",
            "@width": "3160",
            "@_fa": "true",
            "$": "https://api.elsevier.com/content/object/eid/1-s2.0-S0926860X23004258-gr13_lrg.jpg?httpAccept=%2A%2F%2A",
            "@multimediatype": "JPEG image file",
            "@type": "IMAGE-HIGH-RES",
            "@size": "496224",
            "@ref": "gr13",
            "@mimetype": "image/jpeg"
          },
          {
            "@category": "high",
            "@height": "3017",
            "@width": "3493",
            "@_fa": "true",
            "$": "https://api.elsevier.com/content/object/eid/1-s2.0-S0926860X23004258-gr12_lrg.jpg?httpAccept=%2A%2F%2A",
            "@multimediatype": "JPEG image file",
            "@type": "IMAGE-HIGH-RES",
            "@size": "536988",
            "@ref": "gr12",
            "@mimetype": "image/jpeg"
          },
          {
            "@category": "high",
            "@height": "904",
            "@width": "2911",
            "@_fa": "true",
            "$": "https://api.elsevier.com/content/object/eid/1-s2.0-S0926860X23004258-gr11_lrg.jpg?httpAccept=%2A%2F%2A",
            "@multimediatype": "JPEG image file",
            "@type": "IMAGE-HIGH-RES",
            "@size": "139876",
            "@ref": "gr11",
            "@mimetype": "image/jpeg"
          },
          {
            "@category": "high",
            "@height": "1824",
            "@width": "3493",
            "@_fa": "true",
            "$": "https://api.elsevier.com/content/object/eid/1-s2.0-S0926860X23004258-gr10_lrg.jpg?httpAccept=%2A%2F%2A",
            "@multimediatype": "JPEG image file",
            "@type": "IMAGE-HIGH-RES",
            "@size": "296278",
            "@ref": "gr10",
            "@mimetype": "image/jpeg"
          },
          {
            "@category": "standard",
            "@_fa": "true",
            "$": "https://api.elsevier.com/content/object/eid/1-s2.0-S0926860X23004258-mmc1.docx?httpAccept=%2A%2F%2A",
            "@multimediatype": "Microsoft Word file",
            "@type": "APPLICATION",
            "@size": "21500522",
            "@ref": "mmc1",
            "@mimetype": "application/word"
          },
          {
            "@category": "standard",
            "@_fa": "true",
            "$": "https://api.elsevier.com/content/object/eid/1-s2.0-S0926860X23004258-am.pdf?httpAccept=%2A%2F%2A",
            "@multimediatype": "Acrobat PDF file",
            "@type": "AAM-PDF",
            "@size": "4342237",
            "@ref": "am",
            "@mimetype": "application/pdf"
          }
        ]
      },
      "link": {
        "@rel": "abstract",
        "@href": "https://api.elsevier.com/content/abstract/scopus_id/85173875182"
      }
    }
  }
}