{
  "metadata": {
    "title": "Acid–base bifunctional ZnNbCl/eg-C<ce:inf loc=post>3</ce:inf>N<ce:inf loc=post>4</ce:inf> materials towards catalytic synthesis of dimethyl carbonate via transesterification of ethylene carbonate",
    "authors": "; ; ",
    "journal": "Applied Catalysis A: General",
    "date": "2023-09-25",
    "doi": "10.1016/j.apcata.2023.119432",
    "abstract": "",
    "uri": "https://api.elsevier.com/content/article/pii/S0926860X2300412X",
    "pii": "S0926860X2300412X"
  },
  "fulltext": {
    "full-text-retrieval-response": {
      "scopus-eid": "2-s2.0-85171997860",
      "originalText": "serial JL 271346 291210 291744 291809 31 Applied Catalysis A: General APPLIEDCATALYSISAGENERAL 2023-09-23 2023-09-23 2023-09-26 2023-09-26 2023-10-14T12:55:28 1-s2.0-S0926860X2300412X S0926-860X(23)00412-X S0926860X2300412X 10.1016/j.apcata.2023.119432 S300 S300.1 FULL-TEXT 1-s2.0-S0926860X23X00179 2024-01-01T12:35:59.692098Z 0 0 20230925 2023 2023-09-23T01:09:13.205529Z absattachment articleinfo articlenumber articletitlenorm authfirstinitialnorm authfirstsurnamenorm cid cids contenttype copyright crossmark dateloaded dateloadedtxt datesearch datesort dateupdated dco docsubtype doctype doi eid ewtransactionid hubeid indexeddate issn issnnorm itemstage itemtransactionid itemweight openaccess openarchive pg pgfirst pii piinorm pubdatestart pubdatetxt pubyr sortorder srctitle srctitlenorm srctype ssids alllist content subj subheadings suppl tomb volfirst volissue volumelist webpdf webpdfpagecount yearnav figure table e-component body mmlmath acknowledge affil appendices articletitle auth authfirstini authfull authkeywords authlast footnotes grantnumber grantsponsor grantsponsorid highlightsabst orcid primabst ref specialabst 0926-860X 0926860X true 666 666 C Volume 666 33 119432 119432 119432 20230925 25 September 2023 2023-09-25 2023 article fla © 2023 Elsevier B.V. All rights reserved. ACIDBASEBIFUNCTIONALZNNBCLEGC3N4MATERIALSTOWARDSCATALYTICSYNTHESISDIMETHYLCARBONATEVIATRANSESTERIFICATIONETHYLENECARBONATE YU L 1 Introduction 2 Experimental 2.1 Material preparation 2.1.1 Preparation of g-C3N4 and eg-C3N4 2.1.2 Preparation of ZnNbCl/eg-C3N4 2.2 Material characterization 2.3 Catalytic evaluation 3 Results and discussions 3.1 Materials characterization 3.2 Catalytic performance 4 Conclusion CRediT authorship contribution statement Acknowledgments Appendix A Supplementary material References DENG 2019 198 212 W SONG 2020 667 672 Y WANG 2021 423 430 X KUMAR 2020 7455 7464 N WEI 2020 7826 7834 Q LIU 2022 124580 W GAN 2020 3215 3223 Y SONG 2019 5698 5710 Z WANG 2023 139354 G WEI 2021 5540 5550 Q QURESHI 2023 19459 19485 W AKHUNDI 2020 110902 A AMORIN 2019 13647 13653 L DANDIA 2022 A DANDIA 2021 100170 A DANDIA 2021 28452 28465 A DANDIA 2020 100039 A RUBAN 2021 468 474 S SHCHERBAN 2018 2928 2937 N DEVI 2020 3537 3545 M WU 2022 118677 F BAHUGUNA 2018 6711 6723 A ZHANG 2019 716 724 D LONG 2021 145178 X DEMEDEIROS 2020 105306 T NAGVENKAR 2015 20 23 A CUCCIOLITO 2016 1113 1117 M DESAIRRE 2005 2705 2708 M GARCIASANCHO 2011 161 167 C NAKATAKE 2016 2569 2574 D AHMAD 2022 151321 K XU 2020 110979 J GOETTMANN 2006 4467 4471 F BOJDYS 2008 8177 8182 M DONG 2015 23642 23652 X VERMA 2017 3637 3640 S WANG 2015 24 28 Y ZHU 2010 6965 6967 J LIU 2023 1483 1494 N WU 2019 109 120 J YANG 2013 2452 2456 S SU 2014 1556 1562 Q ZHU 2023 e202301526 Y SU 2012 1005 1009 F XU 2015 1 8 J XU 2018 5582 5593 J MCGUIRE 1973 2450 2453 G CROCELLA 2017 323 336 V DAI 2021 113592 Y XU 2013 3192 3199 J KELLER 2010 1 18 N CHEN 2013 3799 3814 L KUMAR 2018 706 716 P CHEN 2023 804 811 M AHIRE 2022 3284 3293 J YUX2023X119432 YUX2023X119432XL 2025-09-26T00:00:00.000Z 2025-09-26T00:00:00.000Z http://creativecommons.org/licenses/by-nc-nd/4.0/ © 2023 Elsevier B.V. All rights reserved. 2023-09-28T01:23:25.564Z http://vtw.elsevier.com/data/voc/AddOnTypes/50.7/aggregated-refined https://doi.org/10.15223/policy-017 https://doi.org/10.15223/policy-037 https://doi.org/10.15223/policy-012 https://doi.org/10.15223/policy-029 https://doi.org/10.15223/policy-004 item S0926-860X(23)00412-X S0926860X2300412X 1-s2.0-S0926860X2300412X 10.1016/j.apcata.2023.119432 271346 2024-01-01T12:35:59.692098Z 2023-09-25 1-s2.0-S0926860X2300412X-main.pdf https://s3-eu-west-1.amazonaws.com/prod-ucs-content-store-eu-west/content/pii:S0926860X2300412X/MAIN/application/pdf/50963bdcf0bc8a8a2b5a5f60e5f99faa/main.pdf main.pdf pdf true 4672971 MAIN 10 1-s2.0-S0926860X2300412X-main_1.png https://s3-eu-west-1.amazonaws.com/prod-ucs-content-store-eu-west/content/pii:S0926860X2300412X/PREVIEW/image/png/13ac493823ea733fe4b75a96b49119d6/main_1.png main_1.png png 55997 849 656 IMAGE-WEB-PDF 1 1-s2.0-S0926860X2300412X-gr11.jpg https://s3-eu-west-1.amazonaws.com/prod-ucs-content-store-eu-west/content/pii:S0926860X2300412X/gr11/DOWNSAMPLED/image/jpeg/6412b99e9e076adb126855b6673a6933/gr11.jpg gr11 gr11.jpg jpg 27784 310 395 IMAGE-DOWNSAMPLED 1-s2.0-S0926860X2300412X-ga1.jpg https://s3-eu-west-1.amazonaws.com/prod-ucs-content-store-eu-west/content/pii:S0926860X2300412X/ga1/DOWNSAMPLED/image/jpeg/08bdff1aa55d8fb6241d1cda53e98d7c/ga1.jpg ga1 true ga1.jpg jpg 18337 200 350 IMAGE-DOWNSAMPLED 1-s2.0-S0926860X2300412X-gr6.jpg https://s3-eu-west-1.amazonaws.com/prod-ucs-content-store-eu-west/content/pii:S0926860X2300412X/gr6/DOWNSAMPLED/image/jpeg/d71db03adf5343633277a79e55830404/gr6.jpg gr6 gr6.jpg jpg 31081 306 395 IMAGE-DOWNSAMPLED 1-s2.0-S0926860X2300412X-gr7.jpg https://s3-eu-west-1.amazonaws.com/prod-ucs-content-store-eu-west/content/pii:S0926860X2300412X/gr7/DOWNSAMPLED/image/jpeg/ba6dfb8ed259cfa29025ccb9c5bd7057/gr7.jpg gr7 gr7.jpg jpg 25499 309 395 IMAGE-DOWNSAMPLED 1-s2.0-S0926860X2300412X-gr14.jpg https://s3-eu-west-1.amazonaws.com/prod-ucs-content-store-eu-west/content/pii:S0926860X2300412X/gr14/DOWNSAMPLED/image/jpeg/b0a66825feebb797e18b8f3f92346844/gr14.jpg gr14 gr14.jpg jpg 36200 355 520 IMAGE-DOWNSAMPLED 1-s2.0-S0926860X2300412X-gr15.jpg https://s3-eu-west-1.amazonaws.com/prod-ucs-content-store-eu-west/content/pii:S0926860X2300412X/gr15/DOWNSAMPLED/image/jpeg/7ecfadbfd430dc3ba889151060569cb0/gr15.jpg gr15 gr15.jpg jpg 35550 290 395 IMAGE-DOWNSAMPLED 1-s2.0-S0926860X2300412X-gr12.jpg https://s3-eu-west-1.amazonaws.com/prod-ucs-content-store-eu-west/content/pii:S0926860X2300412X/gr12/DOWNSAMPLED/image/jpeg/f82f1348d4078b9999de9ea1b4cff5e1/gr12.jpg gr12 gr12.jpg jpg 26450 307 395 IMAGE-DOWNSAMPLED 1-s2.0-S0926860X2300412X-gr13.jpg https://s3-eu-west-1.amazonaws.com/prod-ucs-content-store-eu-west/content/pii:S0926860X2300412X/gr13/DOWNSAMPLED/image/jpeg/3b03a96f9161d6ec34a8fce21c044f2a/gr13.jpg gr13 gr13.jpg jpg 38722 307 395 IMAGE-DOWNSAMPLED 1-s2.0-S0926860X2300412X-gr10.jpg https://s3-eu-west-1.amazonaws.com/prod-ucs-content-store-eu-west/content/pii:S0926860X2300412X/gr10/DOWNSAMPLED/image/jpeg/29296daeda6f7288cd1231ae735a090f/gr10.jpg gr10 gr10.jpg jpg 25987 308 395 IMAGE-DOWNSAMPLED 1-s2.0-S0926860X2300412X-gr4.jpg https://s3-eu-west-1.amazonaws.com/prod-ucs-content-store-eu-west/content/pii:S0926860X2300412X/gr4/DOWNSAMPLED/image/jpeg/243bcac05f3130f8c75e279bb0632e4e/gr4.jpg gr4 gr4.jpg jpg 64188 205 807 IMAGE-DOWNSAMPLED 1-s2.0-S0926860X2300412X-gr3.jpg https://s3-eu-west-1.amazonaws.com/prod-ucs-content-store-eu-west/content/pii:S0926860X2300412X/gr3/DOWNSAMPLED/image/jpeg/f78fef3160bd37ebdacdcdc486d1ca1e/gr3.jpg gr3 gr3.jpg jpg 25242 295 395 IMAGE-DOWNSAMPLED 1-s2.0-S0926860X2300412X-gr5.jpg https://s3-eu-west-1.amazonaws.com/prod-ucs-content-store-eu-west/content/pii:S0926860X2300412X/gr5/DOWNSAMPLED/image/jpeg/cdd192f2eeb030b11bfa71460cc9ebda/gr5.jpg gr5 gr5.jpg jpg 107928 469 807 IMAGE-DOWNSAMPLED 1-s2.0-S0926860X2300412X-gr8.jpg https://s3-eu-west-1.amazonaws.com/prod-ucs-content-store-eu-west/content/pii:S0926860X2300412X/gr8/DOWNSAMPLED/image/jpeg/c67d1ea254f2654c7888cc17640213ee/gr8.jpg gr8 gr8.jpg jpg 30864 325 395 IMAGE-DOWNSAMPLED 1-s2.0-S0926860X2300412X-gr9.jpg https://s3-eu-west-1.amazonaws.com/prod-ucs-content-store-eu-west/content/pii:S0926860X2300412X/gr9/DOWNSAMPLED/image/jpeg/75c257714865cfb150e53d6c63769d3a/gr9.jpg gr9 gr9.jpg jpg 29241 303 395 IMAGE-DOWNSAMPLED 1-s2.0-S0926860X2300412X-sc1.jpg https://s3-eu-west-1.amazonaws.com/prod-ucs-content-store-eu-west/content/pii:S0926860X2300412X/sc1/DOWNSAMPLED/image/jpeg/a0cb3ad9bc7f7707e786c2aa5bc49792/sc1.jpg sc1 sc1.jpg jpg 29962 325 508 IMAGE-DOWNSAMPLED 1-s2.0-S0926860X2300412X-gr2.jpg https://s3-eu-west-1.amazonaws.com/prod-ucs-content-store-eu-west/content/pii:S0926860X2300412X/gr2/DOWNSAMPLED/image/jpeg/c301b8a7bca05680578eb7d89e1e9f63/gr2.jpg gr2 gr2.jpg jpg 28865 295 516 IMAGE-DOWNSAMPLED 1-s2.0-S0926860X2300412X-gr1.jpg https://s3-eu-west-1.amazonaws.com/prod-ucs-content-store-eu-west/content/pii:S0926860X2300412X/gr1/DOWNSAMPLED/image/jpeg/46fa4636f90276acfe6a759d8c0c7f75/gr1.jpg gr1 gr1.jpg jpg 34738 295 395 IMAGE-DOWNSAMPLED 1-s2.0-S0926860X2300412X-gr11.sml https://s3-eu-west-1.amazonaws.com/prod-ucs-content-store-eu-west/content/pii:S0926860X2300412X/gr11/THUMBNAIL/image/gif/64a2605d3af8180b17f9bfcd3e192166/gr11.sml gr11 gr11.sml sml 7029 164 209 IMAGE-THUMBNAIL 1-s2.0-S0926860X2300412X-ga1.sml https://s3-eu-west-1.amazonaws.com/prod-ucs-content-store-eu-west/content/pii:S0926860X2300412X/ga1/THUMBNAIL/image/gif/e2259d3c353bba46770d7c5ff3601083/ga1.sml ga1 true ga1.sml sml 7295 125 219 IMAGE-THUMBNAIL 1-s2.0-S0926860X2300412X-gr6.sml https://s3-eu-west-1.amazonaws.com/prod-ucs-content-store-eu-west/content/pii:S0926860X2300412X/gr6/THUMBNAIL/image/gif/aeca06f4e855ee242239a151ee05f6f2/gr6.sml gr6 gr6.sml sml 8528 164 212 IMAGE-THUMBNAIL 1-s2.0-S0926860X2300412X-gr7.sml https://s3-eu-west-1.amazonaws.com/prod-ucs-content-store-eu-west/content/pii:S0926860X2300412X/gr7/THUMBNAIL/image/gif/7675c251ccab91dc1a34f3962b81f0b6/gr7.sml gr7 gr7.sml sml 7238 164 210 IMAGE-THUMBNAIL 1-s2.0-S0926860X2300412X-gr14.sml https://s3-eu-west-1.amazonaws.com/prod-ucs-content-store-eu-west/content/pii:S0926860X2300412X/gr14/THUMBNAIL/image/gif/868e7f93fb0029ca68a5c52c8730e70e/gr14.sml gr14 gr14.sml sml 6031 149 219 IMAGE-THUMBNAIL 1-s2.0-S0926860X2300412X-gr15.sml https://s3-eu-west-1.amazonaws.com/prod-ucs-content-store-eu-west/content/pii:S0926860X2300412X/gr15/THUMBNAIL/image/gif/33ddd13dbbf728108af6dcf061091fd1/gr15.sml gr15 gr15.sml sml 10293 161 219 IMAGE-THUMBNAIL 1-s2.0-S0926860X2300412X-gr12.sml https://s3-eu-west-1.amazonaws.com/prod-ucs-content-store-eu-west/content/pii:S0926860X2300412X/gr12/THUMBNAIL/image/gif/9846fbb26787879c0da529d29a98f081/gr12.sml gr12 gr12.sml sml 6951 164 211 IMAGE-THUMBNAIL 1-s2.0-S0926860X2300412X-gr13.sml https://s3-eu-west-1.amazonaws.com/prod-ucs-content-store-eu-west/content/pii:S0926860X2300412X/gr13/THUMBNAIL/image/gif/3a82f8c34bd74aa18ff6e6fdbace9c44/gr13.sml gr13 gr13.sml sml 13489 164 211 IMAGE-THUMBNAIL 1-s2.0-S0926860X2300412X-gr10.sml https://s3-eu-west-1.amazonaws.com/prod-ucs-content-store-eu-west/content/pii:S0926860X2300412X/gr10/THUMBNAIL/image/gif/01e48c0941151c4a22173964ed1a28ac/gr10.sml gr10 gr10.sml sml 6702 164 210 IMAGE-THUMBNAIL 1-s2.0-S0926860X2300412X-gr4.sml https://s3-eu-west-1.amazonaws.com/prod-ucs-content-store-eu-west/content/pii:S0926860X2300412X/gr4/THUMBNAIL/image/gif/e5146c668dfcdb196b3c61f7b704597e/gr4.sml gr4 gr4.sml sml 9246 56 219 IMAGE-THUMBNAIL 1-s2.0-S0926860X2300412X-gr3.sml https://s3-eu-west-1.amazonaws.com/prod-ucs-content-store-eu-west/content/pii:S0926860X2300412X/gr3/THUMBNAIL/image/gif/9dc5a9a4feba532855564966f9062524/gr3.sml gr3 gr3.sml sml 7333 164 219 IMAGE-THUMBNAIL 1-s2.0-S0926860X2300412X-gr5.sml https://s3-eu-west-1.amazonaws.com/prod-ucs-content-store-eu-west/content/pii:S0926860X2300412X/gr5/THUMBNAIL/image/gif/7305848add1124efb5e2c2c1c3f3f015/gr5.sml gr5 gr5.sml sml 15992 127 219 IMAGE-THUMBNAIL 1-s2.0-S0926860X2300412X-gr8.sml https://s3-eu-west-1.amazonaws.com/prod-ucs-content-store-eu-west/content/pii:S0926860X2300412X/gr8/THUMBNAIL/image/gif/20e6590791492535cf30ea0eb2fda11a/gr8.sml gr8 gr8.sml sml 8803 164 199 IMAGE-THUMBNAIL 1-s2.0-S0926860X2300412X-gr9.sml https://s3-eu-west-1.amazonaws.com/prod-ucs-content-store-eu-west/content/pii:S0926860X2300412X/gr9/THUMBNAIL/image/gif/b851485bf7b4281246b164d6dd37b313/gr9.sml gr9 gr9.sml sml 8249 164 214 IMAGE-THUMBNAIL 1-s2.0-S0926860X2300412X-sc1.sml https://s3-eu-west-1.amazonaws.com/prod-ucs-content-store-eu-west/content/pii:S0926860X2300412X/sc1/THUMBNAIL/image/gif/d28db83441d8d014d77b381ee4e358c6/sc1.sml sc1 sc1.sml sml 6103 140 219 IMAGE-THUMBNAIL 1-s2.0-S0926860X2300412X-gr2.sml https://s3-eu-west-1.amazonaws.com/prod-ucs-content-store-eu-west/content/pii:S0926860X2300412X/gr2/THUMBNAIL/image/gif/e21ca85fb9d58fba3278d8096c89ead1/gr2.sml gr2 gr2.sml sml 5498 125 219 IMAGE-THUMBNAIL 1-s2.0-S0926860X2300412X-gr1.sml https://s3-eu-west-1.amazonaws.com/prod-ucs-content-store-eu-west/content/pii:S0926860X2300412X/gr1/THUMBNAIL/image/gif/0342b7bf293d8dfd97af84841aab891a/gr1.sml gr1 gr1.sml sml 9050 163 219 IMAGE-THUMBNAIL 1-s2.0-S0926860X2300412X-gr11_lrg.jpg https://s3-eu-west-1.amazonaws.com/prod-ucs-content-store-eu-west/content/pii:S0926860X2300412X/HIGHRES/image/jpeg/0623b401ee5f2155d19ad7b86722f23d/gr11_lrg.jpg gr11 gr11_lrg.jpg jpg 179060 1371 1746 IMAGE-HIGH-RES 1-s2.0-S0926860X2300412X-ga1_lrg.jpg https://s3-eu-west-1.amazonaws.com/prod-ucs-content-store-eu-west/content/pii:S0926860X2300412X/HIGHRES/image/jpeg/c34114a566a65fd18d5ee9fa4aeebf3d/ga1_lrg.jpg ga1 true ga1_lrg.jpg jpg 115500 886 1549 IMAGE-HIGH-RES 1-s2.0-S0926860X2300412X-gr6_lrg.jpg https://s3-eu-west-1.amazonaws.com/prod-ucs-content-store-eu-west/content/pii:S0926860X2300412X/HIGHRES/image/jpeg/a54979128263e199e0e256f6d361b6f3/gr6_lrg.jpg gr6 gr6_lrg.jpg jpg 206007 1351 1746 IMAGE-HIGH-RES 1-s2.0-S0926860X2300412X-gr7_lrg.jpg https://s3-eu-west-1.amazonaws.com/prod-ucs-content-store-eu-west/content/pii:S0926860X2300412X/HIGHRES/image/jpeg/6178dbd23a7d1e566008a56b38305348/gr7_lrg.jpg gr7 gr7_lrg.jpg jpg 177251 1364 1746 IMAGE-HIGH-RES 1-s2.0-S0926860X2300412X-gr14_lrg.jpg https://s3-eu-west-1.amazonaws.com/prod-ucs-content-store-eu-west/content/pii:S0926860X2300412X/HIGHRES/image/jpeg/0167e876574af6668732042d3919fbb6/gr14_lrg.jpg gr14 gr14_lrg.jpg jpg 280381 1571 2304 IMAGE-HIGH-RES 1-s2.0-S0926860X2300412X-gr15_lrg.jpg https://s3-eu-west-1.amazonaws.com/prod-ucs-content-store-eu-west/content/pii:S0926860X2300412X/HIGHRES/image/jpeg/9d047cfc2575b9d1c57d14cb622ab893/gr15_lrg.jpg gr15 gr15_lrg.jpg jpg 307268 1281 1746 IMAGE-HIGH-RES 1-s2.0-S0926860X2300412X-gr12_lrg.jpg https://s3-eu-west-1.amazonaws.com/prod-ucs-content-store-eu-west/content/pii:S0926860X2300412X/HIGHRES/image/jpeg/a8256771a5560bf8a105a30b6d8d29db/gr12_lrg.jpg gr12 gr12_lrg.jpg jpg 162539 1358 1746 IMAGE-HIGH-RES 1-s2.0-S0926860X2300412X-gr13_lrg.jpg https://s3-eu-west-1.amazonaws.com/prod-ucs-content-store-eu-west/content/pii:S0926860X2300412X/HIGHRES/image/jpeg/452f5107eb85e9d7494b902a6323b4b0/gr13_lrg.jpg gr13 gr13_lrg.jpg jpg 392670 1355 1746 IMAGE-HIGH-RES 1-s2.0-S0926860X2300412X-gr10_lrg.jpg https://s3-eu-west-1.amazonaws.com/prod-ucs-content-store-eu-west/content/pii:S0926860X2300412X/HIGHRES/image/jpeg/37e603dbdd7dd497d14a5d3caf045f3d/gr10_lrg.jpg gr10 gr10_lrg.jpg jpg 162264 1362 1746 IMAGE-HIGH-RES 1-s2.0-S0926860X2300412X-gr4_lrg.jpg https://s3-eu-west-1.amazonaws.com/prod-ucs-content-store-eu-west/content/pii:S0926860X2300412X/HIGHRES/image/jpeg/1ad28f1083a3edf8f158ee7fa77f3bd3/gr4_lrg.jpg gr4 gr4_lrg.jpg jpg 298466 909 3575 IMAGE-HIGH-RES 1-s2.0-S0926860X2300412X-gr3_lrg.jpg https://s3-eu-west-1.amazonaws.com/prod-ucs-content-store-eu-west/content/pii:S0926860X2300412X/HIGHRES/image/jpeg/97b88562a612520a9ac85a5d18db3508/gr3_lrg.jpg gr3 gr3_lrg.jpg jpg 165171 1306 1746 IMAGE-HIGH-RES 1-s2.0-S0926860X2300412X-gr5_lrg.jpg https://s3-eu-west-1.amazonaws.com/prod-ucs-content-store-eu-west/content/pii:S0926860X2300412X/HIGHRES/image/jpeg/513dab0f6d2bb581b989aefa51f78727/gr5_lrg.jpg gr5 gr5_lrg.jpg jpg 682728 2079 3575 IMAGE-HIGH-RES 1-s2.0-S0926860X2300412X-gr8_lrg.jpg https://s3-eu-west-1.amazonaws.com/prod-ucs-content-store-eu-west/content/pii:S0926860X2300412X/HIGHRES/image/jpeg/718f438b7dadae74b606a3a10931b037/gr8_lrg.jpg gr8 gr8_lrg.jpg jpg 221368 1435 1746 IMAGE-HIGH-RES 1-s2.0-S0926860X2300412X-gr9_lrg.jpg https://s3-eu-west-1.amazonaws.com/prod-ucs-content-store-eu-west/content/pii:S0926860X2300412X/HIGHRES/image/jpeg/ddf18bbaadb28d097c03e77000508119/gr9_lrg.jpg gr9 gr9_lrg.jpg jpg 190978 1339 1746 IMAGE-HIGH-RES 1-s2.0-S0926860X2300412X-sc1_lrg.jpg https://s3-eu-west-1.amazonaws.com/prod-ucs-content-store-eu-west/content/pii:S0926860X2300412X/HIGHRES/image/jpeg/44a7b7f1358df2d7096e61f3627eb4aa/sc1_lrg.jpg sc1 sc1_lrg.jpg jpg 152853 1438 2245 IMAGE-HIGH-RES 1-s2.0-S0926860X2300412X-gr2_lrg.jpg https://s3-eu-west-1.amazonaws.com/prod-ucs-content-store-eu-west/content/pii:S0926860X2300412X/HIGHRES/image/jpeg/141d92c796e6c172fc88cb3b7276dc86/gr2_lrg.jpg gr2 gr2_lrg.jpg jpg 171616 1309 2286 IMAGE-HIGH-RES 1-s2.0-S0926860X2300412X-gr1_lrg.jpg https://s3-eu-west-1.amazonaws.com/prod-ucs-content-store-eu-west/content/pii:S0926860X2300412X/HIGHRES/image/jpeg/a89bddb5a01328c85c7f67ccf4d43dc7/gr1_lrg.jpg gr1 gr1_lrg.jpg jpg 218139 1302 1746 IMAGE-HIGH-RES 1-s2.0-S0926860X2300412X-mmc1.docx https://s3-eu-west-1.amazonaws.com/prod-ucs-content-store-eu-west/content/pii:S0926860X2300412X/mmc1/MAIN/application/vnd.openxmlformats-officedocument.wordprocessingml.document/b36e2adf6bc463f3751b3c5bac3b4d36/mmc1.docx mmc1 mmc1.docx docx 947542 APPLICATION 1-s2.0-S0926860X2300412X-si0001.svg https://s3-eu-west-1.amazonaws.com/prod-ucs-content-store-eu-west/content/pii:S0926860X2300412X/image/svg+xml/c9131bb931762292f102525e24109c3b/si0001.svg si0001 si0001.svg svg 6759 ALTIMG 1-s2.0-S0926860X2300412X-am.pdf https://s3-eu-west-1.amazonaws.com/prod-ucs-content-store-eu-west/content/egi:101W5C9H0KV/MAIN/application/pdf/f2e58d62a5ae1f74b940e485bb85dfd0/am.pdf am am.pdf pdf false 1272304 AAM-PDF APCATA 119432 119432 S0926-860X(23)00412-X 10.1016/j.apcata.2023.119432 Elsevier B.V. Fig. 1 N2 adsorption–desorption isotherms of g-C3N4 (a), eg-C3N4 (b), Zn8Nb2Cl/g-C3N4-400 (c), Zn8Nb2Cl/eg-C3N4-400 (d), Zn8Nb2Cl/eg-C3N4-400-R (e), Zn8Nb2Cl/ eg-C3N4-300 (f), and Zn8Nb2Cl/eg-C3N4-500 (g). Fig. 1 Fig. 2 The corresponding pore size distributions of g-C3N4 (a), eg-C3N4 (b), Zn8Nb2Cl/g-C3N4-400 (c), Zn8Nb2Cl/eg-C3N4-400 (d), Zn8Nb2Cl/eg-C3N4-400-R (e), Zn8Nb2Cl/eg-C3N4-300 (f), and Zn8Nb2Cl/eg-C3N4-500 (g). Fig. 2 Fig. 3 XRD patterns of g-C3N4 (a), eg-C3N4 (b), NbCl5/eg-C3N4 (c), ZnCl2/eg-C3N4 (d), and Zn8Nb2Cl/eg-C3N4-400 (e) materials. Fig. 3 Fig. 4 SEM images of g-C3N4 (A), eg-C3N4 (B), and Zn8Nb2Cl/eg-C3N4-400 (C). Fig. 4 Fig. 5 EDX mapping of Zn8Nb2Cl/eg-C3N4-400. Fig. 5 Fig. 6 FT-IR spectra of g-C3N4 (a), eg-C3N4 (b), NbCl5/eg-C3N4 (c), ZnCl2/eg-C3N4 (d), and Zn8Nb2Cl/eg-C3N4-400 (e) materials. Fig. 6 Fig. 7 XPS spectra of eg-C3N4 (a), NbCl5/eg-C3N4 (b), ZnCl2/eg-C3N4 (c), Zn8Nb2Cl/eg-C3N4-300 (d), Zn8Nb2Cl/eg-C3N4-400 (e), and Zn8Nb2Cl/eg-C3N4-500 (f) materials. Fig. 7 Fig. 8 N 1 s spectra of eg-C3N4 (a), NbCl5/eg-C3N4 (b), ZnCl2/eg-C3N4 (c), Zn8Nb2Cl/eg-C3N4-300 (d), Zn8Nb2Cl/eg-C3N4-400 (e), and Zn8Nb2Cl/eg-C3N4-500 (f) materials. Fig. 8 Fig. 9 Zn 2p spectra of ZnCl2/eg-C3N4 (a), Zn8Nb2Cl/eg-C3N4-300 (b), Zn8Nb2Cl/eg-C3N4-400 (c), Zn8Nb2Cl/eg-C3N4-500 (d), Zn8Nb2Cl/eg-C3N4-400-R (e), and ZnCl2 (f) materials. Fig. 9 Fig. 10 Nb 3d spectra of NbCl5/eg-C3N4 (a), Zn8Nb2Cl/eg-C3N4-300 (b), Zn8Nb2Cl/eg-C3N4-400 (c), Zn8Nb2Cl/eg-C3N4-500 (d), and Zn8Nb2Cl/eg-C3N4-400-R (e) materials. Fig. 10 Fig. 11 CO2-TPD profiles of eg-C3N4 and supported materials. Fig. 11 Fig. 12 NH3-TPD profiles of eg-C3N4 and supported materials. Fig. 12 Fig. 13 Recycling experiments of Zn8Nb2Cl/eg-C3N4-300 and Zn8Nb2Cl/eg-C3N4-400 catalysts in transesterification of EC with CH3OH. Reaction conditions: T = 120 °C, t = 4 h, n(EC) = 25 mmol, n(CH3OH) = 250 mmol, and W catal. = 100 mg. Fig. 13 Fig. 14 Influence of reaction temperature on the catalytic performance of Zn8Nb2Cl/eg-C3N4. Reaction conditions: t = 4 h, n(EC) = 25 mmol, n(CH3OH) = 250 mmol, and W catal. = 100 mg. Fig. 14 Fig. 15 Effects of reaction time (A) and feeding dosage of catalyst (B) on the catalytic performance of Zn8Nb2Cl/eg-C3N4. Reaction conditions: T = 120 °C, n(EC) = 25 mmol, n(CH3OH) = 250 mmol, W catal. = 100 mg (A) and t = 4 h (B). Fig. 15 Scheme 1 A probable catalytic mechanism of ZnNbCl/eg-C3N4 in transesterification of EC with CH3OH. Scheme 1 Table 1 Surface areas and porous properties of various materials. Table 1 Material S BET (m2·g−1) Pore size (nm) a Pore volume (cm3·g−1) g-C3N4 17 3.5 0.06 eg-C3N4 57 3.6 0.31 Zn8Nb2Cl/g-C3N4-400 18 3.8 0.03 Zn8Nb2Cl/eg-C3N4-300 22 2.9 0.04 Zn8Nb2Cl/eg-C3N4-400 34 3.8 0.07 Zn8Nb2Cl/eg-C3N4-500 62 3.9 0.12 Zn8Nb2Cl/eg-C3N4-400-R 35 3.7 0.06 a Determined by desorption branches. Table 2 Chemical composition and distributions of various nitrogen species of the materials a . Table 2 Material Composition Na (%) Nb (%) Nc (%) eg-C3N4 C0.79N1O0.041 72.1 16.3 11.6 NbCl5/eg-C3N4-400 C0.82N1Nb0.015 66.2 23.7 10.1 ZnCl2/eg-C3N4-400 C0.89N1Zn0.031 65.4 25.2 9.4 Zn8Nb2Cl/eg-C3N4-300 C0.95N1Zn0.033Nb0.003 64.3 27.7 8.0 Zn8Nb2Cl/eg-C3N4-400 C0.90N1Zn0.037Nb0.008 63.2 30.1 6.7 Zn8Nb2Cl/eg-C3N4-500 C0.98N1Zn0.042Nb0.018 60.6 29.8 9.6 Zn8Nb2Cl/eg-C3N4-400-R C0.87N1Zn0.040Nb0.006 63.7 30.2 6.1 Zn8Nb2Cl/eg-C3N4-300-R C0.90N1Zn0.012Nb0.005 65.5 27.9 6.6 a Determined by XPS survey and N 1 s fine spectra. Table 3 Catalytic performances of various catalysts in transesterification reactions of EC with CH3OH a . Table 3 Entry Catalyst Con. (%) Sel. (%) Yield (%) 1 – 23.2 100 23.2 2 eg-C3N4 30.7 100 37.0 4 ZnCl2 81.4 100 81.4 5 NbCl5 33.8 100 33.8 6 ZnCl2/eg-C3N4 23.0 100 23.0 7 NbCl5/eg-C3N4 9.7 100 9.7 8 Zn8Nb2Cl/eg-C3N4 55.9 100 55.9 9 Zn6Nb4Cl/eg-C3N4 49.5 100 49.5 10 Zn4Nb6Cl/eg-C3N4 43.5 100 43.5 11 Zn2Nb8Cl/eg-C3N4 11.4 100 11.4 12 Zn8Nb2Cl/g-C3N4 40.8 100 40.8 a Reaction conditions: T = 120 °C, t = 4 h, n(EC) = 25 mmol, n(CH3OH) = 250 mmol, and W catal. = 100 mg. Table 4 Catalytic performances of various Zn8Nb2Cl/eg-C3N4-T catalysts in transesterification reactions of EC with CH3OH a . Table 4 Catalyst Con. (%) Sel. (%) Yield (%) Zn8Nb2Cl/eg-C3N4-300 59.1 100 59.1 Zn8Nb2Cl/eg-C3N4-400 55.9 100 50.6 Zn8Nb2Cl/eg-C3N4-500 47.1 100 37.8 a Reaction conditions: T = 120 °C, t = 4 h, n(EC) = 25 mmol, n(CH3OH) = 250 mmol, and W catal. = 100 mg. Table 5 Comparison of the catalytic performances of heterogeneous catalysts for the transesterification of EC with CH3OH to DMC. Table 5 Catalyst W catal. (g) n EC (mmol) n CH3OH (mmol) T (°C) t (h) Conv. (%) Sel (%) CaO/carbon [10] 1.5 100 800 65 20 81.2 99.3 SrO/CeO2 [53] –e 25 200 150 5 72.0 62.5 PILs-FLa [6] – – – 90 5 93.7 100 Co-Ca-Zrb [54] – – – 60 5 84.9 92.2 poly[VRIm-VBA-DVIm]− 2.5%c [3] – 10 100 110 4 65.4 91.1 KAlO2/γ-Al2O3 [5] 0.22 80 800 100 1.3 80.2 98.9 CeO2-Tyrsd [55] 0.1 25 250 140 3 80.9 60.1 Zn8Nb2Cl/eg-C3N4 0.1 25 250 140 4 80.1 100 a Poly-ionic liquid–solid base catalyst b Co-modified CaO–ZrO2 mixed oxides c Swelling polyionic liquid d CeO2 nanoparticles prepared by using tyrosine a precipitant e Not available Acid–base bifunctional ZnNbCl/eg-C3N4 materials towards catalytic synthesis of dimethyl carbonate via transesterification of ethylene carbonate Lin-Zhi Yu Investigation Writing – original draft Xiao-Hua Sun Investigation Formal analysis Fei Wang Validation Bing Xue Supervision ⁎ 1 Jie Xu Conceptualization Writing – review & editing ⁎ 2 Jiangsu Key Laboratory of Advanced Catalytic Materials and Technology, School of Petrochemical Engineering, Changzhou University, Gehu Middle Road 21, Changzhou, Jiangsu 213164, PR China Jiangsu Key Laboratory of Advanced Catalytic Materials and Technology, School of Petrochemical Engineering, Changzhou University Gehu Middle Road 21 Changzhou Jiangsu 213164 PR China Jiangsu Key Laboratory of Advanced Catalytic Materials and Technology, School of Petrochemical Engineering, Changzhou University, Gehu Middle Road 21, Changzhou, Jiangsu 213164, PR China ⁎ Corresponding authors. 1 ORCID: 0000–0001-6740–4665 2 ORCID: 0000–0002-2413–8405 The catalytic transesterification reaction between ethylene carbonate (EC) with methanol is a sustainable approach for the production of dimethyl carbonate (DMC). In this work, exfoliated carbon nitride (eg-C3N4) was supported with ZnCl2 and NbCl5. The synthesized materials (ZnNbCl/eg-C3N4) were analyzed by XRD, N2 adsorption–desorption, FT-IR, XPS, SEM, TG, CO2-TPD, and NH3-TPD. The eg-C3N4 could disperse well Zn2+ and Nb5+ species via nitrogen-containing groups. The combined Zn2+ and Nb5+ components enhanced the alkaline strength of eg-C3N4 and introduced acidic sites, enabling ZnNbCl/eg-C3N4 as solid-base bifunctional catalysts. As heterogeneous catalysts, ZnNbCl/eg-C3N4 exhibited superior activity to ZnCl2/eg-C3N4 or NbCl5/eg-C3N4 in the transesterification of EC. At 140 °C of reaction temperature, EC conversion and DMC selectivity reached 80.1% and 100%, respectively. The catalysts showed good recycling performance and were also compared with other recently reported heterogeneous catalysts. Graphical Abstract ga1 Keywords Graphitic carbon nitride (g-C3N4) Base catalyst Transesterification Dimethyl carbonate Data availability Data will be made available on request. 1 Introduction As the simplest organic carbonate, dimethyl carbonate (DMC) has multiple unique physicochemical properties and versatile reactivity [1]. DMC can be applied as green carbonylation and methylation reagents to substitute traditional hazardous phosgene and dimethyl sulfate, respectively [2]. Also, owing to its good biodegradability, low toxicity, and excellent solubility [3], DMC is extensively used as an electrolyte in Li-based batteries, and a green octane booster for gasoline [1,4]. Conventionally, DMC is produced by phosgenation of methanol, which is now mostly phased out because of its serious corrosiveness to equipment along with severe environmental pollution [5,6]. Oxidative carbonylation of methanol is also a dominant industrial route to produce DMC. However, the catalysts thereof commonly suffered a decline in selectivity to DMC after consecutive recycles [1]. Alternatively, transesterification of ethylene carbonate (EC) or propylene carbonate (PC) with methanol has been proposed as a promising and eco-friendly synthetic route for DMC, as the process can be operated under milder conditions and has no toxic phosgene or CO involved [7]. Meanwhile, ethylene glycol (EG), as the co-product generated in the transesterification route, is also an important bulk chemical. To date, a large number of catalysts have been reported for the transesterification reaction. Homogeneous catalysts represented by sodium methoxide and pyridine are very catalytically active but suffer from disadvantages in catalyst recovery and side reactions including decomposition and polymerization of the products [8,9]. On the other hand, various heterogeneous have been reported for catalytic transesterification in the last five years. Despite the advances, most heterogeneous catalysts generally need to be operated under higher reaction temperatures (>140 °C), less dosage of substrates, and even harsh reaction conditions, which undoubtedly greatly hinders their further practical applications. In view of both basic research and sustainable chemistry, it is highly desired to design a heterogeneous catalyst that can offer high catalytic performance under mild conditions [7,10]. In the last decade, graphitic carbon nitride (g-C3N4) has emerged as s novel functional material and has been widely applied in many fields [11–17]. In thermal catalysis, owing to its abundant nitrogen-containing functionalities, g-C3N4 is a typical solid base and can promote Knoevenagel condensation [18,19] and transesterification reactions [7,20]. More importantly, such nitrogen-containing groups also enable g-C3N4 to anchor and disperse some metal species including K [21,22], Zn [23], Pd [24], etc. It should be stressed that the catalytic activity of g-C3N4 is largely related to its porosity and specific surface area. The g-C3N4 materials directly synthesized by thermal condensation own very low surface areas and usually show extremely low catalytic activity [20,25]. In addition, in the case of the transesterification of EC with methanol, despite rich nitrogen species, the total basicity strength of g-C3N4 is also limited [21,25]. In this sense, how to utilize this solid base of g-C3N4 and enhance its catalytic activity is still a challenge for catalytic transesterification and even wide base-mediated reactions. Zn- and Nb-containing compounds, including ZnO [26], zinc(II) acetate [27], Nb2O5 [28,29], and the organic complexes [30], are typical acidic catalysts that have been intensively applied in the transesterification and esterification reactions. However, most Zn- and Nb-containing complexes are homogeneous catalysts in these liquid-phase reactions [27,30], while the catalytic activity achieved on unsupported ZnO and Nb2O5 catalysts was limited. Since g-C3N4 has alkaline property and the ability to disperse many metal species, in this work, exfoliated g-C3N4 material was prepared and utilized as a catalyst support for ZnCl2 and NbCl5. The eg-C3N4 could disperse well the Zn2+ and Nb5+ species via nitrogen-containing groups. More importantly, the incorporation of metal species enhanced the alkaline strength of eg-C3N4 and meanwhile introduced acidic sites, enabling ZnNbCl/eg-C3N4 as solid-base bifunctional catalysts. As heterogeneous catalysts, ZnNbCl/eg-C3N4 exhibited superior catalytic activity to ZnCl2/eg-C3N4 or NbCl5/eg-C3N4 in the transesterification between EC and CH3OH. At 140 °C of reaction temperature and 4 h of reaction time, the conversion of EC and selectivity to DMC were up to 80.1% and 100%, respectively. 2 Experimental 2.1 Material preparation 2.1.1 Preparation of g-C3N4 and eg-C3N4 Dicyandiamide (DCDA, 5 g) was put into a ceramic crucible and heated to 550 °C with a heating slope of 3 °C·min−1 and then kept at this temperature for another 4 h. The synthesized yellow solid was g-C3N4. The exfoliated g-C3N4 was prepared through thermal treatment. Namely, g-C3N4 (2 g) was heated at 600 °C for 2 h and the resultant powder was designated as eg-C3N4. 2.1.2 Preparation of ZnNbCl/eg-C3N4 ZnCl2 (x = 0–10 mmol) and NbCl5 (y = 0–10 mmol) were dissolved into 20 mL of anhydrous ethanol. eg-C3N4 (1.0 g) was added to the solution and stirred for 1 h. Afterwards, the suspension was heated at 50 °C until the removal of ethanol. The ground powder was transferred into a tubular furnace (N2 atmosphere, 20 mL·min−1), and heated from room temperature to 300–500 °C for 3 h (a heating slope of 2 °C·min−1). The obtained sample was collected and designated as Zn x Nb y Cl/eg-C3N4-T, where x and y indicated the molar amounts (the total of x and y was 10) of ZnCl2 and NbCl5, respectively, and T stood for the heating temperatures. Unless other specified, T was 400 °C. For instance, the Zn8Nb2Cl/eg-C3N4-500 material meant the material was prepared using 8 mmol of ZnCl2, 2 mmol NbCl5, and 1.0 g of eg-C3N4 and was treated under 500 °C. 2.2 Material characterization The materials were analyzed N2 adsorption–desorption, X-ray diffraction (XRD), Fourier transform infrared (FT-IR) spectroscopy, X-ray photoelectron spectroscopy (XPS), thermogravimetry (TG), scanning electron microscopy (SEM), NH3 temperature-programmed desorption (NH3-TPD), and CO2 temperature-programmed desorption (CO2-TPD). The detailed analytic methods and information of instruments are given in the supplementary material. 2.3 Catalytic evaluation Transesterification of EC and CH3OH was conducted in an autoclave (25 mL). CH3OH (250 mmol), EC (25 mmol), and the pre-dried catalyst (0.1 g) were added into the autoclave and mixed well. After being filled with nitrogen gas up to ca. 0.6 MPa, the autoclave was heated at 120 °C for 4 h under stirring. After the completion of the reaction (i.e. 4 h), the autoclave was immersed in ice water to cool down and then exhausted slowly. The reaction mixture was centrifugated and analyzed by GC (SP-6890) equipped with a SE-54 capillary column and FID. Owing to the higher stoichiometric of EC than CH3OH adopted in the reaction, the catalytic conversion was calculated based on EC. The detailed EC conversion and selectivity of DMC (target molecule) were calculated by an area-normalization method, and the calculation equations are as follows: C o n v . = A DMC × f DMC + A HEMC × f HEMC A EC × f EC + A DMC × f DMC + A HEMC × f HEMC S e l . = A DMC × f DMC A DMC × f DMC + A HEMC × f HEMC , where A and f are the peak area and response factor of each component detected by GC. HEMC is the abbreviation of 2-hydroxyethyl methyl carbonate as a byproduct. For the recycling experiment, the reaction mixture was filtrated, and the filtrated catalyst was washed with ethanol (95 wt%, a.q.) three times. After drying under 80 °C for 2 h, the recycled catalyst was used for the next catalytic run without the addition of the fresh catalyst. 3 Results and discussions 3.1 Materials characterization Fig. 1 shows the N2 adsorption-desorption isotherms of g-C3N4, eg-C3N4, and the supported materials. All the samples exhibited type-IV isotherms along with H3 hysteretic loops in the relative pressures (p/p 0) between 0.70 and 0.99. The adsorption quantity in g-C3N4 was very low, suggesting that the materials had almost no accessible porous structure. Similarly, the supported material (Zn8Nb2Cl/g-C3N4-400) has also a very low adsorption quantity. In comparison, eg-C3N4 showed a pronounced hysteresis loop, indicative of mesoporous structure. Apparently, the thermal exfoliation of g-C3N4 effectively enhanced the surface areas. The reason for this variation lies in a certain amount of nitrogen-containing species undergoing decomposition during the thermal treatment, thus generating some interparticle voids [31,32]. The pore size distributions of the samples are presented in Fig. 2. The g-C3N4, eg-C3N4, and supported Zn8Nb2Cl materials had similar average pore sizes (2.9–3.8 nm). Moreover, the pore sizes were evenly distributed. Table 1 lists the specific surface areas and porous properties of the materials. The pristine g-C3N4 sample had a very low surface area (17 m2·g−1) and pore volume (0.06 cm3·g−1). As expected, eg-C3N4 material had a larger specific surface area as well as pore volume than g-C3N4. In addition, the surface areas of Zn8Nb2Cl/eg-C3N4 materials are related to the heating temperature. Specifically, as the temperature of Zn8Nb2Cl/eg-C3N4-T was elevated, the surface areas were increased gradually. The introduction of the ZnNbCl component inevitably blocked partial pores of eg-C3N4 support. However, because of heat treatment, some nitrogen-containing species of eg-C3N4 decomposed especially under high temperatures, and therefore the high surface areas were retrieved. The XRD patterns of g-C3N4, eg-C3N4, NbCl5/eg-C3N4, ZnCl2/eg-C3N4, and Zn8Nb2Cl/eg-C3N4-400 are shown in Fig. 3. The XRD pattern of g-C3N4 displayed an insensitive diffraction peak at 2θ = 27.4° (d spacing of 0.33 nm), attributed to the interlayer stacking of graphitic phase, namely (002) faces [33]. In addition, a weak peak appeared at 12.8° (d = 0.69 nm), corresponding to the intralayer stacking of the graphitic phase, i.e. (100) faces [34]. The XRD pattern of eg-C3N4 showed a clear shift of (002) diffraction line towards higher 2θ values, suggesting a lower interlayer spacing in C3N4 than g-C3N4. This is due to the thermal compression of graphitic sheets from g-C3N4 to eg-C3N4, which was also reported previously by Dong et al. [35]. Compared with the eg-C3N4 material, the positions of (002) peaks of the supported materials showed no apparent variation, while the overall intensities of these peaks were weakened. The change could result from the partial collapse of the graphitic stacking structure of eg-C3N4 during the heat treatment with ZnCl2 and NbCl5. Such a phenomenon has also been previously observed in the work involving metal-doped g-C3N4 materials [21,36,37]. Notwithstanding, the graphitic structure of eg-C3N4 remained after the loading of the ZnNbCl component. The XRD patterns of ZnNbCl/eg-C3N4 materials adopting different heating temperatures and different Zn/Nb ratios were shown in Fig. S1, and Fig. S2, respectively. Like those of the eg-C3N4 support, the ZnNbCl/eg-C3N4 materials revealed diffraction peaks at 2θ = 27.7° and 12.8°. It is worth mentioning that the characteristic diffraction peaks of ZnCl2 and NbCl5 were not detected in Fig. S1, implying that these supported components might be dispersed on the support. The thermal stability of the materials was examined by TG. As illustrated in Fig. S3, the TG curves of both the g-C3N4 and eg-C3N4 materials were stable below 600 °C, without any significant weight loss. Above the temperature, the two TG curves showed drastic declines. As the temperature was ca. 760 °C, there was almost no weight remaining. The weight loss occurring in this range was due to the decomposition of the C–N skeleton of the g-C3N4 framework [38]. Compared with that of eg-C3N4, the weight loss of Zn8Nb2Cl/eg-C3N4-400 occurred at lower temperatures (ca. 450 °C). Similar results were also previously revealed in the work involving metal-doped g-C3N4 materials [39,40], where metal cation interacted with nitrogen atoms of g-C3N4 and meanwhile weakened the thermal stability of the original C–N bonds [11]. That is, in this work, the incorporation of ZnNbCl modified the bonding states of the original eg-C3N4 support, also verifying that ZnNbCl was not merely physically loaded on eg-C3N4. The morphologies of the materials were analyzed by SEM. The SEM image ( Fig. 4) of g-C3N4 revealed agglomerated bulky particles, while eg-C3N4 consisted of a large number of slices, much smaller than g-C3N4 particles. The variation in morphology was due to the exfoliation procedure of g-C3N4, which initiated the partial decomposition of nitrogen-containing groups of g-C3N4. Similar SEM images have also been reported in previous work associated with exfoliated g-C3N4 materials [32,41]. The SEM image of Zn8Nb2Cl/eg-C3N4-400 presented slices like eg-C3N4-400 and there was no clear agglomeration of slices. Fig. 5 is the energy dispersive X-ray spectroscopy (EDX) mapping of Zn8Nb2Cl/eg-C3N4-400, and the corresponding elemental distributions are shown in Fig. S4. The elemental images indicate that C, N, Zn, and Nb elements were quite distributed on the material. FT-IR spectroscopy was used to probe the chemical functionalities of the above materials, as shown in Fig. 6. The spectra of g-C3N4, eg-C3N4, and the supported materials exhibited pronounced transmitting bands in three regions. The intensive peaks of 806 cm−1 corresponded to the in-plane deformation vibration (also called breathing mode) of the heptazine motifs, a characteristic FT-IR signal of g-C3N4 [34]. The multiple bands at 1724–1169 cm−1 were assigned to the stretching vibration of aromatic nitrogen-containing heterocycles. The broad bands from 3356 to 2960 cm−1 were associated with the stretching vibration of amino groups and adsorbed water molecules [42]. In comparison with g-C3N4, eg-C3N4, and its supported materials showed a more intensive band at 3265 cm−1, reflecting these materials owned more nitrogen-containing functionalities. Obviously, this is attributed to the larger surface areas of eg-C3N4 materials. The FT-IR spectra of ZnNbCl/eg-C3N4 materials synthesized by different temperatures and Zn/Nb ratios were given in Fig. S5. All the supported materials possessed nearly the same spectra as Zn8Nb2Cl/eg-C3N4-400. XPS was applied to further analyze the surface chemical environment of the above materials. The eg-C3N4 material was dominated by C, N, and O elements ( Fig. 7), and the chemical formula calculated by XPS analysis was C0.79N1O0.041 ( Table 2). The molar ratio of C/N was slightly higher than the value of ideal g-C3N4 (0.75), due to the decomposition of nitrogen-containing fragments in the thermal exfoliation step. The signals of supported metal elements were all detected in the XPS spectra of ZnCl2/eg-C3N4, NbCl5/eg-C3N4, and Zn8Nb2Cl/eg-C3N4 materials. As listed in Table 2, ZnCl2/eg-C3N4 and NbCl5/eg-C3N4 had higher carbon contents than eg-C3N4. As explained above, the introduction of metal components would induce the subsequent decomposition of nitrogen species of eg-C3N4, in agreement with the finding by TG curves (Fig. S3). As described above, the presence of nitrogen-containing groups is responsible for the solid base of g-C3N4 and its derived materials. In order to figure out the detailed distributions of the nitrogen groups, fine N 1 s spectra were recorded. As displayed in Fig. 8, each spectrum could be deconvoluted into three peaks, corresponding to three types of nitrogen atoms (Scheme S1). For eg-C3N4, the primary peak with a binding energy of 398.3 eV was indexed as sp2 nitrogen atoms (Na) in heptazine units [42], accounting for the main proportion of nitrogen species in g-C3N4. The binding energy of 398.9 eV corresponded to the bridging nitrogen atoms (Nb) linking heptazine rings, and the third peak (centered at 400.6 eV) was attributed to uncondensed amino groups (–NH2 or –NH2, Nc) at the edges of graphitic sheets of g-C3N4 [43]. Like that of the bare eg-C3N4 sample, the N 1 s spectra of supported eg-C3N4 materials can also be resolved into three independent peaks. Table 2 summarizes the distribution of the three nitrogen components. The percentages of Na, Nb, and Nc in eg-C3N4 were 72.1%, 16.3%, and 11.6%, respectively. It is noted that Na atoms are highly conjugated in heptazine units and have rarely alkaline properties [44], while the alkaline strength of Nb is higher than Nc [45]. Therein, the alkaline strength and quantity of g-C3N4 and its derived materials were mainly determined by the fractions of Nb species. As shown in Table 2, the ZnCl2/eg-C3N4 and other supported eg-C3N4 materials had higher distributions of Nb than eg-C3N4. As reported in our previous work [45,46], during the heating treatment procedure, the precursors of metal halide (e.g. ZnCl2 and FeCl3) were able to react with terminal amino groups (Nc), thus generating more Nb species. Therefore, it can be reasonably deduced that the supported eg-C3N4 materials had stronger alkaline than the bare material. Besides N 1 s spectra, we also characterized Zn-containing materials in this work and the high-resolution Zn 2p spectra are shown in Fig. 9. All the spectra revealed two peaks at 1044 and 1021 eV, attributed to 2p1/2 and 2p3/2 orbits of Zn element. The spectrum of pure ZnCl2 was also given. One can see that compared with that of ZnCl2, the peak positions of supported Zn-containing materials underwent a distinct shift to lower binding energies, signifying lower positive charges of Zn cation in these materials. This might be probably owing to the interaction of nitrogen of eg-C3N4 with the supported Zn cation, and such d-p interaction [11,39] is beneficial to the stable dispersion of Zn cation on the surface of eg-C3N4 support. Fig. 10 displays the fine Nb 3d spectra of the Nb-containing materials. The peaks centered at 209.1 and 206.4 eV corresponded to 3d3/2 and 3d5/2 orbits of the Nb element. On the other hand, the peak of the 3d5/2 orbit of pure NbCl5 is reported to be located at 208.2 eV [47]. Such shifts toward lower binding energies, like the finding in Zn 2p spectra, also confirmed the interaction between nitrogen species of eg-C3N4 and the supported Nb cation. As evidenced by FT-IR and XPS characterization results, eg-C3N4 and its derived material have rich nitrogen-containing species and therefore are typical solid bases. Regarding this point, CO2-TPD technique was used in order to understand the basicity. The resultant CO2-TPD profiles are depicted in Fig. 11. The eg-C3N4 sample exhibited broad desorption of CO2 ranging from 120 °C to 325 °C, corresponding to weak basic sites on the surface. The ZnCl2/eg-C3N4 material had a very similar peak position (ca. 189 °C) with eg-C3N4. In the case of NbCl5/eg-C3N4, the desorption peak of CO2 was moved towards a higher temperature (230 °C), suggesting the appearance of stronger basic sites in NbCl5/eg-C3N4. Furthermore, compared with the eg-C3N4 materials with single halide, the positions of desorption peak acquired in Zn8Nb2Cl/eg-C3N4 materials showed further enhancement. According to the analytic results of N 1 s, it can be speculated that such enhancement of alkaline strength from eg-C3N4 to Zn8Nb2Cl/eg-C3N4 is owing to the increase of Nb species thereof. Since most Zn2+/Nb5+-containing compounds (NbCl5, ZnCl2, Nb2O5, etc.) are typical acid catalysts, NH3-TPD was further employed to survey the acidity. There was no appreciable desorption peak in the TPD curve of eg-C3N4 ( Fig. 12), indicating no acidic sites in this material. NbCl5/eg-C3N4 had a very weak desorption in the range of 200–300 °C, attributed to the presence of a few weak acidic sites, while ZnCl2/eg-C3N4 showed a more intensive desorption signal. As for Zn8Nb2Cl/eg-C3N4 materials, the desorption peak became much stronger, and the peak positions were ca. 234 °C, corresponding to weak acidic sites. Judging from the CO2-TPD and NH3-TPD profiles, it can be verified that the loading of mixed ZnNbCl component, rather than sole ZnCl2 or NbCl5, effectively enhanced both acidic and basic strength of the eg-C3N4, enabling Zn8Nb2Cl/eg-C3N4 materials as solid-base solid. 3.2 Catalytic performance First, a blank test without any catalyst was performed in the transesterification reaction of EC and CH3OH. As listed in Table 3, the EC conversion was 23.2%, and the product was solely DMC (entry 1). Upon adding 100 mg of eg-C3N4, the conversion was raised to 30.7%. By comparison, under identical reaction conditions, ZnCl2 showed high catalytic activity in the reaction and the EC conversion was 81.4%. Also, the conversion gained in NbCl5 was higher than the value achieved in eg-C3N4. Despite the high conversion, either ZnCl2 or NbCl5 was completely dissolved in the liquid-phase reaction system, and such a homogeneous catalyst is inconvenient to recycle. On the other hand, the supported ZnCl2 and NbCl5 materials showed inferior catalytic activity to ZnCl2 and NbCl5. In sharp contrast, the incorporation of ZnCl2 and NbCl5 on eg-C3N4 brought out remarkable enhancement in catalytic activity (entries 8–10). However, the use of excessive NbCl5 in ZnNbCl/eg-C3N4 resulted in a substantial decline (entry 11); the corresponding EC conversion was almost close to the value obtained in NbCl5/eg-C3N4. Among the various ZnNbCl/eg-C3N4 samples, Zn8Nb2Cl/eg-C3N4 demonstrated the highest activity, affording a DMC yield of 55.9%. In addition, we also tested the Zn8Nb2Cl catalyst supported on g-C3N4. The resultant EC conversion was 40.8% (entry 12), slightly lower than its counterpart, which might be due to the difference in surface areas (Table 1). Table 4 lists the catalytic performances of different Zn8Nb2Cl/eg-C3N4 materials fabricated with various heating temperatures in transesterification reactions. It is seen that the heating temperature had an obvious impact on the final activity of Zn8Nb2Cl/eg-C3N4. The conversion obtained in Zn8Nb2Cl/eg-C3N4-300 was 59.1%; as the temperature was increased, the EC conversion decreased monotonously. However, it should be pointed out that the catalytic data in Table 4 were only collected in the first catalytic run. Fig. 13 shows the recycling performances of various Zn8Nb2Cl/eg-C3N4 catalysts within five consecutive catalytic runs. Despite the higher activity of Zn8Nb2Cl/eg-C3N4-300 in the initial run, the EC conversion of the catalyst showed an apparent decline in the first two running times. After three runs, nearly half the initial conversion dropped. The recycled Zn8Nb2Cl/eg-C3N4-300 and Zn8Nb2Cl/eg-C3N4-400 catalysts after four runs were then analyzed by XPS (Fig. S6–S10). The high-resolution N 1 s, Zn 2p, and Nb 3d spectra showed no significant difference compared with the profiles of the fresh Zn8Nb2Cl/eg-C3N4 catalysts. Nevertheless, in the case of Zn8Nb2Cl/eg-C3N4-300, its content of Zn after several recycling tests declined sharply (Table 2) whereas the Zn content in Zn8Nb2Cl/eg-C3N4-400 showed no clear decrease. On the other hand, as listed in Table 3, ZnCl2 had superior catalytic activity to NbCl5 in this transesterification reaction. According to this analysis, the decrease in activity in recycling experiments can be ascribed to the leaching of the ZnCl2 component. That is, the interaction between Zn and eg-C3N4 support in Zn8Nb2Cl/eg-C3N4-400 would be much steadier than in Zn8Nb2Cl/eg-C3N4-300, which is responsible for its relatively stable recycling performance. Apart from XPS analysis, the recycled Zn8Nb2Cl/eg-C3N4-400 was also analyzed by XRD (Fig. S1), FT-IR (Fig. S5), and TG (Fig. S3) techniques, and the corresponding results showed that the crystalline structure, main chemical functionalities, and thermal stability had well remained in the recycled catalyst. Since the Zn8Nb2Cl/eg-C3N4-400 catalysts showed good stability in the recycling experiment, the impacts of reaction conditions on the catalytic results were also investigated. Fig. 14 describes the conversions and selectivities gained by varying the reaction temperatures. With the increase in the temperature, the EC conversion was increased progressively and the selectivity was still above 99%. As the temperature was adjusted to 140 °C, the DMC yield reached 80%. The influence of reaction time on the catalytic results was also probed. As displayed in Fig. 15 A, the conversion of EC received in the first hour was 28%, and prolonging the reaction, the conversion increased drastically. However, the conversion of EC seemed to level off after five hours of reaction time. Also, the catalytic conversion was sensitive to the feeding dosage of the catalyst (Fig. 15 B). As expected, using more catalyst resulted in a continuous increase in conversion. However, like the finding in the influence of reaction time, as the catalyst mass was higher than 200 mg, no significant increase was observed. As already explained in the introduction, g-C3N4 is a typical solid base and has been widely reported to promote Knoevenagel condensation and transesterification reactions. Wherein, the primary role of g-C3N4 was to activate acidic hydrogen atoms, such as active methylene-containing groups in Knoevenagel condensation and alcoholic hydroxyl groups in transesterification. On the other hand, Zn- and Nb-containing compounds are typical acidic catalysts that have been intensively applied in the transesterification and esterification reactions. The effect of the two cations in the catalytic reaction was mainly to adsorb and activate oxygen atoms in the carbonyl group. Based on some relevant literature [48–51], we proposed a possible mechanism of ZnNbCl/eg-C3N4 in this transesterification of EC and CH3OH ( Scheme 1). Initially, CH3OH molecules were adsorbed and dissociated by alkaline nitrogen atoms (i.e. Nb species) of eg-C3N4, then transforming into methoxide anions (CH3O−). Meanwhile, the basic sites of eg-C3N4 turned into conjugated acidic sites (Step 1). On the other hand, oxygen atoms in of C–O bonds of EC molecules were adsorbed by Zn2+ and Nb5+ cations, leading to further polarization of the bonds (Step 2). After that, the methoxide anions attacked the carbon atoms in the C–O bonds of EC, thus generating alkoxide anions (Step 3). Subsequently, another CH3OH molecule and alkoxide anion underwent proton exchange, yielding alkoxide anion and 2-hydroxyethyl methyl carbonate (HEMC, Step 4). The alkoxide anion further reacted with HEMC, generating DMC and ethylene glycol (EG) anion (Step 5). Finally, EG anion reacted with the conjugated acidic sites of eg-C3N4, thus yielding EG (Step 6). Meanwhile, the original basic sites of eg-C3N4 were recovered. Table 5 summarizes the catalytic performance of several heterogeneous catalysts for transesterification of EC and CH3OH reported in the last five years. It should be noted that all the cases were based on batch reactors rather than fixed-bed ones. Most of the reaction temperatures adopted for the catalytic reaction are above 90 °C, and the molar ratios of EC to CH3OH are basically 1:10. Among these catalysts, CaO/carbon and Co-Ca-Zr catalyst demonstrated the highest activity under the lowest reaction temperatures (60–65 °C). Despite this advantage, the major component of these two catalysts is CaO, and the strong base is very easy to adsorb acidic CO2, resulting in subsequent slow inactivation [52]. On the other hand, ionic liquids such as PILs-FL and poly[VRIm-VBA-DVIm] also suffer from complicated procedures in catalyst preparation. Thereby, in viewpoints of both catalyst preparation and performance, the solid-base bifunctional Zn8Nb2Cl/eg-C3N4 in this work might be more suitable for the practical catalytic synthesis of DMC. 4 Conclusion The eg-C3N4 material was synthesized by the thermal exfoliation method, and then a series of ZnNbCl/eg-C3N4 materials were prepared by an impregnation approach. The loading of Zn2+ and Nb5+ did not alter the graphitic structure of the eg-C3N4 support. There was an interaction between the supported metal cations and eg-C3N4. Compared with the bare eg-C3N4, the loading of metal species enabled it to have acidic properties, while enhancing the alkaline strength of eg-C3N4. In the transesterification reaction of EC and CH3OH, the ZnNbCl/eg-C3N4 composite exhibited superior catalytic activity to ZnCl2/eg-C3N4 and NbCl5/eg-C3N4. At 140 °C of reaction temperature and 4 h of reaction time, the DMC yield could reach 80%. Moreover, the catalyst had good recycling ability. The acid-base bifunctional ZnNbCl/eg-C3N4 catalyst is expected to provide a new and clean approach to synthesizing DMC. CRediT authorship contribution statement Lin-Zhi Yu: Investigation, Writing – original draft. Xiao-Hua Sun: Investigation, Formal analysis. Fei Wang: Validation. Bing Xue: Supervision. Jie Xu: Conceptualization, Writing – review & editing. Declaration of Competing Interest The authors declare that they have no known competing financial interests or personal relationships that could have appeared to influence the work reported in this paper. Acknowledgments This work was supported by the National Natural Science Foundation of China (22278041), the foundation of CNPC-CZU Innovation Alliance (CCIA2023–02), and the Advanced Catalysis and Green Manufacturing Collaborative Innovation Center. J. Xu also thanks Dr. Shi-Jun Qiu and Qian Zhang of the Shiyanjia Lab (www.shiyanjia.com) for their help in XPS and TEM characterization. Appendix A Supporting information Supplementary data associated with this article can be found in the online version at doi:10.1016/j.apcata.2023.119432. Appendix A Supplementary material Supplementary material . References [1] W. Deng L. Shi J. Yao Z. Zhang Carbon Resour. Convers. 2 2019 198 212 W. Deng, L. Shi, J. Yao, Z. Zhang, Carbon Resources Conversion 2 (2019) 198–212. [2] Y. Song X. He B. Yu H.-R. Li L.-N. He Chin. Chem. Lett. 31 2020 667 672 Y. Song, X. He, B. Yu, H.-R. Li, L.-N. He, Chin. Chem. Lett. 31 (2020) 667–672. [3] X. Wang H. Hu B. Chen L. Dang G. Gao Green. Chem. Eng. 2 2021 423 430 X. Wang, H. Hu, B. Chen, L. Dang, G. Gao, Green Chem. Eng. 2 (2021) 423–430. [4] N. Kumar V.C. Srivastava Energy Fuels 34 2020 7455 7464 N. Kumar, V.C. Srivastava, Energy Fuels 34 (2020) 7455–7464. [5] Q. Wei J. Hu H. Zhang G. Wang X. Yang ChemistrySelect 5 2020 7826 7834 Q. Wei, J. Hu, H. Zhang, G. Wang, X. Yang, ChemistrySelect 5 (2020) 7826–7834. [6] W. Liu Y. Wang J. Zhang Q. Shan Fuel 324 2022 124580 W. Liu, Y. Wang, J. Zhang, Q. Shan, Fuel 324 (2022) 124580. [7] Y.-L. Gan X.-Q. Hu L.-Z. Wen J. Xu B. Xue N. J. Chem. 44 2020 3215 3223 Y.-L. Gan, X.-Q. Hu, L.-Z. Wen, J. Xu, B. Xue, New J. Chem. 44 (2020) 3215–3223. [8] Z. Song B. Subramaniam R.V. Chaudhari ACS Sustain. Chem. Eng. 7 2019 5698 5710 Z. Song, B. Subramaniam, R.V. Chaudhari, ACS Sustain. Chem. Eng. 7 (2019) 5698–5710. [9] G. Wang S. Zhao H. Yao Chem. Eng. J. 452 2023 139354 G. Wang, S. Zhao, H. Yao, Chem. Eng. J. 452 (2023) 139354. [10] Q. Wei G. Zhang J. Yao X. Chen G. Wang X. Yang N. J. Chem. 45 2021 5540 5550 Q. Wei, G. Zhang, J. Yao, X. Chen, G. Wang, X. Yang, New J. Chem. 45 (2021) 5540–5550. [11] W.A. Qureshi S.N.-U.-Z. Haider A. Naveed A. Ali Q. Liu J. Yang Int. J. Hydrog. Energy 48 2023 19459 19485 W.A. Qureshi, S.N.-U.-Z. Haider, A. Naveed, A. Ali, Q. Liu, J. Yang, Int. J. Hydrogen Energy 48 (2023) 19459–19485. [12] A. Akhundi A. Badiei G.M. Ziarani A. Habibi-Yangjeh M.J. Muñoz-Batista R. Luque Mol. Catal. 488 2020 110902 A. Akhundi, A. Badiei, G.M. Ziarani, A. Habibi-Yangjeh, M.J. Muñoz-Batista, R. Luque, Mol. Catal. 488 (2020) 110902. [13] L.H. Amorin V.Y. Suzuki N.H. de Paula J.L. Duarte M.A.T. da Silva C.A. Taft F. de Almeida La Porta N. J. Chem. 43 2019 13647 13653 L.H. Amorin, V.Y. Suzuki, N.H. de Paula, J.L. Duarte, M.A.T. da Silva, C.A. Taft, F. de Almeida La Porta, New J. Chem. 43 (2019) 13647–13653. [14] A. Dandia S. Parihar K. Kumar S. Saini V. Parewa Phys. Sci. Rev. 2022 X A. Dandia, S. Parihar, K. Kumar, S. Saini, V. Parewa, Phys. Sci. Rev. (2022) X. [15] A. Dandia P. Saini K. Kumar M. Sethi K.S. Rathore M.L. Meena V. Parewa Curr. Res. Green. Sustain. Chem. 4 2021 100170 A. Dandia, P. Saini, K. Kumar, M. Sethi, K.S. Rathore, M.L. Meena, V. Parewa, Current Res. Green Sustain. Chem. 4 (2021) 100170. [16] A. Dandia D.K. Mahawar P. Saini S. Saini S.L. Gupta K.S. Rathore V. Parewa RSC Adv. 11 2021 28452 28465 A. Dandia, D.K. Mahawar, P. Saini, S. Saini, S.L. Gupta, K.S. Rathore, V. Parewa, RSC Adv. 11 (2021) 28452–28465. [17] A. Dandia S.L. Gupta P. Saini R. Sharma S. Meena V. Parewa Curr. Res. Green. Sustain. Chem. 3 2020 100039 A. Dandia, S.L. Gupta, P. Saini, R. Sharma, S. Meena, V. Parewa, Current Res. Green Sustain. Chem. 3 (2020) 100039. [18] S.M. Ruban C.I. Sathish K. Ramadass S. Joseph S. Kim V.D.B.C. Dasireddy I. Young Kim Aa.H. Al-Muhtaseb Y. Sugi A. Vinu ChemCatChem 13 2021 468 474 S.M. Ruban, C.I. Sathish, K. Ramadass, S. Joseph, S. Kim, V.D.B.C. Dasireddy, I. Young Kim, Aa.H. Al-Muhtaseb, Y. Sugi, A. Vinu, ChemCatChem 13 (2021) 468–474. [19] N.D. Shcherban P. Mäki-Arvela A. Aho S.A. Sergiienko P.S. Yaremov K. Eränen D.Y. Murzin Catal. Sci. Technol. 8 2018 2928 2937 N.D. Shcherban, P. Mäki-Arvela, A. Aho, S.A. Sergiienko, P.S. Yaremov, K. Eränen, D.Y. Murzin, Catal. Sci. Technol. 8 (2018) 2928–2937. [20] M. Devi M.H. Barbhuiya B. Das B. Bhuyan S.S. Dhar Sustain. Energy Fuels 4 2020 3537 3545 M. Devi, M.H. Barbhuiya, B. Das, B. Bhuyan, S.S. Dhar, Sustain. Energy Fuels 4 (2020) 3537–3545. [21] F. Wu J. Du N. Liu J. Xu B. Xue Appl. Catal. A 641 2022 118677 F. Wu, J. Du, N. Liu, J. Xu, B. Xue, Appl. Catal. A 641 (2022) 118677. [22] A. Bahuguna A. Kumar T. Chhabra A. Kumar V. Krishnan ACS Appl. Nano Mater. 1 2018 6711 6723 A. Bahuguna, A. Kumar, T. Chhabra, A. Kumar, V. Krishnan, ACS Appl. Nano Mater. 1 (2018) 6711–6723. [23] D. Zhang T. Xu C. Li W. Xu J. Wang J. Bai J. CO2 Util. 34 2019 716 724 D. Zhang, T. Xu, C. Li, W. Xu, J. Wang, J. Bai, J. CO2 Util. 34 (2019) 716–724. [24] X. Long W. Chen C. Lei Q. Xie F. Zhang B. Huang Sci. Total Environ. 775 2021 145178 X. Long, W. Chen, C. Lei, Q. Xie, F. Zhang, B. Huang, Sci. Total Environ. 775 (2021) 145178. [25] T.V. de Medeiros A. Macina R. Naccache Nano Energy 78 2020 105306 T.V. de Medeiros, A. Macina, R. Naccache, Nano Energy 78 (2020) 105306. [26] A. Nagvenkar S. Naik J. Fernandes Catal. Commun. 65 2015 20 23 A. Nagvenkar, S. Naik, J. Fernandes, Catal. Commun. 65 (2015) 20–23. [27] M.E. Cucciolito M. Lega V. Papa F. Ruffo Catal. Lett. 146 2016 1113 1117 M.E. Cucciolito, M. Lega, V. Papa, F. Ruffo, Catal. Lett. 146 (2016) 1113–1117. [28] M.I. de Sairre E.S. Bronze-Uhle P.M. Donate Tetrahedron Lett. 46 2005 2705 2708 M.I. de Sairre, E.S. Bronze-Uhle, P.M. Donate, Tetrahedron Lett. 46 (2005) 2705–2708. [29] C. García-Sancho R. Moreno-Tost J.M. Mérida-Robles J. Santamaría-González A. Jiménez-López P. Maireles-Torres Appl. Catal. B 108–109 2011 161 167 C. García-Sancho, R. Moreno-Tost, J.M. Mérida-Robles, J. Santamaría-González, A. Jiménez-López, P. Maireles-Torres, Appl. Catal. B 108–109 (2011) 161–167. [30] D. Nakatake R. Yazaki Y. Matsushima T. Ohshima Adv. Synth. Catal. 358 2016 2569 2574 D. Nakatake, R. Yazaki, Y. Matsushima, T. Ohshima, Adv. Synth. Catal. 358 (2016) 2569–2574. [31] K.N. Ahmad W.N.R. Wan Isahak M.I. Rosli M.R. Yusop M.B. Kassim M.A. Yarmo Appl. Sur. Sci. 571 2022 151321 K.N. Ahmad, W.N.R. Wan Isahak, M.I. Rosli, M.R. Yusop, M.B. Kassim, M.A. Yarmo, Appl. Sur. Sci. 571 (2022) 151321. [32] J. Xu Y.-L. Gan J.-J. Pei B. Xue Mol. Catal. 491 2020 110979 J. Xu, Y.-L. Gan, J.-J. Pei, B. Xue, Mol. Catal. 491 (2020) 110979. [33] F. Goettmann A. Fischer M. Antonietti A. Thomas Angew. Chem. Int. Ed. 45 2006 4467 4471 F. Goettmann, A. Fischer, M. Antonietti, A. Thomas, Angew. Chem. Int. Ed. 45 (2006) 4467–4471. [34] M.J. Bojdys J.-O. Müller M. Antonietti A. Thomas Chem. -Eur. J. 14 2008 8177 8182 M.J. Bojdys, J.-O. Müller, M. Antonietti, A. Thomas, Chem. -Eur. J. 14 (2008) 8177–8182. [35] X. Dong F. Cheng J. Mater. Chem. A 3 2015 23642 23652 X. Dong, F. Cheng, J. Mater. Chem. A 3 (2015) 23642–23652. [36] S. Verma R.B. Nasir Baig M.N. Nadagouda R.S. Varma ACS Sustain. Chem. Eng. 5 2017 3637 3640 S. Verma, R.B. Nasir Baig, M.N. Nadagouda, R.S. Varma, ACS Sustain. Chem. Eng. 5 (2017) 3637–3640. [37] Y. Wang Y. Wang Y. Li H. Shi Y. Xu H. Qin X. Li Y. Zuo S. Kang L. Cui Catal. Commun. 72 2015 24 28 Y. Wang, Y. Wang, Y. Li, H. Shi, Y. Xu, H. Qin, X. Li, Y. Zuo, S. Kang, L. Cui, Catal. Commun. 72 (2015) 24–28. [38] J. Zhu Y. Wei W. Chen Z. Zhao A. Thomas Chem. Commun. 46 2010 6965 6967 J. Zhu, Y. Wei, W. Chen, Z. Zhao, A. Thomas, Chem. Commun. 46 (2010) 6965–6967. [39] N. Liu F. Wu J. Xu B. Xue J. Luo Catal. Lett. 153 2023 1483 1494 N. Liu, F. Wu, J. Xu, B. Xue, J. Luo, Catal. Lett. 153 (2023) 1483–1494. [40] J. Wu W. Hua Y. Yue Z. Gao Reac. Kinet. Mech. Cat. 128 2019 109 120 J. Wu, W. Hua, Y. Yue, Z. Gao, Reac. Kinet. Mech. Cat. 128 (2019) 109–120. [41] S. Yang Y. Gong J. Zhang L. Zhan L. Ma Z. Fang R. Vajtai X. Wang P.M. Ajayan Adv. Mater. 25 2013 2452 2456 S. Yang, Y. Gong, J. Zhang, L. Zhan, L. Ma, Z. Fang, R. Vajtai, X. Wang, P.M. Ajayan, Adv. Mater. 25 (2013) 2452–2456. [42] Q. Su J. Sun J. Wang Z. Yang W. Cheng S. Zhang Catal. Sci. Technol. 4 2014 1556 1562 Q. Su, J. Sun, J. Wang, Z. Yang, W. Cheng, S. Zhang, Catal. Sci. Technol. 4 (2014) 1556–1562. [43] Y. Zhu L.-Z. Yu F. Wang J. Xu B. Xue ChemistrySelect 8 2023 e202301526 Y. Zhu, L.-Z. Yu, F. Wang, J. Xu, B. Xue, ChemistrySelect 8 (2023) e202301526. [44] F. Su M. Antonietti X. Wang Catal. Sci. Technol. 2 2012 1005 1009 F. Su, M. Antonietti, X. Wang, Catal. Sci. Technol. 2 (2012) 1005–1009. [45] J. Xu K.-Z. Long Y. Wang B. Xue Y.-X. Li Appl. Catal. A 496 2015 1 8 J. Xu, K.-Z. Long, Y. Wang, B. Xue, Y.-X. Li, Appl. Catal. A 496 (2015) 1–8. [46] J. Xu Y.-L. Gan P. Hu H. Zheng B. Xue Catal. Sci. Technol. 8 2018 5582 5593 J. Xu, Y.-L. Gan, P. Hu, H. Zheng, B. Xue, Catal. Sci. Technol. 8 (2018) 5582–5593. [47] G.E. McGuire G.K. Schweitzer T.A. Carlson Inorg. Chem. 12 1973 2450 2453 G.E. McGuire, G.K. Schweitzer, T.A. Carlson, Inorg. Chem. 12 (1973) 2450–2453. [48] V. Crocellà T. Tabanelli J.G. Vitillo D. Costenaro C. Bisio F. Cavani S. Bordiga Appl. Catal. B 211 2017 323 336 V. Crocellà, T. Tabanelli, J.G. Vitillo, D. Costenaro, C. Bisio, F. Cavani, S. Bordiga, Appl. Catal. B 211 (2017) 323–336. [49] Y.-M. Dai Y.-Y. Li L. Jia Hao B.Y. Chen C.-C. Chen J. Environ. Manag. 299 2021 113592 Y.-M. Dai, Y.-Y. Li, L. Jia Hao, B.Y. Chen, C.-C. Chen, Journal of Environmental Management 299 (2021) 113592. [50] J. Xu K.-Z. Long T. Chen B. Xue Y.-X. Li Y. Cao Catal. Sci. Technol. 3 2013 3192 3199 J. Xu, K.-Z. Long, T. Chen, B. Xue, Y.-X. Li, Y. Cao, Catal. Sci. Technol. 3 (2013) 3192–3199. [51] N. Keller G. Rebmann V. Keller J. Mol. Catal. A 317 2010 1 18 N. Keller, G. Rebmann, V. Keller, J. Mol. Catal. A 317 (2010) 1–18. [52] L. Chen J. Zhao S.-F. Yin C.-T. Au RSC Adv. 3 2013 3799 3814 L. Chen, J. Zhao, S.-F. Yin, C.-T. Au, RSC Adv. 3 (2013) 3799–3814. [53] P. Kumar R. Kaur S. Verma V.C. Srivastava I.M. Mishra Fuel 220 2018 706 716 P. Kumar, R. Kaur, S. Verma, V.C. Srivastava, I.M. Mishra, Fuel 220 (2018) 706–716. [54] M.-J. Chen J.-H. Yang N. Zhao F.-K. Xiao J. Fuel Chem. Technol. 51 2023 804 811 M.-J. Chen, J.-H. Yang, N. Zhao, F.-K. Xiao, Journal of Fuel Chemistry and Technology 51 (2023) 804–811. [55] J. Ahire B.M. Bhanage Catal. Lett. 152 2022 3284 3293 J. Ahire, B.M. Bhanage, Catal. Lett. 152 (2022) 3284–3293.",
      "scopus-id": "85171997860",
      "coredata": {
        "eid": "1-s2.0-S0926860X2300412X",
        "dc:description": "The catalytic transesterification reaction between ethylene carbonate (EC) with methanol is a sustainable approach for the production of dimethyl carbonate (DMC). In this work, exfoliated carbon nitride (eg-C3N4) was supported with ZnCl2 and NbCl5. The synthesized materials (ZnNbCl/eg-C3N4) were analyzed by XRD, N2 adsorption–desorption, FT-IR, XPS, SEM, TG, CO2-TPD, and NH3-TPD. The eg-C3N4 could disperse well Zn2+ and Nb5+ species via nitrogen-containing groups. The combined Zn2+ and Nb5+ components enhanced the alkaline strength of eg-C3N4 and introduced acidic sites, enabling ZnNbCl/eg-C3N4 as solid-base bifunctional catalysts. As heterogeneous catalysts, ZnNbCl/eg-C3N4 exhibited superior activity to ZnCl2/eg-C3N4 or NbCl5/eg-C3N4 in the transesterification of EC. At 140 °C of reaction temperature, EC conversion and DMC selectivity reached 80.1% and 100%, respectively. The catalysts showed good recycling performance and were also compared with other recently reported heterogeneous catalysts.",
        "openArchiveArticle": "false",
        "prism:coverDate": "2023-09-25",
        "openaccessUserLicense": null,
        "prism:aggregationType": "Journal",
        "prism:url": "https://api.elsevier.com/content/article/pii/S0926860X2300412X",
        "dc:creator": [
          {
            "@_fa": "true",
            "$": "Yu, Lin-Zhi"
          },
          {
            "@_fa": "true",
            "$": "Sun, Xiao-Hua"
          },
          {
            "@_fa": "true",
            "$": "Wang, Fei"
          },
          {
            "@_fa": "true",
            "$": "Xue, Bing"
          },
          {
            "@_fa": "true",
            "$": "Xu, Jie"
          }
        ],
        "link": [
          {
            "@_fa": "true",
            "@rel": "self",
            "@href": "https://api.elsevier.com/content/article/pii/S0926860X2300412X"
          },
          {
            "@_fa": "true",
            "@rel": "scidir",
            "@href": "https://www.sciencedirect.com/science/article/pii/S0926860X2300412X"
          }
        ],
        "dc:format": "application/json",
        "openaccessType": null,
        "pii": "S0926-860X(23)00412-X",
        "prism:volume": "666",
        "articleNumber": "119432",
        "prism:publisher": "Elsevier B.V.",
        "dc:title": "Acid–base bifunctional ZnNbCl/eg-C3N4 materials towards catalytic synthesis of dimethyl carbonate via transesterification of ethylene carbonate",
        "prism:copyright": "© 2023 Elsevier B.V. All rights reserved.",
        "openaccess": "0",
        "prism:issn": "0926860X",
        "dcterms:subject": [
          {
            "@_fa": "true",
            "$": "Graphitic carbon nitride (g-C3N4)"
          },
          {
            "@_fa": "true",
            "$": "Base catalyst"
          },
          {
            "@_fa": "true",
            "$": "Transesterification"
          },
          {
            "@_fa": "true",
            "$": "Dimethyl carbonate"
          }
        ],
        "openaccessArticle": "false",
        "prism:publicationName": "Applied Catalysis A: General",
        "openaccessSponsorType": null,
        "prism:pageRange": "119432",
        "pubType": "fla",
        "prism:coverDisplayDate": "25 September 2023",
        "prism:doi": "10.1016/j.apcata.2023.119432",
        "prism:startingPage": "119432",
        "dc:identifier": "doi:10.1016/j.apcata.2023.119432",
        "openaccessSponsorName": null
      },
      "objects": {
        "object": [
          {
            "@category": "standard",
            "@height": "310",
            "@width": "395",
            "@_fa": "true",
            "$": "https://api.elsevier.com/content/object/eid/1-s2.0-S0926860X2300412X-gr11.jpg?httpAccept=%2A%2F%2A",
            "@multimediatype": "JPEG image file",
            "@type": "IMAGE-DOWNSAMPLED",
            "@size": "27784",
            "@ref": "gr11",
            "@mimetype": "image/jpeg"
          },
          {
            "@category": "standard",
            "@height": "200",
            "@width": "350",
            "@_fa": "true",
            "$": "https://api.elsevier.com/content/object/eid/1-s2.0-S0926860X2300412X-ga1.jpg?httpAccept=%2A%2F%2A",
            "@multimediatype": "JPEG image file",
            "@type": "IMAGE-DOWNSAMPLED",
            "@size": "18337",
            "@ref": "ga1",
            "@mimetype": "image/jpeg"
          },
          {
            "@category": "standard",
            "@height": "306",
            "@width": "395",
            "@_fa": "true",
            "$": "https://api.elsevier.com/content/object/eid/1-s2.0-S0926860X2300412X-gr6.jpg?httpAccept=%2A%2F%2A",
            "@multimediatype": "JPEG image file",
            "@type": "IMAGE-DOWNSAMPLED",
            "@size": "31081",
            "@ref": "gr6",
            "@mimetype": "image/jpeg"
          },
          {
            "@category": "standard",
            "@height": "309",
            "@width": "395",
            "@_fa": "true",
            "$": "https://api.elsevier.com/content/object/eid/1-s2.0-S0926860X2300412X-gr7.jpg?httpAccept=%2A%2F%2A",
            "@multimediatype": "JPEG image file",
            "@type": "IMAGE-DOWNSAMPLED",
            "@size": "25499",
            "@ref": "gr7",
            "@mimetype": "image/jpeg"
          },
          {
            "@category": "standard",
            "@height": "355",
            "@width": "520",
            "@_fa": "true",
            "$": "https://api.elsevier.com/content/object/eid/1-s2.0-S0926860X2300412X-gr14.jpg?httpAccept=%2A%2F%2A",
            "@multimediatype": "JPEG image file",
            "@type": "IMAGE-DOWNSAMPLED",
            "@size": "36200",
            "@ref": "gr14",
            "@mimetype": "image/jpeg"
          },
          {
            "@category": "standard",
            "@height": "290",
            "@width": "395",
            "@_fa": "true",
            "$": "https://api.elsevier.com/content/object/eid/1-s2.0-S0926860X2300412X-gr15.jpg?httpAccept=%2A%2F%2A",
            "@multimediatype": "JPEG image file",
            "@type": "IMAGE-DOWNSAMPLED",
            "@size": "35550",
            "@ref": "gr15",
            "@mimetype": "image/jpeg"
          },
          {
            "@category": "standard",
            "@height": "307",
            "@width": "395",
            "@_fa": "true",
            "$": "https://api.elsevier.com/content/object/eid/1-s2.0-S0926860X2300412X-gr12.jpg?httpAccept=%2A%2F%2A",
            "@multimediatype": "JPEG image file",
            "@type": "IMAGE-DOWNSAMPLED",
            "@size": "26450",
            "@ref": "gr12",
            "@mimetype": "image/jpeg"
          },
          {
            "@category": "standard",
            "@height": "307",
            "@width": "395",
            "@_fa": "true",
            "$": "https://api.elsevier.com/content/object/eid/1-s2.0-S0926860X2300412X-gr13.jpg?httpAccept=%2A%2F%2A",
            "@multimediatype": "JPEG image file",
            "@type": "IMAGE-DOWNSAMPLED",
            "@size": "38722",
            "@ref": "gr13",
            "@mimetype": "image/jpeg"
          },
          {
            "@category": "standard",
            "@height": "308",
            "@width": "395",
            "@_fa": "true",
            "$": "https://api.elsevier.com/content/object/eid/1-s2.0-S0926860X2300412X-gr10.jpg?httpAccept=%2A%2F%2A",
            "@multimediatype": "JPEG image file",
            "@type": "IMAGE-DOWNSAMPLED",
            "@size": "25987",
            "@ref": "gr10",
            "@mimetype": "image/jpeg"
          },
          {
            "@category": "standard",
            "@height": "205",
            "@width": "807",
            "@_fa": "true",
            "$": "https://api.elsevier.com/content/object/eid/1-s2.0-S0926860X2300412X-gr4.jpg?httpAccept=%2A%2F%2A",
            "@multimediatype": "JPEG image file",
            "@type": "IMAGE-DOWNSAMPLED",
            "@size": "64188",
            "@ref": "gr4",
            "@mimetype": "image/jpeg"
          },
          {
            "@category": "standard",
            "@height": "295",
            "@width": "395",
            "@_fa": "true",
            "$": "https://api.elsevier.com/content/object/eid/1-s2.0-S0926860X2300412X-gr3.jpg?httpAccept=%2A%2F%2A",
            "@multimediatype": "JPEG image file",
            "@type": "IMAGE-DOWNSAMPLED",
            "@size": "25242",
            "@ref": "gr3",
            "@mimetype": "image/jpeg"
          },
          {
            "@category": "standard",
            "@height": "469",
            "@width": "807",
            "@_fa": "true",
            "$": "https://api.elsevier.com/content/object/eid/1-s2.0-S0926860X2300412X-gr5.jpg?httpAccept=%2A%2F%2A",
            "@multimediatype": "JPEG image file",
            "@type": "IMAGE-DOWNSAMPLED",
            "@size": "107928",
            "@ref": "gr5",
            "@mimetype": "image/jpeg"
          },
          {
            "@category": "standard",
            "@height": "325",
            "@width": "395",
            "@_fa": "true",
            "$": "https://api.elsevier.com/content/object/eid/1-s2.0-S0926860X2300412X-gr8.jpg?httpAccept=%2A%2F%2A",
            "@multimediatype": "JPEG image file",
            "@type": "IMAGE-DOWNSAMPLED",
            "@size": "30864",
            "@ref": "gr8",
            "@mimetype": "image/jpeg"
          },
          {
            "@category": "standard",
            "@height": "303",
            "@width": "395",
            "@_fa": "true",
            "$": "https://api.elsevier.com/content/object/eid/1-s2.0-S0926860X2300412X-gr9.jpg?httpAccept=%2A%2F%2A",
            "@multimediatype": "JPEG image file",
            "@type": "IMAGE-DOWNSAMPLED",
            "@size": "29241",
            "@ref": "gr9",
            "@mimetype": "image/jpeg"
          },
          {
            "@category": "standard",
            "@height": "325",
            "@width": "508",
            "@_fa": "true",
            "$": "https://api.elsevier.com/content/object/eid/1-s2.0-S0926860X2300412X-sc1.jpg?httpAccept=%2A%2F%2A",
            "@multimediatype": "JPEG image file",
            "@type": "IMAGE-DOWNSAMPLED",
            "@size": "29962",
            "@ref": "sc1",
            "@mimetype": "image/jpeg"
          },
          {
            "@category": "standard",
            "@height": "295",
            "@width": "516",
            "@_fa": "true",
            "$": "https://api.elsevier.com/content/object/eid/1-s2.0-S0926860X2300412X-gr2.jpg?httpAccept=%2A%2F%2A",
            "@multimediatype": "JPEG image file",
            "@type": "IMAGE-DOWNSAMPLED",
            "@size": "28865",
            "@ref": "gr2",
            "@mimetype": "image/jpeg"
          },
          {
            "@category": "standard",
            "@height": "295",
            "@width": "395",
            "@_fa": "true",
            "$": "https://api.elsevier.com/content/object/eid/1-s2.0-S0926860X2300412X-gr1.jpg?httpAccept=%2A%2F%2A",
            "@multimediatype": "JPEG image file",
            "@type": "IMAGE-DOWNSAMPLED",
            "@size": "34738",
            "@ref": "gr1",
            "@mimetype": "image/jpeg"
          },
          {
            "@category": "thumbnail",
            "@height": "164",
            "@width": "209",
            "@_fa": "true",
            "$": "https://api.elsevier.com/content/object/eid/1-s2.0-S0926860X2300412X-gr11.sml?httpAccept=%2A%2F%2A",
            "@multimediatype": "GIF image file",
            "@type": "IMAGE-THUMBNAIL",
            "@size": "7029",
            "@ref": "gr11",
            "@mimetype": "image/gif"
          },
          {
            "@category": "thumbnail",
            "@height": "125",
            "@width": "219",
            "@_fa": "true",
            "$": "https://api.elsevier.com/content/object/eid/1-s2.0-S0926860X2300412X-ga1.sml?httpAccept=%2A%2F%2A",
            "@multimediatype": "GIF image file",
            "@type": "IMAGE-THUMBNAIL",
            "@size": "7295",
            "@ref": "ga1",
            "@mimetype": "image/gif"
          },
          {
            "@category": "thumbnail",
            "@height": "164",
            "@width": "212",
            "@_fa": "true",
            "$": "https://api.elsevier.com/content/object/eid/1-s2.0-S0926860X2300412X-gr6.sml?httpAccept=%2A%2F%2A",
            "@multimediatype": "GIF image file",
            "@type": "IMAGE-THUMBNAIL",
            "@size": "8528",
            "@ref": "gr6",
            "@mimetype": "image/gif"
          },
          {
            "@category": "thumbnail",
            "@height": "164",
            "@width": "210",
            "@_fa": "true",
            "$": "https://api.elsevier.com/content/object/eid/1-s2.0-S0926860X2300412X-gr7.sml?httpAccept=%2A%2F%2A",
            "@multimediatype": "GIF image file",
            "@type": "IMAGE-THUMBNAIL",
            "@size": "7238",
            "@ref": "gr7",
            "@mimetype": "image/gif"
          },
          {
            "@category": "thumbnail",
            "@height": "149",
            "@width": "219",
            "@_fa": "true",
            "$": "https://api.elsevier.com/content/object/eid/1-s2.0-S0926860X2300412X-gr14.sml?httpAccept=%2A%2F%2A",
            "@multimediatype": "GIF image file",
            "@type": "IMAGE-THUMBNAIL",
            "@size": "6031",
            "@ref": "gr14",
            "@mimetype": "image/gif"
          },
          {
            "@category": "thumbnail",
            "@height": "161",
            "@width": "219",
            "@_fa": "true",
            "$": "https://api.elsevier.com/content/object/eid/1-s2.0-S0926860X2300412X-gr15.sml?httpAccept=%2A%2F%2A",
            "@multimediatype": "GIF image file",
            "@type": "IMAGE-THUMBNAIL",
            "@size": "10293",
            "@ref": "gr15",
            "@mimetype": "image/gif"
          },
          {
            "@category": "thumbnail",
            "@height": "164",
            "@width": "211",
            "@_fa": "true",
            "$": "https://api.elsevier.com/content/object/eid/1-s2.0-S0926860X2300412X-gr12.sml?httpAccept=%2A%2F%2A",
            "@multimediatype": "GIF image file",
            "@type": "IMAGE-THUMBNAIL",
            "@size": "6951",
            "@ref": "gr12",
            "@mimetype": "image/gif"
          },
          {
            "@category": "thumbnail",
            "@height": "164",
            "@width": "211",
            "@_fa": "true",
            "$": "https://api.elsevier.com/content/object/eid/1-s2.0-S0926860X2300412X-gr13.sml?httpAccept=%2A%2F%2A",
            "@multimediatype": "GIF image file",
            "@type": "IMAGE-THUMBNAIL",
            "@size": "13489",
            "@ref": "gr13",
            "@mimetype": "image/gif"
          },
          {
            "@category": "thumbnail",
            "@height": "164",
            "@width": "210",
            "@_fa": "true",
            "$": "https://api.elsevier.com/content/object/eid/1-s2.0-S0926860X2300412X-gr10.sml?httpAccept=%2A%2F%2A",
            "@multimediatype": "GIF image file",
            "@type": "IMAGE-THUMBNAIL",
            "@size": "6702",
            "@ref": "gr10",
            "@mimetype": "image/gif"
          },
          {
            "@category": "thumbnail",
            "@height": "56",
            "@width": "219",
            "@_fa": "true",
            "$": "https://api.elsevier.com/content/object/eid/1-s2.0-S0926860X2300412X-gr4.sml?httpAccept=%2A%2F%2A",
            "@multimediatype": "GIF image file",
            "@type": "IMAGE-THUMBNAIL",
            "@size": "9246",
            "@ref": "gr4",
            "@mimetype": "image/gif"
          },
          {
            "@category": "thumbnail",
            "@height": "164",
            "@width": "219",
            "@_fa": "true",
            "$": "https://api.elsevier.com/content/object/eid/1-s2.0-S0926860X2300412X-gr3.sml?httpAccept=%2A%2F%2A",
            "@multimediatype": "GIF image file",
            "@type": "IMAGE-THUMBNAIL",
            "@size": "7333",
            "@ref": "gr3",
            "@mimetype": "image/gif"
          },
          {
            "@category": "thumbnail",
            "@height": "127",
            "@width": "219",
            "@_fa": "true",
            "$": "https://api.elsevier.com/content/object/eid/1-s2.0-S0926860X2300412X-gr5.sml?httpAccept=%2A%2F%2A",
            "@multimediatype": "GIF image file",
            "@type": "IMAGE-THUMBNAIL",
            "@size": "15992",
            "@ref": "gr5",
            "@mimetype": "image/gif"
          },
          {
            "@category": "thumbnail",
            "@height": "164",
            "@width": "199",
            "@_fa": "true",
            "$": "https://api.elsevier.com/content/object/eid/1-s2.0-S0926860X2300412X-gr8.sml?httpAccept=%2A%2F%2A",
            "@multimediatype": "GIF image file",
            "@type": "IMAGE-THUMBNAIL",
            "@size": "8803",
            "@ref": "gr8",
            "@mimetype": "image/gif"
          },
          {
            "@category": "thumbnail",
            "@height": "164",
            "@width": "214",
            "@_fa": "true",
            "$": "https://api.elsevier.com/content/object/eid/1-s2.0-S0926860X2300412X-gr9.sml?httpAccept=%2A%2F%2A",
            "@multimediatype": "GIF image file",
            "@type": "IMAGE-THUMBNAIL",
            "@size": "8249",
            "@ref": "gr9",
            "@mimetype": "image/gif"
          },
          {
            "@category": "thumbnail",
            "@height": "140",
            "@width": "219",
            "@_fa": "true",
            "$": "https://api.elsevier.com/content/object/eid/1-s2.0-S0926860X2300412X-sc1.sml?httpAccept=%2A%2F%2A",
            "@multimediatype": "GIF image file",
            "@type": "IMAGE-THUMBNAIL",
            "@size": "6103",
            "@ref": "sc1",
            "@mimetype": "image/gif"
          },
          {
            "@category": "thumbnail",
            "@height": "125",
            "@width": "219",
            "@_fa": "true",
            "$": "https://api.elsevier.com/content/object/eid/1-s2.0-S0926860X2300412X-gr2.sml?httpAccept=%2A%2F%2A",
            "@multimediatype": "GIF image file",
            "@type": "IMAGE-THUMBNAIL",
            "@size": "5498",
            "@ref": "gr2",
            "@mimetype": "image/gif"
          },
          {
            "@category": "thumbnail",
            "@height": "163",
            "@width": "219",
            "@_fa": "true",
            "$": "https://api.elsevier.com/content/object/eid/1-s2.0-S0926860X2300412X-gr1.sml?httpAccept=%2A%2F%2A",
            "@multimediatype": "GIF image file",
            "@type": "IMAGE-THUMBNAIL",
            "@size": "9050",
            "@ref": "gr1",
            "@mimetype": "image/gif"
          },
          {
            "@category": "high",
            "@height": "1371",
            "@width": "1746",
            "@_fa": "true",
            "$": "https://api.elsevier.com/content/object/eid/1-s2.0-S0926860X2300412X-gr11_lrg.jpg?httpAccept=%2A%2F%2A",
            "@multimediatype": "JPEG image file",
            "@type": "IMAGE-HIGH-RES",
            "@size": "179060",
            "@ref": "gr11",
            "@mimetype": "image/jpeg"
          },
          {
            "@category": "high",
            "@height": "886",
            "@width": "1549",
            "@_fa": "true",
            "$": "https://api.elsevier.com/content/object/eid/1-s2.0-S0926860X2300412X-ga1_lrg.jpg?httpAccept=%2A%2F%2A",
            "@multimediatype": "JPEG image file",
            "@type": "IMAGE-HIGH-RES",
            "@size": "115500",
            "@ref": "ga1",
            "@mimetype": "image/jpeg"
          },
          {
            "@category": "high",
            "@height": "1351",
            "@width": "1746",
            "@_fa": "true",
            "$": "https://api.elsevier.com/content/object/eid/1-s2.0-S0926860X2300412X-gr6_lrg.jpg?httpAccept=%2A%2F%2A",
            "@multimediatype": "JPEG image file",
            "@type": "IMAGE-HIGH-RES",
            "@size": "206007",
            "@ref": "gr6",
            "@mimetype": "image/jpeg"
          },
          {
            "@category": "high",
            "@height": "1364",
            "@width": "1746",
            "@_fa": "true",
            "$": "https://api.elsevier.com/content/object/eid/1-s2.0-S0926860X2300412X-gr7_lrg.jpg?httpAccept=%2A%2F%2A",
            "@multimediatype": "JPEG image file",
            "@type": "IMAGE-HIGH-RES",
            "@size": "177251",
            "@ref": "gr7",
            "@mimetype": "image/jpeg"
          },
          {
            "@category": "high",
            "@height": "1571",
            "@width": "2304",
            "@_fa": "true",
            "$": "https://api.elsevier.com/content/object/eid/1-s2.0-S0926860X2300412X-gr14_lrg.jpg?httpAccept=%2A%2F%2A",
            "@multimediatype": "JPEG image file",
            "@type": "IMAGE-HIGH-RES",
            "@size": "280381",
            "@ref": "gr14",
            "@mimetype": "image/jpeg"
          },
          {
            "@category": "high",
            "@height": "1281",
            "@width": "1746",
            "@_fa": "true",
            "$": "https://api.elsevier.com/content/object/eid/1-s2.0-S0926860X2300412X-gr15_lrg.jpg?httpAccept=%2A%2F%2A",
            "@multimediatype": "JPEG image file",
            "@type": "IMAGE-HIGH-RES",
            "@size": "307268",
            "@ref": "gr15",
            "@mimetype": "image/jpeg"
          },
          {
            "@category": "high",
            "@height": "1358",
            "@width": "1746",
            "@_fa": "true",
            "$": "https://api.elsevier.com/content/object/eid/1-s2.0-S0926860X2300412X-gr12_lrg.jpg?httpAccept=%2A%2F%2A",
            "@multimediatype": "JPEG image file",
            "@type": "IMAGE-HIGH-RES",
            "@size": "162539",
            "@ref": "gr12",
            "@mimetype": "image/jpeg"
          },
          {
            "@category": "high",
            "@height": "1355",
            "@width": "1746",
            "@_fa": "true",
            "$": "https://api.elsevier.com/content/object/eid/1-s2.0-S0926860X2300412X-gr13_lrg.jpg?httpAccept=%2A%2F%2A",
            "@multimediatype": "JPEG image file",
            "@type": "IMAGE-HIGH-RES",
            "@size": "392670",
            "@ref": "gr13",
            "@mimetype": "image/jpeg"
          },
          {
            "@category": "high",
            "@height": "1362",
            "@width": "1746",
            "@_fa": "true",
            "$": "https://api.elsevier.com/content/object/eid/1-s2.0-S0926860X2300412X-gr10_lrg.jpg?httpAccept=%2A%2F%2A",
            "@multimediatype": "JPEG image file",
            "@type": "IMAGE-HIGH-RES",
            "@size": "162264",
            "@ref": "gr10",
            "@mimetype": "image/jpeg"
          },
          {
            "@category": "high",
            "@height": "909",
            "@width": "3575",
            "@_fa": "true",
            "$": "https://api.elsevier.com/content/object/eid/1-s2.0-S0926860X2300412X-gr4_lrg.jpg?httpAccept=%2A%2F%2A",
            "@multimediatype": "JPEG image file",
            "@type": "IMAGE-HIGH-RES",
            "@size": "298466",
            "@ref": "gr4",
            "@mimetype": "image/jpeg"
          },
          {
            "@category": "high",
            "@height": "1306",
            "@width": "1746",
            "@_fa": "true",
            "$": "https://api.elsevier.com/content/object/eid/1-s2.0-S0926860X2300412X-gr3_lrg.jpg?httpAccept=%2A%2F%2A",
            "@multimediatype": "JPEG image file",
            "@type": "IMAGE-HIGH-RES",
            "@size": "165171",
            "@ref": "gr3",
            "@mimetype": "image/jpeg"
          },
          {
            "@category": "high",
            "@height": "2079",
            "@width": "3575",
            "@_fa": "true",
            "$": "https://api.elsevier.com/content/object/eid/1-s2.0-S0926860X2300412X-gr5_lrg.jpg?httpAccept=%2A%2F%2A",
            "@multimediatype": "JPEG image file",
            "@type": "IMAGE-HIGH-RES",
            "@size": "682728",
            "@ref": "gr5",
            "@mimetype": "image/jpeg"
          },
          {
            "@category": "high",
            "@height": "1435",
            "@width": "1746",
            "@_fa": "true",
            "$": "https://api.elsevier.com/content/object/eid/1-s2.0-S0926860X2300412X-gr8_lrg.jpg?httpAccept=%2A%2F%2A",
            "@multimediatype": "JPEG image file",
            "@type": "IMAGE-HIGH-RES",
            "@size": "221368",
            "@ref": "gr8",
            "@mimetype": "image/jpeg"
          },
          {
            "@category": "high",
            "@height": "1339",
            "@width": "1746",
            "@_fa": "true",
            "$": "https://api.elsevier.com/content/object/eid/1-s2.0-S0926860X2300412X-gr9_lrg.jpg?httpAccept=%2A%2F%2A",
            "@multimediatype": "JPEG image file",
            "@type": "IMAGE-HIGH-RES",
            "@size": "190978",
            "@ref": "gr9",
            "@mimetype": "image/jpeg"
          },
          {
            "@category": "high",
            "@height": "1438",
            "@width": "2245",
            "@_fa": "true",
            "$": "https://api.elsevier.com/content/object/eid/1-s2.0-S0926860X2300412X-sc1_lrg.jpg?httpAccept=%2A%2F%2A",
            "@multimediatype": "JPEG image file",
            "@type": "IMAGE-HIGH-RES",
            "@size": "152853",
            "@ref": "sc1",
            "@mimetype": "image/jpeg"
          },
          {
            "@category": "high",
            "@height": "1309",
            "@width": "2286",
            "@_fa": "true",
            "$": "https://api.elsevier.com/content/object/eid/1-s2.0-S0926860X2300412X-gr2_lrg.jpg?httpAccept=%2A%2F%2A",
            "@multimediatype": "JPEG image file",
            "@type": "IMAGE-HIGH-RES",
            "@size": "171616",
            "@ref": "gr2",
            "@mimetype": "image/jpeg"
          },
          {
            "@category": "high",
            "@height": "1302",
            "@width": "1746",
            "@_fa": "true",
            "$": "https://api.elsevier.com/content/object/eid/1-s2.0-S0926860X2300412X-gr1_lrg.jpg?httpAccept=%2A%2F%2A",
            "@multimediatype": "JPEG image file",
            "@type": "IMAGE-HIGH-RES",
            "@size": "218139",
            "@ref": "gr1",
            "@mimetype": "image/jpeg"
          },
          {
            "@category": "standard",
            "@_fa": "true",
            "$": "https://api.elsevier.com/content/object/eid/1-s2.0-S0926860X2300412X-mmc1.docx?httpAccept=%2A%2F%2A",
            "@multimediatype": "Microsoft Word file",
            "@type": "APPLICATION",
            "@size": "947542",
            "@ref": "mmc1",
            "@mimetype": "application/word"
          },
          {
            "@category": "thumbnail",
            "@_fa": "true",
            "$": "https://api.elsevier.com/content/object/eid/1-s2.0-S0926860X2300412X-si0001.svg?httpAccept=%2A%2F%2A",
            "@multimediatype": "Scalable Vector Graphics file",
            "@type": "ALTIMG",
            "@size": "6759",
            "@ref": "si0001",
            "@mimetype": "image/svg+xml"
          },
          {
            "@category": "standard",
            "@_fa": "true",
            "$": "https://api.elsevier.com/content/object/eid/1-s2.0-S0926860X2300412X-am.pdf?httpAccept=%2A%2F%2A",
            "@multimediatype": "Acrobat PDF file",
            "@type": "AAM-PDF",
            "@size": "1272304",
            "@ref": "am",
            "@mimetype": "application/pdf"
          }
        ]
      },
      "link": {
        "@rel": "abstract",
        "@href": "https://api.elsevier.com/content/abstract/scopus_id/85171997860"
      }
    }
  }
}