{
  "metadata": {
    "title": "Investigating the multifunctional nature of bimetallic FeMoP catalysts using dehydration and hydrogenolysis reactions",
    "authors": "; ; ",
    "journal": "Applied Catalysis A: General",
    "date": "2016-08-25",
    "doi": "10.1016/j.apcata.2016.06.011",
    "abstract": "",
    "uri": "https://api.elsevier.com/content/article/pii/S0926860X16303258",
    "pii": "S0926860X16303258"
  },
  "fulltext": {
    "full-text-retrieval-response": {
      "scopus-eid": "2-s2.0-84976332593",
      "originalText": "serial JL 271346 291210 291744 291809 31 Applied Catalysis A: General APPLIEDCATALYSISAGENERAL 2016-06-09 2016-06-09 2016-06-24 2016-06-24 2017-04-12T13:07:36 1-s2.0-S0926860X16303258 S0926-860X(16)30325-8 S0926860X16303258 10.1016/j.apcata.2016.06.011 S300 S300.2 FULL-TEXT 1-s2.0-S0926860X16X00129 2025-07-11T08:16:15.102528Z 0 0 20160825 2016 2016-06-09T17:54:42.362616Z absattachment articleinfo articletitlenorm authfirstinitialnorm authfirstsurnamenorm cid cids contenttype copyright crossmark dateloaded dateloadedtxt datesearch datesort dateupdated dco docsubtype doctype doi eid ewtransactionid hubeid indexeddate issn issnnorm itemstage itemtransactionid itemweight openaccess openarchive pg pgfirst pglast pii piinorm pubdatestart pubdatetxt pubyr sectiontitle sortorder srctitle srctitlenorm srctype ssids alllist content subj subheadings suppl tomb volfirst volissue volumelist webpdf webpdfpagecount yearnav figure table e-component body mmlmath acknowledge affil appendices articletitle auth authfirstini authfull authkeywords authlast grantnumber grantsponsor grantsponsorid highlightsabst orcid primabst ref specialabst 0926-860X 0926860X true 524 524 C Volume 524 13 85 93 85 93 20160825 25 August 2016 2016-08-25 2016 Articles article fla © 2016 Elsevier B.V. All rights reserved. INVESTIGATINGMULTIFUNCTIONALNATUREBIMETALLICFEMOPCATALYSTSUSINGDEHYDRATIONHYDROGENOLYSISREACTIONS RENSEL D 1 Introduction 2 Experimental methods 2.1 Chemicals 2.2 Synthesis of FeMoP catalysts 2.3 Characterization 2.4 Dehydration of cyclohexanol and HDO of phenol 3 Results and discussion 3.1 FeMoP catalysts syntheses and characterizations 3.2 Deoxygenation on the FeMoP catalysts 3.2.1 Dehydration of cyclohexanol 3.2.2 HDO of phenol 3.2.3 Mechanistic evaluation 3.2.4 Stability in the HDO of phenol 4 Conclusions Acknowledgements Appendix A Supplementary data References ALONSO 2012 8075 8098 D FURIMSKY 2013 E HICKS 2011 2280 2287 J LI 2014 1 11 H BARTA 2014 1503 1512 K BRUIJNINCX 2014 1035 1036 P ROMERO 2010 213 223 Y BUI 2011 239 245 V ZHAO 2009 3987 3990 C YAN 2010 5549 5553 N ZHANG 2014 683 691 W OMOTOSO 2014 645 652 T LEE 2014 44 53 W KIM 2014 14014 14027 J WANG 2013 1047 1070 H ZHAO 2012 2714 2723 C HE 2014 362 375 J ZHAO 2012 12 23 C BADAWI 2011 155 164 M VOGELAAR 2009 79 88 B PRASOMSRI 2013 1732 1738 T MORTENSEN 2015 208 215 P ROUSSEAU 2014 7664 7680 R ZHU 2011 21 29 X OYAMA 2009 94 107 S PRINS 2013 1 24 R RENSEL 2013 256 263 D ZHAO 2011 305 310 H LI 2011 854 863 K WHIFFEN 2010 4728 4737 V YANG 2009 242 249 Y TEDOYAMA 2012 1 5 S WANG 2014 1594 1601 R BUI 2012 184 198 P GROSVENOR 2008 2549 2558 A DIPLAS 2009 245503 S TAN 1990 186 191 B SHETTY 2015 86 97 M WANG 2002 321 331 X LEE 2006 376 389 Y ALKHARAFI 2008 269 275 F HOU 2012 10 17 B MUNEYAMA 1996 378 384 E HIRUNSIT 2014 7996 8006 P KLACAR 2013 183 190 S SEIDEL 1997 113 118 A NASLUZOV 2002 386 402 V KATRYNIOK 2013 1819 1834 B SATO 2013 721 734 S ZHAO 2011 8 16 C VJUNOV 2014 479 482 A KNOZINGER 1972 57 68 H GROSVENOR 2005 8988 8998 A GROSVENOR 2007 2702 2712 A BADAWI 2013 829 840 M BUNCH 2008 96 103 A CHO 2012 969 980 A LIU 2013 7069 7080 X ROCHA 2010 54 60 A ZHOU 2012 1459 1466 B ZHU 2014 4104 4111 X HONG 2014 3335 3345 Y NELSON 2015 6509 6523 R MOBERG 2010 13782 13795 D BUNCH 2002 177 187 A WIDEGREN 2003 10301 10310 J MONTEIROGEZORK 2008 471 485 A DAAGE 1994 414 427 M KASZTELAN 1984 127 159 S HENSEN 2001 224 235 E SHABANOVA 1975 297 307 I RAMQVIST 1969 1835 1847 L KUIVILA 1988 99 121 C BLANCHARD 2009 6015 6022 P RENSELX2016X85 RENSELX2016X85X93 RENSELX2016X85XD RENSELX2016X85X93XD https://vtw.elsevier.com/content/oragreement/10144 CHU_NSF publishAcceptedManuscriptIndexable 2017-06-24T00:00:00Z http://www.elsevier.com/open-access/userlicense/1.0/ 2017-06-24T00:00:00Z http://creativecommons.org/licenses/by-nc-nd/4.0/ © 2016 Elsevier B.V. All rights reserved. https://doi.org/10.15223/policy-017 https://doi.org/10.15223/policy-037 https://doi.org/10.15223/policy-012 https://doi.org/10.15223/policy-029 https://doi.org/10.15223/policy-004 item S0926-860X(16)30325-8 S0926860X16303258 1-s2.0-S0926860X16303258 10.1016/j.apcata.2016.06.011 271346 2025-07-11T08:16:15.102528Z 2016-08-25 1-s2.0-S0926860X16303258-main.pdf https://s3-eu-west-1.amazonaws.com/prod-ucs-content-store-eu-west/content/pii:S0926860X16303258/MAIN/application/pdf/5ed41f7853def9ae9a38684e25d21f24/main.pdf https://s3.amazonaws.com/prod-ucs-content-store-us-east/content/pii:S0926860X16303258/MAIN/application/pdf/5ed41f7853def9ae9a38684e25d21f24/main.pdf main.pdf pdf true 1721856 MAIN 9 1-s2.0-S0926860X16303258-main_1.png https://s3-eu-west-1.amazonaws.com/prod-ucs-content-store-eu-west/content/pii:S0926860X16303258/PREVIEW/image/png/f56e3a8347115036102640238192ebf0/main_1.png https://s3.amazonaws.com/prod-ucs-content-store-us-east/content/pii:S0926860X16303258/PREVIEW/image/png/f56e3a8347115036102640238192ebf0/main_1.png main_1.png png 56747 849 656 IMAGE-WEB-PDF 1 1-s2.0-S0926860X16303258-fx1.sml https://s3-eu-west-1.amazonaws.com/prod-ucs-content-store-eu-west/content/pii:S0926860X16303258/fx1/THUMBNAIL/image/gif/08ae933102e6ce08ca3e939f1d5b49f1/fx1.sml https://s3.amazonaws.com/prod-ucs-content-store-us-east/content/pii:S0926860X16303258/fx1/THUMBNAIL/image/gif/08ae933102e6ce08ca3e939f1d5b49f1/fx1.sml fx1 true fx1.sml sml 5150 88 219 IMAGE-THUMBNAIL 1-s2.0-S0926860X16303258-gr1.sml https://s3-eu-west-1.amazonaws.com/prod-ucs-content-store-eu-west/content/pii:S0926860X16303258/gr1/THUMBNAIL/image/gif/b2a9826832c1e3e46dc8cd4b1b842386/gr1.sml https://s3.amazonaws.com/prod-ucs-content-store-us-east/content/pii:S0926860X16303258/gr1/THUMBNAIL/image/gif/b2a9826832c1e3e46dc8cd4b1b842386/gr1.sml gr1 gr1.sml sml 8158 164 203 IMAGE-THUMBNAIL 1-s2.0-S0926860X16303258-gr2.sml https://s3-eu-west-1.amazonaws.com/prod-ucs-content-store-eu-west/content/pii:S0926860X16303258/gr2/THUMBNAIL/image/gif/0616a1d09c71e881f02792672a8bb4d2/gr2.sml https://s3.amazonaws.com/prod-ucs-content-store-us-east/content/pii:S0926860X16303258/gr2/THUMBNAIL/image/gif/0616a1d09c71e881f02792672a8bb4d2/gr2.sml gr2 gr2.sml sml 6858 109 219 IMAGE-THUMBNAIL 1-s2.0-S0926860X16303258-gr3.sml https://s3-eu-west-1.amazonaws.com/prod-ucs-content-store-eu-west/content/pii:S0926860X16303258/gr3/THUMBNAIL/image/gif/e3693a3a080597fa673e9d724d4363d9/gr3.sml https://s3.amazonaws.com/prod-ucs-content-store-us-east/content/pii:S0926860X16303258/gr3/THUMBNAIL/image/gif/e3693a3a080597fa673e9d724d4363d9/gr3.sml gr3 gr3.sml sml 7063 104 219 IMAGE-THUMBNAIL 1-s2.0-S0926860X16303258-gr4.sml https://s3-eu-west-1.amazonaws.com/prod-ucs-content-store-eu-west/content/pii:S0926860X16303258/gr4/THUMBNAIL/image/gif/f0c1942bc5da0b3c1d658c66963e0b57/gr4.sml https://s3.amazonaws.com/prod-ucs-content-store-us-east/content/pii:S0926860X16303258/gr4/THUMBNAIL/image/gif/f0c1942bc5da0b3c1d658c66963e0b57/gr4.sml gr4 gr4.sml sml 9075 164 179 IMAGE-THUMBNAIL 1-s2.0-S0926860X16303258-gr5.sml https://s3-eu-west-1.amazonaws.com/prod-ucs-content-store-eu-west/content/pii:S0926860X16303258/gr5/THUMBNAIL/image/gif/33aa6b0606e74240aa70628fafe1e0b2/gr5.sml https://s3.amazonaws.com/prod-ucs-content-store-us-east/content/pii:S0926860X16303258/gr5/THUMBNAIL/image/gif/33aa6b0606e74240aa70628fafe1e0b2/gr5.sml gr5 gr5.sml sml 6873 164 183 IMAGE-THUMBNAIL 1-s2.0-S0926860X16303258-gr6.sml https://s3-eu-west-1.amazonaws.com/prod-ucs-content-store-eu-west/content/pii:S0926860X16303258/gr6/THUMBNAIL/image/gif/ce163273e830613b10f696688129f9fc/gr6.sml https://s3.amazonaws.com/prod-ucs-content-store-us-east/content/pii:S0926860X16303258/gr6/THUMBNAIL/image/gif/ce163273e830613b10f696688129f9fc/gr6.sml gr6 gr6.sml sml 5888 164 179 IMAGE-THUMBNAIL 1-s2.0-S0926860X16303258-gr7.sml https://s3-eu-west-1.amazonaws.com/prod-ucs-content-store-eu-west/content/pii:S0926860X16303258/gr7/THUMBNAIL/image/gif/83973aca2b015dead7281c3117e5616e/gr7.sml https://s3.amazonaws.com/prod-ucs-content-store-us-east/content/pii:S0926860X16303258/gr7/THUMBNAIL/image/gif/83973aca2b015dead7281c3117e5616e/gr7.sml gr7 gr7.sml sml 3370 63 219 IMAGE-THUMBNAIL 1-s2.0-S0926860X16303258-gr8.sml https://s3-eu-west-1.amazonaws.com/prod-ucs-content-store-eu-west/content/pii:S0926860X16303258/gr8/THUMBNAIL/image/gif/84587cda7bb2e16bb37ac0cc66f74ab6/gr8.sml https://s3.amazonaws.com/prod-ucs-content-store-us-east/content/pii:S0926860X16303258/gr8/THUMBNAIL/image/gif/84587cda7bb2e16bb37ac0cc66f74ab6/gr8.sml gr8 gr8.sml sml 10054 164 183 IMAGE-THUMBNAIL 1-s2.0-S0926860X16303258-fx1.jpg https://s3-eu-west-1.amazonaws.com/prod-ucs-content-store-eu-west/content/pii:S0926860X16303258/fx1/DOWNSAMPLED/image/jpeg/b82d293038a47956ef693180be892a91/fx1.jpg https://s3.amazonaws.com/prod-ucs-content-store-us-east/content/pii:S0926860X16303258/fx1/DOWNSAMPLED/image/jpeg/b82d293038a47956ef693180be892a91/fx1.jpg fx1 true fx1.jpg jpg 23236 200 500 IMAGE-DOWNSAMPLED 1-s2.0-S0926860X16303258-gr1.jpg https://s3-eu-west-1.amazonaws.com/prod-ucs-content-store-eu-west/content/pii:S0926860X16303258/gr1/DOWNSAMPLED/image/jpeg/fe6ed661fba7b7853de8ad043c3d31cb/gr1.jpg https://s3.amazonaws.com/prod-ucs-content-store-us-east/content/pii:S0926860X16303258/gr1/DOWNSAMPLED/image/jpeg/fe6ed661fba7b7853de8ad043c3d31cb/gr1.jpg gr1 gr1.jpg jpg 19438 259 320 IMAGE-DOWNSAMPLED 1-s2.0-S0926860X16303258-gr2.jpg https://s3-eu-west-1.amazonaws.com/prod-ucs-content-store-eu-west/content/pii:S0926860X16303258/gr2/DOWNSAMPLED/image/jpeg/98122ff17e9515b15457879f000d85ae/gr2.jpg https://s3.amazonaws.com/prod-ucs-content-store-us-east/content/pii:S0926860X16303258/gr2/DOWNSAMPLED/image/jpeg/98122ff17e9515b15457879f000d85ae/gr2.jpg gr2 gr2.jpg jpg 31904 252 508 IMAGE-DOWNSAMPLED 1-s2.0-S0926860X16303258-gr3.jpg https://s3-eu-west-1.amazonaws.com/prod-ucs-content-store-eu-west/content/pii:S0926860X16303258/gr3/DOWNSAMPLED/image/jpeg/e8750c349581a7fd4b8e0702fe470dc8/gr3.jpg https://s3.amazonaws.com/prod-ucs-content-store-us-east/content/pii:S0926860X16303258/gr3/DOWNSAMPLED/image/jpeg/e8750c349581a7fd4b8e0702fe470dc8/gr3.jpg gr3 gr3.jpg jpg 32333 240 506 IMAGE-DOWNSAMPLED 1-s2.0-S0926860X16303258-gr4.jpg https://s3-eu-west-1.amazonaws.com/prod-ucs-content-store-eu-west/content/pii:S0926860X16303258/gr4/DOWNSAMPLED/image/jpeg/c5242a3be8cf3b6fc346c52aee063a34/gr4.jpg https://s3.amazonaws.com/prod-ucs-content-store-us-east/content/pii:S0926860X16303258/gr4/DOWNSAMPLED/image/jpeg/c5242a3be8cf3b6fc346c52aee063a34/gr4.jpg gr4 gr4.jpg jpg 29661 342 373 IMAGE-DOWNSAMPLED 1-s2.0-S0926860X16303258-gr5.jpg https://s3-eu-west-1.amazonaws.com/prod-ucs-content-store-eu-west/content/pii:S0926860X16303258/gr5/DOWNSAMPLED/image/jpeg/852e033f7d23a2c259531d89cffddb68/gr5.jpg https://s3.amazonaws.com/prod-ucs-content-store-us-east/content/pii:S0926860X16303258/gr5/DOWNSAMPLED/image/jpeg/852e033f7d23a2c259531d89cffddb68/gr5.jpg gr5 gr5.jpg jpg 26414 343 384 IMAGE-DOWNSAMPLED 1-s2.0-S0926860X16303258-gr6.jpg https://s3-eu-west-1.amazonaws.com/prod-ucs-content-store-eu-west/content/pii:S0926860X16303258/gr6/DOWNSAMPLED/image/jpeg/25f1b18e50b2e778742dfc90ff017505/gr6.jpg https://s3.amazonaws.com/prod-ucs-content-store-us-east/content/pii:S0926860X16303258/gr6/DOWNSAMPLED/image/jpeg/25f1b18e50b2e778742dfc90ff017505/gr6.jpg gr6 gr6.jpg jpg 20900 351 384 IMAGE-DOWNSAMPLED 1-s2.0-S0926860X16303258-gr7.jpg https://s3-eu-west-1.amazonaws.com/prod-ucs-content-store-eu-west/content/pii:S0926860X16303258/gr7/DOWNSAMPLED/image/jpeg/8dcffb590b2a8b2428dc4c1b5ea66a2e/gr7.jpg https://s3.amazonaws.com/prod-ucs-content-store-us-east/content/pii:S0926860X16303258/gr7/DOWNSAMPLED/image/jpeg/8dcffb590b2a8b2428dc4c1b5ea66a2e/gr7.jpg gr7 gr7.jpg jpg 13189 113 393 IMAGE-DOWNSAMPLED 1-s2.0-S0926860X16303258-gr8.jpg https://s3-eu-west-1.amazonaws.com/prod-ucs-content-store-eu-west/content/pii:S0926860X16303258/gr8/DOWNSAMPLED/image/jpeg/19aab3238a9a340490e164b7e7b31692/gr8.jpg https://s3.amazonaws.com/prod-ucs-content-store-us-east/content/pii:S0926860X16303258/gr8/DOWNSAMPLED/image/jpeg/19aab3238a9a340490e164b7e7b31692/gr8.jpg gr8 gr8.jpg jpg 32516 349 390 IMAGE-DOWNSAMPLED 1-s2.0-S0926860X16303258-fx1_lrg.jpg https://s3-eu-west-1.amazonaws.com/prod-ucs-content-store-eu-west/content/pii:S0926860X16303258/fx1/HIGHRES/image/jpeg/fa1bee67d604423862eab8b9f4e31f07/fx1_lrg.jpg https://s3.amazonaws.com/prod-ucs-content-store-us-east/content/pii:S0926860X16303258/fx1/HIGHRES/image/jpeg/fa1bee67d604423862eab8b9f4e31f07/fx1_lrg.jpg fx1 true fx1_lrg.jpg jpg 185679 886 2213 IMAGE-HIGH-RES 1-s2.0-S0926860X16303258-gr1_lrg.jpg https://s3-eu-west-1.amazonaws.com/prod-ucs-content-store-eu-west/content/pii:S0926860X16303258/gr1/HIGHRES/image/jpeg/6a7a0796d2c573e5895481faabbae386/gr1_lrg.jpg https://s3.amazonaws.com/prod-ucs-content-store-us-east/content/pii:S0926860X16303258/gr1/HIGHRES/image/jpeg/6a7a0796d2c573e5895481faabbae386/gr1_lrg.jpg gr1 gr1_lrg.jpg jpg 167289 1146 1417 IMAGE-HIGH-RES 1-s2.0-S0926860X16303258-gr2_lrg.jpg https://s3-eu-west-1.amazonaws.com/prod-ucs-content-store-eu-west/content/pii:S0926860X16303258/gr2/HIGHRES/image/jpeg/d71962d58524c495056ff6a1670ec13c/gr2_lrg.jpg https://s3.amazonaws.com/prod-ucs-content-store-us-east/content/pii:S0926860X16303258/gr2/HIGHRES/image/jpeg/d71962d58524c495056ff6a1670ec13c/gr2_lrg.jpg gr2 gr2_lrg.jpg jpg 253162 1118 2250 IMAGE-HIGH-RES 1-s2.0-S0926860X16303258-gr3_lrg.jpg https://s3-eu-west-1.amazonaws.com/prod-ucs-content-store-eu-west/content/pii:S0926860X16303258/gr3/HIGHRES/image/jpeg/6e0e318f2f8d875f64af5d32cb8e71b9/gr3_lrg.jpg https://s3.amazonaws.com/prod-ucs-content-store-us-east/content/pii:S0926860X16303258/gr3/HIGHRES/image/jpeg/6e0e318f2f8d875f64af5d32cb8e71b9/gr3_lrg.jpg gr3 gr3_lrg.jpg jpg 276563 1063 2243 IMAGE-HIGH-RES 1-s2.0-S0926860X16303258-gr4_lrg.jpg https://s3-eu-west-1.amazonaws.com/prod-ucs-content-store-eu-west/content/pii:S0926860X16303258/gr4/HIGHRES/image/jpeg/4fa314ad3b5b9455ccf867dfc5c3e2ba/gr4_lrg.jpg https://s3.amazonaws.com/prod-ucs-content-store-us-east/content/pii:S0926860X16303258/gr4/HIGHRES/image/jpeg/4fa314ad3b5b9455ccf867dfc5c3e2ba/gr4_lrg.jpg gr4 gr4_lrg.jpg jpg 252899 1514 1653 IMAGE-HIGH-RES 1-s2.0-S0926860X16303258-gr5_lrg.jpg https://s3-eu-west-1.amazonaws.com/prod-ucs-content-store-eu-west/content/pii:S0926860X16303258/gr5/HIGHRES/image/jpeg/9a00116773bcc99e4cb6d63d36ec530f/gr5_lrg.jpg https://s3.amazonaws.com/prod-ucs-content-store-us-east/content/pii:S0926860X16303258/gr5/HIGHRES/image/jpeg/9a00116773bcc99e4cb6d63d36ec530f/gr5_lrg.jpg gr5 gr5_lrg.jpg jpg 216439 1521 1701 IMAGE-HIGH-RES 1-s2.0-S0926860X16303258-gr6_lrg.jpg https://s3-eu-west-1.amazonaws.com/prod-ucs-content-store-eu-west/content/pii:S0926860X16303258/gr6/HIGHRES/image/jpeg/7a9067075efdce760ef8b1be1b9c414a/gr6_lrg.jpg https://s3.amazonaws.com/prod-ucs-content-store-us-east/content/pii:S0926860X16303258/gr6/HIGHRES/image/jpeg/7a9067075efdce760ef8b1be1b9c414a/gr6_lrg.jpg gr6 gr6_lrg.jpg jpg 179332 1556 1701 IMAGE-HIGH-RES 1-s2.0-S0926860X16303258-gr7_lrg.jpg https://s3-eu-west-1.amazonaws.com/prod-ucs-content-store-eu-west/content/pii:S0926860X16303258/gr7/HIGHRES/image/jpeg/3a3e61541cbda53eca768db4b05ec31c/gr7_lrg.jpg https://s3.amazonaws.com/prod-ucs-content-store-us-east/content/pii:S0926860X16303258/gr7/HIGHRES/image/jpeg/3a3e61541cbda53eca768db4b05ec31c/gr7_lrg.jpg gr7 gr7_lrg.jpg jpg 97046 500 1743 IMAGE-HIGH-RES 1-s2.0-S0926860X16303258-gr8_lrg.jpg https://s3-eu-west-1.amazonaws.com/prod-ucs-content-store-eu-west/content/pii:S0926860X16303258/gr8/HIGHRES/image/jpeg/e13b95058e120204f39b4bd182e820d4/gr8_lrg.jpg https://s3.amazonaws.com/prod-ucs-content-store-us-east/content/pii:S0926860X16303258/gr8/HIGHRES/image/jpeg/e13b95058e120204f39b4bd182e820d4/gr8_lrg.jpg gr8 gr8_lrg.jpg jpg 279941 1549 1729 IMAGE-HIGH-RES 1-s2.0-S0926860X16303258-mmc1.docx https://s3-eu-west-1.amazonaws.com/prod-ucs-content-store-eu-west/content/pii:S0926860X16303258/mmc1/MAIN/application/msword/680151813bb641278056bb71de0b3dcb/mmc1.docx https://s3.amazonaws.com/prod-ucs-content-store-us-east/content/pii:S0926860X16303258/mmc1/MAIN/application/msword/680151813bb641278056bb71de0b3dcb/mmc1.docx mmc1 mmc1.docx docx 5975955 APPLICATION 1-s2.0-S0926860X16303258-si1.gif https://s3-eu-west-1.amazonaws.com/prod-ucs-content-store-eu-west/content/pii:S0926860X16303258/STRIPIN/image/gif/ab79285dfb9ec04d9222f23ee28fd6a1/si1.gif https://s3.amazonaws.com/prod-ucs-content-store-us-east/content/pii:S0926860X16303258/STRIPIN/image/gif/ab79285dfb9ec04d9222f23ee28fd6a1/si1.gif si1 si1.gif gif 724 35 155 ALTIMG 1-s2.0-S0926860X16303258-si10.gif https://s3-eu-west-1.amazonaws.com/prod-ucs-content-store-eu-west/content/pii:S0926860X16303258/STRIPIN/image/gif/747a43eb6a26969fef1fef06beb9c268/si10.gif https://s3.amazonaws.com/prod-ucs-content-store-us-east/content/pii:S0926860X16303258/STRIPIN/image/gif/747a43eb6a26969fef1fef06beb9c268/si10.gif si10 si10.gif gif 2092 68 376 ALTIMG 1-s2.0-S0926860X16303258-si11.gif https://s3-eu-west-1.amazonaws.com/prod-ucs-content-store-eu-west/content/pii:S0926860X16303258/STRIPIN/image/gif/a58c25a12c0433397ea0451d6d2eedf7/si11.gif https://s3.amazonaws.com/prod-ucs-content-store-us-east/content/pii:S0926860X16303258/STRIPIN/image/gif/a58c25a12c0433397ea0451d6d2eedf7/si11.gif si11 si11.gif gif 1095 39 234 ALTIMG 1-s2.0-S0926860X16303258-si2.gif https://s3-eu-west-1.amazonaws.com/prod-ucs-content-store-eu-west/content/pii:S0926860X16303258/STRIPIN/image/gif/d134dcbc7f07e97635113a831ee5753b/si2.gif https://s3.amazonaws.com/prod-ucs-content-store-us-east/content/pii:S0926860X16303258/STRIPIN/image/gif/d134dcbc7f07e97635113a831ee5753b/si2.gif si2 si2.gif gif 1504 35 324 ALTIMG 1-s2.0-S0926860X16303258-si3.gif https://s3-eu-west-1.amazonaws.com/prod-ucs-content-store-eu-west/content/pii:S0926860X16303258/STRIPIN/image/gif/021f14f2c3e6ddff78f8d4a70385aa21/si3.gif https://s3.amazonaws.com/prod-ucs-content-store-us-east/content/pii:S0926860X16303258/STRIPIN/image/gif/021f14f2c3e6ddff78f8d4a70385aa21/si3.gif si3 si3.gif gif 1505 35 299 ALTIMG 1-s2.0-S0926860X16303258-si4.gif https://s3-eu-west-1.amazonaws.com/prod-ucs-content-store-eu-west/content/pii:S0926860X16303258/STRIPIN/image/gif/bdbbafcfff405c0ee6269be5bea51ee9/si4.gif https://s3.amazonaws.com/prod-ucs-content-store-us-east/content/pii:S0926860X16303258/STRIPIN/image/gif/bdbbafcfff405c0ee6269be5bea51ee9/si4.gif si4 si4.gif gif 496 14 133 ALTIMG 1-s2.0-S0926860X16303258-si5.gif https://s3-eu-west-1.amazonaws.com/prod-ucs-content-store-eu-west/content/pii:S0926860X16303258/STRIPIN/image/gif/596ea88006fbaf3e1a311f4abce48b52/si5.gif https://s3.amazonaws.com/prod-ucs-content-store-us-east/content/pii:S0926860X16303258/STRIPIN/image/gif/596ea88006fbaf3e1a311f4abce48b52/si5.gif si5 si5.gif gif 587 14 184 ALTIMG 1-s2.0-S0926860X16303258-si6.gif https://s3-eu-west-1.amazonaws.com/prod-ucs-content-store-eu-west/content/pii:S0926860X16303258/STRIPIN/image/gif/525473190c74392c4c021c179940f6a1/si6.gif https://s3.amazonaws.com/prod-ucs-content-store-us-east/content/pii:S0926860X16303258/STRIPIN/image/gif/525473190c74392c4c021c179940f6a1/si6.gif si6 si6.gif gif 804 14 284 ALTIMG 1-s2.0-S0926860X16303258-si7.gif https://s3-eu-west-1.amazonaws.com/prod-ucs-content-store-eu-west/content/pii:S0926860X16303258/STRIPIN/image/gif/6a2183b04e8b6a5ffce26333e2fcd909/si7.gif https://s3.amazonaws.com/prod-ucs-content-store-us-east/content/pii:S0926860X16303258/STRIPIN/image/gif/6a2183b04e8b6a5ffce26333e2fcd909/si7.gif si7 si7.gif gif 643 14 222 ALTIMG 1-s2.0-S0926860X16303258-si8.gif https://s3-eu-west-1.amazonaws.com/prod-ucs-content-store-eu-west/content/pii:S0926860X16303258/STRIPIN/image/gif/c89a863658b2084466c45604848487f3/si8.gif https://s3.amazonaws.com/prod-ucs-content-store-us-east/content/pii:S0926860X16303258/STRIPIN/image/gif/c89a863658b2084466c45604848487f3/si8.gif si8 si8.gif gif 683 14 228 ALTIMG 1-s2.0-S0926860X16303258-si9.gif https://s3-eu-west-1.amazonaws.com/prod-ucs-content-store-eu-west/content/pii:S0926860X16303258/STRIPIN/image/gif/c8240f722190ed554524e4ac9bb66316/si9.gif https://s3.amazonaws.com/prod-ucs-content-store-us-east/content/pii:S0926860X16303258/STRIPIN/image/gif/c8240f722190ed554524e4ac9bb66316/si9.gif si9 si9.gif gif 545 14 143 ALTIMG 1-s2.0-S0926860X16303258-Dallas_Rensel_hydrodeoxygenation_dehydration_2016_P01.jpg https://s3-eu-west-1.amazonaws.com/prod-ucs-content-store-eu-west/content/egi:10VLJRXWKKR/PAGE-IMAGE/image/jpg/6db6e0352b62cbef610ad9b4ac535378/Dallas_Rensel_hydrodeoxygenation_dehydration_2016_P01.jpg https://s3.amazonaws.com/prod-ucs-content-store-us-east/content/egi:10VLJRXWKKR/PAGE-IMAGE/image/jpg/6db6e0352b62cbef610ad9b4ac535378/Dallas_Rensel_hydrodeoxygenation_dehydration_2016_P01.jpg https://ucs.elsevier.com/asset/09a2b15e-335d-4e6a-83f5-801552c0bbf5 Dallas_Rensel_hydrodeoxygenation_dehydration_2016_P01 Dallas_Rensel_hydrodeoxygenation_dehydration_2016_P01.jpg jpg 183868 01 AAM-PAGE-IMAGE 1-s2.0-S0926860X16303258-Dallas_Rensel_hydrodeoxygenation_dehydration_2016_P02.jpg https://s3-eu-west-1.amazonaws.com/prod-ucs-content-store-eu-west/content/egi:10VLJRXWKKR/PAGE-IMAGE/image/jpg/025abde752ccc3908cc3dd96a9ee76ef/Dallas_Rensel_hydrodeoxygenation_dehydration_2016_P02.jpg https://s3.amazonaws.com/prod-ucs-content-store-us-east/content/egi:10VLJRXWKKR/PAGE-IMAGE/image/jpg/025abde752ccc3908cc3dd96a9ee76ef/Dallas_Rensel_hydrodeoxygenation_dehydration_2016_P02.jpg https://ucs.elsevier.com/asset/a22d3f8a-6b18-486f-9b29-a9b5241e0123 Dallas_Rensel_hydrodeoxygenation_dehydration_2016_P02 Dallas_Rensel_hydrodeoxygenation_dehydration_2016_P02.jpg jpg 389989 02 AAM-PAGE-IMAGE 1-s2.0-S0926860X16303258-Dallas_Rensel_hydrodeoxygenation_dehydration_2016_P03.jpg https://s3-eu-west-1.amazonaws.com/prod-ucs-content-store-eu-west/content/egi:10VLJRXWKKR/PAGE-IMAGE/image/jpg/7e9218cbb8ae8b59accf7a6c956d40b3/Dallas_Rensel_hydrodeoxygenation_dehydration_2016_P03.jpg https://s3.amazonaws.com/prod-ucs-content-store-us-east/content/egi:10VLJRXWKKR/PAGE-IMAGE/image/jpg/7e9218cbb8ae8b59accf7a6c956d40b3/Dallas_Rensel_hydrodeoxygenation_dehydration_2016_P03.jpg https://ucs.elsevier.com/asset/07ed006d-18d6-470e-ba5a-949ddefc2bef Dallas_Rensel_hydrodeoxygenation_dehydration_2016_P03 Dallas_Rensel_hydrodeoxygenation_dehydration_2016_P03.jpg jpg 503847 03 AAM-PAGE-IMAGE 1-s2.0-S0926860X16303258-Dallas_Rensel_hydrodeoxygenation_dehydration_2016_P04.jpg https://s3-eu-west-1.amazonaws.com/prod-ucs-content-store-eu-west/content/egi:10VLJRXWKKR/PAGE-IMAGE/image/jpg/babe7b244f7a0d60c1e3a670c37e2332/Dallas_Rensel_hydrodeoxygenation_dehydration_2016_P04.jpg https://s3.amazonaws.com/prod-ucs-content-store-us-east/content/egi:10VLJRXWKKR/PAGE-IMAGE/image/jpg/babe7b244f7a0d60c1e3a670c37e2332/Dallas_Rensel_hydrodeoxygenation_dehydration_2016_P04.jpg https://ucs.elsevier.com/asset/a40e94cf-9d6b-4057-a251-9b86a42bbfb7 Dallas_Rensel_hydrodeoxygenation_dehydration_2016_P04 Dallas_Rensel_hydrodeoxygenation_dehydration_2016_P04.jpg jpg 514165 04 AAM-PAGE-IMAGE 1-s2.0-S0926860X16303258-Dallas_Rensel_hydrodeoxygenation_dehydration_2016_P05.jpg https://s3-eu-west-1.amazonaws.com/prod-ucs-content-store-eu-west/content/egi:10VLJRXWKKR/PAGE-IMAGE/image/jpg/914d0689b797229c815d8b79de9e6639/Dallas_Rensel_hydrodeoxygenation_dehydration_2016_P05.jpg https://s3.amazonaws.com/prod-ucs-content-store-us-east/content/egi:10VLJRXWKKR/PAGE-IMAGE/image/jpg/914d0689b797229c815d8b79de9e6639/Dallas_Rensel_hydrodeoxygenation_dehydration_2016_P05.jpg https://ucs.elsevier.com/asset/10edcfe1-b7b6-4915-a1fe-274f09310a97 Dallas_Rensel_hydrodeoxygenation_dehydration_2016_P05 Dallas_Rensel_hydrodeoxygenation_dehydration_2016_P05.jpg jpg 374624 05 AAM-PAGE-IMAGE 1-s2.0-S0926860X16303258-Dallas_Rensel_hydrodeoxygenation_dehydration_2016_P06.jpg https://s3-eu-west-1.amazonaws.com/prod-ucs-content-store-eu-west/content/egi:10VLJRXWKKR/PAGE-IMAGE/image/jpg/76aeac1d4634b0ab0716d1b161305d66/Dallas_Rensel_hydrodeoxygenation_dehydration_2016_P06.jpg https://s3.amazonaws.com/prod-ucs-content-store-us-east/content/egi:10VLJRXWKKR/PAGE-IMAGE/image/jpg/76aeac1d4634b0ab0716d1b161305d66/Dallas_Rensel_hydrodeoxygenation_dehydration_2016_P06.jpg https://ucs.elsevier.com/asset/71bdedb8-227e-45bb-bec6-1f64e4b64334 Dallas_Rensel_hydrodeoxygenation_dehydration_2016_P06 Dallas_Rensel_hydrodeoxygenation_dehydration_2016_P06.jpg jpg 491911 06 AAM-PAGE-IMAGE 1-s2.0-S0926860X16303258-Dallas_Rensel_hydrodeoxygenation_dehydration_2016_P07.jpg https://s3-eu-west-1.amazonaws.com/prod-ucs-content-store-eu-west/content/egi:10VLJRXWKKR/PAGE-IMAGE/image/jpg/58644d92568f553cc43dcc5ce23913d5/Dallas_Rensel_hydrodeoxygenation_dehydration_2016_P07.jpg https://s3.amazonaws.com/prod-ucs-content-store-us-east/content/egi:10VLJRXWKKR/PAGE-IMAGE/image/jpg/58644d92568f553cc43dcc5ce23913d5/Dallas_Rensel_hydrodeoxygenation_dehydration_2016_P07.jpg https://ucs.elsevier.com/asset/925d6e93-33ac-464e-9cf8-42837af1def5 Dallas_Rensel_hydrodeoxygenation_dehydration_2016_P07 Dallas_Rensel_hydrodeoxygenation_dehydration_2016_P07.jpg jpg 545511 07 AAM-PAGE-IMAGE 1-s2.0-S0926860X16303258-Dallas_Rensel_hydrodeoxygenation_dehydration_2016_P08.jpg https://s3-eu-west-1.amazonaws.com/prod-ucs-content-store-eu-west/content/egi:10VLJRXWKKR/PAGE-IMAGE/image/jpg/dc2fe3f0410c1a1ddcf74209144ff88b/Dallas_Rensel_hydrodeoxygenation_dehydration_2016_P08.jpg https://s3.amazonaws.com/prod-ucs-content-store-us-east/content/egi:10VLJRXWKKR/PAGE-IMAGE/image/jpg/dc2fe3f0410c1a1ddcf74209144ff88b/Dallas_Rensel_hydrodeoxygenation_dehydration_2016_P08.jpg https://ucs.elsevier.com/asset/6d1d677b-678f-44a3-b234-3f8dade62f39 Dallas_Rensel_hydrodeoxygenation_dehydration_2016_P08 Dallas_Rensel_hydrodeoxygenation_dehydration_2016_P08.jpg jpg 479232 08 AAM-PAGE-IMAGE 1-s2.0-S0926860X16303258-Dallas_Rensel_hydrodeoxygenation_dehydration_2016_P09.jpg https://s3-eu-west-1.amazonaws.com/prod-ucs-content-store-eu-west/content/egi:10VLJRXWKKR/PAGE-IMAGE/image/jpg/45a633e1b9035a415a784b55b675c360/Dallas_Rensel_hydrodeoxygenation_dehydration_2016_P09.jpg https://s3.amazonaws.com/prod-ucs-content-store-us-east/content/egi:10VLJRXWKKR/PAGE-IMAGE/image/jpg/45a633e1b9035a415a784b55b675c360/Dallas_Rensel_hydrodeoxygenation_dehydration_2016_P09.jpg https://ucs.elsevier.com/asset/d595da0b-9a59-46c3-99e5-d5ab1aa1d3a8 Dallas_Rensel_hydrodeoxygenation_dehydration_2016_P09 Dallas_Rensel_hydrodeoxygenation_dehydration_2016_P09.jpg jpg 490059 09 AAM-PAGE-IMAGE 1-s2.0-S0926860X16303258-Dallas_Rensel_hydrodeoxygenation_dehydration_2016_P10.jpg https://s3-eu-west-1.amazonaws.com/prod-ucs-content-store-eu-west/content/egi:10VLJRXWKKR/PAGE-IMAGE/image/jpg/1430d3a319b0b4af1e919f103a57a81c/Dallas_Rensel_hydrodeoxygenation_dehydration_2016_P10.jpg https://s3.amazonaws.com/prod-ucs-content-store-us-east/content/egi:10VLJRXWKKR/PAGE-IMAGE/image/jpg/1430d3a319b0b4af1e919f103a57a81c/Dallas_Rensel_hydrodeoxygenation_dehydration_2016_P10.jpg https://ucs.elsevier.com/asset/8ae4ff01-cbbb-4e2e-9866-4fd74a287059 Dallas_Rensel_hydrodeoxygenation_dehydration_2016_P10 Dallas_Rensel_hydrodeoxygenation_dehydration_2016_P10.jpg jpg 537692 10 AAM-PAGE-IMAGE 1-s2.0-S0926860X16303258-Dallas_Rensel_hydrodeoxygenation_dehydration_2016_P11.jpg https://s3-eu-west-1.amazonaws.com/prod-ucs-content-store-eu-west/content/egi:10VLJRXWKKR/PAGE-IMAGE/image/jpg/393b0e2e80eb4c66d54735588395f4a5/Dallas_Rensel_hydrodeoxygenation_dehydration_2016_P11.jpg https://s3.amazonaws.com/prod-ucs-content-store-us-east/content/egi:10VLJRXWKKR/PAGE-IMAGE/image/jpg/393b0e2e80eb4c66d54735588395f4a5/Dallas_Rensel_hydrodeoxygenation_dehydration_2016_P11.jpg https://ucs.elsevier.com/asset/1fe5505d-e4a9-4d32-b6be-0415a9cb7394 Dallas_Rensel_hydrodeoxygenation_dehydration_2016_P11 Dallas_Rensel_hydrodeoxygenation_dehydration_2016_P11.jpg jpg 533865 11 AAM-PAGE-IMAGE 1-s2.0-S0926860X16303258-Dallas_Rensel_hydrodeoxygenation_dehydration_2016_P12.jpg https://s3-eu-west-1.amazonaws.com/prod-ucs-content-store-eu-west/content/egi:10VLJRXWKKR/PAGE-IMAGE/image/jpg/8bf46a2bd3055f0a9d5e9c18a4e4f27d/Dallas_Rensel_hydrodeoxygenation_dehydration_2016_P12.jpg https://s3.amazonaws.com/prod-ucs-content-store-us-east/content/egi:10VLJRXWKKR/PAGE-IMAGE/image/jpg/8bf46a2bd3055f0a9d5e9c18a4e4f27d/Dallas_Rensel_hydrodeoxygenation_dehydration_2016_P12.jpg https://ucs.elsevier.com/asset/fb7358d8-1ad3-47cb-9f77-758f9e21c030 Dallas_Rensel_hydrodeoxygenation_dehydration_2016_P12 Dallas_Rensel_hydrodeoxygenation_dehydration_2016_P12.jpg jpg 504429 12 AAM-PAGE-IMAGE 1-s2.0-S0926860X16303258-Dallas_Rensel_hydrodeoxygenation_dehydration_2016_P13.jpg https://s3-eu-west-1.amazonaws.com/prod-ucs-content-store-eu-west/content/egi:10VLJRXWKKR/PAGE-IMAGE/image/jpg/964919153d838d2b4f22fdd52c340a3d/Dallas_Rensel_hydrodeoxygenation_dehydration_2016_P13.jpg https://s3.amazonaws.com/prod-ucs-content-store-us-east/content/egi:10VLJRXWKKR/PAGE-IMAGE/image/jpg/964919153d838d2b4f22fdd52c340a3d/Dallas_Rensel_hydrodeoxygenation_dehydration_2016_P13.jpg https://ucs.elsevier.com/asset/ea02976f-16a5-4526-963a-2c9d33c86e47 Dallas_Rensel_hydrodeoxygenation_dehydration_2016_P13 Dallas_Rensel_hydrodeoxygenation_dehydration_2016_P13.jpg jpg 445030 13 AAM-PAGE-IMAGE 1-s2.0-S0926860X16303258-Dallas_Rensel_hydrodeoxygenation_dehydration_2016_P14.jpg https://s3-eu-west-1.amazonaws.com/prod-ucs-content-store-eu-west/content/egi:10VLJRXWKKR/PAGE-IMAGE/image/jpg/71ae0f109c61e0fb9ba3a319f0949b0b/Dallas_Rensel_hydrodeoxygenation_dehydration_2016_P14.jpg https://s3.amazonaws.com/prod-ucs-content-store-us-east/content/egi:10VLJRXWKKR/PAGE-IMAGE/image/jpg/71ae0f109c61e0fb9ba3a319f0949b0b/Dallas_Rensel_hydrodeoxygenation_dehydration_2016_P14.jpg https://ucs.elsevier.com/asset/0a2d554c-65b3-472d-a8e4-970fd3fc256a Dallas_Rensel_hydrodeoxygenation_dehydration_2016_P14 Dallas_Rensel_hydrodeoxygenation_dehydration_2016_P14.jpg jpg 548540 14 AAM-PAGE-IMAGE 1-s2.0-S0926860X16303258-Dallas_Rensel_hydrodeoxygenation_dehydration_2016_P15.jpg https://s3-eu-west-1.amazonaws.com/prod-ucs-content-store-eu-west/content/egi:10VLJRXWKKR/PAGE-IMAGE/image/jpg/21073739f5f285eb873bb56e65c20ffb/Dallas_Rensel_hydrodeoxygenation_dehydration_2016_P15.jpg https://s3.amazonaws.com/prod-ucs-content-store-us-east/content/egi:10VLJRXWKKR/PAGE-IMAGE/image/jpg/21073739f5f285eb873bb56e65c20ffb/Dallas_Rensel_hydrodeoxygenation_dehydration_2016_P15.jpg https://ucs.elsevier.com/asset/c22ba6ef-cbd1-42fa-9aea-62dce54fe98d Dallas_Rensel_hydrodeoxygenation_dehydration_2016_P15 Dallas_Rensel_hydrodeoxygenation_dehydration_2016_P15.jpg jpg 466940 15 AAM-PAGE-IMAGE 1-s2.0-S0926860X16303258-Dallas_Rensel_hydrodeoxygenation_dehydration_2016_P16.jpg https://s3-eu-west-1.amazonaws.com/prod-ucs-content-store-eu-west/content/egi:10VLJRXWKKR/PAGE-IMAGE/image/jpg/a2503e186fb917b40b737e41cdb3e5ac/Dallas_Rensel_hydrodeoxygenation_dehydration_2016_P16.jpg https://s3.amazonaws.com/prod-ucs-content-store-us-east/content/egi:10VLJRXWKKR/PAGE-IMAGE/image/jpg/a2503e186fb917b40b737e41cdb3e5ac/Dallas_Rensel_hydrodeoxygenation_dehydration_2016_P16.jpg https://ucs.elsevier.com/asset/2e739272-2433-409b-8ce4-23e16192b641 Dallas_Rensel_hydrodeoxygenation_dehydration_2016_P16 Dallas_Rensel_hydrodeoxygenation_dehydration_2016_P16.jpg jpg 453070 16 AAM-PAGE-IMAGE 1-s2.0-S0926860X16303258-Dallas_Rensel_hydrodeoxygenation_dehydration_2016_P17.jpg https://s3-eu-west-1.amazonaws.com/prod-ucs-content-store-eu-west/content/egi:10VLJRXWKKR/PAGE-IMAGE/image/jpg/724438c6ee9f5c61f6d63e375c0163c0/Dallas_Rensel_hydrodeoxygenation_dehydration_2016_P17.jpg https://s3.amazonaws.com/prod-ucs-content-store-us-east/content/egi:10VLJRXWKKR/PAGE-IMAGE/image/jpg/724438c6ee9f5c61f6d63e375c0163c0/Dallas_Rensel_hydrodeoxygenation_dehydration_2016_P17.jpg https://ucs.elsevier.com/asset/3129a9a5-4004-46f6-894e-5ff9ea49e37c Dallas_Rensel_hydrodeoxygenation_dehydration_2016_P17 Dallas_Rensel_hydrodeoxygenation_dehydration_2016_P17.jpg jpg 368269 17 AAM-PAGE-IMAGE 1-s2.0-S0926860X16303258-Dallas_Rensel_hydrodeoxygenation_dehydration_2016_P18.jpg https://s3-eu-west-1.amazonaws.com/prod-ucs-content-store-eu-west/content/egi:10VLJRXWKKR/PAGE-IMAGE/image/jpg/597d2fdf7793c4355cc99beafba195e4/Dallas_Rensel_hydrodeoxygenation_dehydration_2016_P18.jpg https://s3.amazonaws.com/prod-ucs-content-store-us-east/content/egi:10VLJRXWKKR/PAGE-IMAGE/image/jpg/597d2fdf7793c4355cc99beafba195e4/Dallas_Rensel_hydrodeoxygenation_dehydration_2016_P18.jpg https://ucs.elsevier.com/asset/d467ef5a-104d-41a5-99b7-76fcd9a8d0da Dallas_Rensel_hydrodeoxygenation_dehydration_2016_P18 Dallas_Rensel_hydrodeoxygenation_dehydration_2016_P18.jpg jpg 431338 18 AAM-PAGE-IMAGE 1-s2.0-S0926860X16303258-Dallas_Rensel_hydrodeoxygenation_dehydration_2016_P19.jpg https://s3-eu-west-1.amazonaws.com/prod-ucs-content-store-eu-west/content/egi:10VLJRXWKKR/PAGE-IMAGE/image/jpg/7e6ce22165f709299bb8e7635240f7ff/Dallas_Rensel_hydrodeoxygenation_dehydration_2016_P19.jpg https://s3.amazonaws.com/prod-ucs-content-store-us-east/content/egi:10VLJRXWKKR/PAGE-IMAGE/image/jpg/7e6ce22165f709299bb8e7635240f7ff/Dallas_Rensel_hydrodeoxygenation_dehydration_2016_P19.jpg https://ucs.elsevier.com/asset/a8519e6f-7c1f-4e77-9334-605fa0db767a Dallas_Rensel_hydrodeoxygenation_dehydration_2016_P19 Dallas_Rensel_hydrodeoxygenation_dehydration_2016_P19.jpg jpg 430393 19 AAM-PAGE-IMAGE 1-s2.0-S0926860X16303258-Dallas_Rensel_hydrodeoxygenation_dehydration_2016_P20.jpg https://s3-eu-west-1.amazonaws.com/prod-ucs-content-store-eu-west/content/egi:10VLJRXWKKR/PAGE-IMAGE/image/jpg/73b912bfaec0dfb84c8e0f2c7b7698b9/Dallas_Rensel_hydrodeoxygenation_dehydration_2016_P20.jpg https://s3.amazonaws.com/prod-ucs-content-store-us-east/content/egi:10VLJRXWKKR/PAGE-IMAGE/image/jpg/73b912bfaec0dfb84c8e0f2c7b7698b9/Dallas_Rensel_hydrodeoxygenation_dehydration_2016_P20.jpg https://ucs.elsevier.com/asset/d48817dc-8a22-4bb7-a2f1-8aaa9d052ede Dallas_Rensel_hydrodeoxygenation_dehydration_2016_P20 Dallas_Rensel_hydrodeoxygenation_dehydration_2016_P20.jpg jpg 540178 20 AAM-PAGE-IMAGE 1-s2.0-S0926860X16303258-Dallas_Rensel_hydrodeoxygenation_dehydration_2016_P21.jpg https://s3-eu-west-1.amazonaws.com/prod-ucs-content-store-eu-west/content/egi:10VLJRXWKKR/PAGE-IMAGE/image/jpg/5188c43166393c9a27a3900a9114d15e/Dallas_Rensel_hydrodeoxygenation_dehydration_2016_P21.jpg https://s3.amazonaws.com/prod-ucs-content-store-us-east/content/egi:10VLJRXWKKR/PAGE-IMAGE/image/jpg/5188c43166393c9a27a3900a9114d15e/Dallas_Rensel_hydrodeoxygenation_dehydration_2016_P21.jpg https://ucs.elsevier.com/asset/311dcfb2-607d-4efe-ac84-f8f94eb7e852 Dallas_Rensel_hydrodeoxygenation_dehydration_2016_P21 Dallas_Rensel_hydrodeoxygenation_dehydration_2016_P21.jpg jpg 533642 21 AAM-PAGE-IMAGE 1-s2.0-S0926860X16303258-Dallas_Rensel_hydrodeoxygenation_dehydration_2016_P22.jpg https://s3-eu-west-1.amazonaws.com/prod-ucs-content-store-eu-west/content/egi:10VLJRXWKKR/PAGE-IMAGE/image/jpg/38236771c2ede7954b17f0c6ba7ea2ec/Dallas_Rensel_hydrodeoxygenation_dehydration_2016_P22.jpg https://s3.amazonaws.com/prod-ucs-content-store-us-east/content/egi:10VLJRXWKKR/PAGE-IMAGE/image/jpg/38236771c2ede7954b17f0c6ba7ea2ec/Dallas_Rensel_hydrodeoxygenation_dehydration_2016_P22.jpg https://ucs.elsevier.com/asset/22fd6eef-1537-4783-85ff-b01a5ee895f4 Dallas_Rensel_hydrodeoxygenation_dehydration_2016_P22 Dallas_Rensel_hydrodeoxygenation_dehydration_2016_P22.jpg jpg 304088 22 AAM-PAGE-IMAGE 1-s2.0-S0926860X16303258-Dallas_Rensel_hydrodeoxygenation_dehydration_2016_P23.jpg https://s3-eu-west-1.amazonaws.com/prod-ucs-content-store-eu-west/content/egi:10VLJRXWKKR/PAGE-IMAGE/image/jpg/7c000a3ecc8a4346a9b12e0801c35377/Dallas_Rensel_hydrodeoxygenation_dehydration_2016_P23.jpg https://s3.amazonaws.com/prod-ucs-content-store-us-east/content/egi:10VLJRXWKKR/PAGE-IMAGE/image/jpg/7c000a3ecc8a4346a9b12e0801c35377/Dallas_Rensel_hydrodeoxygenation_dehydration_2016_P23.jpg https://ucs.elsevier.com/asset/5c6fe27d-f075-4739-b5aa-a11e22fb9d22 Dallas_Rensel_hydrodeoxygenation_dehydration_2016_P23 Dallas_Rensel_hydrodeoxygenation_dehydration_2016_P23.jpg jpg 459501 23 AAM-PAGE-IMAGE 1-s2.0-S0926860X16303258-Dallas_Rensel_hydrodeoxygenation_dehydration_2016_P24.jpg https://s3-eu-west-1.amazonaws.com/prod-ucs-content-store-eu-west/content/egi:10VLJRXWKKR/PAGE-IMAGE/image/jpg/f6e3f7001ed39014bd5777979e18245a/Dallas_Rensel_hydrodeoxygenation_dehydration_2016_P24.jpg https://s3.amazonaws.com/prod-ucs-content-store-us-east/content/egi:10VLJRXWKKR/PAGE-IMAGE/image/jpg/f6e3f7001ed39014bd5777979e18245a/Dallas_Rensel_hydrodeoxygenation_dehydration_2016_P24.jpg https://ucs.elsevier.com/asset/125d6c6e-8bbe-40ee-bfc7-16875ce5c591 Dallas_Rensel_hydrodeoxygenation_dehydration_2016_P24 Dallas_Rensel_hydrodeoxygenation_dehydration_2016_P24.jpg jpg 514743 24 AAM-PAGE-IMAGE 1-s2.0-S0926860X16303258-Dallas_Rensel_hydrodeoxygenation_dehydration_2016_P25.jpg https://s3-eu-west-1.amazonaws.com/prod-ucs-content-store-eu-west/content/egi:10VLJRXWKKR/PAGE-IMAGE/image/jpg/e1d4d407b39c11bbc77fb2d1f5b31b95/Dallas_Rensel_hydrodeoxygenation_dehydration_2016_P25.jpg https://s3.amazonaws.com/prod-ucs-content-store-us-east/content/egi:10VLJRXWKKR/PAGE-IMAGE/image/jpg/e1d4d407b39c11bbc77fb2d1f5b31b95/Dallas_Rensel_hydrodeoxygenation_dehydration_2016_P25.jpg https://ucs.elsevier.com/asset/10766855-035f-4c0b-8b04-0e6e37f7bad3 Dallas_Rensel_hydrodeoxygenation_dehydration_2016_P25 Dallas_Rensel_hydrodeoxygenation_dehydration_2016_P25.jpg jpg 555883 25 AAM-PAGE-IMAGE 1-s2.0-S0926860X16303258-Dallas_Rensel_hydrodeoxygenation_dehydration_2016_P26.jpg https://s3-eu-west-1.amazonaws.com/prod-ucs-content-store-eu-west/content/egi:10VLJRXWKKR/PAGE-IMAGE/image/jpg/6ea816a4313e26ba2d1282fd33b44ea9/Dallas_Rensel_hydrodeoxygenation_dehydration_2016_P26.jpg https://s3.amazonaws.com/prod-ucs-content-store-us-east/content/egi:10VLJRXWKKR/PAGE-IMAGE/image/jpg/6ea816a4313e26ba2d1282fd33b44ea9/Dallas_Rensel_hydrodeoxygenation_dehydration_2016_P26.jpg https://ucs.elsevier.com/asset/d1dce407-2433-4883-9f94-cb44f634acbf Dallas_Rensel_hydrodeoxygenation_dehydration_2016_P26 Dallas_Rensel_hydrodeoxygenation_dehydration_2016_P26.jpg jpg 715725 26 AAM-PAGE-IMAGE 1-s2.0-S0926860X16303258-Dallas_Rensel_hydrodeoxygenation_dehydration_2016_P27.jpg https://s3-eu-west-1.amazonaws.com/prod-ucs-content-store-eu-west/content/egi:10VLJRXWKKR/PAGE-IMAGE/image/jpg/8fa79a2f84ca75f2604e4473a012b5b5/Dallas_Rensel_hydrodeoxygenation_dehydration_2016_P27.jpg https://s3.amazonaws.com/prod-ucs-content-store-us-east/content/egi:10VLJRXWKKR/PAGE-IMAGE/image/jpg/8fa79a2f84ca75f2604e4473a012b5b5/Dallas_Rensel_hydrodeoxygenation_dehydration_2016_P27.jpg https://ucs.elsevier.com/asset/05ac6e5d-a3f4-4732-98c4-1bb7a751c14e Dallas_Rensel_hydrodeoxygenation_dehydration_2016_P27 Dallas_Rensel_hydrodeoxygenation_dehydration_2016_P27.jpg jpg 382971 27 AAM-PAGE-IMAGE 1-s2.0-S0926860X16303258-Dallas_Rensel_hydrodeoxygenation_dehydration_2016_P28.jpg https://s3-eu-west-1.amazonaws.com/prod-ucs-content-store-eu-west/content/egi:10VLJRXWKKR/PAGE-IMAGE/image/jpg/33cf22e3b42a57dc2dd2b2b1f00f919e/Dallas_Rensel_hydrodeoxygenation_dehydration_2016_P28.jpg https://s3.amazonaws.com/prod-ucs-content-store-us-east/content/egi:10VLJRXWKKR/PAGE-IMAGE/image/jpg/33cf22e3b42a57dc2dd2b2b1f00f919e/Dallas_Rensel_hydrodeoxygenation_dehydration_2016_P28.jpg https://ucs.elsevier.com/asset/8729e92c-04fe-4132-a049-1e2617cb4be0 Dallas_Rensel_hydrodeoxygenation_dehydration_2016_P28 Dallas_Rensel_hydrodeoxygenation_dehydration_2016_P28.jpg jpg 246105 28 AAM-PAGE-IMAGE 1-s2.0-S0926860X16303258-am.pdf https://s3-eu-west-1.amazonaws.com/prod-ucs-content-store-eu-west/content/egi:10VLJRXWKKR/MAIN/application/pdf/cec1306365159bf9c189eded93c1df79/am.pdf am am.pdf pdf 786196 AAM-PDF APCATA 15905 S0926-860X(16)30325-8 10.1016/j.apcata.2016.06.011 Elsevier B.V. Fig. 1 Schematic representation of the multifunctional properties of FeMoP catalytically deoxygenating two lignin model compounds. Fig. 1 Fig. 2 Initial reaction rate of cyclohexanol dehydration normalized on (a) mass (-r0,COH/MASS) (b) and number of acid sites (-r0,COH/ACID) at several reaction temperatures. Inset in Fig. 2b shows the fitted Arrhenius plots based on the data plotted in Fig. 2b. The inset in Fig. 2b is a plot of ln(kapp ) vs 1000/TReaction (K−1). Fig. 2 Fig. 3 Initial reaction rates for phenol HDO normalized on (a) mass (-r0,PHEN/MASS) and (b) CO-titrated metal sites (-r0,PHEN/CO) at various reaction temperatures. Inset in Fig. 3b shows the fitted Arrhenius plots based on the data plotted in Fig. 3b. The inset in Fig. 2b is a plot of ln(k′) vs 1000/TReaction (K−1). Fig. 3 Fig. 4 Plot of -r0,PHEN/MASS at various initial concentrations C0,H2 (black circles) and C0,PHEN (blue hollow squares) using FeMoP-650 for the HDO of phenol at 400°C. (For interpretation of the references to color in this figure legend, the reader is referred to the web version of this article.) Fig. 4 Fig. 5 Initial rate of phenol HDO on FeMoP-650 normalized on mass (-r0,PHEN/MASS) fitted to Langmuir-Hinshelwood kinetic model. Fig. 5 Fig. 6 Selectivity to benzene (SBEN) at various conversions of phenol (XPHEN) on the FeMoP catalysts at 400°C. Fig. 6 Fig. 7 (a) HDO pathway for CUSs (green circle) and (b) hydrogenation pathway for metallic sites (red square) on the FeMoP surface. (For interpretation of the references to color in this figure legend, the reader is referred to the web version of this article.) Fig. 7 Fig. 8 TOS study of the FeMoP-650 catalyst for the HDO of phenol. Fig. 8 Table 1 Physical properties of the FeMoP catalysts. Table 1 catalyst average crystallite size a , b (nm) SBET c (m2 g−1) ρACID d (μmolm−2) NCO e (μmolg−1) FeMoP-650 22.0 6.8 3.9 ± 0.4 28.5 ± 2 FeMoP-750 26.4 2.7 3.2 ± 0.3 9.6 ± 0.7 FeMoP-800 39.2 1.8 2.2 ± 0.2 5.3 ± 0.4 FeMoP-850 44.2 1.5 1.0 ± 0.1 2.0 ± 0.2 a Via Scherrer equation. b Average of values evaluated at (011), (200), and (211). c Via N2 physisorption. d Areal acid concentration (ρACID) via NH3-TPD and SBET. e Via CO-pulsed chemisorption. Investigating the multifunctional nature of bimetallic FeMoP catalysts using dehydration and hydrogenolysis reactions Dallas J. Rensel Jongsik Kim Yolanda Bonita Jason C. Hicks ⁎ University of Notre Dame, Department of Chemical and Biomolecular Engineering, 182 Fitzpatrick Hall, Notre Dame, IN 46556, United States University of Notre Dame Department of Chemical and Biomolecular Engineering 182 Fitzpatrick Hall Notre Dame IN 46556 United States ⁎ Corresponding author. Graphical abstract Herein, we investigate the effects of altering the multifunctional nature of a series of FeMoP catalysts for biomass deoxygenation reactions. Unsupported FeMoP catalysts were synthesized at reduction temperatures between 650°C and 850°C. The reduction temperature used during the synthesis of FeMoP altered the surface properties of these materials (i.e., acidity and CO-titrated metal sites) while leaving the bulk crystal structure of FeMoP unaffected. This alteration in the surface properties significantly affected the catalytic performance of FeMoP materials in the deoxygenation reactions. The catalytic performance of the FeMoP catalysts was first investigated using the acid catalyzed, non-aqueous, dehydration of cyclohexanol. Aside from showing high selectivities to cyclohexene (>99%) for all catalysts, the experiments demonstrated that FeMoP-650 showed the highest initial rate due to the largest number of surface acid sites among these catalysts. In addition, these FeMoP catalysts were examined using the hydrodeoxygenation (HDO) of phenol. While all FeMoP catalysts were highly selective to benzene (∼90%) at conversions less than 15%, studies at higher conversions of phenol provided evidence that catalysts with a higher amount of acid sites maintained enhanced selectivity to benzene. Furthermore, the stability of FeMoP catalysts for phenol HDO was tested with a 48h time-on-stream (TOS) study. FeMoP exhibited excellent stability, as evidenced by the retention of the initial reaction rate, selectivity to benzene, and oxidation state of surface species throughout the TOS run. Keywords Hydrodeoxygenation Dehydration Bimetallic Phosphides Catalyst Biofuels 1 Introduction Lignocellulosic biomass is an abundant and renewable resource from which to derive value-added chemicals and hydrocarbons [1–5]. In particular, the lignin portion of biomass, primarily consisting of phenolic ethers, is the largest source of aromatic compounds in nature [6]. It has been demonstrated that phenolic ethers can be catalytically transformed into a wide range of aromatic feedstocks primarily via deoxygenation reactions (e.g. hydrodeoxygenation (HDO)) [6]. Many transition metal catalysts, such as sulfides [7,8], noble metals [9–12], and carbides [13,14], have been studied for lignin and lignin model compound deoxygenation reactions at elevated temperatures (e.g., >200°C) [15]. While these catalysts have shown high activities for these reactions, they suffered from either low selectivities to aromatic products (i.e., noble metals [16–18]) and/or low stability during the reaction (i.e., sulfides [19,20], oxides [21], and carbides [22]) due in part to (1) preferential hydrogenation of CAROMATIC-H over CAROMATIC-O and (2) chemical susceptibility to coking and oxidation resulting from the oxygenated products. To obtain a good balance of activity, selectivity, and stability for catalytic deoxygenation of lignin and its derivatives, the catalysts should provide the following surface properties: (1) acid sites to aid in the removal of OH functional groups innate to lignin derivatives [23,24], (2) metal sites to adsorb lignin derivatives and catalyze HDO [13,25], and (3) coking and oxidation resistance under the reaction conditions employed [19–21]. Mono-metallic transition metal phosphides represent an interesting and amenable class of catalysts that can provide a unique combination of surface acidic and metallic species active for the deoxygenation of lignin [25–27]. Monometallic phosphide catalysts (e.g., Ni2P, Co2P, MoP, and FeP [28]), however, have been reported with low yields or low selectivities toward aromatic products in these reactions and exhibited low stability due potentially to surface oxidation during the reactions [28–30]. A highly promising method to modify the surface properties of phosphide catalysis is to incorporate a second metal into the mono-metallic structure to form a bimetallic structure. Bimetallic phosphides have been reported as catalysts with increased selectivity to aromatic products compared to mono-metallic phosphides in a variety of deoxygenation reactions [29,31–33]. In addition to retaining surface acidity and surface metal sites, the incorporation of the second transition metal provides another method to enhance the chemical, electronic, and surface properties of the phosphide catalysts [25]. Moreover, the catalytic properties of bimetallic phosphides can be tuned for improved performance by altering phosphide synthesis conditions, expanding the application of these materials to a variety of reactions [27,33]. However, there has not been a systematic study performed to elucidate the impact of synthetic conditions on surface properties and HDO catalytic performance. In spite of the aforementioned potential of these materials, there have been few reports detailing the effects of bimetallic phosphide synthesis conditions on their catalytic surface properties [33]. In a previous study, we employed bimetallic FeMoP as a catalyst to cleave CAROMATIC-O bonds of anisole, phenol, and phenethoxybenzene, which resulted in the production of deoxygenated aromatic compounds (e.g. benzene, toluene, ethylbenzene) with high selectivities (∼90%) over the production of saturated compounds (e.g. cyclohexane) [27]. The FeMoP catalyst also showed good stability for the deoxygenation of phenol, as it was able to catalyze this transformation for five consecutive reaction cycles with almost no loss in selectivity [27]. Herein, we varied the FeMoP reduction temperature to investigate the effects of synthesis conditions on catalytic surface properties (i.e., the number of surface acid and metal sites) and how these surface properties subsequently affected catalytic performance in deoxygenation reactions. Specifically, the multifunctional surface properties of the FeMoP catalysts were investigated using the catalytic deoxygenation of two lignin model compounds, cyclohexanol (with CALIPHATIC-O) and phenol (with CAROMATIC-O)], as probe reactions. The effect of acid sites present on the FeMoP surface was probed via the non-aqueous, dehydration of cyclohexanol, whereas the effect of metal sites (i.e. CO-titrated metal sites) on the FeMoP surface was studied via the HDO of phenol (Fig. 1 ). In addition, mechanistic studies were performed in order to understand how the combination of acid sites and metal sites affected the product selectivity for the HDO of phenol. In addition to detailed catalytic studies using these two reactions, the stability of the FeMoP catalysts was also evaluated via a 48h time-on-stream (TOS) experiment for the HDO of phenol. From these detailed experiments, it is evident that FeMoP catalysts can have a significant impact on deoxygenation reactions pertinent to biomass utilization and biofuels/bio-chemicals production. 2 Experimental methods 2.1 Chemicals All materials were used as-received with no further purification: citric acid (Alfa Aesar, 99%), FeNO3·9H2O (Alfa Aesar, 99%), (NH4)6Mo7O24•4H2O (Alfa Aesar, 99%), (NH4)2HPO4 (Amresco, 98%), phenol (Sigma-Aldrich, 99%), cyclohexanol (Alfa Aesar, 99%), benzene (Alfa Aesar, 99%), cyclohexene (Alfa Aesar, 99%), cyclohexane (Acros Organics, 99%) decane (Alfa Aesar, 99%), and Davisil® silica gel (Sigma Aldrich, Grade 635, 60–100 mesh). All gas cylinders (purity of ≥99.995%) were purchased from Airgas: Ar, He, N2, H2, 1% O2/He, 2% NH3/He, and 30% CO/He. 2.2 Synthesis of FeMoP catalysts FeMoP catalysts were synthesized according to a slightly modified procedure we previously reported [27]. FeNO3·9H2O, (NH4)6Mo7O24·4H2O, and (NH4)2HPO4 were added sequentially to an aqueous citric acid solution (0.4M in deionized water) while achieving a molar ratio of Fe:Mo:P of 1:1:1. The solution was partially dried using a rotary evaporator to form a viscous liquid prior to being transferred to a drying dish. The viscous solution was further dried and calcined under an air atmosphere with a ramp rate of 1.5°Cmin−1 to 200°C and held at 200°C for an hour. Subsequently, resulting intermediate was ground into a powder and then subjected to the calcination under the air atmosphere at 550°C with a ramp rate of 1°Cmin−1 and held at 550°C for six hours. The resulting material was a mixture of FePO4 and MoO3. Afterwards, the resulting powder was reduced using a Lindberg Blue M programmable tube furnace under the following condition: drying at 100°C for an hour under an Ar atmosphere with the flow rate of 60mLmin−1 followed by two-step reduction under a H2 atmosphere with the flow rate of 160mLmin−1 (1st step: holding at 260°C for an hour with the ramp rate of 5°Cmin−1 (between 25°C to 260°C); 2nd step: holding at target temperatures (i.e., 650, 750, 800, and 850°C) for two hours with the ramp rate of 5°Cmin−1 (between 260°C to target temperature)). After the reduction, the resulting FeMoP catalysts were cooled to room temperature under the H2 atmosphere, passivated using a 1% O2/He with the flow rate of 60mLmin−1 for an hour, and then transferred to a glovebox purged with a N2 atmosphere (>99%). The resulting FeMoP catalysts were denoted as FeMoP-XXX, where XXX indicates the target reduction temperature employed under the 2nd reduction step. 2.3 Characterization X-ray diffraction (XRD) patterns were collected using a Bruker DaVinci Advanced D8 X-ray diffractometer equipped with a Cu Kα radiation source (λ=1.5418Å) under a 2θ range of 20–60°, a scan speed of 3.5s./step, and a size step of 0.02°/step. Crystallite size was evaluated using the Scherrer equation shown in Eq. (1), where K is the shape factor (0.9, based on prior work on phosphides [34]), λ is the wavelength of the Cu Kα source, β is the full width half max (FWHM) value of the peak, and θ is the Bragg angle. (1) c r y s t a l l i t e s i z e = K λ β c o s θ In situ transmission electron microscopy (TEM) images were acquired on a FEI Titan 80–300 microscope at 300 keV, equipped with in situ sample holder along with heating chip (DENS Solutions Corporation). The TEM samples were prepared by sonicating the catalyst in iso-propyl alcohol for 5min, placing one drop of the suspension on the in situ sample holder, and then drying under vacuum (10−2 torr) at room temperature for 2h prior to analysis. NH3 temperature programmed desorption (NH3-TPD) experiments were conducted on a Micromeritics Chemisorb 2750 equipped with a thermal conductivity detector (TCD) and TPx temperature controller. The catalyst was re-reduced under a H2 atmosphere by ramping at a rate of 10°Cmin−1 to 400°C for an hour. Chemisorption of NH3 was performed at 100°C for 3h. Subsequently, NH3 desorption was performed in flowing He by ramping at 10°Cmin−1 to 230°C, holding for 42min, then ramping at 10°Cmin−1 to 400°C, and holding for 42min. The desorbed area was quantified based on NH3 calibrations determined using the 2% NH3/He. CO chemisorption experiments were conducted on the Micromeritics Chemisorb 2750 instrument following the same pre-treatment steps as the NH3-TPD experiments. Pulse chemisorption of CO was performed at 35°C using 0.1mL injections of a 30% CO/He. The CO uptake on each material was obtained by summing the area of each peak and subsequently quantified based on CO calibrations determined using 30% CO/He. Brunauer-Emmett-Teller surface area (SBET) of the catalyst was analyzed using a Quantachrome Nova 2200e. A PHI VersaProbe II X-ray Photoelectron Spectrometer was used to obtain X-ray photoelectron (XP) spectra of the catalysts to analyze the surface species. The Fe 2p3/2, Mo 3d5/2, and P 2p3/2 peaks were used to compare binding energies based on a C 1s reference peak located at 284.5eV. 2.4 Dehydration of cyclohexanol and HDO of phenol All reactions were performed in a custom-built continuous flow reactor. For the kinetic studies, the reaction was operated in the forward reaction-dominant regime with the conversion of 15% or lower. In a typical experiment, 30mg of the catalyst particles were diluted using 100mg of Davisil® grade 635 and subsequently packed in a 316 stainless steel reactor equipped with a stainless mesh steel screen (10μm, McMaster-Carr) and quartz wool (VWR Scientific) to immobilize the catalysts particles in the reactor. The reactor was operated in an up-flow configuration. Flow rates of reactant solutions (0.13M of cyclohexanol dissolved in decane; 0.13M of phenol dissolved in decane) were controlled using a high pressure liquid chromatography (HPLC) pump (Hitachi L-6000), whereas flow rates of gases (100mLmin−1 of N2 for cyclohexanol; 100mLmin−1 of H2 for phenol) were regulated using a mass flow controller (Aalborg GFC17). Reaction temperature was set using PID controllers and maintained at 180–220°C (for cyclohexanol) and 350–400°C (for phenol) using a heat tape (Omega Engineering) equipped on the reactor. HDO reactions were operated in an excess hydrogen flow with the feed molar ratio of H2 to phenol as ∼34. Catalytic results (i.e., conversion and selectivity) were quantified using an Agilent 7890A gas chromatograph (GC) directly coupled with an Agilent 5975C mass spectrometer (MS) based on external calibration curves of both reactants and products. Throughout all reaction runs, the carbon balance was 96% or greater. Conversion and selectivity were calculated based on Eqs. (2) and (3). (2) c o n v e r s i o n = m o l e s o f r e a c t a n t c o n v e r t e d m o l e s o f r e a c t a n t f e d × 100 (3) s e l e c t i v i t y = m o l e s o f s p e c i f i c p r o d u c t m o l e s o f a l l p r o d u c t s × 100 All reported reaction rates are initial rates calculated by using the rate expression discussed in the text and extrapolating to the initial solution concentration. The fitted rate law was validated based on the reactions run at 400°C with varying concentrations of phenol and varying concentrations of H2 using the FeMoP-650 catalyst. 3 Results and discussion 3.1 FeMoP catalysts syntheses and characterizations The FeMoP catalysts were synthesized following a procedure we previously reported [27] except with varying reduction temperatures ranging from 400°C to 850°C (Fig. S1). This led to a series of FeMoP catalysts denoted as FeMoP-XXX (where XXX indicates the reduction temperature). The bulk crystal structures of the resulting FeMoP catalysts were investigated using X-ray diffraction (XRD). The purpose of this XRD analysis was to determine the range of reduction temperatures suitable for the production of the crystalline FeMoP structure. Aside from showing a peak assigned to a FeMoP diffraction (Fig. S2), the catalysts synthesized at 600°C or below exhibited multiple diffractions attributed to bulk phases of Mo, MoO2, MoO3, FePO4, and Fe2PO7, and thus were not studied as part of this work. In contrast, as shown in Fig. S3, the catalysts synthesized at 650°C or greater showed only diffractions assigned to the crystalline FeMoP bulk phase, and thus were utilized in this study. Notably, the increase in reduction temperatures used during the synthesis of FeMoP catalysts resulted in the continuous growth of FeMoP crystallites, as evidenced by the increase in average crystallites size from 22nm (650°C) to 44nm (850°C) estimated using the Scherrer equation (Table 1 ). This crystallite growth was also consistent to transmission electron microscopy (TEM) images of FeMoP-550 heated in situ from 650°C to 850°C (Fig. S4). In this experiment, a single region containing the catalyst was imaged at different temperatures to show the change in morphology. These images revealed a significant morphological change at 800°C, likely resulting from the aggregation of FeMoP crystallites. In agreement with the trend observed in both XRD and in situ TEM experiments, the increase in reduction temperatures also led to the decrease in BET surface areas (SBET) of the resulting FeMoP catalysts as determined by N2 physisorption experiments (Table 1). The surface properties were investigated using x-ray photoelectron spectroscopy (XPS). XPS analysis provided evidence the surface of the FeMoP catalysts was composed of Fe, Mo, and P species that were close to their zero valence states or at a higher oxidation state (Fig. S5). The oxidation state of the species close to their zero valence state was not clearly assigned due to interatomic effects in phosphide materials that induced a Madelung potential (electrostatic interaction), as reported for several MP and M2P materials (M=metal) [35,36]. These XP spectra also showed the presence of oxidized species such as Fe3+, Mo6+, and P5+ located at binding energies of 711.1eV, 232.1eV, and 133.5eV, respectively [27,37,38]. The oxidized surface species were likely formed by either oxidation of the catalyst surface during passivation under 1% O2 in He during synthesis or by the incomplete reduction to the FeMoP structure, both of which could provide Lewis and Brønsted surface acid sites (Mδ+ as Lewis acid sites and M-OH and/or P-OH as Brønsted acid sites) on the catalysts. Additionally, several prior studies that synthesized monometallic phosphide catalysts reported the evolution of phosphide gas during reduction of the precursors [26,34,39]. To test the potential loss of P on the FeMoP catalysts, XPS was used to determine the ratio of metal atoms to P atoms. The surface composition of P on FeMoP reduced at 650, 750, 800, and 850°C was 34, 32, 32, and 31at.%, respectively. While it is possible that some P is removed at higher reduction temperatures, the surface concentration of P was fairly unaffected. NH3-temperature programmed desorption (TPD) was used to quantify the surface acid concentration (ρACID, μmol m−2, in Table 1) present on the FeMoP catalysts (Fig. S6) [29]. Prior reports investigating NiMoP, MoP, and Ni2P have shown that two types of acid sites, Brønsted and Lewis, were present on the surface of phosphide materials [29,30,40]. One report suggested that NH3 desorbed from these two acid sites at different temperatures, ∼210°C for Brønsted acids and ∼320°C for Lewis acid sites [29]. The NH3 TPD plots in Fig. S6 shows two separate peaks, one at low temperature (∼210°C) and at high temperature (∼310°C), which suggested that two different types of acid sites were present on the FeMoP materials. As shown in Table 1, the increase in reduction temperatures resulted in a decrease in ρACID, which suggested that thermochemical reduction under a H2 atmosphere eliminated surface acid sites on FeMoP catalysts at elevated temperatures. In addition, the loss of surface area from sintering observed in in situ TEM images could also lead to the decrease in ρACID. The reduction in Brønsted acid sites was likely caused by H2 that thermochemically cleaved the OH groups on the surface of MP or M1M2P, liberating H2O [41–43]. This was suggested based on the phase transition of metal oxide and phosphate materials, which showed the gradual elimination of surface Brønsted acid sites at reduction temperatures of 500°C or greater [41–43]. The Lewis acid sites also decreased with an increase in reduction temperature. One possible reason for this decrease could be the heterolytic cleavage of H2 to form Mδ+-Hδ− surface species at higher reduction temperatures [44,45]. Other reports on supported metal phosphide catalysts (e.g., Ni2P [40]) have clearly shown Brønsted and Lewis acid sites from Fourier Transform Infrared spectroscopy (FT-IR) analysis. Attempts to collect spectroscopic data of these acid sites on the unsupported FeMoP catalysts were unsuccessful because these samples were dark in color and had a poor spectroscopic reflectivity, which in turn showed only weak peak intensities in the FT-IR spectra. In addition to the investigation of ρACID innate to the FeMoP catalysts, the quantity of CO-titrated surface metal sites (i.e. Lewis acid metal sites and metallic sites [46,47], NCO) in the FeMoP catalysts were also determined via CO pulsed chemisorption experiments. Similar as the trend of ρACID, the increase in reduction temperatures also reduced the quantity of NCO (Table 1). The loss of CO-titrated surface sites in the FeMoP catalysts at elevated reduction temperatures was likely due to the loss in the surface area from the growth of FeMoP crystallites (Fig. S4). 3.2 Deoxygenation on the FeMoP catalysts 3.2.1 Dehydration of cyclohexanol The effects of altering surface properties of the FeMoP on catalytic performance were then investigated using two lignin model compounds. Previously, surface acid sites (i.e. Brønsted and Lewis acid sites) in various catalysts have been shown to catalyze the dehydration of aliphatic alcohols with high selectivities to aliphatic alkenes [48,49]. Therefore, to determine if the acid sites on the FeMoP catalysts were accessible and catalytically active, the dehydration of cyclohexanol (a CALIPHATIC-OH compound, denoted as COH), a model compound that can be generated from the hydrogenation of lignin derivatives, was studied as a probe reaction [16,50]. The catalytic performances of the FeMoP catalysts for this reaction were evaluated using a flow reactor under a N2 atmosphere (5.2MPa) at 220°C. All reaction runs were operated in the reaction-limited regime (XCYCLOHEXANOL ≤15%) and utilized an identical amount of catalyst for each reaction (30mg). A 1st-order reaction assumption was used for the calculation of reaction rate based on previous reports with solid acid catalysts [16,51]. The initial rate of cyclohexanol consumption for each catalyst was calculated from the rate and concentration measured during reaction. The measured rate was used to determine the rate constant, which was then multiplied by the initial concentration of cyclohexanol to obtain the initial reaction rate. It should be noted that neither mass transport limitations nor reaction heat effects played significant roles during the kinetic evaluation. This was evidenced by three control reaction runs with FeMoP-650 at 220°C (Fig. S7) which showed consistent values of -r0,COH/MASS under the employed reaction conditions (particle size=60–100mesh, flow rate=1.0mLmin−1 solution, diluent ratio=4 parts silica gel to 1 part catalyst), regardless of varying the size of the catalytic particles, flow rate of cyclohexanol, and amount of the diluent. The FeMoP-800 catalyst was excluded in this study due to its similar surface properties (e.g., ρACID and SBET in Table 1) to those of FeMoP-850. As expected, these reactions evolved cyclohexene with high selectivities (>99%) at all temperatures with all catalysts (FeMoP-650, FeMoP-750, and FeMoP-850). Values of -r0,COH/MASS for the FeMoP catalysts showed that the -r0,COH/MASS values decreased with an increase in the reduction temperatures used to synthesize the FeMoP catalysts. Furthermore, as stated above, an increase in reduction temperature also led to lower values of ρACID (Fig. 2 a). Finally, the initial forward reaction rates when normalized on the number of acid sites per gram (-r0, COH/ACID) for FeMoP catalysts reduced at 650, 750, and 850°C were nearly identical at any given reaction temperature (Fig. 2b). Therefore, surface acid sites were the active sites for the dehydration of cyclohexanol. Kinetic data for the dehydration of cyclohexanol at five temperatures (180, 190, 200, 210, and 220°C) were evaluated in order to obtain activation energies (EA) for the FeMoP catalysts. The FeMoP catalysts not only followed Arrhenius behavior under the employed reaction temperatures (Fig. 2b) but all materials also exhibited similar values of EA (∼130kJmol−1) in this reaction. Previous studies reported that similar values of EA suggested a similar pathway for this reaction when using acid catalysts (e.g. HZSM-5 [17], γ-Al2O3 [52], and H3PO4 [17]). This suggests that all FeMoP materials catalyzed the reaction following a similar mechanistic pathway. 3.2.2 HDO of phenol The catalytic role of CO-titrated metal sites (NCO) present on the surface of the FeMoP catalysts was investigated using another lignin model compound, phenol (CAROMATIC-O, denoted as PHEN), as a probe molecule. These CO-titrated metal sites are likely a combination of near zero-valent metal sites [53,54] and Lewis acid sites (or coordinatively unsaturated sites (CUSs) [30]), both of which could be active sites for the HDO of biomass model compounds [30,55,56]. In this study, phenol dissolved in decane was fed to the reactor packed with the FeMoP catalysts at 400°C and reacted under a H2 atmosphere (5.2MPa). Similar to the dehydration of cyclohexanol, identical amounts (30mg) of FeMoP catalysts were used in each reaction run to compare the initial reaction rate normalized on the mass of each catalysts (-r0,PHEN/MASS) resulting from operation at XPHENOL ≤∼15%. Again, to ensure that the reactions were operated in the forward reaction-dominant regime, three control experiments were performed which demonstrated negligible mass and heat transport effects during the reaction runs (Fig. S8). The product selectivity in the forward reaction-dominant regime favored the production of benzene (∼90% selectivity) for all FeMoP catalysts at 400°C (Fig. S9). Phenol HDO was then performed at varying reaction temperatures, and the results are depicted in Fig. 3 . A decrease in -r0,PHEN/MASS was observed on FeMoP catalysts synthesized at higher reduction temperatures (Fig. 3a). Additionally, as noted above (Table 1), the NCO sites decreased on the FeMoP catalysts synthesized at higher reduction temperatures. When these rates were normalized on NCO (-r0,PHEN/CO, Fig. 3b), all FeMoP catalysts had similar values of -r0,PHEN/CO, which suggested that the CO-titrated metal sites were the primary active sites for the HDO of phenol. The normalization on CO-titrated metal sites was in agreement with previous studies in which surface metals sites (NiMoP [29] and FeNiP [57]) of bimetallic phosphides were suggested as active sites for the HDO of model compounds (e.g. anisole and 2-methyltetrahydrofuran). The -r0,PHEN/CO values for FeMoP-650 were slightly lower than those for FeMoP-750 and FeMoP-850. This could be due to the different accessibility of the reactant to active sites of the much smaller crystallites observed in FeMoP-650 compared to FeMoP-750 and FeMoP-850 (Table 1 and Fig. S4). Multiple prior studies have investigated two site mechanisms for HDO reactions of various CAROMATIC-O model compounds. On Mo2C surfaces, one distinct metal site has been proposed to coordinate with the aromatic ring in the reactant while another metal site participates in the CAROMATIC-O bond cleavage [13,58–60]. Several other studies have proposed that the O functionality in the reactant binds to a hydroxyl or acid site while a reduced metal site facilitates H2 dissociation used to cleave the CAROMATIC-O bond [24,61–63]. Yet another type of mechanism that has been proposed for HDO reactions is a Mars-van Krevelen or reverse Mars-van Krevelen mechanism, which have been reported on oxide catalysts where surface vacancies form to facilitate the reaction [21,64]. For the FeMoP catalysts reported here, it is possible that a surface acid site binds to the OH in phenol to destabilize the Caromatic-O, while reduced metal surface sites dissociate H2 onto the surface. Using the above kinetic data in conjunction with reported mechanisms in literature [61,63], a two site Langmuir–Hinshelwood mechanism was proposed (Eqs. (4)–(9)), where R, S1, and S2 indicate phenyl (C6H5) and two surface sites, respectively. H2 first dissociatively adsorbs on two S1 sites (Eq. (4)), while phenol adsorbs on S2 (Eq. (5)). In the following step, a surface bound hydrogen species protonates the absorbed phenol (Eq. (6)), followed by the addition of another surface H species to form benzene (Eq. (7)). Two assumptions were made to link this two-site mechanism to values of -r0,PHEN-MASS on the FeMoP catalysts. Firstly, Eq. (7) was assumed irreversible and the rate-determining step (RDS) [63]. Eq. (6) could also be the RDS, but the derived rate expression in Eq. (10) would have the same form. Secondly, all elementary steps, except Eq. (5), were assumed to be pseudo-steady state, which provided a site-balance involving all chemical species adsorbed on both S1 and S2 during the HDO of phenol. The resulting −rPHEN/MASS based on the aforementioned assumptions can be expressed in Eq. (10), where k, K1 , and K2 denote reaction rate constant, adsorption coefficient for phenol, and adsorption coefficient for H2, respectively. (4) H 2 + 2 S 1 ⇆ 2 H − S 1 (5) R − O H + S 2 ⇆ R − O H − S 2 (6) R − O H − S 2 + H − S 1 ⇆ R − O H 2 − S 2 + S 1 (7) R − O H 2 − S 2 → O H − S 2 + R − H (8) O H − S 2 + H − S 1 ⇆ H 2 O − S 2 + S 1 (9) H 2 O − S 2 ⇆ H 2 O + S 2 (10) − r 0 , P H E N / M A S S = k [ K 1 C 0 , P H E N ( 1 + K 1 C 0 , P H E N ) ] [ ( K 2 C 0 , H 2 ) 1 2 ( 1 + ( K 2 C 0 , H 2 ) 1 2 ) ] Eq. (10) could be further simplified based on an additional study where -r0,PHEN/MASS was monitored as a function of C0,H2 and C0,PHEN (Fig. 4 ). The initial phenol HDO rate (-r0,PHEN/MASS) showed 0th-order dependence on the initial hydrogen concentration C0,H2 leading to the simplified rate expression in Eq. (11). In this simplification, because the initial hydrogen concentration (C0,H2) used during the reaction was far greater than the C0,PHEN, the contribution of C0,H2 to -r0,PHEN/MASS was assumed constant and therefore incorporated into the value of k′ (Eq. (11)). (11) − r 0 , P H E N / M A S S = k ′ [ K 1 C 0 , P H E N ( 1 + K 1 C 0 , P H E N ) ] Having proposed a mechanism and derived a rate law, data for -r0,PHEN/MASS of FeMoP-650 (Fig. 4) were fitted to a Langmuir–Hinshelwood kinetic model with an excellent agreement (R2 ∼0.97, Fig. 5 ). Furthermore, the value of K1 was extracted from this data, which was determined as 2.0M−1 at 400°C (Eq. (11)). Considering that the values of C0,PHEN ranged from 0.05M to 0.13M, the values of resulting K1 C0,PHEN were close to unity and could not be neglected. Based on the fitted data in Fig. 5, the value of k′ was calculated to be 1160min−1. Based on the rate expression in Eq. (10), the apparent activation energies (EA) of the FeMoP catalysts were determined by performing reactions at three additional reaction temperatures (350°C, 380°C, and 390°C). The values of EA (∼100kJmol−1, Fig. 3b) were similar for all FeMoP catalysts, which again implied a similar reaction pathway on these materials. Furthermore, in addition to consistently showing high selectivity to benzene (SBEN) at all reaction temperatures (Fig. S9), the FeMoP catalysts also exhibited values of initial forward rates of phenol normalized on NCO (-r0,PHEN/CO) that were almost invariant at each reaction temperature (Fig. 3b). The similar EA values and -r0,PHEN/CO for all FeMoP catalysts suggested that the FeMoP materials catalyzed the HDO of phenol along a similar reaction pathway [17,52] and, furthermore, the surface metal sites on the FeMoP catalysts were likely the active sites for this reaction. 3.2.3 Mechanistic evaluation The reaction pathway on the active sites of the FeMoP catalysts (CO-titrated metal sites) was investigated by observing the product selectivities from phenol HDO at different conversions. This was motivated by our previous batch reactions, using anisole as the model CAROMATIC-O compound, operated at high values of XANISOLE (i.e. >25–99%), which showed the FeMoP catalysts synthesized via the reduction at 750°C or lower led to an increase in aromatic products (e.g. benzene and toluene) compared to the FeMoP analogues synthesized at higher reduction temperatures [27]. As shown in Fig. 6 , the FeMoP catalysts showed very different values of SBEN at higher values of XPHEN (e.g., ∼70%). The SBEN on both FeMoP-650 and FeMoP-750 consistently reached values of ∼90% throughout the high conversion study. FeMoP-850, in contrast, showed a decrease in values of SBEN from ∼90% to ∼75%, when increasing the values of XPHEN up to ∼70%. The change in product selectivity at different conversions of phenol was likely due to surface coverage of the reactant and product molecules. At lower values of XPHEN the surface is covered primarily with phenol, and thus HDO reactions dominate. At higher values of XPHEN, the increased formation of benzene leads to higher surface coverages of benzene, which would allow for its subsequent hydrogenation on the FeMoP catalysts. One possible reason for the different values of SBEN among the FeMoP catalysts at higher XPHEN are due to the loss of CUSs (i.e. Lewis acid sites) on the FeMoP catalysts synthesized at higher reduction temperatures. Furthermore, the surface characterization in Table 1 shows that FeMoP-650 and FeMoP-750 contained a similar amount of acid and CO-titrated sites, while FeMoP-800 and FeMoP-850 had a higher amount of CO-titrated sites compared to acid sites. Therefore at least two types of metal sites likely existed on the FeMoP catalysts, metallic sites and CUSs (i.e. Lewis acid sites) [30,40]. The CUSs were of particular interest because prior reports with sulfide and phosphide catalysts suggested the CUSs to be the active sites for HDO of model compounds [30,55,56,65]. Additionally, it has been previously proposed in multiple independent studies that metallic sites are capable of hydrogenating aromatic rings to form aliphatic products (i.e. cyclohexane and cyclohexene, denoted as aliphatic) [30,66,67]. Thus it is proposed for these FeMoP materials (and summarized schematically in Fig. 7 ) that the surface likely contained CUSs that catalyzed the direct HDO of CAROMATIC-O, likely leading to the large SBEN for FeMoP-650 [30,55,56], and metallic sites that further hydrogenated the adsorbed CAROMATIC, likely resulting in the higher rate of formation of aliphatic products for FeMoP-850 [24,30,50]. Higher reduction temperatures may facilitate the loss of CUSs (i.e. Lewis acid sites) by removing them via heterolytic cleavage of H2 [44,45], as shown by the decrease in values of NACID with increasing reduction temperatures (Table 1). Furthermore, previous reports have demonstrated that the key CUSs in molybdenum sulfide catalysts, which are similar in surface properties to phosphide catalysts (i.e. Brønsted, Lewis, and metallic sites), predominantly formed on edges and rims of planes [68–70]. Thus, a reduction of edge and rim atoms compared to surface atoms via sintering could also decrease the number of CUSs relative to metallic surface atoms [68,69]. Therefore, the significant crystallite growth seen in the Scherrer analysis of XRD (Table 1) and morphology change observed in the in situ TEM analysis (Fig. S4) could lead to a reduction in the ratio of edge and rim atoms relative to metallic surface atoms, which would ultimately lead to a decrease in aromatic selectivity. Of note, it is possible that the water formed during the HDO of phenol could potentially interact with the surface to influence the acidity and thus the reactivity of the catalysts. This effect was tested by pulsing pure water for intervals of ∼15min during a time-on-stream study while operating at close to 20% phenol conversion using FeMoP-850. From the results shown in Fig. S10, the addition of water did not significantly affect -r0,PHEN/CO or SBEN. Therefore, from these studies, the water produced from the reaction is unlikely to affect the reactivity of the catalysts under these operating conditions. The HDO and hydrogenation pathways on the FeMoP catalysts were evaluated by co-feeding a reactant mixture of phenol and benzene at 400°C. For these control experiments, FeMoP-650 and FeMoP-850 were used as the catalysts due to their different SBEN profiles (Fig. 6). In these reactions, phenol (0.13M) mixed with benzene (30mol% with respect to the concentration of phenol, or 0.039M) was used as the feed stream. The 0.039M concentration of benzene was added in order to mimic the onset of hydrogenated products that were shown in Fig. 6 (SBEN started to decrease at XPHEN of ≥20%). Instead of investigating SBEN, the production rate of cyclohexene and cyclohexane (rALIPHATIC, μmolmin−1) was calculated at different residence times (Fig. S11). For the FeMoP-650 and FeMoP-850 catalysts, the addition of benzene to the feed stream decreased XPHEN. It is likely that benzene competitively adsorbed on the surface, which would result in a decreased XPHEN. The addition of benzene to the feed stream also slightly increased the values of rALIPHATIC for FeMoP-650 (0.12μmolmin−1 to 0.34μmolmin−1 at ∼70% conversion) (Fig. S11). Therefore, benzene could be hydrogenated on the FeMoP-650 catalyst under these conditions. This result also suggested that phenol was first deoxygenated to benzene and then subsequently hydrogenated to aliphatics through tandem reactions. The addition of benzene enhanced the values of rALIPHATIC for FeMoP-850 (0.76μmolmin−1 to 2.54μmolmin−1 at ∼70% conversion). This large increase in rALIPHATIC on FeMoP-850 suggested that the decrease in SBEN observed in Fig. 6 was a result of subsequent hydrogenation reactions. Therefore, it is possible that either the hydrogenation sites on FeMoP-850 were more active or present in a higher density (per mass basis) than the hydrogenation sites on FeMoP-650. To verify that FeMoP-850 was more active for benzene hydrogenation than FeMoP-650, reactions were run with only benzene to determine the rate of consumption of benzene (-r0,BEN,CO) (Fig. S12). FeMoP-850 was∼2.5 times more active than FeMoP-650 when normalized on CO-titrated sites. The results of these residence time studies were in line with two suggested reaction pathways, shown in Fig. 7, where the acid sites facilitate HDO on phenol followed by benzene hydrogenation on metallic sites (Fig. 8 ). 3.2.4 Stability in the HDO of phenol The catalytic stability of FeMoP-650 (catalyst with -r0,PHEN/MASS) was examined via a time-on-stream (TOS) study over 48h under 5.2MPa of H2 at 400°C. For 48h, FeMoP-650 was able to maintain activity (-r0,PHEN/CO ∼9.5μmolPHEN μmolCO −1 min−1) and selectivity (SBEN ∼90%), which demonstrated the catalytic stability of FeMoP-650. The catalytic stability of FeMoP-650 after the TOS run was further investigated using XPS in order to study the change in oxidation state of the surface species. The resulting XP spectrum was compared with that prior to the TOS run in order to determine if the surface of FeMoP-650 was altered due to the reaction conditions (Fig. S13). The C 1s region in the XP spectrum after the TOS run was first observed to investigate the potential formation of surface carbidic species that have been reported as active species for this reaction [71–73]. The XP spectrum did not show a peak associated with surface carbidic species (located at binding energies between 280 and 283eV). Therefore, the possible role of surface carbidic species to catalyze this reaction was excluded. In addition, the other surface elements observed in the regions of Fe 2p 3/2, Mo 3d 5/2, and P 2p 3/2, were composed of two surface species (i.e. near zero-valent species and oxidized species [53]). For the reduced surface species, their oxidation states were retained throughout the TOS run, as evidenced by unchanged binding energies in the XP spectra (Feδ+ at ∼706.7eV; Moδ+ at ∼227.6eV; Pδ− at ∼129.2eV) [53,54,74]. In contrast, oxidized surface species were reduced during the TOS run, as demonstrated by the decrease in binding energies of these oxidized species. During the TOS run, surface P species assigned to phosphate (at 133.5eV) were also reduced to generate surface species assigned to pyrophosphate species (132.7eV) [27]. In particular, surface species of Fe3+ (at 711.1eV) and Mo6+ (at 232.1eV) inherent to the FeMoP-650 were reduced to Fe2+ (710.2eV) and Mo5+ (230.7eV). These results suggested that the oxidized surface species underwent an in situ reduction during the reaction due to the presence of elevated pressure H2. Therefore FeMoP-650 showcased enhanced catalytic stability due to in situ reduction of the surface, which prevented complete surface oxidation and deactivation. 4 Conclusions In summary, we have studied the multifunctional surface characteristics of FeMoP catalysts as they pertain to the deoxygenation of biomass model compounds. The surface properties were altered by changing the reduction temperature used during the catalyst syntheses (650–850°C). It was determined that the materials with the highest acidity (ρACID) and CO-titrated metal sites (NCO) were attainable at the lowest reduction temperatures. These FeMoP materials acted as non-aqueous phase acid catalysts for the dehydration of cyclohexanol at 180 and 220°C, and FeMoP-650 showed the highest mass normalized rate due to the largest amount of surface acid species. All FeMoP catalysts yielded similar activation energy values for the dehydration of cyclohexanol (∼130kJmol−1), which suggested that all FeMoP catalysts followed a similar reaction pathway. In addition, the CO-titrated surface metal sites were studied via hydrodeoxygenation (HDO) of phenol at 350–400°C. At conversions <15%, all FeMoP catalysts were ∼90% selective to benzene and displayed similar activation energies (∼100kJmol−1), suggesting a similar HDO reaction pathway on these FeMoP catalysts. However, at conversions >20% the selectivity to benzene decreased on FeMoP-850. When benzene was added into the feed stream, FeMoP-650 favored HDO of phenol with minimal hydrogenation of benzene while FeMoP-850 was significantly more active for the hydrogenation of benzene to aliphatic compounds. The high selectivity to benzene on FeMoP-650 was potentially due to the increased number of coordinatively unsaturated sites, which could be altered based on reduction temperature. Furthermore, the FeMoP catalysts provided long-term stability due in part to in situ reduction of surface species in the presence of H2 gas, as evidenced by a 48h time-on-stream study and XP spectra after the reaction. Therefore, based on the high selectivities to the aromatic product and high catalytic stability, FeMoP is highly applicable to other lignocellulosic biomass relevant deoxygenation reactions. Acknowledgements We thank NSF for support through the CAREER program (CBET- 1351609). We also thank the ND Energy Materials Characterization Facility for the use of the XRD and XPS, the Center for Environmental Science and Technology (CEST) at the University of Notre Dame, and Notre Dame Integrated Imaging Facilities (NDIIF) for partial support in utilizing their instrumentation. We thank Dr. Rouvimov and DENSsolutions for their time and expertise in acquiring the images from the in situ TEM work. We also thank Dr. Paul McGinn for valuable conversations and use of his crystallographic software. We acknowledge VESTA 3 and Mercury CSD for access to their three-dimensional visualization of crystal, volumetric, and morphology data. Appendix A Supplementary data Supplementary data associated with this article can be found, in the online version, at http://dx.doi.org/10.1016/j.apcata.2016.06.011. Appendix A Supplementary data The following is Supplementary data to this article: References [1] D.M. Alonso S.G. Wettstein J.A. Dumesic Chem. Soc. Rev. 41 2012 8075 8098 [2] E. Furimsky Catal. Today 2013 [3] J.C. Hicks J. Phys. Chem. Lett. 2 2011 2280 2287 [4] H. Li S. Pattathil M.B. Foston S.-Y. Ding R. Kumar X. Gao A. Mittal J.M. Yarbrough M.E. Himmel A.J. Ragauskas M.G. Hahn C.E. Wyman Biotechnol. Biofuels 7 2014 1 11 [5] K. Barta P.C. Ford Acc. Chem. Res. 47 2014 1503 1512 [6] P.C.A. Bruijnincx B.M. Weckhuysen Nat. Chem. 6 2014 1035 1036 [7] Y. Romero F. Richard S. Brunet Appl. Catal. B Environ. 98 2010 213 223 [8] V.N. Bui D. Laurenti P. Afanasiev C. Geantet Appl. Catal. B Environ. 101 2011 239 245 [9] C. Zhao Y. Kou A.A. Lemonidou X. Li J.A. Lercher Angew. Chem. Int. Ed. 48 2009 3987 3990 [10] N. Yan Y. Yuan R. Dykeman Y. Kou P.J. Dyson Angew. Chem. Int. Ed. 49 2010 5549 5553 [11] W. Zhang J. Chen R. Liu S. Wang L. Chen K. Li ACS Sustainable Chem. Eng. 2 2014 683 691 [12] T. Omotoso S. Boonyasuwat S.P. Crossley Green Chem. 16 2014 645 652 [13] W.-S. Lee Z. Wang R.J. Wu A. Bhan J. Catal. 319 2014 44 53 [14] J. Kim G.T. Neumann N.D. McNamara J.C. Hicks J. Mater. Chem. A 2 2014 14014 14027 [15] H. Wang J. Male Y. Wang ACS Catal. 3 2013 1047 1070 [16] C. Zhao W. Song J.A. Lercher ACS Catal. 2 2012 2714 2723 [17] J. He C. Zhao J.A. Lercher J. Catal. 309 2014 362 375 [18] C. Zhao S. Kasakov J. He J.A. Lercher J. Catal. 296 2012 12 23 [19] M. Badawi J.F. Paul S. Cristol E. Payen Y. Romero F. Richard S. Brunet D. Lambert X. Portier A. Popov E. Kondratieva J.M. Goupil J. El Fallah J.P. Gilson L. Mariey A. Travert F. Maugé J. Catal. 282 2011 155 164 [20] B.M. Vogelaar N. Kagami T.F. van der Zijden A.D. van Langeveld S. Eijsbouts J.A. Moulijn J. Mol. Cat. A Chem. 309 2009 79 88 [21] T. Prasomsri T. Nimmanwudipong Y. Roman-Leshkov Energy Environ. Sci. 6 2013 1732 1738 [22] P.M. Mortensen H.W.P. de Carvalho J.-D. Grunwaldt P.A. Jensen A.D. Jensen J. Catal. 328 2015 208 215 [23] R. Rousseau D.A. Dixon B.D. Kay Z. Dohnalek Chem. Soc. Rev. 43 2014 7664 7680 [24] X. Zhu L.L. Lobban R.G. Mallinson D.E. Resasco J. Catal. 281 2011 21 29 [25] S.T. Oyama T. Gott H. Zhao Y.-K. Lee Catal. Today 143 2009 94 107 [26] R. Prins M. Bussell Catal. Lett. 2013 1 24 [27] D.J. Rensel S. Rouvimov M.E. Gin J.C. Hicks J. Catal. 305 2013 256 263 [28] H.Y. Zhao D. Li P. Bui S.T. Oyama Appl. Catal. A 391 2011 305 310 [29] K. Li R. Wang J. Chen Energy Fuels 25 2011 854 863 [30] V.M.L. Whiffen K.J. Smith Energy Fuels 24 2010 4728 4737 [31] Y. Yang A. Gilbert C. Xu Appl. Catal. A 360 2009 242 249 [32] S. Ted Oyama H. Zhao H.J. Freund K. Asakura R. Włodarczyk M. Sierka J. Catal. 285 2012 1 5 [33] R. Wang K. Smith Catal. Lett. 144 2014 1594 1601 [34] P. Bui J.A. Cecilia S.T. Oyama A. Takagaki A. Infantes-Molina H. Zhao D. Li E. Rodríguez-Castellón A. Jiménez López J. Catal. 294 2012 184 198 [35] A.P. Grosvenor R.G. Cavell A. Mar J. Solid State Chem. 181 2008 2549 2558 [36] S. Diplas O.M. Løvvik J. Phys. Condens. Matter. 21 2009 245503 [37] B.J. Tan K.J. Klabunde P.M.A. Sherwood Chem. Mater. 2 1990 186 191 [38] M. Shetty K. Murugappan T. Prasomsri W.H. Green Y. Román-Leshkov J. Catal. 331 2015 86 97 [39] X. Wang P. Clark S.T. Oyama J. Catal. 208 2002 321 331 [40] Y.-K. Lee S.T. Oyama J. Catal. 239 2006 376 389 [41] F. Al-Kharafi H. Al-Kandari A. Katrib Catal. Lett. 123 2008 269 275 [42] B. Hou H. Zhang H. Li Q. Zhu Chin. J. Chem. Eng. 20 2012 10 17 [43] E. Muneyama A. Kunishige K. Ohdan M. Ai J. Catal. 158 1996 378 384 [44] P. Hirunsit K.-i. Shimizu R. Fukuda S. Namuangruk Y. Morikawa M. Ehara J. Phys. Chem. C 118 2014 7996 8006 [45] S. Klacar H. Gronbeck Catal. Sci. Technol. 3 2013 183 190 [46] A. Seidel A. Gutsze B. Boddenberg Chem. Phys. Lett. 275 1997 113 118 [47] V.A. Nasluzov V.V. Rivanenkov A.M. Shor K.M. Neyman U. Birkenheuer N. Rösch Int. J. Quantum Chem. 90 2002 386 402 [48] B. Katryniok S. Paul F. Dumeignil ACS Catal. 3 2013 1819 1834 [49] S. Sato F. Sato H. Gotoh Y. Yamada ACS Catal. 3 2013 721 734 [50] C. Zhao J. He A.A. Lemonidou X. Li J.A. Lercher J. Catal. 280 2011 8 16 [51] A. Vjunov M.Y. Hu J. Feng D.M. Camaioni D. Mei J.Z. Hu C. Zhao J.A. Lercher Angew. Chem. Int. Ed. 53 2014 479 482 [52] H. Knözinger H. Bühl K. Kochloefl J. Catal. 24 1972 57 68 [53] A.P. Grosvenor S.D. Wik R.G. Cavell A. Mar Inorg. Chem. 44 2005 8988 8998 [54] A.P. Grosvenor R.G. Cavell A. Mar J. Solid State Chem. 180 2007 2702 2712 [55] M. Badawi J.-F. Paul E. Payen Y. Romero F. Richard S. Brunet A. Popov E. Kondratieva J.-P. Gilson L. Mariey A. Travert F. Maugé Oil Gas Sci. Technol. 68 2013 829 840 [56] A.Y. Bunch X. Wang U.S. Ozkan Appl. Catal. A 346 2008 96 103 [57] A. Cho J. Shin A. Takagaki R. Kikuchi S. Oyama Top Catal. 55 2012 969 980 [58] X. Liu A. Tkalych B. Zhou A.M. Köster D.R. Salahub J. Phys. Chem. C 117 2013 7069 7080 [59] A.S. Rocha A.B. Rocha V.T. da Silva Appl. Catal. A 379 2010 54 60 [60] B. Zhou X. Liu J. Cuervo D.R. Salahub Struct. Chem. 23 2012 1459 1466 [61] X. Zhu L. Nie L.L. Lobban R.G. Mallinson D.E. Resasco Energy Fuels 28 2014 4104 4111 [62] Y. Hong H. Zhang J. Sun K.M. Ayman A.J.R. Hensley M. Gu M.H. Engelhard J.-S. McEwen Y. Wang ACS Catal. 4 2014 3335 3345 [63] R.C. Nelson B. Baek P. Ruiz B. Goundie A. Brooks M.C. Wheeler B.G. Frederick L.C. Grabow R.N. Austin ACS Catal. 5 2015 6509 6523 [64] D.R. Moberg T.J. Thibodeau F.G. Amar B.G. Frederick J. Phys. Chem. C 114 2010 13782 13795 [65] A.Y. Bunch U.S. Ozkan J. Catal. 206 2002 177 187 [66] J.A. Widegren M.A. Bennett R.G. Finke J. Am. Chem. Soc. 125 2003 10301 10310 [67] A.C.A. Monteiro-Gezork R. Natividad J.M. Winterbottom Catal. Today 130 2008 471 485 [68] M. Daage R.R. Chianelli J. Catal. 149 1994 414 427 [69] S. Kasztelan H. Toulhoat J. Grimblot J.P. Bonnelle Appl. Catal. 13 1984 127 159 [70] E.J.M. Hensen P.J. Kooyman Y. van der Meer A.M. van der Kraan V.H.J. de Beer J.A.R. van Veen R.A. van Santen J. Catal. 199 2001 224 235 [71] I.N. Shabanova V.A. Trapeznikov J. Electron. Spectros. Relat. Phenom. 6 1975 297 307 [72] L. Ramqvist K. Hamrin G. Johansson A. Fahlman C. Nordling J. Phys. Chem. Solids 30 1969 1835 1847 [73] C.S. Kuivila J.B. Butt P.C. Stair Appl. Surf. Sci. 32 1988 99 121 [74] P.E.R. Blanchard A.P. Grosvenor R.G. Cavell A. Mar J. Mater. Chem. 19 2009 6015 6022",
      "scopus-id": "84976332593",
      "coredata": {
        "eid": "1-s2.0-S0926860X16303258",
        "dc:description": "Herein, we investigate the effects of altering the multifunctional nature of a series of FeMoP catalysts for biomass deoxygenation reactions. Unsupported FeMoP catalysts were synthesized at reduction temperatures between 650°C and 850°C. The reduction temperature used during the synthesis of FeMoP altered the surface properties of these materials (i.e., acidity and CO-titrated metal sites) while leaving the bulk crystal structure of FeMoP unaffected. This alteration in the surface properties significantly affected the catalytic performance of FeMoP materials in the deoxygenation reactions. The catalytic performance of the FeMoP catalysts was first investigated using the acid catalyzed, non-aqueous, dehydration of cyclohexanol. Aside from showing high selectivities to cyclohexene (>99%) for all catalysts, the experiments demonstrated that FeMoP-650 showed the highest initial rate due to the largest number of surface acid sites among these catalysts. In addition, these FeMoP catalysts were examined using the hydrodeoxygenation (HDO) of phenol. While all FeMoP catalysts were highly selective to benzene (∼90%) at conversions less than 15%, studies at higher conversions of phenol provided evidence that catalysts with a higher amount of acid sites maintained enhanced selectivity to benzene. Furthermore, the stability of FeMoP catalysts for phenol HDO was tested with a 48h time-on-stream (TOS) study. FeMoP exhibited excellent stability, as evidenced by the retention of the initial reaction rate, selectivity to benzene, and oxidation state of surface species throughout the TOS run.",
        "openArchiveArticle": "false",
        "prism:coverDate": "2016-08-25",
        "openaccessUserLicense": null,
        "prism:aggregationType": "Journal",
        "prism:url": "https://api.elsevier.com/content/article/pii/S0926860X16303258",
        "dc:creator": [
          {
            "@_fa": "true",
            "$": "Rensel, Dallas J."
          },
          {
            "@_fa": "true",
            "$": "Kim, Jongsik"
          },
          {
            "@_fa": "true",
            "$": "Bonita, Yolanda"
          },
          {
            "@_fa": "true",
            "$": "Hicks, Jason C."
          }
        ],
        "link": [
          {
            "@_fa": "true",
            "@rel": "self",
            "@href": "https://api.elsevier.com/content/article/pii/S0926860X16303258"
          },
          {
            "@_fa": "true",
            "@rel": "scidir",
            "@href": "https://www.sciencedirect.com/science/article/pii/S0926860X16303258"
          }
        ],
        "dc:format": "application/json",
        "openaccessType": null,
        "pii": "S0926-860X(16)30325-8",
        "prism:volume": "524",
        "prism:publisher": "Elsevier B.V.",
        "dc:title": "Investigating the multifunctional nature of bimetallic FeMoP catalysts using dehydration and hydrogenolysis reactions",
        "prism:copyright": "© 2016 Elsevier B.V. All rights reserved.",
        "openaccess": "0",
        "prism:issn": "0926860X",
        "dcterms:subject": [
          {
            "@_fa": "true",
            "$": "Hydrodeoxygenation"
          },
          {
            "@_fa": "true",
            "$": "Dehydration"
          },
          {
            "@_fa": "true",
            "$": "Bimetallic"
          },
          {
            "@_fa": "true",
            "$": "Phosphides"
          },
          {
            "@_fa": "true",
            "$": "Catalyst"
          },
          {
            "@_fa": "true",
            "$": "Biofuels"
          }
        ],
        "openaccessArticle": "false",
        "prism:publicationName": "Applied Catalysis A: General",
        "openaccessSponsorType": null,
        "prism:pageRange": "85-93",
        "prism:endingPage": "93",
        "pubType": "fla",
        "prism:coverDisplayDate": "25 August 2016",
        "prism:doi": "10.1016/j.apcata.2016.06.011",
        "prism:startingPage": "85",
        "dc:identifier": "doi:10.1016/j.apcata.2016.06.011",
        "openaccessSponsorName": null
      },
      "objects": {
        "object": [
          {
            "@category": "thumbnail",
            "@height": "88",
            "@width": "219",
            "@_fa": "true",
            "$": "https://api.elsevier.com/content/object/eid/1-s2.0-S0926860X16303258-fx1.sml?httpAccept=%2A%2F%2A",
            "@multimediatype": "GIF image file",
            "@type": "IMAGE-THUMBNAIL",
            "@size": "5150",
            "@ref": "fx1",
            "@mimetype": "image/gif"
          },
          {
            "@category": "thumbnail",
            "@height": "164",
            "@width": "203",
            "@_fa": "true",
            "$": "https://api.elsevier.com/content/object/eid/1-s2.0-S0926860X16303258-gr1.sml?httpAccept=%2A%2F%2A",
            "@multimediatype": "GIF image file",
            "@type": "IMAGE-THUMBNAIL",
            "@size": "8158",
            "@ref": "gr1",
            "@mimetype": "image/gif"
          },
          {
            "@category": "thumbnail",
            "@height": "109",
            "@width": "219",
            "@_fa": "true",
            "$": "https://api.elsevier.com/content/object/eid/1-s2.0-S0926860X16303258-gr2.sml?httpAccept=%2A%2F%2A",
            "@multimediatype": "GIF image file",
            "@type": "IMAGE-THUMBNAIL",
            "@size": "6858",
            "@ref": "gr2",
            "@mimetype": "image/gif"
          },
          {
            "@category": "thumbnail",
            "@height": "104",
            "@width": "219",
            "@_fa": "true",
            "$": "https://api.elsevier.com/content/object/eid/1-s2.0-S0926860X16303258-gr3.sml?httpAccept=%2A%2F%2A",
            "@multimediatype": "GIF image file",
            "@type": "IMAGE-THUMBNAIL",
            "@size": "7063",
            "@ref": "gr3",
            "@mimetype": "image/gif"
          },
          {
            "@category": "thumbnail",
            "@height": "164",
            "@width": "179",
            "@_fa": "true",
            "$": "https://api.elsevier.com/content/object/eid/1-s2.0-S0926860X16303258-gr4.sml?httpAccept=%2A%2F%2A",
            "@multimediatype": "GIF image file",
            "@type": "IMAGE-THUMBNAIL",
            "@size": "9075",
            "@ref": "gr4",
            "@mimetype": "image/gif"
          },
          {
            "@category": "thumbnail",
            "@height": "164",
            "@width": "183",
            "@_fa": "true",
            "$": "https://api.elsevier.com/content/object/eid/1-s2.0-S0926860X16303258-gr5.sml?httpAccept=%2A%2F%2A",
            "@multimediatype": "GIF image file",
            "@type": "IMAGE-THUMBNAIL",
            "@size": "6873",
            "@ref": "gr5",
            "@mimetype": "image/gif"
          },
          {
            "@category": "thumbnail",
            "@height": "164",
            "@width": "179",
            "@_fa": "true",
            "$": "https://api.elsevier.com/content/object/eid/1-s2.0-S0926860X16303258-gr6.sml?httpAccept=%2A%2F%2A",
            "@multimediatype": "GIF image file",
            "@type": "IMAGE-THUMBNAIL",
            "@size": "5888",
            "@ref": "gr6",
            "@mimetype": "image/gif"
          },
          {
            "@category": "thumbnail",
            "@height": "63",
            "@width": "219",
            "@_fa": "true",
            "$": "https://api.elsevier.com/content/object/eid/1-s2.0-S0926860X16303258-gr7.sml?httpAccept=%2A%2F%2A",
            "@multimediatype": "GIF image file",
            "@type": "IMAGE-THUMBNAIL",
            "@size": "3370",
            "@ref": "gr7",
            "@mimetype": "image/gif"
          },
          {
            "@category": "thumbnail",
            "@height": "164",
            "@width": "183",
            "@_fa": "true",
            "$": "https://api.elsevier.com/content/object/eid/1-s2.0-S0926860X16303258-gr8.sml?httpAccept=%2A%2F%2A",
            "@multimediatype": "GIF image file",
            "@type": "IMAGE-THUMBNAIL",
            "@size": "10054",
            "@ref": "gr8",
            "@mimetype": "image/gif"
          },
          {
            "@category": "standard",
            "@height": "200",
            "@width": "500",
            "@_fa": "true",
            "$": "https://api.elsevier.com/content/object/eid/1-s2.0-S0926860X16303258-fx1.jpg?httpAccept=%2A%2F%2A",
            "@multimediatype": "JPEG image file",
            "@type": "IMAGE-DOWNSAMPLED",
            "@size": "23236",
            "@ref": "fx1",
            "@mimetype": "image/jpeg"
          },
          {
            "@category": "standard",
            "@height": "259",
            "@width": "320",
            "@_fa": "true",
            "$": "https://api.elsevier.com/content/object/eid/1-s2.0-S0926860X16303258-gr1.jpg?httpAccept=%2A%2F%2A",
            "@multimediatype": "JPEG image file",
            "@type": "IMAGE-DOWNSAMPLED",
            "@size": "19438",
            "@ref": "gr1",
            "@mimetype": "image/jpeg"
          },
          {
            "@category": "standard",
            "@height": "252",
            "@width": "508",
            "@_fa": "true",
            "$": "https://api.elsevier.com/content/object/eid/1-s2.0-S0926860X16303258-gr2.jpg?httpAccept=%2A%2F%2A",
            "@multimediatype": "JPEG image file",
            "@type": "IMAGE-DOWNSAMPLED",
            "@size": "31904",
            "@ref": "gr2",
            "@mimetype": "image/jpeg"
          },
          {
            "@category": "standard",
            "@height": "240",
            "@width": "506",
            "@_fa": "true",
            "$": "https://api.elsevier.com/content/object/eid/1-s2.0-S0926860X16303258-gr3.jpg?httpAccept=%2A%2F%2A",
            "@multimediatype": "JPEG image file",
            "@type": "IMAGE-DOWNSAMPLED",
            "@size": "32333",
            "@ref": "gr3",
            "@mimetype": "image/jpeg"
          },
          {
            "@category": "standard",
            "@height": "342",
            "@width": "373",
            "@_fa": "true",
            "$": "https://api.elsevier.com/content/object/eid/1-s2.0-S0926860X16303258-gr4.jpg?httpAccept=%2A%2F%2A",
            "@multimediatype": "JPEG image file",
            "@type": "IMAGE-DOWNSAMPLED",
            "@size": "29661",
            "@ref": "gr4",
            "@mimetype": "image/jpeg"
          },
          {
            "@category": "standard",
            "@height": "343",
            "@width": "384",
            "@_fa": "true",
            "$": "https://api.elsevier.com/content/object/eid/1-s2.0-S0926860X16303258-gr5.jpg?httpAccept=%2A%2F%2A",
            "@multimediatype": "JPEG image file",
            "@type": "IMAGE-DOWNSAMPLED",
            "@size": "26414",
            "@ref": "gr5",
            "@mimetype": "image/jpeg"
          },
          {
            "@category": "standard",
            "@height": "351",
            "@width": "384",
            "@_fa": "true",
            "$": "https://api.elsevier.com/content/object/eid/1-s2.0-S0926860X16303258-gr6.jpg?httpAccept=%2A%2F%2A",
            "@multimediatype": "JPEG image file",
            "@type": "IMAGE-DOWNSAMPLED",
            "@size": "20900",
            "@ref": "gr6",
            "@mimetype": "image/jpeg"
          },
          {
            "@category": "standard",
            "@height": "113",
            "@width": "393",
            "@_fa": "true",
            "$": "https://api.elsevier.com/content/object/eid/1-s2.0-S0926860X16303258-gr7.jpg?httpAccept=%2A%2F%2A",
            "@multimediatype": "JPEG image file",
            "@type": "IMAGE-DOWNSAMPLED",
            "@size": "13189",
            "@ref": "gr7",
            "@mimetype": "image/jpeg"
          },
          {
            "@category": "standard",
            "@height": "349",
            "@width": "390",
            "@_fa": "true",
            "$": "https://api.elsevier.com/content/object/eid/1-s2.0-S0926860X16303258-gr8.jpg?httpAccept=%2A%2F%2A",
            "@multimediatype": "JPEG image file",
            "@type": "IMAGE-DOWNSAMPLED",
            "@size": "32516",
            "@ref": "gr8",
            "@mimetype": "image/jpeg"
          },
          {
            "@category": "high",
            "@height": "886",
            "@width": "2213",
            "@_fa": "true",
            "$": "https://api.elsevier.com/content/object/eid/1-s2.0-S0926860X16303258-fx1_lrg.jpg?httpAccept=%2A%2F%2A",
            "@multimediatype": "JPEG image file",
            "@type": "IMAGE-HIGH-RES",
            "@size": "185679",
            "@ref": "fx1",
            "@mimetype": "image/jpeg"
          },
          {
            "@category": "high",
            "@height": "1146",
            "@width": "1417",
            "@_fa": "true",
            "$": "https://api.elsevier.com/content/object/eid/1-s2.0-S0926860X16303258-gr1_lrg.jpg?httpAccept=%2A%2F%2A",
            "@multimediatype": "JPEG image file",
            "@type": "IMAGE-HIGH-RES",
            "@size": "167289",
            "@ref": "gr1",
            "@mimetype": "image/jpeg"
          },
          {
            "@category": "high",
            "@height": "1118",
            "@width": "2250",
            "@_fa": "true",
            "$": "https://api.elsevier.com/content/object/eid/1-s2.0-S0926860X16303258-gr2_lrg.jpg?httpAccept=%2A%2F%2A",
            "@multimediatype": "JPEG image file",
            "@type": "IMAGE-HIGH-RES",
            "@size": "253162",
            "@ref": "gr2",
            "@mimetype": "image/jpeg"
          },
          {
            "@category": "high",
            "@height": "1063",
            "@width": "2243",
            "@_fa": "true",
            "$": "https://api.elsevier.com/content/object/eid/1-s2.0-S0926860X16303258-gr3_lrg.jpg?httpAccept=%2A%2F%2A",
            "@multimediatype": "JPEG image file",
            "@type": "IMAGE-HIGH-RES",
            "@size": "276563",
            "@ref": "gr3",
            "@mimetype": "image/jpeg"
          },
          {
            "@category": "high",
            "@height": "1514",
            "@width": "1653",
            "@_fa": "true",
            "$": "https://api.elsevier.com/content/object/eid/1-s2.0-S0926860X16303258-gr4_lrg.jpg?httpAccept=%2A%2F%2A",
            "@multimediatype": "JPEG image file",
            "@type": "IMAGE-HIGH-RES",
            "@size": "252899",
            "@ref": "gr4",
            "@mimetype": "image/jpeg"
          },
          {
            "@category": "high",
            "@height": "1521",
            "@width": "1701",
            "@_fa": "true",
            "$": "https://api.elsevier.com/content/object/eid/1-s2.0-S0926860X16303258-gr5_lrg.jpg?httpAccept=%2A%2F%2A",
            "@multimediatype": "JPEG image file",
            "@type": "IMAGE-HIGH-RES",
            "@size": "216439",
            "@ref": "gr5",
            "@mimetype": "image/jpeg"
          },
          {
            "@category": "high",
            "@height": "1556",
            "@width": "1701",
            "@_fa": "true",
            "$": "https://api.elsevier.com/content/object/eid/1-s2.0-S0926860X16303258-gr6_lrg.jpg?httpAccept=%2A%2F%2A",
            "@multimediatype": "JPEG image file",
            "@type": "IMAGE-HIGH-RES",
            "@size": "179332",
            "@ref": "gr6",
            "@mimetype": "image/jpeg"
          },
          {
            "@category": "high",
            "@height": "500",
            "@width": "1743",
            "@_fa": "true",
            "$": "https://api.elsevier.com/content/object/eid/1-s2.0-S0926860X16303258-gr7_lrg.jpg?httpAccept=%2A%2F%2A",
            "@multimediatype": "JPEG image file",
            "@type": "IMAGE-HIGH-RES",
            "@size": "97046",
            "@ref": "gr7",
            "@mimetype": "image/jpeg"
          },
          {
            "@category": "high",
            "@height": "1549",
            "@width": "1729",
            "@_fa": "true",
            "$": "https://api.elsevier.com/content/object/eid/1-s2.0-S0926860X16303258-gr8_lrg.jpg?httpAccept=%2A%2F%2A",
            "@multimediatype": "JPEG image file",
            "@type": "IMAGE-HIGH-RES",
            "@size": "279941",
            "@ref": "gr8",
            "@mimetype": "image/jpeg"
          },
          {
            "@category": "standard",
            "@_fa": "true",
            "$": "https://api.elsevier.com/content/object/eid/1-s2.0-S0926860X16303258-mmc1.docx?httpAccept=%2A%2F%2A",
            "@multimediatype": "Microsoft Word file",
            "@type": "APPLICATION",
            "@size": "5975955",
            "@ref": "mmc1",
            "@mimetype": "application/word"
          },
          {
            "@category": "thumbnail",
            "@height": "35",
            "@width": "155",
            "@_fa": "true",
            "$": "https://api.elsevier.com/content/object/eid/1-s2.0-S0926860X16303258-si1.gif?httpAccept=%2A%2F%2A",
            "@multimediatype": "GIF image file",
            "@type": "ALTIMG",
            "@size": "724",
            "@ref": "si1",
            "@mimetype": "image/gif"
          },
          {
            "@category": "thumbnail",
            "@height": "68",
            "@width": "376",
            "@_fa": "true",
            "$": "https://api.elsevier.com/content/object/eid/1-s2.0-S0926860X16303258-si10.gif?httpAccept=%2A%2F%2A",
            "@multimediatype": "GIF image file",
            "@type": "ALTIMG",
            "@size": "2092",
            "@ref": "si10",
            "@mimetype": "image/gif"
          },
          {
            "@category": "thumbnail",
            "@height": "39",
            "@width": "234",
            "@_fa": "true",
            "$": "https://api.elsevier.com/content/object/eid/1-s2.0-S0926860X16303258-si11.gif?httpAccept=%2A%2F%2A",
            "@multimediatype": "GIF image file",
            "@type": "ALTIMG",
            "@size": "1095",
            "@ref": "si11",
            "@mimetype": "image/gif"
          },
          {
            "@category": "thumbnail",
            "@height": "35",
            "@width": "324",
            "@_fa": "true",
            "$": "https://api.elsevier.com/content/object/eid/1-s2.0-S0926860X16303258-si2.gif?httpAccept=%2A%2F%2A",
            "@multimediatype": "GIF image file",
            "@type": "ALTIMG",
            "@size": "1504",
            "@ref": "si2",
            "@mimetype": "image/gif"
          },
          {
            "@category": "thumbnail",
            "@height": "35",
            "@width": "299",
            "@_fa": "true",
            "$": "https://api.elsevier.com/content/object/eid/1-s2.0-S0926860X16303258-si3.gif?httpAccept=%2A%2F%2A",
            "@multimediatype": "GIF image file",
            "@type": "ALTIMG",
            "@size": "1505",
            "@ref": "si3",
            "@mimetype": "image/gif"
          },
          {
            "@category": "thumbnail",
            "@height": "14",
            "@width": "133",
            "@_fa": "true",
            "$": "https://api.elsevier.com/content/object/eid/1-s2.0-S0926860X16303258-si4.gif?httpAccept=%2A%2F%2A",
            "@multimediatype": "GIF image file",
            "@type": "ALTIMG",
            "@size": "496",
            "@ref": "si4",
            "@mimetype": "image/gif"
          },
          {
            "@category": "thumbnail",
            "@height": "14",
            "@width": "184",
            "@_fa": "true",
            "$": "https://api.elsevier.com/content/object/eid/1-s2.0-S0926860X16303258-si5.gif?httpAccept=%2A%2F%2A",
            "@multimediatype": "GIF image file",
            "@type": "ALTIMG",
            "@size": "587",
            "@ref": "si5",
            "@mimetype": "image/gif"
          },
          {
            "@category": "thumbnail",
            "@height": "14",
            "@width": "284",
            "@_fa": "true",
            "$": "https://api.elsevier.com/content/object/eid/1-s2.0-S0926860X16303258-si6.gif?httpAccept=%2A%2F%2A",
            "@multimediatype": "GIF image file",
            "@type": "ALTIMG",
            "@size": "804",
            "@ref": "si6",
            "@mimetype": "image/gif"
          },
          {
            "@category": "thumbnail",
            "@height": "14",
            "@width": "222",
            "@_fa": "true",
            "$": "https://api.elsevier.com/content/object/eid/1-s2.0-S0926860X16303258-si7.gif?httpAccept=%2A%2F%2A",
            "@multimediatype": "GIF image file",
            "@type": "ALTIMG",
            "@size": "643",
            "@ref": "si7",
            "@mimetype": "image/gif"
          },
          {
            "@category": "thumbnail",
            "@height": "14",
            "@width": "228",
            "@_fa": "true",
            "$": "https://api.elsevier.com/content/object/eid/1-s2.0-S0926860X16303258-si8.gif?httpAccept=%2A%2F%2A",
            "@multimediatype": "GIF image file",
            "@type": "ALTIMG",
            "@size": "683",
            "@ref": "si8",
            "@mimetype": "image/gif"
          },
          {
            "@category": "thumbnail",
            "@height": "14",
            "@width": "143",
            "@_fa": "true",
            "$": "https://api.elsevier.com/content/object/eid/1-s2.0-S0926860X16303258-si9.gif?httpAccept=%2A%2F%2A",
            "@multimediatype": "GIF image file",
            "@type": "ALTIMG",
            "@size": "545",
            "@ref": "si9",
            "@mimetype": "image/gif"
          },
          {
            "@category": "standard",
            "@_fa": "true",
            "$": "https://api.elsevier.com/content/object/eid/1-s2.0-S0926860X16303258-Dallas_Rensel_hydrodeoxygenation_dehydration_2016_P01.jpg?httpAccept=%2A%2F%2A",
            "@multimediatype": "JPEG image file",
            "@type": "AAM-PAGE-IMAGE",
            "@size": "183868",
            "@ref": "Dallas_Rensel_hydrodeoxygenation_dehydration_2016_P01",
            "@mimetype": "image/jpeg"
          },
          {
            "@category": "standard",
            "@_fa": "true",
            "$": "https://api.elsevier.com/content/object/eid/1-s2.0-S0926860X16303258-Dallas_Rensel_hydrodeoxygenation_dehydration_2016_P02.jpg?httpAccept=%2A%2F%2A",
            "@multimediatype": "JPEG image file",
            "@type": "AAM-PAGE-IMAGE",
            "@size": "389989",
            "@ref": "Dallas_Rensel_hydrodeoxygenation_dehydration_2016_P02",
            "@mimetype": "image/jpeg"
          },
          {
            "@category": "standard",
            "@_fa": "true",
            "$": "https://api.elsevier.com/content/object/eid/1-s2.0-S0926860X16303258-Dallas_Rensel_hydrodeoxygenation_dehydration_2016_P03.jpg?httpAccept=%2A%2F%2A",
            "@multimediatype": "JPEG image file",
            "@type": "AAM-PAGE-IMAGE",
            "@size": "503847",
            "@ref": "Dallas_Rensel_hydrodeoxygenation_dehydration_2016_P03",
            "@mimetype": "image/jpeg"
          },
          {
            "@category": "standard",
            "@_fa": "true",
            "$": "https://api.elsevier.com/content/object/eid/1-s2.0-S0926860X16303258-Dallas_Rensel_hydrodeoxygenation_dehydration_2016_P04.jpg?httpAccept=%2A%2F%2A",
            "@multimediatype": "JPEG image file",
            "@type": "AAM-PAGE-IMAGE",
            "@size": "514165",
            "@ref": "Dallas_Rensel_hydrodeoxygenation_dehydration_2016_P04",
            "@mimetype": "image/jpeg"
          },
          {
            "@category": "standard",
            "@_fa": "true",
            "$": "https://api.elsevier.com/content/object/eid/1-s2.0-S0926860X16303258-Dallas_Rensel_hydrodeoxygenation_dehydration_2016_P05.jpg?httpAccept=%2A%2F%2A",
            "@multimediatype": "JPEG image file",
            "@type": "AAM-PAGE-IMAGE",
            "@size": "374624",
            "@ref": "Dallas_Rensel_hydrodeoxygenation_dehydration_2016_P05",
            "@mimetype": "image/jpeg"
          },
          {
            "@category": "standard",
            "@_fa": "true",
            "$": "https://api.elsevier.com/content/object/eid/1-s2.0-S0926860X16303258-Dallas_Rensel_hydrodeoxygenation_dehydration_2016_P06.jpg?httpAccept=%2A%2F%2A",
            "@multimediatype": "JPEG image file",
            "@type": "AAM-PAGE-IMAGE",
            "@size": "491911",
            "@ref": "Dallas_Rensel_hydrodeoxygenation_dehydration_2016_P06",
            "@mimetype": "image/jpeg"
          },
          {
            "@category": "standard",
            "@_fa": "true",
            "$": "https://api.elsevier.com/content/object/eid/1-s2.0-S0926860X16303258-Dallas_Rensel_hydrodeoxygenation_dehydration_2016_P07.jpg?httpAccept=%2A%2F%2A",
            "@multimediatype": "JPEG image file",
            "@type": "AAM-PAGE-IMAGE",
            "@size": "545511",
            "@ref": "Dallas_Rensel_hydrodeoxygenation_dehydration_2016_P07",
            "@mimetype": "image/jpeg"
          },
          {
            "@category": "standard",
            "@_fa": "true",
            "$": "https://api.elsevier.com/content/object/eid/1-s2.0-S0926860X16303258-Dallas_Rensel_hydrodeoxygenation_dehydration_2016_P08.jpg?httpAccept=%2A%2F%2A",
            "@multimediatype": "JPEG image file",
            "@type": "AAM-PAGE-IMAGE",
            "@size": "479232",
            "@ref": "Dallas_Rensel_hydrodeoxygenation_dehydration_2016_P08",
            "@mimetype": "image/jpeg"
          },
          {
            "@category": "standard",
            "@_fa": "true",
            "$": "https://api.elsevier.com/content/object/eid/1-s2.0-S0926860X16303258-Dallas_Rensel_hydrodeoxygenation_dehydration_2016_P09.jpg?httpAccept=%2A%2F%2A",
            "@multimediatype": "JPEG image file",
            "@type": "AAM-PAGE-IMAGE",
            "@size": "490059",
            "@ref": "Dallas_Rensel_hydrodeoxygenation_dehydration_2016_P09",
            "@mimetype": "image/jpeg"
          },
          {
            "@category": "standard",
            "@_fa": "true",
            "$": "https://api.elsevier.com/content/object/eid/1-s2.0-S0926860X16303258-Dallas_Rensel_hydrodeoxygenation_dehydration_2016_P10.jpg?httpAccept=%2A%2F%2A",
            "@multimediatype": "JPEG image file",
            "@type": "AAM-PAGE-IMAGE",
            "@size": "537692",
            "@ref": "Dallas_Rensel_hydrodeoxygenation_dehydration_2016_P10",
            "@mimetype": "image/jpeg"
          },
          {
            "@category": "standard",
            "@_fa": "true",
            "$": "https://api.elsevier.com/content/object/eid/1-s2.0-S0926860X16303258-Dallas_Rensel_hydrodeoxygenation_dehydration_2016_P11.jpg?httpAccept=%2A%2F%2A",
            "@multimediatype": "JPEG image file",
            "@type": "AAM-PAGE-IMAGE",
            "@size": "533865",
            "@ref": "Dallas_Rensel_hydrodeoxygenation_dehydration_2016_P11",
            "@mimetype": "image/jpeg"
          },
          {
            "@category": "standard",
            "@_fa": "true",
            "$": "https://api.elsevier.com/content/object/eid/1-s2.0-S0926860X16303258-Dallas_Rensel_hydrodeoxygenation_dehydration_2016_P12.jpg?httpAccept=%2A%2F%2A",
            "@multimediatype": "JPEG image file",
            "@type": "AAM-PAGE-IMAGE",
            "@size": "504429",
            "@ref": "Dallas_Rensel_hydrodeoxygenation_dehydration_2016_P12",
            "@mimetype": "image/jpeg"
          },
          {
            "@category": "standard",
            "@_fa": "true",
            "$": "https://api.elsevier.com/content/object/eid/1-s2.0-S0926860X16303258-Dallas_Rensel_hydrodeoxygenation_dehydration_2016_P13.jpg?httpAccept=%2A%2F%2A",
            "@multimediatype": "JPEG image file",
            "@type": "AAM-PAGE-IMAGE",
            "@size": "445030",
            "@ref": "Dallas_Rensel_hydrodeoxygenation_dehydration_2016_P13",
            "@mimetype": "image/jpeg"
          },
          {
            "@category": "standard",
            "@_fa": "true",
            "$": "https://api.elsevier.com/content/object/eid/1-s2.0-S0926860X16303258-Dallas_Rensel_hydrodeoxygenation_dehydration_2016_P14.jpg?httpAccept=%2A%2F%2A",
            "@multimediatype": "JPEG image file",
            "@type": "AAM-PAGE-IMAGE",
            "@size": "548540",
            "@ref": "Dallas_Rensel_hydrodeoxygenation_dehydration_2016_P14",
            "@mimetype": "image/jpeg"
          },
          {
            "@category": "standard",
            "@_fa": "true",
            "$": "https://api.elsevier.com/content/object/eid/1-s2.0-S0926860X16303258-Dallas_Rensel_hydrodeoxygenation_dehydration_2016_P15.jpg?httpAccept=%2A%2F%2A",
            "@multimediatype": "JPEG image file",
            "@type": "AAM-PAGE-IMAGE",
            "@size": "466940",
            "@ref": "Dallas_Rensel_hydrodeoxygenation_dehydration_2016_P15",
            "@mimetype": "image/jpeg"
          },
          {
            "@category": "standard",
            "@_fa": "true",
            "$": "https://api.elsevier.com/content/object/eid/1-s2.0-S0926860X16303258-Dallas_Rensel_hydrodeoxygenation_dehydration_2016_P16.jpg?httpAccept=%2A%2F%2A",
            "@multimediatype": "JPEG image file",
            "@type": "AAM-PAGE-IMAGE",
            "@size": "453070",
            "@ref": "Dallas_Rensel_hydrodeoxygenation_dehydration_2016_P16",
            "@mimetype": "image/jpeg"
          },
          {
            "@category": "standard",
            "@_fa": "true",
            "$": "https://api.elsevier.com/content/object/eid/1-s2.0-S0926860X16303258-Dallas_Rensel_hydrodeoxygenation_dehydration_2016_P17.jpg?httpAccept=%2A%2F%2A",
            "@multimediatype": "JPEG image file",
            "@type": "AAM-PAGE-IMAGE",
            "@size": "368269",
            "@ref": "Dallas_Rensel_hydrodeoxygenation_dehydration_2016_P17",
            "@mimetype": "image/jpeg"
          },
          {
            "@category": "standard",
            "@_fa": "true",
            "$": "https://api.elsevier.com/content/object/eid/1-s2.0-S0926860X16303258-Dallas_Rensel_hydrodeoxygenation_dehydration_2016_P18.jpg?httpAccept=%2A%2F%2A",
            "@multimediatype": "JPEG image file",
            "@type": "AAM-PAGE-IMAGE",
            "@size": "431338",
            "@ref": "Dallas_Rensel_hydrodeoxygenation_dehydration_2016_P18",
            "@mimetype": "image/jpeg"
          },
          {
            "@category": "standard",
            "@_fa": "true",
            "$": "https://api.elsevier.com/content/object/eid/1-s2.0-S0926860X16303258-Dallas_Rensel_hydrodeoxygenation_dehydration_2016_P19.jpg?httpAccept=%2A%2F%2A",
            "@multimediatype": "JPEG image file",
            "@type": "AAM-PAGE-IMAGE",
            "@size": "430393",
            "@ref": "Dallas_Rensel_hydrodeoxygenation_dehydration_2016_P19",
            "@mimetype": "image/jpeg"
          },
          {
            "@category": "standard",
            "@_fa": "true",
            "$": "https://api.elsevier.com/content/object/eid/1-s2.0-S0926860X16303258-Dallas_Rensel_hydrodeoxygenation_dehydration_2016_P20.jpg?httpAccept=%2A%2F%2A",
            "@multimediatype": "JPEG image file",
            "@type": "AAM-PAGE-IMAGE",
            "@size": "540178",
            "@ref": "Dallas_Rensel_hydrodeoxygenation_dehydration_2016_P20",
            "@mimetype": "image/jpeg"
          },
          {
            "@category": "standard",
            "@_fa": "true",
            "$": "https://api.elsevier.com/content/object/eid/1-s2.0-S0926860X16303258-Dallas_Rensel_hydrodeoxygenation_dehydration_2016_P21.jpg?httpAccept=%2A%2F%2A",
            "@multimediatype": "JPEG image file",
            "@type": "AAM-PAGE-IMAGE",
            "@size": "533642",
            "@ref": "Dallas_Rensel_hydrodeoxygenation_dehydration_2016_P21",
            "@mimetype": "image/jpeg"
          },
          {
            "@category": "standard",
            "@_fa": "true",
            "$": "https://api.elsevier.com/content/object/eid/1-s2.0-S0926860X16303258-Dallas_Rensel_hydrodeoxygenation_dehydration_2016_P22.jpg?httpAccept=%2A%2F%2A",
            "@multimediatype": "JPEG image file",
            "@type": "AAM-PAGE-IMAGE",
            "@size": "304088",
            "@ref": "Dallas_Rensel_hydrodeoxygenation_dehydration_2016_P22",
            "@mimetype": "image/jpeg"
          },
          {
            "@category": "standard",
            "@_fa": "true",
            "$": "https://api.elsevier.com/content/object/eid/1-s2.0-S0926860X16303258-Dallas_Rensel_hydrodeoxygenation_dehydration_2016_P23.jpg?httpAccept=%2A%2F%2A",
            "@multimediatype": "JPEG image file",
            "@type": "AAM-PAGE-IMAGE",
            "@size": "459501",
            "@ref": "Dallas_Rensel_hydrodeoxygenation_dehydration_2016_P23",
            "@mimetype": "image/jpeg"
          },
          {
            "@category": "standard",
            "@_fa": "true",
            "$": "https://api.elsevier.com/content/object/eid/1-s2.0-S0926860X16303258-Dallas_Rensel_hydrodeoxygenation_dehydration_2016_P24.jpg?httpAccept=%2A%2F%2A",
            "@multimediatype": "JPEG image file",
            "@type": "AAM-PAGE-IMAGE",
            "@size": "514743",
            "@ref": "Dallas_Rensel_hydrodeoxygenation_dehydration_2016_P24",
            "@mimetype": "image/jpeg"
          },
          {
            "@category": "standard",
            "@_fa": "true",
            "$": "https://api.elsevier.com/content/object/eid/1-s2.0-S0926860X16303258-Dallas_Rensel_hydrodeoxygenation_dehydration_2016_P25.jpg?httpAccept=%2A%2F%2A",
            "@multimediatype": "JPEG image file",
            "@type": "AAM-PAGE-IMAGE",
            "@size": "555883",
            "@ref": "Dallas_Rensel_hydrodeoxygenation_dehydration_2016_P25",
            "@mimetype": "image/jpeg"
          },
          {
            "@category": "standard",
            "@_fa": "true",
            "$": "https://api.elsevier.com/content/object/eid/1-s2.0-S0926860X16303258-Dallas_Rensel_hydrodeoxygenation_dehydration_2016_P26.jpg?httpAccept=%2A%2F%2A",
            "@multimediatype": "JPEG image file",
            "@type": "AAM-PAGE-IMAGE",
            "@size": "715725",
            "@ref": "Dallas_Rensel_hydrodeoxygenation_dehydration_2016_P26",
            "@mimetype": "image/jpeg"
          },
          {
            "@category": "standard",
            "@_fa": "true",
            "$": "https://api.elsevier.com/content/object/eid/1-s2.0-S0926860X16303258-Dallas_Rensel_hydrodeoxygenation_dehydration_2016_P27.jpg?httpAccept=%2A%2F%2A",
            "@multimediatype": "JPEG image file",
            "@type": "AAM-PAGE-IMAGE",
            "@size": "382971",
            "@ref": "Dallas_Rensel_hydrodeoxygenation_dehydration_2016_P27",
            "@mimetype": "image/jpeg"
          },
          {
            "@category": "standard",
            "@_fa": "true",
            "$": "https://api.elsevier.com/content/object/eid/1-s2.0-S0926860X16303258-Dallas_Rensel_hydrodeoxygenation_dehydration_2016_P28.jpg?httpAccept=%2A%2F%2A",
            "@multimediatype": "JPEG image file",
            "@type": "AAM-PAGE-IMAGE",
            "@size": "246105",
            "@ref": "Dallas_Rensel_hydrodeoxygenation_dehydration_2016_P28",
            "@mimetype": "image/jpeg"
          },
          {
            "@category": "standard",
            "@_fa": "true",
            "$": "https://api.elsevier.com/content/object/eid/1-s2.0-S0926860X16303258-am.pdf?httpAccept=%2A%2F%2A",
            "@multimediatype": "Acrobat PDF file",
            "@type": "AAM-PDF",
            "@size": "786196",
            "@ref": "am",
            "@mimetype": "application/pdf"
          }
        ]
      },
      "link": {
        "@rel": "abstract",
        "@href": "https://api.elsevier.com/content/abstract/scopus_id/84976332593"
      }
    }
  }
}