{
  "metadata": {
    "title": "The critical role of La/Ce composition in Ni/Ce<ce:inf loc=post>1-y</ce:inf>La<ce:inf loc=post>y</ce:inf>O<ce:inf loc=post>x</ce:inf> catalysts: Optimizing oxygen vacancies and metal-support interactions for ammonia decomposition",
    "authors": "; ; ",
    "journal": "Applied Catalysis A: General",
    "date": "2025-12-25",
    "doi": "10.1016/j.apcata.2025.120578",
    "abstract": "",
    "uri": "https://api.elsevier.com/content/article/pii/S0926860X25004806",
    "pii": "S0926860X25004806"
  },
  "fulltext": {
    "full-text-retrieval-response": {
      "originalText": "serial JL 271346 291210 291744 291809 31 Applied Catalysis A: General APPLIEDCATALYSISAGENERAL 2025-09-17 2025-09-17 2025-09-20 2025-09-20 2025-10-11T16:52:42 1-s2.0-S0926860X25004806 S0926-860X(25)00480-6 S0926860X25004806 10.1016/j.apcata.2025.120578 S300 S300.1 FULL-TEXT 1-s2.0-S0926860X25X00168 2025-10-11T16:06:29.047504Z 0 0 20251225 2025 2025-09-17T16:30:57.32639Z absattachment articleinfo articlenumber articletitlenorm authfirstinitialnorm authfirstsurnamenorm cid cids contenttype copyright crossmark dateloaded dateloadedtxt datesearch datesort dateupdated dco docsubtype doctype doi eid ewtransactionid hubeid indexeddate issn issnnorm itemstage itemtransactionid itemweight openaccess openarchive pg pgfirst pii piinorm pubdatestart pubdatetxt pubyr sortorder srctitle srctitlenorm srctype ssids alllist content subj subheadings suppl tomb volfirst volissue volumelist webpdf webpdfpagecount yearnav figure table e-component body acknowledge affil appendices articletitle auth authfirstini authfull authkeywords authlast grantnumber grantsponsor grantsponsorid highlightsabst orcid primabst ref specialabst 0926-860X 0926860X true 708 708 C Volume 708 37 120578 120578 120578 20251225 25 December 2025 2025-12-25 2025 article fla © 2025 Elsevier B.V. All rights are reserved, including those for text and data mining, AI training, and similar technologies. CRITICALROLELACECOMPOSITIONINNICE1YLAYOXCATALYSTSOPTIMIZINGOXYGENVACANCIESMETALSUPPORTINTERACTIONSFORAMMONIADECOMPOSITION WANG J 1 Introduction 2 Experimental section 3 Results and discussion 3.1 Structural characterization of the Ni/Ce1-yLayOx catalysts 3.2 Catalyst activity of NH3 decomposition 3.3 Reaction mechanism 4 Conclusion CRediT authorship contribution statement Acknowledgements Appendix A Supplementary material References GERNAAT 2021 119 125 D BELL 2016 1438 1457 T WEE 2007 1720 1738 J EBERLE 2009 6608 6630 U ANDERSSON 2019 11901 11919 J CHEN 2021 11693 11706 C SUN 2022 112918 S LAN 2012 1482 1494 R KOJIMA 2019 18179 18192 Y COMOTTI 2015 10673 10686 M STFCUKRESEARCHERS 2014 11 ZHAI 2023 332 342 L LE 2021 1087 1103 T MUKHERJEE 2018 162 181 S FANG 2022 3938 3954 H LI 2025 125020 X CHA 2018 194 204 J GUO 2015 2950 2954 J SIMA 2020 9342 9352 D LI 2024 131543 S WANG 2024 101000 Z LIU 2024 9927 9939 H ZHANG 2023 176 188 R ZHOU 2021 10345 10350 C TABASSUM 2022 4190 4200 H GUO 2024 123844 X USMAN 2025 135272 M CHEN 2023 4544 4553 J LIU 2023 145371 H LEE 2017 2874 2882 K ZHANG 2022 121385 T LE 2021 119831 T LEE 2021 125523 J ZHU 2018 5643 5654 W PINO 2014 91 105 L WILKES 2003 12 19 M HU 2024 3910 3920 H CHUNG 2017 1639 1647 D NABGAN 2017 21571 21585 B HE 2016 994 1003 R LYU 2020 11235 11252 Y LI 2017 683 694 X REDDY 2010 467 475 B SUN 2023 1077 1088 H LI 2019 22351 22358 J CHEN 2024 155854 X XU 2020 118813 L HAYASHI 2013 3124 3130 F LU 2019 1513 1524 M HU 2019 41 49 X IM 2022 32543 32551 Y REN 2023 119344 H BAHRAMI 2011 11 21 B ZHANG 2009 18 25 L YAN 2024 15024 15032 W CAO 2022 117719 C SUN 2024 158043 Y YAN 2025 150855 Y WANGX2025X120578 WANGX2025X120578XJ 2027-09-20T00:00:00.000Z 2027-09-20T00:00:00.000Z http://creativecommons.org/licenses/by-nc-nd/4.0/ © 2025 Elsevier B.V. All rights are reserved, including those for text and data mining, AI training, and similar technologies. 2025-09-17T07:21:15.939Z http://vtw.elsevier.com/data/voc/AddOnTypes/50.7/aggregated-refined National Natural Science Foundation of China 22402018 National Natural Science Foundation of China http://data.elsevier.com/vocabulary/SciValFunders/501100001809 http://sws.geonames.org/1814991 Natural Science Foundation of Liaoning Province 2023BSBA073 Natural Science Foundation of Liaoning Province http://data.elsevier.com/vocabulary/SciValFunders/501100005047 http://sws.geonames.org/1814991/ National Key R&D Program of China NKRDPC National Key Research and Development Program of China http://data.elsevier.com/vocabulary/SciValFunders/501100012166 http://sws.geonames.org/1814991/ 2024YFB4006701 Key Technologies Research and Development Program http://data.elsevier.com/vocabulary/SciValFunders/501100012165 http://sws.geonames.org/1814991 Fundamental Research Funds for the Central Universities DUT24BS053 Fundamental Research Funds for the Central Universities http://data.elsevier.com/vocabulary/SciValFunders/501100012226 http://sws.geonames.org/1814991/ This work was financially supported by National Key R&D Program of China (2024YFB4006701)\\uFF0CNational Natural Science Foundation of China (22402018), Natural Science Foundation of Liaoning Province (2023BSBA073) and the Fundamental Research Funds for the Central Universities (DUT24BS053). https://doi.org/10.15223/policy-017 https://doi.org/10.15223/policy-037 https://doi.org/10.15223/policy-012 https://doi.org/10.15223/policy-029 https://doi.org/10.15223/policy-004 item S0926-860X(25)00480-6 S0926860X25004806 1-s2.0-S0926860X25004806 10.1016/j.apcata.2025.120578 271346 2025-10-11T16:06:29.047504Z 2025-12-25 1-s2.0-S0926860X25004806-main.pdf https://s3-eu-west-1.amazonaws.com/prod-ucs-content-store-eu-west/content/pii:S0926860X25004806/MAIN/application/pdf/ee793b040498718288756521baa534cb/main.pdf main.pdf pdf true 11585601 MAIN 9 1-s2.0-S0926860X25004806-main_1.png https://s3-eu-west-1.amazonaws.com/prod-ucs-content-store-eu-west/content/pii:S0926860X25004806/PREVIEW/image/png/c01c11010a414ff434f99bd6c8bb3b42/main_1.png main_1.png png 57933 928 656 IMAGE-WEB-PDF 1 1-s2.0-S0926860X25004806-gr1.jpg https://s3-eu-west-1.amazonaws.com/prod-ucs-content-store-eu-west/content/pii:S0926860X25004806/gr1/DOWNSAMPLED/image/jpeg/b258e5d02c8c1cd59bfdd4a9e71dc0bd/gr1.jpg gr1 gr1.jpg jpg 79016 405 565 IMAGE-DOWNSAMPLED 1-s2.0-S0926860X25004806-gr1.sml https://s3-eu-west-1.amazonaws.com/prod-ucs-content-store-eu-west/content/pii:S0926860X25004806/gr1/THUMBNAIL/image/gif/34431e574f3399b1ff5e75a777c6c050/gr1.sml gr1 gr1.sml sml 14619 157 219 IMAGE-THUMBNAIL 1-s2.0-S0926860X25004806-gr2.jpg https://s3-eu-west-1.amazonaws.com/prod-ucs-content-store-eu-west/content/pii:S0926860X25004806/gr2/DOWNSAMPLED/image/jpeg/3aed9fbd25e982cf2a0bfe19b3095dfe/gr2.jpg gr2 gr2.jpg jpg 177894 587 659 IMAGE-DOWNSAMPLED 1-s2.0-S0926860X25004806-gr2.sml https://s3-eu-west-1.amazonaws.com/prod-ucs-content-store-eu-west/content/pii:S0926860X25004806/gr2/THUMBNAIL/image/gif/73d0786267d508e2779f98b1aa34fbac/gr2.sml gr2 gr2.sml sml 21932 164 184 IMAGE-THUMBNAIL 1-s2.0-S0926860X25004806-ga1.jpg https://s3-eu-west-1.amazonaws.com/prod-ucs-content-store-eu-west/content/pii:S0926860X25004806/ga1/DOWNSAMPLED/image/jpeg/890a6733e2357c9f8793f861d300ebf8/ga1.jpg ga1 true ga1.jpg jpg 23733 244 280 IMAGE-DOWNSAMPLED 1-s2.0-S0926860X25004806-ga1.sml https://s3-eu-west-1.amazonaws.com/prod-ucs-content-store-eu-west/content/pii:S0926860X25004806/ga1/THUMBNAIL/image/gif/ac12d7a036c1a92e19c1a1d06e6eca3e/ga1.sml ga1 true ga1.sml sml 20077 164 188 IMAGE-THUMBNAIL 1-s2.0-S0926860X25004806-gr3.jpg https://s3-eu-west-1.amazonaws.com/prod-ucs-content-store-eu-west/content/pii:S0926860X25004806/gr3/DOWNSAMPLED/image/jpeg/98b8ce163d5f5a24c4792268201cc7e3/gr3.jpg gr3 gr3.jpg jpg 129754 494 791 IMAGE-DOWNSAMPLED 1-s2.0-S0926860X25004806-gr3.sml https://s3-eu-west-1.amazonaws.com/prod-ucs-content-store-eu-west/content/pii:S0926860X25004806/gr3/THUMBNAIL/image/gif/0e2c26e99436fe0d365bd51912611492/gr3.sml gr3 gr3.sml sml 16019 137 219 IMAGE-THUMBNAIL 1-s2.0-S0926860X25004806-gr4.jpg https://s3-eu-west-1.amazonaws.com/prod-ucs-content-store-eu-west/content/pii:S0926860X25004806/gr4/DOWNSAMPLED/image/jpeg/5b4743094d0ad82da95a565536f81a77/gr4.jpg gr4 gr4.jpg jpg 101567 436 791 IMAGE-DOWNSAMPLED 1-s2.0-S0926860X25004806-gr4.sml https://s3-eu-west-1.amazonaws.com/prod-ucs-content-store-eu-west/content/pii:S0926860X25004806/gr4/THUMBNAIL/image/gif/6d7bcea466f4468abc5b548a90fe2902/gr4.sml gr4 gr4.sml sml 10693 121 219 IMAGE-THUMBNAIL 1-s2.0-S0926860X25004806-gr5.jpg https://s3-eu-west-1.amazonaws.com/prod-ucs-content-store-eu-west/content/pii:S0926860X25004806/gr5/DOWNSAMPLED/image/jpeg/57605e3f644c5944c85545f03ab8f355/gr5.jpg gr5 gr5.jpg jpg 43596 226 565 IMAGE-DOWNSAMPLED 1-s2.0-S0926860X25004806-gr5.sml https://s3-eu-west-1.amazonaws.com/prod-ucs-content-store-eu-west/content/pii:S0926860X25004806/gr5/THUMBNAIL/image/gif/2ba9013459fc44c9d6d3c4fa403b0b8d/gr5.sml gr5 gr5.sml sml 7887 88 219 IMAGE-THUMBNAIL 1-s2.0-S0926860X25004806-gr6.jpg https://s3-eu-west-1.amazonaws.com/prod-ucs-content-store-eu-west/content/pii:S0926860X25004806/gr6/DOWNSAMPLED/image/jpeg/8e9d3a60599e8bb00c727615b2f07c84/gr6.jpg gr6 gr6.jpg jpg 128290 426 791 IMAGE-DOWNSAMPLED 1-s2.0-S0926860X25004806-gr6.sml https://s3-eu-west-1.amazonaws.com/prod-ucs-content-store-eu-west/content/pii:S0926860X25004806/gr6/THUMBNAIL/image/gif/20ccee1bcb92696ab34cfda9b29df3f2/gr6.sml gr6 gr6.sml sml 15044 118 219 IMAGE-THUMBNAIL 1-s2.0-S0926860X25004806-gr1_lrg.jpg https://s3-eu-west-1.amazonaws.com/prod-ucs-content-store-eu-west/content/pii:S0926860X25004806/HIGHRES/image/jpeg/e2b96be42080b0ac64de5dd1bb639000/gr1_lrg.jpg gr1 gr1_lrg.jpg jpg 463111 1789 2495 IMAGE-HIGH-RES 1-s2.0-S0926860X25004806-gr2_lrg.jpg https://s3-eu-west-1.amazonaws.com/prod-ucs-content-store-eu-west/content/pii:S0926860X25004806/HIGHRES/image/jpeg/ac825652b584f48512503f1772c7e836/gr2_lrg.jpg gr2 gr2_lrg.jpg jpg 1484715 2595 2911 IMAGE-HIGH-RES 1-s2.0-S0926860X25004806-ga1_lrg.jpg https://s3-eu-west-1.amazonaws.com/prod-ucs-content-store-eu-west/content/pii:S0926860X25004806/HIGHRES/image/jpeg/4e8fbc713bcd14ca9d442ca89d0c3fbd/ga1_lrg.jpg ga1 true ga1_lrg.jpg jpg 192646 1085 1243 IMAGE-HIGH-RES 1-s2.0-S0926860X25004806-gr3_lrg.jpg https://s3-eu-west-1.amazonaws.com/prod-ucs-content-store-eu-west/content/pii:S0926860X25004806/HIGHRES/image/jpeg/aff6bd8a88acb40db78c73621a20bcad/gr3_lrg.jpg gr3 gr3_lrg.jpg jpg 796583 2182 3493 IMAGE-HIGH-RES 1-s2.0-S0926860X25004806-gr4_lrg.jpg https://s3-eu-west-1.amazonaws.com/prod-ucs-content-store-eu-west/content/pii:S0926860X25004806/HIGHRES/image/jpeg/fa0671e619bbccce78f45bc1ee5e87fa/gr4_lrg.jpg gr4 gr4_lrg.jpg jpg 585771 1926 3493 IMAGE-HIGH-RES 1-s2.0-S0926860X25004806-gr5_lrg.jpg https://s3-eu-west-1.amazonaws.com/prod-ucs-content-store-eu-west/content/pii:S0926860X25004806/HIGHRES/image/jpeg/183220828af395be79c45c588482c1bf/gr5_lrg.jpg gr5 gr5_lrg.jpg jpg 258819 997 2495 IMAGE-HIGH-RES 1-s2.0-S0926860X25004806-gr6_lrg.jpg https://s3-eu-west-1.amazonaws.com/prod-ucs-content-store-eu-west/content/pii:S0926860X25004806/HIGHRES/image/jpeg/1a78289c5d73648de762fc9bfee33d7c/gr6_lrg.jpg gr6 gr6_lrg.jpg jpg 776702 1880 3493 IMAGE-HIGH-RES 1-s2.0-S0926860X25004806-mmc1.docx https://s3-eu-west-1.amazonaws.com/prod-ucs-content-store-eu-west/content/pii:S0926860X25004806/mmc1/MAIN/application/vnd.openxmlformats-officedocument.wordprocessingml.document/a46c26a3a8b1028794830eb0aa1389bc/mmc1.docx mmc1 mmc1.docx docx 277341 APPLICATION APCATA 120578 120578 S0926-860X(25)00480-6 10.1016/j.apcata.2025.120578 Elsevier B.V. Fig. 1 (a) XRD patterns of Ce1-yLayOx, and (b) Ni/Ce1-yLayOx samples, (c) N2 adsorption-desorption isotherms, and (d) pore size distribution of Ni/Ce1-yLayOx samples. Fig. 1 Fig. 2 HRTEM images and size distribution of Ni nanoparticles taken from (a, d) Ni/CeO2, (b, e) Ni/Ce0.5La0.5Ox, (c, f) and Ni/Ce0.1La0.9Ox, (g-j) EDS elemental mappings of Ni/Ce0.5La0.5Ox. Fig. 2 Fig. 3 (a) H2-TPR, (b) Raman, (c) and EPR profiles of Ni/Ce1-yLayOx, (d) Ce 3d, (e) La 3d, (f) and Ni 2p XPS spectra of Ni/Ce1-yLayOx samples. Fig. 3 Fig. 4 (a) Catalytic performance of NH3 decomposition, and (b) corresponding Arrhenius plots of Ni/Ce1-yLayOx catalysts. (c) Long term stability test on the Ni/Ce0.5La0.5Ox catalyst at 500 °C, and (d) XRD pattern of Ni/Ce0.5La0.5Ox catalyst before and after reaction. (e) Cyclic stability test on Ni/Ce0.5La0.5Ox catalyst for five times, (f) GHSV influence on the catalytic performance of Ni/Ce0.5La0.5Ox catalyst. Fig. 4 Fig. 5 NH3-TPD-MS profiles of Ni/Ce1-yLayOx catalysts (a) m/z = 17, (b) m/z = 28. Fig. 5 Fig. 6 In situ DRIFTS spectra of NH3 contacting with the (a)Ni/CeO2, (b)Ni/Ce0.9La0.1Ox, (c) Ni/Ce0.7La0.3Ox, (d) Ni/Ce0.5La0.5Ox, (e) Ni/Ce0.3La0.7Ox, (f) Ni/Ce0.1La0.9Ox during the heating process. Fig. 6 Table 1 Structure, XPS and NH3-TPD results of Ni/Ce1-yLayOx samples. Table 1 Catalyst SBET (m2/g)a D(nm)a V(cm2/g)a M(%)b TOF(s−1)c Ce3+ (%)d Ni0 (%)d ANH3 e Ni/CeO2 24 2.7 0.12 0.8 0.070 15.7 31.5 3.6E−11 Ni/Ce0.9La0.1Ox 22 2.2 0.14 1.5 0.075 16.9 37.9 3.8E−11 Ni/Ce0.7La0.3Ox 62 2.5 0.14 1.6 0.22 17.3 39.7 6.0E−11 Ni/Ce0.5La0.5Ox 53 3.1 0.19 1.9 0.20 18.8 40.3 1.4E−10 Ni/Ce0.3La0.7Ox 28 2.5 0.10 0.6 0.19 17.0 38.1 7.9E−11 Ni/Ce0.1La0.9Ox 21 3.1 0.05 0.1 - 14.0 29.8 9.2E−11 a, b Date obtained from N2 adsorption-desorption and CO pulse chemisorption, respectively. c The turnover frequency (TOF) was calculated based on the H2 formation rate over the determined Ni dispersion from CO pulse chemisorption data. d Ce3+ content (Ce3+/(Ce3++Ce4+)) and Ni0 content (Ni0/(Ni0+Ni2++Niδ+)) obtained from XPS results. e Date obtained from NH3-TPD-MS The critical role of La/Ce composition in Ni/Ce1-yLayOx catalysts: Optimizing oxygen vacancies and metal-support interactions for ammonia decomposition Jiayue Wang Writing – original draft Methodology Investigation Formal analysis a Wenjun Zhu Writing – review & editing Supervision Methodology Data curation a ⁎ Yudi Yan Methodology Formal analysis Data curation a Yao Li Validation Formal analysis a Chenxi Zhao Formal analysis a Changhai Liang Writing – review & editing Supervision Project administration Funding acquisition Conceptualization a b ⁎⁎ a Laboratory of Advanced Materials and Catalytic Engineering, Dalian University of Technology, Dalian 116024, China Laboratory of Advanced Materials and Catalytic Engineering Dalian University of Technology Dalian 116024 China Laboratory of Advanced Materials and Catalytic Engineering, Dalian University of Technology, Dalian 116024, China b Chengdu Research Institute, Dalian University of Technology, Chengdu 611939, China Chengdu Research Institute Dalian University of Technology Chengdu 611939 China Chengdu Research Institute, Dalian University of Technology, Chengdu 611939, China ⁎ Corresponding author. ⁎⁎ Corresponding author at: Laboratory of Advanced Materials and Catalytic Engineering, Dalian University of Technology, Dalian 116024, China. Laboratory of Advanced Materials and Catalytic Engineering, Dalian University of Technology Dalian 116024 China As a carbon-free hydrogen carrier, ammonia requires efficient decomposition catalysts to enable its practical use in hydrogen energy applications. In this study, a series of Ce1-yLayOx oxides with varying La/Ce molar ratios were synthesized via a citric acid method and utilized as supports for Ni-based NH3 decomposition catalysts. The La/Ce molar ratio significantly influenced the catalytic performance, with Ni/Ce0.5La0.5Ox exhibiting the highest catalytic activity, achieving nearly 100 % ammonia conversion at 540 ℃ (GHSV= 9000 mL gcat −1 h−1) and 600 ℃ (GHSV = 30000 mL gcat −1 h−1). Various characterizations demonstrated that optimal La/Ce ratio promoted uniform dispersion of Ni nanoparticles (4.6 nm), maximizing available active sites for NH3 adsorption. Moreover, the Ce0.5La0.5Ox support enriched the catalyst surface with high Ce3+ species and oxygen vacancies, facilitating electron transfer to Ni species. These electron-enriched Ni species significantly enhanced the cleavage of Ni-N bonds and facilitated the recombination of N adatoms, thereby boosting the overall reaction rate. This work provided fundamental insights into the critical role of metal-support electron transfer in optimizing catalytic performance for efficient ammonia decomposition, offering valuable guidance for the design of advanced hydrogen production catalysts. Graphical Abstract Keywords Ammonia decomposition Ce1-yLayOx Ni-based catalyst Reaction mechanism Data Availability Data will be made available on request. 1 Introduction The rapid global population growth and excessive dependence of fossil fuel have resulted in serious climate change and energy shortages, exacerbating economic and geopolitical instability. Consequently, advancing green, renewable, and clean energy technologies has become an urgent global priority for sustainable development [1,2]. Hydrogen, with its high energy density and carbon-free combustion, is regarded as one of the most promising sustainable energies [3]. However, the widespread adoption of hydrogen energy faces substantial challenges, particularly in storage and transportation, owing its low volumetric energy density and inherent safety concerns [4]. To overcome these limitations, research has focused on developing efficient hydrogen production techniques and the identification of practical chemical hydrogen storage carriers for on-site generation [5]. Ammonia (NH3) has garnered significant attention as a leading candidate for hydrogen storage due to its exceptional properties [5,6]. Notably ammonia decomposition produces only N2 and H2, ensuring straightforward separation and purification processes [7]. Additionally, liquid ammonia exhibits exceptional energy density and the highest volumetric hydrogen density among known carriers, enabling safer and more efficient transportation [8,9]. Owing to these advantages, ammonia has become a highly favorable candidate for hydrogen storage, attracting widespread interest in sustainable energy research [7]. The on-site production of hydrogen via ammonia decomposition has garnered extensive industrial application. Currently, nickel-based catalysts supported on Al2O3 are widely employed in industrial cracking units operating at temperatures between 850 and 950 °C, primarily for applications in metal annealing and galvanizing processes [7]. Additionally, ammonia decomposition has become well-established in the field of fuel cells. For example, in Denmark, Rencat has commercialized a technology that product low-cost, high-purity hydrogen from ammonia for fuel cell systems. Furthermore, hydrogen obtained through ammonia cracking can be utilized as a fuel for internal combustion engines. A prototype vehicle operating on a blend of NH3 and H2 was demonstrated in 2013, with hydrogen supplied from an on-board catalytic cracker [10]. Ammonia decomposition also plays a critical role in medium-scale stationary power generation systems. In the UK, the Science and Technology Facilities Council (STFC), in collaboration with Siemens, Ecuity, and Engie, evaluated both centralized and distributed cracking approaches and designed a cracker capable of producing 200 kg of hydrogen per day [11]. Similarly, in China, several new energy companies have developed a demonstration project leveraging on-site ammonia decomposition for hydrogen production. This project utilizes advanced ammonia conversion technology developed by Professor Jiang's research team at Fuzhou University, supporting a zero-carbon emission energy community [12]. The decomposition of NH3 for H2 production was initially recognized as the reverse reaction of ammonia synthesis. However, this process faces a significant thermodynamic energy barrier, making the operating temperature during the decomposition reaction as high as 700 °C [13–15]. To overcome the challenge of high energy consumption, the development of highly efficient catalysts with excellent stability and low cost is critical for advancing NH3 decomposition technology and promoting the growth of a sustainable hydrogen economy [16]. Currently, Ru-based catalysts demonstrate the superior catalytic activity at low temperatures, but high cost hinders their widespread application [17,18]. As alternatives, transition metals such as Ni or Co have been extensive studied due to their lower cost and potential for activity enhancement, but also possess challenges such as structural sensitivity, susceptibility to oxidative sintering, and excessive N binding to active Ni sites [15]. Therefore, research efforts have focused on optimizing Ni-based catalysts by improving metal loading, tuning electronegativity, enhancing dispersion, and controlling particle size to maximize active site accessibility [19]. Various metal oxide supports, including SiO2, MgO, La2O3, CeO2, Y2O3, and Al2O3 have been utilized for Ni-based catalysts preparation [19–27]. Among these oxide support, CeO2 has attract considerable attention due to its high oxygen storage capacity, reversible Ce4+/Ce3+ redox cycling, abundant surface defects and tunable metal-support interactions [28]. Besides, the formation of oxygen vacancy and the Ce4+→Ce3+ transition facilitate electron transfer from CeO2 support to Ni surface, promoting the associative desorption of N adatoms and accelerating the catalytic reaction rate [24,29]. Despite these advances, the catalytic activity of Ni/CeO2-based catalysts still requires further optimization. Research indicates that when the Ni loading amount on CeO2 exceeds 10 %, nickel particles tend to agglomerate, resulting in a poor availability of active nickel sites [24]. Besides, pure ceria has only a limited number of oxygen defects and often shows severe agglomeration of crystalline domains because of its instability at high temperatures [30]. These factors will lead to the deactivation of Ni/CeO2 catalysts at elevated temperatures. Therefore, optimizing the support properties to enhance strong metal-support interaction (SMSI), inhibit the sintering of Ni nanoparticles, and enhance the thermal stability, oxygen vacancy density, and redox properties of CeO2 is currently the focus of research. Hence, recent studies have focused on support modification and promoter incorporation. For instance, Sima et al. [19] introduced Al3+ as a secondary dopant to increase the CeO2 surface oxygen vacancies and facilitate electron transfer. The synthesize Ni/AlCe0.8Zr0.2O2 catalyst exhibited superior ammonia decomposition activity, achieving complete conversion at 580 °C. Similarly, Zhou et al. [31] demonstrated that adding BN to Ni/CeO2 enhanced Ni nanoparticle dispersion, increased oxygen vacancy concentration, elevated Ce3+ content, and strengthened electronic metal-support interaction [24]. These modifications facilitated NH₃ activation and N-atom desorption, significantly boosting catalytic efficiency. It has been reported that incorporating La3+ into CeO2 facilitates the formation of a solid solution, promoting the generation of oxygen vacancies and Ce3+ species, which is conducive to the formation of electron-rich Ni species. Furthermore, La species can effectively inhibit the growth of active nickel nanoparticles and improve their dispersion. Therefore, La is commonly employed as a promoter to enhance the catalytic performance of Ni-based catalysts [32]. In this study, La2O3 was employed as a basic promoter to modify Ni/CeO2 catalysts due to its distinct electronic structure. The catalytic performance of La as promoter in Ni/CeO2 for ammonia decomposition was evaluated by preparing series Ni/Ce1-yLayOx catalysts. Characterization techniques such as TEM, BET, Raman, XPS, EPR, NH3-TPD and CO-Chem are employed to examine the effect of La3+ doping on the catalyst structure, oxygen vacancy and Ni distribution in Ni/Ce1-yLayOx catalysts. Moreover, reaction mechanism of ammonia decomposition was explored through in-situ DRIFTS and kinetic studies. This study introduced a rational design strategy for modulating the electronic states of active metals and optimizing reactant adsorption via constructing interface, offering a practical approach to the challenges of activity and stability in Ni-based catalysts. 2 Experimental section Details of catalyst preparation, characterization and ammonia decomposition tests were described in the Supporting Information. 3 Results and discussion 3.1 Structural characterization of the Ni/Ce1-yLayOx catalysts Fig. 1a shows the XRD patterns of Ce1-yLayOx supports. All samples exhibited characteristic diffraction peaks at 2 theta values of 28.5, 33.1, 47.5, 56.3, 59.1, 69.4, 76.7, 79.1 and 88.4°, corresponding to the (111), (200), (220), (311), (222), (400), (331), (420) and (422) planes of CeO2 (PDF#34–0394), respectively. Upon La incorporation, the diffraction peaks of CeO2 shifted towards lower angles, along with gradual peak broadening and intensity reduction, which is probably due to the lattice expansion resulting from the substitution of Ce4+ ions (0.097 nm) by larger La3+ ionic (0.103 nm) in the fluorite lattice, confirming the successful formation of Ce1-yLayOx solid solutions [33,34]. Additionally, the diffraction peaks of La2O3 appeared at 27.3, 31.7 and 53.5° for Ce0.1La0.9Ox. Previous studies have demonstrated that at low La content (0 <y < 0.5), La primarily incorporates into the CeO2 lattice with partial surface segregation, whereas higher La content (0.6 <y < 0.9) lead to bulk-to-surface and mixed Ce-La phase formation [35,36]. A similar trend was observed in Ni/Ce0.1La0.9Ox catalyst, where the surface consistently exhibited higher La content compared to the bulk phase (Table S1). These observations suggested that La2O3 likely existed in the form of amorphous dispersion. Fig. 1b shows the XRD patterns of Ni/Ce1-yLayOx samples with 15 wt% Ni loading. The Ni/CeO2 sample exhibited distinct diffraction peaks at 44.5° and 51.8°, assignable to the (111) and (200) planes of Ni (PDF#87–0712), respectively. Importantly, the progressive weakening of Ni diffraction intensities with increasing La content indicated enhanced Ni dispersion on Ce1-yLayOx surface. This finding clearly demonstrated that La doping effectively promoted the dispersion of active Ni species, which was crucial for catalytic performance. The textural properties of Ni/Ce1-yLayOx samples were further investigated by N2 adsorption-desorption measurements (Fig. 1c, d). All samples displayed characteristic type IV isotherm with an H4-type hysteresis loop, typical of mesoporous structures with slit-shaped pores [37]. The specific surface area, pore size and volume were summarized in Table 1. Low content of La doping enhanced the specific surface area and pore volume of the Ni/Ce1-yLayOx samples, where Ni/Ce0.7La0.3Ox and Ni/Ce0.5La0.5Ox demonstrated higher specific surface areas (62 and 53 m2/g) and pore volumes (0.14 and 0.19 cm3/g) [38]. This higher specific surface area directly correlated with enhanced metallic dispersion, as evidenced by higher Ni dispersion values of 1.60 % and 1.90 % for Ni/Ce0.7La0.3Ox and Ni/Ce0.5La0.5Ox samples (Table 1). This indicated that more Ni sites were exposed on Ni/Ce0.7La0.3Ox and Ni/Ce0.5La0.5Ox surface, which would increase the density of accessible active sites for NH3 decomposition. Pore size distribution further confirmed the mesoporous nature of all Ni/Ce1-yLayOx samples, with main pore dimeters ranging from 2 to 20 nm and a sharp maximum centered at 2–4 nm. HRTEM technique was employed to investigate the nanostructure and size distribution of Ni nanoparticles in Ni/CeO2, Ni/Ce0.5La0.5Ox and Ni/Ce0.1La0.9Ox, as presented in Fig. 2. All samples exhibited distinct lattice spacing of 0.176 and 0.126 nm, attributed to (200) and (220) crystal plane of metallic Ni, respectively. Notably, the CeO2 (200) plane spacing expanded from 0.271 nm in CeO2 (Fig. S1) and Ni/CeO2 to 0.279 nm in Ni/Ce0.5La0.5Ox, providing evidence for successful formation of Ce1-yLayOx solid solution. Moreover, the appearance of lattice spacing with 0.282 nm in Ni/Ce0.1La0.9Ox (Fig. 2c) confirmed the existence of La2O3 (400) planes, consistent with previous XRD observations. The presence and size distribution of Ni particles were clearly visible in Fig. S2 and 2d-f. Statistical analysis of particle size distribution revealed a strong dependence of Ni nanoparticle size on the La/Ce molar ratio. The Ni/Ce0.5La0.5Ox showed superior dispersion with an average Ni particle size of 4.6 nm, significantly smaller than those observed on Ni/CeO2 (7.7 nm) and Ni/Ce0.1La0.9Ox (7.2 nm). This finding correlated well with the higher specific surface area and enhanced Ni dispersion. The superior dispersion can be attributed to the synergistic effect between the Ni-La metal that effectively prevented Ni nanoparticle agglomeration and migration [39]. However, excessive La loading resulted in surface precipitation of La2O3 species as evidence by HRTEM, which partially obscured active Ni sites and compromised metal accessibility [40]. EDS results in Fig. 2g-j confirmed the uniform dispersion of Ce and La elements, with Ni nanoparticles uniformly dispersed on the Ce0.5La0.5Ox support surface. Fig. 3a presents the H2-TPR profiles of NiO/Ce1-yLayOx samples, providing critical insights into the reducibility and metal-support interactions induced by La doping. The NiO/CeO2 sample exhibited a single reduction peak at 300 °C, which corresponded to the reduction of NiO species [35,37]. With the doping of La content, the main reduction peak shifted to higher temperature, and a distinct low-temperature reduction peak emerged. Specifically, well-defined low-temperature peaks at 225 °C and 234 °C were observed for Ni/Ce0.7La0.3Ox and Ni/Ce0.5La0.5Ox, respectively, corresponding to the reduction of highly dispersed, weakly interaction NiO nanoparticles [37,41]. This observation confirmed that moderated La doping facilitated the formation of well-dispersed NiO species. However, excessive La incorporation resulted in a substantially higher reduction temperature (380 °C), which could be attributed to the facts that the strong metal-support interaction induced by La incorporation, and the partial coverage of Ni species by La2O3 due to its intrinsic hydrophilic nature, creating a physical barrier for hydrogen access [42]. All these results demonstrated that La doping into CeO2 helps to form the well-dispersed NiO particles on the supports and modulated the strength of metal-support interactions. Ramam spectrum was measured to further investigate the structural properties of the Ni/Ce1-yLayOx samples, as shown in Fig. 3b. Two distinct peaks at 460 and 570 cm−1 were observed in all samples, corresponding to F2 g vibrational mode of the cubic fluorite CeO2 structure and the D-mode associated with defect-induced oxygen vacancy, respectively. As La dopped in CeO2, the F2 g peak exhibited a slight blue shift and its FWHM (Full Width at Half Maxima) increased, which was attributed to the lattice expansion, crystallite size reduction and oxygen vacancy presence induced by La doping [43]. The F2 g and D-mode peaks in Ni/Ce0.3La0.7Ox and Ni/Ce0.1La0.9Ox gradually diminished, which was due to the higher La content in the supports precipitating onto the catalyst surface, thereby covering the Ce1-yLayOx and oxygen vacancy on its surface. Quantitative analysis of oxygen vacancy concentrations, reflected by the intensity ratios of ID/IF2g revealed that Ni/Ce0.5La0.5Ox possessed higher ID/IF2g ratios of 0.8 among all Ni/Ce1-yLayOx. This suggested that the higher oxygen vacancy concentration on the surface, which strengthened metal-support interactions and promoted electron transfer from CeO2 to Ni active sites [22,29]. Furthermore, in order to more intuitively reveal the presence and strength of oxygen vacancies in the Ni/Ce1-yLayOx samples, EPR analysis was conducted and the results were shown in Fig. 3c. The symmetrical signal at g= 2.003 could be ascribed to oxygen vacancy. Apparently, Ni/Ce0.5La0.5Ox exhibited a stronger signal, indicating the higher oxygen vacancies content, which was well consistent Raman results. The XPS technique was conducted to investigate the surface elemental composition and electronic states of Ni, Ce, and La species in Ni/Ce1-yLayOx samples. Fig. 3d shows the deconvoluted Ce 3d XPS spectra, where the peaks denoted as u' (884.2 eV) and v' (903.5 eV) were associated with Ce3+ species, while the peaks labeled as u (882.1 eV), u'' (888.7 eV), u′'' (898.5 eV), v (900.8 eV), v'' (907.6 eV), v′'' (916.6 eV) corresponded to Ce4+ species [44]. The peak positions and peak areas for other catalysts are listed in Table S2, S3. Quantitative analysis revealed that La incorporation significantly enhanced Ce3+ content (Table 1), indicating that optimal La doping promoted the formation of oxygen vacancies through the charge compensation mechanism (Ce4+ + O2- → Ce3+ + Ov). Among all samples, the Ni/Ce0.5La0.5Ox exhibited the highest Ce3+ concentration, creating an electron-rich environment that promoted the electron transfer to Ni sites via oxygen vacancy and enhanced N2 desorption during ammonia decomposition [24]. The La 3d5/2 XPS spectra (Fig. 3e) of Ni/Ce1-yLayOx samples displayed spin-orbit splitting peaks. The splitting energy decreased from 4.7 eV (Ni/Ce0.9La0.1Ox) to 4.0 eV (Ni/Ce0.1La0.9Ox), approaching the characteristic value for La(OH)3. This may indicate La2O3 phases segregate to the surface and absorbs moisture from the air to form hydroxides at high La incorporation [45]. Significantly, Ni/Ce0.5La0.5Ox exhibited the highest La 3d5/2 binding energy, indicating the presence of abundant Lax+ species (x > 3) formed through strong Ce-O-La interfacial interactions [46]. The existence of Lax+ could modulate the electron density of surface Ni atoms through metal-support charge transfer, which is crucial for Ni-N cracking during NH3 decomposition [47]. The Ni 2p XPS spectra of Ni/Ce1-yLayOx samples was shown in Fig. 3f. For Ni/CeO2 samples, the characteristic peaks at 870.1, 871.4, 873.2 and 874.6 eV were assigned to Ni0 2p1/2, Niδ+ 2p1/2, Ni2+ 2p1/2 and Sat 2p1/2, respectively [46]. The presence of Ni2+ species predominantly originated from surface oxidation of Ni when exposed to ambient conditions, particularly in high Ni loading catalysts. With the doping of La, the Ni0, Ni2+, and Niδ+ characteristic peaks gradually shifted, and the binding energy of Ni0 in Ni/Ce0.5La0.5Ox was the lowest (869.9 eV), which was due to the Ce0.5La0.5Ox support with high Ce3+ and Ov content. Besides, this electron-rich structure likely forms a Ce-Ov-Ni interface on the catalyst surface and supplied more electrons to Ni0, which would increase the electron cloud density of Ni0, facilitated Ni-N bond breaking and accelerated N desorption and recombination on the metal surface [22,44,48]. The Ni0 content was calculated by Ni0/(Ni0+Ni2++Niδ+) and shown in Table 1. It was revealed that the Ni0 content was the highest in Ni/Ce0.5La0.5Ox samples, which was attributed to abundant Ce3+ species that help stabilize the Ni substance in its metallic Ni0 form and can effectively mitigate nickel oxidation [49]. High Ni0 content will provide more active sites, which enhanced NH3 decomposition. 3.2 Catalyst activity of NH3 decomposition The catalytic performance of the Ni/Ce1-yLayOx for ammonia decomposition were evaluated, and the result was shown in Fig. 4a. The temperature-dependent NH3 conversion was conducted from 220 to 620 °C with a rise step of 20 °C per data point. All catalysts exhibited enhanced activity with increasing temperature, with the highest catalytic performance observed for Ni/Ce0.5La0.5Ox, achieving 90.3 % NH3 conversion at 500 °C and GHSV of 9000 mL gcat −1 h−1. The catalytic performance followed the trend: Ni/Ce0.5La0.5Ox (90.3 %) > Ni/Ce0.7La0.3Ox (81.0 %) > Ni/Ce0.3La0.7Ox (79.7 %) > Ni/Ce0.1La0.9Ox (71.0 %) > Ni/Ce0.9La0.1Ox (48.9 %) > Ni/CeO2 (48.7 %). Notably, Ni/Ce0.5La0.5Ox demonstrated near-complete NH3 conversion (99.8 %) at 540 °C, highlighting its superior catalytic performance. In addition, the apparent activation energies (Ea) were calculated based on the Arrhenius plots, as illustrated in Fig. 4b. The activation energy (Ea) decreases in the following order: Ni/Ce0.5La0.5Ox (80 kJ/mol) < Ni/Ce0.9La0.1Ox (93 kJ/mol) < Ni/Ce0.7La0.3Ox (96 kJ/mol) < Ni/Ce0.3La0.7Ox (110 kJ/mol) < Ni/Ce0.1La0.9Ox (117 kJ/mol) < Ni/CeO2 (133 kJ/mol). The lowest Ea for Ni/Ce0.5La0.5Ox correlated well with its highest catalytic activity, achieving remarkable hydrogen production rate of 60.5 mmol−1 gNi −1 min−1 at 500 °C. These results highlighted the importance of metal-support interactions in facilitating NH3 decomposition, with the optimal La/Ce ratio in Ni/Ce0.5La0.5Ox significantly enhancing reaction kinetics. The long-term stability of Ni/Ce0.5La0.5Ox was examined through a continuous 50-hour reaction at 500 °C. As shown in Fig. 4c, the catalyst sustained 92 % NH3 conversion of its initial activity without significant deactivation, confirming its excellent durability. Post-reaction XRD analysis (Fig. 4d) revealed that the structure of Ni/Ce0.5La0.5Ox catalyst remained thermally stable, with no detectable Ni diffraction peaks, indicating that the preservation of well-dispersed Ni nanoparticles and no noticeable metal sintering occurred during the reaction. Furthermore, the cyclic stability of Ni/Ce0.5La0.5Ox was examined over five reaction cycles (220–620 °C) and shown in Fig. 4e. Ni/Ce0.5La0.5Ox exhibited no significant activity loss after five reaction cycles, demonstrating its robust structural stability. The influence of GHSV (9000–30000 mL gcat −1 h−1) on catalytic performance was also investigated (Fig. 4f). As expected, higher GHSV values resulted in lower NH3 conversion because of the shorter reactant residence time. While near-complete conversion was achieved at 540 °C when the GHSV was 9000 mL gcat −1 h−1, a higher temperature of 600 °C was required to achieve comparable conversion at 30000 mL gcat −1 h−1. The Ni/Ce0.5La0.5Ox catalyst demonstrated satisfactory stability and remarkable resistance to high GHSV conditions, highlighting its strong potential for practical application in NH3 decomposition. As evidenced by comparing with other reported Ni catalysts (Table S4), the prepared Ni/Ce0.5La0.5Ox catalyst exhibited superior catalytic performance under identical reaction conditions. This indicated the incorporation of La into CeO2 support significantly enhanced the catalytic performance for ammonia decomposition compared to pure CeO2 or other promoters such as Zr and Al. Furthermore, the high hydrogen production rate of Ni demonstrated that the metal utilization efficiency of Ni/Ce1-yLayOx catalyst had been significantly improved, suggesting considerable potential for its practical application as a candidate in hydrogen generation systems. 3.3 Reaction mechanism NH3-TPD technology was employed to investigate the adsorption and decomposition of NH3 on the catalyst surface. Before NH₃ adsorption, the Ni/Ce1-yLayOx catalysts were pre-reduced in H2/Ar atmosphere at 400 °C for 2 h. As shown in Fig. 5a, all samples exhibited distinct desorption peaks, indicating the adsorption of NH3 on their surfaces [50]. Moreover, the NH3 desorption peaks for Ni/Ce0.3La0.7Ox and Ni/Ce0.1La0.9Ox samples occurred at higher temperature, suggesting that NH3 was strongly adsorbed on their surfaces, which was primarily caused by the catalyst surface being covered with strongly basic La2O3. The Had and Nad atoms generated on the catalyst surface may recombine to NH3ad, leading to its release as NH3 g at elevated temperatures [51]. Besides, the maximum NH3 desorption peak on Ni/Ce0.5La0.5Ox catalyst indicated that the catalyst exhibited high NH3 adsorption capacity, which may be attributed to the abundance of available oxygen defect sites on the catalyst surface [19]. In Fig. 5b, the onset temperature of N2 desorption was approximately 100–200 °C higher than that of NH3, indicating that the recombination and desorption of N species was more challenging, becoming the rate-determining step in the NH₃ decomposition process [24,52]. Among all the catalysts, the N2 desorption temperature on Ni/Ce0.5La0.5Ox catalyst was relatively low, and intensity of the desorption peak was relatively high. This indicated that the recombination desorption of N atoms occurred more readily on the Ni/Ce0.5La0.5Ox catalyst, which facilitated the NH3 decomposition reaction [22]. Combining the Raman and XPS result, the enhanced N2 desorption on Ni/Ce0.5La0.5Ox catalyst closely related to the high Ce3+ concentration and oxygen vacancies in the support, enriching the electrons of the surface Ni through electron transfer, exciting Ni-N* species and thus promoting N2 desorption. To further elucidate the NH3 decomposition mechanism on the catalyst surface, in-situ DRIFTS measurements were conducted, and the spectra of NH3 adsorption on Ni/Ce1-yLayOx over the temperature range of 50–400 °C were shown in Fig. 6. The bands at 3500–3000 cm−1 and 2000–1000 cm−1 corresponded to the physically adsorbed NH3 or gaseous-phase NH3. The bands at 3333 cm−1 and 1624 cm−1 were attributed to NH₃ molecules adsorbed on Lewis acid sites [22]. The bands at 3800–3600 cm−1 are attributed to basic hydroxyl groups, which primarily interacted with NH3 molecules via hydrogen bonding [53]. The presence of these bands suggested strong chemisorption of NH3 on the catalyst. A pronounced decrease in the peak intensity at 1623 cm−1 was observed for the Ni/Ce0.5La0.5Oₓ and Ni/Ce0.3La0.7Ox catalysts, while only minor reductions were detected in the others. This suggests that NH₃ desorption or dehydrogenation occur more readily on Ni/Ce0.5La0.5Oₓ and Ni/Ce0.3La0.7Ox. Additionally, peaks at 1580–1517 cm−1 and 1500–1403 cm−1 were attributed to -NH2 species and -NH deformation mode, respectively, indicating that NH3 was effectively activated and dissociated into radical intermediates on the catalyst surface [22,54–57]. At 400 °C, the La content leads to divergent trends in the evolution of intermediate species. In the case of low La doping (y = 0–0.3), the peak intensity of -NH2 and -NH decreases. However, as the La content increased (y = 0.5–0.9), the intensity of the -NH2 peak first raised and then decreased at 400 °C. Considering the variation in peak intensity of NH3, the reduction of intermediate species peaks in Fig. 6a-c might stem from the relatively slow N-H bond cleavage rate in NH3, whereby -NH2 continued to be consumed as temperature increases (or time accumulated), likely through further dehydrogenation to form -NH or direct decomposition. The trend in the peak characteristics of the NH species was similar to the -NH2 species, indicating that the formation of NH was also restricted. Conversely, the initial increase of the -NH2 and -NH peaks in Fig. 6d-f suggested that N-H bond cleavage occurred in NH3. This change in peak intensity was most evident over the Ni/Ce0.5La0.5Oₓ catalyst. The strongest -NH2 peak observed on Ni/Ce0.5La0.5Ox indicated its superior ability to facilitate N-H bond cleavage. As the temperature increased, a greater amount of -NH2 species accumulated on the catalyst surface. This enhanced activity could be attributed to the electron-rich and highly dispersed active Ni sites, as well as the strong metal-support interaction in Ni/Ce0.5La0.5Ox, both of which promoted the breaking of N-H bonds [19,22,55]. The decrease in the -NH2 signal at 400 °C indicates that most of the -NH2 species further decompose into -NH, responding to the significantly enhanced -NH peak at 1492 cm−1 observed over Ni/Ce0.5La0.5Ox at the same temperature. Meanwhile, the characteristic -NH peak around 1425 cm−1 in Fig. 6d-f exhibited an initial increase followed by a decrease with rising temperature, suggesting that -NH underwent hydrogenolysis, ultimately forming N atoms. This indicated that the cleavage of N-H bonds likely followed the reaction pathway: NH3 → -NH3 → -NH → -N [56,58]. 4 Conclusion In summary, a series of Ni/Ce1-yLayOx catalysts with various La/Ce ratios were systematically investigated for NH3 decomposition. The Ni/Ce0.5La0.5Ox catalyst showed the best catalytic performance, achieving complete NH3 conversion at 540 °C (GHSV=9000 mL gcat −1 h−1) and 600 °C (GHSV = 30000 mL gcat −1 h−1) while maintaining excellent cycle stability and long-term stability at 500 °C over 50-hour period. Characterization studies revealed that the Ce0.5La0.5Ox support promoted high Ni dispersion with excellent anti-sintering properties, maximizing active site availability, and abundant oxygen vacancies that induced strong metal-support interaction, generating electron-rich Ni sites. Mechanistic studies through NH3-TPSR and in-situ DRIFTS collectively demonstrated that these oxygen vacancies enhanced NH3 adsorption while the electron-rich Ni facilitated N-H bond cleavage and N adatoms recombination, thereby accelerating the reaction rate. This work not only introduces a highly active, stable Ru-free catalyst but also elucidates the critical role of oxygen vacancy engineering in Ce-La mixed oxides for efficient ammonia decomposition, providing fundamental insights for designing cost-effective hydrogen production catalysts. CRediT authorship contribution statement Jiayue Wang: Writing – original draft, Methodology, Investigation, Formal analysis. Changhai Liang: Writing – review & editing, Supervision, Project administration, Funding acquisition, Conceptualization. Yao Li: Validation, Formal analysis. Chenxi Zhao: Formal analysis. Wenjun Zhu: Writing – review & editing, Supervision, Methodology, Data curation. Yudi Yan: Methodology, Formal analysis, Data curation. Declaration of Competing Interest The authors declare that they have no known competing financial interests or personal relationships that could have appeared to influence the work reported in this paper. Acknowledgements This work was financially supported by National Key R&D Program of China (2024YFB4006701)，National Natural Science Foundation of China (22402018), Natural Science Foundation of Liaoning Province (2023BSBA073) and the Fundamental Research Funds for the Central Universities (DUT24BS053). Appendix A Supporting information Supplementary data associated with this article can be found in the online version at doi:10.1016/j.apcata.2025.120578. Appendix A Supplementary material Supplementary material References [1] D.E.H.J. Gernaat H.S. de Boer V. Daioglou S.G. Yalew C. Müller D.P. van Vuuren Climate change impacts on renewable energy supply Nat. Clim. Change 11 2021 119 125 D.E.H.J. Gernaat, H.S. de Boer, V. Daioglou, S.G. Yalew, C. Müller, D.P. van Vuuren, Climate change impacts on renewable energy supply, Nat. Clim. Change, 11 (2021) 119-125. [2] T.E. Bell L. Torrente-Murciano H2 production via ammonia decomposition using Non-Noble metal catalysts: a review Top. Catal. 59 2016 1438 1457 T.E. Bell, L. Torrente-Murciano, H2 Production via Ammonia Decomposition Using Non-Noble Metal Catalysts: A Review, Top. Catal., 59 (2016) 1438-1457. [3] J.-H. Wee Applications of proton exchange membrane fuel cell systems Renew. Sustain. Energy Rev. 11 2007 1720 1738 J.-H. Wee, Applications of proton exchange membrane fuel cell systems, Renewable Sustainable Energy Rev., 11 (2007) 1720-1738. [4] U. Eberle M. Felderhoff F. Schüth Chemical and physical solutions for hydrogen storage Angew. Chem. Int. Ed. 48 2009 6608 6630 U. Eberle, M. Felderhoff, F. Schüth, Chemical and Physical Solutions for Hydrogen Storage, Angew. Chem., Int. Ed., 48 (2009) 6608-6630. [5] J. Andersson S. Grönkvist Large-scale storage of hydrogen Int. J. Hydrog. Energy 44 2019 11901 11919 J. Andersson, S. Grönkvist, Large-scale storage of hydrogen, Int. J. Hydrogen Energy, 44 (2019) 11901-11919. [6] C. Chen K. Wu H. Ren C. Zhou Y. Luo L. Lin C. Au L. Jiang Ru-Based catalysts for ammonia decomposition: a Mini-Review Energy Fuels 35 2021 11693 11706 C. Chen, K. Wu, H. Ren, C. Zhou, Y. Luo, L. Lin, C. Au, L. Jiang, Ru-Based Catalysts for Ammonia Decomposition: A Mini-Review, Energy Fuels, 35 (2021) 11693-11706. [7] S. Sun Q. Jiang D. Zhao T. Cao H. Sha C. Zhang H. Song Z. Da Ammonia as hydrogen carrier: advances in ammonia decomposition catalysts for promising hydrogen production Renew. Sustain. Energy Rev. 169 2022 112918 S. Sun, Q. Jiang, D. Zhao, T. Cao, H. Sha, C. Zhang, H. Song, Z. Da, Ammonia as hydrogen carrier: Advances in ammonia decomposition catalysts for promising hydrogen production, Renewable Sustainable Energy Rev., 169 (2022) 112918. [8] R. Lan J.T.S. Irvine S. Tao Ammonia and related chemicals as potential indirect hydrogen storage materials Int. J. Hydrog. Energy 37 2012 1482 1494 R. Lan, J.T.S. Irvine, S. Tao, Ammonia and related chemicals as potential indirect hydrogen storage materials, Int. J. Hydrogen Energy, 37 (2012) 1482-1494. [9] Y. Kojima Hydrogen storage materials for hydrogen and energy carriers Int. J. Hydrog. Energy 44 2019 18179 18192 Y. Kojima, Hydrogen storage materials for hydrogen and energy carriers, Int. J. Hydrogen Energy, 44 (2019) 18179-18192. [10] M. Comotti S. Frigo Hydrogen generation system for ammonia–hydrogen fuelled internal combustion engines Int. J. Hydrog. Energy 40 2015 10673 10686 M. Comotti, S. Frigo, Hydrogen generation system for ammonia–hydrogen fuelled internal combustion engines, Int. J. Hydrogen Energy, 40 (2015) 10673-10686. [11] STFC UK Researchers Change game for hydrogen from ammonia for cars Fuel Cells Bull. 7 2014 11 STFC UK Researchers, Change game for hydrogen from ammonia for cars, Fuel Cells Bull., 7 (2014) 11. [12] L. Zhai S. Liu Z. Xiang Ammonia as a carbon-free hydrogen carrier for fuel cells: a perspective Ind. Chem. Mater. 1 2023 332 342 L. Zhai, S. Liu, Z. Xiang, Ammonia as a carbon-free hydrogen carrier for fuel cells: a perspective, Ind. Chem. Mater., 1 (2023) 332-342. [13] T.A. Le Q.C. Do Y. Kim T.-W. Kim H.-J. Chae A review on the recent developments of ruthenium and nickel catalysts for COx-free H2 generation by ammonia decomposition Korean J. Chem. Eng. 38 2021 1087 1103 T.A. Le, Q.C. Do, Y. Kim, T.-W. Kim, H.-J. Chae, A review on the recent developments of ruthenium and nickel catalysts for COx-free H2 generation by ammonia decomposition, Korean J. Chem. Eng., 38 (2021) 1087-1103. [14] S. Mukherjee S.V. Devaguptapu A. Sviripa C.R.F. Lund G. Wu Low-temperature ammonia decomposition catalysts for hydrogen generation Appl. Catal. B 226 2018 162 181 S. Mukherjee, S.V. Devaguptapu, A. Sviripa, C.R.F. Lund, G. Wu, Low-temperature ammonia decomposition catalysts for hydrogen generation, Appl. Catal. B, 226 (2018) 162-181. [15] H. Fang D. Liu Y. Luo Y. Zhou S. Liang X. Wang B. Lin L. Jiang Challenges and opportunities of Ru-Based catalysts toward the synthesis and utilization of ammonia ACS Catal. 12 2022 3938 3954 H. Fang, D. Liu, Y. Luo, Y. Zhou, S. Liang, X. Wang, B. Lin, L. Jiang, Challenges and Opportunities of Ru-Based Catalysts toward the Synthesis and Utilization of Ammonia, ACS Catal., 12 (2022) 3938-3954. [16] X.-C. Li T.-T. Huang Y. Hu X. Li Y.-F. Liu H. Dong C.-J. Jia G.-S. Li Y.-W. Zhang Enhancing metal-support interactions in CeAlOx/Co inverse catalyst for significantly boosting ammonia decomposition reaction Appl. Catal. B 366 2025 125020 X.-C. Li, T.-T. Huang, Y. Hu, X. Li, Y.-F. Liu, H. Dong, C.-J. Jia, G.-S. Li, Y.-W. Zhang, Enhancing metal-support interactions in CeAlOx/Co inverse catalyst for significantly boosting ammonia decomposition reaction, Appl. Catal. B, 366 (2025) 125020. [17] J. Cha Y.S. Jo H. Jeong J. Han S.W. Nam K.H. Song C.W. Yoon Ammonia as an efficient COx-free hydrogen carrier: fundamentals and feasibility analyses for fuel cell applications Appl. Energy 224 2018 194 204 J. Cha, Y.S. Jo, H. Jeong, J. Han, S.W. Nam, K.H. Song, C.W. Yoon, Ammonia as an efficient COx-free hydrogen carrier: Fundamentals and feasibility analyses for fuel cell applications, Appl. Energy, 224 (2018) 194-204. [18] J. Guo P. Wang G. Wu A. Wu D. Hu Z. Xiong J. Wang P. Yu F. Chang Z. Chen P. Chen Lithium imide synergy with 3d transition-metal nitrides leading to unprecedented catalytic activities for ammonia decomposition Angew. Chem. Int. Ed. 54 2015 2950 2954 J. Guo, P. Wang, G. Wu, A. Wu, D. Hu, Z. Xiong, J. Wang, P. Yu, F. Chang, Z. Chen, P. Chen, Lithium Imide Synergy with 3d Transition-Metal Nitrides Leading to Unprecedented Catalytic Activities for Ammonia Decomposition, Angew. Chem. Int. Ed., 54 (2015) 2950-2954. [19] D. Sima H. Wu K. Tian S. Xie J.J. Foo S. Li D. Wang Y. Ye Z. Zheng Y.-Q. Liu Enhanced low temperature catalytic activity of Ni/Al–Ce0.8Zr0.2O2 for hydrogen production from ammonia decomposition Int. J. Hydrog. Energy 45 2020 9342 9352 D. Sima, H. Wu, K. Tian, S. Xie, J.J. Foo, S. Li, D. Wang, Y. Ye, Z. Zheng, Y.-Q. Liu, Enhanced low temperature catalytic activity of Ni/Al–Ce0.8Zr0.2O2 for hydrogen production from ammonia decomposition, Int. J. Hydrogen Energy, 45 (2020) 9342-9352. [20] S. Li X. Liu Y. Guo Y. Wang Highly active and stable Ni@SiO2 catalyst for ammonia decomposition Fuel 368 2024 131543 S. Li, X. Liu, Y. Guo, Y. Wang, Highly active and stable Ni@SiO2 catalyst for ammonia decomposition, Fuel, 368 (2024) 131543. [21] Z. Wang X. Tang M. Wang Y. Xu X. Qin L. Zhou M. Peng S. Dai D. Ma Ce-promoted Ni-NiO small ensemble constrained in an MgO catalyst for efficient hydrogen production through NH3 decomposition Chem. Catal. 4 2024 101000 Z. Wang, X. Tang, M. Wang, Y. Xu, X. Qin, L. Zhou, M. Peng, S. Dai, D. Ma, Ce-promoted Ni-NiO small ensemble constrained in an MgO catalyst for efficient hydrogen production through NH3 decomposition, Chem Catal., 4 (2024) 101000. [22] H. Liu R. Zhang S. Liu G. Liu CeO2/Ni inverse catalyst as a highly active and stable Ru-free catalyst for ammonia decomposition ACS Catal. 14 2024 9927 9939 H. Liu, R. Zhang, S. Liu, G. Liu, CeO2/Ni Inverse Catalyst as a Highly Active and Stable Ru-free Catalyst for Ammonia Decomposition, ACS Catal., 14 (2024) 9927-9939. [23] R.-B. Zhang Z.-A. Tu S. Meng G. Feng Z.-H. Lu Y.-Z. Yu T.R. Reina F.-Y. Hu X.-H. Chen R.-P. Ye Engineering morphologies of yttrium oxide supported nickel catalysts for hydrogen production Rare Met. 42 2023 176 188 R.-B. Zhang, Z.-A. Tu, S. Meng, G. Feng, Z.-H. Lu, Y.-Z. Yu, T.R. Reina, F.-Y. Hu, X.-H. Chen, R.-P. Ye, Engineering morphologies of yttrium oxide supported nickel catalysts for hydrogen production, Rare Met., 42 (2023) 176-188. [24] C. Zhou K. Wu H. Huang C.-F. Cao Y. Luo C.-Q. Chen L. Lin C. Au L. Jiang Spatial confinement of Electron-Rich ni nanoparticles for efficient ammonia decomposition to hydrogen production ACS Catal. 11 2021 10345 10350 C. Zhou, K. Wu, H. Huang, C.-F. Cao, Y. Luo, C.-Q. Chen, L. Lin, C. Au, L. Jiang, Spatial Confinement of Electron-Rich Ni Nanoparticles for Efficient Ammonia Decomposition to Hydrogen Production, ACS Catal., 11 (2021) 10345-10350. [25] H. Tabassum S. Mukherjee J. Chen D. Holiharimanana S. Karakalos X. Yang S. Hwang T. Zhang B. Lu M. Chen Z. Tang E.A. Kyriakidou Q. Ge G. Wu Hydrogen generation via ammonia decomposition on highly efficient and stable Ru-free catalysts: approaching complete conversion at 450 °C Energy Environ. Sci. 15 2022 4190 4200 H. Tabassum, S. Mukherjee, J. Chen, D. Holiharimanana, S. Karakalos, X. Yang, S. Hwang, T. Zhang, B. Lu, M. Chen, Z. Tang, E.A. Kyriakidou, Q. Ge, G. Wu, Hydrogen generation via ammonia decomposition on highly efficient and stable Ru-free catalysts: approaching complete conversion at 450 °C, Energy Environ. Sci., 15 (2022) 4190-4200. [26] X.-Y. Guo J.-H. Wang Q. Zhang T.-Z. Li H. Dong C.-J. Jia C. Li Y.-W. Zhang Alkaline earth metal promoted hydrogen production from ammonia decomposition over Ni/La2O3-based catalysts Appl. Catal. B 348 2024 123844 X.-Y. Guo, J.-H. Wang, Q. Zhang, T.-Z. Li, H. Dong, C.-J. Jia, C. Li, Y.-W. Zhang, Alkaline earth metal promoted hydrogen production from ammonia decomposition over Ni/La2O3-based catalysts, Appl. Catal., B, 348 (2024) 123844. [27] M. Usman A. Ali A. Jedidi A. Ajeebi M.M. Hossain K.M. Yau H. Alghamdi M.A. Aziz M.N. Shaikh Rare earth metal promoters (La, Ce, Nd, Sm) on nickel-supported Al2O3 catalysts for ammonia decomposition Fuel 396 2025 135272 M. Usman, A. Ali, A. Jedidi, A. Ajeebi, M.M. Hossain, K.M. Yau, H. Alghamdi, M.A. Aziz, M.N. Shaikh, Rare earth metal promoters (La, Ce, Nd, Sm) on nickel-supported Al2O3 catalysts for ammonia decomposition, Fuel, 396 (2025) 135272. [28] J. Chen H.N. Pham T. Mon T.J. Toops A.K. Datye Z. Li E.A. Kyriakidou Ni/CeO2 nanocatalysts with optimized CeO2 support morphologies for CH4 oxidation ACS Appl. Nano Mater. 6 2023 4544 4553 J. Chen, H.N. Pham, T. Mon, T.J. Toops, A.K. Datye, Z. Li, E.A. Kyriakidou, Ni/CeO2 Nanocatalysts with Optimized CeO2 Support Morphologies for CH4 Oxidation, ACS Appl. Nano Mater., 6 (2023) 4544-4553. [29] H. Liu Y. Zhang S. Liu S. Li G. Liu Ni-CeO2 nanocomposite with enhanced metal-support interaction for effective ammonia decomposition to hydrogen Chem. Eng. J. 473 2023 145371 H. Liu, Y. Zhang, S. Liu, S. Li, G. Liu, Ni-CeO2 nanocomposite with enhanced metal-support interaction for effective ammonia decomposition to hydrogen, Chem. Eng. J., 473 (2023) 145371. [30] K.J. Lee Y. Kim J.H. Lee S.J. Cho J.H. Kwak H.R. Moon Facile synthesis and characterization of nanostructured transition Metal/Ceria solid solutions (TMxCe1–xO2−δ, TM = Mn, Ni, Co, or Fe) for CO oxidation Chem. Mater. 29 2017 2874 2882 K.J. Lee, Y. Kim, J.H. Lee, S.J. Cho, J.H. Kwak, H.R. Moon, Facile Synthesis and Characterization of Nanostructured Transition Metal/Ceria Solid Solutions (TMxCe1–xO2−δ, TM = Mn, Ni, Co, or Fe) for CO Oxidation, Chem. Mater, 29 (2017) 2874-2882. [31] T. Zhang W. Wang F. Gu W. Xu J. Zhang Z. Li T. Zhu G. Xu Z. Zhong F. Su Enhancing the low-temperature CO2 methanation over Ni/La-CeO2 catalyst: the effects of surface oxygen vacancy and basic site on the catalytic performance Appl. Catal. B 312 2022 121385 T. Zhang, W. Wang, F. Gu, W. Xu, J. Zhang, Z. Li, T. Zhu, G. Xu, Z. Zhong, F. Su, Enhancing the low-temperature CO2 methanation over Ni/La-CeO2 catalyst: The effects of surface oxygen vacancy and basic site on the catalytic performance, Appl. Catal. B, 312 (2022) 121385. [32] T.A. Le Y. Kim H.W. Kim S.-U. Lee J.-R. Kim T.-W. Kim Y.-J. Lee H.-J. Chae Ru-supported lanthania-ceria composite as an efficient catalyst for COx-free H2 production from ammonia decomposition Appl. Catal. B 285 2021 119831 T.A. Le, Y. Kim, H.W. Kim, S.-U. Lee, J.-R. Kim, T.-W. Kim, Y.-J. Lee, H.-J. Chae, Ru-supported lanthania-ceria composite as an efficient catalyst for COx-free H2 production from ammonia decomposition, Appl. Catal. B, 285 (2021) 119831. [33] J. Lee M.W. Lee M.J. Kim J.H. Lee E.J. Lee C. Jung J.W. Choung C.H. Kim K.-Y. Lee Effects of la incorporation in catalytic activity of Ag/La-CeO2 catalysts for soot oxidation J. Hazard. Mater. 414 2021 125523 J. Lee, M.W. Lee, M.J. Kim, J.H. Lee, E.J. Lee, C. Jung, J.W. Choung, C.H. Kim, K.-Y. Lee, Effects of La incorporation in catalytic activity of Ag/La-CeO2 catalysts for soot oxidation, J. Hazard. Mater., 414 (2021) 125523. [34] W. Zhu J. Jin X. Chen C. Li T. Wang C.-W. Tsang C. Liang Enhanced activity and stability of La-doped CeO2 monolithic catalysts for lean-oxygen methane combustion Environ. Sci. Pollut. Res. 25 2018 5643 5654 W. Zhu, J. Jin, X. Chen, C. Li, T. Wang, C.-W. Tsang, C. Liang, Enhanced activity and stability of La-doped CeO2 monolithic catalysts for lean-oxygen methane combustion, Environ. Sci. Pollut. Res., 25 (2018) 5643-5654. [35] L. Pino A. Vita M. Laganà V. Recupero Hydrogen from biogas: catalytic tri-reforming process with Ni/LaCeO mixed oxides Appl. Catal. B 148-149 2014 91 105 L. Pino, A. Vita, M. Laganà, V. Recupero, Hydrogen from biogas: Catalytic tri-reforming process with Ni/LaCeO mixed oxides, Appl. Catal. B, 148-149 (2014) 91-105. [36] M.F. Wilkes P. Hayden A.K. Bhattacharya Surface segregation of lanthanum and cerium ions in ceria/lanthana solid solutions: comparison between experimental results and a statistical–mechanical model Appl. Surf. Sci. 206 2003 12 19 M.F. Wilkes, P. Hayden, A.K. Bhattacharya, Surface segregation of lanthanum and cerium ions in ceria/lanthana solid solutions: comparison between experimental results and a statistical–mechanical model, Appl. Surf. Sci., 206 (2003) 12-19. [37] H. Hu Z. Tu X. Yan X. Chen L. Zhou Z.-H. Lu R. Ye G. Feng R. Zhang Effects of organic compounds on Ni/AlLaCe catalysts for ammonia decomposition to hydrogen Ind. Eng. Chem. Res. 63 2024 3910 3920 H. Hu, Z. Tu, X. Yan, X. Chen, L. Zhou, Z.-H. Lu, R. Ye, G. Feng, R. Zhang, Effects of Organic Compounds on Ni/AlLaCe Catalysts for Ammonia Decomposition to Hydrogen, Ind. Eng. Chem. Res., 63 (2024) 3910-3920. [38] D.B. Chung H.Y. Kim M. Jeon D.H. Lee H.S. Park S.H. Choi S.W. Nam S.C. Jang J.-H. Park K.-Y. Lee C.W. Yoon Enhanced ammonia dehydrogenation over Ru/La(x)-Al2O3 (x=0–50mol%): structural and electronic effects of la doping Int. J. Hydrog. Energy 42 2017 1639 1647 D.B. Chung, H.Y. Kim, M. Jeon, D.H. Lee, H.S. Park, S.H. Choi, S.W. Nam, S.C. Jang, J.-H. Park, K.-Y. Lee, C.W. Yoon, Enhanced ammonia dehydrogenation over Ru/La(x)-Al2O3 (x=0–50mol%): Structural and electronic effects of La doping, Int. J. Hydrogen Energy, 42 (2017) 1639-1647. [39] B. Nabgan T.A.T. Abdullah M. Tahir W. Nabgan S. Triwahyono A.A. Jalil Y. Gambo M. Ibrahim K. Moghadamian Pellet size dependent steam reforming of polyethylene terephthalate waste for hydrogen production over Ni/La promoted Al2O3 catalyst Int. J. Hydrog. Energy 42 2017 21571 21585 B. Nabgan, T.A.T. Abdullah, M. Tahir, W. Nabgan, S. Triwahyono, A.A. Jalil, Y. Gambo, M. Ibrahim, K. Moghadamian, Pellet size dependent steam reforming of polyethylene terephthalate waste for hydrogen production over Ni/La promoted Al2O3 catalyst, Int. J. Hydrogen Energy, 42 (2017) 21571-21585. [40] R. He D. Wang K. Zhi B. Wang H. Zhong H. Jiang N. Li Q. Liu Cu-Mn catalysts modified by rare earth lantnaum for low temperature water-gas shift reaction J. Rare Earths 34 2016 994 1003 R. He, D. Wang, K. Zhi, B. Wang, H. Zhong, H. Jiang, N. Li, Q. Liu, Cu-Mn catalysts modified by rare earth lantnaum for low temperature water-gas shift reaction, J. Rare Earths, 34 (2016) 994-1003. [41] Y. Lyu J. Jocz R. Xu E. Stavitski C. Sievers Nickel speciation and methane dry reforming performance of Ni/CexZr1–xO2 prepared by different synthesis methods ACS Catal. 10 2020 11235 11252 Y. Lyu, J. Jocz, R. Xu, E. Stavitski, C. Sievers, Nickel Speciation and Methane Dry Reforming Performance of Ni/CexZr1–xO2 Prepared by Different Synthesis Methods, ACS Catal., 10 (2020) 11235-11252. [42] X. Li D. Li H. Tian L. Zeng Z.-J. Zhao J. Gong Dry reforming of methane over Ni/La2O3 nanorod catalysts with stabilized ni nanoparticles Appl. Catal. B 202 2017 683 694 X. Li, D. Li, H. Tian, L. Zeng, Z.-J. Zhao, J. Gong, Dry reforming of methane over Ni/La2O3 nanorod catalysts with stabilized Ni nanoparticles, Appl. Catal., B, 202 (2017) 683-694. [43] B.M. Reddy L. Katta G. Thrimurthulu Novel nanocrystalline Ce1−xLaxO2−δ (x = 0.2) solid solutions: structural characteristics and catalytic performance Chem. Mater. 22 2010 467 475 B.M. Reddy, L. Katta, G. Thrimurthulu, Novel Nanocrystalline Ce1−xLaxO2−δ (x = 0.2) Solid Solutions: Structural Characteristics and Catalytic Performance, Chem. Mater., 22 (2010) 467-475. [44] H. Sun H. Wang Z. Qu Construction of CuO/CeO2 catalysts via the ceria shape effect for selective catalytic oxidation of ammonia ACS Catal. 13 2023 1077 1088 H. Sun, H. Wang, Z. Qu, Construction of CuO/CeO2 Catalysts via the Ceria Shape Effect for Selective Catalytic Oxidation of Ammonia, ACS Catal., 13 (2023) 1077-1088. [45] J.P.H. Li X. Zhou Y. Pang L. Zhu E.I. Vovk L. Cong A.P. van Bavel S. Li Y. Yang Understanding of binding energy calibration in XPS of lanthanum oxide by in situ treatment Phys. Chem. Chem. Phys. 21 2019 22351 22358 J.P.H. Li, X. Zhou, Y. Pang, L. Zhu, E.I. Vovk, L. Cong, A.P. van Bavel, S. Li, Y. Yang, Understanding of binding energy calibration in XPS of lanthanum oxide by in situ treatment, Phys. Chem. Chem. Phys., 21 (2019) 22351-22358. [46] X. Chen R. Li Y. Zhong H. Liu D. Hu C. Liang Insights on the hydrogenation of furfural and its derivatives to 1,5-Pentanediol over Ni/La-substituted CeO2 catalysts Chem. Eng. J. 499 2024 155854 X. Chen, R. Li, Y. Zhong, H. Liu, D. Hu, C. Liang, Insights on the hydrogenation of furfural and its derivatives to 1,5-Pentanediol over Ni/La-substituted CeO2 catalysts, Chem. Eng. J., 499 (2024) 155854. [47] L. Xu X. Wen M. Chen C. Lv Y. Cui X. Wu C.-e Wu B. Yang Z. Miao X. Hu Mesoporous Ce-Zr solid solutions supported Ni-based catalysts for low-temperature CO2 methanation by tuning the reaction intermediates Fuel 282 2020 118813 L. Xu, X. Wen, M. Chen, C. Lv, Y. Cui, X. Wu, C.-e Wu, B. Yang, Z. Miao, X. Hu, Mesoporous Ce-Zr solid solutions supported Ni-based catalysts for low-temperature CO2 methanation by tuning the reaction intermediates, Fuel, 282 (2020) 118813. [48] F. Hayashi Y. Toda Y. Kanie M. Kitano Y. Inoue T. Yokoyama M. Hara H. Hosono Ammonia decomposition by ruthenium nanoparticles loaded on inorganic electride C12A7:e− Chem. Sci. 4 2013 3124 3130 F. Hayashi, Y. Toda, Y. Kanie, M. Kitano, Y. Inoue, T. Yokoyama, M. Hara, H. Hosono, Ammonia decomposition by ruthenium nanoparticles loaded on inorganic electride C12A7:e−, Chem. Sci., 4 (2013) 3124-3130. [49] M. Lu Y. Sun P. Zhang J. Zhu M. Li Y. Shan J. Shen C. Song Hydrodeoxygenation of guaiacol catalyzed by High-Loading ni catalysts supported on SiO2–TiO2 binary oxides Ind. Eng. Chem. Res. 58 2019 1513 1524 M. Lu, Y. Sun, P. Zhang, J. Zhu, M. Li, Y. Shan, J. Shen, C. Song, Hydrodeoxygenation of Guaiacol Catalyzed by High-Loading Ni Catalysts Supported on SiO2–TiO2 Binary Oxides, Ind. Eng. Chem. Res., 58 (2019) 1513-1524. [50] X.-C. Hu W.-W. Wang Z. Jin X. Wang R. Si C.-J. Jia Transition metal nanoparticles supported La-promoted MgO as catalysts for hydrogen production via catalytic decomposition of ammonia J. Energy Chem. 38 2019 41 49 X.-C. Hu, W.-W. Wang, Z. Jin, X. Wang, R. Si, C.-J. Jia, Transition metal nanoparticles supported La-promoted MgO as catalysts for hydrogen production via catalytic decomposition of ammonia, J. Energy Chem., 38 (2019) 41-49. [51] Y. Im H. Muroyama T. Matsui K. Eguchi Investigation on catalytic performance and desorption behaviors of ruthenium catalysts supported on rare-earth oxides for NH3 decomposition Int. J. Hydrog. Energy 47 2022 32543 32551 Y. Im, H. Muroyama, T. Matsui, K. Eguchi, Investigation on catalytic performance and desorption behaviors of ruthenium catalysts supported on rare-earth oxides for NH3 decomposition, Int. J. Hydrogen Energy, 47 (2022) 32543-32551. [52] H. Ren J. Cheng H. Fang F. Zhong C. Chen L. Lin Y. Luo C. Au L. Jiang X. Lin Phyllosilicate-derived ni catalysts with small nanoparticle size and strong metal-support interaction for efficient and robust decomposition of ammonia Appl. Catal. A 664 2023 119344 H. Ren, J. Cheng, H. Fang, F. Zhong, C. Chen, L. Lin, Y. Luo, C. Au, L. Jiang, X. Lin, Phyllosilicate-derived Ni catalysts with small nanoparticle size and strong metal-support interaction for efficient and robust decomposition of ammonia, Appl. Catal. A, 664 (2023) 119344. [53] B. Bahrami V.G. Komvokis U.G. Singh M.S. Ziebarth O.S. Alexeev M.D. Amiridis In situ FTIR characterization of NH3 adsorption and reaction with O2 and CO on Pd-based FCC emission control additives Appl. Catal. A 391 2011 11 21 B. Bahrami, V.G. Komvokis, U.G. Singh, M.S. Ziebarth, O.S. Alexeev, M.D. Amiridis, In situ FTIR characterization of NH3 adsorption and reaction with O2 and CO on Pd-based FCC emission control additives, Appl. Catal. A, 391 (2011) 11-21. [54] L. Zhang H. He Mechanism of selective catalytic oxidation of ammonia to nitrogen over Ag/Al2O3 J. Catal. 268 2009 18 25 L. Zhang, H. He, Mechanism of selective catalytic oxidation of ammonia to nitrogen over Ag/Al2O3, J. Catal., 268 (2009) 18-25. [55] W. Yan B. Liang G. Bi H. Zhuo W. Wang H. Duan G. Xu F. Wang Y. Su T. Zhang X. Yang Y. Huang Interfacial regulation of Ru-based catalysts for the enhanced activity of ammonia decomposition ACS Sustain. Chem. Eng. 12 2024 15024 15032 W. Yan, B. Liang, G. Bi, H. Zhuo, W. Wang, H. Duan, G. Xu, F. Wang, Y. Su, T. Zhang, X. Yang, Y. Huang, Interfacial Regulation of Ru-Based Catalysts for the Enhanced Activity of Ammonia Decomposition, ACS Sustainable Chem. Eng., 12 (2024) 15024-15032. [56] C.-F. Cao K. Wu C. Zhou Y.-H. Yao Y. Luo C.-Q. Chen L. Lin L. Jiang Electronic metal-support interaction enhanced ammonia decomposition efficiency of perovskite oxide supported ruthenium Chem. Eng. Sci. 257 2022 117719 C.-F. Cao, K. Wu, C. Zhou, Y.-H. Yao, Y. Luo, C.-Q. Chen, L. Lin, L. Jiang, Electronic metal-support interaction enhanced ammonia decomposition efficiency of perovskite oxide supported ruthenium, Chem. Eng. Sci., 257 (2022) 117719. [57] Y. Sun W. Zeng Y. Yang Q. Wu C. Zou Intermetallic synergy in trimetallic alloy for highly-efficient hydrogen production from ammonia decomposition Chem. Eng. J. 502 2024 158043 Y. Sun, W. Zeng, Y. Yang, Q. Wu, C. Zou, Intermetallic synergy in trimetallic alloy for highly-efficient hydrogen production from ammonia decomposition, Chem. Eng. J., 502 (2024) 158043. [58] Y. Yan W. Zhu J. Wang Y. Li C. Zhao C. Liang MgAl-LDH derived oxides supported ni catalysts: tuning acidity-basicity for enhanced ammonia decomposition Int. J. Hydrog. Energy 164 2025 150855 Y. Yan, W. Zhu, J. Wang, Y. Li, C. Zhao, C. Liang, MgAl-LDH derived oxides supported Ni catalysts: Tuning acidity-basicity for enhanced ammonia decomposition, Int. J. Hydrogen Energy, 164 (2025) 150855.",
      "coredata": {
        "eid": "1-s2.0-S0926860X25004806",
        "dc:description": "As a carbon-free hydrogen carrier, ammonia requires efficient decomposition catalysts to enable its practical use in hydrogen energy applications. In this study, a series of Ce1-yLayOx oxides with varying La/Ce molar ratios were synthesized via a citric acid method and utilized as supports for Ni-based NH3 decomposition catalysts. The La/Ce molar ratio significantly influenced the catalytic performance, with Ni/Ce0.5La0.5Ox exhibiting the highest catalytic activity, achieving nearly 100 % ammonia conversion at 540 ℃ (GHSV= 9000 mL gcat −1 h−1) and 600 ℃ (GHSV = 30000 mL gcat −1 h−1). Various characterizations demonstrated that optimal La/Ce ratio promoted uniform dispersion of Ni nanoparticles (4.6 nm), maximizing available active sites for NH3 adsorption. Moreover, the Ce0.5La0.5Ox support enriched the catalyst surface with high Ce3+ species and oxygen vacancies, facilitating electron transfer to Ni species. These electron-enriched Ni species significantly enhanced the cleavage of Ni-N bonds and facilitated the recombination of N adatoms, thereby boosting the overall reaction rate. This work provided fundamental insights into the critical role of metal-support electron transfer in optimizing catalytic performance for efficient ammonia decomposition, offering valuable guidance for the design of advanced hydrogen production catalysts.",
        "openArchiveArticle": "false",
        "prism:coverDate": "2025-12-25",
        "openaccessUserLicense": null,
        "prism:aggregationType": "Journal",
        "prism:url": "https://api.elsevier.com/content/article/pii/S0926860X25004806",
        "dc:creator": [
          {
            "@_fa": "true",
            "$": "Wang, Jiayue"
          },
          {
            "@_fa": "true",
            "$": "Zhu, Wenjun"
          },
          {
            "@_fa": "true",
            "$": "Yan, Yudi"
          },
          {
            "@_fa": "true",
            "$": "Li, Yao"
          },
          {
            "@_fa": "true",
            "$": "Zhao, Chenxi"
          },
          {
            "@_fa": "true",
            "$": "Liang, Changhai"
          }
        ],
        "link": [
          {
            "@_fa": "true",
            "@rel": "self",
            "@href": "https://api.elsevier.com/content/article/pii/S0926860X25004806"
          },
          {
            "@_fa": "true",
            "@rel": "scidir",
            "@href": "https://www.sciencedirect.com/science/article/pii/S0926860X25004806"
          }
        ],
        "dc:format": "application/json",
        "openaccessType": null,
        "pii": "S0926-860X(25)00480-6",
        "prism:volume": "708",
        "articleNumber": "120578",
        "prism:publisher": "Elsevier B.V. All rights are reserved, including those for text and data mining, AI training, and similar technologies.",
        "dc:title": "The critical role of La/Ce composition in Ni/Ce1-yLayOx catalysts: Optimizing oxygen vacancies and metal-support interactions for ammonia decomposition",
        "prism:copyright": "© 2025 Elsevier B.V. All rights are reserved, including those for text and data mining, AI training, and similar technologies.",
        "openaccess": "0",
        "prism:issn": "0926860X",
        "dcterms:subject": [
          {
            "@_fa": "true",
            "$": "Ammonia decomposition"
          },
          {
            "@_fa": "true",
            "$": "Ce1-yLayOx"
          },
          {
            "@_fa": "true",
            "$": "Ni-based catalyst"
          },
          {
            "@_fa": "true",
            "$": "Reaction mechanism"
          }
        ],
        "openaccessArticle": "false",
        "prism:publicationName": "Applied Catalysis A: General",
        "openaccessSponsorType": null,
        "prism:pageRange": "120578",
        "pubType": "fla",
        "prism:coverDisplayDate": "25 December 2025",
        "prism:doi": "10.1016/j.apcata.2025.120578",
        "prism:startingPage": "120578",
        "dc:identifier": "doi:10.1016/j.apcata.2025.120578",
        "openaccessSponsorName": null
      },
      "objects": {
        "object": [
          {
            "@category": "standard",
            "@height": "405",
            "@width": "565",
            "@_fa": "true",
            "$": "https://api.elsevier.com/content/object/eid/1-s2.0-S0926860X25004806-gr1.jpg?httpAccept=%2A%2F%2A",
            "@multimediatype": "JPEG image file",
            "@type": "IMAGE-DOWNSAMPLED",
            "@size": "79016",
            "@ref": "gr1",
            "@mimetype": "image/jpeg"
          },
          {
            "@category": "thumbnail",
            "@height": "157",
            "@width": "219",
            "@_fa": "true",
            "$": "https://api.elsevier.com/content/object/eid/1-s2.0-S0926860X25004806-gr1.sml?httpAccept=%2A%2F%2A",
            "@multimediatype": "GIF image file",
            "@type": "IMAGE-THUMBNAIL",
            "@size": "14619",
            "@ref": "gr1",
            "@mimetype": "image/gif"
          },
          {
            "@category": "standard",
            "@height": "587",
            "@width": "659",
            "@_fa": "true",
            "$": "https://api.elsevier.com/content/object/eid/1-s2.0-S0926860X25004806-gr2.jpg?httpAccept=%2A%2F%2A",
            "@multimediatype": "JPEG image file",
            "@type": "IMAGE-DOWNSAMPLED",
            "@size": "177894",
            "@ref": "gr2",
            "@mimetype": "image/jpeg"
          },
          {
            "@category": "thumbnail",
            "@height": "164",
            "@width": "184",
            "@_fa": "true",
            "$": "https://api.elsevier.com/content/object/eid/1-s2.0-S0926860X25004806-gr2.sml?httpAccept=%2A%2F%2A",
            "@multimediatype": "GIF image file",
            "@type": "IMAGE-THUMBNAIL",
            "@size": "21932",
            "@ref": "gr2",
            "@mimetype": "image/gif"
          },
          {
            "@category": "standard",
            "@height": "244",
            "@width": "280",
            "@_fa": "true",
            "$": "https://api.elsevier.com/content/object/eid/1-s2.0-S0926860X25004806-ga1.jpg?httpAccept=%2A%2F%2A",
            "@multimediatype": "JPEG image file",
            "@type": "IMAGE-DOWNSAMPLED",
            "@size": "23733",
            "@ref": "ga1",
            "@mimetype": "image/jpeg"
          },
          {
            "@category": "thumbnail",
            "@height": "164",
            "@width": "188",
            "@_fa": "true",
            "$": "https://api.elsevier.com/content/object/eid/1-s2.0-S0926860X25004806-ga1.sml?httpAccept=%2A%2F%2A",
            "@multimediatype": "GIF image file",
            "@type": "IMAGE-THUMBNAIL",
            "@size": "20077",
            "@ref": "ga1",
            "@mimetype": "image/gif"
          },
          {
            "@category": "standard",
            "@height": "494",
            "@width": "791",
            "@_fa": "true",
            "$": "https://api.elsevier.com/content/object/eid/1-s2.0-S0926860X25004806-gr3.jpg?httpAccept=%2A%2F%2A",
            "@multimediatype": "JPEG image file",
            "@type": "IMAGE-DOWNSAMPLED",
            "@size": "129754",
            "@ref": "gr3",
            "@mimetype": "image/jpeg"
          },
          {
            "@category": "thumbnail",
            "@height": "137",
            "@width": "219",
            "@_fa": "true",
            "$": "https://api.elsevier.com/content/object/eid/1-s2.0-S0926860X25004806-gr3.sml?httpAccept=%2A%2F%2A",
            "@multimediatype": "GIF image file",
            "@type": "IMAGE-THUMBNAIL",
            "@size": "16019",
            "@ref": "gr3",
            "@mimetype": "image/gif"
          },
          {
            "@category": "standard",
            "@height": "436",
            "@width": "791",
            "@_fa": "true",
            "$": "https://api.elsevier.com/content/object/eid/1-s2.0-S0926860X25004806-gr4.jpg?httpAccept=%2A%2F%2A",
            "@multimediatype": "JPEG image file",
            "@type": "IMAGE-DOWNSAMPLED",
            "@size": "101567",
            "@ref": "gr4",
            "@mimetype": "image/jpeg"
          },
          {
            "@category": "thumbnail",
            "@height": "121",
            "@width": "219",
            "@_fa": "true",
            "$": "https://api.elsevier.com/content/object/eid/1-s2.0-S0926860X25004806-gr4.sml?httpAccept=%2A%2F%2A",
            "@multimediatype": "GIF image file",
            "@type": "IMAGE-THUMBNAIL",
            "@size": "10693",
            "@ref": "gr4",
            "@mimetype": "image/gif"
          },
          {
            "@category": "standard",
            "@height": "226",
            "@width": "565",
            "@_fa": "true",
            "$": "https://api.elsevier.com/content/object/eid/1-s2.0-S0926860X25004806-gr5.jpg?httpAccept=%2A%2F%2A",
            "@multimediatype": "JPEG image file",
            "@type": "IMAGE-DOWNSAMPLED",
            "@size": "43596",
            "@ref": "gr5",
            "@mimetype": "image/jpeg"
          },
          {
            "@category": "thumbnail",
            "@height": "88",
            "@width": "219",
            "@_fa": "true",
            "$": "https://api.elsevier.com/content/object/eid/1-s2.0-S0926860X25004806-gr5.sml?httpAccept=%2A%2F%2A",
            "@multimediatype": "GIF image file",
            "@type": "IMAGE-THUMBNAIL",
            "@size": "7887",
            "@ref": "gr5",
            "@mimetype": "image/gif"
          },
          {
            "@category": "standard",
            "@height": "426",
            "@width": "791",
            "@_fa": "true",
            "$": "https://api.elsevier.com/content/object/eid/1-s2.0-S0926860X25004806-gr6.jpg?httpAccept=%2A%2F%2A",
            "@multimediatype": "JPEG image file",
            "@type": "IMAGE-DOWNSAMPLED",
            "@size": "128290",
            "@ref": "gr6",
            "@mimetype": "image/jpeg"
          },
          {
            "@category": "thumbnail",
            "@height": "118",
            "@width": "219",
            "@_fa": "true",
            "$": "https://api.elsevier.com/content/object/eid/1-s2.0-S0926860X25004806-gr6.sml?httpAccept=%2A%2F%2A",
            "@multimediatype": "GIF image file",
            "@type": "IMAGE-THUMBNAIL",
            "@size": "15044",
            "@ref": "gr6",
            "@mimetype": "image/gif"
          },
          {
            "@category": "high",
            "@height": "1789",
            "@width": "2495",
            "@_fa": "true",
            "$": "https://api.elsevier.com/content/object/eid/1-s2.0-S0926860X25004806-gr1_lrg.jpg?httpAccept=%2A%2F%2A",
            "@multimediatype": "JPEG image file",
            "@type": "IMAGE-HIGH-RES",
            "@size": "463111",
            "@ref": "gr1",
            "@mimetype": "image/jpeg"
          },
          {
            "@category": "high",
            "@height": "2595",
            "@width": "2911",
            "@_fa": "true",
            "$": "https://api.elsevier.com/content/object/eid/1-s2.0-S0926860X25004806-gr2_lrg.jpg?httpAccept=%2A%2F%2A",
            "@multimediatype": "JPEG image file",
            "@type": "IMAGE-HIGH-RES",
            "@size": "1484715",
            "@ref": "gr2",
            "@mimetype": "image/jpeg"
          },
          {
            "@category": "high",
            "@height": "1085",
            "@width": "1243",
            "@_fa": "true",
            "$": "https://api.elsevier.com/content/object/eid/1-s2.0-S0926860X25004806-ga1_lrg.jpg?httpAccept=%2A%2F%2A",
            "@multimediatype": "JPEG image file",
            "@type": "IMAGE-HIGH-RES",
            "@size": "192646",
            "@ref": "ga1",
            "@mimetype": "image/jpeg"
          },
          {
            "@category": "high",
            "@height": "2182",
            "@width": "3493",
            "@_fa": "true",
            "$": "https://api.elsevier.com/content/object/eid/1-s2.0-S0926860X25004806-gr3_lrg.jpg?httpAccept=%2A%2F%2A",
            "@multimediatype": "JPEG image file",
            "@type": "IMAGE-HIGH-RES",
            "@size": "796583",
            "@ref": "gr3",
            "@mimetype": "image/jpeg"
          },
          {
            "@category": "high",
            "@height": "1926",
            "@width": "3493",
            "@_fa": "true",
            "$": "https://api.elsevier.com/content/object/eid/1-s2.0-S0926860X25004806-gr4_lrg.jpg?httpAccept=%2A%2F%2A",
            "@multimediatype": "JPEG image file",
            "@type": "IMAGE-HIGH-RES",
            "@size": "585771",
            "@ref": "gr4",
            "@mimetype": "image/jpeg"
          },
          {
            "@category": "high",
            "@height": "997",
            "@width": "2495",
            "@_fa": "true",
            "$": "https://api.elsevier.com/content/object/eid/1-s2.0-S0926860X25004806-gr5_lrg.jpg?httpAccept=%2A%2F%2A",
            "@multimediatype": "JPEG image file",
            "@type": "IMAGE-HIGH-RES",
            "@size": "258819",
            "@ref": "gr5",
            "@mimetype": "image/jpeg"
          },
          {
            "@category": "high",
            "@height": "1880",
            "@width": "3493",
            "@_fa": "true",
            "$": "https://api.elsevier.com/content/object/eid/1-s2.0-S0926860X25004806-gr6_lrg.jpg?httpAccept=%2A%2F%2A",
            "@multimediatype": "JPEG image file",
            "@type": "IMAGE-HIGH-RES",
            "@size": "776702",
            "@ref": "gr6",
            "@mimetype": "image/jpeg"
          },
          {
            "@category": "standard",
            "@_fa": "true",
            "$": "https://api.elsevier.com/content/object/eid/1-s2.0-S0926860X25004806-mmc1.docx?httpAccept=%2A%2F%2A",
            "@multimediatype": "Microsoft Word file",
            "@type": "APPLICATION",
            "@size": "277341",
            "@ref": "mmc1",
            "@mimetype": "application/word"
          }
        ]
      }
    }
  }
}