{
  "metadata": {
    "title": "CO<ce:inf loc=post>2</ce:inf> methanation over Ru- and Ni/Al<ce:inf loc=post>2</ce:inf>O<ce:inf loc=post>3</ce:inf> catalysts: Effect of preparation solvent on performance and surface chemistry",
    "authors": "; ; ",
    "journal": "Applied Catalysis A: General",
    "date": "2026-01-05",
    "doi": "10.1016/j.apcata.2025.120625",
    "abstract": "",
    "uri": "https://api.elsevier.com/content/article/pii/S0926860X25005277",
    "pii": "S0926860X25005277"
  },
  "fulltext": {
    "full-text-retrieval-response": {
      "originalText": "serial JL 271346 291210 291744 291809 31 90 Applied Catalysis A: General APPLIEDCATALYSISAGENERAL 2025-10-06 2025-10-06 2025-10-11 2025-10-11 2025-10-11T01:25:15 1-s2.0-S0926860X25005277 S0926-860X(25)00527-7 S0926860X25005277 10.1016/j.apcata.2025.120625 S250 S250.1 FULL-TEXT 1-s2.0-S0926860X25X0017X 2025-10-11T02:19:16.006586Z 0 0 20260105 2026 2025-10-07T00:16:45.751594Z absattachment articleinfo articlenumber articletitlenorm authfirstinitialnorm authfirstsurnamenorm cid cids contenttype copyright crossmark dateloaded dateloadedtxt datesearch datesort dateupdated dco docsubtype doctype doi eid ewtransactionid fundingbodyid hubeid indexeddate issn issnnorm itemstage itemtransactionid itemweight oauserlicense openaccess openarchive pg pgfirst pii piinorm pubdatestart pubdatetxt pubyr sortorder sponsoredaccesstype srctitle srctitlenorm srctype ssids alllist content oa subj subheadings suppl tomb volfirst volissue volumelist webpdf webpdfpagecount yearnav figure table e-component body mmlmath acknowledge affil appendices articletitle auth authfirstini authfull authkeywords authlast footnotes grantnumber grantsponsor highlightsabst orcid primabst ref specialabst 0926-860X 0926860X UNLIMITED CRUI2023 false 709 709 C Volume 709 12 120625 120625 120625 20260105 5 January 2026 2026-01-05 2026 article fla © 2025 The Authors. Published by Elsevier B.V. CO2METHANATIONOVERRUNIAL2O3CATALYSTSEFFECTPREPARATIONSOLVENTPERFORMANCESURFACECHEMISTRY ATAKOOHI S 1 Introduction 2 Experimental 2.1 Catalyst preparation 2.2 Catalytic experiments 2.3 Material characterizations 3 Results and discussion 3.1 Ni-based catalysts 3.1.1 Characterization of fresh catalysts 3.1.2 Catalytic activity in CO2 hydrogenation 3.1.3 Characterization of exhaust catalysts 3.2 Ru-based catalysts 3.2.1 In-situ reduction 3.2.2 Catalytic activity in CO2 hydrogenation 3.2.3 Catalytic activity in operando conditions 3.2.4 Characterization of spent catalysts 4 Conclusion CRediT authorship contribution statement Acknowledgements Appendix A Supplementary material References GOTZ 2016 1371 1390 M GLENK 2023 6058 6070 G FERRARI 2021 109 138 J ELECTRICUTILITYRESOURCEPLANNING RENEWABLEFUELSFORLONGTERMENERGYSTORAGE CENTI 2013 1711 G ULLAH 2023 1335 1383 S SIEBORG 2024 118090 M CORMOS 2024 133507 C BOLT 2020 103670 A LEE 2024 102791 K SPENNATI 2023 E BELLOTTI 2015 2433 2444 D GAO 2012 2358 2368 J GIGLIO 2021 1040 1051 E GARBARINO 2016 21 28 G PORTA 2020 38 47 A FALBO 2018 354 363 L DUYAR 2015 27 33 M GARBARINO 2021 6554 6564 G KOSCHANY 2016 504 516 F RIDZUAN 2022 469 N HIGHTEMPERATUREMETHANATION 2013 233 238 VAHALA 1971 60 68 J CHEIN 2020 1 17 R FASOLINI 2023 114271 A BUSCA 2023 5304 G RIANI 2023 24976 24995 P XU 1989 88 96 J MARTINS 2019 1008 J GARBARINO 2015 9171 9182 G GALLANDAT 2018 1101 1110 N MOIOLI 2020 1396 1408 E GARBARINO 2014 11557 11565 G VRIJBURG 2020 358 371 W GARBARINO 2019 286 297 G RIANI 2021 P QUINDIMIL 2020 419 432 A FALBO 2019 117791 L PORTA 2023 7280 7290 A JEONGPOTTER 2022 C PORTA 2021 6706 6718 A PORTA 2021 A PORTA 2024 A CHE 1989 55 172 M SIETSMA 2006 J APPLICATIONORDEREDMESOPOROUSMATERIALSMODELSUPPORTSSTUDYCATALYSTPREPARATIONBYIMPREGNATIONDRYING HONGMANOROM 2021 119564 P BACARIZA 2020 14656 14666 M YU 2018 15191 15204 Y YAN 2018 504 512 Y YU 2018 1514 1527 Y ORTEGADOMINGUEZ 2017 110 122 R ZHANG 2017 33 40 C ASHOK 2017 304 311 J TAO 2016 289 297 M ZHEN 2015 1728 1731 W FAN 2015 655 659 Z OCAMPO 2011 F TAO 2016 35875 35883 M QUINDIMIL 2021 120322 A SONG 2021 178 185 Y MATEUS 2023 8552 8562 F HUANG 2022 122666 S CHEN 2020 3042 3050 Y YUSUF 2023 1225 1237 M TRUSZKIEWICZ 2020 31985 31999 E MUNNIK 2015 6687 6718 P DING 2016 1 12 C OLIVARES 2018 61 73 A BENTALEB 2014 250 255 F UEMURA 1987 53 58 Y QIU 2013 73 78 S LIU 2007 4473 4487 X MUNNIK 2015 6687 6718 P MARTINELLI 2018 153 166 M KATO 2016 123 129 T ROHDE 1959 68 70 K TOJO 2007 61 78 G CHIN 2005 157 166 S KOOPMAN 1981 172 179 P WELLENBUSCHER 1994 61 74 J ATAKOOHI 2024 S LEVENSPIEL 1999 O CHEMICALREACTIONENGINEERING3RDED THOMAS 2017 176 184 S BUSCA 2014 2 13 G GILCALVO 2017 128 138 M ROGERS 2016 5873 5886 J GARBARINO 2016 180 189 G BUSCA 1992 595 605 G VOGT 2018 127 134 C SIMONS 2023 20289 20301 J SPANO 2025 8194 8203 G LI 2023 121982 C MACFARLANE 2020 1186 1205 D BROWN 2014 545 552 D AIKA 1985 305 311 K LIN 2019 1635 1644 B DING 2025 129275 L TAYLOR 1973 478 484 K PETROVIC 2015 7811 7815 Z APOSTOLESCU 2004 43 50 N MEHTA 2019 1115 1133 P BOWMAN 1983 179 187 C WILKINSON 2013 249 260 S VANHERWIJNEN 1973 391 402 T GARBARINO 2020 2792 G WANG 2016 185 195 X TRAA 1999 291 293 Y MONTANARI 2011 61 69 T SANCHEZESCRIBANO 2007 68 74 V GUIDOBUSCA 2014 319 404 THEODORE 1979 575 588 E PFNUR 1980 431 452 H ZUBKOV 2003 57 71 T CORNEJOROMERO 2025 120416 J KUZNETSOV 1980 374 389 V GUGLIELMINOTTI 2000 149 157 E HADJIIVANOV 1998 415 425 K YUBEROVALDIVIELSO 2023 9929 9939 D RAMIS 1991 425 435 G LAVALLEY 1982 289 298 J WANG 2016 185 195 X GONZALEZRANGULAN 2023 V TRUSZKIEWICZ 2017 1299 1305 E FERNANDEZ 2014 194 202 C CHEN 2024 159460 M WANG 2016 185 195 X KUSMIERZ 2008 429 432 M SOLYMOSI 1981 1003 1012 F DUYAR 2015 27 33 M LUNDE 1974 27 33 P OHYA 1997 237 247 H ATAKOOHIX2026X120625 ATAKOOHIX2026X120625XS Full 2025-10-07T15:26:03Z ElsevierBranded CRUI: Hybrid journals 2023 http://creativecommons.org/licenses/by-nc-nd/4.0/ 2026-10-11T00:00:00.000Z 2026-10-11T00:00:00.000Z http://creativecommons.org/licenses/by-nc-nd/4.0/ This is an open access article under the CC BY-NC-ND license. © 2025 The Authors. Published by Elsevier B.V. 2025-10-07T15:08:57.088Z http://vtw.elsevier.com/data/voc/AddOnTypes/50.7/aggregated-refined Department of Civil, Chemical and Environmental Engineering Laboratoire Catalyse et Spectrochimie University of Genova Université de Caen Normandie CNRS Ministero dell’Università e della Ricerca MUR Ministero dell'Università e della Ricerca http://data.elsevier.com/vocabulary/SciValFunders/501100021856 http://sws.geonames.org/3175395/ DICCA PE0000021 Ministry of Education University and Research http://data.elsevier.com/vocabulary/SciValFunders/501100024370 http://sws.geonames.org/3175395 European Union PE0000021 EU European Commission http://data.elsevier.com/vocabulary/SciValFunders/501100000780 http://sws.geonames.org/6695072/ ES acknowledges the University of Genova for the mobility grant under the DR. 1148 signed on 22/03/19 to carry out the research period at Universit\\u00E9 de Caen Normandie, ENSICAEN, CNRS, Laboratoire Catalyse et Spectrochimie (LCS). GG and ES acknowledge the Project funded under the National Recovery and Resilience Plan (NRRP), Mission 4 Component 2 Investment 1.3 - Call for tender No. 1561 of 11. 10. 2022 of Ministero dell\\u2019Universit\\u00E0 e della Ricerca (MUR); funded by the European Union \\u2013 NextGenerationEU, PE0000021, \\u201CNetwork 4 Energy Sustainable Transition \\u2013 NEST\\u201D. SEA acknowledges the University of Genova and the Department of Civil, Chemical and Environmental Engineering (DICCA) for the funding to carry out the research period at Universit\\u00E9 de Caen Normandie, ENSICAEN, CNRS, Laboratoire Catalyse et Spectrochimie (LCS). item S0926-860X(25)00527-7 S0926860X25005277 1-s2.0-S0926860X25005277 10.1016/j.apcata.2025.120625 271346 2025-10-11T02:18:24.76413Z 2026-01-05 UNLIMITED CRUI2023 1-s2.0-S0926860X25005277-main.pdf https://s3-eu-west-1.amazonaws.com/prod-ucs-content-store-eu-west/content/pii:S0926860X25005277/MAIN/application/pdf/1c1799026b7eeac521a7d9563cfafabd/main.pdf main.pdf pdf true 10170862 MAIN 18 1-s2.0-S0926860X25005277-main_1.png https://s3-eu-west-1.amazonaws.com/prod-ucs-content-store-eu-west/content/pii:S0926860X25005277/PREVIEW/image/png/423dd481463127bb1134fbcf264844b8/main_1.png main_1.png png 53871 928 656 IMAGE-WEB-PDF 1 1-s2.0-S0926860X25005277-gr4.jpg https://s3-eu-west-1.amazonaws.com/prod-ucs-content-store-eu-west/content/pii:S0926860X25005277/gr4/DOWNSAMPLED/image/jpeg/e4ff86664309f6b2e7da042488bfe6b6/gr4.jpg gr4 gr4.jpg jpg 49599 446 603 IMAGE-DOWNSAMPLED 1-s2.0-S0926860X25005277-gr4.sml https://s3-eu-west-1.amazonaws.com/prod-ucs-content-store-eu-west/content/pii:S0926860X25005277/gr4/THUMBNAIL/image/gif/5d96ae25fa720781deef56c20afaf541/gr4.sml gr4 gr4.sml sml 8514 162 219 IMAGE-THUMBNAIL 1-s2.0-S0926860X25005277-gr3.jpg https://s3-eu-west-1.amazonaws.com/prod-ucs-content-store-eu-west/content/pii:S0926860X25005277/gr3/DOWNSAMPLED/image/jpeg/3bc49369623961434e620ef70a43468e/gr3.jpg gr3 gr3.jpg jpg 65202 705 565 IMAGE-DOWNSAMPLED 1-s2.0-S0926860X25005277-gr3.sml https://s3-eu-west-1.amazonaws.com/prod-ucs-content-store-eu-west/content/pii:S0926860X25005277/gr3/THUMBNAIL/image/gif/cc86127b1284171d58a4c00cd3374aac/gr3.sml gr3 gr3.sml sml 5513 164 131 IMAGE-THUMBNAIL 1-s2.0-S0926860X25005277-gr6.jpg https://s3-eu-west-1.amazonaws.com/prod-ucs-content-store-eu-west/content/pii:S0926860X25005277/gr6/DOWNSAMPLED/image/jpeg/7b48edcc36ef4977ee7dc8455d9d83e9/gr6.jpg gr6 gr6.jpg jpg 81646 726 602 IMAGE-DOWNSAMPLED 1-s2.0-S0926860X25005277-gr6.sml https://s3-eu-west-1.amazonaws.com/prod-ucs-content-store-eu-west/content/pii:S0926860X25005277/gr6/THUMBNAIL/image/gif/759bba623a7863bb4bbbed2bb0c2d4cf/gr6.sml gr6 gr6.sml sml 7038 164 136 IMAGE-THUMBNAIL 1-s2.0-S0926860X25005277-gr5.jpg https://s3-eu-west-1.amazonaws.com/prod-ucs-content-store-eu-west/content/pii:S0926860X25005277/gr5/DOWNSAMPLED/image/jpeg/65c4fb750f2c41f8b974f404fbe32898/gr5.jpg gr5 gr5.jpg jpg 63987 734 376 IMAGE-DOWNSAMPLED 1-s2.0-S0926860X25005277-gr5.sml https://s3-eu-west-1.amazonaws.com/prod-ucs-content-store-eu-west/content/pii:S0926860X25005277/gr5/THUMBNAIL/image/gif/0cc0f4d16733cca1d6e5addf4424ccd2/gr5.sml gr5 gr5.sml sml 4522 164 84 IMAGE-THUMBNAIL 1-s2.0-S0926860X25005277-gr2.jpg https://s3-eu-west-1.amazonaws.com/prod-ucs-content-store-eu-west/content/pii:S0926860X25005277/gr2/DOWNSAMPLED/image/jpeg/98efd8ec35e73e1f68b45dec1f717669/gr2.jpg gr2 gr2.jpg jpg 61786 254 791 IMAGE-DOWNSAMPLED 1-s2.0-S0926860X25005277-gr2.sml https://s3-eu-west-1.amazonaws.com/prod-ucs-content-store-eu-west/content/pii:S0926860X25005277/gr2/THUMBNAIL/image/gif/4e79ccb5842484368b610b799f7fa0f7/gr2.sml gr2 gr2.sml sml 11092 70 219 IMAGE-THUMBNAIL 1-s2.0-S0926860X25005277-gr1.jpg https://s3-eu-west-1.amazonaws.com/prod-ucs-content-store-eu-west/content/pii:S0926860X25005277/gr1/DOWNSAMPLED/image/jpeg/0f7adb07af2d01e7fd1149992ff335fb/gr1.jpg gr1 gr1.jpg jpg 30397 420 376 IMAGE-DOWNSAMPLED 1-s2.0-S0926860X25005277-gr1.sml https://s3-eu-west-1.amazonaws.com/prod-ucs-content-store-eu-west/content/pii:S0926860X25005277/gr1/THUMBNAIL/image/gif/6cad2db1d52db85b7728b567e7d1558a/gr1.sml gr1 gr1.sml sml 5461 164 147 IMAGE-THUMBNAIL 1-s2.0-S0926860X25005277-gr11.jpg https://s3-eu-west-1.amazonaws.com/prod-ucs-content-store-eu-west/content/pii:S0926860X25005277/gr11/DOWNSAMPLED/image/jpeg/89ba5e823a434440e9341e07500c5be9/gr11.jpg gr11 gr11.jpg jpg 85997 628 600 IMAGE-DOWNSAMPLED 1-s2.0-S0926860X25005277-gr11.sml https://s3-eu-west-1.amazonaws.com/prod-ucs-content-store-eu-west/content/pii:S0926860X25005277/gr11/THUMBNAIL/image/gif/b57d99d538354db2d57eecf8e4582a09/gr11.sml gr11 gr11.sml sml 11025 163 156 IMAGE-THUMBNAIL 1-s2.0-S0926860X25005277-gr10.jpg https://s3-eu-west-1.amazonaws.com/prod-ucs-content-store-eu-west/content/pii:S0926860X25005277/gr10/DOWNSAMPLED/image/jpeg/810cff311181a712bc72893b81bb5ab3/gr10.jpg gr10 gr10.jpg jpg 22537 216 376 IMAGE-DOWNSAMPLED 1-s2.0-S0926860X25005277-gr10.sml https://s3-eu-west-1.amazonaws.com/prod-ucs-content-store-eu-west/content/pii:S0926860X25005277/gr10/THUMBNAIL/image/gif/2291bcc6a8b51a7b90e3d2f27530d8aa/gr10.sml gr10 gr10.sml sml 8057 126 219 IMAGE-THUMBNAIL 1-s2.0-S0926860X25005277-gr8.jpg https://s3-eu-west-1.amazonaws.com/prod-ucs-content-store-eu-west/content/pii:S0926860X25005277/gr8/DOWNSAMPLED/image/jpeg/e7503cdb413d60cc85f259fbe51a0534/gr8.jpg gr8 gr8.jpg jpg 46085 333 791 IMAGE-DOWNSAMPLED 1-s2.0-S0926860X25005277-gr8.sml https://s3-eu-west-1.amazonaws.com/prod-ucs-content-store-eu-west/content/pii:S0926860X25005277/gr8/THUMBNAIL/image/gif/4e01c8eb4d7094a08f9c058eb7fdefbe/gr8.sml gr8 gr8.sml sml 6485 92 219 IMAGE-THUMBNAIL 1-s2.0-S0926860X25005277-gr7.jpg https://s3-eu-west-1.amazonaws.com/prod-ucs-content-store-eu-west/content/pii:S0926860X25005277/gr7/DOWNSAMPLED/image/jpeg/241dffdd40056cc681afc11d0aa1e770/gr7.jpg gr7 gr7.jpg jpg 64679 357 791 IMAGE-DOWNSAMPLED 1-s2.0-S0926860X25005277-gr7.sml https://s3-eu-west-1.amazonaws.com/prod-ucs-content-store-eu-west/content/pii:S0926860X25005277/gr7/THUMBNAIL/image/gif/c46fb4401d673a45db6afb20ab8f1485/gr7.sml gr7 gr7.sml sml 9143 99 219 IMAGE-THUMBNAIL 1-s2.0-S0926860X25005277-gr9.jpg https://s3-eu-west-1.amazonaws.com/prod-ucs-content-store-eu-west/content/pii:S0926860X25005277/gr9/DOWNSAMPLED/image/jpeg/ca488d1109228d7f68db6eeda2e36cbe/gr9.jpg gr9 gr9.jpg jpg 53470 440 678 IMAGE-DOWNSAMPLED 1-s2.0-S0926860X25005277-gr9.sml https://s3-eu-west-1.amazonaws.com/prod-ucs-content-store-eu-west/content/pii:S0926860X25005277/gr9/THUMBNAIL/image/gif/cac2639fafaffe0ab9f2876a15097d54/gr9.sml gr9 gr9.sml sml 8670 142 219 IMAGE-THUMBNAIL 1-s2.0-S0926860X25005277-ga1.jpg https://s3-eu-west-1.amazonaws.com/prod-ucs-content-store-eu-west/content/pii:S0926860X25005277/ga1/DOWNSAMPLED/image/jpeg/1840dc916e2d2abaacc58a931ebbab9f/ga1.jpg ga1 true ga1.jpg jpg 15902 200 264 IMAGE-DOWNSAMPLED 1-s2.0-S0926860X25005277-ga1.sml https://s3-eu-west-1.amazonaws.com/prod-ucs-content-store-eu-west/content/pii:S0926860X25005277/ga1/THUMBNAIL/image/gif/3b4236ee4a83ea3cc20bfafde76dde69/ga1.sml ga1 true ga1.sml sml 11100 164 216 IMAGE-THUMBNAIL 1-s2.0-S0926860X25005277-gr12.jpg https://s3-eu-west-1.amazonaws.com/prod-ucs-content-store-eu-west/content/pii:S0926860X25005277/gr12/DOWNSAMPLED/image/jpeg/9a55fff027830520daf8adf1c84b9600/gr12.jpg gr12 gr12.jpg jpg 97670 762 602 IMAGE-DOWNSAMPLED 1-s2.0-S0926860X25005277-gr12.sml https://s3-eu-west-1.amazonaws.com/prod-ucs-content-store-eu-west/content/pii:S0926860X25005277/gr12/THUMBNAIL/image/gif/9cf9576922e821fbee1f102399f0c7af/gr12.sml gr12 gr12.sml sml 12585 163 129 IMAGE-THUMBNAIL 1-s2.0-S0926860X25005277-sc1.jpg https://s3-eu-west-1.amazonaws.com/prod-ucs-content-store-eu-west/content/pii:S0926860X25005277/sc1/DOWNSAMPLED/image/jpeg/d5720302749b4bb41ab9bf4ad42ff8d6/sc1.jpg sc1 sc1.jpg jpg 17105 141 565 IMAGE-DOWNSAMPLED 1-s2.0-S0926860X25005277-sc1.sml https://s3-eu-west-1.amazonaws.com/prod-ucs-content-store-eu-west/content/pii:S0926860X25005277/sc1/THUMBNAIL/image/gif/48ab895749da4f374d7950eb4b50439e/sc1.sml sc1 sc1.sml sml 3528 55 219 IMAGE-THUMBNAIL 1-s2.0-S0926860X25005277-gr4_lrg.jpg https://s3-eu-west-1.amazonaws.com/prod-ucs-content-store-eu-west/content/pii:S0926860X25005277/HIGHRES/image/jpeg/c1ad1fa2b0e6bb995ddb61da4141d77c/gr4_lrg.jpg gr4 gr4_lrg.jpg jpg 258783 1971 2663 IMAGE-HIGH-RES 1-s2.0-S0926860X25005277-gr3_lrg.jpg https://s3-eu-west-1.amazonaws.com/prod-ucs-content-store-eu-west/content/pii:S0926860X25005277/HIGHRES/image/jpeg/cc0eb33d3703b8896585af81aa01309a/gr3_lrg.jpg gr3 gr3_lrg.jpg jpg 345027 3115 2495 IMAGE-HIGH-RES 1-s2.0-S0926860X25005277-gr6_lrg.jpg https://s3-eu-west-1.amazonaws.com/prod-ucs-content-store-eu-west/content/pii:S0926860X25005277/HIGHRES/image/jpeg/14ce799cca5df520127a1383b0a1fcd7/gr6_lrg.jpg gr6 gr6_lrg.jpg jpg 407128 3207 2661 IMAGE-HIGH-RES 1-s2.0-S0926860X25005277-gr5_lrg.jpg https://s3-eu-west-1.amazonaws.com/prod-ucs-content-store-eu-west/content/pii:S0926860X25005277/HIGHRES/image/jpeg/fdaff42d6ecee827c124ed9208d27138/gr5_lrg.jpg gr5 gr5_lrg.jpg jpg 314895 3249 1664 IMAGE-HIGH-RES 1-s2.0-S0926860X25005277-gr2_lrg.jpg https://s3-eu-west-1.amazonaws.com/prod-ucs-content-store-eu-west/content/pii:S0926860X25005277/HIGHRES/image/jpeg/6d06a0031262c32a9f6eee235ff1b942/gr2_lrg.jpg gr2 gr2_lrg.jpg jpg 276251 1121 3493 IMAGE-HIGH-RES 1-s2.0-S0926860X25005277-gr1_lrg.jpg https://s3-eu-west-1.amazonaws.com/prod-ucs-content-store-eu-west/content/pii:S0926860X25005277/HIGHRES/image/jpeg/3f2a51dba6a5209cd4622756919dbc4d/gr1_lrg.jpg gr1 gr1_lrg.jpg jpg 151700 1859 1666 IMAGE-HIGH-RES 1-s2.0-S0926860X25005277-gr11_lrg.jpg https://s3-eu-west-1.amazonaws.com/prod-ucs-content-store-eu-west/content/pii:S0926860X25005277/HIGHRES/image/jpeg/92523048f1cf4db21da574616a5abce6/gr11_lrg.jpg gr11 gr11_lrg.jpg jpg 387053 2783 2659 IMAGE-HIGH-RES 1-s2.0-S0926860X25005277-gr10_lrg.jpg https://s3-eu-west-1.amazonaws.com/prod-ucs-content-store-eu-west/content/pii:S0926860X25005277/HIGHRES/image/jpeg/afe68c8a6d55c078a913e879ae6531c9/gr10_lrg.jpg gr10 gr10_lrg.jpg jpg 129697 957 1667 IMAGE-HIGH-RES 1-s2.0-S0926860X25005277-gr8_lrg.jpg https://s3-eu-west-1.amazonaws.com/prod-ucs-content-store-eu-west/content/pii:S0926860X25005277/HIGHRES/image/jpeg/8ef2513afc9f2207ee7971809e8fa8ac/gr8_lrg.jpg gr8 gr8_lrg.jpg jpg 303566 1472 3493 IMAGE-HIGH-RES 1-s2.0-S0926860X25005277-gr7_lrg.jpg https://s3-eu-west-1.amazonaws.com/prod-ucs-content-store-eu-west/content/pii:S0926860X25005277/HIGHRES/image/jpeg/f49574c3138170923f6e60ccbc8c5426/gr7_lrg.jpg gr7 gr7_lrg.jpg jpg 473857 1575 3493 IMAGE-HIGH-RES 1-s2.0-S0926860X25005277-gr9_lrg.jpg https://s3-eu-west-1.amazonaws.com/prod-ucs-content-store-eu-west/content/pii:S0926860X25005277/HIGHRES/image/jpeg/c98ddb64a9da12ea76aaee6612102ba3/gr9_lrg.jpg gr9 gr9_lrg.jpg jpg 357977 1943 2994 IMAGE-HIGH-RES 1-s2.0-S0926860X25005277-ga1_lrg.jpg https://s3-eu-west-1.amazonaws.com/prod-ucs-content-store-eu-west/content/pii:S0926860X25005277/HIGHRES/image/jpeg/2d82e929db0f4a5cc7d3cbcb7e3f8da2/ga1_lrg.jpg ga1 true ga1_lrg.jpg jpg 110198 886 1170 IMAGE-HIGH-RES 1-s2.0-S0926860X25005277-gr12_lrg.jpg https://s3-eu-west-1.amazonaws.com/prod-ucs-content-store-eu-west/content/pii:S0926860X25005277/HIGHRES/image/jpeg/e1616fe5c1c27dbabd23542332e4d901/gr12_lrg.jpg gr12 gr12_lrg.jpg jpg 425261 3369 2661 IMAGE-HIGH-RES 1-s2.0-S0926860X25005277-sc1_lrg.jpg https://s3-eu-west-1.amazonaws.com/prod-ucs-content-store-eu-west/content/pii:S0926860X25005277/HIGHRES/image/jpeg/5e6ae1058d3b393368641392d8866073/sc1_lrg.jpg sc1 sc1_lrg.jpg jpg 85336 622 2495 IMAGE-HIGH-RES 1-s2.0-S0926860X25005277-mmc1.docx https://s3-eu-west-1.amazonaws.com/prod-ucs-content-store-eu-west/content/pii:S0926860X25005277/mmc1/MAIN/application/vnd.openxmlformats-officedocument.wordprocessingml.document/4efdab9a5a94e9dfdb44b82527c2df1f/mmc1.docx mmc1 mmc1.docx docx 5229504 APPLICATION 1-s2.0-S0926860X25005277-si0001.svg https://s3-eu-west-1.amazonaws.com/prod-ucs-content-store-eu-west/content/pii:S0926860X25005277/image/svg+xml/76ce96be478865d954b1c64bf8681b4a/si0001.svg si0001 si0001.svg svg 3136 ALTIMG 1-s2.0-S0926860X25005277-si0002.svg https://s3-eu-west-1.amazonaws.com/prod-ucs-content-store-eu-west/content/pii:S0926860X25005277/image/svg+xml/4d3ecf33ddc8910a9bb007576d3960c5/si0002.svg si0002 si0002.svg svg 1835 ALTIMG 1-s2.0-S0926860X25005277-si0003.svg https://s3-eu-west-1.amazonaws.com/prod-ucs-content-store-eu-west/content/pii:S0926860X25005277/image/svg+xml/dfa8a95c7f4d0d9d0d6e1c4e239133b1/si0003.svg si0003 si0003.svg svg 2496 ALTIMG APCATA 120625 120625 S0926-860X(25)00527-7 10.1016/j.apcata.2025.120625 The Authors Fig. 1 XRD of fresh (top) and exhaust (bottom) Ni/Al2O3 catalysts with phase assignment, according to the Pearson’s crystal database. Fig. 1 Fig. 2 FE-SEM micrographs of fresh prepared and spent Ni/Al2O3 catalysts, using ethanol as solvent. In micrographs, SE and BSE stay for micrographs acquired taking advantage of Secondary (S) or Backscattered (BS) Electrons (E). Fig. 2 Fig. 3 Catalytic performances of Ni-based catalysts in CO2 hydrogenation reaction. Fig. 3 Fig. 4 Absorbance profile of ammonia (at 930 cm−1) production and the corresponding time and temperature data during the reduction. Fig. 4 Fig. 5 Absorbance profile over time of NOx release during the reduction of the Ru/Al2O3 catalysts. Profiles of a) NO2 at 1587 cm−1, b) N2O at 2239 cm−1, and c) NO at 1890 cm−1. Fig. 5 Fig. 6 Catalytic performances of Ru-based catalysts in CO2 hydrogenation reaction. Fig. 6 Fig. 7 0.5Ru/A _E_R2 operando IR spectra upon introduction of the COx methanation flow at 523 K. a) carbonates and formate region; b) carbonyls region; c) C-H stretches region; d) O-H stretches region and e) MS profiles. Fig. 7 Fig. 8 0.5Ru/A _E_R2 operando IR spectra upon stopping CO and introducing of the CO2 methanation flow at 523 K. a) carbonates and formate region; b) isobestes of formate and monohydrogencarbonate c) carbonyls region; d) O-H stretches region and e) MS profiles. Fig. 8 Fig. 9 0.5Ru/A _E_R2 operando IR spectra upon stopping CO2 and introducing the CO methanation flow at 523 K. a) carbonates and formate region; b) isobestes of formate and monohydrogen carbonate; c) carbonyls region; d) MS profiles. Fig. 9 Fig. 10 X-ray diffraction patterns of spent (after catalytic test) Ru/Al2O3 catalysts and identification of the crystalline phases [87]. Fig. 10 Fig. 11 FE-SEM images of spent Ru/Al2O3 catalysts prepared using either ethanol or water and reduced under R1 and R2 conditions. Bright points marked by the yellow circles represent Ru nanoparticles. The images on the right side highlight the compositional contrast, thanks to the backscattered electron signals, while the corresponding images on the left, acquired using secondary electron signals, emphasize the morphology. Fig. 11 Fig. 12 FE-SEM images of spent Ru/Al2O3 catalysts prepared using either ethanol or water and pretreated and reduced under Cal-R1 conditions. The images on the right side are acquired using the backscattered electron signals, the corresponding ones on the left using secondary electron signals. Fig. 12 Scheme 1 proposed COx methanation mechanisms, as also proposed by [40]. Scheme 1 Table 1 Overview of similar studies on kinetics evaluation in the literature and comparison with the current work. Table 1 Catalyst T[K] Reaction orders P[atm] H2/CO2 ratio[-] GHSV[1/h] r CH4 [mol/(min*g)] XCO2 [%] Ea [kJ/mol] Ref 3 % Ru/γ-Al2O3 493–573 n H2= 0.39 1 3–15 55000 - 3–7 60 [32] 0.5 % Ru/γ-Al2O3 5 % Ru/γ-Al2O3 513–573 n CO2= 0.39n H2= 0.3 – 0.5 1 0.7–7 33000 –135000 - < 5 57–70 [133] 64–80 0.5 % Ru/γ-Al2O3 0.8 % Ru/γ-Al2O3 573–653 n CO2= 0.14 – 0.28n H2= 0.46 – 0.87 1 4.2 - - 0–5 60 ± 12 [134] 5 %Ru/γ-Al2O3 443–503 n CO2= 0.47n H2= 1 1 - 3000–6000 - 6–10 64 [135] 10 %Ru/γ-Al2O3 473–518 n CO2= 0.34n H2= 0.88 1 4–6 90000–262920 - < 10 66 [136] 0.5 %Ru/Al2O3 473–623 n = 0.225 1 2–4 3000–7700 - 0–18 71 [35,137] 0.5 %Ru/Al2O3 473–718 n = 0.225 2 1–5 100–450 - 20–100 69 [138] 2 Ni/A_E 523 1 5 55000 1.84E−05 0.8 83 Thiswork 573 - 1.18E−04 4.8 623 3.02E−04 17.7 0.5 Ru/A_E_R1 523 1 5 55000 2.37E−05 3.3 70 573 - 9.46E−05 6.7 623 3.28E−04 19.5 0.5 Ru/A_W_R1 523 1 5 55000 1.77E−05 1.7 61 573 - 8.32E−05 4.6 623 3.18E−04 17.5 0.5 Ru/A_E_Cal-R1 523 - 1 5 55000 3.38E−05 2.5 58 573 1.29E−04 7.8 623 4.33E−04 21.1 0.5 Ru/A_W_Cal-R1 523 1 5 55000 2.32E−05 1.3 52 573 - 5.31E−05 3.5 623 1.21E−04 9.1 0.5 Ru/A_E_R2 523 n CO2= ∼ 0n H2= 0.43 1 5 55000 1.82E−05 1.4 62 573 1.19E−04 5.5 623 5.41E−04 18.1 0.5 Ru/A_W_R2 523 n CO2= ∼ 0n H2= 0.44 1 5 55000 3.12E−05 1.4 80 573 1.23E−04 6.0 623 5.57E−04 28.2 CO2 methanation over Ru- and Ni/Al2O3 catalysts: Effect of preparation solvent on performance and surface chemistry Sina Ebrahim Atakoohi Writing – original draft Investigation Formal analysis a b 1 Elena Spennati Writing – review & editing Writing – original draft Methodology Investigation Formal analysis Data curation a b c 1 Paola Riani Writing – review & editing Supervision Project administration Data curation Conceptualization c d Marco Daturi Writing – review & editing Supervision Methodology Data curation b Guido Busca Writing – review & editing Validation Data curation a Gabriella Garbarino Writing – review & editing Validation Supervision Project administration Methodology Funding acquisition Data curation Conceptualization a c ⁎ a University of Genova, DICCA, Department of Civil Chemical and Environmental Engineering, Via all’Opera Pia 15, Genova 16145, Italy University of Genova DICCA, Department of Civil Chemical and Environmental Engineering Via all’Opera Pia 15 Genova 16145 Italy University of Genova, DICCA, Department of Civil Chemical and Environmental Engineering, Via all’Opera Pia 15, 16145, Genova, Italy b Université de Caen Normandie, ENSICAEN, CNRS, Laboratoire Catalyse et Spectrochimie (LCS), Caen 14000, France Université de Caen Normandie, ENSICAEN, CNRS Laboratoire Catalyse et Spectrochimie (LCS) Caen 14000 France Université de Caen Normandie, ENSICAEN, CNRS, Laboratoire Catalyse et Spectrochimie (LCS), Caen, 14000, France c INSTM, UdR di Genova, via Dodecaneso 31, Genova 16146, Italy INSTM UdR di Genova via Dodecaneso 31 Genova 16146 Italy INSTM, UdR di Genova, via Dodecaneso 31, 16146, Genova, Italy d University of Genova, DCCI, Department of Chemistry and Industrial Chemistry, Via Dodecaneso 31, Genova 16146, Italy University of Genova DCCI, Department of Chemistry and Industrial Chemistry Via Dodecaneso 31 Genova 16146 Italy University of Genova, DCCI, Department of Chemistry and Industrial Chemistry, Via Dodecaneso 31, 16146, Genova, Italy ⁎ Corresponding author at: University of Genova, DICCA, Department of Civil Chemical and Environmental Engineering, Via all’Opera Pia 15, Genova 16145, Italy. University of Genova, DICCA, Department of Civil Chemical and Environmental Engineering Via all’Opera Pia 15 Genova 16145 Italy 1 Equal contribution Ru/Al2O3 and Ni/Al2O3 catalysts were prepared and investigated in the CO2 hydrogenation reaction. 0.5 wt% Ru/Al2O3, 2 wt% Ni/Al2O3, and 13.6 wt% Ni/Al2O3 catalysts were prepared by using a modified incipient wetness impregnation with a main focus on the effect of solvent selection and catalyst pretreatment conditions on the catalyst reduction, activity, selectivity, activation energy, and morphology. In-depth characterizations, including FT-IR, FE-SEM, and XRD, were performed on the catalysts, and an operando study was carried out on the best-performing Ru-catalysts in COx transient experiments at 523 K. The investigation revealed that employing ethanol as the solvent for preparation results in a catalyst with improved properties and activity. Furthermore, coupling solvent selection with various pretreatment conditions demonstrated that specific pretreatments can significantly affect the catalyst properties, activity, and morphology. Operando IR confirmed the mechanism and the effect of CO reported in the literature, even if a different distribution of carbonyl species was detected. Graphical Abstract Keywords Hydrogenation CO2 methanation Catalyst design Ruthenium-alumina Solvent Pretreatment Data availability Data will be made available on request. 1 Introduction In the recent years, hydrogenation of captured CO2 with renewable hydrogen has received much attention as a possible way for carbon dioxide valorization and reuse, especially in the frame of the so-called “Power to Gas” (PtG) technologies, which offer promising solutions for reducing greenhouse gas emissions and building up a green energy cycle [1,2] recognizing H2 availability and price as the bottlenecks for the widespread adoption of such technology. The main reaction, known as Sabatier’s reaction, is (1) CO2(g) + 4H2(g) ⇌ CH4(g) + 2H2O(g) ΔH° 298 = -165 kJ/mol that can be carried out in thermochemical [3,4] plasma [5] and biological ways [6], being the resulting methane a type of Synthetic or Substitute Natural Gas (SNG) [7–9], similar to that produced by converting syngases coming from coal gasification. If electrolytic hydrogen is used for CO2 hydrogenation, e-methane is produced, representing a sustainable e-fuel that can be transported in existing natural gas networks after being upgraded to match the natural gas grid requirements set in each EU country in terms of Wobbe index and composition [10]. The same process can also produce hydrogen-methane mixtures, called “hydromethane”, that is a promising and attractive fuel option for vehicles [11]. However, it should be considered that CO2 conversion to methane is competitive with the production of CO through the so-called “Reverse Water Gas Shift” reaction, RWGS [12], (2) CO2(g) + H2(g) ⇌ CO(g) + H2O(g) ΔH° 298 = +41.16 kJ/mol and with the possible reduction of COx to elemental carbon according to reactions (3) and (4) (3) CO2(g) + 2H2(g) ⇌ C(s) + 2H2O(g) ΔH° 298 = -90.1 kJ/mol (4) CO(g) + H2(g) ⇌ C(s) + H2O(g) ΔH° 298 = -131.3 kJ/mol where the Boudouard equilibrium reaction might be accounted (5). (5) 2CO(g) ⇌ C(s) + CO2(g) ΔH° 298 = -172.4 kJ/mol Therefore, catalyst choice plays a crucial role by enhancing the CO2 reaction rate and ensuring high selectivity toward methane production with a reduced carbon deposition and guaranteeing, at the same time, a remarkable thermal stability for the forecasted temperature increase as a function of the chosen reactor and process layouts [13]. Among various catalysts explored for CO2 methanation, those based on Ru [14–17] and Ni [1,2,18–20] have shown significant potential also at the commercial scale level, such as METH 134 and METH 135 commercialized by Clariant, consisting of alumina-supported NiO with 25 and 43 wt% loading, shaped as spheres and operated in a standard syngas plant above 473 K [21]. For low-temperature applications (T < 443 K), primarily related to the COx methanation in hydrogen or ammonia synthesis gas, Clariant provides METH 150, which consists of ruthenium (0.3 wt%) on an alumina support in tablet form. In recent applications, SNG 100 DCARB has also been reported; however, no specifications are provided for its composition and active phase types. Topsøe reported in TREMP™ RNG process [22] that different pre-reduced catalysts, such as MCR-2 and MCR-8, are used for medium and high-temperature methanation in the form of cylinders (for MCR-8) or 7-hole cylinders (for both MCR-2 and MCR-8). In contrast, the PK-7R catalyst is designed explicitly for low-temperature applications and is sold, pre-reduced, in the form of ring-shaped catalysts. In previous reports, MCR-2X was also reported as a Ni-based catalyst over a stabilized support [23], while PK-7R is reported to have a Ni loading higher than 23 wt% [23]. Johnson Matthey produced DAVY™ with CRG catalyst series [24] for coal-derived syngas to methane, and the KATALCO 11 series with a nickel loading of 35 wt% [25]. Ni-based catalysts are prone to sintering and coke deactivation, but guarantee a wide operation range up to 1000 K [26–30], whereas 0.5 wt% Ru/Al2O3 catalysts exhibit a remarkable low-temperature activity [17,31,32] (above 97 %, accounting for temperature inhomogeneities) in a 2 kW plant with a space velocity of 0.14 s−1 [33], even though catalyst cost can increase by a factor 2.5 when compared with Ni-ones, according to data reported from Zuttel’s group [34]. In addition, the higher catalytic activity of Ru-based catalysts at lower temperatures opens the possibility of achieving a wider CO2 conversion range by considering the involved thermodynamic equilibrium. At the laboratory scale, Garbarino and coworkers [35–38] and Gonzales Velasco and coworkers agreed on a suitable Ni loading for CO2 hydrogenation of 12 wt% and of 4 wt% in the Ru case [39], when supported over commercial alumina and starting from nickel nitrate and ruthenium nitrosyl nitrate as precursors followed by a low temperature static air calcination step. In the field of CO2 hydrogenation over Ru/Al2O3 catalysts, the contribution of Prof. Luca Lietti, active in the Laboratory of Catalysis and Chemical Plants at the Polytechnic of Milan, is undoubtelly relevant and has covered, during the years, the determination of kinetics [16], the effect of CO in CO2 hydrogenation [40], the development of eggshell catalysts and the evaluation of mass transport limitations [15], and the possible exploitation of Ru-based catalysts in the frame of dual functional materials [41–44]. This allowed him to contribute to a deep understanding of this catalytic system and to propose a system that can produce SNG ready for injection into the natural gas grid [45]. However, looking at possible optimization and accounting for the fact that catalyst activity and selectivity rely on the size, accessibility, and distribution of the active metal (oxide) particles over the support, it is crucial to find optimal synthesis and pretreatment [46,47]. Among the available preparation routes, incipient wetness impregnation is one of the most widely used techniques for preparing alumina-supported heterogeneous catalysts. This approach is very attractive due to its technical simplicity, scalability, cost-effectiveness, and minimal waste generation [47]. Recently, various methods have been explored in the literature to enhance Ni dispersion, including adjusting preparation conditions, enhancing interactions between the metal and support, and incorporating promoters [48–59]. Additionally, the type and properties of the solvent used may be of particular significance. Water is the conventional and most used solvent in the incipient wetness impregnation preparation method. However, the investigation of using alternative solvents has recently gained interest. Different solvents, such as cyclohexane, ethanol, ethylene glycol, glycerol and alkanols, have been investigated, and it was found that they can lead to the formation of smaller and more uniformly distributed active metal particles [49,56,60,61]. Less polar solvents were observed to increase the interaction between active phase complexes and the support surface, resulting in more stable metal species with stronger metal-support interactions. In addition, it has been reported that the use of organic solvents increased the number of weak and medium basic sites when replacing water. This supports the idea that the solvent choice can represent a critical factor in tailoring catalyst properties and performances [49,56,59,60,62–73]. Furthermore, after the wetness impregnation step, thermal treatment processes (drying, calcination, and/or reduction) are essential to obtain the catalyst in its active form. The drying step has the role of removing the solvent and ensuring the most uniform distribution of the precursor on the support [74]. Subsequent calcination and/or reduction steps facilitate the conversion of precursors into stable forms, promoting interactions between the metal species and the support and producing metal particles, which are at the basis of catalytic performance [75,76]. However, to optimize the thermal treatment conditions, it is crucial to consider the type of catalyst (including the active metal and support) and their physicochemical properties, as well as the specific goals of the intended reaction. Indeed, the sensitivity of the thermal treatment process is particularly crucial when dealing with ruthenium-based catalysts. Ruthenium can be volatile through the formation of ruthenium tetroxide (RuO4) during calcination at elevated temperatures [77,78]. RuO4 is highly toxic and poses health hazards [79], and its formation can lead to the loss of active ruthenium species from the catalyst surface, affecting catalytic performance. Several studies have shown severe sintering of ruthenium particles supported on alumina [80], silica [80,81], and zeolite A [82] when subjected to oxidative treatment prior to reduction. The oxidation treatment leads to a decrease in the support-metal oxide interaction and could result in rapid sintering upon the reduction treatment. As discussed, despite the significant improvements observed in the literature by modifying the impregnation solvent, this is not fully and systematically addressed in the open literature for Ru/Al2O3 and Ni/Al2O3 catalysts in the context of CO2 methanation reaction. Considering the previously summarized studies, this work employs water (as a polar and reference solvent) and ethanol (as an organic primary alcohol solvent) for the preparation of alumina-supported Ru and Ni catalysts aiming at understanding the potential effects. Moreover, in the case of Ru, this contribution aims at ruling out the effect of calcination-reduction or direct reduction protocols onto performance under CO2 methanation conditions and at comparing the obtained results with those available in literature. On the best-performing Ru-catalyst, a systematic surface study has been carried out to shed light on the eventual displayed effects. 2 Experimental 2.1 Catalyst preparation The investigated catalysts were prepared using Pural SB (as boehmite) as an alumina precursor produced by Sasol. Pural SB was calcined with 3 K/min at 1023 K for five hours to obtain a γ-Al2O3 as starting support. To prepare Ni/Al2O3 catalysts using the incipient wetness impregnation method, Ni(NO3)2*6H2O (Alfa Aesar) was utilized as the precursor, and it was dissolved in ethanol to compare this preparation with the well-known recipes established in the literature [14,32]. Hereafter, abbreviations will be used for Ethanol (E), Water (W), and γ-Al2O3 (A). The volume of ethanol was estimated in a way that the total volume of the solution was equal to the determined γ-Al2O3 pore volume. Ni loading was set at 13.6 wt% (13.6Ni/A_E) and 2 wt% (2Ni/A_E), to compare with water-prepared catalysts (13.6Ni/A_W) [37] and Gnp-supported materials [83]. After impregnation, the catalysts underwent a drying step at 333 K for 1 h, followed by calcination in air at 1023 K for 5 h, both with a heating rate of 2 K/min. This heat treatment procedure was identical for both the ethanol- and water-based prepared catalysts. Before each catalytic experiment, the Ni/Al2O3 catalysts were subjected to in situ reduction using a 20 % H2 - 80 % N2 mixture (% mol/mol), with a total flow rate of 80 NmL/min. The temperature was increased at a rate of 25 K/min up to 1023 K, then held for 30 min. The cooling down was performed by keeping the same atmosphere down to room temperature. Besides, to prepare Ru/Al2O3 catalysts using the incipient wetness impregnation method, Ru(NO)(NO3)3 solution, Ru 1.5 % w/v (Alfa Aesar) was used as Ru-precursor and was diluted in either ethanol or water, achieving on the final catalyst the desired Ru loading, i.e. 0.5 wt%. After the impregnation step, three different thermal treatments were considered: 1- direct reduction; using the same conditions employed for the reduction of the Ni-based catalyst, but lowering both the maximum temperature (773 K) and applied heating rate (10 K/min). These catalysts were denoted as 0.5 Ru/A_X_R1, where X represents either ethanol (E) or water (W), as mentioned before. R1 stands for the direct reduction condition. 2- heat treatment + reduction; in this case, the catalysts were thermally treated in a pure N2 flow (80 NmL/min) at 773 K for 30 min, with a heating rate of 10 K/min. Subsequently, at 773 K, the flow was switched to the reducing condition, consisting of a 20 % H2 - 80 % N2 mixture, holding the temperature for 30 min, before cooling. These catalysts were denoted as 0.5 Ru/A_X_R2. R2 stands for heat treatment followed by reduction condition. 3- air calcination + reduction; in this case, the catalysts were dried at 393 K for 2 h, followed by calcination in air at 773 K for 1 h, using a heating rate of 2 K/min. Subsequently, an in-situ R1 reduction step was performed. This series was denoted as 0.5 Ru/A_X_Cal-R1. Cal-R1 refers to catalyst calcination in air followed by reduction treatment. 2.2 Catalytic experiments Following our previous works [27,37], in steady-state catalytic experiments, a fixed-bed reactor with 88.0 mg of catalyst mixed with 700 mg of silica glass beads (0.25–0.21 mm, equivalent to 60–70 mesh sieved) was prepared. Before the catalytic experiments, the catalysts were treated in situ according to the above-described procedures. CO2 hydrogenation experiments were conducted using a gaseous flow rate of 80 NmL/min, with a H2/CO2 ratio of 5 in nitrogen dilution, used as carrier gas. The gas hourly space velocity (GHSV), evaluated on catalyst volume, was equal to 55,000 h−1. To investigate any hysteresis, activation, or short-term deactivation effects, the experiments were performed both in ascending and descending reaction temperature sequences (523 K, 573 K, 623 K, 673 K, 723 K, 773 K, and in reverse). The entire catalytic experiment has a duration of over 7 h on stream. The reaction products were analyzed by FT-IR to evaluate the catalytic performance. For FT-IR online product analysis, a Nicolet 6700 FT-IR instrument was utilized. Frequencies corresponding to weak absorption of CO2, CH4, and CO molecules were employed (2293 cm−1 for CO2, 2170 cm−1 for CO, 1333 cm−1 for CH4, after baseline subtraction). The instrument was calibrated using gas mixtures with known concentrations to ensure accurate and quantitative results during the analysis process. Produced water was mostly condensed upstream of the IR cell, and from the inlet and outlet concentrations calculated using the absorbances of CO, CO2, and CH4, along with the measured total flows (to consider the variation in moles during the reaction), CO2 conversion (XCO2), selectivity, and yields to products (Si and Yi) were determined [84]. They are defined as: (6) X CO 2 = F CO 2 in − F CO 2 out F CO 2 in (7) Y i = F i F CO 2 in (8) S i = F i F CO 2 in − F CO 2 out A comparison of the obtained data using IR (averaged when deactivation is observed) was carried out using an offline gas chromatograph (GC) Agilent 4890 equipped with a Varian capillary column “Molsieve 5A/Porabond Q Tandem” and TCD and FID detectors in series and with a Ni-based methanator. The results presented in this work will be the average of the two methods, with error bars also included for the sake of completeness. Preliminary kinetics investigations were carried out on best-performing materials. The reaction order for CO2 was investigated by varying PCO2 from 0.03 to 0.07 atm at a fixed partial pressure of hydrogen PH2 = 0.30 atm. Similarly, the reaction order of H2 was studied by monitoring PH2 variations between 0.03 and 0.28 atm at a constant value of PCO2 = 0.07 atm. All experiments were performed at 573 K, assuming a differential reactor to analyze changes in the reaction order obtained. Operando experiments were carried out in a “Sandwich” home-made IR reactor cell, which consists of a stainless-steel cylinder carrying a toroidal sample holder in its center, where the self-supported wafer of catalyst is placed. The heating system guarantees to reach the required maximum temperature of 773 K on the sample upon reduction, guaranteeing proper reduction conditions. The dead volume (the residual space between each sample face and windows) is kept as low as 0.12 cm3, and the optical path is below 3 mm, allowing the acquisition of data in relevant catalytic conditions [85]. The experiments were carried out at atmospheric pressure. Gases were introduced into the lines (heated at 333 K) by mass flow controllers and forced on the sample by a 1/16 pipe and collected on the opposite side of the sample holder. The analysis of the reactants and/or the reaction products was performed by a Quadrupole Mass Spectrometry (Pfeiffer Vacuum Omnistar GSD 301) and by FTIR spectroscopy (via a gas microcell of 0.088 cm3 volume). IR spectra were collected with a Thermo Scientific Nicolet 6700 FT-IR spectrometer, equipped with MCT detectors, at the maximum speed of a spectrum every 50 ms. More details about the IR operando setup can be found elsewhere [86]. Samples were pressed as self-supported wafers of around 20 mg and activated, in operando conditions, increasing the temperature up to 773 K for 30 min under a flow of 20 mL/min of Ar. After this, H2 has been introduced at 20 % (vol/vol) for 30 min, and then the system has been cooled down to reach 523 K, the chosen reaction temperature. The experiment carried out consists of three different steps, by keeping a GHSV of 55000 h−1, and coming back from one step and the other to STEP 1: • STEP 1: COx methanation: 3.33 % CO (vol/vol*100) and 3.33 % CO2 (vol/vol*100), 30 % (vol/vol*1100) H2, Ar balance; • STEP 2: Stop CO flow - CO2 methanation with the following conditions 6 % CO2 (vol/vol*100), 30 % (vol/vol*100) H2, Ar balance to acquire time resolved evolution of both gas and surface; • STEP 3: Stop CO2 flow - CO hydrogenation with the following conditions: 8.6 % CO (vol/vol*100), 30 % (vol/vol*100) H2, Ar balance to acquire time resolved evolution of both gas and surface. 2.3 Material characterizations In the case of Ru-containing materials, the in-situ reduction coupled with FT-IR was employed to characterize and assess the reducibility of the investigated materials by collecting and analyzing the reactor outlet stream upon treatment. As detailed in the preparation section and summarized in Table 1, the pretreatments were carried out under two designated conditions: R1 and R2. H2O was mostly completely condensed before the IR cell. To follow the species’ evolution, the following wavenumbers have been chosen: 1587 cm−1, 2239 cm−1, and 1890 cm−1 for NO2, N2O, and NO, respectively. X-ray diffraction profiles of both initial and spent catalysts were obtained using a vertical powder diffractometer, X′Pert. The diffractograms were continuously recorded across the 10–100° 2θ range, with increments of 0.013° and a counting duration of at least 748 s, but also reaching times of up to 1800 s. The powder patterns were indexed by comparing the 2θ values of observed peaks to those reported in Pearson's Crystal Data database [87]. FT-IR spectra were collected with a Nexus Thermo Fisher instrument with 100 scans and a spectral resolution of 2 cm−1. KBr pressed disks were used for skeletal characterization with a 1 wt% catalyst and a disk total weight of 1.00 g. Ultraviolet-visible-near infrared diffuse reflectance spectra were obtained by using a Jasco V570 instrument. Morphological and compositional analyses were carried out using an SEM ZEISS SUPRA 40 VP microscope, equipped with a field emission gun (FE-SEM). This apparatus is equipped with an \"InLens\" secondary electron detector, a solid-state detector for backscattered electrons (BSE), and an EDXS (Energy Dispersive X-ray Spectrometer) OXFORD \"INCA Energie 450 × 3\" for chemical analysis. Fresh and exhaust (after catalytic experiments) sample powders were directly affixed onto a high-purity, conductive, double-sided adhesive carbon tab. The specimens were subjected to imaging after undergoing a carbon coating procedure. 3 Results and discussion 3.1 Ni-based catalysts 3.1.1 Characterization of fresh catalysts Ni-based catalysts prepared using ethanol as a solvent have been characterized through XRD, FE-SEM, FT-IR, and UV–vis–NIR. For the water-based one, 13.6Ni/A, extensive characterization data can be found in the reference [37], which is used here for the sake of comparison. In Fig. 1 top, the diffraction patterns of the investigated Ni-based catalysts are reported and compared with those of the bare support. γ-Al2O3 diffraction pattern well corresponds to the one generally reported in the literature for nearly cubic non-stoichiometric spinel with a lattice prototype cF120-Fe3O4 [88], well representative also for 2Ni/A_E. A different situation is observed in the case of 13.6Ni/A_E, where the XRD pattern of the defective spinel NixAl2O3+x can be observed with the characteristic shift of the 440 and 400 peaks, the disappearance of the 222-crystal family plane of γ-Al2O3 and an increase of the intensities characterizing the 111, 440, and 400 crystal family planes, in line with the formation of a surface spinel [20,90,91]. XRD findings are well complemented by FE-SEM investigation, as reported in Fig. 2 (A-D); in fact, both investigated catalysts display a morphology characterized by globular, rounded alumina-based particles with an average diameter of 20–30 nm, not significantly modified upon nickel addition as observable from Secondary Electron (SE) micrographs. Taking advantage of Backscattered Electrons (BSE) on the same sample portion, nickel appears to be well and homogeneously dispersed in the matrix with a loading of 13.4 wt% and with an uncertainty on a statistical basis of ±10 % (from 11.9 wt% to 15.6 wt%). As indeed expected, and previously discussed, in the case of 2Ni/A_E, nickel is completely diffused in the alumina matrix, in line with the relatively low loading and the followed synthetic route. In Fig. 1S, the UV–vis–NIR spectra of fresh samples are reported. In line with literature findings [38], 13.6Ni/A_E shows a remarkable absorption in the UV region, at 237 nm, associated with O2− → Ni2+ charge transfer transitions (CTT), mostly absent in the low loading sample (2Ni/A_E) and similar to the one reported for 13.6Ni/A_W [37]. In the visible region, the observed features may allow the discrimination in-between dispersed Ni2+ in the form of the surface spinel layer or NiO. Surface spinel phase is characterized by a doublet with features at 630 and 600 nm [38], which are found in both presently investigated samples and arise from the 3T1(F) → 3T1 g (P) transition, common for Ni2+ dispersed on alumina [89,90]. The position of the observed absorption in the near IR region, attributed to the 3A2 g → 3T2 g d–d transition of Ni2+ [91], shifts from 945 to 1041 nm when loading is increased from 2 % to 13.6 %, providing information on the good Ni dispersion, in agreement with the above discussed data, further confirming the absence of NiO species, according to the absence of its main peak at 710 nm [18,20]. In Fig. 2S, IR spectra of fresh samples are reported; the obtained spectra are similar to those reported for Ni/Al2O3 catalysts [32,35,37,38]and show the main features of γ-Al2O3 at 750 and 550 cm−1 as in the case of 2Ni/A_E; at higher loadings, new features at 504 cm−1 and 723 cm−1, characterizing the spinel surface layer [92], are superimposed, with no evident effect of solvent chosen for preparation. 3.1.2 Catalytic activity in CO2 hydrogenation The catalytic activity of Ni/Al2O3 samples (Ni/A_X) is described in Fig. 3 and 3S, where also 13.6Ni/A_W is reported for the sake of comparison. For reader’s convenience, a summary of catalytic results is also available in Table 1S. At low temperatures, i.e., 523–573 K, the performances of 13.6Ni/A samples overlap, despite the use of a different solvent, resulting in a remarkably selective production of methane, with yields ranging from 7 % to 42 %. From 623 K, Ni/A_E exhibited superior methane production and CO2 conversion, achieving a maximum yield of 85 % at 673 K, with no CO coproduction. Above this temperature, over both catalysts, the forecasted thermodynamic equilibrium is approached. This behavior is slightly dampened in the descending temperature experiment, showing comparable performance down to 623 K. At 573 K, a slight increase in CO production is observed for the 13.6Ni/A_E. In Fig. 3S, the methane selectivity against CO2 conversion plot is reported. Nevertheless, in the descending experiment part, 13.6Ni/A_W was demonstrated to be more stable than 13.6Ni/A_E, suggesting that for this sample, a contribution of high-temperature exposure can be hypothesized together with a possible lower reducibility of Ni species, in line with the above-discussed XRD data. Lowering the Ni loading down to 2 wt% (2Ni/A_E) resulted in a decrease in methane yield and an increase in selectivity toward rWGS and CO production, aligning with the findings of Riani et al. [29] over 1 % SiO2 - 99 % Al2O3 support. In this case, the forecasted thermodynamic equilibrium is approached at the highest tested temperature, with only a limited decrease in the performance in the decreasing temperature experiment, i.e., 673 K and 623 K. Interestingly, this behavior is quite different than the one achieved on Ni/Gnp, suggesting that support might play a role together with the absence of sulphur that characterizes presently investigated material [83] and in particular 2Ni/A_E is slightly more selective toward CO2 hydrogenation to methane. In addition to the above-discussed literature findings on the straightforward effect of lower Ni loading reducing the number of active sites and thus the overall activity, the observed changes in performance agree with the reported structure sensitivity of Ni in CO2 methanation and/or possible changes in the Ni chemical state. CO2 methanation has been recognized being a structure-sensitive reaction for Ni/SiO2 catalysts in the work of Vogt and coworkers, where the maximum catalytic activity was obtained on materials displaying Ni particle sizes of 2.5 nm [93]. In addition, as shown by Simons and coworkers on Ni/SiO2 catalysts [94], different active sites are needed for carrying out the conversion of CO2 to CO and CO to methane, being the first reaction strongly structure-sensitive and with a loss of activity below 5 nm, and thus suggesting that multiple contiguous Ni sites (which are rare on highly dispersed small particles found at low loadings) are needed. Conversely, rWGS is less structure-sensitive and occurs efficiently on isolated Ni atoms or small clusters due to a lower availability of step edges. These findings have also been complemented by DFT calculation [95] where the authors underlined the role of particle shape and size, correlating the activity with the shape of the more abundant family of NPs, i.e., the ones with a high fraction of 4-fold sites. However, the predominant shape of NPs is apparently related to both the choice of the support material and the followed preparation procedure, likely important also in the alumina case. In fact, at lower Ni loading, there are stronger interactions between Ni and the support material, as in the alumina case, where small amounts of unreducible Ni2+ might be also present. 3.1.3 Characterization of exhaust catalysts XRD patterns of spent catalysts are reported in Fig. 1, bottom. As expected, reduction occurred in both cases, during the pretreatment and reaction cycle; the diffraction patterns of cubic metallic nickel and of γ-Al2O3 or NixAl2O3+x defective spinel are present, in line with previous reports [29,37,38]. In the case of 13.6Ni/A_E, the original position of the 440 and 400 peaks of γ-Al2O3 is mostly restored. The discussed data are confirmed by IR spectra of spent catalyst (Fig. 2S), where two features in the range 804–797 cm−1 and 504–559 cm−1 are present, superimposed to γ-Al2O3 and Si-O vibration (SiO2 is used as a diluent in catalytic activity experiments), suggesting the modification on AlO4 tetrahedra vibrations [92]; after subtraction of the diluent contribution, the observed bands are shifted to 723 and 550 cm−1, with a broad band at 610 cm−1, contributing to the hypothesis of the presence of a small residue of the surface aluminate layer. The micrographs of spent catalytic materials are included in Fig. 2, right (E-H). On fresh, unreduced catalysts, images obtained with BSE displayed a homogeneous distribution of Ni (Fig. 2 left). In contrast, after catalytic tests, both catalysts show small bright metallic Ni nanoparticles with a narrow particle size distribution and an average diameter lower than 10 nm, in agreement with previously reported data [37], when water was used as a solvent in the preparation step. In particular, the Ni particle distribution was more homogenous in 13.6Ni/A_E sample than 2Ni/A_E one, with no remarkable change in morphology. Interestingly, the diffuse brightness in the images of 2Ni/A_E sample could confirm the achievement of a partly reduced nickel, as evident from the appearance of bright rounded particles in a diffuse bright matrix. This may be the factor affecting the activity and selectivity of the obtained catalyst by limiting methane selectivity and increasing CO production in the 573–723 K region. This datum is also in agreement with previous findings on selective catalytic materials when Ni particles are in the range of 6–10 nm while for smaller particles, CO2 hydrogenation produces CO as a byproduct. In Fig. 3S (top), CH4 selectivity of each catalyst as a function of CO2 conversion at different operating temperatures (523, 573, 623, 673, 723, and 773 K) in both ascending and descending modes is reported. For the Ni-based catalyst with a loading of 13.6 wt%, both catalysts prepared using either ethanol or water, exhibited a selectivity above 99 % for methane production up to 673 K. As expected, the selectivity decreases at higher temperatures as the equilibrium condition approaches, and the reverse water gas shift reaction starts to occur too. However, during the descending mode, the 13.6Ni/A_E catalyst could not replicate the same selectivity observed in the increasing temperature experiments, suggesting that the catalyst undergoes slight deactivation. On the other hand, in the case of 2 Ni/A_E, an increase in temperature led to increased conversion, but CH4 selectivity was significantly reduced, in line with literature data for low-loading Ni samples [29]. The same trend was observed during the descending mode, resulting in an even lower selectivity. 3.2 Ru-based catalysts 3.2.1 In-situ reduction As previously detailed, Ru-based catalysts underwent three distinct pretreatment-reduction conditions, namely R1, Cal-R1, and R2. The reduction processes were monitored using an online FT-IR spectrometer. It is interesting to note that, independently of the applied reduction conditions, ammonia (NH3) was always found in the gas products upon the catalyst reduction process. This could open two different possibilities: the first one is the occurrence of the Haber-Bosch reaction in the H2/N2 reducing gas, (9) N2(g) + 3H2(g) ⇌ 2NH3(g) ΔH° 298 = -92.2 kJ/mol The ammonia synthesis reaction is industrially realized, primarily employing iron catalysts under high temperature and pressure [96,97]. However, ruthenium-based catalysts are well known to be even more active than Fe-based ones. Industrially, Ru-catalysts, supported on graphitic carbon have been developed by Kellogg, are manufactured today by Clariant, and are used in the Kellog Advanced Ammonia Process [98]. γ-Al2O3 has been reported to be a less suitable support for Ru catalysts in ammonia synthesis due to its high electronegativity [99], thus preferring alkali oxides, even though the adoption of suitable alumina support treatments could facilitate the development of Ru-based catalysts [100]. In any case, our data essentially confirm that all Ru/Al2O3 tested catalysts exhibit low-temperature and pressure ammonia synthesis activity. A second possibility is represented by the reduction of nitrate ions residual from the catalyst precursor to ammonia, as recently reported to occur on Ru supported over metal oxides [101] in the liquid phase. Fig. 4 displays the FT-IR absorbance profile of gaseous ammonia at 930 cm−1, along with the corresponding time and temperature data, during the catalyst pretreatment step for all investigated catalysts. Catalysts subjected to similar pretreatment conditions exhibited comparable qualitative ammonia profiles. Moreover, in each case, those prepared with ethanol demonstrate higher activity in NH3 production, except for 0.5 Ru/A_E_R2 (Fig. 4, c), which displayed relatively equal evolution profiles, independently of the used solvent. For Cal-R1 samples, where according to IR spectra, the precursor has been fully decomposed, ammonia is produced at the maximum temperature (773 K) and upon reactor cooling and this might be attributed to occurrence of the gas phase reaction (9), in line with the profiles reported in Fig. 5 where no NOx species are observed in the entire temperature range. A different situation is observed in the case of R1 samples, where a double contribution in terms of temperature is observed, with a former one observed in the temperature range 520–773 K and a latter one at 773 K, irrespective of solvent choice. Below 520 K, with a maximum at 470–480 K, N2O and NO appear as gas species with a slightly increased temperature (10 K) for 0.5Ru/A_W_R1, while remarkable amounts of NO2 are not observed. When N2O absorbance is reduced close to zero, NO is still arising from thermal treatment in H2 and, in particular, on the E-sample; NH3 starts to be produced, suggesting the occurrence of the following reaction on the W- sample and to a limited extent on the E- one, (10) NO + 5/2 H2 ⇌ NH3 + H2O where partially reduced Ru favors the successive hydrogenation of NO to ammonia as reported in the literature [102] for 1 %Ru/SiO2-Al2O3, and where H2 was reported to increase NO reduction to NH3 in CO/CO2/H2O containing atmospheres. The feature shown appears to be a function of the chosen solvent and is more remarkable for ethanol, in line with the delayed profile obtained for NOx. The high-temperature component has no dependence on the solvent choice and mostly follows the behavior observed for Cal-R1, even though with lower activity, 0.06 vs. 0.10 in terms of maximum achieved absorbance. In the case of R2 reduction, NOx species are characterized by the presence of NO2, N2O, and NO diluted in nitrogen, suggesting that in a pure inert atmosphere, NO gas can interact with 0.01–5 wt% Ru/Al2O3 with the formation of a complex mix of species including nitrite, nitrate and nitrosyl complex [103] where the role of the support might play a relevant role [104]. Also in this case, at the maximum temperature and upon H2 introduction, NH3 is detected in accordance with the above-discussed data for the 773 K step. This is in line with the thermodynamic equilibrium forecast in ammonia synthesis, at stoichiometric conditions and at low pressure [105,106]. 3.2.2 Catalytic activity in CO2 hydrogenation In Figs. 4S and 5S, the most relevant data obtained by GC and IR during CO2 hydrogenation experiments are separately introduced, while in Fig. 6, their averaged values are reported. For reader’s convenience a summary of catalytic results is also available in Table 2S. In particular, in the ascending experiment, all catalysts were inactive at the minimum temperature but reached the forecasted thermodynamic equilibria at 773 K (except 0.5Ru/A_W_Cal-R1), and similar conversions with 0.5Ru/A_W_R2 were observed at 623 K with slightly different methane yields. Above 623 K, the catalytic performance remarkably changed. R2 reduced samples kept high CO2 conversion, even though the catalyst labeled as 0.5Ru/A_E_R2, prepared using ethanol and directly reduced under condition R2, exhibited the highest level of activity and selectivity with a negligible deactivation (above 673 K) in steady state; best performance in terms of methane yield has been obtained at 723 K with 70 % yield vs. 75 % CO2 conversion. Moreover, the parent water-prepared catalyst, despite similar CO2 conversion, was slightly less selective to methane, with a slightly higher CO production. R1 pre-reduced samples appeared to be less active than R2 samples, and their activity is comparable with 0.5Ru/A_E_Cal-R1, even though the methane yield is 25 % lower than the one achieved with R2 pretreatment and is less active than 0.5Ru/A_E_Cal-R1. Conversely, the catalyst prepared in water, subjected to pre-calcination, and then reduced under condition R1 (0.5Ru/A_W_Cal-R1), demonstrated the least activity among others. In the decreasing temperature experiment, slight deactivation has been observed for 0.5Ru/A_E_R2 and 0.5Ru/A_E_Cal-R1, while a remarkable deactivation has been observed for 0.5Ru/A_W_R1 and 0.5Ru/A_W_R2, mainly occurring as a loss in terms of conversion and in CH4 yield, with an increased CO production. Negligible deactivation has been observed for 0.5Ru/A_E_R1. Overall, the Ru/Al2O3 catalysts prepared with ethanol not only exhibited superior activity but also demonstrated enhanced stability during the descending mode. Furthermore, when considering the pre-treatment conditions, it appears that condition R2 was more effective than Cal-R1 and R1 in terms of their impact on selectivity, and only for R1 in terms of stability (Fig. 3S). The above-discussed results, including slight deactivation at low temperature, could play well with the results obtained upon CO hydrogenation over Ru/Al2O3 catalysts [107], indeed more relevant for R1 and Cal-R1 samples. In fact, these data might be supported by the CO and CH4 profiles obtained for the selected catalysts, reported in Fig. 6S and Fig. 7S, respectively. Indeed, as a function of the selected solvent and adopted prereduction procedure, the catalysts showed deactivation mainly in the increasing temperature experiment, at both low and high temperatures, with a quite remarkable trend for the R1 catalysts and in particular for methane production, followed by Cal-R1 samples, for both methane and CO, and R2 ones, in line with above discussed results. Moreover, the catalysts prepared with water (Cal-R1 and R2) exhibited activation in CO production and deactivation in CH4 during the temperature test conducted at a temperature range of 723–773 K. To delve deeper in the analysis of deactivation and verify the activity scale proposed also upon the increasing temperature experiment, we performed a data refining. For this purpose, the methane molar concentration has been fitted with an exponential decay function, giving rise to the Eq. (11) [108]: (11) CCH4 = CCH4,qss + A exp(R0*t) where CCH4 is the methane concentration in mol/mL on a dry basis at time t; CCH4,qss is the methane concentration in mol/mL on a dry basis at the final point; A is a pre-exponential factor in mol/mL, and R0 is expressed in s−1. The results, reported in Table S3, confirmed the previously discussed observations with a CCH4,qss higher for more active catalysts and with an average estimated deactivation time ranging between 555 and 1480 s When operating at low temperatures and in conditions close to the differential reactor hypothesis, the estimation of apparent activation energies can be approached, and estimated values are included in Table 1. In the case of 2Ni/A_E, despite having only a 2 wt% nickel loading, the obtained result (Ea = 84 kJ/mol) aligns well with findings for Ni/Al2O3 [27,32,109,110], even though in those cases, the Ni loading ranges from 10 to 30 wt%. For the Ru/A series, the results for the evaluated apparent activation energy align with the literature findings (Table 1), which typically fall within the range of 60–90 kJ/mol for Ru loadings between 0.5 and 5 wt% on alumina. In particular, for the calcined samples, the data agree well with the 0.5 % Ru-alumina datum reported by Szanyi et al. [111]. On the R2 reduced samples, the reaction orders for CO2 and H2 have been evaluated to be 0 and 0.43–0.44, respectively. These values are in line with data reported in the literature [14,112,113], although the CO2 reaction order showed a more relevant experimental uncertainty (±0.1). By looking at the catalytic activity and deactivation refinement results shown in Fig. 6 for the tested Ru/Al2O3 catalysts, the effect of solvent selection and pretreatment conditions on the activity of the catalysts underlines that the most active and robust catalysts in CO2 methanation are those that produce less NH3 upon in situ reduction. 3.2.3 Catalytic activity in operando conditions The most interesting material, i.e., 0.5Ru/A_E_R2, has been investigated under operando conditions for COx methanation using a 1:1 mixture, pure CO2, and pure CO, to clarify eventual differences between commercial and homemade catalysts [16]. The corresponding spectra versus time are reported below and in ESI (Fig. 7 and Fig. 8S). Upon introduction of the mixed COx methanation flow, several bands appear and evolve with time; at time t = 0.0 min, reactants are fed and after 0.4 min carbonyl species with a complex feature centered at 1980 cm−1 (Fig. 7b) appears (Ru-carbonyls) together with bands at 3610, 1657, 1438 and 1228 cm−1 due to OH stretching, asymmetric and symmetric OCO-stretching and OH deformation vibrations of the adsorbed monohydrogencarbonate ions species, typically formed by CO2 adsorption on hydroxylated alumina [14,114], with other bands also growing in the OH stretching region. Meanwhile, MS recorded a reduction of fragment at m/z = 2, probably due to the parallel occurring H2 dissociative adsorption reaction [16]; monohydrogencarbonate bands steadily increase their intensity over time. In parallel, after 0.49 min, perturbation of the OH stretching band at 3768 cm−1 (due to surface hydroxy-groups of alumina) is observed (it appears as a negative band in the subtracted spectrum), with the growth of the OH band at 3601 cm−1. (Fig. 7d). A close look at the spectra pointed out the presence of a shoulder at 1470 cm−1, suggesting the formation of another family of hydrogencarbonates, whose associated vibrations overlap with the aforementioned bands of the main feature. However, the band at 1470 cm−1 could be the evidence of the formation of methoxy species (CH3 asymmetric deformation), which was reported to act as an intermediate in the methanation of formates produced from CO hydrogenation over Ni/Al2O3. It has been shown that surface methoxides, even produced from methanol, are easily converted to methane over transition metal supported catalysts [115]. According to the proposed model of alumina of Busca et al., this converges with the idea that monohydrogencarbonates are formed by reaction of CO2 with the alumina hydroxy groups absorbing at 3768 cm−1, i.e., terminal OH’ over tetrahedral-like Al ions and near a vacancy (Fig. 7d, IA sites) [88,116], with a possible contribution of IB. Interestingly, in the 3750–3500 cm−1 region, there is an increase of band intensities (ν(OH) of type IIA, type III and H-bonded species) with a broad decaying behavior at lower wavenumbers; this can be attributed to hydroxylation of alumina surface that plays well with the delay in the m/z = 18 observation, that occurs when the maximum intensity is achieved on the surface. This indicates that water is formed, implying that COx reduction by hydrogen is occurring. At the same time of monohydrogencarbonates, a complex carbonyl band growths with at least two features at 2028 cm−1 and 1980 cm−1, and then giving rise to three bands at 2059, 2024, and 1972 cm−1, with relative intensities changing upon time evolution; a deconvolution of the spectra suggests the possibility to identify up to six bands, with a quite complex behavior that is still matter of debate in the literature. Shading light on this point, spectroscopic data for CO adsorption on Ru(0001) plane monocrystal face [117,118] show that CO adsorbs on top with a CO stretching of near 1980 cm−1 at the lowest coverages, shifting up to 2060–2080 cm−1 at the higher ones, due to coupling effects. A similar situation occurs on the stepped Ru(109) face, where CO linearly adsorbs and its CO stretching vibration shifts from 1973 cm−1 at the lowest coverages to 2063 cm−1 at saturation coverage [119]. We may also remark that the IR spectrum of Ru3(CO)12, triruthenium dodecacarbonyl, where all carbonyl species are terminal, shows bands at 2066, 2032, 2005, and 1985 cm⁻¹ due to couplings of the three Ru(CO)4 groups [120]. Bands in the region 2140–1980 cm−1 were also attributed to cationic monoruthenium polycarbonyl species such as [Ru(CO)4]2- and [Ru(CO)3]2- [121]. [Ru(CO)2]3+ [122] and [Ru(CO)2]2+ [123] and are formed by decomposition of Ru3(CO)12 on γ-Al2O3, supposed to produce monoruthenium polycarbonyl species [120]. As reviewed years ago by Hadjiivanov et al. [123], CO adsorbs exclusively linearly over ruthenium species supported on oxides. In fact, bridging CO on ruthenium centers, absorbing < 1950 cm−1, seems to be quite unusual in both neutral and cationic complexes [124], where most bands are observed > 2050 cm−1, although they may exist in complexes [124]. Similarly, CO adsorbed on relatively high-loading Ru/Al2O3 catalysts shows a main C-O stretching shifting from approx. 1990 cm−1 to 2037 cm−1 at increasing coverage, which might be attributed to the on-top CO interaction with large metal particles [14]. However, for low loading Ru/Al2O3 or after breaking of ruthenium particles [125], CO stretching bands at higher frequency are commonly found, suggesting that cationic Ru (poly)carbonyls may be formed. Thus, considering the low loading of our sample and the apparent good dispersion of ruthenium species, as well as the absence of significant shift of CO bands with coverage, we can tentatively attribute the bands we observe at 2024 and 2059 cm−1 and above to terminal CO, as mono- or poly-carbonyl species, on isolated ruthenium particles or very small clusters, and the component at 1972–1980 cm−1 to weaklier held CO on larger clusters. Only at the final time of the experiment, a weak emerging shoulder at 1839 cm−1 can be glimpsed, suggesting a partial surface reconstruction, maybe producing a bridging CO species. A broad band centered at 1763 cm−1, appearing during the first stages of CO and CO2 introduction, could be tentatively assigned to the so-called “organic-like” carbonates that have been really identified as strongly perturbed CO2 molecules [126]. Above 0.9 min, three sharp new bands appear at 1377, 1393, and 1593 cm−1 associated with the symmetric OCO-stretching, CH-deformation, and asymmetric OCO-stretching of formates, whose intensity increases with time on stream, with the corresponding band at 2930 cm−1 assigned to the C-H stretching vibration (Fig. 7a) and c)). A close look at the spectra pointed out the presence of two formate species with the observed second component of the OCO-stretching at 1384 and 1533 cm−1, supporting the hypothesis of two different species that evolve upon time on the surface (group I and II), in line with the observation of formyl species on ZnO [127]. Interestingly, methane started to be formed when carbonyls and both monohydrogencarbonate families started to be present at the surface and following the mechanism passing through monohydrogencarbonates-formates proposed in the literature [40,128]. In addition, the above presented data support the idea of strongly bonded adsorbed CO that competes with H2 adsorption producing catalyst passivation more than deactivation, because, in the present case, no carboxylate nor CxHy species in relevant amounts were observed, but the appearance of bands at 2154 and 2159 cm−1 might support either the unlikely occurrence of a slight ruthenium oxidation or the evidence of a small release of Ru carbonyls in the gas phase [124]; in any case, this cannot exclude a limited carbon deposit on the catalysts upon the present experiment. The whole set of data supports the idea that, even in this case, the mechanisms proposed by Falbo and coworkers [40] for COx hydrogenation ( Scheme 1) could be considered still valid, even with a different reason for catalyst deactivation. In the Ni/Al2O3 case, according to literature available operando results [129] the observed species are apparently the same we detected in Ru-case, even though formates appear already at the beginning of the experiment, where monohydrogencarbonates are not observed, followed then by carbonate species. This suggests a possible modification of the reported mechanism that however has been not explicitly verified on the materials investigated in this study. Surface and MS profiles, upon the removal of CO (so CO2 methanation) from the reactant feed, are reported in Fig. 8 and Fig. 9S. It can be noticed that, as expected, gaseous phase CO decreases, showing the negative behavior centered in correspondence with the CO gas fingerprint at 2143 cm−1, replaced by CO2. Interestingly, first a slight increase of monohydrogencarbonate features is observed, followed by their consumption, bringing the characteristic bands (1648, 1440, 1229 cm−1) negative (Fig. 8b). This suggests that we achieved their maximum concentration at the surface with limited changes in the timeframe of the experiment; in parallel, the group I formates showed an increase of their characteristic bands over time with features centered at 1393, 1373, and 1594 cm−1, suggesting the occurrence of the hydrogenation of monohydrogencarbonate species, as it is also confirmed by the presence of isosbestic points in Fig. 8b and by the global profile of band intensities (Fig. 8c). However, quite relevant differences are observed in the carbonyl region with the disappearance of features at 2066 and 2036 cm−1 that well match with an increase in methane production on MS, and a growth in intensity of the band at 1960 cm−1 with a possible broad shoulder at 2000 cm−1 (Fig. 8d), that support the idea of ruthenium carbonyls produced at low CO coverage. The position and relative intensities of the observed bands are slightly different than those observed by Falbo et al. [40] in line with the different nature and preparation of the present sample. In this case, in line with the described surface chemistry, the perturbation in the OH groups appears to be slightly lowered with respect to the previous case, but still with a decrease of the type I A hydroxyls at 3764 cm−1 as in the previous case. As a consequence, these sites can be considered as the active centers for this transformation. It is worth pointing out that, during the experiment, the methane profile (m/z = 15) reached the steady-state conditions with an increased intensity, in agreement with literature [40]. Ultimately, CO2 has been stopped and replaced by CO; the operando results are reported in Fig. 9. The switch from CO2 to CO produces the disappearance of monohydrogencarbonates, as indeed expected, due to the absence of CO2 in the gas phase, and suggesting that they are hydrogenated to formates, as confirmed by the constant growth of the latter over time (Figs. 9a and 9b). On the other hand, the carbonyl species also change with the unaffected broad component at 1967 cm−1 and the appearance of a small feature at 1957 cm−1, together with the band at 2036 cm−1, even though the presence of a component at 2076 cm−1 cannot be excluded (Fig. 9c). This supports the fact that atomically distributed Ru metal strongly interacts with CO adsorbed on top by limiting H2 dissociation and thus reducing methane production, in line with MS acquisition and previous literature reports [40,128] and with the absence of a relevant interaction with water vapour at the surface (OH group region not shown). 3.2.4 Characterization of spent catalysts In addition to the above-discussed results, Fig. 10 illustrates the diffraction patterns of both spent Ru-based catalysts (post-reduction and catalytic activity), while calcined alumina is reported in Fig. 1. In all cases, the diffraction pattern of γ-alumina is mainly present, even though some amorphization occurs, such as in the cases of 0.5Ru/A_W_R2 and 0.5Ru/A_E_R2, where it is even more marked. For some of the investigated samples, metallic ruthenium with crystalline prototype hP2-Mg appears well defined, while for those not showing them, it is worth noting that its presence cannot be excluded due to the low amount of Ru (0.5 wt%). These results are consistent with our previous research [14]. However, in the case of 0.5 Ru/A_E_Cal-R1 and 0.5 Ru/A_W_ R1, the most prominent peaks of metallic Ru at 2θ = 38.2, 42.2, 44.0, 58.7, 69.4, and 78.4 are always evident, while for 0.5 Ru/A_W_Cal-R1, there is no clear evidence. Figs. 11 and 12 report FE-SEM images of Ru catalyst groups subjected to the methanation test (exhausted catalysts) after treatment with R1, R2, and Cal-R1, respectively. Upon analyzing the outcomes, it becomes clear that in all cases, the overall surface morphology of alumina remained quite similar, therefore it can be considered mostly unaffected for R1 and R2. However, a difference can be evidenced, and the distinguishing factor lies in the solvents used during catalyst preparation. In fact, in the case of catalysts prepared with ethanol and subjected to either R1 or R2 conditions, Ru nanoparticles remain undetectable (as they are smaller than the detection limit of the analysis, i.e. 5 nm). Conversely, in catalysts prepared with water, Ru nanoparticles are clearly observable with an increased inhomogeneity in the case of 0.5 Ru/A_W_ R1, in agreement with above discussed XRD data. Significant differences in morphology and size of Ru nanoparticles become particularly noticeable when subjected to the Cal-R1 condition. For the sake of comparison, the fresh calcined samples are also reported in Fig. 10S, supporting the quite remarkable inhomogeneity in terms of Ru distribution. As evident from the images in Fig. 12, both catalysts that underwent Cal-R1 treatment, regardless of whether they were prepared with ethanol or water, exhibited a wide range of Ru nanoparticles, falling in two distinct two ranges: a former in 10–50 nm and a latter one ∼200 nm or more, in line with the dispersion observed in the freshly calcined materials. These findings align with the existing literature, which underscores that the oxidation treatment of supported ruthenium catalysts disrupts the interactions between the support and the active phase, resulting in a rapid sintering [15,80–82] . Moreover, it is known that Ru particle size can significantly affect catalytic activity. Ru nanoparticles have shown a structure sensitive behavior in CO Fischer Tropsch when particle sizes are lower than 10 nm on Ru/Al2O3 catalysts [120] and in CO methanation [130] on Ru/C catalysts (4–8 nm size), while this effect has been not clearly pointed out in the case of ammonia synthesis [131]. Thus, according to the cited literature, the catalytic activity of Ru is often structure-sensitive in hydrogenation but this is not clearly and extensively addressed for CO2 hydrogenation, thus hindering also an additional deep discussion. In fact, there is no universal optimal size and possibly shape; as an example, in CO2 methanation over Ru/TiO2 catalysts, peak activity has been reported at particle sizes of ∼3 nm [132], suggesting that previous discussion on hydrogenation might be extended also to Sabatier’s reaction and agrees with our findings, where the best ethanol-based catalyst treated under R2 conditions showed Ru particle sizes below 5 nm. It should be noted that, as already reported in our previous works [14,32], no coke formation was observed in our experiments conducted over a 6-hour timescale, as evidenced by FE-SEM and XRD studies. 4 Conclusion In this work, the catalytic performance of Ni/Al2O3 and Ru/Al2O3 catalysts in CO2 hydrogenation was studied, with an emphasis on the crucial roles of solvent selection and pretreatment conditions, as a part of systematic studies of these systems. 13.6 wt% Ni/Al2O3 prepared with ethanol as solvent demonstrated superior methane production during the ascending phase, while the water-prepared one performed slightly better during the descending phase, thus suggesting a limited impact of the solvent on catalysts performances. A reduction of the Ni loading down to 2 wt% resulted in a decreased methane yield and increased selectivity to CO, produced through rWGS reaction. In the case of Ru/Al2O3 catalysts, the choice of solvent and pretreatment conditions significantly influenced the catalytic activity and selectivity. Ethanol-prepared catalysts exhibited higher activity, particularly 0.5Ru/A_E_R2, which showed the highest level of activity. The pretreatment condition of R2 proved to be the most effective, ensuring an acceptable catalyst stability also in the descending phase. Characterizations of Ru-based catalysts, including in-situ reduction, revealed insights into ammonia and NOx productions that are affected by solvent selection and pretreatment conditions. In the morphological characterizations, differences in Ru nanoparticle sizes were observed based on solvent and pretreatment, with appreciable sintering effects in catalysts already upon calcination. The assessment of kinetic parameters of CO2 hydrogenation, focusing on apparent activation energy (Ea), revealed a consistent behavior among Ru-based catalysts that underwent the same heat treatment and reduction conditions, regardless of the solvent used. Operando studies in COx/CO/CO2 streams supported the monohydrogencarbonate–formate–carbonyl route for COx hydrogenation at the temperature of 523 K, evidencing the existence of two monohydrogencarbonate and formates species produced on the alumina surface, on specific sites; as well, a different distribution of the carbonyl species is detected and contribute to the activity and selectivity of the best performing material obtained in present conditions. CRediT authorship contribution statement Guido Busca: Writing – review & editing, Validation, Data curation. Marco Daturi: Writing – review & editing, Supervision, Methodology, Data curation. Paola Riani: Writing – review & editing, Supervision, Project administration, Data curation, Conceptualization. Elena Spennati: Writing – review & editing, Writing – original draft, Methodology, Investigation, Formal analysis, Data curation. Sina Ebrahim Atakoohi: Writing – original draft, Investigation, Formal analysis. Gabriella Garbarino: Writing – review & editing, Validation, Supervision, Project administration, Methodology, Funding acquisition, Data curation, Conceptualization. Declaration of Competing Interest The authors declare the following financial interests/personal relationships which may be considered as potential competing interests: Gabriella Garbarino reports financial support was provided by European Commission. If there are other authors, they declare that they have no known competing financial interests or personal relationships that could have appeared to influence the work reported in this paper. Acknowledgements GG and ES acknowledge the Project funded under the National Recovery and Resilience Plan (NRRP), Mission 4 Component 2 Investment 1.3 - Call for tender No. 1561 of 11. 10. 2022 of Ministero dell’Università e della Ricerca (MUR); funded by the European Union – NextGenerationEU, PE0000021, “Network 4 Energy Sustainable Transition – NEST”. SEA acknowledges the University of Genova and the Department of Civil, Chemical and Environmental Engineering (DICCA) for the funding to carry out the research period at Université de Caen Normandie, ENSICAEN, CNRS, Laboratoire Catalyse et Spectrochimie (LCS). ES acknowledges the University of Genova for the mobility grant under the DR. 1148 signed on 22/03/19 to carry out the research period at Université de Caen Normandie, ENSICAEN, CNRS, Laboratoire Catalyse et Spectrochimie (LCS). Appendix A Supporting information Supplementary data associated with this article can be found in the online version at doi:10.1016/j.apcata.2025.120625. Appendix A Supplementary material Supplementary material References [1] M. Götz J. Lefebvre F. Mörs A. McDaniel Koch F. Graf S. Bajohr R. Reimert T. Kolb Renewable power-to-gas: a technological and economic review Renew. Energy 85 2016 1371 1390 10.1016/j.renene.2015.07.066 M. Götz, J. Lefebvre, F. Mörs, A. McDaniel Koch, F. Graf, S. Bajohr, R. Reimert, T. Kolb, Renewable Power-to-Gas: A technological and economic review, Renew Energy 85 (2016) 1371–1390. https://doi.org/10.1016/j.renene.2015.07.066. [2] G. Glenk P. Holler S. Reichelstein Advances in power-to-gas technologies: cost and conversion efficiency Energy Environ. Sci. 16 2023 6058 6070 10.1039/D3EE01208E G. Glenk, P. Holler, S. Reichelstein, Advances in power-to-gas technologies: cost and conversion efficiency, Energy Environ Sci 16 (2023) 6058–6070. https://doi.org/10.1039/D3EE01208E. [3] J. Ferrari Renewable fuels for long-term energy storage Electric Utility Resource Planning 2021 Elsevier 109 138 10.1016/B978-0-12-819873-5.00004-6 J. Ferrari, Renewable fuels for long-term energy storage, in: Electric Utility Resource Planning, Elsevier, 2021: pp. 109–138. https://doi.org/10.1016/B978-0-12-819873-5.00004-6. [4] G. Centi E.A. Quadrelli S. Perathoner Catalysis for CO2 conversion: a key technology for rapid introduction of renewable energy in the value chain of chemical industries Energy Environ. Sci. 6 2013 1711 10.1039/c3ee00056g G. Centi, E.A. Quadrelli, S. Perathoner, Catalysis for CO2 conversion: a key technology for rapid introduction of renewable energy in the value chain of chemical industries, Energy Environ Sci 6 (2013) 1711. https://doi.org/10.1039/c3ee00056g. [5] S. Ullah Y. Gao L. Dou Y. Liu T. Shao Y. Yang A.B. Murphy Recent trends in Plasma-Assisted CO2 methanation: a critical review of recent studies Plasma Chem. Plasma Process. 43 2023 1335 1383 10.1007/s11090-023-10417-9 S. Ullah, Y. Gao, L. Dou, Y. Liu, T. Shao, Y. Yang, A.B. Murphy, Recent Trends in Plasma-Assisted CO2 Methanation: A Critical Review of Recent Studies, Plasma Chemistry and Plasma Processing 43 (2023) 1335–1383. https://doi.org/10.1007/s11090-023-10417-9. [6] M.U. Sieborg J.M.S. Oliveira L.D.M. Ottosen M.V.W. Kofoed Flue-to-fuel: bio-integrated carbon capture and utilization of dilute carbon dioxide gas streams to renewable methane Energy Convers. Manag. 302 2024 118090 10.1016/j.enconman.2024.118090 M.U. Sieborg, J.M.S. Oliveira, L.D.M. Ottosen, M.V.W. Kofoed, Flue-to-fuel: Bio-integrated carbon capture and utilization of dilute carbon dioxide gas streams to renewable methane, Energy Convers Manag 302 (2024) 118090. https://doi.org/10.1016/j.enconman.2024.118090. [7] C.-C. Cormos M. Dragan L. Petrescu A.-M. Cormos S. Dragan A.-M. Bathori S.-C. Galusnyak Synthetic natural gas (SNG) production by biomass gasification with CO2 capture: techno-economic and life cycle analysis (LCA) Energy 312 2024 133507 10.1016/j.energy.2024.133507 C.-C. Cormos, M. Dragan, L. Petrescu, A.-M. Cormos, S. Dragan, A.-M. Bathori, S.-C. Galusnyak, Synthetic natural gas (SNG) production by biomass gasification with CO2 capture: Techno-economic and life cycle analysis (LCA), Energy 312 (2024) 133507. https://doi.org/10.1016/j.energy.2024.133507. [8] A. Bolt I. Dincer M. Agelin-Chaab A critical review of synthetic natural gas production techniques and technologies J. Nat. Gas. Sci. Eng. 84 2020 103670 10.1016/j.jngse.2020.103670 A. Bolt, I. Dincer, M. Agelin-Chaab, A critical review of synthetic natural gas production techniques and technologies, J Nat Gas Sci Eng 84 (2020) 103670. https://doi.org/10.1016/j.jngse.2020.103670. [9] K. Lee P. Sun A. Elgowainy K.H. Baek P. Bobba Techno-economic and life cycle analysis of synthetic natural gas production from low-carbon H2 and point-source or atmospheric CO2 in the United States J. CO2 Util. 83 2024 102791 10.1016/j.jcou.2024.102791 K. Lee, P. Sun, A. Elgowainy, K.H. Baek, P. Bobba, Techno-economic and life cycle analysis of synthetic natural gas production from low-carbon H2 and point-source or atmospheric CO2 in the United States, Journal of CO2 Utilization 83 (2024) 102791. https://doi.org/10.1016/j.jcou.2024.102791. [10] E. Spennati P. Riani G. Garbarino A perspective of lanthanide promoted Ni-catalysts for CO2 hydrogenation to methane: catalytic activity and open challenges Catal. Today 418 2023 10.1016/j.cattod.2023.114131 E. Spennati, P. Riani, G. Garbarino, A perspective of lanthanide promoted Ni-catalysts for CO2 hydrogenation to methane: catalytic activity and open challenges, Catal Today 418 (2023). https://doi.org/10.1016/j.cattod.2023.114131. [11] D. Bellotti M. Rivarolo L. Magistri A.F. Massardo Thermo-economic comparison of hydrogen and hydro-methane produced from hydroelectric energy for land transportation Int. J. Hydrog. Energy 40 2015 2433 2444 10.1016/j.ijhydene.2014.12.066 D. Bellotti, M. Rivarolo, L. Magistri, A.F. Massardo, Thermo-economic comparison of hydrogen and hydro-methane produced from hydroelectric energy for land transportation, Int J Hydrogen Energy 40 (2015) 2433–2444. https://doi.org/10.1016/j.ijhydene.2014.12.066. [12] J. Gao Y. Wang Y. Ping D. Hu G. Xu F. Gu F. Su A thermodynamic analysis of methanation reactions of carbon oxides for the production of synthetic natural gas RSC Adv. 2 2012 2358 2368 10.1039/c2ra00632d J. Gao, Y. Wang, Y. Ping, D. Hu, G. Xu, F. Gu, F. Su, A thermodynamic analysis of methanation reactions of carbon oxides for the production of synthetic natural gas, RSC Adv 2 (2012) 2358–2368. https://doi.org/10.1039/c2ra00632d. [13] E. Giglio R. Pirone S. Bensaid Dynamic modelling of methanation reactors during start-up and regulation in intermittent power-to-gas applications Renew. Energy 170 2021 1040 1051 10.1016/j.renene.2021.01.153 E. Giglio, R. Pirone, S. Bensaid, Dynamic modelling of methanation reactors during start-up and regulation in intermittent power-to-gas applications, Renew Energy 170 (2021) 1040–1051. https://doi.org/10.1016/j.renene.2021.01.153. [14] G. Garbarino D. Bellotti E. Finocchio L. Magistri G. Busca Methanation of carbon dioxide on Ru/Al2O3: catalytic activity and infrared study Catal. Today 277 2016 21 28 10.1016/j.cattod.2015.12.010 G. Garbarino, D. Bellotti, E. Finocchio, L. Magistri, G. Busca, Methanation of carbon dioxide on Ru/Al2O3: Catalytic activity and infrared study, Catal Today 277 (2016) 21–28. https://doi.org/10.1016/j.cattod.2015.12.010. [15] A. Porta L. Falbo C.G. Visconti L. Lietti C. Bassano P. Deiana Synthesis of Ru-based catalysts for CO2 methanation and experimental assessment of intraporous transport limitations Catal. Today 343 2020 38 47 10.1016/j.cattod.2019.01.042 A. Porta, L. Falbo, C.G. Visconti, L. Lietti, C. Bassano, P. Deiana, Synthesis of Ru-based catalysts for CO2 methanation and experimental assessment of intraporous transport limitations, Catal Today 343 (2020) 38–47. https://doi.org/10.1016/j.cattod.2019.01.042. [16] L. Falbo M. Martinelli C.G. Visconti L. Lietti C. Bassano P. Deiana Kinetics of CO2 methanation on a Ru-based catalyst at process conditions relevant for Power-to-Gas applications Appl. Catal. B 225 2018 354 363 10.1016/j.apcatb.2017.11.066 L. Falbo, M. Martinelli, C.G. Visconti, L. Lietti, C. Bassano, P. Deiana, Kinetics of CO2 methanation on a Ru-based catalyst at process conditions relevant for Power-to-Gas applications, Appl Catal B 225 (2018) 354–363. https://doi.org/10.1016/j.apcatb.2017.11.066. [17] M.S. Duyar A. Ramachandran C. Wang R.J. Farrauto Kinetics of CO2 methanation over Ru/γ-Al2O3 and implications for renewable energy storage applications J. CO2 Util. 12 2015 27 33 10.1016/j.jcou.2015.10.003 M.S. Duyar, A. Ramachandran, C. Wang, R.J. Farrauto, Kinetics of CO2 methanation over Ru/γ-Al2O3 and implications for renewable energy storage applications, Journal of CO2 Utilization 12 (2015) 27–33. https://doi.org/10.1016/j.jcou.2015.10.003. [18] G. Garbarino P. Kowalik P. Riani K. Antoniak-Jurak P. Pieta A. Lewalska-Graczyk W. Lisowski R. Nowakowski G. Busca I.S. Pieta Improvement of Ni/Al2O3 catalysts for low-temperature CO2methanation by vanadium and calcium oxide addition Ind. Eng. Chem. Res. 60 2021 6554 6564 10.1021/acs.iecr.0c05556 G. Garbarino, P. Kowalik, P. Riani, K. Antoniak-Jurak, P. Pieta, A. Lewalska-Graczyk, W. Lisowski, R. Nowakowski, G. Busca, I.S. Pieta, Improvement of Ni/Al2O3catalysts for low-temperature CO2methanation by vanadium and calcium oxide addition, Ind Eng Chem Res 60 (2021) 6554–6564. https://doi.org/10.1021/acs.iecr.0c05556. [19] F. Koschany D. Schlereth O. Hinrichsen On the kinetics of the methanation of carbon dioxide on coprecipitated NiAl(O)x Appl. Catal. B 181 2016 504 516 10.1016/j.apcatb.2015.07.026 F. Koschany, D. Schlereth, O. Hinrichsen, On the kinetics of the methanation of carbon dioxide on coprecipitated NiAl(O)x, Appl Catal B 181 (2016) 504–516. https://doi.org/10.1016/j.apcatb.2015.07.026. [20] N.D.M. Ridzuan M.S. Shaharun M.A. Anawar I. Ud-Din Ni-based catalyst for carbon dioxide methanation: a review Catalysts 12 2022 469 N.D.M. Ridzuan, M.S. Shaharun, M.A. Anawar, I. Ud-Din, Ni-Based Catalyst for Carbon Dioxide Methanation: A Review, Catalysts 12 (2022) 469. [21] Clariant A.G., METH® 134 Catalyst for Methanation in Ammonia or Syngas Production, 2019. [22] topsoe, RNG | Methanation, n.d. [23] High temperature methanation Catalyst considerations Catal. Today 215 2013 233 238 10.1016/j.cattod.2013.03.035 High temperature methanation: Catalyst considerations, Catal Today 215 (2013) 233–238. https://doi.org/10.1016/j.cattod.2013.03.035. [24] Johnson Matthey, Methanation Technology | Johnson Matthey, Matthey.Com (2020). 〈https://matthey.com/products-and-markets/chemicals/methanation-technology〉. [25] J. VAHALA Methanation catalysts Int. Chem. Eng. 12 1971 60 68 VAHALA J., Methanation catalysts, Int Chem Eng 12 (1971) 60–68. [26] R.Y. Chein C.C. Wang Experimental study on CO2 methanation over ni/al2o3, Ru/Al2O3, and Ni-Ru/Al2O3 catalysts Catalysts 10 2020 1 17 10.3390/catal10101112 R.Y. Chein, C.C. Wang, Experimental study on co2 methanation over ni/al2o3, ru/al2o3, and ru-ni/al2o3 catalysts, Catalysts 10 (2020) 1–17. https://doi.org/10.3390/catal10101112. [27] A. Fasolini E. Spennati S. Ebrahim Atakoohi M. Percivale G. Busca F. Basile G. Garbarino A study of CO2 hydrogenation over Ni-MgAlOx catalysts derived from hydrotalcite precursors Catal. Today 423 2023 114271 10.1016/j.cattod.2023.114271 A. Fasolini, E. Spennati, S. Ebrahim Atakoohi, M. Percivale, G. Busca, F. Basile, G. Garbarino, A study of CO2 hydrogenation over Ni-MgAlOx catalysts derived from hydrotalcite precursors, Catal Today 423 (2023) 114271. https://doi.org/10.1016/j.cattod.2023.114271. [28] G. Busca E. Spennati P. Riani G. Garbarino Looking for an optimal composition of Nickel-Based catalysts for CO2 methanation Energies 16 2023 5304 10.3390/en16145304 G. Busca, E. Spennati, P. Riani, G. Garbarino, Looking for an Optimal Composition of Nickel-Based Catalysts for CO2 Methanation, Energies (Basel) 16 (2023) 5304. https://doi.org/10.3390/en16145304. [29] P. Riani E. Spennati M.V. Garcia V.S. Escribano G. Busca G. Garbarino Ni/Al2O3 catalysts for CO2 methanation: effect of silica and nickel loading Int. J. Hydrog. Energy 48 2023 24976 24995 10.1016/j.ijhydene.2023.01.002 P. Riani, E. Spennati, M.V. Garcia, V.S. Escribano, G. Busca, G. Garbarino, Ni/Al2O3 catalysts for CO2 methanation: Effect of silica and nickel loading, Int J Hydrogen Energy 48 (2023) 24976–24995. https://doi.org/10.1016/j.ijhydene.2023.01.002. [30] J. Xu G.F. Froment Methane steam reforming, methanation and water-gas shift: I. Intrinsic kinetics AIChE J. 35 1989 88 96 10.1002/aic.690350109 J. Xu, G.F. Froment, Methane steam reforming, methanation and water-gas shift: I. Intrinsic kinetics, AIChE Journal 35 (1989) 88–96. https://doi.org/10.1002/aic.690350109. [31] J.A. Martins A.C. Faria M.A. Soria C.V. Miguel A.E. Rodrigues L.M. Madeira CO2 methanation over Hydrotalcite-Derived Nickel/Ruthenium and supported ruthenium catalysts Catalysts 9 2019 1008 10.3390/catal9121008 J.A. Martins, A.C. Faria, M.A. Soria, C.V. Miguel, A.E. Rodrigues, L.M. Madeira, CO2 Methanation over Hydrotalcite-Derived Nickel/Ruthenium and Supported Ruthenium Catalysts, Catalysts 9 (2019) 1008. https://doi.org/10.3390/catal9121008. [32] G. Garbarino D. Bellotti P. Riani L. Magistri G. Busca Methanation of carbon dioxide on Ru/Al2O3 and Ni/Al2O3catalysts at atmospheric pressure: catalysts activation, behaviour and stability Int J. Hydrog. Energy 40 2015 9171 9182 10.1016/j.ijhydene.2015.05.059 G. Garbarino, D. Bellotti, P. Riani, L. Magistri, G. Busca, Methanation of carbon dioxide on Ru/Al2O3 and Ni/Al2O3 catalysts at atmospheric pressure: Catalysts activation, behaviour and stability, Int J Hydrogen Energy 40 (2015) 9171–9182. https://doi.org/10.1016/j.ijhydene.2015.05.059. [33] N. Gallandat R. Mutschler V. Vernay H. Yang A. Züttel Experimental performance investigation of a 2 kw methanation reactor Sustain Energy Fuels 2 2018 1101 1110 10.1039/C8SE00073E N. Gallandat, R. Mutschler, V. Vernay, H. Yang, A. Züttel, Experimental performance investigation of a 2 kW methanation reactor, Sustain Energy Fuels 2 (2018) 1101–1110. https://doi.org/10.1039/C8SE00073E. [34] E. Moioli A. Züttel A model-based comparison of Ru and Ni catalysts for the sabatier reaction Sustain Energy Fuels 4 2020 1396 1408 10.1039/c9se00787c E. Moioli, A. Züttel, A model-based comparison of Ru and Ni catalysts for the Sabatier reaction, Sustain Energy Fuels 4 (2020) 1396–1408. https://doi.org/10.1039/c9se00787c. [35] G. Garbarino P. Riani L. Magistri G. Busca A study of the methanation of carbon dioxide on Ni/Al2O3 catalysts at atmospheric pressure Int J. Hydrog. Energy 39 2014 11557 11565 10.1016/j.ijhydene.2014.05.111 G. Garbarino, P. Riani, L. Magistri, G. Busca, A study of the methanation of carbon dioxide on Ni/Al2O 3 catalysts at atmospheric pressure, Int J Hydrogen Energy 39 (2014) 11557–11565. https://doi.org/10.1016/j.ijhydene.2014.05.111. [36] W.L. Vrijburg G. Garbarino W. Chen A. Parastaev A. Longo E.A. Pidko E.J.M Hensen Ni-Mn catalysts on silica-modified alumina for CO2 methanation Journal of Catalysis 2020 358 371 https://doi.org/10.1016/j.jcat.2019.12.026 D. Méndez-Mateos, V.L. Barrio, J.M. Requies, M. Gil-Calvo, Graphene-based versus alumina supports on CO2 methanation using lanthanum-promoted nickel catalysts, Environmental Science and Pollution Research (2023). https://doi.org/10.1007/s11356-023-26324-7. [37] G. Garbarino C. Wang T. Cavattoni E. Finocchio P. Riani M. Flytzani-Stephanopoulos G. Busca A study of Ni/La-Al2O3catalysts: a competitive system for CO2 methanation Appl. Catal. B 248 2019 286 297 10.1016/j.apcatb.2018.12.063 G. Garbarino, C. Wang, T. Cavattoni, E. Finocchio, P. Riani, M. Flytzani-Stephanopoulos, G. Busca, A study of Ni/La-Al2O3 catalysts: A competitive system for CO2 methanation, Appl Catal B 248 (2019) 286–297. https://doi.org/10.1016/j.apcatb.2018.12.063. [38] P. Riani I. Valsamakis T. Cavattoni V. Sanchez Escribano G. Busca G. Garbarino Ni/SiO2-Al2O3 catalysts for CO2 methanation: effect of La2O3 addition Appl. Catal. B 284 2021 10.1016/j.apcatb.2020.119697 P. Riani, I. Valsamakis, T. Cavattoni, V. Sanchez Escribano, G. Busca, G. Garbarino, Ni/SiO2-Al2O3 catalysts for CO2 methanation: Effect of La2O3 addition, Appl Catal B 284 (2021). https://doi.org/10.1016/j.apcatb.2020.119697. [39] A. Quindimil U. De-La-Torre B. Pereda-Ayo A. Davó-Quiñonero E. Bailón-García D. Lozano-Castelló J.A. González-Marcos A. Bueno-López J.R. González-Velasco Effect of metal loading on the CO2 methanation: a comparison between alumina supported ni and ru catalysts Catal. Today 356 2020 419 432 10.1016/j.cattod.2019.06.027 A. Quindimil, U. De-La-Torre, B. Pereda-Ayo, A. Davó-Quiñonero, E. Bailón-García, D. Lozano-Castelló, J.A. González-Marcos, A. Bueno-López, J.R. González-Velasco, Effect of metal loading on the CO2 methanation: A comparison between alumina supported Ni and Ru catalysts, Catal Today 356 (2020) 419–432. https://doi.org/10.1016/j.cattod.2019.06.027. [40] L. Falbo C.G. Visconti L. Lietti J. Szanyi The effect of CO on CO2 methanation over Ru/Al2O3 catalysts: a combined steady-state reactivity and transient DRIFT spectroscopy study Appl. Catal. B 256 2019 117791 10.1016/j.apcatb.2019.117791 L. Falbo, C.G. Visconti, L. Lietti, J. Szanyi, The effect of CO on CO2 methanation over Ru/Al2O3 catalysts: a combined steady-state reactivity and transient DRIFT spectroscopy study, Appl Catal B 256 (2019) 117791. https://doi.org/https://doi.org/10.1016/j.apcatb.2019.117791. [41] A. Porta R. Matarrese C.G. Visconti L. Lietti Investigation of DFMs for CO2 capture and methanation by coupled microreactor experiments and FT-IR spectroscopy Energy Fuels 37 2023 7280 7290 10.1021/acs.energyfuels.3c00443 A. Porta, R. Matarrese, C.G. Visconti, L. Lietti, Investigation of DFMs for CO2 Capture and Methanation by Coupled Microreactor Experiments and FT-IR Spectroscopy, Energy and Fuels 37 (2023) 7280–7290. https://doi.org/10.1021/acs.energyfuels.3c00443. [42] C. Jeong-Potter A. Porta R. Matarrese C.G. Visconti L. Lietti R. Farrauto Aging study of low ru loading dual function materials (DFM) for combined power plant effluent CO2 capture and methanation Appl. Catal. B 310 2022 10.1016/j.apcatb.2022.121294 C. Jeong-Potter, A. Porta, R. Matarrese, C.G. Visconti, L. Lietti, R. Farrauto, Aging study of low Ru loading dual function materials (DFM) for combined power plant effluent CO2 capture and methanation, Appl Catal B 310 (2022). https://doi.org/10.1016/j.apcatb.2022.121294. [43] A. Porta R. Matarrese C.G. Visconti L. Castoldi L. Lietti Storage material effects on the performance of Ru-Based CO2 Capture and methanation dual functioning materials Ind. Eng. Chem. Res 60 2021 6706 6718 10.1021/acs.iecr.0c05898 A. Porta, R. Matarrese, C.G. Visconti, L. Castoldi, L. Lietti, Storage Material Effects on the Performance of Ru-Based CO2Capture and Methanation Dual Functioning Materials, Ind Eng Chem Res 60 (2021) 6706–6718. https://doi.org/10.1021/acs.iecr.0c05898. [44] A. Porta C.G. Visconti L. Castoldi R. Matarrese C. Jeong-Potter R. Farrauto L. Lietti Ru-Ba synergistic effect in dual functioning materials for cyclic CO2 capture and methanation Appl. Catal. B 283 2021 10.1016/j.apcatb.2020.119654 A. Porta, C.G. Visconti, L. Castoldi, R. Matarrese, C. Jeong-Potter, R. Farrauto, L. Lietti, Ru-Ba synergistic effect in dual functioning materials for cyclic CO2 capture and methanation, Appl Catal B 283 (2021). https://doi.org/10.1016/j.apcatb.2020.119654. [45] A. Porta C. Larghi L. Lietti C.G. Visconti Once-through CO2 hydrogenation to grid-compatible synthetic natural gas over a Ru-based catalyst at atmospheric pressure Catal. Today 442 2024 10.1016/j.cattod.2024.114907 A. Porta, C. Larghi, L. Lietti, C.G. Visconti, Once-through CO2 hydrogenation to grid-compatible synthetic natural gas over a Ru-based catalyst at atmospheric pressure, Catal Today 442 (2024). https://doi.org/10.1016/j.cattod.2024.114907. [46] M. Che C.O. Bennett The influence of particle size on the catalytic properties of supported metals Adv. Catal. 36 1989 55 172 10.1016/S0360-0564(08)60017-6 M. Che, C.O. Bennett, The Influence of Particle Size on the Catalytic Properties of Supported Metals, Advances in Catalysis 36 (1989) 55–172. https://doi.org/10.1016/S0360-0564(08)60017-6. [47] J.R.A. Sietsma A. Jos van Dillen P.E. de Jongh K.P. de Jong Application of Ordered Mesoporous Materials as Model Supports to Study Catalyst Preparation by Impregnation and Drying 2006 Elsevier Masson SAS 10.1016/S0167-2991(06)80895-5 J.R.A. Sietsma, A. Jos van Dillen, P.E. de Jongh, K.P. de Jong, Application of ordered mesoporous materials as model supports to study catalyst preparation by impregnation and drying, Elsevier Masson SAS, 2006. https://doi.org/10.1016/S0167-2991(06)80895-5. [48] P. Hongmanorom J. Ashok G. Zhang Z. Bian M.H. Wai Y. Zeng S. Xi A. Borgna S. Kawi Enhanced performance and selectivity of CO2 methanation over phyllosilicate structure derived Ni-Mg/SBA-15 catalysts Appl. Catal. B 282 2021 119564 10.1016/j.apcatb.2020.119564 P. Hongmanorom, J. Ashok, G. Zhang, Z. Bian, M.H. Wai, Y. Zeng, S. Xi, A. Borgna, S. Kawi, Enhanced performance and selectivity of CO2 methanation over phyllosilicate structure derived Ni-Mg/SBA-15 catalysts, Appl Catal B 282 (2021) 119564. https://doi.org/10.1016/j.apcatb.2020.119564. [49] M.C. Bacariza S. Amjad P. Teixeira J.M. Lopes C. Henriques Boosting ni dispersion on Zeolite-Supported catalysts for CO2 Methanation: the influence of the impregnation solvent Energy Fuels 34 2020 14656 14666 10.1021/acs.energyfuels.0c02561 M.C. Bacariza, S. Amjad, P. Teixeira, J.M. Lopes, C. Henriques, Boosting Ni Dispersion on Zeolite-Supported Catalysts for CO2Methanation: The Influence of the Impregnation Solvent, Energy and Fuels 34 (2020) 14656–14666. https://doi.org/10.1021/acs.energyfuels.0c02561. [50] Y. Yu Y.M. Chan Z. Bian F. Song J. Wang Q. Zhong S. Kawi Enhanced performance and selectivity of CO2 methanation over g-C3N4 assisted synthesis of Ni–CeO2 catalyst: kinetics and DRIFTS studies Int J. Hydrog. Energy 43 2018 15191 15204 10.1016/j.ijhydene.2018.06.090 Y. Yu, Y.M. Chan, Z. Bian, F. Song, J. Wang, Q. Zhong, S. Kawi, Enhanced performance and selectivity of CO2 methanation over g-C3N4 assisted synthesis of Ni–CeO2 catalyst: Kinetics and DRIFTS studies, Int J Hydrogen Energy 43 (2018) 15191–15204. https://doi.org/10.1016/j.ijhydene.2018.06.090. [51] Y. Yan Y. Dai Y. Yang A.A. Lapkin Improved stability of Y2O3 supported ni catalysts for CO2 methanation by precursor-determined metal-support interaction Appl. Catal. B 237 2018 504 512 10.1016/j.apcatb.2018.06.021 Y. Yan, Y. Dai, Y. Yang, A.A. Lapkin, Improved stability of Y2O3 supported Ni catalysts for CO2 methanation by precursor-determined metal-support interaction, Appl Catal B 237 (2018) 504–512. https://doi.org/10.1016/j.apcatb.2018.06.021. [52] Y. Yu Z. Bian F. Song J. Wang Q. Zhong S. Kawi Influence of calcination temperature on activity and selectivity of Ni–CeO2 and Ni–Ce0.8Zr0.2O2 catalysts for CO2 methanation Top. Catal. 61 2018 1514 1527 10.1007/s11244-018-1010-6 Y. Yu, Z. Bian, F. Song, J. Wang, Q. Zhong, S. Kawi, Influence of Calcination Temperature on Activity and Selectivity of Ni–CeO2 and Ni–Ce0.8Zr0.2O2 Catalysts for CO2 Methanation, Top Catal 61 (2018) 1514–1527. https://doi.org/10.1007/s11244-018-1010-6. [53] R.A. Ortega-Domínguez H. Vargas-Villagrán C. Peñaloza-Orta K. Saavedra-Rubio X. Bokhimi T.E. Klimova A facile method to increase metal dispersion and hydrogenation activity of Ni/SBA-15 catalysts Fuel 198 2017 110 122 10.1016/j.fuel.2016.12.037 R.A. Ortega-Domínguez, H. Vargas-Villagrán, C. Peñaloza-Orta, K. Saavedra-Rubio, X. Bokhimi, T.E. Klimova, A facile method to increase metal dispersion and hydrogenation activity of Ni/SBA-15 catalysts, Fuel 198 (2017) 110–122. https://doi.org/10.1016/j.fuel.2016.12.037. [54] C. Zhang Y.-M. Chai C.-G. Liu Effect of different precursor species on the metal dispersion of a Ni/γ-Al2O3 adsorbent for sulfur adsorption Appl. Petrochem. Res. 7 2017 33 40 10.1007/s13203-017-0176-3 C. Zhang, Y.-M. Chai, C.-G. Liu, Effect of different precursor species on the metal dispersion of a Ni/γ-Al2O3 adsorbent for sulfur adsorption, Appl Petrochem Res 7 (2017) 33–40. https://doi.org/10.1007/s13203-017-0176-3. [55] J. Ashok M.L. Ang S. Kawi Enhanced activity of CO2 methanation over Ni/CeO2-ZrO2 catalysts: influence of preparation methods Catal. Today 281 2017 304 311 10.1016/j.cattod.2016.07.020 J. Ashok, M.L. Ang, S. Kawi, Enhanced activity of CO2 methanation over Ni/CeO2-ZrO2 catalysts: Influence of preparation methods, Catal Today 281 (2017) 304–311. https://doi.org/10.1016/j.cattod.2016.07.020. [56] M. Tao X. Meng Y. Lv Z. Bian Z. Xin Effect of impregnation solvent on ni dispersion and catalytic properties of Ni/SBA-15 for CO methanation reaction Fuel 165 2016 289 297 10.1016/j.fuel.2015.10.023 M. Tao, X. Meng, Y. Lv, Z. Bian, Z. Xin, Effect of impregnation solvent on Ni dispersion and catalytic properties of Ni/SBA-15 for CO methanation reaction, Fuel 165 (2016) 289–297. https://doi.org/10.1016/j.fuel.2015.10.023. [57] W. Zhen B. Li G. Lu J. Ma Enhancing catalytic activity and stability for CO2 methanation on Ni@MOF-5 via control of active species dispersion Chem. Commun. 51 2015 1728 1731 10.1039/c4cc08733j W. Zhen, B. Li, G. Lu, J. Ma, Enhancing catalytic activity and stability for CO2 methanation on Ni@MOF-5 via control of active species dispersion, Chemical Communications 51 (2015) 1728–1731. https://doi.org/10.1039/c4cc08733j. [58] Z. Fan K. Sun N. Rui B. Zhao C.J. Liu Improved activity of Ni/MgAl2O4 for CO2 methanation by the plasma decomposition J. Energy Chem. 24 2015 655 659 10.1016/j.jechem.2015.09.004 Z. Fan, K. Sun, N. Rui, B. Zhao, C.J. Liu, Improved activity of Ni/MgAl2O4 for CO2 methanation by the plasma decomposition, Journal of Energy Chemistry 24 (2015) 655–659. https://doi.org/10.1016/j.jechem.2015.09.004. [59] F. Ocampo B. Louis A. Kiennemann A.C. Roger CO2 methanation over Ni-Ceria-Zirconia catalysts: effect of preparation and operating conditions IOP Conf. Ser. Mater. Sci. Eng. 19 2011 10.1088/1757-899X/19/1/012007 F. Ocampo, B. Louis, A. Kiennemann, A.C. Roger, CO2 methanation over Ni-Ceria-Zirconia catalysts: Effect of preparation and operating conditions, IOP Conf Ser Mater Sci Eng 19 (2011). https://doi.org/10.1088/1757-899X/19/1/012007. [60] M. Tao Z. Xin X. Meng Y. Lv Z. Bian Impact of double-solvent impregnation on the ni dispersion of Ni/SBA-15 catalysts and catalytic performance for the syngas methanation reaction RSC Adv. 6 2016 35875 35883 10.1039/c6ra04490e M. Tao, Z. Xin, X. Meng, Y. Lv, Z. Bian, Impact of double-solvent impregnation on the Ni dispersion of Ni/SBA-15 catalysts and catalytic performance for the syngas methanation reaction, RSC Adv 6 (2016) 35875–35883. https://doi.org/10.1039/c6ra04490e. [61] A. Quindimil M.C. Bacariza J.A. González-Marcos C. Henriques J.R. González-Velasco Enhancing the CO2 methanation activity of γ-Al2O3 supported mono- and bi-metallic catalysts prepared by glycerol assisted impregnation Appl. Catal. B 296 2021 120322 10.1016/j.apcatb.2021.120322 A. Quindimil, M.C. Bacariza, J.A. González-Marcos, C. Henriques, J.R. González-Velasco, Enhancing the CO2 methanation activity of γ-Al2O3 supported mono- and bi-metallic catalysts prepared by glycerol assisted impregnation, Appl Catal B 296 (2021) 120322. https://doi.org/https://doi.org/10.1016/j.apcatb.2021.120322. [62] Y.J. Song X.J. Cui T.S. Deng Z.F. Qin W.Bin Fan Solvent effect on the activity of Ru-Co3O4 catalyst for liquid-phase hydrogenation of CO2 into methane, ranliao huaxue xuebao/ J. Fuel Chem. Technol. 49 2021 178 185 10.1016/S1872-5813(21)60013-0 Y.J. Song, X.J. Cui, T.S. Deng, Z.F. Qin, W.Bin Fan, Solvent effect on the activity of Ru-Co3O4 catalyst for liquid-phase hydrogenation of CO2 into methane, Ranliao Huaxue Xuebao/Journal of Fuel Chemistry and Technology 49 (2021) 178–185. https://doi.org/10.1016/S1872-5813(21)60013-0. [63] F. Mateus P. Teixeira J.M. Lopes C. Henriques C. Bacariza CO2 methanation on Ni catalysts supported over activated carbons derived from cork waste Energy Fuels 37 2023 8552 8562 10.1021/acs.energyfuels.3c00908 F. Mateus, P. Teixeira, J.M. Lopes, C. Henriques, C. Bacariza, CO 2 Methanation on Ni Catalysts Supported over Activated Carbons Derived from Cork Waste, Energy & Fuels 37 (2023) 8552–8562. https://doi.org/10.1021/acs.energyfuels.3c00908. [64] S. Huang C. Liu Y. Chen J. Hong S. Lyu Y. Zhao Y. Zhang J. Li Organic-solvent assisted synthesis of highly dispersed iron based Fischer-Tropsch catalysts with MCF support: the effect of organic-solvent Fuel 313 2022 122666 10.1016/j.fuel.2021.122666 S. Huang, C. Liu, Y. Chen, J. Hong, S. Lyu, Y. Zhao, Y. Zhang, J. Li, Organic-solvent assisted synthesis of highly dispersed iron based Fischer-Tropsch catalysts with MCF support: The effect of organic-solvent, Fuel 313 (2022) 122666. https://doi.org/10.1016/j.fuel.2021.122666. [65] Y. Chen Z. Tian Q. Liu B. Bian A MoOx-doped Ni/3D-SBA-15 catalyst for CO methanation: the effect of a solvent and a MoOx promoter on the catalytic properties Sustain Energy Fuels 4 2020 3042 3050 10.1039/d0se00269k Y. Chen, Z. Tian, Q. Liu, B. Bian, A MoOx-doped Ni/3D-SBA-15 catalyst for CO methanation: The effect of a solvent and a MoOxpromoter on the catalytic properties, Sustain Energy Fuels 4 (2020) 3042–3050. https://doi.org/10.1039/d0se00269k. [66] M. Yusuf G. Leeke J. Wood Anisole hydrodeoxygenation over Nickel-Based catalysts: influences of solvent and support properties Energy Fuels 37 2023 1225 1237 10.1021/acs.energyfuels.2c03734 M. Yusuf, G. Leeke, J. Wood, Anisole Hydrodeoxygenation over Nickel-Based Catalysts: Influences of Solvent and Support Properties, Energy and Fuels 37 (2023) 1225–1237. https://doi.org/10.1021/acs.energyfuels.2c03734. [67] E. Truszkiewicz K. Kowalczyk A. Dębska D. Wojda E. Iwanek L. Kępiński B. Mierzwa Methanation of CO on Ru/graphitized-carbon catalysts: effects of the preparation method and the carbon support structure Int. J. Hydrog. Energy 45 2020 31985 31999 10.1016/j.ijhydene.2020.08.235 E. Truszkiewicz, K. Kowalczyk, A. Dębska, D. Wojda, E. Iwanek, L. Kępiński, B. Mierzwa, Methanation of CO on Ru/graphitized-carbon catalysts: Effects of the preparation method and the carbon support structure, Int J Hydrogen Energy 45 (2020) 31985–31999. https://doi.org/10.1016/j.ijhydene.2020.08.235. [68] P. Munnik P.E. De Jongh K.P. De Jong Recent developments in the synthesis of supported catalysts Chem. Rev. 115 2015 6687 6718 10.1021/cr500486u P. Munnik, P.E. De Jongh, K.P. De Jong, Recent Developments in the Synthesis of Supported Catalysts, Chem Rev 115 (2015) 6687–6718. https://doi.org/10.1021/cr500486u. [69] C. Ding J. Wang G. Ai S. Liu P. Liu K. Zhang Y. Han X. Ma Partial oxidation of methane over silica supported ni nanoparticles with size control by alkanol solvent Fuel 175 2016 1 12 10.1016/j.fuel.2016.02.024 C. Ding, J. Wang, G. Ai, S. Liu, P. Liu, K. Zhang, Y. Han, X. Ma, Partial oxidation of methane over silica supported Ni nanoparticles with size control by alkanol solvent, Fuel 175 (2016) 1–12. https://doi.org/10.1016/j.fuel.2016.02.024. [70] A.C.V. Olivares M.F. Gomez M.N. Barroso M.C. Abello Ni-supported catalysts for ethanol steam reforming: effect of the solvent and metallic precursor in catalyst preparation Int. J. Ind. Chem. 9 2018 61 73 10.1007/s40090-018-0135-6 A.C.V. Olivares, M.F. Gomez, M.N. Barroso, M.C. Abello, Ni-supported catalysts for ethanol steam reforming: effect of the solvent and metallic precursor in catalyst preparation, International Journal of Industrial Chemistry 9 (2018) 61–73. https://doi.org/10.1007/s40090-018-0135-6. [71] F. Bentaleb M. Che A.C. Dubreuil C. Thomazeau E. Marceau Influence of organic additives on the properties of impregnation solutions and on nickel oxide particle size for Ni/Al2O3 catalysts Catal. Today 235 2014 250 255 10.1016/j.cattod.2014.02.020 F. Bentaleb, M. Che, A.C. Dubreuil, C. Thomazeau, E. Marceau, Influence of organic additives on the properties of impregnation solutions and on nickel oxide particle size for Ni/Al2O3 catalysts, Catal Today 235 (2014) 250–255. https://doi.org/10.1016/j.cattod.2014.02.020. [72] Y. Uemura Y. Hatate A. Ikari Characterization of Nickel-Alumina catalysts impregnated in alcohol solution J. Jpn. Pet. Inst. 30 1987 53 58 10.1627/jpi1958.30.53 Y. Uemura, Y. Hatate, A. Ikari, Characterization of Nickel-Alumina Catalysts Impregnated in Alcohol Solution, Journal of The Japan Petroleum Institute 30 (1987) 53–58. https://doi.org/10.1627/jpi1958.30.53. [73] S. Qiu X. Zhang Q. Liu T. Wang Q. Zhang L. Ma A simple method to prepare highly active and dispersed Ni/MCM-41 catalysts by co-impregnation Catal. Commun. 42 2013 73 78 10.1016/j.catcom.2013.07.031 S. Qiu, X. Zhang, Q. Liu, T. Wang, Q. Zhang, L. Ma, A simple method to prepare highly active and dispersed Ni/MCM-41 catalysts by co-impregnation, Catal Commun 42 (2013) 73–78. https://doi.org/10.1016/j.catcom.2013.07.031. [74] X. Liu B. Glasser J. Khinast Impact of impregnation and drying on the metal distribution in supported catalysts, 2007 AIChE Annu. Meet. 56 2007 4473 4487 X. Liu, B. Glasser, J. Khinast, Impact of impregnation and drying on the metal distribution in supported catalysts, 2007 AIChE Annual Meeting 56 (2007) 4473–4487. [75] P. Munnik P.E. De Jongh K.P. De Jong Recent developments in the synthesis of supported catalysts Chem. Rev. 115 2015 6687 6718 10.1021/cr500486u P. Munnik, P.E. De Jongh, K.P. De Jong, Recent Developments in the Synthesis of Supported Catalysts, Chem Rev 115 (2015) 6687–6718. https://doi.org/10.1021/cr500486u. [76] M. Martinelli M. Mehrbod C. Dawson B.H. Davis L. Lietti D.C. Cronauer A.J. Kropf C.L. Marshall G. Jacobs Fischer-Tropsch synthesis: foregoing calcination and utilizing reduction promoters leads to improved conversion and selectivity with co/silica Appl. Catal. A Gen. 559 2018 153 166 10.1016/j.apcata.2018.04.013 M. Martinelli, M. Mehrbod, C. Dawson, B.H. Davis, L. Lietti, D.C. Cronauer, A.J. Kropf, C.L. Marshall, G. Jacobs, Fischer-Tropsch synthesis: Foregoing calcination and utilizing reduction promoters leads to improved conversion and selectivity with Co/silica, Appl Catal A Gen 559 (2018) 153–166. https://doi.org/10.1016/j.apcata.2018.04.013. [77] T. Kato T. Usami T. Tsukada Y. Shibata T. Kodama Study on volatilization mechanism of ruthenium tetroxide from nitrosyl ruthenium nitrate by using mass spectrometer J. Nucl. Mater. 479 2016 123 129 10.1016/j.jnucmat.2016.06.052 T. Kato, T. Usami, T. Tsukada, Y. Shibata, T. Kodama, Study on volatilization mechanism of ruthenium tetroxide from nitrosyl ruthenium nitrate by using mass spectrometer, Journal of Nuclear Materials 479 (2016) 123–129. https://doi.org/10.1016/j.jnucmat.2016.06.052. [78] K.L. Rohde C.E. May B.J. Newby B.D. Withers Fission-Product ruthenium volatility at high temperatures Ind. Eng. Chem. 51 1959 68 70 10.1021/ie50589a040 K.L. Rohde, C.E. May, B.J. Newby, B.D. Withers, Fission-Product Ruthenium Volatility at High Temperatures, Ind Eng Chem 51 (1959) 68–70. https://doi.org/10.1021/ie50589a040. [79] G. Tojo M. Fernández Ruthenium tetroxide and other ruthenium compounds Oxid. Prim. Alcohols Carboxylic Acids 2007 61 78 10.1007/0-387-35432-8_5 G. Tojo, M. Fernández, Ruthenium Tetroxide and Other Ruthenium Compounds, Oxidation of Primary Alcohols to Carboxylic Acids (2007) 61–78. https://doi.org/10.1007/0-387-35432-8_5. [80] S.Y. Chin O.S. Alexeev M.D. Amiridis Preferential oxidation of CO under excess H2 conditions over ru catalysts Appl. Catal. A Gen. 286 2005 157 166 10.1016/j.apcata.2005.02.031 S.Y. Chin, O.S. Alexeev, M.D. Amiridis, Preferential oxidation of CO under excess H2 conditions over Ru catalysts, Appl Catal A Gen 286 (2005) 157–166. https://doi.org/10.1016/j.apcata.2005.02.031. [81] P.G.J. Koopman A.P.G. Kieboom H. van Bekkum Characterization of ruthenium catalysts as studied by temperature programmed reduction J. Catal. 69 1981 172 179 10.1016/0021-9517(81)90139-1 P.G.J. Koopman, A.P.G. Kieboom, H. van Bekkum, Characterization of ruthenium catalysts as studied by temperature programmed reduction, J Catal 69 (1981) 172–179. https://doi.org/10.1016/0021-9517(81)90139-1. [82] J. Wellenbüscher M. Muhler W. Mahdi U. Sauerlandt J. Schütze G. Ertl R. Schlögl, Ruthenium supported on zeolite A: preparation and characterisation of a stable catalyst for ammonia synthesis Catal. Lett. 25 1994 61 74 10.1007/BF00815416 J. Wellenbüscher, M. Muhler, W. Mahdi, U. Sauerlandt, J. Schütze, G. Ertl, R. Schlögl, Ruthenium supported on zeolite A: preparation and characterisation of a stable catalyst for ammonia synthesis, Catal Letters 25 (1994) 61–74. https://doi.org/10.1007/BF00815416. [83] S.E. Atakoohi P. Riani E. Spennati L. Savio L. Vattuone J. De Maron G. Garbarino Graphene-based material supports for Ni- and Ru- catalysts in CO2 hydrogenation: ruling out performances and impurity role ChemSusChem 2024 10.1002/cssc.202400993 S.E. Atakoohi, P. Riani, E. Spennati, L. Savio, L. Vattuone, J. De Maron, G. Garbarino, Graphene-based material supports for Ni- and Ru- catalysts in CO2 Hydrogenation: ruling out performances and impurity role, ChemSusChem (2024). https://doi.org/10.1002/cssc.202400993. [84] O. Levenspiel Chemical Reaction Engineering, 3rd ed 1999 John Wiley & Sons Oregon state 10.1021/ie990488g O. Levenspiel, Chemical Reaction Engineering, 3rd ed., John Wiley & Sons, Oregon state, 1999. https://doi.org/10.1021/ie990488g. [85] A. Serrano-Lotina, K. Cruz, M.A. Bañares, M. Daturi, P. Ávila, Operando IR Studies of Co, Fe and Ce Doped MnO 2-Supported Catalysts for Low-temperature 2 Selective Reduction of NO With NH, n.d. 〈https://ssrn.com/abstract=4165224〉. [86] S. Thomas O. Marie P. Bazin L. Lietti C.G. Visconti M. Corbetta F. Manenti M. Daturi Modelling a reactor cell for operando IR studies: from qualitative to fully quantitative kinetic investigations Catal. Today 283 2017 176 184 10.1016/j.cattod.2016.07.008 S. Thomas, O. Marie, P. Bazin, L. Lietti, C.G. Visconti, M. Corbetta, F. Manenti, M. Daturi, Modelling a reactor cell for operando IR studies: From qualitative to fully quantitative kinetic investigations, Catal Today 283 (2017) 176–184. https://doi.org/10.1016/j.cattod.2016.07.008. [87] Pearson Crystal Data. Crystal Structure Database for Inorganic Compounds. In: ASM international. The Material Information Society; 2021/2022. Release., (n.d.). [88] G. Busca The surface of transitional aluminas: a critical review Catal. Today 226 2014 2 13 10.1016/j.cattod.2013.08.003 G. Busca, The surface of transitional aluminas: A critical review, Catal Today 226 (2014) 2–13. https://doi.org/https://doi.org/10.1016/j.cattod.2013.08.003. [89] M. Gil-Calvo C. Jiménez-González B. de Rivas J.I. Gutiérrez-Ortiz R. López-Fonseca Effect of Ni/Al molar ratio on the performance of substoichiometric NiAl2O4 spinel-based catalysts for partial oxidation of methane Appl. Catal. B 209 2017 128 138 10.1016/j.apcatb.2017.02.063 M. Gil-Calvo, C. Jiménez-González, B. de Rivas, J.I. Gutiérrez-Ortiz, R. López-Fonseca, Effect of Ni/Al molar ratio on the performance of substoichiometric NiAl 2 O 4 spinel-based catalysts for partial oxidation of methane, Appl Catal B 209 (2017) 128–138. https://doi.org/10.1016/j.apcatb.2017.02.063. [90] J.L. Rogers M.C. Mangarella A.D. D’Amico J.R. Gallagher M.R. Dutzer E. Stavitski J.T. Miller C. Sievers Differences in the nature of active sites for methane dry reforming and methane steam reforming over nickel aluminate catalysts ACS Catal. 6 2016 5873 5886 10.1021/acscatal.6b01133 J.L. Rogers, M.C. Mangarella, A.D. D’Amico, J.R. Gallagher, M.R. Dutzer, E. Stavitski, J.T. Miller, C. Sievers, Differences in the Nature of Active Sites for Methane Dry Reforming and Methane Steam Reforming over Nickel Aluminate Catalysts, ACS Catal 6 (2016) 5873–5886. https://doi.org/10.1021/acscatal.6b01133. [91] G. Garbarino P. Riani A. Infantes-Molina E. Rodríguez-Castellón G. Busca On the detectability limits of nickel species on NiO/γ-Al2O3 catalytic materials Appl. Catal. A Gen. 525 2016 180 189 10.1016/j.apcata.2016.07.017 G. Garbarino, P. Riani, A. Infantes-Molina, E. Rodríguez-Castellón, G. Busca, On the detectability limits of nickel species on NiO/γ-Al2O3 catalytic materials, Appl Catal A Gen 525 (2016) 180–189. https://doi.org/10.1016/j.apcata.2016.07.017. [92] G. Busca V. Lorenzelli V. Sanchez Escribano1 Preparation, Solid-State characterization, and surface chemistry of high surface area NixAl2-2xO3-2x Mixed oxides Chem. Mater. 4 1992 595 605 10.1021/cm00021a019 G. Busca, V. Lorenzelli, V. Sanchez Escribano1, Preparation, Solid-State Characterization, and Surface Chemistry of High Surface Area NixAl2-2xO3-2xMixed Oxides, Chemistry of Materials 4 (1992) 595–605. https://doi.org/10.1021/cm00021a019. [93] C. Vogt E. Groeneveld G. Kamsma M. Nachtegaal L. Lu C.J. Kiely P.H. Berben F. Meirer B.M. Weckhuysen Unravelling structure sensitivity in CO2 hydrogenation over nickel Nat. Catal. 1 2018 127 134 10.1038/s41929-017-0016-y C. Vogt, E. Groeneveld, G. Kamsma, M. Nachtegaal, L. Lu, C.J. Kiely, P.H. Berben, F. Meirer, B.M. Weckhuysen, Unravelling structure sensitivity in CO2 hydrogenation over nickel, Nat Catal 1 (2018) 127–134. https://doi.org/10.1038/s41929-017-0016-y. [94] J.F.M. Simons T.J. de Heer R.C.J. van de Poll V. Muravev N. Kosinov E.J.M. Hensen Structure sensitivity of CO2 hydrogenation on ni revisited J. Am. Chem. Soc. 145 2023 20289 20301 10.1021/jacs.3c04284 J.F.M. Simons, T.J. de Heer, R.C.J. van de Poll, V. Muravev, N. Kosinov, E.J.M. Hensen, Structure Sensitivity of CO2 Hydrogenation on Ni Revisited, J Am Chem Soc 145 (2023) 20289–20301. https://doi.org/10.1021/jacs.3c04284. [95] G. Spanò M. Ferri R. Cheula M. Monai B.M. Weckhuysen M. Maestri Deciphering size and shape effects on the structure sensitivity of the CO2 methanation reaction on nickel ACS Catal. 15 2025 8194 8203 10.1021/acscatal.4c08084 G. Spanò, M. Ferri, R. Cheula, M. Monai, B.M. Weckhuysen, M. Maestri, Deciphering Size and Shape Effects on the Structure Sensitivity of the CO2 Methanation Reaction on Nickel, ACS Catal 15 (2025) 8194–8203. https://doi.org/10.1021/acscatal.4c08084. [96] C. Li M. Li Y. Zheng B. Fang J. Lin J. Ni B. Lin L. Jiang Revealing hydrogen migration effect on ammonia synthesis activity over ceria-supported ru catalysts Appl. Catal. B 320 2023 121982 10.1016/j.apcatb.2022.121982 C. Li, M. Li, Y. Zheng, B. Fang, J. Lin, J. Ni, B. Lin, L. Jiang, Revealing hydrogen migration effect on ammonia synthesis activity over ceria-supported Ru catalysts, Appl Catal B 320 (2023) 121982. https://doi.org/10.1016/j.apcatb.2022.121982. [97] D.R. MacFarlane P.V. Cherepanov J. Choi B.H.R. Suryanto R.Y. Hodgetts J.M. Bakker F.M. Ferrero Vallana A.N. Simonov A roadmap to the ammonia economy Joule 4 2020 1186 1205 10.1016/j.joule.2020.04.004 D.R. MacFarlane, P.V. Cherepanov, J. Choi, B.H.R. Suryanto, R.Y. Hodgetts, J.M. Bakker, F.M. Ferrero Vallana, A.N. Simonov, A Roadmap to the Ammonia Economy, Joule 4 (2020) 1186–1205. https://doi.org/10.1016/j.joule.2020.04.004. [98] D.E. Brown T. Edmonds R.W. Joyner J.J. McCarroll S.R. Tennison The genesis and development of the commercial BP doubly promoted catalyst for ammonia synthesis Catal. Lett. 144 2014 545 552 10.1007/s10562-014-1226-4 D.E. Brown, T. Edmonds, R.W. Joyner, J.J. McCarroll, S.R. Tennison, The genesis and development of the commercial BP doubly promoted catalyst for ammonia synthesis, Catal Letters 144 (2014) 545–552. https://doi.org/10.1007/s10562-014-1226-4. [99] K. Aika A. Ohya A. Ozaki Y. Inoue I. Yasumori, support and promoter effect of ruthenium catalyst. Ii. ruthenium/alkaline earth catalyst for activation of dinitrogen J. Catal. 92 1985 305 311 10.1016/0021-9517(85)90265-9 K. Aika, A. Ohya, A. Ozaki, Y. Inoue, I. Yasumori, Support and promoter effect of ruthenium catalyst. II. Ruthenium/alkaline earth catalyst for activation of dinitrogen, J Catal 92 (1985) 305–311. https://doi.org/10.1016/0021-9517(85)90265-9. [100] B. Lin L. Heng B. Fang H. Yin J. Ni X. Wang J. Lin L. Jiang Ammonia synthesis activity of Alumina-Supported ruthenium catalyst enhanced by alumina phase transformation ACS Catal. 9 2019 1635 1644 10.1021/acscatal.8b03554 B. Lin, L. Heng, B. Fang, H. Yin, J. Ni, X. Wang, J. Lin, L. Jiang, Ammonia Synthesis Activity of Alumina-Supported Ruthenium Catalyst Enhanced by Alumina Phase Transformation, ACS Catal 9 (2019) 1635–1644. https://doi.org/10.1021/acscatal.8b03554. [101] L. Ding B. Zhong X. Kong L. Wang C. Li Q. Du C. Liu W. Sun Sustainable catalytic hydrogenation of high concentration nitrate to ammonia over Ruthenium-based catalysts Sep Purif. Technol. 354 2025 129275 10.1016/j.seppur.2024.129275 L. Ding, B. Zhong, X. Kong, L. Wang, C. Li, Q. Du, C. Liu, W. Sun, Sustainable catalytic hydrogenation of high concentration nitrate to ammonia over Ruthenium-based catalysts, Sep Purif Technol 354 (2025) 129275. https://doi.org/10.1016/j.seppur.2024.129275. [102] K. TAYLOR The catalytic reduction of nitric oxide over supported ruthenium catalysts J. Catal. 30 1973 478 484 10.1016/0021-9517(73)90166-8 K. TAYLOR, The catalytic reduction of nitric oxide over supported ruthenium catalysts, J Catal 30 (1973) 478–484. https://doi.org/10.1016/0021-9517(73)90166-8. [103] Ž. Petrović M. Ristić M. Marciuš B. Sepiol H. Peterlik M. Ivanda S. Musić Formation of RuO2 nanoparticles by thermal decomposition of Ru(NO)(NO3)3 Ceram. Int. 41 2015 7811 7815 10.1016/j.ceramint.2015.02.115 Ž. Petrović, M. Ristić, M. Marciuš, B. Sepiol, H. Peterlik, M. Ivanda, S. Musić, Formation of RuO2 nanoparticles by thermal decomposition of Ru(NO)(NO3)3, Ceram Int 41 (2015) 7811–7815. https://doi.org/10.1016/j.ceramint.2015.02.115. [104] N. Apostolescu T. Schröder S. Kureti Study on the mechanism of the reaction of NO2 with aluminium oxide Appl. Catal. B 51 2004 43 50 10.1016/j.apcatb.2004.02.003 N. Apostolescu, T. Schröder, S. Kureti, Study on the mechanism of the reaction of NO2 with aluminium oxide, Appl Catal B 51 (2004) 43–50. https://doi.org/10.1016/j.apcatb.2004.02.003. [105] P. Mehta P. Barboun D.B. Go J.C. Hicks W.F. Schneider Catalysis enabled by plasma activation of strong chemical bonds: a review ACS Energy Lett. 4 2019 1115 1133 10.1021/acsenergylett.9b00263 P. Mehta, P. Barboun, D.B. Go, J.C. Hicks, W.F. Schneider, Catalysis Enabled by Plasma Activation of Strong Chemical Bonds: A Review, ACS Energy Lett 4 (2019) 1115–1133. https://doi.org/10.1021/acsenergylett.9b00263. [106] R. Schlögl, Handbook of Heterogeneous Catalysis, 2nd edition, Wiley-VCH Verlag GmbH & Co. KGaA, 2008. [107] C.H.B.Richard M. Bowman Deactivation by carbon of Ru/Al2O3 during CO hydrogenation Appl. Catal. 7 1983 179 187 C.H.B.Richard M. Bowman, Deactivation by carbon of Ru/Al2O3 during CO hydrogenation, Appl Catal 7 (1983) 179–187. [108] S.K. Wilkinson M.J.H. Simmons E.H. Stitt X. Baucherel M.J. Watson A novel approach to understanding and modelling performance evolution of catalysts during their initial operation under reaction conditions-Case study of vanadium phosphorus oxides for n-butane selective oxidation J. Catal. 299 2013 249 260 10.1016/j.jcat.2012.11.027 S.K. Wilkinson, M.J.H. Simmons, E.H. Stitt, X. Baucherel, M.J. Watson, A novel approach to understanding and modelling performance evolution of catalysts during their initial operation under reaction conditions-Case study of vanadium phosphorus oxides for n-butane selective oxidation, J Catal 299 (2013) 249–260. https://doi.org/10.1016/j.jcat.2012.11.027. [109] T. Van Herwijnen H. Van Doesburg W.A.De Jong Kinetics of the methanation of CO and CO2 on a nickel catalyst J. Catal. 28 1973 391 402 10.1016/0021-9517(73)90132-2 T. Van Herwijnen, H. Van Doesburg, W.A.De Jong, Kinetics of the methanation of CO and CO2 on a nickel catalyst, J Catal 28 (1973) 391–402. https://doi.org/10.1016/0021-9517(73)90132-2. [110] G. Garbarino F. Pugliese T. Cavattoni G. Busca P. Costamagna A study on CO2 methanation and steam methane reforming over commercial Ni/Calcium aluminate catalysts Energies 13 2020 2792 10.3390/en13112792 G. Garbarino, F. Pugliese, T. Cavattoni, G. Busca, P. Costamagna, A Study on CO2 Methanation and Steam Methane Reforming over Commercial Ni/Calcium Aluminate Catalysts, Energies (Basel) 13 (2020) 2792. https://doi.org/10.3390/en13112792. [111] X. Wang Y. Hong H. Shi J. Szanyi Kinetic modeling and transient DRIFTS–MS studies of CO2methanation over Ru/Al2O3 catalysts J. Catal. 343 2016 185 195 10.1016/j.jcat.2016.02.001 X. Wang, Y. Hong, H. Shi, J. Szanyi, Kinetic modeling and transient DRIFTS–MS studies of CO2 methanation over Ru/Al2O3 catalysts, J Catal 343 (2016) 185–195. https://doi.org/10.1016/j.jcat.2016.02.001. [112] Y. Traa J. Weitkamp Kinetics of the methanation of carbon dioxide over ruthenium on titania Chem. Eng. Technol. 22 1999 291 293 10.1002/(SICI)1521-4125(199904)22:4<291::AID-CEAT291>3.0.CO;2-L Y. Traa, J. Weitkamp, Kinetics of the methanation of carbon dioxide over ruthenium on Titania, Chem Eng Technol 22 (1999) 291–293. https://doi.org/10.1002/(SICI)1521-4125(199904)22:4<291::AID-CEAT291>3.0.CO;2-L. [113] M.R. Prairie, A. Renken, J.G. Highfield, K.R. Thampi, M. Grxtzel∼, A Fourier Transform Infrared Spectroscopic Study of CO2 Methanation on Supported Ruthenium, 1991. [114] T. Montanari L. Castoldi L. Lietti G. Busca Basic catalysis and catalysis assisted by basicity: FT-IR and TPD characterization of potassium-doped alumina Appl. Catal. A Gen. 400 2011 61 69 10.1016/j.apcata.2011.04.016 T. Montanari, L. Castoldi, L. Lietti, G. Busca, Basic catalysis and catalysis assisted by basicity: FT-IR and TPD characterization of potassium-doped alumina, Appl Catal A Gen 400 (2011) 61–69. https://doi.org/10.1016/j.apcata.2011.04.016. [115] V. Sanchez-Escribano M.A. Larrubia Vargas E. Finocchio G. Busca On the mechanisms and the selectivity determining steps in syngas conversion over supported metal catalysts: an IR study Appl. Catal. A Gen. 316 2007 68 74 10.1016/j.apcata.2006.09.020 V. Sanchez-Escribano, M.A. Larrubia Vargas, E. Finocchio, G. Busca, On the mechanisms and the selectivity determining steps in syngas conversion over supported metal catalysts: An IR study, Appl Catal A Gen 316 (2007) 68–74. https://doi.org/https://doi.org/10.1016/j.apcata.2006.09.020. [116] Guido Busca Chapter three - structural, surface, and catalytic properties of aluminas, Adv. Catal. 2014 319 404 Guido Busca, Chapter Three - Structural, Surface, and Catalytic Properties of Aluminas, in: Advances in Catalysis, 2014: pp. 319–404. [117] E. Theodore Madey, the geometry of CO on Ru(001): evidence for bending vibrations in adsorbed molecules Surf. Sci. 79 1979 575 588 Theodore E. Madey, The geometry of CO on Ru(001): Evidence for bending vibrations in adsorbed molecules, Surf Sci 79 (1979) 575–588. [118] H. Pfnür D. Menzel F.M. Hoffmann A. Orteg A.M. Bradshaw High resolution vibrational spectroscopy of CO on Ru(001): the importance of lateral interactions Surf. Sci. 93 1980 431 452 D.M.F.M.H.A.O.A.M.B.H. Pfnür, High resolution vibrational spectroscopy of CO on Ru(001): The importance of lateral interactions, Surf Sci 93 (1980) 431–452. [119] T. Zubkov G.A. Morgan J.T. Yates O. Kühlert M. Lisowski R. Schillinger D. Fick H.J. Jänsch The effect of atomic steps on adsorption and desorption of CO on Ru(109) Surf. Sci. 526 2003 57 71 10.1016/S0039-6028(02)02655-9 T. Zubkov, G.A. Morgan, J.T. Yates, O. Kühlert, M. Lisowski, R. Schillinger, D. Fick, H.J. Jänsch, The effect of atomic steps on adsorption and desorption of CO on Ru(109), Surf Sci 526 (2003) 57–71. https://doi.org/https://doi.org/10.1016/S0039-6028(02)02655-9. [120] J. Cornejo-Romero P.S. Gonzalez-Servin A.G. Sarmiento-Lopez A. Solis-Garcia E.E. Gonzalez-Arredondo T.A. Zepeda A. Almendarez-Camarillo J.C. Fierro-Gonzalez γ-Al2O3-supported ruthenium carbonyls: reactivity towards H2 and catalytic activity in CO2 methanation Appl. Catal. A Gen. 704 2025 120416 10.1016/j.apcata.2025.120416 J. Cornejo-Romero, P.S. Gonzalez-Servin, A.G. Sarmiento-Lopez, A. Solis-Garcia, E.E. Gonzalez-Arredondo, T.A. Zepeda, A. Almendarez-Camarillo, J.C. Fierro-Gonzalez, γ-Al2O3-supported ruthenium carbonyls: Reactivity towards H2 and catalytic activity in CO2 methanation, Appl Catal A Gen 704 (2025) 120416. https://doi.org/https://doi.org/10.1016/j.apcata.2025.120416. [121] V.L. Kuznetsov A.T. Bell Y.I. Yermakov, an infrared study of alumina- and silica-supported ruthenium cluster carbonyls J. Catal. 65 1980 374 389 10.1016/0021-9517(80)90315-2 V.L. Kuznetsov, A.T. Bell, Y.I. Yermakov, An infrared study of alumina- and silica-supported ruthenium cluster carbonyls, J Catal 65 (1980) 374–389. https://doi.org/https://doi.org/10.1016/0021-9517(80)90315-2. [122] E. Guglielminotti F. Boccuzzi M. Manzoli F. Pinna M. Scarpa Ru/ZrO2 catalysts: I. O2, CO, and NO adsorption and reactivity J. Catal. 192 2000 149 157 10.1006/jcat.2000.2835 E. Guglielminotti, F. Boccuzzi, M. Manzoli, F. Pinna, M. Scarpa, Ru/ZrO2 Catalysts: I. O2, CO, and NO Adsorption and Reactivity, J Catal 192 (2000) 149–157. https://doi.org/https://doi.org/10.1006/jcat.2000.2835. [123] K. Hadjiivanov J.-C. Lavalley J. Lamotte F. Maugé J. Saint-Just M. Che FTIR study of CO interaction with Ru/TiO2 Catalysts J. Catal. 176 1998 415 425 10.1006/jcat.1998.2038 K. Hadjiivanov, J.-C. Lavalley, J. Lamotte, F. Maugé, J. Saint-Just, M. Che, FTIR Study of CO Interaction with Ru/TiO2Catalysts, J Catal 176 (1998) 415–425. https://doi.org/https://doi.org/10.1006/jcat.1998.2038. [124] D. Yubero Valdivielso C. Kerpal W. Schöllkopf G. Meijer A. Fielicke IR spectra and structures of saturated ruthenium cluster carbonyl cations Run(CO)m+ (n = 1–6) Dalton Trans. 52 2023 9929 9939 10.1039/D3DT01129A D. Yubero Valdivielso, C. Kerpal, W. Schöllkopf, G. Meijer, A. Fielicke, IR spectra and structures of saturated ruthenium cluster carbonyl cations Run(CO)m+ (n = 1–6), Dalton Trans. 52 (2023) 9929–9939. https://doi.org/10.1039/D3DT01129A. [125] D.W. Underhill, J.A. Reeds, R. Bogen, B.M. Zhitomlrskll, A.V. Agafonov, A.D. Berman, I. Yanovskii, R.A. Dalla Betta, References and Notes Carbon Monoxide Adsorption on Supported Ruthenium, 1973. 〈https://pubs.acs.org/sharingguidelines〉. [126] G. Ramis G. Busca V. Lorenzelli Low-temperature CO2 adsorption on metal oxides: spectroscopic characterization of some weakly adsorbed species Mater. Chem. Phys. 29 1991 425 435 10.1016/0254-0584(91)90037-U G. Ramis, G. Busca, V. Lorenzelli, Low-temperature CO2 adsorption on metal oxides: spectroscopic characterization of some weakly adsorbed species, Mater Chem Phys 29 (1991) 425–435. https://doi.org/https://doi.org/10.1016/0254-0584(91)90037-U. [127] J.C. Lavalley J. Saussey T. Raïs Infrared study of the interaction between CO and H2 on ZnO: mechanism and sites of formation of formyl species J. Mol. Catal. 17 1982 289 298 10.1016/0304-5102(82)85040-2 J.C. Lavalley, J. Saussey, T. Raïs, Infrared study of the interaction between CO and H2 on ZnO: Mechanism and sites of formation of formyl species, Journal of Molecular Catalysis 17 (1982) 289–298. https://doi.org/https://doi.org/10.1016/0304-5102(82)85040-2. [128] X. Wang Y. Hong H. Shi J. Szanyi Kinetic modeling and transient DRIFTS–MS studies of CO2 methanation over Ru/Al2O3 catalysts J. Catal. 343 2016 185 195 10.1016/j.jcat.2016.02.001 X. Wang, Y. Hong, H. Shi, J. Szanyi, Kinetic modeling and transient DRIFTS–MS studies of CO2 methanation over Ru/Al2O3 catalysts, J Catal 343 (2016) 185–195. https://doi.org/10.1016/j.jcat.2016.02.001. [129] V.V. González-Rangulan I. Reyero F. Bimbela F. Romero-Sarria M. Daturi L.M. Gandía CO2 methanation over nickel catalysts: support effects investigated through specific activity and operando IR spectroscopy measurements Catalysts 13 2023 10.3390/catal13020448 V.V. González-Rangulan, I. Reyero, F. Bimbela, F. Romero-Sarria, M. Daturi, L.M. Gandía, CO2 Methanation over Nickel Catalysts: Support Effects Investigated through Specific Activity and Operando IR Spectroscopy Measurements, Catalysts 13 (2023). https://doi.org/10.3390/catal13020448. [130] E. Truszkiewicz K. Zegadło D. Wojda B. Mierzwa L. Kępiński The effect of the ruthenium crystallite size on the activity of Ru/Carbon systems in CO methanation Top. Catal. 60 2017 1299 1305 10.1007/s11244-017-0815-z E. Truszkiewicz, K. Zegadło, D. Wojda, B. Mierzwa, L. Kępiński, The Effect of the Ruthenium Crystallite Size on the Activity of Ru/Carbon Systems in CO Methanation, Top Catal 60 (2017) 1299–1305. https://doi.org/10.1007/s11244-017-0815-z. [131] C. Fernández C. Sassoye D.P. Debecker C. Sanchez P. Ruiz Effect of the size and distribution of supported ru nanoparticles on their activity in ammonia synthesis under mild reaction conditions Appl. Catal. A Gen. 474 2014 194 202 10.1016/j.apcata.2013.09.039 C. Fernández, C. Sassoye, D.P. Debecker, C. Sanchez, P. Ruiz, Effect of the size and distribution of supported Ru nanoparticles on their activity in ammonia synthesis under mild reaction conditions, Appl Catal A Gen 474 (2014) 194–202. https://doi.org/https://doi.org/10.1016/j.apcata.2013.09.039. [132] M. Chen L. Liu X. Chen X. Qin K. Li J. Zhang X. Bao L. Ma C. Zhang Effects of ru particle size over TiO2 on the catalytic performance of CO2 hydrogenation Appl. Surf. Sci. 654 2024 159460 10.1016/j.apsusc.2024.159460 M. Chen, L. Liu, X. Chen, X. Qin, K. Li, J. Zhang, X. Bao, L. Ma, C. Zhang, Effects of Ru particle size over TiO2 on the catalytic performance of CO2hydrogenation, Appl Surf Sci 654 (2024) 159460. https://doi.org/https://doi.org/10.1016/j.apsusc.2024.159460. [133] X. Wang Y. Hong H. Shi J. Szanyi Kinetic modeling and transient DRIFTS–MS studies of CO2 methanation over Ru/Al2O3 catalysts J. Catal. 343 2016 185 195 10.1016/j.jcat.2016.02.001 X. Wang, Y. Hong, H. Shi, J. Szanyi, Kinetic modeling and transient DRIFTS–MS studies of CO2 methanation over Ru/Al2O3 catalysts, J Catal 343 (2016) 185–195. https://doi.org/10.1016/j.jcat.2016.02.001. [134] M. Kuśmierz Kinetic study on carbon dioxide hydrogenation over Ru/γ-Al2O3 catalysts Catal. Today 137 2008 429 432 10.1016/j.cattod.2008.03.003 M. Kuśmierz, Kinetic study on carbon dioxide hydrogenation over Ru/γ-Al2O3 catalysts, Catal Today 137 (2008) 429–432. https://doi.org/10.1016/j.cattod.2008.03.003. [135] F. Solymosi A. Erdöhelyi M. Kocsis Methanation of CO2 on supported ru catalysts J. Chem. Soc. Faraday Trans. 1 Phys. Chem. Condens. Ph. 77 1981 1003 1012 10.1039/F19817701003 F. Solymosi, A. Erdöhelyi, M. Kocsis, Methanation of CO2 on supported Ru catalysts, Journal of the Chemical Society, Faraday Transactions 1: Physical Chemistry in Condensed Phases 77 (1981) 1003–1012. https://doi.org/10.1039/F19817701003. [136] M.S. Duyar A. Ramachandran C. Wang R.J. Farrauto Kinetics of CO2 methanation over Ru/γ-Al2O3 and implications for renewable energy storage applications J. CO2 Util. 12 2015 27 33 10.1016/j.jcou.2015.10.003 M.S. Duyar, A. Ramachandran, C. Wang, R.J. Farrauto, Kinetics of CO2 methanation over Ru/γ-Al2O3 and implications for renewable energy storage applications, Journal of CO2 Utilization 12 (2015) 27–33. https://doi.org/10.1016/j.jcou.2015.10.003. [137] P.J. Lunde F.L. Kester Carbon Dioxide Methan. 13 1974 27 33 P.J. Lunde, F.L. Kester, Carbon Dioxide Methanation, 13 (1974) 27–33. [138] H. Ohya J. Fun H. Kawamura K. Itoh H. Ohashi M. Aihara S. Tanisho Y. Negishi Methanation of carbon dioxide by using membrane reactor integrated with water vapor permselective membrane and its analysis J. Membr. Sci. 131 1997 237 247 10.1016/S0376-7388(97)00055-0 H. Ohya, J. Fun, H. Kawamura, K. Itoh, H. Ohashi, M. Aihara, S. Tanisho, Y. Negishi, Methanation of carbon dioxide by using membrane reactor integrated with water vapor permselective membrane and its analysis, J Memb Sci 131 (1997) 237–247. https://doi.org/10.1016/S0376-7388(97)00055-0.",
      "coredata": {
        "eid": "1-s2.0-S0926860X25005277",
        "dc:description": "Ru/Al2O3 and Ni/Al2O3 catalysts were prepared and investigated in the CO2 hydrogenation reaction. 0.5 wt% Ru/Al2O3, 2 wt% Ni/Al2O3, and 13.6 wt% Ni/Al2O3 catalysts were prepared by using a modified incipient wetness impregnation with a main focus on the effect of solvent selection and catalyst pretreatment conditions on the catalyst reduction, activity, selectivity, activation energy, and morphology. In-depth characterizations, including FT-IR, FE-SEM, and XRD, were performed on the catalysts, and an operando study was carried out on the best-performing Ru-catalysts in COx transient experiments at 523 K. The investigation revealed that employing ethanol as the solvent for preparation results in a catalyst with improved properties and activity. Furthermore, coupling solvent selection with various pretreatment conditions demonstrated that specific pretreatments can significantly affect the catalyst properties, activity, and morphology. Operando IR confirmed the mechanism and the effect of CO reported in the literature, even if a different distribution of carbonyl species was detected.",
        "openArchiveArticle": "false",
        "prism:coverDate": "2026-01-05",
        "openaccessUserLicense": "http://creativecommons.org/licenses/by-nc-nd/4.0/",
        "prism:aggregationType": "Journal",
        "prism:url": "https://api.elsevier.com/content/article/pii/S0926860X25005277",
        "dc:creator": [
          {
            "@_fa": "true",
            "$": "Atakoohi, Sina Ebrahim"
          },
          {
            "@_fa": "true",
            "$": "Spennati, Elena"
          },
          {
            "@_fa": "true",
            "$": "Riani, Paola"
          },
          {
            "@_fa": "true",
            "$": "Daturi, Marco"
          },
          {
            "@_fa": "true",
            "$": "Busca, Guido"
          },
          {
            "@_fa": "true",
            "$": "Garbarino, Gabriella"
          }
        ],
        "link": [
          {
            "@_fa": "true",
            "@rel": "self",
            "@href": "https://api.elsevier.com/content/article/pii/S0926860X25005277"
          },
          {
            "@_fa": "true",
            "@rel": "scidir",
            "@href": "https://www.sciencedirect.com/science/article/pii/S0926860X25005277"
          }
        ],
        "dc:format": "application/json",
        "openaccessType": "Full",
        "pii": "S0926-860X(25)00527-7",
        "prism:volume": "709",
        "articleNumber": "120625",
        "prism:publisher": "The Authors. Published by Elsevier B.V.",
        "dc:title": "CO2 methanation over Ru- and Ni/Al2O3 catalysts: Effect of preparation solvent on performance and surface chemistry",
        "prism:copyright": "© 2025 The Authors. Published by Elsevier B.V.",
        "openaccess": "1",
        "prism:issn": "0926860X",
        "dcterms:subject": [
          {
            "@_fa": "true",
            "$": "Hydrogenation"
          },
          {
            "@_fa": "true",
            "$": "CO2 methanation"
          },
          {
            "@_fa": "true",
            "$": "Catalyst design"
          },
          {
            "@_fa": "true",
            "$": "Ruthenium-alumina"
          },
          {
            "@_fa": "true",
            "$": "Solvent"
          },
          {
            "@_fa": "true",
            "$": "Pretreatment"
          }
        ],
        "openaccessArticle": "true",
        "prism:publicationName": "Applied Catalysis A: General",
        "openaccessSponsorType": "ElsevierBranded",
        "prism:pageRange": "120625",
        "pubType": "fla",
        "prism:coverDisplayDate": "5 January 2026",
        "prism:doi": "10.1016/j.apcata.2025.120625",
        "prism:startingPage": "120625",
        "dc:identifier": "doi:10.1016/j.apcata.2025.120625",
        "openaccessSponsorName": "CRUI: Hybrid journals 2023"
      },
      "objects": {
        "object": [
          {
            "@category": "standard",
            "@height": "446",
            "@width": "603",
            "@_fa": "true",
            "$": "https://api.elsevier.com/content/object/eid/1-s2.0-S0926860X25005277-gr4.jpg?httpAccept=%2A%2F%2A",
            "@multimediatype": "JPEG image file",
            "@type": "IMAGE-DOWNSAMPLED",
            "@size": "49599",
            "@ref": "gr4",
            "@mimetype": "image/jpeg"
          },
          {
            "@category": "thumbnail",
            "@height": "162",
            "@width": "219",
            "@_fa": "true",
            "$": "https://api.elsevier.com/content/object/eid/1-s2.0-S0926860X25005277-gr4.sml?httpAccept=%2A%2F%2A",
            "@multimediatype": "GIF image file",
            "@type": "IMAGE-THUMBNAIL",
            "@size": "8514",
            "@ref": "gr4",
            "@mimetype": "image/gif"
          },
          {
            "@category": "standard",
            "@height": "705",
            "@width": "565",
            "@_fa": "true",
            "$": "https://api.elsevier.com/content/object/eid/1-s2.0-S0926860X25005277-gr3.jpg?httpAccept=%2A%2F%2A",
            "@multimediatype": "JPEG image file",
            "@type": "IMAGE-DOWNSAMPLED",
            "@size": "65202",
            "@ref": "gr3",
            "@mimetype": "image/jpeg"
          },
          {
            "@category": "thumbnail",
            "@height": "164",
            "@width": "131",
            "@_fa": "true",
            "$": "https://api.elsevier.com/content/object/eid/1-s2.0-S0926860X25005277-gr3.sml?httpAccept=%2A%2F%2A",
            "@multimediatype": "GIF image file",
            "@type": "IMAGE-THUMBNAIL",
            "@size": "5513",
            "@ref": "gr3",
            "@mimetype": "image/gif"
          },
          {
            "@category": "standard",
            "@height": "726",
            "@width": "602",
            "@_fa": "true",
            "$": "https://api.elsevier.com/content/object/eid/1-s2.0-S0926860X25005277-gr6.jpg?httpAccept=%2A%2F%2A",
            "@multimediatype": "JPEG image file",
            "@type": "IMAGE-DOWNSAMPLED",
            "@size": "81646",
            "@ref": "gr6",
            "@mimetype": "image/jpeg"
          },
          {
            "@category": "thumbnail",
            "@height": "164",
            "@width": "136",
            "@_fa": "true",
            "$": "https://api.elsevier.com/content/object/eid/1-s2.0-S0926860X25005277-gr6.sml?httpAccept=%2A%2F%2A",
            "@multimediatype": "GIF image file",
            "@type": "IMAGE-THUMBNAIL",
            "@size": "7038",
            "@ref": "gr6",
            "@mimetype": "image/gif"
          },
          {
            "@category": "standard",
            "@height": "734",
            "@width": "376",
            "@_fa": "true",
            "$": "https://api.elsevier.com/content/object/eid/1-s2.0-S0926860X25005277-gr5.jpg?httpAccept=%2A%2F%2A",
            "@multimediatype": "JPEG image file",
            "@type": "IMAGE-DOWNSAMPLED",
            "@size": "63987",
            "@ref": "gr5",
            "@mimetype": "image/jpeg"
          },
          {
            "@category": "thumbnail",
            "@height": "164",
            "@width": "84",
            "@_fa": "true",
            "$": "https://api.elsevier.com/content/object/eid/1-s2.0-S0926860X25005277-gr5.sml?httpAccept=%2A%2F%2A",
            "@multimediatype": "GIF image file",
            "@type": "IMAGE-THUMBNAIL",
            "@size": "4522",
            "@ref": "gr5",
            "@mimetype": "image/gif"
          },
          {
            "@category": "standard",
            "@height": "254",
            "@width": "791",
            "@_fa": "true",
            "$": "https://api.elsevier.com/content/object/eid/1-s2.0-S0926860X25005277-gr2.jpg?httpAccept=%2A%2F%2A",
            "@multimediatype": "JPEG image file",
            "@type": "IMAGE-DOWNSAMPLED",
            "@size": "61786",
            "@ref": "gr2",
            "@mimetype": "image/jpeg"
          },
          {
            "@category": "thumbnail",
            "@height": "70",
            "@width": "219",
            "@_fa": "true",
            "$": "https://api.elsevier.com/content/object/eid/1-s2.0-S0926860X25005277-gr2.sml?httpAccept=%2A%2F%2A",
            "@multimediatype": "GIF image file",
            "@type": "IMAGE-THUMBNAIL",
            "@size": "11092",
            "@ref": "gr2",
            "@mimetype": "image/gif"
          },
          {
            "@category": "standard",
            "@height": "420",
            "@width": "376",
            "@_fa": "true",
            "$": "https://api.elsevier.com/content/object/eid/1-s2.0-S0926860X25005277-gr1.jpg?httpAccept=%2A%2F%2A",
            "@multimediatype": "JPEG image file",
            "@type": "IMAGE-DOWNSAMPLED",
            "@size": "30397",
            "@ref": "gr1",
            "@mimetype": "image/jpeg"
          },
          {
            "@category": "thumbnail",
            "@height": "164",
            "@width": "147",
            "@_fa": "true",
            "$": "https://api.elsevier.com/content/object/eid/1-s2.0-S0926860X25005277-gr1.sml?httpAccept=%2A%2F%2A",
            "@multimediatype": "GIF image file",
            "@type": "IMAGE-THUMBNAIL",
            "@size": "5461",
            "@ref": "gr1",
            "@mimetype": "image/gif"
          },
          {
            "@category": "standard",
            "@height": "628",
            "@width": "600",
            "@_fa": "true",
            "$": "https://api.elsevier.com/content/object/eid/1-s2.0-S0926860X25005277-gr11.jpg?httpAccept=%2A%2F%2A",
            "@multimediatype": "JPEG image file",
            "@type": "IMAGE-DOWNSAMPLED",
            "@size": "85997",
            "@ref": "gr11",
            "@mimetype": "image/jpeg"
          },
          {
            "@category": "thumbnail",
            "@height": "163",
            "@width": "156",
            "@_fa": "true",
            "$": "https://api.elsevier.com/content/object/eid/1-s2.0-S0926860X25005277-gr11.sml?httpAccept=%2A%2F%2A",
            "@multimediatype": "GIF image file",
            "@type": "IMAGE-THUMBNAIL",
            "@size": "11025",
            "@ref": "gr11",
            "@mimetype": "image/gif"
          },
          {
            "@category": "standard",
            "@height": "216",
            "@width": "376",
            "@_fa": "true",
            "$": "https://api.elsevier.com/content/object/eid/1-s2.0-S0926860X25005277-gr10.jpg?httpAccept=%2A%2F%2A",
            "@multimediatype": "JPEG image file",
            "@type": "IMAGE-DOWNSAMPLED",
            "@size": "22537",
            "@ref": "gr10",
            "@mimetype": "image/jpeg"
          },
          {
            "@category": "thumbnail",
            "@height": "126",
            "@width": "219",
            "@_fa": "true",
            "$": "https://api.elsevier.com/content/object/eid/1-s2.0-S0926860X25005277-gr10.sml?httpAccept=%2A%2F%2A",
            "@multimediatype": "GIF image file",
            "@type": "IMAGE-THUMBNAIL",
            "@size": "8057",
            "@ref": "gr10",
            "@mimetype": "image/gif"
          },
          {
            "@category": "standard",
            "@height": "333",
            "@width": "791",
            "@_fa": "true",
            "$": "https://api.elsevier.com/content/object/eid/1-s2.0-S0926860X25005277-gr8.jpg?httpAccept=%2A%2F%2A",
            "@multimediatype": "JPEG image file",
            "@type": "IMAGE-DOWNSAMPLED",
            "@size": "46085",
            "@ref": "gr8",
            "@mimetype": "image/jpeg"
          },
          {
            "@category": "thumbnail",
            "@height": "92",
            "@width": "219",
            "@_fa": "true",
            "$": "https://api.elsevier.com/content/object/eid/1-s2.0-S0926860X25005277-gr8.sml?httpAccept=%2A%2F%2A",
            "@multimediatype": "GIF image file",
            "@type": "IMAGE-THUMBNAIL",
            "@size": "6485",
            "@ref": "gr8",
            "@mimetype": "image/gif"
          },
          {
            "@category": "standard",
            "@height": "357",
            "@width": "791",
            "@_fa": "true",
            "$": "https://api.elsevier.com/content/object/eid/1-s2.0-S0926860X25005277-gr7.jpg?httpAccept=%2A%2F%2A",
            "@multimediatype": "JPEG image file",
            "@type": "IMAGE-DOWNSAMPLED",
            "@size": "64679",
            "@ref": "gr7",
            "@mimetype": "image/jpeg"
          },
          {
            "@category": "thumbnail",
            "@height": "99",
            "@width": "219",
            "@_fa": "true",
            "$": "https://api.elsevier.com/content/object/eid/1-s2.0-S0926860X25005277-gr7.sml?httpAccept=%2A%2F%2A",
            "@multimediatype": "GIF image file",
            "@type": "IMAGE-THUMBNAIL",
            "@size": "9143",
            "@ref": "gr7",
            "@mimetype": "image/gif"
          },
          {
            "@category": "standard",
            "@height": "440",
            "@width": "678",
            "@_fa": "true",
            "$": "https://api.elsevier.com/content/object/eid/1-s2.0-S0926860X25005277-gr9.jpg?httpAccept=%2A%2F%2A",
            "@multimediatype": "JPEG image file",
            "@type": "IMAGE-DOWNSAMPLED",
            "@size": "53470",
            "@ref": "gr9",
            "@mimetype": "image/jpeg"
          },
          {
            "@category": "thumbnail",
            "@height": "142",
            "@width": "219",
            "@_fa": "true",
            "$": "https://api.elsevier.com/content/object/eid/1-s2.0-S0926860X25005277-gr9.sml?httpAccept=%2A%2F%2A",
            "@multimediatype": "GIF image file",
            "@type": "IMAGE-THUMBNAIL",
            "@size": "8670",
            "@ref": "gr9",
            "@mimetype": "image/gif"
          },
          {
            "@category": "standard",
            "@height": "200",
            "@width": "264",
            "@_fa": "true",
            "$": "https://api.elsevier.com/content/object/eid/1-s2.0-S0926860X25005277-ga1.jpg?httpAccept=%2A%2F%2A",
            "@multimediatype": "JPEG image file",
            "@type": "IMAGE-DOWNSAMPLED",
            "@size": "15902",
            "@ref": "ga1",
            "@mimetype": "image/jpeg"
          },
          {
            "@category": "thumbnail",
            "@height": "164",
            "@width": "216",
            "@_fa": "true",
            "$": "https://api.elsevier.com/content/object/eid/1-s2.0-S0926860X25005277-ga1.sml?httpAccept=%2A%2F%2A",
            "@multimediatype": "GIF image file",
            "@type": "IMAGE-THUMBNAIL",
            "@size": "11100",
            "@ref": "ga1",
            "@mimetype": "image/gif"
          },
          {
            "@category": "standard",
            "@height": "762",
            "@width": "602",
            "@_fa": "true",
            "$": "https://api.elsevier.com/content/object/eid/1-s2.0-S0926860X25005277-gr12.jpg?httpAccept=%2A%2F%2A",
            "@multimediatype": "JPEG image file",
            "@type": "IMAGE-DOWNSAMPLED",
            "@size": "97670",
            "@ref": "gr12",
            "@mimetype": "image/jpeg"
          },
          {
            "@category": "thumbnail",
            "@height": "163",
            "@width": "129",
            "@_fa": "true",
            "$": "https://api.elsevier.com/content/object/eid/1-s2.0-S0926860X25005277-gr12.sml?httpAccept=%2A%2F%2A",
            "@multimediatype": "GIF image file",
            "@type": "IMAGE-THUMBNAIL",
            "@size": "12585",
            "@ref": "gr12",
            "@mimetype": "image/gif"
          },
          {
            "@category": "standard",
            "@height": "141",
            "@width": "565",
            "@_fa": "true",
            "$": "https://api.elsevier.com/content/object/eid/1-s2.0-S0926860X25005277-sc1.jpg?httpAccept=%2A%2F%2A",
            "@multimediatype": "JPEG image file",
            "@type": "IMAGE-DOWNSAMPLED",
            "@size": "17105",
            "@ref": "sc1",
            "@mimetype": "image/jpeg"
          },
          {
            "@category": "thumbnail",
            "@height": "55",
            "@width": "219",
            "@_fa": "true",
            "$": "https://api.elsevier.com/content/object/eid/1-s2.0-S0926860X25005277-sc1.sml?httpAccept=%2A%2F%2A",
            "@multimediatype": "GIF image file",
            "@type": "IMAGE-THUMBNAIL",
            "@size": "3528",
            "@ref": "sc1",
            "@mimetype": "image/gif"
          },
          {
            "@category": "high",
            "@height": "1971",
            "@width": "2663",
            "@_fa": "true",
            "$": "https://api.elsevier.com/content/object/eid/1-s2.0-S0926860X25005277-gr4_lrg.jpg?httpAccept=%2A%2F%2A",
            "@multimediatype": "JPEG image file",
            "@type": "IMAGE-HIGH-RES",
            "@size": "258783",
            "@ref": "gr4",
            "@mimetype": "image/jpeg"
          },
          {
            "@category": "high",
            "@height": "3115",
            "@width": "2495",
            "@_fa": "true",
            "$": "https://api.elsevier.com/content/object/eid/1-s2.0-S0926860X25005277-gr3_lrg.jpg?httpAccept=%2A%2F%2A",
            "@multimediatype": "JPEG image file",
            "@type": "IMAGE-HIGH-RES",
            "@size": "345027",
            "@ref": "gr3",
            "@mimetype": "image/jpeg"
          },
          {
            "@category": "high",
            "@height": "3207",
            "@width": "2661",
            "@_fa": "true",
            "$": "https://api.elsevier.com/content/object/eid/1-s2.0-S0926860X25005277-gr6_lrg.jpg?httpAccept=%2A%2F%2A",
            "@multimediatype": "JPEG image file",
            "@type": "IMAGE-HIGH-RES",
            "@size": "407128",
            "@ref": "gr6",
            "@mimetype": "image/jpeg"
          },
          {
            "@category": "high",
            "@height": "3249",
            "@width": "1664",
            "@_fa": "true",
            "$": "https://api.elsevier.com/content/object/eid/1-s2.0-S0926860X25005277-gr5_lrg.jpg?httpAccept=%2A%2F%2A",
            "@multimediatype": "JPEG image file",
            "@type": "IMAGE-HIGH-RES",
            "@size": "314895",
            "@ref": "gr5",
            "@mimetype": "image/jpeg"
          },
          {
            "@category": "high",
            "@height": "1121",
            "@width": "3493",
            "@_fa": "true",
            "$": "https://api.elsevier.com/content/object/eid/1-s2.0-S0926860X25005277-gr2_lrg.jpg?httpAccept=%2A%2F%2A",
            "@multimediatype": "JPEG image file",
            "@type": "IMAGE-HIGH-RES",
            "@size": "276251",
            "@ref": "gr2",
            "@mimetype": "image/jpeg"
          },
          {
            "@category": "high",
            "@height": "1859",
            "@width": "1666",
            "@_fa": "true",
            "$": "https://api.elsevier.com/content/object/eid/1-s2.0-S0926860X25005277-gr1_lrg.jpg?httpAccept=%2A%2F%2A",
            "@multimediatype": "JPEG image file",
            "@type": "IMAGE-HIGH-RES",
            "@size": "151700",
            "@ref": "gr1",
            "@mimetype": "image/jpeg"
          },
          {
            "@category": "high",
            "@height": "2783",
            "@width": "2659",
            "@_fa": "true",
            "$": "https://api.elsevier.com/content/object/eid/1-s2.0-S0926860X25005277-gr11_lrg.jpg?httpAccept=%2A%2F%2A",
            "@multimediatype": "JPEG image file",
            "@type": "IMAGE-HIGH-RES",
            "@size": "387053",
            "@ref": "gr11",
            "@mimetype": "image/jpeg"
          },
          {
            "@category": "high",
            "@height": "957",
            "@width": "1667",
            "@_fa": "true",
            "$": "https://api.elsevier.com/content/object/eid/1-s2.0-S0926860X25005277-gr10_lrg.jpg?httpAccept=%2A%2F%2A",
            "@multimediatype": "JPEG image file",
            "@type": "IMAGE-HIGH-RES",
            "@size": "129697",
            "@ref": "gr10",
            "@mimetype": "image/jpeg"
          },
          {
            "@category": "high",
            "@height": "1472",
            "@width": "3493",
            "@_fa": "true",
            "$": "https://api.elsevier.com/content/object/eid/1-s2.0-S0926860X25005277-gr8_lrg.jpg?httpAccept=%2A%2F%2A",
            "@multimediatype": "JPEG image file",
            "@type": "IMAGE-HIGH-RES",
            "@size": "303566",
            "@ref": "gr8",
            "@mimetype": "image/jpeg"
          },
          {
            "@category": "high",
            "@height": "1575",
            "@width": "3493",
            "@_fa": "true",
            "$": "https://api.elsevier.com/content/object/eid/1-s2.0-S0926860X25005277-gr7_lrg.jpg?httpAccept=%2A%2F%2A",
            "@multimediatype": "JPEG image file",
            "@type": "IMAGE-HIGH-RES",
            "@size": "473857",
            "@ref": "gr7",
            "@mimetype": "image/jpeg"
          },
          {
            "@category": "high",
            "@height": "1943",
            "@width": "2994",
            "@_fa": "true",
            "$": "https://api.elsevier.com/content/object/eid/1-s2.0-S0926860X25005277-gr9_lrg.jpg?httpAccept=%2A%2F%2A",
            "@multimediatype": "JPEG image file",
            "@type": "IMAGE-HIGH-RES",
            "@size": "357977",
            "@ref": "gr9",
            "@mimetype": "image/jpeg"
          },
          {
            "@category": "high",
            "@height": "886",
            "@width": "1170",
            "@_fa": "true",
            "$": "https://api.elsevier.com/content/object/eid/1-s2.0-S0926860X25005277-ga1_lrg.jpg?httpAccept=%2A%2F%2A",
            "@multimediatype": "JPEG image file",
            "@type": "IMAGE-HIGH-RES",
            "@size": "110198",
            "@ref": "ga1",
            "@mimetype": "image/jpeg"
          },
          {
            "@category": "high",
            "@height": "3369",
            "@width": "2661",
            "@_fa": "true",
            "$": "https://api.elsevier.com/content/object/eid/1-s2.0-S0926860X25005277-gr12_lrg.jpg?httpAccept=%2A%2F%2A",
            "@multimediatype": "JPEG image file",
            "@type": "IMAGE-HIGH-RES",
            "@size": "425261",
            "@ref": "gr12",
            "@mimetype": "image/jpeg"
          },
          {
            "@category": "high",
            "@height": "622",
            "@width": "2495",
            "@_fa": "true",
            "$": "https://api.elsevier.com/content/object/eid/1-s2.0-S0926860X25005277-sc1_lrg.jpg?httpAccept=%2A%2F%2A",
            "@multimediatype": "JPEG image file",
            "@type": "IMAGE-HIGH-RES",
            "@size": "85336",
            "@ref": "sc1",
            "@mimetype": "image/jpeg"
          },
          {
            "@category": "standard",
            "@_fa": "true",
            "$": "https://api.elsevier.com/content/object/eid/1-s2.0-S0926860X25005277-mmc1.docx?httpAccept=%2A%2F%2A",
            "@multimediatype": "Microsoft Word file",
            "@type": "APPLICATION",
            "@size": "5229504",
            "@ref": "mmc1",
            "@mimetype": "application/word"
          },
          {
            "@category": "thumbnail",
            "@_fa": "true",
            "$": "https://api.elsevier.com/content/object/eid/1-s2.0-S0926860X25005277-si0001.svg?httpAccept=%2A%2F%2A",
            "@multimediatype": "Scalable Vector Graphics file",
            "@type": "ALTIMG",
            "@size": "3136",
            "@ref": "si0001",
            "@mimetype": "image/svg+xml"
          },
          {
            "@category": "thumbnail",
            "@_fa": "true",
            "$": "https://api.elsevier.com/content/object/eid/1-s2.0-S0926860X25005277-si0002.svg?httpAccept=%2A%2F%2A",
            "@multimediatype": "Scalable Vector Graphics file",
            "@type": "ALTIMG",
            "@size": "1835",
            "@ref": "si0002",
            "@mimetype": "image/svg+xml"
          },
          {
            "@category": "thumbnail",
            "@_fa": "true",
            "$": "https://api.elsevier.com/content/object/eid/1-s2.0-S0926860X25005277-si0003.svg?httpAccept=%2A%2F%2A",
            "@multimediatype": "Scalable Vector Graphics file",
            "@type": "ALTIMG",
            "@size": "2496",
            "@ref": "si0003",
            "@mimetype": "image/svg+xml"
          }
        ]
      }
    }
  }
}