{
  "metadata": {
    "title": "A detailed kinetic model for the methanol oxidative dehydrogenation on vanadia-based catalysts: Aggregation state role and active site requirements",
    "authors": "; ; ",
    "journal": "Applied Catalysis A: General",
    "date": "2024-07-25",
    "doi": "10.1016/j.apcata.2024.119807",
    "abstract": "",
    "uri": "https://api.elsevier.com/content/article/pii/S0926860X24002515",
    "pii": "S0926860X24002515"
  },
  "fulltext": {
    "full-text-retrieval-response": {
      "scopus-eid": "2-s2.0-85193615801",
      "originalText": "serial JL 271346 291210 291744 291809 31 Applied Catalysis A: General APPLIEDCATALYSISAGENERAL 2024-05-20 2024-05-20 2024-05-22 2024-05-22 2024-06-08T00:55:01 1-s2.0-S0926860X24002515 S0926-860X(24)00251-5 S0926860X24002515 10.1016/j.apcata.2024.119807 S300 S300.1 FULL-TEXT 1-s2.0-S0926860X24X00101 2024-07-19T03:26:07.554679Z 0 0 20240725 2024 2024-05-20T15:28:10.759749Z absattachment articleinfo articlenumber articletitlenorm authfirstinitialnorm authfirstsurnamenorm cid cids contenttype copyright crossmark dateloaded dateloadedtxt datesearch datesort dateupdated dco docsubtype doctype doi eid ewtransactionid hubeid indexeddate issn issnnorm itemstage itemtransactionid itemweight openaccess openarchive pg pgfirst pii piinorm pubdatestart pubdatetxt pubyr sortorder srctitle srctitlenorm srctype ssids alllist content subj subheadings suppl tomb volfirst volissue volumelist webpdf webpdfpagecount yearnav figure table e-component body mmlmath acknowledge affil appendices articletitle auth authfirstini authfull authkeywords authlast grantnumber grantsponsor grantsponsorid highlightsabst primabst ref specialabst 0926-860X 0926860X true 682 682 C Volume 682 2 119807 119807 119807 20240725 25 July 2024 2024-07-25 2024 article fla © 2024 Elsevier B.V. All rights are reserved, including those for text and data mining, AI training, and similar technologies. ADETAILEDKINETICMODELFORMETHANOLOXIDATIVEDEHYDROGENATIONVANADIABASEDCATALYSTSAGGREGATIONSTATEROLEACTIVESITEREQUIREMENTS GALDAMES G 1 Introduction 2 Methodology/experimental 2.1 Catalysts preparation 2.2 Catalysts characterization 2.3 Catalytic activity 2.4 Reactor modeling and kinetic parameter fitting 3 Results and discussion 3.1 Catalysts characterizations 3.2 XRD and Raman spectroscopy 3.3 UV–vis DRS 3.4 Catalytic activity 3.5 Model derivation 3.6 Parameter fitting 3.7 Selectivity descriptors 4 Conclusions CRediT authorship contribution statement Acknowledgements Appendix A Supplementary material References HASSAN 2023 17383 17408 Q PAPADIAS 2021 24169 24189 D UMEGAKI 2009 2303 2311 T OLAH 2005 2636 2639 G MONDAL 2021 8361 8405 U BEHRENS 2015 M HASZELDINE 2018 20160447 R TAKHTRAVANCHI 2021 172 194 M KARIUKI 2019 1 12 S KAICHEV 2014 59 70 V COZZOLINO 2007 191 200 M LANGESLAY 2019 2128 2191 R FARALDOS 1996 214 221 M KILOS 2009 2830 2836 B WACHS 2013 11762 I GOMEZCAPIRO 2021 6477 6489 O KHODAKOV 1999 205 216 A SANTANDER 2020 117513 P PAPULOVSKIY 2021 19352 19363 E SCHUMACHER 2022 14874 14887 L CARRERO 2014 3357 3380 C HAMILTON 2012 1346 1359 N KUBE 2017 3446 3455 P DINSE 2009 43 50 A HESS 2009 319 326 C FENG 2004 619 629 T FENG 2002 301 309 T BROOMHEAD 2022 11801 11820 W ELMI 1989 387 393 A BUSCA 1987 5263 5269 G KAICHEV 2016 82 94 V DEO 1992 27 42 G DEO 1994 323 334 G GASSER 1988 325 333 D OYAMA 2003 1845 1852 S FORZATTI 1997 387 408 P TATIBOUET 1997 213 252 J DESHLAHRA 2014 26115 26129 P MARS 1954 41 59 P LIU 2004 161 169 H LI 2017 19393 19406 N WACHS 1996 437 455 I BEATTIE 1969 2322 I VUURMAN 1991 9928 9937 M WACHS 2011 36 42 I BRONKEMA 2007 14530 14540 J TIAN 2006 9593 9600 H CENTI 1996 267 298 G TAUC 1968 37 46 J HELALI 2017 100 Z LI 2006 23337 23342 W ZHAO 2013 22 27 Y HU 1995 10911 10922 H SODESAWA 1986 63 69 T BUSCA 1996 457 496 G WACHS 1978 531 558 I LIU 2016 6591 6600 Z LOUIS 1988 354 366 C LIU 2003 10840 10847 H LIU 2005 2155 2163 H TAKAHASHI 1983 1061 1064 K LI 2016 29290 29301 N TATIBOUET 2001 205 216 J DESHLAHRA 2015 666 682 P KWON 2018 228 247 S CAI 2023 1102 1119 G ALLISON 1985 127 135 J CORRALPEREZ 2018 13884 13891 J GOODROW 2007 14753 14761 A GALDAMESX2024X119807 GALDAMESX2024X119807XG 2026-05-22T00:00:00.000Z 2026-05-22T00:00:00.000Z http://creativecommons.org/licenses/by-nc-nd/4.0/ © 2024 Elsevier B.V. All rights are reserved, including those for text and data mining, AI training, and similar technologies. 2024-05-24T00:20:03.978Z http://vtw.elsevier.com/data/voc/AddOnTypes/50.7/aggregated-refined NCN2021_090 ANID ANID http://data.elsevier.com/vocabulary/SciValFunders/501100020884 http://sws.geonames.org/3895114 CONICYT PIA/APOYO CCTE AFB170007 CONICYT Comisión Nacional de Investigación Científica y Tecnológica http://data.elsevier.com/vocabulary/SciValFunders/501100002848 http://sws.geonames.org/3895114/ ANID-Chile /2020-21201192 The authors thank the government of Chile for the financing assigned through the following projects: Millennium Science Initiative Program \\u2013 NCN2021_090, CONICYT PIA/APOYO CCTE AFB170007, ANID-Chile. Gabriel Galdames acknowledges ANID (Chile) for the doctoral scholarship Beca de Doc.Nac./2020-21201192. https://doi.org/10.15223/policy-017 https://doi.org/10.15223/policy-037 https://doi.org/10.15223/policy-012 https://doi.org/10.15223/policy-029 https://doi.org/10.15223/policy-004 item S0926-860X(24)00251-5 S0926860X24002515 1-s2.0-S0926860X24002515 10.1016/j.apcata.2024.119807 271346 2024-07-19T03:26:07.554679Z 2024-07-25 1-s2.0-S0926860X24002515-main.pdf https://s3-eu-west-1.amazonaws.com/prod-ucs-content-store-eu-west/content/pii:S0926860X24002515/MAIN/application/pdf/188eaab32436e04bb2c44313cd7a8219/main.pdf main.pdf pdf true 3849629 MAIN 12 1-s2.0-S0926860X24002515-main_1.png https://s3-eu-west-1.amazonaws.com/prod-ucs-content-store-eu-west/content/pii:S0926860X24002515/PREVIEW/image/png/3461b11c5d5170906a6015ee35384756/main_1.png main_1.png png 60175 849 656 IMAGE-WEB-PDF 1 1-s2.0-S0926860X24002515-gr6.jpg https://s3-eu-west-1.amazonaws.com/prod-ucs-content-store-eu-west/content/pii:S0926860X24002515/gr6/DOWNSAMPLED/image/jpeg/d58a3e0462492e7f46b8677629feecc1/gr6.jpg gr6 gr6.jpg jpg 69410 998 629 IMAGE-DOWNSAMPLED 1-s2.0-S0926860X24002515-gr5.jpg https://s3-eu-west-1.amazonaws.com/prod-ucs-content-store-eu-west/content/pii:S0926860X24002515/gr5/DOWNSAMPLED/image/jpeg/c97f992050daf6e78d648dd014c4f857/gr5.jpg gr5 gr5.jpg jpg 31492 299 602 IMAGE-DOWNSAMPLED 1-s2.0-S0926860X24002515-gr4.jpg https://s3-eu-west-1.amazonaws.com/prod-ucs-content-store-eu-west/content/pii:S0926860X24002515/gr4/DOWNSAMPLED/image/jpeg/3a9558b699fc94fd77d4d8beaa40c70a/gr4.jpg gr4 gr4.jpg jpg 14705 298 339 IMAGE-DOWNSAMPLED 1-s2.0-S0926860X24002515-gr3.jpg https://s3-eu-west-1.amazonaws.com/prod-ucs-content-store-eu-west/content/pii:S0926860X24002515/gr3/DOWNSAMPLED/image/jpeg/e26a0363eac5af675fbe6487be95137e/gr3.jpg gr3 gr3.jpg jpg 33564 296 602 IMAGE-DOWNSAMPLED 1-s2.0-S0926860X24002515-gr2.jpg https://s3-eu-west-1.amazonaws.com/prod-ucs-content-store-eu-west/content/pii:S0926860X24002515/gr2/DOWNSAMPLED/image/jpeg/53e1063b70b91e9fea2ddcfeaa282ae2/gr2.jpg gr2 gr2.jpg jpg 31721 294 602 IMAGE-DOWNSAMPLED 1-s2.0-S0926860X24002515-ga1.jpg https://s3-eu-west-1.amazonaws.com/prod-ucs-content-store-eu-west/content/pii:S0926860X24002515/ga1/DOWNSAMPLED/image/jpeg/1fbedf349889347729554c7fdb79b28d/ga1.jpg ga1 true ga1.jpg jpg 22510 192 500 IMAGE-DOWNSAMPLED 1-s2.0-S0926860X24002515-gr1.jpg https://s3-eu-west-1.amazonaws.com/prod-ucs-content-store-eu-west/content/pii:S0926860X24002515/gr1/DOWNSAMPLED/image/jpeg/a5576a72632641c40a0f3588d3e46506/gr1.jpg gr1 gr1.jpg jpg 33037 366 339 IMAGE-DOWNSAMPLED 1-s2.0-S0926860X24002515-gr8.jpg https://s3-eu-west-1.amazonaws.com/prod-ucs-content-store-eu-west/content/pii:S0926860X24002515/gr8/DOWNSAMPLED/image/jpeg/00729380f39c9e8d651a0197312215da/gr8.jpg gr8 gr8.jpg jpg 35380 293 602 IMAGE-DOWNSAMPLED 1-s2.0-S0926860X24002515-gr7.jpg https://s3-eu-west-1.amazonaws.com/prod-ucs-content-store-eu-west/content/pii:S0926860X24002515/gr7/DOWNSAMPLED/image/jpeg/9461bea8fe3fcc27d60f1126f8abd540/gr7.jpg gr7 gr7.jpg jpg 33843 360 339 IMAGE-DOWNSAMPLED 1-s2.0-S0926860X24002515-gr6.sml https://s3-eu-west-1.amazonaws.com/prod-ucs-content-store-eu-west/content/pii:S0926860X24002515/gr6/THUMBNAIL/image/gif/beb1acf4dfb58ec300d99a810209d1b0/gr6.sml gr6 gr6.sml sml 4420 163 103 IMAGE-THUMBNAIL 1-s2.0-S0926860X24002515-gr5.sml https://s3-eu-west-1.amazonaws.com/prod-ucs-content-store-eu-west/content/pii:S0926860X24002515/gr5/THUMBNAIL/image/gif/199fa132e895925e5c9e48516f25b670/gr5.sml gr5 gr5.sml sml 5654 109 219 IMAGE-THUMBNAIL 1-s2.0-S0926860X24002515-gr4.sml https://s3-eu-west-1.amazonaws.com/prod-ucs-content-store-eu-west/content/pii:S0926860X24002515/gr4/THUMBNAIL/image/gif/58f27680ada2960743fdfe3b186121a1/gr4.sml gr4 gr4.sml sml 4733 164 186 IMAGE-THUMBNAIL 1-s2.0-S0926860X24002515-gr3.sml https://s3-eu-west-1.amazonaws.com/prod-ucs-content-store-eu-west/content/pii:S0926860X24002515/gr3/THUMBNAIL/image/gif/a5b2c3da5af7980f013a4d829799d4b4/gr3.sml gr3 gr3.sml sml 6528 108 219 IMAGE-THUMBNAIL 1-s2.0-S0926860X24002515-gr2.sml https://s3-eu-west-1.amazonaws.com/prod-ucs-content-store-eu-west/content/pii:S0926860X24002515/gr2/THUMBNAIL/image/gif/b3b464c0374ac0d7ac055b0b98637f53/gr2.sml gr2 gr2.sml sml 6218 107 219 IMAGE-THUMBNAIL 1-s2.0-S0926860X24002515-ga1.sml https://s3-eu-west-1.amazonaws.com/prod-ucs-content-store-eu-west/content/pii:S0926860X24002515/ga1/THUMBNAIL/image/gif/d767b0ceb4d702d34f5567224b3111d6/ga1.sml ga1 true ga1.sml sml 7584 84 219 IMAGE-THUMBNAIL 1-s2.0-S0926860X24002515-gr1.sml https://s3-eu-west-1.amazonaws.com/prod-ucs-content-store-eu-west/content/pii:S0926860X24002515/gr1/THUMBNAIL/image/gif/aaa5917545ce9b1837fb6395cc5a813a/gr1.sml gr1 gr1.sml sml 8061 164 152 IMAGE-THUMBNAIL 1-s2.0-S0926860X24002515-gr8.sml https://s3-eu-west-1.amazonaws.com/prod-ucs-content-store-eu-west/content/pii:S0926860X24002515/gr8/THUMBNAIL/image/gif/28c5c4cfa4c919191411c8d015c7e999/gr8.sml gr8 gr8.sml sml 6108 106 219 IMAGE-THUMBNAIL 1-s2.0-S0926860X24002515-gr7.sml https://s3-eu-west-1.amazonaws.com/prod-ucs-content-store-eu-west/content/pii:S0926860X24002515/gr7/THUMBNAIL/image/gif/8744299a8dc75b68f78d167576d5764e/gr7.sml gr7 gr7.sml sml 7723 163 154 IMAGE-THUMBNAIL 1-s2.0-S0926860X24002515-gr6_lrg.jpg https://s3-eu-west-1.amazonaws.com/prod-ucs-content-store-eu-west/content/pii:S0926860X24002515/HIGHRES/image/jpeg/850c5d503041962b9272999360cc7609/gr6_lrg.jpg gr6 gr6_lrg.jpg jpg 325492 4408 2779 IMAGE-HIGH-RES 1-s2.0-S0926860X24002515-gr5_lrg.jpg https://s3-eu-west-1.amazonaws.com/prod-ucs-content-store-eu-west/content/pii:S0926860X24002515/HIGHRES/image/jpeg/d12ae370bb498b966c17db327b3e27d4/gr5_lrg.jpg gr5 gr5_lrg.jpg jpg 152874 1323 2661 IMAGE-HIGH-RES 1-s2.0-S0926860X24002515-gr4_lrg.jpg https://s3-eu-west-1.amazonaws.com/prod-ucs-content-store-eu-west/content/pii:S0926860X24002515/HIGHRES/image/jpeg/9bedc78ec76f2937ea55907fc097eacd/gr4_lrg.jpg gr4 gr4_lrg.jpg jpg 59882 1318 1497 IMAGE-HIGH-RES 1-s2.0-S0926860X24002515-gr3_lrg.jpg https://s3-eu-west-1.amazonaws.com/prod-ucs-content-store-eu-west/content/pii:S0926860X24002515/HIGHRES/image/jpeg/db995a2c749d2ebcc920a5a21e7871c4/gr3_lrg.jpg gr3 gr3_lrg.jpg jpg 167032 1307 2661 IMAGE-HIGH-RES 1-s2.0-S0926860X24002515-gr2_lrg.jpg https://s3-eu-west-1.amazonaws.com/prod-ucs-content-store-eu-west/content/pii:S0926860X24002515/HIGHRES/image/jpeg/2228fcbe17abd7896ebdc8220a0adb62/gr2_lrg.jpg gr2 gr2_lrg.jpg jpg 147429 1301 2661 IMAGE-HIGH-RES 1-s2.0-S0926860X24002515-ga1_lrg.jpg https://s3-eu-west-1.amazonaws.com/prod-ucs-content-store-eu-west/content/pii:S0926860X24002515/HIGHRES/image/jpeg/529becb27b2ad53fa1b63d4bc09833cb/ga1_lrg.jpg ga1 true ga1_lrg.jpg jpg 152091 851 2213 IMAGE-HIGH-RES 1-s2.0-S0926860X24002515-gr1_lrg.jpg https://s3-eu-west-1.amazonaws.com/prod-ucs-content-store-eu-west/content/pii:S0926860X24002515/HIGHRES/image/jpeg/42ece33b5eb11376899badaf0297daa4/gr1_lrg.jpg gr1 gr1_lrg.jpg jpg 156491 1616 1497 IMAGE-HIGH-RES 1-s2.0-S0926860X24002515-gr8_lrg.jpg https://s3-eu-west-1.amazonaws.com/prod-ucs-content-store-eu-west/content/pii:S0926860X24002515/HIGHRES/image/jpeg/b48cdb3093e51028f7ff40fd22a77374/gr8_lrg.jpg gr8 gr8_lrg.jpg jpg 148542 1293 2661 IMAGE-HIGH-RES 1-s2.0-S0926860X24002515-gr7_lrg.jpg https://s3-eu-west-1.amazonaws.com/prod-ucs-content-store-eu-west/content/pii:S0926860X24002515/HIGHRES/image/jpeg/533713645fada5d768fc0f3dabb3124c/gr7_lrg.jpg gr7 gr7_lrg.jpg jpg 140961 1588 1497 IMAGE-HIGH-RES 1-s2.0-S0926860X24002515-mmc1.docx https://s3-eu-west-1.amazonaws.com/prod-ucs-content-store-eu-west/content/pii:S0926860X24002515/mmc1/MAIN/application/vnd.openxmlformats-officedocument.wordprocessingml.document/b657d1ed38a000508f78e99119c78517/mmc1.docx mmc1 mmc1.docx docx 1669421 APPLICATION 1-s2.0-S0926860X24002515-si0001.svg https://s3-eu-west-1.amazonaws.com/prod-ucs-content-store-eu-west/content/pii:S0926860X24002515/image/svg+xml/11c388668bb787baa120806bb8e5dea4/si0001.svg si0001 si0001.svg svg 2791 ALTIMG 1-s2.0-S0926860X24002515-si0002.svg https://s3-eu-west-1.amazonaws.com/prod-ucs-content-store-eu-west/content/pii:S0926860X24002515/image/svg+xml/c5d87a2f2a7821b4c7f51d2b6b680482/si0002.svg si0002 si0002.svg svg 2836 ALTIMG 1-s2.0-S0926860X24002515-si0003.svg https://s3-eu-west-1.amazonaws.com/prod-ucs-content-store-eu-west/content/pii:S0926860X24002515/image/svg+xml/3a9fca61be576b5ce85872aa2178c455/si0003.svg si0003 si0003.svg svg 2727 ALTIMG 1-s2.0-S0926860X24002515-si0004.svg https://s3-eu-west-1.amazonaws.com/prod-ucs-content-store-eu-west/content/pii:S0926860X24002515/image/svg+xml/f017e50f082e80fcaed84e4236b98e39/si0004.svg si0004 si0004.svg svg 2248 ALTIMG 1-s2.0-S0926860X24002515-si0005.svg https://s3-eu-west-1.amazonaws.com/prod-ucs-content-store-eu-west/content/pii:S0926860X24002515/image/svg+xml/adefff48aedb8fd8d87678e673f5c15b/si0005.svg si0005 si0005.svg svg 1993 ALTIMG 1-s2.0-S0926860X24002515-si0006.svg https://s3-eu-west-1.amazonaws.com/prod-ucs-content-store-eu-west/content/pii:S0926860X24002515/image/svg+xml/6ba020bac5308defd8f5e6e90e33f275/si0006.svg si0006 si0006.svg svg 1746 ALTIMG 1-s2.0-S0926860X24002515-si0007.svg https://s3-eu-west-1.amazonaws.com/prod-ucs-content-store-eu-west/content/pii:S0926860X24002515/image/svg+xml/7daf74e251254dbd51b8360a2ea812fa/si0007.svg si0007 si0007.svg svg 2739 ALTIMG 1-s2.0-S0926860X24002515-si0008.svg https://s3-eu-west-1.amazonaws.com/prod-ucs-content-store-eu-west/content/pii:S0926860X24002515/image/svg+xml/95a22f97b764a7cd9a55b95a539bcbae/si0008.svg si0008 si0008.svg svg 3209 ALTIMG 1-s2.0-S0926860X24002515-si0009.svg https://s3-eu-west-1.amazonaws.com/prod-ucs-content-store-eu-west/content/pii:S0926860X24002515/image/svg+xml/c003112a10dbcc71c83779f7bdb1cf04/si0009.svg si0009 si0009.svg svg 2970 ALTIMG 1-s2.0-S0926860X24002515-si0010.svg https://s3-eu-west-1.amazonaws.com/prod-ucs-content-store-eu-west/content/pii:S0926860X24002515/image/svg+xml/0b13dd4febcb9dd9f9a09e88b5ad79b6/si0010.svg si0010 si0010.svg svg 3091 ALTIMG 1-s2.0-S0926860X24002515-si0011.svg https://s3-eu-west-1.amazonaws.com/prod-ucs-content-store-eu-west/content/pii:S0926860X24002515/image/svg+xml/7c49383834f6e4bfdae524fbd931397f/si0011.svg si0011 si0011.svg svg 3148 ALTIMG 1-s2.0-S0926860X24002515-si0012.svg https://s3-eu-west-1.amazonaws.com/prod-ucs-content-store-eu-west/content/pii:S0926860X24002515/image/svg+xml/0f1e6f45ca9f8ddcb9449cac112ccc26/si0012.svg si0012 si0012.svg svg 3318 ALTIMG 1-s2.0-S0926860X24002515-si0013.svg https://s3-eu-west-1.amazonaws.com/prod-ucs-content-store-eu-west/content/pii:S0926860X24002515/image/svg+xml/b31b7c3bb1789cc557137cd67b399f63/si0013.svg si0013 si0013.svg svg 3379 ALTIMG 1-s2.0-S0926860X24002515-si0014.svg https://s3-eu-west-1.amazonaws.com/prod-ucs-content-store-eu-west/content/pii:S0926860X24002515/image/svg+xml/ed59e5839ea25c8b4b05fc98cdca0440/si0014.svg si0014 si0014.svg svg 2791 ALTIMG 1-s2.0-S0926860X24002515-si0015.svg https://s3-eu-west-1.amazonaws.com/prod-ucs-content-store-eu-west/content/pii:S0926860X24002515/image/svg+xml/7c8eb51f0b86eda9b68bafa156384f1f/si0015.svg si0015 si0015.svg svg 1118 ALTIMG 1-s2.0-S0926860X24002515-si0016.svg https://s3-eu-west-1.amazonaws.com/prod-ucs-content-store-eu-west/content/pii:S0926860X24002515/image/svg+xml/0b2b8cfc1f699d8ea768d4742fc9c886/si0016.svg si0016 si0016.svg svg 1025 ALTIMG 1-s2.0-S0926860X24002515-si0017.svg https://s3-eu-west-1.amazonaws.com/prod-ucs-content-store-eu-west/content/pii:S0926860X24002515/image/svg+xml/53f0e485e66f9e5d7a01f5168a8dfbbe/si0017.svg si0017 si0017.svg svg 1215 ALTIMG 1-s2.0-S0926860X24002515-si0018.svg https://s3-eu-west-1.amazonaws.com/prod-ucs-content-store-eu-west/content/pii:S0926860X24002515/image/svg+xml/5a23adb122e4ecad9653ceb6cc5d5c91/si0018.svg si0018 si0018.svg svg 1187 ALTIMG 1-s2.0-S0926860X24002515-si0019.svg https://s3-eu-west-1.amazonaws.com/prod-ucs-content-store-eu-west/content/pii:S0926860X24002515/image/svg+xml/10f24ec802b8abf8817d0ef6ab706189/si0019.svg si0019 si0019.svg svg 2188 ALTIMG 1-s2.0-S0926860X24002515-si0020.svg https://s3-eu-west-1.amazonaws.com/prod-ucs-content-store-eu-west/content/pii:S0926860X24002515/image/svg+xml/ffa6e0f9bbf219ab583dd2b8e81e0cd1/si0020.svg si0020 si0020.svg svg 1713 ALTIMG 1-s2.0-S0926860X24002515-si0021.svg https://s3-eu-west-1.amazonaws.com/prod-ucs-content-store-eu-west/content/pii:S0926860X24002515/image/svg+xml/1bd72c1c45952d934251caf56313ced1/si0021.svg si0021 si0021.svg svg 1649 ALTIMG 1-s2.0-S0926860X24002515-si0022.svg https://s3-eu-west-1.amazonaws.com/prod-ucs-content-store-eu-west/content/pii:S0926860X24002515/image/svg+xml/bcd0b0477eda164d5280cd9f124b88f6/si0022.svg si0022 si0022.svg svg 2325 ALTIMG 1-s2.0-S0926860X24002515-si0023.svg https://s3-eu-west-1.amazonaws.com/prod-ucs-content-store-eu-west/content/pii:S0926860X24002515/image/svg+xml/ad98c484374933543913491b30a23087/si0023.svg si0023 si0023.svg svg 2204 ALTIMG 1-s2.0-S0926860X24002515-si0024.svg https://s3-eu-west-1.amazonaws.com/prod-ucs-content-store-eu-west/content/pii:S0926860X24002515/image/svg+xml/7f90726fcbb0b271f29cb14550142217/si0024.svg si0024 si0024.svg svg 1770 ALTIMG 1-s2.0-S0926860X24002515-si0025.svg https://s3-eu-west-1.amazonaws.com/prod-ucs-content-store-eu-west/content/pii:S0926860X24002515/image/svg+xml/eb476d0af0ae40c399753440f53feaa6/si0025.svg si0025 si0025.svg svg 2256 ALTIMG 1-s2.0-S0926860X24002515-si0026.svg https://s3-eu-west-1.amazonaws.com/prod-ucs-content-store-eu-west/content/pii:S0926860X24002515/image/svg+xml/84ab7d2c4ba6c5d30741b7a7729dd7e5/si0026.svg si0026 si0026.svg svg 1722 ALTIMG 1-s2.0-S0926860X24002515-si0027.svg https://s3-eu-west-1.amazonaws.com/prod-ucs-content-store-eu-west/content/pii:S0926860X24002515/image/svg+xml/e5831a32fbcaafca4a0700f51abe8a47/si0027.svg si0027 si0027.svg svg 2390 ALTIMG 1-s2.0-S0926860X24002515-si0028.svg https://s3-eu-west-1.amazonaws.com/prod-ucs-content-store-eu-west/content/pii:S0926860X24002515/image/svg+xml/6ac4f48490b03d3e0dc652744e832447/si0028.svg si0028 si0028.svg svg 3505 ALTIMG 1-s2.0-S0926860X24002515-si0029.svg https://s3-eu-west-1.amazonaws.com/prod-ucs-content-store-eu-west/content/pii:S0926860X24002515/image/svg+xml/2bd3340b2ba2b3f2ec27a1f60c1a5fde/si0029.svg si0029 si0029.svg svg 2650 ALTIMG 1-s2.0-S0926860X24002515-si0030.svg https://s3-eu-west-1.amazonaws.com/prod-ucs-content-store-eu-west/content/pii:S0926860X24002515/image/svg+xml/4466a9c6df5f29581f07bd55d911dcf4/si0030.svg si0030 si0030.svg svg 2812 ALTIMG 1-s2.0-S0926860X24002515-si0031.svg https://s3-eu-west-1.amazonaws.com/prod-ucs-content-store-eu-west/content/pii:S0926860X24002515/image/svg+xml/0aa80933499d0c068594e4f616ef56de/si0031.svg si0031 si0031.svg svg 3156 ALTIMG 1-s2.0-S0926860X24002515-si0032.svg https://s3-eu-west-1.amazonaws.com/prod-ucs-content-store-eu-west/content/pii:S0926860X24002515/image/svg+xml/f95fc1bad2d6678622fbe8f46902627a/si0032.svg si0032 si0032.svg svg 5045 ALTIMG 1-s2.0-S0926860X24002515-si0033.svg https://s3-eu-west-1.amazonaws.com/prod-ucs-content-store-eu-west/content/pii:S0926860X24002515/image/svg+xml/56fd8d9432a672e2fea1a795e962041a/si0033.svg si0033 si0033.svg svg 1892 ALTIMG 1-s2.0-S0926860X24002515-si0034.svg https://s3-eu-west-1.amazonaws.com/prod-ucs-content-store-eu-west/content/pii:S0926860X24002515/image/svg+xml/7a149ac29f16ed3a1e0c3b52e81c2491/si0034.svg si0034 si0034.svg svg 3942 ALTIMG 1-s2.0-S0926860X24002515-si0035.svg https://s3-eu-west-1.amazonaws.com/prod-ucs-content-store-eu-west/content/pii:S0926860X24002515/image/svg+xml/e733fb6af3b9cef7427386441e024edd/si0035.svg si0035 si0035.svg svg 3772 ALTIMG 1-s2.0-S0926860X24002515-si0036.svg https://s3-eu-west-1.amazonaws.com/prod-ucs-content-store-eu-west/content/pii:S0926860X24002515/image/svg+xml/48272e760bce04b344b1c381cde7ab45/si0036.svg si0036 si0036.svg svg 4177 ALTIMG 1-s2.0-S0926860X24002515-si0037.svg https://s3-eu-west-1.amazonaws.com/prod-ucs-content-store-eu-west/content/pii:S0926860X24002515/image/svg+xml/4babdc175bce41e0385d515f500e3b80/si0037.svg si0037 si0037.svg svg 2111 ALTIMG 1-s2.0-S0926860X24002515-si0038.svg https://s3-eu-west-1.amazonaws.com/prod-ucs-content-store-eu-west/content/pii:S0926860X24002515/image/svg+xml/05cb71c7afca25c01cad8f6cf8d86051/si0038.svg si0038 si0038.svg svg 4109 ALTIMG 1-s2.0-S0926860X24002515-si0039.svg https://s3-eu-west-1.amazonaws.com/prod-ucs-content-store-eu-west/content/pii:S0926860X24002515/image/svg+xml/669d4a2fbf0572c6eb331ca173cfca0c/si0039.svg si0039 si0039.svg svg 7869 ALTIMG 1-s2.0-S0926860X24002515-si0040.svg https://s3-eu-west-1.amazonaws.com/prod-ucs-content-store-eu-west/content/pii:S0926860X24002515/image/svg+xml/80c4b60b152b9be06c2a99966f90447a/si0040.svg si0040 si0040.svg svg 6285 ALTIMG 1-s2.0-S0926860X24002515-si0041.svg https://s3-eu-west-1.amazonaws.com/prod-ucs-content-store-eu-west/content/pii:S0926860X24002515/image/svg+xml/fb2304aa6c37e78db1fbcd348471399a/si0041.svg si0041 si0041.svg svg 1872 ALTIMG 1-s2.0-S0926860X24002515-si0042.svg https://s3-eu-west-1.amazonaws.com/prod-ucs-content-store-eu-west/content/pii:S0926860X24002515/image/svg+xml/e3a01ec12b59b797471105be43309491/si0042.svg si0042 si0042.svg svg 2269 ALTIMG 1-s2.0-S0926860X24002515-si0043.svg https://s3-eu-west-1.amazonaws.com/prod-ucs-content-store-eu-west/content/pii:S0926860X24002515/image/svg+xml/33f01e2a7dcf8467e5b2f0c19cddbbb4/si0043.svg si0043 si0043.svg svg 1855 ALTIMG 1-s2.0-S0926860X24002515-si0044.svg https://s3-eu-west-1.amazonaws.com/prod-ucs-content-store-eu-west/content/pii:S0926860X24002515/image/svg+xml/a62d0881ccc6f7a2a43a1c84acc20518/si0044.svg si0044 si0044.svg svg 5093 ALTIMG 1-s2.0-S0926860X24002515-si0045.svg https://s3-eu-west-1.amazonaws.com/prod-ucs-content-store-eu-west/content/pii:S0926860X24002515/image/svg+xml/f9d291ddcde9fac57daec8603a701a20/si0045.svg si0045 si0045.svg svg 5004 ALTIMG 1-s2.0-S0926860X24002515-si0046.svg https://s3-eu-west-1.amazonaws.com/prod-ucs-content-store-eu-west/content/pii:S0926860X24002515/image/svg+xml/ce2bcdb96de5d239f87dce58dae41b7d/si0046.svg si0046 si0046.svg svg 2167 ALTIMG 1-s2.0-S0926860X24002515-si0047.svg https://s3-eu-west-1.amazonaws.com/prod-ucs-content-store-eu-west/content/pii:S0926860X24002515/image/svg+xml/02bca1188c0b6bc4daf68277a3101c47/si0047.svg si0047 si0047.svg svg 2127 ALTIMG 1-s2.0-S0926860X24002515-si0048.svg https://s3-eu-west-1.amazonaws.com/prod-ucs-content-store-eu-west/content/pii:S0926860X24002515/image/svg+xml/8563a24a51003eb28207f25275130577/si0048.svg si0048 si0048.svg svg 1973 ALTIMG 1-s2.0-S0926860X24002515-si0049.svg https://s3-eu-west-1.amazonaws.com/prod-ucs-content-store-eu-west/content/pii:S0926860X24002515/image/svg+xml/2b85f7d4704f59122c607b582362204d/si0049.svg si0049 si0049.svg svg 2261 ALTIMG 1-s2.0-S0926860X24002515-si0050.svg https://s3-eu-west-1.amazonaws.com/prod-ucs-content-store-eu-west/content/pii:S0926860X24002515/image/svg+xml/9dad49261e315347a92188bedc6e7324/si0050.svg si0050 si0050.svg svg 3221 ALTIMG 1-s2.0-S0926860X24002515-si0051.svg https://s3-eu-west-1.amazonaws.com/prod-ucs-content-store-eu-west/content/pii:S0926860X24002515/image/svg+xml/3354b26ee40e7a0095ba247e85367a84/si0051.svg si0051 si0051.svg svg 3278 ALTIMG 1-s2.0-S0926860X24002515-si0052.svg https://s3-eu-west-1.amazonaws.com/prod-ucs-content-store-eu-west/content/pii:S0926860X24002515/image/svg+xml/42eed5a634de36092b98139b262eb0e8/si0052.svg si0052 si0052.svg svg 3561 ALTIMG 1-s2.0-S0926860X24002515-si0053.svg https://s3-eu-west-1.amazonaws.com/prod-ucs-content-store-eu-west/content/pii:S0926860X24002515/image/svg+xml/91e2a3cb63360b07783abc7b881734d3/si0053.svg si0053 si0053.svg svg 3914 ALTIMG 1-s2.0-S0926860X24002515-si0054.svg https://s3-eu-west-1.amazonaws.com/prod-ucs-content-store-eu-west/content/pii:S0926860X24002515/image/svg+xml/e31ef9e05b5a2aed7c3b1fcb8880edf9/si0054.svg si0054 si0054.svg svg 1405 ALTIMG 1-s2.0-S0926860X24002515-si0055.svg https://s3-eu-west-1.amazonaws.com/prod-ucs-content-store-eu-west/content/pii:S0926860X24002515/image/svg+xml/e5fa600bd905e3a59450da3c8bdd3738/si0055.svg si0055 si0055.svg svg 1118 ALTIMG 1-s2.0-S0926860X24002515-si0056.svg https://s3-eu-west-1.amazonaws.com/prod-ucs-content-store-eu-west/content/pii:S0926860X24002515/image/svg+xml/3f810fe6547665d92d53ef3d9c85535c/si0056.svg si0056 si0056.svg svg 3237 ALTIMG 1-s2.0-S0926860X24002515-si0057.svg https://s3-eu-west-1.amazonaws.com/prod-ucs-content-store-eu-west/content/pii:S0926860X24002515/image/svg+xml/71384ef1af6133490851541b78ebe283/si0057.svg si0057 si0057.svg svg 3067 ALTIMG 1-s2.0-S0926860X24002515-si0058.svg https://s3-eu-west-1.amazonaws.com/prod-ucs-content-store-eu-west/content/pii:S0926860X24002515/image/svg+xml/c71b90330eb56cd48618ef3f4de51d02/si0058.svg si0058 si0058.svg svg 1203 ALTIMG 1-s2.0-S0926860X24002515-si0059.svg https://s3-eu-west-1.amazonaws.com/prod-ucs-content-store-eu-west/content/pii:S0926860X24002515/image/svg+xml/34e87f1391ef2ab3a013bda2f024010e/si0059.svg si0059 si0059.svg svg 1369 ALTIMG 1-s2.0-S0926860X24002515-si0060.svg https://s3-eu-west-1.amazonaws.com/prod-ucs-content-store-eu-west/content/pii:S0926860X24002515/image/svg+xml/00466b84cc2a7f68181cbe2b68e281d4/si0060.svg si0060 si0060.svg svg 1458 ALTIMG 1-s2.0-S0926860X24002515-si0061.svg https://s3-eu-west-1.amazonaws.com/prod-ucs-content-store-eu-west/content/pii:S0926860X24002515/image/svg+xml/a4ff1b08db2a612d656f95036842f488/si0061.svg si0061 si0061.svg svg 1555 ALTIMG 1-s2.0-S0926860X24002515-si0062.svg https://s3-eu-west-1.amazonaws.com/prod-ucs-content-store-eu-west/content/pii:S0926860X24002515/image/svg+xml/31d65aeccff5ecbffb23ff6aeb2e923e/si0062.svg si0062 si0062.svg svg 1555 ALTIMG 1-s2.0-S0926860X24002515-si0063.svg https://s3-eu-west-1.amazonaws.com/prod-ucs-content-store-eu-west/content/pii:S0926860X24002515/image/svg+xml/f61f82f4ff990e5437b7180a5ce40362/si0063.svg si0063 si0063.svg svg 12327 ALTIMG 1-s2.0-S0926860X24002515-si0064.svg https://s3-eu-west-1.amazonaws.com/prod-ucs-content-store-eu-west/content/pii:S0926860X24002515/image/svg+xml/5dfb5debb12f5d0bd9b75431ba0629a2/si0064.svg si0064 si0064.svg svg 1057 ALTIMG 1-s2.0-S0926860X24002515-si0065.svg https://s3-eu-west-1.amazonaws.com/prod-ucs-content-store-eu-west/content/pii:S0926860X24002515/image/svg+xml/7154b1ad57d39e9c507a4c5601c2dec5/si0065.svg si0065 si0065.svg svg 1519 ALTIMG 1-s2.0-S0926860X24002515-si0066.svg https://s3-eu-west-1.amazonaws.com/prod-ucs-content-store-eu-west/content/pii:S0926860X24002515/image/svg+xml/7f9dc665961c71d39004f3c2875ed5d7/si0066.svg si0066 si0066.svg svg 1126 ALTIMG 1-s2.0-S0926860X24002515-si0067.svg https://s3-eu-west-1.amazonaws.com/prod-ucs-content-store-eu-west/content/pii:S0926860X24002515/image/svg+xml/5936cf06e8a99dc92d48063f31bfce98/si0067.svg si0067 si0067.svg svg 2524 ALTIMG 1-s2.0-S0926860X24002515-si0068.svg https://s3-eu-west-1.amazonaws.com/prod-ucs-content-store-eu-west/content/pii:S0926860X24002515/image/svg+xml/6ef82866666f6c66ca1f978a88a40651/si0068.svg si0068 si0068.svg svg 1503 ALTIMG 1-s2.0-S0926860X24002515-si0069.svg https://s3-eu-west-1.amazonaws.com/prod-ucs-content-store-eu-west/content/pii:S0926860X24002515/image/svg+xml/6ef82866666f6c66ca1f978a88a40651/si0069.svg si0069 si0069.svg svg 1503 ALTIMG 1-s2.0-S0926860X24002515-si0070.svg https://s3-eu-west-1.amazonaws.com/prod-ucs-content-store-eu-west/content/pii:S0926860X24002515/image/svg+xml/2037a07933442278d0c459b23ab32819/si0070.svg si0070 si0070.svg svg 9126 ALTIMG 1-s2.0-S0926860X24002515-si0071.svg https://s3-eu-west-1.amazonaws.com/prod-ucs-content-store-eu-west/content/pii:S0926860X24002515/image/svg+xml/0b134b115b8f58ff27608fde6b750dad/si0071.svg si0071 si0071.svg svg 1389 ALTIMG 1-s2.0-S0926860X24002515-si0072.svg https://s3-eu-west-1.amazonaws.com/prod-ucs-content-store-eu-west/content/pii:S0926860X24002515/image/svg+xml/bf4eeff19edb3ce662763bf7652dacf1/si0072.svg si0072 si0072.svg svg 1503 ALTIMG 1-s2.0-S0926860X24002515-si0073.svg https://s3-eu-west-1.amazonaws.com/prod-ucs-content-store-eu-west/content/pii:S0926860X24002515/image/svg+xml/f3d60f614c3182aaf71de348786532af/si0073.svg si0073 si0073.svg svg 10200 ALTIMG 1-s2.0-S0926860X24002515-si0074.svg https://s3-eu-west-1.amazonaws.com/prod-ucs-content-store-eu-west/content/pii:S0926860X24002515/image/svg+xml/e24814b3763ce7af0df19bb6b99a0026/si0074.svg si0074 si0074.svg svg 1057 ALTIMG 1-s2.0-S0926860X24002515-si0075.svg https://s3-eu-west-1.amazonaws.com/prod-ucs-content-store-eu-west/content/pii:S0926860X24002515/image/svg+xml/ee5359581532fb9b87242868c379ae7a/si0075.svg si0075 si0075.svg svg 1389 ALTIMG 1-s2.0-S0926860X24002515-si0076.svg https://s3-eu-west-1.amazonaws.com/prod-ucs-content-store-eu-west/content/pii:S0926860X24002515/image/svg+xml/37311dac05afcf22a129920b1053cb09/si0076.svg si0076 si0076.svg svg 1126 ALTIMG 1-s2.0-S0926860X24002515-si0077.svg https://s3-eu-west-1.amazonaws.com/prod-ucs-content-store-eu-west/content/pii:S0926860X24002515/image/svg+xml/c1916075310ae16b55e3383f40d62284/si0077.svg si0077 si0077.svg svg 1503 ALTIMG 1-s2.0-S0926860X24002515-si0078.svg https://s3-eu-west-1.amazonaws.com/prod-ucs-content-store-eu-west/content/pii:S0926860X24002515/image/svg+xml/75e188abfdc093cfacefc690f595140a/si0078.svg si0078 si0078.svg svg 1389 ALTIMG 1-s2.0-S0926860X24002515-am.pdf am am.pdf pdf 1106272 AAM-PDF https://s3-eu-west-1.amazonaws.com/prod-ucs-content-store-eu-west/content/egi:10WKDT1VPR9/MAIN/application/pdf/e07d7871edeb8cad4795f19473be700c/am.pdf APCATA 119807 119807 S0926-860X(24)00251-5 10.1016/j.apcata.2024.119807 Elsevier B.V. Fig. 1 XRD patterns of V2O5/TiO2 as a function of vanadium surface density. Dashed lines correspond to diffraction peaks attributed to vanadium phases on V2O5 crystals (ICSD 98–009–9808). Fig. 1 Fig. 2 a) Absorption edge energy (ε0) calculated using the Tauc law from DR UV–vis spectra and b) absorption edge energy as a function of vanadium surface density. Bulk V2O5 is shown as a straight line. Fig. 2 Fig. 3 Yield of FA, MF, DMM, CO and CO2 as a function of reaction temperature for a) 2.5 VTi (GHSV = 20 L h−1 gcat −1, CH3OH/O2/N2 (feed) = 4/4/92%v/v) and b) 15 VTi (GHSV = 20 L h−1 gcat −1, CH3OH/O2/N2 (feed) = 4/10/86%v/v). Fig. 3 Fig. 4 Summary of the pathways for the methanol ODH reaction considering the hemiacetal intermediate. Fig. 4 Fig. 5 Yield of FA, MF, DMM, CO and CO2 as a function of the residence time for a) 2.5 VTi (200 °C, CH3OH/O2/N2 (feed) = 4/4/92% v/v) and c) 15 VTi (180 °C, CH3OH/O2/N2 (feed) = 4/10/86% v/v). Fig. 5 Fig. 6 Yield of FA, MF, DMM, CO and CO2 as a function of: CH3OH pressure on a) 2.5 VTi (GHSV = 20 L h−1 gcat −1, O2/N2 (feed) = 4/4/balance %v/v, 175 °C), b) 15 VTi (GHSV = 14 L h−1 gcat −1, O2/N2 (feed) = 4/10/balance %v/v, 190 °C); O2 pressure on c) 2.5 VTi (GHSV = 20 L h−1 gcat −1, CH3OH/N2 (feed) = 4/balance %v/v, 175 °C), d) 15 VTi (GHSV = 14 L h−1 gcat −1, CH3OH/N2 (feed) = 4/balance %v/v, 190 °C; e) H2O partial pressure on 15 VTi (GHSV = 14 L h−1 gcat −1, CH3OH/O2/N2 (feed) = 4/10/balance %v/v). Fig. 6 Fig. 7 Parity plot of methanol ODH products models for experimental and predicted FA, MF and DMM concentration on 2.5 VTi and 15 VTi. Fig. 7 Fig. 8 Predicted (dotted line) vs experimental (symbols) FA, MF and DMM yield on a) 2.5 VTi (GHSV = 20 L h−1 gcat −1, CH3OH/O2/N2 (feed) = 4/4/balance %v/v) and b) 15 VTi (GHSV = 10 L h−1 gcat −1, CH3OH/O2/N2 (feed) = 4/10/balance %v/v). Fig. 8 Table 1 Vanadium surface density, surface BET area, mean pore volume and pore size in the supported V2O5 catalysts as a function of the nominal V2O5 content. Table 1 Sample Loading (wt%) Surface density (V nm −2 ) BET Area (m 2 g −1 ) Pore volume (cm 3 g −1 ) Pore Size (nm) TiO2 0 0 50 0.15 15 0.5 VTi 0.6 0.5 47 0.42 32 2.5 VTi 3.0 2.5 50 0.42 32 8 VTi 8.6 8 41 0.38 34 15 VTi 15 15 52 0.47 32 25 VTi 23 25 24 0.16 28 Table 2 Summary of the net elementary steps for methanol ODH to form FA, MF and DMM, via hemiacetal intermediate. Table 2 Step Description Elemental Step 1 Molecular chemisorption of methanol on a redox site CH 3 OH ( g ) + O * ⟷ K 1 CH 3 OH - O * 2 Methanol dehydrogenation (rds): CH 3 OH − O * ⟶ k ODH O 1 H / HCHO - HO * 3 FA desorption: OH / HCHO - HO * ⟶ k 3 HCHO + O 1 H / HO * 4 OH groups recombination: O 1 H / HO * ⟷ K 4 * + H 2 O 5 First oxygen vacancy reoxidation: O 2 + * ⟶ k 5 O * + O M 6 Second oxygen vacancy reoxidation: O M + * ⟶ k 6 O * 7 Molecular chemisorption of methanol on an acid site: CH 3 OH ( g ) + H + ⟷ K 7 CH 3 OH - H + 8 Hemiacetal intermediate formation: CH 3 OH − H + + O 1 H / HCHO − HO * ⟶ k 8 HOCH 2 OCH 3 − H + O 1 H / HO * 9 Hemiacetal interfacial spillover to a redox site HOCH 2 OCH 3 − H + + O * ⟶ K 9 HOCH 2 OCH 3 − O * + H + 10 Hemiacetal dehydrogenation: HOCH 2 OCH 3 − O * ⟶ K 10 OtH / HCOOCH 3 − HO * 11 MF desorption: OH / HCOOCH 3 − HO * ⟶ K 11 HCOOCH 3 + O 1 H / HO * 12 Dehydration reaction: HOCH 2 − OCH 3 − H + + ⟶ ⟵ k 1 ¯ 2 k 12 CH 2 OCH − H + + H 2 O 13 DMM reversible formation: CH 2 OCH 3 − H + + CH3OH ⟷ K 13 CH 2 OCH 3 OCH 3 − H + 14 DMM desorption: CH 2 OCH 3 OCH 3 − H + ⟷ K 14 CH 2 OCH 3 OCH 3 + H + O * : redox lattice oxygen site. H + : Brønsted acid site. O M : unstable atomic oxygen species after the first oxygen vacancy regeneration with molecular O2. O l H : O-H pair in a lattice oxygen next to the dehydrogenation site. Table 3 Parameter fitting for the FA, MF and DMM formation kinetic model, on 2.5 VTi and 15 VTi catalysts. Table 3 Kinetic parameter Sample 2.5 at. V nm −2 15 at. V nm −2 K 1 450 K kP a − 1 1.37 ± 0.80 0.17 ± 0.06 − ∆ H 1 kJ mol − 1 101.7 ± 36.7 83.7 ± 10.8 k ODH 450 K mol mi n − 1 mol V 2 O 5 − 1 3.46 ± 0.61 0.99 ± 0.24 E a ODH kJ mol − 1 79.9 ± 5.1 61.1 ± 5.7 k FA / HA 450 K 0.82 ± 0.23 0.22 ± 0.02 E a FA / HA kJ mol − 1 60.4 ± 22.5 88.3 ± 6.9 K DMM ′ 450 K 1.80 ± 1.41 0.10 ± 0.02 − ∆ H ′ DMM kJ mol − 1 276.7 ± 59.0 311.4 ± 25.0 A detailed kinetic model for the methanol oxidative dehydrogenation on vanadia-based catalysts: Aggregation state role and active site requirements Gabriel Galdames Writing – review & editing Writing – original draft Methodology Investigation Formal analysis Data curation a b Paola Santander Writing – review & editing Formal analysis c Jimenez Romel Jiménez Writing – review & editing Supervision Formal analysis a Alejandro Karelovic Writing – review & editing Supervision Resources Project administration Funding acquisition Conceptualization a b ⁎ a Carbon and Catalysis Laboratory (CarboCat), Department of Chemical Engineering, Faculty of Engineering, Universidad de Concepción, Concepción, Chile Carbon and Catalysis Laboratory (CarboCat), Department of Chemical Engineering, Faculty of Engineering, Universidad de Concepción Concepción Chile Carbon and Catalysis Laboratory (CarboCat), Department of Chemical Engineering, Faculty of Engineering, Universidad de Concepción, Concepción, Chile b Millennium Nucleus in Catalytic Processes towards Sustainable Chemistry (CSC), ANID Millennium Science Initiative Program, Santiago 8320000, Chile Millennium Nucleus in Catalytic Processes towards Sustainable Chemistry (CSC), ANID Millennium Science Initiative Program Santiago 8320000 Chile Millennium Nucleus in Catalytic Processes towards Sustainable Chemistry (CSC), ANID Millennium Science Initiative Program, Santiago 8320000, Chile c Universidad de Santiago de Chile (USACH), Facultad de Química y Biología, Departamento de Ciencias del Ambiente, Santiago, Chile Universidad de Santiago de Chile (USACH), Facultad de Química y Biología, Departamento de Ciencias del Ambiente Santiago Chile Universidad de Santiago de Chile (USACH), Facultad de Química y Biología, Departamento de Ciencias del Ambiente, Santiago, Chile ⁎ Corresponding author at: Carbon and Catalysis Laboratory (CarboCat), Department of Chemical Engineering, Faculty of Engineering, Universidad de Concepción, Concepción, Chile. Carbon and Catalysis Laboratory (CarboCat), Department of Chemical Engineering, Faculty of Engineering, Universidad de Concepción Concepción Chile A kinetic model was derived for the methanol oxidative dehydrogenation to formaldehyde, methyl formate and dimethoxymethane on sub-monolayer and multilayer V2O5/TiO2 catalysts. Considering a hemiacetal intermediate, the model combines Langmuir-Hinshelwood/Eley-Rideal/Mars-van Krevelen mechanisms, accounting for lattice oxygen redox sites and Brønsted acid sites. The fitted model depends on 4 thermodynamically consistent parameters, adequately simulating yield trends with temperature, residence time, and partial pressure of methanol, oxygen and added water. Oxidation steps follow a Mars-van Krevelen redox cycle, while the dimethoxymethane formation is reversible, as the water addition favored the hemiacetal intermediate. The catalyst with higher vanadia surface density was intrinsically more active (lower activation energy of the rate limiting step), attributed to its higher reducibility, while showing weaker methanol adsorption (lower enthalpy of chemisorption). The increase in reducibility correlates with the transition from monomers to polymers to crystalline vanadia when vanadium content increases, as observed by XRD, Raman spectroscopy and DRS-UV–vis. Graphical Abstract Keywords Dimethoxymethane Kinetic modeling Methanol oxidative dehydrogenation Methyl Formate Vanadium oxide catalysts Data Availability Data will be made available on request. 1 Introduction Climate change and the unsustainable use of fossil fuels requires the active search of efficient renewable energy sources. Within these, hydrogen produced by sustainable water electrolysis has drawn considerable attention as an attractive energetic alternative thanks to its versatility, high heating energy and “green” properties [1]. Nevertheless, hydrogen industry faces many challenges. Hydrogen has a low energy density at room temperature, which has motivated the proposal of several alternatives for its transformation and subsequent storage in fuel carriers [2,3]. In this context, methanol has arisen as an attractive candidate due to its possible applications, simple handling, and its potential to make use of already-existing infrastructure [4–6]. Green hydrogen transformation to methanol also allow to valorize CO2, one of the main greenhouse gases, its sequestration being necessary to achieve the Paris Agreement temperature goals, as only reducing CO2 emissions would be insufficient [7,8]. In this context, methanol has been suggested as a most important chemical compound capable of sustaining a “methanol economy”, due to its capacity to be transformed into high-value chemical products, besides its uses as a carrier [4–6] One of the reactions capable of producing value-added chemicals from methanol is methanol partial oxidation, also known as methanol oxidative dehydrogenation (ODH). Its primary products: formaldehyde (FA), methyl formate (MF) and dimethoxymethane (DMM), have a vast array of direct applications as intermediaries for different chemical products. FA is employed in the production of resins like urea formaldehyde, phenol formaldehyde and melamine formaldehyde [9]; MF is mainly used to manufacture formamide, dimethylformamide, and formic acid; while DMM is primarily used as a solvent and to produce perfumes, resins, adhesives, paint strippers, and protective coatings [10]. Industrially, FA, MF and DMM are manufactured through highly distinct processes. FA is produced by methanol oxidation using silver or mixed iron oxide-molybdenum oxide catalysts[11]. The industrial production of MF occurs via the carbonylation of methanol using carbon monoxide over sodium methoxide catalysts in liquid phase. DMM is currently produced via a two-stage process involving the oxidation of methanol to FA over silver or iron-molybdate catalysts followed by condensation reactions in a methanol–formaldehyde mixture using sulfuric acid or solid acidic catalysts[10]. It would be interesting to have a unified heterogeneous catalyst as the foundation for the ODH reaction, without all the drawbacks of the homogenous catalyst or the two-step processes. It would be desirable to design catalysts which, by means of their structural and physical properties, permit to tune the selectivity to each of the different ODH products. For that, we would need a deep understanding of the effect of these properties on the catalytic activity and selectivity of this reaction. Vanadium oxide supported catalysts have been extensively studied for partial oxidation reactions [12–25], and more importantly, there are several studies for the methanol ODH reaction on these catalysts [11,26–34]. The Mars-van Krevelen redox cycle is unanimously accepted as the reaction mechanism on these catalysts, where the rate-determining step (RDS) is the dehydrogenation of a methanol molecule, leading to the formation of adsorbed FA[35–39]. Nevertheless, the mechanism that leads to the different products is still an open field. Kaichev and coworkers have shown that, during CH3OH−O2 turnovers on monolayer VOx highly dispersed on TiO2, the vanadia lattice oxygen participates in the oxidation of methanol via the classical Mars–van Krevelen mechanism, while the vanadium cations are reduced to the V4+ state[10]. A detailed mechanism involving dioxymethylene and formates as key intermediates was also proposed by these authors, as was initially postulated by Busca et al. [30]. In a later work, using Raman spectroscopy, they report an isolated monomeric vanadium oxide species (VOx) with vanadium in a tetrahedral oxygen environment, while the increase of vanadium content leads to the formation of dimers and polymeric forms of (VOx)n in an octahedral oxygen environment, detected only after the formation of 3D vanadium crystallites at the filling of the monolayer coverage. It was established that the crystalline V2O5 oxide is the least active structure in the selective oxidation of methanol, and that the polymeric forms of (VO)x are more active than the monomeric ones [31]. On the contrary, Liu and Iglesia have proposed an ODH mechanism with hemiacetal as the common intermediate for the formation of MF and DMM, with bifunctional pathways on the redox and acid sites of the catalyst [40]. This mechanism has been confirmed by DFT calculations as the pathway with the lower energy barrier on V2O5/TiO2 [41]. More recently, Broomhead and collaborators [28] also studied the ODH reaction on V2O5/TiO2 and the effect of the surface density of the redox, Brønsted and Lewis sites on the catalytic pathways. The relative abundance of these three sites changes with the VOx domain size and surface density, while, as the content of VOx increases, its structure evolves from isolated monovanadates to two-dimensional planar polyvanadates followed by three-dimensional multi-layer polyvanadates. They suggested that FA is formed by CH3OH dissociative adsorption and subsequent dehydrogenation on V-O redox site pairs at the VOx-TiO2 interface, while the DMM forms via methanol and hemiformal, derived from FA, on Brønsted sites at the VOx-TiO2 interface, meanwhile, the MF forms via Tishchenko reaction from FA molecules on exposed titania uncovered by VOx. This different pathways for the MF and DMM formation is a consequence of the VOx domain size: on highly dispersed, monomeric VOx, as in the study by Broomhead et al., MF would follow the Tishchenko reaction on the Lewis sites of the titania, while on crystalline VOx catalysts, MF would be formed by the formic or hemiacetal route, as the titania active sites are fully covered by VOx. It can be seen that, even for the same active metal-support pairs, three mechanisms for MF and DMM formation have been proposed for the methanol ODH reaction: hemiacetal mechanism, formate/dioximethylene mechanism and Tishchenko reaction. In light of the information given above, there is still a lack of understanding on specific reaction details, like nature of the intermediate species, type of active sites and reaction mechanisms. In an effort to understand the complex parallel and series pathways of the methanol ODH reaction and the corresponding kinetics parameters that govern its reactivity, kinetic models for the formation of the main ODH reaction products (FA, MF and DMM), with only hemiacetal (HA) (CH3OCH2OH) as the MF and DMM intermediate, were rigorously derived on integral reaction conditions. V2O5/TiO2 catalysts with variable vanadium content (0.5, 2.5, 8, 15 and 25 V atoms nm−2) were used to understand the effect of the vanadia surface density on the kinetic parameters. The consideration of a hemiacetal intermediate parallel pathway allowed to adequately simulate the trends of FA, MF and DMM formation. The results indicate that there is an increase in the intrinsic ODH activity and a decrease of methanol heat of adsorption attributed to the growth of the vanadium domains with increasing vanadium content, which was confirmed through XRD, Raman, and UV–vis characterizations. A combined Langmuir-Hinshelwood/Eley-Rideal/Mars-van Krevelen kinetic model was successfully fitted for the methanol ODH reaction, considering hemiacetal as the intermediate for MF and DMM formation, with a mean average error of 20% and thermodynamically consistent kinetic parameters. The redox properties of the catalyst primarily determine the activity. The conclusions of this work are important for the development of finely tuned supported VOx catalysts in the pursuit of selective reaction products. 2 Methodology/experimental 2.1 Catalysts preparation Supported catalysts containing vanadium oxide on titania were synthesized via wet impregnation with varying surface concentrations of vanadium (0.5, 2.5, 8, 15 and 25 atom V nm−2) using ammonium metavanadate as the vanadium source (NH4VO3, Sigma-Aldrich), as was reported on a previous publication [18]. The desired surface concentration was determined by the number of vanadium atoms per square nanometer of the catalyst, which was calculated based on the equivalent V2O5 nominal weight content and the BET surface area of the TiO2 support (50 m2 g−1. Evonik P-25). Expressing metal content as surface density instead of mass fraction is common when comparing catalysts supported on oxides with different surface areas, as the particular structure of the supported oxide (monomeric, oligomeric or crystalline) will depend on how easily the monolayer coverage is achieved [17]. The NH4VO3 dissolution was accomplished using oxalic acid (Merck-Millipore) dissolved in heated distilled water in a water bath (80 °C), with a ratio of 2 mol of oxalic acid per mol of NH4VO3, under stirring (700 rpm). After cooling to room temperature, the titania support was mixed in under stirring, and the resulting solute was dried in a rotary evaporator (Laborota 4002, Heidolph) with vacuum at 58 °C during 2 h. Afterwards, the catalysts were dried overnight at 105 °C in a drying oven (Heraeus) and placed in a box furnace (Lindberg/Blue M Moldatherm, Thermo Scientifc). The temperature was raised to 500 °C (heating rate of 10 °C min−1) and the solids were calcined in static air at 500 °C for 3 h. The resulting solids were stored after cooling down to room temperature. Bulk V2O5 was also prepared by calcination of NH4VO3 at 500 °C (heating rate of 10 °C min−1) in static air for 1 h using an equal procedure. 2.2 Catalysts characterization X-ray diffraction (XRD) analyses were performed in an X-ray diffractometer Bruker D4 Endeavor (Billerica, USA) with a solid-state detector (LynxEye) and with Cu Kα radiation (λ = 0.154 nm) in the range of 2θ = 5–90°. Raman spectroscopy was performed in a high-resolution confocal LabRamHR Evolution Nano Horiba Jobin Yvon microscope, with a 633 nm Edge laser line excitation source with an output power of 13.3 mW at the source. The laser spot was focused on the sample using an optic Objective Olympus 100× VIS and NUV camera (B/S UV 50/50 + Lens F125 D25). UV–vis diffuse reflectance spectroscopy (DRS) was performed in a Thermo Scientific Evolution 260 Bio spectrometer equipped with a Spectralon-coated integrating sphere ISA 220. The spectra were recorded in the range of 190 and 1100 nm using a Spectralon discs as a standard. BET surface area, pore volumes and pore size distributions were determined in a Gemini VII Surface Area Analyzer Micromeritics (Georgia, USA) by N2 adsorption-desorption isotherms at 77 K prior degassing at 200 °C during 4 h under N2 flow (Airliquide 99.999%). Surface area was calculated from BET equation and the pore size distributions obtained from the desorption branch of the nitrogen isotherms using Barrett-Joyner-Halenda (BJH) method. 2.3 Catalytic activity Methanol ODH reaction was performed in a tubular fixed-bed stainless-steel reactor (length 60 cm, internal diameter 0.78 cm). In a typical experiment, the catalytic bed was prepared mixing quartz sand (2 g, 150–380 μm particle size) with the catalyst (0.2 g, 150–380 μm particle size) in a catalytic bed of approximately 0.76 cm, constant for all kinetic measurements, was placed inside the isothermal section of an electric oven. The catalyst was placed in the center of the reactor and was held by quartz wool. Before the reaction, the catalyst was in situ pre-treated in airflow (21% vol O2/N2, 20 ml min−1) at 350 °C for 1 h at a heating rate of 10 °C min−1. Then, the temperature was adjusted to the desired value, the O2/CH3OH molar ratio was set to 1 (PCH3OH = 4 kPa, PO2 = 4 kPa, PN2 = 92 kPa), and a total flow of 50 ml min−1 of the gas mixture was conducted through the catalytic bed. The concentration of CH3OH (Merck-Millipore) in the gas phase was controlled using a PTFE saturator submerged in a thermostated bath at 25 °C and N2 (13 ml min−1) was used as carrier gas by bubbling into the saturator. The N2 (Airliquide 99.999%) and dry air (Airliquide 99.999%) flows were controlled by mass flow controllers (Kofloc 8500). The concentrations of reagents and products were measured online using a SRI 8610 C gas chromatograph, equipped with a packed precolumn (SRI Hayesep D 18’’, 5 m) and three separation columns: a packed column (Hayesep D 6’’, 2 m) and two capillary columns (MS5A, 1 m; MXT-WAX, 30 m), an on-stream methanizer with Ni catalyst, a flame-ionization detector and thermal conductivity detector. All transfer lines were held at 100 °C to prevent condensation of reactants and products. The reactor operated at integral reaction conditions. Each reaction condition was maintained for 3 hours, and 7–8 measurements were made per condition. The steady state of the reaction was rapidly achieved, and the mean concentration of each reactant and product at steady state was calculated. An example of methanol concentration versus time on stream is shown in figure S.1 of Supporting information. CH3OH conversion (X) and FA, MF and DMM yields (Y) were calculated according to Eqs. 1 to 4. (1) X CH 3 OH = C H 3 O H IN − CH 3 O H OUT CH 3 O H IN × 100 (2) Y FA = F A OUT CH 3 O H IN × 100 (3) Y MF = 2 M F OUT CH 3 O H IN × 100 (4) Y DMM = 3 DMM OUT CH 3 O H IN × 100 Where IN and OUT subscripts denote the inlet and outlet molar flow rate for each reactant and product, respectively. The effect of the reaction conditions on the reactions kinetics was studied, starting with the temperature (100–300 °C), followed by the variation of the total flow rate (20–70 ml min−1), the partial pressure of reactants (1–20 kPa) and the addition of water to the reactor feed (0–3 kPa). These later examinations were conducted at a temperature where FA, MF and DMM were formed, as to study the selectivity of the reaction. Carbon balance was calculated as follows: (5) C bal = C H 3 O H in C H 3 O H OUT + F A OUT + 2 M F OUT + 3 DMM OUT + C O OUT + C O 2 OUT × 100 2.4 Reactor modeling and kinetic parameter fitting The reactor was modeled as an integral 1-D pseudo-homogeneous plug-flow reactor. Matlab was used to solve the integral form of the rate equations using the command ode45: (6) d P i dW = RT v r i Where Pi is the partial pressure for compound i (kPa), W is the mass of the catalyst bed (g), R is the universal gas constant (J mol−1 K−1), T is temperature (K), v is the volumetric flow fed to the reactor and ri is the net reaction rate for compound i (mol min−1 gcat −1). Transport and heat transfer limitations were ruled out in order to obtain parameters in strictly kinetic regime (Supporting Information, S.2 to S.4) To estimate the numerical values of the kinetic parameters for the FA, MF and DMM formation models, an optimization problem was solved by minimizing the objective function given by the normalization of the squared errors of the prediction of the three partial oxidation products and the O2 reaction consumption (Eq. 7). This optimization problem is solved with Matlab using the function lsqnonlin, in order to obtain statistical parameters used for the computation of the confidence intervals of the kinetic parameters. The confidence interval of each parameter is obtained with the Matlab function nlparci, while the individual and total mean absolute percentage error (MAPE) values were calculated to evaluate the prediction accuracy (Eqs. 8 and 9, respectively). (7) FO = ∑ i = 1 Nc 1 N i ∑ j = 1 Ni P j exp − P j calc P j exp 2 i (8) MAP E i = 1 N i ∑ j = 1 Ni P j exp − P j calc P j exp i × 100 (9) MAP E T = ∑ i N c 1 N i ∑ j = 1 Ni P j exp − P j calc P j exp i × 100 Where Pexp and Pcalc are the experimental and calculated partial pressure of compound i, respectively, while Ni is the number of data points and Nc is the number of compounds considered in the objective function. 3 Results and discussion 3.1 Catalysts characterizations Table 1 shows vanadium surface density and its corresponding V2O5 loading (wt%) of the synthesized catalysts, as well as the BET area and BJH pore volume and size. The surface area and pore size does not vary significantly with the increase in the vanadia loading until the catalyst 25VTi, indicating that the vanadium layer is not blocking the pores of TiO2 for the catalysts with vanadium surface density lower than 25 at. V nm−2. N2 adsorption-desorption isotherms can be found on figure S.5 of the Supporting Information. 3.2 XRD and Raman spectroscopy Fig. 1 shows the X-ray diffractograms of the VOx/TiO2 catalysts. All catalysts feature typical diffraction peaks of anatase and rutile for TiO2, characteristic of P-25 TiO2 support. At low vanadium content, there is an absence of diffraction peaks attributed to vanadium phases, indicating small size and/or amorphous phases. At vanadium surface density higher than 15 at. V nm−2, peaks attributed to crystalline V2O5 start to appear. With the increase of vanadium content, dimers and polymeric forms of (VOx)n are formed, being detected only after the filling of the monolayer coverage at 7.9 V nm−2, as has been reported by Wachs [33,42]. These findings are in line with our Raman spectroscopy results on non-dehydrated samples, where at higher vanadium content (≥ 15 V nm−2) a clear band appears at 994 cm−1, corresponding to lattice vibrations of crystalline V2O5 (figure S.6, Supporting Information). This behavior is in agreement with Kaichev and co-workers findings based on Raman spectra, who report isolated monomeric vanadium oxide species VOx and dimers and polymeric (VOx)n at surface densities lower than 11.7 at. V nm−2 [31]. Our Raman spectra only shows the region 1200–800 cm−2 because titania obscures Raman bands below 700 cm−1 [43]. Nevertheless, the information gathered studying this region permits to study the structure of vanadia on titania, because all the relevant species can be identified in this range: tetrahedral VOx at low surface densities, then octahedral oligomeric (VOx)n species in increasing proportion as we approach the monolayer coverage, and then crystalline V2O5 as the monolayer has been filled [44]. Based on previous works by multiple authors, our titania-supported vanadium catalysts can be identified as following. At 0.5 VTi, monomers of isolated tetrahedral mono-oxo VOx species should be exclusively present, as has been previously reported for sub 2 at. V nm−2 surface densities [45,46]. At 2.5 and 8 VTi, as the surface coverage of vanadium increases, oligomeric chains of (VOx)n start to appear, with increasing fraction until a monolayer of polymeric (VOx)n is formed [15,47]. At 15 VTi and 25 VTi, as the monolayer has already been filled, the deposition of vanadium oxide forms a crystalline 3-D structure in a multilayer composition [44,48,49], as it was detected by XRD and Raman. These VOx domains are of significance for ODH activity because they have different concentration of surface lattice oxygens with unique coordination spheres and neighboring atoms, depending on the three vanadium oxide aggregation states: terminal VO pairs on all domains, bridging V-O-V moieties on polymeric and crystalline structures and binding V-O-Ti linkages on monomeric and polymeric vanadium phases. Given the differences on reactivity for these types of lattice oxygens, their concentration would be closely related to the redox Mars-van Krevelen reactivity, as it was discussed by Broomhead and collaborators [28]. 3.3 UV–vis DRS The absorbance UV–vis spectra and the Kubelka-Munk function spectra, for all catalysts, are shown in figure S.7 and S.8, respectively (Supporting Information). The spectral bands in the 2–6 eV energy range can be attributed to the charge transfer transitions of the ligand O2- to the metal V5+, as was reported by Iglesia and coworkers[17]. Since these bands are broad, the edge energy (ε0) is calculated using the Tauc law. ε0 serves as a descriptor for the near-edge region in amorphous semiconductors and the band gap transitions in crystalline semiconductors[50]. The energy is calculated by intercepting a straight line on the x-axis, given by the gradient of the function [F(R∞)hν]2 with respect to hv, after correcting by the subtraction of the overlap of the TiO2 bands, as can be seen on Fig. 2a. Fig. 2.b shows the effect of the vanadium surface density on the ε0 parameter, with the V2O5 bulk adsorption energy value as a reference. As the vanadium surface density increases, the adsorption energy decreases towards the V2O5 bulk value, indicating the crystallization of the vanadium polymeric domains [17]. Therefore, the vanadium supported catalysts with lower surface density would have a high vanadia dispersion, since the bulk value is reached at 15 at. V nm−2 or higher, in agreement with the findings observed by XRD and Raman. A decrease of the adsorption edge energy is related to a decrease of the band gap energy, which is also related to the reducibility of the metal oxides: Typical irreducible oxides such as MgO show a large band gap, while reducible oxides such as TiO2 present small band gaps [51]. Reducibility of oxides is known to be linked to their redox activity, thus enhancing the ability to undergo reduction in the kinetically relevant steps for ODH reactions [35,52–55]. Therefore, the catalysts with higher vanadium surface density should be more active for the Mars-van Krevelen redox cycle in the methanol ODH reaction. 3.4 Catalytic activity To study the effect of the vanadium structure, specifically the effect of the vanadium phase (monomeric/polymeric versus crystalline) on the catalytic performance of the methanol ODH reaction, catalysts with surface density 2.5 at. V nm−2 and 15 at. V nm−2 were employed. These samples were selected due to their clear differences in structure and absorption edge energy, arising from the distinct characteristics of both sub-monolayer and multilayer vanadium configurations, as previously discussed. CH3OH conversion for all catalysts as a function of temperature is shown in figure S.9 of the Supporting Information while carbon balances for the data used in the kinetic modeling are shown in figure S.10 of the Supporting Information. Fig. 3 shows the FA, MF and DMM yield as function of the temperature, for the 2.5 at. V nm−2 and 15 at. V nm−2 catalysts, respectively. DMM is the main product at lower temperatures, with higher MF and FA yield as the temperature rises. In general, both catalysts have similar conversions (considering the differences in metal loading) at lower temperatures, while the 15 at. V nm−2 sample is more reactive at higher temperatures (Fig. 3 and figure S.8). The 2.5 at. V nm−2 catalyst is more selective to partial oxidation products at higher temperatures. At higher temperatures, the total oxidation of CH3OH yields CO and CO2 as main reaction products. The differences observed on the catalytic behavior between both catalysts suggest that the VOx surface structure influences the activity and the selectivity of the methanol ODH reaction, with higher VO2 loading (or higher surface density of vanadium atoms) favoring the oxidation of methanol at higher temperatures. It can also be seen that there is formation of DMM even if FA is not present, suggesting that the desorption and subsequent re-adsorption of FA is not a necessary step for the formation of DMM and MF, which will be later confirmed with the kinetic model fitting. It has been reported that FA would not adsorb on vanadium surfaces at room temperature [56] . It can also be seen that the maximum in the DMM formation is directly associated to the rise in MF yield, suggesting that the formation of both products depends on the same reaction intermediate. Hemiacetal (CH3OCH2OH) has been previously proposed in literature as the reaction intermediate for methanol ODH reaction [28,41,57–62], which is the reactive pathway backed by DFT calculations [41,63] Fig. 4 shows a proposal of the reaction pathways considering this hemiacetal intermediate, where CH3OH first oxidizes to form HCHO, which is subsequently converted to the hemiacetal reaction intermediate, which dehydrates to form DMM or oxidizes to form MF, in parallel pathways. Considering the hemiacetal parallel reactive pathways, the MF formation must have a higher apparent activation energy than the DMM formation, as the later forms at lower temperatures (Fig. 3). Fig. 5a and Fig. 5b shows the FA, MF and DMM yield as function of the residence time for 2.5 and 15 at. V nm−2, respectively. When the residence time increases, DMM formation decreases and MF proportionally increases, suggesting that the DMM formation can undergo its reverse reaction, as has been previously reported [28]. The MF formation from DMM is discarded, as previous DFT calculations or experimental evidence does not support this argument [10,41,58,63,64], in agreement with our findings. The DMM reverse reaction does not influence FA formation, suggesting that only the formation of DMM from the hemiacetal intermediate is reversible (Fig. 4). Fig. 6 shows the effect of partial pressure of CH3OH, O2 and H2O on the product yield for 2.5 and 15 V nm−2 catalysts. CH3OH pressure can increase or decrease the formation of ODH products (Fig. 6.a and 6.b). The effect of CH3OH pressure is hard to interpret, given the convoluted web of elemental steps consequence of the parallel and in series reactions, which in turn leads to complex L-H expressions, as will be shown later. The formation of ODH products is not significantly influenced by O2 partial pressure (Fig. 6.c and 6.d), becoming negligible as the O2 partial pressure is increased. This behavior is characteristic of Mars-van Krevelen redox reactions, suggesting that at higher O2 pressures (when compared to CH3OH pressure) the reoxidation steps are much faster than the ODH reaction, so the reduced center would be a minority species on the surface and the rate constant for this step can be disregarded, as has been reported [38,39,65,66]. Fig. 6.e shows that H2O pressure influences the yield of the different product. It has been shown that the H2O chemisorption and its competition with methanol for redox or acid sites can be disregarded, because its adsorption free energy is orders of magnitude lower than that of CH3OH [28]. Thus, the effect of H2O concentration on the yield of the ODH products would be consequence of the reversibility of the DMM formation, where the presence of water, a reaction product, would shift the chemical equilibrium and favor the DMM reverse reaction at higher H2O pressures, to form the hemiacetal intermediary·H2O would not affect the FA formation as this reaction is not in chemical equilibrium and/or is not affected by the DMM equilibrium, as was observed. 3.5 Model derivation A kinetic model for the methanol partial oxidation was proposed considering a hemiacetal intermediate [57,59], as shown on Fig. 4. The model consists of 14 net reactions steps and considers two different types of sites, a redox site for dehydrogenation reactions and an acid site for dehydration reactions, as has been proposed [38,40,65,67]. Each reaction product (FA, MF and DMM) has its own elementary steps which can be shared between them, and the net reaction rate is given by the sum of each step (e.g. r 1 = r 1 FA + r 1 MF + r 1 DMM ). Table 2 shows a plausible sequence of elementary steps for the methanol partial oxidation to FA, MF and DMM, considering previous DFT calculations and the experimental observations discussed on this work. For the sake of model simplicity, COx production from methanol data at high temperature (≈ 200–250 °C), was not considered on the model derivation. Besides, the data at low methanol partial pressure (1 kPa) was also not used for parameter fitting due to its high experimental error. The first step of the reaction is the quasi-equilibrated methanol chemisorption on a redox site, a lattice O* atom (step 1). This step can occur via molecular (CH3OH) or dissociative (methoxy) chemisorption [38]. Kinetically, the distinction between both steps is irrelevant because both routes lead to the same rate equation. The second step is the irreversible abstraction of H atoms from an adsorbed methanol by action adjacent O* species, to form the HCHO-HO* pair (step 2). The H abstraction of the C-H bond is the indisputable kinetically relevant step [35–39]. FA can desorb (step 3) or react with a chemisorbed CH3OH molecule catalyzed by an acid site (step 8) to form the hemiacetal intermediate (CH3OCH2OH). There is evidence that the methanol ODH reaction is sensitive to the coverage of the active phase on the support [28,33,37,54,59,68], and previous works have proposed that the methanol reactions that require sites on both the metal and the support should occur on the interface between these two phases [28,69]. The hemiacetal intermediate formed on an acid site can undergo an acid-catalyzed nucleophilic addition and SN1-condensation reaction. First, the hemiacetal undergoes a reversible and kinetically relevant dehydration (step 12). The dehydrated intermediate can react with gaseous methanol in an Eley-Rideal type mechanism, to form adsorbed DMM on an acid site (step 13), which can later desorb as gaseous DMM (step 14). This formation could be analogous to the formation of DME on acid sites from CH3OH, which has been previously reported [65]. There exists the possibility that an analogous DMM formation occurs, with the reversible and kinetically relevant dehydration occurring after the CH3OH substitution directly on the hemiacetal to form the hemiacetal-methanol dimer species (SN2 pathway), but kinetically this is irrelevant as the net rate equation is the same. Given the low equilibrium constant, and the low concentration and spontaneous reaction of hemiacetal, these steps are considered in quasi equilibrium[28]. As the MF formation requires that the hemiacetal intermediate is dehydrogenated, this intermediate should spillover to a redox site (step 9). Here, hemiacetal can undergo a dehydration step analogous to that of methanol in the first part of the mechanism. The hemiacetal suffers a H abstraction using neighboring O* atoms, to form the MF and OH pair (step 10), which can later desorb to form gaseous MF (step 11). Finally, the proximate OH pairs can recombine to reversibly form gaseous H2O and an O-vacancy. Gaseous O2 can react with two vacancies on sequentially step and regenerate the vacancies via irreversible O2 dissociation, completing a Mars-van Krevelen redox cycle, returning the V3+ to its initial electronic state (step 5 and 6). This reoxidation steps are much faster than the reduction steps, therefore their kinetics cannot be measured [38,39,65,66]. Consequently, these steps do not influence the rate equations. Given the elementary steps on Table 2, kinetic models for the formation of formation of FA, MF and DMM were derived. Details on the kinetic model derivation can be found on Supporting Information (Section S.11). The rate-determining step for each reaction path was the initial methanol dehydrogenation, as has been discussed by several authors [35–39]. That way, the mathematical expressions for the ODH products formation rates were derived, considering pseudo-steady-state treatments of the elementary steps and quasi-equilibrium approximations, expressed in terms of approach to equilibrium: (10) r FA = K 1 k ODH P C H 3 OH θ O * 1 + 1 k FA / HA K 7 P C H 3 OH θ H + (11) r MF = K 1 k ODH P C H 3 OH θ O * 1 + k FA / HA 1 K 7 P C H 3 OH θ H + 1 + 1 k MF / DMM θ H + θ O * 1 + η 1 k MF / DMM θ H + θ O * (12) r DMM = K 1 k ODH P C H 3 OH θ O * 1 + k FA / HA 1 K 7 P C H 3 OH θ H + 1 + k MF / DMM θ O * θ H + 1 − η With: (13) k FA / HA = k 3 k 8 (14) k MF / DMM = K 9 k 10 k 12 (15) k c = k 12 − K 14 K 13 And: (16) η = P DMM P H 2 O P CH 3 OH 3 K DMM ′ 1 + 1 k FA / HA K 7 P C H 3 OH θ H + K 7 θ H + (17) K ′ DMM = K 1 k ODH k FA / HA k MF / DMM k C = K 1 k 2 k 8 k 12 K 13 k 3 k 9 K 10 k 12 − K 14 (18) θ O l = 1 1 + K 1 P C H 3 OH (19) θ H + = 1 1 + K 7 P C H 3 OH From the integral kinetic data and the fitting of the kinetic parameters, the model can be simplified, reducing the number of kinetic parameters without abruptly increasing the fit error. The criteria for this simplification was the confidence interval, where a confidence interval that includes zero would mean that the parameter has a non-statistically significant effect on the proposed model. This was the case, as eliminating these parameters from the model did not increase significantly the MAPE. First, methanol would chemisorb strongly on the acid site, or would dominate the acid site surface. (20) K 7 P C H 3 OH θ H + ≈ 1 We also observed that for most of the points, DMM was the primary reaction product when comparing to MF, which then means that the ratio of DMM to MF forward formation rate, governed by the inverse of the kMF/DMM ratio, should be much greater than 1: (21) 1 ≪ 1 k MF / DMM θ H + θ O * Considering the above shown considerations, the kinetic expressions can be simplified to the following rate equations: (22) r FA = K 1 k ODH P C H 3 OH θ O * 1 + 1 k FA / HA (23) r MF = K 1 k ODH P C H 3 OH θ O * 1 + k FA / HA η (24) r DMM = K 1 k ODH P C H 3 OH θ O * 1 + k FA / HA 1 − η While Eq. (15) turns to: (25) η = P DMM P H 2 O P CH 3 OH 2 K DMM ′ 1 + 1 k FA / HA This same expression can be obtained when considering the DMM formation in quasi-equilibrium in a pseudo-steady state Langmuir-Hinshelwood derivation (rDMM ≈ 0), which can be interpreted as that the DMM formation would be in quasi-equilibrium when compared to the rate of the kinetically relevant step: the methanol dehydrogenation. Given that the DMM formation is sufficiently fast to be considered in quasi-equilibrium, the MF formation rate goes from 0 (far away from DMM equilibrium) to the hemiacetal consumption rate (in the DMM equilibrium). It is worth to know that, after the simplifications, the steps that lead to DMM formation are not kinetically relevant, so DMM could be formed by SN1 or SN2 nucleophilic substitution. In the proposed model, K1 is the chemisorption constant of methanol on a redox site, while the kODH constant is the kinetic constant of the rate determing step C-H bond scission. The rate constant k FA / HA (Eq. 13) is a ratio of kinetics constants that determines the selectivity to the two different pathways that can undergo the HCHO: the desorption or its subsequent reaction to form hemiacetal. Parameter kc lumps the different constants that define the net rate of DMM quasi-equilibrated formation. The rate of reoxidation of the oxygen vacancies was not considered on the model, given the observed weak effect of O2 partial pressure, as was previously discussed. The kinetic equations are a function of two different site balances, the redox sites O * and the Brønsted acid sites H+ On the redox sites, only coverage of methanol was considered MARI, while on the acid sites the surface was completely dominated by methanol. That way, we could develop a kinetic model for the formation of the three main products, FA, DMM and MF, that depends only on 4 parameters. Given that the formation of each product (FA, MF and DMM) requires an initial methanol dehydrogenation step, the ODH net rate equals the sum of each rate of formation, consistent with a Mars-van Krevelen redox cycle involving V-O pairs. (26) r ODH = r FA + r MF + r DMM = K 1 k 2 P C H 3 OH θ O * The ODH reaction was considered irreversible, given the large equilibrium constants at the reaction temperatures [28]. 3.6 Parameter fitting A summary of the parameters of the kinetic models and the statistics are summarized on Table 2. The preexponential factor is expressed as the value of the kinetic rate constant at 450 K, by the equation: (27) k i = k i 450 K e − E i R 1 T [ K ] − 1 450 [ K ] The ODH kinetic constant is expressed as an apparent TOF normalized by total V2O5 content. This apparent TOF is not entirely appropriate for activity comparisons because it does not account for the surface vanadium oxide nor the particular active sites that actually participate in the ODH reaction, which may or may not be V-O-V pairs as has been contradictorily discussed for this reaction [15,28,31]. Instead, our discussion will be centered in the energies of the contributing kinetic steps as a mean to compare the intrinsic activity of the reaction as its quantification is independent of the content of vanadium and the quantity of active sites. The obtained kinetic parameters allow to quantitatively describe the differences observed between both catalysts. We observed an effect on the nature of the active with the increase of vanadium surface density, as reflected on the change on the value of the energies associated to the kinetic parameters. It can be seen that, at higher vanadium surface density, methanol has a lower heat of chemisorption − ∆ H 1 (101.7 versus 83.7 kJ mol−1), which means that CH3OH adsorbs more weakly on the redox sites on the 15 VTi catalyst; methanol ODH has a lower energy barrier E a ODH (79.9 versus 61.1 kJ mol−1), which means that the more coordinated VOx surface of the 15 VTi catalyst dehydrogenates methanol more easily on the redox sites; the methanol transformation to MF and DMM, when compared to the desorption of FA, is favored on the 15 VTi catalyst, as the higher activation energy of the ratio E a FA / HA shows (60.4 versus 88.3 kJ mol−1); and the formation of MF is also favored, because the apparent enthalpy of the constant that defines the DMM equilibrium, − ∆ H ′ DMM , obtained when lumping all the kinetic and adsorption/desorption constants of the elementary steps leading to the DMM formation, including the parallel pathways to FA and MF, is larger at higher surface densities (267.7 versus 311.4 kJ/mol). In this work, it has been previously shown that MF formation is affected by the DMM equilibrium (Eq. 23), and the 2.5 VTi catalyst approaches the equilibrium at lower temperatures than the 15 VTi sample, which is a consequence of its lower − ∆ H ′ DMM , as an exothermic reaction. When operating far away from the equilibrium, we would not observe MF formation, as is far slower than the DMM formation, which can be considered in quasi-equilibrium when compared to the rate determining step. The activation energy for methanol ODH reaction is in line with previously reported values on V2O5/TiO2. Broomhead and collaborators report an activation energy for the rds of 76 kJ mol−1, while Wachs reports values around 83 kJ mol−1 for monolayer and sub-monolayer vanadia catalysts[33]. On vanadium and chromium oxide, Cozzolino and coworkers report values of 40–80 kJ mol−1 for methanol ODH on supported and bulk catalysts [11], while Tatibouët reports, in general, values around 85 kJ mol−1, no matter the catalyst/support duo [37]. Comparing the heat of CH3OH adsorption values, our results are also in similar orders of magnitude compared to reported values of - 90 kJ mol−1 on monomeric VOx supported on TiO2, calculated by DFT [70], and values of −121 kJ mol−1 on a nano-structured vanadium oxide catalyst supported on TiO2/SiO2 [11]. Regarding the role of surface density of vanadia, by Raman, XRD and UV–vis we observed that at higher vanadium content, phases and bands attributed to crystalline V2O5 start to appear, accompanied by a decrease of the absorption edge energy calculated from the Tauc law (also known as the energy of the band gap), approaching the bulk value at densities higher than 15 V nm−2, evidencing the change from monomers and polymers of vanadium oxide to crystalline vanadium oxides. The link between the band gap energy and the reducibility of mixed oxides would mean that the crystalline catalyst is more reducible than the dispersed vanadium oxide catalyst, which then would explain the differences in the intrinsic ODH activity, specifically in the energies of the kinetic parameters. The 15 V nm−2 sample is the more active catalyst, with a lower energy barrier (or transition state energy) for the rate limiting step caused by its higher reducibility, as this step is the C-H bond dehydrogenation, and this property favors its capability to complete the redox cycles necessary for the dehydrogenation reactions of methanol in the rate limiting step. The kinetic model reproduces the catalytic performance over the whole range of studied operation conditions (residence time, temperature, and partial pressure of reactants) and adequately predicts the methanol ODH products formation with MAPE values around the 20%. In Fig. 7, parity plots of the models for catalyst 2.5 V nm−2 and 15 V nm−2 are shown, respectively, for the formation of FA, MF and DMM. Most of the points (60%) are inside the +-20 lines, with 80% of the points have less than 30% error. Some points are in a straight line parallel to the x-axis, due to neglecting the influence of O2 pressure on the methanol ODH reaction. Nevertheless, the error introduced by this simplification is less than 20%. The parity plot of O2 consumption rate, which was also fitted, can be found on Supporting Information, figure S.12. Fig. 8 shows experimental and simulated data for the 2.5 and 15 V nm−2 catalyst, respectively. The models adequately simulate the trends at temperatures between 100 and 250 °C, correctly predicting the abrupt change of the yields with the temperature and the interchange of DMM and MF formation (rest of figures, Supporting Information S.13 and S.14). The model also predicts the effect of residence time on the product yields (Figure S.15 and S.16), accurately simulating the decrease of DMM yield accompanied by the increase of MF yield as the residence time rises, given by the reverse reaction of DMM and the consequently MF formation. It can be seen that the model present discrepancies at low methanol partial pressures (≤ 1 kPa, figure S.17 and S.18), most likely from the simplification presented on Eq. 17, where methanol is presumed to dominate the acid surface. However, we should expect a lower coverage of methanol on the acid sites due to the lower methanol partial pressure. The model also predicts the change in the product distribution with the partial pressure of water and O2 (Figure S.19 to S.22). Also, the model presents discrepancies when simulating the effect of O2 pressure, due to the approximation for the rate of regeneration of the oxygen vacancies, which was considered to be much faster than the rate of methanol ODH. This simplification is only satisfied when the O2 partial pressure is much greater than the CH3OH partial pressure. Other discrepancies are due to the presence of COx on the reaction products, which were not considered in the derivation of the models. 3.7 Selectivity descriptors Given the proposed reaction mechanism and the kinetics expressions obtained, the selectivity of the different species can be analyzed to study the kinetic tuning for each different product, towards the engineering of catalytic surfaces with finely tuned selectivity. In our complete model, the DMM to MF ratio is defined as: (28) r DMM r MF = K 1 k 2 P C H 3 OH θ O * 1 + k FA / HA 1 K 7 P C H 3 OH θ H + 1 + k MF / DMM θ O * θ H + 1 − η K 1 k 2 P C H 3 OH θ O 1 + k FA / HA 1 K 7 P C H 3 OH θ H + 1 + 1 k MF / DMM θ H + θ O * 1 + η 1 k MF / DMM θ H + θ O * If we are close to the DMM equilibrium, η = 1 , and the net DMM formation is zero (therefore, the r DMM r MF ratio is zero). If we are far from equilibrium, η = 0 , then: (29) r DMM r MF = 1 k MF / DMM θ H + θ O * It can be seen that k MF / DMM defines the DMM to MF forward rate. To maximize the selectivity to DMM, we would need to decrease the coverage of species on the acid sites, increase it on the redox sites and/or decrease the k MF / DMM rate constant. The DMM to FA ratio is defined as: (30) r DMM r FA = K 1 k 2 P C H 3 OH θ O * 1 + k FA / HA 1 K 7 P C H 3 OH θ H + 1 + k MF / DMM θ O * θ H + 1 − η K 1 k 2 P C H 3 OH θ O * 1 + 1 k FA / HA K 7 P C H 3 OH θ H + If we are close to the equilibrium, it can be seen that again the net DMM formation is zero. If we are far away from the equilibrium, the selectivity to DMM, when compared to FA, can be increased by decreasing the k FA / HA and k MF / DMM rate constant, as to maximize hemiacetal and DMM formation; increasing the methanol partial pressure and decreasing the coverage of species on the acid sites and increasing it on the redox sites. The MF to FA ratio is defined as: (31) r MF r FA = K 1 k 2 P C H 3 OH θ O * 1 + k FA / HA 1 K 7 P C H 3 OH θ H + 1 + 1 k MF / DMM θ H + θ O * 1 + η 1 k MF / DMM θ H + θ O * K 1 k 2 P C H 3 OH θ O * 1 + 1 k FA / HA K 7 P C H 3 OH θ H + The selectivity to MF when compared to FA depends on the DMM equilibrium. If we are close to the equilibrium, η = 1 , the selectivity to MF can be increased by decreasing the k FA / HA rate constant, which in turn is maximizing the hemiacetal formation, increasing the methanol partial pressure, and decreasing the acid site coverage. In this case, the MF rate is equal to the hemiacetal net rate, as the DMM reaction is in equilibrium. If we are far away from the DMM equilibrium, η = 0 , we can increase the MF selectivity by increasing the k MF / DMM / k FA / HA rate constant ratio, increasing the methanol pressure, and increasing the acid site coverage. It can be seen that the acid sites have an anti-synergistic effect, because they increase the hemiacetal formation but also increase the DMM formation, therefore, there should be an optimum in the concentration ratio of acid site to redox sites on the catalyst surface. 4 Conclusions A Langmuir-Hinshelwood/Eley Rideal/Mars-van Krevelen kinetic model was successfully derived for the methanol ODH reaction products (FA, MF and DMM) considering hemiacetal as the intermediate for MF and DMM formation. The fitted model has a mean average error of 20% and depends on only 4 thermodynamically consistent kinetic parameters: the methanol chemisorption constant on the redox sites, the kinetic rate constant of the rate-limiting step (chemisorbed methanol C-H bond incision), the FA/HA kinetic rate constant ratio and the constant that groups the terms that define the DMM equilibrium. It was found that the redox properties primarily determine the activity of the catalysts, which in turn are closely related to the vanadium loading of the samples. When compared to the redox sites, the effect of coverage of the acid sites is non-statistically significant, as CH3OH completely dominates the acid surface. An increase in vanadium content leads to an increase in methanol ODH intrinsic activity (lower activation energy of the rate determining step) and to a decrease in the coverage of adsorbed methanol species (lower enthalpy of CH3OH chemisorption on the redox site). The lower activation energy of the rate limiting step as the surface density goes from 2.5 at. V nm−2 to 15 at. V nm−2 (61.1 kJ mol−1 versus 79.9 kJ mol−1, respectively) correlates to the increase of the reducibility as the surface density of the catalysts rise, depicted as the decrease of adsorption edge energy from 3.2 eV to the bulk V2O5 value of 2.3 eV, as calculated from UV–vis results. Therefore, the crystalline VOx domains enhance the capacity of the catalyst to complete the necessary redox cycles for the methanol ODH reaction, while reducing the methanol chemisorption capacity. The increased surface density of vanadium oxide influences the selectivity of the methanol ODH reaction by promoting the formation of hemiacetal and the approach to the DMM equilibrium, which can be considered in quasi-equilibrium when compared to the rate determining step. Given that the DMM formation is sufficiently fast to be considered in quasi-equilibrium, the MF formation rate directly depends on the DMM equilibrium, going from 0 (far away from DMM equilibrium) to the hemiacetal consumption rate (in the DMM equilibrium). Further studies are necessary to quantify the effect of the redox and acid sites on the methanol ODH reaction mechanism. CRediT authorship contribution statement Romel Jiménez: Writing – review & editing, Supervision, Formal analysis. Paola Santander: Writing – review & editing, Formal analysis. Gabriel Galdames: Writing – review & editing, Writing – original draft, Methodology, Investigation, Formal analysis, Data curation. Alejandro Karelovic: Writing – review & editing, Supervision, Resources, Project administration, Funding acquisition, Conceptualization. Declaration of Competing Interest The authors declare that they have no known competing financial interests or personal relationships that could have appeared to influence the work reported in this paper. Acknowledgements The authors thank the government of Chile for the financing assigned through the following projects: Millennium Science Initiative Program – NCN2021_090, CONICYT PIA/APOYO CCTE AFB170007, ANID-Chile. Gabriel Galdames acknowledges ANID (Chile) for the doctoral scholarship Beca de Doc.Nac./2020-21201192. Appendix A Supporting information Supplementary data associated with this article can be found in the online version at doi:10.1016/j.apcata.2024.119807. Appendix A Supplementary material Supplementary material References [1] Q. Hassan A.M. Abdulateef S.A. Hafedh A. Al-samari J. Abdulateef A.Z. Sameen H.M. Salman A.K. Al-Jiboory S. Wieteska M. Jaszczur Int J. Hydrog. Energy 48 2023 17383 17408 Q. Hassan, A.M. Abdulateef, S.A. Hafedh, A. Al-samari, J. Abdulateef, A.Z. Sameen, H.M. Salman, A.K. Al-Jiboory, S. Wieteska, M. Jaszczur, Int J Hydrogen Energy 48 (2023) 17383–17408. [2] D.D. Papadias J.-K. Peng R.K. Ahluwalia Int J. Hydrog. Energy 46 2021 24169 24189 D.D. Papadias, J.-K. Peng, R.K. Ahluwalia, Int J Hydrogen Energy 46 (2021) 24169–24189. [3] T. Umegaki J.-M. Yan X.-B. Zhang H. Shioyama N. Kuriyama Q. Xu Int J. Hydrog. Energy 34 2009 2303 2311 T. Umegaki, J.-M. Yan, X.-B. Zhang, H. Shioyama, N. Kuriyama, Q. Xu, Int J Hydrogen Energy 34 (2009) 2303–2311. [4] G.A. Olah Angew. Chem. Int. Ed. 44 2005 2636 2639 G.A. Olah, Angewandte Chemie International Edition 44 (2005) 2636–2639. [5] U. Mondal G.D. Yadav Green. Chem. 23 2021 8361 8405 U. Mondal, G.D. Yadav, Green Chemistry 23 (2021) 8361–8405. [6] M. Behrens Recycl. Catal. 2 2015 M. Behrens, Recyclable Catalysis 2 (2015). [7] R.S. Haszeldine S. Flude G. Johnson V. Scott Philos. Trans. R. Soc. A: Math., Phys. Eng. Sci. 376 2018 20160447 R.S. Haszeldine, S. Flude, G. Johnson, V. Scott, Philosophical Transactions of the Royal Society A: Mathematical, Physical and Engineering Sciences 376 (2018) 20160447. [8] M. Takht Ravanchi S. Sahebdelfar Process Saf. Environ. Prot. 145 2021 172 194 M. Takht Ravanchi, S. Sahebdelfar, Process Safety and Environmental Protection 145 (2021) 172–194. [9] S.W. Kariuki J. Wachira M. Kawira G. Murithi J. Chem. 2019 2019 1 12 S.W. Kariuki, J. Wachira, M. Kawira, G. Murithi, J Chem 2019 (2019) 1–12. [10] V.V. Kaichev G.Ya Popova Yu.A. Chesalov A.A. Saraev D.Y. Zemlyanov S.A. Beloshapkin A. Knop-Gericke R. Schlögl T.V. Andrushkevich V.I. Bukhtiyarov J. Catal. 311 2014 59 70 V.V. Kaichev, G.Ya Popova, Yu.A. Chesalov, A.A. Saraev, D.Y. Zemlyanov, S.A. Beloshapkin, A. Knop-Gericke, R. Schlögl, T.V. Andrushkevich, V.I. Bukhtiyarov, J Catal 311 (2014) 59–70. [11] M. COZZOLINO R. TESSER M. DISERIO P. DONOFRIO E. SANTACESARIA Catal. Today 128 2007 191 200 M. COZZOLINO, R. TESSER, M. DISERIO, P. DONOFRIO, E. SANTACESARIA, Catal Today 128 (2007) 191–200. [12] R.R. Langeslay D.M. Kaphan C.L. Marshall P.C. Stair A.P. Sattelberger M. Delferro Chem. Rev. 119 2019 2128 2191 R.R. Langeslay, D.M. Kaphan, C.L. Marshall, P.C. Stair, A.P. Sattelberger, M. Delferro, Chem Rev 119 (2019) 2128–2191. [13] M. Faraldos M.A. Bañares J.A. Anderson H. Hu I.E. Wachs J.L.G. Fierro J. Catal. 160 1996 214 221 M. Faraldos, M.A. Bañares, J.A. Anderson, H. Hu, I.E. Wachs, J.L.G. Fierro, J Catal 160 (1996) 214–221. [14] B. Kilos A.T. Bell E. Iglesia J. Phys. Chem. C. 113 2009 2830 2836 B. Kilos, A.T. Bell, E. Iglesia, The Journal of Physical Chemistry C 113 (2009) 2830–2836. [15] I.E. Wachs Dalton Trans. 42 2013 11762 I.E. Wachs, Dalton Transactions 42 (2013) 11762. [16] O. Gómez-Cápiro L. Bravo P. Lagos P. Santander G. Pecchi A. Karelovic Catal. Sci. Technol. 11 2021 6477 6489 O. Gómez-Cápiro, L. Bravo, P. Lagos, P. Santander, G. Pecchi, A. Karelovic, Catal Sci Technol 11 (2021) 6477–6489. [17] A. Khodakov B. Olthof A.T. Bell E. Iglesia J. Catal. 181 1999 205 216 A. Khodakov, B. Olthof, A.T. Bell, E. Iglesia, J Catal 181 (1999) 205–216. [18] P. Santander L. Bravo G. Pecchi A. Karelovic Appl. Catal. A Gen. 595 2020 117513 P. Santander, L. Bravo, G. Pecchi, A. Karelovic, Appl Catal A Gen 595 (2020) 117513. [19] E. Papulovskiy A.A. Shubin O.B. Lapina Phys. Chem. Chem. Phys. 23 2021 19352 19363 E. Papulovskiy, A.A. Shubin, O.B. Lapina, Physical Chemistry Chemical Physics 23 (2021) 19352–19363. [20] L. Schumacher J. Weyel C. Hess J. Am. Chem. Soc. 144 2022 14874 14887 L. Schumacher, J. Weyel, C. Hess, J Am Chem Soc 144 (2022) 14874–14887. [21] C.A. Carrero R. Schloegl I.E. Wachs R. Schomaecker ACS Catal. 4 2014 3357 3380 C.A. Carrero, R. Schloegl, I.E. Wachs, R. Schomaecker, ACS Catal 4 (2014) 3357–3380. [22] N. Hamilton T. Wolfram G. Tzolova Müller M. Hävecker J. Kröhnert C. Carrero R. Schomäcker A. Trunschke R. Schlögl Catal. Sci. Technol. 2 2012 1346 1359 N. Hamilton, T. Wolfram, G. Tzolova Müller, M. Hävecker, J. Kröhnert, C. Carrero, R. Schomäcker, A. Trunschke, R. Schlögl, Catal Sci Technol 2 (2012) 1346–1359. [23] P. Kube B. Frank R. Schlögl A. Trunschke ChemCatChem 9 2017 3446 3455 P. Kube, B. Frank, R. Schlögl, A. Trunschke, ChemCatChem 9 (2017) 3446–3455. [24] A. Dinse S. Khennache B. Frank C. Hess R. Herbert S. Wrabetz R. Schlögl R. Schomäcker J. Mol. Catal. A Chem. 307 2009 43 50 A. Dinse, S. Khennache, B. Frank, C. Hess, R. Herbert, S. Wrabetz, R. Schlögl, R. Schomäcker, J Mol Catal A Chem 307 (2009) 43–50. [25] C. Hess ChemPhysChem 10 2009 319 326 C. Hess, ChemPhysChem 10 (2009) 319–326. [26] T. Feng J.M. Vohs J. Catal. 221 2004 619 629 T. Feng, J.M. Vohs, J Catal 221 (2004) 619–629. [27] T. Feng J.M. Vohs J. Catal. 208 2002 301 309 T. Feng, J.M. Vohs, J Catal 208 (2002) 301–309. [28] W.T. Broomhead W. Tian J.E. Herrera Y.-H.C. Chin ACS Catal. 12 2022 11801 11820 W.T. Broomhead, W. Tian, J.E. Herrera, Y.-H.C. Chin, ACS Catal 12 (2022) 11801–11820. [29] A.S. Elmi E. Tronconi C. Cristiani J.P. Gomez Martin P. Forzatti G. Busca Ind. Eng. Chem. Res 28 1989 387 393 A.S. Elmi, E. Tronconi, C. Cristiani, J.P. Gomez Martin, P. Forzatti, G. Busca, Ind Eng Chem Res 28 (1989) 387–393. [30] Guido Busca A.S. Elmi Pio Forzatti J. Phys. Chem. 91 1987 5263 5269 Guido Busca, A.S. Elmi, Pio Forzatti, J Phys Chem 91 (1987) 5263–5269. [31] V.V. Kaichev G.Ya Popova Yu.A. Chesalov A.A. Saraev T.V. Andrushkevich V.I. Bukhtiyarov Kinet. Catal. 57 2016 82 94 V.V. Kaichev, G.Ya Popova, Yu.A. Chesalov, A.A. Saraev, T.V. Andrushkevich, V.I. Bukhtiyarov, Kinetics and Catalysis 57 (2016) 82–94. [32] G. Deo A.M. Turek I.E. Wachs T. Machej J. Haber N. Das H. Eckert A.M. Hirt Appl. Catal. A Gen. 91 1992 27 42 G. Deo, A.M. Turek, I.E. Wachs, T. Machej, J. Haber, N. Das, H. Eckert, A.M. Hirt, Appl Catal A Gen 91 (1992) 27–42. [33] G. Deo I.E. Wachs J. Catal. 146 1994 323 334 G. Deo, I.E. Wachs, J Catal 146 (1994) 323–334. [34] D. Gasser A. Baiker J. Catal. 113 1988 325 333 D. Gasser, A. Baiker, J Catal 113 (1988) 325–333. [35] S.T. Oyama R. Radhakrishnan M. Seman J.N. Kondo K. Domen K. Asakura J. Phys. Chem. B 107 2003 1845 1852 S.T. Oyama, R. Radhakrishnan, M. Seman, J.N. Kondo, K. Domen, K. Asakura, J Phys Chem B 107 (2003) 1845–1852. [36] P. Forzatti E. Tronconi A.S. Elmi G. Busca Appl. Catal. A Gen. 157 1997 387 408 P. Forzatti, E. Tronconi, A.S. Elmi, G. Busca, Appl Catal A Gen 157 (1997) 387–408. [37] J.M. Tatibouët Appl. Catal. A Gen. 148 1997 213 252 J.M. Tatibouët, Appl Catal A Gen 148 (1997) 213–252. [38] P. Deshlahra E. Iglesia J. Phys. Chem. C. 118 2014 26115 26129 P. Deshlahra, E. Iglesia, The Journal of Physical Chemistry C 118 (2014) 26115–26129. [39] P. Mars D.W. van Krevelen Chem. Eng. Sci. 3 1954 41 59 P. Mars, D.W. van Krevelen, Chem Eng Sci 3 (1954) 41–59. [40] H. Liu J. Catal. 223 2004 161 169 H. Liu, J Catal 223 (2004) 161–169. [41] N. Li S. Wang Y. Sun S. Li Phys. Chem. Chem. Phys. 19 2017 19393 19406 N. Li, S. Wang, Y. Sun, S. Li, Physical Chemistry Chemical Physics 19 (2017) 19393–19406. [42] I.E. Wachs Catal. Today 27 1996 437 455 I.E. Wachs, Catal Today 27 (1996) 437–455. [43] I.R. Beattie T.R. Gilson J. Chem. Soc. A: Inorg., Phys., Theor. 1969 2322 I.R. Beattie, T.R. Gilson, Journal of the Chemical Society A: Inorganic, Physical, Theoretical (1969) 2322. [44] M.A. Vuurman I.E. Wachs A.M. Hirt J. Phys. Chem. 95 1991 9928 9937 M.A. Vuurman, I.E. Wachs, A.M. Hirt, J Phys Chem 95 (1991) 9928–9937. [45] I.E. Wachs Appl. Catal. A Gen. 391 2011 36 42 I.E. Wachs, Appl Catal A Gen 391 (2011) 36–42. [46] J.L. Bronkema D.C. Leo A.T. Bell J. Phys. Chem. C. 111 2007 14530 14540 J.L. Bronkema, D.C. Leo, A.T. Bell, Journal of Physical Chemistry C 111 (2007) 14530–14540. [47] H. Tian E.I. Ross I.E. Wachs J. Phys. Chem. B 110 2006 9593 9600 H. Tian, E.I. Ross, I.E. Wachs, Journal of Physical Chemistry B 110 (2006) 9593–9600. [48] G. Centi Appl. Catal. A Gen. 147 1996 267 298 G. Centi, Appl Catal A Gen 147 (1996) 267–298. [49] G.T. Went, L.-J. Leu, A.T. Bell, Quantitative Structural Analysis of Dispersed Vanadia Species in TiO2(Anatase)-Supported V205, 1992. [50] J. Tauc Mater. Res Bull. 3 1968 37 46 J. Tauc, Mater Res Bull 3 (1968) 37–46. [51] Z. Helali A. Jedidi O.A. Syzgantseva M. Calatayud C. Minot Theor. Chem. Acc. 136 2017 100 Z. Helali, A. Jedidi, O.A. Syzgantseva, M. Calatayud, C. Minot, Theor Chem Acc 136 (2017) 100. [52] W. Li H. Liu E. Iglesia J. Phys. Chem. B 110 2006 23337 23342 W. Li, H. Liu, E. Iglesia, J Phys Chem B 110 (2006) 23337–23342. [53] Y. Zhao Z. Qin G. Wang M. Dong L. Huang Z. Wu W. Fan J. Wang Fuel 104 2013 22 27 Y. Zhao, Z. Qin, G. Wang, M. Dong, L. Huang, Z. Wu, W. Fan, J. Wang, Fuel 104 (2013) 22–27. [54] H. Hu I.E. Wachs J. Phys. Chem. 99 1995 10911 10922 H. Hu, I.E. Wachs, J Phys Chem 99 (1995) 10911–10922. [55] T. Sodesawa React. Kinet. Catal. Lett. 32 1986 63 69 T. Sodesawa, Reaction Kinetics and Catalysis Letters 32 (1986) 63–69. [56] G. Busca Catal. Today 27 1996 457 496 G. Busca, Catal Today 27 (1996) 457–496. [57] I.E. Wachs R.J. Madix Surf. Sci. 76 1978 531 558 I.E. Wachs, R.J. Madix, Surf Sci 76 (1978) 531–558. [58] Z. Liu R. Zhang S. Wang N. Li R. Sima G. Liu P. Wu G. Zeng S. Li Y. Sun J. Phys. Chem. C. 120 2016 6591 6600 Z. Liu, R. Zhang, S. Wang, N. Li, R. Sima, G. Liu, P. Wu, G. Zeng, S. Li, Y. Sun, The Journal of Physical Chemistry C 120 (2016) 6591–6600. [59] C. LOUIS J. Catal. 109 1988 354 366 C. LOUIS, J Catal 109 (1988) 354–366. [60] H. Liu E. Iglesia J. Phys. Chem. B 107 2003 10840 10847 H. Liu, E. Iglesia, J Phys Chem B 107 (2003) 10840–10847. [61] H. Liu E. Iglesia J. Phys. Chem. B 109 2005 2155 2163 H. Liu, E. Iglesia, J Phys Chem B 109 (2005) 2155–2163. [62] K. Takahashi N. Takezawa H. Kobayashi Chem. Lett. 12 1983 1061 1064 K. Takahashi, N. Takezawa, H. Kobayashi, Chem Lett 12 (1983) 1061–1064. [63] N. Li S. Wang Q. Ren S. Li Y. Sun J. Phys. Chem. C. 120 2016 29290 29301 N. Li, S. Wang, Q. Ren, S. Li, Y. Sun, The Journal of Physical Chemistry C 120 (2016) 29290–29301. [64] J.-M. Tatibouët H. Lauron-Pernot J. Mol. Catal. A Chem. 171 2001 205 216 J.-M. Tatibouët, H. Lauron-Pernot, J Mol Catal A Chem 171 (2001) 205–216. [65] P. Deshlahra R.T. Carr S.-H. Chai E. Iglesia ACS Catal. 5 2015 666 682 P. Deshlahra, R.T. Carr, S.-H. Chai, E. Iglesia, ACS Catal 5 (2015) 666–682. [66] S. Kwon P. Deshlahra E. Iglesia J. Catal. 364 2018 228 247 S. Kwon, P. Deshlahra, E. Iglesia, J Catal 364 (2018) 228–247. [67] G. Cai W.T. Broomhead Y.-H.C. Chin H. Cai Top. Catal. 66 2023 1102 1119 G. Cai, W.T. Broomhead, Y.-H.C. Chin, H. Cai, Top Catal 66 (2023) 1102–1119. [68] J. ALLISON J. Catal. 92 1985 127 135 J. ALLISON, J Catal 92 (1985) 127–135. [69] J.J. Corral-Pérez A. Bansode C.S. Praveen A. Kokalj H. Reymond A. Comas-Vives J. VandeVondele C. Copéret P.R. von Rohr A. Urakawa J. Am. Chem. Soc. 140 2018 13884 13891 J.J. Corral-Pérez, A. Bansode, C.S. Praveen, A. Kokalj, H. Reymond, A. Comas-Vives, J. VandeVondele, C. Copéret, P.R. von Rohr, A. Urakawa, J Am Chem Soc 140 (2018) 13884–13891. [70] A. Goodrow A.T. Bell J. Phys. Chem. C. 111 2007 14753 14761 A. Goodrow, A.T. Bell, The Journal of Physical Chemistry C 111 (2007) 14753–14761.",
      "scopus-id": "85193615801",
      "coredata": {
        "eid": "1-s2.0-S0926860X24002515",
        "dc:description": "A kinetic model was derived for the methanol oxidative dehydrogenation to formaldehyde, methyl formate and dimethoxymethane on sub-monolayer and multilayer V2O5/TiO2 catalysts. Considering a hemiacetal intermediate, the model combines Langmuir-Hinshelwood/Eley-Rideal/Mars-van Krevelen mechanisms, accounting for lattice oxygen redox sites and Brønsted acid sites. The fitted model depends on 4 thermodynamically consistent parameters, adequately simulating yield trends with temperature, residence time, and partial pressure of methanol, oxygen and added water. Oxidation steps follow a Mars-van Krevelen redox cycle, while the dimethoxymethane formation is reversible, as the water addition favored the hemiacetal intermediate. The catalyst with higher vanadia surface density was intrinsically more active (lower activation energy of the rate limiting step), attributed to its higher reducibility, while showing weaker methanol adsorption (lower enthalpy of chemisorption). The increase in reducibility correlates with the transition from monomers to polymers to crystalline vanadia when vanadium content increases, as observed by XRD, Raman spectroscopy and DRS-UV–vis.",
        "openArchiveArticle": "false",
        "prism:coverDate": "2024-07-25",
        "openaccessUserLicense": null,
        "prism:aggregationType": "Journal",
        "prism:url": "https://api.elsevier.com/content/article/pii/S0926860X24002515",
        "dc:creator": [
          {
            "@_fa": "true",
            "$": "Galdames, Gabriel"
          },
          {
            "@_fa": "true",
            "$": "Santander, Paola"
          },
          {
            "@_fa": "true",
            "$": "Jiménez, Romel"
          },
          {
            "@_fa": "true",
            "$": "Karelovic, Alejandro"
          }
        ],
        "link": [
          {
            "@_fa": "true",
            "@rel": "self",
            "@href": "https://api.elsevier.com/content/article/pii/S0926860X24002515"
          },
          {
            "@_fa": "true",
            "@rel": "scidir",
            "@href": "https://www.sciencedirect.com/science/article/pii/S0926860X24002515"
          }
        ],
        "dc:format": "application/json",
        "openaccessType": null,
        "pii": "S0926-860X(24)00251-5",
        "prism:volume": "682",
        "articleNumber": "119807",
        "prism:publisher": "Elsevier B.V. All rights are reserved, including those for text and data mining, AI training, and similar technologies.",
        "dc:title": "A detailed kinetic model for the methanol oxidative dehydrogenation on vanadia-based catalysts: Aggregation state role and active site requirements",
        "prism:copyright": "© 2024 Elsevier B.V. All rights are reserved, including those for text and data mining, AI training, and similar technologies.",
        "openaccess": "0",
        "prism:issn": "0926860X",
        "dcterms:subject": [
          {
            "@_fa": "true",
            "$": "Dimethoxymethane"
          },
          {
            "@_fa": "true",
            "$": "Kinetic modeling"
          },
          {
            "@_fa": "true",
            "$": "Methanol oxidative dehydrogenation"
          },
          {
            "@_fa": "true",
            "$": "Methyl Formate"
          },
          {
            "@_fa": "true",
            "$": "Vanadium oxide catalysts"
          }
        ],
        "openaccessArticle": "false",
        "prism:publicationName": "Applied Catalysis A: General",
        "openaccessSponsorType": null,
        "prism:pageRange": "119807",
        "pubType": "fla",
        "prism:coverDisplayDate": "25 July 2024",
        "prism:doi": "10.1016/j.apcata.2024.119807",
        "prism:startingPage": "119807",
        "dc:identifier": "doi:10.1016/j.apcata.2024.119807",
        "openaccessSponsorName": null
      },
      "objects": {
        "object": [
          {
            "@category": "standard",
            "@height": "998",
            "@width": "629",
            "@_fa": "true",
            "$": "https://api.elsevier.com/content/object/eid/1-s2.0-S0926860X24002515-gr6.jpg?httpAccept=%2A%2F%2A",
            "@multimediatype": "JPEG image file",
            "@type": "IMAGE-DOWNSAMPLED",
            "@size": "69410",
            "@ref": "gr6",
            "@mimetype": "image/jpeg"
          },
          {
            "@category": "standard",
            "@height": "299",
            "@width": "602",
            "@_fa": "true",
            "$": "https://api.elsevier.com/content/object/eid/1-s2.0-S0926860X24002515-gr5.jpg?httpAccept=%2A%2F%2A",
            "@multimediatype": "JPEG image file",
            "@type": "IMAGE-DOWNSAMPLED",
            "@size": "31492",
            "@ref": "gr5",
            "@mimetype": "image/jpeg"
          },
          {
            "@category": "standard",
            "@height": "298",
            "@width": "339",
            "@_fa": "true",
            "$": "https://api.elsevier.com/content/object/eid/1-s2.0-S0926860X24002515-gr4.jpg?httpAccept=%2A%2F%2A",
            "@multimediatype": "JPEG image file",
            "@type": "IMAGE-DOWNSAMPLED",
            "@size": "14705",
            "@ref": "gr4",
            "@mimetype": "image/jpeg"
          },
          {
            "@category": "standard",
            "@height": "296",
            "@width": "602",
            "@_fa": "true",
            "$": "https://api.elsevier.com/content/object/eid/1-s2.0-S0926860X24002515-gr3.jpg?httpAccept=%2A%2F%2A",
            "@multimediatype": "JPEG image file",
            "@type": "IMAGE-DOWNSAMPLED",
            "@size": "33564",
            "@ref": "gr3",
            "@mimetype": "image/jpeg"
          },
          {
            "@category": "standard",
            "@height": "294",
            "@width": "602",
            "@_fa": "true",
            "$": "https://api.elsevier.com/content/object/eid/1-s2.0-S0926860X24002515-gr2.jpg?httpAccept=%2A%2F%2A",
            "@multimediatype": "JPEG image file",
            "@type": "IMAGE-DOWNSAMPLED",
            "@size": "31721",
            "@ref": "gr2",
            "@mimetype": "image/jpeg"
          },
          {
            "@category": "standard",
            "@height": "192",
            "@width": "500",
            "@_fa": "true",
            "$": "https://api.elsevier.com/content/object/eid/1-s2.0-S0926860X24002515-ga1.jpg?httpAccept=%2A%2F%2A",
            "@multimediatype": "JPEG image file",
            "@type": "IMAGE-DOWNSAMPLED",
            "@size": "22510",
            "@ref": "ga1",
            "@mimetype": "image/jpeg"
          },
          {
            "@category": "standard",
            "@height": "366",
            "@width": "339",
            "@_fa": "true",
            "$": "https://api.elsevier.com/content/object/eid/1-s2.0-S0926860X24002515-gr1.jpg?httpAccept=%2A%2F%2A",
            "@multimediatype": "JPEG image file",
            "@type": "IMAGE-DOWNSAMPLED",
            "@size": "33037",
            "@ref": "gr1",
            "@mimetype": "image/jpeg"
          },
          {
            "@category": "standard",
            "@height": "293",
            "@width": "602",
            "@_fa": "true",
            "$": "https://api.elsevier.com/content/object/eid/1-s2.0-S0926860X24002515-gr8.jpg?httpAccept=%2A%2F%2A",
            "@multimediatype": "JPEG image file",
            "@type": "IMAGE-DOWNSAMPLED",
            "@size": "35380",
            "@ref": "gr8",
            "@mimetype": "image/jpeg"
          },
          {
            "@category": "standard",
            "@height": "360",
            "@width": "339",
            "@_fa": "true",
            "$": "https://api.elsevier.com/content/object/eid/1-s2.0-S0926860X24002515-gr7.jpg?httpAccept=%2A%2F%2A",
            "@multimediatype": "JPEG image file",
            "@type": "IMAGE-DOWNSAMPLED",
            "@size": "33843",
            "@ref": "gr7",
            "@mimetype": "image/jpeg"
          },
          {
            "@category": "thumbnail",
            "@height": "163",
            "@width": "103",
            "@_fa": "true",
            "$": "https://api.elsevier.com/content/object/eid/1-s2.0-S0926860X24002515-gr6.sml?httpAccept=%2A%2F%2A",
            "@multimediatype": "GIF image file",
            "@type": "IMAGE-THUMBNAIL",
            "@size": "4420",
            "@ref": "gr6",
            "@mimetype": "image/gif"
          },
          {
            "@category": "thumbnail",
            "@height": "109",
            "@width": "219",
            "@_fa": "true",
            "$": "https://api.elsevier.com/content/object/eid/1-s2.0-S0926860X24002515-gr5.sml?httpAccept=%2A%2F%2A",
            "@multimediatype": "GIF image file",
            "@type": "IMAGE-THUMBNAIL",
            "@size": "5654",
            "@ref": "gr5",
            "@mimetype": "image/gif"
          },
          {
            "@category": "thumbnail",
            "@height": "164",
            "@width": "186",
            "@_fa": "true",
            "$": "https://api.elsevier.com/content/object/eid/1-s2.0-S0926860X24002515-gr4.sml?httpAccept=%2A%2F%2A",
            "@multimediatype": "GIF image file",
            "@type": "IMAGE-THUMBNAIL",
            "@size": "4733",
            "@ref": "gr4",
            "@mimetype": "image/gif"
          },
          {
            "@category": "thumbnail",
            "@height": "108",
            "@width": "219",
            "@_fa": "true",
            "$": "https://api.elsevier.com/content/object/eid/1-s2.0-S0926860X24002515-gr3.sml?httpAccept=%2A%2F%2A",
            "@multimediatype": "GIF image file",
            "@type": "IMAGE-THUMBNAIL",
            "@size": "6528",
            "@ref": "gr3",
            "@mimetype": "image/gif"
          },
          {
            "@category": "thumbnail",
            "@height": "107",
            "@width": "219",
            "@_fa": "true",
            "$": "https://api.elsevier.com/content/object/eid/1-s2.0-S0926860X24002515-gr2.sml?httpAccept=%2A%2F%2A",
            "@multimediatype": "GIF image file",
            "@type": "IMAGE-THUMBNAIL",
            "@size": "6218",
            "@ref": "gr2",
            "@mimetype": "image/gif"
          },
          {
            "@category": "thumbnail",
            "@height": "84",
            "@width": "219",
            "@_fa": "true",
            "$": "https://api.elsevier.com/content/object/eid/1-s2.0-S0926860X24002515-ga1.sml?httpAccept=%2A%2F%2A",
            "@multimediatype": "GIF image file",
            "@type": "IMAGE-THUMBNAIL",
            "@size": "7584",
            "@ref": "ga1",
            "@mimetype": "image/gif"
          },
          {
            "@category": "thumbnail",
            "@height": "164",
            "@width": "152",
            "@_fa": "true",
            "$": "https://api.elsevier.com/content/object/eid/1-s2.0-S0926860X24002515-gr1.sml?httpAccept=%2A%2F%2A",
            "@multimediatype": "GIF image file",
            "@type": "IMAGE-THUMBNAIL",
            "@size": "8061",
            "@ref": "gr1",
            "@mimetype": "image/gif"
          },
          {
            "@category": "thumbnail",
            "@height": "106",
            "@width": "219",
            "@_fa": "true",
            "$": "https://api.elsevier.com/content/object/eid/1-s2.0-S0926860X24002515-gr8.sml?httpAccept=%2A%2F%2A",
            "@multimediatype": "GIF image file",
            "@type": "IMAGE-THUMBNAIL",
            "@size": "6108",
            "@ref": "gr8",
            "@mimetype": "image/gif"
          },
          {
            "@category": "thumbnail",
            "@height": "163",
            "@width": "154",
            "@_fa": "true",
            "$": "https://api.elsevier.com/content/object/eid/1-s2.0-S0926860X24002515-gr7.sml?httpAccept=%2A%2F%2A",
            "@multimediatype": "GIF image file",
            "@type": "IMAGE-THUMBNAIL",
            "@size": "7723",
            "@ref": "gr7",
            "@mimetype": "image/gif"
          },
          {
            "@category": "high",
            "@height": "4408",
            "@width": "2779",
            "@_fa": "true",
            "$": "https://api.elsevier.com/content/object/eid/1-s2.0-S0926860X24002515-gr6_lrg.jpg?httpAccept=%2A%2F%2A",
            "@multimediatype": "JPEG image file",
            "@type": "IMAGE-HIGH-RES",
            "@size": "325492",
            "@ref": "gr6",
            "@mimetype": "image/jpeg"
          },
          {
            "@category": "high",
            "@height": "1323",
            "@width": "2661",
            "@_fa": "true",
            "$": "https://api.elsevier.com/content/object/eid/1-s2.0-S0926860X24002515-gr5_lrg.jpg?httpAccept=%2A%2F%2A",
            "@multimediatype": "JPEG image file",
            "@type": "IMAGE-HIGH-RES",
            "@size": "152874",
            "@ref": "gr5",
            "@mimetype": "image/jpeg"
          },
          {
            "@category": "high",
            "@height": "1318",
            "@width": "1497",
            "@_fa": "true",
            "$": "https://api.elsevier.com/content/object/eid/1-s2.0-S0926860X24002515-gr4_lrg.jpg?httpAccept=%2A%2F%2A",
            "@multimediatype": "JPEG image file",
            "@type": "IMAGE-HIGH-RES",
            "@size": "59882",
            "@ref": "gr4",
            "@mimetype": "image/jpeg"
          },
          {
            "@category": "high",
            "@height": "1307",
            "@width": "2661",
            "@_fa": "true",
            "$": "https://api.elsevier.com/content/object/eid/1-s2.0-S0926860X24002515-gr3_lrg.jpg?httpAccept=%2A%2F%2A",
            "@multimediatype": "JPEG image file",
            "@type": "IMAGE-HIGH-RES",
            "@size": "167032",
            "@ref": "gr3",
            "@mimetype": "image/jpeg"
          },
          {
            "@category": "high",
            "@height": "1301",
            "@width": "2661",
            "@_fa": "true",
            "$": "https://api.elsevier.com/content/object/eid/1-s2.0-S0926860X24002515-gr2_lrg.jpg?httpAccept=%2A%2F%2A",
            "@multimediatype": "JPEG image file",
            "@type": "IMAGE-HIGH-RES",
            "@size": "147429",
            "@ref": "gr2",
            "@mimetype": "image/jpeg"
          },
          {
            "@category": "high",
            "@height": "851",
            "@width": "2213",
            "@_fa": "true",
            "$": "https://api.elsevier.com/content/object/eid/1-s2.0-S0926860X24002515-ga1_lrg.jpg?httpAccept=%2A%2F%2A",
            "@multimediatype": "JPEG image file",
            "@type": "IMAGE-HIGH-RES",
            "@size": "152091",
            "@ref": "ga1",
            "@mimetype": "image/jpeg"
          },
          {
            "@category": "high",
            "@height": "1616",
            "@width": "1497",
            "@_fa": "true",
            "$": "https://api.elsevier.com/content/object/eid/1-s2.0-S0926860X24002515-gr1_lrg.jpg?httpAccept=%2A%2F%2A",
            "@multimediatype": "JPEG image file",
            "@type": "IMAGE-HIGH-RES",
            "@size": "156491",
            "@ref": "gr1",
            "@mimetype": "image/jpeg"
          },
          {
            "@category": "high",
            "@height": "1293",
            "@width": "2661",
            "@_fa": "true",
            "$": "https://api.elsevier.com/content/object/eid/1-s2.0-S0926860X24002515-gr8_lrg.jpg?httpAccept=%2A%2F%2A",
            "@multimediatype": "JPEG image file",
            "@type": "IMAGE-HIGH-RES",
            "@size": "148542",
            "@ref": "gr8",
            "@mimetype": "image/jpeg"
          },
          {
            "@category": "high",
            "@height": "1588",
            "@width": "1497",
            "@_fa": "true",
            "$": "https://api.elsevier.com/content/object/eid/1-s2.0-S0926860X24002515-gr7_lrg.jpg?httpAccept=%2A%2F%2A",
            "@multimediatype": "JPEG image file",
            "@type": "IMAGE-HIGH-RES",
            "@size": "140961",
            "@ref": "gr7",
            "@mimetype": "image/jpeg"
          },
          {
            "@category": "standard",
            "@_fa": "true",
            "$": "https://api.elsevier.com/content/object/eid/1-s2.0-S0926860X24002515-mmc1.docx?httpAccept=%2A%2F%2A",
            "@multimediatype": "Microsoft Word file",
            "@type": "APPLICATION",
            "@size": "1669421",
            "@ref": "mmc1",
            "@mimetype": "application/word"
          },
          {
            "@category": "thumbnail",
            "@_fa": "true",
            "$": "https://api.elsevier.com/content/object/eid/1-s2.0-S0926860X24002515-si0001.svg?httpAccept=%2A%2F%2A",
            "@multimediatype": "Scalable Vector Graphics file",
            "@type": "ALTIMG",
            "@size": "2791",
            "@ref": "si0001",
            "@mimetype": "image/svg+xml"
          },
          {
            "@category": "thumbnail",
            "@_fa": "true",
            "$": "https://api.elsevier.com/content/object/eid/1-s2.0-S0926860X24002515-si0002.svg?httpAccept=%2A%2F%2A",
            "@multimediatype": "Scalable Vector Graphics file",
            "@type": "ALTIMG",
            "@size": "2836",
            "@ref": "si0002",
            "@mimetype": "image/svg+xml"
          },
          {
            "@category": "thumbnail",
            "@_fa": "true",
            "$": "https://api.elsevier.com/content/object/eid/1-s2.0-S0926860X24002515-si0003.svg?httpAccept=%2A%2F%2A",
            "@multimediatype": "Scalable Vector Graphics file",
            "@type": "ALTIMG",
            "@size": "2727",
            "@ref": "si0003",
            "@mimetype": "image/svg+xml"
          },
          {
            "@category": "thumbnail",
            "@_fa": "true",
            "$": "https://api.elsevier.com/content/object/eid/1-s2.0-S0926860X24002515-si0004.svg?httpAccept=%2A%2F%2A",
            "@multimediatype": "Scalable Vector Graphics file",
            "@type": "ALTIMG",
            "@size": "2248",
            "@ref": "si0004",
            "@mimetype": "image/svg+xml"
          },
          {
            "@category": "thumbnail",
            "@_fa": "true",
            "$": "https://api.elsevier.com/content/object/eid/1-s2.0-S0926860X24002515-si0005.svg?httpAccept=%2A%2F%2A",
            "@multimediatype": "Scalable Vector Graphics file",
            "@type": "ALTIMG",
            "@size": "1993",
            "@ref": "si0005",
            "@mimetype": "image/svg+xml"
          },
          {
            "@category": "thumbnail",
            "@_fa": "true",
            "$": "https://api.elsevier.com/content/object/eid/1-s2.0-S0926860X24002515-si0006.svg?httpAccept=%2A%2F%2A",
            "@multimediatype": "Scalable Vector Graphics file",
            "@type": "ALTIMG",
            "@size": "1746",
            "@ref": "si0006",
            "@mimetype": "image/svg+xml"
          },
          {
            "@category": "thumbnail",
            "@_fa": "true",
            "$": "https://api.elsevier.com/content/object/eid/1-s2.0-S0926860X24002515-si0007.svg?httpAccept=%2A%2F%2A",
            "@multimediatype": "Scalable Vector Graphics file",
            "@type": "ALTIMG",
            "@size": "2739",
            "@ref": "si0007",
            "@mimetype": "image/svg+xml"
          },
          {
            "@category": "thumbnail",
            "@_fa": "true",
            "$": "https://api.elsevier.com/content/object/eid/1-s2.0-S0926860X24002515-si0008.svg?httpAccept=%2A%2F%2A",
            "@multimediatype": "Scalable Vector Graphics file",
            "@type": "ALTIMG",
            "@size": "3209",
            "@ref": "si0008",
            "@mimetype": "image/svg+xml"
          },
          {
            "@category": "thumbnail",
            "@_fa": "true",
            "$": "https://api.elsevier.com/content/object/eid/1-s2.0-S0926860X24002515-si0009.svg?httpAccept=%2A%2F%2A",
            "@multimediatype": "Scalable Vector Graphics file",
            "@type": "ALTIMG",
            "@size": "2970",
            "@ref": "si0009",
            "@mimetype": "image/svg+xml"
          },
          {
            "@category": "thumbnail",
            "@_fa": "true",
            "$": "https://api.elsevier.com/content/object/eid/1-s2.0-S0926860X24002515-si0010.svg?httpAccept=%2A%2F%2A",
            "@multimediatype": "Scalable Vector Graphics file",
            "@type": "ALTIMG",
            "@size": "3091",
            "@ref": "si0010",
            "@mimetype": "image/svg+xml"
          },
          {
            "@category": "thumbnail",
            "@_fa": "true",
            "$": "https://api.elsevier.com/content/object/eid/1-s2.0-S0926860X24002515-si0011.svg?httpAccept=%2A%2F%2A",
            "@multimediatype": "Scalable Vector Graphics file",
            "@type": "ALTIMG",
            "@size": "3148",
            "@ref": "si0011",
            "@mimetype": "image/svg+xml"
          },
          {
            "@category": "thumbnail",
            "@_fa": "true",
            "$": "https://api.elsevier.com/content/object/eid/1-s2.0-S0926860X24002515-si0012.svg?httpAccept=%2A%2F%2A",
            "@multimediatype": "Scalable Vector Graphics file",
            "@type": "ALTIMG",
            "@size": "3318",
            "@ref": "si0012",
            "@mimetype": "image/svg+xml"
          },
          {
            "@category": "thumbnail",
            "@_fa": "true",
            "$": "https://api.elsevier.com/content/object/eid/1-s2.0-S0926860X24002515-si0013.svg?httpAccept=%2A%2F%2A",
            "@multimediatype": "Scalable Vector Graphics file",
            "@type": "ALTIMG",
            "@size": "3379",
            "@ref": "si0013",
            "@mimetype": "image/svg+xml"
          },
          {
            "@category": "thumbnail",
            "@_fa": "true",
            "$": "https://api.elsevier.com/content/object/eid/1-s2.0-S0926860X24002515-si0014.svg?httpAccept=%2A%2F%2A",
            "@multimediatype": "Scalable Vector Graphics file",
            "@type": "ALTIMG",
            "@size": "2791",
            "@ref": "si0014",
            "@mimetype": "image/svg+xml"
          },
          {
            "@category": "thumbnail",
            "@_fa": "true",
            "$": "https://api.elsevier.com/content/object/eid/1-s2.0-S0926860X24002515-si0015.svg?httpAccept=%2A%2F%2A",
            "@multimediatype": "Scalable Vector Graphics file",
            "@type": "ALTIMG",
            "@size": "1118",
            "@ref": "si0015",
            "@mimetype": "image/svg+xml"
          },
          {
            "@category": "thumbnail",
            "@_fa": "true",
            "$": "https://api.elsevier.com/content/object/eid/1-s2.0-S0926860X24002515-si0016.svg?httpAccept=%2A%2F%2A",
            "@multimediatype": "Scalable Vector Graphics file",
            "@type": "ALTIMG",
            "@size": "1025",
            "@ref": "si0016",
            "@mimetype": "image/svg+xml"
          },
          {
            "@category": "thumbnail",
            "@_fa": "true",
            "$": "https://api.elsevier.com/content/object/eid/1-s2.0-S0926860X24002515-si0017.svg?httpAccept=%2A%2F%2A",
            "@multimediatype": "Scalable Vector Graphics file",
            "@type": "ALTIMG",
            "@size": "1215",
            "@ref": "si0017",
            "@mimetype": "image/svg+xml"
          },
          {
            "@category": "thumbnail",
            "@_fa": "true",
            "$": "https://api.elsevier.com/content/object/eid/1-s2.0-S0926860X24002515-si0018.svg?httpAccept=%2A%2F%2A",
            "@multimediatype": "Scalable Vector Graphics file",
            "@type": "ALTIMG",
            "@size": "1187",
            "@ref": "si0018",
            "@mimetype": "image/svg+xml"
          },
          {
            "@category": "thumbnail",
            "@_fa": "true",
            "$": "https://api.elsevier.com/content/object/eid/1-s2.0-S0926860X24002515-si0019.svg?httpAccept=%2A%2F%2A",
            "@multimediatype": "Scalable Vector Graphics file",
            "@type": "ALTIMG",
            "@size": "2188",
            "@ref": "si0019",
            "@mimetype": "image/svg+xml"
          },
          {
            "@category": "thumbnail",
            "@_fa": "true",
            "$": "https://api.elsevier.com/content/object/eid/1-s2.0-S0926860X24002515-si0020.svg?httpAccept=%2A%2F%2A",
            "@multimediatype": "Scalable Vector Graphics file",
            "@type": "ALTIMG",
            "@size": "1713",
            "@ref": "si0020",
            "@mimetype": "image/svg+xml"
          },
          {
            "@category": "thumbnail",
            "@_fa": "true",
            "$": "https://api.elsevier.com/content/object/eid/1-s2.0-S0926860X24002515-si0021.svg?httpAccept=%2A%2F%2A",
            "@multimediatype": "Scalable Vector Graphics file",
            "@type": "ALTIMG",
            "@size": "1649",
            "@ref": "si0021",
            "@mimetype": "image/svg+xml"
          },
          {
            "@category": "thumbnail",
            "@_fa": "true",
            "$": "https://api.elsevier.com/content/object/eid/1-s2.0-S0926860X24002515-si0022.svg?httpAccept=%2A%2F%2A",
            "@multimediatype": "Scalable Vector Graphics file",
            "@type": "ALTIMG",
            "@size": "2325",
            "@ref": "si0022",
            "@mimetype": "image/svg+xml"
          },
          {
            "@category": "thumbnail",
            "@_fa": "true",
            "$": "https://api.elsevier.com/content/object/eid/1-s2.0-S0926860X24002515-si0023.svg?httpAccept=%2A%2F%2A",
            "@multimediatype": "Scalable Vector Graphics file",
            "@type": "ALTIMG",
            "@size": "2204",
            "@ref": "si0023",
            "@mimetype": "image/svg+xml"
          },
          {
            "@category": "thumbnail",
            "@_fa": "true",
            "$": "https://api.elsevier.com/content/object/eid/1-s2.0-S0926860X24002515-si0024.svg?httpAccept=%2A%2F%2A",
            "@multimediatype": "Scalable Vector Graphics file",
            "@type": "ALTIMG",
            "@size": "1770",
            "@ref": "si0024",
            "@mimetype": "image/svg+xml"
          },
          {
            "@category": "thumbnail",
            "@_fa": "true",
            "$": "https://api.elsevier.com/content/object/eid/1-s2.0-S0926860X24002515-si0025.svg?httpAccept=%2A%2F%2A",
            "@multimediatype": "Scalable Vector Graphics file",
            "@type": "ALTIMG",
            "@size": "2256",
            "@ref": "si0025",
            "@mimetype": "image/svg+xml"
          },
          {
            "@category": "thumbnail",
            "@_fa": "true",
            "$": "https://api.elsevier.com/content/object/eid/1-s2.0-S0926860X24002515-si0026.svg?httpAccept=%2A%2F%2A",
            "@multimediatype": "Scalable Vector Graphics file",
            "@type": "ALTIMG",
            "@size": "1722",
            "@ref": "si0026",
            "@mimetype": "image/svg+xml"
          },
          {
            "@category": "thumbnail",
            "@_fa": "true",
            "$": "https://api.elsevier.com/content/object/eid/1-s2.0-S0926860X24002515-si0027.svg?httpAccept=%2A%2F%2A",
            "@multimediatype": "Scalable Vector Graphics file",
            "@type": "ALTIMG",
            "@size": "2390",
            "@ref": "si0027",
            "@mimetype": "image/svg+xml"
          },
          {
            "@category": "thumbnail",
            "@_fa": "true",
            "$": "https://api.elsevier.com/content/object/eid/1-s2.0-S0926860X24002515-si0028.svg?httpAccept=%2A%2F%2A",
            "@multimediatype": "Scalable Vector Graphics file",
            "@type": "ALTIMG",
            "@size": "3505",
            "@ref": "si0028",
            "@mimetype": "image/svg+xml"
          },
          {
            "@category": "thumbnail",
            "@_fa": "true",
            "$": "https://api.elsevier.com/content/object/eid/1-s2.0-S0926860X24002515-si0029.svg?httpAccept=%2A%2F%2A",
            "@multimediatype": "Scalable Vector Graphics file",
            "@type": "ALTIMG",
            "@size": "2650",
            "@ref": "si0029",
            "@mimetype": "image/svg+xml"
          },
          {
            "@category": "thumbnail",
            "@_fa": "true",
            "$": "https://api.elsevier.com/content/object/eid/1-s2.0-S0926860X24002515-si0030.svg?httpAccept=%2A%2F%2A",
            "@multimediatype": "Scalable Vector Graphics file",
            "@type": "ALTIMG",
            "@size": "2812",
            "@ref": "si0030",
            "@mimetype": "image/svg+xml"
          },
          {
            "@category": "thumbnail",
            "@_fa": "true",
            "$": "https://api.elsevier.com/content/object/eid/1-s2.0-S0926860X24002515-si0031.svg?httpAccept=%2A%2F%2A",
            "@multimediatype": "Scalable Vector Graphics file",
            "@type": "ALTIMG",
            "@size": "3156",
            "@ref": "si0031",
            "@mimetype": "image/svg+xml"
          },
          {
            "@category": "thumbnail",
            "@_fa": "true",
            "$": "https://api.elsevier.com/content/object/eid/1-s2.0-S0926860X24002515-si0032.svg?httpAccept=%2A%2F%2A",
            "@multimediatype": "Scalable Vector Graphics file",
            "@type": "ALTIMG",
            "@size": "5045",
            "@ref": "si0032",
            "@mimetype": "image/svg+xml"
          },
          {
            "@category": "thumbnail",
            "@_fa": "true",
            "$": "https://api.elsevier.com/content/object/eid/1-s2.0-S0926860X24002515-si0033.svg?httpAccept=%2A%2F%2A",
            "@multimediatype": "Scalable Vector Graphics file",
            "@type": "ALTIMG",
            "@size": "1892",
            "@ref": "si0033",
            "@mimetype": "image/svg+xml"
          },
          {
            "@category": "thumbnail",
            "@_fa": "true",
            "$": "https://api.elsevier.com/content/object/eid/1-s2.0-S0926860X24002515-si0034.svg?httpAccept=%2A%2F%2A",
            "@multimediatype": "Scalable Vector Graphics file",
            "@type": "ALTIMG",
            "@size": "3942",
            "@ref": "si0034",
            "@mimetype": "image/svg+xml"
          },
          {
            "@category": "thumbnail",
            "@_fa": "true",
            "$": "https://api.elsevier.com/content/object/eid/1-s2.0-S0926860X24002515-si0035.svg?httpAccept=%2A%2F%2A",
            "@multimediatype": "Scalable Vector Graphics file",
            "@type": "ALTIMG",
            "@size": "3772",
            "@ref": "si0035",
            "@mimetype": "image/svg+xml"
          },
          {
            "@category": "thumbnail",
            "@_fa": "true",
            "$": "https://api.elsevier.com/content/object/eid/1-s2.0-S0926860X24002515-si0036.svg?httpAccept=%2A%2F%2A",
            "@multimediatype": "Scalable Vector Graphics file",
            "@type": "ALTIMG",
            "@size": "4177",
            "@ref": "si0036",
            "@mimetype": "image/svg+xml"
          },
          {
            "@category": "thumbnail",
            "@_fa": "true",
            "$": "https://api.elsevier.com/content/object/eid/1-s2.0-S0926860X24002515-si0037.svg?httpAccept=%2A%2F%2A",
            "@multimediatype": "Scalable Vector Graphics file",
            "@type": "ALTIMG",
            "@size": "2111",
            "@ref": "si0037",
            "@mimetype": "image/svg+xml"
          },
          {
            "@category": "thumbnail",
            "@_fa": "true",
            "$": "https://api.elsevier.com/content/object/eid/1-s2.0-S0926860X24002515-si0038.svg?httpAccept=%2A%2F%2A",
            "@multimediatype": "Scalable Vector Graphics file",
            "@type": "ALTIMG",
            "@size": "4109",
            "@ref": "si0038",
            "@mimetype": "image/svg+xml"
          },
          {
            "@category": "thumbnail",
            "@_fa": "true",
            "$": "https://api.elsevier.com/content/object/eid/1-s2.0-S0926860X24002515-si0039.svg?httpAccept=%2A%2F%2A",
            "@multimediatype": "Scalable Vector Graphics file",
            "@type": "ALTIMG",
            "@size": "7869",
            "@ref": "si0039",
            "@mimetype": "image/svg+xml"
          },
          {
            "@category": "thumbnail",
            "@_fa": "true",
            "$": "https://api.elsevier.com/content/object/eid/1-s2.0-S0926860X24002515-si0040.svg?httpAccept=%2A%2F%2A",
            "@multimediatype": "Scalable Vector Graphics file",
            "@type": "ALTIMG",
            "@size": "6285",
            "@ref": "si0040",
            "@mimetype": "image/svg+xml"
          },
          {
            "@category": "thumbnail",
            "@_fa": "true",
            "$": "https://api.elsevier.com/content/object/eid/1-s2.0-S0926860X24002515-si0041.svg?httpAccept=%2A%2F%2A",
            "@multimediatype": "Scalable Vector Graphics file",
            "@type": "ALTIMG",
            "@size": "1872",
            "@ref": "si0041",
            "@mimetype": "image/svg+xml"
          },
          {
            "@category": "thumbnail",
            "@_fa": "true",
            "$": "https://api.elsevier.com/content/object/eid/1-s2.0-S0926860X24002515-si0042.svg?httpAccept=%2A%2F%2A",
            "@multimediatype": "Scalable Vector Graphics file",
            "@type": "ALTIMG",
            "@size": "2269",
            "@ref": "si0042",
            "@mimetype": "image/svg+xml"
          },
          {
            "@category": "thumbnail",
            "@_fa": "true",
            "$": "https://api.elsevier.com/content/object/eid/1-s2.0-S0926860X24002515-si0043.svg?httpAccept=%2A%2F%2A",
            "@multimediatype": "Scalable Vector Graphics file",
            "@type": "ALTIMG",
            "@size": "1855",
            "@ref": "si0043",
            "@mimetype": "image/svg+xml"
          },
          {
            "@category": "thumbnail",
            "@_fa": "true",
            "$": "https://api.elsevier.com/content/object/eid/1-s2.0-S0926860X24002515-si0044.svg?httpAccept=%2A%2F%2A",
            "@multimediatype": "Scalable Vector Graphics file",
            "@type": "ALTIMG",
            "@size": "5093",
            "@ref": "si0044",
            "@mimetype": "image/svg+xml"
          },
          {
            "@category": "thumbnail",
            "@_fa": "true",
            "$": "https://api.elsevier.com/content/object/eid/1-s2.0-S0926860X24002515-si0045.svg?httpAccept=%2A%2F%2A",
            "@multimediatype": "Scalable Vector Graphics file",
            "@type": "ALTIMG",
            "@size": "5004",
            "@ref": "si0045",
            "@mimetype": "image/svg+xml"
          },
          {
            "@category": "thumbnail",
            "@_fa": "true",
            "$": "https://api.elsevier.com/content/object/eid/1-s2.0-S0926860X24002515-si0046.svg?httpAccept=%2A%2F%2A",
            "@multimediatype": "Scalable Vector Graphics file",
            "@type": "ALTIMG",
            "@size": "2167",
            "@ref": "si0046",
            "@mimetype": "image/svg+xml"
          },
          {
            "@category": "thumbnail",
            "@_fa": "true",
            "$": "https://api.elsevier.com/content/object/eid/1-s2.0-S0926860X24002515-si0047.svg?httpAccept=%2A%2F%2A",
            "@multimediatype": "Scalable Vector Graphics file",
            "@type": "ALTIMG",
            "@size": "2127",
            "@ref": "si0047",
            "@mimetype": "image/svg+xml"
          },
          {
            "@category": "thumbnail",
            "@_fa": "true",
            "$": "https://api.elsevier.com/content/object/eid/1-s2.0-S0926860X24002515-si0048.svg?httpAccept=%2A%2F%2A",
            "@multimediatype": "Scalable Vector Graphics file",
            "@type": "ALTIMG",
            "@size": "1973",
            "@ref": "si0048",
            "@mimetype": "image/svg+xml"
          },
          {
            "@category": "thumbnail",
            "@_fa": "true",
            "$": "https://api.elsevier.com/content/object/eid/1-s2.0-S0926860X24002515-si0049.svg?httpAccept=%2A%2F%2A",
            "@multimediatype": "Scalable Vector Graphics file",
            "@type": "ALTIMG",
            "@size": "2261",
            "@ref": "si0049",
            "@mimetype": "image/svg+xml"
          },
          {
            "@category": "thumbnail",
            "@_fa": "true",
            "$": "https://api.elsevier.com/content/object/eid/1-s2.0-S0926860X24002515-si0050.svg?httpAccept=%2A%2F%2A",
            "@multimediatype": "Scalable Vector Graphics file",
            "@type": "ALTIMG",
            "@size": "3221",
            "@ref": "si0050",
            "@mimetype": "image/svg+xml"
          },
          {
            "@category": "thumbnail",
            "@_fa": "true",
            "$": "https://api.elsevier.com/content/object/eid/1-s2.0-S0926860X24002515-si0051.svg?httpAccept=%2A%2F%2A",
            "@multimediatype": "Scalable Vector Graphics file",
            "@type": "ALTIMG",
            "@size": "3278",
            "@ref": "si0051",
            "@mimetype": "image/svg+xml"
          },
          {
            "@category": "thumbnail",
            "@_fa": "true",
            "$": "https://api.elsevier.com/content/object/eid/1-s2.0-S0926860X24002515-si0052.svg?httpAccept=%2A%2F%2A",
            "@multimediatype": "Scalable Vector Graphics file",
            "@type": "ALTIMG",
            "@size": "3561",
            "@ref": "si0052",
            "@mimetype": "image/svg+xml"
          },
          {
            "@category": "thumbnail",
            "@_fa": "true",
            "$": "https://api.elsevier.com/content/object/eid/1-s2.0-S0926860X24002515-si0053.svg?httpAccept=%2A%2F%2A",
            "@multimediatype": "Scalable Vector Graphics file",
            "@type": "ALTIMG",
            "@size": "3914",
            "@ref": "si0053",
            "@mimetype": "image/svg+xml"
          },
          {
            "@category": "thumbnail",
            "@_fa": "true",
            "$": "https://api.elsevier.com/content/object/eid/1-s2.0-S0926860X24002515-si0054.svg?httpAccept=%2A%2F%2A",
            "@multimediatype": "Scalable Vector Graphics file",
            "@type": "ALTIMG",
            "@size": "1405",
            "@ref": "si0054",
            "@mimetype": "image/svg+xml"
          },
          {
            "@category": "thumbnail",
            "@_fa": "true",
            "$": "https://api.elsevier.com/content/object/eid/1-s2.0-S0926860X24002515-si0055.svg?httpAccept=%2A%2F%2A",
            "@multimediatype": "Scalable Vector Graphics file",
            "@type": "ALTIMG",
            "@size": "1118",
            "@ref": "si0055",
            "@mimetype": "image/svg+xml"
          },
          {
            "@category": "thumbnail",
            "@_fa": "true",
            "$": "https://api.elsevier.com/content/object/eid/1-s2.0-S0926860X24002515-si0056.svg?httpAccept=%2A%2F%2A",
            "@multimediatype": "Scalable Vector Graphics file",
            "@type": "ALTIMG",
            "@size": "3237",
            "@ref": "si0056",
            "@mimetype": "image/svg+xml"
          },
          {
            "@category": "thumbnail",
            "@_fa": "true",
            "$": "https://api.elsevier.com/content/object/eid/1-s2.0-S0926860X24002515-si0057.svg?httpAccept=%2A%2F%2A",
            "@multimediatype": "Scalable Vector Graphics file",
            "@type": "ALTIMG",
            "@size": "3067",
            "@ref": "si0057",
            "@mimetype": "image/svg+xml"
          },
          {
            "@category": "thumbnail",
            "@_fa": "true",
            "$": "https://api.elsevier.com/content/object/eid/1-s2.0-S0926860X24002515-si0058.svg?httpAccept=%2A%2F%2A",
            "@multimediatype": "Scalable Vector Graphics file",
            "@type": "ALTIMG",
            "@size": "1203",
            "@ref": "si0058",
            "@mimetype": "image/svg+xml"
          },
          {
            "@category": "thumbnail",
            "@_fa": "true",
            "$": "https://api.elsevier.com/content/object/eid/1-s2.0-S0926860X24002515-si0059.svg?httpAccept=%2A%2F%2A",
            "@multimediatype": "Scalable Vector Graphics file",
            "@type": "ALTIMG",
            "@size": "1369",
            "@ref": "si0059",
            "@mimetype": "image/svg+xml"
          },
          {
            "@category": "thumbnail",
            "@_fa": "true",
            "$": "https://api.elsevier.com/content/object/eid/1-s2.0-S0926860X24002515-si0060.svg?httpAccept=%2A%2F%2A",
            "@multimediatype": "Scalable Vector Graphics file",
            "@type": "ALTIMG",
            "@size": "1458",
            "@ref": "si0060",
            "@mimetype": "image/svg+xml"
          },
          {
            "@category": "thumbnail",
            "@_fa": "true",
            "$": "https://api.elsevier.com/content/object/eid/1-s2.0-S0926860X24002515-si0061.svg?httpAccept=%2A%2F%2A",
            "@multimediatype": "Scalable Vector Graphics file",
            "@type": "ALTIMG",
            "@size": "1555",
            "@ref": "si0061",
            "@mimetype": "image/svg+xml"
          },
          {
            "@category": "thumbnail",
            "@_fa": "true",
            "$": "https://api.elsevier.com/content/object/eid/1-s2.0-S0926860X24002515-si0062.svg?httpAccept=%2A%2F%2A",
            "@multimediatype": "Scalable Vector Graphics file",
            "@type": "ALTIMG",
            "@size": "1555",
            "@ref": "si0062",
            "@mimetype": "image/svg+xml"
          },
          {
            "@category": "thumbnail",
            "@_fa": "true",
            "$": "https://api.elsevier.com/content/object/eid/1-s2.0-S0926860X24002515-si0063.svg?httpAccept=%2A%2F%2A",
            "@multimediatype": "Scalable Vector Graphics file",
            "@type": "ALTIMG",
            "@size": "12327",
            "@ref": "si0063",
            "@mimetype": "image/svg+xml"
          },
          {
            "@category": "thumbnail",
            "@_fa": "true",
            "$": "https://api.elsevier.com/content/object/eid/1-s2.0-S0926860X24002515-si0064.svg?httpAccept=%2A%2F%2A",
            "@multimediatype": "Scalable Vector Graphics file",
            "@type": "ALTIMG",
            "@size": "1057",
            "@ref": "si0064",
            "@mimetype": "image/svg+xml"
          },
          {
            "@category": "thumbnail",
            "@_fa": "true",
            "$": "https://api.elsevier.com/content/object/eid/1-s2.0-S0926860X24002515-si0065.svg?httpAccept=%2A%2F%2A",
            "@multimediatype": "Scalable Vector Graphics file",
            "@type": "ALTIMG",
            "@size": "1519",
            "@ref": "si0065",
            "@mimetype": "image/svg+xml"
          },
          {
            "@category": "thumbnail",
            "@_fa": "true",
            "$": "https://api.elsevier.com/content/object/eid/1-s2.0-S0926860X24002515-si0066.svg?httpAccept=%2A%2F%2A",
            "@multimediatype": "Scalable Vector Graphics file",
            "@type": "ALTIMG",
            "@size": "1126",
            "@ref": "si0066",
            "@mimetype": "image/svg+xml"
          },
          {
            "@category": "thumbnail",
            "@_fa": "true",
            "$": "https://api.elsevier.com/content/object/eid/1-s2.0-S0926860X24002515-si0067.svg?httpAccept=%2A%2F%2A",
            "@multimediatype": "Scalable Vector Graphics file",
            "@type": "ALTIMG",
            "@size": "2524",
            "@ref": "si0067",
            "@mimetype": "image/svg+xml"
          },
          {
            "@category": "thumbnail",
            "@_fa": "true",
            "$": "https://api.elsevier.com/content/object/eid/1-s2.0-S0926860X24002515-si0068.svg?httpAccept=%2A%2F%2A",
            "@multimediatype": "Scalable Vector Graphics file",
            "@type": "ALTIMG",
            "@size": "1503",
            "@ref": "si0068",
            "@mimetype": "image/svg+xml"
          },
          {
            "@category": "thumbnail",
            "@_fa": "true",
            "$": "https://api.elsevier.com/content/object/eid/1-s2.0-S0926860X24002515-si0069.svg?httpAccept=%2A%2F%2A",
            "@multimediatype": "Scalable Vector Graphics file",
            "@type": "ALTIMG",
            "@size": "1503",
            "@ref": "si0069",
            "@mimetype": "image/svg+xml"
          },
          {
            "@category": "thumbnail",
            "@_fa": "true",
            "$": "https://api.elsevier.com/content/object/eid/1-s2.0-S0926860X24002515-si0070.svg?httpAccept=%2A%2F%2A",
            "@multimediatype": "Scalable Vector Graphics file",
            "@type": "ALTIMG",
            "@size": "9126",
            "@ref": "si0070",
            "@mimetype": "image/svg+xml"
          },
          {
            "@category": "thumbnail",
            "@_fa": "true",
            "$": "https://api.elsevier.com/content/object/eid/1-s2.0-S0926860X24002515-si0071.svg?httpAccept=%2A%2F%2A",
            "@multimediatype": "Scalable Vector Graphics file",
            "@type": "ALTIMG",
            "@size": "1389",
            "@ref": "si0071",
            "@mimetype": "image/svg+xml"
          },
          {
            "@category": "thumbnail",
            "@_fa": "true",
            "$": "https://api.elsevier.com/content/object/eid/1-s2.0-S0926860X24002515-si0072.svg?httpAccept=%2A%2F%2A",
            "@multimediatype": "Scalable Vector Graphics file",
            "@type": "ALTIMG",
            "@size": "1503",
            "@ref": "si0072",
            "@mimetype": "image/svg+xml"
          },
          {
            "@category": "thumbnail",
            "@_fa": "true",
            "$": "https://api.elsevier.com/content/object/eid/1-s2.0-S0926860X24002515-si0073.svg?httpAccept=%2A%2F%2A",
            "@multimediatype": "Scalable Vector Graphics file",
            "@type": "ALTIMG",
            "@size": "10200",
            "@ref": "si0073",
            "@mimetype": "image/svg+xml"
          },
          {
            "@category": "thumbnail",
            "@_fa": "true",
            "$": "https://api.elsevier.com/content/object/eid/1-s2.0-S0926860X24002515-si0074.svg?httpAccept=%2A%2F%2A",
            "@multimediatype": "Scalable Vector Graphics file",
            "@type": "ALTIMG",
            "@size": "1057",
            "@ref": "si0074",
            "@mimetype": "image/svg+xml"
          },
          {
            "@category": "thumbnail",
            "@_fa": "true",
            "$": "https://api.elsevier.com/content/object/eid/1-s2.0-S0926860X24002515-si0075.svg?httpAccept=%2A%2F%2A",
            "@multimediatype": "Scalable Vector Graphics file",
            "@type": "ALTIMG",
            "@size": "1389",
            "@ref": "si0075",
            "@mimetype": "image/svg+xml"
          },
          {
            "@category": "thumbnail",
            "@_fa": "true",
            "$": "https://api.elsevier.com/content/object/eid/1-s2.0-S0926860X24002515-si0076.svg?httpAccept=%2A%2F%2A",
            "@multimediatype": "Scalable Vector Graphics file",
            "@type": "ALTIMG",
            "@size": "1126",
            "@ref": "si0076",
            "@mimetype": "image/svg+xml"
          },
          {
            "@category": "thumbnail",
            "@_fa": "true",
            "$": "https://api.elsevier.com/content/object/eid/1-s2.0-S0926860X24002515-si0077.svg?httpAccept=%2A%2F%2A",
            "@multimediatype": "Scalable Vector Graphics file",
            "@type": "ALTIMG",
            "@size": "1503",
            "@ref": "si0077",
            "@mimetype": "image/svg+xml"
          },
          {
            "@category": "thumbnail",
            "@_fa": "true",
            "$": "https://api.elsevier.com/content/object/eid/1-s2.0-S0926860X24002515-si0078.svg?httpAccept=%2A%2F%2A",
            "@multimediatype": "Scalable Vector Graphics file",
            "@type": "ALTIMG",
            "@size": "1389",
            "@ref": "si0078",
            "@mimetype": "image/svg+xml"
          },
          {
            "@category": "standard",
            "@_fa": "true",
            "$": "https://api.elsevier.com/content/object/eid/1-s2.0-S0926860X24002515-am.pdf?httpAccept=%2A%2F%2A",
            "@multimediatype": "Acrobat PDF file",
            "@type": "AAM-PDF",
            "@size": "1106272",
            "@ref": "am",
            "@mimetype": "application/pdf"
          }
        ]
      },
      "link": {
        "@rel": "abstract",
        "@href": "https://api.elsevier.com/content/abstract/scopus_id/85193615801"
      }
    }
  }
}