{
  "metadata": {
    "title": "The role of external acid sites of ZSM-5 in deactivation of hybrid CuZnAl/ZSM-5 catalyst for direct dimethyl ether synthesis from syngas",
    "authors": "; ; ",
    "journal": "Applied Catalysis A: General",
    "date": "2014-09-22",
    "doi": "10.1016/j.apcata.2014.08.030",
    "abstract": "",
    "uri": "https://api.elsevier.com/content/article/pii/S0926860X14005262",
    "pii": "S0926860X14005262"
  },
  "fulltext": {
    "full-text-retrieval-response": {
      "scopus-eid": "2-s2.0-84909606443",
      "originalText": "serial JL 271346 291210 291744 291809 31 Applied Catalysis A: General APPLIEDCATALYSISAGENERAL 2014-09-02 2014-09-02 2017-10-23T13:15:34 1-s2.0-S0926860X14005262 S0926-860X(14)00526-2 S0926860X14005262 10.1016/j.apcata.2014.08.030 S300 S300.2 FULL-TEXT 1-s2.0-S0926860X14X00177 2024-01-01T12:30:29.635264Z 0 0 20140922 2014 2014-09-02T08:36:55.35336Z absattachment articleinfo articletitlenorm authfirstinitialnorm authfirstsurnamenorm cid cids contenttype copyright crossmark dateloaded dateloadedtxt datesearch datesort dateupdated dco docsubtype doctype doi eid ewtransactionid hubeid indexeddate issn issnnorm itemstage itemtransactionid itemweight openaccess openarchive pg pgfirst pglast pii piinorm pubdatestart pubdatetxt pubyr sectiontitle sortorder srctitle srctitlenorm srctype ssids alllist content subj subheadings suppl tomb volfirst volissue volumelist webpdf webpdfpagecount yearnav figure table e-component body mmlmath acknowledge affil appendices articletitle auth authfirstini authfull authkeywords authlast grantsponsor highlightsabst primabst ref specialabst 0926-860X 0926860X true 486 486 C Volume 486 32 266 275 266 275 20140922 22 September 2014 2014-09-22 2014 Articles article fla Copyright © 2014 Elsevier B.V. All rights reserved. ROLEEXTERNALACIDSITESZSM5INDEACTIVATIONHYBRIDCUZNALZSM5CATALYSTFORDIRECTDIMETHYLETHERSYNTHESISSYNGAS ORDOMSKY V 1 Introduction 2 Experimental 2.1 Catalyst preparation 2.2 Characterization 2.3 Catalytic tests 3 Results and discussion 3.1 Zeolite characterization 3.2 Influence of Si/Al ratio and zeolite crystallite size on the catalytic performance of CZA-ZSM-5 catalysts 3.3 Influence of silylation of zeolite external surface on the catalyst structure and stability 3.3.1 Catalytic properties of catalysts with silylated zeolites 3.3.2 Physicochemical properties of catalysts before and after deactivation 4 Conclusion Acknowledgments Appendix A Supplementary data References CORMA 2007 2411 2502 A SEMELSBERGER 2006 497 511 T KAEDING 1980 155 164 W CAI 1995 29 38 G CLAUSEN 2011 5805 5814 L LI 1996 23 33 J TAN 2005 25 29 Y JUNG 2012 1 8 J YANG 2010 8129 8136 G NIE 2012 419 425 R CHEN 1999 193 199 H MAO 2005 140 149 D BAE 2009 426 435 J XU 1997 289 301 M TAKEGUCHI 2000 201 209 T GARCIATRENCO 2012 170 179 A ZHANG 2013 975 980 Q KANG 2008 2035 2039 S JIN 2007 2707 2713 D MAO 2008 945 949 D GE 1998 23 30 Q MORADI 2007 598 606 G NAIK 2008 9791 9794 S PINKAEW 2013 727 732 K YANG 2011 229 235 G ABUDAHRIEH 2012 201 211 J SIERRA 2011 167 173 I JUNG 2012 1 8 J GARCIATRENCO 2012 43 51 A GARCIATRENCO 2013 102 111 A LI 1997 411 417 J SIMONMASSERON 2007 75 82 A ZHENG 2002 9552 9558 S WEBER 2000 533 543 R HIDALGO 1984 362 369 C KIM 2004 37 41 J ROWNAGHI 2012 56 61 A WANG 2012 51 61 J MAO 2010 1134 1139 D GUISNET 1997 1661 1665 M FIERRO 2009 499 506 G SEHESTED 2003 417 426 J SADEQZADEH 2012 11955 11964 M BABER 2014 5336 5340 A SANCHEZESCRIBANO 2006 9214 9219 V BUSCA 2006 70 78 G BORDIGA 1992 179 185 S KITLA 2013 517 530 A MORTERRA 1998 111 128 G OLYMPIOU 2007 304 318 G ORDOMSKYX2014X266 ORDOMSKYX2014X266X275 ORDOMSKYX2014X266XV ORDOMSKYX2014X266X275XV item S0926-860X(14)00526-2 S0926860X14005262 1-s2.0-S0926860X14005262 10.1016/j.apcata.2014.08.030 271346 2024-01-01T12:30:29.635264Z 2014-09-22 1-s2.0-S0926860X14005262-main.pdf https://s3-eu-west-1.amazonaws.com/prod-ucs-content-store-eu-west/content/pii:S0926860X14005262/MAIN/application/pdf/e8522792ffdbebc53ed0672a7aed14ab/main.pdf https://s3.amazonaws.com/prod-ucs-content-store-us-east/content/pii:S0926860X14005262/MAIN/application/pdf/e8522792ffdbebc53ed0672a7aed14ab/main.pdf main.pdf pdf true 2519035 MAIN 10 1-s2.0-S0926860X14005262-main_1.png https://s3-eu-west-1.amazonaws.com/prod-ucs-content-store-eu-west/content/pii:S0926860X14005262/PREVIEW/image/png/0b04302b9955e730e71c20fd860a62e6/main_1.png https://s3.amazonaws.com/prod-ucs-content-store-us-east/content/pii:S0926860X14005262/PREVIEW/image/png/0b04302b9955e730e71c20fd860a62e6/main_1.png main_1.png png 55720 849 656 IMAGE-WEB-PDF 1 1-s2.0-S0926860X14005262-fx1.sml https://s3-eu-west-1.amazonaws.com/prod-ucs-content-store-eu-west/content/pii:S0926860X14005262/fx1/THUMBNAIL/image/gif/816b2fc7fb2087d9f3be60b1c009f0ac/fx1.sml https://s3.amazonaws.com/prod-ucs-content-store-us-east/content/pii:S0926860X14005262/fx1/THUMBNAIL/image/gif/816b2fc7fb2087d9f3be60b1c009f0ac/fx1.sml fx1 true fx1.sml sml 7267 82 219 IMAGE-THUMBNAIL 1-s2.0-S0926860X14005262-gr1.sml https://s3-eu-west-1.amazonaws.com/prod-ucs-content-store-eu-west/content/pii:S0926860X14005262/gr1/THUMBNAIL/image/gif/5e45df2b7a6dd7243c4a063ea2a8efe1/gr1.sml https://s3.amazonaws.com/prod-ucs-content-store-us-east/content/pii:S0926860X14005262/gr1/THUMBNAIL/image/gif/5e45df2b7a6dd7243c4a063ea2a8efe1/gr1.sml gr1 gr1.sml sml 14022 135 219 IMAGE-THUMBNAIL 1-s2.0-S0926860X14005262-gr10.sml https://s3-eu-west-1.amazonaws.com/prod-ucs-content-store-eu-west/content/pii:S0926860X14005262/gr10/THUMBNAIL/image/gif/a5253119e5e9729a3d334594662c5dda/gr10.sml https://s3.amazonaws.com/prod-ucs-content-store-us-east/content/pii:S0926860X14005262/gr10/THUMBNAIL/image/gif/a5253119e5e9729a3d334594662c5dda/gr10.sml gr10 gr10.sml sml 15973 164 160 IMAGE-THUMBNAIL 1-s2.0-S0926860X14005262-gr11.sml https://s3-eu-west-1.amazonaws.com/prod-ucs-content-store-eu-west/content/pii:S0926860X14005262/gr11/THUMBNAIL/image/gif/9bbf6dede2b315541a04a3f0fe154de6/gr11.sml https://s3.amazonaws.com/prod-ucs-content-store-us-east/content/pii:S0926860X14005262/gr11/THUMBNAIL/image/gif/9bbf6dede2b315541a04a3f0fe154de6/gr11.sml gr11 gr11.sml sml 15195 164 212 IMAGE-THUMBNAIL 1-s2.0-S0926860X14005262-gr2.sml https://s3-eu-west-1.amazonaws.com/prod-ucs-content-store-eu-west/content/pii:S0926860X14005262/gr2/THUMBNAIL/image/gif/0e1cc56cf897cd79fd57653392c8ed92/gr2.sml https://s3.amazonaws.com/prod-ucs-content-store-us-east/content/pii:S0926860X14005262/gr2/THUMBNAIL/image/gif/0e1cc56cf897cd79fd57653392c8ed92/gr2.sml gr2 gr2.sml sml 19259 157 219 IMAGE-THUMBNAIL 1-s2.0-S0926860X14005262-gr3.sml https://s3-eu-west-1.amazonaws.com/prod-ucs-content-store-eu-west/content/pii:S0926860X14005262/gr3/THUMBNAIL/image/gif/820c3d59d8834025d74daf8226df6454/gr3.sml https://s3.amazonaws.com/prod-ucs-content-store-us-east/content/pii:S0926860X14005262/gr3/THUMBNAIL/image/gif/820c3d59d8834025d74daf8226df6454/gr3.sml gr3 gr3.sml sml 20869 164 208 IMAGE-THUMBNAIL 1-s2.0-S0926860X14005262-gr4.sml https://s3-eu-west-1.amazonaws.com/prod-ucs-content-store-eu-west/content/pii:S0926860X14005262/gr4/THUMBNAIL/image/gif/535f67080a25872faabadb27d2bd19ed/gr4.sml https://s3.amazonaws.com/prod-ucs-content-store-us-east/content/pii:S0926860X14005262/gr4/THUMBNAIL/image/gif/535f67080a25872faabadb27d2bd19ed/gr4.sml gr4 gr4.sml sml 19657 164 208 IMAGE-THUMBNAIL 1-s2.0-S0926860X14005262-gr5.sml https://s3-eu-west-1.amazonaws.com/prod-ucs-content-store-eu-west/content/pii:S0926860X14005262/gr5/THUMBNAIL/image/gif/89b87489520b52e36be66068fa10a6db/gr5.sml https://s3.amazonaws.com/prod-ucs-content-store-us-east/content/pii:S0926860X14005262/gr5/THUMBNAIL/image/gif/89b87489520b52e36be66068fa10a6db/gr5.sml gr5 gr5.sml sml 23296 159 219 IMAGE-THUMBNAIL 1-s2.0-S0926860X14005262-gr6.sml https://s3-eu-west-1.amazonaws.com/prod-ucs-content-store-eu-west/content/pii:S0926860X14005262/gr6/THUMBNAIL/image/gif/7e22e7e0c3ad60b64922e661707cda3e/gr6.sml https://s3.amazonaws.com/prod-ucs-content-store-us-east/content/pii:S0926860X14005262/gr6/THUMBNAIL/image/gif/7e22e7e0c3ad60b64922e661707cda3e/gr6.sml gr6 gr6.sml sml 30328 148 219 IMAGE-THUMBNAIL 1-s2.0-S0926860X14005262-gr7.sml https://s3-eu-west-1.amazonaws.com/prod-ucs-content-store-eu-west/content/pii:S0926860X14005262/gr7/THUMBNAIL/image/gif/3484252c893f774a30989ca199417813/gr7.sml https://s3.amazonaws.com/prod-ucs-content-store-us-east/content/pii:S0926860X14005262/gr7/THUMBNAIL/image/gif/3484252c893f774a30989ca199417813/gr7.sml gr7 gr7.sml sml 13431 130 219 IMAGE-THUMBNAIL 1-s2.0-S0926860X14005262-gr8.sml https://s3-eu-west-1.amazonaws.com/prod-ucs-content-store-eu-west/content/pii:S0926860X14005262/gr8/THUMBNAIL/image/gif/a3e0a9502c00e564beb297d141665453/gr8.sml https://s3.amazonaws.com/prod-ucs-content-store-us-east/content/pii:S0926860X14005262/gr8/THUMBNAIL/image/gif/a3e0a9502c00e564beb297d141665453/gr8.sml gr8 gr8.sml sml 15558 151 219 IMAGE-THUMBNAIL 1-s2.0-S0926860X14005262-gr9.sml https://s3-eu-west-1.amazonaws.com/prod-ucs-content-store-eu-west/content/pii:S0926860X14005262/gr9/THUMBNAIL/image/gif/7a807c638732d2e32d70852f908f83c2/gr9.sml https://s3.amazonaws.com/prod-ucs-content-store-us-east/content/pii:S0926860X14005262/gr9/THUMBNAIL/image/gif/7a807c638732d2e32d70852f908f83c2/gr9.sml gr9 gr9.sml sml 5075 163 102 IMAGE-THUMBNAIL 1-s2.0-S0926860X14005262-gr9.gif https://s3-eu-west-1.amazonaws.com/prod-ucs-content-store-eu-west/content/pii:S0926860X14005262/gr9/DOWNSAMPLED/image/gif/524575640dff3b001ab122708929418d/gr9.gif https://s3.amazonaws.com/prod-ucs-content-store-us-east/content/pii:S0926860X14005262/gr9/DOWNSAMPLED/image/gif/524575640dff3b001ab122708929418d/gr9.gif gr9 gr9.gif gif 18272 481 301 IMAGE-DOWNSAMPLED 1-s2.0-S0926860X14005262-fx1.jpg https://s3-eu-west-1.amazonaws.com/prod-ucs-content-store-eu-west/content/pii:S0926860X14005262/fx1/DOWNSAMPLED/image/jpeg/7e7fcfbed9ce0424f3497d767e6bf1a2/fx1.jpg https://s3.amazonaws.com/prod-ucs-content-store-us-east/content/pii:S0926860X14005262/fx1/DOWNSAMPLED/image/jpeg/7e7fcfbed9ce0424f3497d767e6bf1a2/fx1.jpg fx1 true fx1.jpg jpg 32674 187 500 IMAGE-DOWNSAMPLED 1-s2.0-S0926860X14005262-gr1.jpg https://s3-eu-west-1.amazonaws.com/prod-ucs-content-store-eu-west/content/pii:S0926860X14005262/gr1/DOWNSAMPLED/image/jpeg/b15467763f85e7a5fd2676111711cf73/gr1.jpg https://s3.amazonaws.com/prod-ucs-content-store-us-east/content/pii:S0926860X14005262/gr1/DOWNSAMPLED/image/jpeg/b15467763f85e7a5fd2676111711cf73/gr1.jpg gr1 gr1.jpg jpg 43931 243 393 IMAGE-DOWNSAMPLED 1-s2.0-S0926860X14005262-gr10.jpg https://s3-eu-west-1.amazonaws.com/prod-ucs-content-store-eu-west/content/pii:S0926860X14005262/gr10/DOWNSAMPLED/image/jpeg/6dae7dd96824425f001694a662091aa3/gr10.jpg https://s3.amazonaws.com/prod-ucs-content-store-us-east/content/pii:S0926860X14005262/gr10/DOWNSAMPLED/image/jpeg/6dae7dd96824425f001694a662091aa3/gr10.jpg gr10 gr10.jpg jpg 54453 347 339 IMAGE-DOWNSAMPLED 1-s2.0-S0926860X14005262-gr11.jpg https://s3-eu-west-1.amazonaws.com/prod-ucs-content-store-eu-west/content/pii:S0926860X14005262/gr11/DOWNSAMPLED/image/jpeg/8ed0d8b20e243544cc6caf0ec0d62986/gr11.jpg https://s3.amazonaws.com/prod-ucs-content-store-us-east/content/pii:S0926860X14005262/gr11/DOWNSAMPLED/image/jpeg/8ed0d8b20e243544cc6caf0ec0d62986/gr11.jpg gr11 gr11.jpg jpg 45210 291 376 IMAGE-DOWNSAMPLED 1-s2.0-S0926860X14005262-gr2.jpg https://s3-eu-west-1.amazonaws.com/prod-ucs-content-store-eu-west/content/pii:S0926860X14005262/gr2/DOWNSAMPLED/image/jpeg/34a32f08b08b7d3732712ca65ebc8bc2/gr2.jpg https://s3.amazonaws.com/prod-ucs-content-store-us-east/content/pii:S0926860X14005262/gr2/DOWNSAMPLED/image/jpeg/34a32f08b08b7d3732712ca65ebc8bc2/gr2.jpg gr2 gr2.jpg jpg 56505 281 393 IMAGE-DOWNSAMPLED 1-s2.0-S0926860X14005262-gr3.jpg https://s3-eu-west-1.amazonaws.com/prod-ucs-content-store-eu-west/content/pii:S0926860X14005262/gr3/DOWNSAMPLED/image/jpeg/c856103eb8d4a50ee3258e81a3ac33af/gr3.jpg https://s3.amazonaws.com/prod-ucs-content-store-us-east/content/pii:S0926860X14005262/gr3/DOWNSAMPLED/image/jpeg/c856103eb8d4a50ee3258e81a3ac33af/gr3.jpg gr3 gr3.jpg jpg 83075 452 574 IMAGE-DOWNSAMPLED 1-s2.0-S0926860X14005262-gr4.jpg https://s3-eu-west-1.amazonaws.com/prod-ucs-content-store-eu-west/content/pii:S0926860X14005262/gr4/DOWNSAMPLED/image/jpeg/6c1eeed3642dde24e6055aed18db6a46/gr4.jpg https://s3.amazonaws.com/prod-ucs-content-store-us-east/content/pii:S0926860X14005262/gr4/DOWNSAMPLED/image/jpeg/6c1eeed3642dde24e6055aed18db6a46/gr4.jpg gr4 gr4.jpg jpg 55952 268 339 IMAGE-DOWNSAMPLED 1-s2.0-S0926860X14005262-gr5.jpg https://s3-eu-west-1.amazonaws.com/prod-ucs-content-store-eu-west/content/pii:S0926860X14005262/gr5/DOWNSAMPLED/image/jpeg/f178d15796e055d8a0ff9e8ba4891609/gr5.jpg https://s3.amazonaws.com/prod-ucs-content-store-us-east/content/pii:S0926860X14005262/gr5/DOWNSAMPLED/image/jpeg/f178d15796e055d8a0ff9e8ba4891609/gr5.jpg gr5 gr5.jpg jpg 104231 493 678 IMAGE-DOWNSAMPLED 1-s2.0-S0926860X14005262-gr6.jpg https://s3-eu-west-1.amazonaws.com/prod-ucs-content-store-eu-west/content/pii:S0926860X14005262/gr6/DOWNSAMPLED/image/jpeg/c70d6a4310ef32d8dcbf6a8492fd66b1/gr6.jpg https://s3.amazonaws.com/prod-ucs-content-store-us-east/content/pii:S0926860X14005262/gr6/DOWNSAMPLED/image/jpeg/c70d6a4310ef32d8dcbf6a8492fd66b1/gr6.jpg gr6 gr6.jpg jpg 100947 457 678 IMAGE-DOWNSAMPLED 1-s2.0-S0926860X14005262-gr7.jpg https://s3-eu-west-1.amazonaws.com/prod-ucs-content-store-eu-west/content/pii:S0926860X14005262/gr7/DOWNSAMPLED/image/jpeg/ae8d4f4a9cf146dd2d1252ccb63fde68/gr7.jpg https://s3.amazonaws.com/prod-ucs-content-store-us-east/content/pii:S0926860X14005262/gr7/DOWNSAMPLED/image/jpeg/ae8d4f4a9cf146dd2d1252ccb63fde68/gr7.jpg gr7 gr7.jpg jpg 48112 313 527 IMAGE-DOWNSAMPLED 1-s2.0-S0926860X14005262-gr8.jpg https://s3-eu-west-1.amazonaws.com/prod-ucs-content-store-eu-west/content/pii:S0926860X14005262/gr8/DOWNSAMPLED/image/jpeg/f001b67d5f5b80fc428a72b6d7853fff/gr8.jpg https://s3.amazonaws.com/prod-ucs-content-store-us-east/content/pii:S0926860X14005262/gr8/DOWNSAMPLED/image/jpeg/f001b67d5f5b80fc428a72b6d7853fff/gr8.jpg gr8 gr8.jpg jpg 46314 260 376 IMAGE-DOWNSAMPLED 1-s2.0-S0926860X14005262-gr9_lrg.gif https://s3-eu-west-1.amazonaws.com/prod-ucs-content-store-eu-west/content/pii:S0926860X14005262/gr9/HIGHRES/image/gif/1850e79d5f0edc9b0ba4633b7925e1d8/gr9_lrg.gif https://s3.amazonaws.com/prod-ucs-content-store-us-east/content/pii:S0926860X14005262/gr9/HIGHRES/image/gif/1850e79d5f0edc9b0ba4633b7925e1d8/gr9_lrg.gif gr9 gr9_lrg.gif gif 100912 4258 2667 IMAGE-HIGH-RES 1-s2.0-S0926860X14005262-fx1_lrg.jpg https://s3-eu-west-1.amazonaws.com/prod-ucs-content-store-eu-west/content/pii:S0926860X14005262/fx1/HIGHRES/image/jpeg/d2ea9e4535f3b9df2998f742a6471e91/fx1_lrg.jpg https://s3.amazonaws.com/prod-ucs-content-store-us-east/content/pii:S0926860X14005262/fx1/HIGHRES/image/jpeg/d2ea9e4535f3b9df2998f742a6471e91/fx1_lrg.jpg fx1 true fx1_lrg.jpg jpg 197963 829 2213 IMAGE-HIGH-RES 1-s2.0-S0926860X14005262-gr1_lrg.jpg https://s3-eu-west-1.amazonaws.com/prod-ucs-content-store-eu-west/content/pii:S0926860X14005262/gr1/HIGHRES/image/jpeg/2f6b27d9ef31b5bc493191687e22781c/gr1_lrg.jpg https://s3.amazonaws.com/prod-ucs-content-store-us-east/content/pii:S0926860X14005262/gr1/HIGHRES/image/jpeg/2f6b27d9ef31b5bc493191687e22781c/gr1_lrg.jpg gr1 gr1_lrg.jpg jpg 245830 1076 1742 IMAGE-HIGH-RES 1-s2.0-S0926860X14005262-gr10_lrg.jpg https://s3-eu-west-1.amazonaws.com/prod-ucs-content-store-eu-west/content/pii:S0926860X14005262/gr10/HIGHRES/image/jpeg/a7be90fba1807d4032f57123d5b02621/gr10_lrg.jpg https://s3.amazonaws.com/prod-ucs-content-store-us-east/content/pii:S0926860X14005262/gr10/HIGHRES/image/jpeg/a7be90fba1807d4032f57123d5b02621/gr10_lrg.jpg gr10 gr10_lrg.jpg jpg 251716 1536 1500 IMAGE-HIGH-RES 1-s2.0-S0926860X14005262-gr11_lrg.jpg https://s3-eu-west-1.amazonaws.com/prod-ucs-content-store-eu-west/content/pii:S0926860X14005262/gr11/HIGHRES/image/jpeg/e6df5f041e0918954195d4e5b1a0235f/gr11_lrg.jpg https://s3.amazonaws.com/prod-ucs-content-store-us-east/content/pii:S0926860X14005262/gr11/HIGHRES/image/jpeg/e6df5f041e0918954195d4e5b1a0235f/gr11_lrg.jpg gr11 gr11_lrg.jpg jpg 218957 1291 1667 IMAGE-HIGH-RES 1-s2.0-S0926860X14005262-gr2_lrg.jpg https://s3-eu-west-1.amazonaws.com/prod-ucs-content-store-eu-west/content/pii:S0926860X14005262/gr2/HIGHRES/image/jpeg/b9fb915592591dcfb91f0d36ba2a05bb/gr2_lrg.jpg https://s3.amazonaws.com/prod-ucs-content-store-us-east/content/pii:S0926860X14005262/gr2/HIGHRES/image/jpeg/b9fb915592591dcfb91f0d36ba2a05bb/gr2_lrg.jpg gr2 gr2_lrg.jpg jpg 278343 1247 1742 IMAGE-HIGH-RES 1-s2.0-S0926860X14005262-gr3_lrg.jpg https://s3-eu-west-1.amazonaws.com/prod-ucs-content-store-eu-west/content/pii:S0926860X14005262/gr3/HIGHRES/image/jpeg/7656afefa425e23b2f484a0c3271cf43/gr3_lrg.jpg https://s3.amazonaws.com/prod-ucs-content-store-us-east/content/pii:S0926860X14005262/gr3/HIGHRES/image/jpeg/7656afefa425e23b2f484a0c3271cf43/gr3_lrg.jpg gr3 gr3_lrg.jpg jpg 417474 2002 2544 IMAGE-HIGH-RES 1-s2.0-S0926860X14005262-gr4_lrg.jpg https://s3-eu-west-1.amazonaws.com/prod-ucs-content-store-eu-west/content/pii:S0926860X14005262/gr4/HIGHRES/image/jpeg/d2be818fd89bc719861e81951cabb8cc/gr4_lrg.jpg https://s3.amazonaws.com/prod-ucs-content-store-us-east/content/pii:S0926860X14005262/gr4/HIGHRES/image/jpeg/d2be818fd89bc719861e81951cabb8cc/gr4_lrg.jpg gr4 gr4_lrg.jpg jpg 288095 1184 1500 IMAGE-HIGH-RES 1-s2.0-S0926860X14005262-gr5_lrg.jpg https://s3-eu-west-1.amazonaws.com/prod-ucs-content-store-eu-west/content/pii:S0926860X14005262/gr5/HIGHRES/image/jpeg/5a1802a59ee1eaaf76bf2b4f2d218528/gr5_lrg.jpg https://s3.amazonaws.com/prod-ucs-content-store-us-east/content/pii:S0926860X14005262/gr5/HIGHRES/image/jpeg/5a1802a59ee1eaaf76bf2b4f2d218528/gr5_lrg.jpg gr5 gr5_lrg.jpg jpg 841830 2180 3000 IMAGE-HIGH-RES 1-s2.0-S0926860X14005262-gr6_lrg.jpg https://s3-eu-west-1.amazonaws.com/prod-ucs-content-store-eu-west/content/pii:S0926860X14005262/gr6/HIGHRES/image/jpeg/468bd6ac8c3f764985ade436f1fbf64d/gr6_lrg.jpg https://s3.amazonaws.com/prod-ucs-content-store-us-east/content/pii:S0926860X14005262/gr6/HIGHRES/image/jpeg/468bd6ac8c3f764985ade436f1fbf64d/gr6_lrg.jpg gr6 gr6_lrg.jpg jpg 434351 1213 1800 IMAGE-HIGH-RES 1-s2.0-S0926860X14005262-gr7_lrg.jpg https://s3-eu-west-1.amazonaws.com/prod-ucs-content-store-eu-west/content/pii:S0926860X14005262/gr7/HIGHRES/image/jpeg/7f4aeca13ef413ee3826cbc17d7bb845/gr7_lrg.jpg https://s3.amazonaws.com/prod-ucs-content-store-us-east/content/pii:S0926860X14005262/gr7/HIGHRES/image/jpeg/7f4aeca13ef413ee3826cbc17d7bb845/gr7_lrg.jpg gr7 gr7_lrg.jpg jpg 238257 1386 2333 IMAGE-HIGH-RES 1-s2.0-S0926860X14005262-gr8_lrg.jpg https://s3-eu-west-1.amazonaws.com/prod-ucs-content-store-eu-west/content/pii:S0926860X14005262/gr8/HIGHRES/image/jpeg/37e7eb2411bcc2a6167b3999041de931/gr8_lrg.jpg https://s3.amazonaws.com/prod-ucs-content-store-us-east/content/pii:S0926860X14005262/gr8/HIGHRES/image/jpeg/37e7eb2411bcc2a6167b3999041de931/gr8_lrg.jpg gr8 gr8_lrg.jpg jpg 196889 1151 1667 IMAGE-HIGH-RES 1-s2.0-S0926860X14005262-mmc1.docx https://s3-eu-west-1.amazonaws.com/prod-ucs-content-store-eu-west/content/pii:S0926860X14005262/mmc1/MAIN/application/vnd.openxmlformats-officedocument.wordprocessingml.document/7c6a26153a8816789e427056934553a8/mmc1.docx https://s3.amazonaws.com/prod-ucs-content-store-us-east/content/pii:S0926860X14005262/mmc1/MAIN/application/vnd.openxmlformats-officedocument.wordprocessingml.document/7c6a26153a8816789e427056934553a8/mmc1.docx mmc1 mmc1.docx docx 1188520 APPLICATION 1-s2.0-S0926860X14005262-si1.gif https://s3-eu-west-1.amazonaws.com/prod-ucs-content-store-eu-west/content/pii:S0926860X14005262/STRIPIN/image/gif/e53fa084b06fc9ebaed36c0226b82ceb/si1.gif https://s3.amazonaws.com/prod-ucs-content-store-us-east/content/pii:S0926860X14005262/STRIPIN/image/gif/e53fa084b06fc9ebaed36c0226b82ceb/si1.gif si1 si1.gif gif 605 21 128 ALTIMG 1-s2.0-S0926860X14005262-si5.gif https://s3-eu-west-1.amazonaws.com/prod-ucs-content-store-eu-west/content/pii:S0926860X14005262/STRIPIN/image/gif/017c04926af8c8fb61facf83551ce4e3/si5.gif https://s3.amazonaws.com/prod-ucs-content-store-us-east/content/pii:S0926860X14005262/STRIPIN/image/gif/017c04926af8c8fb61facf83551ce4e3/si5.gif si5 si5.gif gif 589 22 125 ALTIMG APCATA 14967 S0926-860X(14)00526-2 10.1016/j.apcata.2014.08.030 Elsevier B.V. Fig. 1 CO conversion in time during DME synthesis over hybrid catalysts. CZA-zeolite with zeolites before (ZSM-5-I(13), ZSM-5-I(25), ZSM-5-II(45)) and after silylation (SiO2/ZSM-5-I(13), SiO2/ZSM-5-I(45)) (T =260°C, 3600 c m gas 3 / g cat − 1 h − 1 , H2/CO=2, 20bar). Fig. 2 Selectivity to main products during DME synthesis over CZA hybrid catalyst with ZSM-5-I(25) (TOS 5h) and with ZSM-5-I(13) before and after silylation (TOS: 5, 50 and 100h) (T =260°C, 3600 c m gas 3 / g cat − 1 h − 1 , H2/CO=2, 20bar). Fig. 3 Selectivity to main products during DME synthesis over CZA hybrid catalyst with ZSM-5-II(45) before and after silylation (TOS: 5, 50 and 100h) (T =260°C, 3600 c m gas 3 / g cat − 1 h − 1 , H2/CO=2, 20bar). Fig. 4 IR spectra of Py adsorption over the CZA-ZSM-5-I(13) hybrid non silylated catalyst before (a) and after the reaction (b) and over silylated catalyst before (a) and after the reaction (b). The catalysts were (re)-reduced prior to Py adsorption. Fig. 5 TEM micrographs and corresponding EDX spectra of a representative region within the CZA-ZSM-5-I(13) catalyst before (a) and after reaction (b). The encircled areas represent a ZSM-5 Si-rich region (blue and green) and Co and Zn-rich area (red) as identified by the EDX analysis. (For interpretation of the references to color in this figure legend, the reader is referred to the web version of this article.) Fig. 6 STEM-HAADF micrographs of the CZA-ZSM-5-I(13) hybrid catalysts before the reaction (a), after the reaction (b) and CZA-SiO2/ZSM-5-I(13) after the reaction (c). The rectangular areas mark the metal-rich regions, whereas the red arrows point to metallic atomic clusters and/or nanoparticles. (For interpretation of the references to color in this figure legend, the reader is referred to the web version of this article.) Fig. 7 Schematic presentation of copper migration leading simultaneously to ion exchange with hydroxyl groups of the ZSM-5 zeolite and copper sintering. Fig. 8 CO conversion in time during DME synthesis (T =260°C, 3600 c m gas 3 / g cat − 1 h − 1 , H2/CO=2, 20bar) over hybrid catalysts CZA-ZSM-5-I(13) before and after addition of 0.2cm3/h of H2O during 24h in hydrogen flow (T =260°C, 1200 c m H 2 3 / g cat − 1 h − 1 , 20bar). Fig. 9 FTIR spectra of CZA-ZSM-5-I(13) hybrid catalyst after adsorption of CO at low temperature (−173°C) at gradually increasing pressures. The catalyst was reduced prior to CO adsorption. Fig. 10 IR bands resulting from CO adsorption at −173°C on the CZA catalyst, CZA-ZSM-5-I(13) hybrid catalyst before (a) and after the reaction (b) and on the CZA-SiO2/ZSM-5-I(13) hybrid catalyst before (a) and after the reaction (b). The catalysts were reduced prior to CO adsorption. Fig. 11 TPO of the CZA-ZSM-5-I(13), CZA-ZSM-5-II(45) and CZA-SiO2/ZSM-5-I(13) hybrid catalysts after the reaction with detection of CO2. Table 1 Zeolite characterization. Catalyst Crystallite size Si/Al ratio Al content (mmol/g) S (m2/g) V mic (cm3/g) V tot(<350nm) (cm3/g) TPD (NH3) (μmol/g) ZSM-5-I(13) 5–7μm 13 1.28 432 0.17 0.23 993 SiO2/ZSM-5-I(13) – 14 1.18 350 0.14 0.22 931 ZSM-5-I(25) 5–7μm 25 0.66 – – – – ZSM-5-II(45) 40–100nm 45 0.37 383 0.16 0.63 360 SiO2/ZSM-5-II(45) – 48 0.34 354 0.15 0.56 303 The role of external acid sites of ZSM-5 in deactivation of hybrid CuZnAl/ZSM-5 catalyst for direct dimethyl ether synthesis from syngas V.V. Ordomsky a ⁎ M. Cai a V. Sushkevich b S. Moldovan c O. Ersen c C. Lancelot a V. Valtchev d A.Y. Khodakov a ⁎⁎ a Unité de catalyse et de chimie du solide (UMR 8181 CNRS), Université Lille 1-ENSCL-EC Lille, Bat. C3, Cité Scientiﬁque, 59655 Villeneuve d’Ascq, France Unité de catalyse et de chimie du solide (UMR 8181 CNRS), Université Lille 1-ENSCL-EC Lille, Bat. C3, Cité Scientiﬁque Villeneuve d’Ascq 59655 France b Department of Chemistry, Lomonosov Moscow State University, Leninskye Gory 1/3, 119991 Moscow, Russia Department of Chemistry, Lomonosov Moscow State University Leninskye Gory 1/3 Moscow 119991 Russia c Department of Surfaces and Interfaces (DSI), 23, rue du Loess BP 43, F-67034 Strasbourg, France Department of Surfaces and Interfaces (DSI) 23, rue du Loess BP 43 Strasbourg F-67034 France d Laboratoire Catalyse & Spectrochimie, ENSICAEN, 6 Boulevard Maréchal Juin, 14000 Caen, France Laboratoire Catalyse & Spectrochimie, ENSICAEN 6 Boulevard Maréchal Juin Caen 14000 France ⁎ Corresponding author. Tel.: +33 320436953 ⁎⁎ Corresponding author. Graphical abstract Direct synthesis of dimethyl ether (DME) from syngas was investigated on a series of hybrid Cu–ZnO–Al2O3/ZSM-5 catalysts prepared by kneading. It was found that the initial performance of the catalysts was a function of both zeolite crystallite sizes and Si/Al ratio. The activity of the hybrid catalysts gradually decreased with time on stream because of simultaneous copper sintering, copper oxidation and ion exchange with zeolite hydroxyl groups. Copper sintering led to the decrease in the number of metal active sites, while ion exchange of Cu2+ ions with the hydroxyl groups of the zeolite resulted in lower concentration of acid sites for methanol dehydration. Copper sintering and ion exchange could be slowed down by selective neutralization of the acid sites on the zeolite outer surface by silylation. Both catalyst stability and dimethyl ether productivity were significantly improved. Keywords DME synthesis Syngas Deactivation Cu–ZnO–Al2O3 Silylation ZSM-5 1 Introduction Alternative energy sources have recently attracted increasing attention with the raise of environmental concerns and higher crude oil price, which is a consequence of larger worldwide consumption and limited fossil resources [1]. Dimethyl ether (DME) has been considered as a clean alternative diesel fuel because of high cetane number, low auto-ignition temperature and reduced emission of contaminants [2]. Moreover, DME is also an important chemical intermediate for the production of many useful chemicals, such as methyl sulfate, methyl acetate (a precursor to acetic acid), light olefins and BTX aromatics [3,4]. DME can be manufactured from syngas using either two-steps or direct single-step processes. The traditional technology involves two-steps synthesis: the first step is methanol synthesis from syngas on Cu-ZnO-based catalysts (CO+2H2 =CH3OH) and the second step is methanol dehydration over acid catalyst such as zeolites and alumina to produce DME (2CH3OH=CH3-O-CH3 +H2O). In direct DME synthesis (also named Syngas-to-DME (STD)), carbon monoxide conversion occurs over a bifunctional catalyst in a single reactor. The bifunctional catalyst for direct DME synthesis should combine a methanol synthesis catalyst and a methanol dehydration catalyst. In the two-step DME synthesis, the maximum syngas conversion to methanol is limited by thermodynamics [5], especially at high temperatures. Direct DME synthesis overcomes these thermodynamic constraints. Consequently, a much higher per-pass CO conversion and higher DME productivity could be obtained [6]. Catalyst development for STD reaction has been a subject of a number of publications [7–10]. Copper metal nanoparticles associated with a promoter, i.e. Zn, are usually considered as active phase for methanol synthesis [11]. The advantages of the Cu/Zn system include low cost and high selectivity to methanol. Since methanol synthesis over the Cu–ZnO–Al2O3 catalyst is a well-established and optimized technology [12,13], most of the researchers use this catalyst prepared by co-precipitation as one of the components of bifunctional DME synthesis catalyst. Methanol dehydration to DME requires an acid catalyst [14]. It appears that the acid properties of the dehydration component could play a major role and often affect the overall reaction rate, DME selectivity and catalyst stability. Zeolite based catalysts have several advantages for methanol dehydration to DME relative to more conventional alumina catalysts. The alumina-based catalysts, either pure or doped, are relatively sensitive to steam especially at higher temperatures. A solid acid zeolite-type catalyst, such as HZSM-5 with controlled acidic character exhibits a much higher resistance to steam than alumina [15]. However, the slow diffusion of DME through the zeolite crystals could lead to secondary reactions and formation of undesirable by-products and carbonaceous residues. The latter induces plugging of the catalyst's pores, progressive deactivation and thus demands more frequent catalyst regeneration. Zeolites like ZSM-5 [16,14,17], FER [18], Y [19], MCM-22 [20] are currently the preferred acidic catalysts for the preparation of hybrid catalyst for DME synthesis due to their high acidity and thermal stability. In order to obtain a good synergy between CO hydrogenation and dehydration of methanol, methanol synthesis and methanol dehydration active phases should be in the close proximity to each other. However, conventional methods which provide the highest degree of mixing between active sites in the composites like impregnation and co-precipitation could be not very efficient in this case. This drawback is a consequence of the interaction of metallic copper with acid sites previously observed in CuO-ZnO/γ-Al2O3 [21,6,22] and CuZnAl/SiO2-Al2O3 [23] composites. That was the reason why the most efficient catalysts for DME synthesis reported so far, were prepared using physical mixing of the individual compounds. Recently Tsubaki et al. [24,25] has developed an original technique which can weaken the interaction between methanol synthesis catalyst and zeolite and thus, improve the reaction selectivity to DME. It has been shown [24,25] that core–shell catalyst with Cr/ZnO core and zeolite shell improves DME selectivity by suppressing side reaction such as undesirable hydrocarbon synthesis; C2–C4 alkanes are mostly produced. However, even in the case of the physical mixing or encapsulation method, the interactions of the metals with acid sites could lead to partial deactivation. Several possible reasons of the DME synthesis catalyst deactivation have been reported in the literature: coke deposition [26,27], Cu sintering [28] or copper and zinc ion exchange with protons of zeolite [15,29]. García-Trenco et al. [29] showed the presence of isolated Cu2+ cations occupying exchange positions in the HZSM-5 zeolite by EPR spectroscopy. The decrease in Brönsted acidity resulted in suppression of the catalyst activity due to the reduced zeolite activity in methanol dehydration. The same authors studied the influence of zeolite morphology in hybrid CuZnAl/zeolite catalysts in DME synthesis [30]. It was found that the deactivation increased with increasing the external surface area and surface Al concentration of the zeolite co-catalyst. These results confirm that the interactions between metals and acid sites are detrimental for the process since they cause the deactivation of the catalyst during DME synthesis. They also indicate important role of zeolite outer surface area in the deactivation of DME synthesis catalysts. Despite noticeable deactivation of composite CuZnAl/ZSM-5 catalysts in DME synthesis, very few works have addressed so far possible strategies to enhance the catalyst stability. A stable catalyst is indispensable however for the design of efficient processes for direct DME synthesis. In this work, we have investigated influence of Si/Al ratio, zeolite crystallite size and acid sites on the zeolite outer surface on the structure, catalytic performance and stability of composite Cu–ZnO–Al2O3/ZSM-5 catalysts for DME synthesis. A new method is proposed to improve the stability of DME synthesis catalysts. 2 Experimental 2.1 Catalyst preparation The chemicals used for the catalyst preparation are Cu(NO3)2·3H2O (98%, Sigma–Aldrich), Zn(NO3)2·6H2O (98%, Sigma–Aldrich), Al(NO3)3·9H2O (98.5%, Sigma–Aldrich), Na2CO3 (99%, Janssen Chimica), TEOS (98%, Sigma–Aldrich) and hexane (99%, SDS). The CuO–ZnO–Al2O3 catalyst precursor (Cu:Zn:Al=60:30:10 atomic ratio with the ratio Cu/Zn=2 and Zn/Al=3) was prepared by co-precipitation at constant pH (ca. 7) and constant temperature (70°C). A solution containing metal nitrates ([Cu2+]+[Zn2+]+[Al3+]=1.0M) and a sodium carbonate solution (1.0M) were simultaneously added to the reaction vessel containing 10cm3 of deionized water. The suspension was continuously stirred and kept at the desired pH by adjustment of the relative flow rates of the two solutions. The final suspension was aged under stirring at 70°C for 1h. The precipitate was filtered off, repeatedly washed with sufficient amounts of deionized water to remove residual sodium ions, dried at 110°C overnight and then finally calcined at 350°C in flowing air for 6h yielding the CuO–ZnO–Al2O3 catalyst (abbreviated as CZA). The catalytic performance of CZA catalyst in methanol synthesis was found in agreement with previous reports [31]. Three parent ZSM-5 zeolites with different crystallite sizes and Si/Al ratios were used in this work. ZSM-5-I(13) and ZSM-5-I(25) zeolites with Si/Al ratio 13 and 25, respectively, were purchased from Zeolyst. The ZSM-5-II(45) sample with Si/Al ratio of 45 was kindly offered by Süd-Chemie. The aluminum content in the zeolites was determined by ICP analysis. The samples were converted from NH4 into H-form by calcination in air at 550°C for 6h. The surface modified, silylated samples were prepared by the chemical liquid deposition using TEOS as a silica source. 5g of dried zeolite in H-form was added to the solution of 1g of TEOS in 50cm3 of n-hexane and refluxed for 24h at 50°C. The modified sample was dried at 100°C for 12h and calcined at 550°C (heating rate: 2°C/min) for 5h in air. The calcined silylated zeolites are denoted as SiO2/ZSM-5-I(13) and SiO2/ZSM-5-II(45). The hybrid catalysts were prepared according to the following procedure. The mixed CZA catalyst with ZSM-5 zeolite was prepared by kneading of the mixture of powders in an agate mortar at a mass ratio of 5:3 (w/w) to form homogeneous hybrid catalyst, followed by pressuring the mixture into tablets and crushing them to 90–150 mesh size particles before the reaction. 2.2 Characterization The BET surface area, pore volume and average pore diameter were determined by N2 physisorption using a Micromeritics ASAP 2000 automated system. Each sample was degassed under vacuum at <10μmHg in the Micromeritics ASAP 2000 at 300°C for 4h prior to N2 physisorption. NH3-TPD profiles were obtained in an Autochem 2910 equipment (Micromeritics) coupled with a quadrupole mass spectrometer (OmniStar from Balzers Instruments). Prior to ammonia adsorption, ca. 100mg of sample was pretreated at 500°C for 60min in He. Subsequently, calibrated pulses of NH3 were introduced at 50°C until saturation of the sample. The chemisorbed ammonia was then desorbed by heating from 50 to 1000°C at a heating rate of 10°C/min. The m/z =16 signal in the coupled mass spectrometer was used to obtain the corresponding NH3 desorption profiles. IR spectra were recorded with a Nicolet Protégé 460 FT-IR spectrometer at 4cm−1 optical resolution. Prior to the measurements, the catalysts were pressed in self-supporting discs and activated in the IR cell attached to a vacuum line at 300°C for 4h. After activation the samples were reduced in situ with pure hydrogen at 300°C with subsequent evacuation of the formed water at the same temperature. Adsorption of CO was carried out in the low-temperature cell at −173°C. Adsorption of pyridine (Py) was performed at 150°C for 30min. The excess of Py was further evacuated at 150°C for 1h. All spectra were normalized by the weight of the pellet. Scanning electron microscopy (SEM, Philips XL 30 ESEM-FEG) was used to explore the morphology and size of zeolite crystals. The TEM analyses were carried out on a Jeol 2100F (field emission gun) microscope operating at 200kV equipped with a probe corrector for the spherical aberrations. The point-to-point resolution reached was on the order of 2Å under the parallel TEM mode and 1Å under the STEM mode. For a better chemical resolution, the micrographs were also acquired in the HAADF mode by using a spot size of 1.1Å with a current density of 0.5pAÅ−1. The energy X-ray dispersive spectroscopic analyses have been performed by using a Li-Si EDS detector with an energy resolution of 0.03eV. Prior to the analysis, the sample was dispersed by ultrasound in ethanol solution for 5min, and a drop of solution was deposited onto a carbon membrane onto a 300 mesh-copper grid. Temperature programmed oxidation (TPO) was used to characterize and quantify the deposited coke on spent catalysts. TPO were performed as follows. 50mg of catalyst were placed in a plug flow reactor. The catalyst was first pretreated in He at 150°C for 120min with subsequent temperature increase to 800°C with the ramp of 10°C/min in a He/O2 (10% O2) flow of 50cm3/min. CO2 (m/e =44) profiles were recorded using a Varian Saturn III mass spectrometer. 2.3 Catalytic tests The DME synthesis reaction was carried out in a fixed-bed stainless-steel tubular reactor (d int =8mm) operating at 20bar. The catalyst loading was typically 0.5g. Before reaction, the samples were reduced in hydrogen flow with the flow rate of 30cm3/min. During the reduction, the temperature was increased to 290°C with a ramping rate of 2°C/min and then kept at this temperature for 7h. After reduction, the hydrogen flow was switched to a syngas mixture with H2/CO molar ratio of 2. The reaction was carried out at 260°C under a pressure of 20bar maintained using a back pressure regulator, and the space velocity of 3600 c m gas 3 / g cat − 1 h − 1 (WHSV=1.7h−1). Carbon monoxide contained 5% nitrogen, which was used as an internal standard for conversion and selectivity calculations. The products were sampled from the high pressure side and analyzed using an online gas chromatograph with a TCD (N2, CO, CO2 and CH4) and a FID (MeOH, DME and hydrocarbons) detectors. The CO conversion (X) was calculated based on the molar flow rate of CO in the feed (F CO,in) and in the outlet streams (F CO,out): X CO (%)=(1−(F CO,out/F CO,in))×100. The product selectivity was determined on carbon basis and expressed in mol% of carbon converted to a specific reaction product. 3 Results and discussion 3.1 Zeolite characterization The parent zeolite samples had different chemical compositions and also different size and morphology of zeolite crystallites. ZSM-5-I(13) and ZSM-5-I(25) zeolites have uniform particle size distribution in the range 5–7μm (Figure S1). The zeolite particles consisted of agglomerates of intergrown zeolite crystallites. Again the zeolite crystallites built the agglomerates of sample ZSM-5-II(45), however in this case the individual crystallites with the size ranging between 40 and 100nm were clearly observed (Figure S1). Different crystallite sizes of ZSM-5-I(13) and ZSM-5-II(45) result in different low temperature nitrogen adsorption data (Figure S2). The adsorption equilibrium isotherm for ZSM-5-I(13) is of type I in the Brunauer classification and characteristic of microporous solids. The isotherm of ZSM-5-II(45) exhibits an additional step at p/p 0 ≈0.8. The adsorption step in the range of p/p 0 =0.8–1.0 can be explained by filling the intercrystalline pores between nanocrystallites [32]. The ZSM-5-I(13) and ZSM-5-II(45) samples were silylated by TEOS. The kinetic diameter of TEOS (8.9Å) is much larger than the pore mouth of MFI-type zeolite (5.4–5.6Å). Thus, only hydroxyl groups on the outer surface could react with hydrolyzed silicon species and form SiOSi or SiOAl bonds. The analysis of the Al content shows only slight changes in the Si/Al ratio after silylation procedure (Table 1 ). Previously, silylation with TEOS was used to reduce the concentration of acid sites on the external surface of zeolites [33]. Besides blocking surface activity of zeolite, TEOS and silica species deposited on the external surface might block the zeolite pores and impose diffusion limitations [34]. Low temperature nitrogen adsorption (Table 1 and Figure S2) shows only slight decrease in the total surface area or micropore volume of zeolite ZSM-5-II(45). Differently to ZSM-5-II(45), the silylated ZSM-5-I(13) sample demonstrates a significant decrease in the surface area (from 432 to 350m2/g) and volume (from 0.17 to 0.14cm3/g). Larger crystallite size and higher acidity of ZSM-5-I(13) result in the higher probability of the pore blockage and decrease in the surface area and volume during silylation in comparison with ZSM-5-II(45). The acidity of materials was studied by NH3-TPD (Figure S3, Table 1). All zeolites exhibit a low-temperature (100–300°C) and a high-temperature (400–600°C) ammonia desorption peaks. The high temperature peak is usually assigned to ammonia desorption from bridging hydroxyl groups of zeolites (Si-OH-Al) [35]. The identification of the low temperature peak is still controversial. This peak is usually assigned to desorption of physically adsorbed ammonia or desorption of ammonia from silanol groups or extra framework aluminum species [35]. The total amount of acid sites in ZSM-5-I(13) zeolite is almost three times more significant than in ZSM-5-II(45) zeolite. The acidity of ZSM-5 zeolite is usually associated with aluminum content. Thus, higher concentration of acidic sites in the ZSM-5-I(13) zeolite corresponds to higher aluminum content in this zeolite (Table 1). NH3-TPD shows that silica deposition over ZSM-5-I(13) and ZSM-5-II(45) leads respectively to 6 and 16% decrease in the amount of acid sites in comparison with the parent zeolites, while the strength of acid sites is not affected (Figure S3, Table 1). The larger decrease in the amount of acid sites in the ZSM-5-II(45) sample is obviously due to the higher outer surface area of zeolite nanocrystals. A relatively small drop in the concentration of acid sites after silylation confirms preferential adsorption of TEOS on the zeolite outer surface. The ZSM-5 structure is constituted by two intersecting channel systems. Partial blockage of the pores does not affect the total zeolite acidity measured by NH3-TPD because of relatively small size of NH3 molecules and their possible migration thought the ZSM-5 channel system. 3.2 Influence of Si/Al ratio and zeolite crystallite size on the catalytic performance of CZA-ZSM-5 catalysts The catalytic activities and selectivities in DME synthesis of the CZA-zeolite mixture are shown in Figs. 1–3 . The carbon monoxide conversions and selectivities are strongly affected by the concentration of acid sites and zeolite crystallite sizes. Note that ZSM-5-I(25) and ZSM-5-I(13) have rather similar morphology and relatively large crystallite sizes (5–7μm). The strength of acid sites determined by TPD of NH3 for all zeolites is similar (Figure S3). This suggests that the catalysts principally differ in the concentration of acid sites and in the size of the crystals. Let us first evaluate the phenomena due to the different concentration of Brönsted acid sites. The ZSM-5-I(25) zeolite has a concentration of Brönsted acid sites twice lower than ZSM-5-I(13), while the crystallite size is the same for both the zeolites. Interestingly, the activity of the CZA-ZSM-5-I(25) catalyst is much lower compared to the ZSM-5-I(13) counterpart (Fig. 1). Carbon monoxide conversion is about 35% on CZA-ZSM-5(25) in comparison with 65% over CZA-ZSM-5-I(13). In addition, differently to CZA-ZSM-5-I(13), CZA-ZSM-5-I(25) exhibits much higher methanol selectivity (Fig. 2). Higher methanol selectivity on CZA-ZSM-5-I(25) indicates relatively slow kinetics of methanol dehydration which can be due to lower concentration of Brönsted acid sites in this catalyst. The same dependence of the activity of the hybrid catalyst in DME synthesis on Si/Al ratio in zeolites has been observed earlier [36]. Lower carbon monoxide conversion observed on CZA-ZSM-5-I(25) could be also due to thermodynamic constrains. Indeed, methanol is one of the major products on this catalyst and the theoretical equilibrium conversion of CO to methanol is only 20–30% at these conditions [5]. Higher concentration of acid sites in zeolite could be favorable for methanol dehydration. Under the same reaction conditions, CZA-ZSM-5-I(13) with a higher fraction of acid sites exhibits a much higher DME selectivity (S DME =61%) at the conversion of 65%. The methanol selectivity was only 4% on CZA-ZSM-5-I(13). In addition to the Brönsted acid sites, zeolite crystallite diameter also affects the performance of CZA-ZSM-5 catalysts. Fig. 1 shows that carbon monoxide conversion on the CZA-ZSM-5-II(45) composite catalyst is comparable to that on CZA-ZSM-5-I(13), although, the number of acid sites in CZA-ZSM-5-II(45) is several times lower than CZA-ZSM-5-I(13). This fact is most probably due to the different crystallite size of these two samples (Figure S1). Indeed, the ZSM-5-I(13) zeolite represents intergrown agglomerates of zeolite crystals with size of around 5–7μm in comparison with the nanocrystals of ZSM-5-II(45) with size of 40–100nm. Smaller crystallite sizes of ZSM-5-II(45) should result in higher accessibility of Brönsted sites. This could lead to more efficient methanol dehydration in comparison with ZSM-5-I(13). The higher activity and DME yield during methanol dehydration with decrease in the size of ZSM-5 crystals has been explained earlier by smaller mass transport resistance [37]. The ZSM-5-II(45) based catalyst exhibits DME selectivity of 67% compared to the DME selectivity of 61% observed over CZA-ZSM-5-I(13) at carbon monoxide conversion of 60–70% (Figs. 2 and 3). The ratio of DME to CO2 selectivities is almost equal to 2:1 over the catalyst containing ZSM-5-I(13). This indicates almost full consumption of water produced in methanol dehydration in WGS reaction. Zeolite could possibly play a role in WGS reaction; the CO2 selectivity over CZA-ZSM-5-II(45) is significantly lower than on other zeolites. This observation might be attributed to higher concentration of acid sites in ZSM-5-I(13) which should result in the higher water capacity (hold up) in the catalyst. Higher water concentration would result in deeper WGS reaction over this system. The more hydrophobic ZSM-5-II(45) should lead to the lower water adsorption and lower probability of the WGS reaction. In addition CZA-ZSM-5-I(13) produces some amounts of hydrocarbons. The formation of light hydrocarbons over CZA-ZSM-5-I(13) might be explained by higher concentration of acid sites and thus by higher probability of methanol and DME conversion into olefins in comparison with CZA-ZSM-5-II(45). The presence of saturated hydrocarbons (ethane, propane, butane) is probably due to subsequent hydrogenation of olefins into alkanes over CZA [12]. Methane formation is most probably a result of CO and CO2 hydrogenation over CZA catalyst. Indeed, some amounts of methane are usually observed in syngas conversion on copper catalysts [38]. Hydrocarbon production over CZA-ZSM-5 catalyst could be possibly reduced by selective neutralization of strong zeolite acid sites. Previously it was shown that modification of ZSM-5 by Sb2O3 or MgO increased the selectivity to DME from 55 to 65–69% [12,39]. In addition, higher DME selectivity can be also favored by smaller zeolite crystallite sizes. Smaller ZSM-5-II(45) crystallite size reduces methanol and DME residence time inside the zeolite matrix and thus the probability of secondary reactions (e.g. hydrocarbon formation). 3.3 Influence of silylation of zeolite external surface on the catalyst structure and stability 3.3.1 Catalytic properties of catalysts with silylated zeolites One of the major problems of direct DME synthesis from syngas is catalyst deactivation. All studied CZA-ZSM-5 composite catalysts showed gradual decrease in carbon monoxide conversion with time on stream (Fig. 1). The CO conversion decreased for the CZA-ZSM-5-I(13) catalyst from 64 to 49% and for CZA-ZSM-5-II(45) from 70 to 56% respectively during the first 100h of the reaction. The results are consistent with previous reports about the stability of CZA-ZSM-5 catalysts prepared by kneading [15]. The stability of CZA-ZSM-5-I(13) and CZA-ZSM-5-II(45) catalysts was improved in this work using silylation with TEOS. Fig. 1 shows that the conversion on both the silylated zeolites was much more stable than on the parent catalysts. For CZA-ZSM-5-I(13) catalyst silylation also led to the increase in initial carbon monoxide conversion from 63 to 74%. Higher DME selectivity was also observed on silylated catalysts. For CZA-ZSM-5-I(13), silylation leads to the increase in DME selectivity from 61 to 63% after 5h of the reaction, while for CZA-ZSM-5-II(45) the DME selectivity rises after silylation from 67 to 69%. At the same time, the selectivity to CO2 decreases on both catalysts. Lower CO2 selectivity after silylation can be attributed to lower WGS activity over more hydrophobic CZA-ZSM-5-II(45) and might be explained again by a decrease in the concentration of adsorbed water after the interface between CZA catalyst and zeolite after silylation. In order to identify the reasons of deactivation and to evaluate the influence on silylation on the catalyst stability, the parent and silylated hybrid CZA-zeolite catalysts before and after the catalytic experiments have been extensively studied by TEM and FTIR spectroscopy. 3.3.2 Physicochemical properties of catalysts before and after deactivation Zeolite acidity in the fast deactivating hybrid CZA-ZSM-5-I(13) has been investigated by Py adsorption. Fig. 4 shows the results of Py adsorption over CZA-ZSM-5-I(13) before and after the catalytic tests. In the range of 1400–1700cm−1, chemically adsorbed pyridine exhibited a usual set of bands: two bands at 1545 and 1656cm−1 assigned to pyridinium ion (PyH+), two bands at 1450 and 1610cm−1 related to coordinatively adsorbed pyridine on Lewis sites. The band at 1490cm−1 was attributed to Py species adsorbed on Lewis and Brönsted sites [40]. The intensity of the band corresponding to pyridinium ion (PyH+) significantly decreases after the catalytic experiment. This corresponds to the decrease in the number of Brönsted acid sites. The Lewis acidity remains almost unchanged for both catalysts before and after the reaction. In addition to the zeolite Lewis sites, the Lewis acidity in the spent catalysts seems to be also related to cationic copper species which concentration may increase during the reaction. In order to find the reasons responsible for the drop in the number of Brönsted acid sites after the reaction, the local elemental composition of hybrid CZA-ZSM-5-I(13) catalyst before and after catalytic experiment was analyzed by TEM-EDX and STEM-HAADF (Fig. 5 ). Owing to the contrasts in the TEM mode, we were able to distinguish between the zeolite and metal-rich regions. The chemical composition of these regions was further investigated using EDX. Silicon was predominant in the zeolite area of the catalysts before and after reaction as shown by Fig. 5 (blue and green encircled region and spectra), whereas the other regions, which show different contrasts, appear to be dominated by Cu, Zn and at smaller expense Al. The mean size of the zeolite crystals is of several tens of nm, whereas the CZA grains appear as platelets (ZnO) or needle-like shaped (alumina) with mean sizes of about 20nm. Catalyst spacemen were deposited on a carbon membrane supported by a Cu grid. Consequently, traces of Cu (region 1) could be detected in regions that appear to be pure zeolite. Note however, that the signal of Cu from the catalyst before reaction (region 3) was significantly lower in comparison with the signal from the region 1 indicating the presence of Cu within the zeolite crystal or in the close proximity to zeolite crystal after the reaction. Taking into account the decrease in the number of Brönsted acid sites in zeolite, this observation might be explained by migration of copper during the reaction followed by ion exchange of copper ions with zeolite hydroxyl groups. Similar phenomenon was observed earlier by the group of Martínez [29] at higher temperatures with identification of Cu2+ by EPR. The authors suggested that interaction between protons and Cu is one of the main reasons of the catalyst deactivation [29,30]. The metal distribution within the CZA-ZSM-5 catalysts was studied by direct analysis of contrasts from the STEM-HAADF micrographs. Because of higher sensitivity to the Z atomic number, this mode is particularly suitable for the assessment of the distribution of metallic nanoparticles. The metal distribution in CZA-ZSM-5-I(13) zeolite composite with and without the TEOS treatment has been analyzed before and after reaction (Fig. 6 ). After catalyst activation in hydrogen (Fig. 6a), Cu is located exclusively on the CZA grains, either as NPs with a mean size of 5nm or as a thin metallic layer. The thickness of the Cu metallic layer varies from several nm to 15nm, as depicted by Fig. 6a. After the reaction, the morphology of the catalyst changes drastically in terms of metal distribution. Larger metal NPs with mean sizes superior to 10–15nm are detected not only on the CZA grains but on the zeolite as well (Fig. 6b). The thin metal layer completely disappeared from the grains, most probably being assimilated by the larger neighboring particles during the reaction. This phenomenon can be interpreted by assuming metal sintering on the surface of the CZA and subsequent copper diffusion to the zeolite. Such phenomenon can be responsible for copper migration followed by oxidation, subsequent exchange of Cu2+ ions with zeolite hydroxyl groups. The outline of the catalyst deactivation processes is shown in Fig. 7 . The spent silylated CZA-SiO2/ZSM-5-I(13) sample shows major difference in location of copper NPs, relative to the non-silylated catalyst (Fig. 6). The STEM-HAADF analysis shows a clear separation of CZA and zeolite phases in spent CZA-SiO2/ZSM-5-I(13) catalyst. Differently to the spent CZA-ZSM-5-I(13) catalyst prepared without TEOS pretreatment, copper species were not detected in CZA-SiO2/ZSM-5-I(13) inside the zeolite. Thus, TEM-EDX and STEM-HAADF have provided valuable information on copper localization in the silylated CZA-zeolite prior and after the reaction. Silylation of zeolite surface by TEOS results in less significant Cu sintering and ion exchange with zeolite protons. Consequently, the silylated catalyst shows better stability (Fig. 1). Our results suggest that neutralization of hydroxyl group at the external surface reduces copper sintering and ion exchange with protons of zeolites (Fig. 7) which are usually observed on non-silylated catalysts. Cu sintering in Cu-ZSM-5 catalyst during NO decomposition was observed previously. Fierro et al. [41] found that migration of Cu inside of zeolite pores was facilitated by the presence of water vapor. Water promotes formation of positively charged mobile copper clusters. Copper sintering seems to proceed according to particle migration and coalescence mechanism. Similar mechanism of nanoparticle sintering facilitated by the presence of water was previously observed for supported nickel and cobalt catalysts [42,43]. In addition to water, hydroxyl groups on the zeolite outer surface can obviously contribute to higher copper mobility in hybrid catalysts. Water seems to play a major role in copper sintering. To identify the effect of water on copper sintering, we conducted a specific experiment. In this experiment, water was added to the catalyst in a flow of hydrogen in the absence of carbon monoxide (Fig. 8 ). The amount of added water roughly corresponded to water amounts produced under typical reaction conditions (DME synthesis). Fig. 8 shows that the conversion of CO decreases rapidly from 60 to 10% after 24h of catalyst exposure to water and hydrogen at the reaction temperature. This suggests that indeed water significantly facilitates the migration of Cu. The changes in the oxidation state during the reaction were also investigated by FTIR spectroscopy using low temperature CO adsorption. Fig. 9 displays IR spectra of CO adsorption as a function of coverage over parent CZA-ZSM-5-I(13). At the very low coverage the most intense band is found at 2115cm−1. Further addition of CO leads to the appearance of the band at 2170cm−1 which shifts to 2164cm−1 with the increase in the amount of adsorbed CO. Finally another band emerges at 2136cm−1. The lower frequency band at 2115cm−1 corresponds to the strongest adsorption of CO. In agreement with previous reports [44–46], the band at 2115cm−1 could be related to the reduced copper species (Cu0 or Cu+). It is well known that copper carbonyls are not very stable. Copper carbonyl stability could be enhanced when CO adsorbs on well dispersed nanoparticles at low temperature. The band at 2164cm−1 might be assigned to CO adsorption over Brönsted acid sites [47]. The same band might also have CO adsorbed either to extra framework cations (Zn2+, Cu2+). The band at 2136cm−1 is usually assigned to physically adsorbed CO. It appears only at relatively higher carbon monoxide pressures. Fig. 10 shows IR spectra of adsorbed CO on the pure CZA and hybrid catalysts prepared using the parent and silylated ZSM-5-I(13) zeolites before and after the reaction. The spectrum of CO adsorbed over pure CZA shows bands of CO at 2164 and 2115cm−1. Mixing of CZA with parent and silylated ZSM-5-I(13) zeolites results in modification of the band shape and intensity. The intensity of the band at 2164cm−1 increases for the non-modified zeolite system and almost does not change in the case of silylated ZSM-5. Taking into account that Brönsted acidity decreases during reaction over CZA-ZSM-5-I(13), the increase in the intensity of the band at 2164cm−1 might be possibly explained by high adsorption of CO over forming cationic Cu2+ sites. In the case of silylated sample, the band of CO over metallic Cu is still broad and shifts to higher wavenumbers similarly to parent CZA. It is indicative of the presence of Cu sites with slightly different electronic properties or chemical environment [48]. The position of this band is more affected by the reaction in non silylated ZSM-5-I(13) catalyst. Mixing with parent zeolite results in significant narrowing of the band and a low frequency shift of the band at 2164cm−1. This fact might be explained by interaction of zeolite [49] with positively charged copper clusters in CZA which may form in the catalyst during the pretreatments. It is interesting to note that the non-silylated catalyst shows a significant decrease in the intensity of the band at 2115cm−1 after the reaction. Low intensity of the band at 2115cm−1 can be assigned to the low concentration of available copper sites in the spent CZA-ZSM-5-I(13) catalyst probably because of copper sintering, oxidation and ion exchange. At the same time, the intensity of the band at 2115cm−1 attributed to copper metal sites in the silylated catalysts is affected to a much lesser extent by the exposure to the reaction conditions. Neutralization of the acid sites on zeolite outer surface seems to prevent copper migration with its ion exchange and sintering in SiO2/ZSM-5-I(13). Our results correlate with the results of the group of Martínez [30] who observed the effect of the external surface area and surface Al concentration of the zeolite co-catalyst on the catalyst deactivation. Thus, the pronounced increase in the catalyst stability during DME synthesis after silylation might be explained by suppression of Cu migration and ion exchange on the outer surface of zeolite due to neutralization of the surface acid sites by TEOS. The possible alternative explanation of the catalyst deactivation could be coke formation during reaction. The coke may form by polymerization of olefins or condensation of reactive oxygenates during reaction [26,27]. In order to verify this assumption, TPO of the spent catalysts has been conducted with detection of forming CO2 (Fig. 11 ). The results indicate similar character of the adsorbed coke species for all samples. The amount of forming CO2 is very low (7–8×10−6 mmol/g) and comparable for silylated and non silylated ZSM-5-I(13) and ZSM-5-II(45) zeolites. These results suggest that silylation does not influence to any noticeable extent coke deposition. The experiment with addition of water (Fig. 8) also supports this assumption. Note that silylation can improve not only the catalyst stability but also the catalyst initial activity. One might anticipate that copper on the surface of CZA reacts with the protons of non-silylated ZSM-5-I(13) already during pretreatment of the catalyst in the reactor. It reduces amount of active Cu species for methanol synthesis. Significant interaction between ZSM-5 and CZA with ion exchange of Cu during hybrid catalyst preparation has been observed earlier [29,30]. In the silylated catalyst, the reaction between copper and Brönsted acid sites during activation could be hindered by SiO2 protective layer on the zeolite outer surface. Thus, the silylated catalyst can show higher reaction rate compared to non-silylated counterpart immediately after the exposure to the reaction medium. The selectivity slightly evolves with reaction time over both the parent and silylated catalysts. The selectivity to DME decreases by 2–3% over parent catalysts with simultaneous very slight increase in the selectivity to CO2 and methanol (Figs. 2 and 3). A slight increase in methanol selectivity is related to the continuous decrease in the concentration of Brönsted acid sites during the reaction and thus slower methanol dehydration rate. The acid sites in pores of the parent non-silylated zeolites are neutralized by migrating Cu2+ ions. At the same time, these catalysts can show a higher activity in WGS reaction which can be due to easier water dissociation over Cu2+ ions [50]. At the same time, silylation of zeolite outer surface hinders copper migration into zeolite pores. Thus, the concentration of zeolite acid sites is reduced to a lesser extent in the silylated samples during the reaction. Silylation leads to the increase in the selectivity to DME by 2% over both catalytic systems. This corresponds to the highest selectivity to DME (69%) observed on SiO2/ZSM-5-II catalyst [39]. The increase in DME selectivity after silylation is accompanied by a significant decrease in the selectivity to CO2 and hydrocarbons. Previously it was shown that DME selectivity could be improved by the promotion of copper-zeolite catalysts by metal oxides (ZrO2, MgO, Sb2O3). Indeed, addition of metal oxides reduces zeolite acidity and hydrocarbon production. However promotion with metal oxides does not improve the catalyst stability [12,16,39]. Indeed, metal oxides are usually distributed almost uniformly inside the zeolite lattice. Silylation with TEOS results in selective neutralization of the acid sites on the zeolite surface and produces a much more significant effect on the catalyst stability than the promotion with metal oxides. 4 Conclusion The catalytic performance of hybrid Cu–ZnO–Al2O3/ZSM-5 prepared by kneading in direct DME synthesis from syngas depends on the zeolite crystallite size and Si/Al ratio. Higher concentration of the zeolite Brönsted acid sites and smaller zeolite crystallite sizes favor higher DME productivity. The decrease in the catalytic performance of hybrid catalysts with time on stream is due to the combination of several phenomena: copper sintering, copper oxidation, migration and ion exchange with hydroxyl groups in zeolite pores. The catalyst stability can be enhanced by selective neutralization of acid sites on zeolite outer surface with TEOS. Selective neutralization of Brönsted acid sites on the outer zeolite surface slows down copper sintering and migration and results in the better catalyst stability and slightly higher selectivity to DME. The effect of silylation on the catalytic performance and stability was more pronounced for the zeolite with abundant Brönsted acidity and small outer surface area. Acknowledgments This research is being performed within the ANR project CATSYN-BIOFUELS (ANR-12-BS07-0029). The authors gratefully acknowledge the support of the French National Research Agency. Appendix A Supplementary data Supplementary data associated with this article can be found, in the online version, at http://dx.doi.org/10.1016/j.apcata.2014.08.030. Appendix A Supplementary data The following are the Supplementary data to this article: References [1] A. Corma S. Iborra A. Velty Chem. Rev. 107 2007 2411 2502 [2] T.A. Semelsberger R.L. Borup H.L. Greene J. Power Sources 156 2006 497 511 [3] W.W. Kaeding S.A. Butter J. Catal. 61 1980 155 164 [4] G. Cai Z. Liu R. Shi C. He L. Yang C. Sun Y. Chang Appl. Catal. A 125 1995 29 38 [5] L.R. Clausen B. Elmegaard J. Ahrenfeldt U. Henriksen Energy 36 2011 5805 5814 [6] J.L. Li X.G. Zhang T. Inui Appl. Catal. A 147 1996 23 33 [7] Y. Tan H. Xie H. Cui Y. Han B. Zhong Catal. Today 104 2005 25 29 [8] J.W. Jung Y.J. Lee J.W. Bae Appl. Catal. B 126 2012 1 8 [9] G. Yang N. Tsubaki J. Shamoto Y. Yoneyama J. Am. Chem. Soc. 132 2010 8129 8136 [10] R. Nie H. Lei S. Pan L. Wang J. Fei Fuel 96 2012 419 425 [11] H.Y. Chen S.P. Lau L. Chen J. Lin C.H.A. Huan K.L. Tan J.S. Pan Appl. Surf. Sci. 152 3 1999 193 199 [12] D. Mao W. Yang J. Xia J. Catal. 230 2005 140 149 [13] J.W. Bae S.-H. Kang Y.-J. Lee K.-W. Jun Appl. Catal. B 90 2009 426 435 [14] M. Xu J.H. Lunsford D.W. Goodman A. Bhattacharyya Appl. Catal. A 149 1997 289 301 [15] T. Takeguchi K. Yanagisawa T. Inui M. Inoue Appl. Catal. 192 2000 201 209 [16] A. García-Trenco A. Martínez Appl. Catal. A 411–412 2012 170 179 [17] Q. Zhang Y. Tan C. Yang H. Xie Y. Han J. Ind. Eng. Chem. 19 2013 975 980 [18] S.-H. Kang J.W. Bae K.-W. Jun H.S. Potdar Catal. Commun. 9 2008 2035 2039 [19] D. Jin B. Zhu Z. Hou J. Fei H. Lou X. Zheng Fuel 86 2007 2707 2713 [20] D. Mao J. Xia B. Zhang Q. Chen G. Lu Chin. J. Catal. 29 2008 945 949 [21] Q. Ge Y. Huang F. Qiu S. Li Appl. Catal. A 167 1998 23 30 [22] G.R. Moradi S. Nosrati F. Yaripor Catal. Commun. 8 2007 598 606 [23] S.P. Naik H. Du H. Wan V. Bui J.D. Miller W.W. Zmierczak Ind. Eng. Chem. Res. 47 2008 9791 9794 [24] K. Pinkaew G. Yang T. Vitidsant Y. Jin C. Zeng Y. Yoneyama N. Tsubaki Fuel 111 2013 727 732 [25] G. Yang M. Thongkam T. Vitidsant Y. Yoneyama Y. Tan N. Tsubaki Catal. Today 171 1 2011 229 235 [26] J. Abu-Dahrieh D. Rooney A. Goguet Y. Saih Chem. Eng. J 203 2012 201 211 [27] I. Sierra J. Erena A.T. Aguayo J.M. Arandes M. Olazar J. Bilbao Appl. Catal. B 106 2011 167 173 [28] J.W. Jung Y.J. Lee S.H. Um P.J. Yoo D.H. Lee K.-W. Jun J.W. Bae Appl. Catal. B 126 2012 1 8 [29] A. García-Trenco A. Vidal-Moya A. Martínez Catal. Today 179 2012 43 51 [30] A. García-Trenco S. Valencia A. Martínez Appl. Catal. A 468 2013 102 111 [31] J. Li W. Zhang L. Gao P. Gu K. Sha H. Wa Appl. Catal. A 165 1997 411 417 [32] A. Simon-Masseron J.P. Marques J.M. Lopes F. Ramoa Ribeiro I. Gener M. Guisnet Appl. Catal. A: Gen. 316 2007 75 82 [33] S.R. Zheng R.H. Heydenrych A. Jentys J. Phys. Chem. B 106 37 2002 9552 9558 [34] R.W. Weber K.P. Möller C.T. O’Connor Microporous Mesoporous Mater. 35–36 2000 533 543 [35] C.V. Hidalgo H. Itoh T. Hattori M. Niwa Y. Murakami J. Catal. 85 1984 362 369 [36] J.-H. Kim M.J. Park S.J. Kim O.-Sh. Joo K.-D. Jung Appl. Catal. A 264 2004 37 41 [37] A.A. Rownaghi F. Rezaei M. Stante Appl. Catal. B 119–120 2012 56 61 [38] J. Wang P.A. Chernavskii A.Y. Khodakov Y. Wang J. Catal. 286 2012 51 61 [39] D. Mao J. Xia B. Zhang G. Lu Energy Convers. Manage. 51 2010 1134 1139 [40] M. Guisnet P. Ayrault C. Coutanceau M.F. Alvarez J. Datka J. Chem. Soc., Faraday Trans. 93 1997 1661 1665 [41] G. Fierro G. Ferraris G. Moretti Appl. Catal. B 91 2009 499 506 [42] J. Sehested J. Catal. 217 2003 417 426 [43] M. Sadeqzadeh J. Hong P. Fongarland D. Curulla-Ferré F. Luck J. Bousquet D. Schweich A.Y. Khodakov Ind. Eng. Chem. Res. 51 2012 11955 11964 [44] A.E. Baber X. Yang H. You Kim K. Mudiyanselage M. Soldemo J. Weissenrieder S.D. Senanayake A. Al-Mahboob J.T. Sadowski J. Evans J.A. Rodriguez P. Liu F.M. Hoffmann J.G. Chen D.J. Stacchiola Angew. Chem. 53 2014 5336 5340 [45] V. Sanchez-Escribano L. Arrighi P. Riani R. Marazza G. Busca Langmuir 22 2006 9214 9219 [46] G. Busca U. Constantino F. Marmottini T. Montanari P. Patrono F. Pinzari G. Ramis Appl. Catal. A 310 2006 70 78 [47] S. Bordiga E.E. Platero C.O. Arean C. Lamberti A. Zecchina J. Catal. 137 1992 179 185 [48] A. Kitla O.V. Safonova K. Föttinger Catal. Lett. 143 2013 517 530 [49] G. Morterra E. Giamello G. Cerrato G. Centi S. Perathoner J. Catal. 179 1998 111 128 [50] G.G. Olympiou C.M. Kalamaras C.D. Zeinalipour-Tazdi A.M. Efstathiou Catal. Today 127 2007 304 318",
      "scopus-id": "84909606443",
      "coredata": {
        "eid": "1-s2.0-S0926860X14005262",
        "dc:description": "Direct synthesis of dimethyl ether (DME) from syngas was investigated on a series of hybrid Cu–ZnO–Al2O3/ZSM-5 catalysts prepared by kneading. It was found that the initial performance of the catalysts was a function of both zeolite crystallite sizes and Si/Al ratio. The activity of the hybrid catalysts gradually decreased with time on stream because of simultaneous copper sintering, copper oxidation and ion exchange with zeolite hydroxyl groups. Copper sintering led to the decrease in the number of metal active sites, while ion exchange of Cu2+ ions with the hydroxyl groups of the zeolite resulted in lower concentration of acid sites for methanol dehydration. Copper sintering and ion exchange could be slowed down by selective neutralization of the acid sites on the zeolite outer surface by silylation. Both catalyst stability and dimethyl ether productivity were significantly improved.",
        "openArchiveArticle": "false",
        "prism:coverDate": "2014-09-22",
        "openaccessUserLicense": null,
        "prism:aggregationType": "Journal",
        "prism:url": "https://api.elsevier.com/content/article/pii/S0926860X14005262",
        "dc:creator": [
          {
            "@_fa": "true",
            "$": "Ordomsky, V.V."
          },
          {
            "@_fa": "true",
            "$": "Cai, M."
          },
          {
            "@_fa": "true",
            "$": "Sushkevich, V."
          },
          {
            "@_fa": "true",
            "$": "Moldovan, S."
          },
          {
            "@_fa": "true",
            "$": "Ersen, O."
          },
          {
            "@_fa": "true",
            "$": "Lancelot, C."
          },
          {
            "@_fa": "true",
            "$": "Valtchev, V."
          },
          {
            "@_fa": "true",
            "$": "Khodakov, A.Y."
          }
        ],
        "link": [
          {
            "@_fa": "true",
            "@rel": "self",
            "@href": "https://api.elsevier.com/content/article/pii/S0926860X14005262"
          },
          {
            "@_fa": "true",
            "@rel": "scidir",
            "@href": "https://www.sciencedirect.com/science/article/pii/S0926860X14005262"
          }
        ],
        "dc:format": "application/json",
        "openaccessType": null,
        "pii": "S0926-860X(14)00526-2",
        "prism:volume": "486",
        "prism:publisher": "Elsevier B.V.",
        "dc:title": "The role of external acid sites of ZSM-5 in deactivation of hybrid CuZnAl/ZSM-5 catalyst for direct dimethyl ether synthesis from syngas",
        "prism:copyright": "Copyright © 2014 Elsevier B.V. All rights reserved.",
        "openaccess": "0",
        "prism:issn": "0926860X",
        "dcterms:subject": [
          {
            "@_fa": "true",
            "$": "DME synthesis"
          },
          {
            "@_fa": "true",
            "$": "Syngas"
          },
          {
            "@_fa": "true",
            "$": "Deactivation"
          },
          {
            "@_fa": "true",
            "$": "Cu–ZnO–Al2O3"
          },
          {
            "@_fa": "true",
            "$": "Silylation"
          },
          {
            "@_fa": "true",
            "$": "ZSM-5"
          }
        ],
        "openaccessArticle": "false",
        "prism:publicationName": "Applied Catalysis A: General",
        "openaccessSponsorType": null,
        "prism:pageRange": "266-275",
        "prism:endingPage": "275",
        "pubType": "fla",
        "prism:coverDisplayDate": "22 September 2014",
        "prism:doi": "10.1016/j.apcata.2014.08.030",
        "prism:startingPage": "266",
        "dc:identifier": "doi:10.1016/j.apcata.2014.08.030",
        "openaccessSponsorName": null
      },
      "objects": {
        "object": [
          {
            "@category": "thumbnail",
            "@height": "82",
            "@width": "219",
            "@_fa": "true",
            "$": "https://api.elsevier.com/content/object/eid/1-s2.0-S0926860X14005262-fx1.sml?httpAccept=%2A%2F%2A",
            "@multimediatype": "GIF image file",
            "@type": "IMAGE-THUMBNAIL",
            "@size": "7267",
            "@ref": "fx1",
            "@mimetype": "image/gif"
          },
          {
            "@category": "thumbnail",
            "@height": "135",
            "@width": "219",
            "@_fa": "true",
            "$": "https://api.elsevier.com/content/object/eid/1-s2.0-S0926860X14005262-gr1.sml?httpAccept=%2A%2F%2A",
            "@multimediatype": "GIF image file",
            "@type": "IMAGE-THUMBNAIL",
            "@size": "14022",
            "@ref": "gr1",
            "@mimetype": "image/gif"
          },
          {
            "@category": "thumbnail",
            "@height": "164",
            "@width": "160",
            "@_fa": "true",
            "$": "https://api.elsevier.com/content/object/eid/1-s2.0-S0926860X14005262-gr10.sml?httpAccept=%2A%2F%2A",
            "@multimediatype": "GIF image file",
            "@type": "IMAGE-THUMBNAIL",
            "@size": "15973",
            "@ref": "gr10",
            "@mimetype": "image/gif"
          },
          {
            "@category": "thumbnail",
            "@height": "164",
            "@width": "212",
            "@_fa": "true",
            "$": "https://api.elsevier.com/content/object/eid/1-s2.0-S0926860X14005262-gr11.sml?httpAccept=%2A%2F%2A",
            "@multimediatype": "GIF image file",
            "@type": "IMAGE-THUMBNAIL",
            "@size": "15195",
            "@ref": "gr11",
            "@mimetype": "image/gif"
          },
          {
            "@category": "thumbnail",
            "@height": "157",
            "@width": "219",
            "@_fa": "true",
            "$": "https://api.elsevier.com/content/object/eid/1-s2.0-S0926860X14005262-gr2.sml?httpAccept=%2A%2F%2A",
            "@multimediatype": "GIF image file",
            "@type": "IMAGE-THUMBNAIL",
            "@size": "19259",
            "@ref": "gr2",
            "@mimetype": "image/gif"
          },
          {
            "@category": "thumbnail",
            "@height": "164",
            "@width": "208",
            "@_fa": "true",
            "$": "https://api.elsevier.com/content/object/eid/1-s2.0-S0926860X14005262-gr3.sml?httpAccept=%2A%2F%2A",
            "@multimediatype": "GIF image file",
            "@type": "IMAGE-THUMBNAIL",
            "@size": "20869",
            "@ref": "gr3",
            "@mimetype": "image/gif"
          },
          {
            "@category": "thumbnail",
            "@height": "164",
            "@width": "208",
            "@_fa": "true",
            "$": "https://api.elsevier.com/content/object/eid/1-s2.0-S0926860X14005262-gr4.sml?httpAccept=%2A%2F%2A",
            "@multimediatype": "GIF image file",
            "@type": "IMAGE-THUMBNAIL",
            "@size": "19657",
            "@ref": "gr4",
            "@mimetype": "image/gif"
          },
          {
            "@category": "thumbnail",
            "@height": "159",
            "@width": "219",
            "@_fa": "true",
            "$": "https://api.elsevier.com/content/object/eid/1-s2.0-S0926860X14005262-gr5.sml?httpAccept=%2A%2F%2A",
            "@multimediatype": "GIF image file",
            "@type": "IMAGE-THUMBNAIL",
            "@size": "23296",
            "@ref": "gr5",
            "@mimetype": "image/gif"
          },
          {
            "@category": "thumbnail",
            "@height": "148",
            "@width": "219",
            "@_fa": "true",
            "$": "https://api.elsevier.com/content/object/eid/1-s2.0-S0926860X14005262-gr6.sml?httpAccept=%2A%2F%2A",
            "@multimediatype": "GIF image file",
            "@type": "IMAGE-THUMBNAIL",
            "@size": "30328",
            "@ref": "gr6",
            "@mimetype": "image/gif"
          },
          {
            "@category": "thumbnail",
            "@height": "130",
            "@width": "219",
            "@_fa": "true",
            "$": "https://api.elsevier.com/content/object/eid/1-s2.0-S0926860X14005262-gr7.sml?httpAccept=%2A%2F%2A",
            "@multimediatype": "GIF image file",
            "@type": "IMAGE-THUMBNAIL",
            "@size": "13431",
            "@ref": "gr7",
            "@mimetype": "image/gif"
          },
          {
            "@category": "thumbnail",
            "@height": "151",
            "@width": "219",
            "@_fa": "true",
            "$": "https://api.elsevier.com/content/object/eid/1-s2.0-S0926860X14005262-gr8.sml?httpAccept=%2A%2F%2A",
            "@multimediatype": "GIF image file",
            "@type": "IMAGE-THUMBNAIL",
            "@size": "15558",
            "@ref": "gr8",
            "@mimetype": "image/gif"
          },
          {
            "@category": "thumbnail",
            "@height": "163",
            "@width": "102",
            "@_fa": "true",
            "$": "https://api.elsevier.com/content/object/eid/1-s2.0-S0926860X14005262-gr9.sml?httpAccept=%2A%2F%2A",
            "@multimediatype": "GIF image file",
            "@type": "IMAGE-THUMBNAIL",
            "@size": "5075",
            "@ref": "gr9",
            "@mimetype": "image/gif"
          },
          {
            "@category": "standard",
            "@height": "481",
            "@width": "301",
            "@_fa": "true",
            "$": "https://api.elsevier.com/content/object/eid/1-s2.0-S0926860X14005262-gr9.gif?httpAccept=%2A%2F%2A",
            "@multimediatype": "GIF image file",
            "@type": "IMAGE-DOWNSAMPLED",
            "@size": "18272",
            "@ref": "gr9",
            "@mimetype": "image/gif"
          },
          {
            "@category": "standard",
            "@height": "187",
            "@width": "500",
            "@_fa": "true",
            "$": "https://api.elsevier.com/content/object/eid/1-s2.0-S0926860X14005262-fx1.jpg?httpAccept=%2A%2F%2A",
            "@multimediatype": "JPEG image file",
            "@type": "IMAGE-DOWNSAMPLED",
            "@size": "32674",
            "@ref": "fx1",
            "@mimetype": "image/jpeg"
          },
          {
            "@category": "standard",
            "@height": "243",
            "@width": "393",
            "@_fa": "true",
            "$": "https://api.elsevier.com/content/object/eid/1-s2.0-S0926860X14005262-gr1.jpg?httpAccept=%2A%2F%2A",
            "@multimediatype": "JPEG image file",
            "@type": "IMAGE-DOWNSAMPLED",
            "@size": "43931",
            "@ref": "gr1",
            "@mimetype": "image/jpeg"
          },
          {
            "@category": "standard",
            "@height": "347",
            "@width": "339",
            "@_fa": "true",
            "$": "https://api.elsevier.com/content/object/eid/1-s2.0-S0926860X14005262-gr10.jpg?httpAccept=%2A%2F%2A",
            "@multimediatype": "JPEG image file",
            "@type": "IMAGE-DOWNSAMPLED",
            "@size": "54453",
            "@ref": "gr10",
            "@mimetype": "image/jpeg"
          },
          {
            "@category": "standard",
            "@height": "291",
            "@width": "376",
            "@_fa": "true",
            "$": "https://api.elsevier.com/content/object/eid/1-s2.0-S0926860X14005262-gr11.jpg?httpAccept=%2A%2F%2A",
            "@multimediatype": "JPEG image file",
            "@type": "IMAGE-DOWNSAMPLED",
            "@size": "45210",
            "@ref": "gr11",
            "@mimetype": "image/jpeg"
          },
          {
            "@category": "standard",
            "@height": "281",
            "@width": "393",
            "@_fa": "true",
            "$": "https://api.elsevier.com/content/object/eid/1-s2.0-S0926860X14005262-gr2.jpg?httpAccept=%2A%2F%2A",
            "@multimediatype": "JPEG image file",
            "@type": "IMAGE-DOWNSAMPLED",
            "@size": "56505",
            "@ref": "gr2",
            "@mimetype": "image/jpeg"
          },
          {
            "@category": "standard",
            "@height": "452",
            "@width": "574",
            "@_fa": "true",
            "$": "https://api.elsevier.com/content/object/eid/1-s2.0-S0926860X14005262-gr3.jpg?httpAccept=%2A%2F%2A",
            "@multimediatype": "JPEG image file",
            "@type": "IMAGE-DOWNSAMPLED",
            "@size": "83075",
            "@ref": "gr3",
            "@mimetype": "image/jpeg"
          },
          {
            "@category": "standard",
            "@height": "268",
            "@width": "339",
            "@_fa": "true",
            "$": "https://api.elsevier.com/content/object/eid/1-s2.0-S0926860X14005262-gr4.jpg?httpAccept=%2A%2F%2A",
            "@multimediatype": "JPEG image file",
            "@type": "IMAGE-DOWNSAMPLED",
            "@size": "55952",
            "@ref": "gr4",
            "@mimetype": "image/jpeg"
          },
          {
            "@category": "standard",
            "@height": "493",
            "@width": "678",
            "@_fa": "true",
            "$": "https://api.elsevier.com/content/object/eid/1-s2.0-S0926860X14005262-gr5.jpg?httpAccept=%2A%2F%2A",
            "@multimediatype": "JPEG image file",
            "@type": "IMAGE-DOWNSAMPLED",
            "@size": "104231",
            "@ref": "gr5",
            "@mimetype": "image/jpeg"
          },
          {
            "@category": "standard",
            "@height": "457",
            "@width": "678",
            "@_fa": "true",
            "$": "https://api.elsevier.com/content/object/eid/1-s2.0-S0926860X14005262-gr6.jpg?httpAccept=%2A%2F%2A",
            "@multimediatype": "JPEG image file",
            "@type": "IMAGE-DOWNSAMPLED",
            "@size": "100947",
            "@ref": "gr6",
            "@mimetype": "image/jpeg"
          },
          {
            "@category": "standard",
            "@height": "313",
            "@width": "527",
            "@_fa": "true",
            "$": "https://api.elsevier.com/content/object/eid/1-s2.0-S0926860X14005262-gr7.jpg?httpAccept=%2A%2F%2A",
            "@multimediatype": "JPEG image file",
            "@type": "IMAGE-DOWNSAMPLED",
            "@size": "48112",
            "@ref": "gr7",
            "@mimetype": "image/jpeg"
          },
          {
            "@category": "standard",
            "@height": "260",
            "@width": "376",
            "@_fa": "true",
            "$": "https://api.elsevier.com/content/object/eid/1-s2.0-S0926860X14005262-gr8.jpg?httpAccept=%2A%2F%2A",
            "@multimediatype": "JPEG image file",
            "@type": "IMAGE-DOWNSAMPLED",
            "@size": "46314",
            "@ref": "gr8",
            "@mimetype": "image/jpeg"
          },
          {
            "@category": "high",
            "@height": "4258",
            "@width": "2667",
            "@_fa": "true",
            "$": "https://api.elsevier.com/content/object/eid/1-s2.0-S0926860X14005262-gr9_lrg.gif?httpAccept=%2A%2F%2A",
            "@multimediatype": "GIF image file",
            "@type": "IMAGE-HIGH-RES",
            "@size": "100912",
            "@ref": "gr9",
            "@mimetype": "image/gif"
          },
          {
            "@category": "high",
            "@height": "829",
            "@width": "2213",
            "@_fa": "true",
            "$": "https://api.elsevier.com/content/object/eid/1-s2.0-S0926860X14005262-fx1_lrg.jpg?httpAccept=%2A%2F%2A",
            "@multimediatype": "JPEG image file",
            "@type": "IMAGE-HIGH-RES",
            "@size": "197963",
            "@ref": "fx1",
            "@mimetype": "image/jpeg"
          },
          {
            "@category": "high",
            "@height": "1076",
            "@width": "1742",
            "@_fa": "true",
            "$": "https://api.elsevier.com/content/object/eid/1-s2.0-S0926860X14005262-gr1_lrg.jpg?httpAccept=%2A%2F%2A",
            "@multimediatype": "JPEG image file",
            "@type": "IMAGE-HIGH-RES",
            "@size": "245830",
            "@ref": "gr1",
            "@mimetype": "image/jpeg"
          },
          {
            "@category": "high",
            "@height": "1536",
            "@width": "1500",
            "@_fa": "true",
            "$": "https://api.elsevier.com/content/object/eid/1-s2.0-S0926860X14005262-gr10_lrg.jpg?httpAccept=%2A%2F%2A",
            "@multimediatype": "JPEG image file",
            "@type": "IMAGE-HIGH-RES",
            "@size": "251716",
            "@ref": "gr10",
            "@mimetype": "image/jpeg"
          },
          {
            "@category": "high",
            "@height": "1291",
            "@width": "1667",
            "@_fa": "true",
            "$": "https://api.elsevier.com/content/object/eid/1-s2.0-S0926860X14005262-gr11_lrg.jpg?httpAccept=%2A%2F%2A",
            "@multimediatype": "JPEG image file",
            "@type": "IMAGE-HIGH-RES",
            "@size": "218957",
            "@ref": "gr11",
            "@mimetype": "image/jpeg"
          },
          {
            "@category": "high",
            "@height": "1247",
            "@width": "1742",
            "@_fa": "true",
            "$": "https://api.elsevier.com/content/object/eid/1-s2.0-S0926860X14005262-gr2_lrg.jpg?httpAccept=%2A%2F%2A",
            "@multimediatype": "JPEG image file",
            "@type": "IMAGE-HIGH-RES",
            "@size": "278343",
            "@ref": "gr2",
            "@mimetype": "image/jpeg"
          },
          {
            "@category": "high",
            "@height": "2002",
            "@width": "2544",
            "@_fa": "true",
            "$": "https://api.elsevier.com/content/object/eid/1-s2.0-S0926860X14005262-gr3_lrg.jpg?httpAccept=%2A%2F%2A",
            "@multimediatype": "JPEG image file",
            "@type": "IMAGE-HIGH-RES",
            "@size": "417474",
            "@ref": "gr3",
            "@mimetype": "image/jpeg"
          },
          {
            "@category": "high",
            "@height": "1184",
            "@width": "1500",
            "@_fa": "true",
            "$": "https://api.elsevier.com/content/object/eid/1-s2.0-S0926860X14005262-gr4_lrg.jpg?httpAccept=%2A%2F%2A",
            "@multimediatype": "JPEG image file",
            "@type": "IMAGE-HIGH-RES",
            "@size": "288095",
            "@ref": "gr4",
            "@mimetype": "image/jpeg"
          },
          {
            "@category": "high",
            "@height": "2180",
            "@width": "3000",
            "@_fa": "true",
            "$": "https://api.elsevier.com/content/object/eid/1-s2.0-S0926860X14005262-gr5_lrg.jpg?httpAccept=%2A%2F%2A",
            "@multimediatype": "JPEG image file",
            "@type": "IMAGE-HIGH-RES",
            "@size": "841830",
            "@ref": "gr5",
            "@mimetype": "image/jpeg"
          },
          {
            "@category": "high",
            "@height": "1213",
            "@width": "1800",
            "@_fa": "true",
            "$": "https://api.elsevier.com/content/object/eid/1-s2.0-S0926860X14005262-gr6_lrg.jpg?httpAccept=%2A%2F%2A",
            "@multimediatype": "JPEG image file",
            "@type": "IMAGE-HIGH-RES",
            "@size": "434351",
            "@ref": "gr6",
            "@mimetype": "image/jpeg"
          },
          {
            "@category": "high",
            "@height": "1386",
            "@width": "2333",
            "@_fa": "true",
            "$": "https://api.elsevier.com/content/object/eid/1-s2.0-S0926860X14005262-gr7_lrg.jpg?httpAccept=%2A%2F%2A",
            "@multimediatype": "JPEG image file",
            "@type": "IMAGE-HIGH-RES",
            "@size": "238257",
            "@ref": "gr7",
            "@mimetype": "image/jpeg"
          },
          {
            "@category": "high",
            "@height": "1151",
            "@width": "1667",
            "@_fa": "true",
            "$": "https://api.elsevier.com/content/object/eid/1-s2.0-S0926860X14005262-gr8_lrg.jpg?httpAccept=%2A%2F%2A",
            "@multimediatype": "JPEG image file",
            "@type": "IMAGE-HIGH-RES",
            "@size": "196889",
            "@ref": "gr8",
            "@mimetype": "image/jpeg"
          },
          {
            "@category": "standard",
            "@_fa": "true",
            "$": "https://api.elsevier.com/content/object/eid/1-s2.0-S0926860X14005262-mmc1.docx?httpAccept=%2A%2F%2A",
            "@multimediatype": "Microsoft Word file",
            "@type": "APPLICATION",
            "@size": "1188520",
            "@ref": "mmc1",
            "@mimetype": "application/word"
          },
          {
            "@category": "thumbnail",
            "@height": "21",
            "@width": "128",
            "@_fa": "true",
            "$": "https://api.elsevier.com/content/object/eid/1-s2.0-S0926860X14005262-si1.gif?httpAccept=%2A%2F%2A",
            "@multimediatype": "GIF image file",
            "@type": "ALTIMG",
            "@size": "605",
            "@ref": "si1",
            "@mimetype": "image/gif"
          },
          {
            "@category": "thumbnail",
            "@height": "22",
            "@width": "125",
            "@_fa": "true",
            "$": "https://api.elsevier.com/content/object/eid/1-s2.0-S0926860X14005262-si5.gif?httpAccept=%2A%2F%2A",
            "@multimediatype": "GIF image file",
            "@type": "ALTIMG",
            "@size": "589",
            "@ref": "si5",
            "@mimetype": "image/gif"
          }
        ]
      },
      "link": {
        "@rel": "abstract",
        "@href": "https://api.elsevier.com/content/abstract/scopus_id/84909606443"
      }
    }
  }
}