{
  "metadata": {
    "title": "Self-coupling of secondary alcohols by Ni/CeO<ce:inf loc=post>2</ce:inf> catalyst",
    "authors": "; ; ",
    "journal": "Applied Catalysis A: General",
    "date": "2013-07-10",
    "doi": "10.1016/j.apcata.2013.04.040",
    "abstract": "",
    "uri": "https://api.elsevier.com/content/article/pii/S0926860X13002603",
    "pii": "S0926860X13002603"
  },
  "fulltext": {
    "full-text-retrieval-response": {
      "scopus-eid": "2-s2.0-84878401333",
      "originalText": "serial JL 271346 291210 291744 291809 31 Applied Catalysis A: General APPLIEDCATALYSISAGENERAL 2013-05-13 2013-05-13 2014-09-30T21:12:29 1-s2.0-S0926860X13002603 S0926-860X(13)00260-3 S0926860X13002603 10.1016/j.apcata.2013.04.040 S300 S300.2 FULL-TEXT 1-s2.0-S0926860X13X00109 2024-01-01T12:29:14.622205Z 0 0 20130710 2013 2013-05-13T00:00:00Z absattachment articleinfo articletitlenorm authfirstinitialnorm authfirstsurnamenorm cid cids contenttype copyright crossmark dateloaded dateloadedtxt datesearch datesort dateupdated dco docsubtype doctype doi eid ewtransactionid hubeid indexeddate issn issnnorm itemstage itemtransactionid itemweight openaccess openarchive pg pgfirst pglast pii piinorm pubdatestart pubdatetxt pubyr sectiontitle sortorder srctitle srctitlenorm srctype ssids alllist content subj subheadings suppl tomb volfirst volissue volumelist webpdf webpdfpagecount yearnav figure table body acknowledge affil articletitle auth authfirstini authfull authkeywords authlast grantsponsor highlightsabst primabst ref specialabst 0926-860X 0926860X true 462 463 462 463 C Volumes 462–463 20 137 142 137 142 20130710 10 July 2013 2013-07-10 2013 Articles article fla Copyright © 2013 Elsevier B.V. All rights reserved. SELFCOUPLINGSECONDARYALCOHOLSBYNICEO2CATALYST SHIMURA K 1 Introduction 2 Experimental 2.1 Catalyst preparation 2.2 Characterization 2.3 Typical procedures of catalytic reactions 3 Results and discussion 3.1 Structure of Ni/CeO2 3.2 Catalytic performance and structure-activity relationship 3.3 Reaction pathway 4 Conclusions Acknowledgments References HAMID 2007 1555 1575 M GUILLENA 2007 2358 2364 G NIXON 2009 753 762 T DOBEREINER 2010 681 703 G CHO 2003 3608 3610 C MARTINEZ 2006 8982 8987 R VICIANO 2007 6050 6054 M PRADES 2008 4254 4259 A CHANG 2012 1450 1455 X ADAIR 2005 8233 8235 G CHEUNG 2008 2975 2983 H GNANAMGARI 2008 4442 4445 D GNANAMGARI 2009 321 325 D FUJITA 2005 4017 4019 K DACOSTA 2008 1305 1309 A DACOSTA 2009 6960 6966 A GONG 2011 5596 5600 X XU 2011 6499 6502 C MATSUURA 2006 8306 8308 T KODA 2009 838 839 K OBORA 2011 8618 8622 Y KOSE 2010 896 900 O CARLINI 2003 721 728 C CARLINI 2004 65 70 C MIURA 2011 11146 11151 T LIAO 2012 2973 2978 S TANG 2011 1918 1922 G YANG 2012 328 334 J CHO 2005 1611 1613 C CANO 2012 7628 7630 R SHIMIZU 2009 3982 3986 K CARLINI 2002 273 280 C CARLINI 2003 137 146 C COSIMO 2002 114 123 J ELMOLLA 2006 103 108 S TORRES 2007 161 170 G CARLINI 2003 409 418 C CARLINI 2005 13 20 C COSIMO 2000 261 275 J NDOU 2003 337 345 A NDOU 2004 103 110 A TSUCHIDA 2006 8634 8642 T TSUCHIDA 2008 183 189 T OGO 2011 188 195 S OGO 2012 24 30 S LEON 2011 436 442 M LEON 2011 590 599 M ALLEN 2010 1362 1364 L SHIMURA 2012 2983 2985 K HUANG 1992 10005 10010 M SHIMIZU 2013 112 117 K SHIMURAX2013X137 SHIMURAX2013X137X142 SHIMURAX2013X137XK SHIMURAX2013X137X142XK item S0926-860X(13)00260-3 S0926860X13002603 1-s2.0-S0926860X13002603 10.1016/j.apcata.2013.04.040 271346 2024-01-01T12:29:14.622205Z 2013-07-10 1-s2.0-S0926860X13002603-main.pdf https://s3.amazonaws.com/prod-ucs-content-store-us-east/content/pii:S0926860X13002603/MAIN/application/pdf/0c4e3a6dcc7a421b31acab10a449a123/main.pdf https://s3-eu-west-1.amazonaws.com/prod-ucs-content-store-eu-west/content/pii:S0926860X13002603/MAIN/application/pdf/0c4e3a6dcc7a421b31acab10a449a123/main.pdf main.pdf pdf true 982401 MAIN 6 1-s2.0-S0926860X13002603-main_1.png https://s3-eu-west-1.amazonaws.com/prod-ucs-content-store-eu-west/content/pii:S0926860X13002603/PREVIEW/image/png/88b1e9e88ddb791ceef20780e067690e/main_1.png https://s3.amazonaws.com/prod-ucs-content-store-us-east/content/pii:S0926860X13002603/PREVIEW/image/png/88b1e9e88ddb791ceef20780e067690e/main_1.png main_1.png png 61628 849 656 IMAGE-WEB-PDF 1 1-s2.0-S0926860X13002603-gr7_lrg.jpg https://s3.amazonaws.com/prod-ucs-content-store-us-east/content/pii:S0926860X13002603/gr7/HIGHRES/image/jpeg/9fd0cdafcf4c38687d2a529818a19392/gr7_lrg.jpg https://s3-eu-west-1.amazonaws.com/prod-ucs-content-store-eu-west/content/pii:S0926860X13002603/gr7/HIGHRES/image/jpeg/9fd0cdafcf4c38687d2a529818a19392/gr7_lrg.jpg gr7 gr7_lrg.jpg jpg 107492 726 1620 IMAGE-HIGH-RES 1-s2.0-S0926860X13002603-gr6_lrg.jpg https://s3.amazonaws.com/prod-ucs-content-store-us-east/content/pii:S0926860X13002603/gr6/HIGHRES/image/jpeg/9ec4f02b157a9b1db4891174b9f92eb4/gr6_lrg.jpg https://s3-eu-west-1.amazonaws.com/prod-ucs-content-store-eu-west/content/pii:S0926860X13002603/gr6/HIGHRES/image/jpeg/9ec4f02b157a9b1db4891174b9f92eb4/gr6_lrg.jpg gr6 gr6_lrg.jpg jpg 117330 1047 1417 IMAGE-HIGH-RES 1-s2.0-S0926860X13002603-gr5_lrg.jpg https://s3.amazonaws.com/prod-ucs-content-store-us-east/content/pii:S0926860X13002603/gr5/HIGHRES/image/jpeg/0f086b7eacd9b92e583c7f22e757cf29/gr5_lrg.jpg https://s3-eu-west-1.amazonaws.com/prod-ucs-content-store-eu-west/content/pii:S0926860X13002603/gr5/HIGHRES/image/jpeg/0f086b7eacd9b92e583c7f22e757cf29/gr5_lrg.jpg gr5 gr5_lrg.jpg jpg 149913 1130 1500 IMAGE-HIGH-RES 1-s2.0-S0926860X13002603-gr4_lrg.jpg https://s3.amazonaws.com/prod-ucs-content-store-us-east/content/pii:S0926860X13002603/gr4/HIGHRES/image/jpeg/65eb91dee2650f81df7aecb0b28a4428/gr4_lrg.jpg https://s3-eu-west-1.amazonaws.com/prod-ucs-content-store-eu-west/content/pii:S0926860X13002603/gr4/HIGHRES/image/jpeg/65eb91dee2650f81df7aecb0b28a4428/gr4_lrg.jpg gr4 gr4_lrg.jpg jpg 106227 1067 1417 IMAGE-HIGH-RES 1-s2.0-S0926860X13002603-gr3_lrg.jpg https://s3.amazonaws.com/prod-ucs-content-store-us-east/content/pii:S0926860X13002603/gr3/HIGHRES/image/jpeg/6665baa25ff535e2694a8d992332bf26/gr3_lrg.jpg https://s3-eu-west-1.amazonaws.com/prod-ucs-content-store-eu-west/content/pii:S0926860X13002603/gr3/HIGHRES/image/jpeg/6665baa25ff535e2694a8d992332bf26/gr3_lrg.jpg gr3 gr3_lrg.jpg jpg 126618 1071 1417 IMAGE-HIGH-RES 1-s2.0-S0926860X13002603-gr2_lrg.jpg https://s3.amazonaws.com/prod-ucs-content-store-us-east/content/pii:S0926860X13002603/gr2/HIGHRES/image/jpeg/74d00a54c07bc28bb5fa5e492d6ccc75/gr2_lrg.jpg https://s3-eu-west-1.amazonaws.com/prod-ucs-content-store-eu-west/content/pii:S0926860X13002603/gr2/HIGHRES/image/jpeg/74d00a54c07bc28bb5fa5e492d6ccc75/gr2_lrg.jpg gr2 gr2_lrg.jpg jpg 206013 1516 1333 IMAGE-HIGH-RES 1-s2.0-S0926860X13002603-gr1_lrg.jpg https://s3.amazonaws.com/prod-ucs-content-store-us-east/content/pii:S0926860X13002603/gr1/HIGHRES/image/jpeg/cac8aa9d9e5306d1a840a871f8919013/gr1_lrg.jpg https://s3-eu-west-1.amazonaws.com/prod-ucs-content-store-eu-west/content/pii:S0926860X13002603/gr1/HIGHRES/image/jpeg/cac8aa9d9e5306d1a840a871f8919013/gr1_lrg.jpg gr1 gr1_lrg.jpg jpg 337719 1535 2513 IMAGE-HIGH-RES 1-s2.0-S0926860X13002603-fx7_lrg.jpg https://s3.amazonaws.com/prod-ucs-content-store-us-east/content/pii:S0926860X13002603/fx7/HIGHRES/image/jpeg/6941cdd17c7228eac85ac5dbdd23694f/fx7_lrg.jpg https://s3-eu-west-1.amazonaws.com/prod-ucs-content-store-eu-west/content/pii:S0926860X13002603/fx7/HIGHRES/image/jpeg/6941cdd17c7228eac85ac5dbdd23694f/fx7_lrg.jpg fx7 fx7_lrg.jpg jpg 49345 261 2213 IMAGE-HIGH-RES 1-s2.0-S0926860X13002603-fx6_lrg.jpg https://s3.amazonaws.com/prod-ucs-content-store-us-east/content/pii:S0926860X13002603/fx6/HIGHRES/image/jpeg/5a75127aa79dae28894d9765c8c6caad/fx6_lrg.jpg https://s3-eu-west-1.amazonaws.com/prod-ucs-content-store-eu-west/content/pii:S0926860X13002603/fx6/HIGHRES/image/jpeg/5a75127aa79dae28894d9765c8c6caad/fx6_lrg.jpg fx6 fx6_lrg.jpg jpg 85420 555 2213 IMAGE-HIGH-RES 1-s2.0-S0926860X13002603-fx5_lrg.jpg https://s3.amazonaws.com/prod-ucs-content-store-us-east/content/pii:S0926860X13002603/fx5/HIGHRES/image/jpeg/397a3620c833e885c3703d7621d40f94/fx5_lrg.jpg https://s3-eu-west-1.amazonaws.com/prod-ucs-content-store-eu-west/content/pii:S0926860X13002603/fx5/HIGHRES/image/jpeg/397a3620c833e885c3703d7621d40f94/fx5_lrg.jpg fx5 fx5_lrg.jpg jpg 59491 235 2213 IMAGE-HIGH-RES 1-s2.0-S0926860X13002603-fx4_lrg.jpg https://s3.amazonaws.com/prod-ucs-content-store-us-east/content/pii:S0926860X13002603/fx4/HIGHRES/image/jpeg/1397ba1ec29fdb09b022eb3ed89b2b28/fx4_lrg.jpg https://s3-eu-west-1.amazonaws.com/prod-ucs-content-store-eu-west/content/pii:S0926860X13002603/fx4/HIGHRES/image/jpeg/1397ba1ec29fdb09b022eb3ed89b2b28/fx4_lrg.jpg fx4 fx4_lrg.jpg jpg 104133 449 2213 IMAGE-HIGH-RES 1-s2.0-S0926860X13002603-fx3_lrg.jpg https://s3.amazonaws.com/prod-ucs-content-store-us-east/content/pii:S0926860X13002603/fx3/HIGHRES/image/jpeg/1e518eb4872d835676dc769363eb808b/fx3_lrg.jpg https://s3-eu-west-1.amazonaws.com/prod-ucs-content-store-eu-west/content/pii:S0926860X13002603/fx3/HIGHRES/image/jpeg/1e518eb4872d835676dc769363eb808b/fx3_lrg.jpg fx3 fx3_lrg.jpg jpg 90626 498 2213 IMAGE-HIGH-RES 1-s2.0-S0926860X13002603-fx2_lrg.jpg https://s3.amazonaws.com/prod-ucs-content-store-us-east/content/pii:S0926860X13002603/fx2/HIGHRES/image/jpeg/0e4853c187d565d73f1bed42ee2c4b82/fx2_lrg.jpg https://s3-eu-west-1.amazonaws.com/prod-ucs-content-store-eu-west/content/pii:S0926860X13002603/fx2/HIGHRES/image/jpeg/0e4853c187d565d73f1bed42ee2c4b82/fx2_lrg.jpg fx2 fx2_lrg.jpg jpg 82961 394 2213 IMAGE-HIGH-RES 1-s2.0-S0926860X13002603-fx1_lrg.jpg https://s3.amazonaws.com/prod-ucs-content-store-us-east/content/pii:S0926860X13002603/fx1/HIGHRES/image/jpeg/23b24bab1502cb85759e905236df286c/fx1_lrg.jpg https://s3-eu-west-1.amazonaws.com/prod-ucs-content-store-eu-west/content/pii:S0926860X13002603/fx1/HIGHRES/image/jpeg/23b24bab1502cb85759e905236df286c/fx1_lrg.jpg fx1 true fx1_lrg.jpg jpg 133246 886 2013 IMAGE-HIGH-RES 1-s2.0-S0926860X13002603-gr7.jpg https://s3.amazonaws.com/prod-ucs-content-store-us-east/content/pii:S0926860X13002603/gr7/DOWNSAMPLED/image/jpeg/4d7d89f047d2c43da097984426853063/gr7.jpg https://s3-eu-west-1.amazonaws.com/prod-ucs-content-store-eu-west/content/pii:S0926860X13002603/gr7/DOWNSAMPLED/image/jpeg/4d7d89f047d2c43da097984426853063/gr7.jpg gr7 gr7.jpg jpg 13353 164 366 IMAGE-DOWNSAMPLED 1-s2.0-S0926860X13002603-gr6.jpg https://s3.amazonaws.com/prod-ucs-content-store-us-east/content/pii:S0926860X13002603/gr6/DOWNSAMPLED/image/jpeg/af4d1716e300a93374889351ea520387/gr6.jpg https://s3-eu-west-1.amazonaws.com/prod-ucs-content-store-eu-west/content/pii:S0926860X13002603/gr6/DOWNSAMPLED/image/jpeg/af4d1716e300a93374889351ea520387/gr6.jpg gr6 gr6.jpg jpg 15189 236 320 IMAGE-DOWNSAMPLED 1-s2.0-S0926860X13002603-gr5.jpg https://s3.amazonaws.com/prod-ucs-content-store-us-east/content/pii:S0926860X13002603/gr5/DOWNSAMPLED/image/jpeg/a1a02e5c88df909856a782d593a2dce6/gr5.jpg https://s3-eu-west-1.amazonaws.com/prod-ucs-content-store-eu-west/content/pii:S0926860X13002603/gr5/DOWNSAMPLED/image/jpeg/a1a02e5c88df909856a782d593a2dce6/gr5.jpg gr5 gr5.jpg jpg 20108 255 339 IMAGE-DOWNSAMPLED 1-s2.0-S0926860X13002603-gr4.jpg https://s3.amazonaws.com/prod-ucs-content-store-us-east/content/pii:S0926860X13002603/gr4/DOWNSAMPLED/image/jpeg/6e12fd2db0b761ffd03284d38c864f8c/gr4.jpg https://s3-eu-west-1.amazonaws.com/prod-ucs-content-store-eu-west/content/pii:S0926860X13002603/gr4/DOWNSAMPLED/image/jpeg/6e12fd2db0b761ffd03284d38c864f8c/gr4.jpg gr4 gr4.jpg jpg 14085 241 320 IMAGE-DOWNSAMPLED 1-s2.0-S0926860X13002603-gr3.jpg https://s3.amazonaws.com/prod-ucs-content-store-us-east/content/pii:S0926860X13002603/gr3/DOWNSAMPLED/image/jpeg/865f428ce6cba019f9de7d5565bfe3af/gr3.jpg https://s3-eu-west-1.amazonaws.com/prod-ucs-content-store-eu-west/content/pii:S0926860X13002603/gr3/DOWNSAMPLED/image/jpeg/865f428ce6cba019f9de7d5565bfe3af/gr3.jpg gr3 gr3.jpg jpg 16774 242 320 IMAGE-DOWNSAMPLED 1-s2.0-S0926860X13002603-gr2.jpg https://s3.amazonaws.com/prod-ucs-content-store-us-east/content/pii:S0926860X13002603/gr2/DOWNSAMPLED/image/jpeg/8d4a8d37bcc81cf7b723bea4b469a9f0/gr2.jpg https://s3-eu-west-1.amazonaws.com/prod-ucs-content-store-eu-west/content/pii:S0926860X13002603/gr2/DOWNSAMPLED/image/jpeg/8d4a8d37bcc81cf7b723bea4b469a9f0/gr2.jpg gr2 gr2.jpg jpg 27389 342 301 IMAGE-DOWNSAMPLED 1-s2.0-S0926860X13002603-gr1.jpg https://s3.amazonaws.com/prod-ucs-content-store-us-east/content/pii:S0926860X13002603/gr1/DOWNSAMPLED/image/jpeg/f58ba6990e803fd7d6178712d20de5e4/gr1.jpg https://s3-eu-west-1.amazonaws.com/prod-ucs-content-store-eu-west/content/pii:S0926860X13002603/gr1/DOWNSAMPLED/image/jpeg/f58ba6990e803fd7d6178712d20de5e4/gr1.jpg gr1 gr1.jpg jpg 43317 346 567 IMAGE-DOWNSAMPLED 1-s2.0-S0926860X13002603-fx7.jpg https://s3.amazonaws.com/prod-ucs-content-store-us-east/content/pii:S0926860X13002603/fx7/DOWNSAMPLED/image/jpeg/a243afc00cd691ff018c692820c150ab/fx7.jpg https://s3-eu-west-1.amazonaws.com/prod-ucs-content-store-eu-west/content/pii:S0926860X13002603/fx7/DOWNSAMPLED/image/jpeg/a243afc00cd691ff018c692820c150ab/fx7.jpg fx7 fx7.jpg jpg 7068 59 500 IMAGE-DOWNSAMPLED 1-s2.0-S0926860X13002603-fx6.jpg https://s3.amazonaws.com/prod-ucs-content-store-us-east/content/pii:S0926860X13002603/fx6/DOWNSAMPLED/image/jpeg/dab5bcf0b2caf03c2cccd5f9301c51db/fx6.jpg https://s3-eu-west-1.amazonaws.com/prod-ucs-content-store-eu-west/content/pii:S0926860X13002603/fx6/DOWNSAMPLED/image/jpeg/dab5bcf0b2caf03c2cccd5f9301c51db/fx6.jpg fx6 fx6.jpg jpg 11646 125 500 IMAGE-DOWNSAMPLED 1-s2.0-S0926860X13002603-fx5.jpg https://s3.amazonaws.com/prod-ucs-content-store-us-east/content/pii:S0926860X13002603/fx5/DOWNSAMPLED/image/jpeg/10b499498712c0a076bfb6d070fb20d7/fx5.jpg https://s3-eu-west-1.amazonaws.com/prod-ucs-content-store-eu-west/content/pii:S0926860X13002603/fx5/DOWNSAMPLED/image/jpeg/10b499498712c0a076bfb6d070fb20d7/fx5.jpg fx5 fx5.jpg jpg 8047 53 500 IMAGE-DOWNSAMPLED 1-s2.0-S0926860X13002603-fx4.jpg https://s3.amazonaws.com/prod-ucs-content-store-us-east/content/pii:S0926860X13002603/fx4/DOWNSAMPLED/image/jpeg/3826d2c07f3dfcb328d72dcd73af6d2f/fx4.jpg https://s3-eu-west-1.amazonaws.com/prod-ucs-content-store-eu-west/content/pii:S0926860X13002603/fx4/DOWNSAMPLED/image/jpeg/3826d2c07f3dfcb328d72dcd73af6d2f/fx4.jpg fx4 fx4.jpg jpg 14070 101 500 IMAGE-DOWNSAMPLED 1-s2.0-S0926860X13002603-fx3.jpg https://s3.amazonaws.com/prod-ucs-content-store-us-east/content/pii:S0926860X13002603/fx3/DOWNSAMPLED/image/jpeg/af6023a835fc1ed01ea095c8d06552ed/fx3.jpg https://s3-eu-west-1.amazonaws.com/prod-ucs-content-store-eu-west/content/pii:S0926860X13002603/fx3/DOWNSAMPLED/image/jpeg/af6023a835fc1ed01ea095c8d06552ed/fx3.jpg fx3 fx3.jpg jpg 12608 113 500 IMAGE-DOWNSAMPLED 1-s2.0-S0926860X13002603-fx2.jpg https://s3.amazonaws.com/prod-ucs-content-store-us-east/content/pii:S0926860X13002603/fx2/DOWNSAMPLED/image/jpeg/15e5fd4b1688744907f0853de24be729/fx2.jpg https://s3-eu-west-1.amazonaws.com/prod-ucs-content-store-eu-west/content/pii:S0926860X13002603/fx2/DOWNSAMPLED/image/jpeg/15e5fd4b1688744907f0853de24be729/fx2.jpg fx2 fx2.jpg jpg 12126 89 500 IMAGE-DOWNSAMPLED 1-s2.0-S0926860X13002603-fx1.jpg https://s3.amazonaws.com/prod-ucs-content-store-us-east/content/pii:S0926860X13002603/fx1/DOWNSAMPLED/image/jpeg/c4caca60fa1350a4fd0ca9a022009f60/fx1.jpg https://s3-eu-west-1.amazonaws.com/prod-ucs-content-store-eu-west/content/pii:S0926860X13002603/fx1/DOWNSAMPLED/image/jpeg/c4caca60fa1350a4fd0ca9a022009f60/fx1.jpg fx1 true fx1.jpg jpg 17347 200 454 IMAGE-DOWNSAMPLED 1-s2.0-S0926860X13002603-gr7.sml https://s3.amazonaws.com/prod-ucs-content-store-us-east/content/pii:S0926860X13002603/gr7/THUMBNAIL/image/gif/2f8831917dbfd2a01fe5b7e2a85bf5e3/gr7.sml https://s3-eu-west-1.amazonaws.com/prod-ucs-content-store-eu-west/content/pii:S0926860X13002603/gr7/THUMBNAIL/image/gif/2f8831917dbfd2a01fe5b7e2a85bf5e3/gr7.sml gr7 gr7.sml sml 3455 98 219 IMAGE-THUMBNAIL 1-s2.0-S0926860X13002603-gr6.sml https://s3.amazonaws.com/prod-ucs-content-store-us-east/content/pii:S0926860X13002603/gr6/THUMBNAIL/image/gif/f409540b8caadd3912159878178fc272/gr6.sml https://s3-eu-west-1.amazonaws.com/prod-ucs-content-store-eu-west/content/pii:S0926860X13002603/gr6/THUMBNAIL/image/gif/f409540b8caadd3912159878178fc272/gr6.sml gr6 gr6.sml sml 4599 162 219 IMAGE-THUMBNAIL 1-s2.0-S0926860X13002603-gr5.sml https://s3.amazonaws.com/prod-ucs-content-store-us-east/content/pii:S0926860X13002603/gr5/THUMBNAIL/image/gif/13b9a7d89cd5523a02a3453dd2e19ee2/gr5.sml https://s3-eu-west-1.amazonaws.com/prod-ucs-content-store-eu-west/content/pii:S0926860X13002603/gr5/THUMBNAIL/image/gif/13b9a7d89cd5523a02a3453dd2e19ee2/gr5.sml gr5 gr5.sml sml 5120 164 218 IMAGE-THUMBNAIL 1-s2.0-S0926860X13002603-gr4.sml https://s3.amazonaws.com/prod-ucs-content-store-us-east/content/pii:S0926860X13002603/gr4/THUMBNAIL/image/gif/58ad5e4a7606512fe57e007900c5c00b/gr4.sml https://s3-eu-west-1.amazonaws.com/prod-ucs-content-store-eu-west/content/pii:S0926860X13002603/gr4/THUMBNAIL/image/gif/58ad5e4a7606512fe57e007900c5c00b/gr4.sml gr4 gr4.sml sml 4292 164 218 IMAGE-THUMBNAIL 1-s2.0-S0926860X13002603-gr3.sml https://s3.amazonaws.com/prod-ucs-content-store-us-east/content/pii:S0926860X13002603/gr3/THUMBNAIL/image/gif/65030eece154c98683a7e0162edf3b51/gr3.sml https://s3-eu-west-1.amazonaws.com/prod-ucs-content-store-eu-west/content/pii:S0926860X13002603/gr3/THUMBNAIL/image/gif/65030eece154c98683a7e0162edf3b51/gr3.sml gr3 gr3.sml sml 4919 164 217 IMAGE-THUMBNAIL 1-s2.0-S0926860X13002603-gr2.sml https://s3.amazonaws.com/prod-ucs-content-store-us-east/content/pii:S0926860X13002603/gr2/THUMBNAIL/image/gif/7ccf7d5f60beb43a0337b20e18402c5f/gr2.sml https://s3-eu-west-1.amazonaws.com/prod-ucs-content-store-eu-west/content/pii:S0926860X13002603/gr2/THUMBNAIL/image/gif/7ccf7d5f60beb43a0337b20e18402c5f/gr2.sml gr2 gr2.sml sml 4739 164 144 IMAGE-THUMBNAIL 1-s2.0-S0926860X13002603-gr1.sml https://s3.amazonaws.com/prod-ucs-content-store-us-east/content/pii:S0926860X13002603/gr1/THUMBNAIL/image/gif/69d17576985bb2a9572bd8c8e2d80795/gr1.sml https://s3-eu-west-1.amazonaws.com/prod-ucs-content-store-eu-west/content/pii:S0926860X13002603/gr1/THUMBNAIL/image/gif/69d17576985bb2a9572bd8c8e2d80795/gr1.sml gr1 gr1.sml sml 5169 134 219 IMAGE-THUMBNAIL 1-s2.0-S0926860X13002603-fx7.sml https://s3.amazonaws.com/prod-ucs-content-store-us-east/content/pii:S0926860X13002603/fx7/THUMBNAIL/image/gif/da5873c1666c3eb4b36632778909348f/fx7.sml https://s3-eu-west-1.amazonaws.com/prod-ucs-content-store-eu-west/content/pii:S0926860X13002603/fx7/THUMBNAIL/image/gif/da5873c1666c3eb4b36632778909348f/fx7.sml fx7 fx7.sml sml 1751 26 219 IMAGE-THUMBNAIL 1-s2.0-S0926860X13002603-fx6.sml https://s3.amazonaws.com/prod-ucs-content-store-us-east/content/pii:S0926860X13002603/fx6/THUMBNAIL/image/gif/a46806c4b34c2a8035d897b6fe956ce1/fx6.sml https://s3-eu-west-1.amazonaws.com/prod-ucs-content-store-eu-west/content/pii:S0926860X13002603/fx6/THUMBNAIL/image/gif/a46806c4b34c2a8035d897b6fe956ce1/fx6.sml fx6 fx6.sml sml 2613 55 219 IMAGE-THUMBNAIL 1-s2.0-S0926860X13002603-fx5.sml https://s3.amazonaws.com/prod-ucs-content-store-us-east/content/pii:S0926860X13002603/fx5/THUMBNAIL/image/gif/14a560d272e307e0682da292e5a3a29e/fx5.sml https://s3-eu-west-1.amazonaws.com/prod-ucs-content-store-eu-west/content/pii:S0926860X13002603/fx5/THUMBNAIL/image/gif/14a560d272e307e0682da292e5a3a29e/fx5.sml fx5 fx5.sml sml 1773 23 219 IMAGE-THUMBNAIL 1-s2.0-S0926860X13002603-fx4.sml https://s3.amazonaws.com/prod-ucs-content-store-us-east/content/pii:S0926860X13002603/fx4/THUMBNAIL/image/gif/5b3df08d2fe01246b603965a10550767/fx4.sml https://s3-eu-west-1.amazonaws.com/prod-ucs-content-store-eu-west/content/pii:S0926860X13002603/fx4/THUMBNAIL/image/gif/5b3df08d2fe01246b603965a10550767/fx4.sml fx4 fx4.sml sml 2590 44 219 IMAGE-THUMBNAIL 1-s2.0-S0926860X13002603-fx3.sml https://s3.amazonaws.com/prod-ucs-content-store-us-east/content/pii:S0926860X13002603/fx3/THUMBNAIL/image/gif/aa59923f3bbbda124842b4487cd340c8/fx3.sml https://s3-eu-west-1.amazonaws.com/prod-ucs-content-store-eu-west/content/pii:S0926860X13002603/fx3/THUMBNAIL/image/gif/aa59923f3bbbda124842b4487cd340c8/fx3.sml fx3 fx3.sml sml 2438 49 219 IMAGE-THUMBNAIL 1-s2.0-S0926860X13002603-fx2.sml https://s3.amazonaws.com/prod-ucs-content-store-us-east/content/pii:S0926860X13002603/fx2/THUMBNAIL/image/gif/021728124fc5a7b3809914c98e464c9f/fx2.sml https://s3-eu-west-1.amazonaws.com/prod-ucs-content-store-eu-west/content/pii:S0926860X13002603/fx2/THUMBNAIL/image/gif/021728124fc5a7b3809914c98e464c9f/fx2.sml fx2 fx2.sml sml 2405 39 219 IMAGE-THUMBNAIL 1-s2.0-S0926860X13002603-fx1.sml https://s3.amazonaws.com/prod-ucs-content-store-us-east/content/pii:S0926860X13002603/fx1/THUMBNAIL/image/gif/f2219c039a6a54164c4179536648f93c/fx1.sml https://s3-eu-west-1.amazonaws.com/prod-ucs-content-store-eu-west/content/pii:S0926860X13002603/fx1/THUMBNAIL/image/gif/f2219c039a6a54164c4179536648f93c/fx1.sml fx1 true fx1.sml sml 3440 96 219 IMAGE-THUMBNAIL APCATA 14213 S0926-860X(13)00260-3 10.1016/j.apcata.2013.04.040 Elsevier B.V. Fig. 1 (A) Ni K-edge XANES spectra and (B) the Fourier transforms of EXAFS spectra: (a) NiO, (b)–(f) 5wt% Ni/CeO2 reduced at various temperature and (g) Ni foil. Reduction temperature was (b) 200, (c) 250, (d) 300, (e) 350 and (f) 400°C. Fig. 2 Effects of catalyst reduction temperature on (A) the fraction of metallic Ni or NiO species (from XANES analysis) and (B) conversion of 2-octanol and yields of dimers (1a and 2a) and 2-octanone for self-coupling of 2-octanol (T =140°C, t =4h) by 5wt% Ni/CeO2. Fig. 3 Effects of Ni content in Ni/CeO2 (reduced at 400°C) on conversion of 2-octanol and yields of dimers (1a and 2a) and 2-octanone for self-coupling of 2-octanol (T =140°C, t =4h). Fig. 4 Reaction rate for metal oxides-catalyzed Aldol condensation of 2, 5-hexanedione to 3-methyl-cyclopentenone as a function of electronegativity of the metal oxides (from Table 3). Fig. 5 (○) Yields of dimers (1a and 2a) for self-coupling of 2-octanol by 5wt% Ni-loaded catalysts (Table 2) and (▴) the number of basic sites estimated by CO2-TPD (from ref [51]) as a function of the electronegativity of support metal oxide. Fig. 6 Time course of the product yield for self-coupling of 2-octanol at 130°C by 3wt% Ni/CeO2 reduced at 300°C. Fig. 7 A possible catalytic cycle of self-coupling of secondary alcohols by Ni/CeO2. Table 1 Ni K-edge EXAFS analysis of CeO2-supported Ni (5wt%) samples. T H2 a /°C Shell N b R c /Å σ d /Å R f e /% – O 6.9 1.99 0.145 1.4 Ni 7.8 2.95 0.106 200 O 5.8 2.08 0.129 6.6 Ni 6.4 2.95 0.100 250 O 2.4 2.02 0.100 4.2 Ni 2.0 2.49 0.085 Ni 1.8 2.94 0.080 300 O 0.8 1.88 0.040 1.46 Ni 5.3 2.45 0.103 350 O 0.5 1.86 0.00 0.86 Ni 5.6 2.44 0.107 400 O 0.4 1.84 0.03 1.1 Ni 5.9 2.44 0.109 NiO f O 6 2.02 – – Ni 12 2.94 – – Ni f Ni 12 2.49 – – a Temperature of H2 reduction. b Coordination number. c Bond distance. d Debye-Waller factor. e Residual factor. f Crystallographic data of NiO and Ni metal. Table 2 Self-coupling of 2-octanol by 5wt% metal-loaded catalysts reduced at 500°C and Ni compounds. . Entry Catalyst Conv. (%) Yield (%) 2-Octanone Dimer 1a (2a) Trimer 1 Ni/CeO2 100 0 87 (11) 2 2 a Ni/CeO2 65 30 22 (6) 0 3 Ni/ZrO2 60 45 6 0 4 Ni/γ-Al2O3 74 56 5 0 5 Ni/TiO2 48 38 0 0 6 Ni/SiO2 49 40 0 0 7 Ni/C 38 31 1 0 8 NiO/CeO2 7 7 0 0 9 b CeO2 4 1 0 0 10 Ni powder 11 6 1 0 11 c Raney Ni 36 36 0 0 12 Ni2O3 4 4 0 0 13 NiO 2 1 0 0 14 Co/CeO2 96 27 55 (5) 1 15 Cu/CeO2 79 25 50 (3) 2 a Reaction time=4h. b CeO2 =35mg. c Ni=28mol%. Table 3 Aldol-condensation of 2,5-hexanedione by MO x . Catalyst a t/h Conv./% Yield/% Rate/mmolh−1 g−1 CeO2 1 27 16 3.2 ZrO2 2 15 8 0.8 γ-Al2O3 2 13 5 0.5 TiO2 6 12 2 0.07 SiO2 18 8 1 0.01 a Catalysts were heated in a flow of N2 at 500°C for 0.5h before reaction. Table 4 Self-coupling of secondary alcohols by 3wt% Ni/CeO2 pre-reduced at 300°C. . Entry Substrate T/°C t/h Conv.(%) Yield (%) Ketone Dimer Trimer 1 2 1 2-Octanol 130 20 > 99 0 94 5 1 2 a 130 20 > 99 1 94 4 1 3 b 130 20 > 99 0 94 4 2 4 c 2-Hexanol 144 d 36 99 0 71 8 11 5 2-butanol 144 d 24 99 3 60 14 12 6 c 3-Methyl-2-butanol 144 d 36 99 1 72 11 9 7 Cyclopentanol 80 24 >99 0 19 58 19 8 2-Propanol 120 20 99 2 21 19 30 a Reuse 1. b Reuse 2. c 1wt% Ni/CeO2 reduced at 300°C was used. d Reflux conditions. Bath temperature was 160°C. Self-coupling of secondary alcohols by Ni/CeO2 catalyst Katsuya Shimura a Kenichi Kon a S.M.A. Hakim Siddiki b Ken-ichi Shimizu a b ⁎ a Catalysis Research Center, Hokkaido University, N-21, W-10, Sapporo 001-0021, Japan Catalysis Research Center Hokkaido University N-21 W-10 Sapporo 001-0021 Japan b Elements Strategy Initiative for Catalysts and Batteries, Kyoto University, Katsura, Kyoto 615-8520, Japan Elements Strategy Initiative for Catalysts and Batteries Kyoto University Katsura Kyoto 615-8520 Japan ⁎ Corresponding author at: Catalysis Research Center, Hokkaido University, N-21, W-10, Sapporo 001-0021, Japan. Fax: +81 11 706 9163. Graphical abstract Supported nickel catalysts are studied for the liquid phase CC self-coupling of aliphatic secondary alcohols under additive free conditions in N2 atmosphere. Among various Ni catalysts, 1 or 3wt% Ni/CeO2 catalysts pre-reduced in H2 shows highest yield (94%) of a dimer product (a higher ketone) for the self-coupling of 1-octanol at 130°C, and the catalyst is reused. The catalysts are also effective for self-coupling of various secondary alcohols, providing the first heterogeneous catalytic system for the self-coupling of secondary alcohols under mild conditions. Effects of support material and oxidation state of Ni on the activity are studied and it is found that both CeO2 and metallic Ni are indispensable for the reaction. A possible reaction mechanism is proposed, in which ketones, formed by dehydrogenation of alcohol, undergone Aldol condensation to give α,β-unsaturated ketone which is finally hydrogenated by in situ formed NiH species. Keywords CC bond formation Cerium oxide Hydrogen transfer Nickel 1 Introduction The construction of CC bonds is of fundamental importance in organic synthesis. Generally, the coupling of enolate derivatives with alkyl halides has been applied for this purpose. However, this method has some disadvantages such as the use of strong base, the large amount of weight lost with the leaving group of the alkylation agent (i.e. low atom efficiency) and the formation of undesirable waste. Recently, CC bond formation through the coupling of alcohols as cheap and readily available alkylation agents has attracted much attention [1–4], because it can give a catalytic method to produce chemicals from bio-alcohols. The reaction proceeds through a hydrogen-borrowing (or hydrogen autotransfer) mechanism, which consists of (1) dehydrogenation of alcohols to the corresponding carbonyl compounds, (2) Aldol condensation of them to form α,β-unsaturated carbonyl compounds, and (3) hydrogenation of the CC (and CO) bonds using the borrowed hydrogen atoms from alcohols. Only water is produced as byproducts, and the atom efficiency of this system is high. Various homogeneous (Ru [5–13], Ir [12–21], Pd [22–24], Cu [25,26], Ni [27] and Fe [28]) and heterogeneous (Pd [23,24,29], Ir [30], Ag [31], Cu [24,32–36], Ru [37], Rh [37,38], Ni [37,38] and basic oxides [39–47]) catalysts have been developed for this reaction. However, these systems suffered from problems such as high temperature (>200°C) [23,24,31–47], high reaction pressure (30–80atm) [23,24,32,33,37,38], high cost of noble metals [5–24,29–31,37,38] or needs of additives [5–33,37,48] such as hydrogen donor or acceptor, or base. Generally, the reported catalysts for the coupling of alcohols were not effective under additive free condition at low temperature. Importantly, previous reports on the self-coupling of secondary alcohols are limited [22,34–36]. Cu-based heterogeneous catalysts for self-coupling of 2-propanol to give methyl isobutyl ketone [34–36] are known, but these examples suffer from high temperature (>200°C) and low selectivity. A homogeneous Pd catalyst for self-coupling of 1-phenyethanol at low temperatures [22] was reported, but this system suffers from high catalyst cost and difficulties in catalyst reuse. From the environmental and economical point, it is desirable to develop cheap and recyclable heterogeneous catalysts for the coupling of secondary alcohols under mild and additive-free conditions. In the course of our recent findings [49] on the CeO2-supported Ni (Ni/CeO2) catalyzed transfer hydrogenation of ketones by 2-propanol we have discovered that that Ni/CeO2 acts as a recyclable heterogeneous catalyst for self-coupling of aliphatic secondary alcohols without any additives under relatively mild conditions. The structure-activity relationship and mechanistic aspects are also discussed to clarify the factors affecting the activity of this catalytic system. 2 Experimental 2.1 Catalyst preparation CeO2 (JRC-CEO-2) and TiO2 (JRC-TIO-4) were supplied from Catalysis Society of Japan. γ-Al2O3 was prepared by calcination of γ-AlOOH (Catapal B Alumina purchased from Sasol) at 900°C for 3h. ZrO2 was prepared by hydrolysis of zirconium oxynitrate 2-hydrate in distilled water by gradually adding an aqueous NH4OH solution (1.0moldm−3), filtration of precipitate, washing with distilled water three times, drying at 100°C, and calcining at 500°C. SiO2 (Q-10) was supplied from Fuji Silysia Chemical Ltd. C (active carbon) was purchased from Kishida Chemical Co., Ltd. Ni metal, NiO and Ni2O3 were purchased from Mitsuwa Chemical. Raney Ni (B113W, Ni >90%) was supplied from Evonik Industries. The catalyst precursor (named NiO/CeO2) was prepared by an impregnation method. A mixture of the support and an aqueous solution of Ni nitrates were evaporated at 50°C, followed by drying at 90°C for 12h, calcination in air at 350°C for 4h. Before catalytic experiments, the precursor (NiO/CeO2) was pre-reduced in a pyrex tube under a flow of H2 (20cm3 min−1) at a reduction temperature (T H2) for 0.5h. The specific surface area of 5wt% Ni/CeO2 was 69m2 g−1. 2.2 Characterization XRD patterns of the powdered catalysts were recorded with a Rigaku MiniFlex II/AP diffractometer with Cu Kα radiation. Specific surface area was obtained by measuring N2 adsorption at −196°C by BELCAT. Ni K-edge XAFS measurements were performed in a transmission mode at the BL01B1 in SPring-8 operated at 8GeV. A Si(111) single crystal was used to obtain a monochromatic X-ray beam. A pressed pellet of the pre-reduced Ni/CeO2 sample (Ni=5wt%) was placed in a quartz in situ cell in a flow of 100% H2 (100cm3 min−1) for 0.5h at each temperature under atmospheric pressure, then the sample was cooled to 40°C under a flow of He, and then a XAFS spectrum was obtained. The analysis of EXAFS was performed using the REX version 2.5 program (RIGAKU). The Fourier transformation of the k 3-weighted EXAFS oscillation from k space to r space was performed over the range 22–126nm−1 to obtain a radial distribution function. The inversely Fourier filtered data were analyzed with a usual curve fitting method in the k range of 22–126nm−1. The parameters for the NiO and NiNi shells have been provided by the FEFF6. 2.3 Typical procedures of catalytic reactions Commercially available organic compounds were used without further purification. Typically, 3 or 5wt% Ni/CeO2 (3mol% of Ni with respect to alcohol) was used in catalytic experiments. After the pre-reduction, we carried out catalytic tests without exposing the catalyst to air as follows. The mixture of o-xylene (1.5mL), alcohol (1mmol), and n-dodecane (0.5mmol) was injected to the pre-reduced catalyst inside a reactor (cylindrical glass tube) through a septum inlet. Then, the reactor was purged by N2 and set in a reaction vessel equipped with a condenser. The resulting mixture was stirred at 80–144°C. Conversion and yields of products were determined by GC using n-dodecane as an internal standard. The GC-FID (Shimadzu GC-14B) and GC–MS (Shimadzu GCMS-QP5000) analyses were carried out with a Rtx-65 capillary column (Shimadzu) using nitrogen or helium as the carrier gas. The products were identified by GC–MS and by comparison with commercially pure products. 3 Results and discussion 3.1 Structure of Ni/CeO2 The XRD spectrum of 5wt% Ni/CeO2 showed no peaks due to metallic Ni and NiO possibly due to high dispersion of Ni species. Thus, the structure of Ni species on the Ni/CeO2 catalysts was studied by Ni K-edge X-ray absorption near-edge structures (XANES) and extended X-ray absorption fine structure (EXAFS) shown in Fig. 1 . Table 1 shows the results of curve-fitting analyses of the EXAFS. The curve-fitting of the EXAFS of unreduced precursor, named NiO/CeO2, gave a NiO shell at 1.99Å with NiNi coordination number (N) of 6.9 and a NiNi shell at 2.95Å of N =7.8 (Table 1). By comparison with the crystallographic data of NiO, the EXAFS feature of NiO/CeO2 was assigned to NiO species. On the other hand, the EXAFS of the Ni/CeO2 catalyst reduced at 400°C consists of a NiNi shell at 2.44Å (N =5.9) with a weak NiO shell at 1.84Å (N =0.4). By comparison with the crystallographic data of Ni metal, the NiNi shell was assigned to metallic Ni. The NiNi coordination number (5.9) was smaller than that of Ni foil (12), indicating a small size of Ni metal nanoparticles on Ni/CeO2. The weak contribution of the NiO shell indicates the presence of NiO species as minor species. The EXAFS of the Ni/CeO2 catalyst reduced at a medium temperature (250°C) consists of characteristic features due to NiO (a NiO shell at 2.02Å with N =2.4 and a NiNi shell at 2.94Å with N =1.8) and a feature due to Ni metal (a NiNi shell at 2.49Å with N =2.0), which indicates the co-presence of NiO and Ni metal species. To estimate the fraction of Ni metal and NiO species in the catalysts, we carried out pattern fitting analysis of Ni K-edge XANES. We obtained the fractions of the Ni metal and NiO by the least-squares fitting of the XANES spectrum of the Ni/CeO2 sample with a linear combination of XANES spectra of Ni foil and NiO. The fraction of Ni metal and NiO species in each catalyst was plotted in Fig. 2A as a function of the reduction temperature. The fraction of metallic Ni increased with increase in the reduction temperature. 3.2 Catalytic performance and structure-activity relationship First, we compared the activity of various Ni(5wt%)-loaded catalysts pre-reduced at 500°C and Ni compounds for self-coupling of 2-octanol (Table 2 ). Among various Ni catalysts, Ni/CeO2 showed highest yield of dimer products (ketone 1a and alcohol 2a). In contrast, Ni-loaded ZrO2, γ-Al2O3, TiO2, SiO2 and active carbon catalyzed the dehydrogenation of 2-octanol to give 2-octanone as the main products (entries 3–7). Yield of the dimer products for Ni/CeO2 was much higher than those on other Ni-loaded catalysts even under a similar conversion level (38–74%, entries 2–7). Ni-loaded ZrO2, γ-Al2O3 or TiO2 catalysts pre-reduced at lower temperature (250°C) were also tested (not shown), but the yields of the dimers were below 8%. Cu/CeO2 and Co/CeO2 catalysts (entries 14,15) were less effective than Ni/CeO2 (entry 1). Commercially available Ni compounds (Ni powder, Raney Ni, Ni2O3 and NiO) were nearly ineffective for the self-coupling reaction (entries 10–13). The unreduced precursor (NiO/CeO2) and bare CeO2 showed no yield of the self-coupling products (entries 8, 9). Thus, CeO2 as well as metallic Ni is indispensable for the self-coupling reaction. Next, we optimized the preparation conditions of the 5wt% Ni/CeO2 catalyst. Fig. 2B shows the influence of hydrogen reduction temperature on the catalytic activity. The yield of dimers (self-coupling products) showed volcano-type dependence on the reduction temperature, and the reduction temperature of 250°C gave the highest activity. The XANES analysis showed that the Ni/NiO ratio of the catalyst reduced at 250°C was 48/52. At the reduction temperatures higher than 250°C, the dimer yield gradually decreased with increasing the reduction temperature but was still higher than those of the none-reduced NiO/CeO2 (dimer yield=0%). This shows that metallic Ni is indispensible and the co-existence of oxide one would promote the reaction. The decrease of the activity at reduction temperature more than 300°C would be due to the aggregation of Ni particles, since the fraction of Ni metal was almost constant in this temperature range. Influence of Ni content in Ni/CeO2 on the catalytic activity is shown in Fig. 3 . The Ni loading in a range 1–3wt% was found to be optimum, and the activity decreased at higher loading. For the 1 and 3wt% Ni/CeO2 catalysts, the yield of dimers showed volcano-type dependence on the reduction temperature, and the reduction temperature of 300°C gave the highest activity (result not shown). Assuming that base-catalyzed Aldol condensation step is responsible for the high activity of Ni/CeO2, influence of the support basicity on metal oxide catalyzed Aldol condensation was examined. Aldol condensation of 2, 5-hexanedione to 3-methy-cyclopenten-1-one by metal oxides was carried out as a model reaction under toluene reflux condition in N2 (Table 3 ). The reaction rate was plotted as a function of the electronegativity of the metal oxide (Fig. 4 ). There is a general tendency that basicity of metal oxides increases with a decrease in the electronegativity of the metal oxide [50]. The rate for Aldol condensation increased with decrease in the electronegativity (i.e. with increase in the basicity of the metal oxides). Thus, an effective promotion of the Aldol condensation step by basic sites on the CeO2 support can be responsible for the support (CeO2) specific Ni catalysis for self-coupling of 2-octanol shown in Table 2. To confirm the influence of surface basicity on the activity, the yields of dimers (1a and 1b) for self-coupling of 2-octanol by 5wt% Ni-loaded metal oxides (Table 2) are plotted as a function of the number of basic sites, which has been estimated by CO2-TPD in our recent report [51]. The result (Fig. 5 ) shows that the catalytic activity as well as the basicity of the catalysts increases with a decrease in the electronegativity of the support oxides. We examined the scope of substrates for self-coupling of secondary alcohols by using Ni/CeO2 (Ni=1–3wt%) reduced at 300°C (Table 4 ). Reaction of 2-octanol effectively proceeded at 130°C for 20h to give the corresponding dimer products in high yield (entry 1). Self-coupling of other aliphatic liner alcohols proceeded in good to moderate yield (entries 4–6). In the dimer products, 1 (ketone) was mainly obtained and 2 (alcohol) was a minor products. Ni/CeO2 was also active for the self-coupling of cyclic alcohol, but the main dimer product was not 1 but 2 (entry 7). Self-coupling of 2-propanol proceeded (entry 8) at much lower temperature (120°C) than those of the reported Cu-based catalysts [34–36] (>200°C) and various coupling products, methyl isobutyl ketone (21%), 4-methyl-2-pentanol (19%), diisobutyl ketone (21%) and 2, 6-dimethyl-4-hexanol (9%), were obtained in comparable yields to the previous studies. Note that the product of Aldol addition (non-dehydrated products) was not observed by GC–MS. To the best of our knowledge, the present system is the first heterogeneous catalytic system for self-coupling of various aliphatic alcohols under relatively mild reaction conditions. After the reaction, Ni/CeO2 was easily separated from the reaction mixture by a centrifugation. The filtered catalyst was washed with acetone, followed by calcination in air at 350°C for 1h, and by reducing in H2 at 300°C for 0.5h. As shown in Table 4 entries 1–3, the recovered catalyst was reused at least two times without any indication of catalyst deactivation. We also analyzed the solution after reaction by using ICP and confirmed that no Ni species were dissolved in the solution (under the detection limit less than 0.1ppm). These results show that Ni/CeO2 is a recyclable catalyst for the self-coupling of secondary alcohols. 3.3 Reaction pathway As previously proposed by various researchers [1–3], the present catalytic system could proceed through so called hydrogen-borrowing pathway, which consists of dehydrogenation of secondary alcohols to ketones, Aldol condensation of them to form α,β-unsaturated ketone, and hydrogenation of the CC bonds using the borrowed hydrogen atoms from alcohols. Fig. 6 shows the time course of the product yield for self-coupling of 2-octanol by Ni/CeO2. A time-conversion profile characteristic to a consecutive reaction mechanism was observed; 2-octanone formed at an initial induction period was consumed after 2h to give the dimer product. Thus, the initial stage of the reaction should be the oxidation of alcohols to the ketone intermediates possibly accompanied by the transitory generation of nickel hydride (NiH) species. As shown in Fig. 4, bare CeO2 was active for Aldol condensation of ketones to form α,β-unsaturated ketone. We tested transfer hydrogenation of 1-dodecenne using 2-propanol as hydrogen donor by Ni/CeO2 (Eq. (1)) as a model reaction. (1) It was found that the catalyst was effective for the transfer hydrogenation of the CC bond. Thus, in the self-coupling of alcohols, hydride transfer from the alcohol to the CC bond of α,β-unsaturated ketone could occur by this catalyst. Based on the above results, we propose a plausible mechanism as shown in Fig. 7 . The reaction begins with the dehydrogenation of alcohols to the corresponding ketones with the generation of NiH species (step 1). Then, Aldol condensation between these ketones occurs to give the α,β-unsaturated ketone (step 2). Finally, hydrogen transfer from NiH species to the CC bond of the α,β-unsaturated ketone gives the ketone product (step 3). In the case for the self-coupling of cyclopentanol (Table 4, entry 7), CO bond is also hydrogenated to give an alcohol 2 as a major product. The α,β-unsaturated ketone is relatively unstable, but in situ hydrogenation of the CC bond of it by borrowed hydrogen from alcohols results in selective production of the saturated ketone as shown below. Eq. (2) shows the result of CeO2-catalyzed Aldol condensation of 2-octanone. The yield of the Aldol condensation product (15%) was lower than the conversion of 2-octanone (51%) and several byproducts with higher molecular weight were observed, suggesting that the unstable α,β-unsaturated ketone underwent undesirable reactions. On the other hand, the reaction of equimolar mixture of 2-octanone and 2-octanol by Ni/CeO2 resulted in 97% yield of the saturated ketone (Eq. (3)). These results indicate that fast hydrogenation of unstable α,β-unsaturated ketone by in situ formed NiH species plays a significant role in the one-pot self-coupling of 2-octanol by Ni/CeO2. (2) (3) 4 Conclusions We studied supported Ni catalysts for the CC self-coupling of aliphatic secondary alcohols to dimer products (mainly higher ketones). The catalytic activity was largely varied with the support materials as well as the oxidation state of Ni; CeO2 (a basic support) and metallic Ni are indispensable for the reaction. The best catalyst, i.e. 1 or 3wt% Ni/CeO2 pre-reduced at medium temperatures (250–300°C), acted as reusable heterogeneous catalyst for the self-coupling of various secondary alcohols without any additives at low temperature (80–144°C), providing the first heterogeneous catalytic system for the self-coupling of various secondary alcohols under mild conditions. A possible reaction mechanism is proposed, in which ketones, formed by dehydrogenation of alcohol, undergone Aldol condensation to give α,β-unsaturated ketone which is finally hydrogenated by in situ formed NiH species. Acknowledgments This work was supported by a “Grant for Advanced Industrial Technology Development” in 2011 from the NEDO and a MEXT program “Elements Strategy Initiative to Form Core Research Center” (since 2012), Japan. The EXAFS experiment was performed with the approval of the Japan Synchrotron Radiation Research Institute (Proposal No. 2011B1137). References [1] M.H.S.A. Hamid P.A. Slatford J.M.J. Williams Adv. Synth. Catal. 349 2007 1555 1575 [2] G. Guillena D.J. Ramón M. Yus Angew. Chem. Int. Ed. 46 2007 2358 2364 [3] T.D. Nixon M.K. Whittlesey J.M.J. Williams Dalton Trans. 38 2009 753 762 [4] G.E. Dobereiner R.H. Crabtree Chem. Rev. 110 2010 681 703 [5] C.S. Cho B.T. Kim H.S. Kim T.J. Kim S.C. Shim Organometallics 22 2003 3608 3610 [6] R. Martinez D.J. Ramón M. Yus Tetrahedron 62 2006 8982 8987 [7] M. Viciano M. Sanau E. Peris Organometallics 26 2007 6050 6054 [8] A. Prades M. Viciano M. Sanau E. Peris Organometallics 27 2008 4254 4259 [9] X. Chang L.W. Chuan L. Yongxin S.A. Pullarkat Tetrahedron Lett. 53 2012 1450 1455 [10] G.R.A. Adair J.M.J. Williams Tetrahedron Lett. 46 2005 8233 8235 [11] H.W. Cheung T.Y. Lee H.Y. Lui C.H. Yeung C.P. Lau Adv. Synth. Catal. 350 2008 2975 2983 [12] D. Gnanamgari C.H. Leung N.D. Schley S.T. Hilton R.H. Crabtree Org. Biomol. Chem. 6 2008 4442 4445 [13] D. Gnanamgari E.L.O. Sauer N.D. Schley C. Butler C.D. Incarvito R.H. Crabtree Organometallics 28 2009 321 325 [14] K. Fujita C. Asai T. Yamaguchi F. Hanasaka R. Yamaguchi Org. Lett. 7 2005 4017 4019 [15] A.P. da Costa M. Viciano M. Sanaú S. Merino J. Tejeda E. Peris B. Royo Organometallics 27 2008 1305 1309 [16] A.P. da Costa M. Sanau E. Peris B. Royo Dalton Trans. 38 2009 6960 6966 [17] X. Gong H. Zhang X. Li Tetrahedron Lett. 52 2011 5596 5600 [18] C. Xu L.Y. Goh S.A. Pullarkat Organometallics 30 2011 6499 6502 [19] T. Matsu-ura S. Sakaguchi Y. Obora Y. Ishii J. Org. Chem. 71 2006 8306 8308 [20] K. Koda T. Matsu-ura Y. Obora Y. Ishii Chem. Lett. 38 2009 838 839 [21] Y. Obora Y. Anno R. Okamoto T. Matsu-ura Y. Ishii Angew. Chem. Int. Ed. 50 2011 8618 8622 [22] O. Kose S. Saito Org. Biomol. Chem. 8 2010 896 900 [23] C. Carlini M.D. Girolamo A. Macinai M. Marchionna M. Noviello A.M.R. Galletti G. Sbrana J. Mol. Catal. A 204–205 2003 721 728 [24] C. Carlini A. Macinai A.M.R. Galletti G. Sbrana J. Mol. Catal. A 212 2004 65 70 [25] T. Miura O. Kose F. Li S. Kai S. Saito Chem. Eur. J. 17 2011 11146 11151 [26] S. Liao K. Yu Q. Li H. Tian Z. Zhang X. Yu Q. Xu Org. Biomol. Chem. 10 2012 2973 2978 [27] G. Tang C.H. Cheng Adv. Synth. Catal. 353 2011 1918 1922 [28] J. Yang X. Liu D.L. Meng H.Y. Chen Z.H. Zong T.T. Feng K. Sun Adv. Synth. Catal. 354 2012 328 334 [29] C.S. Cho W.X. Ren S.C. Shim Bull. Korean Chem. Soc. 26 2005 1611 1613 [30] R. Cano M. Yus D.J. Ramón Chem. Commun. 48 2012 7628 7630 [31] K. Shimizu R. Sato A. Satsuma Angew. Chem. Int. Ed. 48 2009 3982 3986 [32] C. Carlini M.D. Girolamo M. Marchionna M. Noviello A.M.R. Galletti G. Sbrana J. Mol. Catal. A 184 2002 273 280 [33] C. Carlini M.D. Girolamo A. Macinai M. Marchionna M. Noviello A.M.R. Galletti G. Sbrana J. Mol. Catal. A 200 2003 137 146 [34] J.I.D. Cosimo G. Torres C.R. Apesteguia J. Catal. 208 2002 114 123 [35] S.A. El-Molla Appl. Catal., A 298 2006 103 108 [36] G. Torres C.R. Apesteguia J.I.D. Cosimo Appl. Catal., A 317 2007 161 170 [37] C. Carlini A. Macinai M. Marchionna M. Noviello A.M.R. Galletti G. Sbrana J. Mol. Catal. A 206 2003 409 418 [38] C. Carlini M. Marchionna M. Noviello A.M.R. Galletti G. Sbranaa F. Basiled A. Vaccarid J. Mol. Catal. A 232 2005 13 20 [39] J.I.D. Cosimo C.R. Apesteguia M.J.L. Gines E. Iglesia J. Catal. 190 2000 261 275 [40] A.S. Ndou N. Plint N.J. Coville Appl. Catal., A 251 2003 337 345 [41] A.S. Ndou N.J. Coville Appl. Catal., A 275 2004 103 110 [42] T. Tsuchida S. Sakuma T. Takeguchi W. Ueda Ind. Eng. Chem. Res. 45 2006 8634 8642 [43] T. Tsuchida J. Kubo T. Yoshioka S. Sakuma T. Takeguchi W. Ueda J. Catal. 259 2008 183 189 [44] S. Ogo A. Onda K. Yanagisawa Appl. Catal., A 402 2011 188 195 [45] S. Ogo A. Onda Y. Iwasa K. Hara A. Fukuoka K. Yanagisawa J. Catal. 296 2012 24 30 [46] M. Leon E. Diaz S. Ordonez Catal. Today 164 2011 436 442 [47] M. Leon E. Diaz A. Vega S. Ordonez A. Auroux Appl. Catal., B 102 2011 590 599 [48] L.J. Allen R.H. Crabtree Green Chem. 12 2010 1362 1364 [49] K. Shimura K. Shimizu Green Chem. 14 2012 2983 2985 [50] M. Huang A. Adnot S. Kaliaguine J. Am. Chem. Soc. 114 1992 10005 10010 [51] K. Shimizu K. Kon W. Onodera H. Yamazaki J.N. Kondo ACS Catal. 3 2013 112 117",
      "scopus-id": "84878401333",
      "coredata": {
        "eid": "1-s2.0-S0926860X13002603",
        "dc:description": "Supported nickel catalysts are studied for the liquid phase CC self-coupling of aliphatic secondary alcohols under additive free conditions in N2 atmosphere. Among various Ni catalysts, 1 or 3wt% Ni/CeO2 catalysts pre-reduced in H2 shows highest yield (94%) of a dimer product (a higher ketone) for the self-coupling of 1-octanol at 130°C, and the catalyst is reused. The catalysts are also effective for self-coupling of various secondary alcohols, providing the first heterogeneous catalytic system for the self-coupling of secondary alcohols under mild conditions. Effects of support material and oxidation state of Ni on the activity are studied and it is found that both CeO2 and metallic Ni are indispensable for the reaction. A possible reaction mechanism is proposed, in which ketones, formed by dehydrogenation of alcohol, undergone Aldol condensation to give α,β-unsaturated ketone which is finally hydrogenated by in situ formed NiH species.",
        "openArchiveArticle": "false",
        "prism:coverDate": "2013-07-10",
        "openaccessUserLicense": null,
        "prism:aggregationType": "Journal",
        "prism:url": "https://api.elsevier.com/content/article/pii/S0926860X13002603",
        "dc:creator": [
          {
            "@_fa": "true",
            "$": "Shimura, Katsuya"
          },
          {
            "@_fa": "true",
            "$": "Kon, Kenichi"
          },
          {
            "@_fa": "true",
            "$": "Hakim Siddiki, S.M.A."
          },
          {
            "@_fa": "true",
            "$": "Shimizu, Ken-ichi"
          }
        ],
        "link": [
          {
            "@_fa": "true",
            "@rel": "self",
            "@href": "https://api.elsevier.com/content/article/pii/S0926860X13002603"
          },
          {
            "@_fa": "true",
            "@rel": "scidir",
            "@href": "https://www.sciencedirect.com/science/article/pii/S0926860X13002603"
          }
        ],
        "dc:format": "application/json",
        "openaccessType": null,
        "pii": "S0926-860X(13)00260-3",
        "prism:volume": "462",
        "prism:publisher": "Elsevier B.V.",
        "dc:title": "Self-coupling of secondary alcohols by Ni/CeO2 catalyst",
        "prism:copyright": "Copyright © 2013 Elsevier B.V. All rights reserved.",
        "openaccess": "0",
        "prism:issn": "0926860X",
        "dcterms:subject": [
          {
            "@_fa": "true",
            "$": "CC bond formation"
          },
          {
            "@_fa": "true",
            "$": "Cerium oxide"
          },
          {
            "@_fa": "true",
            "$": "Hydrogen transfer"
          },
          {
            "@_fa": "true",
            "$": "Nickel"
          }
        ],
        "openaccessArticle": "false",
        "prism:publicationName": "Applied Catalysis A: General",
        "openaccessSponsorType": null,
        "prism:pageRange": "137-142",
        "prism:endingPage": "142",
        "pubType": "fla",
        "prism:coverDisplayDate": "10 July 2013",
        "prism:doi": "10.1016/j.apcata.2013.04.040",
        "prism:startingPage": "137",
        "dc:identifier": "doi:10.1016/j.apcata.2013.04.040",
        "openaccessSponsorName": null
      },
      "objects": {
        "object": [
          {
            "@category": "high",
            "@height": "726",
            "@width": "1620",
            "@_fa": "true",
            "$": "https://api.elsevier.com/content/object/eid/1-s2.0-S0926860X13002603-gr7_lrg.jpg?httpAccept=%2A%2F%2A",
            "@multimediatype": "JPEG image file",
            "@type": "IMAGE-HIGH-RES",
            "@size": "107492",
            "@ref": "gr7",
            "@mimetype": "image/jpeg"
          },
          {
            "@category": "high",
            "@height": "1047",
            "@width": "1417",
            "@_fa": "true",
            "$": "https://api.elsevier.com/content/object/eid/1-s2.0-S0926860X13002603-gr6_lrg.jpg?httpAccept=%2A%2F%2A",
            "@multimediatype": "JPEG image file",
            "@type": "IMAGE-HIGH-RES",
            "@size": "117330",
            "@ref": "gr6",
            "@mimetype": "image/jpeg"
          },
          {
            "@category": "high",
            "@height": "1130",
            "@width": "1500",
            "@_fa": "true",
            "$": "https://api.elsevier.com/content/object/eid/1-s2.0-S0926860X13002603-gr5_lrg.jpg?httpAccept=%2A%2F%2A",
            "@multimediatype": "JPEG image file",
            "@type": "IMAGE-HIGH-RES",
            "@size": "149913",
            "@ref": "gr5",
            "@mimetype": "image/jpeg"
          },
          {
            "@category": "high",
            "@height": "1067",
            "@width": "1417",
            "@_fa": "true",
            "$": "https://api.elsevier.com/content/object/eid/1-s2.0-S0926860X13002603-gr4_lrg.jpg?httpAccept=%2A%2F%2A",
            "@multimediatype": "JPEG image file",
            "@type": "IMAGE-HIGH-RES",
            "@size": "106227",
            "@ref": "gr4",
            "@mimetype": "image/jpeg"
          },
          {
            "@category": "high",
            "@height": "1071",
            "@width": "1417",
            "@_fa": "true",
            "$": "https://api.elsevier.com/content/object/eid/1-s2.0-S0926860X13002603-gr3_lrg.jpg?httpAccept=%2A%2F%2A",
            "@multimediatype": "JPEG image file",
            "@type": "IMAGE-HIGH-RES",
            "@size": "126618",
            "@ref": "gr3",
            "@mimetype": "image/jpeg"
          },
          {
            "@category": "high",
            "@height": "1516",
            "@width": "1333",
            "@_fa": "true",
            "$": "https://api.elsevier.com/content/object/eid/1-s2.0-S0926860X13002603-gr2_lrg.jpg?httpAccept=%2A%2F%2A",
            "@multimediatype": "JPEG image file",
            "@type": "IMAGE-HIGH-RES",
            "@size": "206013",
            "@ref": "gr2",
            "@mimetype": "image/jpeg"
          },
          {
            "@category": "high",
            "@height": "1535",
            "@width": "2513",
            "@_fa": "true",
            "$": "https://api.elsevier.com/content/object/eid/1-s2.0-S0926860X13002603-gr1_lrg.jpg?httpAccept=%2A%2F%2A",
            "@multimediatype": "JPEG image file",
            "@type": "IMAGE-HIGH-RES",
            "@size": "337719",
            "@ref": "gr1",
            "@mimetype": "image/jpeg"
          },
          {
            "@category": "high",
            "@height": "261",
            "@width": "2213",
            "@_fa": "true",
            "$": "https://api.elsevier.com/content/object/eid/1-s2.0-S0926860X13002603-fx7_lrg.jpg?httpAccept=%2A%2F%2A",
            "@multimediatype": "JPEG image file",
            "@type": "IMAGE-HIGH-RES",
            "@size": "49345",
            "@ref": "fx7",
            "@mimetype": "image/jpeg"
          },
          {
            "@category": "high",
            "@height": "555",
            "@width": "2213",
            "@_fa": "true",
            "$": "https://api.elsevier.com/content/object/eid/1-s2.0-S0926860X13002603-fx6_lrg.jpg?httpAccept=%2A%2F%2A",
            "@multimediatype": "JPEG image file",
            "@type": "IMAGE-HIGH-RES",
            "@size": "85420",
            "@ref": "fx6",
            "@mimetype": "image/jpeg"
          },
          {
            "@category": "high",
            "@height": "235",
            "@width": "2213",
            "@_fa": "true",
            "$": "https://api.elsevier.com/content/object/eid/1-s2.0-S0926860X13002603-fx5_lrg.jpg?httpAccept=%2A%2F%2A",
            "@multimediatype": "JPEG image file",
            "@type": "IMAGE-HIGH-RES",
            "@size": "59491",
            "@ref": "fx5",
            "@mimetype": "image/jpeg"
          },
          {
            "@category": "high",
            "@height": "449",
            "@width": "2213",
            "@_fa": "true",
            "$": "https://api.elsevier.com/content/object/eid/1-s2.0-S0926860X13002603-fx4_lrg.jpg?httpAccept=%2A%2F%2A",
            "@multimediatype": "JPEG image file",
            "@type": "IMAGE-HIGH-RES",
            "@size": "104133",
            "@ref": "fx4",
            "@mimetype": "image/jpeg"
          },
          {
            "@category": "high",
            "@height": "498",
            "@width": "2213",
            "@_fa": "true",
            "$": "https://api.elsevier.com/content/object/eid/1-s2.0-S0926860X13002603-fx3_lrg.jpg?httpAccept=%2A%2F%2A",
            "@multimediatype": "JPEG image file",
            "@type": "IMAGE-HIGH-RES",
            "@size": "90626",
            "@ref": "fx3",
            "@mimetype": "image/jpeg"
          },
          {
            "@category": "high",
            "@height": "394",
            "@width": "2213",
            "@_fa": "true",
            "$": "https://api.elsevier.com/content/object/eid/1-s2.0-S0926860X13002603-fx2_lrg.jpg?httpAccept=%2A%2F%2A",
            "@multimediatype": "JPEG image file",
            "@type": "IMAGE-HIGH-RES",
            "@size": "82961",
            "@ref": "fx2",
            "@mimetype": "image/jpeg"
          },
          {
            "@category": "high",
            "@height": "886",
            "@width": "2013",
            "@_fa": "true",
            "$": "https://api.elsevier.com/content/object/eid/1-s2.0-S0926860X13002603-fx1_lrg.jpg?httpAccept=%2A%2F%2A",
            "@multimediatype": "JPEG image file",
            "@type": "IMAGE-HIGH-RES",
            "@size": "133246",
            "@ref": "fx1",
            "@mimetype": "image/jpeg"
          },
          {
            "@category": "standard",
            "@height": "164",
            "@width": "366",
            "@_fa": "true",
            "$": "https://api.elsevier.com/content/object/eid/1-s2.0-S0926860X13002603-gr7.jpg?httpAccept=%2A%2F%2A",
            "@multimediatype": "JPEG image file",
            "@type": "IMAGE-DOWNSAMPLED",
            "@size": "13353",
            "@ref": "gr7",
            "@mimetype": "image/jpeg"
          },
          {
            "@category": "standard",
            "@height": "236",
            "@width": "320",
            "@_fa": "true",
            "$": "https://api.elsevier.com/content/object/eid/1-s2.0-S0926860X13002603-gr6.jpg?httpAccept=%2A%2F%2A",
            "@multimediatype": "JPEG image file",
            "@type": "IMAGE-DOWNSAMPLED",
            "@size": "15189",
            "@ref": "gr6",
            "@mimetype": "image/jpeg"
          },
          {
            "@category": "standard",
            "@height": "255",
            "@width": "339",
            "@_fa": "true",
            "$": "https://api.elsevier.com/content/object/eid/1-s2.0-S0926860X13002603-gr5.jpg?httpAccept=%2A%2F%2A",
            "@multimediatype": "JPEG image file",
            "@type": "IMAGE-DOWNSAMPLED",
            "@size": "20108",
            "@ref": "gr5",
            "@mimetype": "image/jpeg"
          },
          {
            "@category": "standard",
            "@height": "241",
            "@width": "320",
            "@_fa": "true",
            "$": "https://api.elsevier.com/content/object/eid/1-s2.0-S0926860X13002603-gr4.jpg?httpAccept=%2A%2F%2A",
            "@multimediatype": "JPEG image file",
            "@type": "IMAGE-DOWNSAMPLED",
            "@size": "14085",
            "@ref": "gr4",
            "@mimetype": "image/jpeg"
          },
          {
            "@category": "standard",
            "@height": "242",
            "@width": "320",
            "@_fa": "true",
            "$": "https://api.elsevier.com/content/object/eid/1-s2.0-S0926860X13002603-gr3.jpg?httpAccept=%2A%2F%2A",
            "@multimediatype": "JPEG image file",
            "@type": "IMAGE-DOWNSAMPLED",
            "@size": "16774",
            "@ref": "gr3",
            "@mimetype": "image/jpeg"
          },
          {
            "@category": "standard",
            "@height": "342",
            "@width": "301",
            "@_fa": "true",
            "$": "https://api.elsevier.com/content/object/eid/1-s2.0-S0926860X13002603-gr2.jpg?httpAccept=%2A%2F%2A",
            "@multimediatype": "JPEG image file",
            "@type": "IMAGE-DOWNSAMPLED",
            "@size": "27389",
            "@ref": "gr2",
            "@mimetype": "image/jpeg"
          },
          {
            "@category": "standard",
            "@height": "346",
            "@width": "567",
            "@_fa": "true",
            "$": "https://api.elsevier.com/content/object/eid/1-s2.0-S0926860X13002603-gr1.jpg?httpAccept=%2A%2F%2A",
            "@multimediatype": "JPEG image file",
            "@type": "IMAGE-DOWNSAMPLED",
            "@size": "43317",
            "@ref": "gr1",
            "@mimetype": "image/jpeg"
          },
          {
            "@category": "standard",
            "@height": "59",
            "@width": "500",
            "@_fa": "true",
            "$": "https://api.elsevier.com/content/object/eid/1-s2.0-S0926860X13002603-fx7.jpg?httpAccept=%2A%2F%2A",
            "@multimediatype": "JPEG image file",
            "@type": "IMAGE-DOWNSAMPLED",
            "@size": "7068",
            "@ref": "fx7",
            "@mimetype": "image/jpeg"
          },
          {
            "@category": "standard",
            "@height": "125",
            "@width": "500",
            "@_fa": "true",
            "$": "https://api.elsevier.com/content/object/eid/1-s2.0-S0926860X13002603-fx6.jpg?httpAccept=%2A%2F%2A",
            "@multimediatype": "JPEG image file",
            "@type": "IMAGE-DOWNSAMPLED",
            "@size": "11646",
            "@ref": "fx6",
            "@mimetype": "image/jpeg"
          },
          {
            "@category": "standard",
            "@height": "53",
            "@width": "500",
            "@_fa": "true",
            "$": "https://api.elsevier.com/content/object/eid/1-s2.0-S0926860X13002603-fx5.jpg?httpAccept=%2A%2F%2A",
            "@multimediatype": "JPEG image file",
            "@type": "IMAGE-DOWNSAMPLED",
            "@size": "8047",
            "@ref": "fx5",
            "@mimetype": "image/jpeg"
          },
          {
            "@category": "standard",
            "@height": "101",
            "@width": "500",
            "@_fa": "true",
            "$": "https://api.elsevier.com/content/object/eid/1-s2.0-S0926860X13002603-fx4.jpg?httpAccept=%2A%2F%2A",
            "@multimediatype": "JPEG image file",
            "@type": "IMAGE-DOWNSAMPLED",
            "@size": "14070",
            "@ref": "fx4",
            "@mimetype": "image/jpeg"
          },
          {
            "@category": "standard",
            "@height": "113",
            "@width": "500",
            "@_fa": "true",
            "$": "https://api.elsevier.com/content/object/eid/1-s2.0-S0926860X13002603-fx3.jpg?httpAccept=%2A%2F%2A",
            "@multimediatype": "JPEG image file",
            "@type": "IMAGE-DOWNSAMPLED",
            "@size": "12608",
            "@ref": "fx3",
            "@mimetype": "image/jpeg"
          },
          {
            "@category": "standard",
            "@height": "89",
            "@width": "500",
            "@_fa": "true",
            "$": "https://api.elsevier.com/content/object/eid/1-s2.0-S0926860X13002603-fx2.jpg?httpAccept=%2A%2F%2A",
            "@multimediatype": "JPEG image file",
            "@type": "IMAGE-DOWNSAMPLED",
            "@size": "12126",
            "@ref": "fx2",
            "@mimetype": "image/jpeg"
          },
          {
            "@category": "standard",
            "@height": "200",
            "@width": "454",
            "@_fa": "true",
            "$": "https://api.elsevier.com/content/object/eid/1-s2.0-S0926860X13002603-fx1.jpg?httpAccept=%2A%2F%2A",
            "@multimediatype": "JPEG image file",
            "@type": "IMAGE-DOWNSAMPLED",
            "@size": "17347",
            "@ref": "fx1",
            "@mimetype": "image/jpeg"
          },
          {
            "@category": "thumbnail",
            "@height": "98",
            "@width": "219",
            "@_fa": "true",
            "$": "https://api.elsevier.com/content/object/eid/1-s2.0-S0926860X13002603-gr7.sml?httpAccept=%2A%2F%2A",
            "@multimediatype": "GIF image file",
            "@type": "IMAGE-THUMBNAIL",
            "@size": "3455",
            "@ref": "gr7",
            "@mimetype": "image/gif"
          },
          {
            "@category": "thumbnail",
            "@height": "162",
            "@width": "219",
            "@_fa": "true",
            "$": "https://api.elsevier.com/content/object/eid/1-s2.0-S0926860X13002603-gr6.sml?httpAccept=%2A%2F%2A",
            "@multimediatype": "GIF image file",
            "@type": "IMAGE-THUMBNAIL",
            "@size": "4599",
            "@ref": "gr6",
            "@mimetype": "image/gif"
          },
          {
            "@category": "thumbnail",
            "@height": "164",
            "@width": "218",
            "@_fa": "true",
            "$": "https://api.elsevier.com/content/object/eid/1-s2.0-S0926860X13002603-gr5.sml?httpAccept=%2A%2F%2A",
            "@multimediatype": "GIF image file",
            "@type": "IMAGE-THUMBNAIL",
            "@size": "5120",
            "@ref": "gr5",
            "@mimetype": "image/gif"
          },
          {
            "@category": "thumbnail",
            "@height": "164",
            "@width": "218",
            "@_fa": "true",
            "$": "https://api.elsevier.com/content/object/eid/1-s2.0-S0926860X13002603-gr4.sml?httpAccept=%2A%2F%2A",
            "@multimediatype": "GIF image file",
            "@type": "IMAGE-THUMBNAIL",
            "@size": "4292",
            "@ref": "gr4",
            "@mimetype": "image/gif"
          },
          {
            "@category": "thumbnail",
            "@height": "164",
            "@width": "217",
            "@_fa": "true",
            "$": "https://api.elsevier.com/content/object/eid/1-s2.0-S0926860X13002603-gr3.sml?httpAccept=%2A%2F%2A",
            "@multimediatype": "GIF image file",
            "@type": "IMAGE-THUMBNAIL",
            "@size": "4919",
            "@ref": "gr3",
            "@mimetype": "image/gif"
          },
          {
            "@category": "thumbnail",
            "@height": "164",
            "@width": "144",
            "@_fa": "true",
            "$": "https://api.elsevier.com/content/object/eid/1-s2.0-S0926860X13002603-gr2.sml?httpAccept=%2A%2F%2A",
            "@multimediatype": "GIF image file",
            "@type": "IMAGE-THUMBNAIL",
            "@size": "4739",
            "@ref": "gr2",
            "@mimetype": "image/gif"
          },
          {
            "@category": "thumbnail",
            "@height": "134",
            "@width": "219",
            "@_fa": "true",
            "$": "https://api.elsevier.com/content/object/eid/1-s2.0-S0926860X13002603-gr1.sml?httpAccept=%2A%2F%2A",
            "@multimediatype": "GIF image file",
            "@type": "IMAGE-THUMBNAIL",
            "@size": "5169",
            "@ref": "gr1",
            "@mimetype": "image/gif"
          },
          {
            "@category": "thumbnail",
            "@height": "26",
            "@width": "219",
            "@_fa": "true",
            "$": "https://api.elsevier.com/content/object/eid/1-s2.0-S0926860X13002603-fx7.sml?httpAccept=%2A%2F%2A",
            "@multimediatype": "GIF image file",
            "@type": "IMAGE-THUMBNAIL",
            "@size": "1751",
            "@ref": "fx7",
            "@mimetype": "image/gif"
          },
          {
            "@category": "thumbnail",
            "@height": "55",
            "@width": "219",
            "@_fa": "true",
            "$": "https://api.elsevier.com/content/object/eid/1-s2.0-S0926860X13002603-fx6.sml?httpAccept=%2A%2F%2A",
            "@multimediatype": "GIF image file",
            "@type": "IMAGE-THUMBNAIL",
            "@size": "2613",
            "@ref": "fx6",
            "@mimetype": "image/gif"
          },
          {
            "@category": "thumbnail",
            "@height": "23",
            "@width": "219",
            "@_fa": "true",
            "$": "https://api.elsevier.com/content/object/eid/1-s2.0-S0926860X13002603-fx5.sml?httpAccept=%2A%2F%2A",
            "@multimediatype": "GIF image file",
            "@type": "IMAGE-THUMBNAIL",
            "@size": "1773",
            "@ref": "fx5",
            "@mimetype": "image/gif"
          },
          {
            "@category": "thumbnail",
            "@height": "44",
            "@width": "219",
            "@_fa": "true",
            "$": "https://api.elsevier.com/content/object/eid/1-s2.0-S0926860X13002603-fx4.sml?httpAccept=%2A%2F%2A",
            "@multimediatype": "GIF image file",
            "@type": "IMAGE-THUMBNAIL",
            "@size": "2590",
            "@ref": "fx4",
            "@mimetype": "image/gif"
          },
          {
            "@category": "thumbnail",
            "@height": "49",
            "@width": "219",
            "@_fa": "true",
            "$": "https://api.elsevier.com/content/object/eid/1-s2.0-S0926860X13002603-fx3.sml?httpAccept=%2A%2F%2A",
            "@multimediatype": "GIF image file",
            "@type": "IMAGE-THUMBNAIL",
            "@size": "2438",
            "@ref": "fx3",
            "@mimetype": "image/gif"
          },
          {
            "@category": "thumbnail",
            "@height": "39",
            "@width": "219",
            "@_fa": "true",
            "$": "https://api.elsevier.com/content/object/eid/1-s2.0-S0926860X13002603-fx2.sml?httpAccept=%2A%2F%2A",
            "@multimediatype": "GIF image file",
            "@type": "IMAGE-THUMBNAIL",
            "@size": "2405",
            "@ref": "fx2",
            "@mimetype": "image/gif"
          },
          {
            "@category": "thumbnail",
            "@height": "96",
            "@width": "219",
            "@_fa": "true",
            "$": "https://api.elsevier.com/content/object/eid/1-s2.0-S0926860X13002603-fx1.sml?httpAccept=%2A%2F%2A",
            "@multimediatype": "GIF image file",
            "@type": "IMAGE-THUMBNAIL",
            "@size": "3440",
            "@ref": "fx1",
            "@mimetype": "image/gif"
          }
        ]
      },
      "link": {
        "@rel": "abstract",
        "@href": "https://api.elsevier.com/content/abstract/scopus_id/84878401333"
      }
    }
  }
}