{
  "metadata": {
    "title": "Catalytic coupling of epoxides and CO<ce:inf loc=post>2</ce:inf> to cyclic carbonates by carbon nanotube-supported quaternary ammonium salts",
    "authors": "; ; ",
    "journal": "Applied Catalysis A: General",
    "date": "2014-11-30",
    "doi": "10.1016/j.apcata.2014.09.034",
    "abstract": "",
    "uri": "https://api.elsevier.com/content/article/pii/S0926860X14005857",
    "pii": "S0926860X14005857"
  },
  "fulltext": {
    "full-text-retrieval-response": {
      "scopus-eid": "2-s2.0-84929368288",
      "originalText": "serial JL 271346 291210 291744 291809 31 Applied Catalysis A: General APPLIEDCATALYSISAGENERAL 2014-10-02 2014-10-02 2014-11-13T11:31:23 1-s2.0-S0926860X14005857 S0926-860X(14)00585-7 S0926860X14005857 10.1016/j.apcata.2014.09.034 S300 S300.1 FULL-TEXT 1-s2.0-S0926860X14X00190 2024-01-01T12:30:29.635264Z 0 0 20141101 20141130 2014 2014-10-02T14:48:30.385581Z absattachment articleinfo articletitlenorm authfirstinitialnorm authfirstsurnamenorm cid cids contenttype copyright crossmark dateloaded dateloadedtxt datesearch datesort dateupdated dco docsubtype doctype doi eid ewtransactionid hubeid indexeddate issn issnnorm itemstage itemtransactionid itemweight openaccess openarchive pg pgfirst pglast pii piinorm pubdateend pubdatestart pubdatetxt pubyr sectiontitle sortorder srctitle srctitlenorm srctype ssids alllist content subj subheadings suppl tomb volfirst volissue volumelist webpdf webpdfpagecount yearnav figure table e-component body acknowledge affil appendices articletitle auth authfirstini authfull authkeywords authlast highlightsabst primabst ref specialabst 0926-860X 0926860X true 488 488 C Volume 488 13 96 102 96 102 201411 November 2014 2014-11-01 2014-11-30 2014 Articles article fla Copyright © 2014 Elsevier B.V. All rights reserved. CATALYTICCOUPLINGEPOXIDESCO2CYCLICCARBONATESBYCARBONNANOTUBESUPPORTEDQUATERNARYAMMONIUMSALTS BAJ S 1 Introduction 2 Experimental 2.1 Materials 2.2 Synthesis of quaternary ammonium salts 2.3 Immobilization of quaternary ammonium salts on CNTs 2.4 Synthesis of cyclic carbonates 3 Results and discussion 3.1 Catalysts synthesis and characterization 3.2 Catalysts performance 3.3 Reuse of the catalyst 4 Conclusions Acknowledgement Appendix A Supplementary data References SAKAKURA 2007 2365 2387 T NORTH 2010 1514 1539 M SHAIKH 1996 951 976 A KIM 2013 1973 1984 D DAI 2013 7 13 W KIM 2014 3102 3107 M GHAZALIESFAHANI 2013 1584 1589 S HAN 2012 67 72 L SUN 2008 3588 3591 J ROSHAN 2012 2933 2940 K SUN 2012 654 660 J TAKAHASHI 2006 1664 1666 T WANG 2006 143 148 J WATILE 2012 1051 1055 R DHARMAN 2009 1754 1757 M CHOI 2013 242 248 H SUN 2009 423 426 J JU 2008 157 160 H KOSSEV 2003 29 37 K ZHAO 2007 284 289 Y SHIM 2006 744 746 J ZHOU 2008 52 57 Y BAI 2012 600 603 D HAN 2011 1023 1028 L CHANG 2007 241 247 T CAO 2012 416 424 T ANSELMO 2012 49 53 D THARUN 2013 62 65 J DU 2006 1271 1275 Y WANG 2007 167 172 J ZHANG 2012 1376 1381 Y XIONG 2013 1 9 Y BAI 2013 184 187 D SAKAI 2008 337 341 T LI 2004 8307 8310 F XIAO 2014 285 290 L WERNER 2014 39 45 T ZHENG 2009 455 458 X KAWANAMI 2003 896 897 H BAJX2014X96 BAJX2014X96X102 BAJX2014X96XS BAJX2014X96X102XS item S0926-860X(14)00585-7 S0926860X14005857 1-s2.0-S0926860X14005857 10.1016/j.apcata.2014.09.034 271346 2024-01-01T12:30:29.635264Z 2014-11-01 2014-11-30 1-s2.0-S0926860X14005857-main.pdf https://s3.amazonaws.com/prod-ucs-content-store-us-east/content/pii:S0926860X14005857/MAIN/application/pdf/f35df3c6c22b5ef41e32129e59a3ca45/main.pdf https://s3-eu-west-1.amazonaws.com/prod-ucs-content-store-eu-west/content/pii:S0926860X14005857/MAIN/application/pdf/f35df3c6c22b5ef41e32129e59a3ca45/main.pdf main.pdf pdf true 1430610 MAIN 7 1-s2.0-S0926860X14005857-main_1.png https://s3-eu-west-1.amazonaws.com/prod-ucs-content-store-eu-west/content/pii:S0926860X14005857/PREVIEW/image/png/6477f838d743731e48610e632a6a5889/main_1.png https://s3.amazonaws.com/prod-ucs-content-store-us-east/content/pii:S0926860X14005857/PREVIEW/image/png/6477f838d743731e48610e632a6a5889/main_1.png main_1.png png 56483 849 656 IMAGE-WEB-PDF 1 1-s2.0-S0926860X14005857-mmc1.docx https://s3.amazonaws.com/prod-ucs-content-store-us-east/content/pii:S0926860X14005857/mmc1/MAIN/application/msword/a21472655be405541eb2485a89518037/mmc1.docx https://s3-eu-west-1.amazonaws.com/prod-ucs-content-store-eu-west/content/pii:S0926860X14005857/mmc1/MAIN/application/msword/a21472655be405541eb2485a89518037/mmc1.docx mmc1 mmc1.docx docx 80580 APPLICATION 1-s2.0-S0926860X14005857-sc1_lrg.jpg https://s3.amazonaws.com/prod-ucs-content-store-us-east/content/pii:S0926860X14005857/sc1/HIGHRES/image/jpeg/1c05dfbdc3f02bf3bc08ef91840b47a1/sc1_lrg.jpg https://s3-eu-west-1.amazonaws.com/prod-ucs-content-store-eu-west/content/pii:S0926860X14005857/sc1/HIGHRES/image/jpeg/1c05dfbdc3f02bf3bc08ef91840b47a1/sc1_lrg.jpg sc1 sc1_lrg.jpg jpg 161540 619 2500 IMAGE-HIGH-RES 1-s2.0-S0926860X14005857-gr5_lrg.jpg https://s3.amazonaws.com/prod-ucs-content-store-us-east/content/pii:S0926860X14005857/gr5/HIGHRES/image/jpeg/ed157bf45d62b0798fdf9663d57cc62e/gr5_lrg.jpg https://s3-eu-west-1.amazonaws.com/prod-ucs-content-store-eu-west/content/pii:S0926860X14005857/gr5/HIGHRES/image/jpeg/ed157bf45d62b0798fdf9663d57cc62e/gr5_lrg.jpg gr5 gr5_lrg.jpg jpg 63456 621 900 IMAGE-HIGH-RES 1-s2.0-S0926860X14005857-gr4_lrg.jpg https://s3.amazonaws.com/prod-ucs-content-store-us-east/content/pii:S0926860X14005857/gr4/HIGHRES/image/jpeg/b2bdf03a4598128a04d7d3407650640c/gr4_lrg.jpg https://s3-eu-west-1.amazonaws.com/prod-ucs-content-store-eu-west/content/pii:S0926860X14005857/gr4/HIGHRES/image/jpeg/b2bdf03a4598128a04d7d3407650640c/gr4_lrg.jpg gr4 gr4_lrg.jpg jpg 94493 564 900 IMAGE-HIGH-RES 1-s2.0-S0926860X14005857-gr3_lrg.jpg https://s3.amazonaws.com/prod-ucs-content-store-us-east/content/pii:S0926860X14005857/gr3/HIGHRES/image/jpeg/f1c9c53d1737cd2f2d50138e6daf97d6/gr3_lrg.jpg https://s3-eu-west-1.amazonaws.com/prod-ucs-content-store-eu-west/content/pii:S0926860X14005857/gr3/HIGHRES/image/jpeg/f1c9c53d1737cd2f2d50138e6daf97d6/gr3_lrg.jpg gr3 gr3_lrg.jpg jpg 226374 1342 1667 IMAGE-HIGH-RES 1-s2.0-S0926860X14005857-gr2_lrg.jpg https://s3.amazonaws.com/prod-ucs-content-store-us-east/content/pii:S0926860X14005857/gr2/HIGHRES/image/jpeg/f31a615a91835def006da7dcc28fa9ba/gr2_lrg.jpg https://s3-eu-west-1.amazonaws.com/prod-ucs-content-store-eu-west/content/pii:S0926860X14005857/gr2/HIGHRES/image/jpeg/f31a615a91835def006da7dcc28fa9ba/gr2_lrg.jpg gr2 gr2_lrg.jpg jpg 123327 882 1500 IMAGE-HIGH-RES 1-s2.0-S0926860X14005857-gr1_lrg.jpg https://s3.amazonaws.com/prod-ucs-content-store-us-east/content/pii:S0926860X14005857/gr1/HIGHRES/image/jpeg/4664ecb367b90b9e34466f01af76b258/gr1_lrg.jpg https://s3-eu-west-1.amazonaws.com/prod-ucs-content-store-eu-west/content/pii:S0926860X14005857/gr1/HIGHRES/image/jpeg/4664ecb367b90b9e34466f01af76b258/gr1_lrg.jpg gr1 gr1_lrg.jpg jpg 629089 1540 1850 IMAGE-HIGH-RES 1-s2.0-S0926860X14005857-fx1_lrg.jpg https://s3.amazonaws.com/prod-ucs-content-store-us-east/content/pii:S0926860X14005857/fx1/HIGHRES/image/jpeg/138d52dd8a3c28ee0eb1bb29d7836937/fx1_lrg.jpg https://s3-eu-west-1.amazonaws.com/prod-ucs-content-store-eu-west/content/pii:S0926860X14005857/fx1/HIGHRES/image/jpeg/138d52dd8a3c28ee0eb1bb29d7836937/fx1_lrg.jpg fx1 true fx1_lrg.jpg jpg 95535 886 1786 IMAGE-HIGH-RES 1-s2.0-S0926860X14005857-sc2_lrg.gif https://s3.amazonaws.com/prod-ucs-content-store-us-east/content/pii:S0926860X14005857/sc2/HIGHRES/image/gif/8b79d4cd958df5b94f1961c6b4b68081/sc2_lrg.gif https://s3-eu-west-1.amazonaws.com/prod-ucs-content-store-eu-west/content/pii:S0926860X14005857/sc2/HIGHRES/image/gif/8b79d4cd958df5b94f1961c6b4b68081/sc2_lrg.gif sc2 sc2_lrg.gif gif 87366 2987 3333 IMAGE-HIGH-RES 1-s2.0-S0926860X14005857-sc1.jpg https://s3.amazonaws.com/prod-ucs-content-store-us-east/content/pii:S0926860X14005857/sc1/DOWNSAMPLED/image/jpeg/a370ed2b0ce0b272a4d25e6803de0c02/sc1.jpg https://s3-eu-west-1.amazonaws.com/prod-ucs-content-store-eu-west/content/pii:S0926860X14005857/sc1/DOWNSAMPLED/image/jpeg/a370ed2b0ce0b272a4d25e6803de0c02/sc1.jpg sc1 sc1.jpg jpg 19206 140 565 IMAGE-DOWNSAMPLED 1-s2.0-S0926860X14005857-gr5.jpg https://s3.amazonaws.com/prod-ucs-content-store-us-east/content/pii:S0926860X14005857/gr5/DOWNSAMPLED/image/jpeg/6f082c0f3245392443718ff6b2a8754f/gr5.jpg https://s3-eu-west-1.amazonaws.com/prod-ucs-content-store-eu-west/content/pii:S0926860X14005857/gr5/DOWNSAMPLED/image/jpeg/6f082c0f3245392443718ff6b2a8754f/gr5.jpg gr5 gr5.jpg jpg 22745 234 339 IMAGE-DOWNSAMPLED 1-s2.0-S0926860X14005857-gr4.jpg https://s3.amazonaws.com/prod-ucs-content-store-us-east/content/pii:S0926860X14005857/gr4/DOWNSAMPLED/image/jpeg/661461efc5380e0aca169c377d4c05c1/gr4.jpg https://s3-eu-west-1.amazonaws.com/prod-ucs-content-store-eu-west/content/pii:S0926860X14005857/gr4/DOWNSAMPLED/image/jpeg/661461efc5380e0aca169c377d4c05c1/gr4.jpg gr4 gr4.jpg jpg 29523 212 339 IMAGE-DOWNSAMPLED 1-s2.0-S0926860X14005857-gr3.jpg https://s3.amazonaws.com/prod-ucs-content-store-us-east/content/pii:S0926860X14005857/gr3/DOWNSAMPLED/image/jpeg/d157473684bba62685540d921986334b/gr3.jpg https://s3-eu-west-1.amazonaws.com/prod-ucs-content-store-eu-west/content/pii:S0926860X14005857/gr3/DOWNSAMPLED/image/jpeg/d157473684bba62685540d921986334b/gr3.jpg gr3 gr3.jpg jpg 34649 303 376 IMAGE-DOWNSAMPLED 1-s2.0-S0926860X14005857-gr2.jpg https://s3.amazonaws.com/prod-ucs-content-store-us-east/content/pii:S0926860X14005857/gr2/DOWNSAMPLED/image/jpeg/0ac4463ed881b96aba5d114a9be88291/gr2.jpg https://s3-eu-west-1.amazonaws.com/prod-ucs-content-store-eu-west/content/pii:S0926860X14005857/gr2/DOWNSAMPLED/image/jpeg/0ac4463ed881b96aba5d114a9be88291/gr2.jpg gr2 gr2.jpg jpg 21952 199 339 IMAGE-DOWNSAMPLED 1-s2.0-S0926860X14005857-gr1.jpg https://s3.amazonaws.com/prod-ucs-content-store-us-east/content/pii:S0926860X14005857/gr1/DOWNSAMPLED/image/jpeg/2f61a4b176f5fc37d04cadafd8510b30/gr1.jpg https://s3-eu-west-1.amazonaws.com/prod-ucs-content-store-eu-west/content/pii:S0926860X14005857/gr1/DOWNSAMPLED/image/jpeg/2f61a4b176f5fc37d04cadafd8510b30/gr1.jpg gr1 gr1.jpg jpg 151768 579 696 IMAGE-DOWNSAMPLED 1-s2.0-S0926860X14005857-fx1.jpg https://s3.amazonaws.com/prod-ucs-content-store-us-east/content/pii:S0926860X14005857/fx1/DOWNSAMPLED/image/jpeg/efa7c4753e7a8e81fa6eeaa9cc913c06/fx1.jpg https://s3-eu-west-1.amazonaws.com/prod-ucs-content-store-eu-west/content/pii:S0926860X14005857/fx1/DOWNSAMPLED/image/jpeg/efa7c4753e7a8e81fa6eeaa9cc913c06/fx1.jpg fx1 true fx1.jpg jpg 13961 200 403 IMAGE-DOWNSAMPLED 1-s2.0-S0926860X14005857-sc2.gif https://s3.amazonaws.com/prod-ucs-content-store-us-east/content/pii:S0926860X14005857/sc2/DOWNSAMPLED/image/gif/3ebd184ad6e103f4ca7bc6cbf0c1fd48/sc2.gif https://s3-eu-west-1.amazonaws.com/prod-ucs-content-store-eu-west/content/pii:S0926860X14005857/sc2/DOWNSAMPLED/image/gif/3ebd184ad6e103f4ca7bc6cbf0c1fd48/sc2.gif sc2 sc2.gif gif 9660 337 376 IMAGE-DOWNSAMPLED 1-s2.0-S0926860X14005857-sc2.sml https://s3.amazonaws.com/prod-ucs-content-store-us-east/content/pii:S0926860X14005857/sc2/THUMBNAIL/image/gif/6c71af5c4f018b5ed8c417aa6263c6a5/sc2.sml https://s3-eu-west-1.amazonaws.com/prod-ucs-content-store-eu-west/content/pii:S0926860X14005857/sc2/THUMBNAIL/image/gif/6c71af5c4f018b5ed8c417aa6263c6a5/sc2.sml sc2 sc2.sml sml 3288 164 183 IMAGE-THUMBNAIL 1-s2.0-S0926860X14005857-sc1.sml https://s3.amazonaws.com/prod-ucs-content-store-us-east/content/pii:S0926860X14005857/sc1/THUMBNAIL/image/gif/30eef8d019e1600cc4f219ff2d37b74d/sc1.sml https://s3-eu-west-1.amazonaws.com/prod-ucs-content-store-eu-west/content/pii:S0926860X14005857/sc1/THUMBNAIL/image/gif/30eef8d019e1600cc4f219ff2d37b74d/sc1.sml sc1 sc1.sml sml 2657 54 219 IMAGE-THUMBNAIL 1-s2.0-S0926860X14005857-gr5.sml https://s3.amazonaws.com/prod-ucs-content-store-us-east/content/pii:S0926860X14005857/gr5/THUMBNAIL/image/gif/bc10dec0a2918a4504e1dc494e31f012/gr5.sml https://s3-eu-west-1.amazonaws.com/prod-ucs-content-store-eu-west/content/pii:S0926860X14005857/gr5/THUMBNAIL/image/gif/bc10dec0a2918a4504e1dc494e31f012/gr5.sml gr5 gr5.sml sml 6889 151 219 IMAGE-THUMBNAIL 1-s2.0-S0926860X14005857-gr4.sml https://s3.amazonaws.com/prod-ucs-content-store-us-east/content/pii:S0926860X14005857/gr4/THUMBNAIL/image/gif/4e69fef77ae383b453629ae0f63d1a02/gr4.sml https://s3-eu-west-1.amazonaws.com/prod-ucs-content-store-eu-west/content/pii:S0926860X14005857/gr4/THUMBNAIL/image/gif/4e69fef77ae383b453629ae0f63d1a02/gr4.sml gr4 gr4.sml sml 6591 137 219 IMAGE-THUMBNAIL 1-s2.0-S0926860X14005857-gr3.sml https://s3.amazonaws.com/prod-ucs-content-store-us-east/content/pii:S0926860X14005857/gr3/THUMBNAIL/image/gif/3c8a557387f096fc59ae948a94b17e2f/gr3.sml https://s3-eu-west-1.amazonaws.com/prod-ucs-content-store-eu-west/content/pii:S0926860X14005857/gr3/THUMBNAIL/image/gif/3c8a557387f096fc59ae948a94b17e2f/gr3.sml gr3 gr3.sml sml 4960 164 204 IMAGE-THUMBNAIL 1-s2.0-S0926860X14005857-gr2.sml https://s3.amazonaws.com/prod-ucs-content-store-us-east/content/pii:S0926860X14005857/gr2/THUMBNAIL/image/gif/7307bf57bb0831459aae88be205c43e7/gr2.sml https://s3-eu-west-1.amazonaws.com/prod-ucs-content-store-eu-west/content/pii:S0926860X14005857/gr2/THUMBNAIL/image/gif/7307bf57bb0831459aae88be205c43e7/gr2.sml gr2 gr2.sml sml 3533 129 219 IMAGE-THUMBNAIL 1-s2.0-S0926860X14005857-gr1.sml https://s3.amazonaws.com/prod-ucs-content-store-us-east/content/pii:S0926860X14005857/gr1/THUMBNAIL/image/gif/dc07b3a2d1a8d0ba574ed6d4cdfb22c4/gr1.sml https://s3-eu-west-1.amazonaws.com/prod-ucs-content-store-eu-west/content/pii:S0926860X14005857/gr1/THUMBNAIL/image/gif/dc07b3a2d1a8d0ba574ed6d4cdfb22c4/gr1.sml gr1 gr1.sml sml 11859 164 197 IMAGE-THUMBNAIL 1-s2.0-S0926860X14005857-fx1.sml https://s3.amazonaws.com/prod-ucs-content-store-us-east/content/pii:S0926860X14005857/fx1/THUMBNAIL/image/gif/cff3c986139261cd640afe0c16ecaaa0/fx1.sml https://s3-eu-west-1.amazonaws.com/prod-ucs-content-store-eu-west/content/pii:S0926860X14005857/fx1/THUMBNAIL/image/gif/cff3c986139261cd640afe0c16ecaaa0/fx1.sml fx1 true fx1.sml sml 2428 109 219 IMAGE-THUMBNAIL APCATA 15015 S0926-860X(14)00585-7 10.1016/j.apcata.2014.09.034 Elsevier B.V. Fig. 1 TEM and SEM characterization of catalysts and intermediate materials. (A, B) CNT; (C, D) OXCNT; (E–I) OXCNT-(CH2) n+1 (R1)3N+Cl−; (E, G) R1 =Et, n =1; (F) R1 =Bu, n =9; (H, I) R1 =Me, n =5. Fig. 2 IR spectra of OXCNT, free ammonium salt and one of the final products. Fig. 3 Representative DTG curves of catalysts and intermediate materials. Fig. 4 Progress of the cyclic carbonate synthesis from epoxides followed by the consumption of CO2. Reaction conditions: epoxide (0.214mol); catalyst (≈0.5g); 110°C; 2MPa; 500rpm. ECH, epichlorohydrin; PO, propylene oxide; SO, styrene oxide. Fig. 5 Catalytic activity of the reused immobilized catalyst (n =1 and R1 =Et). Reaction conditions: propylene oxide (0.214mol); catalyst (≈0.6g); 110°C; 2MPa; 6h; 500rpm. Scheme 1 General procedure of the synthesis of CNT-ammonium salt catalysts. Scheme 2 Mechanism of the synthesis of cyclic carbonates catalysed by OXCNT-(CH2) n (R1)3N+Cl−. Table 1 Synthesis of a cyclic carbonate in the presence of OXCNT and ammonium catalyst from propylene oxide and CO2. No. System OXCNT loading (g) Quaternary ammonium salt loading (mmol) CO2 conversion (%) Selectivity a (%) 1 No catalyst 0 0 0 – 2 OXCNT 0.65 0 Trace – 3 Choline chloride 0 1 16 95 4 Trimethyl-(6-hydroxyhexyl)ammonium chloride 0 1 15 95 5 Trimethyl-(10-hydroxydecyl)ammonium chloride 0 1 18 95 6 OXCNT+choline chloride 0.65 1 35 96 7 Choline chloride+1mmol CH3COOH 0 1 37 96 8 Choline chloride+10mmol CH3COOH 0 1 38 95 Reaction conditions: epoxide (0.214mol, 15mL); 110°C; 2MPa of CO2; 500rpm; reaction time 6h. a Analysed by GC. Table 2 Structural features and elemental composition of CNT-supported ammonium chlorides OXCNT-(CH2) n+1 (R1)3N+Cl−. R1 n C (%) H (%) N (%) N (mmolg−1) Bu 1 83.54 >0.09 1.43 1.02 Et 1 83.1 0.13 1.65 1.18 Me 1 75.72 0.55 2.36 1.69 Me 9 89.67 0.33 1.99 1.42 Et 9 83.67 0.15 1.30 0.93 Bu 9 74.34 1.08 1.19 0.85 Me 5 84.7 >0.09 1.32 0.94 Et 5 84.15 0.96 0.79 0.56 Bu 5 83.64 0.99 1.34 0.96 Table 3 Effect of the structure of a catalyst and type of epoxide on the cyclic carbonate formation. R1 n Epoxide Catalyst loading (g) CO2 conversion (%) Yield of carbonate a (%) Selectivity a (%) k 1 ×106 (s−1) b TOF c (mol epoxide molN−1 s−1) k 1N ×106 (mmol N−1 s−1) a Me 1 Styrene oxide 0.57 23 22 96 20.3 0.0023 21.1 Et 1 Propylene oxide 0.66 68 66 98 66.7 0.0083 85.6 Bu 1 Epichlorohydrin 0.46 53 50 96 24.9 0.0107 53.0 Me 9 Epichlorohydrin 0.77 86 81 94 110.6 0.0073 101.0 Et 9 Styrene oxide 0.58 17 16 97 14.4 0.0030 26.7 Bu 9 Propylene oxide 0.70 21 20 98 8.9 0.0034 15.0 Me 5 Propylene oxide 0.53 7 6.8 97 3.4 0.0014 6.80 Et 5 Epichlorohydrin 0.55 13 12 92 5.5 0.0039 17.7 Bu 5 Styrene oxide 0.62 16 15 96 13.4 0.0025 22.6 Reaction conditions: epoxide (0.214mol); 110°C; 2MPa of CO2; 500rpm; reaction time 6h. a Analysed by GC. b Measured within the period of 3000–7000s. c Averaged over the entire 6h. Table 4 Impact of the investigated factor on the carbonate yield. Reaction conditions: catalyst loading, 0.46-0.77g; epoxide,0.214mol; 110°C; 2MPa of CO2; 500rpm; reaction time 6h (see Table 3). Factor Factor value Averages of k 1N ×106 (s−1 mmol N−1) a R1 Me 43 Et 43 Bu 30 n 1 53 5 16 9 48 Epoxide Propylene oxide 36 Styrene oxide 23 epichlorohydrin 57 a k 1N, reaction rate per mmol of the ammonium nitrogen present in the reaction system. Estimated uncertainty of k 1N ×106 =6 (s−1 mmol N−1). Catalytic coupling of epoxides and CO2 to cyclic carbonates by carbon nanotube-supported quaternary ammonium salts Stefan Baj a ⁎ Tomasz Krawczyk a Katarzyna Jasiak a Agnieszka Siewniak a Mirosława Pawlyta b a Department of Chemical Organic Technology and Petrochemistry, Faculty of Chemistry, Silesian University of Technology, ul. Krzywoustego 4, 44-100 Gliwice, Poland Department of Chemical Organic Technology and Petrochemistry, Faculty of Chemistry, Silesian University of Technology ul. Krzywoustego 4 Gliwice 44-100 Poland b Institute of Engineering Materials and Biomaterials, Silesian University of Technology, Konarskiego 18a, 44-100 Gliwice, Poland Institute of Engineering Materials and Biomaterials, Silesian University of Technology Konarskiego 18a Gliwice 44-100 Poland ⁎ Corresponding author. Tel.: +48 32 2372973. Graphical abstract Quaternary ammonium chlorides bound to multi-walled carbon nanotubes as a catalyst for coupling of CO2 and epoxides to produce cyclic carbonates were explored. Reaction variables such as the epoxide structure, the length of alkyl substituents in the quaternary ammonium salts and the spacer chain on the catalytic performance were discussed. The yield of the cyclic carbonates varied between 7 and 89% after 6h at 110°C under low pressure (2MPa of CO2). The epoxide:catalyst mass ratio was 20–30, while 1mmolg−1 of the quaternary salt was grafted on the carbon nanotubes. A synergy between carboxyl moiety and ammonium moiety grafted on carbon nanotubes was found, and a strong impact of the length of the spacer group used for grafting of the quaternary ammonium salt on nanotubes was observed. The best performance was achieved with short (2 carbon atoms) and long (10 atoms) spacer groups, while a middle-sized spacer group (6 atoms) was not suitable. The length of the alkyl chain of the substituents of the ammonium salt (head group) had a low impact where ethyl and methyl groups performed better than butyl. The reactivity of epoxides was as follows: epichlorohydrin>propylene oxide>styrene oxide. Observations were rationalized by a mechanism where Brønsted's sites on the surface of nanotubes play an important role during carboxylation of epoxides. The catalyst can easily be separated by filtration recycled without a significant decrease in the catalytic activity if dried properly between the runs. Keywords Carbon dioxide Cyclic carbonates Epoxides Multi-walled carbon nanotubes Quaternary ammonium salts. 1 Introduction The issue of carbon dioxide utilization is particularly important, especially in the view of toughening the regulations on the discharge limits of greenhouse gases into the atmosphere. The necessity of lowering carbon dioxide emission to the atmosphere has brought about advancements in the research on using this feedstock for chemical syntheses. This is evidenced in the substantial number of publications, which is constantly growing, or the number of subsidies granted to the research on the new methods of CO2 management. Regardless of the environmental policy, CO2 is a cheap, abundant and readily available C1 source for chemical synthesis [1]. One of the possible uses of CO2 is in the cyclic carbonate synthesis, which enabled to eliminate the environmentally unfriendly process of phosgenation of glycols. The cyclic carbonate synthesis from carbon dioxide and epoxide was patented in 1943 by IG Farben [2]. In 2010, the annual output of cyclic carbonates reached 0.1 Mt [3]. These compounds are widely used in producing polymers and polycarbonates. Ethylene and propylene carbonates are used as polar aprotic solvents. They dissolve both small-molecule compounds and polymers, e.g., polyacrylonitrile and polysuccinimide. Since propylene carbonate is not toxic, it is used as a solvent for paint strippers, plastics and epoxy resins. Typically, cyclic carbonates are used as solvents in electrolytes for lithium-ion batteries. Alkylene carbonates are also utilized as modifiers of solid fast-crosslinking polyurethanes and polyurethane glues. Moreover, these compounds may be used as intermediate products in the fine chemicals synthesis, e.g., of polycarbonates or polyurethanes. Cyclic carbonates have also found their use in pharmaceutical and cosmetic industries as an additive for clay gellants [4]. Major research effort in recent years has been devoted to the development of a new catalytic system for the cyclic carbonates synthesis from CO2 and various reagents, such as epoxides or alkenes. Among others, quaternary onium salts and ionic liquids were found to be one of the most effective ones. The current research is focused on the improvement of the existing systems to develop highly active catalytic agents that would be non-toxic and environmentally friendly. Due to the potential cost reduction, it is vital to apply immobilized catalysts, as they can be easily separated from the post-reaction mixture [5]. Recently, Luo and co-workers have used a series of cross-linked polydivinylbenzene polymers covalently grafted with hydroxyl, carboxyl and amino functionalized ionic liquid as effective heterogeneous catalysts for the synthesis of cyclic carbonates in the reaction of CO2 with epoxides. These catalysts showed excellent reusability and stability [6]. Park and co-workers described the application of a series of heterogeneous zinc-containing ionic liquids on the silica gel as catalysts in the synthesis of cyclic carbonates from epoxides and CO2. The incorporation of zinc ions in the immobilized ionic liquids significantly enhanced the catalytic activity [7]. Dyson and co-workers [8] reported that cross-linked ionic polymers based on styrene-functionalized imidazolium with chloride are stable and can be easily recycled and reused. Carbon nanotubes (CNTs), among other nanomaterials, have been the object of extensive research in recent years. This arose from the fact that they have numerous beneficial properties, such as a substantial surface area, high mechanical and thermal resistance. This material found a handful of application in the cyclic carbonate synthesis. For example, 1-hydroxyethyl-3-methylimidazolium halides immobilized on CNTs have high catalyst activity, and may be recirculated five times without any substantial drop in activity. The studies have shown that these catalysts exhibited significantly enhanced catalytic activity in the CO2 and epoxides reaction in comparison to conventional heterogeneous supports based on silica and polymers [9]. Herein, the aim of the research was to develop an effective method of the cyclic alkylene carbonate synthesis from carbon dioxide and selected epoxides with the use of catalysts based on the quaternary ammonium salts immobilized on CNT. The scope of the research included the synthesis of catalysts and immobilization, as well as performing a reaction of obtaining cyclic carbonates using these immobilized catalysts in order to select an effective and stable system suitable for practical application. 2 Experimental 2.1 Materials Carbon dioxide (99.5%, from SIAD) was used without further purification. Octane (>99%), (chloromethyl)ethylene carbonate, propylene oxide (>99.5%), 2-chloroethanol (99%), 6-chloro-1-hexanol (>95%), 10-chloro-1-decanol (90%), trimethylamine (>99%) CNT (6–9nm×5μm) were purchased from Sigma Aldrich. Epichlorohydrin (>99%) was obtained from Fluka. Propylene carbonate (99.5%), styrene oxide (>97%), triethylamine (99%), tributylamine (99%), (2-hydroxyethyl)trimethylammonium chloride (99%) were bought from Acros Organics. Other chemicals were of reagent grade supplied by local manufacturers. 2.2 Synthesis of quaternary ammonium salts The method of hydroxyl functionalized quaternary salts has been described elsewhere [10]. In a typical procedure, triethylamine (0.08mol), dry toluene (25mL) and 2-chloroethanol (0.08mol) were stirred for 24h at 70°C under nitrogen atmosphere. Upon completion of the reaction, the mixture was cooled to the room temperature, filtered out and washed successively by anhydrous ether (3×15mL) and dry acetonitrile (2×10mL). Next, the product was dried under vacuum (60°C, 10 mbar, 24h). The other quaternary ammonium salts were obtained following a similar procedure (see supporting information). 2.3 Immobilization of quaternary ammonium salts on CNTs The synthesis was conducted according to Scheme 1 . Commercial CNT (5.3g) were oxidized for 5h with 320mL of the HNO3–H2SO4 mixture (1:3, v/v) in an ultrasonic bath at 50°C. The resulting black viscous suspension was diluted with water (1500mL), filtered through a 0.2μm nylon filter and washed thoroughly with water, acetone, methanol and dried in an oven (100°C). The dry product (5.1g) was mixed with an excess of thionyl chloride (60g) and stirred overnight at the room temperature. The excess of SOCl2 was removed at reduced pressure to give 4.7g of the product. A sample of dry activated oxidized carbon nanotubes (OXCNTs) (0.8g) was dispersed in dry DMF (75mL) and the excess of hydroxyl functionalized quaternary salt was added (0.45g). The reaction was conducted in an ultrasonic bath at 50°C for 1h; then dry pyridine (20mL) was added and the reaction was continued overnight with magnetic stirring at the room temperature. The suspension was then filtered through a 0.2μm nylon filter and thoroughly washed with DMF, water, acetone, methanol and cyclohexane. Finally, it was azeothropically dried for 3h using cyclohexane. The yield of the dry product was 0.7g. 2.4 Synthesis of cyclic carbonates All the reactions were carried out in a 100mL stainless steel pressure reactor (Mettler Toledo) with a mechanical stirrer (pitched-blade) immersed in a solid-state thermostat (EasyMax™ 102) with an automatic temperature control system. The pressure reactor was also equipped with temperature and pressure sensors and a rupture disk. In a typical procedure, propylene oxide (15mL, 0.21mol) and the appropriate amount of the catalyst (Table 1 and Table 3) were added into the reactor. The reactor was purged with carbon dioxide twice and then heated to 110°C. CO2 was charged into the reactor from a reservoir tank to a chosen constant pressure (2MPa). The reaction progress was monitored by means of CO2 consumption rate. After the reaction was completed, the reactor was cooled to the ambient temperature, and the excess CO2 was vented. The catalyst system was separated from the reaction mixture by simple filtration. Samples from the organic layer were taken, dissolved in CH2Cl2 and analyzed by gas chromatography (Perkin Elmer GC, Clarus 500) equipped with a capillary column (SPB™-5: 30 m×0.25mm×0.25μm film thickness). 1-Octane was used as an internal standard. 3 Results and discussion The investigation of the possibility of application of the quaternary ammonium salts immobilized on OXCNTs was initiated by a set of experiments in which a non-immobilized quaternary ammonium salt and OXCNTs were investigated as potential catalysts for the cyclic carbonate synthesis. The results are presented in Table 1. From the control runs presented in Table 1, it was clear that the reaction of CO2 with propylene oxide did not proceed in the absence of a catalyst. Interestingly, the addition of OXCNTs increased slightly the yield of the cyclic carbonate but the concentration of the product remained at trace level. More pronounced effect had the presence of a quaternary ammonium salts (entries 3–5) when the conversion of CO2 reached 15–18%. No significant effect of the structure of the ammonium salt was observed (entries 3–5). In contrast, the presence of both the quaternary ammonium catalyst and oxidized CNTs yielded a 35% conversion of CO2, and equal selectivity. Those preliminary results encouraged us to investigate the possibility of immobilizing an ammonium salt on the CNT surface chemically to obtain a recyclable catalyst of high activity. To confirm whether the CNT itself or carboxylic acid moieties display catalytic activity we added acetic acid to the reaction system instead of OXCNT (entries 7–8). Results were similar as with OXCNTs. Therefore, carboxylic moieties play a dominant catalytic role in the process. 3.1 Catalysts synthesis and characterization Catalysts were synthesized according to Scheme 1. In total, nine different substances were obtained and characterized by elemental analysis (Table 2 ), SEM and TEM (Fig. 1 ), IR (Fig. 2 ), and TGA (Fig. 3 ). From Fig. 1, it is clear that oxidation of CNTs did not substantially change the length of the tubes. Probably functional groups were only introduced randomly on the surface where structural defects facilitate the oxidation. Further functionalization with ammonium salts did not alter the microscopic structure of the material. However, small differences in arrangement of bundles of nanotubes may be identified while comparing images A, C, E, F and I. Also higher resolution images G and H suggests more loosely packed bundles when n =9 group was used. FT-IR analysis confirmed successful immobilization of the quaternary ammonium salts onto carbon nanotubes. Fig. 2 shows the FT-IR spectra of the homogeneous catalyst, oxidized CNTs and immobilized catalyst. The characteristic peaks of oxidized CNTs around 1617 and 1385cm−1 was observed. They can be ascribed to C=O and C-O stretching of carboxyl group. Free quaternary ammonium salt exhibited the characteristic bands which occurred in the region of 2869–2934cm−1. This stretching vibrations of C-H bond are specific for the molecules having a tertiary N-CH3 group. Moreover, the spectra contained peak appearing at 1055cm−1 corresponding to the C-N stretch. The peak appeared in the region of 3347cm−1 is ascribed to H2O that was not removed during drying of the samples. In the case of immobilized ammonium salt, characteristic peaks of support (1635, 1538cm−1) and quaternary ammonium salt (1199, 2861, 2934cm−1) confirmed successful immobilization. The results of the TGA analysis (shown in Fig. 3) of catalysts, OXCNTs and CNTs can be clearly distinguished. CNTs themselves are thermally stable and only small peaks (53 and 85°C) which most likely corresponds to the desorption of water or other substances. Significant decomposition of this material is visible only above 400°C. OXCNTs were more susceptible to decomposition, and additional peaks between 200 and 400°C appeared. In the case of catalysts, the degradation occurred in the same range of temperature. In all cases, 2–3 peaks were visible at approximately 200 and 300°C. Exact position of those peaks depended on the structure of alkyl substituents. If weight loss that occurred between 200 and 400°C was used to calculate the nitrogen content, the results were in good agreement with those obtained by means of elemental analysis. 3.2 Catalysts performance Among possible factors that affect the yield of cyclic carbonate synthesis using immobilized ammonium catalysts are the structure of alkyl substituents of ammonium nitrogen, halide type and the epoxide structure. In the case of halides, the views on that matter are divided. In a series of recently published papers, where tetraalkylammonium halides were considered as a possible factor in carboxylation of epoxides, it was demonstrated that the impact of the halide type strongly depends on a particular reaction system. The reason is that the opening of the epoxy ring occurs through the nucleophilic attack of a halide anion on the less-hindered carbon atom of epoxide. Therefore, the nucleophilicity of the halide is very important to facilitate this step while its leaving ability is crucial during the last step when cyclic carbonate is formed. However, experimental data vary and different orders of reactivity of halides were reported. In the case of ionic liquids immobilized on the carboxymethyl cellulose (CMIL), it was found that propylene carbonate yield increased in the order of CMIL-I (98.6%)>CMIL-Br (81.7%)>CMIL-Cl (73.2%) [11]. Similar order was reported for imidazolium ionic liquids immobilized on chitosan (CS) where the yield of propylene carbonate increased with the increase in nucleophilicity of the anion (CS-EMImBr 96%>CS-EMImCl 74%) [12]. More profound effect was observed when quaternary phosphonium salts immobilized on silica was used for the same reaction. In that case chloride resulted in 29% yield comparing with 100% for iodide [13]. Other authors reported that fluctuations of catalytic activity of different halides was in a narrow range of 1–15% [9,14,15] or no apparent influence was visible [9,12,16,17]. Interestingly, it was found that in certain instances the yield of carbonates did not rise according to the increase of the catalyst's anion nucleophilicity [18]. In one case, it was rationalized by lower stability of an iodide comparing with a bromide under employed reaction conditions [14]. In 2008, an article was published regarding the reaction of carbon dioxide with butyl glycidyl ether (BGE). This article showed that steric hindrance can have stronger influence on the course of the reaction of obtaining cyclic carbonates than the nucleophilicity of anions. In connection with this, the conversion of BGE increased in the order of Cl− >Br− >I− [19]. Some authors reported that cyclic carbonates can be obtained in similar yields regardless of the catalyst's halide type if reaction conditions are changed to offset different reactivity [20]. For example, catalytic activity of Zn3[Co(CN)6]2/TBAB (bromide) system at 120°C was the same as in the case of Zn3[Co(CN)6]2/TBAC (chloride) at 140°C. In both cases, the yield of styrene carbonate amounted in to 97% [16]. A similar phenomenon was described by Zhao et al. [21]. Another view on the subject was presented by other authors who attributed variation in catalytic activity to physical properties of halides. Shim et al. [22] claimed that the yield of styrene carbonate depend on the melting point of quaternary ammonium salt they applied. Zhou et al. [23] noticed that HBetCl (1-carboxy-N,N,N-trimethylmethanaminium chloride) showed higher catalytic activity than HBetBr, which can be explained by the difference in the catalyst solubility in the reaction mixture. HBetBr precipitated from the product, and HBetCl not. At this stage of our research, we selected ammonium chlorides as they are cheaper comparing with bromides or iodides, and we focused only on the length of alkyl substituents of the ammonium salt (head group) and the length of a spacer between the CNT functional site and the ammonium nitrogen. As the reported reactivity of epoxides towards CO2 varies and depends on the reaction system [9,12,18,24], we included this factor in our research. Each experimental variable was investigated at three levels. With three factors that could be set at three levels, the total of a 27-reaction system was possible. Investigations were performed with various catalysts according to the orthogonal array of experiments presented in Table 3 in order to limit the number of required runs. Instead of 27, only 9 runs were performed to investigate three factors: the length of the spacer group (n), the size of alkyl groups of the quaternary ammonium salt (R1) (Scheme 1) and the epoxide type. In all cases, the reaction followed the first-order kinetics at least for the first 3h. Within this period, the relationship between the reaction time and the CO2 consumption was linear on the logarithmic scale as showed in Fig. 4 . The exception was a short initial period, which could be attributed to the formation of a dispersion of the catalyst in the epoxide. For the same reason, in one case the reaction rate increased during the 6th hour (curve 8, Fig. 4). For comparison of the catalyst's performance, the interval between 3000 and 7000s was used. The corresponding slopes of kinetic curves are given in Table 3. As the quantity of the ammonium salt grafted on CNTs was different for each catalyst, we decided to compare not directly the yield of the carbonate, but the rate of the reaction divided by the amount of the ammonium nitrogen present during the reaction (k 1N). For the same reason, the quantity of the catalyst was not maintained strictly constant. The results are given in Table 4 . Each of nine main runs conducted according to the orthogonal array allowed to establish the main effect of three experimental variables simply by averaging the reaction rates of the carbonates obtained for a given setting (Table 3). In other words, based on the nine results, nine averages could be calculated and compared (Table 4). According to Table 4, the impact of the head group on the reaction rate was small. Between ethyl and methyl groups, there was no difference, whilst R1 =Bu gave lower yield compared with the other two. A more important factor was the epoxide type as the variation between the possible rates was higher. The reactivity of epoxides was as follows: epichlorohydrin>propylene oxide>styrene oxide. Compared with other published data, the observed differences were higher especially between epichlorohydrin and propylene oxide. Often it was reported that the reactivity of propylene oxide is higher than epichlorohydrin [12,16,24–31] but other teams observed the same order of reactivity as presented here [32,33]. The different behaviour of epoxides in various systems is probably a consequence of different structures of reaction sites. The presence of an electron-withdrawing chlorine atom in epichlorohydrin results in reduced electron density of the oxygen atom in epoxide [34] [35]. This probably disfavours the coordination of epoxide by carboxylic acid but facilitates the reaction of epoxide with halide ion as C1 carbon is more positively charged. In our case, the latter process is likely to be important as we used ammonium chlorides which are often reported to be less reactive comparing with bromides or iodides. The other factor that may contribute to the reactivity of epoxides is the size of molecules. In our case, the heterogeneity of the catalyst disfavours more bulky substrates such as styrene oxide which is less reactive comparing with propylene oxide or epichlorohydrin. Because in our experiment, only nine runs were performed and nine averages were calculated, there are no degrees of freedom left to calculate the significance of results. The precision of k 1N measurements is high (RSD of linear regression<0.5%). However, using the data obtained during recycle of a catalyst, we estimated the potential variations between runs as high as 15%. Taking into account all results from Table 3, it means that the differences of averages higher than 6 units of k 1N 106 can be treated as significant. Based on the obtained results, it is clear that in our system the main factor that influences the yield of carbonate was the length of the spacer group. The average rates were 16, 48 and 53 ×10−6 s−1 mmol N−1 for hexyl, ethyl and dodecyl chains, respectively. Clearly, the middle-sized spacer was the worst performer, while the shortest was similar to the longest one. Such observation, counterintuitive at first sight (see Table 1, entries 3–5), could be rationalized on the basis of the mechanism as presented in Scheme 2 . The mechanism was derived from a proposition given in previous publications [24,27,36]. Initially (Scheme 2, step A), the epoxide molecule is adsorbed at a Brønsted's site (COOH) on the surface of CNT [37]. Based on the elementary analysis, the number of carboxylic acid sites on an oxidized CNT that was used in this study was approximately 5mmolg−1. Further functionalization affords the material containing 1mmolg−1 of ammonium groups; therefore, a large number of carboxylic acid sites randomly distributed on the surface are available for the coordination of the epoxide. As short (n =1) and long (n =9) spacer groups are more effective in the process compared with the middle-sized one (n =5), but only when grafted on the CNT (entries 3–5 in Table 1) surface, it means that the chain length plays an important role during the rate-determining step. It is likely that the distance between positively charged nitrogen and carboxylic acid moiety decreases with the increase in the chain length as longer chains are more flexible. However, long alkyl chain may inhibit the approach of epoxide to the CNT surface because of steric hindrance. This effect is probably negligible for short spacer group and offset by flexibility of the longest one. Comparable effect was reported recently for amino alcohols potassium iodide catalytic system [38]. Other authors reported irregular dependence of carbonate yield on the alkyl substituents in the case of imidazolium ionic liquid catalysts [9,39,40]. However, in that research the distance between the solid support and reaction centre was not varied. Further steps (Scheme 2) include nucleophilic attack of chloride to the epoxide (B) with the subsequent ring opening, addition of CO2 (C), formation of an alkylcarboante anion stabilized by an ammonium cation and, finally, intramolecular substitution leading to abstraction of chloride and regeneration of the catalyst and cyclic carbonate desorption from the site (D). In comparison with the chloride attack and coordination of the epoxide, those steps are not likely to be affected by the structure of the ammonium salt, which supports our observation of the dominant role of the chain length. The mechanism also allowed to explain the observed impact of the remaining two factors. A small effect of the head group indicates that the epoxide–nitrogen distance is comparable to two C-C bond lengths during the initial step. For that reason we did not observe any difference in activity between catalysts containing Et or Me groups. In the case of larger Bu substituents, the epoxide approach to the carboxylic group is probably more difficult because of the overall steric hindrance around the reaction centre. The observed order of epoxides reactivity reflects the increasing positive charge on the carbon that is attacked by the chloride anion and the steric effects of the R2 group (epoxide). Compared with another publication devoted to CNT-supported catalyst for the cyclic carbonates synthesis from epoxides, we observed a higher difference of reactivity between epoxides, especially between styrene oxide comparing with propylene oxide [17]. It is therefore likely that the quaternary ammonium salts are more sensitive to the reagent's structure compared with imidazolium ionic liquids. Probably, the presence of CNTs favours only parallel orientation of aromatic ring-CNT (due to π–π interaction), which may hamper the attack of the chloride ion on the epoxide comparing with non-aromatic epoxides. This effect might be diminished by the presence of the imidazolium ring. Important role of CNT support in differentiating the reactivity of different epoxides was confirmed by two experiments analogous to entry 3 of Table 1. If styrene oxide and epichlorohydrin were used instead of propylene oxide with choline chloride as a catalyst observed conversions of CO2 were 14 and 16%, respectively (95 and 96% selectivity). Therefore, the observed differences of reactivity were lower comparing with immobilized ammonium salts. 3.3 Reuse of the catalyst A series of cycles of catalyst's reuse was performed with the catalyst of n =1 and R1 =Et using propylene oxide as a model epoxide. After correcting the results for slight losses of the catalyst during its separation from the reaction mixture, it was clear that the catalyst retains its activity (Fig. 5 ). Nevertheless, it was crucial to carefully dry the sample between the runs. Typically the catalyst was azeotropically dried for 1h with cyclohexane. After evaporation of the solvent, the solid was dried over NaOH under vacuum (50mbar). In the case of the third cycle, the drying period was only 15min, which appeared to be not enough to remove water. If no drying was performed and the catalyst was used immediately after filtering only, the yield of epoxide was approximately halved. The observation was surprising as water was demonstrated as a possible solvent for the cyclic carbonate synthesis [18]. In our system, water probably competes with the epoxide for Brønsted's sites on the nanotube's surface (Scheme 2, step A) and decreases the likelihood of the catalyst–epoxide contact. In order to confirm our assumption, we deliberately added water to the reaction system using 0.35g of OXCNT-(CH2)10(CH3)3N+Cl− and propylene oxide (0.214mol) as a model system. With the addition of 0.018g of water, the carbonate yield was 12% (97% selectivity) after 6h while 0.18g of water in the system diminished the yield to 3% only (88% selectivity). 4 Conclusions In summary, quaternary ammonium chlorides covalently bound to CNTs are proved to be efficient and recyclable heterogeneous catalysts for the solvent-free synthesis of cyclic carbonates under mild conditions. The nanotubes are not only a solid support that facilitates the reuse of the catalyst, but carboxylic moieties present on CNT surface also participate in the reaction presumably by coordination of an epoxide. The synergistic effect is clearly visible comparing the results for free, immobilized ammonium salts and for carboxylic acid-catalysed systems. The activity of the catalyst is fully retained upon reuse; however, it should be thoroughly dried between the runs. Strong impact of alkyl chain that links the surface of carbon nanotube with ammonium nitrogen indicates that steric effects play an important role in the activity of the catalyst. Acknowledgement This work was supported by the Polish National Science Centre (NCN); Decision No.: 2011/03/B/ST8/06178. Co-author of this paper Katarzyna Jasiak is a scholar under the project “DoktoRIS - scholarship program for innovative Silesia” co-financed by European Union under the European Social Fund. Appendix A Supplementary data Supplementary material related to this article can be found, in the online version, at http://dx.doi.org/10.1016/j.apcata.2014.09.034. Appendix A Supplementary data The following are Supplementary data to this article: References [1] T. Sakakura J.-C. Choi H. Yasuda Chem. Rev. 107 2007 2365 2387 [2] Ger. Patent 740366 (1943). [3] M. North R. Pasquale C. Young Green Chem. 12 2010 1514 1539 [4] A.-A.G. Shaikh S. Sivaram Chem. Rev. 96 1996 951 976 [5] D.-W. Kim R. Roshan J. Tharun A. Cherian D.-W. Park Korean J. Chem. Eng. 30 2013 1973 1984 [6] W.-L. Dai B. Jin S.-L. Luo S.-F. Yin X.-B. Luo C.-T. Au J. CO2 Util. 3–4 2013 7 13 [7] M.-I. Kim S.-J. Choi D.-W. Kim D.-W. Park J. Ind. Eng. Chem. 20 2014 3102 3107 [8] S. Ghazali-Esfahani H. Song E. Păunescu F.D. Bobbink H. Liu Z. Fei G. Laurenczy M. Bagherzadeh N. Yan P.J. Dyson Green Chem. 15 2013 1584 1589 [9] L. Han H. Li S.-J. Choi M.-S. Park S.-M. Lee Y.-J. Kim D.-W. Park Appl. Catal. Gen. 429–430 2012 67 72 [10] J. Sun S. Zhang W. Cheng J. Ren Tetrahedron Lett. 49 2008 3588 3591 [11] K.R. Roshan G. Mathai J. Kim J. Tharun G.-A. Park D.-W. Park Green Chem. 14 2012 2933 2940 [12] J. Sun J. Wang W. Cheng J. Zhang X. Li S. Zhang Y. She Green Chem. 14 2012 654 660 [13] T. Takahashi T. Watahiki S. Kitazume H. Yasuda T. Sakakura Chem. Commun. 2006 1664 1666 [14] J.-Q. Wang D.-L. Kong J.-Y. Chen F. Cai L.-N. He J. Mol. Catal. Chem. 249 2006 143 148 [15] R.A. Watile K.M. Deshmukh K.P. Dhake B.M. Bhanage Catal. Sci. Technol. 2 2012 1051 1055 [16] M.M. Dharman J.-I. Yu J.-Y. Ahn D.-W. Park Green Chem. 11 2009 1754 1757 [17] H.-J. Choi M. Selvaraj D.-W. Park Chem. Eng. Sci. 100 2013 242 248 [18] J. Sun J. Ren S. Zhang W. Cheng Tetrahedron Lett. 50 2009 423 426 [19] H.-Y. Ju M.-D. Manju K.-H. Kim S.-W. Park D.-W. Park J. Ind. Eng. Chem. 14 2008 157 160 [20] K. Kossev N. Koseva K. Troev J. Mol. Catal. Chem. 194 2003 29 37 [21] Y. Zhao J.-S. Tian X.-H. Qi Z.-N. Han Y.-Y. Zhuang L.-N. He J. Mol. Catal. Chem. 271 2007 284 289 [22] J.-J. Shim D. Kim S.R. Choon Bull. Korean Chem. Soc. 27 2006 744 746 [23] Y. Zhou S. Hu X. Ma S. Liang T. Jiang B. Han J. Mol. Catal. Chem. 284 2008 52 57 [24] D. Bai H. Jing G. Wang Appl. Organomet. Chem. 26 2012 600 603 [25] L. Han H.-J. Choi S.-J. Choi B. Liu D.-W. Park Green Chem. 13 2011 1023 1028 [26] T. Chang H. Jing L. Jin W. Qiu J. Mol. Catal. Chem. 264 2007 241 247 [27] T. Cao L. Sun Y. Shi L. Hua R. Zhang L. Guo W. Zhu Z. Hou Chin. J. Catal. 33 2012 416 424 [28] D. Anselmo V. Bocokić A. Decortes E.C. Escudero-Adán J. Benet-Buchholz J.N.H. Reek A.W. Kleij Polyhedron 32 2012 49 53 [29] J. Tharun D.W. Kim R. Roshan Y. Hwang D.-W. Park Catal. Commun. 31 2013 62 65 [30] Y. Du J.-Q. Wang J.-Y. Chen F. Cai J.-S. Tian D.-L. Kong L.-N. He Tetrahedron Lett. 47 2006 1271 1275 [31] J.-Q. Wang X.-D. Yue F. Cai L.-N. He Catal. Commun. 8 2007 167 172 [32] Y.-Y. Zhang L. Chen S.-F. Yin S.-L. Luo C.-T. Au Catal. Lett. 142 2012 1376 1381 [33] Y. Xiong F. Bai Z. Cui N. Guo R. Wang J. Chem. 2013 2013 1 9 [34] D. Bai G. Nian G. Wang Z. Wang Appl. Organomet. Chem. 27 2013 184 187 [35] T. Sakai Y. Tsutsumi T. Ema Green Chem. 10 2008 337 341 [36] F. Li L. Xiao C. Xia B. Hu Tetrahedron Lett. 45 2004 8307 8310 [37] L.-F. Xiao D.-W. Lv D. Su W. Wu H.-F. Li J. Clean. Prod. 67 2014 285 290 [38] T. Werner N. Tenhumberg J. CO2 Util. 7 2014 39 45 [39] X. Zheng S. Luo L. Zhang J.-P. Cheng Green Chem. 11 2009 455 458 [40] H. Kawanami A. Sasaki K. Matsui Y. Ikushima Chem. Commun. 9 2003 896 897",
      "scopus-id": "84929368288",
      "coredata": {
        "eid": "1-s2.0-S0926860X14005857",
        "dc:description": "Quaternary ammonium chlorides bound to multi-walled carbon nanotubes as a catalyst for coupling of CO2 and epoxides to produce cyclic carbonates were explored. Reaction variables such as the epoxide structure, the length of alkyl substituents in the quaternary ammonium salts and the spacer chain on the catalytic performance were discussed. The yield of the cyclic carbonates varied between 7 and 89% after 6h at 110°C under low pressure (2MPa of CO2). The epoxide:catalyst mass ratio was 20–30, while 1mmolg−1 of the quaternary salt was grafted on the carbon nanotubes. A synergy between carboxyl moiety and ammonium moiety grafted on carbon nanotubes was found, and a strong impact of the length of the spacer group used for grafting of the quaternary ammonium salt on nanotubes was observed. The best performance was achieved with short (2 carbon atoms) and long (10 atoms) spacer groups, while a middle-sized spacer group (6 atoms) was not suitable. The length of the alkyl chain of the substituents of the ammonium salt (head group) had a low impact where ethyl and methyl groups performed better than butyl. The reactivity of epoxides was as follows: epichlorohydrin>propylene oxide>styrene oxide. Observations were rationalized by a mechanism where Brønsted's sites on the surface of nanotubes play an important role during carboxylation of epoxides. The catalyst can easily be separated by filtration recycled without a significant decrease in the catalytic activity if dried properly between the runs.",
        "openArchiveArticle": "false",
        "prism:coverDate": "2014-11-30",
        "openaccessUserLicense": null,
        "prism:aggregationType": "Journal",
        "prism:url": "https://api.elsevier.com/content/article/pii/S0926860X14005857",
        "dc:creator": [
          {
            "@_fa": "true",
            "$": "Baj, Stefan"
          },
          {
            "@_fa": "true",
            "$": "Krawczyk, Tomasz"
          },
          {
            "@_fa": "true",
            "$": "Jasiak, Katarzyna"
          },
          {
            "@_fa": "true",
            "$": "Siewniak, Agnieszka"
          },
          {
            "@_fa": "true",
            "$": "Pawlyta, Mirosława"
          }
        ],
        "link": [
          {
            "@_fa": "true",
            "@rel": "self",
            "@href": "https://api.elsevier.com/content/article/pii/S0926860X14005857"
          },
          {
            "@_fa": "true",
            "@rel": "scidir",
            "@href": "https://www.sciencedirect.com/science/article/pii/S0926860X14005857"
          }
        ],
        "dc:format": "application/json",
        "openaccessType": null,
        "pii": "S0926-860X(14)00585-7",
        "prism:volume": "488",
        "prism:publisher": "Elsevier B.V.",
        "dc:title": "Catalytic coupling of epoxides and CO2 to cyclic carbonates by carbon nanotube-supported quaternary ammonium salts",
        "prism:copyright": "Copyright © 2014 Elsevier B.V. All rights reserved.",
        "openaccess": "0",
        "prism:issn": "0926860X",
        "dcterms:subject": [
          {
            "@_fa": "true",
            "$": "Carbon dioxide"
          },
          {
            "@_fa": "true",
            "$": "Cyclic carbonates"
          },
          {
            "@_fa": "true",
            "$": "Epoxides"
          },
          {
            "@_fa": "true",
            "$": "Multi-walled carbon nanotubes"
          },
          {
            "@_fa": "true",
            "$": "Quaternary ammonium salts."
          }
        ],
        "openaccessArticle": "false",
        "prism:publicationName": "Applied Catalysis A: General",
        "openaccessSponsorType": null,
        "prism:pageRange": "96-102",
        "prism:endingPage": "102",
        "pubType": "fla",
        "prism:coverDisplayDate": "November 2014",
        "prism:doi": "10.1016/j.apcata.2014.09.034",
        "prism:startingPage": "96",
        "dc:identifier": "doi:10.1016/j.apcata.2014.09.034",
        "openaccessSponsorName": null
      },
      "objects": {
        "object": [
          {
            "@category": "standard",
            "@_fa": "true",
            "$": "https://api.elsevier.com/content/object/eid/1-s2.0-S0926860X14005857-mmc1.docx?httpAccept=%2A%2F%2A",
            "@multimediatype": "Microsoft Word file",
            "@type": "APPLICATION",
            "@size": "80580",
            "@ref": "mmc1",
            "@mimetype": "application/word"
          },
          {
            "@category": "high",
            "@height": "619",
            "@width": "2500",
            "@_fa": "true",
            "$": "https://api.elsevier.com/content/object/eid/1-s2.0-S0926860X14005857-sc1_lrg.jpg?httpAccept=%2A%2F%2A",
            "@multimediatype": "JPEG image file",
            "@type": "IMAGE-HIGH-RES",
            "@size": "161540",
            "@ref": "sc1",
            "@mimetype": "image/jpeg"
          },
          {
            "@category": "high",
            "@height": "621",
            "@width": "900",
            "@_fa": "true",
            "$": "https://api.elsevier.com/content/object/eid/1-s2.0-S0926860X14005857-gr5_lrg.jpg?httpAccept=%2A%2F%2A",
            "@multimediatype": "JPEG image file",
            "@type": "IMAGE-HIGH-RES",
            "@size": "63456",
            "@ref": "gr5",
            "@mimetype": "image/jpeg"
          },
          {
            "@category": "high",
            "@height": "564",
            "@width": "900",
            "@_fa": "true",
            "$": "https://api.elsevier.com/content/object/eid/1-s2.0-S0926860X14005857-gr4_lrg.jpg?httpAccept=%2A%2F%2A",
            "@multimediatype": "JPEG image file",
            "@type": "IMAGE-HIGH-RES",
            "@size": "94493",
            "@ref": "gr4",
            "@mimetype": "image/jpeg"
          },
          {
            "@category": "high",
            "@height": "1342",
            "@width": "1667",
            "@_fa": "true",
            "$": "https://api.elsevier.com/content/object/eid/1-s2.0-S0926860X14005857-gr3_lrg.jpg?httpAccept=%2A%2F%2A",
            "@multimediatype": "JPEG image file",
            "@type": "IMAGE-HIGH-RES",
            "@size": "226374",
            "@ref": "gr3",
            "@mimetype": "image/jpeg"
          },
          {
            "@category": "high",
            "@height": "882",
            "@width": "1500",
            "@_fa": "true",
            "$": "https://api.elsevier.com/content/object/eid/1-s2.0-S0926860X14005857-gr2_lrg.jpg?httpAccept=%2A%2F%2A",
            "@multimediatype": "JPEG image file",
            "@type": "IMAGE-HIGH-RES",
            "@size": "123327",
            "@ref": "gr2",
            "@mimetype": "image/jpeg"
          },
          {
            "@category": "high",
            "@height": "1540",
            "@width": "1850",
            "@_fa": "true",
            "$": "https://api.elsevier.com/content/object/eid/1-s2.0-S0926860X14005857-gr1_lrg.jpg?httpAccept=%2A%2F%2A",
            "@multimediatype": "JPEG image file",
            "@type": "IMAGE-HIGH-RES",
            "@size": "629089",
            "@ref": "gr1",
            "@mimetype": "image/jpeg"
          },
          {
            "@category": "high",
            "@height": "886",
            "@width": "1786",
            "@_fa": "true",
            "$": "https://api.elsevier.com/content/object/eid/1-s2.0-S0926860X14005857-fx1_lrg.jpg?httpAccept=%2A%2F%2A",
            "@multimediatype": "JPEG image file",
            "@type": "IMAGE-HIGH-RES",
            "@size": "95535",
            "@ref": "fx1",
            "@mimetype": "image/jpeg"
          },
          {
            "@category": "high",
            "@height": "2987",
            "@width": "3333",
            "@_fa": "true",
            "$": "https://api.elsevier.com/content/object/eid/1-s2.0-S0926860X14005857-sc2_lrg.gif?httpAccept=%2A%2F%2A",
            "@multimediatype": "GIF image file",
            "@type": "IMAGE-HIGH-RES",
            "@size": "87366",
            "@ref": "sc2",
            "@mimetype": "image/gif"
          },
          {
            "@category": "standard",
            "@height": "140",
            "@width": "565",
            "@_fa": "true",
            "$": "https://api.elsevier.com/content/object/eid/1-s2.0-S0926860X14005857-sc1.jpg?httpAccept=%2A%2F%2A",
            "@multimediatype": "JPEG image file",
            "@type": "IMAGE-DOWNSAMPLED",
            "@size": "19206",
            "@ref": "sc1",
            "@mimetype": "image/jpeg"
          },
          {
            "@category": "standard",
            "@height": "234",
            "@width": "339",
            "@_fa": "true",
            "$": "https://api.elsevier.com/content/object/eid/1-s2.0-S0926860X14005857-gr5.jpg?httpAccept=%2A%2F%2A",
            "@multimediatype": "JPEG image file",
            "@type": "IMAGE-DOWNSAMPLED",
            "@size": "22745",
            "@ref": "gr5",
            "@mimetype": "image/jpeg"
          },
          {
            "@category": "standard",
            "@height": "212",
            "@width": "339",
            "@_fa": "true",
            "$": "https://api.elsevier.com/content/object/eid/1-s2.0-S0926860X14005857-gr4.jpg?httpAccept=%2A%2F%2A",
            "@multimediatype": "JPEG image file",
            "@type": "IMAGE-DOWNSAMPLED",
            "@size": "29523",
            "@ref": "gr4",
            "@mimetype": "image/jpeg"
          },
          {
            "@category": "standard",
            "@height": "303",
            "@width": "376",
            "@_fa": "true",
            "$": "https://api.elsevier.com/content/object/eid/1-s2.0-S0926860X14005857-gr3.jpg?httpAccept=%2A%2F%2A",
            "@multimediatype": "JPEG image file",
            "@type": "IMAGE-DOWNSAMPLED",
            "@size": "34649",
            "@ref": "gr3",
            "@mimetype": "image/jpeg"
          },
          {
            "@category": "standard",
            "@height": "199",
            "@width": "339",
            "@_fa": "true",
            "$": "https://api.elsevier.com/content/object/eid/1-s2.0-S0926860X14005857-gr2.jpg?httpAccept=%2A%2F%2A",
            "@multimediatype": "JPEG image file",
            "@type": "IMAGE-DOWNSAMPLED",
            "@size": "21952",
            "@ref": "gr2",
            "@mimetype": "image/jpeg"
          },
          {
            "@category": "standard",
            "@height": "579",
            "@width": "696",
            "@_fa": "true",
            "$": "https://api.elsevier.com/content/object/eid/1-s2.0-S0926860X14005857-gr1.jpg?httpAccept=%2A%2F%2A",
            "@multimediatype": "JPEG image file",
            "@type": "IMAGE-DOWNSAMPLED",
            "@size": "151768",
            "@ref": "gr1",
            "@mimetype": "image/jpeg"
          },
          {
            "@category": "standard",
            "@height": "200",
            "@width": "403",
            "@_fa": "true",
            "$": "https://api.elsevier.com/content/object/eid/1-s2.0-S0926860X14005857-fx1.jpg?httpAccept=%2A%2F%2A",
            "@multimediatype": "JPEG image file",
            "@type": "IMAGE-DOWNSAMPLED",
            "@size": "13961",
            "@ref": "fx1",
            "@mimetype": "image/jpeg"
          },
          {
            "@category": "standard",
            "@height": "337",
            "@width": "376",
            "@_fa": "true",
            "$": "https://api.elsevier.com/content/object/eid/1-s2.0-S0926860X14005857-sc2.gif?httpAccept=%2A%2F%2A",
            "@multimediatype": "GIF image file",
            "@type": "IMAGE-DOWNSAMPLED",
            "@size": "9660",
            "@ref": "sc2",
            "@mimetype": "image/gif"
          },
          {
            "@category": "thumbnail",
            "@height": "164",
            "@width": "183",
            "@_fa": "true",
            "$": "https://api.elsevier.com/content/object/eid/1-s2.0-S0926860X14005857-sc2.sml?httpAccept=%2A%2F%2A",
            "@multimediatype": "GIF image file",
            "@type": "IMAGE-THUMBNAIL",
            "@size": "3288",
            "@ref": "sc2",
            "@mimetype": "image/gif"
          },
          {
            "@category": "thumbnail",
            "@height": "54",
            "@width": "219",
            "@_fa": "true",
            "$": "https://api.elsevier.com/content/object/eid/1-s2.0-S0926860X14005857-sc1.sml?httpAccept=%2A%2F%2A",
            "@multimediatype": "GIF image file",
            "@type": "IMAGE-THUMBNAIL",
            "@size": "2657",
            "@ref": "sc1",
            "@mimetype": "image/gif"
          },
          {
            "@category": "thumbnail",
            "@height": "151",
            "@width": "219",
            "@_fa": "true",
            "$": "https://api.elsevier.com/content/object/eid/1-s2.0-S0926860X14005857-gr5.sml?httpAccept=%2A%2F%2A",
            "@multimediatype": "GIF image file",
            "@type": "IMAGE-THUMBNAIL",
            "@size": "6889",
            "@ref": "gr5",
            "@mimetype": "image/gif"
          },
          {
            "@category": "thumbnail",
            "@height": "137",
            "@width": "219",
            "@_fa": "true",
            "$": "https://api.elsevier.com/content/object/eid/1-s2.0-S0926860X14005857-gr4.sml?httpAccept=%2A%2F%2A",
            "@multimediatype": "GIF image file",
            "@type": "IMAGE-THUMBNAIL",
            "@size": "6591",
            "@ref": "gr4",
            "@mimetype": "image/gif"
          },
          {
            "@category": "thumbnail",
            "@height": "164",
            "@width": "204",
            "@_fa": "true",
            "$": "https://api.elsevier.com/content/object/eid/1-s2.0-S0926860X14005857-gr3.sml?httpAccept=%2A%2F%2A",
            "@multimediatype": "GIF image file",
            "@type": "IMAGE-THUMBNAIL",
            "@size": "4960",
            "@ref": "gr3",
            "@mimetype": "image/gif"
          },
          {
            "@category": "thumbnail",
            "@height": "129",
            "@width": "219",
            "@_fa": "true",
            "$": "https://api.elsevier.com/content/object/eid/1-s2.0-S0926860X14005857-gr2.sml?httpAccept=%2A%2F%2A",
            "@multimediatype": "GIF image file",
            "@type": "IMAGE-THUMBNAIL",
            "@size": "3533",
            "@ref": "gr2",
            "@mimetype": "image/gif"
          },
          {
            "@category": "thumbnail",
            "@height": "164",
            "@width": "197",
            "@_fa": "true",
            "$": "https://api.elsevier.com/content/object/eid/1-s2.0-S0926860X14005857-gr1.sml?httpAccept=%2A%2F%2A",
            "@multimediatype": "GIF image file",
            "@type": "IMAGE-THUMBNAIL",
            "@size": "11859",
            "@ref": "gr1",
            "@mimetype": "image/gif"
          },
          {
            "@category": "thumbnail",
            "@height": "109",
            "@width": "219",
            "@_fa": "true",
            "$": "https://api.elsevier.com/content/object/eid/1-s2.0-S0926860X14005857-fx1.sml?httpAccept=%2A%2F%2A",
            "@multimediatype": "GIF image file",
            "@type": "IMAGE-THUMBNAIL",
            "@size": "2428",
            "@ref": "fx1",
            "@mimetype": "image/gif"
          }
        ]
      },
      "link": {
        "@rel": "abstract",
        "@href": "https://api.elsevier.com/content/abstract/scopus_id/84929368288"
      }
    }
  }
}