{
  "metadata": {
    "title": "Rutile TiO<ce:inf loc=post>2</ce:inf> a desirable support for Ni catalyst in the synthesis of γ-valerolactone: Influence of titania crystal phase on the product distribution",
    "authors": "; ; ",
    "journal": "Applied Catalysis A: General",
    "date": "2023-07-25",
    "doi": "10.1016/j.apcata.2023.119282",
    "abstract": "",
    "uri": "https://api.elsevier.com/content/article/pii/S0926860X23002624",
    "pii": "S0926860X23002624"
  },
  "fulltext": {
    "full-text-retrieval-response": {
      "scopus-eid": "2-s2.0-85162745155",
      "originalText": "serial JL 271346 291210 291744 291809 31 Applied Catalysis A: General APPLIEDCATALYSISAGENERAL 2023-05-26 2023-05-26 2023-05-30 2023-05-30 2023-06-10T00:53:12 1-s2.0-S0926860X23002624 S0926-860X(23)00262-4 S0926860X23002624 10.1016/j.apcata.2023.119282 S300 S300.1 FULL-TEXT 1-s2.0-S0926860X23X00131 2024-01-01T12:35:59.692098Z 0 0 20230725 2023 2023-05-27T00:57:51.127276Z absattachment articleinfo articlenumber articletitlenorm authfirstinitialnorm authfirstsurnamenorm cid cids contenttype copyright crossmark dateloaded dateloadedtxt datesearch datesort dateupdated dco docsubtype doctype doi eid ewtransactionid hubeid indexeddate issn issnnorm itemstage itemtransactionid itemweight openaccess openarchive pg pgfirst pii piinorm pubdatestart pubdatetxt pubyr sortorder srctitle srctitlenorm srctype ssids alllist content subj subheadings suppl tomb volfirst volissue volumelist webpdf webpdfpagecount yearnav figure table e-component body acknowledge affil appendices articletitle auth authfirstini authfull authkeywords authlast grantsponsor highlightsabst primabst ref specialabst 0926-860X 0926860X true 662 662 C Volume 662 10 119282 119282 119282 20230725 25 July 2023 2023-07-25 2023 article fla © 2023 Elsevier B.V. All rights reserved. RUTILETIO2ADESIRABLESUPPORTFORNICATALYSTINSYNTHESISVALEROLACTONEINFLUENCETITANIACRYSTALPHASEPRODUCTDISTRIBUTION VARIMALLA S 1 Introduction 2 Experimental 2.1 Chemicals and materials 2.2 Preparation of Ni supported on TiO2 catalysts 2.3 Activity measurements 2.4 Catalyst characterization 3 Results 3.1 Powder XRD analysis 3.2 Raman spectroscopic analysis 3.3 H2-temperature programmed reduction (H2-TPR) 3.4 X-ray photo electron spectroscopy 3.5 UV-DRS analysis 3.6 NH3-temperature programmed desorption (TPD) 3.7 Electron paramagnetic resonance (EPR) analysis 3.8 SEM and TEM analysis 3.9 Activity studies 4 Discussion 5 Conclusions CRediT authorship contribution statement Acknowledgements Appendix A Supplementary material References TUKACS 2012 2057 2065 J PAN 2013 2967 2974 T ABDELRAHMAN 2014 1171 1181 O CHALID 2011 14 21 M SUDHAKAR 2016 113 120 M UPARE 2015 127 135 P WETTSTEIN 2012 321 329 S ELDESOKY 2020 17574 17584 M DU 2011 7815 7819 X YANG 2014 1419 1425 Y KUMAR 2018 19670 19677 V BRADEN 2011 1755 1765 D ALONSO 2013 584 595 D WRIGHT 2012 1657 1667 W ZHOU 2021 6325 6334 P VIJAYKUMAR 2016 9872 9879 V XU 2017 7600 7609 M KON 2014 3227 3234 K FANG 2022 100021 B QIAN 2022 1937 1944 X QIN 2021 1523 1526 Y RAJ 2012 1299 1305 K MENG 2022 122236 F XU 2018 11241 11251 M LUO 2015 6540 W LUO 2013 175 186 W WOJCIECHOWSKA 2019 639 650 J LI 2019 770 774 S KOTESHKUMAR 2016 91 100 M SWAPNA 2017 8783 C KOTESHKUMAR 2016 282 291 M GAUTAMA 2016 2746 2759 A NARESH 2016 19855 19862 G CHIESA 2013 9435 9447 M SELIM 2005 273 278 M LI 2006 693 702 P REHAN 2011 3725 M MESSOU 2021 14 28 D HINUMA 2018 29435 29444 Y LI 2019 6342 6348 J CUI 2022 880 890 B LI 2022 Y ZHANG 2021 297 311 X SPURR 1957 760 762 R FIGUEIREDO 2022 151647 W GUO 2018 6203 6215 Y RAUPP 1987 G CATALYSISSINTERINGREDISPERSION METALSUPPORTINTERACTIONS FU 2007 431 498 Q VIJAYKUMAR 2015 217 223 V VIJAYKUMAR 2018 142 150 V VIJAYKUMAR 2017 169 176 V PANAGIOTOPOULOU 2011 738 746 P YANG 2018 1672 1682 F VARIMALLAX2023X119282 VARIMALLAX2023X119282XS 2025-05-30T00:00:00.000Z 2025-05-30T00:00:00.000Z http://creativecommons.org/licenses/by-nc-nd/4.0/ © 2023 Elsevier B.V. All rights reserved. 2023-10-10T19:20:07.047Z http://vtw.elsevier.com/data/voc/AddOnTypes/50.7/aggregated-refined CSIR /2023/067 CSIR Council of Scientific and Industrial Research, India http://data.elsevier.com/vocabulary/SciValFunders/501100001412 http://sws.geonames.org/1269750/ All the authors thank the Director CSIR-IICT for constant support. Shirisha thank CSIR New Delhi for the award of junior research fellowship. IICT communication no. IICT/Pubs./2023/067. https://doi.org/10.15223/policy-017 https://doi.org/10.15223/policy-037 https://doi.org/10.15223/policy-012 https://doi.org/10.15223/policy-029 https://doi.org/10.15223/policy-004 item S0926-860X(23)00262-4 S0926860X23002624 1-s2.0-S0926860X23002624 10.1016/j.apcata.2023.119282 271346 2024-01-01T12:35:59.692098Z 2023-07-25 1-s2.0-S0926860X23002624-main.pdf https://s3-eu-west-1.amazonaws.com/prod-ucs-content-store-eu-west/content/pii:S0926860X23002624/MAIN/application/pdf/e2c4854f69e94a7c7195a34a26a7ca0a/main.pdf main.pdf pdf true 9415552 MAIN 12 1-s2.0-S0926860X23002624-main_1.png https://s3-eu-west-1.amazonaws.com/prod-ucs-content-store-eu-west/content/pii:S0926860X23002624/PREVIEW/image/png/b668e8e2e883a0660399e181f01569f9/main_1.png main_1.png png 55759 849 656 IMAGE-WEB-PDF 1 1-s2.0-S0926860X23002624-ga1.jpg https://s3-eu-west-1.amazonaws.com/prod-ucs-content-store-eu-west/content/pii:S0926860X23002624/ga1/DOWNSAMPLED/image/jpeg/66a4b87e33ca1343af9e54c1b4a60672/ga1.jpg ga1 true ga1.jpg jpg 27784 156 500 IMAGE-DOWNSAMPLED 1-s2.0-S0926860X23002624-gr8.jpg https://s3-eu-west-1.amazonaws.com/prod-ucs-content-store-eu-west/content/pii:S0926860X23002624/gr8/DOWNSAMPLED/image/jpeg/244654eb4a8b93aa89eaa0113d7153ff/gr8.jpg gr8 gr8.jpg jpg 32948 303 339 IMAGE-DOWNSAMPLED 1-s2.0-S0926860X23002624-gr9.jpg https://s3-eu-west-1.amazonaws.com/prod-ucs-content-store-eu-west/content/pii:S0926860X23002624/gr9/DOWNSAMPLED/image/jpeg/ce32658cec760c0c8b102b6d6c0a9425/gr9.jpg gr9 gr9.jpg jpg 15946 340 339 IMAGE-DOWNSAMPLED 1-s2.0-S0926860X23002624-gr10.jpg https://s3-eu-west-1.amazonaws.com/prod-ucs-content-store-eu-west/content/pii:S0926860X23002624/gr10/DOWNSAMPLED/image/jpeg/49927b68c712251ffb0a2a7684ee3866/gr10.jpg gr10 gr10.jpg jpg 16326 274 339 IMAGE-DOWNSAMPLED 1-s2.0-S0926860X23002624-gr4.jpg https://s3-eu-west-1.amazonaws.com/prod-ucs-content-store-eu-west/content/pii:S0926860X23002624/gr4/DOWNSAMPLED/image/jpeg/aef3ba3291877b8935ec761e53efaba3/gr4.jpg gr4 gr4.jpg jpg 41572 238 791 IMAGE-DOWNSAMPLED 1-s2.0-S0926860X23002624-gr5.jpg https://s3-eu-west-1.amazonaws.com/prod-ucs-content-store-eu-west/content/pii:S0926860X23002624/gr5/DOWNSAMPLED/image/jpeg/2b3ea62dff4dfaaf3ff7361d575afc00/gr5.jpg gr5 gr5.jpg jpg 25464 297 339 IMAGE-DOWNSAMPLED 1-s2.0-S0926860X23002624-gr7.jpg https://s3-eu-west-1.amazonaws.com/prod-ucs-content-store-eu-west/content/pii:S0926860X23002624/gr7/DOWNSAMPLED/image/jpeg/452d26c6cef054b2f545d666c5bf1e97/gr7.jpg gr7 gr7.jpg jpg 30933 276 339 IMAGE-DOWNSAMPLED 1-s2.0-S0926860X23002624-gr1.jpg https://s3-eu-west-1.amazonaws.com/prod-ucs-content-store-eu-west/content/pii:S0926860X23002624/gr1/DOWNSAMPLED/image/jpeg/9ebede191134eac47ee1f7245e6d2e17/gr1.jpg gr1 gr1.jpg jpg 55676 609 339 IMAGE-DOWNSAMPLED 1-s2.0-S0926860X23002624-gr2.jpg https://s3-eu-west-1.amazonaws.com/prod-ucs-content-store-eu-west/content/pii:S0926860X23002624/gr2/DOWNSAMPLED/image/jpeg/bb1977f536a5cf3f0441a1cba3385c3c/gr2.jpg gr2 gr2.jpg jpg 23232 316 339 IMAGE-DOWNSAMPLED 1-s2.0-S0926860X23002624-gr3.jpg https://s3-eu-west-1.amazonaws.com/prod-ucs-content-store-eu-west/content/pii:S0926860X23002624/gr3/DOWNSAMPLED/image/jpeg/9ca861b9f2bdd767fea9693c67a10908/gr3.jpg gr3 gr3.jpg jpg 19995 296 339 IMAGE-DOWNSAMPLED 1-s2.0-S0926860X23002624-sc1.jpg https://s3-eu-west-1.amazonaws.com/prod-ucs-content-store-eu-west/content/pii:S0926860X23002624/sc1/DOWNSAMPLED/image/jpeg/3e79cae49dd9d5ad4f4312f5649d8ecc/sc1.jpg sc1 sc1.jpg jpg 40437 209 678 IMAGE-DOWNSAMPLED 1-s2.0-S0926860X23002624-gr6a.jpg https://s3-eu-west-1.amazonaws.com/prod-ucs-content-store-eu-west/content/pii:S0926860X23002624/gr6a/DOWNSAMPLED/image/jpeg/66fadd9d5afe14b658ad6dfd56c955ae/gr6a.jpg gr6a gr6a.jpg jpg 224825 988 791 IMAGE-DOWNSAMPLED 1-s2.0-S0926860X23002624-gr6b.jpg https://s3-eu-west-1.amazonaws.com/prod-ucs-content-store-eu-west/content/pii:S0926860X23002624/gr6b/DOWNSAMPLED/image/jpeg/968190bf047f12a7c5459e74294d17de/gr6b.jpg gr6b gr6b.jpg jpg 130716 394 791 IMAGE-DOWNSAMPLED 1-s2.0-S0926860X23002624-ga1.sml https://s3-eu-west-1.amazonaws.com/prod-ucs-content-store-eu-west/content/pii:S0926860X23002624/ga1/THUMBNAIL/image/gif/d514d60dbd0b08b86c4fbb4013ed2d0f/ga1.sml ga1 true ga1.sml sml 8097 68 219 IMAGE-THUMBNAIL 1-s2.0-S0926860X23002624-gr8.sml https://s3-eu-west-1.amazonaws.com/prod-ucs-content-store-eu-west/content/pii:S0926860X23002624/gr8/THUMBNAIL/image/gif/67133e3c879f9dfe9f4e34e74f8381ab/gr8.sml gr8 gr8.sml sml 11116 164 184 IMAGE-THUMBNAIL 1-s2.0-S0926860X23002624-gr9.sml https://s3-eu-west-1.amazonaws.com/prod-ucs-content-store-eu-west/content/pii:S0926860X23002624/gr9/THUMBNAIL/image/gif/9bfa99c6824776b70548c04927c1b702/gr9.sml gr9 gr9.sml sml 6309 164 163 IMAGE-THUMBNAIL 1-s2.0-S0926860X23002624-gr10.sml https://s3-eu-west-1.amazonaws.com/prod-ucs-content-store-eu-west/content/pii:S0926860X23002624/gr10/THUMBNAIL/image/gif/55d90935338578e9a0b6735670f927a7/gr10.sml gr10 gr10.sml sml 8048 164 203 IMAGE-THUMBNAIL 1-s2.0-S0926860X23002624-gr4.sml https://s3-eu-west-1.amazonaws.com/prod-ucs-content-store-eu-west/content/pii:S0926860X23002624/gr4/THUMBNAIL/image/gif/86552a3c2363c61376f07f107cb53fec/gr4.sml gr4 gr4.sml sml 4167 66 219 IMAGE-THUMBNAIL 1-s2.0-S0926860X23002624-gr5.sml https://s3-eu-west-1.amazonaws.com/prod-ucs-content-store-eu-west/content/pii:S0926860X23002624/gr5/THUMBNAIL/image/gif/33a1f988d1e52e1b43c26ee3e30fe352/gr5.sml gr5 gr5.sml sml 8141 164 187 IMAGE-THUMBNAIL 1-s2.0-S0926860X23002624-gr7.sml https://s3-eu-west-1.amazonaws.com/prod-ucs-content-store-eu-west/content/pii:S0926860X23002624/gr7/THUMBNAIL/image/gif/751bd1da7f74cd04eab6b7928b2fd050/gr7.sml gr7 gr7.sml sml 13887 164 201 IMAGE-THUMBNAIL 1-s2.0-S0926860X23002624-gr1.sml https://s3-eu-west-1.amazonaws.com/prod-ucs-content-store-eu-west/content/pii:S0926860X23002624/gr1/THUMBNAIL/image/gif/7942661e8615f2a6b42d0d15a4256fbc/gr1.sml gr1 gr1.sml sml 6212 163 91 IMAGE-THUMBNAIL 1-s2.0-S0926860X23002624-gr2.sml https://s3-eu-west-1.amazonaws.com/prod-ucs-content-store-eu-west/content/pii:S0926860X23002624/gr2/THUMBNAIL/image/gif/234c0ec3e77ddcee08418b51053d8744/gr2.sml gr2 gr2.sml sml 7513 164 176 IMAGE-THUMBNAIL 1-s2.0-S0926860X23002624-gr3.sml https://s3-eu-west-1.amazonaws.com/prod-ucs-content-store-eu-west/content/pii:S0926860X23002624/gr3/THUMBNAIL/image/gif/d908b5895353265cb215598d4bce4691/gr3.sml gr3 gr3.sml sml 7672 164 188 IMAGE-THUMBNAIL 1-s2.0-S0926860X23002624-sc1.sml https://s3-eu-west-1.amazonaws.com/prod-ucs-content-store-eu-west/content/pii:S0926860X23002624/sc1/THUMBNAIL/image/gif/3d2bfb439187606267f1a6deeb55fa57/sc1.sml sc1 sc1.sml sml 6566 68 219 IMAGE-THUMBNAIL 1-s2.0-S0926860X23002624-gr6a.sml https://s3-eu-west-1.amazonaws.com/prod-ucs-content-store-eu-west/content/pii:S0926860X23002624/gr6a/THUMBNAIL/image/gif/37fd597e9d4b0417ca53d602879544c8/gr6a.sml gr6a gr6a.sml sml 15150 164 131 IMAGE-THUMBNAIL 1-s2.0-S0926860X23002624-gr6b.sml https://s3-eu-west-1.amazonaws.com/prod-ucs-content-store-eu-west/content/pii:S0926860X23002624/gr6b/THUMBNAIL/image/gif/e264cdc8b941b527bfc47339635b68dc/gr6b.sml gr6b gr6b.sml sml 19539 109 219 IMAGE-THUMBNAIL 1-s2.0-S0926860X23002624-ga1_lrg.jpg https://s3-eu-west-1.amazonaws.com/prod-ucs-content-store-eu-west/content/pii:S0926860X23002624/HIGHRES/image/jpeg/4fb44d97ce51c0a823e40b06464fe372/ga1_lrg.jpg ga1 true ga1_lrg.jpg jpg 202661 690 2213 IMAGE-HIGH-RES 1-s2.0-S0926860X23002624-gr8_lrg.jpg https://s3-eu-west-1.amazonaws.com/prod-ucs-content-store-eu-west/content/pii:S0926860X23002624/HIGHRES/image/jpeg/0384fad18ad1d2d9c7c1008ad8c3eb1e/gr8_lrg.jpg gr8 gr8_lrg.jpg jpg 169375 1336 1497 IMAGE-HIGH-RES 1-s2.0-S0926860X23002624-gr9_lrg.jpg https://s3-eu-west-1.amazonaws.com/prod-ucs-content-store-eu-west/content/pii:S0926860X23002624/HIGHRES/image/jpeg/944592764d132564997e2a6aeb2a5b82/gr9_lrg.jpg gr9 gr9_lrg.jpg jpg 78021 1503 1497 IMAGE-HIGH-RES 1-s2.0-S0926860X23002624-gr10_lrg.jpg https://s3-eu-west-1.amazonaws.com/prod-ucs-content-store-eu-west/content/pii:S0926860X23002624/HIGHRES/image/jpeg/c3248ffa4939da7a863ee46ab09897da/gr10_lrg.jpg gr10 gr10_lrg.jpg jpg 75828 1208 1497 IMAGE-HIGH-RES 1-s2.0-S0926860X23002624-gr4_lrg.jpg https://s3-eu-west-1.amazonaws.com/prod-ucs-content-store-eu-west/content/pii:S0926860X23002624/HIGHRES/image/jpeg/3313de215bee66d90b4a04e5b0b181d9/gr4_lrg.jpg gr4 gr4_lrg.jpg jpg 183258 1050 3493 IMAGE-HIGH-RES 1-s2.0-S0926860X23002624-gr5_lrg.jpg https://s3-eu-west-1.amazonaws.com/prod-ucs-content-store-eu-west/content/pii:S0926860X23002624/HIGHRES/image/jpeg/4357839bfc5ba36258e0a47e80f3a0f7/gr5_lrg.jpg gr5 gr5_lrg.jpg jpg 129105 1311 1497 IMAGE-HIGH-RES 1-s2.0-S0926860X23002624-gr7_lrg.jpg https://s3-eu-west-1.amazonaws.com/prod-ucs-content-store-eu-west/content/pii:S0926860X23002624/HIGHRES/image/jpeg/d5ed5242dc8f50f14e609faf56978cdb/gr7_lrg.jpg gr7 gr7_lrg.jpg jpg 176917 1218 1497 IMAGE-HIGH-RES 1-s2.0-S0926860X23002624-gr1_lrg.jpg https://s3-eu-west-1.amazonaws.com/prod-ucs-content-store-eu-west/content/pii:S0926860X23002624/HIGHRES/image/jpeg/d9b7ec116bf868ada51e48c0e13932a2/gr1_lrg.jpg gr1 gr1_lrg.jpg jpg 289289 2688 1497 IMAGE-HIGH-RES 1-s2.0-S0926860X23002624-gr2_lrg.jpg https://s3-eu-west-1.amazonaws.com/prod-ucs-content-store-eu-west/content/pii:S0926860X23002624/HIGHRES/image/jpeg/6f39357585349caf8bc85709de0d4534/gr2_lrg.jpg gr2 gr2_lrg.jpg jpg 132301 1396 1497 IMAGE-HIGH-RES 1-s2.0-S0926860X23002624-gr3_lrg.jpg https://s3-eu-west-1.amazonaws.com/prod-ucs-content-store-eu-west/content/pii:S0926860X23002624/HIGHRES/image/jpeg/17d5bae30c6adf6f19432063e67bb983/gr3_lrg.jpg gr3 gr3_lrg.jpg jpg 143541 1306 1497 IMAGE-HIGH-RES 1-s2.0-S0926860X23002624-sc1_lrg.jpg https://s3-eu-west-1.amazonaws.com/prod-ucs-content-store-eu-west/content/pii:S0926860X23002624/HIGHRES/image/jpeg/9a1fa31537f37987a20e59e2013f7bc6/sc1_lrg.jpg sc1 sc1_lrg.jpg jpg 174505 924 2994 IMAGE-HIGH-RES 1-s2.0-S0926860X23002624-gr6a_lrg.jpg https://s3-eu-west-1.amazonaws.com/prod-ucs-content-store-eu-west/content/pii:S0926860X23002624/HIGHRES/image/jpeg/b9a2fb265b8a6a9f146c7f60eea04252/gr6a_lrg.jpg gr6a gr6a_lrg.jpg jpg 1028159 4361 3493 IMAGE-HIGH-RES 1-s2.0-S0926860X23002624-gr6b_lrg.jpg https://s3-eu-west-1.amazonaws.com/prod-ucs-content-store-eu-west/content/pii:S0926860X23002624/HIGHRES/image/jpeg/674ad66440d11acaff4821c2d94f6538/gr6b_lrg.jpg gr6b gr6b_lrg.jpg jpg 781170 1738 3493 IMAGE-HIGH-RES 1-s2.0-S0926860X23002624-mmc1.docx https://s3-eu-west-1.amazonaws.com/prod-ucs-content-store-eu-west/content/pii:S0926860X23002624/mmc1/MAIN/application/vnd.openxmlformats-officedocument.wordprocessingml.document/a7749c7ab77c51e37c8f4ec18c8c2bdc/mmc1.docx mmc1 mmc1.docx docx 4159182 APPLICATION 1-s2.0-S0926860X23002624-am.pdf https://s3-eu-west-1.amazonaws.com/prod-ucs-content-store-eu-west/content/egi:107FHCCQRZD/MAIN/application/pdf/a4927d44433648554c569c7d18bb519e/am.pdf am am.pdf pdf false 2026598 AAM-PDF APCATA 119282 119282 S0926-860X(23)00262-4 10.1016/j.apcata.2023.119282 Elsevier B.V. Fig. 1 XRD patterns of (a) fresh (b) reduced form of (i) 10 wt%Ni/TiO2-500(A) calcined at 500 °C (ii) 10 wt%Ni/TiO2-P25 calcined at 500 °C (iii) 10 wt%Ni/TiO2-550(A, R) (iv) 10 wt%Ni/TiO2-650(R, A) (v) 10 wt%Ni/TiO2-750(R, A) and (vi) 10 wt%Ni/TiO2-800(R) samples. Fig. 1 Fig. 2 Raman spectroscopic analysis of the reduced catalysts of (a) 10 wt%Ni/TiO2-800(R) (b) 10 wt%Ni/TiO2-P25 and (c) 10 wt%Ni/TiO2-500(A) samples. Fig. 2 Fig. 3 H2-TPR profiles of (a) 10 wt%Ni/TiO2-500(A) (b) 10 wt%Ni/TiO2-P25 and (c) 10 wt%Ni/TiO2-800(R) samples. Fig. 3 Fig. 4 X-ray photoelectron spectra of (i) 10 wt%Ni/TiO2-500(A) (ii) 10 wt%Ni/TiO2-800(R) fresh calcined catalysts. Fig. 4 Fig. 5 NH3-TPD profiles of (a) 10 wt%Ni/TiO2-800(R) (b) 10 wt%Ni/TiO2-P25 (c) 10 wt%Ni/TiO2-500(A) samples. Fig. 5 Fig. 6 TEM images reduced samples of 10 wt%Ni/TiO2-800(R) (a-d); 10 wt%Ni/TiO2-500(A) (g-j); SAED pattern of 10 wt%Ni/TiO2-800(R) (e); 10 wt%Ni/TiO2-500(A) (k); HAADF-STEM images of 10 wt%Ni/TiO2-800(R) (6 f); 10 wt%Ni/TiO2-500(A) (6 l); and EDX mapping of Ni, Ti, O of (6 m-p) for 10 wt%Ni/TiO2-800(R) and (6q-t) for 10 wt%Ni/TiO2-500(A). Fig. 6 Fig. 7 Influence of TiO2-500(A) calcination temperature (550 – 750 °C) on 10 wt%Ni in the hydrogenation of levulinic acid. Fig. 7 Fig. 8 LA hydrogenation activity over physically mixed rutile TiO2, anatase TiO2 and mixed of anatase and rutile TiO2 supported 10 wt%Ni catalysts. Fig. 8 Fig. 9 Rate of GVL formation vs rutile phase composition present in the Ni/TiO2 catalysts calcined at different temperatures. Fig. 9 Fig. 10 H2-TPD patterns of (i) 10 wt%Ni/TiO2-500(A) (ii) 10 wt%Ni/TiO2-800(R) catalysts. Fig. 10 Scheme 1 Levulinic acid conversion mechanism over anatase and/or rutile TiO2 supported Ni catalyst. Scheme 1 Table 1 Physicochemical properties of the catalysts. Table 1 Catalyst BET-SA (m2g−1) a H2 uptake (µmol/gcat) b NH3 uptake (µmol/g) c Ni crystallite size (nm) d Ni particle size (nm) Ni particle size (nm) e Ni dispersion (%) f 10 wt%Ni/TiO2-P25 51 883 185 14.6 15.7 - 0.57 10 wt%Ni/TiO2-500(A) 44 1314 177 15.9 14.7 19.5 0.56 10 wt%Ni/TiO2-800(R) 10 1064 42 20.7 17.0 24.5 0.66 a Calculated from H2-TPR b Calculated from NH3-TPD c Calculated from XRD data using Scherrer equation d Calculated from EPR spectra e Ni particle size measured by SEM analysis f Measured by CO pulse chemisorption Table 2 Aqueous levulinic acid hydrogenation of over Ni supported on TiO2-500(A), TiO2-P25, TiO2-800(R) catalysts. Catalyst wt: ∼ 0.1 g reduced at 500 °C for 3 h; GHSV = 8.166 mL s−1 gcat −1 at a reaction temperature of 260 °C. Table 2 Catalyst LA Conv. (mol%) Selectivity (mol%) Rate / 10−6 mol (gcat)−1 s−1 α-AL β-AL GVL VA r ALs r GVL TiO2 – 500(A) 5.0 51.0 49.0 - - 13.6 - TiO2 – P25 2.0 60.0 40.0 - - 5.4 - TiO2 – 800(R) 0.7 45.5 54.5 - - 1.9 - 5 wt%Ni/TiO2 – 500(A) 7.4 21.3 19.1 57.8 1.8 8.1 11.6 10 wt%Ni/TiO2 – 500(A) 7.5 29.4 7.2 54.3 9.0 7.5 11 15 wt%Ni/TiO2 – 500(A) 41.1 5.8 4.3 88.0 1.9 11.3 98.7 10 wt%Ni/TiO2 – 500(A) a 17.6 17.6 17.2 13.0 66.4 61.2 6.2 10 wt%Ni/TiO2 – 500(A) b 29.3 7.5 6.3 84.4 1.7 11.0 67.4 10 wt%Ni/TiO2 – 500(A) c 1.6 55.0 45.0 - - 4.3 - 10 wt%Ni/TiO2 – 500(A) d 4.0 31.9 24.0 44.0 - 6.1 4.8 10 wt%Ni/TiO2 – A e 9.8 39.6 0.0 60.4 - 10.6 16 5 wt%Ni/TiO2 – 800(R) 70.4 0.3 - 97.4 2.3 0.6 186.9 10 wt%Ni/TiO2 – 800(R) 92.6 0.8 - 96.9 2.3 2.0 245 15 wt%Ni/TiO2 – 800(R) 98.4 2.5 - 88.9 8.5 6.7 238.5 10 wt%Ni/TiO2 – 800(R) a 98.0 0.5 - 88.8 10.6 1.3 237.3 10 wt%Ni/TiO2 – 800(R) c 0.4 38.6 61.4 - - 1.1 - 10w%Ni/TiO2 – 800(R) d 96.3 - - 98.0 2.0 - 257 10w%Ni/TiO2 – P25 15.7 35.0 5.7 48.3 10.9 17.4 21 a Reaction performed at 270 °C. b Reaction performed at 280 °C. c Reaction performed without reduction. d Reaction performed after reduction of the catalyst at 350 °C for 3 h. e Activity over 10 wt%Ni supported on commercial anatase TiO2. Rutile TiO2 a desirable support for Ni catalyst in the synthesis of γ-valerolactone: Influence of titania crystal phase on the product distribution Shirisha Varimalla a b Sasikumar Boggala a Kalpana Manda a Padmasri Hari Aytam c Venugopal Akula a b ⁎ a Department of Catalysis and Fine Chemicals, CSIR – Indian Institute of Chemical Technology, Tarnaka, Hyderabad 500 007, Telangana, India Department of Catalysis and Fine Chemicals, CSIR – Indian Institute of Chemical Technology Tarnaka Hyderabad Telangana 500 007 India Department of Catalysis and Fine Chemicals, CSIR – Indian Institute of Chemical Technology, Tarnaka, Hyderabad, TS, India – 500 007 b Academy of Scientific and Innovative Research (AcSIR), Ghaziabad 201002, India Academy of Scientific and Innovative Research (AcSIR) Ghaziabad 201002 India Academy of Scientific and Innovative Research (AcSIR), Ghaziabad, 201002, India. c Department of Chemistry, University College of Science, Osmania University, Hyderabad 500 007, Telangana, India Department of Chemistry, University College of Science, Osmania University Hyderabad Telangana 500 007 India Department of Chemistry, University College of Science, Osmania University, Hyderabad, TS, India – 500 007 ⁎ Corresponding author at: Department of Catalysis and Fine Chemicals, CSIR – Indian Institute of Chemical Technology, Tarnaka, Hyderabad 500 007, Telangana, India. Department of Catalysis and Fine Chemicals, CSIR – Indian Institute of Chemical Technology Tarnaka Hyderabad Telangana 500 007 India Rutile TiO2 was identified as a suitable support for nickel than the anatase form in the selective conversion of levulinic acid (LA) to γ-valerolactone (GVL) with a 20-fold rate enhancement. TEM-HAADF results revealed a high degree of Ni encapsulation by titania species on the anatase that resulted in lower LA conversion with a high selectivity of angelica lactones. While nickel plateaus with protruding particles partially covered by TiOx overlayers on a rutile surface was the reason for the higher rate of GVL. CO chemisorption results indicated a lower uptake on 10 wt%Ni/TiO2-anatase than on the 10 wt%Ni/TiO2-rutile catalyst and a high rate of hydrogen spillover was manifested by rutile TiO2 supported Ni catalyst than its counterpart anatase. Variations in the crystal phase of TiO2 and their interaction with nickel could substantially influence the GVL formation. High intrinsic activity of 10 wt%Ni/TiO2-800(R) was explained and discussed using surface and bulk characteristics of the catalysts. Graphical Abstract ga1 Key words Ni-TiO2 interaction Titania migration Gamma-valerolactone H2-spillover TEM-HAADF Data Availability No data was used for the research described in the article. 1 Introduction Due to the depletion of non-renewable resources, R&D has focused on biomass as a carbon source for the production of fine chemicals and transportation fuels. Levulinic acid (LA), a biomass-derived compound, can be transformed into fuel additives and commodity chemicals [1]. Catalytic conversion of LA to fine chemicals such as angelica lactone (AL), γ-valerolactone (GVL), valeric acid (VA) and 2-methyl tetrahydrofuran (2-MTHF) has attracted much attention in the recent years due to their prominence in the oil, refinery and in the transportation sector [2]. LA can be hydrogenated to GVL through two distinct pathways; one involves its reduction to 4-hydroxyvaleric acid (4-HVA) followed by dehydration to GVL, and the other entails dehydration of LA to angelica lactone (AL) and then reduction to GVL [3]. Several homogeneous catalysts for the LA hydrogenation have been reported, e.g., Ru-based catalysts yielding high LA conversion and GVL selectivity [4]. The catalyst separation and recycling of the spent catalyst are somehow known barriers connected with these catalysts. LA has been hydrogenated over a number of heterogeneous catalysts utilizing molecular H2 or formic acid as the H-donor. Earlier we achieved a GVL rate of 15 × 10−6 mol h−1 (molRu)−1 at moderate temperature on Ru/HAP catalyst at 5 bar H2 pressure [5]. At 265 °C and 1 bar of H2 pressure, Upare & co-workers stated, LA conversion into 1,4 dioxane over commercial Ru/C, Pd/C, and Pt/C catalysts, which showed 98.6% selectivity [6]. The hydrogenation of LA with 2-sec-butyl phenol as a solvent using a Ru-Sn bimetallic system was reported by the Dumesic group at 180 °C and 35 bar H2 pressure [7]. The majority of reported studies on LA hydrogenation were carried out under elevated hydrogen pressures with noble-based metal catalysts and, in a few instances, non-ecofriendly solvents. Among the noble metals, supported Ru catalysts showed better activity in LA hydrogenation to GVL [7–14]. In contrast, the base metals, e.g., supported Ni catalysts, showed their prominence in the transformation of LA to GVL [5,15]. These Ni supported on conventional and non-conventional supports such as Al2O3, SiO2, TiO2, ZrO2 and zeolites demonstrated good LA conversions and > 90% selectivity towards GVL [16]. An important study reported by Kenichi et al. using TiO2 as a support that possesses largely (>95%) surface Lewis acidity had great impact on the product ratio during the LA conversion to GVL and VA [17,18]. TiO2 with different morphologies and varied structures have been identified as potential catalyst systems for solar energy conversion applications [19]. Qian et al. reported highly efficient 2D TiO2 nano-sheets for the electrocatalytic nitrogen reduction [20]. In a recent study Tian and co-workers developed TiO2 nano-belts for the photocatalytic antibacterial activity [21]. However, studies pertaining to interfacial sites appear to be involved in the hydrogenation of LA to GVL [22–24]. The influence of the TiO2 support phase (anatase, rutile, or a mixture of these two) on the Ni catalyst is not well explored for the transformation of LA to GVL. Studies on LA hydrogenation on the TiO2 supported metal catalysts, Luo et al. reported a GVL rate of 1.97 molGVL (gmetal)−1 h−1 over 1 wt% Au-Pd/TiO2 catalyst at 40 bar pressure [25] and about 98% GVL yields over 1 wt%Ru/TiO2 catalyst [26]. Exploring the calcium modified TiO2 supported Ru catalyst, Wojciechowska et al. demonstrated a GVL rate of 29 mmol (gcat)−1 h−1 using formic acid as a hydrogen source at 5 bar pressure [27]. Huang et al. examined the bimetallic Fe-Re supported TiO2 and achieved 95% of GVL yield at 40 bar [28]. Ruthenium supported on different shapes of TiO2, Li et al. excellent GVL yields at 30 bar pressure and room temperature conditions [29]. Most of these investigations were carried out in a batch process at elevated H2 pressures over metal supported on TiO2 catalysts. In this investigation we found rutile TiO2 as a facile support for nickel that showed tremendously higher rate of GVL ∼ 257 × 10−6 mol (gcat)−1 s−1. Hence, we made a detailed investigation on the role of TiO2 (anatase and rutile) supported Ni catalysts for the LA conversion and GVL rates. The as-synthesized TiO2 (anatase) sample was subjected to calcination at various temperatures (500–800 °C) to comprehend the role of anatase, rutile, and a mixture of these two supported Ni catalysts. For comparison purposes, a P25 (commercial TiO2 comprised of a mixture of anatase and rutile) denoted TiO2-P25 and a commercial anatase TiO2 was used as supports for Ni and examined with identical experimental conditions, for the process of LA hydrogenation. The hydrogenation activity of Ni supported on rutile-TiO2 was 20-fold higher than that of anatase-TiO2. The rationale behind the typical behavior of Ni supported on different TiO2 phases (anatase, rutile, and a mixture of anatase and rutile) was examined and discussed for the hydrogenation of LA in conjunction with bulk, surface properties of these catalysts (fresh, some of which were reduced and used) characterized by using various techniques, details are given in [SI]. 2 Experimental 2.1 Chemicals and materials Nickel (II) nitrate hexahydrate (Ni(NO3)2⋅6 H2O), levulinic acid (LA; 98%), α-angelica lactone (AL; 98%) titanium-tetra isopropoxide, isopropanol and γ-valerolactone (GVL; 99%) procured from Sigma-Aldrich (analytical grade), utilized without undergoing further purification. Deionized water was utilized for the catalyst's preparation. The TiO2-Anatase (denoted as TiO2-A) was obtained by calcining the as-synthesized TiO2 sample at 500 °C. The TiO2 Degussa-P25 (BET-surface area = 50.7 m2 g−1 containing both anatase and rutile phases) and a commercial anatase TiO2 (Sigma-Aldrich, BET-SA = 15.8 m2 g−1) were used as supports as such. The TiO2-A was calcined in air subjected to varying temperatures ranging from 500° to 800°C for 5 h which are denoted as TiO2-500(A), TiO2-550(A, R), TiO2-650(R, A), TiO2-A750(R, A), and TiO2-800(R), and were used as supports. 2.2 Preparation of Ni supported on TiO2 catalysts The TiO2 was synthesized following the procedure reported earlier [30]. A loading of 10 wt%Ni is fixed for the preparation of the catalysts. To facilitate comparison, the commercial TiO2-P25 and anatase TiO2 (Sigma-Aldrich) were prepared using impregnation technique. In a standard procedure, needed amount of aqueous Ni(NO3)2. 6 H2O solution was mixed with a desired amount of solid support material subjected to continuous stirring at 100 °C until the water was evaporated, then oven dried at 120 °C for 12 h before being calcination was performed in static air at 500 °C for 5 h to produce a nominal 10 wt% Ni on respective supports. The actual Ni loadings confirmed by ICP-OES are found to be around 10 wt% with ± 0.2 wt% Ni [Table S1]. Powder XRD analysis indicated that the TiO2-P25 sample displayed both rutile, anatase and the commercial TiO2 showed anatase phase only. The TiO2 subjected to calcination at 500 °C, exhibited reflections due to anatase peaks only while the TiO2 calcined at 800 °C showed exclusively the rutile phase, hence, hereafter, these samples are denoted as TiO2-500(A) and TiO2-800(R) respectively. Remaining samples are denoted with respect to their calcination temperatures (550 −750 °C) as all of these were composed of both anatase and rutile TiO2 phases e.g., the TiO2 calcined at 550 °C is noted as TiO2-550(A, R) and the same for TiO2-650(R, A) and TiO2-750(R, A) samples. 2.3 Activity measurements The hydrogenation of aqueous levulinic acid was performed in a fixed-bed quartz reactor (10 mm id, 420 mm length) in a down-flow mode. About 0.1 g of catalyst (−18/+25 sieved particles) was placed in between two quartz wool plugs in the middle of the reactor. The catalyst was reduced at 500 °C for 3 h in H2 at a flow rate of 30 mL min−1. After reduction, the catalyst sample was brought to the desired reaction temperature (260 °C) and the aqueous LA (10 wt%) was fed at a flow rate of 1.0 mL h−1 along with a H2 flow rate of 30 mL min−1 using a syringe feed pump (M/s. B. Braun, Germany). Mass flow controllers (Alicat Scientific make) were employed to monitor the gas flow rates. For each 1 h, the product mixture was collected in an ice trap and analyzed using GC-MS (QP5050A Shimadzu) and a gas chromatograph (Agilent 7890 A GC equipped with an EB capillary wax column and an FID detector) and 1,4-dioxane was used an internal standard. The products were also confirmed by 1H and 13C NMR spectroscopy [Fig. S2]. The reactor outlet was connected to a GC-TCD (thermal conductivity detector), and no COx (x = 1 and/or 2) products were identified. The carbon depositions on the used catalysts were found to be less than 0.5% and the carbon mass balance is > 99%, unless otherwise mentioned. 2.4 Catalyst characterization Different characterization techniques were employed in order to rationalize the surface and bulk properties of these catalysts by using BET-SA, powder XRD, H2-TPR, H2-TPD, NH3-TPD, XPS, Raman spectroscopy, EPR, UV-DRS, CO pulse chemisorption, SEM, TEM-HAADF, ICP-OES and CHNS analyses. To avoid the self-plagiarism, all the experimental details related to the above techniques are mentioned in ESI. 3 Results 3.1 Powder XRD analysis The diffraction patterns obtained from X-ray analysis of calcined fresh 10 wt%Ni/TiO2-500(A), 10 wt%Ni/TiO2-550(A,R), 10 wt%Ni/TiO2-650(R,A), 10 wt%Ni/TiO2-750(R,A), 10 wt%Ni/TiO2-800(R), and 10 wt%Ni/TiO2-P25 samples indicated diffraction peaks attributed to the NiO phase, with peaks appeared at 2θ = 37.2° and 43.2° ( Fig. 1a) [ICDD # 78–0429]. The Ni impregnated on the as-synthesized TiO2-A calcined from 550° to 750°C showed both anatase and rutile peaks. Only anatase in 10 wt%Ni/TiO2-500(A) and just rutile phase in 10 wt%Ni/TiO2-800(R) (along with NiO peaks were present in both) hereafter these samples are called as 10 wt%Ni/TiO2-500(A) and 10 wt%Ni/TiO2-800(R) respectively. From these patterns, it is clearly noticed that the anatase phase was slowly diminished with an increase in calcination temperature of TiO2 up to 750 °C and is absent at 800 °C with emergence of sharp rutile signals (Fig. 1a iii-vi). Overall, these normalized patterns showed weak diffraction lines of NiO phase compared to the TiO2 phase. The intensities of the peaks due to rutile phase became sharp with increase in calcination temperature of TiO2-500(A). After reduction at 500 °C, these samples showed solely metallic Ni phase at 2θ = 44.5° and 52° (ICDD # 04–0850) in all the samples along with prominent anatase and rutile peaks (Fig. 1b). Traces of anatase peaks are still found in TiO2 calcined at 750 °C, but completely disappeared in the sample calcined at 800 °C. The peaks appearing at 25.5, 48.1 and 62.76° are ascribed to the TiO2-anatase phase [JCPDS No. 21–1272] found only in TiO2-500(A) both in fresh and reduced samples [8]. Diffraction lines due to rutile peaks are appeared at 2θ = 27.5°, 36.1°, 54.5° [JCPDS no. 21–1276] and the 10 wt%Ni/TiO2-P25 shows the main diffraction signals at 25.5° (anatase) and 27.5° (rutile) (Fig. 1b ii-vi). All the diffraction signals can be assigned to either the anatase phase or rutile phase, and the observation did not reveal any other peaks related to titania. The crystallite size of nickel is increased due to a minimize in surface area of the TiO2 probably because of anatase phase underwent transformation to the rutile phase upon calcination from 550 to 800 °C (Table S2). As observed from the XRD patterns, anatase (101) and rutile (110) are the most intense and exposed facets of the respective TiO2 phase. The anatase peaks are slightly broader than the FWHM of the peaks corresponding to the rutile phase. 3.2 Raman spectroscopic analysis The Raman spectra of the 10 wt%Ni/TiO2-800(R), 10 wt%Ni/TiO2-P25 and 10 wt%Ni/TiO2-500(A) samples are displayed in Fig. 2. The 10 wt%Ni/TiO2-800(R) sample exhibited stretching vibrations at 141, 425 and 610 cm−1, which correspond to the B1g, Eg and A1g symmetries, respectively (Fig. 2a). The broad band seen near 254 cm−1 is ascribed to O-O interactions involving three- and four-coordinate oxygen [15]. The Ni supported on TiO2-500(A) and TiO2-P25 (Fig. 2b, c) showed the Eg band, which is a result of O-Ti-O symmetric stretching vibrations observed at 151 and 630 cm−1. The B1g band appeared at 393 cm−1, which is attributed to the symmetric bending vibration of O-Ti-O, and the antisymmetric bending vibration occurred at 510 cm−1 that corresponds to the A1g band [31]. These results indicated a clear distinction between the anatase and rutile forms of TiO2 present in the catalysts (Fig. 2). In the presence of the rutile phase (Fig. 2b), band intensities due to the anatase phase are suppressed in the 10 wt%Ni/TiO2-P25 sample. Furthermore, the relative peak intensities of the anatase phase were almost diminished in 10 wt%Ni/TiO2-800(R), which is in good correlation with XRD analyses wherein the anatase diffraction peak intensities are decreased by the occurrence of intensified rutile peaks (Fig. 1b vi). 3.3 H2-temperature programmed reduction (H2-TPR) The reduction characteristics of 10 wt%Ni supported on TiO2-500(A), TiO2-800(R) and TiO2-P25 catalysts was analyzed by H2-TPR ( Fig. 3). The H2 consumptions are reported in ( Table 1) and extent of reduction is presented in SI (Fig. S1 and Table S3). The 10 wt%Ni/TiO2-500(A) showed reduction of NiO around 500 °C predominantly, with a small peak at 340 °C (Fig. 3a). The 10 wt%Ni/TiO2-P25 sample displayed two-stage reduction profiles with a weak reduction signal and an intense peak at 525 °C was observed (Fig. 3b). In contrast, the 10 wt%Ni/TiO2-800(R) sample showed a broad reduction peak centered around 390 °C with a small hump at 500 °C. It is unlikely to discard the partial reduction of TiO2 that is expected at high temperatures to form oxygen vacancy sites such as Ti+3-Ov [17]. These patterns clearly indicated that nickel oxide particles got reduced at low temperature which are interacted with rutile phase of TiO2. On the contrary, the Tmax was found to be high for NiO when it interacted with anatase TiO2. More than 95% of the nickel oxide present in 10 wt%Ni/TiO2-800(R) was reduced below 450 °C. Conversely, NiO/TiO2-500(A) and NiO/TiO2-P25 catalysts were reduced at and above 500 °C to a large extent. The low temperature peak around 390 °C appeared in Ni/TiO2-P25 is probably caused by the reduction of NiO interacting with the rutile TiO2 phase [22]. The variation in the reduction maxima of NiO particles on different phases of titania could be due to the different degree of interaction between the nickel and the TiO2 or a high degree of hydrogen spillover occurring on the Ni/TiO2-800(R) sample [13]. 3.4 X-ray photo electron spectroscopy The X-ray photoelectron spectra of the 10 wt%Ni/TiO2-500(A) and 10 wt%Ni/TiO2-800(R) fresh samples are presented in Fig. 4. The Ni 2 P spectra of both 10 wt%Ni/TiO2-500(A) and 10 wt%Ni/TiO2-800(R) shows 2p3/2 signal at 855.4 and 2p1/2 at 872.7 eV which are in consistent with the earlier reports [14]. The accompanying satellite peaks at 861.9 and 879.2 eV indicate that NiO species are present at the near surface region (Fig. 4a). The peaks associated to Ti (2p3/2) and Ti (2p1/2) seen at 458.83 and 464.6 eV for 10 wt%Ni/TiO2-500(A) and 458.71 and 464.5 eV for 10 wt%Ni/TiO2-800(R) respectively, indicate the presence of Ti+4 species (Fig. 4b). The different Ti-Ti and Ti-O distances in the anatase and rutile forms of TiO2 may be a possible reason for a small change in the binding energy. The O 1 s spectra of 10 wt%Ni/TiO2-500(A) show a sharp peak at 529.6 eV, with additional shoulder peaks detected at 531.7 and 533.1 eV (Fig. 4c i). The weak signal at higher BE may originate from surface OH groups which is absent in the rutile TiO2 supported Ni catalyst that exhibited a sharp O 1 s peak centered at 529.6 eV [32], while the FTIR spectra of these catalysts exhibited weak signal due to –OH group in 10 wt%Ni/TiO2-800(R) compared to the 10 wt%Ni/TiO2-500(A) catalyst (SI, Fig. S13). 3.5 UV-DRS analysis The UVDR spectra of the TiO2-500(A), TiO2-P25 and TiO2-800(R) samples are reported in Fig. S3i. The spectra show two prominent bands at 230 and 310 nm. The fresh 10 wt%Ni/TiO2-500(A), 10 wt%Ni/TiO2-P25 and 10 wt%Ni/TiO2-800(R) catalysts showed similar absorption bands to those that appeared in the bare supports, which originated from O → Ti charge transitions (O2p to Ti3d) (Fig. S3ii). The 10 wt%Ni/TiO2-800(R) (Fig. S3iiic) showed a bathochromic shift (310–355 nm), which is explained by the presence of larger Ni particles compared to the nickel present in both the 10 wt%Ni/TiO2-500(A) and 10 wt%Ni/TiO2-P25 catalysts [33]. The band at 720 nm represents the octahedral Ni2+ species in the NiO lattice (Fig. S3ii a, b, c). This band is absent in the reduced samples (Fig. S3iii) indicating the complete reduction of Ni2+ species into metallic Ni, which is in good correlation with XRD analysis [34]. 3.6 NH3-temperature programmed desorption (TPD) The strength and distribution of acid sites on the catalyst surface was estimated by NH3-TPD analysis ( Fig. 5), and the NH3 uptakes of the 10 wt%Ni/TiO2-800(R), 10 wt%Ni/TiO2-P25, 10 wt%Ni/TiO2-500(A) samples are presented in Table 1. Nature of the acid sites are either Bronsted or Lewis or both but TiO2 encompasses more of Lewis acidity than the Bronsted acidity [18]. However, the surface ionic nickel species would act as Lewis acid centers, and their strength may be lower than the other transition metal oxides when the surface nickel is partially reduced, though in this case, NH3-TPD was analyzed after a reductive pretreatment. Both 10 wt%Ni/TiO2-P25 and 10 wt%Ni/TiO2-500(A) showed an intense NH3 desorption peak at 165 °C along with weak signals at 630 and 700 °C. Quite interestingly, the low temperature peak (165 °C) is absent in the 10 wt%Ni/TiO2-800(R) catalyst (Fig. 5a). On the other hand, the 10 wt%Ni/TiO2-800(R) displayed signals assigned to strong acid sites in the temperature region 600–750 °C. More than 90% of sites represent weak to medium strength over Ni supported on anatase and P25 catalysts. Although relatively weak signals are found with the rutile TiO2-supported nickel catalyst, those are very strong acid sites. There is a peak shift towards high temperatures found over 10 wt%Ni/TiO2-P25 catalyst as the peak tail extended up to 450 °C. This is presumably due to a certain portion of TiO2 in the rutile phase in P25. 3.7 Electron paramagnetic resonance (EPR) analysis The EPR signals present in the fresh calcined samples are found to be weak (Fig. S4). These signals originated from the electrons trapped by oxygen vacancies present in TiO2 crystal. Calcination of TiO2-500(A) at high temperature (800 °C) led to the generation of oxygen vacancies; consequently, high intensity signals were observed at low field over the 10 wt%Ni/TiO2-800(R) catalyst. The ‘g′ values of ca. 1.992, 1.964 and 1.980, 1.945 are assigned to Ti+3 species present in 10 wt%Ni/TiO2-500(A) and 10 wt%Ni/TiO2-800(R), respectively [35]. In the reduced catalysts, the signal at \"g\" is equivalent to 2.2, which is attributed to metallic Ni (Fig. S5). The following equation demonstrates the relationship between the line width ΔHpp (ΔHpp = peak-to-peak width) of the EPR signal and the particle size of a nanoparticle, where “a” is the proportionality constant, “d” is the particle size in nm, and ΔHpp is the line width of the ESR signal in mT, and. d = a(ΔHpp)0·5 The proportionality constant for nickel was found to be \"1.2\" [36]. The peak to peak width of the Ni(0) signal is observed to be high in the 10 wt%Ni/TiO2-800(R) catalyst (Fig. S5) relative to the 10 wt%Ni/TiO2-500(A) and 10 wt%Ni/TiO2-P25 catalysts at ca. 200, 152 and 172 mT, respectively. Though the Ni(0) particle size measured from EPR and XRD analyses are slightly varied, the trends are similar for these catalysts (Table 1). 3.8 SEM and TEM analysis The morphological features of the TiO2-500(A), 10 wt%Ni/TiO2-500(A) and 10 wt%Ni/TiO2-800(R) catalysts were elucidated by scanning electron microscopy (Fig. S6- S8). Smaller particles with a uniform size distribution can be observed on both 10 wt%Ni/TiO2-500(A) and 10 wt%Ni/TiO2-800(R) catalysts. To gain more insights in to the morphology of Ni particles on anatase and rutile TiO2 surfaces, TEM analysis is performed ( Fig. 6). It shows that the Ni particles are in an irregular shape over the 10 wt%Ni/TiO2-800(R) and flat and raft-like nickel particles on the 10 wt%Ni/TiO2-500(A) catalyst (Fig. 6a-d). These images show nucleation of nickel on TiO2 is occurred in different way as the shapes of nickel particles are varied with change in crystal phase. This is explained by a higher interfacial energy for Ni/TiO2-anatase than for Ni/TiO2-rutile. From the environmental TEM analysis of the in-situ reduced Ni/TiO2-anatase and Ni/TiO2-rutile samples, Li et al. reported that Ni nanoparticles nucleate both on rutile and anatase supports [37]. The nickel particles are mostly flat on anatase surface and evidence of raft-like nickel clusters are seen (Fig. 6i). Sort of nickel plateaus are clearly visible on the rutile surface which couldn’t be seen on the anatase TiO2. Furthermore, the growth of nickel nanoparticles is three-dimensional on the anatase and in a two-dimensional structure on the rutile TiO2 surface with Ni plateaus (Fig. 6c, d, j). The average Ni particle size on rutile and anatase TiO2 surfaces are found to be 20.0 and 14.6 nm (Fig. 6), and the corresponding histograms are shown in SI (Fig. S10), which are in a close range when compared to the particle size measured by XRD and EPR analyses (Table 1). The lattice fringes observed with a plane distance of 0.201 nm are typical of the (111) plane and can be inferred due to Ni particles that are oriented along the (111) crystallographic direction. The SAED (selected area electron diffraction) patterns of 10 wt%Ni/TiO2-500(A) (Fig. 6k) shows that the TiO2-500(A) is in the polycrystalline, while in 10 wt%Ni/TiO2-800(R) (Fig. 6e), the particles are mostly single-crystalline in nature [38]. The high angle annular dark field (HAADF) images (Fig. 6f, l) indicated the distribution of Ni, Ti, and O elements present in the 10 wt%Ni/TiO2-800(R) and 10 wt%Ni/TiO2-500(A) samples (Fig. 6m-t). 3.9 Activity studies Levulinic acid hydrogenation has been carried out at 260 °C and the results are presented in Table 2. In the absence of nickel, the bare TiO2-500(A), TiO2-P25 and TiO2-800(R) displayed a LA conversion of 5%, 2%, and 0.7% respectively, with 100% selectivity towards angelica lactones, i.e., the LA dehydration products such as α-AL and β-AL in almost equal proportions with 50% selectivity each ( Scheme 1). Obviously, no hydrogenation products such as GVL and VA was expected because of the fact that Ni was absent. The Ni impregnated on the TiO2 calcined at 500 °C (10 wt%Ni/TiO2-500(A)) catalyst demonstrated a low LA conversion ∼7.5% with selectivity of angelica lactones ∼ 36.6% (α- about 29.4 and β- 7.2%) and 54.3% of GVL, indicating the role of nickel that could convert the ALs in to GVL. While the Ni doped on high temperature calcined TiO2 supports (550–750 °C i.e., 10 wt%Ni/TiO2-550(A, R), 10 wt%Ni/TiO2-650(R, A) and 10 wt%Ni/TiO2-750(R, A) showed that the LA conversion is linearly increased from 7.5% to 90.3%, conversely the selectivity of α-AL, β-AL are decreased and the GVL selectivity is increased from 54.3% to 95% ( Fig. 7). The 10 wt%Ni/TiO2-800(R) (TiO2 calcined at 800 °C that exhibited pure rutile TiO2 along with nickel diffraction lines) showed tremendously high LA conversion of about 92.6% with a GVL rate of 245 × 10−6 moles (gcat)−1 s−1 when compared to other catalysts. In the comparative analysis, anatase TiO2 supported Ni exhibited a meagre GVL rate of 11 × 10−6 mole (gcat)−1 s−1. The TiO2-P25 (Degussa) supported Ni catalyst has been examined under similar conditions that showed slightly improved LA conversion of 15.7%, with an almost similar range of selectivity towards ALs, GVL and VA as compared to the 10 wt%Ni/TiO2-500(A) catalyst. The 10 wt%Ni/TiO2-A-commercial catalyst showed 9.8% LA conversion with α-AL (39.6%) and a GVL selectivity of 60.4%. These results indicated that nickel interacting with rutile TiO2 demonstrated enhanced LA conversion as well as GVL selectivity when compared to the 10 wt%Ni/TiO2-500(A) and 10 wt%Ni/TiO2-P25 catalysts (Table 2). In order to rationalize the role of the rutile phase of TiO2 for Ni, we have examined (under similar experimental conditions) the varied ratios of physically mixed 10 wt%Ni/TiO2-500(A) and 10 wt%Ni/TiO2-800(R) catalysts with proportions of 3:1, 1:1, and 1:3 (by weight ratio), respectively, for the hydrogenation of LA ( Fig. 8). The activity data on these physically mixed catalysts revealed that both the LA conversion and GVL selectivity increased with an increase in the loading of the 10 wt%Ni/TiO2-800(R) catalyst. To avoid ambiguity, the catalytic activities on these physically mixed catalysts are replicated for the LA hydrogenation, and the precision levels are within a 5% range in terms of LA conversion and product selectivity (Table S4). The higher rate of GVL over rutile TiO2 supported Ni was rationalized based on the physicochemical characteristics of the catalysts. At a reaction temperature of 260 °C, the LA hydrogenation measurements showed that the 5 wt%Ni/TiO2-500(A) catalyst displayed a more or less similar rate of GVL formation compared to 10 wt%Ni/TiO2-500(A). While the 15 wt%Ni/TiO2-500(A) demonstrated improved LA conversion (41%), as well as selectivity towards GVL (88%), when compared to 10 wt%Ni/TiO2-500(A) catalyst. Whereas the 5 wt%Ni/TiO2-800(R) catalyst exhibited lower GVL rates compared to the 10 and 15 wt%Ni/ TiO2-800(R) catalysts. A marginal improvement in LA conversion was observed over 15 wt%Ni/TiO2-800(R) catalyst with a small decrease in GVL selectivity (Table 2). On the other hand, the 5 wt%Ni/TiO2 – 800(R) catalyst exhibited better performance than all the various Ni (5, 10, 15 wt%) supported on TiO2-500(A) catalysts. While the TiO2-500(A) calcined at different temperature from 550° to 750°C (TiO2-550(A, R); TiO2-650(R, A) and TiO2-750(R, A)); none of these supports showed formation of the GVL or VA, except the angelica lactones with varied proportions, which is obviously due to the absence of nickel (Table S5). The effect of reaction temperature on the TiO2-500(A) and TiO2-800(R) supported Ni catalysts was studied at 270 °C (Table 2). Upon increasing the reaction temperature to 270 °C, the LA conversion was found to be 17.6% with slightly improved selectivity towards GVL (66.4%) over the 10 wt%Ni/TiO2-500(A) catalyst. Further increase in reaction temperature to 280 °C; both the LA conversion and GVL selectivity were found to be higher than the catalyst tested at 260 °C. (Table 2). In contrast, the 10 wt%Ni/TiO2-800(R) catalyst showed a decrease in GVL selectivity at 270 °C. This is probably due to the further conversion of GVL to VA occurring at 270 °C. The CHNS analysis confirmed the deposition of a small amount of carbon on both 10 wt%Ni/TiO2-500(A) and 10 wt%Ni/TiO2-800(R) catalysts recovered after 24 h of run (Table S6). 4 Discussion Nickel nanoparticles that interact with the anatase and rutile phases of TiO2 represent different degrees of defect sites due to the difference in the orientation of the anatase and rutile space groups, and such defect sites play a significant role in the catalytic process. From the DFT study, Hinuma et al. reported that the catalytic performance of metal oxides can be unraveled from the energy required to remove oxygen from a surface to form O vacancy sites and the activation of hydrogen on such sites for the catalytic hydrogenation reactions [39,40]. According to them, the energy required for the oxygen vacancy sites on rutile TiO2 is lower than that for anatase TiO2. Many studies have shown the typical behavior of nickel when it interacts with different phases of TiO2 for the hydrogenation of CO2 [41], hydrodeoxygenation of m-cresol [42], and methanation of COx (x = 1 and/or 2) [43]. These studies revealed that the catalytic activity and selectivity of Ni-based systems are entirely different when different crystal phases of TiO2 are used as a support. Some efforts have been made for the measurement of the catalytic activity of Ni supported on TiO2 (anatase and rutile) for the hydrodeoxygenation of guaiacol [44] and CO2 methanation [39]. However, synthesis of GVL using biomass derived levulinic acid conversion is not yet reported over Ni supported on different crystal phases such as anatase and/or rutile. Here we found a high intrinsic activity in the LA conversion with a GVL rate of 257 × 10−6 mol (gcat)−1 s−1 over 10 wt%Ni/TiO2-800(R), which is 20 times higher than on the 10 wt%Ni/TiO2-500(A) catalyst. It is interesting to note that the physically mixed catalysts showed improved LA conversion as well as the GVL selectivity with an increase in rutile phase composition (Fig. 8). A similar trend is observed with the TiO2-A calcined at higher temperatures ranging from 550° to 800°C which showed an increase in rutile phase composition with incremental calcination temperature. The rutile phase composition of these catalysts is determined according to the formula proposed by Spurr and Myer [45]. A plot of GVL rates against the rutile phase composition present in the TiO2 (subjected to different calcination temperatures) supported Ni catalyst is reported in Fig. 9. With an increase in rutile phase composition, GVL rates are linearly increased, indicating the self-consistency of our analysis, where the GVL rates are analogous to the physically mixed catalysts. The hydrogenation of LA activities over the 10 wt%Ni/TiO2-500(A) and 10 wt%Ni/TiO2-800(R) catalysts are distinctly varied. According to Messou et al., there are implications associated with using CO as a probe molecule to estimate the nickel metal dispersions, particularly in the case of Ni/TiO2 catalysts, due to the migration of titania on the nickel surface [39]. The CO pulse chemisorption studies indicated that a little higher nickel dispersion was observed on 10 wt%Ni/TiO2-800(R) (0.66%) compared to 10 wt%Ni/TiO2-500(A) (0.56%) catalysts (Table 1). The strong metal-support interaction (SMSI) is a known phenomenon, between partially reducible oxide supports such as TiO2 [46] and nickel [47] when they are subjected to high temperature reductive-treatments. The Ni particle size measured from the CO uptakes on both the 10 wt%Ni/TiO2-800(R) and 10 wt%Ni/TiO2-500(A) catalysts is found to be very high when compared to the Ni particle size measured by TEM analysis (Fig. S10). This discrepancy can be understood from the TiOx overlayer coverage on both the anatase and rutile TiO2 supported Ni catalysts. However, the TEM analysis showed a high ratio of TiOx overlayers on the surface of the Ni supported on anatase TiO2 and, to a lesser extent, on rutile TiO2. The CO pulse chemisorption data showed a slightly higher CO uptake (0.254 cm3/g) over 10 wt%Ni/TiO2-800(R) than on 10 wt%Ni/TiO2-500(A) catalyst (0.217 cm3/g), suggesting a little higher exposure of nickel on the surface of the rutile TiO2, although the surface area of rutile is four times less than the anatase. A very low CO uptake on both the 10 wt%Ni/TiO2-800(R) and 10 wt%Ni/TiO2-500(A) catalysts reflects the large size Ni particles when compared to the average Ni particle size measured by TEM analysis (Fig. S10). This is understood from the TiOx overlayers coverage on Ni particles [39]. While correlated to the Ni particle size in terms of the catalytic performance of these catalysts, 10 wt%Ni/TiO2-800(R) performed better than the 10 wt%Ni/TiO2-500(A) catalyst because of the fact that the nickel particles are largely covered by TiOx overlayers on anatase TiO2 compared to the rutile support, which is further supported by a lower CO uptake over 10 wt%Ni/TiO2-500(A) catalyst, and the Ni particle size obviously manifested to be high. Furthermore, the TEM-HAADF results ascertained the partial coverage of Ni by TiOx overlayers on rutile supported Ni catalyst, and a large extent of TiOx overlayers are found on Ni/TiO2-anatase catalyst. Therefore, it is difficult to correlate the role of Ni particle size on catalytic performance while the Ni particle size was measured by CO pulse chemisorption in parenthesis with the TEM data, particularly in the case of Ni supported on TiO2 (anatase and/or rutile) catalysts for the hydrogenation of LA, as TiOx overlayer formation is inevitable. Furthermore, the SMSI effect could change the geometry of the particle and the overall dispersion of surface nickel. However, we found a lower CO uptake on the 10 wt%Ni/TiO2-500(A) catalyst compared to the 10 wt%Ni/TiO2-800(R) catalyst (Table 1). It was reported that during the catalyst preparation, a small amount of TiO2 may be dissolved in the impregnation solution, and such species will be deposited on the surface of Ni particles during the reduction process [48]. Such phenomena can be validated only when the catalyst preparation techniques (impregnation, precipitation, or deposition-precipitation) and the extent of titania dissolution in the nickel precursor solution with varied pHs are investigated. However, from the environmental-TEM analysis of the both anatase and rutile TiO2 supported Ni catalysts, Li et al. proved that the SMSI effect was occurring to a small extent rather what has been said by Raupp et al. [37]. Nevertheless, the high-resolution TEM-HAADF images indicated a partial coverage of TiOx overlayers on Ni/TiO2-800(R) and a thin layer of TiOx coverage on the Ni/TiO2-500(A) sample (Fig. 6c, j), which was also seen in the elemental mapping of these samples (6 m, 6 n, and 6q, 6r). The TPD of NH3 further supports this observation, as the NH3 uptake was four times higher on the 10 wt%Ni/TiO2-500(A) catalyst compared to the 10 wt%Ni/TiO2-800(R) catalyst, complimenting a higher coverage of TiOx on the nickel surface of the 10 wt%Ni/TiO2-500(A) catalyst, and contributing to enhanced acidity (Table 1). The other reason for the higher acidity on 10 wt%Ni/TiO2-500(A) catalyst may also be due to a higher surface area of TiO2(A) than the TiO2(R). Apart from these, isolated Ni patches are observed on both the Ni/TiO2-500(A) and 10 wt%Ni/TiO2-800(R) surfaces; in contrast, protruding particles with plateaus of nickel islands are seen only in the rutile supported Ni catalyst. The protruding Ni particles are partially covered with TiOx overlayers (Fig. 6c) in 10 wt%Ni/TiO2-800(R), while a thin layer of Ni is surrounded by TiOx around the Ni particle on 10 wt%Ni/TiO2-500(A) (Fig. 6j). This could be explained further from the H2-TPR patterns, which illustrated a high temperature reduction of nickel particles on anatase TiO2 compared to rutile TiO2 supported nickel and the reduction of such TiOx species requires higher temperatures than the reduction of surface exposed nickel oxide particles (Fig. 3). The X-ray photoelectron spectra (Fig. 4c) also revealed that the oxygen is in different environments at the near surface region of the Ni/TiO2-500(A) catalyst [49]. The first step in LA hydrogenation is the formation of angelica lactones, which is facilitated by surface acidic sites [50]. The adsorption of β-AL is more facile than the adsorption of α-AL on the Ni surface. A higher percentage of α-AL than β-AL is explained by the relatively less steric hindrance of the double (present in β-AL compared to α-AL) adsorption on the Ni metal site for its reduction to form GVL (Scheme 1, Table 2). The pure supports showed only the dehydration product, i.e., angelica lactones. Earlier, we reported the LA hydrogenation over bulk NiO catalyst that showed high selectivity towards GVL (98%) though the LA conversion was very low [16]. And the catalysts tested without reduction behaved like support materials in both catalysts (10 wt%Ni/TiO2-500(A) and 10 wt%Ni/TiO2-800(R)), demonstrating the formation of angelica lactones only (Table 2 c); which is explained by the absence of metallic nickel that activates the hydrogen and reduces the double bond present in the angelica lactones (Scheme 1). Reductive pre-treatment has some significance on the catalytic activity and product selectivity. When the catalysts reduced at 350 °C/3 h; the 10 wt%Ni/TiO2-500(A) showed 4% LA conversion with a high ratio of both ALs (α-, β-) of about 56% and GVL selectivity of 44%. In contrast, 10 wt%Ni/TiO2-800(R) demonstrated improved LA conversion and GVL selectivity of 98% when the catalyst was reduced at 350 °C without the formation of ALs (Table 2 d). The absence of ALs suggests that the reductive pretreatment at 350 °C could be ideal to achieve the best GVL yields. These results indicate that reductive pretreatment has a strong influence on the selective hydrogenation activity of Ni/TiO2 catalysts for the production of GVL, a valuable fuel additive. Cui et al. also demonstrated the importance of reductive pretreatment during the hydrodeoxygenation of m-cresol over Ni/TiO2 catalysts [42]. The product distribution acquired with these catalysts showed the formation of valeric acid (VA) of about 9–10% over 10 wt%Ni/TiO2-500(A) and 10 wt%Ni/TiO2-P25 and less than 3% on the 10 wt%Ni/TiO2-800(R) catalyst. Needless to say, VA has equal importance as it can also be used as a fuel additive. Formation of VA occurs through the ring-opening of GVL through β-proton abstraction on the surface Bronsted acid sites [51]. The 10 wt%Ni/TiO2-500(A) catalyst showed a little higher VA selectivity than the 10 wt%Ni/TiO2-800(R) catalyst, which can be explained by the presence of a surface -OH group, which was visible in the O 1 s spectra of the 10 wt%Ni/TiO2-500(A) catalyst, appeared at a BE of 531–532.5 eV as a shoulder peak (Fig. 4c) [32]. Formation of VA can also be explained due to the hetero-junctions on the surface, sort of Ni0/Niδ+ species may be formed due to surface heterogeneity which was seen in TEM-HAADF results as the TiOx overlayers covered on the nickel particles on 10 wt%Ni/TiO2-500(A) catalyst. This observation is further supported by the H2-TPR results, wherein the reduction maximum was extended beyond 500 °C on the 10 wt%Ni/TiO2-500(A) catalyst and such hetero-junctions may prevail on the catalyst surface while nickel particles are in close proximity to TiOx species [52]. The TEM-HAADF indicated that the spots of TiOx overlayers are high, and a major portion of Ni was encapsulated and only a small portion of surface Ni remained exposed over the 10 wt%Ni/TiO2-500(A) catalyst (Fig. 6n, r). While the partially covered TiOx overlayers were found with 10 wt%Ni/TiO2-800(R) catalyst (Fig. 6m-r). Messou et al. investigated the hydrogen spillover on Ni supported on both anatase and rutile TiO2. Based on the H2-TPD studies, they concluded that the hydrogen spillover was higher over Ni supported on rutile TiO2-R than on the anatase TiO2 catalyst [39,53]. To establish the hydrogen spillover effect, we have performed the H2-TPD of these catalysts and the patterns are reported in Fig. 10. The H2 desorption peak starts at 100 °C on the rutile supported Ni, while it is at 150 °C for the Ni/TiO2-500(A). In the comparative analysis, H2-TPD showed that the H2 uptake was 3.7 times higher on 10 wt%Ni/TiO2-800(R) than on the 10 wt%Ni/TiO2-500(A) catalyst, demonstrating a strong hydrogen spillover phenomenon. The Tmax for H2 desorption on the 10 wt%Ni/TiO2-500(A) and 10 wt%Ni/TiO2-800(R) catalysts were 218 and 277 °C respectively. The amount of H2 desorbed on these catalysts is found to be 3.0 × 10−6 moles (gcat)−1 and 11 × 10−6 moles (gcat)−1 for 10 wt%Ni/TiO2-500(A) and 10 wt%Ni/TiO2-800(R) catalysts respectively. The H2-TPD patterns showed the desorption signals for both 10 wt%Ni supported on TiO2-500(A) and TiO2-800(R) samples which was below ∼450 °C. However, such signals are believed to be weakly adsorbed H2 or decomposition of subsurface NiHx species [54]. A lower rate of H2 spillover on the 10 wt%Ni/TiO2-500(A) is explained by a high ratio of nickel particles covered by TiOx; consequently, a lower CO uptake was also observed (Table 1). This could be the reason why a higher rate of angelica lactones was formed on Ni supported anatase TiO2 and the reverse is the case for the 10 wt%Ni/TiO2-800(R) catalyst. Due to the difference in crystal morphology and also the variation in the surface area of the TiO2, patchy Ni particles on anatase that protrude as well as isolated Ni clusters are seen on the rutile surface, which were reduced at low temperatures and consequently obtained with an improved GVL. 5 Conclusions The as-synthesized TiO2 when subjected to calcination from 500° to 800°C produced anatase, rutile and a mixer of these two phases depends upon the temperature applied. Raman shifts are quite distinctly noticed based on their phase (anatase, rutile or a mixture of these) composition and their relative ratios. The nickel supported on these supports emphasized that rutile TiO2 was suggested to be a preferable support for Ni in the selective conversion of levulinic acid to γ-valerolactone, a valuable fuel additive. In the absence of Ni, the pure supports did show some activity for the conversion of LA to angelica lactones only and GVL and valeric acid were not found. Transformation of anatase to rutile occurred during high temperature calcination, which had a pronounced effect on the hydrogenation activity of Ni/TiO2 catalysts. Based on the surface and bulk properties of these catalysts, it is summarized that the TiO2-R is a desirable support for Ni in the selective hydrogenation of LA to GVL attributed to its ease of reduction, hydrogen spillover, higher CO uptake and lower acidity of the catalyst. Unlike the TiO2-A which showed a shift in reduction of NiO species to higher temperatures in H2-TPR pattern due to the encapsulation of Ni particles by TiOx overlayers (TEM-HAADF results), lower CO uptake and higher acidity of the support responsible for predominant formation of angelica lactones and suppressed hydrogenation activity to form GVL. CRediT authorship contribution statement V Shirisha: Catalyst synthesis and activity studies. B Sasikumar: Data curation. M Kalpana: H2-TPR. A Hari Padmasri: Interpretation of results. A. Venugopal: Planning, execution, writing manuscript and PhD supervisor to V Shirisha. Declaration of Competing Interest The authors declare that they have no known competing financial interests or personal relationships that could have appeared to influence the work reported in this paper. Acknowledgements All the authors thank the Director CSIR-IICT for constant support. Shirisha thank CSIR New Delhi for the award of junior research fellowship. IICT communication no. IICT/Pubs./2023/067. Appendix A Supporting information Supplementary data associated with this article can be found in the online version at doi:10.1016/j.apcata.2023.119282. Appendix A Supplementary material Supplementary material . References [1] J.M. Tukacs D. Király A. Strádi G. Novodarszki Z. Eke G. Dibó T. Kégl L.T. Mika Efficient catalytic hydrogenation of levulinic acid: a key step in biomass conversion Green. Chem. 14 2012 2057 2065 10.1039/C2GC35503E J.M. Tukacs, D. Király, A. Strádi, G. Novodarszki, Z. Eke, G. Dibó, T. Kégl, L.T. Mika, Efficient catalytic hydrogenation of levulinic acid: a key step in biomass conversion, Green Chem. 14 (2012) 2057–2065. https://doi.org/10.1039/C2GC35503E. [2] T. Pan J. Deng Q. Xu Y. Xu Q.X. Guo Y. Fu Catalytic conversion of biomass-derived levulinic acid to valerate esters as oxygenated fuels using supported ruthenium catalysts Green. Chem. 15 2013 2967 2974 10.1039/C3GC40927A T. Pan, J. Deng, Q. Xu, Y. Xu, Q.X. Guo, Y. Fu, Catalytic conversion of biomass-derived levulinic acid to valerate esters as oxygenated fuels using supported ruthenium catalysts, Green Chem. 15 (2013) 2967–2974. https://doi.org/10.1039/C3GC40927A. [3] O.A. Abdelrahman A. Heyden J.Q. Bond Analysis of kinetics and reaction pathways in the aqueous-phase hydrogenation of levulinic acid to form γ-valerolactone over Ru/C ACS Catal. 4 2014 1171 1181 10.1021/cs401177p O.A. Abdelrahman, A. Heyden, J.Q. Bond, Analysis of Kinetics and Reaction Pathways in the Aqueous-Phase Hydrogenation of Levulinic Acid to Form γ-Valerolactone over Ru/C, ACS Catal. 4 (2014) 1171−1181. https://doi.org/10.1021/cs401177p. [4] M. Chalid A.A. Broekhuis H.J. Heeres Experimental and kinetic modeling studies on the biphasic hydrogenation of levulinic acid to γ-valerolactone using a homogeneous water-soluble Ru-(TPPTS) catalyst J. Mol. Cat. A: Chem. 341 2011 14 21 10.1016/j.molcata.2011.04.004 M. Chalid, A.A. Broekhuis, H.J. Heeres, Experimental and kinetic modeling studies on the biphasic hydrogenation of levulinic acid to γ-valerolactone using a homogeneous water-soluble Ru-(TPPTS) catalyst, J. Mol. Cat A: Chem. 341 (2011) 14–21. https://doi.org/10.1016/j.molcata.2011.04.004. [5] M. Sudhakar V. Vijay Kumar G. Naresh M. Lakshmi Kantam S.K. Bhargava A. Venugopal Vapor phase hydrogenation of aqueous levulinic acid over hydroxyapatite supported metal (M = Pd, Pt, Ru, Cu, Ni) catalysts Appl. Catal. B: Environ. 180 2016 113 120 10.1016/j.apcatb.2015.05.050 M. Sudhakar, V. Vijay Kumar, G. Naresh, M. Lakshmi Kantam, S.K. Bhargava, A. Venugopal, Vapor phase hydrogenation of aqueous levulinic acid over hydroxyapatite supported metal (M = Pd, Pt, Ru, Cu, Ni) catalysts, Appl. Catal. B: Environ. 180 (2016) 113–120. https://doi.org/10.1016/j.apcatb.2015.05.050. [6] P.P. Upare M.G. Jeong Y.K. Hwang D.H. Kim Y.D. Kim D.W. Hwang U.H. Lee S. Chang Nickel-promoted copper–silica nanocomposite catalysts for hydrogenation of levulinic acid to lactones using formic acid as a hydrogen feeder Appl. Catal. A: Gen. 491 2015 127 135 10.1016/j.apcata.2014.12.007 P.P. Upare, M.G. Jeong, Y.K. Hwang, D.H. Kim, Y.D. Kim, D.W. Hwang, U.H. Lee, S. Chang, Nickel-promoted copper–silica nanocomposite catalysts for hydrogenation of levulinic acid to lactones using formic acid as a hydrogen feeder, Appl. Catal. A: Gen. 491 (2015) 127–135. https://doi.org/10.1016/j.apcata.2014.12.007. [7] S.G. Wettstein J.Q. Bond D.M. Alonso H.N. Pham A.K. Datye J.A. Dumesic RuSn bimetallic catalysts for selective hydrogenation of levulinic acid to γ-Valerolactone Appl. Catal. B: Environ. 117–118 2012 321 329 10.1016/j.apcatb.2012.01.033 S.G. Wettstein, J.Q. Bond, D.M. Alonso, H.N. Pham, A.K. Datye, J.A. Dumesic, RuSn bimetallic catalysts for selective hydrogenation of levulinic acid to γ-Valerolactone, Appl. Catal. B: Environ. 117–118 (2012) 321–329. https://doi.org/10.1016/j.apcatb.2012.01.033. [8] M.M. El-Desoky I. Morad M.H. Wasfy A.F. Mansour Synthesis, structural and electrical properties of PVA/TiO2 nanocomposite films with different TiO2 phases prepared by sol-gel technique J. Mater. Sci: Mater. Electron 31 2020 17574 17584 10.1007/s10854-020-04313-7 M.M. El-Desoky, I. Morad, M.H. Wasfy, A.F. Mansour, Synthesis, structural and electrical properties of PVA/TiO2 nanocomposite films with different TiO2 phases prepared by sol-gel technique, J Mater Sci: Mater Electron. 31 (2020) 17574–17584. https://doi.org/10.1007/s10854–020-04313–7. [9] X.L. Du L. He S. Zhao Dr.Y.M. Liu Y. Cao H.Y. He K.N. Fan Hydrogen-independent reductive transformation of carbohydrate biomass into γ-valerolactone and pyrrolidone derivatives with supported gold catalysts Angew. Chem. Int. Ed. 50 2011 7815 7819 https://doi:10.1002/anie.201100102 X.L. Du, L. He, S. Zhao, Dr. Y.M. Liu, Y. Cao, H.Y. He, K.N. Fan, Hydrogen-Independent Reductive Transformation of Carbohydrate Biomass into γ-Valerolactone and Pyrrolidone Derivatives with Supported Gold Catalysts, Angew. Chem. Int. Ed. 50 (2011) 7815–7819. https://doi:10.1002/anie.201100102. [10] Y. Yang G. Gao X. Zhang F. Li Facile fabrication of composition-tuned Ru-Ni bimetallics in ordered mesoporous carbon for levulinic acid hydrogenation ACS Catal. 4 2014 1419 1425 10.1021/cs401030u Y. Yang, G. Gao, X. Zhang, F. Li, Facile fabrication of composition-tuned Ru-Ni bimetallics in ordered mesoporous carbon for levulinic acid hydrogenation, ACS Catal. 4 (2014) 1419–1425. https://doi.org/10.1021/cs401030u. [11] V.V. Kumar P.G. Bhavani G. Naresh B. Venu K. Manasa K.V.R. Chary A. Venugopal Influence of support for Ru and water role on product selectivity in the vapor-phase hydrogenation of levulinic acid to γ-valerolactone: investigation by probe-adsorbed fourier transform infrared spectroscopy J. Phys. Chem. C. 122 2018 19670 19677 10.1021/acs.jpcc.8b06003 V.V. Kumar, P.G. Bhavani, G. Naresh, B. Venu, K. Manasa, K.V.R. Chary, A. Venugopal, Influence of Support for Ru and Water Role on Product Selectivity in the Vapor-Phase Hydrogenation of Levulinic Acid to γ-Valerolactone: Investigation by Probe-Adsorbed Fourier Transform Infrared Spectroscopy, J. Phys. Chem. C. 122 (2018) 19670–19677. https://doi.org/10.1021/acs.jpcc.8b06003. [12] D.J. Braden C.A. Henao J. Heltzel C.C. Maravelias J.A. Dumesic Production of liquid hydrocarbon fuels by catalytic conversion of biomass-derived levulinic acid Green. Chem. 13 2011 1755 1765 https://doi:10.1039/c1gc15047b 10.1039/c1gc15047b D.J. Braden, C.A. Henao, J. Heltzel, C.C. Maravelias, J.A. Dumesic, Production of liquid hydrocarbon fuels by catalytic conversion of biomass-derived levulinic acid, Green Chem. 13 (2011) 1755–1765. https://doi:10.1039/c1gc15047b 10.1039/c1gc15047b. [13] D.M. Alonso S.G. Wettstein J.A. Dumesic Gamma-valerolactone, a sustainable platform molecule derived from lignocellulosic biomass Green. Chem. 15 2013 584 595 https://doi:10.1039/c3gc37065h 10.1039/c3gc37065h D.M. Alonso, S.G. Wettstein, J.A. Dumesic, Gamma-valerolactone, a sustainable platform molecule derived from lignocellulosic biomass, Green Chem. 15 (2013) 584–595. https://doi:10.1039/c3gc37065h 10.1039/c3gc37065h. [14] W.R.H. Wright R. Palkovits Development of heterogeneous catalysts for the conversion of levulinic acid to γ-valerolactone ChemSusChem 5 2012 1657 1667 https://doi:10.1002/cssc.201200111 10.1002/cssc.201200111 W.R.H. Wright, R. Palkovits, Development of Heterogeneous Catalysts for the Conversion of Levulinic Acid to γ-valerolactone, ChemSusChem. 5 (2012) 1657–1667. https://doi:10.1002/cssc.201200111 10.1002/cssc.201200111. [15] P. Zhou S. Wang G. Zhai X. Lv Y. Liu Z. Wang P. Wang Z. Zheng H. Cheng Y. Dai B. Huang Host dependent electrocatalytic hydrogen evolution of Ni/TiO2 Compos., J. Mater. Chem. A. 9 2021 6325 6334 10.1039/D0TA09604K P. Zhou, S. Wang, G. Zhai, X. Lv, Y. Liu, Z. Wang, P. Wang, Z. Zheng, H. Cheng, Y. Dai, B. Huang, Host dependent electrocatalytic hydrogen evolution of Ni/TiO2 composites, J. Mater. Chem. A. 9 (2021) 6325–6334. https://doi.org/10.1039/D0TA09604K. [16] V. Vijay Kumar G. Naresh M. Sudhakar C. Anjaneyulu S.K. Bhargava J. Tardio A. Venugopal An investigation on the influence of support type for Ni catalysed vapour phase hydrogenation of aqueous levulinic acid to γ-valerolactone RSC Adv. 6 2016 9872 9879 https://doi:10.1039/c5ra24199e 10.1039/c5ra24199e. V. Vijay Kumar, G. Naresh, M. Sudhakar, C. Anjaneyulu, S.K. Bhargava, J. Tardio, A. Venugopal, An investigation on the influence of support type for Ni catalysed vapour phase hydrogenation of aqueous levulinic acid to γ-valerolactone, RSC Adv. 6 (2016) 9872–9879. https://doi:10.1039/c5ra24199e 10.1039/c5ra24199e. [17] M. Xu S. He H. Chen G. Cui L. Zheng B. Wang M. Wei TiO2−x modified Ni nanocatalyst with tunable metal-support interaction for water-gas shift reaction ACS Catal. 7 2017 7600 7609 10.1021/acscatal.7b01951 M. Xu, S. He, H. Chen, G. Cui, L. Zheng, B. Wang, M. Wei, TiO2-x modified Ni nanocatalyst with tunable metal-support interaction for water-gas shift reaction, ACS Catal. 7 (2017) 7600–7609. https://doi.org/10.1021/acscatal.7b01951. [18] K. Kon W. Onodera K. Shimizu Selective hydrogenation of levulinic acid to valeric acid and valeric biofuels by a Pt/HMFI catalyst Catal. Sci. Technol. 4 2014 3227 3234 10.1039/C4CY00504J K. Kon, W. Onodera, K. Shimizu, Selective hydrogenation of levulinic acid to valeric acid and valeric biofuels by a Pt/HMFI catalyst, Catal. Sci. Technol. 4 (2014) 3227–3234. https://doi.org/10.1039/C4CY00504J. [19] B. Fang Z. Xing D. Sun Z. Li W. Zhou Hollow semiconductor photocatalysts for solar energy conversion Adv. Powder Mater. 1 2022 100021 10.1016/j.apmate.2021.11.008 B. Fang, Z. Xing, D. Sun, Z. Li, W. Zhou, Hollow semiconductor photocatalysts for solar energy conversion, Adv. Powder Mater. 1 (2022) 100021. https://doi.org/10.1016/j.apmate.2021.11.008. [20] X. Qian Y. Wei M. Sun Y. Han X. Zhang J. Tian M. Shao Heterostructuring 2D TiO2 nanosheets in situ grown on Ti3C2Tx MXene to improve the electrocatalytic nitrogen reduction, Chinese J. Catal. 43 2022 1937 1944 10.1016/S1872-2067(21)64020-2 X. Qian, Y. Wei, M. Sun, Y. Han, X. Zhang, J. Tian, M. Shao, Heterostructuring 2D TiO2 nanosheets in situ grown on Ti3C2Tx MXene to improve the electrocatalytic nitrogen reduction, Chinese J. Catal. 43 (2022) 1937–1944. https://doi.org/10.1016/S1872–2067(21)64020–2. [21] Y. Qin Y. Guo Z. Liang Y. Xue X. Zhang L. Yang J. Tian Au nanorods decorated TiO2 nanobelts with enhanced full solar spectrum photocatalytic antibacterial activity and the sterilization file cabinet application Chin. Chem. Lett. 32 2021 1523 1526 10.1016/j.cclet.2020.10.020 Y. Qin, Y. Guo, Z. Liang, Y. Xue, X. Zhang, L. Yang, J. Tian, Au nanorods decorated TiO2 nanobelts with enhanced full solar spectrum photocatalytic antibacterial activity and the sterilization file cabinet application, Chinese Chemical Letters. 32 (2021) 1523–1526. http://dx.doi.org/10.1016/j.cclet.2020.10.020. [22] K.J.A. Raj M.G. Prakash R. Mahalakshmy T. Elangovan B. Viswanathan Liquid phase hydrogenation of nitrobenzene over nickel supported on titania Chin. J. Catal. 33 2012 1299 1305 10.1016/S1872-2067(11)60398-7 K.J. A. Raj, M.G. Prakash, R. Mahalakshmy, T. Elangovan, B. Viswanathan, Liquid Phase Hydrogenation of Nitrobenzene over Nickel Supported on Titania, Chin. J. Catal. 33 (2012) 1299–1305. https://doi.org/10.1016/S1872–2067(11)60398–7. [23] F. Meng X. Yang S. Zhao Z. Li G. Zhang Y. Qi S. Chu G. Wang J. Zhang Y. Qin B. Zhang. Shifting reaction path for levulinic acid aqueous phase hydrogenation by Pt-TiO2 strong metal-support interaction Appl. Catal. B: Environ. 324 2022 122236 10.1016/j.apcatb.2022.122236 F. Meng, X. Yang, S. Zhao, Z. Li, G. Zhang, Y. Qi, S. Chu, G. Wang, J. Zhang, Y. Qin, B. Zhang. Shifting reaction path for levulinic acid aqueous phase hydrogenation by Pt-TiO2 strong metal-support interaction, Appl. Catal. B: Environmental. 324 (2022) 122236. https://doi.org/10.1016/j.apcatb.2022.122236. [24] M. Xu S. Yao D. Rao Y. Niu N. Liu M. Peng P. Zhai Y. Man L. Zheng B. Wang B. Zhang D. Ma M. Wei Insights into interfacial synergistic catalysis over Ni@TiO2−x catalyst toward water gas shift reaction J. Am. Chem. Soc. 140 2018 11241 11251 https://doi:10.1021/jacs.8b03117 M. Xu, S. Yao, D. Rao, Y. Niu, N. Liu, M. Peng, P. Zhai, Y. Man, L. Zheng, B. Wang, B. Zhang, D. Ma and M. Wei, Insights into Interfacial Synergistic Catalysis over Ni@TiO2−x Catalyst toward Water Gas Shift Reaction, J. Am. Chem. Soc. 140 (2018) 11241–11251. https://doi:10.1021/jacs.8b03117. [25] W. Luo M. Sankar A.M. Beale Q. He C.J. Kiely P.C.A. Bruijnincx B.M. Weckhuysen High performing and stable supported nano-alloys for the catalytic hydrogenation of levulinic acid to γ-valerolactone Nat. Commun. 6 2015 6540 https://doi:10.1038/ncomms7540 10.1038/ncomms7540 W. Luo, M. Sankar, A.M. Beale, Q. He, C.J. Kiely, P.C. A. Bruijnincx, B.M. Weckhuysen, High performing and stable supported nano-alloys for the catalytic hydrogenation of levulinic acid to γ-valerolactone, Nat. Commun. 6 (2015) 6540. https://doi:10.1038/ncomms7540 10.1038/ncomms7540. [26] W. Luo U. Deka A.M. Beale E.R.H. van Eck P.C.A. Bruijnincx B.M. Weckhuysen Ruthenium-catalyzed hydrogenation of levulinic acid: Influence of the support and solvent on catalyst selectivity and stability J. Catal. 301 2013 175 186 10.1016/j.jcat.2013.02.003 W. Luo, U. Deka, A.M. Beale, E.R.H. van Eck, P.C.A. Bruijnincx, B.M. Weckhuysen, Ruthenium-catalyzed hydrogenation of levulinic acid: Influence of the support and solvent on catalyst selectivity and stability, J. Catal. 301 (2013) 175–186. https://doi.org/10.1016/j.jcat.2013.02.003. [27] J. Wojciechowska M. Jedrzejczyk J. Grams N. Keller A.G. Ruppert Enhanced production of γ-valerolactone with an internal source of hydrogen on Ca-modified TiO2 supported Ru catalysts ChemSusChem 12 2019 639 650 10.1002/cssc.201801974 J. Wojciechowska, M. Jedrzejczyk, J. Grams, N. Keller, A.G. Ruppert, Enhanced production of γ-valerolactone with an internal source of hydrogen on Ca-modified TiO2 supported Ru catalysts, ChemSusChem. 12 (2019) 639–650. https://doi.org/10.1002/cssc.201801974. [28] X. Huang, K. Liu, W.L. Vriburg, X. Ouyang, A.I. Dugulan, Y. Liu, M.W.G.M. Tiny Verhoeven, N.A. Kosinov, E.A. Pidko, E.J.M. Hensen, Hydrogenation of levulinic acid to γ-valerolactone over Fe-Re/TiO2 catalysts, Appl. Catal. B: Environmental. 278 (202) 119314. https://doi.org/10.1016/j.apcatb.2020.119314. [29] S. Li Y. Wang Y. Yang B. Chen J. Tai H. Liu B. Han Conversion of levulinic acid to γ-valerolactone over ultra-thin TiO2 nanosheets decorated with ultrasmall Ru nanoparticle catalysts under mild conditions Green. Chem. 21 2019 770 774 10.1039/C8GC03529F S. Li, Y. Wang, Y. Yang, B. Chen, J. Tai, H. Liu and B. Han, Conversion of levulinic acid to γ-valerolactone over ultra-thin TiO2 nanosheets decorated with ultrasmall Ru nanoparticle catalysts under mild conditions, Green Chem. 21 (2019) 770–774. https://doi.org/10.1039/C8GC03529F. [30] M. Kotesh Kumar K. Bhavani B. Srinivas S. Naveen Kumar M. Sudhakar G. Naresh A. Venugopal Nano structured bismuth and nitrogen co-doped TiO2 as an efficient light harvesting photocatalyst under natural sunlight for the production of H2 by H2O splitting Appl. Catal. A: Gen. 515 2016 91 100 10.1016/j.apcata.2016.01.009 M. Kotesh Kumar, K. Bhavani, B. Srinivas, S. Naveen Kumar, M. Sudhakar, G. Naresh, A. Venugopal, Nano structured bismuth and nitrogen co-doped TiO2 as an efficient light harvesting photocatalyst under natural sunlight for the production of H2 by H2O splitting, Appl. Catal. A: General 515 (2016) 91–100, http://dx.doi.org/10.1016/j.apcata.2016.01.009 [31] C. Swapna T. Kartick G. Ramakrishnan R. Sounak Structure sensitive photocatalytic reduction of nitroarenes over TiO2 Sci. Rep. 7 2017 8783 10.1038/s41598-017-08599-2 C. Swapna, T. Kartick, G. Ramakrishnan, R. Sounak, Structure sensitive photocatalytic reduction of nitroarenes over TiO2, Sci. Rep. 7 (2017) 8783. https://doi.org/10.1038/s41598–017-08599–2. [32] M. Kotesh Kumar K. Bhavani G. Naresh B. Srinivas A. Venugopal Plasmonic resonance nature of Ag-Cu/TiO2 photocatalyst under solar and artificial light: Synthesis, characterization and evaluation of H2O splitting activity Appl. Catal. B: Environ. 199 2016 282 291 M. Kotesh Kumar, K. Bhavani, G. Naresh, B. Srinivas, A. Venugopal. Plasmonic resonance nature of Ag-Cu/TiO2 photocatalyst under solar and artificial light: Synthesis, characterization and evaluation of H2O splitting activity, Appl. Catal. B: Environmental 199 (2016) 282–291. [33] A. Gautama A. Kshirsagara R. Biswasa S. Banerjeea P.K. Khanna Photodegradation of Organic Dyes Based on Anatase and Rutile TiO2 Nanoparticles RSC Adv. 6 2016 2746 2759 10.1039/C5RA20861K A. Gautama, A. Kshirsagara, R. Biswasa, S. Banerjeea, P.K. Khanna, Photodegradation of Organic Dyes Based on Anatase and Rutile TiO2 Nanoparticles, RSC Adv. 6 (2016) 2746–2759. https://doi.org/10.1039/C5RA20861K. [34] G. Naresh V.Vijay Kumar Ch Anjaneyulu J. Tardio S.K. Bhargava J. Patel A. Venugopal Nano size Hβ zeolite as an effective support for Ni and Ni-Cu for CO2 free hydrogen production by catalytic decomposition of methane Int. J. Hydrog. Energy 41 2016 19855 19862 10.1016/j.ijhydene.2016.09.131 G. Naresh, V.Vijay Kumar, Ch. Anjaneyulu, J. Tardio, S.K. Bhargava, J. Patel, A. Venugopal, Nano size Hβ zeolite as an effective support for Ni and Ni-Cu for CO2 free hydrogen production by catalytic decomposition of methane, Int. J. Hydrogen Energy. 41 (2016) 19855–19862. https://doi.org/10.1016/j.ijhydene.2016.09.131. [35] M. Chiesa M.C. Paganini S. Livraghi E. Giamello Charge trapping in TiO2 polymorphs as seen by Electron Paramagnetic Resonance spectroscopy Phys. Chem. Chem. Phys. 15 2013 9435 9447 10.1039/C3CP50658D M. Chiesa, M.C. Paganini, S. Livraghi, E. Giamello, Charge trapping in TiO2 polymorphs as seen by Electron Paramagnetic Resonance spectroscopy, Phys. Chem. Chem. Phys. 15 (2013) 9435–9447. https://doi.org/10.1039/C3CP50658D. [36] M.M. Selim I.H. Abd El-Maksoud Spectroscopic and catalytic characterization of Ni nano-size catalyst for edible oil hydrogenation, Micropor. Mesopor Mater 85 2005 273 278 10.1016/j.micromeso.2005.06.027 M.M. Selim, I.H. Abd El-Maksoud, Spectroscopic and catalytic characterization of Ni nano-size catalyst for edible oil hydrogenation, Micropor. Mesopor. Mater. 85 (2005) 273–278. https://doi.org/10.1016/j.micromeso.2005.06.027. [37] P. Li J. Liu N. Nag P.A. Crozier Dynamic nucleation and growth of Ni nanoparticles on high-surface area titania Surf. Sci. 600 2006 693 702 https://doi:10.1016/j.susc.2005.11.023 P. Li, J. Liu, N. Nag, P.A. Crozier, Dynamic nucleation and growth of Ni nanoparticles on high-surface area titania, Surf. Sci. 600 (2006) 693–702. https://doi:10.1016/j.susc.2005.11.023. [38] M. Rehan X. Lai G.M. Kale Hydrothermal synthesis of titanium dioxide nanoparticles studied employing in situ energy dispersive X-ray diffraction CrystEngComm 13 2011 3725 10.1039/C0CE00781A M. Rehan, X. Lai, G.M. Kale, Hydrothermal synthesis of titanium dioxide nanoparticles studied employing in situ energy dispersive X-ray diffraction, CrystEngComm. 13 (2011) 3725. https://doi.org/10.1039/C0CE00781A. [39] D. Messou V. Bernardin F. Meunier M.B. Ordoño A. Urakawa B.F. Machado V. Collière R. Philippe P. Serp C. Le Berre Origin of the synergistic effect between TiO2 crystalline phases in the Ni/TiO2-catalyzed CO2 methanation reaction J. Catal. 398 2021 14 28 10.1016/j.jcat.2021.04.004 D. Messou, V. Bernardin, F. Meunier, M.B. Ordoño, A. Urakawa, B.F. Machado, V. Collière, R. Philippe, P. Serp, C. Le Berre, Origin of the synergistic effect between TiO2 crystalline phases in the Ni/TiO2-catalyzed CO2 methanation reaction, J. Catal. 398 (2021) 14–28. https://doi.org/10.1016/j.jcat.2021.04.004. [40] Y. Hinuma T. Toyao T. Kamachi Z. Maeno S. Takakusagi S. Furukawa I. Takigawa K.I. Shimizu Density functional theory calculations of oxygen vacancy formation and subsequent molecular adsorption on oxide surfaces J. Phys. Chem. C. 122 2018 29435 29444 http://doi:10.1021/acs.jpcc.8b11279 Y. Hinuma, T. Toyao, T. Kamachi, Z. Maeno, S. Takakusagi, S. Furukawa, I. Takigawa, K.I. Shimizu, Density Functional Theory Calculations of Oxygen Vacancy Formation and Subsequent Molecular Adsorption on Oxide Surfaces, J. Phys. Chem. C. 122 (2018) 29435–29444. http://doi:10.1021/acs.jpcc.8b11279. [41] J. Li Y. Lin X. Pan D. Miao D. Ding Y. Cui J. Dong X. Bao Enhanced CO2 methanation activity of Ni/anatase catalyst by tuning strong metal-support interactions ACS Catal. 9 2019 6342 6348 http://doi:10.1021/acscatal.9b00401 J. Li, Y. Lin, X. Pan, D. Miao, D. Ding, Y. Cui, J. Dong, X. Bao, Enhanced CO2 methanation activity of Ni/anatase catalyst by tuning strong metal-support interactions, ACS Catal. 9 (2019) 6342−6348. http://doi:10.1021/acscatal.9b00401. [42] B. Cui H. Wang J. Han Q. Ge X. Zhu Crystal-phase-depended strong metal-support interactions enhancing hydrodeoxygenation of m-cresol on Ni/TiO2 catalysts J. Catal. 413 2022 880 890 10.1016/j.jcat.2022.07.039 B. Cui, H. Wang, J. Han, Q. Ge, X. Zhu, Crystal-phase-depended strong metal-support interactions enhancing hydrodeoxygenation of m-cresol on Ni/TiO2 catalysts, J. Catal. 413 (2022) 880–890. https://doi.org/10.1016/j.jcat.2022.07.039. [43] Y. Li Z. Rao Z. Liu J. Zeng W. Bao Z. Wang J. Li F. Yu B. Dai Photo-assisted CO/CO2 methanation over Ni/TiO2 catalyst: experiment and density functional theory calculation (XXX) ChemCatChem 14 2022 10.1002/cctc.202200182 Y. Li, Z. Rao, Z. Liu, J. Zeng, W. Bao, Z. Wang, J. Li, F. Yu, B. Dai, Photo-Assisted CO/CO2 Methanation over Ni/TiO2 Catalyst: Experiment and Density Functional Theory Calculation, ChemCatChem. 14 (2022) XXX. https://doi.org/10.1002/cctc.202200182. [44] X. Zhang P. Yan B. Zhao Z.C. Zhang Identification of electron-rich mononuclear Ni atoms on TiO2-A distinguished from Ni particles on TiO2-R in guaiacol hydrodeoxygenation pathways Catal. Sci. Technol. 11 2021 297 311 10.1039/D0CY01720E X. Zhang, P. Yan, B. Zhao, Z.C. Zhang, Identification of electron-rich mononuclear Ni atoms on TiO2-A distinguished from Ni particles on TiO2-R in guaiacol hydrodeoxygenation pathways, Catal. Sci. Technol. 11 (2021) 297–311. https://doi.org/10.1039/D0CY01720E. [45] R.A. Spurr H. Myer Quantitative analysis of anatase-rutile mixtures with an x-ray diffractometer Anal. Chem. 29 1957 760 762 https://doi:10.1021/ac60125a006 R.A. Spurr, H. Myer, Quantitative Analysis of Anatase-Rutile Mixtures with an X-Ray Diffractometer, Anal. Chem. 29 (1957) 760–762. https://doi:10.1021/ac60125a006. [46] W.T. Figueiredo R. Prakash C.G. Vieira D.S. Lima V.E. Carvalho E.A. Soares S. Buchner H. Raschke O.W. Perez-Lopez D.L. Baptista R. Hergenröder M. Segala F. Bernardi New insights on the electronic factor of the SMSI effect in Pd/TiO2 nanoparticles Appl. Surf. Sci. 574 2022 151647 10.1016/j.apsusc.2021.151647 W.T. Figueiredo, R. Prakash, C.G. Vieira, D.S. Lima, V.E. Carvalho, E.A. Soares, S. Buchner, H. Raschke, O.W. Perez-Lopez, D.L. Baptista, R. Hergenröder, M. Segala, F. Bernardi, New insights on the electronic factor of the SMSI effect in Pd/TiO2 nanoparticles, Appl. Surf. Sci. 574 (2022) 151647. https://doi.org/10.1016/j.apsusc.2021.151647. [47] Y. Guo S. Mei K. Yuan D.J. Wang H.C. Liu C.H. Yan Y.W. Zhang Low temperature CO2 methanation over CeO2-supported Ru single atoms nanoclusters and nanoparticles competitively tuned by strong metal-support interactions and H-spillover effect Acs. Catal. 8 2018 6203 6215 10.1021/acscatal.7b04469 Y. Guo, S. Mei, K. Yuan, D.J. Wang, H.C. Liu, C.H. Yan, Y.W. Zhang, Low temperature CO2 methanation over CeO2-supported Ru single atoms nanoclusters and nanoparticles competitively tuned by strong metal-support interactions and H-spillover effect, ACS. Catal. 8 (2018) 6203–6215. https://doi.org/10.1021/acscatal.7b04469. [48] G.B. Raupp S.A. Stevenson J.A. Dumesic S.J. Tauster R.T.K. Baker Metal-support interactions S.A. Stevenson J.A. Dumesic R.T.K. Baker E. Ruckenstein Catalysis, Sintering, and Re-dispersion 1987 Van Nostrand Reinhold Company Inc New York G.B. Raupp, S.A. Stevenson, J.A. Dumesic, S.J. Tauster, R.T.K. Baker, Metal-support interactions, in: S.A. Stevenson, J.A. Dumesic, R.T.K. Baker, E. Ruckenstein (Eds.), Catalysis, Sintering, and Re-dispersion, Van Nostrand Reinhold Company Inc, New York,1987. [49] Q. Fu T. Wagner Interaction of nanostructured metal overlayers with oxide surfaces Surf. Sci. Rep. 67 2007 431 498 10.1016/j.surfrep.2007.07.001 Q. Fu, T. Wagner, Interaction of nanostructured metal overlayers with oxide surfaces, Surf. Sci. Rep. 67 (2007) 431–498. https://doi.org/10.1016/j.surfrep.2007.07.001. [50] V. Vijay Kumar G. Naresh M. Sudhakar J. Tardio S.K. Bhargava A. Venugopal Role of Brønsted and Lewis acid sites on Ni/TiO2 catalyst for vapour phase hydrogenation of levulinic acid: kinetic and mechanistic study Appl. Catal. A: Gen. 505 2015 217 223 10.1016/j.apcata.2015.07.031 V. Vijay Kumar, G. Naresh, M. Sudhakar, J. Tardio, S.K. Bhargava, A. Venugopal, Role of Brønsted and Lewis acid sites on Ni/TiO2 catalyst for vapour phase hydrogenation of levulinic acid: Kinetic and mechanistic study, Appl. Catal. A: Gen. 505 (2015) 217–223. https://doi.org/10.1016/j.apcata.2015.07.031. [51] V. Vijay Kumar G. Naresh J. Tardio S.K. Bhargava V. Krishna Ch Anjaneyulu M. Sudhakar A. Venugopal Hydrodeoxygenation activity of W modified Ni/H-ZSM-5 catalyst for single step conversion of levulinic acid to pentanoic acid: an insight on the reaction mechanism and structure activity relationship Appl. Catal. A: Gen. 550 2018 142 150 https://doi:10.1016/j.apcata.2017.11.008 V. Vijay Kumar, G. Naresh, J. Tardio, S.K. Bhargava, V. Krishna, Ch. Anjaneyulu, M. Sudhakar, A. Venugopal, Hydrodeoxygenation activity of W modified Ni/H-ZSM-5 catalyst for single step conversion of levulinic acid to pentanoic acid: An insight on the reaction mechanism and structure activity relationship. Appl. Catal. A: Gen. 550 (2018) 142–150. https://doi:10.1016/j.apcata.2017.11.008. [52] V. Vijay Kumar G. Naresh S. Deepa P. Ganga Bhavani M. Nagaraju M. Sudhakar K.V.R. Chary J. Tardio S.K. Bhargava A. Venugopal Influence of W on the reduction behaviour and Brønsted acidity of Ni/TiO2 catalyst in the hydrogenation of levulinic acid to valeric acid: Pyridine adsorbed DRIFTS study Appl. Catal. A: Gen. 531 2017 169 176 10.1016/j.apcata.2016.10.032 V. Vijay Kumar, G. Naresh, S. Deepa, P. Ganga Bhavani, M. Nagaraju, M. Sudhakar, K.V.R. Chary, J. Tardio, S.K. Bhargava, A. Venugopal, Influence of W on the reduction behaviour and Brønsted acidity of Ni/TiO2 catalyst in the hydrogenation of levulinic acid to valeric acid: Pyridine adsorbed DRIFTS study, Appl. Catal. A: Gen. 531 (2017) 169–176. https://doi.org/10.1016/j.apcata.2016.10.032. [53] P. Panagiotopoulou D.I. Kondarides Effects of Promotion of TiO2 with alkaline earth metals on the chemisorptive properties and water-gas shift activity of supported platinum catalysts Appl. Catal. B: Environ. 101 2011 738 746 10.1016/j.apcatb.2010.11.016 P. Panagiotopoulou, D.I. Kondarides, Effects of Promotion of TiO2 with Alkaline Earth Metals on the Chemisorptive Properties and Water-Gas Shift Activity of Supported Platinum Catalysts, Appl. Catal. B: Environmental. 101 (2011) 738–746. https://doi.org/10.1016/j.apcatb.2010.11.016. [54] F. Yang D. Liu Y. Zhao H. Wang J. Han Q. Ge X. Zhu Size dependence of vapor phase hydrodeoxygenation of m-cresol on Ni/SiO2 catalysts Acs. Catal. 8 2018 1672 1682 10.1021/acscatal.7b04097 F. Yang, D. Liu, Y. Zhao, H. Wang, J. Han, Q. Ge, X. Zhu, Size Dependence of Vapor Phase Hydrodeoxygenation of m-Cresol on Ni/SiO2 Catalysts, ACS. Catal. 8 (2018) 1672–1682. https://doi.org/10.1021/acscatal.7b04097.",
      "scopus-id": "85162745155",
      "coredata": {
        "eid": "1-s2.0-S0926860X23002624",
        "dc:description": "Rutile TiO2 was identified as a suitable support for nickel than the anatase form in the selective conversion of levulinic acid (LA) to γ-valerolactone (GVL) with a 20-fold rate enhancement. TEM-HAADF results revealed a high degree of Ni encapsulation by titania species on the anatase that resulted in lower LA conversion with a high selectivity of angelica lactones. While nickel plateaus with protruding particles partially covered by TiOx overlayers on a rutile surface was the reason for the higher rate of GVL. CO chemisorption results indicated a lower uptake on 10 wt%Ni/TiO2-anatase than on the 10 wt%Ni/TiO2-rutile catalyst and a high rate of hydrogen spillover was manifested by rutile TiO2 supported Ni catalyst than its counterpart anatase. Variations in the crystal phase of TiO2 and their interaction with nickel could substantially influence the GVL formation. High intrinsic activity of 10 wt%Ni/TiO2-800(R) was explained and discussed using surface and bulk characteristics of the catalysts.",
        "openArchiveArticle": "false",
        "prism:coverDate": "2023-07-25",
        "openaccessUserLicense": null,
        "prism:aggregationType": "Journal",
        "prism:url": "https://api.elsevier.com/content/article/pii/S0926860X23002624",
        "dc:creator": [
          {
            "@_fa": "true",
            "$": "Varimalla, Shirisha"
          },
          {
            "@_fa": "true",
            "$": "Boggala, Sasikumar"
          },
          {
            "@_fa": "true",
            "$": "Manda, Kalpana"
          },
          {
            "@_fa": "true",
            "$": "Aytam, Padmasri Hari"
          },
          {
            "@_fa": "true",
            "$": "Akula, Venugopal"
          }
        ],
        "link": [
          {
            "@_fa": "true",
            "@rel": "self",
            "@href": "https://api.elsevier.com/content/article/pii/S0926860X23002624"
          },
          {
            "@_fa": "true",
            "@rel": "scidir",
            "@href": "https://www.sciencedirect.com/science/article/pii/S0926860X23002624"
          }
        ],
        "dc:format": "application/json",
        "openaccessType": null,
        "pii": "S0926-860X(23)00262-4",
        "prism:volume": "662",
        "articleNumber": "119282",
        "prism:publisher": "Elsevier B.V.",
        "dc:title": "Rutile TiO2 a desirable support for Ni catalyst in the synthesis of γ-valerolactone: Influence of titania crystal phase on the product distribution",
        "prism:copyright": "© 2023 Elsevier B.V. All rights reserved.",
        "openaccess": "0",
        "prism:issn": "0926860X",
        "dcterms:subject": [
          {
            "@_fa": "true",
            "$": "Ni-TiO2 interaction"
          },
          {
            "@_fa": "true",
            "$": "Titania migration"
          },
          {
            "@_fa": "true",
            "$": "Gamma-valerolactone"
          },
          {
            "@_fa": "true",
            "$": "H2-spillover"
          },
          {
            "@_fa": "true",
            "$": "TEM-HAADF"
          }
        ],
        "openaccessArticle": "false",
        "prism:publicationName": "Applied Catalysis A: General",
        "openaccessSponsorType": null,
        "prism:pageRange": "119282",
        "pubType": "fla",
        "prism:coverDisplayDate": "25 July 2023",
        "prism:doi": "10.1016/j.apcata.2023.119282",
        "prism:startingPage": "119282",
        "dc:identifier": "doi:10.1016/j.apcata.2023.119282",
        "openaccessSponsorName": null
      },
      "objects": {
        "object": [
          {
            "@category": "standard",
            "@height": "156",
            "@width": "500",
            "@_fa": "true",
            "$": "https://api.elsevier.com/content/object/eid/1-s2.0-S0926860X23002624-ga1.jpg?httpAccept=%2A%2F%2A",
            "@multimediatype": "JPEG image file",
            "@type": "IMAGE-DOWNSAMPLED",
            "@size": "27784",
            "@ref": "ga1",
            "@mimetype": "image/jpeg"
          },
          {
            "@category": "standard",
            "@height": "303",
            "@width": "339",
            "@_fa": "true",
            "$": "https://api.elsevier.com/content/object/eid/1-s2.0-S0926860X23002624-gr8.jpg?httpAccept=%2A%2F%2A",
            "@multimediatype": "JPEG image file",
            "@type": "IMAGE-DOWNSAMPLED",
            "@size": "32948",
            "@ref": "gr8",
            "@mimetype": "image/jpeg"
          },
          {
            "@category": "standard",
            "@height": "340",
            "@width": "339",
            "@_fa": "true",
            "$": "https://api.elsevier.com/content/object/eid/1-s2.0-S0926860X23002624-gr9.jpg?httpAccept=%2A%2F%2A",
            "@multimediatype": "JPEG image file",
            "@type": "IMAGE-DOWNSAMPLED",
            "@size": "15946",
            "@ref": "gr9",
            "@mimetype": "image/jpeg"
          },
          {
            "@category": "standard",
            "@height": "274",
            "@width": "339",
            "@_fa": "true",
            "$": "https://api.elsevier.com/content/object/eid/1-s2.0-S0926860X23002624-gr10.jpg?httpAccept=%2A%2F%2A",
            "@multimediatype": "JPEG image file",
            "@type": "IMAGE-DOWNSAMPLED",
            "@size": "16326",
            "@ref": "gr10",
            "@mimetype": "image/jpeg"
          },
          {
            "@category": "standard",
            "@height": "238",
            "@width": "791",
            "@_fa": "true",
            "$": "https://api.elsevier.com/content/object/eid/1-s2.0-S0926860X23002624-gr4.jpg?httpAccept=%2A%2F%2A",
            "@multimediatype": "JPEG image file",
            "@type": "IMAGE-DOWNSAMPLED",
            "@size": "41572",
            "@ref": "gr4",
            "@mimetype": "image/jpeg"
          },
          {
            "@category": "standard",
            "@height": "297",
            "@width": "339",
            "@_fa": "true",
            "$": "https://api.elsevier.com/content/object/eid/1-s2.0-S0926860X23002624-gr5.jpg?httpAccept=%2A%2F%2A",
            "@multimediatype": "JPEG image file",
            "@type": "IMAGE-DOWNSAMPLED",
            "@size": "25464",
            "@ref": "gr5",
            "@mimetype": "image/jpeg"
          },
          {
            "@category": "standard",
            "@height": "276",
            "@width": "339",
            "@_fa": "true",
            "$": "https://api.elsevier.com/content/object/eid/1-s2.0-S0926860X23002624-gr7.jpg?httpAccept=%2A%2F%2A",
            "@multimediatype": "JPEG image file",
            "@type": "IMAGE-DOWNSAMPLED",
            "@size": "30933",
            "@ref": "gr7",
            "@mimetype": "image/jpeg"
          },
          {
            "@category": "standard",
            "@height": "609",
            "@width": "339",
            "@_fa": "true",
            "$": "https://api.elsevier.com/content/object/eid/1-s2.0-S0926860X23002624-gr1.jpg?httpAccept=%2A%2F%2A",
            "@multimediatype": "JPEG image file",
            "@type": "IMAGE-DOWNSAMPLED",
            "@size": "55676",
            "@ref": "gr1",
            "@mimetype": "image/jpeg"
          },
          {
            "@category": "standard",
            "@height": "316",
            "@width": "339",
            "@_fa": "true",
            "$": "https://api.elsevier.com/content/object/eid/1-s2.0-S0926860X23002624-gr2.jpg?httpAccept=%2A%2F%2A",
            "@multimediatype": "JPEG image file",
            "@type": "IMAGE-DOWNSAMPLED",
            "@size": "23232",
            "@ref": "gr2",
            "@mimetype": "image/jpeg"
          },
          {
            "@category": "standard",
            "@height": "296",
            "@width": "339",
            "@_fa": "true",
            "$": "https://api.elsevier.com/content/object/eid/1-s2.0-S0926860X23002624-gr3.jpg?httpAccept=%2A%2F%2A",
            "@multimediatype": "JPEG image file",
            "@type": "IMAGE-DOWNSAMPLED",
            "@size": "19995",
            "@ref": "gr3",
            "@mimetype": "image/jpeg"
          },
          {
            "@category": "standard",
            "@height": "209",
            "@width": "678",
            "@_fa": "true",
            "$": "https://api.elsevier.com/content/object/eid/1-s2.0-S0926860X23002624-sc1.jpg?httpAccept=%2A%2F%2A",
            "@multimediatype": "JPEG image file",
            "@type": "IMAGE-DOWNSAMPLED",
            "@size": "40437",
            "@ref": "sc1",
            "@mimetype": "image/jpeg"
          },
          {
            "@category": "standard",
            "@height": "988",
            "@width": "791",
            "@_fa": "true",
            "$": "https://api.elsevier.com/content/object/eid/1-s2.0-S0926860X23002624-gr6a.jpg?httpAccept=%2A%2F%2A",
            "@multimediatype": "JPEG image file",
            "@type": "IMAGE-DOWNSAMPLED",
            "@size": "224825",
            "@ref": "gr6a",
            "@mimetype": "image/jpeg"
          },
          {
            "@category": "standard",
            "@height": "394",
            "@width": "791",
            "@_fa": "true",
            "$": "https://api.elsevier.com/content/object/eid/1-s2.0-S0926860X23002624-gr6b.jpg?httpAccept=%2A%2F%2A",
            "@multimediatype": "JPEG image file",
            "@type": "IMAGE-DOWNSAMPLED",
            "@size": "130716",
            "@ref": "gr6b",
            "@mimetype": "image/jpeg"
          },
          {
            "@category": "thumbnail",
            "@height": "68",
            "@width": "219",
            "@_fa": "true",
            "$": "https://api.elsevier.com/content/object/eid/1-s2.0-S0926860X23002624-ga1.sml?httpAccept=%2A%2F%2A",
            "@multimediatype": "GIF image file",
            "@type": "IMAGE-THUMBNAIL",
            "@size": "8097",
            "@ref": "ga1",
            "@mimetype": "image/gif"
          },
          {
            "@category": "thumbnail",
            "@height": "164",
            "@width": "184",
            "@_fa": "true",
            "$": "https://api.elsevier.com/content/object/eid/1-s2.0-S0926860X23002624-gr8.sml?httpAccept=%2A%2F%2A",
            "@multimediatype": "GIF image file",
            "@type": "IMAGE-THUMBNAIL",
            "@size": "11116",
            "@ref": "gr8",
            "@mimetype": "image/gif"
          },
          {
            "@category": "thumbnail",
            "@height": "164",
            "@width": "163",
            "@_fa": "true",
            "$": "https://api.elsevier.com/content/object/eid/1-s2.0-S0926860X23002624-gr9.sml?httpAccept=%2A%2F%2A",
            "@multimediatype": "GIF image file",
            "@type": "IMAGE-THUMBNAIL",
            "@size": "6309",
            "@ref": "gr9",
            "@mimetype": "image/gif"
          },
          {
            "@category": "thumbnail",
            "@height": "164",
            "@width": "203",
            "@_fa": "true",
            "$": "https://api.elsevier.com/content/object/eid/1-s2.0-S0926860X23002624-gr10.sml?httpAccept=%2A%2F%2A",
            "@multimediatype": "GIF image file",
            "@type": "IMAGE-THUMBNAIL",
            "@size": "8048",
            "@ref": "gr10",
            "@mimetype": "image/gif"
          },
          {
            "@category": "thumbnail",
            "@height": "66",
            "@width": "219",
            "@_fa": "true",
            "$": "https://api.elsevier.com/content/object/eid/1-s2.0-S0926860X23002624-gr4.sml?httpAccept=%2A%2F%2A",
            "@multimediatype": "GIF image file",
            "@type": "IMAGE-THUMBNAIL",
            "@size": "4167",
            "@ref": "gr4",
            "@mimetype": "image/gif"
          },
          {
            "@category": "thumbnail",
            "@height": "164",
            "@width": "187",
            "@_fa": "true",
            "$": "https://api.elsevier.com/content/object/eid/1-s2.0-S0926860X23002624-gr5.sml?httpAccept=%2A%2F%2A",
            "@multimediatype": "GIF image file",
            "@type": "IMAGE-THUMBNAIL",
            "@size": "8141",
            "@ref": "gr5",
            "@mimetype": "image/gif"
          },
          {
            "@category": "thumbnail",
            "@height": "164",
            "@width": "201",
            "@_fa": "true",
            "$": "https://api.elsevier.com/content/object/eid/1-s2.0-S0926860X23002624-gr7.sml?httpAccept=%2A%2F%2A",
            "@multimediatype": "GIF image file",
            "@type": "IMAGE-THUMBNAIL",
            "@size": "13887",
            "@ref": "gr7",
            "@mimetype": "image/gif"
          },
          {
            "@category": "thumbnail",
            "@height": "163",
            "@width": "91",
            "@_fa": "true",
            "$": "https://api.elsevier.com/content/object/eid/1-s2.0-S0926860X23002624-gr1.sml?httpAccept=%2A%2F%2A",
            "@multimediatype": "GIF image file",
            "@type": "IMAGE-THUMBNAIL",
            "@size": "6212",
            "@ref": "gr1",
            "@mimetype": "image/gif"
          },
          {
            "@category": "thumbnail",
            "@height": "164",
            "@width": "176",
            "@_fa": "true",
            "$": "https://api.elsevier.com/content/object/eid/1-s2.0-S0926860X23002624-gr2.sml?httpAccept=%2A%2F%2A",
            "@multimediatype": "GIF image file",
            "@type": "IMAGE-THUMBNAIL",
            "@size": "7513",
            "@ref": "gr2",
            "@mimetype": "image/gif"
          },
          {
            "@category": "thumbnail",
            "@height": "164",
            "@width": "188",
            "@_fa": "true",
            "$": "https://api.elsevier.com/content/object/eid/1-s2.0-S0926860X23002624-gr3.sml?httpAccept=%2A%2F%2A",
            "@multimediatype": "GIF image file",
            "@type": "IMAGE-THUMBNAIL",
            "@size": "7672",
            "@ref": "gr3",
            "@mimetype": "image/gif"
          },
          {
            "@category": "thumbnail",
            "@height": "68",
            "@width": "219",
            "@_fa": "true",
            "$": "https://api.elsevier.com/content/object/eid/1-s2.0-S0926860X23002624-sc1.sml?httpAccept=%2A%2F%2A",
            "@multimediatype": "GIF image file",
            "@type": "IMAGE-THUMBNAIL",
            "@size": "6566",
            "@ref": "sc1",
            "@mimetype": "image/gif"
          },
          {
            "@category": "thumbnail",
            "@height": "164",
            "@width": "131",
            "@_fa": "true",
            "$": "https://api.elsevier.com/content/object/eid/1-s2.0-S0926860X23002624-gr6a.sml?httpAccept=%2A%2F%2A",
            "@multimediatype": "GIF image file",
            "@type": "IMAGE-THUMBNAIL",
            "@size": "15150",
            "@ref": "gr6a",
            "@mimetype": "image/gif"
          },
          {
            "@category": "thumbnail",
            "@height": "109",
            "@width": "219",
            "@_fa": "true",
            "$": "https://api.elsevier.com/content/object/eid/1-s2.0-S0926860X23002624-gr6b.sml?httpAccept=%2A%2F%2A",
            "@multimediatype": "GIF image file",
            "@type": "IMAGE-THUMBNAIL",
            "@size": "19539",
            "@ref": "gr6b",
            "@mimetype": "image/gif"
          },
          {
            "@category": "high",
            "@height": "690",
            "@width": "2213",
            "@_fa": "true",
            "$": "https://api.elsevier.com/content/object/eid/1-s2.0-S0926860X23002624-ga1_lrg.jpg?httpAccept=%2A%2F%2A",
            "@multimediatype": "JPEG image file",
            "@type": "IMAGE-HIGH-RES",
            "@size": "202661",
            "@ref": "ga1",
            "@mimetype": "image/jpeg"
          },
          {
            "@category": "high",
            "@height": "1336",
            "@width": "1497",
            "@_fa": "true",
            "$": "https://api.elsevier.com/content/object/eid/1-s2.0-S0926860X23002624-gr8_lrg.jpg?httpAccept=%2A%2F%2A",
            "@multimediatype": "JPEG image file",
            "@type": "IMAGE-HIGH-RES",
            "@size": "169375",
            "@ref": "gr8",
            "@mimetype": "image/jpeg"
          },
          {
            "@category": "high",
            "@height": "1503",
            "@width": "1497",
            "@_fa": "true",
            "$": "https://api.elsevier.com/content/object/eid/1-s2.0-S0926860X23002624-gr9_lrg.jpg?httpAccept=%2A%2F%2A",
            "@multimediatype": "JPEG image file",
            "@type": "IMAGE-HIGH-RES",
            "@size": "78021",
            "@ref": "gr9",
            "@mimetype": "image/jpeg"
          },
          {
            "@category": "high",
            "@height": "1208",
            "@width": "1497",
            "@_fa": "true",
            "$": "https://api.elsevier.com/content/object/eid/1-s2.0-S0926860X23002624-gr10_lrg.jpg?httpAccept=%2A%2F%2A",
            "@multimediatype": "JPEG image file",
            "@type": "IMAGE-HIGH-RES",
            "@size": "75828",
            "@ref": "gr10",
            "@mimetype": "image/jpeg"
          },
          {
            "@category": "high",
            "@height": "1050",
            "@width": "3493",
            "@_fa": "true",
            "$": "https://api.elsevier.com/content/object/eid/1-s2.0-S0926860X23002624-gr4_lrg.jpg?httpAccept=%2A%2F%2A",
            "@multimediatype": "JPEG image file",
            "@type": "IMAGE-HIGH-RES",
            "@size": "183258",
            "@ref": "gr4",
            "@mimetype": "image/jpeg"
          },
          {
            "@category": "high",
            "@height": "1311",
            "@width": "1497",
            "@_fa": "true",
            "$": "https://api.elsevier.com/content/object/eid/1-s2.0-S0926860X23002624-gr5_lrg.jpg?httpAccept=%2A%2F%2A",
            "@multimediatype": "JPEG image file",
            "@type": "IMAGE-HIGH-RES",
            "@size": "129105",
            "@ref": "gr5",
            "@mimetype": "image/jpeg"
          },
          {
            "@category": "high",
            "@height": "1218",
            "@width": "1497",
            "@_fa": "true",
            "$": "https://api.elsevier.com/content/object/eid/1-s2.0-S0926860X23002624-gr7_lrg.jpg?httpAccept=%2A%2F%2A",
            "@multimediatype": "JPEG image file",
            "@type": "IMAGE-HIGH-RES",
            "@size": "176917",
            "@ref": "gr7",
            "@mimetype": "image/jpeg"
          },
          {
            "@category": "high",
            "@height": "2688",
            "@width": "1497",
            "@_fa": "true",
            "$": "https://api.elsevier.com/content/object/eid/1-s2.0-S0926860X23002624-gr1_lrg.jpg?httpAccept=%2A%2F%2A",
            "@multimediatype": "JPEG image file",
            "@type": "IMAGE-HIGH-RES",
            "@size": "289289",
            "@ref": "gr1",
            "@mimetype": "image/jpeg"
          },
          {
            "@category": "high",
            "@height": "1396",
            "@width": "1497",
            "@_fa": "true",
            "$": "https://api.elsevier.com/content/object/eid/1-s2.0-S0926860X23002624-gr2_lrg.jpg?httpAccept=%2A%2F%2A",
            "@multimediatype": "JPEG image file",
            "@type": "IMAGE-HIGH-RES",
            "@size": "132301",
            "@ref": "gr2",
            "@mimetype": "image/jpeg"
          },
          {
            "@category": "high",
            "@height": "1306",
            "@width": "1497",
            "@_fa": "true",
            "$": "https://api.elsevier.com/content/object/eid/1-s2.0-S0926860X23002624-gr3_lrg.jpg?httpAccept=%2A%2F%2A",
            "@multimediatype": "JPEG image file",
            "@type": "IMAGE-HIGH-RES",
            "@size": "143541",
            "@ref": "gr3",
            "@mimetype": "image/jpeg"
          },
          {
            "@category": "high",
            "@height": "924",
            "@width": "2994",
            "@_fa": "true",
            "$": "https://api.elsevier.com/content/object/eid/1-s2.0-S0926860X23002624-sc1_lrg.jpg?httpAccept=%2A%2F%2A",
            "@multimediatype": "JPEG image file",
            "@type": "IMAGE-HIGH-RES",
            "@size": "174505",
            "@ref": "sc1",
            "@mimetype": "image/jpeg"
          },
          {
            "@category": "high",
            "@height": "4361",
            "@width": "3493",
            "@_fa": "true",
            "$": "https://api.elsevier.com/content/object/eid/1-s2.0-S0926860X23002624-gr6a_lrg.jpg?httpAccept=%2A%2F%2A",
            "@multimediatype": "JPEG image file",
            "@type": "IMAGE-HIGH-RES",
            "@size": "1028159",
            "@ref": "gr6a",
            "@mimetype": "image/jpeg"
          },
          {
            "@category": "high",
            "@height": "1738",
            "@width": "3493",
            "@_fa": "true",
            "$": "https://api.elsevier.com/content/object/eid/1-s2.0-S0926860X23002624-gr6b_lrg.jpg?httpAccept=%2A%2F%2A",
            "@multimediatype": "JPEG image file",
            "@type": "IMAGE-HIGH-RES",
            "@size": "781170",
            "@ref": "gr6b",
            "@mimetype": "image/jpeg"
          },
          {
            "@category": "standard",
            "@_fa": "true",
            "$": "https://api.elsevier.com/content/object/eid/1-s2.0-S0926860X23002624-mmc1.docx?httpAccept=%2A%2F%2A",
            "@multimediatype": "Microsoft Word file",
            "@type": "APPLICATION",
            "@size": "4159182",
            "@ref": "mmc1",
            "@mimetype": "application/word"
          },
          {
            "@category": "standard",
            "@_fa": "true",
            "$": "https://api.elsevier.com/content/object/eid/1-s2.0-S0926860X23002624-am.pdf?httpAccept=%2A%2F%2A",
            "@multimediatype": "Acrobat PDF file",
            "@type": "AAM-PDF",
            "@size": "2026598",
            "@ref": "am",
            "@mimetype": "application/pdf"
          }
        ]
      },
      "link": {
        "@rel": "abstract",
        "@href": "https://api.elsevier.com/content/abstract/scopus_id/85162745155"
      }
    }
  }
}