{
  "metadata": {
    "title": "Carbon spheres anchored Co<ce:inf loc=post>3</ce:inf>O<ce:inf loc=post>4</ce:inf> nanoclusters as an efficient catalyst for dye degradation",
    "authors": "; ; ",
    "journal": "Applied Catalysis A: General",
    "date": "2016-03-05",
    "doi": "10.1016/j.apcata.2015.12.028",
    "abstract": "",
    "uri": "https://api.elsevier.com/content/article/pii/S0926860X1530301X",
    "pii": "S0926860X1530301X"
  },
  "fulltext": {
    "full-text-retrieval-response": {
      "scopus-eid": "2-s2.0-84954051111",
      "originalText": "serial JL 271346 291210 291744 291809 31 Applied Catalysis A: General APPLIEDCATALYSISAGENERAL 2015-12-30 2015-12-30 2016-01-12 2016-01-12 2019-10-29T07:41:49 1-s2.0-S0926860X1530301X S0926-860X(15)30301-X S0926860X1530301X 10.1016/j.apcata.2015.12.028 S300 S300.3 FULL-TEXT 1-s2.0-S0926860X15X00226 2024-01-01T12:30:29.635264Z 0 0 20160305 2016 2015-12-30T16:18:17.212019Z absattachment articleinfo articletitlenorm authfirstinitialnorm authfirstsurnamenorm cid cids contenttype copyright crossmark dateloaded dateloadedtxt datesearch datesort dateupdated dco docsubtype doctype doi eid ewtransactionid hubeid indexeddate issn issnnorm itemstage itemtransactionid itemweight openaccess openarchive pg pgfirst pglast pii piinorm pubdatestart pubdatetxt pubyr sectiontitle sortorder srctitle srctitlenorm srctype ssids alllist content subj subheadings suppl tomb volfirst volissue volumelist webpdf webpdfpagecount yearnav figure e-component body acknowledge affil appendices articletitle auth authfirstini authfull authkeywords authlast grantsponsor highlightsabst primabst ref specialabst 0926-860X 0926860X true 513 513 C Volume 513 14 106 115 106 115 20160305 5 March 2016 2016-03-05 2016 Articles article fla Copyright © 2015 Elsevier B.V. All rights reserved. CARBONSPHERESANCHOREDCO3O4NANOCLUSTERSEFFICIENTCATALYSTFORDYEDEGRADATION DOU J 1 Introduction 2 Experimental section 2.1 Preparation of carbon spheres 2.2 Deposition of Co3O4 clusters and nanoparticles onto carbon spheres 2.3 Degradation of methyl orange 2.4 Materials characterization 3 Results and discussion 3.1 Catalyst Properties 3.2 Methyl orange degradation 4 Conclusions Acknowledgement Appendix A Supplementary data References ZENG 2013 226 235 H SOMORJAI 2009 16589 16605 G ASTRUC 2005 7852 7872 D ZHANG 2010 93 99 W XU 2004 9780 9790 R XIONG 2012 861 871 S WU 2010 3187 3194 Z MA 2014 13925 13931 T ZOU 2014 4372 4376 X LIU 2014 408 418 Y NIKULSHIN 2014 152 169 P GRAHAM 2014 1662 1672 U BEZEMER 2006 3956 3964 G SHI 2011 1225 1233 L JIAO 2009 1841 1844 F WANG 2015 42 50 Q MELAET 2014 2260 2263 G HU 2010 813 828 B SEVILLA 2009 4195 4203 M SUN 2004 597 601 X DOU 2012 7767 7775 J LIU 2014 2998 3001 J ZIDKI 2012 14275 14278 T STOLZ 2001 69 80 A KONSTANTINOU 2004 1 14 I MARTINEZHUITLE 2009 105 145 C ANIPSITAKIS 2006 1000 1007 G ANIPSITAKIS 2004 3705 3712 G HAN 2014 546 553 C DUARTE 2009 139 147 F HSIEH 2009 312 318 C CHEN 2008 116 121 X YANG 2008 300 307 Q SONG 2011 162 168 X GRIMES 1991 461 468 R FARHADI 2014 632 637 S YANG 2010 111 119 J TANG 2008 68 73 C TAN 1991 855 861 B SUN 2003 151 175 C BLESA 2000 31 63 M SHUKLA 2010 529 534 P HU 2013 7 18 L EDLA 2015 475 484 R JI 2011 239 243 F KONKOVA 2015 206 211 T ROY 2014 10248 10257 M YAO 2013 17341 17350 Y CHEN 2014 170 176 Z GOUDARZI 2014 46517 46520 M WANG 2015 159 167 Y LIU 2015 854 861 J REN 2015 572 578 Y GUO 2013 437 444 S TANG 2015 44 51 D DOUX2016X106 DOUX2016X106X115 DOUX2016X106XJ DOUX2016X106X115XJ 2018-01-12T00:00:00Z http://creativecommons.org/licenses/by-nc-nd/4.0/ 2019-03-15T09:47:10.717Z http://vtw.elsevier.com/data/voc/AddOnTypes/50.7/nlp S0926860X1530301X Nanyang Technological University Nanyang Technological University http://data.elsevier.com/vocabulary/SciValFunders/501100001475 http://sws.geonames.org/1880251/ ExxonMobil Research and Engineering ExxonMobil Research and Engineering Company http://data.elsevier.com/vocabulary/SciValFunders/100006584 http://sws.geonames.org/6252001/ The authors gratefully acknowledge the financial support provided by Knowledge Built Grant from ExxonMobil Research and Engineering (EMRE) Company , and the Start-Up grant provided by Nanyang Technological University . The authors are also grateful to insightful discussions with Dr. Y. Du from EMRE. Appendix A item S0926-860X(15)30301-X S0926860X1530301X 1-s2.0-S0926860X1530301X 10.1016/j.apcata.2015.12.028 271346 2024-01-01T12:30:29.635264Z 2016-03-05 1-s2.0-S0926860X1530301X-main.pdf https://s3.amazonaws.com/prod-ucs-content-store-us-east/content/pii:S0926860X1530301X/MAIN/application/pdf/38c404b38dbd196b6806b33e06fd73ac/main.pdf main.pdf pdf true 3534369 MAIN 10 1-s2.0-S0926860X1530301X-main_1.png https://s3.amazonaws.com/prod-ucs-content-store-us-east/content/pii:S0926860X1530301X/PREVIEW/image/png/438fa2adba74e0d340513da442885610/main_1.png main_1.png png 56289 849 656 IMAGE-WEB-PDF 1 1-s2.0-S0926860X1530301X-fx1.sml https://s3.amazonaws.com/prod-ucs-content-store-us-east/content/pii:S0926860X1530301X/fx1/THUMBNAIL/image/gif/46b4acefd0e5b33b6323121f5e2c5c83/fx1.sml fx1 true fx1.sml sml 5057 88 219 IMAGE-THUMBNAIL 1-s2.0-S0926860X1530301X-gr1.sml https://s3.amazonaws.com/prod-ucs-content-store-us-east/content/pii:S0926860X1530301X/gr1/THUMBNAIL/image/gif/e9b7f08c1aa5d90351343606c07d0e33/gr1.sml gr1 gr1.sml sml 10699 92 219 IMAGE-THUMBNAIL 1-s2.0-S0926860X1530301X-gr10.sml https://s3.amazonaws.com/prod-ucs-content-store-us-east/content/pii:S0926860X1530301X/gr10/THUMBNAIL/image/gif/4f4811306aa80892c088e9c90da9237c/gr10.sml gr10 gr10.sml sml 36002 164 180 IMAGE-THUMBNAIL 1-s2.0-S0926860X1530301X-gr11.sml https://s3.amazonaws.com/prod-ucs-content-store-us-east/content/pii:S0926860X1530301X/gr11/THUMBNAIL/image/gif/8049437151b22a671d2b747163213e3c/gr11.sml gr11 gr11.sml sml 5831 85 219 IMAGE-THUMBNAIL 1-s2.0-S0926860X1530301X-gr12.sml https://s3.amazonaws.com/prod-ucs-content-store-us-east/content/pii:S0926860X1530301X/gr12/THUMBNAIL/image/gif/fd2a5caff6005cff452c9e52d5594156/gr12.sml gr12 gr12.sml sml 4967 87 219 IMAGE-THUMBNAIL 1-s2.0-S0926860X1530301X-gr13.sml https://s3.amazonaws.com/prod-ucs-content-store-us-east/content/pii:S0926860X1530301X/gr13/THUMBNAIL/image/gif/ac9419cecd9a82c389a5e72753ec76cb/gr13.sml gr13 gr13.sml sml 5910 158 219 IMAGE-THUMBNAIL 1-s2.0-S0926860X1530301X-gr2.sml https://s3.amazonaws.com/prod-ucs-content-store-us-east/content/pii:S0926860X1530301X/gr2/THUMBNAIL/image/gif/59698baae8e4a06d6f3418a864d6d2d6/gr2.sml gr2 gr2.sml sml 29711 163 131 IMAGE-THUMBNAIL 1-s2.0-S0926860X1530301X-gr3.sml https://s3.amazonaws.com/prod-ucs-content-store-us-east/content/pii:S0926860X1530301X/gr3/THUMBNAIL/image/gif/e654df120873f01951df48577fca4755/gr3.sml gr3 gr3.sml sml 18356 164 209 IMAGE-THUMBNAIL 1-s2.0-S0926860X1530301X-gr4.sml https://s3.amazonaws.com/prod-ucs-content-store-us-east/content/pii:S0926860X1530301X/gr4/THUMBNAIL/image/gif/16ec30c5e571011794586f50ab0702d4/gr4.sml gr4 gr4.sml sml 6310 164 207 IMAGE-THUMBNAIL 1-s2.0-S0926860X1530301X-gr5.sml https://s3.amazonaws.com/prod-ucs-content-store-us-east/content/pii:S0926860X1530301X/gr5/THUMBNAIL/image/gif/809e5a3253f23936cbfd89d636eef788/gr5.sml gr5 gr5.sml sml 7887 164 196 IMAGE-THUMBNAIL 1-s2.0-S0926860X1530301X-gr6.sml https://s3.amazonaws.com/prod-ucs-content-store-us-east/content/pii:S0926860X1530301X/gr6/THUMBNAIL/image/gif/e849b4234d0708072c44bb50848a7e98/gr6.sml gr6 gr6.sml sml 7457 164 197 IMAGE-THUMBNAIL 1-s2.0-S0926860X1530301X-gr7.sml https://s3.amazonaws.com/prod-ucs-content-store-us-east/content/pii:S0926860X1530301X/gr7/THUMBNAIL/image/gif/6922b0fa50e74e27651c8c8a9c3c15a5/gr7.sml gr7 gr7.sml sml 36988 164 190 IMAGE-THUMBNAIL 1-s2.0-S0926860X1530301X-gr8.sml https://s3.amazonaws.com/prod-ucs-content-store-us-east/content/pii:S0926860X1530301X/gr8/THUMBNAIL/image/gif/79c0b8e237c30e9afc890da1d906d7bf/gr8.sml gr8 gr8.sml sml 3662 164 211 IMAGE-THUMBNAIL 1-s2.0-S0926860X1530301X-gr9.sml https://s3.amazonaws.com/prod-ucs-content-store-us-east/content/pii:S0926860X1530301X/gr9/THUMBNAIL/image/gif/3e088830ca694d8cc15925baa7cc6922/gr9.sml gr9 gr9.sml sml 8016 164 199 IMAGE-THUMBNAIL 1-s2.0-S0926860X1530301X-fx1.jpg https://s3.amazonaws.com/prod-ucs-content-store-us-east/content/pii:S0926860X1530301X/fx1/DOWNSAMPLED/image/jpeg/c2b39432b89509b5307eea4a904720b4/fx1.jpg fx1 true fx1.jpg jpg 14354 200 500 IMAGE-DOWNSAMPLED 1-s2.0-S0926860X1530301X-gr1.jpg https://s3.amazonaws.com/prod-ucs-content-store-us-east/content/pii:S0926860X1530301X/gr1/DOWNSAMPLED/image/jpeg/2165178d9e3bb31318882a204e42bf34/gr1.jpg gr1 gr1.jpg jpg 38340 197 470 IMAGE-DOWNSAMPLED 1-s2.0-S0926860X1530301X-gr10.jpg https://s3.amazonaws.com/prod-ucs-content-store-us-east/content/pii:S0926860X1530301X/gr10/DOWNSAMPLED/image/jpeg/6b7ab6834e55f77ab2166b75e7c9d0c3/gr10.jpg gr10 gr10.jpg jpg 145859 515 565 IMAGE-DOWNSAMPLED 1-s2.0-S0926860X1530301X-gr11.jpg https://s3.amazonaws.com/prod-ucs-content-store-us-east/content/pii:S0926860X1530301X/gr11/DOWNSAMPLED/image/jpeg/e9af53d42f285d830c6b336128efbf3e/gr11.jpg gr11 gr11.jpg jpg 31939 219 565 IMAGE-DOWNSAMPLED 1-s2.0-S0926860X1530301X-gr12.jpg https://s3.amazonaws.com/prod-ucs-content-store-us-east/content/pii:S0926860X1530301X/gr12/DOWNSAMPLED/image/jpeg/f1f90fdeca6dab99d622fcf1d914c2c2/gr12.jpg gr12 gr12.jpg jpg 40126 269 675 IMAGE-DOWNSAMPLED 1-s2.0-S0926860X1530301X-gr13.jpg https://s3.amazonaws.com/prod-ucs-content-store-us-east/content/pii:S0926860X1530301X/gr13/DOWNSAMPLED/image/jpeg/0d0911c66dddc8fe857f7ea852007b5c/gr13.jpg gr13 gr13.jpg jpg 19959 270 376 IMAGE-DOWNSAMPLED 1-s2.0-S0926860X1530301X-gr2.jpg https://s3.amazonaws.com/prod-ucs-content-store-us-east/content/pii:S0926860X1530301X/gr2/DOWNSAMPLED/image/jpeg/60266b0eaa647e080f0b658ee0cbdea0/gr2.jpg gr2 gr2.jpg jpg 206862 705 565 IMAGE-DOWNSAMPLED 1-s2.0-S0926860X1530301X-gr3.jpg https://s3.amazonaws.com/prod-ucs-content-store-us-east/content/pii:S0926860X1530301X/gr3/DOWNSAMPLED/image/jpeg/1f0e1c554fc6ea0e087dd96254b1b67c/gr3.jpg gr3 gr3.jpg jpg 93588 443 565 IMAGE-DOWNSAMPLED 1-s2.0-S0926860X1530301X-gr4.jpg https://s3.amazonaws.com/prod-ucs-content-store-us-east/content/pii:S0926860X1530301X/gr4/DOWNSAMPLED/image/jpeg/6786a729ba9e62837314af9029b81bc0/gr4.jpg gr4 gr4.jpg jpg 14917 223 282 IMAGE-DOWNSAMPLED 1-s2.0-S0926860X1530301X-gr5.jpg https://s3.amazonaws.com/prod-ucs-content-store-us-east/content/pii:S0926860X1530301X/gr5/DOWNSAMPLED/image/jpeg/888d942a89803d806a14dbda6642b95c/gr5.jpg gr5 gr5.jpg jpg 40063 393 471 IMAGE-DOWNSAMPLED 1-s2.0-S0926860X1530301X-gr6.jpg https://s3.amazonaws.com/prod-ucs-content-store-us-east/content/pii:S0926860X1530301X/gr6/DOWNSAMPLED/image/jpeg/3644058d3efda38dfb17c189256510c7/gr6.jpg gr6 gr6.jpg jpg 39215 390 470 IMAGE-DOWNSAMPLED 1-s2.0-S0926860X1530301X-gr7.jpg https://s3.amazonaws.com/prod-ucs-content-store-us-east/content/pii:S0926860X1530301X/gr7/DOWNSAMPLED/image/jpeg/532ff26f3372dd5b17f9e10095b91ea2/gr7.jpg gr7 gr7.jpg jpg 148453 487 565 IMAGE-DOWNSAMPLED 1-s2.0-S0926860X1530301X-gr8.jpg https://s3.amazonaws.com/prod-ucs-content-store-us-east/content/pii:S0926860X1530301X/gr8/DOWNSAMPLED/image/jpeg/908a3df9097899669c1ac53d32b98f2c/gr8.jpg gr8 gr8.jpg jpg 10713 233 301 IMAGE-DOWNSAMPLED 1-s2.0-S0926860X1530301X-gr9.jpg https://s3.amazonaws.com/prod-ucs-content-store-us-east/content/pii:S0926860X1530301X/gr9/DOWNSAMPLED/image/jpeg/51530d5326d85e39c2e19a633fae89fa/gr9.jpg gr9 gr9.jpg jpg 43815 403 489 IMAGE-DOWNSAMPLED 1-s2.0-S0926860X1530301X-fx1_lrg.jpg https://s3.amazonaws.com/prod-ucs-content-store-us-east/content/pii:S0926860X1530301X/fx1/HIGHRES/image/jpeg/f52633c00f85856204479ba3b41b6c00/fx1_lrg.jpg fx1 true fx1_lrg.jpg jpg 118221 886 2213 IMAGE-HIGH-RES 1-s2.0-S0926860X1530301X-gr1_lrg.jpg https://s3.amazonaws.com/prod-ucs-content-store-us-east/content/pii:S0926860X1530301X/gr1/HIGHRES/image/jpeg/e22245bd5699328183200fb851b1cbb2/gr1_lrg.jpg gr1 gr1_lrg.jpg jpg 191625 872 2083 IMAGE-HIGH-RES 1-s2.0-S0926860X1530301X-gr10_lrg.jpg https://s3.amazonaws.com/prod-ucs-content-store-us-east/content/pii:S0926860X1530301X/gr10/HIGHRES/image/jpeg/e42ba145c894c5b66c0277a1c6cc2f3e/gr10_lrg.jpg gr10 gr10_lrg.jpg jpg 1260190 2280 2500 IMAGE-HIGH-RES 1-s2.0-S0926860X1530301X-gr11_lrg.jpg https://s3.amazonaws.com/prod-ucs-content-store-us-east/content/pii:S0926860X1530301X/gr11/HIGHRES/image/jpeg/b39499f8816d72c76d5ec0bd857bd87c/gr11_lrg.jpg gr11 gr11_lrg.jpg jpg 267961 967 2500 IMAGE-HIGH-RES 1-s2.0-S0926860X1530301X-gr12_lrg.jpg https://s3.amazonaws.com/prod-ucs-content-store-us-east/content/pii:S0926860X1530301X/gr12/HIGHRES/image/jpeg/39f3ab996a8c899558ac4cf977af736b/gr12_lrg.jpg gr12 gr12_lrg.jpg jpg 289310 1190 2989 IMAGE-HIGH-RES 1-s2.0-S0926860X1530301X-gr13_lrg.jpg https://s3.amazonaws.com/prod-ucs-content-store-us-east/content/pii:S0926860X1530301X/gr13/HIGHRES/image/jpeg/9a5ba250372ec9e9f51dd0633ca034d0/gr13_lrg.jpg gr13 gr13_lrg.jpg jpg 136397 1199 1667 IMAGE-HIGH-RES 1-s2.0-S0926860X1530301X-gr2_lrg.jpg https://s3.amazonaws.com/prod-ucs-content-store-us-east/content/pii:S0926860X1530301X/gr2/HIGHRES/image/jpeg/9717278638f8ea3ab14788cd65e35dc7/gr2_lrg.jpg gr2 gr2_lrg.jpg jpg 2300435 3118 2500 IMAGE-HIGH-RES 1-s2.0-S0926860X1530301X-gr3_lrg.jpg https://s3.amazonaws.com/prod-ucs-content-store-us-east/content/pii:S0926860X1530301X/gr3/HIGHRES/image/jpeg/336066e1602f1bb0572fe60e1c833989/gr3_lrg.jpg gr3 gr3_lrg.jpg jpg 686714 1958 2500 IMAGE-HIGH-RES 1-s2.0-S0926860X1530301X-gr4_lrg.jpg https://s3.amazonaws.com/prod-ucs-content-store-us-east/content/pii:S0926860X1530301X/gr4/HIGHRES/image/jpeg/769157436198af24ab78fcacefc7244c/gr4_lrg.jpg gr4 gr4_lrg.jpg jpg 107988 988 1250 IMAGE-HIGH-RES 1-s2.0-S0926860X1530301X-gr5_lrg.jpg https://s3.amazonaws.com/prod-ucs-content-store-us-east/content/pii:S0926860X1530301X/gr5/HIGHRES/image/jpeg/cbeb582f6666869c070659925c0756c0/gr5_lrg.jpg gr5 gr5_lrg.jpg jpg 334899 1741 2085 IMAGE-HIGH-RES 1-s2.0-S0926860X1530301X-gr6_lrg.jpg https://s3.amazonaws.com/prod-ucs-content-store-us-east/content/pii:S0926860X1530301X/gr6/HIGHRES/image/jpeg/d502588127c09eb4bbfea20dd93f9016/gr6_lrg.jpg gr6 gr6_lrg.jpg jpg 316824 1730 2083 IMAGE-HIGH-RES 1-s2.0-S0926860X1530301X-gr7_lrg.jpg https://s3.amazonaws.com/prod-ucs-content-store-us-east/content/pii:S0926860X1530301X/gr7/HIGHRES/image/jpeg/719ee922274d12782641e76724f5632b/gr7_lrg.jpg gr7 gr7_lrg.jpg jpg 1456559 2153 2500 IMAGE-HIGH-RES 1-s2.0-S0926860X1530301X-gr8_lrg.jpg https://s3.amazonaws.com/prod-ucs-content-store-us-east/content/pii:S0926860X1530301X/gr8/HIGHRES/image/jpeg/575b62136bad54ec38e589a2da163f86/gr8_lrg.jpg gr8 gr8_lrg.jpg jpg 78697 1033 1333 IMAGE-HIGH-RES 1-s2.0-S0926860X1530301X-gr9_lrg.jpg https://s3.amazonaws.com/prod-ucs-content-store-us-east/content/pii:S0926860X1530301X/gr9/HIGHRES/image/jpeg/705564c328215c4ed3b3d0abaf439ba1/gr9_lrg.jpg gr9 gr9_lrg.jpg jpg 339668 1787 2167 IMAGE-HIGH-RES 1-s2.0-S0926860X1530301X-mmc1.docx https://s3.amazonaws.com/prod-ucs-content-store-us-east/content/pii:S0926860X1530301X/mmc1/MAIN/application/msword/cce080d491559a534bc7b4f6ccc87dff/mmc1.docx mmc1 mmc1.docx docx 355163 APPLICATION APCATA 15701 S0926-860X(15)30301-X 10.1016/j.apcata.2015.12.028 Elsevier B.V. Fig. 1 Scheme of deposition of Co3O4 nanoclusters onto carbon spheres. Fig. 2 FESEM and TEM images of (a–d) Co/C-400 and (e, f) Co/C-300 prepared by impregnation method. The inset in (f) shows the high resolution TEM image of cobalt oxide nanoparticles on the surface of carbon spheres. Fig. 3 (a) STEM image and (b-d) EDX mapping of Co/C-300 nanocatalyst. Fig. 4 Raman spectra of Co/C-300 and Co/C-400 nanocatalysts. Fig. 5 XPS spectra of Co/C-300 nanocatalyst, (a) C 1s, (b) Co 2p, and (c) O 1s. Fig. 6 XPS spectra of Co/C-400 nanocatalyst, (a) C 1s, (b) Co 2p, and (c) O 1s. Fig. 7 (a, b) FESEM and (c, d) TEM images of Co/C-DP prepared by precipitation–deposition method. Fig. 8 Raman spectrum of Co/C-DP nanocatalyst. Fig. 9 XPS spectra of Co/C-DP nanocatalysts, (a) C 1s, (b) Co 2p, and (c) O 1s. Fig. 10 TEM images of (a, b) Co/C-600 and (c, d) Co/C-800. Fig. 11 (a) XRD patterns and (b) Raman spectra of Co/C-600 and Co/C-800. Fig. 12 (a, b) Methyl orange degradation with carbon spheres supported Co3O4 nanocatalysts. Reaction condition: methyl orange (5mg), deionized water (100mL), oxone (14mg), catalyst (10mg). Purple (Co/C-300) and blue (Co/C-DP) lines represent control reactions performed without oxidant added. Fig. 13 Catalytic stability of Co/C-300 nanocatalysts for methyl orange degradation. Carbon spheres anchored Co3O4 nanoclusters as an efficient catalyst for dye degradation Jian Dou a Shengming Yin a Jeng Yi Chong a Bowei Zhang b Jianyu Han a Yizhong Huang b Rong Xu a ⁎ a School of Chemical & Biomedical Engineering, Nanyang Technological University, 62 Nanyang Drive, 637459, Singapore School of Chemical & Biomedical Engineering Nanyang Technological University 62 Nanyang Drive 637459 Singapore b School of Materials Science and Engineering, Nanyang Technological University, 50 Nanyang Avenue, 639798, Singapore School of Materials Science and Engineering Nanyang Technological University 50 Nanyang Avenue 639798 Singapore ⁎ Corresponding author. Graphical abstract Cobalt oxide nanoparticles with sizes of 1–2 nm were immobilized on carbon spheres support. Surface cobalt species were stabilized via coordination with surface hydroxyl groups of carbon spheres. Small cobalt oxide nanoclusters were very active for oxidative dye degradation. Herein, we have developed an effective strategy to immobilize spinel cobalt oxide (Co3O4) particles of nanometer and subnanometer sizes on carbon sphere support via impregnation and deposition-precipitation methods. With carbon spheres support, very small Co3O4 nanoparticles of around 1–2nm are uniformly distributed on the surface. Based on XPS analysis, the surface cobalt species are found coordinated with hydroxyl groups from carbon spheres. Among the various catalysts investigated, the Co/C-300 nanocatalyst with 1–2nm cobalt oxide clusters exhibits the highest activity with over 99% of methyl orange degraded in less than 10min of reaction. The higher activity of Co/C-300 nanocatalyst was attributed to small size of Co3O4 nanoparticles with more surface sites exposed for dye degradation reaction. The Co/C-300 nanocatalyst is reasonably stable and could be recycled for at least four runs without losing activity substantially. Keywords Spinel oxide Nanoclusters Carbon spheres Dye Degradation 1 Introduction Nanocatalysis has received growing research interests in the field of materials chemistry and catalysis over the last decades [1–3]. With advancement of materials science and nanotechnology, nanocatalysts can be prepared with well controlled size, shape, composition and structure. These properties are key factors for designing next generation nanocatalysts with high activity and high selectivity [2]. Furthermore, assembly of nanoparticles onto suitable catalyst supports holds the key for the practical application of nanocatalysts, which bridges the gap between homogeneous and heterogeneous catalysts. There are several strategies available to assemble nanoparticles onto catalyst supports such as deposition of nanoparticles or metal salts precursors onto pre-synthesized catalyst supports, co-precipitation of metal/metal oxide with catalyst supports and synthesis of catalyst supports in the presence of nanoparticles [1]. Cobalt metal and cobalt oxides/cobalt hydroxides (i.e., Co, Co3O4, CoO, and Co(OH)2) are important inorganic materials for wide applications such as sensors, magnetism, lithium-ion batteries, and catalysis [4–13]. There are many supported cobalt/cobalt oxides catalysts applied in industrial processes as well as reported in the literature for various catalytic applications. For example, alumina supported cobalt/molybdenum oxides activated by hydrogen sulfide has been used in refinery plants as hydrodesulfurization catalyst for removing sulfur from transportation oil [11]. Silica or alumina supported cobalt metal catalysts have been applied for Fischer–Tropsch process for producing hydrocarbons from carbon monoxide and hydrogen [12,13]. Cobalt oxide nanoparticles with sizes of 1–20nm have been deposited onto metal oxide supports such as SiO2, Al2O3, MgO, TiO2 etc [4,14–17]. Carbonaceous spheres synthesized from hydrothermal treatment of mono- or polysaccharides have unique properties such as well defined morphology and size [18–20]. As-synthesized carbon spheres are generally non-porous, while micropores and/or mesopores can be generated by thermal treatment at high temperature in inert gas atmosphere [21]. Due to rich surface functional groups such as hydroxyl, carbonyl, and carboxylic species, carbon spheres are promising candidate as a new type catalyst support. For instance, carbon spheres have been used as support for immobilizing metal, metal oxides, and metal sulfides such as Ag, Pd, Fe3O4 and CdS etc [18]. Cobalt metal nanoparticles with sizes of around 5nm have also been deposited onto carbon spheres via colloid deposition and CVD methods [12,22]. Much smaller cobalt hydroxide nanoparticles with sizes of 1–2nm have been immobilized onto colloidal silica by a deposition-precipitation method [23]. However, it remains challenging to immobilize cobalt oxide or hydroxide nanoparticles with sizes of 1–2nm onto carbon spheres, as thermal treatment in air associated with the conventional impregnation method leads to aggregation of cobalt oxide nanoparticles. Organic dyes are widely used in textile, paper and food industry. The annual production of dyestuffs is estimated to be around one million tons worldwide [24]. The largest amount of organic dyes is used for dyeing of textiles. In such a process, about 10% of the dyestuffs is released to the environment due to improper binding to the fibers [24,25]. The conventional strategies for purification of dyeing wastewater are based on separation processes such as adsorption, coagulation, filtration and ion exchange [26]. The adsorbed or precipitated dye compounds have to be removed to regenerate the adsorbent or membrane. With more stringent regulations, many research efforts have been devoted to developing efficient processes such as microbiological treatments, enzymatic decomposition and electrochemical methods to remove dyes from polluted water [26]. Particularly, advanced oxidation process (AOP) is a powerful oxidation method based on the generation of highly reactive hydroxyl or sulfate radicals to decompose dyes [25]. Oxone is a versatile oxidant for oxidative degradation of many organic compounds [27]. Oxone can be activated by transition metal cations such as Mn2+, Fe2+, Co2+ and Cu2+ to generate sulfate radicals, which is a strong oxidant for decomposition of organic dyes. Among the various transition metals, cobalt is the most active for coupling with oxone [28]. Many cobalt oxide (i.e., Co3O4) based heterogeneous catalysts either supported or unsupported have been explored for activation of oxone [4,29–33]. Particularly, it was found that the support has a significant effect on the activity of supported cobalt catalyst. With Co3O4 supported on MgO, the activity is four times higher that cobalt oxide supported on ZnO, P25, Al2O3, and SBA-15 [4]. It is our aim to further explore the effects of other catalyst parameters such particle size of cobalt oxide nanoparticles to improve the efficiency of cobalt based catalysts for dye degradation. In this work, cobalt oxide nanoparticles are successfully deposited onto the surface of carbon spheres via impregnation and deposition-precipitation methods (Fig. 1 ). The particle size of the deposited cobalt oxide nanoparticles can be adjusted by heating Co/C samples in argon at various temperature (300–800°C). The as-prepared Co/C nanocatalysts were investigated for organic dye degradation and have demonstrated excellent activities. 2 Experimental section 2.1 Preparation of carbon spheres Carbon spheres with an average size of around 120nm were prepared following literature methods with some modifications [20,34]. Briefly, 80mL of 0.5M glucose (C6H12O6, Sigma–Aldrich) aqueous solution was placed into a Teflon liner with a capacity of 120mL. The Teflon liner was fitted into an autoclave, which was then heated in oven at 160°C for 12h. The dark brown suspension was filtered and washed with deionized water. The collected solid sample was dried at 60°C in oven for overnight. 2.2 Deposition of Co3O4 clusters and nanoparticles onto carbon spheres The prepared carbon spheres were used as catalyst supports for deposition of cobalt oxide nanoclusters and nanoparticles via impregnation and deposition-precipitation methods. In a typical impregnation method, 42mg of cobalt acetate tetrahydrate (Co(CH3COO)2·4H2O) was firstly dissolved in 0.12mL of deionized water. After that, 100mg of carbon spheres were impregnated with above prepared cobalt acetate aqueous solution. The impregnated sample was dried at 60°C for overnight and later heated at 300–800°C for 3h in argon. To immobilize cobalt oxide onto carbon spheres via deposition-precipitation method, 100mg of cobalt nitrate hexahydrate (Co(NO3)2·6H2O) was firstly dissolved in 200mL of deionized water. After that, 200mg of carbon spheres were dispersed in above cobalt nitrate solution, followed by adding 2mL of 20% ammonia aqueous solution. The resultant mixture was refluxed at 90°C in an oil bath for 2 days. The solid product was collected by filtration and washing with deionized water, followed by drying at 60°C overnight. 2.3 Degradation of methyl orange Methyl orange (C14H14N3NaO3S) was used as a model compound for dye degradation reaction. Typically, 100mL of 50ppm (ppm: mg/L) methyl orange solution was added into a beaker with 200mL of capacity. After that, 10mg of catalyst and 14mg of oxone (2KHSO5·KHSO4·K2SO4, Alfa Aesar, 4.7% active oxygen) were added to above methyl orange solution consecutively. The resulted mixture was stirred at room temperature for 30min. At different time intervals (i.e., 2, 5, 10, 15, 20 and 30min), 2mL of reaction mixture was taken and filtered for analyzing the concentration of methyl orange by UV–vis spectroscopy (Shimadzu 2450). For recycle test, the used catalyst was recovered by filtering the reaction mixture after reaction and washed with deionized water. The spent catalyst was dried at 60°C overnight before the next run. 2.4 Materials characterization The crystallographic structures of the prepared Co3O4/C samples were characterized by powder X-ray diffraction (XRD, Bruker D2, CuKα, λ =1.5406Å). The morphology and chemical composition of the Co/C nanocatalysts were studied using field emission scanning electron microscopy and energy dispersive X-ray spectroscopy (FESEM/EDX, JSM6701F), transmission electron microscopy (TEM, JEM2010, 300kV), and high resolution transmission electron microscopy (HRTEM, JEM2100, 200kV). The weight percentage of cobalt was measured on An Agilent 7700x Inductively Coupled Plasma (ICP). The oxidation states of supported cobalt oxide nanoclusters and nanoparticles were examined with X-ray photoelectron spectroscopy (XPS, AXIS-HSi, Kratos Analytical) using a monochromatized Al Kα exciting radiation (1486.71eV), and all binding energies (BE) were referenced to the C 1s peak at 284.6eV. Raman spectra of Co/C samples were collected on Renishaw InVia Reflex Raman Spectroscopy in the back scattering configuration with the excitation wavelength line of 633nm in air ambient environment. The power of the excitation laser lines was kept below 1mW to avoid heating effect. The Raman emission was collected by a Leica 50x objective (N.A.=0.5) over three randomly selected spots on the powder. 3 Results and discussion 3.1 Catalyst Properties Carbon spheres supported cobalt oxide nanoparticles were prepared by impregnation of aqueous solution of cobalt precursor salt (i.e., cobalt acetate) followed by thermal treatment in argon at 300–800°C for 3h. The FESEM image in Fig. 2 a shows that the morphology of cobalt oxide deposited carbon spheres after heat treatment at 400°C (i.e., Co/C-400) remains similar as that of the as-synthesized carbon spheres. At the higher magnification, aggregates of small nanoparticles can be observed on the surface of carbon spheres (Fig. 2b), indicating the formation of cobalt oxide nanoparticles by decomposition of cobalt precursor during thermal treatment. Fig. 2b and 2d presents the TEM images of the same sample. It can be seen that cobalt oxide nanoparticles with sizes of 3–5nm are well dispersed on the surface of carbon spheres. When the thermal treatment temperature was reduced to 300°C, the formed cobalt oxide nanoparticles had very small sizes and were only observed under high resolution TEM examination (Fig. 2e and f). It has been reported that cobalt acetate and cobalt nitrate precursors can decompose below 300°C by extended heating [35]. Hence it is possible that the cobalt oxide nanoclusters formed by decomposition of cobalt acetate at such a low temperature are too small to be observed by TEM. HRTEM analysis was carried out to confirm their existence on the surface of carbon spheres. As shown in the inset in Fig. 2f, cobalt oxide nanoparticles with sizes of 1–2nm can be observed. The lattice spacing of 0.24nm can be attributed to (311) plane of cubic Co3O4 (JCPDS 42–1467), which will be further confirmed by Raman analysis later. In order to understand the distribution of cobalt oxide nanoparticles on the carbon surface, EDX mapping was carried out under scanning TEM (STEM) mode on randomly selected carbon sphere of Co/C-300 nanocatalysts (Fig. 3 a). As shown in Fig. 3b-d, all the three elements (C, Co and O) are uniformly distributed on the carbon surface, suggesting the current synthesis strategy is effective to immobilize very small cobalt oxide nanoparticles on the surface of carbon spheres. The measured weight percentage of cobalt in Co/C-300 and Co/C-400 is around 7.5% and 8.6% which are slightly lower than the theoretical value of 10%. The above two carbon spheres supported cobalt oxide samples, Co/C-300 and Co/C-400, were further characterized by XRD (Fig. S1). There are no peaks observed for both Co/C-300 and Co/C-400 nanocatalysts, possibly due to small cobalt oxide nanoclusters and nanoparticles uniformly dispersed on the surface of carbon spheres or poor crystallinity of formed cobalt oxide nanoparticles. Raman spectroscopy was used to further support the existence of deposited Co3O4 nanoclusters and nanoparticles on the surface of carbon spheres. As shown in Fig. 4 , three peaks at 468, 513, and 674cm−1 appear in the spectrum of Co/C-400 sample, which can be attributed to E g, F 2g, and A 1g mode of Co3O4 nanoparticles [36–38]. For Co/C-300 sample, only two peaks at 468 and 671cm−1 can be observed, correlating to Eg and A1g mode of Co3O4 nanoclusters. The peak at 513cm−1 due to F 2g mode of Co3O4 is not obvious, possibly due to the very small particle sizes. The oxidation states of supported cobalt oxide nanoparticles were examined by XPS technique. In the spectrum of C 1s of sample Co/C-300 (Fig. 5 a), the first peak at 284.6eV is assigned to CC bond, while the second peak at 286.3eV is attributed to carbon coordinated to OH or in COC groups. The third peak at 288.5eV is due to surface COOH and COO groups [21]. The spectrum of Co 2p3/2 can be deconvoluted to two pairs of peaks (Fig. 5b). The two major peaks at 781.4 and 783.9eV could be assigned to cobalt cations associated with OH and COO groups, respectively, which is consistent with existence of abundant surface OH and COO groups on the surface of carbon spheres [4,39]. The two corresponding shake-up satellite peaks are centered at 786.9 and 789.4eV, respectively. For O 1s spectrum, the first peak at 530.7 is ascribed to the lattice oxygen in cobalt oxides or oxygen marked with an asterisk in surface CO*O groups (Fig. 5c). The second peak at 532.1eV can be assigned to surface hydroxyl group, and the last peak at 533.6eV is attributed to oxygen marked with an asterisk in COO* functional groups [21]. It is noted that the surface of carbon spheres is rich in hydroxyl groups based on the peak areas of deconvoluted O 1s peak. It has been reported that most oxides are hydroxylated when exposed to moisture, and the extent of hydroxylation depends on the nature of metal ions involved and also on the surrounding environmental [40,41]. For instance, most surface cobalt ions are associated with hydroxyl group when supported on magnesium oxide [4]. It is known that surface of carbon spheres synthesized from hydrothermal treatment of glucose is abundant with hydroxyl groups [20,21]. Thus it explains that surface cobalt ions on carbon spheres are mainly associated with hydroxyl groups. For the sample Co/C-400 calcined at 400°C, the C 1s and O 1s spectra are similar as those of Co/C-300 sample (Fig. 6 a and c). In cobalt 2p3/2 spectrum, the peaks at 782.0 and 784.1eV can be assigned to cobalt cations coordinated with hydroxyl and carboxylate groups respectively as discussed previously (Fig. 6b). It is noted that after heating at 400°C in argon, a higher percentage of cobalt species are associated with carboxylate groups. Carbon spheres supported Co3O4 nanoclusters were also prepared by deposition-precipitation method (i.e., Co/C-DP). As shown in Fig. 7 a and b, carbon spheres with sizes of around 150nm together with small particles on their surface can be observed after deposition of cobalt species. It is noted that the precipitation-deposition process was carried out by treating the carbon spheres in the aqueous solution added with cobalt nitrate and ammonia and the mixture was aged at 90°C for 2d. The loosen particles on the carbon surface could be the broken carbon species from carbon spheres. Based on the TEM images (Fig. 7C and d), it is clearly seen that broken carbon species co-exist with carbon spheres. Similar to the sample Co/C-300 prepared by the impregnation method, there are no Co3O4 nanoparticles observed on the surface of carbon spheres, indicating that the size of cobalt based nanoparticles is too small and they are uniformly dispersed on the surface of carbon spheres. The weight percentage of cobalt in this sample was measured to be 6.9% by ICP. The samples prepared by precipitation-deposition method were further characterized by XRD and Raman spectroscopy. As expected, there is no peak observed in the XRD pattern of Co/C-DP, which is similar as those of Co/C-300 and Co/C-400 prepared via the impregnation method (Figure S1). As discussed above, it is possibly due to the small Co3O4 nanoclusters uniformly dispersed on the surface of carbon spheres. Raman spectrum (Fig. 8 ) shows that two peaks can be observed at 467 and 663cm−1, which were attributed to E g and A 1g mode of spinel Co3O4, which is similar to that of Co/C-300. It shows both impregnation and precipitation-deposition methods can be used for deposition of very small (probably <1nm) Co3O4 nanoclusters onto carbon spheres. Fig. 9 presents the XPS results of Co/C-DP. In the spectrum of C 1s, the first major peak at 284.6eV is assigned to CC bond, and the second at 286.5eV is attributed to surface OH or COC groups. The last peak at 288.6eV could be attributed to surface COOH and COO groups, as discussed above. For Co 2p3/2 spectrum, the two major peaks at 781.4 and 783.9eV could be assigned to cobalt cations associated with hydroxyl and carboxylate groups respectively. As discussed above, majority of surface cobalt ions coordinated with hydroxyl groups, which presented abundantly on the surface of carbon spheres. The assignment of O 1s peaks was similar as that of Co/C-300 and Co/C-400 nanocatalysts. It can be observed that the hydroxyl group in Co/C-CP sample is relatively more abundant than that in Co/C samples, which is probably due to the interaction of carbon spheres with the alkaline solution during the precipitation process [34]. Based on above results, it is known that the sizes of immobilized Co3O4 nanoparticles in Co/C-300 and Co/C-400 samples prepared via impregnation method vary between about 1 to 5nm by changing the heating temperature. The effect of thermal treatment temperature was further studied by heating the impregnated sample at 600 and 800°C. As shown in Fig. 10 a and b, large cobalt/cobalt oxide particles of 20–100nm can be observed coexisting with 5nm nanoparticles. It was known that carbonization of carbon spheres occurs at temperature above 500°C, along with losing surface functional groups (i.e., OH) [21]. The surface hydroxyl groups are essential to coordinate with Co species and thus stabilize the small cobalt oxide nanoclusters. With decreased surface OH groups, the surface cobalt nanoclusters tend to aggregate and form larger crystals with sizes of 20–100nm. Further increasing the calcination temperature to 800°C, only large cobalt/cobalt oxide particles with size of 20 to 100nm can be observed, which is due to aggregation and recrystallization of surface cobalt oxide nanoclusters after the loss of most of the surface OH groups. Furthermore, it is interesting to find that in the XRD pattern of Co/C-800 nanocatalyst (Fig. 11 a), three peaks appeared at 44.4, 51.8 and 76.2° can be assigned to (111), (200) and (220) planes of cubic cobalt metal phase (JCPDS #15-0806). Self-reduction of cobalt cation occurs at high temperature with consuming surface functional groups (i.e., OH) on the surface carbon spheres. The FTIR spectra of Co/C samples calcined at 300 and 800°C was presented in Fig. S2. It can be seen that the surface functional groups such as OH and CO are greatly reduced after thermal treatment at 800°C, which was due to consumption of surface functional groups for reduction of Co3O4 and also for carbonization of carbon spheres. No peaks can be observed in the XRD pattern of Co/C-600. The lack of XRD peaks for this sample is possibly due to the percentage of large cobalt/cobalt oxide particles is much less compared to that of 5nm nanoparticles. On the other hand, in Raman spectra (Fig. 11b) the four characteristics peaks of spinel Co3O4 can be observed at 463, 509, 605, and 669cm−1 for both samples, though the spectrum of Co/C-600 is much weaker. It suggests that the surface layers of metallic cobalt nanocrystals are oxidized to Co3O4, since cobalt metal can be easily oxidized in air. 3.2 Methyl orange degradation The thus prepared carbon spheres supported Co3O4 were investigated for oxidation of organic dye. In present work, methyl orange was used as the model dye compound and oxone was chosen as the oxidant. The oxidant to methyl orange ratio (KHSO5: C14H14N3NaO3S) was fixed as 3:1. The adsorption capability of the prepared catalysts (i.e., Co/C-300 and Co/C-DP) was firstly investigated without adding oxone. As shown in Fig. 12 a, less than 5% of methyl orange can be adsorbed on the catalyst surface, which should be due to non-porous structure of carbon spheres support. The Co/C-300 nanocatalyst with around 1–2nm Co3O4 nanoclusters supported on carbon spheres exhibits excellent activity for dye degradation and was the most active among all the samples tested (Fig. 12a). At the reaction time of 2min, around 70% methyl orange can be oxidized. The conversion is increased to 91 and 99% at 5 and 10min, respectively. The effect of adsorption alone on reducing the dye concentration is insignificant as indicated by the curves in the absence of oxone shown in Fig. 12a. For the Co/C-400 nanocatalyst calcined at 400°C, the degradation of methyl orange is around 46% and 80% at 2 and 5min respectively. The lower activity should be due to the increased particle sizes of Co3O4 and the reduced OH groups. For Co/C-600 nanocatalyst, the activity is further reduced with around 50 and 70% of methyl orange degraded at 2 and 5min. The sample prepared by precipitation-deposition method (Co/C-DP) has the lowest activity among the samples evaluated. The conversion of methyl orange at 5min was measured to be 50%. The kinetics of dye degradation has been studied by plotting ln(C/C0) vs time (Fig. 12b). By assuming a pseudo first-order reaction, the kinetic constants were calculated to be 0.54, 0.39, 0.2, and 0.16min−1 for Co/C-300, Co/C-400, Co/C-600, and Co/C-DP catalysts respectively. Many transition metal oxides based catalysts (i.e., Co3O4, MnO2, and CuO) have been developed for dye degradation [42–50]. It shall be mentioned that it is difficult to directly compare the activities of various catalysts, as the experiment conditions such as types of dye and oxidants, and oxidant to dye ratio differ from one another. The activity of the best catalyst (i.e., Co/C-300) was calculated to be 1.21mg of methyl orange degraded per mg of cobalt metal per min at reaction time of 5min. It is known that CoO x /MgO catalyst reported earlier by our group was much more active for degradation of organic dyes than cobalt oxide deposited on other supports (i.e., Al2O3, ZnO, and ZrO2 etc.) [4]. The activity of CoO x /MgO catalyst was calculated to be 0.14mg of dye degraded per mg of cobalt metal per min at reaction time of 5min. It shall be mentioned that the size of cobalt oxide on MgO support is 5–10nm, which is much larger than the size of cobalt oxide nanoparticles on carbon spheres. This explains the 8 times higher activity of Co/C-300 nanocatalyst. The effect of pH on the activity for degradation of methyl orange was further studied with Co/C-300 nanocatalyst. As shown in Figure S3, the activity increased with the increasing pH value from 5 to 10. This observation is consistent with our previous results showing that basic MgO supported Co3O4 nanoparticles exhibited the highest activity for methyl orange degradation, which is possibly due to promotion effect of surface hydroxyl group.4 It has been reported that both SO4 −· and OH· radicals could be formed over transition metal catalysts [51–55]. We thus proposed the following mechanism for methyl orange degradation over Co/C nanocatalysts. Co2+ +HSO5 − →Co3+ +OH− +SO4 −· Co2+ +HSO5 − →Co3+ +SO4 2− +OH· Co3+ +HSO5 − →Co2+ +SO5 −·+H+ SO4 −·+MO→SO4 2− +intermediates→→CO2 +H2O OH·+MO→OH− +intermediates→→CO2 +H2O Firstly, sulfate radicals (SO4 −·) and hydroxyl radicals (OH·) are generated by oxidation Co2+ to Co3+ with peroxymonosulfate. Then, the oxidized Co3+ could further react with peroxymonosulfate to form Co2+ and peroxymonosulfate radicals (SO5 −·). The formed radicals (i.e., SO4 −· and OH·) are strong oxidants for degradation of methyl orange to intermediates and finally to carbon dioxide and water. As the redox potential of peroxomonosulfate radicals is relative weak, they may not be involved in degradation of methyl orange [53]. In addition, quenching of radicals may occur to reduce the radicals formed, which will slow the reaction for dye degradation [51]. The stability of Co/C-300 nanocatalyst was studied by recycling the used catalyst for four runs. As shown in Fig. 13 , the conversion of methyl orange is 90% and 100% at reaction time of 5 and 10min in the first run. In the second run, the conversion of methyl orange is dropped to 71% at reaction time of 10min and stabilized at 62–63% at 3rd and 4th run. Besides the possibility of losing some particles during filtration and washing, the partial activity loss could be due to dissolution of cobalt oxide as the reaction solution is slightly acidic because the use of oxone. Nevertheless, over 95% of conversion can still be achieved at 30min at the 4th run. 4 Conclusions In summary, carbon spheres supported Co3O4 nanocatalysts have been prepared by impregnation and precipitation-deposition methods. With low calcination temperatures of 300–400°C, nanometer or sub-nanometer sized Co3O4 clusters can be uniformly deposited on the surface of carbon spheres. The carbon spheres supported Co3O4 nanocatalysts were investigated for methyl orange degradation reaction. Among all the prepared catalysts, Co/C-300 is the most active catalyst. At a reaction time of 5min, 91% of methyl orange can be oxidized, and a total conversion is achieved at 10min. Furthermore, the Co/C-300 nanocatalyst is reasonably stable and could be recycled for several runs. Acknowledgement The authors gratefully acknowledge the financial support provided by Knowledge Built Grant from ExxonMobil Research and Engineering (EMRE) Company, and the Start-Up grant provided by Nanyang Technological University. The authors are also grateful to insightful discussions with Dr. Y. Du from EMRE. Appendix A Supplementary data Supplementary data associated with this article can be found, in the online version, at http://dx.doi.org/10.1016/j.apcata.2015.12.028. Appendix A Supplementary data The following are Supplementary data to this article: References [1] H.C. Zeng Acc. Chem. Res. 46 2013 226 235 [2] G.A. Somorjai H. Frei J.Y. Park J. Am. Chem. Soc. 131 2009 16589 16605 [3] D. Astruc F. Lu J.R. Aranzaes Angew. Chem. Int. Ed. 44 2005 7852 7872 [4] W. Zhang H.L. Tay S.S. Lim Y.S. Wang Z.Y. Zhong R. Xu Appl. Catal. B 95 2010 93 99 [5] R. Xu H.C. Zeng Langmuir 20 2004 9780 9790 [6] S.L. Xiong J.S. Chen X.W. Lou H.C. Zeng Adv. Funct. Mater. 22 2012 861 871 [7] Z.S. Wu W.C. Ren L. Wen L.B. Gao J.P. Zhao Z.P. Chen G.M. Zhou F. Li H.M. Cheng ACS Nano 4 2010 3187 3194 [8] T.Y. Ma S. Dai M. Jaroniec S.Z. Qiao J. Am. Chem. Soc. 136 2014 13925 13931 [9] X.X. Zou X.X. Huang A. Goswami R. Silva B.R. Sathe E. Mikmeková T. Asefa Angew. Chem. Int. Ed. 53 2014 4372 4376 [10] Y.X. Liu H.X. Dai J.G. Deng S.H. Xie H.G. Yang W. Tan W. Han Y. Jiang G.S. Guo J. Catal. 309 2014 408 418 [11] P.A. Nikulshin D.I. Ishutenko A.A. Mozhaev K.I. Maslakov A.A. Pimerzin J. Catal. 312 2014 152 169 [12] U.M. Graham G. Jacobs M.K. Gnanamani S.M. Lipka W.D. Shafer C.R. Swartz T. Jermwongratanachai R. Chen F. Rogers B.H. Davis ACS Catal. 4 2014 1662 1672 [13] G.L. Bezemer J.H. Bitter H.P.C.E. Kuipers H. Oosterbeek J.E. Holewijn X.D. Xu F. Kapteijn A.J. van Dillen K.P. de Jong J. Am. Chem. Soc. 128 2006 3956 3964 [14] L. Shi K. Tao T. Kawabata T. Shimamura X.J. Zhang N. Tsubaki ACS Catal. 1 2011 1225 1233 [15] F. Jiao H. Frei Angew. Chem. Int. Ed. 48 2009 1841 1844 [16] Q. Wang Y. Peng J. Fu G.Z. Kyzas S.M.R. Billah S.Q. An Appl. Catal. B 168 2015 42 50 [17] G. Melaet W.T. Ralston C.S. Li S. Alayoglu K. An N. Musselwhite B. Kalkan G.A. Somorjai J. Am. Chem. Soc. 136 2014 2260 2263 [18] B. Hu K. Wang L.H. Wu S.H. Yu M. Antonietti M.M. Titirici Adv. Mater. 22 2010 813 828 [19] M. Sevilla A.B. Fuertes Chem. Eur. J. 15 2009 4195 4203 [20] X.M. Sun Y.D. Li Angew. Chem. Int. Ed. 43 2004 597 601 [21] J. Dou H.C. Zeng J. Phys. Chem. C 116 2012 7767 7775 [22] J. Liu L.H. Jiang B.S. Zhang J.T. Jin D.S. Su S.L. Wang G.Q. Sun ACS Catal. 4 2014 2998 3001 [23] T. Zidki L.H. Zhang V. Shafirovich S.V. Lymar J. Am. Chem. Soc. 134 2012 14275 14278 [24] A. Stolz Appl. Microbiol. Biotechnol. 56 2001 69 80 [25] I.K. Konstantinou T.A. Albanis Appl. Catal. B 49 2004 1 14 [26] C.A. Martínez-Huitle E. Brillas Appl. Catal. B 87 2009 105 145 [27] G.P. Anipsitakis D.D. Dionysiou M.A. Gonzalez Environ. Sci. Technol. 40 2006 1000 1007 [28] G.P. Anipsitakis D.D. Dionysiou Environ. Sci. Technol. 38 2004 3705 3712 [29] C.C. Han L. Ge C.F. Chen Y.J. Li X.L. Xiao Y.N. Zhang L.L. Guo Appl. Catal. B 147 2014 546 553 [30] F. Duarte F.J. Maldonado-Hódar A.F. Pérez-Cadenas L.M. Madeira Appl. Catal. B 85 2009 139 147 [31] C.T. Hsieh W.S. Fan W.Y. Chen J.Y. Lin Sep. Purif. Technol. 67 2009 312 318 [32] X.Y. Chen J.W. Chen X.L. Qiao D.G. Wang X.Y. Cai Appl. Catal. B 80 2008 116 121 [33] Q.J. Yang H. Choi Y.J. Chen D.D. Dionysiou Appl. Catal. B 77 2008 300 307 [34] X.H. Song P. Gunawan R.R. Jiang S.S.J. Leong K. Wang R. Xu, J. Hazard. Mater. 194 2011 162 168 [35] R.W. Grimes A.N. Fitch J. Mater. Chem. 1 1991 461 468 [36] S. Farhadi K. Pourzare S. Bazgir J. Alloys. Comp. 587 2014 632 637 [37] J. Yang H.W. Liu W.N. Martens R.L. Frost J. Phys. Chem. C 114 2010 111 119 [38] C.W. Tang C.B. Wang S.H. Chien Thermochim. Acta 473 2008 68 73 [39] B.J. Tan K.J. Klabunde P.M.A. Sherwood J. Am. Chem. Soc. 113 1991 855 861 [40] C.H. Sun J.C. Berg Adv. Colloid Interface Sci. 105 2003 151 175 [41] M.A. Blesa A.D. Weisz P.J. Morando J.A. Salfity G.E. Magaz A.E. Regazzoni Coord. Chem. Rev. 196 2000 31 63 [42] P.R. Shukla S.B. Wang H.Q. Sun H.M. Ang M. Tadé Appl. Catal. B. 100 2010 529 534 [43] L.X. Hu F. Yang W.C. Lu Y. Hao H. Yuan Appl. Catal. B. 134-135 2013 7 18 [44] R. Edla N. Patel M. Orlandi N. Bazzanella V. Bello C. Maurizio G. Mattei P. Mazzoldi A. Miotello Appl. Catal. B. 166-167 2015 475 484 [45] F. Ji C.L. Li L. Deng Chem. Eng. J. 178 2011 239 243 [46] T.V. Kon'Kova I.P. Prosvirin M.B. Alekhina S.A. Skornikova Kinet. Catal. 56 2015 206 211 [47] M. Roy S. Ghosh M.K. Naskar Dalton Trans. 43 2014 10248 10257 [48] Y.J. Yao C. Xu J.C. Qin F.Y. Wei M.N. Rao S.B. Wang Ind. Eng. Chem. Res. 52 2013 17341 17350 [49] Z.L. Chen S.H. Chen Y.H. Li X.L. Si J. Huang S. Massey G.L. Chen Mater. Res. Bull. 57 2014 170 176 [50] M. Goudarzi M. Bazarganipour M. Salavati-Niasari RSC Adv. 4 2014 46517 46520 [51] Y.X. Wang H.Q. Sun H.M. Ang M.O. Tadé S.B. Wang Appl. Catal. B 164 2015 159 167 [52] J. Liu Z.W. Zhao P.H. Shao F.Y. Cui Chem. Eng. J. 262 2015 854 861 [53] Y.M. Ren L.Q. Lin J. Ma J. Yang J. Feng Z.J. Fan Appl. Catal. B 165 2015 572 578 [54] S. Guo G.K. Zhang Y.D. Guo J.C. Yu Carbon 60 2013 437 444 [55] D.D. Tang G.K. Zhang S. Guo J. Colloid Interface Sci. 454 2015 44 51",
      "scopus-id": "84954051111",
      "coredata": {
        "eid": "1-s2.0-S0926860X1530301X",
        "dc:description": "Herein, we have developed an effective strategy to immobilize spinel cobalt oxide (Co3O4) particles of nanometer and subnanometer sizes on carbon sphere support via impregnation and deposition-precipitation methods. With carbon spheres support, very small Co3O4 nanoparticles of around 1–2nm are uniformly distributed on the surface. Based on XPS analysis, the surface cobalt species are found coordinated with hydroxyl groups from carbon spheres. Among the various catalysts investigated, the Co/C-300 nanocatalyst with 1–2nm cobalt oxide clusters exhibits the highest activity with over 99% of methyl orange degraded in less than 10min of reaction. The higher activity of Co/C-300 nanocatalyst was attributed to small size of Co3O4 nanoparticles with more surface sites exposed for dye degradation reaction. The Co/C-300 nanocatalyst is reasonably stable and could be recycled for at least four runs without losing activity substantially.",
        "openArchiveArticle": "false",
        "prism:coverDate": "2016-03-05",
        "openaccessUserLicense": null,
        "prism:aggregationType": "Journal",
        "prism:url": "https://api.elsevier.com/content/article/pii/S0926860X1530301X",
        "dc:creator": [
          {
            "@_fa": "true",
            "$": "Dou, Jian"
          },
          {
            "@_fa": "true",
            "$": "Yin, Shengming"
          },
          {
            "@_fa": "true",
            "$": "Chong, Jeng Yi"
          },
          {
            "@_fa": "true",
            "$": "Zhang, Bowei"
          },
          {
            "@_fa": "true",
            "$": "Han, Jianyu"
          },
          {
            "@_fa": "true",
            "$": "Huang, Yizhong"
          },
          {
            "@_fa": "true",
            "$": "Xu, Rong"
          }
        ],
        "link": [
          {
            "@_fa": "true",
            "@rel": "self",
            "@href": "https://api.elsevier.com/content/article/pii/S0926860X1530301X"
          },
          {
            "@_fa": "true",
            "@rel": "scidir",
            "@href": "https://www.sciencedirect.com/science/article/pii/S0926860X1530301X"
          }
        ],
        "dc:format": "application/json",
        "openaccessType": null,
        "pii": "S0926-860X(15)30301-X",
        "prism:volume": "513",
        "prism:publisher": "Elsevier B.V.",
        "dc:title": "Carbon spheres anchored Co3O4 nanoclusters as an efficient catalyst for dye degradation",
        "prism:copyright": "Copyright © 2015 Elsevier B.V. All rights reserved.",
        "openaccess": "0",
        "prism:issn": "0926860X",
        "dcterms:subject": [
          {
            "@_fa": "true",
            "$": "Spinel oxide"
          },
          {
            "@_fa": "true",
            "$": "Nanoclusters"
          },
          {
            "@_fa": "true",
            "$": "Carbon spheres"
          },
          {
            "@_fa": "true",
            "$": "Dye"
          },
          {
            "@_fa": "true",
            "$": "Degradation"
          }
        ],
        "openaccessArticle": "false",
        "prism:publicationName": "Applied Catalysis A: General",
        "openaccessSponsorType": null,
        "prism:pageRange": "106-115",
        "prism:endingPage": "115",
        "pubType": "fla",
        "prism:coverDisplayDate": "5 March 2016",
        "prism:doi": "10.1016/j.apcata.2015.12.028",
        "prism:startingPage": "106",
        "dc:identifier": "doi:10.1016/j.apcata.2015.12.028",
        "openaccessSponsorName": null
      },
      "objects": {
        "object": [
          {
            "@category": "thumbnail",
            "@height": "88",
            "@width": "219",
            "@_fa": "true",
            "$": "https://api.elsevier.com/content/object/eid/1-s2.0-S0926860X1530301X-fx1.sml?httpAccept=%2A%2F%2A",
            "@multimediatype": "GIF image file",
            "@type": "IMAGE-THUMBNAIL",
            "@size": "5057",
            "@ref": "fx1",
            "@mimetype": "image/gif"
          },
          {
            "@category": "thumbnail",
            "@height": "92",
            "@width": "219",
            "@_fa": "true",
            "$": "https://api.elsevier.com/content/object/eid/1-s2.0-S0926860X1530301X-gr1.sml?httpAccept=%2A%2F%2A",
            "@multimediatype": "GIF image file",
            "@type": "IMAGE-THUMBNAIL",
            "@size": "10699",
            "@ref": "gr1",
            "@mimetype": "image/gif"
          },
          {
            "@category": "thumbnail",
            "@height": "164",
            "@width": "180",
            "@_fa": "true",
            "$": "https://api.elsevier.com/content/object/eid/1-s2.0-S0926860X1530301X-gr10.sml?httpAccept=%2A%2F%2A",
            "@multimediatype": "GIF image file",
            "@type": "IMAGE-THUMBNAIL",
            "@size": "36002",
            "@ref": "gr10",
            "@mimetype": "image/gif"
          },
          {
            "@category": "thumbnail",
            "@height": "85",
            "@width": "219",
            "@_fa": "true",
            "$": "https://api.elsevier.com/content/object/eid/1-s2.0-S0926860X1530301X-gr11.sml?httpAccept=%2A%2F%2A",
            "@multimediatype": "GIF image file",
            "@type": "IMAGE-THUMBNAIL",
            "@size": "5831",
            "@ref": "gr11",
            "@mimetype": "image/gif"
          },
          {
            "@category": "thumbnail",
            "@height": "87",
            "@width": "219",
            "@_fa": "true",
            "$": "https://api.elsevier.com/content/object/eid/1-s2.0-S0926860X1530301X-gr12.sml?httpAccept=%2A%2F%2A",
            "@multimediatype": "GIF image file",
            "@type": "IMAGE-THUMBNAIL",
            "@size": "4967",
            "@ref": "gr12",
            "@mimetype": "image/gif"
          },
          {
            "@category": "thumbnail",
            "@height": "158",
            "@width": "219",
            "@_fa": "true",
            "$": "https://api.elsevier.com/content/object/eid/1-s2.0-S0926860X1530301X-gr13.sml?httpAccept=%2A%2F%2A",
            "@multimediatype": "GIF image file",
            "@type": "IMAGE-THUMBNAIL",
            "@size": "5910",
            "@ref": "gr13",
            "@mimetype": "image/gif"
          },
          {
            "@category": "thumbnail",
            "@height": "163",
            "@width": "131",
            "@_fa": "true",
            "$": "https://api.elsevier.com/content/object/eid/1-s2.0-S0926860X1530301X-gr2.sml?httpAccept=%2A%2F%2A",
            "@multimediatype": "GIF image file",
            "@type": "IMAGE-THUMBNAIL",
            "@size": "29711",
            "@ref": "gr2",
            "@mimetype": "image/gif"
          },
          {
            "@category": "thumbnail",
            "@height": "164",
            "@width": "209",
            "@_fa": "true",
            "$": "https://api.elsevier.com/content/object/eid/1-s2.0-S0926860X1530301X-gr3.sml?httpAccept=%2A%2F%2A",
            "@multimediatype": "GIF image file",
            "@type": "IMAGE-THUMBNAIL",
            "@size": "18356",
            "@ref": "gr3",
            "@mimetype": "image/gif"
          },
          {
            "@category": "thumbnail",
            "@height": "164",
            "@width": "207",
            "@_fa": "true",
            "$": "https://api.elsevier.com/content/object/eid/1-s2.0-S0926860X1530301X-gr4.sml?httpAccept=%2A%2F%2A",
            "@multimediatype": "GIF image file",
            "@type": "IMAGE-THUMBNAIL",
            "@size": "6310",
            "@ref": "gr4",
            "@mimetype": "image/gif"
          },
          {
            "@category": "thumbnail",
            "@height": "164",
            "@width": "196",
            "@_fa": "true",
            "$": "https://api.elsevier.com/content/object/eid/1-s2.0-S0926860X1530301X-gr5.sml?httpAccept=%2A%2F%2A",
            "@multimediatype": "GIF image file",
            "@type": "IMAGE-THUMBNAIL",
            "@size": "7887",
            "@ref": "gr5",
            "@mimetype": "image/gif"
          },
          {
            "@category": "thumbnail",
            "@height": "164",
            "@width": "197",
            "@_fa": "true",
            "$": "https://api.elsevier.com/content/object/eid/1-s2.0-S0926860X1530301X-gr6.sml?httpAccept=%2A%2F%2A",
            "@multimediatype": "GIF image file",
            "@type": "IMAGE-THUMBNAIL",
            "@size": "7457",
            "@ref": "gr6",
            "@mimetype": "image/gif"
          },
          {
            "@category": "thumbnail",
            "@height": "164",
            "@width": "190",
            "@_fa": "true",
            "$": "https://api.elsevier.com/content/object/eid/1-s2.0-S0926860X1530301X-gr7.sml?httpAccept=%2A%2F%2A",
            "@multimediatype": "GIF image file",
            "@type": "IMAGE-THUMBNAIL",
            "@size": "36988",
            "@ref": "gr7",
            "@mimetype": "image/gif"
          },
          {
            "@category": "thumbnail",
            "@height": "164",
            "@width": "211",
            "@_fa": "true",
            "$": "https://api.elsevier.com/content/object/eid/1-s2.0-S0926860X1530301X-gr8.sml?httpAccept=%2A%2F%2A",
            "@multimediatype": "GIF image file",
            "@type": "IMAGE-THUMBNAIL",
            "@size": "3662",
            "@ref": "gr8",
            "@mimetype": "image/gif"
          },
          {
            "@category": "thumbnail",
            "@height": "164",
            "@width": "199",
            "@_fa": "true",
            "$": "https://api.elsevier.com/content/object/eid/1-s2.0-S0926860X1530301X-gr9.sml?httpAccept=%2A%2F%2A",
            "@multimediatype": "GIF image file",
            "@type": "IMAGE-THUMBNAIL",
            "@size": "8016",
            "@ref": "gr9",
            "@mimetype": "image/gif"
          },
          {
            "@category": "standard",
            "@height": "200",
            "@width": "500",
            "@_fa": "true",
            "$": "https://api.elsevier.com/content/object/eid/1-s2.0-S0926860X1530301X-fx1.jpg?httpAccept=%2A%2F%2A",
            "@multimediatype": "JPEG image file",
            "@type": "IMAGE-DOWNSAMPLED",
            "@size": "14354",
            "@ref": "fx1",
            "@mimetype": "image/jpeg"
          },
          {
            "@category": "standard",
            "@height": "197",
            "@width": "470",
            "@_fa": "true",
            "$": "https://api.elsevier.com/content/object/eid/1-s2.0-S0926860X1530301X-gr1.jpg?httpAccept=%2A%2F%2A",
            "@multimediatype": "JPEG image file",
            "@type": "IMAGE-DOWNSAMPLED",
            "@size": "38340",
            "@ref": "gr1",
            "@mimetype": "image/jpeg"
          },
          {
            "@category": "standard",
            "@height": "515",
            "@width": "565",
            "@_fa": "true",
            "$": "https://api.elsevier.com/content/object/eid/1-s2.0-S0926860X1530301X-gr10.jpg?httpAccept=%2A%2F%2A",
            "@multimediatype": "JPEG image file",
            "@type": "IMAGE-DOWNSAMPLED",
            "@size": "145859",
            "@ref": "gr10",
            "@mimetype": "image/jpeg"
          },
          {
            "@category": "standard",
            "@height": "219",
            "@width": "565",
            "@_fa": "true",
            "$": "https://api.elsevier.com/content/object/eid/1-s2.0-S0926860X1530301X-gr11.jpg?httpAccept=%2A%2F%2A",
            "@multimediatype": "JPEG image file",
            "@type": "IMAGE-DOWNSAMPLED",
            "@size": "31939",
            "@ref": "gr11",
            "@mimetype": "image/jpeg"
          },
          {
            "@category": "standard",
            "@height": "269",
            "@width": "675",
            "@_fa": "true",
            "$": "https://api.elsevier.com/content/object/eid/1-s2.0-S0926860X1530301X-gr12.jpg?httpAccept=%2A%2F%2A",
            "@multimediatype": "JPEG image file",
            "@type": "IMAGE-DOWNSAMPLED",
            "@size": "40126",
            "@ref": "gr12",
            "@mimetype": "image/jpeg"
          },
          {
            "@category": "standard",
            "@height": "270",
            "@width": "376",
            "@_fa": "true",
            "$": "https://api.elsevier.com/content/object/eid/1-s2.0-S0926860X1530301X-gr13.jpg?httpAccept=%2A%2F%2A",
            "@multimediatype": "JPEG image file",
            "@type": "IMAGE-DOWNSAMPLED",
            "@size": "19959",
            "@ref": "gr13",
            "@mimetype": "image/jpeg"
          },
          {
            "@category": "standard",
            "@height": "705",
            "@width": "565",
            "@_fa": "true",
            "$": "https://api.elsevier.com/content/object/eid/1-s2.0-S0926860X1530301X-gr2.jpg?httpAccept=%2A%2F%2A",
            "@multimediatype": "JPEG image file",
            "@type": "IMAGE-DOWNSAMPLED",
            "@size": "206862",
            "@ref": "gr2",
            "@mimetype": "image/jpeg"
          },
          {
            "@category": "standard",
            "@height": "443",
            "@width": "565",
            "@_fa": "true",
            "$": "https://api.elsevier.com/content/object/eid/1-s2.0-S0926860X1530301X-gr3.jpg?httpAccept=%2A%2F%2A",
            "@multimediatype": "JPEG image file",
            "@type": "IMAGE-DOWNSAMPLED",
            "@size": "93588",
            "@ref": "gr3",
            "@mimetype": "image/jpeg"
          },
          {
            "@category": "standard",
            "@height": "223",
            "@width": "282",
            "@_fa": "true",
            "$": "https://api.elsevier.com/content/object/eid/1-s2.0-S0926860X1530301X-gr4.jpg?httpAccept=%2A%2F%2A",
            "@multimediatype": "JPEG image file",
            "@type": "IMAGE-DOWNSAMPLED",
            "@size": "14917",
            "@ref": "gr4",
            "@mimetype": "image/jpeg"
          },
          {
            "@category": "standard",
            "@height": "393",
            "@width": "471",
            "@_fa": "true",
            "$": "https://api.elsevier.com/content/object/eid/1-s2.0-S0926860X1530301X-gr5.jpg?httpAccept=%2A%2F%2A",
            "@multimediatype": "JPEG image file",
            "@type": "IMAGE-DOWNSAMPLED",
            "@size": "40063",
            "@ref": "gr5",
            "@mimetype": "image/jpeg"
          },
          {
            "@category": "standard",
            "@height": "390",
            "@width": "470",
            "@_fa": "true",
            "$": "https://api.elsevier.com/content/object/eid/1-s2.0-S0926860X1530301X-gr6.jpg?httpAccept=%2A%2F%2A",
            "@multimediatype": "JPEG image file",
            "@type": "IMAGE-DOWNSAMPLED",
            "@size": "39215",
            "@ref": "gr6",
            "@mimetype": "image/jpeg"
          },
          {
            "@category": "standard",
            "@height": "487",
            "@width": "565",
            "@_fa": "true",
            "$": "https://api.elsevier.com/content/object/eid/1-s2.0-S0926860X1530301X-gr7.jpg?httpAccept=%2A%2F%2A",
            "@multimediatype": "JPEG image file",
            "@type": "IMAGE-DOWNSAMPLED",
            "@size": "148453",
            "@ref": "gr7",
            "@mimetype": "image/jpeg"
          },
          {
            "@category": "standard",
            "@height": "233",
            "@width": "301",
            "@_fa": "true",
            "$": "https://api.elsevier.com/content/object/eid/1-s2.0-S0926860X1530301X-gr8.jpg?httpAccept=%2A%2F%2A",
            "@multimediatype": "JPEG image file",
            "@type": "IMAGE-DOWNSAMPLED",
            "@size": "10713",
            "@ref": "gr8",
            "@mimetype": "image/jpeg"
          },
          {
            "@category": "standard",
            "@height": "403",
            "@width": "489",
            "@_fa": "true",
            "$": "https://api.elsevier.com/content/object/eid/1-s2.0-S0926860X1530301X-gr9.jpg?httpAccept=%2A%2F%2A",
            "@multimediatype": "JPEG image file",
            "@type": "IMAGE-DOWNSAMPLED",
            "@size": "43815",
            "@ref": "gr9",
            "@mimetype": "image/jpeg"
          },
          {
            "@category": "high",
            "@height": "886",
            "@width": "2213",
            "@_fa": "true",
            "$": "https://api.elsevier.com/content/object/eid/1-s2.0-S0926860X1530301X-fx1_lrg.jpg?httpAccept=%2A%2F%2A",
            "@multimediatype": "JPEG image file",
            "@type": "IMAGE-HIGH-RES",
            "@size": "118221",
            "@ref": "fx1",
            "@mimetype": "image/jpeg"
          },
          {
            "@category": "high",
            "@height": "872",
            "@width": "2083",
            "@_fa": "true",
            "$": "https://api.elsevier.com/content/object/eid/1-s2.0-S0926860X1530301X-gr1_lrg.jpg?httpAccept=%2A%2F%2A",
            "@multimediatype": "JPEG image file",
            "@type": "IMAGE-HIGH-RES",
            "@size": "191625",
            "@ref": "gr1",
            "@mimetype": "image/jpeg"
          },
          {
            "@category": "high",
            "@height": "2280",
            "@width": "2500",
            "@_fa": "true",
            "$": "https://api.elsevier.com/content/object/eid/1-s2.0-S0926860X1530301X-gr10_lrg.jpg?httpAccept=%2A%2F%2A",
            "@multimediatype": "JPEG image file",
            "@type": "IMAGE-HIGH-RES",
            "@size": "1260190",
            "@ref": "gr10",
            "@mimetype": "image/jpeg"
          },
          {
            "@category": "high",
            "@height": "967",
            "@width": "2500",
            "@_fa": "true",
            "$": "https://api.elsevier.com/content/object/eid/1-s2.0-S0926860X1530301X-gr11_lrg.jpg?httpAccept=%2A%2F%2A",
            "@multimediatype": "JPEG image file",
            "@type": "IMAGE-HIGH-RES",
            "@size": "267961",
            "@ref": "gr11",
            "@mimetype": "image/jpeg"
          },
          {
            "@category": "high",
            "@height": "1190",
            "@width": "2989",
            "@_fa": "true",
            "$": "https://api.elsevier.com/content/object/eid/1-s2.0-S0926860X1530301X-gr12_lrg.jpg?httpAccept=%2A%2F%2A",
            "@multimediatype": "JPEG image file",
            "@type": "IMAGE-HIGH-RES",
            "@size": "289310",
            "@ref": "gr12",
            "@mimetype": "image/jpeg"
          },
          {
            "@category": "high",
            "@height": "1199",
            "@width": "1667",
            "@_fa": "true",
            "$": "https://api.elsevier.com/content/object/eid/1-s2.0-S0926860X1530301X-gr13_lrg.jpg?httpAccept=%2A%2F%2A",
            "@multimediatype": "JPEG image file",
            "@type": "IMAGE-HIGH-RES",
            "@size": "136397",
            "@ref": "gr13",
            "@mimetype": "image/jpeg"
          },
          {
            "@category": "high",
            "@height": "3118",
            "@width": "2500",
            "@_fa": "true",
            "$": "https://api.elsevier.com/content/object/eid/1-s2.0-S0926860X1530301X-gr2_lrg.jpg?httpAccept=%2A%2F%2A",
            "@multimediatype": "JPEG image file",
            "@type": "IMAGE-HIGH-RES",
            "@size": "2300435",
            "@ref": "gr2",
            "@mimetype": "image/jpeg"
          },
          {
            "@category": "high",
            "@height": "1958",
            "@width": "2500",
            "@_fa": "true",
            "$": "https://api.elsevier.com/content/object/eid/1-s2.0-S0926860X1530301X-gr3_lrg.jpg?httpAccept=%2A%2F%2A",
            "@multimediatype": "JPEG image file",
            "@type": "IMAGE-HIGH-RES",
            "@size": "686714",
            "@ref": "gr3",
            "@mimetype": "image/jpeg"
          },
          {
            "@category": "high",
            "@height": "988",
            "@width": "1250",
            "@_fa": "true",
            "$": "https://api.elsevier.com/content/object/eid/1-s2.0-S0926860X1530301X-gr4_lrg.jpg?httpAccept=%2A%2F%2A",
            "@multimediatype": "JPEG image file",
            "@type": "IMAGE-HIGH-RES",
            "@size": "107988",
            "@ref": "gr4",
            "@mimetype": "image/jpeg"
          },
          {
            "@category": "high",
            "@height": "1741",
            "@width": "2085",
            "@_fa": "true",
            "$": "https://api.elsevier.com/content/object/eid/1-s2.0-S0926860X1530301X-gr5_lrg.jpg?httpAccept=%2A%2F%2A",
            "@multimediatype": "JPEG image file",
            "@type": "IMAGE-HIGH-RES",
            "@size": "334899",
            "@ref": "gr5",
            "@mimetype": "image/jpeg"
          },
          {
            "@category": "high",
            "@height": "1730",
            "@width": "2083",
            "@_fa": "true",
            "$": "https://api.elsevier.com/content/object/eid/1-s2.0-S0926860X1530301X-gr6_lrg.jpg?httpAccept=%2A%2F%2A",
            "@multimediatype": "JPEG image file",
            "@type": "IMAGE-HIGH-RES",
            "@size": "316824",
            "@ref": "gr6",
            "@mimetype": "image/jpeg"
          },
          {
            "@category": "high",
            "@height": "2153",
            "@width": "2500",
            "@_fa": "true",
            "$": "https://api.elsevier.com/content/object/eid/1-s2.0-S0926860X1530301X-gr7_lrg.jpg?httpAccept=%2A%2F%2A",
            "@multimediatype": "JPEG image file",
            "@type": "IMAGE-HIGH-RES",
            "@size": "1456559",
            "@ref": "gr7",
            "@mimetype": "image/jpeg"
          },
          {
            "@category": "high",
            "@height": "1033",
            "@width": "1333",
            "@_fa": "true",
            "$": "https://api.elsevier.com/content/object/eid/1-s2.0-S0926860X1530301X-gr8_lrg.jpg?httpAccept=%2A%2F%2A",
            "@multimediatype": "JPEG image file",
            "@type": "IMAGE-HIGH-RES",
            "@size": "78697",
            "@ref": "gr8",
            "@mimetype": "image/jpeg"
          },
          {
            "@category": "high",
            "@height": "1787",
            "@width": "2167",
            "@_fa": "true",
            "$": "https://api.elsevier.com/content/object/eid/1-s2.0-S0926860X1530301X-gr9_lrg.jpg?httpAccept=%2A%2F%2A",
            "@multimediatype": "JPEG image file",
            "@type": "IMAGE-HIGH-RES",
            "@size": "339668",
            "@ref": "gr9",
            "@mimetype": "image/jpeg"
          },
          {
            "@category": "standard",
            "@_fa": "true",
            "$": "https://api.elsevier.com/content/object/eid/1-s2.0-S0926860X1530301X-mmc1.docx?httpAccept=%2A%2F%2A",
            "@multimediatype": "Microsoft Word file",
            "@type": "APPLICATION",
            "@size": "355163",
            "@ref": "mmc1",
            "@mimetype": "application/word"
          }
        ]
      },
      "link": {
        "@rel": "abstract",
        "@href": "https://api.elsevier.com/content/abstract/scopus_id/84954051111"
      }
    }
  }
}