{
  "metadata": {
    "title": "Bimetallic Pd-Fe supported on γ-Al<ce:inf loc=post>2</ce:inf>O<ce:inf loc=post>3</ce:inf> catalyst used in the ring opening of 2-methylfuran to selective formation of alcohols",
    "authors": "; ; ",
    "journal": "Applied Catalysis A: General",
    "date": "2017-08-05",
    "doi": "10.1016/j.apcata.2017.06.019",
    "abstract": "",
    "uri": "https://api.elsevier.com/content/article/pii/S0926860X17302685",
    "pii": "S0926860X17302685"
  },
  "fulltext": {
    "full-text-retrieval-response": {
      "scopus-eid": "2-s2.0-85021286774",
      "originalText": "serial JL 271346 291210 291744 291809 31 Applied Catalysis A: General APPLIEDCATALYSISAGENERAL 2017-06-16 2017-06-16 2017-06-27 2017-06-27 2018-06-13T13:03:18 1-s2.0-S0926860X17302685 S0926-860X(17)30268-5 S0926860X17302685 10.1016/j.apcata.2017.06.019 S300 S300.2 FULL-TEXT 1-s2.0-S0926860X17X00124 2025-07-16T14:34:32.714048Z 0 0 20170805 2017 2017-06-16T21:52:36.879915Z absattachment articleinfo articletitlenorm authfirstinitialnorm authfirstsurnamenorm cid cids contenttype copyright crossmark dateloaded dateloadedtxt datesearch datesort dateupdated dco docsubtype doctype doi eid ewtransactionid hubeid indexeddate issn issnnorm itemstage itemtransactionid itemweight openaccess openarchive pg pgfirst pglast pii piinorm pubdatestart pubdatetxt pubyr sortorder srctitle srctitlenorm srctype ssids alllist content subj subheadings suppl tomb volfirst volissue volumelist webpdf webpdfpagecount yearnav figure table body acknowledge affil articletitle auth authfirstini authfull authkeywords authlast grantsponsor highlightsabst primabst pubtype ref specialabst 0926-860X 0926860X true 543 543 C Volume 543 18 133 140 133 140 20170805 5 August 2017 2017-08-05 2017 article fla © 2017 Elsevier B.V. All rights reserved. BIMETALLICPDFESUPPORTEDAL2O3CATALYSTUSEDINRINGOPENING2METHYLFURANSELECTIVEFORMATIONALCOHOLS DIMASRIVERA G 1 Introduction 2 Experimental 2.1 Catalyst synthesis 2.2 Catalyst characterization 2.2.1 Thermal analysis 2.2.2 Temperature programmed reduction (TPR) 2.2.3 High-resolution transmission electron microscopy (TEM) 2.3 Catalytic activity measurements 3 Results 3.1 Thermal analysis 3.2 Temperature programmed reduction (TPR) 3.3 Catalytic activity tests 3.4 Proposal of the mechanism to form the products of Pd-Fe/Al2O3 catalysts 3.5 High-resolution transmission electron microscopy (HRTEM) 4 Conclusion Acknowledgements References GAO 2007 1645 1650 J CANN 2010 893 899 A HEUFER 2013 511 518 K XING 2011 2193 2205 R LIN 2013 15794 15800 K CLAUS 1998 51 62 P ALIAGA 2011 8104 8109 C BISWAS 2014 379 385 P LIU 2016 668 671 H VETERE 2010 914 920 V ZHAO 2014 185 190 Y SITTHISA 2011 784 791 S MA 2009 1013 1016 T ALONSO 2012 8075 8098 D CHEN 2017 890 896 Y ZHU 2013 1104 1111 C ROUSSET 2000 163 168 J PERSSON 2005 139 150 K ITO 2014 6146 6149 Y CHEN 2013 1436 1442 H WANG 2015 3433 3467 Y MELNIKOV 2014 145 151 P YEN 2002 245 252 F SOLISMALDONADO 2014 2062 2086 C RADIVOJEVIC 2006 51 58 D LEVANMAO 1995 107 118 R GOBARA 2014 105 118 H PARK 2016 282 289 K BARRERA 2005 279 288 A FARRAUTO 1995 263 270 R NAGARAJA 2007 90 97 B MERLO 2011 467 482 A SITTHISA 2011 17 27 S MAZZIERI 2009 161 168 V CONTRERASANDRADE 2009 3835 3841 I DO 2009 9 18 P MOZER 2011 13369 13378 T SIRIJARUPHAN 2004 304 313 A SANKAR 2012 8099 8139 M MIERCZYNSKI 2016 281 294 P TIAN 2013 224 229 D KUGAI 2011 46 53 J WANG 2005 12 48 F PHASEEQUILIBRIUMDIAGRAMSBONDINGTHEORYFORMETALSALLOYS KHALILOV 2013 318 326 I ZHENG 2006 18 23 H HAUBRICH 2009 13947 13967 J VOROTNIKOV 2012 2496 2504 V JEWELL 2006 1 15 L BUI 2016 7701 7709 P IINO 2014 17 27 A XIANG 2010 289 294 Y YANG 2017 266 277 J YU 2012 5780 5817 W LESIAK 2014 337 348 M DIMASRIVERAX2017X133 DIMASRIVERAX2017X133X140 DIMASRIVERAX2017X133XG DIMASRIVERAX2017X133X140XG 2019-06-27T00:00:00.000Z http://creativecommons.org/licenses/by-nc-nd/4.0/ © 2017 Elsevier B.V. All rights reserved. item S0926-860X(17)30268-5 S0926860X17302685 1-s2.0-S0926860X17302685 10.1016/j.apcata.2017.06.019 271346 2024-01-01T12:31:47.592716Z 2017-08-05 1-s2.0-S0926860X17302685-main.pdf https://s3-eu-west-1.amazonaws.com/prod-ucs-content-store-eu-west/content/pii:S0926860X17302685/MAIN/application/pdf/36a66b437d55075ca727cffcd7cd2bba/main.pdf https://s3.amazonaws.com/prod-ucs-content-store-us-east/content/pii:S0926860X17302685/MAIN/application/pdf/36a66b437d55075ca727cffcd7cd2bba/main.pdf main.pdf pdf true 855975 MAIN 8 1-s2.0-S0926860X17302685-main_1.png https://s3-eu-west-1.amazonaws.com/prod-ucs-content-store-eu-west/content/pii:S0926860X17302685/PREVIEW/image/png/ab96e7b2c0562882779970e2414b05e3/main_1.png https://s3.amazonaws.com/prod-ucs-content-store-us-east/content/pii:S0926860X17302685/PREVIEW/image/png/ab96e7b2c0562882779970e2414b05e3/main_1.png main_1.png png 53715 849 656 IMAGE-WEB-PDF 1 1-s2.0-S0926860X17302685-fx1.sml https://s3-eu-west-1.amazonaws.com/prod-ucs-content-store-eu-west/content/pii:S0926860X17302685/fx1/THUMBNAIL/image/gif/09220260428c81a65455f924b8384962/fx1.sml https://s3.amazonaws.com/prod-ucs-content-store-us-east/content/pii:S0926860X17302685/fx1/THUMBNAIL/image/gif/09220260428c81a65455f924b8384962/fx1.sml fx1 true fx1.sml sml 6116 97 219 IMAGE-THUMBNAIL 1-s2.0-S0926860X17302685-fx10.sml https://s3-eu-west-1.amazonaws.com/prod-ucs-content-store-eu-west/content/pii:S0926860X17302685/fx10/THUMBNAIL/image/gif/a85c859aa3c4418407b30e2ba10c69ef/fx10.sml https://s3.amazonaws.com/prod-ucs-content-store-us-east/content/pii:S0926860X17302685/fx10/THUMBNAIL/image/gif/a85c859aa3c4418407b30e2ba10c69ef/fx10.sml fx10 fx10.sml sml 3822 152 122 IMAGE-THUMBNAIL 1-s2.0-S0926860X17302685-fx11.sml https://s3-eu-west-1.amazonaws.com/prod-ucs-content-store-eu-west/content/pii:S0926860X17302685/fx11/THUMBNAIL/image/gif/c8fe49ca785b0658ca5cfa80b8023d48/fx11.sml https://s3.amazonaws.com/prod-ucs-content-store-us-east/content/pii:S0926860X17302685/fx11/THUMBNAIL/image/gif/c8fe49ca785b0658ca5cfa80b8023d48/fx11.sml fx11 fx11.sml sml 5072 178 92 IMAGE-THUMBNAIL 1-s2.0-S0926860X17302685-fx12.sml https://s3-eu-west-1.amazonaws.com/prod-ucs-content-store-eu-west/content/pii:S0926860X17302685/fx12/THUMBNAIL/image/gif/56785ffb93ddf6307c21bd41d723627e/fx12.sml https://s3.amazonaws.com/prod-ucs-content-store-us-east/content/pii:S0926860X17302685/fx12/THUMBNAIL/image/gif/56785ffb93ddf6307c21bd41d723627e/fx12.sml fx12 fx12.sml sml 5433 177 72 IMAGE-THUMBNAIL 1-s2.0-S0926860X17302685-fx13.sml https://s3-eu-west-1.amazonaws.com/prod-ucs-content-store-eu-west/content/pii:S0926860X17302685/fx13/THUMBNAIL/image/gif/58c21ccee61b8f067965ab49e6c58bc9/fx13.sml https://s3.amazonaws.com/prod-ucs-content-store-us-east/content/pii:S0926860X17302685/fx13/THUMBNAIL/image/gif/58c21ccee61b8f067965ab49e6c58bc9/fx13.sml fx13 fx13.sml sml 4732 170 128 IMAGE-THUMBNAIL 1-s2.0-S0926860X17302685-fx14.sml https://s3-eu-west-1.amazonaws.com/prod-ucs-content-store-eu-west/content/pii:S0926860X17302685/fx14/THUMBNAIL/image/gif/34feae0440b894a222cbdc2aaf2f63f5/fx14.sml https://s3.amazonaws.com/prod-ucs-content-store-us-east/content/pii:S0926860X17302685/fx14/THUMBNAIL/image/gif/34feae0440b894a222cbdc2aaf2f63f5/fx14.sml fx14 fx14.sml sml 4548 160 123 IMAGE-THUMBNAIL 1-s2.0-S0926860X17302685-fx2.sml https://s3-eu-west-1.amazonaws.com/prod-ucs-content-store-eu-west/content/pii:S0926860X17302685/fx2/THUMBNAIL/image/gif/9cc62e578289ddc3aa254d1d748f33e1/fx2.sml https://s3.amazonaws.com/prod-ucs-content-store-us-east/content/pii:S0926860X17302685/fx2/THUMBNAIL/image/gif/9cc62e578289ddc3aa254d1d748f33e1/fx2.sml fx2 fx2.sml sml 1216 42 42 IMAGE-THUMBNAIL 1-s2.0-S0926860X17302685-fx3.sml https://s3-eu-west-1.amazonaws.com/prod-ucs-content-store-eu-west/content/pii:S0926860X17302685/fx3/THUMBNAIL/image/gif/57037c55a944f3c1ebcdcfeffee329f4/fx3.sml https://s3.amazonaws.com/prod-ucs-content-store-us-east/content/pii:S0926860X17302685/fx3/THUMBNAIL/image/gif/57037c55a944f3c1ebcdcfeffee329f4/fx3.sml fx3 fx3.sml sml 1955 48 47 IMAGE-THUMBNAIL 1-s2.0-S0926860X17302685-fx4.sml https://s3-eu-west-1.amazonaws.com/prod-ucs-content-store-eu-west/content/pii:S0926860X17302685/fx4/THUMBNAIL/image/gif/eed4af1858610874dcb658a3de6c9309/fx4.sml https://s3.amazonaws.com/prod-ucs-content-store-us-east/content/pii:S0926860X17302685/fx4/THUMBNAIL/image/gif/eed4af1858610874dcb658a3de6c9309/fx4.sml fx4 fx4.sml sml 1405 42 42 IMAGE-THUMBNAIL 1-s2.0-S0926860X17302685-fx5.sml https://s3-eu-west-1.amazonaws.com/prod-ucs-content-store-eu-west/content/pii:S0926860X17302685/fx5/THUMBNAIL/image/gif/c3a806a3e8eef596039a3bb502a7880f/fx5.sml https://s3.amazonaws.com/prod-ucs-content-store-us-east/content/pii:S0926860X17302685/fx5/THUMBNAIL/image/gif/c3a806a3e8eef596039a3bb502a7880f/fx5.sml fx5 fx5.sml sml 1561 42 40 IMAGE-THUMBNAIL 1-s2.0-S0926860X17302685-fx6.sml https://s3-eu-west-1.amazonaws.com/prod-ucs-content-store-eu-west/content/pii:S0926860X17302685/fx6/THUMBNAIL/image/gif/f4bb5c90305b044de66bbffab54c845b/fx6.sml https://s3.amazonaws.com/prod-ucs-content-store-us-east/content/pii:S0926860X17302685/fx6/THUMBNAIL/image/gif/f4bb5c90305b044de66bbffab54c845b/fx6.sml fx6 fx6.sml sml 1203 45 47 IMAGE-THUMBNAIL 1-s2.0-S0926860X17302685-fx7.sml https://s3-eu-west-1.amazonaws.com/prod-ucs-content-store-eu-west/content/pii:S0926860X17302685/fx7/THUMBNAIL/image/gif/313d62cdddc117d5914b89dfaa01ab8e/fx7.sml https://s3.amazonaws.com/prod-ucs-content-store-us-east/content/pii:S0926860X17302685/fx7/THUMBNAIL/image/gif/313d62cdddc117d5914b89dfaa01ab8e/fx7.sml fx7 fx7.sml sml 4792 140 138 IMAGE-THUMBNAIL 1-s2.0-S0926860X17302685-fx8.sml https://s3-eu-west-1.amazonaws.com/prod-ucs-content-store-eu-west/content/pii:S0926860X17302685/fx8/THUMBNAIL/image/gif/e907c8a26c3685c14f2019c7bbbef732/fx8.sml https://s3.amazonaws.com/prod-ucs-content-store-us-east/content/pii:S0926860X17302685/fx8/THUMBNAIL/image/gif/e907c8a26c3685c14f2019c7bbbef732/fx8.sml fx8 fx8.sml sml 5325 185 128 IMAGE-THUMBNAIL 1-s2.0-S0926860X17302685-fx9.sml https://s3-eu-west-1.amazonaws.com/prod-ucs-content-store-eu-west/content/pii:S0926860X17302685/fx9/THUMBNAIL/image/gif/58a268ee81f96c945ad95702ba1e340a/fx9.sml https://s3.amazonaws.com/prod-ucs-content-store-us-east/content/pii:S0926860X17302685/fx9/THUMBNAIL/image/gif/58a268ee81f96c945ad95702ba1e340a/fx9.sml fx9 fx9.sml sml 5208 190 82 IMAGE-THUMBNAIL 1-s2.0-S0926860X17302685-gr1.sml https://s3-eu-west-1.amazonaws.com/prod-ucs-content-store-eu-west/content/pii:S0926860X17302685/gr1/THUMBNAIL/image/gif/7e56d85ca46ef922a5eecec0ee23a86b/gr1.sml https://s3.amazonaws.com/prod-ucs-content-store-us-east/content/pii:S0926860X17302685/gr1/THUMBNAIL/image/gif/7e56d85ca46ef922a5eecec0ee23a86b/gr1.sml gr1 gr1.sml sml 6378 77 219 IMAGE-THUMBNAIL 1-s2.0-S0926860X17302685-gr2.sml https://s3-eu-west-1.amazonaws.com/prod-ucs-content-store-eu-west/content/pii:S0926860X17302685/gr2/THUMBNAIL/image/gif/77ae724cbfb19ea5b2a2f4d082eff21b/gr2.sml https://s3.amazonaws.com/prod-ucs-content-store-us-east/content/pii:S0926860X17302685/gr2/THUMBNAIL/image/gif/77ae724cbfb19ea5b2a2f4d082eff21b/gr2.sml gr2 gr2.sml sml 7625 153 219 IMAGE-THUMBNAIL 1-s2.0-S0926860X17302685-gr3.sml https://s3-eu-west-1.amazonaws.com/prod-ucs-content-store-eu-west/content/pii:S0926860X17302685/gr3/THUMBNAIL/image/gif/bde03d9f85aab6c84b641aca58ffa0fb/gr3.sml https://s3.amazonaws.com/prod-ucs-content-store-us-east/content/pii:S0926860X17302685/gr3/THUMBNAIL/image/gif/bde03d9f85aab6c84b641aca58ffa0fb/gr3.sml gr3 gr3.sml sml 5692 152 219 IMAGE-THUMBNAIL 1-s2.0-S0926860X17302685-gr4.sml https://s3-eu-west-1.amazonaws.com/prod-ucs-content-store-eu-west/content/pii:S0926860X17302685/gr4/THUMBNAIL/image/gif/82288f513ead9a36ccdbf5944bda6b6c/gr4.sml https://s3.amazonaws.com/prod-ucs-content-store-us-east/content/pii:S0926860X17302685/gr4/THUMBNAIL/image/gif/82288f513ead9a36ccdbf5944bda6b6c/gr4.sml gr4 gr4.sml sml 7964 152 219 IMAGE-THUMBNAIL 1-s2.0-S0926860X17302685-gr5.sml https://s3-eu-west-1.amazonaws.com/prod-ucs-content-store-eu-west/content/pii:S0926860X17302685/gr5/THUMBNAIL/image/gif/33d279dec0138fdc1f2d49faaf5974eb/gr5.sml https://s3.amazonaws.com/prod-ucs-content-store-us-east/content/pii:S0926860X17302685/gr5/THUMBNAIL/image/gif/33d279dec0138fdc1f2d49faaf5974eb/gr5.sml gr5 gr5.sml sml 5354 164 216 IMAGE-THUMBNAIL 1-s2.0-S0926860X17302685-gr6.sml https://s3-eu-west-1.amazonaws.com/prod-ucs-content-store-eu-west/content/pii:S0926860X17302685/gr6/THUMBNAIL/image/gif/25013e77dd4b3a925d5f1c10f1fee2d7/gr6.sml https://s3.amazonaws.com/prod-ucs-content-store-us-east/content/pii:S0926860X17302685/gr6/THUMBNAIL/image/gif/25013e77dd4b3a925d5f1c10f1fee2d7/gr6.sml gr6 gr6.sml sml 22443 164 164 IMAGE-THUMBNAIL 1-s2.0-S0926860X17302685-fx1.jpg https://s3-eu-west-1.amazonaws.com/prod-ucs-content-store-eu-west/content/pii:S0926860X17302685/fx1/DOWNSAMPLED/image/jpeg/fce05381096b5869236987954fd27180/fx1.jpg https://s3.amazonaws.com/prod-ucs-content-store-us-east/content/pii:S0926860X17302685/fx1/DOWNSAMPLED/image/jpeg/fce05381096b5869236987954fd27180/fx1.jpg fx1 true fx1.jpg jpg 21159 200 452 IMAGE-DOWNSAMPLED 1-s2.0-S0926860X17302685-fx10.jpg https://s3-eu-west-1.amazonaws.com/prod-ucs-content-store-eu-west/content/pii:S0926860X17302685/fx10/DOWNSAMPLED/image/jpeg/a94f17c45abf3585446cc9d1ac799086/fx10.jpg https://s3.amazonaws.com/prod-ucs-content-store-us-east/content/pii:S0926860X17302685/fx10/DOWNSAMPLED/image/jpeg/a94f17c45abf3585446cc9d1ac799086/fx10.jpg fx10 fx10.jpg jpg 747 34 27 IMAGE-DOWNSAMPLED 1-s2.0-S0926860X17302685-fx11.jpg https://s3-eu-west-1.amazonaws.com/prod-ucs-content-store-eu-west/content/pii:S0926860X17302685/fx11/DOWNSAMPLED/image/jpeg/b1b0fc6b63e69ba0f8d3b23fea5dfbf0/fx11.jpg https://s3.amazonaws.com/prod-ucs-content-store-us-east/content/pii:S0926860X17302685/fx11/DOWNSAMPLED/image/jpeg/b1b0fc6b63e69ba0f8d3b23fea5dfbf0/fx11.jpg fx11 fx11.jpg jpg 840 39 20 IMAGE-DOWNSAMPLED 1-s2.0-S0926860X17302685-fx12.jpg https://s3-eu-west-1.amazonaws.com/prod-ucs-content-store-eu-west/content/pii:S0926860X17302685/fx12/DOWNSAMPLED/image/jpeg/0b58cbe49894168269bb6a36e73bc306/fx12.jpg https://s3.amazonaws.com/prod-ucs-content-store-us-east/content/pii:S0926860X17302685/fx12/DOWNSAMPLED/image/jpeg/0b58cbe49894168269bb6a36e73bc306/fx12.jpg fx12 fx12.jpg jpg 650 39 16 IMAGE-DOWNSAMPLED 1-s2.0-S0926860X17302685-fx13.jpg https://s3-eu-west-1.amazonaws.com/prod-ucs-content-store-eu-west/content/pii:S0926860X17302685/fx13/DOWNSAMPLED/image/jpeg/c360c7188134080d1213c874bb903387/fx13.jpg https://s3.amazonaws.com/prod-ucs-content-store-us-east/content/pii:S0926860X17302685/fx13/DOWNSAMPLED/image/jpeg/c360c7188134080d1213c874bb903387/fx13.jpg fx13 fx13.jpg jpg 756 37 28 IMAGE-DOWNSAMPLED 1-s2.0-S0926860X17302685-fx14.jpg https://s3-eu-west-1.amazonaws.com/prod-ucs-content-store-eu-west/content/pii:S0926860X17302685/fx14/DOWNSAMPLED/image/jpeg/8ccc36ab1a6df19c2c8f4af9b7a168f4/fx14.jpg https://s3.amazonaws.com/prod-ucs-content-store-us-east/content/pii:S0926860X17302685/fx14/DOWNSAMPLED/image/jpeg/8ccc36ab1a6df19c2c8f4af9b7a168f4/fx14.jpg fx14 fx14.jpg jpg 761 35 27 IMAGE-DOWNSAMPLED 1-s2.0-S0926860X17302685-fx2.jpg https://s3-eu-west-1.amazonaws.com/prod-ucs-content-store-eu-west/content/pii:S0926860X17302685/fx2/DOWNSAMPLED/image/jpeg/c2ce911ecd2f8638d3e25f8802ed3e9d/fx2.jpg https://s3.amazonaws.com/prod-ucs-content-store-us-east/content/pii:S0926860X17302685/fx2/DOWNSAMPLED/image/jpeg/c2ce911ecd2f8638d3e25f8802ed3e9d/fx2.jpg fx2 fx2.jpg jpg 367 9 9 IMAGE-DOWNSAMPLED 1-s2.0-S0926860X17302685-fx3.jpg https://s3-eu-west-1.amazonaws.com/prod-ucs-content-store-eu-west/content/pii:S0926860X17302685/fx3/DOWNSAMPLED/image/jpeg/cd5da80f5c9f3eb37aa70f22c28c0130/fx3.jpg https://s3.amazonaws.com/prod-ucs-content-store-us-east/content/pii:S0926860X17302685/fx3/DOWNSAMPLED/image/jpeg/cd5da80f5c9f3eb37aa70f22c28c0130/fx3.jpg fx3 fx3.jpg jpg 444 10 10 IMAGE-DOWNSAMPLED 1-s2.0-S0926860X17302685-fx4.jpg https://s3-eu-west-1.amazonaws.com/prod-ucs-content-store-eu-west/content/pii:S0926860X17302685/fx4/DOWNSAMPLED/image/jpeg/d3a832ed7aa4db32e3126bbb7704eb4d/fx4.jpg https://s3.amazonaws.com/prod-ucs-content-store-us-east/content/pii:S0926860X17302685/fx4/DOWNSAMPLED/image/jpeg/d3a832ed7aa4db32e3126bbb7704eb4d/fx4.jpg fx4 fx4.jpg jpg 368 9 9 IMAGE-DOWNSAMPLED 1-s2.0-S0926860X17302685-fx5.jpg https://s3-eu-west-1.amazonaws.com/prod-ucs-content-store-eu-west/content/pii:S0926860X17302685/fx5/DOWNSAMPLED/image/jpeg/6604c0fc2de4aad8f7843d021c48b6c1/fx5.jpg https://s3.amazonaws.com/prod-ucs-content-store-us-east/content/pii:S0926860X17302685/fx5/DOWNSAMPLED/image/jpeg/6604c0fc2de4aad8f7843d021c48b6c1/fx5.jpg fx5 fx5.jpg jpg 417 9 9 IMAGE-DOWNSAMPLED 1-s2.0-S0926860X17302685-fx6.jpg https://s3-eu-west-1.amazonaws.com/prod-ucs-content-store-eu-west/content/pii:S0926860X17302685/fx6/DOWNSAMPLED/image/jpeg/a350634d4a1cfea39247a4e365c692a5/fx6.jpg https://s3.amazonaws.com/prod-ucs-content-store-us-east/content/pii:S0926860X17302685/fx6/DOWNSAMPLED/image/jpeg/a350634d4a1cfea39247a4e365c692a5/fx6.jpg fx6 fx6.jpg jpg 471 10 10 IMAGE-DOWNSAMPLED 1-s2.0-S0926860X17302685-fx7.jpg https://s3-eu-west-1.amazonaws.com/prod-ucs-content-store-eu-west/content/pii:S0926860X17302685/fx7/DOWNSAMPLED/image/jpeg/23b68ef0b64e04749dfe26362f88e927/fx7.jpg https://s3.amazonaws.com/prod-ucs-content-store-us-east/content/pii:S0926860X17302685/fx7/DOWNSAMPLED/image/jpeg/23b68ef0b64e04749dfe26362f88e927/fx7.jpg fx7 fx7.jpg jpg 795 31 31 IMAGE-DOWNSAMPLED 1-s2.0-S0926860X17302685-fx8.jpg https://s3-eu-west-1.amazonaws.com/prod-ucs-content-store-eu-west/content/pii:S0926860X17302685/fx8/DOWNSAMPLED/image/jpeg/06ad567b1ce156d0ada1decdbfe8bad4/fx8.jpg https://s3.amazonaws.com/prod-ucs-content-store-us-east/content/pii:S0926860X17302685/fx8/DOWNSAMPLED/image/jpeg/06ad567b1ce156d0ada1decdbfe8bad4/fx8.jpg fx8 fx8.jpg jpg 772 40 28 IMAGE-DOWNSAMPLED 1-s2.0-S0926860X17302685-fx9.jpg https://s3-eu-west-1.amazonaws.com/prod-ucs-content-store-eu-west/content/pii:S0926860X17302685/fx9/DOWNSAMPLED/image/jpeg/522031641d7fe03d3cb071052ae2a223/fx9.jpg https://s3.amazonaws.com/prod-ucs-content-store-us-east/content/pii:S0926860X17302685/fx9/DOWNSAMPLED/image/jpeg/522031641d7fe03d3cb071052ae2a223/fx9.jpg fx9 fx9.jpg jpg 771 42 18 IMAGE-DOWNSAMPLED 1-s2.0-S0926860X17302685-gr1.jpg https://s3-eu-west-1.amazonaws.com/prod-ucs-content-store-eu-west/content/pii:S0926860X17302685/gr1/DOWNSAMPLED/image/jpeg/90192985e59ec29fb1d6a8a8f9d7d3b4/gr1.jpg https://s3.amazonaws.com/prod-ucs-content-store-us-east/content/pii:S0926860X17302685/gr1/DOWNSAMPLED/image/jpeg/90192985e59ec29fb1d6a8a8f9d7d3b4/gr1.jpg gr1 gr1.jpg jpg 29410 172 489 IMAGE-DOWNSAMPLED 1-s2.0-S0926860X17302685-gr2.jpg https://s3-eu-west-1.amazonaws.com/prod-ucs-content-store-eu-west/content/pii:S0926860X17302685/gr2/DOWNSAMPLED/image/jpeg/f42643406af581cffdde959c74c564b0/gr2.jpg https://s3.amazonaws.com/prod-ucs-content-store-us-east/content/pii:S0926860X17302685/gr2/DOWNSAMPLED/image/jpeg/f42643406af581cffdde959c74c564b0/gr2.jpg gr2 gr2.jpg jpg 20573 237 339 IMAGE-DOWNSAMPLED 1-s2.0-S0926860X17302685-gr3.jpg https://s3-eu-west-1.amazonaws.com/prod-ucs-content-store-eu-west/content/pii:S0926860X17302685/gr3/DOWNSAMPLED/image/jpeg/ace30782c8d34fff2d1d42c2bab92b79/gr3.jpg https://s3.amazonaws.com/prod-ucs-content-store-us-east/content/pii:S0926860X17302685/gr3/DOWNSAMPLED/image/jpeg/ace30782c8d34fff2d1d42c2bab92b79/gr3.jpg gr3 gr3.jpg jpg 15839 235 339 IMAGE-DOWNSAMPLED 1-s2.0-S0926860X17302685-gr4.jpg https://s3-eu-west-1.amazonaws.com/prod-ucs-content-store-eu-west/content/pii:S0926860X17302685/gr4/DOWNSAMPLED/image/jpeg/db9e9b4f6f1df1ac49180975b90fd9ee/gr4.jpg https://s3.amazonaws.com/prod-ucs-content-store-us-east/content/pii:S0926860X17302685/gr4/DOWNSAMPLED/image/jpeg/db9e9b4f6f1df1ac49180975b90fd9ee/gr4.jpg gr4 gr4.jpg jpg 67576 495 715 IMAGE-DOWNSAMPLED 1-s2.0-S0926860X17302685-gr5.jpg https://s3-eu-west-1.amazonaws.com/prod-ucs-content-store-eu-west/content/pii:S0926860X17302685/gr5/DOWNSAMPLED/image/jpeg/b33663fc5264fa1f3571fb6c753fc546/gr5.jpg https://s3.amazonaws.com/prod-ucs-content-store-us-east/content/pii:S0926860X17302685/gr5/DOWNSAMPLED/image/jpeg/b33663fc5264fa1f3571fb6c753fc546/gr5.jpg gr5 gr5.jpg jpg 48765 543 715 IMAGE-DOWNSAMPLED 1-s2.0-S0926860X17302685-gr6.jpg https://s3-eu-west-1.amazonaws.com/prod-ucs-content-store-eu-west/content/pii:S0926860X17302685/gr6/DOWNSAMPLED/image/jpeg/44152804db4583626aa5fdbcf573f0f0/gr6.jpg https://s3.amazonaws.com/prod-ucs-content-store-us-east/content/pii:S0926860X17302685/gr6/DOWNSAMPLED/image/jpeg/44152804db4583626aa5fdbcf573f0f0/gr6.jpg gr6 gr6.jpg jpg 49333 338 339 IMAGE-DOWNSAMPLED 1-s2.0-S0926860X17302685-fx1_lrg.jpg https://s3-eu-west-1.amazonaws.com/prod-ucs-content-store-eu-west/content/pii:S0926860X17302685/fx1/HIGHRES/image/jpeg/3775f102af95f2c4f7158c972c16be02/fx1_lrg.jpg https://s3.amazonaws.com/prod-ucs-content-store-us-east/content/pii:S0926860X17302685/fx1/HIGHRES/image/jpeg/3775f102af95f2c4f7158c972c16be02/fx1_lrg.jpg fx1 true fx1_lrg.jpg jpg 157623 886 2000 IMAGE-HIGH-RES 1-s2.0-S0926860X17302685-fx10_lrg.jpg https://s3-eu-west-1.amazonaws.com/prod-ucs-content-store-eu-west/content/pii:S0926860X17302685/fx10/HIGHRES/image/jpeg/8f0c9aa26be4b627e63528ec1a2406a0/fx10_lrg.jpg https://s3.amazonaws.com/prod-ucs-content-store-us-east/content/pii:S0926860X17302685/fx10/HIGHRES/image/jpeg/8f0c9aa26be4b627e63528ec1a2406a0/fx10_lrg.jpg fx10 fx10_lrg.jpg jpg 3126 152 122 IMAGE-HIGH-RES 1-s2.0-S0926860X17302685-fx11_lrg.jpg https://s3-eu-west-1.amazonaws.com/prod-ucs-content-store-eu-west/content/pii:S0926860X17302685/fx11/HIGHRES/image/jpeg/60b3b079aa1fc3b387847c8601a25282/fx11_lrg.jpg https://s3.amazonaws.com/prod-ucs-content-store-us-east/content/pii:S0926860X17302685/fx11/HIGHRES/image/jpeg/60b3b079aa1fc3b387847c8601a25282/fx11_lrg.jpg fx11 fx11_lrg.jpg jpg 4174 178 92 IMAGE-HIGH-RES 1-s2.0-S0926860X17302685-fx12_lrg.jpg https://s3-eu-west-1.amazonaws.com/prod-ucs-content-store-eu-west/content/pii:S0926860X17302685/fx12/HIGHRES/image/jpeg/0451ddbc89a3ed36fb2cae400f5afb0a/fx12_lrg.jpg https://s3.amazonaws.com/prod-ucs-content-store-us-east/content/pii:S0926860X17302685/fx12/HIGHRES/image/jpeg/0451ddbc89a3ed36fb2cae400f5afb0a/fx12_lrg.jpg fx12 fx12_lrg.jpg jpg 3290 177 72 IMAGE-HIGH-RES 1-s2.0-S0926860X17302685-fx13_lrg.jpg https://s3-eu-west-1.amazonaws.com/prod-ucs-content-store-eu-west/content/pii:S0926860X17302685/fx13/HIGHRES/image/jpeg/67969279436b00325ad8b84a78b42e3e/fx13_lrg.jpg https://s3.amazonaws.com/prod-ucs-content-store-us-east/content/pii:S0926860X17302685/fx13/HIGHRES/image/jpeg/67969279436b00325ad8b84a78b42e3e/fx13_lrg.jpg fx13 fx13_lrg.jpg jpg 3369 170 128 IMAGE-HIGH-RES 1-s2.0-S0926860X17302685-fx14_lrg.jpg https://s3-eu-west-1.amazonaws.com/prod-ucs-content-store-eu-west/content/pii:S0926860X17302685/fx14/HIGHRES/image/jpeg/e99357ba626955a369e219a232fa829c/fx14_lrg.jpg https://s3.amazonaws.com/prod-ucs-content-store-us-east/content/pii:S0926860X17302685/fx14/HIGHRES/image/jpeg/e99357ba626955a369e219a232fa829c/fx14_lrg.jpg fx14 fx14_lrg.jpg jpg 3323 160 123 IMAGE-HIGH-RES 1-s2.0-S0926860X17302685-fx2_lrg.jpg https://s3-eu-west-1.amazonaws.com/prod-ucs-content-store-eu-west/content/pii:S0926860X17302685/fx2/HIGHRES/image/jpeg/13d0d6628fcb982bb8eb4699789a36f0/fx2_lrg.jpg https://s3.amazonaws.com/prod-ucs-content-store-us-east/content/pii:S0926860X17302685/fx2/HIGHRES/image/jpeg/13d0d6628fcb982bb8eb4699789a36f0/fx2_lrg.jpg fx2 fx2_lrg.jpg jpg 726 42 42 IMAGE-HIGH-RES 1-s2.0-S0926860X17302685-fx3_lrg.jpg https://s3-eu-west-1.amazonaws.com/prod-ucs-content-store-eu-west/content/pii:S0926860X17302685/fx3/HIGHRES/image/jpeg/d532a000d875ed84aa37bbd90d1ef0df/fx3_lrg.jpg https://s3.amazonaws.com/prod-ucs-content-store-us-east/content/pii:S0926860X17302685/fx3/HIGHRES/image/jpeg/d532a000d875ed84aa37bbd90d1ef0df/fx3_lrg.jpg fx3 fx3_lrg.jpg jpg 1391 48 47 IMAGE-HIGH-RES 1-s2.0-S0926860X17302685-fx4_lrg.jpg https://s3-eu-west-1.amazonaws.com/prod-ucs-content-store-eu-west/content/pii:S0926860X17302685/fx4/HIGHRES/image/jpeg/0e3344249706925dec7ad5a5b44a994b/fx4_lrg.jpg https://s3.amazonaws.com/prod-ucs-content-store-us-east/content/pii:S0926860X17302685/fx4/HIGHRES/image/jpeg/0e3344249706925dec7ad5a5b44a994b/fx4_lrg.jpg fx4 fx4_lrg.jpg jpg 717 42 42 IMAGE-HIGH-RES 1-s2.0-S0926860X17302685-fx5_lrg.jpg https://s3-eu-west-1.amazonaws.com/prod-ucs-content-store-eu-west/content/pii:S0926860X17302685/fx5/HIGHRES/image/jpeg/ac97a911b55c60b947b1c1392b559413/fx5_lrg.jpg https://s3.amazonaws.com/prod-ucs-content-store-us-east/content/pii:S0926860X17302685/fx5/HIGHRES/image/jpeg/ac97a911b55c60b947b1c1392b559413/fx5_lrg.jpg fx5 fx5_lrg.jpg jpg 1169 42 40 IMAGE-HIGH-RES 1-s2.0-S0926860X17302685-fx6_lrg.jpg https://s3-eu-west-1.amazonaws.com/prod-ucs-content-store-eu-west/content/pii:S0926860X17302685/fx6/HIGHRES/image/jpeg/3117922da5f3f26964a33acffc5429b0/fx6_lrg.jpg https://s3.amazonaws.com/prod-ucs-content-store-us-east/content/pii:S0926860X17302685/fx6/HIGHRES/image/jpeg/3117922da5f3f26964a33acffc5429b0/fx6_lrg.jpg fx6 fx6_lrg.jpg jpg 1386 45 47 IMAGE-HIGH-RES 1-s2.0-S0926860X17302685-fx7_lrg.jpg https://s3-eu-west-1.amazonaws.com/prod-ucs-content-store-eu-west/content/pii:S0926860X17302685/fx7/HIGHRES/image/jpeg/bfd2f40ff747a99e8725114e0cb6bcc2/fx7_lrg.jpg https://s3.amazonaws.com/prod-ucs-content-store-us-east/content/pii:S0926860X17302685/fx7/HIGHRES/image/jpeg/bfd2f40ff747a99e8725114e0cb6bcc2/fx7_lrg.jpg fx7 fx7_lrg.jpg jpg 3640 140 138 IMAGE-HIGH-RES 1-s2.0-S0926860X17302685-fx8_lrg.jpg https://s3-eu-west-1.amazonaws.com/prod-ucs-content-store-eu-west/content/pii:S0926860X17302685/fx8/HIGHRES/image/jpeg/a4236e802ad30fedbd399a1f6ba35e17/fx8_lrg.jpg https://s3.amazonaws.com/prod-ucs-content-store-us-east/content/pii:S0926860X17302685/fx8/HIGHRES/image/jpeg/a4236e802ad30fedbd399a1f6ba35e17/fx8_lrg.jpg fx8 fx8_lrg.jpg jpg 4046 185 128 IMAGE-HIGH-RES 1-s2.0-S0926860X17302685-fx9_lrg.jpg https://s3-eu-west-1.amazonaws.com/prod-ucs-content-store-eu-west/content/pii:S0926860X17302685/fx9/HIGHRES/image/jpeg/1195973a94739e65196205e1364324be/fx9_lrg.jpg https://s3.amazonaws.com/prod-ucs-content-store-us-east/content/pii:S0926860X17302685/fx9/HIGHRES/image/jpeg/1195973a94739e65196205e1364324be/fx9_lrg.jpg fx9 fx9_lrg.jpg jpg 4148 190 82 IMAGE-HIGH-RES 1-s2.0-S0926860X17302685-gr1_lrg.jpg https://s3-eu-west-1.amazonaws.com/prod-ucs-content-store-eu-west/content/pii:S0926860X17302685/gr1/HIGHRES/image/jpeg/4f2b82cfe0005a01e4d1898d1070d4b7/gr1_lrg.jpg https://s3.amazonaws.com/prod-ucs-content-store-us-east/content/pii:S0926860X17302685/gr1/HIGHRES/image/jpeg/4f2b82cfe0005a01e4d1898d1070d4b7/gr1_lrg.jpg gr1 gr1_lrg.jpg jpg 254938 763 2167 IMAGE-HIGH-RES 1-s2.0-S0926860X17302685-gr2_lrg.jpg https://s3-eu-west-1.amazonaws.com/prod-ucs-content-store-eu-west/content/pii:S0926860X17302685/gr2/HIGHRES/image/jpeg/05f4b099cd3b0585a4a493694f787ab5/gr2_lrg.jpg https://s3.amazonaws.com/prod-ucs-content-store-us-east/content/pii:S0926860X17302685/gr2/HIGHRES/image/jpeg/05f4b099cd3b0585a4a493694f787ab5/gr2_lrg.jpg gr2 gr2_lrg.jpg jpg 160155 1047 1500 IMAGE-HIGH-RES 1-s2.0-S0926860X17302685-gr3_lrg.jpg https://s3-eu-west-1.amazonaws.com/prod-ucs-content-store-eu-west/content/pii:S0926860X17302685/gr3/HIGHRES/image/jpeg/f2563f1bba680dd43f7f53194b657c90/gr3_lrg.jpg https://s3.amazonaws.com/prod-ucs-content-store-us-east/content/pii:S0926860X17302685/gr3/HIGHRES/image/jpeg/f2563f1bba680dd43f7f53194b657c90/gr3_lrg.jpg gr3 gr3_lrg.jpg jpg 117638 1038 1500 IMAGE-HIGH-RES 1-s2.0-S0926860X17302685-gr4_lrg.jpg https://s3-eu-west-1.amazonaws.com/prod-ucs-content-store-eu-west/content/pii:S0926860X17302685/gr4/HIGHRES/image/jpeg/87ee3cca8eaf404249393b1aac9d2990/gr4_lrg.jpg https://s3.amazonaws.com/prod-ucs-content-store-us-east/content/pii:S0926860X17302685/gr4/HIGHRES/image/jpeg/87ee3cca8eaf404249393b1aac9d2990/gr4_lrg.jpg gr4 gr4_lrg.jpg jpg 539580 2193 3167 IMAGE-HIGH-RES 1-s2.0-S0926860X17302685-gr5_lrg.jpg https://s3-eu-west-1.amazonaws.com/prod-ucs-content-store-eu-west/content/pii:S0926860X17302685/gr5/HIGHRES/image/jpeg/9625a5f5026f389b281afb5b6519ec75/gr5_lrg.jpg https://s3.amazonaws.com/prod-ucs-content-store-us-east/content/pii:S0926860X17302685/gr5/HIGHRES/image/jpeg/9625a5f5026f389b281afb5b6519ec75/gr5_lrg.jpg gr5 gr5_lrg.jpg jpg 471892 2404 3167 IMAGE-HIGH-RES 1-s2.0-S0926860X17302685-gr6_lrg.jpg https://s3-eu-west-1.amazonaws.com/prod-ucs-content-store-eu-west/content/pii:S0926860X17302685/gr6/HIGHRES/image/jpeg/885d9d30d915829670ce7d93333cfa99/gr6_lrg.jpg https://s3.amazonaws.com/prod-ucs-content-store-us-east/content/pii:S0926860X17302685/gr6/HIGHRES/image/jpeg/885d9d30d915829670ce7d93333cfa99/gr6_lrg.jpg gr6 gr6_lrg.jpg jpg 477145 1497 1500 IMAGE-HIGH-RES APCATA 16281 S0926-860X(17)30268-5 10.1016/j.apcata.2017.06.019 Elsevier B.V. Fig. 1 Thermal analysis DTA (dashed lines) and TGA (continuous lines) plots for (a) Pt/Al2O3, (b) Fe/Al2O3, (c) Pt-Fe/Al2O3, (d) Pd/Al2O3, (e) Fe/Al2O3 and (f) Pd-Fe/Al2O3, in extra dry air (initial mass: 30mg; heating rate: 5°C/min; flow rate: 100mL/min). Fig. 1 Fig. 2 TPR-H2 profiles of (a) γ- Al2O3, (b) Fe/Al2O3, (c) Pt/Al2O3, (d) Pt-Fe/Al2O3, (e) Pd/Al2O3 and (f) Pd-Fe/Al2O3 samples. Fig. 2 Fig. 3 Catalytic conversion of 2MF in presence of pre-reduced catalysts: (a) Pt/Al2O3, (b) Fe/Al2O3, (c) Pt-Fe/Al2O3, (d) Pd/Al2O3 and (e) Pd-Fe/Al2O3. Fig. 3 Fig. 4 Selectivity of 2MF reaction with pre-reduced catalysts: (a) Pt/Al2O3, (b) Pt-Fe/Al2O3, (c) Pd/Al2O3 and (d) Pd-Fe/Al2O3. Where the next products are identified: (−) 2-methyltetrahydrofuran (MTHF), ( pentene, ( ) pentanal, ( ) 2-pentanone, ( ) 1-pentanol, ( ) 2-pentanol and (▲) 1-butanol. Fig. 4 Fig. 5 Proposed mechanism for hydrodeoxygenation of 2-MF to form butanol and 1-pentene as final products. Fig. 5 Fig. 6 HRTEM image over a group of nanoparticles in the catalyst Pd-Fe/Al2O3. Fig. 6 Table 1 Catalytic activity and reaction yield for hydrogenation of 2-Methylfuran at 100, 150 and 200°C. Using Pt, Pd, Pt-Fe and Pd-Fe as catalysts, with 0.5% of metal content. The most relevant data are in bold Table 1 Catalysts T. R. (°C) Conversion (%) Yield (%) MTHF 2POL 1POL 2PNA PNAL PTNO 1BOL 2BNA NI Pt/Al2O3 100 0.71 0.0 0.58 0.0 0.12 0.0 0.0 0.0 0.10 0.0 Pt/Al2O3 150 0.73 0.0 0.41 0.0 0.27 0.0 0.0 0.0 0.0 0.0 Pt/Al2O3 200 18.65 0.0 0.12 0.0 1.18 0.0 16.65 00 0.0 0.69 Pt-Fe/Al2O3 100 0.0 0.0 0.0 0.0 0.00 0.0 0.0 0.0 0.00 0.0 Pt-Fe/Al2O3 150 0.58 0.0 0.01 0.0 0.11 0.0 0.46 0.0 0.0 0.0 Pt-Fe/Al2O3 200 8.64 0.0 0.0 0.0 0.47 0.0 8.17 0.0 0.0 0.0 Pd/Al2O3 100 23.39 23.03 0.0 0.0 0.18 0.0 0.0 0.0 0.18 0.0 Pd/Al2O3 150 26.88 24.29 0.04 0.23 0.0 1.55 0.09 0.28 0.38 0.0 Pd/Al2O3 200 5.07 0.17 0.0 1.15 0.26 0.36 0.84 0.26 0.12 1.00 Pd-Fe/Al2O3 100 7.71 7.65 0.0 0.0 0.03 0.0 0.0 0.0 0.02 0.0 Pd-Fe/Al2O3 150 21.65 15.64 1.20 1.35 0.0 1.85 0.38 0.08 0.15 0.89 Pd-Fe/Al2O3 200 31.15 0.33 0.38 8.63 0.30 3.39 11.39 3.51 0.23 2.84 MTHF: 2-Methyltetrahydrofuran, 2POL:2-Pentanol, 1POL: 1-Pentanol, 2PNA: 2-Pentanone, PNAL: Pentanal, PTNO: 1-Pentene, 1BOL: 1-Butanol, 2BNA:2-Butanone, NI: Not Identified. *Wcat: 150mg. Feature article Bimetallic Pd-Fe supported on γ-Al2O3 catalyst used in the ring opening of 2-methylfuran to selective formation of alcohols Gloria Lourdes Dimas-Rivera a Javier Rivera De la Rosa a b ⁎ Carlos J. Lucio-Ortiz a Daniela Xulú Martínez-Vargas c Ladislao Sandoval-Rangel a Domingo Ixtcoatl García Gutiérrez b Carolina Solis Maldonado d a Universidad Autónoma de Nuevo León, UANL, Facultad de Ciencias Químicas, Ave. Universidad S/N, Cd. Universitaria, San Nicolás de los Garza, Nuevo León C.P. 64455, Mexico Universidad Autónoma de Nuevo León UANL Facultad de Ciencias Químicas Ave. Universidad S/N Cd. Universitaria San Nicolás de los Garza Nuevo León C.P. 64455 Mexico b Universidad Autónoma de Nuevo León, UANL, Centro de Innovación, Investigación y Desarrollo en Ingeniería y Tecnología (CIIDIT), Km 10 de la Nueva Carretera al Aeropuerto Internacional de Monterrey, PIIT Monterrey, 66600 Apodaca, Nuevo León, Mexico Universidad Autónoma de Nuevo León UANL Centro de Innovación Investigación y Desarrollo en Ingeniería y Tecnología (CIIDIT) Km 10 de la Nueva Carretera al Aeropuerto Internacional de Monterrey PIIT Monterrey Apodaca Nuevo León 66600 Mexico c Tecnológico de Monterrey, Av. Eugenio Garza Sada 2501 Sur, Col. Tecnológico, C.P. 64849 Monterrey, Nuevo León, Mexico Tecnológico de Monterrey Av. Eugenio Garza Sada 2501 Sur Col. Tecnológico Monterrey Nuevo León C.P. 64849 Mexico d Universidad Veracruzana, Facultad de Ciencias Químicas, Prolongación Venustiano Carranza S/N, Poza Rica, Veracruz CP 93390, Mexico Universidad Veracruzana Facultad de Ciencias Químicas Prolongación Venustiano Carranza S/N Poza Rica Veracruz CP 93390 Mexico ⁎ Corresponding author at: Universidad Autónoma de Nuevo León, UANL, Facultad de Ciencias Químicas, Ave. Universidad S/N, Cd. Universitaria, San Nicolás de los Garza, Nuevo León C.P. 64455, Mexico. Universidad Autónoma de Nuevo León UANL Facultad de Ciencias Químicas Ave. Universidad S/N Cd. Universitaria San Nicolás de los Garza Nuevo León C.P. 64455 Mexico Graphical abstract This work presents the hydrogenation of 2-methylfuran (2-MF) in gaseous fluid phase into a catalytic reactor in order to obtain products with good properties to be used as biofuel. Bimetallic nanoparticles were obtained by impregnation on Al2O3 from the classic catalytic metals used in hydrogenation reactions such as platinum and palladium, combined with iron, to observe the catalytic activity and the selectivity to form interest biofuel compounds. Pt, Pd, Pt-Fe and Pd-Fe catalysts (with 0.5% wt. metal content) supported on alumina were reduced at 450°C and tested. At 200°C, Pt/Al2O3 and Pt-Fe/Al2O3 catalysts presented less than 19% conversion and the main formed product was pentene (90% selectivity). The Pd/Al2O3 catalyst conversion of 2-MF was of 5% at 200°C, obtaining 1-pentanol and 1-butanol as products, together with a 28% of selectivity. The Pd-Fe/Al2O3 catalyst presented the highest conversion of 2-MF at 200°C of 31%, the production of alcohols such as 1-pentanol, 2-pentanol and 1-butanol summed a selectivity of 39%. Since the Pd-Fe/Al2O3 catalyst presented the best performance, it was analyzed under high-resolution transmission electron microscopy technique. The HRTEM image revealed the presence of 5nm size nanoparticles over the alumina, and Pd and Fe oxide nanoparticles were identified measuring the interplanar distances of exposed planes. A FePd3 nanoparticle alloy was also identified, which was the difference in having a greater hydrogenation efficiency for the 2-MF molecule. Keywords Bimetallic Pd-Fe catalyst Alcohols production 2-Methylfuran Ring opening 1 Introduction Society relies heavily on energy sources in their daily lives, especially for the transportation of goods, services, and people. For several decades, energy has come from fuels derived from petroleum, but as a non-renewable resource, there is a need to find alternatives. It well known that ethanol is widely used as an alternative to gasoline [1]. However, ethanol has a much lower energy density (only 21MJ/L versus about 32MJ/L for gasoline), a high hygroscopicity and a higher volatility than gasoline [2,3]. A different alternative are pentanol isomers, due to their low affinity for water and an energy density of about 28MJ/L, still less than that of gasoline but better than ethanol, fitting well into the current transportation infrastructure [2]. Furan and its derivatives, which can be extracted from lignocellulosic biomass, produce tetrahydrofuran (THF), methyltetrahydrofuran (MTHF), and dimethyltetrahydrofuran (DMTHF) with catalytic dehydrogenation; these compounds can be used as fuels. 2-methylfuran (2-MF) is a five-member aromatic heterocyclic molecule of the furan family, with one of the electron lone pairs of the oxygen atom delocalized over the π-system in the ring. The 2-MF can be produced by selective hydrogenation of furfural, which is in turn available on an industrial scale by the hydrolysis–dehydration of the hemicellulose part of agriculture wastes and forest residues [4,5]. Different authors have reported the catalytic hydrogenation of 2-MF with different catalysts. Clauss used Rh–Sn/SiO2 and Ag/SiO2 as catalysts for gas phase hydrogenation of furfural having as intermediate the 2-MF and reported that these catalysts suppress the formation of 1-pentanol and 1,5-pentanediol, with very low selectivity for these alcohols [6]. Aliaga et al. showed the 2-MF hydrogenation on Pt nanoparticles and presented over the catalyst bind through heterocyclic π-cloud in a nearly flat configuration; this allows ring opening, leading to the formation of pentanol isomers. The reaction was carried out in a closed chamber at high pressure of hydrogen (10Torr); the selectivity to 1-pentanol was 98% at 40°C, and the selectivity to 2-pentanol was 43% at 95°C [7]. Biswas et al. reported a Cu/Cr/Ni/Zn/Fe catalyst reduced in hydrogen at 340°C into a continuous reactor and performed the hydrogenation of 2-MF obtaining a selectivity of 25% for 2-pentanol at 200°C, but decreased to 10% at 250°C [8]. Hailong et al. used a CuO-Mg3AlOx (30% wt. Cu) catalyst for the hydrogenolysis of furfuryl alcohol, having 2-MF as intermediate. They reported a 18% of selectivity to 1-pentanol in a closed chamber reactor, at high pressure of 6MPa of hydrogen [9]. In this work, the 2-MF molecule will be used as feed of the catalytic reactor. Pd has been used as a promising catalyst metal due to its relative stability in air environment and easy recycle. Palladium also readily adsorbs the furan ring due to a strong interaction between the metal and the π bonds in the molecule [8,10–12]. In other hand, bimetallic catalysts often exhibit superior catalytic performance compared to their individual metals and have been widely used in many catalytic processes. It has been shown that the surface structure of the bimetallic catalyst is critical for their catalytic properties [13]. The effect of the addition of a second metal can be classified into three main categories: (i) increasing the catalytic activity, (ii) modifying the selectivity and (iii) improving catalyst stability [14]. Metals are generally deposited as oxides, or as a mixture of metals, which in turn promote hydrogenation. In the hydrogenation of furfural, Sitthisa et al. proved that addition of Fe to Ni as catalysts, supresses decarboxylation and promotes hydrogenation of the carbonyl group (at low temperatures) and hydrogenolysis of CO (at high temperature); an important finding was the stability of η2-(C, O), which can be easily hydrogenated [12]. Chen et al. reported the formation of an atomic alloy of Pd and Co as bimetallic catalyst by identification of interplanar distances measured in high-resolution transmission electron microscopy (HRTEM) images, that slightly exceeded the corresponding values of planes of pure Pd [15]. Other works report different synthesized bimetallic catalysts that are analyzed by elemental analysis to obtain the molar relation of a possible alloy [16–19]. Chen et al. synthesized Pt-Fe alloy nanoparticles to be used as catalyst; the alloy phase was confirmed by annular dark field-scanning transmission electron microscopy (ADF-STEM) images and the diffractogram. The peak positions for the disordered alloy phase was according to Powder Diffraction File (PDF) No. 030659122.H [20]. Wang et al. studied Pt3Co alloy supported on carbon as catalyst by ADF-STEM image and an electron spot diffractogram and comparing with the PDF No. 04-004-5243 [21]. In this work, the interplanar distance analysis of HRTEM images is presented, in comparison to the Patron Diffraction Files (PDF), in order to identify the presence of a real alloy compound as catalytic site. If a synthesized bimetallic catalyst presents competitive catalytic activity, it is important to demonstrate the formation of a true bimetallic catalyst. The objective of this research was to prepare and characterize new bimetallic Pd-Fe and Pt-Fe catalysts, to be applied in the hydrogenation of 2-MF for the selective formation of pentanol species. The conversion of 2-MF was compared over monometallic and bimetallic catalysts, both supported on γ-alumina. It is interesting to show the presence of an alloy compound in a catalyst in the HRTEM images that cause a positive effect in the rise of selectivity to form alcohol products. As mentioned before, an important group of hydrogenation products are the alcohols, which can be considered as biofuels. 2 Experimental 2.1 Catalyst synthesis The monometallic Pd/Al2O3, Pt/Al2O3 and Fe/Al2O3 and the bimetallic Pd-Fe/Al2O3 Pt-Fe/Al2O3 catalysts were prepared by impregnation method with 0.5% wt of each metal as loading from aqueous solutions of the corresponding metal precursors such as Pd(NO3)2 and Fe(NO3)3 (Sigma Aldrich) to synthesize the Pd and Pd-Fe/Al2O3 catalysts, and the precursors H2PtCl6·6H2O (Sigma Aldrich, 37.5% of Pt) and FeCl2·4H2O (Sigma Aldrich, 99%) for the rest of catalysts. Commercial γ-alumina (CATALOX® SBa-200) was added and used as support, which has a specific surface area of 244.15m2/g. A solution with the support was stirred for 24h. After impregnation, the catalysts were dried at 80°C and calcined at 620°C. The monometallic catalyst with 0.5% wt. of Fe, 0.5% wt. of Pd and 0.5% wt. of Pt were labeled as Fe/Al2O3, Pd/Al2O3 and Pd/Al2O3 respectively. The bimetallic catalysts with 0.5% wt. of Pd and 0.5% wt. of Fe, and with 0.5% wt. of Pt and 0.5% wt. of Fe were labeled as Pd-Fe/Al2O3 and Pt-Fe/Al2O3, respectively. 2.2 Catalyst characterization 2.2.1 Thermal analysis To study their thermal behavior, catalyst samples prepared and dried at 80°C were studied by differential thermal analysis (DTA) and thermogravimetric analysis (TGA). Both analyses were carried out by a differential/thermogravimetric thermal analyzer TA instruments SDT 2960. Experiments were performed under the following conditions: from room temperature to 1000°C, heating rate of 5°C/min, and a flow of 100mL/min extra dry air. 2.2.2 Temperature programmed reduction (TPR) For each TPR measurement, 40mg of catalyst were placed in a quartz tube, heated at 30°C/min under a 20mL/min He flow up to 500°C, and held at that temperature for 1h. The sample was then cooled down to 25°C and exposed to a 20mL/min stream of 5% H2/Ar; it was later heated at 5°C/min up to 1000°C. Hydrogen consumption was monitored online by a TCD detector. 2.2.3 High-resolution transmission electron microscopy (TEM) The metal morphology and size over surface was observed using a FEI Titan G2 30–800 transmission electron microscope with high-resolution. 2.3 Catalytic activity measurements Reactions were carried out in a tubular flow reactor with atmospheric outlet. The pelletized and sieved catalyst (size 250–355μm) was placed at the center of a quartz tube reactor, between two layers of quartz wool, installed vertically inside an electric furnace. Before the reaction, the catalyst was pre-reduced under a flow of H2 ((60mL/min), Airgas 99.99%) for 1h at 450°C. After reduction, the catalyst was cooled down to reaction temperature. Three different reaction temperatures were used (100, 150 and 200°C) and the feed was introduced continuously via a syringe pump (Cole Palmer). All lines at the inlet and outlet of the reactor were kept heated at 100°C in order to keep all compounds in the vapor phase. The products were analyzed with an online gas chromatograph (Agilent model 6890) using a ZB-WAX capillary column and an FID detector. 150mg of catalyst was used for each run, injecting liquid flows of 0.5mL/h into a hydrogen stream. 3 Results 3.1 Thermal analysis Fig. 1 A shows the TGA and DTA for Fe/Al2O3 (prepared with the iron chloride salt) and Pt/Al2O3 (0.5% wt.) monometallic catalysts and Pt-Fe/Al2O3 (0.5% wt.) bimetallic catalyst. Four mass loss stages are observed for Fe/Al2O3, with the first step between 30 and 80°C (6% mass loss), the second from 80 to 260°C (4.5% mass loss), the third from 260 to 470°C (3.5% mass loss), and the fourth from 470 to 1000°C (2.5% mass loss). Two endothermic processes are observed at 40 and 240°C, which can be attributed to physisorbed and chemisorbed water, as well as the formation of iron oxides [22]. According to references, the possible Fe species present (iron hydroxides such as γ-FeOOH, prior to calcining) decompose between 220 and 280°C, depending on the heating rate, which is then followed by the formation of γ-Fe2O3. Between 450 and 500°C the transformation of γ-Fe2O3 to α-Fe2O3 occurs [23,24]. The Pt/Al2O3 catalyst showed three mass loss steps, the first one between 25 and 70°C (10% mass loss), the second from 70 to 610°C (7.1% mass loss), and the third from 610 to 1000°C (1.8% mass loss). In the DTA results, three endothermic signals are also observed, at 51, 160 and 600°C. Radivojević, et al., studied the decomposition temperatures of precursor salts (H6PtCl6·6H2O) used for synthesis of catalysts doped with Pt by the TGA/DTA technique and they reported the following reactions: (1) 25–280°C H2PtCl6·6H2O→PtCl4 +2HCl+6H2O (2) 350–350°C PtCl4 →PtCl2 +Cl2 (3) 350–530°C PtCl2 →Pt+Cl2 They also mention that after impregnation with this salt, the following complexes are formed on the surface of the support: [PtIVCl(6-x)(H2O)x](2−x)− (x=0,1,2), (PtIVCl6)2−, Pt(OH)xCly (x=1, 2, y=4, 5), PtOxCly, PtCl2 and PtCl4); when alumina is used, the PtOxCly species are predominant due to the acidity of this support [25]. Therefore, mass loss in the first zone of this endothermic process may be due to the loss of the physisorbed water, while for the second zone more water is lost and formation of gaseous HCl and Cl2 takes place due to decomposition of the precursor salt. In the third zone, mass loss occurs due to structural reorganization of the alumina support and formation of Pt complexes [26–28]. For the 0.5% Pt-Fe/Al2O3 bimetallic catalyst, a thermogravimetric behavior similar to that of Pt/Al2O3 is observed. Three mass loss steps are shown, with the first one from 25 to 68°C (7.5% weight loss), the second one from 68 to 589°C (8.8% mass loss), and the third one from 589 to 1000°C (2.1% mass loss). Two endothermic DTA peaks at 48 and 151°C were also identified, and are attributed to physisorbed water and decomposition of precursor salts. Unlike Fe/Al2O3, the Pt-Fe/Al2O3 catalyst does not show the endothermic peak at 240°C (characteristic of the γ-Fe2O3 formation), nor the exothermic signal at 430°C (attributed to the conversion of γ-Fe2O3 to α-Fe2O3). However, the endothermic peak at 151°C in the bimetallic catalyst is more pronounced than for Pt/Al2O3; this can be due to formation of Fe oxides occuring at a lower temperature when Pt is present. In general, all catalytic systems studied showed thermal changes up to approximately 600°C, which allowed to fix the optimum calcination temperature during the synthesis. Therefore, the species present on the surface of alumina after calcination are Fe oxides and Pt oxychlorinated complexes. Fig. 1B shows TGA and DTA results for Fe/Al2O3 (prepared with the iron nitrate salt) Pd/Al2O3 and Pd-Fe/Al2O3 catalysts. In all of them, a mass loss of around 150°C was observed, which corresponds with physisorbed water [9], with a 11% mass loss for monometallic catalysts (Fe and Pd), and an 8% mass loss for the bimetallic catalyst. This process is observed in DTA at around 80°C for the three catalysts. The monometallic iron catalyst presents an endothermic signal at 240°C, with a mass loss of 5.11%; this can be attributed to the decomposition of nitrate ions, which has been previously reported in the range of 200–330°C [3,8]. The decomposition of γ-FeOOH species at this temperature has also been reported, followed with formation of γ-Fe2O3 [23]. The bimetallic catalyst presents different behavior until approximately 250°C compared with the monometallic catalysts; the iron-palladium combination began to give evidence of formation of new chemical species (compounds) not present in monometallic samples. After 250°C, Pd/Al2O3 and Pd-Fe/Al2O3 present almost the same mass loss behavior, with a very wide peak in DTA from 250 to 750°C. The maximums (exothermic) for Pd/Al2O3 and Pd-Fe/Al2O3 are at 505 and 517°C, respectively, with another endothermic peak at 836 and 916°C, respectively. These thermal events can be related to the formation of PdO and PdO decomposition to elemental Pd respectively [29,30]. The bimetallic catalyst maintains a slightly decreasing mass loss slope from 700 to 1000°C; the Pd/Al2O3 catalyst shows a similar behavior, with only a small positive slope from 850 to 1000°C. A convenient temperature of calcination for the three type of catalysts is 620°C, mainly due to the thermal events of interaction seen in the bimetallic sample. TGA and DTA results are useful because the calcination temperatures were obtained and in this analysis it was found the first findings of the forming of bimetallic compounds to cause new catalytic sites. 3.2 Temperature programmed reduction (TPR) Fig. 2 shows the TPR profiles for alumina and all the catalysts, both monometallic and bimetallic. As observed, there was no reduction peak for γ-Al2O3. The Fe/Al2O3 catalyst presents a broad peak from 440 to 650°C with a maximum at 580°C and another more pronounced reduction peak from 860 to 990°C with a maximum at 922°C. The first signal can be attributed to the reduction reaction of Fe2O3 to Fe3O4, while the second may be explained as a reduction of Fe2O3 into FeO and Fe [31–33]; the first reduction signal is an evidence of iron oxide interaction with the support (alumina). The Pt/Al2O3 sample presents a single reduction peak at 427°C; this can be attributed to the reduction of oxy or hydroxychlorinated species (from the platinum precursor) to elemental Pt [34–37]. For the bimetallic Pt-Fe/Al2O3 catalyst, a small peak at 230°C is observed, along with a second, broader and less intense peak with a maximum at 450°C (a temperature similar to the peak observed for the Pt/Al2O3 catalyst). Small shoulders appear at 350 and 385°C. It has been previously reported that when the Fe load is less than or equal to Pt, most of the iron species are in contact with the Pt species, which allows the reduction of iron oxides to a lower required temperature than when Pt is not present [38]. The first peak and the mentioned shoulders are attributed to Pt-Fe oxide species reduction. It is important to mention that for the bimetallic catalysts, electron transfer can exist [14,39]; therefore, Pt may donate electrons to Fe, reducing it to Fe+2 while Pt is oxidized. After being reduced, the alloy is finally formed [40–42]. The TPR profile for the Pd/Al2O3 catalyst presents a small negative peak at 29°C attributed to an increase of molecular hydrogen due to decomposition of β-PdH phase, which is formed by Pd0 species trapped in the bulk of support, by H2 diffusion from the Pd crystallites, which are in turn easily reduced to elemental Pd during the TPR preparation of samples [15,18]. An intense reduction peak at 220°C corresponds with reduction of PdO particles weakly interacting with alumina and dispersed over the support; a second, less intense and broader signal at 370°C indicates reduction of PdO species strongly interacting with the alumina. Lower reduction temperatures have been previously found for palladium oxides [19], but the evidence of this work reveals small particles (maybe nanoparticles) very well dispersed and strong interaction with the support [21]. The bimetallic catalyst (Pd-Fe/Al2O3) shows the same reductions signals of the monometallic catalyst (except for the negative peak), but at lower temperatures. Two peaks are observed, an intense signal at 200°C along with a less intense, broader peak (but shorter than Pd/Al2O3) at 360°C and a barely detectable broad peak at 500°C. Pd promotes the reduction of Fe before of reduction process (calcination treatment), reducing Fe3+ to Fe2+. Fe2+ is then reduced at low temperature, in reductive conditions, by the presence of Pd. When Fe is present in a greater load, the presence of particles that are not in contact with the Pd is observed, thus reducing these particles is not promoted before the reduction process. So during reducing process Fe3+ is reduced to Fe2+at high temperatures and then to Fe° [43]. The behavior of TPR profile of bimetallic sample with lower temperatures reveals a presence of alloy of Fe and Pd. The formation of bimetallic compound can be deduced by the last results, but HRTEM characterization confirmed this finding, as discussed later in this work. 3.3 Catalytic activity tests Fig. 3 shows the conversion as a function of temperature for Fe, Pt, Pt-Fe, Pd and Pd-Fe catalysts supported on γ-Al2O3 (pre-reduced at 450°C) for the hydrogenation of 2-MF. The monometallic Fe/Al2O3 catalyst showed absence of catalytic activity at the three tested temperatures. For the monometallic Pt catalyst (Pt/Al2O3), conversions at 100 and 150°C were almost zero, but an increase to up to 18.6% conversion is observed at 200°C. As previously shown in the TPR tests, reduction events for both monometallic Fe and Pt catalysts were not complete at the pre-reduction temperature (450°C). Therefore, metallic oxide species were still present in the catalysts, which can be responsible for low activity at 200°C. However, the selectivity for alcohols at the reaction temperature of 200°C, using the catalysts previously reduced at 450°C, is very competitive when compared with other works [8]. Both the bimetallic Pt-Fe/Al2O3 and the monometallic Pt/Al2O3 catalysts presented significant conversion only at the highest temperature tested (200°C), from which the conversion achieved by the Pt/Al2O3 catalyst was the highest (18.6%). This shows that the combination with iron affected the catalytic activity of platinum. It is possible that the formation of Fe oxides at lower temperatures (even in presence of Pt), as the thermal characterizations showed, promoted the presence of elemental platinum, along with a combination of less active, temperature-persistent Pt and Fe oxides. It was also observed in Fig. 2 that the monometallic Pt catalyst showed a reduction signal maximum at a lower temperature (427°C) than the corresponding signal for the bimetallic Pt-Fe catalyst (450°C). Therefore, while for the monometallic Pt catalyst some metal oxides could be present, it is possible that more Pt could be reduced to the more active, elemental Pt0 at the pre-reduction temperature (compared with the bimetallic catalyst), explaining the increase in catalytic activity shown in Fig. 3. In order to compare the catalytic results, the next reaction rate values were obtained. For the monometallic Pt catalyst, -r'A =25.27mol/s-gcat. For the monometallic Pd catalyst, -r'A =6.87mol/s-gcat. Finally, for the bimetallic catalysts Pt-Fe and Pd-Fe, reaction rate values were -r'A =11.71mol/s-gcat and 42.21mol/s-gcat, respectively. These values were obtained at a temperature of 200°C, using the next equation: -r'A = FA0*x/W, where FA0 is the inlet molar flow of 2-MF, x is conversion, and W is the weight of catalyst. Also the Turnover frequency (TOF) was calculated at the same conditions, as TOF = -r'A/S, where S is the number of active sites, for monometallic Pt and Pd catalyst were 9.86×105 s−1 and 1.46×105 s−1, respectively; and for bimetallic catalysts Pt-Fe and Pd-Fe were 4.56×105 s−1 and 2.69×106 s−1, respectively. The S was estimated from the experimental initial amount of metal in the catalyst (obtained from atomic absorption spectrometry) and the final alloy phase observed for each catalyst via TEM micrographs. As it can be seen the TOF for the bimetallic Pd-Fe catalyst is the highest. The monometallic palladium (Pd/Al2O3) catalyst presented the best catalytic activity of all catalysts at the lowest temperature (100°C), with 23.4% of conversion. This catalyst continues with the best performance also at 150°C, but its catalytic activity drastically decreases up to 5% conversion at the highest reaction temperature (200°C). This can be explained due to a deposition of carbon for early decarboxylation reaction of 2-MF, which in turn covers the hydrogenation catalytic sites of the monometallic Pd catalyst [44]. The same Pd/Al2O3 catalyst was tested from 100 to 200°C, at the time of use was enough to decrease the activity. The bimetallic Pd-Fe/Al2O3 catalyst presented a different behavior compared with the monometallic Pd catalyst; the conversion increases constantly as a function of temperature. At the highest temperature for this experiment, the bimetallic Pd-Fe catalyst showed the highest conversion of 2-MF (31.15%). This is similar to previous works for hydrogenation of 2-MF, such as that reported by Zhu et al. [45], who observed a conversion of 33.3% when operating a continuous catalytic reactor at 220°C and atmospheric pressure, with a commercial Cu-Zn catalyst. Table 1 resumes conversion and yield data for all catalysts evaluated in this work, with the exception of the monometallic Fe catalysts, which showed abscence of catalytic activity at the reaction temperatures. Fig. 4 shows the product selectivity for the Pt, Pt-Fe, Pd and Pd-Fe catalysts on Al2O3. Both the monometallic and bimetallic Pt catalysts form the same type of products: pentene, 2-pentanone, 1-pentanol and 2-pentanol. The production of both alcohol species is very low and the catalyst of pure platinum (Pt/Al2O3) denotes a very high selectivity for pentene. The 2-MF molecule, according to its structure, is adsorbed on the surface of the Pt catalysts in two different ways: in a planar form through the CC groups of the furan ring, or vertically through the oxygen of the COC group of the furan ring [10]. Delbecq and Sautet, in 1995, suggested that the adsorption competitiveness is due to the radial expansion of d orbital of the active metal [46]. According to Vetere, et al., the Pt has this property showing repulsion to the CC functional groups of the furan ring; therefore the 2-MF molecule is adsorbed vertically by the interaction of the Pt with the oxygen atom from the ring and the repulsion that exists with the rest of the molecule [10]. Fig. 4c and d present the selectivity of formed products for the monometallic and bimetallic palladium catalysts, Pd/Al2O3 and Pd-Fe/Al2O3. It is very interesting that both catalysts yield the same type of products (though with different distributions): 2-methyltetrahydrofuran (MTHF), pentene, pentanal, 2-pentanone, 2 butanone and the alcohols 1-pentanol, 2-pentanol and 1-butanol. In both catalysts, MTHF showed higher selectivity at low temperatures, but it fell to almost zero when the temperature was increased to 200°C. MTHF is considered an intermediate to form the rest of the products. It is notable the higher selectivity observed on the formation of 1-pentanol, 2-pentanol and 1-butanol for Pd-Fe/Al2O3 compared with the Pd/Al2O3 catalyst. The total selectivity of the alcohols for the bimetallic Pd catalyst was 39.15% at 200°C and 27.67% for the monometallic Pd catalyst, considering a higher conversion with the bimetallic catalyst. 2-butanone was formed with very low selectivity (less than 1%) at all temperatures. The formation of MTHF at low temperatures when Pd catalysts were used indicates that 2-MF is adsorbed in a different way compared with the Pt catalysts. Vorotnikov et al. studied the adsorption of 2-MF on a surface of Pd (111), which has a face-centered cubic structure (FCC). They found that the most favorable adsorption of the molecule is flat, with the furan ring centered at the FCC hollow site and the methyl group tilted away from the molecular plane to preserve the sp 3 hybridization [47]. This observation justifies the first step of the mechanism for hydrodeoxygenation of 2-MF, which will be discussed thoroughly in the next section. 3.4 Proposal of the mechanism to form the products of Pd-Fe/Al2O3 catalysts According to the presented results, a mechanism for hydrodeoxygenation of 2-MF to form the observed reaction products using the bimetallic Pd-Fe/Al2O3 catalyst is presented as theoretical proposal in Fig. 5 . The first step involves adsorption of the reactants over the catalyst surface, in which case hydrogen readily dissociates in two hydrogen atoms, which later transfer to the CC double bond due to the partially-filled outer layers (d and f) of Pd [48]. The 2-MF adsorption over the catalyst surface is represented as occurring over the flat molecule, with the methyl substituent moving away, as stated before. Biswas et al. suggested 2-MF adsorbs via the double bonds, which promotes first the hydrogenation of the CC bonds and afterwards, an opening of the 5-membered ring [8]. While hydrogenation of the double bonds may proceed simultaneously, in Fig. 5B–F this process is represented in two steps to have an easier understanding. Hydrogenation of 2-MF produces 2-MTHF, which is in equilibrium with its adsorbed and desorbed states (steps G and H). In order to open the ring, MTHF is adsorbed via the oxygen atom (step H), and an SN1 attack from a hydrogen atom on the more substituted carbon is observed (step I). After this, the oxygen attacks a hydrogen atom left over the surface, which leads to the formation of 1-pentanol [49], which in turn is in equilibrium between its adsorbed and desorbed phases (steps K and L). After the bonding of pentanol with the catalyst surface (step M), the reaction proceeds in two different ways. If an active catalyst surface site attacks a hydrogen atom β to the hydroxyl group, the electrons forming the previous CH bond migrate to form a new CC double bond which in turn promote the cleavage of the CO bond, with OH as the leaving group and forming 1-pentene (steps N and O). However, if the active site attacks a hydrogen atom α to the hydroxyl group, the higher electronegativity of the O atom attracts the electrons, forming a CO double bond and promoting the cleavage of the OH bond and the liberation of a whole hydrogen molecule (step P). A pentanal molecule is formed in this process, which is in equilibrium between its adsorbed and desorbed phases (steps Q and R). Although pentanal formation from 1-pentanol may seem unlikely given the reductant conditions, Oyama et al. have confirmed this reaction sequence, attributing it to an abundance of active surface sites due to a low hydrogen content which promotes incomplete occupation by the hydrogen species, while for higher pressures (5atm), the surface is more fully occupied with adsorbed species, and pentanal formation is observed before 1-pentanol [50]. Attack from an hydroxyl group present from the alumina surface to the carbon atom α to the carbonyl group of pentanal promotes simultaneous decarbonylation and hydroxylation, forming butanol as the final product and carbon monoxide as side product (steps S and T) [33]. 3.5 High-resolution transmission electron microscopy (HRTEM) The Pd-Fe/Al2O3 catalyst presented the best conversion at 200°C and the highest selectivity to form alcohols at the same condition. In order to know more about the surface of this catalyst, HRTEM was applied to analyze and explain the significant performance of Pd-Fe/Al2O3. Fig. 6 presents the HRTEM image of the Pd-Fe/Al2O3 catalyst, where a group of four nanoparticles (indicated as A, B, C and D) with different morphology and arrange of atomic planes is observed. Perpendicular lines were drawn (cyan color) to calculate the interplanar distances (IDs) in the micrographs; the average measure was compared with the PDF to identify the crystalline phase observed in the nanoparticle. In zone A, the average measure of the IDs was 0.2801±0.0030nm and matched the (200) plane according to the PDF 04-005-475 for a O4Pd3.5 crystalline phase, which indicates the sample was not completely reduced. For zone B the ID measure was 0.2261±0.0050nm and matched the (111) plane according to the PDF 04-001-7354 for a FePd3 crystalline phase [51]; this confirms the formation of a bimetallic Pd-Fe alloy. According with information of the PDF, an iron atom is located in the six corners of the cubic lattice and three palladium atoms are in the six faces of the cube. The planar packing fraction (PPF) for the face centered cubic (111) plane is 0.906, which means there is a very high density of atoms for an exposed plane. In zone C, the identified crystalline phases were magnetite (Fe3O4) and maghemite (γ-Fe2O3) iron oxides; the observed ID of 0.2578±0.0035nm were matched with the (311) plane according to the PDF 880866 for magnetite, and with the (311) plane according to the PDF 240081 for maghemite. A Pd crystalline phase was identified in zone D, where the ID was calculated as 0.24004±0.0025nm, which matches with the (111) plane according the PDF 01-087-0637. The presence of the bimetallic alloy of FePd3 may produce a greater attraction of 2-MF and H2 than monometallic palladium particles present in the Pd/Al2O3 catalyst. One effect of having a bimetallic Pd alloy with a second metal such as Fe or Co as a catalytic site is to have a higher electron density on palladium atoms, which is likely due to incomplete filling of the valence shell of the second metal and to electron transfer to unoccupied Pd orbitals [44]. In the other hand, Jinfan Yang et al., reported that the presence of iron species leads to a decrease of chemically accessible Pd sites on the surface of a Pd/SiO2 catalyst; nevertheless, the Pd-Fe alloy cause a synergism effect favouring performance of a bimetallic Pd-FeO/SiO2 catalyst [52]. This synergism effect is due to the electronic structure of the surface d-band in alloy sites of bimetallic catalysts, which makes them more active than monometallic catalysts [53]. Other works mention that bimetallic alloys of Pd with other metals such as Re or Cu promote an increased activation of H2 on the catalyst surface compared with pure palladium catalysts [53,54]. 4 Conclusion Pt/Al2O3, Pt-Fe/Al2O3, Pd/Al2O3 and Pd-Fe/Al2O3 catalysts were synthesized with low metal weight percentage (0.5%) on alumina and reduced at 450°C, and nanoparticles around 5nm of size were obtained. The thermal analyses reveled a strong interaction of Pt and Pd with the Fe in the bimetallic formulations. A possible bimetallic compound formation was confirmed with TPR. The Pt/Al2O3 and Pt-Fe/Al2O3 catalysts performance for 2-MF hydrogenation at 200°C was very low and the formed products were not of interest to be used as direct biofuel application (pentene). In contrast, the Pd/Al2O3, Pd-Fe/Al2O3 catalysts presented a better performance, with both an increased conversion and the formation of more valuable products. Pd-Fe/Al2O3 presented the highest conversion, with production of diverse alcohols such 1-pentanol, 2-pentanol and 1-butanol, which can be considered as a good blend to be used as biofuel. A mechanism to form the obtained products with the bimetallic catalyst of Pd and Fe was also presented. The HRTEM image analysis revealed the formation of FePd3 nanoparticles, which was related with the good hydrogenation efficiency in the surface reaction presented for the bimetallic Pd-Fe catalyst. Acknowledgements This work was funded by the Facultad de Ciencias Quimicas, Universidad Autonoma de Nuevo Leon (UANL). Also special thanks to the Daniel E. Resasco from University of Oklahoma for the facilities of some tests. Ladislao Sandoval-Rangel now works at Tecnológico de Monterrey, Campus Monterrey. References [1] J. Gao D. Jiang Z. Huang Fuel 86 2007 1645 1650 [2] A.F. Cann J.C. Liao Appl. Microbiol. Biotechnol. 85 2010 893 899 [3] K.A. Heufer J. Bugler H.J. Curran Proc. Combust. Inst. 34 2013 511 518 [4] R. Xing W. Qi G.W. Huber Energy Environ. Sci. 4 2011 2193 2205 [5] K.-H. Lin M.-H. Huang A.C.C. Chang Int. J. Hydrogen Energy 38 2013 15794 15800 [6] P. Claus Top. Catal. 5 1998 51 62 [7] C. Aliaga C.-K. Tsung S. Alayoglu K. Komvopoulos P. Yang G.A. Somorjai J. Phys. Chem. C 115 2011 8104 8109 [8] P. Biswas J.-H. Lin J. Kang V.V. Guliants Appl. Catal. A: Gen. 475 2014 379 385 [9] H. Liu Z. Huang F. Zhao F. Cui X. Li C. Xia J. Chen Catal. Sci. Technol. 6 2016 668 671 [10] V. Vetere A.B. Merlo J.F. Ruggera M.L. Casella J. Braz. Chem. Soc. 21 2010 914 920 [11] Y. Zhao Environ. Chem. Lett. 12 2014 185 190 [12] S. Sitthisa D.E. Resasco Catal. Lett. 141 2011 784 791 [13] T. Ma Q. Fu H.-Y. Su H.-Y. Liu Y. Cui Z. Wang R.-T. Mu W.-X. Li X.-H. Bao ChemPhysChem 10 2009 1013 1016 [14] D.M. Alonso S.G. Wettstein J.A. Dumesic Chem. Soc. Rev. 41 2012 8075 8098 [15] Y. Chen J. Mao R. Shen D. Wang Q. Peng Z. Yu H. Guo W. He Nano Res. 10 3 2017 890 896 [16] C. Zhu S. Guo S. Dong Chem. – Eur. J. 19 2013 1104 1111 [17] J.L. Rousset F.J. Cadete Santos Aires F. Bornette M. Cattenot M. Pellarin L. Stievano A.J. Renouprez Appl. Surf. Sci. 164 2000 163 168 [18] K. Persson A. Ersson K. Jansson N. Iverlund S. Järås J. Catal. 231 2005 139 150 [19] Y. Ito H. Ohta Y.M.A. Yamada T. Enoki Y. Uozumi Tetrahedron 70 2014 6146 6149 [20] H. Chen Y. Yu H.L. Xin K.A. Newton M.E. Holtz D. Wang D.A. Muller H.D. Abruña F.J. DiSalvo Chem. Mater. 25 2013 1436 1442 [21] Y.-J. Wang N. Zhao B. Fang H. Li X.T. Bi H. Wang Chem. Rev. 115 2015 3433 3467 [22] P. Melnikov V.A. Nascimento I.V. Arkhangelsky L.Z. Zanoni Consolo L.C.S. de Oliveira J. Therm. Anal. Calorim. 115 2014 145 151 [23] F.S. Yen W.C. Chen J.M. Yang C.T. Hong Nano Lett. 2 2002 245 252 [24] C. Solis-Maldonado J. Rivera De la Rosa C.J. Lucio-Ortiz A. Hernández-Ramírez F.F.C. Barraza J.S. Valente Materials 7 3 2014 2062 2086 [25] D. Radivojević K. Seshan L. Lefferts Appl. Catal. A: Gen. 301 2006 51 58 [26] R. Le Van Mao S. Xiao T. Si Le Catal. Lett. 35 1995 107 118 [27] H.M. Gobara R.S. Mohamed F.H. Khalil M.S. El-Shall S.A. Hassan Egypt. J. Pet. 23 2014 105 118 [28] K.W. Park H.N. Yang W.H. Lee B.S. Choi W.J. Kim Microporous Mesoporous Mater. 220 2016 282 289 [29] A. Barrera M. Viniegra S. Fuentes G. Díaz Appl. Catal. B: Environ. 56 2005 279 288 [30] R.J. Farrauto J.K. Lampert M.C. Hobson E.M. Waterman Appl. Catal. B: Environ. 6 1995 263 270 [31] B.M. Nagaraja A.H. Padmasri B. David Raju K.S. Rama Rao J. Mol. Catal. A: Chem. 265 2007 90 97 [32] A.B. Merlo V. Vetere J.M. Ramallo-López F.G. Requejo M.L. Casella Mech. Catal. 104 2011 467 482 [33] S. Sitthisa T. Pham T. Prasomsri T. Sooknoi R.G. Mallinson D.E. Resasco J. Catal. 280 2011 17 27 [34] V.A. Mazzieri J.M. Grau J.C. Yori C.R. Vera C.L. Pieck Appl. Catal. A: Gen. 354 2009 161 168 [35] I. Contreras-Andrade A. Vázquez-Zavala T. Viveros Energy Fuels 23 2009 3835 3841 [36] P.T. Do M. Chiappero L.L. Lobban D.E. Resasco Catal. Lett. 130 2009 9 18 [37] T.S. Mozer F.B. Passos Int. J. Hydrogen Energy 36 2011 13369 13378 [38] A. Sirijaruphan J.G. Goodwin Jr. R.W. Rice J. Catal. 224 2004 304 313 [39] M. Sankar N. Dimitratos P.J. Miedziak P.P. Wells C.J. Kiely G.J. Hutchings Chem. Soc. Rev. 41 2012 8099 8139 [40] P. Mierczynski K. Vasilev A. Mierczynska W. Maniukiewicz M.I. Szynkowska T.P. Maniecki Appl. Catal. B: Environ. 185 2016 281 294 [41] D. Tian Z. Liu D. Li H. Shi W. Pan Y. Cheng Fuel 104 2013 224 229 [42] J. Kugai J.T. Miller N. Guo C. Song J. Catal. 277 2011 46 53 [43] F.E. Wang II Phase Equilibrium Diagrams, Bonding Theory for Metals and Alloys 2005 Elsevier Amsterdam 12 48 [44] I.F. Khalilov I.R. Ilyasov A.V. Gerasimova A.A. Lamberov A.S. Bikmurzin V.M. Shatilov Catal. Ind. 5 2013 318 326 [45] H.-Y. Zheng Y.-L. Zhu B.-T. Teng Z.-Q. Bai C.-H. Zhang H.-W. Xiang Y.-W. Li J. Mol. Catal. A: Chem. 246 2006 18 23 [46] J. Haubrich D. Loffreda F. Delbecq P. Sautet A. Krupski C. Becker K. Wandelt J. Phys. Chem. C 113 2009 13947 13967 [47] V. Vorotnikov G. Mpourmpakis D.G. Vlachos ACS Catal. 2 2012 2496 2504 [48] L.L. Jewell B.H. Davis Appl. Catal. A: Gen. 310 2006 1 15 [49] P. Bui A. Takagaki R. Kikuchi S.T. Oyama ACS Catal. 6 2016 7701 7709 [50] A. Iino A. Cho A. Takagaki R. Kikuchi S. Ted Oyama J. Catal. 311 2014 17 27 [51] Y. Xiang X. Li C. Lu L. Ma Q. Zhang Appl. Catal. A: Gen. 375 2010 289 294 [52] J. Yang S. Li L. Zhang X. Liu J. Wang X. Pan N. Li A. Wang Y. Cong X. Wang T. Zhang Appl. Catal. B: Environ. 201 2017 266 277 [53] W. Yu M.D. Porosoff J.G. Chen Chem. Rev. 112 2012 5780 5817 [54] M. Lesiak M. Binczarski S. Karski W. Maniukiewicz J. Rogowski E. Szubiakiewicz J. Berlowska P. Dziugan I. Witońska J. Mol. Catal. A: Chem. 395 2014 337 348",
      "scopus-id": "85021286774",
      "coredata": {
        "eid": "1-s2.0-S0926860X17302685",
        "dc:description": "This work presents the hydrogenation of 2-methylfuran (2-MF) in gaseous fluid phase into a catalytic reactor in order to obtain products with good properties to be used as biofuel. Bimetallic nanoparticles were obtained by impregnation on Al2O3 from the classic catalytic metals used in hydrogenation reactions such as platinum and palladium, combined with iron, to observe the catalytic activity and the selectivity to form interest biofuel compounds. Pt, Pd, Pt-Fe and Pd-Fe catalysts (with 0.5% wt. metal content) supported on alumina were reduced at 450°C and tested. At 200°C, Pt/Al2O3 and Pt-Fe/Al2O3 catalysts presented less than 19% conversion and the main formed product was pentene (90% selectivity). The Pd/Al2O3 catalyst conversion of 2-MF was of 5% at 200°C, obtaining 1-pentanol and 1-butanol as products, together with a 28% of selectivity. The Pd-Fe/Al2O3 catalyst presented the highest conversion of 2-MF at 200°C of 31%, the production of alcohols such as 1-pentanol, 2-pentanol and 1-butanol summed a selectivity of 39%. Since the Pd-Fe/Al2O3 catalyst presented the best performance, it was analyzed under high-resolution transmission electron microscopy technique. The HRTEM image revealed the presence of 5nm size nanoparticles over the alumina, and Pd and Fe oxide nanoparticles were identified measuring the interplanar distances of exposed planes. A FePd3 nanoparticle alloy was also identified, which was the difference in having a greater hydrogenation efficiency for the 2-MF molecule.",
        "openArchiveArticle": "false",
        "prism:coverDate": "2017-08-05",
        "openaccessUserLicense": null,
        "prism:aggregationType": "Journal",
        "prism:url": "https://api.elsevier.com/content/article/pii/S0926860X17302685",
        "dc:creator": [
          {
            "@_fa": "true",
            "$": "Dimas-Rivera, Gloria Lourdes"
          },
          {
            "@_fa": "true",
            "$": "Rivera De la Rosa, Javier"
          },
          {
            "@_fa": "true",
            "$": "Lucio-Ortiz, Carlos J."
          },
          {
            "@_fa": "true",
            "$": "Martínez-Vargas, Daniela Xulú"
          },
          {
            "@_fa": "true",
            "$": "Sandoval-Rangel, Ladislao"
          },
          {
            "@_fa": "true",
            "$": "García Gutiérrez, Domingo Ixtcoatl"
          },
          {
            "@_fa": "true",
            "$": "Solis Maldonado, Carolina"
          }
        ],
        "link": [
          {
            "@_fa": "true",
            "@rel": "self",
            "@href": "https://api.elsevier.com/content/article/pii/S0926860X17302685"
          },
          {
            "@_fa": "true",
            "@rel": "scidir",
            "@href": "https://www.sciencedirect.com/science/article/pii/S0926860X17302685"
          }
        ],
        "dc:format": "application/json",
        "openaccessType": null,
        "pii": "S0926-860X(17)30268-5",
        "prism:volume": "543",
        "prism:publisher": "Elsevier B.V.",
        "dc:title": "Bimetallic Pd-Fe supported on γ-Al2O3 catalyst used in the ring opening of 2-methylfuran to selective formation of alcohols",
        "prism:copyright": "© 2017 Elsevier B.V. All rights reserved.",
        "openaccess": "0",
        "prism:issn": "0926860X",
        "dcterms:subject": [
          {
            "@_fa": "true",
            "$": "Bimetallic Pd-Fe catalyst"
          },
          {
            "@_fa": "true",
            "$": "Alcohols production"
          },
          {
            "@_fa": "true",
            "$": "2-Methylfuran"
          },
          {
            "@_fa": "true",
            "$": "Ring opening"
          }
        ],
        "openaccessArticle": "false",
        "prism:publicationName": "Applied Catalysis A: General",
        "openaccessSponsorType": null,
        "prism:pageRange": "133-140",
        "prism:endingPage": "140",
        "pubType": "fla",
        "prism:coverDisplayDate": "5 August 2017",
        "prism:doi": "10.1016/j.apcata.2017.06.019",
        "prism:startingPage": "133",
        "dc:identifier": "doi:10.1016/j.apcata.2017.06.019",
        "openaccessSponsorName": null
      },
      "objects": {
        "object": [
          {
            "@category": "thumbnail",
            "@height": "97",
            "@width": "219",
            "@_fa": "true",
            "$": "https://api.elsevier.com/content/object/eid/1-s2.0-S0926860X17302685-fx1.sml?httpAccept=%2A%2F%2A",
            "@multimediatype": "GIF image file",
            "@type": "IMAGE-THUMBNAIL",
            "@size": "6116",
            "@ref": "fx1",
            "@mimetype": "image/gif"
          },
          {
            "@category": "thumbnail",
            "@height": "152",
            "@width": "122",
            "@_fa": "true",
            "$": "https://api.elsevier.com/content/object/eid/1-s2.0-S0926860X17302685-fx10.sml?httpAccept=%2A%2F%2A",
            "@multimediatype": "GIF image file",
            "@type": "IMAGE-THUMBNAIL",
            "@size": "3822",
            "@ref": "fx10",
            "@mimetype": "image/gif"
          },
          {
            "@category": "thumbnail",
            "@height": "178",
            "@width": "92",
            "@_fa": "true",
            "$": "https://api.elsevier.com/content/object/eid/1-s2.0-S0926860X17302685-fx11.sml?httpAccept=%2A%2F%2A",
            "@multimediatype": "GIF image file",
            "@type": "IMAGE-THUMBNAIL",
            "@size": "5072",
            "@ref": "fx11",
            "@mimetype": "image/gif"
          },
          {
            "@category": "thumbnail",
            "@height": "177",
            "@width": "72",
            "@_fa": "true",
            "$": "https://api.elsevier.com/content/object/eid/1-s2.0-S0926860X17302685-fx12.sml?httpAccept=%2A%2F%2A",
            "@multimediatype": "GIF image file",
            "@type": "IMAGE-THUMBNAIL",
            "@size": "5433",
            "@ref": "fx12",
            "@mimetype": "image/gif"
          },
          {
            "@category": "thumbnail",
            "@height": "170",
            "@width": "128",
            "@_fa": "true",
            "$": "https://api.elsevier.com/content/object/eid/1-s2.0-S0926860X17302685-fx13.sml?httpAccept=%2A%2F%2A",
            "@multimediatype": "GIF image file",
            "@type": "IMAGE-THUMBNAIL",
            "@size": "4732",
            "@ref": "fx13",
            "@mimetype": "image/gif"
          },
          {
            "@category": "thumbnail",
            "@height": "160",
            "@width": "123",
            "@_fa": "true",
            "$": "https://api.elsevier.com/content/object/eid/1-s2.0-S0926860X17302685-fx14.sml?httpAccept=%2A%2F%2A",
            "@multimediatype": "GIF image file",
            "@type": "IMAGE-THUMBNAIL",
            "@size": "4548",
            "@ref": "fx14",
            "@mimetype": "image/gif"
          },
          {
            "@category": "thumbnail",
            "@height": "42",
            "@width": "42",
            "@_fa": "true",
            "$": "https://api.elsevier.com/content/object/eid/1-s2.0-S0926860X17302685-fx2.sml?httpAccept=%2A%2F%2A",
            "@multimediatype": "GIF image file",
            "@type": "IMAGE-THUMBNAIL",
            "@size": "1216",
            "@ref": "fx2",
            "@mimetype": "image/gif"
          },
          {
            "@category": "thumbnail",
            "@height": "48",
            "@width": "47",
            "@_fa": "true",
            "$": "https://api.elsevier.com/content/object/eid/1-s2.0-S0926860X17302685-fx3.sml?httpAccept=%2A%2F%2A",
            "@multimediatype": "GIF image file",
            "@type": "IMAGE-THUMBNAIL",
            "@size": "1955",
            "@ref": "fx3",
            "@mimetype": "image/gif"
          },
          {
            "@category": "thumbnail",
            "@height": "42",
            "@width": "42",
            "@_fa": "true",
            "$": "https://api.elsevier.com/content/object/eid/1-s2.0-S0926860X17302685-fx4.sml?httpAccept=%2A%2F%2A",
            "@multimediatype": "GIF image file",
            "@type": "IMAGE-THUMBNAIL",
            "@size": "1405",
            "@ref": "fx4",
            "@mimetype": "image/gif"
          },
          {
            "@category": "thumbnail",
            "@height": "42",
            "@width": "40",
            "@_fa": "true",
            "$": "https://api.elsevier.com/content/object/eid/1-s2.0-S0926860X17302685-fx5.sml?httpAccept=%2A%2F%2A",
            "@multimediatype": "GIF image file",
            "@type": "IMAGE-THUMBNAIL",
            "@size": "1561",
            "@ref": "fx5",
            "@mimetype": "image/gif"
          },
          {
            "@category": "thumbnail",
            "@height": "45",
            "@width": "47",
            "@_fa": "true",
            "$": "https://api.elsevier.com/content/object/eid/1-s2.0-S0926860X17302685-fx6.sml?httpAccept=%2A%2F%2A",
            "@multimediatype": "GIF image file",
            "@type": "IMAGE-THUMBNAIL",
            "@size": "1203",
            "@ref": "fx6",
            "@mimetype": "image/gif"
          },
          {
            "@category": "thumbnail",
            "@height": "140",
            "@width": "138",
            "@_fa": "true",
            "$": "https://api.elsevier.com/content/object/eid/1-s2.0-S0926860X17302685-fx7.sml?httpAccept=%2A%2F%2A",
            "@multimediatype": "GIF image file",
            "@type": "IMAGE-THUMBNAIL",
            "@size": "4792",
            "@ref": "fx7",
            "@mimetype": "image/gif"
          },
          {
            "@category": "thumbnail",
            "@height": "185",
            "@width": "128",
            "@_fa": "true",
            "$": "https://api.elsevier.com/content/object/eid/1-s2.0-S0926860X17302685-fx8.sml?httpAccept=%2A%2F%2A",
            "@multimediatype": "GIF image file",
            "@type": "IMAGE-THUMBNAIL",
            "@size": "5325",
            "@ref": "fx8",
            "@mimetype": "image/gif"
          },
          {
            "@category": "thumbnail",
            "@height": "190",
            "@width": "82",
            "@_fa": "true",
            "$": "https://api.elsevier.com/content/object/eid/1-s2.0-S0926860X17302685-fx9.sml?httpAccept=%2A%2F%2A",
            "@multimediatype": "GIF image file",
            "@type": "IMAGE-THUMBNAIL",
            "@size": "5208",
            "@ref": "fx9",
            "@mimetype": "image/gif"
          },
          {
            "@category": "thumbnail",
            "@height": "77",
            "@width": "219",
            "@_fa": "true",
            "$": "https://api.elsevier.com/content/object/eid/1-s2.0-S0926860X17302685-gr1.sml?httpAccept=%2A%2F%2A",
            "@multimediatype": "GIF image file",
            "@type": "IMAGE-THUMBNAIL",
            "@size": "6378",
            "@ref": "gr1",
            "@mimetype": "image/gif"
          },
          {
            "@category": "thumbnail",
            "@height": "153",
            "@width": "219",
            "@_fa": "true",
            "$": "https://api.elsevier.com/content/object/eid/1-s2.0-S0926860X17302685-gr2.sml?httpAccept=%2A%2F%2A",
            "@multimediatype": "GIF image file",
            "@type": "IMAGE-THUMBNAIL",
            "@size": "7625",
            "@ref": "gr2",
            "@mimetype": "image/gif"
          },
          {
            "@category": "thumbnail",
            "@height": "152",
            "@width": "219",
            "@_fa": "true",
            "$": "https://api.elsevier.com/content/object/eid/1-s2.0-S0926860X17302685-gr3.sml?httpAccept=%2A%2F%2A",
            "@multimediatype": "GIF image file",
            "@type": "IMAGE-THUMBNAIL",
            "@size": "5692",
            "@ref": "gr3",
            "@mimetype": "image/gif"
          },
          {
            "@category": "thumbnail",
            "@height": "152",
            "@width": "219",
            "@_fa": "true",
            "$": "https://api.elsevier.com/content/object/eid/1-s2.0-S0926860X17302685-gr4.sml?httpAccept=%2A%2F%2A",
            "@multimediatype": "GIF image file",
            "@type": "IMAGE-THUMBNAIL",
            "@size": "7964",
            "@ref": "gr4",
            "@mimetype": "image/gif"
          },
          {
            "@category": "thumbnail",
            "@height": "164",
            "@width": "216",
            "@_fa": "true",
            "$": "https://api.elsevier.com/content/object/eid/1-s2.0-S0926860X17302685-gr5.sml?httpAccept=%2A%2F%2A",
            "@multimediatype": "GIF image file",
            "@type": "IMAGE-THUMBNAIL",
            "@size": "5354",
            "@ref": "gr5",
            "@mimetype": "image/gif"
          },
          {
            "@category": "thumbnail",
            "@height": "164",
            "@width": "164",
            "@_fa": "true",
            "$": "https://api.elsevier.com/content/object/eid/1-s2.0-S0926860X17302685-gr6.sml?httpAccept=%2A%2F%2A",
            "@multimediatype": "GIF image file",
            "@type": "IMAGE-THUMBNAIL",
            "@size": "22443",
            "@ref": "gr6",
            "@mimetype": "image/gif"
          },
          {
            "@category": "standard",
            "@height": "200",
            "@width": "452",
            "@_fa": "true",
            "$": "https://api.elsevier.com/content/object/eid/1-s2.0-S0926860X17302685-fx1.jpg?httpAccept=%2A%2F%2A",
            "@multimediatype": "JPEG image file",
            "@type": "IMAGE-DOWNSAMPLED",
            "@size": "21159",
            "@ref": "fx1",
            "@mimetype": "image/jpeg"
          },
          {
            "@category": "standard",
            "@height": "34",
            "@width": "27",
            "@_fa": "true",
            "$": "https://api.elsevier.com/content/object/eid/1-s2.0-S0926860X17302685-fx10.jpg?httpAccept=%2A%2F%2A",
            "@multimediatype": "JPEG image file",
            "@type": "IMAGE-DOWNSAMPLED",
            "@size": "747",
            "@ref": "fx10",
            "@mimetype": "image/jpeg"
          },
          {
            "@category": "standard",
            "@height": "39",
            "@width": "20",
            "@_fa": "true",
            "$": "https://api.elsevier.com/content/object/eid/1-s2.0-S0926860X17302685-fx11.jpg?httpAccept=%2A%2F%2A",
            "@multimediatype": "JPEG image file",
            "@type": "IMAGE-DOWNSAMPLED",
            "@size": "840",
            "@ref": "fx11",
            "@mimetype": "image/jpeg"
          },
          {
            "@category": "standard",
            "@height": "39",
            "@width": "16",
            "@_fa": "true",
            "$": "https://api.elsevier.com/content/object/eid/1-s2.0-S0926860X17302685-fx12.jpg?httpAccept=%2A%2F%2A",
            "@multimediatype": "JPEG image file",
            "@type": "IMAGE-DOWNSAMPLED",
            "@size": "650",
            "@ref": "fx12",
            "@mimetype": "image/jpeg"
          },
          {
            "@category": "standard",
            "@height": "37",
            "@width": "28",
            "@_fa": "true",
            "$": "https://api.elsevier.com/content/object/eid/1-s2.0-S0926860X17302685-fx13.jpg?httpAccept=%2A%2F%2A",
            "@multimediatype": "JPEG image file",
            "@type": "IMAGE-DOWNSAMPLED",
            "@size": "756",
            "@ref": "fx13",
            "@mimetype": "image/jpeg"
          },
          {
            "@category": "standard",
            "@height": "35",
            "@width": "27",
            "@_fa": "true",
            "$": "https://api.elsevier.com/content/object/eid/1-s2.0-S0926860X17302685-fx14.jpg?httpAccept=%2A%2F%2A",
            "@multimediatype": "JPEG image file",
            "@type": "IMAGE-DOWNSAMPLED",
            "@size": "761",
            "@ref": "fx14",
            "@mimetype": "image/jpeg"
          },
          {
            "@category": "standard",
            "@height": "9",
            "@width": "9",
            "@_fa": "true",
            "$": "https://api.elsevier.com/content/object/eid/1-s2.0-S0926860X17302685-fx2.jpg?httpAccept=%2A%2F%2A",
            "@multimediatype": "JPEG image file",
            "@type": "IMAGE-DOWNSAMPLED",
            "@size": "367",
            "@ref": "fx2",
            "@mimetype": "image/jpeg"
          },
          {
            "@category": "standard",
            "@height": "10",
            "@width": "10",
            "@_fa": "true",
            "$": "https://api.elsevier.com/content/object/eid/1-s2.0-S0926860X17302685-fx3.jpg?httpAccept=%2A%2F%2A",
            "@multimediatype": "JPEG image file",
            "@type": "IMAGE-DOWNSAMPLED",
            "@size": "444",
            "@ref": "fx3",
            "@mimetype": "image/jpeg"
          },
          {
            "@category": "standard",
            "@height": "9",
            "@width": "9",
            "@_fa": "true",
            "$": "https://api.elsevier.com/content/object/eid/1-s2.0-S0926860X17302685-fx4.jpg?httpAccept=%2A%2F%2A",
            "@multimediatype": "JPEG image file",
            "@type": "IMAGE-DOWNSAMPLED",
            "@size": "368",
            "@ref": "fx4",
            "@mimetype": "image/jpeg"
          },
          {
            "@category": "standard",
            "@height": "9",
            "@width": "9",
            "@_fa": "true",
            "$": "https://api.elsevier.com/content/object/eid/1-s2.0-S0926860X17302685-fx5.jpg?httpAccept=%2A%2F%2A",
            "@multimediatype": "JPEG image file",
            "@type": "IMAGE-DOWNSAMPLED",
            "@size": "417",
            "@ref": "fx5",
            "@mimetype": "image/jpeg"
          },
          {
            "@category": "standard",
            "@height": "10",
            "@width": "10",
            "@_fa": "true",
            "$": "https://api.elsevier.com/content/object/eid/1-s2.0-S0926860X17302685-fx6.jpg?httpAccept=%2A%2F%2A",
            "@multimediatype": "JPEG image file",
            "@type": "IMAGE-DOWNSAMPLED",
            "@size": "471",
            "@ref": "fx6",
            "@mimetype": "image/jpeg"
          },
          {
            "@category": "standard",
            "@height": "31",
            "@width": "31",
            "@_fa": "true",
            "$": "https://api.elsevier.com/content/object/eid/1-s2.0-S0926860X17302685-fx7.jpg?httpAccept=%2A%2F%2A",
            "@multimediatype": "JPEG image file",
            "@type": "IMAGE-DOWNSAMPLED",
            "@size": "795",
            "@ref": "fx7",
            "@mimetype": "image/jpeg"
          },
          {
            "@category": "standard",
            "@height": "40",
            "@width": "28",
            "@_fa": "true",
            "$": "https://api.elsevier.com/content/object/eid/1-s2.0-S0926860X17302685-fx8.jpg?httpAccept=%2A%2F%2A",
            "@multimediatype": "JPEG image file",
            "@type": "IMAGE-DOWNSAMPLED",
            "@size": "772",
            "@ref": "fx8",
            "@mimetype": "image/jpeg"
          },
          {
            "@category": "standard",
            "@height": "42",
            "@width": "18",
            "@_fa": "true",
            "$": "https://api.elsevier.com/content/object/eid/1-s2.0-S0926860X17302685-fx9.jpg?httpAccept=%2A%2F%2A",
            "@multimediatype": "JPEG image file",
            "@type": "IMAGE-DOWNSAMPLED",
            "@size": "771",
            "@ref": "fx9",
            "@mimetype": "image/jpeg"
          },
          {
            "@category": "standard",
            "@height": "172",
            "@width": "489",
            "@_fa": "true",
            "$": "https://api.elsevier.com/content/object/eid/1-s2.0-S0926860X17302685-gr1.jpg?httpAccept=%2A%2F%2A",
            "@multimediatype": "JPEG image file",
            "@type": "IMAGE-DOWNSAMPLED",
            "@size": "29410",
            "@ref": "gr1",
            "@mimetype": "image/jpeg"
          },
          {
            "@category": "standard",
            "@height": "237",
            "@width": "339",
            "@_fa": "true",
            "$": "https://api.elsevier.com/content/object/eid/1-s2.0-S0926860X17302685-gr2.jpg?httpAccept=%2A%2F%2A",
            "@multimediatype": "JPEG image file",
            "@type": "IMAGE-DOWNSAMPLED",
            "@size": "20573",
            "@ref": "gr2",
            "@mimetype": "image/jpeg"
          },
          {
            "@category": "standard",
            "@height": "235",
            "@width": "339",
            "@_fa": "true",
            "$": "https://api.elsevier.com/content/object/eid/1-s2.0-S0926860X17302685-gr3.jpg?httpAccept=%2A%2F%2A",
            "@multimediatype": "JPEG image file",
            "@type": "IMAGE-DOWNSAMPLED",
            "@size": "15839",
            "@ref": "gr3",
            "@mimetype": "image/jpeg"
          },
          {
            "@category": "standard",
            "@height": "495",
            "@width": "715",
            "@_fa": "true",
            "$": "https://api.elsevier.com/content/object/eid/1-s2.0-S0926860X17302685-gr4.jpg?httpAccept=%2A%2F%2A",
            "@multimediatype": "JPEG image file",
            "@type": "IMAGE-DOWNSAMPLED",
            "@size": "67576",
            "@ref": "gr4",
            "@mimetype": "image/jpeg"
          },
          {
            "@category": "standard",
            "@height": "543",
            "@width": "715",
            "@_fa": "true",
            "$": "https://api.elsevier.com/content/object/eid/1-s2.0-S0926860X17302685-gr5.jpg?httpAccept=%2A%2F%2A",
            "@multimediatype": "JPEG image file",
            "@type": "IMAGE-DOWNSAMPLED",
            "@size": "48765",
            "@ref": "gr5",
            "@mimetype": "image/jpeg"
          },
          {
            "@category": "standard",
            "@height": "338",
            "@width": "339",
            "@_fa": "true",
            "$": "https://api.elsevier.com/content/object/eid/1-s2.0-S0926860X17302685-gr6.jpg?httpAccept=%2A%2F%2A",
            "@multimediatype": "JPEG image file",
            "@type": "IMAGE-DOWNSAMPLED",
            "@size": "49333",
            "@ref": "gr6",
            "@mimetype": "image/jpeg"
          },
          {
            "@category": "high",
            "@height": "886",
            "@width": "2000",
            "@_fa": "true",
            "$": "https://api.elsevier.com/content/object/eid/1-s2.0-S0926860X17302685-fx1_lrg.jpg?httpAccept=%2A%2F%2A",
            "@multimediatype": "JPEG image file",
            "@type": "IMAGE-HIGH-RES",
            "@size": "157623",
            "@ref": "fx1",
            "@mimetype": "image/jpeg"
          },
          {
            "@category": "high",
            "@height": "152",
            "@width": "122",
            "@_fa": "true",
            "$": "https://api.elsevier.com/content/object/eid/1-s2.0-S0926860X17302685-fx10_lrg.jpg?httpAccept=%2A%2F%2A",
            "@multimediatype": "JPEG image file",
            "@type": "IMAGE-HIGH-RES",
            "@size": "3126",
            "@ref": "fx10",
            "@mimetype": "image/jpeg"
          },
          {
            "@category": "high",
            "@height": "178",
            "@width": "92",
            "@_fa": "true",
            "$": "https://api.elsevier.com/content/object/eid/1-s2.0-S0926860X17302685-fx11_lrg.jpg?httpAccept=%2A%2F%2A",
            "@multimediatype": "JPEG image file",
            "@type": "IMAGE-HIGH-RES",
            "@size": "4174",
            "@ref": "fx11",
            "@mimetype": "image/jpeg"
          },
          {
            "@category": "high",
            "@height": "177",
            "@width": "72",
            "@_fa": "true",
            "$": "https://api.elsevier.com/content/object/eid/1-s2.0-S0926860X17302685-fx12_lrg.jpg?httpAccept=%2A%2F%2A",
            "@multimediatype": "JPEG image file",
            "@type": "IMAGE-HIGH-RES",
            "@size": "3290",
            "@ref": "fx12",
            "@mimetype": "image/jpeg"
          },
          {
            "@category": "high",
            "@height": "170",
            "@width": "128",
            "@_fa": "true",
            "$": "https://api.elsevier.com/content/object/eid/1-s2.0-S0926860X17302685-fx13_lrg.jpg?httpAccept=%2A%2F%2A",
            "@multimediatype": "JPEG image file",
            "@type": "IMAGE-HIGH-RES",
            "@size": "3369",
            "@ref": "fx13",
            "@mimetype": "image/jpeg"
          },
          {
            "@category": "high",
            "@height": "160",
            "@width": "123",
            "@_fa": "true",
            "$": "https://api.elsevier.com/content/object/eid/1-s2.0-S0926860X17302685-fx14_lrg.jpg?httpAccept=%2A%2F%2A",
            "@multimediatype": "JPEG image file",
            "@type": "IMAGE-HIGH-RES",
            "@size": "3323",
            "@ref": "fx14",
            "@mimetype": "image/jpeg"
          },
          {
            "@category": "high",
            "@height": "42",
            "@width": "42",
            "@_fa": "true",
            "$": "https://api.elsevier.com/content/object/eid/1-s2.0-S0926860X17302685-fx2_lrg.jpg?httpAccept=%2A%2F%2A",
            "@multimediatype": "JPEG image file",
            "@type": "IMAGE-HIGH-RES",
            "@size": "726",
            "@ref": "fx2",
            "@mimetype": "image/jpeg"
          },
          {
            "@category": "high",
            "@height": "48",
            "@width": "47",
            "@_fa": "true",
            "$": "https://api.elsevier.com/content/object/eid/1-s2.0-S0926860X17302685-fx3_lrg.jpg?httpAccept=%2A%2F%2A",
            "@multimediatype": "JPEG image file",
            "@type": "IMAGE-HIGH-RES",
            "@size": "1391",
            "@ref": "fx3",
            "@mimetype": "image/jpeg"
          },
          {
            "@category": "high",
            "@height": "42",
            "@width": "42",
            "@_fa": "true",
            "$": "https://api.elsevier.com/content/object/eid/1-s2.0-S0926860X17302685-fx4_lrg.jpg?httpAccept=%2A%2F%2A",
            "@multimediatype": "JPEG image file",
            "@type": "IMAGE-HIGH-RES",
            "@size": "717",
            "@ref": "fx4",
            "@mimetype": "image/jpeg"
          },
          {
            "@category": "high",
            "@height": "42",
            "@width": "40",
            "@_fa": "true",
            "$": "https://api.elsevier.com/content/object/eid/1-s2.0-S0926860X17302685-fx5_lrg.jpg?httpAccept=%2A%2F%2A",
            "@multimediatype": "JPEG image file",
            "@type": "IMAGE-HIGH-RES",
            "@size": "1169",
            "@ref": "fx5",
            "@mimetype": "image/jpeg"
          },
          {
            "@category": "high",
            "@height": "45",
            "@width": "47",
            "@_fa": "true",
            "$": "https://api.elsevier.com/content/object/eid/1-s2.0-S0926860X17302685-fx6_lrg.jpg?httpAccept=%2A%2F%2A",
            "@multimediatype": "JPEG image file",
            "@type": "IMAGE-HIGH-RES",
            "@size": "1386",
            "@ref": "fx6",
            "@mimetype": "image/jpeg"
          },
          {
            "@category": "high",
            "@height": "140",
            "@width": "138",
            "@_fa": "true",
            "$": "https://api.elsevier.com/content/object/eid/1-s2.0-S0926860X17302685-fx7_lrg.jpg?httpAccept=%2A%2F%2A",
            "@multimediatype": "JPEG image file",
            "@type": "IMAGE-HIGH-RES",
            "@size": "3640",
            "@ref": "fx7",
            "@mimetype": "image/jpeg"
          },
          {
            "@category": "high",
            "@height": "185",
            "@width": "128",
            "@_fa": "true",
            "$": "https://api.elsevier.com/content/object/eid/1-s2.0-S0926860X17302685-fx8_lrg.jpg?httpAccept=%2A%2F%2A",
            "@multimediatype": "JPEG image file",
            "@type": "IMAGE-HIGH-RES",
            "@size": "4046",
            "@ref": "fx8",
            "@mimetype": "image/jpeg"
          },
          {
            "@category": "high",
            "@height": "190",
            "@width": "82",
            "@_fa": "true",
            "$": "https://api.elsevier.com/content/object/eid/1-s2.0-S0926860X17302685-fx9_lrg.jpg?httpAccept=%2A%2F%2A",
            "@multimediatype": "JPEG image file",
            "@type": "IMAGE-HIGH-RES",
            "@size": "4148",
            "@ref": "fx9",
            "@mimetype": "image/jpeg"
          },
          {
            "@category": "high",
            "@height": "763",
            "@width": "2167",
            "@_fa": "true",
            "$": "https://api.elsevier.com/content/object/eid/1-s2.0-S0926860X17302685-gr1_lrg.jpg?httpAccept=%2A%2F%2A",
            "@multimediatype": "JPEG image file",
            "@type": "IMAGE-HIGH-RES",
            "@size": "254938",
            "@ref": "gr1",
            "@mimetype": "image/jpeg"
          },
          {
            "@category": "high",
            "@height": "1047",
            "@width": "1500",
            "@_fa": "true",
            "$": "https://api.elsevier.com/content/object/eid/1-s2.0-S0926860X17302685-gr2_lrg.jpg?httpAccept=%2A%2F%2A",
            "@multimediatype": "JPEG image file",
            "@type": "IMAGE-HIGH-RES",
            "@size": "160155",
            "@ref": "gr2",
            "@mimetype": "image/jpeg"
          },
          {
            "@category": "high",
            "@height": "1038",
            "@width": "1500",
            "@_fa": "true",
            "$": "https://api.elsevier.com/content/object/eid/1-s2.0-S0926860X17302685-gr3_lrg.jpg?httpAccept=%2A%2F%2A",
            "@multimediatype": "JPEG image file",
            "@type": "IMAGE-HIGH-RES",
            "@size": "117638",
            "@ref": "gr3",
            "@mimetype": "image/jpeg"
          },
          {
            "@category": "high",
            "@height": "2193",
            "@width": "3167",
            "@_fa": "true",
            "$": "https://api.elsevier.com/content/object/eid/1-s2.0-S0926860X17302685-gr4_lrg.jpg?httpAccept=%2A%2F%2A",
            "@multimediatype": "JPEG image file",
            "@type": "IMAGE-HIGH-RES",
            "@size": "539580",
            "@ref": "gr4",
            "@mimetype": "image/jpeg"
          },
          {
            "@category": "high",
            "@height": "2404",
            "@width": "3167",
            "@_fa": "true",
            "$": "https://api.elsevier.com/content/object/eid/1-s2.0-S0926860X17302685-gr5_lrg.jpg?httpAccept=%2A%2F%2A",
            "@multimediatype": "JPEG image file",
            "@type": "IMAGE-HIGH-RES",
            "@size": "471892",
            "@ref": "gr5",
            "@mimetype": "image/jpeg"
          },
          {
            "@category": "high",
            "@height": "1497",
            "@width": "1500",
            "@_fa": "true",
            "$": "https://api.elsevier.com/content/object/eid/1-s2.0-S0926860X17302685-gr6_lrg.jpg?httpAccept=%2A%2F%2A",
            "@multimediatype": "JPEG image file",
            "@type": "IMAGE-HIGH-RES",
            "@size": "477145",
            "@ref": "gr6",
            "@mimetype": "image/jpeg"
          }
        ]
      },
      "link": {
        "@rel": "abstract",
        "@href": "https://api.elsevier.com/content/abstract/scopus_id/85021286774"
      }
    }
  }
}