{
  "metadata": {
    "title": "Preparation of MCM-41-supported Pd–Pt catalysts with enhanced activity and sulfur resistance for partial hydrogenation of soybean oil-derived biodiesel fuel",
    "authors": "; ; ",
    "journal": "Applied Catalysis A: General",
    "date": "2020-01-25",
    "doi": "10.1016/j.apcata.2019.117351",
    "abstract": "",
    "uri": "https://api.elsevier.com/content/article/pii/S0926860X1930506X",
    "pii": "S0926860X1930506X"
  },
  "fulltext": {
    "full-text-retrieval-response": {
      "scopus-eid": "2-s2.0-85075356238",
      "originalText": "serial JL 271346 291210 291744 291809 31 Applied Catalysis A: General APPLIEDCATALYSISAGENERAL 2019-11-17 2019-11-17 2019-11-25 2019-11-25 2019-12-31T10:25:30 1-s2.0-S0926860X1930506X S0926-860X(19)30506-X S0926860X1930506X 10.1016/j.apcata.2019.117351 S300 S300.1 FULL-TEXT 1-s2.0-S0926860X19X00198 2024-01-01T12:33:10.553292Z 0 0 20200125 2020 2019-11-17T07:31:09.859084Z absattachment articleinfo articlenumber articletitlenorm authfirstinitialnorm authfirstsurnamenorm cid cids contenttype copyright crossmark dateloaded dateloadedtxt datesearch datesort dateupdated dco docsubtype doctype doi eid ewtransactionid hubeid indexeddate issn issnnorm itemstage itemtransactionid itemweight openaccess openarchive pg pgfirst pii piinorm pubdatestart pubdatetxt pubyr sortorder srctitle srctitlenorm srctype ssids alllist content subj subheadings suppl tomb volfirst volissue volumelist webpdf webpdfpagecount yearnav figure table body mmlmath acknowledge affil articletitle auth authfirstini authfull authkeywords authlast grantnumber grantsponsor grantsponsorid highlightsabst orcid primabst ref specialabst 0926-860X 0926860X true 590 590 C Volume 590 23 117351 117351 117351 20200125 25 January 2020 2020-01-25 2020 article fla © 2019 Elsevier B.V. All rights reserved. PREPARATIONMCM41SUPPORTEDPDPTCATALYSTSENHANCEDACTIVITYSULFURRESISTANCEFORPARTIALHYDROGENATIONSOYBEANOILDERIVEDBIODIESELFUEL NARUNGSI A 1 Introduction 2 Material and methods 2.1 Materials 2.2 Preparation of supported Pd–Pt catalysts 2.3 Catalyst characterization 2.4 Transesterification of soybean oil with methanol 2.5 Synthesis of SO-derived H-FAME 2.6 Sulfur tolerance test 2.7 Biodiesel analysis 3 Results and discussion 3.1 Catalyst characterizations 3.2 Catalytic performance of the Pd–Pt/MCM-41 catalysts in the synthesis of H-FAME 3.3 Sulfur tolerance of the Pd, Pt, and Pd–Pt catalysts 3.4 Cold-flow properties of SO-BDF and H-FAME 4 Conclusions Author contributions Acknowledgements References SIMACEK 2009 456 460 P SEARLE 2018 S COMPATIBILITYMIDLEVELBIODIESELBLENDSINVEHICLESININDONESIA MALAYSIA 2015 B B10BIODIESELNOTGOODFORENGINES 2015 MERCEDESTOYOTAISUZUVWB10BIODIESELNOGO 2016 B10BIODIESELIMPLEMENTATIONDELAYEDUNTILFURTHERNOTICEINADEQUATEDATANEWBLENDCOMPLIANT 2015 JAPANAUTOMOBILEMANUFACTURERSASSOCIATIONINCJAMAJAMAPOSITIONSTATEMENTUPDATEFQ02201551JAMAPOSITIONMARKETINTRODUCTIONDIESELFUELCONTAINING5FAMEBLENDCONCENTRATIONS 2016 JAPANAUTOMOBILEMANUFACTURERSASSOCIATIONINCJAMAJAMASUPPLEMENTARYPOSITIONSTATEMENTJAMAPOSITIONUSEDIESELFUELBLENDEDFAMECONCENTRATIONSINEXCESS5 2017 JAMAPOSITIONUSEHIGHFAMEBLENDEDBIODIESELFUEL 2019 OFFICIALSSAYBIODIESELB10JOINB7PUMPSNEXTWEEK 2018 BIODIESEL THAILANDMINISTRYOFENERGY 2018 ALTERNATIVEENERGYDEVELOPMENTPLANAEDP2015MINISTRYENERGY NUMWONG 2013 1431 1438 N THUNYARATCHATANON 2016 8 16 C THUNYARATCHATANON 2018 422 435 C THUNYARATCHATANON 2018 9744 9755 C HONGMANOROM 2017 8202 8209 P NARUNGSI 2018 80 90 A NUMWONG 2012 72 78 N MCARDLE 2011 179 187 S NOHAIR 2004 113 118 B WANG 2011 1201 1205 Y NUMWONG 2012 2117 2120 N HE 2009 223 226 B COOKE 1995 M DETERMINATIONSULFURINANIMALVEGETABLEOILSFIRSTCONFIDENTIALPROJECTREPORTDVD48FORFEDERATIONOILS HE 2013 365 371 T YASUDA 1998 23 27 H HOU 2017 R CATALYTICPROCESSSTUDYSELECTIVEHYDROGENATIONACETYLENE13BUTADIENE YASUDA 1997 43 48 H YU 2012 13 25 Y YASUDA 1997 43 48 H FUJIKAWA 1999 27 33 T WIJESUNDERA 1988 1526 1530 R CHEN 2019 122 131 S YOSHIMURA 2001 303 307 Y BECK 1992 10834 10843 J MARINASTORGA 2003 115 121 N CHUNG 2012 205 210 S NAGATA 2008 216 219 H YUAN 2010 1491 1493 Q MCARDLE 2014 78 86 S YU 2016 185 192 W BENITO 2015 108 115 P THANYARATCHATANON 2016 170 177 C SUPPINO 2016 41 49 R DASILVA 2015 460 468 A MIRONENKO 2017 2 9 R RADNIK 2003 172 177 J ZHANG 2015 5204 5211 G WANG 2010 1646 1649 S LI 2016 148 156 X YASUDA 1999 63 71 H ABRAHAM 1987 855 858 V YOSHIMURA 2007 152 171 Y NSTDA 2016 MTECHFAME NARUNGSIX2020X117351 NARUNGSIX2020X117351XA 2021-11-25T00:00:00.000Z 2021-11-25T00:00:00.000Z http://creativecommons.org/licenses/by-nc-nd/4.0/ © 2019 Elsevier B.V. All rights reserved. 2019-11-16T10:30:24.751Z http://vtw.elsevier.com/data/voc/AddOnTypes/50.7/eoas TRF Thailand Research Fund http://data.elsevier.com/vocabulary/SciValFunders/501100004396 http://sws.geonames.org/1605651 CU Chulalongkorn University http://data.elsevier.com/vocabulary/SciValFunders/501100002873 http://sws.geonames.org/1605651 item S0926-860X(19)30506-X S0926860X1930506X 1-s2.0-S0926860X1930506X 10.1016/j.apcata.2019.117351 271346 2024-01-01T12:33:10.553292Z 2020-01-25 1-s2.0-S0926860X1930506X-main.pdf https://s3.amazonaws.com/prod-ucs-content-store-us-east/content/pii:S0926860X1930506X/MAIN/application/pdf/d32bf24e7d49bfd102a0164b6a0b8f96/main.pdf main.pdf pdf true 5541253 MAIN 11 1-s2.0-S0926860X1930506X-main_1.png https://s3.amazonaws.com/prod-ucs-content-store-us-east/content/pii:S0926860X1930506X/PREVIEW/image/png/f85979ddb9c2daa74c00add4917d1372/main_1.png main_1.png png 52904 849 656 IMAGE-WEB-PDF 1 1-s2.0-S0926860X1930506X-fx1.sml https://s3.amazonaws.com/prod-ucs-content-store-us-east/content/pii:S0926860X1930506X/fx1/THUMBNAIL/image/gif/c6f4a7de853289aad1f4941b6abac693/fx1.sml fx1 fx1.sml sml 663 54 151 IMAGE-THUMBNAIL 1-s2.0-S0926860X1930506X-fx2.sml https://s3.amazonaws.com/prod-ucs-content-store-us-east/content/pii:S0926860X1930506X/fx2/THUMBNAIL/image/gif/277a74231d51a197b4e8fdafb4941e77/fx2.sml fx2 fx2.sml sml 1082 54 138 IMAGE-THUMBNAIL 1-s2.0-S0926860X1930506X-gr5.sml https://s3.amazonaws.com/prod-ucs-content-store-us-east/content/pii:S0926860X1930506X/gr5/THUMBNAIL/image/gif/146033f453d39dafaaeb20d4866f6823/gr5.sml gr5 gr5.sml sml 8812 164 102 IMAGE-THUMBNAIL 1-s2.0-S0926860X1930506X-gr6.sml https://s3.amazonaws.com/prod-ucs-content-store-us-east/content/pii:S0926860X1930506X/gr6/THUMBNAIL/image/gif/2d9941a84a0d1b935d5730a29dfc00fa/gr6.sml gr6 gr6.sml sml 5169 111 219 IMAGE-THUMBNAIL 1-s2.0-S0926860X1930506X-gr7.sml https://s3.amazonaws.com/prod-ucs-content-store-us-east/content/pii:S0926860X1930506X/gr7/THUMBNAIL/image/gif/cca06b57500ff180cf5abe4b4cdd9888/gr7.sml gr7 gr7.sml sml 2801 163 52 IMAGE-THUMBNAIL 1-s2.0-S0926860X1930506X-gr8.sml https://s3.amazonaws.com/prod-ucs-content-store-us-east/content/pii:S0926860X1930506X/gr8/THUMBNAIL/image/gif/2af25f609897068f87609203a82fdd5e/gr8.sml gr8 gr8.sml sml 3044 162 50 IMAGE-THUMBNAIL 1-s2.0-S0926860X1930506X-gr1.sml https://s3.amazonaws.com/prod-ucs-content-store-us-east/content/pii:S0926860X1930506X/gr1/THUMBNAIL/image/gif/a629023fa96d5be8c2b63d5e4385dbd5/gr1.sml gr1 gr1.sml sml 4358 164 90 IMAGE-THUMBNAIL 1-s2.0-S0926860X1930506X-gr2.sml https://s3.amazonaws.com/prod-ucs-content-store-us-east/content/pii:S0926860X1930506X/gr2/THUMBNAIL/image/gif/7bf140ee13162cfc8c093ccb6218bea0/gr2.sml gr2 gr2.sml sml 3355 163 87 IMAGE-THUMBNAIL 1-s2.0-S0926860X1930506X-ga1.sml https://s3.amazonaws.com/prod-ucs-content-store-us-east/content/pii:S0926860X1930506X/ga1/THUMBNAIL/image/gif/8e9f203b0158cedc5bb0894f4c8e4bf0/ga1.sml ga1 true ga1.sml sml 9407 83 219 IMAGE-THUMBNAIL 1-s2.0-S0926860X1930506X-gr3.sml https://s3.amazonaws.com/prod-ucs-content-store-us-east/content/pii:S0926860X1930506X/gr3/THUMBNAIL/image/gif/3a299a3ed9923d4fa82ee6ac0dfa12b9/gr3.sml gr3 gr3.sml sml 3922 162 85 IMAGE-THUMBNAIL 1-s2.0-S0926860X1930506X-gr4.sml https://s3.amazonaws.com/prod-ucs-content-store-us-east/content/pii:S0926860X1930506X/gr4/THUMBNAIL/image/gif/51c0d410c639ae6a5dcfd62ef845ed35/gr4.sml gr4 gr4.sml sml 6796 163 156 IMAGE-THUMBNAIL 1-s2.0-S0926860X1930506X-fx1.jpg https://s3.amazonaws.com/prod-ucs-content-store-us-east/content/pii:S0926860X1930506X/fx1/DOWNSAMPLED/image/jpeg/f63af8ab9e5fd07437760bcc7a139e12/fx1.jpg fx1 fx1.jpg jpg 418 12 34 IMAGE-DOWNSAMPLED 1-s2.0-S0926860X1930506X-fx2.jpg https://s3.amazonaws.com/prod-ucs-content-store-us-east/content/pii:S0926860X1930506X/fx2/DOWNSAMPLED/image/jpeg/ec2be02f1f0c21b5097edf034c30179b/fx2.jpg fx2 fx2.jpg jpg 511 12 31 IMAGE-DOWNSAMPLED 1-s2.0-S0926860X1930506X-gr5.jpg https://s3.amazonaws.com/prod-ucs-content-store-us-east/content/pii:S0926860X1930506X/gr5/DOWNSAMPLED/image/jpeg/48a89ab901f0ff7b2cfcb4977802a9f8/gr5.jpg gr5 gr5.jpg jpg 234844 980 610 IMAGE-DOWNSAMPLED 1-s2.0-S0926860X1930506X-gr6.jpg https://s3.amazonaws.com/prod-ucs-content-store-us-east/content/pii:S0926860X1930506X/gr6/DOWNSAMPLED/image/jpeg/41047ba8a9de853f8cbf300c91ff9861/gr6.jpg gr6 gr6.jpg jpg 48602 334 661 IMAGE-DOWNSAMPLED 1-s2.0-S0926860X1930506X-gr7.jpg https://s3.amazonaws.com/prod-ucs-content-store-us-east/content/pii:S0926860X1930506X/gr7/DOWNSAMPLED/image/jpeg/6579b2ddb2b7f1e45f39f81a63a075f9/gr7.jpg gr7 gr7.jpg jpg 45785 979 312 IMAGE-DOWNSAMPLED 1-s2.0-S0926860X1930506X-gr8.jpg https://s3.amazonaws.com/prod-ucs-content-store-us-east/content/pii:S0926860X1930506X/gr8/DOWNSAMPLED/image/jpeg/0e88d20351f575a9c050d5a8e9099709/gr8.jpg gr8 gr8.jpg jpg 37399 980 303 IMAGE-DOWNSAMPLED 1-s2.0-S0926860X1930506X-gr1.jpg https://s3.amazonaws.com/prod-ucs-content-store-us-east/content/pii:S0926860X1930506X/gr1/DOWNSAMPLED/image/jpeg/48a3acc2311713522b208a53378ae53f/gr1.jpg gr1 gr1.jpg jpg 41507 618 340 IMAGE-DOWNSAMPLED 1-s2.0-S0926860X1930506X-gr2.jpg https://s3.amazonaws.com/prod-ucs-content-store-us-east/content/pii:S0926860X1930506X/gr2/DOWNSAMPLED/image/jpeg/a24a0dbf4886c133cec498b494b10fac/gr2.jpg gr2 gr2.jpg jpg 31979 637 340 IMAGE-DOWNSAMPLED 1-s2.0-S0926860X1930506X-ga1.jpg https://s3.amazonaws.com/prod-ucs-content-store-us-east/content/pii:S0926860X1930506X/ga1/DOWNSAMPLED/image/jpeg/4ca18ee819b49bc7dfa114113fc77a21/ga1.jpg ga1 true ga1.jpg jpg 37629 190 500 IMAGE-DOWNSAMPLED 1-s2.0-S0926860X1930506X-gr3.jpg https://s3.amazonaws.com/prod-ucs-content-store-us-east/content/pii:S0926860X1930506X/gr3/DOWNSAMPLED/image/jpeg/effb4331dcdc93951d7fed4516286162/gr3.jpg gr3 gr3.jpg jpg 41847 650 340 IMAGE-DOWNSAMPLED 1-s2.0-S0926860X1930506X-gr4.jpg https://s3.amazonaws.com/prod-ucs-content-store-us-east/content/pii:S0926860X1930506X/gr4/DOWNSAMPLED/image/jpeg/1ea0253c1327a73efafed0ebcc2c6a10/gr4.jpg gr4 gr4.jpg jpg 31211 356 340 IMAGE-DOWNSAMPLED 1-s2.0-S0926860X1930506X-fx1_lrg.jpg https://s3.amazonaws.com/prod-ucs-content-store-us-east/content/pii:S0926860X1930506X/fx1/HIGHRES/image/jpeg/decea752840cca9596080ae4920f5996/fx1_lrg.jpg fx1 fx1_lrg.jpg jpg 978 54 151 IMAGE-HIGH-RES 1-s2.0-S0926860X1930506X-fx2_lrg.jpg https://s3.amazonaws.com/prod-ucs-content-store-us-east/content/pii:S0926860X1930506X/fx2/HIGHRES/image/jpeg/54ab05c14e80cffa8a53f7b0f3425b38/fx2_lrg.jpg fx2 fx2_lrg.jpg jpg 1048 54 138 IMAGE-HIGH-RES 1-s2.0-S0926860X1930506X-gr5_lrg.jpg https://s3.amazonaws.com/prod-ucs-content-store-us-east/content/pii:S0926860X1930506X/gr5/HIGHRES/image/jpeg/9dd56c8a6ca8299da68239fb1ca2ea11/gr5_lrg.jpg gr5 gr5_lrg.jpg jpg 2346747 4341 2701 IMAGE-HIGH-RES 1-s2.0-S0926860X1930506X-gr6_lrg.jpg https://s3.amazonaws.com/prod-ucs-content-store-us-east/content/pii:S0926860X1930506X/gr6/HIGHRES/image/jpeg/c017d814c09db9ed74d20e88d80cfb0f/gr6_lrg.jpg gr6 gr6_lrg.jpg jpg 347352 1476 2925 IMAGE-HIGH-RES 1-s2.0-S0926860X1930506X-gr7_lrg.jpg https://s3.amazonaws.com/prod-ucs-content-store-us-east/content/pii:S0926860X1930506X/gr7/HIGHRES/image/jpeg/3b257824c880be5228ff25a71d74ee3a/gr7_lrg.jpg gr7 gr7_lrg.jpg jpg 331245 4341 1383 IMAGE-HIGH-RES 1-s2.0-S0926860X1930506X-gr8_lrg.jpg https://s3.amazonaws.com/prod-ucs-content-store-us-east/content/pii:S0926860X1930506X/gr8/HIGHRES/image/jpeg/667994139818698ede97b0d23ecc6887/gr8_lrg.jpg gr8 gr8_lrg.jpg jpg 272589 4341 1342 IMAGE-HIGH-RES 1-s2.0-S0926860X1930506X-gr1_lrg.jpg https://s3.amazonaws.com/prod-ucs-content-store-us-east/content/pii:S0926860X1930506X/gr1/HIGHRES/image/jpeg/cc4110a94b71312ea0fba3645a558252/gr1_lrg.jpg gr1 gr1_lrg.jpg jpg 315128 2740 1508 IMAGE-HIGH-RES 1-s2.0-S0926860X1930506X-gr2_lrg.jpg https://s3.amazonaws.com/prod-ucs-content-store-us-east/content/pii:S0926860X1930506X/gr2/HIGHRES/image/jpeg/f4e4759b5614ef756162fbafe4d86087/gr2_lrg.jpg gr2 gr2_lrg.jpg jpg 238768 2824 1508 IMAGE-HIGH-RES 1-s2.0-S0926860X1930506X-ga1_lrg.jpg https://s3.amazonaws.com/prod-ucs-content-store-us-east/content/pii:S0926860X1930506X/ga1/HIGHRES/image/jpeg/b4d32b13d794855951ec91ad05963be5/ga1_lrg.jpg ga1 true ga1_lrg.jpg jpg 297762 842 2213 IMAGE-HIGH-RES 1-s2.0-S0926860X1930506X-gr3_lrg.jpg https://s3.amazonaws.com/prod-ucs-content-store-us-east/content/pii:S0926860X1930506X/gr3/HIGHRES/image/jpeg/bb86bf93128029d83bf4fa9c773fcda3/gr3_lrg.jpg gr3 gr3_lrg.jpg jpg 355585 2882 1508 IMAGE-HIGH-RES 1-s2.0-S0926860X1930506X-gr4_lrg.jpg https://s3.amazonaws.com/prod-ucs-content-store-us-east/content/pii:S0926860X1930506X/gr4/HIGHRES/image/jpeg/a29c2db4c5d125df53423411f497e19d/gr4_lrg.jpg gr4 gr4_lrg.jpg jpg 258932 1578 1508 IMAGE-HIGH-RES 1-s2.0-S0926860X1930506X-am.pdf https://s3-eu-west-1.amazonaws.com/prod-ucs-content-store-eu-west/content/egi:10JCNX60RSW/MAIN/application/pdf/3695538f78b198ea7ab989455d3676b4/am.pdf https://s3.amazonaws.com/prod-ucs-content-store-us-east/content/egi:10JCNX60RSW/MAIN/application/pdf/3695538f78b198ea7ab989455d3676b4/am.pdf am am.pdf pdf false 3159328 AAM-PDF APCATA 117351 117351 S0926-860X(19)30506-X 10.1016/j.apcata.2019.117351 Elsevier B.V. Fig. 1 Representative N2 adsorption-desorption isotherms of MCM-41 support and the prepared catalysts. Fig. 1 Fig. 2 Representative pore size distributions of original supports and catalysts. Fig. 2 Fig. 3 Representative small-angle diffraction patterns of MCM-41 material and the prepared catalysts. Fig. 3 Fig. 4 Representative wide-diffraction patterns of MCM-41 material and the prepared catalysts. Fig. 4 Fig. 5 Representative TEM micrographs of (A) MCM-41, (B) Pd/MCM-41, (C) Pt/MCM-41, (D) Pd–Pt(3:1)/MCM-41, (E) Pd–Pt(1:1)/MCM-41, and (F) Pd–Pt(1:3)/MCM-41. Fig. 5 Fig. 6 Representative XPS spectra of (A) Pd 3d bands of Pd and Pd–Pt/MCM-41 with various Pd–Pt ratios, and (B) Pt 4f bands of Pt and Pd–Pt/MCM-41 with various Pd–Pt ratios. Fig. 6 Fig. 7 (A) TOFs and (B) trans/cis-C18:1 ratio and (C) degree of oversaturation at different C18:2 conversions for the comparison of the Pd, Pt, and Pd–Pt catalysts with various Pd:Pt ratios. Fig. 7 Fig. 8 (A) C18:2 conversion and (B) trans-C18:1 percentage and (C) degree of oversaturation of hydrogenated soybean-biodiesel after 4 h of reaction time in conditions: 100 °C, 4 bar, 150 ml/min of H2 flow rate, 500 rpm of stirring rate. References: ( ) without additional sulfur; ( ) with additional sulfur. Fig. 8 Table 1 Characteristics of the MCM-41 support and catalysts. Table 1 Catalyst Surface area(m2/g) Pore volume(cm3/g) Metal dispersion(%) Particle size (nm) CO Chem. a TEM b MCM-41 support 1385 1.02 – – – Pd/MCM-41 532 0.32 33 1.5 2.0 Pt/MCM-41 520 0.32 45 1.1 2.4 Pd–Pt(3:1)/MCM-41 623 0.38 16 3.0 3.2 Pd–Pt(1:1)/MCM-41 578 0.36 8.4 6.3 6.9 Pd–Pt(1:3)/MCM-41 621 0.37 24 2.0 3.2 a Determined and calculated by CO pulse chemisorption. b Determined from the transmission electron microscopy (TEM). Table 2 The FAME compositions of H-FAME synthesized by the Pd–Pt/MCM-41 catalysts, in comparison to the reference catalysts. Table 2 C18:0 (wt.%) C18:1 (wt.%) Trans-C18:1 (wt.%) Cis-C18:1 (wt.%) Cis/Trans-C18:1ratio C18:2 (wt.%) C18:3 (wt.%) C18:2 conversion at ∼20 % Feed 3.84 26.01 0.00 26.01 – 51.29 5.12 Pd/MCM-41 4.50 38.39 3.99 34.38 8.6 40.88 1.50 Pt/MCM-41 5.67 35.39 3.45 31.94 9.3 40.96 3.23 Pd–Pt(3:1)/MCM-41 5.35 35.90 4.27 31.63 7.4 41.02 2.72 Pd–Pt(1:1)/MCM-41 4.38 37.38 4.56 32.82 7.2 40.97 2.81 Pd–Pt(1:3)/MCM-41 4.59 36.66 4.11 32.55 7.9 41.03 2.80 C18:2 conversion at ∼90 % Pd/MCM-41 5.81 74.36 20.99 53.36 2.5 5.19 0.05 Pd–Pt(3:1)/MCM-41 9.94 71.09 24.84 46.25 1.9 5.26 0.26 Pd–Pt(1:1)/MCM-41 7.35 73.33 26.03 47.30 1.8 5.20 0.00 Pd–Pt(1:3)/MCM-41 9.67 71.16 22.90 48.26 2.1 5.17 0.05 Table 3 Initial rate and TOF at C18:2 conversion of 20 %, and rate constant (k1 and k2 ) of hydrogenated soybean-biodiesel without and with additional sulfur. Table 3 Catalyst Initial rate(mol⋅g-cat−1 h−1) ΔInitial rate a (%) TOF (h−1) ΔTOF b (%) k1 c (×10−1  h-1g-cat-1) k2 d (×10−1  h-1g-cat-1) Δk e (%) w/o S w/ S w/o S w/ S Pd/MCM-41 0.16 0.13 18.8 36 30 16.7 3.03 1.93 36.3 Pt/MCM-41 0.12 0.04 66.7 20 7 65.0 1.60 0.04 97.5 Pd–Pt(1:1)/MCM-41 0.21 0.14 33.3 195 131 32.8 3.97 3.32 16.4 a ΔInitial rate (%) is calculated from. ( I n i t i a l r a t e w / o S - I n i t i a l r a t e w / S I n i t i a l r a t e w / o S × 100 . b ΔTOF (%) is calculated from. ( T O F w / o S - T O F w / S ) T O F w / o S × 100 . c Rate constant with the SO-BDF without additional sulfur species. d Rate constant with the SO-BDF with additional sulfur species. e Δk (%) is calculated from. ( k 1 - k 2 ) k 1 × 100 . Table 4 Fuel properties of feed and hydrogenated biodiesel without and with sulfur adding after 4 h of reaction (100 °C). Table 4 Cloud Point (°C) Oxidative Stability (h) Without additional sulfur Feed 2 0.6 Pd/MCM-41 18 86 Pt/MCM-41 7 7.5 Pd–Pt(3:1)/MCM-41 19 73 Pd–Pt(1:1)/MCM-41 21 >120* Pd–Pt(1:3)/MCM-41 10 30 With additional sulfur Pd/MCM-41 15 46 Pt/MCM-41 6 5.0 Pd–Pt(1:1)/MCM-41 7 65 * The quality of the hydrogenated biodiesel exceeded the capability of the machine. Preparation of MCM-41-supported Pd–Pt catalysts with enhanced activity and sulfur resistance for partial hydrogenation of soybean oil-derived biodiesel fuel Artita Na Rungsi a Apanee Luengnaruemitchai a b * Nuwong Chollacoop c Shih-Yuan Chen d ** Takehisa Mochizuki d Hideyuki Takagi d Yuji Yoshimura c d a The Petroleum and Petrochemical College, Chulalongkorn University, Soi Chula 12, Phayathai Rd., Pathumwan, Bangkok 10330, Thailand The Petroleum and Petrochemical College Chulalongkorn University Soi Chula 12 Phayathai Rd. Pathumwan Bangkok 10330 Thailand The Petroleum and Petrochemical College, Chulalongkorn University, Soi Chula 12, Phayathai Rd., Pathumwan, Bangkok 10330, Thailand b Center of Excellence in Catalysis for Bioenergy and Renewable Chemicals (CBRC), Chulalongkorn University, Soi Chula 12, Phayathai Rd., Pathumwan, Bangkok 10330, Thailand Center of Excellence in Catalysis for Bioenergy and Renewable Chemicals (CBRC) Chulalongkorn University Soi Chula 12 Phayathai Rd. Pathumwan Bangkok 10330 Thailand Center of Excellence in Catalysis for Bioenergy and Renewable Chemicals (CBRC), Chulalongkorn University, Soi Chula 12, Phayathai Rd., Pathumwan, Bangkok 10330, Thailand c Renewable Energy Laboratory, National Metal and Materials Technology Center (MTEC), 114 Thailand Science Park, Paholyothin Rd., Klong 1, Klong Luang, Pathumthani 12120, Thailand Renewable Energy Laboratory National Metal and Materials Technology Center (MTEC) 114 Thailand Science Park Paholyothin Rd. Klong 1 Klong Luang Pathumthani 12120 Thailand Renewable Energy Laboratory, National Metal and Materials Technology Center (MTEC), 114 Thailand Science Park, Paholyothin Rd., Klong 1, Klong Luang, Pathumthani 12120, Thailand d Energy Catalyst Technology Group, Research Institute for Energy Frontier (RIEF), National Institute of Advanced Industrial Science and Technology (AIST), 16-1 Onogawa, Tsukuba, Ibaraki 305-8559, Japan Energy Catalyst Technology Group Research Institute for Energy Frontier (RIEF) National Institute of Advanced Industrial Science and Technology (AIST) 16-1 Onogawa Tsukuba Ibaraki 305-8559 Japan Energy Catalyst Technology Group, Research Institute for Energy Frontier (RIEF), National Institute of Advanced Industrial Science and Technology (AIST), 16-1 Onogawa, Tsukuba, Ibaraki 305-8559, Japan ⁎ Corresponding author at: The Petroleum and Petrochemical College, Chulalongkorn University, Soi Chula 12, Phayathai Rd., Pathumwan, Bangkok 10330, Thailand. The Petroleum and Petrochemical College Chulalongkorn University Soi Chula 12 Phayathai Rd. Pathumwan Bangkok 10330 Thailand ⁎⁎ Corresponding author. Graphical abstract MCM-41-supported bimetallic Pd-Pt prepared by the incipient wetness impregnation method were applied as hydrotreating catalysts for the partial hydrogenation of soybean oil-derived biodiesel into partially hydrogenated fatty acid methyl esters (H-FAME) for use in high blends. The catalytic performance and sulfur resistance of the prepared Pd-Pt/MCM-41 catalysts were strongly associated with the Pd/Pt weight ratio. When H-FAME was synthesized at 100 °C and 0.4 MPa of H2 for 4 h, the 1 wt.% Pd-Pt/MCM-41 (1:1) showed high hydrogenation activity (turnover frequency of 195 h−1 and rate constant of 3.97 × 10−1 h−1gcat−1) with the lowest degree of oversaturation of 4.8 at high conversion of C18:2, and strong resistance to the sulfur species as a poison added to the feedstock. Their high catalytic performance should be related to the suitable size of bimetallic Pd-Pt nanoparticles with a balance of electronic properties, which is supported by the X-ray diffraction and X-ray photoelectron spectroscopy results. Keywords Partial hydrogenation MCM-41 Noble metals Sulfur tolerance Pd–Pt alloy Rate constant 1 Introduction Fatty acid methyl esters (FAME), also called biodiesel fuel (BDF), have been widely blended with petrodiesel to reduce CO2 emissions in the transport sector [1]. It has been reported that BDF with similar fuel properties, such as cetane number and viscosity, to those of petrodiesel is a safe and secure biofuel for conventional diesel engines if the blending ratio of BDF and petrodiesel is lower than ∼5 vol% [2]. However, recent reports have demonstrated that the conventional diesel engine can be damaged by high blends, which are formulated by low-quality BDF and are generally defined as a blended fuel with a FAME concentration of 7 vol% or higher [3–8]. This is presumably caused by the poor oxidation stability and cold flow property of low-quality BDF, which is caused by improper compositions of FAME and impurities. However, the Ministry of Energy (MoE) of Thailand has targeted high blends as new fuel supply for use in the transport sector. The Alternative Energy Development Plan 2015 (AEDP2015), as legislated by MoE, has attempted to increase the blending ratio of palm oil-derived BDF and petrodiesel to 10 % by 2026 and 20 % by 2036, from the current ratio of 7 % [9–11]. For the safety and security of high blends, it is imperative to develop new technology to upgrade conventional BDFs to high-quality BDFs with suitable fuel and cold-flow properties, which can be formulated with petrodiesel for use in high blends. Hydrogenated FAME (H-FAME), which is a high-quality BDF enriched with monounsaturated FAME (mono-FAME) with high oxidation stability and good cold flow properties can be synthesized by partial hydrogenation of different kinds of conventional BDFs [12–16]. In the synthesis of H-FAME, the polyunsaturated FAME (poly-FAME) is selectively hydrogenated to mono-FAME over the supported metal catalysts, especially Pd, under optimal conditions, which reaction is significantly associated with the structural property and hydrogenation nature of supported metal catalysts [16–18]. Unlike the hydrogenation of fatty acids over the supported Ni catalysts in the industry, the supported noble metals, such as Pd, yield higher hydrogenation activity in the synthesis of H-FAME [12,14,19–21]. However, the deactivation of supported noble metals by a small amount of sulfur species present in the BDF was reported [22]. The nature and concentration of sulfur species naturally presented in the conventional BDFs are strongly related to the feedstock oils or fats. For example, the compositions and impurities of vegetable oils can be significantly varied via soil conditions for growth. A previous report showed that the soybean oils contained around 5–6 ppm of sulfur content [23], which are found in a variety of natural sulfur compounds [24]. The sulfur species originally existed in the commercial BDFs can strongly adsorb on the supported Pd catalysts, which causes catalyst deactivation. Therefore, it is necessary to develop new supported Pd catalysts with high performance and sulfur resistance for the synthesis of H-FAME derived from these sulfur-containing BDFs [25]. The deactivation of supported Pd catalysts during the synthesis of H-FAME can be associated with the adsorption of sulfur on the Pd surfaces through a strong S–Pd bonding which significantly depends on the acidity of the support, and the size and electronic property of Pd particles [26]. Recent studies have attempted to prepare new supported Pd catalysts with enhanced activity and sulfur tolerance level by tuning the structural property of supports and the Pd particles as aforementioned [27]. Yasuda et al. found that the Pd/Pt ratio strongly influenced the activity and the sulfur tolerance of Pd–Pt/USY catalysts for the hydrogenation of tetralin in the presence of dibenzothiophene (DBT) [28]. It is likely that the electronic state of bimetallic Pd–Pt surface can be tuned by its composition and support, resulting in different interactions between the reactant molecules and metal surfaces [29–31]. As a result, the supported bimetallic Pd–Pt catalysts may show higher activity and sulfur resistance than the supported monometallic Pd or Pt catalyst in hydrotreating reactions in the presence of sulfur contamination [32]. In this study, the MCM-41-supported bimetallic Pd–Pt catalysts were prepared by incipient impregnation method and applied in the partial hydrogenation of soybean oil-derived BDF to produce high-quality H-FAME for the first time. The influences of Pd/Pt ratio and structural property on the hydrogenation ability and sulfur resistance of MCM-41-supported Pt-Pd catalysts were discussed. The optimal conditions for preparation of high-quality H-FAME over the prepared catalysts were comprehensive discussed. 2 Material and methods 2.1 Materials The soybean oil used for biodiesel synthesis was bought from the Thai Vegetable Oil Public Company Limited. Methanol (ACS grade) was bought from Honeywell-Burdick and Jackson, and potassium hydroxide (KOH; 85 %) was purchased from RCI Labscan Limited. Other chemical reagents were n-heptane (analytical reagent grade), obtained from Fisher Scientific, and sodium sulphate anhydrous (Na2SO4; 99 %), which was bought from Ajax Finechem Pty. Ltd. Allyl isothiocyanate (CH2CHCH2NCS, Wako Pure Chemical Industries, Ltd.) was used as an additional sulfur compound in the biodiesel feedstock. Pd(NH3)4Cl2×H2O (Pd:40.16 %), and Pt(NH3)4Cl2·xH2O (Pt:56.48 %), purchased from N.E. Chemcat Corporation, Japan, were used as a Pd and Pt precursors, consecutively. The hydrophilic fumed silica (SiO2; > 99.8 %) as a silica source of MCM-41 was purchased from Evonik (SEA) Pte. Ltd. Hexadecyltrimethyl ammonium bromide (C16TAB; >98 %) and sodium hydroxide (NaOH) were purchased from Sigma-Aldrich Chemical Co. 2.2 Preparation of supported Pd–Pt catalysts The mesoporous silica MCM-41 was synthesized by the procedures described in a previous report [17] using fumed silica as a silica source with the assistance of microwave irradiation. Briefly, 0.848 g of C16TAB was dissolved in the mixture of 970 μL of 2 M NaOH solution and 12.571 g of deionized water (DW) under stirring. To this solution, 0.466 g of fumed silica was added under stirring for 1 h. The resulting gel with a composition of Si : 0.3 C16TAB : 0.25 NaOH : 90 H2O was heated at 70 °C for 5 h under microwave irradiation (500 W). The resulting solid was filtered, washed with DW to remove bromine ions, and dried at 105 °C overnight. The template was removed by calcining the as-made MCM-41 at 500 °C for 6 h using a heating rate of 0.5 °C/min in air. A series of MCM-41-supported Pd–Pt catalysts with a total metal loading of 1 wt.% and various Pd:Pt weight ratios of 3:1, 1:1 and 1:3, were prepared by incipient wetness impregnation method. The catalysts are denoted as Pd–Pt(3:1)/MCM-41, Pd–Pt(1:1)/MCM-41, and Pd–Pt(1:3)/MCM-41, the numbers in parentheses represent the weight ratio of Pd/Pt in the prepared catalysts. The precursor solutions were prepared by dissolving Pd(NH3)4Cl2×H2O (Pd:40.16 %) in an appropriate amount of DW. The precursor solutions were then impregnated on the MCM-41 support and aged for 24 h. The impregnated samples were dried for 6 h followed by calcined at 400 °C with a heating rate of 0.5 °C/min for 2 h under an oxygen flow. The Pd-impregnated MCM-41 samples were then impregnated by another precursor solution of Pt(NH3)4Cl2·xH2O (Pt:56.48 %) and aged, dried, and calcined based on the aforementioned procedures. As a result, the MCM-41-supported Pd–Pt catalysts were prepared. The MCM-41-supported monometallic Pt or Pd catalysts with a metal loading of 1 wt.% were prepared by the same procedures and used as reference catalysts. 2.3 Catalyst characterization N2 adsorption/desorption isotherms were employed in a Quantachrome Autosorb-1 MP surface area analyzer. Before the measurement, the samples were outgassed under vacuum at 250 °C overnight to eliminate the volatile species and physically adsorbed water. The specific surface area was calculated by the Brunauer–Emmett–Teller (BET) method. The pore volume was accumulated up to a P/P0 ratio of 0.994. The pore size distribution was analyzed by a Barrett–Joyner–Halenda (BJH) desorption method. Small-angle X-ray diffraction (XRD) patterns were recorded by a Rigaku TTRAX III diffractometer using a Cu Kα radiation (1.5405 Å) as a light source at 50 kV and 300 mA. All of the small-angle XRD patterns were recorded in the 2θ range of 2–10° using a step size of 0.01 and scanning speed of 1° s−1. Wide-angle XRD patterns were collected over a 2θ range of 5–90°, step size of 0.01, and scanning speed of 5° s−1 by a Rigaku X-ray diffractometer with Cu Kα at 40 kV and 30 mA. The pulse CO chemisorption was performed on an Ohkura Riken Model R6015 instrument, which provided the metal dispersion and particle size of the prepared catalysts. The stoichiometry of CO to either Pd or Pt was assumed to be unity. The sample was reduced at 300 °C for 2 h using pure H2 flow (30 mL/min) with a ramp rate of 5 °C/min, and then purged with helium before the measurement. Transmission electron microscopy (TEM) images were acquired by a JEOL JEM-2010 model instrument operated at an accelerating voltage of 120 kV in bright-field mode. The samples were dispersed in ethanol under ultrasonic irradiation. The suspension was carefully dropped on the carbon-coated copper grids for TEM measurement. X-ray photoelectron spectroscopy (XPS) data were measured using a Kratos Axis Ultra DLD photoelectron spectrometer, which provided the chemical environments of the prepared catalysts. All the XPS measurements were carried out under a high vacuum (< 5 × 10−7 torr). A monochromatic Al Kα radiation was used as a light source. The binding energy (BE) was calibrated based on the C 1s band at 284.6 eV. 2.4 Transesterification of soybean oil with methanol First, 180 g of soybean oil (SO) was heated in a 500-mL three-necked round-bottom flask at 60 °C. To start the transesterification, 16.9 g of KOH-methanol mixed solution was added and stirred (300 rpm) at 60 °C for 1 h. The methanol/oil molar ratio was 9 and the KOH/Oil ratio was 1 wt.%. After transesterification, the SO-BDF was obtained by the removal of glycerin and washed with 60 °C DW several times until the pH value was approximately 7, then sealed in a glass bottle with Na2SO4. 2.5 Synthesis of SO-derived H-FAME A stainless-steel semi-batch reaction system was utilized to study the hydrogenation activity and selectivity of the MCM-41-supported Pd–Pt catalysts during the partial hydrogenation of SO-BDF at 100 °C and 0.4 MPa of H2 to form H-FAME. The samples of Pd–Pt impregnated on the MCM-41 were reduced by a H2 flow (100 mL/min) at 200 °C for 2 h using a heating rate of 5 °C/min before use in the catalytic testing. In a typical reaction, a 150 mL of SO-BDF (130.4 g) and 1.3 g of catalysts were mixed in the reactor and purged by N2 twice. The stirring rate was maintained at 500 rpm and the H2 flow at 150 mL/min. At the specific time (every 30 min during the reaction period), a small portion of hydrotreated products was taken and analyzed by a Hewlett-Packard gas chromatograph (GC) 5890 Series II instrument equipped with a DB-WAX fused-silica capillary column (a 0.2-μm film of polyimide coating, 100 m in length, 0.25 mm in internal diameter) and a flame ionization detector (FID). The GC analysis conditions were as follows: the carrier gas was He (99.99 %) with a flow rate of 70 mL/min, and 0.2 μL of each sample was injected under an injector temperature of 200 °C and detector temperature of 230 °C with a split ratio of 75:1. The turnover frequency (TOF) of prepared catalysts in the synthesis of H-FAME was calculated by the following equation [33]: (1) T O F ( h -1 ) = I n i t i a l r a t e ( A m o u n t o f P d ) ( D i s p e r s i o n ) where the initial rate was calculated by dividing the molar fraction of poly-FAME consumed by the catalyst weight and reaction time at a C18:2 conversion of less than 20 %. The dispersion of metal was determined by the CO chemisorption technique. Kinetic analysis of the prepared catalysts in the synthesis of H-FAME was further carried out, where the rate constants for hydrogenation of poly-FAME (included C18:3 and C18:2 components) into mono-FAME (C18:1) were simulated using the equation below. (2) A → k 1 , k 2 B where k1 is the rate constant for the SO-BDF without additional sulfur species and k2 is the rate constant for that with additional sulfur species. The rate equations for hydrogenation of poly-FAME (shortly termed A) are enumerated in Eqs. (3)–(5) based on the first-order irreversible reaction [22]. (3) r A = d A d t = - k 1,2 A (4) ln A - l n A 0 = - k t (5) ln A 0 A = k t A plot of ln(A0/A) as a function of time (t) using the first-order rate equation yields a straight line with a slope of k. The experimental data were then fitted by a linear and polynomial regression function using a Polymath 6.1 software (Polymath Software, Professional use version, SWREG Digital River). The rate constants of k1 and k2 were obtained by Polymath curve fitting with the maximum goodness-of-fit, and the correlation coefficient (R2) should be close to 1. 2.6 Sulfur tolerance test Allyl isothiocyanate (CH2CHCH2NCS) was added in the SO-BDF feedstock to study the sulfur tolerance level of the MCM-41-supported Pd–Pt catalysts in the synthesis of SO-BDF. Note that the sulfur content originally presented in the SO-BDF was 1.2 ppm. The additional 2 ppm allyl isothiocyanate was added to SO-BDF, resulting in a sulfur-containing SO-BDF with a total sulfur content of 3.4 ppm. The procedures for the conversion of sulfur-containing SO-BDF to H-FAME and for the GC analysis were the same as those described in Section 2.5. The influence of sulfur species on the kinetic behavior of prepared catalysts in the synthesis of H-FAME was also studied by fitting the experimental data via Polymath software. 2.7 Biodiesel analysis Oxidative stability was analyzed by a Metrohm 743 Rancimat instrument (Herisau, Switzerland) according to the European standard UNE-EN 14212:2003 method. Air flow (10,000 mL/h) was bubbled to 7.5 g of SO-BDF and corresponding H-FAME at 110 °C using a temperature correction factor (ΔT) of 1.6 °C. The volatile oxidation products, which were formed by oxidation of SO-BDF or H-FAME, were dissolved in a 60 mL DW, of which the conductivity varied over the recording time. The induction time (h) was obtained by extrapolating through the inflection point. The cloud point was measured by an ISL Automatic Cloud & Pour Point Analyzer (CPP 5 Gs) based on the standard method of ASTM D2500. The standard test method ASTM D5453-16e1 was used for analysis of total sulfur content of SO-BDF and H-FAME using Analytik jena Model EA5000 elemental analyzer instrument. 3 Results and discussion 3.1 Catalyst characterizations The N2 adsorption-desorption isotherm of MCM-41 used as a supporting material displayed a Types Ⅳ isotherm with a steep hysteresis loop at P/P0 region of 0.25–0.4, which is a characteristic feature of MCM-41 mesoporous silica materials (Fig. 1 A). The specific BET surface area, total pore volume and pore size diameter of MCM-41 were 1,385 m2/g, 1.02 cm3/g, and 2.5 nm, respectively. For the MCM-41-supported Pd–Pt catalysts (Table 1 ), the specific BET surface areas and total pore volumes decreased, owing to the collapse of the ordering pore structure by the acidic metal precursor solution and calcination treatment. The BJH pore size-distribution plot, which was obtained from the N2 desorption branch (in Fig. 2 ), confirms this finding. However, these MCM-41-supported Pd–Pt catalysts gave higher surface area and pore volume than conventional Pd–Pt/zeolites, probably due to its open pore structure [34]. Fig. 3 shows the small-angle XRD patterns of the MCM-41-supported Pd–Pt catalysts, in comparison to MCM-41 support, which showed strong diffraction peaks of 2D-hexagonal p6mm pore structure at 2.4–6.3° [35,36]. The (100) diffraction peak of MCM-41-supported Pd–Pt catalysts was broadened and slightly shifted to relatively high 2θ region, due the ordering pore structure was collapsed to form randomly-distributed and accessible pores [37]. The wide-angle diffraction patterns of the MCM-41 support, monometallic catalysts, and bimetallic catalysts were also recorded in the 2θ range of 5–90° (Fig. 4 ). Only a broad diffraction peak at 2θ = 25° was observed in Pd/MCM-41 catalyst, corresponding to amorphous silica framework of MCM-41 [17,38]. No diffraction peaks related to Pd species can be found, indicating that the amorphous Pd species was formed in the Pd/MCM-41 catalyst [13,17]. For the Pt/MCM-41 catalyst, several diffraction peaks corresponding to cubic Pt particles can be observed. The representative XRD patterns of the Pd–Pt/MCM-41 with various Pd/Pt ratios show another series of diffraction peaks at 42.5-43°, 49-50°, 70-71°, and 84-83°, which correspond to the (111), (200), (220), and (311) planes, respectively. It is specially noticed that the (111) planes of Pd–Pt(3:1)/MCM-41, Pd–Pt(1:1)/MCM-41, and Pd–Pt(1:3)/MCM-41 can be observed at 42.8°, 42.9°, and 42.7°, respectively, which are located between the monometallic Pt/MCM-41 catalyst (Fig. 4) and monometallic Pd species reported in the literatures [39–42]. This observation indicates that bimetallic Pd–Pt species were existed in the Pd-Pt/MCM-41 catalysts. In Fig. 5 A, the TEM images show that the MCM-41 support contained regular channeling pores of 2D-hexagnoal pore structure, which is consistent with the XRD results. In Fig. 5B and C, the Pt and Pd nanoparticles are clearly observed for the Pd/MCM-41 and Pt/MCM-41 catalysts, whose sizes are close to the results of the CO chemisorption. Regarding the Pd–Pt/MCM-41 catalysts (Fig. 5D–F), relatively large bimetallic Pd–Pt particles dispersed on the SiO2 matrix were observed, and the size analyses were close to the result of CO chemisorption. This indicates that the bimetallic Pd–Pt species tend to form relatively large alloy particles than the monometallic Pt or Pd species. Pd 3d and Pt 4f core-level XPS spectra of monometallic (Pd/MCM-41 and Pt/MCM-41) and bimetallic Pd–Pt/MCM-41 were investigated by the XPS technique. The Pd 3d spectra recorded for mono- and bimetallic catalysts show a typical Pd 3d5/2 and 3d3/2 doublet consisting of two overlapping components, indicating the coexistence of Pd0 and PdO species, which may have formed from the oxidation of Pd0 during the solid exposure to the atmospheric air [13,43,44]. The combined line with the dominant line of metallic state (Pd0) is displayed in Fig. 6 A. The position of the signals with lower binding energy (BE) values in the 334.1–335.8-eV region is assigned to metallic Pd 3d5/2, while the signals with higher BE values in the 339.3–341.1-eV region can be attributed to the metallic Pd 3d3/2 (referred to the National Institute of Standards and Technology database). Monometallic Pd/MCM-41 catalyst presents a BE at 335.7 eV and 341.1 eV for Pd0 3d5/2 and Pd0 3d3/2, respectively. The monometallic Pt/MCM-41 catalyst shows two peaks in the Pt 4f spectrum at BE of 71.9 eV and 75.3 eV, which are consistent with the zero-valence state of Pt metal species for the Pt 4f7/2 and Pt 4f5/2 core levels, respectively. The addition of Pt to Pd/MCM-41 influences the XPS spectra of Pd, i.e., this modification was accompanied by a pronounced shift in both Pd 3d5/2 and Pd 3d3/2 with respect to monometallic Pd/MCM-41 catalyst (Fig. 6A). Meanwhile, the XPS spectra of Pt 4f for bimetallic Pd–Pt/MCM-41 catalysts demonstrate an obvious shift with respect to monometallic analogue Pt/MCM-41 (Fig. 6B). The difference in electronegativity between the Pd and Pt elements is associated with the shift of BE. A higher electronegative element (Pt, 2.28) will draw electrons from the lower electronegative element (Pd, 2.2), then the increased electron density around Pt would cause to the downshift of the d-band center due to partial filling of the Pt 5d bands, and shifts its BE to lower values. Such changes in the electronic state of supported Pd and Pt in bimetallic Pd–Pt system indicated that there is an interaction between Pd and Pt in all Pd–Pt/MCM-41 samples [45–49]. 3.2 Catalytic performance of the Pd–Pt/MCM-41 catalysts in the synthesis of H-FAME The prepared Pd–Pt/MCM-41 catalysts with various Pd:Pt ratios of 3:1, 1:1, and 1:3 were used as the hydrotreating catalysts for synthesis of H-FAME under a mild condition (100 °C, 4 bars of H2 pressure, 500 rpm stirring rate), in comparison to the monometallic Pd or Pt/MCM-41 catalysts. The catalyst weight was held at 1 wt.%. The hydrotreated products were specifically taken during the reaction period of 30−240 min with an interval of 30 min. The main components of SO-BDF were methyl linoleate (C18:2, 51.29 %), cis-methyl oleate (cis-C18:1, 26.01 %), methyl palmitate (C16:0, 11.11 %), methyl linolenate (C18:3, 5.12 %), and methyl stearate (C18:0, 3.84 %), which accounted for approximately 99 % of the total FAME components. In the study, the compositions of C18 components, including C18:0, cis-C18:1, trans-C18:1, C18:2, and C18:3, of H-FAME over the prepared catalysts as a functional of light and deep hydrogenation were first discussed in Table 2 . The light and deep hydrogenation were defined when the C18:2 conversions were reached 20 % and 90 %, respectively. For H-FAME synthesized by the monometallic catalysts, Pd/MCM-41 gave the lowest amount of C18:3 content for the light hydrogenation, whereas the reverse is true for the Pt/MCM-41 catalyst. We particularly interested in the deep hydrogenation of BDF catalyzed by the prepared catalysts into H-FAME enriched with mono-FAME components. In other words, the poly-FAME is selectively hydrogenated to form mono-FAME and its fully hydrogenation to form saturated fatty acid methyl esters should be prevented. Under deep hydrogenation conditions, the Pd/MCM-41 catalyst showed lower activity in the synthesis of H-FAME than the bimetallic Pd–Pt/MCM-41 catalysts, which the C18:3 component can be completely converted to the corresponding hydrogenated analogues. In addition, the Pt/MCM-41 catalyst can only give a 51 % conversion of C18:2 even after the reaction was carried out at 100 ℃ and 0.4 MPa of H2 for 4 h. The highest C18:2 conversion of Pt/MCM-41 catalyst is 51 %, therefore, it cannot be compared under C18:2 conversion of 90 %. The results show that the conversion of C18:3 components increased in an order of Pd–Pt(3:1)/MCM-41 < Pd/MCM-41 ∼ Pd–Pt(1:3)/MCM-41 < Pd–Pt(1:1)/MCM-41, indicating that the Pd–Pt(1:1)/MCM-41 catalyst gives the highest activity in the synthesis of H-FAME. A similar trend is observed for the isomerization of cis-monounsaturated FAME component to trans-form analogues, which is highly associated with the hydrogenation activity of the prepared catalysts. Fig. 7 A shows the TOF determined at a C18:2 conversion of 20 % as a functional of the Pd:Pt weight ratio. A volcano curve was observed, and the Pd–Pt/MCM-41 catalyst with a Pd/Pt weight ratio of 1 yielded the highest TOF value in the synthesis of H-FAME. The TOF value was decreased when the Pd/Pt ratio was less than or greater than 1. Furthermore, the TOF values of the Pd–Pt/MCM-41 catalysts are much higher than those of Pd/MCM-41 and Pt/MCM-41 catalysts. A similar phenomenon is observed for the order of the rate constants for the prepared bimetallic catalysts using SO-BDF as a feedstock with no added sulfur species (k1 ), in the sequence of Pd–Pt(1:1)/MCM-41 > Pd–Pt(1:3)/MCM-41 > Pd–Pt(3:1)/MCM-41 with 3.97, 2.96, and 2.91 (×10−1  h-1gcat -1), respectively. This is likely due to the synergic effect of Pd–Pt alloys in the Pd–Pt/MCM-41 catalyst, which is suitable for the partial hydrogenation of SO-BDF to the corresponding H-FAME. Li et al. [50] reported that the bimetallic Pt-Ni and Pt-Co catalysts gave higher activity in hydrogenation of 2(5 H)-furanone to γ-butyrolactone (GBL) than the monometallic Pt, Ni, and Co catalysts, due to higher binding energy of the reactant molecules. The XPS results showed that the Pd0 3d3/2 and Pd0 3d5/2 BEs of the Pd–Pt/MCM-41 catalysts are observed in the range of 340.3–341.6 eV and 335.0–336.0 eV, respectively, which are lower than the Pd/MCM-41. Moreover, the lower Pt0 4f5/2 (74.4–74.8 eV) and Pt0 4f7/2 (71.0–71.3 eV) BEs of the Pd–Pt/MCM-41 catalysts are observed as compared to the BE of Pt/MCM-41. In other words, the Pd–Pt/MCM-41 catalysts contained bimetallic Pd–Pt alloy nanoparticles, which are supported by the results of XRD patterns. The present study showed that the bimetallic Pd–Pt nanoparticles are highly active for partial hydrogenation of SO-BDF to H-FAME, particularly for the Pd/Pt ratio of 1. To further evaluate the hydrogenation selectivity of the prepared catalysts in the synthesis of H-FAME, the degree of oversaturation (DOO) was calculated by the Eq. (6), where the C18:0 fraction formed was divided by the C18:1 fraction in the H-FAME [17]. (6) D e g r e e o f o v e r s a t u r a t i o n % = C18:0 in product-C18:0 in feed Total amounts of C18:1 in product ×100 Fig. 7C shows the DOO value as a function of Pd/Pt ratio. The S-shaped curve over the prepared catalysts with various Pd/Pt ratios is observed and the Pd–Pt/MCM-41 catalyst with a Pd/Pt ratio of 1 give the lowest DOO values for the C18:2 conversions at 20–90 %. Pd–Pt(1:1)/MCM-41 catalyst with a particle size of 6–7 nm and 3d3/2 and 3d5/2 BEs of 340.3 eV and 335.0 eV, respectively, is apparently good for partial hydrogenation of SO-BDF to H-FAME with higher selectivity toward mono-FAME. It is presumably due to the proper adsorption strength of reactant molecules, such as, C18:2, over the alloy Pd–Pt surfaces. Similarly, the desorption of hydrogenated component, such as C18:1, over the alloy Pd–Pt surfaces can be facilitated. As a result, the Pd–Pt/MCM-41 catalyst with proper Pd/Pt ratio of 1 and suitable particle size give the highest activity and selectivity than other analogues catalysts with higher or lower Pd/Pt ratios and improper particle sizes. 3.3 Sulfur tolerance of the Pd, Pt, and Pd–Pt catalysts It is known that the sulfur species are naturally presented in the SO-BDF, which are poisoned to the noble metal catalysts [51]. The sulfur tolerance level of the prepared catalysts in the synthesis of H-FAME was further studied by adding a small amount of sulfur species to the feedstock. The allyl isothiocyanate (CH2CHCH2NCS, 2 ppm) as a standard sulfur compound in the BDFs reported previously was added into SO-BDF [52]. Fig. 8 A shows the C18:2 conversions over the Pd–Pt/MCM-41 catalyst with a Pd/Pt ratio of 1 in the synthesis of H-FAME at 100 °C and 0.4 MPa H2 for 4 h, in comparison to the monometallic Pd or Pt/MCM-41 catalyst. The results show that the addition of sulfur species has little influence on the activities of Pd/MCM-41 and Pd–Pt/MCM-41 catalysts, corresponding to high sulfur resistance level. However, the activity of Pt/MCM-41 catalyst was dropped significantly, due the serious poison of sulfur species on the Pt surface. Table 3 shows that that the initial rates and TOF values over the Pd/MCM-41 and Pd–Pt/MCM-41 catalysts are slightly decreased when 2 ppm of sulfur was added to the feedstock. The significant decreases in the initial rate (Δinitial rate, 66.7 %) and TOF (ΔTOF, 65 %) was observed for the Pt/MCM-41 catalyst. Similar observation is observed for the decrease of rate constant (Δk) which increased in an order Pd–Pt(1:1)/MCM-41 < Pd/MCM-41 < Pt/MCM-41. It is obvious that the prepared catalyst containing Pd species give higher sulfur tolerance level than that without Pd species [53]. The influence of the sulfur species on the compositions of H-FAME over the prepared catalysts is discussed next. In the synthesis of H-FAME, the cis-monounsaturated FAME can be converted into the trans-form analogue over the prepared catalysts, whose amount is usually proportional to the hydrogenation activity of the catalytically active sites. In this study, we would like to specifically discuss the amount of cis and trans-monounsaturated components in the H-FAME. In general, the cis-form C18:1 plays higher cold-flow properties than the trans-form analogues, because of its lower crystallization point [43]. Table 2 shows that the H-FAME over the Pd–Pt/MCM-41 catalyst with a Pd/Pt ratio of 1 contains highest C18:1 with low C18:0 and C18:2, and no C18:3. However, we found that the trans-C18:1 component in the H-FAME over the Pd–Pt/MCM-41 catalyst with Pd/Pt ratios of 1 are higher than those over the Pd–Pt/MCM-41 with other ratios and the DOO value of Pd–Pt/MCM-41 catalyst is higher than that of other catalysts (Fig. 8C). This is because the deep hydrogenation and the fast isomerization of cis-C18:1 to trans-form analogues can be facilitated over the Pd–Pt/MCM-41 catalyst with a Pd/Pt ratio of 1, due to strong hydrogenation ability of metallic Pd–Pt alloy nanoparticles (Figs. 7B and 8). However, the trans-C18:1 component in the H-FAME over the Pd–Pt/MCM-41 catalyst with a Pd/Pt ratio of 1 can be decreased when a small amount of the sulfur species was added to the feedstock (Fig. 8B). Meanwhile, the DOO value is largely decreased (Fig. 8C). It is probably because the sulfur species are selectively adsorbed on the catalytically active sites with strong hydrogenation activity of the prepared Pd–Pt/MCM-41 catalyst with a Pd/Pt ratio of 1. As a result, the deep hydrogenation and the isomerization of cis-C18:1 to trans-form analogues can be hindered. While, the hydrogenation of C18:3 and C18:2 to C18:1 is not significantly affected by the adsorption of sulfur on the prepared Pd–Pt/MCM-41 catalyst with a Pd/Pt ratio of 1. This suggestion is supported by the higher k2 number as shown in Table 3, corresponding to selective hydrogenation of C18:3 and C18:2 to C18:1 of the SO-BDF with additional sulfur species. The highest k2 value of 3.32 × 10−1  h-1gcat -1 is found over the Pd–Pt/MCM-41 catalyst with a Pd/Pt ratio of 1, which decreases only 16.4 % from the k1 . It is an alternative way to turn the composition of H-FAME over the prepared Pd–Pt catalyst with a Pd/Pt ratio of 1, giving a H-FAME product with desirable FAME composition. 3.4 Cold-flow properties of SO-BDF and H-FAME According to the H-FAME technology developed through Thailand–Japan collaboration SATREPS PJ of “Innovation on production and automotive utilization of biofuels from non-food biomass” (FY2010-FY2015), the cloud point of B100 BDF should be lower than 16 °C in Thailand [54]. In addition, the oxidative stability of biodiesel must meet the specifications of EN14214:2012 standard and Thailand standard, which are 8 h and 10 h, respectively, based on the requirement of Department of Energy Business, MoE of Thailand. Table 4 shows the cold-flow properties of SO-BDF and corresponding H-FAME over the Pd–Pt/MCM-41 catalyst with a Pd/Pt ratio of 1 at 100 °C, and 0.4 MPa of H2 for 4 h, comparison to those of other analogue catalysts, synthesized by using SO-BDF without and with adding allyl isothiocyanate. SO-BDF has good cold-flow properties and poor oxidation stability (0.6 h) due to large amounts of C18:3 and C18:2, which cannot meet the international fuel standards. In contrast, all the H-FAMEs give very high oxidation stability due to low amounts of C18:3 and C18:2, and high amount of C18:1 although the cold-flow properties are slightly higher than 16 °C due to too much amount of C18:0, which is the recommended number for ASEAN countries. It is specifically noted that H-FAME synthesized by the Pd–Pt/MCM-41 catalyst with a Pd/Pt ratio of 1 and using sulfur-containing SO-BDF as the feedstock contains high oxidation stability and suitable cold-flow properties due to its suitable FAME compositions, especially for cis-C18:1 component. The result shows again that H-FAME with good fuel property and cold flow properties can be easily prepared by the Pd–Pt/MCM-41 catalyst with a Pd/Pt ratio of 1 under mild reaction conditions with the assistance of small amount of sulfur species to hinder the strong hydrogenation sites. 4 Conclusions Partial hydrogenation of SO-BDF over the MCM-41-supported bimetallic Pd–Pt catalyst with 1 wt.% of metal loading and a Pd/Pt weight ratio of 1 was studied under a mild condition, resulting in H-FAME, a new type of high-quality BDF, and compared to the reference materials with only monometallic Pd or Pt sites and its analogues with 1 wt.% of metal loading and various Pd/Pt weight ratios other than 1. The Pd–Pt(1:1)/MCM-41 with an optimal Pd/Pt weight ratio showed higher activity in the synthesis of H-FAME and better selectivity toward mono-FAME than the reference materials and analogues. In addition, the Pd–Pt(1:1)/MCM-41 catalyst also gave higher sulfur resistance than those monometallic counterparts, because of a synergic effect of the Pd–Pt alloys with proper particle size. Because the sulfur species were presumably adsorbed on the Pd–Pt sites with high hydrogenation ability, the sulfur-poisoned Pd–Pt/MCM-41 catalyst with suppressed hydrogenation ability was found to yield higher cis-monounsaturated FAME selectivity and lower saturated FAME, which was a new method for synthesis of H-FAME enriched with cis-monounsaturated FAME as the favorite component for high blends with improved oxidative stability and suitable cold flow properties. Author contributions Artita Na Rungsi: Collected the data; Performed the analysis; Manufactured the samples, characterized them, and carried out the experiment; Wrote the paper; Analysed the results, designed the figures, and wrote the manuscript. Apanee Luengnaruemitchai: Conceived and designed the analysis; Conceived of the presented idea, devised the project, the main conceptual ideas, proof outline, and supervised the finding of this work; Contributed data or analysis tools; Provided the instruments for the experiment; Other contribution; Aided in interpreting the results, discussed the results, and contributed to the final manuscript. Nuwong Chollacoop: Contributed data or analysis tools; Provided the instruments for testing the biodiesel properties; Other contribution; Provided critical feedback, discussed the results, and commented on the manuscript. Shih-Yuan Chen: Contributed data or analysis tools; Helped on the catalysts characterizations; Other contribution; Aided in interpreting the results, discussed the results, and contributed to the final manuscript. Takehisa Mochizuki: Contributed data or analysis tools; Helped on the catalysts characterizations; Other contribution; Provided critical feedback and commented on the manuscript. Hideyuki Takagi: Contributed data or analysis tools; Provided the instruments for catalyst characterizations; Other contribution; Provided critical feedback and commented on the manuscript. Yuji Yoshimura: Conceived and designed the analysis; Helped to devise the main conceptual ideas; Other contribution; Aided in interpreting the results, helped shape the research, discussed the results, and contributed to the final manuscript. Acknowledgements The authors acknowledge the financial support provided by the following organizations: Ratchadaphiseksomphot Endowment Fund, Chulalongkorn University; the Thailand Research Fund under Contract No. PHD/0072/2558; and Thailand Research Fund (Senior Research Scholar), Thailand. The authors also extend their sincere thanks to the National Institute of Advanced Industrial Science and Technology (AIST), the Japan International Cooperation Agency (JICA), Japan; the National Metal and Materials Technology Center (MTEC); and PTT Public Company Limited, Thailand for their kind assistance in the instrumental analysis. We would like to thank Editage (www.editage.com) for English language editing. References [1] P. Šimáček D. Kubička G. Šebora M. Pospíšil Fuel 88 2009 456 460 10.1016/j.fuel.2008.10.022 P. Šimáček, D. Kubička, G. Šebora, M. Pospíšil, Hydroprocessed rapeseed oil as a source of hydrocarbon-based biodiesel, Fuel 88 (2009) 456–460. https://doi.org/10.1016/j.fuel.2008. 10.022. [2] S. Searle B. Kristine Compatibility of Mid-Level Biodiesel Blends in Vehicles in Indonesia 2018 The International Council on Clean Transportation Working Paper 2018-08 S. Searle, B. Kristine, Compatibility of mid-level biodiesel blends in vehicles in Indonesia. The International Council on Clean Transportation. Working Paper 2018-08. [3] B.M.W. Malaysia B10 Biodiesel Not Good for Engines 2015 (Accessed 8 June 2015) https://paultan.org/2015/06/08/b10-biodiesel-bmw-malaysia/ BMW Malaysia, B10 biodiesel not good for engines, https://paultan.org/2015/06/08/b10-biodiesel-bmw-malaysia/, 2015 (accessed 8 June 2015). [4] Mercedes, Toyota, Isuzu, VW-B10 Biodiesel No Go 2015 (Accessed 18 June 2015) https://paultan.org/2015/06/18/mercedes-toyota-vw-malaysia-b10-biodiesel/ Mercedes, Toyota, Isuzu, VW-B10 biodiesel no go, https://paultan.org/2015/06/18/mercedes-toyota-vw-malaysia-b10-biodiesel/, 2015 (accessed 18 June 2015). [5] B10 Biodiesel Implementation Delayed Until Further Notice – Inadequate Data That New Blend Is Compliant 2016 (Accessed 20 June 2016) https://paultan.org/2016/06/20/b10-biodieselimplementation-delayed-until-further-notice-inadequate-data-that-new-blend-iscompliant/ B10 biodiesel implementation delayed until further notice – inadequate data that new blend is compliant, https://paultan.org/2016/06/20/b10-biodieselimplementation- delayed-until-further-notice-inadequate-data-that-new-blend-iscompliant/, 2016 (accessed 20 June 2016). [6] Japan Automobile Manufacturers Association, Inc. (JAMA), JAMA Position Statement Update, FQ-02, 2015.5.1, JAMA Position on the Market Introduction of Diesel Fuel Containing &5% FAME Blend Concentrations 2015 (Accessed 1 May 2015) http://www.jama.or.jp/eco/wwfc/pdf/JAMA_FQ_PositionStatement_FAME.pdf Japan Automobile Manufacturers Association, Inc. (JAMA), JAMA Position Statement Update, FQ-02, 2015.5.1, JAMA Position on the Market Introduction of Diesel Fuel Containing >5% FAME Blend Concentrations, http://www.jama.or.jp/eco/wwfc/pdf/JAMA_FQ_Position Statement_FAME.pdf, 2015 (accessed 1 May 2015). [7] Japan Automobile Manufacturers Association, Inc. (JAMA), JAMA supplementary position statement, JAMA Position on the Use of Diesel Fuel Blended with FAME Concentrations in Excess of 5% 2016 (Accessed December 2016) http://www.jama.or.jp/eco/wwfc/pdf/FAME_JAMA_Supplementary_Position_Statement_December2016.pdf Japan Automobile Manufacturers Association, Inc. (JAMA), JAMA supplementary position statement, JAMA Position on the Use of Diesel Fuel Blended with FAME Concentrations in Excess of 5%, http://www.jama.or.jp/eco/wwfc/pdf/FAME_JAMA_Supplementary_Position_ Statement_December2016.pdf, 2016 (accessed December 2016). [8] JAMA: Position on the Use of High FAME-Blended Biodiesel Fuel 2017 (Accessed February 2017) http://www.jamaenglish.jp/asia/news/2017/vol66/article1.html JAMA: Position on the use of high FAME-blended biodiesel fuel, http://www.jamaenglish.jp/asia/news/2017/vol66/article1.html; 2017 [accessed February 2017]. [9] Officials Say Biodiesel B10 to Join B7 at the Pumps Next Week 2019 (Accessed 10 May 2019) https://www.bangkokpost.com/business/news/1674844/officials-say-biodiesel-b10-to-join-b7-at-the-pumps-next-week Officials say biodiesel B10 to join B7 at the pumps next week, https://www.bangkokpost.com /business/news/1674844/officials-say-biodiesel-b10-to-join-b7-at-the-pumps-next-week, 2019 (accessed 10 May 2019). [10] Biodiesel 2018 https://www.krungsri.com/bank/getmedia/aaeda432-6e99-4691-b024-fad9247a0245/IO_ Biodiesel_180820_EN-EX.aspx, (Accessed August 2018) Biodiesel, https://www.krungsri.com/bank/getmedia/aaeda432-6e99-4691-b024-fad9247a02 45/IO_Biodiesel_180820_EN-EX.aspx, 2018 (accessed August 2018). [11] Thailand Ministry of Energy Alternative Energy Development Plan: AEDP2015, Ministry of Energy 2018 (Accessed September 2015) http://www.eppo.go.th/images/POLICY/ENG/AEDP2015ENG.pdf Thailand Ministry of Energy, Alternative Energy Development Plan: AEDP2015, Ministry of energy, http://www.eppo.go.th/images/POLICY/ENG/AEDP2015ENG.pdf, 2018 (accessed September 2015). [12] N. Numwong A. Luengnaruemitchai N. Chollacoop Y. Yoshimura J. Am. Oil Chem. Soc. 90 2013 1431 1438 10.1007/s11746-013-2276-2 N. Numwong, A. Luengnaruemitchai, N. Chollacoop, Y. Yoshimura, Effect of Metal Type on Partial Hydrogenation of Rapeseed Oil-Derived FAME, J. Am. Oil Chem. Soc. 90 (2013) 1431–1438. https://doi.org/10.1007/s11746-013-2276-2. [13] C. Thunyaratchatanon A. Luengnaruemitchai N. Chollacoop Y. Yoshimura Fuel 163 2016 8 16 10.1016/j.fuel.2015.09.026 C. Thunyaratchatanon, A. Luengnaruemitchai, N. Chollacoop, Y. Yoshimura, Catalytic upgrading of soybean oil methyl esters by partial hydrogenation using Pd catalysts, Fuel 163 (2016) 8–16. https://doi.org/10.1016/j.fuel.2015.09.026. [14] C. Thunyaratchatanon A. Luengnaruemitchai N. Chollacoop S.-Y. Chen Y. Yoshimura Fuel Process Technol. 179 2018 422 435 10.1016/j.fuproc.2018.07.014 C. Thunyaratchatanon, A. Luengnaruemitchai, N. Chollacoop, S.-Y. Chen, Y. Yoshimura, Catalytic hydrogenation of soybean oil-derived fatty acid methyl esters over Pd supported on Zr-SBA-15 with various Zr loading levels for enhanced oxidative stability, Fuel Process Technol. 179 (2018) 422–435. https://doi.org/10.1016/j.fuproc.2018.07.014 [15] C. Thunyaratchatanon A. Luengnaruemitchai J. Jakkrapong N. Chollacoop S.-Y. Chen Y. Yoshimura Energy Fuels 32 2018 9744 9755 10.1021/acs.energyfuels.8b01498 C. Thunyaratchatanon, A. Luengnaruemitchai, J. Jakkrapong, N. Chollacoop, S.-Y. Chen, Y. Yoshimura, Influence of alkaline and alkaline earth metal promoters on the catalytic performance of Pd-M/SiO2 (M = Na, Ca, or Ba) catalyst in the partial hydrogenation of soybean oil-derived biodiesel for oxidative stability improvement, Energy Fuels 32 (2018) 9744–9755. https://doi.org/10.1021/acs.energyfuels.8b01498. [16] P. Hongmanorom A. Luengnaruemitchai N. Chollacoop Y. Yoshimura Energy Fuels 31 2017 8202 8209 10.1021/acs.energyfuels.7b00832 P. Hongmanorom, A. Luengnaruemitchai, N. Chollacoop, Y. Yoshimura, Effect of the Pd/MCM-41 pore size on the catalytic activity and cis-trans selectivity for partial hydrogenation of canola biodiesel, Energy Fuels 31 (2017) 8202–8209. https://doi.org/10.1021/acs.energyfuels.7b00832. [17] A. Na Rungsi A. Luengnaruemitchai S. Wongkasemjit N. Chollachoop S.-Y. Chen Y. Yoshimura Appl. Catal. A Gen. 562 2018 80 90 10.1016/j.apcata.2018.06.028 A. Na Rungsi, A. Luengnaruemitchai, S. Wongkasemjit, N. Chollachoop, S.-Y. Chen, Y. Yoshimura, Influence of silica sources on structural property and activity of Pd supported on mesoporous MCM-41 synthesized with an aid of microwave heating for partial hydrogenation of soybean methyl esters, Appl. Catal. A: Gen. 562 (2018) 80–90. https://doi.org/10.1016/j. apcata.2018.06.028. [18] N. Numwong A. Luengnaruemitchai N. Chollacoop Y. Yoshimura Appl. Catal. A Gen. 441–442 2012 72 78 10.1016/j.apcata.2012.07.020 N. Numwong, A. Luengnaruemitchai, N. Chollacoop, Y. Yoshimura, Effect of SiO2 pore size on partial hydrogenation of rapeseed oil-derived FAMEs, Appl. Catal. A: Gen. 441–442 (2012) 72–78. https://doi.org/10.1016/j.apcata.2012.07.020. [19] S. McArdle S. Girish J.J. Leahy T. Curtin J. Mol. Catal. A Chem. 351 2011 179 187 10.1016/j.molcata.2011.10.004 S. McArdle, S. Girish, J.J. Leahy, T. Curtin, Selective hydrogenation of sunflower oil over noble metal catalysts, J. Mol. Catal. A: Chem. 351 (2011) 179–187. https://doi.org/10.1016/j. molcata.2011.10.004. [20] B. Nohair C. Especel P. Marécot C. Montassier L.C. Hoang J. Barbier C. R. Chim. 7 2004 113 118 10.1016/j.crci.2003.10.012 B. Nohair, C. Especel, P. Marécot, C. Montassier, L.C. Hoang, J. Barbier, Selective hydrogenation of sunflower oil over supported precious metals, C. R. Chim. 7 (2004) 113–118. https://doi.org/10.1016/j.crci.2003.10.012. [21] Y. Wang Y. Fang T. He H. Hu J. Wu Catal. Commun. 12 2011 1201 1205 10.1016/j.catcom.2011.04.010 Y. Wang, Y. Fang, T. He, H. Hu, J. Wu, Hydrodeoxygenation of dibenzofuran over noble metal supported on mesoporous zeolite, Catal. Commun. 12 (2011) 1201–1205. https://doi.org/ 10.1016/j.catcom.2011.04.010. [22] N. Numwong A. Luengnaruemitchai N. Chollacoop Y. Yoshimura J. Am. Oil Chem. Soc. 89 2012 2117 2120 10.1007/s11746-012-2112-0 N. Numwong, A. Luengnaruemitchai, N. Chollacoop, Y. Yoshimura, Effect of support acidic properties on sulfur tolerance of Pd catalysts for partial hydrogenation of rapeseed oil-derived FAME, J. Am. Oil. Chem. Soc. 89 (2012) 2117–2120. https://doi.org/10.1007/s11746-012-2112-0. [23] B.B. He J.H. Van Gerpen J.C. Thompson Appl. Eng. Agric. 25 2009 223 226 10.13031/2013.26319 B.B. He, J.H. Van Gerpen, J.C. Thompson, Sulfur content in selected oils and fats and their corresponding methyl esters, Appl. Eng. Agric. 25 (2009) 223–226. https://doi.org/10.13031 /2013.26319. [24] M.V. Cooke J.B. Rossell P.J. Farnell The Determination of Sulfur in Animal and Vegetable Oils, First Confidential Project Report DVD 48 for the Federation of Oils 1995 Seeds and Fats Associations Ltd: Food RA Leatherhead M.V. Cooke, J.B. Rossell, P.J. Farnell, The determination of sulfur in animal and vegetable oils, First confidential project report DVD 48 for The Federation of Oils, Seeds and Fats Associations Ltd: Food RA Leatherhead, 1995. [25] T. He Y. Wanga P. Miaoa J. Lia J. Wua Y. Fang Fuel 106 2013 365 371 10.1016/j.fuel.2012.12.025 T. He, Y. Wanga, P. Miaoa, J. Lia, J. Wua, Y. Fang, Hydrogenation of naphthalene over noble metal supported on mesoporous zeolite in the absence and presence of sulfur, Fuel 106 (2013) 365–371. https://doi.org/10.1016/j.fuel.2012.12.025. [26] H. Yasuda N. Matsubayashi T. Sato Y. Yoshimura Catal. Lett. 54 1998 23 27 10.1023/A:1019079906043 H. Yasuda, N. Matsubayashi, T. Sato, Y. Yoshimura, Confirmation of sulfur tolerance of bimetallic Pd–Pt supported on highly acidic USY zeolite by EXAFS, Catal. Lett. 54 (1998) 23–27. https://doi.org/10.1023/A:1019079906043. [27] R. Hou Catalytic and Process Study of the Selective Hydrogenation of Acetylene and 1,3-Butadiene 2017 Springer Nature Singapore Pte Ltd Singapore R. Hou, Catalytic and Process Study of the Selective Hydrogenation of Acetylene and 1,3-Butadiene, Springer Nature Singapore Pte Ltd, Singapore, 2017. [28] H. Yasuda Y. Yoshimura Catal. Lett. 46 1997 43 48 10.1023/A:1019021224505 H. Yasuda, Y. Yoshimura, Hydrogenation of tetralin over zeolite-supported Pd-Pt catalysts in the presence of dibenzothiophene, Catal. Lett. 46 (1997) 43–48. https://doi.org/10.1023/A: 1019021224505. [29] Y. Yu B. Fonfé A. Jentys G.L. Haller J.A.R. van Veen O.Y. Gutiérrez J.A. Lercher J. Catal. 292 2012 13 25 10.1016/j.jcat.2012.03.018 Y. Yu, B. Fonfé, A. Jentys, G.L. Haller, J.A.R. van Veen, O.Y. Gutiérrez, J.A. Lercher, Bimetallic Pt–Pd/silica–alumina hydrotreating catalysts. Part II: Structure-activity correlations in the hydrogenation of tetralin in the presence of dibenzothiophene and quinoline, J. Catal. 292 (2012) 13–25. https://doi.org/10.1016/j.jcat.2012.03.018. [30] H. Yasuda Y. Yoshimura Catal. Lett. 46 1997 43 48 10.1023/A:101902122 H. Yasuda, Y. Yoshimura, Hydrogenation of tetralin over zeolite-supported Pd-Pt catalysts in the presence of dibenzothiophene, Catal. Lett. 46 (1997) 43–48. https://doi.org/10.1023/ A:101902122. [31] T. Fujikawa K. Tsuji H. Mizuguchi D. Godo K. Idei K. Usui Catal. Lett. 63 1999 27 33 10.1023/A:101900880 T. Fujikawa, K. Tsuji, H. Mizuguchi, D. Godo, K. Idei, K. Usui, EXAFS characterization of bimetallic Pt–Pd/SiO2-Al2O3 catalysts for hydrogenation of aromatics in diesel fuel, Catal. Lett. 63 (1999) 27–33. https://doi.org/10.1023/A:101900880. [32] R.C. Wijesundera R.G. Ackmana V. Abraham J.M. deMan J. Am. Oil Chem. Soc. 65 1988 1526 1530 10.1007/BF02898321 R.C. Wijesundera, R.G. Ackmana, V. Abraham, J.M. deMan, Determination of sulfur contents of vegetable and marine oils by ion chromatography and indirect ultraviolet photometry of their combustion products, J. Am. Oil. Chem. Soc. 65 (1988) 1526–1530. https://doi.org/10.1007 /BF02898321. [33] S.-Y. Chen L. Attanatho A. Chang T. Laosombut M. Nishi T. Mochizuki H. Takagi C.-M. Yang Y. Abe M. Toba N. Chollacoop Y. Yoshimura Catal. Today 332 2019 122 131 10.1016/j.cattod.2018.05.039 S.-Y. Chen, L. Attanatho, A. Chang, T. Laosombut, M. Nishi, T. Mochizuki, H. Takagi, C.-M. Yang, Y. Abe, M. Toba, N. Chollacoop, Y. Yoshimura, Profiling and catalytic upgrading of commercial palm oil-derived biodiesel fuels for high-blend fuels, Catal. Today. 332 (2019) 122–131. https://doi.org/10.1016/j.cattod.2018.05.039. [34] Y. Yoshimura H. Yasuda T. Sato N. Kijima T. Kameoka Appl. Catal. A Gen. 207 2001 303 307 Y. Yoshimura, H. Yasuda, T. Sato, N. Kijima, T. Kameoka, Sulfur-tolerant Pd-Pt/Yb-USY zeolite catalysts used to reformulate diesel oils, Appl. Catal. A: Gen. 207 (2001) 303–307. [35] J.S. Beck J.C. Vartuli W.J. Roth M.E. Leonowicz C.T. Kresge K.D. Schmitt C.T.-W. Chu D.H. Olson E.W. Sheppard S.B. McCullen J.B. Higgins J.L. Schlenker J. Am. Chem. Soc. 114 1992 10834 10843 10.1021/ja00053a020 J.S. Beck, J.C. Vartuli, W.J. Roth, M.E. Leonowicz, C.T. Kresge, K.D. Schmitt, C.T.-W. Chu, D.H. Olson, E.W. Sheppard, S.B. McCullen, J.B. Higgins, J.L. Schlenker, A New Family of Mesoporous Molecular Sieves Prepared with Liquid Crystal Templates, J. Am. Chem. Soc. 114 (1992) 10834–10843. https://doi.org/10.1021/ja00053a020. [36] N. Marín-Astorga G. Pecchi J.L.G. Fierro P. Reyes Catal. Lett. 91 2003 115 121 10.1023/B:CATL.0000006326.07708.04 N. Marín-Astorga, G. Pecchi, J.L.G. Fierro, P. Reyes, Alkynes hydrogenation over Pd-supported catalysts, Catal. Lett. 91 (2003) 115–121. https://doi.org/10.1023/B:CATL.000000 6326.07708.04. [37] S.-H. Chung Y.-M. Park M.-S. Kim K.-Y. Lee Catal. Today 185 2012 205 210 10.1016/j.cattod.2011.08.011 S.-H. Chung, Y.-M. Park, M.-S. Kim, K.-Y. Lee, The effect of textural properties on the hydrogenation of succinic acid using palladium incorporated mesoporous supports, Catal. Today 185 (2012) 205–210. https://doi.org/10.1016/j.cattod.2011.08.011. [38] H. Nagata N. Hirao T. Onoki Y. Baba Y. Yamasaki A. Nakahira J. Ceram. Soc. Jpn. 116 2008 216 219 10.2109/jcersj2.116.216 H. Nagata, N. Hirao, T. Onoki, Y. Baba, Y. Yamasaki, A. Nakahira, Synthesis and characterization of bulky mesoporous silica Pd-MCM-41, J. Ceram. Soc. Jpn. 116 (2008) 216–219. https://doi.org/10.2109/jcersj2.116.216. [39] Q. Yuan Z. Zhou J. Zhuang X. Wang Chem. Commun. 46 2010 1491 1493 10.1039/b922792j Q.Yuan, Z. Zhou, J. Zhuang, X. Wang, Pd–Pt random alloy nanocubes with tunable compositions and their enhanced electrocatalytic activities, Chem. Commun. 46 (2010) 1491-1493. https://doi.org/ 10.1039/b922792j. [40] S. McArdle J.J. Leahya T. Curtina D. Tanner Appl. Catal. A Gen. 474 2014 78 86 10.1016/j.apcata.2013.08.033 S. McArdle, J.J. Leahya, T. Curtina, D. Tanner, Hydrogenation of sunflower oil over Pt–Ni bimetallic supported catalysts: Preparation, characterization and catalytic activity, Appl. Catal. A: Gen. 474 (2014) 78–86. https://doi.org/10.1016/j.apcata.2013.08.033. [41] W. Yu Y.-P. Hsu C.-S. Tan Appl. Catal. B: Environment 196 2016 185 192 10.1016/j.apcatb.2016.05.034 W. Yu, Y.-P. Hsu, C.-S. Tan, Synthesis of rhodium-platinum bimetallic catalysts supported on SBA-15 by chemical fluid deposition for the hydrogenation of terephthalic acid in water. Appl. Catal. B: Environment 196 (2016) 185–192. https://doi.org/10.1016/j.apcatb.2016.05.034. [42] P. Benito M. Gregori S. Andreoli G. Fornasari F. Ospitali S. Millefanti M.S. Avila T.F. Garetto S. Albonetti Catal. Today 246 2015 108 115 10.1016/j.cattod.2014.08.027 P. Benito, M. Gregori, S. Andreoli, G. Fornasari, F. Ospitali, S. Millefanti, M.S. Avila, T.F. Garetto, S. Albonetti, Pd–Cu interaction in Pd/Cu-MCM-41 catalysts: Effect of silica source and metal content, Catal. Today 246 (2015) 108–115. https://doi.org/10.1016/j.cattod.2014. 08.027. [43] C. Thanyaratchatanon J. Jitjamnong A. Luengnaruemitchai N. Numwong N. Chollacoop Y. Yoshimura Appl. Catal. A Gen. 520 2016 170 177 10.1016/j.apcata.2016.04.019 C. Thanyaratchatanon, J. Jitjamnong, A. Luengnaruemitchai, N. Numwong, N. Chollacoop, Y. Yoshimura, Influence of Mg modifier on cis-trans selectivity in partial hydrogenation of biodiesel using different metal types, Appl. Catal. A: Gen. 520 (2016) 170–177. https://doi.org/10.1016/j.apcata.2016.04.019. [44] R.S. Suppino R. Landers A.J.G. Cobo Appl. Catal. A Gen. 525 2016 41 49 10.1016/j.apcata.2016.06.038 R.S. Suppino, R. Landers, A.J.G. Cobo, Influence of noble metals (Pd, Pt) on the performance of Ru/Al2O3 based catalysts for toluene hydrogenation in liquid phase, Appl. Catal. A: Gen. 525 (2016) 41–49. https://doi.org/10.1016/j.apcata.2016.06.038. [45] A.G.M. da Silva H.V. Fajardo R. Balzer L.F.D. Probst A.S.P. Lovón J.J. Lovón-Quinrana G.P. Valença W.H. Schreine P.A. Robles-Dutenhefner J. Power Sources 285 2015 460 468 10.1016/j.jpowsour.2015.03.066 A.G.M. da Silva, H.V. Fajardo, R. Balzer, L.F.D. Probst, A.S.P. Lovón, J.J. Lovón-Quinrana, G.P. Valença, W.H. Schreine, P.A. Robles-Dutenhefner, Versatile and efficient catalysts for energy and environmental processes: Mesoporous silica containing Au, Pd and Au-Pd, J. Power Sources 285 (2015) 460–468. https://doi.org/10.1016/j.jpowsour.2015.03.066. [46] R.M. Mironenko O.B. Belskaya T.I. Gulyaeva M.V. Trenikhin A.I. Nizovskii A.V. Kalinkin V.I. Bukhriyarov A.V. Lavrenov V.A. Lilholobov Catal. Today 279 2017 2 9 10.1016/j.cattod.2016.07.022 R.M. Mironenko, O.B. Belskaya, T.I. Gulyaeva, M.V. Trenikhin, A.I. Nizovskii, A.V. Kalinkin, V.I. Bukhriyarov, A.V. Lavrenov, V.A. Lilholobov, Liquid-phase hydrogenation of benzaldehyde over Pd-Ru/C catalysts:Synergistic effect between supported metals, Catal. Today 279 (2017) 2–9. https://doi.org/10.1016/j.cattod.2016.07.022. [47] J. Radnik C. Mohr P. Claus Phys. Chem. Chem. Phys. 5 2003 172 177 10.1039/b207290d J. Radnik, C. Mohr, P. Claus, On the origin of binding energy shifts of core levels of supported gold nanoparticles and dependence of pretreatment and material synthesis, Phys. Chem. Chem. Phys. 5 (2003) 172–177. https://doi.org/10.1039/b207290d. [48] G. Zhang C. Huang R. Qin Z. Shao D. An W. Zhang Y. Wang J. Mater. Chem. A Mater. Energy Sustain. 3 2015 5204 5211 10.1039/c4ta06076h G. Zhang, C. Huang, R. Qin, Z. Shao, D. An, W. Zhang, Y. Wang, Uniform Pd–Pt alloy nanoparticles supported on graphite nanoplatelets with high electrocatalytic activity towards methanol oxidation, J. Mater. Chem, A. 3 (2015) 5204-5211. https://doi.org/10.1039/c4ta06076h. [49] S. Wang F. Yang S.P. Jiang S. Chen S. Wang Electrochem. Commun. 12 2010 1646 1649 10.1016/j.elecom.2010.09 S. Wang, F. Yang, S. P. Jiang, S. Chen, S. Wang, Tuning the electrocatalytic activity of Pt nanoparticles on carbon nanotubes via surface functionalization, Electrochem. commun. 12 (2010) 1646-1649. https://doi.org/ 10.1016/j.elecom.2010.09. [50] X. Li W. Wan S. Kattel J.G. Chen T. Wang J. Catal. 344 2016 148 156 10.1016/j.jcat.2016.09.027 X. Li, W. Wan, S. Kattel, J.G. Chen, T. Wang, Selective hydrogenation of biomass-derived 2(5H)-furanone over Pt-Ni and Pt-Co bimetallic catalysts: From model surfaces to supported catalysts, J. Catal. 344 (2016) 148–156. https://doi.org/10.1016/j.jcat.2016.09.027. [51] H. Yasuda T. Sato Y. Yoshimura Catal. Today 50 1999 63 71 10.1016/S0920-5861(98)00463-5 H. Yasuda, T. Sato, Y. Yoshimura, Influence of the acidity of USY zeolite on the sulfur tolerance of Pd-Pt catalysts for aromatic hydrogenation, Catal. Today 50 (1999) 63–71. https://doi.org/10.1016/S0920-5861(98)00463-5. [52] V. Abraham J.M. deMan J. Am. Oil Chem. Soc. 64 1987 855 858 10.1007/BF02641492 V. Abraham, J.M. deMan, Effect of some isothiocyanates on the hydrogenation of canola oil, J. Am. Oil Chem. Soc. 64 (1987) 855–858. https://doi.org/10.1007/BF02641492. [53] Y. Yoshimura M. Toba T. Matsui M. Harada Y. Ichihashi K.K. Bando H. Yasuda H. Ishihara Y. Morita T. Kameoka Appl. Catal. A Gen. 322 2007 152 171 10.1016/j.apcata.2007.01.009 Y. Yoshimura, M. Toba, T. Matsui, M. Harada, Y. Ichihashi, K.K. Bando, H. Yasuda, H. Ishihara, Y. Morita, T. Kameoka, Active phases and sulfur tolerance of bimetallic Pd-Pt catalysts used for hydrotreatment, Appl. Catal. A: Gen. 322 (2007) 152–171. https://doi.org/10.1016/j.apcata.2007.01.009. [54] NSTDA MTEC_HFAME 2016 (Accessed 31 March 2016) https://www.nstda.or.th/nac/2016/wp-content/uploads/2016/02/MTEC_HFAME.pdf NSTDA, MTEC_HFAME, https://www.nstda.or.th/nac/2016/wp-content/uploads/2016/02/ MTEC_HFAME.pdf, 2016 (accessed 31 March 2016).",
      "scopus-id": "85075356238",
      "coredata": {
        "eid": "1-s2.0-S0926860X1930506X",
        "dc:description": "MCM-41-supported bimetallic Pd-Pt prepared by the incipient wetness impregnation method were applied as hydrotreating catalysts for the partial hydrogenation of soybean oil-derived biodiesel into partially hydrogenated fatty acid methyl esters (H-FAME) for use in high blends. The catalytic performance and sulfur resistance of the prepared Pd-Pt/MCM-41 catalysts were strongly associated with the Pd/Pt weight ratio. When H-FAME was synthesized at 100 °C and 0.4 MPa of H2 for 4 h, the 1 wt.% Pd-Pt/MCM-41 (1:1) showed high hydrogenation activity (turnover frequency of 195 h−1 and rate constant of 3.97 × 10−1 h−1gcat−1) with the lowest degree of oversaturation of 4.8 at high conversion of C18:2, and strong resistance to the sulfur species as a poison added to the feedstock. Their high catalytic performance should be related to the suitable size of bimetallic Pd-Pt nanoparticles with a balance of electronic properties, which is supported by the X-ray diffraction and X-ray photoelectron spectroscopy results.",
        "openArchiveArticle": "false",
        "prism:coverDate": "2020-01-25",
        "openaccessUserLicense": null,
        "prism:aggregationType": "Journal",
        "prism:url": "https://api.elsevier.com/content/article/pii/S0926860X1930506X",
        "dc:creator": [
          {
            "@_fa": "true",
            "$": "Na Rungsi, Artita"
          },
          {
            "@_fa": "true",
            "$": "Luengnaruemitchai, Apanee"
          },
          {
            "@_fa": "true",
            "$": "Chollacoop, Nuwong"
          },
          {
            "@_fa": "true",
            "$": "Chen, Shih-Yuan"
          },
          {
            "@_fa": "true",
            "$": "Mochizuki, Takehisa"
          },
          {
            "@_fa": "true",
            "$": "Takagi, Hideyuki"
          },
          {
            "@_fa": "true",
            "$": "Yoshimura, Yuji"
          }
        ],
        "link": [
          {
            "@_fa": "true",
            "@rel": "self",
            "@href": "https://api.elsevier.com/content/article/pii/S0926860X1930506X"
          },
          {
            "@_fa": "true",
            "@rel": "scidir",
            "@href": "https://www.sciencedirect.com/science/article/pii/S0926860X1930506X"
          }
        ],
        "dc:format": "application/json",
        "openaccessType": null,
        "pii": "S0926-860X(19)30506-X",
        "prism:volume": "590",
        "articleNumber": "117351",
        "prism:publisher": "Elsevier B.V.",
        "dc:title": "Preparation of MCM-41-supported Pd–Pt catalysts with enhanced activity and sulfur resistance for partial hydrogenation of soybean oil-derived biodiesel fuel",
        "prism:copyright": "© 2019 Elsevier B.V. All rights reserved.",
        "openaccess": "0",
        "prism:issn": "0926860X",
        "dcterms:subject": [
          {
            "@_fa": "true",
            "$": "Partial hydrogenation"
          },
          {
            "@_fa": "true",
            "$": "MCM-41"
          },
          {
            "@_fa": "true",
            "$": "Noble metals"
          },
          {
            "@_fa": "true",
            "$": "Sulfur tolerance"
          },
          {
            "@_fa": "true",
            "$": "Pd–Pt alloy"
          },
          {
            "@_fa": "true",
            "$": "Rate constant"
          }
        ],
        "openaccessArticle": "false",
        "prism:publicationName": "Applied Catalysis A: General",
        "openaccessSponsorType": null,
        "prism:pageRange": "117351",
        "pubType": "fla",
        "prism:coverDisplayDate": "25 January 2020",
        "prism:doi": "10.1016/j.apcata.2019.117351",
        "prism:startingPage": "117351",
        "dc:identifier": "doi:10.1016/j.apcata.2019.117351",
        "openaccessSponsorName": null
      },
      "objects": {
        "object": [
          {
            "@category": "thumbnail",
            "@height": "54",
            "@width": "151",
            "@_fa": "true",
            "$": "https://api.elsevier.com/content/object/eid/1-s2.0-S0926860X1930506X-fx1.sml?httpAccept=%2A%2F%2A",
            "@multimediatype": "GIF image file",
            "@type": "IMAGE-THUMBNAIL",
            "@size": "663",
            "@ref": "fx1",
            "@mimetype": "image/gif"
          },
          {
            "@category": "thumbnail",
            "@height": "54",
            "@width": "138",
            "@_fa": "true",
            "$": "https://api.elsevier.com/content/object/eid/1-s2.0-S0926860X1930506X-fx2.sml?httpAccept=%2A%2F%2A",
            "@multimediatype": "GIF image file",
            "@type": "IMAGE-THUMBNAIL",
            "@size": "1082",
            "@ref": "fx2",
            "@mimetype": "image/gif"
          },
          {
            "@category": "thumbnail",
            "@height": "164",
            "@width": "102",
            "@_fa": "true",
            "$": "https://api.elsevier.com/content/object/eid/1-s2.0-S0926860X1930506X-gr5.sml?httpAccept=%2A%2F%2A",
            "@multimediatype": "GIF image file",
            "@type": "IMAGE-THUMBNAIL",
            "@size": "8812",
            "@ref": "gr5",
            "@mimetype": "image/gif"
          },
          {
            "@category": "thumbnail",
            "@height": "111",
            "@width": "219",
            "@_fa": "true",
            "$": "https://api.elsevier.com/content/object/eid/1-s2.0-S0926860X1930506X-gr6.sml?httpAccept=%2A%2F%2A",
            "@multimediatype": "GIF image file",
            "@type": "IMAGE-THUMBNAIL",
            "@size": "5169",
            "@ref": "gr6",
            "@mimetype": "image/gif"
          },
          {
            "@category": "thumbnail",
            "@height": "163",
            "@width": "52",
            "@_fa": "true",
            "$": "https://api.elsevier.com/content/object/eid/1-s2.0-S0926860X1930506X-gr7.sml?httpAccept=%2A%2F%2A",
            "@multimediatype": "GIF image file",
            "@type": "IMAGE-THUMBNAIL",
            "@size": "2801",
            "@ref": "gr7",
            "@mimetype": "image/gif"
          },
          {
            "@category": "thumbnail",
            "@height": "162",
            "@width": "50",
            "@_fa": "true",
            "$": "https://api.elsevier.com/content/object/eid/1-s2.0-S0926860X1930506X-gr8.sml?httpAccept=%2A%2F%2A",
            "@multimediatype": "GIF image file",
            "@type": "IMAGE-THUMBNAIL",
            "@size": "3044",
            "@ref": "gr8",
            "@mimetype": "image/gif"
          },
          {
            "@category": "thumbnail",
            "@height": "164",
            "@width": "90",
            "@_fa": "true",
            "$": "https://api.elsevier.com/content/object/eid/1-s2.0-S0926860X1930506X-gr1.sml?httpAccept=%2A%2F%2A",
            "@multimediatype": "GIF image file",
            "@type": "IMAGE-THUMBNAIL",
            "@size": "4358",
            "@ref": "gr1",
            "@mimetype": "image/gif"
          },
          {
            "@category": "thumbnail",
            "@height": "163",
            "@width": "87",
            "@_fa": "true",
            "$": "https://api.elsevier.com/content/object/eid/1-s2.0-S0926860X1930506X-gr2.sml?httpAccept=%2A%2F%2A",
            "@multimediatype": "GIF image file",
            "@type": "IMAGE-THUMBNAIL",
            "@size": "3355",
            "@ref": "gr2",
            "@mimetype": "image/gif"
          },
          {
            "@category": "thumbnail",
            "@height": "83",
            "@width": "219",
            "@_fa": "true",
            "$": "https://api.elsevier.com/content/object/eid/1-s2.0-S0926860X1930506X-ga1.sml?httpAccept=%2A%2F%2A",
            "@multimediatype": "GIF image file",
            "@type": "IMAGE-THUMBNAIL",
            "@size": "9407",
            "@ref": "ga1",
            "@mimetype": "image/gif"
          },
          {
            "@category": "thumbnail",
            "@height": "162",
            "@width": "85",
            "@_fa": "true",
            "$": "https://api.elsevier.com/content/object/eid/1-s2.0-S0926860X1930506X-gr3.sml?httpAccept=%2A%2F%2A",
            "@multimediatype": "GIF image file",
            "@type": "IMAGE-THUMBNAIL",
            "@size": "3922",
            "@ref": "gr3",
            "@mimetype": "image/gif"
          },
          {
            "@category": "thumbnail",
            "@height": "163",
            "@width": "156",
            "@_fa": "true",
            "$": "https://api.elsevier.com/content/object/eid/1-s2.0-S0926860X1930506X-gr4.sml?httpAccept=%2A%2F%2A",
            "@multimediatype": "GIF image file",
            "@type": "IMAGE-THUMBNAIL",
            "@size": "6796",
            "@ref": "gr4",
            "@mimetype": "image/gif"
          },
          {
            "@category": "standard",
            "@height": "12",
            "@width": "34",
            "@_fa": "true",
            "$": "https://api.elsevier.com/content/object/eid/1-s2.0-S0926860X1930506X-fx1.jpg?httpAccept=%2A%2F%2A",
            "@multimediatype": "JPEG image file",
            "@type": "IMAGE-DOWNSAMPLED",
            "@size": "418",
            "@ref": "fx1",
            "@mimetype": "image/jpeg"
          },
          {
            "@category": "standard",
            "@height": "12",
            "@width": "31",
            "@_fa": "true",
            "$": "https://api.elsevier.com/content/object/eid/1-s2.0-S0926860X1930506X-fx2.jpg?httpAccept=%2A%2F%2A",
            "@multimediatype": "JPEG image file",
            "@type": "IMAGE-DOWNSAMPLED",
            "@size": "511",
            "@ref": "fx2",
            "@mimetype": "image/jpeg"
          },
          {
            "@category": "standard",
            "@height": "980",
            "@width": "610",
            "@_fa": "true",
            "$": "https://api.elsevier.com/content/object/eid/1-s2.0-S0926860X1930506X-gr5.jpg?httpAccept=%2A%2F%2A",
            "@multimediatype": "JPEG image file",
            "@type": "IMAGE-DOWNSAMPLED",
            "@size": "234844",
            "@ref": "gr5",
            "@mimetype": "image/jpeg"
          },
          {
            "@category": "standard",
            "@height": "334",
            "@width": "661",
            "@_fa": "true",
            "$": "https://api.elsevier.com/content/object/eid/1-s2.0-S0926860X1930506X-gr6.jpg?httpAccept=%2A%2F%2A",
            "@multimediatype": "JPEG image file",
            "@type": "IMAGE-DOWNSAMPLED",
            "@size": "48602",
            "@ref": "gr6",
            "@mimetype": "image/jpeg"
          },
          {
            "@category": "standard",
            "@height": "979",
            "@width": "312",
            "@_fa": "true",
            "$": "https://api.elsevier.com/content/object/eid/1-s2.0-S0926860X1930506X-gr7.jpg?httpAccept=%2A%2F%2A",
            "@multimediatype": "JPEG image file",
            "@type": "IMAGE-DOWNSAMPLED",
            "@size": "45785",
            "@ref": "gr7",
            "@mimetype": "image/jpeg"
          },
          {
            "@category": "standard",
            "@height": "980",
            "@width": "303",
            "@_fa": "true",
            "$": "https://api.elsevier.com/content/object/eid/1-s2.0-S0926860X1930506X-gr8.jpg?httpAccept=%2A%2F%2A",
            "@multimediatype": "JPEG image file",
            "@type": "IMAGE-DOWNSAMPLED",
            "@size": "37399",
            "@ref": "gr8",
            "@mimetype": "image/jpeg"
          },
          {
            "@category": "standard",
            "@height": "618",
            "@width": "340",
            "@_fa": "true",
            "$": "https://api.elsevier.com/content/object/eid/1-s2.0-S0926860X1930506X-gr1.jpg?httpAccept=%2A%2F%2A",
            "@multimediatype": "JPEG image file",
            "@type": "IMAGE-DOWNSAMPLED",
            "@size": "41507",
            "@ref": "gr1",
            "@mimetype": "image/jpeg"
          },
          {
            "@category": "standard",
            "@height": "637",
            "@width": "340",
            "@_fa": "true",
            "$": "https://api.elsevier.com/content/object/eid/1-s2.0-S0926860X1930506X-gr2.jpg?httpAccept=%2A%2F%2A",
            "@multimediatype": "JPEG image file",
            "@type": "IMAGE-DOWNSAMPLED",
            "@size": "31979",
            "@ref": "gr2",
            "@mimetype": "image/jpeg"
          },
          {
            "@category": "standard",
            "@height": "190",
            "@width": "500",
            "@_fa": "true",
            "$": "https://api.elsevier.com/content/object/eid/1-s2.0-S0926860X1930506X-ga1.jpg?httpAccept=%2A%2F%2A",
            "@multimediatype": "JPEG image file",
            "@type": "IMAGE-DOWNSAMPLED",
            "@size": "37629",
            "@ref": "ga1",
            "@mimetype": "image/jpeg"
          },
          {
            "@category": "standard",
            "@height": "650",
            "@width": "340",
            "@_fa": "true",
            "$": "https://api.elsevier.com/content/object/eid/1-s2.0-S0926860X1930506X-gr3.jpg?httpAccept=%2A%2F%2A",
            "@multimediatype": "JPEG image file",
            "@type": "IMAGE-DOWNSAMPLED",
            "@size": "41847",
            "@ref": "gr3",
            "@mimetype": "image/jpeg"
          },
          {
            "@category": "standard",
            "@height": "356",
            "@width": "340",
            "@_fa": "true",
            "$": "https://api.elsevier.com/content/object/eid/1-s2.0-S0926860X1930506X-gr4.jpg?httpAccept=%2A%2F%2A",
            "@multimediatype": "JPEG image file",
            "@type": "IMAGE-DOWNSAMPLED",
            "@size": "31211",
            "@ref": "gr4",
            "@mimetype": "image/jpeg"
          },
          {
            "@category": "high",
            "@height": "54",
            "@width": "151",
            "@_fa": "true",
            "$": "https://api.elsevier.com/content/object/eid/1-s2.0-S0926860X1930506X-fx1_lrg.jpg?httpAccept=%2A%2F%2A",
            "@multimediatype": "JPEG image file",
            "@type": "IMAGE-HIGH-RES",
            "@size": "978",
            "@ref": "fx1",
            "@mimetype": "image/jpeg"
          },
          {
            "@category": "high",
            "@height": "54",
            "@width": "138",
            "@_fa": "true",
            "$": "https://api.elsevier.com/content/object/eid/1-s2.0-S0926860X1930506X-fx2_lrg.jpg?httpAccept=%2A%2F%2A",
            "@multimediatype": "JPEG image file",
            "@type": "IMAGE-HIGH-RES",
            "@size": "1048",
            "@ref": "fx2",
            "@mimetype": "image/jpeg"
          },
          {
            "@category": "high",
            "@height": "4341",
            "@width": "2701",
            "@_fa": "true",
            "$": "https://api.elsevier.com/content/object/eid/1-s2.0-S0926860X1930506X-gr5_lrg.jpg?httpAccept=%2A%2F%2A",
            "@multimediatype": "JPEG image file",
            "@type": "IMAGE-HIGH-RES",
            "@size": "2346747",
            "@ref": "gr5",
            "@mimetype": "image/jpeg"
          },
          {
            "@category": "high",
            "@height": "1476",
            "@width": "2925",
            "@_fa": "true",
            "$": "https://api.elsevier.com/content/object/eid/1-s2.0-S0926860X1930506X-gr6_lrg.jpg?httpAccept=%2A%2F%2A",
            "@multimediatype": "JPEG image file",
            "@type": "IMAGE-HIGH-RES",
            "@size": "347352",
            "@ref": "gr6",
            "@mimetype": "image/jpeg"
          },
          {
            "@category": "high",
            "@height": "4341",
            "@width": "1383",
            "@_fa": "true",
            "$": "https://api.elsevier.com/content/object/eid/1-s2.0-S0926860X1930506X-gr7_lrg.jpg?httpAccept=%2A%2F%2A",
            "@multimediatype": "JPEG image file",
            "@type": "IMAGE-HIGH-RES",
            "@size": "331245",
            "@ref": "gr7",
            "@mimetype": "image/jpeg"
          },
          {
            "@category": "high",
            "@height": "4341",
            "@width": "1342",
            "@_fa": "true",
            "$": "https://api.elsevier.com/content/object/eid/1-s2.0-S0926860X1930506X-gr8_lrg.jpg?httpAccept=%2A%2F%2A",
            "@multimediatype": "JPEG image file",
            "@type": "IMAGE-HIGH-RES",
            "@size": "272589",
            "@ref": "gr8",
            "@mimetype": "image/jpeg"
          },
          {
            "@category": "high",
            "@height": "2740",
            "@width": "1508",
            "@_fa": "true",
            "$": "https://api.elsevier.com/content/object/eid/1-s2.0-S0926860X1930506X-gr1_lrg.jpg?httpAccept=%2A%2F%2A",
            "@multimediatype": "JPEG image file",
            "@type": "IMAGE-HIGH-RES",
            "@size": "315128",
            "@ref": "gr1",
            "@mimetype": "image/jpeg"
          },
          {
            "@category": "high",
            "@height": "2824",
            "@width": "1508",
            "@_fa": "true",
            "$": "https://api.elsevier.com/content/object/eid/1-s2.0-S0926860X1930506X-gr2_lrg.jpg?httpAccept=%2A%2F%2A",
            "@multimediatype": "JPEG image file",
            "@type": "IMAGE-HIGH-RES",
            "@size": "238768",
            "@ref": "gr2",
            "@mimetype": "image/jpeg"
          },
          {
            "@category": "high",
            "@height": "842",
            "@width": "2213",
            "@_fa": "true",
            "$": "https://api.elsevier.com/content/object/eid/1-s2.0-S0926860X1930506X-ga1_lrg.jpg?httpAccept=%2A%2F%2A",
            "@multimediatype": "JPEG image file",
            "@type": "IMAGE-HIGH-RES",
            "@size": "297762",
            "@ref": "ga1",
            "@mimetype": "image/jpeg"
          },
          {
            "@category": "high",
            "@height": "2882",
            "@width": "1508",
            "@_fa": "true",
            "$": "https://api.elsevier.com/content/object/eid/1-s2.0-S0926860X1930506X-gr3_lrg.jpg?httpAccept=%2A%2F%2A",
            "@multimediatype": "JPEG image file",
            "@type": "IMAGE-HIGH-RES",
            "@size": "355585",
            "@ref": "gr3",
            "@mimetype": "image/jpeg"
          },
          {
            "@category": "high",
            "@height": "1578",
            "@width": "1508",
            "@_fa": "true",
            "$": "https://api.elsevier.com/content/object/eid/1-s2.0-S0926860X1930506X-gr4_lrg.jpg?httpAccept=%2A%2F%2A",
            "@multimediatype": "JPEG image file",
            "@type": "IMAGE-HIGH-RES",
            "@size": "258932",
            "@ref": "gr4",
            "@mimetype": "image/jpeg"
          },
          {
            "@category": "standard",
            "@_fa": "true",
            "$": "https://api.elsevier.com/content/object/eid/1-s2.0-S0926860X1930506X-am.pdf?httpAccept=%2A%2F%2A",
            "@multimediatype": "Acrobat PDF file",
            "@type": "AAM-PDF",
            "@size": "3159328",
            "@ref": "am",
            "@mimetype": "application/pdf"
          }
        ]
      },
      "link": {
        "@rel": "abstract",
        "@href": "https://api.elsevier.com/content/abstract/scopus_id/85075356238"
      }
    }
  }
}