{
  "metadata": {
    "title": "An overview of Fischer-Tropsch Synthesis: XtL processes, catalysts and reactors",
    "authors": "; ; ",
    "journal": "Applied Catalysis A: General",
    "date": "2020-11-25",
    "doi": "10.1016/j.apcata.2020.117740",
    "abstract": "",
    "uri": "https://api.elsevier.com/content/article/pii/S0926860X20303331",
    "pii": "S0926860X20303331"
  },
  "fulltext": {
    "full-text-retrieval-response": {
      "scopus-eid": "2-s2.0-85092689777",
      "originalText": "serial JL 271346 291210 291744 291809 31 Applied Catalysis A: General APPLIEDCATALYSISAGENERAL 2020-07-15 2020-07-15 2020-10-16 2020-10-16 2020-11-24T12:52:21 1-s2.0-S0926860X20303331 S0926-860X(20)30333-1 S0926860X20303331 10.1016/j.apcata.2020.117740 S300 S300.1 FULL-TEXT 1-s2.0-S0926860X20X00184 2024-01-01T12:34:28.416125Z 0 0 20201125 2020 2020-07-15T15:24:11.087935Z absattachment articleinfo articlenumber articletitlenorm authfirstinitialnorm authfirstsurnamenorm cid cids contenttype copyright crossmark dateloaded dateloadedtxt datesearch datesort dateupdated dco docsubtype doctype doi eid ewtransactionid hubeid indexeddate issn issnnorm itemstage itemtransactionid itemweight openaccess openarchive pg pgfirst pii piinorm pubdatestart pubdatetxt pubyr sortorder srctitle srctitlenorm srctype ssids alllist content subj subheadings suppl tomb volfirst volissue volumelist webpdf webpdfpagecount yearnav figure table body mmlmath acknowledge affil articletitle auth authfirstini authfull authkeywords authlast grantsponsor highlightsabst orcid primabst ref specialabst 0926-860X 0926860X true 608 608 C Volume 608 14 117740 117740 117740 20201125 25 November 2020 2020-11-25 2020 article rev © 2020 Elsevier B.V. All rights reserved. OVERVIEWFISCHERTROPSCHSYNTHESISXTLPROCESSESCATALYSTSREACTORS MARTINELLI M 1 Introduction 2 Summary of techno-economic analyses 2.1 Biomass-to-Liquids process 2.2 CBtL technologies 2.3 GBtL technologies 2.4 PtL technologies 2.5 XtL direction 3 Fischer Tropsch Synthesis 3.1 Catalysts 3.2 Mechanism 3.3 Tuning 3.4 CO2 hydrogenation 4 FT reactor development 4.1 Slurry bubble column reactors 4.2 Fluidized-bed reactors 4.3 Fixed-bed and compact reactors 5 Concluding remarks Data availability statement Acknowledgments References DIMITRIOU 2018 160 175 I BUTTERMAN 2009 9030 9037 H ZHANG 2018 5358 5373 Y FLOUDAS 2012 24 51 C LIU 2011 415 437 G AIL 2016 267 286 S SANSANIWAL 2017 23 43 S SIKARWAR 2017 189 248 V ROY 2013 864 868 P BALIBAN 2013 3381 3406 R PRINS 2005 375 389 M AGBLEVOR 1995 635 640 F DEMIRBAS 2006 285 289 A FERMOSO 2009 926 932 J LAPUERTA 2008 828 837 M LICKRASTINA 2011 3352 3358 A OUDSHOORN 2010 1605 1615 A WRIGHT 2010 S2 S10 M SHEMFE 2015 361 372 M KANDARAMATHHARI 2015 1234 1244 T VARGASLARRETA 2017 B BARON 2018 6506 6511 Y CLOUGH 2017 1153 1164 B GURUNG 2015 144 152 M YAO 2018 1108 1117 Y VERMA 2014 895 905 A DJOMO 2017 184 193 A BUKOSKI 2017 e0169096 J GALIDAKI 2016 1940 1966 G YANG 2014 80 87 S USLU 2008 1206 1223 A PRINS 2005 M THERMODYNAMICANALYSISBIOMASSGASIFICATIONTORREFACTIONPHDTHESIS SRINIVASAN 2015 495 505 P SAQIB 2018 357 363 N MUNIR 2009 1413 1418 S MOLINO 2016 10 25 A SIKARWAR 2016 2939 2977 V SEIFKAR 2015 N ZHU 2011 Y TECHNOECONOMICANALYSISFORTHERMOCHEMICALCONVERSIONBIOMASSLIQUIDFUELS JACOBS 2010 95 124 G CONVERSIONBIOMASSLIQUIDFUELSCHEMICALSVIAFISCHERTROPSCHSYNTHESISROUTE VANSTEEN 2008 655 666 E NAQI 2019 A TRIPPE 2011 2169 2184 F MAITLIS 2013 P GREENERFISCHERTROPSCHPROCESSESFORFUELSFEEDSTOCKS TOCK 2010 1838 1854 L JIN 2009 142 173 H TRIPPE 2013 577 586 F SWANSON 2010 S11 S19 R TIJMENSEN 2002 129 152 M LIU 2011 1989 1996 G WU 2010 261 267 C TARKA 2009 T DONG 1997 971 977 Y SCHMIDT 2018 127 140 P PETERS 2001 191 194 A VAZQUEZ 2018 235 246 F SCHMIDT 2016 P KONIG 2015 289 297 D FASIHI 2016 243 268 M SCHULZKE 2017 254 259 T HILLESTAD 2018 1431 1451 M ZHENG 2017 1427 1436 Y BAUMEISTER 2016 139 160 C HAMILTON 2011 239 265 J ROUTLEDGEHANDBOOKMAJOREVENTSINECONOMYHYSTORY INREPARKERRWHAPLESEDS KING 1985 146 154 F ENGER 2012 437 488 B SCHULZ 1999 3 12 H SHAFER 2019 259 W BOTES 2013 112 120 F BUKUR 2004 41 48 D MA 2004 99 106 W OBRIEN 2000 173 178 R RYTTER 2011 801 810 E ELIASON 1999 229 243 S GNANAMANI 2013 1123 1131 M PENDYALA 2014 1704 1716 V LUO 2007 133 140 M PENDYALA 2010 131 139 V RIBEIRO 2010 7895 7903 M XIONG 2015 687 696 H TAO 2006 1061 1066 Z CHEN 2019 92 96 Q NAKHAEIPOUR 2008 201 208 A LI 2001 197 205 S DING 2013 21 27 M GAUBE 2008 126 132 J LI 2016 2574 2584 J LUO 2003 171 181 M OBRIEN 1995 1 15 R CHONCO 2013 283 294 Z CHONCO 2013 363 373 Z OBRIEN 2004 1 6 R STORSAETER 2005 343 347 S KHODAKOV 2007 1692 1744 A KANG 2011 1464 1471 S VANDELOOSDRECHT 2013 430 436 J YU 2006 43 47 Z DLAMINI 2015 3000 3011 M RAROGPILECKA 2006 207 210 W TREPANIER 2009 193 202 M BEZEMER 2006 3956 3964 G WANG 2006 47 52 T LILLEBO 2013 730 736 A WERNER 2014 2881 2888 S ATASHI 2010 952 961 H GNANAMANI 2017 115 123 M DEKLERK 2015 6438 6453 A DENOTTER 2013 445 450 J LIU 2007 945 949 Y ZHAO 2012 265 272 Y GNANAMANI 2009 37 44 M WANG 2001 3 9 Y COOK 2014 275 286 K JACOBS 2007 177 191 G BORG 2009 70 77 O DIEHL 2009 11 24 F RAHMATI 2018 118 128 M VANDERLAAN 1999 255 318 G FISCHER 1923 193 197 F FISCHER 1923 276 285 F FISCHER 1926 97 104 F FISCHER 1927 1 5 F FISCHER 1927 165 167 F KUMMER 1948 3632 3643 J KUMMER 1951 564 569 J KUMMER 1953 5177 5183 J HALL 1957 2983 2989 W KOKES 1957 2989 2996 R BLYHOLDER 1960 470 472 G BRADY 1980 6181 6182 R BRADY 1981 R TAU 1991 127 140 L DAVIS 2001 157 166 B SHI 2001 202 208 B CHENG 2008 6082 6086 J GAUBE 2008 60 68 J MOODLEY 2009 102 110 D GAUBE 2010 120 125 J KOIZUMI 2011 138 145 N VANSANTEN 2013 17038 17063 R YANG 2013 37 49 J TODIC 2014 32 39 B TODIC 2015 386 B ZHANG 2016 76 84 R CHEN 2017 8061 8071 W CHEN 2018 136 140 W RYTTER 2018 1024 1034 E PONEC 1978 151 171 V CAO 2011 55 69 D OJEDA 2010 287 297 M ZHUO 2013 217 226 M RAJE 1996 52 131 A CATALYSIS HENRICIOLIVE 1984 7 13 G HALL 1960 1027 1037 W VANSTEEN 1999 309 320 E WESTSTRATE 2016 29210 29224 C NIEUWENHUYS 1983 307 336 B NAHM 1997 283 290 T KISKINOVA 1988 379 396 M SIEBEN 1993 B KISKINOVA 1981 584 594 M ZHAO 2011 956 960 X CANNING 1986 L811 L816 N DWYER 1979 249 257 D ARAY 1998 L532 L541 Y LEMIRE 2004 103 114 C ROCHANA 2011 681 688 P RIEDEL 1999 201 213 T ZHUO 2009 8357 8365 M DAVIS 2009 25 33 B BALLARD 1983 393 397 D HENRICIOLIVE 1982 111 115 G PETERSEN 2019 794 A TENG 2006 39 50 B SONAL 2019 1263 1272 P VISCONTI 2011 786 800 C BOTES 2006 7415 7426 F BOTES 2009 10439 10447 F ROTHAEMEL 1997 79 84 M BOTES 2008 471 491 F SUN 2017 29222 29235 Y GNANAMANI 2011 1420 1428 M YANG 2013 508 517 J LOZANOBLANCO 2007 489 496 G MA 2011 127 153 W DAS 2007 289 314 T MA 2014 2157 2166 W MA 2014 158 166 W MA 2011 756 765 W MA 2020 137 145 W DAS 2005 1430 1439 T MOUSAVI 2015 57 66 S WANG 2009 96 107 H PATZLAFF 2002 381 394 J YATES 1991 168 173 I VANDERLAAN 2000 39 53 G SHI 2011 178 183 B QI 2019 551 Y GOLESTAN 2017 407 418 S BOTES 2008 F KINETICSELECTIVITYMODELLINGIRONBASEDLOWTEMPERATUREFISCHERTROPSCHSYTHESISPHDTHESIS TODIC 2013 669 679 B TODIC 2017 859 874 B NIKBAKHT 2018 209 216 N SCHULZ 1999 91 107 H OJEDA 2010 19761 19770 M MIRZAEI 2015 701 710 A WANG 2003 195 213 Y KEYVANLOO 2015 33 47 K SCHULZ 1988 293 304 H BEPARI 2019 872 S ZENNARO 2000 309 319 R VISCONTI 2016 685 695 C BHATELIA 2010 707 712 T LEDAKOWICZ 1985 1043 1049 S SELVATICO 2016 544 560 D AZADI 2015 137 143 P STORSAETER 2006 2051 2063 S QI 2014 145 161 Y VANBELLEGHEM 2016 149 162 J MOUSAVI 2016 1333 1346 S SCHULZ 1999 215 227 H KELLNER 1981 175 185 C SHAFER 2013 1368 1373 W SHAFER 2015 1683 1690 W SHAFER 2012 1452 1456 W SHAFER 2015 W INVESTIGATIONCOMPETITIVEPARTITIONINGDISSOCATEDH2D2ACTIVATEDFISCHERTROPSCHCATALYSTPHDTHESIS BENNDORF 1991 872 876 C BERLOWITZ 1987 A329 P BERNASEK 1992 53 64 S EICHLER 2003 332 340 A GOVENDER 2010 81 89 N MAITLIS 2007 80 83 P FREEMANTLE 1996 31 33 M MANNIE 2014 3255 3260 G GNANAMANI 2016 40 47 M WESTSTRATE 2016 60 66 C BERTOLE 2004 309 318 C BLYHOLDER 1964 2772 2777 G BLYHOLDER 1969 3158 3162 G BLYHOLDER 1995 G HENRICIOLIVE 1982 187 193 G NGANTSOUEHOC 2002 77 89 W SARKAR 2007 1 11 A LI 2015 174 180 J JACOBS 2017 1861 1870 G MANGALOGLU 2018 298 310 D MIMS 1988 121 125 C KRISHNA 1992 305 313 K TURNER 1995 549 556 M ADESINA 1990 295 308 A TAU 1991 141 149 L SHI 2003 157 161 B PERCY 1990 228 235 L BLYHOLDER 1976 122 130 G ZHANG 2009 4740 4747 R HEALY 2018 128 132 E KUBAS 2001 37 68 G HALBERT 2015 5410 5419 S WENTRUP 2020 8332 8342 C VANNICE 1983 139 198 M BALONEK 2010 8 13 C COSULTCHI 2012 368 377 A ISHIDA 2013 145 154 T CAMPOS 2010 12 16 A DAD 2015 101 109 M DAD 2017 83 92 M GNANAMANI 2016 62356 62367 M LOHITHARN 2008 7 16 N LOHITHARN 2008 142 151 N MIYAZAWA 2014 36 39 T GNANAMANI 2012 12 17 M BOTES 2005 21 29 F BOTES 2004 217 225 F KANG 2010 399 403 S MARTINEZ 2005 251 259 A GNANAMANI 2011 17 23 M DINSE 2012 104 114 A LIU 2007 182 190 Y GNANAMANI 2015 39 46 M PENDYALA 2017 6408 6418 V XING 2014 53 56 C XU 2018 168 183 Y RIEDEL 2003 145 156 T RIEDEL 2001 1355 1363 T RIEDEL 2003 41 54 T FIATO 1996 339 343 R ADVANCESINCHEMICALCONVERSIONSFORMITIGATINGCARBONDIOXIDE MA 2019 2639 2656 Z MARTINELLI 2014 77 88 M SATTHAWONG 2015 34 40 R SHAFER 2019 239 248 W VISCONTI 2009 61 68 C VISCONTI 2016 161 170 C ZHANG 2002 411 418 Y YAO 2011 11002 11012 Y YAO 2012 58 68 Y CUBEIRO 1999 87 97 M GNANAMANI 2013 50 56 M EIGENBERGER 2008 2075 2106 G HANDBOOKHETEROGNENEOUSCATALYSIS STEYNBERG 2004 64 195 A STUDIESINSURFACESCIENCECATALYSIS DAVIS 2005 143 168 B WANG 2007 5824 5847 T GUETTEL 2008 746 754 R SOUSAAGUIAR 2011 698 713 E KHADZHIEV 2016 465 479 S JACOBS 2016 269 294 G MULTIPHASECATALYTICREACTORSTHEORYDESIGNMANUFACTURINGAPPLICATIONS BUKUR 2005 135 141 D DECKWER 1982 231 241 W WANG 2008 222 228 Y MARETTO 1999 279 289 C DRY 1986 288 292 M STAMENIC 2017 9964 9979 M HOLMEN 2013 150 157 A DEKLERK 2011 A FISCHERTROPSCHREFINING LEVINESS 2011 1 7 S LEVINESS 2013 518 525 S JIA 2011 Z DAVIS 2016 B STATEWYOMINGCLEANCOALTECHNOLOGIESRESEARCHPROGRAMFISCHERTROPSCHCONVERSIONWYOMINGCOALDERIVEDSYNGASUSINGASMALLCHANNELREACTORFORIMPROVINGEFFICIENCYLIMITINGEMISSIONS JACOBS 2016 51 57 G IGLESIA 1997 59 78 E ABBASLOU 2009 849 856 R JACOBS 2003 1251 1260 G FRATALOCCHI 2018 829 837 L HE 2005 1699 1702 J KHASSIN 2005 39 46 A KHASSIN 2003 465 470 A KHASSIN 2005 362 366 A MARTINELLIX2020X117740 MARTINELLIX2020X117740XM 2022-10-16T00:00:00.000Z 2022-10-16T00:00:00.000Z http://creativecommons.org/licenses/by-nc-nd/4.0/ © 2020 Elsevier B.V. All rights reserved. 2020-10-21T23:20:14.995Z http://vtw.elsevier.com/data/voc/AddOnTypes/50.7/nlp S0926860X20303331 Asbury University State of Texas Commonwealth of Kentucky Dr. Shafer would like to acknowledge support from Asbury University. Dr. Jacobs acknowledges UTSA and the State of Texas (including the Stars program) for financial support. Dr. Martinelli and Dr. Gnanamani thank the Commonwealth of Kentucky for financial support. The authors thank Chelsea Parsons for assisting with editing. item S0926-860X(20)30333-1 S0926860X20303331 1-s2.0-S0926860X20303331 10.1016/j.apcata.2020.117740 271346 2024-01-01T12:34:28.416125Z 2020-11-25 1-s2.0-S0926860X20303331-main.pdf https://s3-eu-west-1.amazonaws.com/prod-ucs-content-store-eu-west/content/pii:S0926860X20303331/MAIN/application/pdf/1ca4acd95cc8f60bb82c85737a061cdb/main.pdf main.pdf pdf true 5175968 MAIN 14 1-s2.0-S0926860X20303331-main_1.png https://s3-eu-west-1.amazonaws.com/prod-ucs-content-store-eu-west/content/pii:S0926860X20303331/PREVIEW/image/png/568d0bcaddeec71d27793d8496184340/main_1.png main_1.png png 48838 849 656 IMAGE-WEB-PDF 1 1-s2.0-S0926860X20303331-gr1.jpg https://s3-eu-west-1.amazonaws.com/prod-ucs-content-store-eu-west/content/pii:S0926860X20303331/gr1/DOWNSAMPLED/image/jpeg/b94e3cb64639dbe5c4edbc90ae8f962e/gr1.jpg gr1 gr1.jpg jpg 76906 406 718 IMAGE-DOWNSAMPLED 1-s2.0-S0926860X20303331-gr4.jpg https://s3-eu-west-1.amazonaws.com/prod-ucs-content-store-eu-west/content/pii:S0926860X20303331/gr4/DOWNSAMPLED/image/jpeg/6ea09da9786010189cc36dce3932c3a5/gr4.jpg gr4 gr4.jpg jpg 57394 217 718 IMAGE-DOWNSAMPLED 1-s2.0-S0926860X20303331-gr2.jpg https://s3-eu-west-1.amazonaws.com/prod-ucs-content-store-eu-west/content/pii:S0926860X20303331/gr2/DOWNSAMPLED/image/jpeg/862450dc39b4d93c6f635fcc879edf84/gr2.jpg gr2 gr2.jpg jpg 79571 476 718 IMAGE-DOWNSAMPLED 1-s2.0-S0926860X20303331-ga1.jpg https://s3-eu-west-1.amazonaws.com/prod-ucs-content-store-eu-west/content/pii:S0926860X20303331/ga1/DOWNSAMPLED/image/jpeg/0a6d60b2791ce23a4a429b9e805cb864/ga1.jpg ga1 true ga1.jpg jpg 24707 200 353 IMAGE-DOWNSAMPLED 1-s2.0-S0926860X20303331-gr3.jpg https://s3-eu-west-1.amazonaws.com/prod-ucs-content-store-eu-west/content/pii:S0926860X20303331/gr3/DOWNSAMPLED/image/jpeg/6be955e855b4c04b789eda30ddb5e661/gr3.jpg gr3 gr3.jpg jpg 101657 836 718 IMAGE-DOWNSAMPLED 1-s2.0-S0926860X20303331-gr1.sml https://s3-eu-west-1.amazonaws.com/prod-ucs-content-store-eu-west/content/pii:S0926860X20303331/gr1/THUMBNAIL/image/gif/ac1f42b61c053bda4b96101437836854/gr1.sml gr1 gr1.sml sml 14926 124 219 IMAGE-THUMBNAIL 1-s2.0-S0926860X20303331-gr4.sml https://s3-eu-west-1.amazonaws.com/prod-ucs-content-store-eu-west/content/pii:S0926860X20303331/gr4/THUMBNAIL/image/gif/2ac1bc882eaa30f2aeecfe6bc94dc96a/gr4.sml gr4 gr4.sml sml 14215 66 219 IMAGE-THUMBNAIL 1-s2.0-S0926860X20303331-gr2.sml https://s3-eu-west-1.amazonaws.com/prod-ucs-content-store-eu-west/content/pii:S0926860X20303331/gr2/THUMBNAIL/image/gif/2bdb9ad6b336d55b1b059488df87dd6f/gr2.sml gr2 gr2.sml sml 11519 145 219 IMAGE-THUMBNAIL 1-s2.0-S0926860X20303331-ga1.sml https://s3-eu-west-1.amazonaws.com/prod-ucs-content-store-eu-west/content/pii:S0926860X20303331/ga1/THUMBNAIL/image/gif/d0ba0625e0c695cca9cc1deaf25eb43f/ga1.sml ga1 true ga1.sml sml 15423 124 219 IMAGE-THUMBNAIL 1-s2.0-S0926860X20303331-gr3.sml https://s3-eu-west-1.amazonaws.com/prod-ucs-content-store-eu-west/content/pii:S0926860X20303331/gr3/THUMBNAIL/image/gif/cd44d5fb3fb796d0de88685d37e7cfad/gr3.sml gr3 gr3.sml sml 7922 163 140 IMAGE-THUMBNAIL 1-s2.0-S0926860X20303331-gr1_lrg.jpg https://s3-eu-west-1.amazonaws.com/prod-ucs-content-store-eu-west/content/pii:S0926860X20303331/gr1/HIGHRES/image/jpeg/c7cc107ae4aa5032235e1105402d341a/gr1_lrg.jpg gr1 gr1_lrg.jpg jpg 822133 1796 3177 IMAGE-HIGH-RES 1-s2.0-S0926860X20303331-gr4_lrg.jpg https://s3-eu-west-1.amazonaws.com/prod-ucs-content-store-eu-west/content/pii:S0926860X20303331/gr4/HIGHRES/image/jpeg/be1e739916aa6eb3922fbd6fe514f0da/gr4_lrg.jpg gr4 gr4_lrg.jpg jpg 656123 960 3177 IMAGE-HIGH-RES 1-s2.0-S0926860X20303331-gr2_lrg.jpg https://s3-eu-west-1.amazonaws.com/prod-ucs-content-store-eu-west/content/pii:S0926860X20303331/gr2/HIGHRES/image/jpeg/d80217933526a574b0b8f948e63201e0/gr2_lrg.jpg gr2 gr2_lrg.jpg jpg 641247 2106 3177 IMAGE-HIGH-RES 1-s2.0-S0926860X20303331-ga1_lrg.jpg https://s3-eu-west-1.amazonaws.com/prod-ucs-content-store-eu-west/content/pii:S0926860X20303331/ga1/HIGHRES/image/jpeg/684a7d8215c135e4dee0d7c97a401975/ga1_lrg.jpg ga1 true ga1_lrg.jpg jpg 227100 886 1564 IMAGE-HIGH-RES 1-s2.0-S0926860X20303331-gr3_lrg.jpg https://s3-eu-west-1.amazonaws.com/prod-ucs-content-store-eu-west/content/pii:S0926860X20303331/gr3/HIGHRES/image/jpeg/0439df1d92bf6029d2959c6a08bdbea9/gr3_lrg.jpg gr3 gr3_lrg.jpg jpg 931692 3701 3177 IMAGE-HIGH-RES 1-s2.0-S0926860X20303331-si1.svg https://s3-eu-west-1.amazonaws.com/prod-ucs-content-store-eu-west/content/pii:S0926860X20303331/STRIPIN/image/svg+xml/09896b39ebd999ecffd29cf8b57cce26/si1.svg si1 si1.svg svg 25857 ALTIMG 1-s2.0-S0926860X20303331-si2.svg https://s3-eu-west-1.amazonaws.com/prod-ucs-content-store-eu-west/content/pii:S0926860X20303331/STRIPIN/image/svg+xml/a82b4b00d9620529827a5815d327cec5/si2.svg si2 si2.svg svg 18653 ALTIMG 1-s2.0-S0926860X20303331-si3.svg https://s3-eu-west-1.amazonaws.com/prod-ucs-content-store-eu-west/content/pii:S0926860X20303331/STRIPIN/image/svg+xml/0c5283b25aafc50234d66f9c1a3931cd/si3.svg si3 si3.svg svg 22965 ALTIMG 1-s2.0-S0926860X20303331-si4.svg https://s3-eu-west-1.amazonaws.com/prod-ucs-content-store-eu-west/content/pii:S0926860X20303331/STRIPIN/image/svg+xml/264dc4ef1d69fe60bf70bdacc49b3715/si4.svg si4 si4.svg svg 16336 ALTIMG 1-s2.0-S0926860X20303331-am.pdf am am.pdf pdf 1053317 AAM-PDF https://s3-eu-west-1.amazonaws.com/prod-ucs-content-store-eu-west/content/egi:1029D2J5VM2/MAIN/application/pdf/c0f4131cd898ec0a914c3227475e6e6b/am.pdf APCATA 117740 117740 S0926-860X(20)30333-1 10.1016/j.apcata.2020.117740 Elsevier B.V. Fig. 1 Sources of synthesis gas for Fischer-Tropsch synthesis. Fig. 1 Fig. 2 FTS is a balancing act controlled by the localized electron donating capability of the active surface. “X2” and “L” simply denote localized carbon hybridization as sp3 and sp2 respectivelly. Selectivity toward those products increased because of these localized environments. Fig. 2 Fig. 3 Commercial reactors for Fischer-Tropsch synthesis. (a) Exxon and (b) Sasol slurry bubble column reactors, (c) multitubular trickle bed reactor, (d) circulating fluidized-bed reactor, and (e) fixed fluidized-bed reactor [299]. Fig. 3 Fig. 4 Different forms of aluminum used as structured materials for FTS, including (left) knitted wire [325] and (middle) foam [325]; and (right) Velocys microchannel FTS reactor core [317,318](Copyright, Velocys, 2012). Fig. 4 Table 1 Physico- chemical parameters for different biomass feedstocks. Table 1 Biomass feedstock HHV (kWh/kg) Moist. Ash V.M.* S C H N O Ref. Sawdust 3.5 34.9 0.7 55.0 0.01 32.0 3.9 0.3 28.2 [11] Wood (pellet) 5.0 7.9 2.1 81.3 0.01 45.0 6.0 0.1 – [16] Wheat straw (pellet) 4.6 9.4 3.7 71.3 0.13 49.7 5.3 1.1 – [16] Switchgrass 5.2 15.0 5.3 61.6 0.09 46.9 5.7 0.9 40.2 [5] Corn stover 5.2 5.4 5.0 – 0.12 46.0 5.9 0.9 41.4 [12] Sunflower shells 5.0 – 4.0 – 0.05 47.4 5.8 1.4 41.4 [13] Almond shells 5.5 – 1.2 79.3 0.00 49.8 6.1 0.2 43.9 [14] Olive stones 5.6 – 0.8 83.8 0.00 52.0 6.2 0.1 41.7 [14] Eucalyptus 5.4** – 0.7 83.6 0.00 50.6 6.4 0.1 42.9 [14] Grapevine pruning 5.0** – 2.1 78.2 0.01 47.0 5.8 0.7 44.5 [15] Sawdust waste 5.7** – 1.3 82.5 0.05 50.3 6.1 0.1 42.2 [15] Olive pruning 5.6** – 3.7 82.4 0.04 47.5 6.0 1.0 43.7 [15] Eucalyptus wood 5.2 16.4 3.3 – – 46.0 5.8 0.3 44.5 [9] Bamboo wood 5.7 11.5 1.9 – – 48.8 6.3 0.2 42.8 [9] Wheat straw 5.0 8.9 6.9 – – 43.0 5.3 0.0 47.0 [9] Rice straw 4.1 8.1 20.4 – – 35.7 4.6 0.3 39.1 [9] Coconut shell 5.7 8.3 0.7 – – 50.2 5.7 0.0 43.4 [9] Duckweed 4.2 – 17.6 75.3 0.99 38.9 5.9 5.8 38.4 [10] Pine sawdust (sawmill) 4.4 9.7 1.0 – – 90.9 1.3 0.1 6.1 [33] Broiler liter (chicken feces and bedding material) 4.1 10.1 11.2 – – 86.8 1.9 1.3 10.8 [33] Paunch grass (cow stomach) 3.9 8.8 28.7 – – 64.8 2.3 0.8 12.4 [33] Sewage sludge 3.5 7.9 12.6 – – 78.0 2.1 0.5 19.3 [33] Dissolved air flotation sludge (chicken factory) 3.9 8.3 4.6 – – 66.9 1.9 0.7 30.5 [33] Dewatered pond sludge (chicken factory) 3.4 7.7 4.0 – – 78.7 2.3 0.3 18.6 [33] Food waste (mixture of several human wastes) 31.0 53.1 2.2 50.4 0.30 73.0 7.0 5.2 17.0 [34] *V.M.: volatile material. ** LHV. Table 2 Selectivity fingerprints of unpromoted and promoted FTS catalysts [68]. Table 2 Active phase Cobalt Ruthenium Modified Iron (100Fe:5.1Si) Iron Support/promoter None Al Si Ti Carbon Ce Al Si Ti NaY None Li Na K Rb Cs Mn CH4 42.20 14.98 19.30 19.40 18.00 28.80 7.99 6.76 8.36 7.53 42.94 11.77 12.20 10.51 11.56 10.83 4.31 Total Oxy 1.44 2.51 6.27 2.93 10.07 46.59 3.85 7.05 3.40 2.24 0.23 2.36 3.61 2.71 7.19 7.97 4.47 % Alcohol 100 100 100 100 100 100 100 100 100 100 72.29 83.70 88.39 96.76 97.52 96.39 100 % Acid – – – – – – – – – – 1.91 3.17 2.91 0.53 0.40 0.61 0.00 % Ketone – – – – – – – – – – 12.22 4.76 2.17 0.90 0.99 0.96 0.00 % Aldehyde – – – – – – – – – – 13.58 8.36 6.53 1.82 1.09 2.03 0.00 Isomerized 0.00 0.00 0.00 0.00 0.00 0.00 0.00 0.00 0.00 0.00 7.17 5.52 5.24 4.56 4.31 3.23 4.87 Paraffin 42.79 66.10 53.31 41.03 58.38 11.92 59.96 51.56 54.90 53.70 34.56 31.84 32.87 28.99 27.78 24.63 18.93 1-Olefin 10.56 13.12 18.29 30.26 7.89 8.81 26.32 23.71 24.64 25.13 11.98 37.97 41.95 46.16 42.00 46.31 62.61 Trans-2-Olefin 2.33 1.00 1.36 3.57 3.26 2.04 1.17 6.85 4.90 7.11 2.17 6.54 2.38 4.29 3.47 4.07 1.55 Cis-2-Olefin 0.68 2.30 1.48 2.81 2.40 1.84 0.72 4.08 3.80 4.30 0.96 3.99 1.74 2.78 3.67 2.96 3.26 O/P 0.32 0.25 0.40 0.89 0.23 1.07 0.47 0.67 0.61 0.68 0.44 1.52 1.40 1.84 1.77 2.17 3.56 Oxy./P 0.14 0.19 0.34 0.10 1.28 5.29 0.15 0.30 0.14 0.09 0.02 0.06 0.09 0.06 0.17 0.17 0.07 Iso/Total P 0.00 0.00 0.00 0.00 0.00 0.00 0.00 0.00 0.00 0.00 0.17 0.15 0.14 0.14 0.13 0.12 0.20 Table 3 Selectivity comparison of Sasol high temperature and low temperature reactors [313]. Table 3 Cut Synthol High Temperature(Circulating Fluid Bed) Arge Low Temperature C1 and C2 16.0 5.4 C3 to C6 paraffins 5.0 8.4 C3 to C6 olefins 33.5 7.6 C7 - 160 °C 17.2 8.0 160 °C - 350 °C 14.0 19.5 350+ oC 7.8 48.1 Water soluble oxygenates 6.5 3.0 Table 4 Type of reactors commercially used in GtL-CtL technology worldwide. Table 4 Reactor type Technology Company Catalyst Raw material Year commissioned Capacity (bpd) Slurry MTSFTP Synfuels China Mongolia Fe Coal 2009 160,000 Fixed-bed Shell SMDS Shell, Bintulu, Malaysia Co-SiO2 Natural gas 1993 14,700 Fixed-bed Shell SMDS Pearl GTL, Qatar Co-SiO2 Natural gas 2011 140,000 Slurry Sasol Slurry bed Sasol, Sasolburg Fe Coal 1994 2,500 Slurry Sasol Slurry bed Oryx GTL, Qatar Co-Al2O3 Natural gas 2006 34,000 Slurry Sasol Slurry bed Escravos GTL, Nigeria Co-Al2O3 Coal 2014 34,000 Circulating fluidized Sasol Synthol PetroSA, Mossel Bay, RSA Fe (fused) Natural gas 1992 36,000 Fixed fluidized Sasol Advanced Synthol Sasol, Secunda, RSA Fe (fused) Coal 1995 165,000 Table 5 Comparison of 0.276%Ag-25%Co/Al2O3 catalysts at 210 °C [320]. Table 5 Support Reactor SV(sl/h gcat) P(psig) TOS(h) Ave. XCO (%) Ave. SCH4 (%) Ave. SCO2 (%) Ave. SC5+(%) FT product rate(g/h gcat) Wider Pore HP14/150 CHER 4.0 157 132-195 44.4 8.0 0.5 84.0 0.368 Wider Pore HP14/150 CSTR 2.5 175 71-138 48.3 4.8 0.8 90.4 0.318 Narrow Pore Catalox150 CHER 2.5 160 121-200 59.9 8.7 0.9 82.3 0.312 Narrow Pore Catalox150 CSTR 2.8 175 71-139 47.2 5.5 0.6 88.7 0.247 Table 6 FTS results of catalyst testing various pore-filled γ- Al2O3 supported cobalt catalysts using a CSTR. (Reaction conditions: T = 220 °C, P = 20 atm, H2/CO = 2) [321]. Table 6 Catalyst CO conv. (%) TOF (mol CH2 produced/mol Co surface/s) Selectivity (%) CO2 C1 C2-C4 C5+ 22.4% Co/Al2O3 23.3 0.052 0.5 10.7 13.2 75.6 11.5% Co/PF#1 25.6 0.052 0.6 9.1 10.6 79.7 3.5% Co/PF#2 26.6 0.049 0.6 8.1 7.9 83.4 22.4% Co/Al2O3 51.0 0.046 1.0 8.9 10.1 80.0 11.5% Co/PF#1 52.9 0.050 1.0 7.4 8.8 82.8 3.5% Co/PF#2 54.8 0.042 1.2 6.8 7.0 85.0 * PF#1 and PF#2 have successively decreasing pore lengths due to pore filling. An overview of Fischer-Tropsch Synthesis: XtL processes, catalysts and reactors Michela Martinelli a Muthu Kumaran Gnanamani a Steve LeViness b Gary Jacobs c Wilson D. Shafer d * a Center for Applied Energy Research, University of Kentucky, 2540 Research Park Dr., Lexington, KY, 40511, United States Center for Applied Energy Research University of Kentucky 2540 Research Park Dr. Lexington KY 40511 United States Center for Applied Energy Research, University of Kentucky, 2540 Research Park Dr., Lexington, KY, 40511, United States b Consultant (does not work with anyone now) Consultant (does not work with anyone now) Consultant (does not work with anyone now) c University of Texas at San Antonio, Chemical Engineering Program - Dept. of Biomedical Engineering, and Dept. of Mechanical Engineering, 1 UTSA Circle, San Antonio, TX 78249, United States University of Texas at San Antonio Chemical Engineering Program - Dept. of Biomedical Engineering, and Dept. of Mechanical Engineering 1 UTSA Circle San Antonio TX 78249 United States University of Texas at San Antonio, Chemical Engineering Program - Dept. of Biomedical Engineering, and Dept. of Mechanical Engineering, 1 UTSA Circle, San Antonio, TX 78249, United States d Asbury University, One Macklem Drive, Wilmore, KY 40390, United States Asbury University One Macklem Drive Wilmore KY 40390 United States Asbury University, One Macklem Drive, Wilmore, KY 40390, United States ⁎ Corresponding author. Graphical abstract This review is divided into three main sections. The first section of this overview examines in detail recent techno-economic analyses on the utilization of biomass as a source of syngas for Fischer-Tropsch synthesis (FTS). FTS is a highly localized industry, and depends on the sources of syngas available, the products desired, and the demand for co- production of electricity. Where coal or natural gas coexist in the region where biomass is available, economics may favor producing or blending syngas from multiple resources, making biomass-to-liquids a highly complex scenario. Land use management is essential for sustainable biomass production, if used as the carbon source for FTS. The second section discusses FTS mechanisms, reactions and catalysts. Supposing the catalyst surface energy favors CO hydrogenation to FTS products, the sweet spot of FTS, selectivity will depend on the degree of back- donation from the metal. The degree of electron back-donation from the catalyst surface to both adsorbed CO and vinylic intermediates in part controls the FT synthesis product distribution. When the back-donation is sufficient, chain growth favors longer chained linear hydrocarbons (paraffins, alpha olefins, linear alcohols) suitable for upgrading to diesel, jet fuels, lubricants, and waxes. When back-donation is less significant, monomethyl branched hydrocarbons, internal olefins, and oxygenates (esters, acids and ketones) are elevated. Lastly, active supports are discussed for increasing the termination rate to oxygenates and olefins, as are hybrid catalysts that simultaneously carry out FTS and upgrading, often through secondary reactions. The last section provides an overview of the commercial scale reactor designs including the fixed bed, fluidized bed, and slurry bubble column reactor currently used in the FTS process. Economically, FTS is favored at larger scales; however, new compact reactor designs are coming into play aimed at monetizing highly localized (e.g. biomass) and stranded resources (e.g. natural gas). These types of reactors, involving microchannel and heat exchanger designs, must be highly efficient at managing heat, cost-effective, and mobile in order to exploit non-traditional sources of syngas. Keywords Fischer-Tropsch Biomass-to-Liquids Coal-to-Liquids Gas-to-Liquids Mechanism Cobalt catalyst Iron catalyst 1 Introduction This manuscript is a collaborative work from researchers of different backgrounds, who had the honor to work alongside Dr. Davis in some capacity or another. Dr. Davis was a trailblazer, mentor, and leader. His work in the catalysis field was remarkable, spanning over 60 years and resulting in over 800 publications, and around 20,000 citations to date. His work highly contributed to Fischer-Tropsch synthesis, liquefaction, hydrotreating, alcohol conversion, isomerization, aromatization, hydrogen production and purification, and many other industrial fields. Like his predecessor Dr. Emmett, Dr. Davis used radio labeled and non-radio labeled isotopes to further understand the mechanistic routes of these extremely complicated reaction networks. In the final stage of his career, Dr. Davis was working on projects that utilized syngas from combined feedstocks, such as biomass and coal. Therefore, we decided to provide a brief overview of this area with a focus on findings from CAER during Dr. Davis’ tenure. 2 Summary of techno-economic analyses The comparison among different studies is complex, as the competitiveness of Biomass-to-Liquids (BtL) or combined processes (e.g. CBtL, GBtL) depends not only on crude oil pricing, but also on local government policy for green-house gas (GHG) reduction, land management, and the particular feedstocks utilized. As this is a general overview, this section will only focus on the fundamental gasification routes paired with discussions on economics and viability. 2.1 Biomass-to-Liquids process Gas-to-Liquids (GtL) and Coal-to-Liquids (CtL) are well-established technologies for the production of synthetic fuels (e.g., commercial plants of Shell and Sasol) [1]. In contrast, few plants at the pilot and demonstration scales are available worldwide for BtL. If syngas produced from coal were replaced by renewable biomass, then a net reduction in emissions would result. Any CO2 involved in the BtL process is assumed to be recycled by photosynthesis, whereas it takes 300 million years to make coal from plant matter. Moreover, even today, the bulk of the biomaterials are left to rot or are burned in fires, contributing to increases in carbon dioxide levels. Thus, by using biorenewable materials to produce fuels or chemicals, the net amount of CO2 released would be less than what would be produced using fossil-based resources alone. Thus, if 20% of the total liquid fuels were produced from biomass, then a reduction in CO2 emissions of 15% could potentially be achieved [2]. The BtL process (Fig. 1 ) has four basic steps: (1) transportation, storage, handling and pretreatment of the biomass; (2) gasification to syngas (mixture of CO and H2) followed by gas cleaning/conditioning; (3) Fischer-Tropsch synthesis (FTS); and (4) upgrading of FTS liquids to high quality fuels. The main obstacle impeding commercialization is lack of competitiveness in today’s energy market because of (1) a complicated and diverse biomass supply, (2) expensive biomass transportation and feed preparation (e.g., torrefaction) costs, and (3) high plant capital costs [1,3–7]. Different biomass feedstocks can be used in BtL, including dry residues such as straw, energy crops (e.g., short- rotation or herbaceous wood, sugar, oil seed, miscanthus grass, switchgrass), wood materials from forestry operations, municipal/industrial/agricultural organic waste, and algae [8]. Depending on the origin, biomass feedstocks have different physico-chemical properties (e.g., moisture, ash content, particle size, energy density and toxicity) (Table 1 ) [5,9–16]. These differences influence transport, pretreatment, gasification, and cleaning/conditioning steps [7–9]. Biomass cost is coupled with several factors such as: resource and land availability, supply chain, and processing costs, and require vastly different CapEx costs [6,17–19]. Availability of abundant low cost biomass is the main challenge for achieving economic competitiveness [20]. This does not rule out that locally available biomass can be ideally processed as feedstock in a small-scale bio-refinery; rather, very high investment costs must be considered for this configuration, because large-scale investments are essential for achieving high returns [6]. A reason for these costs lie in the complexities in understanding specific concentrations of biomass for land management [21–29]. These types of assessments are of great importance but lie outside the scope of this review, as focus will remain on types of biomass specifically. High transportation costs result from decentralized production and the lower energy density of biomass relative to coal and natural gas (NG) [4,30]. Biomass can be transported by road, rail, water or pipeline. Trucking is usually the cheapest and most flexible means of transport when the distance is less than 100 km [1]. Local pre- processing close to the production source can minimize the cost of logistics [31]. This pretreatment before gasification is characterized by: drying (decreasing the moisture to 40%), densification (e.g., balling, briquetting or pelletizing) and grinding (reducing the particle size to increase both surface area and heat transfer characteristics) [7]. Torrefaction (heating at 200–300 °C under an inert atmosphere) can be another route to enhance the potential of biomass prior to gasification. This results in loss in moisture, hydrogen and oxygenated species, producing a “coal-like” material [8]. Torrefied biomass contains around 70% and 90% of its initial weight and energy, respectively [32], whereas moisture level varies from 1 to 6% [31]. The type of gasifier (fixed bed, fluidized, entrained flow, rotary kiln or plasma), its performance as well as the produced syngas (composition and calorific value) are influenced by feedstock properties [7,9,35]. Particle size range and moisture content are two of the main parameters considered in the choice of the gasifier. Generally, when water content in the biomass is less than 15% (e.g., wood or herbaceous biomass), an entrained flow reactor as well as all fixed-bed gasifiers (updraft, downdraft and cross-draft) can be used, while high-moisture biomass (up to 60% wet basis - e.g., oil palm empty fruit bunch) requires an updraft fixed-bed or a fluidized reactor [8]. Moreover, biomass with either light treatment or no pretreatment can be supplied to a rotary kiln or plasma reactor [36]. Particles sizes usually range from 0.15 mm to 51 mm [8]. Fixed bed reactors are less sensitive (< 51 mm) than fluidized bed reactors (< 6 mm) or entrained flow gasifiers (<0.15 mm) [37]. The best gasifier in terms of syngas quality is the plasma reactor, however lower tar content can be obtained with an entrained flow gasifier than fluidized or fixed bed reactors. More details regarding types of gasifiers, as well as their advantages/limitations, can be found in previous reviews available in the literature [36,37]. The main capital costs of BtL are gasification and syngas clean-up [10]. Gasification accounts for up to 39% of costs for an oxygen-steam fluidized bed reactor [38]. Capital costs were found to be 15% for indirectly-heated gasifiers and 27% for directly-heated gasifiers, whereas the cleanup step accounted for about 20–26% of the total cost [39]. Syngas cleaning for FTS applications are severe (H2S/COS < 0.01 μLL−1, NH3/HCN < 0.02 μLL−1, alkali and halides < 0.01 μLL−1) [8]. Optimization of gasification process conditions (e.g., temperature), as well as development of FTS catalysts more resistant to contaminants, like sulfur, greatly impact the cost analysis. Due to the great diversity in biomass and depending on the production side steam, biomass-derived syngas may have a H2/CO ratio in the range of 0.5–1.0, allowing both cobalt and iron-based catalysts to be used [40,41]. Cobalt has higher productivity and conversion, but upstream water-gas shift (WGS) or steam oxidation on the production side, will be required to boost the H2/CO ratio. Iron possesses intrinsic WGS activity, so FTS and WGS can be carried out in a single reactor [40]. Yet, with the diversity in biomass, iron catalysts may be preferred for the downstream FT step, as they are more resistant to sulfur contaminants in syngas. Regarding gasifier design, steam oxidation is typically more economically viable at smaller scales [41]. Based upon the literature, BtL has an efficiency that typically ranges between 28 and 40% for the conversion of raw materials to end products [1,6,11,18,19,42,43]. In general, oxy-steam and air-blown fixed bed gasifiers have efficiencies in the range of 75–81%, while the syngas to liquid fuel efficiency (diesel and wax) for a cobalt catalyst is in the range of 35–50% [6,11]. The development of high yield catalysts, efficient FTS reactors with high heat transfer rates, improved technologies for O2 generation consumed to produce syngas, syngas purification and CO2 separation, are all fundamentally important for improving the overall BtL efficiency [6]. Obviously, there are limitations to these studies, as any model must draw upon certain assumptions. Logistical evaluations, which include detailed realistic economic studies, are typically paid for and conducted by companies, where little outside information is provided. Furthermore, utilizing mobile FTS with compact reactors at the source of the biomass will have a different result compared to operations whereby the biomass must be conveyed to large scale FTS facilities by barges or diesel-powered land vehicles [44]. These considerations, like the concentration of vegetation assessment, are too specific, and outside the scope of this review. Many techno-economic analyses (TEA) have been carried out for BtL [45–49], and fuel costs are in the range of 0.4$/l to 1.39$/l. Jin et al. [46] suggested that production of liquid fuel could compete with petroleum only if low cost biomass is coupled with a low cost in electrical supply energy [46]. Swanson et al. [48] have pointed out that liquid fuel costs could be lowest when coupled with high temperature gasification (∼1300 °C) to yield the highest syngas conversion from biomaterials. Yet, syngas generation still dominates the economic value of the end products, as a sensitivity analysis revealed a significant effect of capital and biomass costs on product value [48]. Thus, TEA studies indicate that BtL is still not competitive with conventional refineries, since the biofuel production costs are 8% higher than current market prices [1]. An economic evaluation reported that BtL concepts only become economically viable if the crude oil price is higher than $80 per bbl and only if the biomass feedstock price is lower than $120 per ton [1]. Moreover, BtL requires relatively high product selling prices to be economically viable. However, in certain locations of the world, achieving high product sales prices does not require high oil prices. The US renewable identification number (RIN) credits available for the highest reduction in carbon intensity (>60%) can account for $2-3/gallon ($84-126/bbl) credits, while the same fuels under California’s low carbon fuel standard can qualify for a further $1.50-2.00/gallon credit. Thus, BtL product sales prices can be as high as $7.00–8.00/gallon today. Issues will remain, as these are statutory credits, and therefore could be rescinded at any time, though this possibility is unlikely. In many parts of Europe, carbon taxes exist, and there are often very significant “tipping fees” for MSW (municipal solid waste) landfilling. In certain cases, revenue from these tipping fees can be significantly higher than those from product fuel sales. Enerkem has an existing commercial MSW gasification to methanol/ethanol plant in Edmonton, Alberta, while Fulcrum Bioenergy is currently constructing a ca. 850 BPD plant based on MSW gasification to FT products in Nevada using a TRI gasifier, and Red Rock Biofuels is currently constructing a ca. 1000 BPD plant based on wood waste gasification to FT products in southeastern Oregon using a TCG Global gasifier. Finally, in the absence of either the credits or carbon taxes, a strategy being considered to make BtL more competitive is to combine biomass feedstock with coal (CBtL) or natural gas (GBtL) [3–5,10,50–53]. 2.2 CBtL technologies CBtL allows the possibility of balancing economic and environmental factors in terms of fuel price and GHG emissions, combining the advantage of both CtL and BtL. CtL can generate fuels at lower costs ($50/bbl), but GHG emissions are high (205 kg CO2,eq/GJ), whereas BtL results in zero or even net-negative GHG emissions if CO2 capture technology is considered but at a higher fuel price ($127/bbl) [30]. Thus, assuming the feedstock is comprised of 43% biomass, GHG emissions for CBtL are 120 kg CO2,eq/GJ, while production costs are $93/bbl [30]. Other studies show that when 8% by weight of biomass (switchgrass) is co-fed with coal, CBtL with CO2 sequestration can produce economically competitive fuels when crude oil is above 93$/bbl; they have 20% lower GHG emissions than petroleum-derived diesel. Co-gasification of 15% and 30% biomass results in emission reductions of 33% and 63%, respectively [52]. Generally economic benefits can be realized when the production capacity is higher than 1 million tons/yr for CtL and 0.8–1.59 million tons/yr for BtL[30]. However, BtL is hindered by limited biomass availability as a large area of land is needed, which affects the maximum plant size limiting the economy of scale [52]. The combination of BtL and CtL allows the CBtL process to inherit the large scale economy of CtL, so it suffers less from this limitation compared to BtL alone [30]. For example, the capacity of CBtL can be 30,000 bbd when 30% of biomass (switchgrass) is co-fed compared to 50,000 bbd for CtL or 5000 bbd BtL alone [52]. This is because the biomass supply rate is limited to 4000 dry tons per day. This is the maximum value assuming that a regional site which can support collection would have a radius of 30 to 50 miles supposing that a delivery truck arrives every 10 min [52]. Similarly to BtL and CtL, a significant debit for CBtL processes is the generally very low H2/CO ratio of syngas. For both methanol and FT, increasing the H2/CO ratio to the required range of about 2 entails conversion of 30–60% of the syngas CO (which is the desired component) to CO2. The coal or biomass gasifier is by far the most expensive unit in these plants, and it is plainly economically problematic to lose a large fraction of potential feed for conversion to products. Perhaps a more economically viable combination would be CBtL with supplemental hydrogen addition produced by electrolysis using (very low cost) renewable electricity. 2.3 GBtL technologies TEA studies for GBtL are limited [3,51,53]. Co-processing NG with biomass has advantages because of the higher NG conversion efficiency, lower capital costs and richer hydrogen content in the feedstock [3]. Increasing the NG/biomass ratio decreases investment and operational costs. When the NG blending ratio is less than 50%, the H2/CO ratio of the syngas produced is less than the stoichiometric value for FTS, requiring WGS [3,40]. When the NG blending ratio is higher than 50%, such that the H2/CO ratio is higher than the stoichiometric value needed for FTS, pressure swing adsorption (PSA) may be used to remove the portion of hydrogen not needed [3]. Environmental sustainability needs must also be addressed. GHG emissions of GBtL increase by increasing the NG co-fed to the biomass. The optimal NG blending ratio must be calculated by considering both economic and environmental factors. GBtL can readily include 28% NG and still meet the GHG threshold reduction target to be classified as an advanced biofuel as defined by the US Environmental Protection Agency [3]. 2.4 PtL technologies Recently, an alternative route to produce renewable jet-fuels is the Power-to-Liquids process (PtL) [54]. The concept of PtL is storing energy from intermittent renewable energy and producing carbon-neutral fuels from CO2 emissions. The hydrogen, produced in an electrolyzer, and CO2 are then directly or indirectly converted to fuels by FTS or the methanol route. The Sunfire PtL Plant (i.e., featuring a solid oxide electrolyte, direct air capture, and FTS) [55] and Soletair [56] are applications of this technology. Vázquez et al. [56] reported that PtL has a carbon efficiency close to 94% and an overall energy efficiency of 47%, while efficiencies up to 63% could be realized in a PtL process with high-temperature electrolysis if concentrated CO2 were obtained from renewable point sources [57]. PtL is relatively new, so limited TEA studies are available [58,59]. TEA shows that the process is still not competitive for the production of fuels or chemicals [58]. Process optimization (e.g., innovative processes for CO2 extraction from air, higher efficiency from the electrolyzer) and dynamic operation studies are required to improve plant flexibility because of the daily, weekly or seasonal fluctuations in renewable energy (e.g., the solar radiation intensity, wind speed) [56]. The main requirement for large-scale implementation is a reduction in cost for the production of hydrogen from water electrolysis as powered by solar and/or wind energy [58]. PtL can also be combined with BtL to boost the production of carbon neutral fuels [60,61]. In this case, the carbon efficiency of conventional BtL can increase from 38% to 90% by adding hydrogen produced in a renewable manner. As such, WGS is avoided, while reverse water-gas shift (RWGS) is introduced to convert CO2 to CO. This means that the amount of fuel can be increased by a factor of 2.4 with the same amount of biomass, while the cost of biofuel produced with PBtL is 30% less compared to BtL [61]. 2.5 XtL direction There are several market analysis groups reporting analysis of specialty markets on a regular basis, some of which were covered in this review. Those studies provide qualitative and quantitative results from end-users regarding manufacturing processes involving the conversion of various feedstocks to high-value specialty products via FT synthesis, including such products as lube oils, alpha olefins, food grade wax, etc. in addition to middle-distillates. However, demands in FT products may continue to shift as the prices of oil and gas change; moreover, the need for LNG may draw the attention away from CtL, GtL, BtL and XtL ( Fig. 1 ). As a whole, CtL and GtL would appear to be favored by the very low current coal and natural gas prices, as well as the abundant number of demonstrated/commercialized technologies available for these processes [1]. However, each time in the past that it appeared large-scale development of either/both was imminent, cyclical crude price collapses rendered most proposed plants uneconomical. This happened despite the claim on more than one occasion that \"it's different this time\". In the late 70’s/early 80’s, around 2007–2008, and again 2011–2012, claims were made that prices would be high forever. There were many claims that $100/bbl was the new floor, and in 2008 there were predictions that it would soon go to $200/bbl. It went to $35/bbl instead, a reoccurrence trend post WW2 [63,64]. These repeated cycles of crude price boom and bust have certainly increased the perception of economic risk involved in contemplating plants requiring hundreds of millions to multibillion-dollar capital expenditures. BtL development has been hampered by the lack of well demonstrated commercialized biomass gasification technologies. Although there are several BtL plants in construction today and the outlook may change for the better if they are able to operate as designed [6,8]. Clearly the current low carbon/CO2 policies and subsidies make BtL considerably more attractive. Yet, CtL and BtL are further challenged by the need to produce additional H2 to meet the requirements of downstream FTS operations as discussed above. As previously described, gasification and clean-up comprise the majority of the total plant costs for BtL and CtL, so every mole of CO produced is extremely costly. But, conventional processes then proceed to consume 30–45% of the valuable CO to produce H2 (and CO2) by water-gas- shift. This issue is also observed in PtL, where it is currently limited by the developmental status of hydrogen production. An economical source of additional H2 from outside the plant, for example by Power- to-Gas or natural gas reforming, would make such plants a lot much more attractive. Going from CO2 and H2 directly to products is well demonstrated for methanation, but problematic for FTS or methanol synthesis. In the latter processes, overall CO2 conversion is low, as are the selectivities to the desired products. In addition, a significant fraction of the H2 feed is consumed by reaction with oxygen from the CO2, producing water (which is the starting material for H2 production by electrolysis). H2 and CO2 can be converted to CO and H2O, for example by the reverse water-gas-shift reaction, followed by conventional FT or methanol synthesis. Even if high conversion and selectivity to the desidered product can be obtained, the additional processing steps add considerable capital costs, and consume about 1/3 of the H2 required, again simply producing water. Granted, the production of H2 by alkaline or PEM electrolyzers and its use in the direct or indirect CO2 hydrogenation is less than desiderable given the high H2 usage required for oxygen removal/water production. Thus, a more promising solution is the co-electrolysis of CO2 and H2O to produce syngas directly, followed by conventional FT or methanol synthesis. But such co-electrolysis technologies are only now entering or are at pilot plant scale operations, and their widespread commercial availability is at least several years away at best [62]. Futhermore, costs are very high (4-6 times that of alakine electrolyzers), and commercial lifetime (activation/degradation) is uncertain. 3 Fischer Tropsch Synthesis In FTS, syngas (CO and H2) is catalytically converted into a spectrum of hydrocarbon chains, including a fraction of oxygenates Eq. (1)–(3). WGS also may occur depending on the catalyst Eq. (4): (1) F T S : n C O + 2 n + 1 H 2 → C n H 2 n + 2 + n H 2 O (2) n C O + 2 n H 2 → C n H 2 n + n H 2 O (3) n C O + 2 n H 2 → C n H 2 n + 2 O + n - 1 H 2 O (4) W G S : C O + H 2 O ↔ C O 2 + H 2 The four main metals considered for FTS are iron, cobalt, ruthenium, and nickel. Ruthenium, though the most active, is impractical due to its high cost and low abundance [65]. Nickel, though inexpensive, is plagued by coking and typically considered a methanation catalyst [66,67]. Thus, cobalt and iron are the essential active industrial metals for FTS. The cost of iron-based FT catalyst is estimated at $10-40 per pound, whereas cobalt- based FT catalyst can cost $60-100 per pound, and is more susceptible to the marketplace due to increasing demands in aerospace and batteries. Each FT catalyst developed to date has its own yield structure [68]. Cobalt-based catalyst produces more water, and water clean-up is required, whereas iron-based catalyst, active for WGS, produces significant CO2 (which can be sent to a shift reactor if a hydrogen source is available). Iron catalyst can be used in a wider variety of feedstocks compared to cobalt catalyst; however, economics remains the driving force and finding the cheapest available feedstock is imperative. Another advantage for iron, spent Co catalysts must be reclaimed whereas Fe catalyst can be landfilled (if within acceptable environmental standards for copper). In general, though, as previously discussed, iron is commonly paired with CtL and BtL when low H2/CO syngas is available [69]. Cobalt is preferred with GtL, as it requires a higher H2/CO ratio (close to 2) to be most effective [69]. 3.1 Catalysts Structural and chemical promoters are usually added to iron-based catalysts. Binders such as silica are usually added to improve the structural rigidity of iron catalysts [70–73]. Alkali metals are electronic promoters that facilitate carburization, increase FTS activity, maintain stability, and improve the selectivity to high molecular weight hydrocarbons [74–80]. There are a number of studies that have been done for the promotion of iron with various metals, mainly for the sake of tuning, which will be discussed in more detail [77,80–89]. Promoters such as copper are added in part to facilitate the reduction of iron oxides [90–92]. Because cobalt is expensive, to increase the number of cobalt atoms exposed at the surface, cobalt nanoparticles are dispersed on carriers such as typical metal oxides [93,94], zeolites [95], carbon materials [96–102], silicon carbide [103], partially reducible oxides (PRO) like manganese [104,105] and ceria [106,107], and various other materials [108–112]. Many of these supports, originally thought to be inert, are now being used to promote a specific selectivity to be discussed. Unlike iron, promoters used for cobalt do not significantly increase the turnover frequency; rather, these metals aid in increasing the % of reduction of cobalt oxides to Co metal [113,114]. Whether these additives promote methanation depends on the nature of the promoter [113,115–117]. Lastly, unlike cobalt and ruthenium, where the metallic surface is deemed active for FTS, several species of iron carbide exhibit FTS activity [118]. 3.2 Mechanism Ninety years have passed since the discovery of FTS [119–123]; however, many details regarding the mechanism remain speculative [107,118,124–148]. Interactions between the active metals and CO or H2 are still being investigated to elucidate specific dissociation pathways, as well as their kinetic effect on hydrocarbon chain-growth [107,124–130,133,135–138,140–143,145–155]. CO may dissociate directly or with the assistance of H2 in a concerted manner [156–167]. Two different mechanistic families have been proposed to explain initiation and chain growth steps during FTS: the carbide mechanism and CO insertion. In carbide mechanisms, first proposed by Fischer and Tropsch [121], CO dissociatively adsorbs to form carbide and surface oxygen [130,131,135,145,146]. Carbide species are partially hydrogenated to CHx intermediates which serve as the chain growth monomer. Termination occurs by desorption of unsaturated intermediates to form olefins or by addition of CH3 species or hydrogen to form paraffins [130,131,135,145,146]. In CO insertion mechanisms [68,142,143,168–172], CO directly inserts into the growing hydrocarbon chain prior to C–O scission [156–167]. Micro-kinetic models, isotope tracer studies, and steady state and transient kinetic investigations lend support to this mechanistic scheme, where C–O scission is the key step [74,105,118,140–142,155,173–221]. Isotopic kinetic experiments were performed by switching from H2/CO to D2/CO while maintaining constant conditions (T, P, space velocity, H2/CO) to obtain a steady state CO conversion. Hydrogen/deuterium experiments performed during FTS have displayed various kinetic rate ratios, but have conclusively displayed an inverse kinetic isotope effect (IKIE) [182,183,190,197,205,222]. Results from isotopic surface partitioning experiments suggest that the H/D isotopic effect is not due to chemisorption [223–226]. Rather, H/D partitioning studies indicate that a nearly uniform (H/D ≅ 0.97) mixture of hydrogen isotopes exists on the active metal surface [223–226]. This nearly uniform partitioning, coupled with the IKIE observed in H-D switching during FTS reaction tests, suggests kinetic limitations in H-bond formation, which agree with the calculated IKIE values [150,205,159,163,165,227–230]. 3.3 Tuning Reactor type and process conditions can alter product selectivity; however, dramatic changes in selectivity are also achieved by adjusting the catalyst formulation. Thus, selectivity is a fingerprint of the catalyst formulation [68]. Desired selectivity is achieved by the capability of the catalyst, under controlled conditions (temperature, pressure, space velocity, H2/CO), to maintain a balance among adsorbed reactants and products [130,135,140,142,144,146,205,217,225,231–237]; this balance depends on tuning the localized electron density at the active catalyst surface, through electronic back donation to the 2π* anti-bonding molecular orbital of CO [129,238–240]. The electron density of the active metal, in turn, can be modified by adding specific promoters [150,241–246]. Although there is debate in the literature [107,124–130,133,135–138,140–143,145–155], one explanation for the diversity in selectivity fingerprints among different catalyst formulations is the involvement of the electronic tuning of a vinylic intermediate. A collection of labeled 14C isotopic studies describe ethylene as a chain initiator of FTS with >99% primary incorporation [154,156,247–255]. Furthermore, ethylene/CO/H2 or propylene/CO/H2 feeds resulted in enhanced higher hydrocarbon production [154,252], which directly corresponded to the amounts of ethylene/propylene incorporated [154,252]. Furthermore, without CO, 10% ethylene/H2 produced products at a higher rate [152]. Simply put, FTS selectivity may rely on the stability of a 2-carbon species [68] which in turn relies on electronic back-donation; if too weak or too strong, only CHX is formed, leading to methanation. Since CO and vinylic intermediates are pi-accepting ligands, both are susceptible to electronic back-donation from the catalyst surface (Fig. 2 ) . The figure displays a Dewar-Chatt-Duncanson model [256–259] describing how localized back-donation from the metal affects how these species interact. If the localized sp2 character is retained, both CO and C2 will be weakly bound to the surface, and the CC bond length observed in IR is remarkably similar to a free CC bond (L). In contrast, if back-donation is strong, carbon takes on more sp3 character, as a metallocyclopropane species. Vibrational observations then reveal that the CC bond weakens to resemble a single bond (X2). Thus, a balance in electron back-donation for FTS is of great importance, and if not held, could lead to inferior catalysts having poor selectivity. In general, and using the figure as a guide, three different major scenarios can be identified [68]: • Route A: weak back- donation. CO is adsorbed molecularly as the scission of CO bond with H* is not kinetically favored. If CO is weakly adsorbed, then the vinylic intermediate species would be in an L- configuration (linear molecule) weakly bound to the surface. Thus, the intermediate is susceptible to hydrogenation reactions and high selectivities to methane and light hydrocarbons are observed. As CO dissociation is difficult, carbon growth from the weakly-bound L configured vinylic intermediate could be through CO insertion [68,142,143,168–172]. Moreover, the carbons of the vinylic intermediate exhibit sp2 hybridization (electrophilic nature) because of the weak back- donation from the metal; consequently, chain growth can occur at either C position, resulting in internal olefins, branched paraffins (i.e., typically monomethyl branched hydrocarbons due to steric factors), and oxygenated materials (e.g., esters, acids, ketone, aldehydes) through a pseudo-hydroformylation series of steps. This configuration has been proposed for un-promoted iron carbide [68]. • Route B: semi-strong back-donation CO adsorbs in an associative manner followed by H-assisted dissociation on the active site. As adsorbed CO is stable, so is the vinylic intermediate, X2- configuration. These species are suitably stabilized on the active surface to favor chain growth solely at the Cx position (Fig. 2), resulting in a fingerprint of primarily linear paraffins and 1-olefins, as observed for cobalt and ruthenium catalysts. Oxygenates do form, but the term “oxygenates” is too general, as virtually only linear alcohols are formed [68]. Potassium-promoted iron catalysts may also be included in this configuration. CO readily dissociates as potassium facilitates back donation [90–92]. However, the selectivity fingerprint is different from cobalt or ruthenium, as H2 is limited. The vinylic intermediate will desorb without hydrogenation resulting in a higher fraction of oxygenates and alkenes [68]. However, the promoter may only modify the local electronic environment, so not all of the FTS sites may benefit from the effect of promoters [68]. The possibility for simultaneous routes occurring on the active catalyst may be possible [68]. • Route C: strong back-donation As CO rapidly dissociates [130,131,135,145,146], the vinylic intermediate (π acceptor) will also easily dissociate, forming a carbidic phase. The X2-configuration, though present, will not possess sufficient stability and will dissociate to an active carbidic phase (Cs), which will convert to methane or inactive graphitic carbon [66,260]. This configuration occurs with nickel. After 13CO was decomposed on the surface of Ni/SiO2, immediately after, H2 and unlabeled CO produced 13CH4/12CH4, and 12CO2, suggesting that methanation involves a Cs intermediate [260]. As previously discussed, the balance maintained among adsorbed species has a dramatic effect on the selectivity fingerprint. Thus, modifications to this balance are strictly correlated to the strength of back donation from the active metal, which is adjusted by promoters (e.g., K, Rb and Cs) [77,79,80,86,261–263]. However, further changes in the fingerprint may be achieved by employing active supports (e.g., CeO2, MnO2 or zeolite) [95,107,106,235,264–275]. Ceria [271,276], a PRO, increases the selectivity to linear alcohols, as observed in Table 2 . Manganese can be used to increase the olefin content [264,267,269,277,278], carbon can be used to slightly increase alcohols and olefins [279,280], and zeolite bifunctionality can be used to increase isomerized products [272,273,281,282]. 3.4 CO2 hydrogenation The hydrogenation of CO2 may proceed through a two-step reaction mechanism [168,283–286], where CO2 is first converted to CO via RWGS, and then CO reacts to form hydrocarbons via FTS. Both cobalt and iron are active for the hydrogenation of CO2 [168,283–285,287–293]. In the case of cobalt-based catalysts, the reaction shifts from FTS toward methanation (CH4, and eventually C2- C4 hydrocarbons, are the dominant products) when CO is replaced by CO2 [168,283,285,290]. Some authors propose different reaction pathways involving CO and CO2 [293]. Others consider that CO and CO2 have the same mechanistic pathway but that the difference lies in the selectivity between CO and CO2 hydrogenation because of a different H/C ratio on the catalyst surface [291] or because of the loss of the “selective inhibition” for methanation when CO is switched to CO2 [285]. Iron catalysts are reported to be more effective than cobalt for the hydrogenation of CO2 to high molecular weight hydrocarbons. This can be attributed either to their intrinsic activity for the RWGS reaction or their ability to directly hydrogenate CO2 [285]. Middle distillates or heavy hydrocarbons can be formed depending on the catalyst formulation (e.g., amount of alkali) [285,292]. CO2 hydrogenation involves CO as an intermediate, and FTS activity is established by carbiding the iron, which is facilitated by the alkali promoter. Some authors have even reported the formation of light paraffins during CO2 hydrogenation on un- promoted iron catalyst [294,295]. The different selectivities during CO and CO2 hydrogenation can be attributed either to a different H/C ratio on the catalyst surface or to the lower stability of the active iron carbide during CO2 hydrogenation [291,292]. In fact, during CO2 hydrogenation, the fraction of Fe3O4 and other oxidized Fe species (FeOx) increases with time due to the oxidation of χ-Fe5C2 species [296,297]. In this scenario, the addition of potassium plays a key role in promoting the stability of the iron carbide site and in decreasing secondary reactions of olefins during CO2 hydrogenation [292]. In conclusion, the conventional iron catalyst can be used for the hydrogenation of CO2 to hydrocarbons; however, the formulation needs to be optimized (e.g., alkali type and loading) in order to achieve the desired selectivity [290]. 4 FT reactor development Optimization of both reactor configuration and process parameters is essential to maximize efficiency and achieve desired product selectivity [298]. In this section, recent developments in FTS reactors are discussed. Since FTS is a highly exothermic reaction, heat management is critical. Excessive reaction temperatures lead to higher methane yield, carbon deposition, and catalyst deactivation [299]. In the early stages, slurry bubble column (SBCR), multi-tubular trickle-bed, circulating fluidized-bed, and fixed fluidized-bed reactors were utilized for FTS (Fig. 3 ), and review articles are available [300–305]. 4.1 Slurry bubble column reactors The development of a low-temperature slurry phase FTS process began in 1938 by Kölbel and Ackermann [306] and the technology attained a production rate of 11.5 tons (ca. 75 bbl/day) of hydrocarbons per day. In a typical SBCR, synthesis gas enters from the bottom of the reactor and thoroughly mixes with the liquid phase containing catalyst. The reaction takes place on the catalyst surface and the product gas exits from the top, with heavier hydrocarbons being recovered from the bottom using an appropriately sized metal filter. Cooling tubes remove the heat produced by the reaction. The major issue with the slurry phase reactor was product separation from the catalyst. Since some breakthrough of catalyst occurred, activity declined [307]. A problem with conventional SBCRs is scale-up. In most cases, the initial reactor design is solely based on the reactor results from laboratory and/or pilot plant scales. Assumptions made based on preliminary testing of SBCRs at smaller scale may not apply at the industrial scale due to differences in reactor hydrodynamics [232]. However, a recent review by Guettel et al. [155] indicates that adequate models for FTS in SBCRs have been developed that could facilitate scale-up in the future. SBCR technology has been adopted by both industry as well as academia because of simplicity of operation compared to fixed-bed reactors. Deckwer et al. [308] studied the effect of different parameters on reactor performance using the three-phase model; they showed an increase in the overall conversion from 0.79 to 0.97 by increasing reaction temperature from 258 to 290 °C and pressure up to 3 MPa. Increasing H2/CO ratio in the feed continuously decreases the selectivity of C21 + and increases the selectivity of methane [308,309]. Exxon [310] and Sasol [311] have independently developed SBCRs as shown in Fig. 3a and 3b. Extensive work was done to understand the variables affecting the performance of a bubble reactor, allowing insights into churn-turbulent flow [312]; other flow pattern-based models inadequately reflected the reality of SBCR operation. 4.2 Fluidized-bed reactors Sasol has employed circulating fluidized-bed reactors (Fig. 3d) commercially for many years. One drawback is that high temperature operation is required to achieve high productivity. This precludes the use of typical high surface area catalysts, which would otherwise undergo attrition under such harsh conditions; thus, lower surface area, attrition-resistant, catalysts are used. Also, operating at high temperature results in a product distribution having lower α, resulting in a higher fraction of less environmentally benign GHG products (Table 3 ). Other problems include (1) an energy requirement to circulate the catalyst and (2) a pressure drop. The Sasol fixed fluidized-bed reactors have replaced circulating bed reactors. Currently, neither Sasol nor PetroSA plans to deploy any additional plants using this technology. Commercial FTS plants are provided in Table 4 . With the exception of the PetroSA GtL plant in Mossel Bay, all GtL facilities to date are operated by Sasol and Shell. 4.3 Fixed-bed and compact reactors The fixed-bed reactor configuration as a whole though (Fig. 3c) is desirable since it offers high throughput with plug flow behavior, lower maintenance costs, and reduced losses due to attrition and wear. Moreover, they are easily tested at small scale using a single tube. Heat management is an important challenge in fixed bed reactor design. Recently, significant advances have been made in small-scale reactors, especially in light of the current focus by the oil industry on unconventional and renewable feedstocks for syngas generation. Multi-channel fixed bed reactors are much smaller in size, and they are complicated to fabricate [314,315], but they are more mobile, which is useful for reaching stranded resources [316]. The catalytic activity in microchannel reactor can certainly be higher because of the better heat transfer; however, there is also the reactor cost, which is part of capital, and has less impact on economics unless the difference is significantly great. Manufacturing complexity leads to higher specific cost, and it is not completely clear that these reactors, though clearly smaller, are cheaper or more economical. A reason for the unclear path is because the economics are determined by a complicated combination of CO conversion, product selectivities, deactivation rates, regenerability and frequency, as well as time off-line to do it, ultimate catalyst life (replacement time interval), plus reactor and catalyst cost. Generally, cost is calculated by how many barrels can be produced over the lifetime of a catalyst (which accounts for time on stream, conversion/selectivity, and life), rather than the amount of catalyst multiplied by the specific cost. This results in $/bbl numbers for the catalyst can that can range from $1.25 to at least $8.00. The Velocys microchannel reactor [317,318] and Chart’s compact heat-exchanger reactors (CHER) [319] have gained significant attention. Recently, Velocys demonstrated their own technology on a commercial scale in Oklahoma running 2 reactors for more than 5000 h and obtaining renewable fuel credit. Velocys, and Ineratec, show that their microchannel based reactor system achieves superior FTS activity and that it is much more economical than a normal packed-bed reactor, attributing this to a highly efficient method of heat removal from catalyst sites operating at high CO conversion without producing excess methane. The methane selectivity produced by the CHER with catalysts tested was slightly higher, and C5 + selectivity was slightly lower (Table 5 ) than that of a slurry reactor; however, this was attributed in part to differences in catalyst aging. Advantages of Chart's CHER include highly efficient heat removal due to the proximity of the catalyst to aluminum heat exchanger plates. One significant advantage is that small catalyst pellets can be utilized, such that the catalyst can be easily replaced [319]. Research on catalyst development has focused on shortening the length scale of pores within pellets to minimize diffusional problems that negatively impact selectivity [321]. Because H2 diffuses more rapidly than CO within pores, the H2/CO ratio tend to increase deeper within the pore [322], such that catalyst design with shorter pore lengths (with cobalt nanoparticles closer to the pore mouth) benefits selectivity. Shortened pores were achieved on suitably sized catalyst pellets by filling in the interior with alumina; light gas selectivity significantly decreased (Table 6 ), and C5 + selectivity improved [321]. Research efforts including aqueous media as a start-up solvent for Co- or Ru-based FT catalysts offer tuning of FTS product selectivity towards oxygenates; however, catalyst stability remains an issue. Another interesting research area in fixed-bed FT reactors is running at supercritical conditions. Abbaslou et al. [323] recently reviewed the beneficial effect of supercritical media (SCM) on FTS activity and selectivity due to higher heat and mass transfer rates in comparison with conventional gas phase FTS. Fine tuning of the SCM for operation at 220 °C was achieved using a C5/C6 mixture [324]. Switching between the SCM and conventional FTS without the SCM demonstrated significant improvements in CO conversion due in part to the extraction of wax from catalyst pores. However, from a practical standpoint, separation of the SCM from the products adds cost. Structured packing reactors have become attractive in recent years due to their high efficiency for the removal of energy at gas-liquid-solid interfaces. Moreover, structured catalysts improve radial heat transport properties, allowing the application of more active catalysts and the use of larger reactor tube diameters. Different configurations of aluminum (open cross flow, closed cross flow, knitted wire, and form) as depicted in Fig. 4 have been compared for FTS. Despite the fact that these reactors accommodate less catalyst loading on a volume basis compared to traditional packed-bed reactors, they could have 25% higher C5 + productivity due to increased catalyst effectiveness [325]. Finally, monolithic membranes act as a kind of structured packing reactor in which a zeolite membrane is adopted for loading cobalt or iron and used as the catalyst for FTS [326]. The concept of forced-through membrane contactors was introduced by Khassin et al. [327–329] using inorganic membranes with highly dispersed metallic catalysts on macroporous titania-wash coated alumina supports for syngas conversion. The novel membrane based catalyst achieved steady productivity of 100–200 mg/(h cm3 of reactor volume) at 210 °C due to improved mass transfer, as well as a higher density of active component. Higher reaction rates and improved selectivity were achieved with membrane supported metal catalysts for syngas conversion compared to conventional catalysts, where conversion is often limited by the diffusion of reactants into the pores of the catalyst support, as well as by intraparticle diffusion. In general, current commercially demonstrated FT reactors are limited to slurry reactors (Sasol, GtL-F1, and Synfuels China) or multi-tubular fixed bed reactors (Shell, possibly Greyrock Energy). There are a number of technology suppliers who could be considered relatively close, although without actually having a commercial plant in operation today. Compact reactors seem to be a good choice for biomass or remote natural gas feedstocks. 5 Concluding remarks The carbon sources for syngas used in Fischer- Tropsch synthesis depend on the resources available. During World War II, syngas was mainly generated from coal, whereas nowadays, it is mainly produced from natural gas. Considering the current low carbon/CO2 policies to reduce greenhouse emissions, interest in Biomass-to-Liquids as well as Power-to-Liquids has increased. However, these technologies are quite new and additional optimization is needed in order to have commercial plants as in the case of CtL and GtL. Syngas generation followed by gas clean-up takes up 50–65% of the total cost, whereas each step of FT synthesis and product upgrading is estimated to take up to 25–30% of the cost. Syngas cleaning specifications for FTS applications are severe (H2S/COS < 0.01 μLL−1, NH3/HCN < 0.02 μLL−1, alkali and halides < 0.01 μLL−1). Optimization of gasification process conditions (e.g., temperature), as well as development of FTS catalysts more resistant to contaminants like sulfur, can greatly impact the cost analysis. To date, iron and cobalt have been the only commercial catalysts for FTS and the choice mainly depends on the H2/CO ratio of the syngas. Due to its instrinc WGS activity, iron is commonly paired with CtL and BtL, when low H2/CO syngas is available (0.5–1.2), whereas cobalt - possesing low intrinsic WGS activity - is preferred for GtL, as it requires a higher H2/CO ratio (close to 2) to be effective. As the mechanism for FTS is still under scrutiny, and the as potential for greater feedstock and product diversity is high, significantly more research and developmnet is still needed. Furthermore, sheding further light on the electronic tuning of the catalyst surface should pave the way for improving the cost effectiveness of these catalysts. Though the reaction is a century old, there are still many questions regarding the underlying catalyst that need to be answered to further our understanding of this complex process. Optimization of both reactor configuration and process parameters is essential to maximize efficiency and achieve desired product selectivity. Slurry bubble column, multi- tubular trickle-bed, circulating fluidized-bed, and fixed fluidized-bed reactors are well-known reactor designs that have been commercialized for FTS. Recently, in addition to conventional fossil fuels, another current focus by the oil industry is on unconventional and renewable (e.g., biomass) or remote (e.g., stranded natural gas) feedstocks for syngas generation; this has led to the develoment of new compact heat exchange and microchannel reactors. These systems have higher FTS activity and heat removal, although fabrication costs may be higher due to added complexity in the reactor design. Data availability statement This work is a review article and, as such, readers will need to contact referenced authors in order to obtain additional information regarding the data presented. Declaration of Competing Interest The authors report no declarations of interest. Acknowledgments Dr. Shafer would like to acknowledge support from Asbury University. Dr. Jacobs acknowledges UTSA and the State of Texas (including the Stars program) for financial support. Dr. Martinelli and Dr. Gnanamani thank the Commonwealth of Kentucky for financial support. The authors thank Chelsea Parsons for assisting with editing. References [1] I. Dimitriou H. Goldingay A.V. Bridgwater Renew. Sustain. Energy Rev. 88 2018 160 175 I. Dimitriou, H. Goldingay, A.V. Bridgwater, Techno-economic and uncertainty analysis of Biomass to Liquid (BTL) systems for transport fuel production, Renewable and Sustainable Energy Reviews, 88 (2018) 160-175. [2] H.C. Butterman M.J. Castaldi Environ. Sci. Technol. 43 2009 9030 9037 H.C. Butterman, M.J. Castaldi, CO2 as a Carbon Neutral Fuel Source via Enhanced Biomass Gasification, Environmental Science & Technology, 43 (2009) 9030- 9037. [3] Y. Zhang A.H. Sahir E.C.D. Tan M.S. Talmadge R. Davis M.J. Biddy L. Tao Green Chem. 20 2018 5358 5373 Y. Zhang, A.H. Sahir, E.C.D. Tan, M.S. Talmadge, R. Davis, M.J. Biddy, L. Tao, Economic and environmental potentials for natural gas to enhance biomass-to- liquid fuels technologies, Green Chemistry, 20 (2018) 5358- 5373. [4] C.A. Floudas J.A. Elia R.C. Baliban Comput. Chem. Eng. 41 2012 24 51 C.A. Floudas, J.A. Elia, R.C. Baliban, Hybrid and single feedstock energy processes for liquid transportation fuels: A critical review, Computers & Chemical Engineering, 41 (2012) 24-51. [5] G. Liu E.D. Larson R.H. Williams T.G. Kreutz X. Guo Energy Fuels 25 2011 415 437 G. Liu, E.D. Larson, R.H. Williams, T.G. Kreutz, X. Guo, Making Fischer−Tropsch Fuels and Electricity from Coal and Biomass: Performance and Cost Analysis, Energy & Fuels, 25 (2011) 415-437. [6] S.S. Ail S. Dasappa Renew. Sustain. Energy Rev. 58 2016 267 286 S.S. Ail, S. Dasappa, Biomass to liquid transportation fuel via Fischer Tropsch synthesis – Technology review and current scenario, Renewable and Sustainable Energy Reviews, 58 (2016) 267-286. [7] S.K. Sansaniwal M.A. Rosen S.K. Tyagi Renew. Sustain. Energy Rev. 80 2017 23 43 S.K. Sansaniwal, M.A. Rosen, S.K. Tyagi, Global challenges in the sustainable development of biomass gasification: An overview, Renewable and Sustainable Energy Reviews, 80 (2017) 23-43. [8] V.S. Sikarwar M. Zhao P.S. Fennell N. Shah E.J. Anthony Prog. Energy Combust. Sci. 61 2017 189 248 V.S. Sikarwar, M. Zhao, P.S. Fennell, N. Shah, E.J. Anthony, Progress in biofuel production from gasification, Progress in Energy and Combustion Science, 61 (2017) 189- 248. [9] P.C. Roy A. Datta N. Chakraborty Fuel 106 2013 864 868 P.C. Roy, A. Datta, N. Chakraborty, An assessment of different biomass feedstocks in a downdraft gasifier for engine application, Fuel, 106 (2013) 864-868. [10] R.C. Baliban J.A. Elia C.A. Floudas Ind. Eng. Chem. Res. 52 2013 3381 3406 R.C. Baliban, J.A. Elia, C.A. Floudas, Biomass and Natural Gas to Liquid Transportation Fuels: Process Synthesis, Global Optimization, and Topology Analysis, Industrial & Engineering Chemistry Research, 52 (2013) 3381- 3406. [11] M.J. Prins K.J. Ptasinski F.J.J.G. Janssen Fuel Process. Technol. 86 2005 375 389 M.J. Prins, K.J. Ptasinski, F.J.J.G. Janssen, Exergetic optimisation of a production process of Fischer–Tropsch fuels from biomass, Fuel Processing Technology, 86 (2005) 375-389. [12] F.A. Agblevor S. Besler A.E. Wiselogel Energy Fuels 9 1995 635 640 F.A. Agblevor, S. Besler, A.E. Wiselogel, Fast Pyrolysis of Stored Biomass Feedstocks, Energy & Fuels, 9 (1995) 635-640. [13] A. Demirbas J. Anal. Appl. Pyrolysis 76 2006 285 289 A. Demirbas, Effect of temperature on pyrolysis products from four nut shells, Journal of Analytical and Applied Pyrolysis, 76 (2006) 285-289. [14] J. Fermoso B. Arias M.G. Plaza C. Pevida F. Rubiera J.J. Pis F. García- Peña P. Casero Fuel Process. Technol. 90 2009 926 932 J. Fermoso, B. Arias, M.G. Plaza, C. Pevida, F. Rubiera, J.J. Pis, F. García-Peña, P. Casero, High- pressure co-gasification of coal with biomass and petroleum coke, Fuel Processing Technology, 90 (2009) 926-932. [15] M. Lapuerta J.J. Hernández A. Pazo J. López Fuel Process. Technol. 89 2008 828 837 M. Lapuerta, J.J. Hernández, A. Pazo, J. López, Gasification and co-gasification of biomass wastes: Effect of the biomass origin and the gasifier operating conditions, Fuel Processing Technology, 89 (2008) 828-837. [16] A. Lickrastina I. Barmina V. Suzdalenko M. Zake Fuel 90 2011 3352 3358 A. Lickrastina, I. Barmina, V. Suzdalenko, M. Zake, Gasification of pelletized renewable fuel for clean energy production, Fuel, 90 (2011) 3352-3358. [17] A. Oudshoorn C. van den Berg C.P.M. Roelands A.J.J. Straathof L.A.M. van der Wielen Process. Biochem. 45 2010 1605 1615 A. Oudshoorn, C. van den Berg, C.P.M. Roelands, A.J.J. Straathof, L.A.M. van der Wielen, Short-cut calculations for integrated product recovery options in fermentative production of bio-bulk chemicals, Process Biochemistry, 45 (2010) 1605-1615. [18] M.M. Wright D.E. Daugaard J.A. Satrio R.C. Brown Fuel 89 2010 S2 S10 M.M. Wright, D.E. Daugaard, J.A. Satrio, R.C. Brown, Techno-economic analysis of biomass fast pyrolysis to transportation fuels, Fuel, 89 (2010) S2-S10. [19] M.B. Shemfe S. Gu P. Ranganathan Fuel 143 2015 361 372 M.B. Shemfe, S. Gu, P. Ranganathan, Techno- economic performance analysis of biofuel production and miniature electric power generation from biomass fast pyrolysis and bio-oil upgrading, Fuel, 143 (2015) 361-372. [20] T. Kandaramath Hari Z. Yaakob N.N. Binitha Renew. Sustain. Energy Rev. 42 2015 1234 1244 T. Kandaramath Hari, Z. Yaakob, N.N. Binitha, Aviation biofuel from renewable resources: Routes, opportunities and challenges, Renewable and Sustainable Energy Reviews, 42 (2015) 1234-1244. [21] B. Vargas- Larreta C.A. López- Sánchez J.J. Corral- Rivas J.O. López- Martínez C.G. Aguirre- Calderón J.G. Álvarez- González Forests 8 2017 B. Vargas-Larreta, C.A. López- Sánchez, J.J. Corral-Rivas, J.O. López-Martínez, C.G. Aguirre-Calderón, J.G. Álvarez-González, Allometric Equations for Estimating Biomass and Carbon Stocks in the Temperate Forests of North-Western Mexico, Forests, 8 (2017). [22] Y.M. Bar-On R. Phillips R. Milo PNAS 115 2018 6506 6511 Y.M. Bar-On, R. Phillips, R. Milo, The biomass distribution on Earth, Proc Natl Acad Sci U S A, 115 (2018) 6506- 6511. [23] B.J. Clough M.T. Curzon G.M. Domke M.B. Russell C.W. Woodall Glob. Ecol. Biogeogr. 26 2017 1153 1164 B.J. Clough, M.T. Curzon, G.M. Domke, M.B. Russell, C.W. Woodall, Climate-driven trends in stem wood density of tree species in the eastern United States: Ecological impact and implications for national forest carbon assessmentsClimate-driven trends in stem wood density of tree species in the eastern United States: Ecological impact and implications for national forest carbon assessments, Global Ecology and Biogeography, 26 (2017) 1153-1164. [24] M.B. Gurung H. Bigsby R. Cullen U. Manandhar Forest Ecol. Manag. 356 2015 144 152 M.B. Gurung, H. Bigsby, R. Cullen, U. Manandhar, Estimation of carbon stock under different management regimes of tropical forest in the Terai Arc Landscape, Nepal, Forest Ecology and Management, 356 (2015) 144-152. [25] Y. Yao S. Piao T. Wang Sci. Bull. (Beijing) 63 2018 1108 1117 Y. Yao, S. Piao, T. Wang, Future biomass carbon sequestration capacity of Chinese forests, Science Bulletin, 63 (2018) 1108-1117. [26] A. Verma R. Kaushal N.M. Alam H. Mehta O.P. Chaturvedi D. Mandal J.M.S. Tomar A.C. Rathore C. Singh Agroforest Syst. 88 2014 895 905 A. Verma, R. Kaushal, N.M. Alam, H. Mehta, O.P. Chaturvedi, D. Mandal, J.M.S. Tomar, A.C. Rathore, C. Singh, Predictive models for biomass and carbon stocks estimation in Grewia optiva on degraded lands in western Himalaya, Agroforestry Systems, 88 (2014) 895-905. [27] A.N. Djomo C.D. Chimi Forest Ecol. Manag. 391 2017 184 193 A.N. Djomo, C.D. Chimi, Tree allometric equations for estimation of above, below and total biomass in a tropical moist forest: Case study with application to remote sensing, Forest Ecology and Management, 391 (2017) 184- 193. [28] J.J. Bukoski J.S. Broadhead D.C. Donato D. Murdiyarso T.G. Gregoire PLoS One 12 2017 e0169096 J.J. Bukoski, J.S. Broadhead, D.C. Donato, D. Murdiyarso, T.G. Gregoire, The Use of Mixed Effects Models for Obtaining Low-Cost Ecosystem Carbon Stock Estimates in Mangroves of the Asia-Pacific, PLoS One, 12 (2017) e0169096. [29] G. Galidaki D. Zianis I. Gitas K. Radoglou V. Karathanassi M. Tsakiri–Strati I. Woodhouse G. Mallinis Int. J. Remote Sens. 38 2016 1940 1966 G. Galidaki, D. Zianis, I. Gitas, K. Radoglou, V. Karathanassi, M. Tsakiri–Strati, I. Woodhouse, G. Mallinis, Vegetation biomass estimation with remote sensing: focus on forest and other wooded land over the Mediterranean ecosystem, International Journal of Remote Sensing, 38 (2016) 1940-1966. [30] S. Yang L. Xiao S. Yang A. Kraslawski Y. Man Y. Qian ACS Sustain. Chem. Eng. 2 2014 80 87 S. Yang, L. Xiao, S. Yang, A. Kraslawski, Y. Man, Y. Qian, Sustainability Assessment of the Coal/Biomass to Fischer–Tropsch Fuel Processes, ACS Sustainable Chemistry & Engineering, 2 (2014) 80-87. [31] A. Uslu A.P.C. Faaij P.C.A. Bergman Energy 33 2008 1206 1223 A. Uslu, A.P.C. Faaij, P.C.A. Bergman, Pre- treatment technologies, and their effect on international bioenergy supply chain logistics. Techno-economic evaluation of torrefaction, fast pyrolysis and pelletisation, Energy, 33 (2008) 1206-1223. [32] M.J. Prins Thermodynamic analysis of biomass gasification and torrefaction, PhD Thesis 2005 Technische Universiteit Eindhoven Netherlands M.J. Prins, Thermodynamic analysis of biomass gasification and torrefaction, TUE, Eindhoven (Netherlands); Eindhoven University of Technology, Eindhoven (Netherlands), 2005, pp. Medium: X; Size: 164 pages. [33] P. Srinivasan A.K. Sarmah R. Smernik O. Das M. Farid W. Gao Sci. Total Environ. 512- 513 2015 495 505 P. Srinivasan, A.K. Sarmah, R. Smernik, O. Das, M. Farid, W. Gao, A feasibility study of agricultural and sewage biomass as biochar, bioenergy and biocomposite feedstock: production, characterization and potential applications, Sci Total Environ, 512-513 (2015) 495-505. [34] N.U. Saqib S. Baroutian A.K. Sarmah Bioresour. Technol. 266 2018 357 363 N.U. Saqib, S. Baroutian, A.K. Sarmah, Physicochemical, structural and combustion characterization of food waste hydrochar obtained by hydrothermal carbonization, Bioresour Technol, 266 (2018) 357-363. [35] S. Munir S.S. Daood W. Nimmo A.M. Cunliffe B.M. Gibbs Bioresour. Technol. 100 2009 1413 1418 S. Munir, S.S. Daood, W. Nimmo, A.M. Cunliffe, B.M. Gibbs, Thermal analysis and devolatilization kinetics of cotton stalk, sugar cane bagasse and shea meal under nitrogen and air atmospheres, Bioresource Technology, 100 (2009) 1413- 1418. [36] A. Molino S. Chianese D. Musmarra J. Energy Chem. 25 2016 10 25 A. Molino, S. Chianese, D. Musmarra, Biomass gasification technology: The state of the art overview, Journal of Energy Chemistry, 25 (2016) 10-25. [37] V.S. Sikarwar M. Zhao P. Clough J. Yao X. Zhong M.Z. Mohammad N. Shah E.J. Anthony P.S. Fennell Energy Environ. Sci. 9 2016 2939 2977 V.S. Sikarwar, M. Zhao, P. Clough, J. Yao, X. Zhong, M.Z. Memon, N. Shah, E.J. Anthony, P.S. Fennell, An overview of advances in biomass gasification, Energy & Environmental Science, 9 (2016) 2939-2977. [38] N. Seifkar X. Lu M. Withers R. Malina R. Field S.H.H. Barrett Biomass to liquid fuels: a techno-ecomomic environmental evaluation MIT Energy Initiative Report March 2015 Seifkar N., Lu X., Withers M., Malina R., Field R., Barrett S., H. H., Biomass to liquid fuels pathways: a techno- economic enviromental evaluation, MIT Energy Initiative, March 2015. [39] Y. Zhu S.A. Tjokro Rahardjo C. Valkenburg L.J. Snowden-Swan M.A. Machinal Techno-economic analysis for the thermochemical conversion of biomass to liquid fuels 2011 Pacific Northwest National Laboratory PNNL- 19009 Zhu Y, Tjokro Rahardjo SA, Valkenburg C, Snowden-Swan LJ, M. MA, Techno-economic analysis fro the thermochemical conversion of biomass to liquid fuel, June 2011. [40] G. Jacobs B.H. Davis Conversion of Biomass to Liquid Fuels and Chemicals via the Fischer–Tropsch Synthesis Route 2010 The Royal Society of Chemistry England 95 124 G. Jacobs, B.H. Davis, Chapter 5 Conversion of Biomass to Liquid Fuels and Chemicals via the Fischer–Tropsch Synthesis Route, Thermochemical Conversion of Biomass to Liquid Fuels and Chemicalsuels and Chemicals, The Royal Society of Chemistry2010, pp. 95-124. [41] E. van Steen M. Claeys Chem. Eng. Technol. 31 2008 655 666 E. van Steen, M. Claeys, Fischer-Tropsch Catalysts for the Biomass-to-Liquid (BTL)-Process, Chemical Engineering & Technology, 31 (2008) 655-666. [42] A. Naqi J.N. Kuhn B. Joseph Biomass Bioenergy 130 2019 A. Naqi, J.N. Kuhn, B. Joseph, Techno- economic analysis of producing liquid fuels from biomass via anaerobic digestion and thermochemical conversion, Biomass and Bioenergy, 130 (2019). [43] F. Trippe M. Fröhling F. Schultmann R. Stahl E. Henrich Fuel Process. Technol. 92 2011 2169 2184 F. Trippe, M. Fröhling, F. Schultmann, R. Stahl, E. Henrich, Techno-economic assessment of gasification as a process step within biomass-to-liquid (BtL) fuel and chemicals production, Fuel Processing Technology, 92 (2011) 2169- 2184. [44] P.M. Maitlis A. de Klerk Greener Fischer-Tropsch processes: for fuels and feedstocks 2013 Wiley-VHC Verlag GmbH & Co KGaA A.d.K. Peter M. Maitlis, Greener Fischer- Tropsch Processes: For Fuels and Feedstocks, Wiley-VHC Verlag GmbH & Co2013. [45] L. Tock M. Gassner F. Maréchal Biomass Bioenergy 34 2010 1838 1854 L. Tock, M. Gassner, F. Maréchal, Thermochemical production of liquid fuels from biomass: Thermo-economic modeling, process design and process integration analysisThermochemical production of liquid fuels from biomass: Thermo-economic modeling, process design and process integration analysis, Biomass and Bioenergy, 34 (2010) 1838-1854. [46] H. Jin E.D. Larson F.E. Celik Biofuels Bioprod. Biorefin. 3 2009 142 173 H. Jin, E.D. Larson, F.E. Celik, Performance and cost analysis of future, commercially mature gasification-based electric power generation from switchgrass, Biofuels, Bioproducts and Biorefining, 3 (2009) 142-173. [47] F. Trippe M. Fröhling F. Schultmann R. Stahl E. Henrich A. Dalai Fuel Process. Technol. 106 2013 577 586 F. Trippe, M. Fröhling, F. Schultmann, R. Stahl, E. Henrich, A. Dalai, Comprehensive techno-economic assessment of dimethyl ether (DME) synthesis and Fischer–Tropsch synthesis as alternative process steps within biomass-to-liquid productionComprehensive techno-economic assessment of dimethyl ether (DME) synthesis and FischerTropsch synthesis as alternative process steps within biomass-to-liquid production, Fuel Processing Technology, 106 (2013) 577-586. [48] R.M. Swanson A. Platon J.A. Satrio R.C. Brown Fuel 89 2010 S11 S19 R.M. Swanson, A. Platon, J.A. Satrio, R.C. Brown, Techno-economic analysis of biomass-to-liquids production based on gasification, Fuel, 89 (2010) S11-S19. [49] M.J.A. Tijmensen A.P.C. Faaij C.N. Hamelinck M.R.M. van Hardeveld Biomass Bioenergy 23 2002 129 152 M.J.A. Tijmensen, A.P.C. Faaij, C.N. Hamelinck, M.R.M. van Hardeveld, Exploration of the possibilities for production of Fischer Tropsch liquids and power via biomass gasification, Biomass and Bioenergy, 23 (2002) 129-152. [50] G. Liu R.H. Williams E.D. Larson T.G. Kreutz Energy Procedia 4 2011 1989 1996 G. Liu, R.H. Williams, E.D. Larson, T.G. Kreutz, Design/economics of low-carbon power generation from natural gas and biomass with synthetic fuels co-production, Energy Procedia, 4 (2011) 1989-1996. [51] C. Wu K. Qian M. Nefliu R.G. Cooks J. Am. Soc. Mass Spectrom. 21 2010 261 267 C. Wu, K. Qian, M. Nefliu, R.G. Cooks, Ambient analysis of saturated hydrocarbons using discharge-induced oxidation in desorption electrospray ionization, J Am Soc Mass Spectrom, 21 (2010) 261-267. [52] T.J. Tarka Affordable, low-carbon diesel fuel from domestic coal and biomass National Energy Technology Laboratory 2009 DOE/NETL-2009/1349 Tarka T.J., Affordable, low-carbon diesel fuel from domestic coal and biomass, National Energy Technology Laboratory, Jan 14, 2009. [53] Y. Dong M. Steinberg Int. J. Hydrogen Energy 22 1997 971 977 Y. Dong, M. Steinberg, Hynol—An economical process for methanol production from biomass and natural gas with reduced CO2 emission, International Journal of Hydrogen Energy, 22 (1997) 971-977. [54] P. Schmidt V. Batteiger A. Roth W. Weindorf T. Raksha Chem. Ing. Tech. (Weinh) 90 2018 127 140 P. Schmidt, V. Batteiger, A. Roth, W. Weindorf, T. Raksha, Power-to-Liquids as Renewable Fuel Option for Aviation: A Review, Chemie Ingenieur Technik, 90 (2018) 127- 140. [55] A.W. Peters Y. Zhang B.H. Davis ACS, Div. Petroleum Chemistry, Preprints 46 2001 191 194 A.W. Peters, Y. Zhang, B.H. Davis, A brief historical overview of petroleum conversion by thermal and catalytic cracking, American Chemical Society, Division of Petroleum Chemistry, Preprints, 46 (2001) 191-194. [56] F.V. Vázquez J. Koponen V. Ruuskanen C. Bajamundi A. Kosonen P. Simell J. Ahola C. Frilund J. Elfving M. Reinikainen N. Heikkinen J. Kauppinen P. Piermartini J. CO2 Util. 28 2018 235 246 F.V. Vázquez, J. Koponen, V. Ruuskanen, C. Bajamundi, A. Kosonen, P. Simell, J. Ahola, C. Frilund, J. Elfving, M. Reinikainen, N. Heikkinen, J. Kauppinen, P. Piermartini, Power-to-X technology using renewable electricity and carbon dioxide from ambient air: SOLETAIR proof-of-concept and improved process concept, Journal of CO2 Utilization, 28 (2018) 235-246. [57] P. Schmidt W. Weindorf A. Roth V. Batteiger F. Riegel German Environment Agency 2016 P. Schmidt, W. Weindorf, A. Roth, V. Batteiger, F. Riegel, Power-to-liquids—Potentials and perspectives for the future supply of renewable aviation fuel, German Environment Agency, (2016). [58] D.H. König M. Freiberg R.-U. Dietrich A. Wörner Fuel 159 2015 289 297 D.H. König, M. Freiberg, R.-U. Dietrich, A. Wörner, Techno-economic study of the storage of fluctuating renewable energy in liquid hydrocarbons, Fuel, 159 (2015) 289-297. [59] M. Fasihi D. Bogdanov C. Breyer Energy Procedia 99 2016 243 268 M. Fasihi, D. Bogdanov, C. Breyer, Techno- Economic Assessment of Power-to-Liquids (PtL) Fuels Production and Global Trading Based on Hybrid PV-Wind Power Plants, Energy Procedia, 99 (2016) 243-268. [60] T. Schulzke Chem. Eng. Technol. 40 2017 254 259 Y. Zheng, J. Wang, B. Yu, W. Zhang, J. Chen, J. Qiao, J. Zhang, A review of high temperature co-electrolysis of H2O and CO2 to produce sustainable fuels using solid oxide electrolysis cells (SOECs): advanced materials and technology, Chem Soc Rev, 46 (2017) 1427-1463. [61] M. Hillestad M. Ostadi G.D. Alamo Serrano E. Rytter B. Austbø J.G. Pharoah O.S. Burheim Fuel 234 2018 1431 1451 M. Hillestad, M. Ostadi, G.d. Alamo Serrano, E. Rytter, B. Austbø, J.G. Pharoah, O.S. Burheim, Improving carbon efficiency and profitability of the biomass to liquid process with hydrogen from renewable power, Fuel, 234 (2018) 1431-1451. [62] Y. Zheng J. Wang B. Yu W. Zhang J. Chen J. Qiao J. Zhang Chem. Soc. Rev. 46 2017 1427 1436 T. Schulzke, Synergies from Direct Coupling of Biomass-to-Liquid and Power-to-Liquid Plants, Chemical Engineering & Technology, 40 (2017) 254-259. [63] C. Baumeister L. Kilian J. Econ. Perspect. 30 2016 139 160 C. Baumeister, L. Kilian, Forty Years of Oil Price Fluctuations: Why the Price of Oil May Still Surprise Us, Journal of Economic Perspectives, 30 (2016) 139-160. [64] J.D. Hamilton in: R.E. Parker and R. Whaples (Eds) Routledge Handbook of Major Events in Economy Hystory 2011 Routledge Taylor and Francis Group New York, NY 239 265 J.D. Hamilton, Historical Oil Shocks, Routledge Taylor and Francis Group, New York, NY, 2011. [65] F. King E. Shutt A.I. Thornson Platin. Met. Rev. 29 1985 146 154 F. King, E. Shutt, A.I. Thornson, Ruthenium Catalyst Systems for the Production of Hydrocarbons from Coal, Platinum Metals Review, 29 (1985) 146-154. [66] B.C. Enger A. Holmen Catal. Rev. 54 2012 437 488 B.C. Enger, A. Holmen, Nickel and Fischer- Tropsch Synthesis, Catalysis Reviews, 54 (2012) 437-488. [67] H. Schulz Appl. Catal. A Gen. 186 1999 3 12 H. Schulz, Short history and present trends of Fischer–Tropsch synthesis, Applied Catalysis A: General, 186 (1999) 3-12. [68] W.D. Shafer M.K. Gnanamani U.M. Graham J. Yang C. Masuku G. Jacobs B.H. Davis Catalysts 9 2019 259 W. Shafer, M. Gnanamani, U. Graham, J. Yang, C. Masuku, G. Jacobs, B. Davis, Fischer–Tropsch: Product Selectivity–The Fingerprint of Synthetic Fuels, Catalysts, 9 (2019) 259. [69] F.G. Botes J.W. Niemantsverdriet J. van de Loosdrecht Catal. Today 215 2013 112 120 F.G. Botes, J.W. Niemantsverdriet, J. van de Loosdrecht, A comparison of cobalt and iron based slurry phase Fischer–Tropsch synthesis, Catalysis Today, 215 (2013) 112-120. [70] D.B. Bukur V. Carreto-Vazquez H.N. Pham A.K. Datye Appl. Catal. A Gen. 266 2004 41 48 D.B. Bukur, V. Carreto-Vazquez, H.N. Pham, A.K. Datye, Attrition properties of precipitated iron Fischer–Tropsch catalysts, Applied Catalysis A: General, 266 (2004) 41-48. [71] W. Ma Y. Ding V.H. Carreto Vàzquez D.B. Bukur Appl. Catal. A Gen. 268 2004 99 106 W. Ma, Study on catalytic performance and attrition strength of the Ruhrchemie catalyst for the Fischer? Tropsch synthesis in a stirred tank slurry reactor, Applied Catalysis A: General, 268 (2004) 99-106. [72] R.J. O’Brien L. Xu S. Bao A. Raje B.H. Davis Appl. Catal. A Gen. 196 2000 173 178 R.J. O’Brien, L. Xu, S. Bao, A. Raje, B.H. Davis, Activity, selectivity and attrition characteristics of supported iron Fischer–Tropsch catalysts, Applied Catalysis A: General, 196 (2000) 173-178. [73] E. Rytter S. Eri D. Schanke H. Wigum T.H. Skagseth Ø. Borg E. Bergene Top. Catal. 54 2011 801 810 E. Rytter, S. Eri, D. Schanke, H. Wigum, T.H. Skagseth, Ø. Borg, E. Bergene, Development of an Attrition Resistant Fischer–Tropsch Catalyst for Slurry Operation, Topics in Catalysis, 54 (2011) 801-810. [74] S.A. Eliason C.H. Bartholomew Appl. Catal. A Gen. 186 1999 229 243 S.A. Eliason, C.H. Bartholomew, Reaction and deactivation kinetics for Fischer–Tropsch synthesis on unpromoted and potassium-promoted iron catalysts, Applied Catalysis A: General, 186 (1999) 229-243. [75] M.K. Gnanamani H.H. Hamdeh W.D. Shafer D.E. Sparks B.H. Davis Catal. Letters 143 2013 1123 1131 M.K. Gnanamani, H.H. Hamdeh, W.D. Shafer, D.E. Sparks, B.H. Davis, Fischer–Tropsch Synthesis: Effect of Potassium on Activity and Selectivity for Oxide and Carbide Fe Catalysts, Catalysis Letters, 143 (2013) 1123-1131. [76] V.R.R. Pendyala U.M. Graham G. Jacobs H.H. Hamdeh B.H. Davis Catal. Lett. 144 2014 1704 1716 V.R.R. Pendyala, U.M. Graham, G. Jacobs, H.H. Hamdeh, B.H. Davis, Fischer–Tropsch Synthesis: Deactivation as a Function of Potassium Promoter Loading for Precipitated Iron Catalyst, Catalysis Letters, 144 (2014) 1704- 1716. [77] M. Luo B.H. Davis Stud. Surf. Sci. Catal. 139 2007 133 140 M. Luo, B.H. Davis, Deactivation and Regeneration of Alkali Metal Promoted Iron Fischer-Tropsch Synthesis Catalysts, 139 (2007) 133-140. [78] V.R.R. Pendyala G. Jacobs J.C. Mohandas M. Luo W. Ma M.K. Gnanamani B.H. Davis Appl. Catal. A Gen. 389 2010 131 139 V.R. Rao Pendyala, G. Jacobs, J.C. Mohandas, M. Luo, W. Ma, M.K. Gnanamani, B.H. Davis, Fischer–Tropsch synthesis: Attempt to tune FTS and WGS by alkali promoting of iron catalysts, Applied Catalysis A: General, 389 (2010) 131-139. [79] M.C. Ribeiro G. Jacobs B.H. Davis D.C. Cronauer A.J. Kropf C.L. Marshall J. Phys. Chem. C 114 2010 7895 7903 M.C. Ribeiro, G. Jacobs, B.H. Davis, D.C. Cronauer, A.J. Kropf, C.L. Marshall, Fischer−Tropsch Synthesis: An In-Situ TPR-EXAFS/XANES Investigation of the Influence of Group I Alkali Promoters on the Local Atomic and Electronic Structure of Carburized Iron/Silica CatalystsFischerTropsch Synthesis: An In-Situ TPR-EXAFS/XANES Investigation of the Influence of Group I Alkali Promoters on the Local Atomic and Electronic Structure of Carburized Iron/Silica Catalysts, The Journal of Physical Chemistry C, 114 (2010) 7895- 7903. [80] H. Xiong M.A. Motchelaho M. Moyo L.L. Jewell N.J. Coville Fuel 150 2015 687 696 H. Xiong, M.A. Motchelaho, M. Moyo, L.L. Jewell, N.J. Coville, Effect of Group I alkali metal promoters on Fe/CNT catalysts in Fischer–Tropsch synthesis, Fuel, 150 (2015) 687-696. [81] Z. Tao Y. Yang C. Zhang T. Li J. Wang H. Wan H. Xiang Y. Li Catal. Commun. 7 2006 1061 1066 Z. Tao, Y. Yang, C. Zhang, T. Li, J. Wang, H. Wan, H. Xiang, Y. Li, Effect of calcium promoter on a precipitated iron–manganese catalyst for Fischer–Tropsch synthesis, Catalysis Communications, 7 (2006) 1061-1066. [82] Q. Chen W. Qian H. Zhang H. Ma Q. Sun W. Ying Catal. Commun. 124 2019 92 96 Q. Chen, W. Qian, H. Zhang, H. Ma, Q. Sun, W. Ying, Effect of Li promoter on FeMn/CNTs for light olefins from syngas, Catalysis Communications, 124 (2019) 92-96. [83] A. Nakhaei Pour S.M.K. Shahri H.R. Bozorgzadeh Y. Zamani A. Tavasoli M.A. Marvast Appl. Catal. A Gen. 348 2008 201 208 A. Nakhaei Pour, S.M.K. Shahri, H.R. Bozorgzadeh, Y. Zamani, A. Tavasoli, M.A. Marvast, Effect of Mg, La and Ca promoters on the structure and catalytic behavior of iron-based catalysts in Fischer–Tropsch synthesis, Applied Catalysis A: General, 348 (2008) 201-208. [84] S. Li A. Li S. Krishnamoorthy E. Iglesia Catal. Letters 77 2001 197 205 S. Li, A. Li, S. Krishnamoorthy, E. Iglesia, Effects of Zn, Cu, and K promoters on the structure and on the reduction, carburization, and catalytic behavior of iron-based Fischer–Tropsch synthesis catalysts, Catalysis Letters, 77 (2001) 197-205. [85] M. Ding M. Qiu J. Liu Y. Li T. Wang L. Ma C. Wu Fuel 109 2013 21 27 M. Ding, M. Qiu, J. Liu, Y. Li, T. Wang, L. Ma, C. Wu, Influence of manganese promoter on co-precipitated Fe–Cu based catalysts for higher alcohols synthesis, Fuel, 109 (2013) 21-27. [86] J. Gaube H.F. Klein Appl. Catal. A Gen. 350 2008 126 132 J. Gaube, H.F. Klein, The promoter effect of alkali in Fischer-Tropsch iron and cobalt catalysts, Applied Catalysis A: General, 350 (2008) 126-132. [87] J. Li X. Cheng C. Zhang W. Dong Y. Yang Y. Li Catal. Letters 146 2016 2574 2584 J. Li, X. Cheng, C. Zhang, W. Dong, Y. Yang, Y. Li, Comparative Study of Iron-Based Fischer–Tropsch Synthesis Catalysts Promoted with Strontium or Potassium, Catalysis Letters, 146 (2016) 2574-2584. [88] M. Luo B.H. Davis Appl. Catal. A Gen. 246 2003 171 181 M. Luo, Fischer–Tropsch synthesis: Group II alkali-earth metal promoted catalysts, Applied Catalysis A: General, 246 (2003) 171-181. [89] R.J. O’Brien L. Xu D.R. Milburn Y.-X. Li K.J. Klabunde B.H. Davis Top. Catal. 2 1995 1 15 R.J. O'Brien, L. Xu, D.R. Milburn, Y.-X. Li, K.J. Klabunde, B.H. Davis, Fischer-Tropsch synthesis: Impact of potassium and zirconium promoters on the activity and structure of an ultrafine iron oxide catalyst, Topics in Catalysis, 2 (1995) 1 -15. [90] Z.H. Chonco A. Ferreira L. Lodya M. Claeys E. van Steen J. Catal. 307 2013 283 294 Z.H. Chonco, A. Ferreira, L. Lodya, M. Claeys, E. van Steen, Comparing silver and copper as promoters in Fe- based Fischer–Tropsch catalysts using delafossite as a model compound, Journal of Catalysis, 307 (2013) 283-294. [91] Z.H. Chonco L. Lodya M. Claeys E. van Steen J. Catal. 308 2013 363 373 Z.H. Chonco, L. Lodya, M. Claeys, E. van Steen, Copper ferrites: A model for investigating the role of copper in the dynamic iron-based Fischer–Tropsch catalyst, Journal of Catalysis, 308 (2013) 363-373. [92] R.J. O’Brien B.H. Davis Catal. Letters 94 2004 1 6 R.J. O'Brien, B.H. Davis, Impact of Copper on an Alkali Promoted Iron Fischer–Tropsch Catalyst, Catalysis Letters, 94 (2004) 1-6. [93] S. Storsæter Ø. Borg E.A. Blekkan B. Tøtdal A. Holmen Catal. Today 100 2005 343 347 S. Storsæter, Ø. Borg, E.A. Blekkan, B. Tøtdal, A. Holmen, Fischer–Tropsch synthesis over Re- promoted Co supported on Al2O3, SiO2 and TiO2: Effect of water, Catalysis Today, 100 (2005) 343-347. [94] A.Y. Khodakov W. Chu P. Fongarland Chem. Rev. 107 2007 1692 1744 A.Y. Khodakov, W. Chu, P. Fongarland, Advances in the development of novel cobalt Fischer-Tropsch catalysts for synthesis of long-chain hydrocarbons and clean fuels, Chem Rev, 107 (2007) 1692-1744. [95] S.-H. Kang J.-H. Ryu J.-H. Kim P.S. Sai Prasad J.W. Bae J.-Y. Cheon K.-W. Jun Catal. Letters 141 2011 1464 1471 S.-H. Kang, J.-H. Ryu, J.-H. Kim, P.S. Sai Prasad, J.W. Bae, J.-Y. Cheon, K.-W. Jun, ZSM-5 Supported Cobalt Catalyst for the Direct Production of Gasoline Range Hydrocarbons by Fischer–Tropsch Synthesis, Catalysis Letters, 141 (2011) 1464-1471. [96] J. van de Loosdrecht M. Datt J.L. Visagie Top. Catal. 57 2013 430 436 J. van de Loosdrecht, M. Datt, J.L. Visagie, Carbon Coated Supports for Cobalt Based Fischer–Tropsch Catalysts, Topics in Catalysis, 57 (2013) 430-436. [97] Z. Yu Ø. Borg D. Chen B.C. Enger V. Frøseth E. Rytter H. Wigum A. Holmen Catal. Letters 109 2006 43 47 Z. Yu, Ø. Borg, D. Chen, B.C. Enger, V. Frøseth, E. Rytter, H. Wigum, A. Holmen, Carbon Nanofiber Supported Cobalt Catalysts for Fischer–Tropsch Synthesis with High Activity and Selectivity, Catalysis Letters, 109 (2006) 43-47. [98] M.W. Dlamini D.O. Kumi T.N. Phaahlamohlaka A.S. Lyadov D.G. Billing L.L. Jewell N.J. Coville ChemCatChem 7 2015 3000 3011 M.W. Dlamini, D.O. Kumi, T.N. Phaahlamohlaka, A.S. Lyadov, D.G. Billing, L.L. Jewell, N.J. Coville, Carbon Spheres Prepared by Hydrothermal Synthesis-A Support for Bimetallic Iron Cobalt Fischer-Tropsch Catalysts, ChemCatChem, 7 (2015) 3000-3011. [99] W. Rarogpilecka E. Miskiewicz M. Matyszek Z. Kaszkur L. Kepinski Z. Kowalczyk J. Catal. 237 2006 207 210 W. Rarogpilecka, E. Miskiewicz, M. Matyszek, Z. Kaszkur, L. Kepinski, Z. Kowalczyk, Carbon-supported cobalt catalyst for ammonia synthesis: Effect of preparation procedure, Journal of Catalysis, 237 (2006) 207-210. [100] M. Trépanier A. Tavasoli A.K. Dalai N. Abatzoglou Appl. Catal. A Gen. 353 2009 193 202 M. Trépanier, A. Tavasoli, A.K. Dalai, N. Abatzoglou, Co, Ru and K loadings effects on the activity and selectivity of carbon nanotubes supported cobalt catalyst in Fischer–Tropsch synthesis, Applied Catalysis A: General, 353 (2009) 193-202. [101] G.L. Bezemer J.H. Bitter H.P. Kuipers H. Oosterbeek J.E. Holewijn X. Xu F. Kapteijn J. Am. Chem. Soc. 128 2006 3956 3964 G.L. Bezemer, J.H. Bitter, H.P. Kuipers, H. Oosterbeek, J.E. Holewijn, X. Xu, F. Kapteijn, A.J. van Dillen, K.P. de Jong, Cobalt particle size effects in the Fischer-Tropsch reaction studied with carbon nanofiber supported catalysts, J Am Chem Soc, 128 (2006) 3956-3964. [102] T. Wang Y. Ding J. Xiong L. Yan H. Zhu Y. Lu L. Lin Catal. Letters 107 2006 47 52 T. Wang, Y. Ding, J. Xiong, L. Yan, H. Zhu, Y. Lu, L. Lin, Effect of Vanadium Promotion on Activated Carbon- Supported Cobalt Catalysts in Fischer–Tropsch Synthesis, Catalysis Letters, 107 (2006) 47-52. [103] A. Lillebø S. Håvik E.A. Blekkan A. Holmen Top. Catal. 56 2013 730 736 H. Atashi, F. Siami, A.A. Mirzaei, M. Sarkari, Kinetic study of Fischer–Tropsch process on titania- supported cobalt–manganese catalyst, Journal of Industrial and Engineering Chemistry, 16 (2010) 952-961. [104] S. Werner G.R. Johnson A.T. Bell ChemCatChem 6 2014 2881 2888 S. Werner, G.R. Johnson, A.T. Bell, Synthesis and Characterization of Supported Cobalt-Manganese Nanoparticles as Model Catalysts for Fischer-Tropsch Synthesis, ChemCatChem, 6 (2014) 2881-2888. [105] H. Atashi F. Siami A.A. Mirzaei M. Sarkari J. Ind. Eng. Chem 16 2010 952 961 D. Chakrabarti, M.K. Gnanamani, W.D. Shafer, M.C. Ribeiro, D.E. Sparks, V. Prasad, A. de Klerk, B.H. Davis, Fischer–Tropsch Mechanism: 13C18O Tracer Studies on a Ceria–Silica Supported Cobalt Catalyst and a Doubly Promoted Iron Catalyst, Industrial & Engineering Chemistry Research, 54 (2015) 6438-6453. [106] M.K. Gnanamani G. Jacobs W.D. Shafer M. Martinelli D.C. Cronauer A.J. Kropf C.L. Marshall B.H. Davis Appl. Catal. A Gen. 547 2017 115 123 M.K. Gnanamani, G. Jacobs, W.D. Shafer, M. Martinelli, D.C. Cronauer, A.J. Kropf, C.L. Marshall, B.H. Davis, Ga and In modified ceria as supports for cobalt-catalyzed Fischer- Tropsch synthesis, Applied Catalysis A: General, 547 (2017) 115- 123. [107] A. de Klerk D. Chakrabarti M.K. Gnanamani W.D. Shafer M.C. Ribeiro D.E. Sparks V. Prasad B.H. Davis Ind. Eng. Chem. Res. 54 2015 6438 6453 A. Lillebø, S. Håvik, E.A. Blekkan, A. Holmen, Fischer–Tropsch Synthesis on SiC- Supported Cobalt Catalysts, Topics in Catalysis, 56 (2013) 730- 736. [108] J.H. den Otter K.P. de Jong Top. Catal. 57 2013 445 450 J.H. den Otter, K.P. de Jong, Highly Selective and Active Niobia-Supported Cobalt Catalysts for Fischer–Tropsch Synthesis, Topics in Catalysis, 57 (2013) 445-450. [109] Y. Liu J. Chen K. Fang Y. Wang Y. Sun Catal. Commun. 8 2007 945 949 Y. Liu, J. Chen, K. Fang, Y. Wang, Y. Sun, A large pore-size mesoporous zirconia supported cobalt catalyst with good performance in Fischer–Tropsch synthesis, Catalysis Communications, 8 (2007) 945-949. [110] Y. Zhao Y. Zhang J. Chen J. Li K. Liew M.R.B. Nordin ChemCatChem 4 2012 265 272 Y. Zhao, Y. Zhang, J. Chen, J. Li, K. Liew, M.R.B. Nordin, SBA-16-Supported Cobalt Catalyst with High Activity and Stability for Fischer-Tropsch Synthesis, ChemCatChem, 4 (2012) 265-272. [111] M.K. Gnanamani G. Jacobs U.M. Graham W. Ma V.R.R. Pendyala M. Ribeiro B.H. Davis Catal. Letters 134 2009 37 44 M.K. Gnanamani, G. Jacobs, U.M. Graham, W. Ma, V.R.R. Pendyala, M. Ribeiro, B.H. Davis, Studies on KIT-6 Supported Cobalt Catalyst for Fischer–Tropsch Synthesis, Catalysis Letters, 134 (2009) 37-44. [112] Y. Wang M. Noguchi Y. Takahashi Y. Ohtsuka Catal. Today 68 2001 3 9 Y. Wang, M. Noguchi, Y. Takahashi, Y. Ohtsuka, Synthesis of SBA-15 with different pore sizes and the utilization as supports of high loading of cobalt catalysts, Catalysis Today, 68 (2001) 3-9. [113] K.M. Cook H.D. Perez C.H. Bartholomew W.C. Hecker Appl. Catal. A Gen. 482 2014 275 286 K.M. Cook, H.D. Perez, C.H. Bartholomew, W.C. Hecker, Effect of promoter deposition order on platinum-, ruthenium-, or rhenium-promoted cobalt Fischer–Tropsch catalysts, Applied Catalysis A: General, 482 (2014) 275-286. [114] G. Jacobs Y. Ji B.H. Davis D. Cronauer A.J. Kropf C.L. Marshall Appl. Catal. A Gen. 333 2007 177 191 G. Jacobs, Y. Ji, B.H. Davis, D. Cronauer, A.J. Kropf, C.L. Marshall, Fischer–Tropsch synthesis: Temperature programmed EXAFS/XANES investigation of the influence of support type, cobalt loading, and noble metal promoter addition to the reduction behavior of cobalt oxide particlesFischerTropsch synthesis: Temperature programmed EXAFS/XANES investigation of the influence of support type, cobalt loading, and noble metal promoter addition to the reduction behavior of cobalt oxide particles, Applied Catalysis A: General, 333 (2007) 177-191. [115] Ø. Borg N. Hammer S. Eri O.A. Lindvåg R. Myrstad E.A. Blekkan M. Rønning E. Rytter A. Holmen Catal. Today 142 2009 70 77 Ø. Borg, N. Hammer, S. Eri, O.A. Lindvåg, R. Myrstad, E.A. Blekkan, M. Rønning, E. Rytter, A. Holmen, Fischer–Tropsch synthesis over un- promoted and Re-promoted γ-Al2O3 supported cobalt catalysts with different pore sizes, Catalysis Today, 142 (2009) 70-77. [116] F. Diehl A.Y. Khodakov Oil Gas Sci. Technol. 64 2009 11 24 F. Diehl, A.Y. Khodakov, Promotion of Cobalt Fischer-Tropsch Catalysts with Noble Metals : a Review, 64 (2009) 11-24. [117] M. Rahmati B. Huang L.M. Schofield T.H. Fletcher B.F. Woodfield W.C. Hecker C.H. Bartholomew M.D. Argyle J. Catal. 362 2018 118 128 M. Rahmati, B. Huang, L.M. Schofield, T.H. Fletcher, B.F. Woodfield, W.C. Hecker, C.H. Bartholomew, M.D. Argyle, Effects of Ag promotion and preparation method on cobalt Fischer-Tropsch catalysts supported on silica-modified alumina, Journal of Catalysis, 362 (2018) 118-128. [118] G.P. Van Der Laan A.A.C.M. Beenackers Catal. Rev. 41 1999 255 318 G.P. Van Der Laan, A.A.C.M. Beenackers, Kinetics and Selectivity of the Fischer–Tropsch Synthesis: A Literature Review, Catalysis Reviews, 41 (1999) 255-318. [119] F. Fischer H. Tropsch Brennstoff-Chemie 4 1923 193 197 F. Fischer, H. Tropsch, Ober clie Reduktion des Ifohlenoxyds zu Methan am Eisenkontakt unter Druck, Brennstoff-Chemie, 4 (1923) 193-197. [120] F. Fischer H. Tropsch Brennstoff-Chemie 4 1923 276 285 F. Fischer, H. Tropsch, Uher die Herstellung synthetiseher Olgemische (Synthol) durch Autbau ans Kohlenoxyd und, vasserstoff., Brennstoff-Chemie, 4 (1923) 276-285. [121] F. Fischer H. Tropsch Brennstoff-Chemie 7 1926 97 104 F. Fischer, H. Tropsch, Die Erdolsynthese bei gewohnliohem Druck ans den Vergasungsprodukten der Kohlen, Brennstoff-Chemie, 7 (1926) 97-104. [122] F. Fischer Brennstoff-Chemie 8 1927 1 5 F. Fischer, Ober die Synthese der Petroleumkohlenwasserstolle, Brennstoff-Chemie, 8 (1927) 1-5. [123] F. Fischer H. Tropsch Brennstoff-Chemie 8 1927 165 167 F. Fischer, H. Tropsch, Uber das Auftreten von Synthol bei der Durchfiihrung der ErdoJsynthese unter Druck und uber die Synthese hochmolekularer Paraffinkohlenwasserstoffe aus WassergasUber das Auftreten von Synthol bei der Durchfiihrung der ErdoJsynthese unter Druck und uber die Synthese hochmolekularer Paraffinkohlenwasserstoffe aus Wassergas., Brennstoff-Chemie, 8 (1927) 165-167. [124] J.T. Kummer W.T. De P.H. Emmett J. Am. Chem. Soc. 70 1948 3632 3643 J.T. Kummer, W.T. De, P.H. Emmett, Some mechanism studies on the Fischer-Tropsch synthesis using C14, J Am Chem Soc, 70 (1948) 3632-3643. [125] J.T. Kummer H.H. Podgurski W.B. Spencer P.H. Emmett J. Am. Chem. Soc. 73 1951 564 569 J.T. Kummer, H.H. Podgurski, W.B. Spencer, P.H. Emmett, Mechanism Studies of the Fischer—Tropsch Synthesis. The Addition of Radioactive Alcohol, Journal of the American Chemical Society, 73 (1951) 564-569. [126] J.T. Kummer P.H. Emmett J. Am. Chem. Soc. 75 1953 5177 5183 J.T. Kummer, P.H. Emmett, Fischer—Tropsch Synthesis Mechanism Studies. The Addition of Radioactive Alcohols to the Synthesis Gas, Journal of the American Chemical Society, 75 (1953) 5177-5183. [127] W.K. Hall R.J. Kokes P.H. Emmett J. Am. Chem. Soc. 79 1957 2983 2989 W.K. Hall, R.J. Kokes, P.H. Emmett, Mechanism Studies of the Fischer-Tropsch Synthesis. The Addition of Radioactive Methanol, Carbon Dioxide and Gaseous FormaldehydeMechanism Studies of the Fischer-Tropsch Synthesis. The Addition of Radioactive Methanol, Carbon Dioxide and Gaseous Formaldehyde, Journal of the American Chemical Society, 79 (1957) 2983-2989. [128] R.J. Kokes W.K. Hall P.H. Emmett J. Am. Chem. Soc. 79 1957 2989 2996 R.J. Kokes, W.K. Hall, P.H. Emmett, Fischer- Tropsch Synthesis Mechanism Studies. The Addition of Radioactive Ethanol to the Synthesis Gas, Journal of the American Chemical Society, 79 (1957) 2989-2996. [129] G. Blyholder P.H. Emmett J. Phys. Chem. 64 1960 470 472 G. Blyholder, P.H. Emmett, Fischer—Tropsch Synthesis Mechanism Studies. Ii. The Addition of Radioactive Ketene to the Synthesis Gas, The Journal of Physical Chemistry, 64 (1960) 470-472. [130] R.C. Brady R. Pettit J. Am. Chem. Soc. 102 1980 6181 6182 R.C. Brady, R. Pettit, Reactions of diazomethane on transition-metal surfaces and their relationship to the mechanism of the Fischer-Tropsch reaction, Journal of the American Chemical Society, 102 (1980) 6181-6182. [131] R.C. Brady III R. Pettit Chem. Inf. 12 1981 R.C. Brady, III, R. Pettit, ChemInform Abstract: MECHANISM OF THE FISCHER-TROPSCH REACTION. THE CHAIN PROPAGATION STEP, Chemischer Informationsdienst, 12 (1981). [132] L.M. Tau H. Dabbagh S. Bao B.H. Davis Catal. Letters 7 1991 127 140 L.M. Tau, H. Dabbagh, S. Bao, B.H. Davis, Fischer-Tropsch synthesis. Evidence for two chain growth mechanisms, Catalysis Letters, 7 (1991) 127-140. [133] B.H. Davis Fuel Process. Technol. 71 2001 157 166 B.H. Davis, Fischer–Tropsch synthesis: current mechanism and futuristic needs, Fuel Processing Technology, 71 (2001) 157-166. [134] B. Shi R.J. O’Brien S. Bao B.H. Davis J. Catal. 199 2001 202 208 B. Shi, R.J. O'Brien, S. Bao, B.H. Davis, Mechanism of the Isomerization of 1-Alkene during Iron- Catalyzed Fischer–Tropsch Synthesis, Journal of Catalysis, 199 (2001) 202-208. [135] J. Cheng P. Hu P. Ellis S. French G. Kelly C.M. Lok J. Phys. Chem. C 112 2008 6082 6086 J. Cheng, P. Hu, P. Ellis, S. French, G. Kelly, C.M. Lok, Chain Growth Mechanism in Fischer−Tropsch Synthesis: A DFT Study of C–C Coupling over Ru, Fe, Rh, and Re Surfaces, The Journal of Physical Chemistry C, 112 (2008) 6082-6086. [136] J. Gaube H.F. Klein J. Mol. Catal. A Chem. 283 2008 60 68 J. Gaube, H.F. Klein, Studies on the reaction mechanism of the Fischer–Tropsch synthesis on iron and cobalt, Journal of Molecular Catalysis A: Chemical, 283 (2008) 60-68. [137] D.J. Moodley J. van de Loosdrecht A.M. Saib M.J. Overett A.K. Datye J.W. Niemantsverdriet Appl. Catal. A Gen. 354 2009 102 110 D.J. Moodley, J. van de Loosdrecht, A.M. Saib, M.J. Overett, A.K. Datye, J.W. Niemantsverdriet, Carbon deposition as a deactivation mechanism of cobalt-based Fischer–Tropsch synthesis catalysts under realistic conditions, Applied Catalysis A: General, 354 (2009) 102-110. [138] J. Gaube H.F. Klein Appl. Catal. A Gen. 374 2010 120 125 J. Gaube, H.F. Klein, Further support for the two-mechanisms hypothesis of Fischer–Tropsch synthesis, Applied Catalysis A: General, 374 (2010) 120-125. [139] N. Koizumi S. Suzuki S. Niiyama Y. Ibi T. Shindo M. Yamada Appl. Catal. A Gen. 395 2011 138 145 N. Koizumi, S. Suzuki, S. Niiyama, Y. Ibi, T. Shindo, M. Yamada, Effects of glycols on Fischer–Tropsch synthesis activity and coordination structure of Co species in Co/SiO2: Mechanism for enhanced dispersion of Co0 nanoparticlesEffects of glycols on FischerTropsch synthesis activity and coordination structure of Co species in Co/SiO2: Mechanism for enhanced dispersion of Co0 nanoparticles, Applied Catalysis A: General, 395 (2011) 138- 145. [140] R.A. van Santen A.J. Markvoort I.A. Filot M.M. Ghouri E.J. Hensen Phys. Chem. Chem. Phys. 15 2013 17038 17063 R.A. van Santen, A.J. Markvoort, I.A. Filot, M.M. Ghouri, E.J. Hensen, Mechanism and microkinetics of the Fischer-Tropsch reaction, Phys Chem Chem Phys, 15 (2013) 17038-17063. [141] J. Yang Y. Qi J. Zhu Y.-A. Zhu D. Chen A. Holmen J. Catal. 308 2013 37 49 J. Yang, Y. Qi, J. Zhu, Y.-A. Zhu, D. Chen, A. Holmen, Reaction mechanism of CO activation and methane formation on Co Fischer–Tropsch catalyst: A combined DFT, transient, and steady-state kinetic modeling, Journal of Catalysis, 308 (2013) 37-49. [142] B. Todic W. Ma G. Jacobs B.H. Davis D.B. Bukur Catal. Today 228 2014 32 39 B. Todic, W. Ma, G. Jacobs, B.H. Davis, D.B. Bukur, CO-insertion mechanism based kinetic model of the Fischer–Tropsch synthesis reaction over Re-promoted Co catalyst, Catalysis Today, 228 (2014) 32-39. [143] B. Todic W. Ma G. Jacobs B.H. Davis D.B. Bukur Catal. Today 242 2015 386 B. Todic, W. Ma, G. Jacobs, B.H. Davis, D.B. Bukur, Corrigendum to: CO-insertion mechanism based kinetic model of the Fischer–Tropsch synthesis reaction over Re-promoted Co catalyst, Catalysis Today, 242 (2015) 386. [144] R. Zhang F. Liu Q. Wang B. Wang D. Li Appl. Catal. A Gen. 525 2016 76 84 R. Zhang, F. Liu, Q. Wang, B. Wang, D. Li, Insight into CH x formation in Fischer–Tropsch synthesis on the hexahedron Co catalyst: Effect of surface structure on the preferential mechanism and existence form, Applied Catalysis A: General, 525 (2016) 76-84. [145] W. Chen I.A.W. Filot R. Pestman E.J.M. Hensen ACS Catal. 7 2017 8061 8071 W. Chen, I.A.W. Filot, R. Pestman, E.J.M. Hensen, Mechanism of Cobalt-Catalyzed CO Hydrogenation: 2. Fischer-Tropsch Synthesis, ACS Catal, 7 (2017) 8061-8071. [146] W. Chen B. Zijlstra I.A.W. Filot R. Pestman E.J.M. Hensen ChemCatChem 10 2018 136 140 W. Chen, B. Zijlstra, I.A.W. Filot, R. Pestman, E.J.M. Hensen, Mechanism of Carbon Monoxide Dissociation on a Cobalt Fischer-Tropsch Catalyst, ChemCatChem, 10 (2018) 136- 140. [147] E. Rytter A. Holmen Top. Catal. 61 2018 1024 1034 E. Rytter, A. Holmen, Consorted Vinylene Mechanism for Cobalt Fischer–Tropsch Synthesis Encompassing Water or Hydroxyl Assisted CO-Activation, Topics in Catalysis, 61 (2018) 1024-1034. [148] V. Ponec Catal. Rev. 18 1978 151 171 V. Ponec, Some Aspects of the Mechanism of Methanation and Fischer-Tropsch Synthesis, Catalysis Reviews, 18 (1978) 151-171. [149] D.-B. Cao Y.-W. Li J. Wang H. Jiao J. Mol. Catal. A Chem. 346 2011 55 69 Chain growth mechanism of Fischer-Tropsch synthesis on Fe5C2 (001). [150] M. Ojeda R. Nabar A.U. Nilekar A. Ishikawa M. Mavrikakis E. Iglesia J. Catal. 272 2010 287 297 M. Ojeda, R. Nabar, A.U. Nilekar, A. Ishikawa, M. Mavrikakis, E. Iglesia, CO activation pathways and the mechanism of Fischer–Tropsch synthesis, Journal of Catalysis, 272 (2010) 287-297. [151] M. Zhuo A. Borgna M. Saeys J. Catal. 297 2013 217 226 M. Zhuo, A. Borgna, M. Saeys, Effect of the CO coverage on the Fischer–Tropsch synthesis mechanism on cobalt catalysts, Journal of Catalysis, 297 (2013) 217-226. [152] A. Raje B.H. Davis J. Spivey Catalysis 1996 Royal Society of Chemistry Cambridge 52 131 A. Raje, B.H. Davis, Fischer-Tropsch Synthesis. Mechanism Studies Using lsotopes, in: J. Spivey (Ed.) Catalysis, Royal Society of Chemistry, Cambridge, 1996, pp. 52-131. [153] G. Henrici-Olivé S. Olive J. Mol. Catal. 24 1984 7 13 G. Henrici-Olivé, S. Olive, Mechanism of the Fischer-Tropsch synthesis: Origin of oxygenates, Journal of Molecular Catalysis, 24 (1984) 7-13. [154] W.K. Hall R.J. Kokes P.H. Emmett J. Am. Chem. Soc. 82 1960 1027 1037 W.K. Hall, R.J. Kokes, P.H. Emmett, Mechanism Studies of the Fischer-Tropsch Synthesis: The Incorporation of Radioactive Ethylene, Propionaldehyde and PropanolMechanism Studies of the Fischer-Tropsch Synthesis: The Incorporation of Radioactive Ethylene, Propionaldehyde and Propanol, Journal of the American Chemical Society, 82 (1960) 1027-1037. [155] E. van Steen H. Schulz Appl. Catal. A Gen. 186 1999 309 320 E. van Steen, H. Schulz, Polymerisation kinetics of the Fischer–Tropsch CO hydrogenation using iron and cobalt based catalysts, Applied Catalysis A: General, 186 (1999) 309-320. [156] C.J. Weststrate I.M. Ciobîcă J. van de Loosdrecht J.W. Niemantsverdriet J. Phys. Chem. C 120 2016 29210 29224 C.J. Weststrate, I.M. Ciobîcă, J. van de Loosdrecht, J.W. Niemantsverdriet, Adsorption and Decomposition of Ethene and Propene on Co(0001): The Surface Chemistry of Fischer–Tropsch Chain Growth IntermediatesAdsorption and Decomposition of Ethene and Propene on Co(0001): The Surface Chemistry of FischerTropsch Chain Growth Intermediates, The Journal of Physical Chemistry C, 120 (2016) 29210-29224. [157] B.E. Nieuwenhuys Surf. Sci. 126 1983 307 336 B.E. Nieuwenhuys, Adsorption and reactions of CO, NO, H2 and O2 on group VIII metal surfaces, Surface Science, 126 (1983) 307-336. [158] T.U. Nahm R. Gomer Surf. Sci. 384 1997 283 290 T.U. Nahm, R. Gomer, The adsorption of CO on Fe-covered W(110), Surface Science, 384 (1997) 283-290. [159] M. Kiskinova M. Tikhov Surf. Sci. 194 1988 379 396 M. Kiskinova, M. Tikhov, Adsorption of CO on Ru(100) doped with different amounts of K and Cs, Surface Science, 194 (1988) 379-396. [160] B. Sieben H.P. Bonzel Surf. Sci. Lett. 282 1993 B. Sieben, H.P. Bonzel, Adsorption of H2 and CO on Mn/Fe(110) surfaces, Surface Science Letters, 282 (1993). [161] M.P. Kiskinova Surf. Sci. 111 1981 584 594 M.P. Kiskinova, CO adsorption on alkali-metal covered Ni(100), Surface Science, 111 (1981) 584-594. [162] X.-h. Zhao Y.-w. Li J.-g. Wang C.-f. Huo J. Fuel Chem. Technol. 39 2011 956 960 X.-h. Zhao, Y.-w. Li, J.-g. Wang, C.-f. Huo, CO adsorption, CO dissociation, and C-C coupling on Cu monolayer- covered Fe(100), Journal of Fuel Chemistry and Technology, 39 (2011) 956-960. [163] N.D.S. Canning M.A. Chesters Surf. Sci. Lett. 175 1986 L811 L816 N.D.S. Canning, M.A. Chesters, The co- adsorption of H2 and CO on Ni(110), Surface Science Letters, 175 (1986) L811-L816. [164] D. Dwyer G.A. Samorjai J. Catal. 56 1979 249 257 D. Dwyer, The role of readsorption in determining the product distribution during CO hydrogenation over Fe single crystals, Journal of Catalysis, 56 (1979) 249- 257. [165] Y. Aray J. Rodriguez Surf. Sci. 405 1998 L532 L541 Y. Aray, J. Rodriguez, Study of CO adsorption on the Fe(100) surface using the Laplacian of the electronic charge density, Surface Science, 405 (1998) L532-L541. [166] C. Lemire R. Meyer V.E. Henrich S. Shaikhutdinov H.J. Freund Surf. Sci. 572 2004 103 114 C. Lemire, R. Meyer, V.E. Henrich, S. Shaikhutdinov, H.J. Freund, The surface structure of Fe3O4(111) films as studied by CO adsorption, Surface Science, 572 (2004) 103-114. [167] P. Rochana J. Wilcox Surf. Sci. 605 2011 681 688 P. Rochana, J. Wilcox, A theoretical study of CO adsorption on FeCo(100) and the effect of alloying, Surface Science, 605 (2011) 681-688. [168] T. Riedel M. Claeys H. Schulz G. Schaub S.-S. Nam K.-W. Jun M.-J. Choi G. Kishan K.-W. Lee Appl. Catal. A Gen. 186 1999 201 213 T. Riedel, M. Claeys, H. Schulz, G. Schaub, S.-S. Nam, K.-W. Jun, M.-J. Choi, G. Kishan, K.-W. Lee, Comparative study of Fischer–Tropsch synthesis with H2/CO and H2/CO2 syngas using Fe- and Co-based catalysts, Applied Catalysis A: General, 186 (1999) 201-213. [169] M. Zhuo K.F. Tan A. Borgna M. Saeys J. Phys. Chem. C 113 2009 8357 8365 M. Zhuo, K.F. Tan, A. Borgna, M. Saeys, Density Functional Theory Study of the CO Insertion Mechanism for Fischer−Tropsch Synthesis over Co Catalysts, The Journal of Physical Chemistry C, 113 (2009) 8357-8365. [170] B.H. Davis Catal. Today 141 2009 25 33 Fischer-Tropsch Synthesis: Reaction mechanisms for iron catalysts. [171] D.G.H. Ballard J. Mol. Catal. 19 1983 393 397 D.G.H. Ballard, Mechanism of fischer-tropsch synthesis: CH2 polymerisation versus CO insertion, Journal of Molecular Catalysis, 19 (1983) 393-397. [172] G. Henrici-Olivé S. Olivé J. Mol. Catal. 16 1982 111 115 G. Henrici-Olivé, S. Olivé, Mechanism of Fischer—Tropsch Synthesis: CH2—Polymerization versus CO Insertion, Journal of Molecular Catalysis, 16 (1982) 111-115. [173] A.P. Petersen M. Claeys P.J. Kooyman E. van Steen Catalysts 9 2019 794 A.P. Petersen, M. Claeys, P.J. Kooyman, E. van Steen, Cobalt-Based Fischer–Tropsch Synthesis: A Kinetic Evaluation of Metal–Support Interactions Using an Inverse Model System, Catalysts, 9 (2019). [174] B.-T. Teng J. Chang C.-H. Zhang D.-B. Cao J. Yang Y. Liu X.-H. Guo H.-W. Xiang Y.-W. Li Appl. Catal. A Gen. 301 2006 39 50 B.-T. Teng, J. Chang, C.-H. Zhang, D.-B. Cao, J. Yang, Y. Liu, X.-H. Guo, H.-W. Xiang, Y.-W. Li, A comprehensive kinetics model of Fischer–Tropsch synthesis over an industrial Fe–Mn catalyst, Applied Catalysis A: General, 301 (2006) 39-50. [175] P. Sonal K.K. Pant S. Upadhyayula Fuel 236 2019 1263 1272 Sonal, K.K. Pant, S. Upadhyayula, Detailed kinetics of Fischer Tropsch synthesis over Fe-Co bimetallic catalyst considering chain length dependent olefin desorption, Fuel, 236 (2019) 1263-1272. [176] C.G. Visconti E. Tronconi L. Lietti P. Forzatti S. Rossini R. Zennaro Top. Catal. 54 2011 786 800 C.G. Visconti, E. Tronconi, L. Lietti, P. Forzatti, S. Rossini, R. Zennaro, Detailed Kinetics of the Fischer–Tropsch Synthesis on Cobalt Catalysts Based on H-Assisted CO Activation, Topics in Catalysis, 54 (2011) 786-800. [177] F.G. Botes B.B. Breman Ind. Eng. Chem. Res. 45 2006 7415 7426 F.G. Botes, B.B. Breman, Development and Testing of a New Macro Kinetic Expression for the Iron-Based Low-Temperature Fischer−Tropsch Reaction, Industrial & Engineering Chemistry Research, 45 (2006) 7415- 7426. [178] F.G. Botes B. van Dyk C. McGregor Ind. Eng. Chem. Res. 48 2009 10439 10447 F.G. Botes, B. van Dyk, C. McGregor, The Development of a Macro Kinetic Model for a Commercial Co/Pt/Al2O3Fischer−Tropsch Catalyst, Industrial & Engineering Chemistry Research, 48 (2009) 10439-10447. [179] M. Rothaemel K.F. Hanssen E.A. Blekkan D. Schanke A. Holmen Catal. Today 38 1997 79 84 M. Rothaemel, K.F. Hanssen, E.A. Blekkan, D. Schanke, A. Holmen, The effect of water on cobalt Fischer- Tropsch catalysts studied by steady-state isotopic transient kinetic analysis (SSITKA), Catalysis Today, 38 (1997) 79-84. [180] F.G. Botes Catal. Rev. 50 2008 471 491 F.G. Botes, The Effects of Water and CO2on the Reaction Kinetics in the Iron‐Based Low‐Temperature Fischer‐Tropsch Synthesis: A Literature Review, Catalysis Reviews, 50 (2008) 471-491. [181] Y. Sun Z. Jia G. Yang L. Zhang Z. Sun Int. J. Hydrogen Energy 42 2017 29222 29235 Y. Sun, Z. Jia, G. Yang, L. Zhang, Z. Sun, Fischer-Tropsch synthesis using iron based catalyst in a microchannel reactor: Performance evaluation and kinetic modeling, International Journal of Hydrogen Energy, 42 (2017) 29222-29235. [182] M.K. Gnanamani G. Jacobs W.D. Shafer D.E. Sparks B.H. Davis Catal. Letters 141 2011 1420 1428 M.K. Gnanamani, G. Jacobs, W.D. Shafer, D. Sparks, B.H. Davis, Fischer–Tropsch Synthesis: Deuterium Kinetic Isotope Study for Hydrogenation of Carbon Oxides Over Cobalt and Iron CatalystsFischerTropsch Synthesis: Deuterium Kinetic Isotope Study for Hydrogenation of Carbon Oxides Over Cobalt and Iron Catalysts, Catalysis Letters, 141 (2011) 1420- 1428. [183] J. Yang W.D. Shafer V.R.R. Pendyala G. Jacobs W. Ma D. Chen A. Holmen B.H. Davis Top. Catal. 57 2013 508 517 J. Yang, W.D. Shafer, V.R.R. Pendyala, G. Jacobs, W. Ma, D. Chen, A. Holmen, B.H. Davis, Fischer–Tropsch Synthesis: Deuterium Kinetic Isotopic Effect for a 2.5 % Ru/NaY Catalyst, Topics in Catalysis, 57 (2013) 508-517. [184] G. Lozano-Blanco J.W. Thybaut K. Surla P. Galtier G.B. Marin Oil Gas Sci. Technol. 61 2007 489 496 G. Lozano-Blanco, J.W. Thybaut, K. Surla, P. Galtier, G.B. Marin, Fischer-Tropsch Synthesis: Development of a Microkinetic Model for Metal Catalysis, Oil & Gas Science and Technology - Revue de l'IFP, 61 (2007) 489-496. [185] W. Ma G. Jacobs R. Keogh C.H. Yen J.L.S. Klettlinger B.H. Davis ACS Symposium Series 1084 2011 127 153 W. Ma, G. Jacobs, R. Keogh, C.H. Yen, J.L.S. Klettlinger, B.H. Davis, Fischer-Tropsch synthesis: Effect of Pt promoter on activity, selectivities to hydrocarbons and oxygenates, and kinetic parameters over 15%Co/Al 2O3Fischer- Tropsch synthesis: Effect of Pt promoter on activity, selectivities to hydrocarbons and oxygenates, and kinetic parameters over 15%Co/Al 2O3, ACS Symposium Series, 1084 (2011) 127-153. [186] T.K. Das X. Zhan J. Li G. Jacobs M.E. Dry B.H. Davis Stud. Surf. Sci. Catal. 163 2007 289 314 T.K. Das, X. Zhan, J. Li, G. Jacobs, M.E. Dry, B.H. Davis, Fischer-Tropsch Synthesis: Kinetics and Effect of Water for a Co/Al2O3 Catalyst, Studies in Surface Science and Catalysis, 163 (2007) 289-314. [187] W. Ma G. Jacobs T.K. Das C.M. Masuku J. Kang V.R.R. Pendyala B.H. Davis J.L.S. Klettlinger C.H. Yen Ind. Eng. Chem. Res. 53 2014 2157 2166 W. Ma, G. Jacobs, T.K. Das, C.M. Masuku, J. Kang, V.R.R. Pendyala, B.H. Davis, J.L.S. Klettlinger, C.H. Yen, Fischer–Tropsch Synthesis: Kinetics and Water Effect on Methane Formation over 25%Co/γ-Al2O3 Catalyst, Industrial & Engineering Chemistry Research, 53 (2014) 2157-2166. [188] W. Ma G. Jacobs D.E. Sparks R.L. Spicer B.H. Davis J.L.S. Klettlinger C.H. Yen Catal. Today 228 2014 158 166 W. Ma, G. Jacobs, D.E. Sparks, R.L. Spicer, B.H. Davis, J.L.S. Klettlinger, C.H. Yen, Fischer–Tropsch synthesis: Kinetics and water effect study over 25%Co/Al2O3 catalysts, Catalysis Today, 228 (2014) 158-166. [189] W. Ma G. Jacobs D.E. Sparks M.K. Gnanamani V.R.R. Pendyala C.H. Yen J.L.S. Klettlinger T.M. Tomsik B.H. Davis Fuel 90 2011 756 765 W. Ma, G. Jacobs, D.E. Sparks, M.K. Gnanamani, V.R.R. Pendyala, C.H. Yen, J.L.S. Klettlinger, T.M. Tomsik, B.H. Davis, Fischer–Tropsch synthesis: Support and cobalt cluster size effects on kinetics over Co/Al2O3 and Co/SiO2 catalysts, Fuel, 90 (2011) 756-765. [190] W. Ma W.D. Shafer M. Martinelli D.E. Sparks B.H. Davis Catal. Today 343 2020 137 145 W. Ma, W.D. Shafer, M. Martinelli, D.E. Sparks, B.H. Davis, Fischer-Tropsch synthesis: Using deuterium tracer coupled with kinetic approach to study the kinetic isotopic effects of iron, cobalt and ruthenium catalystss of iron, cobalt and ruthenium catalysts, Catalysis Today, (2019). [191] T.K. Das W.A. Conner J. Li G. Jacobs M.E. Dry B.H. Davis Energy Fuels 19 2005 1430 1439 T.K. Das, W.A. Conner, J. Li, G. Jacobs, M.E. Dry, B.H. Davis, Fischer−Tropsch Synthesis: Kinetics and Effect of Water for a Co/SiO2Catalyst, Energy & Fuels, 19 (2005) 1430-1439. [192] S. Mousavi A. Zamaniyan M. Irani M. Rashidzadeh Appl. Catal. A Gen. 506 2015 57 66 S. Mousavi, A. Zamaniyan, M. Irani, M. Rashidzadeh, Generalized kinetic model for iron and cobalt based Fischer–Tropsch synthesis catalysts: Review and model evaluation, Applied Catalysis A: General, 506 (2015) 57-66. [193] H. Wang Y. Yang B.-S. Wu J. Xu M.-Y. Ding H.-L. Wang W.-H. Fan H.-W. Xiang Y.-W. Li J. Mol. Catal. A Chem. 308 2009 96 107 H. Wang, Y. Yang, B.-S. Wu, J. Xu, M.-Y. Ding, H.-L. Wang, W.-H. Fan, H.-W. Xiang, Y.-W. Li, Hydrogen reduction kinetics modeling of a precipitated iron Fischer–Tropsch catalyst, Journal of Molecular Catalysis A: Chemical, 308 (2009) 96-107. [194] J. Patzlaff Y. Liu C. Graffmann J. Gaube Catal. Today 71 2002 381 394 J. Patzlaff, Y. Liu, C. Graffmann, J. Gaube, Interpretation and kinetic modeling of product distributions of cobalt catalyzed Fischer–Tropsch synthesis, Catalysis Today, 71 (2002) 381-394. [195] I.C. Yates C.N. Satterfield Energy Fuels 5 1991 168 173 I.C. Yates, C.N. Satterfield, Intrinsic kinetics of the Fischer-Tropsch synthesis on a cobalt catalyst, Energy & Fuels, 5 (1991) 168-173. [196] G.P. van der Laan A.A.C.M. Beenackers Appl. Catal. A Gen. 193 2000 39 53 G.P. van der Laan, A.A.C.M. Beenackers, Intrinsic kinetics of the gas–solid Fischer–Tropsch and water gas shift reactions over a precipitated iron catalyst, Applied Catalysis A: General, 193 (2000) 39-53. [197] B. Shi C. Jin Appl. Catal. A Gen. 393 2011 178 183 B. Shi, C. Jin, Inverse kinetic isotope effects and deuterium enrichment as a function of carbon number during formation of C–C bonds in cobalt catalyzed Fischer–Tropsch synthesis, Applied Catalysis A: General, 393 (2011) 178-183. [198] Y. Qi J. Yang A. Holmen D. Chen Catalysts 9 2019 551 Y. Qi, J. Yang, A. Holmen, D. Chen, Investigation of C1 + C1 Coupling Reactions in Cobalt-Catalyzed Fischer-Tropsch Synthesis by a Combined DFT and Kinetic Isotope Study, Catalysts, 9 (2019). [199] S. Golestan A.A. Mirzaei H. Atashi Fuel 200 2017 407 418 S. Golestan, A.A. Mirzaei, H. Atashi, Kinetic and mechanistic studies of Fischer-Tropsch synthesis over the nano-structured iron–cobalt–manganese catalyst prepared by hydrothermal procedureKinetic and mechanistic studies of Fischer-Tropsch synthesis over the nano-structured ironcobaltmanganese catalyst prepared by hydrothermal procedure, Fuel, 200 (2017) 407-418. [200] F.G. Botes Kinetic and selectivity modelling of the iron- based low-temperature Fischer-Tropsch sythesis, PhD Thesis 2008 Technische Universiteit Eindhoven Netherlands 10.6100/IR638544 F.G. Botes, Kinetic and selectivity modelling of the iron-based low- temperature Fischer-Tropsch synthesis, Technische Universiteit Eindhoven, 2008. [201] B. Todic T. Bhatelia G.F. Froment W. Ma G. Jacobs B.H. Davis D.B. Bukur Ind. Eng. Chem. Res. 52 2013 669 679 B. Todic, T. Bhatelia, G.F. Froment, W. Ma, G. Jacobs, B.H. Davis, D.B. Bukur, Kinetic Model of Fischer–Tropsch Synthesis in a Slurry Reactor on Co–Re/Al2O3 Catalyst, Industrial & Engineering Chemistry Research, 52 (2013) 669-679. [202] B. Todic W. Ma G. Jacobs N. Nikacevic B.H. Davis D.B. Bukur Int. J. Chem. Kinet. 49 2017 859 874 B. Todic, W. Ma, G. Jacobs, N. Nikacevic, B.H. Davis, D.B. Bukur, Kinetic Modeling of Secondary Methane Formation and 1-Olefin Hydrogenation in Fischer-Tropsch Synthesis over a Cobalt Catalyst, International Journal of Chemical Kinetics, 49 (2017) 859-874. [203] N. Nikbakht A.A. Mirzaei H. Atashi Fuel 229 2018 209 216 N. Nikbakht, A.A. Mirzaei, H. Atashi, Kinetic modeling of the Fischer-Tropsch reaction over a zeolite supported Fe-Co-Ce catalyst prepared using impregnation procedure, Fuel, 229 (2018) 209-216. [204] H. Schulz M. Claeys Appl. Catal. A Gen. 186 1999 91 107 H. Schulz, M. Claeys, Kinetic modelling of Fischer–Tropsch product distributions, Applied Catalysis A: General, 186 (1999) 91-107. [205] M. Ojeda A. Li R. Nabar A.U. Nilekar M. Mavrikakis E. Iglesia J. Phys. Chem. C 114 2010 19761 19770 M. Ojeda, A. Li, R. Nabar, A.U. Nilekar, M. Mavrikakis, E. Iglesia, Kinetically Relevant Steps and H2/D2 Isotope Effects in Fischer−Tropsch Synthesis on Fe and Co Catalysts, The Journal of Physical Chemistry C, 114 (2010) 19761 -19770. [206] A.A. Mirzaei R. Sarani H.R. Azizi S. Vahid H.O. Torshizi Fuel 140 2015 701 710 A.A. Mirzaei, R. Sarani, H.R. Azizi, S. Vahid, H.O. Torshizi, Kinetics modeling of Fischer–Tropsch synthesis on the unsupported Fe-Co-Ni (ternary) catalyst prepared using co- precipitation procedure, Fuel, 140 (2015) 701-710. [207] Y.-N. Wang W.-P. Ma Y.-J. Lu J. Yang Y.-Y. Xu H.-W. Xiang Y.-W. Li Y.-L. Zhao B.-J. Zhang Fuel 82 2003 195 213 Y.-N. Wang, W.-P. Ma, Y.-J. Lu, J. Yang, Y.-Y. Xu, H.-W. Xiang, Y.-W. Li, Y.-L. Zhao, B.-J. Zhang, Kinetics modelling of Fischer–Tropsch synthesis over an industrial Fe–Cu–K catalyst, Fuel, 82 (2003) 195-213. [208] K. Keyvanloo M.J. Fisher W.C. Hecker R.J. Lancee G. Jacobs C.H. Bartholomew J. Catal. 327 2015 33 47 K. Keyvanloo, M.J. Fisher, W.C. Hecker, R.J. Lancee, G. Jacobs, C.H. Bartholomew, Kinetics of deactivation by carbon of a cobalt Fischer–Tropsch catalyst: Effects of CO and H2 partial pressures, Journal of Catalysis, 327 (2015) 33- 47. [209] H. Schulz K. Beck E. Erich Fuel Process. Technol. 18 1988 293 304 H. Schulz, K. Beck, E. Erich, Kinetics of Fischer-Tropsch selectivity, Fuel Processing Technology, 18 (1988) 293-304. [210] S. Bepari N. Mohammad S. Aravamudhan D. Kuila Catalysts 9 2019 872 Mohammad, Bepari, Aravamudhan, Kuila, Kinetics of Fischer–Tropsch Synthesis in a 3-D Printed Stainless Steel Microreactor Using Different Mesoporous Silica Supported Co-Ru CatalystsKinetics of FischerTropsch Synthesis in a 3-D Printed Stainless Steel Microreactor Using Different Mesoporous Silica Supported Co-Ru Catalysts, Catalysts, 9 (2019). [211] R. Zennaro M. Tagliabue C.H. Bartholomew Catal. Today 58 2000 309 319 R. Zennaro, M. Tagliabue, C.H. Bartholomew, Kinetics of Fischer–Tropsch synthesis on titania- supported cobalt, Catalysis Today, 58 (2000) 309-319. [212] C.G. Visconti L. Lietti E. Tronconi S. Rossini Can. J. Chem. Eng. 94 2016 685 695 C.G. Visconti, L. Lietti, E. Tronconi, S. Rossini, Kinetics of low-temperature Fischer-Tropsch synthesis on cobalt catalysts: Are both slurry autoclave and tubular packed-bed reactors adequate to collect relevant data at lab-scale?, The Canadian Journal of Chemical Engineering, 94 (2016) 685- 695. [213] T. Bhatelia W. Ma B. Davis G. Jacobs D. Bukur Chem. Eng. Trans. 25 2010 707 712 T. Bhatelia, W. Ma, B. Davis, G. Jacobs, D. Bukur, Kinetics of the Fischer-Tropsch Reaction over a Ru- Promoted Co/Al2O3 Catalyst, (2010) 707-712. [214] S. Ledakowicz H. Nettelhoff R. Kokuun W.D. Deckwer Ind. Eng. Chem. Process. Des. Dev. 24 1985 1043 1049 S. Ledakowicz, H. Nettelhoff, R. Kokuun, W.D. Deckwer, Kinetics of the Fischer-Tropsch synthesis in the slurry phase on a potassium promoted iron catalyst, Industrial & Engineering Chemistry Process Design and Development, 24 (1985) 1043-1049. [215] D. Selvatico A. Lanzini M. Santarelli Fuel 186 2016 544 560 D. Selvatico, A. Lanzini, M. Santarelli, Low Temperature Fischer-Tropsch fuels from syngas: Kinetic modeling and process simulation of different plant configurationsLow Temperature Fischer-Tropsch fuels from syngas: Kinetic modeling and process simulation of different plant configurations, Fuel, 186 (2016) 544-560. [216] P. Azadi G. Brownbridge I. Kemp S. Mosbach J.S. Dennis M. Kraft ChemCatChem 7 2015 137 143 P. Azadi, G. Brownbridge, I. Kemp, S. Mosbach, J.S. Dennis, M. Kraft, Microkinetic Modeling of the Fischer- Tropsch Synthesis over Cobalt Catalysts, ChemCatChem, 7 (2015) 137-143. [217] S. Storsæter D. Chen A. Holmen Surf. Sci. 600 2006 2051 2063 S. Storsæter, D. Chen, A. Holmen, Microkinetic modelling of the formation of C1 and C2 products in the Fischer–Tropsch synthesis over cobalt catalysts, Surface Science, 600 (2006) 2051 -2063. [218] Y. Qi J. Yang D. Chen A. Holmen Catal. Letters 145 2014 145 161 Y. Qi, J. Yang, D. Chen, A. Holmen, Recent Progresses in Understanding of Co-Based Fischer–Tropsch Catalysis by Means of Transient Kinetic Studies and Theoretical Analysis, Catalysis Letters, 145 (2014) 145-161. [219] J. Van Belleghem C. Ledesma J. Yang K. Toch D. Chen J.W. Thybaut G.B. Marin Appl. Catal. A Gen. 524 2016 149 162 J. Van Belleghem, C. Ledesma, J. Yang, K. Toch, D. Chen, J.W. Thybaut, G.B. Marin, A Single-Event MicroKinetic model for the cobalt catalyzed Fischer-Tropsch Synthesis, Applied Catalysis A: General, 524 (2016) 149-162. [220] S. Mousavi A. Zamaniyan M. Irani M. Rashidzadeh J. Nat. Gas Sci. Eng. 34 2016 1333 1346 S. Mousavi, A. Zamaniyan, M. Irani, M. Rashidzadeh, Statistical investigation of macro kinetics for iron and cobalt based Fischer-Tropsch synthesis: Mechanistic and kinetic implicationsStatistical investigation of macro kinetics for iron and cobalt based Fischer-Tropsch synthesis: Mechanistic and kinetic implications, Journal of Natural Gas Science and Engineering, 34 (2016) 1333-1346. [221] H. Schulz G. Schaub M. Claeys T. Riedel Appl. Catal. A Gen. 186 1999 215 227 H. Schulz, G. Schaub, M. Claeys, T. Riedel, Transient initial kinetic regimes of Fischer–Tropsch synthesis, Applied Catalysis A: General, 186 (1999) 215-227. [222] C. Kellner J. Catal. 67 1981 175 185 C. Kellner, Evidence for H2/D2 isotope effects on fischer-tropsch synthesis over supported ruthenium catalysts, Journal of Catalysis, 67 (1981) 175-185. [223] W.D. Shafer J.P. Selegue G. Jacobs B.H. Davis Catal. Letters 143 2013 1368 1373 W.D. Shafer, J.P. Selegue, G. Jacobs, B.H. Davis, An Investigation of the Partitioning of Dissociated H2 and D2 on Activated Nickel Catalysts, Catalysis Letters, 143 (2013) 1368- 1373. [224] W.D. Shafer V.R.R. Pendyala M.K. Gnanamani G. Jacobs J.P. Selegue S.D. Hopps G.A. Thomas B.H. Davis Catal. Letters 145 2015 1683 1690 W.D. Shafer, V.R.R. Pendyala, M.K. Gnanamani, G. Jacobs, J.P. Selegue, S.D. Hopps, G.A. Thomas, B.H. Davis, Isotopic Apportioning of Hydrogen/Deuterium on the Surface of an Activated Iron Carbide Catalyst, Catalysis Letters, 145 (2015) 1683-1690. [225] W.D. Shafer G. Jacobs B.H. Davis ACS Catal. 2 2012 1452 1456 W.D. Shafer, G. Jacobs, B.H. Davis, Fischer–Tropsch Synthesis: Investigation of the Partitioning of Dissociated H2 and D2 on Activated Cobalt Catalysts, ACS Catalysis, 2 (2012) 1452- 1456. [226] W.D. Shafer Investigation into the competitive partitioning of dissocated H2 and D2 on activated Fischer-Tropsch catalyst, PhD Thesis 2015 University of Kentucky U.S.A W.D. Shafer, Investigation in to the Competitive Partitioning of Dissocated H2 and D2 on Activated Fischer-Tropsch Catalysts, Chemistry, University of Kentucky, 2015, pp. 171. [227] C. Benndorf L. Meyer Surf. Sci. 251- 252 1991 872 876 C. Benndorf, L. Meyer, CO adsorption on Ni (551), Surface Science, 251-252 (1991) 872-876. [228] P.J. Berlowitz D. Wayne Goodman Surf. Sci. Lett. 187 1987 A329 P.J. Berlowitz, D. Wayne Goodman, The adsorption of H2 and CO on strained Ni overlayers on W(110) and W(100), Surface Science Letters, 187 (1987). [229] S.L. Bernasek M. Zappone J. Ping Surf. Sci. 272 1992 53 64 S.L. Bernasek, M. Zappone, J. Ping, Adsorption and coadsorption of CO and H2 on Fe(111) probed by TEAS, Surface Science, 272 (1992) 53-64. [230] A. Eichler Surf. Sci. 526 2003 332 340 A. Eichler, CO adsorption on Ni––a density functional theory study, Surface Science, 526 (2003) 332-340. [231] N.S. Govender M.H.J.M. de Croon J.C. Schouten Appl. Catal. A Gen. 373 2010 81 89 N.S. Govender, M.H.J.M. de Croon, J.C. Schouten, Reactivity of surface carbonaceous intermediates on an iron-based Fischer–Tropsch catalyst, Applied Catalysis A: General, 373 (2010) 81-89. [232] P.M. Maitlis V. Zanotti Catal. Letters 122 2007 80 83 P.M. Maitlis, V. Zanotti, Organometallic Models for Metal Surface Reactions: Chain Growth Involving Electrophilic Methylidynes in the Fischer–Tropsch Reaction, Catalysis Letters, 122 (2007) 80-83. [233] M. Freemantle Chem. Eng. News 74 1996 31 33 M. Freemantle, New Catalytic Cycle Proposed For Fischer-Tropsch Synthesis, Chemical & Engineering News, 74 (1996) 31-33. [234] G.J.A. Mannie L. Lammich Y.-W. Li J.W. Niemantsverdriet J.V. Lauritsen ACS Catal. 4 2014 3255 3260 G.J.A. Mannie, L. Lammich, Y.-W. Li, J.W. Niemantsverdriet, J.V. Lauritsen, Monolayer Iron Carbide Films on Au(111) as a Fischer–Tropsch Model Catalyst, ACS Catalysis, 4 (2014) 3255-3260. [235] M.K. Gnanamani G. Jacobs U.M. Graham M.C. Ribeiro F.B. Noronha W.D. Shafer B.H. Davis Catal. Today 261 2016 40 47 M.K. Gnanamani, G. Jacobs, U.M. Graham, M.C. Ribeiro, F.B. Noronha, W.D. Shafer, B.H. Davis, Influence of carbide formation on oxygenates selectivity during Fischer- Tropsch synthesis over Ce-containing Co catalysts, Catalysis Today, 261 (2016) 40-47. [236] C.J. Weststrate P. van Helden J. van de Loosdrecht J.W. Niemantsverdriet Surf. Sci. 648 2016 60 66 C.J. Weststrate, P. van Helden, J. van de Loosdrecht, J.W. Niemantsverdriet, Elementary steps in Fischer–Tropsch synthesis: CO bond scission, CO oxidation and surface carbiding on Co(0001), Surface Science, 648 (2016) 60-66. [237] C. Bertole G. Kiss C.A. Mims J. Catal. 223 2004 309 318 C. Bertole, The effect of surface-active carbon on hydrocarbon selectivity in the cobalt-catalyzed Fischer–Tropsch synthesis, Journal of Catalysis, 223 (2004) 309-318. [238] G. Blyholder J. Phys. Chem. 68 1964 2772 2777 G. Blyholder, Molecular Orbital View of Chemisorbed Carbon Monoxide, The Journal of Physical Chemistry, 68 (1964) 2772-2777. [239] G. Blyholder M.C. Allen J. Am. Chem. Soc. 91 1969 3158 3162 G. Blyholder, M.C. Allen, Infrared spectra and molecular orbital model for carbon monoxide adsorbed on metals, Journal of the American Chemical Society, 91 (1969) 3158-3162. [240] G.D. Blyholder B.H. Davis Colloids Surf. A Physicochem. Eng. Asp. 105 1995 vii-x G.D. Blyholder, B.H. Davis, Robert eischens — A pioneer in the application of infrared spectroscopy in surface science, Colloids and Surfaces A: Physicochemical and Engineering Aspects, 105 (1995) vii-x. [241] G. Henrici-Olivé S. Olivé J. Mol. Catal. 16 1982 187 193 G. Henrici-Olivé, S. Olivé, The role of alkali promoters in the fischer—tropsch synthesis, Journal of Molecular Catalysis, 16 (1982) 187-193. [242] W. Ngantsoue-Hoc Y. Zhang R.J. O’Brien M. Luo B.H. Davis Appl. Catal. A Gen. 236 2002 77 89 W. Ngantsoue-Hoc, Y. Zhang, R.J. O’Brien, M. Luo, B.H. Davis, Fischer−Tropsch synthesis: activity and selectivity for Group I alkali promoted iron-based catalysts, Applied Catalysis A: General, 236 (2002) 77 -89. [243] A. Sarkar G. Jacobs Y. Ji H.H. Hamdeh B.H. Davis Catal. Letters 121 2007 1 11 A. Sarkar, G. Jacobs, Y. Ji, H.H. Hamdeh, B.H. Davis, Fischer–Tropsch Synthesis: Characterization Rb Promoted Iron Catalyst, Catalysis Letters, 121 (2007) 1-11. [244] J. Li X. Cheng C. Zhang Y. Yang Y. Li J. Mol. Catal. A Chem. 396 2015 174 180 J. Li, X. Cheng, C. Zhang, Y. Yang, Y. Li, Effects of alkali on iron-based catalysts for Fischer-Tropsch synthesis: CO chemisorptions study, Journal of Molecular Catalysis A: Chemical, 396 (2015) 174-180. [245] G. Jacobs V.R.R. Pendyala M. Martinelli W.D. Shafer M.K. Gnanamani S. Khalid A. MacLennan Y. Hu B.H. Davis Catal. Letters 147 2017 1861 1870 G. Jacobs, V.R.R. Pendyala, M. Martinelli, W.D. Shafer, M.K. Gnanamani, S. Khalid, A. MacLennan, Y. Hu, B.H. Davis, Fischer–Tropsch Synthesis: XANES Spectra of Potassium in Promoted Precipitated Iron Catalysts as a Function of Time On-stream, Catalysis Letters, 147 (2017) 1861-1870. [246] D.U. Mangaloğlu M. Baranak Ö. Ataç H. Atakül J. Ind. Eng. Chem. 66 2018 298 310 D. Uykun Mangaloğlu, M. Baranak, Ö. Ataç, H. Atakül, Effect of the promoter presence in catalysts on the compositions of Fischer–Tropsch synthesis products, Journal of Industrial and Engineering Chemistry, 66 (2018) 298- 310. [247] C.A. Mims L.E. McCandlish M.T. Melchior Catal. Letters 1 1988 121 125 C.A. Mims, L.E. McCandlish, M.T. Melchior, Fischer-Tropsch synthesis-A C2 initiator for hydrocarbon chain growth on ruthenium, Catalysis Letters, 1 (1988) 121-125. [248] K.R. Krishna A.T. Bell Catal. Letters 14 1992 305 313 K.R. Krishna, A.T. Bell, The role of C2 intermediates in Fischer-Tropsch synthesis over ruthenium, Catalysis Letters, 14 (1992) 305-313. [249] M.L. Turner H.C. Long A. Shenton P.K. Byers P.M. Maitlis Chem. Eur. J. 1 1995 549 556 M.L. Turner, H.C. Long, A. Shenton, P.K. Byers, P.M. Maitlis, The Alkenyl Mechanism for Fischer-Tropsch Surface Methylene Polymerisation; the Reactions of Vinylic Probes with CO/H2 over Rhodium Catalyst, Chemistry - A European Journal, 1 (1995) 549-556. [250] A.A. Adesina R.R. Hudgins P.L. Silveston Appl. Catal. 62 1990 295 308 A.A. Adesina, R.R. Hudgins, P.L. Silveston, Effect of ethene addition during the Fischer-Tropsch reaction, Applied Catalysis, 62 (1990) 295-308. [251] L.M. Tau H.A. Dabbagh B. Chawla B.H. Davis Catal. Letters 7 1991 141 149 L.M. Tau, H.A. Dabbagh, B. Chawla, B.H. Davis, Fischer-Tropsch synthesis with an iron catalyst: Incorporation of ethene into higher carbon number alkanes, Catalysis Letters, 7 (1991) 141-149. [252] B. Shi B.H. Davis Top. Catal. 26 2003 157 161 B. Shi, B.H. Davis, Fischer–Tropsch Synthesis: Evidence for Chain Initiation by Ethene and Ethanol for an Iron Catalyst, Topics in Catalysis, 26 (2003) 157-161. [253] L. Percy J. Catal. 121 1990 228 235 L. Percy, An NMR study of the mode of incorporation of ethene into propene in the Fischer-Tropsch reaction over cobalt, Journal of Catalysis, 121 (1990) 228- 235. [254] G. Blyholder D. Shihabi W. Wyatt R. Bartlett J. Catal. 43 1976 122 130 G. Blyholder, D. Shihabi, W. Wyatt, R. Bartlett, Adsorption and interaction of C2H4, H2, CO, and organic acids on Fe, Co, and Ni, Journal of Catalysis, 43 (1976) 122-130. [255] R. Zhang J. Chang Y. Xu L. Cao Y. Li J. Zhou Energy Fuels 23 2009 4740 4747 R. Zhang, J. Chang, Y. Xu, L. Cao, Y. Li, J. Zhou, Kinetic Model of Product Distribution over Fe Catalyst for Fischer−Tropsch Synthesis†, Energy & Fuels, 23 (2009) 4740-4747. [256] E.F. Healy Comput. Theor. Chem. 1125 2018 128 132 E.F. Healy, Visualizing the molecular wave function in sigma-coordinated complexes, Comput Theor Chem, 1125 (2018) 128-132. [257] G.J. Kubas J. Organomet. Chem. 635 2001 37 68 G.J. Kubas, Metal–dihydrogen and σ-bond coordination: the consummate extension of the Dewar–Chatt–Duncanson model for metal–olefin π bondingMetaldihydrogen and -bond coordination: the consummate extension of the DewarChattDuncanson model for metalolefin bonding, Journal of Organometallic Chemistry, 635 (2001) 37-68. [258] S. Halbert H. Gérard New J. Chem. 39 2015 5410 5419 S. Halbert, H. Gérard, A computational study of the effects of ancillary ligands on copper(i)–ethylene interaction, New Journal of Chemistry, 39 (2015) 5410-5419. [259] C. Wentrup Liebig Zeise Huckel Jensen Angew. Chem. Int. Ed. Engl. 59 2020 8332 8342 C. Wentrup, Zeise, Liebig, Jensen, Huckel, Dewar, and the Olefin pi-Complex Bonds, Angew Chem Int Ed Engl, 59 (2020) 8332-8342. [260] M.A. Vannice Catal. Sci. Technol. 1983 139 198 M.A. Vannice, Catalytic Activation of Carbon Monoxide on Metal Surfaces, Catalysis - Science and Technology1983, pp. 139-198. [261] C.M. Balonek A.H. Lillebø S. Rane E. Rytter L.D. Schmidt A. Holmen Catal. Letters 138 2010 8 13 C.M. Balonek, A.H. Lillebø, S. Rane, E. Rytter, L.D. Schmidt, A. Holmen, Effect of Alkali Metal Impurities on Co–Re Catalysts for Fischer–Tropsch Synthesis from Biomass-Derived Syngas, Catalysis Letters, 138 (2010) 8-13. [262] A. Cosultchi M. Pérez-Luna J.A. Morales-Serna M. Salmón Catal. Letters 142 2012 368 377 A. Cosultchi, M. Pérez-Luna, J.A. Morales-Serna, M. Salmón, Characterization of Modified Fischer–Tropsch Catalysts Promoted with Alkaline Metals for Higher Alcohol Synthesis, Catalysis Letters, 142 (2012) 368-377. [263] T. Ishida T. Yanagihara X. Liu H. Ohashi A. Hamasaki T. Honma H. Oji T. Yokoyama M. Tokunaga Appl. Catal. A Gen. 458 2013 145 154 T. Ishida, T. Yanagihara, X. Liu, H. Ohashi, A. Hamasaki, T. Honma, H. Oji, T. Yokoyama, M. Tokunaga, Synthesis of higher alcohols by Fischer–Tropsch synthesis over alkali metal-modified cobalt catalysts, Applied Catalysis A: General, 458 (2013) 145-154. [264] A. Campos N. Lohitharn A. Roy E. Lotero J.G. Goodwin J.J. Spivey Appl. Catal. A Gen. 375 2010 12 16 A. Campos, N. Lohitharn, A. Roy, E. Lotero, J.G. Goodwin, J.J. Spivey, An activity and XANES study of Mn- promoted, Fe-based Fischer–Tropsch catalysts, Applied Catalysis A: General, 375 (2010) 12-16. [265] M. Dad H.O.A. Fredriksson J. Van de Loosdrecht P.C. Thüne J.W. Niemantsverdriet Catal. Struct. React. 1 2015 101 109 M. Dad, H.O.A. Fredriksson, J. Van de Loosdrecht, P.C. Thüne, J.W. Niemantsverdriet, Stabilization of iron by manganese promoters in uniform bimetallic FeMn Fischer–Tropsch model catalysts prepared from colloidal nanoparticles, Catalysis, Structure & Reactivity, 1 (2015) 101-109. [266] M. Dad R.J. Lancee M. Janse van Vuuren J. van de Loosdrecht J.W.H. Niemantsverdriet H.O.A. Fredriksson Appl. Catal. A Gen. 537 2017 83 92 M. Dad, R.J. Lancee, M. Janse van Vuuren, J. van de Loosdrecht, J.W.H. Niemantsverdriet, H.O.A. Fredriksson, SiO 2 -supported Fe & FeMn colloids—Fischer-Tropsch synthesis on 3D model catalysts, Applied Catalysis A: General, 537 (2017) 83-92. [267] M.K. Gnanamani H.H. Hamdeh G. Jacobs D. Qian F. Liu S.D. Hopps G.A. Thomas W.D. Shafer Q. Xiao Y. Hu B.H. Davis RSC Adv. 6 2016 62356 62367 M.K. Gnanamani, H.H. Hamdeh, G. Jacobs, D. Qian, F. Liu, S.D. Hopps, G.A. Thomas, W.D. Shafer, Q. Xiao, Y. Hu, B.H. Davis, Fischer–Tropsch synthesis: effect of Cu, Mn and Zn addition on activity and product selectivity of cobalt ferrite, RSC Advances, 6 (2016) 62356-62367. [268] N. Lohitharn J.G. Goodwin J. Catal. 260 2008 7 16 N. Lohitharn, J.G. Goodwin, Effect of K promotion of Fe and FeMn Fischer–Tropsch synthesis catalysts: Analysis at the site level using SSITKA, Journal of Catalysis, 260 (2008) 7-16. [269] N. Lohitharn J. Goodwinjr J. Catal. 257 2008 142 151 N. Lohitharn, J. Goodwinjr, Impact of Cr, Mn and Zr addition on Fe Fischer–Tropsch synthesis catalysis: Investigation at the active site level using SSITKA, Journal of Catalysis, 257 (2008) 142-151. [270] T. Miyazawa T. Hanaoka K. Shimura S. Hirata Catal. Commun. 57 2014 36 39 T. Miyazawa, T. Hanaoka, K. Shimura, S. Hirata, Fischer–Tropsch synthesis over a Co/SiO2 catalyst modified with Mn- and Zr under practical conditions, Catalysis Communications, 57 (2014) 36- 39. [271] M.K. Gnanamani G. Jacobs W.D. Shafer M.C. Ribeiro V.R.R. Pendyala W. Ma B.H. Davis Catal. Commun. 25 2012 12 17 M.K. Gnanamani, G. Jacobs, W.D. Shafer, M.C. Ribeiro, V.R.R. Pendyala, W. Ma, B.H. Davis, Fischer Tropsch synthesis: Deuterium isotopic study for the formation of oxygenates over CeO2 supported Pt–Co catalysts, Catalysis Communications, 25 (2012) 12-17. [272] F.G. Botes Appl. Catal. A Gen. 284 2005 21 29 F.G. Botes, The effect of a higher operating temperature on the Fischer–Tropsch/HZSM-5 bifunctional process, Applied Catalysis A: General, 284 (2005) 21-29. [273] F.G. Botes W. Böhringer Appl. Catal. A Gen. 267 2004 217 225 F.G. Botes, W. Böhringer, The addition of HZSM-5 to the Fischer–Tropsch process for improved gasoline production, Applied Catalysis A: General, 267 (2004) 217-225. [274] S.-H. Kang J.W. Bae K.-J. Woo P.S. Sai Prasad K.-W. Jun Fuel Process. Technol. 91 2010 399 403 S.-H. Kang, J.W. Bae, K.-J. Woo, P.S. Sai Prasad, K.-W. Jun, ZSM-5 supported iron catalysts for Fischer–Tropsch production of light olefin, Fuel Processing Technology, 91 (2010) 399-403. [275] A. Martínez C. López Appl. Catal. A Gen. 294 2005 251 259 A. Martínez, C. López, The influence of ZSM-5 zeolite composition and crystal size on the in situ conversion of Fischer–Tropsch products over hybrid catalysts, Applied Catalysis A: General, 294 (2005) 251-259. [276] M.K. Gnanamani M.C. Ribeiro W. Ma W.D. Shafer G. Jacobs U.M. Graham B.H. Davis Appl. Catal. A Gen. 393 2011 17 23 M.K. Gnanamani, M.C. Ribeiro, W. Ma, W.D. Shafer, G. Jacobs, U.M. Graham, B.H. Davis, Fischer–Tropsch synthesis: Metal–support interfacial contact governs oxygenates selectivity over CeO2 supported Pt–Co catalysts, Applied Catalysis A: General, 393 (2011) 17-23. [277] A. Dinse M. Aigner M. Ulbrich G.R. Johnson A.T. Bell J. Catal. 288 2012 104 114 A. Dinse, M. Aigner, M. Ulbrich, G.R. Johnson, A.T. Bell, Effects of Mn promotion on the activity and selectivity of Co/SiO2 for Fischer–Tropsch Synthesis, Journal of Catalysis, 288 (2012) 104-114. [278] Y. Liu B.-T. Teng X.-H. Guo Y. Li J. Chang L. Tian X. Hao Y. Wang H.-W. Xiang Y.-Y. Xu Y.-W. Li J. Mol. Catal. A Chem. 272 2007 182 190 Y. Liu, B.-T. Teng, X.-H. Guo, Y. Li, J. Chang, L. Tian, X. Hao, Y. Wang, H.-W. Xiang, Y.-Y. Xu, Y.-W. Li, Effect of reaction conditions on the catalytic performance of Fe-Mn catalyst for Fischer-Tropsch synthesis, Journal of Molecular Catalysis A: Chemical, 272 (2007) 182-190. [279] M.K. Gnanamani G. Jacobs R.A. Keogh W.D. Shafer D.E. Sparks S.D. Hopps G.A. Thomas B.H. Davis Appl. Catal. A Gen. 499 2015 39 46 M.K. Gnanamani, G. Jacobs, R.A. Keogh, W.D. Shafer, D.E. Sparks, S.D. Hopps, G.A. Thomas, B.H. Davis, Fischer-Tropsch synthesis: Effect of pretreatment conditions of cobalt on activity and selectivity for hydrogenation of carbon dioxide, Applied Catalysis A: General, 499 (2015) 39-46. [280] V.R.R. Pendyala G. Jacobs U.M. Graham W.D. Shafer M. Martinelli L. Kong B.H. Davis Ind. Eng. Chem. Res. 56 2017 6408 6418 V.R.R. Pendyala, G. Jacobs, U.M. Graham, W.D. Shafer, M. Martinelli, L. Kong, B.H. Davis, Fischer–Tropsch Synthesis: Influence of Acid Treatment and Preparation Method on Carbon Nanotube Supported Ruthenium Catalysts, Industrial & Engineering Chemistry Research, 56 (2017) 6408-6418. [281] C. Xing W. Shen G. Yang R. Yang P. Lu J. Sun Y. Yoneyama N. Tsubaki Catal. Commun. 55 2014 53 56 C. Xing, W. Shen, G. Yang, R. Yang, P. Lu, J. Sun, Y. Yoneyama, N. Tsubaki, Completed encapsulation of cobalt particles in mesoporous H-ZSM-5 zeolite catalyst for direct synthesis of middle isoparaffin from syngas, Catalysis Communications, 55 (2014) 53-56. [282] Y. Xu D. Liu X. Liu Appl. Catal. A Gen. 552 2018 168 183 Y. Xu, D. Liu, X. Liu, Conversion of syngas toward aromatics over hybrid Fe-based Fischer-Tropsch catalysts and HZSM-5 zeolites, Applied Catalysis A: General, 552 (2018) 168-183. [283] T. Riedel G. Schaub Top. Catal. 26 2003 145 156 T. Riedel, G. Schaub, Low-Temperature Fischer–Tropsch Synthesis on Cobalt Catalysts—Effects of CO2, Topics in Catalysis, 26 (2003) 145-156. [284] T. Riedel G. Schaub K.-W. Jun K.-W. Lee Ind. Eng. Chem. Res. 40 2001 1355 1363 T. Riedel, G. Schaub, K.-W. Jun, K.-W. Lee, Kinetics of CO2Hydrogenation on a K-Promoted Fe Catalyst, Industrial & Engineering Chemistry Research, 40 (2001) 1355-1363. [285] T. Riedel H. Schulz G. Schaub K.-W. Jun J.-S. Hwang K.-W. Lee Top. Catal. 26 2003 41 54 T. Riedel, H. Schulz, G. Schaub, K.-W. Jun, J.-S. Hwang, K.-W. Lee, Fischer–Tropsch on Iron with H2/CO and H2/CO2as Synthesis Gases: The Episodes of Formation of the Fischer–Tropsch Regime and Construction of the CatalystFischerTropsch on Iron with H2/CO and H2/CO2as Synthesis Gases: The Episodes of Formation of the FischerTropsch Regime and Construction of the Catalyst, Topics in Catalysis, 26 (2003) 41-54. [286] R.A. Fiato E. Iglesia G.W. Rice S.L. Soled T. Inui M. Anpo K. Izui S. Yanagida T. Yamaguchi Advances in Chemical Conversions for Mitigating Carbon Dioxide 1996 Elsevier Science B.V 339 343 R.A. Fiato, E. Iglesia, G.W. Rice, S.L. Soled, Iron Catalyzed CO2 Hydrogenation to Liquid Hydrocarbons, in: T. Inui, M. Anpo, K. Izui, S. Yanagida, T. Yamaguchi (Eds.) Advances in Chemical Conversions for Mitigating Carbon Dioxide, Elsevier Science B.V1996, pp. 339-343. [287] Z. Ma M.D. Porosoff ACS Catal. 9 2019 2639 2656 Z. Ma, M.D. Porosoff, Development of Tandem Catalysts for CO2 Hydrogenation to Olefins, ACS Catalysis, 9 (2019) 2639-2656. [288] M. Martinelli C.G. Visconti L. Lietti P. Forzatti C. Bassano P. Deiana Catal. Today 228 2014 77 88 M. Martinelli, C.G. Visconti, L. Lietti, P. Forzatti, C. Bassano, P. Deiana, CO2 reactivity on Fe–Zn–Cu–K Fischer–Tropsch synthesis catalysts with different K-loadings, Catalysis Today, 228 (2014) 77-88. [289] R. Satthawong N. Koizumi C. Song P. Prasassarakich Catal. Today 251 2015 34 40 R. Satthawong, N. Koizumi, C. Song, P. Prasassarakich, Light olefin synthesis from CO2 hydrogenation over K-promoted Fe–Co bimetallic catalysts, Catalysis Today, 251 (2015) 34-40. [290] W.D. Shafer G. Jacobs U.M. Graham H.H. Hamdeh B.H. Davis J. Catal. 369 2019 239 248 W.D. Shafer, G. Jacobs, U.M. Graham, H.H. Hamdeh, B.H. Davis, Increased CO2 hydrogenation to liquid products using promoted iron catalysts, Journal of Catalysis, 369 (2019) 239-248. [291] C.G. Visconti L. Lietti E. Tronconi P. Forzatti R. Zennaro E. Finocchio Appl. Catal. A Gen. 355 2009 61 68 C.G. Visconti, L. Lietti, E. Tronconi, P. Forzatti, R. Zennaro, E. Finocchio, Fischer–Tropsch synthesis on a Co/Al2O3 catalyst with CO2 containing syngas, Applied Catalysis A: General, 355 (2009) 61-68. [292] C.G. Visconti M. Martinelli L. Falbo L. Fratalocchi L. Lietti Catal. Today 277 2016 161 170 C.G. Visconti, M. Martinelli, L. Falbo, L. Fratalocchi, L. Lietti, CO2 hydrogenation to hydrocarbons over Co and Fe-based Fischer-Tropsch catalysts, Catalysis Today, 277 (2016) 161-170. [293] Y. Zhang G. Jacobs D.E. Sparks M.E. Dry B.H. Davis Catal. Today 71 2002 411 418 Y. Zhang, G. Jacobs, D.E. Sparks, M.E. Dry, B.H. Davis, CO and CO2 hydrogenation study on supported cobalt Fischer–Tropsch synthesis catalysts, Catalysis Today, 71 (2002) 411-418. [294] Y. Yao X. Liu D. Hildebrandt D. Glasser Ind. Eng. Chem. Res. 50 2011 11002 11012 Y. Yao, X. Liu, D. Hildebrandt, D. Glasser, Fischer–Tropsch Synthesis Using H2/CO/CO2Syngas Mixtures over an Iron Catalyst, Industrial & Engineering Chemistry Research, 50 (2011) 11002-11012. [295] Y. Yao X. Liu D. Hildebrandt D. Glasser Appl. Catal. A Gen. 433- 434 2012 58 68 Y. Yao, X. Liu, D. Hildebrandt, D. Glasser, Fischer–Tropsch synthesis using H2/CO/CO2 syngas mixtures: A comparison of paraffin to olefin ratios for iron and cobalt based catalystsFischerTropsch synthesis using H2/CO/CO2 syngas mixtures: A comparison of paraffin to olefin ratios for iron and cobalt based catalysts, Applied Catalysis A: General, 433-434 (2012) 58-68. [296] M.L. Cubeiro H. Morales M.R. Goldwasser M.J. Pérez-Zurita F. González-Jiménez C. Urbina de N Appl. Catal. A Gen. 189 1999 87 97 M.a.L. Cubeiro, H. Morales, M.R. Goldwasser, M.J. Pérez-Zurita, F. González-Jiménez, C. Urbina de N, Hydrogenation of carbon oxides over Fe/Al2O3 catalysts, Applied Catalysis A: General, 189 (1999) 87-97. [297] M.K. Gnanamani G. Jacobs H.H. Hamdeh W.D. Shafer B.H. Davis Catal. Today 207 2013 50 56 M.K. Gnanamani, G. Jacobs, H.H. Hamdeh, W.D. Shafer, B.H. Davis, Fischer–Tropsch synthesis: Mössbauer investigation of iron containing catalysts for hydrogenation of carbon dioxide, Catalysis Today, 207 (2013) 50 -56. [298] G. Eigenberger G. Ertl H. Knözinger F. Schuth J. Weitkamp Handbook of Heterogneneous Catalysis 2008 Wiley‐VCH Verlag GmbH & Co. KGaA Germany 2075 2106 G. Eigenberger, Reaction engineering, in: G. Ertl, H. Knözinger, F. Schuth, J. Weitkamp (Eds.) Handbook of Heterogneneous Catalysis, Wiley‐VCH Verlag GmbH & Co. KGaA, Germany, 2008, pp. 2075-2106. [299] A.P. Steynberg M.E. Dry B.H. Davis B.B. Breman A. Steynberg M. Dry Studies in Surface Science and Catalysis 2004 Elsevier London 64 195 A.P. Steynberg, M.E. Dry, B.H. Davis, B.B. Breman, Fischer-Tropsch Reactors, in: A. Steynberg, M. Dry (Eds.) Studies in Surface Science and Catalysis, Elsevier, London, 2004, pp. 64-195. [300] B.H. Davis Top. Catal. 32 2005 143 168 B.H. Davis, Fischer–Tropsch synthesis: Overview of reactor development and future potentialities, Topics in Catalysis, 32 (2005) 143-168. [301] T. Wang J. Wang Y. Jin Ind. Eng. Chem. Res. 46 2007 5824 5847 T. Wang, J. Wang, Y. Jin, Slurry Reactors for Gas-to-Liquid Processes: A Review, Industrial & Engineering Chemistry Research, 46 (2007) 5824-5847. [302] R. Guettel U. Kunz T. Turek Chem. Eng. Technol. 31 2008 746 754 R. Guettel, U. Kunz, T. Turek, Reactors for Fischer-Tropsch Synthesis, Chemical Engineering & Technology, 31 (2008) 746-754. [303] E.F. Sousa-Aguiar F.B. Noronha J.A. Faro Catal. Sci. Technol. 1 2011 698 713 E.F. Sousa-Aguiar, F.B. Noronha, J.A. Faro, The main catalytic challenges in GTL (gas-to-liquids) processes, Catalysis Science & Technology, 1 (2011) 698-713. [304] S.N. Khadzhiev Pet. Chem. 56 2016 465 479 S.N. Khadzhiev, Nanoheterogeneous catalysis: Definition, state, and research prospects (Review), Petroleum Chemistry, 56 (2016) 465-479. [305] G. Jacobs B.H. Davis Z.I. Önsan A.K. Avci Multiphase Catalytic Reactors: Theory, Design, Manufacturing, and Applications 2016 John Wiley & Sons, Inc. 269 294 G. Jacobs, B.H. Davis, Reactor approaches for Fischer-Tropsch synthesis, in: Z.I. Önsan, A.K. Avci (Eds.) Multiphase Catalytic Reactors: Theory, Design, Manufacturing, and Applications, John Wiley & Sons, Inc.2016, pp. 269- 294. [306] H. Kölbel, P. Ackermann, Hydrocarbons from gaseous mixtures of carbon monoxide, hydrogen and carbon dioxide, Steinkohlen-Bergwerk “Rheinpreussen” German patent DE 728217, Nov. 23 1942. [307] D.B. Bukur W.-P. Ma V. Carreto- Vazquez Top. Catal. 32 2005 135 141 D.B. Bukur, W.-P. Ma, V. Carreto-Vazquez, Attrition studies with precipitated iron Fischer–Tropsch catalysts under reaction conditions, Topics in Catalysis, 32 (2005) 135-141. [308] W.D. Deckwer Y. Serpemen M. Ralek B. Schmidt Ind. Eng. Chem. Process. Des. Dev. 21 1982 231 241 W.D. Deckwer, Y. Serpemen, M. Ralek, B. Schmidt, Modeling the Fischer-Tropsch synthesis in the slurry phase, Industrial & Engineering Chemistry Process Design and Development, 21 (1982) 231-241. [309] Y. Wang W. Fan Z. Zeng X. Hao M. Chang C. Zhang Y. Xu H. Xiang Y. Li Chem. Eng. Process. 47 2008 222 228 N. Rados, M.H. Al-Dahhan, M.P. Dudukovic, Modeling of the Fischer–Tropsch synthesis in slurry bubble column reactors, Catalysis Today, 79-80 (2003) 211- 218. [310] R.M. Koros, Bubble column, tube side slurry process and apparatus, Exxon Research & Engineering Co., US Patent 5,384,366. Jan 24 1995. [311] A.P. Steynberg, A.P. Vogel, Slurry-bed Fischer-Tropsch reactor with in-situ filtration zone for separation of catalyst from product waxes, Sasol Technology, Internat Patent WO 0045948, Aug. 10 2010. [312] C. Maretto R. Krishna Catal. Today 52 1999 279 289 C. Maretto, Modelling of a bubble column slurry reactor for Fischer–Tropsch synthesis, Catalysis Today, 52 (1999) 279-289. [313] M.E. Dry ACS, Div. Fuel Chem., Preprints 31 1986 288 292 M.E. Dry, Recent developments in Sasol Fischer-Tropsch technology, Am. Chem. Soc., Div. Gas Fuel Chem., Prepr., 31 (1986) 288 - 292. [314] M. Stamenić V. Dikić M. Mandić B. Todić D.B. Bukur N.M. Nikačević Ind. Eng. Chem. Res. 56 2017 9964 9979 M. Stamenić, V. Dikić, M. Mandić, B. Todić, D.B. Bukur, N.M. Nikačević, Multiscale and Multiphase Model of Fixed Bed Reactors for Fischer–Tropsch Synthesis: Intensification Possibilities Study, Industrial & Engineering Chemistry Research, 56 (2017) 9964-9979. [315] A. Holmen H.J. Venvik R. Myrstad J. Zhu D. Chen Catal. Today 216 2013 150 157 A. Holmen, H.J. Venvik, R. Myrstad, J. Zhu, D. Chen, Monolithic, microchannel and carbon nanofibers/carbon felt reactors for syngas conversion by Fischer-Tropsch synthesis, Catalysis Today, 216 (2013) 150-157. [316] A. de Klerk Fischer-Tropsch Refining 2011 Wiley‐VCH Verlag GmbH & Co. A. de Klerk, Fischer-Tropsch Refining, Wiley‐VCH Verlag GmbH & Co.2011. [317] S. LeViness A.L. Tonkovich K. Jarosch S. Fitzgerald B. Yang J. McDaniel Velocys 2011 1 7 S. LeViness, A.L. Tonkovich, K. Jarosch, S. Fitzgerald, B. Yang, J. McDaniel, Improved Fischer-Tropsch Economics Enabled by Microchannel Technology, Velocys, (2011) 1-7. [318] S. LeViness S.R. Deshmukh L.A. Richard H.J. Robota Top. Catal. 57 2013 518 525 S. LeViness, S.R. Deshmukh, L.A. Richard, H.J. Robota, Velocys Fischer–Tropsch Synthesis Technology—New Advances on State-of-the-Art, Topics in Catalysis, 57 (2013) 518-525. [319] Z. Jia H. Gadalla S. Vallee B.H. Davis D.E. Sparks AIChE Annual Meeting, Minneapolis, October 16 -21 2011 Z. Jia, H. Gadalla, S. Vallee, B.H. Davis, D.E. Sparks, Pilot Test for Fischer-Tropsch Synthesis using a Fixed-Bed Compact Heat Exchange Reactor, AIChE Annual MeetingMinneapolis Mn, 2011. [320] B.H. Davis G. Jacobs State of Wyoming Clean Coal Technologies Research Program Fischer-tropsch Conversion of Wyoming Coal- derived Syngas Using a Small Channel Reactor for Improving Efficiency and Limiting Emissions 2016 The University of Kentucky Research Foundation on behalf of the University of Kentucky Center for Applied Energy Research, State of Wyoming Clean Coal Technologies Research Program B.H. Davis, G. Jacobs, State of Wyoming Clean Coal Technologies Research Program Fischer-Tropsch conversion of Wyoming coal-derived syngas using a small channel reactor for improving efficiency and limiting emissions, The University of Kentucky Research Foundation on behalf of the University of Kentucky Center for Applied Energy Research, State of Wyoming Clean Coal Technologies Research Program, 2016. [321] G. Jacobs C. Bertaux V.R.R. Pendyala W.D. Shafer J.-S. Poirier Q. Xiao Y. Hu B.H. Davis Appl. Catal. A Gen. 516 2016 51 57 G. Jacobs, C. Bertaux, V.R.R. Pendyala, W.D. Shafer, J.-S. Poirier, Q. Xiao, Y. Hu, B.H. Davis, Fischer-Tropsch synthesis: Cobalt catalysts on alumina having partially pre-filled pores exhibit higher C5+ and lower light gas selectivities, Applied Catalysis A: General, 516 (2016) 51-57. [322] E. Iglesia Appl. Catal. A Gen. 161 1997 59 78 E. Iglesia, Design, synthesis, and use of cobalt-based Fischer-Tropsch synthesis catalysts, Applied Catalysis A: General, 161 (1997) 59-78. [323] R.M.M. Abbaslou J.S.S. Mohammadzadeh A.K. Dalai Fuel Process. Technol. 90 2009 849 856 R.M. Malek Abbaslou, J.S. Soltan Mohammadzadeh, A.K. Dalai, Review on Fischer–Tropsch synthesis in supercritical media, Fuel Processing Technology, 90 (2009) 849- 856. [324] G. Jacobs K. Chaudhari D.E. Sparks Y. Zhang B. Shi R. Spicer T.K. Das J. Li B.H. Davis Fuel 82 2003 1251 1260 G. Jacobs, K. Chaudhari, D. Sparks, Y. Zhang, B. Shi, R. Spicer, T.K. Das, J. Li, B.H. Davis, Fischer–Tropsch synthesis: supercritical conversion using a Co/Al2O3 catalyst in a fixed bed reactor, Fuel, 82 (2003) 1251-1260. [325] L. Fratalocchi C.G. Visconti G. Groppi L. Lietti E. Tronconi Chem. Eng. J. 349 2018 829 837 L. Fratalocchi, C.G. Visconti, G. Groppi, L. Lietti, E. Tronconi, Intensifying heat transfer in Fischer-Tropsch tubular reactors through the adoption of conductive packed foams, Chemical Engineering Journal, 349 (2018) 829-837. [326] J. He Y. Yoneyama B. Xu N. Nishiyama N. Tsubaki Langmuir 21 2005 1699 1702 J. He, Y. Yoneyama, B. Xu, N. Nishiyama, N. Tsubaki, Designing a capsule catalyst and its application for direct synthesis of middle isoparaffins, Langmuir, 21 (2005) 1699-1702. [327] A.A. Khassin A.G. Sipatrov G.K. Chermashetseva T.M. Yurieva V.N. Parmon Top. Catal. 32 2005 39 46 A.A. Khassin, A.G. Sipatrov, G.K. Chermashetseva, T.M. Yurieva, V.N. Parmon, Fischer?Tropsch synthesis using plug-through contactor membranes based on permeable composite monoliths. Selectivity control by porous structure parameters and membrane geometry, Topics in Catalysis, 32 (2005) 39-46. [328] A.A. Khassin T.M. Yurieva A.G. Sipatrov V.A. Kirillov G.K. Chermashentseva V.N. Parmon Catal. Today 79-80 2003 465 470 A.A. Khassin, T.M. Yurieva, A.G. Sipatrov, V.A. Kirillov, G.K. Chermashentseva, V.N. Parmon, Fischer–Tropsch synthesis using a porous catalyst packing: experimental evidence of an efficient use of permeable composite monoliths as a novel type of the Fischer–Tropsch synthesis catalystFischerTropsch synthesis using a porous catalyst packing: experimental evidence of an efficient use of permeable composite monoliths as a novel type of the FischerTropsch synthesis catalyst, Catalysis Today, 79-80 (2003) 465-470. [329] A.A. Khassin A.G. Sipatrov T.M. Yurieva G.K. Chermashentseva N.A. Rudina V.N. Parmon Catal. Today 105 2005 362 366 A.A. Khassin, A.G. Sipatrov, T.M. Yurieva, G.K. Chermashentseva, N.A. Rudina, V.N. Parmon, Performance of a catalytic membrane reactor for the Fischer–Tropsch synthesis, Catalysis Today, 105 (2005) 362-366.",
      "scopus-id": "85092689777",
      "coredata": {
        "eid": "1-s2.0-S0926860X20303331",
        "dc:description": "This review is divided into three main sections. The first section of this overview examines in detail recent techno-economic analyses on the utilization of biomass as a source of syngas for Fischer-Tropsch synthesis (FTS). FTS is a highly localized industry, and depends on the sources of syngas available, the products desired, and the demand for co- production of electricity. Where coal or natural gas coexist in the region where biomass is available, economics may favor producing or blending syngas from multiple resources, making biomass-to-liquids a highly complex scenario. Land use management is essential for sustainable biomass production, if used as the carbon source for FTS. The second section discusses FTS mechanisms, reactions and catalysts. Supposing the catalyst surface energy favors CO hydrogenation to FTS products, the sweet spot of FTS, selectivity will depend on the degree of back- donation from the metal. The degree of electron back-donation from the catalyst surface to both adsorbed CO and vinylic intermediates in part controls the FT synthesis product distribution. When the back-donation is sufficient, chain growth favors longer chained linear hydrocarbons (paraffins, alpha olefins, linear alcohols) suitable for upgrading to diesel, jet fuels, lubricants, and waxes. When back-donation is less significant, monomethyl branched hydrocarbons, internal olefins, and oxygenates (esters, acids and ketones) are elevated. Lastly, active supports are discussed for increasing the termination rate to oxygenates and olefins, as are hybrid catalysts that simultaneously carry out FTS and upgrading, often through secondary reactions. The last section provides an overview of the commercial scale reactor designs including the fixed bed, fluidized bed, and slurry bubble column reactor currently used in the FTS process. Economically, FTS is favored at larger scales; however, new compact reactor designs are coming into play aimed at monetizing highly localized (e.g. biomass) and stranded resources (e.g. natural gas). These types of reactors, involving microchannel and heat exchanger designs, must be highly efficient at managing heat, cost-effective, and mobile in order to exploit non-traditional sources of syngas.",
        "openArchiveArticle": "false",
        "prism:coverDate": "2020-11-25",
        "openaccessUserLicense": null,
        "prism:aggregationType": "Journal",
        "prism:url": "https://api.elsevier.com/content/article/pii/S0926860X20303331",
        "dc:creator": [
          {
            "@_fa": "true",
            "$": "Martinelli, Michela"
          },
          {
            "@_fa": "true",
            "$": "Gnanamani, Muthu Kumaran"
          },
          {
            "@_fa": "true",
            "$": "LeViness, Steve"
          },
          {
            "@_fa": "true",
            "$": "Jacobs, Gary"
          },
          {
            "@_fa": "true",
            "$": "Shafer, Wilson D."
          }
        ],
        "link": [
          {
            "@_fa": "true",
            "@rel": "self",
            "@href": "https://api.elsevier.com/content/article/pii/S0926860X20303331"
          },
          {
            "@_fa": "true",
            "@rel": "scidir",
            "@href": "https://www.sciencedirect.com/science/article/pii/S0926860X20303331"
          }
        ],
        "dc:format": "application/json",
        "openaccessType": null,
        "pii": "S0926-860X(20)30333-1",
        "prism:volume": "608",
        "articleNumber": "117740",
        "prism:publisher": "Elsevier B.V.",
        "dc:title": "An overview of Fischer-Tropsch Synthesis: XtL processes, catalysts and reactors",
        "prism:copyright": "© 2020 Elsevier B.V. All rights reserved.",
        "openaccess": "0",
        "prism:issn": "0926860X",
        "dcterms:subject": [
          {
            "@_fa": "true",
            "$": "Fischer-Tropsch"
          },
          {
            "@_fa": "true",
            "$": "Biomass-to-Liquids"
          },
          {
            "@_fa": "true",
            "$": "Coal-to-Liquids"
          },
          {
            "@_fa": "true",
            "$": "Gas-to-Liquids"
          },
          {
            "@_fa": "true",
            "$": "Mechanism"
          },
          {
            "@_fa": "true",
            "$": "Cobalt catalyst"
          },
          {
            "@_fa": "true",
            "$": "Iron catalyst"
          }
        ],
        "openaccessArticle": "false",
        "prism:publicationName": "Applied Catalysis A: General",
        "openaccessSponsorType": null,
        "prism:pageRange": "117740",
        "pubType": "rev",
        "prism:coverDisplayDate": "25 November 2020",
        "prism:doi": "10.1016/j.apcata.2020.117740",
        "prism:startingPage": "117740",
        "dc:identifier": "doi:10.1016/j.apcata.2020.117740",
        "openaccessSponsorName": null
      },
      "objects": {
        "object": [
          {
            "@category": "standard",
            "@height": "406",
            "@width": "718",
            "@_fa": "true",
            "$": "https://api.elsevier.com/content/object/eid/1-s2.0-S0926860X20303331-gr1.jpg?httpAccept=%2A%2F%2A",
            "@multimediatype": "JPEG image file",
            "@type": "IMAGE-DOWNSAMPLED",
            "@size": "76906",
            "@ref": "gr1",
            "@mimetype": "image/jpeg"
          },
          {
            "@category": "standard",
            "@height": "217",
            "@width": "718",
            "@_fa": "true",
            "$": "https://api.elsevier.com/content/object/eid/1-s2.0-S0926860X20303331-gr4.jpg?httpAccept=%2A%2F%2A",
            "@multimediatype": "JPEG image file",
            "@type": "IMAGE-DOWNSAMPLED",
            "@size": "57394",
            "@ref": "gr4",
            "@mimetype": "image/jpeg"
          },
          {
            "@category": "standard",
            "@height": "476",
            "@width": "718",
            "@_fa": "true",
            "$": "https://api.elsevier.com/content/object/eid/1-s2.0-S0926860X20303331-gr2.jpg?httpAccept=%2A%2F%2A",
            "@multimediatype": "JPEG image file",
            "@type": "IMAGE-DOWNSAMPLED",
            "@size": "79571",
            "@ref": "gr2",
            "@mimetype": "image/jpeg"
          },
          {
            "@category": "standard",
            "@height": "200",
            "@width": "353",
            "@_fa": "true",
            "$": "https://api.elsevier.com/content/object/eid/1-s2.0-S0926860X20303331-ga1.jpg?httpAccept=%2A%2F%2A",
            "@multimediatype": "JPEG image file",
            "@type": "IMAGE-DOWNSAMPLED",
            "@size": "24707",
            "@ref": "ga1",
            "@mimetype": "image/jpeg"
          },
          {
            "@category": "standard",
            "@height": "836",
            "@width": "718",
            "@_fa": "true",
            "$": "https://api.elsevier.com/content/object/eid/1-s2.0-S0926860X20303331-gr3.jpg?httpAccept=%2A%2F%2A",
            "@multimediatype": "JPEG image file",
            "@type": "IMAGE-DOWNSAMPLED",
            "@size": "101657",
            "@ref": "gr3",
            "@mimetype": "image/jpeg"
          },
          {
            "@category": "thumbnail",
            "@height": "124",
            "@width": "219",
            "@_fa": "true",
            "$": "https://api.elsevier.com/content/object/eid/1-s2.0-S0926860X20303331-gr1.sml?httpAccept=%2A%2F%2A",
            "@multimediatype": "GIF image file",
            "@type": "IMAGE-THUMBNAIL",
            "@size": "14926",
            "@ref": "gr1",
            "@mimetype": "image/gif"
          },
          {
            "@category": "thumbnail",
            "@height": "66",
            "@width": "219",
            "@_fa": "true",
            "$": "https://api.elsevier.com/content/object/eid/1-s2.0-S0926860X20303331-gr4.sml?httpAccept=%2A%2F%2A",
            "@multimediatype": "GIF image file",
            "@type": "IMAGE-THUMBNAIL",
            "@size": "14215",
            "@ref": "gr4",
            "@mimetype": "image/gif"
          },
          {
            "@category": "thumbnail",
            "@height": "145",
            "@width": "219",
            "@_fa": "true",
            "$": "https://api.elsevier.com/content/object/eid/1-s2.0-S0926860X20303331-gr2.sml?httpAccept=%2A%2F%2A",
            "@multimediatype": "GIF image file",
            "@type": "IMAGE-THUMBNAIL",
            "@size": "11519",
            "@ref": "gr2",
            "@mimetype": "image/gif"
          },
          {
            "@category": "thumbnail",
            "@height": "124",
            "@width": "219",
            "@_fa": "true",
            "$": "https://api.elsevier.com/content/object/eid/1-s2.0-S0926860X20303331-ga1.sml?httpAccept=%2A%2F%2A",
            "@multimediatype": "GIF image file",
            "@type": "IMAGE-THUMBNAIL",
            "@size": "15423",
            "@ref": "ga1",
            "@mimetype": "image/gif"
          },
          {
            "@category": "thumbnail",
            "@height": "163",
            "@width": "140",
            "@_fa": "true",
            "$": "https://api.elsevier.com/content/object/eid/1-s2.0-S0926860X20303331-gr3.sml?httpAccept=%2A%2F%2A",
            "@multimediatype": "GIF image file",
            "@type": "IMAGE-THUMBNAIL",
            "@size": "7922",
            "@ref": "gr3",
            "@mimetype": "image/gif"
          },
          {
            "@category": "high",
            "@height": "1796",
            "@width": "3177",
            "@_fa": "true",
            "$": "https://api.elsevier.com/content/object/eid/1-s2.0-S0926860X20303331-gr1_lrg.jpg?httpAccept=%2A%2F%2A",
            "@multimediatype": "JPEG image file",
            "@type": "IMAGE-HIGH-RES",
            "@size": "822133",
            "@ref": "gr1",
            "@mimetype": "image/jpeg"
          },
          {
            "@category": "high",
            "@height": "960",
            "@width": "3177",
            "@_fa": "true",
            "$": "https://api.elsevier.com/content/object/eid/1-s2.0-S0926860X20303331-gr4_lrg.jpg?httpAccept=%2A%2F%2A",
            "@multimediatype": "JPEG image file",
            "@type": "IMAGE-HIGH-RES",
            "@size": "656123",
            "@ref": "gr4",
            "@mimetype": "image/jpeg"
          },
          {
            "@category": "high",
            "@height": "2106",
            "@width": "3177",
            "@_fa": "true",
            "$": "https://api.elsevier.com/content/object/eid/1-s2.0-S0926860X20303331-gr2_lrg.jpg?httpAccept=%2A%2F%2A",
            "@multimediatype": "JPEG image file",
            "@type": "IMAGE-HIGH-RES",
            "@size": "641247",
            "@ref": "gr2",
            "@mimetype": "image/jpeg"
          },
          {
            "@category": "high",
            "@height": "886",
            "@width": "1564",
            "@_fa": "true",
            "$": "https://api.elsevier.com/content/object/eid/1-s2.0-S0926860X20303331-ga1_lrg.jpg?httpAccept=%2A%2F%2A",
            "@multimediatype": "JPEG image file",
            "@type": "IMAGE-HIGH-RES",
            "@size": "227100",
            "@ref": "ga1",
            "@mimetype": "image/jpeg"
          },
          {
            "@category": "high",
            "@height": "3701",
            "@width": "3177",
            "@_fa": "true",
            "$": "https://api.elsevier.com/content/object/eid/1-s2.0-S0926860X20303331-gr3_lrg.jpg?httpAccept=%2A%2F%2A",
            "@multimediatype": "JPEG image file",
            "@type": "IMAGE-HIGH-RES",
            "@size": "931692",
            "@ref": "gr3",
            "@mimetype": "image/jpeg"
          },
          {
            "@category": "thumbnail",
            "@_fa": "true",
            "$": "https://api.elsevier.com/content/object/eid/1-s2.0-S0926860X20303331-si1.svg?httpAccept=%2A%2F%2A",
            "@multimediatype": "Scalable Vector Graphics file",
            "@type": "ALTIMG",
            "@size": "25857",
            "@ref": "si1",
            "@mimetype": "image/svg+xml"
          },
          {
            "@category": "thumbnail",
            "@_fa": "true",
            "$": "https://api.elsevier.com/content/object/eid/1-s2.0-S0926860X20303331-si2.svg?httpAccept=%2A%2F%2A",
            "@multimediatype": "Scalable Vector Graphics file",
            "@type": "ALTIMG",
            "@size": "18653",
            "@ref": "si2",
            "@mimetype": "image/svg+xml"
          },
          {
            "@category": "thumbnail",
            "@_fa": "true",
            "$": "https://api.elsevier.com/content/object/eid/1-s2.0-S0926860X20303331-si3.svg?httpAccept=%2A%2F%2A",
            "@multimediatype": "Scalable Vector Graphics file",
            "@type": "ALTIMG",
            "@size": "22965",
            "@ref": "si3",
            "@mimetype": "image/svg+xml"
          },
          {
            "@category": "thumbnail",
            "@_fa": "true",
            "$": "https://api.elsevier.com/content/object/eid/1-s2.0-S0926860X20303331-si4.svg?httpAccept=%2A%2F%2A",
            "@multimediatype": "Scalable Vector Graphics file",
            "@type": "ALTIMG",
            "@size": "16336",
            "@ref": "si4",
            "@mimetype": "image/svg+xml"
          },
          {
            "@category": "standard",
            "@_fa": "true",
            "$": "https://api.elsevier.com/content/object/eid/1-s2.0-S0926860X20303331-am.pdf?httpAccept=%2A%2F%2A",
            "@multimediatype": "Acrobat PDF file",
            "@type": "AAM-PDF",
            "@size": "1053317",
            "@ref": "am",
            "@mimetype": "application/pdf"
          }
        ]
      },
      "link": {
        "@rel": "abstract",
        "@href": "https://api.elsevier.com/content/abstract/scopus_id/85092689777"
      }
    }
  }
}