{
  "metadata": {
    "title": "Elucidating the structure-activity relationship of Bi-doped MnO<ce:inf loc=post>2</ce:inf> catalysts towards CH<ce:inf loc=post>3</ce:inf>OH oxidation",
    "authors": "; ; ",
    "journal": "Applied Catalysis A: General",
    "date": "2025-08-25",
    "doi": "10.1016/j.apcata.2025.120402",
    "abstract": "",
    "uri": "https://api.elsevier.com/content/article/pii/S0926860X25003035",
    "pii": "S0926860X25003035"
  },
  "fulltext": {
    "full-text-retrieval-response": {
      "scopus-eid": "2-s2.0-105007552821",
      "originalText": "serial JL 271346 291210 291744 291809 31 Applied Catalysis A: General APPLIEDCATALYSISAGENERAL 2025-06-07 2025-06-07 2025-06-11 2025-06-11 2025-07-07T20:52:29 1-s2.0-S0926860X25003035 S0926-860X(25)00303-5 S0926860X25003035 10.1016/j.apcata.2025.120402 S300 S300.1 FULL-TEXT 1-s2.0-S0926860X25X00120 2025-07-07T19:56:34.976853Z 0 0 20250825 2025 2025-06-07T06:46:52.632749Z absattachment articleinfo articlenumber articletitlenorm authfirstinitialnorm authfirstsurnamenorm cid cids contenttype copyright crossmark dateloaded dateloadedtxt datesearch datesort dateupdated dco docsubtype doctype doi eid ewtransactionid hubeid indexeddate issn issnnorm itemstage itemtransactionid itemweight openaccess openarchive pg pgfirst pii piinorm pubdatestart pubdatetxt pubyr sortorder srctitle srctitlenorm srctype ssids alllist content subj subheadings suppl tomb volfirst volissue volumelist webpdf webpdfpagecount yearnav figure e-component body mmlmath acknowledge affil appendices articletitle auth authfirstini authfull authkeywords authlast grantnumber grantsponsor grantsponsorid highlightsabst orcid primabst ref specialabst 0926-860X 0926860X true 704 704 C Volume 704 19 120402 120402 120402 20250825 25 August 2025 2025-08-25 2025 article fla © 2025 Elsevier B.V. All rights are reserved, including those for text and data mining, AI training, and similar technologies. ELUCIDATINGSTRUCTUREACTIVITYRELATIONSHIPBIDOPEDMNO2CATALYSTSTOWARDSCH3OHOXIDATION YU S 1 Introduction 2 Experimental section 2.1 Raw materials and chemicals 2.2 Preparation of the Bi-doped MnO2 catalysts 2.3 Catalyst characterization 2.4 Evaluation of catalytic performance 3 Results and discussion 3.1 Activity of Bi-doped MnO2 towards CH3OH oxidation 3.2 Bulk structure and morphology of Bi-doped MnO2 3.3 Surface chemical structure and adsorption properties of Bi-doped MnO2 3.4 Structure-activity relationship of Bi-doped MnO2 during CH3OH oxidation 4 Conclusions CRediT authorship contribution statement Acknowledgements Appendix A Supplementary material References HAKIM 2012 5949 5966 M HE 2019 4471 4568 C YANG 2019 1128 1153 C ZHANG 2018 2625 2637 S MAO 2022 14469 14482 X ZHENG 2021 2815 2825 T LOU 2009 579 588 J SIVAKUMAR 2023 15013 15053 G DATYE 2021 1049 1059 A MERTE 2013 1460 1468 L JABLONSKA 2015 353 365 M CALZADA 2017 79 92 L KAHLER 2013 162 170 K ZHAO 2015 6679 6684 H SHI 2022 2482 2492 Z DZIEMBAJ 2019 196 207 R DZIEMBAJ 2011 112 117 R WU 2022 e202200159 C LI 2021 111847 W YANG 2021 e2103052 R WANG 2024 8896 8899 W JIANG 2024 160629 Y YANG 2021 e2004862 R YANG 2020 118150 W AKSARAY 2024 38 46 G GAO 2025 e2410883 Y LOU 2025 159751 Y SHANG 2017 33 44 Z XIE 2019 15368 15374 Y YANG 2019 22006 22014 Y CUI 2020 9932 9939 B LI 2023 3226 3230 D TIAN 2021 115 128 F PARK 2004 18 28 J THOMMES 2015 1051 1069 M GAO 2024 7455 7458 B LIU 2019 374 385 Y LI 2023 e202203167 C LI 2025 e202401951 J WANG 2012 4034 4041 F LIU 2019 569 582 Y GAO 2009 922 928 T TIAN 2021 157223 S WANG 2025 129203 W ZHANG 2024 151721 Y TANG 2023 13402 13409 J LOU 2011 610 614 Y YAO 2022 728 745 Y SINHAMAJUMDAR 2025 158490 S SAPIENZA 2023 9997 10006 N GURSES 2023 100782 S GU 2024 9374 9384 H JIANG 2019 1902041 Z PEI 2023 122888 W DU 2022 2471 2481 Y JIANG 2020 119304 Z LI 2024 114398 H WALKOWIAK 2024 115504 A LEE 2024 13778 13791 J HIBBITTS 2016 210 220 D YUX2025X120402 YUX2025X120402XS 2027-06-11T00:00:00.000Z 2027-06-11T00:00:00.000Z http://creativecommons.org/licenses/by-nc-nd/4.0/ © 2025 Elsevier B.V. All rights are reserved, including those for text and data mining, AI training, and similar technologies. 2025-06-12T02:43:55.755Z http://vtw.elsevier.com/data/voc/AddOnTypes/50.7/aggregated-refined Fundamental Research Funds for the Central Universities Fundamental Research Funds for the Central Universities http://data.elsevier.com/vocabulary/SciValFunders/501100012226 http://sws.geonames.org/1814991/ National Key Research and Development Program of China 2022YFB3805504 NKRDPC National Key Research and Development Program of China http://data.elsevier.com/vocabulary/SciValFunders/501100012166 http://sws.geonames.org/1814991/ 22TQ1400100\\u20137 Shanghai Pilot Program for Basic Research http://sws.geonames.org/1814991 Basic Research Program of Science and Technology Commission of Shanghai Municipality http://sws.geonames.org/1814991 National Key R&D Program of China http://sws.geonames.org/1814991 Shanghai Pilot Program for Basic Research Shanghai Key Basic Research Program http://data.elsevier.com/vocabulary/SciValFunders/100016096 http://sws.geonames.org/1814991/ Basic Research Program of Science and Technology Commission of Shanghai Municipality 22JC1400600 STCSM Science and Technology Commission of Shanghai Municipality http://data.elsevier.com/vocabulary/SciValFunders/501100003399 http://sws.geonames.org/1814991/ This work was supported by the National Key Research and Development Program of China ( 2022YFB3805504 ), Shanghai Pilot Program for Basic Research ( 22TQ1400100\\u20137 ), the Basic Research Program of Science and Technology Commission of Shanghai Municipality ( 22JC1400600 ), and the Fundamental Research Funds for the Central Universities . https://doi.org/10.15223/policy-017 https://doi.org/10.15223/policy-037 https://doi.org/10.15223/policy-012 https://doi.org/10.15223/policy-029 https://doi.org/10.15223/policy-004 item S0926-860X(25)00303-5 S0926860X25003035 1-s2.0-S0926860X25003035 10.1016/j.apcata.2025.120402 271346 2025-07-07T19:56:34.976853Z 2025-08-25 1-s2.0-S0926860X25003035-main.pdf https://s3-eu-west-1.amazonaws.com/prod-ucs-content-store-eu-west/content/pii:S0926860X25003035/MAIN/application/pdf/2a8d78e3784a071f40bf243ed1c4227b/main.pdf main.pdf pdf true 9578878 MAIN 11 1-s2.0-S0926860X25003035-main_1.png https://s3-eu-west-1.amazonaws.com/prod-ucs-content-store-eu-west/content/pii:S0926860X25003035/PREVIEW/image/png/d895e2a75198b8947dce8437fe448275/main_1.png main_1.png png 57648 928 656 IMAGE-WEB-PDF 1 1-s2.0-S0926860X25003035-gr5.jpg https://s3-eu-west-1.amazonaws.com/prod-ucs-content-store-eu-west/content/pii:S0926860X25003035/gr5/DOWNSAMPLED/image/jpeg/fe2eb54f5d143f6114e9f5aac64e6d95/gr5.jpg gr5 gr5.jpg jpg 63458 246 791 IMAGE-DOWNSAMPLED 1-s2.0-S0926860X25003035-gr6.jpg https://s3-eu-west-1.amazonaws.com/prod-ucs-content-store-eu-west/content/pii:S0926860X25003035/gr6/DOWNSAMPLED/image/jpeg/6f5cdd4ce1573a93a47d7700d095edb0/gr6.jpg gr6 gr6.jpg jpg 181863 995 555 IMAGE-DOWNSAMPLED 1-s2.0-S0926860X25003035-gr7.jpg https://s3-eu-west-1.amazonaws.com/prod-ucs-content-store-eu-west/content/pii:S0926860X25003035/gr7/DOWNSAMPLED/image/jpeg/575d7421a1fe2790be945585d01cf02e/gr7.jpg gr7 gr7.jpg jpg 90946 505 565 IMAGE-DOWNSAMPLED 1-s2.0-S0926860X25003035-gr1.jpg https://s3-eu-west-1.amazonaws.com/prod-ucs-content-store-eu-west/content/pii:S0926860X25003035/gr1/DOWNSAMPLED/image/jpeg/deb9cf2401bf67628b6ffc1568b6a5c3/gr1.jpg gr1 gr1.jpg jpg 70892 463 565 IMAGE-DOWNSAMPLED 1-s2.0-S0926860X25003035-gr2.jpg https://s3-eu-west-1.amazonaws.com/prod-ucs-content-store-eu-west/content/pii:S0926860X25003035/gr2/DOWNSAMPLED/image/jpeg/01d6b756e5131533d7f8959bb347f2de/gr2.jpg gr2 gr2.jpg jpg 67903 464 565 IMAGE-DOWNSAMPLED 1-s2.0-S0926860X25003035-ga1.jpg https://s3-eu-west-1.amazonaws.com/prod-ucs-content-store-eu-west/content/pii:S0926860X25003035/ga1/DOWNSAMPLED/image/jpeg/277c88b3d29cf147d8e02f653df05717/ga1.jpg ga1 true ga1.jpg jpg 38791 200 371 IMAGE-DOWNSAMPLED 1-s2.0-S0926860X25003035-gr3.jpg https://s3-eu-west-1.amazonaws.com/prod-ucs-content-store-eu-west/content/pii:S0926860X25003035/gr3/DOWNSAMPLED/image/jpeg/7a2b38f5b746f288348e2d20fb6155d9/gr3.jpg gr3 gr3.jpg jpg 93316 476 659 IMAGE-DOWNSAMPLED 1-s2.0-S0926860X25003035-gr4.jpg https://s3-eu-west-1.amazonaws.com/prod-ucs-content-store-eu-west/content/pii:S0926860X25003035/gr4/DOWNSAMPLED/image/jpeg/6ecefb6b194b30b8e0d76b5d5865563d/gr4.jpg gr4 gr4.jpg jpg 87056 522 565 IMAGE-DOWNSAMPLED 1-s2.0-S0926860X25003035-gr5.sml https://s3-eu-west-1.amazonaws.com/prod-ucs-content-store-eu-west/content/pii:S0926860X25003035/gr5/THUMBNAIL/image/gif/5f14ad70f66280c95e26ddca324f90dd/gr5.sml gr5 gr5.sml sml 6941 68 219 IMAGE-THUMBNAIL 1-s2.0-S0926860X25003035-gr6.sml https://s3-eu-west-1.amazonaws.com/prod-ucs-content-store-eu-west/content/pii:S0926860X25003035/gr6/THUMBNAIL/image/gif/323773cece257114616d950f747d5306/gr6.sml gr6 gr6.sml sml 9404 163 91 IMAGE-THUMBNAIL 1-s2.0-S0926860X25003035-gr7.sml https://s3-eu-west-1.amazonaws.com/prod-ucs-content-store-eu-west/content/pii:S0926860X25003035/gr7/THUMBNAIL/image/gif/9f97c1ff49a5d5d99e7eea1b1ca5fbf0/gr7.sml gr7 gr7.sml sml 13669 164 183 IMAGE-THUMBNAIL 1-s2.0-S0926860X25003035-gr1.sml https://s3-eu-west-1.amazonaws.com/prod-ucs-content-store-eu-west/content/pii:S0926860X25003035/gr1/THUMBNAIL/image/gif/af46842142776bbb99da33e60afb84f2/gr1.sml gr1 gr1.sml sml 10552 164 200 IMAGE-THUMBNAIL 1-s2.0-S0926860X25003035-gr2.sml https://s3-eu-west-1.amazonaws.com/prod-ucs-content-store-eu-west/content/pii:S0926860X25003035/gr2/THUMBNAIL/image/gif/85727004e3560e8831643a8d9a841a64/gr2.sml gr2 gr2.sml sml 10356 164 200 IMAGE-THUMBNAIL 1-s2.0-S0926860X25003035-ga1.sml https://s3-eu-west-1.amazonaws.com/prod-ucs-content-store-eu-west/content/pii:S0926860X25003035/ga1/THUMBNAIL/image/gif/a6cb7c99d663fc302dc15db841053fad/ga1.sml ga1 true ga1.sml sml 20146 118 219 IMAGE-THUMBNAIL 1-s2.0-S0926860X25003035-gr3.sml https://s3-eu-west-1.amazonaws.com/prod-ucs-content-store-eu-west/content/pii:S0926860X25003035/gr3/THUMBNAIL/image/gif/5cd91d68cfd354c3b85e43465356b31e/gr3.sml gr3 gr3.sml sml 13866 158 219 IMAGE-THUMBNAIL 1-s2.0-S0926860X25003035-gr4.sml https://s3-eu-west-1.amazonaws.com/prod-ucs-content-store-eu-west/content/pii:S0926860X2500300X/gr4/THUMBNAIL/image/gif/232f088bacbfe39f5cd9cbc3de266e6d/gr4.sml gr4 gr4.sml sml 11431 164 177 IMAGE-THUMBNAIL 1-s2.0-S0926860X25003035-gr5_lrg.jpg https://s3-eu-west-1.amazonaws.com/prod-ucs-content-store-eu-west/content/pii:S0926860X25003035/HIGHRES/image/jpeg/97e83855857c3e746ce9a6275838bbe7/gr5_lrg.jpg gr5 gr5_lrg.jpg jpg 286823 1087 3493 IMAGE-HIGH-RES 1-s2.0-S0926860X25003035-gr6_lrg.jpg https://s3-eu-west-1.amazonaws.com/prod-ucs-content-store-eu-west/content/pii:S0926860X25003035/HIGHRES/image/jpeg/413ac0eb6d65b2442727c95059a3386b/gr6_lrg.jpg gr6 gr6_lrg.jpg jpg 1028323 4408 2458 IMAGE-HIGH-RES 1-s2.0-S0926860X25003035-gr7_lrg.jpg https://s3-eu-west-1.amazonaws.com/prod-ucs-content-store-eu-west/content/pii:S0926860X25003035/HIGHRES/image/jpeg/2b9e2e5f4ace426497b7a9ad51cdf7ad/gr7_lrg.jpg gr7 gr7_lrg.jpg jpg 491022 2230 2495 IMAGE-HIGH-RES 1-s2.0-S0926860X25003035-gr1_lrg.jpg https://s3-eu-west-1.amazonaws.com/prod-ucs-content-store-eu-west/content/pii:S0926860X25003035/HIGHRES/image/jpeg/44c535b4ebe6fdcd5eeeb265c8ff18c2/gr1_lrg.jpg gr1 gr1_lrg.jpg jpg 349726 2045 2495 IMAGE-HIGH-RES 1-s2.0-S0926860X25003035-gr2_lrg.jpg https://s3-eu-west-1.amazonaws.com/prod-ucs-content-store-eu-west/content/pii:S0926860X25003035/HIGHRES/image/jpeg/320c35b7285840108ab238728c055486/gr2_lrg.jpg gr2 gr2_lrg.jpg jpg 366558 2049 2495 IMAGE-HIGH-RES 1-s2.0-S0926860X25003035-ga1_lrg.jpg https://s3-eu-west-1.amazonaws.com/prod-ucs-content-store-eu-west/content/pii:S0926860X25003035/HIGHRES/image/jpeg/b6859fcd9974bbbe6657dc792eb5732e/ga1_lrg.jpg ga1 true ga1_lrg.jpg jpg 318757 886 1642 IMAGE-HIGH-RES 1-s2.0-S0926860X25003035-gr3_lrg.jpg https://s3-eu-west-1.amazonaws.com/prod-ucs-content-store-eu-west/content/pii:S0926860X2500300X/HIGHRES/image/jpeg/1d0a733949e10b0dba13cb803e80df17/gr3_lrg.jpg gr3 gr3_lrg.jpg jpg 535909 2103 2911 IMAGE-HIGH-RES 1-s2.0-S0926860X25003035-gr4_lrg.jpg https://s3-eu-west-1.amazonaws.com/prod-ucs-content-store-eu-west/content/pii:S0926860X2500300X/HIGHRES/image/jpeg/84a869c14344682f2812c8cb6c5e36d7/gr4_lrg.jpg gr4 gr4_lrg.jpg jpg 442754 2306 2495 IMAGE-HIGH-RES 1-s2.0-S0926860X25003035-mmc1.docx https://s3-eu-west-1.amazonaws.com/prod-ucs-content-store-eu-west/content/pii:S0926860X25003035/mmc1/MAIN/application/vnd.openxmlformats-officedocument.wordprocessingml.document/b5267cb7af4155f53bb11a934f86b8e2/mmc1.docx mmc1 mmc1.docx docx 4302550 APPLICATION 1-s2.0-S0926860X25003035-si0001.svg https://s3-eu-west-1.amazonaws.com/prod-ucs-content-store-eu-west/content/pii:S0926860X25003035/image/svg+xml/12ec23b7ae68f909d743a40d9d3430f0/si0001.svg si0001 si0001.svg svg 1900 ALTIMG 1-s2.0-S0926860X25003035-si0002.svg https://s3-eu-west-1.amazonaws.com/prod-ucs-content-store-eu-west/content/pii:S0926860X25003035/image/svg+xml/8492fdb399b103b8e5384be2f3bb2ce6/si0002.svg si0002 si0002.svg svg 1705 ALTIMG 1-s2.0-S0926860X25003035-si0003.svg https://s3-eu-west-1.amazonaws.com/prod-ucs-content-store-eu-west/content/pii:S0926860X25003035/image/svg+xml/12f05b46c0d2f4f4d59c6d2e82da59fd/si0003.svg si0003 si0003.svg svg 1507 ALTIMG 1-s2.0-S0926860X25003035-si0004.svg https://s3-eu-west-1.amazonaws.com/prod-ucs-content-store-eu-west/content/pii:S0926860X25003035/image/svg+xml/56112edb02034978d30f1f7561a8b5de/si0004.svg si0004 si0004.svg svg 1491 ALTIMG 1-s2.0-S0926860X25003035-si0005.svg https://s3-eu-west-1.amazonaws.com/prod-ucs-content-store-eu-west/content/pii:S0926860X25003035/image/svg+xml/ad82ea24129f68d811c36d6a59314cde/si0005.svg si0005 si0005.svg svg 4485 ALTIMG 1-s2.0-S0926860X25003035-si0006.svg https://s3-eu-west-1.amazonaws.com/prod-ucs-content-store-eu-west/content/pii:S0926860X25003035/image/svg+xml/1e7e9182bbd5f0ec99fe06c5583ae24b/si0006.svg si0006 si0006.svg svg 1608 ALTIMG 1-s2.0-S0926860X25003035-si0007.svg https://s3-eu-west-1.amazonaws.com/prod-ucs-content-store-eu-west/content/pii:S0926860X25003035/image/svg+xml/cb972e0460b78792d0bb266d19f2beed/si0007.svg si0007 si0007.svg svg 1665 ALTIMG 1-s2.0-S0926860X25003035-si0008.svg https://s3-eu-west-1.amazonaws.com/prod-ucs-content-store-eu-west/content/pii:S0926860X25003035/image/svg+xml/0b62aa91bf894bf991c90344825089b8/si0008.svg si0008 si0008.svg svg 1333 ALTIMG 1-s2.0-S0926860X25003035-si0009.svg https://s3-eu-west-1.amazonaws.com/prod-ucs-content-store-eu-west/content/pii:S0926860X25003035/image/svg+xml/eb61eb021722b67409c699845969afea/si0009.svg si0009 si0009.svg svg 3213 ALTIMG 1-s2.0-S0926860X25003035-si0010.svg https://s3-eu-west-1.amazonaws.com/prod-ucs-content-store-eu-west/content/pii:S0926860X25003035/image/svg+xml/87afabcf01a58f7456cdb5fdec400aec/si0010.svg si0010 si0010.svg svg 1539 ALTIMG 1-s2.0-S0926860X25003035-si0011.svg https://s3-eu-west-1.amazonaws.com/prod-ucs-content-store-eu-west/content/pii:S0926860X25003035/image/svg+xml/12f05b46c0d2f4f4d59c6d2e82da59fd/si0011.svg si0011 si0011.svg svg 1507 ALTIMG 1-s2.0-S0926860X25003035-si0012.svg https://s3-eu-west-1.amazonaws.com/prod-ucs-content-store-eu-west/content/pii:S0926860X25003035/image/svg+xml/6608dc75d2c29968f6f5ad9d37224dbe/si0012.svg si0012 si0012.svg svg 2301 ALTIMG 1-s2.0-S0926860X25003035-si0013.svg https://s3-eu-west-1.amazonaws.com/prod-ucs-content-store-eu-west/content/pii:S0926860X25003035/image/svg+xml/9e70a7b31e13d1048220e618bad1fb09/si0013.svg si0013 si0013.svg svg 4522 ALTIMG 1-s2.0-S0926860X25003035-si0014.svg https://s3-eu-west-1.amazonaws.com/prod-ucs-content-store-eu-west/content/pii:S0926860X25003035/image/svg+xml/91ca588ac4537a16cd5b2a4e54e49a70/si0014.svg si0014 si0014.svg svg 1474 ALTIMG 1-s2.0-S0926860X25003035-si0015.svg https://s3-eu-west-1.amazonaws.com/prod-ucs-content-store-eu-west/content/pii:S0926860X25003035/image/svg+xml/741449b7ebd7854ac0852e60f0fa9d4c/si0015.svg si0015 si0015.svg svg 1170 ALTIMG 1-s2.0-S0926860X25003035-si0016.svg https://s3-eu-west-1.amazonaws.com/prod-ucs-content-store-eu-west/content/pii:S0926860X25003035/image/svg+xml/908bb285028c5639410ef5be4379e141/si0016.svg si0016 si0016.svg svg 2155 ALTIMG 1-s2.0-S0926860X25003035-si0017.svg https://s3-eu-west-1.amazonaws.com/prod-ucs-content-store-eu-west/content/pii:S0926860X25003035/image/svg+xml/c7ce2aa770b18f224da53c08f69f2c1c/si0017.svg si0017 si0017.svg svg 4340 ALTIMG 1-s2.0-S0926860X25003035-si0018.svg https://s3-eu-west-1.amazonaws.com/prod-ucs-content-store-eu-west/content/pii:S0926860X25003035/image/svg+xml/c1be2a5dce8add1b97a3cb87d652431f/si0018.svg si0018 si0018.svg svg 1126 ALTIMG 1-s2.0-S0926860X25003035-si0019.svg https://s3-eu-west-1.amazonaws.com/prod-ucs-content-store-eu-west/content/pii:S0926860X25003035/image/svg+xml/7ddea714a95b4e264de11c370bc0a7ee/si0019.svg si0019 si0019.svg svg 1572 ALTIMG 1-s2.0-S0926860X25003035-si0020.svg https://s3-eu-west-1.amazonaws.com/prod-ucs-content-store-eu-west/content/pii:S0926860X25003035/image/svg+xml/0e43aef6668f72dcfb1261cc129bd77b/si0020.svg si0020 si0020.svg svg 2439 ALTIMG 1-s2.0-S0926860X25003035-si0021.svg https://s3-eu-west-1.amazonaws.com/prod-ucs-content-store-eu-west/content/pii:S0926860X25003035/image/svg+xml/18990ed6b37c6e392c9f85aec17f1e87/si0021.svg si0021 si0021.svg svg 1458 ALTIMG 1-s2.0-S0926860X25003035-si0022.svg https://s3-eu-west-1.amazonaws.com/prod-ucs-content-store-eu-west/content/pii:S0926860X25003035/image/svg+xml/3653e3f48d050503a37d76d9b18b21cc/si0022.svg si0022 si0022.svg svg 1645 ALTIMG 1-s2.0-S0926860X25003035-si0023.svg https://s3-eu-west-1.amazonaws.com/prod-ucs-content-store-eu-west/content/pii:S0926860X25003035/image/svg+xml/28d184d194b4bc09268fbbd54182fffe/si0023.svg si0023 si0023.svg svg 3472 ALTIMG 1-s2.0-S0926860X25003035-si0024.svg https://s3-eu-west-1.amazonaws.com/prod-ucs-content-store-eu-west/content/pii:S0926860X25003035/image/svg+xml/eccf75a5d5a3db317f5c6baff1d2ecc1/si0024.svg si0024 si0024.svg svg 1430 ALTIMG 1-s2.0-S0926860X25003035-si0025.svg https://s3-eu-west-1.amazonaws.com/prod-ucs-content-store-eu-west/content/pii:S0926860X25003035/image/svg+xml/8280085c4d141901bb9bd50b528702fe/si0025.svg si0025 si0025.svg svg 1539 ALTIMG 1-s2.0-S0926860X25003035-si0026.svg https://s3-eu-west-1.amazonaws.com/prod-ucs-content-store-eu-west/content/pii:S0926860X25003035/image/svg+xml/68d13a5eb43d0eccfa7ce514e13a7168/si0026.svg si0026 si0026.svg svg 2913 ALTIMG 1-s2.0-S0926860X25003035-si0027.svg https://s3-eu-west-1.amazonaws.com/prod-ucs-content-store-eu-west/content/pii:S0926860X25003035/image/svg+xml/eccf75a5d5a3db317f5c6baff1d2ecc1/si0027.svg si0027 si0027.svg svg 1430 ALTIMG 1-s2.0-S0926860X25003035-si0028.svg https://s3-eu-west-1.amazonaws.com/prod-ucs-content-store-eu-west/content/pii:S0926860X25003035/image/svg+xml/c7c409605bc70e307cb307a19b83138d/si0028.svg si0028 si0028.svg svg 1608 ALTIMG 1-s2.0-S0926860X25003035-si0029.svg https://s3-eu-west-1.amazonaws.com/prod-ucs-content-store-eu-west/content/pii:S0926860X25003035/image/svg+xml/77314abac528096e0a9dbce66f0d95eb/si0029.svg si0029 si0029.svg svg 2301 ALTIMG 1-s2.0-S0926860X25003035-si0030.svg https://s3-eu-west-1.amazonaws.com/prod-ucs-content-store-eu-west/content/pii:S0926860X25003035/image/svg+xml/fcfc3e9d29e4a586b77f1ff70f111a2b/si0030.svg si0030 si0030.svg svg 1507 ALTIMG 1-s2.0-S0926860X25003035-si0031.svg https://s3-eu-west-1.amazonaws.com/prod-ucs-content-store-eu-west/content/pii:S0926860X25003035/image/svg+xml/81d81cd419d58e605164cfe85817478e/si0031.svg si0031 si0031.svg svg 2301 ALTIMG 1-s2.0-S0926860X25003035-si0032.svg https://s3-eu-west-1.amazonaws.com/prod-ucs-content-store-eu-west/content/pii:S0926860X25003035/image/svg+xml/49b0823cac02fb35bae279b0f373f212/si0032.svg si0032 si0032.svg svg 2155 ALTIMG 1-s2.0-S0926860X25003035-si0033.svg https://s3-eu-west-1.amazonaws.com/prod-ucs-content-store-eu-west/content/pii:S0926860X25003035/image/svg+xml/49b0823cac02fb35bae279b0f373f212/si0033.svg si0033 si0033.svg svg 2155 ALTIMG 1-s2.0-S0926860X25003035-si0034.svg https://s3-eu-west-1.amazonaws.com/prod-ucs-content-store-eu-west/content/pii:S0926860X25003035/image/svg+xml/49b0823cac02fb35bae279b0f373f212/si0034.svg si0034 si0034.svg svg 2155 ALTIMG 1-s2.0-S0926860X25003035-si0035.svg https://s3-eu-west-1.amazonaws.com/prod-ucs-content-store-eu-west/content/pii:S0926860X25003035/image/svg+xml/49b0823cac02fb35bae279b0f373f212/si0035.svg si0035 si0035.svg svg 2155 ALTIMG 1-s2.0-S0926860X25003035-si0036.svg https://s3-eu-west-1.amazonaws.com/prod-ucs-content-store-eu-west/content/pii:S0926860X25003035/image/svg+xml/540b8ea106849b4613696e4311b33ee5/si0036.svg si0036 si0036.svg svg 2929 ALTIMG 1-s2.0-S0926860X25003035-si0037.svg https://s3-eu-west-1.amazonaws.com/prod-ucs-content-store-eu-west/content/pii:S0926860X25003035/image/svg+xml/3e8f696a924eec199492c78f3aa5622d/si0037.svg si0037 si0037.svg svg 2184 ALTIMG APCATA 120402 120402 S0926-860X(25)00303-5 10.1016/j.apcata.2025.120402 Elsevier B.V. Fig. 1 (a) CH3OH conversion and (b) CO2 yield over MnO2, Mn15Bi1Ox, Mn7.5Bi1Ox, and Mn2.5Bi1Ox catalysts during CH3OH oxidation reaction. (c) Catalysts stability during 100 h continuous CH3OH oxidation test over MnO2 and Mn7.5Bi1Ox catalysts at 165 °C. (d) Arrhenius plots of CH3OH oxidation reaction rates over different Bi-doped MnO2 catalysts. Fig. 1 Fig. 2 (a) CH3OH conversion and (b) CO2 yield over MnO2 and Mn7.5Bi1Ox catalysts during CH3OH oxidation reaction with H2O (0, 3, 5, 10, and 15 vol%). (c) CH3OH conversion and (d) CO2 yield over MnO2 and Mn7.5Bi1Ox catalysts during CH3OH oxidation reaction with CO2 (0 and 3 vol%). Fig. 2 Fig. 3 (a) Specific CH3OH oxidation reaction rates (RS) based on the specific surface areas over Bi-doped MnO2 catalysts at 130 °C. (b) XRD patterns of MnO2, Mn15Bi1Ox, Mn7.5Bi1Ox, Mn2.5Bi1Ox, and BiOx catalysts. (c-e) HR‐TEM images of MnO2, Mn7.5Bi1Ox, and BiOx catalysts. Fig. 3 Fig. 4 Quasi in situ XPS spectra of (a) Mn 2p3/2, (b) Mn 3 s, (c) Bi 4 f, and (d) O 1 s for Bi-doped MnO2 catalysts. Fig. 4 Fig. 5 (a) O2-TPD, (b)H2-TPR and (c) CH3OH-TPD profiles of MnO2, Mn15Bi1Ox, Mn7.5Bi1Ox, Mn2.5Bi1Ox, and BiOx catalysts. Fig. 5 Fig. 6 (a, c, e) In situ DRIFTS spectra and (b, d, f) surface species evolution at elevated temperature over MnO2, BiOx, and Mn7.5Bi1Ox during CH3OH oxidation reaction (1 %CH3OH/10 %O2/40 %N2/Ar). (g) In situ DRIFTS spectra and (h) surface species evolution at an elevated temperature over Mn7.5Bi1Ox during CH3OH oxidation reaction (1 %CH3OH/10 %O2/40 %N2/Ar) with H2O (3 vol%) existed. Fig. 6 Fig. 7 (a, c) In situ DRIFTS spectra and (b, d) surface species evolution of MnO2 and Mn7.5Bi1Ox at elevated temperature during CH3OH-TPD in an Ar flow. Fig. 7 Elucidating the structure-activity relationship of Bi-doped MnO2 catalysts towards CH3OH oxidation Suxin Yu Writing – original draft Methodology Investigation Data curation Conceptualization Haoyuan Gu Methodology Investigation Data curation Qihang Wen Methodology Investigation Data curation Yi-Fan Han Supervision Resources Project administration Minghui Zhu Writing – review & editing Supervision Resources Project administration Funding acquisition ⁎ State Key Laboratory of Chemical Engineering, East China University of Science and Technology, 130 Meilong Road, Shanghai 200237, China State Key Laboratory of Chemical Engineering, East China University of Science and Technology 130 Meilong Road Shanghai 200237 China State Key Laboratory of Chemical Engineering, East China University of Science and Technology, 130 Meilong Road, Shanghai 200237, China ⁎ Corresponding author. MnO2-based catalysts have been extensively utilized in the catalytic oxidation of volatile organic compounds due to their cost-effectiveness. In this study, a series of Bi-doped MnO2 catalysts with various contents were systematically investigated to reveal the structure-activity relationship during the CH3OH oxidation reaction, which was achieved using a series of characterizations. Bi could enter the MnO2 lattice and lead to the facile formation of oxygen vacancies, facilitating the generation of surface reactive oxygen species by O2 dissociation. With the increase of Bi, the activity showed a volcanic trend, and the Mn7.5Bi1Ox (T90 = 160 °C) exhibited the lowest apparent activation energy and optimal performance. CH3OH oxidation mechanism (CH3OH → methoxy species → formate species → CO2 and H2O) was revealed by in situ DRIFTS, and the last two oxidation processes were significantly sped up. Bi-doped MnO2 exhibited high H2O tolerance due to hydroxyl-assisted CH3OH chemisorption via hydrogen bonding and hydroxyl-assisted C-H activation of methoxy species with surface reactive oxygen species. These findings are beneficial for the rational design of metal-doped catalysts with rich oxygen vacancy defects for catalytic oxidation. Graphical Abstract Keywords CH3OH oxidation Manganese oxide Bi doping Oxygen vacancies Surface reactive oxygen species Data Availability Data will be made available on request. 1 Introduction Stemming from worldwide concerns about human health and the natural environment, extensive efforts have been made to treat detrimental volatile organic compounds (VOCs) from our daily life and industry [1,2]. Among multi-pronged elimination methods [3,4], catalytic oxidation, the most thorough and eco-friendly one, catches significant attention, which not only converts VOCs into nontoxic CO2 and H2O molecules but also achieves energy recycling by using regenerative catalytic oxidors [5–7]. On the other hand, CH3OH, as one of the VOCs, the removal of which garners interest in the field of hydrogen energy due to the need for heat supply and treatment of tail gas for methanol steam reforming to hydrogen [5,6,8]. The key to efficient catalytic oxidation lies in the development of cost-effective catalysts [9]. Currently, the catalysts for thermal CH3OH oxidation can be divided into two categories: i) Pt, Pd, Ru, Au, or Ag-based noble metal catalysts [10–14]; and ii) transition metal-based (Mn, Cu, Ce, Co, etc.) oxide catalysts [15–18]. Transition metal oxides, especially Mn oxides, stand out and are widely investigated in virtue of low cost, abundant reserves, rich crystal structures, multi-valence states, excellent redox nature, superior lattice oxygen mobility, and high oxygen storage capacity, which promotes VOCs incineration for commercialization [19,20]. To further improve performances for catalytic oxidation reactions, a series of metal-doped manganese oxide catalysts have been studied. For instance, Wang et al. [21] synthesized Co-doped manganese oxides via microwave/ultrasound-assisted method to create polycrystalline interfacial sites for methane oxidation. Jiang et al. [22] reported that optimized Mn5Cu1 exhibited excellent catalytic oxidation performance with outstanding H2O resistance due to the bimetal synergistic effect and plentiful oxygen vacancies. Defect-rich manganese oxides can provide highly active sites for adsorption or activation of reactants and prompt conversion of intermediates [23,24]. It is worth mentioning that Bi doping has been widely applied in electrocatalytic, photocatalytic, and thermocatalytic oxidation reactions due to its promotion of lattice distortion defects and enhancement of redox capacity [25–27]. Bi-modified reducible metal oxides (Co3O4, Fe2O3, or CeO2) have been reported to be favorable for soot or CO oxidation [28–31]. To the best of our knowledge, systematic investigations on the structure-activity relationship of Bi-doped MnO2 catalysts for CH3OH oxidation are still inadequate. In the present study, we systematically studied the structure-activity relationship of Bi-doped MnO2 for CH3OH oxidation. In particular, X-ray diffraction (XRD), high-resolution transmission electron microscopy (HR-TEM), scanning electron microscope-energy dispersive X-ray spectrometer (SEM-EDS), and quasi in situ X-ray photo-electron spectroscopy (quasi in situ XPS) were used to characterize the bulk/surface structures of Bi-doped MnO2. Hydrogen temperature programmed reduction (H2-TPR), oxygen or methanol temperature programmed desorption (O2-TPD or CH3OH-TPD) were carried out to investigate the redox capability. In addition, CH3OH oxidation mechanism was revealed by in situ diffuse reflectance infrared Fourier transform spectroscopy (in situ DRIFTS). Bi doping facilitated the generation of oxygen vacancies to adsorb and activate O2 to produce surface reactive oxygen species. The conversions of methoxy species to formate, and formate to CO2 and H2O were accelerated. The promotion of H2O towards CH3OH oxidation was also investigated over Bi-doped MnO2, where hydroxyl species were found to assist CH3OH chemisorption and C-H activation of methoxy species with surface reactive oxygen species. 2 Experimental section 2.1 Raw materials and chemicals All the chemicals were of analytical grade. K2CO3 and Bi(CH3COO)3 were bought from Shanghai D&B Biological Science and Technology Co., Ltd. Mn(CH3COO)2·4 H2O were obtained from Sinopharm Chemical Reagent Co., Ltd. HOCH2CH2OH and CH3OH were purchased from Shanghai Macklin Biochemical Technology Co., Ltd. SiO2 (40–50 mesh) were acquired from Shanghai Aladdin Biochemical Technology Co., Ltd. Deionized water was homemade using the water purification system (electrical resistivity ≥ 18.25 MΩ·cm). Shanghai Air Liquide Co., Ltd. provided ultra-pure Air(20 %O2/80 %N2), Ar, 10 %H2/Ar, 2 %CO/98 %Ar, and CO2. All the chemicals were utilized without further purification. 2.2 Preparation of the Bi-doped MnO2 catalysts A low-temperature co-precipitation method was used to prepare Bi-doped MnO2 catalysts with different compositions. Mn(CH3COO)2·4 H2O and Bi(CH3COO)3 were stoichiometrically dispersed and dissolved in glycol (150 mL) following vigorous stirring for 1 h. And K2CO3 (0.0260 mol) was dissolved in deionized water (100 mL) under ultrasonication. Subsequently, the K2CO3 solution was injected at a rate of 4 mL·min−1 into the above bimetallic precursor solution with constant stirring and cooled with an ice bath. After complete injection, the suspensions were further aged for 2 h. The precipitates were then centrifugally washed with cold-deionized water until the pH reached 7.0, dried in an oven at 35 °C for 24 h, and calcined in static air at 450 °C for 4 h with a ramp rate of 2 °C·min−1. The detailed reagents and dosages of catalyst preparation were shown in Table S1. 2.3 Catalyst characterization The catalysts were characterized by a series of methods, including O2-TPD, H2O temperature programmed desorption (H2O-TPD), CH3OH-TPD, H2-TPR, XRD, inductively coupled plasma-optical emission spectrometer (ICP-OES), N2 adsorption-desorption isotherms, HR-TEM, SEM-EDS, quasi in situ XPS, and in situ DRIFTS. Details of these operations were listed below. The nitrogen adsorption-desorption isotherm curves were tested using Micrometrics ASAP 2460 at −196 °C in static mode. Prior to characterization, the powder catalysts were thoroughly ground and degassed with pure He at 200 °C for 8 h. The specific surface area, total pore volume, average pore diameter, and pore size distribution were calculated using the Brunauer-Emmett-Teller (BET) and Barrett-Joyner-Halenda (BJH) theories based on the adsorption branch of isotherm. XRD was performed with D8/Advance X-ray diffractometer (BRUKER, Germany) using Cu Kα radiation (λ = 0.154 nm). The scan range was 10–80°, the scan speed was 3 °·min−1, and the step size was 0.02°. The average grain sizes of manganese oxide substrates were calculated with the full width of half-maximum using the Scherrer formula: (1) D = 0.9 λ ∆ cos θ Where D is the crystal size, λ is the wavelength of X-rays, Δ is the FWHM of the diffraction peak, and θ is the angle corresponding to the peak. ICP-OES (Agilent 5800) was utilized to obtain the Mn, Bi, and K mass fractions, ensuring that the molar ratios of the samples synthesized were consistent with expectations. Using a micro-fixed bed reactor with a U-type quartz tube (4 mm diameter) connected to mass spectrometry (HIDEN HPR200) for online chemical detection, O2-TPD experiments were carried out. First of all, 50 mg of catalysts were treated with Ar (30 mL·min−1) at 200 °C for 1 h to remove adsorbed water and carbonate species. The reactor was then allowed to cool naturally to room temperature, and the flow gas was switched to 10 %O2/Ar (30 mL·min−1) to achieve oxygen adsorption on the catalysts. Subsequently, the flow gas was switched back to Ar (30 mL·min−1) to remove physically adsorbed O2 and stabilize the baseline. Finally, the temperature was programmed to increase from 25 to 840 °C with a ramp of 10 °C·min−1 in Argon atmosphere. The CH3OH-TPD or H2O-TPD process was similar to the O2-TPD, but the CH3OH (1 vol%) or H2O (3 vol%) was used instead of the 10 %O2. What’s more, the detected chemicals were CH3OH, CO2, and H2O, respectively. And more attention was paid to the results below 400 °C. During H2-TPR operation, 10 %H2/Ar was introduced after pretreating and cooling. Once the baseline stabilized for 1.5 h, the temperature program was run from 25 to 740 °C with a ramp of 10 °C·min−1. Quasi in situ X-ray photoelectron spectroscopy was detected on Thermo Fisher Scientific-K-Alpha spectrometer equipped with Al Kα radiation (1486.6 eV, pass energy 50.0 eV). The C 1 s peak (284.8 eV, as reference) was adopted to calibrate all the binding energy. Before the examination, catalysts were pretreated in Ar (30 mL·min−1) at 200 °C for 1 h and transferred into a vacuum analysis chamber to avoid exposure to air. The XPS spectra of Mn 2p3/2, Mn 3 s, Bi 4 f, and O 1 s were recorded. HR-TEM was conducted on a JEOL JEM F200 microscope operated at 100 kV. Scanning electron microscopy (SEM) measurements were performed using a TESCAN MIRA LMS. Energy dispersive X-ray spectroscopy (EDS) was measured with Quantax 200 XFlash 6|60. In situ DRIFTS spectra of CH3OH oxidation and CH3OH-TPD processes at elevated temperatures were recorded using a Fourier transform infrared spectrometer (PerkinElmer, Frontier) equipped with a mercury cadmium telluride (MCT-A) detector and a homemade in situ cell (Fig. S1) [32] with a resolution of 4 cm−1. Firstly, 50 mg of catalysts were pretreated by an Ar flow (30 mL·min−1) at 200 °C for 1 h and cooled to 15 °C. Then, the background spectrum was recorded. In the CH3OH oxidation process, spectra over MnO2, BiOx, and Mn7.5Bi1Ox were obtained with the samples heated to 300 or 500 °C at a rate of 5 °C·min−1 in 1 %CH3OH/10 %O2/40 %N2/Ar atmosphere. Moreover, H2O (3 vol%) was added to investigate its influence where needed. In the CH3OH-TPD process over MnO2 and Mn7.5Bi1Ox, the catalysts were pretreated with Ar (30 mL·min−1) at 200 °C for 1 h and cooled to 15 °C, and then the reactants with 1 %CH3OH/Ar (30 mL·min−1) were introduced for 1 h to adsorb CH3OH, and the catalysts were purged with Ar. The spectra were recorded at an Ar flow (30 mL·min−1) with temperature increasing at a ramp of 5 °C·min−1. The infrared absorption peaks of the intermediate species were integrated and the distributions of the peak area with temperature were plotted. 2.4 Evaluation of catalytic performance The catalysts were applied to catalytic CH3OH oxidation, CO oxidation, and CH3OH cracking reactions. Details of these evaluations of catalytic performance were listed below. The catalyst evaluation setup (Fig. S2) for CH3OH oxidation was a micro-fixed bed reactor, where 40 mg of catalysts (60–80 mesh) diluted with 160 mg of SiO2 (40–50 mesh) were sandwiched by quartz wool within the quartz tube (4 mm diameter). Constant CH3OH was introduced by air bubbling through a glass saturator at −4 °C and further mixed with Ar. The chromatographic results up to 100 h demonstrated the stability of CH3OH bubbling (Fig. S3). The inlet was a gas mixture of 1 %CH3OH/10 %O2/40 %N2/Ar with a total flow rate of 30 mL·min−1. The corresponding weight hourly space velocity (WHSV) was 45000 mL· g cat . − 1 · h − 1 . The reactor effluents were analyzed by gas chromatographs (Shanghai Ruimin, Model GC2006) equipped with a capillary column of KB-1301, a 5 A molecular sieves column, a TDX-01 column, a methanizer, a flame ionization detector (FID), and a thermal conductivity detector (TCD) for analysis of the products. Both the inlet streamlines from bubbler to reactor and the outlet streamlines from reactor to gas chromatograph were heated at 100 °C to avoid condensation of the chemicals. The effect of H2O (3, 5, 10, and 15 vol%) or CO2 (3 vol%) on CH3OH oxidation was also explored. To diminish the significant influence of heat and mass transfer, the conversion of CH3OH was kept below 20 % using 1.00 mg of catalysts diluted with 4.00 mg of SiO2 to obtain the reaction rate ( R CH 3 OH ) and apparent activation energy (Ea). The conversion of CH3OH ( X CH 3 OH , %) is calculated using Eq. (2): (2) X CH 3 OH % = C CH 3 OH in − C CH 3 OH out C CH 3 OH in × 100 % Where C CH 3 OH in and C CH 3 OH out are the inlet and outlet concentrations of CH3OH, respectively. The yield of CO2 ( Y CO 2 , %) is calculated from the Eq. (3): (3) Y CO 2 = C CO 2 out C CH 3 OH in × 100 % Where C CO 2 out is the outlet concentration of CO2. The rate of CH3OH oxidation ( R CH 3 OH , μ mol CH 3 OH · g cat . − 1 · s − 1 ) is calculated by Eq. (4): (4) R CH 3 OH μ mol CH 3 OH · g cat . − 1 · s − 1 = F CH 3 OH × X CH 3 OH m cat . Where F CH 3 OH is the flow rate of CH3OH in μmol·s−1, m cat. is the catalyst weight in grams. The specific rate of CH3OH oxidation based on the specific surface areas ( R S , μ mol CH 3 OH · m − 2 · s − 1 ) is calculated by Eq. (5): (5) R S μ mol CH 3 OH · m − 2 · s − 1 = F CH 3 OH × X CH 3 OH m cat . × A S Where A S is the specific surface area of catalysts in m2·g−1. The Arrhenius Eq. (6) is utilized to obtain the apparent activation energy ( E a , kJ ∙ mol − 1 ) of catalysts for CH3OH oxidation with CH3OH conversion below 20 %. (6) ln R CH 3 OH = − E a RT + ln A Where R is the ideal gas constant (8.314 J ∙ mol − 1 ∙ K − 1 ), T is the reaction temperature (K), and A is the pre-exponential factor. Ultimately, the apparent activation energy was calculated by plotting ln R CH 3 OH ∼ 1000/T. CO oxidation was performed using the identical setup and pretreatment. The inlet was a gas mixture of 1 %CO/10 %O2/40 %N2/Ar with a total flow rate of 30 mL·min−1. The influence of H2O (3 and 15 vol%) was also examined on CO oxidation. The conversion of CO (X CO, %) is calculated by Eq. (7): (7) X CO % = C CO 2 out C CO out + C CO 2 out Where C CO out and C CO 2 out are the outlet concentrations of CO and CO2, respectively. CH3OH cracking was performed using the identical setup and pretreatment. The inlet was a gas mixture of 1 %CH3OH/Ar with a total flow rate of 30 mL·min−1. The yield of CO (Y CO, %) is calculated by Eq. (8): (8) Y CO % = C CO out C CH 3 OH in Where C CO out is the outlet concentration of CO and C CH 3 OH in is the inlet concentration of CH3OH. 3 Results and discussion 3.1 Activity of Bi-doped MnO2 towards CH3OH oxidation To systematically investigate the role of Bi doping in MnO2, catalysts with varying Bi doping were synthesized, with the actual content confirmed by ICP-OES analysis (Table S2). The CH3OH oxidation activities over Bi-doped MnO2 catalysts ( Fig. 1a,b and S4) followed the order of Mn7.5Bi1Ox > Mn15Bi1Ox > Mn2.5Bi1Ox > MnO2 > BiOx. The T50 (the temperature at which 50 %CH3OH converted) was noticed at 147 °C for Mn7.5Bi1Ox, which was remarkably lower than that for MnO2 (165 °C), Mn15Bi1Ox (152 °C), Mn2.5Bi1Ox (154 °C), and BiOx (300 °C), respectively. Specifically, at 160 °C, Mn7.5Bi1Ox achieved almost 90 % CO2 yield, while MnO2, Mn15Bi1Ox, Mn2.5Bi1Ox, and BiOx reached 25, 70, 69, and 0 % CO2 yield. The CH3OH reaction rates were also calculated, showing a volcanic trend against the amount of Bi over Bi-doped MnO2 (Fig. S5). The CH3OH reaction rate of the Mn7.5Bi1Ox was 14.2 μ mol C H 3 O H · g cat . − 1 · s − 1 at 150 °C, which was 1.5 times that of MnO2. At 160 °C, R CH 3 OH over Mn7.5Bi1Ox raised to 20.5 μ mol C H 3 O H · g cat . − 1 · s − 1 , being 2 times that of the unpromoted MnO2. The influence of weight hourly space velocities was explored (Fig. S6), where Mn7.5Bi1Ox manifested satisfactory activity even at 180000 mL·g−1·h−1. To the best of our knowledge, this is among the highly active catalysts that have been reported for CH3OH oxidation (Table S3). Mn7.5Bi1Ox also performed well in the stability test of catalytic CH3OH oxidation at 165 °C for up to 100 h with CH3OH conversion and CO2 yield decreasing by only ∼7 % compared to ∼11 and ∼17 % for MnO2 (Fig. 1c). In addition, Arrhenius plots of these catalysts during CH3OH oxidation in the temperature region of 110–190 °C were presented in Fig. 1d, where the apparent activation energy followed the order of Mn7.5Bi1Ox (Ea = 42.9 ± 1.6 kJ·mol−1) < Mn2.5Bi1Ox (Ea = 53.0 ± 3.9 kJ·mol−1) < Mn15Bi1Ox (Ea = 56.6 ± 3.6 kJ·mol−1) < MnO2 (Ea = 72.1 ± 4.3 kJ·mol−1). The lowest Ea of Mn7.5Bi1Ox indicated that CH3OH oxidation was more kinetically favorable. H2O, as the target product of catalytic CH3OH oxidation, might be tightly adsorbed on the active sites of catalysts, especially for Mn-based catalysts, which leads to a sharp decrease in catalytic VOCs oxidation activity [24,33]. Exceptionally, the presence of H2O (3, 5, 10, and 15 vol%) resulted in a slight enhancement of CH3OH oxidation ( Fig. 2a,b). In addition, the catalytic stability of MnO2 and Mn7.5Bi1Ox for CH3OH oxidation under high humidity (10 vol%) at 140 °C was conducted (Fig. S7). The CH3OH conversion increased slightly over MnO2 and Mn7.5Bi1Ox with H2O (10 vol%) introduced midway. When H2O molecules were removed, the CH3OH conversion slightly decreased to the previous levels. We also conducted CO oxidation experiments with H2O (0, 3, and 15 vol%) at 140 °C, CO conversion (Fig. S8) over Mn7.5Bi1Ox declined from 91 % to 60 % and then to 43 %, while over MnO2, it decreased from 78 % to 39 % and then to 30 %. Hence, H2O molecules exhibited inhibition on CO oxidation over Bi-doped MnO2·H2O-TPD experiments (Fig. S9) were performed on MnO2 and Mn7.5Bi1Ox in the temperature range (50–250 °C). Bi doping weakened H2O adsorption on MnO2 and the H2O molecules adsorption peak areas were reduced by 25 %. Differences in the H2O-tolerance of Bi-doped MnO2 between CH3OH oxidation and CO oxidation reactions might provide indirect information on the mechanism of CH3OH oxidation, which would be discussed later in this work. After introducing CO2 (3 vol%), the CH3OH conversion and CO2 yield declined slightly (Fig. 2c,d). This might be due to the formation of carbonate species from CO2 adsorbed on the active surface sites, which in turn affect the activity [18,33,34]. 3.2 Bulk structure and morphology of Bi-doped MnO2 The N2 adsorption and desorption isotherms (Fig. S10) were executed to determine the pore size distributions and specific surface areas of Bi-doped MnO2 (Table S4). All the samples displayed Ⅳ isotherms with hysteresis loops, indicating a typical mesoporous structure of the catalysts [35]. The specific surface areas of the samples followed the order of MnO2 (105.5 m2·g−1) > Mn15Bi1Ox (101.1 m2·g−1) > Mn7.5Bi1Ox (77.9 m2·g−1) > Mn2.5Bi1Ox (40.5 m2·g−1) > BiOx (1.2 m2·g−1). Similarly, the total pore volumes of the samples followed the order: MnO2 (0.314 cm3·g−1) > Mn15Bi1Ox (0.258 cm3·g−1) > Mn7.5Bi1Ox (0.196 cm3·g−1) > Mn2.5Bi1Ox (0.158 cm3·g−1) > BiOx (0.003 cm3·g−1). The average pore diameter showed a reverse-volcano trend against the amount of Bi: MnO2 (11.9 nm) > Mn15Bi1Ox (9.1 nm) > Mn7.5Bi1Ox (8.9 nm) < Mn2.5Bi1Ox (14.4 nm) < BiOx (14.8 nm). RS were calculated by correlating CH3OH oxidation rate and specific surface areas at 130 °C ( Fig. 3a), which followed the order of MnO2 (0.019 μ mol CH 3 OH · m − 2 · s − 1 ) < Mn15Bi1Ox (0.049 μ mol CH 3 OH · m − 2 · s − 1 ) < Mn2.5Bi1Ox (0.067 μ mol CH 3 OH · m − 2 · s − 1 ) < Mn7.5Bi1Ox (0.093 μ mol CH 3 OH · m − 2 · s − 1 ). The specific reaction rates were related to the content of surface active sites. In general, large specific surface area can expose more active sites, thereby increasing the probability of reactant contact and ultimately facilitating the reaction. However, MnO2 with the largest specific surface area exhibited the lowest specific reaction rate, which indicated that the surface area might not be the dominant factor in catalytic activity [36]. The pore structures might be related to the compositions, but didn’t influence the internal diffusion. We carried out the CH3OH oxidation over Mn7.5Bi1Ox with different mesh sizes, which didn’t exhibit significant changes (Fig. S11). XRD analyses were performed to obtain crystal structure information of the catalysts (Fig. 3b). For unpromoted MnO2, the diffraction peaks at 2θ = 36.9, 56.0, and 67.4° were consistent with (100), (102), and (110) crystal planes of hexagonal MnO2 (PDF #89–5171). The MnCO3 (PDF #85–1109) phase was present in minute quantities with peaks at 31.7° corresponding to the (104) crystal plane due to its incomplete thermal decomposition for MnO2 [37]. The XRD patterns of BiOx could be well indexed with monoclinic Bi2O3 (PDF #71–0465), where the sharp peaks (2θ = 24.4, 25.6, 26.7, 27.2, 27.8, 33.1, and 46.2°) coincided with the (-102), (002), (111), (120), (012), (121), and (122) planes. The average grain size of BiOx was ∼68.6 nm based on Scherrer formula [29]. With Bi doped into MnO2, the peak (36.9°) of MnO2 shifted towards lower 2θ values by ∼0.3°, implying that Bi atoms were doped into the manganese oxide lattice and caused lattice expansion. In addition, referring to the weaker peak and the broader full width of half-maximum of crystal phase at (100) crystal planes of MnO2, the crystallinity decreased and the average grain sizes of MnO2 substrates in these catalysts were calculated by Scherrer formula, which followed the order of MnO2 (8.6 nm) > Mn15Bi1Ox (7.9 nm) > Mn7.5Bi1Ox (7.5 nm). Furthermore, the orthorhombic Bi2Mn4O10 (PDF #74–1096) crystal phase recognizably appeared over Mn2.5Bi1Ox [38]. TEM and HR-TEM images of MnO2, Mn7.5Bi1Ox, and BiOx were taken to investigate their crystal structures (Figs. 3c-3e and S12). MnO2 presented the lattice spacings of 0.213 and 0.247 nm (Fig. 3c), corresponding to the (101) and (100) lattice planes of MnO2. The irregular structures and unclear lattice fringes of Mn7.5Bi1Ox (Fig. 3d and S12e) demonstrated their low crystallinity and abundant lattice defects, while the lattice fringes of MnO2 (100) in some places could be observed slightly. The SEM images and elemental mapping of Mn7.5Bi1Ox exhibited well-dispersed Bi over sphere MnO2 [33] (Fig. S13). The quantified surface Mn/Bi atom ratio was 9.97, slightly lower than the theoretical value (Table S5). The residual alkali metal (K, potassium) based on the quantified EDS spectrum on the Mn7.5Bi1Ox surface was considerably low (0.03 wt%). Moreover, residual K contents over MnO2 and Mn7.5Bi1Ox based on the ICP-OES results were determined to be 0.08 and 0.10 wt% (Table S2), the influence of which could be neglected under such low and similar contents [39]. For BiOx, the exposed lattice fringes (Fig. 3e) of 0.236, 0.317, and 0.390 nm agreed well with the interplanar distances of the (112), (012), and (020) facets of Bi2O3. And its visualized large grain size (Fig. S12c) was consistent with XRD results (grain size based on the Scherrer formula: ∼68.6 nm). 3.3 Surface chemical structure and adsorption properties of Bi-doped MnO2 Quasi in situ XPS analyses were performed to investigate the chemical states of Bi-doped MnO2 ( Fig. 4). The peaks in the Mn 2p3/2 spectra (Fig. 4a) at ∼641.8 eV belonged to Mn 2p3/2, which could be deconvoluted into peaks of Mn4+, Mn3+, and Mn2+, respectively [18,33]. The Mn3+/Mn4+ surface atomic ratios were calculated based on peak areas (Table S6), which followed the order of MnO2 (0.533) < Mn2.5Bi1Ox (0.838) < Mn15Bi1Ox (0.857) < Mn7.5Bi1Ox (1.185). It is generally accepted that the Mn3+/Mn4+ redox pairs are associated with the content of oxygen vacancies (OV) based on the electrostatic balance ( 2 Mn 4 + + O 2 − → 2 Mn 3 + + O V + 1 / 2 O 2 ) [40]. The average oxidation valences (AOS) of Mn were also calculated using the empirical formula ( AOS = 9.27 − 1.18 × Δ Ε ) based on the Mn 3 s multiple energy (ΔΕ) [33,41,42]. The ΔΕ of MnO2, Mn15Bi1Ox, Mn7.5Bi1Ox, and Mn2.5Bi1Ox were 5.02, 5.25, 5.43, and 5.30 eV, whose AOS were 3.34, 3.07, 2.86, and 3.01 (Fig. 4b and Table S6). Thus, Mn7.5Bi1Ox possessed the most unsaturated Mn atoms accompanied with abundant oxygen vacancy defects, which were attributed to Bi doping. The peaks of Bi 4 f spectra at ∼164.0 and ∼158.8 eV corresponded to the Bi 4f5/2 and Bi 4f7/2 with ∼5.3 eV gap (Fig. 4c), respectively. Pure Bi2O3 has peaks located at 163.8 and 158.4 eV in line with the literature [38,43]. With Bi doped into MnO2, the peaks shifted to 164.1 and 158.9 eV over Mn15Bi1Ox, while shifted by only ∼0.2 eV towards high binding energy over Mn7.5Bi1Ox and Mn2.5Bi1Ox, which could be attributed to the electron interaction between Bi and Mn [27] and the incorporation of Bi into the crystal lattice of MnO2 [44]. For the O 1 s spectrum (Fig. 4d), the peaks at ∼529.7 eV were assigned to the lattice oxygen species (Oα); the peaks at ∼531.5 eV were assigned to the surface adsorbed oxygen species (Oβ, including O-, O2 -, and O2 2-) and the peaks at ∼533.3 eV belonged to the surface adsorbed H2O (Oγ) [24,37,45,46]. The ratio of Oα over Bi-doped MnO2 followed the reverse-volcanic order of MnO2 (62.5 %) > Mn15Bi1Ox (60.8 %) > Mn7.5Bi1Ox (53.5 %) < Mn2.5Bi1Ox (59.7 %) with Bi content, while the ratio of Oβ (Table S6) followed the volcanic order of MnO2 (35.9 %) < Mn15Bi1Ox (37.7 %) < Mn7.5Bi1Ox (45.3 %) > Mn2.5Bi1Ox (39.5 %). Under the influence of Bi doping, the reduction of lattice oxygen species indicated the facile formation of surface oxygen vacancies, which in turn promoted O2 adsorption and activation to form active surface adsorbed oxygen species in the Air atmosphere [18,28–31,47]. Moreover, the ratio of surface adsorbed H2O (Oγ) exhibited a declining trend with Bi content, which followed the order of Mn2.5Bi1Ox (0.8 %) < Mn7.5Bi1Ox (1.2 %) < Mn15Bi1Ox (1.5 %) < MnO2 (1.6 %). Such low ratios were due to the pretreatment (in 30 mL·min−1 Ar flow at 200 °C for 1 h). O2-TPD ( Fig. 5a) was executed to investigate the mobility and content distribution of oxygen species. The desorption peaks were divided into three temperature ranges: i) below 200 °C, ii) 200–400 °C, and iii) above 400 °C, which were attributed to the desorption of i) physically adsorbed oxygen species, ii) chemically adsorbed oxygen species, and iii) lattice oxygen species, respectively [24,33]. It was worth mentioning that Bi2O3 had almost no desorption of oxygen species in line with the literature [29]. In comparison, the desorption peaks of oxygen species over MnO2 were located at 427 °C. With Bi doped into MnO2, the desorption temperature of oxygen species over Bi-doped MnO2 decreased to 404, 366, and 404 °C. The content of chemically adsorbed oxygen species (Table S6) followed the order of MnO2 (10.6 %) < Mn15Bi1Ox (14.1 %) < Mn7.5Bi1Ox (16.8 %) > Mn2.5Bi1Ox (15.6 %). In this sense, Mn7.5Bi1Ox possessed superior oxygen species mobility and rich chemically adsorbed oxygen species. Bi doping enhanced the favorable oxygen species mobility and facilitated the formation of oxygen vacancies over MnO2, which promoted O2 adsorption and activation and increased the content of reactive chemically adsorbed oxygen species, thereby promoting CH3OH oxidation [20,24,48]. H2-TPR (Fig. 5b) was carried out to evaluate the reducibility of catalysts. The peak temperature over MnO2 and BiOx were 248 and 480 °C [29,38,47]. Once the Bi atoms were doped into the MnO2, the reduction peak temperatures shifted to 223, 180, and 337 °C over Mn15Bi1Ox, Mn7.5Bi1Ox, and Mn2.5Bi1Ox, promoting the reducibility of the catalysts, which might be related to the reduced MnO2 particle sizes. CH3OH-TPD (Fig. 5c) was also performed with CH3OH and CO2 monitored to evaluate CH3OH desorption and reaction processes. The peaks for CH3OH desorption at ∼80 °C were ascribed to physically adsorbed CH3OH. The following peaks of CO2 corresponded to the oxidation of chemically adsorbed CH3OH by surface adsorbed oxygen species and lattice oxygen. The peak temperature for CO2 production followed the order of Mn7.5Bi1Ox (146 °C) < Mn2.5Bi1Ox (153 °C) < Mn15Bi1Ox (157 °C) < MnO2 (169 °C) < BiOx (305 °C), which was in line with their catalytic activities towards CH3OH oxidation. 3.4 Structure-activity relationship of Bi-doped MnO2 during CH3OH oxidation In situ DRIFT experiments were conducted over MnO2, BiOx, and Mn7.5Bi1Ox to get insight into the role of Bi doping during CH3OH oxidation ( Fig. 6). The catalysts were pretreated with Ar (30 mL·min−1) at 200 °C for 1 h and cooled to 15 °C to record the background. Then, reactants (1 %CH3OH/10 %O2/40 %N2/Ar, 30 mL·min−1) were introduced into the cell. After the adsorption saturation of reactants, the spectra were recorded in reactants with elevated temperature at a rate of 5 °C·min−1. The assignments of the vibration characteristic peaks are enumerated in Table S7 based on the literature [18,33,49–54]. The peaks at 3500–3700 and 1610–1640 cm−1 might be ascribed to hydroxyl species (-OH). The bands at ∼2926 and ∼2820 cm−1 belong to νas(C-H) and νs(C-H) of the methoxy species (-OCH3). The features at ∼1030 cm−1 can be assigned to ν(C-O) mode of the methoxy species (-OCH3). The characteristic peaks at ∼1590 and ∼1310 cm−1 correspond to νas(-OCO) and νs(-OCO) of formate species, respectively. The peaks at ∼2170 and ∼2110 cm−1 belong to CO. Two peaks at ∼2360 and ∼2320 cm−1 might be identified as CO2. To visualize the evolution of the species, the infrared absorption peaks of the species were integrated and the evolution of the peak area with temperature was plotted (Fig. 6b,d,f,h). The CH3OH oxidation reactants adsorbed on MnO2 at 15 °C (Fig. 6a,b) resulted in the observed peaks at 2926, 2820, and 1030 cm⁻¹ corresponding to the methoxy species [55]. As the temperature increased, the intensity of formate species (νas(-OCO) at 1580 cm−1) gradually enhanced from 50 °C and reached a maximum at 175 °C [52]. CO₂ peaks at 2361 and 2320 cm⁻¹ were observed from 175 °C [56], illustrating the further oxidation of formate species. For the BiOx catalysts, methoxy species were observed upon saturated adsorption of reactants (Fig. 6c,d). The intensity of formate species (νas(-OCO) at 1580 cm−1) started to enhance from 100 °C and reached a maximum at 215 °C [52]. CO2 started to appear from the oxidation of formate species at 250 °C. For Mn7.5Bi1Ox, the formate species emerged at 50 °C, reaching the maximum at 150 °C, and further started to be oxidized to CO2 and H2O simultaneously (Fig. 6e,f). It is widely recognized that formate is the key intermediate during CH3OH oxidation, and its generation from methoxy species and further conversion are important [53,54]. Comparatively, the temperature of the maximum formate species peak areas followed the order of Mn7.5Bi1Ox (150 °C) < MnO2 (175 °C) < BiOx (215 °C) and the onset temperature of enhanced CO2 peaks also followed the same order of Mn7.5Bi1Ox (150 °C) < MnO2 (175 °C) < BiOx (250 °C), demonstrating that two oxidation processes were accelerated over Bi-doped MnO2 due to surface reactive oxygen species. Furthermore, a few studies have shown the presence of CO during CH3OH oxidation [18,51]. CO peaks (at 2170 and 2110 cm−1) were barely observed in the spectra. CH3OH Cracking was also carried out over Mn7.5Bi1Ox (Fig. S14). It was found that CO did not begin to slightly produce until 260 °C. In this sense, formate species could be directly oxidized to CO2 and H2O, rather than decomposing to H2O and CO, which was then oxidized to CO2. Based on the above results, a probable mechanism of CH3OH oxidation is proposed, following the pathway: CH3OH → methoxy species → formate species → CO2 and H2O, which is consistent with the literature [54,57,58]. H2O molecules have been reported to promote CH3OH oxidation [50,59]. Two functions of hydroxyl species were reported in the literature: i) the hydroxyl species assisted CH3OH chemisorption via hydrogen bonding [18,55,58]; ii) the hydroxyl species assisted C-H activation of methoxy species with surface reactive oxygen species [50,60]. To reveal the effect of hydroxyl species, the Mn7.5Bi1Ox was pretreated with Ar (30 mL·min−1) at 200 °C for 1 h and cooled to room temperature. And then, 1 %CH3OH/Ar was introduced for full adsorption. Finally, in situ DRIFTS were recorded for CH3OH desorption at room temperature with Ar (30 mL·min−1) purging (Fig. S15). The peaks of methoxy species (at 2926, 2820, and 1030 cm−1) gradually diminished, accompanied with enhanced peaks of hydroxyl species (3500–3700 cm−1) within 20 mins, which demonstrated that the CH3OH adsorption was related to the hydroxyl species. Moreover, in situ DRIFTS of CH3OH oxidation with H2O addition over Mn7.5Bi1Ox were performed (Fig. 6g,h). After the same pretreatment, the reactants with H2O (3 vol%) were constantly introduced and the spectra were recorded at elevated temperature (5 °C·min−1). The peaks (-OH) from H2O hydrolysis (at ∼3500 and ∼1640 cm−1) significantly appeared at 15 °C and gradually faded away with temperature increasing, illustrating the participation of -OH in CH3OH oxidation. The whole reaction mechanism did not change much; it still evolved from CH3OH to methoxy species, subsequently to formate species, and ultimately to CO2 and H2O. However, the production of formate species sharply sped up from 50 °C and reached the maximum at 140 °C, lower than that (150 °C) during dry CH3OH oxidation. The hydroxyl species could take part in CH3OH chemisorption and the C-H activation of methoxy species, the oxidation of which was subsequently accelerated into formate species by surrounding reactive oxygen species [18,50,58]. Based on the above studies, the structure-activity relationship of MnO2 with the addition of Bi towards CH3OH oxidation can be established. In our study, the T50 (the temperature at which 50 %CH3OH converted) of BiOx towards CH3OH oxidation was 300 °C (Fig. S4), much higher than MnO2 (165 °C) and Mn7.5Bi1Ox (147 °C) (Fig. 1a). In the XRD pattern of Mn7.5Bi1Ox, the peaks of BiOx (Bi2O3) and MnO2 could be observed simultaneously (Fig. 3b). However, the worst activity, weak oxygen and methanol desorption peaks over BiOx (Figs. 5a and 5c), indicated that the contribution from the synergistic effect of BiOx and MnO2 to CH3OH oxidation was weak or even negligible. Bi doping promoted CH3OH oxidation mainly by the Bi entering into the lattice of MnO2, leading to changes in lattice structure, surface chemical structure, and redox properties. Moreover, the synergistic effect of Bi and Mn ions in MnBiOx solid solutions was possible to exist, and it was worth further systematic studies to elucidate this mechanism. With Bi doped into MnO2 (the downshifted peaks), Bi primarily enters the lattice of MnO2, leading to the expansion of lattice spacing and a decrease in crystallinity (XRD and TEM results). As a result, the Mn7.5Bi1Ox catalyst contains abundant lattice defects in the form of oxygen vacancies. Such a structure with plenty of Mn3+/Mn4+ redox pairs shows more active surface adsorbed oxygen species (O2-TPD and CH3OH-TPD results), and consequently, reveals much improved catalytic performance towards CH3OH oxidation as compared to the unpromoted MnO2 catalyst. Furthermore, the dominant role of the surface area in improved activity was also excluded by the observation that MnO2 with the largest specific surface area presented the lowest specific reaction rate. The CH3OH oxidation mechanism is that CH3OH molecules adsorbed over the catalysts deprotonate to methoxy species, which are oxidized to formate species by surface reactive oxygen species located at oxygen vacancies. The resultant formate species are further oxidized by surface reactive oxygen species to CO2 and H2O. The exposed vacancies are replenished by gaseous O2 dissociation. Bi doping accelerates two oxidation steps by reactive oxygen species on oxygen vacancies. Jiang et al. [53] emphasized the importance of CH3OH and O2 adsorption during CH3OH oxidation over Pt1-Co3O4 by combining experiments and DFT calculations. To study the role of O2 during CH3OH oxidation, in situ CH3OH-TPD-DRIFTS was performed over MnO2 and Mn7.5Bi1Ox ( Fig. 7). The catalysts were pretreated in Ar at 200 °C for 1 h and then cooled to 15 °C to record the background. Afterward, 30 mL·min−1 of 1 %CH3OH/Ar was fed to the cell for 1 h. The catalysts were then heated to 300 °C at a rate of 5 °C·min−1 in Ar flow with the spectra recorded. For MnO2, the formate species increased slowly, and the maximum peak temperature shifted from 175 °C (with O2) to 182 °C (without O2). Due to the lack of gaseous O2 replenishment, it was difficult to observe CO2 originating from the deep oxidation of formate species. For Mn7.5Bi1Ox, the maximum peak of formate species slightly shifted from 150 °C (with O2) to 154 °C (without O2). Since there was no timely replenishment of gaseous O2, the oxidation of formate species to CO2 became slow as well, even with abundant surface reactive oxygen species. The replenishment and dissociation of O2 on oxygen vacancies were equally essential for the formation of surface reactive oxygen species, which were also emphasized in the literature [18,53,56,57]. In brief, the promotion mechanism of Bi-doped MnO2 is the formation of oxygen vacancies induced by Bi-doping, which facilitates the O2 adsorption and dissociation into active surface adsorbed oxygen species, accelerating the oxidation processes of methoxy species to formate species and formate species to CO2 and H2O. 4 Conclusions In summary, multiple Bi-doped MnO2 catalysts were synthesized and systematically investigated to reveal the structure-activity relationship of Bi doping towards catalytic CH3OH oxidation. Bi doping induces a decrease in crystallinity and lattice expansion of MnO2. Meanwhile, abundant Mn3+/Mn4+ redox pairs and unsaturated Mn emerge, accompanied with oxygen vacancies due to Bi doping, which are conducive to adsorbing and activating O2 to generate more active surface adsorbed oxygen species. During CH3OH oxidation, the oxidation processes from methoxy species to formate species and from formate species to CO2 and H2O over Bi-doped MnO2 are significantly expedited due to the rich and active surface oxygen species. It is worth mentioning that H2O molecules can, to some extent, facilitate CH3OH oxidation via hydroxyl-assisted CH3OH chemisorption and hydroxyl-assisted C-H activation of methoxy species with surface reactive oxygen species. The findings in this work have the potential to deepen the understanding and guide the design of catalysts with rich oxygen vacancies via metal doping methods for catalytic oxidation. CRediT authorship contribution statement Yi-Fan Han: Supervision, Resources, Project administration. Minghui Zhu: Writing – review & editing, Supervision, Resources, Project administration, Funding acquisition. Qihang Wen: Methodology, Investigation, Data curation. Suxin Yu: Writing – original draft, Methodology, Investigation, Data curation, Conceptualization. Haoyuan Gu: Methodology, Investigation, Data curation. Declaration of Competing Interest The authors declare that they have no known competing financial interests or personal relationships that could have appeared to influence the work reported in this paper. Acknowledgements This work was supported by the National Key Research and Development Program of China (2022YFB3805504), Shanghai Pilot Program for Basic Research (22TQ1400100–7), the Basic Research Program of Science and Technology Commission of Shanghai Municipality (22JC1400600), and the Fundamental Research Funds for the Central Universities. Appendix A Supporting information Supplementary data associated with this article can be found in the online version at doi:10.1016/j.apcata.2025.120402. Appendix A Supplementary material Supplementary material References [1] M. Hakim Y.Y. Broza O. Barash N. Peled M. Phillips A. Amann H. Haick Volatile organic compounds of lung cancer and possible biochemical pathways Chem. Rev. 112 2012 5949 5966 M. Hakim, Y.Y. Broza, O. Barash, N. Peled, M. Phillips, A. Amann, H. Haick, Volatile organic compounds of lung cancer and possible biochemical pathways, Chem. Rev., 112 (2012) 5949-5966. [2] C. He J. Cheng X. Zhang M. Douthwaite S. Pattisson Z. Hao Recent advances in the catalytic oxidation of volatile organic compounds: a review based on pollutant sorts and sources Chem. Rev. 119 2019 4471 4568 C. He, J. Cheng, X. Zhang, M. Douthwaite, S. Pattisson, Z. Hao, Recent advances in the catalytic oxidation of volatile organic compounds: A review based on pollutant sorts and sources, Chem. Rev., 119 (2019) 4471-4568. [3] C. Yang G. Miao Y. Pi Q. Xia J. Wu Z. Li J. Xiao Abatement of various types of VOCs by adsorption/catalytic oxidation: a review Chem. Eng. J. 370 2019 1128 1153 C. Yang, G. Miao, Y. Pi, Q. Xia, J. Wu, Z. Li, J. Xiao, Abatement of various types of VOCs by adsorption/catalytic oxidation: A review, Chem. Eng. J., 370 (2019) 1128-1153. [4] S.H. Zhang J.P. You C. Kennes Z.W. Cheng J.X. Ye D.Z. Chen J.M. Chen L.D. Wang Current advances of VOCs degradation by bioelectrochemical systems: a review Chem. Eng. J. 334 2018 2625 2637 S.H. Zhang, J.P. You, C. Kennes, Z.W. Cheng, J.X. Ye, D.Z. Chen, J.M. Chen, L.D. Wang, Current advances of VOCs degradation by bioelectrochemical systems: A review, Chem. Eng. J., 334 (2018) 2625-2637. [5] X. Mao W.Z. Li Y. Yuan L.W. Yang Numerical analysis of methanol steam reforming reactor heated by catalytic combustion for hydrogen production Int. J. Hydrog. Energy 47 2022 14469 14482 X. Mao, W.Z. Li, Y. Yuan, L.W. Yang, Numerical analysis of methanol steam reforming reactor heated by catalytic combustion for hydrogen production, Int. J. Hydrogen Energy, 47 (2022) 14469-14482. [6] T.Q. Zheng W. Zhou Y.F. Yang Y.C. Zhong H.H. You X.Y. Li X.Y. Chu K.S. Hui W.H. Ding Novel nickel foam with multiple microchannels as combustion reaction support for the self-heating methanol steam reforming microreactor Energy Fuels 35 2021 2815 2825 T.Q. Zheng, W. Zhou, Y.F. Yang, Y.C. Zhong, H.H. You, X.Y. Li, X.Y. Chu, K.S. Hui, W.H. Ding, Novel nickel foam with multiple microchannels as combustion reaction support for the self-heating methanol steam reforming microreactor, Energy Fuels, 35 (2021) 2815-2825. [7] J. Lou S. Huang Treatment of gaseous toluene using a regenerative catalytic oxidizer over supported copper oxide catalysts Environ. Eng. Sci. 26 2009 579 588 J. Lou, S. Huang, Treatment of gaseous toluene using a regenerative catalytic oxidizer over supported copper oxide catalysts, Environ. Eng. Sci., 26 (2009) 579-588. [8] G. Sivakumar R. Kumar V. Yadav V. Gupta E. Balaraman Multi-functionality of methanol in sustainable catalysis: beyond methanol economy ACS Catal. 13 2023 15013 15053 G. Sivakumar, R. Kumar, V. Yadav, V. Gupta, E. Balaraman, Multi-functionality of methanol in sustainable catalysis: Beyond methanol economy, ACS Catal., 13 (2023) 15013-15053. [9] A.K. Datye M. Votsmeier Opportunities and challenges in the development of advanced materials for emission control catalysts Nat. Mater. 20 2021 1049 1059 A.K. Datye, M. Votsmeier, Opportunities and challenges in the development of advanced materials for emission control catalysts, Nat. Mater., 20 (2021) 1049-1059. [10] L.R. Merte M. Ahmadi F. Behafarid L.K. Ono E. Lira J. Matos L. Li J.C. Yang B. Roldan Cuenya Correlating catalytic methanol oxidation with the structure and oxidation state of size-selected pt nanoparticles ACS Catal. 3 2013 1460 1468 L.R. Merte, M. Ahmadi, F. Behafarid, L.K. Ono, E. Lira, J. Matos, L. Li, J.C. Yang, B. Roldan Cuenya, Correlating catalytic methanol oxidation with the structure and oxidation state of size-selected Pt nanoparticles, ACS Catal., 3 (2013) 1460-1468. [11] M. Jablonska A. Krol E. Kukulska-Zajac K. Tarach V. Girman L. Chmielarz K. Gora-Marek Zeolites y modified with palladium as effective catalysts for low-temperature methanol incineration Appl. Catal. B 166 2015 353 365 M. Jablonska, A. Krol, E. Kukulska-Zajac, K. Tarach, V. Girman, L. Chmielarz, K. Gora-Marek, Zeolites Y modified with palladium as effective catalysts for low-temperature methanol incineration, Appl. Catal., B, 166 (2015) 353-365. [12] L.A. Calzada S.E. Collins C.W. Han V. Ortalan R. Zanella Synergetic effect of bimetallic Au-Ru/TiO2 catalysts for complete oxidation of methanol Appl. Catal. B 207 2017 79 92 L.A. Calzada, S.E. Collins, C.W. Han, V. Ortalan, R. Zanella, Synergetic effect of bimetallic Au-Ru/TiO2 catalysts for complete oxidation of methanol, Appl. Catal., B, 207 (2017) 79-92. [13] K. Kähler M.C. Holz M. Rohe A.C. van Veen M. Muhler Methanol oxidation as probe reaction for active sites in Au/ZnO and Au/TiO2 catalysts J. Catal. 299 2013 162 170 K. Kähler, M.C. Holz, M. Rohe, A.C. van Veen, M. Muhler, Methanol oxidation as probe reaction for active sites in Au/ZnO and Au/TiO2 catalysts, J. Catal., 299 (2013) 162-170. [14] H.J. Zhao J.Z. Song X.F. Song Z. Yan H.B. Zeng Ag/White graphene foam for catalytic oxidation of methanol with high efficiency and stability J. Mater. Chem. A 3 2015 6679 6684 H.J. Zhao, J.Z. Song, X.F. Song, Z. Yan, H.B. Zeng, Ag/white graphene foam for catalytic oxidation of methanol with high efficiency and stability, J. Mater. Chem. A, 3 (2015) 6679-6684. [15] Z. Shi W. Li X. Wen X. Wang E. Ren D. Mo Effect of organic reagents on the phase structure of MnOx porous nanospheres: catalytic oxidation of methanol at low temperatures Catal. Lett. 153 2022 2482 2492 Z. Shi, W. Li, X. Wen, X. Wang, E. Ren, D. Mo, Effect of organic reagents on the phase structure of MnOx porous nanospheres: Catalytic oxidation of methanol at low temperatures, Catal. Lett., 153 (2022) 2482-2492. [16] R. Dziembaj A. Chojnacka Z. Piwowarska M. Gajewska M. Świętosławski S. Górecka M. Molenda Comparative study of Co-rich and Ce-rich oxide nanocatalysts (CoxCe1−xOy) for low-temperature total oxidation of methanol Catal. Today 333 2019 196 207 R. Dziembaj, A. Chojnacka, Z. Piwowarska, M. Gajewska, M. Świętosławski, S. Górecka, M. Molenda, Comparative study of Co-rich and Ce-rich oxide nanocatalysts (CoxCe1−xOy) for low-temperature total oxidation of methanol, Catal. Today, 333 (2019) 196-207. [17] R. Dziembaj M. Molenda L. Chmielarz M.M. Zaitz Z. Piwowarska A. Rafalska-Lasocha Optimization of cu doped ceria nanoparticles as catalysts for low-temperature methanol and ethylene total oxidation Catal. Today 169 2011 112 117 R. Dziembaj, M. Molenda, L. Chmielarz, M.M. Zaitz, Z. Piwowarska, A. Rafalska-Lasocha, Optimization of Cu doped ceria nanoparticles as catalysts for low-temperature methanol and ethylene total oxidation, Catal. Today, 169 (2011) 112-117. [18] C. Wu Z. Fan D. Lu X. Wu Y. Du X. Guo Insight into the contribution of cerium oxide to MnOx/CeO2 in methanol oxidation reaction: perspective from the crystal facet of CeO2 ChemCatChem 14 2022 e202200159 C. Wu, Z. Fan, D. Lu, X. Wu, Y. Du, X. Guo, Insight into the contribution of cerium oxide to MnOx/CeO2 in methanol oxidation reaction: Perspective from the crystal facet of CeO2, ChemCatChem, 14 (2022) e202200159. [19] W. Li X. Wen X. Wang J. Li E. Ren Z. Shi C. Liu D. Mo S. Mo Oriented growth of δ-MnO2 nanosheets over core-shell Mn2O3@δ-MnO2 catalysts: an interface-engineered effects for enhanced low-temperature methanol oxidation Mol. Catal. 514 2021 111847 W. Li, X. Wen, X. Wang, J. Li, E. Ren, Z. Shi, C. Liu, D. Mo, S. Mo, Oriented growth of δ-MnO2 nanosheets over core-shell Mn2O3@δ-MnO2 catalysts: An interface-engineered effects for enhanced low-temperature methanol oxidation, Mol. Catal., 514 (2021) 111847. [20] R. Yang Z. Guo L. Cai R. Zhu Y. Fan Y. Zhang P. Han W. Zhang X. Zhu Q. Zhao Z. Zhu C.K. Chan Z. Zeng Investigation into the phase–activity relationship of MnO2 nanomaterials toward ozone-assisted catalytic oxidation of toluene Small 17 2021 e2103052 R. Yang, Z. Guo, L. Cai, R. Zhu, Y. Fan, Y. Zhang, P. Han, W. Zhang, X. Zhu, Q. Zhao, Z. Zhu, C.K. Chan, Z. Zeng, Investigation into the phase–activity relationship of MnO2 nanomaterials toward ozone-assisted catalytic oxidation of toluene, Small, 17 (2021) e2103052. [21] W. Wang R. Qiu C. Li R. Zhong H. Wang J. Qi Advancing catalytic oxidation of lean methane over cobalt-manganese oxide via a phase-engineered amorphous/crystalline interface Chem. Commun. 60 2024 8896 8899 W. Wang, R. Qiu, C. Li, R. Zhong, H. Wang, J. Qi, Advancing catalytic oxidation of lean methane over cobalt-manganese oxide via a phase-engineered amorphous/crystalline interface, Chem. Commun., 60 (2024) 8896-8899. [22] Y. Jiang S.Y. Cheng C.C. Su Y.S. Jiang X. Sun G.M. Zhang Y.N. Liu X. Dou Z.D. Yang Bimetallic Mn-Cu oxide catalysts for toluene oxidation: synergistic effect and catalytic mechanism Appl. Surf. Sci. 670 2024 160629 Y. Jiang, S.Y. Cheng, C.C. Su, Y.S. Jiang, X. Sun, G.M. Zhang, Y.N. Liu, X. Dou, Z.D. Yang, Bimetallic Mn-Cu oxide catalysts for toluene oxidation: Synergistic effect and catalytic mechanism, Appl. Surf. Sci., 670 (2024) 160629. [23] R. Yang Y. Fan R. Ye Y. Tang X. Cao Z. Yin Z. Zeng MnO2-based materials for environmental applications Adv. Mater. 33 2021 e2004862 R. Yang, Y. Fan, R. Ye, Y. Tang, X. Cao, Z. Yin, Z. Zeng, MnO2-based materials for environmental applications, Adv. Mater., 33 (2021) e2004862. [24] W. Yang Za Su Z. Xu W. Yang Y. Peng J. Li Comparative study of α-, β-, γ- and δ-MnO2 on toluene oxidation: oxygen vacancies and reaction intermediates Appl. Catal. B 260 2020 118150 W. Yang, Za Su, Z. Xu, W. Yang, Y. Peng, J. Li, Comparative study of α-, β-, γ- and δ-MnO2 on toluene oxidation: Oxygen vacancies and reaction intermediates, Appl. Catal., B, 260 (2020) 118150. [25] G. Aksaray M.E. Mert B. Doğru Mert G. Kardaş Catalytic insights into methanol electrooxidation on ni foam modified with Bi2O3 - acetylene black-rGO: synthesis, characterization, and performance evaluation Int. J. Hydrog. Energy 75 2024 38 46 G. Aksaray, M.E. Mert, B. Doğru Mert, G. Kardaş, Catalytic insights into methanol electrooxidation on Ni foam modified with Bi2O3 - acetylene black-rGO: Synthesis, characterization, and performance evaluation, Int. J. Hydrogen Energy, 75 (2024) 38-46. [26] Y. Gao Z. Zhan L. Guo Z. Li S. Cai X. Wang M. Li Y. Xie W. Zhou Visual location of oxygen vacancies on bismuth titanate nanosheets with periodic quantum well and promoting H2O2 photosynthesis Small 21 2025 e2410883 Y. Gao, Z. Zhan, L. Guo, Z. Li, S. Cai, X. Wang, M. Li, Y. Xie, W. Zhou, Visual location of oxygen vacancies on bismuth titanate nanosheets with periodic quantum well and promoting H2O2 photosynthesis, Small, 21 (2025) e2410883. [27] Y. Lou Q. Wu J. Shen N.J. Divins J. Llorca Y. Guo W. Zhan A. Wang L. Wang Y. Guo Bismuth boosts the preferential oxidation of CO over Pt/Al2O3 by regulating the reactant adsorption and reaction route Chem. Eng. J. 505 2025 159751 Y. Lou, Q. Wu, J. Shen, N.J. Divins, J. Llorca, Y. Guo, W. Zhan, A. Wang, L. Wang, Y. Guo, Bismuth boosts the preferential oxidation of CO over Pt/Al2O3 by regulating the reactant adsorption and reaction route, Chem. Eng. J., 505 (2025) 159751. [28] Z. Shang M. Sun S.M. Chang X. Che X.M. Cao L. Wang Y. Guo W.C. Zhan Y.L. Guo G.Z. Lu Activity and stability of Co3O4-based catalysts for soot oxidation: the enhanced effect of Bi2O3 on activation and transfer of oxygen Appl. Catal. B 209 2017 33 44 Z. Shang, M. Sun, S.M. Chang, X. Che, X.M. Cao, L. Wang, Y. Guo, W.C. Zhan, Y.L. Guo, G.Z. Lu, Activity and stability of Co3O4-based catalysts for soot oxidation: The enhanced effect of Bi2O3 on activation and transfer of oxygen, Appl. Catal., B, 209 (2017) 33-44. [29] Y. Xie C. Zhang D. Wang J. Lu Y. Wang J. Wang L. Zhang R. Zhang Catalytic performance of a Bi2O3–Fe2O3 system in soot combustion New. J. Chem. 43 2019 15368 15374 Y. Xie, C. Zhang, D. Wang, J. Lu, Y. Wang, J. Wang, L. Zhang, R. Zhang, Catalytic performance of a Bi2O3–Fe2O3 system in soot combustion, New. J. Chem., 43 (2019) 15368-15374. [30] Y. Yang L. Xing W. Ren D. Zhao S. Jian C. Cao C. Wang Y. Tian X. Yu X. Li Oxygen activation through β-Bi2O3 and ultrafine CeO2 interactions to promote catalytic soot combustion Ind. Eng. Chem. Res. 58 2019 22006 22014 Y. Yang, L. Xing, W. Ren, D. Zhao, S. Jian, C. Cao, C. Wang, Y. Tian, X. Yu, X. Li, Oxygen activation through β-Bi2O3 and ultrafine CeO2 interactions to promote catalytic soot combustion, Ind. Eng. Chem. Res., 58 (2019) 22006-22014. [31] B. Cui Y. Li S. Li Y. Xia Z. Zheng Y.-Q. Liu Bi-doped ceria as a highly efficient catalyst for soot combustion: improved mobility of lattice oxygen in CexBi1–xOy catalysts Energy Fuels 34 2020 9932 9939 B. Cui, Y. Li, S. Li, Y. Xia, Z. Zheng, Y.-Q. Liu, Bi-doped ceria as a highly efficient catalyst for soot combustion: Improved mobility of lattice oxygen in CexBi1–xOy catalysts, Energy Fuels, 34 (2020) 9932-9939. [32] D. Li S. Jin Z. Wang Z. Jiang F. Xiong J. Wang M. Zhu Revealing the gas sensitive stability of formate species during CO2 hydrogenation Catal. Sci. Technol. 13 2023 3226 3230 D. Li, S. Jin, Z. Wang, Z. Jiang, F. Xiong, J. Wang, M. Zhu, Revealing the gas sensitive stability of formate species during CO2 hydrogenation, Catal. Sci. Technol., 13 (2023) 3226-3230. [33] F.-X. Tian M. Zhu X. Liu W. Tu Y.-F. Han Dynamic structure of highly disordered manganese oxide catalysts for low-temperature CO oxidation J. Catal. 401 2021 115 128 F.-X. Tian, M. Zhu, X. Liu, W. Tu, Y.-F. Han, Dynamic structure of highly disordered manganese oxide catalysts for low-temperature CO oxidation, J. Catal., 401 (2021) 115-128. [34] J.W. Park J.H. Jeong W.L. Yoon Y.W. Rhee Selective oxidation of carbon monoxide in hydrogen-rich stream over Cu-Ce/γ-Al2O3 catalysts promoted with cobalt in a fuel processor for proton exchange membrane fuel cells J. Power Sources 132 2004 18 28 J.W. Park, J.H. Jeong, W.L. Yoon, Y.W. Rhee, Selective oxidation of carbon monoxide in hydrogen-rich stream over Cu-Ce/γ-Al2O3 catalysts promoted with cobalt in a fuel processor for proton exchange membrane fuel cells, J. Power Sources, 132 (2004) 18-28. [35] M. Thommes K. Kaneko A.V. Neimark J.P. Olivier F. Rodriguez-Reinoso J. Rouquerol K.S.W. Sing Physisorption of gases, with special reference to the evaluation of surface area and pore size distribution (IUPAC Technical Report) Pure Appl. Chem. 87 2015 1051 1069 M. Thommes, K. Kaneko, A.V. Neimark, J.P. Olivier, F. Rodriguez-Reinoso, J. Rouquerol, K.S.W. Sing, Physisorption of gases, with special reference to the evaluation of surface area and pore size distribution (IUPAC Technical Report), Pure Appl. Chem., 87 (2015) 1051-1069. [36] B. Gao F.K. Bi Z.X. Zhou Y.F. Zhang J.F. Wei X.T. Lv B.L. Liu Y.D. Huang X.D. Zhang A bimetallic MOF-derived MnCo spinel oxide catalyst to enhance toluene catalytic degradation Chem. Commun. 60 2024 7455 7458 B. Gao, F.K. Bi, Z.X. Zhou, Y.F. Zhang, J.F. Wei, X.T. Lv, B.L. Liu, Y.D. Huang, X.D. Zhang, A bimetallic MOF-derived MnCo spinel oxide catalyst to enhance toluene catalytic degradation, Chem. Commun., 60 (2024) 7455-7458. [37] Y. Liu P. Zhang J. Zhan L. Liu Heat treatment of MnCO3: an easy way to obtain efficient and stable MnO2 for humid O3 decomposition Appl. Surf. Sci. 463 2019 374 385 Y. Liu, P. Zhang, J. Zhan, L. Liu, Heat treatment of MnCO3: An easy way to obtain efficient and stable MnO2 for humid O3 decomposition, Appl. Surf. Sci., 463 (2019) 374-385. [38] C. Li J. Wang W. Dai C. Zhang Bismuth manganese catalysts for soot oxidation in siesel engine exhaust: effect of preparation methods on active oxygen species ChemistrySelect 8 2023 e202203167 C. Li, J. Wang, W. Dai, C. Zhang, Bismuth manganese catalysts for soot oxidation in siesel engine exhaust: Effect of preparation methods on active oxygen species, ChemistrySelect, 8 (2023) e202203167. [39] J. Li S. Yuan Qf Bo B. Zhang H. Chen Performance of Fe-Mo catalysts with Li/Na/K promoters for methanol oxidation to formaldehyde ChemCatChem 17 2025 e202401951 J. Li, S. Yuan, Qf Bo, B. Zhang, H. Chen, Performance of Fe-Mo catalysts with Li/Na/K promoters for methanol oxidation to formaldehyde, ChemCatChem, 17 (2025) e202401951. [40] F. Wang H. Dai J. Deng G. Bai K. Ji Y. Liu Manganese oxides with rod-, wire-, tube-, and flower-like morphologies: highly effective catalysts for the removal of toluene Environ. Sci. Technol. 46 2012 4034 4041 F. Wang, H. Dai, J. Deng, G. Bai, K. Ji, Y. Liu, Manganese oxides with rod-, wire-, tube-, and flower-like morphologies: Highly effective catalysts for the removal of toluene, ‌Environ. Sci. Technol., 46 (2012) 4034-4041. [41] Y. Liu H. Zhou R. Cao X. Liu P. Zhang J. Zhan L. Liu Facile and green synthetic strategy of birnessite-type MnO2 with high efficiency for airborne benzene removal at low temperatures Appl. Catal. B 245 2019 569 582 Y. Liu, H. Zhou, R. Cao, X. Liu, P. Zhang, J. Zhan, L. Liu, Facile and green synthetic strategy of birnessite-type MnO2 with high efficiency for airborne benzene removal at low temperatures, Appl. Catal., B, 245 (2019) 569-582. [42] T. Gao P. Norby F. Krumeich H. Okamoto R. Nesper H. Fjellvåg Synthesis and properties of layered-structured Mn5O8 nanorods J. Phys. Chem. C. 114 2009 922 928 T. Gao, P. Norby, F. Krumeich, H. Okamoto, R. Nesper, H. Fjellvåg, Synthesis and properties of layered-structured Mn5O8 nanorods, J. Phys. Chem. C, 114 (2009) 922-928. [43] S. Tian I.A. Bello J. Peng H. Ren Q. Ma M. Zhu K. Li H. Wang J. Wu G. Zhu Fabricating Mn3O4/β-Bi2O3 heterojunction microspheres with enhanced photocatalytic activity for organic pollutants degradation and NO removal J. Alloy. Compd. 854 2021 157223 S. Tian, I.A. Bello, J. Peng, H. Ren, Q. Ma, M. Zhu, K. Li, H. Wang, J. Wu, G. Zhu, Fabricating Mn3O4/β-Bi2O3 heterojunction microspheres with enhanced photocatalytic activity for organic pollutants degradation and NO removal, J. Alloys Compd., 854 (2021) 157223. [44] W. Wang G. Xing X. Li S. Han Z. Xu L. Qi Synergistic catalytic enhancement of chemical oxygen demand removal using Mn-Bi doped submicron Fly ash carrier: mechanistic insights and environmental adaptability Sep. Purif. Technol. 354 2025 129203 W. Wang, G. Xing, X. Li, S. Han, Z. Xu, L. Qi, Synergistic catalytic enhancement of chemical oxygen demand removal using Mn-Bi doped submicron fly ash carrier: Mechanistic insights and environmental adaptability, Sep. Purif. Technol., 354 (2025) 129203. [45] Y. Zhang J. Wang M. Niu J. Tang Z. Chen C. Wan Q. Ke Surface adsorbed–H2O promoted aerobic oxidation of biomass–derived alcohols on MnO catalysts Chem. Eng. J. 490 2024 151721 Y. Zhang, J. Wang, M. Niu, J. Tang, Z. Chen, C. Wan, Q. Ke, Surface adsorbed–H2O promoted aerobic oxidation of biomass–derived alcohols on MnO catalysts, Chem. Eng. J., 490 (2024) 151721. [46] J. Tang J. Chen Z. Zhang Q. Ma X. Hu P. Li Z. Liu P. Cui C. Wan Q. Ke L. Fu J. Kim T. Hamada Y. Kang Y. Yamauchi Spontaneous generation of singlet oxygen on microemulsion-derived manganese oxides with rich oxygen vacancies for efficient aerobic oxidation Chem. Sci. 14 2023 13402 13409 J. Tang, J. Chen, Z. Zhang, Q. Ma, X. Hu, P. Li, Z. Liu, P. Cui, C. Wan, Q. Ke, L. Fu, J. Kim, T. Hamada, Y. Kang, Y. Yamauchi, Spontaneous generation of singlet oxygen on microemulsion-derived manganese oxides with rich oxygen vacancies for efficient aerobic oxidation, Chem. Sci., 14 (2023) 13402-13409. [47] Y. Lou L. Wang Y. Zhang Z. Zhao Z. Zhang G. Lu Y. Guo The effects of Bi2O3 on the CO oxidation over Co3O4 Catal. Today 175 2011 610 614 Y. Lou, L. Wang, Y. Zhang, Z. Zhao, Z. Zhang, G. Lu, Y. Guo, The effects of Bi2O3 on the CO oxidation over Co3O4, Catal. Today, 175 (2011) 610-614. [48] Y. Yao W. Yang X. Zhang X. Zhu J. Cheng J. Zhou Kinetics of catalytic oxidation of oxygenated fuels on Pt/ZSM-5 catalyst Combust. Theory Model. 26 2022 728 745 Y. Yao, W. Yang, X. Zhang, X. Zhu, J. Cheng, J. Zhou, Kinetics of catalytic oxidation of oxygenated fuels on Pt/ZSM-5 catalyst, Combust. Theory Modell., 26 (2022) 728-745. [49] S. Sinha Majumdar M.M. Rahman J.A. Pihl Reactivity of net-zero carbon alcohol fuels and their corresponding aldehyde intermediates on PGM-based commercial oxidation catalysts for lean-burn emissions control Chem. Eng. J. 503 2025 158490 S. Sinha Majumdar, M.M. Rahman, J.A. Pihl, Reactivity of net-zero carbon alcohol fuels and their corresponding aldehyde intermediates on PGM-based commercial oxidation catalysts for lean-burn emissions control, Chem. Eng. J., 503 (2025) 158490. [50] N.S. Sapienza K.N. Knight M. Albrahim M.R. Yousuf A.M. Karim J.R. Morris Autocatalysis through the generation of water during methanol oxidation over a titania-supported platinum catalyst ACS Catal. 13 2023 9997 10006 N.S. Sapienza, K.N. Knight, M. Albrahim, M.R. Yousuf, A.M. Karim, J.R. Morris, Autocatalysis through the generation of water during methanol oxidation over a titania-supported platinum catalyst, ACS Catal., 13 (2023) 9997-10006. [51] S.M. Gurses N. Felvey L.R. Filardi A.J. Zhang J. Wood K. van Benthem J.H. Frank D.L. Osborn N. Hansen C.X. Kronawitter Constraining reaction pathways for methanol oxidation through operando interrogation of both the surface and the near-surface gas phase Chem. Catal. 3 2023 100782 S.M. Gurses, N. Felvey, L.R. Filardi, A.J. Zhang, J. Wood, K. van Benthem, J.H. Frank, D.L. Osborn, N. Hansen, C.X. Kronawitter, Constraining reaction pathways for methanol oxidation through operando interrogation of both the surface and the near-surface gas phase, Chem Catal., 3 (2023) 100782. [52] H. Gu H. Tao Q. Liu Z. Jiang D. Li H. Wu R. Qiu W. Zhang C. Lian J. Xu M. Zhu Electrochemical synthesized copper mesh catalysts for methanol steam reforming ACS Catal. 14 2024 9374 9384 H. Gu, H. Tao, Q. Liu, Z. Jiang, D. Li, H. Wu, R. Qiu, W. Zhang, C. Lian, J. Xu, M. Zhu, Electrochemical synthesized copper mesh catalysts for methanol steam reforming, ACS Catal., 14 (2024) 9374-9384. [53] Z. Jiang X. Feng J. Deng C. He M. Douthwaite Y. Yu J. Liu Z. Hao Z. Zhao Atomic-scale insights into the low-temperature oxidation of methanol over a single-atom Pt1-Co3O4 catalyst Adv. Funct. Mater. 29 2019 1902041 Z. Jiang, X. Feng, J. Deng, C. He, M. Douthwaite, Y. Yu, J. Liu, Z. Hao, Z. Zhao, Atomic-scale insights into the low-temperature oxidation of methanol over a single-atom Pt1-Co3O4 catalyst, Adv. Funct. Mater., 29 (2019) 1902041. [54] W. Pei K. Yang J. Deng Y. Liu Z. Hou J. Wang Y. Feng X. Yu H. Dai SO2-tolerant mesoporous iron oxide supported bimetallic single atom catalyst for methanol removal Appl. Catal. B 335 2023 122888 W. Pei, K. Yang, J. Deng, Y. Liu, Z. Hou, J. Wang, Y. Feng, X. Yu, H. Dai, SO2-tolerant mesoporous iron oxide supported bimetallic single atom catalyst for methanol removal, Appl. Catal., B, 335 (2023) 122888. [55] Y. Du C. Wu J. Liu X. Li X. Wu Efficient catalysts for low‑temperature methanol oxidation: Mn‑coated nanospherical CeO2 Catal. Lett. 153 2022 2471 2481 Y. Du, C. Wu, J. Liu, X. Li, X. Wu, Efficient catalysts for low‑temperature methanol oxidation: Mn‑coated nanospherical CeO2, Catal. Lett., 153 (2022) 2471-2481. [56] Z.Y. Jiang M.Z. Jing X.B. Feng J.C. Xiong C. He M. Douthwaite L.R. Zheng W.Y. Song J. Liu Z.G. Qu Stabilizing platinum atoms on CeO2 oxygen vacancies by metal-support interaction induced interface distortion: mechanism and application Appl. Catal. B 278 2020 119304 Z.Y. Jiang, M.Z. Jing, X.B. Feng, J.C. Xiong, C. He, M. Douthwaite, L.R. Zheng, W.Y. Song, J. Liu, Z.G. Qu, Stabilizing platinum atoms on CeO2 oxygen vacancies by metal-support interaction induced interface distortion: Mechanism and application, Appl. Catal., B, 278 (2020) 119304. [57] H. Li X. Wang H. Yi X. Shi M. Mao Y. Zhang H. Huang D. Ye X. Tu J. Wu Morphology and size effect of ceria on methanol oxidation in non-thermal plasma Catal. Today 426 2024 114398 H. Li, X. Wang, H. Yi, X. Shi, M. Mao, Y. Zhang, H. Huang, D. Ye, X. Tu, J. Wu, Morphology and size effect of ceria on methanol oxidation in non-thermal plasma, Catal. Today, 426 (2024) 114398. [58] A. Walkowiak L. Wolski O.I. Lebedev M. Daturi M. Ziolek Unraveling the impact of phosphate doping on surface properties and catalytic activity of gold supported on mixed iron-niobium oxide in gas phase methanol oxidation J. Catal. 434 2024 115504 A. Walkowiak, L. Wolski, O.I. Lebedev, M. Daturi, M. Ziolek, Unraveling the impact of phosphate doping on surface properties and catalytic activity of gold supported on mixed iron-niobium oxide in gas phase methanol oxidation, J. Catal., 434 (2024) 115504. [59] J.D. Lee A. Filie L. Wilson K. Nguyen T. Shirman E. Guan M. Luneau M. Aizenberg J. Aizenberg R.J. Madix C.M. Friend Selective oxidation of linear alcohols: the promotional effect of water and inhibiting effect of carboxylates over dilute PdAu catalysts J. Mater. Chem. A 12 2024 13778 13791 J.D. Lee, A. Filie, L. Wilson, K. Nguyen, T. Shirman, E. Guan, M. Luneau, M. Aizenberg, J. Aizenberg, R.J. Madix, C.M. Friend, Selective oxidation of linear alcohols: The promotional effect of water and inhibiting effect of carboxylates over dilute PdAu catalysts, J. Mater. Chem. A, 12 (2024) 13778-13791. [60] D. Hibbitts M. Neurock Promotional effects of chemisorbed oxygen and hydroxide in the activation of C–H and O–H bonds over transition metal surfaces Surf. Sci. 650 2016 210 220 D. Hibbitts, M. Neurock, Promotional effects of chemisorbed oxygen and hydroxide in the activation of C–H and O–H bonds over transition metal surfaces, Surf. Sci., 650 (2016) 210-220.",
      "scopus-id": "105007552821",
      "coredata": {
        "eid": "1-s2.0-S0926860X25003035",
        "dc:description": "MnO2-based catalysts have been extensively utilized in the catalytic oxidation of volatile organic compounds due to their cost-effectiveness. In this study, a series of Bi-doped MnO2 catalysts with various contents were systematically investigated to reveal the structure-activity relationship during the CH3OH oxidation reaction, which was achieved using a series of characterizations. Bi could enter the MnO2 lattice and lead to the facile formation of oxygen vacancies, facilitating the generation of surface reactive oxygen species by O2 dissociation. With the increase of Bi, the activity showed a volcanic trend, and the Mn7.5Bi1Ox (T90 = 160 °C) exhibited the lowest apparent activation energy and optimal performance. CH3OH oxidation mechanism (CH3OH → methoxy species → formate species → CO2 and H2O) was revealed by in situ DRIFTS, and the last two oxidation processes were significantly sped up. Bi-doped MnO2 exhibited high H2O tolerance due to hydroxyl-assisted CH3OH chemisorption via hydrogen bonding and hydroxyl-assisted C-H activation of methoxy species with surface reactive oxygen species. These findings are beneficial for the rational design of metal-doped catalysts with rich oxygen vacancy defects for catalytic oxidation.",
        "openArchiveArticle": "false",
        "prism:coverDate": "2025-08-25",
        "openaccessUserLicense": null,
        "prism:aggregationType": "Journal",
        "prism:url": "https://api.elsevier.com/content/article/pii/S0926860X25003035",
        "dc:creator": [
          {
            "@_fa": "true",
            "$": "Yu, Suxin"
          },
          {
            "@_fa": "true",
            "$": "Gu, Haoyuan"
          },
          {
            "@_fa": "true",
            "$": "Wen, Qihang"
          },
          {
            "@_fa": "true",
            "$": "Han, Yi-Fan"
          },
          {
            "@_fa": "true",
            "$": "Zhu, Minghui"
          }
        ],
        "link": [
          {
            "@_fa": "true",
            "@rel": "self",
            "@href": "https://api.elsevier.com/content/article/pii/S0926860X25003035"
          },
          {
            "@_fa": "true",
            "@rel": "scidir",
            "@href": "https://www.sciencedirect.com/science/article/pii/S0926860X25003035"
          }
        ],
        "dc:format": "application/json",
        "openaccessType": null,
        "pii": "S0926-860X(25)00303-5",
        "prism:volume": "704",
        "articleNumber": "120402",
        "prism:publisher": "Elsevier B.V. All rights are reserved, including those for text and data mining, AI training, and similar technologies.",
        "dc:title": "Elucidating the structure-activity relationship of Bi-doped MnO2 catalysts towards CH3OH oxidation",
        "prism:copyright": "© 2025 Elsevier B.V. All rights are reserved, including those for text and data mining, AI training, and similar technologies.",
        "openaccess": "0",
        "prism:issn": "0926860X",
        "dcterms:subject": [
          {
            "@_fa": "true",
            "$": "CH3OH oxidation"
          },
          {
            "@_fa": "true",
            "$": "Manganese oxide"
          },
          {
            "@_fa": "true",
            "$": "Bi doping"
          },
          {
            "@_fa": "true",
            "$": "Oxygen vacancies"
          },
          {
            "@_fa": "true",
            "$": "Surface reactive oxygen species"
          }
        ],
        "openaccessArticle": "false",
        "prism:publicationName": "Applied Catalysis A: General",
        "openaccessSponsorType": null,
        "prism:pageRange": "120402",
        "pubType": "fla",
        "prism:coverDisplayDate": "25 August 2025",
        "prism:doi": "10.1016/j.apcata.2025.120402",
        "prism:startingPage": "120402",
        "dc:identifier": "doi:10.1016/j.apcata.2025.120402",
        "openaccessSponsorName": null
      },
      "objects": {
        "object": [
          {
            "@category": "standard",
            "@height": "246",
            "@width": "791",
            "@_fa": "true",
            "$": "https://api.elsevier.com/content/object/eid/1-s2.0-S0926860X25003035-gr5.jpg?httpAccept=%2A%2F%2A",
            "@multimediatype": "JPEG image file",
            "@type": "IMAGE-DOWNSAMPLED",
            "@size": "63458",
            "@ref": "gr5",
            "@mimetype": "image/jpeg"
          },
          {
            "@category": "standard",
            "@height": "995",
            "@width": "555",
            "@_fa": "true",
            "$": "https://api.elsevier.com/content/object/eid/1-s2.0-S0926860X25003035-gr6.jpg?httpAccept=%2A%2F%2A",
            "@multimediatype": "JPEG image file",
            "@type": "IMAGE-DOWNSAMPLED",
            "@size": "181863",
            "@ref": "gr6",
            "@mimetype": "image/jpeg"
          },
          {
            "@category": "standard",
            "@height": "505",
            "@width": "565",
            "@_fa": "true",
            "$": "https://api.elsevier.com/content/object/eid/1-s2.0-S0926860X25003035-gr7.jpg?httpAccept=%2A%2F%2A",
            "@multimediatype": "JPEG image file",
            "@type": "IMAGE-DOWNSAMPLED",
            "@size": "90946",
            "@ref": "gr7",
            "@mimetype": "image/jpeg"
          },
          {
            "@category": "standard",
            "@height": "463",
            "@width": "565",
            "@_fa": "true",
            "$": "https://api.elsevier.com/content/object/eid/1-s2.0-S0926860X25003035-gr1.jpg?httpAccept=%2A%2F%2A",
            "@multimediatype": "JPEG image file",
            "@type": "IMAGE-DOWNSAMPLED",
            "@size": "70892",
            "@ref": "gr1",
            "@mimetype": "image/jpeg"
          },
          {
            "@category": "standard",
            "@height": "464",
            "@width": "565",
            "@_fa": "true",
            "$": "https://api.elsevier.com/content/object/eid/1-s2.0-S0926860X25003035-gr2.jpg?httpAccept=%2A%2F%2A",
            "@multimediatype": "JPEG image file",
            "@type": "IMAGE-DOWNSAMPLED",
            "@size": "67903",
            "@ref": "gr2",
            "@mimetype": "image/jpeg"
          },
          {
            "@category": "standard",
            "@height": "200",
            "@width": "371",
            "@_fa": "true",
            "$": "https://api.elsevier.com/content/object/eid/1-s2.0-S0926860X25003035-ga1.jpg?httpAccept=%2A%2F%2A",
            "@multimediatype": "JPEG image file",
            "@type": "IMAGE-DOWNSAMPLED",
            "@size": "38791",
            "@ref": "ga1",
            "@mimetype": "image/jpeg"
          },
          {
            "@category": "standard",
            "@height": "476",
            "@width": "659",
            "@_fa": "true",
            "$": "https://api.elsevier.com/content/object/eid/1-s2.0-S0926860X25003035-gr3.jpg?httpAccept=%2A%2F%2A",
            "@multimediatype": "JPEG image file",
            "@type": "IMAGE-DOWNSAMPLED",
            "@size": "93316",
            "@ref": "gr3",
            "@mimetype": "image/jpeg"
          },
          {
            "@category": "standard",
            "@height": "522",
            "@width": "565",
            "@_fa": "true",
            "$": "https://api.elsevier.com/content/object/eid/1-s2.0-S0926860X25003035-gr4.jpg?httpAccept=%2A%2F%2A",
            "@multimediatype": "JPEG image file",
            "@type": "IMAGE-DOWNSAMPLED",
            "@size": "87056",
            "@ref": "gr4",
            "@mimetype": "image/jpeg"
          },
          {
            "@category": "thumbnail",
            "@height": "68",
            "@width": "219",
            "@_fa": "true",
            "$": "https://api.elsevier.com/content/object/eid/1-s2.0-S0926860X25003035-gr5.sml?httpAccept=%2A%2F%2A",
            "@multimediatype": "GIF image file",
            "@type": "IMAGE-THUMBNAIL",
            "@size": "6941",
            "@ref": "gr5",
            "@mimetype": "image/gif"
          },
          {
            "@category": "thumbnail",
            "@height": "163",
            "@width": "91",
            "@_fa": "true",
            "$": "https://api.elsevier.com/content/object/eid/1-s2.0-S0926860X25003035-gr6.sml?httpAccept=%2A%2F%2A",
            "@multimediatype": "GIF image file",
            "@type": "IMAGE-THUMBNAIL",
            "@size": "9404",
            "@ref": "gr6",
            "@mimetype": "image/gif"
          },
          {
            "@category": "thumbnail",
            "@height": "164",
            "@width": "183",
            "@_fa": "true",
            "$": "https://api.elsevier.com/content/object/eid/1-s2.0-S0926860X25003035-gr7.sml?httpAccept=%2A%2F%2A",
            "@multimediatype": "GIF image file",
            "@type": "IMAGE-THUMBNAIL",
            "@size": "13669",
            "@ref": "gr7",
            "@mimetype": "image/gif"
          },
          {
            "@category": "thumbnail",
            "@height": "164",
            "@width": "200",
            "@_fa": "true",
            "$": "https://api.elsevier.com/content/object/eid/1-s2.0-S0926860X25003035-gr1.sml?httpAccept=%2A%2F%2A",
            "@multimediatype": "GIF image file",
            "@type": "IMAGE-THUMBNAIL",
            "@size": "10552",
            "@ref": "gr1",
            "@mimetype": "image/gif"
          },
          {
            "@category": "thumbnail",
            "@height": "164",
            "@width": "200",
            "@_fa": "true",
            "$": "https://api.elsevier.com/content/object/eid/1-s2.0-S0926860X25003035-gr2.sml?httpAccept=%2A%2F%2A",
            "@multimediatype": "GIF image file",
            "@type": "IMAGE-THUMBNAIL",
            "@size": "10356",
            "@ref": "gr2",
            "@mimetype": "image/gif"
          },
          {
            "@category": "thumbnail",
            "@height": "118",
            "@width": "219",
            "@_fa": "true",
            "$": "https://api.elsevier.com/content/object/eid/1-s2.0-S0926860X25003035-ga1.sml?httpAccept=%2A%2F%2A",
            "@multimediatype": "GIF image file",
            "@type": "IMAGE-THUMBNAIL",
            "@size": "20146",
            "@ref": "ga1",
            "@mimetype": "image/gif"
          },
          {
            "@category": "thumbnail",
            "@height": "158",
            "@width": "219",
            "@_fa": "true",
            "$": "https://api.elsevier.com/content/object/eid/1-s2.0-S0926860X25003035-gr3.sml?httpAccept=%2A%2F%2A",
            "@multimediatype": "GIF image file",
            "@type": "IMAGE-THUMBNAIL",
            "@size": "13866",
            "@ref": "gr3",
            "@mimetype": "image/gif"
          },
          {
            "@category": "thumbnail",
            "@height": "164",
            "@width": "177",
            "@_fa": "true",
            "$": "https://api.elsevier.com/content/object/eid/1-s2.0-S0926860X25003035-gr4.sml?httpAccept=%2A%2F%2A",
            "@multimediatype": "GIF image file",
            "@type": "IMAGE-THUMBNAIL",
            "@size": "11431",
            "@ref": "gr4",
            "@mimetype": "image/gif"
          },
          {
            "@category": "high",
            "@height": "1087",
            "@width": "3493",
            "@_fa": "true",
            "$": "https://api.elsevier.com/content/object/eid/1-s2.0-S0926860X25003035-gr5_lrg.jpg?httpAccept=%2A%2F%2A",
            "@multimediatype": "JPEG image file",
            "@type": "IMAGE-HIGH-RES",
            "@size": "286823",
            "@ref": "gr5",
            "@mimetype": "image/jpeg"
          },
          {
            "@category": "high",
            "@height": "4408",
            "@width": "2458",
            "@_fa": "true",
            "$": "https://api.elsevier.com/content/object/eid/1-s2.0-S0926860X25003035-gr6_lrg.jpg?httpAccept=%2A%2F%2A",
            "@multimediatype": "JPEG image file",
            "@type": "IMAGE-HIGH-RES",
            "@size": "1028323",
            "@ref": "gr6",
            "@mimetype": "image/jpeg"
          },
          {
            "@category": "high",
            "@height": "2230",
            "@width": "2495",
            "@_fa": "true",
            "$": "https://api.elsevier.com/content/object/eid/1-s2.0-S0926860X25003035-gr7_lrg.jpg?httpAccept=%2A%2F%2A",
            "@multimediatype": "JPEG image file",
            "@type": "IMAGE-HIGH-RES",
            "@size": "491022",
            "@ref": "gr7",
            "@mimetype": "image/jpeg"
          },
          {
            "@category": "high",
            "@height": "2045",
            "@width": "2495",
            "@_fa": "true",
            "$": "https://api.elsevier.com/content/object/eid/1-s2.0-S0926860X25003035-gr1_lrg.jpg?httpAccept=%2A%2F%2A",
            "@multimediatype": "JPEG image file",
            "@type": "IMAGE-HIGH-RES",
            "@size": "349726",
            "@ref": "gr1",
            "@mimetype": "image/jpeg"
          },
          {
            "@category": "high",
            "@height": "2049",
            "@width": "2495",
            "@_fa": "true",
            "$": "https://api.elsevier.com/content/object/eid/1-s2.0-S0926860X25003035-gr2_lrg.jpg?httpAccept=%2A%2F%2A",
            "@multimediatype": "JPEG image file",
            "@type": "IMAGE-HIGH-RES",
            "@size": "366558",
            "@ref": "gr2",
            "@mimetype": "image/jpeg"
          },
          {
            "@category": "high",
            "@height": "886",
            "@width": "1642",
            "@_fa": "true",
            "$": "https://api.elsevier.com/content/object/eid/1-s2.0-S0926860X25003035-ga1_lrg.jpg?httpAccept=%2A%2F%2A",
            "@multimediatype": "JPEG image file",
            "@type": "IMAGE-HIGH-RES",
            "@size": "318757",
            "@ref": "ga1",
            "@mimetype": "image/jpeg"
          },
          {
            "@category": "high",
            "@height": "2103",
            "@width": "2911",
            "@_fa": "true",
            "$": "https://api.elsevier.com/content/object/eid/1-s2.0-S0926860X25003035-gr3_lrg.jpg?httpAccept=%2A%2F%2A",
            "@multimediatype": "JPEG image file",
            "@type": "IMAGE-HIGH-RES",
            "@size": "535909",
            "@ref": "gr3",
            "@mimetype": "image/jpeg"
          },
          {
            "@category": "high",
            "@height": "2306",
            "@width": "2495",
            "@_fa": "true",
            "$": "https://api.elsevier.com/content/object/eid/1-s2.0-S0926860X25003035-gr4_lrg.jpg?httpAccept=%2A%2F%2A",
            "@multimediatype": "JPEG image file",
            "@type": "IMAGE-HIGH-RES",
            "@size": "442754",
            "@ref": "gr4",
            "@mimetype": "image/jpeg"
          },
          {
            "@category": "standard",
            "@_fa": "true",
            "$": "https://api.elsevier.com/content/object/eid/1-s2.0-S0926860X25003035-mmc1.docx?httpAccept=%2A%2F%2A",
            "@multimediatype": "Microsoft Word file",
            "@type": "APPLICATION",
            "@size": "4302550",
            "@ref": "mmc1",
            "@mimetype": "application/word"
          },
          {
            "@category": "thumbnail",
            "@_fa": "true",
            "$": "https://api.elsevier.com/content/object/eid/1-s2.0-S0926860X25003035-si0001.svg?httpAccept=%2A%2F%2A",
            "@multimediatype": "Scalable Vector Graphics file",
            "@type": "ALTIMG",
            "@size": "1900",
            "@ref": "si0001",
            "@mimetype": "image/svg+xml"
          },
          {
            "@category": "thumbnail",
            "@_fa": "true",
            "$": "https://api.elsevier.com/content/object/eid/1-s2.0-S0926860X25003035-si0002.svg?httpAccept=%2A%2F%2A",
            "@multimediatype": "Scalable Vector Graphics file",
            "@type": "ALTIMG",
            "@size": "1705",
            "@ref": "si0002",
            "@mimetype": "image/svg+xml"
          },
          {
            "@category": "thumbnail",
            "@_fa": "true",
            "$": "https://api.elsevier.com/content/object/eid/1-s2.0-S0926860X25003035-si0003.svg?httpAccept=%2A%2F%2A",
            "@multimediatype": "Scalable Vector Graphics file",
            "@type": "ALTIMG",
            "@size": "1507",
            "@ref": "si0003",
            "@mimetype": "image/svg+xml"
          },
          {
            "@category": "thumbnail",
            "@_fa": "true",
            "$": "https://api.elsevier.com/content/object/eid/1-s2.0-S0926860X25003035-si0004.svg?httpAccept=%2A%2F%2A",
            "@multimediatype": "Scalable Vector Graphics file",
            "@type": "ALTIMG",
            "@size": "1491",
            "@ref": "si0004",
            "@mimetype": "image/svg+xml"
          },
          {
            "@category": "thumbnail",
            "@_fa": "true",
            "$": "https://api.elsevier.com/content/object/eid/1-s2.0-S0926860X25003035-si0005.svg?httpAccept=%2A%2F%2A",
            "@multimediatype": "Scalable Vector Graphics file",
            "@type": "ALTIMG",
            "@size": "4485",
            "@ref": "si0005",
            "@mimetype": "image/svg+xml"
          },
          {
            "@category": "thumbnail",
            "@_fa": "true",
            "$": "https://api.elsevier.com/content/object/eid/1-s2.0-S0926860X25003035-si0006.svg?httpAccept=%2A%2F%2A",
            "@multimediatype": "Scalable Vector Graphics file",
            "@type": "ALTIMG",
            "@size": "1608",
            "@ref": "si0006",
            "@mimetype": "image/svg+xml"
          },
          {
            "@category": "thumbnail",
            "@_fa": "true",
            "$": "https://api.elsevier.com/content/object/eid/1-s2.0-S0926860X25003035-si0007.svg?httpAccept=%2A%2F%2A",
            "@multimediatype": "Scalable Vector Graphics file",
            "@type": "ALTIMG",
            "@size": "1665",
            "@ref": "si0007",
            "@mimetype": "image/svg+xml"
          },
          {
            "@category": "thumbnail",
            "@_fa": "true",
            "$": "https://api.elsevier.com/content/object/eid/1-s2.0-S0926860X25003035-si0008.svg?httpAccept=%2A%2F%2A",
            "@multimediatype": "Scalable Vector Graphics file",
            "@type": "ALTIMG",
            "@size": "1333",
            "@ref": "si0008",
            "@mimetype": "image/svg+xml"
          },
          {
            "@category": "thumbnail",
            "@_fa": "true",
            "$": "https://api.elsevier.com/content/object/eid/1-s2.0-S0926860X25003035-si0009.svg?httpAccept=%2A%2F%2A",
            "@multimediatype": "Scalable Vector Graphics file",
            "@type": "ALTIMG",
            "@size": "3213",
            "@ref": "si0009",
            "@mimetype": "image/svg+xml"
          },
          {
            "@category": "thumbnail",
            "@_fa": "true",
            "$": "https://api.elsevier.com/content/object/eid/1-s2.0-S0926860X25003035-si0010.svg?httpAccept=%2A%2F%2A",
            "@multimediatype": "Scalable Vector Graphics file",
            "@type": "ALTIMG",
            "@size": "1539",
            "@ref": "si0010",
            "@mimetype": "image/svg+xml"
          },
          {
            "@category": "thumbnail",
            "@_fa": "true",
            "$": "https://api.elsevier.com/content/object/eid/1-s2.0-S0926860X25003035-si0011.svg?httpAccept=%2A%2F%2A",
            "@multimediatype": "Scalable Vector Graphics file",
            "@type": "ALTIMG",
            "@size": "1507",
            "@ref": "si0011",
            "@mimetype": "image/svg+xml"
          },
          {
            "@category": "thumbnail",
            "@_fa": "true",
            "$": "https://api.elsevier.com/content/object/eid/1-s2.0-S0926860X25003035-si0012.svg?httpAccept=%2A%2F%2A",
            "@multimediatype": "Scalable Vector Graphics file",
            "@type": "ALTIMG",
            "@size": "2301",
            "@ref": "si0012",
            "@mimetype": "image/svg+xml"
          },
          {
            "@category": "thumbnail",
            "@_fa": "true",
            "$": "https://api.elsevier.com/content/object/eid/1-s2.0-S0926860X25003035-si0013.svg?httpAccept=%2A%2F%2A",
            "@multimediatype": "Scalable Vector Graphics file",
            "@type": "ALTIMG",
            "@size": "4522",
            "@ref": "si0013",
            "@mimetype": "image/svg+xml"
          },
          {
            "@category": "thumbnail",
            "@_fa": "true",
            "$": "https://api.elsevier.com/content/object/eid/1-s2.0-S0926860X25003035-si0014.svg?httpAccept=%2A%2F%2A",
            "@multimediatype": "Scalable Vector Graphics file",
            "@type": "ALTIMG",
            "@size": "1474",
            "@ref": "si0014",
            "@mimetype": "image/svg+xml"
          },
          {
            "@category": "thumbnail",
            "@_fa": "true",
            "$": "https://api.elsevier.com/content/object/eid/1-s2.0-S0926860X25003035-si0015.svg?httpAccept=%2A%2F%2A",
            "@multimediatype": "Scalable Vector Graphics file",
            "@type": "ALTIMG",
            "@size": "1170",
            "@ref": "si0015",
            "@mimetype": "image/svg+xml"
          },
          {
            "@category": "thumbnail",
            "@_fa": "true",
            "$": "https://api.elsevier.com/content/object/eid/1-s2.0-S0926860X25003035-si0016.svg?httpAccept=%2A%2F%2A",
            "@multimediatype": "Scalable Vector Graphics file",
            "@type": "ALTIMG",
            "@size": "2155",
            "@ref": "si0016",
            "@mimetype": "image/svg+xml"
          },
          {
            "@category": "thumbnail",
            "@_fa": "true",
            "$": "https://api.elsevier.com/content/object/eid/1-s2.0-S0926860X25003035-si0017.svg?httpAccept=%2A%2F%2A",
            "@multimediatype": "Scalable Vector Graphics file",
            "@type": "ALTIMG",
            "@size": "4340",
            "@ref": "si0017",
            "@mimetype": "image/svg+xml"
          },
          {
            "@category": "thumbnail",
            "@_fa": "true",
            "$": "https://api.elsevier.com/content/object/eid/1-s2.0-S0926860X25003035-si0018.svg?httpAccept=%2A%2F%2A",
            "@multimediatype": "Scalable Vector Graphics file",
            "@type": "ALTIMG",
            "@size": "1126",
            "@ref": "si0018",
            "@mimetype": "image/svg+xml"
          },
          {
            "@category": "thumbnail",
            "@_fa": "true",
            "$": "https://api.elsevier.com/content/object/eid/1-s2.0-S0926860X25003035-si0019.svg?httpAccept=%2A%2F%2A",
            "@multimediatype": "Scalable Vector Graphics file",
            "@type": "ALTIMG",
            "@size": "1572",
            "@ref": "si0019",
            "@mimetype": "image/svg+xml"
          },
          {
            "@category": "thumbnail",
            "@_fa": "true",
            "$": "https://api.elsevier.com/content/object/eid/1-s2.0-S0926860X25003035-si0020.svg?httpAccept=%2A%2F%2A",
            "@multimediatype": "Scalable Vector Graphics file",
            "@type": "ALTIMG",
            "@size": "2439",
            "@ref": "si0020",
            "@mimetype": "image/svg+xml"
          },
          {
            "@category": "thumbnail",
            "@_fa": "true",
            "$": "https://api.elsevier.com/content/object/eid/1-s2.0-S0926860X25003035-si0021.svg?httpAccept=%2A%2F%2A",
            "@multimediatype": "Scalable Vector Graphics file",
            "@type": "ALTIMG",
            "@size": "1458",
            "@ref": "si0021",
            "@mimetype": "image/svg+xml"
          },
          {
            "@category": "thumbnail",
            "@_fa": "true",
            "$": "https://api.elsevier.com/content/object/eid/1-s2.0-S0926860X25003035-si0022.svg?httpAccept=%2A%2F%2A",
            "@multimediatype": "Scalable Vector Graphics file",
            "@type": "ALTIMG",
            "@size": "1645",
            "@ref": "si0022",
            "@mimetype": "image/svg+xml"
          },
          {
            "@category": "thumbnail",
            "@_fa": "true",
            "$": "https://api.elsevier.com/content/object/eid/1-s2.0-S0926860X25003035-si0023.svg?httpAccept=%2A%2F%2A",
            "@multimediatype": "Scalable Vector Graphics file",
            "@type": "ALTIMG",
            "@size": "3472",
            "@ref": "si0023",
            "@mimetype": "image/svg+xml"
          },
          {
            "@category": "thumbnail",
            "@_fa": "true",
            "$": "https://api.elsevier.com/content/object/eid/1-s2.0-S0926860X25003035-si0024.svg?httpAccept=%2A%2F%2A",
            "@multimediatype": "Scalable Vector Graphics file",
            "@type": "ALTIMG",
            "@size": "1430",
            "@ref": "si0024",
            "@mimetype": "image/svg+xml"
          },
          {
            "@category": "thumbnail",
            "@_fa": "true",
            "$": "https://api.elsevier.com/content/object/eid/1-s2.0-S0926860X25003035-si0025.svg?httpAccept=%2A%2F%2A",
            "@multimediatype": "Scalable Vector Graphics file",
            "@type": "ALTIMG",
            "@size": "1539",
            "@ref": "si0025",
            "@mimetype": "image/svg+xml"
          },
          {
            "@category": "thumbnail",
            "@_fa": "true",
            "$": "https://api.elsevier.com/content/object/eid/1-s2.0-S0926860X25003035-si0026.svg?httpAccept=%2A%2F%2A",
            "@multimediatype": "Scalable Vector Graphics file",
            "@type": "ALTIMG",
            "@size": "2913",
            "@ref": "si0026",
            "@mimetype": "image/svg+xml"
          },
          {
            "@category": "thumbnail",
            "@_fa": "true",
            "$": "https://api.elsevier.com/content/object/eid/1-s2.0-S0926860X25003035-si0027.svg?httpAccept=%2A%2F%2A",
            "@multimediatype": "Scalable Vector Graphics file",
            "@type": "ALTIMG",
            "@size": "1430",
            "@ref": "si0027",
            "@mimetype": "image/svg+xml"
          },
          {
            "@category": "thumbnail",
            "@_fa": "true",
            "$": "https://api.elsevier.com/content/object/eid/1-s2.0-S0926860X25003035-si0028.svg?httpAccept=%2A%2F%2A",
            "@multimediatype": "Scalable Vector Graphics file",
            "@type": "ALTIMG",
            "@size": "1608",
            "@ref": "si0028",
            "@mimetype": "image/svg+xml"
          },
          {
            "@category": "thumbnail",
            "@_fa": "true",
            "$": "https://api.elsevier.com/content/object/eid/1-s2.0-S0926860X25003035-si0029.svg?httpAccept=%2A%2F%2A",
            "@multimediatype": "Scalable Vector Graphics file",
            "@type": "ALTIMG",
            "@size": "2301",
            "@ref": "si0029",
            "@mimetype": "image/svg+xml"
          },
          {
            "@category": "thumbnail",
            "@_fa": "true",
            "$": "https://api.elsevier.com/content/object/eid/1-s2.0-S0926860X25003035-si0030.svg?httpAccept=%2A%2F%2A",
            "@multimediatype": "Scalable Vector Graphics file",
            "@type": "ALTIMG",
            "@size": "1507",
            "@ref": "si0030",
            "@mimetype": "image/svg+xml"
          },
          {
            "@category": "thumbnail",
            "@_fa": "true",
            "$": "https://api.elsevier.com/content/object/eid/1-s2.0-S0926860X25003035-si0031.svg?httpAccept=%2A%2F%2A",
            "@multimediatype": "Scalable Vector Graphics file",
            "@type": "ALTIMG",
            "@size": "2301",
            "@ref": "si0031",
            "@mimetype": "image/svg+xml"
          },
          {
            "@category": "thumbnail",
            "@_fa": "true",
            "$": "https://api.elsevier.com/content/object/eid/1-s2.0-S0926860X25003035-si0032.svg?httpAccept=%2A%2F%2A",
            "@multimediatype": "Scalable Vector Graphics file",
            "@type": "ALTIMG",
            "@size": "2155",
            "@ref": "si0032",
            "@mimetype": "image/svg+xml"
          },
          {
            "@category": "thumbnail",
            "@_fa": "true",
            "$": "https://api.elsevier.com/content/object/eid/1-s2.0-S0926860X25003035-si0033.svg?httpAccept=%2A%2F%2A",
            "@multimediatype": "Scalable Vector Graphics file",
            "@type": "ALTIMG",
            "@size": "2155",
            "@ref": "si0033",
            "@mimetype": "image/svg+xml"
          },
          {
            "@category": "thumbnail",
            "@_fa": "true",
            "$": "https://api.elsevier.com/content/object/eid/1-s2.0-S0926860X25003035-si0034.svg?httpAccept=%2A%2F%2A",
            "@multimediatype": "Scalable Vector Graphics file",
            "@type": "ALTIMG",
            "@size": "2155",
            "@ref": "si0034",
            "@mimetype": "image/svg+xml"
          },
          {
            "@category": "thumbnail",
            "@_fa": "true",
            "$": "https://api.elsevier.com/content/object/eid/1-s2.0-S0926860X25003035-si0035.svg?httpAccept=%2A%2F%2A",
            "@multimediatype": "Scalable Vector Graphics file",
            "@type": "ALTIMG",
            "@size": "2155",
            "@ref": "si0035",
            "@mimetype": "image/svg+xml"
          },
          {
            "@category": "thumbnail",
            "@_fa": "true",
            "$": "https://api.elsevier.com/content/object/eid/1-s2.0-S0926860X25003035-si0036.svg?httpAccept=%2A%2F%2A",
            "@multimediatype": "Scalable Vector Graphics file",
            "@type": "ALTIMG",
            "@size": "2929",
            "@ref": "si0036",
            "@mimetype": "image/svg+xml"
          },
          {
            "@category": "thumbnail",
            "@_fa": "true",
            "$": "https://api.elsevier.com/content/object/eid/1-s2.0-S0926860X25003035-si0037.svg?httpAccept=%2A%2F%2A",
            "@multimediatype": "Scalable Vector Graphics file",
            "@type": "ALTIMG",
            "@size": "2184",
            "@ref": "si0037",
            "@mimetype": "image/svg+xml"
          }
        ]
      },
      "link": {
        "@rel": "abstract",
        "@href": "https://api.elsevier.com/content/abstract/scopus_id/105007552821"
      }
    }
  }
}