{
  "metadata": {
    "title": "Effect of Zn addition on the performance of Ni/Al<ce:inf loc=post>2</ce:inf>O<ce:inf loc=post>3</ce:inf> catalyst for steam reforming of ethanol",
    "authors": "; ; ",
    "journal": "Applied Catalysis A: General",
    "date": "2016-06-05",
    "doi": "10.1016/j.apcata.2016.03.008",
    "abstract": "",
    "uri": "https://api.elsevier.com/content/article/pii/S0926860X16301181",
    "pii": "S0926860X16301181"
  },
  "fulltext": {
    "full-text-retrieval-response": {
      "scopus-eid": "2-s2.0-84961918836",
      "originalText": "serial JL 271346 291210 291744 291809 31 Applied Catalysis A: General APPLIEDCATALYSISAGENERAL 2016-03-17 2016-03-17 2016-03-30 2016-03-30 2016-05-03T16:58:19 1-s2.0-S0926860X16301181 S0926-860X(16)30118-1 S0926860X16301181 10.1016/j.apcata.2016.03.008 S300 S300.1 FULL-TEXT 1-s2.0-S0926860X16X00063 2025-07-16T14:33:53.326206Z 0 0 20160605 2016 2016-03-17T18:58:53.584462Z absattachment articleinfo articletitlenorm authfirstinitialnorm authfirstsurnamenorm cid cids contenttype copyright crossmark dateloaded dateloadedtxt datesearch datesort dateupdated dco docsubtype doctype doi eid ewtransactionid hubeid indexeddate issn issnnorm itemstage itemtransactionid itemweight openaccess openarchive pg pgfirst pglast pii piinorm pubdatestart pubdatetxt pubyr sectiontitle sortorder srctitle srctitlenorm srctype ssids alllist content subj subheadings suppl tomb volfirst volissue volumelist webpdf webpdfpagecount yearnav figure table e-component body mmlmath acknowledge affil appendices articletitle auth authfirstini authfull authkeywords authlast footnotes grantnumber grantsponsor highlightsabst primabst ref specialabst 0926-860X 0926860X true 519 519 C Volume 519 12 85 98 85 98 20160605 5 June 2016 2016-06-05 2016 Articles article fla © 2016 Elsevier B.V. All rights reserved. EFFECTZNADDITIONPERFORMANCENIAL2O3CATALYSTFORSTEAMREFORMINGETHANOL ANJANEYULU C 1 Introduction 2 Experimental 2.1 Catalyst preparation 2.2 BET surface area 2.3 X-ray diffraction (XRD) 2.4 Thermogravimetric analysis (TG) 2.5 Scanning electron microscopy (SEM) 2.6 X-ray absorption spectroscopy (XAS) 2.7 Catalytic tests 3 Results and discussion 3.1 Characterization of Ni supported catalysts 3.2 SR of ethanol over Ni supported catalysts 3.3 Characterization of post-reaction Ni supported catalysts 3.4 - XANES/EXAFS experiments 3.4.1 XANES experiments 3.4.2 EXAFS experiments 3.5 General discussion 4 Conclusions Acknowledgements Appendix A Supplementary data References HOU 2015 132 T MATTOS 2012 4094 L FIERRO 2003 20 V AKDIM 2008 22 O MARINO 2001 665 F MARINO 1998 1095 F VELU 2002 145 S VELU 2005 287 S VIZCAINO 2007 1450 A FURTADO 2009 7189 A KUGAI 2005 255 J KUGAI 2006 430 J ORUCU 2008 198 E SANCHEZSANCHEZ 2010 3873 M YOUN 2007 276 M HOMS 2006 361 N RESINI 2008 3728 C HE 2009 206 L GALETTI 2008 1201 A HUANG 2010 1138 L KAZAMA 2010 96 A PEREIRA 2008 206 E PROFETI 2008 482 L SHENG 2007 313 P BI 2007 322 J DELIMA 2010 387 S CASANOVAS 2006 44 A AVILANETO 2012 124 C VENUGOPAL 2010 1188 A BALLARINI 2009 293 A RESSLER 1998 118 T REHR 1992 3397 J VIZCAINO 2012 1985 A AGUSTIN 2008 94 E KOURTELESIS 2015 247 M MORAES 2015 281 T DELIMA 2009 268 S BARROSO 2006 116 M RESINI 2009 83 C ZENG 2011 206 G WANG 2008 25 H SAID 2006 326 A DELAPOSHEA 2007 148 V GRUNWALDT 2000 452 J THOMAS 2001 571 J ANJANEYULUX2016X85 ANJANEYULUX2016X85X98 ANJANEYULUX2016X85XC ANJANEYULUX2016X85X98XC 2018-03-30T00:00:00Z http://creativecommons.org/licenses/by-nc-nd/4.0/ © 2016 Elsevier B.V. All rights reserved. item S0926-860X(16)30118-1 S0926860X16301181 1-s2.0-S0926860X16301181 10.1016/j.apcata.2016.03.008 271346 2024-01-01T12:31:47.592716Z 2016-06-05 1-s2.0-S0926860X16301181-main.pdf https://s3-eu-west-1.amazonaws.com/prod-ucs-content-store-eu-west/content/pii:S0926860X16301181/MAIN/application/pdf/03cfc2ca589aadee25dc082c103c173a/main.pdf https://s3.amazonaws.com/prod-ucs-content-store-us-east/content/pii:S0926860X16301181/MAIN/application/pdf/03cfc2ca589aadee25dc082c103c173a/main.pdf main.pdf pdf true 3590169 MAIN 14 1-s2.0-S0926860X16301181-main_1.png https://s3-eu-west-1.amazonaws.com/prod-ucs-content-store-eu-west/content/pii:S0926860X16301181/PREVIEW/image/png/919951346b2045ac61ce7584eec650fe/main_1.png https://s3.amazonaws.com/prod-ucs-content-store-us-east/content/pii:S0926860X16301181/PREVIEW/image/png/919951346b2045ac61ce7584eec650fe/main_1.png main_1.png png 56878 849 656 IMAGE-WEB-PDF 1 1-s2.0-S0926860X16301181-fx1.sml https://s3-eu-west-1.amazonaws.com/prod-ucs-content-store-eu-west/content/pii:S0926860X16301181/fx1/THUMBNAIL/image/gif/f365df5f9fdd860ec01e15ee3d2dc8ff/fx1.sml https://s3.amazonaws.com/prod-ucs-content-store-us-east/content/pii:S0926860X16301181/fx1/THUMBNAIL/image/gif/f365df5f9fdd860ec01e15ee3d2dc8ff/fx1.sml fx1 true fx1.sml sml 7449 88 219 IMAGE-THUMBNAIL 1-s2.0-S0926860X16301181-gr1.sml https://s3-eu-west-1.amazonaws.com/prod-ucs-content-store-eu-west/content/pii:S0926860X16301181/gr1/THUMBNAIL/image/gif/1e00e3ae977c2ac0ddbb945b7895da8e/gr1.sml https://s3.amazonaws.com/prod-ucs-content-store-us-east/content/pii:S0926860X16301181/gr1/THUMBNAIL/image/gif/1e00e3ae977c2ac0ddbb945b7895da8e/gr1.sml gr1 gr1.sml sml 4060 164 108 IMAGE-THUMBNAIL 1-s2.0-S0926860X16301181-gr10.sml https://s3-eu-west-1.amazonaws.com/prod-ucs-content-store-eu-west/content/pii:S0926860X16301181/gr10/THUMBNAIL/image/gif/e853bdb82af23fb6e023e5c18bb913aa/gr10.sml https://s3.amazonaws.com/prod-ucs-content-store-us-east/content/pii:S0926860X16301181/gr10/THUMBNAIL/image/gif/e853bdb82af23fb6e023e5c18bb913aa/gr10.sml gr10 gr10.sml sml 22136 131 219 IMAGE-THUMBNAIL 1-s2.0-S0926860X16301181-gr11.sml https://s3-eu-west-1.amazonaws.com/prod-ucs-content-store-eu-west/content/pii:S0926860X16301181/gr11/THUMBNAIL/image/gif/906c85cbe561015982c885f00fee7031/gr11.sml https://s3.amazonaws.com/prod-ucs-content-store-us-east/content/pii:S0926860X16301181/gr11/THUMBNAIL/image/gif/906c85cbe561015982c885f00fee7031/gr11.sml gr11 gr11.sml sml 24051 137 219 IMAGE-THUMBNAIL 1-s2.0-S0926860X16301181-gr12.sml https://s3-eu-west-1.amazonaws.com/prod-ucs-content-store-eu-west/content/pii:S0926860X16301181/gr12/THUMBNAIL/image/gif/c2cf647347039d305482c9866b2c1f93/gr12.sml https://s3.amazonaws.com/prod-ucs-content-store-us-east/content/pii:S0926860X16301181/gr12/THUMBNAIL/image/gif/c2cf647347039d305482c9866b2c1f93/gr12.sml gr12 gr12.sml sml 27534 164 218 IMAGE-THUMBNAIL 1-s2.0-S0926860X16301181-gr2.sml https://s3-eu-west-1.amazonaws.com/prod-ucs-content-store-eu-west/content/pii:S0926860X16301181/gr2/THUMBNAIL/image/gif/95dbb091b94fb6a305b6cbe8e0328367/gr2.sml https://s3.amazonaws.com/prod-ucs-content-store-us-east/content/pii:S0926860X16301181/gr2/THUMBNAIL/image/gif/95dbb091b94fb6a305b6cbe8e0328367/gr2.sml gr2 gr2.sml sml 5565 164 211 IMAGE-THUMBNAIL 1-s2.0-S0926860X16301181-gr3.sml https://s3-eu-west-1.amazonaws.com/prod-ucs-content-store-eu-west/content/pii:S0926860X16301181/gr3/THUMBNAIL/image/gif/dabbc2dc17e1810ed046f44aba02404a/gr3.sml https://s3.amazonaws.com/prod-ucs-content-store-us-east/content/pii:S0926860X16301181/gr3/THUMBNAIL/image/gif/dabbc2dc17e1810ed046f44aba02404a/gr3.sml gr3 gr3.sml sml 4556 163 153 IMAGE-THUMBNAIL 1-s2.0-S0926860X16301181-gr4.sml https://s3-eu-west-1.amazonaws.com/prod-ucs-content-store-eu-west/content/pii:S0926860X16301181/gr4/THUMBNAIL/image/gif/012cf330c0f5dc0421426fa3341ce093/gr4.sml https://s3.amazonaws.com/prod-ucs-content-store-us-east/content/pii:S0926860X16301181/gr4/THUMBNAIL/image/gif/012cf330c0f5dc0421426fa3341ce093/gr4.sml gr4 gr4.sml sml 3319 163 71 IMAGE-THUMBNAIL 1-s2.0-S0926860X16301181-gr5.sml https://s3-eu-west-1.amazonaws.com/prod-ucs-content-store-eu-west/content/pii:S0926860X16301181/gr5/THUMBNAIL/image/gif/38dac4a8071f6e78fef2ed0d9c9d6cf5/gr5.sml https://s3.amazonaws.com/prod-ucs-content-store-us-east/content/pii:S0926860X16301181/gr5/THUMBNAIL/image/gif/38dac4a8071f6e78fef2ed0d9c9d6cf5/gr5.sml gr5 gr5.sml sml 5532 163 157 IMAGE-THUMBNAIL 1-s2.0-S0926860X16301181-gr6.sml https://s3-eu-west-1.amazonaws.com/prod-ucs-content-store-eu-west/content/pii:S0926860X16301181/gr6/THUMBNAIL/image/gif/c5363ae788f4c17c505428872c631ed5/gr6.sml https://s3.amazonaws.com/prod-ucs-content-store-us-east/content/pii:S0926860X16301181/gr6/THUMBNAIL/image/gif/c5363ae788f4c17c505428872c631ed5/gr6.sml gr6 gr6.sml sml 21848 163 109 IMAGE-THUMBNAIL 1-s2.0-S0926860X16301181-gr7.sml https://s3-eu-west-1.amazonaws.com/prod-ucs-content-store-eu-west/content/pii:S0926860X16301181/gr7/THUMBNAIL/image/gif/e21421e09e674ffb94686df8dd0b93ec/gr7.sml https://s3.amazonaws.com/prod-ucs-content-store-us-east/content/pii:S0926860X16301181/gr7/THUMBNAIL/image/gif/e21421e09e674ffb94686df8dd0b93ec/gr7.sml gr7 gr7.sml sml 20456 164 119 IMAGE-THUMBNAIL 1-s2.0-S0926860X16301181-gr8.sml https://s3-eu-west-1.amazonaws.com/prod-ucs-content-store-eu-west/content/pii:S0926860X16301181/gr8/THUMBNAIL/image/gif/f709f45c93866425899b97dc2139ae90/gr8.sml https://s3.amazonaws.com/prod-ucs-content-store-us-east/content/pii:S0926860X16301181/gr8/THUMBNAIL/image/gif/f709f45c93866425899b97dc2139ae90/gr8.sml gr8 gr8.sml sml 20951 153 219 IMAGE-THUMBNAIL 1-s2.0-S0926860X16301181-gr9.sml https://s3-eu-west-1.amazonaws.com/prod-ucs-content-store-eu-west/content/pii:S0926860X16301181/gr9/THUMBNAIL/image/gif/d200fc1772a480ab946d72f8e6e23b27/gr9.sml https://s3.amazonaws.com/prod-ucs-content-store-us-east/content/pii:S0926860X16301181/gr9/THUMBNAIL/image/gif/d200fc1772a480ab946d72f8e6e23b27/gr9.sml gr9 gr9.sml sml 13611 95 219 IMAGE-THUMBNAIL 1-s2.0-S0926860X16301181-fx1.jpg https://s3-eu-west-1.amazonaws.com/prod-ucs-content-store-eu-west/content/pii:S0926860X16301181/fx1/DOWNSAMPLED/image/jpeg/3285a8eea5fd0eccc680600966ef8018/fx1.jpg https://s3.amazonaws.com/prod-ucs-content-store-us-east/content/pii:S0926860X16301181/fx1/DOWNSAMPLED/image/jpeg/3285a8eea5fd0eccc680600966ef8018/fx1.jpg fx1 true fx1.jpg jpg 24480 200 500 IMAGE-DOWNSAMPLED 1-s2.0-S0926860X16301181-gr1.jpg https://s3-eu-west-1.amazonaws.com/prod-ucs-content-store-eu-west/content/pii:S0926860X16301181/gr1/DOWNSAMPLED/image/jpeg/db95af8ebdca9dd55c074c57ac268bda/gr1.jpg https://s3.amazonaws.com/prod-ucs-content-store-us-east/content/pii:S0926860X16301181/gr1/DOWNSAMPLED/image/jpeg/db95af8ebdca9dd55c074c57ac268bda/gr1.jpg gr1 gr1.jpg jpg 27059 514 339 IMAGE-DOWNSAMPLED 1-s2.0-S0926860X16301181-gr10.jpg https://s3-eu-west-1.amazonaws.com/prod-ucs-content-store-eu-west/content/pii:S0926860X16301181/gr10/DOWNSAMPLED/image/jpeg/b6ba6dca574506de75bfb64865962af0/gr10.jpg https://s3.amazonaws.com/prod-ucs-content-store-us-east/content/pii:S0926860X16301181/gr10/DOWNSAMPLED/image/jpeg/b6ba6dca574506de75bfb64865962af0/gr10.jpg gr10 gr10.jpg jpg 100625 339 565 IMAGE-DOWNSAMPLED 1-s2.0-S0926860X16301181-gr11.jpg https://s3-eu-west-1.amazonaws.com/prod-ucs-content-store-eu-west/content/pii:S0926860X16301181/gr11/DOWNSAMPLED/image/jpeg/b733fd8b6756ef82d0f4e576efa03640/gr11.jpg https://s3.amazonaws.com/prod-ucs-content-store-us-east/content/pii:S0926860X16301181/gr11/DOWNSAMPLED/image/jpeg/b733fd8b6756ef82d0f4e576efa03640/gr11.jpg gr11 gr11.jpg jpg 97900 354 565 IMAGE-DOWNSAMPLED 1-s2.0-S0926860X16301181-gr12.jpg https://s3-eu-west-1.amazonaws.com/prod-ucs-content-store-eu-west/content/pii:S0926860X16301181/gr12/DOWNSAMPLED/image/jpeg/c2f65dbdbafbfbd0b22482db2a69619f/gr12.jpg https://s3.amazonaws.com/prod-ucs-content-store-us-east/content/pii:S0926860X16301181/gr12/DOWNSAMPLED/image/jpeg/c2f65dbdbafbfbd0b22482db2a69619f/gr12.jpg gr12 gr12.jpg jpg 115557 424 565 IMAGE-DOWNSAMPLED 1-s2.0-S0926860X16301181-gr2.jpg https://s3-eu-west-1.amazonaws.com/prod-ucs-content-store-eu-west/content/pii:S0926860X16301181/gr2/DOWNSAMPLED/image/jpeg/c11fd28d45bee1b373002dcd9861c1be/gr2.jpg https://s3.amazonaws.com/prod-ucs-content-store-us-east/content/pii:S0926860X16301181/gr2/DOWNSAMPLED/image/jpeg/c11fd28d45bee1b373002dcd9861c1be/gr2.jpg gr2 gr2.jpg jpg 45159 526 678 IMAGE-DOWNSAMPLED 1-s2.0-S0926860X16301181-gr3.jpg https://s3-eu-west-1.amazonaws.com/prod-ucs-content-store-eu-west/content/pii:S0926860X16301181/gr3/DOWNSAMPLED/image/jpeg/d54f06c4aa955ca43b281abb9a95855c/gr3.jpg https://s3.amazonaws.com/prod-ucs-content-store-us-east/content/pii:S0926860X16301181/gr3/DOWNSAMPLED/image/jpeg/d54f06c4aa955ca43b281abb9a95855c/gr3.jpg gr3 gr3.jpg jpg 56572 704 659 IMAGE-DOWNSAMPLED 1-s2.0-S0926860X16301181-gr4.jpg https://s3-eu-west-1.amazonaws.com/prod-ucs-content-store-eu-west/content/pii:S0926860X16301181/gr4/DOWNSAMPLED/image/jpeg/270193a6ff702658423f789169819dde/gr4.jpg https://s3.amazonaws.com/prod-ucs-content-store-us-east/content/pii:S0926860X16301181/gr4/DOWNSAMPLED/image/jpeg/270193a6ff702658423f789169819dde/gr4.jpg gr4 gr4.jpg jpg 52122 863 376 IMAGE-DOWNSAMPLED 1-s2.0-S0926860X16301181-gr5.jpg https://s3-eu-west-1.amazonaws.com/prod-ucs-content-store-eu-west/content/pii:S0926860X16301181/gr5/DOWNSAMPLED/image/jpeg/31769180e6f209c737d7920f3334537c/gr5.jpg https://s3.amazonaws.com/prod-ucs-content-store-us-east/content/pii:S0926860X16301181/gr5/DOWNSAMPLED/image/jpeg/31769180e6f209c737d7920f3334537c/gr5.jpg gr5 gr5.jpg jpg 30812 392 376 IMAGE-DOWNSAMPLED 1-s2.0-S0926860X16301181-gr6.jpg https://s3-eu-west-1.amazonaws.com/prod-ucs-content-store-eu-west/content/pii:S0926860X16301181/gr6/DOWNSAMPLED/image/jpeg/ad7a23170475bfadef408cb278c6b4b1/gr6.jpg https://s3.amazonaws.com/prod-ucs-content-store-us-east/content/pii:S0926860X16301181/gr6/DOWNSAMPLED/image/jpeg/ad7a23170475bfadef408cb278c6b4b1/gr6.jpg gr6 gr6.jpg jpg 151181 846 565 IMAGE-DOWNSAMPLED 1-s2.0-S0926860X16301181-gr7.jpg https://s3-eu-west-1.amazonaws.com/prod-ucs-content-store-eu-west/content/pii:S0926860X16301181/gr7/DOWNSAMPLED/image/jpeg/4cca454f20042a592a893d7d5a4aa4ab/gr7.jpg https://s3.amazonaws.com/prod-ucs-content-store-us-east/content/pii:S0926860X16301181/gr7/DOWNSAMPLED/image/jpeg/4cca454f20042a592a893d7d5a4aa4ab/gr7.jpg gr7 gr7.jpg jpg 74087 468 339 IMAGE-DOWNSAMPLED 1-s2.0-S0926860X16301181-gr8.jpg https://s3-eu-west-1.amazonaws.com/prod-ucs-content-store-eu-west/content/pii:S0926860X16301181/gr8/DOWNSAMPLED/image/jpeg/4802c6bbdfbba3778767e128e264796e/gr8.jpg https://s3.amazonaws.com/prod-ucs-content-store-us-east/content/pii:S0926860X16301181/gr8/DOWNSAMPLED/image/jpeg/4802c6bbdfbba3778767e128e264796e/gr8.jpg gr8 gr8.jpg jpg 128681 525 753 IMAGE-DOWNSAMPLED 1-s2.0-S0926860X16301181-gr9.jpg https://s3-eu-west-1.amazonaws.com/prod-ucs-content-store-eu-west/content/pii:S0926860X16301181/gr9/DOWNSAMPLED/image/jpeg/a29a7cfbf5d03d2f3bea31655b4699f2/gr9.jpg https://s3.amazonaws.com/prod-ucs-content-store-us-east/content/pii:S0926860X16301181/gr9/DOWNSAMPLED/image/jpeg/a29a7cfbf5d03d2f3bea31655b4699f2/gr9.jpg gr9 gr9.jpg jpg 70030 326 753 IMAGE-DOWNSAMPLED 1-s2.0-S0926860X16301181-fx1_lrg.jpg https://s3-eu-west-1.amazonaws.com/prod-ucs-content-store-eu-west/content/pii:S0926860X16301181/fx1/HIGHRES/image/jpeg/b49cf2aeefacd1d0a95a046e2c5467f6/fx1_lrg.jpg https://s3.amazonaws.com/prod-ucs-content-store-us-east/content/pii:S0926860X16301181/fx1/HIGHRES/image/jpeg/b49cf2aeefacd1d0a95a046e2c5467f6/fx1_lrg.jpg fx1 true fx1_lrg.jpg jpg 192813 886 2213 IMAGE-HIGH-RES 1-s2.0-S0926860X16301181-gr1_lrg.jpg https://s3-eu-west-1.amazonaws.com/prod-ucs-content-store-eu-west/content/pii:S0926860X16301181/gr1/HIGHRES/image/jpeg/e1534de88c383462f73b36e67f8ca52f/gr1_lrg.jpg https://s3.amazonaws.com/prod-ucs-content-store-us-east/content/pii:S0926860X16301181/gr1/HIGHRES/image/jpeg/e1534de88c383462f73b36e67f8ca52f/gr1_lrg.jpg gr1 gr1_lrg.jpg jpg 210643 2275 1500 IMAGE-HIGH-RES 1-s2.0-S0926860X16301181-gr10_lrg.jpg https://s3-eu-west-1.amazonaws.com/prod-ucs-content-store-eu-west/content/pii:S0926860X16301181/gr10/HIGHRES/image/jpeg/ed5cea68917482281cd2da14e581c4a5/gr10_lrg.jpg https://s3.amazonaws.com/prod-ucs-content-store-us-east/content/pii:S0926860X16301181/gr10/HIGHRES/image/jpeg/ed5cea68917482281cd2da14e581c4a5/gr10_lrg.jpg gr10 gr10_lrg.jpg jpg 718074 1498 2500 IMAGE-HIGH-RES 1-s2.0-S0926860X16301181-gr11_lrg.jpg https://s3-eu-west-1.amazonaws.com/prod-ucs-content-store-eu-west/content/pii:S0926860X16301181/gr11/HIGHRES/image/jpeg/6559d0ef3b0eeb75f794afcb95acbff1/gr11_lrg.jpg https://s3.amazonaws.com/prod-ucs-content-store-us-east/content/pii:S0926860X16301181/gr11/HIGHRES/image/jpeg/6559d0ef3b0eeb75f794afcb95acbff1/gr11_lrg.jpg gr11 gr11_lrg.jpg jpg 617003 1568 2500 IMAGE-HIGH-RES 1-s2.0-S0926860X16301181-gr12_lrg.jpg https://s3-eu-west-1.amazonaws.com/prod-ucs-content-store-eu-west/content/pii:S0926860X16301181/gr12/HIGHRES/image/jpeg/8f355bfe0f029b56a8a3d36a4f935bc0/gr12_lrg.jpg https://s3.amazonaws.com/prod-ucs-content-store-us-east/content/pii:S0926860X16301181/gr12/HIGHRES/image/jpeg/8f355bfe0f029b56a8a3d36a4f935bc0/gr12_lrg.jpg gr12 gr12_lrg.jpg jpg 699174 1876 2500 IMAGE-HIGH-RES 1-s2.0-S0926860X16301181-gr2_lrg.jpg https://s3-eu-west-1.amazonaws.com/prod-ucs-content-store-eu-west/content/pii:S0926860X16301181/gr2/HIGHRES/image/jpeg/c5bc5c9f5a6dcc87e7f116b84a3907ee/gr2_lrg.jpg https://s3.amazonaws.com/prod-ucs-content-store-us-east/content/pii:S0926860X16301181/gr2/HIGHRES/image/jpeg/c5bc5c9f5a6dcc87e7f116b84a3907ee/gr2_lrg.jpg gr2 gr2_lrg.jpg jpg 362435 2327 3000 IMAGE-HIGH-RES 1-s2.0-S0926860X16301181-gr3_lrg.jpg https://s3-eu-west-1.amazonaws.com/prod-ucs-content-store-eu-west/content/pii:S0926860X16301181/gr3/HIGHRES/image/jpeg/7ab8cb9419f114774b256ce0fd2cd09c/gr3_lrg.jpg https://s3.amazonaws.com/prod-ucs-content-store-us-east/content/pii:S0926860X16301181/gr3/HIGHRES/image/jpeg/7ab8cb9419f114774b256ce0fd2cd09c/gr3_lrg.jpg gr3 gr3_lrg.jpg jpg 468575 3117 2917 IMAGE-HIGH-RES 1-s2.0-S0926860X16301181-gr4_lrg.jpg https://s3-eu-west-1.amazonaws.com/prod-ucs-content-store-eu-west/content/pii:S0926860X16301181/gr4/HIGHRES/image/jpeg/64904dd003c255880c2828e73edf3aaa/gr4_lrg.jpg https://s3.amazonaws.com/prod-ucs-content-store-us-east/content/pii:S0926860X16301181/gr4/HIGHRES/image/jpeg/64904dd003c255880c2828e73edf3aaa/gr4_lrg.jpg gr4 gr4_lrg.jpg jpg 385318 3825 1667 IMAGE-HIGH-RES 1-s2.0-S0926860X16301181-gr5_lrg.jpg https://s3-eu-west-1.amazonaws.com/prod-ucs-content-store-eu-west/content/pii:S0926860X16301181/gr5/HIGHRES/image/jpeg/f65d7a5c5d29a5c3eaebc2f257c35ca1/gr5_lrg.jpg https://s3.amazonaws.com/prod-ucs-content-store-us-east/content/pii:S0926860X16301181/gr5/HIGHRES/image/jpeg/f65d7a5c5d29a5c3eaebc2f257c35ca1/gr5_lrg.jpg gr5 gr5_lrg.jpg jpg 234338 1736 1667 IMAGE-HIGH-RES 1-s2.0-S0926860X16301181-gr6_lrg.jpg https://s3-eu-west-1.amazonaws.com/prod-ucs-content-store-eu-west/content/pii:S0926860X16301181/gr6/HIGHRES/image/jpeg/fb819a43d1b37b0767d6550a5db0a04e/gr6_lrg.jpg https://s3.amazonaws.com/prod-ucs-content-store-us-east/content/pii:S0926860X16301181/gr6/HIGHRES/image/jpeg/fb819a43d1b37b0767d6550a5db0a04e/gr6_lrg.jpg gr6 gr6_lrg.jpg jpg 1313445 3744 2500 IMAGE-HIGH-RES 1-s2.0-S0926860X16301181-gr7_lrg.jpg https://s3-eu-west-1.amazonaws.com/prod-ucs-content-store-eu-west/content/pii:S0926860X16301181/gr7/HIGHRES/image/jpeg/2a722900d3cb1097fcde7b74480a6150/gr7_lrg.jpg https://s3.amazonaws.com/prod-ucs-content-store-us-east/content/pii:S0926860X16301181/gr7/HIGHRES/image/jpeg/2a722900d3cb1097fcde7b74480a6150/gr7_lrg.jpg gr7 gr7_lrg.jpg jpg 485078 2070 1500 IMAGE-HIGH-RES 1-s2.0-S0926860X16301181-gr8_lrg.jpg https://s3-eu-west-1.amazonaws.com/prod-ucs-content-store-eu-west/content/pii:S0926860X16301181/gr8/HIGHRES/image/jpeg/d487e767d80f41fc6b46be899d0cff03/gr8_lrg.jpg https://s3.amazonaws.com/prod-ucs-content-store-us-east/content/pii:S0926860X16301181/gr8/HIGHRES/image/jpeg/d487e767d80f41fc6b46be899d0cff03/gr8_lrg.jpg gr8 gr8_lrg.jpg jpg 1550165 2323 3333 IMAGE-HIGH-RES 1-s2.0-S0926860X16301181-gr9_lrg.jpg https://s3-eu-west-1.amazonaws.com/prod-ucs-content-store-eu-west/content/pii:S0926860X16301181/gr9/HIGHRES/image/jpeg/40ec9868ee446c9dbeb549a59186ee6d/gr9_lrg.jpg https://s3.amazonaws.com/prod-ucs-content-store-us-east/content/pii:S0926860X16301181/gr9/HIGHRES/image/jpeg/40ec9868ee446c9dbeb549a59186ee6d/gr9_lrg.jpg gr9 gr9_lrg.jpg jpg 449318 1443 3333 IMAGE-HIGH-RES 1-s2.0-S0926860X16301181-mmc1.pdf https://s3-eu-west-1.amazonaws.com/prod-ucs-content-store-eu-west/content/pii:S0926860X16301181/mmc1/MAIN/application/pdf/ab71cd381f4fe4432a9131a1a8dfbb8f/mmc1.pdf https://s3.amazonaws.com/prod-ucs-content-store-us-east/content/pii:S0926860X16301181/mmc1/MAIN/application/pdf/ab71cd381f4fe4432a9131a1a8dfbb8f/mmc1.pdf mmc1 mmc1.pdf pdf false 210870 APPLICATION 1-s2.0-S0926860X16301181-si1.gif https://s3-eu-west-1.amazonaws.com/prod-ucs-content-store-eu-west/content/pii:S0926860X16301181/STRIPIN/image/gif/77a5d85e962fde36459cd752d0ed774d/si1.gif https://s3.amazonaws.com/prod-ucs-content-store-us-east/content/pii:S0926860X16301181/STRIPIN/image/gif/77a5d85e962fde36459cd752d0ed774d/si1.gif si1 si1.gif gif 1276 39 272 ALTIMG 1-s2.0-S0926860X16301181-si2.gif https://s3-eu-west-1.amazonaws.com/prod-ucs-content-store-eu-west/content/pii:S0926860X16301181/STRIPIN/image/gif/011d282ebf67e9c6ef2642fa4f9ee80e/si2.gif https://s3.amazonaws.com/prod-ucs-content-store-us-east/content/pii:S0926860X16301181/STRIPIN/image/gif/011d282ebf67e9c6ef2642fa4f9ee80e/si2.gif si2 si2.gif gif 836 39 166 ALTIMG APCATA 15800 S0926-860X(16)30118-1 10.1016/j.apcata.2016.03.008 Elsevier B.V. Fig. 1 XRD patterns of calcined Ni-based catalysts (a) Ni/Al2O3; (b) Ni/ZnAl2O4; (c) Ni/ZnO-Al2O3. (■) ZnO; (♦) ZnAl2O4; (▲) NiO; (□) Al2O3. Fig. 1 Fig. 2 XRD patterns of reduced Ni-based catalysts obtained between (A) 2θ=20–80º; (B) 2θ=40–55º; (a) Ni/Al2O3; (b) Ni/ZnAl2O4; (c) Ni/ZnO-Al2O3. (■) ZnO; (▲) ZnAl2O4; (*) Nio; (○) NiZn; (●) Ni4Zn. Fig. 2 Fig. 3 Ethanol conversion (Xethanol) and product distributions versus TOS for SR of ethanol at 773K under H2O/ethanol molar ratio=3.0 over: (a) Ni/Al2O3; (b) Ni/ZnAl2O4; (c) Ni/ZnO-Al2O3. (Mass of catalyst=20mg and residence time=0.02g.s/mL). Fig. 3 Fig. 4 Ethanol conversion (Xethanol) and product distributions versus TOS over Ni/ZnO-Al2O3 catalyst for SR of ethanol at (a) 673K; (b) 1073K. (Mass of catalyst=20mg and residence time=0.02g.s/mL). Fig. 4 Fig. 5 Ethanol conversion (Xethanol) and product distributions versus TOS for SR of ethanol at 773 K over Ni/ZnO-Al2O3 catalyst reduced at 873K. (Mass of catalyst=20mg and residence time=0.02g.s/mL). Fig. 5 Fig. 6 SEM images after SR of ethanol at 773K during 28h TOS over (a) Ni/Al2O3; (b) Ni/ZnAl2O4; (c) Ni/ZnO-Al2O3; SR of ethanol over Ni/ZnO-Al2O3 catalyst at (d) 673K; (e) 1073K. Fig. 6 Fig. 7 Ni K-edge XANES spectra obtained during reduction under 5% H2/He mixture up to 1023K of: (a) NiO; (b) Ni/ZnO2-Al2O3. Fig. 7 Fig. 8 Ni K-edge XANES spectra of 15% Ni/ZnO2·Al2O3 under different conditions. Spectra recorded at: (a) reduction temperature under 5% H2 / He mixture; (b) reaction temperature, under 5% H2(He) flow; (c) reaction temperature at the beginning of SR of ethanol; (d) reaction temperature, after SR of ethanol for 4h; (e) Evolution of Ni species given by linear combination of Ni K-edge XANES spectra (LC-XANES) of Ni/ZnO2-Al2O3 catalyst under both reduction treatment and SR of ethanol conditions, at different temperatures. Fig. 8 Fig. 9 Correlation of Ni phase species given by linear combination of Ni K-edge XANES spectra (LC-XANES) of Ni/ZnO2-Al2O3 catalyst under SR of ethanol with mass spectra of reaction products.. Fig. 9 Fig. 10 Ni and Zn K-edge k2 weighed EXAFS spectra of Ni/ZnO2-Al2O3 catalyst. (1) Experimental FEFF fittings; (2) Fourier filtered (backtransformed) spectra; (3) k2- weighed Fourier transformed spectra, under the following in-situ conditions: (a) 1023K reduced passivated and spectra recorded at 298 K; (b) after activation for 1h under H2 flow, at 773K; (c) under SR of ethanol conditions at 773K for 4h; (d) after cooling to 298K, under He flow. Conditions for (i) activation: 5% H2 (He) 86mLmin−1, heating rate during reduction ramp: 5Kmin−1. (ii) SR of ethanol 86mLmin−1 EtOH:H2O 1:2 (He balance), at 773K. Fig. 10 Fig. 11 Ni and Zn K-edge k2 weighed EXAFS spectra of Ni/ZnAl2O4 catalyst. (1) Experimental FEFF fittings; (2) Fourier filtered (backtransformed) spectra; (3) k2- weighed Fourier transformed spectra, under the following in-situ conditions: (a) 1023K reduced passivated Ni/ZnAl2O4, at 298K; (b) after activation for 1h under H2 flow, at 773K; (c) under SR of ethanol conditions at 773K for 4h; (d) after cooling to 298K, under He flow. Conditions for (i) activation: 5% H2 (He) 86mLmin−1, heating rate during reduction ramp: 5Kmin−1. (ii) SR of ethanol reaction: 86mLmin−1 EtOH:H2O 1:2 (He balance), at 773K. Fig. 11 Fig. 12 Scheme of phase transformation during Ni/ZnAl activation (reduction) and reaction step. Fig. 12 Table 1 BET surface area and metallic Ni crystallite size of Ni-based catalysts. Table 1 Catalyst Surface area(m2/g) dNi (nm) Ni/Al2O3 161 4 Ni/ZnAl2O4 46 11 Ni/ZnO-Al2O3 61 16 Table 2 Amount of carbon deposited on Ni-based catalysts after different reaction conditions, as determined by TGA, using 5% O2:He and a heating rate of 10K/min. Table 2 Catalyst Reaction conditions mg carbon/g catal/h Ni/Al2O3 SR − 773K 2.3 Ni/ZnAl2O4 SR − 773K 14.7 Ni/ZnO-Al2O3 SR − 773K 0.0 Ni/ZnO-Al2O3 SR − 673K 20.1 Ni/ZnO-Al2O3 SR − 1073K 0.0 Ni/ZnO-Al2O3 a SR − 773K 3.1 a Catalyst reduced at 873K Table 3 Best fit results of EXAFS fittings for the Ni/ZnO-Al2O3 catalyst under either reducing or SR of ethanol conditions (as indicated in the table). S0 =0.9. Fits in k2 weight, k-space. Table 3 model conditions R(Å) N d D(nm) f σ2 (10−3 Å2) e0 (eV) r (%) c Δr Δk Ni fcc b Ni foil a 2.482(0.003) Ni-Ni: 12 b 5.4(0.1) −4.9(0.6) 0.2 1.8–2.8 2.5–15.0 Ni4Zn fcc e 298K 2.501(0.008) Ni-Ni: 4.6(0.6)Ni-Zn: 0.9(0.6) 1.2(0.02) 6.1(0.9) −6(1) 0.3 1.8–3.6 773K/H2 2.507(0.008) Ni-Ni: 7.8(0.8)Ni-Zn: 2.4(0.7) 3.2(0.1) 18(1) −7(1) 0.9 773K/SR/4h 2.51(0.01) Ni-Ni: 9(1)Ni-Zn: 2.7(1.5) 4.2(0.3) 18(2) −6(2) 3 SR/4h/298K 2.51(0.01) Ni-Ni: 8.0(1.1)Ni-Zn: 2.8(1.2) 3.4(0.2) 8(1) −5(2) 3.4 Zn foil a 2.64(0.01) Zn-Zn(short): 6 b 10.9(0.4) −1.5(1.6) 0.5 1.5–2.8 3.5–15.0 NiZn tetragonal e 298K Zn-Ni: 2.49(0.01)Zn-O: 1.91(0.04) Zn-Ni: 2.4(0.4)Zn-O: 2.4(0.4) Zn-Ni: 4(1)Zn-O: 7(1) −1(2) 1.5 1.2–2.5 2.5–15.0 773K/H2 Zn-Ni: 2.48(0.01)Zn-O: 1.94(0.01) Zn-Ni: 2.7(0.9)Zn-O: 2.5(0.3) Zn-Ni: 7(2)Zn-O: 16(4) −0.4(2.0) 1.1 773K/SR/4h Zn-Ni: 2.505(0.009)Zn-O: 1.98(0.01) Zn-Ni: 1.6(0.7)Zn-O: 2.8(0.3) Zn-Ni: 5.5(1.1)Zn-O: 14(5) 1.5(1.3) 0.9 1.8–2.5 SR/4h/298K Zn-Ni: 2.512(0.006)Zn-O: 1.995(0.008) Zn-Ni: 1.6(0.4)Zn-O: 3.2(0.2) Zn-Ni: 3.4(0.8)Zn-Zn: 8(3) 2.0(0.9) 0.06 a From spectra of Metal foils placed in between the I0 and I1 ionization chambers. b Parameters constrained to be equal to 12 (Ni foil) and 6 (Zn foil). For Zn foil S0 was set to 1, Δr = 1.8-2.8 Å. c The average mismatch between experimental and fitted spectra. d According to our model for fcc Ni4Zn the theoretical values for the degenerescence of Ni-Ni, Ni-Zn, Zn-Ni and Zn-O are, respectively, 12, 6, 12 and 4. e Ni k-edge fits considering a Ni rich phase (Ni4Zn); Zn K-edge considering a tetragonal NiZn phase. f From reference [41], the correlation between dispersion degree (the fraction of atoms located at the particle surface from the total amount of atoms in the sample) and the average number of neighboring atoms is log(% dispersion) = −0.130(±0.005) x(NPt-Pt) + 2.58 (±0.04) where NPt-Pt is EXAFS estimated average number of neighboring around Pt, which is face centered cubic. It is then assumed that correlation also applies to the Co particles in our catalysts, assumed to be fcc. The relation between the dispersion and the average particle diameters was assumed to be 11.616 × (100 × % dispersion). Table 4 Best fit results of EXAFS fittings for the Ni/ZnAl2O4 catalyst under either reducing or steam reform conditions (as indicated in the table). S0 =0.9. Fits in k2 weight, k-space. Table 4 Model(K-edge) conditions R(Å) N d D(nm) b σ2 (10−3 Å2) e0 (eV) r (%) c Δr Δk Ni fcc(Ni) d 298K Ni-Ni: 2.501(0.008) Ni-Ni: 7(1) 2.6(0.1) 5.7(0.9) −3(2) 0.2 1.8–3.6 2.5–15.0 773K/H2 Ni-Ni: 2.48(0.01) Ni-Ni: 9(1) 5.0(0.3) 14(1) −6(1) 1.2 773K/SR/4h Ni-Ni: 2.46(0.01) Ni-Ni: 7(1) 2.7(0.1) 13(1) −8(1) 0.8 SR/4h/298K Ni-Ni: 2.49(0.01) Ni-Ni: 6(1) 1.9(0.1) 5.7(1.4) −3.0(2.4) 3.1 NiZn tetragonal(Zn) d 298K Zn-Al: 3.363(0.003)Zn-O: 1.961(0.005) Zn-Al: 13(1)Zn-O: 3.6(0.5) 3.5(0.9) 11(1) 1.9 1.5–3.3 3.5–13.5 773K/H2 Zn-Al: 3.40(0.01)Zn-O: 1.97(0.01) Zn-Al: 9(1)Zn-O: 3.3(0.5) 7(1) 12(1) 2.1 773K/SR/4h Zn-Al: 3.37(0.03)Zn-O: 2.02(0.04) Zn-Al: 11(4)Zn-O: 3(1) 9(5) 13(3) 1.1 SR/4h/298K Zn-Ni: 3.37(0.01)Zn-O: 2.00(0.01) Zn-Al: 3.8(1.8)Zn-O: 3.2(0.6) 4(1) 12(1) 4.2 aAccording to our model for fcc Ni4Zn the theoretical values for the degenerescence of Ni-Ni, Ni-Zn, Zn-Ni and Zn-O are, respectively, 12, 6, 12 and 4. b From reference [41], the correlation between dispersion degree (the fraction of atoms located at the particle surface from the total amount of atoms in the sample) and the average number of neighboring atoms is log(% dispersion)=−0.130(±0.005) x(NPt-Pt)+2.58 (±0.04) where NPt-Pt is EXAFS estimated average number of neighboring around Pt, which is face centered cubic. It is then assumed that correlation also applies to the Co particles in our catalysts, assumed to be fcc. The relation between the dispersion and the average particle diameters was assumed to be 11.616 × (100 × % dispersion). c The average mismatch between experimental and fitted spectra. d Ni k-edge fits considering a Ni fcc phase; Zn K-edge considering a cubic ZnAl2O4 phase. Effect of Zn addition on the performance of Ni/Al2O3 catalyst for steam reforming of ethanol Chatla Anjaneyulu a Lídia O.O.da Costa b Mauro C. Ribeiro b 1 Raimundo C. Rabelo-Neto b Lisiane V. Mattos c A. Venugopal a Fábio B. Noronha b ⁎ a Inorganic and Physical Chemistry Division, Indian Institute of Chemical Technology, Hyderabad 500607, India Inorganic and Physical Chemistry Division Indian Institute of Chemical Technology Hyderabad 500607 India b National Institute of Technology, Catalysis Division, Av. Venezuela 82, Rio de Janeiro 20081-312, Brazil National Institute of Technology Catalysis Division Av. Venezuela 82 Rio de Janeiro 20081-312 Brazil c Fluminense Federal University, Chemical Engineering Department, Rua Passo da Pátria 156, Niterói 24210-240, Brazil Fluminense Federal University Chemical Engineering Department Rua Passo da Pátria 156 Niterói 24210-240 Brazil ⁎ Corresponding author. 1 Present address: Fluminense Federal University, Department of Chemistry, Rua Des. Ellis Hermydes Figueira 783, Volta Redonda, 27213, Brazil. Graphical abstract A detailed investigation of the effect of Zn on the performance of supported Ni-based catalysts for steam reforming of ethanol is presented in this paper. A Ni/Al2O3 and two ZnO/Al2O3 supported Ni catalysts with different Zn/Al ratio were prepared. For the Ni/Al2O3 and Ni/ZnAl2O4 (Zn/Al=0.5) catalysts, only metallic Ni particles were identified after reduction. Under ethanol steam reforming conditions, carbon filaments were formed during the reaction, which led to deactivation of the catalyst. It was shown that Zn present in excess (Ni/ZnO-Al2O3) may form an alloy with compositions ranging from Zn-rich tetragonal NiZn and Ni-rich cubic Ni4Zn. The formation of NiZn alloy with different compositions plays a key role in catalyst performance, improving resistance to coke formation and its stability. Keywords Hydrotalcite Ni-Zn alloy Hydrogen production Steam reforming of ethanol Catalyst deactivation Carbon formation 1 Introduction Hydrogen production via the catalytic steam reforming (SR) of ethanol has been extensively studied [1]. Currently the greatest challenge in developing new catalysts for SR of ethanol is improving the stability of the catalyst. Catalyst deactivation has been generally attributed to the deposition of carbonaceous species on the catalyst surface, although sintering and oxidation of metallic particles have also been reported [2]. Many recent investigations have focused on applying different strategies to either hinder carbon formation or to react it from the surface during SR of ethanol [2]. This may be achieved by the addition of a second metal that can induce changes in both catalytic and adsorptive properties. This may be due to a number of factors, including (i) the dilution or the coverage of a fraction of the surface of the host metal (i.e., geometric effects). In that case, the size of the ensemble decreases, and this inhibits the formation of carbon [2]; (ii) changes in the electronic structure of the metal via alloying, which influences the intrinsic activity (i.e., electronic effects); (iii) increases in metal reducibility; (iv) inhibition of metal particle sintering; or (v) the prevention of metal oxidation by the feed. In all cases, the addition of a second metal induces changes in selectivity, affecting more severely reactions involving CC bond scission and that may lead to carbon deposition. Bimetallic catalysts have been extensively studied for ethanol conversion reactions. Different bimetallic catalysts were investigated such as Ni-Cu [3–10], Ni-Rh [11,12], Ni-Pt [13,14], Ni-Mo [15], Ni-Zn [16], Ni-Co [17,18], Co-Cu [19], Co-Fe [20,21], Co-noble metal [22,23], Rh-noble metal [24], Pt-Ru [25], Pt-Sn [26], Pd-Zn [27]. Most of these studies reported changes in activity and selectivity as a function of the second metal. CuNiZnAl mixed oxides with various Cu/Ni ratios have been tested for oxidative steam reforming (OSR) of ethanol [8]. The dehydrogenation of ethanol to acetaldehyde was favored on Cu-rich catalysts. The addition of Ni promoted the reactions involving CC bond scission to H2, CO2, CO and CH4. The changes in product distribution were attributed to an increase in the density of states at the Fermi level in Ni-rich catalysts. Casanovas et al. [27] investigated the effect of alloy formation on the performance of Pd/ZnO for SR and OSR of ethanol. A Pd/SiO2 catalyst was also used for comparison. For the Pd/SiO2 catalyst, ethanol decomposition to H2, CO and CH4 was the main reaction pathway during SR and OSR of ethanol. On the other hand, H2, CO2, CH4, acetaldehyde and dimethylketone were formed over a Pd/ZnO catalyst. These results indicate that ethanol dehydrogenation to acetaldehyde followed by steam reforming takes place over ZnO-supported Pd catalyst. The formation of a PdZn alloy, as identified by XRD and HRTEM, promoted the dehydrogenation of ethanol to acetaldehyde, the first step of the SR of ethanol. Homs et al. [16] studied the performance of 10wt.%Ni/ZnO for the SR of ethanol. H2, CO2 and CH4 were the main products observed. XRD analysis of Ni/ZnO catalyst reduced at 673K revealed the formation of NiZn alloy with different compositions. However, after the SR at 723K, the diffraction lines corresponding to NiZn alloys were no longer detected and only those that were characteristic of metallic Ni were observed. Unfortunately, the authors did not investigate whether carbon deposits were formed during those tests. In fact, there are few studies of the effect of metal addition on carbon formation. Fierro et al. [3] compared the long term stability of Ni/SiO2 and Ni-Cu/SiO2 catalysts for the OSR of ethanol. The monometallic catalyst significantly deactivated during time-on-stream (TOS). The selectivity to H2 decreased whereas the selectivity to acetaldehyde and ethylene (as well as the formation of carbon) increased. The bimetallic catalyst remained quite stable. The authors suggested that the addition of Cu inhibited the formation of Ni carbide, which is considered to be a precursor for the growth of carbon filaments. The addition of Cu to a Ni/SiO2 catalyst significantly decreased the formation of carbon during SR of ethanol [9]. In this case, the authors proposed that the presence of Cu prevented Ni particles from sintering. This eliminated the large ensembles of Ni metal atoms that favor the formation of carbon deposits. The addition of Mo to a Ni/Al2O3 catalyst also decreased the amount of carbon deposited [15]. According to the authors, Mo species prevented the growth of Ni particles, thereby improving catalyst stability. However, no information about alloy formation was provided. The addition of a second metal may also inhibit metal oxidation. To avoid carbon deposition during the SR reaction, one strategy adopted has been the addition of oxygen to the feed as has been employed for OSR and POX. However, this may contribute to the oxidation of the metal particles, which can result in losses in activity as well as changes in selectivity [22]. A Co/SiO2 catalyst deactivated during OSR of ethanol, which was attributed to the oxidation of the surface of the Co particles by oxygen from the feed [22]. The addition of a noble metal (e.g., Rh, Ru) stabilized Co in the reduced state (i.e., the active phase for SR), thus preventing the oxidation of cobalt particles and, in turn, improving catalyst stability. Temperature-programmed XANES experiments of Co/CeO2-Al2O3 and Co-Pt/CeO2-Al2O3 under SR and OSR of ethanol revealed deep oxidation of cobalt particles [28]. However, the fraction of reduced Co was recovered at high temperature only for the bimetallic catalyst. Therefore, regardless of the fact that alloy-based catalysts have been extensively studied for the SR of ethanol, a survey of the literature does not provide experimentally coherent trends about whether or not there should be any correlation between alloy formation and the resistance to carbon deposition for ethanol conversion reactions. That apparent lack of agreement may be connected to issues related to actual alloy formation/stability during ethanol SR conditions, as well as the uniformity of the alloy composition in the active catalyst. Those issues should be better addressed by observing catalyst phase composition dynamics during both activation and reaction via in-situ studies. Thus, the aim of this work was to study the catalytic performance of Ni-based catalysts for SR of ethanol by in situ X-ray absorption spectroscopy experiments, among other more standard characterization techniques. Different supported Ni catalysts were prepared in order to investigate the formation of a NiZn alloy. 2 Experimental 2.1 Catalyst preparation A solution containing the desired amount of Zn(NO3)2·6H2O and Al(NO3)3.9H2O (Zn:Al=2:1 molar ratio) and another solution containing the precipitating agents (NaOH and Na2CO3) were added slowly and simultaneously into a beaker containing distilled water, while maintaining the pH constant at ∼9 under vigorous stirring at room temperature [29]. Thus, the precipitate was thoroughly washed with distilled water until the pH decreased to the pH of distilled water. The gel was filtered, dried at 373K for 12h and subsequently calcined in air at 1073K for 5h (ZnO-Al2O3). Al2O3 was also prepared for the purpose of comparison following the same procedure as previously described. Another ZnAl sample was synthesized by using a solution containing Al(NO3)3·9H2O and Zn(NO3)2·6H2O with a Zn:Al molar ratio of 1:2. The precipitation was carried out by maintaining the temperature at 323K and the pH constant at 7.5 throughout the addition of a NH4OH (50v/v%) solution. The gel obtained was aged overnight and then washed with distilled water. Finally the gel was dried at 383K and calcined at 1073K in air flow for 8h (ZnAl2O4) [30]. Ni/Al2O3, Ni/ZnO-Al2O3 and Ni/ZnAl2O4 catalysts were prepared by wet impregnation. The required amounts of metal salt solutions (Ni(NO3)2 6H2O) were used to yield 15wt.% of Ni. The solutions were dried with constant stirring at 373K until the point of dryness, further dried in an oven at 373K for 12h, and then calcined in static air at 723K. 2.2 BET surface area The BET surface areas of the samples were measured using a Micromeritics ASAP 2020 analyzer by nitrogen adsorption at the boiling temperature of liquid nitrogen. 2.3 X-ray diffraction (XRD) X-ray powder diffraction pattern of the calcined and reduced/passivated samples were obtained with CuKα radiation (λ=1,5406Å) using a RIGAKU diffractometer. Data were collected over the 2θ range of 20–80° at a scan rate of 0.04°/step and a scan time of 1s/step. For the XRD analysis of reduced catalysts, the calcined samples were reduced under pure hydrogen (30mL/min) at 873 or 1023K for 1h (same reduction conditions used for the catalytic test), purged under N2 at the same temperature for 30min and cooled to 298K. Then, the reactor was maintained at 209K for 1h, using a mixture of isopropyl alcohol and liquid nitrogen and the catalyst was passivated with a mixture of 5% O2 in helium. The Scherrer equation was used to estimate the crystallite mean diameter of metallic Ni and NiZn particles, using the lines at 2θ=51.8 (Ni°) and 51.0 (NiZn). 2.4 Thermogravimetric analysis (TG) Temperature programmed oxidation (TPO) experiments were performed using a TA Instruments TGA analyzer (SDT Q 600) in order to quantify the amount of carbon formed over the catalyst. Approximately 10mg of spent catalyst was heated under air flow from room temperature to 1173K at a heating rate of 20K/min and the weight change was measured. 2.5 Scanning electron microscopy (SEM) SEM analyses of the fresh and spent catalysts were carried out using a FEI Inspect S scanning electron microscope equipped with a secondary electron analyzer. The microscope was also equipped with an EDAX energy dispersive spectrometer (EDS). 2.6 X-ray absorption spectroscopy (XAS) In-situ XAS experiments were performed at the D04B-XAFS − 1 beamline of the Brazilian Synchrotron Light Source (LNLS, Campinas). Typically, a mixture containing 20mg of the sample and 80mg of boron nitride was pressed and the resulting wafers were then placed into a sample holder located inside a quartz tubular reactor and temperature was controlled by a furnace. X-ray absorption near edge spectra (XANES) were measured at either the Ni or Zn K edge (E0 =8.333 keV and 9.659 keV, respectively) during reduction. The sample was heated under a 5% H2/He mixture at 5Kmin−1 up to the final reduction temperatures used in this study (873 or 1023K), and then held for 1h at those temperatures. The H2/He mixture was then replaced by the reactant mixture containing 80% He, 15% H2O, 5% ethanol at the reaction temperatures used in this study (673 or 773K), and held for 1h (i.e., SR conditions). The downstream gas was analyzed by a mass spectrometer model OMNISTAR GSD 320 (Pfeiffer). For the extended X-rays absorption fine structure (EXAFS) experiments, the samples were previously reduced at 1023K under pure H2 and then passivated using the same procedure previously described in XRD section. The pre-treated samples were then activated in-situ activated under a 5% H2/He mixture at 5Kmin−1 up to 773K for 1h, and subsequently exposed to a flow of H2O/Ethanol with a molar ratio of 3:1at that same temperature for 4h. EXAFS spectra were then recorded, successively, in (i) the passivated sample at room temperature, prior to any further in-situ treatment; (ii) after 1h activation at 773K, under dilute H2 flow, (iii) after 4h under a flow of an Ethanol:H2O (He) mixture at 773K and then (iv) after the sample was cooled to room temperature under flowing He. XANES spectra were treated by pre-edge background subtraction using a first order linear function. Following background subtraction, the normalized XANES spectra were then trimmed to a suitable energy range (c.a.100eV above the absorption edge). The Ni-containing phase composition during sample activation and reaction was analyzed by the linear combination method using normalized Ni K-edge XANES spectra (LC-XANES) within the 8.3–8.43 keV energy range. The references used for the fitting procedure were Ni foil and NiO (references for the Ni° and Ni2+states, respectively). Data reduction for EXAFS spectra was made using the WinXAS software [31]. Baseline correction for Ni and Zn K-edges were made by using a Victoreen function in the 8.6–9.0 keV and 9.6–10 keV ranges, respectively. Pre-edge regions were corrected by using a first order function. Edge jumps were calibrated to the first inflection point in the edge of the reference used. The k2χ(k) functions were Fourier transformed (and back-transformed to generate the first coordination shell filtered k2χ(k) functions) within a 1.8–2.8Å Hanning window (unless explicitly stated otherwise). EXAFS k2-space fitting was performed using the FEFF 6 software [32], by considering the amplitudes and phase shifts generated from the scattering patterns through the first coordination shell of theoretical models of NiZn alloys. The Ni edge was modeled by a fcc Ni4Zn alloy (ICSD 647139). The Zn edge was better modeled by considering the presence of both ZnAl2O4 and a tetragonal NiZn alloy (ICSD 105469) phases. These models were chosen as they were detected in the diffractogram of the catalyst after reduction at 1023K, under pure H2, followed by passivation under 5%O2/He mixture as previously described in the XRD section. The Ni4Zn phase was regarded to be a Ni fcc arrangement with six of the eight corners occupied by Zn atoms. The distances were then recalculated from the lattice parameter (a=3.5694Å) obtained from the XRD pattern, being Ni–Ni and Ni-Zn interatomic distances both equal to 2.5237Å (1.4% longer than the actual Ni–Ni bond distances). The NiZn phase is a tetragonal configuration (a=b=2.76Å; c=3.193), with unit cell corners occupied by Ni and its core occupied by a Zn atom. The spectra were represented in R-space by Fourier transformed k2.χ(k) functions within a Hanning window. The first coordination shell fits were compared to the filtered, back transformed spectra. Data fitting allowed the estimation of structural parameters such as Nm, R and σdw, which are the number of neighboring scatterers around the absorber atom, the interatomic bond lengths and the Debye-Waller factor. 2.7 Catalytic tests SR was performed using a fixed-bed quartz reactor at atmospheric pressure. Prior to reaction testing, catalysts were reduced at 1023K for 1h and then purged under N2 at the same temperature for 30min. The reactions were carried out at 773K and a H2O/ethanol molar ratio of 3.0 for all catalysts. Ni/ZnO-Al2O3 catalyst was also tested at different reaction temperatures (673 and 1073K) and reduction temperatures (873 or 1023K). The reactant mixture (2.5% ethanol; 7.5% water, 90.0% nitrogen) was obtained by flowing two N2 streams (30mL/min) through each saturator containing ethanol and water separately. The saturators were maintained at the temperature required to obtain the desired H2O/ethanol molar ratio. In order to observe the deactivation of the catalyst within a short period of time, a small amount of catalyst was used (20mg). The samples were diluted with SiC (SiC mass/catalyst mass=3.0). The catalysts were exposed to the reaction mixture during 28h time on stream (TOS). The reaction products were analyzed by gas chromatography (Micro GC Agilent 3000A containing three channels for three thermal conductivity detectors (TCD) and three columns: a molecular sieve, a plot-Q and an OV-1 column). The ethanol conversion and product distribution were determined from: (1) X e t h a n o l = ( n e t h a n o l ) f e d − ( n e t h a n o l ) e x i t ( n e t h a n o l ) f e d × 100 (2) S x = ( n x ) p r o d u c e d ( n t o t a l ) p r o d u c e d × 100 where (nx)produced =mol of x produced (x=hydrogen, CO, CO2, methane, acetaldehyde or ethene) and (ntotal)produced =mol of H2 +mol of CO+mol of CO2 +mol of methane+mol of acetaldehyde+mol of ethene (the moles of water produced are not included). 3 Results and discussion 3.1 Characterization of Ni supported catalysts Table 1 lists the BET surface area of the samples. The Ni/Al2O3 catalyst exhibited the highest surface area whereas the presence of ZnO decreased the surface area. The XRD patterns of the calcined Ni-based samples are shown in Fig. 1 . The diffractogram of Ni/Al2O3 indicates that alumina is amorphous (curve a). The diffractogram of Ni/ZnO-Al2O3 exhibits lines typical of ZnO (2θ=31.8, 34.4, 36.3, 47.5, 56.6, 62.8, 66.3, 67.9, 69.0°) (curve c). The shoulder at 2θ=31.2 and 37.0° and the broad lines at 2θ=58.7 and 64.5° indicate the presence of ZnAl2O4 (JCPDF 05–0669). The broad diffraction line at 2θ=43.9° is likely due to the overlapping of NiO and ZnAl2O4 phases. For Ni/ZnAl2O4, the diffractogram displayed only lines corresponding to NiO and ZnAl2O4 phases (curve b). These results show that depending on the Zn:Al ratio used, either isolated ZnO particles or a ZnAl2O4 spinel structure may be obtained. When the Zn:Al ratio is low, zinc is inserted into the alumina structure leading to the formation of the spinel structure. Increasing the Zn:Al ratio, zinc is segregated forming ZnO particles. In addition, the preparation method also significantly affected the NiO crystallite size. The lines characteristic of NiO were not clearly detected on the diffractogram of Ni/ZnO-Al2O3, although they can be observed in Ni/ZnAl2O4. Fig. 2 A shows the diffractograms obtained over the 2θ range of 20–80° of the Ni-based catalysts after reduction. An expanded view of the diffratograms for 2θ range of 20–80° is shown in Fig. 2B. For Ni/Al2O3, the reduction treatment led to the appearance of lines at 2θ=44.5 and 51.8° associated with Ni°, revealing that NiO was completely reduced under hydrogen at 1023K (curve a). For the Ni/ZnO-Al2O3 sample, the intensity of the lines typical of the ZnAl2O4 phase (2θ=31.3, 36.8, 55.6, 59.3, 65.3, 74.1, 77.5°) increased, whereas the intensity of the lines corresponding to ZnO phase at 2θ=31.7, 34.4, 36.3, 56.6, 62.7, 68.2, 74.8° significantly decreased (curve c). These results suggested that ZnO migrated to the alumina structure during reduction, producing the ZnAl2O4 phase. Similar results were obtained by Vizcaino et al. [33] for a NiZnAl catalyst with Zn:Al ratio of 4.0. In addition, diffraction lines at 2θ=43.6, 46.8 and 51.0° were also observed, which could be associated with NiZn (JCPDF 06–0672) and Ni4Zn (ICSD 647139) phases. There is also a shoulder at 2θ=44.3° that might be attributed to metallic Ni that was not alloyed with zinc. The diffractogram of Ni/ZnAl2O4 showed only lines characteristic of ZnAl2O4 and metallic Ni phases (curve b). The NiZn phase was also observed in the X-ray diffractogram of a 10wt.% Ni/ZnO sample after reduction at 673K [16]. The lines at 2θ=43.7, 44.2, 46.9 and 51.28° were attributed to NiZn alloys with variable compositions. Augustin et al. [34] carried out XRD analysis of a Ni/ZnAl2O4 catalyst after calcination and reduction. The XRD diffraction patterns of the calcined sample also revealed the presence of ZnAl2O4 and NiO phases. The ZnO phase was not detected. After TPR under a 5% H2 in He at 973K, the XRD patterns showed the lines characteristic of Ni° and ZnAl2O4 phases. However, the NiZn bimetallic phase was not detected. Our results are in agreement with the literature. In our work, the XRD experiments revealed that the calcined NiO/ZnO-Al2O3 sample is represented by NiO particles deposited over alumina containing island of ZnO particles. In fact, the presence of ZnO and NiO particles in close contact leads to the formation of NiZnx alloy during reduction. In the case of the Ni/ZnAl2O4 catalyst, Zn is retained in the alumina structure and thus, NiZn alloying did not occur. Table 1 listed the crystallite size of metallic Ni and NiZn phase for all catalysts. The crystallite size of metallic Ni on Ni/Al2O3 and Ni/ZnAl2O4 catalysts (4 and 11nm, respectively) was smaller than that for NiZn alloy on Ni/ZnO-Al2O3 catalyst (16nm). 3.2 SR of ethanol over Ni supported catalysts The ethanol conversion and product distributions as a function of TOS for Ni-based catalysts during SR of ethanol at 773K under H2O/ethanol ratio=3 are shown in Fig. 3 . Ni/Al2O3, Ni/ZnAl2O4 and Ni/ZnO-Al2O3 catalysts exhibited high initial ethanol conversion (83, 100 and 99%, respectively). For Ni/Al2O3 and Ni/ZnAl2O4 catalysts, H2 and CO2 were the main products formed along with CO, CH4 and small amounts of acetaldehyde and ethylene. These products suggest the occurrence of SR of ethanol, ethanol decomposition, ethanol dehydrogenation and ethanol dehydration reactions. Only H2, CO, CO2 and small amounts of CH4 were detected for Ni/ZnO-Al2O3 catalyst, indicating that SR of ethanol is the main reaction taking place. Ni/Al2O3 and Ni/ZnAl2O4 catalysts significantly deactivated during reaction at 773K. However, ethanol conversion and product distributions remained quite constant during 28h of TOS for the Ni/ZnO-Al2O3 catalyst. Since the Ni/ZnO-Al2O3 catalyst exhibited the highest stability for SR of ethanol at 773K, this catalyst was studied in greater detail. This catalyst was tested for SR of ethanol under different reaction conditions (reaction temperatures: 673 and 1073K; catalyst reduction temperature: 873K). Fig. 4 shows the ethanol conversion and product distributions as a function of TOS for Ni/ZnO-Al2O3 catalyst during SR at 673 and 1073K under H2O/ethanol ratio=3. The catalyst significantly deactivated during reaction at 673K, whereas ethanol conversion remained quite constant during SR at 1073K. Therefore, the stability of Ni/ZnO-Al2O3 catalyst is significantly affected by the reaction temperature. Increasing the reaction temperature promoted the stability of the catalyst. For the low reaction temperature, H2, CO, and CH4 were the main products formed with small amounts of CO2, and acetaldehyde. This result indicates that ethanol decomposition is the main reaction taking place at this temperature. According to the literature, the main reaction pathway at 673K is ethanol dehydrogenation to acetaldehyde, followed by its decomposition to CO and CH4 [35,36]. At high reaction temperature, only H2, CO and CO2 were produced, which suggests that SR of ethanol and the reverse of Boudouard [34] reactions occurs. The ethanol conversion and product distribution as a function of TOS for SR of ethanol at 773K over the Ni/ZnO-Al2O3 catalyst reduced at 873K are shown in Fig. 5 . When the catalyst was reduced at lower temperature, significant deactivation was observed. The main products formed were H2, CO2 and CO. The decrease in ethanol conversion was accompanied by an increase in acetaldehyde selectivity. In order to determine the main causes of catalyst deactivation, the used Ni supported catalysts were characterized by SEM and TG analysis and the results obtained are presented in the following section. 3.3 Characterization of post-reaction Ni supported catalysts Fig. 6 shows the SEM images of the Ni-based catalysts after SR of ethanol at different reaction temperatures. A large amount of carbon, in the form of carbon filaments, was observed after SR of ethanol at 773K over Ni/Al2O3 and Ni/ZnAl2O4 catalysts (Fig. 6a and b). However, carbon filaments were either not detected on Ni/ZnO-Al2O3 catalyst after SR of ethanol at 773K (Fig. 6c) and after reaction at 1073K (Fig. 6e) or detected only to a minor extent in the Ni/ZnO-Al2O3 catalyst after SR of ethanol at 673K (Fig. 6d). After SR of ethanol at 773K, the TPO profiles (not shown) of Ni/Al2O3 and Ni/ZnAl2O4 catalysts exhibited peaks at 795, 812 and 851K. For Ni/ZnO-Al2O3 catalyst, no peak was observed on the TPO profile after SR at 773 and 1073K, whereas peaks at 777, 820 and 843K were detected after reaction at low temperature (673K). According to the literature [37], the several peaks in the TPO profile indicates the presence of different types of carbon. Then, the peak at 777/795K and 812/820K are attributed to carbon filaments while the peak at high temperature (851/843K) is associated with graphitic carbon. The rate of carbon deposition on all catalysts after different reaction conditions, as determined by TG analysis, is listed in Table 2 . For this calculation, the contribution of nickel reoxidation was removed. After SR of ethanol at 773K, the largest amount of carbon was formed on Ni/ZnAl2O4. However, no carbon deposits were detected on the Ni/ZnO-Al2O3 catalyst reduced at 1023K. The literature reports important carbon formation during SR of ethanol over Ni/ZnAl2O4 catalysts. Augustin et al. [34] observed significant carbon deposition during SR of ethanol at 773K over 30wt.% Ni/ZnAl2O4 catalyst. XRD, Raman and SEM analysis of used catalyst showed the formation of graphitic carbon and carbon filament. In addition, an X-ray diffraction pattern of the spent catalyst revealed the presence of metallic Ni phase, nickel zinc carbide (Ni3ZnC0.7) and graphitic carbon. This result suggests that carbon deposits are formed over metallic Ni particles, producing a carbide phase, which is regarded to be a precursor for carbon filament formation. Ni/ZnAl2O4 catalysts with different Ni loading (1–25wt.%) and a Zn:Al atomic ratio of 0.6 were tested for the SR of ethanol at 773K [38]. XRD and TG of the used catalyst revealed the presence of carbon deposits. Carbon formation has also been observed during SR of ethanol over Ni-based catalysts derived from NiZnAl hydrotalcite-like precursors [33,39,40]. Zeng et al. [40] carried out the SR of ethanol at 973K over NiZnAl catalyst (15wt.% Ni). TG analysis of the spent catalyst showed that a large amount of carbon was deposited during the reaction. In addition, the diffractogram of the used catalyst exhibited the lines characteristic of graphitic carbon and the metallic Ni phase. Therefore, the results reported in the literature reveals that the formation of carbon during SR of ethanol occurs on the metallic Ni particles and a Ni carbide phase is formed, which is the precursor of carbon filament. In the present work, significant carbon deposition was observed over Ni/Al2O3 and Ni/ZnAl2O4 catalysts, which exhibited only metallic Ni particles, as revealed by XRD. On the other hand, Ni/ZnO-Al2O3 catalyst remained quite stable during SR of ethanol at 773K, which was likely due to the inhibition of carbon formation as revealed by SEM and TG analyses. In addition, the diffractogram of the reduced catalyst showed the presence of NiZn alloy. Therefore, these results indicate that carbon deposits are formed over metallic Ni particles as suggested by the literature. However, the formation of carbon is suppressed during SR of ethanol when the NiZn alloy was formed. The amount of carbon formed on Ni/ZnO-Al2O3 catalyst was strongly dependent on the reaction temperature. A large amount of carbon was deposited during the SR at 673K (20.1mgcarbon/gcatal/h). However, the SEM images revealed the presence of only few carbon filaments indicating that this corresponds mainly to amorphous carbon. Increasing the reaction temperature from 673 to 773K resulted in the suppression of carbon accumulation on the catalyst surface. Carbon deposition was no longer observed during SR at 1073K. Wang et al. [41] also studied the effect of the SR reaction temperature on the performance of a Co/CeO2 catalyst. Severe deactivation was observed at 623 and 723K. In this case, the cobalt particles were found to be completely encapsulated by coke. When the reaction was carried out at 773 or 823K, carbon filaments were detected but the catalyst remained quite stable for 8h of TOS. Above 873K, carbon deposits were no longer detected by TEM analysis. According to Augustin et al. [34], carbon is removed from the surface of the catalyst by the reverse of the Boudouard reaction, which improves catalyst stability during SR at high temperature. Therefore, the decrease of carbon formation when the reaction temperature increases observed in our work is in agreement with the literature. The reduction temperature of the Ni/ZnO-Al2O3 sample also influenced the amount of carbon deposited. The reduction at 873K led to the formation of carbon on Ni/ZnO-Al2O3 catalyst, whereas carbon was not formed after reduction treatment at 1023K. 3.4 - XANES/EXAFS experiments The formation of a NiZn alloy during the reduction seems to play a key role in the catalyst resistance to carbon accumulation. However, the destruction of the NiZn alloy under reaction conditions has been reported in the literature [16] and it could lead to the formation of carbon due to the presence of metallic Ni particles. Homs et al. [16] studied the SR of ethanol over 10wt.%Ni/ZnO. The diffractogram of Ni/ZnO catalyst reduced at 673K revealed the formation of NiZn alloy with different compositions. However, after SR at 723K, the lines corresponding to the NiZn alloys were no longer detected and only the diffraction lines characteristic of metallic Ni were identified. This result suggested that the NiZn alloy was destroyed during the SR of ethanol reaction. Therefore, in situ XAS studies were performed in order to determine the role of the NiZn alloy on catalyst stability. 3.4.1 XANES experiments Fig. 7 shows the Ni K-edge XANES spectra of Ni/ZnO-Al2O3 catalyst and a reference NiO recorded during a reduction ramp under a mixture of 5% H2 in helium. The spectrum of Ni/ZnO-Al2O3 catalyst at room temperature is very similar to the spectrum of the NiO reference, indicating that NiO particles were present in this catalyst. Increasing the temperature the intensity of the white line peak decreases as Ni2+ is reduced to Ni°. After the ramp, the temperature was kept constant for 1h, still under H2 flow, and then an ethanol/water vapor mixture was flowed through the sample for 4h. Ni K edge XANES spectra of the Ni/ZnO2-Al2O3 catalyst at different conditions and references (NiO and Ni foil) are shown in Fig. 8 . After reduction at 873K, the spectrum indicates that part of Ni is still in the oxidized form. Increasing the reduction temperature to 1023K showed that Ni is completely reduced (Figs. 8 a and b). When the reaction mixture was admitted into the reaction chamber at 773K, a small fraction of metallic Ni is oxidized regardless the previous reduction temperature of the catalyst (Fig. 8c). On the other hand, significant changes were observed in the catalyst reduced at 1023K and under SR at 673K. The intensity of the white line strongly increased, indicating that a considerable part of Ni is oxidized back to Ni2+, arguably forming a well dispersed NiO phase. After reaction for 4h, the intensity of the white line decreased, showing that nickel oxide was reduced (Fig. 8d). However, a significant fraction of Ni still remained in an oxidized state after SR of ethanol at 673K for 4h. The evolution of the Ni species during reduction and SR of ethanol over Ni/ZnO-Al2O3 catalyst at different temperatures is shown on a more quantitative basis by LC XANES (Fig. 8e). The evolution of the reaction products with TOS for SR of ethanol at 673 and 773K over Ni/ZnO-Al2O3 catalyst was also followed downstream by mass spectrometry and the data are presented in Fig. 9 . When the reaction feed was injected into the reactor at 773K, the signals corresponding to H2, CO, CO2 and CH4 increased at the beginning of reaction and then leveled off. Only trace amounts of acetaldehyde was observed. The same result was obtained for SR of ethanol at 773K over the Ni/ZnO-Al2O3 catalyst reduced at 873K, except that a higher formation of acetaldehyde was observed. These results agrees very well with those obtained for the long-term catalytic tests carried out in the fixed-bed reactor. For the SR of ethanol at 673K, H2, CO and CH4 are the main products formed, indicating that ethanol decomposition reaction is favored at low reaction temperature. However, the concentration of acetaldehyde significantly increased in the first reaction hour when the SR of ethanol was performed at 673K. This was followed by a significant oxidation of the Ni particles when they were exposed to the reaction mixture at 673K, as revealed by XANES analyses. Then, acetaldehyde formation decreased as the Ni2+ containing phase was reduced to metallic Ni during the reaction. The oxidation of metallic particles by water has been reported in the literature [28,42]. Said et al. [42] investigated the oxidation of metallic Co particles by water using in situ XANES. Co/SiO2 catalysts with different Co particle size were exposed to a flow of H2O/He and heated up to 673K. The oxidation of Co/SiO2 catalysts by water was Co-size and temperature dependent. Large Co particles underwent low oxidation whereas the catalyst with medium-sized Co crystallites was significantly oxidized between 373 − 573K. Recently, Avila-Neto et al. [28] used XANES to follow the evolution of Co species when a Co/Al2O3 catalyst was heated under a flow of a mixture containing water and ethanol (H2O/Ethanol=3). Oxidation of metallic Co particles by water was observed at low temperatures and achieved a maximum degree of oxidation at around 573K. Above this temperature, the fraction of metallic Co particles increases, indicating that Co oxide particles are reduced by syngas produced through SR of ethanol at temperatures higher than 623K. The higher rate of dehydrogenation of ethanol to acetaldehyde over metal oxides has also been reported in the literature [22,43]. de la Pena O’shea investigated the SR of ethanol over Co3O4 by in situ X-ray diffraction coupled to gas chromatography [43].They demonstrated that ethanol dehydrogenation to acetaldehyde was the main reaction in the presence of cobalt oxide. When cobalt oxide was reduced, the selectivity to acetaldehyde decreased. Pereira et al. [22] studied the performance of Co/SiO2, CoRh/SiO2 and CoRu/SiO2 for OSR of ethanol. The decrease in ethanol conversion was accompanied by a decrease in hydrogen selectivity and an increase in acetaldehyde selectivity. Catalyst deactivation was attributed to oxidation of the surface of the Co particles by oxygen from the feed. Also, the cobalt oxide formed favored dehydrogenation of ethanol to acetaldehyde. In our work, XANES and mass spectrometry results suggest that the metallic Ni particles are partially oxidized by water in the feed, and these NiO particles promote the dehydrogenation of ethanol to acetaldehyde at 673K. Therefore, the oxidation of metallic Ni particles might contribute for the deactivation observed for SR of ethanol at 673K (Fig. 4a). At higher reaction temperature (773K), there is only a slight oxidation of metallic Ni particles because the syngas produced through SR of ethanol keep the Ni particles reduced, regardless the reduction temperature of the catalyst. Then, the deactivation observed for the catalyst reduced at 873K (Fig. 5) is not caused by the oxidation of metallic Ni particles. In this case, the loss of activity of this catalyst is likely due to carbon deposition, as demonstrate by TG analyses. 3.4.2 EXAFS experiments While XANES allows information mainly about the oxidation state of the absorbing element in the sample, analysis of the extended part of the spectra (EXAFS) also gives information about the ordering and composition of a few coordination shells around the absorber. EXAFS experiments could then give further evidences for the NiZn alloy formation, which was suggested by XRD experiments of the reduced catalyst and, most interestingly, whether or not such alloys would be stable under the conditions for SR of ethanol. As previously discussed, Ni/ZnAl2O4 and Ni/ZnO-Al2O3 catalysts exhibited different performance during SR of ethanol. A considerable amount of carbon was deposited over Ni/ZnAl2O4 after 28 h of TOS. In addition, no metallic phase other than Ni fcc was formed after reduction. In the case of Ni/ZnO-Al2O3 catalyst, the formation of carbon was not found. Furthermore, XRD experiments for Ni/ZnO-Al2O3 catalyst presented evidence that the metallic phases most likely present in the reduced catalyst were Ni4Zn fcc (ICSD # 647139) and tetragonal NiZn (ICSD # 105469). Taking into account the presence of these phases identified by XRD, Ni-rich Ni4Zn and the more Ni diluted NiZn phase theoretical models were used for fitting the Ni and Zn K-edge spectra, respectively. From a qualitative comparison of the results, some remarks about the structure of the working catalyst could be drawn. As depicted in Fig. S1a the Ni4Zn unit cell may be represented by a fcc structure whose six faces as well as two out of the eight corners are occupied by Ni atoms. The remaining six corner sites are occupied by Zn atoms. According to that model, the first coordination shell around each Ni atom is composed of 12 Ni atoms at a distance of 2.52 Å (only 1.6% longer than the Ni-Ni distance in fcc Ni, that is 2.48 Å), with the second coordination shell having six Zn atoms. It could be expected then that the FT-transformed EXAFS patterns of this Ni4Zn alloy should be quite comparable to Ni fcc. In fact, the FEFF generated FT-EXAFS spectrum of Ni4Zn (not shown) is very similar to the one of a Ni foil. The only difference being that the peak located at the first coordination shell is in fact shifted to longer distances in Ni4Zn, and these longer atomic distances are considered in this model (2.5237 Å vis à vis Ni fcc’s 2.4890 Å). The other model considered for fitting the Zn edge spectra, NiZn (ICSD # 105469), as depicted in Fig. S1b, is a tetragonal cube with its corners and the core sites being occupied by Ni and Zn atoms, respectively. According to that model, a Zn atom is surrounded by eight Ni atoms at a distance of 2.52 Å (5.3% shorter than the Zn-Zn distance, which is 2.66 Å) and by four Zn atoms at 2.76 Å. The FEFF generated FT-EXAFS of our NiZn theoretical models reveals that the Zn-Ni first coordination shell occurs at a considerably smaller distance than the Zn-Zn found in the Zn foil FT-EXAFS. EXAFS analysis was then performed for the Ni/ZnO-Al2O3 and Ni/ZnAl2O4 catalysts. The fitted spectra and the fitting parameters obtained are presented in Figs. 10 and 11 Tables 3 and 4 , respectively. When one compares the experimental spectra of the Ni/ZnO-Al2O3 catalyst with the Ni foil, the first shell peaks are similar, unlike those found in the Ni4Zn theoretical spectrum. The differences in the Ni–Ni distances in the Ni foil in comparison to the NiZn intermetallic distances of the sample could be due to two factors: (i) a FT-EXAFS peak broadening effect due to the thermal and static fluctuation of the average crystalline interatomic distances (represented by the Debye-Waller term, σDW), expected for measurements at high temperatures (773K) and in small particles [32];(ii) The fact that some Ni fcc was also detected by XRD, probably in the form of very small domains dispersed over the support. However, the most striking difference found between the spectra of Ni/ZnO-Al2O3 and Ni foil reference was with regard to the peaks related to coordination shells farther than the first. In that case, the orderly, clear peaks assigned to the 2nd, 3rd and 4th coordination shells found in the FT EXAFS of the Ni foil cannot be reproduced by the Ni/ZnO-Al2O3 spectra, regardless of the in-situ treatment to which the sample was exposed. This suggests that Ni is present in very small domains, being that Zn induces a high degree of disorder in coordination shells farther than the first one and it also has been regarded as an indication of alloying in bimetallic systems [44]. As for the evolution of the distribution of Zn containing phases, it can be observed in the Zn K-edge Fourier transformed EXAFS spectra of the reduced passivated Ni/ZnO-Al2O3 sample that besides the peaks assigned to Zn-O and Zn-O-Me, (Me=Zn or Al), this latter one of quite low intensity, there is a pronounced peak, which is somewhat shifted towards lower distances than the peak related to the first coordination shell of the Zn foil. However it is located at similar first shell distances found in the FEFF generated FT-EXAFS of the NiZn model. By that peak, it appears that, besides it is present in an oxide form (which according to the XRD profiles in Fig. 3, is mainly ZnAl2O4 along with traces of a highly dispersed ZnO phase), Zn is also present in a metallic form. However, its first coordination shell distances are shorter than the ones found in a Zn hcp phase. Therefore, the qualitative analysis of the FT-EXAFS spectra indicates that metallic Zn is present in the reduced sample in a tetragonal NiZn phase, which is richer in Zn than the Ni4Zn model considered for describing the Ni edge spectra. The evolution of both Ni and Zn environments as the sample underwent different treatments may be better observed by considering the average number of first neighbor atoms (N) in the fitting parameters presented in Tables 3 and 4. With regard to the Ni K-edge spectra, inspection of EXAFS parameters of Ni/ZnO-Al2O3 (Table 3) reveals that the average number of Ni neighbors of the reduced catalyst (NNi-Ni = 7.8 ± 0.8) only slightly grew (NNi-Ni = 9.0 ± 1.0) after under SR of ethanol reaction for 4 h. As for the coordination number for Ni-Zn (NNi-Zn), it is observed that it also slightly increased from NNi-Zn = 2.4 ± 0.7–2.7 ± 1.5. These results revealed that particle sintering was not important during SR of ethanol at 773 K. From the Zn edge standpoint, Zn-O in tetrahedral ZnO4 units located in a cubic ZnAl2O4 phase was considered in the fitting (see Fig. S1c for a graphic depiction of the cubic ZnAl2O4 unit cell). The subsequent Zn-O-Al scattering paths were not considered in our model due to the fact that it led invariably to very bad fittings with quite large uncertainties in the parameters. That might be ascribed to the fact that the peak corresponding to the Zn-O-Al distances (in the FT-EXAFS spectra) in the samples, compared to the ZnAl2O4 reference, were rather small. It is suggested then that Zn2+ ions are present in the form of isolated ZnOx unities. This usually occurs in catalysts comprised of transition metal oxides highly dispersed on the support, for instance as in SiO2 supported Ti catalysts for partial oxidation of olefins, where TiIVO4 isolate tetrahedral units are highly dispersed over the SiO2 matrix [45]. In that case, no significant Ti-O-Me (Me = Ti or Si) peaks may be found in the Ti K-edge Fourier Transformed EXAFS, either. It was observed that the average number of neighbors in the first coordination shells (NZn-O and NZn-Ni) remains fairly constant regardless of the in-situ treatment. As for the Ni/ZnAl2O4 sample, as it is shown both in Fig. 11 and Table 4, the Ni K-edge spectrum is best fitted by considering a Ni fcc phase, which is in accordance with XRD data of reduced/passivated sample (Fig. 2). From the Zn K-edge viewpoint, an inverse spinel ZnAl2O4 phase was used for fitting. The scattering paths considered in those fits were then Ni–Ni first coordination shell (dNi-Ni =2.489Å) and Zn-O and Zn-O-Al (dZn-O: 1.9522Å; dZn-O-Al: 3.3520Å) for Ni fcc and cubic ZnAl2O4, respectively. The average coordination number of Ni (NNi-Ni) did not appreciably change, being around 8±1 over the different treatments. This indicates that the Ni particle size remained approximately constant regardless of the treatment used. As far as the Zn edge is concerned, the presence of a bulky ZnAl2O4 phase is observed, unlike Ni/ZnO-Al2O3, which exhibited a NiZn intermetallic phase with non-uniform composition, as well as a rather disordered oxidic phase. Therefore, the average coordination number of Ni for both catalysts does not change significantly during the SR of ethanol reaction, which suggests that Ni particle sintering is not responsible for the deactivation observed for Ni/ZnAl2O4 catalyst. 3.5 General discussion From the above discussed results, a general picture on the evolution of phase composition of Ni/ZnO-Al2O3 catalyst over the different working conditions may be drawn, as depicted in Fig. 12 . The Ni/ZnO-Al2O3 calcined catalyst precursor, comprised mainly of NiO/ZnO crystalline phases dispersed over a rather amorphous Al2O3 matrix, is transformed into a metallic phase over a ZnAl2O4 support. The composition of the metallic phase in the reduced catalyst is dependent on the Zn content in the catalyst, being that an excess of Zn (Zn:Al atomic ratio of 2:1) gives rise to a mixture of NixZny based intermetallic phase with a rather small amount of pure Ni in it. Additionally a highly dispersed ZnO phase can be seen. On the other hand, when the Zn content in the catalyst is just enough to form the ZnAl2O4 inverse spinel phase, the reduced catalyst is comprised of only Ni°/ZnAl2O4. As far as the NiZn intermetallic phase is concerned, it contains a Ni-rich phase, suggested in the present work to be a cubic Ni4Zn, associated with a Zn-richer metallic phase, suggested to be present as tetragonal NiZn. In that case, it is assumed that, during activation under H2 flow at 1023K, Zn2+ is reduced to Zn° in a process possibly aided by Ni° promoted H2 spillover. The fact that mainly two Ni-Zn intermetallic phases were observed suggests that they may occur in separate particles. Therefore, these results revealed that NiZn bimetallic particles were formed with different compositions. After 4h of flowing ethanol/H2O mixture at 773K, any detectable modification is not observed in the phase composition of the catalyst, other than an increase in the participation of a Zn-O scattering path, suggesting that at most a small part of the Zn is oxidized back to Zn2+. The formation of NiZn alloy significantly influenced the stability of the catalyst. Ni/ZnO-Al2O3 catalyst remained quite stable during SR of ethanol at 773K, which was likely due to the inhibition of carbon formation as revealed by SEM and TG analyses. However, a significant carbon deposition was observed over Ni/Al2O3 and Ni/ZnAl2O4 catalysts. Therefore, the dilution effect of the large ensembles of Ni metal atoms contributed to suppressing the formation of carbon deposits, thus improving catalyst stability. In addition, the NiZn phase was quite stable and it was not destroyed during the reaction. For the Ni/Al2O3 and Ni/ZnAl2O4 catalysts, only metallic Ni particles were found after reduction. Then, carbon filaments were formed during the reaction, leading to catalyst deactivation. in situ EXAFS did not detected significant metallic Ni sintering on Ni/ZnO-Al2O3 and Ni/ZnAl2O4 catalysts for SR of ethanol at 773K. However, the oxidation of metallic Ni particles was observed for SR of ethanol at low temperature (673K) and it might contribute for catalyst deactivation. 4 Conclusions Two differently prepared ZnO/Al2O3 supported Ni catalysts were tested for the SR of ethanol: (i) one containing a high enough amount of Zn to form a ZnAl2O4 phase after calcination (Ni/ZnAl2O4), (ii) the other one with an excess of Zn (Ni/ZnO-Al2O4). XRD and EXAFS of the reduced Ni/ZnAl2O4 catalyst revealed only the presence of metallic Ni particles whereas a NiZn alloy with mixed compositions (NiZn and Ni4Zn) was observed for Ni/ZnO-Al2O3 catalyst. For Ni/Al2O3 and Ni/ZnAl2O4 catalysts, many different reactions occur simultaneously with the SR reaction at 773K such as ethanol decomposition, ethanol dehydrogenation and ethanol dehydration. On the other hand, Ni/ZnO-Al2O3 catalyst was highly selective to SR of ethanol. Ni/Al2O3 and Ni/ZnAl2O4 catalysts significantly deactivated whereas Ni/ZnO-Al2O3 catalyst remained quite stable during SR of ethanol at 773K. The stability of the catalysts strongly depended on the type of Ni species formed after reduction. SEM and TG analyses revealed a significant carbon deposition over Ni/Al2O3 and Ni/ZnAl2O4 catalysts, which contained mainly metallic Ni particles. Carbon accumulates on the surface of Ni particles and a Ni carbide phase is formed, which is the precursor of carbon filament. However, the formation of NiZn alloy inhibited the deposition of carbon. The dilution effect of the large ensembles of Ni metal atoms contributed to suppressing the formation of carbon deposits, thus improving catalyst stability. in situ EXAFS ruled out the sintering of Ni particles during SR of ethanol at 773K. However, the oxidation of metallic Ni particles by water from the feed could play an important role on the deactivation of Ni/ZnO-Al2O3 catalyst during SR of ethanol at low temperature (673K). The NiO particles formed promotes the ethanol dehydrogenation to acetaldehyde. Only a fraction of these NiO particles are reduced back over TOS. Acknowledgements This work received financial support of CNPq (CT-INFO/CT-HIDRO/MCT/CNPq–490818/2007-2). The authors C. Anjaneyulu and A. Venugopal thank DST New Delhi for the bilateral program with CNPq. M.C. Ribeiro and R.C. Rabelo-Neto acknowledge a scholarship received from CNPq and FAPERJ. The Brazilian Synchrotron Light Source (LNLS-Campinas) is acknowledged for the assigned beamtime (project # XAFS 1-13664) and for the support to perform the XAFS studies. The group kindly thanks Prof. J.M. Bueno and A. Braga for the helpful discussions during the XAFS experiments. Appendix A Supplementary data Supplementary data associated with this article can be found, in the online version, at http://dx.doi.org/10.1016/j.apcata.2016.03.008. Appendix A Supplementary data The following are Supplementary data to this article: References [1] T. Hou S. Zhang Y. Chen D. Wang W. Cai Renew. Sustain. Energy Rev. 44 2015 132 [2] L.V. Mattos G. Jacobs B.H. Davis F.B. Noronha Chem. Rev. 112 2012 4094 [3] V. Fierro O. Akdim C. Mirodatos Green Chem. 5 2003 20 [4] O. Akdim W. Cai V. Fierro H. Provendier A. Van Veen W. Shen C. Mirodatos Top. Catal. 51 2008 22 [5] F. Marino M. Boveri G. Baronetti M. Laborde Int. J. Hydrogen Energy 26 2001 665 [6] F. Marino E.G. Cerrela S. Duhalde M. Jobbagy M. Laborde Int. J. Hydrogen Energy 23 1998 1095 [7] S. Velu N. Satoh C.S. Gopinath K. Suzuki Catal. Lett. 82 2002 145 [8] S. Velu K. Suzuki M. Vijayaraj S. Barman G.S. Gopinath B 55 2005 287 [9] A.J. Vizcaino A. Carrero J.A. Calles Int. J. Hydrogen Energy 32 2007 1450 [10] A.C. Furtado C.G. Alonso M.P. Cantão N.R.C. Fernandes-Machado Int. J. Hydrogen Energy 34 2009 7189 [11] J. Kugai V. Subramani C. Song Catal. Lett. 101 2005 255 [12] J. Kugai S. Velu C. Song M.H. Engelhard Y. Chin J. Catal. 238 2006 430 [13] E. Orucu F. Gokaliler A.E. Aksoylu Z.I. Onsan Catal. Lett. 120 2008 198 [14] M.C. Sanchez-Sanchez R.M.N. Yerga D.I. Kondarides X.E. Verykios J.L.G. Fierro J. Phys. Chem. A 114 11 2010 3873 [15] M.H. Youn J.G. Seo P. Kim I.K. Song J. Mol. Catal. A 261 2007 276 [16] N. Homs J. Llorca P.R. de la Piscina Catal. Today 116 2006 361 [17] C. Resini M.C.H. Delgado S. Presto L.J. Alemany P. Riani R. Marazza G. Ramis G. Busca Int. J. Hydrogen Energy 33 2008 3728 [18] L. He H. Berntsen E. Ochoa-Fernandez J.C. Walmsley E.A. Bleckkan Top. Catal 52 2009 206 [19] A.E. Galetti M.F. Gomez L.A. Arrua A.J. Marchi M.C. Abello Catal. Commun. 9 2008 1201 [20] L. Huang R. Chen D. Chu A.T. Hsu Int. J. Hydrogen Energy 35 2010 1138 [21] A. Kazama Y. Sekine K. Oyama M. Matsukata E. Kikuchi Appl. Catal. A 383 2010 96 [22] E.B. Pereira N. Homs S. Marti J.L.G. Fierro P.R. de la Piscina J. Catal. 257 2008 206 [23] L.P.R. Profeti E.A. Ticianelli E.M. Assaf J. Power Sources 175 2008 482 [24] P.Y. Sheng W.W. Chiu A. Yee S.J. Morrison H. Idriss Catal. Today 129 2007 313 [25] J.L. Bi Y.Y. Hong C.C. Lee C.T. Yeh C.B. Wang Catal. Today 129 2007 322 [26] S.M. de Lima A.M. da Silva G. Jacobs B.H. Davis L.V. Mattos F.B. Noronha Appl. Catal. B 96 2010 387 [27] A. Casanovas J. Llorca N. Homs J.L.G. Fierro P.R. de la Piscina J. Mol. Catal. A: Chemical 250 2006 44 [28] C.N. Ávila-Neto J.W.C. Liberatori A.M. da Silva D. Zanchet C.E. Hori F.B. Noronha J. Catal. 287 2012 124 [29] A. Venugopal M. Sudhakar R. Kishore R. Sarkari J. Ashok F.B. Noronha S.M. de Lima A. Hari Padmasri . J. Nanotechnol. 7 2010 1188 [30] A.D. Ballarini S.A. Bocanegra A.A. Castro S.R. Miguel O.A. Scelza Catal. Letters 129 2009 293 [31] T. Ressler J. Synch. Rad. 5 1998 118 [32] J.J. Rehr S.I. Zabinsky R.C. Albers Phys. Rev. Lett. 69 1992 3397 [33] A.J. Vizcaino M. Lindo A. Carrero J.A. Calles Int. J. Hydrogen Energy 37 2012 1985 [34] E. Agustın E. Galetti M.F. Gomez L.A. Arrua M.C. Abello Appl. Catal. A: General 348 2008 94 [35] M. Kourtelesis P. Panagiotopoulou X.E. Verykios Catal. Today 258 2015 247 [36] T.S. Moraes R.C. Rabelo-Neto M.C. Ribeiro L.V. Mattos M. Kourtelesis X. Verykios F.B. Noronha Top. Catal. 58 2015 281 [37] S.M. de Lima A.M. da Silva L.O.O. da Costa U.M. Graham G. Jacobs B.H. Davis L.V. Mattos F.B. Noronha J. Catal. 268 2009 268 [38] M.N. Barroso M.F. Gomez L.A. Arrua M.C. Abello Appl. Catal. A: General 304 2006 116 [39] C. Resini T. Montanari L. Barattini G. Ramis G. Busca S. Presto P. Riani R. Marazza M. Sisani F. Marmottini U. Costantino Appl. Catal. A: General 355 2009 83 [40] G. Zeng Q. Liu R. Gu L. Zhang Y. Li Catal. Today 178 2011 206 [41] H. Wang Y. Liu L. Wang Y.N. Qin Chem. Eng. J. 145 2008 25 [42] A.M. Said A. Borgna J. van de Loosdrecht P.J. van Berge J.W. Geus J.W. Niemantsverdriet J. Catal. 239 2006 326 [43] V.A. de laP. O’shea N. Homs E.B. Pereira R. Nafria P.R. de la Piscina Catal. Today 126 2007 148 [44] J.-D. Grunwaldt A.M. Molenbroek N.-Y. Topsøe H. Topsøe B.S. Clausen J. Catal. 194 2000 452 [45] J.M. Thomas G. Sankar Acc. Chem. Res. 34 2001 571",
      "scopus-id": "84961918836",
      "coredata": {
        "eid": "1-s2.0-S0926860X16301181",
        "dc:description": "A detailed investigation of the effect of Zn on the performance of supported Ni-based catalysts for steam reforming of ethanol is presented in this paper. A Ni/Al2O3 and two ZnO/Al2O3 supported Ni catalysts with different Zn/Al ratio were prepared. For the Ni/Al2O3 and Ni/ZnAl2O4 (Zn/Al=0.5) catalysts, only metallic Ni particles were identified after reduction. Under ethanol steam reforming conditions, carbon filaments were formed during the reaction, which led to deactivation of the catalyst. It was shown that Zn present in excess (Ni/ZnO-Al2O3) may form an alloy with compositions ranging from Zn-rich tetragonal NiZn and Ni-rich cubic Ni4Zn. The formation of NiZn alloy with different compositions plays a key role in catalyst performance, improving resistance to coke formation and its stability.",
        "openArchiveArticle": "false",
        "prism:coverDate": "2016-06-05",
        "openaccessUserLicense": null,
        "prism:aggregationType": "Journal",
        "prism:url": "https://api.elsevier.com/content/article/pii/S0926860X16301181",
        "dc:creator": [
          {
            "@_fa": "true",
            "$": "Anjaneyulu, Chatla"
          },
          {
            "@_fa": "true",
            "$": "Costa, Lídia O.O.da"
          },
          {
            "@_fa": "true",
            "$": "Ribeiro, Mauro C."
          },
          {
            "@_fa": "true",
            "$": "Rabelo-Neto, Raimundo C."
          },
          {
            "@_fa": "true",
            "$": "Mattos, Lisiane V."
          },
          {
            "@_fa": "true",
            "$": "Venugopal, A."
          },
          {
            "@_fa": "true",
            "$": "Noronha, Fábio B."
          }
        ],
        "link": [
          {
            "@_fa": "true",
            "@rel": "self",
            "@href": "https://api.elsevier.com/content/article/pii/S0926860X16301181"
          },
          {
            "@_fa": "true",
            "@rel": "scidir",
            "@href": "https://www.sciencedirect.com/science/article/pii/S0926860X16301181"
          }
        ],
        "dc:format": "application/json",
        "openaccessType": null,
        "pii": "S0926-860X(16)30118-1",
        "prism:volume": "519",
        "prism:publisher": "Elsevier B.V.",
        "dc:title": "Effect of Zn addition on the performance of Ni/Al2O3 catalyst for steam reforming of ethanol",
        "prism:copyright": "© 2016 Elsevier B.V. All rights reserved.",
        "openaccess": "0",
        "prism:issn": "0926860X",
        "dcterms:subject": [
          {
            "@_fa": "true",
            "$": "Hydrotalcite"
          },
          {
            "@_fa": "true",
            "$": "Ni-Zn alloy"
          },
          {
            "@_fa": "true",
            "$": "Hydrogen production"
          },
          {
            "@_fa": "true",
            "$": "Steam reforming of ethanol"
          },
          {
            "@_fa": "true",
            "$": "Catalyst deactivation"
          },
          {
            "@_fa": "true",
            "$": "Carbon formation"
          }
        ],
        "openaccessArticle": "false",
        "prism:publicationName": "Applied Catalysis A: General",
        "openaccessSponsorType": null,
        "prism:pageRange": "85-98",
        "prism:endingPage": "98",
        "pubType": "fla",
        "prism:coverDisplayDate": "5 June 2016",
        "prism:doi": "10.1016/j.apcata.2016.03.008",
        "prism:startingPage": "85",
        "dc:identifier": "doi:10.1016/j.apcata.2016.03.008",
        "openaccessSponsorName": null
      },
      "objects": {
        "object": [
          {
            "@category": "thumbnail",
            "@height": "88",
            "@width": "219",
            "@_fa": "true",
            "$": "https://api.elsevier.com/content/object/eid/1-s2.0-S0926860X16301181-fx1.sml?httpAccept=%2A%2F%2A",
            "@multimediatype": "GIF image file",
            "@type": "IMAGE-THUMBNAIL",
            "@size": "7449",
            "@ref": "fx1",
            "@mimetype": "image/gif"
          },
          {
            "@category": "thumbnail",
            "@height": "164",
            "@width": "108",
            "@_fa": "true",
            "$": "https://api.elsevier.com/content/object/eid/1-s2.0-S0926860X16301181-gr1.sml?httpAccept=%2A%2F%2A",
            "@multimediatype": "GIF image file",
            "@type": "IMAGE-THUMBNAIL",
            "@size": "4060",
            "@ref": "gr1",
            "@mimetype": "image/gif"
          },
          {
            "@category": "thumbnail",
            "@height": "131",
            "@width": "219",
            "@_fa": "true",
            "$": "https://api.elsevier.com/content/object/eid/1-s2.0-S0926860X16301181-gr10.sml?httpAccept=%2A%2F%2A",
            "@multimediatype": "GIF image file",
            "@type": "IMAGE-THUMBNAIL",
            "@size": "22136",
            "@ref": "gr10",
            "@mimetype": "image/gif"
          },
          {
            "@category": "thumbnail",
            "@height": "137",
            "@width": "219",
            "@_fa": "true",
            "$": "https://api.elsevier.com/content/object/eid/1-s2.0-S0926860X16301181-gr11.sml?httpAccept=%2A%2F%2A",
            "@multimediatype": "GIF image file",
            "@type": "IMAGE-THUMBNAIL",
            "@size": "24051",
            "@ref": "gr11",
            "@mimetype": "image/gif"
          },
          {
            "@category": "thumbnail",
            "@height": "164",
            "@width": "218",
            "@_fa": "true",
            "$": "https://api.elsevier.com/content/object/eid/1-s2.0-S0926860X16301181-gr12.sml?httpAccept=%2A%2F%2A",
            "@multimediatype": "GIF image file",
            "@type": "IMAGE-THUMBNAIL",
            "@size": "27534",
            "@ref": "gr12",
            "@mimetype": "image/gif"
          },
          {
            "@category": "thumbnail",
            "@height": "164",
            "@width": "211",
            "@_fa": "true",
            "$": "https://api.elsevier.com/content/object/eid/1-s2.0-S0926860X16301181-gr2.sml?httpAccept=%2A%2F%2A",
            "@multimediatype": "GIF image file",
            "@type": "IMAGE-THUMBNAIL",
            "@size": "5565",
            "@ref": "gr2",
            "@mimetype": "image/gif"
          },
          {
            "@category": "thumbnail",
            "@height": "163",
            "@width": "153",
            "@_fa": "true",
            "$": "https://api.elsevier.com/content/object/eid/1-s2.0-S0926860X16301181-gr3.sml?httpAccept=%2A%2F%2A",
            "@multimediatype": "GIF image file",
            "@type": "IMAGE-THUMBNAIL",
            "@size": "4556",
            "@ref": "gr3",
            "@mimetype": "image/gif"
          },
          {
            "@category": "thumbnail",
            "@height": "163",
            "@width": "71",
            "@_fa": "true",
            "$": "https://api.elsevier.com/content/object/eid/1-s2.0-S0926860X16301181-gr4.sml?httpAccept=%2A%2F%2A",
            "@multimediatype": "GIF image file",
            "@type": "IMAGE-THUMBNAIL",
            "@size": "3319",
            "@ref": "gr4",
            "@mimetype": "image/gif"
          },
          {
            "@category": "thumbnail",
            "@height": "163",
            "@width": "157",
            "@_fa": "true",
            "$": "https://api.elsevier.com/content/object/eid/1-s2.0-S0926860X16301181-gr5.sml?httpAccept=%2A%2F%2A",
            "@multimediatype": "GIF image file",
            "@type": "IMAGE-THUMBNAIL",
            "@size": "5532",
            "@ref": "gr5",
            "@mimetype": "image/gif"
          },
          {
            "@category": "thumbnail",
            "@height": "163",
            "@width": "109",
            "@_fa": "true",
            "$": "https://api.elsevier.com/content/object/eid/1-s2.0-S0926860X16301181-gr6.sml?httpAccept=%2A%2F%2A",
            "@multimediatype": "GIF image file",
            "@type": "IMAGE-THUMBNAIL",
            "@size": "21848",
            "@ref": "gr6",
            "@mimetype": "image/gif"
          },
          {
            "@category": "thumbnail",
            "@height": "164",
            "@width": "119",
            "@_fa": "true",
            "$": "https://api.elsevier.com/content/object/eid/1-s2.0-S0926860X16301181-gr7.sml?httpAccept=%2A%2F%2A",
            "@multimediatype": "GIF image file",
            "@type": "IMAGE-THUMBNAIL",
            "@size": "20456",
            "@ref": "gr7",
            "@mimetype": "image/gif"
          },
          {
            "@category": "thumbnail",
            "@height": "153",
            "@width": "219",
            "@_fa": "true",
            "$": "https://api.elsevier.com/content/object/eid/1-s2.0-S0926860X16301181-gr8.sml?httpAccept=%2A%2F%2A",
            "@multimediatype": "GIF image file",
            "@type": "IMAGE-THUMBNAIL",
            "@size": "20951",
            "@ref": "gr8",
            "@mimetype": "image/gif"
          },
          {
            "@category": "thumbnail",
            "@height": "95",
            "@width": "219",
            "@_fa": "true",
            "$": "https://api.elsevier.com/content/object/eid/1-s2.0-S0926860X16301181-gr9.sml?httpAccept=%2A%2F%2A",
            "@multimediatype": "GIF image file",
            "@type": "IMAGE-THUMBNAIL",
            "@size": "13611",
            "@ref": "gr9",
            "@mimetype": "image/gif"
          },
          {
            "@category": "standard",
            "@height": "200",
            "@width": "500",
            "@_fa": "true",
            "$": "https://api.elsevier.com/content/object/eid/1-s2.0-S0926860X16301181-fx1.jpg?httpAccept=%2A%2F%2A",
            "@multimediatype": "JPEG image file",
            "@type": "IMAGE-DOWNSAMPLED",
            "@size": "24480",
            "@ref": "fx1",
            "@mimetype": "image/jpeg"
          },
          {
            "@category": "standard",
            "@height": "514",
            "@width": "339",
            "@_fa": "true",
            "$": "https://api.elsevier.com/content/object/eid/1-s2.0-S0926860X16301181-gr1.jpg?httpAccept=%2A%2F%2A",
            "@multimediatype": "JPEG image file",
            "@type": "IMAGE-DOWNSAMPLED",
            "@size": "27059",
            "@ref": "gr1",
            "@mimetype": "image/jpeg"
          },
          {
            "@category": "standard",
            "@height": "339",
            "@width": "565",
            "@_fa": "true",
            "$": "https://api.elsevier.com/content/object/eid/1-s2.0-S0926860X16301181-gr10.jpg?httpAccept=%2A%2F%2A",
            "@multimediatype": "JPEG image file",
            "@type": "IMAGE-DOWNSAMPLED",
            "@size": "100625",
            "@ref": "gr10",
            "@mimetype": "image/jpeg"
          },
          {
            "@category": "standard",
            "@height": "354",
            "@width": "565",
            "@_fa": "true",
            "$": "https://api.elsevier.com/content/object/eid/1-s2.0-S0926860X16301181-gr11.jpg?httpAccept=%2A%2F%2A",
            "@multimediatype": "JPEG image file",
            "@type": "IMAGE-DOWNSAMPLED",
            "@size": "97900",
            "@ref": "gr11",
            "@mimetype": "image/jpeg"
          },
          {
            "@category": "standard",
            "@height": "424",
            "@width": "565",
            "@_fa": "true",
            "$": "https://api.elsevier.com/content/object/eid/1-s2.0-S0926860X16301181-gr12.jpg?httpAccept=%2A%2F%2A",
            "@multimediatype": "JPEG image file",
            "@type": "IMAGE-DOWNSAMPLED",
            "@size": "115557",
            "@ref": "gr12",
            "@mimetype": "image/jpeg"
          },
          {
            "@category": "standard",
            "@height": "526",
            "@width": "678",
            "@_fa": "true",
            "$": "https://api.elsevier.com/content/object/eid/1-s2.0-S0926860X16301181-gr2.jpg?httpAccept=%2A%2F%2A",
            "@multimediatype": "JPEG image file",
            "@type": "IMAGE-DOWNSAMPLED",
            "@size": "45159",
            "@ref": "gr2",
            "@mimetype": "image/jpeg"
          },
          {
            "@category": "standard",
            "@height": "704",
            "@width": "659",
            "@_fa": "true",
            "$": "https://api.elsevier.com/content/object/eid/1-s2.0-S0926860X16301181-gr3.jpg?httpAccept=%2A%2F%2A",
            "@multimediatype": "JPEG image file",
            "@type": "IMAGE-DOWNSAMPLED",
            "@size": "56572",
            "@ref": "gr3",
            "@mimetype": "image/jpeg"
          },
          {
            "@category": "standard",
            "@height": "863",
            "@width": "376",
            "@_fa": "true",
            "$": "https://api.elsevier.com/content/object/eid/1-s2.0-S0926860X16301181-gr4.jpg?httpAccept=%2A%2F%2A",
            "@multimediatype": "JPEG image file",
            "@type": "IMAGE-DOWNSAMPLED",
            "@size": "52122",
            "@ref": "gr4",
            "@mimetype": "image/jpeg"
          },
          {
            "@category": "standard",
            "@height": "392",
            "@width": "376",
            "@_fa": "true",
            "$": "https://api.elsevier.com/content/object/eid/1-s2.0-S0926860X16301181-gr5.jpg?httpAccept=%2A%2F%2A",
            "@multimediatype": "JPEG image file",
            "@type": "IMAGE-DOWNSAMPLED",
            "@size": "30812",
            "@ref": "gr5",
            "@mimetype": "image/jpeg"
          },
          {
            "@category": "standard",
            "@height": "846",
            "@width": "565",
            "@_fa": "true",
            "$": "https://api.elsevier.com/content/object/eid/1-s2.0-S0926860X16301181-gr6.jpg?httpAccept=%2A%2F%2A",
            "@multimediatype": "JPEG image file",
            "@type": "IMAGE-DOWNSAMPLED",
            "@size": "151181",
            "@ref": "gr6",
            "@mimetype": "image/jpeg"
          },
          {
            "@category": "standard",
            "@height": "468",
            "@width": "339",
            "@_fa": "true",
            "$": "https://api.elsevier.com/content/object/eid/1-s2.0-S0926860X16301181-gr7.jpg?httpAccept=%2A%2F%2A",
            "@multimediatype": "JPEG image file",
            "@type": "IMAGE-DOWNSAMPLED",
            "@size": "74087",
            "@ref": "gr7",
            "@mimetype": "image/jpeg"
          },
          {
            "@category": "standard",
            "@height": "525",
            "@width": "753",
            "@_fa": "true",
            "$": "https://api.elsevier.com/content/object/eid/1-s2.0-S0926860X16301181-gr8.jpg?httpAccept=%2A%2F%2A",
            "@multimediatype": "JPEG image file",
            "@type": "IMAGE-DOWNSAMPLED",
            "@size": "128681",
            "@ref": "gr8",
            "@mimetype": "image/jpeg"
          },
          {
            "@category": "standard",
            "@height": "326",
            "@width": "753",
            "@_fa": "true",
            "$": "https://api.elsevier.com/content/object/eid/1-s2.0-S0926860X16301181-gr9.jpg?httpAccept=%2A%2F%2A",
            "@multimediatype": "JPEG image file",
            "@type": "IMAGE-DOWNSAMPLED",
            "@size": "70030",
            "@ref": "gr9",
            "@mimetype": "image/jpeg"
          },
          {
            "@category": "high",
            "@height": "886",
            "@width": "2213",
            "@_fa": "true",
            "$": "https://api.elsevier.com/content/object/eid/1-s2.0-S0926860X16301181-fx1_lrg.jpg?httpAccept=%2A%2F%2A",
            "@multimediatype": "JPEG image file",
            "@type": "IMAGE-HIGH-RES",
            "@size": "192813",
            "@ref": "fx1",
            "@mimetype": "image/jpeg"
          },
          {
            "@category": "high",
            "@height": "2275",
            "@width": "1500",
            "@_fa": "true",
            "$": "https://api.elsevier.com/content/object/eid/1-s2.0-S0926860X16301181-gr1_lrg.jpg?httpAccept=%2A%2F%2A",
            "@multimediatype": "JPEG image file",
            "@type": "IMAGE-HIGH-RES",
            "@size": "210643",
            "@ref": "gr1",
            "@mimetype": "image/jpeg"
          },
          {
            "@category": "high",
            "@height": "1498",
            "@width": "2500",
            "@_fa": "true",
            "$": "https://api.elsevier.com/content/object/eid/1-s2.0-S0926860X16301181-gr10_lrg.jpg?httpAccept=%2A%2F%2A",
            "@multimediatype": "JPEG image file",
            "@type": "IMAGE-HIGH-RES",
            "@size": "718074",
            "@ref": "gr10",
            "@mimetype": "image/jpeg"
          },
          {
            "@category": "high",
            "@height": "1568",
            "@width": "2500",
            "@_fa": "true",
            "$": "https://api.elsevier.com/content/object/eid/1-s2.0-S0926860X16301181-gr11_lrg.jpg?httpAccept=%2A%2F%2A",
            "@multimediatype": "JPEG image file",
            "@type": "IMAGE-HIGH-RES",
            "@size": "617003",
            "@ref": "gr11",
            "@mimetype": "image/jpeg"
          },
          {
            "@category": "high",
            "@height": "1876",
            "@width": "2500",
            "@_fa": "true",
            "$": "https://api.elsevier.com/content/object/eid/1-s2.0-S0926860X16301181-gr12_lrg.jpg?httpAccept=%2A%2F%2A",
            "@multimediatype": "JPEG image file",
            "@type": "IMAGE-HIGH-RES",
            "@size": "699174",
            "@ref": "gr12",
            "@mimetype": "image/jpeg"
          },
          {
            "@category": "high",
            "@height": "2327",
            "@width": "3000",
            "@_fa": "true",
            "$": "https://api.elsevier.com/content/object/eid/1-s2.0-S0926860X16301181-gr2_lrg.jpg?httpAccept=%2A%2F%2A",
            "@multimediatype": "JPEG image file",
            "@type": "IMAGE-HIGH-RES",
            "@size": "362435",
            "@ref": "gr2",
            "@mimetype": "image/jpeg"
          },
          {
            "@category": "high",
            "@height": "3117",
            "@width": "2917",
            "@_fa": "true",
            "$": "https://api.elsevier.com/content/object/eid/1-s2.0-S0926860X16301181-gr3_lrg.jpg?httpAccept=%2A%2F%2A",
            "@multimediatype": "JPEG image file",
            "@type": "IMAGE-HIGH-RES",
            "@size": "468575",
            "@ref": "gr3",
            "@mimetype": "image/jpeg"
          },
          {
            "@category": "high",
            "@height": "3825",
            "@width": "1667",
            "@_fa": "true",
            "$": "https://api.elsevier.com/content/object/eid/1-s2.0-S0926860X16301181-gr4_lrg.jpg?httpAccept=%2A%2F%2A",
            "@multimediatype": "JPEG image file",
            "@type": "IMAGE-HIGH-RES",
            "@size": "385318",
            "@ref": "gr4",
            "@mimetype": "image/jpeg"
          },
          {
            "@category": "high",
            "@height": "1736",
            "@width": "1667",
            "@_fa": "true",
            "$": "https://api.elsevier.com/content/object/eid/1-s2.0-S0926860X16301181-gr5_lrg.jpg?httpAccept=%2A%2F%2A",
            "@multimediatype": "JPEG image file",
            "@type": "IMAGE-HIGH-RES",
            "@size": "234338",
            "@ref": "gr5",
            "@mimetype": "image/jpeg"
          },
          {
            "@category": "high",
            "@height": "3744",
            "@width": "2500",
            "@_fa": "true",
            "$": "https://api.elsevier.com/content/object/eid/1-s2.0-S0926860X16301181-gr6_lrg.jpg?httpAccept=%2A%2F%2A",
            "@multimediatype": "JPEG image file",
            "@type": "IMAGE-HIGH-RES",
            "@size": "1313445",
            "@ref": "gr6",
            "@mimetype": "image/jpeg"
          },
          {
            "@category": "high",
            "@height": "2070",
            "@width": "1500",
            "@_fa": "true",
            "$": "https://api.elsevier.com/content/object/eid/1-s2.0-S0926860X16301181-gr7_lrg.jpg?httpAccept=%2A%2F%2A",
            "@multimediatype": "JPEG image file",
            "@type": "IMAGE-HIGH-RES",
            "@size": "485078",
            "@ref": "gr7",
            "@mimetype": "image/jpeg"
          },
          {
            "@category": "high",
            "@height": "2323",
            "@width": "3333",
            "@_fa": "true",
            "$": "https://api.elsevier.com/content/object/eid/1-s2.0-S0926860X16301181-gr8_lrg.jpg?httpAccept=%2A%2F%2A",
            "@multimediatype": "JPEG image file",
            "@type": "IMAGE-HIGH-RES",
            "@size": "1550165",
            "@ref": "gr8",
            "@mimetype": "image/jpeg"
          },
          {
            "@category": "high",
            "@height": "1443",
            "@width": "3333",
            "@_fa": "true",
            "$": "https://api.elsevier.com/content/object/eid/1-s2.0-S0926860X16301181-gr9_lrg.jpg?httpAccept=%2A%2F%2A",
            "@multimediatype": "JPEG image file",
            "@type": "IMAGE-HIGH-RES",
            "@size": "449318",
            "@ref": "gr9",
            "@mimetype": "image/jpeg"
          },
          {
            "@category": "standard",
            "@_fa": "true",
            "$": "https://api.elsevier.com/content/object/eid/1-s2.0-S0926860X16301181-mmc1.pdf?httpAccept=%2A%2F%2A",
            "@multimediatype": "Acrobat PDF file",
            "@type": "APPLICATION",
            "@size": "210870",
            "@ref": "mmc1",
            "@mimetype": "application/pdf"
          },
          {
            "@category": "thumbnail",
            "@height": "39",
            "@width": "272",
            "@_fa": "true",
            "$": "https://api.elsevier.com/content/object/eid/1-s2.0-S0926860X16301181-si1.gif?httpAccept=%2A%2F%2A",
            "@multimediatype": "GIF image file",
            "@type": "ALTIMG",
            "@size": "1276",
            "@ref": "si1",
            "@mimetype": "image/gif"
          },
          {
            "@category": "thumbnail",
            "@height": "39",
            "@width": "166",
            "@_fa": "true",
            "$": "https://api.elsevier.com/content/object/eid/1-s2.0-S0926860X16301181-si2.gif?httpAccept=%2A%2F%2A",
            "@multimediatype": "GIF image file",
            "@type": "ALTIMG",
            "@size": "836",
            "@ref": "si2",
            "@mimetype": "image/gif"
          }
        ]
      },
      "link": {
        "@rel": "abstract",
        "@href": "https://api.elsevier.com/content/abstract/scopus_id/84961918836"
      }
    }
  }
}