{
  "metadata": {
    "title": "Delaminated MWW-type zeolite and its catalytic performance in alkylation of benzene with cyclohexene",
    "authors": "; ; ",
    "journal": "Applied Catalysis A: General",
    "date": "2022-08-05",
    "doi": "10.1016/j.apcata.2022.118741",
    "abstract": "",
    "uri": "https://api.elsevier.com/content/article/pii/S0926860X22002642",
    "pii": "S0926860X22002642"
  },
  "fulltext": {
    "full-text-retrieval-response": {
      "scopus-eid": "2-s2.0-85133233923",
      "originalText": "serial JL 271346 291210 291744 291809 31 Applied Catalysis A: General APPLIEDCATALYSISAGENERAL 2022-06-18 2022-06-18 2022-06-29 2022-06-29 2022-10-16T00:55:09 1-s2.0-S0926860X22002642 S0926-860X(22)00264-2 S0926860X22002642 10.1016/j.apcata.2022.118741 S300 S300.1 FULL-TEXT 1-s2.0-S0926860X22X00148 2024-01-01T12:34:28.416125Z 0 0 20220805 2022 2022-06-18T15:10:12.042655Z absattachment articleinfo articlenumber articletitlenorm authfirstinitialnorm authfirstsurnamenorm cid cids contenttype copyright crossmark dateloaded dateloadedtxt datesearch datesort dateupdated dco docsubtype doctype doi eid ewtransactionid hubeid indexeddate issn issnnorm itemstage itemtransactionid itemweight openaccess openarchive pg pgfirst pii piinorm pubdatestart pubdatetxt pubyr sortorder srctitle srctitlenorm srctype ssids alllist content subj subheadings suppl tomb volfirst volissue volumelist webpdf webpdfpagecount yearnav figure table e-component body mmlmath acknowledge affil appendices articletitle auth authfirstini authfull authkeywords authlast grantnumber grantsponsor grantsponsorid highlightsabst primabst ref specialabst 0926-860X 0926860X true 643 643 C Volume 643 19 118741 118741 118741 20220805 5 August 2022 2022-08-05 2022 article fla © 2022 Elsevier B.V. All rights reserved. DELAMINATEDMWWTYPEZEOLITECATALYTICPERFORMANCEINALKYLATIONBENZENECYCLOHEXENE BAO R 1 Introduction 2 Experimental 2.1 Materials 2.2 Characterization 2.3 Diffusivity property measurements 2.4 Catalytic performance testing 3 Results and discussion 3.1 Physicochemical property of the MWW samples 3.2 Investigation of the active sites 3.3 Catalytic performance 4 Conclusion Acknowledgements Appendix A Supplementary material References SCARAMUZZA 2001 307 312 N GAO 2016 35 37 Y ARENDS 2002 9055 9061 I WU 2002 48 53 X SONG 2013 804 808 S ZHU 2019 1 4 Z SONG 2000 1695 1696 C LIU 2001 19 22 Y PEREGO 2002 3 22 C FAHY 2001 259 268 J HARIPRASADRAO 1998 97 103 P YEN 2016 2715 2724 T NADGERI 2008 441 446 J LEONOWICZ 1994 1910 1913 M ROTH 2014 4807 4837 W XU 2016 1600441 L CORMA 1998 353 356 A ROTH 1995 301 308 W TEMPELMAN 2016 28 38 C RODRIGUES 2019 231 241 M ZHOU 2020 8211 8222 Y CHEN 2021 J WANG 2020 1062 1066 Z CORMA 1995 2 8 A ANDERSON 1946 686 691 R BARRETT 1951 373 380 E ZHAI 2018 M MASUDA 2003 133 144 T POLOZIJ 2014 10443 10450 M CORMA 2000 218 224 A ZHANG 2012 103 110 B KNYAZEVA 2019 1939 1945 E BRUNAUER 1940 1723 1732 S YOU 2018 56 58 Y CORMA 1995 576 582 A KENNEDY 1999 385 399 G VJUNOV 2014 8296 8306 A ZHOU 2006 11 19 D CHEN 2016 2299 2313 J XU 2014 49 50 R MA 2001 1770 1779 D BAOX2022X118741 BAOX2022X118741XR 2024-06-29T00:00:00.000Z 2024-06-29T00:00:00.000Z http://creativecommons.org/licenses/by-nc-nd/4.0/ © 2022 Elsevier B.V. All rights reserved. 2022-07-07T04:34:09.339Z http://vtw.elsevier.com/data/voc/AddOnTypes/50.7/aggregated-refined 0 https://doi.org/10.15223/policy-017 https://doi.org/10.15223/policy-037 https://doi.org/10.15223/policy-012 https://doi.org/10.15223/policy-029 https://doi.org/10.15223/policy-004 item S0926-860X(22)00264-2 S0926860X22002642 1-s2.0-S0926860X22002642 10.1016/j.apcata.2022.118741 271346 2024-01-01T12:34:28.416125Z 2022-08-05 1-s2.0-S0926860X22002642-main.pdf https://s3-eu-west-1.amazonaws.com/prod-ucs-content-store-eu-west/content/pii:S0926860X22002642/MAIN/application/pdf/460816fbe0164412fed18da8fdd1ee97/main.pdf main.pdf pdf true 4324610 MAIN 8 1-s2.0-S0926860X22002642-main_1.png https://s3-eu-west-1.amazonaws.com/prod-ucs-content-store-eu-west/content/pii:S0926860X22002642/PREVIEW/image/png/1728b1e82e8d998cc7bf2cee46a4101d/main_1.png main_1.png png 56764 849 656 IMAGE-WEB-PDF 1 1-s2.0-S0926860X22002642-sc1.jpg https://s3-eu-west-1.amazonaws.com/prod-ucs-content-store-eu-west/content/pii:S0926860X22002642/sc1/DOWNSAMPLED/image/jpeg/b5b2259fee9396d5a3145598c141879c/sc1.jpg sc1 sc1.jpg jpg 15646 213 376 IMAGE-DOWNSAMPLED 1-s2.0-S0926860X22002642-gr9.jpg https://s3-eu-west-1.amazonaws.com/prod-ucs-content-store-eu-west/content/pii:S0926860X22002642/gr9/DOWNSAMPLED/image/jpeg/d93b86bdbd74b371ff38e709a3c71d33/gr9.jpg gr9 gr9.jpg jpg 44834 307 659 IMAGE-DOWNSAMPLED 1-s2.0-S0926860X22002642-gr8.jpg https://s3-eu-west-1.amazonaws.com/prod-ucs-content-store-eu-west/content/pii:S0926860X22002642/gr8/DOWNSAMPLED/image/jpeg/764b33a1659c771c41c85fc1a12c6c1a/gr8.jpg gr8 gr8.jpg jpg 16840 280 339 IMAGE-DOWNSAMPLED 1-s2.0-S0926860X22002642-gr7.jpg https://s3-eu-west-1.amazonaws.com/prod-ucs-content-store-eu-west/content/pii:S0926860X22002642/gr7/DOWNSAMPLED/image/jpeg/7d6cca108bb109e4087ea2a177f50883/gr7.jpg gr7 gr7.jpg jpg 35629 254 659 IMAGE-DOWNSAMPLED 1-s2.0-S0926860X22002642-gr6.jpg https://s3-eu-west-1.amazonaws.com/prod-ucs-content-store-eu-west/content/pii:S0926860X22002642/gr6/DOWNSAMPLED/image/jpeg/5b787281b0808fd01588ec4ff66fde00/gr6.jpg gr6 gr6.jpg jpg 32036 257 659 IMAGE-DOWNSAMPLED 1-s2.0-S0926860X22002642-gr5.jpg https://s3-eu-west-1.amazonaws.com/prod-ucs-content-store-eu-west/content/pii:S0926860X22002642/gr5/DOWNSAMPLED/image/jpeg/fe0e0cedfc2301a1b04a20501549db46/gr5.jpg gr5 gr5.jpg jpg 32741 270 659 IMAGE-DOWNSAMPLED 1-s2.0-S0926860X22002642-gr4.jpg https://s3-eu-west-1.amazonaws.com/prod-ucs-content-store-eu-west/content/pii:S0926860X22002642/gr4/DOWNSAMPLED/image/jpeg/13e42bac8be0a42007530b11f42afa66/gr4.jpg gr4 gr4.jpg jpg 20301 285 339 IMAGE-DOWNSAMPLED 1-s2.0-S0926860X22002642-gr3.jpg https://s3-eu-west-1.amazonaws.com/prod-ucs-content-store-eu-west/content/pii:S0926860X22002642/gr3/DOWNSAMPLED/image/jpeg/b06863458caa0cbd2d6e416e90a94e02/gr3.jpg gr3 gr3.jpg jpg 124431 437 659 IMAGE-DOWNSAMPLED 1-s2.0-S0926860X22002642-gr2.jpg https://s3-eu-west-1.amazonaws.com/prod-ucs-content-store-eu-west/content/pii:S0926860X22002642/gr2/DOWNSAMPLED/image/jpeg/b9f457892f98bbd0d836cc089d437e95/gr2.jpg gr2 gr2.jpg jpg 24829 282 339 IMAGE-DOWNSAMPLED 1-s2.0-S0926860X22002642-ga1.jpg https://s3-eu-west-1.amazonaws.com/prod-ucs-content-store-eu-west/content/pii:S0926860X22002642/ga1/DOWNSAMPLED/image/jpeg/a76796f2e1080dcb8c44fe043eb4954d/ga1.jpg ga1 true ga1.jpg jpg 18988 200 316 IMAGE-DOWNSAMPLED 1-s2.0-S0926860X22002642-gr1.jpg https://s3-eu-west-1.amazonaws.com/prod-ucs-content-store-eu-west/content/pii:S0926860X22002642/gr1/DOWNSAMPLED/image/jpeg/165aa72c1e8835c4b6e0d2e3dac5c16e/gr1.jpg gr1 gr1.jpg jpg 26523 284 339 IMAGE-DOWNSAMPLED 1-s2.0-S0926860X22002642-sc1.sml https://s3-eu-west-1.amazonaws.com/prod-ucs-content-store-eu-west/content/pii:S0926860X22002642/sc1/THUMBNAIL/image/gif/a95361c1dcb4eb9e014a40f8f2208f31/sc1.sml sc1 sc1.sml sml 4503 124 219 IMAGE-THUMBNAIL 1-s2.0-S0926860X22002642-gr9.sml https://s3-eu-west-1.amazonaws.com/prod-ucs-content-store-eu-west/content/pii:S0926860X22002642/gr9/THUMBNAIL/image/gif/8011fe4edb6ce03f694719fda7f9cbd3/gr9.sml gr9 gr9.sml sml 7560 102 219 IMAGE-THUMBNAIL 1-s2.0-S0926860X22002642-gr8.sml https://s3-eu-west-1.amazonaws.com/prod-ucs-content-store-eu-west/content/pii:S0926860X22002642/gr8/THUMBNAIL/image/gif/8be346a596999526e224135b1408fa5e/gr8.sml gr8 gr8.sml sml 5787 164 198 IMAGE-THUMBNAIL 1-s2.0-S0926860X22002642-gr7.sml https://s3-eu-west-1.amazonaws.com/prod-ucs-content-store-eu-west/content/pii:S0926860X22002642/gr7/THUMBNAIL/image/gif/eb9e4284750a7af4df0d5201341550da/gr7.sml gr7 gr7.sml sml 5792 84 219 IMAGE-THUMBNAIL 1-s2.0-S0926860X22002642-gr6.sml https://s3-eu-west-1.amazonaws.com/prod-ucs-content-store-eu-west/content/pii:S0926860X22002642/gr6/THUMBNAIL/image/gif/b74accb7ea1f4eca5fe2f438f7993773/gr6.sml gr6 gr6.sml sml 5269 85 219 IMAGE-THUMBNAIL 1-s2.0-S0926860X22002642-gr5.sml https://s3-eu-west-1.amazonaws.com/prod-ucs-content-store-eu-west/content/pii:S0926860X22002642/gr5/THUMBNAIL/image/gif/b79405dd54b04479992e79e31c492f31/gr5.sml gr5 gr5.sml sml 5070 90 219 IMAGE-THUMBNAIL 1-s2.0-S0926860X22002642-gr4.sml https://s3-eu-west-1.amazonaws.com/prod-ucs-content-store-eu-west/content/pii:S0926860X22002642/gr4/THUMBNAIL/image/gif/1a647175c9544fe8b432d8d3591361ae/gr4.sml gr4 gr4.sml sml 7277 164 195 IMAGE-THUMBNAIL 1-s2.0-S0926860X22002642-gr3.sml https://s3-eu-west-1.amazonaws.com/prod-ucs-content-store-eu-west/content/pii:S0926860X22002642/gr3/THUMBNAIL/image/gif/8d6a07d7863594ca2e73acca51ba8124/gr3.sml gr3 gr3.sml sml 26076 145 219 IMAGE-THUMBNAIL 1-s2.0-S0926860X22002642-gr2.sml https://s3-eu-west-1.amazonaws.com/prod-ucs-content-store-eu-west/content/pii:S0926860X22002642/gr2/THUMBNAIL/image/gif/63ca1a4c077f118be7a4524fc6c475a4/gr2.sml gr2 gr2.sml sml 8785 164 197 IMAGE-THUMBNAIL 1-s2.0-S0926860X22002642-ga1.sml https://s3-eu-west-1.amazonaws.com/prod-ucs-content-store-eu-west/content/pii:S0926860X22002642/ga1/THUMBNAIL/image/gif/92be4ea0beb8143f483a0bfa125a318c/ga1.sml ga1 true ga1.sml sml 10613 139 219 IMAGE-THUMBNAIL 1-s2.0-S0926860X22002642-gr1.sml https://s3-eu-west-1.amazonaws.com/prod-ucs-content-store-eu-west/content/pii:S0926860X22002642/gr1/THUMBNAIL/image/gif/65fb8641c30eb0c9a1fdbc52c8a67f69/gr1.sml gr1 gr1.sml sml 9080 164 195 IMAGE-THUMBNAIL 1-s2.0-S0926860X22002642-sc1_lrg.jpg https://s3-eu-west-1.amazonaws.com/prod-ucs-content-store-eu-west/content/pii:S0926860X22002642/sc1/HIGHRES/image/jpeg/a7942069e28456e93d4d36fb793268f7/sc1_lrg.jpg sc1 sc1_lrg.jpg jpg 80961 944 1663 IMAGE-HIGH-RES 1-s2.0-S0926860X22002642-gr9_lrg.jpg https://s3-eu-west-1.amazonaws.com/prod-ucs-content-store-eu-west/content/pii:S0926860X22002642/gr9/HIGHRES/image/jpeg/1035180b59adc7355c7f7f2780e7bcbf/gr9_lrg.jpg gr9 gr9_lrg.jpg jpg 207469 1354 2911 IMAGE-HIGH-RES 1-s2.0-S0926860X22002642-gr8_lrg.jpg https://s3-eu-west-1.amazonaws.com/prod-ucs-content-store-eu-west/content/pii:S0926860X22002642/gr8/HIGHRES/image/jpeg/365e8caa6da0a49b00a46c5c902ec02d/gr8_lrg.jpg gr8 gr8_lrg.jpg jpg 79998 1238 1497 IMAGE-HIGH-RES 1-s2.0-S0926860X22002642-gr7_lrg.jpg https://s3-eu-west-1.amazonaws.com/prod-ucs-content-store-eu-west/content/pii:S0926860X22002642/gr7/HIGHRES/image/jpeg/c7f8a99b00ffc3ba062d435e43a7f9c9/gr7_lrg.jpg gr7 gr7_lrg.jpg jpg 173918 1121 2911 IMAGE-HIGH-RES 1-s2.0-S0926860X22002642-gr6_lrg.jpg https://s3-eu-west-1.amazonaws.com/prod-ucs-content-store-eu-west/content/pii:S0926860X22002642/gr6/HIGHRES/image/jpeg/8c268a751678f4a26f3d40a9b32f5912/gr6_lrg.jpg gr6 gr6_lrg.jpg jpg 168727 1136 2911 IMAGE-HIGH-RES 1-s2.0-S0926860X22002642-gr5_lrg.jpg https://s3-eu-west-1.amazonaws.com/prod-ucs-content-store-eu-west/content/pii:S0926860X22002642/gr5/HIGHRES/image/jpeg/b487292c5e2ee6011ee40804b1f566a2/gr5_lrg.jpg gr5 gr5_lrg.jpg jpg 156671 1193 2911 IMAGE-HIGH-RES 1-s2.0-S0926860X22002642-gr4_lrg.jpg https://s3-eu-west-1.amazonaws.com/prod-ucs-content-store-eu-west/content/pii:S0926860X22002642/gr4/HIGHRES/image/jpeg/507a39d7af5a26255fbd5c028be82331/gr4_lrg.jpg gr4 gr4_lrg.jpg jpg 113683 1257 1497 IMAGE-HIGH-RES 1-s2.0-S0926860X22002642-gr3_lrg.jpg https://s3-eu-west-1.amazonaws.com/prod-ucs-content-store-eu-west/content/pii:S0926860X22002642/gr3/HIGHRES/image/jpeg/4cf2eea2e38e71d95eff808f0b6b83c9/gr3_lrg.jpg gr3 gr3_lrg.jpg jpg 641547 1931 2911 IMAGE-HIGH-RES 1-s2.0-S0926860X22002642-gr2_lrg.jpg https://s3-eu-west-1.amazonaws.com/prod-ucs-content-store-eu-west/content/pii:S0926860X22002642/gr2/HIGHRES/image/jpeg/24bb05dc83852ab11c49063ec629b63e/gr2_lrg.jpg gr2 gr2_lrg.jpg jpg 137500 1244 1497 IMAGE-HIGH-RES 1-s2.0-S0926860X22002642-ga1_lrg.jpg https://s3-eu-west-1.amazonaws.com/prod-ucs-content-store-eu-west/content/pii:S0926860X22002642/ga1/HIGHRES/image/jpeg/85e0846d27c5c4ff34f9ad6834f69798/ga1_lrg.jpg ga1 true ga1_lrg.jpg jpg 156890 886 1400 IMAGE-HIGH-RES 1-s2.0-S0926860X22002642-gr1_lrg.jpg https://s3-eu-west-1.amazonaws.com/prod-ucs-content-store-eu-west/content/pii:S0926860X22002642/gr1/HIGHRES/image/jpeg/093946588eb15c33c45f434c1a088203/gr1_lrg.jpg gr1 gr1_lrg.jpg jpg 123417 1256 1497 IMAGE-HIGH-RES 1-s2.0-S0926860X22002642-mmc1.docx https://s3-eu-west-1.amazonaws.com/prod-ucs-content-store-eu-west/content/pii:S0926860X22002642/mmc1/MAIN/application/vnd.openxmlformats-officedocument.wordprocessingml.document/872e40256dac7f41edc773849cb8f5d2/mmc1.docx mmc1 mmc1.docx docx 897665 APPLICATION 1-s2.0-S0926860X22002642-si0001.svg https://s3-eu-west-1.amazonaws.com/prod-ucs-content-store-eu-west/content/pii:S0926860X22002642/STRIPIN/image/svg+xml/00b5ffdaa47e84fd29fe6916d3a6fc03/si0001.svg si0001 si0001.svg svg 4222 ALTIMG 1-s2.0-S0926860X22002642-si0002.svg https://s3-eu-west-1.amazonaws.com/prod-ucs-content-store-eu-west/content/pii:S0926860X22002642/STRIPIN/image/svg+xml/c2527fa05b57c2d8c5d1219d8870dcca/si0002.svg si0002 si0002.svg svg 1179 ALTIMG 1-s2.0-S0926860X22002642-si0003.svg https://s3-eu-west-1.amazonaws.com/prod-ucs-content-store-eu-west/content/pii:S0926860X22002642/STRIPIN/image/svg+xml/1843376f2c11fd92719f7076c384ac1b/si0003.svg si0003 si0003.svg svg 1045 ALTIMG 1-s2.0-S0926860X22002642-si0004.svg https://s3-eu-west-1.amazonaws.com/prod-ucs-content-store-eu-west/content/pii:S0926860X22002642/STRIPIN/image/svg+xml/4483b77ac6b9c5061c4f04a3a3be2530/si0004.svg si0004 si0004.svg svg 6236 ALTIMG 1-s2.0-S0926860X22002642-si0005.svg https://s3-eu-west-1.amazonaws.com/prod-ucs-content-store-eu-west/content/pii:S0926860X22002642/STRIPIN/image/svg+xml/a1789fe9e1ec5b7f945751567c5bfa7e/si0005.svg si0005 si0005.svg svg 1612 ALTIMG 1-s2.0-S0926860X22002642-si0006.svg https://s3-eu-west-1.amazonaws.com/prod-ucs-content-store-eu-west/content/pii:S0926860X22002642/STRIPIN/image/svg+xml/80318c91d912e6c11307d14a927719ae/si0006.svg si0006 si0006.svg svg 5920 ALTIMG 1-s2.0-S0926860X22002642-am.pdf am am.pdf pdf 1252775 AAM-PDF https://s3-eu-west-1.amazonaws.com/prod-ucs-content-store-eu-west/content/egi:10VWM7VQ439/MAIN/application/pdf/29877190d1e9b156ccbb5fdb709d743c/am.pdf APCATA 118741 118741 S0926-860X(22)00264-2 10.1016/j.apcata.2022.118741 Elsevier B.V. Fig. 1 XRD patterns of the MWW zeolite precursors The samples were hydrothermally synthesized at HMI/SiO2 = 0.25 and DCHA/SiO2 = 0(a), 0.2(b), 0.4(c), 0.6(d), 0.8(e). Fig. 1 Fig. 2 An overall landscape of crystallization products with different concentrations of HMI and DCHA (The number in bracket represents the molar ratio of HMI to DCHA). Fig. 2 Fig. 3 SEM and TEM images of the studied crystallization products (M1, M2, M3 and M4). Fig. 3 Fig. 4 FTIR spectra of MCM-22 (M1) and delaminated MWW (M2) at 373 K. Fig. 4 Fig. 5 FTIR spectra of MCM-22 (M1) and delaminated MWW (M2) after absorption of pyridine (left) and 2,6-di-tert-butylpyridine (right) at 473 K. Fig. 5 Fig. 6 27Al MAS NMR spectra of MCM-22 (M1) and delaminated MWW (M2). Fig. 6 Fig. 7 29Si MAS NMR spectra of MCM-22 (M1) and delaminated MWW (M2). Fig. 7 Fig. 8 Dependence of cyclohexene conversion on the reaction temperature of MCM-22 (M1) and delaminated MWW (M2) Reaction conditions: P = 2.0 MPa, benzene/cyclohexene mole ratio = 10, TOS = 24 h, catalyst amount = 1.50 g (5.00 mL), WHSV = 3.65 h−1. Fig. 8 Fig. 9 Dependence of cyclohexene conversion (a) and product selectivity (b) in benzene alkylation with cyclohexene on the TOS over MCM-22 (M1) and delaminated MWW (M2) Reaction conditions: 423 K, 2.0 MPa, benzene/cyclohexene mole ratio = 10, catalyst amount = 1.50 g (5.00 mL), WHSV = 3.65 h−1. Fig. 9 Scheme 1 A brief reaction network of benzene alkylation with cyclohexene. Scheme 1 Table 1 Physicochemical properties of the studied samples. Table 1 Samples HMI/DCHA molar ratio SBET (m²·g−1) Smicro (m²·g−1) Sexternal (m²·g−1) DI a Vtotal (cm³·g−1) Vmicro (cm³·g−1) SiO2/Al2O3 molar ratio M1 ∞ 540 407 143 0.26 0.720 0.170 31.5 M2 1.25 503 266 237 0.47 1.040 0.136 31.4 M3 0.50 434 199 235 0.54 0.805 0.108 30.8 M4 0.38 133 42 91 0.68 0.321 0.020 31.0 a DI is the ratio of Sexternal / SBET Table 2 27Al MAS NMR data of MCM-22 (M1) and delaminated MWW (M2). Table 2 Samples AlF (%) AlEF (%) Total Al[61] Al[56] Al[50] M1 85.9 13.8 53.8 18.3 14.1 M2 86.7 22.9 47.4 16.4 13.3 Table 3 The apparent diffusion coefficient (ADC) of EB and CHB through MCM-22 (M1) and delaminated MWW (M2). Table 3 Samples ADC / 10−17·cm²·s−1 EB CHB M1 11.6 1.87 M2 19.8 7.34 Table 4 Component composition and product selectivity of benzene alkylation with cyclohexene over M1 and M2, at 423 K, 2.0 MPa, TOS = 24 h, benzene/cyclohexene molar ratio = 10, WHSV = 3.65 h−1. Table 4 Component Content in Feed, wt% Content in Effluent, wt% Selectivity, mol% M1 M2 M1 M2 Benzene 90.89 83.56 83.12 NA NA Cyclohexene 9.11 0 0 NA NA CHB a 0 14.25 15.31 83.8 88.7 DCHB a 0 1.30 0.87 10.0 6.7 ∑ (Cyclohexylation Products) 93.8 95.4 (Isomerization Products) MCPB a 0 0.29 0.32 1.7 1.9 (Cracking Products) Non-Aromatics(C2~C5) 0 0.04 0.04 0.5 0.4 Aromatics(C7~C11) b 0 0.10 0.08 0.4 0.3 Aromatics(C13~C17) c 0 0.13 0.08 0.9 0.6 (Oligomerization Products) CHCHs a 0 0.01 0 0.1 0 (High-aromatics) Other C18 Aromatics 0 0.28 0.17 2.2 1.3 C19 + Aromatics 0 0.04 0.01 0.4 0.1 a CHB: cyclohexylbenzene; DCHB: 1,3-dicyclohexylbenzene & 1,4-dicyclohexylbenzene; MCPB: methylcyclopentylbenzene; CHCHs: Cyclohexylcyclohexene and isomers b calculated as C9 aromatics c calculated as C15 aromatics Delaminated MWW-type zeolite and its catalytic performance in alkylation of benzene with cyclohexene Ruirui Bao a Zhenhao Shen b ⁎ Chongwei Ma b Liyuan Li b Yiyan Wang b Hongmin Sun b Weimin Yang a b ⁎⁎ a School of Chemical Engineering, East China University of Science and Technology, Shanghai 200237, PR China School of Chemical Engineering, East China University of Science and Technology Shanghai 200237 PR China School of Chemical Engineering, East China University of Science and Technology, Shanghai 200237, PR China b State Key Laboratory of Green Chemical Engineering and Industrial Catalysis, Sinopec Shanghai Research Institute of Petrochemical Technology, Shanghai 201208, PR China State Key Laboratory of Green Chemical Engineering and Industrial Catalysis, Sinopec Shanghai Research Institute of Petrochemical Technology Shanghai 201208 PR China State Key Laboratory of Green Chemical Engineering and Industrial Catalysis, Sinopec Shanghai Research Institute of Petrochemical Technology, Shanghai 201208, PR China ⁎ Corresponding author. ⁎⁎ Corresponding author at: School of Chemical Engineering, East China University of Science and Technology, Shanghai 200237, PR China. School of Chemical Engineering, East China University of Science and Technology Shanghai 200237 PR China. A type of delaminated MWW zeolite is synthesized in the presence of hexamethyleneimine and dicyclohexylamine via a hydrothermal crystallization method. The appropriate molar ratio range of HMI/DCHA is found to correlate with the laminar morphology and crystallinity of the prepared zeolite samples. The delaminated MWW zeolite possesses thinner layered structure, larger external surface area and more accessible active sites than the conventional MCM-22 sample, and its protonated form can be used as a superb catalyst in benzene alkylation with cyclohexene. Under the optimized reaction conditions, the conversion of cyclohexene reaches 99.9 % while the selectivity to the target products, cyclohexylbenzene and dicyclohexylbenzene is 95.4 % in 1000 h lifetime experiment. Because of better diffusion properties and more abundant accessible acid sites on external surface, the delaminated MWW is superior to the conventional MCM-22 in benzene alkylation with cyclohexene, despite of the similar microporous structure and bulk acid properties of these two samples. Graphical Abstract ga1 Keywords Delaminated MWW zeolite External surface Accessible active sites Alkylation of benzene Cyclohexene Cyclohexylbenzene 1 Introduction Cyclohexylbenzene (CHB) is a high value-added organic intermediate, which can be used as electrolyte additive of lithium-ion battery. It is also a raw material in the manufacture of liquid crystal display (LCD) [1,2], phenol/cyclohexanone [3,4], high-end plastics, coatings and adhesives, whose demand is gradually expanded by the development of its application fields [5]. Practically, CHB can be synthesized via alkylation of benzene with cyclohexene or cyclohexanol in the presence of a protonic acid (e.g. sulfuric acid, hydrofluoric acid, etc.) and/or a Lewis acid (e.g. aluminum chloride), but the process with these homogeneous catalysts has several problems, i.e. environment pollution and equipment corrosion, which cannot meet the trend of green chemical industry [6,7]. Zeolite, a kind of microporous material, can be used as a heterogeneous catalyst in some acid catalyzed reactions, such as alkylation, isomerization, transalkylation and disproportionation of aromatics [8,9]. The commercial processes for ethylbenzene [10] or cumene [11] manufacture in the presence of protonated ZSM-5, Y, Beta or MCM-22 [12,13] are good examples of the green applications of zeolites. However, few literatures have been reported so far on the alkylation of benzene with cyclohexene to CHB catalyzed by microporous zeolites, mainly due to the large molecular size of CHB, which could cause limited diffusion and consequently rapid deactivation of catalysts [14]. On the other hand, CHB can also be prepared by benzene hydroalkylation, which has been reported to have potential economic efficiency [15–19]. This process requires a bi-functional catalyst containing metallic active sites and acidic active sites, and is more complicated than benzene alkylation with cyclohexene [20]. The matching of the both active sites is still a problem to solve. MCM-22 is a typical MWW-type lamellar zeolite, whose precursors with loose bonding between layers show structural diversity and variability. MWW-type zeolite has two independent pore systems [21]: a 10-MR channel system (4.1 Å × 5.1 Å) within layers and a 12-MR supercages (7.1 Å × 18.2 Å) connected by 10-MR openings (4.0 Å × 5.5 Å). The 12-MR supercages are expressed as semi-supercage cups on the external surface [22]. MCM-22 is proved to be a highly active and selective catalyst in many organic chemical reaction, e.g. manufacture of ethylbenzene or cumene. However, once applied in the reactions associated with large organic molecules, rapid deactivation may become the main obstacle to the practical application of MCM-22, due to the diffusion problems. The most effective way to improve the catalytic performance of MWW-type zeolites is to expose more external semi-supercage cups without damaging them. The synthesis of delaminated zeolites with high external surface area and more external acid sites has become one of the most interesting topics in this research field [23,24]. By post-synthesis, ITQ-2 [25], a representative delaminated MWW-type zeolite, can be prepared by swelling and ultrasonic stripping of three-dimensional MCM-22 precursor in the presence of surfactants. However, the preparation procedure of ITQ-2 is considered to be complex, difficult to control and expensive. The situation of MCM-36 [26], developed by Mobil, is similar with that of ITQ-2. As a result, they are not suitable for a practical catalytic process. Therefore, one-step synthesis of delaminated MWW zeolites has attracted extensive attention [27,28]. Zhou et al. [29] directly synthesized disordered 2D MWW zeolites in the presence of cetyltrimethylammonium (CTA) surfactant. The disordered 2D MWW zeolites can be used in the alkylation of benzene with benzyl alcohol, in which conversion of benzyl alcohol can be increased by 30 %. Using hexamethyleneimine (HMI) and commercially available amphiphilic organosilane ([(CH3O)3SiC3H6N(CH3)2C18H37]Cl, TPOAC) as combinational SDAs, Chen et al. [30] studied the controlled direct synthesis of single-unit-cell (SL-) to multi-layered (mL-) MWW zeolite, and its high catalytic performance was demonstrated in the alkylation of benzene with 1-dodecene as a model reaction. In our previous work [31], a method for the direct synthesis of a delaminated MWW-type zeolite was achieved by introducing dicyclohexylamine (DCHA) as an assistant organic additive into the conventional synthesis system. This newly developed zeolite, named as SCM-1, can act as a highly efficient catalyst in alkylation of benzene with ethylene. However, the synthesis conditions, as well as the catalytic adaptability in alkylation of benzene with cyclohexene to produce CHB, has rarely been reported yet. In this paper, the direct synthesis of delaminated MWW zeolite using HMI and DCHA is carefully investigated. Herein, a comparison in the physicochemical properties, including the textual properties, the distribution of framework Al atoms and the external acidity, between as-prepared delaminated MWW zeolite and the conventional MCM-22 is demonstrated. Moreover, the delaminated MWW zeolite catalyst is tested as a catalyst in alkylation of benzene with cyclohexene to CHB and DCHB. 2 Experimental 2.1 Materials Delaminated MWW zeolites [31] and conventional MCM-22 [32] were synthesized using colloidal silica (Merck, LUDOX 40 %) and sodium metaaluminate (Aldrich, Al2O3 = 42 %) as silicon and aluminum sources, respectively. Hexamethyleneimine (HMI, Alfa Aesar, 98 %) was used as the organic structure-directing agent (OSDA), while dicyclohexylamine (DCHA) (Sinopharm, 97 %) was used as a delaminating additive. The precursors gels were prepared with molar compositions of 1.0 SiO2: 1/30 Al2O3: 0.04 Na2O: x HMI: y DCHA: 20 H2O, where x and y were variable from 0 to 0.8. Crystallization was carried out in teﬂon-lined stainless autoclaves under rotation (30 rpm) at 423 K for 2 d. After washing and filtration the solid products were then dried at 423 K overnight. The as-synthesized precursors were calcined in air at 823 K for 5 h to remove the organic species and were then ion-exchanged in 1 M NH4NO3 aqueous solution at room temperature for 4 times. After dried at 423 K overnight, the samples were then calcined at 823 K in air for 5 h and prepared as 20–40 mesh granules for catalytic performance test. In particular, the four representative samples denoted as M1 (x = 0.35, y = 0), M2 (x = 0.25, y = 0.2), M3 (x = 0.2, y = 0.4) and M4 (x = 0.15, y = 0.4) are synthesized according to the above procedure, where x and y represent the molar ratios of HMI to SiO2 and DCHA to SiO2 in the synthesis gel, respectively. 2.2 Characterization X-ray powder diffraction (XRD) patterns were recorded on a Bruker D8 Advance diffractometer equipped with a rotating anode and Cu-Kα1 radiation (λ = 1.54056 Å, 40 kV, 40 mA), with a scan rate of 2°·min−1. The scanning electron microscopy (SEM) images were taken by a field emission scanning electron microscope (Hitachi S-4800, 2 kV). Transmission electron microscopy (TEM) images were recorded on a Tecnai G220 S-TWIN (200 kV). Nitrogen ad-/desorption isotherms were collected on a Micromeritics ASAP-2000 instrument at 77 K. Samples were evacuated at 573 K for 4 h before measurement. The specific surface area and pore size distribution were calculated by the BET method [33] and BJH model [34], respectively, and t-plot curve method was used to calculate the microporous surface area and microporous pore volume. The SiO2/Al2O3 molar ratios were measured by chemical analysis in assistance of inductively coupled plasma (ICP) method. FTIR spectroscopy was used to characterize hydroxyl groups in various materials, the infrared spectrum was obtained by Nicolet Nexus 5700 FTIR spectrometer. The pyridine (Py-FTIR) and 2,6-di-tert-butylpyridine (DTBPy-FTIR) absorption infrared spectroscopy experiments were performed using a vacuum adsorption system followed by FTIR testing. All the samples were activated at 673 K in vacuum for 2 h. Adsorption occurred at 473 K in a saturated atmosphere of pyridine or 2,6-di-tert-butylpyridine for 10 min followed by degassing to less than 0.1 Pa. Then desorption was carried out at 473 K, 573 K and 673 K, respectively. Absorbance at specific wavenumbers was gathered to estimate the amounts of acid sites. 27Al MAS NMR and 29Si MAS NMR were performed on a JEOL 500 MHz (11.7 T) spectrometer using a 3.2 mm HX MAS NMR probe at resonance frequencies of 130.3, and 99.4 MHz and spun at a MAS rate of 18 kHz, respectively. The spectra were recorded after single-pulse π/12 and π/2 excitation with repetition times of 0.5 and 90 s for studying 27Al and 29Si nuclei, respectively. The 27Al and 29Si chemical shift scales were referenced externally using 1 M aqueous solution Al(NO3)3 at δ = 0 ppm and DSS at δ = 1.53 ppm, respectively. 2.3 Diffusivity property measurements The diffusivity of ethylbenzene (EB) and cyclohexylbenzene (CHB) in the zeolite samples were measured by gravimetric analysis method [35] using an Intelligent Gravimetric Analyzer instrument (model IGA-100) from Hiden Analytical Ltd., Warrington, UK. The calcined sample (0.10 g) was pretreated at a pressure below 10⁠−6 Pa at 573 K for 3 h to remove the adsorbed impurities before the sample held a constant weight. Afterwards, the sample was cooled to 373 K and the contacting gas was replaced by a preset amount of gaseous, consisting of EB or CHB. Isotherms and the corresponding kinetics of adsorption were determined at varied partial pressure (P/P⁠0 = 0–1). The effective diffusivity was fitted by Fick’s 2 nd Law [36]. MWW zeolite is a lamellar structure material, the solution of corresponding equation can be well approximated by Eq. (2–1): (2−1) M T M ∞ = 1 − ∑ n = 0 ∞ 8 2 n + 1 π 2 exp − D 2 n + 1 2 π 2 t h 2 Where ‘D′ is the apparent diffusion coefficient (ADC), ‘h′ is the layer thickness of the material, ‘M t ’ is the adsorption capacity at time t, and ‘ M ∞ ’ is the saturated adsorption capacity at equilibrium. 2.4 Catalytic performance testing The protonated samples (20–40 mesh) were tested in alkylation of benzene with cyclohexene. Catalyst samples (typically 5.0 mL, 1.50 g) were loaded in the middle of a stainless fixed-bed reactor with an inner diameter of 12 mm. At the beginning of reaction, the required reaction temperature and pressure were needed to be well adjusted before a mixture of benzene and cyclohexene was introduced to the reactor to initiate the alkylation reaction. The reactor was then brought to the reaction temperature of 373–443 K where the alkylation was operated continuously at 2.0 MPa, benzene to cyclohexene molar ratio at 10:1, the weight hourly space velocity (WHSV) at 3.65 or 18.2 h−1 for total feed, and the corresponding flow rate at 5.48 g·h−1 (6.30 mL·h−1). The reaction feed or effluent was analyzed by an online gas chromatograph equipped with a high pressure liquid sample injector, a flame ionization detector (FID) and a capillary column (HP-FFAP, 50 m × 0.2 mm × 0.33 µm). The conversion and selectivity were calculated according to the methods below. As the high pressure liquid sample injector can ensure a total component analysis for the feed or effluent, the conversion ( X ) of cyclohexene can be calculated by Eq. (2–2), in which “w” is representative to mass concentration of cyclohexene before or after reaction. (2−2) X Cyclohexene = w cyclohexene before reaction − w cyclohexene after reaction w cyclohexene before reaction × 100 % In Eq. (2–3), the selectivity to a specific product can be calculated, where \"n < CH 2 > P ” is representative to the molar fraction of total “CH 2 ” group discounting benzene ring. The equation indicates how many cyclohexyl groups enter the specific product via alkylation, isomerization, oligomerization, cracking, etc. (2−3) Selectivity to a specific product ( P ) = n < CH 2 > P n < CH 2 > Total − n < CH 2 > cyclohexene × 100 % 3 Results and discussion 3.1 Physicochemical property of the MWW samples The influence of DCHA/SiO2 ratios to the crystallization products was investigated at a fixed HMI/SiO2 molar ratio of 0.25, and the XRD patterns are shown in Fig. 1. The pattern of MCM-22 (a) shows four intense peaks, at 3.2° (001), 6.5° (002), 7.8° (101) and 9.5° (102), due to interlayer diffraction about c-axis [23,37]. With the increase of DCHA/SiO2 ratio, the (001) and (002) diffraction peaks are weakened, and the (101) and (102) diffraction peaks grow weak and broad, indicating the disordered arrangement of MWW layers along the c-axis affected by DCHA [38,39]. The peaks at 7.5° and 26.0° are corresponding to (100) and (310) lattice plane, respectively, which represent the intralayer diffraction along a- or b-axis. Their intensities also decrease with the increase of DCHA/SiO2 ratio, which marks the slow rate of crystallization. When the DCHA/SiO2 ratio is higher than 0.6, MWW morphology is difficult to be formed. The amorphous product will be acquired, when DCHA/SiO2 ratio is higher than 0.8. As shown in Fig. 2, appropriate ratio of HMI to DCHA is found to determine the morphology of the crystallization products, from amorphous products to delaminated or conventional MWW. Among all the hydrothermally synthesized samples listed in Fig. 2, four representative ones, denoted as M1, M2, M3 and M4, were selected for comparison, whose XRD patterns are shown in Fig. S1. As the concentration of DCHA is insufficient (Fig. 2, M1), the molecules cannot be evenly inserted into MWW layers resulting in the rapid stacking of MWW layers along c-axis to form a conventional MCM-22(P) [32] morphology. On the contrary, as the quantity of DCHA is far beyond enough or the amount of HMI is low (Fig. 2, M3 and M4), the growth rate of MWW layers along a- or b-axis will be lagged. As a result, crystallization products in poor crystallinity will be got. The optimal molar ratio of HMI/DCHA is in the range is 0.56–1.25 (Fig. 2, M2), which can ensure to acquire a delaminated MWW zeolite with a high crystallinity. The SEM and TEM images of M1, M2, M3 and M4 are shown in Fig. 3. It can be observed that the samples, M1, M2 and M3, exhibit typical lamellar morphology of the MWW zeolite, while M4 is amorphous product, which is correlated with the results of XRD (Fig. S1). A considerable quantity of amorphous particles are observed in the image of M3 indicating its low crystallinity. At the same time, SEM images also show that the thickness and diameter of the lamellae of the delaminated MWW samples (M2 and M3) are obviously smaller than those of the conventional one (M1). This conclusion is consistent with the TEM results below. The TEM images of M1 and M2 reveal that the thickness of delaminated MWW sample (M2) is 2.5–5.2 nm indicating its mono-layered or dual-layered structure [40], which is obviously smaller than that of the conventional MCM-22 (M1, 11–20 nm). It can be inferred that DCHA can hinder the aggregation of MWW layers and cause their irregular arrangement. The physicochemical properties of the studied samples (M1, M2, M3 and M4) gathered by N2 physical ad-/desorption and chemical analysis are listed in Table 1. With the decrease of HMI/DCHA ratio, the proportion of external specific surface area increases (M4 > M3 > M2 > M1), but both the BET specific area and the microporous volume decrease, due to the lost in crystallinity. Under the appropriate HMI/DCHA ratio (0.56–1.25), the total pore volume reach the maximum for M2, while more inter-crystalline mesopores are produced by delaminated layer crystals. It is evident in M3 and M4, where their XRD patterns and SEM images clearly show the presence of weak diffraction peaks and an amorphous phases (Figs. S1 and 3), the microporous volume correspondingly decreases below 0.1 cm³ ·g−1 (Table 1, Vmicro), and the overall BET surface area monotonically decreases when increasing DCHA concentration (Table 1, Sext). Considering the good crystallinity and pore structure integrity of the samples, M1 and M2 are selected for physiochemical characterization and catalytic performance comparison. The N2 adsorption-desorption isotherms of MCM-22 (M1) and delaminated MWW (M2) are shown in Fig. S2. Both isotherms are belong to Type IV with an H3 hysteresis loop, indicating the existence of mesoporous structure of the material. Compared with M1, there is a dramatic increase in adsorbed volume for the M2 where P/P0 is higher than 0.8, due to the disordered stacking of MWW mono-layers. And in the region of P/P0 < 0.1, a decrease of adsorbed volume is observed, which is correlated with its loss in microporous structure [41–43]. All the samples have similar SiO2/Al2O3 molar ratio around 31 because of their same feeding ratio of Si to Al sources. 3.2 Investigation of the active sites The active sites of the studied MWW zeolite samples were investigated via FTIR and NMR technologies. The FTIR spectra of the conventional MCM-22 sample (M1) and the delaminated MWW sample (M2) are shown in Fig. 4. MWW-type zeolite has a strong absorbance peak at 3745 cm−1 that belongs to the vibration of Si-OH group on external surface and terminal hydroxyl group; the weak peaks at 3694 cm−1 and 3663 cm−1 belong respectively to the stretching vibration of Si-OH group on internal surface and the group connected with aluminum outside zeolite framework; and the peak at 3620 cm−1 is due to the stretching vibration of acid bridge hydroxyl group (Si-OH-Al) in framework [44]. Compared with conventional MCM-22 (M1), the reflection at 3745 cm−1 of the delaminated MWW (M2) is significantly enhanced, indicating that M2 has larger external surface and more terminal silicon hydroxyl species because of its good delamination status. In addition, the absorption peak at 3620 cm−1 of M2 has no significant change compared with M1, explaining that the addition of DCHA does little effect on content of framework aluminum. According to the Py-FTIR results in Fig. 5, left, and Fig. S3, both samples show two discrete absorption peaks at 1545 cm−1 and 1450 cm−1, correlated to Brønsted acid sites and Lewis acid sites, respectively. The amount of Brønsted acid sites of M2 is slightly less than that of M1 at all the temperatures, and there is little difference in the amount of Lewis acid sites. It can be concluded that the bulk acidity of both the MCM-22 (M1) and delaminated MWW (M2) are quite similar, both in acid amount and strength. This result is also in accordance with the NH3-TPD patterns of the two samples (Fig. S4). Comparatively, because the molecule size of 2,6-di-tert-butylpyridine (DTBPy) is too large to enter the 10-MR micropores of MWW zeolites, DTBPy‐FTIR was carried out to characterize the external acid sites located in the semi-supercages of MWW zeolites. In the DTBPy‐FTIR patterns (Fig. 5, right), an apparent peak at 3370 cm–1 related to the external Brønsted acid sites is found in both samples. It is remarkable that the intensity of delaminated MWW (M2) is greater than that of the conventional MCM-22 (M1), indicating that delaminated MWW has a more abundant concentration of external Brønsted acid sites. The active sites of a protonated zeolite catalyst is usually associated with its amounts and status of framework Al atoms, which can be revealed by solid state NMR spectroscopy. According to the results of 27Al MAS NMR spectra in Fig. 6, there are two evident characteristic peaks appear at 56 ppm and 0 ppm after complete hydration of both M1 and M2. The resonance at around 0 ppm is typically assigned to extra-framework Al atoms (AlEF), whereas the resonance at 56 ppm is generally assigned to framework tetrahedral coordinated Al species (AlF). And it is found that at least three peaks are superimposed to get better fitting around 56 ppm. As it has been reported, framework Al of MWW-type zeolite is composed of 8 different tetrahedral sites (T sites) [29,44] that can be distinguished by 27Al MAS NMR spectroscopy and reorganized by three groups at specific chemical shift, i.e. three overlapped signals at around 50, 56, and 61 ppm, which can be referred to the (T6 +T7), (T1 +T3 +T4 +T5 +T8) and T2 sites, respectively [45,46]. The characteristic peak at 56 ppm (Al[56]) corresponds to the distribution of AlF in the sinusoidal channel, while the peaks at 50 ppm (Al[50]) and 61 ppm (Al[61]) correspond to the 12-MR supercage and the 12-MR semi-supercage cup on the external surface, respectively [47,48]. Comparing the calculation results in Table 2, the total AlF content in both the MCM-22 (M1) and delaminated MWW (M2) is quite close, but the Al[61] content (22.9 %) in M2 is much higher than that in M1 (13.8 %), which indicates that more AlF atoms are distributed on the external surface of delaminated MWW zeolites. According to the 29Si MAS NMR spectra shown in Fig. 7, most of the Si species are Q4 [Si(OSi)4] type due to the relatively high Si/Al ratio, and the specific assignments of this broad resonance are as follows: −105 ppm, −108 ppm, −111 ppm, −113 ppm, −115 ppm and −119 ppm, corresponding to the distribution of Si at different T sites in the zeolite framework. Small parts of Q2 [Si(OH)2(OSi)2] and Q3 [Si(1Al) and Si(OH)(OSi)3] are also found at approximately −90 ppm and −100 ppm [49,50], respectively. The proportion of Q2 and Q3 is about 7.5 % in the MCM-22 sample (M1), while it reaches 11.3 % for the delaminated MWW (M2) because of its abundant silicon species between two adjacent MWW layers. It can be summarized from the aforementioned characterization data that the delaminated MWW zeolite sample possesses thinner layered structure, larger external surface area and more accessible active sites than the conventional MCM-22 sample, which will be benefit to its application in catalysis, e.g. alkylation of benzene with cyclohexene. 3.3 Catalytic performance It has been also been reported that the delaminated MWW zeolite is a superb alkylation catalyst in benzene alkylation with ethylene or propylene [31]. As the alkylation agent was substituted by cyclohexene, the molecule size of the target product, CHB, will be much larger than ethylbenzene or cumene. As a result, higher requirement is demanded for the catalytic material, especially on its diffusion properties and accessibility of active sites. One of the key points to a good performance in benzene alkylation with cyclohexene is how to eliminate the mass transfer restrictions of molecules engaged in the reaction, so as to avoid side reactions and rapid deactivation of catalyst. As shown in Fig. S5, ethylbenzene (EB) and cyclohexylbenzene CHB, with different molecular sizes, were used as probe molecules to characterize the diffusion properties of both M1 and M2 using intelligent gravimetric analyzer (IGA) method. The slopes of the curves represent the diffusion rate of the two molecules. It can be observed that the diffusion rate of the two molecules for M2 is significantly greater than M1. The apparent diffusion coefficients (ADC) of two substances in zeolites are shown in Table 3. The ADC of EB in M2 is 1.7 times as much as that of M1, while the ADC of CHB is 3.9 times. In other words, the delaminated structure of M2 helps to shorten the effective diffusion distance and promote the diffusion of the probe molecules including CHB, a target product in benzene alkylation with cyclohexene. As a result, the excellent diffusion performance of the delaminated MWW sample (M2) plays an important role in the catalytic reaction. Alkylation of benzene with cyclohexene was carried out on conventional MCM-22 (M1) and delaminated MWW (M2) under 373–443 K, and the results are shown in Fig. 8. Compared with the conventional MCM-22 (M1), cyclohexene can be more easily converted over delaminated MWW (M2). The lowest temperature to ensure a complete cyclohexene conversion for M2 is 413 K, which is 10 K lower than that for M1. This can be attributed to the fact that delaminated MWW has more external acid sites than conventional MCM-22, although it has slightly smaller amount of bulk Brønsted acid sites. The variation of product selectivity with reaction temperature is shown in Fig. S6. It can be inferred that 423 K is the optimal reaction temperature, where the selectivity to CHB reaches the peak for both M1 and M2. The component composition and the product selectivity data of the conventional MCM-22 (M1) and the delaminated MWW (M2) in benzene alkylation with cyclohexene at 423 K is compared in Table 4, where the cyclohexene conversion of each sample is almost complete. Compared with M1, the delaminated MWW (M2) is found to be more selective to cyclohexylation products. The selectivity to CHB and DCHB reaches 95.4 % over M2. And it is remarkable that the selectivity to CHB (the most desired target product) is 88.7 % over M2, about 5 % higher than that over the conventional MCM-22 sample (M1), while the selectivity to DCHB (consecutive alkylation product) is 6.7 % over M2, about 3.3 % lower than that over M1. It means that CHB is easier to diffuse through the delaminated MWW sample to avoid consecutive alkylation than through the conventional MCM-22. Moreover, less side reactions take place on M2. Isomerization of CHB leads to form methylcyclopentylbenzene (MCPB) that has a close boiling point to CHB, and it is mainly determined by reaction temperature. As a result, the selectivity data to MCPB over M1 and M2 is quite close. However, the selectivity to the by-products of cracking, oligomerization of cyclohexene and other complicated side reactions over M2 (totally 2.7 %) is only about 60 % of that over M1 (totally 4.5 %) due to good diffusion properties and abundant surface acid sites of the delaminated MWW sample (M2). Side reactions are more likely to take place on the acid sites located at internal 12-MR supercages of MWW-type zeolite, where the diffusion rate of the organic molecules, especially CHB, is low. On the basis of the selectivity data in Table 4, a brief reaction network of benzene alkylation with cyclohexene can be speculated and shown in Scheme 1. In this reaction process, protonated MWW-type zeolite provides necessary acidic active sites either for the main reaction or the side reactions. According to the results of catalytic performance test in the present work, both the conventional MCM-22 sample and the delaminated MWW sample have good cyclohexylation selectivity to get CHB and DCHB. DCHB can be converted to recover CHB in the presence of benzene in another catalytic process, namely the transalkylation process. The estimated routes of side reactions are also listed in Scheme 1. Most of the by-products could be fractionated by rectifying process, besides MCPB. In order to evaluate the lifetime of the studied MWW-type zeolites, an optimized reaction condition (423 K, 2.0 MPa, benzene/cyclohexene molar ratio = 10, WHSV = 3.65 h−1) is applied to the stability tests of the samples (M1 and M2), and the dependence of cyclohexene conversion on the time of stream (TOS) and products selectivity in the early and last stages of the reaction are shown in Fig. 9(a) and (b), respectively, where all results were selected under the condition with high cyclohexene conversion. For the delaminated MWW sample (M2), the conversion of cyclohexene is maintained above 99.9 % (Fig. 9(a)), in the range of TOS before 1100 h, indicating its single lifetime, while the selectivity to CHB and DCHB is always at about 95 % (Fig. 9(b)). For comparison, the single lifetime of the conventional MCM-22 sample (M1) is about 520 h, about a half of that of M2. The faster deactivation of M1 can be attributed to its poor diffusion properties and less amount of external acid sites. As a result, larger amount of by-products are formed on M1, as is mentioned in Fig. 9(b, left), where the heavy components could became the precursors of coking and block the diffusion pathway and active sites. In addition, a rapid aging experiment of M1 and M2 was carried out at a higher WHSV (18.2 h−1 , 423 K, 2.0 MPa, benzene to cyclohexene molar ratio at 10:1). As shown in Fig. S7, delaminated MWW (M2) has a higher initial cyclohexene conversion and lower deactivation rate than conventional MCM-22 (M1), which is also accordant with the lifetime results in Fig. 9. In summary, it can be concluded that the delaminated MWW zeolite is superior to the MCM-22 in benzene alkylation with cyclohexene due to its better diffusion properties and more accessible external active sites, despite of the similar microporous structure and bulk acid properties of these two samples. For the development of industrial catalysts for CHB production, delaminated MWW zeolites could also provide a new research orientation and have a good prospect. 4 Conclusion A type of delaminated MWW zeolite is synthesized in the presence of HMI and DCHA, where DCHA acts as a stacking inhibitor of MWW layers. The optimal molar ratio of HMI/DCHA is in the range is 0.56–1.25 ensuring to acquire a delaminated MWW zeolite with a good crystallinity. The physicochemical properties of delaminated MWW were studied by means of various characterization methods including 27Al MAS NMR and DTBPy-FTIR. Compared with the conventional MCM-22 sample, delaminated MWW possesses thinner layered structure, larger external surface area and more accessible active sites. The protonated delaminated MWW zeolite is found to be a superb catalyst in benzene alkylation with cyclohexene, whose cyclohexene conversion can reach 99.9 %, while the selectivity to CHB and DCHB is 95.4 %. Moreover, it has a single cycle length about 1100 h under the optimized reaction conditions. Its catalytic performance is superior to the conventional MCM-22 due to its good diffusion properties and abundant external acid sites. It can also be predicted that the delaminated MWW zeolite could have a good prospect in an industrial process of CHB production in the future. Declaration of Competing Interest The authors declare that they have no known competing financial interests or personal relationships that could have appeared to influence the work reported in this paper. Acknowledgements The authors wish to acknowledge the financial support by “National Natural Science Foundation of China” (U19B6002) and “National Key Research and Development Project” (2016TFB0702804). Appendix A Supporting information Supplementary data associated with this article can be found in the online version at doi:10.1016/j.apcata.2022.118741. Appendix A Supplementary material Supplementary material. . References [1] N. Scaramuzza G. Strangi C. Versace Liq. Cryst. 28 2001 307 312 N. Scaramuzza, G. Strangi, C. Versace, Liq. Cryst. 28 (2001) 307–312. [2] Y. Gao F. Wang C. Jiang X. Chen Guangzhou Chem. Ind. 44 2016 35 37 Y. Gao, F. Wang, C. Jiang, X. Chen, Guangzhou Chemical Industry. 44 (2016) 35–37. [3] I.W.C. Arends M. Sasidharan A. Kühnle M. Duda C. Jost R.A. Sheldon Tetrahedron 58 2002 9055 9061 I.W.C. Arends, M. Sasidharan, A. Kühnle, M. Duda, C. Jost, R.A. Sheldon, Tetrahedron. 58 (2002) 9055–9061. [4] X. Wu H. Liu Sci. Technol. Chem. Ind. 10 2002 48 53 X. Wu, H. Liu, Science & technology in chemical industry.10 (2002) 48–53. [5] S. Song Z. Shao X. Li H. Chang W. Wei Huaxue Shiji 35 2013 804 808 S. Song, Z. Shao, X. Li, H. Chang, W. Wei, Huaxue Shiji.35 (2013) 804–808. [6] Z. Zhu Y. Li A. Li Nat. Sci. 32 2019 1 4 Z. Zhu, Y. Li, A. Li, Natural Sciences. 32 (2019) 1–4. [7] C.E. Song E.J. Roh W.H. Shim J.H. Choi Chem. Commun. 2000 1695 1696 C.E. Song, E.J. Roh, W.H. Shim, J.H. Choi, Chem. Commun. (2000) 1695–1696. [8] Y. Liu J. Di Spec. Petrochem. 6 2001 19 22 Y. Liu, J. Di, Speciality pet rochemicals, 6 (2001) 19–22. [9] C. Perego P. Ingallina Catal. Today 73 2002 3 22 C. Perego, P. Ingallina, Catal. Today. 73 (2002) 3–22. [10] P. Chu, M. Landis, Q. Le, US Patent 5334795, 1994. [11] D.L. Holtermann, R.A. Innes, US Patent 5149894, 1992. [12] J. Fahy D. Trimm D. Cookson Appl. Catal. A Gen. 211 2001 259 268 J. Fahy, D. Trimm, D. Cookson, Appl. Catal. A Gen. 211 (2001) 259–268. [13] P.R. Hari Prasad Rao K. Ueyama M. Matsukata Appl. Catal. A Gen. 166 1998 97 103 P.R. Hari Prasad Rao, K. Ueyama, M. Matsukata, Appl. Catal. A Gen. 166 (1998) 97–103. [14] T.C. Yen H.T. Wang J.J. Siao S.H. Cha S.H. Hong S.B. Al-Khattaf S.S. Wang I. Tsai Catal. Sci. Technol. 6 2016 2715 2724 T.C. Yen, H.T. Wang, J.J. Siao, S.H. Cha, S.H. Hong, S.B. Al-Khattaf, S.S. Wang, I. Tsai, Catal. Sci. Technol. 6 (2016) 2715–2724. [15] T.P. Murtha, W.A. Jones, E.A. Zuech, M.M. Johnson, US Patent 4206082, 1980. [16] M. Makkee, US Patent 5053571, 1991. [17] T.P. Murtha, E.A. Zuech, US Patent 4268699, 1981. [18] C.Y. Cheng, A.B. Dandekar, M.A. Steckel, H.K.C. Timken, WO 0153236, 2001. [19] G. Wang, Y. Wei, H. Fang, Chinese Patent CN106518601, 2017. [20] J.M. Nadgeri M.M. Teldar C.V. Rode Catal. Commun. 2008 441 446 J.M. Nadgeri, M.M. Teldar, C.V. Rode, Catal Commun, 2008, 441–446. [21] M.E. Leonowicz J.A. Lawton S.L. Lawton M.K. Rubin Science 264 1994 1910 1913 M.E. Leonowicz, J.A. Lawton, S.L. Lawton, M.K. Rubin, Science. 264 (1994) 1910–1913. [22] 〈http://asia.iza-structure.org/IZA-SC/framework.php?STC=MWW〉. [23] W.J. Roth P. Nachtigall R.E. Morris J. Čejka Chem. Rev. 114 2014 4807 4837 W.J. Roth, P. Nachtigall, R.E. Morris, J. Čejka, Chem. Rev. 114 (2014) 4807–4837. [24] L. Xu J. Sun Adv. Energy Mater. 6 2016 1600441 L. Xu, J. Sun, Adv. Energy Mater. 6 (2016) 1600441. [25] A. Corma V. Fornes S.B. Pergher T.L.M. Maesen J.G. Buglass Nature 396 1998 353 356 A. Corma, V. Fornes, S.B. Pergher, T.L.M. Maesen, J.G. Buglass, Nature. 396 (1998) 353–356. [26] W.J. Roth C.T. Kresge J.C. Vartuli M.E. Leonowicz A.S. Fung S.B. McCullen Stud. Surf. Sci. Catal. 94 1995 301 308 W.J. Roth, C.T. Kresge, J.C. Vartuli, M.E. Leonowicz, A.S. Fung, S.B. McCullen, Studies in Surface Science and Catalysis. 94 (1995) 301–308. [27] C.H.L. Tempelman M.T. Portilla M.E. Martínez-Armero B. Mezari N.G.R. de Caluwé C. Martínez E.J.M. Hensen Microporous Mesoporous Mater. 220 2016 28 38 C.H.L. Tempelman, M.T. Portilla, M.E. Martínez-Armero, B. Mezari, N.G.R. de Caluwé, C. Martínez, E.J.M. Hensen, Microporous Mesoporous Mater. 220 (2016) 28–38. [28] M.V. Rodrigues C. Okolie C. Sievers L. Martins Cryst. Growth Des. 19 2019 231 241 M.V. Rodrigues, C. Okolie, C. Sievers, L. Martins, Cryst. Growth Des. 19 (2019) 231–241. [29] Y. Zhou Y. Mu M.F. Hsieh B. Kabius C. Pacheco C. Bator R.M. Rioux J.D. Rimer J. Am. Chem. Soc. 142 2020 8211 8222 Y. Zhou, Y. Mu, M.F. Hsieh, B. Kabius, C. Pacheco, C. Bator, R.M. Rioux, J.D. Rimer, J. Am. Chem. Soc. 142 (2020) 8211–8222. [30] J. Chen Y. Li Q. Hao H. Chen Z. Liu C. Dai J. Zhang X. Ma Z. Liu Natl. Sci. Rev. 8 2021 J. Chen, Y. Li, Q. Hao, H. Chen, Z. Liu, C. Dai, J. Zhang, X. Ma, Z. Liu, Natl. Sci. Rev. 8 (2021). [31] Z. Wang M.O. Cichocka Y. Luo B. Zhang H. Sun Y. Tang W. Yang Chin. J. Catal. 41 2020 1062 1066 Z. Wang, M.O. Cichocka, Y. Luo, B. Zhang, H. Sun, Y. Tang, W. Yang, Chinese J. Catal. 41 (2020) 1062–1066. [32] A. Corma C. Corell J. Pérez-Pariente Zeolites 15 1995 2 8 A. Corma, C. Corell, J. Pérez-Pariente, Zeolites. 15 (1995) 2–8. [33] R.B. Anderson J. Am. Chem. Soc. 68 1946 686 691 R.B. Anderson, J. Am. Chem. Soc. 68 (1946) 686–691. [34] E.P. Barrett L.G. Joyner P.P. Halenda J. Am. Chem. Soc. 73 1951 373 380 E.P. Barrett, L.G. Joyner, P.P. Halenda, J. Am. Chem. Soc. 73 (1951) 373–380. [35] M. Zhai L. Li Y. B K. Zhu X. Zhou Catal. Today 2018 M. Zhai, L. Li, Y. B, K. Zhu, X. Zhou, Catal. Today. (2018). [36] T. Masuda Catal. Surv. Asia 2/3 2003 133 144 T. Masuda, Catal. Surv. Asia. 2/3 (2003) 133–144. [37] M. Položij H.V. Thang M. Rubeš P. Eliášová J. Čejka P. Nachtigall Dalton Trans. 43 2014 10443 10450 M. Položij, H.V. Thang, M. Rubeš, P. Eliášová, J. Čejka, P. Nachtigall, Dalt. Trans. 43 (2014) 10443–10450. [38] A. Corma U. Diaz V. Fornés J.M. Guil J. Martínez-Triguero E.J. Creyghton J. Catal. 191 2000 218 224 A. Corma, U. Diaz, V. Fornés, J.M. Guil, J. Martínez-Triguero, E.J. Creyghton, J. Catal. 191 (2000) 218–224. [39] B. Zhang Y. Ji Z. Wang Y. Liu H. Sun W. Yang P. Wu Appl. Catal. A Gen. 443–444 2012 103 110 B. Zhang, Y. Ji, Z. Wang, Y. Liu, H. Sun, W. Yang, P. Wu, Appl. Catal. A Gen. 443–444 (2012) 103–110. [40] E.E. Knyazeva A.V. Shkuropatov D.S. Zasukhin I.V. Dobryakova O.A. Ponomareva I.I. Ivanova Russ. J. Phys. Chem. A. 93 2019 1939 1945 E.E. Knyazeva, A.V. Shkuropatov, D.S. Zasukhin, I.V. Dobryakova, O.A. Ponomareva, I.I. Ivanova, Russ. J. Phys. Chem. A. 93 (2019) 1939–1945. [41] S. Brunauer L.S. Deming W.E. Deming E. Teller J. Am. Chem. Soc. 62 1940 1723 1732 S. Brunauer, L.S. Deming, W.E. Deming, E. Teller, J. Am. Chem. Soc. 62 (1940) 1723–1732. [42] B.J.H. De, D.H., in: Everett, F.S. Stone, Butterworths, London 68(1958). B.J.H. De, D.H. In: Everett, F.S. Stone, London: Butterworths. 68(1958). [43] Y. You Sch. Chem. Eng. Energy 2018 56 58 Y., You. School of Chemical Engineering and Energy. 2018 56–58. [44] A. Corma C. Corell V. Fornés W. Kolodziejski J. Pérez-Pariente Zeolites 15 1995 576 582 A. Corma, C. Corell, V. Fornés, W. Kolodziejski, J. Pérez-Pariente, Zeolites. 15 (1995) 576–582. [45] G.J. Kennedy S.L. Lawton A.S. Fung M.K. Rubin S. Steuernagel Catal. Today 49 1999 385 399 G.J. Kennedy, S.L. Lawton, A.S. Fung, M.K. Rubin, S. Steuernagel, Catal. Today. 49 (1999) 385–399. [46] A. Vjunov J.L. Fulton T. Huthwelker S. Pin D. Mei G.K. Schenter N. Govind D.M. Camaioni J.Z. Hu J.A. Lercher J. Am. Chem. Soc. 136 2014 8296 8306 A. Vjunov, J.L. Fulton, T. Huthwelker, S. Pin, D. Mei, G.K. Schenter, N. Govind, D.M. Camaioni, J.Z. Hu, J.A. Lercher, J. Am. Chem. Soc. 136 (2014) 8296–8306. [47] D. Zhou Y. Bao M. Yang N. He G. Yang J. Mol. Catal. A Chem. 244 2006 11 19 D. Zhou, Y. Bao, M. Yang, N. He, G. Yang, J. Mol. Catal. A Chem. 244 (2006) 11–19. [48] J. Chen T. Liang J. Li S. Wang Z. Qin P. Wang L. Huang W. Fan J. Wang ACS Catal. 6 2016 2299 2313 J. Chen, T. Liang, J. Li, S. Wang, Z. Qin, P. Wang, L. Huang, W. Fan, J. Wang, ACS Catal. 6 (2016) 2299–2313. [49] R. Xu W. Pang Q. Huo Porous Mater. 2014 49 50 R. Xu, W. Pang, Q. Huo, Porous Mater. (2014) 49–50. [50] D. Ma F. Deng R. Fu X. Han X. Bao J. Phys. Chem. B 105 2001 1770 1779 D. Ma, F. Deng, R. Fu, X. Han, X. Bao, J. Phys. Chem. B. 105 (2001) 1770–1779.",
      "scopus-id": "85133233923",
      "coredata": {
        "eid": "1-s2.0-S0926860X22002642",
        "dc:description": "A type of delaminated MWW zeolite is synthesized in the presence of hexamethyleneimine and dicyclohexylamine via a hydrothermal crystallization method. The appropriate molar ratio range of HMI/DCHA is found to correlate with the laminar morphology and crystallinity of the prepared zeolite samples. The delaminated MWW zeolite possesses thinner layered structure, larger external surface area and more accessible active sites than the conventional MCM-22 sample, and its protonated form can be used as a superb catalyst in benzene alkylation with cyclohexene. Under the optimized reaction conditions, the conversion of cyclohexene reaches 99.9 % while the selectivity to the target products, cyclohexylbenzene and dicyclohexylbenzene is 95.4 % in 1000 h lifetime experiment. Because of better diffusion properties and more abundant accessible acid sites on external surface, the delaminated MWW is superior to the conventional MCM-22 in benzene alkylation with cyclohexene, despite of the similar microporous structure and bulk acid properties of these two samples.",
        "openArchiveArticle": "false",
        "prism:coverDate": "2022-08-05",
        "openaccessUserLicense": null,
        "prism:aggregationType": "Journal",
        "prism:url": "https://api.elsevier.com/content/article/pii/S0926860X22002642",
        "dc:creator": [
          {
            "@_fa": "true",
            "$": "Bao, Ruirui"
          },
          {
            "@_fa": "true",
            "$": "Shen, Zhenhao"
          },
          {
            "@_fa": "true",
            "$": "Ma, Chongwei"
          },
          {
            "@_fa": "true",
            "$": "Li, Liyuan"
          },
          {
            "@_fa": "true",
            "$": "Wang, Yiyan"
          },
          {
            "@_fa": "true",
            "$": "Sun, Hongmin"
          },
          {
            "@_fa": "true",
            "$": "Yang, Weimin"
          }
        ],
        "link": [
          {
            "@_fa": "true",
            "@rel": "self",
            "@href": "https://api.elsevier.com/content/article/pii/S0926860X22002642"
          },
          {
            "@_fa": "true",
            "@rel": "scidir",
            "@href": "https://www.sciencedirect.com/science/article/pii/S0926860X22002642"
          }
        ],
        "dc:format": "application/json",
        "openaccessType": null,
        "pii": "S0926-860X(22)00264-2",
        "prism:volume": "643",
        "articleNumber": "118741",
        "prism:publisher": "Elsevier B.V.",
        "dc:title": "Delaminated MWW-type zeolite and its catalytic performance in alkylation of benzene with cyclohexene",
        "prism:copyright": "© 2022 Elsevier B.V. All rights reserved.",
        "openaccess": "0",
        "prism:issn": "0926860X",
        "dcterms:subject": [
          {
            "@_fa": "true",
            "$": "Delaminated MWW zeolite"
          },
          {
            "@_fa": "true",
            "$": "External surface"
          },
          {
            "@_fa": "true",
            "$": "Accessible active sites"
          },
          {
            "@_fa": "true",
            "$": "Alkylation of benzene"
          },
          {
            "@_fa": "true",
            "$": "Cyclohexene"
          },
          {
            "@_fa": "true",
            "$": "Cyclohexylbenzene"
          }
        ],
        "openaccessArticle": "false",
        "prism:publicationName": "Applied Catalysis A: General",
        "openaccessSponsorType": null,
        "prism:pageRange": "118741",
        "pubType": "fla",
        "prism:coverDisplayDate": "5 August 2022",
        "prism:doi": "10.1016/j.apcata.2022.118741",
        "prism:startingPage": "118741",
        "dc:identifier": "doi:10.1016/j.apcata.2022.118741",
        "openaccessSponsorName": null
      },
      "objects": {
        "object": [
          {
            "@category": "standard",
            "@height": "213",
            "@width": "376",
            "@_fa": "true",
            "$": "https://api.elsevier.com/content/object/eid/1-s2.0-S0926860X22002642-sc1.jpg?httpAccept=%2A%2F%2A",
            "@multimediatype": "JPEG image file",
            "@type": "IMAGE-DOWNSAMPLED",
            "@size": "15646",
            "@ref": "sc1",
            "@mimetype": "image/jpeg"
          },
          {
            "@category": "standard",
            "@height": "307",
            "@width": "659",
            "@_fa": "true",
            "$": "https://api.elsevier.com/content/object/eid/1-s2.0-S0926860X22002642-gr9.jpg?httpAccept=%2A%2F%2A",
            "@multimediatype": "JPEG image file",
            "@type": "IMAGE-DOWNSAMPLED",
            "@size": "44834",
            "@ref": "gr9",
            "@mimetype": "image/jpeg"
          },
          {
            "@category": "standard",
            "@height": "280",
            "@width": "339",
            "@_fa": "true",
            "$": "https://api.elsevier.com/content/object/eid/1-s2.0-S0926860X22002642-gr8.jpg?httpAccept=%2A%2F%2A",
            "@multimediatype": "JPEG image file",
            "@type": "IMAGE-DOWNSAMPLED",
            "@size": "16840",
            "@ref": "gr8",
            "@mimetype": "image/jpeg"
          },
          {
            "@category": "standard",
            "@height": "254",
            "@width": "659",
            "@_fa": "true",
            "$": "https://api.elsevier.com/content/object/eid/1-s2.0-S0926860X22002642-gr7.jpg?httpAccept=%2A%2F%2A",
            "@multimediatype": "JPEG image file",
            "@type": "IMAGE-DOWNSAMPLED",
            "@size": "35629",
            "@ref": "gr7",
            "@mimetype": "image/jpeg"
          },
          {
            "@category": "standard",
            "@height": "257",
            "@width": "659",
            "@_fa": "true",
            "$": "https://api.elsevier.com/content/object/eid/1-s2.0-S0926860X22002642-gr6.jpg?httpAccept=%2A%2F%2A",
            "@multimediatype": "JPEG image file",
            "@type": "IMAGE-DOWNSAMPLED",
            "@size": "32036",
            "@ref": "gr6",
            "@mimetype": "image/jpeg"
          },
          {
            "@category": "standard",
            "@height": "270",
            "@width": "659",
            "@_fa": "true",
            "$": "https://api.elsevier.com/content/object/eid/1-s2.0-S0926860X22002642-gr5.jpg?httpAccept=%2A%2F%2A",
            "@multimediatype": "JPEG image file",
            "@type": "IMAGE-DOWNSAMPLED",
            "@size": "32741",
            "@ref": "gr5",
            "@mimetype": "image/jpeg"
          },
          {
            "@category": "standard",
            "@height": "285",
            "@width": "339",
            "@_fa": "true",
            "$": "https://api.elsevier.com/content/object/eid/1-s2.0-S0926860X22002642-gr4.jpg?httpAccept=%2A%2F%2A",
            "@multimediatype": "JPEG image file",
            "@type": "IMAGE-DOWNSAMPLED",
            "@size": "20301",
            "@ref": "gr4",
            "@mimetype": "image/jpeg"
          },
          {
            "@category": "standard",
            "@height": "437",
            "@width": "659",
            "@_fa": "true",
            "$": "https://api.elsevier.com/content/object/eid/1-s2.0-S0926860X22002642-gr3.jpg?httpAccept=%2A%2F%2A",
            "@multimediatype": "JPEG image file",
            "@type": "IMAGE-DOWNSAMPLED",
            "@size": "124431",
            "@ref": "gr3",
            "@mimetype": "image/jpeg"
          },
          {
            "@category": "standard",
            "@height": "282",
            "@width": "339",
            "@_fa": "true",
            "$": "https://api.elsevier.com/content/object/eid/1-s2.0-S0926860X22002642-gr2.jpg?httpAccept=%2A%2F%2A",
            "@multimediatype": "JPEG image file",
            "@type": "IMAGE-DOWNSAMPLED",
            "@size": "24829",
            "@ref": "gr2",
            "@mimetype": "image/jpeg"
          },
          {
            "@category": "standard",
            "@height": "200",
            "@width": "316",
            "@_fa": "true",
            "$": "https://api.elsevier.com/content/object/eid/1-s2.0-S0926860X22002642-ga1.jpg?httpAccept=%2A%2F%2A",
            "@multimediatype": "JPEG image file",
            "@type": "IMAGE-DOWNSAMPLED",
            "@size": "18988",
            "@ref": "ga1",
            "@mimetype": "image/jpeg"
          },
          {
            "@category": "standard",
            "@height": "284",
            "@width": "339",
            "@_fa": "true",
            "$": "https://api.elsevier.com/content/object/eid/1-s2.0-S0926860X22002642-gr1.jpg?httpAccept=%2A%2F%2A",
            "@multimediatype": "JPEG image file",
            "@type": "IMAGE-DOWNSAMPLED",
            "@size": "26523",
            "@ref": "gr1",
            "@mimetype": "image/jpeg"
          },
          {
            "@category": "thumbnail",
            "@height": "124",
            "@width": "219",
            "@_fa": "true",
            "$": "https://api.elsevier.com/content/object/eid/1-s2.0-S0926860X22002642-sc1.sml?httpAccept=%2A%2F%2A",
            "@multimediatype": "GIF image file",
            "@type": "IMAGE-THUMBNAIL",
            "@size": "4503",
            "@ref": "sc1",
            "@mimetype": "image/gif"
          },
          {
            "@category": "thumbnail",
            "@height": "102",
            "@width": "219",
            "@_fa": "true",
            "$": "https://api.elsevier.com/content/object/eid/1-s2.0-S0926860X22002642-gr9.sml?httpAccept=%2A%2F%2A",
            "@multimediatype": "GIF image file",
            "@type": "IMAGE-THUMBNAIL",
            "@size": "7560",
            "@ref": "gr9",
            "@mimetype": "image/gif"
          },
          {
            "@category": "thumbnail",
            "@height": "164",
            "@width": "198",
            "@_fa": "true",
            "$": "https://api.elsevier.com/content/object/eid/1-s2.0-S0926860X22002642-gr8.sml?httpAccept=%2A%2F%2A",
            "@multimediatype": "GIF image file",
            "@type": "IMAGE-THUMBNAIL",
            "@size": "5787",
            "@ref": "gr8",
            "@mimetype": "image/gif"
          },
          {
            "@category": "thumbnail",
            "@height": "84",
            "@width": "219",
            "@_fa": "true",
            "$": "https://api.elsevier.com/content/object/eid/1-s2.0-S0926860X22002642-gr7.sml?httpAccept=%2A%2F%2A",
            "@multimediatype": "GIF image file",
            "@type": "IMAGE-THUMBNAIL",
            "@size": "5792",
            "@ref": "gr7",
            "@mimetype": "image/gif"
          },
          {
            "@category": "thumbnail",
            "@height": "85",
            "@width": "219",
            "@_fa": "true",
            "$": "https://api.elsevier.com/content/object/eid/1-s2.0-S0926860X22002642-gr6.sml?httpAccept=%2A%2F%2A",
            "@multimediatype": "GIF image file",
            "@type": "IMAGE-THUMBNAIL",
            "@size": "5269",
            "@ref": "gr6",
            "@mimetype": "image/gif"
          },
          {
            "@category": "thumbnail",
            "@height": "90",
            "@width": "219",
            "@_fa": "true",
            "$": "https://api.elsevier.com/content/object/eid/1-s2.0-S0926860X22002642-gr5.sml?httpAccept=%2A%2F%2A",
            "@multimediatype": "GIF image file",
            "@type": "IMAGE-THUMBNAIL",
            "@size": "5070",
            "@ref": "gr5",
            "@mimetype": "image/gif"
          },
          {
            "@category": "thumbnail",
            "@height": "164",
            "@width": "195",
            "@_fa": "true",
            "$": "https://api.elsevier.com/content/object/eid/1-s2.0-S0926860X22002642-gr4.sml?httpAccept=%2A%2F%2A",
            "@multimediatype": "GIF image file",
            "@type": "IMAGE-THUMBNAIL",
            "@size": "7277",
            "@ref": "gr4",
            "@mimetype": "image/gif"
          },
          {
            "@category": "thumbnail",
            "@height": "145",
            "@width": "219",
            "@_fa": "true",
            "$": "https://api.elsevier.com/content/object/eid/1-s2.0-S0926860X22002642-gr3.sml?httpAccept=%2A%2F%2A",
            "@multimediatype": "GIF image file",
            "@type": "IMAGE-THUMBNAIL",
            "@size": "26076",
            "@ref": "gr3",
            "@mimetype": "image/gif"
          },
          {
            "@category": "thumbnail",
            "@height": "164",
            "@width": "197",
            "@_fa": "true",
            "$": "https://api.elsevier.com/content/object/eid/1-s2.0-S0926860X22002642-gr2.sml?httpAccept=%2A%2F%2A",
            "@multimediatype": "GIF image file",
            "@type": "IMAGE-THUMBNAIL",
            "@size": "8785",
            "@ref": "gr2",
            "@mimetype": "image/gif"
          },
          {
            "@category": "thumbnail",
            "@height": "139",
            "@width": "219",
            "@_fa": "true",
            "$": "https://api.elsevier.com/content/object/eid/1-s2.0-S0926860X22002642-ga1.sml?httpAccept=%2A%2F%2A",
            "@multimediatype": "GIF image file",
            "@type": "IMAGE-THUMBNAIL",
            "@size": "10613",
            "@ref": "ga1",
            "@mimetype": "image/gif"
          },
          {
            "@category": "thumbnail",
            "@height": "164",
            "@width": "195",
            "@_fa": "true",
            "$": "https://api.elsevier.com/content/object/eid/1-s2.0-S0926860X22002642-gr1.sml?httpAccept=%2A%2F%2A",
            "@multimediatype": "GIF image file",
            "@type": "IMAGE-THUMBNAIL",
            "@size": "9080",
            "@ref": "gr1",
            "@mimetype": "image/gif"
          },
          {
            "@category": "high",
            "@height": "944",
            "@width": "1663",
            "@_fa": "true",
            "$": "https://api.elsevier.com/content/object/eid/1-s2.0-S0926860X22002642-sc1_lrg.jpg?httpAccept=%2A%2F%2A",
            "@multimediatype": "JPEG image file",
            "@type": "IMAGE-HIGH-RES",
            "@size": "80961",
            "@ref": "sc1",
            "@mimetype": "image/jpeg"
          },
          {
            "@category": "high",
            "@height": "1354",
            "@width": "2911",
            "@_fa": "true",
            "$": "https://api.elsevier.com/content/object/eid/1-s2.0-S0926860X22002642-gr9_lrg.jpg?httpAccept=%2A%2F%2A",
            "@multimediatype": "JPEG image file",
            "@type": "IMAGE-HIGH-RES",
            "@size": "207469",
            "@ref": "gr9",
            "@mimetype": "image/jpeg"
          },
          {
            "@category": "high",
            "@height": "1238",
            "@width": "1497",
            "@_fa": "true",
            "$": "https://api.elsevier.com/content/object/eid/1-s2.0-S0926860X22002642-gr8_lrg.jpg?httpAccept=%2A%2F%2A",
            "@multimediatype": "JPEG image file",
            "@type": "IMAGE-HIGH-RES",
            "@size": "79998",
            "@ref": "gr8",
            "@mimetype": "image/jpeg"
          },
          {
            "@category": "high",
            "@height": "1121",
            "@width": "2911",
            "@_fa": "true",
            "$": "https://api.elsevier.com/content/object/eid/1-s2.0-S0926860X22002642-gr7_lrg.jpg?httpAccept=%2A%2F%2A",
            "@multimediatype": "JPEG image file",
            "@type": "IMAGE-HIGH-RES",
            "@size": "173918",
            "@ref": "gr7",
            "@mimetype": "image/jpeg"
          },
          {
            "@category": "high",
            "@height": "1136",
            "@width": "2911",
            "@_fa": "true",
            "$": "https://api.elsevier.com/content/object/eid/1-s2.0-S0926860X22002642-gr6_lrg.jpg?httpAccept=%2A%2F%2A",
            "@multimediatype": "JPEG image file",
            "@type": "IMAGE-HIGH-RES",
            "@size": "168727",
            "@ref": "gr6",
            "@mimetype": "image/jpeg"
          },
          {
            "@category": "high",
            "@height": "1193",
            "@width": "2911",
            "@_fa": "true",
            "$": "https://api.elsevier.com/content/object/eid/1-s2.0-S0926860X22002642-gr5_lrg.jpg?httpAccept=%2A%2F%2A",
            "@multimediatype": "JPEG image file",
            "@type": "IMAGE-HIGH-RES",
            "@size": "156671",
            "@ref": "gr5",
            "@mimetype": "image/jpeg"
          },
          {
            "@category": "high",
            "@height": "1257",
            "@width": "1497",
            "@_fa": "true",
            "$": "https://api.elsevier.com/content/object/eid/1-s2.0-S0926860X22002642-gr4_lrg.jpg?httpAccept=%2A%2F%2A",
            "@multimediatype": "JPEG image file",
            "@type": "IMAGE-HIGH-RES",
            "@size": "113683",
            "@ref": "gr4",
            "@mimetype": "image/jpeg"
          },
          {
            "@category": "high",
            "@height": "1931",
            "@width": "2911",
            "@_fa": "true",
            "$": "https://api.elsevier.com/content/object/eid/1-s2.0-S0926860X22002642-gr3_lrg.jpg?httpAccept=%2A%2F%2A",
            "@multimediatype": "JPEG image file",
            "@type": "IMAGE-HIGH-RES",
            "@size": "641547",
            "@ref": "gr3",
            "@mimetype": "image/jpeg"
          },
          {
            "@category": "high",
            "@height": "1244",
            "@width": "1497",
            "@_fa": "true",
            "$": "https://api.elsevier.com/content/object/eid/1-s2.0-S0926860X22002642-gr2_lrg.jpg?httpAccept=%2A%2F%2A",
            "@multimediatype": "JPEG image file",
            "@type": "IMAGE-HIGH-RES",
            "@size": "137500",
            "@ref": "gr2",
            "@mimetype": "image/jpeg"
          },
          {
            "@category": "high",
            "@height": "886",
            "@width": "1400",
            "@_fa": "true",
            "$": "https://api.elsevier.com/content/object/eid/1-s2.0-S0926860X22002642-ga1_lrg.jpg?httpAccept=%2A%2F%2A",
            "@multimediatype": "JPEG image file",
            "@type": "IMAGE-HIGH-RES",
            "@size": "156890",
            "@ref": "ga1",
            "@mimetype": "image/jpeg"
          },
          {
            "@category": "high",
            "@height": "1256",
            "@width": "1497",
            "@_fa": "true",
            "$": "https://api.elsevier.com/content/object/eid/1-s2.0-S0926860X22002642-gr1_lrg.jpg?httpAccept=%2A%2F%2A",
            "@multimediatype": "JPEG image file",
            "@type": "IMAGE-HIGH-RES",
            "@size": "123417",
            "@ref": "gr1",
            "@mimetype": "image/jpeg"
          },
          {
            "@category": "standard",
            "@_fa": "true",
            "$": "https://api.elsevier.com/content/object/eid/1-s2.0-S0926860X22002642-mmc1.docx?httpAccept=%2A%2F%2A",
            "@multimediatype": "Microsoft Word file",
            "@type": "APPLICATION",
            "@size": "897665",
            "@ref": "mmc1",
            "@mimetype": "application/word"
          },
          {
            "@category": "thumbnail",
            "@_fa": "true",
            "$": "https://api.elsevier.com/content/object/eid/1-s2.0-S0926860X22002642-si0001.svg?httpAccept=%2A%2F%2A",
            "@multimediatype": "Scalable Vector Graphics file",
            "@type": "ALTIMG",
            "@size": "4222",
            "@ref": "si0001",
            "@mimetype": "image/svg+xml"
          },
          {
            "@category": "thumbnail",
            "@_fa": "true",
            "$": "https://api.elsevier.com/content/object/eid/1-s2.0-S0926860X22002642-si0002.svg?httpAccept=%2A%2F%2A",
            "@multimediatype": "Scalable Vector Graphics file",
            "@type": "ALTIMG",
            "@size": "1179",
            "@ref": "si0002",
            "@mimetype": "image/svg+xml"
          },
          {
            "@category": "thumbnail",
            "@_fa": "true",
            "$": "https://api.elsevier.com/content/object/eid/1-s2.0-S0926860X22002642-si0003.svg?httpAccept=%2A%2F%2A",
            "@multimediatype": "Scalable Vector Graphics file",
            "@type": "ALTIMG",
            "@size": "1045",
            "@ref": "si0003",
            "@mimetype": "image/svg+xml"
          },
          {
            "@category": "thumbnail",
            "@_fa": "true",
            "$": "https://api.elsevier.com/content/object/eid/1-s2.0-S0926860X22002642-si0004.svg?httpAccept=%2A%2F%2A",
            "@multimediatype": "Scalable Vector Graphics file",
            "@type": "ALTIMG",
            "@size": "6236",
            "@ref": "si0004",
            "@mimetype": "image/svg+xml"
          },
          {
            "@category": "thumbnail",
            "@_fa": "true",
            "$": "https://api.elsevier.com/content/object/eid/1-s2.0-S0926860X22002642-si0005.svg?httpAccept=%2A%2F%2A",
            "@multimediatype": "Scalable Vector Graphics file",
            "@type": "ALTIMG",
            "@size": "1612",
            "@ref": "si0005",
            "@mimetype": "image/svg+xml"
          },
          {
            "@category": "thumbnail",
            "@_fa": "true",
            "$": "https://api.elsevier.com/content/object/eid/1-s2.0-S0926860X22002642-si0006.svg?httpAccept=%2A%2F%2A",
            "@multimediatype": "Scalable Vector Graphics file",
            "@type": "ALTIMG",
            "@size": "5920",
            "@ref": "si0006",
            "@mimetype": "image/svg+xml"
          },
          {
            "@category": "standard",
            "@_fa": "true",
            "$": "https://api.elsevier.com/content/object/eid/1-s2.0-S0926860X22002642-am.pdf?httpAccept=%2A%2F%2A",
            "@multimediatype": "Acrobat PDF file",
            "@type": "AAM-PDF",
            "@size": "1252775",
            "@ref": "am",
            "@mimetype": "application/pdf"
          }
        ]
      },
      "link": {
        "@rel": "abstract",
        "@href": "https://api.elsevier.com/content/abstract/scopus_id/85133233923"
      }
    }
  }
}