{
  "metadata": {
    "title": "Chitosan-derived NC support zirconia as highly efficient catalyst for the catalytic transfer hydrogenation of furfural to furfuryl alcohol",
    "authors": "; ; ",
    "journal": "Applied Catalysis A: General",
    "date": "2025-10-25",
    "doi": "10.1016/j.apcata.2025.120492",
    "abstract": "",
    "uri": "https://api.elsevier.com/content/article/pii/S0926860X2500393X",
    "pii": "S0926860X2500393X"
  },
  "fulltext": {
    "full-text-retrieval-response": {
      "scopus-eid": "2-s2.0-105012290648",
      "originalText": "serial JL 271346 291210 291744 291809 31 Applied Catalysis A: General APPLIEDCATALYSISAGENERAL 2025-08-05 2025-08-05 2025-08-06 2025-08-06 2025-08-20T04:53:00 1-s2.0-S0926860X2500393X S0926-860X(25)00393-X S0926860X2500393X 10.1016/j.apcata.2025.120492 S300 S300.1 FULL-TEXT 1-s2.0-S0926860X25X00144 2025-08-20T03:59:14.95691Z 0 0 20251025 2025 2025-08-05T23:51:46.572779Z absattachment articleinfo articlenumber articletitlenorm authfirstinitialnorm authfirstsurnamenorm cid cids contenttype copyright crossmark dateloaded dateloadedtxt datesearch datesort dateupdated dco docsubtype doctype doi eid ewtransactionid hubeid indexeddate issn issnnorm itemstage itemtransactionid itemweight openaccess openarchive pg pgfirst pii piinorm pubdatestart pubdatetxt pubyr sortorder srctitle srctitlenorm srctype ssids alllist content subj subheadings suppl tomb volfirst volissue volumelist webpdf webpdfpagecount yearnav figure table e-component body mmlmath acknowledge affil appendices articletitle auth authfirstini authfull authkeywords authlast grantnumber grantsponsor grantsponsorid highlightsabst orcid primabst ref specialabst 0926-860X 0926860X true 706 706 C Volume 706 14 120492 120492 120492 20251025 25 October 2025 2025-10-25 2025 article fla © 2025 Elsevier B.V. All rights are reserved, including those for text and data mining, AI training, and similar technologies. CHITOSANDERIVEDNCSUPPORTZIRCONIAHIGHLYEFFICIENTCATALYSTFORCATALYTICTRANSFERHYDROGENATIONFURFURALFURFURYLALCOHOL ZHU X 1 Introduction 2 Experimental section 2.1 Catalyst preparation 2.2 Catalyst characterization 2.3 Catalytic reaction 3 Results and discussion 3.1 Catalyst characterization 3.2 Catalytic performance for the CTH of FUR to FAL reaction 3.2.1 Activity evaluation of different catalysts 3.2.2 The effect of reaction parameters 3.2.3 Reusability and universality of the catalyst 4 Conclusion CRediT authorship contribution statement Acknowledgments Appendix A Supplementary material References LI 2019 196 205 X ZHAO 2024 9957 9992 K QIU 2023 129278 B CHEN 2024 114093 Y MA 2025 367 M ZHAO 2023 128887 H LIU 2024 129631 Z LIU 2023 13196 13207 Z YUAN 2025 120031 Y LIU 2025 e202500677 H LEE 2019 317 334 Y IVANIS 2021 120021 G GAO 2022 121260 G SERETIS 2025 115019 A LI 2015 119 122 M FULAJTAROVA 2015 78 85 K WANG 2021 111599 Z ZHAO 2024 e202400333 B PU 2022 1661 1669 C MUSCI 2022 81 93 J RAMIREZBARRIA 2018 177 184 C WANG 2021 1186 1190 T ZHANG 2024 118144 X WANG 2022 3172 3182 T VALEKAR 2020 3720 3732 A LI 2021 116075 D WU 2022 411 417 J HU 2023 145656 L GUO 2024 156659 T FAN 2021 1110 1118 Y WANG 2022 9138 9146 F AKRAM 2023 108808 M HUS 2022 135070 M LUO 2022 575 587 J ZHOU 2020 16624 16636 K GAO 2022 112065 B PAN 2023 3301 3304 G RAMOS 2020 1467 1475 R LIU 2022 3537 3547 Z CHEN 2023 574 585 W WANG 2011 78 81 L LIU 2024 107396 Z CHEN 2020 3075 3081 Z HUANG 2021 2002811 K ZHANG 2018 2365 2374 W ZHANG 2019 3381 3387 W LIU 2025 676 685 Z PUTHIARAJ 2019 49 58 P CHEN 2018 94 101 H GARCIASANCHO 2021 117905 117918 C XU 2015 1 8 J XU 2017 380 388 J CAI 2024 114902 C QIU 2024 118474 J MUTLU 2024 112665 B HUANG 2024 125862 B QIU 2020 117719 117725 M LI 2020 478 486 F ZHANG 2021 124152 J WANG 2017 942 947 F QIU 2020 117719 M GARCIASANCHO 2021 117905 C CEN 2024 129864 S CHENG 2024 119909 S HE 2018 430 438 J ZHUX2025X120492 ZHUX2025X120492XX 2027-08-06T00:00:00.000Z 2027-08-06T00:00:00.000Z http://creativecommons.org/licenses/by-nc-nd/4.0/ © 2025 Elsevier B.V. All rights are reserved, including those for text and data mining, AI training, and similar technologies. 2025-08-07T02:07:26.440Z http://vtw.elsevier.com/data/voc/AddOnTypes/50.7/aggregated-refined Jiangsu Province Engineering Research Center of Biodegradable Materials KF2305 Postgraduate Research & Practice Innovation Program of Jiangsu Province KYCX25_3326 Graduate Research and Innovation Projects of Jiangsu Province http://data.elsevier.com/vocabulary/SciValFunders/501100012154 http://sws.geonames.org/1814991/ Shiyanjia Lab National Natural Science Foundation of China 22302016 22278041 National Natural Science Foundation of China http://data.elsevier.com/vocabulary/SciValFunders/501100001809 http://sws.geonames.org/1814991 This work was supported by the National Natural Science Foundation of China ( 22302016 , and 22278041 ) and the Jiangsu Province Engineering Research Center of Biodegradable Materials ( KF2305 ), and Postgraduate Research & Practice Innovation Program of Jiangsu Province ( KYCX25_3326 ). We also thank the Shiyanjia Lab ( https://www . shiyanjia.com) for the XPS and TEM characterization. https://doi.org/10.15223/policy-017 https://doi.org/10.15223/policy-037 https://doi.org/10.15223/policy-012 https://doi.org/10.15223/policy-029 https://doi.org/10.15223/policy-004 item S0926-860X(25)00393-X S0926860X2500393X 1-s2.0-S0926860X2500393X 10.1016/j.apcata.2025.120492 271346 2025-08-20T03:59:14.95691Z 2025-10-25 1-s2.0-S0926860X2500393X-main.pdf https://s3-eu-west-1.amazonaws.com/prod-ucs-content-store-eu-west/content/pii:S0926860X2500393X/MAIN/application/pdf/b2eaee018e609c6b46300b604da94d63/main.pdf main.pdf pdf true 8257894 MAIN 11 1-s2.0-S0926860X2500393X-main_1.png https://s3-eu-west-1.amazonaws.com/prod-ucs-content-store-eu-west/content/pii:S0926860X2500393X/PREVIEW/image/png/5c449ede9af45858fb24c5302907be72/main_1.png main_1.png png 58040 928 656 IMAGE-WEB-PDF 1 1-s2.0-S0926860X2500393X-gr9.jpg https://s3-eu-west-1.amazonaws.com/prod-ucs-content-store-eu-west/content/pii:S0926860X2500393X/gr9/DOWNSAMPLED/image/jpeg/a91431cb5e9e33545cc9bec16e3a5dd2/gr9.jpg gr9 gr9.jpg jpg 31862 286 678 IMAGE-DOWNSAMPLED 1-s2.0-S0926860X2500393X-gr3.jpg https://s3-eu-west-1.amazonaws.com/prod-ucs-content-store-eu-west/content/pii:S0926860X2500393X/gr3/DOWNSAMPLED/image/jpeg/310e027d9174c79d79d62aa7105d863f/gr3.jpg gr3 gr3.jpg jpg 81037 602 671 IMAGE-DOWNSAMPLED 1-s2.0-S0926860X2500393X-gr4.jpg https://s3-eu-west-1.amazonaws.com/prod-ucs-content-store-eu-west/content/pii:S0926860X2500393X/gr4/DOWNSAMPLED/image/jpeg/428296768ab603fb40c25d48875198ea/gr4.jpg gr4 gr4.jpg jpg 21927 251 565 IMAGE-DOWNSAMPLED 1-s2.0-S0926860X2500393X-gr1.jpg https://s3-eu-west-1.amazonaws.com/prod-ucs-content-store-eu-west/content/pii:S0926860X2500393X/gr1/DOWNSAMPLED/image/jpeg/b01291b3118e0be0151b6c37476cc9cc/gr1.jpg gr1 gr1.jpg jpg 52893 306 678 IMAGE-DOWNSAMPLED 1-s2.0-S0926860X2500393X-gr2.jpg https://s3-eu-west-1.amazonaws.com/prod-ucs-content-store-eu-west/content/pii:S0926860X2500393X/gr2/DOWNSAMPLED/image/jpeg/89d79feffb414c8a94784324b7554432/gr2.jpg gr2 gr2.jpg jpg 110309 362 678 IMAGE-DOWNSAMPLED 1-s2.0-S0926860X2500393X-gr7.jpg https://s3-eu-west-1.amazonaws.com/prod-ucs-content-store-eu-west/content/pii:S0926860X2500393X/gr7/DOWNSAMPLED/image/jpeg/3f4580173c0227462e9776c5392d68c0/gr7.jpg gr7 gr7.jpg jpg 19967 328 395 IMAGE-DOWNSAMPLED 1-s2.0-S0926860X2500393X-gr8.jpg https://s3-eu-west-1.amazonaws.com/prod-ucs-content-store-eu-west/content/pii:S0926860X2500393X/gr8/DOWNSAMPLED/image/jpeg/6a10a419baba98508e39379805d1e796/gr8.jpg gr8 gr8.jpg jpg 74057 597 678 IMAGE-DOWNSAMPLED 1-s2.0-S0926860X2500393X-gr5.jpg https://s3-eu-west-1.amazonaws.com/prod-ucs-content-store-eu-west/content/pii:S0926860X2500393X/gr5/DOWNSAMPLED/image/jpeg/6494cd1106abb753c6a3aceacdbc4ee6/gr5.jpg gr5 gr5.jpg jpg 76490 603 678 IMAGE-DOWNSAMPLED 1-s2.0-S0926860X2500393X-gr6.jpg https://s3-eu-west-1.amazonaws.com/prod-ucs-content-store-eu-west/content/pii:S0926860X2500393X/gr6/DOWNSAMPLED/image/jpeg/e3c1bf8fb0acbe77b6a6b8d157eb83c7/gr6.jpg gr6 gr6.jpg jpg 28309 340 395 IMAGE-DOWNSAMPLED 1-s2.0-S0926860X2500393X-sc1.jpg https://s3-eu-west-1.amazonaws.com/prod-ucs-content-store-eu-west/content/pii:S0926860X2500393X/sc1/DOWNSAMPLED/image/jpeg/a18230b12bc056833854280702a0117b/sc1.jpg sc1 sc1.jpg jpg 36649 395 563 IMAGE-DOWNSAMPLED 1-s2.0-S0926860X2500393X-fx1.jpg https://s3-eu-west-1.amazonaws.com/prod-ucs-content-store-eu-west/content/pii:S0926860X2500393X/fx1/DOWNSAMPLED/image/jpeg/89e247f42fb688ba243ce713723e341e/fx1.jpg fx1 fx1.jpg jpg 30409 367 678 IMAGE-DOWNSAMPLED 1-s2.0-S0926860X2500393X-ga1.jpg https://s3-eu-west-1.amazonaws.com/prod-ucs-content-store-eu-west/content/pii:S0926860X2500393X/ga1/DOWNSAMPLED/image/jpeg/0bf73ab46c4ab4f1ff767be5473496db/ga1.jpg ga1 true ga1.jpg jpg 20930 200 372 IMAGE-DOWNSAMPLED 1-s2.0-S0926860X2500393X-gr9.sml https://s3-eu-west-1.amazonaws.com/prod-ucs-content-store-eu-west/content/pii:S0926860X2500393X/gr9/THUMBNAIL/image/gif/3156495f9094060896ea259a8bb25e2d/gr9.sml gr9 gr9.sml sml 7399 92 219 IMAGE-THUMBNAIL 1-s2.0-S0926860X2500393X-gr3.sml https://s3-eu-west-1.amazonaws.com/prod-ucs-content-store-eu-west/content/pii:S0926860X2500393X/gr3/THUMBNAIL/image/gif/9888eb839d6f0ef8001c49b2cd7ef310/gr3.sml gr3 gr3.sml sml 9961 164 183 IMAGE-THUMBNAIL 1-s2.0-S0926860X2500393X-gr4.sml https://s3-eu-west-1.amazonaws.com/prod-ucs-content-store-eu-west/content/pii:S0926860X2500393X/gr4/THUMBNAIL/image/gif/6b345cae8875123e42ab678536cba1ba/gr4.sml gr4 gr4.sml sml 3998 97 219 IMAGE-THUMBNAIL 1-s2.0-S0926860X2500393X-gr1.sml https://s3-eu-west-1.amazonaws.com/prod-ucs-content-store-eu-west/content/pii:S0926860X2500393X/gr1/THUMBNAIL/image/gif/e54104529f9a901fe612165af171814b/gr1.sml gr1 gr1.sml sml 6855 99 219 IMAGE-THUMBNAIL 1-s2.0-S0926860X2500393X-gr2.sml https://s3-eu-west-1.amazonaws.com/prod-ucs-content-store-eu-west/content/pii:S0926860X2500393X/gr2/THUMBNAIL/image/gif/6881db8f35482a65bd6a115c40b44333/gr2.sml gr2 gr2.sml sml 21330 117 219 IMAGE-THUMBNAIL 1-s2.0-S0926860X2500393X-gr7.sml https://s3-eu-west-1.amazonaws.com/prod-ucs-content-store-eu-west/content/pii:S0926860X2500393X/gr7/THUMBNAIL/image/gif/66fcdfe001f2084a633565308790d1b6/gr7.sml gr7 gr7.sml sml 10464 164 197 IMAGE-THUMBNAIL 1-s2.0-S0926860X2500393X-gr8.sml https://s3-eu-west-1.amazonaws.com/prod-ucs-content-store-eu-west/content/pii:S0926860X2500393X/gr8/THUMBNAIL/image/gif/391e9e0708acd267d692a17e50983761/gr8.sml gr8 gr8.sml sml 10413 164 186 IMAGE-THUMBNAIL 1-s2.0-S0926860X2500393X-gr5.sml https://s3-eu-west-1.amazonaws.com/prod-ucs-content-store-eu-west/content/pii:S0926860X2500393X/gr5/THUMBNAIL/image/gif/f8246f46882b3d6108932fe1343ebfc2/gr5.sml gr5 gr5.sml sml 6309 164 184 IMAGE-THUMBNAIL 1-s2.0-S0926860X2500393X-gr6.sml https://s3-eu-west-1.amazonaws.com/prod-ucs-content-store-eu-west/content/pii:S0926860X2500393X/gr6/THUMBNAIL/image/gif/ecf26258d9256fb27829aa39a05a9330/gr6.sml gr6 gr6.sml sml 12752 164 190 IMAGE-THUMBNAIL 1-s2.0-S0926860X2500393X-sc1.sml https://s3-eu-west-1.amazonaws.com/prod-ucs-content-store-eu-west/content/pii:S0926860X2500393X/sc1/THUMBNAIL/image/gif/2be52c8d270bad44b5eaa19ccb2651c4/sc1.sml sc1 sc1.sml sml 10059 154 219 IMAGE-THUMBNAIL 1-s2.0-S0926860X2500393X-fx1.sml https://s3-eu-west-1.amazonaws.com/prod-ucs-content-store-eu-west/content/pii:S0926860X2500393X/fx1/THUMBNAIL/image/gif/8388e5da66bb7eea3bb44e9c4f4949ef/fx1.sml fx1 fx1.sml sml 3750 118 219 IMAGE-THUMBNAIL 1-s2.0-S0926860X2500393X-ga1.sml https://s3-eu-west-1.amazonaws.com/prod-ucs-content-store-eu-west/content/pii:S0926860X2500393X/ga1/THUMBNAIL/image/gif/749f29408dfada69fd9f0af2fd9087b2/ga1.sml ga1 true ga1.sml sml 9845 118 219 IMAGE-THUMBNAIL 1-s2.0-S0926860X2500393X-gr9_lrg.jpg https://s3-eu-west-1.amazonaws.com/prod-ucs-content-store-eu-west/content/pii:S0926860X2500393X/HIGHRES/image/jpeg/a781fa01df502917b5ab9dfcb4bddd36/gr9_lrg.jpg gr9 gr9_lrg.jpg jpg 172938 1261 2994 IMAGE-HIGH-RES 1-s2.0-S0926860X2500393X-gr3_lrg.jpg https://s3-eu-west-1.amazonaws.com/prod-ucs-content-store-eu-west/content/pii:S0926860X2500393X/HIGHRES/image/jpeg/551e86b1a0883cec7bd90c56515d4209/gr3_lrg.jpg gr3 gr3_lrg.jpg jpg 445143 2661 2966 IMAGE-HIGH-RES 1-s2.0-S0926860X2500393X-gr4_lrg.jpg https://s3-eu-west-1.amazonaws.com/prod-ucs-content-store-eu-west/content/pii:S0926860X2500393X/HIGHRES/image/jpeg/c446c3aadf250f7eb4e9fd3f4e050c15/gr4_lrg.jpg gr4 gr4_lrg.jpg jpg 132955 1108 2495 IMAGE-HIGH-RES 1-s2.0-S0926860X2500393X-gr1_lrg.jpg https://s3-eu-west-1.amazonaws.com/prod-ucs-content-store-eu-west/content/pii:S0926860X2500393X/HIGHRES/image/jpeg/16cb0d012db7fc6a633593f2fb91b291/gr1_lrg.jpg gr1 gr1_lrg.jpg jpg 344416 1351 2994 IMAGE-HIGH-RES 1-s2.0-S0926860X2500393X-gr2_lrg.jpg https://s3-eu-west-1.amazonaws.com/prod-ucs-content-store-eu-west/content/pii:S0926860X2500393X/HIGHRES/image/jpeg/968012099c15cad70a869d7d2f0ddaa8/gr2_lrg.jpg gr2 gr2_lrg.jpg jpg 678536 1597 2994 IMAGE-HIGH-RES 1-s2.0-S0926860X2500393X-gr7_lrg.jpg https://s3-eu-west-1.amazonaws.com/prod-ucs-content-store-eu-west/content/pii:S0926860X2500393X/HIGHRES/image/jpeg/925cb9aa0306cbf19048caee83d6efd0/gr7_lrg.jpg gr7 gr7_lrg.jpg jpg 105034 1450 1746 IMAGE-HIGH-RES 1-s2.0-S0926860X2500393X-gr8_lrg.jpg https://s3-eu-west-1.amazonaws.com/prod-ucs-content-store-eu-west/content/pii:S0926860X2500393X/HIGHRES/image/jpeg/b2ae8faedb9534712e3cc37cc78a1d55/gr8_lrg.jpg gr8 gr8_lrg.jpg jpg 392681 2637 2994 IMAGE-HIGH-RES 1-s2.0-S0926860X2500393X-gr5_lrg.jpg https://s3-eu-west-1.amazonaws.com/prod-ucs-content-store-eu-west/content/pii:S0926860X2500393X/HIGHRES/image/jpeg/be4cead6b9b4581b498d70fdac6a5609/gr5_lrg.jpg gr5 gr5_lrg.jpg jpg 459545 2663 2994 IMAGE-HIGH-RES 1-s2.0-S0926860X2500393X-gr6_lrg.jpg https://s3-eu-west-1.amazonaws.com/prod-ucs-content-store-eu-west/content/pii:S0926860X2500393X/HIGHRES/image/jpeg/f8b5af157db00e3cc70d033cfb3c0a50/gr6_lrg.jpg gr6 gr6_lrg.jpg jpg 146675 1504 1746 IMAGE-HIGH-RES 1-s2.0-S0926860X2500393X-sc1_lrg.jpg https://s3-eu-west-1.amazonaws.com/prod-ucs-content-store-eu-west/content/pii:S0926860X2500393X/HIGHRES/image/jpeg/45471eaeab071f27a96cdd52d2db08eb/sc1_lrg.jpg sc1 sc1_lrg.jpg jpg 196532 1749 2492 IMAGE-HIGH-RES 1-s2.0-S0926860X2500393X-fx1_lrg.jpg https://s3-eu-west-1.amazonaws.com/prod-ucs-content-store-eu-west/content/pii:S0926860X2500393X/HIGHRES/image/jpeg/105dab44f1314092ae75d6a5bfa707fc/fx1_lrg.jpg fx1 fx1_lrg.jpg jpg 186444 1619 2994 IMAGE-HIGH-RES 1-s2.0-S0926860X2500393X-ga1_lrg.jpg https://s3-eu-west-1.amazonaws.com/prod-ucs-content-store-eu-west/content/pii:S0926860X25003850/HIGHRES/image/jpeg/cf8e7ef2cd36bbbea859b232b4a87023/ga1_lrg.jpg ga1 true ga1_lrg.jpg jpg 152004 886 1649 IMAGE-HIGH-RES 1-s2.0-S0926860X2500393X-mmc1.doc https://s3-eu-west-1.amazonaws.com/prod-ucs-content-store-eu-west/content/pii:S0926860X2500393X/mmc1/MAIN/application/msword/413de23a69705aae2c7c744cb407cfa2/mmc1.doc mmc1 mmc1.doc doc 296960 APPLICATION 1-s2.0-S0926860X2500393X-si0001.svg https://s3-eu-west-1.amazonaws.com/prod-ucs-content-store-eu-west/content/pii:S0926860X2500393X/image/svg+xml/7b48b36d58bc017860438e12dccaafb0/si0001.svg si0001 si0001.svg svg 4943 ALTIMG 1-s2.0-S0926860X2500393X-si0002.svg https://s3-eu-west-1.amazonaws.com/prod-ucs-content-store-eu-west/content/pii:S0926860X2500393X/image/svg+xml/42c26f241fb9acea5f5f2914e8feb778/si0002.svg si0002 si0002.svg svg 5077 ALTIMG APCATA 120492 120492 S0926-860X(25)00393-X 10.1016/j.apcata.2025.120492 Elsevier B.V. Fig. 1 The XRD patterns of different ZrO2/NC catalysts. (a) 48ZrO2/NC_T with different pyrolysis temperature and (b) wZrO2/NC_750 with varying Zr loadings. Fig. 1 Fig. 2 SEM image of NC (a) and 33ZrO2/NC_750 (b), TEM image (c and d) and EDS mapping (e) of 33ZrO2/NC_750. Fig. 2 Fig. 3 XPS survey spectra (a), and the high-resolution Zr 3d (b), O 1 s (c), N 1s (d) of ZrO2 and 22ZrO2/NC_750. Fig. 3 Fig. 4 NH3-TPD (a) and CO2-TPD (b) of 33ZrO2/NC_750 catalyst. Fig. 4 Fig. 5 The Py-FTIR of ZrO2 (a), 9ZrO2/NC (b), 22ZrO2/NC (c) and 48ZrO2/NC (d) at different temperatures. L: LAS and B: BAS. Fig. 5 Fig. 6 Effect of pyrolysis temperature on catalytic performance of 48ZrO2/NC_T. Reaction conditions: 2 mmol FUR, 10 mL 2-propanol, 100 mg catalyst, 160 °C, 6 h. Fig. 6 Fig. 7 The effect of additives on catalytic performance of 33ZrO2/NC. Reaction conditions: 2 mmol FUR, 2 mmol additive, 10 mL 2-propanol, 100 mg catalyst, 150 °C, 2 h. Fig. 7 Fig. 8 Effect of reaction temperature (a), time (b), catalyst amount (c) and H-donor (d) on the catalytic performance of 33ZrO2/NC. Reaction conditions: (a) 2 mmol FUR, 10 mL 2-propanol, 100 mg catalyst, 6 h; (b) 2 mmol FUR, 10 mL 2-propanol, 100 mg catalyst, 150 °C; (c) 2 mmol FUR, 10 mL 2-propanol, 150 °C, 2 h; (d) 2 mmol FUR, 10 mL hydrogen donor, 100 mg catalyst, 150 °C, 2 h. Fig. 8 Fig. 9 Recycle performance (a) and hot filtration test (b) of 33ZrO2/NC on FUR to FAL. Reaction conditions: (a) 2 mmol FUR, 10 mL 2-propanol, 100 mg catalyst, 150 °C, 2 h. Fig. 9 Scheme 1 Schematic diagram for preparing ZrO2/NC catalyst. Scheme 1 Table 1 Catalytic performance of wZrO2/NC with different Zr loading in the CTH reaction a . Table 1 Entry Catalyst FUR conversion (%) FAL selectivity (%) 1 Blank 2.2 88.9 2 NC 4.3 87.5 3 ZrO2 29.9 78.8 4 9ZrO2/NC 30.5 77.6 5 12ZrO2/NC 72.0 94.0 6 17ZrO2/NC 82.2 96.5 7 22ZrO2/NC 94.0 98.3 8 33ZrO2/NC 99.7 96.5 9 48ZrO2/NC 79.9 92.4 10 33ZrO2/C 66.5 93.7 a Reaction conditions: 2 mmol FUR, 10 mL 2-propanol, 100 mg catalyst, 160 °C, 6 h. Table 2 Comparison of catalytic performance of various catalysts in CTH reaction of FUR to FAL. Table 2 Catalyst Temp (°C) Time (h) FUR conv. (%) FAL sel. (%) Ref. Zr9B1FeO 170 2 98 51 [26] 15Cu−15Ni/MCM−41 160 4 95 99 [36] 20 %Cu/MgO-Al2O3 210 1 100 89 [49] Fe3O4@C 200 4 94 99 [58] Cu2Zn/SiO2-IS 120 4 82 95 [59] γ-Fe2O3@HAP 180 10 96 95 [60] UiO−66 140 5 99 87 [61] Zr5Al5 130 5 95 95 [62] SA-PO(MA)/Zr-E 85 8 96 98 [63] Co1.5Mg1.5Al1-LDO−500 160 6 99 96 [64] Al7Zr3@Fe3O4(1/1) 180 4 99 91 [65] 33ZrO2/NC 150 2 93 96 This work Table 3 CTH activity of 33ZrO2/NC for different aldehyde compounds a. Table 3 Image 1 a Reaction conditions: 2 mmol substrate, 10 mL 2-propanol, 100 mg catalyst, 150 °C, 2 h. Chitosan-derived NC support zirconia as highly efficient catalyst for the catalytic transfer hydrogenation of furfural to furfuryl alcohol Xueting Zhu Investigation Formal analysis a Zonghui Liu Writing – review & editing Writing – original draft Formal analysis Conceptualization a ⁎ Zhun Hu Validation b Bing Yan Validation a Bing Xue Supervision a ⁎ a Jiangsu Province Engineering Research Center of Biodegradable Materials, School of Petrochemical Engineering, Changzhou University, Changzhou, Jiangsu 213164, China Jiangsu Province Engineering Research Center of Biodegradable Materials, School of Petrochemical Engineering, Changzhou University Changzhou Jiangsu 213164 China Jiangsu Province Engineering Research Center of Biodegradable Materials, School of Petrochemical Engineering, Changzhou University, Changzhou 213164, Jiangsu, China b Institute of Industrial Catalysis, School of Chemical Engineering and Technology, Xi’an Jiaotong University, Xi’an, Shaanxi 710049, China Institute of Industrial Catalysis, School of Chemical Engineering and Technology, Xi’an Jiaotong University Xi’an Shaanxi 710049 China Institute of Industrial Catalysis, School of Chemical Engineering and Technology, Xi’an Jiaotong University, Xi’an 710049, Shaanxi, China ⁎ Corresponding authors. Developing green and efficient catalysts for converting biomass into high-value chemicals is of great significance in heterogeneous catalysis. Herein, we prepared a series of wZrO2/NC_T with various ZrO2 loading (w) and pyrolysis temperature (T) by a hydrothermal carbonization-pyrolysis method using green and inexpensive bio-chitosan as nitrogen-doped carbon materials (NC) precursor, and applied to the catalytic transfer hydrogenation (CTH) of furfural (FUR) to furfuryl alcohol (FAL). A 99.7 % FUR conversion and 96.5 % FAL selectivity was achieved over 33ZrO2/NC_750 catalyst using 2-propanol as the hydrogen source under certain reaction conditions, which was much higher than that of ZrO2 and ZrO2/C catalyst. The nitrogen species in NC can not only enhance the dispersion of ZrO2, but also provide a certain amount of Lewis base sites. The synergistic interaction of Lewis acid sites (Zr4 +) and Lewis base sites (N species and O2-) played important roles in the FUR to FAL reaction. Moreover, the absence of Brønsted acid sites reduced the occurrence of side reactions and thereby enhances the selectivity of FAL. The influence of acidic (benzoic acid) and basic (pyridine) additives on the catalytic performance further verified the synergistic acid-base catalytic mechanism. In addition, this catalyst can also catalyze other aldehydes to corresponding alcohols and was reused at least five times without any significant loss of catalytic active and selectivity. Graphical Abstract Keywords Furfural Furfuryl alcohol Catalytic transfer hydrogenation ZrO2/NC Data availability Data will be made available on request. 1 Introduction Biomass, as a sustainable source of natural carbon to replace fossil fuels in the production of high value-added products, has attracted widespread attention. Furfural (FUR) is a key platform compound that can be cheaply produced through the catalytic conversion of C5 carbohydrates from hemicellulose biomass [1–3]. As a bio-based platform compound containing both aldehydic functional group and 5-membered monocyclic heteroarene furan ring, FUR can convert to many value-added products such as furfuryl alcohol (FAL), tetrahydrofurfuryl alcohol, levulinic acid, 2-methylfuran, γ-valerolactone and other fine chemicals [4–10]. As the primary industrial derivative of FUR, FAL constitutes approximately 65 % of its annual global production [11]. This key chemical intermediate is widely used in the manufacturing process, especially in the production of agricultural pesticides, polymer materials and phenolic resins, as well as for other industrial applications [12]. The catalytic hydrogenation pathways for converting FUR to FAL mainly include direct hydrogenation and catalytic transfer hydrogenation (CTH). In conventional direct hydrogenation processes, the use of H2 as the primary hydrogen source presents some challenges, such as the inherent safety concerns associated with high-pressure H2, and thermodynamic propensity for over-hydrogenation side reactions that decrease FAL selectivity. Notably, direct hydrogenation often uses precious metals such as Pt [13,14], Au [15], Pd [16–19]and Ru[20,21] as catalysts, which will further increase the production cost. Emerging as a promising alternative, CTH strategies employ liquid-phase hydrogen donors, primarily categorized into acid-mediated and alcohol-based systems. While acidic hydrogen donors (usually formic acid[22–24]) demonstrate effective proton transfer capabilities, their practical application is constrained by accelerated reactor corrosion under prolonged operational conditions. In contrast, alcohol donors exhibit enhanced process sustainability due to its safety and high efficiency. Extensive research has confirmed that the synergistic interaction of Lewis acid sites (LAS) and Lewis base sites (LBS) serves as critical active centers in the transfer hydrogenation systems, which has prompted researcher to develop bifunctional catalysts suitable for this reaction. To date, a diverse array of catalysts has been developed and successfully implemented in this CTH of FUR to FAL reaction, including Zr-based [25–28], Ni-based [29–31], Ru-based [32,33], Cu-based [34–37], Al-based [38–40], etc. Very recently, Tian et al. [5] synthesized high-entropy HE-UiO-66 catalysts for the CTH of FUR to FAL reaction. The catalytic performance exhibits a positive correlation with configurational entropy in UiO-66 systems. When the number of metals increased from single metal Zr to five metals ZrHfCeSnTi, the yield of FAL gradually increased and reached the highest value of 80.6 % in HE-UiO-66. This enhancement of performance primarily originates from entropy-driven strategy, which effectively generated a high density of unsaturated metal coordination sites. Extensive studies have demonstrated that nitrogen-doped carbon (NC) materials exhibit extensive applications in heterogeneous catalysis owing to their structural tunability and electronic modifiability. Firstly, the introduction of nitrogen to carbon materials can effectively regulate the acid-base properties of the catalyst and improve its activation ability for reactant molecules[28,41]. Secondly, the synergistic coordination between nitrogen and catalytic active centers (e.g., metals or metal oxides) establishes strong metal-support interactions, thereby enhancing the dispersion and stability of active site and improving the catalytic performance [19,42–44]. It is known that the pyridinic nitrogen in NC materials exhibits non-hybridized lone-pair electrons, demonstrating pronounced electron-donating capabilities that serve as LBS, thereby promoting the progress of CTH reaction. However, the use of NC as supporting for the CTH of FUR to FAL reaction has not been reported. In this work, a series of ZrO2/NC catalysts with different ZrO2 loading were prepared by a hydrothermal carbonization-pyrolysis method using green and inexpensive bio-chitosan as NC precursor ( Scheme 1). Under optimum reaction conditions (150 °C, 2 h,100 mg catalyst, in 2-propanol), A 92.9 % FUR conversion with 96.4 % FAL selectivity was obtained over 33ZrO2/NC_750 catalyst. The excellent catalytic performance is primarily attributed to the synergistic catalytic effect between the LAS and LBS in the catalyst. Meanwhile, the absence of Brønsted acid sites in this catalyst effectively avoids the occurrence of side reactions. The effect of acidic additives (benzoic acid) and basic additives (pyridine) on the catalytic performance further verified the synergistic catalytic mechanism of LAS and LBS. In addition, this catalyst has also showed excellent catalytic stability and universality. 2 Experimental section 2.1 Catalyst preparation The catalyst was synthesized through hydrothermal carbonization followed by high-temperature pyrolysis (Scheme 1). First, 1.5 g chitosan was dissolved in 5 wt% acetic acid solution (50 mL). a certain amount of ZrOCl2·8H₂O was then mixed in the above solution under continuous stirring at room temperature. The mixture solution was transferred to a hydrothermal autoclave and carbonized at 180 °C for 8 h. After cooling to room temperature, the obtained black solid-liquid mixture was dried overnight in an oven at 100 °C. The solid power was finally calcined at specified temperature for 2 h in a tube furnace under N₂ atmosphere with a heating rate of 2 °C/min. The final catalyst was designated as wZrO₂/NC_T, where w and T represents the mass loading of Zr and the calcination temperature. Unless otherwise specified, the calcination temperature of the catalyst is 750 °C. 2.2 Catalyst characterization To investigate the structural and surface characteristics of the synthesized catalysts, a series of characterization were investigated. The textural properties were evaluated through N2 adsorption-desorption, while crystallographic features were analyzed using powder X-ray diffraction (XRD). Morphological and chemical attributes were examined via high-resolution electron microscopy techniques (SEM/TEM) coupled with X-ray photoelectron spectroscopy (XPS) analysis. Acidic profiles were quantified through ammonia temperature-programmed desorption (NH3-TPD), with Brønsted/Lewis acid differentiation achieved via pyridine-probed infrared spectroscopy (Py-FTIR). The actual Zr loading was determined by inductively coupled plasma-atomic emission spectroscopy (ICP-AES). Standard characterization procedures and instrumental configurations are documented in the Supplementary Materials. 2.3 Catalytic reaction The CTH reaction of FUR with 2-propanol was performed in a 25 mL stainless steel autoclave. In a typical catalytic reaction, 100 mg of catalyst, 2 mmol of FUR and 10 mL of solvent were transferred into the autoclave. The autoclave was then sealed, purged with N2, and heated to the reaction temperature. After the reaction, the reactor was quickly cooled to room temperature. Finally, the mixture solution was filtered and analyzed by gas chromatograph (GC). The conversion of FUR and selectivity of FAL were calculated by the following equations: FUR conversion % = moles of FUR reacted moles of FUR in the feed × 100 % FAL selectivity % = moles of FAL in the product moles of FUR reacted × 100 % 3 Results and discussion 3.1 Catalyst characterization Figs. 1 a and b present the XRD patterns of 48ZrO2/NC_T samples pyrolyzed at different temperatures and wZrO2/NC_750 samples with varying Zr loadings, respectively. Fig. 1 a reveals that all samples exhibited distinct diffraction peaks corresponding to ZrO2, with no detectable impurity phases. At pyrolysis temperatures below 600 °C, only a single crystalline phase of tetragonal ZrO2 (t-ZrO2, PDF No. 49–1642) is observed, characterized by peaks at 2θ = 30.1°, 34.9°, 50.2°, 59.7°, 62.6°, and 73.9°. However, increasing the pyrolysis temperature leads to the emergence of three additional peaks at 2θ = 24.5°, 28.2°, and 31.4° attributed to monoclinic ZrO2 (m-ZrO2, PDF No. 72–1669). Furthermore, tetragonal ZrO2 remains the predominant phase when the Zr loading is below 33 % (Fig. 1 b). The FTIR of wZrO2/NC_750 also confirmed the successful loading of ZrO2 on the NC support, and when the loading amount of Zr increased to 44 %, a tetragonal phase of ZrO2 was observed (Figure S1). Additionally, a diffraction peaks at 2θ = 26.5° related to carbon nitride (CN) are detectable in samples with Zr loadings below 22 %. The N2 adsorption-desorption isotherm of wZrO2/NC_750 samples were shown in Figure S2, a type I isotherm was observed, indicating that ZrO2/NC_750 contain micropore. As the Zr loading increased from 22 % to 48 %, the surface area and pore volume decreased from 294 to 94 m2/g and from 0.15 to 0.06 m3/g, respectively. In addition, the pore size (0.5–0.6 nm) remained almost unchanged (Table S1). Thermogravimetric analysis (TGA) of the catalysts was conducted in air (Figure S3). The TGA curves indicated a significant mass loss as the samples were heated from room temperature to 800 °C. An initial minor mass loss (< 8 wt%) occurring below 150 °C was ascribed to physisorbed water. On the NC support, more than 90 % of the weight loss was observed, which was attributed to the combustion of the NC material. In contrast, there was no mass lose of ZrO2 when the temperature increased to 800 °C. When Zr was supported on NC materials, the mass loss is mainly attributed to the combustion of the NC material. Furthermore, increasing the ZrO2 loading led to a decrease in catalyst mass loss. The morphology of NC support and 33ZrO2/NC_750 was characterized by SEM and TEM. In the NC sample, a smooth sheet-like structure was observed with a sparse distribution of nanoscale pores on the surface ( Fig. 2 a). After loading ZrO2, numerous nano-ZrO2 particles appeared on the NC support (Fig. 2 b). TEM image confirmed the uniform distribution of ZrO2 particles on NC and the average particle size of ZrO2 was about 3.5 nm (Fig. 2 c). The high-resolution TEM exhibited lattice fringes of 0.296 nm and 0.284 nm, which matched with the (111) plane of t-ZrO2 and m-ZrO2, respectively (Fig. 2 d). In addition, The EDS mapping image of 33ZrO2/NC_750 showed homogeneous dispersion of C, N, Zr and O (Fig. 2 e). The elemental composition and chemical environment of the ZrO2/NC catalyst were analyzed by XPS spectroscopy. The survey spectra ( Fig. 3 a) confirmed the presence of O (531 eV), N (399 eV), C (284 eV) and Zr (182 eV) in ZrO2/NC catalyst. High-resolution spectra of the Zr 3d, O 1 s and N 1 s region were further analyzed to determine their chemical states. The Zr 3d spectra exhibited two signals from 181 eV to 184 eV and from 184 eV to 187 eV, respectively attributed to the Zr 3d5/2 and Zr 3d3/2 electron orbitals (Fig. 3 b). Compared to pure ZrO2, the position of these two peaks shifted to the lower binding energies after ZrO2 was supported on NC. This shift provides evidence for the chemical bonding of ZrO2 to the NC support, probably due to the interaction between Zr and N of NC. Moreover, the blue shift observed in the Zr 3d spectra indicated an increase in the density of positive charges Zr atoms in ZrO2/NC, leading to a decrease in Lewis acidity. The O 1 s spectra can be fitted into tree peaks (Fig. 3 c)[45,46]. For ZrO2, the primary peaks at 530.6 eV represented the lattice oxygen (OI) of ZrO2, while the peaks at 532.1 and 533.2 eV corresponded to surface defect oxygen (OII) and surface chemisorbed oxygen (OIII), respectively. Similar to Zr 3d, the O 1 s binding energy of ZrO2/NC also exhibited a negative shift relative to pure ZrO2. This shift indicates increased negative charge density on oxygen atoms and enhanced Lewis basicity in the ZrO2/NC catalyst. It is known that in the CTH reaction, LAS facilitate hydrogen transfer while LBS activate hydroxyl groups through nucleophilic interactions, forming a cooperative catalytic mechanism. Consistent with prior studies on NC materials[42,47,48], the spectra of N 1 s could be deconvoluted into four peaks (Fig. 3 d). The peak with the lowest binding energy of 398.4 eV corresponded to pyridinic N. Peaks at 400.1 eV and 400.8 eV were assigned to pyrrolic and graphitic N, respectively. The peak located at highest binding energy of 403.2 eV was attributed to pyridinic oxides. These N species are beneficial for the stabilization and dispersion of ZrO2, and also provide basic sites, thereby enhancing the catalytic activity of the CTH reaction. It is well known that the acidic and basic sites of the catalyst play a crucial role in the CTH reaction[26,49,50], thus, the acid-base characteristics of the 33ZrO2/NC_750 were characterized using temperature-programmed desorption of ammonia (NH3-TPD) and carbon dioxide (CO2-TPD) ( Fig. 4). To circumvent potential interference from water desorption, the NH3-TPD profiles were specifically acquired by monitoring the m/z = 15. For CO2-TPD, the desorption behavior was tracked via the molecular CO2 signal at m/z = 44. The NH3-TPD profile exhibited two distinct broad desorption peaks at 213 and 264 °C (Fig. 4 a), corresponding to the weak and medium acid sites, respectively, with acid densities of 0.15 and 0.16 mmol NH3 gcatal. –1. For CO2-TPD profile (Fig. 4 b), the desorption of CO2 started at 100 °C and peaked at 295 °C, indicating that weak bases and moderately strong bases sites were mainly present in the ZrO2/NC catalyst. The basic sites of NC are mainly provided by uncondensed amino group, such as –NH2 and –NH[51,52]. Additionally, a small CO2 desorption peak was also observed at 167 °C, which is attributed to the weak basic site. Furthermore, the number of basic sites is 0.78 mmol CO2 gcatal. –1, significantly higher than the number of acidic sites (0.31 mmol NH3 gcatal. –1) in ZrO2/NC. Given the critical role of acidic site type in CTH reaction, pyridine-adsorption FTIR spectroscopy (Py-FTIR) was employed to characterize the prepared catalysts as shown in Fig. 5. Characteristic bands for LAS were identified at 1447, 1580, and 1600 cm⁻¹ , while BAS exhibited a peak at 1540 cm⁻¹ . The band at 1490 cm⁻¹ corresponds to pyridine adsorbed on both LAS and BAS[7,53–55]. It is clear seen that all the catalysts exhibited adsorption band related with the LAS, which are caused by pyridine adsorption on surface Zr4 +. Moreover, the density of these peaks decreased with increasing the adsorption temperature. This is because as the temperature increase, pyridine gradually desorbed from the acidic sites. In contrast, no adsorption peaks related with BAS were detected in all samples even at low evacuation temperature. Combined with the following catalytic results, it can be concluded that the active sites in the CTH reaction is LAS rather than BAS. Furthermore, the intensity of LAS increased with the higher ZrO2 loading, but it is lower than that of pure ZrO2, this result was also consistent with the XPS results (Fig. 3 b). 3.2 Catalytic performance for the CTH of FUR to FAL reaction 3.2.1 Activity evaluation of different catalysts It is well known that the pyrolysis temperature has a significant effect on the properties of carbon materials, which in turn affects the catalytic performance of the catalyst[56]. Therefore, we first studied the influence of different pyrolysis temperatures on the catalytic performance of 48ZrO2/NC_T using 2-propanol as the hydrogen donor and solvent. As shown in Fig. 6, the selectivity of FAL exhibited a steady increase from 21.3 % to 88.4 % with increasing pyrolysis temperature from 500 °C to 700 °C. Upon further elevating the temperature to 800 °C, the selectivity initially demonstrated a gradual increase to 92.4 % (750 °C), followed by a decline to 86.6 % (800 °C). Concurrently, FUR conversion displayed a parabolic trend across the 500–800 °C temperature range and attaining its maximum value (79.9 %) at 750 °C. Therefore, the optimal pyrolysis temperature is 750 °C. The catalytic performance of wZrO2/NC with varying Zr loading was subsequently evaluated and the results were shown in Table 1. In the blank experiment, only a 2.2 % FUR conversion was observed (Entry 1), indicating that the CTH reaction of FUR to FAL is hard to occur without catalyst. For comparison, both NC support and ZrO2 as the catalyst were also applied in this reaction. The NC support showed a 4.3 % FUR conversion and 87.5 % FUR selectivity (Entry 2), while ZrO2 also exhibited limited catalytic efficiency with 29.9 % conversion and 78.8 % selectivity toward FAL (Entry 3). The catalytic behavior exhibited a clear dependence on the loading of Zirconium (Entry 4–9). At 9 wt% Zr loading on the NC support, the FUR conversion (30.5 %) and FAL selectivity (77.6 %) remained comparable to those of pure ZrO2. Interestingly, increasing the Zr loading to 33 wt% induced a progressive enhancement in catalytic performance, achieving 99.7 % FUR conversion and 96.5 % FAL selectivity. The improvement of catalytic performance might be caused by the synergistic effect of LAS (Zr4+) and LBS (O2- of ZrO2 and N species of NC). However, further increasing the loading to 48 wt% resulted in a notable decline in FUR conversion (79.9 %), this may be due to a reduction in surface area caused by Zirconia agglomeration. The observed volcanic activity pattern suggests an optimal balance between LAS/LBS density (enhanced by moderate ZrO2 loading) and mass transfer efficiency (pore blockage caused by excessive load). In order to verify the role of N species (LBS) in the reaction, we also synthesized the 33ZrO2/C catalyst using active carbon as the support (Entry 10). A decreased in FUR conversion (66.5 %) was observed, suggesting that N species of ZrO2/NC was important for this reaction. In addition, to further investigate the influence of acid-base sites on the CTH reaction, we conducted selective poisoning experiments by introducing 2 mmol of pyridine (adsorbed on the acid site) or benzoic acid (adsorbed on the basic site) into the reactor prior to catalytic testing using the 33ZrO2/NC catalyst. To more clearly observe the effect of these additives on catalytic activity (in case the conversion increase), the FUR conversion was decreased by lowing the reaction temperature to 150 °C and the time to 2 h. The results from Fig. 7 showed that the control experiment (without adding any additives) achieved 92.9 % FUR conversion with 96.4 % FAL selectivity. The introduction of pyridine resulted in a slight decline in FUR conversion (83.2 %), indicating that LAS are beneficial for the CTH reactions. Strikingly, benzoic acid addition caused a dramatic reduction in FUR conversion to 9.5 %, strongly demonstrating that basic sites are crucial for facilitating the CTH process. Selective site-poisoning studies demonstrated that dual acid-base functionality is essential for converting FUR to FAL reaction. 3.2.2 The effect of reaction parameters The catalytic performance of 33ZrO2/NC was systematically evaluated under varying reaction conditions, with critical parameters such as temperature (120–160 °C), duration (1–6 h), hydrogen donor (alcohol, C1-C4), and catalyst amount (10–120 mg) being optimized ( Fig. 8). As shown in Fig. 8 a, when reaction temperature increased from 120 °C to 150 °C, the conversion of FUR increased from 57.1 % to 92.9 %. Further increasing the temperature to 160 °C had little effect on FUR conversion. Similarly, the selectivity of FAL followed a similar trend, increasing from 83.8 % at 120 °C to 96.8 % at 140 °C, and then remaining almost unchanged. Considering both FUR conversion and FAL selectivity, the optimal reaction temperature is 150 °C. The effect of reaction time on the CTH reaction at the optimal temperature of 150 °C is shown in Fig. 8 b. It can be seen that the FUR conversion reached 93 % after 2 h and subsequently showed gradual enhancement to 99.7 % upon extending the reaction duration to 6 h. Notably, FAL selectivity maintained consistently superior performance above 90 % throughout the time course. Fig. 8 c illustrate that the catalyst amount exhibited a similar effect as the reaction time. When increasing the catalyst amount from 10 mg to 100 mg, significant improvements were observed with FUR conversion improving from 22.3 % to 92.9 % and FAL selectivity increasing from 16.3 % to 96.4 %. Further increasing the catalyst amount did not significantly change the catalytic performance. Therefore, the optimal catalyst amount is 100 mg. The effect of hydrogen donor on catalytic performance were finally studied on 33ZrO2/NC catalyst under the optimum conditions (150 °C, 2 h and 100 mg catalyst). As shown in Fig. 8 d, both carbon chain length (C1-C4) and alcohol type (primary or secondary) have a significant influence on FUR conversion and FAL selectivity. Notable, all the used alcohols except methanol demonstrated effective catalytic activity for the FUR to FAL reaction. When methanol was used as the hydrogen and solvent, a high FUR conversion of 73.4 % was achieved, but the FAL selectivity was only 0.9 %. This is mainly due to the competitive acetalization between FUR and methanol, the similar results were also observed in the same reaction using other catalysts[5,39,57]. Particularly, the primary alcohols (methanol, ethanol, n-propanol and 1-butanol) presented a much lower FUR conversion (<75 %) and FAL selectivity (<50 %) than secondary alcohols. It is because the primary alcohols have higher reduction potential than secondary alcohols. In the comparison of secondary alcohols, although the selectivity of FAL was similar, the FUR conversion in 2-butanol was slightly lower (79.7 %) than that in 2-propanol (92.9 %). This difference is due to the steric effect caused by the longer carbon chain in 2-butanol. Therefor, 2-propanol proved to be the most effective hydrogen donor for the CTH reaction. For comparison, the catalytic performance of various previously reported catalysts (e.g., Zr-, Cu-, Fe-, Co-, and Al-based materials) for the CTH of FUR to FAL reaction was listed in Table 2. It can be seen that most catalysts were carried out at higher reaction temperature and longer reaction time to obtain a higher FUR conversion, and the ZrO2/NC catalyst exhibited a superior performance under milder conditions. Moreover, the ZrO2/NC catalyst was synthesized by a simple hydrothermal carbonization-pyrolysis method using chitosan as the NC precursor, which is more convenient than the preparation methods of other catalysts listed in Table 2. Given its favorable catalytic efficiency and simplified synthesis, ZrO2/NC demonstrates promising potential for the CTH of FUR to FAL. 3.2.3 Reusability and universality of the catalyst The reusability of 33ZrO2/NC was evaluated under optimum reaction conditions (150 °C, 2 h,100 mg catalyst, in 2-propanol) for the FAL production from FUR. Prior to the next reaction, the used catalyst was separated by filtration and washed 3 times with ethanol to thoroughly remove any organic residues adsorbed on catalyst, and finally dried at 110 °C for 12 h. As shown in Fig. 9 a, the 33ZrO₂/NC catalyst demonstrated remarkable stability with sustained FUR conversion (>93 %) and FAL selectivity (>91 %) over five consecutive cycles. To further verify the heterogeneous nature of the catalyst, the catalyst was removed when the reaction reached 0.5 h (with a FUR conversion of 69 %) (Fig. 9 b). The filtrate was then reacted for 2 h and 4 h under the same conditions. The results showed that FUR conversion was almost unchanged, confirming that the active site did not dissolve into the reaction solution. Cyclic usage and thermal filtration experiments demonstrated that 33ZrO₂/NC exhibits high efficiency and durability in the CTH of FUR. The excellent stability might be attributed to the strong anchoring effect of NC on the metal oxides. The CTH reaction of different aldehydes to the corresponding alcohols were also investigated over 33ZrO2/NC catalyst. As shown in Table 3, the catalyst presented excellent catalytic performance with both aromatic and aliphatic aldehydes. For salicylaldehyde (Substrate 1), a moderate conversion of 51.6 % was achieved with exceptionally high selectivity (99.2 %), suggesting that salicylaldehyde was more difficult to active and may require a higher temperature or longer reaction time to obtain the higher conversion. Notably, very high conversion of benzaldehyde (93.2 %) and selectivity of benzyl alcohol (99.2 %) was obtained over this catalyst. Moreover, excellent catalytic efficiency has also been achieved for para-substituted aromatic aldehydes: p-methoxybenzaldehyde (Substrate 2: 97.9 % conversion, 96.9 % selectivity), and p-methylbenzaldehyde (Substrate 4: 99.5 % conversion, 98.1 % selectivity). Furthermore, the catalyst demonstrated high activity in aliphatic alcohol, achieving 86.3 % conversion of pentanal (Substrate 5) with 84.1 % selectivity toward pentanol. These results demonstrate that the prepared ZrO2/NC has good universality for the CTH reaction of different aldehydes to the corresponding alcohols. 4 Conclusion In summary, a series of catalysts based on nitrogen-doped carbon materials (wZrO2/NC_T) with abundant LAS and LBS were synthesized using hydrothermal carbonization-pyrolysis of chitosan method and applied to the CTH of FUR to FAL reaction. The conversion of FUR first increases and then decreases with the increase of ZrO2 loading (w=9–48 wt%) and the rise of pyrolysis temperature (T = 500–800 °C). The 33ZrO2/NC_750 catalyst was identified as the most efficient catalyst, providing a 92.9 % FUR conversion and 96.4 % FAL selectivity at 150 °C for 2 h. Moreover, this catalyst can be reused at least 5 times without losing its catalytic activity. Correlating the catalytic performance with characterization results revealed that the synergistic interaction of LAS and LBS plays a crucial role in the FUR to FAL reaction. The addition of benzoic acid and pyridine to the reaction system decreased the FUR conversion, indicating that both acid sites and basic site are crucial for the CTH reaction. In addition, their wide applicability to various aldehydes enhances their flexibility, and they are expected to become important catalysts in industrial fields. CRediT authorship contribution statement Zonghui Liu: Writing – review & editing, Writing – original draft, Formal analysis, Conceptualization. Zhun Hu: Validation. Bing Yan: Validation. Xueting Zhu: Investigation, Formal analysis. Bing Xue: Supervision. Declaration of Competing Interest The authors declare that they have no known competing financial interests or personal relationships that could have appeared to influence the work reported in this paper. Acknowledgments This work was supported by the National Natural Science Foundation of China (22302016, and 22278041) and the Jiangsu Province Engineering Research Center of Biodegradable Materials (KF2305), and Postgraduate Research & Practice Innovation Program of Jiangsu Province (KYCX25_3326). We also thank the Shiyanjia Lab (https://www. shiyanjia.com) for the XPS and TEM characterization. Appendix A Supporting information Supplementary data associated with this article can be found in the online version at doi:10.1016/j.apcata.2025.120492. Appendix A Supplementary material Supplementary material References [1] X. Li J. Yang R. Xu L. Lu F. Kong M. Liang L. Jiang S. Nie C. Si Kinetic study of furfural production from eucalyptus sawdust using H-SAPO-34 as solid Brønsted acid and lewis acid catalysts in biomass-derived solvents Ind. Crops Prod. 135 2019 196 205 X. Li, J. Yang, R. Xu, L. Lu, F. Kong, M. Liang, L. Jiang, S. Nie, C. Si, Kinetic study of furfural production from Eucalyptus sawdust using H-SAPO-34 as solid Brønsted acid and Lewis acid catalysts in biomass-derived solvents, Industrial Crops and Products, 135 (2019) 196-205. [2] K. Zhao B. Wen Q. Tang F. Wang X. Liu Q. Xu D. Yin Recent catalytic innovations in furfural transformation Green Chem. 26 2024 9957 9992 K. Zhao, B. Wen, Q. Tang, F. Wang, X. Liu, Q. Xu, D. Yin, Recent catalytic innovations in furfural transformation, Green Chemistry, 26 (2024) 9957-9992. [3] B. Qiu J. Shi W. Hu J. Gao S. Li H. Chu Construction of hydrothermal liquefaction system for efficient production of biomass-derived furfural: solvents, catalysts and mechanisms Fuel 354 2023 129278 B. Qiu, J. Shi, W. Hu, J. Gao, S. Li, H. Chu, Construction of hydrothermal liquefaction system for efficient production of biomass-derived furfural: Solvents, catalysts and mechanisms, Fuel, 354 (2023) 129278. [4] Y. Chen T. Lu X. Yang L. Zhou Regulation of acid/basic properties of Zr-Beta zeolite for efficient conversion of furfural to furfuryl alcohol Mol. Catal. 559 2024 114093 Y. Chen, T. Lu, X. Yang, L. Zhou, Regulation of acid/basic properties of Zr-Beta zeolite for efficient conversion of furfural to furfuryl alcohol, Molecular Catalysis, 559 (2024) 114093. [5] M. Ma E. Chen H. Yue G. Tian S. Feng Entropy engineering activation of UiO-66 for boosting catalytic transfer hydrogenation Nat. Commun. 16 2025 367 M. Ma, E. Chen, H. Yue, G. Tian, S. Feng, Entropy engineering activation of UiO-66 for boosting catalytic transfer hydrogenation, Nature Communications, 16 (2025) 367. [6] H. Zhao X. Liao H. Cui M. Zhu F. Hao W. Xiong H. Luo Y. Lv P. Liu Efficient Cu-Co bimetallic catalysts for the selective hydrogenation of furfural to furfuryl alcohol Fuel 351 2023 128887 H. Zhao, X. Liao, H. Cui, M. Zhu, F. Hao, W. Xiong, H. Luo, Y. Lv, P. Liu, Efficient Cu-Co bimetallic catalysts for the selective hydrogenation of furfural to furfuryl alcohol, Fuel, 351 (2023) 128887. [7] Z. Liu Z. Zhang Y. Zhou Z. Wang M. Du Z. Wen B. Yan Q. Ma N. Liu B. Xue Phosphotungstic acid supported on Zr-SBA-15 as an efficient catalyst for one-pot conversion of furfural to γ-valerolactone Fuel 356 2024 129631 Z. Liu, Z. Zhang, Y. Zhou, Z. Wang, M. Du, Z. Wen, B. Yan, Q. Ma, N. Liu, B. Xue, Phosphotungstic acid supported on Zr-SBA-15 as an efficient catalyst for one-pot conversion of furfural to γ-valerolactone, Fuel, 356 (2024) 129631. [8] Z. Liu Z. Zhang R. Fu J. Xu J. Lu Z. Wen B. Xue One-Pot conversion of furfural to Gamma-Valerolactone over Zr-SBA-15: cooperation of lewis and Brønsted acidic sites ACS Appl. Nano Mater. 6 2023 13196 13207 Z. Liu, Z. Zhang, R. Fu, J. Xu, J. Lu, Z. Wen, B. Xue, One-Pot Conversion of Furfural to Gamma-Valerolactone over Zr-SBA-15: Cooperation of Lewis and Brønsted Acidic Sites, ACS Applied Nano Materials, 6 (2023) 13196-13207. [9] Y. Yuan X. Chen L. Deng S. Zhou C. Qiao Z. Diao H. Wang Y. Tian Production of γ-valerolactone from furfural by core-shell ZSM-5 supporting Ru-Zr bimetals through enhanced cascade reaction Appl. Catal. A Gen. 690 2025 120031 Y. Yuan, X. Chen, L. Deng, S. Zhou, C. Qiao, Z. Diao, H. Wang, Y. Tian, Production of γ-valerolactone from furfural by core-shell ZSM-5 supporting Ru-Zr bimetals through enhanced cascade reaction, Applied Catalysis A: General, 690 (2025) 120031. [10] H. Liu M. Ren W. Wu K. Shi Y. He H. Li H. Wu Direct transformation of Bio-based furfural into γ-valerolactone over SO3H-functionalized P─ O─ hf hybrid catalysts Chem. A Eur. J. 31 2025 e202500677 H. Liu, M. Ren, W. Wu, K. Shi, Y. He, H. Li, H. Wu, Direct Transformation of Bio-Based Furfural into γ-Valerolactone over SO3H-Functionalized P─ O─ Hf Hybrid Catalysts, Chemistry–A European Journal, 31 (2025) e202500677. [11] Y. Lee E.E. Kwon J. Lee Polymers derived from hemicellulosic parts of lignocellulosic biomass Rev. Environ. Sci. Bio/Technol. 18 2019 317 334 Y. Lee, E.E. Kwon, J. Lee, Polymers derived from hemicellulosic parts of lignocellulosic biomass, Reviews in Environmental Science and Bio/Technology, 18 (2019) 317-334. [12] G. Ivaniš L. Fele Žilnik B. Likozar M. Grilc Hydrogen solubility in bio-based furfural and furfuryl alcohol at elevated temperatures and pressures relevant for hydrodeoxygenation Fuel 290 2021 120021 G. Ivaniš, L. Fele Žilnik, B. Likozar, M. Grilc, Hydrogen solubility in bio-based furfural and furfuryl alcohol at elevated temperatures and pressures relevant for hydrodeoxygenation, Fuel, 290 (2021) 120021. [13] G. Gao J. Remón Z. Jiang L. Yao C. Hu Selective hydrogenation of furfural to furfuryl alcohol in water under mild conditions over a hydrotalcite-derived Pt-based catalyst Appl. Catal. B Environ. 309 2022 121260 G. Gao, J. Remón, Z. Jiang, L. Yao, C. Hu, Selective hydrogenation of furfural to furfuryl alcohol in water under mild conditions over a hydrotalcite-derived Pt-based catalyst, Applied Catalysis B: Environmental, 309 (2022) 121260. [14] A. Seretis I. Mertika E. Gabrielatou E. Patatsi I. Thanou P. Diamantopoulou P. Tzevelekidis C. Fakas P. Lilas P.G. Kanellopoulos E. Chrysochou S.P. Kotsaki K. Koukoulakis E. Bakeas G. Papadogianakis Novel hydrogenation reaction of renewable furfural into furfuryl alcohol using highly efficient and selective water-soluble platinum catalysts modified with phosphines and nitrogen-containing ligands in Green aqueous media Catal. Today 444 2025 115019 A. Seretis, I. Mertika, E. Gabrielatou, E. Patatsi, I. Thanou, P. Diamantopoulou, P. Tzevelekidis, C. Fakas, P. Lilas, P.G. Kanellopoulos, E. Chrysochou, S.P. Kotsaki, K. Koukoulakis, E. Bakeas, G. Papadogianakis, Novel hydrogenation reaction of renewable furfural into furfuryl alcohol using highly efficient and selective water-soluble platinum catalysts modified with phosphines and nitrogen-containing ligands in green aqueous media, Catalysis Today, 444 (2025) 115019. [15] M. Li Y. Hao F. Cárdenas-Lizana M.A. Keane Selective production of furfuryl alcohol via gas phase hydrogenation of furfural over Au/Al2O3 Catal. Commun. 69 2015 119 122 M. Li, Y. Hao, F. Cárdenas-Lizana, M.A. Keane, Selective production of furfuryl alcohol via gas phase hydrogenation of furfural over Au/Al2O3, Catalysis Communications, 69 (2015) 119-122. [16] K. Fulajtárova T. Soták M. Hronec I. Vávra E. Dobročka M. Omastová Aqueous phase hydrogenation of furfural to furfuryl alcohol over Pd–Cu catalysts Appl. Catal. A Gen. 502 2015 78 85 K. Fulajtárova, T. Soták, M. Hronec, I. Vávra, E. Dobročka, M. Omastová, Aqueous phase hydrogenation of furfural to furfuryl alcohol over Pd–Cu catalysts, Applied Catalysis A: General, 502 (2015) 78-85. [17] Z. Wang X. Wang C. Zhang M. Arai L. Zhou F. Zhao Selective hydrogenation of furfural to furfuryl alcohol over Pd/TiH2 catalyst Mol. Catal. 508 2021 111599 Z. Wang, X. Wang, C. Zhang, M. Arai, L. Zhou, F. Zhao, Selective hydrogenation of furfural to furfuryl alcohol over Pd/TiH2 catalyst, Molecular Catalysis, 508 (2021) 111599. [18] B. Zhao Y. Yao K. Huang J. Li M. Chen C. Liu H. Xu X. Zhao G. Chang Hollow UiO-66-NH2 encapsulated pd catalysts for highly selective hydrogenation of furfural to furfuryl alcohol Chem. A Eur. J. 30 2024 e202400333 B. Zhao, Y. Yao, K. Huang, J. Li, M. Chen, C. Liu, H. Xu, X. Zhao, G. Chang, Hollow UiO-66-NH2 Encapsulated Pd Catalysts for Highly Selective Hydrogenation of Furfural to Furfuryl Alcohol, Chemistry–A European Journal, 30 (2024) e202400333. [19] C. Pu R.-D. Li G.-G. Chang M.-J. Chen Y. Yao J.-S. Li B. Zhao L. Wu Y.-X. Zhang X.-Y. Yang Hierarchical ZrO2@ N-doped carbon nano-networks anchored ultrafine pd nanoparticles for highly efficient catalytic hydrogenation Sci. China Chem. 65 2022 1661 1669 C. Pu, R.-D. Li, G.-G. Chang, M.-J. Chen, Y. Yao, J.-S. Li, B. Zhao, L. Wu, Y.-X. Zhang, X.-Y. Yang, Hierarchical ZrO2@ N-doped carbon nano-networks anchored ultrafine Pd nanoparticles for highly efficient catalytic hydrogenation, Science China Chemistry, 65 (2022) 1661-1669. [20] J.J. Musci M. Montaña A.B. Merlo E. Rodríguez-Aguado J.A. Cecilia E. Rodríguez-Castellón I.D. Lick M.L. Casella Supported ruthenium catalysts for the aqueous-phase selective hydrogenation of furfural to furfuryl alcohol Catal. Today 394-396 2022 81 93 J.J. Musci, M. Montaña, A.B. Merlo, E. Rodríguez-Aguado, J.A. Cecilia, E. Rodríguez-Castellón, I.D. Lick, M.L. Casella, Supported ruthenium catalysts for the aqueous-phase selective hydrogenation of furfural to furfuryl alcohol, Catalysis Today, 394-396 (2022) 81-93. [21] C. Ramirez-Barria M. Isaacs K. Wilson A. Guerrero-Ruiz I. Rodríguez-Ramos Optimization of ruthenium based catalysts for the aqueous phase hydrogenation of furfural to furfuryl alcohol Appl. Catal. A Gen. 563 2018 177 184 C. Ramirez-Barria, M. Isaacs, K. Wilson, A. Guerrero-Ruiz, I. Rodríguez-Ramos, Optimization of ruthenium based catalysts for the aqueous phase hydrogenation of furfural to furfuryl alcohol, Applied Catalysis A: General, 563 (2018) 177-184. [22] T. Wang J. Du Y. Sun X. Tang Z.-J. Wei X. Zeng S.-J. Liu L. Lin Catalytic transfer hydrogenation of biomass-derived furfural to furfuryl alcohol with formic acid as hydrogen donor over CuCs-MCM catalyst Chin. Chem. Lett. 32 2021 1186 1190 T. Wang, J. Du, Y. Sun, X. Tang, Z.-J. Wei, X. Zeng, S.-J. Liu, L. Lin, Catalytic transfer hydrogenation of biomass-derived furfural to furfuryl alcohol with formic acid as hydrogen donor over CuCs-MCM catalyst, Chinese Chemical Letters, 32 (2021) 1186-1190. [23] X. Zhang Y. Jiang W. Li L. Zhu L. Wang Production of liquid fuels via catalytic transfer hydrogenation promoting lignin depolymerization on modified y zeolite: formic acid as a continuous hydrogen source Energy Convers. Manag. 302 2024 118144 X. Zhang, Y. Jiang, W. Li, L. Zhu, L. Wang, Production of liquid fuels via catalytic transfer hydrogenation promoting lignin depolymerization on modified Y zeolite: Formic acid as a continuous hydrogen source, Energy Conversion and Management, 302 (2024) 118144. [24] T. Wang W. Suo M. Qu F. Li S. Sun W. Xue Y. Wang Cu/CuOx@ c for efficient selective transfer hydrogenation of furfural to furfuryl alcohol with formic acid J. Chem. Technol. Biotechnol. 97 2022 3172 3182 T. Wang, W. Suo, M. Qu, F. Li, S. Sun, W. Xue, Y. Wang, Cu/CuOx@ C for efficient selective transfer hydrogenation of furfural to furfuryl alcohol with formic acid, Journal of Chemical Technology & Biotechnology, 97 (2022) 3172-3182. [25] A.H. Valekar M. Lee J.W. Yoon J. Kwak D.-Y. Hong K.-R. Oh G.-Y. Cha Y.-U. Kwon J. Jung J.-S. Chang Catalytic transfer hydrogenation of furfural to furfuryl alcohol under mild conditions over Zr-MOFs: exploring the role of metal node coordination and modification ACS Catal. 10 2020 3720 3732 A.H. Valekar, M. Lee, J.W. Yoon, J. Kwak, D.-Y. Hong, K.-R. Oh, G.-Y. Cha, Y.-U. Kwon, J. Jung, J.-S. Chang, Catalytic transfer hydrogenation of furfural to furfuryl alcohol under mild conditions over Zr-MOFs: exploring the role of metal node coordination and modification, ACS Catalysis, 10 (2020) 3720-3732. [26] D. Li J. Zhang Y. Liu H. Yuan Y. Chen Boron doped magnetic catalysts for selective transfer hydrogenation of furfural into furfuryl alcohol Chem. Eng. Sci. 229 2021 116075 D. Li, J. Zhang, Y. Liu, H. Yuan, Y. Chen, Boron doped magnetic catalysts for selective transfer hydrogenation of furfural into furfuryl alcohol, Chemical Engineering Science, 229 (2021) 116075. [27] J. Wu D. Liang X. Song T. Liu T. Xu S. Wang Y. Zou Sulfonic groups functionalized Zr-metal organic framework for highly catalytic transfer hydrogenation of furfural to furfuryl alcohol J. Energy Chem. 71 2022 411 417 J. Wu, D. Liang, X. Song, T. Liu, T. Xu, S. Wang, Y. Zou, Sulfonic groups functionalized Zr-metal organic framework for highly catalytic transfer hydrogenation of furfural to furfuryl alcohol, Journal of Energy Chemistry, 71 (2022) 411-417. [28] L. Hu K. Chen J. Li L. Zhang Y. Jiang X. Wang Z. Wu A. He J. Xu J. Song Highly selective transfer hydrogenation of biomass-derived furfural to furfuryl alcohol over a zirconium-melamine coordination catalyst without Brønsted acid sites Chem. Eng. J. 474 2023 145656 L. Hu, K. Chen, J. Li, L. Zhang, Y. Jiang, X. Wang, Z. Wu, A. He, J. Xu, J. Song, Highly selective transfer hydrogenation of biomass-derived furfural to furfuryl alcohol over a zirconium-melamine coordination catalyst without Brønsted acid sites, Chemical Engineering Journal, 474 (2023) 145656. [29] T. Guo Y. Luo H. Li S. Huang Y. Zhang Z. Huang H. Hu T. Gan Single nickel atoms anchored on porous N-doped nanocarbon with dual reaction sites for highly-efficient transfer hydrogenation of furfural to furfuryl alcohol Chem. Eng. J. 500 2024 156659 T. Guo, Y. Luo, H. Li, S. Huang, Y. Zhang, Z. Huang, H. Hu, T. Gan, Single nickel atoms anchored on porous N-doped nanocarbon with dual reaction sites for highly-efficient transfer hydrogenation of furfural to furfuryl alcohol, Chemical Engineering Journal, 500 (2024) 156659. [30] Y. Fan C. Zhuang S. Li Y. Wang X. Zou X. Liu W. Huang G. Zhu Efficient single-atom ni for catalytic transfer hydrogenation of furfural to furfuryl alcohol J. Mater. Chem. A 9 2021 1110 1118 Y. Fan, C. Zhuang, S. Li, Y. Wang, X. Zou, X. Liu, W. Huang, G. Zhu, Efficient single-atom Ni for catalytic transfer hydrogenation of furfural to furfuryl alcohol, Journal of Materials Chemistry A, 9 (2021) 1110-1118. [31] F.-F. Wang R. Guo C. Jian W. Zhang R. Xue D.-L. Chen F. Zhang W. Zhu Mechanism of catalytic transfer hydrogenation for furfural using single ni atom catalysts anchored to nitrogen-doped graphene sheets Inorg. Chem. 61 2022 9138 9146 F.-F. Wang, R. Guo, C. Jian, W. Zhang, R. Xue, D.-L. Chen, F. Zhang, W. Zhu, Mechanism of catalytic transfer hydrogenation for furfural using single Ni atom catalysts anchored to nitrogen-doped graphene sheets, Inorganic Chemistry, 61 (2022) 9138-9146. [32] M. Akram S.U.A. Bhutto S. Aftab F. Wang X. Xu M. Xia Ruthenium based with carbon supported catalysts for the catalytic transfer hydrogenation of furfural: a review Nano Energy 117 2023 108808 M. Akram, S.U.A. Bhutto, S. Aftab, F. Wang, X. Xu, M. Xia, Ruthenium based with carbon supported catalysts for the catalytic transfer hydrogenation of furfural: A review, Nano Energy, 117 (2023) 108808. [33] M. Huš B. Likozar M. Grilc Furfural hydrogenation over cu, ni, pd, pt, re, rh and ru catalysts: ab initio modelling of adsorption, desorption and reaction micro-kinetics Chem. Eng. J. 436 2022 135070 M. Huš, B. Likozar, M. Grilc, Furfural hydrogenation over Cu, Ni, Pd, Pt, Re, Rh and Ru catalysts: Ab initio modelling of adsorption, desorption and reaction micro-kinetics, Chemical Engineering Journal, 436 (2022) 135070. [34] J. Luo Y. Cheng H. Niu T. Wang C. Liang Efficient Cu/FeOx catalyst with developed structure for catalytic transfer hydrogenation of furfural J. Catal. 413 2022 575 587 J. Luo, Y. Cheng, H. Niu, T. Wang, C. Liang, Efficient Cu/FeOx catalyst with developed structure for catalytic transfer hydrogenation of furfural, Journal of Catalysis, 413 (2022) 575-587. [35] K. Zhou J. Chen Y. Cheng Z. Chen S. Kang Z. Cai Y. Xu J. Wei Enhanced catalytic transfer hydrogenation of biomass-based furfural into 2-methylfuran over multifunctional Cu–Re bimetallic catalysts ACS Sustain. Chem. Eng. 8 2020 16624 16636 K. Zhou, J. Chen, Y. Cheng, Z. Chen, S. Kang, Z. Cai, Y. Xu, J. Wei, Enhanced catalytic transfer hydrogenation of biomass-based furfural into 2-methylfuran over multifunctional Cu–Re bimetallic catalysts, ACS Sustainable Chemistry & Engineering, 8 (2020) 16624-16636. [36] B. Gao J. Zhang J.-H. Yang Bimetallic Cu-Ni/MCM-41 catalyst for efficiently selective transfer hydrogenation of furfural into furfural alcohol Mol. Catal. 517 2022 112065 B. Gao, J. Zhang, J.-H. Yang, Bimetallic Cu-Ni/MCM-41 catalyst for efficiently selective transfer hydrogenation of furfural into furfural alcohol, Molecular Catalysis, 517 (2022) 112065. [37] G. Pan S. Cheng Y. Zhang Y. Chen X. Xu J. Xu In situ reduction of cu nanoparticles on Mg-Al-LDH for simultaneous efficient catalytic transfer hydrogenation of furfural to furfuryl alcohol Chem. Commun. 59 2023 3301 3304 G. Pan, S. Cheng, Y. Zhang, Y. Chen, X. Xu, J. Xu, In situ reduction of Cu nanoparticles on Mg-Al-LDH for simultaneous efficient catalytic transfer hydrogenation of furfural to furfuryl alcohol, Chemical Communications, 59 (2023) 3301-3304. [38] R. Ramos A.F. Peixoto B.I. Arias-Serrano O.S.G.P. Soares M.F.R. Pereira D. Kubička C. Freire Catalytic transfer hydrogenation of furfural over Co3O4−Al2O3 Hydrotalcite-derived catalyst ChemCatChem 12 2020 1467 1475 R. Ramos, A.F. Peixoto, B.I. Arias-Serrano, O.S.G.P. Soares, M.F.R. Pereira, D. Kubička, C. Freire, Catalytic Transfer Hydrogenation of Furfural over Co3O4−Al2O3 Hydrotalcite-derived Catalyst, ChemCatChem, 12 (2020) 1467-1475. [39] Z. Liu Z. Zhang Z. Wen B. Xue High efficiency catalytic transfer hydrogenation of furfural to furfuryl alcohol over metallic oxide catalyst Catal. Lett. 152 2022 3537 3547 Z. Liu, Z. Zhang, Z. Wen, B. Xue, High efficiency catalytic transfer hydrogenation of furfural to furfuryl alcohol over metallic oxide catalyst, Catalysis Letters, 152 (2022) 3537-3547. [40] W. Chen Q. Peng G. Fan Q. Cheng M. Tu G. Song Catalytic transfer hydrogenation of furfural to furfuryl alcohol over Al-containing ferrihydrite J. Ind. Eng. Chem. 119 2023 574 585 W. Chen, Q. Peng, G. Fan, Q. Cheng, M. Tu, G. Song, Catalytic transfer hydrogenation of furfural to furfuryl alcohol over Al-containing ferrihydrite, Journal of Industrial and Engineering Chemistry, 119 (2023) 574-585. [41] L. Wang L. Wang H. Jin N. Bing Nitrogen-doped carbon nanotubes with variable basicity: preparation and catalytic properties Catal. Commun. 15 2011 78 81 L. Wang, L. Wang, H. Jin, N. Bing, Nitrogen-doped carbon nanotubes with variable basicity: Preparation and catalytic properties, Catalysis Communications, 15 (2011) 78-81. [42] Z. Liu J. Xu Z. Wen B. Yan B. Xue Chitin-derived NC support vanadia as highly efficient catalyst for the oxidation of ethyl lactate to ethyl pyruvate Biomass.. Bioenergy 190 2024 107396 Z. Liu, J. Xu, Z. Wen, B. Yan, B. Xue, Chitin-derived NC support vanadia as highly efficient catalyst for the oxidation of ethyl lactate to ethyl pyruvate, Biomass and Bioenergy, 190 (2024) 107396. [43] Z. Chen W. Yang Y. Wu C. Zhang J. Luo C. Chen Y. Li Atomic iron on mesoporous N-doped carbon to achieve dehydrogenation reaction at room temperature Nano Res. 13 2020 3075 3081 Z. Chen, W. Yang, Y. Wu, C. Zhang, J. Luo, C. Chen, Y. Li, Atomic iron on mesoporous N-doped carbon to achieve dehydrogenation reaction at room temperature, Nano Research, 13 (2020) 3075-3081. [44] K.X. Huang J. Hua G.G. Chang Z. Li G. Tian M.J. Chen J.X. Li S.C. Ke X.Y. Yang B. Chen Confined thermolysis for oriented N-Doped carbon supported pd toward stable catalytic and energy storage applications Small 17 2021 2002811 K.X. Huang, J. Hua, G.G. Chang, Z. Li, G. Tian, M.J. Chen, J.X. Li, S.C. Ke, X.Y. Yang, B. Chen, Confined Thermolysis for Oriented N-Doped Carbon Supported Pd toward Stable Catalytic and Energy Storage Applications, Small, 17 (2021) 2002811. [45] W. Zhang G. Innocenti P. Oulego V. Gitis H. Wu B. Ensing F. Cavani G. Rothenberg N.R. Shiju Highly selective oxidation of ethyl lactate to ethyl pyruvate catalyzed by mesoporous Vanadia–Titania ACS Catal. 8 2018 2365 2374 W. Zhang, G. Innocenti, P. Oulego, V. Gitis, H. Wu, B. Ensing, F. Cavani, G. Rothenberg, N.R. Shiju, Highly Selective Oxidation of Ethyl Lactate to Ethyl Pyruvate Catalyzed by Mesoporous Vanadia–Titania, ACS Catalysis, 8 (2018) 2365-2374. [46] W. Zhang P. Oulego T.K. Slot G. Rothenberg N.R. Shiju Selective aerobic oxidation of lactate to pyruvate catalyzed by vanadium-nitrogen-doped carbon nanosheets ChemCatChem 11 2019 3381 3387 W. Zhang, P. Oulego, T.K. Slot, G. Rothenberg, N.R. Shiju, Selective Aerobic Oxidation of Lactate to Pyruvate Catalyzed by Vanadium-Nitrogen-Doped Carbon Nanosheets, ChemCatChem, 11 (2019) 3381-3387. [47] Z. Liu J. Xu L. Cui N. Liu B. Yan B. Xue Highly efficient and selectivity controllable aerobic oxidation of ethyl lactate to ethyl pyruvate over VxOy/NC catalysts React. Chem. Eng. 10 2025 676 685 Z. Liu, J. Xu, L. Cui, N. Liu, B. Yan, B. Xue, Highly efficient and selectivity controllable aerobic oxidation of ethyl lactate to ethyl pyruvate over VxOy/NC catalysts, Reaction Chemistry & Engineering, 10 (2025) 676-685. [48] P. Puthiaraj K. Kim W.-S. Ahn Catalytic transfer hydrogenation of bio-based furfural by palladium supported on nitrogen-doped porous carbon Catal. Today 324 2019 49 58 P. Puthiaraj, K. Kim, W.-S. Ahn, Catalytic transfer hydrogenation of bio-based furfural by palladium supported on nitrogen-doped porous carbon, Catalysis Today, 324 (2019) 49-58. [49] H. Chen H. Ruan X. Lu J. Fu T. Langrish X. Lu Efficient catalytic transfer hydrogenation of furfural to furfuryl alcohol in near-critical isopropanol over Cu/MgO-Al2O3 catalyst Mol. Catal. 445 2018 94 101 H. Chen, H. Ruan, X. Lu, J. Fu, T. Langrish, X. Lu, Efficient catalytic transfer hydrogenation of furfural to furfuryl alcohol in near-critical isopropanol over Cu/MgO-Al2O3 catalyst, Molecular Catalysis, 445 (2018) 94-101. [50] C. García-Sancho C.P. Jiménez-Gómez N. Viar-Antuñano J.A. Cecilia R. Moreno-Tost J.M. Mérida-Robles J. Requies P. Maireles-Torres Evaluation of the ZrO2/Al2O3 system as catalysts in the catalytic transfer hydrogenation of furfural to obtain furfuryl alcohol Appl. Catal. A Gen. 609 2021 117905 117918 C. García-Sancho, C.P. Jiménez-Gómez, N. Viar-Antuñano, J.A. Cecilia, R. Moreno-Tost, J.M. Mérida-Robles, J. Requies, P. Maireles-Torres, Evaluation of the ZrO2/Al2O3 system as catalysts in the catalytic transfer hydrogenation of furfural to obtain furfuryl alcohol, Applied Catalysis A: General, 609 (2021) 117905-117918. [51] J. Xu K.-Z. Long Y. Wang B. Xue Y.-X. Li Fast and facile preparation of metal-doped g-C3N4 composites for catalytic synthesis of dimethyl carbonate Appl. Catal. A Gen. 496 2015 1 8 J. Xu, K.-Z. Long, Y. Wang, B. Xue, Y.-X. Li, Fast and facile preparation of metal-doped g-C3N4 composites for catalytic synthesis of dimethyl carbonate, Applied Catalysis A: General, 496 (2015) 1-8. [52] J. Xu J.-K. Shang Y. Chen Y. Wang Y.-X. Li Palladium nanoparticles supported on mesoporous carbon nitride for efficiently selective oxidation of benzyl alcohol with molecular oxygen Appl. Catal. A Gen. 542 2017 380 388 J. Xu, J.-K. Shang, Y. Chen, Y. Wang, Y.-X. Li, Palladium nanoparticles supported on mesoporous carbon nitride for efficiently selective oxidation of benzyl alcohol with molecular oxygen, Applied Catalysis A: General, 542 (2017) 380-388. [53] C. Cai Z. Liu X. Wang Z. Wen B. Yan B. Xue High efficiency catalytic transfer hydrogenation of ethyl levulinate to γ‑valerolactone over Hf-based catalyst Catal. Today 441 2024 114902 C. Cai, Z. Liu, X. Wang, Z. Wen, B. Yan, B. Xue, High efficiency catalytic transfer hydrogenation of ethyl levulinate to γ‑valerolactone over Hf-based catalyst, Catalysis Today, 441 (2024) 114902. [54] J. Qiu Y. Liu J. Zhang B. Zhou Q. Yang L. Zhang J. Chen B. Wang L. Lin X. Zeng One-pot cascade process for efficient upgrading of furfural to γ-valerolactone over adjustable Lewis-Brønsted bi-acidic catalyst Ind. Crops Prod. 214 2024 118474 J. Qiu, Y. Liu, J. Zhang, B. Zhou, Q. Yang, L. Zhang, J. Chen, B. Wang, L. Lin, X. Zeng, One-pot cascade process for efficient upgrading of furfural to γ-valerolactone over adjustable Lewis-Brønsted bi-acidic catalyst, Industrial Crops and Products, 214 (2024) 118474. [55] B. Mutlu B. Unal D. Unlu A novel and clean technique for the one-pot production of Green chemical γ-valerolactone from furfural using bifunctional H3PW12O4/UiO-66 catalyst: pervaporation membrane reactor J. Environ. Chem. Eng. 12 2024 112665 B. Mutlu, B. Unal, D. Unlu, A novel and clean technique for the one-pot production of green chemical γ-valerolactone from furfural using bifunctional H3PW12O4/UiO-66 catalyst: Pervaporation membrane reactor, Journal of Environmental Chemical Engineering, 12 (2024) 112665. [56] B. Huang L. Zhu Z. Du A.W. Anjum X. Li X. Li G. Miao J. Xiao S. Du Highly efficient ethylene/ethane separation via molecular sieving using chitosan-derived ultramicroporous carbon Sep. Purif. Technol. 333 2024 125862 B. Huang, L. Zhu, Z. Du, A.W. Anjum, X. Li, X. Li, G. Miao, J. Xiao, S. Du, Highly efficient ethylene/ethane separation via molecular sieving using chitosan-derived ultramicroporous carbon, Separation and Purification Technology, 333 (2024) 125862. [57] M. Qiu T. Guo R. Xi D. Li X. Qi Highly efficient catalytic transfer hydrogenation of biomass-derived furfural to furfuryl alcohol using UiO-66 without metal catalysts Appl. Catal. A Gen. 602 2020 117719 117725 M. Qiu, T. Guo, R. Xi, D. Li, X. Qi, Highly efficient catalytic transfer hydrogenation of biomass-derived furfural to furfuryl alcohol using UiO-66 without metal catalysts, Applied Catalysis A: General, 602 (2020) 117719-117725. [58] F. Li S. Jiang J. Huang Y. Wang S. Lu C. Li Catalytic transfer hydrogenation of furfural to furfuryl alcohol over a magnetic fe 3 o 4@ c catalyst N. J. Chem. 44 2020 478 486 F. Li, S. Jiang, J. Huang, Y. Wang, S. Lu, C. Li, Catalytic transfer hydrogenation of furfural to furfuryl alcohol over a magnetic Fe 3 O 4@ C catalyst, New Journal of Chemistry, 44 (2020) 478-486. [59] J. Zhang D. Wu Aqueous phase catalytic hydrogenation of furfural to furfuryl alcohol over in-situ synthesized Cu–Zn/SiO2 catalysts Mater. Chem. Phys. 260 2021 124152 J. Zhang, D. Wu, Aqueous phase catalytic hydrogenation of furfural to furfuryl alcohol over in-situ synthesized Cu–Zn/SiO2 catalysts, Materials Chemistry and Physics, 260 (2021) 124152. [60] F. Wang Z. Zhang Catalytic transfer hydrogenation of furfural into furfuryl alcohol over magnetic γ-Fe2O3@ HAP catalyst ACS Sustain. Chem. Eng. 5 2017 942 947 F. Wang, Z. Zhang, Catalytic transfer hydrogenation of furfural into furfuryl alcohol over magnetic γ-Fe2O3@ HAP catalyst, ACS Sustainable Chemistry & Engineering, 5 (2017) 942-947. [61] M. Qiu T. Guo R. Xi D. Li X. Qi Highly efficient catalytic transfer hydrogenation of biomass-derived furfural to furfuryl alcohol using UiO-66 without metal catalysts Appl. Catal. A Gen. 602 2020 117719 M. Qiu, T. Guo, R. Xi, D. Li, X. Qi, Highly efficient catalytic transfer hydrogenation of biomass-derived furfural to furfuryl alcohol using UiO-66 without metal catalysts, Applied Catalysis A: General, 602 (2020) 117719. [62] C. García-Sancho C.P. Jiménez-Gómez N. Viar-Antuñano J.A. Cecilia R. Moreno-Tost J.M. Mérida-Robles J. Requies P. Maireles-Torres Evaluation of the ZrO2/Al2O3 system as catalysts in the catalytic transfer hydrogenation of furfural to obtain furfuryl alcohol Appl. Catal. A Gen. 609 2021 117905 C. García-Sancho, C.P. Jiménez-Gómez, N. Viar-Antuñano, J.A. Cecilia, R. Moreno-Tost, J.M. Mérida-Robles, J. Requies, P. Maireles-Torres, Evaluation of the ZrO2/Al2O3 system as catalysts in the catalytic transfer hydrogenation of furfural to obtain furfuryl alcohol, Applied Catalysis A: General, 609 (2021) 117905. [63] S. Cen L. Wang C. Wan X. Chai L. Li W. Linghu Oxygenated groups enriched polyolefin-Zr(IV) complexes catalyzing low-temperature transfer hydrogenation of biomass-derived furfural with 2-propanol Fuel 357 2024 129864 S. Cen, L. Wang, C. Wan, X. Chai, L. Li, W. Linghu, Oxygenated groups enriched polyolefin-Zr(IV) complexes catalyzing low-temperature transfer hydrogenation of biomass-derived furfural with 2-propanol, Fuel, 357 (2024) 129864. [64] S. Cheng J. Ding Y. Chen G. Pan X. Feng X. Xu J. Xu Enhanced catalytic transfer hydrogenation of biomass-based furfural into furfuryl alcohol over Co3O4-based mixed oxide catalysts from hydrotalcite Appl. Catal. A Gen. 684 2024 119909 S. Cheng, J. Ding, Y. Chen, G. Pan, X. Feng, X. Xu, J. Xu, Enhanced catalytic transfer hydrogenation of biomass-based furfural into furfuryl alcohol over Co3O4-based mixed oxide catalysts from hydrotalcite, Applied Catalysis A: General, 684 (2024) 119909. [65] J. He H. Li A. Riisager S. Yang Catalytic transfer hydrogenation of furfural to furfuryl alcohol with recyclable Al–Zr@ fe mixed oxides ChemCatChem 10 2018 430 438 J. He, H. Li, A. Riisager, S. Yang, Catalytic transfer hydrogenation of furfural to furfuryl alcohol with recyclable Al–Zr@ Fe mixed oxides, ChemCatChem, 10 (2018) 430-438.",
      "scopus-id": "105012290648",
      "coredata": {
        "eid": "1-s2.0-S0926860X2500393X",
        "dc:description": "Developing green and efficient catalysts for converting biomass into high-value chemicals is of great significance in heterogeneous catalysis. Herein, we prepared a series of wZrO2/NC_T with various ZrO2 loading (w) and pyrolysis temperature (T) by a hydrothermal carbonization-pyrolysis method using green and inexpensive bio-chitosan as nitrogen-doped carbon materials (NC) precursor, and applied to the catalytic transfer hydrogenation (CTH) of furfural (FUR) to furfuryl alcohol (FAL). A 99.7 % FUR conversion and 96.5 % FAL selectivity was achieved over 33ZrO2/NC_750 catalyst using 2-propanol as the hydrogen source under certain reaction conditions, which was much higher than that of ZrO2 and ZrO2/C catalyst. The nitrogen species in NC can not only enhance the dispersion of ZrO2, but also provide a certain amount of Lewis base sites. The synergistic interaction of Lewis acid sites (Zr4 +) and Lewis base sites (N species and O2-) played important roles in the FUR to FAL reaction. Moreover, the absence of Brønsted acid sites reduced the occurrence of side reactions and thereby enhances the selectivity of FAL. The influence of acidic (benzoic acid) and basic (pyridine) additives on the catalytic performance further verified the synergistic acid-base catalytic mechanism. In addition, this catalyst can also catalyze other aldehydes to corresponding alcohols and was reused at least five times without any significant loss of catalytic active and selectivity.",
        "openArchiveArticle": "false",
        "prism:coverDate": "2025-10-25",
        "openaccessUserLicense": null,
        "prism:aggregationType": "Journal",
        "prism:url": "https://api.elsevier.com/content/article/pii/S0926860X2500393X",
        "dc:creator": [
          {
            "@_fa": "true",
            "$": "Zhu, Xueting"
          },
          {
            "@_fa": "true",
            "$": "Liu, Zonghui"
          },
          {
            "@_fa": "true",
            "$": "Hu, Zhun"
          },
          {
            "@_fa": "true",
            "$": "Yan, Bing"
          },
          {
            "@_fa": "true",
            "$": "Xue, Bing"
          }
        ],
        "link": [
          {
            "@_fa": "true",
            "@rel": "self",
            "@href": "https://api.elsevier.com/content/article/pii/S0926860X2500393X"
          },
          {
            "@_fa": "true",
            "@rel": "scidir",
            "@href": "https://www.sciencedirect.com/science/article/pii/S0926860X2500393X"
          }
        ],
        "dc:format": "application/json",
        "openaccessType": null,
        "pii": "S0926-860X(25)00393-X",
        "prism:volume": "706",
        "articleNumber": "120492",
        "prism:publisher": "Elsevier B.V. All rights are reserved, including those for text and data mining, AI training, and similar technologies.",
        "dc:title": "Chitosan-derived NC support zirconia as highly efficient catalyst for the catalytic transfer hydrogenation of furfural to furfuryl alcohol",
        "prism:copyright": "© 2025 Elsevier B.V. All rights are reserved, including those for text and data mining, AI training, and similar technologies.",
        "openaccess": "0",
        "prism:issn": "0926860X",
        "dcterms:subject": [
          {
            "@_fa": "true",
            "$": "Furfural"
          },
          {
            "@_fa": "true",
            "$": "Furfuryl alcohol"
          },
          {
            "@_fa": "true",
            "$": "Catalytic transfer hydrogenation"
          },
          {
            "@_fa": "true",
            "$": "ZrO2/NC"
          }
        ],
        "openaccessArticle": "false",
        "prism:publicationName": "Applied Catalysis A: General",
        "openaccessSponsorType": null,
        "prism:pageRange": "120492",
        "pubType": "fla",
        "prism:coverDisplayDate": "25 October 2025",
        "prism:doi": "10.1016/j.apcata.2025.120492",
        "prism:startingPage": "120492",
        "dc:identifier": "doi:10.1016/j.apcata.2025.120492",
        "openaccessSponsorName": null
      },
      "objects": {
        "object": [
          {
            "@category": "standard",
            "@height": "286",
            "@width": "678",
            "@_fa": "true",
            "$": "https://api.elsevier.com/content/object/eid/1-s2.0-S0926860X2500393X-gr9.jpg?httpAccept=%2A%2F%2A",
            "@multimediatype": "JPEG image file",
            "@type": "IMAGE-DOWNSAMPLED",
            "@size": "31862",
            "@ref": "gr9",
            "@mimetype": "image/jpeg"
          },
          {
            "@category": "standard",
            "@height": "602",
            "@width": "671",
            "@_fa": "true",
            "$": "https://api.elsevier.com/content/object/eid/1-s2.0-S0926860X2500393X-gr3.jpg?httpAccept=%2A%2F%2A",
            "@multimediatype": "JPEG image file",
            "@type": "IMAGE-DOWNSAMPLED",
            "@size": "81037",
            "@ref": "gr3",
            "@mimetype": "image/jpeg"
          },
          {
            "@category": "standard",
            "@height": "251",
            "@width": "565",
            "@_fa": "true",
            "$": "https://api.elsevier.com/content/object/eid/1-s2.0-S0926860X2500393X-gr4.jpg?httpAccept=%2A%2F%2A",
            "@multimediatype": "JPEG image file",
            "@type": "IMAGE-DOWNSAMPLED",
            "@size": "21927",
            "@ref": "gr4",
            "@mimetype": "image/jpeg"
          },
          {
            "@category": "standard",
            "@height": "306",
            "@width": "678",
            "@_fa": "true",
            "$": "https://api.elsevier.com/content/object/eid/1-s2.0-S0926860X2500393X-gr1.jpg?httpAccept=%2A%2F%2A",
            "@multimediatype": "JPEG image file",
            "@type": "IMAGE-DOWNSAMPLED",
            "@size": "52893",
            "@ref": "gr1",
            "@mimetype": "image/jpeg"
          },
          {
            "@category": "standard",
            "@height": "362",
            "@width": "678",
            "@_fa": "true",
            "$": "https://api.elsevier.com/content/object/eid/1-s2.0-S0926860X2500393X-gr2.jpg?httpAccept=%2A%2F%2A",
            "@multimediatype": "JPEG image file",
            "@type": "IMAGE-DOWNSAMPLED",
            "@size": "110309",
            "@ref": "gr2",
            "@mimetype": "image/jpeg"
          },
          {
            "@category": "standard",
            "@height": "328",
            "@width": "395",
            "@_fa": "true",
            "$": "https://api.elsevier.com/content/object/eid/1-s2.0-S0926860X2500393X-gr7.jpg?httpAccept=%2A%2F%2A",
            "@multimediatype": "JPEG image file",
            "@type": "IMAGE-DOWNSAMPLED",
            "@size": "19967",
            "@ref": "gr7",
            "@mimetype": "image/jpeg"
          },
          {
            "@category": "standard",
            "@height": "597",
            "@width": "678",
            "@_fa": "true",
            "$": "https://api.elsevier.com/content/object/eid/1-s2.0-S0926860X2500393X-gr8.jpg?httpAccept=%2A%2F%2A",
            "@multimediatype": "JPEG image file",
            "@type": "IMAGE-DOWNSAMPLED",
            "@size": "74057",
            "@ref": "gr8",
            "@mimetype": "image/jpeg"
          },
          {
            "@category": "standard",
            "@height": "603",
            "@width": "678",
            "@_fa": "true",
            "$": "https://api.elsevier.com/content/object/eid/1-s2.0-S0926860X2500393X-gr5.jpg?httpAccept=%2A%2F%2A",
            "@multimediatype": "JPEG image file",
            "@type": "IMAGE-DOWNSAMPLED",
            "@size": "76490",
            "@ref": "gr5",
            "@mimetype": "image/jpeg"
          },
          {
            "@category": "standard",
            "@height": "340",
            "@width": "395",
            "@_fa": "true",
            "$": "https://api.elsevier.com/content/object/eid/1-s2.0-S0926860X2500393X-gr6.jpg?httpAccept=%2A%2F%2A",
            "@multimediatype": "JPEG image file",
            "@type": "IMAGE-DOWNSAMPLED",
            "@size": "28309",
            "@ref": "gr6",
            "@mimetype": "image/jpeg"
          },
          {
            "@category": "standard",
            "@height": "395",
            "@width": "563",
            "@_fa": "true",
            "$": "https://api.elsevier.com/content/object/eid/1-s2.0-S0926860X2500393X-sc1.jpg?httpAccept=%2A%2F%2A",
            "@multimediatype": "JPEG image file",
            "@type": "IMAGE-DOWNSAMPLED",
            "@size": "36649",
            "@ref": "sc1",
            "@mimetype": "image/jpeg"
          },
          {
            "@category": "standard",
            "@height": "367",
            "@width": "678",
            "@_fa": "true",
            "$": "https://api.elsevier.com/content/object/eid/1-s2.0-S0926860X2500393X-fx1.jpg?httpAccept=%2A%2F%2A",
            "@multimediatype": "JPEG image file",
            "@type": "IMAGE-DOWNSAMPLED",
            "@size": "30409",
            "@ref": "fx1",
            "@mimetype": "image/jpeg"
          },
          {
            "@category": "standard",
            "@height": "200",
            "@width": "372",
            "@_fa": "true",
            "$": "https://api.elsevier.com/content/object/eid/1-s2.0-S0926860X2500393X-ga1.jpg?httpAccept=%2A%2F%2A",
            "@multimediatype": "JPEG image file",
            "@type": "IMAGE-DOWNSAMPLED",
            "@size": "20930",
            "@ref": "ga1",
            "@mimetype": "image/jpeg"
          },
          {
            "@category": "thumbnail",
            "@height": "92",
            "@width": "219",
            "@_fa": "true",
            "$": "https://api.elsevier.com/content/object/eid/1-s2.0-S0926860X2500393X-gr9.sml?httpAccept=%2A%2F%2A",
            "@multimediatype": "GIF image file",
            "@type": "IMAGE-THUMBNAIL",
            "@size": "7399",
            "@ref": "gr9",
            "@mimetype": "image/gif"
          },
          {
            "@category": "thumbnail",
            "@height": "164",
            "@width": "183",
            "@_fa": "true",
            "$": "https://api.elsevier.com/content/object/eid/1-s2.0-S0926860X2500393X-gr3.sml?httpAccept=%2A%2F%2A",
            "@multimediatype": "GIF image file",
            "@type": "IMAGE-THUMBNAIL",
            "@size": "9961",
            "@ref": "gr3",
            "@mimetype": "image/gif"
          },
          {
            "@category": "thumbnail",
            "@height": "97",
            "@width": "219",
            "@_fa": "true",
            "$": "https://api.elsevier.com/content/object/eid/1-s2.0-S0926860X2500393X-gr4.sml?httpAccept=%2A%2F%2A",
            "@multimediatype": "GIF image file",
            "@type": "IMAGE-THUMBNAIL",
            "@size": "3998",
            "@ref": "gr4",
            "@mimetype": "image/gif"
          },
          {
            "@category": "thumbnail",
            "@height": "99",
            "@width": "219",
            "@_fa": "true",
            "$": "https://api.elsevier.com/content/object/eid/1-s2.0-S0926860X2500393X-gr1.sml?httpAccept=%2A%2F%2A",
            "@multimediatype": "GIF image file",
            "@type": "IMAGE-THUMBNAIL",
            "@size": "6855",
            "@ref": "gr1",
            "@mimetype": "image/gif"
          },
          {
            "@category": "thumbnail",
            "@height": "117",
            "@width": "219",
            "@_fa": "true",
            "$": "https://api.elsevier.com/content/object/eid/1-s2.0-S0926860X2500393X-gr2.sml?httpAccept=%2A%2F%2A",
            "@multimediatype": "GIF image file",
            "@type": "IMAGE-THUMBNAIL",
            "@size": "21330",
            "@ref": "gr2",
            "@mimetype": "image/gif"
          },
          {
            "@category": "thumbnail",
            "@height": "164",
            "@width": "197",
            "@_fa": "true",
            "$": "https://api.elsevier.com/content/object/eid/1-s2.0-S0926860X2500393X-gr7.sml?httpAccept=%2A%2F%2A",
            "@multimediatype": "GIF image file",
            "@type": "IMAGE-THUMBNAIL",
            "@size": "10464",
            "@ref": "gr7",
            "@mimetype": "image/gif"
          },
          {
            "@category": "thumbnail",
            "@height": "164",
            "@width": "186",
            "@_fa": "true",
            "$": "https://api.elsevier.com/content/object/eid/1-s2.0-S0926860X2500393X-gr8.sml?httpAccept=%2A%2F%2A",
            "@multimediatype": "GIF image file",
            "@type": "IMAGE-THUMBNAIL",
            "@size": "10413",
            "@ref": "gr8",
            "@mimetype": "image/gif"
          },
          {
            "@category": "thumbnail",
            "@height": "164",
            "@width": "184",
            "@_fa": "true",
            "$": "https://api.elsevier.com/content/object/eid/1-s2.0-S0926860X2500393X-gr5.sml?httpAccept=%2A%2F%2A",
            "@multimediatype": "GIF image file",
            "@type": "IMAGE-THUMBNAIL",
            "@size": "6309",
            "@ref": "gr5",
            "@mimetype": "image/gif"
          },
          {
            "@category": "thumbnail",
            "@height": "164",
            "@width": "190",
            "@_fa": "true",
            "$": "https://api.elsevier.com/content/object/eid/1-s2.0-S0926860X2500393X-gr6.sml?httpAccept=%2A%2F%2A",
            "@multimediatype": "GIF image file",
            "@type": "IMAGE-THUMBNAIL",
            "@size": "12752",
            "@ref": "gr6",
            "@mimetype": "image/gif"
          },
          {
            "@category": "thumbnail",
            "@height": "154",
            "@width": "219",
            "@_fa": "true",
            "$": "https://api.elsevier.com/content/object/eid/1-s2.0-S0926860X2500393X-sc1.sml?httpAccept=%2A%2F%2A",
            "@multimediatype": "GIF image file",
            "@type": "IMAGE-THUMBNAIL",
            "@size": "10059",
            "@ref": "sc1",
            "@mimetype": "image/gif"
          },
          {
            "@category": "thumbnail",
            "@height": "118",
            "@width": "219",
            "@_fa": "true",
            "$": "https://api.elsevier.com/content/object/eid/1-s2.0-S0926860X2500393X-fx1.sml?httpAccept=%2A%2F%2A",
            "@multimediatype": "GIF image file",
            "@type": "IMAGE-THUMBNAIL",
            "@size": "3750",
            "@ref": "fx1",
            "@mimetype": "image/gif"
          },
          {
            "@category": "thumbnail",
            "@height": "118",
            "@width": "219",
            "@_fa": "true",
            "$": "https://api.elsevier.com/content/object/eid/1-s2.0-S0926860X2500393X-ga1.sml?httpAccept=%2A%2F%2A",
            "@multimediatype": "GIF image file",
            "@type": "IMAGE-THUMBNAIL",
            "@size": "9845",
            "@ref": "ga1",
            "@mimetype": "image/gif"
          },
          {
            "@category": "high",
            "@height": "1261",
            "@width": "2994",
            "@_fa": "true",
            "$": "https://api.elsevier.com/content/object/eid/1-s2.0-S0926860X2500393X-gr9_lrg.jpg?httpAccept=%2A%2F%2A",
            "@multimediatype": "JPEG image file",
            "@type": "IMAGE-HIGH-RES",
            "@size": "172938",
            "@ref": "gr9",
            "@mimetype": "image/jpeg"
          },
          {
            "@category": "high",
            "@height": "2661",
            "@width": "2966",
            "@_fa": "true",
            "$": "https://api.elsevier.com/content/object/eid/1-s2.0-S0926860X2500393X-gr3_lrg.jpg?httpAccept=%2A%2F%2A",
            "@multimediatype": "JPEG image file",
            "@type": "IMAGE-HIGH-RES",
            "@size": "445143",
            "@ref": "gr3",
            "@mimetype": "image/jpeg"
          },
          {
            "@category": "high",
            "@height": "1108",
            "@width": "2495",
            "@_fa": "true",
            "$": "https://api.elsevier.com/content/object/eid/1-s2.0-S0926860X2500393X-gr4_lrg.jpg?httpAccept=%2A%2F%2A",
            "@multimediatype": "JPEG image file",
            "@type": "IMAGE-HIGH-RES",
            "@size": "132955",
            "@ref": "gr4",
            "@mimetype": "image/jpeg"
          },
          {
            "@category": "high",
            "@height": "1351",
            "@width": "2994",
            "@_fa": "true",
            "$": "https://api.elsevier.com/content/object/eid/1-s2.0-S0926860X2500393X-gr1_lrg.jpg?httpAccept=%2A%2F%2A",
            "@multimediatype": "JPEG image file",
            "@type": "IMAGE-HIGH-RES",
            "@size": "344416",
            "@ref": "gr1",
            "@mimetype": "image/jpeg"
          },
          {
            "@category": "high",
            "@height": "1597",
            "@width": "2994",
            "@_fa": "true",
            "$": "https://api.elsevier.com/content/object/eid/1-s2.0-S0926860X2500393X-gr2_lrg.jpg?httpAccept=%2A%2F%2A",
            "@multimediatype": "JPEG image file",
            "@type": "IMAGE-HIGH-RES",
            "@size": "678536",
            "@ref": "gr2",
            "@mimetype": "image/jpeg"
          },
          {
            "@category": "high",
            "@height": "1450",
            "@width": "1746",
            "@_fa": "true",
            "$": "https://api.elsevier.com/content/object/eid/1-s2.0-S0926860X2500393X-gr7_lrg.jpg?httpAccept=%2A%2F%2A",
            "@multimediatype": "JPEG image file",
            "@type": "IMAGE-HIGH-RES",
            "@size": "105034",
            "@ref": "gr7",
            "@mimetype": "image/jpeg"
          },
          {
            "@category": "high",
            "@height": "2637",
            "@width": "2994",
            "@_fa": "true",
            "$": "https://api.elsevier.com/content/object/eid/1-s2.0-S0926860X2500393X-gr8_lrg.jpg?httpAccept=%2A%2F%2A",
            "@multimediatype": "JPEG image file",
            "@type": "IMAGE-HIGH-RES",
            "@size": "392681",
            "@ref": "gr8",
            "@mimetype": "image/jpeg"
          },
          {
            "@category": "high",
            "@height": "2663",
            "@width": "2994",
            "@_fa": "true",
            "$": "https://api.elsevier.com/content/object/eid/1-s2.0-S0926860X2500393X-gr5_lrg.jpg?httpAccept=%2A%2F%2A",
            "@multimediatype": "JPEG image file",
            "@type": "IMAGE-HIGH-RES",
            "@size": "459545",
            "@ref": "gr5",
            "@mimetype": "image/jpeg"
          },
          {
            "@category": "high",
            "@height": "1504",
            "@width": "1746",
            "@_fa": "true",
            "$": "https://api.elsevier.com/content/object/eid/1-s2.0-S0926860X2500393X-gr6_lrg.jpg?httpAccept=%2A%2F%2A",
            "@multimediatype": "JPEG image file",
            "@type": "IMAGE-HIGH-RES",
            "@size": "146675",
            "@ref": "gr6",
            "@mimetype": "image/jpeg"
          },
          {
            "@category": "high",
            "@height": "1749",
            "@width": "2492",
            "@_fa": "true",
            "$": "https://api.elsevier.com/content/object/eid/1-s2.0-S0926860X2500393X-sc1_lrg.jpg?httpAccept=%2A%2F%2A",
            "@multimediatype": "JPEG image file",
            "@type": "IMAGE-HIGH-RES",
            "@size": "196532",
            "@ref": "sc1",
            "@mimetype": "image/jpeg"
          },
          {
            "@category": "high",
            "@height": "1619",
            "@width": "2994",
            "@_fa": "true",
            "$": "https://api.elsevier.com/content/object/eid/1-s2.0-S0926860X2500393X-fx1_lrg.jpg?httpAccept=%2A%2F%2A",
            "@multimediatype": "JPEG image file",
            "@type": "IMAGE-HIGH-RES",
            "@size": "186444",
            "@ref": "fx1",
            "@mimetype": "image/jpeg"
          },
          {
            "@category": "high",
            "@height": "886",
            "@width": "1649",
            "@_fa": "true",
            "$": "https://api.elsevier.com/content/object/eid/1-s2.0-S0926860X2500393X-ga1_lrg.jpg?httpAccept=%2A%2F%2A",
            "@multimediatype": "JPEG image file",
            "@type": "IMAGE-HIGH-RES",
            "@size": "152004",
            "@ref": "ga1",
            "@mimetype": "image/jpeg"
          },
          {
            "@category": "standard",
            "@_fa": "true",
            "$": "https://api.elsevier.com/content/object/eid/1-s2.0-S0926860X2500393X-mmc1.doc?httpAccept=%2A%2F%2A",
            "@multimediatype": "Microsoft Word file",
            "@type": "APPLICATION",
            "@size": "296960",
            "@ref": "mmc1",
            "@mimetype": "application/word"
          },
          {
            "@category": "thumbnail",
            "@_fa": "true",
            "$": "https://api.elsevier.com/content/object/eid/1-s2.0-S0926860X2500393X-si0001.svg?httpAccept=%2A%2F%2A",
            "@multimediatype": "Scalable Vector Graphics file",
            "@type": "ALTIMG",
            "@size": "4943",
            "@ref": "si0001",
            "@mimetype": "image/svg+xml"
          },
          {
            "@category": "thumbnail",
            "@_fa": "true",
            "$": "https://api.elsevier.com/content/object/eid/1-s2.0-S0926860X2500393X-si0002.svg?httpAccept=%2A%2F%2A",
            "@multimediatype": "Scalable Vector Graphics file",
            "@type": "ALTIMG",
            "@size": "5077",
            "@ref": "si0002",
            "@mimetype": "image/svg+xml"
          }
        ]
      },
      "link": {
        "@rel": "abstract",
        "@href": "https://api.elsevier.com/content/abstract/scopus_id/105012290648"
      }
    }
  }
}