{
  "metadata": {
    "title": "Ligand-free Suzuki coupling reaction with highly recyclable ionic palladium catalyst, Ti<ce:inf loc=post>1-x</ce:inf>Pd<ce:inf loc=post>x</ce:inf>O<ce:inf loc=post>2-x</ce:inf> (x = 0.03)",
    "authors": "; ; ",
    "journal": "Applied Catalysis A: General",
    "date": "2020-04-25",
    "doi": "10.1016/j.apcata.2020.117516",
    "abstract": "",
    "uri": "https://api.elsevier.com/content/article/pii/S0926860X20301095",
    "pii": "S0926860X20301095"
  },
  "fulltext": {
    "full-text-retrieval-response": {
      "scopus-eid": "2-s2.0-85081691961",
      "originalText": "serial JL 271346 291210 291744 291809 31 Applied Catalysis A: General APPLIEDCATALYSISAGENERAL 2020-03-18 2020-03-18 2020-03-18 2020-03-18 2020-04-24T12:53:46 1-s2.0-S0926860X20301095 S0926-860X(20)30109-5 S0926860X20301095 10.1016/j.apcata.2020.117516 S300 S300.2 FULL-TEXT 1-s2.0-S0926860X20X00068 2024-01-01T12:33:10.553292Z 0 0 20200425 2020 2020-03-19T00:05:16.851878Z absattachment articleinfo articlenumber articletitlenorm authfirstinitialnorm authfirstsurnamenorm cid cids contenttype copyright crossmark dateloaded dateloadedtxt datesearch datesort dateupdated dco docsubtype doctype doi eid ewtransactionid hubeid indexeddate issn issnnorm itemstage itemtransactionid itemweight openaccess openarchive pg pgfirst pii piinorm pubdatestart pubdatetxt pubyr sortorder srctitle srctitlenorm srctype ssids alllist content subj subheadings suppl tomb volfirst volissue volumelist webpdf webpdfpagecount yearnav figure table e-component body acknowledge affil appendices articletitle auth authfirstini authfull authkeywords authlast grantsponsor grantsponsorid highlightsabst orcid primabst ref specialabst 0926-860X 0926860X true 596 596 C Volume 596 3 117516 117516 117516 20200425 25 April 2020 2020-04-25 2020 article fla © 2020 Elsevier B.V. All rights reserved. LIGANDFREESUZUKICOUPLINGREACTIONHIGHLYRECYCLABLEIONICPALLADIUMCATALYSTTI1XPDXO2XX003 BHATK S 1 Introduction 2 Results and discussion 3 Substrate scope using Ti0.97Pd0.03O1.97 powder catalyst 4 Suzuki coupling reactions using catalyst coated on the monolith 5 Comparison of Ti0.97Pd0.03O1.97 catalyst with other palladium catalysts 6 Scale-up reaction 7 Recycling of the catalyst coated on the monolith 8 Synthetic application 9 Experimental 9.1 Synthesis of Ti0.97Pd0.03O1.97 9.2 Procedure for coating of the catalyst over the monolith 9.3 Typical experimental procedure for the palladium-catalyzed suzuki cross-coupling reaction in water 10 Conclusions Declaration of Competing Interest CRediT authorship contribution statement Acknowledgment Appendix A Supplementary data References YU 2016 6956 6959 C LEE 2016 549 554 C MARKHAM 1997 299 311 A CAPDEVILLE 2002 493 502 R MIYAURA 1995 2457 2483 N HASSAN 2002 1359 1469 J LIGHTOWLER 2005 5538 5549 S MIYAURA 1979 3437 3440 N ZHAN 2003 1963 1969 X DONGA 2017 106 114 Y YUE 2017 666 669 G TIAN 2017 18 25 L LIRON 2007 2220 2223 F GURAM 2007 5104 5112 A KANTCHEV 2007 2768 2813 E ALTENHOFF 2004 15195 15201 G HERRMANN 2001 616 628 W GONG 2005 3963 3969 J CHEN 2005 1075 1081 C MUBOFU 2001 23 25 E LI 2007 4067 4072 S YIN 2007 133 173 L YUAN 2010 4054 4058 B PAUL 2003 635 638 S MONOPOLI 2010 4511 4525 A DURAPA 2010 339 344 F BHATTACHARYA 2005 3557 3560 S HOFFMANN 2015 3844 3857 I CASALNUOVO 1990 4324 4330 A SHIMIZU 2004 202 209 K LUSSIER 2014 46218 46223 T HERVE 2014 46926 46929 G HERVE 2014 18558 18594 G GALLAGHERDUVAL 2013 1989 1995 S FIHRI 2011 3116 3121 A PEREZLORENZO 2012 167 174 M MANDALI 2013 16 20 P MUKRI 2012 4491 4502 B HEGDE 2009 704 712 M ROY 2007 5798 5802 S SHARMA 2009 637 S ROY 2007 8153 S SHARMA 2006 69 S YAMADA 2002 3371 3374 Y KIM 2017 3336 3343 J ZAPF 2000 4153 4155 A WANG 2005 153 158 G FRINGUELLI 2006 5741 5744 F BHATKX2020X117516 BHATKX2020X117516XS 2022-03-18T00:00:00.000Z 2022-03-18T00:00:00.000Z http://creativecommons.org/licenses/by-nc-nd/4.0/ © 2020 Elsevier B.V. All rights reserved. 2020-03-10T05:20:58.598Z http://vtw.elsevier.com/data/voc/AddOnTypes/50.7/eoas IISc Indian Institute of Science http://data.elsevier.com/vocabulary/SciValFunders/100007780 http://sws.geonames.org/1269750 CSIR Council of Scientific and Industrial Research, India http://data.elsevier.com/vocabulary/SciValFunders/501100001412 http://sws.geonames.org/1269750 SERB Science and Engineering Research Board http://data.elsevier.com/vocabulary/SciValFunders/501100001843 http://sws.geonames.org/1269750 item S0926-860X(20)30109-5 S0926860X20301095 1-s2.0-S0926860X20301095 10.1016/j.apcata.2020.117516 271346 2024-01-01T12:33:10.553292Z 2020-04-25 1-s2.0-S0926860X20301095-main.pdf https://s3-eu-west-1.amazonaws.com/prod-ucs-content-store-eu-west/content/pii:S0926860X20301095/MAIN/application/pdf/d18fd40660296c7a7509d25c762db799/main.pdf main.pdf pdf true 2368334 MAIN 7 1-s2.0-S0926860X20301095-main_1.png https://s3-eu-west-1.amazonaws.com/prod-ucs-content-store-eu-west/content/pii:S0926860X20301095/PREVIEW/image/png/fc632037ad427367e0fce724150b7bf3/main_1.png main_1.png png 55684 849 656 IMAGE-WEB-PDF 1 1-s2.0-S0926860X20301095-fx2.jpg https://s3-eu-west-1.amazonaws.com/prod-ucs-content-store-eu-west/content/pii:S0926860X20301095/fx2/DOWNSAMPLED/image/jpeg/8b6585b259a7e778b6b315ae2e774da3/fx2.jpg fx2 fx2.jpg jpg 57471 543 423 IMAGE-DOWNSAMPLED 1-s2.0-S0926860X20301095-sc1.jpg https://s3-eu-west-1.amazonaws.com/prod-ucs-content-store-eu-west/content/pii:S0926860X20301095/sc1/DOWNSAMPLED/image/jpeg/b019085213d32e828d2ea8adf70d21cd/sc1.jpg sc1 sc1.jpg jpg 7894 73 393 IMAGE-DOWNSAMPLED 1-s2.0-S0926860X20301095-fx3.jpg https://s3-eu-west-1.amazonaws.com/prod-ucs-content-store-eu-west/content/pii:S0926860X20301095/fx3/DOWNSAMPLED/image/jpeg/61a0ad249da627f4b3651f38f51065e7/fx3.jpg fx3 fx3.jpg jpg 21503 198 415 IMAGE-DOWNSAMPLED 1-s2.0-S0926860X20301095-fx1.jpg https://s3-eu-west-1.amazonaws.com/prod-ucs-content-store-eu-west/content/pii:S0926860X20301095/fx1/DOWNSAMPLED/image/jpeg/52907167702e75cec5a23d17f393b554/fx1.jpg fx1 fx1.jpg jpg 7649 55 377 IMAGE-DOWNSAMPLED 1-s2.0-S0926860X20301095-sc2.jpg https://s3-eu-west-1.amazonaws.com/prod-ucs-content-store-eu-west/content/pii:S0926860X20301095/sc2/DOWNSAMPLED/image/jpeg/ae43fe1b55a54913d1b832fb1ef28516/sc2.jpg sc2 sc2.jpg jpg 23354 207 489 IMAGE-DOWNSAMPLED 1-s2.0-S0926860X20301095-fx4.jpg https://s3-eu-west-1.amazonaws.com/prod-ucs-content-store-eu-west/content/pii:S0926860X20301095/fx4/DOWNSAMPLED/image/jpeg/888e7ffc3aa78e8b822b82855c08b8e7/fx4.jpg fx4 fx4.jpg jpg 6630 52 354 IMAGE-DOWNSAMPLED 1-s2.0-S0926860X20301095-sc3.jpg https://s3-eu-west-1.amazonaws.com/prod-ucs-content-store-eu-west/content/pii:S0926860X20301095/sc3/DOWNSAMPLED/image/jpeg/06cfdc7925686ff11de303f8b17812d9/sc3.jpg sc3 sc3.jpg jpg 14617 108 510 IMAGE-DOWNSAMPLED 1-s2.0-S0926860X20301095-fx5.jpg https://s3-eu-west-1.amazonaws.com/prod-ucs-content-store-eu-west/content/pii:S0926860X20301095/fx5/DOWNSAMPLED/image/jpeg/714572ac88851654f64b0a68e134ddfd/fx5.jpg fx5 fx5.jpg jpg 13627 131 415 IMAGE-DOWNSAMPLED 1-s2.0-S0926860X20301095-gr1.jpg https://s3-eu-west-1.amazonaws.com/prod-ucs-content-store-eu-west/content/pii:S0926860X20301095/gr1/DOWNSAMPLED/image/jpeg/b1cab24d77e141b26036674bca7770b8/gr1.jpg gr1 gr1.jpg jpg 15925 218 376 IMAGE-DOWNSAMPLED 1-s2.0-S0926860X20301095-gr2.jpg https://s3-eu-west-1.amazonaws.com/prod-ucs-content-store-eu-west/content/pii:S0926860X20301095/gr2/DOWNSAMPLED/image/jpeg/e7840c131d04df3ccfba2b6eef6f410c/gr2.jpg gr2 gr2.jpg jpg 16823 322 376 IMAGE-DOWNSAMPLED 1-s2.0-S0926860X20301095-ga1.jpg https://s3-eu-west-1.amazonaws.com/prod-ucs-content-store-eu-west/content/pii:S0926860X20301095/ga1/DOWNSAMPLED/image/jpeg/6acff81d0da8316bb6e18cba1fbbe8fc/ga1.jpg ga1 true ga1.jpg jpg 21571 145 500 IMAGE-DOWNSAMPLED 1-s2.0-S0926860X20301095-fx2.sml https://s3-eu-west-1.amazonaws.com/prod-ucs-content-store-eu-west/content/pii:S0926860X20301095/fx2/THUMBNAIL/image/gif/23c332be7ef3f7890a6d50568a398596/fx2.sml fx2 fx2.sml sml 5497 163 127 IMAGE-THUMBNAIL 1-s2.0-S0926860X20301095-sc1.sml https://s3-eu-west-1.amazonaws.com/prod-ucs-content-store-eu-west/content/pii:S0926860X20301095/sc1/THUMBNAIL/image/gif/bdd9f3a6c06e811cd54080ce04ed812c/sc1.sml sc1 sc1.sml sml 2597 41 219 IMAGE-THUMBNAIL 1-s2.0-S0926860X20301095-fx3.sml https://s3-eu-west-1.amazonaws.com/prod-ucs-content-store-eu-west/content/pii:S0926860X20301095/fx3/THUMBNAIL/image/gif/46bc6cf6bf0e1e1efe120df06904b4b5/fx3.sml fx3 fx3.sml sml 4714 104 219 IMAGE-THUMBNAIL 1-s2.0-S0926860X20301095-fx1.sml https://s3-eu-west-1.amazonaws.com/prod-ucs-content-store-eu-west/content/pii:S0926860X20301095/fx1/THUMBNAIL/image/gif/51fd3c4d60627d9b2e054f85df8bc65f/fx1.sml fx1 fx1.sml sml 2559 32 219 IMAGE-THUMBNAIL 1-s2.0-S0926860X20301095-sc2.sml https://s3-eu-west-1.amazonaws.com/prod-ucs-content-store-eu-west/content/pii:S0926860X20301095/sc2/THUMBNAIL/image/gif/019468f5a7c2647e14bf32089d796fad/sc2.sml sc2 sc2.sml sml 4379 93 219 IMAGE-THUMBNAIL 1-s2.0-S0926860X20301095-fx4.sml https://s3-eu-west-1.amazonaws.com/prod-ucs-content-store-eu-west/content/pii:S0926860X20301095/fx4/THUMBNAIL/image/gif/db6c8e294f569ac5a6ae6b7f9f77c0f4/fx4.sml fx4 fx4.sml sml 2373 32 219 IMAGE-THUMBNAIL 1-s2.0-S0926860X20301095-sc3.sml https://s3-eu-west-1.amazonaws.com/prod-ucs-content-store-eu-west/content/pii:S0926860X20301095/sc3/THUMBNAIL/image/gif/2118df075fc34451fe6d49cc3b82f43c/sc3.sml sc3 sc3.sml sml 2502 46 219 IMAGE-THUMBNAIL 1-s2.0-S0926860X20301095-fx5.sml https://s3-eu-west-1.amazonaws.com/prod-ucs-content-store-eu-west/content/pii:S0926860X20301095/fx5/THUMBNAIL/image/gif/420802d3c42f513325e86840705aa961/fx5.sml fx5 fx5.sml sml 3392 69 219 IMAGE-THUMBNAIL 1-s2.0-S0926860X20301095-gr1.sml https://s3-eu-west-1.amazonaws.com/prod-ucs-content-store-eu-west/content/pii:S0926860X20301095/gr1/THUMBNAIL/image/gif/e480a7612837c3032991891d71e49195/gr1.sml gr1 gr1.sml sml 7074 127 219 IMAGE-THUMBNAIL 1-s2.0-S0926860X20301095-gr2.sml https://s3-eu-west-1.amazonaws.com/prod-ucs-content-store-eu-west/content/pii:S0926860X20301095/gr2/THUMBNAIL/image/gif/c7abf35f6e80efbaf2ae15b8ce2454aa/gr2.sml gr2 gr2.sml sml 7006 164 192 IMAGE-THUMBNAIL 1-s2.0-S0926860X20301095-ga1.sml https://s3-eu-west-1.amazonaws.com/prod-ucs-content-store-eu-west/content/pii:S0926860X20301095/ga1/THUMBNAIL/image/gif/7ede8fbdb608a178b7079e13069eb36b/ga1.sml ga1 true ga1.sml sml 4772 64 219 IMAGE-THUMBNAIL 1-s2.0-S0926860X20301095-fx2_lrg.jpg https://s3-eu-west-1.amazonaws.com/prod-ucs-content-store-eu-west/content/pii:S0926860X20301095/fx2/HIGHRES/image/jpeg/8e9704c9601e2db4ff9cf56618f176c1/fx2_lrg.jpg fx2 fx2_lrg.jpg jpg 443311 2405 1873 IMAGE-HIGH-RES 1-s2.0-S0926860X20301095-sc1_lrg.jpg https://s3-eu-west-1.amazonaws.com/prod-ucs-content-store-eu-west/content/pii:S0926860X20301095/sc1/HIGHRES/image/jpeg/916bf8963a51d5c6cb1795618f5eb32b/sc1_lrg.jpg sc1 sc1_lrg.jpg jpg 55826 324 1742 IMAGE-HIGH-RES 1-s2.0-S0926860X20301095-fx3_lrg.jpg https://s3-eu-west-1.amazonaws.com/prod-ucs-content-store-eu-west/content/pii:S0926860X20301095/fx3/HIGHRES/image/jpeg/92b6c119326eaacf198bb1722fb60eda/fx3_lrg.jpg fx3 fx3_lrg.jpg jpg 154627 875 1837 IMAGE-HIGH-RES 1-s2.0-S0926860X20301095-fx1_lrg.jpg https://s3-eu-west-1.amazonaws.com/prod-ucs-content-store-eu-west/content/pii:S0926860X20301095/fx1/HIGHRES/image/jpeg/6ed46f8d1a3f0811c8e74a164a8c5032/fx1_lrg.jpg fx1 fx1_lrg.jpg jpg 57903 246 1672 IMAGE-HIGH-RES 1-s2.0-S0926860X20301095-sc2_lrg.jpg https://s3-eu-west-1.amazonaws.com/prod-ucs-content-store-eu-west/content/pii:S0926860X20301095/sc2/HIGHRES/image/jpeg/313c76788fae9ca473298e98ac3d55ca/sc2_lrg.jpg sc2 sc2_lrg.jpg jpg 173797 916 2167 IMAGE-HIGH-RES 1-s2.0-S0926860X20301095-fx4_lrg.jpg https://s3-eu-west-1.amazonaws.com/prod-ucs-content-store-eu-west/content/pii:S0926860X20301095/fx4/HIGHRES/image/jpeg/9efa6753da79d94afcbd3ad519c83e9a/fx4_lrg.jpg fx4 fx4_lrg.jpg jpg 47157 231 1569 IMAGE-HIGH-RES 1-s2.0-S0926860X20301095-sc3_lrg.jpg https://s3-eu-west-1.amazonaws.com/prod-ucs-content-store-eu-west/content/pii:S0926860X20301095/sc3/HIGHRES/image/jpeg/7ee99322430121930520be4809b9ffa3/sc3_lrg.jpg sc3 sc3_lrg.jpg jpg 110811 477 2258 IMAGE-HIGH-RES 1-s2.0-S0926860X20301095-fx5_lrg.jpg https://s3-eu-west-1.amazonaws.com/prod-ucs-content-store-eu-west/content/pii:S0926860X20301095/fx5/HIGHRES/image/jpeg/da2ee68f60ec18f53e6c798a05a20f78/fx5_lrg.jpg fx5 fx5_lrg.jpg jpg 101948 578 1837 IMAGE-HIGH-RES 1-s2.0-S0926860X20301095-gr1_lrg.jpg https://s3-eu-west-1.amazonaws.com/prod-ucs-content-store-eu-west/content/pii:S0926860X20301095/gr1/HIGHRES/image/jpeg/7a1fe82b6a542e94bc6670f831c4dc24/gr1_lrg.jpg gr1 gr1_lrg.jpg jpg 149133 966 1667 IMAGE-HIGH-RES 1-s2.0-S0926860X20301095-gr2_lrg.jpg https://s3-eu-west-1.amazonaws.com/prod-ucs-content-store-eu-west/content/pii:S0926860X20301095/gr2/HIGHRES/image/jpeg/d54edf66869a02b2ac59448215461cba/gr2_lrg.jpg gr2 gr2_lrg.jpg jpg 122883 1426 1667 IMAGE-HIGH-RES 1-s2.0-S0926860X20301095-ga1_lrg.jpg https://s3-eu-west-1.amazonaws.com/prod-ucs-content-store-eu-west/content/pii:S0926860X20301095/ga1/HIGHRES/image/jpeg/17bdb6782ea3236161433c9658a96e02/ga1_lrg.jpg ga1 true ga1_lrg.jpg jpg 168225 642 2213 IMAGE-HIGH-RES 1-s2.0-S0926860X20301095-mmc1.doc https://s3-eu-west-1.amazonaws.com/prod-ucs-content-store-eu-west/content/pii:S0926860X20301095/mmc1/MAIN/application/msword/7eb0e151cee914e22b4c1eee17fccb03/mmc1.doc mmc1 mmc1.doc doc 5095936 APPLICATION 1-s2.0-S0926860X20301095-am.pdf am am.pdf pdf 399970 AAM-PDF https://s3-eu-west-1.amazonaws.com/prod-ucs-content-store-eu-west/content/egi:10P54DT9TC5/MAIN/application/pdf/53fc909d7ffa63447121237669e47786/am.pdf APCATA 117516 117516 S0926-860X(20)30109-5 10.1016/j.apcata.2020.117516 Elsevier B.V. Fig. 1 Rietveld refinement of the XRD profile of freshly prepared catalyst. Fig. 1 Fig. 2 Recycling the catalyst coated on the monolith. Reaction conditions: 4-Iodoanisole (1 equiv. 300 mg), phenylboronic acid (2 equiv.), K2CO3 (2 equiv.), Ti0.97Pd0.03O1.97 coated on monolith (30 mg), H2O (6 mL), 100 °C, 6 h, all products are isolated yield. Fig. 2 Scheme 1 Suzuki-Miyaura-Coupling Reaction. Scheme 1 Scheme 2 Scale-up reactions a,b . a Reaction conditions: Aryl halide (1 equiv.), phenylboronic acid (2 equiv.), K2CO3 (2 equiv.), Ti0.97Pd0.03O1.97 (10 wt percent), H2O, 100 °C, 6 h. b Isolated yield Scheme 2 Scheme 3 Synthetic application a,b . a Reaction conditions: 1-Iodo-4-methylbenzene (0.68 mmol, 150 mg), 2-cyanophenylboronic acid (1.38 mmol, 202.04 mg), Ti0.97Pd0.03O1.97 (nanoparticles; 10 wt %, 15 mg), K2CO3 (1.38 mmol, 190 mg) and water 6 ml (solvent) was stirred at 100 °C for 6 h. b isolated yield. Scheme 3 Table 1 Optimization studiesa. Table 1 entry catalyst (wt %) base solvent temp (°C) time (h) yield (%) 1 10 K2CO3 H2O 100 15 92 2 10 K2CO3 H2O 100 6 93 3 10 K2CO3 H2O 70 6 68 4 10 K2CO3 DMF/H2O (3:1) 100 6 72 5 10 none H2O 100 20 n.r 6 10 Cs2CO3 H2O 100 6 87 7 20 K2CO3 H2O 100 6 88 8 5 K2CO3 H2O 100 6 85 9 10 K2CO3 H2O 100 3 74 10 10 K2CO3 H2O 100 6 81 b Reaction conditions: 4-Iodoanisole (1c, 0.4 mmol, 1 equiv.), phenylboronic acid (2a, 0.8 mmol, 2 equiv.), K2CO3 (0.8 mmol, 2 equiv.), 10 wt% of Pd catalyst (3.02 μg of Pd2+ ion), 2 ml of water. b Phenylboronic acid (2a,1.5 equiv.). All are isolated yield, n.r = no reaction. Table 2 Substrate scope using Ti0.97Pd0.03O1.97 powder catalyst. Table 2 Reaction conditions: Aryl halides (0.4 mmol), arylboronic acid (0.8 mmol), K2CO3 (0.8 mmol), Ti0.97Pd0.03O1.97 (10 wt percentage), H2O (2 mL), 100 °C, 6 h, the values presented in the parenthesis are isolated yields. Table 3 Suzuki coupling reactions using catalyst coated on the monolith. Table 3 Reaction conditions: Aryl halides (1 equiv., 300 mg), phenylboronic acid (2 equiv.), K2CO3 (2 equiv.), Ti0.97Pd0.03O1.97 coated on monolith (30 mg), H2O (6 mL), 100 °C, 6 h, the values presented in the parenthesis are isolated yields. Table 4 Comparison Ti0.97Pd0.03O1.97 catalyst with other palladium catalysts a . Table 4 entry Pd-catalyst percentage of Pd yield (%) TOF (h−1) 1 Pd2(dba)3 21.5 60 4.6 2 Pd(OAc)2 45.9 – 48.4 70 2.48 3 Pd(PPh3)4 9 10 1.85 4 PdCl2(dppf) 53.62 – 58.04 65 1.67 5 PdCl2(PPh3)2 14 n.r. – 6 Ti0.97Pd0.03O1.97 3 74 14 7 Ti0.97Pd0.03O1.97 3 99 b 18 b a Reaction conditions: 0.4 mmol of 4-iodoanisole, 0.8 mmol of phenylboronic acid, 0.8 mmol of K2CO3, 10 mol% of Pd catalyst, 2 ml of DMF as a solvent, temperature of the reaction is 100 °C. b Water (2 mL) as a solvent. n. r. = no reaction. Table 5 Recycling of catalyst for different substrates a,b . Table 5 a Reaction conditions: Iodobenzene (300 mg, 1.47 mmol), 4-iodoanisole (300 mg, 1.28 mmol), 5-bromoindole (300 mg, 1.53 mmol), phenylboronic acid (2 equiv.), K2CO3 (2 equiv.), Ti0.97Pd0.03O1.97 (30 mg coated), H2O (6 mL), 100 °C, 6 h. b isolated yields. Ligand-free Suzuki coupling reaction with highly recyclable ionic palladium catalyst, Ti1-xPdxO2-x (x = 0.03) Shrikanth Bhat K Data curation Methodology a b Veeranjaneyulu Lanke Data curation Methodology c Jagadeesh Dasappa Prasad Writing - review & editing Supervision b * Kandikere Ramaiah Prabhu Conceptualization Formal analysis Funding acquisition Supervision Writing - review & editing c * a Talent Development Centre, Indian Institute of Science, Challakere Campus, Chitradurga, 577536, India Talent Development Centre Indian Institute of Science Challakere Campus Chitradurga 577536 India b Department of Chemistry, Mangalore University, Mangalagangotri, Mangalore, 574199, India Department of Chemistry Mangalore University Mangalagangotri Mangalore 574199 India c Department of Organic Chemistry, Indian Institute of Science, Bangalore, 560012, India Department of Organic Chemistry Indian Institute of Science Bangalore 560012 India ⁎ Corresponding authors. Graphical abstract We synthesized a recyclable palladium ionic catalyst, Ti0.97Pd0.03O1.97, using a solution combustion method (SCM), and characterized by XRD and Rietveld refinement. The synthesized Pd ionic catalyst is stable, insensitive to moisture and air, and easy to handle. The new catalyst has exhibited a phenomenal result for the Suzuki-Miyaura cross-coupling reaction with a broad substrate scope, and the reaction proceeds in an aqueous medium. The new catalyst proved beneficial and produced excellent yields irrespective of aryl halide used in the reaction (electron-rich or electron-poor or heterocyclic compounds) and shown a turnover frequency (TOF) of 14–25 h−1 for different reactions. The catalyst was coated on a cordierite monolith (Mg2Al4Si5O18), which enhanced the applicability of the catalyst, and made the handling and recycling of the catalyst very easy. Suzuki Miyaura reaction was carried out using both Pd-powder catalysts as well as the Pd-coated honeycomb, which gave almost similar results. We have demonstrated the recyclability of Pd coated cordierite monolith and shown the superiority of the catalyst over the other Pd catalysts for the Suzuki-Miyaura reaction. Keywords Suzuki miyaura reaction Palladium catalyst Pd-coated honeycomb Ligand-free conditions Aerobic conditions Arylboronic acids 1 Introduction Suzuki coupling reaction is an important tool for synthesizing biaryl compounds, that are found in many natural products [1,2], drug molecules [3,4], and advanced materials [5–7]. The palladium-catalyzed Suzuki coupling reaction is very well-known from time memorial [8], which is well exploited [9–12]. Generally, the Suzuki reactions are performed using palladium-catalyst in the presence of phosphine ligands [13,14], and N-heterocyclic carbene ligands [15–17], which proceeds through a well-known palladacycle [18–21]. Synthesizing biaryl compounds by employing heterogeneous Pd-catalysts leads to a sustainable method and offers the advantage of recovery and recyclability of the catalyst [22–26]. Suzuki coupling reaction without using ligands is advantageous [27,28], and Suzuki reaction in water or water/organic co-solvents has received a considerable attention [25–35]. Although a few methods are designed to use homogeneous catalytic conditions, the costs, conditions, and limited substrate scope limit their applications. In a large-scale synthesis, a heterogeneous method has a definite advantage in terms of their practical utility and smooth operations. Recent days, Pd nanoparticles catalyzed Suzuki Miyaura cross-coupling reactions are becoming more attractive as they offer advantages such as a high surface-to-volume ratio, ligand-free synthesis, simple workup procedure, easy separation of final products, easy recovery, and multiple recycling of the catalyst [36,37]. Dispersion of Pd on reducible oxide support on TiO2 has enhanced the catalytic activity of CO oxidation several folds at a much lower temperature compared to the same amount of Pd on Al2O3. This is due to the dispersion of Pd2+ ion in TiO2, which provides an enhanced active site for adsorption. In the catalyst, Pd-ion has been dispersed in TiO2 as Pd2+ion in stoichiometric ionic compounds of Ti1-xPdxO2-x (x = 0.01-0.03) [38,39]. In Ti1-xPdxO2-x catalytic system, Pd2+ ion, and O2− vacancies are next to each other, and Pd2+ functions as an electrophilic site, whereas O2− ion vacancy provides a nucleophilic site. Accordingly, CO has been adsorbed on Pd2+ ion, and O2 has been adsorbed on oxide ion vacancy. Using this concept, a new class of noble metal ionic catalysts are developed [38–42]. In this direction, herein, we report a synthesis of a Pd2+ ionic catalyst on TiO2 and demonstrate the utility of Pd2+ ionic catalyst for the Suzuki-Miyaura reaction (Scheme 1 ). The catalyst shows higher Suzuki-Miyaura coupling rates and a wide substrates scope compared to other Pd-ionic catalyst or Pd-metal catalyst. We performed the Suzuki-Miyaura coupling reaction with the Pd-powder catalyst as well as the Pd-coated on cordierite. The advantages of the new catalyst for the Suzuki-Miyaura coupling reaction are, (i) the catalyst is less expensive, (ii) air and moisture stable, (iii) the catalyst is coated on cordierite monolith, which is easy to handle and easy to recycle. Besides, the reaction was performed in ligand-free conditions, the reaction proceeds smoothly in an aqueous medium, and the reaction is compatible with heterocyclic molecules. 2 Results and discussion The catalyst, Ti0.97Pd0.03O1.97, which is Pd2+ ion substituted TiO2, was synthesized based on earlier reports and confirmed by XRD, XPS and EXAFS study [38]. XRD pattern and Rietveld refinement of the XRD profile of freshly prepared catalyst is shown in Fig. 1 . As confirmed by the X-ray pattern, the catalyst Ti0.97Pd0.03O1.97 is a single-phase catalyst [38]. From the X-ray pattern, the average crystallite size of the catalyst was found to be 8 ± 2 nm, which was calculated using the Scherrer formula (0.95 λ/β cosθ), wherein β is FWHM of diffraction lines of the X-ray pattern. The color of the catalyst is brown. The catalyst was coated on a cordierite monolith by solution combustion method [43]. Cordierite monolith is a ceramic material with a cylindrical structure made up of many parallel channels of square shape. The composition of cordierite monolith is Mg2Al4Si5O18. Wash coating of cordierite was performed to obtain coated cordierite with γ–Al2O3 [43]. This operation has increased the surface area of cordierite as γ–Al2O3 is one of the oxides with a high surface area. Then the catalyst, Ti1-xPdxO2-x, was coated over γ–Al2O3 to obtain a “ready to use catalyst” coated over a cordierite monolith. Having a pure catalyst in hand, we focused our attention on the applicability of the catalyst for the Suzuki-Miyaura coupling reaction. First, the screening studies were started to find optimal reaction conditions for the reaction using 4–iodoanisole (1c, 0.4 mmol, 1 equiv.) and phenylboronic acid (2a, 0.8 mmol, 2 equiv) as model substrates (Table 1 ). The optimization studies were carried out using the powder catalyst Ti0.97Pd0.03O1.97. The reaction of 1c with 2a using K2CO3 (2 equiv.) as a base, water (2 mL) as a solvent, and a powder catalyst Ti0.97Pd0.03O1.97 (10 % by weight) at 100 °C for 15 h furnished the corresponding coupled product 3c in 92 % yield (entry 1, Table 1). A similar reaction at 100 °C for 6 h afforded the product 3c in 93 % yield (entry 2, Table 1). However, the reaction at 70 °C furnished 3c in 68 % (entry 3, Table 1). Although water is a preferred solvent, as it is non-toxic, highly abundant, and environmentally benign, we conducted a reaction in DMF/H2O in 3:1 ratio (2 mL) as a solvent system at 100 °C, which furnished a slightly low yield of 3c (72 %, entry 4, Table 1), whereas the reaction in the absence of base was unsuccessful (entry 5, Table 1). Reaction using Cs2CO3 furnished 87 % of 3c (entry 6, Table 1). Increasing the catalyst loading from 10 wt% to 20 wt%, resulted in the formation of 3c in 88 % yield (entry 7, Table 1), whereas reducing the catalyst loading to 5% afforded the 85 % of 3c (entry 8, Table 1). Decreasing the reaction time to 3 h (entry 9, Table 1) or employing the phenylboronic acid in 1.5 equiv. (entry 10, Table 1) furnished the 3c in 74 and 81 % yields, respectively. The best result (entry 2, Table 1) was obtained with the use of K2CO3 (2 equiv.) as a base, 10 wt percentage of catalyst, and water (2 mL) as the solvent at 100 °C for 6 h (See the Supporting Information for the optimization studies were also performed using iodobenzene (1a) and phenyl boronic acid (2a)). 3 Substrate scope using Ti0.97Pd0.03O1.97 powder catalyst First, we explored the scope of the Suzuki reaction using Ti0.97Pd0.03O1.97 powder catalyst (Table 2 ). As can be seen, the reaction proceeded well with a variety of aryl halides and arylboronic acid derivatives. The reaction of iodobenzene with phenylboronic acid and m-tolylboronic acid was facile furnishing the corresponding biaryl derivatives 3a and 3b in 90 and 96 % yields, respectively. Similarly, the reaction of para-methoxyiodobenzene, para-methyliodobenzene, and para-fluoroiodobenzene with phenylboronic acid afforded the corresponding biaryl derivatives 3c, 3d, and 3e in 92, 83, and 96 % yields, respectively. The reaction of para-methoxyiodobenzene with (4-acetylphenyl)boronic acid was also facile, affording the product 3f in almost quantitative yield. The reaction of halo substituted arylboronic acids such as (4-fluorophenyl)boronic acid, (3-chlorophenyl)boronic acid, and (4-chlorophenyl)boronic acid proceeded smoothly furnishing the products 3 g, 3 h, and 3i in 99, 96, and 98 % yields, respectively. (4-(Methylthio)phenyl)boronic acid and (4-(tert-butyl)phenyl)boronic acid underwent a smooth Suzuki-Miyaura coupling with para-methoxyiodobenzene forming the coupled products 3 j and 3k in 76 and 98 % yields, respectively. These experiments reveal that the reactions of the substrates with the electron-withdrawing or electron-donating groups lead to the corresponding coupled products in good to excellent yields. The reaction of aryl bromides with arylboronic acids were also facile furnishing the corresponding biaryl derivatives in good to excellent yields. A few examples have been presented in Table 2. The reaction of 2-bromonaphthalene with phenylboronic acid and 1-bromonaphthalene with p-methoxy phenylboronic acid proceeded smoothly, furnishing the corresponding biaryl derivatives 3 l and 3 m in 97 and 99 % yields, respectively. The reaction of phenylboronic acid with para-bromoacetophenone and meta-bromoprophiophenone proceeded smoothly, affording the coupled products 3n and 3o in 85 and 85 % yields, respectively. Similarly, the reaction of meta-methoxybromobenzene with phenylboronic acid afforded the product 3p in 84 % yield. The reaction of bromobenzene with 3-cyanophenylboronic acid furnished coupled product 3q in 64 % yield. For broadening the scope of the reaction, the reactions were carried out with heterocyclic aromatic halides and heterocyclic aromatic boronic acids. As can be seen, the reaction of phenylboronic acid with 6-bromoindole and 5-bromoindole proceeded well and furnished the corresponding Suzuki-Miyaura coupled products 6 t and 6 u in 99 and 90 % yields, respectively. The reaction of 6-bromoindole with 3,4-methylenedioxyphenylboronic acid was also facile, providing the coupled product 6v in 98 % yield. The reactions of heterocyclic bromides, such as 3-bromopyridine with phenylboronic acid, also proceeded well furnishing the corresponding coupled products 6 w in 89 % yields. Our attempt of using alkyl halides and alkylboronic acids for the Suzuki-Miyaura coupling reactions using developed conditions were not successful. 4 Suzuki coupling reactions using catalyst coated on the monolith After successfully showcasing the utility of the catalyst (Ti0.97Pd0.03O1.97) for the Suzuki coupling reactions, we continued our expedition on the applicability of the catalytic system. From past decades, the palladium-catalyzed reactions became part of the large-scale synthesis and adopted by many industries. Having this in mind, we continued the investigation employing the catalyst coated over cordierite monolith (Table 3 ). Therefore, the reaction of bromobenzene (1 equiv.) with phenylboronic acid (2 equiv.) was performed using catalyst coated on monolith (30 mg), base K2CO3 (2 equiv.), at 100 °C for 6 h. To our delight, the reaction proceeded smoothly to afford the corresponding coupled product 3a in an 89 % yield. The advantage of this reaction is that after the reaction, the catalyst (coated over cordierite monolith) is removed from the reaction flask, washed with hexane to remove the organic phase, and washed with distilled water to remove solvent and base. After washing, the monolith is heated in a furnace for about 2 h at 300 °C, and the monolith is ready to reuse for another cycle. To demonstrate the generality of this protocol, a few more selected examples are illustrated in Table 3 by employing the same procedure. Thus, the reaction of para-methylbromobenzene and 4-bromo acetophenone with phenylboronic acid proceeded very well to afford the coupled products 3b and 3n in 93 and 90 % yields, respectively. Similarly, the reaction of 6-bromoindole with phenylboronic acid, under similar conditions, afforded the coupled product 6 t in 92 % yield. The reactions of iodobenzene and para-methoxyiodobenzene with phenylboronic acid were also facile, yielding the corresponding coupled products 3a and 3c in 88 % and 89 %, respectively. All these examples show that the catalyst coated on the monolith is equally efficient as the powder catalyst (Ti0.97Pd0.03O1.97). Each time, a separate monolith was used for the reaction. The amount of substrate used in these reactions is corresponding to the amount of catalyst coated on the monolith. In every reaction, we maintained a 10 wt percentage catalyst to the substrate. 5 Comparison of Ti0.97Pd0.03O1.97 catalyst with other palladium catalysts To demonstrate the advantage of using the catalyst Ti0.97Pd0.03O1.97, we performed the Suzuki reaction of para-methoxyiodobenzene with phenylboronic acid using Pd-catalysts such as Pd2(dba)3, Pd(OAc)2, PdCl2(PPh3)2, Pd(PPh3)4, and PdCl2(dppf) (Table 4 ). For the sake of convenience, we performed the reaction in N, N-dimethyl formamide at 100 °C for 6 h using K2CO3 as a base. The Suzuki reaction of para-methoxyiodobenzene with phenylboronic acid in the presence of Pd2(dba)3, Pd(OAc)2, Pd(PPh3)4, and PdCl2(dppf) furnished the coupled product in 60, 70, 10, and 65 % yields, respectively (entries1-4, Table 4). A similar reaction using catalyst PdCl2(PPh3)2 tuned out to be an unsuccessful (entry 5). As can be seen in entry 6, the reaction of para-methoxyiodobenzene with phenylboronic acid usingTi0.97Pd0.03O1.97 catalyst under similar conditions (employed for the other palladium catalysts, as seen in Table 4), furnished a better yield of Suzuki product in 74 % yield. To our delight, the same reaction in water furnished almost quantitative yield of the coupled product (entry 7). Besides, the present method employs only 3% of Pd, whereas other methods (entries 1–5, Table 4) require a higher percentage of Pd-catalysts. More importantly, the TOF for the present method is quite high. For comparison sake, we also performed the reaction using conditions in DMF as well as water. In both the solvents, the yield and TOF are higher than other known methods, and the reaction in water turned out to be very good. 6 Scale-up reaction We performed a preparative scale reaction of 5-bromoindole with phenylboronic acid (2a) for demonstrating the usefulness of the method. Thus, we carried out a reaction of 5-bromoindole (5.1 mmol, 1 g) with phenylboronic acid (2 equiv., 10.2 mmol, 1.24 g) using Ti0.97Pd0.03O1.97 (nanoparticles. 10 wt percent) in H2O (15 mL) at 100 °C for 6 h. This reaction afforded the coupled product 6 u in 82 % yield (Scheme 2 ). Similarly, we carried out another scale-up reaction of 4-iodoanisole (1c, 12.8 mmol, 3 g) with phenylboronic acid (2a, 25.6 mmol, 3.1232 g) using catalyst coated monolith (300 mg) in H2O (25 mL) at 100 °C for 6 h. This reaction afforded the coupled product 3c in 87 % yield (Scheme 2). 7 Recycling of the catalyst coated on the monolith To find the recyclability of the catalyst coated monolith, we carried out a few experiments using catalyst coated monolith (Fig. 2 and Table 5 ). The first set of the experiment (Fig. 2) was performed repeating the single reaction using the same monolith. The second experiment was carried out was using the same monolith for different substrates (Table 5). As can be seen in Fig. 2, in the first set of experiment, the reaction of 4-iodoanisole (1c, 1.28 mmol) and phenylboronic acid (2a, 2.56 mmol) was carried out with monolith coated with 30 mg of the catalyst, which accounts for 0.011 mmol of Pd2+ ion as an active catalyst. The reaction was repeated 7 times, reusing the same catalyst coated monolith. After each cycle, the monolith coated with the catalyst was removed from the reaction flask, washed with hexane to remove organic compounds, and washed with distilled water to remove solvent and base. After washing the monolith, it was heated in the furnace for about 2 h at 300 °C, cooled to room temperature, and reused for another reaction. The percentage of yields obtained in each cycle has been shown in Fig. 2. This result shows that there is a little loss of catalytic activity after 7 cycles of the same monolith. The total TOF of the reaction is 112.3 h−1. In the second set of experiments (Table 5), the same catalyst (the same monolith) was recycled for the Suzuki-Miyaura reaction for three different substrates (Table 5). As seen, the reaction of phenylboronic acid (2a) was performed with iodobenzene, 4-methoxyiodobenzene, and 5-bromoindole, which afforded the corresponding Suzuki products 3a, 3c, and 6 u in 88, 93, and 71 % yields, respectively. 8 Synthetic application By knowing the utility of palladium-catalyzed coupling reactions in pharmaceutical, agrochemical, and fine chemical industries, we have showcased the application of the methodology in synthesizing 4′-methyl-1,1′-biphenyl-2-carbonitrile 6x, which is an intermediate for synthesizing angiostein II antagonists [44], using the developed method (Scheme 3 ). Thus, by reacting 1-iodo-4-methylbenzene with 2-cynophenylboronic acid, under optimal conditions, corresponding coupled product 6x was obtained in 89 % yield. 9 Experimental 9.1 Synthesis of Ti0.97Pd0.03O1.97 The catalyst Ti0.97Pd0.03O1.97 was prepared using the solution combustion method. Ti(OC3H7)4 and PdCl2 were used as starting materials and glycine was employed as a fuel. TiO(NO3)2 (2926 mg, 9.89 mmol), which was prepared from Ti(OC3H7)4 (2810 mg, 9.89 mmol), PdCl2, (54.8 mg, 0.31 mmol), and glycine (8242 mg, 10.99 mmol) were taken in a 300 ml capacity crystallizing dish. The mixture of compounds was completely dissolved in water (15 mL). The solution was kept in a preheated furnace at 350 °C (30 min). The combustion takes place after the dehydration, and the solid product was left behind. For the structural confirmation, powdered X-ray diffraction has been recorded. The absence of Pd-metal and PdO diffraction lines confirmed that the Pd ions are substituted in TiO2. 9.2 Procedure for coating of the catalyst over the monolith The commercially available cordierite monolith was dried in the oven for an hour. 0.05 mol of Al(NO3)3 and 0.083 mol of glycine were taken in a beaker. About 50–60 mL of water was added to dissolve the solids. A piece of a known mass of monolith was dipped in the solution and kept in the preheated furnace at 350 °C. The combustion takes place, and γ-Al2O3 will be coated over monolith. Repeated the procedure for 3–4 times and weighed the monolith each time. The amount of γ-Al2O3 was about 2–2.5 % of the monolith. The same procedure has been repeated for the coating palladium catalyst over a γ-Al2O3 layer of the monolith. As mentioned in the synthesis of Ti0.97Pd0.03O1.97, the solution of starting materials was made, and a known mass of the monolith is dipped in the solution and kept in a preheated furnace (30 min). Combustion takes place, and the catalyst will be coated over the monolith. The procedure has been repeated to get the desired weight of the catalyst. 9.3 Typical experimental procedure for the palladium-catalyzed suzuki cross-coupling reaction in water A mixture of aryl halide 1 (0.4 mmol), arylboronic acid 2 (0.8 mmol), Ti0.97Pd0.03O1.97 (nanoparticles; 10 wt %), K2CO3 (110 mg, 0.8 mmol) in water (2 mL) was stirred at 100 °C for 6 h. After the completion of the reaction, diethyl ether (15 ml x 3 times) was poured into the mixture, washed with water (15 mL), extracted with diethyl ether (3 × 20 mL), dried over anhydrous Na2SO4 and evaporated under vacuum; the residue was purified by column chromatography (petroleum ether or petroleum ether/ethyl acetate) to obtain the desired coupled product. In the recycling of the catalyst, we used the monolith coated with the catalyst in the reaction. After the reaction, the monolith coated with the catalyst was removed from the reaction flask, washed with hexane to remove the organic compound, and again washed with distilled water to remove the solvent and base. After washing the monolith, it was heated in the furnace for about 2 h at 300 °C. Then it was reused for another reaction. The same procedure was repeated after every reaction. 10 Conclusions In summary, we have developed a highly recyclable, non-toxic, catalyst Ti0.97Pd0.03O1.97 and demonstrated its utility in the Suzuki-Miyaura cross-coupling reaction. The catalyst Ti0.97Pd0.03O1.97, is very efficient and compatible with water and aerobic conditions. The utility of this catalyst has been enhanced in designing a coated catalyst on monolith and shown the coated monolith can be successfully used for several cycles. We have showcased the application of the methodology in synthesizing 4′-methyl-1,1′-biphenyl-2-carbonitrile, which is an intermediate for synthesizing angiostein II antagonists. The salient feature of using these catalysts in Suzuki reaction is, they are non-toxic, easy to handle, and show high TOF as compared to other Pd-catalysts. Declaration of Competing Interest The authors declare no competing financial interest. CRediT authorship contribution statement Shrikanth Bhat K: Data curation, Methodology. Veeranjaneyulu Lanke: Data curation, Methodology. Jagadeesh Dasappa Prasad: Writing - review & editing, Supervision. Kandikere Ramaiah Prabhu: Conceptualization, Formal analysis, Funding acquisition, Supervision, Writing - review & editing. Acknowledgment Authors thank Prof. M. S. Hedge for valuable discussions. K.R.P. thanks SERB (EMR/2016/006358), New-Delhi, and Indian Institute of Science, for financial assistance. V.L. thanks CSIR, New-Delhi, for a fellowship. Appendix A Supplementary data Supplementary material related to this article can be found, in the online version, at doi:https://doi.org/10.1016/j.apcata.2020.117516. Appendix A Supplementary data The following is Supplementary data to this article: The Supporting Information is available free of charge via the Internet at Procedure, characterization data, 1H and 13C spectra. References [1] C. Yu H. Huang X. Li Y. Zhang W. Wang J. Am. Chem. Soc. 138 2016 6956 6959 [2] C.Y. Lee C.H. Cheona Adv. Synth. Catal. 358 2016 549 554 [3] A. Markham K.L. Goa Drugs 54 1997 299 311 [4] R. Capdeville E. Buchdunger J. Zimmermann A. Matter Nat. Rev. Drug Discov. 1 2002 493 502 [5] N. Miyaura A. Suzuki Chem. Rev. 95 1995 2457 2483 [6] J. Hassan M. Sevignon C. Gozzi E. Schulz M. Lemaire Chem. Rev. 102 2002 1359 1469 [7] S. Lightowler M. Hird Chem. Mater. 17 2005 5538 5549 [8] N. Miyaura K. Yanada A. Suzuki Tetrahedron Lett. 20 1979 3437 3440 [9] X. Zhan S. Wang Y. Liu X. Wu D. Zhu Chem. Mater. 15 2003 1963 1969 [10] Y. Donga X. Wua X. Chena Y. Wei Carbohydr. Polym. 160 2017 106 114 [11] G. Yue Y. Wu C. Wu Z. Yin H. Chen X. Wang Z. Zhang Tetrahedron Lett. 58 2017 666 669 [12] L. Tian L. Yanjun L. Feng-Shou Appl. Clay Sci. 136 2017 18 25 [13] F. Liron C. Fosse A. Pernolet E. Roulland J. Org. Chem. 72 2007 2220 2223 [14] A.S. Guram X. Wang E.E. Bunel M.M. Faul R.D. Larsen M.J. Martinelli J. Org. Chem. 72 2007 5104 5112 [15] E.A.B. Kantchev C.J. O’Brien M.G. Organ Angew. Chem., Int. Ed. 46 2007 2768 2813 [16] G. Altenhoff R. Goddard C.W. Lehmann F. Glorius J. Am. Chem. Soc. 126 2004 15195 15201 [17] W.A. Herrmann C.W.K. Gstottmayr M. Grosche C.P. Reisinger T. Weskamp J. Organomet. Chem. 617–618 2001 616 628 [18] J. Gong G. Liu C. Du Y. Zhu Y. Wu J. Organomet. Chem. 690 2005 3963 3969 [19] C. Chen Y. Liu S. Peng S. Liu Organometallics 24 2005 1075 1081 [20] E.B. Mubofu J.H. Clark D.J. Macquarrie Green Chem. 3 2001 23 25 [21] S. Li Y. Lin J. Cao S. Zhang J. Org. Chem. 72 2007 4067 4072 [22] L. Yin J. Liebscher Chem. Rev. 107 2007 133 173 [23] B. Yuan Y. Pan Y. Li B. Yin H. Jiang Angew. Chem. Int. Ed. 49 2010 4054 4058 [24] S. Paul J.H. Clark Green Chem. 5 2003 635 638 [25] A. Monopoli A. Nacci V. Calò F. Ciminale P. Cotugno A. Mangone L.C. Giannossa Pietro. Azzone N. Cioffi Molecules 15 2010 4511 4525 [26] F. Durapa M. Rakap M. Aydemir S. Ozkar Appl. Catal. A Gen. 382 2010 339 344 [27] S. Bhattacharya A. Srivastava S. Sengupta Tetrahedron Lett. 46 2005 3557 3560 [28] I. Hoffmann B. Blumenröder S.O. Thumann S. Dommer J. Schatz Green Chem. 17 2015 3844 3857 [29] A.L. Casalnuovo J.C. Calabrese J. Am. Chem. Soc. 112 1990 4324 4330 [30] K. Shimizu R. Maruyama S. Komai T. Kodama Y. Kitayama J. Catal. 227 2004 202 209 [31] T. Lussier G. Herve´ G. Enderlina C. Len RSC Adv. 4 2014 46218 46223 [32] G. Herve´ C. Len RSC Adv. 4 2014 46926 46929 [33] G. Herve´ G. Sartori G. Enderlin G. Mackenzie C. Len RSC Adv. 4 2014 18558 18594 [34] S. Gallagher-Duval G. Herve´ G. Sartori G. Enderlin C. Len New J. Chem. 37 2013 1989 1995 [35] A. Fihri D. Luart C. Len A. Solhy C. Chevrin V. Polshettiwar Dalton Trans. 40 2011 3116 3121 [36] M. Pe ́rez-Lorenzo J. Phys. Chem. Lett. 3 2012 167 174 [37] P.K. Mandali D.K. Chand Catal. Commun. 31 2013 16 20 [38] B.D. Mukri G. Dutta U.V. Waghmare M.S. Hegde Chem. Mater. 24 2012 4491 4502 [39] M.S. Hegde G. Madras K.C. Patil Acc. Chem. Res. 42 2009 704 712 [40] S. Roy T. Aarthi M.S. Hegde G. Madras Ind. Eng. Chem. Res. 46 2007 5798 5802 [41] S. Sharma M.S. Hegde J. Res. Phys. Chem. Chem. Phys. 10 2009 637 [42] S. Roy M.S. Hegde N. Ravishankar G. Madras J. Phys. Chem. C 111 2007 8153 [43] S. Sharma M.S. Hegde Catal. Lett. 112 2006 69 [44] (a) Y.M.A. Yamada K. Takeda H. Takahashi S. Ikegami Org. Lett. 4 2002 3371 3374 and references therein (b) J. Kim S.Y. Hong ACS Catal. 7 2017 3336 3343 and references therein (c) A. Zapf A. Ehrentraut M. Beller Angew. Chem. Int. Ed. 39 2000 4153 4155 (d) G.T. Wang Bioorg. Med. Chem. Lett. 12 2005 153 158 (e) F. Fringuelli R. Girotti O. Piermatti F. Pizzo L. Vaccaro Org. Lett. 8 2006 5741 5744 and references therein",
      "scopus-id": "85081691961",
      "coredata": {
        "eid": "1-s2.0-S0926860X20301095",
        "dc:description": "We synthesized a recyclable palladium ionic catalyst, Ti0.97Pd0.03O1.97, using a solution combustion method (SCM), and characterized by XRD and Rietveld refinement. The synthesized Pd ionic catalyst is stable, insensitive to moisture and air, and easy to handle. The new catalyst has exhibited a phenomenal result for the Suzuki-Miyaura cross-coupling reaction with a broad substrate scope, and the reaction proceeds in an aqueous medium. The new catalyst proved beneficial and produced excellent yields irrespective of aryl halide used in the reaction (electron-rich or electron-poor or heterocyclic compounds) and shown a turnover frequency (TOF) of 14–25 h−1 for different reactions. The catalyst was coated on a cordierite monolith (Mg2Al4Si5O18), which enhanced the applicability of the catalyst, and made the handling and recycling of the catalyst very easy. Suzuki Miyaura reaction was carried out using both Pd-powder catalysts as well as the Pd-coated honeycomb, which gave almost similar results. We have demonstrated the recyclability of Pd coated cordierite monolith and shown the superiority of the catalyst over the other Pd catalysts for the Suzuki-Miyaura reaction.",
        "openArchiveArticle": "false",
        "prism:coverDate": "2020-04-25",
        "openaccessUserLicense": null,
        "prism:aggregationType": "Journal",
        "prism:url": "https://api.elsevier.com/content/article/pii/S0926860X20301095",
        "dc:creator": [
          {
            "@_fa": "true",
            "$": "Bhat K, Shrikanth"
          },
          {
            "@_fa": "true",
            "$": "Lanke, Veeranjaneyulu"
          },
          {
            "@_fa": "true",
            "$": "Prasad, Jagadeesh Dasappa"
          },
          {
            "@_fa": "true",
            "$": "Prabhu, Kandikere Ramaiah"
          }
        ],
        "link": [
          {
            "@_fa": "true",
            "@rel": "self",
            "@href": "https://api.elsevier.com/content/article/pii/S0926860X20301095"
          },
          {
            "@_fa": "true",
            "@rel": "scidir",
            "@href": "https://www.sciencedirect.com/science/article/pii/S0926860X20301095"
          }
        ],
        "dc:format": "application/json",
        "openaccessType": null,
        "pii": "S0926-860X(20)30109-5",
        "prism:volume": "596",
        "articleNumber": "117516",
        "prism:publisher": "Elsevier B.V.",
        "dc:title": "Ligand-free Suzuki coupling reaction with highly recyclable ionic palladium catalyst, Ti1-xPdxO2-x (x = 0.03)",
        "prism:copyright": "© 2020 Elsevier B.V. All rights reserved.",
        "openaccess": "0",
        "prism:issn": "0926860X",
        "dcterms:subject": [
          {
            "@_fa": "true",
            "$": "Suzuki miyaura reaction"
          },
          {
            "@_fa": "true",
            "$": "Palladium catalyst"
          },
          {
            "@_fa": "true",
            "$": "Pd-coated honeycomb"
          },
          {
            "@_fa": "true",
            "$": "Ligand-free conditions"
          },
          {
            "@_fa": "true",
            "$": "Aerobic conditions"
          },
          {
            "@_fa": "true",
            "$": "Arylboronic acids"
          }
        ],
        "openaccessArticle": "false",
        "prism:publicationName": "Applied Catalysis A: General",
        "openaccessSponsorType": null,
        "prism:pageRange": "117516",
        "pubType": "fla",
        "prism:coverDisplayDate": "25 April 2020",
        "prism:doi": "10.1016/j.apcata.2020.117516",
        "prism:startingPage": "117516",
        "dc:identifier": "doi:10.1016/j.apcata.2020.117516",
        "openaccessSponsorName": null
      },
      "objects": {
        "object": [
          {
            "@category": "standard",
            "@height": "543",
            "@width": "423",
            "@_fa": "true",
            "$": "https://api.elsevier.com/content/object/eid/1-s2.0-S0926860X20301095-fx2.jpg?httpAccept=%2A%2F%2A",
            "@multimediatype": "JPEG image file",
            "@type": "IMAGE-DOWNSAMPLED",
            "@size": "57471",
            "@ref": "fx2",
            "@mimetype": "image/jpeg"
          },
          {
            "@category": "standard",
            "@height": "73",
            "@width": "393",
            "@_fa": "true",
            "$": "https://api.elsevier.com/content/object/eid/1-s2.0-S0926860X20301095-sc1.jpg?httpAccept=%2A%2F%2A",
            "@multimediatype": "JPEG image file",
            "@type": "IMAGE-DOWNSAMPLED",
            "@size": "7894",
            "@ref": "sc1",
            "@mimetype": "image/jpeg"
          },
          {
            "@category": "standard",
            "@height": "198",
            "@width": "415",
            "@_fa": "true",
            "$": "https://api.elsevier.com/content/object/eid/1-s2.0-S0926860X20301095-fx3.jpg?httpAccept=%2A%2F%2A",
            "@multimediatype": "JPEG image file",
            "@type": "IMAGE-DOWNSAMPLED",
            "@size": "21503",
            "@ref": "fx3",
            "@mimetype": "image/jpeg"
          },
          {
            "@category": "standard",
            "@height": "55",
            "@width": "377",
            "@_fa": "true",
            "$": "https://api.elsevier.com/content/object/eid/1-s2.0-S0926860X20301095-fx1.jpg?httpAccept=%2A%2F%2A",
            "@multimediatype": "JPEG image file",
            "@type": "IMAGE-DOWNSAMPLED",
            "@size": "7649",
            "@ref": "fx1",
            "@mimetype": "image/jpeg"
          },
          {
            "@category": "standard",
            "@height": "207",
            "@width": "489",
            "@_fa": "true",
            "$": "https://api.elsevier.com/content/object/eid/1-s2.0-S0926860X20301095-sc2.jpg?httpAccept=%2A%2F%2A",
            "@multimediatype": "JPEG image file",
            "@type": "IMAGE-DOWNSAMPLED",
            "@size": "23354",
            "@ref": "sc2",
            "@mimetype": "image/jpeg"
          },
          {
            "@category": "standard",
            "@height": "52",
            "@width": "354",
            "@_fa": "true",
            "$": "https://api.elsevier.com/content/object/eid/1-s2.0-S0926860X20301095-fx4.jpg?httpAccept=%2A%2F%2A",
            "@multimediatype": "JPEG image file",
            "@type": "IMAGE-DOWNSAMPLED",
            "@size": "6630",
            "@ref": "fx4",
            "@mimetype": "image/jpeg"
          },
          {
            "@category": "standard",
            "@height": "108",
            "@width": "510",
            "@_fa": "true",
            "$": "https://api.elsevier.com/content/object/eid/1-s2.0-S0926860X20301095-sc3.jpg?httpAccept=%2A%2F%2A",
            "@multimediatype": "JPEG image file",
            "@type": "IMAGE-DOWNSAMPLED",
            "@size": "14617",
            "@ref": "sc3",
            "@mimetype": "image/jpeg"
          },
          {
            "@category": "standard",
            "@height": "131",
            "@width": "415",
            "@_fa": "true",
            "$": "https://api.elsevier.com/content/object/eid/1-s2.0-S0926860X20301095-fx5.jpg?httpAccept=%2A%2F%2A",
            "@multimediatype": "JPEG image file",
            "@type": "IMAGE-DOWNSAMPLED",
            "@size": "13627",
            "@ref": "fx5",
            "@mimetype": "image/jpeg"
          },
          {
            "@category": "standard",
            "@height": "218",
            "@width": "376",
            "@_fa": "true",
            "$": "https://api.elsevier.com/content/object/eid/1-s2.0-S0926860X20301095-gr1.jpg?httpAccept=%2A%2F%2A",
            "@multimediatype": "JPEG image file",
            "@type": "IMAGE-DOWNSAMPLED",
            "@size": "15925",
            "@ref": "gr1",
            "@mimetype": "image/jpeg"
          },
          {
            "@category": "standard",
            "@height": "322",
            "@width": "376",
            "@_fa": "true",
            "$": "https://api.elsevier.com/content/object/eid/1-s2.0-S0926860X20301095-gr2.jpg?httpAccept=%2A%2F%2A",
            "@multimediatype": "JPEG image file",
            "@type": "IMAGE-DOWNSAMPLED",
            "@size": "16823",
            "@ref": "gr2",
            "@mimetype": "image/jpeg"
          },
          {
            "@category": "standard",
            "@height": "145",
            "@width": "500",
            "@_fa": "true",
            "$": "https://api.elsevier.com/content/object/eid/1-s2.0-S0926860X20301095-ga1.jpg?httpAccept=%2A%2F%2A",
            "@multimediatype": "JPEG image file",
            "@type": "IMAGE-DOWNSAMPLED",
            "@size": "21571",
            "@ref": "ga1",
            "@mimetype": "image/jpeg"
          },
          {
            "@category": "thumbnail",
            "@height": "163",
            "@width": "127",
            "@_fa": "true",
            "$": "https://api.elsevier.com/content/object/eid/1-s2.0-S0926860X20301095-fx2.sml?httpAccept=%2A%2F%2A",
            "@multimediatype": "GIF image file",
            "@type": "IMAGE-THUMBNAIL",
            "@size": "5497",
            "@ref": "fx2",
            "@mimetype": "image/gif"
          },
          {
            "@category": "thumbnail",
            "@height": "41",
            "@width": "219",
            "@_fa": "true",
            "$": "https://api.elsevier.com/content/object/eid/1-s2.0-S0926860X20301095-sc1.sml?httpAccept=%2A%2F%2A",
            "@multimediatype": "GIF image file",
            "@type": "IMAGE-THUMBNAIL",
            "@size": "2597",
            "@ref": "sc1",
            "@mimetype": "image/gif"
          },
          {
            "@category": "thumbnail",
            "@height": "104",
            "@width": "219",
            "@_fa": "true",
            "$": "https://api.elsevier.com/content/object/eid/1-s2.0-S0926860X20301095-fx3.sml?httpAccept=%2A%2F%2A",
            "@multimediatype": "GIF image file",
            "@type": "IMAGE-THUMBNAIL",
            "@size": "4714",
            "@ref": "fx3",
            "@mimetype": "image/gif"
          },
          {
            "@category": "thumbnail",
            "@height": "32",
            "@width": "219",
            "@_fa": "true",
            "$": "https://api.elsevier.com/content/object/eid/1-s2.0-S0926860X20301095-fx1.sml?httpAccept=%2A%2F%2A",
            "@multimediatype": "GIF image file",
            "@type": "IMAGE-THUMBNAIL",
            "@size": "2559",
            "@ref": "fx1",
            "@mimetype": "image/gif"
          },
          {
            "@category": "thumbnail",
            "@height": "93",
            "@width": "219",
            "@_fa": "true",
            "$": "https://api.elsevier.com/content/object/eid/1-s2.0-S0926860X20301095-sc2.sml?httpAccept=%2A%2F%2A",
            "@multimediatype": "GIF image file",
            "@type": "IMAGE-THUMBNAIL",
            "@size": "4379",
            "@ref": "sc2",
            "@mimetype": "image/gif"
          },
          {
            "@category": "thumbnail",
            "@height": "32",
            "@width": "219",
            "@_fa": "true",
            "$": "https://api.elsevier.com/content/object/eid/1-s2.0-S0926860X20301095-fx4.sml?httpAccept=%2A%2F%2A",
            "@multimediatype": "GIF image file",
            "@type": "IMAGE-THUMBNAIL",
            "@size": "2373",
            "@ref": "fx4",
            "@mimetype": "image/gif"
          },
          {
            "@category": "thumbnail",
            "@height": "46",
            "@width": "219",
            "@_fa": "true",
            "$": "https://api.elsevier.com/content/object/eid/1-s2.0-S0926860X20301095-sc3.sml?httpAccept=%2A%2F%2A",
            "@multimediatype": "GIF image file",
            "@type": "IMAGE-THUMBNAIL",
            "@size": "2502",
            "@ref": "sc3",
            "@mimetype": "image/gif"
          },
          {
            "@category": "thumbnail",
            "@height": "69",
            "@width": "219",
            "@_fa": "true",
            "$": "https://api.elsevier.com/content/object/eid/1-s2.0-S0926860X20301095-fx5.sml?httpAccept=%2A%2F%2A",
            "@multimediatype": "GIF image file",
            "@type": "IMAGE-THUMBNAIL",
            "@size": "3392",
            "@ref": "fx5",
            "@mimetype": "image/gif"
          },
          {
            "@category": "thumbnail",
            "@height": "127",
            "@width": "219",
            "@_fa": "true",
            "$": "https://api.elsevier.com/content/object/eid/1-s2.0-S0926860X20301095-gr1.sml?httpAccept=%2A%2F%2A",
            "@multimediatype": "GIF image file",
            "@type": "IMAGE-THUMBNAIL",
            "@size": "7074",
            "@ref": "gr1",
            "@mimetype": "image/gif"
          },
          {
            "@category": "thumbnail",
            "@height": "164",
            "@width": "192",
            "@_fa": "true",
            "$": "https://api.elsevier.com/content/object/eid/1-s2.0-S0926860X20301095-gr2.sml?httpAccept=%2A%2F%2A",
            "@multimediatype": "GIF image file",
            "@type": "IMAGE-THUMBNAIL",
            "@size": "7006",
            "@ref": "gr2",
            "@mimetype": "image/gif"
          },
          {
            "@category": "thumbnail",
            "@height": "64",
            "@width": "219",
            "@_fa": "true",
            "$": "https://api.elsevier.com/content/object/eid/1-s2.0-S0926860X20301095-ga1.sml?httpAccept=%2A%2F%2A",
            "@multimediatype": "GIF image file",
            "@type": "IMAGE-THUMBNAIL",
            "@size": "4772",
            "@ref": "ga1",
            "@mimetype": "image/gif"
          },
          {
            "@category": "high",
            "@height": "2405",
            "@width": "1873",
            "@_fa": "true",
            "$": "https://api.elsevier.com/content/object/eid/1-s2.0-S0926860X20301095-fx2_lrg.jpg?httpAccept=%2A%2F%2A",
            "@multimediatype": "JPEG image file",
            "@type": "IMAGE-HIGH-RES",
            "@size": "443311",
            "@ref": "fx2",
            "@mimetype": "image/jpeg"
          },
          {
            "@category": "high",
            "@height": "324",
            "@width": "1742",
            "@_fa": "true",
            "$": "https://api.elsevier.com/content/object/eid/1-s2.0-S0926860X20301095-sc1_lrg.jpg?httpAccept=%2A%2F%2A",
            "@multimediatype": "JPEG image file",
            "@type": "IMAGE-HIGH-RES",
            "@size": "55826",
            "@ref": "sc1",
            "@mimetype": "image/jpeg"
          },
          {
            "@category": "high",
            "@height": "875",
            "@width": "1837",
            "@_fa": "true",
            "$": "https://api.elsevier.com/content/object/eid/1-s2.0-S0926860X20301095-fx3_lrg.jpg?httpAccept=%2A%2F%2A",
            "@multimediatype": "JPEG image file",
            "@type": "IMAGE-HIGH-RES",
            "@size": "154627",
            "@ref": "fx3",
            "@mimetype": "image/jpeg"
          },
          {
            "@category": "high",
            "@height": "246",
            "@width": "1672",
            "@_fa": "true",
            "$": "https://api.elsevier.com/content/object/eid/1-s2.0-S0926860X20301095-fx1_lrg.jpg?httpAccept=%2A%2F%2A",
            "@multimediatype": "JPEG image file",
            "@type": "IMAGE-HIGH-RES",
            "@size": "57903",
            "@ref": "fx1",
            "@mimetype": "image/jpeg"
          },
          {
            "@category": "high",
            "@height": "916",
            "@width": "2167",
            "@_fa": "true",
            "$": "https://api.elsevier.com/content/object/eid/1-s2.0-S0926860X20301095-sc2_lrg.jpg?httpAccept=%2A%2F%2A",
            "@multimediatype": "JPEG image file",
            "@type": "IMAGE-HIGH-RES",
            "@size": "173797",
            "@ref": "sc2",
            "@mimetype": "image/jpeg"
          },
          {
            "@category": "high",
            "@height": "231",
            "@width": "1569",
            "@_fa": "true",
            "$": "https://api.elsevier.com/content/object/eid/1-s2.0-S0926860X20301095-fx4_lrg.jpg?httpAccept=%2A%2F%2A",
            "@multimediatype": "JPEG image file",
            "@type": "IMAGE-HIGH-RES",
            "@size": "47157",
            "@ref": "fx4",
            "@mimetype": "image/jpeg"
          },
          {
            "@category": "high",
            "@height": "477",
            "@width": "2258",
            "@_fa": "true",
            "$": "https://api.elsevier.com/content/object/eid/1-s2.0-S0926860X20301095-sc3_lrg.jpg?httpAccept=%2A%2F%2A",
            "@multimediatype": "JPEG image file",
            "@type": "IMAGE-HIGH-RES",
            "@size": "110811",
            "@ref": "sc3",
            "@mimetype": "image/jpeg"
          },
          {
            "@category": "high",
            "@height": "578",
            "@width": "1837",
            "@_fa": "true",
            "$": "https://api.elsevier.com/content/object/eid/1-s2.0-S0926860X20301095-fx5_lrg.jpg?httpAccept=%2A%2F%2A",
            "@multimediatype": "JPEG image file",
            "@type": "IMAGE-HIGH-RES",
            "@size": "101948",
            "@ref": "fx5",
            "@mimetype": "image/jpeg"
          },
          {
            "@category": "high",
            "@height": "966",
            "@width": "1667",
            "@_fa": "true",
            "$": "https://api.elsevier.com/content/object/eid/1-s2.0-S0926860X20301095-gr1_lrg.jpg?httpAccept=%2A%2F%2A",
            "@multimediatype": "JPEG image file",
            "@type": "IMAGE-HIGH-RES",
            "@size": "149133",
            "@ref": "gr1",
            "@mimetype": "image/jpeg"
          },
          {
            "@category": "high",
            "@height": "1426",
            "@width": "1667",
            "@_fa": "true",
            "$": "https://api.elsevier.com/content/object/eid/1-s2.0-S0926860X20301095-gr2_lrg.jpg?httpAccept=%2A%2F%2A",
            "@multimediatype": "JPEG image file",
            "@type": "IMAGE-HIGH-RES",
            "@size": "122883",
            "@ref": "gr2",
            "@mimetype": "image/jpeg"
          },
          {
            "@category": "high",
            "@height": "642",
            "@width": "2213",
            "@_fa": "true",
            "$": "https://api.elsevier.com/content/object/eid/1-s2.0-S0926860X20301095-ga1_lrg.jpg?httpAccept=%2A%2F%2A",
            "@multimediatype": "JPEG image file",
            "@type": "IMAGE-HIGH-RES",
            "@size": "168225",
            "@ref": "ga1",
            "@mimetype": "image/jpeg"
          },
          {
            "@category": "standard",
            "@_fa": "true",
            "$": "https://api.elsevier.com/content/object/eid/1-s2.0-S0926860X20301095-mmc1.doc?httpAccept=%2A%2F%2A",
            "@multimediatype": "Microsoft Word file",
            "@type": "APPLICATION",
            "@size": "5095936",
            "@ref": "mmc1",
            "@mimetype": "application/word"
          },
          {
            "@category": "standard",
            "@_fa": "true",
            "$": "https://api.elsevier.com/content/object/eid/1-s2.0-S0926860X20301095-am.pdf?httpAccept=%2A%2F%2A",
            "@multimediatype": "Acrobat PDF file",
            "@type": "AAM-PDF",
            "@size": "399970",
            "@ref": "am",
            "@mimetype": "application/pdf"
          }
        ]
      },
      "link": {
        "@rel": "abstract",
        "@href": "https://api.elsevier.com/content/abstract/scopus_id/85081691961"
      }
    }
  }
}