{
  "metadata": {
    "title": "Deactivation of Pt-Au/TiO<ce:inf loc=post>2</ce:inf>-CeO<ce:inf loc=post>2</ce:inf> catalyst for co-oxidation of HCHO, H<ce:inf loc=post>2</ce:inf> and CO at room temperature: Degradations of active sites and mutual influence between reactants",
    "authors": "; ; ",
    "journal": "Applied Catalysis A: General",
    "date": "2019-07-25",
    "doi": "10.1016/j.apcata.2019.117116",
    "abstract": "",
    "uri": "https://api.elsevier.com/content/article/pii/S0926860X19302704",
    "pii": "S0926860X19302704"
  },
  "fulltext": {
    "full-text-retrieval-response": {
      "scopus-eid": "2-s2.0-85067898374",
      "originalText": "serial JL 271346 291210 291744 291809 31 Applied Catalysis A: General APPLIEDCATALYSISAGENERAL 2019-06-18 2019-06-18 2019-06-27 2019-06-27 2019-07-03T16:52:19 1-s2.0-S0926860X19302704 S0926-860X(19)30270-4 S0926860X19302704 10.1016/j.apcata.2019.117116 S300 S300.1 FULL-TEXT 1-s2.0-S0926860X19X00113 2024-01-01T12:33:10.553292Z 0 0 20190725 2019 2019-06-18T15:23:36.122313Z absattachment articleinfo articlenumber articletitlenorm authfirstinitialnorm authfirstsurnamenorm cid cids contenttype copyright crossmark dateloaded dateloadedtxt datesearch datesort dateupdated dco docsubtype doctype doi eid ewtransactionid hubeid indexeddate issn issnnorm itemstage itemtransactionid itemweight openaccess openarchive pg pgfirst pii piinorm pubdatestart pubdatetxt pubyr sectiontitle sortorder srctitle srctitlenorm srctype ssids alllist content subj subheadings suppl tomb volfirst volissue volumelist webpdf webpdfpagecount yearnav figure table body acknowledge affil articletitle auth authfirstini authfull authkeywords authlast grantnumber grantsponsor grantsponsorid highlightsabst orcid primabst ref specialabst 0926-860X 0926860X true 582 582 C Volume 582 25 117116 117116 117116 20190725 25 July 2019 2019-07-25 2019 Regular papers article fla © 2019 Elsevier B.V. All rights reserved. DEACTIVATIONPTAUTIO2CEO2CATALYSTFORCOOXIDATIONHCHOH2COROOMTEMPERATUREDEGRADATIONSACTIVESITESMUTUALINFLUENCEBETWEENREACTANTS HONG X 1 Introduction 2 Experimental section 2.1 Catalyst preparation 2.2 Catalyst characterization 2.3 Measurement of the catalytic activity 3 Results and discussion 3.1 Catalytic performance 3.2 Physicochemical properties of catalysts 3.3 In-situ DRIFTS study of reaction mechanism 3.4 Origins of the deactivation on the Pt-Au/TiO2-CeO2 catalyst 4 Conclusions Acknowledgements References SCHMIDT 1997 2591 2595 T OJEDA 2010 33 41 M WANG 2006 106 108 W SEO 2010 917 925 P SCIRE 2003 43 49 S ZHANG 2007 345 350 C HONG 2016 3606 3615 X JANICKE 2000 282 293 M VOLOSHIN 2007 40 47 Y JONES 1990 219 229 M KANDOI 2004 93 100 S ZHENG 2014 332 346 X SCHMIDT 2001 132 140 T LIU 2003 3731 3742 P WANG 2009 154 162 H HARUTA 1989 301 309 M NA 2014 2051 2057 H QIAO 2011 361 365 B HONG 2017 351 X MA 2014 36 43 L WANG 2009 154 162 H HONG 2017 226 234 X NA 2014 2051 2057 H LI 2011 279 285 H CHEN 2009 5031 5034 Y QIAN 2009 40 47 K BULUSHEV 2004 8 17 D QIAO 2008 220 228 B HUTCHINGS 2006 71 81 G ZWIJNENBURG 2002 9853 9862 A HUANG 2014 69 75 C AN 2011 1392 1397 N MANZOLI 2007 308 315 M DENG 2005 126 135 W SHAN 2012 100 106 W MIN 2003 143 156 K CHEN 2013 245 255 B FENG 2015 1607 1616 N GUO 2008 19 26 Q SHAN 2012 100 106 W JANSSON 2000 55 60 J ZHANG 2012 9628 9632 C SUN 2010 239 246 S ENEVOLDSEN 2009 136103 G PARK 1999 8101 8107 Y ALOISIO 1998 1899 1902 S PICCOLO 2009 190 195 L CHIORINO 2009 169 176 A QI 2012 234 245 L HANEDA 2014 109 115 M LI 2013 523 532 N GREEN 2011 10186 10189 I DATE 2001 221 224 M SCHMIDT 2001 132 140 T LEE 2010 244 249 D LIU 2005 69 75 X BURCH 2006 5483 5500 R HONGX2019X117116 HONGX2019X117116XX 2021-06-27T00:00:00.000Z 2021-06-27T00:00:00.000Z http://creativecommons.org/licenses/by-nc-nd/4.0/ © 2019 Elsevier B.V. All rights reserved. 2019-06-18T23:36:44.903Z http://vtw.elsevier.com/data/voc/AddOnTypes/50.7/eoas NSFC National Natural Science Foundation of China http://data.elsevier.com/vocabulary/SciValFunders/501100001809 http://sws.geonames.org/1814991 item S0926-860X(19)30270-4 S0926860X19302704 1-s2.0-S0926860X19302704 10.1016/j.apcata.2019.117116 271346 2024-01-01T12:33:10.553292Z 2019-07-25 1-s2.0-S0926860X19302704-main.pdf https://s3.amazonaws.com/prod-ucs-content-store-us-east/content/pii:S0926860X19302704/MAIN/application/pdf/a4dbab5c678b192a108621d138766852/main.pdf main.pdf pdf true 4181780 MAIN 8 1-s2.0-S0926860X19302704-main_1.png https://s3.amazonaws.com/prod-ucs-content-store-us-east/content/pii:S0926860X19302704/PREVIEW/image/png/bf5d241bdb34cee6de61cdaf1acbe62b/main_1.png main_1.png png 54966 849 656 IMAGE-WEB-PDF 1 1-s2.0-S0926860X19302704-gr8.sml https://s3.amazonaws.com/prod-ucs-content-store-us-east/content/pii:S0926860X19302704/gr8/THUMBNAIL/image/gif/49e11c930dc0093c7d72384075c94e18/gr8.sml gr8 gr8.sml sml 10995 164 199 IMAGE-THUMBNAIL 1-s2.0-S0926860X19302704-gr7.sml https://s3.amazonaws.com/prod-ucs-content-store-us-east/content/pii:S0926860X19302704/gr7/THUMBNAIL/image/gif/9733a7bbe5095157353f9cf74aa2560b/gr7.sml gr7 gr7.sml sml 6873 163 189 IMAGE-THUMBNAIL 1-s2.0-S0926860X19302704-gr6.sml https://s3.amazonaws.com/prod-ucs-content-store-us-east/content/pii:S0926860X19302704/gr6/THUMBNAIL/image/gif/3e6da181923a68dd06938aa2e8e6f245/gr6.sml gr6 gr6.sml sml 12686 164 203 IMAGE-THUMBNAIL 1-s2.0-S0926860X19302704-gr5.sml https://s3.amazonaws.com/prod-ucs-content-store-us-east/content/pii:S0926860X19302704/gr5/THUMBNAIL/image/gif/b87cb788e09b61ebbe78782b29858f58/gr5.sml gr5 gr5.sml sml 8580 94 219 IMAGE-THUMBNAIL 1-s2.0-S0926860X19302704-gr4.sml https://s3.amazonaws.com/prod-ucs-content-store-us-east/content/pii:S0926860X19302704/gr4/THUMBNAIL/image/gif/94e6cfe342d9d0abd9f91d52facc7073/gr4.sml gr4 gr4.sml sml 8709 164 208 IMAGE-THUMBNAIL 1-s2.0-S0926860X19302704-gr3.sml https://s3.amazonaws.com/prod-ucs-content-store-us-east/content/pii:S0926860X19302704/gr3/THUMBNAIL/image/gif/6b935bb222109e795b5d0dfe8e0e2715/gr3.sml gr3 gr3.sml sml 19167 164 174 IMAGE-THUMBNAIL 1-s2.0-S0926860X19302704-gr2.sml https://s3.amazonaws.com/prod-ucs-content-store-us-east/content/pii:S0926860X19302704/gr2/THUMBNAIL/image/gif/c764f2ffe10b34e7a9723dab23b76112/gr2.sml gr2 gr2.sml sml 9293 164 198 IMAGE-THUMBNAIL 1-s2.0-S0926860X19302704-ga1.sml https://s3.amazonaws.com/prod-ucs-content-store-us-east/content/pii:S0926860X19302704/ga1/THUMBNAIL/image/gif/1dd2dbf2cea140e57b7cdbbcb225495c/ga1.sml ga1 true ga1.sml sml 6898 50 219 IMAGE-THUMBNAIL 1-s2.0-S0926860X19302704-gr1.sml https://s3.amazonaws.com/prod-ucs-content-store-us-east/content/pii:S0926860X19302704/gr1/THUMBNAIL/image/gif/f85186d82136cb155d445dcd65a88879/gr1.sml gr1 gr1.sml sml 10073 164 215 IMAGE-THUMBNAIL 1-s2.0-S0926860X19302704-gr9.sml https://s3.amazonaws.com/prod-ucs-content-store-us-east/content/pii:S0926860X19302704/gr9/THUMBNAIL/image/gif/788aedd6d6d05fb1dd43a2c9649b4d44/gr9.sml gr9 gr9.sml sml 14264 163 199 IMAGE-THUMBNAIL 1-s2.0-S0926860X19302704-gr8.jpg https://s3.amazonaws.com/prod-ucs-content-store-us-east/content/pii:S0926860X19302704/gr8/DOWNSAMPLED/image/jpeg/2d8dd2915d333bc72565ae2f1a732e82/gr8.jpg gr8 gr8.jpg jpg 66130 466 567 IMAGE-DOWNSAMPLED 1-s2.0-S0926860X19302704-gr7.jpg https://s3.amazonaws.com/prod-ucs-content-store-us-east/content/pii:S0926860X19302704/gr7/DOWNSAMPLED/image/jpeg/8e5538e7619682b6bd7b7ad2c3a7b01a/gr7.jpg gr7 gr7.jpg jpg 20183 295 341 IMAGE-DOWNSAMPLED 1-s2.0-S0926860X19302704-gr6.jpg https://s3.amazonaws.com/prod-ucs-content-store-us-east/content/pii:S0926860X19302704/gr6/DOWNSAMPLED/image/jpeg/fdf5fce2950a9af0e8141c33c03ca2ac/gr6.jpg gr6 gr6.jpg jpg 72972 459 567 IMAGE-DOWNSAMPLED 1-s2.0-S0926860X19302704-gr5.jpg https://s3.amazonaws.com/prod-ucs-content-store-us-east/content/pii:S0926860X19302704/gr5/DOWNSAMPLED/image/jpeg/d237059189098720560ac11bb9794f75/gr5.jpg gr5 gr5.jpg jpg 45422 243 567 IMAGE-DOWNSAMPLED 1-s2.0-S0926860X19302704-gr4.jpg https://s3.amazonaws.com/prod-ucs-content-store-us-east/content/pii:S0926860X19302704/gr4/DOWNSAMPLED/image/jpeg/b43185513fe6c2bd7789eca9095d057a/gr4.jpg gr4 gr4.jpg jpg 22857 268 341 IMAGE-DOWNSAMPLED 1-s2.0-S0926860X19302704-gr3.jpg https://s3.amazonaws.com/prod-ucs-content-store-us-east/content/pii:S0926860X19302704/gr3/DOWNSAMPLED/image/jpeg/62cc190965522c00eb391a9b17bf1243/gr3.jpg gr3 gr3.jpg jpg 126431 535 567 IMAGE-DOWNSAMPLED 1-s2.0-S0926860X19302704-gr2.jpg https://s3.amazonaws.com/prod-ucs-content-store-us-east/content/pii:S0926860X19302704/gr2/DOWNSAMPLED/image/jpeg/be1ff4adfe85130863c95ebad6288c46/gr2.jpg gr2 gr2.jpg jpg 25119 283 341 IMAGE-DOWNSAMPLED 1-s2.0-S0926860X19302704-ga1.jpg https://s3.amazonaws.com/prod-ucs-content-store-us-east/content/pii:S0926860X19302704/ga1/DOWNSAMPLED/image/jpeg/6004628e4974277e29434fe25000253b/ga1.jpg ga1 true ga1.jpg jpg 19725 115 500 IMAGE-DOWNSAMPLED 1-s2.0-S0926860X19302704-gr1.jpg https://s3.amazonaws.com/prod-ucs-content-store-us-east/content/pii:S0926860X19302704/gr1/DOWNSAMPLED/image/jpeg/4afa427cf8b50ba3c81d862a9cbb7449/gr1.jpg gr1 gr1.jpg jpg 22859 259 341 IMAGE-DOWNSAMPLED 1-s2.0-S0926860X19302704-gr9.jpg https://s3.amazonaws.com/prod-ucs-content-store-us-east/content/pii:S0926860X19302704/gr9/DOWNSAMPLED/image/jpeg/22e0c30b8a202a2c68e6cd80bf106449/gr9.jpg gr9 gr9.jpg jpg 91977 466 567 IMAGE-DOWNSAMPLED 1-s2.0-S0926860X19302704-gr8_lrg.jpg https://s3.amazonaws.com/prod-ucs-content-store-us-east/content/pii:S0926860X19302704/gr8/HIGHRES/image/jpeg/5f381a6abbbf1470fc222f537dba2538/gr8_lrg.jpg gr8 gr8_lrg.jpg jpg 576371 2063 2510 IMAGE-HIGH-RES 1-s2.0-S0926860X19302704-gr7_lrg.jpg https://s3.amazonaws.com/prod-ucs-content-store-us-east/content/pii:S0926860X19302704/gr7/HIGHRES/image/jpeg/1f4bd548fa2cde57188bf159ac3cf60c/gr7_lrg.jpg gr7 gr7_lrg.jpg jpg 388470 1306 1510 IMAGE-HIGH-RES 1-s2.0-S0926860X19302704-gr6_lrg.jpg https://s3.amazonaws.com/prod-ucs-content-store-us-east/content/pii:S0926860X19302704/gr6/HIGHRES/image/jpeg/0d51eb3ce22f223965d4d80f214d1167/gr6_lrg.jpg gr6 gr6_lrg.jpg jpg 636934 2030 2510 IMAGE-HIGH-RES 1-s2.0-S0926860X19302704-gr5_lrg.jpg https://s3.amazonaws.com/prod-ucs-content-store-us-east/content/pii:S0926860X19302704/gr5/HIGHRES/image/jpeg/4d4f52e87f04276744c8a34b34b72283/gr5_lrg.jpg gr5 gr5_lrg.jpg jpg 325745 1075 2510 IMAGE-HIGH-RES 1-s2.0-S0926860X19302704-gr4_lrg.jpg https://s3.amazonaws.com/prod-ucs-content-store-us-east/content/pii:S0926860X19302704/gr4/HIGHRES/image/jpeg/e5dfabcffd6bb6c7ba59ce47b247b7b6/gr4_lrg.jpg gr4 gr4_lrg.jpg jpg 416324 1187 1510 IMAGE-HIGH-RES 1-s2.0-S0926860X19302704-gr3_lrg.jpg https://s3.amazonaws.com/prod-ucs-content-store-us-east/content/pii:S0926860X19302704/gr3/HIGHRES/image/jpeg/ecc3ad3e215cdb06cb495b05857547cc/gr3_lrg.jpg gr3 gr3_lrg.jpg jpg 1323219 2367 2510 IMAGE-HIGH-RES 1-s2.0-S0926860X19302704-gr2_lrg.jpg https://s3.amazonaws.com/prod-ucs-content-store-us-east/content/pii:S0926860X19302704/gr2/HIGHRES/image/jpeg/f3b99810b4adab5261789345c13a71c6/gr2_lrg.jpg gr2 gr2_lrg.jpg jpg 453410 1251 1510 IMAGE-HIGH-RES 1-s2.0-S0926860X19302704-ga1_lrg.jpg https://s3.amazonaws.com/prod-ucs-content-store-us-east/content/pii:S0926860X19302704/ga1/HIGHRES/image/jpeg/626a46eabe024c3a38cf46c78585cce8/ga1_lrg.jpg ga1 true ga1_lrg.jpg jpg 146008 507 2213 IMAGE-HIGH-RES 1-s2.0-S0926860X19302704-gr1_lrg.jpg https://s3.amazonaws.com/prod-ucs-content-store-us-east/content/pii:S0926860X19302704/gr1/HIGHRES/image/jpeg/47e3ffce9c2c4cb8536cc701fc19a6e5/gr1_lrg.jpg gr1 gr1_lrg.jpg jpg 357311 1149 1510 IMAGE-HIGH-RES 1-s2.0-S0926860X19302704-gr9_lrg.jpg https://s3.amazonaws.com/prod-ucs-content-store-us-east/content/pii:S0926860X19302704/gr9/HIGHRES/image/jpeg/ada348c28daee80d8bce5a03cf24cd38/gr9_lrg.jpg gr9 gr9_lrg.jpg jpg 782361 2062 2510 IMAGE-HIGH-RES 1-s2.0-S0926860X19302704-am.pdf am am.pdf pdf 5478973 AAM-PDF https://s3-eu-west-1.amazonaws.com/prod-ucs-content-store-eu-west/content/egi:1010TLVM8M3/MAIN/application/pdf/0503ea3241b1bfb38b1e93a632a1556b/am.pdf https://s3.amazonaws.com/prod-ucs-content-store-us-east/content/egi:1010TLVM8M3/MAIN/application/pdf/0503ea3241b1bfb38b1e93a632a1556b/am.pdf APCATA 117116 117116 S0926-860X(19)30270-4 10.1016/j.apcata.2019.117116 Elsevier B.V. Fig. 1 Stability of the Pt-Au/TiO2-CeO2 catalyst for the co-oxidation of HCHO, H2 and CO, Reaction gas: 100 ppm HCHO, 100 ppm H2 and 4000 ppm CO, and air with 51% RH, GHSV = 300,000 h−1, 25 °C. Fig. 1 Fig. 2 XRD patterns of the fresh and deactivated catalysts. Fig. 2 Fig. 3 HRTEM images of the (a) fresh and (b) deactivated catalysts, (c) and (d) CeO2 nanospheres. Fig. 3 Fig. 4 H2-TPR profiles of the fresh and deactivated catalysts. Fig. 4 Fig. 5 Au (a) and Pt4f (b) XPS spectra of the fresh and deactivated catalysts. Fig. 5 Fig. 6 Ce3d, Ti2p, C1 s, and O1 s XPS spectra of the fresh and deactivated Pt–Au/TiO2-CeO2 catalysts. Fig. 6 Fig. 7 O2-TPO profiles of the deactivated Pt-Au/TiO2-CeO2catalyst. Fig. 7 Fig. 8 In situ DRIFT spectra of fresh Pt-Au/TiO2-CeO2 catalyst in different atmospheres at room temperature: (a) 4000 ppm CO + Air; (b)100 ppm H2 + Air; (c)100 ppm HCHO + Air. Fig. 8 Fig. 9 In situ DRIFT spectra of fresh Pt-Au/TiO2-CeO2 catalyst in different atmospheres at room temperature: (a) 4000 ppm CO + 100 ppm H2 + Air; (b) 4000 ppm CO + 100 ppm HCHO + Air; (c) 100 ppm H2 + 100 ppm HCHO + Air; (d) 4000 ppm CO + 100 ppm H2 + 100 ppm HCHO + Air. Fig. 9 Table 1 the assignments of IR bands in DRIFTS experiments. Table 1 band position (cm−1) assignment Reference 3692 hydroxyl groups [42,43,44,45,46] 3421 Isolated hydroxyl groups υ(OH) [47] 2840 υ(CH) [37] 2166 CO adsorbed on Au species [15,48,49] 2092 CO adsorbed on Pt species [23,50,51] 1670 Water δ(H-O-H) [49] 1640 adsorbed water δ(H-O-H) [37] 1590 asymmetric υas(COO) stretch [37] 1460, 1386 symmetric υs(COO) stretch [35] Deactivation of Pt-Au/TiO2-CeO2 catalyst for co-oxidation of HCHO, H2 and CO at room temperature: Degradations of active sites and mutual influence between reactants Xiaowei Hong a b Jianjun Chen a b ⁎ Yue Peng a b Hua Song a b Chizhong Wang a b Junhua Li a b a State Key Joint Laboratory of Environment Simulation and Pollution Control, School of Environment, Tsinghua University, Beijing, 100084, PR China State Key Joint Laboratory of Environment Simulation and Pollution Control School of Environment Tsinghua University Beijing 100084 PR China State Key Joint Laboratory of Environment Simulation and Pollution Control, School of Environment, Tsinghua University, Beijing 100084, PR China b National Engineering Laboratory for Multi Flue Gas Pollution Control Technology and Equipment, Beijing, 100084, PR China National Engineering Laboratory for Multi Flue Gas Pollution Control Technology and Equipment Beijing 100084 PR China National Engineering Laboratory for Multi Flue Gas Pollution Control Technology and Equipment, Beijing, 100084, PR China ⁎ Corresponding author at: State Key Joint Laboratory of Environment Simulation and Pollution Control, School of Environment, Tsinghua University, Beijing, 100084, PR China. State Key Joint Laboratory of Environment Simulation and Pollution Control School of Environment Tsinghua University Beijing 100084 PR China Graphical abstract Pt-Au/TiO2-CeO2 catalyst for the co-oxidation of HCHO, H2 and CO at 25 °C. The deactivation origins of the Pt-Au/TiO2-CeO2 catalyst for co-oxidation of formaldehyde (HCHO), hydrogen (H2) and carbon monoxide (CO) at room temperature were studied by means of XRD, BET, H2-TPR, O2-TPD, XPS and in-situ DRIFTS. The results suggested that the catalyst deactivation was mainly caused by the reduction of Au+ species, the decrease of Ce3+ species and interaction weakness between active components and support. Moreover, during the co-oxidation process, CO showed a negative influence on the oxidation of HCHO and H2 due to the CO self-poisoning effect, whereas H2 promoted the oxidation of HCHO and CO because of the generation of OOH and OH active intermediates from the H2 oxidation. Meanwhile, the accumulations of carbonate-like species as well as the production of H2O on the deactivated catalyst were also observed, accounting for the complete catalyst deactivation. Keywords Deactivation HCHO H2 CO Pt-Au/TiO2-CeO2 catalyst 1 Introduction Space capsule is important for the development of scientific research. In space capsule, formaldehyde (HCHO), hydrogen (H2) and carbon monoxide (CO) coexist, which originate respectively from the degradation process of macromolecular compounds, the charge-discharge procedure of battery, and human metabolism processes [1–3]. Long-time exposure to HCHO and CO would endanger human health [4], and H2 is inflammable and explosive. Therefore, it is necessary to develop new technologies to simultaneously remove HCHO, H2 and CO [5]. Supported noble metals catalysts always present completely different catalytic properties than noble metals and supports (metal oxides). This may be due to the strong interaction between the noble metal nanoparticle and the oxide support, which can significantly facilitate the catalytic activity [6,7]. Noble metal catalysts presented good catalytic activity on the removal of HCHO, H2 and CO. Pt catalysts showed high activity for the oxidation HCHO. It can be attributed to that formate species were easily decomposed to CO and then CO was oxidized to CO2 over these catalysts [6,7]. Meanwhile, H2 was facilely dissociated on these catalysts due to its low activation barrier of OH formation [8–11]. However, these catalysts were easily poisoned by CO attributed to the CO self-poisoning effect [12–14]. CO was more favorably adsorbed by Pt active species because of its higher sticking coefficient than that of O2 when CO could not be completely oxidized [12], which inhibited the effective O2 adsorption and resulted in the Pt catalyst deactivation. Au catalysts can weaken the CO self-poisoning effect and eliminate CO at low temperature (< 0 °C) [15,16], because activation energy barrier for CO oxidation on Au catalyst (0.18 eV) is lower than that those of Pt catalyst (0.96 eV) [11]. Due to the co-existence of HCHO, H2 and CO in space capsule [6], Pt-Au bimetallic catalyst was accordingly proposed for the co-oxidation of H2, CO and HCHO at room temperature. Previous studies [17,18] have suggested that bimetal catalyst showed high activity due to the synergetic effect between individual active site. Na et al. [17] have reported that Pt-Au bimetal catalyst presented higher catalytic activity than single Pt or Au catalysts for the simultaneous removal of CO and HCHO at 25 °C. While single Pd or Au catalysts can not co-oxide H2 and CO, supported Au-Pd/Fe(OH)x catalyst presents high activity for the simultaneous removal of CO and H2 [18]. Our previous reports showed that the catalytic activity of bimetallic Pt-Au/CeO2 catalyst was strongly influenced by preparation method [7] and doping TiO2 [19] into CeO2 support. The Pt-Au/TiO2-CeO2 catalyst with 5% (wt) TiO2 doped into CeO2 support showed the best activity for the simultaneous removal of CO, HCHO and H2 at 25 °C. Although massive studies reported deactivation mechanism of single noble metal catalyst [8,11,12,20], few works have been referred to the deactivation mechanism of the bimetal catalyst (Pt-Au) and mutual influence between reactants for the simultaneous removal of CO, HCHO and H2 at room temperature. Based on our previous studies [7,19], the bimetallic Pt-Au/TiO2-CeO2 catalyst was selected for the co-oxidation of CO, HCHO and H2 at room temperature. This work was focused on the deactivation mechanism and mutual influence between reactants on this catalyst. The deactivated catalyst was obtained after running for 75 h, then it was characterized using X-ray photoelectron spectroscopy (XPS), High Resolution Transimission Electron Microscop (HRTEM), and temperature programmed studies. The key intermediate species during reaction were identified with in-situ diffuse reflectance infrared Fourier transform spectroscopy (In-situ DRIFTS) and the deactivation mechanisms were proposed. 2 Experimental section 2.1 Catalyst preparation CeO2 nanosphere was obtained through the hydrothermal method [18]. TiO2-CeO2 support (mTiO2/mCeO2 = 5%) was obtained by the direct precipitation method. CeO2 nanospheres were added into the tetra-n-butyl titanate ethanol solution, and the suspension was stirred for 2 h. Then pH value of the suspension was adjusted to 10 by ammonia solution. After that the suspension was filtered, solid sample was washed with ultra-pure water for three times. Solid sample was dried at 120 °C for 12 h. Then solid sample was calcined at 400 °C for 2 h under air. Pt-Au/TiO2-CeO2 catalyst was prepared by reduction and deposition precipitation method [21], and mole ratios of Ti/Ce and Au/Pt on the fresh sample were 5 % and 1 %, respectively. 4 g TiO2-CeO2 support was dispersed into the H2PtCl6 solution (0.04 g Pt) with being stirred for 2 h. Then NaOH solution was added into the suspension to adjust pH value (10). After that NaBH4 solution, with the molar ratio of NaBH4/Pt = 10, was fleetly dispersed into the suspension. The suspension was stirred for 2 h at 25 °C. Then suspension was filtered out, and solid was washed with ultra-pure water for three times. The solid sample was dried at 80 °C for 12 h under vacuum. 2 g Pt/TiO2-CeO2 and 0.8 g urea were added into the HAuCl4 solution (0.02 g Au). The suspension was keeped being stirred for 8 h at 80 °C, and then was aged at 25 °C for 12 h. The suspension was filtered out, and then was washed with ultra-pure water for three times. At last, solid sample was dried for 12 h under vacuum at 25 °C to get Pt-Au/TiO2-CeO2 catalyst. 2.2 Catalyst characterization XRD patterns were operated by a Shimadzu XRD-6000 diffractometer at 40 kV and 40 mA, with nickel-filtered Cu Kα (λ =0.1542 nm) radiation. Pt-Au/TiO2-CeO2 catalyst was added into ethanol under ultrasonic for 2 h to prepare HRTEM samples. HRTEM micrographs were obtained through a JEM-2100 F microscope. BET surface area of the catalyst was tested through N2 adsorption-desorption isotherms, on a Micromeritics ASAP 2000 instrument at low temperature. Before BET surface area test, catalyst sample was pretreated under vacuum at 300 °C for 6 h. Moreover, the pressure range (P/P0) of points was selected at 0.05-0.3 for BET surface area calculation. The surface chemical state of catalyst was investigated through XPS, PHI Quantro SXM ULVAC-PHI, Japan. The test was operated at 15 kV and 25 W using an Al Kα X-ray source (1486.7 eV). The binding energy calibrated by C 1s was at 284.8 eV. H2-TPR measurements were tested in a fixed bed microreactor, equipped with a mass spectrometer (Omnistar, GSD-301-O2). Before test, 0.2 g sample was pretreated for 1 h at 120 °C under Ar. Cooling to 25 °C, the catalyst was pretreated by 5% H2/N2 at 50 mL min−1. At the same time, the system temperature increased from 30 to 680 °C at the rate of 10 °C min−1. O2-TPO analysis was tested on a mass spectrometer OmniStar. 40 mg sample in a quartz reactor was pretreated with a He flow at 120 °C for 1 h. When the system temperature increased to 500 °C at a rate of 10 °C min−1 with the a 4% O2/He gas flow, the signals of O2, CO2 and H2O were collected. In-situ DRIFTS spectra were obtained through a Nicolet 6700 FTIR spectrometer. Before the experiments, catalyst sample was pretreated for 30 min at 120 °C under Ar. After the system was cooled to 25 °C, the reactant gas mixture (at 100 mL min−1) was led into the DRIFT cell. All spectra were collected with 4 cm-1 resolution through 32 scans accumulation. 2.3 Measurement of the catalytic activity Activity test for the simultaneous removal of HCHO, H2 and CO was investigated with 0.36 g catalyst sample at 25 °C. Before activity test, catalyst sample was pretreated for 1 h at 120 °C under Ar. After the system was cooled to 25 °C, the reaction gas contained 100 ppm HCHO, 100 ppm H2, 4000 ppm CO, and air with 50% RH (relative humidity), was led into the reactor at 2100 mL min−1, corresponding to 300,000 h-1 (GHSV). Gaseous HCHO was generated by flowing nitrogen through the paraformaldehyde container in a water bath kept at 35 °C. HCHO was tested through an acetylacetone-based spectrophotometric method. H2 was tested through a gas chromatograph (GC), CO and CO2 were tested by another gas chromatograph (GC) with a CH4 converter. 3 Results and discussion 3.1 Catalytic performance The catalytic performance of Pt-Au/TiO2-CeO2 catalyst for the co-oxidation of HCHO, H2 and CO was investigated at 25 °C. As shown in Fig. 1 , the catalytic process can be divided into two stages. The 1st stage sustained around 20 h, during which the conversions of HCHO, H2 and CO are comparatively stable, maintaining at 80%, 77% and 85%, respectively. The 2nd stage, starting from 20 h, was characterized by the quick decrease of catalytic activity until 0 with time on stream. However, the conversions of HCHO, H2 and CO did not decrease synchronously. The catalytic oxidation activity of HCHO and H2 are very low after 60 h while the conversion of CO is still around 60%. This activity result indicates that the active sites for the oxidation of HCHO and H2 are different from that for the oxidation of CO. To elucidate the origins of the deactivation of Pt-Au/TiO2-CeO2 catalyst during the HCHO, H2 and CO co-oxidation process, physicochemical properties of the fresh and deactivated catalysts were further investigated. 3.2 Physicochemical properties of catalysts Firstly, the XRD patterns of the fresh and deactivated Pt-Au/TiO2-CeO2 catalysts were performed and shown in the Fig. 2 . It is obviously found that all diffraction peaks are attributed to cubic CeO2 (JCPDS 43-1002), and no diffraction peaks assigned to TiO2, Pt and Au species are detected in all catalyst samples. Furthermore, diffraction peak intensity of deactivated catalyst is a little bit lower than that of fresh catalyst, suggesting that physicochemical property of CeO2 has been modified [21]. The HRTEM images of the fresh and deactivated Pt-Au/TiO2-CeO2 catalysts as well as the CeO2 nanospheres are shown in Fig. 3 . The reflection through a d spacing value of 0.23 nm attributed to Pt (111) plane and the Au (200) reflection through a d spacing value of 0.20 nm present in both fresh and deactivated Pt-Au/TiO2-CeO2 samples [22]. No obvious aggregation of Pt and Au species can be observed in two samples, which is in accordance with the XRD results. Therefore, the particle growth of Pt and Au species probably is not the origin of catalyst deactivation. It is worth mentioning that BET surface areas of fresh and deactivated catalyst are 133.6 and 110.7 m2 g−1, respectively, which suggests that the decrease of BET surface area should not be the main origin of catalyst deactivation. Fig. 4 shows H2-TPR profiles of the fresh and deactivated catalysts. For the fresh catalyst, four reduction peaks are observed at 70, 144, 322, and 451 °C, respectively. The reduction temperature of cationic Pt species is in the range of 70–100 °C [23] and the peak at 70 °C is assigned to the reduction of cationic Pt species. The peak at 144 °C is assigned to the reduction of cationic Au species [24], and the peak at 322 °C is assinged to the reduction of surface oxygen species on CeO2 [25]. The peak at 451 °C can be attributed to the reduction of surface CeO2 (Ce4+ to Ce3+) [26]. However, there are only two reduction peaks at 144 and 469 °C were observed over the deactivated catalyst. The reduction peak at 70 °C disappears, which reveals the absence of cationic Pt species. The reduction peak intensity at 144 °C is lower than that on fresh catalyst, meaning that the loss of cationic Au species occurs during the reaction. The reduction peak at 322 °C disappears is due to the CeO2 surface oxygen was completely consumed on the deactivated catalyst. In addition, the reduction temperature of CeO2 shifts to higher temperature, suggesting that the reduction of CeO2 is more difficult on the deactivated catalyst. Reduction peak changes of CeO2 surface oxygen and surface CeO2 may be caused by the interaction change between CeO2 and TiO2 [21]. XPS measurement was performed to study the chemical states of active species on the fresh and deactivated Pt-Au/TiO2-CeO2 catalysts. Fig. 5 shows Au and Pt4f spectra of the fresh and deactivated catalysts. The peaks at 83.7 and 84.6 eV are assigned to Au0 and Au+ respectively [27]. Results of the Au4f spectra suggest that both Au0 and Au+ species exist in the fresh catalyst. However, only Au0 species can be observed in the deactivated catalyst. Previously studies showed that cationic Au species present higher activity than metallic Au species for the CO oxidation [28,29]. Consequently, the decrease of cationic Au species is one of the reasons for the catalyst deactivation. Moreover, the binding energy (BE) of Au4f in deactivated catalyst presents a negative shift of 0.4 ev compared to that of fresh catalyst (84.3 eV). It indicates the reduction of Au speices, which may be cuased by the electron transfer from CeO2 and TiO2 supports to Au+ species, thus increasing the Au species electron density during the co-oxidation process [30,31]. The electron transfer results in the reduction of Au+ species and enhances the interaction between the Au species and support oxides. Therefore, an in-depth understanding and optimization of the strong metal-support interaction (SMSI) occurring at the metal/oxide interface is significantly for the design of high-performance catalysts [15,17–19]. For Pt4f spectra, peaks at 70.7 and 71.6 eV are assigned to Pt0 and Pt2+ respectively [32]. Comparing the Pt4f spectra on fresh and deactivated catalyst, it is speculated that the valence of Pt species did not change significantly during the deactivation process. For the fresh catalyst, a small quantity of Pt2+ species exist, and then they are reduced to Pt0 species during the co-oxidation reaction. The reduction mechanism of Pt2+ species may be similar to that of Au+ species on fresh catalyst. Nevertheless, the surface atomic concentrations of Au and Pt species on the deactivated catalyst (0.38% and 0.39%) measured by XPS are lower than that on the fresh catalyst (0.45% and 0.47%). Flytzani-Stephanopoulos et al. reported that the content of surface Au on Au/CeO2 decreases after preferential oxidation (PROX) reaction. They pointed out that only Au species that is strongly bound to CeO2 appears to be involved in catalyzing the PROX reaction [33,34]. Furthermore, Wang et al. [15] proposed that the disappearance of Auδ+ may indicates the destruction of the strong interaction between Au and CeO2 and a decrease in the amount of Au that is strongly bound to CeO2 in the deactivated catalyst. Therefore, the decrease of surface Au and Pt species concentrations on Pt-Au/TiO2-CeO2 catalyst suggests the destruction of the strong interaction between Au, Pt and CeO2 in the deactivated catalyst. Fig. 6 shows Ce3d, Ti2p, C1 s, and O1 s XPS spectra of the fresh and deactivated Pt-Au/TiO2-CeO2 catalysts. The Ce3d core level spectra of the catalyst include eight components. The bands (labeled as u′ and v′) are assigned to the Ce3+ species. The bands (labeled as u, u′′, u′′′, v, v′′, and v′′′) are attributed to Ce4+ species [35]. The intensities of the signals of u′ and v′ in the fresh catalyst are stronger than that in the deactivated catalyst, meaning the decrease of Ce3+ species content during the co-oxidation reaction. More Ce3+ species promote the interaction between Ce species and the nearby atoms [36]. Guzman et al. [33] reported that Au species contacted with Ce or an oxygen vacancy might possess a positive charge. Chen et al. [37] also proposed that there was charge transfer from Au species to Ce, leading to a higher concentration of Auδ+ species and Ce3+species, although there was no Ce-Au bonding. It can reasonably illustrate the presence of Au+, Pt2+ and Ce3+ species in the fresh catalyst. Therefore the decrease of Ce3+ species concentration on the deactivated catalyst suggests the reduction of the interaction between CeO2, Pt and Au species, which is accordant with Au species XPS results. For Ti2p XPS spectra, the peaks at 456.8 eV and 459.9 eV are attributed to Ti3+ and Ti4+ species, respectively [38]. The content of Ti4+ species (7.5%) in the deactivated catalyst is lower than that (9.1%) in the fresh catalyst, which indicates a reduction of the interaction between TiO2 and CeO2 [39]. The surface Ti/Ce atomic ratios are 0.10 and 0.12 for the fresh and the deactivated catalysts, suggesting that the cerium-rich structure has been modified [21]. The C1 s spectra presents two different carbon species: adventitious carbon species (284.7 eV), and carbonate-like species (formate and carbonate species) (288.8 eV) [21]. Carbonate-like species content on the deactivated catalyst is higher than that on the fresh catalyst, evidently proving that carbonate-like species were generated on the catalyst during the co-oxidation reaction. Carbonate-like species covered the active sites, inhibited the effective activation of O2 and weakened interaction between Au, Pt species and the support. In O1 s spectra, the peaks at 529.7, 531.1 and 533.3 eV are ascribed to lattice oxygen of CeO2 and titanium oxide, carbonate and chemisorbed oxygen, and hydroxides species, respectively [40]. For the deactivated catalyst, the peak for lattice oxygen slightly shifts to the higher BE value than that for the fresh catalyst, which may be caused by the decrease of the surface Ce atomic concentration. Moreover, the peak at 531.1 eV is much stronger than that on the fresh catalyst, meaning that large amounts of carbonate-like species accumulate on the deactivated catalyst surface. In addition, the presence of the peak at 533.3 eV indicates the massive production of H2O species on the deactivated catalyst. Accumulation of numerous carbonate-like and production of H2O species on the active sites may inhibit the effective O2 adsorption and weaken the interaction between active species and support oxides, resulting in the decrease of catalytic activity [18]. In short, XPS results illustrate the chemical property of Pt-Au/TiO2-CeO2 catalyst changes after the co-oxidation of HCHO, H2 and CO at room temperature. The cationic Au and Pt species are reduced to metallic Au and Pt species with the decreasing of Ce3+ species content. In addition, the surface structure of CeO2 is modified, the accumulation of carbonate-like species and production of H2O species are also observed. The chemical and structural transformation may account for the deactivation of Pt-Au/TiO2–CeO2 catalyst. The XPS results show the accumulation of the carbonate-like species and water on the deactivated catalyst. Since carbonaceous species and water can be removed through calcination under air, O2-TPO is carried out to confirm the presence of these species on deactivated catalyst. During the O2-TPO test, the deactivated catalyst was pretreated with a He flow at 120 °C for 1 h, therefore the adsorbed H2O and CO2 at lower temperature should desorb from the deactivated catalyst. In Fig. 7 , CO2 and H2O are detected at 150–250 °C on the deactivated catalyst. Carbon can be oxidized in to CO2 at high temperature (>400 °C) [41], therefore CO2 is probably generated from the carbonate-like species. The production of H2O is mainly from the evaporation of production water and degradation of carbonate-like species. It can be concluded that the presence of CO2 and H2O during O2-TPO test proves the existence of carbonate-like species. Carbonate-like species could inhibit the effective O2 activation and decrease the catalytic activity. O2 consumption can be observed with the generation of CO2. There are three pathways for the O2 consumption. Firstly, decomposition of carbonate-like species should consume O2 and the consumption of oxygen is mainly attributed to degradation of carbonate-like species. Secondly, the consumption of O2 may be a part attributable to supply the defect of lattice oxygen as observed by the peak at 322 K in TPR (Fig. 4). Moreover, the oxidation of Ce3+ and Ti3+ species also consume O2. O2-TPO results suggest the existence of carbonate-like species and water, which is accordant with the XPS results. 3.3 In-situ DRIFTS study of reaction mechanism In order to gain further insights into the reaction mechanism of co-oxidation of HCHO, H2 and CO, in-situ DRIFT spectra of the fresh Pt-Au/TiO2-CeO2 catalyst were investigated under different gas streams at 25 °C. Nine distinct bands present in the in-situ DRIFT spectra. Bands at 3692 and 3421 cm−1 can be assigned to hydroxyl groups υ(OH) stemmed from the adsorbed water (HOH) [42–46] and isolated hydroxyl groups υ(OH) generated from the decomposition of OOH species [47]. 2840 cm−1 band could be attributed to υ(CH) of formate species [37]. 2166 and 2092 cm−1 bands can be assigned to CO adsorbed on Au species [15,48,49] and CO adsorbed on Pt species [23,50,51]. 1670 and 1640 cm−1 bands are attributed to production water δ(HOH) originated from the oxidation of H2 [49] and adsorbed water δ(HOH) [39]. 1590 cm−1 band is assigned to asymmetric υas(COO) stretch of carbonates-like species (formate species or carbonates species) [37]. 1460 and 1386 cm-1 bands can be assigned to symmetric υs(COO) stretch of carbonates-like species (formate species or carbonates species) [37].(Table 1 ). The combination of the adsorbed oxygen and adsorbed hydrogen brought out OOH species, and OOH species are further decomposed into isolated hydroxyl groups [47,52]. Isolated hydroxyl groups can be reacted with adsorbed hydrogen, generating production water. In Fig. 8 a, the peaks at 3692 (hydroxyl groups) and 3421 cm−1 (isolated hydroxyl groups υ(OH)) present negative peak, indicating that OH species participate in the CO oxidation. Previous studies showed that OH species as the active species can effectively oxidize the reactant, enhancing the oxidation reaction [22,53]. CO species gradually accumulate on the catalyst surface with the formation of carbonate species. Fig. 8 b presents the in situ DRIFT spectra of the Pt-Au/TiO2-CeO2 catalyst under H2/Air. Intensity change of peaks at 3692 and 3421 cm-1 indicates that massive OOH species were decomposed into OH species. Intensity change of peak at 1670 cm-1 (water δ(HOH)) means that H2O species are gradually formed. The peak of adsorbed water is at 1640 cm−1, however production H2O species shifts to high wavenumber. It means that H2O species may be strongly adsorbed on active sites and cause the deactivation of catalyst [22]. Furthermore, the production H2O species can condense inside the pores, and consequently the mass transfer of CO, HCHO and H2 to the catalytic sites will be strongly inhibited [21]. In Fig. 8c, no peaks assigned to formaldehyde are tested, suggesting that the adsorbed HCHO could be immediately oxidized on the catalyst. Massive formate species are gradually adsorbed on the catalyst surface according to the peaks intensity at 1590, 1460 and 1386 cm−1. In Fig. 9 a, intensity of the band at 3421 cm−1 is weaker than that in Fig. 8b, indicating that the CO has a negative influence on the H2 oxidation. Previous studies results also show the similar results, due to the CO self-poisoning effect on Pt active species [12,13]. Moreover, intensity of the band at 1590 cm−1 is stronger than that in Fig. 8a, suggesting that H2 promotes the CO oxidation. Wang et al. [21] and Piccolo et al. [47] have proposed that H2 promotion for the CO oxidation is due to the reaction between OOH species or OH species and adsorbed CO species. In Fig. 9b, intensity of the band at 1590 cm−1 is obviously weaker than that in Fig. 8c, which suggests that the presence of CO inhibits the HCHO oxidation because of CO accumulation and self-poisoning effect over Pt catalysts [12,13]. Intensity of the band at 1590 cm−1 in Fig. 9c is stronger than that in Fig. 8c. It indicates that H2 greatly improves the HCHO oxidation and may be due to the highly active OOH species or OH species. Chen et al. [37] have reported that water exhibits positive effect on the HCHO oxidation, due to that water can generate OH species and enhance HCHO removal. Intensity of the band at 1590 cm−1 in Fig. 9d is stronger than that in Fig. 9b, suggesting the H2 promotion on the oxidation HCHO and CO. Intensity of the bands at 1670 and 1590 cm−1 in Fig. 9d are weaker than that in Fig. 9c, showing the presence of CO restrains the oxidation of HCHO and H2. Therefore, CO inhibits the oxidation of H2 and HCHO, and H2 promotes the oxidation of CO and HCHO during co-oxidation reaction. 3.4 Origins of the deactivation on the Pt-Au/TiO2-CeO2 catalyst Generally, Au particle only with small particle size (<30 Å) was reported to be reactive in the atmosphere [54]. To some extent, Au catalyst activity for CO oxidation decreases with the increase of Au species particle size. The HRTEM and XRD results of the fresh and deactivated Pt-Au/TiO2-CeO2 catalysts present the well-dispersion of Pt and Au particles after reaction, indicating the catalyst deactivation probably does not origin from the growth of Pt and Au particles. The catalytic activity and adsorption/desorption behaviors of Au+ species were generally reported to be different from that of Au0 species. For example, in CO oxidation, Au+ species were the active components, while Au0 species were facile deactivated with increasing the reaction time [28]. These could be due to the adsorption of O2 on cationic Au species. The XPS and H2-TPR results in this study show the concentrations of cationic Au and Pt species significantly decreases on the deactivated catalyst, indicating the change in the chemical state of Pt and Au species. Therefore, it can be concluded that the reduction of Au+ and Pt+ species mainly account for the deactivation of Pt-Au/TiO2-CeO2 catalyst. The accumulation of intermediates such as carbonate species and water could also lead to the deactivation of catalyst. On the one hand, carbonate species inhibited the effective O2 activation and led to a reduction of interaction between active species and the support as shown in water-gas shift reaction on Pt/CeO2 catalyst [18,55–57]. In this study, the decrease of surface Au and Pt species concentrations may indicate that the strong interaction between Au and Pt species and support is reduction. The decrease of Ce3+ species amount surrounding Pt and Au species particles may leads to the decrease of the defects sites for oxygen activation. On the other hand, the deactivation of the Pt-Au/TiO2-CeO2 catalyst by the accumulation of carbonates-like and production H2O species may also be caused through covering the active sites. When the active sites are fully blocked by the carbonates-like and production H2O species, catalyst is completely deactivated. Peak area of 1670 and 1590 cm−1 in Fig. 9c is higher than that in Fig. 9d, suggesting that the presence of CO hinders the formation of carbonates-like and production H2O species on catalyst. It is attributed to the CO self-poisoning effect on Pt active species [55]. So, CO inhibits the oxidation of H2 and HCHO during co-oxidation reaction, which accounts for the decrease of H2 and HCHO conversions in Fig. 1. Peak area of 1590 cm−1 in Fig. 9d is higher than that in Fig. 9b, which suggests that H2 enhances the generation of carbonates-like species. It is caused by the formation of highly active OOH species or OH species during H2 oxidation [37]. Consequently, H2 promotes the CO and HCHO oxidation during the co-oxidation reaction. 4 Conclusions The origins of the deactivation of the Pt-Au/TiO2-CeO2 catalyst during the co-oxidation of CO, HCHO and H2 at room temperature were studied. Based on the above results, the deactivation of the catalyst was mainly attributed to the intrinsic change in the chemical state of the Au, Pt and Ce species, the formation of carbonates-like and production H2O species on catalyst active sites. Continuous accumulation of carbonates-like and production H2O species finally caused the total deactivation. Identification of key intermediate species suggests that mutual influence between CO, HCHO and H2 reactants are as follows: CO inhibited the oxidation of H2 and HCHO, and H2 promoted the oxidation of CO and HCHO during co-oxidation reaction. Acknowledgements This work was supported by the National Key Research and Development Program of China (Grant No. 2018YFB0605200, 2017YFC0210700), and the National Natural Science Foundation of China (No. 21606047 and 21876093). References [1] T.J. Schmidt M. Noeske H.A.G. And R.J. Behm P. Britz A.W. Brijoux H. Bönnemann Langmuir 13 1997 2591 2595 T. J. Schmidt, M. Noeske, H. A. G. And, R. J. Behm, P. Britz, A. W. Brijoux, H. Bönnemann, Langmuir. 13 (1997) 2591–2595. [2] M. Ojeda S. Rojas M. Boutonnet F.J. Pérez-Alonso F.J. Garcı́A-Garcı́A J.L.G. Fierro Appl. Catal. A 274 2010 33 41 M. Ojeda, S. Rojas, M. Boutonnet, F. J. Pérez-Alonso, F. J. Garcı́A-Garcı́A, J. L. G. Fierro, Appl. Catal. A. 274 (2010) 33–41. [3] W.C. Wang S.X. Zhou Y.Y. Jiang M.J. Yang Environ. Sci. Technol. 29 2006 106 108 W. C. Wang, S. X. Zhou, Y. Y. Jiang, M. J. Yang, Environ. Sc. Technol. 29 (2006) 106–108. [4] P.W. Seo H.J. Choi S.I. Hong S.C. Hong J. Hazard. Mater. 178 2010 917 925 P. W. Seo, H. J. Choi, S. I. Hong, S. C. Hong, J. Hazard. Mater. 178 (2010) 917–925. [5] S. Scirè S. Minicò C. Crisafulli C. Satriano A. Pistone Appl. Catal. B 40 2003 43 49 S. Scirè, S. Minicò, C. Crisafulli, C. Satriano, A. Pistone, Appl. Catal. B. 40 (2003) 43–49. [6] C. Zhang H. He Catal. Today 126 2007 345 350 C. Zhang, H. He, Catal. Today. 126 (2007) 345–350. [7] X. Hong Y. Sun T. Zhu Z. Liu Catal. Sci. Technol. 6 2016 3606 3615 X. Hong, Y. Sun, T. Zhu, Z. Liu, Catal. Sci. Technol. 6 (2016) 3606–3615. [8] M.T. Janicke H. Kestenbaum U. Hagendorf F. Schüth M. Fichtner K. Schubert J. Catal. 191 2000 282 293 M.T. Janicke, H. Kestenbaum, U. Hagendorf, F. Schüth, M. Fichtner, K. Schubert, J. Catal. 191 (2000) 282–293. [9] Y. Voloshin R. Halder A. Lawal Catal. Today 125 2007 40 47 Y. Voloshin, R. Halder, A. Lawal, Catal. Today. 125 (2007) 40–47. [10] M. Jones T. Nevell J. Catal. 122 1990 219 229 M. Jones, T. Nevell, J. Catal. 122 (1990) 219–229. [11] S. Kandoi A.A. Gokhale L.C. Grabow J.A. Dumesic M. Mavrikakis Catal. Lett. 93 2004 93 100 S. Kandoi, A. A. Gokhale, L. C. Grabow, J. A. Dumesic, M. Mavrikakis, Catal. Lett. 93 (2004) 93–100. [12] X. Zheng J. Mantzaras R. Bombach Combust. Flame 161 2014 332 346 X. Zheng, J. Mantzaras, R. Bombach, Combustion & Flame. 161 (2014) 332–346. [13] T. Schmidt Z. Jusys H. Gasteiger R. Behm U. Endruschat H. Boennemann J. Electroanal. Chem. 501 2001 132 140 T. Schmidt, Z. Jusys, H. Gasteiger, R. Behm, U. Endruschat, H. Boennemann, J. Electroanal. Chem. 501 (2001) 132–140. [14] P. Liu A. Logadottir J.K. Nørskov Electrochim. Acta 48 2003 3731 3742 P. Liu, A. Logadottir, J. K. Nørskov, Electrochim Acta. 48 (2003) 3731–3742. [15] H. Wang H. Zhu Z. Qing F. Liang G. Wang J. Wang J. Catal. 2009 154 162 H. Wang, H. Zhu, Z. Qing, F. Liang, G. Wang, J. Wang, J. Catal. 2009, 154–162. [16] M. Haruta N. Yamada T. Kobayashi S. Iijima J. Catal. 115 1989 301 309 M. Haruta, N. Yamada, T. Kobayashi, S. Iijima, J. Catal. 115 (1989) 301–309. [17] H. Na T. Zhu Z. Liu Catal. Sci. Technol. 4 2014 2051 2057 H. Na, T. Zhu, Z. Liu, Catal. Sci. Technol. 4 (2014) 2051–2057. [18] B. Qiao A. Wang M. Takahashi Y. Zhang J. Wang Y. Deng T. Zhang J. Catal. 279 2011 361 365 B. Qiao, A. Wang, M. Takahashi, Y. Zhang, J. Wang, Y. Deng, T. Zhang, J. Catal. 279 (2011) 361–365. [19] X. Hong Y. Sun T. Zhu Z. Liu Molecules 22 2017 351 X. Hong, Y. Sun, T. Zhu, Z. Liu, Molecules. 22 (2017) 351. [20] L. Ma D. Wang J. Li B. Bai L. Fu Y. Li Appl. Catal. B 148–149 2014 36 43 L. Ma, D. Wang, J. Li, B. Bai, L. Fu, Y. Li, Appl. Catal. B. 148–149 (2014) 36–43. [21] H. Wang H. Zhu Z. Qin F. Liang G. Wang J. Wang J. Catal. 264 2009 154 162 H. Wang, H. Zhu, Z. Qin, F. Liang, G. Wang, J. Wang, J. Catal. 264 (2009) 154–162. [22] X. Hong Y. Sun T. Zhu Z. Liu Appl. Surf. Sci. 396 2017 226 234 X. Hong, Y. Sun, T. Zhu, Z. Liu, Appl. Surf. Sci. 396 (2017) 226–234. [23] H. Na T. Zhu Z. Liu Catal. Sci. Technol. 4 2014 2051 2057 H. Na, T. Zhu, Z. Liu, Catal. Sci. Technol. 4 (2014) 2051–2057. [24] H.F. Li N. Zhang P. Chen M.F. Luo J.Q. Lu Appl. Catal. B 110 2011 279 285 H. F. Li, N. Zhang, P. Chen, M. F. Luo, J. Q. Lu, Appl. Catal., B. 110 (2011) 279–285. [25] Y.C. Chen K.B. Chen C.S. Lee M.C. Lin J. Phys. Chem. C 113 2009 5031 5034 Y. C. Chen, K. B. Chen, C. S. Lee, M. C. Lin, J. Phys. Chem. C. 113 (2009) 5031–5034. [26] K. Qian S. Lv X. Xiao H. Sun J. Lu M. Luo W. Huang J. Mol. Catal. A Chem. 306 2009 40 47 K. Qian, S. Lv, X. Xiao, H. Sun, J. Lu, M. Luo, W. Huang, J. Mol. Catal. A Chem. 306 (2009) 40–47. [27] D.A. Bulushev I. Yuranov E.I. Suvorova P.A. Buffat L. Kiwi-Minsker J. Catal. 224 2004 8 17 D. A. Bulushev, I. Yuranov, E. I. Suvorova, P. A. Buffat, L. Kiwi-Minsker, J. Catal. 224 (2004) 8–17. [28] B. Qiao J. Zhang L. Liu Y. Deng Appl. Catal. A 340 2008 220 228 B. Qiao, J. Zhang, L. Liu, Y. Deng, Appl. Catal. A. 340 (2008) 220–228. [29] G. Hutchings M. Hall A. Carley P. Landon B. Solsona C. Kiely A. Herzing M. Makkee J. Moulijn A. Overweg J. Catal. 242 2006 71 81 G. Hutchings, M. Hall, A. Carley, P. Landon, B. Solsona, C. Kiely, A. Herzing, M. Makkee, J. Moulijn, A. Overweg, J. Catal. 242 (2006) 71–81. [30] A. Zwijnenburg A. Goossens W.G. Sloof M.W.J. Crajé A.M.V.D. Kraan L.J.D. Jongh M. Makkee J.A. Moulijn J. Phys. Chem. B 106 2002 9853 9862 A. Zwijnenburg, A. Goossens, W.G. Sloof, M.W.J. Crajé, A.M.V.D. Kraan, L.J.D. Jongh, M. Makkee, J.A. Moulijn, J. Phys. Chem. B 106 (2002) 9853–9862. [31] C. Huang M. Zhu L. Kang X. Li B. Dai Chem. Eng. J. 242 2014 69 75 C. Huang, M. Zhu, L. Kang, X. Li, B. Dai, Chem. Eng. J. 242 (2014) 69–75. [32] N. An Q. Yu L. Gang S. Li M. Jia W. Zhang J. Hazard. Mater. 186 2011 1392 1397 N. An, Q. Yu, L. Gang, S. Li, M. Jia, W. Zhang, J. Hazard. Mater. 186 (2011) 1392–1397. [33] M. Manzoli F. Boccuzzi A. Chiorino F. Vindigni W. Deng M. Flytzani-Stephanopoulos J. Catal. 245 2007 308 315 M. Manzoli, F. Boccuzzi, A. Chiorino, F. Vindigni, W. Deng, M. Flytzani-Stephanopoulos, J. Catal. 245 (2007) 308–315. [34] W. Deng J.D. Jesus H. Saltsburg M. Flytzani-Stephanopoulos Appl. Catal. A 291 2005 126 135 W. Deng, J. D. Jesus, H. Saltsburg, M. Flytzani-Stephanopoulos, Appl. Catal. A 291 (2005) 126–135. [35] W.P. Shan F.D. Liu H. He X.Y. Shi C.B. Zhang Appl. Catal. B 115 2012 100 106 W. P. Shan, F. D. Liu, H. He, X. Y. Shi, C. B. Zhang, Appl. Catal. B. 115 (2012) 100–106. [36] K. Min W.S. Min H.L. Chang Appl. Catal. A 251 2003 143 156 K. Min, W. S. Min, H. L. Chang, Appl. Catal. A. 251 (2003) 143–156. [37] B.B. Chen C. Shi M. Crocker Y. Wang A.-M. Zhu Appl. Catal. B 132–133 2013 245 255 B. B. Chen, C. Shi, M. Crocker, Y. Wang, A.-M. Zhu, Appl. Catal. B. 132–133 (2013) 245–255. [38] N. Feng Q. Wang A. Zheng Z. Zhang J. Fan S.B. Liu J.P. Amoureux F. Deng J. Am. Chem. Soc. 135 2015 1607 1616 N. Feng, Q. Wang, A. Zheng, Z. Zhang, J. Fan, S.B. Liu, J.P. Amoureux, F. Deng, J. Am. Chem. Soc. 135 (2015) 1607–1616. [39] Q. Guo Y. Liu Appl. Catal. B 82 2008 19 26 Q. Guo, Y. Liu, Appl. Catal. B. 82 (2008) 19–26. [40] W. Shan F. Liu H. He X. Shi C. Zhang Appl. Catal. B 115–116 2012 100 106 W. Shan, F. Liu, H. He, X. Shi, C. Zhang, Appl. Catal. B. 115–116 (2012) 100–106. [41] J. Jansson J. Catal. 194 2000 55 60 J. Jansson, J. Catal. 194 (2000) 55–60. [42] C.B. Zhang F.D. Liu Y.P. Zhai H. Ariga N. Yi Y.C. Liu K. Asakura M. Flytzani-Stephanopoulos H. He Angew. Chem. Int. Ed. 51 2012 9628 9632 C. B. Zhang, F. D. Liu, Y. P. Zhai, H. Ariga, N. Yi, Y.C. Liu, K. Asakura, M. Flytzani-Stephanopoulos, H. He, Angew. Chem. Int. Ed. 51 (2012) 9628–9632. [43] S. Sun J. Ding J. Bao C. Gao Z. Qi C. Li Catal. Lett. 137 2010 239 246 S. Sun, J. Ding, J. Bao, C. Gao, Z. Qi, C. Li, Catal. Lett. 137 (2010) 239–246. [44] G.H. Enevoldsen H.P. Pinto A.S. Foster M.C. Jensen W.A. Hofer B. Hammer J.V. Lauritsen F. Besenbacher Phys. Rev. Lett. 102 2009 136103 G. H. Enevoldsen, H. P. Pinto, A. S. Foster, M. C. Jensen, W. A. Hofer, B. Hammer, J.V. Lauritsen, F. Besenbacher, Phys. Rev. Lett. 102 (2009) 136103. [45] Y.K. Park P. Aghalayam D.G. Vlachos J. Phys. Chem. A 103 1999 8101 8107 Y. K. Park, P. Aghalayam, D. G. Vlachos, J. Phys. Chem. A. 103 (1999) 8101–8107. [46] S. Aloisio J. Francisco J. Phys. Chem. A 102 1998 1899 1902 S. Aloisio, J. Francisco, J. Phys. Chem. A. 102 (1998) 1899–1902. [47] L. Piccolo H. Daly A. Valcarcel F.C. Meunier Appl. Catal. B 86 2009 190 195 L. Piccolo, H. Daly, A. Valcarcel, F. C. Meunier, Appl Catal. B. 86 (2009) 190–195. [48] A. Chiorino M. Manzoli F. Menegazzo M. Signoretto F. Vindigni F. Pinna F. Boccuzzi J. Catal. 262 2009 169 176 A. Chiorino, M. Manzoli, F. Menegazzo, M. Signoretto, F. Vindigni, F. Pinna, F. Boccuzzi, J. Catal. 262 (2009) 169–176. [49] L. Qi C. Tang L. Zhang X. Yao Y. Cao L. Liu F. Gao L. Dong Y. Chen Appl. Catal. B 127 2012 234 245 L. Qi, C. Tang, L. Zhang, X. Yao, Y. Cao, L. Liu, F. Gao, L. Dong, Y. Chen, Appl. Catal. B. 127 (2012) 234–245. [50] M. Haneda K. Suzuki M. Sasaki H. Hamada M. Ozawa Appl. Catal. A 475 2014 109 115 M. Haneda, K. Suzuki, M. Sasaki, H. Hamada, M. Ozawa, Appl. Catal. A. 475 (2014) 109–115. [51] N. Li Q.Y. Chen L.F. Luo W.X. Huang M.F. Luo G.S. Hu J.Q. Lu Appl. Catal. B 142 2013 523 532 N. Li, Q.Y. Chen, L. F. Luo, W. X. Huang, M. F. Luo, G. S. Hu, J. Q. Lu, Appl. Catal. B. 142 (2013) 523–532. [52] I.X. Green W. Tang M. Neurock J.T. Yates Angew. Chem. Int. Ed. 50 2011 10186 10189 I. X. Green, W. Tang, M. Neurock, J. T. Yates, Angew. Chem. Int. Ed. 50 (2011) 10186–10189. [53] M. Daté M. Haruta J. Catal. 201 2001 221 224 M. Daté, M. Haruta, J. Catal. 201 (2001) 221–224. [54] T. Schmidt Z. Jusys H. Gasteiger R. Behm U. Endruschat H. Boennemann J. Electroanal. Chem. 501 2001 132 140 T. Schmidt, Z. Jusys, H. Gasteiger, R. Behm, U. Endruschat, H. Boennemann, J. Electroanal. Chem. 501 (2001) 132–140. [55] D.K. Lee D.S. Kim T.H. Kim Y.K. Lee S.E. Jeong N.T. Le M.J. Cho S.D. Henam Catal. Today 154 2010 244 249 D. K. Lee, D. S. Kim, T. H. Kim, Y. K. Lee, S. E. Jeong, N. T. Le, M. J. Cho, S. D. Henam, Catal. Today. 154 (2010) 244–249. [56] X. Liu W. Ruettinger X. Xu R. Farrauto Appl. Catal. B 56 2005 69 75 X. Liu, W. Ruettinger, X. Xu, R. Farrauto, Appl. Catal. B. 56 (2005) 69–75. [57] R. Burch Phys. Chem. Chem. Phys. 8 2006 5483 5500 R. Burch, Phys. Chem. Chem. Phys. 8 (2006) 5483–5500.",
      "scopus-id": "85067898374",
      "coredata": {
        "eid": "1-s2.0-S0926860X19302704",
        "dc:description": "The deactivation origins of the Pt-Au/TiO2-CeO2 catalyst for co-oxidation of formaldehyde (HCHO), hydrogen (H2) and carbon monoxide (CO) at room temperature were studied by means of XRD, BET, H2-TPR, O2-TPD, XPS and in-situ DRIFTS. The results suggested that the catalyst deactivation was mainly caused by the reduction of Au+ species, the decrease of Ce3+ species and interaction weakness between active components and support. Moreover, during the co-oxidation process, CO showed a negative influence on the oxidation of HCHO and H2 due to the CO self-poisoning effect, whereas H2 promoted the oxidation of HCHO and CO because of the generation of OOH and OH active intermediates from the H2 oxidation. Meanwhile, the accumulations of carbonate-like species as well as the production of H2O on the deactivated catalyst were also observed, accounting for the complete catalyst deactivation.",
        "openArchiveArticle": "false",
        "prism:coverDate": "2019-07-25",
        "openaccessUserLicense": null,
        "prism:aggregationType": "Journal",
        "prism:url": "https://api.elsevier.com/content/article/pii/S0926860X19302704",
        "dc:creator": [
          {
            "@_fa": "true",
            "$": "Hong, Xiaowei"
          },
          {
            "@_fa": "true",
            "$": "Chen, Jianjun"
          },
          {
            "@_fa": "true",
            "$": "Peng, Yue"
          },
          {
            "@_fa": "true",
            "$": "Song, Hua"
          },
          {
            "@_fa": "true",
            "$": "Wang, Chizhong"
          },
          {
            "@_fa": "true",
            "$": "Li, Junhua"
          }
        ],
        "link": [
          {
            "@_fa": "true",
            "@rel": "self",
            "@href": "https://api.elsevier.com/content/article/pii/S0926860X19302704"
          },
          {
            "@_fa": "true",
            "@rel": "scidir",
            "@href": "https://www.sciencedirect.com/science/article/pii/S0926860X19302704"
          }
        ],
        "dc:format": "application/json",
        "openaccessType": null,
        "pii": "S0926-860X(19)30270-4",
        "prism:volume": "582",
        "articleNumber": "117116",
        "prism:publisher": "Elsevier B.V.",
        "dc:title": "Deactivation of Pt-Au/TiO2-CeO2 catalyst for co-oxidation of HCHO, H2 and CO at room temperature: Degradations of active sites and mutual influence between reactants",
        "prism:copyright": "© 2019 Elsevier B.V. All rights reserved.",
        "openaccess": "0",
        "prism:issn": "0926860X",
        "dcterms:subject": [
          {
            "@_fa": "true",
            "$": "Deactivation"
          },
          {
            "@_fa": "true",
            "$": "HCHO"
          },
          {
            "@_fa": "true",
            "$": "H2"
          },
          {
            "@_fa": "true",
            "$": "CO"
          },
          {
            "@_fa": "true",
            "$": "Pt-Au/TiO2-CeO2 catalyst"
          }
        ],
        "openaccessArticle": "false",
        "prism:publicationName": "Applied Catalysis A: General",
        "openaccessSponsorType": null,
        "prism:pageRange": "117116",
        "pubType": "fla",
        "prism:coverDisplayDate": "25 July 2019",
        "prism:doi": "10.1016/j.apcata.2019.117116",
        "prism:startingPage": "117116",
        "dc:identifier": "doi:10.1016/j.apcata.2019.117116",
        "openaccessSponsorName": null
      },
      "objects": {
        "object": [
          {
            "@category": "thumbnail",
            "@height": "164",
            "@width": "199",
            "@_fa": "true",
            "$": "https://api.elsevier.com/content/object/eid/1-s2.0-S0926860X19302704-gr8.sml?httpAccept=%2A%2F%2A",
            "@multimediatype": "GIF image file",
            "@type": "IMAGE-THUMBNAIL",
            "@size": "10995",
            "@ref": "gr8",
            "@mimetype": "image/gif"
          },
          {
            "@category": "thumbnail",
            "@height": "163",
            "@width": "189",
            "@_fa": "true",
            "$": "https://api.elsevier.com/content/object/eid/1-s2.0-S0926860X19302704-gr7.sml?httpAccept=%2A%2F%2A",
            "@multimediatype": "GIF image file",
            "@type": "IMAGE-THUMBNAIL",
            "@size": "6873",
            "@ref": "gr7",
            "@mimetype": "image/gif"
          },
          {
            "@category": "thumbnail",
            "@height": "164",
            "@width": "203",
            "@_fa": "true",
            "$": "https://api.elsevier.com/content/object/eid/1-s2.0-S0926860X19302704-gr6.sml?httpAccept=%2A%2F%2A",
            "@multimediatype": "GIF image file",
            "@type": "IMAGE-THUMBNAIL",
            "@size": "12686",
            "@ref": "gr6",
            "@mimetype": "image/gif"
          },
          {
            "@category": "thumbnail",
            "@height": "94",
            "@width": "219",
            "@_fa": "true",
            "$": "https://api.elsevier.com/content/object/eid/1-s2.0-S0926860X19302704-gr5.sml?httpAccept=%2A%2F%2A",
            "@multimediatype": "GIF image file",
            "@type": "IMAGE-THUMBNAIL",
            "@size": "8580",
            "@ref": "gr5",
            "@mimetype": "image/gif"
          },
          {
            "@category": "thumbnail",
            "@height": "164",
            "@width": "208",
            "@_fa": "true",
            "$": "https://api.elsevier.com/content/object/eid/1-s2.0-S0926860X19302704-gr4.sml?httpAccept=%2A%2F%2A",
            "@multimediatype": "GIF image file",
            "@type": "IMAGE-THUMBNAIL",
            "@size": "8709",
            "@ref": "gr4",
            "@mimetype": "image/gif"
          },
          {
            "@category": "thumbnail",
            "@height": "164",
            "@width": "174",
            "@_fa": "true",
            "$": "https://api.elsevier.com/content/object/eid/1-s2.0-S0926860X19302704-gr3.sml?httpAccept=%2A%2F%2A",
            "@multimediatype": "GIF image file",
            "@type": "IMAGE-THUMBNAIL",
            "@size": "19167",
            "@ref": "gr3",
            "@mimetype": "image/gif"
          },
          {
            "@category": "thumbnail",
            "@height": "164",
            "@width": "198",
            "@_fa": "true",
            "$": "https://api.elsevier.com/content/object/eid/1-s2.0-S0926860X19302704-gr2.sml?httpAccept=%2A%2F%2A",
            "@multimediatype": "GIF image file",
            "@type": "IMAGE-THUMBNAIL",
            "@size": "9293",
            "@ref": "gr2",
            "@mimetype": "image/gif"
          },
          {
            "@category": "thumbnail",
            "@height": "50",
            "@width": "219",
            "@_fa": "true",
            "$": "https://api.elsevier.com/content/object/eid/1-s2.0-S0926860X19302704-ga1.sml?httpAccept=%2A%2F%2A",
            "@multimediatype": "GIF image file",
            "@type": "IMAGE-THUMBNAIL",
            "@size": "6898",
            "@ref": "ga1",
            "@mimetype": "image/gif"
          },
          {
            "@category": "thumbnail",
            "@height": "164",
            "@width": "215",
            "@_fa": "true",
            "$": "https://api.elsevier.com/content/object/eid/1-s2.0-S0926860X19302704-gr1.sml?httpAccept=%2A%2F%2A",
            "@multimediatype": "GIF image file",
            "@type": "IMAGE-THUMBNAIL",
            "@size": "10073",
            "@ref": "gr1",
            "@mimetype": "image/gif"
          },
          {
            "@category": "thumbnail",
            "@height": "163",
            "@width": "199",
            "@_fa": "true",
            "$": "https://api.elsevier.com/content/object/eid/1-s2.0-S0926860X19302704-gr9.sml?httpAccept=%2A%2F%2A",
            "@multimediatype": "GIF image file",
            "@type": "IMAGE-THUMBNAIL",
            "@size": "14264",
            "@ref": "gr9",
            "@mimetype": "image/gif"
          },
          {
            "@category": "standard",
            "@height": "466",
            "@width": "567",
            "@_fa": "true",
            "$": "https://api.elsevier.com/content/object/eid/1-s2.0-S0926860X19302704-gr8.jpg?httpAccept=%2A%2F%2A",
            "@multimediatype": "JPEG image file",
            "@type": "IMAGE-DOWNSAMPLED",
            "@size": "66130",
            "@ref": "gr8",
            "@mimetype": "image/jpeg"
          },
          {
            "@category": "standard",
            "@height": "295",
            "@width": "341",
            "@_fa": "true",
            "$": "https://api.elsevier.com/content/object/eid/1-s2.0-S0926860X19302704-gr7.jpg?httpAccept=%2A%2F%2A",
            "@multimediatype": "JPEG image file",
            "@type": "IMAGE-DOWNSAMPLED",
            "@size": "20183",
            "@ref": "gr7",
            "@mimetype": "image/jpeg"
          },
          {
            "@category": "standard",
            "@height": "459",
            "@width": "567",
            "@_fa": "true",
            "$": "https://api.elsevier.com/content/object/eid/1-s2.0-S0926860X19302704-gr6.jpg?httpAccept=%2A%2F%2A",
            "@multimediatype": "JPEG image file",
            "@type": "IMAGE-DOWNSAMPLED",
            "@size": "72972",
            "@ref": "gr6",
            "@mimetype": "image/jpeg"
          },
          {
            "@category": "standard",
            "@height": "243",
            "@width": "567",
            "@_fa": "true",
            "$": "https://api.elsevier.com/content/object/eid/1-s2.0-S0926860X19302704-gr5.jpg?httpAccept=%2A%2F%2A",
            "@multimediatype": "JPEG image file",
            "@type": "IMAGE-DOWNSAMPLED",
            "@size": "45422",
            "@ref": "gr5",
            "@mimetype": "image/jpeg"
          },
          {
            "@category": "standard",
            "@height": "268",
            "@width": "341",
            "@_fa": "true",
            "$": "https://api.elsevier.com/content/object/eid/1-s2.0-S0926860X19302704-gr4.jpg?httpAccept=%2A%2F%2A",
            "@multimediatype": "JPEG image file",
            "@type": "IMAGE-DOWNSAMPLED",
            "@size": "22857",
            "@ref": "gr4",
            "@mimetype": "image/jpeg"
          },
          {
            "@category": "standard",
            "@height": "535",
            "@width": "567",
            "@_fa": "true",
            "$": "https://api.elsevier.com/content/object/eid/1-s2.0-S0926860X19302704-gr3.jpg?httpAccept=%2A%2F%2A",
            "@multimediatype": "JPEG image file",
            "@type": "IMAGE-DOWNSAMPLED",
            "@size": "126431",
            "@ref": "gr3",
            "@mimetype": "image/jpeg"
          },
          {
            "@category": "standard",
            "@height": "283",
            "@width": "341",
            "@_fa": "true",
            "$": "https://api.elsevier.com/content/object/eid/1-s2.0-S0926860X19302704-gr2.jpg?httpAccept=%2A%2F%2A",
            "@multimediatype": "JPEG image file",
            "@type": "IMAGE-DOWNSAMPLED",
            "@size": "25119",
            "@ref": "gr2",
            "@mimetype": "image/jpeg"
          },
          {
            "@category": "standard",
            "@height": "115",
            "@width": "500",
            "@_fa": "true",
            "$": "https://api.elsevier.com/content/object/eid/1-s2.0-S0926860X19302704-ga1.jpg?httpAccept=%2A%2F%2A",
            "@multimediatype": "JPEG image file",
            "@type": "IMAGE-DOWNSAMPLED",
            "@size": "19725",
            "@ref": "ga1",
            "@mimetype": "image/jpeg"
          },
          {
            "@category": "standard",
            "@height": "259",
            "@width": "341",
            "@_fa": "true",
            "$": "https://api.elsevier.com/content/object/eid/1-s2.0-S0926860X19302704-gr1.jpg?httpAccept=%2A%2F%2A",
            "@multimediatype": "JPEG image file",
            "@type": "IMAGE-DOWNSAMPLED",
            "@size": "22859",
            "@ref": "gr1",
            "@mimetype": "image/jpeg"
          },
          {
            "@category": "standard",
            "@height": "466",
            "@width": "567",
            "@_fa": "true",
            "$": "https://api.elsevier.com/content/object/eid/1-s2.0-S0926860X19302704-gr9.jpg?httpAccept=%2A%2F%2A",
            "@multimediatype": "JPEG image file",
            "@type": "IMAGE-DOWNSAMPLED",
            "@size": "91977",
            "@ref": "gr9",
            "@mimetype": "image/jpeg"
          },
          {
            "@category": "high",
            "@height": "2063",
            "@width": "2510",
            "@_fa": "true",
            "$": "https://api.elsevier.com/content/object/eid/1-s2.0-S0926860X19302704-gr8_lrg.jpg?httpAccept=%2A%2F%2A",
            "@multimediatype": "JPEG image file",
            "@type": "IMAGE-HIGH-RES",
            "@size": "576371",
            "@ref": "gr8",
            "@mimetype": "image/jpeg"
          },
          {
            "@category": "high",
            "@height": "1306",
            "@width": "1510",
            "@_fa": "true",
            "$": "https://api.elsevier.com/content/object/eid/1-s2.0-S0926860X19302704-gr7_lrg.jpg?httpAccept=%2A%2F%2A",
            "@multimediatype": "JPEG image file",
            "@type": "IMAGE-HIGH-RES",
            "@size": "388470",
            "@ref": "gr7",
            "@mimetype": "image/jpeg"
          },
          {
            "@category": "high",
            "@height": "2030",
            "@width": "2510",
            "@_fa": "true",
            "$": "https://api.elsevier.com/content/object/eid/1-s2.0-S0926860X19302704-gr6_lrg.jpg?httpAccept=%2A%2F%2A",
            "@multimediatype": "JPEG image file",
            "@type": "IMAGE-HIGH-RES",
            "@size": "636934",
            "@ref": "gr6",
            "@mimetype": "image/jpeg"
          },
          {
            "@category": "high",
            "@height": "1075",
            "@width": "2510",
            "@_fa": "true",
            "$": "https://api.elsevier.com/content/object/eid/1-s2.0-S0926860X19302704-gr5_lrg.jpg?httpAccept=%2A%2F%2A",
            "@multimediatype": "JPEG image file",
            "@type": "IMAGE-HIGH-RES",
            "@size": "325745",
            "@ref": "gr5",
            "@mimetype": "image/jpeg"
          },
          {
            "@category": "high",
            "@height": "1187",
            "@width": "1510",
            "@_fa": "true",
            "$": "https://api.elsevier.com/content/object/eid/1-s2.0-S0926860X19302704-gr4_lrg.jpg?httpAccept=%2A%2F%2A",
            "@multimediatype": "JPEG image file",
            "@type": "IMAGE-HIGH-RES",
            "@size": "416324",
            "@ref": "gr4",
            "@mimetype": "image/jpeg"
          },
          {
            "@category": "high",
            "@height": "2367",
            "@width": "2510",
            "@_fa": "true",
            "$": "https://api.elsevier.com/content/object/eid/1-s2.0-S0926860X19302704-gr3_lrg.jpg?httpAccept=%2A%2F%2A",
            "@multimediatype": "JPEG image file",
            "@type": "IMAGE-HIGH-RES",
            "@size": "1323219",
            "@ref": "gr3",
            "@mimetype": "image/jpeg"
          },
          {
            "@category": "high",
            "@height": "1251",
            "@width": "1510",
            "@_fa": "true",
            "$": "https://api.elsevier.com/content/object/eid/1-s2.0-S0926860X19302704-gr2_lrg.jpg?httpAccept=%2A%2F%2A",
            "@multimediatype": "JPEG image file",
            "@type": "IMAGE-HIGH-RES",
            "@size": "453410",
            "@ref": "gr2",
            "@mimetype": "image/jpeg"
          },
          {
            "@category": "high",
            "@height": "507",
            "@width": "2213",
            "@_fa": "true",
            "$": "https://api.elsevier.com/content/object/eid/1-s2.0-S0926860X19302704-ga1_lrg.jpg?httpAccept=%2A%2F%2A",
            "@multimediatype": "JPEG image file",
            "@type": "IMAGE-HIGH-RES",
            "@size": "146008",
            "@ref": "ga1",
            "@mimetype": "image/jpeg"
          },
          {
            "@category": "high",
            "@height": "1149",
            "@width": "1510",
            "@_fa": "true",
            "$": "https://api.elsevier.com/content/object/eid/1-s2.0-S0926860X19302704-gr1_lrg.jpg?httpAccept=%2A%2F%2A",
            "@multimediatype": "JPEG image file",
            "@type": "IMAGE-HIGH-RES",
            "@size": "357311",
            "@ref": "gr1",
            "@mimetype": "image/jpeg"
          },
          {
            "@category": "high",
            "@height": "2062",
            "@width": "2510",
            "@_fa": "true",
            "$": "https://api.elsevier.com/content/object/eid/1-s2.0-S0926860X19302704-gr9_lrg.jpg?httpAccept=%2A%2F%2A",
            "@multimediatype": "JPEG image file",
            "@type": "IMAGE-HIGH-RES",
            "@size": "782361",
            "@ref": "gr9",
            "@mimetype": "image/jpeg"
          },
          {
            "@category": "standard",
            "@_fa": "true",
            "$": "https://api.elsevier.com/content/object/eid/1-s2.0-S0926860X19302704-am.pdf?httpAccept=%2A%2F%2A",
            "@multimediatype": "Acrobat PDF file",
            "@type": "AAM-PDF",
            "@size": "5478973",
            "@ref": "am",
            "@mimetype": "application/pdf"
          }
        ]
      },
      "link": {
        "@rel": "abstract",
        "@href": "https://api.elsevier.com/content/abstract/scopus_id/85067898374"
      }
    }
  }
}