{
  "metadata": {
    "title": "Development of an efficient Pt/SiO<ce:inf loc=post>2</ce:inf> catalyst for the transfer hydrogenation from perhydro-dibenzyltoluene to acetone",
    "authors": "; ; ",
    "journal": "Applied Catalysis A: General",
    "date": "2022-06-05",
    "doi": "10.1016/j.apcata.2022.118644",
    "abstract": "",
    "uri": "https://api.elsevier.com/content/article/pii/S0926860X22001673",
    "pii": "S0926860X22001673"
  },
  "fulltext": {
    "full-text-retrieval-response": {
      "scopus-eid": "2-s2.0-85129566937",
      "originalText": "serial JL 271346 291210 291744 291809 31 Applied Catalysis A: General APPLIEDCATALYSISAGENERAL 2022-04-30 2022-04-30 2022-05-04 2022-05-04 2022-05-12T08:53:26 1-s2.0-S0926860X22001673 S0926-860X(22)00167-3 S0926860X22001673 10.1016/j.apcata.2022.118644 S300 S300.1 FULL-TEXT 1-s2.0-S0926860X22X00100 2024-01-01T12:34:28.416125Z 0 0 20220605 2022 2022-04-30T15:15:59.20436Z absattachment articleinfo articlenumber articletitlenorm authfirstinitialnorm authfirstsurnamenorm cid cids contenttype copyright crossmark dateloaded dateloadedtxt datesearch datesort dateupdated dco docsubtype doctype doi eid ewtransactionid hubeid indexeddate issn issnnorm itemstage itemtransactionid itemweight openaccess openarchive pg pgfirst pii piinorm pubdatestart pubdatetxt pubyr sortorder srctitle srctitlenorm srctype ssids alllist content subj subheadings suppl tomb volfirst volissue volumelist webpdf webpdfpagecount yearnav figure table e-component body mmlmath acknowledge affil appendices articletitle auth authfirstini authfull authkeywords authlast grantsponsor highlightsabst primabst ref specialabst 0926-860X 0926860X true 639 639 C Volume 639 4 118644 118644 118644 20220605 5 June 2022 2022-06-05 2022 article fla © 2022 Elsevier B.V. All rights reserved. DEVELOPMENTEFFICIENTPTSIO2CATALYSTFORTRANSFERHYDROGENATIONPERHYDRODIBENZYLTOLUENEACETONE ZAKGEYM D 1 Introduction 2 Experimental 2.1 Materials 2.2 Catalyst synthesis 2.3 Catalyst characterization 2.4 Catalytic tests 2.5 Gas chromatography analysis of liquid samples and calculation of yields and conversion 2.6 Molecular size determination 3 Results and discussion 3.1 Choice of support material 3.2 Catalyst evaluation 3.3 Effect of pore size 3.4 Effect of the temperature and duration of oxidative treatment 3.5 Effect of reduction temperature and duration 3.6 Effect of platinum loading 4 Conclusion Credit authorship contribution statement Acknowledgements Appendix A Supplementary material References PREUSTER 2017 445 471 P NIERMANN 2019 290 307 M MULLER 2019 72 80 K JANG 2019 1185 1194 M BRUCKNER 2014 229 235 N GEBURTIG 2016 1010 1017 D SIEVI 2019 2305 2314 G XIAO 2013 514 522 N GLASEL 2015 5719 5725 J HEROLD 2021 5898 5906 F SU 2013 5782 5816 D 2008 CATALYSIS8VOLUMES2COMPLETELYREVENL HANDBOOKHETEROGENEOUS CHEN 1994 481 488 P STUDIESINSURFACESCIENCECATALYSIS HIGASHIO 1996 127 131 Y MELO 1997 201 204 L MELO 1997 155 161 L CHEN 1998 207 214 Y MELO 1999 217 222 L MAGNOUX 2000 3011 3016 P STUDIESINSURFACESCIENCECATALYSIS CHEN 2001 61 69 Y ZAKI 2001 768 774 M NIKOLOPOULOS 2005 128 136 A ZHANG 1988 189 197 G TANABE 1989 63 69 K LIPPERT 1991 199 214 S LIN 1996 L259 L265 K DICOSIMO 1996 149 166 J DICOSIMO 1998 177 185 J CHIKAN 1999 134 143 V MATTOS 2002 166 176 L GANDIA 1994 L1 L7 L BOURIKAS 2003 9441 9451 K BOURIKAS 2005 4100 4108 K GERVASINI 1991 190 198 A LAURONPERNOT 1991 213 225 H SEN 1988 52 71 B VANDRUTEN 1997 181 187 G SHUTKINA 2013 30 34 O SANTORI 2004 215 223 G MARGITFALVI 1998 29 49 J CHEN 2003 117 128 C BOUFADEN 2018 188 199 N MARTYNENKO 2020 178 186 E KANEKO 2012 85 91 S GOGUET 2002 135 144 A GOGUET 2003 280 290 A MILLER 2004 203 212 J OUDENHUIJZEN 2002 135 146 M BRUNAUER 1938 309 319 S BARRETT 1951 373 380 E KIM 2020 126043 S KIM 2020 122449 S SATTERFIELD 1973 628 635 C AUER 2019 3537 3547 F LEE 2021 5520 5529 S AUER 2020 6669 6678 F SCHREIER 2004 190 202 M LI 2020 155503 G KIM 2004 173 180 S HAUENSTEIN 2020 106786 P ZAKGEYMX2022X118644 ZAKGEYMX2022X118644XD 2024-05-04T00:00:00.000Z 2024-05-04T00:00:00.000Z http://creativecommons.org/licenses/by-nc-nd/4.0/ © 2022 Elsevier B.V. All rights reserved. 0 2022-05-10T23:52:32.273Z http://vtw.elsevier.com/data/voc/AddOnTypes/50.7/aggregated-refined Bavarian Ministry of Economic Affairs, Regional Development and Energy This work was funded by the Bavarian Ministry of Economic Affairs, Regional Development and Energy through the project “Emissionsfreier und stark emissionsreduzierter Bahnverkehr auf nicht-elektrifizierten Strecken”. The authors would like to thank Stephan Mrusek and Narayanan Raman for assistance with the BET measurements, Nicola Taccardi for assistance with ICP measurements and Lina Koshnau for assistance with catalyst synthesis and testing for the Pt loading variation. https://doi.org/10.15223/policy-017 https://doi.org/10.15223/policy-037 https://doi.org/10.15223/policy-012 https://doi.org/10.15223/policy-029 https://doi.org/10.15223/policy-004 item S0926-860X(22)00167-3 S0926860X22001673 1-s2.0-S0926860X22001673 10.1016/j.apcata.2022.118644 271346 2024-01-01T12:34:28.416125Z 2022-06-05 1-s2.0-S0926860X22001673-main.pdf https://s3-eu-west-1.amazonaws.com/prod-ucs-content-store-eu-west/content/pii:S0926860X22001673/MAIN/application/pdf/029ccab91eaa59449d143a03c4306f14/main.pdf main.pdf pdf true 776769 MAIN 9 1-s2.0-S0926860X22001673-main_1.png https://s3-eu-west-1.amazonaws.com/prod-ucs-content-store-eu-west/content/pii:S0926860X22001673/PREVIEW/image/png/da2a4b90ca12bd13ec797020c4943895/main_1.png main_1.png png 55405 849 656 IMAGE-WEB-PDF 1 1-s2.0-S0926860X22001673-gr8.jpg https://s3-eu-west-1.amazonaws.com/prod-ucs-content-store-eu-west/content/pii:S0926860X22001673/gr8/DOWNSAMPLED/image/jpeg/4cf9c1ba0871aaf3ce5f11ae0ad2fe73/gr8.jpg gr8 gr8.jpg jpg 23143 219 561 IMAGE-DOWNSAMPLED 1-s2.0-S0926860X22001673-gr7.jpg https://s3-eu-west-1.amazonaws.com/prod-ucs-content-store-eu-west/content/pii:S0926860X22001673/gr7/DOWNSAMPLED/image/jpeg/60c90e20c467a5b6b4cb24c8c8dc308d/gr7.jpg gr7 gr7.jpg jpg 23868 212 565 IMAGE-DOWNSAMPLED 1-s2.0-S0926860X22001673-gr6.jpg https://s3-eu-west-1.amazonaws.com/prod-ucs-content-store-eu-west/content/pii:S0926860X22001673/gr6/DOWNSAMPLED/image/jpeg/ea9204fa3686a542206af0dde305a698/gr6.jpg gr6 gr6.jpg jpg 21195 215 565 IMAGE-DOWNSAMPLED 1-s2.0-S0926860X22001673-gr5.jpg https://s3-eu-west-1.amazonaws.com/prod-ucs-content-store-eu-west/content/pii:S0926860X22001673/gr5/DOWNSAMPLED/image/jpeg/5605a1d1ed944b7ccc0efa4f5c777a33/gr5.jpg gr5 gr5.jpg jpg 25493 216 561 IMAGE-DOWNSAMPLED 1-s2.0-S0926860X22001673-gr4.jpg https://s3-eu-west-1.amazonaws.com/prod-ucs-content-store-eu-west/content/pii:S0926860X22001673/gr4/DOWNSAMPLED/image/jpeg/bf971e94a70f679cb66ec563aceeb284/gr4.jpg gr4 gr4.jpg jpg 13583 244 279 IMAGE-DOWNSAMPLED 1-s2.0-S0926860X22001673-gr3.jpg https://s3-eu-west-1.amazonaws.com/prod-ucs-content-store-eu-west/content/pii:S0926860X22001673/gr3/DOWNSAMPLED/image/jpeg/ab44cdb7bd29eebc46d7ea6939d89d35/gr3.jpg gr3 gr3.jpg jpg 39880 486 565 IMAGE-DOWNSAMPLED 1-s2.0-S0926860X22001673-gr2.jpg https://s3-eu-west-1.amazonaws.com/prod-ucs-content-store-eu-west/content/pii:S0926860X22001673/gr2/DOWNSAMPLED/image/jpeg/60725ea97682abf30a9c4f68bf982129/gr2.jpg gr2 gr2.jpg jpg 50123 476 565 IMAGE-DOWNSAMPLED 1-s2.0-S0926860X22001673-ga1.jpg https://s3-eu-west-1.amazonaws.com/prod-ucs-content-store-eu-west/content/pii:S0926860X22001673/ga1/DOWNSAMPLED/image/jpeg/730e2e4e0f13cdbaf8491e31c08fe310/ga1.jpg ga1 true ga1.jpg jpg 30528 200 500 IMAGE-DOWNSAMPLED 1-s2.0-S0926860X22001673-gr1.jpg https://s3-eu-west-1.amazonaws.com/prod-ucs-content-store-eu-west/content/pii:S0926860X22001673/gr1/DOWNSAMPLED/image/jpeg/28c5f4405dc0c0229c7ea57e92cf0e09/gr1.jpg gr1 gr1.jpg jpg 21103 459 565 IMAGE-DOWNSAMPLED 1-s2.0-S0926860X22001673-gr8.sml https://s3-eu-west-1.amazonaws.com/prod-ucs-content-store-eu-west/content/pii:S0926860X22001673/gr8/THUMBNAIL/image/gif/e5b79c17098d1d593ec5e124a8f8a4bb/gr8.sml gr8 gr8.sml sml 3577 85 219 IMAGE-THUMBNAIL 1-s2.0-S0926860X22001673-gr7.sml https://s3-eu-west-1.amazonaws.com/prod-ucs-content-store-eu-west/content/pii:S0926860X22001673/gr7/THUMBNAIL/image/gif/a234fc594fa907257d5ee47874f7deea/gr7.sml gr7 gr7.sml sml 3622 82 219 IMAGE-THUMBNAIL 1-s2.0-S0926860X22001673-gr6.sml https://s3-eu-west-1.amazonaws.com/prod-ucs-content-store-eu-west/content/pii:S0926860X22001673/gr6/THUMBNAIL/image/gif/93a6c16ad665cb2174715e54eef28ef1/gr6.sml gr6 gr6.sml sml 3327 83 219 IMAGE-THUMBNAIL 1-s2.0-S0926860X22001673-gr5.sml https://s3-eu-west-1.amazonaws.com/prod-ucs-content-store-eu-west/content/pii:S0926860X22001673/gr5/THUMBNAIL/image/gif/3e9aa54798aa25665f86dfd1dc1f0c7c/gr5.sml gr5 gr5.sml sml 3726 84 219 IMAGE-THUMBNAIL 1-s2.0-S0926860X22001673-gr4.sml https://s3-eu-west-1.amazonaws.com/prod-ucs-content-store-eu-west/content/pii:S0926860X22001673/gr4/THUMBNAIL/image/gif/2261c1af935ebaad5c4f1470ab60df01/gr4.sml gr4 gr4.sml sml 4965 164 187 IMAGE-THUMBNAIL 1-s2.0-S0926860X22001673-gr3.sml https://s3-eu-west-1.amazonaws.com/prod-ucs-content-store-eu-west/content/pii:S0926860X22001673/gr3/THUMBNAIL/image/gif/fda8081c65c1f7207350da9bb7d680bd/gr3.sml gr3 gr3.sml sml 5590 164 190 IMAGE-THUMBNAIL 1-s2.0-S0926860X22001673-gr2.sml https://s3-eu-west-1.amazonaws.com/prod-ucs-content-store-eu-west/content/pii:S0926860X22001673/gr2/THUMBNAIL/image/gif/068a84aebe8f6deb1a60af54ead32bda/gr2.sml gr2 gr2.sml sml 7204 164 194 IMAGE-THUMBNAIL 1-s2.0-S0926860X22001673-ga1.sml https://s3-eu-west-1.amazonaws.com/prod-ucs-content-store-eu-west/content/pii:S0926860X22001673/ga1/THUMBNAIL/image/gif/11e5d5831d9fb0140267543a09754f6e/ga1.sml ga1 true ga1.sml sml 10005 87 219 IMAGE-THUMBNAIL 1-s2.0-S0926860X22001673-gr1.sml https://s3-eu-west-1.amazonaws.com/prod-ucs-content-store-eu-west/content/pii:S0926860X22001673/gr1/THUMBNAIL/image/gif/1700791055cdb6d02eb48cf294135fde/gr1.sml gr1 gr1.sml sml 3503 164 202 IMAGE-THUMBNAIL 1-s2.0-S0926860X22001673-gr8_lrg.jpg https://s3-eu-west-1.amazonaws.com/prod-ucs-content-store-eu-west/content/pii:S0926860X22001673/gr8/HIGHRES/image/jpeg/47d9a6f3f0261c79cc3f817bb4bf27f5/gr8_lrg.jpg gr8 gr8_lrg.jpg jpg 133473 968 2485 IMAGE-HIGH-RES 1-s2.0-S0926860X22001673-gr7_lrg.jpg https://s3-eu-west-1.amazonaws.com/prod-ucs-content-store-eu-west/content/pii:S0926860X22001673/gr7/HIGHRES/image/jpeg/901c855ad44387b2038ef45771c9ce04/gr7_lrg.jpg gr7 gr7_lrg.jpg jpg 143371 938 2495 IMAGE-HIGH-RES 1-s2.0-S0926860X22001673-gr6_lrg.jpg https://s3-eu-west-1.amazonaws.com/prod-ucs-content-store-eu-west/content/pii:S0926860X22001673/gr6/HIGHRES/image/jpeg/ee9564270433e2fb2a3c0babe3073641/gr6_lrg.jpg gr6 gr6_lrg.jpg jpg 126247 951 2495 IMAGE-HIGH-RES 1-s2.0-S0926860X22001673-gr5_lrg.jpg https://s3-eu-west-1.amazonaws.com/prod-ucs-content-store-eu-west/content/pii:S0926860X22001673/gr5/HIGHRES/image/jpeg/74cae35dfb48e3d8184c49b2735126f7/gr5_lrg.jpg gr5 gr5_lrg.jpg jpg 150783 956 2485 IMAGE-HIGH-RES 1-s2.0-S0926860X22001673-gr4_lrg.jpg https://s3-eu-west-1.amazonaws.com/prod-ucs-content-store-eu-west/content/pii:S0926860X22001673/gr4/HIGHRES/image/jpeg/b6374f8f6cfea4cbb60d232204cf86a7/gr4_lrg.jpg gr4 gr4_lrg.jpg jpg 72125 1086 1240 IMAGE-HIGH-RES 1-s2.0-S0926860X22001673-gr3_lrg.jpg https://s3-eu-west-1.amazonaws.com/prod-ucs-content-store-eu-west/content/pii:S0926860X22001673/gr3/HIGHRES/image/jpeg/de6641fa105aaf1aa8ada41c6d52453e/gr3_lrg.jpg gr3 gr3_lrg.jpg jpg 221274 2148 2495 IMAGE-HIGH-RES 1-s2.0-S0926860X22001673-gr2_lrg.jpg https://s3-eu-west-1.amazonaws.com/prod-ucs-content-store-eu-west/content/pii:S0926860X22001673/gr2/HIGHRES/image/jpeg/a60f9d778c34428b56b743e06204381e/gr2_lrg.jpg gr2 gr2_lrg.jpg jpg 274369 2103 2495 IMAGE-HIGH-RES 1-s2.0-S0926860X22001673-ga1_lrg.jpg https://s3-eu-west-1.amazonaws.com/prod-ucs-content-store-eu-west/content/pii:S0926860X22001673/ga1/HIGHRES/image/jpeg/e37e881b2cf1325d30d8eea23136f501/ga1_lrg.jpg ga1 true ga1_lrg.jpg jpg 219572 884 2213 IMAGE-HIGH-RES 1-s2.0-S0926860X22001673-gr1_lrg.jpg https://s3-eu-west-1.amazonaws.com/prod-ucs-content-store-eu-west/content/pii:S0926860X22001673/gr1/HIGHRES/image/jpeg/0450c19712180f675564e7777492d105/gr1_lrg.jpg gr1 gr1_lrg.jpg jpg 135105 2028 2495 IMAGE-HIGH-RES 1-s2.0-S0926860X22001673-mmc1.docx https://s3-eu-west-1.amazonaws.com/prod-ucs-content-store-eu-west/content/pii:S0926860X22001673/mmc1/MAIN/application/vnd.openxmlformats-officedocument.wordprocessingml.document/5095a395ffab33dbf20aaaede4bee179/mmc1.docx mmc1 mmc1.docx docx 3406650 APPLICATION 1-s2.0-S0926860X22001673-si0001.svg https://s3-eu-west-1.amazonaws.com/prod-ucs-content-store-eu-west/content/pii:S0926860X22001673/STRIPIN/image/svg+xml/9307331cbec2c7c929a2914695122284/si0001.svg si0001 si0001.svg svg 2070 ALTIMG 1-s2.0-S0926860X22001673-si0002.svg https://s3-eu-west-1.amazonaws.com/prod-ucs-content-store-eu-west/content/pii:S0926860X22001673/STRIPIN/image/svg+xml/1334443c88d1828c707d524121098d50/si0002.svg si0002 si0002.svg svg 2856 ALTIMG 1-s2.0-S0926860X22001673-si0003.svg https://s3-eu-west-1.amazonaws.com/prod-ucs-content-store-eu-west/content/pii:S0926860X22001673/STRIPIN/image/svg+xml/785b93e5b636c42d8f3e5286bf0f0c04/si0003.svg si0003 si0003.svg svg 2739 ALTIMG 1-s2.0-S0926860X22001673-si0004.svg https://s3-eu-west-1.amazonaws.com/prod-ucs-content-store-eu-west/content/pii:S0926860X22001673/STRIPIN/image/svg+xml/e78e84a9061691c9d6d9709713f28652/si0004.svg si0004 si0004.svg svg 2917 ALTIMG 1-s2.0-S0926860X22001673-si0005.svg https://s3-eu-west-1.amazonaws.com/prod-ucs-content-store-eu-west/content/pii:S0926860X22001673/STRIPIN/image/svg+xml/c1803edb3d17d72020997481f1f13821/si0005.svg si0005 si0005.svg svg 4019 ALTIMG 1-s2.0-S0926860X22001673-si0006.svg https://s3-eu-west-1.amazonaws.com/prod-ucs-content-store-eu-west/content/pii:S0926860X22001673/STRIPIN/image/svg+xml/19005253a8e86479a646f67e2ec47697/si0006.svg si0006 si0006.svg svg 3857 ALTIMG 1-s2.0-S0926860X22001673-si0007.svg https://s3-eu-west-1.amazonaws.com/prod-ucs-content-store-eu-west/content/pii:S0926860X22001673/STRIPIN/image/svg+xml/41be33edb90f6ff8fb88b8b6ce3efc87/si0007.svg si0007 si0007.svg svg 1458 ALTIMG 1-s2.0-S0926860X22001673-si0008.svg https://s3-eu-west-1.amazonaws.com/prod-ucs-content-store-eu-west/content/pii:S0926860X22001673/STRIPIN/image/svg+xml/ed60073d4450ae9c0524754a9f89c6d4/si0008.svg si0008 si0008.svg svg 1454 ALTIMG 1-s2.0-S0926860X22001673-si0009.svg https://s3-eu-west-1.amazonaws.com/prod-ucs-content-store-eu-west/content/pii:S0926860X22001673/STRIPIN/image/svg+xml/66ae44af7a8eb84e89a7d451d4019982/si0009.svg si0009 si0009.svg svg 3010 ALTIMG 1-s2.0-S0926860X22001673-am.pdf am am.pdf pdf 495392 AAM-PDF https://s3-eu-west-1.amazonaws.com/prod-ucs-content-store-eu-west/content/egi:103S6P0X6BW/MAIN/application/pdf/9fa5d7162da713d22dc9060004959a56/am.pdf APCATA 118644 118644 S0926-860X(22)00167-3 10.1016/j.apcata.2022.118644 Elsevier B.V. Fig. 1 Aldol condensation and consecutive reactions of acetone. Fig. 1 Fig. 2 Yield of mesityl oxide, isophorone, IBMK and diisobutyl methyl ketone obtained in a catalytic reaction using 0.3 mol H18-DBT, 0.3 mol acetone and 0.03 mol of a) Al2O3, b) MgO, c) TiO2, or d) SiO2 (15 nm pore diameter) at 200 °C, normalized to the BET surface area of the respective metal oxide. Note that scaling of the y-axis in d) is reduced by two orders of magnitude. Fig. 2 Fig. 3 Isopropanol and IBMK yields in the transfer hydrogenation reaction at 200 °C using 0.3 mol H18-DBT, 0.3 mol acetone and a catalyst amount corresponding to 0.3 mmol Pt; a) average and standard deviation of the yields (dashed lines: linear fit) over three different batches of the prepared benchmark catalyst (entry ‘BM’ in Table 2), b) commercial Pt/SiO2 catalyst (entry ‘Escat’ in Table 2), c) commercial Pt/C catalyst. Fig. 3 Fig. 4 Influence of support pore diameter on the Pt/SiO2-catalyzed transfer hydrogenation of acetone to isopropanol and IBMK side product formation; conditions: 200 °C, 0.3 mol H18-DBT, 0.3 mol acetone, 1.2 mmol Pt (5 wt% Pt/SiO2). Fig. 4 Fig. 5 Effect of the temperature of oxidative treatment of the 1 wt% Pt/SiO2 catalyst used in the transfer hydrogenation reaction; conditions of the transfer hydrogenation: 200 °C, 0.3 mol H18-DBT, 0.3 mol acetone, 0.3 mmol Pt; a) dispersion of Pt after reductive treatment; b) TOF of acetone transfer hydrogenation and IBMK formation. Fig. 5 Fig. 6 Effect of the duration of reductive treatment at 200 °C of the 1 wt% Pt/SiO2 catalyst used in the transfer hydrogenation reaction; conditions of the transfer hydrogenation: 200 °C, 0.3 mol H18-DBT, 0.3 mol acetone, 0.3 mmol Pt; a) dispersion of Pt; b) TOF of acetone transfer hydrogenation and IBMK formation. Fig. 6 Fig. 7 Effect of the reduction temperature in a 3 h reductive treatment of the 1 wt% Pt/SiO2 catalyst used in the transfer hydrogenation reaction; conditions of the transfer hydrogenation: 200 °C, 0.3 mol H18-DBT, 0.3 mol acetone, 0.3 mmol Pt; a) dispersion of Pt; b) TOF of acetone transfer hydrogenation and IBMK formation. Fig. 7 Fig. 8 Effect of the Pt loading of the Pt/SiO2 catalyst used in the transfer hydrogenation reaction; conditions of the transfer hydrogenation: 200 °C, 0.3 mol H18-DBT, 0.3 mol acetone, 0.3 mmol Pt using 1 wt% Pt/SiO2, or 0.6 mmol Pt using 2 wt% Pt/SiO2, etc.; a) dispersion of Pt after reductive treatment; b) TOF of acetone transfer hydrogenation and IBMK formation. Fig. 8 Table 1 Morphological properties of the studied metal oxides. Table 1 Support material ABET [m² g−1] VPore [cm³ g−1] dPore [nm] Al2O3 196 0.516 9.93 MgO 147 0.330 4.04 TiO2 61.4 0.305 3.11 SiO2 (15 nm) 282 1.05 14.9 SiO2 (6 nm) a 414 0.555 5.71 a Used in Section 3.3. Table 2 Characterization results of the prepared Pt/SiO2 benchmark catalyst (BM; average over three batches with standard deviation) and the commercial Escat catalyst. Table 2 Catalyst ABET [m² g−1] VPore [cm³ g−1] dPore [nm] Pt loading[wt%] DPt a [%] dPt a [nm] BM 272 ± 7 1.03 ± 0.04 14.8 1.07 ± 0.05 b 63 ± 4 1.8 ± 0.1 Escat 478 2.60 19.6 5.0 c 2.4 48 Pt/C 1660 1.63 3.93 5.0 c 27 4.2 a Determined by CO pulse chemisorption b Determined by ICP-OES c Provided by the manufacturer Table 3 Yield of main side product IBMK in the transfer hydrogenation over Pt/SiO2 catalysts after 5 h of reaction time with different Pt loading. Table 3 Pt loading [wt%] 0.51 0.90 1.4 1.9 4.1 Y(IBMK) [mol%] 3.7 2.5 2.1 2.0 0.8 Development of an efficient Pt/SiO2 catalyst for the transfer hydrogenation from perhydro-dibenzyltoluene to acetone Dina Zakgeym Conceptualization Investigation Formal analysis Methodology Validation Data curation Visualization Writing – original draft Writing – review & editing a b Timo Engl Investigation Formal analysis Data curation b Yazan Mahayni Investigation Formal analysis a b Muller Karsten Müller Conceptualization Supervision Project administration Writing – review & editing a c Moritz Wolf Methodology Supervision Project administration Writing – review & editing a Peter Wasserscheid Conceptualization Resources Supervision Writing – review & editing Funding acquisition Project administration a b ⁎ a Helmholtz-Institut Erlangen-Nürnberg für Erneuerbare Energien (IEK-11), Forschungszentrum Jülich GmbH, Erlangen, Germany Helmholtz-Institut Erlangen-Nürnberg für Erneuerbare Energien (IEK-11), Forschungszentrum Jülich GmbH Erlangen Germany Helmholtz-Institut Erlangen-Nürnberg für Erneuerbare Energien (IEK-11), Forschungszentrum Jülich GmbH, Erlangen, Germany b Friedrich-Alexander-Universität Erlangen-Nürnberg (FAU), Lehrstuhl für Chemische Reaktionstechnik, Erlangen, Germany Friedrich-Alexander-Universität Erlangen-Nürnberg (FAU), Lehrstuhl für Chemische Reaktionstechnik Erlangen Germany Friedrich-Alexander-Universität Erlangen-Nürnberg (FAU), Lehrstuhl für Chemische Reaktionstechnik, Erlangen, Germany c Universität of Rostock, Institute of Technical Thermodynamics, Rostock, Germany Universität of Rostock, Institute of Technical Thermodynamics Rostock Germany Universität of Rostock, Institute of Technical Thermodynamics, Rostock, Germany ⁎ Correspondence to: Cauerstr. 1, 91058 Erlangen, Germany. Cauerstr. 1 Erlangen 91058 Germany The storage of hydrogen in liquid organic hydrogen carriers (LOHCs) represents a safe and easy to handle storage solution for energy from renewable sources. Dibenzyltoluene (H0-DBT)/perhydro-dibenzyltoluene (H18-DBT) is a promising LOHC system due to its low flammability, wide liquid range and high storage density for hydrogen. However, this LOHC system requires high temperature heat (typically > 250 °C) for hydrogen release, which lowers the efficiency of the storage cycle if no appropriate source of waste heat is available. This disadvantage can be mitigated by transfer of the hydrogen onto an acceptor molecule such as acetone at mild temperatures, forming isopropanol which can be used as fuel in direct fuel cell concepts or represents a valuable chemical product. Herein, we present the development of an active and selective platinum on silica (Pt/SiO2) catalyst for the transfer hydrogenation of acetone using perhydro-dibenzyltoluene as the sole source of hydrogen. Relevant catalyst design parameters, such as the optimal pore size, Pt loading, reduction and oxidation temperatures/times, are identified and their influence on the catalyst morphology and performance is discussed. Graphical Abstract ga1 Keywords LOHC systems Dibenzyltoluene Transfer hydrogenation Acetone Aldol formation 1 Introduction The sustainable energy infrastructure of the future requires ways for large-scale energy storage to cope with the fluctuation of some of the renewable energy sources (e.g. sun, wind) and to facilitate transport from locations with high energy harvesting potentials to locations with high energy consumption. For this purpose, hydrogen offers great potential [1], but the low volumetric energy density and flammability of molecular hydrogen are major drawbacks for the technical implementation in many application scenarios [2–4]. The liquid organic hydrogen carrier (LOHC) concept circumvents these disadvantages as molecular hydrogen is chemically bound to fuel-like liquid organic molecules at the site of its production and released by a dehydrogenation reaction at the site of its consumption. The LOHC technology may simplify storage and transport between those sites, whilst relying on existing infrastructure for liquid fuels [1,3,4]. Dibenzyltoluene (H0-DBT) is a promising candidate for the chemical storage of hydrogen via the LOHC technology. Perhydro-dibenzyltoluene (H18-DBT) offers a good hydrogen storage density of 6.2 wt% in combination with a comparatively high density of 0.91 kg·L−1, a wide liquid range (−39 to 390 °C), and low flammability [1,3,5]. However, the release of hydrogen from H18-DBT requires reaction temperatures exceeding 250 °C due to the strongly endothermal nature of the dehydrogenation reaction to H0-DBT (Eq. 1) [1,3,5]. In contrast, process temperatures of 200 °C and below may be realized by transferring the hydrogen stored in H18-DBT to an acceptor molecule, such as acetone (Eq. 2), instead of releasing molecular hydrogen [6,7]. The hydrogenated acceptor molecule, isopropanol, represents not only a valuable chemical but can be applied in direct fuel cell systems to produce electric power (Eq. 3) [8]. (1) H 18 -DBT → H 0 -DBT + 9 H 2 (2) H 18 -DBT + 9 acetone → H 0 -DBT + 9 isopropanol (3) isopropanol + 0.5 O 2 → acetone + H 2 O In previous works, platinum on activated carbon (Pt/C) has been employed as a catalyst for the transfer hydrogenation of acetone by H18-DBT [8]. This catalyst system was demonstrated to enable high activity and selectivity towards the desired reaction. Furthermore, preliminary studies indicated that Pt-based catalysts outperform Pd, Ru, Rh, Au and Ni-based catalysts, which display low to zero-level activity for the transfer hydrogenation [7]. In this contribution, we present the use of metal oxide-supported catalysts for the same transfer hydrogenation. Metal oxide supports are common in technical catalysis and provide the advantage of a straightforward catalyst shaping. This facilitates the use of such catalysts in larger scale applications, e.g. by reduced pressure drop in catalytic fixed bed reactors and straight-forward liquid-solid-separation. Contrary, carbon-supported catalysts are usually applied as fine powders because robust shaping of these materials is a challenging task [9–13]. The choice of the metal oxide has to consider the fact that acetone may undergo aldol condensation reactions ( Fig. 1) in the presence of acidic [14–23] or basic sites [22–32]. The first condensation product is mesityl oxide, which may further condensate with acetone or can be hydrogenated to isobutyl methyl ketone (IBMK) in the presence of a reducing agent [14–16,18,19,21,23,27,30–32]. The consequence of aldol condensation is the consumption of the reactant acetone in an undesired side reaction. Moreover, the aldol condensation products are high-boilers that stick to the catalyst surface, a fact that will inevitably lead to coke formation and catalyst deactivation [16,26,30]. Metal oxide supports in heterogeneous catalysis exhibit different surface chemistries, including acidic (TiO2), basic (MgO), amphoteric (Al2O3) or mostly inert (SiO2) reactivities [33–36]. It can be assumed that the rather inert surface of SiO2 will be the least reactive for the undesired aldol condensation. Platinum on silica (Pt/SiO2) catalysts are well known in literature and have been used for different hydrogenation reactions [37–42] including the hydrogenation of acetone [37–39] as well as dehydrogenation reactions [43,44]. They are typically prepared by impregnation using varying reaction conditions [37,38,40–42,45–49]. Goguet et al. [46] and Miller et al. [48] provide an overview of the various impregnation and thermal treatment conditions in literature. The latter publication includes the effect on Pt dispersion over SiO2 support materials. Herein, a Pt/SiO2 transfer hydrogenation catalyst is developed for the application in transfer hydrogenation of acetone to isopropanol using H18-DBT as the sole source of hydrogen. 2 Experimental 2.1 Materials For the catalyst synthesis, two silica gel materials with different porous structures were used (Acros Organics, 419282500, average pore size of 15 nm, particle size of 75–250 µm; Alfa Aesar, 42570, average pore size of 6 nm, particle size of 40–63 µm). Other tested support materials were aluminum oxide (PURALOX SBa 200, Sasol), magnesium oxide (LUVOMAG M074, Lehmann&Voss&Co.) and titanium dioxide (P25, Evonik). Pt(NH3)4(OH)2 (464813, Sigma Aldrich) was employed as Pt precursor. Commercial Pt/SiO2 (5 wt%, Escat 2351, ABCR) and Pt/C (5 wt%, 205931, Sigma Aldrich) catalysts were used as reference. All materials were used without pretreatment. For the transfer hydrogenation reaction, H18-DBT (Hydrogenious LOHC Technologies GmbH, Erlangen) with a degree of hydrogenation of 95% and acetone (>99.8% purity, 34850, Sigma Aldrich) were used. 2.2 Catalyst synthesis In a typical catalyst synthesis, 0.259 g of Pt(NH3)4(OH)2 were dissolved in 45 mL deionized water and mixed with 14.85 g of silica, which corresponds to a precursor salt content of 5.76 g L−1 and a targeted loading of 1 wt% platinum. The suspension was stirred for 1 h, after which it was dried in vacuo using a rotary evaporator at 60 °C and 40 mbar until no more bubble formation was observed. The impregnated catalyst was heated in a Nabertherm L9/11 muffle furnace with a P330 temperature control unit under a flow of synthetic air (70 mL min−1) at 150 °C for 3 h with a heating ramp of 5 °C min−1. It was then transferred into a ceramic boat which was placed inside a quartz tube (inner diameter: 42 mm, length: 550 mm) inside a horizontal tubular furnace (Carbolite type Gero) and heated up to 200 °C with a heating ramp of 5 °C min−1 under a flow of nitrogen (500 mL min−1). Upon reaching this temperature, the nitrogen flow was reduced to 450 mL min−1 and 50 mL min−1 of hydrogen were introduced to the feed stream for 3 h to activate the catalyst. Finally, the reduced catalyst was collected after cool-down under a flow of nitrogen. Deviations from the standard procedure are explicitly stated in the respective result sections. 2.3 Catalyst characterization The surface area A BET of the support materials was determined by nitrogen physisorption at liquid nitrogen temperature using a Quadrasorb SI analyzer (Quantachrome Instruments) and evaluated with the Brunauer-Emmett-Teller (BET) method in the relative pressure range between 0.05 and 0.35 (Fig. S14-S23) [50]. Prior to analysis, the samples were degassed for 12 h at 200 °C and a pressure of 0.01 mbar. The pore size distribution was determined from the physisorption data with the Barrett-Joyner-Halenda (BJH) method in the relative pressure range between 0.5 and 0.75. Pore volumes V Pore and pore diameters d Pore were calculated as an average of the adsorption and desorption isotherm [51]. The platinum loading of a catalyst was determined using optical emission spectroscopy in a Ciros CCD (Spectro Analytical Instruments GmbH) with inductively coupled plasma (ICP-OES). A total of 100 mg of the catalyst was digested in 100 mL of a HCl-HNO3-HF mixture with a ratio of 3:1:1 in a microwave at 220 °C for 40 min. The concentration of platinum in the solution was determined using the spectral line of platinum at 214.123 nm. The dispersion of platinum on the catalyst surface D Pt was assessed using CO pulse chemisorption at 40 °C in an Autochem II 2920 (Micromeritics) after reduction for 200 °C in 20% H2/N2 for 1 h. A stoichiometric factor of 1 was assumed for the adsorption of CO on Pt. From the dispersion, the average Pt particle size d Pt was calculated assuming hemispherical particles. Transmission electron microscopy (TEM) was conducted using a Philips CM30. The particle size of Pt was evaluated by measuring at least 100 particles per sample using the software ImageJ (version 1.52a). 2.4 Catalytic tests The catalysts were tested in the transfer hydrogenation reaction using a 600 mL stainless steel (SS316) autoclave (Parr Instrument Company). The autoclave was equipped with a stirrer, argon line, internal cooling coil, rupture disk, and a liquid phase sampling line with a filter to prevent catalyst discharge and contamination of the samples. A perfluoroelastomer (FFKM) sealing ring was used due to the chemical resistance against H18-DBT and acetone. In a typical experiment, the autoclave was charged with 0.3 mol H18-DBT (corrected by the actual degree of hydrogenation), 0.3 mol acetone and the corresponding amount of catalyst for 0.3 mmol Pt. The 1:1 ratio of H18-DBT to acetone was selected as it has been shown previously to favor a high isopropanol yield [7]. The reactor was purged three times with argon (4 bar), the pressure was released, and the reactor was heated up to 200 °C under continuous stirring at 300 rpm, which took approximately 20 min. During heat-up the pressure increased from 1 bar to ca. 10 bar due to the evaporating reactant. After reaching the desired temperature, the stirrer speed was increased to 1200 rpm to ensure contact between the catalyst and the two reactant phases. Liquid samples were taken from the sampling line every 30 or 60 min depending on the reaction time. Approximately 1.5 mL of the effluent liquid from the sampling line were discarded to avoid contamination with the previous sample. Afterwards, approximately 0.2 mL were collected for off-line analysis. To elucidate the blank activity of the support materials, 30 mmol of the corresponding metal oxide (Al2O3, MgO, TiO2 or SiO2) were loaded instead of the catalyst. When testing catalysts with loadings other than 1 wt%, the same catalyst mass was loaded in each experiment to ensure a comparable physical composition of the slurry in the reactor. Consequently, the loaded amount of Pt scaled with the loading, i.e. 0.3 mmol Pt for 1 wt% loading, 0.15 mmol Pt for 0.5 wt% loading etc. 2.5 Gas chromatography analysis of liquid samples and calculation of yields and conversion The liquid samples were diluted with cyclohexane and analyzed in a Bruker type 430 gas chromatograph (GC) equipped with a 50 m CP-Sil PONA CB column and a flame ionization detector. For each product i resulting from acetone, the integral A i of its peak in the chromatogram was used to calculate the mass in the GC vial m i,v using the mass of decane in the GC vial m Decan,v and the corresponding calibration factor f i (Eq. 4). From the mass of i in the vial, its mass in the reactor m i was calculated using the total sample mass m Sample,v and the initial mass of reactants m Aceton,0 and mH18-DBT,0 (Eq. 5): (4) m i , v = f i ∙ A i A Decane ∙ m Decane , v (5) m i = m i , v m Sample , v ∙ m Acetone , 0 + m H 18 − DBT , 0 The yield Y i was calculated using the stoichiometric coefficients ν i and the molar mass M i (Eq. 6). (6) Y i = ν j ∙ m i M i m Acetone M Acetone + ∑ j ν j ∙ m j M j The conversion X was calculated as the sum of all yields (Eq. 7) and the selectivity S towards a product i is defined as the yield of this product divided by the conversion (Eq. 8). For this, it was assumed that all reaction products have been found in the GC, so that the sum of all selectivities would equal 1 (cf. Fig. S1 and corresponding discussion). (7) X = ∑ i Y i (8) S i = Y i X The turnover frequency (TOF) towards a product i was calculated from a linear fit of the yield (Eq. 9) using the initial amount of platinum n Pt (calculated from the catalyst mass and loading as measured with the ICP-OES) as well as the dispersion D (measured with CO pulse chemisorption). The linearity of the yield as a function of time will be discussed in Section 3.2. (9) TO F i = n Acetone , 0 * dY i dt * n Pt * D 2.6 Molecular size determination The size of H18-DBT and acetone was determined by minimizing the molecule energy by MMFF94 in the software Avogadro (version 1.2.0) and determining the maximum distance in between two hydrogen atoms. 3 Results and discussion 3.1 Choice of support material Several common metal oxide materials were initially screened to identify promising inert candidates to suppress support-induced side reactions. Bare Al2O3, MgO, TiO2 and SiO2 were tested for their activity towards aldol condensation and consecutive reactions of acetone. The morphological properties of the metal oxides were analyzed by means of physisorption ( Table 1). The BET surface area of all supports was in the range of 61–282 m2g−1. The yields of condensation products were normalized to the corresponding surface area to ensure comparability of the results. A significant amount of aldol condensation was observed over TiO2, MgO and Al2O3 ( Fig. 2). In contrast, only a minor amount of mesityl oxide was formed over SiO2 after prolonged exposure (note that the scale of the y-axis in Fig. 2d is two orders of magnitude lower than for the other metal oxides). This confirms the rather inert character of this metal oxide support in the present application and is in agreement with literature [35,36] as well as NH3-TPD measurements (Fig. S2). Hence, SiO2 was selected as the catalyst support of choice in the present study. 3.2 Catalyst evaluation A 1 wt% Pt/SiO2 catalyst prepared according to the standard preparation method (impregnation of SiO2 with a mean pore size of 15 nm with 1 wt% Pt, drying, oxidative treatment at 150 °C for 3 h, reduction at 200 °C for 3 h) shows a similar morphology to the support material ( Table 2; Table S1). The determined Pt dispersion of 63% is well in-line with literature values of the dispersion obtained with similar synthesis procedures [47]. In comparison, a commercial 5 wt% Pt/SiO2 catalyst exhibits broader pores and a higher surface area, while the platinum nanoparticles are poorly dispersed on the support surface resulting in dispersions below 3%. The Pt/C catalyst, which has been previously used for transfer hydrogenation [8], has rather narrow pores and a high surface area, well in line with literature values for this activated carbon-supported catalyst [52,53], as well as a moderate Pt dispersion. For the synthesized catalyst, an approximately linear increase of the isopropanol and IBMK yields over time was observed for low acetone conversion at a reaction temperature of 200 °C ( Fig. 3a; Fig. S3). This allows for comparison of the kinetics of the transfer hydrogenation reaction over this catalyst material depending on its synthesis parameters. Interestingly, no isopropanol formation, a low yield of IBMK of 2.4% and 0.3% mesityl oxide were observed with the commercial Pt/SiO2 catalyst (Fig. 3b), which is most likely due to the low Pt dispersion and some support reactivity. The Pt/C catalyst exhibited a similar isopropanol yield and a lower IBMK yield than the synthesized catalyst (Fig. 3c). However, the higher Pt loading and differences in the support morphology (Table 2) complicate the direct comparison with the synthesized catalyst. 3.3 Effect of pore size To investigate the influence of the pore size on the catalytic reaction, two catalysts were synthesized with the standard procedure and a platinum loading of 5 wt% (impregnation of SiO2 with 5 wt% Pt, drying, oxidative treatment at 150 °C for 3 h, reduction at 200 °C for 3 h) to ensure a sufficiently high yield of isopropanol for a reasonable comparative evaluation. Two different silica supports with a pore size of 6 and 15 nm, respectively, were used for the two catalysts. The maximum diameter of H18-DBT was estimated to be approximately 1.3 nm. Therefore, a cylindrical pore with a diameter of 6 nm can geometrically accommodate approx. 20 molecules of H18-DBT in its cross-section. In such an arrangement, most of the molecules can be expected to interact with the pore walls, i.e. cannot diffuse freely [54]. On the other hand, pores with a diameter of 15 nm can geometrically accommodate approx. 130 molecules of H18-DBT in the cross-section significantly reducing walls effects on diffusion. Acetone should not be affected by diffusion limitations due to its small maximum diameter of approx. 0.41 nm. In the transfer hydrogenation experiments, the TOF of acetone towards isopropanol is significantly lower over the catalyst with 6 nm pores compared to the catalyst with 15 nm pores ( Fig. 4). Considering the comparable dispersion of Pt in both catalysts (73% vs. 83% for 6 and 15 nm pore size, respectively) and the identical amount of Pt used in the experiments, the fact that the isopropanol formation with the large pore support catalyst is significantly higher is remarkable. This hints for a mass transport influence in the 6 nm pores. Similar effects have been discussed in literature for the H18-DBT dehydrogenation, where mass transfer influences were observed for pore diameters smaller than 30 nm [55,56]. It is noteworthy, that the activity difference with respect to IBMK formation between the catalysts supported on silica with different pore width is comparatively small. The first step of this reaction – the aldol condensation – requires acetone as the only feedstock molecule and acetone diffusion is fast. In a second step, the condensation product mesityl oxide is reduced to IBMK. No mesityl oxide has been observed over either of the two catalysts, showing that the second step is comparatively fast. This is consistent with literature as the C-C-double bond in mesityl oxide has been reported to be reduced faster in the presence of hydrogen than the C-O-double bond in acetone [19,23]. However, the TOF towards IBMK is lower than the TOF towards isopropanol as the amount of formed mesityl oxide in the reaction mixture is expected to be significantly lower than the amount of the reactant acetone. The slight increase of IBMK formation over the catalyst with larger pores indicates that the intermediate mesityl oxide or the product IBMK (maximum diameter of both molecules ~ 0.63 nm) might be mass transport limited in 6 nm pores, though less than H18-DBT. 3.4 Effect of the temperature and duration of oxidative treatment It has been discussed in literature that after impregnation and evaporation of water, a treatment of the Pt(NH3)4(OH)2/SiO2 catalyst in an oxidative atmosphere, such as air, can ensure the complete removal of the ligands [46,47,49]. Goguet et al. studied impregnation of SiO2 with Pt(NH3)4(OH)2 by means of temperature programmed oxidation (TPO). It was found, that NH3 desorbed between 100 and 200 °C and was oxidized by air around 270 °C, which resulted in the formation of N2 and N2O [47]. The latter process was exothermic and induced a pronounced increase of particle size in catalysts treated at temperatures ≥ 300 °C in air. After preparation of a Pt/SiO2 by the standard procedure (impregnation SiO2 with mean pore size of 15 nm with 1 wt% Pt, drying, oxidative treatment for 3 h, reductive treatment at 200 °C for 3 h) with different temperatures during the oxidative treatment in synthetic air, the maximum Pt dispersion was observed for the catalysts treated between 150 and 200 °C ( Fig. 5a). Low dispersions were observed after oxidative treatment at 100 °C, potentially due to residual ammonia being attached to Pt after incomplete oxidation of the precursor. This may prevent adsorption of CO during the pulse chemisorption experiment, while the Pt particles as such are still small (median of the particle size distribution: 1.2 nm) as verified by means of TEM (see Fig. S6). For this reason, no TOF was calculated for the catalyst treated at 100 °C since the active surface area of the platinum catalyst could not be precisely assessed. After thermal treatment of the catalyst materials at temperatures ≥ 300 °C, the concentration of particles with a diameter larger than 3.2 nm increased, which broadened the size distribution (see Fig. S6-S7). A nearly linear decrease in dispersion after oxidative treatment between 200 and 500 °C reflects the trends observed using TEM. These observations are consistent with the formation of mobile PtOx species under oxidizing atmospheres at temperatures ≥ 300 °C as described in literature [47–49]. The TOF of transfer hydrogenation to isopropanol (Fig. 5b) is similar for the catalyst materials that have been treated at temperatures ≤ 300 °C. For 150–300 °C, the Pt particle sizes mostly range between 0.8 and 3.2 nm (see Fig. S6-S7). While the increase of oxidation temperature to 300 °C leads to a significant decrease of particles smaller than 1.6 nm in favor of few particles larger 3.2 nm (slightly lowering the Pt dispersion), the reaction rate is hardly affected. This suggests that particles below a critical size, which may be approx. 1.6 nm for transfer hydrogenation, contribute less effectively to the overall reaction. This is in good agreement with the structure sensitivity of the H18-DBT dehydrogenation reaction that has been reported in literature [57]. According to these previous studies, H18-DBT dehydrogenation is most effective for supported Pt nanoparticles with an average Pt particle diameter of approx. 2.1 nm. Above 300 °C, the TOF of transfer hydrogenation decreases as expected from the enhanced loss in Pt surface area due to sintering during oxidative treatment, which has been observed in the TEM analyses (see Fig. S6-S7) and dispersion ( Fig. 5a). The TOF towards IBMK, on the other hand, increases with decreasing Pt dispersion. One possible explanation is the presence of acidic sites on the SiO2 surface, which are mostly responsible for the aldol condensation over SiO2. These sites bind the Pt precursor salt [46,48,58] and are then blocked by Pt nanoparticles formed during the catalyst synthesis. Therefore, if the dispersion of Pt is low, many acidic sites remain available inducing the significant formation of mesityl oxide. Subsequent transfer hydrogenation to IBMK competes with the transfer hydrogenation of acetone in the reaction system. Contrary to the temperature, the duration of the oxidative treatment at 150 °C hardly affected the Pt dispersion or catalyst performance. Even a short oxidative treatment at this mild temperature was found to sufficiently remove Pt ligands while even prolonged exposure times did not induce particle growth via sintering (see Fig. S5). 3.5 Effect of reduction temperature and duration The oxidative treatment induces formation of acidic PtOx species [47–49,59,60]. Prior to the use of the Pt/SiO2 catalysts in transfer hydrogenation, the catalyst materials prepared by the standard procedure (impregnation of SiO2 with mean pore size of 15 nm with 1 wt% Pt, drying, oxidative treatment at 150 °C for 3 h) were reduced using hydrogen at various treatment durations and temperatures. At 200 °C, the dispersion of Pt increased with reduction duration up to 2 h ( Fig. 6a), which is seemingly the time required for a thorough reduction at this temperature. The decrease of dispersion after reduction times exceeding 3 h hints towards a slow agglomeration of the reduced Pt particles over time. The influence of the reduction time on the TOF of acetone towards isopropanol is relatively small (Fig. 6b), whereas the TOF towards IBMK is strongly affected. Hence, it can be assumed that aldol condensation is not only catalyzed by support sites, but also by acidic PtOx species. Thus, while most Pt on the surface appears to be reduced after 2 h as indicated by dispersion measurements, the TOF towards IBMK rather suggests that a reduction time of at least 3 h is required for the full removal of the more acidic PtOx surface species. Variation of the reduction temperature suggests incomplete reduction after 3 h at 150 °C, while the dispersion of Pt is rather independent from the conditions at reduction temperatures ≥ 200 °C ( Fig. 7a). TEM measurements confirm that the average Pt particle size remains mostly constant over the studied range of reduction temperatures (see Fig. S8). This is in contrast to the observation under oxidative atmospheres (Fig. 5), but in agreement with a reported different mobility of the species present under reducing atmospheres [47,49]. The TOF of the acetone transfer hydrogenation to isopropanol increases with the reduction temperature in the reductive catalyst treatment prior to the transfer hydrogenation step (Fig. 7b). The TOF of IBMK formation decreases with reduction temperature to a minimum at 300 °C linked to a more quantitative reduction of the acidic PtOx sites. Higher reduction temperatures of the catalyst led again to an increase of IBMK formation. Our results indicate that a reduction temperature of 300 °C promotes some extent of Ostwald ripening (see Fig. S8) leading to a disproportionation of medium sized particles into smaller and larger particles. The larger particles may effectively catalyze the transfer hydrogenation (cf. Section 3.4), while the smaller particles suppress the aldol condensation by blocking acidic sites of the support. At 200 °C, the reduction is slow, but the PtOx species present on the surface after oxidative treatment are not particularly mobile at this low temperature [47] and therefore do not significantly agglomerate. On the other hand, the reduction is sufficiently accelerated at temperatures ≥ 400 °C to prevent Pt diffusion, possibly because metallic Pt is formed immediately and subsequently “pinned” to the surface. 3.6 Effect of platinum loading The amount of platinum on the catalyst is decisive for the mass-specific activity of the catalyst. Variation of the Pt loading between 0.5 and 4.1 wt% during the standard synthesis procedure (impregnation of SiO2 with mean pore size of 15 nm, drying, oxidative treatment at 150 °C for 3 h, reduction at 200 °C for 3 h) resulted in similar Pt dispersions on the catalyst ( Fig. 8a). Expectedly, the conversion scales with the loading of the catalyst as the overall catalyst mass (support + Pt) was constant throughout this series of catalytic testing (see Fig. S4). A maximum of the TOF for the transfer hydrogenation was observed for a loading of 1 wt% (Fig. 8b). We explain this finding with the inhomogeneous distribution of the platinum particles over the cross section of the support particle leading to an enrichment of Pt in an egg-shell manner. At low loadings, most Pt is found close to the external surface of the SiO2 due to the quick irreversible adsorption of Pt(NH3)4(OH)2 onto SiO2 as discussed in the literature [46]. At high loadings, on the other hand, the outer parts of the particle become saturated and a larger fraction of Pt precursor diffuses deeper into the porous network of the particle during impregnation. This reduces the effective use of these Pt centers in the mass transfer limited transfer hydrogenation (see above) using H18-DBT as the sole source of hydrogen. Interestingly, the TOF towards IBMK decreases steadily with the Pt loading (Fig. 8b). Our explanation is that at higher Pt loadings, similar to the scenario at high dispersions (cf. Section 3.4), more acidic support sites are blocked by Pt nanoparticles formed during catalyst synthesis. Note that less formation of mesityl oxide also reduces the competing transfer hydrogenation of mesityl oxide to IBMK and thus leads to a lower absolute IBMK yield at higher Pt loadings ( Table 3), which is especially remarkable considering the aforementioned higher acetone conversion. 4 Conclusion A Pt/SiO2 catalyst for the transfer hydrogenation of acetone by perhydro-dibenzyltoluene was developed, prepared, and evaluated. Several important parameters for producing an effective transfer hydrogenation catalyst could be identified and their further optimization may allow the synthesis of even better transfer hydrogenation catalysts for this application in the future: a) In contrast to other oxidic supports, using SiO2 as catalyst support can minimize the amount of side products from acetone aldol condensation. Pt(NH3)4(OH)2 is a suitable platinum precursor for the catalyst synthesis by wet impregnation. b) The average pore diameter of the support should exceed 6 nm to minimize detrimental influences by mass transport effects. Mass transfer restrictions affect primarily the concentration of the hydrogen source H18-DBT at the catalytic sites and thus the liberation of hydrogen for the transfer hydrogenation process. c) During catalyst synthesis, an oxidative treatment of the impregnated catalyst at 150 °C is required to ensure accessibility of the active phase, potentially by a complete removal of residual ligands. Higher temperatures under oxidative conditions eventually lead to sintering of Pt and, consequently, to a loss of active metal surface. d) During catalyst synthesis, a reduction step is required after the oxidative treatment of the catalyst material to ensure that all Pt surface atoms are in the metallic state prior to the transfer hydrogenation experiment. This enhances the formation of the desired product isopropanol while simultaneously lowering the formed amount of the main side product IBMK. A reduction at 300 °C for at least 3 h provides the lowest IBMK yield. e) A higher Pt loading on SiO2 decreases the IBMK yield and increases the productivity of the catalyst per volume and per total mass of catalyst. However, the Pt-based activity and the TOF decreases with higher loadings. A Pt loading of 1 wt% appears as reasonable compromise between these counteracting trends. f) To mitigate side product formation and maximize isopropanol yield, it is highly important to avoid formation of the mesityl oxide aldol condensation product in the first place. Once formed, the latter is readily hydrogenated to the main side product IBMK. In addition to the competing nature of this transfer hydrogenation, it also consumes hydrogen initially bound to the hydrogen carrier H18-DBT. Conclusively, three crucial parameters for the preparation of Pt-based catalyst for the herein studied transfer hydrogenation were identified: support material, pore size, and loading of Pt. Compared to other metal oxides facilitating a high dispersion of Pt, SiO2 may represent a superior support material due to suppression of major side reactions even though this support demands a considerable degree of attention to ensure an efficient dispersion of Pt. However, Pt(NH3)4(OH)2 is a suitable precursor resulting in robust catalyst syntheses yielding high dispersions. In particular the parameters of the reduction have little impact on the performance of the catalyst, as long as minimum duration of 3 h and minimum temperature of 200 °C are ensured. The pore size of the support is crucial for mass diffusion limitation of H18-DBT and (partially) dehydrogenated species, which demands for large pore sizes. Finally, high Pt loadings are highly recommended, but a trade-off must be made between improved space-time yields with lower formation of by-products and efficient use of costly Pt. Using the herein summarized catalyst design principles, we demonstrated that a highly selective transfer hydrogenation of acetone and H18-DBT is indeed possible with Pt/SiO2 catalysts. As isopropanol is a suitable fuel for direct LOHC fuel cells [61], the here presented investigations may contribute to the further exploration of a possibly highly attractive route for using cycloalkane-bound hydrogen in future emission-free electric power generation systems. Credit authorship contribution statement Dina Zakgeym: Conceptualization, Investigation, Formal analysis, Methodology, Validation, Data curation, Visualization, Writing – original draft preparation, Writing – review & editing. Timo Engl: Investigation, Formal analysis, Data curation. Yazan Mahayni: Investigation, Formal analysis. Karsten Müller: Conceptualization, Supervision, Project administration, Writing – review & editing. Moritz Wolf: Methodology, Supervision, Project administration, Writing – review & editing. Peter Wasserscheid: Conceptualization, Resources, Supervision, Writing – review & editing, Funding acquisition, Project administration. Declaration of Competing Interest The authors declare that they have no known competing financial interests or personal relationships that could have appeared to influence the work reported in this paper. Acknowledgements This work was funded by the Bavarian Ministry of Economic Affairs, Regional Development and Energy through the project “Emissionsfreier und stark emissionsreduzierter Bahnverkehr auf nicht-elektrifizierten Strecken”. The authors would like to thank Stephan Mrusek and Narayanan Raman for assistance with the BET measurements, Nicola Taccardi for assistance with ICP measurements and Lina Koshnau for assistance with catalyst synthesis and testing for the Pt loading variation. Appendix A Supporting information Supplementary data associated with this article can be found in the online version at doi:10.1016/j.apcata.2022.118644. Appendix A Supplementary material Supplementary material . References [1] P. Preuster A. Alekseev P. Wasserscheid Annu. Rev. Chem. Biomol. Eng. 8 2017 445 471 10.1146/annurev-chembioeng-060816-101334 P. Preuster, A. Alekseev, P. Wasserscheid, Annu. Rev. Chem. Biomol. Eng. 8 (2017) 445–471. https://doi.org/10.1146/annurev-chembioeng-060816–101334 [2] M. Niermann S. Drünert M. Kaltschmitt K. Bonhoff Energy Environ. Sci. 12 2019 290 307 10.1039/C8EE02700E M. Niermann, S. Drünert, M. Kaltschmitt, K. Bonhoff, Energy Environ. Sci. 12 (2019) 290–307. https://doi.org/10.1039/C8EE02700E [3] K. Müller ChemBioEng Rev. 6 2019 72 80 10.1002/cben.201900009 K. Müller, ChemBioEng Rev. 6 (2019) 72–80. https://doi.org/10.1002/cben.201900009 [4] M. Jang Y.S. Jo W.J. Lee B.S. Shin H. Sohn H. Jeong S.C. Jang S.K. Kwak J.W. Kang C.W. Yoon ACS Sustain. Chem. Eng. 7 2019 1185 1194 10.1021/acssuschemeng.8b04835 M. Jang, Y.S. Jo, W.J. Lee, B.S. Shin, H. Sohn, H. Jeong, S.C. Jang, S.K. Kwak, J.W. Kang, C.W. Yoon, ACS Sustain. Chem. Eng. 7 (2019) 1185–1194. https://doi.org/10.1021/acssuschemeng.8b04835 [5] N. Brückner K. Obesser A. Bösmann D. Teichmann W. Arlt J. Dungs P. Wasserscheid ChemSusChem 7 2014 229 235 10.1002/cssc.201300426 N. Brückner, K. Obesser, A. Bösmann, D. Teichmann, W. Arlt, J. Dungs, P. Wasserscheid, ChemSusChem 7 (2014) 229–235. https://doi.org/10.1002/cssc.201300426 [6] D. Geburtig P. Preuster A. Bösmann K. Müller P. Wasserscheid Int. J. Hydrog. Energy 41 2016 1010 1017 10.1016/j.ijhydene.2015.10.013 D. Geburtig, P. Preuster, A. Bösmann, K. Müller, P. Wasserscheid, Int. J. Hydrog. Energy 41 (2016) 1010–1017. https://doi.org/10.1016/j.ijhydene.2015.10.013 [7] D. Geburtig, Transfer hydrogenation using Liquid Organic Hydrogen Carrier systems as hydrogen source, Friedrich-Alexander-Universität Erlangen-Nürnberg (FAU), Technische Fakultät, 2019. [8] G. Sievi D. Geburtig T. Skeledzic A. Bösmann P. Preuster O. Brummel F. Waidhas M.A. Montero P. Khanipour I. Katsounaros J. Libuda K.J.J. Mayrhofer P. Wasserscheid Energy Environ. Sci. 12 2019 2305 2314 10.1039/C9EE01324E G. Sievi, D. Geburtig, T. Skeledzic, A. Bösmann, P. Preuster, O. Brummel, F. Waidhas, M.A. Montero, P. Khanipour, I. Katsounaros, J. Libuda, K.J.J. Mayrhofer, P. Wasserscheid, Energy Environ. Sci. 12 (2019) 2305–2314. https://doi.org/10.1039/C9EE01324E [9] N. Xiao Y. Zhou Z. Ling Z. Zhao J. Qiu Carbon 60 2013 514 522 10.1016/j.carbon.2013.04.081 N. Xiao, Y. Zhou, Z. Ling, Z. Zhao, J. Qiu, Carbon 60 (2013) 514–522. https://doi.org/10.1016/j.carbon.2013.04.081 [10] J. Gläsel J. Diao Z. Feng M. Hilgart T. Wolker D.S. Su B.J.M. Etzold Chem. Mater. 27 2015 5719 5725 10.1021/acs.chemmater.5b02262 J. Gläsel, J. Diao, Z. Feng, M. Hilgart, T. Wolker, D.S. Su, B.J.M. Etzold, Chem. Mater. 27 (2015) 5719–5725. https://doi.org/10.1021/acs.chemmater.5b02262 [11] F. Herold S. Prosch N. Oefner K. Brunnengräber O. Leubner Y. Hermans K. Hofmann A. Drochner J.P. Hofmann W. Qi B.J.M. Etzold Angew. Chem. Int. Ed. 60 2021 5898 5906 10.1002/anie.202014862 F. Herold, S. Prosch, N. Oefner, K. Brunnengräber, O. Leubner, Y. Hermans, K. Hofmann, A. Drochner, J.P. Hofmann, W. Qi, B.J.M. Etzold, Angew. Chem. Int. Ed. 60 (2021) 5898–5906. https://doi.org/10.1002/anie.202014862 [12] D.S. Su S. Perathoner G. Centi Chem. Rev. 113 2013 5782 5816 10.1021/cr300367d D.S. Su, S. Perathoner, G. Centi, Chem. Rev. 113 (2013) 5782–5816. https://doi.org/10.1021/cr300367d [13] Handbook of Heterogeneous G. Ertl H. Knözinger F. Schüth J. Weitkamp G. Bergeret P. Gallezot Catalysis: 8 Volumes, 2., completely rev. and enl 2008 WILEY-VCH Weinheim G. Ertl, H. Knözinger, F. Schüth, J. Weitkamp, G. Bergeret, P. Gallezot, eds., Handbook of Heterogeneous Catalysis: 8 Volumes, 2., completely rev. and enl. ed, WILEY-VCH, Weinheim, 2008. [14] P.Y. Chen S.J. Chu W.C. Lin K.C. Wu C.L. Yang T. Hattori T. Yashima Studies in Surface Science and Catalysis 1994 Elsevier 481 488 P.Y. Chen, S.J. Chu, W.C. Lin, K.C. Wu, C.L. Yang, in: T. Hattori, T. Yashima (Eds.), Studies in Surface Science and Catalysis, Elsevier, 1994, pp. 481–488. [15] Y. Higashio T. Nakayama Catal. Today 28 1996 127 131 10.1016/0920-5861(95)00219-7 Y. Higashio, T. Nakayama, Catal. Today 28 (1996) 127–131. https://doi.org/10.1016/0920–5861(95)00219–7 [16] L. Melo G. Giannetto F. Alvarez P. Magnoux M. Guisnet Catal. Lett. 44 1997 201 204 10.1023/A:1018945613176 L. Melo, G. Giannetto, F. Alvarez, P. Magnoux, M. Guisnet, Catal. Lett. 44 (1997) 201–204. https://doi.org/10.1023/A:1018945613176 [17] L. Melo P. Magnoux G. Giannetto F. Alvarez M. Guisnet J. Mol. Catal. A Chem. 124 1997 155 161 10.1016/S1381-1169(97)00073-3 L. Melo, P. Magnoux, G. Giannetto, F. Alvarez, M. Guisnet, J. Mol. Catal. A: Chem. 124 (1997) 155–161. https://doi.org/10.1016/S1381–1169(97)00073–3 [18] Y.Z. Chen C.M. Hwang C.W. Liaw Appl. Catal. A: Gen. 169 1998 207 214 10.1016/S0926-860X(98)00019-2 Y.Z. Chen, C.M. Hwang, C.W. Liaw, Appl. Catal. A: Gen. 169 (1998) 207–214. https://doi.org/10.1016/S0926–860X(98)00019–2 [19] L. Melo G. Giannetto L. Cardozo A. Llanos L. García P. Magnoux M. Guisnet F. Alvarez Catal. Lett. 60 1999 217 222 10.1023/A:1019015325859 L. Melo, G. Giannetto, L. Cardozo, A. Llanos, L. García, P. Magnoux, M. Guisnet, F. Alvarez, Catal. Lett. 60 (1999) 217–222. https://doi.org/10.1023/A:1019015325859 [20] P. Magnoux N. Lavaud L. Melo G. Giannetto A.I. Silva F. Alvarez M. Guisnet A. Corma F.V. Melo S. Mendioroz J.L.G. Fierro Studies in Surface Science and Catalysis 2000 Elsevier 3011 3016 P. Magnoux, N. Lavaud, L. Melo, G. Giannetto, A.I. Silva, F. Alvarez, M. Guisnet, in: A. Corma, F.V. Melo, S. Mendioroz, J.L.G. Fierro (Eds.), Studies in Surface Science and Catalysis, Elsevier, 2000, pp. 3011–3016. [21] Y.Z. Chen B.J. Liaw H.R. Tan K.L. Shen Appl. Catal. A: Gen. 205 2001 61 69 10.1016/S0926-860X(00)00545-7 Y.Z. Chen, B.J. Liaw, H.R. Tan, K.L. Shen, Appl. Catal. A: Gen. 205 (2001) 61–69. https://doi.org/10.1016/S0926–860X(00)00545–7 [22] M.I. Zaki M.A. Hasan L. Pasupulety Langmuir 17 2001 768 774 10.1021/la000976p M.I. Zaki, M.A. Hasan, L. Pasupulety, Langmuir 17 (2001) 768–774. https://doi.org/10.1021/la000976p [23] A.A. Nikolopoulos B.W.-L. Jang J.J. Spivey Appl. Catal. A: Gen. 296 2005 128 136 10.1016/j.apcata.2005.08.022 A.A. Nikolopoulos, B.W.-L. Jang, J.J. Spivey, Appl. Catal. A: Gen. 296 (2005) 128–136. https://doi.org/10.1016/j.apcata.2005.08.022 [24] G. Zhang H. Hattori K. Tanabe Appl. Catal. 36 1988 189 197 10.1016/S0166-9834(00)80114-1 G. Zhang, H. Hattori, K. Tanabe, Appl. Catal. 36 (1988) 189–197. https://doi.org/10.1016/S0166–9834(00)80114–1 [25] K. Tanabe G. Zhang H. Hattori Appl. Catal. 48 1989 63 69 10.1016/S0166-9834(00)80266-3 K. Tanabe, G. Zhang, H. Hattori, Appl. Catal. 48 (1989) 63–69. https://doi.org/10.1016/S0166–9834(00)80266–3 [26] S. Lippert W. Baumann K. Thomke J. Mol. Catal. 69 1991 199 214 10.1016/0304-5102(91)80145-S S. Lippert, W. Baumann, K. Thomke, J. Mol. Catal. 69 (1991) 199–214. https://doi.org/10.1016/0304–5102(91)80145-S [27] K.-H. Lin A.-N. Ko Appl. Catal. A: Gen. 147 1996 L259 L265 10.1016/S0926-860X(96)00294-3 K.-H. Lin, A.-N. Ko, Appl. Catal. A: Gen. 147 (1996) L259–L265. https://doi.org/10.1016/S0926–860X(96)00294–3 [28] J.I. Di Cosimo V.K. Díez C.R. Apesteguía Appl. Catal. A: Gen. 137 1996 149 166 10.1016/0926-860X(95)00289-8 J.I. Di Cosimo, V.K. Díez, C.R. Apesteguía, Appl. Catal. A: Gen. 137 (1996) 149–166. https://doi.org/10.1016/0926–860X(95)00289–8 [29] J.I. Di Cosimo C.R. Apesteguı́a J. Mol. Catal. A: Chem. 130 1998 177 185 10.1016/S1381-1169(97)00204-5 J.I. Di Cosimo, C.R. Apesteguı́a, J. Mol. Catal. A: Chem. 130 (1998) 177–185. https://doi.org/10.1016/S1381–1169(97)00204–5 [30] V. Chikán Á. Molnár K. Balázsik J. Catal. 184 1999 134 143 10.1006/jcat.1999.2437 V. Chikán, Á. Molnár, K. Balázsik, J. Catal. 184 (1999) 134–143. https://doi.org/10.1006/jcat.1999.2437 [31] L.V. Mattos F.B. Noronha J.L.F. Monteiro J. Catal. 209 2002 166 176 10.1006/jcat.2002.3625 L.V. Mattos, F.B. Noronha, J.L.F. Monteiro, J. Catal. 209 (2002) 166–176. https://doi.org/10.1006/jcat.2002.3625 [32] L.M. Gandía R. Malm R. Marchand R. Conanec Y. Laurent M. Montes Appl. Catal. A: Gen. 114 1994 L1 L7 10.1016/0926-860X(94)85105-0 L.M. Gandía, R. Malm, R. Marchand, R. Conanec, Y. Laurent, M. Montes, Appl. Catal. A: Gen. 114 (1994) L1–L7. https://doi.org/10.1016/0926–860X(94)85105–0 [33] K. Bourikas J. Vakros C. Kordulis A. Lycourghiotis J. Phys. Chem. B 107 2003 9441 9451 10.1021/jp035123v K. Bourikas, J. Vakros, C. Kordulis, A. Lycourghiotis, J. Phys. Chem. B 107 (2003) 9441–9451. https://doi.org/10.1021/jp035123v [34] K. Bourikas C. Kordulis A. Lycourghiotis Environ. Sci. Technol. 39 2005 4100 4108 10.1021/es048139n K. Bourikas, C. Kordulis, A. Lycourghiotis, Environ. Sci. Technol. 39 (2005) 4100–4108. https://doi.org/10.1021/es048139n [35] A. Gervasini A. Auroux J. Catal. 131 1991 190 198 10.1016/0021-9517(91)90335-2 A. Gervasini, A. Auroux, J. Catal. 131 (1991) 190–198. https://doi.org/10.1016/0021–9517(91)90335–2 [36] H. Lauron-Pernot F. Luck J.M. Popa Appl. Catal. 78 1991 213 225 10.1016/0166-9834(91)80107-8 H. Lauron-Pernot, F. Luck, J.M. Popa, Appl. Catal. 78 (1991) 213–225. https://doi.org/10.1016/0166–9834(91)80107–8 [37] B. Sen M.A. Vannice J. Catal. 113 1988 52 71 10.1016/0021-9517(88)90237-0 B. Sen, M.A. Vannice, J. Catal. 113 (1988) 52–71. https://doi.org/10.1016/0021–9517(88)90237–0 [38] G.M.R. van Druten L. Aksu V. Ponec Appl. Catal. A: Gen. 149 1997 181 187 10.1016/S0926-860X(96)00256-6 G.M.R. van Druten, L. Aksu, V. Ponec, Appl. Catal. A: Gen. 149 (1997) 181–187. https://doi.org/10.1016/S0926–860X(96)00256–6 [39] O.V. Shutkina O.A. Ponomareva P.A. Kots I.I. Ivanova Catal. Today 218– 219 2013 30 34 10.1016/j.cattod.2013.05.017 O.V. Shutkina, O.A. Ponomareva, P.A. Kots, I.I. Ivanova, Catal. Today 218–219 (2013) 30–34. https://doi.org/10.1016/j.cattod.2013.05.017 [40] G.F. Santori A.G. Moglioni V. Vetere G.Y.M. Iglesias M.L. Casella O.A. Ferretti Appl. Catal. A: Gen. 269 2004 215 223 10.1016/j.apcata.2004.04.020 G.F. Santori, A.G. Moglioni, V. Vetere, G.Y.M. Iglesias, M.L. Casella, O.A. Ferretti, Appl. Catal. A: Gen. 269 (2004) 215–223. https://doi.org/10.1016/j.apcata.2004.04.020 [41] J.L. Margitfalvi I. Borbáth E. Tfirst A. Tompos Catal. Today 43 1998 29 49 10.1016/S0920-5861(98)00165-5 J.L. Margitfalvi, I. Borbáth, E. Tfirst, A. Tompos, Catal. Today 43 (1998) 29–49. https://doi.org/10.1016/S0920–5861(98)00165–5 [42] C.-S. Chen H.-W. Chen W.-H. Cheng Appl. Catal. A: Gen. 248 2003 117 128 10.1016/S0926-860X(03)00156-X C.-S. Chen, H.-W. Chen, W.-H. Cheng, Appl. Catal. A: Gen. 248 (2003) 117–128. https://doi.org/10.1016/S0926–860X(03)00156-X [43] N. Boufaden B. Pawelec J.L.G. Fierro R. Guil López R. Akkari M. Said Zina Mater. Chem. Phys. 209 2018 188 199 10.1016/j.matchemphys.2018.01.061 N. Boufaden, B. Pawelec, J.L.G. Fierro, R. Guil López, R. Akkari, M. Said Zina, Mater. Chem. Phys. 209 (2018) 188–199. https://doi.org/10.1016/j.matchemphys.2018.01.061 [44] E.A. Martynenko Al.A. Pimerzin A.A. Savinov S.P. Verevkin A.A. Pimerzin Top. Catal. 63 2020 178 186 10.1007/s11244-020-01228-9 E.A. Martynenko, Al.A. Pimerzin, A.A. Savinov, S.P. Verevkin, A.A. Pimerzin, Top. Catal. 63 (2020) 178–186. https://doi.org/10.1007/s11244–020-01228–9 [45] S. Kaneko M. Izuka A. Takahashi M. Ohshima H. Kurokawa H. Miura Appl. Catal. A: Gen. 427–428 2012 85 91 10.1016/j.apcata.2012.03.033 S. Kaneko, M. Izuka, A. Takahashi, M. Ohshima, H. Kurokawa, H. Miura, Appl. Catal. A: Gen. 427–428 (2012) 85–91. https://doi.org/10.1016/j.apcata.2012.03.033 [46] A. Goguet M. Aouine F.J. Cadete Santos Aires A. De Mallmann D. Schweich J.P. Candy J. Catal. 209 2002 135 144 10.1006/jcat.2002.3616 A. Goguet, M. Aouine, F.J. Cadete Santos Aires, A. De Mallmann, D. Schweich, J.P. Candy, J. Catal. 209 (2002) 135–144. https://doi.org/10.1006/jcat.2002.3616 [47] A. Goguet D. Schweich J.-P. Candy J. Catal. 220 2003 280 290 10.1016/S0021-9517(03)00189-1 A. Goguet, D. Schweich, J.-P. Candy, J. Catal. 220 (2003) 280–290. https://doi.org/10.1016/S0021–9517(03)00189–1 [48] J.T. Miller M. Schreier A.J. Kropf J.R. Regalbuto J. Catal. 225 2004 203 212 10.1016/j.jcat.2004.04.007 J.T. Miller, M. Schreier, A.J. Kropf, J.R. Regalbuto, J. Catal. 225 (2004) 203–212. https://doi.org/10.1016/j.jcat.2004.04.007 [49] M.K. Oudenhuijzen P.J. Kooyman B. Tappel J.A. van Bokhoven D.C. Koningsberger J. Catal. 205 2002 135 146 10.1006/jcat.2001.3433 M.K. Oudenhuijzen, P.J. Kooyman, B. Tappel, J.A. van Bokhoven, D.C. Koningsberger, J. Catal. 205 (2002) 135–146. https://doi.org/10.1006/jcat.2001.3433 [50] S. Brunauer P.H. Emmett E. Teller J. Am. Chem. Soc. 60 1938 309 319 10.1021/ja01269a023 S. Brunauer, P.H. Emmett, E. Teller, J. Am. Chem. Soc. 60 (1938) 309–319. https://doi.org/10.1021/ja01269a023 [51] E.P. Barrett L.G. Joyner P.P. Halenda J. Am. Chem. Soc. 73 1951 373 380 10.1021/ja01145a126 E.P. Barrett, L.G. Joyner, P.P. Halenda, J. Am. Chem. Soc. 73 (1951) 373–380. https://doi.org/10.1021/ja01145a126 [52] S. Kim C.-G. Lee Y.T. Kim K.-H. Kim J. Lee Chemosphere 248 2020 126043 10.1016/j.chemosphere.2020.126043 S. Kim, C.-G. Lee, Y.T. Kim, K.-H. Kim, J. Lee, Chemosph. 248 (2020) 126043. https://doi.org/10.1016/j.chemosphere.2020.126043 [53] S. Kim J. Lee J. Hazard. Mater. 393 2020 122449 10.1016/j.jhazmat.2020.122449 S. Kim, J. Lee, J. Hazard. Mater. 393 (2020) 122449. https://doi.org/10.1016/j.jhazmat.2020.122449 [54] C.N. Satterfield C.K. Colton W.H. Pitcher AIChE J. 19 1973 628 635 10.1002/aic.690190332 C.N. Satterfield, C.K. Colton, W.H. Pitcher, AIChE J. 19 (1973) 628–635. https://doi.org/10.1002/aic.690190332 [55] F. Auer D. Blaumeiser T. Bauer A. Bösmann N. Szesni J. Libuda P. Wasserscheid Catal. Sci. Technol. 9 2019 3537 3547 10.1039/C9CY00817A F. Auer, D. Blaumeiser, T. Bauer, A. Bösmann, N. Szesni, J. Libuda, P. Wasserscheid, Catal. Sci. Technol. 9 (2019) 3537–3547. https://doi.org/10.1039/C9CY00817A [56] S. Lee J. Lee T. Kim G. Han J. Lee K. Lee J. Bae Int. J. Hydrog. Energy 46 2021 5520 5529 10.1016/j.ijhydene.2020.11.038 S. Lee, J. Lee, T. Kim, G. Han, J. Lee, K. Lee, J. Bae, Int. J. Hydrog. Energy 46 (2021) 5520–5529. https://doi.org/10.1016/j.ijhydene.2020.11.038 [57] F. Auer A. Hupfer A. Bösmann N. Szesni P. Wasserscheid Catal. Sci. Technol. 10 2020 6669 6678 10.1039/D0CY01173H F. Auer, A. Hupfer, A. Bösmann, N. Szesni, P. Wasserscheid, Catal. Sci. Technol. 10 (2020) 6669–6678. https://doi.org/10.1039/D0CY01173H [58] M. Schreier J.R. Regalbuto J. Catal. 225 2004 190 202 10.1016/j.jcat.2004.03.034 M. Schreier, J.R. Regalbuto, J. Catal. 225 (2004) 190–202. https://doi.org/10.1016/j.jcat.2004.03.034 [59] G. Li Y. Fang C. Arges C. Plaisance J. Flake J. Electrochem. Soc. 167 2020 155503 10.1149/1945-7111/aba704 G. Li, Y. Fang, C. Arges, C. Plaisance, J. Flake, J. Electrochem. Soc. 167 (2020) 155503. https://doi.org/10.1149/1945–7111/aba704 [60] S.J. Kim K.-D. Jung O.-S. Joo E.J. Kim T.B. Kang Appl. Catal. A: Gen. 266 2004 173 180 10.1016/j.apcata.2004.02.003 S.J. Kim, K.-D. Jung, O.-S. Joo, E.J. Kim, T.B. Kang, Appl. Catal. A: Gen. 266 (2004) 173–180. https://doi.org/10.1016/j.apcata.2004.02.003 [61] P. Hauenstein D. Seeberger P. Wasserscheid S. Thiele Electrochem. Commun. 118 2020 106786 10.1016/j.elecom.2020.106786 P. Hauenstein, D. Seeberger, P. Wasserscheid, S. Thiele, Electrochem. Commun. 118 (2020) 106786. https://doi.org/10.1016/j.elecom.2020.106786",
      "scopus-id": "85129566937",
      "coredata": {
        "eid": "1-s2.0-S0926860X22001673",
        "dc:description": "The storage of hydrogen in liquid organic hydrogen carriers (LOHCs) represents a safe and easy to handle storage solution for energy from renewable sources. Dibenzyltoluene (H0-DBT)/perhydro-dibenzyltoluene (H18-DBT) is a promising LOHC system due to its low flammability, wide liquid range and high storage density for hydrogen. However, this LOHC system requires high temperature heat (typically > 250 °C) for hydrogen release, which lowers the efficiency of the storage cycle if no appropriate source of waste heat is available. This disadvantage can be mitigated by transfer of the hydrogen onto an acceptor molecule such as acetone at mild temperatures, forming isopropanol which can be used as fuel in direct fuel cell concepts or represents a valuable chemical product. Herein, we present the development of an active and selective platinum on silica (Pt/SiO2) catalyst for the transfer hydrogenation of acetone using perhydro-dibenzyltoluene as the sole source of hydrogen. Relevant catalyst design parameters, such as the optimal pore size, Pt loading, reduction and oxidation temperatures/times, are identified and their influence on the catalyst morphology and performance is discussed.",
        "openArchiveArticle": "false",
        "prism:coverDate": "2022-06-05",
        "openaccessUserLicense": null,
        "prism:aggregationType": "Journal",
        "prism:url": "https://api.elsevier.com/content/article/pii/S0926860X22001673",
        "dc:creator": [
          {
            "@_fa": "true",
            "$": "Zakgeym, Dina"
          },
          {
            "@_fa": "true",
            "$": "Engl, Timo"
          },
          {
            "@_fa": "true",
            "$": "Mahayni, Yazan"
          },
          {
            "@_fa": "true",
            "$": "Müller, Karsten"
          },
          {
            "@_fa": "true",
            "$": "Wolf, Moritz"
          },
          {
            "@_fa": "true",
            "$": "Wasserscheid, Peter"
          }
        ],
        "link": [
          {
            "@_fa": "true",
            "@rel": "self",
            "@href": "https://api.elsevier.com/content/article/pii/S0926860X22001673"
          },
          {
            "@_fa": "true",
            "@rel": "scidir",
            "@href": "https://www.sciencedirect.com/science/article/pii/S0926860X22001673"
          }
        ],
        "dc:format": "application/json",
        "openaccessType": null,
        "pii": "S0926-860X(22)00167-3",
        "prism:volume": "639",
        "articleNumber": "118644",
        "prism:publisher": "Elsevier B.V.",
        "dc:title": "Development of an efficient Pt/SiO2 catalyst for the transfer hydrogenation from perhydro-dibenzyltoluene to acetone",
        "prism:copyright": "© 2022 Elsevier B.V. All rights reserved.",
        "openaccess": "0",
        "prism:issn": "0926860X",
        "dcterms:subject": [
          {
            "@_fa": "true",
            "$": "LOHC systems"
          },
          {
            "@_fa": "true",
            "$": "Dibenzyltoluene"
          },
          {
            "@_fa": "true",
            "$": "Transfer hydrogenation"
          },
          {
            "@_fa": "true",
            "$": "Acetone"
          },
          {
            "@_fa": "true",
            "$": "Aldol formation"
          }
        ],
        "openaccessArticle": "false",
        "prism:publicationName": "Applied Catalysis A: General",
        "openaccessSponsorType": null,
        "prism:pageRange": "118644",
        "pubType": "fla",
        "prism:coverDisplayDate": "5 June 2022",
        "prism:doi": "10.1016/j.apcata.2022.118644",
        "prism:startingPage": "118644",
        "dc:identifier": "doi:10.1016/j.apcata.2022.118644",
        "openaccessSponsorName": null
      },
      "objects": {
        "object": [
          {
            "@category": "standard",
            "@height": "219",
            "@width": "561",
            "@_fa": "true",
            "$": "https://api.elsevier.com/content/object/eid/1-s2.0-S0926860X22001673-gr8.jpg?httpAccept=%2A%2F%2A",
            "@multimediatype": "JPEG image file",
            "@type": "IMAGE-DOWNSAMPLED",
            "@size": "23143",
            "@ref": "gr8",
            "@mimetype": "image/jpeg"
          },
          {
            "@category": "standard",
            "@height": "212",
            "@width": "565",
            "@_fa": "true",
            "$": "https://api.elsevier.com/content/object/eid/1-s2.0-S0926860X22001673-gr7.jpg?httpAccept=%2A%2F%2A",
            "@multimediatype": "JPEG image file",
            "@type": "IMAGE-DOWNSAMPLED",
            "@size": "23868",
            "@ref": "gr7",
            "@mimetype": "image/jpeg"
          },
          {
            "@category": "standard",
            "@height": "215",
            "@width": "565",
            "@_fa": "true",
            "$": "https://api.elsevier.com/content/object/eid/1-s2.0-S0926860X22001673-gr6.jpg?httpAccept=%2A%2F%2A",
            "@multimediatype": "JPEG image file",
            "@type": "IMAGE-DOWNSAMPLED",
            "@size": "21195",
            "@ref": "gr6",
            "@mimetype": "image/jpeg"
          },
          {
            "@category": "standard",
            "@height": "216",
            "@width": "561",
            "@_fa": "true",
            "$": "https://api.elsevier.com/content/object/eid/1-s2.0-S0926860X22001673-gr5.jpg?httpAccept=%2A%2F%2A",
            "@multimediatype": "JPEG image file",
            "@type": "IMAGE-DOWNSAMPLED",
            "@size": "25493",
            "@ref": "gr5",
            "@mimetype": "image/jpeg"
          },
          {
            "@category": "standard",
            "@height": "244",
            "@width": "279",
            "@_fa": "true",
            "$": "https://api.elsevier.com/content/object/eid/1-s2.0-S0926860X22001673-gr4.jpg?httpAccept=%2A%2F%2A",
            "@multimediatype": "JPEG image file",
            "@type": "IMAGE-DOWNSAMPLED",
            "@size": "13583",
            "@ref": "gr4",
            "@mimetype": "image/jpeg"
          },
          {
            "@category": "standard",
            "@height": "486",
            "@width": "565",
            "@_fa": "true",
            "$": "https://api.elsevier.com/content/object/eid/1-s2.0-S0926860X22001673-gr3.jpg?httpAccept=%2A%2F%2A",
            "@multimediatype": "JPEG image file",
            "@type": "IMAGE-DOWNSAMPLED",
            "@size": "39880",
            "@ref": "gr3",
            "@mimetype": "image/jpeg"
          },
          {
            "@category": "standard",
            "@height": "476",
            "@width": "565",
            "@_fa": "true",
            "$": "https://api.elsevier.com/content/object/eid/1-s2.0-S0926860X22001673-gr2.jpg?httpAccept=%2A%2F%2A",
            "@multimediatype": "JPEG image file",
            "@type": "IMAGE-DOWNSAMPLED",
            "@size": "50123",
            "@ref": "gr2",
            "@mimetype": "image/jpeg"
          },
          {
            "@category": "standard",
            "@height": "200",
            "@width": "500",
            "@_fa": "true",
            "$": "https://api.elsevier.com/content/object/eid/1-s2.0-S0926860X22001673-ga1.jpg?httpAccept=%2A%2F%2A",
            "@multimediatype": "JPEG image file",
            "@type": "IMAGE-DOWNSAMPLED",
            "@size": "30528",
            "@ref": "ga1",
            "@mimetype": "image/jpeg"
          },
          {
            "@category": "standard",
            "@height": "459",
            "@width": "565",
            "@_fa": "true",
            "$": "https://api.elsevier.com/content/object/eid/1-s2.0-S0926860X22001673-gr1.jpg?httpAccept=%2A%2F%2A",
            "@multimediatype": "JPEG image file",
            "@type": "IMAGE-DOWNSAMPLED",
            "@size": "21103",
            "@ref": "gr1",
            "@mimetype": "image/jpeg"
          },
          {
            "@category": "thumbnail",
            "@height": "85",
            "@width": "219",
            "@_fa": "true",
            "$": "https://api.elsevier.com/content/object/eid/1-s2.0-S0926860X22001673-gr8.sml?httpAccept=%2A%2F%2A",
            "@multimediatype": "GIF image file",
            "@type": "IMAGE-THUMBNAIL",
            "@size": "3577",
            "@ref": "gr8",
            "@mimetype": "image/gif"
          },
          {
            "@category": "thumbnail",
            "@height": "82",
            "@width": "219",
            "@_fa": "true",
            "$": "https://api.elsevier.com/content/object/eid/1-s2.0-S0926860X22001673-gr7.sml?httpAccept=%2A%2F%2A",
            "@multimediatype": "GIF image file",
            "@type": "IMAGE-THUMBNAIL",
            "@size": "3622",
            "@ref": "gr7",
            "@mimetype": "image/gif"
          },
          {
            "@category": "thumbnail",
            "@height": "83",
            "@width": "219",
            "@_fa": "true",
            "$": "https://api.elsevier.com/content/object/eid/1-s2.0-S0926860X22001673-gr6.sml?httpAccept=%2A%2F%2A",
            "@multimediatype": "GIF image file",
            "@type": "IMAGE-THUMBNAIL",
            "@size": "3327",
            "@ref": "gr6",
            "@mimetype": "image/gif"
          },
          {
            "@category": "thumbnail",
            "@height": "84",
            "@width": "219",
            "@_fa": "true",
            "$": "https://api.elsevier.com/content/object/eid/1-s2.0-S0926860X22001673-gr5.sml?httpAccept=%2A%2F%2A",
            "@multimediatype": "GIF image file",
            "@type": "IMAGE-THUMBNAIL",
            "@size": "3726",
            "@ref": "gr5",
            "@mimetype": "image/gif"
          },
          {
            "@category": "thumbnail",
            "@height": "164",
            "@width": "187",
            "@_fa": "true",
            "$": "https://api.elsevier.com/content/object/eid/1-s2.0-S0926860X22001673-gr4.sml?httpAccept=%2A%2F%2A",
            "@multimediatype": "GIF image file",
            "@type": "IMAGE-THUMBNAIL",
            "@size": "4965",
            "@ref": "gr4",
            "@mimetype": "image/gif"
          },
          {
            "@category": "thumbnail",
            "@height": "164",
            "@width": "190",
            "@_fa": "true",
            "$": "https://api.elsevier.com/content/object/eid/1-s2.0-S0926860X22001673-gr3.sml?httpAccept=%2A%2F%2A",
            "@multimediatype": "GIF image file",
            "@type": "IMAGE-THUMBNAIL",
            "@size": "5590",
            "@ref": "gr3",
            "@mimetype": "image/gif"
          },
          {
            "@category": "thumbnail",
            "@height": "164",
            "@width": "194",
            "@_fa": "true",
            "$": "https://api.elsevier.com/content/object/eid/1-s2.0-S0926860X22001673-gr2.sml?httpAccept=%2A%2F%2A",
            "@multimediatype": "GIF image file",
            "@type": "IMAGE-THUMBNAIL",
            "@size": "7204",
            "@ref": "gr2",
            "@mimetype": "image/gif"
          },
          {
            "@category": "thumbnail",
            "@height": "87",
            "@width": "219",
            "@_fa": "true",
            "$": "https://api.elsevier.com/content/object/eid/1-s2.0-S0926860X22001673-ga1.sml?httpAccept=%2A%2F%2A",
            "@multimediatype": "GIF image file",
            "@type": "IMAGE-THUMBNAIL",
            "@size": "10005",
            "@ref": "ga1",
            "@mimetype": "image/gif"
          },
          {
            "@category": "thumbnail",
            "@height": "164",
            "@width": "202",
            "@_fa": "true",
            "$": "https://api.elsevier.com/content/object/eid/1-s2.0-S0926860X22001673-gr1.sml?httpAccept=%2A%2F%2A",
            "@multimediatype": "GIF image file",
            "@type": "IMAGE-THUMBNAIL",
            "@size": "3503",
            "@ref": "gr1",
            "@mimetype": "image/gif"
          },
          {
            "@category": "high",
            "@height": "968",
            "@width": "2485",
            "@_fa": "true",
            "$": "https://api.elsevier.com/content/object/eid/1-s2.0-S0926860X22001673-gr8_lrg.jpg?httpAccept=%2A%2F%2A",
            "@multimediatype": "JPEG image file",
            "@type": "IMAGE-HIGH-RES",
            "@size": "133473",
            "@ref": "gr8",
            "@mimetype": "image/jpeg"
          },
          {
            "@category": "high",
            "@height": "938",
            "@width": "2495",
            "@_fa": "true",
            "$": "https://api.elsevier.com/content/object/eid/1-s2.0-S0926860X22001673-gr7_lrg.jpg?httpAccept=%2A%2F%2A",
            "@multimediatype": "JPEG image file",
            "@type": "IMAGE-HIGH-RES",
            "@size": "143371",
            "@ref": "gr7",
            "@mimetype": "image/jpeg"
          },
          {
            "@category": "high",
            "@height": "951",
            "@width": "2495",
            "@_fa": "true",
            "$": "https://api.elsevier.com/content/object/eid/1-s2.0-S0926860X22001673-gr6_lrg.jpg?httpAccept=%2A%2F%2A",
            "@multimediatype": "JPEG image file",
            "@type": "IMAGE-HIGH-RES",
            "@size": "126247",
            "@ref": "gr6",
            "@mimetype": "image/jpeg"
          },
          {
            "@category": "high",
            "@height": "956",
            "@width": "2485",
            "@_fa": "true",
            "$": "https://api.elsevier.com/content/object/eid/1-s2.0-S0926860X22001673-gr5_lrg.jpg?httpAccept=%2A%2F%2A",
            "@multimediatype": "JPEG image file",
            "@type": "IMAGE-HIGH-RES",
            "@size": "150783",
            "@ref": "gr5",
            "@mimetype": "image/jpeg"
          },
          {
            "@category": "high",
            "@height": "1086",
            "@width": "1240",
            "@_fa": "true",
            "$": "https://api.elsevier.com/content/object/eid/1-s2.0-S0926860X22001673-gr4_lrg.jpg?httpAccept=%2A%2F%2A",
            "@multimediatype": "JPEG image file",
            "@type": "IMAGE-HIGH-RES",
            "@size": "72125",
            "@ref": "gr4",
            "@mimetype": "image/jpeg"
          },
          {
            "@category": "high",
            "@height": "2148",
            "@width": "2495",
            "@_fa": "true",
            "$": "https://api.elsevier.com/content/object/eid/1-s2.0-S0926860X22001673-gr3_lrg.jpg?httpAccept=%2A%2F%2A",
            "@multimediatype": "JPEG image file",
            "@type": "IMAGE-HIGH-RES",
            "@size": "221274",
            "@ref": "gr3",
            "@mimetype": "image/jpeg"
          },
          {
            "@category": "high",
            "@height": "2103",
            "@width": "2495",
            "@_fa": "true",
            "$": "https://api.elsevier.com/content/object/eid/1-s2.0-S0926860X22001673-gr2_lrg.jpg?httpAccept=%2A%2F%2A",
            "@multimediatype": "JPEG image file",
            "@type": "IMAGE-HIGH-RES",
            "@size": "274369",
            "@ref": "gr2",
            "@mimetype": "image/jpeg"
          },
          {
            "@category": "high",
            "@height": "884",
            "@width": "2213",
            "@_fa": "true",
            "$": "https://api.elsevier.com/content/object/eid/1-s2.0-S0926860X22001673-ga1_lrg.jpg?httpAccept=%2A%2F%2A",
            "@multimediatype": "JPEG image file",
            "@type": "IMAGE-HIGH-RES",
            "@size": "219572",
            "@ref": "ga1",
            "@mimetype": "image/jpeg"
          },
          {
            "@category": "high",
            "@height": "2028",
            "@width": "2495",
            "@_fa": "true",
            "$": "https://api.elsevier.com/content/object/eid/1-s2.0-S0926860X22001673-gr1_lrg.jpg?httpAccept=%2A%2F%2A",
            "@multimediatype": "JPEG image file",
            "@type": "IMAGE-HIGH-RES",
            "@size": "135105",
            "@ref": "gr1",
            "@mimetype": "image/jpeg"
          },
          {
            "@category": "standard",
            "@_fa": "true",
            "$": "https://api.elsevier.com/content/object/eid/1-s2.0-S0926860X22001673-mmc1.docx?httpAccept=%2A%2F%2A",
            "@multimediatype": "Microsoft Word file",
            "@type": "APPLICATION",
            "@size": "3406650",
            "@ref": "mmc1",
            "@mimetype": "application/word"
          },
          {
            "@category": "thumbnail",
            "@_fa": "true",
            "$": "https://api.elsevier.com/content/object/eid/1-s2.0-S0926860X22001673-si0001.svg?httpAccept=%2A%2F%2A",
            "@multimediatype": "Scalable Vector Graphics file",
            "@type": "ALTIMG",
            "@size": "2070",
            "@ref": "si0001",
            "@mimetype": "image/svg+xml"
          },
          {
            "@category": "thumbnail",
            "@_fa": "true",
            "$": "https://api.elsevier.com/content/object/eid/1-s2.0-S0926860X22001673-si0002.svg?httpAccept=%2A%2F%2A",
            "@multimediatype": "Scalable Vector Graphics file",
            "@type": "ALTIMG",
            "@size": "2856",
            "@ref": "si0002",
            "@mimetype": "image/svg+xml"
          },
          {
            "@category": "thumbnail",
            "@_fa": "true",
            "$": "https://api.elsevier.com/content/object/eid/1-s2.0-S0926860X22001673-si0003.svg?httpAccept=%2A%2F%2A",
            "@multimediatype": "Scalable Vector Graphics file",
            "@type": "ALTIMG",
            "@size": "2739",
            "@ref": "si0003",
            "@mimetype": "image/svg+xml"
          },
          {
            "@category": "thumbnail",
            "@_fa": "true",
            "$": "https://api.elsevier.com/content/object/eid/1-s2.0-S0926860X22001673-si0004.svg?httpAccept=%2A%2F%2A",
            "@multimediatype": "Scalable Vector Graphics file",
            "@type": "ALTIMG",
            "@size": "2917",
            "@ref": "si0004",
            "@mimetype": "image/svg+xml"
          },
          {
            "@category": "thumbnail",
            "@_fa": "true",
            "$": "https://api.elsevier.com/content/object/eid/1-s2.0-S0926860X22001673-si0005.svg?httpAccept=%2A%2F%2A",
            "@multimediatype": "Scalable Vector Graphics file",
            "@type": "ALTIMG",
            "@size": "4019",
            "@ref": "si0005",
            "@mimetype": "image/svg+xml"
          },
          {
            "@category": "thumbnail",
            "@_fa": "true",
            "$": "https://api.elsevier.com/content/object/eid/1-s2.0-S0926860X22001673-si0006.svg?httpAccept=%2A%2F%2A",
            "@multimediatype": "Scalable Vector Graphics file",
            "@type": "ALTIMG",
            "@size": "3857",
            "@ref": "si0006",
            "@mimetype": "image/svg+xml"
          },
          {
            "@category": "thumbnail",
            "@_fa": "true",
            "$": "https://api.elsevier.com/content/object/eid/1-s2.0-S0926860X22001673-si0007.svg?httpAccept=%2A%2F%2A",
            "@multimediatype": "Scalable Vector Graphics file",
            "@type": "ALTIMG",
            "@size": "1458",
            "@ref": "si0007",
            "@mimetype": "image/svg+xml"
          },
          {
            "@category": "thumbnail",
            "@_fa": "true",
            "$": "https://api.elsevier.com/content/object/eid/1-s2.0-S0926860X22001673-si0008.svg?httpAccept=%2A%2F%2A",
            "@multimediatype": "Scalable Vector Graphics file",
            "@type": "ALTIMG",
            "@size": "1454",
            "@ref": "si0008",
            "@mimetype": "image/svg+xml"
          },
          {
            "@category": "thumbnail",
            "@_fa": "true",
            "$": "https://api.elsevier.com/content/object/eid/1-s2.0-S0926860X22001673-si0009.svg?httpAccept=%2A%2F%2A",
            "@multimediatype": "Scalable Vector Graphics file",
            "@type": "ALTIMG",
            "@size": "3010",
            "@ref": "si0009",
            "@mimetype": "image/svg+xml"
          },
          {
            "@category": "standard",
            "@_fa": "true",
            "$": "https://api.elsevier.com/content/object/eid/1-s2.0-S0926860X22001673-am.pdf?httpAccept=%2A%2F%2A",
            "@multimediatype": "Acrobat PDF file",
            "@type": "AAM-PDF",
            "@size": "495392",
            "@ref": "am",
            "@mimetype": "application/pdf"
          }
        ]
      },
      "link": {
        "@rel": "abstract",
        "@href": "https://api.elsevier.com/content/abstract/scopus_id/85129566937"
      }
    }
  }
}