{
  "metadata": {
    "title": "Redox oxide@molten salt as a generalized catalyst design strategy for oxidative dehydrogenation of ethane via selective hydrogen combustion",
    "authors": "; ; ",
    "journal": "Applied Catalysis A: General",
    "date": "2022-09-25",
    "doi": "10.1016/j.apcata.2022.118869",
    "abstract": "",
    "uri": "https://api.elsevier.com/content/article/pii/S0926860X22003921",
    "pii": "S0926860X22003921"
  },
  "fulltext": {
    "full-text-retrieval-response": {
      "scopus-eid": "2-s2.0-85138532754",
      "originalText": "serial JL 271346 291210 291744 291809 31 Applied Catalysis A: General APPLIEDCATALYSISAGENERAL 2022-09-15 2022-09-15 2022-09-22 2022-09-22 2022-10-07T08:52:29 1-s2.0-S0926860X22003921 S0926-860X(22)00392-1 S0926860X22003921 10.1016/j.apcata.2022.118869 S300 S300.1 FULL-TEXT 1-s2.0-S0926860X22X00173 2024-01-01T12:34:28.416125Z 0 0 20220925 2022 2022-09-15T15:32:33.814029Z absattachment articleinfo articlenumber articletitlenorm authfirstinitialnorm authfirstsurnamenorm cid cids contenttype copyright crossmark dateloaded dateloadedtxt datesearch datesort dateupdated dco docsubtype doctype doi eid ewtransactionid hubeid indexeddate issn issnnorm itemstage itemtransactionid itemweight openaccess openarchive pg pgfirst pii piinorm pubdatestart pubdatetxt pubyr sortorder srctitle srctitlenorm srctype ssids alllist content subj subheadings suppl tomb volfirst volissue volumelist webpdf webpdfpagecount yearnav figure table e-component body mmlmath acknowledge affil appendices articletitle auth authfirstini authfull authkeywords authlast grantnumber grantsponsor grantsponsorid highlightsabst primabst ref specialabst 0926-860X 0926860X true 646 646 C Volume 646 11 118869 118869 118869 20220925 25 September 2022 2022-09-25 2022 article fla © 2022 Elsevier B.V. All rights reserved. REDOXOXIDEMOLTENSALTAGENERALIZEDCATALYSTDESIGNSTRATEGYFOROXIDATIVEDEHYDROGENATIONETHANEVIASELECTIVEHYDROGENCOMBUSTION LIU J 1 Introduction 2 Experimental methods 2.1 Redox catalyst synthesis 2.2 Ethane ODH experiment 2.3 Catalyst characterization 3 Results and discussion 3.1 Characterization of the crystalline phases of the redox catalysts 3.2 Characterization of the surface properties 3.3 Catalyst design – redox oxide selection 3.4 Redox catalyst design – selection of promoters 3.5 Potential redox catalyst optimizations 4 Conclusion CRediT authorship contribution statement Acknowledgement Appendix A Supplementary material References SIIROLA 2014 810 819 J REN 2006 425 451 T GARTNER 2013 3196 3217 C HARIBAL 2017 1024 1035 V MELZER 2019 4012 D NAJARI 2021 4564 4605 S CAVANI 2007 113 131 F NAKAMURA 2006 144 151 K SKOUFA 2012 48 56 Z ZHANG 2003 143 150 X ZHU 2014 58 64 H CHAO 2004 17 31 Z SOLSONA 2006 228 233 B DAI 2000 52 62 H MULLA 2001 43 48 S HENNING 2002 11 D HUFF 1993 11815 11822 M YOKOYAMA 1996 181 188 C DONSI 2005 3453 3470 F BOTELLA 2004 428 438 P XIE 2005 S1381116905004760 Q GAAB 2008 151 158 S GARTNER 2014 12691 12701 C FRANK 2010 644 648 B SHI 2017 389 395 L CASTLE 2002 158 172 W NEAL 2016 1200 1208 L WANG 2021 121286 T NOVOTNY 2019 P NOVOTNY 2020 044713 P YUSUF 2019 3174 3186 S NEAL 2019 894 904 L GAO 2016 7293 7302 Y LUONGO 2022 2200405 G DUDEK 2021 106827 R DING 2021 117910 W TIAN 2021 8002 8011 X TIAN 2022 120894 X TIAN 2022 S0920586122001444 Y SUN 2022 120948 W LI 2021 106771 M ELBADAWI 2016 448 457 A ALGHAMDI 2013 120 130 S YUSUF 2017 5163 5173 S FANG 2009 1 16 H GARCIALABIANO 2004 8168 8177 F ADANEZ 2013 540 549 J HOSSAIN 2008 4433 4451 M MUNGSE 2014 19634 19642 P AZAD 2013 59 69 A SIRIWARDANE 2009 3885 3892 R RUMBLE 2021 J CRCHANDBOOKCHEMISTRYPHYSICS DRIESSENS 1967 48 62 F FAIRLEY 2021 100112 N GREENSFELDER 1949 2573 2584 B SUNDARAM 1977 601 608 K SUNDARAM 1981 946 951 K RYDEN 2014 6255 6267 M ZHENG 2020 8718 8725 C WANG 2020 124792 K LIUX2022X118869 LIUX2022X118869XJ CHU_DOE publishAcceptedManuscriptIndexable CHU_NSF publishAcceptedManuscriptIndexable http://www.elsevier.com/open-access/userlicense/1.0/ 2023-09-22T00:00:00.000Z http://creativecommons.org/licenses/by-nc-nd/4.0/ © 2022 Elsevier B.V. All rights reserved. 2022-09-27T12:44:32.650Z http://vtw.elsevier.com/data/voc/AddOnTypes/50.7/aggregated-refined 0 https://doi.org/10.15223/policy-017 https://doi.org/10.15223/policy-037 https://doi.org/10.15223/policy-012 https://doi.org/10.15223/policy-029 https://doi.org/10.15223/policy-004 item S0926-860X(22)00392-1 S0926860X22003921 1-s2.0-S0926860X22003921 10.1016/j.apcata.2022.118869 271346 2024-01-01T12:34:28.416125Z 2022-09-25 1-s2.0-S0926860X22003921-main.pdf https://s3-eu-west-1.amazonaws.com/prod-ucs-content-store-eu-west/content/pii:S0926860X22003921/MAIN/application/pdf/afef177bbaf180e2bac3d085f31a2f36/main.pdf main.pdf pdf true 6363452 MAIN 10 1-s2.0-S0926860X22003921-main_1.png https://s3-eu-west-1.amazonaws.com/prod-ucs-content-store-eu-west/content/pii:S0926860X22003921/PREVIEW/image/png/55b1fac04bfe2c426f19dc825c828e85/main_1.png main_1.png png 58104 849 656 IMAGE-WEB-PDF 1 1-s2.0-S0926860X22003921-gr7.jpg https://s3-eu-west-1.amazonaws.com/prod-ucs-content-store-eu-west/content/pii:S0926860X22003921/gr7/DOWNSAMPLED/image/jpeg/aeea3b346c3bc5448843cfe5d454b843/gr7.jpg gr7 gr7.jpg jpg 155356 692 678 IMAGE-DOWNSAMPLED 1-s2.0-S0926860X22003921-gr10.jpg https://s3-eu-west-1.amazonaws.com/prod-ucs-content-store-eu-west/content/pii:S0926860X22003921/gr10/DOWNSAMPLED/image/jpeg/0212c1a99ac226fc6660640c675a59fe/gr10.jpg gr10 gr10.jpg jpg 121371 679 678 IMAGE-DOWNSAMPLED 1-s2.0-S0926860X22003921-gr6.jpg https://s3-eu-west-1.amazonaws.com/prod-ucs-content-store-eu-west/content/pii:S0926860X22003921/gr6/DOWNSAMPLED/image/jpeg/319f3a4cd428ff42e91a696f5a660464/gr6.jpg gr6 gr6.jpg jpg 37423 233 678 IMAGE-DOWNSAMPLED 1-s2.0-S0926860X22003921-gr9.jpg https://s3-eu-west-1.amazonaws.com/prod-ucs-content-store-eu-west/content/pii:S0926860X22003921/gr9/DOWNSAMPLED/image/jpeg/d685fd4f681bd6538c2da1ee4e8ff457/gr9.jpg gr9 gr9.jpg jpg 21974 246 339 IMAGE-DOWNSAMPLED 1-s2.0-S0926860X22003921-gr8.jpg https://s3-eu-west-1.amazonaws.com/prod-ucs-content-store-eu-west/content/pii:S0926860X22003921/gr8/DOWNSAMPLED/image/jpeg/55b637ce3eb58446e7982d8058ca9dcb/gr8.jpg gr8 gr8.jpg jpg 21000 259 339 IMAGE-DOWNSAMPLED 1-s2.0-S0926860X22003921-gr3.jpg https://s3-eu-west-1.amazonaws.com/prod-ucs-content-store-eu-west/content/pii:S0926860X22003921/gr3/DOWNSAMPLED/image/jpeg/be339c27a1470f863e93cd44be0e2f63/gr3.jpg gr3 gr3.jpg jpg 105350 562 659 IMAGE-DOWNSAMPLED 1-s2.0-S0926860X22003921-gr2.jpg https://s3-eu-west-1.amazonaws.com/prod-ucs-content-store-eu-west/content/pii:S0926860X22003921/gr2/DOWNSAMPLED/image/jpeg/499b0712314de1a05e23a3527efb1be0/gr2.jpg gr2 gr2.jpg jpg 82253 497 659 IMAGE-DOWNSAMPLED 1-s2.0-S0926860X22003921-ga1.jpg https://s3-eu-west-1.amazonaws.com/prod-ucs-content-store-eu-west/content/pii:S0926860X22003921/ga1/DOWNSAMPLED/image/jpeg/e8cdebb61814c8e45312fe21f0ac4d1b/ga1.jpg ga1 true ga1.jpg jpg 20890 200 367 IMAGE-DOWNSAMPLED 1-s2.0-S0926860X22003921-gr5.jpg https://s3-eu-west-1.amazonaws.com/prod-ucs-content-store-eu-west/content/pii:S0926860X22003921/gr5/DOWNSAMPLED/image/jpeg/95716bdee4f530867663c3bccbfd3def/gr5.jpg gr5 gr5.jpg jpg 104757 598 659 IMAGE-DOWNSAMPLED 1-s2.0-S0926860X22003921-gr4.jpg https://s3-eu-west-1.amazonaws.com/prod-ucs-content-store-eu-west/content/pii:S0926860X22003921/gr4/DOWNSAMPLED/image/jpeg/79427d8033aa94d1ea7897b3de462c4f/gr4.jpg gr4 gr4.jpg jpg 31560 257 565 IMAGE-DOWNSAMPLED 1-s2.0-S0926860X22003921-gr1.jpg https://s3-eu-west-1.amazonaws.com/prod-ucs-content-store-eu-west/content/pii:S0926860X22003921/gr1/DOWNSAMPLED/image/jpeg/226f36a9e2b9fe975efb0b07939e0dcd/gr1.jpg gr1 gr1.jpg jpg 22224 179 376 IMAGE-DOWNSAMPLED 1-s2.0-S0926860X22003921-gr7.sml https://s3-eu-west-1.amazonaws.com/prod-ucs-content-store-eu-west/content/pii:S0926860X22003921/gr7/THUMBNAIL/image/gif/febefe78991c65647ed6954db35f9c59/gr7.sml gr7 gr7.sml sml 12178 163 160 IMAGE-THUMBNAIL 1-s2.0-S0926860X22003921-gr10.sml https://s3-eu-west-1.amazonaws.com/prod-ucs-content-store-eu-west/content/pii:S0926860X22003921/gr10/THUMBNAIL/image/gif/ceaef63d4fe4cb93beb692e993253642/gr10.sml gr10 gr10.sml sml 9691 163 163 IMAGE-THUMBNAIL 1-s2.0-S0926860X22003921-gr6.sml https://s3-eu-west-1.amazonaws.com/prod-ucs-content-store-eu-west/content/pii:S0926860X22003921/gr6/THUMBNAIL/image/gif/f090a859cd9ed9ace0ba102b1fc9b7ba/gr6.sml gr6 gr6.sml sml 6168 75 219 IMAGE-THUMBNAIL 1-s2.0-S0926860X22003921-gr9.sml https://s3-eu-west-1.amazonaws.com/prod-ucs-content-store-eu-west/content/pii:S0926860X22003921/gr9/THUMBNAIL/image/gif/297f0c4d18e959e0038dc690c0690e90/gr9.sml gr9 gr9.sml sml 10896 159 219 IMAGE-THUMBNAIL 1-s2.0-S0926860X22003921-gr8.sml https://s3-eu-west-1.amazonaws.com/prod-ucs-content-store-eu-west/content/pii:S0926860X22003921/gr8/THUMBNAIL/image/gif/bcf3b4b8dd62f03b6644ef4df0d4760d/gr8.sml gr8 gr8.sml sml 10971 164 214 IMAGE-THUMBNAIL 1-s2.0-S0926860X22003921-gr3.sml https://s3-eu-west-1.amazonaws.com/prod-ucs-content-store-eu-west/content/pii:S0926860X22003921/gr3/THUMBNAIL/image/gif/e0f38265e441c9295923c46bb38a6625/gr3.sml gr3 gr3.sml sml 11573 164 192 IMAGE-THUMBNAIL 1-s2.0-S0926860X22003921-gr2.sml https://s3-eu-west-1.amazonaws.com/prod-ucs-content-store-eu-west/content/pii:S0926860X22003921/gr2/THUMBNAIL/image/gif/2728734e55c83569dbeb7f102d39663c/gr2.sml gr2 gr2.sml sml 11637 164 217 IMAGE-THUMBNAIL 1-s2.0-S0926860X22003921-ga1.sml https://s3-eu-west-1.amazonaws.com/prod-ucs-content-store-eu-west/content/pii:S0926860X22003921/ga1/THUMBNAIL/image/gif/f1e772c0e4678e1c1ffe9696646ca4d2/ga1.sml ga1 true ga1.sml sml 8785 119 219 IMAGE-THUMBNAIL 1-s2.0-S0926860X22003921-gr5.sml https://s3-eu-west-1.amazonaws.com/prod-ucs-content-store-eu-west/content/pii:S0926860X22003921/gr5/THUMBNAIL/image/gif/9e08e2e642e8df6b9195b0d5e9bf2309/gr5.sml gr5 gr5.sml sml 11683 164 181 IMAGE-THUMBNAIL 1-s2.0-S0926860X22003921-gr4.sml https://s3-eu-west-1.amazonaws.com/prod-ucs-content-store-eu-west/content/pii:S0926860X22003921/gr4/THUMBNAIL/image/gif/a44c857c6f64d2dfed1eff0bfd2ea981/gr4.sml gr4 gr4.sml sml 5426 100 219 IMAGE-THUMBNAIL 1-s2.0-S0926860X22003921-gr1.sml https://s3-eu-west-1.amazonaws.com/prod-ucs-content-store-eu-west/content/pii:S0926860X22003921/gr1/THUMBNAIL/image/gif/6ece490d19053ed4c8d8a9bac2b59624/gr1.sml gr1 gr1.sml sml 10773 104 219 IMAGE-THUMBNAIL 1-s2.0-S0926860X22003921-gr7_lrg.jpg https://s3-eu-west-1.amazonaws.com/prod-ucs-content-store-eu-west/content/pii:S0926860X22003921/HIGHRES/image/jpeg/cb5506dd6477b87f4fb524c407439de0/gr7_lrg.jpg gr7 gr7_lrg.jpg jpg 1086074 3058 2994 IMAGE-HIGH-RES 1-s2.0-S0926860X22003921-gr10_lrg.jpg https://s3-eu-west-1.amazonaws.com/prod-ucs-content-store-eu-west/content/pii:S0926860X22003921/HIGHRES/image/jpeg/6933e668f37aff5855f7076005ecea99/gr10_lrg.jpg gr10 gr10_lrg.jpg jpg 696583 2999 2994 IMAGE-HIGH-RES 1-s2.0-S0926860X22003921-gr6_lrg.jpg https://s3-eu-west-1.amazonaws.com/prod-ucs-content-store-eu-west/content/pii:S0926860X22003921/HIGHRES/image/jpeg/8721621f59645526e4444d83050bdd71/gr6_lrg.jpg gr6 gr6_lrg.jpg jpg 214731 1030 2994 IMAGE-HIGH-RES 1-s2.0-S0926860X22003921-gr9_lrg.jpg https://s3-eu-west-1.amazonaws.com/prod-ucs-content-store-eu-west/content/pii:S0926860X22003921/HIGHRES/image/jpeg/ecd65454b31ad2d863d45ac8cbce6b2d/gr9_lrg.jpg gr9 gr9_lrg.jpg jpg 117674 1088 1497 IMAGE-HIGH-RES 1-s2.0-S0926860X22003921-gr8_lrg.jpg https://s3-eu-west-1.amazonaws.com/prod-ucs-content-store-eu-west/content/pii:S0926860X22003921/HIGHRES/image/jpeg/d04aa072aef9bf6d2996465ded9298ce/gr8_lrg.jpg gr8 gr8_lrg.jpg jpg 155901 1145 1497 IMAGE-HIGH-RES 1-s2.0-S0926860X22003921-gr3_lrg.jpg https://s3-eu-west-1.amazonaws.com/prod-ucs-content-store-eu-west/content/pii:S0926860X22003921/HIGHRES/image/jpeg/b5d111a5bdbbe5844ce092d81236131f/gr3_lrg.jpg gr3 gr3_lrg.jpg jpg 615191 2483 2911 IMAGE-HIGH-RES 1-s2.0-S0926860X22003921-gr2_lrg.jpg https://s3-eu-west-1.amazonaws.com/prod-ucs-content-store-eu-west/content/pii:S0926860X22003921/HIGHRES/image/jpeg/20e6e2f79d82c1e671b54817014f3630/gr2_lrg.jpg gr2 gr2_lrg.jpg jpg 496502 2197 2911 IMAGE-HIGH-RES 1-s2.0-S0926860X22003921-ga1_lrg.jpg https://s3-eu-west-1.amazonaws.com/prod-ucs-content-store-eu-west/content/pii:S0926860X22003921/HIGHRES/image/jpeg/40b88a88c482621551ec60b47b3c368c/ga1_lrg.jpg ga1 true ga1_lrg.jpg jpg 161455 886 1626 IMAGE-HIGH-RES 1-s2.0-S0926860X22003921-gr5_lrg.jpg https://s3-eu-west-1.amazonaws.com/prod-ucs-content-store-eu-west/content/pii:S0926860X22003921/HIGHRES/image/jpeg/cb4b381bf8221c22c20bf50ac62fd3e6/gr5_lrg.jpg gr5 gr5_lrg.jpg jpg 549596 2640 2911 IMAGE-HIGH-RES 1-s2.0-S0926860X22003921-gr4_lrg.jpg https://s3-eu-west-1.amazonaws.com/prod-ucs-content-store-eu-west/content/pii:S0926860X22003921/HIGHRES/image/jpeg/ef3e0a2c0777a085601178f8a97d3a8e/gr4_lrg.jpg gr4 gr4_lrg.jpg jpg 203492 1136 2495 IMAGE-HIGH-RES 1-s2.0-S0926860X22003921-gr1_lrg.jpg https://s3-eu-west-1.amazonaws.com/prod-ucs-content-store-eu-west/content/pii:S0926860X22003921/HIGHRES/image/jpeg/21540a255d4e664dea0448a96d8d7b2a/gr1_lrg.jpg gr1 gr1_lrg.jpg jpg 124140 790 1663 IMAGE-HIGH-RES 1-s2.0-S0926860X22003921-mmc1.docx https://s3-eu-west-1.amazonaws.com/prod-ucs-content-store-eu-west/content/pii:S0926860X22003921/mmc1/MAIN/application/vnd.openxmlformats-officedocument.wordprocessingml.document/0ab25e04b9dac3b74bf3640b13c9036c/mmc1.docx mmc1 mmc1.docx docx 92310 APPLICATION 1-s2.0-S0926860X22003921-si0001.svg https://s3-eu-west-1.amazonaws.com/prod-ucs-content-store-eu-west/content/pii:S0926860X22003921/image/svg+xml/e571a5e81e4114d8a9140ae474d1bd50/si0001.svg si0001 si0001.svg svg 3472 ALTIMG 1-s2.0-S0926860X22003921-si0002.svg https://s3-eu-west-1.amazonaws.com/prod-ucs-content-store-eu-west/content/pii:S0926860X22003921/image/svg+xml/2ba054c3f690bcd5fe933377f5b73260/si0002.svg si0002 si0002.svg svg 3821 ALTIMG 1-s2.0-S0926860X22003921-si0003.svg https://s3-eu-west-1.amazonaws.com/prod-ucs-content-store-eu-west/content/pii:S0926860X22003921/image/svg+xml/a9db4f0d91f2d4775b414357818a52e7/si0003.svg si0003 si0003.svg svg 4696 ALTIMG 1-s2.0-S0926860X22003921-si0004.svg https://s3-eu-west-1.amazonaws.com/prod-ucs-content-store-eu-west/content/pii:S0926860X22003921/image/svg+xml/b0211864f701db31ada1e886427bafa5/si0004.svg si0004 si0004.svg svg 4327 ALTIMG 1-s2.0-S0926860X22003921-si0005.svg https://s3-eu-west-1.amazonaws.com/prod-ucs-content-store-eu-west/content/pii:S0926860X22003921/image/svg+xml/8138857f8c796a48f2f78028761eba57/si0005.svg si0005 si0005.svg svg 4433 ALTIMG 1-s2.0-S0926860X22003921-si0006.svg https://s3-eu-west-1.amazonaws.com/prod-ucs-content-store-eu-west/content/pii:S0926860X22003921/image/svg+xml/885ac898350fe306c677fad2bef2679e/si0006.svg si0006 si0006.svg svg 4352 ALTIMG 1-s2.0-S0926860X22003921-si0007.svg https://s3-eu-west-1.amazonaws.com/prod-ucs-content-store-eu-west/content/pii:S0926860X22003921/image/svg+xml/f3a7fec51d156fcd24007500b59e58ef/si0007.svg si0007 si0007.svg svg 1247 ALTIMG 1-s2.0-S0926860X22003921-am.pdf https://s3-eu-west-1.amazonaws.com/prod-ucs-content-store-eu-west/content/egi:10L07TNPFJF/MAIN/application/pdf/4efe2415acd5e769540ccb46beed0839/am.pdf am am.pdf pdf false 5294202 AAM-PDF APCATA 118869 118869 S0926-860X(22)00392-1 10.1016/j.apcata.2022.118869 Elsevier B.V. Fig. 1 (a) Overall scheme of CL-ODH and (b) schematic illustration of the core-shell structured, molten salt promoted redox catalyst (film thickness is ∼8–13 nm and the particle diameter is 425–850 µm). Fig. 1 Fig. 2 XRD patterns for the promoted and unpromoted CMO samples. Fig. 2 Fig. 3 XRD patterns for the promoted MGM samples. Fig. 3 Fig. 4 Near-surface atomic composition (oxygen- and carbon-free basis): a) Alkali metals + W/V/Mo in promoted MGM; b) Na+W in Na2WO4 promoted CMOs. Theoretical concentration corresponds to the average concentration of the promoter based on the actual loading. The estimated standard deviations for elemental compositions are ∼1 %. Fig. 4 Fig. 5 Molten-salt-promoted CMOs reaction testing results at 4500 hr−1 and 800, 825 and 850 ℃: a) C2H6 conversion and C2H4 selectivity profiles; b) C2+ olefin yield profiles at 4500 hr−1; c) Product selectivity profiles; d) H2 conversion of promoted CMOs. Fig. 5 Fig. 6 a) The trend of COx selectivity on Na2WO4 promoted CMO series; b. H2 conversion and CO2; b) The relationship between CO2 selectivity and H2 conversion at 850 ℃, 4500 hr−1. Fig. 6 Fig. 7 Molten salt promoted MGMs at 800, 825 and 850 ℃: a) C2H6 conversion and C2H4 selectivity profiles at 4500 hr−1 with error bars; b) C2H6 conversion and C2H4 selectivity profiles at 1500 hr−1; c) C2+ olefin yield profiles of promoted MGMs at 4500 hr−1; d) H2 conversion profiles of promoted MGMs at 4500 hr−1;. Fig. 7 Fig. 8 MGM@molten salt COx selectivity profile at 800–850 ℃, 4500 hr−1. Fig. 8 Fig. 9 Lattice oxygen donation (mL O2/g catalyst) of the promoted MGM samples at 4500 hr−1, 850 ℃. Fig. 9 Fig. 10 a) C2+ selectivity and CO2 selectivity vs H2 conversion at GHSV= 4500 hr−1; b) C2+ selectivity of tungstate-promoted MGMs at GHSV= 4500 hr−1, 1500 hr−1 and 800, 825, and 850 ℃. c) C2+ selectivity of tungstate-promoted MGMs and CMOs at GHSV= 4500 hr−1; d) Linear fit (black) and sigmoidal fit (blue) of all promoted MGMs, and sigmoidal fit (red) of all CMO performance data at different temperature and space velocities (1500 and 4500 hr−1). The blue region highlights the anticipated yield with the better performing redox catalysts (i.e. 88 % conversion, 73.9 % yield to 100 % conversion, 86.7 % yield). The red region highlights the anticipated yield with the less effective redox catalysts (i.e. 88 % conversion, 57.6 % yield to 100 % conversion, 78.2 % yield). Fig. 10 Table 1 Promoter type and loading with respect to the oxide type. Table 1 Oxide Type Promoter Type Promoter Loading (wt %) Mn:Cu= 4:1 (CMO) Na2WO4 (Na-W) 10 wt% Na 2 WO 4 (1.7 wt% Na basis) Mn:Cu= 2:1 (CMO) Na2WO4 (Na-W) Mn:Cu= 1:1 (CMO) Na2WO4 (Na-W) Mn:Cu= 1:2 (CMO) Na2WO4 (Na-W) Mg6MnO8 (MGM) Li2WO4 (Li-W) 20 wt% Li 2 WO 4 Na2WO4 (Na-W) 10 wt% Na 2 WO 4 (6.8 wt% W basis)[36] K2WO4 (K-W) 12 wt% K 2 WO 4 (6.8 wt% W basis) (Li-Na)2WO4 (Li-Na-W) 10 wt% Li 2 WO 4 + 10 wt% Na 2 WO 4 Na2MoO4 (Na-Mo) 7.6 wt% Na 2 MoO 4 (1.7 wt% Na basis) NaVO3 (Na-V 1–1) 20 wt% NaVO 3 (3.8 wt% Na basis) Na3VO4 (Na-V 3–1) 20 wt% Na 3 VO 4 Na3VO4-Na2WO4 (75 mol. % Na2WO4, Na-V-W) 7 wt% V 2 O 5 + 10 wt% Na 2 WO 4 (3.8 wt% Na basis) Na3VO4-Na2MoO4-Na2WO4 (75 mol. % Na2WO4, Na-V-Mo-W) 3.6 wt% V 2 O 5 + 2.6 wt% MoO 3 + 10 wt% Na 2 WO 4 (3.8 wt % Na basis) Redox oxide@molten salt as a generalized catalyst design strategy for oxidative dehydrogenation of ethane via selective hydrogen combustion Junchen Liu Methodology Writing – original draft Seif Yusuf Daniel Jackson William Martin Dennis Chacko Kyle Vogt-Lowell Luke Neal Supervision ⁎ Fanxing Li Supervision Conceptualization Writing – review & editing ⁎ Department of Chemical and Biomolecular Engineering, North Carolina State University, Raleigh, NC 27606, USA Department of Chemical and Biomolecular Engineering, North Carolina State University Raleigh NC 27606 USA Department of Chemical and Biomolecular Engineering, North Carolina State University, Raleigh, NC, 27606 ⁎ Corresponding authors. The current study demonstrates a redox oxide @ molten salt core-shell architecture as a generalized redox catalyst design strategy for chemical looping – oxidative dehydrogenation of ethane. 17 combinations of redox active oxides and molten salts were prepared, evaluated, and characterized. X-ray diffraction indicates that the redox oxides and molten salts are fully compatible, forming separate and stable phases. X-ray photoelectron spectroscopy demonstrates that the molten salts aggregate at the redox oxide surface, forming a core-shell structure to block the non-selective sites responsible for COx formation. Up to ∼74 % single-pass olefin yields were achieved using the proposed redox catalyst design strategy. Statistical analyses of the performance data indicate the potential to achieve up to 86.7 % single-pass yield by simply optimizing the operating conditions using the redox catalysts reported in this study. Meanwhile, the generalizability of the catalyst design strategy offers exciting opportunities to further optimize the composition and performance of the redox catalysts for ethane ODH under a chemical looping scheme with significantly reduced energy consumption and CO2 emissions. Graphical Abstract ga1 Keywords Oxidative dehydrogenation Catalyst design Chemical looping Ethane Ethylene Data Availability Data will be made available on request. 1 Introduction Ethylene is an important commodity chemical to produce various important chemical intermediates and products [1]. The surge of the shale gas production in the United States, which contains a substantial amount of ethane (∼24 vol % ethane in Bakken), has significantly increased ethane supply and thus opened up new opportunities for ethane to ethylene production [2–5]. State-of-the-art for ethylene production is based on steam cracking of ethane and other hydrocarbon feedstocks [6,7]. However, due to the high reaction endothermicity (e.g. Reaction 1), limited single pass conversion (∼60 % at 850 ℃), significant steam consumption, and complex downstream separations, the energy demand for this process is very high (∼16 GJ/ton C2H4 for ethane cracking) [6,8]. The similarity in the boiling points of unconverted ethane and the ethylene product also makes separation challenging. This, coupled with the various byproducts resulting from gas phase cracking reactions, leads to complex and energy-intensive downstream compression and separation operations, accounting for 40–50 % of the total energy consumption of the plant. In addition, the cracker furnaces emit substantial amounts of CO2 and NOx [6,8]. Therefore, novel approaches for the autothermal or exothermic conversion of ethane to ethylene are highly desirable to eliminate the equilibrium limitation, simplify downstream separations, and reduce the energy consumption and pollutant emissions. Oxidative dehydrogenation (ODH) represents such an exothermic, non-equilibrium-limited approach (Reaction 2) [7,9–11]. Extensive studies have been performed on catalyst design and optimization with the goal of improving the ethane conversion and ethylene productivity. Major families of heterogeneous catalysts investigated include supported NiO (∼35–38 % ethylene yield) [12–15], V and V/Mo catalysts (23–32 % yield) [16–18], La/Sr/Nd and Cl doped La/Sr/Fe oxides (∼55 % yields) [19,20], Sn doped Pt (∼55 % yield or higher) [21–24], Mo/V/Te/Nb/O (M1 catalyst, up to 78 % yield) [9,25,26], Mg/Dy/Li/Cl/O (∼55 % yields) [27,28], carbon nanotube and modified boron nitride (up to 50% yield) [29,30]. From a process design standpoint, ethane/O2 co-feed requires an energy-intensive air separation unit for oxygen production and raises safety concerns [25,26,31]. In terms of catalyst design, selectivity towards unwanted CO2 and oxygenates (which are difficult to separate) under O2-rich environment remains a key challenge [7,9,32]. In addition, the long term stability of these catalysts has not been demonstrated [26]. (1) C 2 H 6 ↔ C 2 H 4 + H 2 ∆ H 1123 K = + 143 kJ mol − 1 (2) O 2 + C 2 H 6 ↔ C 2 H 4 + H 2 O ∆ H 1123 K = − 105 kJ mol − 1 Chemical looping-ODH (CL-ODH) provides an alternative route to ethane ODH that overcomes these challenges [32–46]. In CL-ODH, an oxide-based redox catalyst acts as an oxygen carrier to convert ethane with oxygen from its crystal lattice ( Reactions 3 ), as shown in the ODH reactor in Fig. 1 a. The redox catalyst is then reoxidized in air to regenerate its lattice oxygen ( Reactions 4 ), as shown in the regenerator in Fig. 1 a. As illustrated in Reactions 3 and 4 , the exothermic nature of the overall reaction (ODH reaction) can facilitate autothermal operations. The reaction cycle enabled by the redox catalyst also prevents the direct mixing of O2 and ethane and eliminates the need for air separation. (3) C 2 H 6 + MeO x solid ↔ C 2 H 4 + H 2 O + MeO x − 1 solid ∆ H 1 ( oxide dependent ) (4) O 2 + 2 MeO x − 1 ( solid ) ↔ 2 MeO x ( solid ) ∆ H 2 = − 105 − ∆ H 1 kJ mo l − 1 Commonly encountered oxygen carriers in chemical looping combustion like Fe2O3 and CuO tend to be nonselective for ethane ODH and thus lead to COx formation. Several reports have demonstrated that CL-ODH of ethane with FeO/MoO, VOx, and alkali doped LSF can achieve up to ∼50 % C2H4 yield with 90 % selectivity [33–35,38,39,44,47,48]. Luongo et al. has recently reported using nitrates as the precursor to uniformly coats the surface with carbonates as the selective hydrogen combustion catalyst, which, combined with MoVNbTeO based catalyst, achieved ∼42 % C2H6 conversion and 91 % of C2H4 selectivity at 500 °C [39]. Previously, Yusuf et al. and Neal et al. proposed using Na2WO4 as a catalyst surface modifier, validating CL-ODH with Mg6MnO8 @Na2WO4 (MGM@Na2WO4) as a potentially attractive approach by achieving < 8 % CO2 selectivity and ∼86.6 % ethane conversion [36,37,49]. This work suggested that the Na2WO4 promoter may coat the MGM core as a molten shell under the chemical looping reaction conditions, as shown in Fig. 1b. The molten salt shell decreased the presence of Mn4+ in the near-surface region (verified by XPS), inhibited the dissociative adsorption of oxygen, and decreased the rate of oxygen exchange, leading to significantly lower CO2 selectivity and higher C2H4 selectivity than those of unpromoted MGM [36,49]. Despite suppressing COx formation, the shell still support facile oxidation of hydrogen from ethane dehydrogenation. As such, ∼90 % of the H2 conversion was achieved using MGM@Na2WO4. The high H2 conversion is beneficial to facilitate the autothermal operation, as illustrated by Haribal et al., resulting in up to 82 % reduction in CO2 emission when compared to state-of-the-art cracking processes [8]. In summary, the molten Na2WO4-promoted MGM-based CL-ODH can: (i) Circumvent C2H6 cracking equilibrium limitation and maintain high ethylene and C2+ selectivity; (ii) Facilitate autothermal operation via facile H2 combustion [49]. The current study demonstrates a generalized redox catalyst design strategy, i.e. a redox oxide @ molten salt core-shell architecture, for CL-ODH applications. Specifically, 17 combinations of molten salt promoters (Mo-, V-, and W-containing alkali molten salt and their mixtures) and oxides (CuMn2O4 (CMO) and Mg6MnO8 (MGM)) were experimentally tested and characterized, confirming the generality of the core-shell structure and its effectiveness for ethane CL-ODH. Up to ∼74 % single pass olefin yields and 85 % H2 conversions at 80 mol. % C2H6 feed. The extensive experimental results and the composition-performance relationships will enable further optimization of the redox catalyst for increased ethylene and C2+ olefin selectivity and yield under the autothermal CL-ODH scheme with near an order of magnitude lower CO2 emissions. 2 Experimental methods 2.1 Redox catalyst synthesis Table 1 summarizes the compositions of the redox catalysts investigated in this study. CMO core oxide particles were synthesized via a sol-gel method, and the promoted redox catalysts were subsequently obtained through incipient wetness impregnation. Both unpromoted and promoted CMO samples were prepared using Mn(NO3)20.4 H2O (Alfa Aesar, 98 %) and Cu(NO3)20.3 H2O (Sigma-Aldrich). The desired ratio of metal nitrates was dissolved in deionized water with citric acid in a 2.5:1 molar ratio of citric acid (HOC(CH2CO2H)2, Sigma-Aldrich, 99.5 %) to metal ions (Cu2+ and Mn4+). Once dissolved, the solution was heated to 40 ºC and stirred at 500 rpm for 30 min. To promote gel formation from the slurry, a 1.5:1 molar ratio of ethylene glycol (Sigma-Aldrich, 99.8 %) to citric acid was added to the mixture. The temperature was then set to 80 ºC until gel formation (∼1.5 h), and the resulting gel was dried overnight in a 120 ºC oven. Calcination of the CMO redox core oxide samples was conducted in two steps. In the first step, the sample was heated in a muffle furnace to 450 ºC at a ramp rate of 5 ºC/min, where it was held at temperature for 3 h. The resulting powder was then placed into a tube furnace (GSL-15 0X, MTI Corporation) for the second step, where the sample was heated to 1000 ºC at 4 ºC/min for CMO and held for 8 h under continuous air flow. The catalyst was then cooled with air. The MGM core oxide was synthesized by combining Mn(NO3)2 (Sigma-Aldrich, 98 %) and MgO (Materion Advanced Chemicals, ≥99.5 %) precursors in 4 mL of water to create a 15 wt % manganese catalyst. The mixture was then stirred and dried overnight at 80 ºC. The calcination of the MGM paralleled that of CMO, with the MGM sample heating first to 450 ºC for 3 h and then to 900 ºC for 8 h in a muffle furnace before air-cooling to room temperature. Table 1 also lists the promoters and their respective loadings. To promote the CMO sample with Na2WO4 after calcination at 1000 ºC, a calculated amount of Na2WO4·2H2O (Sigma-Aldrich, ≥99 %) was dissolved in deionized (DI) water to achieve a desired ratio of Na2+ ions to catalyst. The resulting solution was then homogenously dripped via pipette onto the CMO sample in a crucible. The crucible was then dried in an oven at 120 ºC overnight before calcination at 900 ºC to achieve the promoted CMO@Na2WO4 sample. A similar approach was used to promote MGM with Li2WO4 (Aldrich Chemistry), Na2WO4·2H2O (Sigma-Aldrich), K2WO4 (Acros Organics), Na2MoO4 (Aldrich Chemistry), Na3VO4 (Aldrich Chemistry), NH4VO3 (Sigma-Aldrich), NaNO3 (Fisher Scientific), and (NH4)6Mo7O24 (Sigma-Aldrich) precursors. Calculated quantities of promoters were dissolved in DI water according to their desired loadings and dried overnight at 80 ºC. After subsequent heating to 200 ºC to decompose the nitrates, the resulting mixture was calcined, ground, and sieved to 425–850 µm for reaction testing. 2.2 Ethane ODH experiment ODH of ethane was performed in a 1/4″ O.D. x 1/8″ I.D. U-tube reactor was loaded with 0.5 g of catalyst particles. A 16 mesh white alumina grit was loaded on each side to minimize void volume and fix the catalyst. In the thermal cracking experiment, the U-tube is filled with the alumina grit to maintain a consistent gas hourly space velocity. Two-step redox cycle experiments were done to determine the catalysts activities. The redox cycle is separated into two steps: (1) during the reduction step, an Alicat mass flow controllers (MFCs) was used inject 5 mL of 80 vol % of ethane (balance Ar) is injected into the U-tube. This is followed by 5 min of pure Ar gas purge. (2) During the oxidation step, 20 vol% of O2 (balance Ar) into the U-tube for 3 min to completely regenerate the redox catalyst and remove coke. Following the reduction and oxidation steps, pure Ar gas purged the system for 5 min and 4 min, respectively. This is followed by four minutes of pure Ar gas purge until the reduction step described in (1). The catalysts have been were tested under six different combinations of temperature (800, 825, 850 ºC) and gas hourly space velocity (GHSV=1500 and 4500 hr−1). The products distribution profile was determined by the gas chromatography (GC). The CO2/CO and H2 are analyzed by two thermal conductivity detector (He/TCD for CO2/CO and Ar/TCD for H2). The hydrocarbons are analyzed by flame ionization detector. Previous study has verified that there is no significant coking in the system, so the selectivity and the conversion of hydrocarbon is calculated by the carbon mass balance determined by the GC using the same calculation method described in the previous literature, the equations for calculating selectivity and conversion are shown in Eqs. (5) and (6) , respectively [36]. The hydrogen to water conversion is calculated based on the hydrogen balance expected from the GC results. (5) S C x H y = x N C x H y O z CO + C O 2 + ∑ n = 1 6 nC n H m − 2 C 2 H 6 × 100 % (6) X C 2 H 6 = ( 1 − 2 N C 2 H 6 CO + C O 2 + ∑ n = 1 6 nC n H m ) × 100 % 2.3 Catalyst characterization To determine the bulk crystalline phases, the as-prepared catalysts were analyzed by powder X-ray diffraction (XRD), Rigaku SmartLab X-ray diffractometer with Cu Kα (λ = 0.1542 nm) radiation operating at 40 kV and 44 mA. All the catalysts were scanned from 10° to 80° (2θ) with a step size of 0.1° holding for 3.5 s at each step was used to generate XRD patterns. To determine the near-surface elemental composition of the as-prepared samples, X-ray photoelectron spectroscopy (XPS) was used. The Kratos Analytical Axis Ultra (monochromated Al Kα) was operated at 10 mA and 15 kV. The results from XPS were analyzed by CasaXPS software, and were calibrated with adventitious peak of carbon 1 s at 284.8 eV. The estimated standard deviations for elemental compositions are ∼1 %. 3 Results and discussion 3.1 Characterization of the crystalline phases of the redox catalysts CMO and MGM were selected as the core oxides to demonstrate the generalizability of the core-shell redox catalyst design, because CuO and MnOx based oxides are common options for CL-combustion (CLC) of carbonaceous fuels such as methane, biomass, coal, and syngas [50–56]. To investigate the effect of different molten salt promoters, we used MGM as the oxide core material [32,36,49]. V and Mo based alkali molten salts were chosen, in addition to tungstate salts, given their similarities [57]. The structural and catalytic effect of different molten salt promoters are elaborated in the following sections. Figs. 2 and 3 summarize the XRD patterns of the promoted CMO and MGM, respectively. As can be seen from Fig. 2 , the characteristic peaks of CuMn2O4 are observed from all the CMO based samples. Compared to the unpromoted samples, promoted samples all show the characteristic peaks of Na2WO4. These results, along with our previous study with MGM@Na2WO4, further demonstrate that promotion with Na2WO4 would remain as a separate phase on different redox oxides without significant ternary phase formation [49]. The observed minor phases formed on the catalyst correlates to the Mn: Cu ratio. As the Mn: Cu ratio decreases, the minor phase shifts from Mn2O3 and/or Mn2O3 to CuO, a behavior consistent with the phase diagram of the Mn-Cu-O system [58]. The effect of these minority phases will be discussed in the following sections. To validate our strategy with other molten salt promoters, W-, Mo-, V-based alkali metal salts and their eutectics on MGM were synthesized and characterized with XRD, as shown in Fig. 3. All of the XRD patterns exhibit the characteristic peaks of MGM. Li-W, Na-W, K-W and Li-Na-W (eutectic) promoted MGM all indicate the presence of the tungstate phase on the MGM with only minor impurity phases (Fig. 3 a). The XRD pattern of Na-Mo promoted MGM in Fig. 3 a also shows Na2MoO4 as a separate phase from MGM. Fig. 3 b summarizes the XRD patterns of MGM promoted with V, V-W, and V-Mo-W mixtures. As expected, 1–1 and 3–1 MGM@Na-V both indicate the presence of Na3VO4 phase. Similarly, both MGM@Na-V-W compositions (75 wt% Na-W and 88 wt% Na-W) show the formation of Na2WO4. A minor NaV2O5 phase is observed for MGM@Na-V-W (75 wt% Na-W), but no vanadate phase was identified for MGM@Na-V-W (88 wt% Na-W), likely due to the limited amount of V added. The XRD pattern of the ternary mixture promoter, MGM@Na-V-Mo-W, reveals the presence of the Na2WO4/Na2MoO4 on MGM but not of the vanadate promoter due to its limited loading. The XRD results also confirm that limited reactions take place between the redox oxide and promoter phases, which is an important finding given that the formation of additional phases can disrupt the desired core-shell structure. 3.2 Characterization of the surface properties XPS results in Fig. 4a, b and Table S2 clearly demonstrate the localization of the promoter phase near the surface of the redox catalysts. As can be seen from Fig. 4, with the exception of MGM@Li2WO4 due to the poor sensitivity of Li in XPS [59], all promoted catalysts show a high surface concentration (150–700 % surface enrichment) of the promoters compared to the average concentration based on the actual loading shown in Table 1. Elemental composition of the X-ray fluorescence of the selected MGM samples are shown in Table S3, which also indicates that the bulk composition of the molten salt is lower than that of the surface concentration, which further confirms that the salt are enriched at the surface. This observation indicates that the molten salt promoters are indeed enriched on the surface of the oxide particles and confirms the core-shell structures for all the molten-salt-promoted oxides. 3.3 Catalyst design – redox oxide selection The feasibility of redox oxide @ molten salt strategy was first demonstrated with a series of CuxMnyOz (CMO) redox oxides promoted with Na2WO4. Fig. 5a-d and Table S4 illustrate the key performance parameters of CuxMnyOz @Na2WO4 (y:x = 4:1,2:1,1:1 and 2:1) at 800–850 ℃ and GHSV = 4500 hr−1. The reliability of the data was examined and the maximum standard deviations of the selectivity and conversion were ≤ 1.5 % (Tables S4). As is apparent from Fig. 5a, unlike unpromoted CMO, every Na2WO4-promoted CMO (1.7 wt% Na basis) exhibited significant increases in C2H4 selectivity (∼5 % → ∼90 %) and yield (∼5 % → ∼56 %), albeit moderately lower C2H6 conversions. Fig. 5d also indicates that the H2 conversions of the promoted CMO series can surpass ∼85 % at 850 ℃, which would sufficiently support autothermal operations for CL-ODH. The effect of reaction temperature was also investigated. Fig. 5a-c implies that as temperature increases from 800 to 850 ℃, the maximum C2+ selectivity decreases slightly from ∼90 % to ∼80 %. However, the temperature increase boosted C2H6 conversion by up to 17 %, which in turn improved C2+ olefin yield (up to 58.9 %) as shown in Fig. 5b. These results further confirm that molten salt promoted redox oxides can enhance C2H4 and C2+ yields. CH4 and C3+ selectivity also rose slightly, possibly due to the heightened radical formation and thermal cracking activities that take place above 800 ℃ [7,60–62]. Moreover, as observed in Fig. 5c and 5d, the temperature increase led to higher H2 conversions but also higher COx selectivity. The effect of varying the Cu: Mn ratio was also examined. Fig. 5c and d indicate that as the Cu composition increases in the promoted CMO, C2H4 selectivity decreases as H2 and C2H6 conversions improve. The COx selectivity shown in Fig. 6a also corroborates the trend, since the Cu composition increases with the increase of COx selectivity. This trend could be explained by the aforementioned change in the XRD patterns due to Mn:Cu ratio changes in Fig. 2. XRD indicated the presence of CuO as Cu content increases. CuO has a strong tendency to decompose and release gaseous oxygen ( P O 2 = 465 Pa at 850 ℃), which would result in deep oxidation (i.e., COx selectivity), higher H2 conversion, and, in turn, higher C2H6 conversion [63–65]. We also note that the C2+ yield first reaches a maximum as Mn:Cu ratio shifts from 4:1–1:1 at 800 ℃ and 825 ℃ (2:1 in 850 ℃) and then decreases as the Cu:Mn ratio continues to increase, as shown in Fig. 5b. These C2+ yield maxima resulted from the competition between C2H6 conversion increase and C2+ selectivity decrease, as discussed earlier. This volcano-shaped behavior also suggests the possibility of further tailoring the Mn:Cu ratio of the redox catalyst to optimize C2+ yield. For the CMO-based redox catalysts, the equilibrium oxygen partial pressure (PO2) of the oxides correlates positively with ethane conversion and negatively with olefin selectivity. Fig. 6b also implies that the composition of the redox oxide influences the H2 combustion and COx selectivity. To sum up, these observations argue that a satisfactory redox oxide should (i) maximize selective H2 combustion to facilitate ethane conversion and autothermal operation and (ii) minimize COx selectivity to reduce unwanted byproducts and emissions. In addition, selected oxide compositions should pair synergistically with the operating conditions of the reactor (e.g., temperature and space velocity). 3.4 Redox catalyst design – selection of promoters Testing different molten salt promoters on MGM further substantiates the redox oxide @ molten salt strategy. Fig. 7a-d and Table S5 highlight the key performance metrics for different molten promoters on MGM catalysts at 800–850 ℃ with gas hourly space velocities of 4500 h−1 and 1500 h−1. The reliability of the data was examined and the maximum standard deviations of the selectivity and conversion were ≤ 1.5 % (Table S5). As shown in Fig. 7a and 7c, relative to that of the thermal cracking blank, all the catalysts (except Li-Na-W and Li-W promoted MGM at 800 ℃ and 4500 hr−1) exhibit a slightly lower C2+ selectivity. However, the comparative increase in the ethane conversion (up to 11.4 % absolute basis) leads to a higher C2+ yield in most of the cases. On the other hand, when compared to unpromoted MGM (<23 % C2+ selectivity), the promoted catalysts show up to a 72 % increase in C2H4 selectivity. This significant improvement in performance leads to a maximum single pass C2+ yield of 60.4 % at 850 ℃. The effects of space velocity and temperature were also investigated. As can be seen in Fig. 7a and b, a lower space velocity leads to lower C2H4 selectivity but higher C2H4 yield. This result is expected since lower space velocities generally lead to greater extents of conversion and increase sequential oxidation of the C2+ products. The effect of temperature is similar to what is observed in the CMO series: as the temperature rises, C2H4 selectivity decreases slightly, but the C2H4 yield improves significantly due to increased H2 and C2H6 conversions. The effect of different promoters and their mixtures are further examined at 850 ℃. Fig. 7a and c indicate that the tungstate promoters MGM@Li-W and MGM@Na-W both achieve high C2H4 selectivity and yield. Their mixture, MGM@Li-Na-W, attained comparable C2H4 and C2+ yields as well. This is anticipated, since both MGM@Li-W and MGM@Na-W have a comparable C2+ selectivities (90.2 % and 94.7 %) and C2H6 conversions (64.7 % vs 63.7 %). Upon adding Mo to V- and W-containing promoters, a synergistic effect is observed. As can be seen from Fig. 7a and c, a slight decrease in C2+ yield (∼3.5 % on an abs. scale) when adding V to Na-W promoter to form Na-V-W promoter. However, further addition of Na-Mo to the binary promoter (Na-V-W) system increases C2+ yield (∼1.4 % on an abs. scale). This phenomenon could be attributed to the high C2+ yield from the Na-Mo promoter alone, which positively affects the C2+ yield in the promoter mixture. It is also noted that the C2H4 selectivity is higher for the Na-V-W-Mo promoter when compared to Na-V and Na-Mo promoters. This synergistic effect was also observed in the context of H2 conversion and COx selectivity. As can be inferred from Fig. 7d, among the tungstate promoters, K2WO4 (K-W) exhibits the highest H2 conversion at 850 ℃, followed by Na-W and Li-W. For the binary molten mixture system, adding Na-W to Li-W (i.e. Li-Na-W) results in a ∼24 % increase in H2 conversion. Interestingly, the addition of Na-W to Li-W also decreases the COx selectivity, as shown in Fig. 8, an effect also observed in Mo-, V-, and W-containing samples. A ∼16 % increase (absolute basis) of H2 conversion is observed after supplementing the Na-W promoter with V to form Na-V-W promoter (∼70–86 %). This improvement could stem from the addition of Na-V (3−1), a promoter that previously demonstrated a high H2 conversion of ∼88 %. Further addition of Na-Mo to the binary promoter (Na-V-W) system also increases H2 conversion, as the Na-Mo promoter alone exhibits up to 89.3 % H2 conversion. In terms of COx selectivity, Fig. 8 shows that the COx selectivity of the MGM@Na-V-Mo eutectic is lower than those of both MGM@Na-V and MGM@Na-Mo. Adding Na-W to MGM@Na-V-Mo slightly increases the COx selectivity, but the COx selectivity remains significantly lower than those of Na-V and Na-Mo alone. From both of the tungstate cases and the V/W/Mo mixture cases, it can be concluded combinations of different molten salts can result in both a lower COx selectivity and a higher H2 conversion. These attributes can benefit the overall CL-ODH scheme. The COx selectivity and the H2 conversion of MGM@Li-W differs significantly from other W-promoted MGM. The COx selectivity of MGM@Li-W was 5 %, which is ∼150 % (relative basis) higher than those of other W-promoted MGM (∼2 %). The H2 conversion of MGM@Li-W was 41.6 %, which is 30–50 % (absolute basis) lower than the average H2 conversion of W-promoted catalysts. Fig. 9 further indicates that the amounts of lattice oxygen donated from Li2WO4-containing samples (i.e. Li-W, Li-Na-W) are up to 69 % lower than non-Li containing catalysts, using Equation S1 and S2. These results reveal that Li2WO4 does not effectively promote selective H2 conversion or ethylene production. 3.5 Potential redox catalyst optimizations The data presented above also demonstrate that the C2+ selectivity is inversely proportional to the CO2 selectivity. Fig. 10a summarizes the selectivity data of both promoted and unpromoted MGMs and CMOs at > 80 % H2 conversion. From this figure, we see that increase in H2 conversion corresponds to decreasing C2+ selectivity and increasing COx selectivity. Both Fig. 10a and S4a imply that competition exists between H2 combustion and ethylene combustion. In other words, reducing the concentration of H2 promotes non-selective combustion of the olefin products by the redox catalyst. Additionally, shown in Fig. S1a , when H2 conversion falls below 80 %, both CO2 and C2+ selectivity stay relatively stable at < 10 % and > 90 %, respectively. Fig. S1b also shows that the CH4 selectivity stays below 4.6 % regardless of the H2 conversion. Further comparisons between 4500 hr−1 and 1500 hr−1 using tungstate-containing promoted MGM are provided in Fig. 10b. Although the R2 values of the fitted curves in Fig. 10b were less than ideal, the slopes of the curves are significantly different statistically (at 4500 hr−1 slope = −0.09, at 1500 hr−1 slope = −0.23, see Table S5 for the statistical test result). This discrepancy suggests that as conversion increases, a higher space velocity should result in higher C2+ selectivity and, consequently, a higher C2+ yield. Fig. 10c summarizes the performance of tungstate-containing promoted MGMs and CMOs, respectively. Again, a significant difference between the slopes is observed (MGM slope = −0.09, CMO slope = −0.31; see Table S6 for the statistical test result). This implies that tungstate-promoted MGMs result in higher C2+ selectivities than tungstate-promoted CMOs, due to higher COx selectivities of the former. This corroborates well with the discussions in the previous sections. Tables S6 and S7 provide the key statistics for the linear fit of the C2+ selectivity and C2+ yield for each catalyst. Table S6 and S7 also indicate that, excluding MGM@Na-V (3−1), all of the MGM catalysts have less negative slopes than that of CMO, which confirms that the MGM redox catalysts perform better than that of CMO in terms of the C2+ selectivity and C2+ yield. Both tables indicate that MGM@Li-Na-W have the potential to reach optimal C2+ yield when the conversion increases. Fig. 10d shows the general trend for C2+ yield, with the C2+ yield performance data of MGMs fitted together using both a linear and sigmoidal model and the performance data of CMOs fitted with a sigmoidal model. Detailed parameters and key statistics are provided in Table S8. All models fit well (R2 > 0.9). We predict that further optimization would result in the expected yield shown in the shaded region of Fig. 10d. This prediction indicated that it is possible to further optimize the C2+ yield to 78.2 – 86.7 %. These analyses indicate that further increase in single-pass olefin yield would be possible by simply optimizing the operating conditions with the redox catalysts reported in this study. Given the flexibility and generalizability of the core-shell redox catalyst system, further tailoring the redox oxide @ molten salt compositions to minimize COx without increasing CH4 selectivity is also likely. 4 Conclusion The present study demonstrates a redox oxide @ molten salt core-shell architecture as a generalized redox catalyst design strategy for chemical looping – oxidative dehydrogenation of ethane. XPS data collected on all 17 redox catalyst samples with different oxide and molten salt combinations confirmed that the molten salt promoters aggregate at the outer surface of the oxide, forming a core-shell structure. XRD results further confirmed that the promoter salts and core oxides are fully compatible by forming separate phases without significant chemical interactions. Catalyst performance tests with CMO@Na2WO4 indicated that a higher Cu content leads to higher C2H6 conversion but also increases CO2 selectivity. This highlights the importance to optimize the redox properties of the core oxides to maximize the C2+ yield. For the MGM-based redox catalysts, we reported a synergistic effect for molten salt mixtures: combination of different molten salts can further enhance the C2+ yield, increase the H2 conversion, and decrease the CO2 selectivity. Up to 74% single pass yield of C2+ olefins was demonstrated, along with low COx selectivity. Statistical fitting of the performance data for the various redox catalyst compositions indicate that 78.2 – 86.7 % single pass olefin yield can potentially be achieved by optimizing the operating conditions (e.g. higher operating temperature coupled with higher space velocity). The generalizability of the core-shell redox catalyst design strategy also offers exciting opportunities to further optimize the composition and performance of the redox catalysts in the context of CL-ODH. CRediT authorship contribution statement Junchen Liu: Methodology, Catalyst synthesis, Data collection and Analysis, Writing – original draft and revision; Seif Yusuf: Catalyst synthesis, Data collection, Analysis; Daniel Jackson: Catalyst Synthesis, Data collection; William Martin: Data collection, Analysis; Dennis Chacko: Data collection, Analysis; Kyle Vogt-Lowell: Data collection and Analysis; Luke Neal: Reviewing, Supervision; Fanxing Li: Supervision, Conceptualization, Writing – review & editing. Declaration of Competing Interest The authors declare that they have no known competing financial interests or personal relationships that could have appeared to influence the work reported in this paper. Acknowledgement This work was supported by the US National Science Foundation (Award No. CBET-2116724), the National Energy Technology Lab (DE-FE0031918), and the Kenan Institute for Engineering, Technology and Science at the NC State University. The characterization was performed in part at the Analytical Instrumentation Facility (AIF) at North Carolina State University and the Duke University Shared Materials Instrumentation Facility (SMIF), which are supported by the State of North Carolina and the National Science Foundation (award number ECCS-2025064). AIF and SMIF are members of the North Carolina Research Triangle Nanotechnology Network (RTNN), a site in the National Nanotechnology Coordinated Infrastructure (NNCI). Author contributions The manuscript was written through contributions of all authors. All authors have given approval to the final version of the manuscript. ‡These authors contributed equally. Appendix A Supporting information Supplementary data associated with this article can be found in the online version at doi:10.1016/j.apcata.2022.118869. Appendix A Supplementary material Supplementary material . References [1] R. Perry, Ethane Storage and Distribution Hub in the United States, 2018. 〈https://www.energy.gov/sites/prod/files/2018/12/f58/Nov%202018%20DOE%20Ethane%20Hub%20Report.pdf〉. [2] J.J. Siirola The impact of shale gas in the chemical industry AIChE J. 60 2014 810 819 10.1002/aic.14368 J.J. Siirola, The impact of shale gas in the chemical industry, AIChE J. 60 (2014) 810–819. https://doi.org/10.1002/aic.14368. [3] J. Ciferno, Developing Technologies for Upcycling Associated Gas into Higher-Value Products., U.S. Department of Energy. 2020) 〈https://www.netl.doe.gov/sites/default/files/2020–12/Upcycling-Associated-Gas-into-Higher-Value-Products-12–2020.pdf〉. [4] Crude Oil To Natural Gas Ratio Explodes to 52:1, EconMatters. (2012). 〈https://www.nasdaq.com/articles/crude-oil-natural-gas-ratio-explodes-521–2012-04–15〉. [5] US natural gas total consumption., 2021). 〈https://www.eia.gov/dnav/ng/hist/n9140us2a.htm〉. [6] T. Ren M. Patel K. Blok Energy 31 2006 425 451 10.1016/j.energy.2005.04.001 T. Ren, M. Patel, K. Blok, Olefins from conventional and heavy feedstocks: Energy use in steam cracking and alternative processes, Energy. 31 (2006) 425–451. https://doi.org/10.1016/j.energy.2005.04.001. [7] C.A. Gärtner A.C. van Veen J.A. Lercher ChemCatChem 5 2013 3196 3217 10.1002/cctc.201200966 C.A. Gärtner, A.C. van Veen, J.A. Lercher, Oxidative Dehydrogenation of Ethane: Common Principles and Mechanistic Aspects, ChemCatChem. 5 (2013) 3196–3217. https://doi.org/10.1002/cctc.201200966. [8] V.P. Haribal L.M. Neal F. Li Energy 119 2017 1024 1035 10.1016/j.energy.2016.11.039 V.P. Haribal, L.M. Neal, F. Li, Oxidative dehydrogenation of ethane under a cyclic redox scheme – Process simulations and analysis, Energy. 119 (2017) 1024–1035. https://doi.org/10.1016/j.energy.2016.11.039. [9] D. Melzer G. Mestl K. Wanninger Y. Zhu N.D. Browning M. Sanchez-Sanchez J.A. Lercher Nat. Commun. 10 2019 4012 10.1038/s41467-019-11940-0 D. Melzer, G. Mestl, K. Wanninger, Y. Zhu, N.D. Browning, M. Sanchez-Sanchez, J.A. Lercher, Design and synthesis of highly active MoVTeNb-oxides for ethane oxidative dehydrogenation, Nat Commun. 10 (2019) 4012. https://doi.org/10.1038/s41467–019-11940–0. [10] S. Najari S. Saeidi P. Concepcion D.D. Dionysiou S.K. Bhargava A.F. Lee K. Wilson Chem. Soc. Rev. 50 2021 4564 4605 10.1039/D0CS01518K S. Najari, S. Saeidi, P. Concepcion, D.D. Dionysiou, S.K. Bhargava, A.F. Lee, K. Wilson, Oxidative dehydrogenation of ethane: catalytic and mechanistic aspects and future trends, Chem. Soc. Rev. 50 (2021) 4564–4605. https://doi.org/10.1039/D0CS01518K. [11] F. Cavani N. Ballarini A. Cericola Catal. Today 127 2007 113 131 10.1016/j.cattod.2007.05.009 F. Cavani, N. Ballarini, A. Cericola, Oxidative dehydrogenation of ethane and propane: How far from commercial implementation?, Catalysis Today. 127 (2007) 113–131. https://doi.org/10.1016/j.cattod.2007.05.009. [12] K.-I. Nakamura T. Miyake T. Konishi T. Suzuki J. Mol. Catal. A: Chem. 260 2006 144 151 10.1016/j.molcata.2006.06.058 K.-I. Nakamura, T. Miyake, T. Konishi, T. Suzuki, Oxidative dehydrogenation of ethane to ethylene over NiO loaded on high surface area MgO, Journal of Molecular Catalysis A: Chemical. 260 (2006) 144–151. https://doi.org/10.1016/j.molcata.2006.06.058. [13] Z. Skoufa E. Heracleous A.A. Lemonidou Chem. Eng. Sci. 84 2012 48 56 10.1016/j.ces.2012.08.007 Z. Skoufa, E. Heracleous, A.A. Lemonidou, Investigation of engineering aspects in ethane ODH over highly selective Ni0.85Nb0.15Ox catalyst, Chemical Engineering Science. 84 (2012) 48–56. https://doi.org/10.1016/j.ces.2012.08.007. [14] X. Zhang J. Liu Y. Jing Y. Xie Appl. Catal. A: Gen. 240 2003 143 150 10.1016/S0926-860X(02)00426-X X. Zhang, J. Liu, Y. Jing, Y. Xie, Support effects on the catalytic behavior of NiO/Al2O3 for oxidative dehydrogenation of ethane to ethylene, Applied Catalysis A: General. 240 (2003) 143–150. https://doi.org/10.1016/S0926–860X(02)00426-X. [15] H. Zhu H. Dong P. Laveille Y. Saih V. Caps J.-M. Basset Catal. Today 228 2014 58 64 10.1016/j.cattod.2013.11.061 H. Zhu, H. Dong, P. Laveille, Y. Saih, V. Caps, J.-M. Basset, Metal oxides modified NiO catalysts for oxidative dehydrogenation of ethane to ethylene, Catalysis Today. 228 (2014) 58–64. https://doi.org/10.1016/j.cattod.2013.11.061. [16] Z.-S. Chao, E. Ruckenstein, A Comparison of Catalytic Oxidative Dehydrogenation of Ethane Over Mixed V-Mg Oxides and Over Those Prepared via a Mesoporous V-Mg-O Pathway, (n.d.) 9. [17] Z.-S. Chao E. Ruckenstein J. Catal. 222 2004 17 31 10.1016/j.jcat.2003.11.004 Z.-S. Chao, E. Ruckenstein, Noncatalytic and catalytic conversion of ethane over V·Mg oxide catalysts prepared via solid reaction or mesoporous precursors, Journal of Catalysis. 222 (2004) 17–31. https://doi.org/10.1016/j.jcat.2003.11.004. [18] B. Solsona A. Dejoz T. Garcia P. Concepcion J. Nieto M. Vazquez M. Navarro Catal. Today 117 2006 228 233 10.1016/j.cattod.2006.05.025 B. Solsona, A. Dejoz, T. Garcia, P. Concepcion, J. Nieto, M. Vazquez, M. Navarro, Molybdenum–vanadium supported on mesoporous alumina catalysts for the oxidative dehydrogenation of ethane, Catalysis Today. 117 (2006) 228–233. https://doi.org/10.1016/j.cattod.2006.05.025. [19] H.X. Dai C.F. Ng C.T. Au J. Catal. 189 2000 52 62 10.1006/jcat.1999.2677 H.X. Dai, C.F. Ng, C.T. Au, Perovskite-Type Halo-oxide La1−xSrxFeO3−δXσ (X=F, Cl) Catalysts Selective for the Oxidation of Ethane to Ethene, Journal of Catalysis. 189 (2000) 52–62. https://doi.org/10.1006/jcat.1999.2677. [20] S.A.R. Mulla O.V. Buyevskaya M. Baerns J. Catal. 197 2001 43 48 10.1006/jcat.2000.3059 S.A.R. Mulla, O.V. Buyevskaya, M. Baerns, Autothermal Oxidative Dehydrogenation of Ethane to Ethylene Using SrxLa1.0Nd1.0Oy Catalysts as Ignitors, Journal of Catalysis. 197 (2001) 43–48. https://doi.org/10.1006/jcat.2000.3059. [21] D.A. Henning L.D. Schmidt Chem. Eng. Sci. 2002 11 D.A. Henning, L.D. Schmidt, Oxidative dehydrogenation of ethane at short contact times: species and temperature proÿles within and after the catalyst, Chemical Engineering Science. (2002) 11. [22] M. Huff L.D. Schmidt J. Phys. Chem. 97 1993 11815 11822 10.1021/j100147a040 M. Huff, L.D. Schmidt, Ethylene formation by oxidative dehydrogenation of ethane over monoliths at very short contact times, J. Phys. Chem. 97 (1993) 11815–11822. https://doi.org/10.1021/j100147a040. [23] C. Yokoyama S.S. Bharadwaj L.D. Schmidt Catal. Lett. 38 1996 181 188 10.1007/BF00806566 C. Yokoyama, S.S. Bharadwaj, L.D. Schmidt, Platinum-tin and platinum-copper catalysts for autothermal oxidative dehydrogenation of ethane to ethylene, Catal Lett. 38 (1996) 181–188. https://doi.org/10.1007/BF00806566. [24] F. Donsì K.A. Williams L.D. Schmidt Ind. Eng. Chem. Res. 44 2005 3453 3470 10.1021/ie0493356 F. Donsì, K.A. Williams, L.D. Schmidt, A Multistep Surface Mechanism for Ethane Oxidative Dehydrogenation on Pt- and Pt/Sn-Coated Monoliths, Ind. Eng. Chem. Res. 44 (2005) 3453–3470. https://doi.org/10.1021/ie0493356. [25] P. Botella J. Catal. 225 2004 428 438 10.1016/j.jcat.2004.04.024 P. Botella, Selective oxidative dehydrogenation of ethane on MoVTeNbO mixed metal oxide catalysts, Journal of Catalysis. 225 (2004) 428–438. https://doi.org/10.1016/j.jcat.2004.04.024. [26] Q. Xie L. Chen W. Weng H. Wan J. Mol. Catal. A: Chem. 2005 S1381116905004760 10.1016/j.molcata.2005.07.004 Q. Xie, L. Chen, W. Weng, H. Wan, Preparation of MoVTe(Sb)Nb mixed oxide catalysts using a slurry method for selective oxidative dehydrogenation of ethane, Journal of Molecular Catalysis A: Chemical. (2005) S1381116905004760. https://doi.org/10.1016/j.molcata.2005.07.004. [27] S. Gaab M. Machli J. Find R.K. Grasselli J.A. Lercher Top. Catal. 23 2008 151 158 S. Gaab, M. Machli, J. Find, R.K. Grasselli, J.A. Lercher, Oxidative dehydrogenation of ethane over novel Li/Dy/Mg mixed oxides: structure–activity study, Topics in Catalysis. 23 (2008) 151–158. [28] C.A. Gärtner A.C. van Veen J.A. Lercher , J. Am. Chem. Soc. 136 2014 12691 12701 10.1021/ja505411s C.A. Gärtner, A.C. van Veen, J.A. Lercher, Oxidative Dehydrogenation of Ethane on Dynamically Rearranging Supported Chloride Catalysts, J. Am. Chem. Soc. 136 (2014) 12691–12701. https://doi.org/10.1021/ja505411s. [29] B. Frank M. Morassutto R. Schomäcker R. Schlögl D.S. Su ChemCatChem 2 2010 644 648 10.1002/cctc.201000035 B. Frank, M. Morassutto, R. Schomäcker, R. Schlögl, D.S. Su, Oxidative Dehydrogenation of Ethane over Multiwalled Carbon Nanotubes, ChemCatChem. 2 (2010) 644–648. https://doi.org/10.1002/cctc.201000035. [30] L. Shi B. Yan D. Shao F. Jiang D. Wang A.-H. Lu Chin. J. Catal. 38 2017 389 395 10.1016/S1872-2067(17)62786-4 L. Shi, B. Yan, D. Shao, F. Jiang, D. Wang, A.-H. Lu, Selective oxidative dehydrogenation of ethane to ethylene over a hydroxylated boron nitride catalyst, Chinese Journal of Catalysis. 38 (2017) 389–395. https://doi.org/10.1016/S1872–2067(17)62786–4. [31] W.F. Castle Int. J. Refrig. 25 2002 158 172 10.1016/S0140-7007(01)00003-2 W.F. Castle, Air separation and liquefaction: recent developments and prospects for the beginning of the new millennium, International Journal of Refrigeration. 25 (2002) 158–172. https://doi.org/10.1016/S0140–7007(01)00003–2. [32] L.M. Neal S. Yusuf J.A. Sofranko F. Li Energy Technol. 4 2016 1200 1208 10.1002/ente.201600074 L.M. Neal, S. Yusuf, J.A. Sofranko, F. Li, Oxidative Dehydrogenation of Ethane: A Chemical Looping Approach, Energy Technol. 4 (2016) 1200–1208. https://doi.org/10.1002/ente.201600074. [33] T. Wang Y. Gao Y. Liu M. Song J. Liu Q. Guo Fuel 303 2021 121286 10.1016/j.fuel.2021.121286 T. Wang, Y. Gao, Y. Liu, M. Song, J. Liu, Q. Guo, Core-shell Na2WO4/CuMn2O4 oxygen carrier with high oxygen capacity for chemical looping oxidative dehydrogenation of ethane, Fuel. 303 (2021) 121286. https://doi.org/10.1016/j.fuel.2021.121286. [34] P. NOVOTNÝ 2019 North Carolina University P. NOVOTNÝ, Molybdenum Oxide Supported on Hematite and Alumina as Redox Catalysts for Chemical Looping Oxidative Dehydrogenation of Ethane, North Carolina University, 2019. [35] P. Novotný S. Yusuf F. Li H.H. Lamb J. Chem. Phys. 152 2020 044713 10.1063/1.5135920 P. Novotný, S. Yusuf, F. Li, H.H. Lamb, MoO 3 /Al 2 O 3 catalysts for chemical-looping oxidative dehydrogenation of ethane, J. Chem. Phys. 152 (2020) 044713. https://doi.org/10.1063/1.5135920. [36] S. Yusuf L. Neal Z. Bao Z. Wu F. Li ACS Catal. 9 2019 3174 3186 10.1021/acscatal.9b00164 S. Yusuf, L. Neal, Z. Bao, Z. Wu, F. Li, Effects of Sodium and Tungsten Promoters on Mg 6 MnO 8 -Based Core–Shell Redox Catalysts for Chemical Looping—Oxidative Dehydrogenation of Ethane, ACS Catal. 9 (2019) 3174–3186. https://doi.org/10.1021/acscatal.9b00164. [37] L.M. Neal V.P. Haribal F. Li IScience 19 2019 894 904 10.1016/j.isci.2019.08.039 L.M. Neal, V.P. Haribal, F. Li, Intensified Ethylene Production via Chemical Looping through an Exergetically Efficient Redox Scheme, IScience. 19 (2019) 894–904. https://doi.org/10.1016/j.isci.2019.08.039. [38] Y. Gao L.M. Neal F. Li ACS Catal. 6 2016 7293 7302 10.1021/acscatal.6b01399 Y. Gao, L.M. Neal, F. Li, Li-Promoted La x Sr 2– x FeO 4−δ Core–Shell Redox Catalysts for Oxidative Dehydrogenation of Ethane under a Cyclic Redox Scheme, ACS Catal. 6 (2016) 7293–7302. https://doi.org/10.1021/acscatal.6b01399. [39] G. Luongo F. Donat A.H. Bork E. Willinger A. Landuyt C.R. Müller Adv. Energy Mater. 2022 2200405 10.1002/aenm.202200405 G. Luongo, F. Donat, A.H. Bork, E. Willinger, A. Landuyt, C.R. Müller, Highly Selective Oxidative Dehydrogenation of Ethane to Ethylene via Chemical Looping with Oxygen Uncoupling through Structural Engineering of the Oxygen Carrier, Advanced Energy Materials. (2022) 2200405. https://doi.org/10.1002/aenm.202200405. [40] R.B. Dudek F. Li Fuel Process. Technol. 218 2021 106827 10.1016/j.fuproc.2021.106827 R.B. Dudek, F. Li, Selective hydrogen combustion as an effective approach for intensified chemical production via the chemical looping strategy, Fuel Processing Technology. 218 (2021) 106827. https://doi.org/10.1016/j.fuproc.2021.106827. [41] W. Ding K. Zhao S. Jiang Z. Zhao Y. Cao F. He Appl. Catal. A: Gen. 609 2021 117910 10.1016/j.apcata.2020.117910 W. Ding, K. Zhao, S. Jiang, Z. Zhao, Y. Cao, F. He, Alkali-metal enhanced LaMnO3 perovskite oxides for chemical looping oxidative dehydrogenation of ethane, Applied Catalysis A: General. 609 (2021) 117910. https://doi.org/10.1016/j.apcata.2020.117910. [42] X. Tian C. Zheng F. Li H. Zhao ACS Sustain. Chem. Eng. 9 2021 8002 8011 10.1021/acssuschemeng.1c02726 X. Tian, C. Zheng, F. Li, H. Zhao, Co and Mo Co-doped Fe 2 O 3 for Selective Ethylene Production via Chemical Looping Oxidative Dehydrogenation, ACS Sustainable Chem. Eng. 9 (2021) 8002–8011. https://doi.org/10.1021/acssuschemeng.1c02726. [43] X. Tian C. Zheng H. Zhao Appl. Catal. B: Environ. 303 2022 120894 10.1016/j.apcatb.2021.120894 X. Tian, C. Zheng, H. Zhao, Ce-modified SrFeO3- for ethane oxidative dehydrogenation coupled with CO2 splitting via a chemical looping scheme, Applied Catalysis B: Environmental. 303 (2022) 120894. https://doi.org/10.1016/j.apcatb.2021.120894. [44] Y. Tian P.R. Westmoreland F. Li Catal. Today 2022 S0920586122001444 10.1016/j.cattod.2022.04.026 Y. Tian, P.R. Westmoreland, F. Li, CaMn0.9Ti0.1O3 based redox catalysts for chemical looping – Oxidative dehydrogenation of ethane: Effects of Na2MoO4 promoter and degree of reduction on the reaction kinetics, Catalysis Today. (2022) S0920586122001444. https://doi.org/10.1016/j.cattod.2022.04.026. [45] W. Sun G. Zhao Y. Gao J. Si Y. Liu Y. Lu Appl. Catal. B: Environ. 304 2022 120948 10.1016/j.apcatb.2021.120948 W. Sun, G. Zhao, Y. Gao, J. Si, Y. Liu, Y. Lu, An oxygen carrier catalyst toward efficient chemical looping-oxidative coupling of methane, Applied Catalysis B: Environmental. 304 (2022) 120948. https://doi.org/10.1016/j.apcatb.2021.120948. [46] M. Li Y. Gao K. Zhao H. Li F. He P. Lv Z. Huang Fuel Process. Technol. 216 2021 106771 10.1016/j.fuproc.2021.106771 M. Li, Y. Gao, K. Zhao, H. Li, F. He, P. Lv, Z. Huang, Mg-doped La1.6Sr0.4FeCoO6 for anaerobic oxidative dehydrogenation of ethane using surface-absorbed oxygen with tuned electronic structure, Fuel Processing Technology. 216 (2021) 106771. https://doi.org/10.1016/j.fuproc.2021.106771. [47] A.H. Elbadawi M.S. Ba-Shammakh S. Al-Ghamdi S.A. Razzak M.M. Hossain Chem. Eng. J. 284 2016 448 457 10.1016/j.cej.2015.08.048 A.H. Elbadawi, M.S. Ba-Shammakh, S. Al-Ghamdi, S.A. Razzak, M.M. Hossain, Reduction kinetics and catalytic activity of VO x /γ-Al 2 O 3 -ZrO 2 for gas phase oxygen free ODH of ethane, Chemical Engineering Journal. 284 (2016) 448–457. https://doi.org/10.1016/j.cej.2015.08.048. [48] S. Al-Ghamdi M. Volpe M.M. Hossain H. de Lasa Appl. Catal. A: Gen. 450 2013 120 130 10.1016/j.apcata.2012.10.007 S. Al-Ghamdi, M. Volpe, M.M. Hossain, H. de Lasa, VOx/c-Al2O3 catalyst for oxidative dehydrogenation of ethane to ethylene: Desorption kinetics and catalytic activity, Applied Catalysis A: General. 450 (2013) 120–130. https://doi.org/10.1016/j.apcata.2012.10.007. [49] S. Yusuf L.M. Neal F. Li ACS Catal. 7 2017 5163 5173 10.1021/acscatal.7b02004 S. Yusuf, L.M. Neal, F. Li, Effect of Promoters on Manganese-Containing Mixed Metal Oxides for Oxidative Dehydrogenation of Ethane via a Cyclic Redox Scheme, ACS Catal. 7 (2017) 5163–5173. https://doi.org/10.1021/acscatal.7b02004. [50] H. Fang L. Haibin Z. Zengli Int. J. Chem. Eng. 2009 2009 1 16 10.1155/2009/710515 H. Fang, L. Haibin, Z. Zengli, Advancements in Development of Chemical-Looping Combustion: A Review, International Journal of Chemical Engineering. 2009 (2009) 1–16. https://doi.org/10.1155/2009/710515. [51] F. García-Labiano L.F. de Diego J. Adánez A. Abad P. Gayán Ind. Eng. Chem. Res. 43 2004 8168 8177 10.1021/ie0493311 F. García-Labiano, L.F. de Diego, J. Adánez, A. Abad, P. Gayán, Reduction and Oxidation Kinetics of a Copper-Based Oxygen Carrier Prepared by Impregnation for Chemical-Looping Combustion, Ind. Eng. Chem. Res. 43 (2004) 8168–8177. https://doi.org/10.1021/ie0493311. [52] J. Adánez P. Gayán I. Adánez-Rubio A. Cuadrat T. Mendiara A. Abad F. García-Labiano L.F. de Diego Energy Procedia 37 2013 540 549 10.1016/j.egypro.2013.05.140 J. Adánez, P. Gayán, I. Adánez-Rubio, A. Cuadrat, T. Mendiara, A. Abad, F. García-Labiano, L.F. de Diego, Use of Chemical-Looping processes for coal combustion with CO2 capture, Energy Procedia. 37 (2013) 540–549. https://doi.org/10.1016/j.egypro.2013.05.140. [53] M.M. Hossain H.I. de Lasa Chem. Eng. Sci. 63 2008 4433 4451 10.1016/j.ces.2008.05.028 M.M. Hossain, H.I. de Lasa, Chemical-looping combustion (CLC) for inherent CO2 separations—a review, Chemical Engineering Science. 63 (2008) 4433–4451. https://doi.org/10.1016/j.ces.2008.05.028. [54] P. Mungse G. Saravanan T. Uchiyama M. Nishibori Y. Teraoka S. Rayalu N. Labhsetwar Phys. Chem. Chem. Phys. 16 2014 19634 19642 10.1039/C4CP01747A P. Mungse, G. Saravanan, T. Uchiyama, M. Nishibori, Y. Teraoka, S. Rayalu, N. Labhsetwar, Copper–manganese mixed oxides: CO 2 -selectivity, stable, and cyclic performance for chemical looping combustion of methane, Phys. Chem. Chem. Phys. 16 (2014) 19634–19642. https://doi.org/10.1039/C4CP01747A. [55] A.-M. Azad A. Hedayati M. Rydén H. Leion T. Mattisson Energy Technol. 1 2013 59 69 10.1002/ente.200009 A.-M. Azad, A. Hedayati, M. Rydén, H. Leion, T. Mattisson, Examining the Cu-Mn-O Spinel System as an Oxygen Carrier in Chemical Looping Combustion, Energy Technology. 1 (2013) 59–69. https://doi.org/10.1002/ente.200009. [56] R. Siriwardane H. Tian G. Richards T. Simonyi J. Poston Energy Fuels 23 2009 3885 3892 10.1021/ef9001605 R. Siriwardane, H. Tian, G. Richards, T. Simonyi, J. Poston, Chemical-Looping Combustion of Coal with Metal Oxide Oxygen Carriers, Energy Fuels. 23 (2009) 3885–3892. https://doi.org/10.1021/ef9001605. [57] J.R. Rumble T.J. Bruno M.J. Doa CRC Handbook of Chemistry and Physics hundred and second ed. 2021 CRC Press, Taylor & Francis Group J.R. Rumble, T.J. Bruno, M.J. Doa, CRC Handbook of Chemistry and Physics, 102nd ed., CRC Press, Taylor & Francis Group, 2021. [58] F.C.M. Driessens G.D. Rieck Z. Anorg. Allg. Chem. 351 1967 48 62 10.1002/zaac.19673510108 F.C.M. Driessens, G.D. Rieck, Phase Equilibria in the System Cu?Mn?O, Z. Anorg. Allg. Chem. 351 (1967) 48–62. https://doi.org/10.1002/zaac.19673510108. [59] N. Fairley V. Fernandez M. Richard‐Plouet C. Guillot-Deudon J. Walton E. Smith D. Flahaut M. Greiner M. Biesinger S. Tougaard D. Morgan J. Baltrusaitis Appl. Surf. Sci. Adv. 5 2021 100112 10.1016/j.apsadv.2021.100112 N. Fairley, V. Fernandez, M. Richard‐Plouet, C. Guillot-Deudon, J. Walton, E. Smith, D. Flahaut, M. Greiner, M. Biesinger, S. Tougaard, D. Morgan, J. Baltrusaitis, Systematic and collaborative approach to problem solving using X-ray photoelectron spectroscopy, Applied Surface Science Advances. 5 (2021) 100112. https://doi.org/10.1016/j.apsadv.2021.100112. [60] B.S. Greensfelder H.H. Voge G.M. Good Ind. Eng. Chem. 41 1949 2573 2584 10.1021/ie50479a043 B.S. Greensfelder, H.H. Voge, G.M. Good, Catalytic and Thermal Cracking of Pure Hydrocarbons: Mechanisms of Reaction, Ind. Eng. Chem. 41 (1949) 2573–2584. https://doi.org/10.1021/ie50479a043. [61] K.M. Sundaram G.F. Froment Chem. Eng. Sci. 32 1977 601 608 10.1016/0009-2509(77)80225-X K.M. Sundaram, G.F. Froment, Modeling of thermal cracking kinetics—I, Chemical Engineering Science. 32 (1977) 601–608. https://doi.org/10.1016/0009–2509(77)80225-X. [62] K.M. Sundaram P.S. Van Damme G.F. Froment AIChE J. 27 1981 946 951 10.1002/aic.690270610 K.M. Sundaram, P.S. Van Damme, G.F. Froment, Coke deposition in the thermal cracking of ethane, AIChE J. 27 (1981) 946–951. https://doi.org/10.1002/aic.690270610. [63] M. Rydén D. Jing M. Källén H. Leion A. Lyngfelt T. Mattisson Ind. Eng. Chem. Res. 53 2014 6255 6267 10.1021/ie4039983 M. Rydén, D. Jing, M. Källén, H. Leion, A. Lyngfelt, T. Mattisson, CuO-Based Oxygen-Carrier Particles for Chemical-Looping with Oxygen Uncoupling – Experiments in Batch Reactor and in Continuous Operation, Ind. Eng. Chem. Res. 53 (2014) 6255–6267. https://doi.org/10.1021/ie4039983. [64] C. Zheng J. Cao Y. Zhang H. Zhao Energy Fuels 34 2020 8718 8725 10.1021/acs.energyfuels.0c00941 C. Zheng, J. Cao, Y. Zhang, H. Zhao, Insight into the Oxidation Mechanism of a Cu-Based Oxygen Carrier (Cu → Cu 2 O → CuO) in Chemical Looping Combustion, Energy Fuels. 34 (2020) 8718–8725. https://doi.org/10.1021/acs.energyfuels.0c00941. [65] K. Wang Q. Yu T. Wu M. van Sint Annaland Q. Qin Chem. Eng. J. 393 2020 124792 10.1016/j.cej.2020.124792 K. Wang, Q. Yu, T. Wu, M. van Sint Annaland, Q. Qin, Thermodynamic and kinetic characteristics of a Cu-Mn composite oxygen carrier for low-temperature chemical-looping air separation, Chemical Engineering Journal. 393 (2020) 124792. https://doi.org/10.1016/j.cej.2020.124792.",
      "scopus-id": "85138532754",
      "coredata": {
        "eid": "1-s2.0-S0926860X22003921",
        "dc:description": "The current study demonstrates a redox oxide @ molten salt core-shell architecture as a generalized redox catalyst design strategy for chemical looping – oxidative dehydrogenation of ethane. 17 combinations of redox active oxides and molten salts were prepared, evaluated, and characterized. X-ray diffraction indicates that the redox oxides and molten salts are fully compatible, forming separate and stable phases. X-ray photoelectron spectroscopy demonstrates that the molten salts aggregate at the redox oxide surface, forming a core-shell structure to block the non-selective sites responsible for COx formation. Up to ∼74 % single-pass olefin yields were achieved using the proposed redox catalyst design strategy. Statistical analyses of the performance data indicate the potential to achieve up to 86.7 % single-pass yield by simply optimizing the operating conditions using the redox catalysts reported in this study. Meanwhile, the generalizability of the catalyst design strategy offers exciting opportunities to further optimize the composition and performance of the redox catalysts for ethane ODH under a chemical looping scheme with significantly reduced energy consumption and CO2 emissions.",
        "openArchiveArticle": "false",
        "prism:coverDate": "2022-09-25",
        "openaccessUserLicense": null,
        "prism:aggregationType": "Journal",
        "prism:url": "https://api.elsevier.com/content/article/pii/S0926860X22003921",
        "dc:creator": [
          {
            "@_fa": "true",
            "$": "Liu, Junchen"
          },
          {
            "@_fa": "true",
            "$": "Yusuf, Seif"
          },
          {
            "@_fa": "true",
            "$": "Jackson, Daniel"
          },
          {
            "@_fa": "true",
            "$": "Martin, William"
          },
          {
            "@_fa": "true",
            "$": "Chacko, Dennis"
          },
          {
            "@_fa": "true",
            "$": "Vogt-Lowell, Kyle"
          },
          {
            "@_fa": "true",
            "$": "Neal, Luke"
          },
          {
            "@_fa": "true",
            "$": "Li, Fanxing"
          }
        ],
        "link": [
          {
            "@_fa": "true",
            "@rel": "self",
            "@href": "https://api.elsevier.com/content/article/pii/S0926860X22003921"
          },
          {
            "@_fa": "true",
            "@rel": "scidir",
            "@href": "https://www.sciencedirect.com/science/article/pii/S0926860X22003921"
          }
        ],
        "dc:format": "application/json",
        "openaccessType": null,
        "pii": "S0926-860X(22)00392-1",
        "prism:volume": "646",
        "articleNumber": "118869",
        "prism:publisher": "Elsevier B.V.",
        "dc:title": "Redox oxide@molten salt as a generalized catalyst design strategy for oxidative dehydrogenation of ethane via selective hydrogen combustion",
        "prism:copyright": "© 2022 Elsevier B.V. All rights reserved.",
        "openaccess": "0",
        "prism:issn": "0926860X",
        "dcterms:subject": [
          {
            "@_fa": "true",
            "$": "Oxidative dehydrogenation"
          },
          {
            "@_fa": "true",
            "$": "Catalyst design"
          },
          {
            "@_fa": "true",
            "$": "Chemical looping"
          },
          {
            "@_fa": "true",
            "$": "Ethane"
          },
          {
            "@_fa": "true",
            "$": "Ethylene"
          }
        ],
        "openaccessArticle": "false",
        "prism:publicationName": "Applied Catalysis A: General",
        "openaccessSponsorType": null,
        "prism:pageRange": "118869",
        "pubType": "fla",
        "prism:coverDisplayDate": "25 September 2022",
        "prism:doi": "10.1016/j.apcata.2022.118869",
        "prism:startingPage": "118869",
        "dc:identifier": "doi:10.1016/j.apcata.2022.118869",
        "openaccessSponsorName": null
      },
      "objects": {
        "object": [
          {
            "@category": "standard",
            "@height": "692",
            "@width": "678",
            "@_fa": "true",
            "$": "https://api.elsevier.com/content/object/eid/1-s2.0-S0926860X22003921-gr7.jpg?httpAccept=%2A%2F%2A",
            "@multimediatype": "JPEG image file",
            "@type": "IMAGE-DOWNSAMPLED",
            "@size": "155356",
            "@ref": "gr7",
            "@mimetype": "image/jpeg"
          },
          {
            "@category": "standard",
            "@height": "679",
            "@width": "678",
            "@_fa": "true",
            "$": "https://api.elsevier.com/content/object/eid/1-s2.0-S0926860X22003921-gr10.jpg?httpAccept=%2A%2F%2A",
            "@multimediatype": "JPEG image file",
            "@type": "IMAGE-DOWNSAMPLED",
            "@size": "121371",
            "@ref": "gr10",
            "@mimetype": "image/jpeg"
          },
          {
            "@category": "standard",
            "@height": "233",
            "@width": "678",
            "@_fa": "true",
            "$": "https://api.elsevier.com/content/object/eid/1-s2.0-S0926860X22003921-gr6.jpg?httpAccept=%2A%2F%2A",
            "@multimediatype": "JPEG image file",
            "@type": "IMAGE-DOWNSAMPLED",
            "@size": "37423",
            "@ref": "gr6",
            "@mimetype": "image/jpeg"
          },
          {
            "@category": "standard",
            "@height": "246",
            "@width": "339",
            "@_fa": "true",
            "$": "https://api.elsevier.com/content/object/eid/1-s2.0-S0926860X22003921-gr9.jpg?httpAccept=%2A%2F%2A",
            "@multimediatype": "JPEG image file",
            "@type": "IMAGE-DOWNSAMPLED",
            "@size": "21974",
            "@ref": "gr9",
            "@mimetype": "image/jpeg"
          },
          {
            "@category": "standard",
            "@height": "259",
            "@width": "339",
            "@_fa": "true",
            "$": "https://api.elsevier.com/content/object/eid/1-s2.0-S0926860X22003921-gr8.jpg?httpAccept=%2A%2F%2A",
            "@multimediatype": "JPEG image file",
            "@type": "IMAGE-DOWNSAMPLED",
            "@size": "21000",
            "@ref": "gr8",
            "@mimetype": "image/jpeg"
          },
          {
            "@category": "standard",
            "@height": "562",
            "@width": "659",
            "@_fa": "true",
            "$": "https://api.elsevier.com/content/object/eid/1-s2.0-S0926860X22003921-gr3.jpg?httpAccept=%2A%2F%2A",
            "@multimediatype": "JPEG image file",
            "@type": "IMAGE-DOWNSAMPLED",
            "@size": "105350",
            "@ref": "gr3",
            "@mimetype": "image/jpeg"
          },
          {
            "@category": "standard",
            "@height": "497",
            "@width": "659",
            "@_fa": "true",
            "$": "https://api.elsevier.com/content/object/eid/1-s2.0-S0926860X22003921-gr2.jpg?httpAccept=%2A%2F%2A",
            "@multimediatype": "JPEG image file",
            "@type": "IMAGE-DOWNSAMPLED",
            "@size": "82253",
            "@ref": "gr2",
            "@mimetype": "image/jpeg"
          },
          {
            "@category": "standard",
            "@height": "200",
            "@width": "367",
            "@_fa": "true",
            "$": "https://api.elsevier.com/content/object/eid/1-s2.0-S0926860X22003921-ga1.jpg?httpAccept=%2A%2F%2A",
            "@multimediatype": "JPEG image file",
            "@type": "IMAGE-DOWNSAMPLED",
            "@size": "20890",
            "@ref": "ga1",
            "@mimetype": "image/jpeg"
          },
          {
            "@category": "standard",
            "@height": "598",
            "@width": "659",
            "@_fa": "true",
            "$": "https://api.elsevier.com/content/object/eid/1-s2.0-S0926860X22003921-gr5.jpg?httpAccept=%2A%2F%2A",
            "@multimediatype": "JPEG image file",
            "@type": "IMAGE-DOWNSAMPLED",
            "@size": "104757",
            "@ref": "gr5",
            "@mimetype": "image/jpeg"
          },
          {
            "@category": "standard",
            "@height": "257",
            "@width": "565",
            "@_fa": "true",
            "$": "https://api.elsevier.com/content/object/eid/1-s2.0-S0926860X22003921-gr4.jpg?httpAccept=%2A%2F%2A",
            "@multimediatype": "JPEG image file",
            "@type": "IMAGE-DOWNSAMPLED",
            "@size": "31560",
            "@ref": "gr4",
            "@mimetype": "image/jpeg"
          },
          {
            "@category": "standard",
            "@height": "179",
            "@width": "376",
            "@_fa": "true",
            "$": "https://api.elsevier.com/content/object/eid/1-s2.0-S0926860X22003921-gr1.jpg?httpAccept=%2A%2F%2A",
            "@multimediatype": "JPEG image file",
            "@type": "IMAGE-DOWNSAMPLED",
            "@size": "22224",
            "@ref": "gr1",
            "@mimetype": "image/jpeg"
          },
          {
            "@category": "thumbnail",
            "@height": "163",
            "@width": "160",
            "@_fa": "true",
            "$": "https://api.elsevier.com/content/object/eid/1-s2.0-S0926860X22003921-gr7.sml?httpAccept=%2A%2F%2A",
            "@multimediatype": "GIF image file",
            "@type": "IMAGE-THUMBNAIL",
            "@size": "12178",
            "@ref": "gr7",
            "@mimetype": "image/gif"
          },
          {
            "@category": "thumbnail",
            "@height": "163",
            "@width": "163",
            "@_fa": "true",
            "$": "https://api.elsevier.com/content/object/eid/1-s2.0-S0926860X22003921-gr10.sml?httpAccept=%2A%2F%2A",
            "@multimediatype": "GIF image file",
            "@type": "IMAGE-THUMBNAIL",
            "@size": "9691",
            "@ref": "gr10",
            "@mimetype": "image/gif"
          },
          {
            "@category": "thumbnail",
            "@height": "75",
            "@width": "219",
            "@_fa": "true",
            "$": "https://api.elsevier.com/content/object/eid/1-s2.0-S0926860X22003921-gr6.sml?httpAccept=%2A%2F%2A",
            "@multimediatype": "GIF image file",
            "@type": "IMAGE-THUMBNAIL",
            "@size": "6168",
            "@ref": "gr6",
            "@mimetype": "image/gif"
          },
          {
            "@category": "thumbnail",
            "@height": "159",
            "@width": "219",
            "@_fa": "true",
            "$": "https://api.elsevier.com/content/object/eid/1-s2.0-S0926860X22003921-gr9.sml?httpAccept=%2A%2F%2A",
            "@multimediatype": "GIF image file",
            "@type": "IMAGE-THUMBNAIL",
            "@size": "10896",
            "@ref": "gr9",
            "@mimetype": "image/gif"
          },
          {
            "@category": "thumbnail",
            "@height": "164",
            "@width": "214",
            "@_fa": "true",
            "$": "https://api.elsevier.com/content/object/eid/1-s2.0-S0926860X22003921-gr8.sml?httpAccept=%2A%2F%2A",
            "@multimediatype": "GIF image file",
            "@type": "IMAGE-THUMBNAIL",
            "@size": "10971",
            "@ref": "gr8",
            "@mimetype": "image/gif"
          },
          {
            "@category": "thumbnail",
            "@height": "164",
            "@width": "192",
            "@_fa": "true",
            "$": "https://api.elsevier.com/content/object/eid/1-s2.0-S0926860X22003921-gr3.sml?httpAccept=%2A%2F%2A",
            "@multimediatype": "GIF image file",
            "@type": "IMAGE-THUMBNAIL",
            "@size": "11573",
            "@ref": "gr3",
            "@mimetype": "image/gif"
          },
          {
            "@category": "thumbnail",
            "@height": "164",
            "@width": "217",
            "@_fa": "true",
            "$": "https://api.elsevier.com/content/object/eid/1-s2.0-S0926860X22003921-gr2.sml?httpAccept=%2A%2F%2A",
            "@multimediatype": "GIF image file",
            "@type": "IMAGE-THUMBNAIL",
            "@size": "11637",
            "@ref": "gr2",
            "@mimetype": "image/gif"
          },
          {
            "@category": "thumbnail",
            "@height": "119",
            "@width": "219",
            "@_fa": "true",
            "$": "https://api.elsevier.com/content/object/eid/1-s2.0-S0926860X22003921-ga1.sml?httpAccept=%2A%2F%2A",
            "@multimediatype": "GIF image file",
            "@type": "IMAGE-THUMBNAIL",
            "@size": "8785",
            "@ref": "ga1",
            "@mimetype": "image/gif"
          },
          {
            "@category": "thumbnail",
            "@height": "164",
            "@width": "181",
            "@_fa": "true",
            "$": "https://api.elsevier.com/content/object/eid/1-s2.0-S0926860X22003921-gr5.sml?httpAccept=%2A%2F%2A",
            "@multimediatype": "GIF image file",
            "@type": "IMAGE-THUMBNAIL",
            "@size": "11683",
            "@ref": "gr5",
            "@mimetype": "image/gif"
          },
          {
            "@category": "thumbnail",
            "@height": "100",
            "@width": "219",
            "@_fa": "true",
            "$": "https://api.elsevier.com/content/object/eid/1-s2.0-S0926860X22003921-gr4.sml?httpAccept=%2A%2F%2A",
            "@multimediatype": "GIF image file",
            "@type": "IMAGE-THUMBNAIL",
            "@size": "5426",
            "@ref": "gr4",
            "@mimetype": "image/gif"
          },
          {
            "@category": "thumbnail",
            "@height": "104",
            "@width": "219",
            "@_fa": "true",
            "$": "https://api.elsevier.com/content/object/eid/1-s2.0-S0926860X22003921-gr1.sml?httpAccept=%2A%2F%2A",
            "@multimediatype": "GIF image file",
            "@type": "IMAGE-THUMBNAIL",
            "@size": "10773",
            "@ref": "gr1",
            "@mimetype": "image/gif"
          },
          {
            "@category": "high",
            "@height": "3058",
            "@width": "2994",
            "@_fa": "true",
            "$": "https://api.elsevier.com/content/object/eid/1-s2.0-S0926860X22003921-gr7_lrg.jpg?httpAccept=%2A%2F%2A",
            "@multimediatype": "JPEG image file",
            "@type": "IMAGE-HIGH-RES",
            "@size": "1086074",
            "@ref": "gr7",
            "@mimetype": "image/jpeg"
          },
          {
            "@category": "high",
            "@height": "2999",
            "@width": "2994",
            "@_fa": "true",
            "$": "https://api.elsevier.com/content/object/eid/1-s2.0-S0926860X22003921-gr10_lrg.jpg?httpAccept=%2A%2F%2A",
            "@multimediatype": "JPEG image file",
            "@type": "IMAGE-HIGH-RES",
            "@size": "696583",
            "@ref": "gr10",
            "@mimetype": "image/jpeg"
          },
          {
            "@category": "high",
            "@height": "1030",
            "@width": "2994",
            "@_fa": "true",
            "$": "https://api.elsevier.com/content/object/eid/1-s2.0-S0926860X22003921-gr6_lrg.jpg?httpAccept=%2A%2F%2A",
            "@multimediatype": "JPEG image file",
            "@type": "IMAGE-HIGH-RES",
            "@size": "214731",
            "@ref": "gr6",
            "@mimetype": "image/jpeg"
          },
          {
            "@category": "high",
            "@height": "1088",
            "@width": "1497",
            "@_fa": "true",
            "$": "https://api.elsevier.com/content/object/eid/1-s2.0-S0926860X22003921-gr9_lrg.jpg?httpAccept=%2A%2F%2A",
            "@multimediatype": "JPEG image file",
            "@type": "IMAGE-HIGH-RES",
            "@size": "117674",
            "@ref": "gr9",
            "@mimetype": "image/jpeg"
          },
          {
            "@category": "high",
            "@height": "1145",
            "@width": "1497",
            "@_fa": "true",
            "$": "https://api.elsevier.com/content/object/eid/1-s2.0-S0926860X22003921-gr8_lrg.jpg?httpAccept=%2A%2F%2A",
            "@multimediatype": "JPEG image file",
            "@type": "IMAGE-HIGH-RES",
            "@size": "155901",
            "@ref": "gr8",
            "@mimetype": "image/jpeg"
          },
          {
            "@category": "high",
            "@height": "2483",
            "@width": "2911",
            "@_fa": "true",
            "$": "https://api.elsevier.com/content/object/eid/1-s2.0-S0926860X22003921-gr3_lrg.jpg?httpAccept=%2A%2F%2A",
            "@multimediatype": "JPEG image file",
            "@type": "IMAGE-HIGH-RES",
            "@size": "615191",
            "@ref": "gr3",
            "@mimetype": "image/jpeg"
          },
          {
            "@category": "high",
            "@height": "2197",
            "@width": "2911",
            "@_fa": "true",
            "$": "https://api.elsevier.com/content/object/eid/1-s2.0-S0926860X22003921-gr2_lrg.jpg?httpAccept=%2A%2F%2A",
            "@multimediatype": "JPEG image file",
            "@type": "IMAGE-HIGH-RES",
            "@size": "496502",
            "@ref": "gr2",
            "@mimetype": "image/jpeg"
          },
          {
            "@category": "high",
            "@height": "886",
            "@width": "1626",
            "@_fa": "true",
            "$": "https://api.elsevier.com/content/object/eid/1-s2.0-S0926860X22003921-ga1_lrg.jpg?httpAccept=%2A%2F%2A",
            "@multimediatype": "JPEG image file",
            "@type": "IMAGE-HIGH-RES",
            "@size": "161455",
            "@ref": "ga1",
            "@mimetype": "image/jpeg"
          },
          {
            "@category": "high",
            "@height": "2640",
            "@width": "2911",
            "@_fa": "true",
            "$": "https://api.elsevier.com/content/object/eid/1-s2.0-S0926860X22003921-gr5_lrg.jpg?httpAccept=%2A%2F%2A",
            "@multimediatype": "JPEG image file",
            "@type": "IMAGE-HIGH-RES",
            "@size": "549596",
            "@ref": "gr5",
            "@mimetype": "image/jpeg"
          },
          {
            "@category": "high",
            "@height": "1136",
            "@width": "2495",
            "@_fa": "true",
            "$": "https://api.elsevier.com/content/object/eid/1-s2.0-S0926860X22003921-gr4_lrg.jpg?httpAccept=%2A%2F%2A",
            "@multimediatype": "JPEG image file",
            "@type": "IMAGE-HIGH-RES",
            "@size": "203492",
            "@ref": "gr4",
            "@mimetype": "image/jpeg"
          },
          {
            "@category": "high",
            "@height": "790",
            "@width": "1663",
            "@_fa": "true",
            "$": "https://api.elsevier.com/content/object/eid/1-s2.0-S0926860X22003921-gr1_lrg.jpg?httpAccept=%2A%2F%2A",
            "@multimediatype": "JPEG image file",
            "@type": "IMAGE-HIGH-RES",
            "@size": "124140",
            "@ref": "gr1",
            "@mimetype": "image/jpeg"
          },
          {
            "@category": "standard",
            "@_fa": "true",
            "$": "https://api.elsevier.com/content/object/eid/1-s2.0-S0926860X22003921-mmc1.docx?httpAccept=%2A%2F%2A",
            "@multimediatype": "Microsoft Word file",
            "@type": "APPLICATION",
            "@size": "92310",
            "@ref": "mmc1",
            "@mimetype": "application/word"
          },
          {
            "@category": "thumbnail",
            "@_fa": "true",
            "$": "https://api.elsevier.com/content/object/eid/1-s2.0-S0926860X22003921-si0001.svg?httpAccept=%2A%2F%2A",
            "@multimediatype": "Scalable Vector Graphics file",
            "@type": "ALTIMG",
            "@size": "3472",
            "@ref": "si0001",
            "@mimetype": "image/svg+xml"
          },
          {
            "@category": "thumbnail",
            "@_fa": "true",
            "$": "https://api.elsevier.com/content/object/eid/1-s2.0-S0926860X22003921-si0002.svg?httpAccept=%2A%2F%2A",
            "@multimediatype": "Scalable Vector Graphics file",
            "@type": "ALTIMG",
            "@size": "3821",
            "@ref": "si0002",
            "@mimetype": "image/svg+xml"
          },
          {
            "@category": "thumbnail",
            "@_fa": "true",
            "$": "https://api.elsevier.com/content/object/eid/1-s2.0-S0926860X22003921-si0003.svg?httpAccept=%2A%2F%2A",
            "@multimediatype": "Scalable Vector Graphics file",
            "@type": "ALTIMG",
            "@size": "4696",
            "@ref": "si0003",
            "@mimetype": "image/svg+xml"
          },
          {
            "@category": "thumbnail",
            "@_fa": "true",
            "$": "https://api.elsevier.com/content/object/eid/1-s2.0-S0926860X22003921-si0004.svg?httpAccept=%2A%2F%2A",
            "@multimediatype": "Scalable Vector Graphics file",
            "@type": "ALTIMG",
            "@size": "4327",
            "@ref": "si0004",
            "@mimetype": "image/svg+xml"
          },
          {
            "@category": "thumbnail",
            "@_fa": "true",
            "$": "https://api.elsevier.com/content/object/eid/1-s2.0-S0926860X22003921-si0005.svg?httpAccept=%2A%2F%2A",
            "@multimediatype": "Scalable Vector Graphics file",
            "@type": "ALTIMG",
            "@size": "4433",
            "@ref": "si0005",
            "@mimetype": "image/svg+xml"
          },
          {
            "@category": "thumbnail",
            "@_fa": "true",
            "$": "https://api.elsevier.com/content/object/eid/1-s2.0-S0926860X22003921-si0006.svg?httpAccept=%2A%2F%2A",
            "@multimediatype": "Scalable Vector Graphics file",
            "@type": "ALTIMG",
            "@size": "4352",
            "@ref": "si0006",
            "@mimetype": "image/svg+xml"
          },
          {
            "@category": "thumbnail",
            "@_fa": "true",
            "$": "https://api.elsevier.com/content/object/eid/1-s2.0-S0926860X22003921-si0007.svg?httpAccept=%2A%2F%2A",
            "@multimediatype": "Scalable Vector Graphics file",
            "@type": "ALTIMG",
            "@size": "1247",
            "@ref": "si0007",
            "@mimetype": "image/svg+xml"
          },
          {
            "@category": "standard",
            "@_fa": "true",
            "$": "https://api.elsevier.com/content/object/eid/1-s2.0-S0926860X22003921-am.pdf?httpAccept=%2A%2F%2A",
            "@multimediatype": "Acrobat PDF file",
            "@type": "AAM-PDF",
            "@size": "5294202",
            "@ref": "am",
            "@mimetype": "application/pdf"
          }
        ]
      },
      "link": {
        "@rel": "abstract",
        "@href": "https://api.elsevier.com/content/abstract/scopus_id/85138532754"
      }
    }
  }
}