{
  "metadata": {
    "title": "Influence of Pd precursors and Cl addition on performance of Pd-Re catalysts in glycerol hydrogenolysis to propanediols",
    "authors": "; ; ",
    "journal": "Applied Catalysis A: General",
    "date": "2016-07-25",
    "doi": "10.1016/j.apcata.2016.04.029",
    "abstract": "",
    "uri": "https://api.elsevier.com/content/article/pii/S0926860X16302137",
    "pii": "S0926860X16302137"
  },
  "fulltext": {
    "full-text-retrieval-response": {
      "scopus-eid": "2-s2.0-84964652714",
      "originalText": "serial JL 271346 291210 291744 291809 31 Applied Catalysis A: General APPLIEDCATALYSISAGENERAL 2016-04-27 2016-04-27 2016-04-30 2016-04-30 2017-08-12T09:10:15 1-s2.0-S0926860X16302137 S0926-860X(16)30213-7 S0926860X16302137 10.1016/j.apcata.2016.04.029 S300 S300.3 FULL-TEXT 1-s2.0-S0926860X16X00099 2024-01-01T12:31:47.592716Z 0 0 20160725 2016 2016-04-27T16:05:16.727809Z absattachment articleinfo articletitlenorm authfirstinitialnorm authfirstsurnamenorm cid cids contenttype copyright crossmark dateloaded dateloadedtxt datesearch datesort dateupdated dco docsubtype doctype doi eid ewtransactionid hubeid indexeddate issn issnnorm itemstage itemtransactionid itemweight openaccess openarchive pg pgfirst pglast pii piinorm pubdatestart pubdatetxt pubyr sectiontitle sortorder srctitle srctitlenorm srctype ssids alllist content subj subheadings suppl tomb volfirst volissue volumelist webpdf webpdfpagecount yearnav figure table e-component body mmlmath acknowledge affil appendices articletitle auth authfirstini authfull authkeywords authlast grantnumber grantsponsor grantsponsorid highlightsabst primabst ref specialabst 0926-860X 0926860X true 522 522 C Volume 522 4 13 20 13 20 20160725 25 July 2016 2016-07-25 2016 Articles article fla © 2016 Elsevier B.V. All rights reserved. INFLUENCEPDPRECURSORSCLADDITIONPERFORMANCEPDRECATALYSTSINGLYCEROLHYDROGENOLYSISPROPANEDIOLS LI Y 1 Introduction 2 Experiments 2.1 Catalysts preparation 2.2 Catalysts characterization 2.3 Glycerol hydrogenolysis 3 Results and discussion 3.1 The texture properties of Pd-Re/SBA-15 prepared with different Pd precursors 3.2 The effect of different Pd precursors on the properties and catalytic performance of Pd-Re/SBA-15 3.3 The effect of Cl component on the properties and catalytic performance of Pd-Re/SBA-15 4 Conclusions Acknowledgments Appendix A Supplementary data References FRUSTERI 2009 77 83 F ZHOU 2008 527 549 C ZUHAIMI 2015 312 319 N AKIYAMA 2009 60 66 M HAAS 2005 83 88 T XIA 2013 11548 11552 S ZHU 2016 782 791 S YU 2010 493 497 W JIANG 2015 1 10 T VANAMA 2015 226 238 P LIU 2012 1257 1261 L GARCIAFERNANDEZ 2015 65 75 S ZHU 2015 391 398 S MUSOLINO 2011 1143 1150 M JIANG 2015 71 79 T MA 2010 148 156 L MA 2011 872 876 L DENG 2014 208 214 C NAKAGAWA 2010 191 194 Y TAMURA 2014 177 187 M LI 2014 5503 5512 Y ZHOU 2008 5839 5841 W MUTO 1996 203 215 K HARRAZ 2012 184 192 F HAN 2005 353 358 Y WANG 2010 7253 7260 F MICHEL 1993 159 182 C LIX2016X13 LIX2016X13X20 LIX2016X13XY LIX2016X13X20XY 2018-04-30T00:00:00Z UnderEmbargo http://creativecommons.org/licenses/by-nc-nd/4.0/ © 2016 Elsevier B.V. All rights reserved. item S0926-860X(16)30213-7 S0926860X16302137 1-s2.0-S0926860X16302137 10.1016/j.apcata.2016.04.029 271346 2024-01-01T12:31:47.592716Z 2016-07-25 1-s2.0-S0926860X16302137-main.pdf https://s3-eu-west-1.amazonaws.com/prod-ucs-content-store-eu-west/content/pii:S0926860X16302137/MAIN/application/pdf/24f598e9223df28c84dc012a4135f35e/main.pdf https://s3.amazonaws.com/prod-ucs-content-store-us-east/content/pii:S0926860X16302137/MAIN/application/pdf/24f598e9223df28c84dc012a4135f35e/main.pdf main.pdf pdf true 2077418 MAIN 8 1-s2.0-S0926860X16302137-main_1.png https://s3-eu-west-1.amazonaws.com/prod-ucs-content-store-eu-west/content/pii:S0926860X16302137/PREVIEW/image/png/764c4e065f13d4565f5f5af126c28cf9/main_1.png https://s3.amazonaws.com/prod-ucs-content-store-us-east/content/pii:S0926860X16302137/PREVIEW/image/png/764c4e065f13d4565f5f5af126c28cf9/main_1.png main_1.png png 57559 849 656 IMAGE-WEB-PDF 1 1-s2.0-S0926860X16302137-fx1.sml https://s3-eu-west-1.amazonaws.com/prod-ucs-content-store-eu-west/content/pii:S0926860X16302137/fx1/THUMBNAIL/image/gif/b82814cd2532b7906ed96f5ce7d3bc19/fx1.sml https://s3.amazonaws.com/prod-ucs-content-store-us-east/content/pii:S0926860X16302137/fx1/THUMBNAIL/image/gif/b82814cd2532b7906ed96f5ce7d3bc19/fx1.sml fx1 true fx1.sml sml 10928 88 219 IMAGE-THUMBNAIL 1-s2.0-S0926860X16302137-gr1.sml https://s3-eu-west-1.amazonaws.com/prod-ucs-content-store-eu-west/content/pii:S0926860X16302137/gr1/THUMBNAIL/image/gif/e259a06e6db129f64f78908b1e6d6ed0/gr1.sml https://s3.amazonaws.com/prod-ucs-content-store-us-east/content/pii:S0926860X16302137/gr1/THUMBNAIL/image/gif/e259a06e6db129f64f78908b1e6d6ed0/gr1.sml gr1 gr1.sml sml 5704 164 72 IMAGE-THUMBNAIL 1-s2.0-S0926860X16302137-gr2.sml https://s3-eu-west-1.amazonaws.com/prod-ucs-content-store-eu-west/content/pii:S0926860X16302137/gr2/THUMBNAIL/image/gif/bce749dc3d55b56d52fd443fd852ae72/gr2.sml https://s3.amazonaws.com/prod-ucs-content-store-us-east/content/pii:S0926860X16302137/gr2/THUMBNAIL/image/gif/bce749dc3d55b56d52fd443fd852ae72/gr2.sml gr2 gr2.sml sml 4322 163 73 IMAGE-THUMBNAIL 1-s2.0-S0926860X16302137-gr3.sml https://s3-eu-west-1.amazonaws.com/prod-ucs-content-store-eu-west/content/pii:S0926860X16302137/gr3/THUMBNAIL/image/gif/b32b6be4d74da3dcc64ae0c6e52796bd/gr3.sml https://s3.amazonaws.com/prod-ucs-content-store-us-east/content/pii:S0926860X16302137/gr3/THUMBNAIL/image/gif/b32b6be4d74da3dcc64ae0c6e52796bd/gr3.sml gr3 gr3.sml sml 8020 164 111 IMAGE-THUMBNAIL 1-s2.0-S0926860X16302137-gr4.sml https://s3-eu-west-1.amazonaws.com/prod-ucs-content-store-eu-west/content/pii:S0926860X16302137/gr4/THUMBNAIL/image/gif/edb44c9b21b5c9fd2afda9b47ec98c9c/gr4.sml https://s3.amazonaws.com/prod-ucs-content-store-us-east/content/pii:S0926860X16302137/gr4/THUMBNAIL/image/gif/edb44c9b21b5c9fd2afda9b47ec98c9c/gr4.sml gr4 gr4.sml sml 30401 147 219 IMAGE-THUMBNAIL 1-s2.0-S0926860X16302137-gr5.sml https://s3-eu-west-1.amazonaws.com/prod-ucs-content-store-eu-west/content/pii:S0926860X16302137/gr5/THUMBNAIL/image/gif/e829ca44a609f73cb4c4a7083ccfcf93/gr5.sml https://s3.amazonaws.com/prod-ucs-content-store-us-east/content/pii:S0926860X16302137/gr5/THUMBNAIL/image/gif/e829ca44a609f73cb4c4a7083ccfcf93/gr5.sml gr5 gr5.sml sml 31891 146 219 IMAGE-THUMBNAIL 1-s2.0-S0926860X16302137-gr6.sml https://s3-eu-west-1.amazonaws.com/prod-ucs-content-store-eu-west/content/pii:S0926860X16302137/gr6/THUMBNAIL/image/gif/1ff84b2380aa295aef1c545877a324a0/gr6.sml https://s3.amazonaws.com/prod-ucs-content-store-us-east/content/pii:S0926860X16302137/gr6/THUMBNAIL/image/gif/1ff84b2380aa295aef1c545877a324a0/gr6.sml gr6 gr6.sml sml 10123 164 219 IMAGE-THUMBNAIL 1-s2.0-S0926860X16302137-fx1.jpg https://s3-eu-west-1.amazonaws.com/prod-ucs-content-store-eu-west/content/pii:S0926860X16302137/fx1/DOWNSAMPLED/image/jpeg/5687eb0223a3d45c8a049edda31828b6/fx1.jpg https://s3.amazonaws.com/prod-ucs-content-store-us-east/content/pii:S0926860X16302137/fx1/DOWNSAMPLED/image/jpeg/5687eb0223a3d45c8a049edda31828b6/fx1.jpg fx1 true fx1.jpg jpg 34577 200 500 IMAGE-DOWNSAMPLED 1-s2.0-S0926860X16302137-gr1.jpg https://s3-eu-west-1.amazonaws.com/prod-ucs-content-store-eu-west/content/pii:S0926860X16302137/gr1/DOWNSAMPLED/image/jpeg/6deb5ea0f08b01f492129380c89fd5bf/gr1.jpg https://s3.amazonaws.com/prod-ucs-content-store-us-east/content/pii:S0926860X16302137/gr1/DOWNSAMPLED/image/jpeg/6deb5ea0f08b01f492129380c89fd5bf/gr1.jpg gr1 gr1.jpg jpg 81819 772 339 IMAGE-DOWNSAMPLED 1-s2.0-S0926860X16302137-gr2.jpg https://s3-eu-west-1.amazonaws.com/prod-ucs-content-store-eu-west/content/pii:S0926860X16302137/gr2/DOWNSAMPLED/image/jpeg/0d09ae1a71da6f738b8ac9f6fc300d4b/gr2.jpg https://s3.amazonaws.com/prod-ucs-content-store-us-east/content/pii:S0926860X16302137/gr2/DOWNSAMPLED/image/jpeg/0d09ae1a71da6f738b8ac9f6fc300d4b/gr2.jpg gr2 gr2.jpg jpg 71545 842 376 IMAGE-DOWNSAMPLED 1-s2.0-S0926860X16302137-gr3.jpg https://s3-eu-west-1.amazonaws.com/prod-ucs-content-store-eu-west/content/pii:S0926860X16302137/gr3/DOWNSAMPLED/image/jpeg/7b56dd6fb06c10849c364a0f1c1dd1f0/gr3.jpg https://s3.amazonaws.com/prod-ucs-content-store-us-east/content/pii:S0926860X16302137/gr3/DOWNSAMPLED/image/jpeg/7b56dd6fb06c10849c364a0f1c1dd1f0/gr3.jpg gr3 gr3.jpg jpg 73189 556 376 IMAGE-DOWNSAMPLED 1-s2.0-S0926860X16302137-gr4.jpg https://s3-eu-west-1.amazonaws.com/prod-ucs-content-store-eu-west/content/pii:S0926860X16302137/gr4/DOWNSAMPLED/image/jpeg/f312a26d5369c8a32ef2bf6b98c2928b/gr4.jpg https://s3.amazonaws.com/prod-ucs-content-store-us-east/content/pii:S0926860X16302137/gr4/DOWNSAMPLED/image/jpeg/f312a26d5369c8a32ef2bf6b98c2928b/gr4.jpg gr4 gr4.jpg jpg 119134 454 678 IMAGE-DOWNSAMPLED 1-s2.0-S0926860X16302137-gr5.jpg https://s3-eu-west-1.amazonaws.com/prod-ucs-content-store-eu-west/content/pii:S0926860X16302137/gr5/DOWNSAMPLED/image/jpeg/a2d81b43d3b5e16b6264eca3e6ed8a97/gr5.jpg https://s3.amazonaws.com/prod-ucs-content-store-us-east/content/pii:S0926860X16302137/gr5/DOWNSAMPLED/image/jpeg/a2d81b43d3b5e16b6264eca3e6ed8a97/gr5.jpg gr5 gr5.jpg jpg 123264 451 678 IMAGE-DOWNSAMPLED 1-s2.0-S0926860X16302137-gr6.jpg https://s3-eu-west-1.amazonaws.com/prod-ucs-content-store-eu-west/content/pii:S0926860X16302137/gr6/DOWNSAMPLED/image/jpeg/cdd8a095108f3506e1a1b51ba9667a7c/gr6.jpg https://s3.amazonaws.com/prod-ucs-content-store-us-east/content/pii:S0926860X16302137/gr6/DOWNSAMPLED/image/jpeg/cdd8a095108f3506e1a1b51ba9667a7c/gr6.jpg gr6 gr6.jpg jpg 27617 239 320 IMAGE-DOWNSAMPLED 1-s2.0-S0926860X16302137-fx1_lrg.jpg https://s3-eu-west-1.amazonaws.com/prod-ucs-content-store-eu-west/content/pii:S0926860X16302137/fx1/HIGHRES/image/jpeg/b3bfc05883e2ecb61ded685c1219a54c/fx1_lrg.jpg https://s3.amazonaws.com/prod-ucs-content-store-us-east/content/pii:S0926860X16302137/fx1/HIGHRES/image/jpeg/b3bfc05883e2ecb61ded685c1219a54c/fx1_lrg.jpg fx1 true fx1_lrg.jpg jpg 315421 886 2213 IMAGE-HIGH-RES 1-s2.0-S0926860X16302137-gr1_lrg.jpg https://s3-eu-west-1.amazonaws.com/prod-ucs-content-store-eu-west/content/pii:S0926860X16302137/gr1/HIGHRES/image/jpeg/606995e2945ae73c2278ed572b40ca8d/gr1_lrg.jpg https://s3.amazonaws.com/prod-ucs-content-store-us-east/content/pii:S0926860X16302137/gr1/HIGHRES/image/jpeg/606995e2945ae73c2278ed572b40ca8d/gr1_lrg.jpg gr1 gr1_lrg.jpg jpg 740767 3414 1500 IMAGE-HIGH-RES 1-s2.0-S0926860X16302137-gr2_lrg.jpg https://s3-eu-west-1.amazonaws.com/prod-ucs-content-store-eu-west/content/pii:S0926860X16302137/gr2/HIGHRES/image/jpeg/66f3b05b870e30cad664a6bebf9ecbde/gr2_lrg.jpg https://s3.amazonaws.com/prod-ucs-content-store-us-east/content/pii:S0926860X16302137/gr2/HIGHRES/image/jpeg/66f3b05b870e30cad664a6bebf9ecbde/gr2_lrg.jpg gr2 gr2_lrg.jpg jpg 544701 3733 1667 IMAGE-HIGH-RES 1-s2.0-S0926860X16302137-gr3_lrg.jpg https://s3-eu-west-1.amazonaws.com/prod-ucs-content-store-eu-west/content/pii:S0926860X16302137/gr3/HIGHRES/image/jpeg/b3b74171ffb7a03458367c0c56308d0d/gr3_lrg.jpg https://s3.amazonaws.com/prod-ucs-content-store-us-east/content/pii:S0926860X16302137/gr3/HIGHRES/image/jpeg/b3b74171ffb7a03458367c0c56308d0d/gr3_lrg.jpg gr3 gr3_lrg.jpg jpg 669285 2465 1667 IMAGE-HIGH-RES 1-s2.0-S0926860X16302137-gr4_lrg.jpg https://s3-eu-west-1.amazonaws.com/prod-ucs-content-store-eu-west/content/pii:S0926860X16302137/gr4/HIGHRES/image/jpeg/d00d825c08ee5021c713bb034b93ae95/gr4_lrg.jpg https://s3.amazonaws.com/prod-ucs-content-store-us-east/content/pii:S0926860X16302137/gr4/HIGHRES/image/jpeg/d00d825c08ee5021c713bb034b93ae95/gr4_lrg.jpg gr4 gr4_lrg.jpg jpg 1070666 2007 3000 IMAGE-HIGH-RES 1-s2.0-S0926860X16302137-gr5_lrg.jpg https://s3-eu-west-1.amazonaws.com/prod-ucs-content-store-eu-west/content/pii:S0926860X16302137/gr5/HIGHRES/image/jpeg/bf0c4fc21607459f440dad14d735c48a/gr5_lrg.jpg https://s3.amazonaws.com/prod-ucs-content-store-us-east/content/pii:S0926860X16302137/gr5/HIGHRES/image/jpeg/bf0c4fc21607459f440dad14d735c48a/gr5_lrg.jpg gr5 gr5_lrg.jpg jpg 1093920 1997 3000 IMAGE-HIGH-RES 1-s2.0-S0926860X16302137-gr6_lrg.jpg https://s3-eu-west-1.amazonaws.com/prod-ucs-content-store-eu-west/content/pii:S0926860X16302137/gr6/HIGHRES/image/jpeg/80ec1538dd2418e33a307cadd7529072/gr6_lrg.jpg https://s3.amazonaws.com/prod-ucs-content-store-us-east/content/pii:S0926860X16302137/gr6/HIGHRES/image/jpeg/80ec1538dd2418e33a307cadd7529072/gr6_lrg.jpg gr6 gr6_lrg.jpg jpg 227463 1060 1417 IMAGE-HIGH-RES 1-s2.0-S0926860X16302137-mmc1.doc https://s3-eu-west-1.amazonaws.com/prod-ucs-content-store-eu-west/content/pii:S0926860X16302137/mmc1/MAIN/application/msword/87e06d7bb2a72db83d9d37ff6de974e0/mmc1.doc https://s3.amazonaws.com/prod-ucs-content-store-us-east/content/pii:S0926860X16302137/mmc1/MAIN/application/msword/87e06d7bb2a72db83d9d37ff6de974e0/mmc1.doc mmc1 mmc1.doc doc 738816 APPLICATION 1-s2.0-S0926860X16302137-si1.gif https://s3-eu-west-1.amazonaws.com/prod-ucs-content-store-eu-west/content/pii:S0926860X16302137/STRIPIN/image/gif/97f0b1602e7a0647193ebd9de5171bed/si1.gif https://s3.amazonaws.com/prod-ucs-content-store-us-east/content/pii:S0926860X16302137/STRIPIN/image/gif/97f0b1602e7a0647193ebd9de5171bed/si1.gif si1 si1.gif gif 2111 35 452 ALTIMG 1-s2.0-S0926860X16302137-si2.gif https://s3-eu-west-1.amazonaws.com/prod-ucs-content-store-eu-west/content/pii:S0926860X16302137/STRIPIN/image/gif/89393c78d8e5ef07228bb0c2149c55da/si2.gif https://s3.amazonaws.com/prod-ucs-content-store-us-east/content/pii:S0926860X16302137/STRIPIN/image/gif/89393c78d8e5ef07228bb0c2149c55da/si2.gif si2 si2.gif gif 1938 35 373 ALTIMG APCATA 15857 S0926-860X(16)30213-7 10.1016/j.apcata.2016.04.029 Elsevier B.V. Fig. 1 Wide angle XRD patterns of Pd-Re catalyst prepared with different treatments. (a) Pd(C)-Re/SBA-15 (b) Pd(N)-Re/SBA-15 and (c) Pd(A)-Re/SBA-15. Fig. 1 Fig. 2 H2-TPR profiles of catalysts. (a) Pd-Re/SBA-15 prepared with different Pd precursors, (b) Pd(N)-Re/SBA-15 prepared with different amounts of HCl addition, (c) Pd(A)-Re/SBA-15 prepared with different amounts of HCl addition. Fig. 2 Fig. 3 Wide angle XRD patterns of Pd-Re catalysts prepared with different amounts of HCl addition and treated with H2 at 250°C. (a) Pd(N)-Re/SBA-15, (b) Pd(A)-Re/SBA-15. Fig. 3 Fig. 4 TEM images of Pd(N)-Re/SBA-15 prepared with different amount of HCl addition and treated with H2 at 250°C. (a) without HCl addition, (b) Pd:HCl=5:1, (c) Pd:HCl=1:1, (d) Pd:HCl=1:5. Fig. 4 Fig. 5 TEM images of Pd(A)-Re/SBA-15 prepared with different amount of HCl addition and treated with H2 at 250°C. (a) without HCl addition, (b) Pd:HCl=5:1, (c) Pd:HCl=1:1, (d) Pd:HCl=1:5/. Fig. 5 Fig. 6 NH3-TPD profiles of Pd-Re/SBA-15 prepared with different amount of HCl addition and treated with H2 at 250°C. Fig. 6 Table 1 Catalytic performance of Pd-Re/SBA-15 prepared with different Pd precursors in glycerol hydrogenolysis. Table 1 Catalyst Treatment Condition Glycerol Conv. (%) Select. (%) C1–2 1-PO 2-PO 1,2-PD 1,3-PD Pd(C)-Re/SBA-15 H2-250 40.7 5.2 24.6 2.1 59.9 8.2 Pd(C)-Re/SBA-15 H2-500 41.4 4.7 25.3 3.5 57.0 9.5 Pd(N)-Re/SBA-15 H2-250 19.3 4.2 29.4 3.6 55.7 7.1 Pd(N)-Re/SBA-15 H2-500 15.4 5.7 27.7 2.8 54.8 9.0 Pd(A)-Re/SBA-15 H2-250 18.0 4.1 17.6 1.5 67.4 9.5 Pd(A)-Re/SBA-15 H2-500 22.1 4.2 22.1 2.3 60.4 11.0 Reaction conditions: 0.15g Pd catalyst, 40% glycerol aqueous solution 10mL, 200°C, 8MPa H2, 18h, 700rpm. C1–2: methane, methanol, ethanol and ethylene glycol, PO: propanol, PD: propanediol. Table 2 Influence of addition Cl on the catalytic performance of Pd(N)-Re/SBA-15 and Pd(A)-Re/SBA-15 prepared with Pd(NO3)2 and Pd(OAc)2 as precursor. Table 2 No. Catalyst Cl precursor type Pd:Cl (mol ratio) GlycerolConv. (%) Select. (%) C1–2 1-PO 2-PO 1,2-PD 1,3-PD 1 Pd(N)-Re/SBA-15 – – 19.3 4.2 29.4 3.6 55.7 7.1 2 Pd(N)-Re/SBA-15 HCl 5:1 21.4 3.4 24.6 3.2 59.1 9.7 3 Pd(N)-Re/SBA-15 HCl 2:1 25.0 3.5 27.8 3.0 56.1 9.5 4 Pd(N)-Re/SBA-15 HCl 1:1 36.6 3.1 35.9 4.3 48.3 8.3 5 Pd(N)-Re/SBA-15 HCl 1:2 38.7 3.9 31.6 3.0 51.4 10.1 6 Pd(N)-Re/SBA-15 HCl 1:5 45.3 3.0 40.5 4.8 43.6 8.2 7 Pd(N)-Re/SBA-15 NaCl 1:2 45.8 3.4 32.4 4.5 51.1 8.6 8 Pd(N)-Re/SBA-15 NaNO3 – 20.0 5.8 17.0 1.9 67.7 7.6 9 Pd(A)-Re/SBA-15 – – 18.0 4.1 17.6 1.5 67.4 9.5 10 Pd(A)-Re/SBA-15 HCl 5:1 24.4 3.8 28.8 2.9 55.7 8.8 11 Pd(A)-Re/SBA-15 HCl 2:1 25.8 3.5 40.2 2.6 43.9 9.8 12 Pd(A)-Re/SBA-15 HCl 1:1 32.7 2.7 35.4 2.4 49.4 10.2 13 Pd(A)-Re/SBA-15 HCl 1:2 42.0 2.8 32.7 3.1 52.5 8.9 14 Pd(A)-Re/SBA-15 HCl 1:5 59.5 4.5 39.1 5.6 45.0 5.8 Reaction Conditions: 0.15g Pd catalyst, 40% glycerol aqueous solution 10mL, 200°C, 8MPa H2, 18h,700rpm. C1–2: methane, methanol, ethanol and ethylene glycol, PO: propanol, PD: propanediol. Table 3 Actual amount of Cl in Pd-Re/SBA-15 prepared with different treatments. Table 3 Catalyst PdPrecursor Pd:HCl(mol ratio) Treatment Cl content(%) Pd(N)-Re/SBA-15 Pd(NO3)2 1:5 Only evaporation 3.76 Pd(N)-Re/SBA-15 Pd(NO3)2 1:5 Only dried at 110 1.51 Pd(N)-Re/SBA-15 Pd(NO3)2 1:5 H2-250 0.17 Pd(A)-Re/SBA-15 Pd(OAc)2 1:5 Only evaporation 3.22 Pd(A)-Re/SBA-15 Pd(OAc)2 1:5 Only dried at 110 0.51 Pd(A)-Re/SBA-15 Pd(OAc)2 1:5 H2-250 0.12 Pd(C)-Re/SBA-15 PdCl2 – Only evaporation 0.98 Pd(C)-Re/SBA-15 PdCl2 – Only dried at 110 0.91 Pd(C)-Re/SBA-15 PdCl2 – H2-250 0.14 Table 4 Acid amounts of Pd-Re/SBA-15 prepared with different Pd precursors. Table 4 Catalyst Precursor Pd:HCl a (mol ratio) Total Acid amount b μ mol/g Amount of weak acid sites b μ mol/g Amount of moderateacid sites b μ mol/g Pd(C)-Re/SBA-15 PdCl2 – 175 100.4 74.2 Pd(N)-Re/SBA-15 Pd(NO3)2 – 232 59.7 172.3 Pd(N)-Re/SBA-15 Pd(NO3)2 1:5 194 95.4 98.6 Pd(A)-Re/SBA-15 Pd(OAc)2 – 226 78.6 147.6 Pd(A)-Re/SBA-15 Pd(OAc)2 1:5 196 95.4 100.3 a Addition amount of HCl during preparation. b Obtained from NH3-TPD. Influence of Pd precursors and Cl addition on performance of Pd-Re catalysts in glycerol hydrogenolysis to propanediols Yuming Li a Huimin Liu a Lan Ma a b Dehua He a ⁎ a Innovative Catalysis Program, Key Lab. of Organic Optoelectronics & Molecular Engineering of Ministry of Education, Department of Chemistry, Tsinghua University, Beijing 100084, China Innovative Catalysis Program Key Lab. of Organic Optoelectronics & Molecular Engineering of Ministry of Education Department of Chemistry Tsinghua University Beijing 100084 China b Institute of Chemical Defence, Beijing 102205, China Institute of Chemical Defence Beijing 102205 China ⁎ Corresponding author. Graphical abstract Pd-Re/SBA-15 catalysts with different Pd precursors were prepared by the impregnation method. N2 adsorption-desorption, XRD, H2-TPR, TEM and NH3-TPD were used to characterize the physical and chemical properties of the catalysts. Pd-Re catalysts with different precursors showed different activities in the reaction of glycerol hydrogenolysis. 5Pd-5Re/SBA-15 with PdCl2 as Pd precursor had higher activity than those with Pd(NO3)2 and Pd(OAc)2 as precursors. The existence of Cl could affect the particle sizes, reduction behaviors and the acid properties of Pd-Re catalysts. Keywords Glycerol hydrogenolysis Palladium Rhenium Precursor 1 Introduction Glycerol is produced as a by-product during the production of biodiesel by the transesterification of vegetable oils or animal fats with methanol. During this process, 1kg of glycerol would be produced as a by-product from 10kg of raw materials [1–3]. Converting this over-produced glycerol into more value-added downstream products can not only decrease the price of biodiesel, but also use biomass efficiently. The catalytic hydrogenolysis of glycerol can produce 1,2-propanediols (1,2-PD), 1,3-propanediols (1,3-PD) and other chemicals, including propanols and glycol. Among these chemicals, 1,2-PD can be used to produce cosmetics, antifreeze, epoxy resin and so on. For 1,3-PD, which is much more valuable than others, it could be used in the pharmaceuticals industry [4,5]. For glycerol hydrogenolysis, non-noble metals including Cu, Ni and noble metals including Ru, Pd and Pt have been often used as the active components of catalysts. For the most of Cu and Ni catalysts, 1,2-PD was the main product. Xia et al. [6] prepared a multiwall carbon nanotube-pillared layered Cu0.4/Mg5.6Al2O8.6 catalyst and used in glycerol hydrogenolysis, and the conversion of glycerol and selectivity to 1,2-PD were 64.8% and 99.3%, respectively. Zhu et al. [7] used CuCe-SBA catalysts in hydrogenolysis of biomass-derived glycerol and sugar alcohols, and got about 97% yield of 1,2-PD from glycerol hydrogenolysis at 180°C. Yu et al. [8] employed Ni/AC treated with KBH4 in this reaction, and the conversion of glycerol over Ni/AC reached 63.2% after 24h reaction and the selectivity to 1,2-PD was 77.4%. Jiang et al. [9] prepared bimetallic Ni-Co catalysts and found that with the promoting effect of ceria, the total glycol selectivity over Ni-Co-Ce catalysts could reach about 81%. For noble metal based catalysts, most of them could convert glycerol to 1,3-PD and 1,2-PD, but the selectivity to 1,3-PD was low. Vanama et al. [10] found that Ru/MCM-41 could convert 62% of glycerol in the reaction under 230°C, while the selectivities to 1,2-PD and 1,3-PD were 38% and 20%, respectively. Liu et al. [11] texted Pt/WO3 catalysts, and the ratio of 1,3-PD to 1,2-PD was 9.6. Pt/WOx/Al2O3 catalysts were studied by García-Fernández et al. [12], and 1,3-PD selectivity reached 52% in the glycerol hydrogenolysis. Zhu et al. [13] also studied the Pt-WOx/Al2O3 bifunctional catalysts in glycerol hydrogenolysis with a fixed-bed reactor, and the selectivity to 1,3-PD could reach 66% at 160°C. Pd-based supported catalysts also showed activity in the glycerol hydrogenolysis. Musoline et al. [14] prepared different supported PdCo catalysts with co-precipitation method. Using PdCo catalysts got about 70% glycerol conversion and selectivity to 1,2-PD was 86.5% when n-propanol (1-PO) was used as the solvent. Jiang et al. [15] tested a Pd-Ni bimetallic catalyst in glycerol hydrogenolysis, and after 4 times recycle, the catalyst could still maintain its activity and selectivity to 1,2-PD, compared with the fresh one. Recently, Re also gains much attention as a co-active component, and Ru-Re [16,17], Pt-Re [18], Rh-Re [19] and Ir-Re [20] all showed relatively good activities. In our previous study [21], the addition of Re into the Pd catalyst greatly increased the conversion of glycerol. But the influences of Pd precursors and Cl component on the properties of the Pd-Re catalysts and the catalytic performance in glycerol hydrogenolysis were rarely investigated. To further study the behaviors of Pd-Re bi-component catalysts, different Pd precursors and Cl component addition into Pd-Re catalysts were studied in this work. The effects of Pd nitrate, Pd chloride and Pd acetate as the precursors of Pd on the activities of Pd-Re catalysts were investigated. On the other hand, the influence of Cl addition into the Pd-Re catalyst during impregnation process, when Pd nitrate and Pd acetate were used as precursors, on the properties and performance of Pd-Re catalysts were also studied. 2 Experiments 2.1 Catalysts preparation SBA-15 (a kind of ordered mesoporous silica) was used as the support of Pd-Re catalysts and prepared by the method mentioned in a literature [22]. The brief preparation process was as follows: P123 (EO20PO70EO20, Mw =5800) was dissolved in an aqueous solution of HCl (2mol/L) and stirred at 35°C for 4h until the solution became transparent. Tetraethoxysilane (TEOS) was then added into the solution and hydrolyzed at 35°C for 20h, and then formed gel was aged at 80°C for 24h. After cooled down, the precipitation was filtered and washed until the filtrate was neutral, the obtained paste was dried at 40°C for 48h and calcinated in flowing air at 500°C for 5h. All bi-component Pd-Re/SBA-15 catalysts were all prepared by the co-impregnation method. A typical procedure was as below. PdCl2 was dissolved in HCl aqueous solution (0.03mol/L HCl, 0.06mol/L PdCl2), then the PdCl2-HCl aqueous solution was mixed with HReO4 aqueous solution, and SBA-15 powder was added into this mixed solution for impregnation with stirring at room temperature for 10h. After the water was evaporated by rotary evaporation, the obtained solid sample was dried at 110°C overnight. The theoretical contents of Pd and Re were all 5wt%, while the actual contents of Pd and Re in the catalysts measured by ICP analysis were all near to the theoretical ones. Before using in the reaction, all Pd-Re/SBA-15 catalysts were reduced with flowing H2/N2 at 250°C or 500°C for 2h. The Pd-Re/SBA-15 catalysts prepared using PdCl2 and HReO4 were denoted as Pd(C)-Re/SBA-15. When Pd(NO3)2 or Pd(OAc)2 was used as Pd precursor and HReO4 as Re precursor, the catalysts were denoted as Pd(N)-Re/SBA-15 or Pd(A)-Re/SBA-15. For investigating the effect of Cl addition on Pd-Re catalysts, Cl component using HCl or NaCl as Cl precursor was introduced into Pd(N)-Re/SBA-15 or Pd(A)-5Re/SBA-15. 2.2 Catalysts characterization The specific surface areas, pore volumes and pore size distributions of Pd-Re/SBA-15 catalysts were measured by N2 adsorption-desorption at −196°C, using a Micromeritics ASAP 2010C analyzer. The crystal structures of all 5Pd-5Re/SBA-15 catalysts were characterized by powder X-ray diffraction (XRD). The experiments were carried out in a Rigaku D/max 2500 powered at 40kV, 200mA and CuKa radiation. For small angle XRD from 0.6° to 3°, the scan step was 1°/min. For wide angle XRD from 10° to 80°, the scan step was 10°/min. H2-TPR was used to characterize the reduction behaviors of Pd-Re catalysts. The characterizations were carried out on Quantachrome CHEM-3000. For a typical measurement, 0.1g of the catalyst was firstly pretreated in flowing Ar at 250°C for 2h and then cooled down to room temperature. As part of Pd oxide was reduced when contacted with H2 immediately even at room temperature [23], two steps of H2-TPR process were employed for the characterizations. For step I, the catalyst was maintained at 30°C under flowing Ar, then the Ar gas was changed from sample tube path into bypass, while 5%H2/Ar flowing gas was introduced into the sample tube path and kept in 5%H2/Ar at 30°C until the baseline was stabilized. Immediately, changing H2/Ar gas from bypass to sample path would result in a pulse signal and this was recorded. During this step I process, the residual Ar in the sample path would also cause signals after introducing 5%H2/Ar into sample path. For this reason, SBA-15 was also used as a blank for characterizing the residual Ar. After maintaining the sample in 5%H2/Ar for 20min, the step I was end, and the step II was started. For step II of the TPR, the temperature was increased from 30°C to 500°C with the rate of 15°C/min. NH3-TPD was used to characterize the acid properties of Pd-Re catalysts with Quantachrome CHEM-3000. In a typical procedure, 0.1g of the sample was pretreated at 250°C for 2h with flowing He, then cooled down to 100°C. After the pretreatment, the catalyst was adsorbed with 1%NH3/He gas at 100°C for 0.5h, and then the sample was swept with flowing He at 100°C for another 0.5h. Then the temperature of the sample tube was increased from 100°C to 750°C with the rate of 15°C/min and NH2 (m/z =16) species in the desorption gas was recorded. The morphologies of the catalysts were characterized by High Resolution Transmission Electron Microscopy (HR-TEM) with JEM-2010 JEOL equipped with an energy dispersive spectrometer (EDS). The actual amounts of Cl remained in the catalysts were analyzed with X-Ray Fluorescence (XRF), using Shimadzu XRF-1800 instrument. 2.3 Glycerol hydrogenolysis The reactions were carried out in a 100mL stainless steel autoclave. In a typical run, 0.15g of the catalyst, which was reduced at 250°C or 500°C before used, and 10mL 40% glycerol aqueous was added into the autoclave. After checking the leakage of the autoclave with 8MPa H2, 3MPa H2 was purged and released for 3 times to remove the residual air in the autoclave. The temperature of the autoclave was increased to 200°C and 8MPa H2 was purged, and then the reaction was carried out for 18h with 700rpm stirring. After the reaction, the autoclave was cooled down to 5°C and gas phase products were analyzed by a TCD gas chromatography (Weisifu SP-6890). The mixture of liquid and solid catalysts was separated by centrifugation. The liquid phase products were analyzed by a FID gas chromatography (Lunan-6890). The conversion of glycerol and selectivity to product were calculated by equations as below. C o n v e r s i o n ( % ) = S u m o f C m o l o f a l l p r o d u c t s A d d e d g l y c e r o l b e f o r e r e a c t i o n ( C m o l ) × 100 % S e l c t i v i t y ( % ) = C m o l o f e a c h p r o d u c t S u m o f C m o l o f a l l p r o d u c t s × 100 % The carbon balances for all reactions were about 95±5%. 3 Results and discussion 3.1 The texture properties of Pd-Re/SBA-15 prepared with different Pd precursors The texture properties of Pd-Re/SBA-15 prepared with different precursors were all characterized by N2 adsorption-desorption method and the results are shown in Table S1. From the results, it can be seen that the texture properties of these catalysts were quite similar. The specific surface areas were in the range of 600–680m2/g, which were lower than that of support SBA-15. The pore volumes and average pore sizes of the catalysts were also lower than those of support SBA-15. Pd-Re/SBA-15 with different Pd precursors all had similar N2 adsorption-desorption isotherms and pore size distributions (Fig. S1), indicating that all catalysts maintained the mesoporous structure of SBA-15 after impregnation and reduction. 3.2 The effect of different Pd precursors on the properties and catalytic performance of Pd-Re/SBA-15 The effect of different Pd precursors on the catalytic performance of Pd-Re/SBA-15 catalysts in glycerol hydrogenolysis is shown in Table 1 . When the reduction temperatures of the catalysts were 250°C, the conversion of glycerol over Pd(C)-Re/SBA-15 was the highest (40.7%) among the three catalysts, while Pd(N)-Re/SBA-15 and Pd(A)-Re/SBA-15 had similar conversion of glycerol (19.3% and 18.0%, respectively). Even increasing the reduction temperature from 250°C to 500°C, the glycerol conversion over Pd(C)-Re/SBA-15 (41.4%) was still higher than those over Pd(N)-Re/SBA-15 and Pd(A)-Re/SBA-15 (15.4% and 22.1%, respectively). The selectivities to 1,2-PD was in the range of 55–68% over these catalysts when the reduction temperature was 250°C, and they were in the order of Pd(A)-Re/SBA-15 (67.4%)>Pd(C)-Re/SBA-15 (59.9%)>Pd(N)-Re/SBA-15 (55.7%). All catalysts showed similar selectivity to 1,3-PD (8–11%) at the conditions of 200°C, 8MPa H2 and 18h. After reduction at 500°C, the catalysts all showed a relatively lower selectivity to 1,2-PD, while a higher selectivity to 1,3-PD. For example, on Pd(A)-Re/SBA-15, the reduction at 500°C decreased the selectivity to 1,2-PD from 67.4% to 60.4%, while the selectivity to 1,3-PD increased from 9.5% to 11.0%. From the results mentioned above, it could be seen that the different Pd precursors could affect the activities of Pd-Re catalysts. Pd(C)-Re/SBA-15 prepared with PdCl2 as the precursor had better activity than those prepared with Pd(NO3)2 or Pd(OAc)2 as the precursor. The crystal phases of Pd-Re/SBA-15 catalysts prepared with different Pd precursors are shown in Fig. 1 . For the samples using PdCl2 as the precursor (Fig. 1(a)), after evaporated and dried at 110°C, there was no obvious diffraction peak of Pd or Re on Pd(C)-Re/SBA-15. When the Pd(C)-Re/SBA-15 was reduced at 250°C, the diffraction peaks of Pd(111) at 2θ=40°, Pd(200) at 2θ=46° and Pd(220) at 2θ=68° could be observed [24,25]. For the bi-component sample using Pd(NO3)2 as the precursor (Fig. 1(b)), its crystal structure was different from that of using PdCl2 as the precursor. After evaporated and dried at 110°C, the diffraction peak of PdO 2θ=34° could be observed on Pd(N)-Re/SBA-15, and the crystal phase of PdO changed into Pd° after reduced at 250°C. Similar results were also found over Pd(A)-Re/SBA-15 (Fig. 1(c)), Pd° crystal phase was observed after dried at 110°C. Therefore, different Pd precursors would affect the particle size of Pd on the Pd-Re catalysts, and this might result in the different activities of these catalysts. H2-TPR profiles of Pd-Re catalysts prepared by different Pd precursors are shown in Fig. 2 (a). For step I of TPR experiment (keeping at 30°C constant), all catalysts showed similar TPR profiles (the results are shown in Fig. S2). From step II (from 30°C to 500°C) of all Pd-Re/SBA-15, the reduction behaviors of these catalysts were different from either mono-component Pd/SBA-15 or Re/SBA-15 (Fig. S3). This meant that Pd and Re had interaction no matter what Pd precursor was used. But the reduction behaviors of Pd-Re catalysts prepared with different palladium precursors were quite different from each other. For Pd(C)-Re/SBA-15, the main reduction peaks were at 130°C and 220°C, while for Pd(N)-Re/SBA-15, the main reduction peak was at 200°C. The reduction peaks of Pd(A)-Re/SBA-15 were also at 130°C and 220°C, but the peak shapes were different from Pd(C)-Re/SBA-15. The reduction peak of Pd(A)-Re/SBA-15 at 130°C was much sharper than that of Pd(C)-Re/SBA-15. And the reduction peak of Pd(A)-Re/SBA-15 at 220°C was also more visible. Moreover, for Pd(A)-Re/SBA-15, a weak reduction peak at 330°C could be found, which might belong to ReOx, which meant that the Pd and Re interaction was not as strong as that of Pd(C)-Re/SBA-15. 3.3 The effect of Cl component on the properties and catalytic performance of Pd-Re/SBA-15 As mentioned above, Pd-Re catalysts prepared with different Pd precursors showed different activities in glycerol hydrogenolysis. Different Pd precursors have different negative ions. Pd(C)-Re/SBA-15 had better activity than Pd(N)-Re/SBA-15 and Pd(A)-Re/SBA-15, and the Cl component on the Pd(C)-Re/SBA-15 might be the reason. In order to further investigate the influence of Cl on the properties and catalytic performance of Pd-Re/SBA-15, HCl or NaCl was added into the catalysts as Cl precursor. Table 2 shows the influence of Cl addition on Pd(N)-Re/SBA-15 in glycerol hydrogenolysis. From No. 1–6, as the addition amount of HCl increased, the conversion of glycerol over Pd(N)-Re/SBA-15 increased from 19.3% to 45.3%, while the selectivity to 1,2-PD decreased from 59.1% to 43.6%. As the addition amount (mol) of HCl was 5 times of that of Pd(NO3)2, the selectivity to 1,2-PD was the lowest (43.6%), but the addition of HCl influenced little on the selectivity to 1,3-PD (maintained between 7–10%). This decrease of 1,2-PD selectivity might be caused by the higher activities of the catalysts with Cl addition on further hydrogenolysis of 1,2-PD to 1-PO. The selectivity to 1-PO increased to the highest of 40% with the ratio of Pd/HCl=5/1. During the impregnation, the HCl addition might change the pH value of the impregnation solution. For comparison, NaCl was also used as Cl precursor for preparing Pd(N)-Re/SBA-15. The result (Table 2, No. 7) revealed that, the addition of NaCl into Pd(N)-Re/SBA-15 could also increase the conversion of glycerol from 19.3% to 45.8% while the selectivity to 1,2-PD became a little lower, and the selectivity to 1,3-PD was still kept at 8.6%. Furthermore, for comparison NaCl, NaNO3 was also used to examine the effect of Na on the activity of Pd(N)-Re/SBA-15 (Table 2, No. 8), and the conversion of glycerol was 20.0%, which was similar to that of Pd(N)-Re/SBA-15 without Cl addition (19.3%), while the selectivity to 1,2-PD was the highest (67.7%). This might be the reason of the basic property of Na which was favor to 1,2-PD formation in the hydrogenolysis. In our previous study [21], the Pd-Re catalysts with base supports (like CeO2, MgO, La2O3) had higher selectivity to 1,2-PD compared with those Pd-Re catalysts with neutral and acid supports. From these results, it can be seen that the addition of Cl could surely increase the activity of Pd(N)-Re/SBA-15. For mono-component Pd and Re catalysts, the influence of HCl addition was also tested. The activity of mono-component Pd or Re catalyst was very low, and as shown in Table S2, the addition of HCl affected little on the activity of Pd(N)/SBA-15 or Re/SBA-15. The conversions of glycerol were below 5%, but the selectivities changed. For Pd(N)/SBA-15, after addition of HCl, the selectivity to 1,2-PD increased from 35.6% to 70.4%, which was quite similar with the selectivity to 1,2-PD on Pd(C)/SBA-15 (72.2%). The reduction behaviors of Pd(N)-Re/SBA-15 prepared with different amounts of HCl addition are shown in Fig. 2(b). It clearly showed that when the amount of HCl was small (Pd:HCl=5:1), the intensity of reduction peak at 130°C in TPR profile was stronger, while the reduction peak at 200°C shifted to 210°C. As the addition amount of HCl increased, the intensity of reduction peak at 130°C became stronger, but the reduction peak at 210°C became weaker. When the addition amount of HCl was 2 times of that of Pd(NO3)2, the TPR profile of the Pd(N)-Re/SBA-15 was very like that of Pd(C)-Re/SBA-15. When the amount (mol) of HCl was 5 times of that of Pd(NO3)2, the main reduction peak in the TPR profile was at 130°C, while the reduction peak at 210°C was almost disappeared. The differences of reduction behaviors of these Pd(N)-Re/SBA-15 samples might be due to the addition of Cl component, and this would finally result in the different activities of Pd(N)-Re/SBA-15. To further investigate the effect of HCl, mono-component Pd and Re catalysts were also prepared with HCl addition, respectively. From the TPR results of Pd(N)/SBA-15 with HCl addition, the reduction peak at 130°C was observed (Fig. S3(a)). On the other hand, for the TPR profiles of Re/SBA-15 samples (Fig. S3(b)), the reduction temperature of Re/SBA-15 with HCl addition decreased from 330°C to 270°C compared with that of Re/SBA-15 without HCl addition. These results showed that the Cl would also affect the reduction behaviors of ReOx, and finally also influence the performance of Pd-Re catalysts. Fig. 3 (a) shows the XRD patterns of Pd(N)-Re/SBA-15 prepared with different amounts of HCl addition. When the samples were reduced at 250°C, all Pd(N)-Re/SBA-15 showed similar Pd° diffraction peaks in the XRD patterns. When the addition amount (mol) of HCl was 5 times of that of Pd(NO3)2, the Pd° diffraction peaks in the XRD patterns of Pd(N)-Re/SBA-15 (Pd:HCl=1:5) were very weak. The morphologies of Pd(N)-Re/SBA-15 prepared with different amounts of HCl addition were characterized by HR-TEM. The results are shown in Fig. 4 . For Pd(N)-Re/SBA-15 without HCl addition (Fig. 4(a)), Pd-Re particles agglomerated into very large ones, while Pd and Re components were both existed in the particles according to EDX analysis. After a certain amount of HCl was added (Pd:HCl=5:1, Fig. 4(b)), Pd-Re particles on the sample were still agglomerated, but the dispersion of these particles were clearly better than that one without HCl addition. When the addition amount of HCl increased to Pd:HCl=1:1 (Fig. 4(c)), Pd-Re particles on the sample were obviously dispersed better and grew along the SBA-15 channels, and particle sizes of Pd-Re were in the range of 4–5nm. Further increasing the amount (mol) of HCl to 5 times of that of Pd(NO3)2 (Fig. 4(d)), Pd-Re particles dispersed more homogenously, and the particle sizes of Pd-Re particles were also 4–5nm. From these results, it clearly indicated that the addition of HCl would surely decrease the particle size and increase the dispersion of Pd-Re particles. In order to further make sure the effect of Cl, Pd(A)-Re/SBA-15 catalysts were also prepared with HCl addition during an impregnation process. The reaction results using these catalysts are listed in Table 2 (No. 9–14). Similar as the case of Pd(N)-Re/SBA-15, for Pd(A)-Re/SBA-15 without HCl addition, it had the lowest activity (conversion of glycerol was 18.0%), while it had the highest selectivity to 1,2-PD (67.4%). The addition of HCl into Pd(A)-Re/SBA-15 also increased the activity of the catalysts. As the addition amount (mol) of HCl increased from 0 to 5 times of that of Pd(OAc)2, the conversion of glycerol over these catalysts increased from 18.0% to 59.5%, while the selectivity to 1,2-PD became lower. To further examine the influence of HCl addition on the distribution of products, reaction times over the catalysts were changed to maintain conversions of glycerol in the range of 18–27% (Table S3). It can be seen that using the catalysts prepared with the addition of HCl could increase the activity of Pd-Re while the selectivity to 1,2-PD was decreased. For Pd(N)-Re/SBA-15, the addition of HCl decreased the selectivity to 1,2-PD from 55.7% to 51.3%, while the addition of HCl decreased the selectivity to 1,2-PD from 67.4% to 50.5% over Pd(A)-Re/SBA-15 (Table S3). In all these catalysts, the selectivities to 1,3-PD were all maintained at 7–12%. In glycerol hydrogenolysis, 1,2-PD could undergo further hydrogenolysis reaction to 1-PO. The increase of the activity of Pd-Re catalyst with Cl addition in hydrogenolysis of OH group might be favorable to convert 1,2-PD into 1-PO. This might be the reason of lower selectivity to 1,2-PD and higher selectivity to 1-PO. Furthermore, H2-TPR was also used to characterize the reduction properties of Pd(A)-Re/SBA-15 prepared with different amounts of HCl addition (Fig. 2(c)). The addition of HCl could also change the reduction behaviors of Pd(A)-Re/SBA-15. When the ratio of Pd:HCl was 5:1, the reduction peak at 130°C in the TPR profile of Pd(A)-Re/SBA-15 prepared with HCl addition was not as sharp as that of without HCl addition, while the intensity of the reduction peak at 330°C became stronger. As the addition amount (mol) of HCl increased to 5 times of that of Pd(OAc)2, the TPR profile of Pd(A)-Re/SBA-15 was very like that of Pd(C)-Re/SBA-15. This result was also as similar as that of Pd(N)-Re/SBA-15 prepared with HCl addition. From Fig. 3(b), the crystal structures of Pd(A)-Re/SBA-15 prepared with different amounts of HCl addition had no obviously differences except for the sample of Pd:HCl=1:5. For Pd(A)-Re/SBA-15 prepared with Pd:HCl=1:5, the Pd° diffraction peaks in the XRD pattern were weaker than those of others. This result was similar with that of Pd(N)-Re/SBA-15. HR-TEM was also used to characterize the morphologies of Pd(A)-Re/SBA-15 prepared with different amounts of HCl addition, and the results are shown in Fig. 5 (The histograms established from TEM images of Pd(A)-Re/SBA-15 are performed in Fig. S4). Really, the addition of HCl during the preparation of the catalysts also increased the dispersion of Pd-Re particles on Pd(A)-Re/SBA-15. For Pd(A)-Re/SBA-15 prepared without HCl addition (Fig. 5(a)), most of the Pd-Re particles grew on the outside of the support, and the average particle size was 17nm, which was much larger than that of Pd(C)-Re/SBA-15. When a little amount of HCl was added into Pd(A)-Re/SBA-15 during the preparation of the catalyst (Pd:HCl=5:1, Fig. 5(b)), the average particle size of Pd-Re was 10nm and particles dispersed more homogenously. At the same time, the Pd-Re particles grew along the SBA-15 channels and their shapes became rod like. Further increasing the HCl amount, the Pd-Re particles of Pd(A)-Re/SBA-15 became smaller. When Pd:HCl was 1:5 (Fig. 5(d)), the average Pd-Re particle size of Pd(A)-Re/SBA-15 was 4nm. These results were also as similar as that of Pd(N)-Re/SBA-15 prepared with HCl addition. The actual amounts of Cl in the catalysts were characterized by XRF, and the results are listed in Table 3 . For Pd(N)-Re/SBA-15 prepared with Pd:HCl=1:5 addition, the actual amount of Cl on the catalyst was 3.76% after the sample was evaporated, while only 1.51% of Cl remained on the catalyst after it was dried at 110°C overnight. Furthermore, when the sample was reduced at 250°C, the Cl amount on the catalyst further decreased to only 0.17%. For Pd(A)-Re/SBA-15 prepared with Pd:HCl=1:5 addition, it had similar results. That is, during the treatment steps of evaporation, drying and reduction, part of the Cl component on the catalyst lost. Only 0.12% of Cl remained on the catalyst after the reduction at 250°C. These results indicated that most of the Cl might be removed by the reduction step. Acid properties of Pd-Re catalysts prepared with HCl addition were characterized by NH3-TPD. Fig. 6 shows the NH3-TPD profiles of Pd-Re catalysts, and the acid amounts calculated from NH3-TPD are listed in Table 4 . For bi-component Pd-Re catalysts, the NH3-TPD profiles of Pd(N)-Re/SBA-15 and Pd(A)-Re/SBA-15 prepared without HCl addition had similar peak type, and the intensity of the desorption peak at 240°C (moderate acid sites) was stronger than that of at 160°C (weak acid sites), while the moderate acid amounts were higher than weak acid amounts. Meanwhile, the total acid amounts of these two catalysts were also similar (232 and 226μmol/g, respectively). For Pd(N)-Re/SBA-15 and Pd(A)-Re/SBA-15 prepared with HCl addition, the NH3-TPD profiles changed a lot. The desorption peaks at 160°C became much stronger than those of 240°C, and the weak acid amounts become higher than the moderate acid amounts. Meanwhile, the total acid amounts were similar with Pd(C)-Re/SBA-15, which were all between 175–196μmol/g. It’s worth noting that the weak acid amounts of Pd(N)-Re/SBA-15 and Pd(A)-Re/SBA-15 prepared with HCl addition were similar with that of Pd(C)-Re/SBA-15 (95–100μmol/g). Meanwhile, the glycerol hydrogenolysis reactions were carried out at 200°C, which meant the weak acid sites had a greater impact on the activities of Pd-Re catalysts. From NH3-TPD results combined with H2-TPR, it can be seen that the addition of Cl component during preparation might increase the interaction between Pd and Re. This kind of interaction lead to the change of reduction behaviors and acid properties of Pd(N)-Re/SBA-15 and Pd(A)-Re/SBA-15. From the results mentioned above, the addition of Cl in the preparation of the catalysts could change the reduction behaviors of Pd(N)-Re/SBA-15 and Pd(A)-Re/SBA-15 catalysts, and decrease the particle sizes of Pd-Re on the catalysts. These results were as similar as a reference reported by Wang and Lu [26]. They found that the existence of Cl could vary the dispersion of Pd in Pd-Cu bimetallic catalysts. Michel et al. [27] studied Pt-Re catalysts and found that ReOCl species could be formed, and this ReOCl could move on the support surface, which led Pt-Re be reduced much easier. 4 Conclusions Different Pd precursors showed influence on the properties and the catalytic performance of Pd-Re/SBA-15 catalysts in glycerol hydrogenolysis. The conversions of glycerol over Pd-Re/SBA-15 catalysts prepared with different precursors were in the order of PdCl2 >Pd(NO3)2 ≈Pd(OAc)2. Those catalysts showed the different reduction behaviors and had different Pd-Re particle sizes. The existence of Cl on the catalysts could change the reduction behaviors, Pd-Re particle sizes and acid properties of the catalysts, and finally affected their activities in glycerol hydrogenolysis. When Pd(NO3)2 or Pd(OAc)2 was used as Pd precursor, the appropriate amount of Cl addition could promote the dispersion of Pd-Re particles, and then improve the activities of the catalysts in glycerol hydrogenolysis. Acknowledgments This work is supported by the National Natural Science Foundation of China (No. 20973098, 21033004). Appendix A Supplementary data Supplementary data associated with this article can be found, in the online version, at http://dx.doi.org/10.1016/j.apcata.2016.04.029. Appendix A Supplementary data The following are Supplementary data to this article: References [1] F. Frusteri F. Arena G. Bonura C. Cannilla L. Spadaro O. Di Blasi Appl. Catal. A: Gen. 367 2009 77 83 [2] C.H. Zhou J.N. Beltramini Y.X. Fan G.Q. Lu Chem. Soc. Rev. 37 2008 527 549 [3] N.A.S. Zuhaimi V.P. Indran M.A. Deraman N.F. Mudrikah G.P. Maniam Y.H. Taufiq-Yap M.H. Ab. Rahim Appl. Catal. A: Gen. 502 2015 312 319 [4] M. Akiyama S. Sato R. Takahashi K. Inui M. Yokota Appl. Catal. A: Gen. 371 2009 60 66 [5] T. Haas B. Jaeger R. Weber S.F. Mitchell C.F. King Appl. Catal. A: Gen. 280 2005 83 88 [6] S. Xia L. Zheng W. Ning L. Wang P. Chen Z. Hou J. Mater. Chem. A 1 2013 11548 11552 [7] S. Zhu X. Gao Y. Zhu Y. Li Green Chem. 18 2016 782 791 [8] W. Yu J. Xu H. Ma C. Chen J. Zhao H. Miao Q. Song Catal. Commun. 11 2010 493 497 [9] T. Jiang D. Kong K. Xu F. Cao Appl. Petrochem Res. 2015 1 10 [10] P.K. Vanama A. Kumar S.R. Ginjupalli V.R. Chary Komandur Catal. Today 250 2015 226 238 [11] L. Liu Y. Zhang A. Wang T. Zhang Chin. J. Catal. 33 2012 1257 1261 [12] S. García-Fernández I. Gandarias J. Requies M.B. Güemez S. Bennici A. Auroux P.L. Arias J. Catal. 323 2015 65 75 [13] S. Zhu X. Cao Y. Zhu Y. Li J. Mol. Catal. A: Chem. 398 2015 391 398 [14] M.G. Musolino L.A. Scarpino F. Mauriello R. Pietropaolo ChemSusChem 4 2011 1143 1150 [15] T. Jiang Q. Huai T. Geng W. Ying T. Xiao F. Cao Biomass Bioenergy 78 2015 71 79 [16] L. Ma D. He Catal. Today 149 2010 148 156 [17] L. Ma Y. Li D. He Chin. J. Catal. 32 2011 872 876 [18] C. Deng X. Duan J. Zhou D. Chen X. Zhou Catal. Today 234 2014 208 214 [19] Y. Nakagawa Y. Shinmi S. Kosa K. Tomishige J. Catal. 272 2010 191 194 [20] M. Tamura Y. Amada S. Liu Z. Yuan Y. Nakagawa K. Tomishige J. Mol. Catal: A S1 2014 177 187 [21] Y. Li H. Liu L. Ma D.H. He RSC Adv. 4 2014 5503 5512 [22] W. Zhou D. He Chem. Commun. 44 2008 5839 5841 [23] K. Muto N. Katada M. Niwa Appl. Catal. A: Gen. 134 1996 203 215 [24] F.A. Harraz S.E. El-Hout H.M. Kill I.A. Ibrahim J. Catal. 286 2012 184 192 [25] Y.F. Han D. Kumar D.W. Goodman J. Catal. 230 2005 353 358 [26] F. Wang G. Lu Int. J. Hydrogen Energy 35 2010 7253 7260 [27] C.G. Michel W.E. Bambrick R.H. Ebel Fuel Process. Technol. 35 1993 159 182",
      "scopus-id": "84964652714",
      "coredata": {
        "eid": "1-s2.0-S0926860X16302137",
        "dc:description": "Pd-Re/SBA-15 catalysts with different Pd precursors were prepared by the impregnation method. N2 adsorption-desorption, XRD, H2-TPR, TEM and NH3-TPD were used to characterize the physical and chemical properties of the catalysts. Pd-Re catalysts with different precursors showed different activities in the reaction of glycerol hydrogenolysis. 5Pd-5Re/SBA-15 with PdCl2 as Pd precursor had higher activity than those with Pd(NO3)2 and Pd(OAc)2 as precursors. The existence of Cl could affect the particle sizes, reduction behaviors and the acid properties of Pd-Re catalysts.",
        "openArchiveArticle": "false",
        "prism:coverDate": "2016-07-25",
        "openaccessUserLicense": null,
        "prism:aggregationType": "Journal",
        "prism:url": "https://api.elsevier.com/content/article/pii/S0926860X16302137",
        "dc:creator": [
          {
            "@_fa": "true",
            "$": "Li, Yuming"
          },
          {
            "@_fa": "true",
            "$": "Liu, Huimin"
          },
          {
            "@_fa": "true",
            "$": "Ma, Lan"
          },
          {
            "@_fa": "true",
            "$": "He, Dehua"
          }
        ],
        "link": [
          {
            "@_fa": "true",
            "@rel": "self",
            "@href": "https://api.elsevier.com/content/article/pii/S0926860X16302137"
          },
          {
            "@_fa": "true",
            "@rel": "scidir",
            "@href": "https://www.sciencedirect.com/science/article/pii/S0926860X16302137"
          }
        ],
        "dc:format": "application/json",
        "openaccessType": null,
        "pii": "S0926-860X(16)30213-7",
        "prism:volume": "522",
        "prism:publisher": "Elsevier B.V.",
        "dc:title": "Influence of Pd precursors and Cl addition on performance of Pd-Re catalysts in glycerol hydrogenolysis to propanediols",
        "prism:copyright": "© 2016 Elsevier B.V. All rights reserved.",
        "openaccess": "0",
        "prism:issn": "0926860X",
        "dcterms:subject": [
          {
            "@_fa": "true",
            "$": "Glycerol hydrogenolysis"
          },
          {
            "@_fa": "true",
            "$": "Palladium"
          },
          {
            "@_fa": "true",
            "$": "Rhenium"
          },
          {
            "@_fa": "true",
            "$": "Precursor"
          }
        ],
        "openaccessArticle": "false",
        "prism:publicationName": "Applied Catalysis A: General",
        "openaccessSponsorType": null,
        "prism:pageRange": "13-20",
        "prism:endingPage": "20",
        "pubType": "fla",
        "prism:coverDisplayDate": "25 July 2016",
        "prism:doi": "10.1016/j.apcata.2016.04.029",
        "prism:startingPage": "13",
        "dc:identifier": "doi:10.1016/j.apcata.2016.04.029",
        "openaccessSponsorName": null
      },
      "objects": {
        "object": [
          {
            "@category": "thumbnail",
            "@height": "88",
            "@width": "219",
            "@_fa": "true",
            "$": "https://api.elsevier.com/content/object/eid/1-s2.0-S0926860X16302137-fx1.sml?httpAccept=%2A%2F%2A",
            "@multimediatype": "GIF image file",
            "@type": "IMAGE-THUMBNAIL",
            "@size": "10928",
            "@ref": "fx1",
            "@mimetype": "image/gif"
          },
          {
            "@category": "thumbnail",
            "@height": "164",
            "@width": "72",
            "@_fa": "true",
            "$": "https://api.elsevier.com/content/object/eid/1-s2.0-S0926860X16302137-gr1.sml?httpAccept=%2A%2F%2A",
            "@multimediatype": "GIF image file",
            "@type": "IMAGE-THUMBNAIL",
            "@size": "5704",
            "@ref": "gr1",
            "@mimetype": "image/gif"
          },
          {
            "@category": "thumbnail",
            "@height": "163",
            "@width": "73",
            "@_fa": "true",
            "$": "https://api.elsevier.com/content/object/eid/1-s2.0-S0926860X16302137-gr2.sml?httpAccept=%2A%2F%2A",
            "@multimediatype": "GIF image file",
            "@type": "IMAGE-THUMBNAIL",
            "@size": "4322",
            "@ref": "gr2",
            "@mimetype": "image/gif"
          },
          {
            "@category": "thumbnail",
            "@height": "164",
            "@width": "111",
            "@_fa": "true",
            "$": "https://api.elsevier.com/content/object/eid/1-s2.0-S0926860X16302137-gr3.sml?httpAccept=%2A%2F%2A",
            "@multimediatype": "GIF image file",
            "@type": "IMAGE-THUMBNAIL",
            "@size": "8020",
            "@ref": "gr3",
            "@mimetype": "image/gif"
          },
          {
            "@category": "thumbnail",
            "@height": "147",
            "@width": "219",
            "@_fa": "true",
            "$": "https://api.elsevier.com/content/object/eid/1-s2.0-S0926860X16302137-gr4.sml?httpAccept=%2A%2F%2A",
            "@multimediatype": "GIF image file",
            "@type": "IMAGE-THUMBNAIL",
            "@size": "30401",
            "@ref": "gr4",
            "@mimetype": "image/gif"
          },
          {
            "@category": "thumbnail",
            "@height": "146",
            "@width": "219",
            "@_fa": "true",
            "$": "https://api.elsevier.com/content/object/eid/1-s2.0-S0926860X16302137-gr5.sml?httpAccept=%2A%2F%2A",
            "@multimediatype": "GIF image file",
            "@type": "IMAGE-THUMBNAIL",
            "@size": "31891",
            "@ref": "gr5",
            "@mimetype": "image/gif"
          },
          {
            "@category": "thumbnail",
            "@height": "164",
            "@width": "219",
            "@_fa": "true",
            "$": "https://api.elsevier.com/content/object/eid/1-s2.0-S0926860X16302137-gr6.sml?httpAccept=%2A%2F%2A",
            "@multimediatype": "GIF image file",
            "@type": "IMAGE-THUMBNAIL",
            "@size": "10123",
            "@ref": "gr6",
            "@mimetype": "image/gif"
          },
          {
            "@category": "standard",
            "@height": "200",
            "@width": "500",
            "@_fa": "true",
            "$": "https://api.elsevier.com/content/object/eid/1-s2.0-S0926860X16302137-fx1.jpg?httpAccept=%2A%2F%2A",
            "@multimediatype": "JPEG image file",
            "@type": "IMAGE-DOWNSAMPLED",
            "@size": "34577",
            "@ref": "fx1",
            "@mimetype": "image/jpeg"
          },
          {
            "@category": "standard",
            "@height": "772",
            "@width": "339",
            "@_fa": "true",
            "$": "https://api.elsevier.com/content/object/eid/1-s2.0-S0926860X16302137-gr1.jpg?httpAccept=%2A%2F%2A",
            "@multimediatype": "JPEG image file",
            "@type": "IMAGE-DOWNSAMPLED",
            "@size": "81819",
            "@ref": "gr1",
            "@mimetype": "image/jpeg"
          },
          {
            "@category": "standard",
            "@height": "842",
            "@width": "376",
            "@_fa": "true",
            "$": "https://api.elsevier.com/content/object/eid/1-s2.0-S0926860X16302137-gr2.jpg?httpAccept=%2A%2F%2A",
            "@multimediatype": "JPEG image file",
            "@type": "IMAGE-DOWNSAMPLED",
            "@size": "71545",
            "@ref": "gr2",
            "@mimetype": "image/jpeg"
          },
          {
            "@category": "standard",
            "@height": "556",
            "@width": "376",
            "@_fa": "true",
            "$": "https://api.elsevier.com/content/object/eid/1-s2.0-S0926860X16302137-gr3.jpg?httpAccept=%2A%2F%2A",
            "@multimediatype": "JPEG image file",
            "@type": "IMAGE-DOWNSAMPLED",
            "@size": "73189",
            "@ref": "gr3",
            "@mimetype": "image/jpeg"
          },
          {
            "@category": "standard",
            "@height": "454",
            "@width": "678",
            "@_fa": "true",
            "$": "https://api.elsevier.com/content/object/eid/1-s2.0-S0926860X16302137-gr4.jpg?httpAccept=%2A%2F%2A",
            "@multimediatype": "JPEG image file",
            "@type": "IMAGE-DOWNSAMPLED",
            "@size": "119134",
            "@ref": "gr4",
            "@mimetype": "image/jpeg"
          },
          {
            "@category": "standard",
            "@height": "451",
            "@width": "678",
            "@_fa": "true",
            "$": "https://api.elsevier.com/content/object/eid/1-s2.0-S0926860X16302137-gr5.jpg?httpAccept=%2A%2F%2A",
            "@multimediatype": "JPEG image file",
            "@type": "IMAGE-DOWNSAMPLED",
            "@size": "123264",
            "@ref": "gr5",
            "@mimetype": "image/jpeg"
          },
          {
            "@category": "standard",
            "@height": "239",
            "@width": "320",
            "@_fa": "true",
            "$": "https://api.elsevier.com/content/object/eid/1-s2.0-S0926860X16302137-gr6.jpg?httpAccept=%2A%2F%2A",
            "@multimediatype": "JPEG image file",
            "@type": "IMAGE-DOWNSAMPLED",
            "@size": "27617",
            "@ref": "gr6",
            "@mimetype": "image/jpeg"
          },
          {
            "@category": "high",
            "@height": "886",
            "@width": "2213",
            "@_fa": "true",
            "$": "https://api.elsevier.com/content/object/eid/1-s2.0-S0926860X16302137-fx1_lrg.jpg?httpAccept=%2A%2F%2A",
            "@multimediatype": "JPEG image file",
            "@type": "IMAGE-HIGH-RES",
            "@size": "315421",
            "@ref": "fx1",
            "@mimetype": "image/jpeg"
          },
          {
            "@category": "high",
            "@height": "3414",
            "@width": "1500",
            "@_fa": "true",
            "$": "https://api.elsevier.com/content/object/eid/1-s2.0-S0926860X16302137-gr1_lrg.jpg?httpAccept=%2A%2F%2A",
            "@multimediatype": "JPEG image file",
            "@type": "IMAGE-HIGH-RES",
            "@size": "740767",
            "@ref": "gr1",
            "@mimetype": "image/jpeg"
          },
          {
            "@category": "high",
            "@height": "3733",
            "@width": "1667",
            "@_fa": "true",
            "$": "https://api.elsevier.com/content/object/eid/1-s2.0-S0926860X16302137-gr2_lrg.jpg?httpAccept=%2A%2F%2A",
            "@multimediatype": "JPEG image file",
            "@type": "IMAGE-HIGH-RES",
            "@size": "544701",
            "@ref": "gr2",
            "@mimetype": "image/jpeg"
          },
          {
            "@category": "high",
            "@height": "2465",
            "@width": "1667",
            "@_fa": "true",
            "$": "https://api.elsevier.com/content/object/eid/1-s2.0-S0926860X16302137-gr3_lrg.jpg?httpAccept=%2A%2F%2A",
            "@multimediatype": "JPEG image file",
            "@type": "IMAGE-HIGH-RES",
            "@size": "669285",
            "@ref": "gr3",
            "@mimetype": "image/jpeg"
          },
          {
            "@category": "high",
            "@height": "2007",
            "@width": "3000",
            "@_fa": "true",
            "$": "https://api.elsevier.com/content/object/eid/1-s2.0-S0926860X16302137-gr4_lrg.jpg?httpAccept=%2A%2F%2A",
            "@multimediatype": "JPEG image file",
            "@type": "IMAGE-HIGH-RES",
            "@size": "1070666",
            "@ref": "gr4",
            "@mimetype": "image/jpeg"
          },
          {
            "@category": "high",
            "@height": "1997",
            "@width": "3000",
            "@_fa": "true",
            "$": "https://api.elsevier.com/content/object/eid/1-s2.0-S0926860X16302137-gr5_lrg.jpg?httpAccept=%2A%2F%2A",
            "@multimediatype": "JPEG image file",
            "@type": "IMAGE-HIGH-RES",
            "@size": "1093920",
            "@ref": "gr5",
            "@mimetype": "image/jpeg"
          },
          {
            "@category": "high",
            "@height": "1060",
            "@width": "1417",
            "@_fa": "true",
            "$": "https://api.elsevier.com/content/object/eid/1-s2.0-S0926860X16302137-gr6_lrg.jpg?httpAccept=%2A%2F%2A",
            "@multimediatype": "JPEG image file",
            "@type": "IMAGE-HIGH-RES",
            "@size": "227463",
            "@ref": "gr6",
            "@mimetype": "image/jpeg"
          },
          {
            "@category": "standard",
            "@_fa": "true",
            "$": "https://api.elsevier.com/content/object/eid/1-s2.0-S0926860X16302137-mmc1.doc?httpAccept=%2A%2F%2A",
            "@multimediatype": "Microsoft Word file",
            "@type": "APPLICATION",
            "@size": "738816",
            "@ref": "mmc1",
            "@mimetype": "application/word"
          },
          {
            "@category": "thumbnail",
            "@height": "35",
            "@width": "452",
            "@_fa": "true",
            "$": "https://api.elsevier.com/content/object/eid/1-s2.0-S0926860X16302137-si1.gif?httpAccept=%2A%2F%2A",
            "@multimediatype": "GIF image file",
            "@type": "ALTIMG",
            "@size": "2111",
            "@ref": "si1",
            "@mimetype": "image/gif"
          },
          {
            "@category": "thumbnail",
            "@height": "35",
            "@width": "373",
            "@_fa": "true",
            "$": "https://api.elsevier.com/content/object/eid/1-s2.0-S0926860X16302137-si2.gif?httpAccept=%2A%2F%2A",
            "@multimediatype": "GIF image file",
            "@type": "ALTIMG",
            "@size": "1938",
            "@ref": "si2",
            "@mimetype": "image/gif"
          }
        ]
      },
      "link": {
        "@rel": "abstract",
        "@href": "https://api.elsevier.com/content/abstract/scopus_id/84964652714"
      }
    }
  }
}