{
  "metadata": {
    "title": "Catalytic performance of low loading palladium-carbon catalyst in rosin disproportionation: Characterization, process enhancement, and reaction pathway",
    "authors": "; ; ",
    "journal": "Applied Catalysis A: General",
    "date": "2025-02-05",
    "doi": "10.1016/j.apcata.2024.120077",
    "abstract": "",
    "uri": "https://api.elsevier.com/content/article/pii/S0926860X24005222",
    "pii": "S0926860X24005222"
  },
  "fulltext": {
    "full-text-retrieval-response": {
      "scopus-eid": "2-s2.0-85212188567",
      "originalText": "serial JL 271346 291210 291744 291809 31 Applied Catalysis A: General APPLIEDCATALYSISAGENERAL 2024-12-15 2024-12-15 2024-12-18 2024-12-18 2025-01-07T20:52:35 1-s2.0-S0926860X24005222 S0926-860X(24)00522-2 S0926860X24005222 10.1016/j.apcata.2024.120077 S300 S300.1 FULL-TEXT 1-s2.0-S0926860X24X00198 2025-01-07T20:59:18.293185Z 0 0 20250205 2025 2024-12-15T04:03:33.201633Z absattachment articleinfo articlenumber articletitlenorm authfirstinitialnorm authfirstsurnamenorm cid cids contenttype copyright crossmark dateloaded dateloadedtxt datesearch datesort dateupdated dco docsubtype doctype doi eid ewtransactionid hubeid indexeddate issn issnnorm itemstage itemtransactionid itemweight openaccess openarchive pg pgfirst pii piinorm pubdatestart pubdatetxt pubyr sortorder srctitle srctitlenorm srctype ssids alllist content subj subheadings suppl tomb volfirst volissue volumelist webpdf webpdfpagecount yearnav figure table e-component body mmlmath acknowledge affil appendices articletitle auth authfirstini authfull authkeywords authlast grantnumber grantsponsor grantsponsorid highlightsabst primabst ref specialabst 0926-860X 0926860X true 691 691 C Volume 691 20 120077 120077 120077 20250205 5 February 2025 2025-02-05 2025 article fla © 2024 Elsevier B.V. All rights are reserved, including those for text and data mining, AI training, and similar technologies. CATALYTICPERFORMANCELOWLOADINGPALLADIUMCARBONCATALYSTINROSINDISPROPORTIONATIONCHARACTERIZATIONPROCESSENHANCEMENTREACTIONPATHWAY NIU Y 1 Introduction 2 Experimental 2.1 Materials and chemicals 2.2 Catalyst preparation 2.3 Catalyst characterization 2.4 Catalytic evaluation 2.5 GC-MS analysis 3 Results and discussion 3.1 Characterization of Pd/C catalysts 3.1.1 Structural characterization of Pd/C catalysts 3.1.2 XPS analysis of Pd/C catalysts 3.2 Catalytic performance of Pd/C catalyst in RD reaction 3.2.1 Effect of reaction time on catalytic performance 3.2.2 Effect of catalyst dosage on catalytic performance 3.2.3 Effect of Pd loading on catalytic performance 3.2.4 Effect of temperature on catalytic performance 3.2.5 Comparison of catalytic performance with commercial catalyst 3.3 Optimal RD process via RSM (Response surface method) 3.3.1 Determination of RSM factors 3.3.2 The DAA yield response surface experiment and variance analysis 3.3.3 Factor interaction response surface analysis 3.3.4 Verification of the optimization model 3.4 Matching relationship between structure and performance of Pd/C catalysts 3.5 Reaction kinetics of rosin disproportionation 3.6 Reaction pathways of rosin disproportionation reaction 4 Conclusion CRediT authorship contribution statement Acknowledgments Appendix A Supplementary material References KARLBERG 2021 671 678 A MANDAL 2018 2260 2269 M WANG 2024 1679 1693 G HUANG 2015 434 443 Y WANG 2016 219 233 L SILVESTRE 2008 67 88 A MONOMERSPOLYMERSCOMPOSITESRENEWABLERESOURCES CHAPTER4ROSINMAJORSOURCESPROPERTIESAPPLICATIONS LIU 2024 804 814 H MOSTAFALU 2017 61 66 R ZENG 2018 692 696 Y GU 2020 115588 Y SOUTO 2024 J JEON 2017 212 222 H GU 2015 S5-1295 Y MOSTAFALU 2017 201 206 R WANG 2007 784 789 L HAFEEZ 2020 119833 A CHAKER 2021 104584 H VEBBER 2019 1447 1458 M FERREIRA 2007 179 186 S ATHAR 2022 124205 M LIU 2017 1211 1221 Y WU 2022 658 667 Z PATTABIRAMAN 1997 9 20 R YAO 2020 17398 17409 M XIE 2017 1178 1188 J OGINNI 2019 100266 O DI 2019 201 207 L GAO 2024 X SANTOS 2020 118423 J WANG 2021 119540 C LU 2022 154834 Y LI 2021 147849 Q LI 2016 2289 2295 Y LI 2017 560 569 Y HUANG 2011 348 354 H TAN 2015 8675 8682 H ZHANG 2014 5816 5822 C LIU 2023 124701 H WU 2022 121387 S POLARZ 2006 2965 2969 S LI 2022 122432 T TIAN 2017 30 40 P GE 2024 151367 F WANG 2013 1 9 L SOUTO 2011 3504 3511 J SIYU 2023 106276 G HUA 2023 4692 4700 X RASOULI 2023 122799 K ANSARI 2023 112342 F SUN 2022 189 195 J YUNQIAN 2021 128 135 L YAO 2024 152100 J DUAN 2024 112015 C JIANG 2007 183 186 L WANG 2006 11 13 Y CHEN 2013 103 107 S KUMOOKA 2008 111 120 Y WANG 2009 242 250 L APSIMON 2011 2793 2801 J SONG 1985 535 542 Z NIUX2025X120077 NIUX2025X120077XY 2026-12-18T00:00:00.000Z 2026-12-18T00:00:00.000Z http://creativecommons.org/licenses/by-nc-nd/4.0/ © 2024 Elsevier B.V. All rights are reserved, including those for text and data mining, AI training, and similar technologies. 2024-12-20T01:29:20.680Z http://vtw.elsevier.com/data/voc/AddOnTypes/50.7/aggregated-refined National Key Research and Development Program of China 2019YFC1908402 NKRDPC National Key Research and Development Program of China http://data.elsevier.com/vocabulary/SciValFunders/501100012166 http://sws.geonames.org/1814991/ National Natural Science Foundation of China 51964032 NSFC National Natural Science Foundation of China http://data.elsevier.com/vocabulary/SciValFunders/501100001809 http://sws.geonames.org/1814991 This work was supported by the National Key Research and Development Program of China (2019YFC1908402), National Natural Science Foundation of China (51964032). The authors would like to thank Shiyanjia lab (www.shiyanjia.com) for the TEM tests. https://doi.org/10.15223/policy-017 https://doi.org/10.15223/policy-037 https://doi.org/10.15223/policy-012 https://doi.org/10.15223/policy-029 https://doi.org/10.15223/policy-004 item S0926-860X(24)00522-2 S0926860X24005222 1-s2.0-S0926860X24005222 10.1016/j.apcata.2024.120077 271346 2025-01-07T20:59:18.293185Z 2025-02-05 1-s2.0-S0926860X24005222-main.pdf https://s3-eu-west-1.amazonaws.com/prod-ucs-content-store-eu-west/content/pii:S0926860X24005222/MAIN/application/pdf/5cc3b0e491f38c0c092420ef05433470/main.pdf main.pdf pdf true 15933056 MAIN 15 1-s2.0-S0926860X24005222-main_1.png https://s3-eu-west-1.amazonaws.com/prod-ucs-content-store-eu-west/content/pii:S0926860X24005222/PREVIEW/image/png/6a9ab01a92075491cbe7827066a7a2f0/main_1.png main_1.png png 55314 849 656 IMAGE-WEB-PDF 1 1-s2.0-S0926860X24005222-sc1.jpg https://s3-eu-west-1.amazonaws.com/prod-ucs-content-store-eu-west/content/pii:S0926860X24005222/sc1/DOWNSAMPLED/image/jpeg/d3738d57bf95d7e164071c030ffb8b7f/sc1.jpg sc1 sc1.jpg jpg 90386 394 678 IMAGE-DOWNSAMPLED 1-s2.0-S0926860X24005222-gr10.jpg https://s3-eu-west-1.amazonaws.com/prod-ucs-content-store-eu-west/content/pii:S0926860X24005222/gr10/DOWNSAMPLED/image/jpeg/674d371eb203f7358bc6501d00baddac/gr10.jpg gr10 gr10.jpg jpg 87125 483 751 IMAGE-DOWNSAMPLED 1-s2.0-S0926860X24005222-ga1.jpg https://s3-eu-west-1.amazonaws.com/prod-ucs-content-store-eu-west/content/pii:S0926860X24005222/ga1/DOWNSAMPLED/image/jpeg/da19aae542f4e75d0ef03d57a554b98e/ga1.jpg ga1 true ga1.jpg jpg 29283 200 343 IMAGE-DOWNSAMPLED 1-s2.0-S0926860X24005222-gr9.jpg https://s3-eu-west-1.amazonaws.com/prod-ucs-content-store-eu-west/content/pii:S0926860X24005222/gr9/DOWNSAMPLED/image/jpeg/640e4c848f9328f62d77eebd784e8fd0/gr9.jpg gr9 gr9.jpg jpg 37123 311 791 IMAGE-DOWNSAMPLED 1-s2.0-S0926860X24005222-gr8.jpg https://s3-eu-west-1.amazonaws.com/prod-ucs-content-store-eu-west/content/pii:S0926860X24005222/gr8/DOWNSAMPLED/image/jpeg/883614c11b6d8afd12851fe3dca1d851/gr8.jpg gr8 gr8.jpg jpg 63664 457 791 IMAGE-DOWNSAMPLED 1-s2.0-S0926860X24005222-gr5.jpg https://s3-eu-west-1.amazonaws.com/prod-ucs-content-store-eu-west/content/pii:S0926860X24005222/gr5/DOWNSAMPLED/image/jpeg/6d0cd0f6d8c5da99cd4a37716dabb6e8/gr5.jpg gr5 gr5.jpg jpg 187870 757 791 IMAGE-DOWNSAMPLED 1-s2.0-S0926860X24005222-gr4.jpg https://s3-eu-west-1.amazonaws.com/prod-ucs-content-store-eu-west/content/pii:S0926860X24005222/gr4/DOWNSAMPLED/image/jpeg/03ad55cf3be74ce7d6693ce1b1f0ff3e/gr4.jpg gr4 gr4.jpg jpg 173020 883 791 IMAGE-DOWNSAMPLED 1-s2.0-S0926860X24005222-gr7.jpg https://s3-eu-west-1.amazonaws.com/prod-ucs-content-store-eu-west/content/pii:S0926860X24005222/gr7/DOWNSAMPLED/image/jpeg/859ce2fb87814ee03b21c8221762c766/gr7.jpg gr7 gr7.jpg jpg 133117 530 791 IMAGE-DOWNSAMPLED 1-s2.0-S0926860X24005222-gr6.jpg https://s3-eu-west-1.amazonaws.com/prod-ucs-content-store-eu-west/content/pii:S0926860X24005222/gr6/DOWNSAMPLED/image/jpeg/04e895c4cdf6f6300c14f43cb0856d20/gr6.jpg gr6 gr6.jpg jpg 46794 280 678 IMAGE-DOWNSAMPLED 1-s2.0-S0926860X24005222-gr1.jpg https://s3-eu-west-1.amazonaws.com/prod-ucs-content-store-eu-west/content/pii:S0926860X24005222/gr1/DOWNSAMPLED/image/jpeg/90c2de477f7202b49b4773545907c62b/gr1.jpg gr1 gr1.jpg jpg 71700 494 602 IMAGE-DOWNSAMPLED 1-s2.0-S0926860X24005222-gr3.jpg https://s3-eu-west-1.amazonaws.com/prod-ucs-content-store-eu-west/content/pii:S0926860X24005222/gr3/DOWNSAMPLED/image/jpeg/1043b1f7b598f14e979811e9760182a6/gr3.jpg gr3 gr3.jpg jpg 123519 581 791 IMAGE-DOWNSAMPLED 1-s2.0-S0926860X24005222-gr2.jpg https://s3-eu-west-1.amazonaws.com/prod-ucs-content-store-eu-west/content/pii:S0926860X24005222/gr2/DOWNSAMPLED/image/jpeg/a8c83fab87270d75df565d484388ffc0/gr2.jpg gr2 gr2.jpg jpg 196012 995 553 IMAGE-DOWNSAMPLED 1-s2.0-S0926860X24005222-sc1.sml https://s3-eu-west-1.amazonaws.com/prod-ucs-content-store-eu-west/content/pii:S0926860X24005222/sc1/THUMBNAIL/image/gif/c0d36406a008de4b74cb8eeebd18e0e0/sc1.sml sc1 sc1.sml sml 24659 127 219 IMAGE-THUMBNAIL 1-s2.0-S0926860X24005222-gr10.sml https://s3-eu-west-1.amazonaws.com/prod-ucs-content-store-eu-west/content/pii:S0926860X24005222/gr10/THUMBNAIL/image/gif/e9c56f5e298ed33f39c00c4802fab35f/gr10.sml gr10 gr10.sml sml 13088 141 219 IMAGE-THUMBNAIL 1-s2.0-S0926860X24005222-ga1.sml https://s3-eu-west-1.amazonaws.com/prod-ucs-content-store-eu-west/content/pii:S0926860X24005222/ga1/THUMBNAIL/image/gif/e51a7fb2725b5f4568237819629357e1/ga1.sml ga1 true ga1.sml sml 25001 128 219 IMAGE-THUMBNAIL 1-s2.0-S0926860X24005222-gr9.sml https://s3-eu-west-1.amazonaws.com/prod-ucs-content-store-eu-west/content/pii:S0926860X24005222/gr9/THUMBNAIL/image/gif/b44fdf68ab0b9cad3fdc70a4c37d7d7c/gr9.sml gr9 gr9.sml sml 3884 86 219 IMAGE-THUMBNAIL 1-s2.0-S0926860X24005222-gr8.sml https://s3-eu-west-1.amazonaws.com/prod-ucs-content-store-eu-west/content/pii:S0926860X24005222/gr8/THUMBNAIL/image/gif/3d70295625d9ac0eb7e25bdef306e4cf/gr8.sml gr8 gr8.sml sml 8470 127 219 IMAGE-THUMBNAIL 1-s2.0-S0926860X24005222-gr5.sml https://s3-eu-west-1.amazonaws.com/prod-ucs-content-store-eu-west/content/pii:S0926860X24005222/gr5/THUMBNAIL/image/gif/dcd2cb3940286c7cb37d9c372524392e/gr5.sml gr5 gr5.sml sml 16853 164 171 IMAGE-THUMBNAIL 1-s2.0-S0926860X24005222-gr4.sml https://s3-eu-west-1.amazonaws.com/prod-ucs-content-store-eu-west/content/pii:S0926860X24005222/gr4/THUMBNAIL/image/gif/5bbce74eb2f851ccfafaa7be38ca9627/gr4.sml gr4 gr4.sml sml 11879 164 147 IMAGE-THUMBNAIL 1-s2.0-S0926860X24005222-gr7.sml https://s3-eu-west-1.amazonaws.com/prod-ucs-content-store-eu-west/content/pii:S0926860X24005222/gr7/THUMBNAIL/image/gif/f8756471782765c78953ca743d372e83/gr7.sml gr7 gr7.sml sml 18145 147 219 IMAGE-THUMBNAIL 1-s2.0-S0926860X24005222-gr6.sml https://s3-eu-west-1.amazonaws.com/prod-ucs-content-store-eu-west/content/pii:S0926860X24005222/gr6/THUMBNAIL/image/gif/a86d465dbdb10b9f741cb0198ffecbd1/gr6.sml gr6 gr6.sml sml 7539 91 219 IMAGE-THUMBNAIL 1-s2.0-S0926860X24005222-gr1.sml https://s3-eu-west-1.amazonaws.com/prod-ucs-content-store-eu-west/content/pii:S0926860X24005222/gr1/THUMBNAIL/image/gif/46a9a6d0538f8a1e036689d0e146205d/gr1.sml gr1 gr1.sml sml 12392 164 200 IMAGE-THUMBNAIL 1-s2.0-S0926860X24005222-gr3.sml https://s3-eu-west-1.amazonaws.com/prod-ucs-content-store-eu-west/content/pii:S0926860X24005222/gr3/THUMBNAIL/image/gif/8633075b47215e49dc555c9ac1dd213a/gr3.sml gr3 gr3.sml sml 14318 161 219 IMAGE-THUMBNAIL 1-s2.0-S0926860X24005222-gr2.sml https://s3-eu-west-1.amazonaws.com/prod-ucs-content-store-eu-west/content/pii:S0926860X24004794/gr2/THUMBNAIL/image/gif/1cd719547aae869d390b9fc921aa1851/gr2.sml gr2 gr2.sml sml 11253 164 91 IMAGE-THUMBNAIL 1-s2.0-S0926860X24005222-sc1_lrg.jpg https://s3-eu-west-1.amazonaws.com/prod-ucs-content-store-eu-west/content/pii:S0926860X24005222/HIGHRES/image/jpeg/7cbb077a6e0537272fbf4cf9fae1b9d1/sc1_lrg.jpg sc1 sc1_lrg.jpg jpg 425999 1739 2994 IMAGE-HIGH-RES 1-s2.0-S0926860X24005222-gr10_lrg.jpg https://s3-eu-west-1.amazonaws.com/prod-ucs-content-store-eu-west/content/pii:S0926860X24005222/HIGHRES/image/jpeg/230178483dcff7a4efb0a4d4884d7558/gr10_lrg.jpg gr10 gr10_lrg.jpg jpg 392482 2141 3326 IMAGE-HIGH-RES 1-s2.0-S0926860X24005222-ga1_lrg.jpg https://s3-eu-west-1.amazonaws.com/prod-ucs-content-store-eu-west/content/pii:S0926860X24005222/HIGHRES/image/jpeg/edbc2b93f1c7ca66faef5f602c519008/ga1_lrg.jpg ga1 true ga1_lrg.jpg jpg 281623 886 1521 IMAGE-HIGH-RES 1-s2.0-S0926860X24005222-gr9_lrg.jpg https://s3-eu-west-1.amazonaws.com/prod-ucs-content-store-eu-west/content/pii:S0926860X24005222/HIGHRES/image/jpeg/3c776ef86ceb8e07602ec22c01e93e46/gr9_lrg.jpg gr9 gr9_lrg.jpg jpg 174362 1373 3493 IMAGE-HIGH-RES 1-s2.0-S0926860X24005222-gr8_lrg.jpg https://s3-eu-west-1.amazonaws.com/prod-ucs-content-store-eu-west/content/pii:S0926860X24005222/HIGHRES/image/jpeg/056ced2b1d8e412c67677e9327321773/gr8_lrg.jpg gr8 gr8_lrg.jpg jpg 320676 2019 3493 IMAGE-HIGH-RES 1-s2.0-S0926860X24005222-gr5_lrg.jpg https://s3-eu-west-1.amazonaws.com/prod-ucs-content-store-eu-west/content/pii:S0926860X24005222/HIGHRES/image/jpeg/0f14fb531f57e363bcb59b51a4ff4ce0/gr5_lrg.jpg gr5 gr5_lrg.jpg jpg 837543 3343 3493 IMAGE-HIGH-RES 1-s2.0-S0926860X24005222-gr4_lrg.jpg https://s3-eu-west-1.amazonaws.com/prod-ucs-content-store-eu-west/content/pii:S0926860X24005222/HIGHRES/image/jpeg/b74ca81cb33c8b1b01325767f9406e73/gr4_lrg.jpg gr4 gr4_lrg.jpg jpg 841995 3899 3493 IMAGE-HIGH-RES 1-s2.0-S0926860X24005222-gr7_lrg.jpg https://s3-eu-west-1.amazonaws.com/prod-ucs-content-store-eu-west/content/pii:S0926860X24005222/HIGHRES/image/jpeg/d1c8b6187168651c1df23ba37acd843c/gr7_lrg.jpg gr7 gr7_lrg.jpg jpg 628958 2341 3493 IMAGE-HIGH-RES 1-s2.0-S0926860X24005222-gr6_lrg.jpg https://s3-eu-west-1.amazonaws.com/prod-ucs-content-store-eu-west/content/pii:S0926860X24005222/HIGHRES/image/jpeg/7fe5a979db7f7fffdae886fd2e43c318/gr6_lrg.jpg gr6 gr6_lrg.jpg jpg 221747 1238 2994 IMAGE-HIGH-RES 1-s2.0-S0926860X24005222-gr1_lrg.jpg https://s3-eu-west-1.amazonaws.com/prod-ucs-content-store-eu-west/content/pii:S0926860X24005222/HIGHRES/image/jpeg/06c2a3427277ce9ebc9e19befb305425/gr1_lrg.jpg gr1 gr1_lrg.jpg jpg 352916 2185 2661 IMAGE-HIGH-RES 1-s2.0-S0926860X24005222-gr3_lrg.jpg https://s3-eu-west-1.amazonaws.com/prod-ucs-content-store-eu-west/content/pii:S0926860X24004794/HIGHRES/image/jpeg/f6db123967a4a7b32fdd5cef6e9657fc/gr3_lrg.jpg gr3 gr3_lrg.jpg jpg 617476 2565 3493 IMAGE-HIGH-RES 1-s2.0-S0926860X24005222-gr2_lrg.jpg https://s3-eu-west-1.amazonaws.com/prod-ucs-content-store-eu-west/content/pii:S0926860X24004794/HIGHRES/image/jpeg/65911d3c986899d5b121c54840484910/gr2_lrg.jpg gr2 gr2_lrg.jpg jpg 1044437 4408 2449 IMAGE-HIGH-RES 1-s2.0-S0926860X24005222-mmc1.docx https://s3-eu-west-1.amazonaws.com/prod-ucs-content-store-eu-west/content/pii:S0926860X24005222/mmc1/MAIN/application/vnd.openxmlformats-officedocument.wordprocessingml.document/123e9fdecb5a1bbbe1a9f82cb859c66d/mmc1.docx mmc1 mmc1.docx docx 2687641 APPLICATION 1-s2.0-S0926860X24005222-si0001.svg https://s3-eu-west-1.amazonaws.com/prod-ucs-content-store-eu-west/content/pii:S0926860X24005222/image/svg+xml/5e6a8295bca8476a5735c5b617ee0e22/si0001.svg si0001 si0001.svg svg 1669 ALTIMG 1-s2.0-S0926860X24005222-si0002.svg https://s3-eu-west-1.amazonaws.com/prod-ucs-content-store-eu-west/content/pii:S0926860X24005222/image/svg+xml/53c08cea1451d79dd54ffaf54b79133d/si0002.svg si0002 si0002.svg svg 1977 ALTIMG 1-s2.0-S0926860X24005222-si0003.svg https://s3-eu-west-1.amazonaws.com/prod-ucs-content-store-eu-west/content/pii:S0926860X24005222/image/svg+xml/dd2c53d7f648ab59865ea6e4d6a64c41/si0003.svg si0003 si0003.svg svg 1089 ALTIMG 1-s2.0-S0926860X24005222-si0004.svg https://s3-eu-west-1.amazonaws.com/prod-ucs-content-store-eu-west/content/pii:S0926860X24005222/image/svg+xml/a151cc72d4e644480cee064ca577607e/si0004.svg si0004 si0004.svg svg 1118 ALTIMG 1-s2.0-S0926860X24005222-si0005.svg https://s3-eu-west-1.amazonaws.com/prod-ucs-content-store-eu-west/content/pii:S0926860X24005222/image/svg+xml/c83838584f6397034143df132a8ece7b/si0005.svg si0005 si0005.svg svg 935 ALTIMG 1-s2.0-S0926860X24005222-si0006.svg https://s3-eu-west-1.amazonaws.com/prod-ucs-content-store-eu-west/content/pii:S0926860X24005222/image/svg+xml/258b03acaa49af6be6f300bda7fde622/si0006.svg si0006 si0006.svg svg 1126 ALTIMG 1-s2.0-S0926860X24005222-si0007.svg https://s3-eu-west-1.amazonaws.com/prod-ucs-content-store-eu-west/content/pii:S0926860X24005222/image/svg+xml/258b03acaa49af6be6f300bda7fde622/si0007.svg si0007 si0007.svg svg 1126 ALTIMG APCATA 120077 120077 S0926-860X(24)00522-2 10.1016/j.apcata.2024.120077 Elsevier B.V. Fig. 1 Schematic diagram of general process to produce rosin from pine trees and rosin modifications. Fig. 1 Fig. 2 Structural characterization of Pd/C catalysts. TEM, HAADF-STEM images of (a) 1-Pd, (b) 1.5-Pd, (c) 2-Pd, (d) 2.5-Pd/C, (e) 3-Pd/C, and (f) 4-Pd/C. Fig. 2 Fig. 3 N2 adsorption-desorption isotherms and pore size distribution curve of AC (a), 1-Pd/C (b), 1.5-Pd/C (c), 2-Pd/C (d), 2.5-Pd/C (e), 3-Pd/C (f), 4-Pd/ (g), and XRD patterns of Pd/C catalysts (h). Fig. 3 Fig. 4 Pd 3d and O 1 s XPS spectra of Pd/C catalysts. Fig. 4 Fig. 5 Catalytic performance of Pd/AC catalysts with different conditions (reaction time, catalyst dosage, and Pd loading) for the RD reaction. Fig. 5 Fig. 6 Catalytic performance of Pd/AC catalysts under different temperatures for the RD reaction (a); Comparison of commercial Pd/C catalyst with our catalyst in the disproportionation of rosin (b). Fig. 6 Fig. 7 Contour map and response surface graph of the interaction among four factors on the DAA content. Fig. 7 Fig. 8 Correlations between DAA content and Pd NPs size (a), crystallite size (b), Pd dispersion (c), Pd loading (d), and Pd0 ratio (e). (Reaction conditions: 0.03 wt%, 270 °C, 120 min, and the atmosphere was nitrogen). Fig. 8 Fig. 9 (a) Zero-order kinetic model fitted to the experimental data calculated from the dehydrogenation of AA at different temperature over Pd/C catalyst; (b) Arrhenius plot for AA dehydrogenation at different temperature on Pd/C catalyst. Fig. 9 Fig. 10 GC-MS analysis of rosin before and after catalytic disproportionation on: (a) raw rosin, (b) disproportionated rosin; catalyzed by 1.5-Pd/C catalyst; (c) Reaction pathways of RD reaction. Fig. 10 Scheme 1 Flow chart of catalyst preparation. Scheme 1 Table 1 Comparison performance of Pd/C catalysts in RD reaction. Table 1 Catalysts Pd (wt%) Reaction time (h) Catalyst dosage (wt%) Main component content (%) Quality standard Ref. AA DAA Pd-NP-AC 4.65 3.00 0.05 0.07 70.00 Super [11] Pd/AC3 2.00 2.00 5.00 0.00 64.15 Super [13] Fe3O4-Pd-C 2.46 1.00 0.25 0.00 74.00 Super [17] Pd/C 4.00 2.00 0.25 5.16 44.00 Below proof [12] Pd/C-salicylate 4.00 3.00 0.25 0.12 65.70 First-grade [12] Pd/C 3.00 0.20 < 0.1 % 89.45 Super [18] (AA: abietic acid; DAA: dehydroabietic acid.) Table 2 Physicochemical properties of Pd/C catalysts. Table 2 Catalysts Pd loading (%) a SBET b (m2/g) TPV b (cm3/g) MPS b (nm) Size (nm) c D d (%) AC - 1605.10 1.38 3.31 - - 1-Pd/C 0.81 1568.77 1.14 3.24 2.96 38.17 1.5-Pd/C 1.30 1482.63 1.02 3.57 3.00 37.67 2-Pd/C 1.88 1229.15 0.95 3.11 3.07 36.81 2.5-Pd/C 2.38 1081.50 0.85 3.14 3.35 33.73 3-Pd/C 2.72 764.85 0.75 3.74 3.27 34.55 4-Pd/C 3.85 667.23 0.65 3.34 3.41 33.13 a : Determined by ICP-OES analysis. b : Measured by N2 physisorption, c : Calculated from Scherrer equation. d : Pd dispersion values (D) calculated from crystallite size [26]. Table 3 Level and coding of factors. Table 3 Factors Codes Levels −1 0 + 1 Temperature (°C) A 260 270 280 Time (min) B 90 120 150 Addition amount (mg) C 20 30 40 Pd loading (g) D 0.02 0.03 0.04 Table 4 Analysis of variance (ANOVA) table for response surface quadratic model. Table 4 Source SS DF MS F -value p -value (Prob > F ) Significance Model 1137.02 14 81.22 14.13 < 0.0001 significant A-Temperature 225.59 1 225.59 39.25 < 0.0001 B-Time 4.21 1 4.21 0.7329 0.4087 C-Additon 352.30 1 352.30 61.29 < 0.0001 D-Pd loading 147.84 1 147.84 25.72 0.0003 AB 0.0025 1 0.0025 0.0004 0.9837 AC 6.48 1 6.48 1.13 0.3093 AD 2.72 1 2.72 0.4737 0.5044 BC 1.37 1 1.37 0.2382 0.6343 BD 0.1260 1 0.1260 0.0219 0.8847 CD 3.82 1 3.82 0.6649 0.4307 A 2 43.60 1 43.60 7.59 0.0175 B 2 8.05 1 8.05 1.40 0.2596 C 2 173.86 1 173.86 30.25 0.0001 D 2 37.96 1 37.96 6.60 0.0245 Residual 68.97 12 5.75 Lack of Fit 65.92 10 6.59 4.31 0.2028 not significant Pure error 3.06 2 1.53 Cor total 1205.99 26 Catalytic performance of low loading palladium-carbon catalyst in rosin disproportionation: Characterization, process enhancement, and reaction pathway Yifan Niu Writing – original draft Formal analysis Data curation Conceptualization a b c Siyu Gong Investigation a b c Jinhao Zheng Formal analysis a b c Xian Zhou Formal analysis a b c Ziyu Song Methodology a b c Shaohua Ju Writing – review & editing Funding acquisition Conceptualization a b c d ⁎ Yongwan Gu Writing – review & editing Resources e ⁎⁎ a Faculty of Metallurgical and Energy Engineering, Kunming University of Science and Technology, Kunming, Yunnan 650093, China Faculty of Metallurgical and Energy Engineering, Kunming University of Science and Technology Kunming Yunnan 650093 China Faculty of Metallurgical and Energy Engineering, Kunming University of Science and Technology, Kunming, Yunnan 650093, China b Key Laboratory of Unconventional Metallurgy, Ministry of Education, Kunming, Yunnan 650093, China Key Laboratory of Unconventional Metallurgy, Ministry of Education Kunming Yunnan 650093 China Key Laboratory of Unconventional Metallurgy, Ministry of Education, Kunming, Yunnan 650093, China c National Local Joint Laboratory of Engineering Application of Microwave Energy and Equipment Technology, Kunming, Yunnan 650093, China National Local Joint Laboratory of Engineering Application of Microwave Energy and Equipment Technology Kunming Yunnan 650093 China National Local Joint Laboratory of Engineering Application of Microwave Energy and Equipment Technology, Kunming, Yunnan 650093, China d State Key Laboratory of Complex Nonferrous Metal Resources Clean Utilization, Kunming, Yunnan 650093, China State Key Laboratory of Complex Nonferrous Metal Resources Clean Utilization Kunming Yunnan 650093 China State Key Laboratory of Complex Nonferrous Metal Resources Clean Utilization, Kunming, Yunnan 650093, China. e Kunming Institute of Precious Metals, Kunming 650106, China Kunming Institute of Precious Metals Kunming 650106 China Kunming Institute of Precious Metals, Kunming 650106, China ⁎ Corresponding author at: Faculty of Metallurgical and Energy Engineering, Kunming University of Science and Technology, Kunming, Yunnan 650093, China Faculty of Metallurgical and Energy Engineering, Kunming University of Science and Technology Kunming Yunnan 650093 China ⁎⁎ Corresponding author. This study introduces an efficient Pd/C catalyst for the rosin disproportionation (RD) reaction, a key biomass conversion process. The low-loaded Pd/C catalysts, with 3–6 nm Pd nanoparticles, were synthesized via deposition-precipitation and characterized for their high dispersion of metallic Pd on activated carbon. Optimized using the Box-Behnken design of response surface methodology, the catalyst achieved a 71.36 % maximum DAA yield under optimal conditions (280 °C, 150 min, 0.04 wt% catalyst, 3.00 wt% Pd), surpassing commercial catalysts by 1.27 times with reduced Pd usage. Key factors for catalytic activity included Pd loading, dispersion, particle size, and metallic Pd content. Kinetic studies showed an activation energy of 21.52 kJ/mol for the conversion of abietic acid to dehydroabietic acid, highlighting the superior potential in the RD reaction. Ultraviolet-visible absorption spectra and gas chromatography-mass spectrometry analyses elucidated the reaction pathway and mechanism, providing a practical approach to developing high-activity catalysts for industrial RD applications. Graphical Abstract Keywords Pd/C catalyst Rosin disproportionation Process optimization Reaction pathways Response surface methodology Data availability Data will be made available on request. 1 Introduction Resin rosin, a key sustainable natural product derived from forestry, is predominantly produced in China [1]. Primarily composed of rosin acids with a minor fraction of neutrals [2], its susceptibility to oxidation due to double bonds constrains its applications [3]. To enhance its stability and versatility, modifications such as isomerization, disproportionation, hydrogenation, maleation, and esterification are applied. Dehydroabietic acid (DAA), a derivative, finds broad industrial use [4,5]. The transformation to disproportionated rosin offers a cost-effective, renewable resource with significant commercial value. Fig. 1 depicts the modification process. The RD reaction is an oxidation-reduction process in which a segment of the conjugated double bonds in AA loses two hydrogen atoms, forming a stable benzene ring structure known as DAA. Concurrently, another portion of AA molecules gains two or four hydrogen atoms, resulting in the formation of dihydroabietic acid or tetrahydroabietic acid, respectively [6]. Catalysis is essential for this reaction, with the catalytic performance profoundly affecting both the reaction efficiency and product quality [7]. Among the various RD catalysts, including sulfide, iodide, non-precious metal, and precious metal catalysts [8], the Pd/C catalyst is particularly favored in industrial applications due to its high activity, lower operating temperature requirements, and superior product quality in RD reactions [9]. However, the scarcity of palladium (with concentrations < 3 ng/g in the Earth’s crust) and its high cost render Pd/C catalysts expensive [10]. Therefore, improving RD reaction performance and reducing catalyst costs are crucial objectives. Extensive research has focused on elucidating the reaction pathways and improving the catalytic performance of Pd/C catalysts in RD reaction. Mostafalu et al. produced spherical Pd/C catalysts with particle sizes from 10 to 45 nm via liquid phase reduction, achieving a 70 % yield of DAA in disproportionated rosin under optimized conditions [11]. Zeng et al. enhanced Pd utilization by modifying AC with maleic acid, sodium citrate, and salicylic acid, forming strong Pd complexes that resulted in superior catalytic activity and production of disproportionated rosin meeting forestry first-grade standards [12]. Gu et al. increased the specific surface area of AC through nitric acid pretreatment and prepared Pd/C catalysts at various vacuum drying temperatures using wet impregnation; the catalyst dried at 443 K exhibited the highest Pd dispersion (23.60 %), specific surface area (1057 m²/g), and DAA content (64.15 %), underscoring the influence of strong metal-support interactions (SMSI) on catalyst performance [13]. Despite these efforts, Pd/C catalysts for RD often exhibit low catalytic activity and high precious metal content ( Table 1). Research has primarily focused on support modification and reaction kinetics [14–16]. There is a lack of literature on low-loading Pd/C catalysts that maintain high catalytic activity, and the structure-activity relationship in RD is not well understood. The mechanisms of AA hydrogenation and dehydrogenation are not well established, impeding the development of more efficient Pd/C catalysts. Understanding the reaction pathways and intermediates is crucial for reducing precious metal usage and developing more efficient catalysts. In catalysis, the efficiency of the RD process is profoundly influenced by various reaction-intrinsic parameters and catalyst characteristics. A comprehensive review of the literature reveals that reaction temperature, duration, catalyst dosage, and Pd loading are the pivotal factors that significantly modulate catalytic performance. The response surface methodology (RSM), and specifically the Box-Behnken Design (BBD), is widely recognized for its ability to define the optimal operational parameters for RD processes by assessing the effects of these multiple factors [19,20]. BBD is noted for its effectiveness and practicality in statistical experimental design, due to its ability to examine multiple variables concurrently within a single experimental setup and its requirement for fewer experimental trials compared to other strategies [21,22]. Additionally, BBD can estimate response functions at intermediate levels without the need for direct experimental probing [23]. Although BBD has been extensively applied in analogous contexts, its application in optimizing and modeling the Pd/C-catalyzed RD reaction has not been explored. This study, therefore, employs the BBD experimental design model to determine the optimized conditions for the RD process, addressing a significant research gap. This work successfully synthesized a range of Pd/C catalysts with low Pd loadings ranging from 1.00–4.00 wt%, employing a deposition-precipitation method. These catalysts exhibited high activity in the RD reaction under mild conditions with mechanical agitation. Characterization techniques including high-angle annular dark-field scanning transmission electron microscope (HAADF-STEM), X-ray diffraction (XRD), and X-ray photoelectron spectroscopy (XPS) were employed to characterize the catalysts structure and chemical properties. These characterizations established the correlation between catalyst structure and catalytic activity, shedding light on the underlying catalytic mechanisms. A comprehensive investigation of the RD process, encompassing reaction temperature, time, catalyst dosage, and Pd loading, was performed using a three-level, four-factor BBD based on RSM. Furthermore, ultraviolet-visible (UV–vis) spectroscopy and gas chromatography-mass spectrometry (GC-MS) were employed for the quantification and qualitative analysis of the disproportionation products, delineating the reaction pathway. This research focuses on elucidating the structure of Pd/C catalysts and optimizing the RD reaction conditions, providing a theoretical foundation for their industrial application. 2 Experimental 2.1 Materials and chemicals The detailed materials and chemicals information were shown in Supplementary Material. 2.2 Catalyst preparation Palladium-loaded AC supports with Pd contents ranging from 1.00 wt% to 4.00 wt% were synthesized via the deposition-precipitation method with palladium (II) nitrate (Pd(NO3)2) as the metal precursor. The preparation procedure is as follows ( Scheme 1) and described in detail within in Support Material. The resulting Pd/C catalysts were labeled according to their increasing Pd loadings as 1-Pd/C, 1.5-Pd/C, 2-Pd/C, 2.5-Pd/C, 3-Pd/C, and 4-Pd/C. 2.3 Catalyst characterization Detailed information regarding inductively coupled plasma atomic emission spectrometry (ICP-AES), X-ray diffraction (XRD), X-ray photoelectron spectroscopy (XPS), High-angle annular dark-field scanning transmission electron microscope (HAADF-STEM) with energy-dispersive X-ray spectroscopy (EDS), and N2 adsorption-desorption measurements can be found in the Supplementary Material. 2.4 Catalytic evaluation A total of 100 g of raw rosin was accurately weighed and then crushed into a nitrogen-purged three-necked flask, which was equipped with a magnetic stirrer and a thermometer. The flask was heated to melt the rosin with continuous magnetic stirring. At a temperature of 230 °C, 10–40 mg (0.01–0.04 wt%) of Pd/C catalyst was uniformly incorporated into the molten rosin. The reaction temperature was set to 270 °C and maintained throughout the duration of the process. Samples were collected at intervals of 30 min using a pipette for subsequent analysis. Detailed information on the catalytic tests and a schematic diagram of the disproportionation reaction evaluation setup (Fig. S1) for rosin can be found in the Support Material. 2.5 GC-MS analysis To ascertain the principal constituents and track the conversion of AA to DAA, as well as to assess the yield of DAA after disproportionation, both the raw and disproportionated rosin were subjected to a thorough gas chromatography-mass spectrometry (GC-MS) analysis. The sample preparation included a methylation step using tetramethylammonium hydroxide in methanol, which is crucial for analyzing the polar and high-boiling compounds present in rosin, such as abietic acid. This step enhances the volatility and reduces the polarity of these compounds, facilitating their analysis. Comprehensive details regarding the equipment and experimental parameters are furnished in the Supplementary Material. 3 Results and discussion 3.1 Characterization of Pd/C catalysts 3.1.1 Structural characterization of Pd/C catalysts The Pd content in the as-prepared Pd/C catalysts was quantified using ICP-AES. Table 2 shows that the Pd loadings in the six samples match the targeted concentrations of 1.00 wt%, 1.50 wt%, 2.00 wt%, 2.50 wt%, 3.00 %, and 4.00 %, respectively. These findings confirm the successful synthesis of the Pd/C catalysts. The specific surface area (S BET), total pore volume (TPV), mean pore size (MPS), crystallite size, and dispersion of Pd/C catalysts were measured and are summarized in Table 2. An increase in Pd loading resulted in a significant reduction in the S BET and TPV of the Pd/C catalysts, from 1605.10 m2/g and 1.38 cm3/g to 667.23 m2/g and 0.65 cm3/g, respectively. This reduction is due to the aggregation of Pd NPs on the AC support surface or within its pores [24]. The elevated Pd loading on AC enhances the number of active sites, thereby improving catalyst activity [25]. To elucidate the surface morphology and microstructure of the synthesized Pd/C catalysts, TEM images and EDS mappings are depicted in Fig. 2 and Fig. S2. The images display numerous distinct darker Pd NPs against a lighter AC background, confirming high-density dispersion of Pd NPs on AC. To determine the average particles size of the catalysts, 200 particles were randomly selected for analysis, and the findings are shown in Fig. 2(a-f). The results demonstrate that Pd NPs are highly dispersed on the AC surface, with average sizes ranging from 3.32 to 5.98 nm. An increase in Pd loading results in larger Pd NPs and a wider size distribution. The average Pd sizes, calculated from Scherrer equation (Table 2), align with TEM observations. Exceeding a 2.00 wt% Pd loading results in significant aggregation of Pd species, reducing dispersion. HAADF-STEM images reveal lattice distances of 0.222–0.226 nm, corresponding to the (111) crystal plane of Pd NPs [27]. EDS mapping confirms the uniform distribution of C, O, and Pd elements across the AC surface (Fig. S2) [28]. This uniform Pd dispersion is pivotal for maximizing active sites and enhancing catalytic activity in the disproportionation reaction. The specific surface areas and pore size distribution of AC and Pd/C catalysts were examined using nitrogen adsorption-desorption isotherms. Fig. 3(a-g) display the corresponding pore size distribution, with structural parameters provided in Table 2. Both the AC and Pd/C catalysts display typical Type IV isotherms with H2 hysteresis loops at relative pressures of 0.6 < P/P 0 < 0.9, indicative of mesoporous structures [29,30]. The pore size distribution, derived from the Density Functional Theory (DFT) model, reveals that the pore diameters are concentrated in 1–10 nm range and are evenly distributed across all samples. After Pd loading, the shape of the adsorption isotherm shape was maintained, but the gas adsorbed decreased, suggesting a reduction in mesopore and total pore volume. The AC possesses a surface area and pore volume of 1605.10 m²/g and 1.38 cm³ /g, respectively, which is conducive to Pd species dispersion. However, with increasing Pd loading, the surface area and pore volume of the Pd/C catalysts decrease in the following order: 1-Pd/C (1568.77 m²/g, 1.14 cm³/g) > 1.5-Pd/C (1482.63 m²/g, 1.02 cm³/g) > 2-Pd/C (1229.15 m²/g, 0.95 cm³/g) > 2.5-Pd/C (1081.50 m²/g, 0.85 cm³/g) > 3-Pd/C (764.85 m²/g, 0.75 cm³/g) > 4-Pd/C (667.23 m²/g, 0.65 cm³/g). This trend suggests that Pd particles, which are relatively large compared to the mesopore size, may partially occupy and block some mesopores within the support. Nevertheless, the large BET surface area of AC indicates a high number of active catalytic sites, aiding adsorption and activation [31]. Fig. 3(h) presents the XRD patterns of the Pd/C catalysts, showing a broad peak at 26.0° for the carbon support (PDF #75–0444). Four distinct peaks corresponding to the (111), (200), and (220) planes of metallic Pd (PDF #00–005–0681) are also observed. At low loadings, the Pd characteristic peak is barely visible, indicating small, highly dispersed Pd NPs particles on the AC surface [32]. Above 2.00 wt% Pd loading, a pronounced peak at 40.1° appears, corresponding to the (111) planes of Pd. The predominance of the Pd (111) face is crucial for rosin disproportionation. The intensity of this peak increases with higher Pd loadings, indicating effective deposition. The XRD data align with the ICP-AES results in Table 2. Pd NPs, calculated from the full-width-at-half-maximum (FWHM) of the Pd (111) peak at 40.1° using the Scherrer equation, increase in the order: 1-Pd/C < 1.5-Pd/C < 2-Pd/C < 2.5-Pd/C < 3-Pd/C < 4-Pd/C. Pd dispersion values, determined from crystallite sizes, are 38.17 %, 37.67 %, 36.81 %, 33.73 %, 34.55 %, and 33.13 % for the 1-Pd/C to 4-Pd/C catalysts, respectively (Table 2). Although peak overlapping with the carbon support may affect accuracy, the trend in crystallite sizes and Pd dispersion is consistent with TEM findings. 3.1.2 XPS analysis of Pd/C catalysts XPS analysis of the Pd 3d and O 1 s levels was conducted to investigate the surface electronic configurations of the Pd/C catalysts, with results detailed in Fig. 4 and Table S1. The deconvoluted XPS spectra exposed two pairs of peaks for Pd/C series. Peaks at 335.20–336.26 eV and 340.33–341.29 eV, indicative of metallic Pd (Pd0), correspond to the Pd 3d 5/2 and 3d 3/2 orbitals, respectively. A less intense set of peaks at 336.21–337.56 eV and 341.35–342.78 eV are assigned to Pd2+ species, originating from the same orbitals [33,34]. A systematic increase in Pd0 intensity and a corresponding decrease in Pd2+ intensity were observed across the 1-Pd/C to 4-Pd/C series. A higher Pd0 to Pd2+ ratio and increased peak intensity suggest enhanced catalytic activity due to the reduced Pd0 state [35]. Additionally, the Pd0 3d 5/2 XPS peaks shifted towards higher binding energies (Table S1), indicating a strengthened interaction between metallic Pd and the AC support. This interaction, supported by literature, implies the formation of negatively charged Pd0 species (Pd0-Vo) through electron transfer via the SMSI mechanism [36,37], enhancing H2 adsorption and activation [38]. Consequently, increased Pd loading correlates with a higher density of Pd0-Vo species, which is associated with improved catalytic activity for the RD reaction. Oxygen vacancies are acknowledged for their essential role in oxygen species absorption. To elucidate the surface oxygen species, O 1 s XPS analysis was conducted, with the spectra presented in Fig. 4(g-i). Two distinct oxygen species were identified: the predominant peak at 531.71–532.29 eV corresponds to bulk AC lattice oxygen (Oα), and the minor shoulder peak at 532.98–533.46 eV corresponds to surface chemisorbed oxygen (Oβ) [39,40]. The Oβ/(Oα+Oβ) ratio varies from 38.20 % to 58.33 %, peaking at 58.33 % for the 2.5-Pd/C, indicating a high chemisorbed oxygen content. These findings imply a rich presence of surface oxygen species on Pd/C catalysts, consistent with their efficacy in activating water and oxygen [41,42]. Literature suggests that oxygen vacancies on the AC support can produce adsorbed atomic oxygen, which, due to its high mobility, participates actively in the redox cycles of the RD reaction, significantly affecting the oxidation and reduction properties of the supported Pd species [39]. Therefore, the capability of the Pd/C catalysts to activate the chemisorbed oxygen is pivotal to their catalytic activity, complementing their oxygen generation capacity. Chemisorbed oxygen is more readily activated by metallic Pd than by cationic Pd. Metallic Pd NPs, with their strong oxygen activation capability, act as active sites for rosin catalytic oxidation. The activated oxygen then participates in the hydrogenation and dehydrogenation reactions of rosin. The SMSI effect, which imparts a negative charge to metallic Pd NPs, along with the abundance of chemisorbed oxygen, likely accounts for the high catalytic activity observed over the Pd/C catalysts [43,44]. 3.2 Catalytic performance of Pd/C catalyst in RD reaction Reaction time, temperature, catalyst dosage, and Pd loading are paramount factors affecting the RD reaction. This section meticulously examines their influence on both AA conversion and DAA selectivity. The experimental parameters were adjusted over a wide range: reaction times spanned 30–180 minutes, temperatures ranged from 230 to 270 °C, catalyst dosages varied from 0.01 to 0.04 wt%, and Pd loadings were set between 1.00 and 4.00 wt%. This broad spectrum was used to comprehensively assess their impact on the reaction. The catalytic performance of catalysts 1-Pd/C, 1.5-Pd/C, 2-Pd/C, 2.5-Pd/C, 3-Pd/C, and 4-Pd/C under these conditions was systematically assessed, with the findings depicted in Fig. 5. 3.2.1 Effect of reaction time on catalytic performance Fig. 5 depicts the time-dependent catalytic activity of Pd/C catalysts in the RD reaction. The DAA content for all six catalysts increased markedly within the first 120 min, after which it stabilized until 180 min. In contrast, the AA content diminished over time, culminating in complete conversion. At the optimal conditions of 270 °C, a 2.00 wt% Pd loading, 0.04 wt% catalyst dosage, a reaction time of 180 min, and under a nitrogen atmosphere, the DAA and AA yields reached their maxima of 71.13 % and 0 % (theoretically), respectively. These findings underscore the advantage of extended reaction time for the hydrogenation/dehydrogenation processes of rosin, ensuring complete AA conversion and maximizing DAA selectivity. 3.2.2 Effect of catalyst dosage on catalytic performance Fig. 5 vividly illustrates the effect of Pd/C catalyst dosage on the RD reaction. A pronounced enhancement in both AA conversion and DAA selectivity was observed with an increase in catalyst dosage from 0.01 wt% to 0.02 wt%. For dosages above 0.02 wt%, the reaction was minimally affected for all catalysts except the 1-Pd/C, which continued to exhibit increased DAA selectivity. Notably, the DAA selectivity for the 1-Pd/C catalyst peaked at 27.16 %, 54.15 %, 51.32 %, and 62.8 % at dosages of 0.01 wt%, 0.02 wt%, 0.03 wt%, and 0.04 wt%, respectively, under the conditions of 270 °C and a reaction time of 180 min. The accelerated reaction rate and the shortened equilibrium stabilization period to one hour with increased dosage suggest a substantial increase in hydrogen-spillover active sites, essential for the RD reaction. Collectively, these results suggest that a 0.02 wt% Pd/C catalyst dosage strikes an optimal balance between cost and catalytic efficiency. 3.2.3 Effect of Pd loading on catalytic performance To deepen our understanding of the dehydrogenation mechanism over the synthesized catalysts, the effect of Pd loading on catalytic performance was systematically investigated. As depicted in Fig. 5, under conditions of 270 °C, a 2-h reaction time, and a 0.03 wt% catalyst dosage, the DAA content rose significantly from 50.19 % to 61.51 % as Pd loading increased from 1.0 wt% to 2.5 wt%, while the AA content correspondingly fell from 3.41 % to −0.38 %. This improvement in catalytic performance is attributed to the increased density of active sites with higher Pd loadings, which facilitates better reactant contact with active centers, thereby enhancing catalytic activity. However, further increasing the Pd loading to 3.0 wt% and 4.0 wt% resulted in a notable decrease in DAA content after reaching a peak 61.51 %. Specifically, the DAA content dropped to 55.66 % and 57.55 % for the 3.0 wt% and 4.0 wt% Pd loadings, respectively. This trend underscores the correlation between higher Pd loadings and larger Pd/C particle sizes, associated with reduced dispersion, as evidenced by the data in Table 2 and visually represented in Fig. 2. Beyond a threshold, these changes induce Pd NPs instability and agglomeration, inevitably compromises catalytic efficiency. Additionally, although 3-Pd/C and 4-Pd/C possess the highest contents of metallic Pd contents, their catalytic activities are not the most superior, suggesting that catalytic performance cannot be fully explained by the Pd0 contents. Previous literature has demonstrated that oxygen vacancies, as a type of defect structure, can effectively alter the electronic structure and coordination environment, thereby enhancing catalytic performance [45]. Oxygen-rich vacancies not only facilitate hydrogen spillover but also significantly enhance hydrogen activation and dissociation, which aligns with the superior RD reaction activation ability of the 2.5-Pd/C catalysts, known for their highest Oβ content. These findings are supported by the work of Li et al. [46], who reported enhanced reactant activation due to the presence of abundant carbon defects. 3.2.4 Effect of temperature on catalytic performance Chemical reactions are intricately linked to temperature, which is a critical factor in providing the necessary activation energy. The influence of reaction temperature on the catalytic performance of Pd/C catalysts in the RD reaction is presented in Fig. 6(a). The experimental parameters were set as follows: a catalyst dosage of 0.03 wt%, a reaction time of 2 h, a Pd loading of 2.00 wt%, and a nitrogen atmosphere. The results show that DAA content increased in tandem with the elevation of temperature. Specifically, the DAA content dramatically increased from 7.92 % to 54.52 % as the temperature was raised from 230 to 270 °C. The reaction rate exhibited the most pronounced variation between 230 and 250 °C, after which the rate of increase moderated, indicating that 270 °C is the optimal temperature for the RD reaction. Previous studies indicate that the activation energy for the dehydrogenation of AA is higher than that for its hydrogenation [47,48], suggesting that dehydrogenation becomes the dominant reaction pathway at elevated temperatures. Moreover, dehydrogenation reactions are reversible, endothermic, and typically involve an increase in the number of molecules. Therefore, increasing the reaction temperature not only favors the endothermic dehydrogenation process but also enhances the selectivity of the RD reaction and the overall dehydrogenation pathway. This temperature effect is crucial for optimizing the reaction conditions to achieve high yields of the desired product, DAA. 3.2.5 Comparison of catalytic performance with commercial catalyst To underscore the outstanding catalytic performance of the prepared catalysts, a comparative analysis was conducted between the 2-Pd/C catalyst and a commercial Pd/C catalyst (4.00 wt%) for the RD reaction. Fig. 6(b) shows that our 2-Pd/C catalyst outperformed a commercial one under standard conditions (reaction temperature of 270 °C, a reaction time of 180 minutes, a catalyst dosage of 0.04 wt%, and a nitrogen atmosphere), reducing AA and boosting DAA selectivity. It increased activity by 1.27 times with half the Pd, enhancing cost-efficiency and sustainability. Additionally, our catalyst offers superior value in terms of cost-performance compared to catalysts previously reported in the literature (Table 1). Analysis of the data in Fig. 5 reveals that all Pd/C catalysts synthesized by our team, with varying Pd loadings, exhibited remarkable catalytic activity. The disproportionated rosin products meet the stringent requirements for special-grade disproportionated rosin as specified in the forestry standard LY/T 1357–2008, which mandates a minimum dehydroabietic acid content of 52 % and an abietic acid content not exceeding 0.1 %. These comparative results indicate that our catalysts not only display superior catalytic performance but also offer lower preparation costs, positioning them as highly promising candidates for practical applications in industrial RD processes. 3.3 Optimal RD process via RSM (Response surface method) Single-factor experiments indicate that the optimal conditions for maximizing DAA content are a reaction temperature of 270 °C, a duration of 120 min, a catalyst dosage of 0.03 wt%, and a Pd loading of 0.02 wt%. However, the resulting DAA yield is unsatisfactory, and these experiments fail to address the complex factor interactions that affect DAA selectivity in the RD reaction. RSM, particularly the BBD, provides a more nuanced approach to optimizing parameters efficiently. This technique uncovers the mathematical relationships between DAA content and the influencing factors, including their interactions, which is crucial for enhancing DAA selectivity [49]. Building on the single-factor results, we established operational ranges for reaction temperature (260–280 °C), time (90–150 min), catalyst dosage (20–30 mg), and Pd loading (0.02–0.04 g). Using the BBD model with Design Expert 13.0 software, we systematically refined the experimental conditions and analyzed the factor interactions to improve the catalytic efficiency for the RD reaction. 3.3.1 Determination of RSM factors In the RSM, four independent variables were identified: reaction temperature (A), time (B), catalyst addition amount (C), and Pd loading (D). These variables were each examined at three distinct levels, coded as −1 (low), 0 (middle), and 1 (high). Table 3 summarizes the actual and coded levels for these factors. The DAA content was set as the response variable. Notably, the BBD incorporated 27 experiments, including three central point replicates to estimate the pure error of the sum of squares. The dependent variable was DAA content, with independent variables being reaction temperature, time, catalyst dosage, and Pd loading. A mathematical model equation was formulated using the BBD optimization to forecast the optimal conditions for the RD reaction. This model serves as a predictive tool, allowing for process refinement to achieve the desired DAA content by considering the complex interactions among the variables. 3.3.2 The DAA yield response surface experiment and variance analysis To achieve the most accurate regression model, second-order polynomials were used to fit the experimental data. Design-Expert software version 13 facilitated the design, analysis, and optimization of the trials for the response surface experiment. The model coefficients, indicative of precision and effectiveness, were derived from fitting the polynomial equation to the data. The outcomes of the RD reaction process, utilizing the BBD and RSM experimental designs, are detailed in Table S2. The following multivariate quadratic response surface regression model is built by Design-Expert software 13 from Table S2: (1) η (%) = 55.01 + 4.34 A + 0.5925B + 5.42 C + 3.51D + 0.0250AB + 1.27AC + 0.8250AD + 0.5850BC + 0.1775BD -0.9775CD - 2.86A 2 + 1.23B 2 + 5.71C 2 - 2.67D 2 where η represents the response value (DAA content, %), A denotes reaction temperature, B represents time, C and D signifies the addition and Pd loading, respectively. The linear factors of A, B, C, and D positively influence DAA content, indicating that increased reaction temperatures, extended durations, higher catalyst dosages, and greater Pd loadings enhance DAA selectivity. Likewise, the interactions among these factors also positively affect the DAA content. Thus, optimizing conditions to maximize DAA selectivity necessitates accounting for these combined effects. Table 4 presents the experimental results and the variance analysis fitted to the quadratic regression model equation. (Note: SS—Sum of squares; DF—Degrees of freedom; MS—Mean square. R 2 = 0.9428, R adj 2 = 0.8761, R pre 2 = 0.6795, C.V.% = 4.31, Adeq Precision = 14.7876.) The analysis of variance (ANOVA) for the quadratic model detailed in Table 4 indicates that the model F-value of 14.13 and a p-value < 0.0001, confirming the statistical significance of the model. Values of “Prob > F” below 0.0500 indicate significant model terms. In this case, the fitted R 2 = 0.9428, R adj 2 = 0.8761, and low C.V.% (4.31 < 15) also suggested that the model fit the experimental data well. Adeq Precision, which assesses the signal-to-noise ratio, is favorable with a value greater than 4.0. The Adeq Precision of this model is 14.7876 suggests an excellent fit. The Lack of Fit value of 0.2028 over 0.05 verified the validity of the model. The difference between R adj 2 (0.8761) and R pre 2 (0.6795) is less than 0.2, signifying that the model fits well with the data. ANOVA reveals that the first-order terms A, C, and D have p-value of < 0.0001, but the p-value of B = 0.4087, indicating their significant impact on the response variable, except for time. Interaction terms of AB, AC, AD, BC, BD, and CD also show non-significant effects. Moreover, the quadratic terms A 2 , C 2 , D 2 are found to have significant impacts. Therefore, the relative influence of each factor on the DAA content under the RD reaction conditions is ranked as follows: C (Addition) > A (Temperature) > D (Pd loading) > B (Time). Fig. S3(a) presents a comparison between the predicted values and the experimental findings of the quadratic regression model for the RD reaction. The plot illustrates a linear representation where the predicted model values are plotted against the experimental values, with scattered dots that deviate from the line, thereby validating the quadratic regression model. The closer the data points align with the line, the more precise the model's fit to the data. Fig. S3(b) exhibits the results of the experimental residual analysis, depicting a near-linear distribution of experimental residuals without significant outliers. This confirms the robustness of the selected model, as experimental results closely align with expected values, effectively capturing the interplay between the factors and the response values [50,51]. 3.3.3 Factor interaction response surface analysis The variance analysis revealed that the catalyst addition amount exerts a more significant influence on DAA content than temperature, Pd loading, and time. Fig. 7 presents contour plots and 3D response surfaces for factor interactions AB, AC, AD, BC, BD, and CD, elucidating how independent variables impact DAA yield [52]. Horizontal contours in these plots signify a strong main effect, while elliptical or saddle-shaped contours indicate significant interactions [53]. Steep slopes within the response surface plot suggest a more substantial influence on DAA content [54]. The color-coding on the surface plot denotes different DAA content ranges: red for above 60 %, yellow for 50–60 %, and green for below 50 %. Fig. 7(b) clearly shows that the interaction between A (temperature) and C (catalyst addition amount) significantly influences DAA content. With time (B) and Pd loading (D) fixed at 120 min and 0.02 g, respectively, increasing A from 250 °C to 290 °C and C from 20 to 40 mg leads to a consistent increase in DAA content. Analysis of the contour lines and 3D response surface maps indicates that catalyst addition amount (C) has a greater influence than temperature (A), followed by Pd loading (D) and time (B). Moreover, the A-C interaction significantly affects DAA content more than other interactions. This comprehensive analysis provides valuable insights into the relative importance of each factor and their interactions, guiding the optimization of the reaction conditions for higher DAA production. 3.3.4 Verification of the optimization model The quadratic regression response model identified optimal parameters for adsorption: 280 °C temperature, 150-minute duration, 40 mg (0.04 wt%) catalyst dosage, and 0.03 g (3.00 wt%) Pd loading. These parameters were refined for practical application to ascertain the most favorable conditions for the RD reaction. To validate the model predictions, three parallel experiments were conducted under these optimal conditions, yielding an average DAA content of 71.36 % (Table S3). The relative deviation of 1.5 % is well within the standard deviation of 2.4 %, confirming the reliability of the optimal process conditions predicted and optimized using the quadratic regression response model. 3.4 Matching relationship between structure and performance of Pd/C catalysts To verify the impact of catalyst structure on catalytic performance in the RD reaction, Pearson correlation analysis was performed. Fig. 8 displays the correlations between DAA yield and catalyst parameters, including Pd NPs size, crystallite size, Pd loading, dispersion, and Pd0 ratio. A positive association was found with Pd NPs size, crystallite size, Pd loading, and Pd0 ratio, whereas a negative correlation existed with dispersion. The Pearson correlation coefficients ranged from 0.812 for crystallite size to 0.990 for Pd loading, highlighting the influence of Pd loading, dispersion, Pd0 ratio, and particle size on catalytic activity. Increased Pd loading promotes nanoparticle growth and agglomeration (Fig. 3), detrimental to dispersion but compensates with additional active sites. Higher Pd NPs size and optimized Pd0 ratio significantly enhanced catalytic efficiency. Under conditions: 0.04 wt% dosage, 280 °C, 150 min, nitrogen as the protective gas, the 3-Pd/C catalyst maximizes DAA yield in disproportionated rosin (71.36 %), validating our analytical approach. 3.5 Reaction kinetics of rosin disproportionation RD reaction is a multifaceted process encompassing both concurrent and sequential reactions. In our investigation, the primary objective was to achieve the conversion of AA into DAA, which served as the basis for our kinetic analysis. We formulated macroscopic kinetic models and determined the corresponding kinetic parameters. To minimize the influence of diffusion, the catalyst particles were ground to a size range of 10–20 μm, and the stirring speed was elevated to 1000 r/min, thus making chemical kinetics the dominant factor in the reaction. Experiments were conducted under precise conditions, with temperatures set at 503.15, 513.15, 523.15, and 533.15 K, and the reaction time was prolonged up to 210 minutes. Using a standardized 0.03 wt% 2-Pd/C catalyst, samples were collected at regular intervals within a temperature range of 230–260 °C. The variations in DAA concentration were measured employing UV-Vis spectroscopy and GC-MS, providing us with intrinsic kinetic insights. The apparent activation energy was subsequently derived from Eqs. (2) and (3) [55]. (2) C t − C 0 = − k 0 t (3) lnk = − E a RT + ln A Where C t is the content of DAA, C 0 is the content of DAA in raw rosin, t is reaction time (min), k 0 is zero-order k 0 is the reaction rate constant (min−1); k is the temperature-independent factor, E a is the activation energy (kJ mol−1), R is the universal gas constant (8.314 J mol K−1), T is the solution temperature (K) and A is the pre-exponential factor [56]. The kinetic parameters and profiles for the Pd/C catalyst at various temperatures, as presented in Fig. 9(a) and Table S4, distinctly illustrate the zero-order kinetics characteristic of the dehydrogenation of AA [57,58]. The apparent activation energy, determined using the Arrhenius equation (refer to Fig. 9(b)), is calculated to be 21.52 kJ/mol. This value is comparatively lower than those documented in earlier studies for Pd/C catalysts in similar reactions [59], suggesting that our catalyst potentially enhances the catalytic efficacy of the rosin disproportionation reaction by lowering the activation energy threshold. 3.6 Reaction pathways of rosin disproportionation reaction GC-MS analysis revealed the compositional changes in rosin before and after catalytic disproportionation, as shown in Fig. 10(a-b) and detailed in Tables S5-S6. The raw rosin contained AA at 34.25 %, palustric acid at 20.35 %, and 1-phenanthrenecarboxylic acid at 35.75 %, alongside trace amounts of DAA at 3.38 %, longifolene at 1.11 %, and retinoic acid at 1.11 %. After catalytic disproportionation, the product profile shifted significantly, with DAA constituting 52 %, 1-phenanthrenecarboxylic acid at 35.92 %, and a significantly reduced AA content to 1.91 %. The dehydrogenation of AA and the isomerization of palustric acid took place, yielding DAA as the principal product of the disproportionation reaction, with AA nearly eliminated under more reactive conditions [60]. Notably, the absence of dihydroabietic and tetrahydroabietic acids in the disproportionated rosin suggests a marked preference for dehydrogenation over hydrogenation under the applied catalytic conditions, with a negligible hydroabietic acid yield. This observation highlights the 100 % selective conversion of AA to DAA in the RD process. Previous studies indicates that raw rosin constituents, including neoabietic acid, palustric acid, levopimaric acid, and abietic acid, readily isomerize to abietic acid upon heating through hydrogen atom transfer [61,62]. The highly reactive conjugated double bond in AA molecule can readily absorb one mole of hydrogen to form dihydroabietic acid. Subsequently, further hydrogenation of the remaining double bond is significantly hindered, and only a minor proportion of dihydroabietic acid can react with hydrogen to form tetrahydroabietic acid. The Pd/C catalyst enhances AA dehydrogenation selectivity [63]. The reaction pathway for AA to DAA, as depicted in Fig. 10(c). Initially, dihydroabietic acid forms as an intermediate after the cleavage of one CC bond within the conjugated diene and subsequent hydrogenation in one C6 ring. Then, through two distinct pathways, the four hydrogen atoms in the adjacent C6 ring are removed, culminating in the formation of the final DAA product. This comprehensive analysis provides a clear understanding of the reaction mechanisms involved in the catalytic disproportionation of rosin, underscoring the efficiency of the Pd/C catalyst in directing the reaction towards the desired product profile. 4 Conclusion In this work, a series of Pd/C catalysts with low Pd loading and different Pd NPs size were successfully fabricated via deposition-precipitation strategies for the RD reaction. Multiple characterization results showed that Pd species, most Pd0 and minor PdOx, highly dispersed on AC, with an average size of Pd NPs in the range of 3–6 nm. More structural defects and oxygen vacancies on the Pd/C catalyst surface increased the electron density around Pd species and enhanced the activation of chemisorbed oxygen, which is beneficial to the RD reaction. The effect of reaction time, temperature, Pd loading, and catalyst dosage on catalytic performance was extensively investigated. Maximum conversion of AA reached 100 % and 71.13 % yield to DAA under the conditions with a Pd loading of 2.00 wt%, reaction time of 180 min, temperature of 270 °C, and catalyst dosage of 0.04 %. Compared to commercial catalyst, activity increased by 1.27 times with a 50 % reduction in Pd, conserving precious metals. Maximum DAA content (71.36 %) occurred at the following operating factor optimum values based on RSM-BBD: temperature of 280 °C, a time of 150 min, a catalyst dosage of 40 mg (0.04 wt%), and a Pd loading of 0.03 g (3.00 wt%). Pd loading, dispersion, particle size, and metallic Pd contents were identified as primary determinants of Pd/C catalytic activity. Kinetic studies confirmed an activation energy of 21.52 kJ/mol for the AA to DAA conversion, validating Pd/C catalyst was a very promising catalyst for the RD reaction. Ultimately, both qualitative and quantitative analyses of rosin and disproportionated rosin were conducted using UV–vis and GC-MS, thereby clarifying the reaction pathway and catalytic mechanism of the RD reaction catalyzed by Pd/C. CRediT authorship contribution statement Jinhao Zheng: Formal analysis. Ziyu Song: Methodology. Yifan Niu: Writing – original draft, Formal analysis, Data curation, Conceptualization. Siyu Gong: Investigation. Xian Zhou: Formal analysis. Shaohua Ju: Writing – review & editing, Funding acquisition, Conceptualization. Yongwan Gu: Writing – review & editing, Resources. Declaration of Competing Interest The authors declare no competing ﬁnancial interest. The manuscript was written through the contributions of all authors, and all authors have given approval to the ﬁnal version of the manuscript. Acknowledgments This work was supported by the National Key Research and Development Program of China (2019YFC1908402), National Natural Science Foundation of China (51964032). The authors would like to thank Shiyanjia lab (www.shiyanjia.com) for the TEM tests. Appendix A Supporting information Supplementary data associated with this article can be found in the online version at doi:10.1016/j.apcata.2024.120077. Appendix A Supplementary material Supplementary material References [1] A.-T. Karlberg M.-H. Albadr U. Nilsson Tracing colophonium in consumer products Contact Dermat. 85 2021 671 678 A.-T. Karlberg, M.-H. Albadr, U. Nilsson, Tracing colophonium in consumer products, Contact Dermatitis, 85 (2021) 671-678. [2] M. Mandal P. Borgohain P. Begum R.C. Deka T.K. Maji Property enhancement and DFT study of wood polymer composites using rosin derivatives as co-monomers N. J. Chem. 42 2018 2260 2269 M. Mandal, P. Borgohain, P. Begum, R.C. Deka, T.K. Maji, Property enhancement and DFT study of wood polymer composites using rosin derivatives as co-monomers, New Journal of Chemistry, 42 (2018) 2260-2269. [3] G. Wang Z. Zhou K. Zhang L. Wu X. Shi X. Zhang Study on corrosion resistance of passive film promoted by natural rosin-based passive sealant J. Mater. Res. Technol. 28 2024 1679 1693 G. Wang, Z. Zhou, K. Zhang, L. Wu, X. Shi, X. Zhang, Study on corrosion resistance of passive film promoted by natural rosin-based passive sealant, Journal of Materials Research and Technology, 28 (2024) 1679-1693. [4] Y. Huang X. Chen Y. Deng D. Zhou L. Wang A novel nickel catalyst derived from layered double hydroxides (LDHs) supported on fluid catalytic cracking catalyst residue (FC3R) for rosin hydrogenation Chem. Eng. J. 269 2015 434 443 Y. Huang, X. Chen, Y. Deng, D. Zhou, L. Wang, A novel nickel catalyst derived from layered double hydroxides (LDHs) supported on fluid catalytic cracking catalyst residue (FC3R) for rosin hydrogenation, Chemical Engineering Journal, 269 (2015) 434-443. [5] L. Wang S. Ding P. Gan X. Chen D. Zhang X. Wei X. Wang A supported nano ZnO catalyst based on a spent fluid cracking catalyst (FC3R) for the heterogeneous esterification of rosin React. Kinet., Mech. Catal. 119 2016 219 233 L. Wang, S. Ding, P. Gan, X. Chen, D. Zhang, X. Wei, X. Wang, A supported nano ZnO catalyst based on a spent fluid cracking catalyst (FC3R) for the heterogeneous esterification of rosin, Reaction Kinetics, Mechanisms and Catalysis, 119 (2016) 219-233. [6] A.J.D. Silvestre A. Gandini Chapter 4 - Rosin: major sources, properties and applications M.N. Belgacem A. Gandini Monomers, Polymers and Composites from Renewable Resources 2008 Elsevier Amsterdam 67 88 A.J.D. Silvestre, A. Gandini, Chapter 4 - Rosin: Major Sources, Properties and Applications, in: M.N. Belgacem, A. Gandini (Eds.) Monomers, Polymers and Composites from Renewable Resources, Elsevier, Amsterdam, 2008, pp. 67-88. [7] Z. ShenProduction and standards for chemical non-wood forest products in China OCCASIONAL PAPER1995. Z. Shen, Production and Standards for Chemical Non-Wood Forest Products in China, OCCASIONAL PAPER, (1995). [8] I. Portugal, C. Domingues, A. ValenteRosin disproportionation: catalytic testing and modelling, 2005.. I. Portugal, C. Domingues, A. Valente, Rosin disproportionation: catalytic testing and modelling, (2005). [9] Z. SongChemical modification and utilization of rosin and turpentine in China, chemistry and industry of forest products, 1982. pp. 22-25.. Z. Song, Chemical modification and utilization of rosin and turpentine in China, chemistry and industry of forest products, (1982) 22-25. [10] H. Liu P. Wu K. Wang Q. Li C. Yu X. Li Y. Cai W. Feng L. Yuan Palladium recovery from acidic solution with phenanthroline-based covalent organic polymers as adsorbents for efficient heterogeneous catalysis Green Chem. 26 2024 804 814 H. Liu, P. Wu, K. Wang, Q. Li, C. Yu, X. Li, Y. Cai, W. Feng, L. Yuan, Palladium recovery from acidic solution with phenanthroline-based covalent organic polymers as adsorbents for efficient heterogeneous catalysis, Green Chemistry, 26 (2024) 804-814. [11] R. Mostafalu A. Heydari A. Banaei F. Ghorbani M. Arefi The use of palladium nanoparticles supported on active carbon for synthesis of disproportionate rosin (DPR) J. Nanostruct. Chem. 7 2017 61 66 R. Mostafalu, A. Heydari, A. Banaei, F. Ghorbani, M. Arefi, The use of palladium nanoparticles supported on active carbon for synthesis of disproportionate rosin (DPR), Journal of Nanostructure in Chemistry, 7 (2017) 61-66. [12] Y. Zeng Z. Wang L. Zeng Y. Li Rosin disproportionation of activated carbon modified by different complexing agents Rare Met. Mater. Eng. 47 2018 692 696 Y. Zeng, Z. Wang, L. Zeng, Y. Li, Rosin disproportionation of activated carbon modified by different complexing agents, Rare Metal Materials and Engineering, 47 (2018) 692-696. [13] Y. Gu Y. Li J. Zhang H. Zhang C. Wu J. Lin J. Zhou Y. Fan V. Murugadoss Z. Guo Effects of pretreated carbon supports in Pd/C catalysts on rosin disproportionation catalytic performance Chem. Eng. Sci. 216 2020 115588 Y. Gu, Y. Li, J. Zhang, H. Zhang, C. Wu, J. Lin, J. Zhou, Y. Fan, V. Murugadoss, Z. Guo, Effects of pretreated carbon supports in Pd/C catalysts on rosin disproportionation catalytic performance, Chemical Engineering Science, 216 (2020) 115588. [14] J.C. Souto P. Yustos F. Garcia-Ochoa M. Ladero Disproportionation of rosin driven by 4,4′-thio-bis(3-methyl-6-tert-butylphenol): kinetic model discrimination : Catal. 2024 J.C. Souto, P. Yustos, F. Garcia-Ochoa, M. Ladero, Disproportionation of Rosin Driven by 4,4′-Thio-bis(3-Methyl-6-Tert-Butylphenol): Kinetic Model Discrimination, in: Catalysts, 2024. [15] H.-j Jeon Y.-M. Chung Hydrogen production from formic acid dehydrogenation over Pd/C catalysts: Effect of metal and support properties on the catalytic performance Appl. Catal. B: Environ. 210 2017 212 222 H.-j Jeon, Y.-M. Chung, Hydrogen production from formic acid dehydrogenation over Pd/C catalysts: Effect of metal and support properties on the catalytic performance, Applied Catalysis B: Environmental, 210 (2017) 212-222. [16] Y. Gu H. Zhang F. Liu Y. Li Preparation of Pd/C catalyst by modifying carbon with γ -Al2O3 Mater. Res. Innov. 19 2015 S5-1295 Y. Gu, H. Zhang, F. Liu, Y. Li, Preparation of Pd/C catalyst by modifying carbon with γ -Al2O3, Materials Research Innovations, 19 (2015) S5-1295. [17] R. Mostafalu A. Heydari M. Arefi M. Kazemi A. Banaei F. Ghorbani A facial, scalable, and green synthesis of superparamagnetic palladium–carbon catalyst and its use in disproportionation of gum rosin J. Nanostruct. Chem. 7 2017 201 206 R. Mostafalu, A. Heydari, M. Arefi, M. Kazemi, A. Banaei, F. Ghorbani, A facial, scalable, and green synthesis of superparamagnetic palladium–carbon catalyst and its use in disproportionation of gum rosin, Journal of Nanostructure in Chemistry, 7 (2017) 201-206. [18] L. Wang W. Sun X. Chen X. Hu Z. Tong Study on catalytic disproportionation of pine Gum over Pd/C J. Chem. Eng. Chin. Univ. 21 2007 784 789 L. Wang, W. Sun, X. Chen, X. Hu, Z. Tong, Study on catalytic disproportionation of pine Gum over Pd/C, Journal of Chemical Engineering of Chinese Universities, 21 (2007) 784-789. [19] A. Hafeez S.A. Ammar Taqvi T. Fazal F. Javed Z. Khan U.S. Amjad A. Bokhari N. Shehzad N. Rashid S. Rehman F. Rehman Optimization on cleaner intensification of ozone production using artificial neural network and response surface methodology: parametric and comparative study J. Clean. Prod. 252 2020 119833 A. Hafeez, S.A. Ammar Taqvi, T. Fazal, F. Javed, Z. Khan, U.S. Amjad, A. Bokhari, N. Shehzad, N. Rashid, S. Rehman, F. Rehman, Optimization on cleaner intensification of ozone production using Artificial Neural Network and Response Surface Methodology: Parametric and comparative study, Journal of Cleaner Production, 252 (2020) 119833. [20] H. Chaker N. Ameur K. Saidi-Bendahou M. Djennas S. Fourmentin Modeling and Box-Behnken design optimization of photocatalytic parameters for efficient removal of dye by lanthanum-doped mesoporous TiO2 J. Environ. Chem. Eng. 9 2021 104584 H. Chaker, N. Ameur, K. Saidi-Bendahou, M. Djennas, S. Fourmentin, Modeling and Box-Behnken design optimization of photocatalytic parameters for efficient removal of dye by lanthanum-doped mesoporous TiO2, Journal of Environmental Chemical Engineering, 9 (2021) 104584. [21] M.C. Vebber J. da Silva Crespo M. Giovanela Self-assembled thin films of PAA/PAH/TiO2 for the photooxidation of ibuprofen. Part I: optimization of photoactivity using design of experiments and surface response methodology Chem. Eng. J. 360 2019 1447 1458 M.C. Vebber, J. da Silva Crespo, M. Giovanela, Self-assembled thin films of PAA/PAH/TiO2 for the photooxidation of ibuprofen. Part I: Optimization of photoactivity using design of experiments and surface response methodology, Chemical Engineering Journal, 360 (2019) 1447-1458. [22] S.L.C. Ferreira R.E. Bruns H.S. Ferreira G.D. Matos J.M. David G.C. Brandão E.G.P. da Silva L.A. Portugal P.S. dos Reis A.S. Souza W.N.L. dos Santos Box-Behnken design: an alternative for the optimization of analytical methods Anal. Chim. Acta 597 2007 179 186 S.L.C. Ferreira, R.E. Bruns, H.S. Ferreira, G.D. Matos, J.M. David, G.C. Brandão, E.G.P. da Silva, L.A. Portugal, P.S. dos Reis, A.S. Souza, W.N.L. dos Santos, Box-Behnken design: An alternative for the optimization of analytical methods, Analytica Chimica Acta, 597 (2007) 179-186. [23] M. Athar S. Imdad S. Zaidi M. Yusuf H. Kamyab J. Jaromír Klemeš S. Chelliapan Biodiesel production by single-step acid-catalysed transesterification of Jatropha oil under microwave heating with modelling and optimisation using response surface methodology Fuel 322 2022 124205 M. Athar, S. Imdad, S. Zaidi, M. Yusuf, H. Kamyab, J. Jaromír Klemeš, S. Chelliapan, Biodiesel production by single-step acid-catalysed transesterification of Jatropha oil under microwave heating with modelling and optimisation using response surface methodology, Fuel, 322 (2022) 124205. [24] Y. Liu L. Li S. Liu C. Xie S. Yu The selective hydrogenation of rosin to hydroabietic content using Pd/SBA-15 as catalysts Res. Chem. Intermed. 43 2017 1211 1221 Y. Liu, L. Li, S. Liu, C. Xie, S. Yu, The selective hydrogenation of rosin to hydroabietic content using Pd/SBA-15 as catalysts, Research on Chemical Intermediates, 43 (2017) 1211-1221. [25] Z.-Y. Wu P. Zhu D.A. Cullen Y. Hu Q.-Q. Yan S.-C. Shen F.-Y. Chen H. Yu M. Shakouri J.D. Arregui-Mena A. Ziabari A.R. Paterson H.-W. Liang H. Wang A general synthesis of single atom catalysts with controllable atomic and mesoporous structures Nat. Synth. 1 2022 658 667 Z.-Y. Wu, P. Zhu, D.A. Cullen, Y. Hu, Q.-Q. Yan, S.-C. Shen, F.-Y. Chen, H. Yu, M. Shakouri, J.D. Arregui-Mena, A. Ziabari, A.R. Paterson, H.-W. Liang, H. Wang, A general synthesis of single atom catalysts with controllable atomic and mesoporous structures, Nature Synthesis, 1 (2022) 658-667. [26] R. Pattabiraman Electrochemical investigations on carbon supported palladium catalysts Appl. Catal. A: Gen. 153 1997 9 20 R. Pattabiraman, Electrochemical investigations on carbon supported palladium catalysts, Applied Catalysis A: General, 153 (1997) 9-20. [27] M. Yao Y. Ye H. Chen X. Zhang Porous carbon supported Pd as catalysts for boosting formic acid dehydrogenation Int. J. Hydrog. Energy 45 2020 17398 17409 M. Yao, Y. Ye, H. Chen, X. Zhang, Porous carbon supported Pd as catalysts for boosting formic acid dehydrogenation, International Journal of Hydrogen Energy, 45 (2020) 17398-17409. [28] J. Xie H. Qu J. Xin X. Zhang G. Cui X. Zhang J. Bao B. Tang Y. Xie Defect-rich MoS2 nanowall catalyst for efficient hydrogen evolution reaction Nano Res. 10 2017 1178 1188 J. Xie, H. Qu, J. Xin, X. Zhang, G. Cui, X. Zhang, J. Bao, B. Tang, Y. Xie, Defect-rich MoS2 nanowall catalyst for efficient hydrogen evolution reaction, Nano Research, 10 (2017) 1178-1188. [29] O. Oginni K. Singh G. Oporto B. Dawson-Andoh L. McDonald E. Sabolsky Influence of one-step and two-step KOH activation on activated carbon characteristics Bioresour. Technol. Rep. 7 2019 100266 O. Oginni, K. Singh, G. Oporto, B. Dawson-Andoh, L. McDonald, E. Sabolsky, Influence of one-step and two-step KOH activation on activated carbon characteristics, Bioresource Technology Reports, 7 (2019) 100266. [30] L. Di J. Zhang C. Ma X. Tu X. Zhang Atmospheric-pressure dielectric barrier discharge cold plasma for synthesizing high performance Pd/C formic acid dehydrogenation catalyst Catal. Today 337 2019 201 207 L. Di, J. Zhang, C. Ma, X. Tu, X. Zhang, Atmospheric-pressure dielectric barrier discharge cold plasma for synthesizing high performance Pd/C formic acid dehydrogenation catalyst, Catalysis Today, 337 (2019) 201-207. [31] X. Gao F. Qiu H. Xie X. Chen C. Wu Y. Chen J. Liang L. Wang Efficient catalytic hydrogenation of acrylic rosin over high-activity Pd/C catalyst under mild conditions React. Kinet., Mech. Catal. 2024 X. Gao, F. Qiu, H. Xie, X. Chen, C. Wu, Y. Chen, J. Liang, L. Wang, Efficient catalytic hydrogenation of acrylic rosin over high-activity Pd/C catalyst under mild conditions, Reaction Kinetics, Mechanisms and Catalysis, (2024). [32] J.L. Santos P. Mäki-Arvela A. Monzón D.Y. Murzin M.Á. Centeno Metal catalysts supported on biochars: Part I synthesis and characterization Appl. Catal. B: Environ. 268 2020 118423 J.L. Santos, P. Mäki-Arvela, A. Monzón, D.Y. Murzin, M.Á. Centeno, Metal catalysts supported on biochars: Part I synthesis and characterization, Applied Catalysis B: Environmental, 268 (2020) 118423. [33] C. Wang Y. Li C. Zhang X. Chen C. Liu W. Weng W. Shan H. He A simple strategy to improve Pd dispersion and enhance Pd/TiO2 catalytic activity for formaldehyde oxidation: the roles of surface defects Appl. Catal. B: Environ. 282 2021 119540 C. Wang, Y. Li, C. Zhang, X. Chen, C. Liu, W. Weng, W. Shan, H. He, A simple strategy to improve Pd dispersion and enhance Pd/TiO2 catalytic activity for formaldehyde oxidation: The roles of surface defects, Applied Catalysis B: Environmental, 282 (2021) 119540. [34] Y. Lu H. Deng T. Pan L. Wang C. Zhang H. He Interaction between noble metals (Pt, Pd, Rh, Ir, Ag) and defect-enriched TiO2 and its application in toluene and propene catalytic oxidation Appl. Surf. Sci. 606 2022 154834 Y. Lu, H. Deng, T. Pan, L. Wang, C. Zhang, H. He, Interaction between noble metals (Pt, Pd, Rh, Ir, Ag) and defect-enriched TiO2 and its application in toluene and propene catalytic oxidation, Applied Surface Science, 606 (2022) 154834. [35] Q. Li G. Qin L. Wu Y. Zhao X. Wang High catalytic performance of a Pd-loaded TaN-TaC electrocatalyst for ethylene glycol oxidation in an alkaline medium Appl. Surf. Sci. 537 2021 147849 Q. Li, G. Qin, L. Wu, Y. Zhao, X. Wang, High catalytic performance of a Pd-loaded TaN-TaC electrocatalyst for ethylene glycol oxidation in an alkaline medium, Applied Surface Science, 537 (2021) 147849. [36] Y. Li C. Zhang H. He J. Zhang M. Chen Influence of alkali metals on Pd/TiO2 catalysts for catalytic oxidation of formaldehyde at room temperature Catal. Sci. Technol. 6 2016 2289 2295 Y. Li, C. Zhang, H. He, J. Zhang, M. Chen, Influence of alkali metals on Pd/TiO2 catalysts for catalytic oxidation of formaldehyde at room temperature, Catalysis Science & Technology, 6 (2016) 2289-2295. [37] Y. Li C. Zhang J. Ma M. Chen H. Deng H. He High temperature reduction dramatically promotes Pd/TiO2 catalyst for ambient formaldehyde oxidation Appl. Catal. B: Environ. 217 2017 560 569 Y. Li, C. Zhang, J. Ma, M. Chen, H. Deng, H. He, High temperature reduction dramatically promotes Pd/TiO2 catalyst for ambient formaldehyde oxidation, Applied Catalysis B: Environmental, 217 (2017) 560-569. [38] H. Huang D.Y.C. Leung Complete oxidation of formaldehyde at room temperature using TiO2 supported metallic Pd nanoparticles ACS Catal. 1 2011 348 354 H. Huang, D.Y.C. Leung, Complete Oxidation of Formaldehyde at Room Temperature Using TiO2 Supported Metallic Pd Nanoparticles, ACS Catalysis, 1 (2011) 348-354. [39] H. Tan J. Wang S. Yu K. Zhou Support morphology-dependent catalytic activity of Pd/CeO2 for formaldehyde oxidation Environ. Sci. Technol. 49 2015 8675 8682 H. Tan, J. Wang, S. Yu, K. Zhou, Support Morphology-Dependent Catalytic Activity of Pd/CeO2 for Formaldehyde Oxidation, Environmental Science & Technology, 49 (2015) 8675-8682. [40] C. Zhang Y. Li Y. Wang H. He Sodium-promoted Pd/TiO2 for catalytic oxidation of formaldehyde at ambient temperature Environ. Sci. Technol. 48 2014 5816 5822 C. Zhang, Y. Li, Y. Wang, H. He, Sodium-Promoted Pd/TiO2 for Catalytic Oxidation of Formaldehyde at Ambient Temperature, Environmental Science & Technology, 48 (2014) 5816-5822. [41] H. Liu C. Yuan S. Wu C. Sun Z. Huang H. Xu W. Shen Constructing an oxygen vacancy- and hydroxyl-rich TiO2-supported Pd catalyst with improved Pd dispersion and catalytic stability J. Chem. Phys. 159 2023 124701 H. Liu, C. Yuan, S. Wu, C. Sun, Z. Huang, H. Xu, W. Shen, Constructing an oxygen vacancy- and hydroxyl-rich TiO2-supported Pd catalyst with improved Pd dispersion and catalytic stability, The Journal of Chemical Physics, 159 (2023) 124701. [42] S. Wu H. Liu Z. Huang H. Xu W. Shen O-vacancy-rich porous MnO2 nanosheets as highly efficient catalysts for propane catalytic oxidation Appl. Catal. B: Environ. 312 2022 121387 S. Wu, H. Liu, Z. Huang, H. Xu, W. Shen, O-vacancy-rich porous MnO2 nanosheets as highly efficient catalysts for propane catalytic oxidation, Applied Catalysis B: Environmental, 312 (2022) 121387. [43] S. Polarz J. Strunk V. Ischenko M.W.E. van den Berg O. Hinrichsen M. Muhler M. Driess On the role of oxygen defects in the catalytic performance of zinc oxide Angew. Chem. Int. Ed. 45 2006 2965 2969 S. Polarz, J. Strunk, V. Ischenko, M.W.E. van den Berg, O. Hinrichsen, M. Muhler, M. Driess, On the Role of Oxygen Defects in the Catalytic Performance of Zinc Oxide, Angewandte Chemie International Edition, 45 (2006) 2965-2969. [44] T. Li H. Li C. Li Hydrodeoxygenation of vanillin to creosol under mild conditions over carbon nanospheres supported palladium catalysts: influence of the carbon defects on surface of catalysts Fuel 310 2022 122432 T. Li, H. Li, C. Li, Hydrodeoxygenation of vanillin to creosol under mild conditions over carbon nanospheres supported palladium catalysts: Influence of the carbon defects on surface of catalysts, Fuel, 310 (2022) 122432. [45] P. Tian L. Ouyang X. Xu C. Ao X. Xu R. Si X. Shen M. Lin J. Xu Y.-F. Han The origin of palladium particle size effects in the direct synthesis of H2O2: is smaller better? J. Catal. 349 2017 30 40 P. Tian, L. Ouyang, X. Xu, C. Ao, X. Xu, R. Si, X. Shen, M. Lin, J. Xu, Y.-F. Han, The origin of palladium particle size effects in the direct synthesis of H2O2: Is smaller better?, Journal of Catalysis, 349 (2017) 30-40. [46] F. Ge H. Li B. Wu X. Yang J. Jiang Y. Zhang M. Zhou MOFs-derived carbon-covered nickel phosphide for catalytic transfer hydrodeoxygenation of lignin-derived vanillin Chem. Eng. J. 489 2024 151367 F. Ge, H. Li, B. Wu, X. Yang, J. Jiang, Y. Zhang, M. Zhou, MOFs-derived carbon-covered nickel phosphide for catalytic transfer hydrodeoxygenation of lignin-derived vanillin, Chemical Engineering Journal, 489 (2024) 151367. [47] L. Wang X. Chen W. Sun J. Liang X. Xu Z. Tong Kinetic model for the catalytic disproportionation of pine oleoresin over Pd/C catalyst Ind. Crops Prod. 49 2013 1 9 L. Wang, X. Chen, W. Sun, J. Liang, X. Xu, Z. Tong, Kinetic model for the catalytic disproportionation of pine oleoresin over Pd/C catalyst, Industrial Crops and Products, 49 (2013) 1-9. [48] J.C. Souto P. Yustos M. Ladero F. Garcia-Ochoa Disproportionation of rosin on an industrial Pd/C catalyst: reaction pathway and kinetic model discrimination Bioresour. Technol. 102 2011 3504 3511 J.C. Souto, P. Yustos, M. Ladero, F. Garcia-Ochoa, Disproportionation of rosin on an industrial Pd/C catalyst: Reaction pathway and kinetic model discrimination, Bioresource Technology, 102 (2011) 3504-3511. [49] G. Siyu D. Xizhi Z. Ting N. Yifan H. Keren C. Wang A. Yunfei L. Bingguo Preparation and characterization of micro-spherical ruthenium particles using spray drying combined with microwave calcination of ammonium hexachlororuthenate (IV) Int. J. Refract. Met. Hard Mater. 115 2023 106276 G. Siyu, D. Xizhi, Z. Ting, N. Yifan, H. Keren, C. Wang, A. Yunfei, L. Bingguo, Preparation and characterization of micro-spherical ruthenium particles using spray drying combined with microwave calcination of ammonium hexachlororuthenate (IV), International Journal of Refractory Metals and Hard Materials, 115 (2023) 106276. [50] X. Hua W. Wang W. Ran G. He J. Liu R. Liu Promoting effect of nitride as support for Pd hydrodechlorination catalyst Langmuir: ACS J. Surf. Colloids 39 2023 4692 4700 X. Hua, W. Wang, W. Ran, G. He, J. Liu, R. Liu, Promoting Effect of Nitride as Support for Pd Hydrodechlorination Catalyst, Langmuir: the ACS journal of surfaces and colloids, 39 (2023) 4692-4700. [51] K. Rasouli A. Alamdari S. Sabbaghi Ultrasonic-assisted synthesis of α-Fe2O3@TiO2 photocatalyst: Optimization of effective factors in the fabrication of photocatalyst and removal of non-biodegradable cefixime via response surface methodology-central composite design Sep. Purif. Technol. 307 2023 122799 K. Rasouli, A. Alamdari, S. Sabbaghi, Ultrasonic-assisted synthesis of α-Fe2O3@TiO2 photocatalyst: Optimization of effective factors in the fabrication of photocatalyst and removal of non-biodegradable cefixime via response surface methodology-central composite design, Separation and Purification Technology, 307 (2023) 122799. [52] F. Ansari S. Sheibani M. Fernández-García A response surface methodology optimization for efficient photocatalytic degradation over reusable CuxO/TiO2 nanocomposite on copper wire Mater. Res. Bull. 166 2023 112342 F. Ansari, S. Sheibani, M. Fernández-García, A response surface methodology optimization for efficient photocatalytic degradation over reusable CuxO/TiO2 nanocomposite on copper wire, Materials Research Bulletin, 166 (2023) 112342. [53] J. Sun Z. Tu H. Wang Y. Hu Process optimization and quality analysis of mango cake prepared with fish protein gelatin Sci. Technol. Food Ind. 43 2022 189 195 J. Sun, Z. Tu, H. Wang, Y. Hu, Process optimization and quality analysis of mango cake prepared with fish protein gelatin, Science and technology of food industry, 43 (2022) 189-195. [54] L.I. Yunqian Y. Xi L.I.U. Jiang W.U. Juan W. Zhenxing Z. Xuechun Ultrasonic-assisted alkaline extraction of Plukenetia volubilis protein isolate and its processing properties Food Ferment. Ind. 47 2021 128 135 L.I. Yunqian, Y. Xi, L.I.U. Jiang, W.U. Juan, W. Zhenxing, Z. Xuechun, Ultrasonic-assisted alkaline extraction of Plukenetia volubilis protein isolate and its processing properties, Food and Fermentation Industries, 47 (2021) 128-135. [55] J. Yao Z. Xu S. Cheng Y. Yue H. Zhu Pt/Al2O3 as efficient catalyst for the dehydrogenation of Dodecahydro-N-ethylcarbazole Chem. Eng. J. 491 2024 152100 J. Yao, Z. Xu, S. Cheng, Y. Yue, H. Zhu, Pt/Al2O3 as efficient catalyst for the dehydrogenation of Dodecahydro-N-ethylcarbazole, Chemical Engineering Journal, 491 (2024) 152100. [56] C. Duan H. Wang J. Wu T. Qu Y. Zhang D. Fu L. Hu F. Wang D. Lai Y. Dai Y. Wu Co@Pd bimetallic catalysts doped on the CNTs for bidirectional improving hydriding/dehydriding property of Mg/MgH2 J. Energy Storage 91 2024 112015 C. Duan, H. Wang, J. Wu, T. Qu, Y. Zhang, D. Fu, L. Hu, F. Wang, D. Lai, Y. Dai, Y. Wu, Co@Pd bimetallic catalysts doped on the CNTs for bidirectional improving hydriding/dehydriding property of Mg/MgH2, Journal of Energy Storage, 91 (2024) 112015. [57] L. Jiang Y. Wang S. Shan Q. Jia Study on disproportionation kinetics of rosin catalyzed by new non-noble metal catalysts J. Yunnan Univ. 29 2007 183 186 L. Jiang, Y. Wang, S. Shan, Q. Jia, Study on disproportionation kinetics of rosin catalyzed by new non-noble metal catalysts, Journal of Yunnan University, 29 (2007) 183-186. [58] Y. Wang L. Wang L. Jiang Z. Wang Research on reaction kinetics of disproportionation of gum rosin catalyzed by AH non-noble metal catalyst Chem. Ind. For. Prod. 2006 11 13 Y. Wang, L. Wang, L. Jiang, Z. Wang, Research on reaction kinetics of disproportionation of gum rosin catalyzed by AH non-noble metal catalyst, Chemistry and industry of forest products, (2006) 11-13. [59] S. Chen Q. Ran X. Chen L. Wang C. Yang J. Liang Kinetic study for catalytic hydrogenation of rosin over Pd/C Chem. Ind. For. Prod. 33 2013 103 107 S. Chen, Q. Ran, X. Chen, L. Wang, C. Yang, J. Liang, Kinetic study for catalytic hydrogenation of rosin over Pd/C, Chemistry and industry of forest products, 33 (2013) 103-107. [60] Y. Kumooka Analysis of rosin and modified rosin esters in adhesives by matrix-assisted laser desorption/ionization time-of-flight mass spectrometry (MALDI-TOF-MS) Forensic Sci. Int. 176 2008 111 120 Y. Kumooka, Analysis of rosin and modified rosin esters in adhesives by matrix-assisted laser desorption/ionization time-of-flight mass spectrometry (MALDI-TOF-MS), Forensic Science International, 176 (2008) 111-120. [61] L. Wang X. Chen J. Liang Y. Chen X. Pu Z. Tong Kinetics of the catalytic isomerization and disproportionation of rosin over carbon-supported palladium Chem. Eng. J. 152 2009 242 250 L. Wang, X. Chen, J. Liang, Y. Chen, X. Pu, Z. Tong, Kinetics of the catalytic isomerization and disproportionation of rosin over carbon-supported palladium, Chemical Engineering Journal, 152 (2009) 242-250. [62] J. Apsimon P. Demarco J. Lemke The stereochemistry of the tetrahydropimaric acids Can. J. Chem. 43 2011 2793 2801 J. Apsimon, P. Demarco, J. Lemke, The stereochemistry of the tetrahydropimaric acids, Canadian Journal of Chemistry, 43 (2011) 2793-2801. [63] Z.-Q. Song E. Zavarin D.F. Zinkel On the palladium-on-charcoal disproportionate of rosin J. Wood Chem. Technol. 5 1985 535 542 Z.-Q. Song, E. Zavarin, D.F. Zinkel, On the Palladium-On-Charcoal Disproportionate of Rosin, Journal of Wood Chemistry and Technology, 5 (1985) 535-542.",
      "scopus-id": "85212188567",
      "coredata": {
        "eid": "1-s2.0-S0926860X24005222",
        "dc:description": "This study introduces an efficient Pd/C catalyst for the rosin disproportionation (RD) reaction, a key biomass conversion process. The low-loaded Pd/C catalysts, with 3–6 nm Pd nanoparticles, were synthesized via deposition-precipitation and characterized for their high dispersion of metallic Pd on activated carbon. Optimized using the Box-Behnken design of response surface methodology, the catalyst achieved a 71.36 % maximum DAA yield under optimal conditions (280 °C, 150 min, 0.04 wt% catalyst, 3.00 wt% Pd), surpassing commercial catalysts by 1.27 times with reduced Pd usage. Key factors for catalytic activity included Pd loading, dispersion, particle size, and metallic Pd content. Kinetic studies showed an activation energy of 21.52 kJ/mol for the conversion of abietic acid to dehydroabietic acid, highlighting the superior potential in the RD reaction. Ultraviolet-visible absorption spectra and gas chromatography-mass spectrometry analyses elucidated the reaction pathway and mechanism, providing a practical approach to developing high-activity catalysts for industrial RD applications.",
        "openArchiveArticle": "false",
        "prism:coverDate": "2025-02-05",
        "openaccessUserLicense": null,
        "prism:aggregationType": "Journal",
        "prism:url": "https://api.elsevier.com/content/article/pii/S0926860X24005222",
        "dc:creator": [
          {
            "@_fa": "true",
            "$": "Niu, Yifan"
          },
          {
            "@_fa": "true",
            "$": "Gong, Siyu"
          },
          {
            "@_fa": "true",
            "$": "Zheng, Jinhao"
          },
          {
            "@_fa": "true",
            "$": "Zhou, Xian"
          },
          {
            "@_fa": "true",
            "$": "Song, Ziyu"
          },
          {
            "@_fa": "true",
            "$": "Ju, Shaohua"
          },
          {
            "@_fa": "true",
            "$": "Gu, Yongwan"
          }
        ],
        "link": [
          {
            "@_fa": "true",
            "@rel": "self",
            "@href": "https://api.elsevier.com/content/article/pii/S0926860X24005222"
          },
          {
            "@_fa": "true",
            "@rel": "scidir",
            "@href": "https://www.sciencedirect.com/science/article/pii/S0926860X24005222"
          }
        ],
        "dc:format": "application/json",
        "openaccessType": null,
        "pii": "S0926-860X(24)00522-2",
        "prism:volume": "691",
        "articleNumber": "120077",
        "prism:publisher": "Elsevier B.V. All rights are reserved, including those for text and data mining, AI training, and similar technologies.",
        "dc:title": "Catalytic performance of low loading palladium-carbon catalyst in rosin disproportionation: Characterization, process enhancement, and reaction pathway",
        "prism:copyright": "© 2024 Elsevier B.V. All rights are reserved, including those for text and data mining, AI training, and similar technologies.",
        "openaccess": "0",
        "prism:issn": "0926860X",
        "dcterms:subject": [
          {
            "@_fa": "true",
            "$": "Pd/C catalyst"
          },
          {
            "@_fa": "true",
            "$": "Rosin disproportionation"
          },
          {
            "@_fa": "true",
            "$": "Process optimization"
          },
          {
            "@_fa": "true",
            "$": "Reaction pathways"
          },
          {
            "@_fa": "true",
            "$": "Response surface methodology"
          }
        ],
        "openaccessArticle": "false",
        "prism:publicationName": "Applied Catalysis A: General",
        "openaccessSponsorType": null,
        "prism:pageRange": "120077",
        "pubType": "fla",
        "prism:coverDisplayDate": "5 February 2025",
        "prism:doi": "10.1016/j.apcata.2024.120077",
        "prism:startingPage": "120077",
        "dc:identifier": "doi:10.1016/j.apcata.2024.120077",
        "openaccessSponsorName": null
      },
      "objects": {
        "object": [
          {
            "@category": "standard",
            "@height": "394",
            "@width": "678",
            "@_fa": "true",
            "$": "https://api.elsevier.com/content/object/eid/1-s2.0-S0926860X24005222-sc1.jpg?httpAccept=%2A%2F%2A",
            "@multimediatype": "JPEG image file",
            "@type": "IMAGE-DOWNSAMPLED",
            "@size": "90386",
            "@ref": "sc1",
            "@mimetype": "image/jpeg"
          },
          {
            "@category": "standard",
            "@height": "483",
            "@width": "751",
            "@_fa": "true",
            "$": "https://api.elsevier.com/content/object/eid/1-s2.0-S0926860X24005222-gr10.jpg?httpAccept=%2A%2F%2A",
            "@multimediatype": "JPEG image file",
            "@type": "IMAGE-DOWNSAMPLED",
            "@size": "87125",
            "@ref": "gr10",
            "@mimetype": "image/jpeg"
          },
          {
            "@category": "standard",
            "@height": "200",
            "@width": "343",
            "@_fa": "true",
            "$": "https://api.elsevier.com/content/object/eid/1-s2.0-S0926860X24005222-ga1.jpg?httpAccept=%2A%2F%2A",
            "@multimediatype": "JPEG image file",
            "@type": "IMAGE-DOWNSAMPLED",
            "@size": "29283",
            "@ref": "ga1",
            "@mimetype": "image/jpeg"
          },
          {
            "@category": "standard",
            "@height": "311",
            "@width": "791",
            "@_fa": "true",
            "$": "https://api.elsevier.com/content/object/eid/1-s2.0-S0926860X24005222-gr9.jpg?httpAccept=%2A%2F%2A",
            "@multimediatype": "JPEG image file",
            "@type": "IMAGE-DOWNSAMPLED",
            "@size": "37123",
            "@ref": "gr9",
            "@mimetype": "image/jpeg"
          },
          {
            "@category": "standard",
            "@height": "457",
            "@width": "791",
            "@_fa": "true",
            "$": "https://api.elsevier.com/content/object/eid/1-s2.0-S0926860X24005222-gr8.jpg?httpAccept=%2A%2F%2A",
            "@multimediatype": "JPEG image file",
            "@type": "IMAGE-DOWNSAMPLED",
            "@size": "63664",
            "@ref": "gr8",
            "@mimetype": "image/jpeg"
          },
          {
            "@category": "standard",
            "@height": "757",
            "@width": "791",
            "@_fa": "true",
            "$": "https://api.elsevier.com/content/object/eid/1-s2.0-S0926860X24005222-gr5.jpg?httpAccept=%2A%2F%2A",
            "@multimediatype": "JPEG image file",
            "@type": "IMAGE-DOWNSAMPLED",
            "@size": "187870",
            "@ref": "gr5",
            "@mimetype": "image/jpeg"
          },
          {
            "@category": "standard",
            "@height": "883",
            "@width": "791",
            "@_fa": "true",
            "$": "https://api.elsevier.com/content/object/eid/1-s2.0-S0926860X24005222-gr4.jpg?httpAccept=%2A%2F%2A",
            "@multimediatype": "JPEG image file",
            "@type": "IMAGE-DOWNSAMPLED",
            "@size": "173020",
            "@ref": "gr4",
            "@mimetype": "image/jpeg"
          },
          {
            "@category": "standard",
            "@height": "530",
            "@width": "791",
            "@_fa": "true",
            "$": "https://api.elsevier.com/content/object/eid/1-s2.0-S0926860X24005222-gr7.jpg?httpAccept=%2A%2F%2A",
            "@multimediatype": "JPEG image file",
            "@type": "IMAGE-DOWNSAMPLED",
            "@size": "133117",
            "@ref": "gr7",
            "@mimetype": "image/jpeg"
          },
          {
            "@category": "standard",
            "@height": "280",
            "@width": "678",
            "@_fa": "true",
            "$": "https://api.elsevier.com/content/object/eid/1-s2.0-S0926860X24005222-gr6.jpg?httpAccept=%2A%2F%2A",
            "@multimediatype": "JPEG image file",
            "@type": "IMAGE-DOWNSAMPLED",
            "@size": "46794",
            "@ref": "gr6",
            "@mimetype": "image/jpeg"
          },
          {
            "@category": "standard",
            "@height": "494",
            "@width": "602",
            "@_fa": "true",
            "$": "https://api.elsevier.com/content/object/eid/1-s2.0-S0926860X24005222-gr1.jpg?httpAccept=%2A%2F%2A",
            "@multimediatype": "JPEG image file",
            "@type": "IMAGE-DOWNSAMPLED",
            "@size": "71700",
            "@ref": "gr1",
            "@mimetype": "image/jpeg"
          },
          {
            "@category": "standard",
            "@height": "581",
            "@width": "791",
            "@_fa": "true",
            "$": "https://api.elsevier.com/content/object/eid/1-s2.0-S0926860X24005222-gr3.jpg?httpAccept=%2A%2F%2A",
            "@multimediatype": "JPEG image file",
            "@type": "IMAGE-DOWNSAMPLED",
            "@size": "123519",
            "@ref": "gr3",
            "@mimetype": "image/jpeg"
          },
          {
            "@category": "standard",
            "@height": "995",
            "@width": "553",
            "@_fa": "true",
            "$": "https://api.elsevier.com/content/object/eid/1-s2.0-S0926860X24005222-gr2.jpg?httpAccept=%2A%2F%2A",
            "@multimediatype": "JPEG image file",
            "@type": "IMAGE-DOWNSAMPLED",
            "@size": "196012",
            "@ref": "gr2",
            "@mimetype": "image/jpeg"
          },
          {
            "@category": "thumbnail",
            "@height": "127",
            "@width": "219",
            "@_fa": "true",
            "$": "https://api.elsevier.com/content/object/eid/1-s2.0-S0926860X24005222-sc1.sml?httpAccept=%2A%2F%2A",
            "@multimediatype": "GIF image file",
            "@type": "IMAGE-THUMBNAIL",
            "@size": "24659",
            "@ref": "sc1",
            "@mimetype": "image/gif"
          },
          {
            "@category": "thumbnail",
            "@height": "141",
            "@width": "219",
            "@_fa": "true",
            "$": "https://api.elsevier.com/content/object/eid/1-s2.0-S0926860X24005222-gr10.sml?httpAccept=%2A%2F%2A",
            "@multimediatype": "GIF image file",
            "@type": "IMAGE-THUMBNAIL",
            "@size": "13088",
            "@ref": "gr10",
            "@mimetype": "image/gif"
          },
          {
            "@category": "thumbnail",
            "@height": "128",
            "@width": "219",
            "@_fa": "true",
            "$": "https://api.elsevier.com/content/object/eid/1-s2.0-S0926860X24005222-ga1.sml?httpAccept=%2A%2F%2A",
            "@multimediatype": "GIF image file",
            "@type": "IMAGE-THUMBNAIL",
            "@size": "25001",
            "@ref": "ga1",
            "@mimetype": "image/gif"
          },
          {
            "@category": "thumbnail",
            "@height": "86",
            "@width": "219",
            "@_fa": "true",
            "$": "https://api.elsevier.com/content/object/eid/1-s2.0-S0926860X24005222-gr9.sml?httpAccept=%2A%2F%2A",
            "@multimediatype": "GIF image file",
            "@type": "IMAGE-THUMBNAIL",
            "@size": "3884",
            "@ref": "gr9",
            "@mimetype": "image/gif"
          },
          {
            "@category": "thumbnail",
            "@height": "127",
            "@width": "219",
            "@_fa": "true",
            "$": "https://api.elsevier.com/content/object/eid/1-s2.0-S0926860X24005222-gr8.sml?httpAccept=%2A%2F%2A",
            "@multimediatype": "GIF image file",
            "@type": "IMAGE-THUMBNAIL",
            "@size": "8470",
            "@ref": "gr8",
            "@mimetype": "image/gif"
          },
          {
            "@category": "thumbnail",
            "@height": "164",
            "@width": "171",
            "@_fa": "true",
            "$": "https://api.elsevier.com/content/object/eid/1-s2.0-S0926860X24005222-gr5.sml?httpAccept=%2A%2F%2A",
            "@multimediatype": "GIF image file",
            "@type": "IMAGE-THUMBNAIL",
            "@size": "16853",
            "@ref": "gr5",
            "@mimetype": "image/gif"
          },
          {
            "@category": "thumbnail",
            "@height": "164",
            "@width": "147",
            "@_fa": "true",
            "$": "https://api.elsevier.com/content/object/eid/1-s2.0-S0926860X24005222-gr4.sml?httpAccept=%2A%2F%2A",
            "@multimediatype": "GIF image file",
            "@type": "IMAGE-THUMBNAIL",
            "@size": "11879",
            "@ref": "gr4",
            "@mimetype": "image/gif"
          },
          {
            "@category": "thumbnail",
            "@height": "147",
            "@width": "219",
            "@_fa": "true",
            "$": "https://api.elsevier.com/content/object/eid/1-s2.0-S0926860X24005222-gr7.sml?httpAccept=%2A%2F%2A",
            "@multimediatype": "GIF image file",
            "@type": "IMAGE-THUMBNAIL",
            "@size": "18145",
            "@ref": "gr7",
            "@mimetype": "image/gif"
          },
          {
            "@category": "thumbnail",
            "@height": "91",
            "@width": "219",
            "@_fa": "true",
            "$": "https://api.elsevier.com/content/object/eid/1-s2.0-S0926860X24005222-gr6.sml?httpAccept=%2A%2F%2A",
            "@multimediatype": "GIF image file",
            "@type": "IMAGE-THUMBNAIL",
            "@size": "7539",
            "@ref": "gr6",
            "@mimetype": "image/gif"
          },
          {
            "@category": "thumbnail",
            "@height": "164",
            "@width": "200",
            "@_fa": "true",
            "$": "https://api.elsevier.com/content/object/eid/1-s2.0-S0926860X24005222-gr1.sml?httpAccept=%2A%2F%2A",
            "@multimediatype": "GIF image file",
            "@type": "IMAGE-THUMBNAIL",
            "@size": "12392",
            "@ref": "gr1",
            "@mimetype": "image/gif"
          },
          {
            "@category": "thumbnail",
            "@height": "161",
            "@width": "219",
            "@_fa": "true",
            "$": "https://api.elsevier.com/content/object/eid/1-s2.0-S0926860X24005222-gr3.sml?httpAccept=%2A%2F%2A",
            "@multimediatype": "GIF image file",
            "@type": "IMAGE-THUMBNAIL",
            "@size": "14318",
            "@ref": "gr3",
            "@mimetype": "image/gif"
          },
          {
            "@category": "thumbnail",
            "@height": "164",
            "@width": "91",
            "@_fa": "true",
            "$": "https://api.elsevier.com/content/object/eid/1-s2.0-S0926860X24005222-gr2.sml?httpAccept=%2A%2F%2A",
            "@multimediatype": "GIF image file",
            "@type": "IMAGE-THUMBNAIL",
            "@size": "11253",
            "@ref": "gr2",
            "@mimetype": "image/gif"
          },
          {
            "@category": "high",
            "@height": "1739",
            "@width": "2994",
            "@_fa": "true",
            "$": "https://api.elsevier.com/content/object/eid/1-s2.0-S0926860X24005222-sc1_lrg.jpg?httpAccept=%2A%2F%2A",
            "@multimediatype": "JPEG image file",
            "@type": "IMAGE-HIGH-RES",
            "@size": "425999",
            "@ref": "sc1",
            "@mimetype": "image/jpeg"
          },
          {
            "@category": "high",
            "@height": "2141",
            "@width": "3326",
            "@_fa": "true",
            "$": "https://api.elsevier.com/content/object/eid/1-s2.0-S0926860X24005222-gr10_lrg.jpg?httpAccept=%2A%2F%2A",
            "@multimediatype": "JPEG image file",
            "@type": "IMAGE-HIGH-RES",
            "@size": "392482",
            "@ref": "gr10",
            "@mimetype": "image/jpeg"
          },
          {
            "@category": "high",
            "@height": "886",
            "@width": "1521",
            "@_fa": "true",
            "$": "https://api.elsevier.com/content/object/eid/1-s2.0-S0926860X24005222-ga1_lrg.jpg?httpAccept=%2A%2F%2A",
            "@multimediatype": "JPEG image file",
            "@type": "IMAGE-HIGH-RES",
            "@size": "281623",
            "@ref": "ga1",
            "@mimetype": "image/jpeg"
          },
          {
            "@category": "high",
            "@height": "1373",
            "@width": "3493",
            "@_fa": "true",
            "$": "https://api.elsevier.com/content/object/eid/1-s2.0-S0926860X24005222-gr9_lrg.jpg?httpAccept=%2A%2F%2A",
            "@multimediatype": "JPEG image file",
            "@type": "IMAGE-HIGH-RES",
            "@size": "174362",
            "@ref": "gr9",
            "@mimetype": "image/jpeg"
          },
          {
            "@category": "high",
            "@height": "2019",
            "@width": "3493",
            "@_fa": "true",
            "$": "https://api.elsevier.com/content/object/eid/1-s2.0-S0926860X24005222-gr8_lrg.jpg?httpAccept=%2A%2F%2A",
            "@multimediatype": "JPEG image file",
            "@type": "IMAGE-HIGH-RES",
            "@size": "320676",
            "@ref": "gr8",
            "@mimetype": "image/jpeg"
          },
          {
            "@category": "high",
            "@height": "3343",
            "@width": "3493",
            "@_fa": "true",
            "$": "https://api.elsevier.com/content/object/eid/1-s2.0-S0926860X24005222-gr5_lrg.jpg?httpAccept=%2A%2F%2A",
            "@multimediatype": "JPEG image file",
            "@type": "IMAGE-HIGH-RES",
            "@size": "837543",
            "@ref": "gr5",
            "@mimetype": "image/jpeg"
          },
          {
            "@category": "high",
            "@height": "3899",
            "@width": "3493",
            "@_fa": "true",
            "$": "https://api.elsevier.com/content/object/eid/1-s2.0-S0926860X24005222-gr4_lrg.jpg?httpAccept=%2A%2F%2A",
            "@multimediatype": "JPEG image file",
            "@type": "IMAGE-HIGH-RES",
            "@size": "841995",
            "@ref": "gr4",
            "@mimetype": "image/jpeg"
          },
          {
            "@category": "high",
            "@height": "2341",
            "@width": "3493",
            "@_fa": "true",
            "$": "https://api.elsevier.com/content/object/eid/1-s2.0-S0926860X24005222-gr7_lrg.jpg?httpAccept=%2A%2F%2A",
            "@multimediatype": "JPEG image file",
            "@type": "IMAGE-HIGH-RES",
            "@size": "628958",
            "@ref": "gr7",
            "@mimetype": "image/jpeg"
          },
          {
            "@category": "high",
            "@height": "1238",
            "@width": "2994",
            "@_fa": "true",
            "$": "https://api.elsevier.com/content/object/eid/1-s2.0-S0926860X24005222-gr6_lrg.jpg?httpAccept=%2A%2F%2A",
            "@multimediatype": "JPEG image file",
            "@type": "IMAGE-HIGH-RES",
            "@size": "221747",
            "@ref": "gr6",
            "@mimetype": "image/jpeg"
          },
          {
            "@category": "high",
            "@height": "2185",
            "@width": "2661",
            "@_fa": "true",
            "$": "https://api.elsevier.com/content/object/eid/1-s2.0-S0926860X24005222-gr1_lrg.jpg?httpAccept=%2A%2F%2A",
            "@multimediatype": "JPEG image file",
            "@type": "IMAGE-HIGH-RES",
            "@size": "352916",
            "@ref": "gr1",
            "@mimetype": "image/jpeg"
          },
          {
            "@category": "high",
            "@height": "2565",
            "@width": "3493",
            "@_fa": "true",
            "$": "https://api.elsevier.com/content/object/eid/1-s2.0-S0926860X24005222-gr3_lrg.jpg?httpAccept=%2A%2F%2A",
            "@multimediatype": "JPEG image file",
            "@type": "IMAGE-HIGH-RES",
            "@size": "617476",
            "@ref": "gr3",
            "@mimetype": "image/jpeg"
          },
          {
            "@category": "high",
            "@height": "4408",
            "@width": "2449",
            "@_fa": "true",
            "$": "https://api.elsevier.com/content/object/eid/1-s2.0-S0926860X24005222-gr2_lrg.jpg?httpAccept=%2A%2F%2A",
            "@multimediatype": "JPEG image file",
            "@type": "IMAGE-HIGH-RES",
            "@size": "1044437",
            "@ref": "gr2",
            "@mimetype": "image/jpeg"
          },
          {
            "@category": "standard",
            "@_fa": "true",
            "$": "https://api.elsevier.com/content/object/eid/1-s2.0-S0926860X24005222-mmc1.docx?httpAccept=%2A%2F%2A",
            "@multimediatype": "Microsoft Word file",
            "@type": "APPLICATION",
            "@size": "2687641",
            "@ref": "mmc1",
            "@mimetype": "application/word"
          },
          {
            "@category": "thumbnail",
            "@_fa": "true",
            "$": "https://api.elsevier.com/content/object/eid/1-s2.0-S0926860X24005222-si0001.svg?httpAccept=%2A%2F%2A",
            "@multimediatype": "Scalable Vector Graphics file",
            "@type": "ALTIMG",
            "@size": "1669",
            "@ref": "si0001",
            "@mimetype": "image/svg+xml"
          },
          {
            "@category": "thumbnail",
            "@_fa": "true",
            "$": "https://api.elsevier.com/content/object/eid/1-s2.0-S0926860X24005222-si0002.svg?httpAccept=%2A%2F%2A",
            "@multimediatype": "Scalable Vector Graphics file",
            "@type": "ALTIMG",
            "@size": "1977",
            "@ref": "si0002",
            "@mimetype": "image/svg+xml"
          },
          {
            "@category": "thumbnail",
            "@_fa": "true",
            "$": "https://api.elsevier.com/content/object/eid/1-s2.0-S0926860X24005222-si0003.svg?httpAccept=%2A%2F%2A",
            "@multimediatype": "Scalable Vector Graphics file",
            "@type": "ALTIMG",
            "@size": "1089",
            "@ref": "si0003",
            "@mimetype": "image/svg+xml"
          },
          {
            "@category": "thumbnail",
            "@_fa": "true",
            "$": "https://api.elsevier.com/content/object/eid/1-s2.0-S0926860X24005222-si0004.svg?httpAccept=%2A%2F%2A",
            "@multimediatype": "Scalable Vector Graphics file",
            "@type": "ALTIMG",
            "@size": "1118",
            "@ref": "si0004",
            "@mimetype": "image/svg+xml"
          },
          {
            "@category": "thumbnail",
            "@_fa": "true",
            "$": "https://api.elsevier.com/content/object/eid/1-s2.0-S0926860X24005222-si0005.svg?httpAccept=%2A%2F%2A",
            "@multimediatype": "Scalable Vector Graphics file",
            "@type": "ALTIMG",
            "@size": "935",
            "@ref": "si0005",
            "@mimetype": "image/svg+xml"
          },
          {
            "@category": "thumbnail",
            "@_fa": "true",
            "$": "https://api.elsevier.com/content/object/eid/1-s2.0-S0926860X24005222-si0006.svg?httpAccept=%2A%2F%2A",
            "@multimediatype": "Scalable Vector Graphics file",
            "@type": "ALTIMG",
            "@size": "1126",
            "@ref": "si0006",
            "@mimetype": "image/svg+xml"
          },
          {
            "@category": "thumbnail",
            "@_fa": "true",
            "$": "https://api.elsevier.com/content/object/eid/1-s2.0-S0926860X24005222-si0007.svg?httpAccept=%2A%2F%2A",
            "@multimediatype": "Scalable Vector Graphics file",
            "@type": "ALTIMG",
            "@size": "1126",
            "@ref": "si0007",
            "@mimetype": "image/svg+xml"
          }
        ]
      },
      "link": {
        "@rel": "abstract",
        "@href": "https://api.elsevier.com/content/abstract/scopus_id/85212188567"
      }
    }
  }
}