{
  "metadata": {
    "title": "Adsorption Studies of Pharmaceutical Feed Impurities on Pd/C Catalysts Fail to Predict Activity in Liquid Phase Hydrogenation",
    "authors": "; ; ",
    "journal": "Applied Catalysis A: General",
    "date": "2025-10-08",
    "doi": "10.1016/j.apcata.2025.120626",
    "abstract": "",
    "uri": "https://api.elsevier.com/content/article/pii/S0926860X25005289",
    "pii": "S0926860X25005289"
  },
  "fulltext": {
    "full-text-retrieval-response": {
      "originalText": "serial JL 271346 291210 291744 291809 31 90 Applied Catalysis A: General APPLIEDCATALYSISAGENERAL 2025-10-08 2025-10-08 2025-10-09T21:53:02 1-s2.0-S0926860X25005289 S0926-860X(25)00528-9 S0926860X25005289 10.1016/j.apcata.2025.120626 S5 S5.1 FULL-TEXT 2025-10-10T03:29:20.651656Z 0 0 20251008 2025 2025-10-08T16:39:58.431264Z absattachment aiptxt articleinfo articlenumber articletitlenorm authfirstinitialnorm authfirstsurnamenorm cid cids contenttype copyright crossmark dateloaded dateloadedtxt datesearch datesort dateupdated dco docsubtype doctype doi eid ewtransactionid fundingbodyid indexeddate issn issnnorm itemstage itemtransactionid itemweight oauserlicense openaccess openarchive pg pgfirst pii piinorm pubdatestart pubdatetxt pubyr sortorder sponsoredaccesstype srctitle srctitlenorm srctype ssids alllist content oa subj subheadings tomb webpdf webpdfpagecount yearnav figure table e-component body mmlmath acknowledge affil appendices articletitle auth authfirstini authfull authkeywords authlast glossary highlightsabst orcid primabst ref specialabst 0926-860X 0926860X UNLIMITED KANSAS2023 In Press, Journal Pre-proof 0 120626 120626 120626 Available online 8 October 2025 2025-10-08 2025 article fla © 2025 The Authors. Published by Elsevier B.V. ADSORPTIONSTUDIESPHARMACEUTICALFEEDIMPURITIESPDCCATALYSTSFAILPREDICTACTIVITYINLIQUIDPHASEHYDROGENATION KUMAR L 1 Introduction 2 Materials and Methods 2.1 Materials 2.2 Catalyst reduction 2.3 Adsorption experiments 2.4 Screening Reaction 2.5 Gas Chromatography 2.6 Data analysis 2.7 Catalyst Characterization 2.8 Density Functional Theory (DFT) Calculations 3 Results and discussion 3.1 Characterizing time for adsorption 3.2 Adsorption Studies 3.3 Modeling of Adsorptive Interactions 3.4 Reactor Screening 4 Conclusion Funding sources CRediT authorship contribution statement Acknowledgements Appendix A Supplementary material References Glossary TRAN 2021 H LIU 2008 229 242 Y LIMA 2021 41 88 E ALGHOUTI 2020 122383 M FOO 2010 2 10 K OTOR 2020 7630 7656 H ATKINS 2023 P ATKINSPHYSICALCHEMISTRY ANASTOPOULOS 2016 174 185 I SINGH 2008 626 641 K PICCIN 2017 19 51 J VANDEVOORDE 2014 5766 5788 B LANGMUIR 1918 1361 1403 I FARZINNEJAD 2013 239 246 N MCCHESNEY 1961 800 810 E GOEL 2024 1471 1482 T NASR 1978 295 298 M NECHIPADAPPU 2017 64 74 S SINGH 2023 P RECENTDEVELOPMENTSINSYNTHESISAPPLICATIONSPYRIDINES DUNN 2010 P HERAVI 2020 44247 44311 M LACHHIREDDY 2020 103558 V HYLLAND 2020 4208 4226 K WOLFE 2000 1158 1174 J BRUNAUER 1938 309 318 S WEBB 1997 1 325 P KRESSE 1996 11169 G KRESSE 1996 15 50 G KRESSE 1999 1758 G BLOCHL 1994 17953 P PERDEW 1996 3865 J GRIMME 2011 1456 1465 S GRIMME 2010 S MONKHORST 1976 5188 H BENGTSSON 1999 12301 L MOOTZ 1981 1517 1522 D ALBERS 2003 1941 1949 P CHERKASOV 2020 112378 N TUTUS 2025 1 16 E MOOTZ 1981 1517 1522 D HULLFISH 2025 1011 1020 C BELL 2024 114875 J BONELLO 2002 2672 2679 J SANTAROSSA 2008 401 413 G WADDILL 1986 208 213 G MALONE 2020 015001 W KUMARX2025X120626 KUMARX2025X120626XL Full 2025-10-09T20:09:56Z FundingBody Kansas University 2023: Hybrid journals http://creativecommons.org/licenses/by/4.0/ This is an open access article under the CC BY license. © 2025 The Authors. Published by Elsevier B.V. 2025-10-09T19:54:22.723Z http://vtw.elsevier.com/data/voc/AddOnTypes/50.7/aggregated-refined Iowa State University of Science and Technology http://data.elsevier.com/vocabulary/SciValFunders/100009227 http://sws.geonames.org/6252001 Jack R. and Carol A. Johnson Pfizer Inc http://data.elsevier.com/vocabulary/SciValFunders/100004319 http://sws.geonames.org/6252001 This work was primarily funded by Pfizer, Inc. LTR acknowledges support from the Jack R. and Carol A. Johnson Faculty Fellowship. item S0926-860X(25)00528-9 S0926860X25005289 1-s2.0-S0926860X25005289 10.1016/j.apcata.2025.120626 271346 2025-10-10T03:29:20.651656Z 2025-10-08 UNLIMITED KANSAS2023 1-s2.0-S0926860X25005289-main.pdf https://s3-eu-west-1.amazonaws.com/prod-ucs-content-store-eu-west/content/pii:S0926860X25005289/MAIN/application/pdf/991ac5bff534f0c3ea4bca7770b8de1c/main.pdf main.pdf pdf true 894953 MAIN 18 1-s2.0-S0926860X25005289-main_1.png https://s3-eu-west-1.amazonaws.com/prod-ucs-content-store-eu-west/content/pii:S0926860X25005289/PREVIEW/image/png/0cfe6dd9ca88926172cfd8a33f224230/main_1.png main_1.png png 51915 928 656 IMAGE-WEB-PDF 1 1-s2.0-S0926860X25005289-ga1.jpg https://s3-eu-west-1.amazonaws.com/prod-ucs-content-store-eu-west/content/pii:S0926860X25005289/ga1/DOWNSAMPLED/image/jpeg/2ffc058eac2d8246d86c9d9043bb0fa6/ga1.jpg ga1 true ga1.jpg jpg 36164 200 499 IMAGE-DOWNSAMPLED 1-s2.0-S0926860X25005289-gr1.jpg https://s3-eu-west-1.amazonaws.com/prod-ucs-content-store-eu-west/content/pii:S0926860X25005289/gr1/DOWNSAMPLED/image/jpeg/f4e16515c651fe0a200c77b460c250dc/gr1.jpg gr1 gr1.jpg jpg 18461 235 511 IMAGE-DOWNSAMPLED 1-s2.0-S0926860X25005289-gr2.jpg https://s3-eu-west-1.amazonaws.com/prod-ucs-content-store-eu-west/content/pii:S0926860X25005289/gr2/THUMBNAIL/image/jpeg/0f720720efcbb40a83818fc7e1a6acd2/gr2.jpg gr2 gr2.jpg jpg 20758 290 508 IMAGE-DOWNSAMPLED 1-s2.0-S0926860X25005289-gr3.jpg https://s3-eu-west-1.amazonaws.com/prod-ucs-content-store-eu-west/content/pii:S0926860X25005289/gr3/DOWNSAMPLED/image/jpeg/e55d4cdac46750fd0c5a69603b15d4a9/gr3.jpg gr3 gr3.jpg jpg 18017 319 678 IMAGE-DOWNSAMPLED 1-s2.0-S0926860X25005289-ga1.sml https://s3-eu-west-1.amazonaws.com/prod-ucs-content-store-eu-west/content/pii:S0926860X25005289/ga1/THUMBNAIL/image/gif/25bd84e296ccd546f75af0efd0f638a3/ga1.sml ga1 true ga1.sml sml 13832 88 219 IMAGE-THUMBNAIL 1-s2.0-S0926860X25005289-gr1.sml https://s3-eu-west-1.amazonaws.com/prod-ucs-content-store-eu-west/content/pii:S0926860X25005289/gr1/THUMBNAIL/image/gif/408639600dad0c68d85f0d54973502fb/gr1.sml gr1 gr1.sml sml 3229 101 219 IMAGE-THUMBNAIL 1-s2.0-S0926860X25005289-gr2.sml https://s3-eu-west-1.amazonaws.com/prod-ucs-content-store-eu-west/content/pii:S0926860X25005289/gr2/THUMBNAIL/image/gif/f37e7b7dbb75d458d1741fdcfe98c931/gr2.sml gr2 gr2.sml sml 3405 125 219 IMAGE-THUMBNAIL 1-s2.0-S0926860X25005289-gr3.sml https://s3-eu-west-1.amazonaws.com/prod-ucs-content-store-eu-west/content/pii:S0926860X25005289/gr3/THUMBNAIL/image/gif/95d603936903dee80372ef80e13f302e/gr3.sml gr3 gr3.sml sml 4063 103 219 IMAGE-THUMBNAIL 1-s2.0-S0926860X25005289-ga1_lrg.jpg https://s3-eu-west-1.amazonaws.com/prod-ucs-content-store-eu-west/content/pii:S0926860X25005289/HIGHRES/image/jpeg/98dd033efafaa220fb5a2d2b7aa79a5a/ga1_lrg.jpg ga1 true ga1_lrg.jpg jpg 306118 886 2211 IMAGE-HIGH-RES 1-s2.0-S0926860X25005289-gr1_lrg.jpg https://s3-eu-west-1.amazonaws.com/prod-ucs-content-store-eu-west/content/pii:S0926860X25005289/HIGHRES/image/jpeg/8f9a78cfd10a8b8a54d78f4d985dceac/gr1_lrg.jpg gr1 gr1_lrg.jpg jpg 126435 1039 2262 IMAGE-HIGH-RES 1-s2.0-S0926860X25005289-gr2_lrg.jpg https://s3-eu-west-1.amazonaws.com/prod-ucs-content-store-eu-west/content/pii:S0926860X25005289/HIGHRES/image/jpeg/d3e1b7f0c3bf5d6be804bfc6ffbb357b/gr2_lrg.jpg gr2 gr2_lrg.jpg jpg 102351 1282 2247 IMAGE-HIGH-RES 1-s2.0-S0926860X25005289-gr3_lrg.jpg https://s3-eu-west-1.amazonaws.com/prod-ucs-content-store-eu-west/content/pii:S0926860X25005289/HIGHRES/image/jpeg/620d8b99ef390ea9d10283d572ec6d1d/gr3_lrg.jpg gr3 gr3_lrg.jpg jpg 87356 1408 2994 IMAGE-HIGH-RES 1-s2.0-S0926860X25005289-mmc1.pdf https://s3-eu-west-1.amazonaws.com/prod-ucs-content-store-eu-west/content/pii:S0926860X25005289/mmc1/MAIN/application/pdf/94196b72625dbcb15c92052dbb0c883f/mmc1.pdf mmc1 mmc1.pdf pdf false 1435467 APPLICATION 1-s2.0-S0926860X25005289-si0001.gif https://s3-eu-west-1.amazonaws.com/prod-ucs-content-store-eu-west/content/pii:S0926860X25005289/STRIPIN/image/gif/680d8d498b0f9f08b6b4c590bdf3d28f/si0001.gif si0001 si0001.gif gif 1665 35 100 ALTIMG 1-s2.0-S0926860X25005289-si0002.gif https://s3-eu-west-1.amazonaws.com/prod-ucs-content-store-eu-west/content/pii:S0926860X25005289/STRIPIN/image/gif/cd2383016b4bf11a804ded07edd920a7/si0002.gif si0002 si0002.gif gif 306 12 7 ALTIMG 1-s2.0-S0926860X25005289-si0003.gif https://s3-eu-west-1.amazonaws.com/prod-ucs-content-store-eu-west/content/pii:S0926860X25005289/STRIPIN/image/gif/03bee83cc97f5c1750254bbcd96933b1/si0003.gif si0003 si0003.gif gif 308 12 11 ALTIMG 1-s2.0-S0926860X25005289-si0004.gif https://s3-eu-west-1.amazonaws.com/prod-ucs-content-store-eu-west/content/pii:S0926860X25005289/STRIPIN/image/gif/db57ecf1c710b20d9dc9469a53753c6c/si0004.gif si0004 si0004.gif gif 544 14 16 ALTIMG 1-s2.0-S0926860X25005289-si0005.gif https://s3-eu-west-1.amazonaws.com/prod-ucs-content-store-eu-west/content/pii:S0926860X25005289/STRIPIN/image/gif/b3f1e099af92c3b67b2e1a0fd26e17e0/si0005.gif si0005 si0005.gif gif 1692 34 102 ALTIMG 1-s2.0-S0926860X25005289-si0006.gif https://s3-eu-west-1.amazonaws.com/prod-ucs-content-store-eu-west/content/pii:S0926860X25005289/STRIPIN/image/gif/109614aac789769bcd1be138631fadcc/si0006.gif si0006 si0006.gif gif 1790 35 92 ALTIMG 1-s2.0-S0926860X25005289-si0007.gif https://s3-eu-west-1.amazonaws.com/prod-ucs-content-store-eu-west/content/pii:S0926860X25005289/STRIPIN/image/gif/0e9a8c9b2a570e6a41fa222c55842bcb/si0007.gif si0007 si0007.gif gif 1488 30 117 ALTIMG 1-s2.0-S0926860X25005289-si0008.gif https://s3-eu-west-1.amazonaws.com/prod-ucs-content-store-eu-west/content/pii:S0926860X25005289/STRIPIN/image/gif/12eebc907158daef45852e3bae17a9ba/si0008.gif si0008 si0008.gif gif 2570 32 249 ALTIMG 1-s2.0-S0926860X25005289-si0009.gif https://s3-eu-west-1.amazonaws.com/prod-ucs-content-store-eu-west/content/pii:S0926860X25005289/STRIPIN/image/gif/d298b950f62e76fb7e6952c893e88be7/si0009.gif si0009 si0009.gif gif 2862 32 333 ALTIMG 1-s2.0-S0926860X25005289-si0010.gif https://s3-eu-west-1.amazonaws.com/prod-ucs-content-store-eu-west/content/pii:S0926860X25005289/STRIPIN/image/gif/ab74143fe1c4018e091fd8a8cea2adaa/si0010.gif si0010 si0010.gif gif 468 15 21 ALTIMG 1-s2.0-S0926860X25005289-si0011.gif https://s3-eu-west-1.amazonaws.com/prod-ucs-content-store-eu-west/content/pii:S0926860X25005289/STRIPIN/image/gif/c3457afe9c5771908d5137762f357e6f/si0011.gif si0011 si0011.gif gif 630 15 26 ALTIMG 1-s2.0-S0926860X25005289-si0012.gif https://s3-eu-west-1.amazonaws.com/prod-ucs-content-store-eu-west/content/pii:S0926860X25005289/STRIPIN/image/gif/4c22ff1074d3034373dd3437c04065db/si0012.gif si0012 si0012.gif gif 634 18 25 ALTIMG 1-s2.0-S0926860X25005289-si0013.gif https://s3-eu-west-1.amazonaws.com/prod-ucs-content-store-eu-west/content/pii:S0926860X25005289/STRIPIN/image/gif/cba263b51d23e72c1e5a9d0494d6a2c3/si0013.gif si0013 si0013.gif gif 660 18 30 ALTIMG 1-s2.0-S0926860X25005289-si0014.gif https://s3-eu-west-1.amazonaws.com/prod-ucs-content-store-eu-west/content/pii:S0926860X25005289/STRIPIN/image/gif/33a26d5ad342317eb23b7acd9392947f/si0014.gif si0014 si0014.gif gif 1574 18 136 ALTIMG 1-s2.0-S0926860X25005289-si0015.gif https://s3-eu-west-1.amazonaws.com/prod-ucs-content-store-eu-west/content/pii:S0926860X25005289/STRIPIN/image/gif/dfb314852c57422e02a94d6f879b1063/si0015.gif si0015 si0015.gif gif 306 12 7 ALTIMG 1-s2.0-S0926860X25005289-si0016.gif https://s3-eu-west-1.amazonaws.com/prod-ucs-content-store-eu-west/content/pii:S0926860X25005289/STRIPIN/image/gif/1aba68b5278f22c68bccb2138511244d/si0016.gif si0016 si0016.gif gif 544 14 16 ALTIMG APCATA 120626 120626 S0926-860X(25)00528-9 10.1016/j.apcata.2025.120626 Fig. 1 Structures of N-containing adsorbates. Fig. 1 Fig. 2 (a) Langmuir adsorption isotherm for 4-methylquinoline on Pd/C catalyst (b) Linearized form of Langmuir adsorption isotherm for 4-methylquinoline on Pd/C catalyst. Fig. 2 Fig. 3 Screening of catalyst in block reactor. Reaction conditions: Reactions Conditions: 1mL 1.5M styrene + 20µL 0.5M adsorbate + 10mgPd/C catalyst, 35 ℃; 10bar H2, 30 mint. Fig. 3 Table 1 Comparative Equilibrium Constant, K Values on reduced Pd/C for N-containing adsorbates and their Gibbs free energy for adsorption. Table 1 Adsorbate pK a [40] K average (L/mol) Adsorbate site density (q m-SSA ) (molecules/nm 2 of catalyst) Hypothetical Pd adsorbate site density (q m-Pd ) (molecules/nm 2 of Pd) Gibbs free energy for adsorption (kJ/mol) 3-methylquinoline 5.17 141±23 0.25±0.08 80±13 -12.3 pyridine 5.23 116±72 0.14±0.02 54±08 -11.7 3-methylisoquinoline 5.60 232±107 0.21±0.09 56±31 -13.5 4-methylquinoline 5.64 208±84 0.28±0.02 105±11 -13.2 Hünig's base 11.00 384±29 0.17±0.05 65±18 -15.3 dibutylamine 11.39 2271±448 0.11±0.02 40±07 -19.1 Table 2 DFT-calculated adsorption energies on model surfaces. Table 2 Adsorbate K average (L/mol) from Experiment BE (eV) on Pd(111) BE (eV) on graphene-based -COOH BE (eV) on graphane-based -COOH 3-methylquinoline 141±23 -3.08 -0.89 -0.79 styrene -2.93 Not considered Not considered Hünig's base 384±29 -1.53 -0.94 -0.79 Adsorption Studies of Pharmaceutical Feed Impurities on Pd/C Catalysts Fail to Predict Activity in Liquid Phase Hydrogenation Loveneesh Kumar Writing – review & editing Writing – original draft Methodology Investigation Formal analysis Conceptualization a b Austin Tuschhoff Investigation a Ameera M. Alhajri Investigation a Kakasaheb Y. Nandiwale Writing – review & editing Visualization Investigation Formal analysis Conceptualization c Jadid E. Samad Writing – review & editing Investigation Formal analysis Conceptualization c Steven M. Guinness Writing – review & editing Investigation Formal analysis c Luke T. Roling Writing – review & editing Writing – original draft Visualization Investigation Formal analysis d Alan M. Allgeier Writing – review & editing Writing – original draft Supervision Resources Project administration Investigation Funding acquisition Formal analysis Conceptualization a a Chemical and Petroleum Engineering and the Center for Environmentally Beneficial Catalysis University of Kansas, Lawrence, Kansas USA Chemical and Petroleum Engineering and the Center for Environmentally Beneficial Catalysis University of Kansas Lawrence Kansas USA Chemical and Petroleum Engineering and the Center for Environmentally Beneficial Catalysis University of Kansas, Lawrence, Kansas USA b Department of Chemistry, Hansraj College, University of Delhi, Delhi-110007, India Department of Chemistry, Hansraj College, University of Delhi Delhi 110007 India Department of Chemistry, Hansraj College, University of Delhi, Delhi-110007, India c Chemical Research and Development, Pfizer Worldwide Research and Development, Groton, Connecticut 06340, USA Chemical Research and Development, Pfizer Worldwide Research and Development Groton Connecticut 06340 USA Chemical Research and Development, Pfizer Worldwide Research and Development, Groton, Connecticut 06340, USA d Chemical and Biological Engineering Iowa State University, Ames, Iowa USA Chemical and Biological Engineering Iowa State University Ames Iowa USA Chemical and Biological Engineering Iowa State University, Ames, Iowa USA Insight into the thermodynamics of liquid phase adsorption of nitrogen-containing compounds, which may serve as catalyst poisons for Pd/C, is important for the optimization of such catalytic processes in pharmaceutical industry. Here, the adsorption behaviors of six nitrogenous adsorbates pyridine, 3-methylquinoline, 3-methylisoquinoline, 4-methylquinoline, Hünig's base, and dibutylamine were examined by means of the Langmuir adsorption isotherm model. Equilibrium adsorption constants (K) varied from 141L·mol⁻¹ for 3-methylquinoline with pKa = 5.17 to 2271L·mol⁻¹ for dibutylamine with pKa = 11.39, indicating a strong dependence of adsorption affinity on pKa. The monolayer binding capacity far surpassed the availability of active palladium sites implying that the support played a significant role in equilibrium adsorption. Indeed, computation of a sampling of adsorbate binding energies for Pd(111) showed no correlation to measured adsorption constants, while adsorbate binding energies for R-COOH sites on the support showed a notable correlation. On the other hand, in a comparison of 3-methylquinoline to ethyl di-isopropyl amine as potential poisons, the suppression of reaction rate for styrene hydrogenation was strongly correlated to the computed adsorbate binding energy for Pd(111) and not correlated to the equilibrium binding constant overall. This observation further supports the conclusion that R-COOH sites play a significant role in adsorption equilibrium but experimentally determined equilibrium binding constants (via the Langmuir adsorption model) are insufficient to provide insight into catalyst poisoning. Rather analysis of reaction rate perturbations are recommended as essential for both practical and scientific examination of the role of catalyst poisons. These results offer important information on the adsorption mechanisms of nitrogen-containing compounds on Pd/C catalysts, which can be used in the design of more efficient catalytic systems for pharmaceutical use. Graphical abstract Keywords Catalyst deactivation Langmuir adsorption Pd/C Hydrogenation Pharmaceutical catalysis Data availability Data are available on request 1 Introduction Thermodynamic modeling of adsorption plays a vital role in estimating adsorption mechanism (i.e., physisorption and chemisorption).[1] Adsorption of a solute (adsorbate) onto a solid (adsorbent) certainly provides insights into how a process is occurring.[2–5] Currently, this approach is widely used in cleaning or separating various kinds of impurities in several different systems, but it can also be extended to understanding the mechanism of deactivation of a catalytic material.[6] To extract such information from experimental data, it is necessary to relate equilibrium adsorption to thermodynamic parameters via an appropriate adsorption isotherm model, which may be derived from first-principles or purely empirical. Generating and fitting equilibrium data have been discussed in detail recently.[7] Liquid-phase adsorption is a surface phenomenon in which entities of one or more components present within a liquid phase are concentrated onto the solid adsorbent surface.[8–11] Normally, this may occur due to the interactions of the adsorbate onto the surface of the adsorbents. It finds wide applications in industries dealing with water treatment, pharmaceuticals[12], and the petrochemicals industry[12], where control of the interaction at a molecular level accurately is indispensable. Certain parameters that determine the efficiency of such processes include properties of adsorbents, such as surface area, pore structure, and chemical composition; nature of adsorbate; and operational conditions involving temperature and pH. Among the most conventional models of adsorption, the Langmuir model interprets the adsorption of molecules onto a solid surface, considering only monolayer coverage with no interaction between adsorbed species. Irving Langmuir developed this model in 1918[13]; essentially, it was based on the premise that the sites of adsorption on the surface are uniform and that each site could hold only one molecule of adsorbate. According to Langmuir adsorption isotherm: (1) θ = q e q m = K C e 1 + K C e where, θ is fractional surface coverage K is equilibrium constant C e is the equilibrium-phase concentration of adsorbate qe is the quantity of adsorbate adsorbed in a single monolayer q m is the maximum adsorbate adsorbed. Common linearization of this equation includes[14]: (2) 1 q e = 1 K q m C e + 1 q m (3) C e q e = 1 Kq m + C e q m The N-containing heterocycles, adsorbates ( Fig. 1), are chosen according to their relevance in active pharmaceutical ingredients (API) synthesis and they should also have tendencies to bind the sites in a supported precious metal catalyst. 3-methylquinoline, 4-methylquinoline and 3-methylisoquinoline are used as intermediate, precursors or even as metal ligands for various kinds of drugs such as chloroquine and mefloquine.[15–17] Pyridine finds use as a precursor or moiety in various API syntheses and as a base.[18,19] Similarly, Hünig’s base and dibutylamine are used as reagents in many API synthesis steps.[20–24] In the present study, adsorption uptake at equilibrium was measured for N-containing heterocyclic adsorbates on the surface of a commercial Pd/C catalyst, having a high surface area at room temperature. These measurements were further fit to the Langmuir isotherm model to calculate the equilibrium adsorption constant, monolayer site density and Gibbs free energy for that N-containing compound. The analysis supports mechanistic studies of adsorption and reaction phenomena. 2 Materials and Methods 2.1 Materials The industrially available 10wt% Pd/C catalyst (Noblyst® P1261, Evonik) was used after pre-reduction. Anhydrous tetrahydrofuran (THF) was obtained in a 1L Sure/Seal™ bottle from Sigma-Aldrich to prevent moisture contamination; an inert atmosphere was maintained by purging with gas each time the bottle was accessed. 3-methylquinoline (99%), pyridine (99.8%, anhydrous), 3-methylisoquinoline (98%) and dibutylamine (99.5%) was obtained from Millipore-Sigma/Sigma-Aldrich, 4-methylquinoline (99%) was obtained from ThermoScientific Chemicals, and Hünig's base (99%) was obtained from TCI America™. After the reaction, the catalyst was separated using 0.2µm PTFE syringe filters. 2.2 Catalyst reduction Industrially available 10% Pd/C Noblyst® P1261 catalyst by Evonik was reduced in approximately 1g quantities in a 2.54cm horizontal quartz tube reduction apparatus after initially purging with 100 sccm N2 for 30minutes at room temperature. The sample was heated at 50° C under 100 sccm H2 for 60minutes and again flushed with N2 for 30minutes at room temperature. The furnace tube was sealed, then immediately moved to an inert atmosphere glovebox to collect the reduced/activated catalyst. 2.3 Adsorption experiments Adsorption experiments were conducted by charging 10mg of reduced Pd catalyst and 1mL of adsorbate solution to a 2mL vial with a stir bar in a glovebox. The vials were sealed and then stirred for 1 – 1.5h outside the glovebox to attain equilibrium at room temperature. The concentration of the supernatant was determined by gas chromatography (GC) analysis. Each experiment was conducted at least 2 times. 2.4 Screening Reaction A 1.5M solution of the model hydrogenation substrate (styrene) was prepared in anhydrous THF. Seven crimp-cap vials, each containing a magnetic stir bar, were prepared inside an inert atmosphere glovebox. To each vial, 10mg of the reduced 10wt% Pd/C catalyst was added, followed by 1mL of the prepared 1.5M substrate solution. The mass of each vial was recorded after each addition step. The sealed vials were then loaded into the reactor block. A pressure leak test was performed at 400psi for 30minutes. Following the leak test, the system was purged three times with nitrogen, then three times with hydrogen. Heating was initiated at the lowest possible pressure, and once its reached 35 °C, hydrogen pressure was increased to 150psig (~10bar), and stirring was initiated for 30minutes. After the reaction completion, the system was purged with nitrogen and allowed to cool to room temperature. The vials were subsequently removed, and the reaction mixtures were analyzed by GC. Calibration of model substrate was also performed using GC. 2.5 Gas Chromatography After the experiments, samples were first filtered using a 0.2µm PTFE filter to remove the catalyst. The concentrations of unknown adsorbates and styrene samples were then quantified using an Agilent 8890 GC equipped with a flame ionization detector (FID) and an autosampler. Quantification was performed using the calibration curve method. The instrument was fitted with an RTx-5 Amine capillary column (30m length, 0.25mm internal diameter, and 1 μm ﬁlm thickness) to ensure efficient separation and detection. The FID heater was set at 300 ºC. The flow of air was set at 400mL/min, H2 at 40mL/min and the makeup flow was done with UHP Helium at 45mL/min whereas the column flow rate of Helium was 1mL/min. 2.6 Data analysis The concentration after equilibrium adsorption, Ce (mol·L-1), was determined by GC and the quantity adsorbed on the surface was calculated. (4) q e = ( C i − C e ) m × V where Ci is the initial concentration before adsorption, and m is the mass of the adsorbent (reduced Pd/C). V is the volume of the adsorbate taken (in liters). The Langmuir adsorption isotherms for each adsorbate were plotted as the equilibrium loading (qe) as a function of the equilibrium adsorption concentration (Ce). Further 1/qe was plotted against 1/Ce and the data fit to Eq. 2 to determine the equilibrium binding constant, and the monolayer coverage, qm. The former was used to calculate the change in Gibbs free energy via Eq. 5 (5) ΔG = -RT(ln K) where R is universal gas constant, T is the absolute temperature. The adsorbate site density (qm-SSA), i.e., the monolayer coverage normalized to the BET specific surface area, was calculated by Eq. 6. The hypothetical Pd adsorbate site density (qm-Pd), i.e. the monolayer coverage normalized to Pd specific surface area was calculated by Eq. 7. Here, qm = monolayer coverage (mole/g), BET SSA = specific surface area by the BET method described below, Pd SSA = the specific surface area of exposed Pd measured by the method described below and NA = Avogadro’s number. The BET specific surface area (1426 m2/g) and the palladium specific surface area (3.8 m2/g) were taken as constants and measured, as described below. (6) adsorbate site density = q m − SSA = ( q m * N A ) BET SSA (7) hypothetical Pd adsorbate site density = q m − Pd = ( q m * N A ) Pd SSA 2.7 Catalyst Characterization The BET specific surface area of the Pd/C catalyst was measured from nitrogen adsorption-desorption isotherms with a Micromeritics TriStar II Plus instrument. The samples were degassed at 80 °C for 7hours under vacuum before the analysis. [25] Nitrogen was adsorbed at -196 °C over a pressure range 0.05 to 0.25P/P0, where P0 is the saturation pressure at the measurement temperature and P is the equilibrated pressure. Ten data points were fit to the BET equation [26] to extract the monolayer surface area. CO chemisorption was performed using MicroActive for Autochem II 2920 version 6.01 using 0.0320g of catalyst. The process involved initially heating the catalyst in flowing N2 for 1hr to remove residual moisture. Temperature was then cooled to 50 °C and the flow was switched to 50 sccm of 10% H2/Ar for 0.5hr for pre-reduction. 50 sccm of He was subsequently flown for another 0.5hr to remove physisorbed hydrogen. The temperature was then lowered to 35 °C under He atmosphere before CO was injected in pulses and recording elution profiles with a thermal conductivity detector. Pd dispersion and active surface area were calculated assuming a Pd/CO stoichiometry of 1.0. 2.8 Density Functional Theory (DFT) Calculations DFT calculations were performed using the Vienna Ab initio Simulation Package (VASP)[27,28]. Electron-ion interactions were calculated with projector augmented wave (PAW) potentials [29,30]using the Perdew-Burke-Ernzerhof (PBE) functional [31]and the DFT-D3 method[32,33] to implement dispersion corrections. A kinetic energy cutoff of 400eV was used, and self-consistent energy calculations were converged to 10-4 eV. The Pd(111) surface was modeled with a 5 ×5 surface unit cell, 4 metal layers, and six equivalent layers of vacuum using an optimized lattice constant of 3.89Å. The lattice parameters of graphene (2.47Å) and graphane (2.54Å), chosen to represent two simple substrates for the acid site model, were optimized using at least 12Å of vacuum between layers. Acid sites were constructed on each carbon surface using a 5 ×5 surface unit cell (100C atoms) with a single carboxylic acid (-COOH) site placed on top of the C support (in the case of graphane, replacing one surface -H). Geometry optimizations were performed until forces on all atoms were less than 0.02eV/Å. All atoms were relaxed in all geometry optimizations, except for the bottom two layers of the Pd(111) slab, which were fixed at their bulk lattice positions. The most stable binding configurations found for each adsorbate and surface model are shown in Figure S11 with converged geometries (VASP POSCAR format) provided as supplementary files. Surface Brillouin zones were sampled with a gamma-centered 4 ×4 x 1 Monkhorst-Pack k-point mesh.[34] Dipole corrections were applied normal to the surface.[35] Binding energies ( BE s) were calculated as the difference in total energies of the adsorbed state ( E ads ) and the respective gas-phase molecule ( E gas ) and the clean surface ( E surf ), i.e., BE = E ads − E gas − E surf 3 Results and discussion 3.1 Characterizing time for adsorption We began our study by characterizing the time required to reach equilibrium adsorption for the model substrate, 3-methylquinoline, which has the highest molecular weight among adsorbates evaluated. While this molecular weight is expected to provide the lowest diffusivity among the adsorbates, we acknowledge that all adsorbates are small molecules with similar diffusivities. Four adsorption measurements were conducted at 30, 60, 120, and 240min, each comprising 1ml of 0.05M adsorbate and 10mg of reduced Pd/C catalyst. There was no significant change in concentration among these measurements suggesting the system reached equilibrium even at 30minutes (Figure S1). For subsequent experiments a minimum of 60minutes was allocated to reach equilibrium for each substrate. 3.2 Adsorption Studies The adsorption studies were then carried out at multiple starting concentrations using 3-methylquinoline, pyridine, 3-methylisoquinoline, 4-methylquinoline and Hünig's base over reduced Pd/C catalyst. The adsorption isotherm data were plotted as the surface equilibrium loading (qe) against the equilibrium concentration (Ce) of adsorbate in solution. The data were further transformed and plotted as 1/qe versus 1/Ce and fit to Eq. 2 to determine K and qm. Fig. 2 presents representative data for 4-methylquinoline adsorption. Additional data sets are provided in the supporting information, and a summary, along with calculated ∆G values, is provided in Table 1. Analysis of the hypothetical Pd adsorbate site density reveals values 40 – 120 molecules / nm2 across the series of adsorbates tested. The trait is labeled hypothetical because it is calculated under the assumption that on Pd sites bind absorbates and the carbon sites are merely spectators. Under the assumption that the molecular footprint of these molecules falls in the range 0.16 – 0.50 nm2 per molecule, any hypothetical Pd adsorbate site density greater than 7 is unrealistic. Note that even the smallest molecule in the series (pyridine) is estimated to have an adsorption area of 0.23 nm2 per molecule from analysis of its crystal structure[36] suggesting a packing of 40 molecules/nm2 is not realistic. Accordingly, we conclude that the support contributes significantly to the adsorption equilibrium in all cases. The results also suggest that the catalyst surfaces present at least two types of sites (Pd and C) and given the complexity of carbon catalyst supports, a multiplicity of sites is likely.[37] Challenges of conducting liquid phase adsorption experiments have been extensively discussed in the literature.[38,39] An assumption of the Langmuir adsorption model is a uniform surface bearing a fixed number of energetically identical sites and it is acknowledged that the present system clearly presents non-uniformity. Still, the Langmuir adsorption model is widely applied to generate understanding of surface adsorption phenomena, while acknowledging its limitations.[38] We assess that this simple model provides sufficient fidelity and understanding of the experimental data to provide insights into catalytic behavior. The adsorbate site density (qm-SSA) was fairly insensitive to the identity of the adsorbate in this series, with values ranging 0.11 – 0.32 molecules/nm2, and always substantially less than the predicted packing for a close packed structure (c.f. pyridine packing from crystal structure data,[41] 4.34 molecules/nm2). Dibutylamine and Hünig's base are on the low end (0.11 and 0.17 molecules/nm2) and correspondingly have the largest molar volume and largest molecular footprint (see Supporting Information). Acid sites on the catalyst surface are expected to bind these nitrogenous bases and the data are consistent with some portion of the acid sites being close enough to each other that the molecular footprint of dibutylamine limits access to some of the sites. The potential for non-uniform distribution of acid sites is accommodated by the observation of low site density. It is acknowledged that pyridine also presents a low site density, an inconsistency in the proposed correlation (see supporting information). It is also notable that the solvent THF with its high concentration in these systems may dominate occupancy of weakly binding sites (physisorption). The low value of surface binding density observed for pyridine relative to the other aromatic amines is not fully understood but is certainly within the range of all adsorbates studied herein. The average equilibrium constants for adsorption for different adsorbates from Table 1, generally correlate with pKa values of the conjugate acids of the adsorbates. Hünig's base deviates from the apparent correlation which might be related to it being a tertiary amine whereby steric crowding negatively impacts Keq. The change in Gibbs free energy (ΔG) of binding necessarily shows a parallel correlation to the increase in pKa of the molecule. This trend may suggest that surface acid sites dominate the binding of adsorbates but leaves open the potential that Pd binding of aromatic rings and strong Lewis-bases would follow the same trend. In practice the data imply that, to some extent, the support may act as a poison trap and protecting the active metal sites. 3.3 Modeling of Adsorptive Interactions To better understand the competitive roles of acid sites and palladium sites in adsorption, a series of density functional theory (DFT) models were constructed to compute the binding energies (BEs) for representative bases: 3-methylquinoline, and Hünig's base, and for a representative hydrogenation substrate of pharmaceutical relevance, styrene. For the N-containing substrates the BEs on model acid sites, -COOH modified graphene and -COOH modified graphane, were similarly computed. The computations do not account for the role of solvation and are meant to provide relative insights into the adsorption events from modeling that is not resource intensive. It is noted that the BEs on Pd(111) for 3-methylquinoline and Hünig's base are not well correlated with the experimentally determined K values for adsorption, further supporting the above conclusion that palladium is not the only contributor to adsorption but that the carbon support plays a significant role. It is notable that the BE on Pd(111) for styrene is comparable to 3-methylquinoline, but stronger than Hünig's base, which should influence catalysis (vide infra). The observation is reminiscent of comparisons of nearly isostructural adsorbates: dibenzothiophene and fluorene, adsorbing to Pd/SiO2.[42] Furthermore, the binding energy of Hünig's base and 3-methylquinoline to the support acid sites are energetically sufficient to contribute to the overall adsorption equilibrium as proposed above. Indeed, the measured values are influenced, not only by the energetics computed at each site, but also biased for the relatively large population of carbon support acidic adsorption sites (expressed across 1426 m2/g), compared to Pd sites (comprising 3.8 m2/g). The somewhat stronger BE of Hünig's base, compared to 3-methylquinoline, for acid sites is correlated with its higher experimental K value and to a first approximation consistent with the van’t Hoff equation relationship. 3.4 Reactor Screening The performance of Pd/C in the presence of catalyst poisons / nitrogenous base adsorbates was evaluated using the representative substrate, styrene. Accordingly, styrene was treated with Pd/C (6.4% w/w relative to styrene) in THF solvent at 35 °C and 10bar H2 for 30minutes, optionally with 2mol% nitrogen-containing adsorbates, Fig. 3. Both pyridine and Hünig's base show no significant impact upon conversion, while the fused arene substrates 3-methylquinoline and 3-methylisoquinoline negatively impact conversion. The lack of correlation of conversion and adsorption equilibrium constant is initially intriguing but in light of the conclusion that adsorption is significantly influenced by the support, the data further underscore that adsorption isotherms are insufficient to draw conclusions about catalytic behaviour on supported metal catalysts. Indeed, Hünig's base has much higher affinity for the overall catalyst surface (Kav = 384 vs. 141 for 3-methylquinoline) but has no apparent impact on rate, while 3-methylquinoline has lower Kav but a higher BE for Pd(111) and greater suppression of reaction rate / conversion. It has been noted in the literature that the binding of aromatics to Pd can be sufficient to modify selectivity in catalytic reactions.[43] or inhibiting substrate binding.[42] Additionally the binding of quinolines to Pd(111) has been described as parallel to the surface by both experiments,[44] and DFT models,[45] consistent with our models (see supporting information), Pyridine’s adsorption mode has been described as dependent upon conditions and methods of modelling.[46,47] Some permutations suggesting adsorption via N-Pd bonding and others by aromatic pi system – Pd binding. Our data suggest that the fused ring substrates have higher palladium BE than the mono-arenes, styrene and pyridine, and the aliphatic amines. The reactivity trends are aligned with these BEs, rather than the experimentally determined K values. We acknowledge that the conversions in Fig. 3 were measured in a small volume screening reactor (1mL each) and a rigorous assessment validating the intrinsic kinetic regime has not been completed, nonetheless the rate suppression caused by 3-methylquinoline and 3-methylisoquinoline is clearly supported and aligned with the conclusions. 4 Conclusion The present study is a comprehensive thermodynamic examination of the liquid-phase adsorption of nitrogen compounds on Pd/C catalysts based on the Langmuir adsorption isotherm model. The findings suggest a positive relationship between adsorption affinity and pKa of the adsorbate conjugate acids, with equilibrium adsorption constants (K) ranging from 141L·mol⁻¹ for 3-methylquinoline (pKa = 5.17) to 2271L·mol⁻¹ for dibutylamine (pKa = 11.39). While the size of molecules does not strongly affect the adsorption site density, the data for the largest molecules tested (dibutylamine and Hünig's base) suggest some inaccessible sites remain at equilibrium, consistent with non-uniform spacing of adsorption sites. Some percent of the acid sites are in close proximity and inaccessible due to crowding. In addition, the unrealistically high values for the hypothetical Pd adsorbate site density calculations indicate adsorption is not limited to Pd but strongly influenced by the carbon support. The calculated Gibbs free energy changes (ΔG) indicate that adsorption feasibility rises with pKa, from -11.6kJ·mol⁻¹ for 3-methylquinoline to -19.1kJ·mol⁻¹ for dibutylamine. Adsorbate binding energies calculated from DFT models further support that adsorption comprises both Pd and support binding sites. Comparison of equilibrium adsorption data to rates of styrene hydrogenation show poor correlations between conversion and K values. On the other hand, adsorbate binding energies for Pd(111) show a good correlation to reaction performance. While providing excellent insight into surface chemistry, laboratory-based adsorption studies are insufficient for addressing catalyst poisoning, and kinetic evaluations are critical. Funding sources This work was primarily funded by Pfizer, Inc. LTR acknowledges support from the Jack R. and Carol A. Johnson Faculty Fellowship. CRediT authorship contribution statement Alan M. Allgeier: Writing – review & editing, Writing – original draft, Supervision, Resources, Project administration, Investigation, Funding acquisition, Formal analysis, Conceptualization. Luke T. Roling: Writing – review & editing, Writing – original draft, Visualization, Investigation, Formal analysis. Steven M. Guinness: Writing – review & editing, Investigation, Formal analysis. Jadid E. Samad: Writing – review & editing, Investigation, Formal analysis, Conceptualization. Kakasaheb Y. Nandiwale: Writing – review & editing, Visualization, Investigation, Formal analysis, Conceptualization. Ameera M. Alhajri: Investigation. Austin Tuschhoff: Investigation. Loveneesh Kumar: Writing – review & editing, Writing – original draft, Methodology, Investigation, Formal analysis, Conceptualization. Declaration of Competing Interest The authors declare the following financial interests/personal relationships which may be considered as potential competing interests:Alan M. Allgeier reports financial support was provided by Pfizer. Kakasaheb Nandiwale reports a relationship with Pfizer that includes: employment. Jadid Samad reports a relationship with Pfizer that includes: employment. Steven M. Guinness reports a relationship with Pfizer that includes: employment. If there are other authors, they declare that they have no known competing financial interests or personal relationships that could have appeared to influence the work reported in this paper. Acknowledgements None Declaration of Competing Interest The authors declare that the work was funded by Pfizer, Inc. and JES, SMG and KYN acknowledge their employment by the funder. Appendix A Supporting information Supplementary data associated with this article can be found in the online version at doi:10.1016/j.apcata.2025.120626. Appendix A Supplementary material Supplementary material References [1] H.N. Tran E.C. Lima R.S. Juang J.C. Bollinger H.P. Chao J Environ Chem Eng 9 2021 10.1016/j.jece.2021.106674 H.N. Tran, E.C. Lima, R.S. Juang, J.C. Bollinger, H.P. Chao, J Environ Chem Eng 9 (2021). https://doi.org/10.1016/j.jece.2021.106674 [2] Y. Liu Y.J. Liu Sep Purif Technol 61 2008 229 242 10.1016/J.SEPPUR.2007.10.002 Y. Liu, Y.J. Liu, Sep Purif Technol 61 (2008) 229–242. https://doi.org/10.1016/J.SEPPUR.2007.10.002 [3] É.C. Lima M.H. Dehghani A. Guleria F. Sher R.R. Karri G.L. Dotto H.N. Tran Green Technologies for the Defluoridation of Water 2021 41 88 10.1016/B978-0-323-85768-0.00004-X É.C. Lima, M.H. Dehghani, A. Guleria, F. Sher, R.R. Karri, G.L. Dotto, H.N. Tran, Green Technologies for the Defluoridation of Water (2021) 41–88. https://doi.org/10.1016/B978-0-323-85768-0.00004-X [4] M.A. Al-Ghouti D.A. Da’ana J Hazard Mater 393 2020 122383 10.1016/J.JHAZMAT.2020.122383 M.A. Al-Ghouti, D.A. Da’ana, J Hazard Mater 393 (2020) 122383. https://doi.org/10.1016/J.JHAZMAT.2020.122383 [5] K.Y. Foo B.H. Hameed Chemical Engineering Journal 156 2010 2 10 10.1016/J.CEJ.2009.09.013 K.Y. Foo, B.H. Hameed, Chemical Engineering Journal 156 (2010) 2–10. https://doi.org/10.1016/J.CEJ.2009.09.013 [6] H.O. Otor J.B. Steiner C. García-Sancho A.C. Alba-Rubio ACS Catal 10 2020 7630 7656 10.1021/acscatal.0c01569 H.O. Otor, J.B. Steiner, C. García-Sancho, A.C. Alba-Rubio, ACS Catal 10 (2020) 7630–7656. https://doi.org/10.1021/acscatal.0c01569 [7] P. Atkins J. De Paula J. Keeler Atkins’ Physical Chemistry 12th edition 2023 Oxford University Press P. Atkins, J. De Paula, J. Keeler, Atkins’ Physical Chemistry, 12th edition, Oxford University Press, 2023. [8] I. Anastopoulos G.Z. Kyzas J Mol Liq 218 2016 174 185 10.1016/j.molliq.2016.02.059 I. Anastopoulos, G.Z. Kyzas, J Mol Liq 218 (2016) 174–185. https://doi.org/10.1016/j.molliq.2016.02.059 [9] K.P. Singh A. Malik S. Sinha P. Ojha J Hazard Mater 150 2008 626 641 10.1016/j.jhazmat.2007.05.017 K.P. Singh, A. Malik, S. Sinha, P. Ojha, J Hazard Mater 150 (2008) 626–641. https://doi.org/10.1016/j.jhazmat.2007.05.017 [10] J.S. Piccin T.R.S.A. Cadaval L.A.A. De Pinto G.L. Dotto Adsorption Processes for Water Treatment and Purification 2017 19 51 10.1007/978-3-319-58136-1_2 J.S. Piccin, T.R.S.A. Cadaval, L.A.A. De Pinto, G.L. Dotto, Adsorption Processes for Water Treatment and Purification (2017) 19–51. https://doi.org/10.1007/978-3-319-58136-1_2 [11] P. Sepúlveda, A. Erto, J.L. da S. Duarte, L. Meili, (2021) 1–24. https://doi.org/10.1007/978-3-030-64092-7_1 [12] B. Van De Voorde B. Bueken J. Denayer D. De Vos Chem Soc Rev 43 2014 5766 5788 10.1039/c4cs00006d B. Van De Voorde, B. Bueken, J. Denayer, D. De Vos, Chem Soc Rev 43 (2014) 5766–5788. https://doi.org/10.1039/c4cs00006d [13] I. Langmuir J Am Chem Soc 40 1918 1361 1403 10.1021/JA02242A004/ASSET/JA02242A004.FP.PNG_V03 I. Langmuir, J Am Chem Soc 40 (1918) 1361–1403. https://doi.org/10.1021/JA02242A004/ASSET/JA02242A004.FP.PNG_V03 [14] N. Farzin Nejad E. Shams M.K. Amini J.C. Bennett Microporous and Mesoporous Materials 168 2013 239 246 10.1016/J.MICROMESO.2012.10.012 N. Farzin Nejad, E. Shams, M.K. Amini, J.C. Bennett, Microporous and Mesoporous Materials 168 (2013) 239–246. https://doi.org/10.1016/J.MICROMESO.2012.10.012 [15] E.W. McCHESNEY J.P. McAuLiFF Antibiot Chemother (1971) 11 1961 800 810 E.W. McCHESNEY, J.P. McAuLiFF, Antibiot Chemother (1971) 11 (1961) 800–810. [16] T.R. Goel K. Salahuddin A. Rana R. Mazumder M.J. Kumar M. Ahsan P.K. Sarafroz S. Tyagi Singh Curr Org Chem 28 2024 1471 1482 10.2174/0113852728311152240529082035/CITE/REFWORKS T.R. Goel, Salahuddin, K. Rana, A. Mazumder, R. Kumar, M.J. Ahsan, M. Sarafroz, P.K. Tyagi, S. Singh, Curr Org Chem 28 (2024) 1471–1482. https://doi.org/10.2174/0113852728311152240529082035/CITE/REFWORKS [17] M. Nasr I. Nabih J.H. Burckhalter J Med Chem 21 1978 295 298 10.1021/jm00201a013 M. Nasr, I. Nabih, J.H. Burckhalter, J Med Chem 21 (1978) 295–298. https://doi.org/10.1021/jm00201a013 [18] S.K. Nechipadappu D.R. Trivedi J Mol Struct 1141 2017 64 74 10.1016/J.MOLSTRUC.2017.03.086 S.K. Nechipadappu, D.R. Trivedi, J Mol Struct 1141 (2017) 64–74. https://doi.org/10.1016/J.MOLSTRUC.2017.03.086 [19] P. Singh Recent Developments in the Synthesis and Applications of Pyridines 2023 Elsevier P. Singh, Recent Developments in the Synthesis and Applications of Pyridines, Elsevier, 2023. [20] P.J. Dunn A.S. Wells M.T. Williams Green Chemistry in the Pharmaceutical Industry 2010 10.1002/9783527629688 P.J. Dunn, A.S. Wells, M.T. Williams, Green Chemistry in the Pharmaceutical Industry (2010). https://doi.org/10.1002/9783527629688 [21] M.M. Heravi V. Zadsirjan RSC Adv 10 2020 44247 44311 10.1039/D0RA09198G M.M. Heravi, V. Zadsirjan, RSC Adv 10 (2020) 44247–44311. https://doi.org/10.1039/D0RA09198G [22] V. Lachhi Reddy V.K.R. Avula G.V. Zyryanov S. Vallela J.S. Anireddy V.R. Pasupuleti N.R. Chamarthi Bioorg Chem 95 2020 103558 10.1016/J.BIOORG.2019.103558 V. Lachhi Reddy, V.K.R. Avula, G.V. Zyryanov, S. Vallela, J.S. Anireddy, V.R. Pasupuleti, N.R. Chamarthi, Bioorg Chem 95 (2020) 103558. https://doi.org/10.1016/J.BIOORG.2019.103558 [23] K.T. Hylland S. Øien-Ødegaard M. Tilset European J Org Chem 2020 2020 4208 4226 10.1002/ejoc.202000599 K.T. Hylland, S. Øien-Ødegaard, M. Tilset, European J Org Chem 2020 (2020) 4208–4226. https://doi.org/10.1002/ejoc.202000599 [24] J.P. Wolfe H. Tomori J.P. Sadighi J. Yin S.L. Buchwald Journal of Organic Chemistry 65 2000 1158 1174 10.1021/jo991699y J.P. Wolfe, H. Tomori, J.P. Sadighi, J. Yin, S.L. Buchwald, Journal of Organic Chemistry 65 (2000) 1158–1174. https://doi.org/10.1021/jo991699y [25] S. Brunauer P.H. Emmett E. Teller Adsorption of Gases in Multimolecular Layers 60 1938 309 318 S. Brunauer, P.H. Emmett, E. Teller, Adsorption of Gases in Multimolecular Layers 60 (1938) 309–318. [26] P.A. Webb C. Orr Micromeritics 1997 1 325 P.A. Webb, C. Orr, Micromeritics (1997) 1–325. [27] G. Kresse J. Furthmüller Phys Rev B 54 1996 11169 10.1103/PhysRevB.54.11169 G. Kresse, J. Furthmüller, Phys Rev B 54 (1996) 11169. https://doi.org/10.1103/PhysRevB.54.11169 [28] G. Kresse J. Furthmüller Comput Mater Sci 6 1996 15 50 10.1016/0927-0256(96)00008-0 G. Kresse, J. Furthmüller, Comput Mater Sci 6 (1996) 15–50. https://doi.org/10.1016/0927-0256(96)00008-0 [29] G. Kresse D. Joubert Phys Rev B 59 1999 1758 10.1103/PhysRevB.59.1758 G. Kresse, D. Joubert, Phys Rev B 59 (1999) 1758. https://doi.org/10.1103/PhysRevB.59.1758 [30] P.E. Blöchl Phys Rev B 50 1994 17953 10.1103/PhysRevB.50.17953 P.E. Blöchl, Phys Rev B 50 (1994) 17953. https://doi.org/10.1103/PhysRevB.50.17953 [31] J.P. Perdew K. Burke M. Ernzerhof Phys Rev Lett 77 1996 3865 10.1103/PhysRevLett.77.3865 J.P. Perdew, K. Burke, M. Ernzerhof, Phys Rev Lett 77 (1996) 3865. https://doi.org/10.1103/PhysRevLett.77.3865 [32] S. Grimme S. Ehrlich L. Goerigk J Comput Chem 32 2011 1456 1465 10.1002/JCC.21759 S. Grimme, S. Ehrlich, L. Goerigk, J Comput Chem 32 (2011) 1456–1465. https://doi.org/10.1002/JCC.21759 [33] S. Grimme J. Antony S. Ehrlich H. Krieg Journal of Chemical Physics 132 2010 10.1063/1.3382344/926936 S. Grimme, J. Antony, S. Ehrlich, H. Krieg, Journal of Chemical Physics 132 (2010). https://doi.org/10.1063/1.3382344/926936 [34] H.J. Monkhorst J.D. Pack Phys Rev B 13 1976 5188 10.1103/PhysRevB.13.5188 H.J. Monkhorst, J.D. Pack, Phys Rev B 13 (1976) 5188. https://doi.org/10.1103/PhysRevB.13.5188 [35] L. Bengtsson Phys Rev B 59 1999 12301 10.1103/PhysRevB.59.12301 L. Bengtsson, Phys Rev B 59 (1999) 12301. https://doi.org/10.1103/PhysRevB.59.12301 [36] D. Mootz H.G. Wussow J Chem Phys 75 1981 1517 1522 10.1063/1.442204 D. Mootz, H.G. Wussow, J Chem Phys 75 (1981) 1517–1522. https://doi.org/10.1063/1.442204 [37] P.W. Albers J. Pietsch J. Krauter S.F. Parker Physical Chemistry Chemical Physics 5 2003 1941 1949 10.1039/b212210n P.W. Albers, J. Pietsch, J. Krauter, S.F. Parker, Physical Chemistry Chemical Physics 5 (2003) 1941–1949. https://doi.org/10.1039/b212210n [38] N. Cherkasov J Mol Liq 301 2020 112378 10.1016/J.MOLLIQ.2019.112378 N. Cherkasov, J Mol Liq 301 (2020) 112378. https://doi.org/10.1016/J.MOLLIQ.2019.112378 [39] E. Tutus N. Kanmaz T. Hayri-Senel P. Demircivi G. Nasun-Saygili N. Erdol-Aydin Sci Rep 15 2025 1 16 10.1038/s41598-025-03127-z E. Tutus, N. Kanmaz, T. Hayri-Senel, P. Demircivi, G. Nasun-Saygili, N. Erdol-Aydin, Sci Rep 15 (2025) 1–16. https://doi.org/10.1038/s41598-025-03127-z [40] \"Quest Database™ pKa and pKb Reference Table.\" AAT Bioquest, Inc., 7 Aug. 2025, 〈https://www.aatbio.com/data-sets/pka-and-pkb-reference-table〉. [41] D. Mootz H.G. Wussow J Chem Phys 75 1981 1517 1522 10.1063/1.442204 D. Mootz, H.G. Wussow, J Chem Phys 75 (1981) 1517–1522. https://doi.org/10.1063/1.442204 [42] C.W. Hullfish R.A. Yang M.L. Sarazen Ind Eng Chem Res 64 2025 1011 1020 10.1021/acs.iecr.4c03213 C.W. Hullfish, R.A. Yang, M.L. Sarazen, Ind Eng Chem Res 64 (2025) 1011–1020. https://doi.org/10.1021/acs.iecr.4c03213 [43] J. Bell A. Poncet L. Li A. Zachariou K. Whiston S.K. Beaumont Catal Today 441 2024 114875 10.1016/J.CATTOD.2024.114875 J. Bell, A. Poncet, L. Li, A. Zachariou, K. Whiston, S.K. Beaumont, Catal Today 441 (2024) 114875. https://doi.org/10.1016/J.CATTOD.2024.114875 [44] J.M. Bonello R. Lindsay A.K. Santra R.M. Lambert Journal of Physical Chemistry B 106 2002 2672 2679 10.1021/jp013765h J.M. Bonello, R. Lindsay, A.K. Santra, R.M. Lambert, Journal of Physical Chemistry B 106 (2002) 2672–2679. https://doi.org/10.1021/jp013765h [45] G. Santarossa M. Iannuzzi A. Vargas A. Baiker ChemPhysChem 9 2008 401 413 10.1002/CPHC.200700534 G. Santarossa, M. Iannuzzi, A. Vargas, A. Baiker, ChemPhysChem 9 (2008) 401–413. https://doi.org/10.1002/CPHC.200700534 [46] G.D. Waddill L.L. Kesmodel Chem Phys Lett 128 1986 208 213 10.1016/0009-2614(86)80327-X G.D. Waddill, L.L. Kesmodel, Chem Phys Lett 128 (1986) 208–213. https://doi.org/10.1016/0009-2614(86)80327-X [47] W. Malone A. Kara Electronic Structure 2 2020 015001 10.1088/2516-1075/AB6AAB W. Malone, A. Kara, Electronic Structure 2 (2020) 015001. https://doi.org/10.1088/2516-1075/AB6AAB. Glossary K Equilibrium adsorption constant θ fractional surface coverage GC Gas chromatography C e equilibrium-phase concentration of adsorbate qe quantity of adsorbate adsorbed in a single monolayer q m maximum adsorbate adsorbed ΔG Gibbs free energy DFT Density functional theory w/w weight by weight Kav Average Equilibrium adsorption constant BE Binding energy SSA Specific surface area THF Tetrahydrofuran",
      "coredata": {
        "eid": "1-s2.0-S0926860X25005289",
        "dc:description": "Insight into the thermodynamics of liquid phase adsorption of nitrogen-containing compounds, which may serve as catalyst poisons for Pd/C, is important for the optimization of such catalytic processes in pharmaceutical industry. Here, the adsorption behaviors of six nitrogenous adsorbates pyridine, 3-methylquinoline, 3-methylisoquinoline, 4-methylquinoline, Hünig's base, and dibutylamine were examined by means of the Langmuir adsorption isotherm model. Equilibrium adsorption constants (K) varied from 141L·mol⁻¹ for 3-methylquinoline with pKa = 5.17 to 2271L·mol⁻¹ for dibutylamine with pKa = 11.39, indicating a strong dependence of adsorption affinity on pKa. The monolayer binding capacity far surpassed the availability of active palladium sites implying that the support played a significant role in equilibrium adsorption. Indeed, computation of a sampling of adsorbate binding energies for Pd(111) showed no correlation to measured adsorption constants, while adsorbate binding energies for R-COOH sites on the support showed a notable correlation. On the other hand, in a comparison of 3-methylquinoline to ethyl di-isopropyl amine as potential poisons, the suppression of reaction rate for styrene hydrogenation was strongly correlated to the computed adsorbate binding energy for Pd(111) and not correlated to the equilibrium binding constant overall. This observation further supports the conclusion that R-COOH sites play a significant role in adsorption equilibrium but experimentally determined equilibrium binding constants (via the Langmuir adsorption model) are insufficient to provide insight into catalyst poisoning. Rather analysis of reaction rate perturbations are recommended as essential for both practical and scientific examination of the role of catalyst poisons. These results offer important information on the adsorption mechanisms of nitrogen-containing compounds on Pd/C catalysts, which can be used in the design of more efficient catalytic systems for pharmaceutical use.",
        "openArchiveArticle": "false",
        "prism:coverDate": "2025-10-08",
        "openaccessUserLicense": "http://creativecommons.org/licenses/by/4.0/",
        "prism:aggregationType": "Journal",
        "prism:url": "https://api.elsevier.com/content/article/pii/S0926860X25005289",
        "dc:creator": [
          {
            "@_fa": "true",
            "$": "Kumar, Loveneesh"
          },
          {
            "@_fa": "true",
            "$": "Tuschhoff, Austin"
          },
          {
            "@_fa": "true",
            "$": "Alhajri, Ameera M."
          },
          {
            "@_fa": "true",
            "$": "Nandiwale, Kakasaheb Y."
          },
          {
            "@_fa": "true",
            "$": "Samad, Jadid E."
          },
          {
            "@_fa": "true",
            "$": "Guinness, Steven M."
          },
          {
            "@_fa": "true",
            "$": "Roling, Luke T."
          },
          {
            "@_fa": "true",
            "$": "Allgeier, Alan M."
          }
        ],
        "link": [
          {
            "@_fa": "true",
            "@rel": "self",
            "@href": "https://api.elsevier.com/content/article/pii/S0926860X25005289"
          },
          {
            "@_fa": "true",
            "@rel": "scidir",
            "@href": "https://www.sciencedirect.com/science/article/pii/S0926860X25005289?v=s5"
          }
        ],
        "dc:format": "application/json",
        "openaccessType": "Full",
        "pii": "S0926-860X(25)00528-9",
        "articleNumber": "120626",
        "prism:publisher": "The Authors. Published by Elsevier B.V.",
        "dc:title": "Adsorption Studies of Pharmaceutical Feed Impurities on Pd/C Catalysts Fail to Predict Activity in Liquid Phase Hydrogenation",
        "prism:copyright": "© 2025 The Authors. Published by Elsevier B.V.",
        "openaccess": "1",
        "prism:issn": "0926860X",
        "dcterms:subject": [
          {
            "@_fa": "true",
            "$": "Catalyst deactivation"
          },
          {
            "@_fa": "true",
            "$": "Langmuir adsorption"
          },
          {
            "@_fa": "true",
            "$": "Pd/C"
          },
          {
            "@_fa": "true",
            "$": "Hydrogenation"
          },
          {
            "@_fa": "true",
            "$": "Pharmaceutical catalysis"
          }
        ],
        "openaccessArticle": "true",
        "prism:publicationName": "Applied Catalysis A: General",
        "openaccessSponsorType": "FundingBody",
        "prism:pageRange": "120626",
        "pubType": "fla",
        "prism:coverDisplayDate": "Available online 8 October 2025",
        "prism:doi": "10.1016/j.apcata.2025.120626",
        "prism:startingPage": "120626",
        "dc:identifier": "doi:10.1016/j.apcata.2025.120626",
        "openaccessSponsorName": "Kansas University 2023: Hybrid journals"
      },
      "objects": {
        "object": [
          {
            "@category": "standard",
            "@height": "200",
            "@width": "499",
            "@_fa": "true",
            "$": "https://api.elsevier.com/content/object/eid/1-s2.0-S0926860X25005289-ga1.jpg?httpAccept=%2A%2F%2A",
            "@multimediatype": "JPEG image file",
            "@type": "IMAGE-DOWNSAMPLED",
            "@size": "36164",
            "@ref": "ga1",
            "@mimetype": "image/jpeg"
          },
          {
            "@category": "standard",
            "@height": "235",
            "@width": "511",
            "@_fa": "true",
            "$": "https://api.elsevier.com/content/object/eid/1-s2.0-S0926860X25005289-gr1.jpg?httpAccept=%2A%2F%2A",
            "@multimediatype": "JPEG image file",
            "@type": "IMAGE-DOWNSAMPLED",
            "@size": "18461",
            "@ref": "gr1",
            "@mimetype": "image/jpeg"
          },
          {
            "@category": "standard",
            "@height": "290",
            "@width": "508",
            "@_fa": "true",
            "$": "https://api.elsevier.com/content/object/eid/1-s2.0-S0926860X25005289-gr2.jpg?httpAccept=%2A%2F%2A",
            "@multimediatype": "JPEG image file",
            "@type": "IMAGE-DOWNSAMPLED",
            "@size": "20758",
            "@ref": "gr2",
            "@mimetype": "image/jpeg"
          },
          {
            "@category": "standard",
            "@height": "319",
            "@width": "678",
            "@_fa": "true",
            "$": "https://api.elsevier.com/content/object/eid/1-s2.0-S0926860X25005289-gr3.jpg?httpAccept=%2A%2F%2A",
            "@multimediatype": "JPEG image file",
            "@type": "IMAGE-DOWNSAMPLED",
            "@size": "18017",
            "@ref": "gr3",
            "@mimetype": "image/jpeg"
          },
          {
            "@category": "thumbnail",
            "@height": "88",
            "@width": "219",
            "@_fa": "true",
            "$": "https://api.elsevier.com/content/object/eid/1-s2.0-S0926860X25005289-ga1.sml?httpAccept=%2A%2F%2A",
            "@multimediatype": "GIF image file",
            "@type": "IMAGE-THUMBNAIL",
            "@size": "13832",
            "@ref": "ga1",
            "@mimetype": "image/gif"
          },
          {
            "@category": "thumbnail",
            "@height": "101",
            "@width": "219",
            "@_fa": "true",
            "$": "https://api.elsevier.com/content/object/eid/1-s2.0-S0926860X25005289-gr1.sml?httpAccept=%2A%2F%2A",
            "@multimediatype": "GIF image file",
            "@type": "IMAGE-THUMBNAIL",
            "@size": "3229",
            "@ref": "gr1",
            "@mimetype": "image/gif"
          },
          {
            "@category": "thumbnail",
            "@height": "125",
            "@width": "219",
            "@_fa": "true",
            "$": "https://api.elsevier.com/content/object/eid/1-s2.0-S0926860X25005289-gr2.sml?httpAccept=%2A%2F%2A",
            "@multimediatype": "GIF image file",
            "@type": "IMAGE-THUMBNAIL",
            "@size": "3405",
            "@ref": "gr2",
            "@mimetype": "image/gif"
          },
          {
            "@category": "thumbnail",
            "@height": "103",
            "@width": "219",
            "@_fa": "true",
            "$": "https://api.elsevier.com/content/object/eid/1-s2.0-S0926860X25005289-gr3.sml?httpAccept=%2A%2F%2A",
            "@multimediatype": "GIF image file",
            "@type": "IMAGE-THUMBNAIL",
            "@size": "4063",
            "@ref": "gr3",
            "@mimetype": "image/gif"
          },
          {
            "@category": "high",
            "@height": "886",
            "@width": "2211",
            "@_fa": "true",
            "$": "https://api.elsevier.com/content/object/eid/1-s2.0-S0926860X25005289-ga1_lrg.jpg?httpAccept=%2A%2F%2A",
            "@multimediatype": "JPEG image file",
            "@type": "IMAGE-HIGH-RES",
            "@size": "306118",
            "@ref": "ga1",
            "@mimetype": "image/jpeg"
          },
          {
            "@category": "high",
            "@height": "1039",
            "@width": "2262",
            "@_fa": "true",
            "$": "https://api.elsevier.com/content/object/eid/1-s2.0-S0926860X25005289-gr1_lrg.jpg?httpAccept=%2A%2F%2A",
            "@multimediatype": "JPEG image file",
            "@type": "IMAGE-HIGH-RES",
            "@size": "126435",
            "@ref": "gr1",
            "@mimetype": "image/jpeg"
          },
          {
            "@category": "high",
            "@height": "1282",
            "@width": "2247",
            "@_fa": "true",
            "$": "https://api.elsevier.com/content/object/eid/1-s2.0-S0926860X25005289-gr2_lrg.jpg?httpAccept=%2A%2F%2A",
            "@multimediatype": "JPEG image file",
            "@type": "IMAGE-HIGH-RES",
            "@size": "102351",
            "@ref": "gr2",
            "@mimetype": "image/jpeg"
          },
          {
            "@category": "high",
            "@height": "1408",
            "@width": "2994",
            "@_fa": "true",
            "$": "https://api.elsevier.com/content/object/eid/1-s2.0-S0926860X25005289-gr3_lrg.jpg?httpAccept=%2A%2F%2A",
            "@multimediatype": "JPEG image file",
            "@type": "IMAGE-HIGH-RES",
            "@size": "87356",
            "@ref": "gr3",
            "@mimetype": "image/jpeg"
          },
          {
            "@category": "standard",
            "@_fa": "true",
            "$": "https://api.elsevier.com/content/object/eid/1-s2.0-S0926860X25005289-mmc1.pdf?httpAccept=%2A%2F%2A",
            "@multimediatype": "Acrobat PDF file",
            "@type": "APPLICATION",
            "@size": "1435467",
            "@ref": "mmc1",
            "@mimetype": "application/pdf"
          },
          {
            "@category": "thumbnail",
            "@height": "35",
            "@width": "100",
            "@_fa": "true",
            "$": "https://api.elsevier.com/content/object/eid/1-s2.0-S0926860X25005289-si0001.gif?httpAccept=%2A%2F%2A",
            "@multimediatype": "GIF image file",
            "@type": "ALTIMG",
            "@size": "1665",
            "@ref": "si0001",
            "@mimetype": "image/gif"
          },
          {
            "@category": "thumbnail",
            "@height": "12",
            "@width": "7",
            "@_fa": "true",
            "$": "https://api.elsevier.com/content/object/eid/1-s2.0-S0926860X25005289-si0002.gif?httpAccept=%2A%2F%2A",
            "@multimediatype": "GIF image file",
            "@type": "ALTIMG",
            "@size": "306",
            "@ref": "si0002",
            "@mimetype": "image/gif"
          },
          {
            "@category": "thumbnail",
            "@height": "12",
            "@width": "11",
            "@_fa": "true",
            "$": "https://api.elsevier.com/content/object/eid/1-s2.0-S0926860X25005289-si0003.gif?httpAccept=%2A%2F%2A",
            "@multimediatype": "GIF image file",
            "@type": "ALTIMG",
            "@size": "308",
            "@ref": "si0003",
            "@mimetype": "image/gif"
          },
          {
            "@category": "thumbnail",
            "@height": "14",
            "@width": "16",
            "@_fa": "true",
            "$": "https://api.elsevier.com/content/object/eid/1-s2.0-S0926860X25005289-si0004.gif?httpAccept=%2A%2F%2A",
            "@multimediatype": "GIF image file",
            "@type": "ALTIMG",
            "@size": "544",
            "@ref": "si0004",
            "@mimetype": "image/gif"
          },
          {
            "@category": "thumbnail",
            "@height": "34",
            "@width": "102",
            "@_fa": "true",
            "$": "https://api.elsevier.com/content/object/eid/1-s2.0-S0926860X25005289-si0005.gif?httpAccept=%2A%2F%2A",
            "@multimediatype": "GIF image file",
            "@type": "ALTIMG",
            "@size": "1692",
            "@ref": "si0005",
            "@mimetype": "image/gif"
          },
          {
            "@category": "thumbnail",
            "@height": "35",
            "@width": "92",
            "@_fa": "true",
            "$": "https://api.elsevier.com/content/object/eid/1-s2.0-S0926860X25005289-si0006.gif?httpAccept=%2A%2F%2A",
            "@multimediatype": "GIF image file",
            "@type": "ALTIMG",
            "@size": "1790",
            "@ref": "si0006",
            "@mimetype": "image/gif"
          },
          {
            "@category": "thumbnail",
            "@height": "30",
            "@width": "117",
            "@_fa": "true",
            "$": "https://api.elsevier.com/content/object/eid/1-s2.0-S0926860X25005289-si0007.gif?httpAccept=%2A%2F%2A",
            "@multimediatype": "GIF image file",
            "@type": "ALTIMG",
            "@size": "1488",
            "@ref": "si0007",
            "@mimetype": "image/gif"
          },
          {
            "@category": "thumbnail",
            "@height": "32",
            "@width": "249",
            "@_fa": "true",
            "$": "https://api.elsevier.com/content/object/eid/1-s2.0-S0926860X25005289-si0008.gif?httpAccept=%2A%2F%2A",
            "@multimediatype": "GIF image file",
            "@type": "ALTIMG",
            "@size": "2570",
            "@ref": "si0008",
            "@mimetype": "image/gif"
          },
          {
            "@category": "thumbnail",
            "@height": "32",
            "@width": "333",
            "@_fa": "true",
            "$": "https://api.elsevier.com/content/object/eid/1-s2.0-S0926860X25005289-si0009.gif?httpAccept=%2A%2F%2A",
            "@multimediatype": "GIF image file",
            "@type": "ALTIMG",
            "@size": "2862",
            "@ref": "si0009",
            "@mimetype": "image/gif"
          },
          {
            "@category": "thumbnail",
            "@height": "15",
            "@width": "21",
            "@_fa": "true",
            "$": "https://api.elsevier.com/content/object/eid/1-s2.0-S0926860X25005289-si0010.gif?httpAccept=%2A%2F%2A",
            "@multimediatype": "GIF image file",
            "@type": "ALTIMG",
            "@size": "468",
            "@ref": "si0010",
            "@mimetype": "image/gif"
          },
          {
            "@category": "thumbnail",
            "@height": "15",
            "@width": "26",
            "@_fa": "true",
            "$": "https://api.elsevier.com/content/object/eid/1-s2.0-S0926860X25005289-si0011.gif?httpAccept=%2A%2F%2A",
            "@multimediatype": "GIF image file",
            "@type": "ALTIMG",
            "@size": "630",
            "@ref": "si0011",
            "@mimetype": "image/gif"
          },
          {
            "@category": "thumbnail",
            "@height": "18",
            "@width": "25",
            "@_fa": "true",
            "$": "https://api.elsevier.com/content/object/eid/1-s2.0-S0926860X25005289-si0012.gif?httpAccept=%2A%2F%2A",
            "@multimediatype": "GIF image file",
            "@type": "ALTIMG",
            "@size": "634",
            "@ref": "si0012",
            "@mimetype": "image/gif"
          },
          {
            "@category": "thumbnail",
            "@height": "18",
            "@width": "30",
            "@_fa": "true",
            "$": "https://api.elsevier.com/content/object/eid/1-s2.0-S0926860X25005289-si0013.gif?httpAccept=%2A%2F%2A",
            "@multimediatype": "GIF image file",
            "@type": "ALTIMG",
            "@size": "660",
            "@ref": "si0013",
            "@mimetype": "image/gif"
          },
          {
            "@category": "thumbnail",
            "@height": "18",
            "@width": "136",
            "@_fa": "true",
            "$": "https://api.elsevier.com/content/object/eid/1-s2.0-S0926860X25005289-si0014.gif?httpAccept=%2A%2F%2A",
            "@multimediatype": "GIF image file",
            "@type": "ALTIMG",
            "@size": "1574",
            "@ref": "si0014",
            "@mimetype": "image/gif"
          },
          {
            "@category": "thumbnail",
            "@height": "12",
            "@width": "7",
            "@_fa": "true",
            "$": "https://api.elsevier.com/content/object/eid/1-s2.0-S0926860X25005289-si0015.gif?httpAccept=%2A%2F%2A",
            "@multimediatype": "GIF image file",
            "@type": "ALTIMG",
            "@size": "306",
            "@ref": "si0015",
            "@mimetype": "image/gif"
          },
          {
            "@category": "thumbnail",
            "@height": "14",
            "@width": "16",
            "@_fa": "true",
            "$": "https://api.elsevier.com/content/object/eid/1-s2.0-S0926860X25005289-si0016.gif?httpAccept=%2A%2F%2A",
            "@multimediatype": "GIF image file",
            "@type": "ALTIMG",
            "@size": "544",
            "@ref": "si0016",
            "@mimetype": "image/gif"
          }
        ]
      }
    }
  }
}