{
  "metadata": {
    "title": "Behavior of active species on Pt-Sn/SiO<ce:inf loc=post>2</ce:inf> catalyst during the dehydrogenation of propane and regeneration",
    "authors": "; ; ",
    "journal": "Applied Catalysis A: General",
    "date": "2020-09-25",
    "doi": "10.1016/j.apcata.2020.117826",
    "abstract": "",
    "uri": "https://api.elsevier.com/content/article/pii/S0926860X20304191",
    "pii": "S0926860X20304191"
  },
  "fulltext": {
    "full-text-retrieval-response": {
      "scopus-eid": "2-s2.0-85091384065",
      "originalText": "serial JL 271346 291210 291744 291809 31 Applied Catalysis A: General APPLIEDCATALYSISAGENERAL 2020-09-07 2020-09-07 2020-09-21 2020-09-21 2020-10-08T16:52:38 1-s2.0-S0926860X20304191 S0926-860X(20)30419-1 S0926860X20304191 10.1016/j.apcata.2020.117826 S300 S300.1 FULL-TEXT 1-s2.0-S0926860X20X00160 2024-01-01T12:34:28.416125Z 0 0 20200925 2020 2020-09-07T15:44:13.843936Z absattachment articleinfo articlenumber articletitlenorm authfirstinitialnorm authfirstsurnamenorm cid cids contenttype copyright crossmark dateloaded dateloadedtxt datesearch datesort dateupdated dco docsubtype doctype doi eid ewtransactionid hubeid indexeddate issn issnnorm itemstage itemtransactionid itemweight openaccess openarchive pg pgfirst pii piinorm pubdatestart pubdatetxt pubyr sortorder srctitle srctitlenorm srctype ssids alllist content subj subheadings suppl tomb volfirst volissue volumelist webpdf webpdfpagecount yearnav figure table e-component body acknowledge affil appendices articletitle auth authfirstini authfull authkeywords authlast grantnumber grantsponsor grantsponsorid highlightsabst orcid primabst ref specialabst 0926-860X 0926860X true 606 606 C Volume 606 10 117826 117826 117826 20200925 25 September 2020 2020-09-25 2020 article fla © 2020 Elsevier B.V. All rights reserved. BEHAVIORACTIVESPECIESPTSNSIO2CATALYSTDURINGDEHYDROGENATIONPROPANEREGENERATION DENG L 1 Introduction 2 Experimental 2.1 Catalyst preparation 2.2 Dehydrogenation of propane 2.3 Catalyst regeneration processes 2.4 Characterization 3 Results 3.1 Propane dehydrogenation 3.2 Coke deposition on catalysts 3.3 XRD patterns of the catalysts 3.4 HADDF-STEM images of Pt-Sn/SiO2 3.5 XAFS analysis 3.5.1 Pt L3-edge XAFS 3.5.2 Sn K-edge XANES spectra 3.6 XPS analysis of Pt-Sn/SiO2 4 Discussion 5 Conclusions CRediT authorship contribution statement Acknowledgments Appendix A Supplementary data References BRUIJNINCX 2013 11980 11987 P MCFARLAND 2012 340 342 E SATTLER 2014 10613 10653 J NAWAZ 2015 413 436 Z JAMES 2016 239 255 O GRANT 2016 1570 1573 J HAN 2014 10000 10008 Z LI 2011 888 896 Q VU 2011 25 33 B IGLESIASJUEZ 2010 268 279 A WANG 2018 8647 8654 H YANG 2012 1247 1258 M NYKANEN 2013 3026 3030 L ZHANG 2014 138 147 Y BARIAS 1996 1 12 O ZHOU 2016 1072 1081 S LEE 2015 123 140 M BAI 2009 449 456 L ZHANG 2013 94 104 Y DENG 2014 33 39 L DENG 2014 2680 2691 L DENG 2018 277 291 L DENG 2019 947 956 L DENG 2017 7160 7172 L CONTRERASANDRADE 2009 3835 3841 I ZAFEIRATOS 2012 1787 1801 S WANG 2011 11052 11061 X SINGH 2013 652 676 A TAO 2010 8697 8703 F TAO 2008 932 934 F UEMURA 2011 15833 15844 Y UEMURA 2011 5823 5833 Y LIU 2017 246 252 Q KAYLOR 2018 181 193 N BARRALESCORTES 2020 C HANSEN 2013 1720 1730 T LYTLE 1976 376 379 F RAMALLOLOPEZ 2003 11441 11451 J KIM 2008 89 102 J SYMOENS 2018 16117 16136 S VIRNOVSKAIA 2007 30 43 A DENGX2020X117826 DENGX2020X117826XL 2022-09-21T00:00:00.000Z 2022-09-21T00:00:00.000Z http://creativecommons.org/licenses/by-nc-nd/4.0/ © 2020 Elsevier B.V. All rights reserved. 2020-09-07T10:25:08.715Z http://vtw.elsevier.com/data/voc/AddOnTypes/50.7/eoas National Natural Science Foundation of China http://data.elsevier.com/vocabulary/SciValFunders/501100001809 http://sws.geonames.org/1814991 item S0926-860X(20)30419-1 S0926860X20304191 1-s2.0-S0926860X20304191 10.1016/j.apcata.2020.117826 271346 2024-01-01T12:34:28.416125Z 2020-09-25 1-s2.0-S0926860X20304191-main.pdf https://s3-eu-west-1.amazonaws.com/prod-ucs-content-store-eu-west/content/pii:S0926860X20304191/MAIN/application/pdf/9c13b7c666802b18d5e33b8c08dc2ec7/main.pdf main.pdf pdf true 2699967 MAIN 9 1-s2.0-S0926860X20304191-main_1.png https://s3-eu-west-1.amazonaws.com/prod-ucs-content-store-eu-west/content/pii:S0926860X20304191/PREVIEW/image/png/dff962b053a32b203c8dfa782c960987/main_1.png main_1.png png 56137 849 656 IMAGE-WEB-PDF 1 1-s2.0-S0926860X20304191-sc1.jpg https://s3-eu-west-1.amazonaws.com/prod-ucs-content-store-eu-west/content/pii:S0926860X20304191/sc1/DOWNSAMPLED/image/jpeg/cb0df096228e92557577e40284f14228/sc1.jpg sc1 sc1.jpg jpg 41405 435 567 IMAGE-DOWNSAMPLED 1-s2.0-S0926860X20304191-gr1.jpg https://s3-eu-west-1.amazonaws.com/prod-ucs-content-store-eu-west/content/pii:S0926860X20304191/gr1/DOWNSAMPLED/image/jpeg/a2f4e2cf37badc00e0cd0a4d80710dcc/gr1.jpg gr1 gr1.jpg jpg 34153 262 567 IMAGE-DOWNSAMPLED 1-s2.0-S0926860X20304191-gr2.jpg https://s3-eu-west-1.amazonaws.com/prod-ucs-content-store-eu-west/content/pii:S0926860X20304191/gr2/DOWNSAMPLED/image/jpeg/5e17d6a814321a0d3706d1f8a803b9a4/gr2.jpg gr2 gr2.jpg jpg 63009 618 567 IMAGE-DOWNSAMPLED 1-s2.0-S0926860X20304191-ga1.jpg https://s3-eu-west-1.amazonaws.com/prod-ucs-content-store-eu-west/content/pii:S0926860X20304191/ga1/DOWNSAMPLED/image/jpeg/9fe56e610f632ed436a48cf99ca81fb7/ga1.jpg ga1 true ga1.jpg jpg 24421 200 430 IMAGE-DOWNSAMPLED 1-s2.0-S0926860X20304191-gr5.jpg https://s3-eu-west-1.amazonaws.com/prod-ucs-content-store-eu-west/content/pii:S0926860X20304191/gr5/DOWNSAMPLED/image/jpeg/eba67258e436366d283dd36b84077f2b/gr5.jpg gr5 gr5.jpg jpg 42952 358 567 IMAGE-DOWNSAMPLED 1-s2.0-S0926860X20304191-gr6.jpg https://s3-eu-west-1.amazonaws.com/prod-ucs-content-store-eu-west/content/pii:S0926860X20304191/gr6/DOWNSAMPLED/image/jpeg/76dd2cb4169fe66e23c8432d2850eda4/gr6.jpg gr6 gr6.jpg jpg 47966 349 567 IMAGE-DOWNSAMPLED 1-s2.0-S0926860X20304191-gr3.jpg https://s3-eu-west-1.amazonaws.com/prod-ucs-content-store-eu-west/content/pii:S0926860X20304191/gr3/DOWNSAMPLED/image/jpeg/a9f451c99f13f3ae7d7e373249113735/gr3.jpg gr3 gr3.jpg jpg 111215 715 718 IMAGE-DOWNSAMPLED 1-s2.0-S0926860X20304191-gr4.jpg https://s3-eu-west-1.amazonaws.com/prod-ucs-content-store-eu-west/content/pii:S0926860X20304191/gr4/DOWNSAMPLED/image/jpeg/622f729407e443588f1426102d7c9e89/gr4.jpg gr4 gr4.jpg jpg 26707 299 341 IMAGE-DOWNSAMPLED 1-s2.0-S0926860X20304191-sc1.sml https://s3-eu-west-1.amazonaws.com/prod-ucs-content-store-eu-west/content/pii:S0926860X20304191/sc1/THUMBNAIL/image/gif/0878f49b18e4007902fdea6a8f3b070f/sc1.sml sc1 sc1.sml sml 9034 164 214 IMAGE-THUMBNAIL 1-s2.0-S0926860X20304191-gr1.sml https://s3-eu-west-1.amazonaws.com/prod-ucs-content-store-eu-west/content/pii:S0926860X20304191/gr1/THUMBNAIL/image/gif/e6e1d1f86fa6c3d7b9d096cc2f6cbd17/gr1.sml gr1 gr1.sml sml 5551 101 219 IMAGE-THUMBNAIL 1-s2.0-S0926860X20304191-gr2.sml https://s3-eu-west-1.amazonaws.com/prod-ucs-content-store-eu-west/content/pii:S0926860X20304191/gr2/THUMBNAIL/image/gif/0154390b6ff3001305230993e91ef91f/gr2.sml gr2 gr2.sml sml 6403 164 150 IMAGE-THUMBNAIL 1-s2.0-S0926860X20304191-ga1.sml https://s3-eu-west-1.amazonaws.com/prod-ucs-content-store-eu-west/content/pii:S0926860X20304191/ga1/THUMBNAIL/image/gif/b83d739b600be0f1031c1c4630c4ec3e/ga1.sml ga1 true ga1.sml sml 7132 102 219 IMAGE-THUMBNAIL 1-s2.0-S0926860X20304191-gr5.sml https://s3-eu-west-1.amazonaws.com/prod-ucs-content-store-eu-west/content/pii:S0926860X20304191/gr5/THUMBNAIL/image/gif/3f78e8f1b7ce7cf2055f043d061f84c6/gr5.sml gr5 gr5.sml sml 7082 138 219 IMAGE-THUMBNAIL 1-s2.0-S0926860X20304191-gr6.sml https://s3-eu-west-1.amazonaws.com/prod-ucs-content-store-eu-west/content/pii:S0926860X20304191/gr6/THUMBNAIL/image/gif/d67dd94245938dda3e6e5a935de347dd/gr6.sml gr6 gr6.sml sml 6420 135 219 IMAGE-THUMBNAIL 1-s2.0-S0926860X20304191-gr3.sml https://s3-eu-west-1.amazonaws.com/prod-ucs-content-store-eu-west/content/pii:S0926860X20304191/gr3/THUMBNAIL/image/gif/de87d8287400dd95e886d6a2d5549230/gr3.sml gr3 gr3.sml sml 13759 164 165 IMAGE-THUMBNAIL 1-s2.0-S0926860X20304191-gr4.sml https://s3-eu-west-1.amazonaws.com/prod-ucs-content-store-eu-west/content/pii:S0926860X20304191/gr4/THUMBNAIL/image/gif/fd965a093b0558453b0c474cbf4cc316/gr4.sml gr4 gr4.sml sml 8079 164 187 IMAGE-THUMBNAIL 1-s2.0-S0926860X20304191-sc1_lrg.jpg https://s3-eu-west-1.amazonaws.com/prod-ucs-content-store-eu-west/content/pii:S0926860X20304191/sc1/HIGHRES/image/jpeg/f19d99b592a6f9ffe1a109d514c3d182/sc1_lrg.jpg sc1 sc1_lrg.jpg jpg 314255 1926 2510 IMAGE-HIGH-RES 1-s2.0-S0926860X20304191-gr1_lrg.jpg https://s3-eu-west-1.amazonaws.com/prod-ucs-content-store-eu-west/content/pii:S0926860X20304191/gr1/HIGHRES/image/jpeg/fa9c0f0bf063314393bf855f41daa57a/gr1_lrg.jpg gr1 gr1_lrg.jpg jpg 233681 1161 2510 IMAGE-HIGH-RES 1-s2.0-S0926860X20304191-gr2_lrg.jpg https://s3-eu-west-1.amazonaws.com/prod-ucs-content-store-eu-west/content/pii:S0926860X20304191/gr2/HIGHRES/image/jpeg/4f1fb321afb7371a95b1a3047d66cb98/gr2_lrg.jpg gr2 gr2_lrg.jpg jpg 529958 2737 2510 IMAGE-HIGH-RES 1-s2.0-S0926860X20304191-ga1_lrg.jpg https://s3-eu-west-1.amazonaws.com/prod-ucs-content-store-eu-west/content/pii:S0926860X20304191/ga1/HIGHRES/image/jpeg/28ad636d13441f361504c4af983a20ec/ga1_lrg.jpg ga1 true ga1_lrg.jpg jpg 171331 886 1903 IMAGE-HIGH-RES 1-s2.0-S0926860X20304191-gr5_lrg.jpg https://s3-eu-west-1.amazonaws.com/prod-ucs-content-store-eu-west/content/pii:S0926860X20304191/gr5/HIGHRES/image/jpeg/5bdc0b96b659ba5781ce199506b24aaa/gr5_lrg.jpg gr5 gr5_lrg.jpg jpg 333180 1585 2510 IMAGE-HIGH-RES 1-s2.0-S0926860X20304191-gr6_lrg.jpg https://s3-eu-west-1.amazonaws.com/prod-ucs-content-store-eu-west/content/pii:S0926860X20304191/gr6/HIGHRES/image/jpeg/3ac704d5ae2d2bb15d3246b3434f7674/gr6_lrg.jpg gr6 gr6_lrg.jpg jpg 328577 1547 2510 IMAGE-HIGH-RES 1-s2.0-S0926860X20304191-gr3_lrg.jpg https://s3-eu-west-1.amazonaws.com/prod-ucs-content-store-eu-west/content/pii:S0926860X20304191/gr3/HIGHRES/image/jpeg/a91a5434ec8210046adfbc10518b2915/gr3_lrg.jpg gr3 gr3_lrg.jpg jpg 1659299 3162 3177 IMAGE-HIGH-RES 1-s2.0-S0926860X20304191-gr4_lrg.jpg https://s3-eu-west-1.amazonaws.com/prod-ucs-content-store-eu-west/content/pii:S0926860X20304191/gr4/HIGHRES/image/jpeg/5a41a7869c04a81bc254004878e80abd/gr4_lrg.jpg gr4 gr4_lrg.jpg jpg 212574 1322 1510 IMAGE-HIGH-RES 1-s2.0-S0926860X20304191-mmc1.docx https://s3-eu-west-1.amazonaws.com/prod-ucs-content-store-eu-west/content/pii:S0926860X20304191/mmc1/MAIN/application/vnd.openxmlformats-officedocument.wordprocessingml.document/5b0de9b7a9aafefdd1fbaf1367ede003/mmc1.docx mmc1 mmc1.docx docx 1205714 APPLICATION 1-s2.0-S0926860X20304191-am.pdf am am.pdf pdf 1393528 AAM-PDF https://s3-eu-west-1.amazonaws.com/prod-ucs-content-store-eu-west/content/egi:10BMDWH7LK6/MAIN/application/pdf/60439f2fd5aa3a038842b410f9b69357/am.pdf APCATA 117826 117826 S0926-860X(20)30419-1 10.1016/j.apcata.2020.117826 Elsevier B.V. Fig. 1 Time-course of propane dehydrogenation over Pt-Sn/SiO2 catalyst in the first and second runs (after regeneration): (a) Pt-Sn/SiO2, without H2, (b) Pt-Sn/SiO2, with H2, (c) Pt-Sn/SiO2 (R), (d) Pt-Sn/SiO2 (OR); Reaction conditions: catalyst weight, 50 mg; reaction temperature, 773 K; (a), (c), (d) P (C3H8) = 20.3 kPa; P (N2) = 81.0 kPa; (b) P (C3H8) = 20.3 kPa; P (H2) = 5.0 kPa; P (N2) = 76.0 kPa. Fig. 1 Fig. 2 XRD patterns of Pt-Sn/SiO2 catalyst. (a) Pt/SiO2, (b) Pt-Sn/SiO2, (c) reacted without H2, (d) reacted with H2, (e) Pt-Sn/SiO2 (R), (f) Pt-Sn/SiO2 (OR), (e’) reacted Pt-Sn/SiO2 (R) and (f’) reacted Pt-Sn/SiO2 (OR). ●: Pt3Sn; ▼: Pt0.94Sn0.06; ◼: PtSn. Fig. 2 Fig. 3 HAADF-STEM images and particle size distribution histograms of Pt-Sn/SiO2 catalyst: (a) the initial one, (b) reacted without H2, (c) reacted with H2. (Determined by counting about 200 bright dots from the HAADF-STEM images). Fig. 3 Fig. 4 Pt L3-edge XANES spectra of Pt-Sn/SiO2 catalyst and Pt foil. (a) Pt-Sn/SiO2, (b) reacted Pt-Sn/SiO2 without H2, (c) reacted Pt-Sn/SiO2 with H2, (d) Pt-Sn/SiO2 (R), (e) Pt-Sn/SiO2 (OR), (f) Pt foil. Fig. 4 Fig. 5 Sn K-edge XANES spectra of Pt-Sn/SiO2 catalyst and SnO2: (a) Pt-Sn/SiO2, (b) reacted Pt-Sn/SiO2 without H2, (c) reacted Pt-Sn/SiO2 with H2, (d) Pt-Sn/SiO2 (R), (e) Pt-Sn/SiO2 (OR), (f) Sn foil, (g) SnO, (h) SnO2. Fig. 5 Fig. 6 Pt and Sn XPS profiles of Pt-Sn/SiO2 catalyst reduced at 1073 K and the reacted and regenerated Pt-Sn/SiO2 catalysts. (A) Pt 4f level and (B) Sn 3d level spectra. (a) Pt-Sn/SiO2, (b) reacted Pt-Sn/SiO2 without H2, (c) reacted Pt-Sn/SiO2 with H2, (d) Pt-Sn/SiO2 (R), (e) Pt-Sn/SiO2 (OR), (f) reacted Pt-Sn/SiO2 (R), and (g) reacted Pt-Sn/SiO2 (OR). Fig. 6 Scheme 1 The models of Pt-Sn/SiO2 catalysts during propane dehydrogenation and the regeneration process. Scheme 1 Table 1 The amount of coke deposited on Pt-Sn/SiO2 catalysts. Table 1 Catalyst Coke amount (wt%) Pt-Sn/SiO2 0.0 reacted Pt-Sn/SiO2 without H2 2.8 reacted Pt-Sn/SiO2 with H2 0.7 Pt-Sn/SiO2 (R) 0.7 reacted Pt-Sn/SiO2 (R) 0.1 Pt-Sn/SiO2 (OR) 0.0 reacted Pt-Sn/SiO2 (OR) 0.6 Table 2 The XPS data of supported Pt-Sn catalysts. Table 2 Catalyst BEs (eV) Ratios Pt 4f7/2 Sn 3d5/2 Sn/Pt Pt/Si Sn/Si (Pt + Sn)/Si Pt-Sn/SiO2 71.3 486.2 1 6.0*10−3 6.0*10−3 12.1*10−3 reacted Pt-Sn/SiO2 without H2 72.1 487.1 1.6 3.5*10−3 5.5*10−3 9.0*10−3 reacted Pt-Sn/SiO2 with H2 71.4 486.7 1.1 5.1*10−3 5.9*10−3 11.0*10−3 Pt-Sn/SiO2 (R) 71.6 486.2 1.7 3.6*10−3 6.2*10−3 9.8*10−3 Pt-Sn/SiO2 (OR) 71.4 486.5 1.7 3.5*10−3 5.9*10−3 9.4*10−3 reacted Pt-Sn/SiO2 (R) 71.6 486.2 1.8 3.1*10−3 5.6*10−3 8.7*10−3 reacted Pt-Sn/SiO2 (OR) 71.4 486.4 1.9 3.1*10−3 5.9*10−3 9.0*10−3 Behavior of active species on Pt-Sn/SiO2 catalyst during the dehydrogenation of propane and regeneration Lidan Deng Investigation Writing - review & editing a Zijian Zhou Software Funding acquisition a * Tetsuya Shishido Conceptualization Supervision b c * a State Key Laboratory of Coal Combustion, Huazhong University of Science and Technology, Wuhan, 430074, China State Key Laboratory of Coal Combustion Huazhong University of Science and Technology Wuhan 430074 China State Key Laboratory of Coal Combustion, Huazhong University of Science and Technology, Wuhan 430074, China. b Department of Applied Chemistry for Environment, Graduate School of Urban Environmental Sciences, Tokyo Metropolitan University, 1-1 Minami-Osawa, Hachioji, Tokyo, 192-0397, Japan Department of Applied Chemistry for Environment Graduate School of Urban Environmental Sciences Tokyo Metropolitan University 1-1 Minami-Osawa Hachioji Tokyo 192-0397 Japan Department of Applied Chemistry for Environment, Graduate School of Urban Environmental Sciences, Tokyo Metropolitan University, 1-1 Minami-Osawa, Hachioji, Tokyo 192-0397, Japan c Elements Strategy Initiative for Catalysts & Batteries Kyoto University, Katsura, Nishikyo-ku, Kyoto, 615-8520, Japan Elements Strategy Initiative for Catalysts & Batteries Kyoto University Katsura, Nishikyo-ku Kyoto 615-8520 Japan Elements Strategy Initiative for Catalysts & Batteries Kyoto University, Katsura, Nishikyo-ku, Kyoto 615-8520, Japan ⁎ Corresponding authors. Graphical abstract Pt-Sn alloy nanoparticles supported on inert SiO2 were prepared and used in the dehydrogenation of propane. The bulk/surface properties of Pt-Sn alloys during reactions and regeneration reactions and regenerations were investigated by transmission electron microscopy, X-ray diffraction, X-ray absorption fine structure, and X-ray photoelectron spectroscopy. Thermogravimetric analysis showed that small amounts of coke formed on the reacted catalysts, and the Pt-Sn interactions were also weakened during the reaction. Sn enrichment occurred on the catalyst surface after the first and second reaction cycles. Fortunately, a small amount of co-fed H2 inhibited Sn segregation from Pt-Sn alloys and retained the active structure. The regeneration processes, especially the “oxidation-reduction” method, strengthened Pt-Sn interactions while concurrently burning off coke, allowing partial recovery of the catalytic performance. This work indicates the key role of the special geometric arrangements of Pt-Sn alloys in the dehydrogenation of propane. Keywords Pt-Sn/SiO2 Dehydrogenation Propylene Deactivation Regeneration 1 Introduction The shale gas revolution in North America has produced an abundance of cheap propane [1], and the market demand for propylene has steadily increased because propylene is an important chemical building block [2]. The catalytic dehydrogenation of propane to propylene (PDH) is an attractive process for directly converting propane to more valuable propylene [3–7]. Honeywell UOP (Oleflex) has commercialized this process using an alumina-supported Pt catalyst operated on a moving bed reactor [3]. Despite high initial propylene yields, these supported Pt catalysts are prone to deactivation and often have short lifetimes [3,4]; therefore, it is important to develop highly stable catalysts with long-term activities for PDH, which requires a fundamental understanding of the causes of catalyst deactivation. Many studies have attributed catalyst deactivation to coke formation [8–11]. Propane dehydrogenation is an endothermic reaction that requires high temperatures (>500 °C) to obtain high propylene yields. Under these operating conditions, C3 species such as propylene are dehydrogenated to C1 and C2 species, which may serve as coke precursors. Through side reactions such as hydrogenolysis, cracking, oligomerization, cyclization, and aromatization, coke can form and block the active sites of catalysts, which impedes the catalytic activity and eventually deactivating the catalysts. Weckhuysen [10] carried out propane dehydrogenation at 590 ℃ for 6 h using Pt/Al2O3 catalyst, and thermogravimetric analysis showed that about 8.2 % coke was deposited on the spent catalyst. The addition of Sn inhibited coke formation by alloying with Pt. Relevant studies explained that Sn facilitates the desorption of the propylene product and increases the propylene selectivity [12,13]. Besides modifying Pt, the support also greatly influences the stability of Pt-Sn catalysts [14]. The supports with strong acidic sites such as γ-Al2O3 can catalyze side reactions such as isomerization, cracking, and polymerization, which enhance coke formation [11,15]. The stability of ZSM-5 zeolite-supported Pt-Sn was also unsatisfactory due to ZSM-5′s high acidity, which induced coke accumulation [16]. Thus, doping alkali (earth) metals such as Na [16], K [17], and Ca [18] or rare-earth metal La [19] in γ-Al2O3 or ZSM-5 has been studied to improve the catalyst stability by decreasing the catalyst acidity. The addition of Sn and the use of a support with fewer/weaker acid sites can inhibit coke formation, so we prepared SiO2 or SBA-15-supported Pt-Sn alloy catalysts for lower alkane dehydrogenation in previous studies [20–23]. Due to the inertness of SiO2 and the formation of a Pt3Sn alloy, the catalyst showed high resistance to coke formation; however, the initial high activity of the catalyst gradually deactivated over time [20,21,24]. Coked catalysts can be regenerated to restore their activity, and regeneration treatments typically involve exposing a coked catalyst to air at high temperatures to burn off coke deposits, followed by a reduction step that reactivates the catalyst (i.e., Pt-Sn alloys). Weckhuysen [10] found that after one regeneration process, Pt-Sn/Al2O3 catalyst possessed a different activity and coke formation in subsequent dehydrogenation cycles. These observations suggest that coke formation is not the only reason for the deactivation of Pt-Sn catalyst during propane dehydrogenation. Besides coke, the structural and electronic properties of the active species on Pt-Sn/SiO2 during reactions and regeneration should be considered. Bimetallic catalysts have complex structures that often differ depending on the reaction atmosphere (oxidizing, reductive, inert), temperature, and so on [25–30]. Flexible and tunable structural changes of Pt-Sn bimetallic catalysts also occurred under certain conditions. Uemura [31,32] treated a Pt-Sn bimetallic catalyst in oxygen at high temperatures, followed by a reduction step, and investigated the structure with in situ X-ray absorption fine structure (XAFS). Pt3Sn alloy nanoparticles on Al2O3 transformed into metallic Pt and SnO2 during oxidation and then returned to Pt3Sn alloy in reduction by H2. Weckhuysen [10] also used XAFS to reveal a gradual Sn enrichment on the alloy surface after various dehydrogenation-regeneration cycles. Although the aforementioned works provide valuable knowledge about coke formation and the structural properties of Pt-Sn bimetallic systems during PDH, there is still no comprehensive understanding of the catalyst deactivation mechanism. Particularly, no studies have reported conclusive information regarding the basic principles of catalyst deactivation and regeneration of supported Pt-Sn catalysts for the dehydrogenation of lower alkanes. To comprehensively analyze catalyst deactivation, there is a need to establish an analysis procedure that integrates coke characterization with the behavior of active species on Pt-Sn/SiO2 catalysts during the dehydrogenation of propane and regeneration. Therefore, this work systemically investigates Pt-Sn/SiO2 catalysts during their use and regenerations using a combination of TG-DTA, TEM, XRD, XAFS, and XPS. Based on these results, the causes of Pt-Sn/SiO2 deactivation are discussed. We hope these findings will be helpful to rationally design active Pt-based catalysts with high stabilities for propane dehydrogenation. 2 Experimental 2.1 Catalyst preparation SiO2 (JRC-SIO-9, 334 m2 g−1) was used to support Pt-Sn active species. Before impregnation, SiO2 was calcined at 773 K for 3 h in air. Pt/SiO2 with 3 wt% Pt was prepared by impregnating SiO2 support with an aqueous solution of H2PtCl6･6H2O (Wako, 99.9 %) at 353 K for 3 h and dried at 353 K for 20 h. The obtained precipitate was noted as Pt/SiO2 precursor. A bimetallic Pt-Sn/SiO2 precursor with a 1.0 M ratio of Sn: Pt was prepared by impregnating the Pt/SiO2 precursor with an acetone solution of SnCl2･2H2O (Wako, 97 %) at 353 K for 3 h and drying at 353 K for 20 h. 2.2 Dehydrogenation of propane Before the reaction, the catalyst precursor (50 mg) was loaded in a quartz reactor (i.d. 10 mm) and reduced in situ by 20 vol% H2 diluted with N2 (total flow rate: 50 mL min−1) at 1073 K for 1 h to obtain the initial Pt-Sn/SiO2 catalyst. The temperature was then decreased to 773 K in N2 (100 mL min−1). After reduction, a gas mixture of C3H8 and N2 (20/80, 100 mL min-1) was introduced to the reactor. The reaction then proceeded at 773 K for 7 h with 20,000 h-1 of gas hourly space velocity (GHSV). The catalyst after the catalytic reaction was noted as “reacted Pt-Sn/SiO2”. A gas mixture of C3H8/H2/N2 (20/5/75) was used as the feed gas. The catalyst after the catalytic reaction was noted as “reacted Pt-Sn/SiO2 with H2”. The gas composition was analyzed with an on-line gas chromatograph (Shimadzu GC-8A, Japan) equipped with TCD (Molecular Sieve 5A column) and methanizer FID (Porapak-Q column) detectors. 2.3 Catalyst regeneration processes (1) Regeneration with reduction After 7 h of propane dehydrogenation, the sample was regenerated at 1073 K in a mixture of H2 (10 mL min−1) and N2 (40 mL min−1) for 1 h. Then, the catalyst was cooled to 773 K in N2 (100 mL min−1). The catalyst regenerated using the reduction method was noted as “Pt-Sn/SiO2 (R)”. (2) Regeneration with oxidation-reduction After the propane dehydrogenation proceeded for 7 h, the sample was regenerated at 773 K in a gas mixture of O2 (10 mL min−1) and N2 (40 mL min−1) for 1 h, followed by reduction at 1073 K in a mixture of H2 (10 mL min−1) and N2 (40 mL min−1) for another 1 h. The obtained catalyst was cooled to 773 K in N2 (100 mL min−1). This regenerated catalyst with oxidation-reduction was noted as “Pt-Sn/SiO2 (OR)”. 2.4 Characterization X-ray diffraction (XRD) patterns were obtained using a RINT-TTR III powder X-ray diffractometer (Rigaku, Tokyo, Japan) with Cu Kα radiation (λ=1.5405 Å, 50 kV, 300 mA). Samples were scanned from 2θ = 38° to 46° at a scanning resolution of 0.01°. High angle annular dark field-scanning transmission electron microscope (HADDF-STEM) images were obtained using a JEOL JEM-3200FS transmission electron microscope. Samples were prepared by depositing drops of ethanol suspensions containing small amounts of the powders onto carbon-coated copper grids (Okenshoji Co., Ltd.), followed by evaporation of ethanol in the air. X-ray absorption experiments were carried out at the BL01B1 at SPring-8 (Hyogo, Japan). The ring energy was 8 GeV, and the stored current was 99.5 mA. The Pt L3-edge (11.56 keV) X-ray absorption spectra were recorded using a Si (111) monochromator in transmission mode in the air at room temperature. Sn K-edge (29.19 keV) X-ray absorption spectra were recorded using a Si (311) monochromator in fluorescence mode in the air at room temperature. Data processing was performed using REX2000 Ver.2.5.9 (Rigaku) and FEFF8.40 programs. Pt foil and Sn foil were purchased from Nilaco Corp., and SnO2 (98 %) was purchased from Wako Corp. X-ray photoelectron spectra (XPS) were acquired using an ULVAC PHI 5500 M T with Mg Kα radiation (15 kV, 400 W) in a chamber with a base pressure of ∼10−7 Pa. All spectra were calibrated using Si 2p (103.5 eV) as the reference. Peak fitting was performed for Sn 3d5/2 using XPSPeak 4.1 software (UK Surface Analysis Forum). The Shirley function was used for background subtraction. The amount of coke formed over the Pt-Sn/SiO2 catalyst after the reaction for 7 h at 773 K was measured by thermogravimetric-differential thermal analysis (TG-DTA, Shimadzu DTG-60H, Japan) in air. 3 Results 3.1 Propane dehydrogenation Fig. 1 shows the propane conversion over Pt-Sn/SiO2 catalyst in the first run. In the absence of hydrogen in the feed gas, the initial propane conversion was 23.7 %, which decreased to 15.5 % after 7 h. The amount of coke on the reacted Pt-Sn/SiO2 catalyst was estimated to be ca. 2.8 wt% by TG-DTA (Table 1 ). This was smaller than the 7.3 wt% on Pt-Sn/Al2O3 (after 6 h of reaction at 590 ℃) reported by Weckhuysen [10], and 4.9 wt% on Pt-Sn/ZnAl2O4 (after 4 h of reaction and 600 ℃) reported by Vu [9]. This lower value was probably due to the lower reaction temperature (500 ℃) and the amorphous SiO2 support used in this study. The acid strength of SiO2 is weaker than Al2O3 and ZnAl2O4; thus, it inhibited propylene dehydrogenation or intermediate adsorption (coke precursors) on SiO2-supported catalysts. In the presence of hydrogen, the initial propane conversion was 23.4 %, which was very similar to the case without hydrogen; however, it slightly decreased throughout the reaction and was 19.1 % after 7 h, suggesting a lower catalyst deactivation rate when a small amount of hydrogen was added to the feed gas. The amount of coke on reacted Pt-Sn/SiO2 was very small (ca. 0.7 %), which shows that adding hydrogen to the feed gas inhibited coke formation and improved the stability of Pt-Sn/SiO2 catalyst. The Pt-Sn/SiO2 catalyst after the first reaction run without H2 co-feeding was regenerated with H2 at 1073 K for 1 h (Reduction method, denoted as Pt-Sn/SiO2 (R)) or with O2 at 773 K for 1 h and subsequent H2 reduction at 1073 K for 1 h (oxidation-reduction method, denoted as Pt-Sn/SiO2 (OR)). Table 1 shows that both regeneration methods eliminated the coke formed on the reacted Pt-Sn/SiO2 catalyst. The amount of coke remaining on Pt-Sn/SiO2 (R) was only 0.7 %, and no coke remained on Pt-Sn/SiO2 (OR). The catalytic activities of the regenerated catalysts (the second reaction run) are shown in Fig. 1. Using the Reduction method, the activity of the Pt-Sn/SiO2 catalyst slightly recovered (16.5 %). In contrast, it was remarkably recovered using the oxidation-reduction method, and the initial propane conversion of Pt-Sn/SiO2 (OR) was 20.2 %. In the second run, however, the activities of regenerated Pt-Sn/SiO2 catalysts via the two regeneration methods gradually decreased without H2 co-feeding. The propane conversion using Pt-Sn/SiO2 (R) decreased to 9.9 % after 7 h, and the conversion using Pt-Sn/SiO2 (OR) decreased from 20.2%–13.0% after 7 h. Moreover, the amount of coke formed during the second run was different from that in the first run, and only 0.1 % coke was formed on the reacted Pt-Sn/SiO2 (R), while 0.6 % was formed on the reacted Pt-Sn/SiO2 (OR). 3.2 Coke deposition on catalysts Figure S1 shows the TG/DTA curves of the catalysts, which shows that little coke was deposited on these catalysts (Table 1). When we carried out propane dehydrogenation at 500 ℃ for 7 h with SiO2-supported Pt-Sn catalysts, only about 2.8 % coke was deposited on the spent catalysts. When H2 was co-fed in the reaction gas, only 0.7 % coke was detected. Although both regeneration methods eliminated coke, the efficiency of hydrogen in the “reduction” method was lower than that of oxygen in the “oxidation-reduction” method, which completely burned the coke off. In the second reaction cycle, very little coke was deposited on reacted Pt-Sn/SiO2 (R) and Pt-Sn/SiO2 (OR). 3.3 XRD patterns of the catalysts Fig. 2 shows the XRD patterns of the Pt-Sn/SiO2 catalysts. As the reference, the Pt/SiO2 catalyst contains two diffraction peaks at 2θ = 39.8° and 46.3°, corresponding to the (111) and (200) of face-centered cubic (FCC) Pt [33,34]. Before the reaction, the Pt-Sn/SiO2 pattern contained diffraction peaks attributed to Pt3Sn alloy (ICSD 105,796) and PtSn alloy (ICSD 105,796) [34]. These peaks were detailedly assigned to Pt3Sn(111) (2Ө = 38.96°), PtSn(102) (2Ө = 41.73°), PtSn(110) (2Ө = 44.08°), and Pt3Sn(200) (2Ө = 45.28°) [35]. A small peak appeared near 2Ө = 39.6°, which was assigned to Pt0.94Sn0.06 alloy (ICSD 105,798). Its crystal structure was FCC, similar to Pt metal and Pt3Sn (Fig. S2). No diffraction peaks of Sn compounds, such as Sn metal or Sn oxides (SnO and SnO2), were observed. The XRD patterns of reacted Pt-Sn/SiO2 catalysts (Fig. 2c and d) were similar to that of the fresh catalyst, which indicated that the crystal structure of Pt species did not significantly change throughout the reaction with or without co-fed H2. Although no significant changes were observed in the patterns of the regenerated catalysts (Fig. 2e and f), the intensity of the diffraction peaks of PtSn alloy over Pt-Sn/SiO2 (R) was slightly stronger than that of Pt-Sn/SiO2 (OR), while the diffraction peak intensity of Pt3Sn alloy remained unchanged. This suggests that the “oxidation-reduction” regeneration method favors the formation of Pt3Sn alloy. After the second reaction run of the regenerated catalysts, Pt-Sn/SiO2 (R) (Fig. 2e) and reacted Pt-Sn/SiO2 (R) (Fig. 2e’) exhibited similar patterns. In contrast, the intensity of the Pt3Sn and PtSn alloy diffraction peaks over Pt-Sn/SiO2 (OR) increased slightly. 3.4 HADDF-STEM images of Pt-Sn/SiO2 An increase in the metal nanoparticle size in heterogeneous catalysis is referred to as sintering [36], which is often regarded as an important reason for the loss of catalyst activity because it decreases the number of active sites. Fig. 3 shows the HAADF-STEM images of Pt-Sn/SiO2 catalysts before and after the reaction. According to the particle size distribution, the average size of Pt-Sn alloy nanoparticles on the fresh catalyst was 1.7 ± 0.7 nm. After propane dehydrogenation, the average particle size was 1.2 ± 0.5 nm on the reacted catalyst with H2 co-feeding, and 1.2 ± 0.6 nm without H2 co-feeding. No Pt-Sn alloy nanoparticle sintering was observed after 7 h of reaction. Fig. S3 also shows HAADF-STEM images of Pt-Sn/SiO2(R), Pt-Sn/SiO2(OR), reacted Pt-Sn/SiO2(R), and reacted Pt-Sn/SiO2(OR). Their average particle sizes were similar to each other and were only slightly different during regeneration and the second reaction run. 3.5 XAFS analysis 3.5.1 Pt L3-edge XAFS The Pt L3-edge X-ray absorption white lines correspond to electronic transitions of 2p3/2 core-level states and indicate the final vacant d states of both the 5d3/2 and 5d5/2 levels of platinum [37,38]. Lytle et al. [37] reported that the intensity of the Pt L3 X-ray absorption spectra is concerned to the d-electron valences and the chemical environments of Pt atoms. Fig. 4 shows the Pt L3-edge XANES spectra of Pt-Sn/SiO2 catalysts and Pt foil. The white line intensity at the Pt L3-edge of the initial catalyst (Pt-Sn/SiO2 reduced at 1073 K) was slightly lower than that of Pt foil, which indicated electron donation from Sn to Pt due to alloying between Pt and Sn. Uemura et al. [31,32] reported a lower white line intensity of Pt in Pt-Sn/Al2O3 than in Pt foil. Kim et al. [39] also reported that the intensity of the white line at the Pt L3-edge was lower in Pt-Sn/C catalysts than Pt/C catalysts. They attributed this decreased intensity to the formation of a Pt-Sn alloy since the d-electron density of Pt atoms increased when alloyed with Sn atoms, which are less electronegative than Pt. The k 3-weighted EXAFS oscillation at the Pt L3-edge of Pt-Sn/SiO2 catalysts and Pt foil is displayed in Fig. S4, which also confirmed the alloy nature of Pt-Sn species. Fig. 4 shows that the white line intensities at Pt L3-edge of reacted Pt-Sn/SiO2 catalysts were quite similar to the initial catalyst (Fig. 4(B)), which indicated that Pt has a similar d-electron density before and after the reaction. Compared with reacted Pt-Sn/SiO2 without H2, the peak positions at the Pt L3-edge of regenerated Pt-Sn/SiO2 (Pt-Sn/SiO2 (R) and Pt-Sn/SiO2 (OR)) shifted to higher energies with similar white line intensities, as shown in Fig. 4(C). This implied that the fraction of Pt-Sn alloys changed during regeneration. 3.5.2 Sn K-edge XANES spectra Fig. 5 shows the Sn K-edge XANES spectra of Pt-Sn/SiO2 catalysts and reference samples (Sn foil and SnO2). The absorption band intensity of the initial catalyst was higher than that of Sn foil, but lower than that of SnO2. The absorption band intensity of reacted Pt-Sn/SiO2 ((b) and (c)) was nearly the same as the initial one. Moreover, the absorption band intensities of regenerated Pt-Sn/SiO2 were also similar to those of reacted Pt-Sn/SiO2, regardless of the regeneration method. These results suggest that a mixture of Sn(0) and Sn cations (Sn(II) and Sn(IV)) were present on the fresh, reacted, and regenerated Pt-Sn/SiO2 catalysts. 3.6 XPS analysis of Pt-Sn/SiO2 Both XRD and XAFS, which penetrate the entire sample, are bulk characterization techniques, but XPS is a surface-sensitive technique whose signals arise within a few nanometers of the outermost layers of a sample. Thus, XPS can be used to reflect the chemical environment of the catalyst surface that contacts gases or liquids during heterogeneous catalysis. The Pt 4f and Sn 3d XPS data in Fig. 6 a and Table 2 show that the binding energies of Pt 4f7/2 and 4f5/2 peaks in the Pt-Sn/SiO2 catalyst were 71.3 and 74.6 eV. The state of Pt0 on the catalyst was indicated. After 7 h of reaction with or without H2, the intensity of the Pt 4f7/2, 4f5/2 peak in the reacted catalyst (spectrum (b) or (c)) greatly decreased. Similarly, the intensities of the Sn peak decreased in the reacted catalysts, especially for reacted Pt-Sn/SiO2 without H2 because coke deposition may have attenuated the surface Pt and Sn signals. The reacted catalyst with H2 co-feeding possessed slightly stronger Pt and Sn signals than in the absence of H2, and the amount of coke formed on the previous one is consistently smaller than that on the latter. More importantly, the position of the Pt 4f7/2, 4f5/2 peaks in the catalyst reacted without H2 co-feeding shifted to a higher binding energy, which indicated that the chemical states of surface Pt atoms in the Pt-Sn alloy changed during the reaction. Coincidentally, the binding energy of the Sn 3d5/2 peak over the reacted catalyst without H2 was also higher than those of the initial catalyst and the reacted catalyst with H2, suggesting a weakening of Pt-Sn interactions in alloys. The deconvoluted Sn 3d5/2 XPS spectra (Fig. S5 (A)) revealed that the surface ratio of Sn0/SnIV on the fresh catalyst was 33:67. After 7 h of reaction in the absence of H2, the surface ratio of Sn0/SnIV was remarkably lower (Fig. S5 (C)). It seems that surface SnIV enrichment in Pt-Sn alloys occurred during the reaction, especially in the absence of H2 in the feed gas. The geometric arrangement Pt and Sn atoms in Pt-Sn alloys may have changed, which was also verified by the different Sn/Pt ratios over the initial and reacted catalysts (Table 2). The Sn/Pt ratio was 1 in the initial (unreacted) catalyst, which is consistent with the added amount of Sn and Pt during catalyst preparation; however, this ratio increased to 1.6 in the reacted catalyst in the absence of co-fed H2, which suggests Sn segregation from Pt-Sn alloys during the reaction. Fortunately, the small amount of co-fed H2 inhibited such Sn enrichment on the catalyst surface, and an Sn/Pt ratio of 1.1 preserved the high activity of Pt-Sn alloys. The Sn/Pt ratios of reacted Pt-Sn/SiO2 (R) (Sn/Pt = 1.8) and Pt-Sn/SiO2 (OR) (Sn/Pt = 1.9) after the second reaction cycle continuously increased without co-fed H2. After regenerating the Pt-Sn/SiO2 catalyst reacted without H2, the Pt 4f7/2, 4f5/2 peaks of Pt-Sn/SiO2 (R) and Pt-Sn/SiO2 (OR) catalysts (spectrum (d) and (e) in Fig. 6(A)) shifted towards lower binding energy, and showed the similar position to the initial Pt-Sn/SiO2 catalyst. The Sn 3d5/2 peaks of Pt-Sn/SiO2 (R) and Pt-Sn/SiO2 (OR) catalysts (spectrum (d) and (e) in Fig. 6(B)) slightly shifted to lower binding energies than the reacted catalyst without H2. However, neither the “Reduction” treatment nor “Oxidation-Reduction” regeneration methods completely recovered the surface properties of the reacted catalyst compared with the initial catalyst (spectrum (a) in Fig. 6). The intensities of the Pt and Sn XPS signals of Pt-Sn/SiO2 (OR) and Pt-Sn/SiO2 (R) catalysts were lower. Fig. S6 shows the XRD patterns of Pt-Sn/SiO2 (OR), Pt L3-edge XANES spectra, and Sn K-edge XANES spectra of oxidized reacted Pt-Sn/SiO2 in the air at 773 K for 1 h, and Pt-Sn/SiO2 (OR). The oxidation of reacted catalysts in the air at 773 K for 1 h formed Pt and SnO2, and subsequent reduction in H2 resulted in Pt-Sn alloying. Moreover, no obvious peak shifts over the regenerated catalysts were observed in the second reaction run (spectrum (f) and (g) in Fig. 6), probably due to the weak peak intensity. After the second reaction run, the reacted Pt-Sn/SiO2 (R) and reacted Pt-Sn/SiO2 (DR) showed similar Pt and Sn XPS signals to Pt-Sn/SiO2 (R) and Pt-Sn/SiO2 (DR). 4 Discussion Coke formation is often the principal cause of deactivation in the petrochemical industry due to high operation temperatures [40]. For the supported-metal catalysts used in propane dehydrogenation, coke is normally deposited on both the metal and the acid support [11]. On the metal, a coke precursor will be generated if propane is deeply dehydrogenated or polymerized. This coke can migrate to acid sites on the supports, and undergo polymerization/oligomerization, condensation, cyclization, and hydride transfer, resulting in the formation of additional coke [8,15]; therefore, coke accommodate over highly acidic supports such as Al2O3 [17,19] and ZSM-5 [18], resulting in poor stabilities. In this work, SiO2 was used as the support. Due to its surface inertness (low acidity) [14], coke formation on the Pt-Sn/SiO2 catalyst prepared by the direct reduction method (H2 atmosphere, 1073 K, 1 h) was significantly decreased. The highest coke amount was only about 2.8 % on the spent catalyst in the absence of H2 in the feed gas. XPS analysis of this catalyst shows that coke formation on the catalyst surface weakened the XPS signals of both Pt and Sn. During the regeneration stage, both “reduction” and “oxidation-reduction” methods eliminated coke formed on the reacted Pt-Sn/SiO2 catalyst without H2, even though hydrogen was less efficient in the “reduction” method than oxygen in the “oxidation-reduction” method. Only 0.7 % coke remained on Pt-Sn/SiO2 (R), and no coke remained on Pt-Sn/SiO2 (OR). More interestingly, less coke formed during the second reaction run, with only 0.6 % on reacted Pt-Sn/SiO2 (OR), and the coke on the reacted Pt-Sn/SiO2 (R) decreased from 0.7 % to 0.1 %; however, the activities of both Pt-Sn/SiO2 (R) and Pt-Sn/SiO2 (OR) decreased with the reaction time, indicating poor stabilities. These results indicated that besides coke formation, other factors were responsible for catalyst deactivation during the second reaction run. TEM images showed no obvious metal particle aggregation after reaction and regenerations. XRD analysis and XAFS spectra confirmed the formation of Pt-Sn alloys over these catalysts, but the fraction of bulk Pt-Sn alloy phases changed slightly during the reactions and regenerations, and the atomic environments of Pt and Sn were also slightly different, as reflected by the XAFS spectra. The Sn 3d5/2 peak of reacted Pt-Sn/SiO2 catalyst without H2 in the first reaction run shifted towards a higher binding energy than the peaks over the initial catalyst and the reacted Pt-Sn/SiO2 catalyst with H2. This suggested that more surface Sn oxides were present on the reacted Pt-Sn/SiO2 catalyst without H2. Virnovskaia [41] once found that when pure PtSn2 alloy going form reduction to reaction conditions, the amount of reduced Sn decreased to <10 %. In the case of propane dehydrogenation, alloyed Sn (Sn°) may separate from Pt-Sn alloys when the reaction atmosphere is a mixture of propane and nitrogen. The addition of small amounts of H2 to the feed gas (5%) appears to help retain Pt-Sn alloys. The separation of alloyed Sn was inhibited, and the catalyst stability during 7 h of reaction was greatly improved. H2 addition in the feed gas also inhibited coke formation by reducing the formation of coke precursor by inhibiting deep propane dehydrogenation over metal sites. The amount of coke formed on the spent catalyst with H2 was only about 0.7 %. Therefore, besides coke formation, the separation of alloyed Sn and weakened Pt-Sn interactions also contributed to catalyst deactivation. The surface fraction of Pt-Sn alloys, their morphologies, or their detailed surface atomic arrangements on Pt-Sn/SiO2 likely changed after propane dehydrogenation and regeneration (Scheme 1 ). 5 Conclusions The catalytic deactivation and regeneration over Pt-Sn/SiO2 catalyst during propane dehydrogenation were investigated by catalytic tests and characterization techniques. It was found that: (1) About 2.8 wt% coke deposited on the reacted catalyst after 7 h of reaction without H2 feed. A small amount of H2 in the feed gas effectively decreased the coke amount and improved the catalyst stability, and only 0.7 wt% coke formed on the reacted catalyst in the presence of H2. The subsequent “Reduction” or “Oxidation-Reduction” regeneration methods resulted in the partial or complete elimination of coke deposited on the reacted catalyst. A trace amount of coke formed during the second reaction run. (2) The HAADF-STEM images showed that dispersed Pt was stable before and after propane dehydrogenation for 7 h. The particle sizes remained in the range of ca. 1.2–1.7 nm, suggesting that no particle sintering occurred. (3) The surface composition of Pt-Sn alloys and their morphologies probably redistributed during the reactions and regeneration. The addition of H2 in the feed gas appeared to help retain the surface states of active species on fresh Pt-Sn/SiO2 catalysts during the reaction. The “reduction” regeneration method partially regenerated the active Pt-Sn alloy phases. With respect to oxidation-reduction regeneration, Sn segregated from the Pt-Sn alloy during the calcination step and then re-alloyed with Pt under reduction conditions. This phenomenon led to strong interactions between Pt and Sn, which resulted in a greater recovery in the catalytic activity over the reacted catalyst. CRediT authorship contribution statement Lidan Deng: Investigation, Writing - review & editing. Zijian Zhou: Software, Funding acquisition. Tetsuya Shishido: Conceptualization, Supervision. Declaration of Competing Interest The authors report no declarations of interest. Acknowledgments This work was supported by the National Natural Science Foundation of China (51906078), the Grants-in-Aid for Scientific Research (B) of Japan (17H03459). The XAFS experiments at SPring–8 were carried out with approval (proposal No. 2014B1036 and 2015A1389). Appendix A Supplementary data Supplementary material related to this article can be found, in the online version, at doi:https://doi.org/10.1016/j.apcata.2020.117826. Appendix A Supplementary data The following is Supplementary data to this article: References [1] P.C. Bruijnincx B.M. Weckhuysen Angew. Chem. Int. Ed. 52 2013 11980 11987 P.C. Bruijnincx, B.M. Weckhuysen, Shale gas revolution: an opportunity for the production of biobased chemicals, Angew. Chem., Int. Ed. 52 (2013) 11980-11987. [2] E. McFarland Science 338 2012 340 342 E. McFarland, Unconventional chemistry for unconventional natural gas, Science 338 (2012) 340-342. [3] J.J. Sattler J. Ruiz-Martinez E. Santillan-Jimenez B.M. Weckhuysen Chem. Rev. 114 2014 10613 10653 J.J. Sattler, J. Ruiz-Martinez, E. Santillan-Jimenez, B.M. Weckhuysen, Catalytic dehydrogenation of light alkanes on metals and metal oxides, Chem. Rev. 114 (2014) 10613-10653. [4] Z. Nawaz Rev. Chem. Eng. 31 2015 413 436 Z. Nawaz, Light alkane dehydrogenation to light olefin technologies: a comprehensive review, Rev. Chem. Eng. 31 (2015) 413-436. [5] O.O. James S. Mandal N. Alele B. Chowdhury S. Maity Fuel Process. Technol. 149 2016 239 255 O.O. James, S. Mandal, N. Alele, B. Chowdhury, S. Maity, Lower alkanes dehydrogenation: strategies and reaction routes to corresponding alkenes, Fuel Process. Technol. 149 (2016) 239-255. [6] J.T. Grant C.A. Carrero F. Goeltl J. Venegas P. Mueller S.P. Burt S.E. Specht A.C.W.P. McDermott I. Hermans Science 354 2016 1570 1573 J. T. Grant, C. A. Carrero, F. Goeltl, J. Venegas, P. Mueller, S. P. Burt, S. E. Specht, A.C. W.P.McDermott, I. Hermans, Selective oxidative dehydrogenation of propane to propene using boron nitride cataysts, Science 354 (2016) 1570-1573. [7] Zhiping Han Shuirong Li Feng Jiang Tuo Wang Xinbin Ma J. Gong Nanoscale 6 2014 10000 10008 Zhiping Han, Shuirong Li, Feng Jiang, Tuo Wang, Xinbin Ma, J. Gong, Propane dehydrogenation over Pt–Cu bimetallic catalysts: the nature of coke deposition and the role of copper, Nanoscale 6 (2014) 10000-10008. [8] Qing Li Zhijun Sui Xinggui Zhou Yian Zhu Jinghong Zhou D. Chen Top. Catal. 54 2011 888 896 Qing Li, Zhijun Sui, Xinggui Zhou, Yian Zhu, Jinghong Zhou, D. Chen, Coke formation on Pt–Sn/Al2O3 catalyst in propane dehydrogenation coke characterization and kinetic study., Top. Catal. 54 (2011) 888-896. [9] B.K. Vu M.B. Song I.Y. Ahn Y.-W. Suh D.J. Suh W.-I. Kim H.-L. Koh Y.G. Choi E.W. Shin Appl. Catal. A Gen. 400 2011 25 33 B. K. Vu, M. B. Song, I. Y. Ahn, Y-W. Suh, D. J. Suh, W-I. Kim, H-L. Koh, Y. G. Choi, E. W. Shin, Pt–Sn alloy phases and coke mobility over Pt–Sn/Al2O3 and Pt–Sn/ZnAl2O4 catalysts for propane dehydrogenation, Appl. Catal., A 400 (2011) 25-33. [10] A. Iglesias-Juez A.M. Beale K. Maaijen T.C. Weng P. Glatzel B.M. Weckhuysen J. Catal. 276 2010 268 279 A. Iglesias-Juez, A. M. Beale, K. Maaijen, T.C. Weng, P. Glatzel, B.M. Weckhuysen, A combined in situ time-resolved UV-Vis, Raman and high-energy resolution X-ray absorption spectroscopy study on the deactivation behavior of Pt and Pt-Sn propane dehydrogenation catalysts under industrial reaction conditions, J. Catal. 276 (2010) 268-279 [11] H.-Z. Wang L.-L. Sun Z.-J. Sui Y.-A. Zhu G.-H. Ye D. Chen X.-G. Zhou W.-K. Yuan Ind. Eng. Chem. Res. 57 2018 8647 8654 H.-Z. Wang, L.-L. Sun, Z.-J. Sui, Y.-A. Zhu, G.-H. Ye, D. Chen, X.-G. Zhou, W.-K. Yuan, Coke formation on Pt–Sn/Al2O3 catalyst for propane dehydrogenation, Ind. Eng. Chem. Res. 57 (2018) 8647-8654. [12] M.-L. Yang Y.-A. Zhu X.-G. Zhou Z.-J. Sui D. Chen ACS Catal. 2 2012 1247 1258 M.-L. Yang, Y.-A. Zhu, X.-G. Zhou, Z.-J. Sui, D. Chen, First-principles calculations of propane dehydrogenation over PtSn catalysts, ACS Catal. 2 (2012) 1247-1258. [13] L. Nykänen K. Honkala ACS Catal. 3 2013 3026 3030 L. Nykänen, K. Honkala, Selectivity in propene dehydrogenation on Pt and Pt3Sn surfaces from first principles, ACS Catal. 3 (2013) 3026-3030. [14] Y.W. Zhang Y.M. Zhou J.J. Shi S.J. Zhou X.L. Sheng J. Mol. Catal. A-Chem. 381 2014 138 147 Y. W. Zhang, Y.M. Zhou, J.J. Shi, S. J. Zhou, X.L. Sheng, Comparative study of bimetallic Pt-Sn catalysts supported on different supports for propane dehydrogenation, J. Mol. Catal. A-Chem. 381 (2014) 138-147 [15] O.A. Barias A. Holmen E.A. Blekkan J. Catal. 158 1996 1 12 O. A. Barias, A. Holmen, E. A. Blekkan, Propane dehydrogenation over supported Pt and Pt–Sn catalysts: catalyst preparation, characterization and activity measurements, J. Catal. 158 (1996) 1-12. [16] S. Zhou Y. Zhou Y. Zhang X. Sheng Z. Zhang J. Chem. Technol. Biotechnol. 91 2016 1072 1081 S. Zhou, Y. Zhou, Y. Zhang, X. Sheng, Z. Zhang, The synthesis of new coke-resistant support and its application in propane dehydrogenation to propene, J. Chem. Technol. Biotechnol. 91 (2016) 1072-1081. [17] M.-H. Lee B.M. Nagaraja P. Natarajan N.T. Truong K.Y. Lee S. Yoon K.-D. Jung Res.Chem. Intermed. 42 2015 123 140 M.-H. Lee, B.M. Nagaraja, P. Natarajan, N.T. Truong, K.Y. Lee, S. Yoon, K.-D. Jung, Effect of potassium addition on bimetallic PtSn/θ-Al2O3 catalyst for dehydrogenation of propane to propylene, Res.Chem. Intermed. 42 (2015) 123-140. [18] L. Bai Y. Zhou Y. Zhang H. Liu M. Tang Catal. Lett. 129 2009 449 456 L. Bai, Y. Zhou, Y. Zhang, H. Liu, M. Tang, Influence of calcium addition on catalytic properties of PtSn/ZSM-5 catalyst for propane dehydrogenation, Catal. Lett. 129 (2009) 449-456. [19] Y. Zhang Y. Zhou J. Shi S. Zhou Z. Zhang S. Zhang M. Guo Technol. 111 2013 94 104 Y. Zhang, Y. Zhou, J. Shi, S. Zhou, Z. Zhang, S. Zhang, M. Guo, Propane dehydrogenation over PtSnNa/La-doped Al2O3 catalyst: effect of La content, Fuel Process. Technol. 111 (2013) 94-104. [20] L.D. Deng T. Shishido K. Teramura T. Tanaka Catal. Today 232 2014 33 39 L.D. Deng, T. Shishido, K. Teramura, T. Tanaka, Effect of reduction method on the activity of Pt-Sn/SiO2 for dehydrogenation of propane, Catal. Today 232 (2014) 33-39. [21] L. Deng H. Miura T. Shishido S. Hosokawa K. Teramura T. Tanaka ChemCatChem 6 2014 2680 2691 L. Deng, H. Miura, T. Shishido, S. Hosokawa, K. Teramura, T. Tanaka, Dehydrogenation of propane over Pt-Sn/SiO2 catalysts prepared by direct reduction method:effects of Sn/Pt ratio and reduction temperature., ChemCatChem 6 (2014) 2680-2691. [22] L. Deng H. Miura T. Shishido Z. Wang S. Hosokawa K. Teramura T. Tanaka J. Catal. 365 2018 277 291 L. Deng, H. Miura, T. Shishido, Z. Wang, S. Hosokawa, K. Teramura, T. Tanaka, Elucidating strong metal-support interactions in Pt–Sn/SiO2 catalyst and its consequences for dehydrogenation of lower alkanes, J. Catal. 365 (2018) 277-291. [23] L. Deng H. Miura T. Ohkubo T. Shishido Z. Wang S. Hosokawa K. Teramura T. Tanaka Catal. Sci. Technol. 9 2019 947 956 L. Deng, H. Miura, T. Ohkubo, T. Shishido, Z. Wang, S. Hosokawa, K. Teramura, T. Tanaka, The importance of direct reduction in the synthesis of highly active Pt–Sn/SBA-15 for n-butane dehydrogenation, Catal. Sci. Technol. 9 (2019) 947-956. [24] L. Deng T. Arakawa T. Ohkubo H. Miura T. Shishido S. Hosokawa K. Teramura T. Tanaka Ind. Eng. Chem. Res. 56 2017 7160 7172 L. Deng, T. Arakawa, T. Ohkubo, H. Miura, T. Shishido, S. Hosokawa, K. Teramura, T. Tanaka, Highly active and stable Pt–Sn/SBA-15 catalyst prepared by direct reduction for ethylbenzene dehydrogenation: effects of Sn addition, Ind. Eng. Chem. Res. 56 (2017) 7160-7172. [25] I. Contreras-Andrade A. Vazquez-Zavala T. Viveros Energ. Fuel. 23 2009 3835 3841 I. Contreras-Andrade, A. Vazquez-Zavala, T. Viveros, Influence of the synthesis method on the catalytic behavior of Pt and PtSn/Al2O3 reforming catalyst, Energ. Fuel. 23 (2009) 3835-3841 [26] S. Zafeiratos S. Piccinin D. Teschner Catal. Sci. Technol. 2 2012 1787 1801 S. Zafeiratos, S. Piccinin, D. Teschner, Alloys in catalysis phase separation and surface segregation phenomena in response to the reactive environment, Catal. Sci. Technol. 2 (2012) 1787-1801 [27] X.D. Wang J. Stoever V. Zielasek L. Altmann K. Thiel K. Al-Shamery M. Baumer H. Borchert J. Parisi J. Kolny-Olesiak Langmuir 27 2011 11052 11061 X. D. Wang, J. Stoever, V. Zielasek, L. Altmann, K. Thiel, K. Al-Shamery, M. Baumer, H. Borchert, J. Parisi, J. Kolny-Olesiak, Colloidal synthesis and structural control of PtSn bimetallic nanoparticles, Langmuir 27 (2011) 11052-11061. [28] A.K. Singh Q. Xu ChemCatChem 5 2013 652 676 A. K. Singh, Q. Xu, Synergistic catalysis over bimetallic alloy nanoparticles, ChemCatChem 5 (2013) 652-676. [29] F. Tao M.E. Grass Y.W. Zhang D.R. Butcher F. Aksoy S. Aloni V. Altoe S. Alayoglu J.R. Renzas C.-K. Tsung Z.W. Zhu Z. Liu M. Salmeron G.A. Somorjai J. Am. Chem. Soc. 132 2010 8697 8703 F. Tao, M. E. Grass, Y. W. Zhang, D. R. Butcher, F. Aksoy, S. Aloni, V. Altoe, S. Alayoglu, J. R. Renzas, C-K.Tsung, Z. W. Zhu, Z. Liu, M. Salmeron, G. A. Somorjai, Evolution of structure and chemistry of bimetallic nanoparticle catalysts under reaction conditions, J. Am. Chem. Soc. 132 (2010) 8697-8703 [30] F. Tao M.E. Grass Y.W. Zhang D.R. Butcher J.R. Renzas Z. Liu J.Y. Chung B.S. Mun M. Salmeron G.A. Somorjai Science 322 2008 932 934 F. Tao, M. E. Grass, Y. W. Zhang, D. R. Butcher, J. R. Renzas, Z. Liu, J. Y. Chung, B. S. Mun, M. Salmeron, G. A. Somorjai, Reaction-driven restructuring of Rh-Pd and Pt-Pd core-shell nanoparticles, Science 322 (2008) 932-934. [31] Y. Uemura Y. Inada K.K. Bando T. Sasaki N. Kamiuchi K. Eguchi A. Yagishita M. Nomura M. Tada Y. Iwasawa Phy. Chem.Chem. Phys. 13 2011 15833 15844 Y. Uemura, Y. Inada, K. K. Bando, T. Sasaki, N. Kamiuchi, K. Eguchi, A. Yagishita, M. Nomura, M. Tada, Y. Iwasawa, In situ time-resolved XAFS study on the structural transformation and phase separation of Pt3Sn and PtSn alloy nanoparticles on carbon in the oxidation process, Phy. Chem.Chem. Phys. 13 (2011) 15833-15844. [32] Y. Uemura Y. Inada K.K. Bando T. Sasaki N. Kamiuchi K. Eguchi A. Yagishita M. Nomura M. Tada Y. Iwasawa J. Phys. Chem. C 115 2011 5823 5833 Y. Uemura, Y. Inada, K. K. Bando, T. Sasaki, N. Kamiuchi, K. Eguchi, A. Yagishita, M. Nomura, M. Tada, Y. Iwasawa, Core−shell phase separation and structural transformation of Pt3Sn alloy nanoparticles support on r-Al2O3 in the reduction and oxidation processes characterized by in situ time-resolved XAFS, J. Phys. Chem. C 115 (2011) 5823-5833 [33] Q. Liu J. Samad J.E. Copple S. Eskandari C. Satterwhite J.R. Regalbuto Catal. Today 280 2017 246 252 Q. Liu, J. Samad, J.E. Copple, S. Eskandari, C. Satterwhite, J.R. Regalbuto, A pinch of salt to control supported Pt nanoparticle size, Catal. Today 280 (2017) 246-252. [34] N. Kaylor R.J. Davis J. Catal. 367 2018 181 193 N. Kaylor, R.J. Davis, Propane dehydrogenation over supported Pt-Sn nanoparticles, J. Catal. 367 (2018) 181-193. [35] C.A. Barrales-Cortés H. Pérez-Pastenes J.C. Piña-Victoria T. Viveros-García Top. Catal. 2020 C.A. Barrales-Cortés, H. Pérez-Pastenes, J.C. Piña-Victoria, T. Viveros-García, Hydrogenation of citral on Pt/SiO2 catalysts: effect of Sn addition and type of solvent, Top. in Catal. (2020) [36] T.W. Hansen A.T. Delariva S.R. Challa A.K. Datye Acc. Chem. Res. 46 2013 1720 1730 T. W. Hansen, A. T. Delariva, S. R. Challa, A. K. Datye, Sintering of catalytic nanoparticles particle migration or ostwald ripening, Acc. Chem. Res. 46 (2013) 1720-1730. [37] F.W. Lytle J. Catal. 43 1976 376 379 F. W. Lytle, Determination of d-band occupancy in pure metals and supported catalysts by measurement of the LIII X-ray absorption threshold, J. Catal. 43 (1976) 376-379. [38] J.M. Ramallo-Lopez G.F. Santori L. Giovanetti M.L. Casella O.A. Ferretti F.G. Requejo J. Phys. Chem. B 107 2003 11441 11451 J. M. Ramallo-Lopez, G. F. Santori, L. Giovanetti, M. L. Casella, O. A. Ferretti, F. G. Requejo, XPS and XAFS Pt L2,3-edge studies of dispersed metallic Pt and PtSn clusters on SiO2 obtained by organometallic synthesis:structural and electronic characteristics, J. Phys. Chem. B. 107 (2003) 11441-11451 [39] J.H. Kim S.M. Choi S.H. Nam M.H. Seo S.H. Choi W.B. Kim Appl. Catal. B-Environ 82 2008 89 102 J. H. Kim, S. M. Choi, S. H. Nam, M. H. Seo, S. H. Choi, W. B. Kim, Influence of Sn content on PtSn/C catalysts for electrooxidation of C1–C3 alcohols synthesis, characterization, and electrocatalytic activity, Appl. Catal. B-Environ 82 (2008) 89-102. [40] S.H. Symoens N. Olahova A.E. Muñoz Gandarillas H. Karimi M.R. Djokic M.-F. Reyniers G.B. Marin K.M. Van Geem Ind. Eng. Chem. Res. 57 2018 16117 16136 S.H. Symoens, N. Olahova, A.E. Muñoz Gandarillas, H. Karimi, M.R. Djokic, M.-F. Reyniers, G.B. Marin, K.M. Van Geem, State-of-the-art of coke formation during steam cracking: anti-coking surface technologies, Ind. Eng. Chem. Res. 57 (2018) 16117-16136. [41] A. Virnovskaia S. Jorgensen J. Hafizovic O. Prytz E. Kleimenov M. Havecker H. Bluhm A. Knop-Gericke R. Schlogl U. Olsbye Surf. Sci. 601 2007 30 43 A. Virnovskaia, S. Jorgensen, J. Hafizovic, O. Prytz, E. Kleimenov, M. Havecker, H. Bluhm, A. Knop-Gericke, R. Schlogl, U. Olsbye, In situ XPS investigation of Pt(Sn)/Mg(Al)O catalysts during ethane dehydrogenation experiments, Surf. Sci. 601 (2007) 30-43.",
      "scopus-id": "85091384065",
      "coredata": {
        "eid": "1-s2.0-S0926860X20304191",
        "dc:description": "Pt-Sn alloy nanoparticles supported on inert SiO2 were prepared and used in the dehydrogenation of propane. The bulk/surface properties of Pt-Sn alloys during reactions and regeneration reactions and regenerations were investigated by transmission electron microscopy, X-ray diffraction, X-ray absorption fine structure, and X-ray photoelectron spectroscopy. Thermogravimetric analysis showed that small amounts of coke formed on the reacted catalysts, and the Pt-Sn interactions were also weakened during the reaction. Sn enrichment occurred on the catalyst surface after the first and second reaction cycles. Fortunately, a small amount of co-fed H2 inhibited Sn segregation from Pt-Sn alloys and retained the active structure. The regeneration processes, especially the “oxidation-reduction” method, strengthened Pt-Sn interactions while concurrently burning off coke, allowing partial recovery of the catalytic performance. This work indicates the key role of the special geometric arrangements of Pt-Sn alloys in the dehydrogenation of propane.",
        "openArchiveArticle": "false",
        "prism:coverDate": "2020-09-25",
        "openaccessUserLicense": null,
        "prism:aggregationType": "Journal",
        "prism:url": "https://api.elsevier.com/content/article/pii/S0926860X20304191",
        "dc:creator": [
          {
            "@_fa": "true",
            "$": "Deng, Lidan"
          },
          {
            "@_fa": "true",
            "$": "Zhou, Zijian"
          },
          {
            "@_fa": "true",
            "$": "Shishido, Tetsuya"
          }
        ],
        "link": [
          {
            "@_fa": "true",
            "@rel": "self",
            "@href": "https://api.elsevier.com/content/article/pii/S0926860X20304191"
          },
          {
            "@_fa": "true",
            "@rel": "scidir",
            "@href": "https://www.sciencedirect.com/science/article/pii/S0926860X20304191"
          }
        ],
        "dc:format": "application/json",
        "openaccessType": null,
        "pii": "S0926-860X(20)30419-1",
        "prism:volume": "606",
        "articleNumber": "117826",
        "prism:publisher": "Elsevier B.V.",
        "dc:title": "Behavior of active species on Pt-Sn/SiO2 catalyst during the dehydrogenation of propane and regeneration",
        "prism:copyright": "© 2020 Elsevier B.V. All rights reserved.",
        "openaccess": "0",
        "prism:issn": "0926860X",
        "dcterms:subject": [
          {
            "@_fa": "true",
            "$": "Pt-Sn/SiO2"
          },
          {
            "@_fa": "true",
            "$": "Dehydrogenation"
          },
          {
            "@_fa": "true",
            "$": "Propylene"
          },
          {
            "@_fa": "true",
            "$": "Deactivation"
          },
          {
            "@_fa": "true",
            "$": "Regeneration"
          }
        ],
        "openaccessArticle": "false",
        "prism:publicationName": "Applied Catalysis A: General",
        "openaccessSponsorType": null,
        "prism:pageRange": "117826",
        "pubType": "fla",
        "prism:coverDisplayDate": "25 September 2020",
        "prism:doi": "10.1016/j.apcata.2020.117826",
        "prism:startingPage": "117826",
        "dc:identifier": "doi:10.1016/j.apcata.2020.117826",
        "openaccessSponsorName": null
      },
      "objects": {
        "object": [
          {
            "@category": "standard",
            "@height": "435",
            "@width": "567",
            "@_fa": "true",
            "$": "https://api.elsevier.com/content/object/eid/1-s2.0-S0926860X20304191-sc1.jpg?httpAccept=%2A%2F%2A",
            "@multimediatype": "JPEG image file",
            "@type": "IMAGE-DOWNSAMPLED",
            "@size": "41405",
            "@ref": "sc1",
            "@mimetype": "image/jpeg"
          },
          {
            "@category": "standard",
            "@height": "262",
            "@width": "567",
            "@_fa": "true",
            "$": "https://api.elsevier.com/content/object/eid/1-s2.0-S0926860X20304191-gr1.jpg?httpAccept=%2A%2F%2A",
            "@multimediatype": "JPEG image file",
            "@type": "IMAGE-DOWNSAMPLED",
            "@size": "34153",
            "@ref": "gr1",
            "@mimetype": "image/jpeg"
          },
          {
            "@category": "standard",
            "@height": "618",
            "@width": "567",
            "@_fa": "true",
            "$": "https://api.elsevier.com/content/object/eid/1-s2.0-S0926860X20304191-gr2.jpg?httpAccept=%2A%2F%2A",
            "@multimediatype": "JPEG image file",
            "@type": "IMAGE-DOWNSAMPLED",
            "@size": "63009",
            "@ref": "gr2",
            "@mimetype": "image/jpeg"
          },
          {
            "@category": "standard",
            "@height": "200",
            "@width": "430",
            "@_fa": "true",
            "$": "https://api.elsevier.com/content/object/eid/1-s2.0-S0926860X20304191-ga1.jpg?httpAccept=%2A%2F%2A",
            "@multimediatype": "JPEG image file",
            "@type": "IMAGE-DOWNSAMPLED",
            "@size": "24421",
            "@ref": "ga1",
            "@mimetype": "image/jpeg"
          },
          {
            "@category": "standard",
            "@height": "358",
            "@width": "567",
            "@_fa": "true",
            "$": "https://api.elsevier.com/content/object/eid/1-s2.0-S0926860X20304191-gr5.jpg?httpAccept=%2A%2F%2A",
            "@multimediatype": "JPEG image file",
            "@type": "IMAGE-DOWNSAMPLED",
            "@size": "42952",
            "@ref": "gr5",
            "@mimetype": "image/jpeg"
          },
          {
            "@category": "standard",
            "@height": "349",
            "@width": "567",
            "@_fa": "true",
            "$": "https://api.elsevier.com/content/object/eid/1-s2.0-S0926860X20304191-gr6.jpg?httpAccept=%2A%2F%2A",
            "@multimediatype": "JPEG image file",
            "@type": "IMAGE-DOWNSAMPLED",
            "@size": "47966",
            "@ref": "gr6",
            "@mimetype": "image/jpeg"
          },
          {
            "@category": "standard",
            "@height": "715",
            "@width": "718",
            "@_fa": "true",
            "$": "https://api.elsevier.com/content/object/eid/1-s2.0-S0926860X20304191-gr3.jpg?httpAccept=%2A%2F%2A",
            "@multimediatype": "JPEG image file",
            "@type": "IMAGE-DOWNSAMPLED",
            "@size": "111215",
            "@ref": "gr3",
            "@mimetype": "image/jpeg"
          },
          {
            "@category": "standard",
            "@height": "299",
            "@width": "341",
            "@_fa": "true",
            "$": "https://api.elsevier.com/content/object/eid/1-s2.0-S0926860X20304191-gr4.jpg?httpAccept=%2A%2F%2A",
            "@multimediatype": "JPEG image file",
            "@type": "IMAGE-DOWNSAMPLED",
            "@size": "26707",
            "@ref": "gr4",
            "@mimetype": "image/jpeg"
          },
          {
            "@category": "thumbnail",
            "@height": "164",
            "@width": "214",
            "@_fa": "true",
            "$": "https://api.elsevier.com/content/object/eid/1-s2.0-S0926860X20304191-sc1.sml?httpAccept=%2A%2F%2A",
            "@multimediatype": "GIF image file",
            "@type": "IMAGE-THUMBNAIL",
            "@size": "9034",
            "@ref": "sc1",
            "@mimetype": "image/gif"
          },
          {
            "@category": "thumbnail",
            "@height": "101",
            "@width": "219",
            "@_fa": "true",
            "$": "https://api.elsevier.com/content/object/eid/1-s2.0-S0926860X20304191-gr1.sml?httpAccept=%2A%2F%2A",
            "@multimediatype": "GIF image file",
            "@type": "IMAGE-THUMBNAIL",
            "@size": "5551",
            "@ref": "gr1",
            "@mimetype": "image/gif"
          },
          {
            "@category": "thumbnail",
            "@height": "164",
            "@width": "150",
            "@_fa": "true",
            "$": "https://api.elsevier.com/content/object/eid/1-s2.0-S0926860X20304191-gr2.sml?httpAccept=%2A%2F%2A",
            "@multimediatype": "GIF image file",
            "@type": "IMAGE-THUMBNAIL",
            "@size": "6403",
            "@ref": "gr2",
            "@mimetype": "image/gif"
          },
          {
            "@category": "thumbnail",
            "@height": "102",
            "@width": "219",
            "@_fa": "true",
            "$": "https://api.elsevier.com/content/object/eid/1-s2.0-S0926860X20304191-ga1.sml?httpAccept=%2A%2F%2A",
            "@multimediatype": "GIF image file",
            "@type": "IMAGE-THUMBNAIL",
            "@size": "7132",
            "@ref": "ga1",
            "@mimetype": "image/gif"
          },
          {
            "@category": "thumbnail",
            "@height": "138",
            "@width": "219",
            "@_fa": "true",
            "$": "https://api.elsevier.com/content/object/eid/1-s2.0-S0926860X20304191-gr5.sml?httpAccept=%2A%2F%2A",
            "@multimediatype": "GIF image file",
            "@type": "IMAGE-THUMBNAIL",
            "@size": "7082",
            "@ref": "gr5",
            "@mimetype": "image/gif"
          },
          {
            "@category": "thumbnail",
            "@height": "135",
            "@width": "219",
            "@_fa": "true",
            "$": "https://api.elsevier.com/content/object/eid/1-s2.0-S0926860X20304191-gr6.sml?httpAccept=%2A%2F%2A",
            "@multimediatype": "GIF image file",
            "@type": "IMAGE-THUMBNAIL",
            "@size": "6420",
            "@ref": "gr6",
            "@mimetype": "image/gif"
          },
          {
            "@category": "thumbnail",
            "@height": "164",
            "@width": "165",
            "@_fa": "true",
            "$": "https://api.elsevier.com/content/object/eid/1-s2.0-S0926860X20304191-gr3.sml?httpAccept=%2A%2F%2A",
            "@multimediatype": "GIF image file",
            "@type": "IMAGE-THUMBNAIL",
            "@size": "13759",
            "@ref": "gr3",
            "@mimetype": "image/gif"
          },
          {
            "@category": "thumbnail",
            "@height": "164",
            "@width": "187",
            "@_fa": "true",
            "$": "https://api.elsevier.com/content/object/eid/1-s2.0-S0926860X20304191-gr4.sml?httpAccept=%2A%2F%2A",
            "@multimediatype": "GIF image file",
            "@type": "IMAGE-THUMBNAIL",
            "@size": "8079",
            "@ref": "gr4",
            "@mimetype": "image/gif"
          },
          {
            "@category": "high",
            "@height": "1926",
            "@width": "2510",
            "@_fa": "true",
            "$": "https://api.elsevier.com/content/object/eid/1-s2.0-S0926860X20304191-sc1_lrg.jpg?httpAccept=%2A%2F%2A",
            "@multimediatype": "JPEG image file",
            "@type": "IMAGE-HIGH-RES",
            "@size": "314255",
            "@ref": "sc1",
            "@mimetype": "image/jpeg"
          },
          {
            "@category": "high",
            "@height": "1161",
            "@width": "2510",
            "@_fa": "true",
            "$": "https://api.elsevier.com/content/object/eid/1-s2.0-S0926860X20304191-gr1_lrg.jpg?httpAccept=%2A%2F%2A",
            "@multimediatype": "JPEG image file",
            "@type": "IMAGE-HIGH-RES",
            "@size": "233681",
            "@ref": "gr1",
            "@mimetype": "image/jpeg"
          },
          {
            "@category": "high",
            "@height": "2737",
            "@width": "2510",
            "@_fa": "true",
            "$": "https://api.elsevier.com/content/object/eid/1-s2.0-S0926860X20304191-gr2_lrg.jpg?httpAccept=%2A%2F%2A",
            "@multimediatype": "JPEG image file",
            "@type": "IMAGE-HIGH-RES",
            "@size": "529958",
            "@ref": "gr2",
            "@mimetype": "image/jpeg"
          },
          {
            "@category": "high",
            "@height": "886",
            "@width": "1903",
            "@_fa": "true",
            "$": "https://api.elsevier.com/content/object/eid/1-s2.0-S0926860X20304191-ga1_lrg.jpg?httpAccept=%2A%2F%2A",
            "@multimediatype": "JPEG image file",
            "@type": "IMAGE-HIGH-RES",
            "@size": "171331",
            "@ref": "ga1",
            "@mimetype": "image/jpeg"
          },
          {
            "@category": "high",
            "@height": "1585",
            "@width": "2510",
            "@_fa": "true",
            "$": "https://api.elsevier.com/content/object/eid/1-s2.0-S0926860X20304191-gr5_lrg.jpg?httpAccept=%2A%2F%2A",
            "@multimediatype": "JPEG image file",
            "@type": "IMAGE-HIGH-RES",
            "@size": "333180",
            "@ref": "gr5",
            "@mimetype": "image/jpeg"
          },
          {
            "@category": "high",
            "@height": "1547",
            "@width": "2510",
            "@_fa": "true",
            "$": "https://api.elsevier.com/content/object/eid/1-s2.0-S0926860X20304191-gr6_lrg.jpg?httpAccept=%2A%2F%2A",
            "@multimediatype": "JPEG image file",
            "@type": "IMAGE-HIGH-RES",
            "@size": "328577",
            "@ref": "gr6",
            "@mimetype": "image/jpeg"
          },
          {
            "@category": "high",
            "@height": "3162",
            "@width": "3177",
            "@_fa": "true",
            "$": "https://api.elsevier.com/content/object/eid/1-s2.0-S0926860X20304191-gr3_lrg.jpg?httpAccept=%2A%2F%2A",
            "@multimediatype": "JPEG image file",
            "@type": "IMAGE-HIGH-RES",
            "@size": "1659299",
            "@ref": "gr3",
            "@mimetype": "image/jpeg"
          },
          {
            "@category": "high",
            "@height": "1322",
            "@width": "1510",
            "@_fa": "true",
            "$": "https://api.elsevier.com/content/object/eid/1-s2.0-S0926860X20304191-gr4_lrg.jpg?httpAccept=%2A%2F%2A",
            "@multimediatype": "JPEG image file",
            "@type": "IMAGE-HIGH-RES",
            "@size": "212574",
            "@ref": "gr4",
            "@mimetype": "image/jpeg"
          },
          {
            "@category": "standard",
            "@_fa": "true",
            "$": "https://api.elsevier.com/content/object/eid/1-s2.0-S0926860X20304191-mmc1.docx?httpAccept=%2A%2F%2A",
            "@multimediatype": "Microsoft Word file",
            "@type": "APPLICATION",
            "@size": "1205714",
            "@ref": "mmc1",
            "@mimetype": "application/word"
          },
          {
            "@category": "standard",
            "@_fa": "true",
            "$": "https://api.elsevier.com/content/object/eid/1-s2.0-S0926860X20304191-am.pdf?httpAccept=%2A%2F%2A",
            "@multimediatype": "Acrobat PDF file",
            "@type": "AAM-PDF",
            "@size": "1393528",
            "@ref": "am",
            "@mimetype": "application/pdf"
          }
        ]
      },
      "link": {
        "@rel": "abstract",
        "@href": "https://api.elsevier.com/content/abstract/scopus_id/85091384065"
      }
    }
  }
}