{
  "metadata": {
    "title": "A new boron modified carbon nitride metal-free catalyst for the cycloaddition of CO<ce:inf loc=post>2</ce:inf> and bisepoxides",
    "authors": "; ; ",
    "journal": "Applied Catalysis A: General",
    "date": "2024-04-05",
    "doi": "10.1016/j.apcata.2024.119615",
    "abstract": "",
    "uri": "https://api.elsevier.com/content/article/pii/S0926860X24000590",
    "pii": "S0926860X24000590"
  },
  "fulltext": {
    "full-text-retrieval-response": {
      "scopus-eid": "2-s2.0-85185567555",
      "originalText": "serial JL 271346 291210 291744 291809 31 Applied Catalysis A: General APPLIEDCATALYSISAGENERAL 2024-02-09 2024-02-09 2024-02-23 2024-02-23 2024-03-13T12:53:12 1-s2.0-S0926860X24000590 S0926-860X(24)00059-0 S0926860X24000590 10.1016/j.apcata.2024.119615 S300 S300.1 FULL-TEXT 1-s2.0-S0926860X24X00034 2024-04-05T07:12:02.220507Z 0 0 20240405 2024 2024-02-09T08:00:26.243056Z absattachment articleinfo articlenumber articletitlenorm authfirstinitialnorm authfirstsurnamenorm cid cids contenttype copyright crossmark dateloaded dateloadedtxt datesearch datesort dateupdated dco docsubtype doctype doi eid ewtransactionid hubeid indexeddate issn issnnorm itemstage itemtransactionid itemweight openaccess openarchive pg pgfirst pii piinorm pubdatestart pubdatetxt pubyr sortorder srctitle srctitlenorm srctype ssids alllist content subj subheadings suppl tomb volfirst volissue volumelist webpdf webpdfpagecount yearnav figure table e-component body acknowledge affil appendices articletitle auth authfirstini authfull authkeywords authlast grantnumber grantsponsor grantsponsorid highlightsabst primabst ref specialabst 0926-860X 0926860X true 675 675 C Volume 675 2 119615 119615 119615 20240405 5 April 2024 2024-04-05 2024 article fla © 2024 Elsevier B.V. All rights reserved. ANEWBORONMODIFIEDCARBONNITRIDEMETALFREECATALYSTFORCYCLOADDITIONCO2BISEPOXIDES ZHANG Y 1 Introduction 2 Experimental 2.1 Catalyst preparation 2.2 Characterization 2.3 Synthesis of five-membered cyclocarbonates (5CC) 3 Results and discussions 3.1 Compositional and structural studies 3.2 Morphological and textural properties studies 3.3 Acidic and basic properties studies 3.4 Catalytic activities 3.5 Reaction mechanism 4 Conclusions CRediT authorship contribution statement Acknowledgements Appendix A Supplementary material References FRANCKE 2018 4631 4701 R BONNEUIL 2021 C KAMPHUIS 2019 406 448 A JIANG 2020 7984 8034 X DIBENEDETTO 2020 6219 6228 A MUJMULE 2022 115045 R ZHANG 2023 F AOMCHAD 2021 1077 1113 V GUO 2021 77 118 L USMAN 2023 22717 22743 M WANG 2023 R ZHOU 2019 3193 3228 W HU 2019 14825 14834 T CHOWDHURY 2018 46 54 A ZHAO 2019 172 178 L CENTENOPEDRAZO 2021 A YUAN 2023 H GOU 2021 2005 2014 H LONG 2023 L PAL 2020 T ALROWAILI 2021 F LUO 2021 25731 25749 R LIU 2022 136 141 K KE 2016 474 485 J KE 2018 302 313 J SU 2017 2957 2965 Q LIU 2020 M WANG 2021 X ZHANG 2022 Y XUE 2017 5041 5045 Z ZHU 2017 92 100 J XU 2018 5582 5593 J SU 2014 Q CHAND 2021 H LIANG 2018 16127 16137 H XU 2020 J GE 2022 M YAN 2018 2515 2520 Q GU 2021 5723 5732 Y ZHANG 2019 716 724 D LIU 2022 1483 1494 N YANG 2022 C WANG 2022 523 534 X WANG 2021 3712 3721 H WANG 2016 4871 4876 J ZHANGX2024X119615 ZHANGX2024X119615XY 2026-02-23T00:00:00.000Z 2026-02-23T00:00:00.000Z http://creativecommons.org/licenses/by-nc-nd/4.0/ © 2024 Elsevier B.V. All rights reserved. 2024-03-19T16:34:34.454Z http://vtw.elsevier.com/data/voc/AddOnTypes/50.7/aggregated-refined National Natural Science Foundation of China 52003286 NSFC National Natural Science Foundation of China http://data.elsevier.com/vocabulary/SciValFunders/501100001809 http://sws.geonames.org/1814991/ 2023431 http://sws.geonames.org/1814991 http://sws.geonames.org/1814991 http://sws.geonames.org/1814991 Youth Innovation Promotion Association of Chinese Academy of Sciences YIPA CAS Youth Innovation Promotion Association of the Chinese Academy of Sciences http://data.elsevier.com/vocabulary/SciValFunders/501100004739 http://sws.geonames.org/1814991/ ICC CAS SCJC-DT-2022-02 ICC Institute of Coal Chemistry, Chinese Academy of Sciences http://data.elsevier.com/vocabulary/SciValFunders/501100018804 http://sws.geonames.org/1814991/ This work was supported by the National Natural Science Foundation of China (Grant No. 52003286, China), the Youth Innovation Promotion Association of Chinese Academy of Sciences (Grant No. 2023431, China), and the Innovation Fund Programs of Institute of Coal Chemistry (supported by ICC CAS, Grant No. SCJC-DT-2022-02, China). https://doi.org/10.15223/policy-017 https://doi.org/10.15223/policy-037 https://doi.org/10.15223/policy-012 https://doi.org/10.15223/policy-029 https://doi.org/10.15223/policy-004 item S0926-860X(24)00059-0 S0926860X24000590 1-s2.0-S0926860X24000590 10.1016/j.apcata.2024.119615 271346 2024-04-05T07:12:02.220507Z 2024-04-05 1-s2.0-S0926860X24000590-main.pdf https://s3-eu-west-1.amazonaws.com/prod-ucs-content-store-eu-west/content/pii:S0926860X24000590/MAIN/application/pdf/341e7cbe47ac80885d7d720c1a3c6fec/main.pdf main.pdf pdf true 9827716 MAIN 11 1-s2.0-S0926860X24000590-main_1.png https://s3-eu-west-1.amazonaws.com/prod-ucs-content-store-eu-west/content/pii:S0926860X24000590/PREVIEW/image/png/b41f5514cc52379e7774aab9d35d6ff9/main_1.png main_1.png png 57681 849 656 IMAGE-WEB-PDF 1 1-s2.0-S0926860X24000590-ga1.jpg https://s3-eu-west-1.amazonaws.com/prod-ucs-content-store-eu-west/content/pii:S0926860X24000590/ga1/DOWNSAMPLED/image/jpeg/11ff430728a46fa73f1bcb2976373861/ga1.jpg ga1 true ga1.jpg jpg 23638 200 414 IMAGE-DOWNSAMPLED 1-s2.0-S0926860X24000590-sc4.jpg https://s3-eu-west-1.amazonaws.com/prod-ucs-content-store-eu-west/content/pii:S0926860X24000590/sc4/DOWNSAMPLED/image/jpeg/db2116b2723f10b592cead73387c8f75/sc4.jpg sc4 sc4.jpg jpg 79149 662 751 IMAGE-DOWNSAMPLED 1-s2.0-S0926860X24000590-sc3.jpg https://s3-eu-west-1.amazonaws.com/prod-ucs-content-store-eu-west/content/pii:S0926860X24000590/sc3/DOWNSAMPLED/image/jpeg/23f295057dcd926684bc241ee6b33f71/sc3.jpg sc3 sc3.jpg jpg 25411 213 565 IMAGE-DOWNSAMPLED 1-s2.0-S0926860X24000590-sc2.jpg https://s3-eu-west-1.amazonaws.com/prod-ucs-content-store-eu-west/content/pii:S0926860X24000590/sc2/DOWNSAMPLED/image/jpeg/d5ede341c6bae81b152d031ea026bc13/sc2.jpg sc2 sc2.jpg jpg 46627 301 791 IMAGE-DOWNSAMPLED 1-s2.0-S0926860X24000590-sc1.jpg https://s3-eu-west-1.amazonaws.com/prod-ucs-content-store-eu-west/content/pii:S0926860X24000590/sc1/DOWNSAMPLED/image/jpeg/7fb6bb652c41d7c49826f5dd925711c7/sc1.jpg sc1 sc1.jpg jpg 46034 362 791 IMAGE-DOWNSAMPLED 1-s2.0-S0926860X24000590-fx1.jpg https://s3-eu-west-1.amazonaws.com/prod-ucs-content-store-eu-west/content/pii:S0926860X24000590/fx1/DOWNSAMPLED/image/jpeg/bd83fb4cdd2421a81316daff1ae32b68/fx1.jpg fx1 fx1.jpg jpg 7038 67 445 IMAGE-DOWNSAMPLED 1-s2.0-S0926860X24000590-gr7.jpg https://s3-eu-west-1.amazonaws.com/prod-ucs-content-store-eu-west/content/pii:S0926860X24000590/gr7/DOWNSAMPLED/image/jpeg/57c1db88d33c420826f7ebec2f4263da/gr7.jpg gr7 gr7.jpg jpg 32748 325 565 IMAGE-DOWNSAMPLED 1-s2.0-S0926860X24000590-gr6.jpg https://s3-eu-west-1.amazonaws.com/prod-ucs-content-store-eu-west/content/pii:S0926860X24000590/gr6/DOWNSAMPLED/image/jpeg/f02e324ee9a88261285383644f15a3c2/gr6.jpg gr6 gr6.jpg jpg 22881 274 376 IMAGE-DOWNSAMPLED 1-s2.0-S0926860X24000590-gr5.jpg https://s3-eu-west-1.amazonaws.com/prod-ucs-content-store-eu-west/content/pii:S0926860X24000590/gr5/DOWNSAMPLED/image/jpeg/0701d771c4cfc265d7a45c1b06ab7d0e/gr5.jpg gr5 gr5.jpg jpg 55576 264 791 IMAGE-DOWNSAMPLED 1-s2.0-S0926860X24000590-gr4.jpg https://s3-eu-west-1.amazonaws.com/prod-ucs-content-store-eu-west/content/pii:S0926860X24000590/gr4/DOWNSAMPLED/image/jpeg/d459cacdbeebb04e27348a6ac4f104e9/gr4.jpg gr4 gr4.jpg jpg 45536 255 751 IMAGE-DOWNSAMPLED 1-s2.0-S0926860X24000590-gr3.jpg https://s3-eu-west-1.amazonaws.com/prod-ucs-content-store-eu-west/content/pii:S0926860X24000590/gr3/DOWNSAMPLED/image/jpeg/110d2b4cb9f5af7550b3f5da2bf7f163/gr3.jpg gr3 gr3.jpg jpg 198220 519 791 IMAGE-DOWNSAMPLED 1-s2.0-S0926860X24000590-gr2.jpg https://s3-eu-west-1.amazonaws.com/prod-ucs-content-store-eu-west/content/pii:S0926860X24000590/gr2/DOWNSAMPLED/image/jpeg/3bddbb84cea3024df35768274b194c05/gr2.jpg gr2 gr2.jpg jpg 112919 542 751 IMAGE-DOWNSAMPLED 1-s2.0-S0926860X24000590-gr1.jpg https://s3-eu-west-1.amazonaws.com/prod-ucs-content-store-eu-west/content/pii:S0926860X24000590/gr1/DOWNSAMPLED/image/jpeg/1833a7168a196f973721a4fbbacc86a0/gr1.jpg gr1 gr1.jpg jpg 41938 192 678 IMAGE-DOWNSAMPLED 1-s2.0-S0926860X24000590-ga1.sml https://s3-eu-west-1.amazonaws.com/prod-ucs-content-store-eu-west/content/pii:S0926860X24000590/ga1/THUMBNAIL/image/gif/897c022bb68ceae7e34cbe38142a14c7/ga1.sml ga1 true ga1.sml sml 9958 106 219 IMAGE-THUMBNAIL 1-s2.0-S0926860X24000590-sc4.sml https://s3-eu-west-1.amazonaws.com/prod-ucs-content-store-eu-west/content/pii:S0926860X24000590/sc4/THUMBNAIL/image/gif/2ccfe33e88e44ab012c6194983ed665b/sc4.sml sc4 sc4.sml sml 7012 164 186 IMAGE-THUMBNAIL 1-s2.0-S0926860X24000590-sc3.sml https://s3-eu-west-1.amazonaws.com/prod-ucs-content-store-eu-west/content/pii:S0926860X24000590/sc3/THUMBNAIL/image/gif/1f369f058774cae94462476b2b8b8288/sc3.sml sc3 sc3.sml sml 4781 83 219 IMAGE-THUMBNAIL 1-s2.0-S0926860X24000590-sc2.sml https://s3-eu-west-1.amazonaws.com/prod-ucs-content-store-eu-west/content/pii:S0926860X24000590/sc2/THUMBNAIL/image/gif/532e333e70f763ce3865a8a09b8ed2b3/sc2.sml sc2 sc2.sml sml 6918 83 219 IMAGE-THUMBNAIL 1-s2.0-S0926860X24000590-sc1.sml https://s3-eu-west-1.amazonaws.com/prod-ucs-content-store-eu-west/content/pii:S0926860X24000590/sc1/THUMBNAIL/image/gif/a1730c25e4e67e85ec96580b8dbf3753/sc1.sml sc1 sc1.sml sml 5423 100 219 IMAGE-THUMBNAIL 1-s2.0-S0926860X24000590-fx1.sml https://s3-eu-west-1.amazonaws.com/prod-ucs-content-store-eu-west/content/pii:S0926860X24000590/fx1/THUMBNAIL/image/gif/15da9ef27638ca002db2c76cf46fb272/fx1.sml fx1 fx1.sml sml 1718 33 219 IMAGE-THUMBNAIL 1-s2.0-S0926860X24000590-gr7.sml https://s3-eu-west-1.amazonaws.com/prod-ucs-content-store-eu-west/content/pii:S0926860X24000590/gr7/THUMBNAIL/image/gif/5d1701d506b4053ee0216ef90c5839dc/gr7.sml gr7 gr7.sml sml 4411 126 219 IMAGE-THUMBNAIL 1-s2.0-S0926860X24000590-gr6.sml https://s3-eu-west-1.amazonaws.com/prod-ucs-content-store-eu-west/content/pii:S0926860X24000590/gr6/THUMBNAIL/image/gif/6734971375bd52598ec7a54d071c2e95/gr6.sml gr6 gr6.sml sml 12119 159 219 IMAGE-THUMBNAIL 1-s2.0-S0926860X24000590-gr5.sml https://s3-eu-west-1.amazonaws.com/prod-ucs-content-store-eu-west/content/pii:S0926860X24000590/gr5/THUMBNAIL/image/gif/7667b22a06b3eb62516d3ea5662ec198/gr5.sml gr5 gr5.sml sml 7102 73 219 IMAGE-THUMBNAIL 1-s2.0-S0926860X24000590-gr4.sml https://s3-eu-west-1.amazonaws.com/prod-ucs-content-store-eu-west/content/pii:S0926860X24000590/gr4/THUMBNAIL/image/gif/c9ae5c76c13ea8936c8f2b057db93e91/gr4.sml gr4 gr4.sml sml 6151 74 219 IMAGE-THUMBNAIL 1-s2.0-S0926860X24000590-gr3.sml https://s3-eu-west-1.amazonaws.com/prod-ucs-content-store-eu-west/content/pii:S0926860X24000590/gr3/THUMBNAIL/image/gif/d4d210c1550ee1f9e06218e857c26555/gr3.sml gr3 gr3.sml sml 24264 144 219 IMAGE-THUMBNAIL 1-s2.0-S0926860X24000590-gr2.sml https://s3-eu-west-1.amazonaws.com/prod-ucs-content-store-eu-west/content/pii:S0926860X24000590/gr2/THUMBNAIL/image/gif/5049ab011a276e718472169a62b0e47a/gr2.sml gr2 gr2.sml sml 14614 158 219 IMAGE-THUMBNAIL 1-s2.0-S0926860X24000590-gr1.sml https://s3-eu-west-1.amazonaws.com/prod-ucs-content-store-eu-west/content/pii:S0926860X24000590/gr1/THUMBNAIL/image/gif/8ea0869f1e4e957c78868e947d29713c/gr1.sml gr1 gr1.sml sml 6015 62 219 IMAGE-THUMBNAIL 1-s2.0-S0926860X24000590-ga1_lrg.jpg https://s3-eu-west-1.amazonaws.com/prod-ucs-content-store-eu-west/content/pii:S0926860X24000590/HIGHRES/image/jpeg/935effc189fba2b844aa90bc51cf6915/ga1_lrg.jpg ga1 true ga1_lrg.jpg jpg 171370 886 1832 IMAGE-HIGH-RES 1-s2.0-S0926860X24000590-sc4_lrg.jpg https://s3-eu-west-1.amazonaws.com/prod-ucs-content-store-eu-west/content/pii:S0926860X24000590/HIGHRES/image/jpeg/0156051dc7e234ab2f11782d545c0187/sc4_lrg.jpg sc4 sc4_lrg.jpg jpg 395232 2933 3326 IMAGE-HIGH-RES 1-s2.0-S0926860X24000590-sc3_lrg.jpg https://s3-eu-west-1.amazonaws.com/prod-ucs-content-store-eu-west/content/pii:S0926860X24000590/HIGHRES/image/jpeg/39dd068bed9e94f2d3dd00e496f889b7/sc3_lrg.jpg sc3 sc3_lrg.jpg jpg 121566 941 2495 IMAGE-HIGH-RES 1-s2.0-S0926860X24000590-sc2_lrg.jpg https://s3-eu-west-1.amazonaws.com/prod-ucs-content-store-eu-west/content/pii:S0926860X24000590/HIGHRES/image/jpeg/acc40dd925738ba9de88a288e112d58e/sc2_lrg.jpg sc2 sc2_lrg.jpg jpg 206799 1329 3493 IMAGE-HIGH-RES 1-s2.0-S0926860X24000590-sc1_lrg.jpg https://s3-eu-west-1.amazonaws.com/prod-ucs-content-store-eu-west/content/pii:S0926860X24000590/HIGHRES/image/jpeg/1909d558f38d25f25932be65f6b8b02a/sc1_lrg.jpg sc1 sc1_lrg.jpg jpg 216677 1597 3493 IMAGE-HIGH-RES 1-s2.0-S0926860X24000590-fx1_lrg.jpg https://s3-eu-west-1.amazonaws.com/prod-ucs-content-store-eu-west/content/pii:S0926860X24000590/HIGHRES/image/jpeg/24bd2ab1b67a4ecd6179d1f754741a6a/fx1_lrg.jpg fx1 fx1_lrg.jpg jpg 31178 297 1975 IMAGE-HIGH-RES 1-s2.0-S0926860X24000590-gr7_lrg.jpg https://s3-eu-west-1.amazonaws.com/prod-ucs-content-store-eu-west/content/pii:S0926860X24000590/HIGHRES/image/jpeg/5db480ffecf231f519953b156b4b925c/gr7_lrg.jpg gr7 gr7_lrg.jpg jpg 142641 1434 2495 IMAGE-HIGH-RES 1-s2.0-S0926860X24000590-gr6_lrg.jpg https://s3-eu-west-1.amazonaws.com/prod-ucs-content-store-eu-west/content/pii:S0926860X24000590/HIGHRES/image/jpeg/4c8438dc2363aa677c1829e58f381de3/gr6_lrg.jpg gr6 gr6_lrg.jpg jpg 147997 1211 1663 IMAGE-HIGH-RES 1-s2.0-S0926860X24000590-gr5_lrg.jpg https://s3-eu-west-1.amazonaws.com/prod-ucs-content-store-eu-west/content/pii:S0926860X24000590/HIGHRES/image/jpeg/ac86dfa0ccf7cf138d22a8a12ca906db/gr5_lrg.jpg gr5 gr5_lrg.jpg jpg 272975 1167 3493 IMAGE-HIGH-RES 1-s2.0-S0926860X24000590-gr4_lrg.jpg https://s3-eu-west-1.amazonaws.com/prod-ucs-content-store-eu-west/content/pii:S0926860X24000590/HIGHRES/image/jpeg/564a638265f21bd2677a7aeb74eff925/gr4_lrg.jpg gr4 gr4_lrg.jpg jpg 212289 1130 3326 IMAGE-HIGH-RES 1-s2.0-S0926860X24000590-gr3_lrg.jpg https://s3-eu-west-1.amazonaws.com/prod-ucs-content-store-eu-west/content/pii:S0926860X24000590/HIGHRES/image/jpeg/72b3aca1a38f70ae4aadd80ae52f918c/gr3_lrg.jpg gr3 gr3_lrg.jpg jpg 1192602 2292 3493 IMAGE-HIGH-RES 1-s2.0-S0926860X24000590-gr2_lrg.jpg https://s3-eu-west-1.amazonaws.com/prod-ucs-content-store-eu-west/content/pii:S0926860X24000590/HIGHRES/image/jpeg/105fd8a9a595b12873ad1537609544ea/gr2_lrg.jpg gr2 gr2_lrg.jpg jpg 561824 2402 3326 IMAGE-HIGH-RES 1-s2.0-S0926860X24000590-gr1_lrg.jpg https://s3-eu-west-1.amazonaws.com/prod-ucs-content-store-eu-west/content/pii:S0926860X24000590/HIGHRES/image/jpeg/7c6fcd5ab389b2556f3a479b9582b366/gr1_lrg.jpg gr1 gr1_lrg.jpg jpg 230065 846 2994 IMAGE-HIGH-RES 1-s2.0-S0926860X24000590-mmc1.docx https://s3-eu-west-1.amazonaws.com/prod-ucs-content-store-eu-west/content/pii:S0926860X24000590/mmc1/MAIN/application/vnd.openxmlformats-officedocument.wordprocessingml.document/88129260ac8504c9b759e8c58f18e679/mmc1.docx mmc1 mmc1.docx docx 2452804 APPLICATION 1-s2.0-S0926860X24000590-am.pdf am am.pdf pdf 1584281 AAM-PDF https://s3-eu-west-1.amazonaws.com/prod-ucs-content-store-eu-west/content/egi:1043K6TBZ92/MAIN/application/pdf/31ece6543b404f47558dfd7c31596663/am.pdf APCATA 119615 119615 S0926-860X(24)00059-0 10.1016/j.apcata.2024.119615 Elsevier B.V. Fig. 1 XRD (a) and FT-IR (b) patterns of CN and x-BCN catalysts. Fig. 1 Fig. 2 X-ray photoelectron spectra: (a) survey spectra of CN, 0.01-BCN, 0.10-BCN, 0.20-BCN and 0.30-BCN; (b) B 1 s XPS spectra; (c) C 1 s XPS spectra and (d) N 1 s XPS spectra of various samples. Fig. 2 Fig. 3 SEM images of CN (a1, a2), 0.01-BCN (b1, b2), 0.10-BCN (c1, c2), 0.20-BCN (d1, d2), and 0.30-BCN (e1, e2) samples and EDAX (f) images of 0.30-BCN. Fig. 3 Fig. 4 Nitrogen adsorption-desorption isotherms (a) and Barret-Joyner-Halenda (BJH) pore size distribution plots (b) of catalysts. Fig. 4 Fig. 5 CO2-TPD (a) and NH3-TPD (b) profiles of CN and x-BCN. Fig. 5 Fig. 6 Recycling tests of 0.30-BCN catalyst. Reaction conditions: W(epoxide)=30 g, W(catalyst)=1.5 g, p(CO2)=2.0 MPa, T=130 ℃, t= 20 h. Fig. 6 Fig. 7 The yields of cyclic carbonates formed by cycloaddition of CO2 with various epoxides catalyzed by 0.30-BCN. Fig. 7 Scheme 1 Reaction path for synthesizing carbon nitride using urea as precursor. Scheme 1 Scheme 2 Schematic illustration of preparation process for catalyst. Scheme 2 Scheme 3 Possible reaction pathway of incorporating B atoms into the catalyst structure [32]. Scheme 3 Scheme 4 A proposed mechanism for the cycloaddition of CO2 and BDODGE. Scheme 4 Table 1 The relative percentages of the N species over the catalysts. Table 1 Sample Relative percentage of N components (at%) C−NC N−B C−N− (C/H)−C −NH2 π-excitation CN 61.78 — 21.14 10.30 6.78 0.01-BCN 61.09 — 20.38 12.82 5.71 0.10-BCN 45.54 20.38 24.74 7.60 1.74 0.20-BCN 42.64 22.18 21.65 12.82 0.71 0.30-BCN 41.56 28.19 16.46 13.13 0.66 Table 2 Catalytic performance of various catalysts in the reaction of BDODGE and CO2. Table 2 Image 1 Entry Catalyst a BDODGE Conversion (%) 5CC-BDODGE Selectivity (%) 1 None — — 2 CN 29.6 92.5 3 b H x B y O z 40.5 2.5 4 c CN+H x B y O z 35.8 4.5 5 0.01-BCN 53.4 98.8 6 0.05-BCN 64.1 99.8 7 0.10-BCN 89.2 99.6 8 0.15-BCN 95.6 99.6 9 0.20-BCN 96.6 99.4 10 0.25-BCN 98.0 99.4 11 0.30-BCN 99.8 99.2 12 0.35-BCN 98.1 98.9 a Reaction conditions: W(epoxide)=30 g, W(catalyst)=1.5 g, p(CO2)=2.0 MPa, T=130 ℃, t= 20 h. b W(H x B y O z )=0.345 g, H x B y O z is the calcination product of H3BO3 at 450 ℃. c W(H x B y O z )=0.345 g, W(CN)=0.345 g, and m(H x B y O z ): m(CN)=0.3 in CN+H x B y O z mixed catalyst. A new boron modified carbon nitride metal-free catalyst for the cycloaddition of CO2 and bisepoxides Yuanping Zhang Writing – original draft Methodology Investigation Formal analysis Data curation a b Qin Wang Writing – review & editing a b Qian Chen Writing – review & editing a b Xiaoyun Li Writing – review & editing Visualization Funding acquisition a Yanfang Li Writing – review & editing c Maoqing Kang Supervision Resources Formal analysis a Qifeng Li Writing – review & editing Supervision Resources Formal analysis a ⁎ Junwei Wang Writing – review & editing Supervision Resources Investigation Conceptualization a ⁎ a Institute of Coal Chemistry, Chinese Academy of Sciences, Taiyuan, Shanxi 030001, PR China Institute of Coal Chemistry, Chinese Academy of Sciences Taiyuan Shanxi 030001 PR China Institute of Coal Chemistry, Chinese Academy of Sciences, Taiyuan 030001, Shanxi, PR China b University of Chinese Academy of Sciences, Beijing 100049, PR China University of Chinese Academy of Sciences Beijing 100049 PR China University of Chinese Academy of Sciences, Beijing 100049, PR China c Department of Chemistry and Chemical Engineering, Lyuliang University, Lyuliang, Shanxi 033001, PR China Department of Chemistry and Chemical Engineering, Lyuliang University Lyuliang Shanxi 033001 PR China Department of Chemistry and Chemical Engineering, Lyuliang University, Lyuliang 033001, Shanxi, PR China ⁎ Corresponding authors. The cycloaddition of CO2 and epoxide is regarded as an eco-friendly, sustainable, and promising way to utilize CO2. However, it is crucial to design and prepare efficient and low-cost catalysts for this reaction. Herein, through controlling condensation temperature, a series of boron modified urea-derived g-C3N4 (x-BCN) were prepared. Notably, more edge defect (−NH2/−NH−) formed at low roasting temperatures and both basic and acidic sites increased after introducing B. 0.30-BCN exhibited superior catalytic performance for cycloaddition of CO2 with 1, 4-butanediol diglycidyl ether and 99% cyclic carbonate yield was acquired at 130 ℃, 2.0 MPa after 20 h reacting. Additionally, 0.30-BCN showed outstanding recyclability and substrate adaptability. The synergistic effects of edge defects, rich mesoporous structure and Lewis acid-base sites were conductive to promoting CO2 cycloaddition. Moreover, a possible multi-synergetic mechanism was proposed. An originality option was provided for preparing a simple, eco-friendly, and efficient metal-free catalyst for practical CO2 fixation. Graphical Abstract Keywords Urea-derived carbon nitride Low polymerization degree Boron modification Acid-base duality CO2 cycloaddition Data availability Data will be made available on request. 1 Introduction The greenhouse effect caused by excessive carbon dioxide (CO2) emissions has triggered a series of severe negative impacts, including global warming, glacier melting, ocean acidification, and extreme weather events [1,2]. Meanwhile, CO2 is also an abundant, non-toxic, and sustainable C1 resource for synthesis of high value-added chemicals such as urea, methane, methanol, formic acid, organic/inorganic carbonates [3–7]. Among them, the cycloaddition of CO2 and epoxides into cyclic carbonates is one of the simplest and most atomic efficient path for CO2 utilization, and it also fully conforms to the concept of green chemistry. Furthermore, cyclic carbonate is widely used in polar aprotic solvents, electrolytes for Li-ion batteries, polycarbonate monomers, medical intermediates, and so on [8–11]. Due to the thermodynamic stability and kinetic inertness of CO2 [8,12], it is necessary to find efficient catalysts that can break high reaction barriers of CO2 cycloaddition reaction. Previous literature pointed out that ring-opening of epoxide is the rate-determining step in CO2 cycloaddition [13]. In general, metal ions and hydrogen bond donors (HBDs) can be used to activate epoxides. Metal ions can be used to activate epoxides as Lewis acids by forming metal−O coordination bonds, while HBDs can polarize the C−O bonds of epoxides via forming hydrogen bonds with O of epoxides. Based on these, a variety of homogeneous and heterogeneous catalysts have been developed, such as metallic oxides [14,15], ionic liquids [16,17], HBDs complex [18,19], metal-organic framework (MOFs) [20,21], and functional polymers, etc. [22,23]. While improving the catalytic performance, these catalysts also have some drawbacks such as difficult product separation and purification, complex catalyst synthesis route, metal leaching and environmental pollution. Besides, most catalysts currently target the reaction of small mono-epoxides with CO2. In the case of CO2 cycloaddition for epoxides containing two or more epoxy groups, relatively few studies on the utilization of catalysts have been reported. Moreover, difunctional or polyfunctional cyclic carbonates can serve as precursors for highly potential chemicals, such as non-isocyanate polyurethanes [24,25]. It is known that larger epoxide molecules intrinsically have higher steric demand, and the physical properties of molecules of different sizes (such as viscosity) also vary greatly, making the cycloaddition of CO2 to high molecule weight epoxides challenging. Therefore, it is meaningful to develop a metal-free heterogeneous catalyst with simple preparation, low cost and high efficiency for the cycloaddition reaction between CO2 and polyfunctional epoxides (such as 1, 4-butanediol diglycidyl ether). Graphite carbon nitride (g-C3N4), a metal-free heterogeneous catalyst, aroused extensive attention in CO2 cycloaddition due to its preparation simplicity, high thermal and chemical stability, eco-friendliness, and nitrogen-rich structure. In particular, rich amine groups (such as tri-s-triazine ring, −NH2, and −NH−) on the surface of g-C3N4 can be used to adsorb and activate CO2 as Lewis base sites [26,27], and these uncondensed amines (−NH2 and −NH−) can also activate partly epoxide through hydrogen bonding [28,29]. Additionally, in the process of synthesizing g-C3N4 by thermal condensation polymerization, intermediates with different degrees of condensation such as melem are successively produced ( Scheme 1). Interestingly, these intermediates have different catalytic activities, and more terminal defective structures are conducive to CO2 cycloaddition reactions. Unfortunately, the original CN provided poor activity owing to its low specificity and absence of active sites that can activate epoxide. Hence, a series of strategies (including increasing surface area, element doping, and so on) to modify g-C3N4 were developed to further improve the catalytic performance. Currently, various modified g-C3N4 catalysts such as mesoporous mp-CN-450 [30], the exfoliation of CN [31], SBA-15 loaded CN [32], metal halides supported CN [33], have been reported in the CO2 cycloaddition. The results proved that the modified CN significantly improved the catalytic activity. Su et al. [34] reported the urea-derived g-C3N4 (u-g-C3N4) prepared at different temperatures could catalyze CO2 cycloaddition reaction with 67.2% propylene carbonate (PC) yield under 130 ℃, 2.0 MPa for 8 h. It demonstrated that lower polymerization degree and a larger number of macropores were obtained as the preparation temperature decreased, which exposed more edge defects, resulting in better catalytic performance. Zhu et al. [32] reported that B-doped carbon nitride (B-CN) loaded on SBA-15 catalyzed the CO2 cycloaddition reaction with 94.7% styrene carbonate (SC) yield under 130 °C, 3.0 MPa for 24 h. The improvement of B-CN catalytic activity was mainly attributed to the increase of both surface basic and acid sites of g-C3N4 after doping of B atoms. However, harsher reaction conditions are still required, and some of them require solvents or co-catalysts to improve the catalytic activity. Considering the above principles, a series of metal-free boron modified g-C3N4 with acid-base duality (x-BCN) were successfully developed using urea as precursor and boric acid as B source at 450 ℃. The effects of different B amounts on the crystallinity, polymerization degree, species and positions of active groups, and quantities of edge defects of the sample were investigated. Moreover, according to XPS and elemental analysis characterization, the insertion sites of B and the influence of B introduction on different N-containing groups in the catalyst structure were further confirmed. Subsequently, the x-BCN as catalysts were used for the cycloaddition of CO2 and 1, 4-Butanediol diglycidyl ether (BDODGE) without co-catalyst and solvent, and the catalytic behaviors were briefly studied. Ultimately, a multi-synergetic mechanism of the catalytic cycloaddition was proposed. 2 Experimental 2.1 Catalyst preparation The urea-derived carbon nitride was synthesized using the previously reported method [34]. Typically, 10 g of urea was poured into a covered crucible and heated to 450 ℃ for 4 h in a muffle furnace with a heating rate of 5 ℃ min−1. The obtained yellow solid product was ground to a fine powder for further use. The obtained urea-derived carbon nitride catalyst was marked as CN. A series of B modified carbon nitride catalysts with varied boron amounts were prepared according to the literature [35]. Typically, 5 g of urea and a certain amount of H3BO3 were mixed in deionized water and treated through ultrasonic treatment for 30 min. The obtained solution was heated to 80 °C on magnetic stirring until water was completely evaporated. Thereafter, the final mixture was transferred into a muffle furnace and calcined in air at 450 ℃ for 4 h. Through the above steps, a series of x-BCN catalysts with different H3BO3/Urea mass ratios (x = 0.01, 0.05, 0.10, 0.15, 0.20, 0.25, 0.30, 0.35) were prepared (x represents the boron weight percentage). The preparation process of the catalysts is shown in Scheme 2. 2.2 Characterization The crystal structures of the samples were characterized by using X-ray diffraction (XRD) measurements on a Bruker D8 Advance X-ray diffractometer with Cu Kα (λ= 1.54 Å) irradiation. The Fourier-transform infrared (FT-IR) spectra were collected on the Nicolet iS20 FT-IR instrument. The elemental composition and chemical states were obtained using X-ray photoelectron spectroscopy (XPS) measurement and recorded on an AXIS ULTRA DLD spectrometer. Elemental analysis (EA) was used to determine the content of H, C, N, and O in the sample with a Vario EL CUBE instrument. The surface morphology and element distribution of the samples were investigated using scanning electronic micrograph (SEM, JSM-7001 F). Nitrogen adsorption-desorption isotherms were conducted on the Tristar II 3020 measurement at liquid nitrogen temperature. Thermogravimetric analysis (TGA) was recorded on the TGA-50 instrument. The samples were heated from room temperature to 800 ℃ at a heating rate of 10 ℃ min−1 under N2 atmosphere with a flow rate of 30 mL min−1. The temperature programmed desorption (TPD) measurements were measured using a BELCAT-B instrument equipped with a thermal conductivity detector (TCD) detector. The TPD measurements were carried out the temperature range of 30−450 ℃ with a heating rate of 10 ℃ min−1. 1H NMR spectra were taken by using Bruker AVANCE Ⅲ (400 MHz) spectrometer using CDCl3 as the solvent and toluene as an internal standard. 2.3 Synthesis of five-membered cyclocarbonates (5CC) The 1, 4-butanediol diglycidyl ether cyclic carbonate (BDODGE-5CC), hereafter this cyclocarbonate being abbreviated as 5CC, was synthesized by BDODGE with CO2 to evaluate the catalytic performance of the prepared catalysts. Firstly, 1.5 g catalyst and 30.0 g BDODGE were introduced into a 100 mL stainless steel autoclave equipped with a magnetic stirrer. The reactor was purged with N2 for three times and heated to 130 ℃. Thereafter, the autoclave was pressurized with CO2 to 2.0 MPa and maintained for 20 h under stirring. Finally, the reactor was cooled to room temperature and the mixture was separated via filtration and centrifugation. The conversion of BDODGE and selectivity of corresponding cyclic carbonate were calculated from the 1H NMR spectra of the product [36], and the 1H NMR spectra of all epoxides and cyclic carbonates used in this work were exhibited in Fig. S6-12. (Details are shown in Supplementary Information). 3 Results and discussions 3.1 Compositional and structural studies The structural investigations of x-BCN were carried out using powder XRD measurements, and the patterns are presented in Fig. 1(a). The XRD pattern of CN was added as a contrast. The CN presents two diffraction peaks at around 13.1° and 27.3°, which are assigned to the (100) and (002) planes of carbon nitride, respectively. The former relates to the in-plane repeating tri-s-triazine units and the latter corresponds to the interplanar stacking structure [37]. The (002) diffraction peak of the B-modified samples shifted to a small diffraction angle and the peak became weaker and broader compared with CN. This indicates that the insertion of boron atoms increased the interplanar distance of the aromatic units, thereby altering the structure of carbon nitride. Meanwhile, with the increase of B content, the in-plane repeating unit (100) peak of tri-s-triazine gradually weakened and finally disappeared. The introduction of boron atoms disrupted the atomic arrangement and created defect points in the x-BCN structure, which ultimately caused ring structure distortion and decreased the crystallinity, as reported in the literature [35]. Additionally, H3BO3 could react with −NH2 in tri-s-triazine ring structure and formed the −NB(OH)2 structure [32], which passivated the original −NH2 and prevented further condensation of tri-s-triazine unit, resulting in a decrease in crystallinity. FT-IR was applied to study the composition and structure of the samples, as shown in Fig. 1(b). In the spectrum of CN, the absorption bands in the region of 1200–1700 cm−1 and 810 cm−1 are attributed to the stretching and bending vibrations of tri-s-triazine heterocycles [33], respectively. Similarly, x-BCN has a chemical skeleton as CN. However, with the introduction of B, x-BCN display a weak absorption band in these regions, indicating that the triazine ring structure was destroyed and the polymerization degree was reduced, which is consistent with the XRD results. The absorption band in 3000–3500 cm−1 was enhanced from CN to 0.30-BCN, indicating that more terminal amino groups (−NH2/−NH) or hydroxyl groups (−OH) produced with the introduction of B atoms. −NH2/−NH originated from the destroyed g-C3N4 edge, and its content increased with the decrease of g-C3N4 condensation degree. It is worth noting that these defects may provide more catalytic active sites for the adsorption and activation of CO2. Noteworthily, new peaks appearing at 1398 cm−1 and 1040 cm−1 are attributed to the stretching vibration of the B−N and B−O bonds, which confirmed the successful incorporation of B [32]. Besides, a gradually enhanced absorption peak appears at 2171 cm−1 after the incorporation of boron in CN, which is assigned to stretching modes of CN. The production of CN also prevented further polymerization of the precursor, which is helpful to the formation of more defects. To further figure out the chemical states of the successful introduction of B elements, various samples were verified by XPS measurements ( Fig. 2). The overall spectra for all catalysts are shown in Fig. 2(a), which shows three different peaks around 282, 397 and 530 eV corresponding to the carbon, nitrogen, and oxygen atoms, respectively [38]. The new peak at 189 eV in the x-BCN spectra is attributed to the B atoms [35], indicating that the B was successfully inserted into the structure of carbon nitride. The B 1 s spectrum of 0.30-BCN could be deconvoluted into three peaks at 190.9, 191.9, and 192.9 eV, which is ascribed to B−N, B−N−C, and −NB(OH)2, respectively. The corresponding binding energy of all these peaks is higher than 190.00 eV and lower than 194.00 eV, which confirms that h-hexagonal boron nitride and B2O3 were not generated [35]. Moreover, B atoms may exist in two ways in the x-BCN structure by replacing the C atoms from x-BCN network and bonding to three nitrogen atoms in the triazine or heptazine ring structure, or by reaction between H3BO3 and −NH2 on the surface of x-BCN to form −NB(OH)2. Wherein, when the C atom in the x-BCN framework was substituted by B, it might be connected to the bridged N atoms (bay B atoms) or inserted between the six-membered rings of the tri-s-triazine ring unit (corner B atoms). According to the calculation results of the atomic percentage with different B components (see Table S1), it can be concluded that bay B atoms (191.9 eV) mainly exist in the BCN network. Moreover, the percentage of B atoms associated with −NB(OH)2 gradually increased with the increase of B incorporation. It is due to the introduced B prevented further condensation of melem molecules, and resulted in more terminal amino groups (−NH2), which reacted with boric acid to generate more −NB(OH)2 groups. In the case of C 1 s XPS spectrum of CN, there are three peaks at 284.8, 286.0 and 288.2 eV belonged to the graphitic carbon (C−C), sp2 hybridized carbon (C−NH2), and triazine carbon (N−CN) in tri-s-triazine ring, respectively (Fig. 2c). Comparing to CN, C 1 s XPS of x-BCN indicates similar C chemical states. However, the C 1 s peaks of x-BCN located at around 285.6 eV contains two kinds of C atoms, corresponding to C−NH2 and C−NB(OH)2, respectively. As the replacement of the C atom by B atom, the binding energy shifted toward lower energy, which was caused by an increase in the electron cloud density on the C atoms due to the electron-giving induction effect of −NB(OH)2. Moreover, with the increase of B introduction, x-BCN shows a significant increase in the percentage of C linked to C−NB(OH)2 bonds. While the content of triazine carbon and graphitic carbon in x-BCN decreased, which led to the disruption of the crystal structure of carbon nitride. For CN, the N 1 s peak could be fitted with four peaks at binding energies of 398.7, 399.8, 401.1, and 404.4 eV (Fig. 2d). The peak at 398.7 eV is assigned to triazine skeleton nitrogen (CN−C). The peak at 399.8 eV is identified as bridge groups (C−N(−C)−C) or partially-condensed (C−N(−H)−C), and the peak at 401.1 eV is ascribed to the uncondensed primary nitrogen groups (−NH2) [39]. Besides, a broad peak at 404.4 eV is assigned to the charging effects in the carbon nitride framework. Similarly, the N 1 s spectrum of x-BCN exhibits four characteristic peaks as CN. Besides, a new peak at 399.5 eV in x-BCN is ascribed to the N−B [35], which further confirms that B atoms bind to N instead of C atoms. Table 1 summarizes the relative percentage content of nitrogen species for all catalysts. Compared to the original CN, the percentage content of CN−C in x-BCN decreased but N−B increased, which was caused by the substitution of C atoms by B in the CN framework. Whereas, the change in the content of bridged amine (C−N(−C/H)−C) and terminal amine (−NH2) was affected by the reaction between boric acid and −NH2. This reaction affected the further condensation of melem, resulted in the production of more −NH2. Part of the −NH2 could further react with boric acid to generate −NB(OH)2 groups that could activate epoxides, while the others served as the active site for activating CO2. It is worth noting that the introduction of B caused a certain impact on the electron cloud density of the different N species. For CN, the C and N atoms on the heptazine ring are bonded in sp2 hybrid orbitals, and each atom provides a p orbital with one p electron, forming a conjugated system of three ring-closed 6π electrons. The lone electron pairs on the N atom of the ring that do not participate in bonding interact with the π electrons on the heptazine ring, formed a more stable conjugated system. The result of electron homogenization could cause the charge on N transfer to the C atom partially. However, when some of the C atoms on the ring were replaced by B atoms, the large π-conjugation system of the heptazine ring was disrupted. It may be attributed that B bonded to the adjacent N via sp3 hybridized orbital, which caused a shift of the charge on the ring toward CN−C. Moreover, the N atom attached to B also formed an electron-donating p-π conjugation system with CN−C, which further caused the charge to shift toward CN−C. A higher electron cloud density is more conducive to the adsorption and activation of CO2 by triazine skeleton nitrogen (CN−C), and beneficial to the cycloaddition reaction. Elemental analysis was performed on the prepared samples, and the results are shown in Table S2. The C/N atomic ratio of CN is around 0.65 (theoretical value of g-C3N4=0.75), which implies that the sample calcined at 450 ℃ is an incomplete condensation product. With the addition of B, the C/N value gradually decreased, indicating that the degree of polymerization of x-BCN decreased. Moreover, the C content in x-BCN gradually decreased, which might resulted from more B−N structure generated in the CN framework due to the boron replacement. However, the increase in N content reconfirmed that the introduction of B prevented further condensation of melem and produced more terminal amine groups. Moreover, the C/H atomic ratio of x-BCN also gradually decreased, which is a sign of the increase of −NH2/−NB(OH)2 groups. Simultaneously, the higher O element content in x-BCN also proves the generation of −NB(OH)2, which is consistent with the analysis results of XPS. The thermogravimetric analysis (TGA) was carried out to figure out the thermal stability of CN and 0.30-BCN. As shown in Fig. S2, CN exhibits only 3.03% weight loss up to 150 ℃, which is mainly due to the evaporation of adsorbed water on the catalyst surface. Only 4.23% weight loss is observed up to 450 ℃, which confirms the high thermal stability of the ring structure. After 450 ℃, CN exhibits a rapid weight loss and the complete decomposition by 750 ℃. Whereas the weight loss of CN is slightly greater than that of 0.30-BCN at 150 ℃. Because boron has empty p-orbital in its shell that allowed it to attract water molecules, resulted in more adsorbed water on the surface of the sample after B addition. The 0.30-BCN exhibits significant weight loss between 150 and 450 ℃ in comparison to CN, and the weight loss is still ongoing after 450 ℃. It is ascribed to the insertion of boron orderly destroyed the ring structure in the CN, thereby reduced the overall stability of the x-BCN. 3.2 Morphological and textural properties studies To survey the surface morphology and relative textural properties of catalysts, SEM images ( Fig. 3) and nitrogen adsorption-desorption characterization ( Fig. 4) results of different B-modified samples were obtained. As shown in Fig. 3(a, b), pure CN is composed of a lot of amorphous fine particles, giving abundant interparticular porosity, which led to the porous structure of CN (33 m2g−1, 0.0916 cm3g−1). This special morphology was formed via NH3 and CO2 generation during the thermal treating process of CN from urea. In contrast, the x-BCN exhibits a porous layered structure, and this layered structure became more pronounced with the introduction of B, which led to a gradual increase in the BET specific surface area and pore structure. It may be related to borate melting and dehydration under high temperature conditions, as well as the reaction between boric acid and urea oligomers [39]. The enhancement in both BET surface area and pore volume exposed more active sites, which are conducive to improving the catalytic activity. However, when introduced B exceeded a critical point, the x-BCN became more solidified and the pore volume decreased (see Table S3). The major reason is that the introduction of B resulted in a distortion in the x-BCN ring structure, which led to pore collapse and more stacking of small layers. Interestingly, it can be clearly observed that small lamella curled up or stacked to form abundant orderly channels with large pore sizes (32 nm) on the surface of 0.30-BCN, which would facilitate the transport of reactants and product molecules, further improving the catalytic activity. Additionally, the energy dispersive X-ray (EDAX) spectra shown in Fig. 3(f) clearly exhibits the uniform distribution of B, C, N, and O elements in the 0.30-BCN, indicating the successful incorporation of B atoms in the CN framework. 3.3 Acidic and basic properties studies The temperature-programmed desorption (TPD) measurements were performed in order to identify and evaluate the acid-base sites on the catalysts. The NH3-TPD and CO2-TPD were employed to determine the acidic amount and basic amount of the catalysts, respectively, and the obtained curves were peak fitted. As shown in Fig. 5(a), various surface basic sites are displayed on the CO2-TPD profile of CN. According to previous reports [40], the surface basicity of CN was corresponded to the nitrogen-containing functional groups present in different forms in the catalyst structure (C−NC, −NH−, and −NH2), which resulted in three deconvoluted CO2 desorption peaks. These CO2 desorption peaks indicated the presence of weak and medium strength basic sites in the CN surface. Similarly, the CO2-TPD profile of x-BCN was deconvoluted into three peaks. Interestingly, the CO2 desorption temperature of BCN gradually increased with the introduction of B, indicating that the surface basic intensity of BCN was enhanced [35]. It was found that the content of basic site −NH2 increased firstly then decreased as the CN was modified by B. This was a result of more surface amine groups, which were generated due to the surface termination caused by the −NB(OH)2 formed from boric acid and −NH2. Subsequently, these amino groups react with the remaining boric acid again, which consumed a certain amount of −NH2. Additionally, the content of C−NC decreased with the introduction of B as a result of the destruction of heptazine ring structure and the formation of B−N bonds caused by B replacing C in the CN framework. This is consistent with the XPS results. Furthermore, the larger specific surface area of x-BCN is another reason for the enhancement in the number of basic sites because the large specific surface area exposed more activity, as confirmed by BET results. In general, the number of basic sites increased and the amount of basicity enhanced with the introduction of B. The NH3-TPD plot of CN (Fig. 5b) shows that NH3 was desorbed with a peak at around 150 ℃, corresponding to the weak adsorption of NH3, which is ascribed to acidic sites with weak strength. When the temperature was above 350 ℃, a broad desorption peak emerged, which was mainly caused by the further thermal decomposition of g-C3N4. BCN exhibited three peaks (110, 208, and 328 ℃) in lower and higher temperature regions compared to CN [35]. With the increase of B introduction, the area of NH3 desorption peak of x-BCN in the high temperature region gradually increased, which indicated the amount of basicity for x-BCN enhanced significantly as the amount of B increased. The two NH3 desorption peaks present at 208 ℃ and 328 ℃ were ascribed to the presence of the Lewis acidic sites formed by boron atoms in different chemical states, as reported in the literature [32]. Compared with CN, x-BCN had stronger acidity, which endowed the catalyst surface with acidic-basic sites and synergistically activate both CO2 and the epoxide for the cycloaddition reaction. Moreover, the amount of basicity for x-BCN enhanced significantly as the amount of B increased. Therefore, it is evident that both basic and acidic sites increased after introducing B in the CN, which is beneficial for the cycloaddition of CO2 and epoxides. 3.4 Catalytic activities The catalytic activities of CN and x-BCN were evaluated using 1, 4-butanediol diglycidyl ether (BDODGE) as the model substrate via examining the conversion of epoxide and selectivity of five-membered cyclic carbonate (5CC-BDODGE). The results are listed in Table 2. All conversion and selectivity were determined by 1H NMR characterization using toluene as an internal standard. Additionally, as a contrast, the catalytic activity of the burnt product H x B y O z of boric acid at 450 ℃ and the mixed sample of CN and H x B y O z for this reaction was also investigated. The reaction hardly occurred without catalyst participation (entry 1). The BDODGE conversion increased to 29.6% (with a 5CC-BDODGE selectivity of 92.5%) when CN was used as a catalyst. The lower conversion obtained in the case of CN was due to the presence of basic sites on its surface, which activated only CO2 molecules. After the introduction of B atoms in CN, the catalytic activity was improved further. Among all the x-BCN catalysts, 0.30-BCN obtained the highest BDODGE conversion up to 99.8%, and the best cyclic carbonate selectivity up to 99.2% at 130 °C for 20 h. The reasons are as follows. Firstly, the larger specific surface area and richer pore structure were obtained with the addition of boron in CN. The higher SBET could not only provide more catalytic active sites but also assist in the adsorption of the reactants more readily, which facilitated the contact between substrates and active groups. Besides, the larger pore size allowed better mass transport, which enabled reactant and product molecules to transfer more easily in the reaction process. Secondly, both CN and x-BCN were obtained by calcining at 450 ℃, which resulted in a lower crystallinity and polymerization degree with more edge defects. These edge defects were mainly composed of partially condensed groups such as primary amine (−NH2) groups and secondary amine (−NH−) groups. It is worth noting that CO2 molecules and epoxides could be activated by these terminal uncondensed amino groups, which was reported previously. Part of the triazine ring and bridged hydrazine in the x-BCN structure was destroyed due to the introduction of B atom, exposing more terminal amino groups, which was beneficial to the coupling of CO2 and epoxides. Furthermore, the active centers were also influenced by the introduction of B atoms. The addition of B atoms introduced Lewis acid groups such as −B(OH)2 and thus induced the formation of an acid-base duality site. Obviously, Lewis acidic and Lewis basic sites could synergistically activate the epoxides and CO2, accelerating the cycloaddition reaction. However, excessive B might harm the catalytic performance (see entry 12), since too large B addition can seriously damage the structure of CN. The mixture of CN and H x B y O z (the product of boric acid calcination at 450 ℃) was also used as a catalyst for the cycloaddition of BDODGE and CO2. Clearly, the mixture exhibited a rather poor performance giving a BDODGE conversion of 35.8% with a less than 5% 5CC-BDODGE selectivity at the same reaction conditions (Entry 4). When the reaction was carried out in the presence of H x B y O z alone, the yield was only 1.0% (Entry 3). It further indicated that the B in CN structure, as the Lewis acid site, could combine with the basic sites in the catalyst and synergistically promote the cycloaddition, which resulted in a better 5CC yield. Recyclability is a crucial standard for evaluating catalyst performance. In order to investigate the stability of the catalyst, 0.30-BCN recycling experiments were conducted by the cycloaddition of CO2 and BDODGE at 130 °C, 2.0 MPa for 20 h. After each cycle, the catalyst was recovered through filtration and centrifugation, and then thoroughly washed with acetone and anhydrous ethanol, dried, and used for the next cycle. As shown in Fig. 6, almost no decrease was detected in the conversion of BDODGE and the selectivity of 5CC-BDODGE after 5 cycles, indicating that the catalyst has superior stability. In addition, the structure of the recycled catalyst was also characterized to elucidate the mechanism for maintaining good stability. XRD patterns and FT-IR spectra of 0.30-BCN before and after use for five runs were shown in Fig. S4 (a, b), respectively. In the XRD patterns (Fig. S4a), the used BGCN05 resembled the fresh 0.30-BCN, indicating the catalyst maintained stability after recycling. The FT-IR shows that a new absorption peak appeared at 1785 cm−1 on the recycled catalyst, which is attributed to the residual macromolecular product cyclic carbonate in the catalyst sample. Furthermore, in the TGA curves (Fig. S4c), a new weight loss peak was found in the recovered 0.30-BCN, which was attributed to the mass loss of residual cyclic carbonates in the catalyst. In general, 0.30-BCN presented excellent catalytic performance due to its multiple active sites on the surface. Since 0.30-BCN owns superior catalytic performance among all catalysts, the optimal reaction condition for CO2 cycloaddition was further studied using 0.30-BCN as the catalyst, as shown in Fig. S5. The 5CC-BDODGE yield was positively correlated with the temperature in the range of 110–140 ℃ (Fig. S5a). Obviously, with the temperature raised from 110 to 140 ℃, the 5CC-BDODGE yield remarkably increased from 47.5% to 99.7%, which is due to the increased effective collision between catalyst and reactant with the increase of temperature. When the temperature was 130 ℃, the 5CC-BDODGE yield reached 99%. However, as the temperature further increased to 140 ℃, the 5CC-BDODGE yield slightly increased. Therefore, 130 ℃ was considered the appropriate reaction temperature. The catalytic results obtained at different reaction times are shown in Fig. S5b. With prolonging the reaction time, gradual enhancement in the BDODGE conversion was obtained. From the curve, it can be observed that BDODGE conversion almost linearly increased in the first 15 hours, then slowly risen reaching 99.8% after the next 5 hours, and the 5CC-BDODGE selectivity remained above 98%. Additionally, catalytic reactions were found to be insensitive to the pressure of CO2. A higher BDODGE yield was obtained, both in the low or high pressure, which may be related to the properties of large molecule bifunctional epoxies themselves. Optimizing the reaction conditions, it has been demonstrated that 0.30-BCN could efficiently catalyze CO2 cycloaddition reaction under mild conditions. Subsequently, the suitability of 0.30-BCN catalyst for other epoxides was also investigated and the results were displayed in Fig. 7. It is found that 0.30-BCN shows high catalytic activity for all epoxides. Obviously, the activity of ECH is superior to other mono-functional epoxides, due to the Cl– in ECH structure. In the reaction process, the Cl anion released by ECH served as a nucleophilic agent to promote the ring opening of epoxides, thus facilitating the cycloaddition reaction. The better conversion (90.7%) was achieved when styrene oxide was used. It might be ascribed to phenyl-induced changes in the electron cloud of the epoxy group, making the epoxy group more vulnerable to attack by nucleophiles. Additionally, the catalytic activity of bifunctional epoxides (EDODGE, NPODGE, BDODGE, HDODGE) was found to be higher than mono-functional epoxide (PO, ECH, SO), which related to the O atom from the ether bond of glycidol ether. The O atom, as an electron-withdrawing group with high electronegativity, could strongly attract the electron cloud adjacent to the epoxy group, which made it easier to open the ring during the attack of nucleophiles. For the epoxide (such as PO) without such an electronegative structure, it showed a lower yield (78.7%). Also, the steric hindrance also affected the conversion of epoxide. For example, the conversion of NPODGE is lower than that of other bisepoxides. Therefore, it is reasonable to expect that 0.30-BCN would be a promising catalyst for the synthesis of cyclic carbonates and potential industrial application because of its high catalytic activity and suitability for various epoxides. The catalytic performance of several g-C3N4-based catalysts reported in the cycloaddition reaction of CO2 and SO are summarized in Table S4. Metallic Zn-doped g-C3N4 catalysts such as 2.0Zn@g-C3N4-550 [41], Zn-CN/C [42], ZnBr2/g-C3N4 [33], and 5ZnO2/g-C3N4-400 [43] presented excellent catalytic activity in the cycloaddition reactions of CO2 and SO. Meanwhile, some metal-free g-C3N4-based catalysts have also shown efficient catalytic performance for CO2 cycloaddition, such as B-doped [35], P and B co-doped [44], SBA-15-loaded [32], K,B-CN-4 [45]and modified by carboxyl or other functional groups [29] g-C3N4-based catalysts. Although the previous catalysts have realized effective conversion of CO2 into SC, most of them still needed a co-catalyst or solvent. In comparison with the catalysts listed above, the metal-free 0.30-BCN developed in a simple method exhibited excellent catalytic activity and could achieve comparable or higher product yield for the CO2 cycloaddition without any solvent and co-catalyst. 3.5 Reaction mechanism Based on the above discussions and related literature [26,46,47], a possible mechanism for the coupling reaction of CO2 with epoxides over 0.30-BCN was proposed and illustrated in Scheme 4. Firstly, the −NH2, −NH− and acidic −B(OH)2 sites in catalyst structure, as hydrogen bond donors [46,47], formed hydrogen bonds with O atom of epoxide, which activated the epoxides to undergo the CO2 cycloaddition. Meanwhile, the N-containing groups served as Lewis bases to activate CO2 and formed carbamate salt simultaneously. Subsequently, tertiary amine conducted a nucleophilic attack on the less sterically hindered β-carbon atom of the activated epoxide and enabled the ring-opening of epoxides, forming an intermediate for oxygen-negative ions. After that, a new linear alkyl carbonate compound was generated due to the nucleophilic attack of oxygen anion on carbamate salt. Ultimately, the subsequent intermediate formed the cyclic carbonate after intramolecular ring closure and regenerated the catalyst simultaneously. It was worth noting that the synergetic effect of both acidic sites (derived from boron atoms) and basic sites (derived from nitrogen atoms) presented on BCN catalysts could activate CO2 and epoxide simultaneously, thus promoted the reaction significantly. 4 Conclusions In conclusion, a series of metal-free carbon nitrides (x-BCN) with varying boron content were successfully prepared via thermal condensation of urea and boric acid at 450 ℃. As a catalyst for CO2 cycloaddition with epoxides, 0.30-BCN exhibited a high 5CC-BDODGE yield (99%) and excellent stability in the absence of solvent and co-catalyst. It was found that a low crystallinity and polymerization degree of CN with more edge defects (−NH2) was obtained at lower preparation temperature. These edge defects caused by incomplete condensation of carbon nitride were considered active sites for CO2 activation. Moreover, boron hydroxyl groups (−B(OH)2) were formed in the catalyst by introduced B atom, which could activate epoxide. CO2 and epoxide could be co-activated on the catalyst surface, which further promoted the cycloaddition due to the existence of acid-base duality. Additionally, the increase in surface area of x-BCN was another important factor in achieving its excellent catalytic performance. In summary, the multi-synergistic effects of edge defects (−NH2, −NH−), N atoms (CN−C) of the s-triazine skeleton unit, boron hydroxyl groups (−B(OH)2), and high specific surface area maximized the catalytic potential of x-BCN for CO2 cycloaddition. In addition, a possible multi-synergetic mechanism for CO2 cycloaddition was put forward. Considering the high catalytic activity, thermal stability, and good recoverability, 0.30-BCN is expected to be an efficient heterogeneous catalyst in the utilization of CO2 for the synthesis of cyclic carbonate. CRediT authorship contribution statement Wang Junwei: Writing – review & editing, Supervision, Resources, Investigation, Conceptualization. Li Qifeng: Writing – review & editing, Supervision, Resources, Formal analysis. Kang Maoqing: Supervision, Resources, Formal analysis. Li Yanfang: Writing – review & editing. Li Xiaoyun: Writing – review & editing, Visualization, Funding acquisition. Chen Qian: Writing – review & editing. Wang Qin: Writing – review & editing. Zhang Yuanping: Writing – original draft, Methodology, Investigation, Formal analysis, Data curation. Declaration of Competing Interest The authors declare that they have no known competing financial interests or personal relationships that could have appeared to influence the work reported in this paper. Acknowledgements This work was supported by the National Natural Science Foundation of China (Grant No. 52003286, China), the Youth Innovation Promotion Association of Chinese Academy of Sciences (Grant No. 2023431, China), and the Innovation Fund Programs of Institute of Coal Chemistry (supported by ICC CAS, Grant No. SCJC-DT-2022-02, China). Appendix A Supporting information Supplementary data associated with this article can be found in the online version at doi:10.1016/j.apcata.2024.119615. Appendix A Supplementary material Supplementary material References [1] R. Francke Homogeneously catalyzed electroreduction of carbon dioxide-methods, mechanisms, and catalysts Chem. Rev. 118 2018 4631 4701 10.1021/acs.chemrev.7b00459 R. Francke, et al., Homogeneously catalyzed electroreduction of carbon dioxide-methods, mechanisms, and catalysts, Chem. Rev., 118 (2018) 4631-4701. https://doi.org/10.1021/acs.chemrev.7b00459. [2] C. Bonneuil Early warnings and emerging accountability: total’s responses to global warming, 1971–2021 Glob. Environ. Change 71 2021 10.1016/j.gloenvcha.2021.102386 C. Bonneuil, et al., Early warnings and emerging accountability: Total’s responses to global warming, 1971–2021, Glob. Environ. Change, 71 (2021). https://doi.org/10.1016/j.gloenvcha.2021.102386. [3] A.J. Kamphuis CO2-fixation into cyclic and polymeric carbonates: principles and applications Green. Chem. 21 2019 406 448 10.1039/C8GC03086C A.J. Kamphuis, et al., CO2-fixation into cyclic and polymeric carbonates: principles and applications, Green Chem., 21 (2019) 406-448. https://doi.org/10.1039/C8GC03086C. [4] X. Jiang Recent advances in carbon dioxide hydrogenation to methanol via heterogeneous catalysis Chem. Rev. 120 2020 7984 8034 10.1021/acs.chemrev.9b00723 X. Jiang, et al., Recent advances in carbon dioxide hydrogenation to methanol via heterogeneous catalysis, Chem Rev, 120 (2020) 7984-8034. https://doi.org/10.1021/acs.chemrev.9b00723. [5] A. Dibenedetto The future of carbon dioxide chemistry ChemSusChem 13 2020 6219 6228 10.1002/cssc.202002029 A. Dibenedetto, et al., The future of carbon dioxide chemistry, ChemSusChem, 13 (2020) 6219-6228. https://doi.org/10.1002/cssc.202002029. [6] R.B. Mujmule Efficient imidazolium ionic liquid as a tri-functional robust catalyst for chemical fixation of CO2 into cyclic carbonates J. Environ. Manag. 314 2022 115045 10.1016/j.jenvman.2022.115045 R.B. Mujmule, et al., Efficient imidazolium ionic liquid as a tri-functional robust catalyst for chemical fixation of CO2 into cyclic carbonates, J. Environ. Manage., 314 (2022) 115045. https://doi.org/10.1016/j.jenvman.2022.115045. [7] F. Zhang Recent advances in the catalytic conversion of CO2 to chemicals and demonstration projects in china Mol. Catal. 541 2023 10.1016/j.mcat.2023.113093 F. Zhang, et al., Recent advances in the catalytic conversion of CO2 to chemicals and demonstration projects in china, Mol. Catal., 541 (2023). https://doi.org/10.1016/j.mcat.2023.113093. [8] V. Aomchad Recent progress in the catalytic transformation of carbon dioxide into biosourced organic carbonates Green. Chem. 23 2021 1077 1113 10.1039/D0GC03824E V. Aomchad, et al., Recent progress in the catalytic transformation of carbon dioxide into biosourced organic carbonates, Green Chem., 23 (2021) 1077-1113. https://doi.org/10.1039/D0GC03824E. [9] L. Guo Recent developments in organocatalysed transformations of epoxides and carbon dioxide into cyclic carbonates Green. Chem. 23 2021 77 118 10.1039/D0GC03465G L. Guo, et al., Recent developments in organocatalysed transformations of epoxides and carbon dioxide into cyclic carbonates, Green Chem., 23 (2021) 77-118. https://doi.org/10.1039/D0GC03465G. [10] M. Usman Synthesis of cyclic carbonates from CO2 cycloaddition to bio-based epoxides and glycerol: an overview of recent development RSC Adv. 13 2023 22717 22743 10.1039/D3RA03028H M. Usman, et al., Synthesis of cyclic carbonates from CO2 cycloaddition to bio-based epoxides and glycerol: an overview of recent development, RSC Adv., 13 (2023) 22717-22743. https://doi.org/10.1039/D3RA03028H. [11] R. Wang “All-in-one” carbon dots-based catalyst for converting CO2 to cyclic carbonates Carbon 211 2023 10.1016/j.carbon.2023.118118 R. Wang, et al., “All-in-one” carbon dots-based catalyst for converting CO2 to cyclic carbonates, Carbon, 211 (2023). https://doi.org/10.1016/j.carbon.2023.118118. [12] W. Zhou New horizon in C1 chemistry: breaking the selectivity limitation in transformation of syngas and hydrogenation of CO2 into hydrocarbon chemicals and fuels Chem. Soc. Rev. 48 2019 3193 3228 10.1039/C8CS00502H W. Zhou, et al., New horizon in C1 chemistry: breaking the selectivity limitation in transformation of syngas and hydrogenation of CO2 into hydrocarbon chemicals and fuels, Chem. Soc. Rev., 48 (2019) 3193-3228. https://doi.org/10.1039/C8CS00502H. [13] T. Hu Computational screening of metal-substituted HKUST-1 catalysts for chemical fixation of carbon dioxide into epoxides J. Mater. Chem. A 7 2019 14825 14834 10.1039/C9TA02455G T. Hu, et al., Computational screening of metal-substituted HKUST-1 catalysts for chemical fixation of carbon dioxide into epoxides, J. Mater. Chem. A, 7 (2019) 14825-14834. https://doi.org/10.1039/C9TA02455G. [14] A.H. Chowdhury Magnesium oxide as an efficient catalyst for CO2 fixation and N-formylation reactions under ambient conditions Mol. Catal. 450 2018 46 54 10.1016/j.mcat.2018.03.003 A.H. Chowdhury, et al., Magnesium oxide as an efficient catalyst for CO2 fixation and N-formylation reactions under ambient conditions, Mol. Catal., 450 (2018) 46-54. https://doi.org/10.1016/j.mcat.2018.03.003. [15] L.Y. Zhao B2O3: A heterogeneous metal-free Lewis acid catalyst for carbon dioxide fixation into cyclic carbonates J. CO2 Util. 29 2019 172 178 10.1016/j.jcou.2018.12.006 L.Y. Zhao, et al., B2O3: A heterogeneous metal-free Lewis acid catalyst for carbon dioxide fixation into cyclic carbonates, J. CO2 Util., 29 (2019) 172-178. https://doi.org/10.1016/j.jcou.2018.12.006. [16] A. Centeno Pedrazo Phosphonium-based ionic liquids: economic and efficient catalysts for the solvent-free cycloaddition of CO2 to epoxidized soybean vegetable oil to obtain potential bio-based polymers precursors Mol. Catal. 515 2021 10.1016/j.mcat.2021.111889 A. Centeno Pedrazo, et al., Phosphonium-based ionic liquids: Economic and efficient catalysts for the solvent-free cycloaddition of CO2 to epoxidized soybean vegetable oil to obtain potential bio-based polymers precursors, Mol. Catal., 515 (2021). https://doi.org/10.1016/j.mcat.2021.111889. [17] H. Yuan Bi-functional phosphonium poly(ionic liquid)s catalyzed CO2-promoted hydration of ethylene oxide Fuel 345 2023 10.1016/j.fuel.2023.128210 H. Yuan, et al., Bi-functional phosphonium poly(ionic liquid)s catalyzed CO2-promoted hydration of ethylene oxide, Fuel, 345 (2023). https://doi.org/10.1016/j.fuel.2023.128210. [18] H. Gou Hydrogen bond donor functionalized poly(ionic liquid)s for efficient synergistic conversion of CO2 to cyclic carbonates Phys. Chem. Chem. Phys. 23 2021 2005 2014 10.1039/D0CP06041K H. Gou, et al., Hydrogen bond donor functionalized poly(ionic liquid)s for efficient synergistic conversion of CO2 to cyclic carbonates, Phys. Chem. Chem. Phys., 23 (2021) 2005-2014. https://doi.org/10.1039/D0CP06041K. [19] L. Long Boric acid as a hydrogen bond donor with TBAB catalyze the cycloaddition of CO2 to internal bio-epoxides under solvent-free conditions Mol. Catal. 535 2023 10.1016/j.mcat.2022.112849 L. Long, et al., Boric acid as a hydrogen bond donor with TBAB catalyze the cycloaddition of CO2 to internal bio-epoxides under solvent-free conditions, Mol. Catal., 535 (2023). https://doi.org/10.1016/j.mcat.2022.112849. [20] T.K. Pal Metal-organic frameworks for the chemical fixation of CO2 into cyclic carbonates Coord. Chem. Rev. 408 2020 10.1016/j.ccr.2019.213173 T.K. Pal, et al., Metal-organic frameworks for the chemical fixation of CO2 into cyclic carbonates, Coord. Chem. Rev., 408 (2020). https://doi.org/10.1016/j.ccr.2019.213173. [21] F.N. Al Rowaili A review for metal-organic frameworks (MOFs) utilization in capture and conversion of carbon dioxide into valuable products J. CO 2 Util. 53 2021 10.1016/j.jcou.2021.101715 F.N. Al Rowaili, et al., A review for metal-organic frameworks (MOFs) utilization in capture and conversion of carbon dioxide into valuable products, J. CO2 Util., 53 (2021). https://doi.org/10.1016/j.jcou.2021.101715. [22] R. Luo Synthesis of metalloporphyrin-based porous organic polymers and their functionalization for conversion of CO2 into cyclic carbonates: recent advances, opportunities and challenges J. Mater. Chem. A 9 2021 25731 25749 10.1039/D1TA08146B R. Luo, et al., Synthesis of metalloporphyrin-based porous organic polymers and their functionalization for conversion of CO2 into cyclic carbonates: recent advances, opportunities and challenges, J. Mater. Chem. A, 9 (2021) 25731-25749. https://doi.org/10.1039/D1TA08146B. [23] K. Liu In situsynthesis of pyridinium-based ionic porous organic polymers with hydroxide anions and pyridinyl radicals for halogen-free catalytic fixation of atmospheric CO2 Green. Chem. 24 2022 136 141 10.1039/D1GC03465K K. Liu, et al., In situsynthesis of pyridinium-based ionic porous organic polymers with hydroxide anions and pyridinyl radicals for halogen-free catalytic fixation of atmospheric CO2, Green Chem., 24 (2022) 136-141. https://doi.org/10.1039/D1GC03465K. [24] J. Ke The hybrid polyhydroxyurethane materials synthesized by a prepolymerization method from CO2-sourced monomer and epoxy J. CO2 Util. 16 2016 474 485 10.1016/j.jcou.2016.11.001 J. Ke, et al., The hybrid polyhydroxyurethane materials synthesized by a prepolymerization method from CO2-sourced monomer and epoxy, J. CO2 Util., 16 (2016) 474-485. https://doi.org/10.1016/j.jcou.2016.11.001. [25] J. Ke Critical transition of epoxy resin from brittleness to toughness by incorporating CO2-sourced cyclic carbonate J. CO2 Util. 26 2018 302 313 10.1016/j.jcou.2018.05.020 J. Ke, et al., Critical transition of epoxy resin from brittleness to toughness by incorporating CO2-sourced cyclic carbonate, J. CO2 Util., 26 (2018) 302-313. https://doi.org/10.1016/j.jcou.2018.05.020. [26] Q. Su Boron-doped melamine-derived carbon nitrides tailored by ionic liquids for catalytic conversion of CO2 into cyclic carbonates Green. Chem. 19 2017 2957 2965 10.1039/C7GC00279C Q. Su, et al., Boron-doped melamine-derived carbon nitrides tailored by ionic liquids for catalytic conversion of CO2 into cyclic carbonates, Green Chem., 19 (2017) 2957-2965. https://doi.org/10.1039/C7GC00279C. [27] Y. Liu, Non-metal and non-halide enol PENDI catalysts for the cycloaddition of CO2 and epoxide 63 J. CO2 Util., 2022, 10.1016/j.jcou.2022.102130. Y. Liu, et al., Non-metal and non-halide enol PENDI catalysts for the cycloaddition of CO2 and epoxide, J. CO2 Util., 63 (2022). https://doi.org/10.1016/j.jcou.2022.102130. [28] M. Liu Squaramide-derived framework modified periodic mesoporous organosilica: a robust bifunctional platform for CO2 adsorption and cooperative conversion Chem. Eng. J. 399 2020 10.1016/j.cej.2020.125682 M. Liu, et al., Squaramide-derived framework modified periodic mesoporous organosilica: A robust bifunctional platform for CO2 adsorption and cooperative conversion, Chem. Eng. J., 399 (2020). https://doi.org/10.1016/j.cej.2020.125682. [29] X. Wang Facile synthesis of carboxyl- and hydroxyl‑functional carbon nitride catalyst for efficient CO2 cycloaddition Mol. Catal. 515 2021 10.1016/j.mcat.2021.111924 X. Wang, et al., Facile synthesis of carboxyl- and hydroxyl‑functional carbon nitride catalyst for efficient CO2 cycloaddition, Mol. Catal., 515 (2021). https://doi.org/10.1016/j.mcat.2021.111924. [30] Y. Zhang Melem based mesoporous metal-free catalyst for cycloaddition of CO2 to cyclic carbonate J. CO2 Util. 64 2022 10.1016/j.jcou.2022.102173 Y. Zhang, et al., Melem based mesoporous metal-free catalyst for cycloaddition of CO2 to cyclic carbonate, J. CO2 Util., 64 (2022). https://doi.org/10.1016/j.jcou.2022.102173. [31] Z. Xue Scalable and super-stable exfoliation of graphitic carbon nitride in biomass-derived γ-valerolactone: enhanced catalytic activity for the alcoholysis and cycloaddition of epoxides with CO2 Green. Chem. 19 2017 5041 5045 10.1039/C7GC02583A Z. Xue, et al., Scalable and super-stable exfoliation of graphitic carbon nitride in biomass-derived γ-valerolactone: enhanced catalytic activity for the alcoholysis and cycloaddition of epoxides with CO2, Green Chem., 19 (2017) 5041-5045. https://doi.org/10.1039/C7GC02583A. [32] J. Zhu Boron doped graphitic carbon nitride with acid-base duality for cycloaddition of carbon dioxide to epoxide under solvent-free condition Appl. Catal. B 219 2017 92 100 10.1016/j.apcatb.2017.07.041 J. Zhu, et al., Boron doped graphitic carbon nitride with acid-base duality for cycloaddition of carbon dioxide to epoxide under solvent-free condition, Appl. Catal. B, 219 (2017) 92-100. https://doi.org/10.1016/j.apcatb.2017.07.041. [33] J. Xu Comprehensive insight into the support effect of graphitic carbon nitride for zinc halides on the catalytic transformation of CO2 into cyclic carbonates Catal. Sci. Technol. 8 2018 5582 5593 10.1039/C8CY01688G J. Xu, et al., Comprehensive insight into the support effect of graphitic carbon nitride for zinc halides on the catalytic transformation of CO2 into cyclic carbonates, Catal. Sci. Technol., 8 (2018) 5582-5593. https://doi.org/10.1039/C8CY01688G. [34] Q. Su Urea-derived graphitic carbon nitride as an efficient heterogeneous catalyst for CO2 conversion into cyclic carbonates Catal. Sci. Technol. 4 2014 10.1039/C3CY00921A Q. Su, et al., Urea-derived graphitic carbon nitride as an efficient heterogeneous catalyst for CO2 conversion into cyclic carbonates, Catal. Sci. Technol., 4 (2014). https://doi.org/10.1039/C3CY00921A. [35] H. Chand Atmospheric pressure conversion of carbon dioxide to cyclic carbonates using a metal-free Lewis acid-base bifunctional heterogeneous catalyst J. CO2 Util. 51 2021 10.1016/j.jcou.2021.101646 H. Chand, et al., Atmospheric pressure conversion of carbon dioxide to cyclic carbonates using a metal-free Lewis acid-base bifunctional heterogeneous catalyst, J. CO2 Util., 51 (2021). https://doi.org/10.1016/j.jcou.2021.101646. [36] H. Liang Supported ZnBr2 and carbon nitride bifunctional complex catalysts for the efficient cycloaddition of CO2 with diglycidyl ethers N. J. Chem. 42 2018 16127 16137 10.1039/C8NJ03499K H. Liang, et al., Supported ZnBr2 and carbon nitride bifunctional complex catalysts for the efficient cycloaddition of CO2 with diglycidyl ethers, New J. Chem., 42 (2018) 16127-16137. https://doi.org/10.1039/C8NJ03499K. [37] J. Xu Metal-free catalytic conversion of CO2 into cyclic carbonate by hydroxyl-functionalized graphitic carbon nitride materials Mol. Catal. 491 2020 10.1016/j.mcat.2020.110979 J. Xu, et al., Metal-free catalytic conversion of CO2 into cyclic carbonate by hydroxyl-functionalized graphitic carbon nitride materials, Mol. Catal., 491 (2020). https://doi.org/10.1016/j.mcat.2020.110979. [38] M. Ge Enhanced photocatalytic degradation performance of cyano groups-modified carbon nitride nanosheets synthesized by magadiite template-assisted thermal treatment Mater. Sci. Semicond. Process 141 2022 10.1016/j.mssp.2021.106420 M. Ge, et al., Enhanced photocatalytic degradation performance of cyano groups-modified carbon nitride nanosheets synthesized by magadiite template-assisted thermal treatment, Mater. Sci. Semicond. Process, 141 (2022). https://doi.org/10.1016/j.mssp.2021.106420. [39] Q. Yan Facile synthesis and superior photocatalytic and electrocatalytic performances of porous B-doped g-C3N4 nanosheets J. Mater. Sci. Technol. 34 2018 2515 2520 10.1016/j.jmst.2017.06.018 Q. Yan, et al., Facile synthesis and superior photocatalytic and electrocatalytic performances of porous B-doped g-C3N4 nanosheets, J. Mater. Sci. Technol., 34 (2018) 2515-2520. https://doi.org/10.1016/j.jmst.2017.06.018. [40] J. Zhu, Graphitic carbon nitride: synthesis, properties, and applications in catalysis 6 ACS Appl. Mater. Interfaces, 2014, 16449–16465, 10.1021/am502925j. J. Zhu, et al., Graphitic carbon nitride: synthesis, properties, and applications in catalysis, ACS Appl. Mater. Interfaces, 6 (2014) 16449-16465. https://doi.org/10.1021/am502925j. [41] Y. Gu Novel carbon nitride/metal oxide nanocomposites as efficient and robust catalysts for coupling of CO2 and epoxides Ind. Eng. Chem. Res. 60 2021 5723 5732 10.1021/acs.iecr.0c05966 Y. Gu, et al., Novel carbon nitride/metal oxide nanocomposites as efficient and robust catalysts for coupling of CO2 and epoxides, Ind. Eng. Chem. Res., 60 (2021) 5723-5732. https://doi.org/10.1021/acs.iecr.0c05966. [42] D. Zhang Synthesis of carbon fibers support graphitic carbon nitride immobilize ZnBr2 catalyst in the catalytic reaction between styrene oxide and CO2 J. CO2 Util. 34 2019 716 724 10.1016/j.jcou.2019.09.005 D. Zhang, et al., Synthesis of carbon fibers support graphitic carbon nitride immobilize ZnBr2 catalyst in the catalytic reaction between styrene oxide and CO2, J. CO2 Util., 34 (2019) 716-724. https://doi.org/10.1016/j.jcou.2019.09.005. [43] N. Liu ZrO2 supported on graphitic carbon nitride based on metal-nitrogen interaction for enhanced catalytic cycloaddition of CO2 to cyclic carbonates Catal. Lett. 153 2022 1483 1494 10.1007/s10562-022-04083-3 N. Liu, et al., ZrO2 supported on graphitic carbon nitride based on metal-nitrogen interaction for enhanced catalytic cycloaddition of CO2 to cyclic carbonates, Catal Letters, 153 (2022) 1483-1494. https://doi.org/10.1007/s10562-022-04083-3. [44] C. Yang Boron and phosphorus co-doped graphitic carbon nitride cooperate with Bu4NBr as binary heterogeneous catalysts for the cycloaddition of CO2 to epoxides Catalysts 12 2022 10.3390/catal12101196 C. Yang, et al., Boron and phosphorus co-doped graphitic carbon nitride cooperate with Bu4NBr as binary heterogeneous catalysts for the cycloaddition of CO2 to epoxides, Catalysts, 12 (2022). https://doi.org/10.3390/catal12101196. [45] X. Wang Experimental and theoretical investigation for the cycloaddition of carbon dioxide to epoxides catalyzed by potassium and boron co-doped carbon nitride J. Colloid Interface Sci. 609 2022 523 534 10.1016/j.jcis.2021.11.053 X. Wang, et al., Experimental and theoretical investigation for the cycloaddition of carbon dioxide to epoxides catalyzed by potassium and boron co-doped carbon nitride, J. Colloid Interface Sci., 609 (2022) 523-534. https://doi.org/10.1016/j.jcis.2021.11.053. [46] H. Wang Rich −NH2 mesoporous g-C3N4 nanosheets efficient for eycloaddition of CO2 to epoxides without solvent and co-catalyst ChemistrySelect 6 2021 3712 3721 10.1002/slct.202100308 H. Wang, et al., Rich −NH2 mesoporous g-C3N4 nanosheets efficient for eycloaddition of CO2 to epoxides without solvent and co-catalyst, ChemistrySelect, 6 (2021) 3712-3721. https://doi.org/10.1002/slct.202100308. [47] J. Wang Boronic acids as hydrogen bond donor catalysts for efficient conversion of CO2 into organic carbonate in water ACS Catal. 6 2016 4871 4876 10.1021/acscatal.6b01422 J. Wang, et al., Boronic acids as hydrogen bond donor catalysts for efficient conversion of CO2 into organic carbonate in water, ACS Catal., 6 (2016) 4871-4876. https://doi.org/10.1021/acscatal.6b01422",
      "scopus-id": "85185567555",
      "coredata": {
        "eid": "1-s2.0-S0926860X24000590",
        "dc:description": "The cycloaddition of CO2 and epoxide is regarded as an eco-friendly, sustainable, and promising way to utilize CO2. However, it is crucial to design and prepare efficient and low-cost catalysts for this reaction. Herein, through controlling condensation temperature, a series of boron modified urea-derived g-C3N4 (x-BCN) were prepared. Notably, more edge defect (−NH2/−NH−) formed at low roasting temperatures and both basic and acidic sites increased after introducing B. 0.30-BCN exhibited superior catalytic performance for cycloaddition of CO2 with 1, 4-butanediol diglycidyl ether and 99% cyclic carbonate yield was acquired at 130 ℃, 2.0 MPa after 20 h reacting. Additionally, 0.30-BCN showed outstanding recyclability and substrate adaptability. The synergistic effects of edge defects, rich mesoporous structure and Lewis acid-base sites were conductive to promoting CO2 cycloaddition. Moreover, a possible multi-synergetic mechanism was proposed. An originality option was provided for preparing a simple, eco-friendly, and efficient metal-free catalyst for practical CO2 fixation.",
        "openArchiveArticle": "false",
        "prism:coverDate": "2024-04-05",
        "openaccessUserLicense": null,
        "prism:aggregationType": "Journal",
        "prism:url": "https://api.elsevier.com/content/article/pii/S0926860X24000590",
        "dc:creator": [
          {
            "@_fa": "true",
            "$": "Zhang, Yuanping"
          },
          {
            "@_fa": "true",
            "$": "Wang, Qin"
          },
          {
            "@_fa": "true",
            "$": "Chen, Qian"
          },
          {
            "@_fa": "true",
            "$": "Li, Xiaoyun"
          },
          {
            "@_fa": "true",
            "$": "Li, Yanfang"
          },
          {
            "@_fa": "true",
            "$": "Kang, Maoqing"
          },
          {
            "@_fa": "true",
            "$": "Li, Qifeng"
          },
          {
            "@_fa": "true",
            "$": "Wang, Junwei"
          }
        ],
        "link": [
          {
            "@_fa": "true",
            "@rel": "self",
            "@href": "https://api.elsevier.com/content/article/pii/S0926860X24000590"
          },
          {
            "@_fa": "true",
            "@rel": "scidir",
            "@href": "https://www.sciencedirect.com/science/article/pii/S0926860X24000590"
          }
        ],
        "dc:format": "application/json",
        "openaccessType": null,
        "pii": "S0926-860X(24)00059-0",
        "prism:volume": "675",
        "articleNumber": "119615",
        "prism:publisher": "Elsevier B.V.",
        "dc:title": "A new boron modified carbon nitride metal-free catalyst for the cycloaddition of CO2 and bisepoxides",
        "prism:copyright": "© 2024 Elsevier B.V. All rights reserved.",
        "openaccess": "0",
        "prism:issn": "0926860X",
        "dcterms:subject": [
          {
            "@_fa": "true",
            "$": "Urea-derived carbon nitride"
          },
          {
            "@_fa": "true",
            "$": "Low polymerization degree"
          },
          {
            "@_fa": "true",
            "$": "Boron modification"
          },
          {
            "@_fa": "true",
            "$": "Acid-base duality"
          },
          {
            "@_fa": "true",
            "$": "CO2 cycloaddition"
          }
        ],
        "openaccessArticle": "false",
        "prism:publicationName": "Applied Catalysis A: General",
        "openaccessSponsorType": null,
        "prism:pageRange": "119615",
        "pubType": "fla",
        "prism:coverDisplayDate": "5 April 2024",
        "prism:doi": "10.1016/j.apcata.2024.119615",
        "prism:startingPage": "119615",
        "dc:identifier": "doi:10.1016/j.apcata.2024.119615",
        "openaccessSponsorName": null
      },
      "objects": {
        "object": [
          {
            "@category": "standard",
            "@height": "200",
            "@width": "414",
            "@_fa": "true",
            "$": "https://api.elsevier.com/content/object/eid/1-s2.0-S0926860X24000590-ga1.jpg?httpAccept=%2A%2F%2A",
            "@multimediatype": "JPEG image file",
            "@type": "IMAGE-DOWNSAMPLED",
            "@size": "23638",
            "@ref": "ga1",
            "@mimetype": "image/jpeg"
          },
          {
            "@category": "standard",
            "@height": "662",
            "@width": "751",
            "@_fa": "true",
            "$": "https://api.elsevier.com/content/object/eid/1-s2.0-S0926860X24000590-sc4.jpg?httpAccept=%2A%2F%2A",
            "@multimediatype": "JPEG image file",
            "@type": "IMAGE-DOWNSAMPLED",
            "@size": "79149",
            "@ref": "sc4",
            "@mimetype": "image/jpeg"
          },
          {
            "@category": "standard",
            "@height": "213",
            "@width": "565",
            "@_fa": "true",
            "$": "https://api.elsevier.com/content/object/eid/1-s2.0-S0926860X24000590-sc3.jpg?httpAccept=%2A%2F%2A",
            "@multimediatype": "JPEG image file",
            "@type": "IMAGE-DOWNSAMPLED",
            "@size": "25411",
            "@ref": "sc3",
            "@mimetype": "image/jpeg"
          },
          {
            "@category": "standard",
            "@height": "301",
            "@width": "791",
            "@_fa": "true",
            "$": "https://api.elsevier.com/content/object/eid/1-s2.0-S0926860X24000590-sc2.jpg?httpAccept=%2A%2F%2A",
            "@multimediatype": "JPEG image file",
            "@type": "IMAGE-DOWNSAMPLED",
            "@size": "46627",
            "@ref": "sc2",
            "@mimetype": "image/jpeg"
          },
          {
            "@category": "standard",
            "@height": "362",
            "@width": "791",
            "@_fa": "true",
            "$": "https://api.elsevier.com/content/object/eid/1-s2.0-S0926860X24000590-sc1.jpg?httpAccept=%2A%2F%2A",
            "@multimediatype": "JPEG image file",
            "@type": "IMAGE-DOWNSAMPLED",
            "@size": "46034",
            "@ref": "sc1",
            "@mimetype": "image/jpeg"
          },
          {
            "@category": "standard",
            "@height": "67",
            "@width": "445",
            "@_fa": "true",
            "$": "https://api.elsevier.com/content/object/eid/1-s2.0-S0926860X24000590-fx1.jpg?httpAccept=%2A%2F%2A",
            "@multimediatype": "JPEG image file",
            "@type": "IMAGE-DOWNSAMPLED",
            "@size": "7038",
            "@ref": "fx1",
            "@mimetype": "image/jpeg"
          },
          {
            "@category": "standard",
            "@height": "325",
            "@width": "565",
            "@_fa": "true",
            "$": "https://api.elsevier.com/content/object/eid/1-s2.0-S0926860X24000590-gr7.jpg?httpAccept=%2A%2F%2A",
            "@multimediatype": "JPEG image file",
            "@type": "IMAGE-DOWNSAMPLED",
            "@size": "32748",
            "@ref": "gr7",
            "@mimetype": "image/jpeg"
          },
          {
            "@category": "standard",
            "@height": "274",
            "@width": "376",
            "@_fa": "true",
            "$": "https://api.elsevier.com/content/object/eid/1-s2.0-S0926860X24000590-gr6.jpg?httpAccept=%2A%2F%2A",
            "@multimediatype": "JPEG image file",
            "@type": "IMAGE-DOWNSAMPLED",
            "@size": "22881",
            "@ref": "gr6",
            "@mimetype": "image/jpeg"
          },
          {
            "@category": "standard",
            "@height": "264",
            "@width": "791",
            "@_fa": "true",
            "$": "https://api.elsevier.com/content/object/eid/1-s2.0-S0926860X24000590-gr5.jpg?httpAccept=%2A%2F%2A",
            "@multimediatype": "JPEG image file",
            "@type": "IMAGE-DOWNSAMPLED",
            "@size": "55576",
            "@ref": "gr5",
            "@mimetype": "image/jpeg"
          },
          {
            "@category": "standard",
            "@height": "255",
            "@width": "751",
            "@_fa": "true",
            "$": "https://api.elsevier.com/content/object/eid/1-s2.0-S0926860X24000590-gr4.jpg?httpAccept=%2A%2F%2A",
            "@multimediatype": "JPEG image file",
            "@type": "IMAGE-DOWNSAMPLED",
            "@size": "45536",
            "@ref": "gr4",
            "@mimetype": "image/jpeg"
          },
          {
            "@category": "standard",
            "@height": "519",
            "@width": "791",
            "@_fa": "true",
            "$": "https://api.elsevier.com/content/object/eid/1-s2.0-S0926860X24000590-gr3.jpg?httpAccept=%2A%2F%2A",
            "@multimediatype": "JPEG image file",
            "@type": "IMAGE-DOWNSAMPLED",
            "@size": "198220",
            "@ref": "gr3",
            "@mimetype": "image/jpeg"
          },
          {
            "@category": "standard",
            "@height": "542",
            "@width": "751",
            "@_fa": "true",
            "$": "https://api.elsevier.com/content/object/eid/1-s2.0-S0926860X24000590-gr2.jpg?httpAccept=%2A%2F%2A",
            "@multimediatype": "JPEG image file",
            "@type": "IMAGE-DOWNSAMPLED",
            "@size": "112919",
            "@ref": "gr2",
            "@mimetype": "image/jpeg"
          },
          {
            "@category": "standard",
            "@height": "192",
            "@width": "678",
            "@_fa": "true",
            "$": "https://api.elsevier.com/content/object/eid/1-s2.0-S0926860X24000590-gr1.jpg?httpAccept=%2A%2F%2A",
            "@multimediatype": "JPEG image file",
            "@type": "IMAGE-DOWNSAMPLED",
            "@size": "41938",
            "@ref": "gr1",
            "@mimetype": "image/jpeg"
          },
          {
            "@category": "thumbnail",
            "@height": "106",
            "@width": "219",
            "@_fa": "true",
            "$": "https://api.elsevier.com/content/object/eid/1-s2.0-S0926860X24000590-ga1.sml?httpAccept=%2A%2F%2A",
            "@multimediatype": "GIF image file",
            "@type": "IMAGE-THUMBNAIL",
            "@size": "9958",
            "@ref": "ga1",
            "@mimetype": "image/gif"
          },
          {
            "@category": "thumbnail",
            "@height": "164",
            "@width": "186",
            "@_fa": "true",
            "$": "https://api.elsevier.com/content/object/eid/1-s2.0-S0926860X24000590-sc4.sml?httpAccept=%2A%2F%2A",
            "@multimediatype": "GIF image file",
            "@type": "IMAGE-THUMBNAIL",
            "@size": "7012",
            "@ref": "sc4",
            "@mimetype": "image/gif"
          },
          {
            "@category": "thumbnail",
            "@height": "83",
            "@width": "219",
            "@_fa": "true",
            "$": "https://api.elsevier.com/content/object/eid/1-s2.0-S0926860X24000590-sc3.sml?httpAccept=%2A%2F%2A",
            "@multimediatype": "GIF image file",
            "@type": "IMAGE-THUMBNAIL",
            "@size": "4781",
            "@ref": "sc3",
            "@mimetype": "image/gif"
          },
          {
            "@category": "thumbnail",
            "@height": "83",
            "@width": "219",
            "@_fa": "true",
            "$": "https://api.elsevier.com/content/object/eid/1-s2.0-S0926860X24000590-sc2.sml?httpAccept=%2A%2F%2A",
            "@multimediatype": "GIF image file",
            "@type": "IMAGE-THUMBNAIL",
            "@size": "6918",
            "@ref": "sc2",
            "@mimetype": "image/gif"
          },
          {
            "@category": "thumbnail",
            "@height": "100",
            "@width": "219",
            "@_fa": "true",
            "$": "https://api.elsevier.com/content/object/eid/1-s2.0-S0926860X24000590-sc1.sml?httpAccept=%2A%2F%2A",
            "@multimediatype": "GIF image file",
            "@type": "IMAGE-THUMBNAIL",
            "@size": "5423",
            "@ref": "sc1",
            "@mimetype": "image/gif"
          },
          {
            "@category": "thumbnail",
            "@height": "33",
            "@width": "219",
            "@_fa": "true",
            "$": "https://api.elsevier.com/content/object/eid/1-s2.0-S0926860X24000590-fx1.sml?httpAccept=%2A%2F%2A",
            "@multimediatype": "GIF image file",
            "@type": "IMAGE-THUMBNAIL",
            "@size": "1718",
            "@ref": "fx1",
            "@mimetype": "image/gif"
          },
          {
            "@category": "thumbnail",
            "@height": "126",
            "@width": "219",
            "@_fa": "true",
            "$": "https://api.elsevier.com/content/object/eid/1-s2.0-S0926860X24000590-gr7.sml?httpAccept=%2A%2F%2A",
            "@multimediatype": "GIF image file",
            "@type": "IMAGE-THUMBNAIL",
            "@size": "4411",
            "@ref": "gr7",
            "@mimetype": "image/gif"
          },
          {
            "@category": "thumbnail",
            "@height": "159",
            "@width": "219",
            "@_fa": "true",
            "$": "https://api.elsevier.com/content/object/eid/1-s2.0-S0926860X24000590-gr6.sml?httpAccept=%2A%2F%2A",
            "@multimediatype": "GIF image file",
            "@type": "IMAGE-THUMBNAIL",
            "@size": "12119",
            "@ref": "gr6",
            "@mimetype": "image/gif"
          },
          {
            "@category": "thumbnail",
            "@height": "73",
            "@width": "219",
            "@_fa": "true",
            "$": "https://api.elsevier.com/content/object/eid/1-s2.0-S0926860X24000590-gr5.sml?httpAccept=%2A%2F%2A",
            "@multimediatype": "GIF image file",
            "@type": "IMAGE-THUMBNAIL",
            "@size": "7102",
            "@ref": "gr5",
            "@mimetype": "image/gif"
          },
          {
            "@category": "thumbnail",
            "@height": "74",
            "@width": "219",
            "@_fa": "true",
            "$": "https://api.elsevier.com/content/object/eid/1-s2.0-S0926860X24000590-gr4.sml?httpAccept=%2A%2F%2A",
            "@multimediatype": "GIF image file",
            "@type": "IMAGE-THUMBNAIL",
            "@size": "6151",
            "@ref": "gr4",
            "@mimetype": "image/gif"
          },
          {
            "@category": "thumbnail",
            "@height": "144",
            "@width": "219",
            "@_fa": "true",
            "$": "https://api.elsevier.com/content/object/eid/1-s2.0-S0926860X24000590-gr3.sml?httpAccept=%2A%2F%2A",
            "@multimediatype": "GIF image file",
            "@type": "IMAGE-THUMBNAIL",
            "@size": "24264",
            "@ref": "gr3",
            "@mimetype": "image/gif"
          },
          {
            "@category": "thumbnail",
            "@height": "158",
            "@width": "219",
            "@_fa": "true",
            "$": "https://api.elsevier.com/content/object/eid/1-s2.0-S0926860X24000590-gr2.sml?httpAccept=%2A%2F%2A",
            "@multimediatype": "GIF image file",
            "@type": "IMAGE-THUMBNAIL",
            "@size": "14614",
            "@ref": "gr2",
            "@mimetype": "image/gif"
          },
          {
            "@category": "thumbnail",
            "@height": "62",
            "@width": "219",
            "@_fa": "true",
            "$": "https://api.elsevier.com/content/object/eid/1-s2.0-S0926860X24000590-gr1.sml?httpAccept=%2A%2F%2A",
            "@multimediatype": "GIF image file",
            "@type": "IMAGE-THUMBNAIL",
            "@size": "6015",
            "@ref": "gr1",
            "@mimetype": "image/gif"
          },
          {
            "@category": "high",
            "@height": "886",
            "@width": "1832",
            "@_fa": "true",
            "$": "https://api.elsevier.com/content/object/eid/1-s2.0-S0926860X24000590-ga1_lrg.jpg?httpAccept=%2A%2F%2A",
            "@multimediatype": "JPEG image file",
            "@type": "IMAGE-HIGH-RES",
            "@size": "171370",
            "@ref": "ga1",
            "@mimetype": "image/jpeg"
          },
          {
            "@category": "high",
            "@height": "2933",
            "@width": "3326",
            "@_fa": "true",
            "$": "https://api.elsevier.com/content/object/eid/1-s2.0-S0926860X24000590-sc4_lrg.jpg?httpAccept=%2A%2F%2A",
            "@multimediatype": "JPEG image file",
            "@type": "IMAGE-HIGH-RES",
            "@size": "395232",
            "@ref": "sc4",
            "@mimetype": "image/jpeg"
          },
          {
            "@category": "high",
            "@height": "941",
            "@width": "2495",
            "@_fa": "true",
            "$": "https://api.elsevier.com/content/object/eid/1-s2.0-S0926860X24000590-sc3_lrg.jpg?httpAccept=%2A%2F%2A",
            "@multimediatype": "JPEG image file",
            "@type": "IMAGE-HIGH-RES",
            "@size": "121566",
            "@ref": "sc3",
            "@mimetype": "image/jpeg"
          },
          {
            "@category": "high",
            "@height": "1329",
            "@width": "3493",
            "@_fa": "true",
            "$": "https://api.elsevier.com/content/object/eid/1-s2.0-S0926860X24000590-sc2_lrg.jpg?httpAccept=%2A%2F%2A",
            "@multimediatype": "JPEG image file",
            "@type": "IMAGE-HIGH-RES",
            "@size": "206799",
            "@ref": "sc2",
            "@mimetype": "image/jpeg"
          },
          {
            "@category": "high",
            "@height": "1597",
            "@width": "3493",
            "@_fa": "true",
            "$": "https://api.elsevier.com/content/object/eid/1-s2.0-S0926860X24000590-sc1_lrg.jpg?httpAccept=%2A%2F%2A",
            "@multimediatype": "JPEG image file",
            "@type": "IMAGE-HIGH-RES",
            "@size": "216677",
            "@ref": "sc1",
            "@mimetype": "image/jpeg"
          },
          {
            "@category": "high",
            "@height": "297",
            "@width": "1975",
            "@_fa": "true",
            "$": "https://api.elsevier.com/content/object/eid/1-s2.0-S0926860X24000590-fx1_lrg.jpg?httpAccept=%2A%2F%2A",
            "@multimediatype": "JPEG image file",
            "@type": "IMAGE-HIGH-RES",
            "@size": "31178",
            "@ref": "fx1",
            "@mimetype": "image/jpeg"
          },
          {
            "@category": "high",
            "@height": "1434",
            "@width": "2495",
            "@_fa": "true",
            "$": "https://api.elsevier.com/content/object/eid/1-s2.0-S0926860X24000590-gr7_lrg.jpg?httpAccept=%2A%2F%2A",
            "@multimediatype": "JPEG image file",
            "@type": "IMAGE-HIGH-RES",
            "@size": "142641",
            "@ref": "gr7",
            "@mimetype": "image/jpeg"
          },
          {
            "@category": "high",
            "@height": "1211",
            "@width": "1663",
            "@_fa": "true",
            "$": "https://api.elsevier.com/content/object/eid/1-s2.0-S0926860X24000590-gr6_lrg.jpg?httpAccept=%2A%2F%2A",
            "@multimediatype": "JPEG image file",
            "@type": "IMAGE-HIGH-RES",
            "@size": "147997",
            "@ref": "gr6",
            "@mimetype": "image/jpeg"
          },
          {
            "@category": "high",
            "@height": "1167",
            "@width": "3493",
            "@_fa": "true",
            "$": "https://api.elsevier.com/content/object/eid/1-s2.0-S0926860X24000590-gr5_lrg.jpg?httpAccept=%2A%2F%2A",
            "@multimediatype": "JPEG image file",
            "@type": "IMAGE-HIGH-RES",
            "@size": "272975",
            "@ref": "gr5",
            "@mimetype": "image/jpeg"
          },
          {
            "@category": "high",
            "@height": "1130",
            "@width": "3326",
            "@_fa": "true",
            "$": "https://api.elsevier.com/content/object/eid/1-s2.0-S0926860X24000590-gr4_lrg.jpg?httpAccept=%2A%2F%2A",
            "@multimediatype": "JPEG image file",
            "@type": "IMAGE-HIGH-RES",
            "@size": "212289",
            "@ref": "gr4",
            "@mimetype": "image/jpeg"
          },
          {
            "@category": "high",
            "@height": "2292",
            "@width": "3493",
            "@_fa": "true",
            "$": "https://api.elsevier.com/content/object/eid/1-s2.0-S0926860X24000590-gr3_lrg.jpg?httpAccept=%2A%2F%2A",
            "@multimediatype": "JPEG image file",
            "@type": "IMAGE-HIGH-RES",
            "@size": "1192602",
            "@ref": "gr3",
            "@mimetype": "image/jpeg"
          },
          {
            "@category": "high",
            "@height": "2402",
            "@width": "3326",
            "@_fa": "true",
            "$": "https://api.elsevier.com/content/object/eid/1-s2.0-S0926860X24000590-gr2_lrg.jpg?httpAccept=%2A%2F%2A",
            "@multimediatype": "JPEG image file",
            "@type": "IMAGE-HIGH-RES",
            "@size": "561824",
            "@ref": "gr2",
            "@mimetype": "image/jpeg"
          },
          {
            "@category": "high",
            "@height": "846",
            "@width": "2994",
            "@_fa": "true",
            "$": "https://api.elsevier.com/content/object/eid/1-s2.0-S0926860X24000590-gr1_lrg.jpg?httpAccept=%2A%2F%2A",
            "@multimediatype": "JPEG image file",
            "@type": "IMAGE-HIGH-RES",
            "@size": "230065",
            "@ref": "gr1",
            "@mimetype": "image/jpeg"
          },
          {
            "@category": "standard",
            "@_fa": "true",
            "$": "https://api.elsevier.com/content/object/eid/1-s2.0-S0926860X24000590-mmc1.docx?httpAccept=%2A%2F%2A",
            "@multimediatype": "Microsoft Word file",
            "@type": "APPLICATION",
            "@size": "2452804",
            "@ref": "mmc1",
            "@mimetype": "application/word"
          },
          {
            "@category": "standard",
            "@_fa": "true",
            "$": "https://api.elsevier.com/content/object/eid/1-s2.0-S0926860X24000590-am.pdf?httpAccept=%2A%2F%2A",
            "@multimediatype": "Acrobat PDF file",
            "@type": "AAM-PDF",
            "@size": "1584281",
            "@ref": "am",
            "@mimetype": "application/pdf"
          }
        ]
      },
      "link": {
        "@rel": "abstract",
        "@href": "https://api.elsevier.com/content/abstract/scopus_id/85185567555"
      }
    }
  }
}