{
  "metadata": {
    "title": "Effect of hydrothermal aging on CO and C<ce:inf loc=post>3</ce:inf>H<ce:inf loc=post>6</ce:inf> oxidation over a Pt-Pd-based wiremesh catalyst as a motorcycle aftertreatment device",
    "authors": "; ",
    "journal": "Applied Catalysis A: General",
    "date": "2023-04-25",
    "doi": "10.1016/j.apcata.2023.119128",
    "abstract": "",
    "uri": "https://api.elsevier.com/content/article/pii/S0926860X23001084",
    "pii": "S0926860X23001084"
  },
  "fulltext": {
    "full-text-retrieval-response": {
      "scopus-eid": "2-s2.0-85149779684",
      "originalText": "serial JL 271346 291210 291744 291809 31 Applied Catalysis A: General APPLIEDCATALYSISAGENERAL 2023-03-06 2023-03-06 2023-03-10 2023-03-10 2023-03-21T16:53:39 1-s2.0-S0926860X23001084 S0926-860X(23)00108-4 S0926860X23001084 10.1016/j.apcata.2023.119128 S300 S300.1 FULL-TEXT 1-s2.0-S0926860X23X00076 2024-01-01T12:35:59.692098Z 0 0 20230425 2023 2023-03-06T21:08:12.904619Z absattachment articleinfo articlenumber articletitlenorm authfirstinitialnorm authfirstsurnamenorm cid cids contenttype copyright crossmark dateloaded dateloadedtxt datesearch datesort dateupdated dco docsubtype doctype doi eid ewtransactionid hubeid indexeddate issn issnnorm itemstage itemtransactionid itemweight openaccess openarchive pg pgfirst pii piinorm pubdatestart pubdatetxt pubyr sortorder srctitle srctitlenorm srctype ssids alllist content subj subheadings suppl tomb volfirst volissue volumelist webpdf webpdfpagecount yearnav figure table e-component body mmlmath acknowledge affil appendices articletitle auth authfirstini authfull authkeywords authlast grantnumber grantsponsor highlightsabst orcid primabst ref specialabst 0926-860X 0926860X true 656 656 C Volume 656 7 119128 119128 119128 20230425 25 April 2023 2023-04-25 2023 article fla © 2023 Elsevier B.V. All rights reserved. EFFECTHYDROTHERMALAGINGCOC3H6OXIDATIONOVERAPTPDBASEDWIREMESHCATALYSTAMOTORCYCLEAFTERTREATMENTDEVICE TAHERI A 1 Introduction 2 Experimental 2.1 Catalyst characterization 2.2 Reactor system 2.3 Aging and activity tests procedures 3 Results and discussion 3.1 Catalyst characterization results 3.2 CO and propylene oxidation over the fresh catalyst 3.3 Effect of aging on catalyst activity 3.3.1 Aging under reducing condition 3.3.2 Aging under oxidizing condition 3.3.3 Correlation between catalyst properties and activity 4 Conclusions CRediT authorship contribution statement Acknowledgments Supporting information Appendix A Supplementary material References BRANDENBERGER 2008 492 531 S A 2018 C SHAHBAZI 2019 197 207 H SHAHBAZI 2016 216 229 H SCHUTZ 2021 300 J GIULIANO 2021 131 139 M DADI 2021 119655 R HO 2021 6596 6612 P CHEN 2015 499 509 X VELINOVA 2019 865 876 R JANG 2021 5894 5905 E JOHNS 2015 151 164 T MORLANG 2005 191 199 A HAUFF 2012 107 116 K GANZLER 2015 216 224 A BOUBNOV 2013 333 338 A DUBBE 2018 H DING 2021 X OLSSON 2001 6895 6906 L LIANG 2020 Y PLESSOW 2016 7098 7108 P ALCOCK 1960 551 561 C GRAHAM 2007 1 8 G KALANTARNEYESTANAKI 2004 395 408 A CIUPARU 2001 197 209 D RUCKENSTEIN 1981 233 236 E CARRILLO 2014 2089 2093 C LAN 2019 127 136 L TIEN 2022 2137 2145 N FAN 2020 104236 J LEE 1998 279 291 C CHEN 2010 337 345 Y WU 2018 H 980938EMISSIONCONTROLTECHNOLOGIESFOR50125CCMOTORCYCLESINTAIWAN LOTFOLLAHZADEMOGHADDAM 2021 10122 10133 A DENG 2019 1202 1213 B WANG 2014 1482 1491 S CZERWINSKI 2008 J CATALYSTAGINGEFFECTSPARTICLEEMISSIONS2STROKESCOOTERS CZERWINSKI 2009 J COMBINATIONSTECHNICALMEASURESFORREDUCTIONPARTICLEEMISSIONSTOXICITY2SSCOOTERS HASSANI 2016 1 12 A THOMAS 2019 284 294 C SU 2020 277 293 S PAKHARUKOV 2015 2795 2804 I DING 2020 Y DESPRES 2004 73 82 J WANG 2009 18746 18752 H HUANG 2020 6407 6419 C LIANG 2018 336 344 Y YANG 2015 2358 2365 Z OLSSON 2002 340 353 L KIBIS 2012 19342 19348 L HUANG 2017 73 81 F IVANOVA 2010 57 71 A PERSSON 2007 401 414 K HAZLETT 2016 157 166 M HAZLETT 2017 404 417 M LANG 2017 430 442 W FIEDOROW 1976 34 42 R FLYNN 1975 432 448 P OLSSON 2009 S290 S294 L LEE 1999 491 498 A LEE 1984 279 291 T AUVRAY 2013 517 527 X NAGAI 2006 103 109 Y TAHERIX2023X119128 TAHERIX2023X119128XA 2025-03-10T00:00:00.000Z 2025-03-10T00:00:00.000Z http://creativecommons.org/licenses/by-nc-nd/4.0/ © 2023 Elsevier B.V. All rights reserved. 2023-03-16T12:33:10.293Z http://vtw.elsevier.com/data/voc/AddOnTypes/50.7/aggregated-refined https://doi.org/10.15223/policy-017 https://doi.org/10.15223/policy-037 https://doi.org/10.15223/policy-012 https://doi.org/10.15223/policy-029 https://doi.org/10.15223/policy-004 item S0926-860X(23)00108-4 S0926860X23001084 1-s2.0-S0926860X23001084 10.1016/j.apcata.2023.119128 271346 2024-01-01T12:35:59.692098Z 2023-04-25 1-s2.0-S0926860X23001084-main.pdf https://s3-eu-west-1.amazonaws.com/prod-ucs-content-store-eu-west/content/pii:S0926860X23001084/MAIN/application/pdf/9eccb2cd7c58370782d5110d34822fa4/main.pdf main.pdf pdf true 7791545 MAIN 15 1-s2.0-S0926860X23001084-main_1.png https://s3-eu-west-1.amazonaws.com/prod-ucs-content-store-eu-west/content/pii:S0926860X23001084/PREVIEW/image/png/9df8f9e555bc717d1cdfa036eaf3308c/main_1.png main_1.png png 57138 849 656 IMAGE-WEB-PDF 1 1-s2.0-S0926860X23001084-gr2.jpg https://s3-eu-west-1.amazonaws.com/prod-ucs-content-store-eu-west/content/pii:S0926860X23001084/gr2/DOWNSAMPLED/image/jpeg/44583269ff1024cee95aca37e33d0798/gr2.jpg gr2 gr2.jpg jpg 137756 837 565 IMAGE-DOWNSAMPLED 1-s2.0-S0926860X23001084-ga1.jpg https://s3-eu-west-1.amazonaws.com/prod-ucs-content-store-eu-west/content/pii:S0926860X23001084/ga1/DOWNSAMPLED/image/jpeg/8a4fc0b7464d85300795073d22cc2e10/ga1.jpg ga1 true ga1.jpg jpg 21622 200 355 IMAGE-DOWNSAMPLED 1-s2.0-S0926860X23001084-gr1.jpg https://s3-eu-west-1.amazonaws.com/prod-ucs-content-store-eu-west/content/pii:S0926860X23001084/gr1/DOWNSAMPLED/image/jpeg/243f5e5ebe8d97842bd309967bb5ff04/gr1.jpg gr1 gr1.jpg jpg 38956 259 565 IMAGE-DOWNSAMPLED 1-s2.0-S0926860X23001084-gr8.jpg https://s3-eu-west-1.amazonaws.com/prod-ucs-content-store-eu-west/content/pii:S0926860X23001084/gr8/DOWNSAMPLED/image/jpeg/ebc62fbe6d3f2cd02a858e1835c264cd/gr8.jpg gr8 gr8.jpg jpg 53282 584 376 IMAGE-DOWNSAMPLED 1-s2.0-S0926860X23001084-gr7.jpg https://s3-eu-west-1.amazonaws.com/prod-ucs-content-store-eu-west/content/pii:S0926860X23001084/gr7/DOWNSAMPLED/image/jpeg/80ffe125d351403908086c67995a78cf/gr7.jpg gr7 gr7.jpg jpg 123177 716 678 IMAGE-DOWNSAMPLED 1-s2.0-S0926860X23001084-gr6.jpg https://s3-eu-west-1.amazonaws.com/prod-ucs-content-store-eu-west/content/pii:S0926860X23001084/gr6/DOWNSAMPLED/image/jpeg/61a2c08760d3b42de8354f461afabc1d/gr6.jpg gr6 gr6.jpg jpg 81984 519 678 IMAGE-DOWNSAMPLED 1-s2.0-S0926860X23001084-gr5.jpg https://s3-eu-west-1.amazonaws.com/prod-ucs-content-store-eu-west/content/pii:S0926860X23001084/gr5/DOWNSAMPLED/image/jpeg/673f0218f2b90b91c6ef45e6085a1905/gr5.jpg gr5 gr5.jpg jpg 84180 933 678 IMAGE-DOWNSAMPLED 1-s2.0-S0926860X23001084-gr4.jpg https://s3-eu-west-1.amazonaws.com/prod-ucs-content-store-eu-west/content/pii:S0926860X23001084/gr4/DOWNSAMPLED/image/jpeg/781b48c965c5533cc43c5aab95132e50/gr4.jpg gr4 gr4.jpg jpg 114556 949 678 IMAGE-DOWNSAMPLED 1-s2.0-S0926860X23001084-gr3.jpg https://s3-eu-west-1.amazonaws.com/prod-ucs-content-store-eu-west/content/pii:S0926860X23001084/gr3/DOWNSAMPLED/image/jpeg/a76610abc6076a1d8ed91fe78848cc90/gr3.jpg gr3 gr3.jpg jpg 79211 890 678 IMAGE-DOWNSAMPLED 1-s2.0-S0926860X23001084-gr2.sml https://s3-eu-west-1.amazonaws.com/prod-ucs-content-store-eu-west/content/pii:S0926860X23001084/gr2/THUMBNAIL/image/gif/7e51d90fabcf97b74d233f3fd33311c4/gr2.sml gr2 gr2.sml sml 9884 163 110 IMAGE-THUMBNAIL 1-s2.0-S0926860X23001084-ga1.sml https://s3-eu-west-1.amazonaws.com/prod-ucs-content-store-eu-west/content/pii:S0926860X23001084/ga1/THUMBNAIL/image/gif/b150c87be8881386c66d01e6051e3080/ga1.sml ga1 true ga1.sml sml 15457 123 219 IMAGE-THUMBNAIL 1-s2.0-S0926860X23001084-gr1.sml https://s3-eu-west-1.amazonaws.com/prod-ucs-content-store-eu-west/content/pii:S0926860X23001084/gr1/THUMBNAIL/image/gif/b488ac71a89198832c08500a3011392f/gr1.sml gr1 gr1.sml sml 15595 100 219 IMAGE-THUMBNAIL 1-s2.0-S0926860X23001084-gr8.sml https://s3-eu-west-1.amazonaws.com/prod-ucs-content-store-eu-west/content/pii:S0926860X23001084/gr8/THUMBNAIL/image/gif/a649e1a87539caacbcd25ffd28865125/gr8.sml gr8 gr8.sml sml 5894 163 105 IMAGE-THUMBNAIL 1-s2.0-S0926860X23001084-gr7.sml https://s3-eu-west-1.amazonaws.com/prod-ucs-content-store-eu-west/content/pii:S0926860X23001084/gr7/THUMBNAIL/image/gif/f33f12d93bd1dc70bd8683dbd01aedb9/gr7.sml gr7 gr7.sml sml 9717 164 155 IMAGE-THUMBNAIL 1-s2.0-S0926860X23001084-gr6.sml https://s3-eu-west-1.amazonaws.com/prod-ucs-content-store-eu-west/content/pii:S0926860X23001084/gr6/THUMBNAIL/image/gif/b4479df6f768d638191ed01808acbafe/gr6.sml gr6 gr6.sml sml 10510 164 214 IMAGE-THUMBNAIL 1-s2.0-S0926860X23001084-gr5.sml https://s3-eu-west-1.amazonaws.com/prod-ucs-content-store-eu-west/content/pii:S0926860X23001084/gr5/THUMBNAIL/image/gif/f6dea295f2394d42bbc0ba135fa157fe/gr5.sml gr5 gr5.sml sml 5036 164 119 IMAGE-THUMBNAIL 1-s2.0-S0926860X23001084-gr4.sml https://s3-eu-west-1.amazonaws.com/prod-ucs-content-store-eu-west/content/pii:S0926860X23001084/gr4/THUMBNAIL/image/gif/7da6b78ab694becff8a5ccb7e8c2d4bd/gr4.sml gr4 gr4.sml sml 6211 164 117 IMAGE-THUMBNAIL 1-s2.0-S0926860X23001084-gr3.sml https://s3-eu-west-1.amazonaws.com/prod-ucs-content-store-eu-west/content/pii:S0926860X23001084/gr3/THUMBNAIL/image/gif/f2f9615432a0a1a39ca8a0381925e531/gr3.sml gr3 gr3.sml sml 4603 164 125 IMAGE-THUMBNAIL 1-s2.0-S0926860X23001084-gr2_lrg.jpg https://s3-eu-west-1.amazonaws.com/prod-ucs-content-store-eu-west/content/pii:S0926860X23001084/HIGHRES/image/jpeg/3cd9f6684fe8c9069640f2e51c0ce942/gr2_lrg.jpg gr2 gr2_lrg.jpg jpg 719389 3695 2495 IMAGE-HIGH-RES 1-s2.0-S0926860X23001084-ga1_lrg.jpg https://s3-eu-west-1.amazonaws.com/prod-ucs-content-store-eu-west/content/pii:S0926860X23001084/HIGHRES/image/jpeg/da046119e738deaeb897ea68e27f3c19/ga1_lrg.jpg ga1 true ga1_lrg.jpg jpg 203403 886 1574 IMAGE-HIGH-RES 1-s2.0-S0926860X23001084-gr1_lrg.jpg https://s3-eu-west-1.amazonaws.com/prod-ucs-content-store-eu-west/content/pii:S0926860X23001084/HIGHRES/image/jpeg/12e5616a9584d21ee0acba02197e8030/gr1_lrg.jpg gr1 gr1_lrg.jpg jpg 177345 1142 2495 IMAGE-HIGH-RES 1-s2.0-S0926860X23001084-gr8_lrg.jpg https://s3-eu-west-1.amazonaws.com/prod-ucs-content-store-eu-west/content/pii:S0926860X23001084/HIGHRES/image/jpeg/73a920c49f78d8a68ee9d1e936c28053/gr8_lrg.jpg gr8 gr8_lrg.jpg jpg 273072 2583 1663 IMAGE-HIGH-RES 1-s2.0-S0926860X23001084-gr7_lrg.jpg https://s3-eu-west-1.amazonaws.com/prod-ucs-content-store-eu-west/content/pii:S0926860X23001084/HIGHRES/image/jpeg/5b7496a0672e78556b7d9068ed511bf8/gr7_lrg.jpg gr7 gr7_lrg.jpg jpg 601792 3164 2994 IMAGE-HIGH-RES 1-s2.0-S0926860X23001084-gr6_lrg.jpg https://s3-eu-west-1.amazonaws.com/prod-ucs-content-store-eu-west/content/pii:S0926860X23001084/HIGHRES/image/jpeg/0e7e611c72e576ec037ab57c210d0bc5/gr6_lrg.jpg gr6 gr6_lrg.jpg jpg 395105 2290 2994 IMAGE-HIGH-RES 1-s2.0-S0926860X23001084-gr5_lrg.jpg https://s3-eu-west-1.amazonaws.com/prod-ucs-content-store-eu-west/content/pii:S0926860X23001084/HIGHRES/image/jpeg/f06ac959f8d2c0a7f9255047e9b39e15/gr5_lrg.jpg gr5 gr5_lrg.jpg jpg 439628 4118 2994 IMAGE-HIGH-RES 1-s2.0-S0926860X23001084-gr4_lrg.jpg https://s3-eu-west-1.amazonaws.com/prod-ucs-content-store-eu-west/content/pii:S0926860X23001084/HIGHRES/image/jpeg/a851d33b521aa932aa39802a710e32d5/gr4_lrg.jpg gr4 gr4_lrg.jpg jpg 580986 4189 2994 IMAGE-HIGH-RES 1-s2.0-S0926860X23001084-gr3_lrg.jpg https://s3-eu-west-1.amazonaws.com/prod-ucs-content-store-eu-west/content/pii:S0926860X23001084/HIGHRES/image/jpeg/11732a716a832a7894db1d13f9ee60cb/gr3_lrg.jpg gr3 gr3_lrg.jpg jpg 459327 3928 2994 IMAGE-HIGH-RES 1-s2.0-S0926860X23001084-mmc1.docx https://s3-eu-west-1.amazonaws.com/prod-ucs-content-store-eu-west/content/pii:S0926860X23001084/mmc1/MAIN/application/vnd.openxmlformats-officedocument.wordprocessingml.document/7683de48f5aa6595e3b3a8ce40409249/mmc1.docx mmc1 mmc1.docx docx 3381308 APPLICATION 1-s2.0-S0926860X23001084-si0001.svg https://s3-eu-west-1.amazonaws.com/prod-ucs-content-store-eu-west/content/pii:S0926860X23001084/image/svg+xml/6ecec2af0ccf7eab9c672b3bcfe08641/si0001.svg si0001 si0001.svg svg 2021 ALTIMG 1-s2.0-S0926860X23001084-si0002.svg https://s3-eu-west-1.amazonaws.com/prod-ucs-content-store-eu-west/content/pii:S0926860X23001084/image/svg+xml/aabae8ea2a3d6cd7f26bd75821989555/si0002.svg si0002 si0002.svg svg 3760 ALTIMG 1-s2.0-S0926860X23001084-am.pdf https://s3-eu-west-1.amazonaws.com/prod-ucs-content-store-eu-west/content/egi:10B3CM7PJH1/MAIN/application/pdf/d79e2bf5e23b8006c54e884deaa03e1a/am.pdf am am.pdf pdf false 2771593 AAM-PDF APCATA 119128 119128 S0926-860X(23)00108-4 10.1016/j.apcata.2023.119128 Elsevier B.V. Fig. 1 The commercial oxidation catalyst; a) canned catalyst sample, b) FE-SEM image of the wiremesh catalyst. Fig. 1 Fig. 2 FE-SEM images of the (a) Fresh sample, (b) Reducing aged sample at 750 ℃, (c) Oxidizing aged sample at 750 ℃, (d) Reducing aged sample at 900 ℃, (e) Oxidizing aged sample at 900 ℃; FE-SEM magnification of 200 kx. Fig. 2 Fig. 3 Particle size distribution histograms of the (a) Fresh sample, (b) Reducing aged sample at 750 ℃, (c) Oxidizing aged sample at 750 ℃, (d) Reducing aged sample at 900 ℃, (e) Oxidizing aged at 900 ℃; Measurements are based on FE-SEM images with a magnification of 200 kx. Fig. 3 Fig. 4 X–ray photoelectron spectra of Pt4f for the (a) Fresh, (b) Reducing aged at 750 ℃, (c) Oxidizing aged at 750 ℃, (d) Reducing aged at 900 ℃, (e) Oxidizing aged at 900 ℃ catalysts. Fig. 4 Fig. 5 X–ray photoelectron spectra of Pd3d for the (a) Fresh, (b) Reducing aged at 750 ℃, (c) Oxidizing aged at 750 ℃, (d) Reducing aged at 900 ℃, (e) Oxidizing aged at 900 ℃ catalysts. Fig. 5 Fig. 6 C3H6 and CO conversion as a function of inlet temperature in the absence and presence of CO/C3H6 over fresh catalyst: (a) Lean (b) Stoichiometric (c) Rich (d) Ultra-rich condition. Solid lines represent co-oxidation tests and dashed lines represent individual oxidation tests. Fig. 6 Fig. 7 Effect of reducing and oxidizing aging on CO and C3H6 conversion as a function of temperature at different air-fuel ratios; aging under reducing atmosphere at 750 °C and 900 °C: (a) lean (c) stoichiometric, and (e) rich conditions, and aging under oxidizing atmosphere at 750 °C and 900 °C: (b) lean (d) stoichiometric, and (f) rich conditions. F: fresh, A: aged, C3: C3H6. Fig. 7 Fig. 8 (a) The variation of CO T50 as a function of Pt0 content (solid line), CO T50 as a function of Pd2+ content (dashed line), and CO T50 as a function of average particle size of the catalyst (dotted line) under stoichiometric condition (b) Effect of aging conditions on CO T50, Pt0 content and particle size (c) Effect of aging conditions on CO T50, Pd2+ content and particle size; bubble sizes correspond to average particle size of the catalyst with the labels next to each bubble indicating particle sizes (nm). Fig. 8 Table 1 Physicochemical properties of the fresh and aged catalysts in a wiremesh structure. Table 1 Samples Relative contribution based on XPS (%) Avg. particlesize (nm) SBET (m2/g) Total porevolume (cm3/g) Pt loading(ppm) Pd loading(ppm) Pt0 Pt2+ Pt4+ Pd0 Pd2+ Pd4+ Fresh 57.7 42.3 - 4.6 58.9 36.5 15.7 20.07 0.01517 470 118 Aged (Red. 750 ℃) 40.2 43.8 15.9 21.9 41.5 36.6 20.9 17.40 0.01487 462 110 Aged (Oxid. 750 ℃) 35.8 36.5 27.8 1.9 45.6 52.6 29.9 15.26 0.01461 454 108 Aged (Red. 900 ℃) 41.7 27.1 31.3 32.4 15 52.6 39.9 9.14 0.01390 437 101 Aged (Oxid. 900 ℃) 19.3 23.9 56.9 50.1 22.1 27.8 58.8 7.22 0.01368 430 103 Table 2 Feed gas concentration used in the experiments at different lambda values. Table 2 Individual CO oxidation Individual C3H6 oxidation Co-oxidation of CO and C3H6 Lambda (λ) 0.6 0.7 0.8 1.0 1.2 0.6 0.7 0.8 1.0 1.2 0.6 0.7 0.8 1.0 1.2 CO (%) 1.8 1.8 1.8 1.8 1.8 1.8 1.8 1.8 1.8 1.8 C3H6 (ppm) 3000 3000 3000 3000 3000 3000 3000 3000 3000 3000 O2 (%) 0.54 0.63 0.72 0.9 1.08 0.81 0.94 1.08 1.35 1.62 1.35 1.58 1.8 2.25 2.7 Table 3 Estimated T10, T30, T50 of CO and C3H6 TPO experiments on the fresh catalyst. Table 3 Air-fuel ratio Reaction T10 (°C) T30 (°C) T50 (°C) Max conv. (%) λ = 1.2 CO oxidation Individual 184 209 217 100 Co-Oxidation 197 225 256 100 C3H6 oxidation Individual 227 244 248 100 Co-Oxidation 255 256 257 100 λ = 1.0 CO oxidation Individual 191 214 222 100 Co-Oxidation 196 227 264 100 C3H6 oxidation Individual 234 252 258 100 Co-Oxidation 264 266 267 100 λ = 0.8 CO oxidation Individual 198 222 232 77 Co-Oxidation 208 262 272 92 C3H6 oxidation Individual 237 256 267 80 Co-Oxidation 274 277 278 73 λ = 0.6 CO oxidation Individual 209 234 257 52 Co-Oxidation 235 283 294 88 C3H6 oxidation Individual 251 272 289 60 Co-Oxidation 298 315 - 37 Effect of hydrothermal aging on CO and C3H6 oxidation over a Pt-Pd-based wiremesh catalyst as a motorcycle aftertreatment device Arman Taheri Investigation Writing – original draft Visualization Writing – review & editing Tayebeh Hamzehlouyan Project administration Conceptualization Resources Writing – review & editing ⁎ Chemical and Petroleum Engineering Department, Sharif University of Technology, Tehran 145888-9694, Iran Chemical and Petroleum Engineering Department, Sharif University of Technology Tehran 145888-9694 Iran Chemical and Petroleum Engineering Department, Sharif University of Technology, Tehran 145888–9694, Iran ⁎ Corresponding author. Motorcycles are major contributors to air pollutants, i.e. CO, VOCs, and PM, emissions to the atmosphere in some regions around the world. Hydrothermal aging of the Pd-Pt-based wiremesh catalyst, as an emission control device for 4-stroke carburetor motorcycles, was studied under laboratory-simulated aging conditions. Aging temperature and reaction atmosphere were selected as independent variables affecting aging. Catalyst properties were characterized by ICP, XPS, BET, EDS, and FE-SEM analysis. Increasing aging temperature and oxidizing atmosphere led to a more pronounced particle size growth and sintering after aging. Regardless of the aging temperature, surface inhibition effects gradually disappeared by shifting the light-off curves to higher temperatures, whether the reason for this shift is oxygen deficiency in the reaction mixture or hydrothermal aging of the catalyst. The surface concentration of the most active phase of platinum, Pt0, decreased in the following order: fresh sample > reducing-aged at 750 °C ≈ reducing-aged at 900 °C > oxidizing-aged at 750 °C > oxidizing-aged at 900 °C. The overall trend of activity for different samples is as follows: fresh sample > reducing-aged at 750 °C > oxidizing-aged at 750 °C > reducing-aged at 900 °C > oxidizing-aged at 900 °C. The less extent of deactivation under reducing atmosphere was attributed to the preservation of metallic Pt content and limited particle size growth under such aging conditions. Analysis of the effect of the air-fuel ratio on the light-off profiles indicated that under all aging conditions, the rich atmosphere resulted in the highest degree of deactivation compared to stoichiometric and lean conditions. Graphical Abstract ga1 Keywords Catalyst deactivation CO and propylene conversion Pt-Pd/Al2O3/CeO2/ZrO2 Motorcycle emission control Catalyst aging Data Availability Data will be made available on request. 1 Introduction Air pollutants emitted from automotive exhaust gas contribute to global warming, ozone layer depletion, acid rain, and environmental toxicity [1,2]. Over 200 million motorcycles in-use around the world account for a significant portion of carbon monoxide (CO) and unburned hydrocarbons (HC) emissions [3,4]. Specifically, over one million motorcycles operating in the city of Tehran, the capital of Iran, are responsible for 31% of the total volatile organic compound (VOC), 15% of CO, and 12% of particulate matter (PM) emissions from mobile sources demonstrating their substantial contribution in air pollutants emissions in this city [5,6]. To meet strict environmental emission standards, exhaust aftertreatment catalysts need to maintain a high yield during the entire useful lifetime of motor vehicles. Despite significant improvements in catalytic converters technology during the last decades, catalyst deactivation due to poisoning and hydrothermal aging has always been a challenge [7]. Thermal aging is the major problem in the deactivation of automotive catalysts, where elevated temperatures, the presence of water vapor, and inconstant environmental conditions result in a series of processes leading to a loss of catalytic activity. Loss of specific surface area of the catalyst support, sintering of noble metal particles, and growth of the mixed oxides can decrease the effective contact between the gaseous species present in the exhaust gas and catalytic sites thus decreasing catalyst activity [8]. Oxidation catalysts, as an exhaust aftertreatment system for motorcycles, can reduce emissions of CO, VOC, and PM by 80%, 60%, and 50%, respectively [9]. Pt-Pd bimetallic catalysts are good candidates for oxidation catalysts, both in motorcycle applications and diesel applications as diesel oxidation catalysts (DOC), because of their superior oxidation performance. These bimetallic catalysts are susceptible to sintering when exposed to high temperatures. The effect of Hydrothermal aging on the performance of Pt-Pd-based catalysts, including DOC [7,10,11], three-way catalyst (TWC) [8,12], and methane oxidation catalyst (MOC) [13,14], have been previously investigated. TWCs typically contain Pt, Pd, and Rh as active phases, while Pt and Pd are the main active species in oxidation catalysts (eg. DOC and MOC) formulations. Alumina is the most common metal oxide in the DOC support formulation, while ceria-zirconia-alumina mixed oxides are typically used as aftertreatment catalyst support in stoichiometric combustion applications. Pt is observed to more readily sinter when subjected to hydrothermal aging compared to Pd supported on alumina [10]. Bimetallic Pt-Pd catalysts have been introduced as alternatives for Pt-only catalysts to enhance the thermal stability of metallic Pt [15,16]. The reduced Pt sites (metallic Pt phase) have been identified as the active sites for oxidation reactions [17–23]. Pd has higher thermal stability under oxidizing conditions compared to oxidized Pt, as the latter can form volatile PtO2; Therefore, Pt-Pd alloy has been introduced as an efficient catalyst formulation with enhanced hydrothermal stability [15,24–26]. Especially, the addition of Pd to Pt-based catalysts can suppress the formation of large Pt particles, which typically happens due to a vapor-phase transport of platinum during high-temperature treatment of Pt [15,24–27]. In contrast, Pd particles sinter more rapidly under reducing conditions [28], most likely due to the formation of metallic Pd that has a lower surface tension than PdO [29,30]. Carrillo et al. [31], reported that PdO nanoparticles can trap mobile Pt species under oxidizing atmosphere and prevent Pt sintering in bimetallic Pt-Pd catalysts. The difference in driving patterns between automobiles and motorcycles results in exhaust gases with different compositions and temperatures. Motorcycle catalytic converters under-study are exposed to lower temperatures and emit very low nitrogen oxide (NOx) concentrations, so it is important to evaluate the activity and aging of motorcycle catalysts under their relevant operating conditions. The performance of motorcycle catalysts, including TWCs [32–35] and oxidation catalysts [3,36–38], has been evaluated in some studies. Small changes in the aging temperature were found to have large impacts on the monolithic catalyst performance in motorcycle applications. Elevation in aging temperature has a more significant impact on CO conversion compared to the addition of oil poisons [9]. Another study focused on the effects of aging temperature and aging time on the thermal deactivation of metallic Pt/Pd/Rh honeycomb motorcycle catalytic converters. Growth in the crystallites due to the washcoat sintering of the aged catalysts was reported as the main cause of catalyst deactivation. The loss of specific surface area and the increase in pore size caused by the sintering were strongly temperature-dependent [39]. A study of the hydrothermal stability of an Rh-based three-way catalyst as a motorcycle emission control device suggested that severe aggregation and transformation of the oxidation state of Rh species into an inactive RhO2 state after aging are the main reasons for severe deactivation [32]. Increasing the air-fuel ratio, as an important parameter affecting catalyst activity, or injecting secondary air to the exhaust gas upstream of the motorcycle oxidation catalyst can improve catalyst conversion and reduce CO and unburned HCs emissions [40–42]. Various catalyst structures such as ceramic structures [35,43], corrugated metals [41,44], and metallic honeycomb monoliths have been utilized in motorcycle-application studies. However, research studies on oxidation catalysts with wiremesh structures are very limited. The wiremesh structure, as a novel technology, has an advantage over other metallic structures, including corrugated metals and metallic monoliths. It is knitted from the stainless steel as a heat resistant wire and is able to trap and oxidize the volatile, particulate compounds and oil droplets efficiently. Wiremesh catalyst can move the particle size distribution to lower sizes, the integral particle counts stay approximately unchanged, but the values of PM emissions due to its filtration functionality are reduced by more than 50% [45]. The wiremesh structure also facilitates heat distribution because of its large thermal conductivity and prevents occurrence of hotspots in the catalyst due to the progress of exothermic reactions. Therefore, the wiremesh structure has more efficient heat distribution than conventional monolithic structures. To the best of our knowledge, the effect of hydrothermal aging on the properties and activity of Pt-Pd-based catalysts in motorcycle-relevant applications has not been studied in previous works. The possible correlations between the activity of the aged wiremesh catalyst and its properties have not yet been elucidated. In the present work, oxidation of CO and C3H6 (as a representative hydrocarbon) over a commercial Pt-Pd/Al2O3/CeO2/ZrO2 catalyst with a wiremesh structure is studied in a flow reactor set-up using temperature-programmed oxidation (TPO) experiments. Four different hydrothermal aging procedures were carried out to investigate the effect of aging on the catalyst's activity. Due to the significant role of air-fuel ratio in the wiremesh catalyst activity toward CO and C3H6 oxidation [41], its effect on the activity of the fresh and aged samples was examined. Catalyst characterization using field emission scanning electron microscopy (FE-SEM), X-ray photoelectron spectroscopy (XPS), inductively coupled plasma optical emission spectroscopy (ICP-OES), Brunauer−Emmett−Teller (BET), and Energy-Dispersive Spectroscopy (EDS) was performed to study the effect of various aging conditions on particle morphology, particle size, specific surface area, noble metal loading, and oxidation state of PGM in the samples. Finally, correlations between the properties and activity of the aged catalyst were presented. 2 Experimental 2.1 Catalyst characterization A commercial oxidation catalyst (Pt−Pd/CeO2 −ZrO2 −Al2O3), developed by an industrial catalyst manufacturer as a motorcycle aftertreatment system, was used in this study. The catalyst substrate is woven stainless steel wire over which the active phase is washcoated. The initial canned sample is a cylindrical shape of 5.6 cm diameter and 8 cm length with a total wire surface of about 0.12 m2 and wire diameter of 0.35 mm as shown in Fig. 1a. The FE-SEM image of a small piece of the sample is presented in Fig. 1b in which the washcoat powder coated on the metal substrate can be observed. The catalyst washcoat contains Pt and Pd (Pt:Pd weight ratio of 4:1) as active metals and CeO2, ZrO2, and Al2O3 as a mixed metal oxide support. The BET surface area of the washcoat and total pore volume are 89.63 m2/g and, 0.32 cm3/g, respectively. Inductively coupled plasma optical emission spectroscopy (ICP-OES) analysis was performed on the fresh and aged samples with wiremesh structure. Pt and Pd loading of the wiremesh sample in the fresh and different aged states are presented in Table 1. Concentration of the main metallic elements of the washcoat (i.e. Pt, Pd, Al, Ce, and Zr) obtained from the ICP-OES analysis are also presented in Table S1 in the supporting information. A BELSORP device model MINI II was utilized to determine the specific surface area and porosity of the fresh and aged samples. The degassing process was performed at 120 °C for 2 h. The nitrogen uptake and desorption tests were then carried out at − 196 °C. Brunauer-Emmett-Teller (BET) analysis was employed in order to calculate the specific surface area. The total volume of the pores was obtained from the desorption isotherms. The morphology of the fresh and aged samples was analyzed using field emission scanning electron microscopy (FE-SEM). A MIRA III-LMU, TESCAN instrument equipped with SE and BSD detectors at a voltage of 30 kV and a resolution of 5 nm was used in the FE-SEM analysis. Pt/Pd particle size (surface-average particle size) was calculated based on FE-SEM images using a sphere model. ImageJ software was used for FE-SEM image processing and calculation of the individual Pt/Pd particles area. Particle diameter was estimated based on Eq. (1) [12]. (1) d p = ∑ n i d i 3 / ∑ n i d i 2 where dp represents the FE-SEM surface-average particle size, di is the diameter of individual particles in the FE-SEM image, and ni is the number of particles of size di. The average particle size was calculated for the fresh sample and aged samples based on size measurement for at least 360 particles. Energy-dispersive X-ray (EDX) mapping images of Pd and Pt elements were obtained for the fresh and aged samples using an Oxford Instruments EDS Microanalysis equipment, equipped with an X-MAX-80 detector with 20 kV of electron accelerating voltage. ASTM E1508–12a Standard Guide was used for Quantitative Analysis by Energy-Dispersive Spectroscopy (EDS). The results of the Pd and Pt EDS analysis are presented in Fig. S2 and S3 in the supporting information. The catalysts composition and electronic structure of the fresh and aged samples with wiremesh structure were investigated using X-ray photoelectron spectroscopy (XPS). A BESTEC (EA 10) electron spectrometer instrument equipped with an achromatic MgKα radiation with a photon energy of 1253.6 eV was used for the XPS analysis. The samples were prepared by securing the wiremesh samples onto double-sided carbon sticky tape. The XPS main chamber was evacuated to 10−10 Torr. The binding energies (BE) of surface species were determined with an accuracy of ± 0.1 eV and calibrated using C1s peak at 285.0 eV. Origin software was used for peak deconvolution and analysis of the spectral data. 2.2 Reactor system A schematic representation of the reactor setup is shown in Fig. S4 in the supporting information. The simulated exhaust gas mixture was produced using high purity gas cylinders. Five mass flow controllers (MFCs) were employed to adjust different gas flow rates and produce desired feed gas concentrations. Required steam for running the aging tests was introduced using a temperature-controlled bubbler by directing the N2 flow through it as a carrier gas. In the tests run under dry conditions, a three-way valve was used to direct the N2 flow to the feed manifold without passing through the bubbler. The inlet and outlet gas lines were wrapped with heating tapes and insulation tapes to keep the line temperatures above 140 ℃ in order to avoid water condensation within the system and improve temperature uniformity of the catalyst. The reactor consisted of a cylindrical quartz tube placed in a temperature-controlled furnace. A cylindrical piece of the wiremesh catalyst, with a diameter of 1.9 cm and length of 1.1 cm, was cut from the commercial sample and used in the reactor tests. In order to extract samples with approximately the same weight and washcoat loading, the samples were cut out from the central point of the wiremesh catalyst with approximately the same length, diameter, and extent of compactness. Mineral wool was wrapped around the sample to block space between the catalyst and quartz tube walls and to prevent gas bypass around the catalyst. The catalyst sample was then loaded inside the quartz tube reactor with internal diameter of 21 mm. Two K-type thermocouples were inserted inside the quartz tube reactor for temperature measurements at two different positions: (1) 1 cm upstream of the inlet face of the catalyst to measure the inlet gas temperature; (2) inside the wiremesh catalyst close to its back face to monitor the sample temperature. Outlet gas concentrations of CO, C3H6, and CO2 were measured using a Henan Oceanus OC-1000 gas detector. Feed gas concentration was also measured by flowing the inlet gas through bypass. The frequency of gas concentration measurement was 1 Hz. The outlet gas concentrations and temperatures in the reactor tube were continuously recorded on a PC. 2.3 Aging and activity tests procedures C3H6 was used as a representative for hydrocarbons in the simulated exhaust gas during reactor tests. Since the majority of Tehran’s motorcycle fleet have four-stroke 125 cc displacement volume, spark-ignited, gasoline-fueled engines with a carburetor fueling system with significant CO and HC emissions [46], 125 cc-engine motorcycles were selected as a representative of Tehran’s motorcycle fleet. Emission data of these motorcycles were used to define the operating conditions of the catalyst activity tests. Due to the ultra-rich combustion of the motorcycles under-study, the amount of NOx emission is very low (i.e. NOx mole fraction in the exhaust gas is within 0.005–0.030%), while CO mole fraction is within 1.8–8.0% and total hydrocarbon mole fraction is within 0.17–0.83%. Therefore, the catalyst activity toward oxidation of CO and hydrocarbons (as the main exhaust pollutants) was evaluated in this study. The CO and C3H6 concentration ranges were selected based on the exhaust gas data of 125 cc gasoline carburetor motorcycles. Considering the ultra-rich combustion (lambda’s as low as 0.6–0.7) of the motorcycles under-study and the beneficial effect of oxygen on the activity of a similar wiremesh oxidation catalyst [41], all TPO experiments were run under different air-fuel ratios representing rich, stoichiometric and lean conditions. Lambda (λ) is the ratio of the operating air-fuel ratio (AFR) to the stoichiometric AFR as shown in Eq. (2) [47]: (2) λ= AFR/AFRstoich After loading each sample into the reactor, the sample was degreened at 550 ℃ for 2 h in 1% O2, 5% H2O, balance N2. The degreening procedure was conducted for all the newly-loaded fresh samples prior to running the reactor tests. Activity of the fresh and aged catalysts was evaluated using temperature-programmed oxidation (TPO) experiments. All the TPO tests were run using a ramp rate of 5 °C/min from 150 °C to 600 °C. Table 2 shows the inlet gas compositions for each set of experiments. All the experiments and aging procedures were conducted at the gas hourly space velocity (GHSV) of 25000 h−1 corresponding to the total flow rate of 1.3 L/min. CO and C3H6 co-oxidation tests were carried out on the fresh and aged samples. For the sake of comparison, individual CO and C3H6 oxidation tests were also run on the fresh samples. The light-off tests were run in the absence of H2O and CO2 in the feed. While the absence of CO2 is not expected to significantly impact oxidation results, H2O can affect CO and C3H6 oxidation activity. However, to simplify the reaction mixture and minimize the effect of water gas shift and steam reforming reactions, TPO experiments were run without inlet H2O with the goal of avoiding complexities in data interpretation and focusing on the catalyst activity toward CO and propylene oxidation as the key reactions of interest. A blank test was run by loading mineral wool with no catalyst bed to ensure that the mineral wool does not have any activity. The pressure drop through the catalyst bed was also measured which was below 2 mbar. In the first set of experiments, the effect of the air-fuel ratio on the fresh catalyst activity was evaluated by running TPO experiments for individual CO oxidation, individual propylene oxidation, and co-oxidation of CO and propylene. Individual and co-oxidation tests were run under lambda values of 0.6 (ultra-rich), 0.8 (rich), 1.0 (stoichiometric) and 1.2 (lean). Considering the ultra-rich condition of motorcycles under-study, the two lambda values of 0.6 and 0.8 within the rich range were employed in the first set of experiments to better quantify the impact of oxygen deficiency on catalyst activity. In the second set of experiments, the effect of aging atmosphere and temperature on the wiremesh catalyst activity was studied. To obtain an accurate baseline for making comparison between the activity of the fresh and aged samples and account for small light-off temperature variations originating from the small changes in catalyst size upon changing the samples, the TPO test for co-oxidation of CO and propylene was first conducted on each fresh sample at the three lambda values of 0.7 (as an intermediate value between 0.6 and 0.8), 1.0 and 1.2. Then, the hydrothermal aging procedure was run under various operating conditions. The aging protocol consisted of heating the catalyst to the desired aging temperature under N2, followed by flowing either an oxidizing mixture, i.e. 16% O2, 10% H2O, balanced with N2, or a reducing mixture, i.e. 1% H2, 10% H2O, balanced with N2, over the catalyst for 8 h. Each aging protocol was conducted at two different temperatures, i.e. 750 ℃ and 900 ℃, corresponding to equivalent mileage of approximately 1250 km and 11000 km based on the General Motors RAT-A equation [48], respectively. Thus, the four different aging procedures were as follows: (1) Oxidizing atmosphere at 750 ℃, (2) Reducing atmosphere at 750 ℃, (3) Oxidizing atmosphere at 900 ℃, (4) Reducing atmosphere at 900 ℃. After aging, the water flow was turned off and the nitrogen flow was switched directly to the reactor feed manifold (instead of going through the bubbler) and the reactor was maintained at the aging temperature for 20 min to desorb the remaining moisture from the catalyst. The sample was then cooled down to room temperature without any further changes in the inlet composition. To stabilize the state of catalyst and improve data reproducibility, an oxidative pretreatment was run after each aging protocol and prior to the TPO tests by flowing 10% O2 in N2 at 550 ℃ over the aged sample for 2 h. According to our preliminary data, running either oxidizing or reducing pretreatment at 550/350 ℃ in the absence of water did not affect conversion profiles over the aged samples. The light-off test for co-oxidation of CO and propylene was run over the aged samples at the three different lambda values. The data reproducibility was verified by repeating all the experiments. For this purpose, for all the TPO tests run under lean, stoichiometric, and rich conditions, the activity tests were repeated for the second time on the same sample. The repeated light-off profiles were overlaid with their corresponding first-run profiles indicating data reproducibility. 3 Results and discussion 3.1 Catalyst characterization results The particle size and morphology of metallic phase on the catalyst surface are important factors affecting oxidation catalysts activity. FE-SEM images of the fresh samples were taken after degreening procedure (as described in Section 2.3) so as to represent the corresponding state of the fresh sample used in the reactor tests. Low-magnification FE-SEM images of the fresh and hydrothermally aged catalysts are shown in Fig. 2. Fig. 2c indicates that upon aging at 750 °C under oxidizing condition, some changes occur in the catalyst morphology where slab shape particles appeared compared to the nearly spherical shapes of the fresh catalyst (Fig. 2a). The samples aged at 900 °C (Figs. 2d and 2e) displayed more severe sintering compared to the samples aged at 750 °C. Particle size distribution for the fresh and aged samples were obtained using FE-SEM images with 200 k magnification and are presented in Fig. 3. Here, FE-SEM was used to get a sense of the extent of particle size growth (regardless of metal particles or support) upon different aging conditions. Particle size distribution of the fresh sample is in the range of 6–24 nm and average particle size is 15.7 nm (Fig. 3a). After aging at 750 °C under oxidizing and reducing atmosphere, the average particle size increased to 29.9 nm (Figs. 3c) and 20.9 nm (Fig. 3b), respectively. The extent of increase in particle size was greater at the higher aging temperature (900 °C). Oxidizing-aging at 900 °C, led to the surface-average particle size of 58.8 nm with a broader particle distribution (Fig. 3e) indicating severe sintering when compared with 39.9 nm average size after reducing-aging at 900 °C (Fig. 3d). Regardless of the aging temperature, oxidizing atmosphere sintered the catalyst more severely than reducing atmosphere. Platinum, as the main active phase of the catalyst, has a dominating role in determining the overall catalyst properties. Under oxidative environment, platinum is normally covered with a very thin film of oxide. The vapor pressure of Pt oxides is higher than that of Pd oxides, therefore the degree of catalyst sintering is higher in the Pt-based catalysts under oxidizing conditions. Increasing platinum or palladium particle sizes can adversely affect catalytic performance due to the reduced available surface area [13,47,49,50]. In addition to the particles size of the active metals (i.e. Pt or Pd), oxidation state of active phase plays a crucial role on the catalytic activity. Metallic Pt is generally regarded as the most active phase for oxidation reactions and it is favorable to have a high content of Pt0 on the surface [21], [51,52]. PdO is considered as the more active phase of palladium in oxidation reactions [53]. X-ray photoelectron spectroscopy (XPS) analysis was used to investigate the impact of hydrothermal aging on the oxidation state of platinum and palladium, as the active phase of the catalyst, in the fresh and aged samples. The Pt4f core level spectra revealed that platinum is present in three oxidation states: Pt0, Pt2+ and Pt4+. The photoelectron spectra of Pt4f for the fresh and aged catalysts are shown in Fig. 4. The 4 f7/2 peak at 70.9 eV and the 4 f5/2 peak at 74.1 eV were assigned to Pt0 representing metallic platinum particles [54]. The binding energies at 73.7 and 77.1 eV were associated with Pt2+ species from PtO phase [55]. The feature at 74.9 eV was attributed to 4 f7/2 peak of Pt4+ from PtO2 phase [17,56]. According to the literature [57,58], palladium supported on Al2O3 may exist in three forms (Pd0, PdO and PdO2) or a combination thereof in the Pd3d core level. As shown in Fig. 5, the obtained results for the fresh and aged catalysts show that the Pd3d core level spectra is present in three oxidation states—Pd0, Pd2+ and Pd4+. The binding energies in the range 336.9–337.2 eV indicated the presence of PdO [59]. The binding energies at 334.9 and 335.1 eV in the photoelectron spectra were assigned to Pd0 species from metal palladium particles [58,59]. A third component at 338.6–339.3 eV was associated with Pd4+ from PdO2 phase [57]. Surface concentration of various Pt species can be obtained using Eq. (3): (3) Pt n ( % ) = ∑ i n ( i + 1 ) n S i n / ∑ 1 6 S i ( n = 0 , + 2 , + 4 ) where Si represents the area under each Pt-related peak and Si n is the area under the Ptn peak. n is the oxidation state of platinum. A similar equation was used to calculate different surface concentration of various Pd species. The contribution of Pt0, Pt2+, Pt4+, Pd0, Pd2+, and Pd4+ on the surface of fresh and aged samples was calculated based on the XPS results and the results are presented in Table 1. The relative surface contribution of Pt0 and Pd2+ on the fresh sample was 57.7% and 58.9%, respectively, demonstrating the highest content of Pt metallic phase and PdO species among all samples. The high content of the more active Pt0 and Pd2+ on the fresh sample can facilitate CO and C3H6 oxidation. Concentration of Pt2+ (i.e. PtO phase) is 42.3% and the Pt4+ (PtO2) peak was not observed on the fresh sample spectra. The substantial content of PtO is probably due to the fresh sample exposure to degreening conditions (i.e. in the presence of O2 and steam at 550 °C) and the role of the oxygen storage components of the support (such as ceria) in providing oxygen for PtO formation. Upon aging at 750 °C under reducing and oxidizing conditions, the relative contribution of Pt0 decreased to 40.2% and 35.8%, respectively, and the Pt4+ peak appeared in the spectra. Oxidizing condition facilitates oxidation of Pt and increases the Pt4+ content on the surface relative to that under reducing condition. Formation of PtO and PtO2 phases at 750 °C is going to negatively impact CO/C3H6 conversion over the aged samples. The relative contribution of Pd0 and Pd4+ (PdO2) on the fresh sample is 4.6% and 36.5%, respectively. According to the literature [13], formation of stable Pd4+ species on the catalyst may also contribute to the reaction, leading to an increase in the catalytic activity. Upon aging at 750 °C, the relative concentration of Pd2+ (the most active phase of palladium) decreased to 41.5% and 45.6% under reducing and oxidizing conditions, respectively. As shown in Figs. 4d-e and 5d-e, with increasing the aging temperature up to 900 °C, the intensity of XPS spectra for both noble metals was significantly suppressed indicating partial Pt and Pd loss at such high temperatures. This result is in agreement with our results from ICP-OES analysis, presented in Table 1, where up to 8.5% Pt and 14.4% Pd loss were observed in the samples aged at 900 °C. In the aged sample under oxidizing atmosphere at 900 °C, the intensity of all Pt- and Pd-related peaks has significantly decreased, except the Pt4+ peak at approximately 75 eV (Fig. 4e). This indicates PtO2 domination on the surface. The surface contribution of the most active phase of palladium, Pd2+, in different samples decreases in the following order: fresh sample > oxidizing-aged at 750 °C > reducing-aged at 750 °C > oxidizing-aged at 900 °C > reducing-aged at 900 °C. However, the order for Pt0 (as the most active phase of platinum) is: fresh sample > reducing-aged at 750 °C ≈ reducing-aged at 900 °C > oxidizing-aged at 750 °C > oxidizing-aged at 900 °C. These results indicate that, upon reducing-aging protocols, lower extent of Pt0 oxidation to Ptn+ occurs compared to the oxidizing aging protocols. This is expected to be beneficial for achieving higher oxidation activities as it preserves the most active Pt0 state. Note that the decrease observed in the relative content of Pt0 after reducing aging can be due to the presence of water that can act as an oxygen source at high temperatures. According to the overall trend observed for Pd2+ (as will be shown in Fig. 8c), at each aging temperature, Pd2+ fraction under oxidizing condition is higher than that under reducing condition. The extent of decrease in Pd2+ contribution extremely depends on the aging temperature rather than aging atmosphere. The reason for such behavior is the presence of CeO2 and ZrO2 in the support. Due to the good interaction between Pd and Ce-Zr-O, the mobility of active oxygen from Ce-Zr to Pd can readily stabilize PdO species regardless of reducing or oxidizing conditions [58]. The values of BET surface area, total pore volume, and noble metal concentration of the fresh and aged samples with the wiremesh structure are listed in Table 1. Note that the low values reported for surface area and pore volume is due to the nature of wiremesh sample, where coated metallic substrate has been used in the BET analysis (not washcoat powder by itself). The specific surface area of the fresh wiremesh sample is 20.07 m2/g. After aging at 750 °C, the BET surface area of the sample decreases by 13.3% and 24.0% under reducing and oxidizing conditions, respectively. After aging at 900 °C, the surface area significantly drops by 54.4% and 64.0% under reducing and oxidizing conditions, respectively. Similar trend in observed for pore volume of the sample which decreases by increasing the aging temperature. The pore volume and BET surface area of the samples decrease in the following order: fresh sample > Reducing-aged at 750 ℃ > Oxidizing-aged at 750 ℃ > Reducing-aged at 900 ℃ > Oxidizing-aged at 900 ℃. These results indicate dramatic structural changes and sintering occurred during hydrothermal aging at high temperature that can play role in activity loss of the aged samples. Vaporization of the noble metals at high temperatures is one of the reasons for catalyst deactivation. According to the literature [60], Pt is more easily vaporized than Pd, but the combination of two PGMs makes the platinum more resistant against vaporization. The ICP results in Table 1 show that, upon aging at 750 °C, the noble metal loading (i.e. Pt and Pd) decreased such that up to 3.4% and 8.5% decrease occurred in Pt and Pd concentration, respectively, after oxidizing aging at 750 °C. For the catalysts aged at 900 °C, the Pt concentration decreased by 8.5% under oxidizing condition and the Pd concentration decreased by 14.4% after reducing aging. In summary, hydrothermal aging led to decreased surface area and partial loss of noble metals due to vaporization, as confirmed by the ICP and XPS results in this study. This phenomena becomes more pronounced at higher aging temperatures and can remarkably aggravate the extent of catalyst deactivation. 3.2 CO and propylene oxidation over the fresh catalyst Co-oxidation of CO and propylene over a fresh wiremesh sample was performed as a measure of initial activity of the catalyst. The mutual effects of CO and propylene on the oxidation reactions were also studied. The experiments were run under lean, stoichiometric, rich and ultra-rich conditions using lambda values of 1.2, 1.0, 0.8, and 0.6, respectively. CO and propylene conversion profiles as a function of inlet gas temperature are presented in Fig. 6 where solid lines represent co-oxidation profiles. Similar tests were run for individual oxidation of CO and propylene. For comparison, the corresponding individual oxidation profiles are also displayed in Fig. 6 using dashed lines. As shown in Fig. 6, the presence of both reactants in the feed gas resulted in the shift of all light-off curves toward higher temperatures with respect to the corresponding individual oxidation profiles. Such a shift is due to the mutual inhibition effects of CO and C3H6 on their oxidation activity, consistent with the previous results in the literature [61–63]. Competitive adsorption of reactants on either Pt or Pd active sites as well as surface intermediates are the reasons for such mutual inhibition. Each CO molecule normally requires one Pt or Pd active site for adsorption and segmentation into smaller species, whereas each C3H6 molecule requires multiple active sites [63]. CO and propylene also limit oxygen adsorption and dissociation onto the surface and this competitive step is facilitated as temperature increases. At the early stages of light off, due to the relative abundance of adsorbed CO compared to C3H6 surface intermediates, the probability of CO reaction with adsorbed oxygen is higher. Upon the progress of exothermic CO oxidation, temperature further increases and the number of available active sites for C3H6 adsorption and oxidation obviously increases. At this stage, CO profile decelerates due to the inhibition effects of propylene-derived surface intermediates (Figs. 6a and 6b). The appearance of the low slope region in the 210–260 °C range in the CO oxidation profile during co-oxidation is clearly visible under the lean and stoichiometric conditions (Figs. 6a and 6b) indicating the inhibition effects of propylene-derived surface intermediates [61]. According to the literature [61,62], the scission of adsorbed propylene on catalyst surface leads to formation of intermediate species such as ethylene, acetate and formats. This in turn leads to appearance of inhibition steps on CO conversion profiles. Note that the initial ignition of CO during co-oxidation is close to that during individual CO oxidation. Propylene-derived intermediates form after CO ignition by utilizing the CO oxidation exotherm. With further increase in temperature, the heat required for desorption/reaction of surface species is provided and the inhibition steps are followed by accelerated progress of CO and propylene conversion. Under rich and ultra-rich conditions, the nearly flat region is gradually dissipated and only appears as slight inflection points on CO conversion profiles at λ = 0.8 and λ = 0.6. The reason for gradual disappearance of the lower slope region under rich and ultra-rich conditions, is that these intermediates are stable below 250 °C and start to desorb/convert at higher temperatures where the rich and ultra-rich conversion profiles are located. During individual and co-oxidation tests, complete conversion of CO is achieved under stoichiometric (Fig. 6a) and lean conditions (Fig. 6b). However, under oxygen-deficient atmospheres (Figs. 6c and 6d), i.e. lambda values of 0.8 and 0.6, complete CO conversion was not attained even at high temperatures. At these lambda values, final CO conversion in the presence of propylene is higher than the corresponding values in the CO-only experiments. The reason for such higher conversion is that in the simultaneous presence of both reactants, CO ignition starts prior to C3H6 ignition. Therefore during co-oxidation tests, higher fraction of the limited oxygen content in the feed gas is available to react with CO, and higher level of final CO conversion is attained compared to that of the individual CO oxidation. Comparison between individual and co-oxidation profiles indicates that by introducing the second reactant to the feed, a greater shift toward higher temperatures is seen for CO conversion profile compared to propylene profile. For example, CO T50 (i.e. the temperature at which CO conversion is 50%) increases about 42 °C while propylene T50 increases about 9 °C during co-oxidation under stoichiometric condition (as shown in Table 3 and Fig. S5 in the supporting information). As such, C3H6 hindrance toward CO oxidation is more significant than CO hindrance toward C3H6 oxidation due to the substantial negative impact of propylene-derived intermediates. Since CO has also blocked some of the surface sites, the easier oxidation of these species leads to earlier CO light-off. The CO inhibition effect on propylene oxidation becomes more severe as O2 concentration decreases. Under lean and stoichiometric conditions (i.e. Figs. 6a and 6b), the ignition slopes for CO and propylene after inhibition steps were generally steeper compared to the rich and ultra-rich conditions. Therefore, complete conversion of CO and propylene was attainable at relatively lower temperatures when sufficient amount of oxygen was available. The best performance was achieved at λ = 1.2 where almost complete conversion of both reactants was attained at 310 °C. As such, the catalyst performance ranking for co-oxidation of CO and propylene under different air-fuel ratios is: λ = 1.2 > 1 > 0.8 > 0.6. 3.3 Effect of aging on catalyst activity 3.3.1 Aging under reducing condition The effect of various aging conditions on catalyst performance was evaluated by running activity tests under lean, stoichiometric and rich condition (i.e. corresponding to lambda values of 1.2, 1.0, and 0.7, respectively). Fig. 7(a, c, and e) shows CO and propylene light-off curves after aging the sample under reducing atmosphere at 750 ℃ and 900 ℃ at the three lambda values. CO and propylene conversion profiles for the fresh sample, performed prior to each aging procedure, are also shown on the plots with dashed lines (denoted as F in the legend). Decreasing the air-fuel ratio has shifted CO and propylene light-off profiles to higher temperatures, similar to the results observed for the fresh samples. Regardless of air-fuel ratio condition, aging under reducing condition led to shift of conversion profiles toward higher temperatures. The higher the aging temperature, the higher the extent of this shift to the right. Under lean and stoichiometric conditions (Fig. 7a-d), where sufficient oxygen is available, CO and C3H6 conversion profiles overlay with each other at ca. 50% conversion due to the desorption/reaction of surface intermediates and the availability of active sites for propylene oxidation. A different trend is observed under the oxygen-deficient atmosphere (i.e. λ = 0.7, Figs. 7e and 7f) where propylene oxidation experiences a delay after CO light-off and a gap between CO and C3H6 TPO profiles is seen for all samples. In addition, a more significant decay in the slope of propylene conversion profiles is observed as aging conditions become more severe. Under rich conditions, the appearance of the lower slope region becomes less significant over the fresh and aged samples. In order to make a comparison between changes in T50 and T10′s under lean, stoichiometric, and rich conditions after various hydrothermal aging conditions, Fig. S5 is presented in the supporting information. A clearly distinct trend is observed in the final parts of CO and C3H6 conversion profiles over the aged samples at the lambda value of 0.7 (Fig. 7e). In the high temperature range (above 350 °C for the 750 °C-aged sample and above 380 °C for the 900 °C-aged sample), CO conversion becomes descending and propylene conversion continuously increases over both aged samples. The reason is the progress of steam reforming reactions and partial oxidation of propylene, as undesired side reactions, over the aged samples under an extremely oxygen-deficient atmosphere. Our data indicate that at the high temperature, CO2 concentration at the reactor outlet remains constant (data not shown) when propylene conversion is ascending and CO conversion is decaying (Fig. 7e). Once a substantial amount of CO has been reacted and very small oxygen concentration is available, there is a competition between CO and C3H6 for consuming the remaining oxygen. Under such conditions, steam reforming reaction and partial oxidation of propylene proceed and CO oxidation to CO2 is suppressed. Therefore, the extra CO emission produced by steam reforming and partial oxidation of C3H6 results in lower CO conversions. The progress of C3H6 partial oxidation is insignificant in the earlier stages of light off. These results are in line with the previous studies where partial oxidation of C3H6 has been reported to occur on Pt-based catalysts above 400 °C under the rich condition [36–38]. 3.3.2 Aging under oxidizing condition CO and C3H6 light-off curves for the fresh and aged samples with aging under the oxidizing condition at 750 ℃ and 900 ℃ is shown in Fig. 6. Different panels indicate the test results at three different lambda values, i.e. 1.2, 1.0 and 0.7. Under all air-fuel ratios, the conversion profiles of the aged samples are shifted toward higher temperatures, with the shift becoming more significant as the aging temperature increases from 750 °C to 900 °C. Comparison between Fig. 7(a, c, e) and Fig. 7(b, d, f) at corresponding lambda values indicates that the extent of shift toward higher temperatures due to oxidizing-aging is greater than that due to reducing-aging. At lambda values of 1.0 and 1.2 (Fig. 7b and d), the lower slope region in CO conversion profiles of the aged samples becomes less significant compared to the fresh one. According to these results, surface inhibition effects gradually disappear by shifting the light-off curves to higher temperatures, whether the reason for this shift is oxygen deficiency in the reaction mixture or hydrothermal aging of the catalyst. Other features of the conversion profiles of the oxidizing-aged samples are similar to the results reported for the samples aged under a reducing atmosphere (Fig. 7a and c). According to these results, switching the catalyst condition from rich toward lean atmosphere can partially compensate the deactivation impacts of hydrothermal aging by moving the light-off curves toward lower temperatures. Therefore, injecting secondary air to the exhaust gas upstream of the catalyst (and downstream of the combustion chamber) can result in an overall improvement in CO and propylene conversion with respect to the catalyst performance under its normal operating condition (i.e. rich mode). 3.3.3 Correlation between catalyst properties and activity The extent of catalyst deactivation was analyzed as a function of catalyst properties including average particle size and oxidation state of all species in active phase (i.e. Pt and Pd). Since CO and C3H6 T50 are correlated with each other, CO T50 was used as a measure of catalyst activity for oxidation reactions where the lower T50′s indicate higher activities. Correlation between either CO or C3H6 T50 and average particle size is shown in Fig. 8a. indicating a linear relationship between these two parameters (with R2 equal to 0.99). The extent of activity loss (i.e. increase in T50) and the particle size of the samples increase in the following order: fresh sample < reducing-aged at 750 °C < oxidizing-aged at 750 °C < reducing-aged at 900 °C < oxidizing-aged at 900 °C. These results show that the most severe deactivation occurs at 900 °C under oxidizing atmosphere. At each aging temperature employed, higher degree of catalyst sintering occurred under oxidizing atmosphere compared to the reducing one. Sintering of Pt and Pd has been reported as an important reason for dramatic deactivation of TWCs after aging at 900 °C [64–69]. The extent of deactivation can also be correlated with variations of either the most active state of the Pt or Pd phase on the surface. Previous studies have shown that metallic Pt [51] and PdO [53] are the main active phase for oxidation reactions over Pt-Pd catalysts. Pd-based catalysts deactivate significantly under reducing atmosphere compared to the oxidizing atmosphere [70], while Pt-based catalysts substantially lose their activity under oxidizing conditions [71]. Considering our catalyst formulation (i.e. Pt:Pd ratio 4:1), it is expected that Pt sites play a dominating role in catalyst deactivation behavior. According to the XPS results presented in Table 1, Ptn+ content for the fresh, 750-oxidizing, and 900-oxidizing aged catalysts are 42.3, 64.3, and 80.8, respectively, while Pt0 for these samples are 57.7, 35.8, and 19.3, respectively. Therefore, upon oxidizing aging, the contribution of oxidized states of platinum (i.e. Pt2+ and Pt4+) increases at the expense of metallic Pt. The variation of CO oxidation T50 as a function of metallic Pt content (i.e. Pt0), Pd2+ content (representing PdO as the most active state of palladium), and average particle size of the catalyst is shown in Fig. 8a. Data points are related to the fresh and aged samples under different conditions. There is a linear, negative correlation between CO T50 and the relative contribution of Pt0 sites. Similar negative correlation is also observed between CO T50 and the relative contribution of Pd2+ sites. A very strong positive correlation between CO T50 and average particle size of the catalyst is also observed in Fig. 8a. C3H6 T50 variations with these three catalyst properties indicate trends similar to CO T50 (data not shown for brevity). These results indicate that preserving the higher content of Pt0 and Pd2+ on the catalyst surface and smaller particle size are beneficial for representing high activity toward CO and propylene oxidation reactions. Effect of aging conditions on CO oxidation T50 (vertical axis), metallic Pt content (obtained from XPS analysis and represented in horizontal axis) and average particle size of the catalyst (obtained from FE-SEM analysis) is represented in Fig. 8b. A similar plot with Pd2+ contribution values as the horizontal axis is also shown in Fig. 8c. Bubble sizes correspond to average particle size of the catalyst and the labels next to each bubble indicate average particle sizes in nm. It is worth mentioning that the plot of CO T50 as a function of Pt0, Pd2+, and particle size under other air-fuel ratios, i.e. the lean and rich conditions, follows a trend similar to stoichiometric condition, Fig. 8b and Fig. 8c (data is not shown for brevity). According to Fig. 8b, contribution of metallic Pt in different samples decreases in the following order: fresh sample > reducing-aging at 750 °C ≈ reducing-aging at 900 °C > oxidizing-aging at 750 °C > oxidizing-aging at 900 °C. On the other hand, the order of decrease in the PdO content, shown in Fig. 8c, is: fresh sample > oxidizing-aged at 750 °C > reducing-aged at 750 °C > oxidizing-aged at 900 °C > reducing-aged at 900 °C. Considering catalyst formulation (Pt:Pd of 4:1), the extent of catalyst activity is expected to be mainly governed by the Pt oxidation state. The results presented in Fig. 8b suggest that oxidizing atmosphere at the higher aging temperature (i.e. 900 °C) can substantially exacerbate extent of deactivation due to the significant particle growth associated with lower contribution of Pt0 sites. In contrast, reducing-aging with H2 limits oxidation of platinum sites [69] thereby preserves metallic Pt and results in less deactivation even at 900 °C. It can be seen in Fig. 8c that increasing aging temperature leads to the decrease in PdO (i.e. Pd2+) fraction thus increases CO T50. The effect of aging temperature on the Pd2+ content has been more severe than the aging atmosphere. By increasing the aging temperature, the Pd2+ content has substantially decreased, and this decrease is associated with an increase in the CO T50. At each aging temperature, however, the reducing-aged sample with slightly lower Pd2+ content has a higher activity which is due to the dominating role of Pt state on the overall activity. Using CO T50 as a measure of catalyst activity, it can be concluded that the order of activity in different samples is: fresh sample > reducing-aged at 750 °C > oxidizing-aged at 750 °C > reducing-aged at 900 °C > oxidizing-aged at 900 °C. This ranking is in agreement with the catalyst particle size where the lower size results in higher activity. This ranking also indicates that Pt0 content has a more dominating effect on catalyst activity compared to the Pd2+ content due to the higher content of Pt in catalyst formulation. 4 Conclusions The impact of hydrothermal aging on catalyst particle size, BET surface area, and oxidation state of noble metals was studied. Increasing aging temperature led to a substantial degree of catalyst sintering and particle aggregation resulting in lower BET surface area and a significant particle size growth. At each aging temperature, more significant particle growth was obtained under oxidizing condition compared to reducing one. According to the XPS results, the surface contribution of Pt0, as the most active state of platinum, decreased after hydrothermal aging in the following order: fresh sample > reducing-aged at 750 °C ≈ reducing-aged at 900 °C > oxidizing-aged at 750 °C > oxidizing-aged at 900 °C. The Pd2+ contribution also decreased by increasing the aging temperature and using an oxidizing atmosphere. According to the CO and propylene oxidation tests over the fresh wiremesh catalyst, decreasing lambda values from 1.2 (lean) toward 0.6 (ultra-rich), shifted CO and propylene light-off profiles toward higher temperatures. The inhibition effects of surface intermediates such as ethylene, formate, and acetate, were clearly observed on CO and propylene co-oxidation profiles under the lean and stoichiometric conditions. A descending trend observed in the final stages of CO light-off over the aged samples under the rich condition was due to the partial oxidation of C3H6 to CO above 340 °C. The low slope region, representing surface inhibition effects, disappears on the light-off profiles over the aged samples due to the shift of light-off curves to a higher temperature range. The disappearance of the inhibition steps was also observed in the light-off curve of the fresh samples under the rich and ultra-rich conditions which was attributed to the stability of surface intermediates up to 250 °C. The extent of catalyst deactivation upon aging showed a linear relationship with the particle size and relative contribution of metallic Pt on the surface. The T50 data over the aged samples revealed that the catalyst activity for both CO and propylene conversion decreases in the following order: fresh sample > reducing-aged at 750 °C > oxidizing-aged at 750 °C > reducing-aged at 900 °C > oxidizing-aged at 900 °C. This order was in agreement with the order of catalyst sintering and particle growth where the highest degree of sintering and particle growth occurred under oxidizing aging at 900 °C. It was found that the reducing atmosphere can alleviate the extent of deactivation compared to the oxidizing atmosphere due to the higher content of metallic Pt and less severe particle growth. The normal operating condition of motorcycles under-study is rich and ultra-rich. Therefore, during thermal excursions,less catalyst deactivation is expected compared to oxidizing environment. On the other hand, when pulse air valves are used in the motorcycle exhaust line for injecting secondary air upstream of the catalyst, oxygen can have a more detrimental impact during thermal excursions (temperatures above 700 °C). However, in this case, the normal operating conditions also shift from ultra-rich to stoichiometric or lean conditions, which can improve catalyst activity even after severe hydrothermal aging due to the positive effect of increasing lambda. Therefore, it is expected that using pulse air valves (i.e. excess O2) can have an overall positive impact on the catalyst activity even after high mileage operation of motorcycles. CRediT authorship contribution statement Arman Taheri: Investigation, Writing – original draft, Visualization, Writing – review & editing. Tayebeh Hamzehlouyan: Project administration, Conceptualization, Resources, Writing – review & editing. Declaration of Competing Interest The authors declare that they have no known competing financial interests or personal relationships that could have appeared to influence the work reported in this paper. Acknowledgments This project is funded by the Vice Presidency for Research and Technology at the Sharif University of Technology under grant No. G970133. The authors are grateful to Dr. Vahid Hosseini, associate professor at Simon Fraser University in Canada, and Dr. Andrea Mayer, scientific chair of the VERT association in Switzerland, for their technical assistance during the course of this project. Supporting information Characterization and experimental setup, including TEM, elemental analysis, and EDS mapping, along with the effect of aging on the light off behavior are presented in the supporting information. Appendix A Supporting information Supplementary data associated with this article can be found in the online version at doi:10.1016/j.apcata.2023.119128. Appendix A Supplementary material Supplementary material . References [1] Santhosh Kumar M., Mlynek J., and Buckhout T., On the nature of different Fe sites in Fe-containing micro and mesoporous materials and their catalytic role in the abatement of nitrogen oxides from exhaust gases, (2005). [2] S. Brandenberger O. Kröcher A. Tissler R. Althoff The state of the art in selective catalytic reduction of NOx by ammonia using metal-exchanged zeolite catalysts Catal. Rev. - Sci. Eng. 50 4 2008 492 531 10.1080/01614940802480122 S. Brandenberger, O. Kröcher, A. Tissler, and R. Althoff, “The state of the art in selective catalytic reduction of NOx by ammonia using metal-exchanged zeolite catalysts,” Catalysis Reviews - Science and Engineering, vol. 50, no. 4. pp. 492–531, 2008. doi: 10.1080/01614940802480122. [3] Emission Control of Two-and Three-Wheel Vehicles, (2014). Available: 〈www.meca.org〉. [4] Chafidz A C.R. Megawati V. Widyastuti K. Augustia Nisa Ratnaningrum Application of copper-zinc metal as a catalytic converter in the motorcycle muffler to reduce the exhaust emissions IOP Conf. Ser.: Earth Environ. Sci. 167 1 2018 10.1088/1755-1315/167/1/012014 A. Chafidz, Megawati, C.R. Widyastuti, V. Augustia, K. Nisa, and Ratnaningrum, “Application of copper-zinc metal as a catalytic converter in the motorcycle muffler to reduce the exhaust emissions,” in IOP Conference Series: Earth and Environmental Science, Jul. 2018, vol. 167, no. 1. doi: 10.1088/1755–1315/167/1/012014. [5] H. Shahbazi V. Hosseini S. Torbatian M. Hamedi Assessment of emission reduction scenarios with a focus on the impact of vehicle fleets on tehran air quality: case study Transp. Res Rec. 2673 5 2019 197 207 10.1177/0361198119836770 H. Shahbazi, V. Hosseini, S. Torbatian, and M. Hamedi, “Assessment of Emission Reduction Scenarios with a Focus on the Impact of Vehicle Fleets on Tehran Air Quality: Case Study,” Transp Res Rec, vol. 2673, no. 5, pp. 197–207, May 2019, doi: 10.1177/0361198119836770. [6] H. Shahbazi S. Taghvaee V. Hosseini H. Afshin A GIS based emission inventory development for Tehran Urban Clim. 17 2016 216 229 10.1016/J.UCLIM.2016.08.005 H. Shahbazi, S. Taghvaee, V. Hosseini, and H. Afshin, “A GIS based emission inventory development for Tehran,” Urban Clim, vol. 17, pp. 216–229, Sep. 2016, doi: 10.1016/J.UCLIM.2016.08.005. [7] J. Schütz H. Störmer P. Lott O. Deutschmann Effects of hydrothermal aging on co and no oxidation activity over monometallic and bimetallic pt‐pd catalysts Catalysts 11 3 2021 300 10.3390/catal11030300 J. Schütz, H. Störmer, P. Lott, and O. Deutschmann, “Effects of hydrothermal aging on co and no oxidation activity over monometallic and bimetallic pt‐pd catalysts,” Catalysts, vol. 11, no. 3, pp. 1–18, Mar. 2021, doi: 10.3390/catal11030300. [8] M. Giuliano G. Ricchiardi M.C. Valsania F. Parussa G. Nicol M. Sgroi Characterization of vehicle and laboratory aged commercial three way catalyst: a morphological and functional correlation between real and simulated ageing Int. J. Automot. Technol. 22 1 2021 131 139 10.1007/s12239-021-0014-6 M. Giuliano, G. Ricchiardi, M.C. Valsania, F. Parussa, G. Nicol, and M. Sgroi, “Characterization of Vehicle and Laboratory Aged Commercial Three Way Catalyst: A Morphological and Functional Correlation between Real and Simulated Ageing,” International Journal of Automotive Technology, vol. 22, no. 1, pp. 131–139, Feb. 2021, doi: 10.1007/s12239–021-0014–6. [9] M.A. Tyo D.R. Palke Thermal and Poisoning Effects on the Performance of Motorcycle Emission Control Catalysts SAE Thecnical Paper 1999 doi: 10.4271/1999-01-3301 . M.A. Tyo D.R. Palke Thermal and Poisoning Effects on the Performance of Motorcycle Emission Control Catalysts SAE Thecnical Paper 1999 10.4271/1999-01-3301 [10] R.K. Dadi A modeling and experimental study on hydrothermal aging deactivation of NO oxidation activity on Pt-Pd catalyst Appl. Catal. B 283 2021 119655 ⦸R.K. Dadi et al., “A modeling and experimental study on hydrothermal aging deactivation of NO oxidation activity on Pt-Pd catalyst,” Appl Catal B, vol. 283, p. 119655, 2021. [11] P.H. Ho J.-W. Woo R. Feizie Ilmasani J. Han L. Olsson The role of Pd–Pt interactions in the oxidation and sulfur resistance of bimetallic Pd–Pt/γ-Al2O3 diesel oxidation catalysts Ind. Eng. Chem. Res 60 18 2021 6596 6612 P.H. Ho, J.-W. Woo, R. Feizie Ilmasani, J. Han, and L. Olsson, “The role of Pd–Pt interactions in the oxidation and sulfur resistance of bimetallic Pd–Pt/γ-Al2O3 diesel oxidation catalysts,” Ind Eng Chem Res, vol. 60, no. 18, pp. 6596–6612, 2021. [12] X. Chen Y. Cheng C.Y. Seo J.W. Schwank R.W. McCabe Aging, re-dispersion, and catalytic oxidation characteristics of model Pd/Al2O3 automotive three-way catalysts Appl. Catal. B 163 2015 499 509 10.1016/j.apcatb.2014.08.018 X. Chen, Y. Cheng, C.Y. Seo, J.W. Schwank, and R.W. McCabe, “Aging, re-dispersion, and catalytic oxidation characteristics of model Pd/Al2O3 automotive three-way catalysts,” Appl Catal B, vol. 163, pp. 499–509, Feb. 2015, doi: 10.1016/j.apcatb.2014.08.018. [13] R. Velinova Complex study of the activity, stability and sulfur resistance of Pd/La2O3-CeO2-Al2O3 system as monolithic catalyst for abatement of methane Chem. Eng. J. 368 2019 865 876 10.1016/j.cej.2019.03.017 R. Velinova et al., “Complex study of the activity, stability and sulfur resistance of Pd/La2O3-CeO2-Al2O3 system as monolithic catalyst for abatement of methane,” Chemical Engineering Journal, vol. 368, pp. 865–876, Jul. 2019, doi: 10.1016/j.cej.2019.03.017. [14] E.J. Jang J. Lee D.G. Oh J.H. Kwak CH4 oxidation activity in Pd and Pt–Pd bimetallic catalysts: correlation with surface PdO x quantified from the DRIFTS study ACS Catal. 11 10 2021 5894 5905 E.J. Jang, J. Lee, D.G. Oh, and J.H. Kwak, “CH4 Oxidation Activity in Pd and Pt–Pd Bimetallic Catalysts: Correlation with Surface PdO x Quantified from the DRIFTS Study,” ACS Catal, vol. 11, no. 10, pp. 5894–5905, 2021. [15] T.R. Johns Relating adatom emission to improved durability of Pt–Pd diesel oxidation catalysts J. Catal. 328 2015 151 164 10.1016/J.JCAT.2015.03.016 T.R. Johns et al., “Relating adatom emission to improved durability of Pt–Pd diesel oxidation catalysts,” J Catal, vol. 328, pp. 151–164, Aug. 2015, doi: 10.1016/J.JCAT.2015.03.016. [16] A. Morlang Bimetallic Pt/Pd diesel oxidation catalysts: Structural characterisation and catalytic behaviour Appl. Catal. B 60 3–4 2005 191 199 10.1016/J.APCATB.2005.03.007 A. Morlang et al., “Bimetallic Pt/Pd diesel oxidation catalysts: Structural characterisation and catalytic behaviour,” Appl Catal B, vol. 60, no. 3–4, pp. 191–199, Oct. 2005, doi: 10.1016/J.APCATB.2005.03.007. [17] K. Hauff U. Tuttlies G. Eigenberger U. Nieken Platinum oxide formation and reduction during NO oxidation on a diesel oxidation catalyst – Experimental results, Appl. Catal. B 123–124 2012 107 116 10.1016/J.APCATB.2012.04.008 K. Hauff, U. Tuttlies, G. Eigenberger, and U. Nieken, “Platinum oxide formation and reduction during NO oxidation on a diesel oxidation catalyst – Experimental results,” Appl Catal B, vol. 123–124, pp. 107–116, Jul. 2012, doi: 10.1016/J.APCATB.2012.04.008. [18] A.M. Gänzler Operando spatially and time-resolved X-ray absorption spectroscopy and infrared thermography during oscillatory CO oxidation J. Catal. 328 2015 216 224 10.1016/J.JCAT.2015.01.002 A.M. Gänzler et al., “Operando spatially and time-resolved X-ray absorption spectroscopy and infrared thermography during oscillatory CO oxidation,” J Catal, vol. 328, pp. 216–224, Aug. 2015, doi: 10.1016/J.JCAT.2015.01.002. [19] A. Boubnov A. Gänzler S. Conrad M. Casapu J.D. Grunwaldt Oscillatory CO oxidation over Pt/Al2O3 catalysts studied by in situ XAS and DRIFTS Top. Catal. 56 1–8 2013 333 338 10.1007/s11244-013-9976-6 A. Boubnov, A. Gänzler, S. Conrad, M. Casapu, and J.D. Grunwaldt, “Oscillatory CO oxidation over Pt/Al2O3 catalysts studied by in situ XAS and DRIFTS,” in Topics in Catalysis, May 2013, vol. 56, no. 1–8, pp. 333–338. doi: 10.1007/s11244–013-9976–6. [20] H. Dubbe G. Eigenberger U. Nieken Modeling of Conversion Hysteresis Phenomena for Pt/Pd-based Diesel Oxidation Catalysts Chemie Ingenieur Technik 2018 10.1002/cite.201700134 Dubbe H., Eigenberger G., Nieken U., Modeling of Conversion Hysteresis Phenomena for Pt/Pd-based Diesel Oxidation Catalysts, Chemie Ingenieur Technik (2018), doi:10.1002/cite.201700134. [21] X. Ding The inhibition mechanism of H2O at hydrothermal aging over Pt/SiO2-Al2O3for NO oxidation J. Environ. Chem. Eng. 9 4 2021 10.1016/j.jece.2021.105497 X. Ding et al., “The inhibition mechanism of H2O at hydrothermal aging over Pt/SiO2-Al2O3for NO oxidation,” J Environ Chem Eng, vol. 9, no. 4, Aug. 2021, doi: 10.1016/j.jece.2021.105497. [22] L. Olsson H. Persson E. Fridell M. Skoglundh B. Andersson A kinetic study of NO oxidation and NOx storage on Pt/Al2O3 and Pt/BaO/Al2O3 J. Phys. Chem. B 105 29 2001 6895 6906 10.1021/jp010324p L. Olsson, H. Persson, E. Fridell, M. Skoglundh, and B. Andersson, “A kinetic study of NO oxidation and NOx storage on Pt/Al2O3 and Pt/BaO/Al2O3,” Journal of Physical Chemistry B, vol. 105, no. 29, pp. 6895–6906, Jul. 2001, doi: 10.1021/jp010324p. [23] Y. Liang Comparative activity and hydrothermal stability of FeOx- And CeO2-doped Pt-based catalysts for eliminating diesel emissions J. Environ. Chem. Eng. 8 5 2020 10.1016/j.jece.2020.104361 Y. Liang et al., “Comparative activity and hydrothermal stability of FeOx- And CeO2-doped Pt-based catalysts for eliminating diesel emissions,” J Environ Chem Eng, vol. 8, no. 5, Oct. 2020, doi: 10.1016/j.jece.2020.104361. [24] P.N. Plessow F. Abild-Pedersen Sintering of Pt nanoparticles via volatile PtO2: simulation and comparison with experiments ACS Catal. 6 10 2016 7098 7108 10.1021/acscatal.6b01646 P.N. Plessow and F. Abild-Pedersen, “Sintering of Pt Nanoparticles via Volatile PtO2: Simulation and Comparison with Experiments,” ACS Catal, vol. 6, no. 10, pp. 7098–7108, Oct. 2016, doi: 10.1021/acscatal.6b01646. [25] C.B. Alcock G.W. Hooper Thermodynamics of the gaseous oxides of the platinum-group metals Proc R Soc Lond A Math Phys Sci 254 1279 1960 551 561 10.1098/rspa.1960.0040 C.B. Alcock G.W. Hooper Thermodynamics of the gaseous oxides of the platinum-group metals Proc R Soc Lond A Math Phys Sci 254 1279 1960 551 561 10.1098/rspa.1960.0040 [26] Peuckert M., Study on Surface and Bulk Palladium Oxide, Its Thermal Stability, and a Comparison with Other Noble Metal Oxides, (1985). Available: 〈https://pubs.acs.org/sharingguidelines〉. [27] G.W. Graham Effect of alloy composition on dispersion stability and catalytic activity for NO oxidation over alumina-supported Pt-Pd catalysts Catal. Lett. 116 1–2 2007 1 8 10.1007/s10562-007-9124-7 G.W. Graham et al., “Effect of alloy composition on dispersion stability and catalytic activity for NO oxidation over alumina-supported Pt-Pd catalysts,” Catal Letters, vol. 116, no. 1–2, pp. 1–8, Jul. 2007, doi: 10.1007/s10562–007-9124–7. [28] A. Kalantar Neyestanaki F. Klingstedt T. Salmi D.Y. Murzin Deactivation of postcombustion catalysts, a review Fuel 83 4–5 2004 395 408 10.1016/J.FUEL.2003.09.002 A. Kalantar Neyestanaki, F. Klingstedt, T. Salmi, and D.Y. Murzin, “Deactivation of postcombustion catalysts, a review,” Fuel, vol. 83, no. 4–5, pp. 395–408, Mar. 2004, doi: 10.1016/J.FUEL.2003.09.002. [29] D. Ciuparu L. Pfefferle Methane combustion activity of supported palladium catalysts after partial reduction Appl. Catal. A Gen. 218 1–2 2001 197 209 10.1016/S0926-860X(01)00643-3 D. Ciuparu and L. Pfefferle, “Methane combustion activity of supported palladium catalysts after partial reduction,” Appl Catal A Gen, vol. 218, no. 1–2, pp. 197–209, Sep. 2001, doi: 10.1016/S0926–860X(01)00643–3. [30] E. Ruckenstein J.J. Chen Spreading and surface tension gradient driven phenomena during heating of alumina-supported palladium crystallites in oxygen J. Catal. 70 1 1981 233 236 10.1016/0021-9517(81)90334-1 E. Ruckenstein and J.J. Chen, “Spreading and surface tension gradient driven phenomena during heating of alumina-supported palladium crystallites in oxygen,” J Catal, vol. 70, no. 1, pp. 233–236, Jul. 1981, doi: 10.1016/0021–9517(81)90334–1. [31] C. Carrillo Trapping of mobile Pt species by PdO nanoparticles under oxidizing conditions J. Phys. Chem. Lett. 5 12 2014 2089 2093 10.1021/jz5009483 C. Carrillo et al., “Trapping of mobile Pt species by PdO nanoparticles under oxidizing conditions,” Journal of Physical Chemistry Letters, vol. 5, no. 12, pp. 2089–2093, Jun. 2014, doi: 10.1021/jz5009483. [32] L. Lan Enhanced activity and hydrothermal stability of Rh-based three-way catalyst for emission control from motorcycles with the assistance of monoethanolamine J. Ind. Eng. Chem. 71 2019 127 136 10.1016/j.jiec.2018.11.014 L. Lan et al., “Enhanced activity and hydrothermal stability of Rh-based three-way catalyst for emission control from motorcycles with the assistance of monoethanolamine,” Journal of Industrial and Engineering Chemistry, vol. 71, pp. 127–136, Mar. 2019, doi: 10.1016/j.jiec.2018.11.014. [33] Mc Grane J. and et al., A Study of the Effect of Light-Off Temperatures and Light-Off Curve Shape on the Cumulative Emissions Performance of 3-Way Catalytic Converters, SAE Technical Paper (2021), https://doi.org/10.4271/2021-01-0594. [34] N.D. Tien K.V. Quang N.T. Luong P.H. Tuyen N.D. Khanh Study on improving emission conversion efficiency of three-way catalyst equipped in carburetor motorcycle by air supplement system Int. J. Ambient Energy 43 1 2022 2137 2145 N.D. Tien, K.V. Quang, N.T. Luong, P.H. Tuyen, and N.D. Khanh, “Study on improving emission conversion efficiency of three-way catalyst equipped in carburetor motorcycle by air supplement system,” International Journal of Ambient Energy, vol. 43, no. 1, pp. 2137–2145, 2022. [35] J. Fan A simple and effective method to synthesize Pt/CeO2 three-way catalysts with high activity and hydrothermal stability J. Environ. Chem. Eng. 8 5 2020 104236 J. Fan et al., “A simple and effective method to synthesize Pt/CeO2 three-way catalysts with high activity and hydrothermal stability,” J Environ Chem Eng, vol. 8, no. 5, p. 104236, 2020. [36] C.H. Lee Y.W. Chen Effect of additives on Pd/Al2O3 for CO and propylene oxidation at oxygen-deficient conditions Appl. Catal. B 17 4 1998 279 291 10.1016/S0926-3373(97)00072-6 C.H. Lee and Y.W. Chen, “Effect of additives on Pd/Al2O3 for CO and propylene oxidation at oxygen-deficient conditions,” Appl Catal B, vol. 17, no. 4, pp. 279–291, Aug. 1998, doi: 10.1016/S0926–3373(97)00072–6. [37] H.-C. Wu, L.-C. Liu, and S.-M. Yang, Effects of additives on supported noble metal catalysts for oxidation of hydrocarbons and carbon monoxide, (2001). [38] C.-H. Lee, Y.-W. Chen, Effect of Basic Additives on Pt/Al2O3 for CO and Propylene Oxidation under Oxygen-Deficient Conditions, (1997). [39] Y.C. Chen L.Y. Chen Y.H. Yu F.T. Jeng Study on the thermal deactivation of motorcycle catalytic converters by laboratory aging tests Environ. Technol. 31 3 2010 337 345 10.1080/09593330903473879 Y.C. Chen, L.Y. Chen, Y.H. Yu, and F.T. Jeng, “Study on the thermal deactivation of motorcycle catalytic converters by laboratory aging tests,” Environ Technol, vol. 31, no. 3, pp. 337–345, 2010, doi: 10.1080/09593330903473879. [40] H.-C. Wu S.-M. Yang A. Wang H.-C. Kao 980938 Emission Control Technologies for 50 and 125 cc Motorcycles in Taiwan 2018 Wu H.-C., Yang S.-M., Wang A., Kao H.-C., 980938 Emission Control Technologies for 50 and 125 cc Motorcycles in Taiwan, 2018. [41] A. Lotfollahzade Moghaddam T. Hamzehlouyan V. Hosseini A. Mayer Beneficial role of oxygen in CO and propylene oxidation over a Pt–Pd-based wiremesh catalyst as a retrofit emission control device for four-stroke gasoline spark-ignited motorcycles Energy Fuels 35 12 2021 10122 10133 A. Lotfollahzade Moghaddam, T. Hamzehlouyan, V. Hosseini, and A. Mayer, “Beneficial role of oxygen in CO and propylene oxidation over a Pt–Pd-based wiremesh catalyst as a retrofit emission control device for four-stroke gasoline spark-ignited motorcycles,” Energy & Fuels, vol. 35, no. 12, pp. 10122–10133, 2021. [42] B. Deng The effect of air/fuel ratio on the CO and NOx emissions for a twin-spark motorcycle gasoline engine under wide range of operating conditions Energy 169 2019 1202 1213 10.1016/j.energy.2018.12.113 B. Deng et al., “The effect of air/fuel ratio on the CO and NOx emissions for a twin-spark motorcycle gasoline engine under wide range of operating conditions,” Energy, vol. 169, pp. 1202–1213, Feb. 2019, doi: 10.1016/j.energy.2018.12.113. [43] S. Wang A new monolithic Pt-Pd-Rh motorcycle exhaust catalyst to meet future emission standards Cuihua Xuebao/Chin. J. Catal. 35 9 2014 1482 1491 10.1016/S1872-2067(14)60092-9 S. Wang et al., “A new monolithic Pt-Pd-Rh motorcycle exhaust catalyst to meet future emission standards,” Cuihua Xuebao/Chinese Journal of Catalysis, vol. 35, no. 9, pp. 1482–1491, Sep. 2014, doi: 10.1016/S1872–2067(14)60092–9. [44] J. Czerwinski P. Comte N. Violetti P. Landri A. Mayer F. Reutimann Catalyst Aging and Effects on Particle Emissions of 2-Stroke Scooters 2008 Czerwinski J., Comte P., Violetti N., Landri P., Mayer A., Reutimann F., Catalyst Aging and Effects on Particle Emissions of 2-Stroke Scooters, 2008. [45] J. Czerwinski Combinations of Technical Measures for Reduction of Particle Emissions & Toxicity of 2-S Scooters 2009 Czerwinski J., et al., Combinations of Technical Measures for Reduction of Particle Emissions & Toxicity of 2-S Scooters, 2009. [46] A. Hassani V. Hosseini An assessment of gasoline motorcycle emissions performance and understanding their contribution to Tehran air pollution Transp. Res D. Transp. Environ. 47 2016 1 12 10.1016/j.trd.2016.05.003 A. Hassani and V. Hosseini, “An assessment of gasoline motorcycle emissions performance and understanding their contribution to Tehran air pollution,” Transp Res D Transp Environ, vol. 47, pp. 1–12, Aug. 2016, doi: 10.1016/j.trd.2016.05.003. [47] C.R. Thomas J.A. Pihl M.J. Lance T.J. Toops J.E. Parks J. Lauterbach Effects of four-mode hydrothermal aging on three-way catalysts for passive selective catalytic reduction to control emissions from lean-burn gasoline engine Appl. Catal. B 244 2019 284 294 10.1016/j.apcatb.2018.11.051 C.R. Thomas, J.A. Pihl, M.J. Lance, T.J. Toops, J.E. Parks, and J. Lauterbach, “Effects of four-mode hydrothermal aging on three-way catalysts for passive selective catalytic reduction to control emissions from lean-burn gasoline engine,” Appl Catal B, vol. 244, pp. 284–294, May 2019, doi: 10.1016/j.apcatb.2018.11.051. [48] S. Su Y. Lai C. Hao P. Hou T. Lv Y. Ge Review of rapid ageing testing methods of three-way catalyst for gasoline engine Int. J. Veh. Perform. 6 3 2020 277 293 S. Su, Y. Lai, C. Hao, P. Hou, T. Lv, and Y. Ge, “Review of rapid ageing testing methods of three-way catalyst for gasoline engine,” International Journal of Vehicle Performance, vol. 6, no. 3, pp. 277–293, 2020. [49] I.Y. Pakharukov Concentration hysteresis in the oxidation of methane over Pt/γ-Al2O3: X-ray absorption spectroscopy and kinetic study ACS Catal. 5 5 2015 2795 2804 10.1021/cs501964z I.Y. Pakharukov et al., “Concentration hysteresis in the oxidation of methane over Pt/γ-Al2O3: X-ray absorption spectroscopy and kinetic study,” ACS Catal, vol. 5, no. 5, pp. 2795–2804, May 2015, doi: 10.1021/cs501964z. [50] Y. Ding Superior catalytic activity of a Pd catalyst in methane combustion by fine-tuning the phase of ceria-zirconia support Appl. Catal. B 266 2020 10.1016/j.apcatb.2020.118631 Y. Ding et al., “Superior catalytic activity of a Pd catalyst in methane combustion by fine-tuning the phase of ceria-zirconia support,” Appl Catal B, vol. 266, Jun. 2020, doi: 10.1016/j.apcatb.2020.118631. [51] J. Despres M. Elsener M. Koebel O. Kröcher B. Schnyder A. Wokaun Catalytic oxidation of nitrogen monoxide over Pt/SiO2 Appl. Catal. B 50 2 2004 73 82 J. Despres, M. Elsener, M. Koebel, O. Kröcher, B. Schnyder, and A. Wokaun, “Catalytic oxidation of nitrogen monoxide over Pt/SiO2,” Appl Catal B, vol. 50, no. 2, pp. 73–82, 2004. [52] H.F. Wang Y.L. Guo G. Lu P. Hu NO oxidation on platinum group metals oxides: First principles calculations combined with microkinetic analysis J. Phys. Chem. C. 113 43 2009 18746 18752 10.1021/jp904371f H.F. Wang, Y.L. Guo, G. Lu, and P. Hu, “NO oxidation on platinum group metals oxides: First principles calculations combined with microkinetic analysis,” Journal of Physical Chemistry C, vol. 113, no. 43, pp. 18746–18752, 2009, doi: 10.1021/jp904371f. [53] C. Huang W. Shan Z. Lian Y. Zhang H. He Recent advances in three-way catalysts of natural gas vehicles Catal. Sci. Technol. 10 19 2020 6407 6419 10.1039/d0cy01320j C. Huang, W. Shan, Z. Lian, Y. Zhang, and H. He, “Recent advances in three-way catalysts of natural gas vehicles,” Catal Sci Technol, vol. 10, no. 19, pp. 6407–6419, Oct. 2020, doi: 10.1039/d0cy01320j. [54] Y. Liang X. Ding M. Zhao J. Wang Y. Chen Effect of valence state and particle size on NO oxidation in fresh and aged Pt-based diesel oxidation catalysts Appl. Surf. Sci. 443 2018 336 344 10.1016/j.apsusc.2018.03.032 Y. Liang, X. Ding, M. Zhao, J. Wang, and Y. Chen, “Effect of valence state and particle size on NO oxidation in fresh and aged Pt-based diesel oxidation catalysts,” Appl Surf Sci, vol. 443, pp. 336–344, Jun. 2018, doi: 10.1016/j.apsusc.2018.03.032. [55] Z. Yang J. Li H. Zhang Y. Yang M. Gong Y. Chen Size-dependent CO and propylene oxidation activities of platinum nanoparticles on the monolithic Pt/TiO2-YOx diesel oxidation catalyst under simulative diesel exhaust conditions Catal. Sci. Technol. 5 4 2015 2358 2365 10.1039/c4cy01384k Z. Yang, J. Li, H. Zhang, Y. Yang, M. Gong, and Y. Chen, “Size-dependent CO and propylene oxidation activities of platinum nanoparticles on the monolithic Pt/TiO2-YOx diesel oxidation catalyst under simulative diesel exhaust conditions,” Catal Sci Technol, vol. 5, no. 4, pp. 2358–2365, Apr. 2015, doi: 10.1039/c4cy01384k. [56] L. Olsson E. Fridell The influence of Pt oxide formation and Pt dispersion on the reactions NO2⇔ NO+ 1/2 O2 over Pt/Al2O3 and Pt/BaO/Al2O3 J. Catal. 210 2 2002 340 353 L. Olsson and E. Fridell, “The influence of Pt oxide formation and Pt dispersion on the reactions NO2⇔ NO+ 1/2 O2 over Pt/Al2O3 and Pt/BaO/Al2O3,” J Catal, vol. 210, no. 2, pp. 340–353, 2002. [57] L.S. Kibis A.I. Stadnichenko S.V. Koscheev V.I. Zaikovskii A.I. Boronin Highly oxidized palladium nanoparticles comprising Pd 4+ species: Spectroscopic and structural aspects, thermal stability, and reactivity J. Phys. Chem. C. 116 36 2012 19342 19348 10.1021/jp305166k L.S. Kibis, A.I. Stadnichenko, S. v. Koscheev, V. I. Zaikovskii, and A. I. Boronin, “Highly oxidized palladium nanoparticles comprising Pd 4+ species: Spectroscopic and structural aspects, thermal stability, and reactivity,” Journal of Physical Chemistry C, vol. 116, no. 36, pp. 19342–19348, Sep. 2012, doi: 10.1021/jp305166k. [58] F. Huang Pd or PdO: Catalytic active site of methane oxidation operated close to stoichiometric air-to-fuel for natural gas vehicles Appl. Catal. B 219 2017 73 81 10.1016/j.apcatb.2017.07.037 F. Huang et al., “Pd or PdO: Catalytic active site of methane oxidation operated close to stoichiometric air-to-fuel for natural gas vehicles,” Appl Catal B, vol. 219, pp. 73–81, 2017, doi: 10.1016/j.apcatb.2017.07.037. [59] A.S. Ivanova Metal–support interactions in Pt/Al2O3 and Pd/Al2O3 catalysts for CO oxidation Appl. Catal. B 97 1 2010 57 71 10.1016/j.apcatb.2010.03.024 A.S. Ivanova et al., “Metal–support interactions in Pt/Al2O3 and Pd/Al2O3 catalysts for CO oxidation,” Appl Catal B, vol. 97, no. 1, pp. 57–71, 2010, doi: https://doi.org/10.1016/j.apcatb.2010.03.024. [60] K. Persson K. Jansson S.G. Järås Characterisation and microstructure of Pd and bimetallic Pd-Pt catalysts during methane oxidation J. Catal. 245 2 2007 401 414 10.1016/j.jcat.2006.10.029 K. Persson, K. Jansson, and S.G. Järås, “Characterisation and microstructure of Pd and bimetallic Pd-Pt catalysts during methane oxidation,” J Catal, vol. 245, no. 2, pp. 401–414, Jan. 2007, doi: 10.1016/j.jcat.2006.10.029. [61] M.J. Hazlett W.S. Epling Spatially resolving CO and C3H6 oxidation reactions in a Pt/Al2O3 model oxidation catalyst Catal. Today 267 2016 157 166 10.1016/j.cattod.2015.11.033 M.J. Hazlett and W.S. Epling, “Spatially resolving CO and C3H6 oxidation reactions in a Pt/Al2O3 model oxidation catalyst,” Catal Today, vol. 267, pp. 157–166, Jun. 2016, doi: 10.1016/j.cattod.2015.11.033. [62] M.J. Hazlett M. Moses-Debusk J.E. Parks L.F. Allard W.S. Epling Kinetic and mechanistic study of bimetallic Pt-Pd/Al2O3 catalysts for CO and C3H6 oxidation Appl. Catal. B 202 2017 404 417 10.1016/j.apcatb.2016.09.034 M.J. Hazlett, M. Moses-Debusk, J.E. Parks, L.F. Allard, and W.S. Epling, “Kinetic and mechanistic study of bimetallic Pt-Pd/Al2O3 catalysts for CO and C3H6 oxidation,” Appl Catal B, vol. 202, pp. 404–417, Mar. 2017, doi: 10.1016/j.apcatb.2016.09.034. [63] W. Lang P. Laing Y. Cheng C. Hubbard M.P. Harold Co-oxidation of CO and propylene on Pd/CeO2-ZrO2 and Pd/Al2O3 monolith catalysts: A light-off, kinetics, and mechanistic study Appl. Catal. B 218 2017 430 442 10.1016/j.apcatb.2017.06.064 W. Lang, P. Laing, Y. Cheng, C. Hubbard, and M.P. Harold, “Co-oxidation of CO and propylene on Pd/CeO2-ZrO2 and Pd/Al2O3 monolith catalysts: A light-off, kinetics, and mechanistic study,” Appl Catal B, vol. 218, pp. 430–442, 2017, doi: 10.1016/j.apcatb.2017.06.064. [64] R.M.J. Fiedorow S.E. Wanke The sintering of supported metal catalysts: I. Redispersion of supported platinum in oxygen J. Catal. 43 1–3 1976 34 42 R.M. J. Fiedorow and S.E. Wanke, “The sintering of supported metal catalysts: I. Redispersion of supported platinum in oxygen,” J Catal, vol. 43, no. 1–3, pp. 34–42, 1976. [65] P.C. Flynn S.E. Wanke Experimental studies of sintering of supported platinum catalysts J. Catal. 37 3 1975 432 448 10.1016/0021-9517(75)90180-3 P.C. Flynn and S.E. Wanke, “Experimental studies of sintering of supported platinum catalysts,” J Catal, vol. 37, no. 3, pp. 432–448, Jun. 1975, doi: 10.1016/0021–9517(75)90180–3. [66] L. Olsson H. Karlsson The beneficial effect of SO2 on platinum migration and NO oxidation over Pt containing monolith catalysts Catal. Today 147 2009 S290 S294 L. Olsson and H. Karlsson, “The beneficial effect of SO2 on platinum migration and NO oxidation over Pt containing monolith catalysts,” Catal Today, vol. 147, pp. S290–S294, 2009. [67] A.F. Lee The origin of SO2 promotion of propane oxidation over Pt/Al2O3 catalysts J. Catal. 184 2 1999 491 498 A.F. Lee et al., “The origin of SO2 promotion of propane oxidation over Pt/Al2O3 catalysts,” J Catal, vol. 184, no. 2, pp. 491–498, 1999. [68] T.J. Lee Y.G. Kim Redispersion of supported platinum catalysts J. Catal. 90 2 1984 279 291 T.J. Lee and Y.G. Kim, “Redispersion of supported platinum catalysts,” J Catal, vol. 90, no. 2, pp. 279–291, 1984. [69] X. Auvray T. Pingel E. Olsson L. Olsson The effect gas composition during thermal aging on the dispersion and NO oxidation activity over Pt/Al2O3 catalysts Appl. Catal. B 129 2013 517 527 10.1016/j.apcatb.2012.10.002 X. Auvray, T. Pingel, E. Olsson, and L. Olsson, “The effect gas composition during thermal aging on the dispersion and NO oxidation activity over Pt/Al2O3 catalysts,” Appl Catal B, vol. 129, pp. 517–527, Jan. 2013, doi: 10.1016/j.apcatb.2012.10.002. [70] Y. Nagai Sintering inhibition mechanism of platinum supported on ceria-based oxide and Pt-oxide-support interaction J. Catal. 242 1 2006 103 109 10.1016/j.jcat.2006.06.002 Y. Nagai et al., “Sintering inhibition mechanism of platinum supported on ceria-based oxide and Pt-oxide-support interaction,” J Catal, vol. 242, no. 1, pp. 103–109, Aug. 2006, doi: 10.1016/j.jcat.2006.06.002. [71] H. Shinjoh H. Muraki Y. Fujitani Effect of Severe Thermal Aging on Noble Metal Catalysts (1991).",
      "scopus-id": "85149779684",
      "coredata": {
        "eid": "1-s2.0-S0926860X23001084",
        "dc:description": "Motorcycles are major contributors to air pollutants, i.e. CO, VOCs, and PM, emissions to the atmosphere in some regions around the world. Hydrothermal aging of the Pd-Pt-based wiremesh catalyst, as an emission control device for 4-stroke carburetor motorcycles, was studied under laboratory-simulated aging conditions. Aging temperature and reaction atmosphere were selected as independent variables affecting aging. Catalyst properties were characterized by ICP, XPS, BET, EDS, and FE-SEM analysis. Increasing aging temperature and oxidizing atmosphere led to a more pronounced particle size growth and sintering after aging. Regardless of the aging temperature, surface inhibition effects gradually disappeared by shifting the light-off curves to higher temperatures, whether the reason for this shift is oxygen deficiency in the reaction mixture or hydrothermal aging of the catalyst. The surface concentration of the most active phase of platinum, Pt0, decreased in the following order: fresh sample > reducing-aged at 750 °C ≈ reducing-aged at 900 °C > oxidizing-aged at 750 °C > oxidizing-aged at 900 °C. The overall trend of activity for different samples is as follows: fresh sample > reducing-aged at 750 °C > oxidizing-aged at 750 °C > reducing-aged at 900 °C > oxidizing-aged at 900 °C. The less extent of deactivation under reducing atmosphere was attributed to the preservation of metallic Pt content and limited particle size growth under such aging conditions. Analysis of the effect of the air-fuel ratio on the light-off profiles indicated that under all aging conditions, the rich atmosphere resulted in the highest degree of deactivation compared to stoichiometric and lean conditions.",
        "openArchiveArticle": "false",
        "prism:coverDate": "2023-04-25",
        "openaccessUserLicense": null,
        "prism:aggregationType": "Journal",
        "prism:url": "https://api.elsevier.com/content/article/pii/S0926860X23001084",
        "dc:creator": [
          {
            "@_fa": "true",
            "$": "Taheri, Arman"
          },
          {
            "@_fa": "true",
            "$": "Hamzehlouyan, Tayebeh"
          }
        ],
        "link": [
          {
            "@_fa": "true",
            "@rel": "self",
            "@href": "https://api.elsevier.com/content/article/pii/S0926860X23001084"
          },
          {
            "@_fa": "true",
            "@rel": "scidir",
            "@href": "https://www.sciencedirect.com/science/article/pii/S0926860X23001084"
          }
        ],
        "dc:format": "application/json",
        "openaccessType": null,
        "pii": "S0926-860X(23)00108-4",
        "prism:volume": "656",
        "articleNumber": "119128",
        "prism:publisher": "Elsevier B.V.",
        "dc:title": "Effect of hydrothermal aging on CO and C3H6 oxidation over a Pt-Pd-based wiremesh catalyst as a motorcycle aftertreatment device",
        "prism:copyright": "© 2023 Elsevier B.V. All rights reserved.",
        "openaccess": "0",
        "prism:issn": "0926860X",
        "dcterms:subject": [
          {
            "@_fa": "true",
            "$": "Catalyst deactivation"
          },
          {
            "@_fa": "true",
            "$": "CO and propylene conversion"
          },
          {
            "@_fa": "true",
            "$": "Pt-Pd/Al2O3/CeO2/ZrO2"
          },
          {
            "@_fa": "true",
            "$": "Motorcycle emission control"
          },
          {
            "@_fa": "true",
            "$": "Catalyst aging"
          }
        ],
        "openaccessArticle": "false",
        "prism:publicationName": "Applied Catalysis A: General",
        "openaccessSponsorType": null,
        "prism:pageRange": "119128",
        "pubType": "fla",
        "prism:coverDisplayDate": "25 April 2023",
        "prism:doi": "10.1016/j.apcata.2023.119128",
        "prism:startingPage": "119128",
        "dc:identifier": "doi:10.1016/j.apcata.2023.119128",
        "openaccessSponsorName": null
      },
      "objects": {
        "object": [
          {
            "@category": "standard",
            "@height": "837",
            "@width": "565",
            "@_fa": "true",
            "$": "https://api.elsevier.com/content/object/eid/1-s2.0-S0926860X23001084-gr2.jpg?httpAccept=%2A%2F%2A",
            "@multimediatype": "JPEG image file",
            "@type": "IMAGE-DOWNSAMPLED",
            "@size": "137756",
            "@ref": "gr2",
            "@mimetype": "image/jpeg"
          },
          {
            "@category": "standard",
            "@height": "200",
            "@width": "355",
            "@_fa": "true",
            "$": "https://api.elsevier.com/content/object/eid/1-s2.0-S0926860X23001084-ga1.jpg?httpAccept=%2A%2F%2A",
            "@multimediatype": "JPEG image file",
            "@type": "IMAGE-DOWNSAMPLED",
            "@size": "21622",
            "@ref": "ga1",
            "@mimetype": "image/jpeg"
          },
          {
            "@category": "standard",
            "@height": "259",
            "@width": "565",
            "@_fa": "true",
            "$": "https://api.elsevier.com/content/object/eid/1-s2.0-S0926860X23001084-gr1.jpg?httpAccept=%2A%2F%2A",
            "@multimediatype": "JPEG image file",
            "@type": "IMAGE-DOWNSAMPLED",
            "@size": "38956",
            "@ref": "gr1",
            "@mimetype": "image/jpeg"
          },
          {
            "@category": "standard",
            "@height": "584",
            "@width": "376",
            "@_fa": "true",
            "$": "https://api.elsevier.com/content/object/eid/1-s2.0-S0926860X23001084-gr8.jpg?httpAccept=%2A%2F%2A",
            "@multimediatype": "JPEG image file",
            "@type": "IMAGE-DOWNSAMPLED",
            "@size": "53282",
            "@ref": "gr8",
            "@mimetype": "image/jpeg"
          },
          {
            "@category": "standard",
            "@height": "716",
            "@width": "678",
            "@_fa": "true",
            "$": "https://api.elsevier.com/content/object/eid/1-s2.0-S0926860X23001084-gr7.jpg?httpAccept=%2A%2F%2A",
            "@multimediatype": "JPEG image file",
            "@type": "IMAGE-DOWNSAMPLED",
            "@size": "123177",
            "@ref": "gr7",
            "@mimetype": "image/jpeg"
          },
          {
            "@category": "standard",
            "@height": "519",
            "@width": "678",
            "@_fa": "true",
            "$": "https://api.elsevier.com/content/object/eid/1-s2.0-S0926860X23001084-gr6.jpg?httpAccept=%2A%2F%2A",
            "@multimediatype": "JPEG image file",
            "@type": "IMAGE-DOWNSAMPLED",
            "@size": "81984",
            "@ref": "gr6",
            "@mimetype": "image/jpeg"
          },
          {
            "@category": "standard",
            "@height": "933",
            "@width": "678",
            "@_fa": "true",
            "$": "https://api.elsevier.com/content/object/eid/1-s2.0-S0926860X23001084-gr5.jpg?httpAccept=%2A%2F%2A",
            "@multimediatype": "JPEG image file",
            "@type": "IMAGE-DOWNSAMPLED",
            "@size": "84180",
            "@ref": "gr5",
            "@mimetype": "image/jpeg"
          },
          {
            "@category": "standard",
            "@height": "949",
            "@width": "678",
            "@_fa": "true",
            "$": "https://api.elsevier.com/content/object/eid/1-s2.0-S0926860X23001084-gr4.jpg?httpAccept=%2A%2F%2A",
            "@multimediatype": "JPEG image file",
            "@type": "IMAGE-DOWNSAMPLED",
            "@size": "114556",
            "@ref": "gr4",
            "@mimetype": "image/jpeg"
          },
          {
            "@category": "standard",
            "@height": "890",
            "@width": "678",
            "@_fa": "true",
            "$": "https://api.elsevier.com/content/object/eid/1-s2.0-S0926860X23001084-gr3.jpg?httpAccept=%2A%2F%2A",
            "@multimediatype": "JPEG image file",
            "@type": "IMAGE-DOWNSAMPLED",
            "@size": "79211",
            "@ref": "gr3",
            "@mimetype": "image/jpeg"
          },
          {
            "@category": "thumbnail",
            "@height": "163",
            "@width": "110",
            "@_fa": "true",
            "$": "https://api.elsevier.com/content/object/eid/1-s2.0-S0926860X23001084-gr2.sml?httpAccept=%2A%2F%2A",
            "@multimediatype": "GIF image file",
            "@type": "IMAGE-THUMBNAIL",
            "@size": "9884",
            "@ref": "gr2",
            "@mimetype": "image/gif"
          },
          {
            "@category": "thumbnail",
            "@height": "123",
            "@width": "219",
            "@_fa": "true",
            "$": "https://api.elsevier.com/content/object/eid/1-s2.0-S0926860X23001084-ga1.sml?httpAccept=%2A%2F%2A",
            "@multimediatype": "GIF image file",
            "@type": "IMAGE-THUMBNAIL",
            "@size": "15457",
            "@ref": "ga1",
            "@mimetype": "image/gif"
          },
          {
            "@category": "thumbnail",
            "@height": "100",
            "@width": "219",
            "@_fa": "true",
            "$": "https://api.elsevier.com/content/object/eid/1-s2.0-S0926860X23001084-gr1.sml?httpAccept=%2A%2F%2A",
            "@multimediatype": "GIF image file",
            "@type": "IMAGE-THUMBNAIL",
            "@size": "15595",
            "@ref": "gr1",
            "@mimetype": "image/gif"
          },
          {
            "@category": "thumbnail",
            "@height": "163",
            "@width": "105",
            "@_fa": "true",
            "$": "https://api.elsevier.com/content/object/eid/1-s2.0-S0926860X23001084-gr8.sml?httpAccept=%2A%2F%2A",
            "@multimediatype": "GIF image file",
            "@type": "IMAGE-THUMBNAIL",
            "@size": "5894",
            "@ref": "gr8",
            "@mimetype": "image/gif"
          },
          {
            "@category": "thumbnail",
            "@height": "164",
            "@width": "155",
            "@_fa": "true",
            "$": "https://api.elsevier.com/content/object/eid/1-s2.0-S0926860X23001084-gr7.sml?httpAccept=%2A%2F%2A",
            "@multimediatype": "GIF image file",
            "@type": "IMAGE-THUMBNAIL",
            "@size": "9717",
            "@ref": "gr7",
            "@mimetype": "image/gif"
          },
          {
            "@category": "thumbnail",
            "@height": "164",
            "@width": "214",
            "@_fa": "true",
            "$": "https://api.elsevier.com/content/object/eid/1-s2.0-S0926860X23001084-gr6.sml?httpAccept=%2A%2F%2A",
            "@multimediatype": "GIF image file",
            "@type": "IMAGE-THUMBNAIL",
            "@size": "10510",
            "@ref": "gr6",
            "@mimetype": "image/gif"
          },
          {
            "@category": "thumbnail",
            "@height": "164",
            "@width": "119",
            "@_fa": "true",
            "$": "https://api.elsevier.com/content/object/eid/1-s2.0-S0926860X23001084-gr5.sml?httpAccept=%2A%2F%2A",
            "@multimediatype": "GIF image file",
            "@type": "IMAGE-THUMBNAIL",
            "@size": "5036",
            "@ref": "gr5",
            "@mimetype": "image/gif"
          },
          {
            "@category": "thumbnail",
            "@height": "164",
            "@width": "117",
            "@_fa": "true",
            "$": "https://api.elsevier.com/content/object/eid/1-s2.0-S0926860X23001084-gr4.sml?httpAccept=%2A%2F%2A",
            "@multimediatype": "GIF image file",
            "@type": "IMAGE-THUMBNAIL",
            "@size": "6211",
            "@ref": "gr4",
            "@mimetype": "image/gif"
          },
          {
            "@category": "thumbnail",
            "@height": "164",
            "@width": "125",
            "@_fa": "true",
            "$": "https://api.elsevier.com/content/object/eid/1-s2.0-S0926860X23001084-gr3.sml?httpAccept=%2A%2F%2A",
            "@multimediatype": "GIF image file",
            "@type": "IMAGE-THUMBNAIL",
            "@size": "4603",
            "@ref": "gr3",
            "@mimetype": "image/gif"
          },
          {
            "@category": "high",
            "@height": "3695",
            "@width": "2495",
            "@_fa": "true",
            "$": "https://api.elsevier.com/content/object/eid/1-s2.0-S0926860X23001084-gr2_lrg.jpg?httpAccept=%2A%2F%2A",
            "@multimediatype": "JPEG image file",
            "@type": "IMAGE-HIGH-RES",
            "@size": "719389",
            "@ref": "gr2",
            "@mimetype": "image/jpeg"
          },
          {
            "@category": "high",
            "@height": "886",
            "@width": "1574",
            "@_fa": "true",
            "$": "https://api.elsevier.com/content/object/eid/1-s2.0-S0926860X23001084-ga1_lrg.jpg?httpAccept=%2A%2F%2A",
            "@multimediatype": "JPEG image file",
            "@type": "IMAGE-HIGH-RES",
            "@size": "203403",
            "@ref": "ga1",
            "@mimetype": "image/jpeg"
          },
          {
            "@category": "high",
            "@height": "1142",
            "@width": "2495",
            "@_fa": "true",
            "$": "https://api.elsevier.com/content/object/eid/1-s2.0-S0926860X23001084-gr1_lrg.jpg?httpAccept=%2A%2F%2A",
            "@multimediatype": "JPEG image file",
            "@type": "IMAGE-HIGH-RES",
            "@size": "177345",
            "@ref": "gr1",
            "@mimetype": "image/jpeg"
          },
          {
            "@category": "high",
            "@height": "2583",
            "@width": "1663",
            "@_fa": "true",
            "$": "https://api.elsevier.com/content/object/eid/1-s2.0-S0926860X23001084-gr8_lrg.jpg?httpAccept=%2A%2F%2A",
            "@multimediatype": "JPEG image file",
            "@type": "IMAGE-HIGH-RES",
            "@size": "273072",
            "@ref": "gr8",
            "@mimetype": "image/jpeg"
          },
          {
            "@category": "high",
            "@height": "3164",
            "@width": "2994",
            "@_fa": "true",
            "$": "https://api.elsevier.com/content/object/eid/1-s2.0-S0926860X23001084-gr7_lrg.jpg?httpAccept=%2A%2F%2A",
            "@multimediatype": "JPEG image file",
            "@type": "IMAGE-HIGH-RES",
            "@size": "601792",
            "@ref": "gr7",
            "@mimetype": "image/jpeg"
          },
          {
            "@category": "high",
            "@height": "2290",
            "@width": "2994",
            "@_fa": "true",
            "$": "https://api.elsevier.com/content/object/eid/1-s2.0-S0926860X23001084-gr6_lrg.jpg?httpAccept=%2A%2F%2A",
            "@multimediatype": "JPEG image file",
            "@type": "IMAGE-HIGH-RES",
            "@size": "395105",
            "@ref": "gr6",
            "@mimetype": "image/jpeg"
          },
          {
            "@category": "high",
            "@height": "4118",
            "@width": "2994",
            "@_fa": "true",
            "$": "https://api.elsevier.com/content/object/eid/1-s2.0-S0926860X23001084-gr5_lrg.jpg?httpAccept=%2A%2F%2A",
            "@multimediatype": "JPEG image file",
            "@type": "IMAGE-HIGH-RES",
            "@size": "439628",
            "@ref": "gr5",
            "@mimetype": "image/jpeg"
          },
          {
            "@category": "high",
            "@height": "4189",
            "@width": "2994",
            "@_fa": "true",
            "$": "https://api.elsevier.com/content/object/eid/1-s2.0-S0926860X23001084-gr4_lrg.jpg?httpAccept=%2A%2F%2A",
            "@multimediatype": "JPEG image file",
            "@type": "IMAGE-HIGH-RES",
            "@size": "580986",
            "@ref": "gr4",
            "@mimetype": "image/jpeg"
          },
          {
            "@category": "high",
            "@height": "3928",
            "@width": "2994",
            "@_fa": "true",
            "$": "https://api.elsevier.com/content/object/eid/1-s2.0-S0926860X23001084-gr3_lrg.jpg?httpAccept=%2A%2F%2A",
            "@multimediatype": "JPEG image file",
            "@type": "IMAGE-HIGH-RES",
            "@size": "459327",
            "@ref": "gr3",
            "@mimetype": "image/jpeg"
          },
          {
            "@category": "standard",
            "@_fa": "true",
            "$": "https://api.elsevier.com/content/object/eid/1-s2.0-S0926860X23001084-mmc1.docx?httpAccept=%2A%2F%2A",
            "@multimediatype": "Microsoft Word file",
            "@type": "APPLICATION",
            "@size": "3381308",
            "@ref": "mmc1",
            "@mimetype": "application/word"
          },
          {
            "@category": "thumbnail",
            "@_fa": "true",
            "$": "https://api.elsevier.com/content/object/eid/1-s2.0-S0926860X23001084-si0001.svg?httpAccept=%2A%2F%2A",
            "@multimediatype": "Scalable Vector Graphics file",
            "@type": "ALTIMG",
            "@size": "2021",
            "@ref": "si0001",
            "@mimetype": "image/svg+xml"
          },
          {
            "@category": "thumbnail",
            "@_fa": "true",
            "$": "https://api.elsevier.com/content/object/eid/1-s2.0-S0926860X23001084-si0002.svg?httpAccept=%2A%2F%2A",
            "@multimediatype": "Scalable Vector Graphics file",
            "@type": "ALTIMG",
            "@size": "3760",
            "@ref": "si0002",
            "@mimetype": "image/svg+xml"
          },
          {
            "@category": "standard",
            "@_fa": "true",
            "$": "https://api.elsevier.com/content/object/eid/1-s2.0-S0926860X23001084-am.pdf?httpAccept=%2A%2F%2A",
            "@multimediatype": "Acrobat PDF file",
            "@type": "AAM-PDF",
            "@size": "2771593",
            "@ref": "am",
            "@mimetype": "application/pdf"
          }
        ]
      },
      "link": {
        "@rel": "abstract",
        "@href": "https://api.elsevier.com/content/abstract/scopus_id/85149779684"
      }
    }
  }
}