{
  "metadata": {
    "title": "A highly efficient bi-functional zeolite catalyst for low temperature catalytic cracking of <ce:italic>n</ce:italic>-octane to produce propylene: Joint contribution of nanogold and dealumination",
    "authors": "; ; ",
    "journal": "Applied Catalysis A: General",
    "date": "2022-09-25",
    "doi": "10.1016/j.apcata.2022.118862",
    "abstract": "",
    "uri": "https://api.elsevier.com/content/article/pii/S0926860X22003854",
    "pii": "S0926860X22003854"
  },
  "fulltext": {
    "full-text-retrieval-response": {
      "scopus-eid": "2-s2.0-85138184448",
      "originalText": "serial JL 271346 291210 291744 291809 31 Applied Catalysis A: General APPLIEDCATALYSISAGENERAL 2022-09-12 2022-09-12 2022-09-19 2022-09-19 2022-10-07T08:52:29 1-s2.0-S0926860X22003854 S0926-860X(22)00385-4 S0926860X22003854 10.1016/j.apcata.2022.118862 S300 S300.1 FULL-TEXT 1-s2.0-S0926860X22X00173 2024-01-01T12:34:28.416125Z 0 0 20220925 2022 2022-09-12T11:30:04.952968Z absattachment articleinfo articlenumber articletitlenorm authfirstinitialnorm authfirstsurnamenorm cid cids contenttype copyright crossmark dateloaded dateloadedtxt datesearch datesort dateupdated dco docsubtype doctype doi eid ewtransactionid hubeid indexeddate issn issnnorm itemstage itemtransactionid itemweight openaccess openarchive pg pgfirst pii piinorm pubdatestart pubdatetxt pubyr sortorder srctitle srctitlenorm srctype ssids alllist content subj subheadings suppl tomb volfirst volissue volumelist webpdf webpdfpagecount yearnav figure table e-component body mmlmath acknowledge affil appendices articletitle auth authfirstini authfull authkeywords authlast footnotes grantnumber grantsponsor grantsponsorid highlightsabst primabst ref specialabst 0926-860X 0926860X true 646 646 C Volume 646 10 118862 118862 118862 20220925 25 September 2022 2022-09-25 2022 article fla © 2022 Elsevier B.V. All rights reserved. AHIGHLYEFFICIENTBIFUNCTIONALZEOLITECATALYSTFORLOWTEMPERATURECATALYTICCRACKINGNOCTANEPRODUCEPROPYLENEJOINTCONTRIBUTIONNANOGOLDDEALUMINATION WU L 1 Introduction 2 Experimental 2.1 Preparation of ZSM-5 catalysts 2.1.1 Preparation of Au precursors (Au(en)2Cl3) [33,34] 2.1.2 Dealumination of ZSM-5 zeolite 2.1.3 Preparation of Au/ZSM-5-F 2.1.4 Exchange of sodium (Na+) and cobalt (Co2+) ions in ZSM-5 catalysts support 2.2 Catalyst characterization 2.3 Catalytic activity evaluation 3 Results and discussion 3.1 Physical properties of the modified catalysts 3.2 Dispersion of gold nanoparticles 3.3 Distribution of Si and Al 3.4 Acidity of the modified catalysts 3.5 Catalytic cracking 4 Discussion 5 Conclusions CRediT authorship contribution statement Acknowledgements Appendix A Supplementary material References PATTERSON 2012 147 170 J CAMPO 2020 11878 11891 P HOU 2017 572 583 X BLAY 2017 6542 6566 V HOU 2018 297 308 X RILEY 1986 322 327 M LUKYANOV 1994 87 92 D KRANNILA 1992 115 124 H FARSHI 2011 875 885 A FARSHI 2012 1285 1295 A FENG 2010 4111 4115 X LUO 2021 670 693 J YUAN 2020 5225 5229 S ISHIDA 2020 464 525 T CIRIMINNA 2016 14210 14217 R HASHMI 2006 7896 7936 A HARUTA 1987 405 408 M HUTCHINGS 1985 292 295 G QI 2019 160 169 C ZHENG 2021 188 199 Y HARUTA 1993 175 192 M HAYASHI 1998 566 575 T QI 2016 1747 1754 C ZHANG 2021 16013 16023 M AISHA 2013 1262 1266 N LIN 2014 136 145 L ZHENG 2002 9552 9558 S SAZAMA 2008 180 189 P ENGELHARDT 1983 239 243 G SCHERZER 1984 157 200 J SZOSTAK 2001 261 297 R HE 1989 189 197 Y BLOCK 1951 4722 4725 B ZHU 2006 10842 10848 H SCHALLMOSER 2014 93 102 S TANG 2010 600 602 T DIAO 2015 452 460 Z 1985 603 1994 1739 RAHIMI 2011 1 17 N ISABELLE 2019 4235 4242 B DONG 2018 15832 15840 X ZHANG 2019 18758 18768 N KAO 2006 19104 19107 H KANELLOPOULOS 2006 416 425 J GILSON 1987 91 92 J XIN 2014 204 215 H DEDECEK 2012 3231 3239 J KRAMER 1993 529 531 G KRAMER 1995 1766 1776 G QIU 2017 176 185 Y KOTREL 2000 11 20 S EMEIS 1993 347 354 C WATTANAPAPHAWONG 2020 106367 P WANG 2011 127 133 L LEE 2000 158 166 S JUNG 2004 777 781 J XIAO 2022 111621 X SMIRNIOTIS 1994 800 813 P ALTWASSER 2005 345 356 S JUNG 2005 149 157 J LIU 2019 14695 14704 Q TARIGHI 2017 2201 2207 S HU 2010 504 509 X WANG 2021 121725 J FU 2018 12222 12230 J WIELERS 1991 51 66 A CORMA 2015 520 532 A KUBO 2012 126 133 K HUNTER 2002 1346 1356 K LI 2007 11161 11171 S LIN 2014 136 145 L AISHA 2015 980 989 N CORMA 2000 21 30 A PAN 2021 9970 9985 Y XU 2020 818 828 Z WANG 2016 7484 7487 N ZHENG 2016 6662 6669 J YANG 2020 16429 16436 Z WANG 2016 210 218 C ZHENG 2016 6662 6669 J TAKETOSHI 2017 1888 1898 A SANTI 2013 1524 1530 D RAMAKER 2001 7 17 D KUBICKA 2006 4937 4946 D WUX2022X118862 WUX2022X118862XL 2024-09-19T00:00:00.000Z 2024-09-19T00:00:00.000Z http://creativecommons.org/licenses/by-nc-nd/4.0/ © 2022 Elsevier B.V. All rights reserved. 2022-09-23T02:45:01.244Z http://vtw.elsevier.com/data/voc/AddOnTypes/50.7/aggregated-refined 0 https://doi.org/10.15223/policy-017 https://doi.org/10.15223/policy-037 https://doi.org/10.15223/policy-012 https://doi.org/10.15223/policy-029 https://doi.org/10.15223/policy-004 item S0926-860X(22)00385-4 S0926860X22003854 1-s2.0-S0926860X22003854 10.1016/j.apcata.2022.118862 271346 2024-01-01T12:34:28.416125Z 2022-09-25 1-s2.0-S0926860X22003854-main.pdf https://s3-eu-west-1.amazonaws.com/prod-ucs-content-store-eu-west/content/pii:S0926860X22003854/MAIN/application/pdf/a15ff75ba5aaa071cc8238d47a8c0dc5/main.pdf main.pdf pdf true 4435932 MAIN 10 1-s2.0-S0926860X22003854-main_1.png https://s3-eu-west-1.amazonaws.com/prod-ucs-content-store-eu-west/content/pii:S0926860X22003854/PREVIEW/image/png/8c5a2d115a1812e36968a98c0eac38a9/main_1.png main_1.png png 56866 849 656 IMAGE-WEB-PDF 1 1-s2.0-S0926860X22003854-gr9.jpg https://s3-eu-west-1.amazonaws.com/prod-ucs-content-store-eu-west/content/pii:S0926860X22003854/gr9/DOWNSAMPLED/image/jpeg/83c3eab98342c13d33763bf00fbecee6/gr9.jpg gr9 gr9.jpg jpg 47197 269 602 IMAGE-DOWNSAMPLED 1-s2.0-S0926860X22003854-gr7.jpg https://s3-eu-west-1.amazonaws.com/prod-ucs-content-store-eu-west/content/pii:S0926860X22003854/gr7/DOWNSAMPLED/image/jpeg/1ebaedc8bfbdfa0d5822fcff9b916f04/gr7.jpg gr7 gr7.jpg jpg 44908 283 602 IMAGE-DOWNSAMPLED 1-s2.0-S0926860X22003854-gr8.jpg https://s3-eu-west-1.amazonaws.com/prod-ucs-content-store-eu-west/content/pii:S0926860X22003854/gr8/DOWNSAMPLED/image/jpeg/20acef33f5e71f8443ab350782bae119/gr8.jpg gr8 gr8.jpg jpg 39362 288 602 IMAGE-DOWNSAMPLED 1-s2.0-S0926860X22003854-gr5.jpg https://s3-eu-west-1.amazonaws.com/prod-ucs-content-store-eu-west/content/pii:S0926860X22003854/gr5/DOWNSAMPLED/image/jpeg/4b8175d6992a022da3b5517a0e5be898/gr5.jpg gr5 gr5.jpg jpg 43018 256 602 IMAGE-DOWNSAMPLED 1-s2.0-S0926860X22003854-gr6.jpg https://s3-eu-west-1.amazonaws.com/prod-ucs-content-store-eu-west/content/pii:S0926860X22003854/gr6/DOWNSAMPLED/image/jpeg/0a24e1668d90dfc38de8e18d82acea6d/gr6.jpg gr6 gr6.jpg jpg 37529 268 376 IMAGE-DOWNSAMPLED 1-s2.0-S0926860X22003854-gr3.jpg https://s3-eu-west-1.amazonaws.com/prod-ucs-content-store-eu-west/content/pii:S0926860X22003854/gr3/DOWNSAMPLED/image/jpeg/5735d6181bd1105d840d9e7748492a7b/gr3.jpg gr3 gr3.jpg jpg 20136 313 339 IMAGE-DOWNSAMPLED 1-s2.0-S0926860X22003854-gr4.jpg https://s3-eu-west-1.amazonaws.com/prod-ucs-content-store-eu-west/content/pii:S0926860X22003854/gr4/DOWNSAMPLED/image/jpeg/7b5d3e790dc6226a5f0abbca5a55cb41/gr4.jpg gr4 gr4.jpg jpg 34742 267 339 IMAGE-DOWNSAMPLED 1-s2.0-S0926860X22003854-gr1.jpg https://s3-eu-west-1.amazonaws.com/prod-ucs-content-store-eu-west/content/pii:S0926860X22003854/gr1/DOWNSAMPLED/image/jpeg/62e10cc416b716266463287d40fdd9c9/gr1.jpg gr1 gr1.jpg jpg 56611 283 565 IMAGE-DOWNSAMPLED 1-s2.0-S0926860X22003854-gr2.jpg https://s3-eu-west-1.amazonaws.com/prod-ucs-content-store-eu-west/content/pii:S0926860X22003854/gr2/DOWNSAMPLED/image/jpeg/1013e9d7694edce9d59c2de09e1a67a3/gr2.jpg gr2 gr2.jpg jpg 54994 355 791 IMAGE-DOWNSAMPLED 1-s2.0-S0926860X22003854-ga1.jpg https://s3-eu-west-1.amazonaws.com/prod-ucs-content-store-eu-west/content/pii:S0926860X22003854/ga1/DOWNSAMPLED/image/jpeg/44ce9c08fd51fb70bfe3b4eff5b3c25e/ga1.jpg ga1 true ga1.jpg jpg 26744 200 370 IMAGE-DOWNSAMPLED 1-s2.0-S0926860X22003854-gr9.sml https://s3-eu-west-1.amazonaws.com/prod-ucs-content-store-eu-west/content/pii:S0926860X22003854/gr9/THUMBNAIL/image/gif/ecaedb29aceaf629fe25ce90854c8917/gr9.sml gr9 gr9.sml sml 8699 98 219 IMAGE-THUMBNAIL 1-s2.0-S0926860X22003854-gr7.sml https://s3-eu-west-1.amazonaws.com/prod-ucs-content-store-eu-west/content/pii:S0926860X22003854/gr7/THUMBNAIL/image/gif/121492fb6f5f89731a7ebd854f0a3a8f/gr7.sml gr7 gr7.sml sml 8035 103 219 IMAGE-THUMBNAIL 1-s2.0-S0926860X22003854-gr8.sml https://s3-eu-west-1.amazonaws.com/prod-ucs-content-store-eu-west/content/pii:S0926860X22003854/gr8/THUMBNAIL/image/gif/86f3862b96d12906bdcacdec3980bd72/gr8.sml gr8 gr8.sml sml 7180 105 219 IMAGE-THUMBNAIL 1-s2.0-S0926860X22003854-gr5.sml https://s3-eu-west-1.amazonaws.com/prod-ucs-content-store-eu-west/content/pii:S0926860X22003854/gr5/THUMBNAIL/image/gif/26809fff4abdbe7213d65651774d31e1/gr5.sml gr5 gr5.sml sml 7744 93 219 IMAGE-THUMBNAIL 1-s2.0-S0926860X22003854-gr6.sml https://s3-eu-west-1.amazonaws.com/prod-ucs-content-store-eu-west/content/pii:S0926860X22003854/gr6/THUMBNAIL/image/gif/2402eb88db2aeec43ec042b303dd7bf5/gr6.sml gr6 gr6.sml sml 16300 156 219 IMAGE-THUMBNAIL 1-s2.0-S0926860X22003854-gr3.sml https://s3-eu-west-1.amazonaws.com/prod-ucs-content-store-eu-west/content/pii:S0926860X22003854/gr3/THUMBNAIL/image/gif/f22476d0bb136a8a7ccd13514cb0d782/gr3.sml gr3 gr3.sml sml 5861 164 177 IMAGE-THUMBNAIL 1-s2.0-S0926860X22003854-gr4.sml https://s3-eu-west-1.amazonaws.com/prod-ucs-content-store-eu-west/content/pii:S0926860X22003854/gr4/THUMBNAIL/image/gif/ccc76692c79de237d26b729cf2dea96c/gr4.sml gr4 gr4.sml sml 13590 164 208 IMAGE-THUMBNAIL 1-s2.0-S0926860X22003854-gr1.sml https://s3-eu-west-1.amazonaws.com/prod-ucs-content-store-eu-west/content/pii:S0926860X22003854/gr1/THUMBNAIL/image/gif/e24c36f98ebcba86a3136c3560773f2c/gr1.sml gr1 gr1.sml sml 10935 110 219 IMAGE-THUMBNAIL 1-s2.0-S0926860X22003854-gr2.sml https://s3-eu-west-1.amazonaws.com/prod-ucs-content-store-eu-west/content/pii:S0926860X22003854/gr2/THUMBNAIL/image/gif/4d1ee5e726a3bb0c79ef911b356c2c7c/gr2.sml gr2 gr2.sml sml 9726 98 219 IMAGE-THUMBNAIL 1-s2.0-S0926860X22003854-ga1.sml https://s3-eu-west-1.amazonaws.com/prod-ucs-content-store-eu-west/content/pii:S0926860X22003854/ga1/THUMBNAIL/image/gif/16f5daadf424530247e8ce604960816c/ga1.sml ga1 true ga1.sml sml 10540 118 219 IMAGE-THUMBNAIL 1-s2.0-S0926860X22003854-gr9_lrg.jpg https://s3-eu-west-1.amazonaws.com/prod-ucs-content-store-eu-west/content/pii:S0926860X22003854/HIGHRES/image/jpeg/b89e1208e4ac6d496f2f71cba008a1e8/gr9_lrg.jpg gr9 gr9_lrg.jpg jpg 211120 1188 2661 IMAGE-HIGH-RES 1-s2.0-S0926860X22003854-gr7_lrg.jpg https://s3-eu-west-1.amazonaws.com/prod-ucs-content-store-eu-west/content/pii:S0926860X22003854/HIGHRES/image/jpeg/aac92018d9e502c7cfc7a90fb8ae47d2/gr7_lrg.jpg gr7 gr7_lrg.jpg jpg 196852 1250 2661 IMAGE-HIGH-RES 1-s2.0-S0926860X22003854-gr8_lrg.jpg https://s3-eu-west-1.amazonaws.com/prod-ucs-content-store-eu-west/content/pii:S0926860X22003854/HIGHRES/image/jpeg/b9c1d28317dd4d6f6822ab7acb23c023/gr8_lrg.jpg gr8 gr8_lrg.jpg jpg 184038 1272 2661 IMAGE-HIGH-RES 1-s2.0-S0926860X22003854-gr5_lrg.jpg https://s3-eu-west-1.amazonaws.com/prod-ucs-content-store-eu-west/content/pii:S0926860X22003854/HIGHRES/image/jpeg/990ab005ee5e954b0975eb0892181f5b/gr5_lrg.jpg gr5 gr5_lrg.jpg jpg 203581 1132 2661 IMAGE-HIGH-RES 1-s2.0-S0926860X22003854-gr6_lrg.jpg https://s3-eu-west-1.amazonaws.com/prod-ucs-content-store-eu-west/content/pii:S0926860X22003854/HIGHRES/image/jpeg/4200f0f65a0ff62bdf3b0be46eca374c/gr6_lrg.jpg gr6 gr6_lrg.jpg jpg 219925 1184 1663 IMAGE-HIGH-RES 1-s2.0-S0926860X22003854-gr3_lrg.jpg https://s3-eu-west-1.amazonaws.com/prod-ucs-content-store-eu-west/content/pii:S0926860X22003854/HIGHRES/image/jpeg/ccdfae45ab3a09aa25355bc3fb6fb487/gr3_lrg.jpg gr3 gr3_lrg.jpg jpg 93554 1384 1497 IMAGE-HIGH-RES 1-s2.0-S0926860X22003854-gr4_lrg.jpg https://s3-eu-west-1.amazonaws.com/prod-ucs-content-store-eu-west/content/pii:S0926860X22003854/HIGHRES/image/jpeg/a72723afaa934558621dff462cc1253f/gr4_lrg.jpg gr4 gr4_lrg.jpg jpg 214888 1180 1497 IMAGE-HIGH-RES 1-s2.0-S0926860X22003854-gr1_lrg.jpg https://s3-eu-west-1.amazonaws.com/prod-ucs-content-store-eu-west/content/pii:S0926860X22003854/HIGHRES/image/jpeg/2bc31ed6a0209b000b92584b7558dd23/gr1_lrg.jpg gr1 gr1_lrg.jpg jpg 289771 1251 2495 IMAGE-HIGH-RES 1-s2.0-S0926860X22003854-gr2_lrg.jpg https://s3-eu-west-1.amazonaws.com/prod-ucs-content-store-eu-west/content/pii:S0926860X22003854/HIGHRES/image/jpeg/685cf09658970c177ff63ee21ddaa9bc/gr2_lrg.jpg gr2 gr2_lrg.jpg jpg 307947 1568 3493 IMAGE-HIGH-RES 1-s2.0-S0926860X22003854-ga1_lrg.jpg https://s3-eu-west-1.amazonaws.com/prod-ucs-content-store-eu-west/content/pii:S0926860X22003854/HIGHRES/image/jpeg/2ef2ffbd9bfa8267111ec241a00a5b09/ga1_lrg.jpg ga1 true ga1_lrg.jpg jpg 180433 886 1641 IMAGE-HIGH-RES 1-s2.0-S0926860X22003854-mmc1.docx https://s3-eu-west-1.amazonaws.com/prod-ucs-content-store-eu-west/content/pii:S0926860X22003854/mmc1/MAIN/application/vnd.openxmlformats-officedocument.wordprocessingml.document/0ac421bee6a921a0e3cc97d1a599dcda/mmc1.docx mmc1 mmc1.docx docx 1186798 APPLICATION 1-s2.0-S0926860X22003854-si0001.svg https://s3-eu-west-1.amazonaws.com/prod-ucs-content-store-eu-west/content/pii:S0926860X22003854/image/svg+xml/a4c3fedfc41f728f6fe721d21a7f9d97/si0001.svg si0001 si0001.svg svg 4445 ALTIMG 1-s2.0-S0926860X22003854-si0002.svg https://s3-eu-west-1.amazonaws.com/prod-ucs-content-store-eu-west/content/pii:S0926860X22003854/image/svg+xml/ba52cdec0e3cd6d26f9f7312ebbcd0fe/si0002.svg si0002 si0002.svg svg 5600 ALTIMG 1-s2.0-S0926860X22003854-am.pdf https://s3-eu-west-1.amazonaws.com/prod-ucs-content-store-eu-west/content/egi:10CDZNLS2HL/MAIN/application/pdf/df99f6f3a0a4f675eb30f5026b0719c0/am.pdf am am.pdf pdf false 1485770 AAM-PDF APCATA 118862 118862 S0926-860X(22)00385-4 10.1016/j.apcata.2022.118862 Elsevier B.V. Fig. 1 XRD patterns of ZSM-5 before and after treatment,(a) the characteristic peaks of ZSM-5, (b) the characteristic peaks of Au. Fig. 1 Fig. 2 TEM image (a) and the elemental maps (b) of Si, Al, and Au for 0.3% Au/ZSM-5-F catalyst. Fig. 2 Fig. 3 27Al MAS NMR spectrum of the ZSM-5 catalysts. Fig. 3 Fig. 4 NH3-TPD curves of the ZSM-5 samples before and after treatment. Fig. 4 Fig. 5 n-octane conversion and propylene selectivity of the ZSM-5 catalysts at different temperatures. Fig. 5 Fig. 6 n -octane conversion and propylene yield with time on line at 360 °C over the studied catalysts. Fig. 6 Fig. 7 UV-Vis spectrum of Au/ZSM-5-F sample (a): before calcination at 500 °C in air; (b): after calcination. Fig. 7 Fig. 8 The catalytic cracking results of n-octane over the parent ZSM-5, 0.3%Au/ZSM-5, S-1, 0.3%Au/S-1. Fig. 8 Fig. 9 (a) Au LIII-edge X-ray absorption near-edge structure (XANES) spectra and (b) Au LIII-edge extended X-ray absorption fine structure (EXAFS) fit. Fig. 9 Table 1 Physical properties of the post-treated catalysts. Table 1 Sample SBET a m2‧g−1 Smicro b m2‧g−1 Smeso b m2‧g−1 Vtotal c cm3‧g−1 Vmicro b cm3‧g−1 Aucont‧ d % ZSM-5 309 259 49.9 0.186 0.147 – ZSM-5-F 314 264 49.7 0.185 0.143 – 0.1%Au/ZSM-5-F 304 250 53.7 0.187 0.141 0.088 0.2%Au/ZSM-5-F 312 231 81.5 0.178 0.126 0.144 0.3%Au/ZSM-5-F 300 220 80.5 0.180 0.126 0.235 0.4%Au/ZSM-5-F 306 223 82.5 0.179 0.126 0.355 0.5%Au/ZSM-5-F 307 232 75.0 0.171 0.124 0.486 a Calculated by the BET method; b Calculated by the t-plot method; c Calculation of the total pore volume at P/Po= 0.9946 d The actual Au loading measured by ICP-OES analysis. Table 2 Chemical composition of ZSM-5 catalysts. Table 2 Sample Si/Al ratio Total Al a mmol/g “Single” Al “Close” Al bulk Si/Al a Si/AlFr b mmol/g % mmol/g % ZSM-5 24.0 18.7 0.417 0.333 79.9 0.084 20.1 ZSM-5-F 23.9 20.7 0.396 0.386 97.5 0.010 2.50 0.3%Au/ZSM-5-F 22.4 21.6 0.394 0.384 97.5 0.010 2.50 a Detected by ICP-OES; b Obtained by the analysis of 29Si MAS NMR; Table 3 Distribution of Brønsted and Lewis acids before and after catalyst treatment. Table 3 Catalysis Amount (μmol·g−1) and distribution of acid sites Total acid (160 °C) Strong acidity (350 °C) L+B L B L/B L+B L B L/B ZSM-5 748 565 183 2.9 552 270 282 0.96 ZSM-5-F 801 572 229 2.5 618 194 424 0.69 0.3%Au/ZSM-5-F 745 147 598 0.24 565 72.0 493 0.15 Table 4 Catalytic cracking of n-octane at 260, 360 and 460 °C over the representative catalysts. Table 4 Catalyst T (°C) Conv.(%) Product selectivity (%) Distribution of other products (%) Carbon balance C2 = C3 = C4 = i-C4 0 n-C4 0 Aro a Benz b Tol c C8A d C9A e C10A f ZSM-5 260 75.1 2.5 33.0 22.5 19.0 12.9 2.3 0.35 0.66 0.58 0.08 0.68 > 0.97 360 92.0 2.5 45.3 19.3 16.4 8.7 2.9 0.43 1.05 0.38 0.16 0.88 > 0.98 460 98.8 13.5 54.6 13.1 9.4 4.7 3.8 0.53 1.34 0.41 0.28 1.24 > 0.98 ZSM-5-F 260 99.0 0.6 31.1 25.9 20.9 14.9 1.8 0.12 1.04 0.53 0.02 0.12 > 0.98 360 99.3 2.5 51.2 18.7 16.7 8.2 1.8 0.24 0.69 0.22 0.09 0.53 > 0.99 460 100 15.5 59.2 7.5 7.8 1.2 5.9 1.43 2.24 0.40 0.17 1.69 > 0.99 0.3%Au/ZSM-5-F 260 100 1.2 45.2 20.3 25.4 7.0 0 — — — — — > 0.99 360 100 3.1 58.9 13.4 15.2 4.3 5.0 1.41 1.69 0.26 0.14 1.51 > 0.99 460 100 16.9 63.5 6.9 6.5 1.1 5.0 0.80 1.25 0.41 0.22 2.33 > 0.99 a Total selectivity of aromatic compounds. b Benzene. c Toluene. d Aromatic compounds containing eight carbon atoms. e Aromatic compounds containing nine carbon atoms. f Aromatic compounds containing ten carbon atoms. A highly efficient bi-functional zeolite catalyst for low temperature catalytic cracking of n-octane to produce propylene: Joint contribution of nanogold and dealumination Lei Wu Conceptualization Methodology Software Validation Investigation Writing – original draft a Caixia Qi Conceptualization Validation Resources Writing – review & editing Funding acquisition a ⁎ 1 Xun Sun Formal analysis a Huijuan Su Data curation Supervision a Libo Sun Formal analysis: Data curation a Lijun Zhao Supervision a Fengshou Xiao b a Yantai Key Laboratory of Gold Catalysis and Engineering, Shandong Applied Research Center of Nanogold Technology (Au-SDARC), School of Chemistry & Chemical Engineering, Yantai University, Yantai 264005, China Yantai Key Laboratory of Gold Catalysis and Engineering, Shandong Applied Research Center of Nanogold Technology (Au-SDARC), School of Chemistry & Chemical Engineering, Yantai University Yantai 264005 China Yantai Key Laboratory of Gold Catalysis and Engineering, Shandong Applied Research Center of Nanogold Technology (Au-SDARC), School of Chemistry & Chemical Engineering, Yantai University, Yantai 264005, China b Department of Chemistry, Zhejiang University, Hangzhou 310028, China Department of Chemistry, Zhejiang University Hangzhou 310028 China Department of Chemistry, Zhejiang University, Hangzhou 310028, PR China ⁎ Corresponding author. 1 Homepage: http://www.qicxlab.com With respect to catalysis, the pursuit of low reaction temperatures has received continuous efforts for developing energy efficient and environmentally friendly processes. In this study, the significant promotion in the catalytic cracking performance of n-octane at low temperatures of 260–460 °C over Au/ZSM-5 catalysts was obtained via the joint contribution of dealumination and Au species. A 63.5% propylene selectivity and 100% n-octane conversion were obtained over the optimized catalyst at 410 °C. The higher propylene yield was attributed to an increase in the concentration of Brønsted acids and a decrease in that of Lewis acids, as well as synergy between acid sites and Au species. The positive effect of Au species during dehydrogenation at lower temperatures was verified, and electron transfer from Au to the zeolite framework was proposed. Graphical Abstract The significant promotion in the catalytic cracking performance of n-octane at 260 ∼ 460 °C over Au/ZSM-5 catalysts was obtained via joint contribution of dealumination and Au species, resulting a highest PO yield reported so far, i.e., 100% n-octane conversion and 62.6% of propylene selectivity of over the optimized catalyst at 410 °C. Moreover, the modified catalyst exhibited similar performance to the parent ZSM-5 at temperature lower than 150 °C, showing vast benefit for energy saving and environment friendly in petroleum industry process. ga1 Keywords Au/ZSM-5 Dealumination Catalytic cracking Propylene N-Octane Data Availability Data will be made available on request. 1 Introduction At present, the total consumption of fossil energy such as oil, natural gas, and coal accounts for more than 80% of primary energy. Crude oil still accounts for the highest proportion of primary energy. Petrochemical processes consume large amounts of energy and are the main source of greenhouse gas emissions [1]. Fluid catalytic cracking (FCC) is one of the most important carbon emission sources in traditional oil refineries. With the continuous promotion of global electrification and \"carbon neutrality\" policies, the transformation of energy structure and improvements in energy efficiency will be the only way to achieve carbon neutrality. Optimizing systems, processes, and equipment, saving energy, and improving energy efficiency are the primary ways for reducing carbon emissions. As an important raw material for organic synthesis, the global demand for propylene continues to grow. Fluid catalytic cracking (FCC) plays a more important role in propylene production than steam cracking due to the higher ratio of propylene to ethane and lower energy consumption [2–8]. As a catalyst or additive in the FCC process, modified ZSM-5 that is currently available has been used for propylene production, but the working temperatures are quite high (> 510 °C). However, a lower temperature limits the production of propylene [9–11]. Many research teams have used different reaction systems to demonstrate the advantages of Au catalysts, which show excellent low-temperature catalytic activity and high product selectivity [12–18] including our own work [19,20]. Prof. Haruta oxidized CO over TiO2, α-Fe2O3, and Co3O4 at temperatures as low as − 70 °C [21] and performed the epoxidation of propylene over Au/TiO2 with a propylene oxide selectivity greater than 90% [22]. We have previously reported that the catalytic cracking of light diesel oil can work well at a lower temperature of 460 °C with improved feed conversion, micro-reactivity, and propylene selectivity by introducing small amounts of Au nanoparticles into ZSM-5 [23]. We found that Au0 rather than Auδ+ promoted the production of propylene and the catalytic cracking activity [24]. Guo et al. [25] also reported that a series of aluminosilicate molecular sieve-supported gold catalysts exhibited high activity at a low reaction temperature for the aromatization, isomerization, alkylation, and catalytic cracking of low-carbon alkanes (C3 −C9). This further supports the potential application of gold nanoparticles in the field of petroleum chemistry, but the intrinsic role of gold nanoparticles is not clear in this typical acid-driven reaction. In the FCC process, alkane cracking is one of the main reactions. The cracking of light hydrocarbons on acidic zeolites mainly follows an acid-catalyzed process involving carbonium ions [26,27]. Sazama et al. [28] investigated the effect of the spatial distance between the acidic centers (Al) of ZSM-5 on the cleavage of 1-butene and found that “single” Al atoms of ZSM-5 contributed to the cleavage of olefins. “Close” Al atoms contributed to oligomerization and hydrogen transfer, which mainly produced aromatic compounds; thus, modulating the microscopic acidity of zeolite is important for catalytic cracking reactions. To transition from “close” Al to “single” Al atoms in ZSM-5 zeolite, a certain degree of dealumination of the zeolite is required. Different dealumination methods and conditions will have different effects on the properties and functions of a particular zeolite. After decades of research and exploration by scientists, zeolite dealumination routes can be broadly divided into (a) thermal treatment and hydrothermal treatment methods at high temperatures [29,30] or (b) chemical dealumination methods [31,32]. The latter include reactions between acids, bases, salts, and zeolite and reactions between inorganic coordination ions (F-), chelating agents (EDTA, ACAC, etc.), and aluminum. Each of these routes has its own advantages and disadvantages. (NH4)2SiF6 was used to dealuminate ZSM-5 zeolite via the hydrolysis of (NH4)2SiF6 as follows [32]: (1) (NH4)2SiF6 → 2NH4 + + SiF6 2- (2) SiF6 2- + 4 H2O → Si(OH)4 + 6 F- + 4 H+ During the reaction, (NH4)2SiF6 is first hydrolyzed to Si(OH)4, and the dissociated F- interacts with the framework Al to produce AlF6 3-. Then, Si(OH)4 is inserted into the Al cavity, thus completing the dealumination and silicon replenishment. Pursuing low reaction temperatures deserves continuous efforts in regard to catalysis for energy efficiency and environmental friendly. The main objective of this work is to further improve the propylene production in the Au/ZSM-5 catalyst system at a low reaction temperature via the cooperation of nanogold and dealumination. Secondly, we attempt to determine the individual role of nanogold and the possible synergetic effects between the nanogold and acidic sites on ZSM-5. The cracking of n-octane was applied as a test feed. The performance of the optimized catalyst at 260 °C and 310 °C was similar to that of the parent ZSM-5 at 410 °C and 460 °C, respectively. Furthermore, at 410 °C, the optimized catalyst achieved 100% n-octane conversion and 63.5% propylene selectivity, which is the highest propylene yield reported so far. 2 Experimental 2.1 Preparation of ZSM-5 catalysts In this work, all chemicals were obtained from commercial suppliers (Sinopharm Chemical Reagent Co., Ltd. and Xiya Reagent) and used without further purification. 2.1.1 Preparation of Au precursors (Au(en)2Cl3) [33,34] Ethylenediamine (0.09 mL) solution was added to 2 mL of 0.1 g/mL HAuCl4 solution dropwise under magnetic stirring and then stirred for 30 min. Then, 14 mL of anhydrous ethanol was added dropwise and stirred for another 30 min. The obtained suspension was separated by centrifugation and washed twice with anhydrous ethanol. Au(en)2Cl3 powder was then obtained by vacuum drying at 40 °C for 12 h. 2.1.2 Dealumination of ZSM-5 zeolite ZSM-5 zeolite (SiO2/Al2O3 = 37.3, Tianjin Shenneng Technology Co., Ltd.) was roasted in the air at 550 °C for 4 h to remove the template agent before use. The dealumination of ZSM-5 zeolite was processed as follows: The above-obtained ZSM-5 zeolite (10 g) was placed in 200 mL of deionized water. Then, a certain amount of ammonium hexafluorosilicate solution was added with a ratio of n AHFS: n Al = 1: 1 at 80 °C, followed by stirring for 2 h. The mixture was then cooled to room temperature and washed by centrifugation three times. The resultant solid was dried overnight at 80 °C and finally calcined for 4 h at 550 °C to obtain the dealuminated ZSM-5, namely ZSM-5-F. 2.1.3 Preparation of Au/ZSM-5-F Gold was deposited on ZSM-5-F by an isovolumetric impregnation method. The Au/ZSM-5-F catalysts with different Au loadings were obtained after impregnating the ZSM-F support in a solution of Au(en)2Cl3 for 24 h. The resultant solid was filtered and washed with deionized water, dried at 80 °C for 12 h, and then calcined at 550 °C for 4 h. 2.1.4 Exchange of sodium (Na+) and cobalt (Co2+) ions in ZSM-5 catalysts support (1) ZSM-5 (2 g) was dispersed in 200 mL of aqueous NaCl (0.5 mol/L), stirred at 80 °C for 8 h, then washed and dried. The exchange process was repeated three times to obtain Na-ZSM-5. (2) Na-ZSM-5 (1 g) was dispersed in 100 mL of aqueous cobalt nitrate solution (0.05 mol/L). Ion exchange was performed at room temperature for 8 h, then washed, and dried. The procedure was repeated three times to obtain Co-ZSM-5. The specific contents of “Close” Al and “Single” Al atoms in a ZSM-5 sample were calculated by the following equations [35]: (3) [“Single” Al] = [Altotal] − 2 [Comax] (4) [“Close” Al] = 2 [Comax] 2.2 Catalyst characterization The crystallographic analysis of the catalysts was carried out using a Shimadzu XRD-6100 powder X-ray diffractometer with a Cu Kα monochromatic radiation source (λ = 0.154 nm) at a scanning speed of 6°/min at 40 kV and 100 mA. The specific surface areas and pore size distributions of the catalysts were obtained using a Mack 3Flex adsorption analyzer (USA) under a vacuum pressure of 20 mTorr at an operating temperature of − 196 °C. The catalysts were vacuum-degassed at a pretreatment temperature of 200 °C for 8 h prior to testing. Surface area, microporous area, and micropore volume were calculated by the Brunauer-Emmett-Teller (BET) equation and the t-plot method, respectively. The pore size distribution was obtained by nonlocal density functional theory (NLDFT). Inductively coupled plasma-optical emission spectroscopy (ICP-OES; Agilent 5110) was used to determine the elemental content of the catalysts. Before ICP analysis, the catalysts were added to a mixture of hydrofluoric acid at 80 °C for digestion. The digested solution was then volumetrically determined using a volumetric flask. The distribution of Au nanoparticles in the catalysts was observed on a JEOL TEM-2100 transmission electron microscope (TEM) with an accelerating voltage of 200 kV. X-ray energy-dispersive spectroscopy (EDS) was also carried out to obtain the element mappings of Au, Si, and Al in the Au/ZSM-5-F catalyst. The Au LIII-edge X-ray absorption fine structure (XAFS) spectra were measured at BL14B2, SPring-8 (Hyogo,Japan). NH3-TPD measurements were carried out on a TP-5080 multi-functional adsorption instrument. The catalysts were pretreated at 500 °C for 2 h under a helium stream and then cooled to room temperature. Ammonia was then introduced to the catalyst chamber for 0.5 h and purged with helium for another 0.5 h. Finally, desorbed ammonia was detected by a thermal conductivity detector (TCD) when the temperature was raised from room temperature to 700 °C under helium. Pyridine adsorption-infrared (Py-IR) spectra of the catalysts were measured on a Fourier-transform infrared spectrometer (Thermo Fisher Scientific Inc., Nicolet 6700, USA) with a spectral resolution of 4 cm−1 with 32 scans. The catalysts were first purified at 500 °C for 30 min under a high vacuum of 10−5 Pa and then pyridine was adsorbed at room temperature. Finally, the residual adsorbed pyridine was recorded after vacuum desorption at 160, 250, and 350 °C, respectively. Quartz-spring gravimetric adsorption-infrared spectroscopy was adopted to quantitatively determine the concentration of the Brønsted and Lewis acid sites of the catalysts [36,37]. The specific method involved selecting a representative group of Y zeolite samples that contained the basic elements of Si and Al and obtaining their pyridine adsorption-infrared spectra. The absorbance A B and A L of each sample were determined from the characteristic peaks of Brønsted acids and Lewis acids of the sample by using the equation A i = lg(I/I o), where I o and I are the transmittance of the baseline and peak summit of the characteristic peaks, respectively. The total acidity (C) of the samples was determined by the weight of chemically-adsorbed pyridine, as measured by a quartz spring. According to Beale's law of A = KCL, where A is absorbance; K is the absorption coefficient; L is sample the thickness. The absorption coefficients K B of Brønsted acids and K L of Lewis acids in the zeolite samples were obtained by solving multiple sets of standard simultaneous equations based on the non-standard sample quantitative method and the least-squares method. The calculated values of K B and K L are 34.29 and 71.32, respectively, and the ratio of K L/K B is 2.08. Then, the amounts of Brønsted and Lewis acids on a studied catalyst surface were calculated by using K B and K L via the following formulas: (5) C B = KB/KL·AB·C / (KB/KL·AB+AL) (6) C L = AL·C / (KB/KL·AB+AL) where C B and C L are the concentrations of Brønsted acid sites and Lewis acid sites (mmol·g−1), respectively. The 29Si and 27Al MAS NMR spectra were used to determine the Si and Al arrangements and to differentiate Al in different chemical environments in the studied zeolite-based Au catalysts. 29Si and 27Al MAS NMR characterization were performed on a Bruker 400 M solid-state NMR spectrometer with a MAS spin rate of 10 kHz and recovery time of 4 s. A pulsed program was used for acquisition with a pre-scan delay of 6.5 μs and a rotor of 4 mm. 2.3 Catalytic activity evaluation Catalytic tests were carried out in a small confined fluidized bed reactor at 260–460 °C using 3 g catalyst and 0.94 g feed. The contact time was 70 s. The products were separated through an ice-water bath and analyzed by an on‐line gas chromatogram GC‐920X with a flame ionization detector equipped with an OV‐101 capillary column. The area normalization method was applied to collect the data. The conversion of n-octane and the selectivity of target products were calculated using equations (7) and (8): (7) Conversion = 1 − mol of unreacted n − octane mol of reactant n − octane (8) Selectivity = mol of carbon atom in target product mol of carbon atom in all reactants 3 Results and discussion 3.1 Physical properties of the modified catalysts To investigate the effect of different modification conditions on the textural structure of ZSM-5, all catalysts were characterized by XRD. As shown in Fig. 1a, all catalysts showed characteristic diffraction peaks of ZSM-5 with a typical MFI framework structure at 7.9, 8.8, 23.1, 23.9, and 24.3°, corresponding to the (101), (020), (501), (151), and (303) crystal planes (JCPDS no.: 49–0657) [38], respectively. The peak intensities of the catalysts with Au decreased gradually upon increasing the Au loading, indicating a lower ZSM-5 crystallinity during metal impregnation. The characteristic peaks corresponding to the Au (111) and (200) crystal planes at 2θ = 38.2 and 44.4° were detected, and their intensity increased steadily upon increasing the Au loading, as shown in Fig. 1b, implying the presence of larger Au nanoparticles. Fig. S1 shows the N2 adsorption-desorption isotherms (a) and pore size distribution curves (b) of the ZSM-5-based catalysts. Based on the modern IUPAC classiﬁcation of adsorption isotherms [39,40], all catalysts displayed type I adsorption isotherms with H4 hysteresis loops. These are indicative of microporous materials with some narrow slit-like pores and mesopores as reported in previously published works [41–44]. The corresponding NLDFT pore size distributions confirmed that the majority of these pores were approximately 0.5–0.6 nm plus some mesopores larger than 2 nm, as shown in Fig. S1b. The micropore size of ZSM-5 became narrower after dealumination and Au addition. The 0.3%Au/ZSM-5-F catalyst presented a high and narrow peak near 0.55 nm, indicating more regular pore channels than the other catalysts. The specific pore structure parameters of the ZSM-5-based catalysts are listed in Table 1, together with the actual Au loadings of Au-containing catalysts. ZSM-5-F maintained its original pore structure parameters but with a smaller volume of micropores. Si species most likely filled the cavities that were created by the removal of Al from the ZSM-5 framework due to AHFS hydrolysis. Furthermore, the surface area and volume of the micropores of the catalysts were reduced further with a relative increase in the mesoporous area after Au loading. This suggests that some of the small Au nanoparticles entered the micropores. The formation of some additional mesopores due to Au addition could be a result of the basic environment of the catalysts’ preparation process. 3.2 Dispersion of gold nanoparticles TEM and the corresponding EDX spectroscopy were employed to further study the structural properties of Au metal particles in the Au-ZSM-5-F catalyst. Fig. 2a shows a TEM image of 0.3% Au/ZSM-5-F, in which the Au nanoparticles were unevenly distributed in size, ranging from a few nanometers to nearly 200 nm. This agrees with the XRD patterns. The shape of the Au nanoparticles varied from elliptical to irregular, with multiple nanoparticles connected. The contact pattern with ZSM-5 also varied, and some were simply deposited on the surface, while others were interspersed in the gaps or embedded in the carrier. In addition to larger Au nanoparticles, the EDX mapping analysis of Si, Al, and Au for the 0.3% Au/ZSM-5-F catalyst is shown in Fig. 2. These small Au nanoparticles that filled the pores of ZSM-5-F were likely the main reason for the reduction in the micropore size of the parent catalyst, as observed in the N2 adsorption-desorption isotherms in Fig. S1. 3.3 Distribution of Si and Al Solid-state high-resolution MAS NMR provides a powerful tool to probe the zeolite framework to obtain important information about its elemental components and arrangements. 27Al MAS NMR is sensitive to differently-coordinated Al species and is therefore commonly used to monitor the extraction of Al from a framework. This process involves a transition from tetra-coordinated framework Al (50–65 ppm) to sixfold-coordinated extra-framework Al (∼ 0 ppm), through fivefold coordinated partially detached Al (∼ 38 ppm) [45,46]. Fig. 3 shows the 27Al MAS NMR spectra of the ZSM-5 catalysts before and after modification. All catalysts showed characteristic peaks of hexa-coordinated extra-framework Al and tetra-coordinated framework Al at the corresponding positions. The characteristic peak of the tetra-coordinated framework Al of ZSM-5-F at 54 ppm was slightly weaker than that of ZSM-5 due to the removal of some framework Al atoms from the zeolite by AHFS. 0.3%Au/ZSM-5-F showed considerable horizontal broadening in the spectral line of the tetra-coordinated framework Al. This indicated the presence of Al species in an asymmetric environment due to the incorporation of Au and the existence of the five-coordinated extraframework aluminum species at 38 ppm [46,47]. The 27Al MAS NMR linewidth was determined by the nuclear quadrupole coupling constant and the asymmetry factor. Since the 27Al peak width is very sensitive to the symmetry of the 27Al nucleus, a highly asymmetric environment may cause significant broadening of the spectral lines, preventing some 27Al signals from appearing [46]. Since the addition of Au was performed via the wet impregnation of the Au precursor followed by calcination, the broadening of the Al(IV) signal could be a result of the partial hydration of dehydrated ZSM-5-F based on two proposed models [40]. The fivefold-coordinated aluminum species could be formed after hydration by attaching three water oxygen atoms to the aluminum atom. These originated from SiOAlOH on a framework defect connecting to the framework via the SiOAl bridge or an Al2O3 molecule that was unconnected to the framework. High-Si zeolites have narrower spectral lines due to their lower Al content and much weaker Si-Al dipole effect; therefore, only Si (4Si,0Al) and smaller amounts of Si (3Si,1Al) appeared in the spectra [48]. As shown in Fig. S2, the 29Si MAS NMR spectra of the ZSM-5 catalysts before and after modification were fitted with Gaussian split peaks, which allowed their Si coordination to be classified. According to the equation of Si: AlFr = ∑ISi(nAl) / ∑ 0.25nISi(nAl), the framework Si to Al ratio (Si: AlFr) was calculated to be 18.7 for ZSM-5 zeolite, 20.7 for ZSM-5-F, and 21.6 for 0.3%Au/ZSM-5-F. These indicate that slight delamination occurred for the two modified catalysts, ZSM-5-F and 0.3%Au/ZSM-5-F. This is in agreement with the above 27Al MAS NMR analysis. When the two Al atoms in the ZSM-5 pore were sufficiently close in spatial distance, the negative charge generated by AlO4 - balanced the two positive charges carried by Co2+, allowing Co2+ to stabilize in the framework cation position [16,49]. The exchange capacity of Co2+ and equations [3] and [4] in Section 2.1.4 can therefore be used to calculate the content of “close” Al and “single” Al atoms in ZSM-5. Table 2 lists the chemical composition of all zeolite catalysts, which shows th at ZSM-5 had a “close” Al concentration of 0.084 mmol/g. The “close” Al concentration in ZSM-5-F decreased significantly after AHFS treatment, indicating obvious zeolite delamination. Furthermore, the “single” Al concentration in ZSM-5-F increased from 0.333 mmol/g to 0.386 mmol/g, consistent with the Si/AlFr data (Table 2) obtained from both ICP-OES and 29Si MAS NMR measurements. In addition, further adding trace amounts of Au had nearly no effect on the chemical composition of the zeolite. It is thus clear that the conversion of “close” Al to “single” Al can be achieved by adding a suitable AHFS without largely changing the Si: AlFr ratio. 3.4 Acidity of the modified catalysts The aluminum atoms in different T-sites of ZSM-5 resulted in various proton energies, which corresponded to acid strength [50,51]. NH3-TPD was carried out to monitor the acid strength and the number of acid sites for the studied ZSM-5-based catalysts before and after treatment ( Fig. 4). All catalysts displayed three ammonia desorption peaks: weak acidic sites at 120 °C, medium acidic sites at 215 °C, and strong acidic sites at 440 °C. Post-treatment shifted the peak positions of the acidic sites to higher temperatures with a more pronounced shift for the strong acidic sites. A similar amount of total acid sites (0.19–0.24 mmol/g acid sites) was obtained with all zeolite samples based on the spectra, while the parent ZSM-5 had the lowest value of 0.19 mmol/g acid sites. The ZSM-5 consists of alumina tetrahedra (AlO4) and silica tetrahedra (SiO4), with most AlO4 connected to SiO4 by a bridging hydroxyl group (Si-OH-Al), which acted as a Brønsted acid site [52]. Lewis acid sites are generally formed by non-framework aluminum species generated by the dealumination of the zeolite framework or by tri-coordinated unsaturated aluminum species on the framework [53]. Pyridine adsorption infrared spectroscopy can distinguish between Brønsted and Lewis acids of zeolite catalysts and is generally used to quantitatively determine the solid acid content. The determination of the acid content on solid surfaces by infrared spectroscopy is based on the absorbance per unit weight of a sample or the characteristic peak areas of Brønsted acidic sites at 1440 cm−1 and Lewis acidic sites near 1540 cm−1 per unit weight of a sample [54]. In this work, the combination of quartz-spring gravimetric adsorption and infrared spectroscopy, instead of infrared spectroscopy alone, was adopted to more precisely determine the concentration of the Brønsted and Lewis acid sites of the catalysts [36,37]. Fig. S3 exhibits the Py-IR spectra of the catalysts at degassing temperatures of 160 and 350 °C. The spectra provide information about the concentration distribution of total acid sites and strong acid sites, respectively. Specific information about the concentrations of total acid sites and strong acid sites of the studied catalysts is presented in Table 3. In the studied samples, most acid sites were strong acids. For ZSM-5-F, the concentration of total acid sites increased upon increasing both Brønsted and Lewis acid sites compared with the parent ZSM-5. However, the concentration of strong Brønsted acid sites increased considerably with a moderate increase in the number of weak Lewis acid sites. This is in agreement with the observations of S. Schallmoser et al. in their study of the local environment of Brønsted acid sites in ZSM-5 on the catalytic activity in n-pentane cracking, in which AHFS treatment was performed [32]. Notably, after adding Au species, both strong and weak Brønsted acids enhanced significantly, whereas both strong and weak Lewis acids decreased substantially. As a result, the ratio of Lewis acid sites to Brønsted acid sites (L: B) and the ratio of strong Lewis acid sites to strong Brønsted acid sites (SL: SB) decreased sharply. These results are in agreement with the 27Al NMR analysis in Section 3.3. 3.5 Catalytic cracking Dealumination is an important process that can be used to adjust the Si: Al ratio of zeolites and gives rise to their acidity and catalytic properties. Fig. 5 shows the n-octane conversion and propylene selectivity of the ZSM-5 series catalysts at different temperatures. ZSM-5-F almost completely converted n-octane at all tested temperatures, and the improved propylene selectivity increased upon increasing the reaction temperature. The addition of trace amounts of Au clearly improved the catalytic effect, and 100% n-octane conversion and improved propylene selectivity were obtained over all Au/ZSM-5-F catalysts. 0.3%Au/ZSM-5-F exhibited the highest propylene selectivity among all catalysts, with a propylene selectivity at least 20% higher than those of ZSM-5 at all temperatures. The performance of the 0.3% Au/ZSM-5-F catalyst at 260 °C (n-octane conv.: 100%, propylene sel.: 45.2%) and 310 °C (n-octane conv.: 100%, propylene sel.: 53.2%) was similar to those of the parent ZSM-5 at 410 °C and 460 °C, respectively, which provides significant energy savings by lowering the temperature by 150 °C. This demonstrates one of the great features of Au-based catalysts, i.e., good catalytic performance under mild conditions. Furthermore, Table S1 provides a comparison of the octane cracking results with the literatures [24,55–66]. Nearly no catalyst has been tested at such low temperatures, and none of the catalysts presented 100% conversion of n-octane with a propylene selectivity greater than 60%. In addition, the recyclability test results of the studied catalysts at 360 °C are shown in Fig. 6 . The n-octane conversion and propylene yield both fluctuated within a certain range, with no significant reduction after fifteen cycles. The modified catalyst still exhibited superior catalytic performance compared with the parent ZSM-5, indicating that the studied catalysts have good stability. ( Fig. 7). 4 Discussion To further clarify the role of gold particles in producing propylene via catalytic cracking over Au-modified ZSM-5 catalysts, the product distributions of n-octane catalytic cracking over three catalysts of the parent ZSM-5, ZSM-5-F, and 0.3%Au/ZSM-5-F at 260 °C, 360 °C, and 460 °C were collected and shown in Table 4. The typical products of both monomolecular and bimolecular cracking were obtained, in agreement with previous results [53,66,67]. Products including ethylene, propylene, butene, isobutane, and n-butane were accompanied by the formation of very small amounts of aromatics, and trace amounts of methane, ethane, and propane. The data listed in Table 4 do not include the amounts of methane, ethane, or propane. One can see that propylene, the main product, increased gradually with the reaction temperature, while butene, isobutane, and n-butane gradually decreased. The selectivity of ethylene at 260 °C and 360 °C was relatively poor for the three catalysts, while a sharp increase at 460 °C occurred with an obvious decrease in C4 products. At lower reaction temperatures (≤ 360 °C), there were mainly (> 90%) two kinds of final products, i.e., C3 (C3 =) and C4 (C4 =, i-C4 0, and n-C4 0). According to the definition of the cracking mechanism ratio (CMR) as ‘‘(C1 + C2)/i-C4” that is directly proportional to the ratio of monomolecular to the bimolecular mechanism proposed by Wielers et al. [68], it can be concluded that bimolecular cracking was dominant in our studied system, especially at temperatures ≤ 360 °C. This result is in line with the conclusions of published work [68,69]. The classical bimolecular carbenium-ion chain mechanism, which involves a hydride-transfer step followed by isomerization and β-scission, is favored by low reaction temperatures. The significant increase in the formation of ethene, one of the main representative n-alkane monomolecular cracking products at 460 °C, implies that the monomolecular cracking of n-octane made a greater contribution at higher temperatures [70], in addition to the contribution of thermal cracking. Compared with the performance of the parent ZSM-5, the conversion of n-octane at 260 °C over ZSM-5-F was considerably higher, along with an obvious increase in C4 products and a negligible decrease in the propylene selectivity. This implies that the transformation of “close” Al to “single” Al promoted cleavage of the central C-C bonds of n-alkanes and was attributed to an increase in the strong Brønsted acid sites after AHFS treatment in the presence of a buffer, as observed by our Py-IR measurements (Fig. S3 and Table 3). For the Brønsted acid-catalyzed cracking of straight-chain paraffins, if initiation occurs via carbonium ions, the central C-C bonds are most attractive to the Brønsted proton [71]. When the temperature increased to 360 °C for ZSM-5-F, the propylene selectivity increased, and the n-butane selectivity decreased, with a constant selectivity to isobutane and butene compared with the parent ZSM-5 catalyst at the same reaction temperature. The secondary cracking of n-butane via classical β-scission might have occurred simultaneously. The results unequivocally show that the presence of non-framework aluminum is associated with an enhancement in the cracking activity, which might be caused by the interaction of non-framework aluminum with nearby Brønsted acid sites, which enhanced the strength of Brønsted acids [32,72]. Both non-framework Lewis acid sites and Brønsted acid sites nearby may mutually act as the active sites for the bimolecular mechanism, in agreement with the conclusion proposed by Wielers et al. [68]. After adding 0.3 wt% gold into the ZSM-F sample, very different results to those of ZSM-F were obtained. The propylene selectivity was considerably enhanced from 30.6% to 44.4% with a continued increase in the n-octane conversion from 99% to 100%. The formation of i-butane was more pronounced, accompanied by a significantly lower n-butane yield and a moderate decrease in the butene yield. The Py-IR results in Table 3 show that both strong and weak Brønsted acid sites were significantly enhanced, while there was a substantial decrease in both strong and weak Lewis acid sites after introducing Au species into the ZSM-5-F substrate. The N2 adsorption-desorption measurements showed that the pore size of ZSM-5-F became narrower (Fig. S1 and Table 1) after adding Au. The increase in Brønsted acid sites and the optimization of pore structure after loading Au were responsible for the improved Py selectivity and n-octane conversion [73]. However, thinking about the different product distributions between 0.3%Au/ZSM-5-F and ZSM-5-F, the role of Au species in the reaction is still unclear. The isomerization of n-butane on Au/ZSM-5 below 400 °C was once reported by Aisha et al., and Au+ species were considered to play an important role except for the acid sites [74]. The analysis of Au/ZSM-5-F via UV-Vis (Fig. 7), H2-TPR, and XPS (Fig. S4) indicated the reduction of Au3+ into metallic Au. Some Au+ species still existed in the final catalyst. Corma et al. found that the dehydrogenation of an alkane formed an olefin and initiated (or at least enhanced) the cracking reaction [75]. To determine if nanogold showed similar activity in dehydrogenation to other metals, such as Pt, Pd, Ag, and Fe [76–80], we carried out ethane dehydrogenation over the studied catalysts by using the feed of 1 vol% ethane in nitrogen with a velocity of 6 mL/g‧h. The results are presented in Table S2. At 260 °C, ethene was observed only over the catalyst containing Au. This result suggests that improvements in n-octane catalytic cracking after Au addition partially resulted from the dehydrogenation of gold species. Au-based catalysts have been used for ethanol [81] and benzyl alcohol dehydrogenation [82] at low temperatures. As shown in Fig. 8, a comparison was made between the inert support of silicate-1 and ZSM-5 and their supported Au catalysts in the reaction of n-octane cracking. Similar conversion and propylene selectivity were obtained over S-1 and Au/S-1. Thinking about the clear improvement in the performance after Au loaded on ZSM-5, there appears to be synergy between acid sites and Au species in the catalytic cracking reaction over bi-functional Au/ZSM-5 catalyst. As shown in Fig. 9a, the XANES spectra of Au/ZSM-5 were similar to that of the Au foil, indicating the oxidation state of most Au atoms was mainly Au0, in line with the XPS analysis in Fig. S4. The corresponding EXAFS data after Fourier transform (FT) in R-space (Fig. 9b) presented two peaks around 2.5 and 3.2 Å for Au/ZSM-5. These peaks were attributed to a single Au-Au shell, and the splitting was due to Ramsauer-Townsend resonance [83]. No features of Au-Si or Au-Al bonds were found, but the clear enhancement of Au 5d/6 s DOSs indicates electron transfer from Au to the ZSM-5 matrix. Therefore, it could be assumed that reduced Au0 and Au+ might be involved in charge transfer with neighboring framework alumina atoms, which affected the framework electronegativity of the zeolites and changed the acid strength of the Si(OH)Al group to some extent. This has been discussed in other works [84–86] concerning the nature of metal-support interactions [85] and the influence of noble metal Pt in support acidity and the strength of Brønsted acid sites due to metal-support interactions in zeolite-supported noble metal catalysts [84,86]. However, this inference needs further investigation. 5 Conclusions The microscopic acidity of ZSM-5 was modulated by AHFS to achieve the transition from “Close” Al to “Single” Al. A series of Au/ZSM-5 catalysts were prepared by dealumination and silicon supplementing of ZSM-5 with (NH4)2SiF6 (AHFS). They were further modified with Au(en)2Cl3 precursor, followed by calcination in air at 550 °C. The corresponding catalysts were investigated for their catalytic activities and stabilities during the catalytic cracking of n-octane in the temperature range of 260–460 °C. The observations and results led to the following conclusions: 1) AHFS-treated ZSM-5 converted ZSM-5 “Close” Al (n = 2) to “Single” Al (n > 2) while leaving the Si: AlFr ratio essentially unchanged even after adding gold species. 2) The ZSM-5-F catalyst prepared by this method led to a small increase in weak Lewis acid sites but enhanced the strength of Brønsted acids. It considerably promoted the conversion of n-octane, even at a low reaction temperature of 260 °C, and further increased the propylene selectivity at higher temperatures. 3) The addition of trace amounts of Au species lowered the surface area and volume of the micropores of ZSM-5-F, with 0.3%Au/ZSM-5-F being the most significant. Its pore size distribution curves showed more regular microporous channels. 4) The addition of gold species further enhanced the Brønsted acidity and reduced the Lewis acidity. 5) The addition of gold species broadened the 27Al NMR peaks, indicating the formation of a more distorted tetrahedral Al environment. 6) HRTEM observations showed many large, irregular gold particles deposited on the outer surface of ZSM-5; however, the element maps, pore size distribution curves, and 27Al NMR results suggested the presence of gold species inside ZSM-5 channels. XPS spectra indicated that the chemical state of Au in the final catalyst was metallic Au and some Au+. 7) Significantly enhanced propylene selectivity was obtained over the optimized Au-ZSM-5 catalyst with 0.3 wt% gold loading with 100% n-octane conversion over the entire tested temperature range. Au played a more positive effect in cracking, isomerization, and dehydrogenation at lower temperatures. We proposed that the electron transfer from gold species to the zeolite framework affected the zeolite framework electronegativity and changed the acid strength of the Si(OH)Al groups. This provides a useful strategy to explore the acidic nature of bifunctional zeolite catalysts and may shed light on their structure-function relationships. CRediT authorship contribution statement Lei Wu: Conceptualization, Methodology, Software, Validation, Investigation, Writing – original draft. Caixia Qi: Conceptualization, Validation, Resources, Writing – review & editing, Funding acquisition. Xun Sun: Formal analysis. Huijuan Su: Data curation, Supervision. Libo Sun: Formal analysis, Data curation. Lijun Zhao: Supervision. All authors have read and agreed to the published version of the manuscript. Declaration of Competing Interest The authors declare that they have no known competing financial interests or personal relationships that could have appeared to influence the work reported in this paper. Acknowledgements We gratefully acknowledge the financial support provided by the National Natural Science Foundation of China (Nos.21773202 and 21802117) and by the Key Research and Development Plan of Yantai (Grant: 2019LJRC140 and 2021XDHZ068). The assistance for the quantitative measurement of solid surface acidity of the studied catalysts from Prof. Fengxiang Ling and Dr. Guoli Zhao is deeply appreciated. The Py-Infrared spectroscopy combined with quartz-spring gravimetric adsorption was established originally by their institute, the Fushun Research Institute of Petroleum and Petrochemicals, China. We also deeply appreciate the assistance of Prof. Tamao Ishida at Tokyo Metropolitan University for measurements of the Au LIII-edge X-ray absorption fine structure (XAFS) spectra. Appendix A Supporting information Supplementary data associated with this article can be found in the online version at doi:10.1016/j.apcata.2022.118862. Appendix A Supplementary material Supplementary material . References [1] J. Patterson Meas. Manag. 2012 147 170 J. Patterson, Exploitation of unconventional fossil fuels: enhanced greenhouse gas emissions. Greenhouse Gases- Emission, Measurement and Management, 2012,147–170. [2] P.D. Campo M. Teresa Navarro S.K. Shaikh M.D. Khokhar F. Aljumah C. Martínez A. Corma ACS Catal. 10 2020 11878 11891 10.1021/acscatal.0c02799 P.D. Campo, M. Teresa Navarro, S.K. Shaikh, M.D. Khokhar, F. Aljumah, C. Martínez, A. Corma, Propene production by butene cracking. Descriptors for zeolite catalysts, ACS Catal. 10 (2020) 11878−11891. https://doi.org/10.1021/acscatal.0c02799. [3] X. Hou Y. Qiu X.W. Zhang G.Z. Liu Chem. Eng. J. 321 2017 572 583 10.1016/j.cej.2017.03.127 X. Hou, Y. Qiu, X.W. Zhang, G.Z. Liu, Effects of regeneration of ZSM-5 based catalysts on light olefins production in n-pentane catalytic cracking, Chem. Eng. J. 321 (2017) 572−583. https://doi.org/10.1016/j.cej.2017.03.127. [4] V. Blay B. Louis R. Miravalles T. Yokoi K.A. Peccatiello M. Clough B. Yilmaz ACS Catal. 7 2017 6542 6566 10.1021/acscatal.7b02011 V. Blay, B. Louis, R. Miravalles, T. Yokoi, K.A. Peccatiello, M. Clough, B. Yilmaz, Engineering zeolites for catalytic cracking to light olefins, ACS Catal. 7 (2017) 6542−6566. https://doi.org/10.1021/acscatal.7b02011. [5] X. Hou Y. Qiu Y.J. Tian Z.H. Diao X.W. Zhang G.Z. Liu Chem. Eng. J. 349 2018 297 308 10.1016/j.cej.2018.05.026 X. Hou, Y. Qiu, Y.J. Tian, Z.H. Diao, X.W. Zhang, G.Z. Liu, Reaction pathways of n-pentane cracking on the fresh and regenerated Sr, Zr and La-loaded ZSM-5 zeolites, Chem. Eng. J. 349 (2018) 297−308. https://doi.org/10.1016/j.cej.2018.05.026. [6] M.G. Riley R.G. Anthony J. Catal. 100 1986 322 327 10.1016/0021-9517(86)90098-9 M.G. Riley, R.G. Anthony, Transition-state selectivity in the cracking of n-heptane over modified ZSM-5 catalysts, J. Catal. 100 (1986) 322−327. https://doi.org/10.1016/0021–9517(86)90098–9. [7] D.B. Lukyanov V.I. Shtral S.N. Khadzhiev J. Catal. 146 1994 87 92 10.1016/0021-9517(94)90011-6 D.B. Lukyanov, V.I. Shtral, S.N. Khadzhiev, A kinetic model for the hexane cracking reaction over H-ZSM-5, J. Catal. 146 (1994) 87−92. https://doi.org/10.1016/0021–9517(94)90011–6. [8] H. Krannila W.O. Haag B.C. Gates J. Catal. 13 1992 115 124 10.1016/0021-9517(92)90273-K H. Krannila, W.O. Haag, B.C. Gates, Monomolecular and bimolecular mechanisms of paraffin cracking: n-butane cracking catalyzed by HZSM-5, J. Catal. 13 (1992) 115−124. https://doi.org/10.1016/0021–9517(92)90273-K. [9] A. Farshi F. Shaiyegh S.H. Burogerdi A. Dehgan Petrol. Sci. Technol. 29 2011 875 885 10.1080/10916460903451985 A. Farshi, F. Shaiyegh, S.H. Burogerdi, A. Dehgan, FCC process role in propylene demands, Petrol. Sci. Technol. 29 (2011) 875–885. https://doi.org/10.1080/10916460903451985. [10] A. Farshi H.R. Abri Petrol. Sci. Technol. 30 2012 1285 1295 10.1080/10916466.2010.497789 A. Farshi, H.R. Abri, The addition of ZSM-5 to a fluid catalytic cracking catalyst for increasing olefins in fluid catalytic cracking light gas, Petrol. Sci. Technol. 30 (2012) 1285–1295. https://doi.org/10.1080/10916466.2010.497789 [11] X.N. Feng G.Y. Jiang Z. Zhao L. Wang X.H. Li A.J. Duan J. Liu C.M. Xu J.S. Gao Energ. Fuel. 24 2010 4111 4115 10.1021/ef100392d X.N. Feng, G.Y. Jiang, Z. Zhao, L. Wang, X.H. Li, A.J. Duan, J. Liu, C.M. Xu, J.S. Gao, Highly effective F-modified HZSM-5 catalysts for the cracking of naphtha to produce light olefins, Energ. Fuel. 24 (2010) 4111–4115. https://doi.org/10.1021/ef100392d. [12] J.J. Luo Y.N. Dong C. Petit C.H. Liang Chin. J. Catal. 42 2021 670 693 10.1016/S1872-2067(20)63743-3 J.J. Luo, Y.N. Dong, C. Petit, C.H. Liang, Development of gold catalysts supported by unreducible materials: Design and promotions. Chinese. J. Catal. 42 (2021) 670−693. https://doi.org/10.1016/S1872–2067(20)63743–3. [13] S.F. Yuan Z. Lei Z.J. Guan Q.M. Wang Angew. Chem. Int. Ed. 60 2020 5225 5229 10.1002/anie.202012499 S.F. Yuan, Z. Lei, Z.J. Guan, Q.M. Wang, Atomically precise preorganization of open metal sites on gold nanocluster with high catalytic performance, Angew. Chem. Int. Ed. 60 (2020) 5225−5229. https://doi.org/10.1002/anie.202012499. [14] T. Ishida T. Murayama A. Taketoshi M. Haruta Chem. Rev. 120 2020 464 525 10.1021/acs.chemrev.9b00551 T. Ishida, T. Murayama, A. Taketoshi, M. Haruta, Importance of size and contact structure of gold nanoparticles for the genesis of unique catalytic processes, Chem. Rev. 120 (2020) 464−525. https://doi.org/10.1021/acs.chemrev.9b00551. [15] R. Ciriminna E. Falletta C.D. Pina J.H. Teles M. Pagliaro Angew. Chem. Int. Ed. 55 2016 14210 14217 10.1002/anie.201604656 R. Ciriminna, E. Falletta, C.D. Pina, J.H. Teles, M. Pagliaro, Industrial applications of gold catalysis, Angew. Chem. Int. Ed. 55 (2016) 14210−14217. https://doi.org/10.1002/anie.201604656. [16] A.S.K. Hashmi G.J. Hutchings Angew. Chem. Int. Ed. 45 2006 7896 7936 10.1002/anie.200602454 A.S.K. Hashmi, G.J. Hutchings, Gold catalysis, Angew. Chem. Int. Ed. 45 (2006) 7896−7936. https://doi.org/10.1002/anie.200602454. [17] M. Haruta T. Kobayashi H. Sano N. Yamada Chem. Lett. 16 1987 405 408 10.1246/cl.1987.405 M. Haruta, T. Kobayashi, H. Sano, N. Yamada, Novel gold catalysts for the oxidation of carbon monoxide at a temperature far below 0°C, Chem. Lett. 16 (1987) 405−408. https://doi.org/10.1246/cl.1987.405. [18] G.J. Hutchings J. Catal. 96 1985 292 295 10.1016/0021-9517(85)90383-5 G.J. Hutchings, Vapor phase hydrochlorination of acetylene: correlation of catalytic activity of supported metal chloride catalysts, J. Catal. 96 (1985) 292−295. https://doi.org/10.1016/0021–9517(85)90383–5. [19] C.X. Qi Y.H. Zheng H. Lin H.J. Su X. Sun L.B. Sun Appl. Catal. B Environ. 253 2019 160 169 10.1016/j.apcatb.2019.03.081 C.X. Qi, Y.H. Zheng, H. Lin, H.J. Su, X. Sun, L.B. Sun, CO oxidation over gold catalysts supported on CuO/Cu2O both in O2-richand H2-rich streams: Necessity of copper oxide. Appl. Catal. B-Environ. 253 (2019) 160−169. https://doi.org/10.1016/j.apcatb.2019.03.081. [20] Y.H. Zheng M. Okumura X.Y. Hua A. Sonoura H.J. Su H. Nobutou X. Sun L.B. Sun F.S. Xiao C.X. Qi J. Catal. 401 2021 188 199 10.1016/j.jcat.2021.07.021 Y.H. Zheng, M. Okumura, X.Y. Hua, A. Sonoura, H.J. Su, H. Nobutou, X. Sun, L.B. Sun, F.S. Xiao, C.X. Qi, Partial oxidation of propylene with H2 and O2 over Au supported on ZrO2 with different structural and surface properties, J. Catal. 401 (2021) 188–199. https://doi.org/10.1016/j.jcat.2021.07.021. [21] M. Haruta S. Tsubota T. Kobayashi H. Kageyama M.J. Genet B. Delmon J. Catal.. 144 1993 175 192 10.1006/jcat.1993.1322 M. Haruta, S. Tsubota, T. Kobayashi, H. Kageyama, M.J. Genet, B. Delmon, Low-temperature oxidation of CO over gold supported on TiO2, α-Fe2O3, and Co3O4, J. Catal. 144 (1993) 175–192. https://doi.org/10.1006/jcat.1993.1322. [22] T. Hayashi K. Tanaka M. Haruta J. Catal. 178 1998 566 575 10.1006/jcat.1998.2157 T. Hayashi, K. Tanaka, M. Haruta, Selective vapor-phase epoxidation of propylene over Au/TiO2 catalysts in the presence of oxygen and hydrogen, J. Catal. 178 (1998) 566–575. https://doi.org/10.1006/jcat.1998.2157. [23] C.X. Qi Y.X. Wang X.T. Ding H.J. Su J. Catal. 37 2016 1747 1754 10.1016/S1872-2067(16)62499-3 C.X. Qi, Y.X. Wang, X.T. Ding, H.J. Su, Catalytic cracking of light diesel over Au/ZSM‐5 catalyst for increasing propylene production, Chinese. J. Catal. 37 (2016) 1747−1754. https://doi.org/10.1016/S1872–2067(16)62499–3. [24] M. Zhang Q. Liu H.A. Long L.B. Sun T. Murayama C.X. Qi J. Phys. Chem. C. 125 2021 16013 16023 10.1021/acs.jpcc.1c04608 M. Zhang, Q. Liu, H.A. Long, L.B. Sun, T. Murayama, C.X. Qi, Insights into Au nanoparticle size and chemical state of Au/ZSM-5 catalyst for catalytic cracking of n-octane to increase propylene production, J. Phys. Chem. C. 125 (2021) 16013−16023. https://doi.org/10.1021/acs.jpcc.1c04608. [25] N.L.H. Ai Sha J.X. Liu N. He H.C. Guo Chin. J. Catal. 34 2013 1262 1266 10.1016/S1872-2067(12)60539-7 N.L.H.A.I. Sha, J.X. Liu, N. He, H.C. Guo, Catalytic conversion of n‐butane over Au‐Zn‐modified nano‐sized HZSM‐5, Chinese J. Catal. 34 (2013) 1262–1266. https://doi.org/10.1016/S1872–2067(12)60539–7. [26] L.F. Lin C.F. Qiu Z.X. Zhuo D.W. Zhang S.F. Zhao H.H. Wu Y.M. Liu M.Y. He J. Catal. 309 2014 136 145 10.1016/j.jcat.2013.09.011 L.F. Lin, C.F. Qiu, Z.X. Zhuo, D.W. Zhang, S.F. Zhao, H.H. Wu, Y.M. Liu, M.Y. He, Acid strength controlled reaction pathways for the catalytic cracking of 1-butene to propene over ZSM-5, J. Catal. 309 (2014) 136–145. https://doi.org/10.1016/j.jcat.2013.09.011. [27] S.R. Zheng H.R. Heydenrych A. Jentys J.A. Lercher J. Phys. Chem. B 106 2002 9552 9558 10.1021/jp014091d S.R. Zheng, H.R. Heydenrych, A. Jentys, J.A. Lercher, Influence of surface modification on the acid site distribution of HZSM-5, J. Phys. Chem. B. 106 (2002) 9552−9558. https://doi.org/10.1021/jp014091d. [28] P. Sazama J. Dedecek V. Gabova B. Wichterlova G. Spoto S. Bordiga J. Catal. 254 2008 180 189 10.1016/j.jcat.2007.12.005 P. Sazama, J. Dedecek, V. Gabova, B. Wichterlova, G. Spoto, S. Bordiga, Effect of aluminium distribution in the framework of ZSM-5 on hydrocarbon transformation. Cracking of 1-butene, J. Catal. 254 (2008) 180−189. https://doi.org/10.1016/j.jcat.2007.12.005. [29] G. Engelhardt U. Lohse V. Patzelova M. Magi E. Lippmaa Zeolites 3 1983 239 243 10.1016/0144-2449(83)90014-3 G. Engelhardt, U. Lohse, V. Patzelova, M. Magi, E. Lippmaa, High resolution 29Si n.m.r, of dealuminated Y-zeolites. 2. Silicon, aluminium ordering in the tetrahedral zeolite lattice, Zeolites 3 (1983) 239−243. https://doi.org/10.1016/0144–2449(83)90014–3. [30] J. Scherzer ACS Symp. Ser. 248 1984 157 200 10.1021/bk-1984-0248.ch010 J. Scherzer, The preparation and characterization of aluminum-deficient zeolites, ACS Symp. Ser. 248 (1984) 157–200. https://doi.org/10.1021/bk-1984–0248.ch010. [31] R. Szostak Stud. Surf. Sci. Catal. 137 2001 261 297 10.1016/S0167-2991(01)80248-2 R. Szostak, Secondary synthesis methods, Stud. Surf. Sci. Catal. 137 (2001) 261−297. https://doi.org/10.1016/S0167–2991(01)80248–2. [32] Y.G. He C.Y. Li E.Z. Min Stud. Surf. Sci. Catal. 49 1989 189 197 10.1016/S0167-2991(08)61718-8 Y.G. He, C.Y. Li, E.Z. Min, A mechanism study of framework Si-Al substitution in Y zeolite during aqueous fluorosilicate treatment, Stud. Surf. Sci. Catal. 49 (1989) 189−197. https://doi.org/10.1016/S0167–2991(08)61718–8. [33] B.P. Block J.C. Bailar J. Am. Chem. Soc. 73 1951 4722 4725 10.1021/ja01154a071 B.P. Block, J.C. Bailar, The Reaction of Gold(III) with Some Bidentate Coördinating Groups, J. Am. Chem. Soc. 73 (1951) 4722−4725. https://doi.org/10.1021/ja01154a071. [34] H.G. Zhu C.D. Liang W.F. Yan S.H. Overbury S. Dai J. Phys. Chem. B 110 2006 10842 10848 10.1021/jp060637q H.G. Zhu, C.D. Liang, W.F. Yan, S.H. Overbury, S. Dai, Preparation of highly active silica-supported Au catalysts for CO oxidation by a solution-based technique, J. Phys. Chem. B. 110 (2006) 10842–10848. https://doi.org/10.1021/jp060637q. [35] S. Schallmoser T. Ikuno M.F. Wagenhofer R. Kolvenbach G.L. Haller M. Sanchez-Sanchez J.A. Lercher J. Catal. 316 2014 93 102 10.1016/j.jcat.2014.05.004 S. Schallmoser, T. Ikuno, M.F. Wagenhofer, R. Kolvenbach, G.L. Haller, M. Sanchez-Sanchez, J.A. Lercher, Impact of the local environment of Brønsted acid sites in ZSM-5 on the catalytic activity in n-pentane cracking, J. Catal. 316 (2014) 93–102. https://doi.org/10.1016/j.jcat.2014.05.004. [36] K.J. Liao, H. Jian, (Eds), Catalysts Analysis (in Chinese), Shenyang, Northeastern University Press, China, (2000) 90. [37] T. Tang F.X. Ling S.J. Wang Contemp. Chem. Ind. 10 2010 600 602 T. Tang, F.X. Ling, S.J. Wang, Contemporary Chemical Industry (in Chinese), 10 (2010) 600–602. [38] Z.H. Diao L. Wang X.W. Zhang G.Z. Liu Chem. Eng. Sci. 135 2015 452 460 10.1016/j.ces.2014.12.048 Z.H. Diao, L. Wang, X.W. Zhang, G.Z. Liu, Catalytic cracking of supercritical n-dodecane over meso-HZSM-5@Al-MCM-41 zeolites, Chem. Eng. Sci. 135 (2015) 452−460. https://doi.org/10.1016/j.ces.2014.12.048. [39] IUPAC Recommendations Pure Appl. Chem. 57 1985 603 IUPAC Recommendations Pure Appl. Chem. 57 (1985) 603. [40] IUPAC Recommendations Pure Appl. Chem. 66 1994 1739 IUPAC Recommendations Pure Appl. Chem. 66 (1994) 1739. [41] N. Rahimi R. Karimzadeh Appl. Catal. A Gen. 398 2011 1 17 10.1016/j.apcata.2011.03.009 N. Rahimi, R. Karimzadeh, Catalytic cracking of hydrocarbons over modified ZSM-5 zeolites to produce light olefins: A review, Appl. Catal. A-Gen. 398 (2011) 1–17. https://doi.org/10.1016/j.apcata.2011.03.009. [42] B. Isabelle S. Alexander J. Phys. Chem. C 123 2019 4235 4242 10.1021/acs.jpcc.8b11524 B. Isabelle, S. Alexander, Determination of the exact microporous volume and BET surface area in hierarchical ZSM–5, J. Phys. Chem. C. 123 (2019) 4235–4242. https://doi.org/10.1021/acs.jpcc.8b11524. [43] X.L. Dong S. Shaikh J.R. Vittenet J.J. Wang Z.H. Liu K.D. Bhatte O. Ali W. Xu I. Osorio Y. Saih ACS Sustain. Chem. Eng. 6 2018 15832 15840 10.1021/acssuschemeng.8b04441 X.L. Dong, S. Shaikh, J.R. Vittenet, J.J. Wang, Z.H. Liu, K.D. Bhatte, O. Ali, W. Xu, I. Osorio, Y. Saih, et al. Fine tuning the diffusion length in hierarchical ZSM-5 to maximize the yield of propylene in catalytic cracking of hydrocarbons, ACS Sustain. Chem. Eng. 6 (2018) 15832–15840. https://doi.org/10.1021/acssuschemeng.8b04441. [44] N. Zhang C.L. Liu J.H. Ma R.F. Li H.J. Jiao Phys. Chem. Chem. Phys. 21 2019 18758 18768 10.1039/C9CP04050A N. Zhang, C.L. Liu, J.H. Ma, R.F. Li, H.J. Jiao, Determining the structures, acidity and adsorption properties of Al substituted HZSM-5, Phys. Chem. Chem. Phys. 21 (2019) 18758–18768. https://doi.org/10.1039/C9CP04050A. [45] H.M. Kao P.C. Chang J. Phys. Chem. B 110 2006 19104 19107 10.1021/jp064938b H.M. Kao, P.C. Chang, Direct solid-state NMR spectroscopic evidence for the NH4AlF4 crystalline phase derived from zeolite HY dealuminated with ammonium hexafluorosilicate, J. Phys. Chem. B. 110 (2006) 19104–19107. https://doi.org/10.1021/jp064938b. [46] J. Kanellopoulos A. Unger W. Schwieger D. Freude J. Catal. 237 2006 416 425 10.1016/j.jcat.2005.11.030 J. Kanellopoulos, A. Unger, W. Schwieger, D. Freude, Catalytic and multinuclear MAS NMR studies of a thermally treated zeolite ZSM-5, J. Catal. 237 (2006) 416–425. https://doi.org/10.1016/j.jcat.2005.11.030. [47] J.P. Gilson G.C. Edwards A.W. Peters K. Rajagopalan R.F. Wormsbecher T.G. Roberie M.P. Shatlock J. Chem. Soc. Chem. Commun. 2 1987 91 92 10.1039/C39870000091 J.P. Gilson, G.C. Edwards, A.W. Peters, K. Rajagopalan, R.F. Wormsbecher, T.G. Roberie, M.P. Shatlock, Penta-coordinated aluminium in zeolites and aluminosilicates. J. Chem. Soc., Chem. Commun. 2 (1987) 91−92. https://doi.org/10.1039/C39870000091. [48] H.C. Xin X.P. Li Y. Fang X.F. Yi W.H. Hu Y.Y. Chu F. Zhang A.M. Zheng H.P. Zhang X.B. Li J. Catal. 312 2014 204 215 10.1016/j.jcat.2014.02.003 H.C. Xin, X.P. Li, Y. Fang, X.F. Yi, W.H. Hu, Y.Y. Chu, F. Zhang, A.M. Zheng, H.P. Zhang, X.B. Li, Catalytic dehydration of ethanol over post-treated ZSM-5 zeolites, J. Catal. 312 (2014) 204−215. https://doi.org/10.1016/j.jcat.2014.02.003. [49] J. Dedecek V. Balgová V. Pashkova P. Klein B. Wichterlová Chem. Mater. 24 2012 3231 3239 10.1021/cm301629a J. Dedecek, V. Balgová, V. Pashkova, P. Klein, B. Wichterlová, Synthesis of ZSM-5 zeolites with defined distribution of Al atoms in the framework and multinuclear MAS NMR analysis of the control of Al distribution, Chem. Mate. 24 (2012) 3231–3239. https://doi.org/10.1021/cm301629a. [50] G.J. Kramer R.A. van Santen C.A. Emeis A.K. Nowak Nature 363 1993 529 531 10.1038/363529a0 G.J. Kramer, R.A. van Santen, C.A. Emeis, A.K. Nowak, Understanding the acid behaviour of zeolites from theory and experiment, Nature 363 (1993) 529−531. https://doi.org/10.1038/363529a0. [51] G.J. Kramer R.A. van Santen J. Am. Chem. Soc. 117 1995 1766 1776 10.1021/ja00111a014 G.J. Kramer, R.A. van Santen, An ab-initio study of D/H exchange between CD4 and the H-forms of zeolites FAU and MFI, J. Am. Chem. Soc. 117 (1995) 1766–1776. https://doi.org/10.1021/ja00111a014. [52] Y. Qiu X. Hou G.Z. Liu L. Wang X.W. Zhang Micro Mesoporous Mat. 243 2017 176 185 10.1016/j.micromeso.2017.02.030 Y. Qiu, X. Hou, G.Z. Liu, L. Wang, X.W. Zhang, Fast recovery of Brønsted acid sites lost during high-temperature calcination in HZSM-5, Micropor. Mesopor. Mat. 243 (2017) 176–185. https://doi.org/10.1016/j.micromeso.2017.02.030. [53] S. Kotrel H. Knozinger B.C. Gates Micro Mesoporous Mat. 36 2000 11 20 10.1016/S1387-1811(99)00204-8 S. Kotrel, H. Knozinger, B.C. Gates, The Haag–Dessau mechanism of protolytic cracking of alkanes, Micropor. Mesopor. Mat. 35–36 (2000) 11–20. https://doi.org/10.1016/S1387–1811(99)00204–8. [54] C.A. Emeis J. Catal. 141 1993 347 354 10.1006/jcat.1993.1145 C.A. Emeis, Determination of integrated molar extinction coefficients for infrared absorption bands of pyridine adsorbed on solid acid catalysts, J. Catal. 141 (1993) 347–354. https://doi.org/10.1006/jcat.1993.1145. [55] P. Wattanapaphawong P. Reubroycharoen N. Mimura O. Sato A. Yamaguchi Fuel Process. Technol. 202 2020 106367 10.1016/j.fuproc.2020.106367 P. Wattanapaphawong, P. Reubroycharoen, N. Mimura, O. Sato, A. Yamaguchi, Effect of carbon number on the production of propylene and ethylene by catalytic cracking of straight-chain alkanes over phosphorus-modified ZSM-5, Fuel Process. Technol. 202 (2020) 106367. https://doi.org/10.1016/j.fuproc.2020.106367. [56] L.X. Wang K. Ozawa T. Komatsu T. Ikeda Appl. Catal. A Gen. 407 2011 127 133 10.1016/j.apcata.2011.08.028 L.X. Wang, K. Ozawa, T. Komatsu, T. Ikeda, Ca2+-exchanged ferrierite: Quasi one-dimensional zeolite for highly selective and stable formation of light alkenes in catalytic cracking of n-octane, Appl. Catal. A-Gen. 407 (2011) 127−133. https://doi.org/10.1016/j.apcata.2011.08.028. [57] S.H. Lee D.K. Lee C.H. Shin W.C. Paik W.M. Lee S.B. Hong J. Catal. 196 2000 158 166 10.1006/jcat.2000.3031 S.H. Lee, D.K. Lee, C.H. Shin, W.C. Paik, W.M. Lee, S.B. Hong, Synthesis of zeolite ZSM-57 and its catalytic evaluation for the 1-butene skeletal isomerization and n-octane cracking, J. Catal. 196 (2000) 158−166. https://doi.org/10.1006/jcat.2000.3031. [58] J.S. Jung T.J. Kim G. Seo J. Chem. Eng. 21 2004 777 781 10.1007/BF02705520 J.S. Jung, T.J. Kim, G. Seo, Catalytic cracking of n-octane over zeolites with different pore structures and acidities, Korean. J. Chem. Eng. 21 (2004) 777−781. https://doi.org/10.1007/BF02705520. [59] X. Xiao B. Sun P. Wang X.Q. Fan L. Kong Z.A. Xie B.N. Liu Z. Zhao Micropor. Mesoporous Mater 330 2022 111621 10.1016/j.micromeso.2021.111621 X. Xiao, B. Sun, P. Wang, X.Q. Fan, L. Kong, Z.A. Xie, B.N. Liu, Z. Zhao, Tuning the density of Brønsted acid sites on mesoporous ZSM-5 zeolite for enhancing light olefins selectivity in the catalytic cracking of n-octane, Micropor. Mesopor. Mater. 330 (2022) 111621. https://doi.org/10.1016/j.micromeso.2021.111621. [60] P.G. Smirniotis E. Ruckenstein Ind. Eng. Chem. Res. 33 1994 800 813 10.1021/ie00028a004 P.G. Smirniotis, E. Ruckenstein, Comparison of the performance of ZSM-5, β Zeolite, Y, USY, and their composites in the catalytic cracking of n-octane, 2,2,4-Trimethylpentane, and 1-octene, Ind. Eng. Chem. Res. 33 (1994) 800−813. https://doi.org/10.1021/ie00028a004. [61] S. Altwasser C. Welker Y. Traa J. Weitkamp Micro Mesoporous Mat. 83 2005 345 356 10.1016/j.micromeso.2005.04.028 S. Altwasser, C. Welker, Y. Traa, J. Weitkamp, Catalytic cracking of n-octane on small-pore zeolites, Micropor. Mesopor. Mat. 83 (2005) 345−356. https://doi.org/10.1016/j.micromeso.2005.04.028. [62] J.S. Jung J.W. Park G. Seo Appl. Catal. A Gen. 288 2005 149 157 10.1016/j.apcata.2005.04.047 J.S. Jung, J.W. Park, G. Seo, Catalytic cracking of n-octane over alkali-treated MFI zeolites, Appl. Catal. A-Gen. 288 (2005) 149−157. https://doi.org/10.1016/j.apcata.2005.04.047. [63] Q. Liu M. Zhang L.B. Sun H.J. Su X.H. Zou C.X. Qi Ind. Eng. Chem. Res. 58 2019 14695 14704 10.1021/acs.iecr.9b02612 Q. Liu, M. Zhang, L.B. Sun, H.J. Su, X.H. Zou, C.X. Qi, The performance of catalytic conversion of ZSM-5 comodified with gold and lanthanum for increasing propylene production, Ind. Eng. Chem. Res. 58 (2019) 14695–14704. https://doi.org/10.1021/acs.iecr.9b02612. [64] S. Tarighi N. Afroukhteh-Langaroudi H.A. Khonakdar Sci. Technol. 35 2017 2201 2207 10.1080/10916466.2017.1396610 S. Tarighi, N. Afroukhteh-Langaroudi, H.A. Khonakdar, Conversion of n-heptane over different catalysts: Effect of catalyst-to-oil ratio and temperature, Petrol. Sci. Technol. 35 (2017) 2201−2207. https://doi.org/10.1080/10916466.2017.1396610. [65] X.Y. Hu C.Y. Li C.H. Yang Catal. Today 158 2010 504 509 10.1016/j.cattod.2010.07.028 X.Y. Hu, C.Y. Li, C.H. Yang, Catalytic cracking of n-heptane over HZSM-5 catalysts with the activation of lattice oxygen, Catal. Today. 158 (2010) 504−509. https://doi.org/10.1016/j.cattod.2010.07.028. [66] J. Wang J.W. Shan Y.J. Tian T.T. Zhu H.N. Duan X.Y. He C.Z. Qiao G.Z. Liu Fuel 306 2021 121725 10.1016/j.fuel.2021.121725 J. Wang, J.W. Shan, Y.J. Tian, T.T. Zhu, H.N. Duan, X.Y. He, C.Z. Qiao, G.Z. Liu, Catalytic cracking of n-heptane over Fe modified HZSM-5 nanosheet to produce light olefins, Fuel 306 (2021) 121725. https://doi.org/10.1016/j.fuel.2021.121725. [67] J. Fu X. Feng Y.B. Liu H.H. Shan C.H. Yang J. Phys. Chem. C 122 2018 12222 12230 10.1021/acs.jpcc.8b00995 J. Fu, X. Feng, Y.B. Liu, H.H. Shan, C.H. Yang, Mechanistic insights into the pore confinement effect on bimolecular and monomolecular cracking mechanisms of n‑octane over HY and HZSM‑5 zeolites: A DFT study, J. Phys. Chem. C. 122 (2018) 12222–12230. https://doi.org/10.1021/acs.jpcc.8b00995. [68] A.F.H. Wielers M. Vaarkamp M.F.M. Post J. Catal. 127 1991 51 66 10.1016/0021-9517(91)90208-L A.F.H. Wielers, M. Vaarkamp, M.F.M. Post, Relation between properties and performance of zeolites in paraffin cracking, J. Catal. 127 (1991) 51–66. https://doi.org/10.1016/0021–9517(91)90208-L. [69] A. Corma J. Mengual P.J. Miguel J. Catal. 330 2015 520 532 10.1016/j.jcat.2015.04.020 A. Corma, J. Mengual, P.J. Miguel, Catalytic cracking of n-alkane naphtha: The impact of olefin addition and active sites differentiation, J. Catal. 330 (2015) 520–532. https://doi.org/10.1016/j.jcat.2015.04.020. [70] K. Kubo H. Iida S. Namba A. Igarashi Micro Mesoporous Mat. 149 2012 126 133 10.1016/j.micromeso.2011.08.021 K. Kubo, H. Iida, S. Namba, A. Igarashi, Selective formation of light olefin by n-heptane cracking over HZSM-5 at high temperatures, Micropor. Mesopor. Mat. 149 (2012) 126−133. https://doi.org/10.1016/j.micromeso.2011.08.021. [71] K.C. Hunter A.L.L. East J. Phys. Chem. A 106 2002 1346 1356 10.1021/jp0129030 K.C. Hunter, A.L.L. East, Properties of C-C bonds in n-alkanes: Relevance to cracking mechanisms, J. Phys. Chem. A. 106 (2002) 1346–1356. https://doi.org/10.1021/jp0129030. [72] S.H. Li A.M. Zheng Y.C. Su H.L. Zhang L. Chen J. Yang C.H. Ye F. Deng J. Am. Chem. Soc. 129 2007 11161 11171 10.1021/ja072767y S.H. Li, A.M. Zheng, Y.C. Su, H.L. Zhang, L. Chen, J. Yang, C.H. Ye, F. Deng, Brønsted/Lewis acid synergy in dealuminated HY zeolite: A combined solid-state NMR and theoretical calculation study, J. Am. Chem. Soc. 129 (2007) 11161–11171. https://doi.org/10.1021/ja072767y. [73] L.F. Lin C.F. Qiu Z.X. Zhuo D.W. Zhang S.F. Zhao H.H. Wu Y.M. Liu M.Y. He J. Catal. 309 2014 136 145 10.1016/j.jcat.2013.09.011 L.F. Lin, C.F. Qiu, Z.X. Zhuo, D.W. Zhang, S.F. Zhao, H.H. Wu, Y.M. Liu, M.Y. He, Acid strength controlled reaction pathways for the catalytic cracking of 1-butene to propene over ZSM-5, J. Catal. 309 (2014) 136–145. https://doi.org/10.1016/j.jcat.2013.09.011. [74] N. Aisha W.L. MO F.Y. MA J. Fuel Chem. Technol. 43 2015 980 989 N. Aisha, W.L. MO, F.Y. MA, Performance of Au /HZSM-5 catalysts for the isomerization reaction of n-butane, Journal of Fuel Chemistry and Technology. 43 (2015) 980−989. [75] A. Corma A.V. Orchilles Micro Mesoporous Mater. 35–36 2000 21 30 10.1016/S1387-1811(99)00205-X A. Corma, A.V. Orchilles, Current views on the mechanism of catalytic cracking. Micropor. Mesopor. Mater. 35–36 (2000) 21–30. https://doi.org/10.1016/S1387–1811(99)00205-X. [76] Y. Pan A. Bhowmick W. Wu Y. Zhang Y.X. Diao A.G. Zheng C. Zhang R.X. Xie Z.X. Liu J.Q. Meng D.X.Liu Titanium ACS Catal. 11 2021 9970 9985 10.1021/acscatal.1c02676 Y. Pan, A. Bhowmick, W. Wu, Y. Zhang, Y.X. Diao, A.G. Zheng, C. Zhang, R.X. Xie, Z.X. Liu, J.Q. Meng, D.X.Liu. Titanium silicalite‑1 nanosheet-supported platinum for nonoxidative ethane dehydrogenation, ACS Catal. 11 (2021) 9970−9985. https://doi.org/10.1021/acscatal.1c02676. [77] Z.K. Xu Y.Y. Yue X.J. Bao Z.L. Xie H.B. Zhu ACS Catal. 10 2020 818 828 10.1021/acscatal.9b03527 Z.K. Xu, Y.Y. Yue, X.J. Bao, Z.L. Xie, H.B. Zhu, Propane dehydrogenation over Pt clusters localized at the single-site in zeolite framework, ACS Catal. 10 (2020) 818−828. https://doi.org/10.1021/acscatal.9b03527. [78] N. Wang Q.M. Sun R.S. Bai X. Li G.Q. Guo J.H. Yu J. Am. Chem. Soc. 138 2016 7484 7487 10.1021/jacs.6b03518 N. Wang, Q.M. Sun, R.S. Bai, X. Li, G.Q. Guo, J.H. Yu, In situ confinement of ultrasmall Pd clusters within nanosized silicalite‑1 zeolite for highly efficient catalysis of hydrogen generation, J. Am. Chem. Soc. 138 (2016) 7484−7487. https://doi.org/10.1021/jacs.6b03518. [79] J.W. Zheng J. Qu H.Q. Lin Q. Zhang X. Yuan Y.H. Yang Y.Z. Yuan ACS Catal. 6 2016 6662 6669 10.1021/acscatal.6b01348 J.W. Zheng, J. Qu, H.Q. Lin, Q. Zhang, X. Yuan, Y.H. Yang, Y.Z. Yuan, Surface composition control of the binary Au−Ag catalyst for enhanced oxidant-free dehydrogenation, ACS Catal. 6 (2016) 6662−6669. https://doi.org/10.1021/acscatal.6b01348. [80] Z.Y. Yang H. Li H. Zhou L. Wang L.X. Wang Q.Y. Zhu J.P. Xiao X.J. Meng J.X. Chen F.S. Xiao J. Am. Chem. Soc. 142 2020 16429 16436 10.1021/jacs.0c07792 Z.Y. Yang, H. Li, H. Zhou, L. Wang, L.X. Wang, Q.Y. Zhu, J.P. Xiao, X.J. Meng, J.X. Chen, F.S. Xiao, Coking-resistant iron catalyst in ethane dehydrogenation achieved through siliceous zeolite modulation, J. Am. Chem. Soc. 142 (2020) 16429−16436. https://doi.org/10.1021/jacs.0c07792. [81] C.Y. Wang G. Garbarino L.F. Allard F. Wilson G. Busca M. Flytzani-Stephanopoulos ACS Catal. 6 2016 210 218 10.1021/acscatal.5b01593 C.Y. Wang, G. Garbarino, L.F. Allard, F. Wilson, G. Busca, M. Flytzani-Stephanopoulos, Low-temperature dehydrogenation of ethanol on atomically dispersed gold supported on ZnZrOx. ACS Catal. 6 (2016) 210−218. https://doi.org/10.1021/acscatal.5b01593. [82] J.W. Zheng J. Qu H.Q. Lin Q. Zhang X. Yuan Y.H. Yang Y.Z. Yuan ACS Catal. 6 2016 6662 6669 10.1021/acscatal.6b01348 J.W. Zheng, J. Qu, H.Q. Lin, Q. Zhang, X. Yuan, Y.H. Yang, Y.Z. Yuan, Surface composition control of the binary Au−Ag catalyst for enhanced oxidant-free dehydrogenation. ACS Catal. 6 (2016) 6662–6669. https://doi.org/10.1021/acscatal.6b01348. [83] A. Taketoshi T. Ishida H. Ohashi T. Honma M. Haruta Chin. J. Catal. 38 2017 1888 1898 10.1016/S1872-2067(17)62909-7 A. Taketoshi, T. Ishida, H. Ohashi, T. Honma, M. Haruta, Preparation of gold clusters on metal oxides by deposition-precipitation with microwave drying and their catalytic performance for CO and sulfide oxidation, Chinese J. Catal. 38 (2017) 1888–1898. https://doi.org/10.1016/S1872–2067(17)62909–7. [84] D. Santi S. Rabl V. Calemma M. Dyballa M. Hunger J. Weitkamp Chem. Cat. Chem. 5 2013 1524 1530 10.1002/cctc.201200675 D. Santi, S. Rabl, V. Calemma, M. Dyballa, M. Hunger, J. Weitkamp, Effect of noble metals on the strength of Brønsted acid sites in bifunctional zeolites, Chem. Cat. Chem. 5 (2013) 1524–1530. https://doi.org/10.1002/cctc.201200675. [85] D.E. Ramaker J. De Graaf J.A.R. van Veen D.C. Koningsberger J. Catal. 203 2001 7 17 10.1006/jcat.2001.3299 D.E. Ramaker, J. De Graaf, J.A.R. van Veen, D.C. Koningsberger, Nature of the metal–support interaction in supported Pt catalysts: shift in Pt valence orbital energy and charge rearrangement. J. Catal. 203 (2001) 7–17. https://doi.org/10.1006/jcat.2001.3299. [86] D. Kubićka N. Kumar T. Venäläinen H. Karhu I. Kubičková H. Österholm D.Y. Murzin J. Phys. Chem. B 110 2006 4937 4946 10.1021/jp055754k D. Kubićka, N. Kumar, T. Venäläinen, H. Karhu, I. Kubičková, H. Österholm, D.Y. Murzin, Metal−support interactions in zeolite-supported noble metals: influence of metal crystallites on the support acidity, J. Phys. Chem. B. 110 (2006) 4937–4946. https://doi.org/10.1021/jp055754k.",
      "scopus-id": "85138184448",
      "coredata": {
        "eid": "1-s2.0-S0926860X22003854",
        "dc:description": "With respect to catalysis, the pursuit of low reaction temperatures has received continuous efforts for developing energy efficient and environmentally friendly processes. In this study, the significant promotion in the catalytic cracking performance of n-octane at low temperatures of 260–460 °C over Au/ZSM-5 catalysts was obtained via the joint contribution of dealumination and Au species. A 63.5% propylene selectivity and 100% n-octane conversion were obtained over the optimized catalyst at 410 °C. The higher propylene yield was attributed to an increase in the concentration of Brønsted acids and a decrease in that of Lewis acids, as well as synergy between acid sites and Au species. The positive effect of Au species during dehydrogenation at lower temperatures was verified, and electron transfer from Au to the zeolite framework was proposed.",
        "openArchiveArticle": "false",
        "prism:coverDate": "2022-09-25",
        "openaccessUserLicense": null,
        "prism:aggregationType": "Journal",
        "prism:url": "https://api.elsevier.com/content/article/pii/S0926860X22003854",
        "dc:creator": [
          {
            "@_fa": "true",
            "$": "Wu, Lei"
          },
          {
            "@_fa": "true",
            "$": "Qi, Caixia"
          },
          {
            "@_fa": "true",
            "$": "Sun, Xun"
          },
          {
            "@_fa": "true",
            "$": "Su, Huijuan"
          },
          {
            "@_fa": "true",
            "$": "Sun, Libo"
          },
          {
            "@_fa": "true",
            "$": "Zhao, Lijun"
          },
          {
            "@_fa": "true",
            "$": "Xiao, Fengshou"
          }
        ],
        "link": [
          {
            "@_fa": "true",
            "@rel": "self",
            "@href": "https://api.elsevier.com/content/article/pii/S0926860X22003854"
          },
          {
            "@_fa": "true",
            "@rel": "scidir",
            "@href": "https://www.sciencedirect.com/science/article/pii/S0926860X22003854"
          }
        ],
        "dc:format": "application/json",
        "openaccessType": null,
        "pii": "S0926-860X(22)00385-4",
        "prism:volume": "646",
        "articleNumber": "118862",
        "prism:publisher": "Elsevier B.V.",
        "dc:title": "A highly efficient bi-functional zeolite catalyst for low temperature catalytic cracking of n-octane to produce propylene: Joint contribution of nanogold and dealumination",
        "prism:copyright": "© 2022 Elsevier B.V. All rights reserved.",
        "openaccess": "0",
        "prism:issn": "0926860X",
        "dcterms:subject": [
          {
            "@_fa": "true",
            "$": "Au/ZSM-5"
          },
          {
            "@_fa": "true",
            "$": "Dealumination"
          },
          {
            "@_fa": "true",
            "$": "Catalytic cracking"
          },
          {
            "@_fa": "true",
            "$": "Propylene"
          },
          {
            "@_fa": "true",
            "$": "N-Octane"
          }
        ],
        "openaccessArticle": "false",
        "prism:publicationName": "Applied Catalysis A: General",
        "openaccessSponsorType": null,
        "prism:pageRange": "118862",
        "pubType": "fla",
        "prism:coverDisplayDate": "25 September 2022",
        "prism:doi": "10.1016/j.apcata.2022.118862",
        "prism:startingPage": "118862",
        "dc:identifier": "doi:10.1016/j.apcata.2022.118862",
        "openaccessSponsorName": null
      },
      "objects": {
        "object": [
          {
            "@category": "standard",
            "@height": "269",
            "@width": "602",
            "@_fa": "true",
            "$": "https://api.elsevier.com/content/object/eid/1-s2.0-S0926860X22003854-gr9.jpg?httpAccept=%2A%2F%2A",
            "@multimediatype": "JPEG image file",
            "@type": "IMAGE-DOWNSAMPLED",
            "@size": "47197",
            "@ref": "gr9",
            "@mimetype": "image/jpeg"
          },
          {
            "@category": "standard",
            "@height": "283",
            "@width": "602",
            "@_fa": "true",
            "$": "https://api.elsevier.com/content/object/eid/1-s2.0-S0926860X22003854-gr7.jpg?httpAccept=%2A%2F%2A",
            "@multimediatype": "JPEG image file",
            "@type": "IMAGE-DOWNSAMPLED",
            "@size": "44908",
            "@ref": "gr7",
            "@mimetype": "image/jpeg"
          },
          {
            "@category": "standard",
            "@height": "288",
            "@width": "602",
            "@_fa": "true",
            "$": "https://api.elsevier.com/content/object/eid/1-s2.0-S0926860X22003854-gr8.jpg?httpAccept=%2A%2F%2A",
            "@multimediatype": "JPEG image file",
            "@type": "IMAGE-DOWNSAMPLED",
            "@size": "39362",
            "@ref": "gr8",
            "@mimetype": "image/jpeg"
          },
          {
            "@category": "standard",
            "@height": "256",
            "@width": "602",
            "@_fa": "true",
            "$": "https://api.elsevier.com/content/object/eid/1-s2.0-S0926860X22003854-gr5.jpg?httpAccept=%2A%2F%2A",
            "@multimediatype": "JPEG image file",
            "@type": "IMAGE-DOWNSAMPLED",
            "@size": "43018",
            "@ref": "gr5",
            "@mimetype": "image/jpeg"
          },
          {
            "@category": "standard",
            "@height": "268",
            "@width": "376",
            "@_fa": "true",
            "$": "https://api.elsevier.com/content/object/eid/1-s2.0-S0926860X22003854-gr6.jpg?httpAccept=%2A%2F%2A",
            "@multimediatype": "JPEG image file",
            "@type": "IMAGE-DOWNSAMPLED",
            "@size": "37529",
            "@ref": "gr6",
            "@mimetype": "image/jpeg"
          },
          {
            "@category": "standard",
            "@height": "313",
            "@width": "339",
            "@_fa": "true",
            "$": "https://api.elsevier.com/content/object/eid/1-s2.0-S0926860X22003854-gr3.jpg?httpAccept=%2A%2F%2A",
            "@multimediatype": "JPEG image file",
            "@type": "IMAGE-DOWNSAMPLED",
            "@size": "20136",
            "@ref": "gr3",
            "@mimetype": "image/jpeg"
          },
          {
            "@category": "standard",
            "@height": "267",
            "@width": "339",
            "@_fa": "true",
            "$": "https://api.elsevier.com/content/object/eid/1-s2.0-S0926860X22003854-gr4.jpg?httpAccept=%2A%2F%2A",
            "@multimediatype": "JPEG image file",
            "@type": "IMAGE-DOWNSAMPLED",
            "@size": "34742",
            "@ref": "gr4",
            "@mimetype": "image/jpeg"
          },
          {
            "@category": "standard",
            "@height": "283",
            "@width": "565",
            "@_fa": "true",
            "$": "https://api.elsevier.com/content/object/eid/1-s2.0-S0926860X22003854-gr1.jpg?httpAccept=%2A%2F%2A",
            "@multimediatype": "JPEG image file",
            "@type": "IMAGE-DOWNSAMPLED",
            "@size": "56611",
            "@ref": "gr1",
            "@mimetype": "image/jpeg"
          },
          {
            "@category": "standard",
            "@height": "355",
            "@width": "791",
            "@_fa": "true",
            "$": "https://api.elsevier.com/content/object/eid/1-s2.0-S0926860X22003854-gr2.jpg?httpAccept=%2A%2F%2A",
            "@multimediatype": "JPEG image file",
            "@type": "IMAGE-DOWNSAMPLED",
            "@size": "54994",
            "@ref": "gr2",
            "@mimetype": "image/jpeg"
          },
          {
            "@category": "standard",
            "@height": "200",
            "@width": "370",
            "@_fa": "true",
            "$": "https://api.elsevier.com/content/object/eid/1-s2.0-S0926860X22003854-ga1.jpg?httpAccept=%2A%2F%2A",
            "@multimediatype": "JPEG image file",
            "@type": "IMAGE-DOWNSAMPLED",
            "@size": "26744",
            "@ref": "ga1",
            "@mimetype": "image/jpeg"
          },
          {
            "@category": "thumbnail",
            "@height": "98",
            "@width": "219",
            "@_fa": "true",
            "$": "https://api.elsevier.com/content/object/eid/1-s2.0-S0926860X22003854-gr9.sml?httpAccept=%2A%2F%2A",
            "@multimediatype": "GIF image file",
            "@type": "IMAGE-THUMBNAIL",
            "@size": "8699",
            "@ref": "gr9",
            "@mimetype": "image/gif"
          },
          {
            "@category": "thumbnail",
            "@height": "103",
            "@width": "219",
            "@_fa": "true",
            "$": "https://api.elsevier.com/content/object/eid/1-s2.0-S0926860X22003854-gr7.sml?httpAccept=%2A%2F%2A",
            "@multimediatype": "GIF image file",
            "@type": "IMAGE-THUMBNAIL",
            "@size": "8035",
            "@ref": "gr7",
            "@mimetype": "image/gif"
          },
          {
            "@category": "thumbnail",
            "@height": "105",
            "@width": "219",
            "@_fa": "true",
            "$": "https://api.elsevier.com/content/object/eid/1-s2.0-S0926860X22003854-gr8.sml?httpAccept=%2A%2F%2A",
            "@multimediatype": "GIF image file",
            "@type": "IMAGE-THUMBNAIL",
            "@size": "7180",
            "@ref": "gr8",
            "@mimetype": "image/gif"
          },
          {
            "@category": "thumbnail",
            "@height": "93",
            "@width": "219",
            "@_fa": "true",
            "$": "https://api.elsevier.com/content/object/eid/1-s2.0-S0926860X22003854-gr5.sml?httpAccept=%2A%2F%2A",
            "@multimediatype": "GIF image file",
            "@type": "IMAGE-THUMBNAIL",
            "@size": "7744",
            "@ref": "gr5",
            "@mimetype": "image/gif"
          },
          {
            "@category": "thumbnail",
            "@height": "156",
            "@width": "219",
            "@_fa": "true",
            "$": "https://api.elsevier.com/content/object/eid/1-s2.0-S0926860X22003854-gr6.sml?httpAccept=%2A%2F%2A",
            "@multimediatype": "GIF image file",
            "@type": "IMAGE-THUMBNAIL",
            "@size": "16300",
            "@ref": "gr6",
            "@mimetype": "image/gif"
          },
          {
            "@category": "thumbnail",
            "@height": "164",
            "@width": "177",
            "@_fa": "true",
            "$": "https://api.elsevier.com/content/object/eid/1-s2.0-S0926860X22003854-gr3.sml?httpAccept=%2A%2F%2A",
            "@multimediatype": "GIF image file",
            "@type": "IMAGE-THUMBNAIL",
            "@size": "5861",
            "@ref": "gr3",
            "@mimetype": "image/gif"
          },
          {
            "@category": "thumbnail",
            "@height": "164",
            "@width": "208",
            "@_fa": "true",
            "$": "https://api.elsevier.com/content/object/eid/1-s2.0-S0926860X22003854-gr4.sml?httpAccept=%2A%2F%2A",
            "@multimediatype": "GIF image file",
            "@type": "IMAGE-THUMBNAIL",
            "@size": "13590",
            "@ref": "gr4",
            "@mimetype": "image/gif"
          },
          {
            "@category": "thumbnail",
            "@height": "110",
            "@width": "219",
            "@_fa": "true",
            "$": "https://api.elsevier.com/content/object/eid/1-s2.0-S0926860X22003854-gr1.sml?httpAccept=%2A%2F%2A",
            "@multimediatype": "GIF image file",
            "@type": "IMAGE-THUMBNAIL",
            "@size": "10935",
            "@ref": "gr1",
            "@mimetype": "image/gif"
          },
          {
            "@category": "thumbnail",
            "@height": "98",
            "@width": "219",
            "@_fa": "true",
            "$": "https://api.elsevier.com/content/object/eid/1-s2.0-S0926860X22003854-gr2.sml?httpAccept=%2A%2F%2A",
            "@multimediatype": "GIF image file",
            "@type": "IMAGE-THUMBNAIL",
            "@size": "9726",
            "@ref": "gr2",
            "@mimetype": "image/gif"
          },
          {
            "@category": "thumbnail",
            "@height": "118",
            "@width": "219",
            "@_fa": "true",
            "$": "https://api.elsevier.com/content/object/eid/1-s2.0-S0926860X22003854-ga1.sml?httpAccept=%2A%2F%2A",
            "@multimediatype": "GIF image file",
            "@type": "IMAGE-THUMBNAIL",
            "@size": "10540",
            "@ref": "ga1",
            "@mimetype": "image/gif"
          },
          {
            "@category": "high",
            "@height": "1188",
            "@width": "2661",
            "@_fa": "true",
            "$": "https://api.elsevier.com/content/object/eid/1-s2.0-S0926860X22003854-gr9_lrg.jpg?httpAccept=%2A%2F%2A",
            "@multimediatype": "JPEG image file",
            "@type": "IMAGE-HIGH-RES",
            "@size": "211120",
            "@ref": "gr9",
            "@mimetype": "image/jpeg"
          },
          {
            "@category": "high",
            "@height": "1250",
            "@width": "2661",
            "@_fa": "true",
            "$": "https://api.elsevier.com/content/object/eid/1-s2.0-S0926860X22003854-gr7_lrg.jpg?httpAccept=%2A%2F%2A",
            "@multimediatype": "JPEG image file",
            "@type": "IMAGE-HIGH-RES",
            "@size": "196852",
            "@ref": "gr7",
            "@mimetype": "image/jpeg"
          },
          {
            "@category": "high",
            "@height": "1272",
            "@width": "2661",
            "@_fa": "true",
            "$": "https://api.elsevier.com/content/object/eid/1-s2.0-S0926860X22003854-gr8_lrg.jpg?httpAccept=%2A%2F%2A",
            "@multimediatype": "JPEG image file",
            "@type": "IMAGE-HIGH-RES",
            "@size": "184038",
            "@ref": "gr8",
            "@mimetype": "image/jpeg"
          },
          {
            "@category": "high",
            "@height": "1132",
            "@width": "2661",
            "@_fa": "true",
            "$": "https://api.elsevier.com/content/object/eid/1-s2.0-S0926860X22003854-gr5_lrg.jpg?httpAccept=%2A%2F%2A",
            "@multimediatype": "JPEG image file",
            "@type": "IMAGE-HIGH-RES",
            "@size": "203581",
            "@ref": "gr5",
            "@mimetype": "image/jpeg"
          },
          {
            "@category": "high",
            "@height": "1184",
            "@width": "1663",
            "@_fa": "true",
            "$": "https://api.elsevier.com/content/object/eid/1-s2.0-S0926860X22003854-gr6_lrg.jpg?httpAccept=%2A%2F%2A",
            "@multimediatype": "JPEG image file",
            "@type": "IMAGE-HIGH-RES",
            "@size": "219925",
            "@ref": "gr6",
            "@mimetype": "image/jpeg"
          },
          {
            "@category": "high",
            "@height": "1384",
            "@width": "1497",
            "@_fa": "true",
            "$": "https://api.elsevier.com/content/object/eid/1-s2.0-S0926860X22003854-gr3_lrg.jpg?httpAccept=%2A%2F%2A",
            "@multimediatype": "JPEG image file",
            "@type": "IMAGE-HIGH-RES",
            "@size": "93554",
            "@ref": "gr3",
            "@mimetype": "image/jpeg"
          },
          {
            "@category": "high",
            "@height": "1180",
            "@width": "1497",
            "@_fa": "true",
            "$": "https://api.elsevier.com/content/object/eid/1-s2.0-S0926860X22003854-gr4_lrg.jpg?httpAccept=%2A%2F%2A",
            "@multimediatype": "JPEG image file",
            "@type": "IMAGE-HIGH-RES",
            "@size": "214888",
            "@ref": "gr4",
            "@mimetype": "image/jpeg"
          },
          {
            "@category": "high",
            "@height": "1251",
            "@width": "2495",
            "@_fa": "true",
            "$": "https://api.elsevier.com/content/object/eid/1-s2.0-S0926860X22003854-gr1_lrg.jpg?httpAccept=%2A%2F%2A",
            "@multimediatype": "JPEG image file",
            "@type": "IMAGE-HIGH-RES",
            "@size": "289771",
            "@ref": "gr1",
            "@mimetype": "image/jpeg"
          },
          {
            "@category": "high",
            "@height": "1568",
            "@width": "3493",
            "@_fa": "true",
            "$": "https://api.elsevier.com/content/object/eid/1-s2.0-S0926860X22003854-gr2_lrg.jpg?httpAccept=%2A%2F%2A",
            "@multimediatype": "JPEG image file",
            "@type": "IMAGE-HIGH-RES",
            "@size": "307947",
            "@ref": "gr2",
            "@mimetype": "image/jpeg"
          },
          {
            "@category": "high",
            "@height": "886",
            "@width": "1641",
            "@_fa": "true",
            "$": "https://api.elsevier.com/content/object/eid/1-s2.0-S0926860X22003854-ga1_lrg.jpg?httpAccept=%2A%2F%2A",
            "@multimediatype": "JPEG image file",
            "@type": "IMAGE-HIGH-RES",
            "@size": "180433",
            "@ref": "ga1",
            "@mimetype": "image/jpeg"
          },
          {
            "@category": "standard",
            "@_fa": "true",
            "$": "https://api.elsevier.com/content/object/eid/1-s2.0-S0926860X22003854-mmc1.docx?httpAccept=%2A%2F%2A",
            "@multimediatype": "Microsoft Word file",
            "@type": "APPLICATION",
            "@size": "1186798",
            "@ref": "mmc1",
            "@mimetype": "application/word"
          },
          {
            "@category": "thumbnail",
            "@_fa": "true",
            "$": "https://api.elsevier.com/content/object/eid/1-s2.0-S0926860X22003854-si0001.svg?httpAccept=%2A%2F%2A",
            "@multimediatype": "Scalable Vector Graphics file",
            "@type": "ALTIMG",
            "@size": "4445",
            "@ref": "si0001",
            "@mimetype": "image/svg+xml"
          },
          {
            "@category": "thumbnail",
            "@_fa": "true",
            "$": "https://api.elsevier.com/content/object/eid/1-s2.0-S0926860X22003854-si0002.svg?httpAccept=%2A%2F%2A",
            "@multimediatype": "Scalable Vector Graphics file",
            "@type": "ALTIMG",
            "@size": "5600",
            "@ref": "si0002",
            "@mimetype": "image/svg+xml"
          },
          {
            "@category": "standard",
            "@_fa": "true",
            "$": "https://api.elsevier.com/content/object/eid/1-s2.0-S0926860X22003854-am.pdf?httpAccept=%2A%2F%2A",
            "@multimediatype": "Acrobat PDF file",
            "@type": "AAM-PDF",
            "@size": "1485770",
            "@ref": "am",
            "@mimetype": "application/pdf"
          }
        ]
      },
      "link": {
        "@rel": "abstract",
        "@href": "https://api.elsevier.com/content/abstract/scopus_id/85138184448"
      }
    }
  }
}