{
  "metadata": {
    "title": "Study on the modification of unsupported hydrodesulfurization catalysts by the ZSM-5 zeolite nanoclusters",
    "authors": "; ; ",
    "journal": "Applied Catalysis A: General",
    "date": "2019-07-25",
    "doi": "10.1016/j.apcata.2019.117113",
    "abstract": "",
    "uri": "https://api.elsevier.com/content/article/pii/S0926860X19302674",
    "pii": "S0926860X19302674"
  },
  "fulltext": {
    "full-text-retrieval-response": {
      "scopus-eid": "2-s2.0-85067807266",
      "originalText": "serial JL 271346 291210 291744 291809 31 Applied Catalysis A: General APPLIEDCATALYSISAGENERAL 2019-06-21 2019-06-21 2019-06-25 2019-06-25 2019-07-03T16:52:19 1-s2.0-S0926860X19302674 S0926-860X(19)30267-4 S0926860X19302674 10.1016/j.apcata.2019.117113 S300 S300.1 FULL-TEXT 1-s2.0-S0926860X19X00113 2024-01-01T12:33:10.553292Z 0 0 20190725 2019 2019-06-21T12:50:33.4923Z absattachment articleinfo articlenumber articletitlenorm authfirstinitialnorm authfirstsurnamenorm cid cids contenttype copyright crossmark dateloaded dateloadedtxt datesearch datesort dateupdated dco docsubtype doctype doi eid ewtransactionid hubeid indexeddate issn issnnorm itemstage itemtransactionid itemweight openaccess openarchive pg pgfirst pii piinorm pubdatestart pubdatetxt pubyr sectiontitle sortorder srctitle srctitlenorm srctype ssids alllist content subj subheadings suppl tomb volfirst volissue volumelist webpdf webpdfpagecount yearnav figure table body mmlmath acknowledge affil articletitle auth authfirstini authfull authkeywords authlast grantnumber grantsponsor highlightsabst primabst ref specialabst 0926-860X 0926860X true 582 582 C Volume 582 22 117113 117113 117113 20190725 25 July 2019 2019-07-25 2019 Regular papers article fla © 2019 Elsevier B.V. All rights reserved. STUDYMODIFICATIONUNSUPPORTEDHYDRODESULFURIZATIONCATALYSTSBYZSM5ZEOLITENANOCLUSTERS DONG C 1 Introduction 2 Experimental 2.1 Synthesis of the catalysts 2.2 Characterization 2.3 Catalytic evaluation 3 Results and discussion 3.1 Synthesis and characterization of catalysts 3.2 Catalytic activity and acid properties 3.3 The structure of the sulfide active phase 4 Conclusions Acknowledgements References MORALESORTUNO 2016 127 139 J WANG 2015 269 284 X DU 2018 1100 1109 Y PAWELEC 2006 30 43 B PEREYMA 2018 162 170 V ZHOU 2018 152 163 W KLIMOV 2018 73 83 O SONG 2003 211 263 C STANISLAUS 2010 1 68 A MELLO 2018 66 74 M ZHAO 2010 3962 3967 A SONG 2003 207 238 C YE 2008 2343 2346 Z SHARIFVAGHEFI 2018 164 173 S EGOROVA 2004 417 427 M KAGAMI 2005 11 23 N CEDEOCAERO 2008 244 254 L PRABHU 2011 1 11 N YOOSUK 2010 52 61 B ZEPEDA 2014 108 121 T WANG 2009 31 43 H MICHAUD 1998 343 353 P PAWELEC 2004 155 166 B WU 2014 303 317 H WU 2018 55 64 Q GANIYU 2017 21943 21952 S KIRSCHHOCK 1999 4965 4971 C PROKESOVA 2003 1001 1005 P PROKESOVA 2003 165 174 P FRUNZ 2006 152 162 L LI 2018 56 66 Y LIU 2017 93 101 H LIU 2015 264 276 H BARAKOV 2016 1619 1632 R GRIEKEN 2000 135 147 R ZUO 2004 751 760 D YUFAN 2011 27 35 H MENDEZ 2017 479 491 F KLIMOV 2018 192 202 O AMAYA 2015 575 583 S LIU 2017 222 229 H DORONLEVIN 1996 4191 4197 S LAI 2013 8 16 W LIU 2016 493 507 H GOCHI 2005 531 536 Y YIN 2013 873 878 C ALI 2005 9451 9456 G ALTAMIRANO 2005 403 412 E TOPSOE 1983 386 401 N LIU 2012 50 56 X ZHAO 2016 564 569 R VRADMAN 2001 47 54 L HENSEN 2001 224 235 E DONGX2019X117113 DONGX2019X117113XC 2021-06-25T00:00:00.000Z 2021-06-25T00:00:00.000Z http://creativecommons.org/licenses/by-nc-nd/4.0/ © 2019 Elsevier B.V. All rights reserved. 2019-06-18T02:12:06.674Z http://vtw.elsevier.com/data/voc/AddOnTypes/50.7/eoas Natural Science Foundation of Shandong Province http://data.elsevier.com/vocabulary/SciValFunders/501100007129 http://sws.geonames.org/1814991 NSFC National Natural Science Foundation of China http://data.elsevier.com/vocabulary/SciValFunders/501100001809 http://sws.geonames.org/1814991 item S0926-860X(19)30267-4 S0926860X19302674 1-s2.0-S0926860X19302674 10.1016/j.apcata.2019.117113 271346 2024-01-01T12:33:10.553292Z 2019-07-25 1-s2.0-S0926860X19302674-main.pdf https://s3.amazonaws.com/prod-ucs-content-store-us-east/content/pii:S0926860X19302674/MAIN/application/pdf/113434251bf63f989950baa7dfb608be/main.pdf main.pdf pdf true 4631125 MAIN 9 1-s2.0-S0926860X19302674-main_1.png https://s3.amazonaws.com/prod-ucs-content-store-us-east/content/pii:S0926860X19302674/PREVIEW/image/png/7a91d13010d4ac029964446a29dcdadb/main_1.png main_1.png png 55681 849 656 IMAGE-WEB-PDF 1 1-s2.0-S0926860X19302674-gr4.sml https://s3.amazonaws.com/prod-ucs-content-store-us-east/content/pii:S0926860X19302674/gr4/THUMBNAIL/image/gif/ca313accde7f9e9ac3f3c60f14fb410b/gr4.sml gr4 gr4.sml sml 4306 164 112 IMAGE-THUMBNAIL 1-s2.0-S0926860X19302674-gr3.sml https://s3.amazonaws.com/prod-ucs-content-store-us-east/content/pii:S0926860X19302674/gr3/THUMBNAIL/image/gif/8bc2a5f797fe3cd007f484bd8b20a28b/gr3.sml gr3 gr3.sml sml 4983 164 119 IMAGE-THUMBNAIL 1-s2.0-S0926860X19302674-gr2.sml https://s3.amazonaws.com/prod-ucs-content-store-us-east/content/pii:S0926860X19302674/gr2/THUMBNAIL/image/gif/a7ad8eea19f2ba1fae9213977305736b/gr2.sml gr2 gr2.sml sml 20075 164 145 IMAGE-THUMBNAIL 1-s2.0-S0926860X19302674-ga1.sml https://s3.amazonaws.com/prod-ucs-content-store-us-east/content/pii:S0926860X19302674/ga1/THUMBNAIL/image/gif/a9a3dcaeed627ead7833c2ff64a6c347/ga1.sml ga1 true ga1.sml sml 6700 95 219 IMAGE-THUMBNAIL 1-s2.0-S0926860X19302674-gr1.sml https://s3.amazonaws.com/prod-ucs-content-store-us-east/content/pii:S0926860X19302674/gr1/THUMBNAIL/image/gif/6a9b0d3acba312023bd776e82a2b3eb8/gr1.sml gr1 gr1.sml sml 6022 163 111 IMAGE-THUMBNAIL 1-s2.0-S0926860X19302674-gr8.sml https://s3.amazonaws.com/prod-ucs-content-store-us-east/content/pii:S0926860X19302674/gr8/THUMBNAIL/image/gif/6ec6b8f5c2441e937eb83e5782b0ca34/gr8.sml gr8 gr8.sml sml 8164 152 219 IMAGE-THUMBNAIL 1-s2.0-S0926860X19302674-gr7.sml https://s3.amazonaws.com/prod-ucs-content-store-us-east/content/pii:S0926860X19302674/gr7/THUMBNAIL/image/gif/960bcfe9c846e317f8698cdfd2d09905/gr7.sml gr7 gr7.sml sml 14739 163 145 IMAGE-THUMBNAIL 1-s2.0-S0926860X19302674-gr6.sml https://s3.amazonaws.com/prod-ucs-content-store-us-east/content/pii:S0926860X19302674/gr6/THUMBNAIL/image/gif/75c3e1fe953e552f82df3433fe654de3/gr6.sml gr6 gr6.sml sml 4322 163 115 IMAGE-THUMBNAIL 1-s2.0-S0926860X19302674-gr5.sml https://s3.amazonaws.com/prod-ucs-content-store-us-east/content/pii:S0926860X19302674/gr5/THUMBNAIL/image/gif/dec0402a9a414f3189a55c11c46bae2e/gr5.sml gr5 gr5.sml sml 3667 164 115 IMAGE-THUMBNAIL 1-s2.0-S0926860X19302674-gr9.sml https://s3.amazonaws.com/prod-ucs-content-store-us-east/content/pii:S0926860X19302674/gr9/THUMBNAIL/image/gif/7daa7cb1c6610b09c792e7ab658babb2/gr9.sml gr9 gr9.sml sml 8743 151 219 IMAGE-THUMBNAIL 1-s2.0-S0926860X19302674-gr4.jpg https://s3.amazonaws.com/prod-ucs-content-store-us-east/content/pii:S0926860X19302674/gr4/DOWNSAMPLED/image/jpeg/42770254904eb16b0861a3564696f87f/gr4.jpg gr4 gr4.jpg jpg 41835 549 376 IMAGE-DOWNSAMPLED 1-s2.0-S0926860X19302674-gr3.jpg https://s3.amazonaws.com/prod-ucs-content-store-us-east/content/pii:S0926860X19302674/gr3/DOWNSAMPLED/image/jpeg/4d7c4be7eace2fce092e0b68a9cb2807/gr3.jpg gr3 gr3.jpg jpg 41381 517 376 IMAGE-DOWNSAMPLED 1-s2.0-S0926860X19302674-gr2.jpg https://s3.amazonaws.com/prod-ucs-content-store-us-east/content/pii:S0926860X19302674/gr2/DOWNSAMPLED/image/jpeg/0b7d8620bec93cf6fd207b035957c237/gr2.jpg gr2 gr2.jpg jpg 174115 636 562 IMAGE-DOWNSAMPLED 1-s2.0-S0926860X19302674-ga1.jpg https://s3.amazonaws.com/prod-ucs-content-store-us-east/content/pii:S0926860X19302674/ga1/DOWNSAMPLED/image/jpeg/fa391ab2f29f8806e7a493fafabbd02c/ga1.jpg ga1 true ga1.jpg jpg 24824 200 462 IMAGE-DOWNSAMPLED 1-s2.0-S0926860X19302674-gr1.jpg https://s3.amazonaws.com/prod-ucs-content-store-us-east/content/pii:S0926860X19302674/gr1/DOWNSAMPLED/image/jpeg/977229254073fe1a6d1b20f75f6e8aeb/gr1.jpg gr1 gr1.jpg jpg 57161 553 376 IMAGE-DOWNSAMPLED 1-s2.0-S0926860X19302674-gr8.jpg https://s3.amazonaws.com/prod-ucs-content-store-us-east/content/pii:S0926860X19302674/gr8/DOWNSAMPLED/image/jpeg/92ae97d1cd4f702d62b2a6480cf94c6c/gr8.jpg gr8 gr8.jpg jpg 25173 260 376 IMAGE-DOWNSAMPLED 1-s2.0-S0926860X19302674-gr7.jpg https://s3.amazonaws.com/prod-ucs-content-store-us-east/content/pii:S0926860X19302674/gr7/DOWNSAMPLED/image/jpeg/1aec2a8ad1fab939e463237310e7fcbc/gr7.jpg gr7 gr7.jpg jpg 165086 637 565 IMAGE-DOWNSAMPLED 1-s2.0-S0926860X19302674-gr6.jpg https://s3.amazonaws.com/prod-ucs-content-store-us-east/content/pii:S0926860X19302674/gr6/DOWNSAMPLED/image/jpeg/e08d43a6b45398a7514236d9ce984bc3/gr6.jpg gr6 gr6.jpg jpg 36055 533 376 IMAGE-DOWNSAMPLED 1-s2.0-S0926860X19302674-gr5.jpg https://s3.amazonaws.com/prod-ucs-content-store-us-east/content/pii:S0926860X19302674/gr5/DOWNSAMPLED/image/jpeg/8081fc346234c822533cc2d335f80e9c/gr5.jpg gr5 gr5.jpg jpg 35453 535 376 IMAGE-DOWNSAMPLED 1-s2.0-S0926860X19302674-gr9.jpg https://s3.amazonaws.com/prod-ucs-content-store-us-east/content/pii:S0926860X19302674/gr9/DOWNSAMPLED/image/jpeg/6b3931d20e8d629df9ab983912010622/gr9.jpg gr9 gr9.jpg jpg 26679 260 376 IMAGE-DOWNSAMPLED 1-s2.0-S0926860X19302674-gr4_lrg.jpg https://s3.amazonaws.com/prod-ucs-content-store-us-east/content/pii:S0926860X19302674/gr4/HIGHRES/image/jpeg/90c28931e3fe62316307e34d7d46766d/gr4_lrg.jpg gr4 gr4_lrg.jpg jpg 329770 2436 1667 IMAGE-HIGH-RES 1-s2.0-S0926860X19302674-gr3_lrg.jpg https://s3.amazonaws.com/prod-ucs-content-store-us-east/content/pii:S0926860X19302674/gr3/HIGHRES/image/jpeg/0eb8790d5614d163bce5358d07b464f8/gr3_lrg.jpg gr3 gr3_lrg.jpg jpg 305487 2291 1667 IMAGE-HIGH-RES 1-s2.0-S0926860X19302674-gr2_lrg.jpg https://s3.amazonaws.com/prod-ucs-content-store-us-east/content/pii:S0926860X19302674/gr2/HIGHRES/image/jpeg/afb22a188eef8c9c8e588cff13d92189/gr2_lrg.jpg gr2 gr2_lrg.jpg jpg 1965997 2816 2490 IMAGE-HIGH-RES 1-s2.0-S0926860X19302674-ga1_lrg.jpg https://s3.amazonaws.com/prod-ucs-content-store-us-east/content/pii:S0926860X19302674/ga1/HIGHRES/image/jpeg/7fac6128c6f2d61b98c8db74c335b284/ga1_lrg.jpg ga1 true ga1_lrg.jpg jpg 160441 886 2048 IMAGE-HIGH-RES 1-s2.0-S0926860X19302674-gr1_lrg.jpg https://s3.amazonaws.com/prod-ucs-content-store-us-east/content/pii:S0926860X19302674/gr1/HIGHRES/image/jpeg/382f832a50d9eb24e0de997db0359218/gr1_lrg.jpg gr1 gr1_lrg.jpg jpg 513063 2452 1667 IMAGE-HIGH-RES 1-s2.0-S0926860X19302674-gr8_lrg.jpg https://s3.amazonaws.com/prod-ucs-content-store-us-east/content/pii:S0926860X19302674/gr8/HIGHRES/image/jpeg/67e5bd0bebb858bae8909820e6028ee4/gr8_lrg.jpg gr8 gr8_lrg.jpg jpg 212663 1154 1667 IMAGE-HIGH-RES 1-s2.0-S0926860X19302674-gr7_lrg.jpg https://s3.amazonaws.com/prod-ucs-content-store-us-east/content/pii:S0926860X19302674/gr7/HIGHRES/image/jpeg/a873a45e8d52f269df7d3a0aa0e68095/gr7_lrg.jpg gr7 gr7_lrg.jpg jpg 2110505 2817 2500 IMAGE-HIGH-RES 1-s2.0-S0926860X19302674-gr6_lrg.jpg https://s3.amazonaws.com/prod-ucs-content-store-us-east/content/pii:S0926860X19302674/gr6/HIGHRES/image/jpeg/bf609eab4233142d3b665491fc754569/gr6_lrg.jpg gr6 gr6_lrg.jpg jpg 285133 2363 1667 IMAGE-HIGH-RES 1-s2.0-S0926860X19302674-gr5_lrg.jpg https://s3.amazonaws.com/prod-ucs-content-store-us-east/content/pii:S0926860X19302674/gr5/HIGHRES/image/jpeg/5cc89e92b9c13ad5a802508dd7d20e8e/gr5_lrg.jpg gr5 gr5_lrg.jpg jpg 266239 2374 1667 IMAGE-HIGH-RES 1-s2.0-S0926860X19302674-gr9_lrg.jpg https://s3.amazonaws.com/prod-ucs-content-store-us-east/content/pii:S0926860X19302674/gr9/HIGHRES/image/jpeg/c6e5b8e07211dc9ac0641fbdf7132c42/gr9_lrg.jpg gr9 gr9_lrg.jpg jpg 228252 1151 1667 IMAGE-HIGH-RES 1-s2.0-S0926860X19302674-si7.gif https://s3.amazonaws.com/prod-ucs-content-store-us-east/content/pii:S0926860X19302674/STRIPIN/image/gif/0a3e00484aeb3b80f16ef70d694b3e90/si7.gif si7 si7.gif gif 688 40 209 ALTIMG 1-s2.0-S0926860X19302674-si6.gif https://s3.amazonaws.com/prod-ucs-content-store-us-east/content/pii:S0926860X19302674/STRIPIN/image/gif/23212cf6e0836cfdbe1436537d45751a/si6.gif si6 si6.gif gif 1247 43 339 ALTIMG 1-s2.0-S0926860X19302674-si1.gif https://s3.amazonaws.com/prod-ucs-content-store-us-east/content/pii:S0926860X19302674/STRIPIN/image/gif/ed0611961636e489226060a68b6a8f2a/si1.gif si1 si1.gif gif 686 52 195 ALTIMG 1-s2.0-S0926860X19302674-si2.gif https://s3.amazonaws.com/prod-ucs-content-store-us-east/content/pii:S0926860X19302674/STRIPIN/image/gif/d2973c924faeb81bcae482fd3530c595/si2.gif si2 si2.gif gif 738 52 204 ALTIMG 1-s2.0-S0926860X19302674-si5.gif https://s3.amazonaws.com/prod-ucs-content-store-us-east/content/pii:S0926860X19302674/STRIPIN/image/gif/7f848bbc6ee2e7f9ffb988566a95979e/si5.gif si5 si5.gif gif 910 41 285 ALTIMG 1-s2.0-S0926860X19302674-si4.gif https://s3.amazonaws.com/prod-ucs-content-store-us-east/content/pii:S0926860X19302674/STRIPIN/image/gif/7f1bc0b313eeb4fc133e5068d4b3521a/si4.gif si4 si4.gif gif 443 33 141 ALTIMG 1-s2.0-S0926860X19302674-si3.gif https://s3.amazonaws.com/prod-ucs-content-store-us-east/content/pii:S0926860X19302674/STRIPIN/image/gif/4d5ed668d36b24f27b04e106f6fd1a45/si3.gif si3 si3.gif gif 969 80 192 ALTIMG 1-s2.0-S0926860X19302674-am.pdf am am.pdf pdf 902480 AAM-PDF https://s3-eu-west-1.amazonaws.com/prod-ucs-content-store-eu-west/content/egi:10PRT95DZKX/MAIN/application/pdf/9989bb37df30a47ae92d2b9d57c48a6d/am.pdf https://s3.amazonaws.com/prod-ucs-content-store-us-east/content/egi:10PRT95DZKX/MAIN/application/pdf/9989bb37df30a47ae92d2b9d57c48a6d/am.pdf APCATA 117113 117113 S0926-860X(19)30267-4 10.1016/j.apcata.2019.117113 Elsevier B.V. Fig. 1 XRD patterns of different unsupported Ni-Mo catalysts. Fig. 1 Fig. 2 SEM of unsupported Ni-Mo catalysts modified by ZSM-5 zeolite nanoclusters. Fig. 2 Fig. 3 The pore size distribution of different unsupported Ni-Mo catalysts. Fig. 3 Fig. 4 FT-IR of different unsupported Ni-Mo catalysts. Fig. 4 Fig. 5 H2-TPR of unsupported Ni-Mo catalyst before and after modification. Fig. 5 Fig. 6 Py-IR spectra of unsupported Ni-Mo catalyst before and after modification. Fig. 6 Fig. 7 The TEM of sulfided unsupported Ni-Mo catalysts. Fig. 7 Fig. 8 Distributions of slab length of MoS2 particles on different unsupported Ni-Mo catalysts. Fig. 8 Fig. 9 Distributions of stacking layer number of MoS2 particles on different unsupported Ni-Mo catalysts. Fig. 9 Table 1 Pore structure properties of unsupported Ni-Mo catalyst modified by ZSM-5 zeolite nanoclusters. Table 1 Sample SBET a (m2·g-−1) VP b (cm3·g−1) DP c (nm) NiMo-1.5 67.2 0.09 3.99 Z5-NiMo-10 g 160.7 0.15 3.50 Z5-NiMo-20 g 159.5 0.26 5.15 Z5-NiMo-30 g 159.1 0.31 6.08 Z5-NiMo-10 h 145.8 0.31 6.31 Z5-NiMo-14 h 166.1 0.26 5.01 Z5-NiMo-18 h 172.4 0.21 4.25 Z5-NiMo-24 h 159.5 0.26 5.15 a SBET: BET surface area. b VP: Pore volume, calculated by the BJH method. c Dp: Average pore diameter, calculated by the BJH method from the desorption branch of the isotherms. Table 2 Hydrodesulfurization product distributions of DBT for different unsupported Ni-Mo catalysts. Table 2 Sample BP CHB BCH ICHB IBCH YHDS ConvDBT HYD/DDS NiMo-1.5 0 41.9 24.3 21.1 12.7 3.53 100.0 － Z5-NiMo-10 g 3.9 16.7 6.3 30.2 38.7 3.46 98.1 6.5 Z5-NiMo-20 g 16.8 36.1 6.2 5.2 3.7 2.46 69.6 2.6 Z5-NiMo-30 g 17.8 32.0 3.2 1.8 2.6 2.09 59.3 2.1 Z5-NiMo-10 h 19.0 26.9 4.1 1.7 4.8 2.07 58.7 1.8 Z5-NiMo-14 h 31.3 47.8 7.6 2.8 10.1 3.53 100.0 1.8 Z5-NiMo-18 h 19.2 36.1 7.7 5.4 6.8 2.69 76.1 2.3 Z5-NiMo-24h 16.8 36.1 6.2 5.2 3.7 2.46 69.6 2.6 BP: Biphenyl. CHB: Cyclohexylbenzene. BCH: Bicyclohexane. YHDS: The space time yield (mol/mL (cat.)·h/10−4). ICHB: Isomer of Cyclohexylbenzene (Molecular weight 160). IBCH: Isomer of Bicyclohexane (Molecular weight 166). Table 3 Amounts and distributions of Lewis and Brønsted acid sites of different catalysts (mmol/g). Table 3 Sample L (1447 cm−1) B (1540 cm−1) L + B (1488 cm−1) NiMo-1.5 0.137 0 0.083 Z5-NiMo-10 g 0.433 0 0.138 Z5-NiMo-20 g 0.414 0 0.119 Z5-NiMo-30 g 0.396 0 0.106 Z5-NiMo-10 h 0.429 0 0.151 Z5-NiMo-14 h 0.518 0 0.167 Z5-NiMo-18 h 0.425 0 0.141 Z5-NiMo-24 h 0.414 0 0.119 Table 4 The average slab length (LA) and stacking layer number (NA) of MoS2. Table 4 Sample LA/ nm NA f Mo NiMo-1.5 10.2 5.4 0.11 Z5-NiMo-10 g 7.8 5.7 0.15 Z5-NiMo-20 g 10.3 3.9 0.12 Z5-NiMo-30 g 10.3 3.4 0.12 Z5-NiMo-10 h 11.3 3.5 0.11 Z5-NiMo-14 h 10.3 4.6 0.12 Z5-NiMo-18 h 10.0 4.1 0.12 Z5-NiMo-24 h 10.3 3.9 0.12 Study on the modification of unsupported hydrodesulfurization catalysts by the ZSM-5 zeolite nanoclusters Chengwu Dong Changlong Yin ⁎ Tongtong Wu Zhuyan Wu Dong Liu Chenguang Liu State Key Laboratory of Heavy Oil Processing, Key Laboratory of Catalysis, China National Petroleum Corporation (CNPC), China University of Petroleum, Qingdao, Shandong, 266580, China State Key Laboratory of Heavy Oil Processing Key Laboratory of Catalysis China National Petroleum Corporation (CNPC) China University of Petroleum Qingdao Shandong 266580 China ⁎ Corresponding author. Graphical abstract The influence of ZSM-5 zeolite nanoclusters on the unsupported Ni-Mo catalyst was investigated by correlating their physicochemical properties with the hydrodesulfurization (HDS) activity of dibenzothiophene (DBT). The physicochemical properties of the catalysts before and after modification were characterized by N2 adsorption-desorption, XRD, SEM, FT-IR, H2-TPR, Py-IR, and HRTEM techniques. Results showed that the specific surface area and Lewis acid of the unsupported Ni-Mo catalyst were improved obviously after modification, which indicate that the ZSM-5 zeolite nanoclusters were successfully introduced into the unsupported Ni-Mo catalysts. Besides, DBT HDS results revealed that the catalysts Z5-NiMo-10 g and Z5-NiMo-14h exhibited high hydrodesulfurization activity (the desulfurization rate of 98.1% and 100.0%, respectively). In particular, the catalyst Z5-NiMo-10 g produced the highest isomerization rate of 68.9% due to more dispersed structure and suitable acidity. Keywords Unsupported Ni-Mo catalysts ZSM-5 zeolite nanoclusters Surface modification Hydrodesulfurization 1 Introduction The sulfur-containing compounds and the polyaromatics in the diesel are gradually increasing due to the inferior quality of the crude oil [1–3]. And the higher polyaromatics and sulfur-containing impurities can seriously affect the combustion performance of the diesel [4,5], which can cause serious air pollution [6,7]. Thereby, all countries of the world have set more and more stringent standards for the content of sulfur-containing impurities and polyaromatics in diesel [8–10]. Hydrodesulfurization (HDS) and Hydrodearomatization (HDAr) are the most traditional impurity removal methods [11–14], and most of the industrialized hydrogenation catalysts can only realize simple hydrogenation for these impurities, but the proper cracking and isomerization of the hydrogenation products can't be realized. For example, the complex sulfur-containing impurities are hydrogenated to generate more cycloalkanes with benzene rings, not the simple cycloalkanes with branched chains [15,16], which can only reduce the sulfur content of the diesel, but is not favorable for the improvement of the diesel quality, so developing a bifunctional catalyst with higher hydrogenation activity and moderate cracking or isomerization performance is very necessary. The diesel hydro treating catalysts mainly include two types, supported and unsupported hydro treating catalysts [17–19], and the HDS of the complex benzothiophene impurities usually includes two different pathways, which are direct desulfurization pathway (DDS) and hydrodesulfurization pathway (HYD) [20,21], respectively. The supported catalysts are mainly based on direct desulfurization path with the main products of biphenyl (BP) and its derivatives. The pathway has higher desulfurization efficiency, but more aromatics are produced, which is not conducive to the improvement of diesel quality. However the HYD is the main reaction pathway for the unsupported hydrogenation catalyst with more products of cyclohexylbenzene (CHB) and bichlorocyclohexane (BCH), which reduce the content of aromatics, but have no great contribution to the increase of cetane number of diesel. For unsupported hydrogenation catalyst, more cycloalkanes can be produced because of higher hydrogenation activity, but the weak acidity limits its cracking and isomerization activity. So the zeolites such as ZSM-5, Y, Beta, and HMS with strong acidity were used to modify the hydrogenation catalyst to improve the acidity of hydrogenation catalyst [20,22–25]. The results showed that the acidity of the catalyst modified by zeolites was improved obviously. However, the hydrogenation activity of the catalyst was limited due to the limited loading of the active components. In addition, DDS became the main desulfurization pathway to produce more BP and its derivatives, which was difficult to be further hydrogenated deeply. Furthermore, the modified catalysts were easier to coking and deactivation because of the strong acidity of the zeolite, which is unfavorable to the stable industrial production. To improve the acidity of hydrogenation catalyst, Saheed A. Ganiyu et al. [26] synthesized the Ti-SBA-15-NiMo composite catalyst to compound the hydrogenation active component with the weak acidic Ti-SBA-15 zeolite by one-pot method. Results showed that the catalyst prepared by this method could not realize the deep hydrogenation of complex benzothiophene impurities due to its strict synthesis conditions and the difficulty of forming hydrogenation active phase, only more BP and CHB can be produced, which is unfavorable to the increase of cetane number of diesel oil. In our previous studies, the zeolite was mixed directly with the unsupported hydrogenation catalyst precursor. The results showed that the composite catalysts had lower strength and uneven acid distribution, which were not conducive to industrial application. As the secondary structure unit of the zeolite, the zeolite precursor was studied by many scholars and modified with it. Christine E. A. Kirschhock et al. [27] studied the polymerization process of MFI zeolite precursors by NMR and in situ infrared spectroscopy. The results showed that the formation of zeolite was the result of the ordered binding and growth of the zeolite precursors. P. Prokešová et al. [28,29] also studied the change of particle size of the zeolite precursors before and after hydrothermal treatment by DLS technique. The results showed that the zeolite was gradually polymerized by the zeolite primary structure unit, and found that the zeolite precursor had a very small size (nanometer level). Lukas Frunz et al. [30] encapsulated the ZSM-5 zeolite precursor into the mesoporous zeolite structure to make the zeolite precursor grow in the mesoporous structure to improve the acidity of the mesoporous zeolite. The results showed that the ZSM-5 zeolite precursor could grow into zeolite structure in the mesoporous structure, which could effectively improve the acidity of mesoporous zeolite. A novel FDU-12 mesoporous composite assembled by ZSM-5 nanoclusters was synthesized by Yuyang Li et al. [31], and the hydro treating performance for DBT and FCC diesel was studied. The results showed that the catalyst modified by ZSM-5 nanoclusters achieved the higher hydro treating activity due to its larger specific surface area and the appropriate acidic properties. Overall, the studies for zeolite nanoclusters were mainly focused on the supported catalysts, while the modification of the unsupported catalysts by nanoclusters was rarely studied. In this paper, we combined the ZSM-5 zeolite nanoclusters with the unsupported hydrogenation catalyst to prepare the bifunctional hydrogenation catalysts with strong acidity and hydrogenation performance. 2 Experimental 2.1 Synthesis of the catalysts The catalysts were synthesized according to the following steps [32,33], and all reagents were purchased from Sinopharm Chemical Reagent Company (PR China) without any further purification. Typically, 150 mL deionized water was heated to 50 °C in a flask firstly. Then the proper amount of nickel nitrate hexahydrate (Ni(NO3)2 6H2O) was slowly added into the flask and stirred. When the temperature reached to 93 °C, ammonium heptamolybdate solution ((NH4)6Mo7O24 4H2O) (molar ratio Ni:Mo = 1.5) was added. When the temperature was stabilized to 93 °C, the ammonium hydroxide (28.8% NH3) was added under stirring until the solution became clear and stopped dropping, finally the pH of the clear solution was about 12, and the clear solution was further heated at 93 °C for 10 h to obtain the turbid liquid A. The turbid liquid was isolated by vacuum filtration, washed with deionized water, and dried 12 h at 100 °C and atmospheric pressure to get the unsupported Ni-Mo catalyst precursor. The precursors were calcined at 350 °C for 4 h to get the unsupported Ni-Mo catalyst. The obtained catalyst was labeled as NiMo-1.5. The ZSM-5 zeolite precursor was synthesized according to the previously reported conditions with some modification [34,35]. The molar composition of various raw materials was as follows: 1.0SiO2: 0.005Al2O3: 0.45TPAOH: 35H2O. In short, aluminium isopropoxide (Al(OiPr)3, 98 wt%) was dissolved in an aqueous solution of tetrapropylammonium hydroxide (TPAOH, 25 wt%) and stirred at room temperature until completely dissolved, the tetraethyl orthosilicate (TEOS, 98 wt%) and deionized water were added, the resulting mixture was stirred until the solution became clear again. The clear solution was added into Teflon-lined stainless steel autoclave and crystallized at 160 °C for 10, 14, 18, and 24 h, respectively. The ZSM-5 zeolite precursor was obtained. 20 g ZSM-5 zeolite precursor with crystallization for 10, 14, and 18 h respectively were dripped into turbid liquid A to study the effect of different crystallization time. 10, 20, and 30 g (for the final modified catalyst, the acidic components accounted for 5.5%, 10.5%, and 15.0%, and the active metal content accounted for 94.5% (Ni: 56.7%, Mo: 37.8%), 89.5% (Ni: 53.7%, Mo: 35.8%), and 85.0% (Ni: 51.0%, Mo: 34.0%), respectively) ZSM-5 zeolite precursor with the crystallization time of 24 h respectively were dripped into turbid liquid A to study the effect of different amount of precursor. The mixture was stirred for overnight, and the products were filtered and washed with deionized water for many times, then the catalyst precursor powder was obtained by drying at 100 °C for 12 h. The precursor powders were tableted and then pulverized them into 20–40 mesh, calcined at 350 °C for 4 h to obtain the modified unsupported hydrogenation catalysts. The obtained catalysts were labeled as Z5-NiMo-10 h, Z5-NiMo-14 h, Z5-NiMo-18 h, Z5-NiMo-10 g, Z5-NiMo-20 g, and Z5-NiMo-30 g, respectively. 2.2 Characterization The textural and structural properties were measured by a Tristar3000 multifunctional adsorption instrument (Mike Corporation, USA). The catalysts were treated at 300 °C in vacuum to remove the gas before the measurement, and the N2 adsorption-desorption temperature was −196 °C. The FT-IR and Py-IR of all catalysts were analyzed by a Nexus infrared spectrometer (Nicolet). KBr was used as the background for the FT-IR analysis. The crystal phase of the catalysts was detected by X-ray diffraction (XRD) on an X’Pert Pro MPD instrument with Cu Kα. The H2 temperature programmed reduction (H2-TPR) of all catalysts was performed on a Micromeritics AutoChem HP 2950 Chemisorption Analyzer (made in USA) with a thermal conductivity detector (TCD). The morphology of the modified catalyst was observed by using a S-4800 cold field emission scanning electron microscope (Hitachi Company, Japan), and the morphology of the sulfurized catalyst was observed by a JEM-2100 high resolution electron transmission microscope (Hitachi Company, Japan), the average slab length (LA) and stacking layer number (NA) of MoS2 were also calculated by statistical analyses according to about 15 micrographs, including 200 slabs taken from different parts of each catalyst. The Mo atoms dispersion of the edge surface of MoS2 slabs was also calculated. The equations are as follows [36–39]: (1) L A = ∑ i = 1 t n i L i / ∑ i = 1 t n i (2) N A = ∑ i = 1 t n i N i / ∑ i = 1 t n i (3) f M o = ∑ i = 1 n ( 6 x i − 6 ) ∑ i = 1 n ( 3 x i 2 − 3 x i + 1 ) (4) L =3.2(2 x i -1)Å Where, Li is the slab length, ni of Eq. (1) presents the number of MoS2 slabs whose slab length is Li. Ni represents the stacking layer number, ni of Eq. (2) is the number of MoS2 units whose stacking layer number is Ni. And where xi is the number of atoms along one edge of a MoS2 slab determined from Eq. (4), and n is the total number of MoS2 slabs shown in the TEM micrographs. 2.3 Catalytic evaluation The catalytic activities of all catalysts were evaluated using 1.0 wt% DBT in petroleum ether solution. The reactions were carried out in a fixed-bed down-flow high-pressure micro reactor (10 mm diameter and 400 mm in length) loaded with 1 mL of 20–40 mesh catalysts (bulk density is about 0.95 g/cm3) diluted with the same mesh quartz sand to 3 mL. Before reaction, the catalysts were in situ presulfided for 8 h using a 3.0 wt.% CS2/petroleum ether solution at 330 °C at a H2 pressure of 3.0 MPa and with a liquid hourly space velocity (LHSV) of 6 h−1 and a H2/Oil ratio of 300. After that, 1.0 wt.% DBT/petroleum ether solution was pumped into the reactor as the feed with a total pressure of 3.0 MPa, with a reaction temperature of 280 °C, with a H2/Oil ratio of 300, with a liquid hourly space velocity (LHSV) of 10 h−1, and the samples were collected after 6 h of stabilization, analyzed by a Varian 3800 gas chromatography. In addition, to estimate the selectivities of the two hydrodesulfurization routes (HYD and DDS), the following Eqs. (5) and (6) were employed [40]. The space time yield of the catalyst was calculated by the formula (7). (5) DDS = BP × 100 % THDBT+HHDBT+BP+CHB+BCH (6) HYD = ( THDBT + HHDBT + CHB + BCH ) × 100 % THDBT + HHDBT + BP + CHB + BCH (7) Y (A)= N V × Conv (A) Where, Y (A) is the space time yield of A (mol/(mL·h)), N is the moles of feed per hour (mol/h), Conv (A) represents the conversion of A, and V is the volume of catalyst (mL). 3 Results and discussion 3.1 Synthesis and characterization of catalysts A series of unsupported Ni-Mo catalysts modified by ZSM-5 zeolite nanoclusters with different crystallization time and amount were synthesized. The structure and morphology of the catalyst are important factor affecting its catalytic activity. In order to observe the structural changes of the unsupported Ni-Mo catalyst modified by ZSM-5 zeolite nanoclusters, the structure and morphology of the unsupported Ni-Mo catalyst before and after modification were studied by XRD and SEM. The XRD patterns of different unsupported Ni-Mo catalysts are shown in Fig. 1 . As shown in Fig. 1, the introduction of the ZSM-5 zeolite nanoclusters changes the catalyst precursor from the initial crystalline state to the nearly amorphous state. The reason is that the alkalinity of the ZSM-5 zeolite nanoclusters changes the structure of unsupported Ni-Mo catalyst precursor. In addition, for modified unsupported Ni-Mo catalysts, the weak characteristic diffraction peaks at 2θ = 23.1° was detected, it was the characteristic peaks of the ZSM-5 zeolite microcrystals, which was possible that the ZSM-5 zeolite nanoclusters were further crystallized after they were introduced into the unsupported Ni-Mo catalyst. Fig. 2 shows the SEM diagram of unsupported Ni-Mo catalysts modified by ZSM-5 zeolite nanoclusters. The catalyst Z5-NiMo-10 g is composed of some relatively small particles, the whole structure is relatively dense, and the pore distribution is more uniform. However, with the increase of the amount of zeolite nanoclusters, the structure of the catalyst becomes seriously aggregated, especially for the catalyst Z5-NiMo-30 g, the whole aggregation is more serious, which is not conducive to the formation of porous structures. For Z5-NiMo-10 h, the whole pore is like the honeycomb structure, while the pore structure of the catalyst Z5-NiMo-14 h and Z5-NiMo-18 h originates from the piling of the catalyst particles. Especially the catalyst Z5-NiMo-14 h shows a more developed pore distribution. The pore structures are also an important factor affecting catalytic activity. The higher pore volume and specific surface area are favorable for the uniform distribution of hydrogenation active site and acidic sites on the surface of the catalyst, which is beneficial to the continuous hydrogenation and isomerization reaction. The pore structure properties of unsupported Ni-Mo catalyst modified by ZSM-5 zeolite nanoclusters were detected and the results were shown in Table 1 and Fig. 3 . Table 1 shows the pore structure distribution of unsupported Ni-Mo catalysts modified by ZSM-5 zeolite nanoclusters. It is shown in the table that the specific surface area, pore volume, and average pore diameter of unsupported Ni-Mo catalysts modified by ZSM-5 zeolite nanoclusters increase significantly. And the specific surface area decreases with the increased introduction of nanoclusters. However, the pore volume and pore size show the opposite trend with the increase of the amount of nanoclusters. It is due to that some relatively small pores in the unsupported Ni-Mo catalyst are occupied by the nanoclusters with the increase of the amount of nanoclusters, which reduces the number of small pores in the catalyst, thus reducing the specific surface area of the catalyst. In addition, the specific surface area of the catalyst increases firstly and then decreases with the prolongation of crystallization time, which is the result of the decomposition of the template (TPAOH) in the catalyst. The longer the crystallization time is, the more templates are encapsulated in the nanoclusters, and when the templates are decomposed by heat, more pores will be produced, which will increase the specific surface area of the catalysts. However, if the crystallization time is too long, the nanoclusters will grow into larger particles. Larger nanoparticles will destroy the pore structure of the unsupported Ni-Mo catalyst, thus reducing the specific surface area of the catalyst. Fig. 3 shows the pore size distribution of different unsupported Ni-Mo catalysts. As shown in Fig. 3, the introduction of ZSM-5 zeolite nanoclusters broadened the pore size range of unsupported Ni-Mo catalysts, and the increase of the amount of ZSM-5 zeolite nanoclusters can expand the pore size of the catalyst, however the longer crystallization time can reduce the pore size of the catalyst, which is consistent with the results shown in Table 1. The skeleton structure and reducibility of unsupported Ni-Mo catalysts modified by ZSM-5 zeolite nanoclusters were studied by FT-IR and H2-TPR. And the results were shown in Figs. 4 and 5 . Fig. 4 shows the FT-IR spectra of the unsupported Ni-Mo catalysts before and after modification. The absorption bands of the unsupported Ni-Mo catalysts are observed at 1281, 1409, and 1600–2000 cm−1 before modification. The absorption band at 1281 cm−1 can be attributed to the Ni-O bonds, and the absorption band at 1409 cm−1 is the deformed H-N-H band for NH4 + [41,42], and the bands between 1600 and 2000 cm−1 can be assigned to the torsional vibration of the ammonium on the lattice site [41]. After modification, the absorption bands between 1200 and 1500 cm−1 almost completely disappear, indicating that the ammonium nickel moly date is easier to decompose into NiMoO4 structure after the introduction of ZSM-5 zeolite nanoclusters. In addition, the weak absorption band at 559 cm−1 appears for the catalysts modified by ZSM-5 zeolite nanoclusters, and the structure increases gradually with the increase of the nanoclusters amount and the prolongation of crystallization time. It is attributed to the five-member ring structure of ZSM-5 zeolite nanoclusters [34,35], which is also the source of zeolite acidity. The reducibility of unsupported Ni-Mo catalysts before and after modification was studied by H2-TPR. And the results are depicted in Fig. 5. There are two different hydrogen consumption peaks at about 400 and 450 °C for all catalysts. The peak at about 400 °C represents the reduction of nickel-containing species, and the peak at about 450 °C represents the reduction of molybdenum-containing species [43,44]. Compared with the unmodified catalyst, the hydrogen consumption peaks of nickel-containing species of the unsupported Ni-Mo catalysts modified by ZSM-5 zeolite nanoclusters shift to the lower temperature, while the hydrogen consumption peaks of molybdenum-containing species move to the higher temperature, which indicate that the introduction of ZSM-5 zeolite nanoclusters enhances the reducibility of nickel-containing species but decreases the reducibility of molybdenum-containing species. The active components of the unsupported Ni-Mo catalyst were dispersed by ZSM-5 zeolite nanoclusters, which distributed more n nickel-containing species to the surface of the catalyst which was conducive to the improvement of its reducibility. In addition, the FT-IR results showed that the unsupported Ni-Mo catalyst precursors were easier to decompose into NiMoO4 structure after the introduction of ZSM-5 zeolite nanoclusters, so the interaction between nickel-containing and molybdenum-containing species were enhanced, which would reduce the reducibility of molybdenum-containing species. 3.2 Catalytic activity and acid properties The catalytic activity of unsupported Ni-Mo catalyst before and after modification was studied by DBT HDS, and the product distributions were analyzed by GC–MS. In addition, the acid properties of the catalyst are related to its isomerization or cracking activity. Suitable Lewis acid and Brønsted acid can produce high isomerization and cracking activity, respectively. To study the effect of ZSM-5 zeolite nanoclusters on the acidity of unsupported Ni-Mo catalyst, the acid changes of unsupported Ni-Mo catalyst before and after modification were studied by Py-IR, and the results were shown in Fig. 6 and Table 3. Table 2 gives the distribution of DBT hydro desulfurization products over different unsupported Ni-Mo catalysts. The DBT conversion of the catalyst decreases with the increase of zeolite nanoclusters and increases first and then decreases with the prolongation of crystallization time. In addition, for the proportion of isomerization products (ICHB and IBCH), all catalysts have the smaller proportion than unmodified unsupported Ni-Mo catalyst (33.8%) except for the catalyst Z5-NiMo-10 g (68.9%), and the Z5-NiMo-10 g has also the higher IBCH than NiMo-1.5, indicating that the Z5-NiMo-10 g has the highest isomerization activity in all catalysts. The isomerization activity of the catalyst is related to its acidity, the suitable acidity can produce higher isomerization activity. As shown in Fig. 6 and Table 3, all catalysts have only Lewis acid sites but no Brønsted acid sites, the reason is that the Brønsted acid of zeolite nanoclusters is weaker than zeolite, a small number of zeolite nanoclusters may be distributed inside the unsupported Ni-Mo catalyst which could not be detected by Py-IR, and it is also possible that the Brønsted acid sites of the zeolite nanoclusters may be destroyed in the process of the reaction. The Lewis acid sites of the modified unsupported Ni-Mo catalysts were significantly enhanced after the introduction of ZSM-5 zeolite nanoclusters, thus its isomerization activity was improved. However, with the increase of the ZSM-5 zeolite nanoclusters, more active sites of unsupported Ni-Mo catalyst were covered by the ZSM-5 zeolite nanoclusters, which decreased the hydrogenation performance of the catalysts, at the same time, the isomerization activity of the catalyst was also limited. For example, for the catalyst Z5-NiMo-14 h, although it produced higher DBT desulfurization activity (100.0%), more biphenyls (31.3%) were produced during the reaction, and the desulfurization selectivity (HYD/DDS) was lower (only 1.8) than the catalyst Z5-NiMo-10 g (6.5), which indicated that the Z5-NiMo-10 g was more inclined to hydrogenolysis pathway than others. Furthermore, the hydrodesulphurization activity of the catalyst are related to Lewis acid, and the stronger Lewis acid can produce higher hydro desulfurization activity [22]. The Py-IR results showed that the Lewis acid of the unsupported Ni-Mo catalysts modified by nanoclusters was obviously enhanced. In particular, the catalyst Z5-NiMo-10 g has high Lewis acid content. It is also the reason for its higher hydrodesulphurization activity. 3.3 The structure of the sulfide active phase HRTEM was used to observe the change of the sulfide active phase to analyze the effect of ZSM-5 zeolite nanoclusters on the active phase of unsupported Ni-Mo catalyst. Besides, the slab length and stacking layer number of MoS2 were counted. And the average slab length (LA) and stacking layer number (NA) of MoS2 were also calculated. Fig. 7 presents the HRTEM diagram of the sulfide unsupported Ni-Mo catalysts. As shown in the figure, the black stripes with a spacing of about 0.6 nm are found in the HRTEM diagrams of all samples, which can be attributed to the structure of the MoS2 crystal [45,46]. In addition, the stripes with a spacing of approximately 0.3 nm can also be found in the catalyst Z5-NiMo-10 g, which can be attributed to the Ni3S2 crystal structure [47]. Efraín Altamirano et al. [48] found that MoS2 and Ni3S2 nanoparticles could be produced simultaneously by decomposition of \"NiMoS\" phase (NiMoS→Ni3S2+MoS2), and the nanoparticles of MoS2 and Ni3S2 were found in Z5-NiMo-10 g simultaneously, indicating that there are the \"NiMoS\" active phases in Z5-NiMo-10 g. Topsøe et al. [49] proposed that \"NiMoS\" phase played an important role in the hydrodesulfurization reaction of the catalyst, and the image of \"NiMoS\" phase had been detected by the advanced technique of scanning tunnel microscopy (STM). And they also found that the \"NiMoS\" active phase could produce higher hydrogenation activity than the MoS2 active phase. In addition, it was found that the \"NiMoS\" active phase could be divided into two types: NiMoS (I) and NiMoS (II), respectively. For the supported Ni-Mo catalyst, NiMoS (I) can easily be formed due to the strong interaction between the metal active phase and the support. For the unsupported Ni-Mo catalyst, NiMoS (II) is the Main active phase, and NiMoS (II) has stronger hydrogenation activity than that of NiMoS (I). Furthermore, the hydrogenation activity of sulfided unsupported Ni-Mo catalyst is also related to the slab length and the stacking layer number of MoS2 [50]. The shorter slab length and the more stacking layer number can produce higher hydrogenation activity [51–53]. The statistical results of the slab length and stacking layer number of MoS2 crystal phase are shown in Figs. 8 and 9 . The slab length and stacking layer number of NiMo-1.5, Z5-NiMo-10 g, and Z5-NiMo-14 h are mainly 7–9 nm and 4–8 layers, while other catalysts are mainly 10–12 nm and 2–5 layers, which show that NiMo-1.5, Z5-NiMo-10 g, and Z5-NiMo-14 h have the shorter slab length and more stacking layer number. Besides, the average slab length and the average stacking layer number of all catalysts were also calculated, and the results are shown in Table 4 . As shown in Table 4, the catalyst Z5-NiMo-10 g shows the shortest average slab length (7.8 nm) and the maximum average stacking layer number (5.7), indicating that the Z5-NiMo-10 g will have higher hydrogenation activity, which is consistent with the catalytic activity evaluation results (Table 2). The frequency (f Mo) of the side active phase (MoS2) was also calculated, the results are listed in Table 4. The catalyst Z5-NiMo-10 g also shows the highest f Mo (0.15), indicating that the Z5-NiMo-10 g has more side angle active phase (MoS2). It is beneficial to improve the contact probability between the sulfur-containing impurities and the active sites of the catalyst, thus to improve the hydro desulfurization activity of the catalyst. 4 Conclusions The unsupported Ni-Mo catalyst was modified by the ZSM-5 zeolite nanoclusters. BET and SEM results show that the introduction of the ZSM-5 zeolite nanoclusters can obviously increase the specific surface area of the unsupported Ni-Mo catalysts, and the structure of modified catalysts can become more loose and porous. FT-IR results show that the unsupported Ni-Mo catalyst precursor (ammonium nickel moly date) is easier to decompose into NiMoO4 structure after the introduction of ZSM-5 zeolite nanoclusters. Py-IR results reveal that the Lewis acid site of all catalysts modified by the ZSM-5 zeolite nanoclusters is obviously improved. DBT hydrodesulphurization results reveal that the Z5-NiMo-10 g achieves the higher hydrogenation activity (a DBT desulfurization rate of 98.1% and an isomerization rate of 68.9%) due to more dispersed structure and suitable acidity. Acknowledgements This work was financially supported by the National Natural Science Fund of China (Grant No. 21676301), Shandong Province Natural Science Foundation (Grant No. ZR2016BM19), and the National key R & D program of China (2017YFB0602500). Financial support from PetroChina Corporation Limited was also greatly appreciated. References [1] J.C. Morales-Ortuño R.A. Ortega-Domínguez P. Hernández-Hipólito X. Bokhimi T.E. Klimova HDS performance of NiMo catalysts supported on nanostructured materials containing titania Catal. Today 271 2016 127 139 [2] X. Wang P. Du K. Chi A. Duan C. Xu Z. Zhao Z. Chen H. Zhang Synthesis of NiMo catalysts supported on mesoporous silica FDU-12 with different morphologies and their catalytic performance of DBT HDS Appl. Catal. B Environ. 165 2015 269 284 [3] Y. Du J. Lei L. Zhou Z. Guo X. Du J. Li Oxidation Desulfurization of Fuels by Using Amphiphilic Hierarchically Meso/Macroporous Phosphotungstic Acid/SiO2 Catalysts Catal. Lett. 148 2018 1100 1109 [4] B. Pawelec V.L. Parola S. Thomas J.L.G. Fierro Enhancement of naphthalene hydrogenation over PtPd/SiO2-Al2O3 catalyst modified by gold J. Mol. Catal. A Chem. 253 2006 30 43 [5] V.Y. Pereyma O.V. Klimov I.P. Prosvirin E.Y. Gerasimov S.A. Yashnik A.S. Noskov Effect of thermal treatment on morphology and catalytic performance of NiW/Al2O3 catalysts prepared using citric acid as chelating agent Catal. Today 305 2018 162 170 [6] W. Zhou Y. Zhang X. Tao Y. Zhou W. Qiang S. Ding Effects of gallium addition to mesoporous alumina by impregnation on dibenzothiophene hydrodesulfurization performances of the corresponding NiMo supported catalysts Fuel 228 2018 152 163 [7] O.V. Klimov K.A. Nadeina Y.V. Vatutina E.A. Stolyarova I.G. Danilova E.Y. Gerasimov I.P. Prosvirin A.S. Noskov CoMo/Al2O3 hydrotreating catalysts of diesel fuel with improved hydrodenitrogenation activity Catal. Today 307 2018 73 83 [8] C.S. Song An overview of new approaches to deep desulfurization for ultra-clean gasoline, diesel fuel and jet fuel Catal. Today 86 2003 211 263 [9] A. Stanislaus A. Marafi M.S. Rana Recent advances in the science and technology of ultra low sulfur diesel (ULSD) production Catal. Today 153 2010 1 68 [10] M.D.D. Mello F.D.A. Braggio B.D.C. Magalhães J.L. Zotin M.A.P.D. Silva Kinetic modeling of deep hydrodesulfurization of dibenzothiophenes on NiMo/alumina catalysts modified by phosphorus Fuel Process. Technol. 177 2018 66 74 [11] A. Zhao X. Zhang C. Xiao J. Guan C. Liang Cobalt Silicide Nanoparticles in Mesoporous Silica as Efficient Naphthalene Hydrogenation Catalysts by Chemical Vapor Deposition J. Phys. Chem. C 114 2010 3962 3967 [12] C. Song X. Ma New design approaches to ultra-clean diesel fuels by deep desulfurization and deep dearomatization Appl. Catal. B Environ. 41 2003 207 238 [13] Z. Ye B. Shen W. Zhang T. Ran Z. Zhang J. Gao Hydrodesulfurization and hydrodearomatization activities of catalyst containing ETS-10 and AlPO4-5 on Daqing FCC diesel Fuel 87 2008 2343 2346 [14] S. Sharifvaghefi Y. Bo Z. Ying New Insights on the role of sulfur vacancies on dibenzothiophene hydrodesulfurization over MoS2 edges Appl. Catal. A Gen. 566 2018 164 173 [15] M. Egorova R. Prins Hydrodesulfurization of dibenzothiophene and 4,6-dimethyldibenzothiophene over sulfided NiMo/γ-Al2O3, CoMo/γ-Al2O3, and Mo/γ-Al2O3 catalysts J. Catal. 225 2004 417 427 [16] Narinobu Kagami M. Vogelaar V. Bas A. Langeveld Moulijn Dick A. Jacob Reaction pathways on NiMo/Al2O3 catalysts for hydrodesulfurization of diesel fuel Appl. Catal. A Gen. 293 2005 11 23 [17] L. Cede?O-Caero H. Gomez-Bernal A. Fraustro-Cuevas H.D. Guerra-Gomez R. Cuevas-Garcia Oxidative desulfurization of synthetic diesel using supported catalysts: part III. Support effect on vanadium-based catalysts Catal. Today 133 2008 244 254 [18] N. Prabhu A.K. Dalai J. Adjaye Hydrodesulphurization and hydrodenitrogenation of light gas oil using NiMo catalyst supported on functionalized mesoporous carbon Appl. Catal. A Gen. 401 2011 1 11 [19] B. Yoosuk C. Song J.H. Kim C. Ngamcharussrivichai P. Prasassarakich Effects of preparation conditions in hydrothermal synthesis of highly active unsupported NiMo sulfide catalysts for simultaneous hydrodesulfurization of dibenzothiophene and 4,6-dimethyldibenzothiophene Catal. Today 149 2010 52 61 [20] T.A. Zepeda A. Infantes-Molina J.N.D.D. León S. Fuentes G. Alonso-Núñez G. Torres-Otañez B. Pawelec Hydrodesulfurization enhancement of heavy and light S-hydrocarbons on NiMo/HMS catalysts modified with Al and P Appl. Catal. A Gen. 484 2014 108 121 [21] H. Wang R. Prins Hydrodesulfurization of dibenzothiophene, 4,6-dimethyldibenzothiophene, and their hydrogenated intermediates over NiMoS2/γ-Al2O3 J. Catal. 264 2009 31 43 [22] P. Michaud J.L. Lemberton G. Pérot Hydrodesulfurization of dibenzothiophene and 4,6-dimethyldibenzothiophene: Effect of an acid component on the activity of a sulfided NiMo on alumina catalyst Appl. Catal. A Gen. 169 1998 343 353 [23] B. Pawelec R. Mariscal R.M. Navarro J.M. Campos-Martin J.L.G. Fierro Simultaneous 1-pentene hydroisomerisation and thiophene hydrodesulphurisation over sulphided Ni/FAU and Ni/ZSM-5 catalysts Appl. Catal. A Gen. 262 2004 155 166 [24] H. Wu A. Duan Z. Zhen T. Li R. Prins X. Zhou Synthesis of NiMo hydrodesulfurization catalyst supported on a composite of nano-sized ZSM-5 zeolite enwrapped with mesoporous KIT-6 material and its high isomerization selectivity J. Catal. 317 2014 303 317 [25] Q. Wu Y. Li Z. Hou X. Jing M. Qian L. Han C. Xiao H. Di A. Duan C. Xu Synthesis and characterization of Beta-FDU-12 and the hydrodesulfurization performance of FCC gasoline and diesel Fuel Process. Technol. 172 2018 55 64 [26] S.A. Ganiyu S.A. Ali K. Alhooshani Simultaneous HDS of DBT and 4,6-DMDBT over single-pot Ti-SBA-15-NiMo catalysts: influence of Si/Ti ratio on the structural properties, dispersion and catalytic activity Rsc Adv. 7 2017 21943 21952 [27] C.E.A. Kirschhock R. Ravishankar F. Verspeurt P.J. Grobet P.A.J. And J.A. Martens Identification of Precursor Species in the Formation of MFI Zeolite in the TPAOH-TEOS-H2O System J. phys. chem. B 103 1999 4965 4971 [28] P. Prokešová S. Mintova J. Čejka T. Bein Preparation of nanosized micro/mesoporous composites Mater. Sci. Eng. C 23 2003 1001 1005 [29] P. Prokešová S. Mintova J. Čejka T. Bein Preparation of nanosized micro/mesoporous composites via simultaneous synthesis of Beta/MCM-48 phases Micropor. Mesopor. Mater. 64 2003 165 174 [30] Lukas Frunz Pirngruber Roel D. Gerhard ZSM-5 precursors assembled to a mesoporous structure and its subsequent transformation into a zeolitic phase-from low to high catalytic activity Micropor. Mesopor. Mater. 88 2006 152 162 [31] Y. Li K. Chi H. Zhang P. Du D. Hu C. Xiao H. Li Z. Zhao A. Duan C. Xu The influence of hydrothermal crystallization temperature on a novel FDU-12 mesoporous composite assembled by ZSM-5 nanoclusters and its hydrodesulfurization performance for DBT and FCC diesel Fuel Process. Technol. 180 2018 56 66 [32] H. Liu Q. Liu J. Zhang C. Yin Y. Zhao S. Yin C. Liu W. Sun PVP-assisted synthesis of unsupported NiMo catalysts with enhanced hydrodesulfurization activity Fuel Process. Technol. 160 2017 93 101 [33] H. Liu C. Liu C. Yin Y. Chai Y. Li D. Liu B. Liu X. Li Y. Wang X. Li Preparation of highly active unsupported nickel-zinc-molybdenum catalysts for the hydrodesulfurization of dibenzothiophene Appl. Catal. B Environ. 174–175 2015 264 276 [34] R. Barakov N. Shcherban P. Yaremov V. Solomakha V. Ilyin Two-stage dual template alkali metal-free synthesis of micro-mesoporous aluminosilicates based on ZSM-5 zeolite precursors J. Porous Mater. 23 2016 1619 1632 [35] R.V. Grieken J.L. Sotelo J.M. Menéndez J.A. Melero Anomalous crystallization mechanism in the synthesis of nanocrystalline ZSM-5 Micropor. Mesopor. Mater. 39 2000 135 147 [36] D. Zuo M. Vrinat H. Nie F. Maugé Y. Shi M. Lacroix D. Li The formation of the active phases in sulfided NiW/Al2O3 catalysts and their evolution during post-reduction treatment Catal. Today 93 2004 751 760 [37] Hanxiao Yufan S. Gang Yingqian Haiyanliu Guangbigong Tinghaiwang X. Bao Citric acid-assisted hydrothermal method for preparing NiW/USY-Al2O3 ultradeep hydrodesulfurization catalysts J. Catal. 279 2011 27 35 [38] F.J. Méndez O.E. Franco-López X. Bokhimi D.A. Solís-Casados L. Escobar-Alarcón T.E. Klimova Dibenzothiophene hydrodesulfurization with NiMo and CoMo catalysts supported on niobium-modified MCM-41 Appl. Catal. B Environ. 219 2017 479 491 [39] O.V. Klimov Y.V. Vatutina K.A. Nadeina M.O. Kazakov E.Y. Gerasimov I.P. Prosvirin T.V. Larina A.S. Noskov CoMoB/Al2O3 catalysts for hydrotreating of diesel fuel. The effect of the way of the boron addition to a support or an impregnating solution Catal. Today 305 2018 192 202 [40] S.L. Amaya G. Alonso-Núñez J. Cruz-Reyes S. Fuentes A. Echavarría Influence of the sulfidation temperature in a NiMoW catalyst derived from layered structure (NH4)Ni2OH(H2O)(MoO4)2 Fuel 139 2015 575 583 [41] H. Liu C. Yin X. Li Y. Chai Y. Li C. Liu Effect of NiMo phases on the hydrodesulfurization activities of dibenzothiophene Catal. Today 282 2017 222 229 [42] S.L.S. Doron Levin J.Y.Y. And Crystal Structure of an Ammonium Nickel Molybdate Prepared by Chemical Precipitation Inorg. Chem. 35 1996 4191 4197 [43] W. Lai L. Pang J. Zheng J. Li Z. Wu X. Yi W. Fang L. Jia Efficient one pot synthesis of mesoporous NiMo-Al2O3 catalysts for dibenzothiophene hydrodesulfurization Fuel Process. Technol. 110 2013 8 16 [44] H. Liu Y. Li C. Yin Y. Wu Y. Chai D. Dong X. Li C. Liu One-pot synthesis of ordered mesoporous NiMo-Al2O3 catalysts for dibenzothiophene hydrodesulfurization Appl. Catal. B Environ. 198 2016 493 507 [45] Y. Gochi C. Ornelas F. Paraguay S. Fuentes L. Alvarez J.L. Rico G. Alonso-Núñez Effect of sulfidation on Mo-W-Ni trimetallic catalysts in the HDS of DBT Catal. Today 107 2005 531 536 [46] C. Yin L. Zhao Z. Bai H. Liu Y. Liu C. Liu A novel porous ammonium nickel molybdate as the catalyst precursor towards deep hydrodesulfurization of gas oil Fuel 107 2013 873 878 [47] G. Ali B.A. Korgel Nickel sulfide and copper sulfide nanocrystal synthesis and polymorphism Langmuir 21 2005 9451 9456 [48] E. Altamirano J.A.D.L. Reyes F. Murrieta M. Vrinat Hydrodesulfurization of dibenzothiophene and 4,6-dimethyl-dibenzothiophene: Gallium effect over NiMo/Al2O3 sulfided catalysts J. Catal. 235 2005 403 412 [49] N.Y. Topsøe H. Topsøe Characterization of the structures and active sites in sulfided CoMo/Al2O3 and NiMo/Al2O3 catalysts by NO chemisorption J. Catal. 84 1983 386 401 [50] X. Liu X. Li Z. Yan Facile route to prepare bimodal mesoporous γ-Al2O3 as support for highly active CoMo-based hydrodesulfurization catalyst Appl. Catal. B: Environ. 121–122 2012 50 56 [51] R.Y. Zhao L.Y. Zeng J. Liang C.G. Liu Interaction between Ni promoter and Al2O3 support and its effect on the performance of NiMo/γ-Al2O3 catalyst in hydrodesulphurization J. Fuel Chem. Technol. 44 2016 564 569 [52] L. Vradman M.V. Landau Structure-Function Relations in Supported Ni-W Sulfide Hydrogenation Catalysts Catal. Lett. 77 2001 47 54 [53] E.J.M. Hensen P.J. Kooyman Y.V.D. Meer A.M.V.D. Kraan V.H.J.D. Beer J.A.R.V. Veen R.A.V. Santen The Relation between Morphology and Hydrotreating Activity for Supported MoS2 Particles J. Catal. 199 2001 224 235",
      "scopus-id": "85067807266",
      "coredata": {
        "eid": "1-s2.0-S0926860X19302674",
        "dc:description": "The influence of ZSM-5 zeolite nanoclusters on the unsupported Ni-Mo catalyst was investigated by correlating their physicochemical properties with the hydrodesulfurization (HDS) activity of dibenzothiophene (DBT). The physicochemical properties of the catalysts before and after modification were characterized by N2 adsorption-desorption, XRD, SEM, FT-IR, H2-TPR, Py-IR, and HRTEM techniques. Results showed that the specific surface area and Lewis acid of the unsupported Ni-Mo catalyst were improved obviously after modification, which indicate that the ZSM-5 zeolite nanoclusters were successfully introduced into the unsupported Ni-Mo catalysts. Besides, DBT HDS results revealed that the catalysts Z5-NiMo-10 g and Z5-NiMo-14h exhibited high hydrodesulfurization activity (the desulfurization rate of 98.1% and 100.0%, respectively). In particular, the catalyst Z5-NiMo-10 g produced the highest isomerization rate of 68.9% due to more dispersed structure and suitable acidity.",
        "openArchiveArticle": "false",
        "prism:coverDate": "2019-07-25",
        "openaccessUserLicense": null,
        "prism:aggregationType": "Journal",
        "prism:url": "https://api.elsevier.com/content/article/pii/S0926860X19302674",
        "dc:creator": [
          {
            "@_fa": "true",
            "$": "Dong, Chengwu"
          },
          {
            "@_fa": "true",
            "$": "Yin, Changlong"
          },
          {
            "@_fa": "true",
            "$": "Wu, Tongtong"
          },
          {
            "@_fa": "true",
            "$": "Wu, Zhuyan"
          },
          {
            "@_fa": "true",
            "$": "Liu, Dong"
          },
          {
            "@_fa": "true",
            "$": "Liu, Chenguang"
          }
        ],
        "link": [
          {
            "@_fa": "true",
            "@rel": "self",
            "@href": "https://api.elsevier.com/content/article/pii/S0926860X19302674"
          },
          {
            "@_fa": "true",
            "@rel": "scidir",
            "@href": "https://www.sciencedirect.com/science/article/pii/S0926860X19302674"
          }
        ],
        "dc:format": "application/json",
        "openaccessType": null,
        "pii": "S0926-860X(19)30267-4",
        "prism:volume": "582",
        "articleNumber": "117113",
        "prism:publisher": "Elsevier B.V.",
        "dc:title": "Study on the modification of unsupported hydrodesulfurization catalysts by the ZSM-5 zeolite nanoclusters",
        "prism:copyright": "© 2019 Elsevier B.V. All rights reserved.",
        "openaccess": "0",
        "prism:issn": "0926860X",
        "dcterms:subject": [
          {
            "@_fa": "true",
            "$": "Unsupported Ni-Mo catalysts"
          },
          {
            "@_fa": "true",
            "$": "ZSM-5 zeolite nanoclusters"
          },
          {
            "@_fa": "true",
            "$": "Surface modification"
          },
          {
            "@_fa": "true",
            "$": "Hydrodesulfurization"
          }
        ],
        "openaccessArticle": "false",
        "prism:publicationName": "Applied Catalysis A: General",
        "openaccessSponsorType": null,
        "prism:pageRange": "117113",
        "pubType": "fla",
        "prism:coverDisplayDate": "25 July 2019",
        "prism:doi": "10.1016/j.apcata.2019.117113",
        "prism:startingPage": "117113",
        "dc:identifier": "doi:10.1016/j.apcata.2019.117113",
        "openaccessSponsorName": null
      },
      "objects": {
        "object": [
          {
            "@category": "thumbnail",
            "@height": "164",
            "@width": "112",
            "@_fa": "true",
            "$": "https://api.elsevier.com/content/object/eid/1-s2.0-S0926860X19302674-gr4.sml?httpAccept=%2A%2F%2A",
            "@multimediatype": "GIF image file",
            "@type": "IMAGE-THUMBNAIL",
            "@size": "4306",
            "@ref": "gr4",
            "@mimetype": "image/gif"
          },
          {
            "@category": "thumbnail",
            "@height": "164",
            "@width": "119",
            "@_fa": "true",
            "$": "https://api.elsevier.com/content/object/eid/1-s2.0-S0926860X19302674-gr3.sml?httpAccept=%2A%2F%2A",
            "@multimediatype": "GIF image file",
            "@type": "IMAGE-THUMBNAIL",
            "@size": "4983",
            "@ref": "gr3",
            "@mimetype": "image/gif"
          },
          {
            "@category": "thumbnail",
            "@height": "164",
            "@width": "145",
            "@_fa": "true",
            "$": "https://api.elsevier.com/content/object/eid/1-s2.0-S0926860X19302674-gr2.sml?httpAccept=%2A%2F%2A",
            "@multimediatype": "GIF image file",
            "@type": "IMAGE-THUMBNAIL",
            "@size": "20075",
            "@ref": "gr2",
            "@mimetype": "image/gif"
          },
          {
            "@category": "thumbnail",
            "@height": "95",
            "@width": "219",
            "@_fa": "true",
            "$": "https://api.elsevier.com/content/object/eid/1-s2.0-S0926860X19302674-ga1.sml?httpAccept=%2A%2F%2A",
            "@multimediatype": "GIF image file",
            "@type": "IMAGE-THUMBNAIL",
            "@size": "6700",
            "@ref": "ga1",
            "@mimetype": "image/gif"
          },
          {
            "@category": "thumbnail",
            "@height": "163",
            "@width": "111",
            "@_fa": "true",
            "$": "https://api.elsevier.com/content/object/eid/1-s2.0-S0926860X19302674-gr1.sml?httpAccept=%2A%2F%2A",
            "@multimediatype": "GIF image file",
            "@type": "IMAGE-THUMBNAIL",
            "@size": "6022",
            "@ref": "gr1",
            "@mimetype": "image/gif"
          },
          {
            "@category": "thumbnail",
            "@height": "152",
            "@width": "219",
            "@_fa": "true",
            "$": "https://api.elsevier.com/content/object/eid/1-s2.0-S0926860X19302674-gr8.sml?httpAccept=%2A%2F%2A",
            "@multimediatype": "GIF image file",
            "@type": "IMAGE-THUMBNAIL",
            "@size": "8164",
            "@ref": "gr8",
            "@mimetype": "image/gif"
          },
          {
            "@category": "thumbnail",
            "@height": "163",
            "@width": "145",
            "@_fa": "true",
            "$": "https://api.elsevier.com/content/object/eid/1-s2.0-S0926860X19302674-gr7.sml?httpAccept=%2A%2F%2A",
            "@multimediatype": "GIF image file",
            "@type": "IMAGE-THUMBNAIL",
            "@size": "14739",
            "@ref": "gr7",
            "@mimetype": "image/gif"
          },
          {
            "@category": "thumbnail",
            "@height": "163",
            "@width": "115",
            "@_fa": "true",
            "$": "https://api.elsevier.com/content/object/eid/1-s2.0-S0926860X19302674-gr6.sml?httpAccept=%2A%2F%2A",
            "@multimediatype": "GIF image file",
            "@type": "IMAGE-THUMBNAIL",
            "@size": "4322",
            "@ref": "gr6",
            "@mimetype": "image/gif"
          },
          {
            "@category": "thumbnail",
            "@height": "164",
            "@width": "115",
            "@_fa": "true",
            "$": "https://api.elsevier.com/content/object/eid/1-s2.0-S0926860X19302674-gr5.sml?httpAccept=%2A%2F%2A",
            "@multimediatype": "GIF image file",
            "@type": "IMAGE-THUMBNAIL",
            "@size": "3667",
            "@ref": "gr5",
            "@mimetype": "image/gif"
          },
          {
            "@category": "thumbnail",
            "@height": "151",
            "@width": "219",
            "@_fa": "true",
            "$": "https://api.elsevier.com/content/object/eid/1-s2.0-S0926860X19302674-gr9.sml?httpAccept=%2A%2F%2A",
            "@multimediatype": "GIF image file",
            "@type": "IMAGE-THUMBNAIL",
            "@size": "8743",
            "@ref": "gr9",
            "@mimetype": "image/gif"
          },
          {
            "@category": "standard",
            "@height": "549",
            "@width": "376",
            "@_fa": "true",
            "$": "https://api.elsevier.com/content/object/eid/1-s2.0-S0926860X19302674-gr4.jpg?httpAccept=%2A%2F%2A",
            "@multimediatype": "JPEG image file",
            "@type": "IMAGE-DOWNSAMPLED",
            "@size": "41835",
            "@ref": "gr4",
            "@mimetype": "image/jpeg"
          },
          {
            "@category": "standard",
            "@height": "517",
            "@width": "376",
            "@_fa": "true",
            "$": "https://api.elsevier.com/content/object/eid/1-s2.0-S0926860X19302674-gr3.jpg?httpAccept=%2A%2F%2A",
            "@multimediatype": "JPEG image file",
            "@type": "IMAGE-DOWNSAMPLED",
            "@size": "41381",
            "@ref": "gr3",
            "@mimetype": "image/jpeg"
          },
          {
            "@category": "standard",
            "@height": "636",
            "@width": "562",
            "@_fa": "true",
            "$": "https://api.elsevier.com/content/object/eid/1-s2.0-S0926860X19302674-gr2.jpg?httpAccept=%2A%2F%2A",
            "@multimediatype": "JPEG image file",
            "@type": "IMAGE-DOWNSAMPLED",
            "@size": "174115",
            "@ref": "gr2",
            "@mimetype": "image/jpeg"
          },
          {
            "@category": "standard",
            "@height": "200",
            "@width": "462",
            "@_fa": "true",
            "$": "https://api.elsevier.com/content/object/eid/1-s2.0-S0926860X19302674-ga1.jpg?httpAccept=%2A%2F%2A",
            "@multimediatype": "JPEG image file",
            "@type": "IMAGE-DOWNSAMPLED",
            "@size": "24824",
            "@ref": "ga1",
            "@mimetype": "image/jpeg"
          },
          {
            "@category": "standard",
            "@height": "553",
            "@width": "376",
            "@_fa": "true",
            "$": "https://api.elsevier.com/content/object/eid/1-s2.0-S0926860X19302674-gr1.jpg?httpAccept=%2A%2F%2A",
            "@multimediatype": "JPEG image file",
            "@type": "IMAGE-DOWNSAMPLED",
            "@size": "57161",
            "@ref": "gr1",
            "@mimetype": "image/jpeg"
          },
          {
            "@category": "standard",
            "@height": "260",
            "@width": "376",
            "@_fa": "true",
            "$": "https://api.elsevier.com/content/object/eid/1-s2.0-S0926860X19302674-gr8.jpg?httpAccept=%2A%2F%2A",
            "@multimediatype": "JPEG image file",
            "@type": "IMAGE-DOWNSAMPLED",
            "@size": "25173",
            "@ref": "gr8",
            "@mimetype": "image/jpeg"
          },
          {
            "@category": "standard",
            "@height": "637",
            "@width": "565",
            "@_fa": "true",
            "$": "https://api.elsevier.com/content/object/eid/1-s2.0-S0926860X19302674-gr7.jpg?httpAccept=%2A%2F%2A",
            "@multimediatype": "JPEG image file",
            "@type": "IMAGE-DOWNSAMPLED",
            "@size": "165086",
            "@ref": "gr7",
            "@mimetype": "image/jpeg"
          },
          {
            "@category": "standard",
            "@height": "533",
            "@width": "376",
            "@_fa": "true",
            "$": "https://api.elsevier.com/content/object/eid/1-s2.0-S0926860X19302674-gr6.jpg?httpAccept=%2A%2F%2A",
            "@multimediatype": "JPEG image file",
            "@type": "IMAGE-DOWNSAMPLED",
            "@size": "36055",
            "@ref": "gr6",
            "@mimetype": "image/jpeg"
          },
          {
            "@category": "standard",
            "@height": "535",
            "@width": "376",
            "@_fa": "true",
            "$": "https://api.elsevier.com/content/object/eid/1-s2.0-S0926860X19302674-gr5.jpg?httpAccept=%2A%2F%2A",
            "@multimediatype": "JPEG image file",
            "@type": "IMAGE-DOWNSAMPLED",
            "@size": "35453",
            "@ref": "gr5",
            "@mimetype": "image/jpeg"
          },
          {
            "@category": "standard",
            "@height": "260",
            "@width": "376",
            "@_fa": "true",
            "$": "https://api.elsevier.com/content/object/eid/1-s2.0-S0926860X19302674-gr9.jpg?httpAccept=%2A%2F%2A",
            "@multimediatype": "JPEG image file",
            "@type": "IMAGE-DOWNSAMPLED",
            "@size": "26679",
            "@ref": "gr9",
            "@mimetype": "image/jpeg"
          },
          {
            "@category": "high",
            "@height": "2436",
            "@width": "1667",
            "@_fa": "true",
            "$": "https://api.elsevier.com/content/object/eid/1-s2.0-S0926860X19302674-gr4_lrg.jpg?httpAccept=%2A%2F%2A",
            "@multimediatype": "JPEG image file",
            "@type": "IMAGE-HIGH-RES",
            "@size": "329770",
            "@ref": "gr4",
            "@mimetype": "image/jpeg"
          },
          {
            "@category": "high",
            "@height": "2291",
            "@width": "1667",
            "@_fa": "true",
            "$": "https://api.elsevier.com/content/object/eid/1-s2.0-S0926860X19302674-gr3_lrg.jpg?httpAccept=%2A%2F%2A",
            "@multimediatype": "JPEG image file",
            "@type": "IMAGE-HIGH-RES",
            "@size": "305487",
            "@ref": "gr3",
            "@mimetype": "image/jpeg"
          },
          {
            "@category": "high",
            "@height": "2816",
            "@width": "2490",
            "@_fa": "true",
            "$": "https://api.elsevier.com/content/object/eid/1-s2.0-S0926860X19302674-gr2_lrg.jpg?httpAccept=%2A%2F%2A",
            "@multimediatype": "JPEG image file",
            "@type": "IMAGE-HIGH-RES",
            "@size": "1965997",
            "@ref": "gr2",
            "@mimetype": "image/jpeg"
          },
          {
            "@category": "high",
            "@height": "886",
            "@width": "2048",
            "@_fa": "true",
            "$": "https://api.elsevier.com/content/object/eid/1-s2.0-S0926860X19302674-ga1_lrg.jpg?httpAccept=%2A%2F%2A",
            "@multimediatype": "JPEG image file",
            "@type": "IMAGE-HIGH-RES",
            "@size": "160441",
            "@ref": "ga1",
            "@mimetype": "image/jpeg"
          },
          {
            "@category": "high",
            "@height": "2452",
            "@width": "1667",
            "@_fa": "true",
            "$": "https://api.elsevier.com/content/object/eid/1-s2.0-S0926860X19302674-gr1_lrg.jpg?httpAccept=%2A%2F%2A",
            "@multimediatype": "JPEG image file",
            "@type": "IMAGE-HIGH-RES",
            "@size": "513063",
            "@ref": "gr1",
            "@mimetype": "image/jpeg"
          },
          {
            "@category": "high",
            "@height": "1154",
            "@width": "1667",
            "@_fa": "true",
            "$": "https://api.elsevier.com/content/object/eid/1-s2.0-S0926860X19302674-gr8_lrg.jpg?httpAccept=%2A%2F%2A",
            "@multimediatype": "JPEG image file",
            "@type": "IMAGE-HIGH-RES",
            "@size": "212663",
            "@ref": "gr8",
            "@mimetype": "image/jpeg"
          },
          {
            "@category": "high",
            "@height": "2817",
            "@width": "2500",
            "@_fa": "true",
            "$": "https://api.elsevier.com/content/object/eid/1-s2.0-S0926860X19302674-gr7_lrg.jpg?httpAccept=%2A%2F%2A",
            "@multimediatype": "JPEG image file",
            "@type": "IMAGE-HIGH-RES",
            "@size": "2110505",
            "@ref": "gr7",
            "@mimetype": "image/jpeg"
          },
          {
            "@category": "high",
            "@height": "2363",
            "@width": "1667",
            "@_fa": "true",
            "$": "https://api.elsevier.com/content/object/eid/1-s2.0-S0926860X19302674-gr6_lrg.jpg?httpAccept=%2A%2F%2A",
            "@multimediatype": "JPEG image file",
            "@type": "IMAGE-HIGH-RES",
            "@size": "285133",
            "@ref": "gr6",
            "@mimetype": "image/jpeg"
          },
          {
            "@category": "high",
            "@height": "2374",
            "@width": "1667",
            "@_fa": "true",
            "$": "https://api.elsevier.com/content/object/eid/1-s2.0-S0926860X19302674-gr5_lrg.jpg?httpAccept=%2A%2F%2A",
            "@multimediatype": "JPEG image file",
            "@type": "IMAGE-HIGH-RES",
            "@size": "266239",
            "@ref": "gr5",
            "@mimetype": "image/jpeg"
          },
          {
            "@category": "high",
            "@height": "1151",
            "@width": "1667",
            "@_fa": "true",
            "$": "https://api.elsevier.com/content/object/eid/1-s2.0-S0926860X19302674-gr9_lrg.jpg?httpAccept=%2A%2F%2A",
            "@multimediatype": "JPEG image file",
            "@type": "IMAGE-HIGH-RES",
            "@size": "228252",
            "@ref": "gr9",
            "@mimetype": "image/jpeg"
          },
          {
            "@category": "thumbnail",
            "@height": "40",
            "@width": "209",
            "@_fa": "true",
            "$": "https://api.elsevier.com/content/object/eid/1-s2.0-S0926860X19302674-si7.gif?httpAccept=%2A%2F%2A",
            "@multimediatype": "GIF image file",
            "@type": "ALTIMG",
            "@size": "688",
            "@ref": "si7",
            "@mimetype": "image/gif"
          },
          {
            "@category": "thumbnail",
            "@height": "43",
            "@width": "339",
            "@_fa": "true",
            "$": "https://api.elsevier.com/content/object/eid/1-s2.0-S0926860X19302674-si6.gif?httpAccept=%2A%2F%2A",
            "@multimediatype": "GIF image file",
            "@type": "ALTIMG",
            "@size": "1247",
            "@ref": "si6",
            "@mimetype": "image/gif"
          },
          {
            "@category": "thumbnail",
            "@height": "52",
            "@width": "195",
            "@_fa": "true",
            "$": "https://api.elsevier.com/content/object/eid/1-s2.0-S0926860X19302674-si1.gif?httpAccept=%2A%2F%2A",
            "@multimediatype": "GIF image file",
            "@type": "ALTIMG",
            "@size": "686",
            "@ref": "si1",
            "@mimetype": "image/gif"
          },
          {
            "@category": "thumbnail",
            "@height": "52",
            "@width": "204",
            "@_fa": "true",
            "$": "https://api.elsevier.com/content/object/eid/1-s2.0-S0926860X19302674-si2.gif?httpAccept=%2A%2F%2A",
            "@multimediatype": "GIF image file",
            "@type": "ALTIMG",
            "@size": "738",
            "@ref": "si2",
            "@mimetype": "image/gif"
          },
          {
            "@category": "thumbnail",
            "@height": "41",
            "@width": "285",
            "@_fa": "true",
            "$": "https://api.elsevier.com/content/object/eid/1-s2.0-S0926860X19302674-si5.gif?httpAccept=%2A%2F%2A",
            "@multimediatype": "GIF image file",
            "@type": "ALTIMG",
            "@size": "910",
            "@ref": "si5",
            "@mimetype": "image/gif"
          },
          {
            "@category": "thumbnail",
            "@height": "33",
            "@width": "141",
            "@_fa": "true",
            "$": "https://api.elsevier.com/content/object/eid/1-s2.0-S0926860X19302674-si4.gif?httpAccept=%2A%2F%2A",
            "@multimediatype": "GIF image file",
            "@type": "ALTIMG",
            "@size": "443",
            "@ref": "si4",
            "@mimetype": "image/gif"
          },
          {
            "@category": "thumbnail",
            "@height": "80",
            "@width": "192",
            "@_fa": "true",
            "$": "https://api.elsevier.com/content/object/eid/1-s2.0-S0926860X19302674-si3.gif?httpAccept=%2A%2F%2A",
            "@multimediatype": "GIF image file",
            "@type": "ALTIMG",
            "@size": "969",
            "@ref": "si3",
            "@mimetype": "image/gif"
          },
          {
            "@category": "standard",
            "@_fa": "true",
            "$": "https://api.elsevier.com/content/object/eid/1-s2.0-S0926860X19302674-am.pdf?httpAccept=%2A%2F%2A",
            "@multimediatype": "Acrobat PDF file",
            "@type": "AAM-PDF",
            "@size": "902480",
            "@ref": "am",
            "@mimetype": "application/pdf"
          }
        ]
      },
      "link": {
        "@rel": "abstract",
        "@href": "https://api.elsevier.com/content/abstract/scopus_id/85067807266"
      }
    }
  }
}