{
  "metadata": {
    "title": "Synergistic catalysis of Ru<ce:sup loc=post>0</ce:sup>-Ru<ce:sup loc=post>3+</ce:sup> in MOF supported ultrafine Ru nanoparticles catalyst promotes ethyl levulinate to γ-valerolactone",
    "authors": "; ; ",
    "journal": "Applied Catalysis A: General",
    "date": "2024-05-05",
    "doi": "10.1016/j.apcata.2024.119705",
    "abstract": "",
    "uri": "https://api.elsevier.com/content/article/pii/S0926860X24001492",
    "pii": "S0926860X24001492"
  },
  "fulltext": {
    "full-text-retrieval-response": {
      "scopus-eid": "2-s2.0-85189012744",
      "originalText": "serial JL 271346 291210 291744 291809 31 Applied Catalysis A: General APPLIEDCATALYSISAGENERAL 2024-03-26 2024-03-26 2024-03-27 2024-03-27 2024-04-05T08:53:41 1-s2.0-S0926860X24001492 S0926-860X(24)00149-2 S0926860X24001492 10.1016/j.apcata.2024.119705 S300 S300.1 FULL-TEXT 1-s2.0-S0926860X24X00058 2024-05-10T10:37:19.151208Z 0 0 20240505 2024 2024-03-26T15:14:21.780157Z absattachment articleinfo articlenumber articletitlenorm authfirstinitialnorm authfirstsurnamenorm cid cids contenttype copyright crossmark dateloaded dateloadedtxt datesearch datesort dateupdated dco docsubtype doctype doi eid ewtransactionid hubeid indexeddate issn issnnorm itemstage itemtransactionid itemweight openaccess openarchive pg pgfirst pii piinorm pubdatestart pubdatetxt pubyr sortorder srctitle srctitlenorm srctype ssids alllist content subj subheadings suppl tomb volfirst volissue volumelist webpdf webpdfpagecount yearnav figure e-component body mmlmath acknowledge affil appendices articletitle auth authfirstini authfull authkeywords authlast grantnumber grantsponsor grantsponsorid highlightsabst orcid primabst ref specialabst 0926-860X 0926860X true 677 677 C Volume 677 12 119705 119705 119705 20240505 5 May 2024 2024-05-05 2024 article fla © 2024 Elsevier B.V. All rights reserved. SYNERGISTICCATALYSISRU0RU3INMOFSUPPORTEDULTRAFINERUNANOPARTICLESCATALYSTPROMOTESETHYLLEVULINATEVALEROLACTONE DAO Z 1 Introduction 2 Experimental 2.1 Materials 2.2 Catalyst characterization 2.3 Catalyst preparation 2.3.1 Preparation of LaQS support 2.3.2 Preparation of Ru/LaQS 2.4 Catalytic evaluation 3 Results and discussion 3.1 Interaction between the LaQS support and ultrafine Ru nanoparticles 3.1.1 LaQS anchored ultrafine Ru nanoparticles 3.1.2 Electronic effects of support and metal NPs 3.2 Ru0-Ru3+ synergistic catalysis of EL 3.2.1 Ru0 with high electron density promotes catalytic performance 3.2.2 Enhanced acid site Ru3+ promotes catalytic performance 3.2.3 The interaction between the support and Ru NPs improves the stability 4 Conclusions CRediT authorship contribution statement Acknowledgements Appendix A Supplementary material References CHEN 2018 11023 11117 S NASROLLAHZADEH 2020 M HAYES 2009 138 151 D RAGAUSKAS 2006 484 489 A HORVATH 2008 238 242 I WEI 2018 100 107 Z GADAMSETTI 2018 192 199 S YOSHIDA 2018 70 76 R DUTTA 2019 992 1006 S ALONSO 2013 D WRIGHT 2012 1657 1667 W BOZELL 2010 J HE 2020 359 370 J WINOTO 2016 62 71 H HENGNE 2016 59753 59761 A LOMATE 2017 348 358 S SERRANORUIZ 2010 J GUTIERREZ 2009 239 246 A SANTOS 2020 268 J BALLESTEROSPLATA 2017 86 95 D FABA 2014 436 444 L MICHEL 2015 4130 4132 C GAO 2020 60 70 X SHEN 2019 29 38 Q MANI 2022 M LI 2020 17338 17347 W HUA 2019 W RUMYANTSEVA 2006 208 214 M ODOOMWUBAH 2019 T LI 2021 9242 9251 X SCOTT 2021 9682 9693 N ZHAN 2022 1152 1164 J JING 2021 5527 5535 Y SIMAKOVA 2012 95 103 O YAN 2020 810 825 P NIE 2018 1064 1074 L HE 2019 82 86 D XIE 2019 606 613 Z LI 2020 163 174 J LI 2022 7926 7935 Y LI 2022 185 192 W LUO 2013 175 186 W WANG 2017 1528 1539 L NAKAGAWA 2014 2197 2203 Y CHEN 2011 9370 9375 L KOCK 2017 4554 4570 E ZHAO 2023 6645 6654 X MAHATO 2020 M HA 2019 Y SHU 2022 15386 15399 Y SHI 2016 5842 5848 J GUPTA 2018 189 194 S FU 2015 J CHEN 2011 217 227 L MA 2020 9017 9027 X ZHANG 2010 62 68 D WANG 2014 13481 13489 J ZHANG 2023 2268 2276 L LU 2022 Y DAOX2024X119705 DAOX2024X119705XZ 2026-03-27T00:00:00.000Z 2026-03-27T00:00:00.000Z http://creativecommons.org/licenses/by-nc-nd/4.0/ © 2024 Elsevier B.V. All rights reserved. 2024-04-05T00:50:03.965Z http://vtw.elsevier.com/data/voc/AddOnTypes/50.7/aggregated-refined 31760190 32360430 32260368 NSFC National Natural Science Foundation of China http://data.elsevier.com/vocabulary/SciValFunders/501100001809 http://sws.geonames.org/1814991 Young and Middle-aged Academic and Technical Leaders Project in Yunnan Province Ru3+/ZIF-8 202205AC160052 LaQS Science and Technology Planning Project of Yunnan Province 202101BD070001-007 202201AU070066 202101BD070001-052 Major Science and Technology Projects in Yunnan Province http://data.elsevier.com/vocabulary/SciValFunders/501100018531 http://sws.geonames.org/1814991/ This work was supported by the National Natural Science Foundation of China (32360430, 32260368, 31760190), Science and Technology Planning Project of Yunnan Province (202101BD070001-007, 202101BD070001-052, 202201AU070066), Young and Middle-aged Academic and Technical Leaders Project in Yunnan Province (202205AC160052). Comparison of actual loading for Rux/LaQS with different loading by ICP, C-C/C[dbnd]C content of C 1 s in LaQS and Rux/LaQS with different loading, Ru0/Ru3+ content of Ru 3p in Ru/C and Rux/LaQS with different loading, Hydrogenation of EL using different Ru catalysts for the preparation of GVL, Different acid contents and comparison of Ru2/LaQS and LaQS, XPS spectra of Ru 3d for RuCl3, Ru3+/ZIF-8 and Ru3+/LaQS, CO2-TPD spectra of LaQS and different loadings of Ru/LaQS, XPS spectra of La 3d and O 1 s of LaQS and Ru/LaQS with different loading, XPS spectra of Cl 3p of Ru2/LaQS with different loading. This work was supported by the National Natural Science Foundation of China (32360430, 32260368, 31760190), Science and Technology Planning Project of Yunnan Province (202101BD070001-007, 202101BD070001-052, 202201AU070066), Young and Middle-aged Academic and Technical Leaders Project in Yunnan Province (202205AC160052). https://doi.org/10.15223/policy-017 https://doi.org/10.15223/policy-037 https://doi.org/10.15223/policy-012 https://doi.org/10.15223/policy-029 https://doi.org/10.15223/policy-004 item S0926-860X(24)00149-2 S0926860X24001492 1-s2.0-S0926860X24001492 10.1016/j.apcata.2024.119705 271346 2024-05-10T10:37:19.151208Z 2024-05-05 1-s2.0-S0926860X24001492-main.pdf https://s3-eu-west-1.amazonaws.com/prod-ucs-content-store-eu-west/content/pii:S0926860X24001492/MAIN/application/pdf/8d0296eff2e14d5bb947109627846ada/main.pdf main.pdf pdf true 9369485 MAIN 11 1-s2.0-S0926860X24001492-main_1.png https://s3-eu-west-1.amazonaws.com/prod-ucs-content-store-eu-west/content/pii:S0926860X24001492/PREVIEW/image/png/befca9fd91283488f1a207d1d6d3e05a/main_1.png main_1.png png 56121 849 656 IMAGE-WEB-PDF 1 1-s2.0-S0926860X24001492-gr1.jpg https://s3-eu-west-1.amazonaws.com/prod-ucs-content-store-eu-west/content/pii:S0926860X24001492/gr1/DOWNSAMPLED/image/jpeg/c71d0095d86330d1eb018b98e7e39260/gr1.jpg gr1 gr1.jpg jpg 165932 753 807 IMAGE-DOWNSAMPLED 1-s2.0-S0926860X24001492-gr2.jpg https://s3-eu-west-1.amazonaws.com/prod-ucs-content-store-eu-west/content/pii:S0926860X24001492/gr2/DOWNSAMPLED/image/jpeg/1755e8e23add7ba198529f1870e22f30/gr2.jpg gr2 gr2.jpg jpg 80766 462 565 IMAGE-DOWNSAMPLED 1-s2.0-S0926860X24001492-ga1.jpg https://s3-eu-west-1.amazonaws.com/prod-ucs-content-store-eu-west/content/pii:S0926860X24001492/ga1/DOWNSAMPLED/image/jpeg/3be4b0378142c487b8ffaf8f3a94397c/ga1.jpg ga1 true ga1.jpg jpg 23765 200 345 IMAGE-DOWNSAMPLED 1-s2.0-S0926860X24001492-gr3.jpg https://s3-eu-west-1.amazonaws.com/prod-ucs-content-store-eu-west/content/pii:S0926860X24001492/gr3/DOWNSAMPLED/image/jpeg/69374f04df8bfc9bbdc37f71e45d857b/gr3.jpg gr3 gr3.jpg jpg 90725 473 807 IMAGE-DOWNSAMPLED 1-s2.0-S0926860X24001492-gr4.jpg https://s3-eu-west-1.amazonaws.com/prod-ucs-content-store-eu-west/content/pii:S0926860X24001492/gr4/DOWNSAMPLED/image/jpeg/044bd38af041136f7de39431aa295da8/gr4.jpg gr4 gr4.jpg jpg 73283 494 565 IMAGE-DOWNSAMPLED 1-s2.0-S0926860X24001492-gr5.jpg https://s3-eu-west-1.amazonaws.com/prod-ucs-content-store-eu-west/content/pii:S0926860X24001492/gr5/DOWNSAMPLED/image/jpeg/47afc94fed9e2e4af30d3930e9dd3bc5/gr5.jpg gr5 gr5.jpg jpg 61129 472 565 IMAGE-DOWNSAMPLED 1-s2.0-S0926860X24001492-gr6.jpg https://s3-eu-west-1.amazonaws.com/prod-ucs-content-store-eu-west/content/pii:S0926860X24001492/gr6/DOWNSAMPLED/image/jpeg/8afb4823344d2c5e177ffd859d56aef7/gr6.jpg gr6 gr6.jpg jpg 91048 402 807 IMAGE-DOWNSAMPLED 1-s2.0-S0926860X24001492-gr7.jpg https://s3-eu-west-1.amazonaws.com/prod-ucs-content-store-eu-west/content/pii:S0926860X24001492/gr7/DOWNSAMPLED/image/jpeg/1299d81edafdd6a8e0b6295ca1aad2ff/gr7.jpg gr7 gr7.jpg jpg 63759 460 565 IMAGE-DOWNSAMPLED 1-s2.0-S0926860X24001492-gr1.sml https://s3-eu-west-1.amazonaws.com/prod-ucs-content-store-eu-west/content/pii:S0926860X24001492/gr1/THUMBNAIL/image/gif/62cf6f23c5fe84e30a84d82b6577482d/gr1.sml gr1 gr1.sml sml 16315 164 176 IMAGE-THUMBNAIL 1-s2.0-S0926860X24001492-gr2.sml https://s3-eu-west-1.amazonaws.com/prod-ucs-content-store-eu-west/content/pii:S0926860X24001492/gr2/THUMBNAIL/image/gif/655e60c456faae12dc6dea2a981cdaf1/gr2.sml gr2 gr2.sml sml 13899 163 200 IMAGE-THUMBNAIL 1-s2.0-S0926860X24001492-ga1.sml https://s3-eu-west-1.amazonaws.com/prod-ucs-content-store-eu-west/content/pii:S0926860X24001492/ga1/THUMBNAIL/image/gif/1f93601d9111b2339285d349534b37ee/ga1.sml ga1 true ga1.sml sml 19444 127 219 IMAGE-THUMBNAIL 1-s2.0-S0926860X24001492-gr3.sml https://s3-eu-west-1.amazonaws.com/prod-ucs-content-store-eu-west/content/pii:S0926860X24001492/gr3/THUMBNAIL/image/gif/edc9497bc6875d93d6ef32687ae4c99c/gr3.sml gr3 gr3.sml sml 12226 128 219 IMAGE-THUMBNAIL 1-s2.0-S0926860X24001492-gr4.sml https://s3-eu-west-1.amazonaws.com/prod-ucs-content-store-eu-west/content/pii:S0926860X24001492/gr4/THUMBNAIL/image/gif/fd640200a784ee5f0e2361191ee4e244/gr4.sml gr4 gr4.sml sml 11073 163 187 IMAGE-THUMBNAIL 1-s2.0-S0926860X24001492-gr5.sml https://s3-eu-west-1.amazonaws.com/prod-ucs-content-store-eu-west/content/pii:S0926860X24001492/gr5/THUMBNAIL/image/gif/bf7a114b323c0c921b95ee17540259ff/gr5.sml gr5 gr5.sml sml 12288 164 196 IMAGE-THUMBNAIL 1-s2.0-S0926860X24001492-gr6.sml https://s3-eu-west-1.amazonaws.com/prod-ucs-content-store-eu-west/content/pii:S0926860X24001492/gr6/THUMBNAIL/image/gif/bfa4947871a31d4a9c8eb53610547f8b/gr6.sml gr6 gr6.sml sml 11820 109 219 IMAGE-THUMBNAIL 1-s2.0-S0926860X24001492-gr7.sml https://s3-eu-west-1.amazonaws.com/prod-ucs-content-store-eu-west/content/pii:S0926860X24001492/gr7/THUMBNAIL/image/gif/90aabc368361a8c52913bc485e68f1ca/gr7.sml gr7 gr7.sml sml 13574 164 201 IMAGE-THUMBNAIL 1-s2.0-S0926860X24001492-gr1_lrg.jpg https://s3-eu-west-1.amazonaws.com/prod-ucs-content-store-eu-west/content/pii:S0926860X24001492/HIGHRES/image/jpeg/d001ac233a0e51b5a884100e7f230072/gr1_lrg.jpg gr1 gr1_lrg.jpg jpg 874397 3334 3575 IMAGE-HIGH-RES 1-s2.0-S0926860X24001492-gr2_lrg.jpg https://s3-eu-west-1.amazonaws.com/prod-ucs-content-store-eu-west/content/pii:S0926860X24001492/HIGHRES/image/jpeg/4baadfa4edbb6ee14bdf7b926e9b1445/gr2_lrg.jpg gr2 gr2_lrg.jpg jpg 371796 2039 2495 IMAGE-HIGH-RES 1-s2.0-S0926860X24001492-ga1_lrg.jpg https://s3-eu-west-1.amazonaws.com/prod-ucs-content-store-eu-west/content/pii:S0926860X24001492/HIGHRES/image/jpeg/28ab3e9efb7c28fe7c0b3d681b0f31d4/ga1_lrg.jpg ga1 true ga1_lrg.jpg jpg 202554 886 1528 IMAGE-HIGH-RES 1-s2.0-S0926860X24001492-gr3_lrg.jpg https://s3-eu-west-1.amazonaws.com/prod-ucs-content-store-eu-west/content/pii:S0926860X24001492/HIGHRES/image/jpeg/1f7d581d34f55648c8dc66747ba0f667/gr3_lrg.jpg gr3 gr3_lrg.jpg jpg 429336 2097 3575 IMAGE-HIGH-RES 1-s2.0-S0926860X24001492-gr4_lrg.jpg https://s3-eu-west-1.amazonaws.com/prod-ucs-content-store-eu-west/content/pii:S0926860X24001492/HIGHRES/image/jpeg/117a7798583d1f5d4cd88ab1cf94adf4/gr4_lrg.jpg gr4 gr4_lrg.jpg jpg 330076 2181 2495 IMAGE-HIGH-RES 1-s2.0-S0926860X24001492-gr5_lrg.jpg https://s3-eu-west-1.amazonaws.com/prod-ucs-content-store-eu-west/content/pii:S0926860X24001492/HIGHRES/image/jpeg/269f639eeae11c88bee8c94fdfb3aef9/gr5_lrg.jpg gr5 gr5_lrg.jpg jpg 289987 2084 2495 IMAGE-HIGH-RES 1-s2.0-S0926860X24001492-gr6_lrg.jpg https://s3-eu-west-1.amazonaws.com/prod-ucs-content-store-eu-west/content/pii:S0926860X24001492/HIGHRES/image/jpeg/563668177c745642f4e398f5851dc781/gr6_lrg.jpg gr6 gr6_lrg.jpg jpg 410075 1781 3575 IMAGE-HIGH-RES 1-s2.0-S0926860X24001492-gr7_lrg.jpg https://s3-eu-west-1.amazonaws.com/prod-ucs-content-store-eu-west/content/pii:S0926860X24001492/HIGHRES/image/jpeg/53dac39690346f7ec26368c5e324fdcb/gr7_lrg.jpg gr7 gr7_lrg.jpg jpg 314441 2032 2495 IMAGE-HIGH-RES 1-s2.0-S0926860X24001492-mmc1.docx https://s3-eu-west-1.amazonaws.com/prod-ucs-content-store-eu-west/content/pii:S0926860X24001492/mmc1/MAIN/application/vnd.openxmlformats-officedocument.wordprocessingml.document/a6d252b084202bca0588c370fb800d61/mmc1.docx mmc1 mmc1.docx docx 467215 APPLICATION 1-s2.0-S0926860X24001492-si0001.svg https://s3-eu-west-1.amazonaws.com/prod-ucs-content-store-eu-west/content/pii:S0926860X24001492/image/svg+xml/0a9b0c15ad2600a4bcf608ec6610680b/si0001.svg si0001 si0001.svg svg 3946 ALTIMG 1-s2.0-S0926860X24001492-si0002.svg https://s3-eu-west-1.amazonaws.com/prod-ucs-content-store-eu-west/content/pii:S0926860X24001492/image/svg+xml/2276fa7e2f3e51768193c60bba4fc813/si0002.svg si0002 si0002.svg svg 5105 ALTIMG 1-s2.0-S0926860X24001492-am.pdf am am.pdf pdf 1500305 AAM-PDF https://s3-eu-west-1.amazonaws.com/prod-ucs-content-store-eu-west/content/egi:104XTGVP9HC/MAIN/application/pdf/8a1647162fd8fe41c5e3d420d251cbf4/am.pdf APCATA 119705 119705 S0926-860X(24)00149-2 10.1016/j.apcata.2024.119705 Elsevier B.V. Fig. 1 (a) Synthesis path diagram of Ru/LaQS; (b-d) TEM images and particle size distributions of Ru/LaQS with different loading; (e) TEM image of LaQS; (f) HR-TEM image of Ru/LaQS; (g) XRD spectra of Ru/LaQS with different loading; (h) N2 adsorption/desorption isotherms and pore size distribution of Ru2/LaQS and LaQS; (i) EDS elemental spectrum of Ru/LaQS. Fig. 1 Fig. 2 (a) IR spectra of LaQS and Ru/LaQS with different loading; (b-c) XPS spectra of C 1 s and N 1 s of LaQS and Ru/LaQS with different loading; (d) XPS spectra of Ru 3p of Ru/LaQS with different loading. Fig. 2 Fig. 3 (a) Reaction conditions: EL:1 mmol; H2: 2 MPa; 100 °C; 6 h; (b) H2-TPD spectra of Ru/LaQS at different loading; (c) TEM image of Ru2/ZIF-8; (d) XPS spectra of Ru 3p Ru2/LaQS, Ru2/ZIF-8 and Ru/C; (e) Model for the activation of H2 by Ru NPs; (f) Model for the activation of H2 by Ru NPs in Ru/LaQS. Fig. 3 Fig. 4 (a) Poisoning experiments of EL hydrogenation catalyzed by Ru2/LaQS; (b) NH3-TPD spectra of LaQS and Ru/LaQS with different loading; (c) In situ CO DRIFT-IR spectra of Ru/LaQS; (d) Pyridine IR spectra of Ru2/LaQS and LaQS. Fig. 4 Fig. 5 (a) EL at ultrafine Ru NPs; (b) EL at ultrafine Ru NPs on Ru/LaQS; (c) EL at La3+ on Ru/LaQS; (d) EL at La3+ on LaQS. Fig. 5 Fig. 6 (a) 4-HPE at ultrafine Ru NPs on Ru2/LaQS; (b) 4-HPE at La3+ on Ru/LaQS; (c) 4-HPE at La3+ on LaQS; (d) Presumed hydrogenation mechanism of EL to GVL. Fig. 6 Fig. 7 (a) Cycling experiments of Ru2/LaQS-catalyzed EL hydrogenation reaction (reaction conditions: EL: 1 mmol; H2: 2 MPa; 90 °C; 6 h); (b) XRD spectra of fresh and used Ru2/LaQS catalysts; (c) TEM and particle size of used Ru2/LaQS; (d) XPS spectra of Ru 3p in fresh and used Ru2/LaQS catalysts. Fig. 7 Synergistic catalysis of Ru0-Ru3+ in MOF supported ultrafine Ru nanoparticles catalyst promotes ethyl levulinate to γ-valerolactone Zirui Dao Writing – original draft Software Methodology Investigation Formal analysis Data curation a Ying Wang Validation Supervision a Chunyan Yang Methodology Investigation a Siyi Pu Methodology a Wei Yan Software a Di Tian Supervision Funding acquisition a Chungang Min Visualization Supervision Software b ⁎ Jie Zhao Software Project administration c Changfu Zhuang Writing – review & editing Writing – original draft Visualization Validation Supervision Software Resources Project administration Funding acquisition Formal analysis Data curation Conceptualization a ⁎ a Key Laboratory of Forest Resources Conservation and Utilization in the Southwest Mountains of China Forestry and grassland administration, Southwest Forestry University, Kunming 650051, PR China Key Laboratory of Forest Resources Conservation and Utilization in the Southwest Mountains of China Forestry and grassland administration, Southwest Forestry University Kunming 650051 PR China Key Laboratory of Forest Resources Conservation and Utilization in the Southwest Mountains of China Forestry and grassland administration, Southwest Forestry University, Kunming 650051, PR China b Research Center for Analysis and Measurement, Kunming University of Science and Technology, Kunming 650093, PR China Research Center for Analysis and Measurement, Kunming University of Science and Technology Kunming 650093 PR China Research Center for Analysis and Measurement, Kunming University of Science and Technology, Kunming 650093, PR China c Key Laboratory of Bionic Engineering, Ministry of Education, Jilin University, Changchun, 130022, PR China Key Laboratory of Bionic Engineering, Ministry of Education, Jilin University Changchun 130022 PR China Key Laboratory of Bionic Engineering, Ministry of Education, Jilin University, Changchun, 130022, PR China ⁎ Corresponding authors. Synthesis of bifunctional catalysts is very important for the hydrogenation of biomass to advanced biofuels, but its efficient regulation is difficult. In this work, a tunable bifunctional Ru/LaQS catalyst with Lewis acid and metal hydrogenation sites was prepared by stable MOFs (LaQS) supported ultrafine Ru nanoparticles (NPs). When the optimal Ru2/LaQS catalyst catalyzed bio-based ethyl levulinate (EL) to γ-valerolactone (GVL), the EL conversion and GVL selectivity reached 99.9% under mild conditions of 100 °C. The excellent catalytic performance is mainly attributed to the synergistic effect of Ru0-Ru3+ on ultrafine Ru NPs with only 1.60 nm generated by metal-support interaction, which is proved by experimental characterization and theoretical calculation. Moreover, the electron density of hydrogenation active site Ru0 and the content of acidic site Ru3+ can be modulated by Ru loading. Among them, the activation of H2 was promoted by the high electron density of Ru0 generated through metal-support electronic interactions. The enhanced medium-strong acidic site Ru3+ not only improved the activation of EL, but also promoted the intramolecular dealcoholization of the intermediate to GVL. The synergistic catalytic mechanism of Ru0-Ru3+ on ultrafine Ru NPs was speculated. The excellent stability was mainly attributed to the metal-support interaction stabilizing the ultrafine Ru NPs, which prevents the agglomeration and loss of Ru NPs during cycling. This work provides an in-depth understanding of the bifunctional catalytic mechanism, which is of guiding significance for the design and preparation of MOFs-based catalysts for biomass hydrogenation. Graphical Abstract An adjustable bifunctional Ru/LaQS catalyst with Lewis acid and metal hydrogenation activity was prepared by stable MOF (LaQS) supported ultrafine Ru nanoparticles. The excellent catalytic performance of ethyl acetylpropionate (EL) to γ-valerolactone (GVL) is mainly attributed to the synergistic effect of Ru0-Ru3+ on Ru NPs with only 1.60 nm generated by metal-support interaction. Keywords Metal-organic frameworks Ultrafine Ru NPs Support-metal interaction Ru0-Ru3+ synergistic catalysis Ethyl levulinateγ-valerolactone Data Availability Data will be made available on request. 1 Introduction Cheap and renewable biomass, as a precursor for the replacement of fossil energy, has attracted wide attention[1–4]. Among them, γ-valerolactone (GVL), which can be used as a renewable biofuel, has been widely studied because of its unique fuel characteristics[5]. Levulinic acid (LA) is listed as one of the twelve most important biomass platform molecules by the U.S. Department of Energy[6–8]. Levulinic acid is an important raw material for the synthesis of GVL, especially its esters have more advantages[9–11]. Compared with LA, ethyl levulinate (EL) is not acidic and has a relatively low boiling point, which is more advantageous to the stability of the catalyst and the corrosion resistance of the reaction vessel. Moreover, the catalytic conditions for the preparation of GVL by EL are milder and more environmentally friendly[12]. So, catalyzing EL to GVL is an environmentally friendly production route, but it still faces great challenges. The catalytic process of EL to GVL is divided into two steps: hydrogenation reduction and intramolecular dealcoholization, which are influenced by metal active sites and Lewis acid sites respectively[13,14]. Among them, the hydrogenation step depends on the activity of the metal catalyst, and the dehydration ring-closing step depends on the acidic site of the catalyst[15–17]. Therefore, the key to efficiently convert EL to GVL is the synergistic effect of hydrogenation active sites and Lewis acid sites in bifunctional regulatory catalysts. Currently, supported single-metal catalysts, especially noble-metal catalysts (Pt, Pd, Ru, etc.) have shown excellent performance in the hydrogenation of biomass platform compounds[18–21]. Among them, Ru has a lower barrier for CO than Pt and Pd[22]. Meanwhile, the supported nano-Ru catalyst has excellent activation ability for H2 molecules and CO bonds in LA and EL[23–26]. Gao et al. investigated the impact of different crystal types of CeO2-supported Ru on the catalytic hydrogenation of EL to GVL, and achieved complete conversion of EL with a GVL selectivity of 54.8% under conditions of 100 °C and 4 MPa H2 [23]. Shen et al. prepared CNT-Ru-1 catalyst by loading N-heterocyclic ruthenium carbon (NHC-Ru) on multi-wall carbon nanotubes (CNT), resulting in a 99% of the EL conversion and GVL yield of 93%, but a by-product of levulinic acid methyl ester[24]. Therefore, it is very necessary to develop efficient Ru-based catalysts under mild conditions. The metal particle size of supported metal catalysts will significantly affect the hydrogenation performance[27–29], especially the metal clusters with the size less than 2 nm[30,31]. Zhan et al. synthesized a Ru-based supported catalyst with the minimum Ru metal size (2.0 nm), which provided more active sites and achieved the highest yield of cyclohexanol in phenol hydrogenation[32]. Ning Yan et al. catalyzed the hydrogenation of aromatic plastic waste into aromatic hydrocarbons using Ru/Nb2O5 catalysts, attributing its exceptional performance to the small-sized Ru atoms on Nb2O5 that hindered adsorption and hydrogenation of aromatic rings[33]. Consequently, current research on hydrogenation catalysts focuses on preparing ultrafine metal particle catalysts with high activity and selectivity. With the deepening of research in recent years, it is found that the interaction between metal and support in supported catalysts can not only adjust the size of metal particles, but also effectively regulate the hydrogenation performance of the catalyst through electronic effect[34]. The literature has demonstrated that the acidity modulation of the catalyst surface can enhance the hydrogenation performance[35–39]. Literature shows that in the preparation process from LA to GVL, whether the intermediate HPA can be effectively converted into GVL under mild conditions mainly depends on Lewis acid sites[40,41]. Moreover, the intramolecular dehydration process of HPA is usually considered the rate-determining step[1]. The choice of support also has a great influence on the catalytic performance of supported Ru nanocatalysts in hydrogenation reactions[42]. Metal-organic frameworks (MOFs) materials are characterized by their large specific surface area and high porosity. The study of metal particles supported on stable MOFs support has attracted a lot of attention in the field of heterogeneous catalysis. Moreover, the interaction between MOFs support and metal nanoparticles (NPs) can not only disperse metal particles into small sizes, but also regulate the electronic effect between MOFs and metal NPs, so as to improve the catalytic performance[43–46]. Therefore, it is very necessary to develop MOFs-supported bifunctional Ru-based catalysts with Lewis acid and metal hydrogenation sites. In this work, noble metal Ru with excellent hydrogenation performance and low price was selected as the active component, and a bifunctional Ru/MOF catalyst with both hydrogenation sites and Lewis acid sites was designed, which can efficiently catalyze the conversion of EL to GVL under mild conditions. Highly dispersed ultrafine Ru NPs are generated by metal-support interaction, and electron-rich hydrogenation sites (Ru0) and enhanced Lewis acid sites (Ru3+) can be obtained by adjusting the loading of metal Ru. The influence of synergistic catalysis of Ru0-Ru3+ on ultrafine Ru NPs was studied by correlation characterization and theoretical calculation system, and the synergistic catalysis mechanism was also speculated. 2 Experimental 2.1 Materials LaCl3·xH2O (99.0%) and Ethyl levulinate (99.0%) were purchased from Adamas Reagent Co. RuCl3·xH2O and 8-Hydroxyquinoline-5-sulfonic Acid. Monohydrate was purchased from TCI (Shanghai). Development Co. isopropanol (99.7%), ethanol (99.7%), Dichloromethane(99.7%), Ethylenediamine (99.7%), N,N-Dimethylformamide (99.7%) and NaBH4 (99.7%) were purchased from Sinopharm Chemical Reagent Co. 2.2 Catalyst characterization X-ray photoelectron spectroscopy (XPS) analysis was performed with a monochromatic Al Kα X-ray source at 50 W, 15 KV on a PHI5000 Versaprobe II scanning XPS microprobe system. XPS spectra were fitted on the software MultiPak to analyze all elemental compositions and chemical species in the samples, with binding energy based on a C 1 s peak at 284.8 eV. Powder X-ray diffraction (XRD) spectra were recorded at 40 kV and 40 mA on a Rigaku Ultima X-ray diffraction spectrometer using copper Kα radiation (λ = 1.5418 Å). Transmission electron microscopy (TEM) and high resolution transmission electron microscopy (HR-TEM) were performed on a FEI Talos F200X American FEI instrument. High-angle annular dark-field scanning transmission electron microscopy (HAADF-STEM) images were imaged by an FEI Talos-F200S model at 300 kV equipped with an energy dispersive X-ray spectrometer (EDS). BET surface area and pore size measurements were done by N2 adsorption/desorption isotherms at −196 °C using Micromeritics ASAP 2460 instrument. Inductively coupled plasma emission spectrometry (ICP-OES) characterization was performed on the VISTA-MPX instrument. The sample is dissolved in a strong acid solution of HCl and HNO3, diluted, and then tested. Perform electron paramagnetic resonance (EPR) testing at room temperature using the Bruker EMXplus-6/1 spectrometer. Fourier transform infrared spectroscopy (FTIR) is used to analyze the changes in functional groups and chemical bonds in catalysts using the Nexus 670 spectrometer. The programmed temperature rise desorption (TPD) of NH3, CO2 and H2 were performed in a VDSorb-91i chemisorber equipped with a thermal conductivity detector (TCD). In the TPD test, the carrier/reference gas was first pre-treated in helium (30 mL min−1) at a rate of 10 °C min−1 to 150 °C for 1 h, then lowered to the adsorption temperature of 50 °C, and after the temperature stabilization, the carrier/reference gas was switched to the adsorption gas and adsorbed at a flow rate of 30 mL min−1 for 1 h. Then, the carrier gas was switched to helium (30 mL min−1) and purged for 1 h. After the baseline After the baseline was stabilized, the temperature was increased to 300 °C at a rate of 10 °C min−1, and the signal was recorded ten times every 1 s. In situ adsorption pyridine infrared spectroscopy (Pyridine IR) was collected on Tensor 27 spectrometer. The potassium bromide compression method was used with a resolution of 2 cm−1 and a scanning frequency of 64. Vacuum purify 20 mg of the sample at 200 °C for 1 h. Then cool to room temperature, and record the initial background spectrum at this time; Then expose the sample to pyridine vapor for 0.5 h, and then introduce He gas for 0.5 h to remove excess pyridine. To evaluate the chemical adsorption strength of pyridine, the infrared cells were heated to 90 °C, 190 °C and 290 °C (with a heating rate of 10 °C min−1) and maintained for 1 h. After cooling to room temperature, collect an infrared spectrum of 1400–1700 cm−1. Density functional theory (DFT) calculations were performed in Vienna ab initio simulation package (VASP) with the generalized gradient approximation (GGA) using the Perdew-Burke-Ernzerhof (PBE) functional. The projected augmented wave (PAW) potentials were used to describe the ionic cores and valence electrons were also considered using a plane wave basis set with a kinetic energy cutoff of 400 eV. Geometry optimizations were performed with the force convergency smaller than −0.03 eV Å−1. A 3 × 3 × 1 k-point grid of the Brillouin zone is used. The adsorption energies (Eads) of ethyl levulinate and hydrogen were defined by the following equations: (1) E ads = E total – (E slab + E g) Where Etotal is the total energy of the ideal surface containing the adsorbate; Eslab is the energy of the ideal surface, and Eg is the energy of EL and H2 in the gas phase, respectively. 2.3 Catalyst preparation 2.3.1 Preparation of LaQS support Ru/LaQS was prepared by the impregnation method. LaCl3 and 8-Hydroxyquinoline-5-sulfonic Acid were used as the main materials for the synthesis of LaQS. LaCl3 (1.22 g) and 8-Hydroxyquinoline-5-sulfonic Acid (0.8 g) were fully dissolved at room temperature in 50 mL of DMF, followed by the dropwise addition of about 1 mL of ethylenediamine to the mixture, which was thoroughly stirred and transferred to a 100 mL PTFE-lined stainless steel autoclave and fully crystallized at 100 °C under autogenous pressure for 2 days. The resulting yellow crystals were filtered out and LaQS was obtained by drying after sufficient washing in ethanol. 2.3.2 Preparation of Ru/LaQS Weigh 0.4 g of LaQS obtained in the previous step and pour it into 40 mL of distilled water, stirring for 30 min to ensure that the LaQS was uniformly dispersed, which was referred to as Liquid A. Then weigh 0.5 wt%, 1 wt% and 2 wt% of the corresponding RuCl3 in 20 mL of aqueous solution, and the resulting solution is called liquid B. Liquid B was slowly dripped into liquid A and stirred for 4 h. Then 20 mL of NaBH4 solution with a concentration of 0.5 mol L−1 was slowly dripped into the mixture and stirred for another 4 h. Finally, the solution was filtered to obtain a solid and then dried sufficiently to obtain Ru0.5/LaQS, Ru1/LaQS and Ru2/LaQS catalysts. 2.4 Catalytic evaluation The EL hydrogenation reaction was carried out in a 25 mL stainless steel autoclave having a magnetic stirrer. Typically, 1 mmol EL, 50 mg of catalyst and 8 mL of isopropanol were loaded into the reactor. The reactor was purged three times with H2 and then pressurized to 2 MPa. The reaction temperature and reaction time were set and magnetic stirring was maintained at a rate of 800 rpm throughout the reaction. At the end of the reaction the filtrate was removed with a filter membrane after cooling to room temperature. The used catalyst was washed three times with ethanol and then extracted and dried, and continued to be used for subsequent catalyst cycling experiments. The liquid phase reactants were identified using GC-MS (GCMS-QP2010 SE, Shimadzu) and the reaction samples were analyzed by GC (GC- 7890 A, Agilent). The conversion of EL and selectivity of the products were calculated as follows: (2) Conversion % = Mole of EL converted Mole of EL loaded × 100 % (3) Selectivity % = Mole of GVL produced Mole of product produced × 100 % 3 Results and discussion 3.1 Interaction between the LaQS support and ultrafine Ru nanoparticles 3.1.1 LaQS anchored ultrafine Ru nanoparticles Fig. 1a shows that based on the previous work, a La-MOF (LaQS) with high stability and specific surface area was synthesized[47]. Rux/LaQS materials loaded with different contents of ultrafine Ru NPs (0.5 wt%, 1 wt%, 2 wt%) were prepared by impregnation method with LaQS as support, where x is the theoretical loading of Ru. The actual metal loading of Ru/LaQS determined by ICP were 0.29 wt%, 0.72 wt% and 1.60 wt%, respectively (Table S1). Based on the analysis of the TEM of Ru/LaQS with different loading (Fig. 1b-d), the results showed that when the Ru loading was 0.5 wt%, it was difficult to clearly observe the presence of ultrafine Ru NPs due to the low content. When the loading amount of Ru is 1 wt%, ultrafine Ru NPs can be seen uniformly dispersed on LaQS. And the average particle size is slightly increased from 1.51 nm of 0.5 wt% to 1.53 nm of 1 wt%. When the loading of Ru increased to 2 wt%, the number of ultrafine Ru NPs increased significantly, but the average particle size was only 1.60 nm. This shows that the catalyst still has high dispersibility even when the loading is 2 wt%. The reasons for the uniform distribution of ultrafine Ru NPs on LaQS support may be as follows: On the one hand, LaQS support is lamellar structure (Fig. 1e), which provides more open adsorption sites for supporting metal Ru. On the other hand, there are abundant coniugated π bonds of quinoline ring on the surface of LaQS support, which can interact with metal Ru. This can effectively avoid Ru metal agglomeration. In addition, Fig. 1f clearly shows the lattice stripes of metal Ru, and the detected lattice spacing is 0.158 nm, corresponding to the 102 crystal plane of single crystal Ru (PDF#89–3942). According to the EDS element map of Ru2/LaQS (Fig. 1i), C, N, O, S, La and Ru are uniformly distributed in the structure. Moreover, the elements are highly coincident, which also proves the uniform dispersion of Ru on LaQS support. The XRD of LaQS support and Ru/LaQS with different Ru loading is shown in Fig. 1g. The XRD diffraction peaks of Ru/LaQS and LaQS support are basically the same, which indicates that the structure of LaQS remains stable after loading ultrafine Ru NPs. Immersion treatment of LaQS support in different NaBH4 concentrations confirms the structural stability of LaQS during NaBH4 treatment(Figure S1). Meanwhile, it is difficult to observe the XRD diffraction peak of ultrafine Ru NPs in Ru/LaQS. This may be because the Ru loading is less and the dispersion is even. The structures of LaQS and Ru2/LaQS were tested by N2 physical adsorption/desorption. As shown in Fig. 1h, the sample is a typical type IV adsorption-desorption isotherm, which indicates that the sample has the structure of micro-mesoporous coexistence. Moreover, the Langmuir specific surface area of LaQS is as high as 843.37 m2 g−1, which can make the ultrafine Ru NPs disperse more evenly. 3.1.2 Electronic effects of support and metal NPs LaQS and Ru/LaQS with different loading were analyzed by infrared spectrum ( Fig. 2a). Compared with the CC stretching vibration (1654 cm−1) of quinoline ring in LaQS, the absorption peak of Ru/LaQS gradually disappears. The possible reason is that the coniugated π bonds on quinoline ring in LaQS interacts with ultrafine Ru NPs. The XPS spectra of N 1 s[47,48] and C 1 s[49,50] of Ru/LaQS with different loads can also support this inference (Fig. 2b). Fig. 3c shows XPS spectra of N 1 s on Ru/LaQS with different Ru loading. Compared with the 398.87 eV of LaQS, the binding energy of N in Ru0.5/LaQS, Ru1/LaQS and Ru2/LaQS increased to 399.08, 399.16 and 399.28 eV, respectively. This proves that electrons move from N on LaQS support to Ru, which indicates the interaction between Ru NPs and CN in the quinoline ring on LaQS. With the increase of Ru loading in Ru/LaQS, the binding energy of N 1 s increases. This shows that the more electrons are transferred from N of LaQS support to Ru. Because XPS analysis needs to be corrected by C peak, it is impossible to determine the interaction between CC and ultrafine Ru NPs by C peak shift of different loading (Fig. 2b). However, with the increasing Ru loading, the relative content of CC bond in Fig. 2b decreased from 73.21% in LaQS to 42.42% in Ru2/LaQS (Table S2). Moreover, with the increase of Ru loading, the area of C peak also decreases. This shows that the increase of Ru content leads to the decrease of CC bond content. This is consistent with the results of IR spectra. This further proves the interaction between Ru NPs and CC in the quinoline ring on LaQS. It is inferred that the electrons on the CC bond move to the ultrafine Ru NPs, which leads to the decrease of the electron cloud density. In addition, we also analyzed the XPS spectra of O1s and La 3d with different loads (Figure S4), and there was no significant change in binding energy. This indicates that Ru NPs mainly interacts with the conjugated π bonds (CN and CC) of the quinoline ring on the LaQS support. Therefore, the interaction between support and metal leads to the ultrafine Ru NPs in Ru/LaQS being only 1.60 nm. The interaction between the LaQS support and the ultrafine Ru NPs not only helps its stabilization and dispersion, but also affects the electron density of Ru0. Fig. 2d shows the XPS spectra of Ru 3p on Ru/LaQS with different Ru loading[51]. The peaks at 464 eV and 486 eV are attributed to Ru0, while the peaks at 467 eV and 489 eV belong to Ru3+. Based on the spectra of O 1 s and Cl 3p, we conclude that Ru3+ exists in the form of RuCl3 on LaQS(Figure S4-S5). Compared with the 464.45 eV of Ru in Ru0.5/LaQS, the binding energy of Ru1/LaQS moves to 463.96 eV, while that of Ru2/LaQS moves to 463.65 eV. The binding energy of Ru0 shifted to the lower direction by 0.49 eV and 0.8 eV, respectively, which proves the increase of electron density of Ru0 in Ru/LaQS. And as the Ru loading in Ru/LaQS is larger, the electron density transferred from the LaQS supporter to Ru0 is larger. Therefore, Ru loading can modulate the electronic effect of LaQS support with ultrafine Ru NPs. That is, the increase of Ru loading not only increased the electron density of Ru0, but also raised the content of Ru0 and Ru3+ (Table S3). 3.2 Ru0-Ru3+ synergistic catalysis of EL 3.2.1 Ru0 with high electron density promotes catalytic performance Fig. 3a shows the comparison of catalytic performance of different catalysts in EL hydrogenation under the same reaction conditions of 100 °C and 6 h. The results showed that GVL was not detected without catalyst. When the reaction was catalyzed by LaQS support, only 10.4% conversion and 28.5% selectivity were obtained. This shows that LaQS can catalyze the reaction with acid-base synergy[47], but its catalytic performance is very low due to the weak acidic sites. When Ru2/LaQS was used as catalyst, the conversion of EL and the selectivity of GVL reached 99.9%. The commercial catalyst Ru/C has only 71.9% conversion and 78.7% selectivity. XPS results show that the acid site Ru3+ in Ru/C is only 9.58%, which may lead to lower catalytic performance than Ru2/LaQS. When Ru2/ZIF-8 was used as the control catalyst, only 44.0% conversion and 47.9% selectivity were obtained. From the TEM of Ru2/ZIF-8 (Fig. 3c), it can be found that the metal nano-size of Ru2/ZIF-8 is much higher than that of Ru2/LaQS under the same metal loading. Meanwhile, the XPS of Ru 3p in the catalyst prepared with ZIF-8 and LaQS as support was compared (Fig. 3d). Compared with 464.16 and 464.02 eV of Ru2/ZIF-8 and Ru/C, the Ru binding energy of Ru2/LaQS is reduced to 463.65 eV. It shows that higher electron density is produced on Ru0 in Ru2/LaQS, which plays a key role in promoting the high activity of catalytic reaction. By comparing the reported Ru-based catalysts, only Ru2/LaQS can achieve 99.9% selectivity for GVL under mild reaction conditions (Table S4). In order to analyze the H2 adsorption capacity of the catalyst, H2-TPD (Fig. 3b) curves of Ru/LaQS with different loadings were studied. Compared with the loading of 0.5 wt% and 1 wt%, the H2 desorption peak area of 2 wt% Ru2/LaQS is greatly increased. This is because when the loading of Ru increases, the electron density of Ru in the catalyst increases and the adsorption capacity for H2 increases. Moreover, the desorption peak of Ru2/LaQS at 210 °C showed an obvious tendency to shift to the direction of temperature increase. It shows that there is a stronger interaction between metal Ru and LaQS support in Ru2/LaQS catalyst with higher Ru loading. Therefore, the main reason why Ru2/LaQS has high catalytic activity is its small size and high electron density of Ru0. On the one hand, Ru2/LaQS has a high Langmuir specific surface area (533.87 m2 g−1) and an ultra-small ultrafine Ru NPs size of 1.60 nm, which will increase the active site density. On the other hand, increasing Ru loading leads to higher electron density of Ru0 in Ru2/LaQS. This improves the feedback from Ru to H-H antibonding orbitals and reduces the activation energy of hydrogen adsorption. This is helpful to improve the activation ability of H2. In addition, the micro-mesoporous pores of Ru2/LaQS provide great convenience for the transport of reactants and products, and the reactive molecules are more likely to contact with active sites. This is also helpful to improve the activity of Ru2/LaQS catalyst. Density Functional Theory (DFT) calculations were used to corroborate the inference that ultrafine Ru nanoparticles are active sites for hydrogenation. Fig. 3e-f are the activation models of H2 for ultrafine Ru NPs alone and Ru NPs in Ru/LaQS, respectively. Compared with the bond length between two hydrogen atoms in free H2 (0.751 Å), the bond length of ultrafine Ru NPs after adsorption increased to 0.886 Å. However, the bond length of Ru NPs in Ru2/LaQS increased to 0.969 Å after H2 activation. This further proves that Ru0 is a hydrogenation site, which can adsorb and activate H2 molecules well. This also shows that the interaction between metal and support in Ru2/LaQS promotes the activation of H2, which is consistent with the characterization and catalytic results. 3.2.2 Enhanced acid site Ru3+ promotes catalytic performance The influence of acid-base sites on the hydrogenation of EL was studied by the experiment of poisoning EL catalyzed by Ru2/LaQS. In Fig. 4a, when the acidic sites poisoned by KSCN are added in the reaction, the conversion and selectivity are significantly reduced from 99.9% to 0%, which shows that acidic sites must exist. When benzoic acid was added to poison the basic sites, the conversion and selectivity of 99.9% decreased to 10.9% and 79.4%, respectively. This shows that alkaline sites play an important role in promoting, which is consistent with the literature[52]. In order to further discuss the influence of acid-base sites on hydrogenation reaction, NH3-TPD and CO2-TPD tests were carried out. The alkaline sites were analyzed by CO2-TPD (Figure S3), and the adsorption peaks of LaQS support at 225 °C and Ru/LaQS at 170 °C were presumed to be electron-rich N on LaQS support. Because of the interaction between the loaded ultrafine Ru NPs and electron-rich N, the electron cloud density of N decreases, which leads to the weakening of its alkalinity. However, the weak base sites near 210 °C may be metal Ru in Ru/LaQS with different loading. XPS analysis of Ru 3p shows that the increase of Ru loading leads to more electron transfer from LaQS support to ultrafine Ru NPs. This leads to the higher the electron density of Ru0, the stronger the alkalinity. The acid sites were further analyzed by NH3-TPD (Fig. 4b). It can be seen from Fig. 4b that the greater the Ru loading on LaQS, the stronger the acidity of Ru/LaQS. The NH3 desorption peak of Ru/LaQS loaded with different amounts of Ru at 90 °C may be caused by physical adsorption. The desorption peak at 150 °C may be the acidic site caused by the desorption of unsaturated La ions of DMF molecules[47]. It is worth noting that NH3-TPD has a new desorption peak at 210 °C, and the desorption peak is stronger with the increase of Ru loading. This corresponds to the Ru3+ content of Ru0.5/LaQS (13.29%) in the XPS of Ru 3p increasing to 15.93% of Ru2/LaQS (Table S3). Compared with Ru2/LaQS, the desorption peak of Ru3/LaQS at 210 °C is further increased when the addition of Ru increased to 3 wt% (Fig. 4b). Moreover, NH3-TPD of LaQS-NaBH4 did not show the medium-strong acid site, which further indicates that Ru3+ in Ru/LaQS is the new intermediate-strong Lewis acid site. Meanwhile, it also shows that the loading of Ru on LaQS support can regulate the intermediate-strong acid sites of Ru/LaQS. Therefore, Ru2/LaQS with higher Ru loading has higher acid strength, which is helpful to improve the catalyst's ability to activate CO on EL[53]. Characterization using in situ CO diffuse reflectance infrared spectroscopy (in situ CO DRIFT-IR) revealed that two CO strong absorption bands were detected at the vicinity of 2171 and 2119 cm−1 for the reduced Ru/LaQS catalysts (Fig. 4c), which corresponds to the linear adsorption of CO onto Ru ions[54,55]. In contrast, there is no CO absorption band in the range of 1800–2100 cm−1, indicating that Ru0 is not adsorbed on CO. This further suggests that Ru3+ is the active site for the activation of EL, which is consistent with the XPS and NH3-TPD analyses.The spectral analysis of the pyridine IR of Ru2/LaQS with LaQS at 90 °C is presented in Fig. 4d. The two strong absorption peaks at 1612 cm−1 and 1448 cm−1 are attributed to Lewis acid sites, which are caused by pyridine adsorption on Ru3+. While the absorption peak at 1580 cm−1 may be caused by unsaturated La3+. Brönsted acid site is represented near 1540 cm−1, and the weak absorption peak at 1490 cm−1 corresponds to the co-adsorption of pyridine on Lewis and Brønsted acid sites[56]. Meanwhile, an interesting phenomenon was found that the Lewis acid to Brönsted acid ratio (L/B) was much larger for Ru2/LaQS (9.840: 5.622) as compared to that in LaQS. And this phenomenon was still present at the elevated desorption temperatures of 190 °C (6.355: 4.369) and 290 °C (3.474: 2.710) (Table S5). This proves that the interaction of ultrafine Ru NPs with the support produces a higher proportion of medium-strong Lewis acid sites, which is consistent with the results of NH3-TPD. It was also shown that the higher GVL yields from LA hydrogenation over Zr-Beta zeolite catalysts are attributed to the presence of Lewis acid sites[57]. In order to investigate the activation effect on EL after metal loading, DFT theoretical calculations were carried out for the adsorption of EL on alone ultrafine Ru NPs, Ru NPs and La3+ sites in Ru2/LaQS, respectively ( Fig. 5a-c). From the poisoning experiments of EL hydrogenation, it is known that the acidic sites are poisoned by KSCN and the EL conversion is 0 (Fig. 4a). And the Lewis acidic sites on the catalyst surface originated from Ru3+ in ultrafine Ru NPs and La3+ in LaQS. This indicates that EL adsorption at Ru3+ or La3+ is activated. As can be seen from the Fig. 5a-c, the adsorption energy of Ru3+ in Ru/LaQS for EL (-1.419 eV) is much larger than that of La3+ (-0.654 eV), which represents that the CO of EL is mainly activated on Ru3+ in Ru/LaQS[58]. Meanwhile, comparing the bond length of CO on free EL (1.222 Å), the bond lengths of Ru3+ and La3+ adsorbed CO in Ru2/LaQS grew to 1.256 Å and 1.227 Å, respectively, which further suggests that the EL adsorbed at Ru3+ in Ru/LaQS. Meanwhile, in combination with NH3-TPD analysis (Fig. 4b), the Lewis acidic site Ru3+ with medium-strong acidic strength was the main active site for the activation of EL. In addition, the commercial catalyst Ru/C had high EL conversion (71.9%) and GVL selectivity (78.7%) under the same conditions, but was lower than that of Ru2/LaQS (99.9%) (Fig. 3a). The possible reason is that Ru/C is only 9.58% compared to Ru3+ content of Ru2/LaQS (15.93%). Meanwhile, compared with 1.254 Å for the adsorption of CO bond of EL at ultrafine Ru NPs (Fig. 5a), CO bond length by Ru3+ in Ru2/LaQS increases to 1.256 Å (Fig. 5b). This shows that the interaction between LaQS and ultrafine Ru NPs promotes the activation of EL at Ru3+ on Ru2/LaQS. According to the literature, Lewis acid have a major role in the molecular dealcoholization reaction in EL hydrogenation[52,59]. According to XPS and NH3-TPD analyses, Ru2/LaQS with higher Ru loading has higher acid strength, which contributes to the intramolecular dealcoholization process of the intermediate 4-hydroxyvalerate (4-HPE). To further investigate the role of acidic sites in the dealcoholization process of the intermediate, DFT theoretical calculations were made for the adsorption of 4-HPE at ultrafine Ru NPs and La3+ on Ru/LaQS, and La3+ on LaQS, respectively. Relative to the adsorption energy of La3+ on Ru/LaQS for C-O in 4-HPE (-0.460 eV), the adsorption energy of Ru3+ on Ru/LaQS is increased to −1.217 eV, which indicates that the intermediate 4-HPE is also mainly adsorbed on Ru3+ of Ru/LaQS. This is consistent with the analysis results of EL adsorption on Ru3+ of Ru/LaQS. Moreover, the adsorption energy of Ru3+ and La3+ on Ru/LaQS for C-O in 4-HPE (-1.217 eV and −0.460 eV) were also larger than that of La3+ on LaQS (-0.446 eV), which suggests that the interaction between LaQS and ultrafine Ru NPs in Ru/LaQS promotes the adsorption of 4-HPE. Meanwhile, compared with the C-O bond length on free 4-HPE (1.441 Å), the C-O bond length adsorbed at Ru3+ on Ru/LaQS increased to 1.489 Å. However, the bond length of C-O in 4-HPE adsorbed by La3+ on Ru/LaQS is only 1.434 Å. This further shows that Ru3+ on Ru/LaQS has a stronger effect on 4-HPE, which is more beneficial to the next dealcoholization reaction. Based on the above analysis, the reaction mechanism of catalytic hydrogenation of EL by Ru2/LaQS was hypothesized ( Fig. 6d). The hydrogenation reaction of EL undergoes EL hydrogenation to generate the intermediate 4-HPE and intramolecular dealcoholization of 4-HPE to generate GVL, which requires bifunctional catalysts possessing both the hydrogenation active site and the Lewis acidic site. Experimental results and DFT calculations indicate that ultrafine Ru NPs (1.60 nm) on the LaQS surface are the key sites for the conversion of EL to GVL. Characterization results demonstrated that the strong metal-support effect in Ru2/LaQS resulted in the increase of Ru loading not only increased the electron density and content of Ru0, but also the content of Ru3+ (Table S3). First, H2 molecules adsorbed on the Ru0 active sites with high-electron-density were activated to hydrogen atoms. Meanwhile, NH3-TPD and DFT demonstrated that the Ru3+ sites can effectively adsorb CO in EL, which is also consistent with literature reports[58]. Then, the activated H atoms attack the CO on the adjacent activated EL to generate the intermediate 4-HPE. -O-H of 4-HPE adsorbs on the Ru3+ and basic sites, respectively. Lewis acidic sites play a key role in the generation of GVL from 4-HPE[52,59]. The medium-strong Lewis acidic sites on the catalyst surface are mainly derived from Ru3+ in Ru/LaQS. As the increase of Ru loading raises the content of medium-strong acid Ru3+, the intramolecular ester exchange reaction on the acidic sites of the catalyst to remove ethanol can easily convert 4-HPE to GVL without any other by-products. Finally, the generated GVL was desorbed from the catalyst surface, and the catalytically active sites were directly recycled. It can be seen that the synergistic effect of Ru0-Ru3+ promotes the adsorption of reactants and the formation of the intermediate 4-HPE, and significantly accelerates the intramolecular dehydrogenation of 4-HPE to GVL via intramolecular nucleophilic addition. 3.2.3 The interaction between the support and Ru NPs improves the stability As an important element in the examination of catalyst performance, the cycling test of Ru2/LaQS in the EL selective hydrogenation was investigated. After the EL hydrogenation was completed, the catalyst was allowed to dry and then repeated for EL hydrogenation at a reduced reaction temperature (90 °C). After three cycle reactions, the EL conversion of and GVL selectivity remained unchanged, indicating the excellent stability of the catalyst ( Fig. 7a). The used Ru2/LaQS catalyst was shown to be similar to the fresh catalyst by XRD analysis (Fig. 7b). XPS analysis of fresh and used Ru2/LaQS catalysts showed that the Ru0 and Ru3+ content of the ultrafine Ru NPs were essentially unchanged (Fig. 7d). According to TEM, it can be seen that the Ru NPs did not undergo significant clustering (Fig. 7c). Meanwhile, Ru was not observed within the detection limit of ICP-OES, indicating that no loss of Ru occurred during the reaction. This suggests that the reaction is a non-homogeneous catalytic process and further demonstrates the stability of Ru2/LaQS. The high stability of Ru2/LaQS during the cycle is mainly attributed to the coordination between ultrafine Ru NPs and the quinoline ring on LaQS support through coniugated π bonds, which anchors ultrafine Ru NPs to prevent agglomeration and metal loss. 4 Conclusions In summary, the Ru/LaQS catalyst with LaQS supported ultrafine Ru NPs is a highly active and stable bifunctional catalyst with hydrogenation center and Lewis acid, which is used for EL to GVL at low temperature. The experimental results and theoretical calculations show that the synergistic effect between the hydrogenation site Ru0 and Lewis acid site Ru3+ on Ru/LaQS has a decisive role in EL conversion and product selectivity. The metal-support effect in Ru2/LaQS results in a ultrafine Ru NPs size of only 1.60 nm. Meanwhile, the increase of Ru loading not only increases the electron density of Ru0, but also increases the content of Ru0 and Ru3+. The synergistic interaction of Ru0-Ru3+ on ultrafine Ru NPs facilitated the conversion of H2 and EL, and the intramolecular dealcoholization of the intermediate to GVL, which significantly increased the yield of GVL (99.9%). The electron-rich Ru0 active site caused by the electron transfer from LaQS to Ru0 effectively adsorbed and activated H2 molecules. The Lewis acidic site Ru3+, which was increased in content, not only effectively adsorbed and activated the CO group in EL, but also was the key site for the intramolecular dehydrogenation of the intermediate 4-HPE to GVL. In addition, the strong interaction between the Ru metal and LaQS support prevented the agglomeration and loss of ultrafine Ru NPs during cycling. The bifunctional modulation strategy through metal-acidic sites provide a reference for the use of MOFs-based catalysts for biomass conversion. CRediT authorship contribution statement Chunyan Yang: Methodology, Investigation. Siyi Pu: Methodology. Zirui Dao: Writing – original draft, Software, Methodology, Investigation, Formal analysis, Data curation. Ying Wang: Validation, Supervision. Wei Yan: Software. Di Tian: Supervision, Funding acquisition. Chungang Min: Visualization, Supervision, Software. Jie Zhao: Software, Project administration. Changfu Zhuang: Writing – review & editing, Writing – original draft, Visualization, Validation, Supervision, Software, Resources, Project administration, Funding acquisition, Formal analysis, Data curation, Conceptualization. Declaration of Competing Interest The authors declare that they have no known competing financial interests or personal relationships that could have appeared to influence the work reported in this paper. Acknowledgements This work was supported by the National Natural Science Foundation of China (32360430, 32260368, 31760190), Science and Technology Planning Project of Yunnan Province (202101BD070001-007, 202101BD070001-052, 202201AU070066), Young and Middle-aged Academic and Technical Leaders Project in Yunnan Province (202205AC160052). Appendix. Supporting Information Comparison of actual loading for Rux/LaQS with different loading by ICP, C-C/CC content of C 1 s in LaQS and Rux/LaQS with different loading, Ru0/Ru3+ content of Ru 3p in Ru/C and Rux/LaQS with different loading, Hydrogenation of EL using different Ru catalysts for the preparation of GVL, Different acid contents and comparison of Ru2/LaQS and LaQS, XPS spectra of Ru 3d for RuCl3, Ru3+/ZIF-8 and Ru3+/LaQS, CO2-TPD spectra of LaQS and different loadings of Ru/LaQS, XPS spectra of La 3d and O 1 s of LaQS and Ru/LaQS with different loading, XPS spectra of Cl 3p of Ru2/LaQS with different loading. Appendix A Supporting information Supplementary data associated with this article can be found in the online version at doi:10.1016/j.apcata.2024.119705. Appendix A Supplementary material Supplementary material References [1] S. Chen R. Wojcieszak F. Dumeignil E. Marceau S. Royer How catalysts and experimental conditions determine the selective hydroconversion of furfural and 5-hydroxymethylfurfural Chem. Rev. 118 2018 11023 11117 S. Chen, R. Wojcieszak, F. Dumeignil, E. Marceau, S. Royer, How Catalysts and Experimental Conditions Determine the Selective Hydroconversion of Furfural and 5-Hydroxymethylfurfural, Chemical Reviews, 118 (2018) 11023-11117. [2] M. Nasrollahzadeh N. Shafiei Z. Nezafat N.S.S. Bidgoli Recent progresses in the application of lignin derived (nano)catalysts in oxidation reactions Mol. Catal. 489 2020 M. Nasrollahzadeh, N. Shafiei, Z. Nezafat, N.S.S. Bidgoli, Recent progresses in the application of lignin derived (nano)catalysts in oxidation reactions, Molecular Catalysis, 489 (2020). [3] D.J. Hayes An examination of biorefining processes, catalysts and challenges Catal. Today 145 2009 138 151 D.J. Hayes, An examination of biorefining processes, catalysts and challenges, Catalysis Today, 145 (2009) 138-151. [4] A.J. Ragauskas C.K. Williams B.H. Davison G. Britovsek J. Cairney C.A. Eckert W.J. Frederick J.P. Hallett D.J. Leak C.L. Liotta J.R. Mielenz R. Murphy R. Templer T. Tschaplinski Science Path Forw. Biofuels Biomater. 311 2006 484 489 A.J. Ragauskas, C.K. Williams, B.H. Davison, G. Britovsek, J. Cairney, C.A. Eckert, W.J. Frederick, J.P. Hallett, D.J. Leak, C.L. Liotta, J.R. Mielenz, R. Murphy, R. Templer, T. Tschaplinski, The Path Forward for Biofuels and Biomaterials, Science, 311 (2006) 484-489. [5] I.T. Horváth H. Mehdi V. Fábos L. Boda L.T. Mika γ-Valerolactone—a sustainable liquid for energy and carbon-based chemicals Green. Chem. 10 2008 238 242 I.T. Horváth, H. Mehdi, V. Fábos, L. Boda, L.T. Mika, γ-Valerolactone—a sustainable liquid for energy and carbon-based chemicals, Green Chem., 10 (2008) 238-242. [6] Z. Wei X. Li J. Deng J. Wang H. Li Y. Wang Improved catalytic activity and stability for hydrogenation of levulinic acid by Ru/N-doped hierarchically porous carbon Mol. Catal. 448 2018 100 107 Z. Wei, X. Li, J. Deng, J. Wang, H. Li, Y. Wang, Improved catalytic activity and stability for hydrogenation of levulinic acid by Ru/N-doped hierarchically porous carbon, Molecular Catalysis, 448 (2018) 100-107. [7] S. Gadamsetti N. Mathangi S. Hussain V. Kumar Velisoju K.V.R. Chary Vapor phase esterification of levulinic acid catalyzed by γ-Al2O3 supported molybdenum phosphate catalysts Mol. Catal. 451 2018 192 199 S. Gadamsetti, N. Mathangi, S. Hussain, V. Kumar Velisoju, K.V.R. Chary, Vapor phase esterification of levulinic acid catalyzed by γ-Al2O3 supported molybdenum phosphate catalysts, Molecular Catalysis, 451 (2018) 192-199. [8] R. Yoshida D. Sun Y. Yamada S. Sato Stable Cu-Ni/SiO2 catalysts prepared by using citric acid-assisted impregnation for vapor-phase hydrogenation of levulinic acid Mol. Catal. 454 2018 70 76 R. Yoshida, D. Sun, Y. Yamada, S. Sato, Stable Cu-Ni/SiO2 catalysts prepared by using citric acid-assisted impregnation for vapor-phase hydrogenation of levulinic acid, Molecular Catalysis, 454 (2018) 70-76. [9] S. Dutta I.K.M. Yu D.C.W. Tsang Y.H. Ng Y.S. Ok J. Sherwood J.H. Clark Green synthesis of gamma-valerolactone (GVL) through hydrogenation of biomass-derived levulinic acid using non-noble metal catalysts: a critical review Chem. Eng. J. 372 2019 992 1006 S. Dutta, I.K.M. Yu, D.C.W. Tsang, Y.H. Ng, Y.S. Ok, J. Sherwood, J.H. Clark, Green synthesis of gamma-valerolactone (GVL) through hydrogenation of biomass-derived levulinic acid using non-noble metal catalysts: A critical review, Chemical Engineering Journal, 372 (2019) 992-1006. [10] D.M. Alonso S.G. Wettstein J.A. Dumesic Gamma-valerolactone, a sustainable platform molecule derived from lignocellulosic biomass Green. Chem. 15 2013 D.M. Alonso, S.G. Wettstein, J.A. Dumesic, Gamma-valerolactone, a sustainable platform molecule derived from lignocellulosic biomass, Green Chemistry, 15 (2013). [11] W.R.H. Wright R. Palkovits Development of Heterogeneous Catalysts for the Conversion of Levulinic Acid to γ-Valerolactone ChemSusChem 5 2012 1657 1667 W.R.H. Wright, R. Palkovits, Development of Heterogeneous Catalysts for the Conversion of Levulinic Acid to γ-Valerolactone, ChemSusChem, 5 (2012) 1657-1667. [12] J.J. Bozell G.R. Petersen Technology development for the production of biobased products from biorefinery carbohydrates—the US Department of Energy’s “Top 10” revisited Green. Chem. 12 2010 J.J. Bozell, G.R. Petersen, Technology development for the production of biobased products from biorefinery carbohydrates—the US Department of Energy’s “Top 10” revisited, Green Chemistry, 12 (2010). [13] J. He H. Li Y. Xu S. Yang Dual acidic mesoporous KIT silicates enable one-pot production of γ-valerolactone from biomass derivatives via cascade reactions Renew. Energy 146 2020 359 370 J. He, H. Li, Y. Xu, S. Yang, Dual acidic mesoporous KIT silicates enable one-pot production of γ-valerolactone from biomass derivatives via cascade reactions, Renewable Energy, 146 (2020) 359-370. [14] H.P. Winoto B.S. Ahn J. Jae Production of γ-valerolactone from furfural by a single-step process using Sn-Al-Beta zeolites: optimizing the catalyst acid properties and process conditions J. Ind. Eng. Chem. 40 2016 62 71 H.P. Winoto, B.S. Ahn, J. Jae, Production of γ-valerolactone from furfural by a single-step process using Sn-Al-Beta zeolites: Optimizing the catalyst acid properties and process conditions, Journal of Industrial and Engineering Chemistry, 40 (2016) 62-71. [15] A.M. Hengne B.S. Kadu N.S. Biradar R.C. Chikate C.V. Rode Transfer hydrogenation of biomass-derived levulinic acid to γ-valerolactone over supported Ni catalysts RSC Adv. 6 2016 59753 59761 A.M. Hengne, B.S. Kadu, N.S. Biradar, R.C. Chikate, C.V. Rode, Transfer hydrogenation of biomass-derived levulinic acid to γ-valerolactone over supported Ni catalysts, RSC Advances, 6 (2016) 59753-59761. [16] S. Lomate A. Sultana T. Fujitani Vapor phase catalytic transfer hydrogenation (CTH) of levulinic acid to γ-valerolactone over copper supported catalysts using formic acid as hydrogen source Catal. Lett. 148 2017 348 358 S. Lomate, A. Sultana, T. Fujitani, Vapor Phase Catalytic Transfer Hydrogenation (CTH) of Levulinic Acid to γ-Valerolactone Over Copper Supported Catalysts Using Formic Acid as Hydrogen Source, Catalysis Letters, 148 (2017) 348-358. [17] J.C. Serrano-Ruiz D. Wang J.A. Dumesic Catalytic upgrading of levulinic acid to 5-nonanone Green. Chem. 12 2010 J.C. Serrano-Ruiz, D. Wang, J.A. Dumesic, Catalytic upgrading of levulinic acid to 5-nonanone, Green Chemistry, 12 (2010). [18] A. Gutierrez R.K. Kaila M.L. Honkela R. Slioor A.O.I. Krause Hydrodeoxygenation of guaiacol on noble metal catalysts Catal. Today 147 2009 239 246 A. Gutierrez, R.K. Kaila, M.L. Honkela, R. Slioor, A.O.I. Krause, Hydrodeoxygenation of guaiacol on noble metal catalysts, Catalysis Today, 147 (2009) 239-246. [19] J.L. Santos P. Mäki-Arvela J. Wärnå A. Monzón M.A. Centeno D.Y. Murzin Hydrodeoxygenation of vanillin over noble metal catalyst supported on biochars: Part II: Catalytic behaviour Appl. Catal. B: Environ. 2020 268 J.L. Santos, P. Mäki-Arvela, J. Wärnå, A. Monzón, M.A. Centeno, D.Y. Murzin, Hydrodeoxygenation of vanillin over noble metal catalyst supported on biochars: Part II: Catalytic behaviour, Applied Catalysis B: Environmental, 268 (2020). [20] D. Ballesteros-Plata A. Infantes-Molina M. Rodríguez-Cuadrado E. Rodríguez-Aguado P. Braos-García E. Rodríguez-Castellón Incorporation of molybdenum into Pd and Pt catalysts supported on commercial silica for hydrodeoxygenation reaction of dibenzofuran Appl. Catal. A: Gen. 547 2017 86 95 D. Ballesteros-Plata, A. Infantes-Molina, M. Rodríguez-Cuadrado, E. Rodríguez-Aguado, P. Braos-García, E. Rodríguez-Castellón, Incorporation of molybdenum into Pd and Pt catalysts supported on commercial silica for hydrodeoxygenation reaction of dibenzofuran, Applied Catalysis A: General, 547 (2017) 86-95. [21] L. Faba E. Díaz S. Ordóñez Hydrodeoxygenation of acetone–furfural condensation adducts over alumina-supported noble metal catalysts Appl. Catal. B: Environ. 160-161 2014 436 444 L. Faba, E. Díaz, S. Ordóñez, Hydrodeoxygenation of acetone–furfural condensation adducts over alumina-supported noble metal catalysts, Applied Catalysis B: Environmental, 160-161 (2014) 436-444. [22] C. Michel P. Gallezot Why is ruthenium an efficient catalyst for the aqueous-phase hydrogenation of biosourced carbonyl compounds? ACS Catal. 5 2015 4130 4132 C. Michel, P. Gallezot, Why Is Ruthenium an Efficient Catalyst for the Aqueous-Phase Hydrogenation of Biosourced Carbonyl Compounds?, ACS Catalysis, 5 (2015) 4130-4132. [23] X. Gao S. Zhu M. Dong J. Wang W. Fan Ru/CeO2 catalyst with optimized CeO2 morphology and surface facet for efficient hydrogenation of ethyl levulinate to γ-valerolactone J. Catal. 389 2020 60 70 X. Gao, S. Zhu, M. Dong, J. Wang, W. Fan, Ru/CeO2 catalyst with optimized CeO2 morphology and surface facet for efficient hydrogenation of ethyl levulinate to γ-valerolactone, Journal of Catalysis, 389 (2020) 60-70. [24] Q. Shen Y. Zhang Y. Zhang S. Tan J. Chen Transformations of biomass-based levulinate ester into γ-valerolactone and pyrrolidones using carbon nanotubes-grafted N-heterocyclic carbene ruthenium complexes J. Energy Chem. 39 2019 29 38 Q. Shen, Y. Zhang, Y. Zhang, S. Tan, J. Chen, Transformations of biomass-based levulinate ester into γ-valerolactone and pyrrolidones using carbon nanotubes-grafted N-heterocyclic carbene ruthenium complexes, Journal of Energy Chemistry, 39 (2019) 29-38. [25] M. Mani M. Mariyaselvakumar A. Samikannu A.B. Panda L.J. Konwar J.-P. Mikkola Continuous hydrocyclization of aqueous levulinic acid to γ-valerolactone over bi-functional Ru/NbOPO4/SBA-15 catalyst under mild conditions Appl. Catal. A: Gen. 643 2022 M. Mani, M. Mariyaselvakumar, A. Samikannu, A.B. Panda, L.J. Konwar, J.-P. Mikkola, Continuous hydrocyclization of aqueous levulinic acid to γ-valerolactone over bi-functional Ru/NbOPO4/SBA-15 catalyst under mild conditions, Applied Catalysis A: General, 643 (2022). [26] W. Li F. Li J. Chen L.E. Betancourt C. Tu M. Liao X. Ning J. Zheng R. Li Efficient and sustainable hydrogenation of levulinic acid to γ-valerolactone in aqueous phase over Ru/MCM-49 catalysts Ind. Eng. Chem. Res. 59 2020 17338 17347 W. Li, F. Li, J. Chen, L.E. Betancourt, C. Tu, M. Liao, X. Ning, J. Zheng, R. Li, Efficient and Sustainable Hydrogenation of Levulinic Acid to γ-Valerolactone in Aqueous Phase over Ru/MCM-49 Catalysts, Industrial & Engineering Chemistry Research, 59 (2020) 17338-17347. [27] W. Hua C. Zhang Y. Guo G. Chai C. Wang Y. Guo L. Wang Y. Wang W. Zhan An efficient SnyMn1-yOx composite oxide catalyst for catalytic combustion of vinyl chloride emissions Appl. Catal. B: Environ. 255 2019 W. Hua, C. Zhang, Y. Guo, G. Chai, C. Wang, Y. Guo, L. Wang, Y. Wang, W. Zhan, An efficient SnyMn1-yOx composite oxide catalyst for catalytic combustion of vinyl chloride emissions, Applied Catalysis B: Environmental, 255 (2019). [28] M. Rumyantseva V. Kovalenko A. Gaskov E. Makshina V. Yuschenko I. Ivanova A. Ponzoni G. Faglia E. Comini Nanocomposites SnO2/Fe2O3: Sensor and catalytic properties Sens. Actuators B: Chem. 118 2006 208 214 M. Rumyantseva, V. Kovalenko, A. Gaskov, E. Makshina, V. Yuschenko, I. Ivanova, A. Ponzoni, G. Faglia, E. Comini, Nanocomposites SnO2/Fe2O3: Sensor and catalytic properties, Sensors and Actuators B: Chemical, 118 (2006) 208-214. [29] T. Odoom-Wubah Q. Li I. Adilov J. Huang Q. Li Towards efficient Pd/Mn3O4 catalyst with enhanced acidic sites and low temperature reducibility for Benzene abatement Mol. Catal. 477 2019 T. Odoom-Wubah, Q. Li, I. Adilov, J. Huang, Q. Li, Towards efficient Pd/Mn3O4 catalyst with enhanced acidic sites and low temperature reducibility for Benzene abatement, Molecular Catalysis, 477 (2019). [30] X. Li S. Feng P. Hemberger A. Bodi X. Song Q. Yuan J. Mu B. Li Z. Jiang Y. Ding Iodide-coordinated single-site Pd catalysts for alkyne dialkoxycarbonylation ACS Catal. 11 2021 9242 9251 X. Li, S. Feng, P. Hemberger, A. Bodi, X. Song, Q. Yuan, J. Mu, B. Li, Z. Jiang, Y. Ding, Iodide-Coordinated Single-Site Pd Catalysts for Alkyne Dialkoxycarbonylation, ACS Catalysis, 11 (2021) 9242-9251. [31] N.W.J. Scott M.J. Ford N. Jeddi A. Eyles L. Simon A.C. Whitwood T. Tanner C.E. Willans I.J.S. Fairlamb A dichotomy in cross-coupling site selectivity in a dihalogenated heteroarene: influence of mononuclear Pd, Pd clusters, and Pd nanoparticles—the case for exploiting pd catalyst speciation J. Am. Chem. Soc. 143 2021 9682 9693 N.W.J. Scott, M.J. Ford, N. Jeddi, A. Eyles, L. Simon, A.C. Whitwood, T. Tanner, C.E. Willans, I.J.S. Fairlamb, A Dichotomy in Cross-Coupling Site Selectivity in a Dihalogenated Heteroarene: Influence of Mononuclear Pd, Pd Clusters, and Pd Nanoparticles—the Case for Exploiting Pd Catalyst Speciation, Journal of the American Chemical Society, 143 (2021) 9682-9693. [32] J. Zhan R. Hu X. Luo C. Zhang G. Luo J. Fan J.H. Clark S. Zhang Highly selective conversion of phenol to cyclohexanol over Ru/Nb2O5-nC18PA catalysts with increased acidity in a biphasic system under mild conditions Green. Chem. 24 2022 1152 1164 J. Zhan, R. Hu, X. Luo, C. Zhang, G. Luo, J. Fan, J.H. Clark, S. Zhang, Highly selective conversion of phenol to cyclohexanol over Ru/Nb2O5-nC18PA catalysts with increased acidity in a biphasic system under mild conditions, Green Chemistry, 24 (2022) 1152-1164. [33] Y. Jing Y. Wang S. Furukawa J. Xia C. Sun M.J. Hülsey H. Wang Y. Guo X. Liu N. Yan Towards the circular economy: converting aromatic plastic waste back to arenes over a Ru/Nb2O5 catalyst Angew. Chem. Int. Ed. 60 2021 5527 5535 Y. Jing, Y. Wang, S. Furukawa, J. Xia, C. Sun, M.J. Hülsey, H. Wang, Y. Guo, X. Liu, N. Yan, Towards the Circular Economy: Converting Aromatic Plastic Waste Back to Arenes over a Ru/Nb2O5 Catalyst, Angewandte Chemie International Edition, 60 (2021) 5527-5535. [34] O.A. Simakova E. Smolentseva M. Estrada E.V. Murzina S. Beloshapkin S.M. Willför A.V. Simakov D.Y. Murzin From woody biomass extractives to health-promoting substances: Selective oxidation of the lignan hydroxymatairesinol to oxomatairesinol over Au, Pd, and Au–Pd heterogeneous catalysts J. Catal. 291 2012 95 103 O.A. Simakova, E. Smolentseva, M. Estrada, E.V. Murzina, S. Beloshapkin, S.M. Willför, A.V. Simakov, D.Y. Murzin, From woody biomass extractives to health-promoting substances: Selective oxidation of the lignan hydroxymatairesinol to oxomatairesinol over Au, Pd, and Au–Pd heterogeneous catalysts, Journal of Catalysis, 291 (2012) 95-103. [35] P. Yan M.M.-J. Li E. Kennedy A. Adesina G. Zhao A. Setiawan M. Stockenhuber The role of acid and metal sites in hydrodeoxygenation of guaiacol over Ni/Beta catalysts Catal. Sci. Technol. 10 2020 810 825 P. Yan, M.M.-J. Li, E. Kennedy, A. Adesina, G. Zhao, A. Setiawan, M. Stockenhuber, The role of acid and metal sites in hydrodeoxygenation of guaiacol over Ni/Beta catalysts, Catalysis Science & Technology, 10 (2020) 810-825. [36] L. Nie B. Peng X. Zhu Vapor-phase hydrodeoxygenation of guaiacol to aromatics over Pt/HBeta: identification of the role of acid sites and metal sites on the reaction pathway ChemCatChem 10 2018 1064 1074 L. Nie, B. Peng, X. Zhu, Vapor-Phase Hydrodeoxygenation of Guaiacol to Aromatics over Pt/HBeta: Identification of the Role of Acid Sites and Metal Sites on the Reaction Pathway, ChemCatChem, 10 (2018) 1064-1074. [37] D. He Q. He P. Jiang G. Zhou R. Hu W. Fu Novel Cu/Al2O3-ZrO2 composite for selective hydrogenation of levulinic acid to -valerolactone Catal. Commun. 125 2019 82 86 D. He, Q. He, P. Jiang, G. Zhou, R. Hu, W. Fu, Novel Cu/Al2O3-ZrO2 composite for selective hydrogenation of levulinic acid to -valerolactone, Catalysis Communications, 125 (2019) 82-86. [38] Z. Xie B. Chen H. Wu M. Liu H. Liu J. Zhang G. Yang B. Han Highly efficient hydrogenation of levulinic acid into 2-methyltetrahydrofuran over Ni–Cu/Al2O3–ZrO2 bifunctional catalysts Green. Chem. 21 2019 606 613 Z. Xie, B. Chen, H. Wu, M. Liu, H. Liu, J. Zhang, G. Yang, B. Han, Highly efficient hydrogenation of levulinic acid into 2-methyltetrahydrofuran over Ni–Cu/Al2O3–ZrO2 bifunctional catalysts, Green Chemistry, 21 (2019) 606-613. [39] J. Li M. Li C. Zhang C.-L. Liu R.-Z. Yang W.-S. Dong Construction of mesoporous Cu/ZrO2-Al2O3 as a ternary catalyst for efficient synthesis of γ-valerolactone from levulinic acid at low temperature J. Catal. 381 2020 163 174 J. Li, M. Li, C. Zhang, C.-L. Liu, R.-Z. Yang, W.-S. Dong, Construction of mesoporous Cu/ZrO2-Al2O3 as a ternary catalyst for efficient synthesis of γ-valerolactone from levulinic acid at low temperature, Journal of Catalysis, 381 (2020) 163-174. [40] Y. Li B. Liu Y. Wang S. Wang X. Lan T. Wang High-performance Ni 3P catalyst for C═O hydrogenation of ethyl levulinate: Niδ+ as outstanding adsorption sites ACS Catal. 12 2022 7926 7935 Y. Li, B. Liu, Y. Wang, S. Wang, X. Lan, T. Wang, High-Performance Ni 3P Catalyst for C═O Hydrogenation of Ethyl Levulinate: Niδ+ as Outstanding Adsorption Sites, ACS Catalysis, 12 (2022) 7926-7935. [41] W. Li F. Li X. Ning K. Deng J. Chen J. Zheng R. Li Promotional effect of Mn doping on Ru/layered MCM-49 catalysts for the conversion of Levulinic acid to γ-Valerolactone Carbon Resour. Convers. 5 2022 185 192 W. Li, F. Li, X. Ning, K. Deng, J. Chen, J. Zheng, R. Li, Promotional effect of Mn doping on Ru/layered MCM-49 catalysts for the conversion of Levulinic acid to γ-Valerolactone, Carbon Resources Conversion, 5 (2022) 185-192. [42] W. Luo U. Deka A.M. Beale E.R.H. van Eck P.C.A. Bruijnincx B.M. Weckhuysen Ruthenium-catalyzed hydrogenation of levulinic acid: influence of the support and solvent on catalyst selectivity and stability J. Catal. 301 2013 175 186 W. Luo, U. Deka, A.M. Beale, E.R.H. van Eck, P.C.A. Bruijnincx, B.M. Weckhuysen, Ruthenium-catalyzed hydrogenation of levulinic acid: Influence of the support and solvent on catalyst selectivity and stability, Journal of Catalysis, 301 (2013) 175-186. [43] L. Wang L. Huang F. Liang S. Liu Y. Wang H. Zhang Preparation, characterization and catalytic performance of single-atom catalysts Chin. J. Catal. 38 2017 1528 1539 L. Wang, L. Huang, F. Liang, S. Liu, Y. Wang, H. Zhang, Preparation, characterization and catalytic performance of single-atom catalysts, Chinese Journal of Catalysis, 38 (2017) 1528-1539. [44] Y. Nakagawa M. Ishikawa M. Tamura K. Tomishige Selective production of cyclohexanol and methanol from guaiacol over Ru catalyst combined with MgO Green. Chem. 16 2014 2197 2203 Y. Nakagawa, M. Ishikawa, M. Tamura, K. Tomishige, Selective production of cyclohexanol and methanol from guaiacol over Ru catalyst combined with MgO, Green Chem., 16 (2014) 2197-2203. [45] L. Chen T. Mashimo E. Omurzak H. Okudera C. Iwamoto A. Yoshiasa Pure tetragonal ZrO2 nanoparticles synthesized by pulsed plasma in liquid J. Phys. Chem. C. 115 2011 9370 9375 L. Chen, T. Mashimo, E. Omurzak, H. Okudera, C. Iwamoto, A. Yoshiasa, Pure Tetragonal ZrO2 Nanoparticles Synthesized by Pulsed Plasma in Liquid, The Journal of Physical Chemistry C, 115 (2011) 9370-9375. [46] E.-M. Köck M. Kogler T. Götsch L. Schlicker M.F. Bekheet A. Doran A. Gurlo B. Klötzer B. Petermüller D. Schildhammer N. Yigit S. Penner Surface chemistry of pure tetragonal ZrO2 and gas-phase dependence of the tetragonal-to-monoclinic ZrO2 transformation Dalton Trans. 46 2017 4554 4570 E.-M. Köck, M. Kogler, T. Götsch, L. Schlicker, M.F. Bekheet, A. Doran, A. Gurlo, B. Klötzer, B. Petermüller, D. Schildhammer, N. Yigit, S. Penner, Surface chemistry of pure tetragonal ZrO2 and gas-phase dependence of the tetragonal-to-monoclinic ZrO2 transformation, Dalton Transactions, 46 (2017) 4554-4570. [47] X. Zhao L. Sun Z. Zhai D. Tian Y. Wang X. Zou C. Min C. Zhuang An ultrastable La-MOF for catalytic hydrogen transfer of furfural: in situ activation of the surface Nanoscale 15 2023 6645 6654 X. Zhao, L. Sun, Z. Zhai, D. Tian, Y. Wang, X. Zou, C. Min, C. Zhuang, An ultrastable La-MOF for catalytic hydrogen transfer of furfural: in situ activation of the surface, Nanoscale, 15 (2023) 6645-6654. [48] M. Mahato R. Tabassian V.H. Nguyen S. Oh S. Nam K.J. Kim I.K. Oh Sulfur- and nitrogen-rich porous π-conjugated COFs as stable electrode materials for electro-ionic soft actuators Adv. Funct. Mater. 30 2020 M. Mahato, R. Tabassian, V.H. Nguyen, S. Oh, S. Nam, K.J. Kim, I.K. Oh, Sulfur- and Nitrogen-Rich Porous π-Conjugated COFs as Stable Electrode Materials for Electro-Ionic Soft Actuators, Advanced Functional Materials, 30 (2020). [49] Y. Ha L. Shi Z. Chen R. Wu Phase-transited lysozyme-driven formation of self-supported Co3O4@C nanomeshes for overall water splitting Adv. Sci. 6 2019 Y. Ha, L. Shi, Z. Chen, R. Wu, Phase-Transited Lysozyme-Driven Formation of Self-Supported Co3O4@C Nanomeshes for Overall Water Splitting, Advanced Science, 6 (2019). [50] Y. Shu X. Song F. Lan C. Zhao Q. Guan W. Li N-doped carbon interior-modified mesoporous silica-confined nickel nanoclusters for stereoselective hydrogenation ACS Catal. 12 2022 15386 15399 Y. Shu, X. Song, F. Lan, C. Zhao, Q. Guan, W. Li, N-Doped Carbon Interior-Modified Mesoporous Silica-Confined Nickel Nanoclusters for Stereoselective Hydrogenation, ACS Catalysis, 12 (2022) 15386-15399. [51] J. Shi M. Zhao Y. Wang J. Fu X. Lu Z. Hou Upgrading of aromatic compounds in bio-oil over ultrathin graphene encapsulated Ru nanoparticles J. Mater. Chem. A 4 2016 5842 5848 J. Shi, M. Zhao, Y. Wang, J. Fu, X. Lu, Z. Hou, Upgrading of aromatic compounds in bio-oil over ultrathin graphene encapsulated Ru nanoparticles, Journal of Materials Chemistry A, 4 (2016) 5842-5848. [52] S.S.R. Gupta M.L. Kantam Selective hydrogenation of levulinic acid into γ-valerolactone over Cu/Ni hydrotalcite-derived catalyst Catal. Today 309 2018 189 194 S.S.R. Gupta, M.L. Kantam, Selective hydrogenation of levulinic acid into γ-valerolactone over Cu/Ni hydrotalcite-derived catalyst, Catalysis Today, 309 (2018) 189-194. [53] J. Fu D. Sheng X. Lu Hydrogenation of levulinic acid over nickel catalysts supported on aluminum oxide to prepare γ-valerolactone Catalysts 6 2015 J. Fu, D. Sheng, X. Lu, Hydrogenation of Levulinic Acid over Nickel Catalysts Supported on Aluminum Oxide to Prepare γ-Valerolactone, Catalysts, 6 (2015). [54] L. Chen Y. Zhu H. Zheng C. Zhang B. Zhang Y. Li Aqueous-phase hydrodeoxygenation of carboxylic acids to alcohols or alkanes over supported Ru catalysts J. Mol. Catal. A: Chem. 351 2011 217 227 L. Chen, Y. Zhu, H. Zheng, C. Zhang, B. Zhang, Y. Li, Aqueous-phase hydrodeoxygenation of carboxylic acids to alcohols or alkanes over supported Ru catalysts, Journal of Molecular Catalysis A: Chemical, 351 (2011) 217-227. [55] X. Ma Z. An H. Song X. Shu X. Xiang J. He Atomic Pt-catalyzed heterogeneous anti-markovnikov C–N formation: Pt10 activating N–H for Ptδ+ 1-Activated C═C attack J. Am. Chem. Soc. 142 2020 9017 9027 X. Ma, Z. An, H. Song, X. Shu, X. Xiang, J. He, Atomic Pt-Catalyzed Heterogeneous Anti-Markovnikov C–N Formation: Pt10 Activating N–H for Ptδ+1-Activated C═C Attack, Journal of the American Chemical Society, 142 (2020) 9017-9027. [56] D. Zhang A. Duan Z. Zhao G. Wan Z. Gao G. Jiang K. Chi K.H. Chuang Preparation, characterization and hydrotreating performances of ZrO2–Al2O3-supported NiMo catalysts Catal. Today 149 2010 62 68 D. Zhang, A. Duan, Z. Zhao, G. Wan, Z. Gao, G. Jiang, K. Chi, K.H. Chuang, Preparation, characterization and hydrotreating performances of ZrO2–Al2O3-supported NiMo catalysts, Catalysis Today, 149 (2010) 62-68. [57] J. Wang S. Jaenicke G.-K. Chuah Zirconium–Beta zeolite as a robust catalyst for the transformation of levulinic acid to γ-valerolactone via Meerwein–Ponndorf–Verley reduction RSC Adv. 4 2014 13481 13489 J. Wang, S. Jaenicke, G.-K. Chuah, Zirconium–Beta zeolite as a robust catalyst for the transformation of levulinic acid to γ-valerolactone via Meerwein–Ponndorf–Verley reduction, RSC Adv., 4 (2014) 13481-13489. [58] L. Zhang G. Meng W. Zhang X. Li Z. Zhang M. Yang Y. Wu D. Wang Y. Li Oriented Conversion of a LA/HMF Mixture to GVL and FDCA in a Biphasic Solvent over a Ru Single-Atom/Nanoparticle Dual-Site Catalyst ACS Catal. 13 2023 2268 2276 L. Zhang, G. Meng, W. Zhang, X. Li, Z. Zhang, M. Yang, Y. Wu, D. Wang, Y. Li, Oriented Conversion of a LA/HMF Mixture to GVL and FDCA in a Biphasic Solvent over a Ru Single-Atom/Nanoparticle Dual-Site Catalyst, ACS Catalysis, 13 (2023) 2268-2276. [59] Y. Lu Y. Wang Q. Tang Q. Cao W. Fang Synergy in Sn-Mn oxide boosting the hydrogenation catalysis of supported Pt nanoparticles for selective conversion of levulinic acid Appl. Catal. B: Environ. 300 2022 Y. Lu, Y. Wang, Q. Tang, Q. Cao, W. Fang, Synergy in Sn-Mn oxide boosting the hydrogenation catalysis of supported Pt nanoparticles for selective conversion of levulinic acid, Applied Catalysis B: Environmental, 300 (2022).",
      "scopus-id": "85189012744",
      "coredata": {
        "eid": "1-s2.0-S0926860X24001492",
        "dc:description": "Synthesis of bifunctional catalysts is very important for the hydrogenation of biomass to advanced biofuels, but its efficient regulation is difficult. In this work, a tunable bifunctional Ru/LaQS catalyst with Lewis acid and metal hydrogenation sites was prepared by stable MOFs (LaQS) supported ultrafine Ru nanoparticles (NPs). When the optimal Ru2/LaQS catalyst catalyzed bio-based ethyl levulinate (EL) to γ-valerolactone (GVL), the EL conversion and GVL selectivity reached 99.9% under mild conditions of 100 °C. The excellent catalytic performance is mainly attributed to the synergistic effect of Ru0-Ru3+ on ultrafine Ru NPs with only 1.60 nm generated by metal-support interaction, which is proved by experimental characterization and theoretical calculation. Moreover, the electron density of hydrogenation active site Ru0 and the content of acidic site Ru3+ can be modulated by Ru loading. Among them, the activation of H2 was promoted by the high electron density of Ru0 generated through metal-support electronic interactions. The enhanced medium-strong acidic site Ru3+ not only improved the activation of EL, but also promoted the intramolecular dealcoholization of the intermediate to GVL. The synergistic catalytic mechanism of Ru0-Ru3+ on ultrafine Ru NPs was speculated. The excellent stability was mainly attributed to the metal-support interaction stabilizing the ultrafine Ru NPs, which prevents the agglomeration and loss of Ru NPs during cycling. This work provides an in-depth understanding of the bifunctional catalytic mechanism, which is of guiding significance for the design and preparation of MOFs-based catalysts for biomass hydrogenation.",
        "openArchiveArticle": "false",
        "prism:coverDate": "2024-05-05",
        "openaccessUserLicense": null,
        "prism:aggregationType": "Journal",
        "prism:url": "https://api.elsevier.com/content/article/pii/S0926860X24001492",
        "dc:creator": [
          {
            "@_fa": "true",
            "$": "Dao, Zirui"
          },
          {
            "@_fa": "true",
            "$": "Wang, Ying"
          },
          {
            "@_fa": "true",
            "$": "Yang, Chunyan"
          },
          {
            "@_fa": "true",
            "$": "Pu, Siyi"
          },
          {
            "@_fa": "true",
            "$": "Yan, Wei"
          },
          {
            "@_fa": "true",
            "$": "Tian, Di"
          },
          {
            "@_fa": "true",
            "$": "Min, Chungang"
          },
          {
            "@_fa": "true",
            "$": "Zhao, Jie"
          },
          {
            "@_fa": "true",
            "$": "Zhuang, Changfu"
          }
        ],
        "link": [
          {
            "@_fa": "true",
            "@rel": "self",
            "@href": "https://api.elsevier.com/content/article/pii/S0926860X24001492"
          },
          {
            "@_fa": "true",
            "@rel": "scidir",
            "@href": "https://www.sciencedirect.com/science/article/pii/S0926860X24001492"
          }
        ],
        "dc:format": "application/json",
        "openaccessType": null,
        "pii": "S0926-860X(24)00149-2",
        "prism:volume": "677",
        "articleNumber": "119705",
        "prism:publisher": "Elsevier B.V.",
        "dc:title": "Synergistic catalysis of Ru0-Ru3+ in MOF supported ultrafine Ru nanoparticles catalyst promotes ethyl levulinate to γ-valerolactone",
        "prism:copyright": "© 2024 Elsevier B.V. All rights reserved.",
        "openaccess": "0",
        "prism:issn": "0926860X",
        "dcterms:subject": [
          {
            "@_fa": "true",
            "$": "Metal-organic frameworks"
          },
          {
            "@_fa": "true",
            "$": "Ultrafine Ru NPs"
          },
          {
            "@_fa": "true",
            "$": "Support-metal interaction"
          },
          {
            "@_fa": "true",
            "$": "Ru0-Ru3+ synergistic catalysis"
          },
          {
            "@_fa": "true",
            "$": "Ethyl levulinateγ-valerolactone"
          }
        ],
        "openaccessArticle": "false",
        "prism:publicationName": "Applied Catalysis A: General",
        "openaccessSponsorType": null,
        "prism:pageRange": "119705",
        "pubType": "fla",
        "prism:coverDisplayDate": "5 May 2024",
        "prism:doi": "10.1016/j.apcata.2024.119705",
        "prism:startingPage": "119705",
        "dc:identifier": "doi:10.1016/j.apcata.2024.119705",
        "openaccessSponsorName": null
      },
      "objects": {
        "object": [
          {
            "@category": "standard",
            "@height": "753",
            "@width": "807",
            "@_fa": "true",
            "$": "https://api.elsevier.com/content/object/eid/1-s2.0-S0926860X24001492-gr1.jpg?httpAccept=%2A%2F%2A",
            "@multimediatype": "JPEG image file",
            "@type": "IMAGE-DOWNSAMPLED",
            "@size": "165932",
            "@ref": "gr1",
            "@mimetype": "image/jpeg"
          },
          {
            "@category": "standard",
            "@height": "462",
            "@width": "565",
            "@_fa": "true",
            "$": "https://api.elsevier.com/content/object/eid/1-s2.0-S0926860X24001492-gr2.jpg?httpAccept=%2A%2F%2A",
            "@multimediatype": "JPEG image file",
            "@type": "IMAGE-DOWNSAMPLED",
            "@size": "80766",
            "@ref": "gr2",
            "@mimetype": "image/jpeg"
          },
          {
            "@category": "standard",
            "@height": "200",
            "@width": "345",
            "@_fa": "true",
            "$": "https://api.elsevier.com/content/object/eid/1-s2.0-S0926860X24001492-ga1.jpg?httpAccept=%2A%2F%2A",
            "@multimediatype": "JPEG image file",
            "@type": "IMAGE-DOWNSAMPLED",
            "@size": "23765",
            "@ref": "ga1",
            "@mimetype": "image/jpeg"
          },
          {
            "@category": "standard",
            "@height": "473",
            "@width": "807",
            "@_fa": "true",
            "$": "https://api.elsevier.com/content/object/eid/1-s2.0-S0926860X24001492-gr3.jpg?httpAccept=%2A%2F%2A",
            "@multimediatype": "JPEG image file",
            "@type": "IMAGE-DOWNSAMPLED",
            "@size": "90725",
            "@ref": "gr3",
            "@mimetype": "image/jpeg"
          },
          {
            "@category": "standard",
            "@height": "494",
            "@width": "565",
            "@_fa": "true",
            "$": "https://api.elsevier.com/content/object/eid/1-s2.0-S0926860X24001492-gr4.jpg?httpAccept=%2A%2F%2A",
            "@multimediatype": "JPEG image file",
            "@type": "IMAGE-DOWNSAMPLED",
            "@size": "73283",
            "@ref": "gr4",
            "@mimetype": "image/jpeg"
          },
          {
            "@category": "standard",
            "@height": "472",
            "@width": "565",
            "@_fa": "true",
            "$": "https://api.elsevier.com/content/object/eid/1-s2.0-S0926860X24001492-gr5.jpg?httpAccept=%2A%2F%2A",
            "@multimediatype": "JPEG image file",
            "@type": "IMAGE-DOWNSAMPLED",
            "@size": "61129",
            "@ref": "gr5",
            "@mimetype": "image/jpeg"
          },
          {
            "@category": "standard",
            "@height": "402",
            "@width": "807",
            "@_fa": "true",
            "$": "https://api.elsevier.com/content/object/eid/1-s2.0-S0926860X24001492-gr6.jpg?httpAccept=%2A%2F%2A",
            "@multimediatype": "JPEG image file",
            "@type": "IMAGE-DOWNSAMPLED",
            "@size": "91048",
            "@ref": "gr6",
            "@mimetype": "image/jpeg"
          },
          {
            "@category": "standard",
            "@height": "460",
            "@width": "565",
            "@_fa": "true",
            "$": "https://api.elsevier.com/content/object/eid/1-s2.0-S0926860X24001492-gr7.jpg?httpAccept=%2A%2F%2A",
            "@multimediatype": "JPEG image file",
            "@type": "IMAGE-DOWNSAMPLED",
            "@size": "63759",
            "@ref": "gr7",
            "@mimetype": "image/jpeg"
          },
          {
            "@category": "thumbnail",
            "@height": "164",
            "@width": "176",
            "@_fa": "true",
            "$": "https://api.elsevier.com/content/object/eid/1-s2.0-S0926860X24001492-gr1.sml?httpAccept=%2A%2F%2A",
            "@multimediatype": "GIF image file",
            "@type": "IMAGE-THUMBNAIL",
            "@size": "16315",
            "@ref": "gr1",
            "@mimetype": "image/gif"
          },
          {
            "@category": "thumbnail",
            "@height": "163",
            "@width": "200",
            "@_fa": "true",
            "$": "https://api.elsevier.com/content/object/eid/1-s2.0-S0926860X24001492-gr2.sml?httpAccept=%2A%2F%2A",
            "@multimediatype": "GIF image file",
            "@type": "IMAGE-THUMBNAIL",
            "@size": "13899",
            "@ref": "gr2",
            "@mimetype": "image/gif"
          },
          {
            "@category": "thumbnail",
            "@height": "127",
            "@width": "219",
            "@_fa": "true",
            "$": "https://api.elsevier.com/content/object/eid/1-s2.0-S0926860X24001492-ga1.sml?httpAccept=%2A%2F%2A",
            "@multimediatype": "GIF image file",
            "@type": "IMAGE-THUMBNAIL",
            "@size": "19444",
            "@ref": "ga1",
            "@mimetype": "image/gif"
          },
          {
            "@category": "thumbnail",
            "@height": "128",
            "@width": "219",
            "@_fa": "true",
            "$": "https://api.elsevier.com/content/object/eid/1-s2.0-S0926860X24001492-gr3.sml?httpAccept=%2A%2F%2A",
            "@multimediatype": "GIF image file",
            "@type": "IMAGE-THUMBNAIL",
            "@size": "12226",
            "@ref": "gr3",
            "@mimetype": "image/gif"
          },
          {
            "@category": "thumbnail",
            "@height": "163",
            "@width": "187",
            "@_fa": "true",
            "$": "https://api.elsevier.com/content/object/eid/1-s2.0-S0926860X24001492-gr4.sml?httpAccept=%2A%2F%2A",
            "@multimediatype": "GIF image file",
            "@type": "IMAGE-THUMBNAIL",
            "@size": "11073",
            "@ref": "gr4",
            "@mimetype": "image/gif"
          },
          {
            "@category": "thumbnail",
            "@height": "164",
            "@width": "196",
            "@_fa": "true",
            "$": "https://api.elsevier.com/content/object/eid/1-s2.0-S0926860X24001492-gr5.sml?httpAccept=%2A%2F%2A",
            "@multimediatype": "GIF image file",
            "@type": "IMAGE-THUMBNAIL",
            "@size": "12288",
            "@ref": "gr5",
            "@mimetype": "image/gif"
          },
          {
            "@category": "thumbnail",
            "@height": "109",
            "@width": "219",
            "@_fa": "true",
            "$": "https://api.elsevier.com/content/object/eid/1-s2.0-S0926860X24001492-gr6.sml?httpAccept=%2A%2F%2A",
            "@multimediatype": "GIF image file",
            "@type": "IMAGE-THUMBNAIL",
            "@size": "11820",
            "@ref": "gr6",
            "@mimetype": "image/gif"
          },
          {
            "@category": "thumbnail",
            "@height": "164",
            "@width": "201",
            "@_fa": "true",
            "$": "https://api.elsevier.com/content/object/eid/1-s2.0-S0926860X24001492-gr7.sml?httpAccept=%2A%2F%2A",
            "@multimediatype": "GIF image file",
            "@type": "IMAGE-THUMBNAIL",
            "@size": "13574",
            "@ref": "gr7",
            "@mimetype": "image/gif"
          },
          {
            "@category": "high",
            "@height": "3334",
            "@width": "3575",
            "@_fa": "true",
            "$": "https://api.elsevier.com/content/object/eid/1-s2.0-S0926860X24001492-gr1_lrg.jpg?httpAccept=%2A%2F%2A",
            "@multimediatype": "JPEG image file",
            "@type": "IMAGE-HIGH-RES",
            "@size": "874397",
            "@ref": "gr1",
            "@mimetype": "image/jpeg"
          },
          {
            "@category": "high",
            "@height": "2039",
            "@width": "2495",
            "@_fa": "true",
            "$": "https://api.elsevier.com/content/object/eid/1-s2.0-S0926860X24001492-gr2_lrg.jpg?httpAccept=%2A%2F%2A",
            "@multimediatype": "JPEG image file",
            "@type": "IMAGE-HIGH-RES",
            "@size": "371796",
            "@ref": "gr2",
            "@mimetype": "image/jpeg"
          },
          {
            "@category": "high",
            "@height": "886",
            "@width": "1528",
            "@_fa": "true",
            "$": "https://api.elsevier.com/content/object/eid/1-s2.0-S0926860X24001492-ga1_lrg.jpg?httpAccept=%2A%2F%2A",
            "@multimediatype": "JPEG image file",
            "@type": "IMAGE-HIGH-RES",
            "@size": "202554",
            "@ref": "ga1",
            "@mimetype": "image/jpeg"
          },
          {
            "@category": "high",
            "@height": "2097",
            "@width": "3575",
            "@_fa": "true",
            "$": "https://api.elsevier.com/content/object/eid/1-s2.0-S0926860X24001492-gr3_lrg.jpg?httpAccept=%2A%2F%2A",
            "@multimediatype": "JPEG image file",
            "@type": "IMAGE-HIGH-RES",
            "@size": "429336",
            "@ref": "gr3",
            "@mimetype": "image/jpeg"
          },
          {
            "@category": "high",
            "@height": "2181",
            "@width": "2495",
            "@_fa": "true",
            "$": "https://api.elsevier.com/content/object/eid/1-s2.0-S0926860X24001492-gr4_lrg.jpg?httpAccept=%2A%2F%2A",
            "@multimediatype": "JPEG image file",
            "@type": "IMAGE-HIGH-RES",
            "@size": "330076",
            "@ref": "gr4",
            "@mimetype": "image/jpeg"
          },
          {
            "@category": "high",
            "@height": "2084",
            "@width": "2495",
            "@_fa": "true",
            "$": "https://api.elsevier.com/content/object/eid/1-s2.0-S0926860X24001492-gr5_lrg.jpg?httpAccept=%2A%2F%2A",
            "@multimediatype": "JPEG image file",
            "@type": "IMAGE-HIGH-RES",
            "@size": "289987",
            "@ref": "gr5",
            "@mimetype": "image/jpeg"
          },
          {
            "@category": "high",
            "@height": "1781",
            "@width": "3575",
            "@_fa": "true",
            "$": "https://api.elsevier.com/content/object/eid/1-s2.0-S0926860X24001492-gr6_lrg.jpg?httpAccept=%2A%2F%2A",
            "@multimediatype": "JPEG image file",
            "@type": "IMAGE-HIGH-RES",
            "@size": "410075",
            "@ref": "gr6",
            "@mimetype": "image/jpeg"
          },
          {
            "@category": "high",
            "@height": "2032",
            "@width": "2495",
            "@_fa": "true",
            "$": "https://api.elsevier.com/content/object/eid/1-s2.0-S0926860X24001492-gr7_lrg.jpg?httpAccept=%2A%2F%2A",
            "@multimediatype": "JPEG image file",
            "@type": "IMAGE-HIGH-RES",
            "@size": "314441",
            "@ref": "gr7",
            "@mimetype": "image/jpeg"
          },
          {
            "@category": "standard",
            "@_fa": "true",
            "$": "https://api.elsevier.com/content/object/eid/1-s2.0-S0926860X24001492-mmc1.docx?httpAccept=%2A%2F%2A",
            "@multimediatype": "Microsoft Word file",
            "@type": "APPLICATION",
            "@size": "467215",
            "@ref": "mmc1",
            "@mimetype": "application/word"
          },
          {
            "@category": "thumbnail",
            "@_fa": "true",
            "$": "https://api.elsevier.com/content/object/eid/1-s2.0-S0926860X24001492-si0001.svg?httpAccept=%2A%2F%2A",
            "@multimediatype": "Scalable Vector Graphics file",
            "@type": "ALTIMG",
            "@size": "3946",
            "@ref": "si0001",
            "@mimetype": "image/svg+xml"
          },
          {
            "@category": "thumbnail",
            "@_fa": "true",
            "$": "https://api.elsevier.com/content/object/eid/1-s2.0-S0926860X24001492-si0002.svg?httpAccept=%2A%2F%2A",
            "@multimediatype": "Scalable Vector Graphics file",
            "@type": "ALTIMG",
            "@size": "5105",
            "@ref": "si0002",
            "@mimetype": "image/svg+xml"
          },
          {
            "@category": "standard",
            "@_fa": "true",
            "$": "https://api.elsevier.com/content/object/eid/1-s2.0-S0926860X24001492-am.pdf?httpAccept=%2A%2F%2A",
            "@multimediatype": "Acrobat PDF file",
            "@type": "AAM-PDF",
            "@size": "1500305",
            "@ref": "am",
            "@mimetype": "application/pdf"
          }
        ]
      },
      "link": {
        "@rel": "abstract",
        "@href": "https://api.elsevier.com/content/abstract/scopus_id/85189012744"
      }
    }
  }
}