{
  "metadata": {
    "title": "Methanol oxidation over iron molybdate catalysts. Main and side reactions kinetics",
    "authors": "; ; ",
    "journal": "Applied Catalysis A: General",
    "date": "2023-05-25",
    "doi": "10.1016/j.apcata.2023.119118",
    "abstract": "",
    "uri": "https://api.elsevier.com/content/article/pii/S0926860X23000984",
    "pii": "S0926860X23000984"
  },
  "fulltext": {
    "full-text-retrieval-response": {
      "scopus-eid": "2-s2.0-85151393253",
      "originalText": "serial JL 271346 291210 291744 291809 31 Applied Catalysis A: General APPLIEDCATALYSISAGENERAL 2023-03-28 2023-03-28 2023-03-31 2023-03-31 2024-01-22T20:52:25 1-s2.0-S0926860X23000984 S0926-860X(23)00098-4 S0926860X23000984 10.1016/j.apcata.2023.119118 S300 S300.2 FULL-TEXT 1-s2.0-S0926860X23X0009X 2024-01-22T21:21:32.577098Z 0 0 20230525 2023 2023-03-28T14:54:50.678772Z absattachment articleinfo articlenumber articletitlenorm authfirstinitialnorm authfirstsurnamenorm cid cids contenttype copyright crossmark dateloaded dateloadedtxt datesearch datesort dateupdated dco docsubtype doctype doi eid ewtransactionid hubeid indexeddate issn issnnorm itemstage itemtransactionid itemweight openaccess openarchive pg pgfirst pii piinorm pubdatestart pubdatetxt pubyr sortorder srctitle srctitlenorm srctype ssids alllist content subj subheadings suppl tomb volfirst volissue volumelist webpdf webpdfpagecount yearnav figure table body mmlmath acknowledge affil articletitle auth authfirstini authfull authkeywords authlast grantnumber grantsponsor grantsponsorid highlightsabst nomenclature primabst ref specialabst 0926-860X 0926860X true 658 658 C Volume 658 2 119118 119118 119118 20230525 25 May 2023 2023-05-25 2023 article fla © 2024 Elsevier B.V. All rights reserved. METHANOLOXIDATIONOVERIRONMOLYBDATECATALYSTSMAINSIDEREACTIONSKINETICS DIAS A Nomenclature 1 Introduction 2 Experimental 2.1 Preparation of the catalysts 2.2 Characterization of the catalysts 2.3 Catalytic tests 3 Results and discussion 3.1 Catalytic activity 4 Conclusions CRediT authorship contribution statement Acknowledgments References VIEIRASOARES 2005 A ADKINS 1931 1512 1520 H BOWKER 2002 165 176 M BOWKER 2013 12056 12067 M SODERHJELM 2008 145 155 E ROUTRAY 2011 54 66 K KHAZZALHUMMADI 2009 1 7 K KONG 2019 390 400 L DIAS 2015 93 98 A RAUN 2018 4626 4637 K CHOWDHRY 1984 360 372 U HOUSE 2007 88 96 M BOWKER 2015 606 612 M PERNICONE 1969 293 302 N ALLISON 1985 127 135 J MACHIELS 1985 103 119 C PERNICONE 1974 289 297 N DESHMUKH 2005 240 255 S TATIBOUET 1997 213 252 J GRIBOVSKII 2017 135 141 A SOARES 2001 221 229 A SOARES 2003 1315 1322 A SOARES 1997 A DIBLASI 1998 43 64 C HOLSTEIN 1996 118 124 W BELHEKAR 1994 395 402 A SOARES 2001 A JIRU 1966 674 688 P BIBIN 1969 10 V EVMENENKO 1968 1299 1304 N SANTACESARIA 1981 909 918 E SCHWEDOCK 2007 45 71 M MDRPIP 1964 1326 1336 DIAKOV 2002 1563 1569 V DIASX2023X119118 DIASX2023X119118XA 2025-03-31T00:00:00.000Z 2025-03-31T00:00:00.000Z http://creativecommons.org/licenses/by-nc-nd/4.0/ © 2024 Elsevier B.V. All rights reserved. 2024-01-22T21:20:52.484Z http://vtw.elsevier.com/data/voc/AddOnTypes/50.7/aggregated-refined Fundação para a Ciência e a Tecnologia UID/ECI/04028/2019 FCT FCT http://data.elsevier.com/vocabulary/SciValFunders/501100001871 http://sws.geonames.org/2264397 This research was partially supported by the Fundação para a Ciência e a Tecnologia through CERENA, under project UID/ECI/04028/2019 . https://doi.org/10.15223/policy-017 https://doi.org/10.15223/policy-037 https://doi.org/10.15223/policy-012 https://doi.org/10.15223/policy-029 https://doi.org/10.15223/policy-004 item S0926-860X(23)00098-4 S0926860X23000984 1-s2.0-S0926860X23000984 10.1016/j.apcata.2023.119118 271346 2024-01-22T20:59:51.482018Z 2023-05-25 1-s2.0-S0926860X23000984-main.pdf https://s3-eu-west-1.amazonaws.com/prod-ucs-content-store-eu-west/content/pii:S0926860X23000984/MAIN/application/pdf/6d2bd61116c031930e989914600b1c48/main.pdf main.pdf pdf true 1913056 MAIN 10 1-s2.0-S0926860X23000984-main_1.png https://s3-eu-west-1.amazonaws.com/prod-ucs-content-store-eu-west/content/pii:S0926860X23000984/PREVIEW/image/png/a64f3f47f0a6aed00fbdf09b06cc6791/main_1.png main_1.png png 60434 849 656 IMAGE-WEB-PDF 1 1-s2.0-S0926860X23000984-gr5.jpg https://s3-eu-west-1.amazonaws.com/prod-ucs-content-store-eu-west/content/pii:S0926860X23000984/gr5/DOWNSAMPLED/image/jpeg/238cc7cddb27231ac38325aaf1726270/gr5.jpg gr5 gr5.jpg jpg 27301 294 564 IMAGE-DOWNSAMPLED 1-s2.0-S0926860X23000984-gr2.jpg https://s3-eu-west-1.amazonaws.com/prod-ucs-content-store-eu-west/content/pii:S0926860X23000984/gr2/DOWNSAMPLED/image/jpeg/bf392f4e44db2dc61a67daf643546b37/gr2.jpg gr2 gr2.jpg jpg 52915 584 658 IMAGE-DOWNSAMPLED 1-s2.0-S0926860X23000984-ga1.jpg https://s3-eu-west-1.amazonaws.com/prod-ucs-content-store-eu-west/content/pii:S0926860X23000984/ga1/DOWNSAMPLED/image/jpeg/d78e0ac10f8e5352a2e9aaf0e02d7d0b/ga1.jpg ga1 true ga1.jpg jpg 18946 245 255 IMAGE-DOWNSAMPLED 1-s2.0-S0926860X23000984-gr4.jpg https://s3-eu-west-1.amazonaws.com/prod-ucs-content-store-eu-west/content/pii:S0926860X23000984/gr4/DOWNSAMPLED/image/jpeg/f24dbbef612ca6281edaae0602d65195/gr4.jpg gr4 gr4.jpg jpg 43033 590 658 IMAGE-DOWNSAMPLED 1-s2.0-S0926860X23000984-gr3.jpg https://s3-eu-west-1.amazonaws.com/prod-ucs-content-store-eu-west/content/pii:S0926860X23000984/gr3/DOWNSAMPLED/image/jpeg/a994ba4b9efad3a8a81f4131e4efe10d/gr3.jpg gr3 gr3.jpg jpg 28116 292 564 IMAGE-DOWNSAMPLED 1-s2.0-S0926860X23000984-fx1.jpg https://s3-eu-west-1.amazonaws.com/prod-ucs-content-store-eu-west/content/pii:S0926860X23000984/fx1/DOWNSAMPLED/image/jpeg/94a17f7f316d74ef2b0bfeeaa2f2caf8/fx1.jpg fx1 fx1.jpg jpg 1869 74 78 IMAGE-DOWNSAMPLED 1-s2.0-S0926860X23000984-gr1b.jpg https://s3-eu-west-1.amazonaws.com/prod-ucs-content-store-eu-west/content/pii:S0926860X23000984/gr1b/DOWNSAMPLED/image/jpeg/2343cd2cdf848e8a18da5d2175577004/gr1b.jpg gr1b gr1b.jpg jpg 65338 676 758 IMAGE-DOWNSAMPLED 1-s2.0-S0926860X23000984-gr1a.jpg https://s3-eu-west-1.amazonaws.com/prod-ucs-content-store-eu-west/content/pii:S0926860X23000984/gr1a/DOWNSAMPLED/image/jpeg/2549eb8f327bbabc64cea1487914fb02/gr1a.jpg gr1a gr1a.jpg jpg 102170 995 752 IMAGE-DOWNSAMPLED 1-s2.0-S0926860X23000984-fx2.jpg https://s3-eu-west-1.amazonaws.com/prod-ucs-content-store-eu-west/content/pii:S0926860X23000984/fx2/DOWNSAMPLED/image/jpeg/de99fb91020636ceba563b1afe708e67/fx2.jpg fx2 fx2.jpg jpg 2182 51 186 IMAGE-DOWNSAMPLED 1-s2.0-S0926860X23000984-gr5.sml https://s3-eu-west-1.amazonaws.com/prod-ucs-content-store-eu-west/content/pii:S0926860X23000984/gr5/THUMBNAIL/image/gif/734112a254871bd989bb8b5eb3238f07/gr5.sml gr5 gr5.sml sml 6536 114 219 IMAGE-THUMBNAIL 1-s2.0-S0926860X23000984-gr2.sml https://s3-eu-west-1.amazonaws.com/prod-ucs-content-store-eu-west/content/pii:S0926860X23000984/gr2/THUMBNAIL/image/gif/9dd81f1838d9553417b5e1da4727fee5/gr2.sml gr2 gr2.sml sml 6141 164 185 IMAGE-THUMBNAIL 1-s2.0-S0926860X23000984-ga1.sml https://s3-eu-west-1.amazonaws.com/prod-ucs-content-store-eu-west/content/pii:S0926860X23000984/ga1/THUMBNAIL/image/gif/155a510b91c1d7108517900c3df82935/ga1.sml ga1 true ga1.sml sml 9745 164 171 IMAGE-THUMBNAIL 1-s2.0-S0926860X23000984-gr4.sml https://s3-eu-west-1.amazonaws.com/prod-ucs-content-store-eu-west/content/pii:S0926860X23000984/gr4/THUMBNAIL/image/gif/a0ea31590ac21e8f3bc682c227cbd493/gr4.sml gr4 gr4.sml sml 6329 164 183 IMAGE-THUMBNAIL 1-s2.0-S0926860X23000984-gr3.sml https://s3-eu-west-1.amazonaws.com/prod-ucs-content-store-eu-west/content/pii:S0926860X23000984/gr3/THUMBNAIL/image/gif/a85bfe72e615d07e1cacd1869b7c7da3/gr3.sml gr3 gr3.sml sml 6561 114 219 IMAGE-THUMBNAIL 1-s2.0-S0926860X23000984-fx1.sml https://s3-eu-west-1.amazonaws.com/prod-ucs-content-store-eu-west/content/pii:S0926860X23000984/fx1/THUMBNAIL/image/gif/e05e353b5df5d112287b6b8ef8171e93/fx1.sml fx1 fx1.sml sml 4979 164 173 IMAGE-THUMBNAIL 1-s2.0-S0926860X23000984-gr1b.sml https://s3-eu-west-1.amazonaws.com/prod-ucs-content-store-eu-west/content/pii:S0926860X23000984/gr1b/THUMBNAIL/image/gif/d9160c177c0d354ee9209d57e1391c95/gr1b.sml gr1b gr1b.sml sml 4976 164 184 IMAGE-THUMBNAIL 1-s2.0-S0926860X23000984-gr1a.sml https://s3-eu-west-1.amazonaws.com/prod-ucs-content-store-eu-west/content/pii:S0926860X23000984/gr1a/THUMBNAIL/image/gif/38db19ebb90be1f332feb3ea94541d9b/gr1a.sml gr1a gr1a.sml sml 4050 164 124 IMAGE-THUMBNAIL 1-s2.0-S0926860X23000984-fx2.sml https://s3-eu-west-1.amazonaws.com/prod-ucs-content-store-eu-west/content/pii:S0926860X23000984/fx2/THUMBNAIL/image/gif/23dbf827f7c97e9d595be1e66d7f0f99/fx2.sml fx2 fx2.sml sml 2260 60 219 IMAGE-THUMBNAIL 1-s2.0-S0926860X23000984-gr5_lrg.jpg https://s3-eu-west-1.amazonaws.com/prod-ucs-content-store-eu-west/content/pii:S0926860X23000984/HIGHRES/image/jpeg/f49d4272726e2837336c7a422dafdeaa/gr5_lrg.jpg gr5 gr5_lrg.jpg jpg 153216 1303 2498 IMAGE-HIGH-RES 1-s2.0-S0926860X23000984-gr2_lrg.jpg https://s3-eu-west-1.amazonaws.com/prod-ucs-content-store-eu-west/content/pii:S0926860X23000984/HIGHRES/image/jpeg/a30724e33e9c1e599f43a100c1b48e52/gr2_lrg.jpg gr2 gr2_lrg.jpg jpg 291462 2581 2910 IMAGE-HIGH-RES 1-s2.0-S0926860X23000984-ga1_lrg.jpg https://s3-eu-west-1.amazonaws.com/prod-ucs-content-store-eu-west/content/pii:S0926860X23000984/HIGHRES/image/jpeg/06feae0afb19e348dd352315ea26e255/ga1_lrg.jpg ga1 true ga1_lrg.jpg jpg 147255 1085 1130 IMAGE-HIGH-RES 1-s2.0-S0926860X23000984-gr4_lrg.jpg https://s3-eu-west-1.amazonaws.com/prod-ucs-content-store-eu-west/content/pii:S0926860X23000984/HIGHRES/image/jpeg/00ece248a11dc695a0e9e43614ae9a23/gr4_lrg.jpg gr4 gr4_lrg.jpg jpg 279920 2611 2910 IMAGE-HIGH-RES 1-s2.0-S0926860X23000984-gr3_lrg.jpg https://s3-eu-west-1.amazonaws.com/prod-ucs-content-store-eu-west/content/pii:S0926860X23000984/HIGHRES/image/jpeg/e7b4e1facb7d700d56da578ad58724bc/gr3_lrg.jpg gr3 gr3_lrg.jpg jpg 157279 1295 2498 IMAGE-HIGH-RES 1-s2.0-S0926860X23000984-fx1_lrg.jpg https://s3-eu-west-1.amazonaws.com/prod-ucs-content-store-eu-west/content/pii:S0926860X23000984/HIGHRES/image/jpeg/a7b067e500531982378c6aeb760cd51c/fx1_lrg.jpg fx1 fx1_lrg.jpg jpg 8504 329 347 IMAGE-HIGH-RES 1-s2.0-S0926860X23000984-gr1b_lrg.jpg https://s3-eu-west-1.amazonaws.com/prod-ucs-content-store-eu-west/content/pii:S0926860X23000984/HIGHRES/image/jpeg/baf20cdb103f6ff9639743e1ec66fa68/gr1b_lrg.jpg gr1b gr1b_lrg.jpg jpg 393337 2986 3348 IMAGE-HIGH-RES 1-s2.0-S0926860X23000984-gr1a_lrg.jpg https://s3-eu-west-1.amazonaws.com/prod-ucs-content-store-eu-west/content/pii:S0926860X23000984/HIGHRES/image/jpeg/7fd053694dce39cee4640ea2c25c8598/gr1a_lrg.jpg gr1a gr1a_lrg.jpg jpg 619161 4407 3331 IMAGE-HIGH-RES 1-s2.0-S0926860X23000984-fx2_lrg.jpg https://s3-eu-west-1.amazonaws.com/prod-ucs-content-store-eu-west/content/pii:S0926860X23000984/HIGHRES/image/jpeg/62040776793fd9b5a15c3751ec74f195/fx2_lrg.jpg fx2 fx2_lrg.jpg jpg 9355 226 825 IMAGE-HIGH-RES 1-s2.0-S0926860X23000984-si0001.svg https://s3-eu-west-1.amazonaws.com/prod-ucs-content-store-eu-west/content/pii:S0926860X23000984/image/svg+xml/59a0313e615d52065e9def4151630c5b/si0001.svg si0001 si0001.svg svg 2694 ALTIMG 1-s2.0-S0926860X23000984-si0002.svg https://s3-eu-west-1.amazonaws.com/prod-ucs-content-store-eu-west/content/pii:S0926860X23000984/image/svg+xml/a934fb40320e6226577afb0c1f8972e6/si0002.svg si0002 si0002.svg svg 2694 ALTIMG 1-s2.0-S0926860X23000984-si0003.svg https://s3-eu-west-1.amazonaws.com/prod-ucs-content-store-eu-west/content/pii:S0926860X23000984/image/svg+xml/b4bd884cc7e9246fd7440b85e2e242f6/si0003.svg si0003 si0003.svg svg 2998 ALTIMG 1-s2.0-S0926860X23000984-si0004.svg https://s3-eu-west-1.amazonaws.com/prod-ucs-content-store-eu-west/content/pii:S0926860X23000984/image/svg+xml/b4bd884cc7e9246fd7440b85e2e242f6/si0004.svg si0004 si0004.svg svg 2998 ALTIMG 1-s2.0-S0926860X23000984-si0005.svg https://s3-eu-west-1.amazonaws.com/prod-ucs-content-store-eu-west/content/pii:S0926860X23000984/image/svg+xml/e15eadbb3b3ad4ea3ee3773b3f389678/si0005.svg si0005 si0005.svg svg 3164 ALTIMG 1-s2.0-S0926860X23000984-si0006.svg https://s3-eu-west-1.amazonaws.com/prod-ucs-content-store-eu-west/content/pii:S0926860X23000984/image/svg+xml/90d645121e1d452ba7f13b2d9eb3af34/si0006.svg si0006 si0006.svg svg 3059 ALTIMG 1-s2.0-S0926860X23000984-si0007.svg https://s3-eu-west-1.amazonaws.com/prod-ucs-content-store-eu-west/content/pii:S0926860X23000984/image/svg+xml/cf1725b1e9c0dcc89868ce2d64c8408f/si0007.svg si0007 si0007.svg svg 3756 ALTIMG 1-s2.0-S0926860X23000984-si0008.svg https://s3-eu-west-1.amazonaws.com/prod-ucs-content-store-eu-west/content/pii:S0926860X23000984/image/svg+xml/1d6df5c2d87cf0d9d82bf4a5453baec2/si0008.svg si0008 si0008.svg svg 4607 ALTIMG 1-s2.0-S0926860X23000984-si0009.svg https://s3-eu-west-1.amazonaws.com/prod-ucs-content-store-eu-west/content/pii:S0926860X23000984/image/svg+xml/69db2f6e43d79fd1af8bef77f1cc1889/si0009.svg si0009 si0009.svg svg 5580 ALTIMG 1-s2.0-S0926860X23000984-si0010.svg https://s3-eu-west-1.amazonaws.com/prod-ucs-content-store-eu-west/content/pii:S0926860X23000984/image/svg+xml/16ab8637fdc124d88e57c55a2a51c298/si0010.svg si0010 si0010.svg svg 2650 ALTIMG 1-s2.0-S0926860X23000984-si0011.svg https://s3-eu-west-1.amazonaws.com/prod-ucs-content-store-eu-west/content/pii:S0926860X23000984/image/svg+xml/1a29942453cec715a8a19a8691d08e6e/si0011.svg si0011 si0011.svg svg 4915 ALTIMG 1-s2.0-S0926860X23000984-si0012.svg https://s3-eu-west-1.amazonaws.com/prod-ucs-content-store-eu-west/content/pii:S0926860X23000984/image/svg+xml/049eaeb6fde0c7bb440bb1ae2f61eaed/si0012.svg si0012 si0012.svg svg 3112 ALTIMG 1-s2.0-S0926860X23000984-si0013.svg https://s3-eu-west-1.amazonaws.com/prod-ucs-content-store-eu-west/content/pii:S0926860X23000984/image/svg+xml/0e8268d1fe7d9c761f213651d40cc806/si0013.svg si0013 si0013.svg svg 1693 ALTIMG 1-s2.0-S0926860X23000984-si0014.svg https://s3-eu-west-1.amazonaws.com/prod-ucs-content-store-eu-west/content/pii:S0926860X23000984/image/svg+xml/22b8e36d710450dda60f6673d6841217/si0014.svg si0014 si0014.svg svg 2913 ALTIMG 1-s2.0-S0926860X23000984-si0015.svg https://s3-eu-west-1.amazonaws.com/prod-ucs-content-store-eu-west/content/pii:S0926860X23000984/image/svg+xml/2a2af7c129349225a59c427a51ecea31/si0015.svg si0015 si0015.svg svg 1916 ALTIMG 1-s2.0-S0926860X23000984-si0016.svg https://s3-eu-west-1.amazonaws.com/prod-ucs-content-store-eu-west/content/pii:S0926860X23000984/image/svg+xml/e8ba5934cd6cd30a4f8c35948aaf911a/si0016.svg si0016 si0016.svg svg 3168 ALTIMG 1-s2.0-S0926860X23000984-si0017.svg https://s3-eu-west-1.amazonaws.com/prod-ucs-content-store-eu-west/content/pii:S0926860X23000984/image/svg+xml/abadfbe8fac6c91daec1083fc8be295f/si0017.svg si0017 si0017.svg svg 3112 ALTIMG 1-s2.0-S0926860X23000984-si0018.svg https://s3-eu-west-1.amazonaws.com/prod-ucs-content-store-eu-west/content/pii:S0926860X23000984/image/svg+xml/2445e3573e2499db362d53c67334ff66/si0018.svg si0018 si0018.svg svg 2925 ALTIMG 1-s2.0-S0926860X23000984-si0019.svg https://s3-eu-west-1.amazonaws.com/prod-ucs-content-store-eu-west/content/pii:S0926860X23000984/image/svg+xml/30e37105bbae5056ef3bf20ed9b0eab6/si0019.svg si0019 si0019.svg svg 2200 ALTIMG 1-s2.0-S0926860X23000984-si0020.svg https://s3-eu-west-1.amazonaws.com/prod-ucs-content-store-eu-west/content/pii:S0926860X23000984/image/svg+xml/ee3fd5b28dd70c70f99687f55dc80a59/si0020.svg si0020 si0020.svg svg 1944 ALTIMG 1-s2.0-S0926860X23000984-si0021.svg https://s3-eu-west-1.amazonaws.com/prod-ucs-content-store-eu-west/content/pii:S0926860X23000984/image/svg+xml/bbf6fddcdbe40d86f9081b4b5e998a0d/si0021.svg si0021 si0021.svg svg 2179 ALTIMG 1-s2.0-S0926860X23000984-si0022.svg https://s3-eu-west-1.amazonaws.com/prod-ucs-content-store-eu-west/content/pii:S0926860X23000984/image/svg+xml/5e5ae52466268ded1a8ea264bc8b3d99/si0022.svg si0022 si0022.svg svg 1093 ALTIMG 1-s2.0-S0926860X23000984-si0023.svg https://s3-eu-west-1.amazonaws.com/prod-ucs-content-store-eu-west/content/pii:S0926860X23000984/image/svg+xml/302fee3d6a91eafea75b4eef51722cc5/si0023.svg si0023 si0023.svg svg 1150 ALTIMG 1-s2.0-S0926860X23000984-si0024.svg https://s3-eu-west-1.amazonaws.com/prod-ucs-content-store-eu-west/content/pii:S0926860X23000984/image/svg+xml/0868f4bdb84f77f8271c409779bcc926/si0024.svg si0024 si0024.svg svg 1405 ALTIMG 1-s2.0-S0926860X23000984-si0025.svg https://s3-eu-west-1.amazonaws.com/prod-ucs-content-store-eu-west/content/pii:S0926860X23000984/image/svg+xml/d5388c06360a133c0888eadb37c67d1a/si0025.svg si0025 si0025.svg svg 2179 ALTIMG 1-s2.0-S0926860X23000984-si0026.svg https://s3-eu-west-1.amazonaws.com/prod-ucs-content-store-eu-west/content/pii:S0926860X23000984/image/svg+xml/458716fc5256496c3b4769143d7e9298/si0026.svg si0026 si0026.svg svg 2159 ALTIMG 1-s2.0-S0926860X23000984-si0027.svg https://s3-eu-west-1.amazonaws.com/prod-ucs-content-store-eu-west/content/pii:S0926860X23000984/image/svg+xml/b51bed95c355f8bdde4ef107453e878a/si0027.svg si0027 si0027.svg svg 948 ALTIMG 1-s2.0-S0926860X23000984-si0028.svg https://s3-eu-west-1.amazonaws.com/prod-ucs-content-store-eu-west/content/pii:S0926860X23000984/image/svg+xml/e717aac8f367dbe42f366ad6efa0dd16/si0028.svg si0028 si0028.svg svg 1053 ALTIMG 1-s2.0-S0926860X23000984-si0029.svg https://s3-eu-west-1.amazonaws.com/prod-ucs-content-store-eu-west/content/pii:S0926860X23000984/image/svg+xml/f3f71030ff5a659beb2df509e7f5e6b5/si0029.svg si0029 si0029.svg svg 1061 ALTIMG 1-s2.0-S0926860X23000984-si0030.svg https://s3-eu-west-1.amazonaws.com/prod-ucs-content-store-eu-west/content/pii:S0926860X23000984/image/svg+xml/34f54be820c6cfad237eeac7b348d4da/si0030.svg si0030 si0030.svg svg 1195 ALTIMG 1-s2.0-S0926860X23000984-si0031.svg https://s3-eu-west-1.amazonaws.com/prod-ucs-content-store-eu-west/content/pii:S0926860X23000984/image/svg+xml/c57163113886384b8339977fec10e5ca/si0031.svg si0031 si0031.svg svg 1418 ALTIMG 1-s2.0-S0926860X23000984-si0032.svg https://s3-eu-west-1.amazonaws.com/prod-ucs-content-store-eu-west/content/pii:S0926860X23000984/image/svg+xml/03a23e8593c8e817ab91401f64f60783/si0032.svg si0032 si0032.svg svg 1296 ALTIMG 1-s2.0-S0926860X23000984-si0033.svg https://s3-eu-west-1.amazonaws.com/prod-ucs-content-store-eu-west/content/pii:S0926860X23000984/image/svg+xml/cf0c2831df3e68ad98be6ea3c7818fe0/si0033.svg si0033 si0033.svg svg 1130 ALTIMG 1-s2.0-S0926860X23000984-si0034.svg https://s3-eu-west-1.amazonaws.com/prod-ucs-content-store-eu-west/content/pii:S0926860X23000984/image/svg+xml/6c2961385db2aba476ea670fd5177685/si0034.svg si0034 si0034.svg svg 1065 ALTIMG 1-s2.0-S0926860X23000984-si0035.svg https://s3-eu-west-1.amazonaws.com/prod-ucs-content-store-eu-west/content/pii:S0926860X23000984/image/svg+xml/f7f367fbb0092f7417d93c078a27c66e/si0035.svg si0035 si0035.svg svg 1588 ALTIMG 1-s2.0-S0926860X23000984-si0036.svg https://s3-eu-west-1.amazonaws.com/prod-ucs-content-store-eu-west/content/pii:S0926860X23000984/image/svg+xml/68e599df21f52a3cb059db8397e4a4d2/si0036.svg si0036 si0036.svg svg 1357 ALTIMG 1-s2.0-S0926860X23000984-si0037.svg https://s3-eu-west-1.amazonaws.com/prod-ucs-content-store-eu-west/content/pii:S0926860X23000984/image/svg+xml/554d9eb996cd9a0fc0facfd1d907678d/si0037.svg si0037 si0037.svg svg 1025 ALTIMG 1-s2.0-S0926860X23000984-si0038.svg https://s3-eu-west-1.amazonaws.com/prod-ucs-content-store-eu-west/content/pii:S0926860X23000984/image/svg+xml/affbecfd78d71e35d550c4a922ba4638/si0038.svg si0038 si0038.svg svg 2289 ALTIMG 1-s2.0-S0926860X23000984-si0039.svg https://s3-eu-west-1.amazonaws.com/prod-ucs-content-store-eu-west/content/pii:S0926860X23000984/image/svg+xml/8194b1dc7b081a42bb21e94450456627/si0039.svg si0039 si0039.svg svg 2731 ALTIMG 1-s2.0-S0926860X23000984-si0040.svg https://s3-eu-west-1.amazonaws.com/prod-ucs-content-store-eu-west/content/pii:S0926860X23000984/image/svg+xml/b5fd4b1f6dd4ba553587b2610d8316c2/si0040.svg si0040 si0040.svg svg 2905 ALTIMG 1-s2.0-S0926860X23000984-si0041.svg https://s3-eu-west-1.amazonaws.com/prod-ucs-content-store-eu-west/content/pii:S0926860X23000984/image/svg+xml/2e66af29668210e5f783a91500ed6359/si0041.svg si0041 si0041.svg svg 3209 ALTIMG 1-s2.0-S0926860X23000984-si0042.svg https://s3-eu-west-1.amazonaws.com/prod-ucs-content-store-eu-west/content/pii:S0926860X23000984/image/svg+xml/f3db3befb0a110c8a8a850920f371919/si0042.svg si0042 si0042.svg svg 2868 ALTIMG 1-s2.0-S0926860X23000984-si0043.svg https://s3-eu-west-1.amazonaws.com/prod-ucs-content-store-eu-west/content/pii:S0926860X23000984/image/svg+xml/ac4c65e303267ef3f0a111929a0254c7/si0043.svg si0043 si0043.svg svg 2483 ALTIMG 1-s2.0-S0926860X23000984-si0044.svg https://s3-eu-west-1.amazonaws.com/prod-ucs-content-store-eu-west/content/pii:S0926860X23000984/image/svg+xml/6c1bc5148f1142b6335c778985e7238c/si0044.svg si0044 si0044.svg svg 2297 ALTIMG 1-s2.0-S0926860X23000984-si0045.svg https://s3-eu-west-1.amazonaws.com/prod-ucs-content-store-eu-west/content/pii:S0926860X23000984/image/svg+xml/a1d54927efd854cecfcc2a3977314ee1/si0045.svg si0045 si0045.svg svg 2200 ALTIMG 1-s2.0-S0926860X23000984-si0046.svg https://s3-eu-west-1.amazonaws.com/prod-ucs-content-store-eu-west/content/pii:S0926860X23000984/image/svg+xml/f801fcba79cc676c1e7f9e71cd4e2d89/si0046.svg si0046 si0046.svg svg 2317 ALTIMG 1-s2.0-S0926860X23000984-si0047.svg https://s3-eu-west-1.amazonaws.com/prod-ucs-content-store-eu-west/content/pii:S0926860X23000984/image/svg+xml/a4b7c3cc2c55ec6958a3c45386609cf4/si0047.svg si0047 si0047.svg svg 3817 ALTIMG 1-s2.0-S0926860X23000984-si0048.svg https://s3-eu-west-1.amazonaws.com/prod-ucs-content-store-eu-west/content/pii:S0926860X23000984/image/svg+xml/bbe2bda617ccc8dbe09ff70ccf5cd521/si0048.svg si0048 si0048.svg svg 2467 ALTIMG 1-s2.0-S0926860X23000984-si0049.svg https://s3-eu-west-1.amazonaws.com/prod-ucs-content-store-eu-west/content/pii:S0926860X23000984/image/svg+xml/ad29b3b3c7fd57d0c3a8e23e055cee9a/si0049.svg si0049 si0049.svg svg 2994 ALTIMG 1-s2.0-S0926860X23000984-si0050.svg https://s3-eu-west-1.amazonaws.com/prod-ucs-content-store-eu-west/content/pii:S0926860X23000984/image/svg+xml/b976b666af02fb6b18b1cefd584caf7b/si0050.svg si0050 si0050.svg svg 1746 ALTIMG 1-s2.0-S0926860X23000984-si0051.svg https://s3-eu-west-1.amazonaws.com/prod-ucs-content-store-eu-west/content/pii:S0926860X23000984/image/svg+xml/eb153ee9e15eb058c5eaa552218b7152/si0051.svg si0051 si0051.svg svg 1487 ALTIMG 1-s2.0-S0926860X23000984-si0052.svg https://s3-eu-west-1.amazonaws.com/prod-ucs-content-store-eu-west/content/pii:S0926860X23000984/image/svg+xml/356c4d2fd6feb58b4ff5044b60ae48b3/si0052.svg si0052 si0052.svg svg 2877 ALTIMG 1-s2.0-S0926860X23000984-si0053.svg https://s3-eu-west-1.amazonaws.com/prod-ucs-content-store-eu-west/content/pii:S0926860X23000984/image/svg+xml/c5977d63a37142dfbabe7c70792dfee5/si0053.svg si0053 si0053.svg svg 2925 ALTIMG 1-s2.0-S0926860X23000984-am.pdf https://s3-eu-west-1.amazonaws.com/prod-ucs-content-store-eu-west/content/egi:10BGKVK33S7/MAIN/application/pdf/c76622cc86c415d7b33e73b1f6c8111a/am.pdf am am.pdf pdf false 1946316 AAM-PDF APCATA 119118 119118 S0926-860X(23)00098-4 10.1016/j.apcata.2023.119118 Elsevier B.V. Fig. 1 A – Formaldehyde yield versus contact time (6% (V/V) of methanol in air). Fig. 1B – Dimethyl ether yield versus contact time (6% (V/V) of methanol in air). Fig. 1C – Carbon monoxide yield versus contact time (6% (V/V) of methanol in air). Fig. 1 Fig. 2 Rate of formaldehyde production experimental data and fitted kinetic r HCHO = k C H 3 OH [ H 2 O ] − 1 (dotted lines). Fig. 2 Fig. 3 Arrhenius plots of kinetics constants fitted using kinetics law r HCHO = k C H 3 OH [ H 2 O ] − 1 (data Fig.; Ea in cal/mol). Fig. 3 Fig. 4 Rate of carbon monoxide production. Experimental data and fitted kinetic law r CO = k [ C H 3 OH ] 0.5 [ HCHO ] − 1 [ H 2 O ] − 1 (dotted lines). Fig. 4 Fig. 5 Arrhenius plots of kinetics constants fitted using kinetics law r CO = k [ C H 3 OH ] 0.5 [ HCHO ] − 1 [ H 2 O ] − 1 . Fig. 5 Table 1 Kinetics laws for methanol to formaldehyde oxidation from literature. Table 1 Kinetics law r = k 1 P MeOH m 1 + 0.5 k 1 k 2 P MeOH m P O 2 n Jiru et al. [29] r = k 1 C Me OH 1 + a 1 C MeOH + a 2 C H 2 O Bibin et al. [30] r = k C MeOH 1 + b 1 C MeOH + b 3 C H 2 O C O 2 1 + b 2 C O 2 Evmenenko et al. [31] r = k 1 k 2 P MeOH P O 2 0.5 k 1 P MeOH + k 2 P O 2 0.5 1 1 + b H 2 O P H 2 O Santacesaria et al. [32] r = P MeOH m P O 2 n k 1 P MeOH m + k 2 P O 2 n 1 + k 3 P H 2 O r = P MeOH m P O 2 n k 1 P MeOH m 1 + k 3 P H 2 O + k 2 P O 2 n Soares et al. [28] r = k C MeOH m C O 2 n C H 2 O l Machiels et al. [26] r = k P MeOH P O 2 1 2 1 + k ′ P MeOH + k ′′ P H 2 O 1 + k ′′′ P O 2 1 2 Deshmukh et al. [19] Table 2 Formaldehyde to carbon monoxide kinetics from literature. Table 2 Kinetics law Ea (kcal/mol) Reference r = k P HCHO 1 2 1 + k ′ P HCHO 1 2 10–17 Schwedock et al. [33] r = k P HCHO ---- Dente et al. [34] r = k P HCHO P O 2 1 + k ′ P O 2 2 17.3 Diakov and Blakwell [35] r = k P HCHO P O 2 --- BiBin and Popov [30] r = k P HCHO P O 2 1 2 1 + k ′ P O 2 1 2 11 Deshmukh et al. [19] r = k P HCH O 1 2 1 + k ′ P HCHO 1 2 ---- Holstein and Wilson [26] r = k C MeOH 0.5 C HCHO − 1 C H 2 O − 1 36.1 Soares et al. [28] Table 3 BET surface area, elemental composition (ICP, EDS and XPS), surface reduction (Fe2+/Fe3+ atomic ratio by XPS) of the prepared catalysts, Mössbauer phases and XRD phases. Table 3 Mo/Fe atomic ratio and preparation technique BET surface area(m2/g) Mo/Featomic ratioby ICP Mo/Featomic ratioby EDS Mo/Featomic ratioby XPS Fe2+/Fe3+ atomic ratioby XPS Mössbauerphases XRD phases Mo/Fe= 1.5 coprecipitation 2.8 1.5 2.1 1.89 0.24 Fe2(MoO4)3 Fe2(MoO4)3 Mo/Fe= 1.5 sol-gel 4.8 1.2 1.6 1.58 0.57 Fe2(MoO4)3 αFe2O3 Fe2(MoO4)3 Mo/Fe= 3 coprecipitation 8.3 2.9 4,3 2.35 0.19 Fe2(MoO4)3 Fe2(MoO4)3.xMoO3; Fe2(MoO4)3; MoO3 Mo/Fe= 3 sol-gel 16.4 1.9 2,6 2.17 0.60 Fe2(MoO4)3 FeMoO4 Fe2(MoO4)3.xMoO3; Fe2(MoO4)3; MoO3 Table 4 Parameter of the analytic curve ( Y HCHO = A . τ + B . τ 1.2 ) fitted to the formaldehyde yield versus contact time experimental data (R2- squared correlation coefficient). Table 4 Mo/Fe= 1.5 Coprecipitated T = 275 °C T = 305 °C T = 320 °C T = 345 °C Ax102 0.625 1.31 1.78 4.49 B x102 -0.155 -0.464 -0.636 -1.91 r 2 0.997 1 0.983 0.971 Mo/Fe= 3 Sol-Gel T = 275 °C T = 290 °C T = 305 °C T = 320 °C A 0.134 0.213 0.252 0.304 B -0.061 -0.104 -0.126 -0.157 r 2 0.994 0.957 0.937 0.677 Mo/Fe= 1.5 Sol-Gel T = 275 °C T = 290 °C T = 305 °C T = 320 °C A x102 1.54 1.72 2.92 4.49 B x102 -0.57 -0.58 -1.12 -1.81 r 2 0.991 0.993 0.999 0.999 Mo/Fe= 3 Coprecipitated T = 300 °C T = 325 °C T = 350 °C T = 375 °C A 0.189 0.262 0.311 0.350 B -0.083 -0.123 -0.150 -0.171 r 2 0.983 0.899 0.835 0.974 Table 5 Parameter of the analytic curve ( Y CO = A . τ + B . τ 1.2 ) fitted to the carbon monoxide yield versus contact time experimental data (R2- squared correlation coefficient). Table 5 Mo/Fe= 1.5 Coprecipitated T = 275 °C T = 305 °C T = 320 °C T = 345 °C Ax10 2 3.333 5.06 5.08 5.72 Bx10 2 -1.31 -2.14 -2.13 -2.28 r 2 0.984 0.791 0.877 0.866 Mo/Fe= 3 Coprecipitated T = 300 °C T = 325 °C T = 350 °C T = 375 °C Ax10 2 3.29 4.57 5.59 6.82 Bx10 2 -1.34 -1.79 -2.47 -3.20 r 2 0.980 0.985 0.935 0 Mo/Fe= 1.5 Sol-Gel T = 275 °C T = 290 °C T = 305 °C T = 320 °C Ax10 2 4.42 6.14 6.66 8.76 Bx10 2 -1.69 -2.53 -2.68 -3.66 r 2 0.940 0.959 0.990 0.831 Mo/Fe= 3 Sol-Gel T = 275 °C T = 290 °C T = 305 °C T = 320 °C Ax10 2 4.65 8.86 11.3 9.97 Bx10 2 -1.84 -4.05 -5.28 -4.30 r 2 0.960 0.928 0.851 0.9613 Methanol oxidation over iron molybdate catalysts. Main and side reactions kinetics Ana Paula Soares Dias Conceptualization Methodology Investigation Writing – review & editing a ⁎ Bruna Rijo Data curation Validation a b Alain Kiennemann Supervision Formal analysis c Manuel Farinha Portela Supervision Funding acquisition d a CERENA, Instituto Superior Técnico, Universidade de Lisboa, Av. Rovisco Pais, 1, 1049-001 Lisboa, Portugal CERENA, Instituto Superior Técnico, Universidade de Lisboa Av. Rovisco Pais, 1 Lisboa 1049-001 Portugal CERENA, Instituto Superior Técnico, Universidade de Lisboa, Av. Rovisco Pais, 1, 1049–001 Lisboa, Portugal b CoLAB BIOREF—Collaborative Laboratory for Biorefineries, 4466-901 São Mamede de Infesta, Portugal CoLAB BIOREF—Collaborative Laboratory for Biorefineries São Mamede de Infesta 4466-901 Portugal CoLAB BIOREF—Collaborative Laboratory for Biorefineries, 4466–901 São Mamede de Infesta, Portugal c Laboratoire des Matériaux et Procédés pour la Catalyse, UMR 7515, ECPM, Université Louis Pasteur, 25 rue Becquerel, 67087 Strasbourg Cedex 2, France Laboratoire des Matériaux et Procédés pour la Catalyse, UMR 7515, ECPM, Université Louis Pasteur 25 rue Becquerel Strasbourg Cedex 2 67087 France Laboratoire des Matériaux et Procédés pour la Catalyse, UMR 7515, ECPM, Université Louis Pasteur, 25 rue Becquerel, 67087 Strasbourg Cedex 2, France d Departamento de Engenharia Química, Instituto Superior Técnico, Universidade de Lisboa, Av. Rovisco Pais, 1, 1049-001 Lisboa, Portugal Departamento de Engenharia Química, Instituto Superior Técnico, Universidade de Lisboa Av. Rovisco Pais, 1 Lisboa 1049-001 Portugal Departamento de Engenharia Química, Instituto Superior Técnico, Universidade de Lisboa, Av. Rovisco Pais, 1, 1049–001 Lisboa, Portugal ⁎ Corresponding author. The kinetics of methanol to formaldehyde oxidation over iron molybdates catalysts has been studied. Data were obtained in integral reactor conditions and the rates of the products formation were computed by differentiation of experimental data yield versus contact time. Catalytic tests were performed over stoichiometric (Mo/Fe=1.5 at. ratio) and Mo rich (Mo/Fe=3 at. ratio) catalysts prepared by coprecipitation and sol-gel like techniques. The Mo/Fe atomic ratio of the catalysts seems to have a null effect on the methanol to formaldehyde kinetics what is coherent with the attribution of the active phase to the Fe2(MoO4)3, the main phase of the tested catalysts. A direct correlation between the CO formation and the Mo/Fe atomic ratio was not inferred mainly due to the different degrees of reduction of the tested catalysts (Fe2+/Fe3+), but the Mo/Fe ratio plays an important role on the consecutive oxidation of formaldehyde to CO thus controlling catalyst selectivity. Graphical Abstract ga1 Keywords Methanol oxidation Iron molybdates Mo excess Kinetics Side reactions Formaldehyde Data availability Data will be made available on request. Nomenclature A, B parameters for the analytic curve f i τ j = A . τ + B . τ j 1.2 . C i concentration of the i component. k , k ′ kinetics constants. Ea activation energy (Kcal/mol). FO objective function. R perfect gas constant (1.9858775(34) cal. K− 1.mol− 1). r2 squared correlation coefficient. T temperature. V/V volume fraction. X methanol conversion. f i ( τ j ) analytical curve for yield of the product i versus contact time ( f i τ j = A . τ + B . τ j 1.2 , i = formaldeyde or CO ). τ contact time. P i partial pressure of the i component (methanol, oxygen, water, formaldehyde). r ij rate of formation of the product i (formaldehyde and CO) at temperature j. r CO rate of CO production. r HCHO rate of formaldehyde production. r exp observed reaction rate. r comp computed reaction rate. P T total pressure. Y i yield of the i product. y MeOH o molar faction of methanol in the reactor feed. y O 2 o molar fraction of oxygen in the reactor feed. ε i stoichiometric coefficient. 1 Introduction People benefit from products that contain formaldehyde every day. Formaldehyde, a small and versatile molecule (HCHO) has several applications in resins, fibers, solvents, preservatives, plasticizers, drying agents, coatings, among others with a global market which is expected to reach US$ 15 Bn by 2031 [1]. The price for formaldehyde is closely coupled with the price for methanol. In fact, methanol is the raw material used in industry to produce formaldehyde. The commercial production of formaldehyde was first started in Germany in the 1880 s but the development of a methanol synthesis route in the 1920 s gave the spur to the development of large-scale manufacture. Today there are two main production routes: oxidation-dehydrogenation using a silver catalyst involving either the complete or incomplete conversion of methanol; and the direct oxidation of methanol to formaldehyde using oxides type catalysts. Hybrid processes are also used in industry [2]. Iron molybdates are industrial catalysts for selective oxidation of methanol to formaldehyde [2]. Since the pioneer work of Adkins et al. [3] in 1931, a large number of papers and patents has been published and the catalytic systems his relatively well characterized [2]. Industrial iron molybdate catalysts present large Mo excess and but its role remains doubtful [4–7]. Pure MoO3 presents high selectivity towards formaldehyde, but the activity is low. Contrarily the Fe2O3 shows high activity but low formaldehyde selectivity. Over hematite methanol is totally oxidized to CO. Actually Mo-Fe mixed oxides present high catalytic performances for selective oxidation of methanol and it is believed by the majority of researchers that a Mo excess is needed to avoid the formation of unselective iron rich phases during the redox process. In fact, Mo is lost by volatilization during reaction[8]. Recently, Kong et al. [9] reported a green synthesis method of MoFeO catalyst using a mechanochemical route, emphasizing an improved formaldehyde selectivity for mixed oxide samples with higher content of Fe2(MoO4)3 crystalline phase. The authors also reported a lower formaldehyde selectivity for catalyst with segregated plates of MoO3 and granules of Fe2(MoO4)3. A cooperative effect between the Mo excess (MoO3) and the molybdate phase was claimed by Dias et al. [10]. As reported before, the authors found improved formaldehyde selectivity for Mo rich catalysts. Data from Ruan et al. [11] corroborate the fact that Fe2(MoO4)3 phase plays a crucial for the high selectivity towards formaldehyde. Chowdhry et al. [12] reported that Fe-Mo mixed oxides catalysts are more active than pure MoO3 but the selectivity towards formaldehyde and the kinetics is similar for both materials. House et al. [13] studied the methanol oxidation over MoO3 and hematite using pulse reactor. They confirmed the high selectivity of MoO3 toward formaldehyde and high activity of hematite but low selectivity. The researchers attributed the different catalytic behaviors observed to the stronger oxygen biding energy of hematite. It is generally accepted that methanol to formaldehyde oxidation, over iron molybdate catalysts, proceeds via a Mars van Krevelen redox mechanisms [2]. Recently Bowker confirmed a Mars-van Krevelen reaction mechanism in which the active species are surface lattice oxygens. The author also underlined the crucial role of high oxidation state (VI) surface Mo species on the catalyst selectivity [14]. According to Pernicone [15] such mechanism can by schematized by: CH3OH+□+O2-→(CH3O-□)-+OH- (CH3O-□)-+ O2-→(CH2O-□)2-+OH- 2 O H − D ⇄ H 2 O + O 2 − + ̈ (CH2O-□)2-→HCHO+□2- 1/2 O2 +□2-→ O2- Where □ is an anionic vacancy and O2- is lattice oxygen. The same author reported that Mo6+ provides adsorption sites for methanol forming an alcoholate complex. Allisson and Goddard III [16] also reported a similar reaction intermediate involving a dual dioxo Mo site: Image 1 . Analogous methanol adsorption sites were described by Machiels et al. [17] proposed the methanol adsorption site involving two adjacent molybdenums: Image 2 . Taking into account the behavior of some trivalent (Al, Cr) metal molybdates, Pernicone [18] emphasized that the role of Fe is to increase the number of methanol adsorption sites existing in stationary conditions by making the dehydroxylation of the catalyst surface easier. The methanol to formaldehyde oxidation produces water. Typically, authors report a competitive dissociative adsorption of water and methanol on molybdenum sites. Thus, water is referred to have an inhibition effect on the methanol oxidation reaction. Certain researchers reported that water is responsible for the high selectivity towards formaldehyde since avoid its readsorption and consecutive reactions [2]. Deshmukh et al. [19] proposed for the same reaction a Langmuir-Hinshelwood kinetics assuming two different metal oxide sites, one containing adsorbed oxygenates and the other containing lattice oxygen. For this mechanism water also has an inhibition effect by competitive adsorption. Regarding the above features for the methanol oxidation reaction mechanism researchers proposed several kinetics laws ( Table 1). For the proposed laws the methanol reaction order varies in the range 1–0.5 and the order relative to oxygen is usually lower than 0.5 been zero when oxygen is in excess. The activation energy is around 20 kcal/mol at 275 °C [2]. Kinetics data strongly depends on the reaction conditions used. In spite of the high selectivity of the iron molybdates catalysts for methanol to formaldehyde reaction other products are also formed depending on the catalyst type and reaction conditions. The reactions occurring during methanol oxidation over Mo-Fe-O catalysts can be divided in two main types [20]: i. Oxidation reactions, which need oxygen ii. Dehydration reactions, which do not need oxygen Generally, the reaction products can be accounted for by the reactions [2]: (r1) C H 3 OH + 1 2 O 2 → HCHO + H 2 O (r2) C H 3 OH + C H 3 OH → C H 3 OC H 3 + H 2 O (r3) C H 3 OH + HCHO + 1 2 O 2 → HCOOC H 3 + H 2 O (r4) 2 C H 3 OH + HCHO → C H 2 OC H 3 2 + H 2 O (r5) HCHO + 1 / 2 O 2 → CO + H 2 O The selectivity towards formaldehyde increases raising the methanol conversion since for the formation of DME, MF and DMM unreacted methanol must be available in the reaction medium [2]. Gribovskii et al. [21] reported, using a complex microchannel reactor, high formaldehyde selectivities (near 100%) even for methanol conversion lower than 30%. Formic acid is rarely observed in the reactor outlet mainly due to its instability in reaction conditions. Carbon monoxide is the main by product in industry. Despite the industrial relevance of this secondary reaction, due to its negative effect, only few researchers studied their kinetics. The large variety of kinetics laws ( Table 2), obtained by a few researchers, can be due to the different reaction conditions employed. In fact, most of the researchers consider that CO is only formed by oxidation of formaldehyde, but any carbon compound can be converted to CO. The various pathways for CO formation depend on the reaction conditions. Although the large volume of research work published during more than 50 years several items remain unclear for the above-mentioned catalytic system. In order to contribute to the knowledge in this research field the next sections present the results and discussion of a kinetics study for methanol to formaldehyde oxidation. The catalytic data were obtained with an integral reactor using catalysts with different Mo/Fe atomic ratios prepared by coprecipitation and sol-gel like route. 2 Experimental 2.1 Preparation of the catalysts Stoichiometric (Mo/Fe=1.5 at. ratio) and molybdenum rich (Mo/Fe=3 at. ratio) catalysts have been prepared by coprecipitation [22] and sol-gel like [23,24] techniques. Briefly the coprecipitated samples were prepared from aqueous solutions of Fe(NO3)3·9 H2O and (NH4)6Mo7O24. All the reagents were p.a. grade. In order to avoid gel formation during coprecipitation low concentration solutions have been used. The iron nitrate solution was slowly added to the ammonium heptamolybdate solution under vigorous stirring. Before filtration, precipitates remained in contact with mother-liquors for 3 h at boiling temperature. Additionally, samples with the same Mo/Fe atomic ratios (1.5 and 3) were prepared by a sol-gel like technique using propionic acid as chelating agent. Details on the preparation method are given elsewhere [23,24]. For both preparation techniques the powder materials obtained by crushing in a pyrex mortar were dried (overnight at 120 °C) and then calcined under slow flow of dried air at 475 °C during 10 h. An industrial Mo rich catalyst (Mo/Fe=3 at. ratio), provided by a local formaldehyde industry was used as standard for the catalytic behavior. 2.2 Characterization of the catalysts For fresh catalysts the elemental composition, near surface, was assessed by SEM-EDS using a JEOL JSM 840 equipment with a Delta Kevex energy dispersive X-ray analyser. The BET surface areas were measured with a Perkin-Elmer Shell 212 C sorptometer by N2 physisorption. The bulk elemental compositions were determined by induced coupled plasma (ICP). X-ray diffraction (XRD) patterns were recorded with a D5000 Siemens diffractometer with a primary beam quartz monochromator (Co Kα1 =1.78897 Å) at 40 kV and 25 mA. The bulk compositions of iron phases, for fresh and post reaction catalysts samples were studied by transmission Mössbauer spectroscopy at room temperature with a time mode spectrometer, a constant acceleration drive and a 57Co in a Rh matrix source. The isomer shifts (δ) were given with respect to α-Fe at room temperature and calculated as the quadrupole splittings (Δ) and the line widths (W) with a precision of 0.02 mm s−1. Details on spectral parameters calculations are given elsewhere [22]. X-ray photoelectron spectroscopy (XPS) was used to investigate the chemical analysis and reduction state of the surface of the fresh catalysts. The analyses were performed with a VG ESCA 3 apparatus. The kinetic energy of the emitted photoelectron was given by E Kin= 1486.6 − E Bcor, where 1486.6 eV is the energy of the incident radiation (Al Kα) and E Bcor the corrected binding energy of the electron. The binding energy of the electron, corrected from charge effects, was calibrated with respect to the signal for adventitious carbon (binding energy: 284.8 eV). 2.3 Catalytic tests Methanol oxidation was carried out in a conventional continuous flow apparatus at atmospheric pressure. Catalytic behavior was studied in steady state conditions. Feed mixtures (6%, v/v) were prepared by injecting methanol into the air flow with a precise Gilson 302 pump. The catalysts were diluted with inert SiC (1:4, w/w) to avoid adverse thermal effects and charged into a tubular pyrex reactor with a thermocouple in a coaxial centered thermowell. Catalyst particles of diameter dp < 125 µm (115 mesh sieve) were used in order to minimize the effects of internal diffusion limitations on the mass and heat transfer. The reactor outlet was kept at 130 °C, to prevent condensation of liquid products and formaldehyde polymerization, and was connected to a Shimadzu GC-8A gas chromatograph with thermal conductivity detector. Two in-parallel columns, one at room temperature (molecular sieve 13X) for N2, O2, and CO and the other in the oven of the chromatograph (Porapak T) at 443 K for air, CO2, HCHO, CH3OCH3 (DME), H2O, CH3OH (MeOH), HCOOCH3 (MF) and CH2(OCH3)2 (DMM), performed the separation of the reactor effluents. Formic acid was never detected. The carbon balance was evaluated for each catalytic test and the data were rejected if the error was higher than 5%. 3 Results and discussion Results in Table 3 show, as reported before [25], that sol-gel like route allows to obtain materials with larger surface area than those obtained by coprecipitation. Also, the Mo rich samples present a larger surface area than the stoichiometric sample. The elemental compositions in Table 3 show that catalysts prepared by sol-gel technique presented lower Mo/Fe ratio than the previewed considering the same ratio in the precursor’s solutions. Since the combustion of carbon precursors (carbon was added as propionic acid) is highly exothermic, during calcination step occurs Mo species loss by sublimation/volatilization. All the prepared catalyst displayed a near surface (EDS) Mo/Fe ratio higher than the bulk value (ICP) whereas XPS data showed surface Mo/Fe ratios always higher than the stoichiometric value and around 2. The Fe2+/Fe3+ ratios obtained by XPS showed that fresh catalysts are partially reduced even before reaction. The sample prepared by sol-gel presented higher degree of surface reduction than the coprecipitated samples. This result for sol-gel samples can be explained considering that some iron species are reduced during carbon species oxidation that occurs during calcination. Moreover, for coprecipitation technique both samples displayed similar degrees of reduction. The presence of reduced iron species was confirmed by Mössbauer spectroscopy. The data in Table 3 show measurable amounts of reduced phases for sol-gel samples and confirm the fact that sol-gel technique allows to higher reduction state than coprecipitation technique. The sol-gel sample with lower Mo/Fe ratio presents iron oxide what is consistent with its substoichiometric Mo/Fe ratio (Mo/Fe= 1.2 at. ratio by ICP). Despite the Fe2+/Fe3+ ratios no reduced iron molybdate or iron phases have been observed by XRD (Table 3). In fact, the detection level of XRD is reported to be around 7% (w/w) thus the reduced iron molybdate phase and the iron oxide observed by Mössbauer remain undetected by XRD. The catalysts prepared by both techniques displayed analogous XRD characteristics but with low crystallinity for sol-gel samples. The stoichiometric sample, prepared by coprecipitation, presented XRD lines ascribable to Fe2(MoO4)3. The main XRD lines of the Mo-rich samples were attributable to the Fe2(MoO4)3.xMoO3 and MoO3 phases [22]. 3.1 Catalytic activity Due to the high activity of tested catalyst, conversion was always higher than 10%. Thus, integral reactor was considered. The kinetics data were obtained for reaction mixtures containing 6% of methanol in air, reaction temperatures in the range 275–375 °C and contact times in the range 5–40 gcat.h/molCH3OH. Only appreciable amounts of formaldehyde and CO were detected for all the prepared catalysts ( Fig. 1A, Fig. 1B and Fig. 1C). For stoichiometric samples, coprecipitated and sol-gel like, measurable amounts of DME were also detected in the reactor outlet. The formation of dimethyl ether is more probable when large amounts of methanol are available on the catalyst surface (low methanol conversion) and the oxygen is scarce. The catalytic tests were performed with a large excess of oxygen and with high methanol conversion (low methanol availability) what explains the low selectivities towards dimethyl ether observed (Fig. 1B). The products yields (Yi) were plotted (Figs. 1A, 1B &1 C) versus contact time (τ j ) for each studied reaction temperature (j). The results in Fig. 1A show, as expected, that the formaldehyde yield increase raising the contact time and the reaction temperature, except for high conversion levels (high contact time) when the consecutive oxidation of formaldehyde becomes significant [22]. The rates of products formation (ri j , i-product, j-temperature) can be computed by differentiation of the fitted curves (f i (τ j )) to products yields (Y ij ) experimental data (Eq.1): (1) r ij = ∂ f i ( τ ) ∂ τ j For formaldehyde yield the experimental data (Fig. 1A) several curves (f i (τ j )) have being tested and the chosen, on basis of the squared correlation coefficient, was (Eq.2): (2) Y HCHO = A . τ + B . τ 1.2 For the prepared catalysts the fitted parameters A and B as well as the squared correlation coefficients are resumed in Tables 4 and 5. The rates of formaldehyde formation were computed by differentiation of the above curve. For each formaldehyde rate value, the composition of the reaction mixture was computed considering the following set of reaction that account for the products observed in the reactor outlet. Thus, the partial pressures of methanol, oxygen and water were computed by (Eq.3 and eq. 4): (3) P MeOH = P T . Y MeOH o ( 1 X ) (4) P H 2 O = P T . Y MeOH o . ( Y 1 + 1 2 Y 2 + Y 3 + 1 3 Y 4 + 2 Y 5 ) For other products the partial pressure was computed using (Eq.5): (5) P i = P T . Y MeOH o . Y i . 1 ε i Where ε i is the stoichiometric coefficient. Different kinetics laws have been proposed by several authors for the methanol to formaldehyde oxidation reaction (Table 1). The available data, relatively scarce, discourages the fitting of complex kinetics laws with several parameters. Thus, a power law, as proposed by Holstein and Machiels [26], was adopted (Eq.6): (6) r HCHO = k C MeOH m C O 2 n C H 2 O l This kinetics law includes the water inhibition effect. As underlined by the authors the true value of the reaction rate is only obtained when the inhibition effects accounted for. In fact, several authors reported that water, a reaction product, adsorb competitively with the methanol in the same active site [20,27] thus hindering the reaction. Some of them also claimed that this effect is responsible for the high selectivity towards formaldehyde exhibited by iron molybdates catalysts [26]. The catalytic tests were always performed with a large oxygen excess ( y o 2 0 ≈ 19 % ) thus its concentration was considered constant. The kinetics law parameters were computed using the SOLVER routine of EXCEL software, imposing k > 0 and m , − 1 ∈ [ 0 , 1 ] . The optimum values were obtained minimizing the objective function FO (Eq.7): (7) FO = ∑ i r exp − r comp r exp 2 where r exp is the observed reaction rate and r comp is the computed value. Experimental data and fitted kinetics laws are in Fig. 2. For all the tested catalysts optimum fittings were obtained for m= 1 and l= −1 evidencing the strong inhibition effect of water. The Arrhenius plots for computed kinetics constants (k) are in Fig. 3 Nonetheless for stoichiometric samples and Mo rich prepared by sol-gel technique the Arrhenius are the same within the error margin. The activation energy around 22 Kcal/mol agrees with previously published results [16]. Thus, it can be concluded that the Mo/Fe atomic ratio of the catalyst is irrelevant for the kinetics of the methanol to formaldehyde oxidation. This result agrees with the attribution of the active phase to the Fe2(MoO4)3 [6]. The Mo excess is only a spectator phase [15]. For the Mo rich sample prepared by coprecipitation, the Arrhenius parameters are different what can be ascribable to the slightly different reaction conditions. In fact, this sample was tested for higher reaction temperatures what can be responsible for a different slow step and by different activation energy. The main byproduct in the tested conditions was carbon monoxide. In an analogous manner the rate of CO production was computed by differentiation of the fitted curves to experimental data CO yields versus contact time. As previously reported [28] experimental rates of CO formation fitted with power kinetics law(Eq.8): (8) r CO = k ′ C MeOH m 1 C O 2 n 1 C H 2 O l 1 The kinetics parameters (k′,m1,n1,l1) were computed as above described for the formaldehyde reaction rate. Experimental data and fitted kinetics laws are in Fig. 4. The best fitting was obtained for m1 = 0.5, n1 = −1 and l1 = −1. For the Mo/Fe= 3 coprecipitated catalyst the inhibitor effect of water is minor (l1 =0). Astonishingly, the rate of CO production is proportional to methanol concentration instead of the expected formaldehyde concentration. This result pointed out that, in tested condition, the direct overoxidation of methanol was not negligible. CO can, in theory, be simultaneously formed by oxidation of any of the reaction products. As expected, the water inhibits the CO formation thus improving the catalyst selectivity. Contrary to the observed for the rate of formaldehyde formation the CO depends on the Mo/Fe ratio of the catalyst and certainly on its Fe2+/Fe3+ ratio. Arrhenius plots in Fig. 5 show different activation energy for each tested catalyst but sol-gel catalysts display similar value and higher than coprecipitated ones what explains observed high formaldehyde selectivity, for high reaction temperature, for these catalysts. The Mo/Fe atomic ratio seems to have an important role in the catalyst selectivity since the kinetics of the main byproduct (CO) depend on its value. This result is in line with the high selectivity towards formaldehyde (around 100%) obtained when methanol is oxidized over pure MoO3. 4 Conclusions Iron molybdate catalysts are well established catalytic systems for selective oxidation of methanol to formaldehyde, an important building block for more complex products such as rubber. The active phase of the catalysts is ascribed to the stoichiometric mixed oxide (Fe2(MoO4)3) but industrial catalysts present a high molybdenum excess, usually with Mo/Fe atomic ratios higher than 3. Recently researchers claimed a synergy effect between the MoO3 and the Fe2(MoO4)3 what apparently opposes the former spectator role attributed to the MoO3 excess. In order to contribute to clarify the role of the Mo excess on the catalytic performances of iron molybdates catalysts stoichiometric and Mo rich samples were prepared by coprecipitation and sol-gel like techniques. Data from characterization techniques revealed that sol-gel technique allows catalysts with higher surface areas but with higher surface reduction. For both preparation techniques samples showed Mo surface enrichment but always with Fe2(MoO4)3 as the main bulk component. Kinetics studies performed in integral conditions revealed that the Mo excess has an almost null effect on the formaldehyde production rate. Data computed by differentiation of experimental data of formaldehyde yield versus contact time fitted well to kinetics power law with a first order methanol dependence showing a strong water inhibition effect due to the recognized competitive adsorption between water and methanol in the same active sites. The activation energy computed based on the Arrhenius plot was 22 kcal/mol what agrees with previously published values by other authors. Kinetics analysis of CO production, computed as above referred by differentiation of yield versus contact time curves, showed a power kinetics law dependent of the methanol concentration (reaction order 0.5), hindered by formaldehyde and water. Methanol dependence seems to indicate that CO is produced by other overoxidation processes than that of formaldehyde. Apparently, any molecule containing carbon, in reaction medium can be converted into CO. This would explain the observed lack of usual reaction products such as dimethyl ether, methyl formate and dimethoxymethane in the reactor effluent. Contrary to the null effect observed for the formaldehyde formation rate, the Mo/Fe ratio seems to affect the CO formation. All the tested catalyst presented different Arrhenius plots for the CO formation kinetic constant. Additionally, the samples prepared by sol-gel method presented higher activation energy what explains their highest formaldehyde selectivity. The higher activation energy would be related to their higher surface reduction. CRediT authorship contribution statement A.P. Soares Dias: Conceptualization, Methodology, Investigation, Writing – review & editing. Bruna Rijo: Data curation, Validation, Review & editing. Alain Kiennemann: Supervision, Formal analysis. M.F. Portela: Supervision, Funding acquisition. Declaration of Competing Interest The authors declare that they have no known competing financial interests or personal relationships that could have appeared to influence the work reported in this paper. Acknowledgments This research was partially supported by the Fundação para a Ciência e a Tecnologia through CERENA, under project UID/ECI/04028/2019. References [1] Formaldehyde Market to Reach Value of US$ 15 Bn by 2031, Notes TMR Study n.d. 〈https://www.prnewswire.com/news-releases/formaldehyde-market-to-reach-value-of-us-15-bn-by-2031-notes-tmr-study-301646131.html〉 (accessed November 24, 2022). [2] A.P.A.P. Vieira Soares M. Farinha Portela A. Kiennemann Methanol selective oxidation to formaldehyde over iron-molybdate catalysts vol. 47 2005 10.1081/CR-200049088 Vieira Soares A.P.A.P., Farinha Portela M., Kiennemann A. Methanol selective oxidation to formaldehyde over iron-molybdate catalysts. vol. 47. 2005. https://doi.org/10.1081/CR-200049088. [3] H. Adkins W.R. Peterson The oxidation of methanol with air over iron, molybdenum, and iron-molybdenum oxides J. Am. Chem. Soc. 53 1931 1512 1520 10.1021/JA01355A050/ASSET/JA01355A050.FP.PNG_V03 Adkins H., Peterson W.R. The oxidation of methanol with air over iron, molybdenum, and iron-molybdenum oxides. J Am Chem Soc 1931;53:1512–1520. https://doi.org/10.1021/JA01355A050/ASSET/JA01355A050.FP.PNG_V03. [4] M. Bowker R. Holroyd A. Elliott P. Morrall A. Alouche C. Entwistle The selective oxidation of methanol to formaldehyde on iron molybdate catalysts and on component oxides 2002 833 Catal. Lett. 83 2002 165 176 10.1023/A:1021025828544 Bowker M., Holroyd R., Elliott A., Morrall P., Alouche A., Entwistle C., et al. The Selective Oxidation of Methanol to Formaldehyde on Iron Molybdate Catalysts and on Component Oxides. Catal Lett 2002 833 2002;83:165–176. https://doi.org/10.1023/A:1021025828544. [5] M. Bowker C. Brookes A.F. Carley M.P. House M. Kosif G. Sankar Evolution of active catalysts for the selective oxidative dehydrogenation of methanol on Fe2O3 surface doped with Mo oxide Phys. Chem. Chem. Phys. 15 2013 12056 12067 10.1039/C3CP50399B Bowker M., Brookes C., Carley A.F., House M.P., Kosif M., Sankar G., et al. Evolution of active catalysts for the selective oxidative dehydrogenation of methanol on Fe2O3 surface doped with Mo oxide. Phys Chem Chem Phys 2013;15:12056–12067. https://doi.org/10.1039/C3CP50399B. [6] E. Söderhjelm M.P. House N. Cruise J. Holmberg M. Bowker J.O. Bovin On the synergy effect in MoO3-Fe2(MoO 4)3 catalysts for methanol oxidation to formaldehyde Top. Catal. 50 2008 145 155 10.1007/S11244-008-9112-1/FIGURES/10 Söderhjelm E., House M.P., Cruise N., Holmberg J., Bowker M., Bovin J.O., et al. On the synergy effect in MoO3-Fe2(MoO 4)3 catalysts for methanol oxidation to formaldehyde. Top Catal 2008;50:145–155. https://doi.org/10.1007/S11244–008-9112–1/FIGURES/10. [7] K. Routray W. Zhou C.J. Kiely I.E. Wachs Catalysis science of methanol oxidation over iron vanadate catalysts: nature of the catalytic active sites ACS Catal. 1 2011 54 66 10.1021/CS1000569/SUPPL_FILE/CS1000569_SI_001.PDF Routray K., Zhou W., Kiely C.J., Wachs I.E. Catalysis science of methanol oxidation over iron vanadate catalysts: Nature of the catalytic active sites. ACS Catal 2011;1:54–66. https://doi.org/10.1021/CS1000569/SUPPL_FILE/CS1000569_SI_001.PDF. [8] K. Khazzal Hummadi K.H. Hassan P.C.H. Mitchell A. Khawarizmi Selectivity and activity of iron molybdate catalysts in oxidation of methanol J. Eng. Res. 6 2009 1 7 Khazzal Hummadi K., Hassan K.H., Mitchell P.C.H., Khawarizmi A. Selectivity and Activity of Iron Molybdate Catalysts in Oxidation of Methanol. J Eng Res 2009;6:1–7. [9] L.Tao Kong M. Zhang X. Liu F. yun Ma B. Wei K. Wumaier Green and rapid synthesis of iron molybdate catalyst by mechanochemistry and their catalytic performance for the oxidation of methanol to formaldehyde Chem. Eng. J. 364 2019 390 400 10.1016/J.CEJ.2019.01.164 Kong L.Tao, Zhang M., Liu X., Ma F. yun, Wei B., Wumaier K., et al. Green and rapid synthesis of iron molybdate catalyst by mechanochemistry and their catalytic performance for the oxidation of methanol to formaldehyde. Chem Eng J 2019;364:390–400. https://doi.org/10.1016/J.CEJ.2019.01.164. [10] A.P.S. Dias F. Montemor M.F. Portela A. Kiennemann The role of the suprastoichiometric molybdenum during methanol to formaldehyde oxidation over Mo–Fe mixed oxides J. Mol. Catal. A Chem. 397 2015 93 98 10.1016/J.MOLCATA.2014.10.022 Dias A.P.S., Montemor F., Portela M.F., Kiennemann A. The role of the suprastoichiometric molybdenum during methanol to formaldehyde oxidation over Mo–Fe mixed oxides. J Mol Catal A Chem 2015;397:93–98. https://doi.org/10.1016/J.MOLCATA.2014.10.022. [11] K.V. Raun L.F. Lundegaard J. Chevallier P. Beato C.C. Appel K. Nielsen Deactivation behavior of an iron-molybdate catalyst during selective oxidation of methanol to formaldehyde Catal. Sci. Technol. 8 2018 4626 4637 10.1039/C8CY01109E Raun K.V., Lundegaard L.F., Chevallier J., Beato P., Appel C.C., Nielsen K., et al. Deactivation behavior of an iron-molybdate catalyst during selective oxidation of methanol to formaldehyde. Catal Sci Technol 2018;8:4626–4637. https://doi.org/10.1039/C8CY01109E. [12] U. Chowdhry A. Ferretti L.E. Firment C.J. Machiels F. Ohuchi A.W. Sleight Mechanism and surface structural effects in methanol oxidation over molybdates Appl. Surf. Sci. 19 1984 360 372 10.1016/0378-5963(84)90073-4 Chowdhry U., Ferretti A., Firment L.E., Machiels C.J., Ohuchi F., Sleight A.W., et al. Mechanism and surface structural effects in methanol oxidation over molybdates. Appl Surf Sci 1984;19:360–372. https://doi.org/10.1016/0378–5963(84)90073–4. [13] M.P. House A.F. Carley M. Bowker Selective oxidation of methanol on iron molybdate catalysts and the effects of surface reduction J. Catal. 252 2007 88 96 10.1016/J.JCAT.2007.09.005 House M.P., Carley A.F., Bowker M. Selective oxidation of methanol on iron molybdate catalysts and the effects of surface reduction. J Catal 2007;252:88–96. https://doi.org/10.1016/J.JCAT.2007.09.005. [14] M. Bowker Rules for selective oxidation exemplified by methanol selective oxidation on iron molybdate catalysts 2015 5810 Top. Catal. 58 2015 606 612 10.1007/S11244-015-0399-4 Bowker M. Rules for Selective Oxidation Exemplified by Methanol Selective Oxidation on Iron Molybdate Catalysts. Top Catal 2015 5810 2015;58:606–612. https://doi.org/10.1007/S11244–015-0399–4. [15] N. Pernicone F. Lazzerin G. Liberti G. Lanzavecchia On the mechanism of CH3OH oxidation to CH2O over MoO3·Fe2(MoO4)3 catalyst J. Catal. 14 1969 293 302 10.1016/0021-9517(69)90319-4 Pernicone N., Lazzerin F., Liberti G., Lanzavecchia G. On the mechanism of CH3OH oxidation to CH2O over MoO3·Fe2(MoO4)3 catalyst. J Catal 1969;14:293–302. https://doi.org/10.1016/0021–9517(69)90319–4. [16] J.N. Allison W.A. Goddard Oxidative dehydrogenation of methanol to formaldehyde J. Catal. 92 1985 127 135 10.1016/0021-9517(85)90242-8 Allison J.N., Goddard W.A. Oxidative dehydrogenation of methanol to formaldehyde. J Catal 1985;92:127–135. https://doi.org/10.1016/0021–9517(85)90242–8. [17] C.J. Machiels U. Chowdhry W.T.A. Harrison A.W. Sleight Molybdate and tungstate catalysts for methanol oxidation ACS Symp. Ser. 1985 103 119 10.1021/BK-1985-0279.CH007 Machiels C.J., Chowdhry U., Harrison W.T.A., Sleight A.W. MOLYBDATE AND TUNGSTATE CATALYSTS FOR METHANOL OXIDATION. ACS Symp Ser 1985:103–119. https://doi.org/10.1021/BK-1985–0279.CH007. [18] N. Pernicone MoO3·Fe2(MoO4)3 catalysts for methanol oxidation J. Less Common Met. 36 1974 289 297 10.1016/0022-5088(74)90113-1 Pernicone N. MoO3·Fe2(MoO4)3 catalysts for methanol oxidation. J Less Common Met 1974;36:289–297. https://doi.org/10.1016/0022–5088(74)90113–1. [19] S.A.R.K. Deshmukh M. Van Sint Annaland J.A.M. Kuipers Kinetics of the partial oxidation of methanol over a Fe-Mo catalyst Appl. Catal. A Gen. 289 2005 240 255 10.1016/J.APCATA.2005.05.005 Deshmukh S.A.R.K., Van Sint Annaland M., Kuipers J.A.M. Kinetics of the partial oxidation of methanol over a Fe-Mo catalyst. Appl Catal A Gen 2005;289:240–255. https://doi.org/10.1016/J.APCATA.2005.05.005. [20] J.M. Tatibouët Methanol oxidation as a catalytic surface probe Appl. Catal. A Gen. 148 1997 213 252 10.1016/S0926-860X(96)00236-0 Tatibouët J.M. Methanol oxidation as a catalytic surface probe. Appl Catal A Gen 1997;148:213–252. https://doi.org/10.1016/S0926–860X(96)00236–0. [21] A.G. Gribovskii E.V. Ovchinnikova N.V. Vernikovskaya D.V. Andreev V.A. Chumachenko L.L. Makarshin Microchannel reactor for intensifying oxidation of methanol to formaldehyde over Fe-Mo catalyst Chem. Eng. J. 308 2017 135 141 10.1016/J.CEJ.2016.09.058 Gribovskii A.G., Ovchinnikova E.V., Vernikovskaya N.V., Andreev D.V., Chumachenko V.A., Makarshin L.L. Microchannel reactor for intensifying oxidation of methanol to formaldehyde over Fe-Mo catalyst. Chem Eng J 2017;308:135–141. https://doi.org/10.1016/J.CEJ.2016.09.058. [22] A.P.V. Soares M. Farinha Portela A. Kiennemann L. Hilaire J.M.M. Millet Iron molybdate catalysts for methanol to formaldehyde oxidation: effects of Mo excess on catalytic behaviour Appl. Catal. A Gen. 206 2001 221 229 10.1016/S0926-860X(00)00600-1 Soares A.P.V., Farinha Portela M., Kiennemann A., Hilaire L., Millet J.M.M. Iron molybdate catalysts for methanol to formaldehyde oxidation: Effects of Mo excess on catalytic behaviour. Appl Catal A Gen 2001;206:221–229. https://doi.org/10.1016/S0926–860X(00)00600–1. [23] A.P.V. Soares M.F. Portela A. Kiennemann L. Hilaire Mechanism of deactivation of iron-molybdate catalysts prepared by coprecipitation and sol - gel techniques in methanol to formaldehyde oxidation Chem. Eng. Sci. 58 2003 1315 1322 10.1016/S0009-2509(02)00573-0 Soares A.P.V.A.P.V., Portela M.F.M.F., Kiennemann A., Hilaire L. Mechanism of deactivation of iron-molybdate catalysts prepared by coprecipitation and sol - gel techniques in methanol to formaldehyde oxidation. Chem Eng Sci 2003;58:1315–1322. https://doi.org/10.1016/S0009–2509(02)00573–0. [24] A.P.V. Soares M.F. Portela A. Kiennemann A comparison of iron molybdate catalysts for methanol oxidation prepared by copreciptation and new sol-gel method vol. 110 1997 Soares A.P.V., Portela M.F., Kiennemann A. A comparison of iron molybdate catalysts for methanol oxidation prepared by copreciptation and new sol-gel method. vol. 110. 1997. [25] C. Di Blasi Comparison of semi-global mechanisms for primary pyrolysis of lignocellulosic fuels J. Anal. Appl. Pyrolysis 47 1998 43 64 10.1016/S0165-2370(98)00079-5 Di Blasi C. Comparison of semi-global mechanisms for primary pyrolysis of lignocellulosic fuels. J Anal Appl Pyrolysis 1998;47:43–64. https://doi.org/10.1016/S0165–2370(98)00079–5. [26] W.L. Holstein C.J. Machiels Inhibition of methanol oxidation by water vapor—effect on measured kinetics and relevance to the mechanism J. Catal. 162 1996 118 124 10.1006/JCAT.1996.0265 Holstein W.L., Machiels C.J. Inhibition of Methanol Oxidation by Water Vapor—Effect on Measured Kinetics and Relevance to the Mechanism. J Catal 1996;162:118–124. https://doi.org/10.1006/JCAT.1996.0265. [27] A.A. Belhekar S. Ayyappan A.V. Ramaswamy FT-IR studies on the evolution of different phases and their interaction in ferric molybdate—molybdenum trioxide catalysts J. Chem. Technol. Biotechnol. 59 1994 395 402 10.1002/JCTB.280590413 Belhekar A.A., Ayyappan S., Ramaswamy A.V. FT-IR studies on the evolution of different phases and their interaction in ferric molybdate—molybdenum trioxide catalysts. J Chem Technol Biotechnol 1994;59:395–402. https://doi.org/10.1002/JCTB.280590413. [28] A.P.V. Soares M.F. Portela A. Kiennemann Kinetics of the main and side reactions of the methanol oxidation over iron molybdates vol. 133 2001 10.1016/S0167-2991(01)82000-0 Soares A.P.V., Portela M.F., Kiennemann A. Kinetics of the main and side reactions of the methanol oxidation over iron molybdates. vol. 133. 2001. https://doi.org/10.1016/S0167–2991(01)82000–0. [29] P. Jírů J. Tichý B. Wichterlová Kinetik der Oxidation des Methylalkohols zu Formaldehyd an einem Oxidkatalysator Collect Czechoslov Chem. Commun. 31 1966 674 688 10.1135/CCCC19660674 Jírů P., Tichý J., Wichterlová B. Kinetik der Oxidation des Methylalkohols zu Formaldehyd an einem Oxidkatalysator. Collect Czechoslov Chem Commun 1966;31:674–688. https://doi.org/10.1135/CCCC19660674. [30] V.N. Bibin B.I. Popov Kinetics of methanol oxidation by air on iron- molybdenum oxide catalysts Kinet. Catal. (Engl. Transl. ) 10 1091 1969 10 Bibin, V.N.; Popov B.I. Kinetics of Methanol Oxidation by Air on Iron- Molybdenum Oxide Catalysts. Kinet Catal (Engl Transl), 10 1091 1969;10:1091. [31] N.P. Evmenenko Y. Gorokhovatskii Kinetics of methanol oxidation at a ferromolybdenum catalyst Kinet. Katal. 10 1968 1299 1304 Evmenenko, N.P.; Gorokhovatskii Y. Kinetics of methanol oxidation at a ferromolybdenum catalyst. Kinet Katal 1968;10:1299–1304. [32] E. Santacesaria M. Morbidelli S. Carrà Kinetics of the catalytic oxidation of methanol to formaldehyde Chem. Eng. Sci. 36 1981 909 918 10.1016/0009-2509(81)85045-2 Santacesaria E., Morbidelli M., Carrà S. Kinetics of the catalytic oxidation of methanol to formaldehyde. Chem Eng Sci 1981;36:909–918. https://doi.org/10.1016/0009–2509(81)85045–2. [33] M.J. Schwedock L.C. Windes W.H. Ray Steady state and dynamic modelling of a packed bed reactor for the partial oxidation of methanol to formaldehyde II. Experimental results compared with model predictions 78 2007 45 71 10.1080/00986448908940186 Schwedock M.J., Windes L.C., Ray W.H. Steady state and dynamic modelling of a packed bed reactor for the partial oxidation of methanol to formaldehyde II. Experimental results compared with model predictions. 2007;78:45–71. https://doi.org/10.1080/00986448908940186. [34] M D, R P, I P Cinetica dell’ossidazione del metanolo a formaldeide con catalizzatore a base di ossidi di Fe e Mo. I. Equazione cinetica per la reazione principale: CH3OH+1/202→CH2O+H2O Chim. Ind. 46 1964 1326 1336 M D, R P, I P. Cinetica dell’ossidazione del metanolo a formaldeide con catalizzatore a base di ossidi di Fe e Mo. I. Equazione cinetica per la reazione principale: CH3OH+1/202→CH2O+H2O. Chim Ind 1964;46:1326–1336. [35] V. Diakov B. Blackwell A. Varma Methanol oxidative dehydrogenation in a catalytic packed-bed membrane reactor: experiments and model Chem. Eng. Sci. 57 2002 1563 1569 10.1016/S0009-2509(02)00031-3 Diakov V., Blackwell B., Varma A. Methanol oxidative dehydrogenation in a catalytic packed-bed membrane reactor: experiments and model. Chem Eng Sci 2002;57:1563–1569. https://doi.org/10.1016/S0009–2509(02)00031–3.",
      "scopus-id": "85151393253",
      "coredata": {
        "eid": "1-s2.0-S0926860X23000984",
        "dc:description": "The kinetics of methanol to formaldehyde oxidation over iron molybdates catalysts has been studied. Data were obtained in integral reactor conditions and the rates of the products formation were computed by differentiation of experimental data yield versus contact time. Catalytic tests were performed over stoichiometric (Mo/Fe=1.5 at. ratio) and Mo rich (Mo/Fe=3 at. ratio) catalysts prepared by coprecipitation and sol-gel like techniques. The Mo/Fe atomic ratio of the catalysts seems to have a null effect on the methanol to formaldehyde kinetics what is coherent with the attribution of the active phase to the Fe2(MoO4)3, the main phase of the tested catalysts. A direct correlation between the CO formation and the Mo/Fe atomic ratio was not inferred mainly due to the different degrees of reduction of the tested catalysts (Fe2+/Fe3+), but the Mo/Fe ratio plays an important role on the consecutive oxidation of formaldehyde to CO thus controlling catalyst selectivity.",
        "openArchiveArticle": "false",
        "prism:coverDate": "2023-05-25",
        "openaccessUserLicense": null,
        "prism:aggregationType": "Journal",
        "prism:url": "https://api.elsevier.com/content/article/pii/S0926860X23000984",
        "dc:creator": [
          {
            "@_fa": "true",
            "$": "Dias, Ana Paula Soares"
          },
          {
            "@_fa": "true",
            "$": "Rijo, Bruna"
          },
          {
            "@_fa": "true",
            "$": "Kiennemann, Alain"
          },
          {
            "@_fa": "true",
            "$": "Portela, Manuel Farinha"
          }
        ],
        "link": [
          {
            "@_fa": "true",
            "@rel": "self",
            "@href": "https://api.elsevier.com/content/article/pii/S0926860X23000984"
          },
          {
            "@_fa": "true",
            "@rel": "scidir",
            "@href": "https://www.sciencedirect.com/science/article/pii/S0926860X23000984"
          }
        ],
        "dc:format": "application/json",
        "openaccessType": null,
        "pii": "S0926-860X(23)00098-4",
        "prism:volume": "658",
        "articleNumber": "119118",
        "prism:publisher": "Elsevier B.V.",
        "dc:title": "Methanol oxidation over iron molybdate catalysts. Main and side reactions kinetics",
        "prism:copyright": "© 2024 Elsevier B.V. All rights reserved.",
        "openaccess": "0",
        "prism:issn": "0926860X",
        "dcterms:subject": [
          {
            "@_fa": "true",
            "$": "Methanol oxidation"
          },
          {
            "@_fa": "true",
            "$": "Iron molybdates"
          },
          {
            "@_fa": "true",
            "$": "Mo excess"
          },
          {
            "@_fa": "true",
            "$": "Kinetics"
          },
          {
            "@_fa": "true",
            "$": "Side reactions"
          },
          {
            "@_fa": "true",
            "$": "Formaldehyde"
          }
        ],
        "openaccessArticle": "false",
        "prism:publicationName": "Applied Catalysis A: General",
        "openaccessSponsorType": null,
        "prism:pageRange": "119118",
        "pubType": "fla",
        "prism:coverDisplayDate": "25 May 2023",
        "prism:doi": "10.1016/j.apcata.2023.119118",
        "prism:startingPage": "119118",
        "dc:identifier": "doi:10.1016/j.apcata.2023.119118",
        "openaccessSponsorName": null
      },
      "objects": {
        "object": [
          {
            "@category": "standard",
            "@height": "294",
            "@width": "564",
            "@_fa": "true",
            "$": "https://api.elsevier.com/content/object/eid/1-s2.0-S0926860X23000984-gr5.jpg?httpAccept=%2A%2F%2A",
            "@multimediatype": "JPEG image file",
            "@type": "IMAGE-DOWNSAMPLED",
            "@size": "27301",
            "@ref": "gr5",
            "@mimetype": "image/jpeg"
          },
          {
            "@category": "standard",
            "@height": "584",
            "@width": "658",
            "@_fa": "true",
            "$": "https://api.elsevier.com/content/object/eid/1-s2.0-S0926860X23000984-gr2.jpg?httpAccept=%2A%2F%2A",
            "@multimediatype": "JPEG image file",
            "@type": "IMAGE-DOWNSAMPLED",
            "@size": "52915",
            "@ref": "gr2",
            "@mimetype": "image/jpeg"
          },
          {
            "@category": "standard",
            "@height": "245",
            "@width": "255",
            "@_fa": "true",
            "$": "https://api.elsevier.com/content/object/eid/1-s2.0-S0926860X23000984-ga1.jpg?httpAccept=%2A%2F%2A",
            "@multimediatype": "JPEG image file",
            "@type": "IMAGE-DOWNSAMPLED",
            "@size": "18946",
            "@ref": "ga1",
            "@mimetype": "image/jpeg"
          },
          {
            "@category": "standard",
            "@height": "590",
            "@width": "658",
            "@_fa": "true",
            "$": "https://api.elsevier.com/content/object/eid/1-s2.0-S0926860X23000984-gr4.jpg?httpAccept=%2A%2F%2A",
            "@multimediatype": "JPEG image file",
            "@type": "IMAGE-DOWNSAMPLED",
            "@size": "43033",
            "@ref": "gr4",
            "@mimetype": "image/jpeg"
          },
          {
            "@category": "standard",
            "@height": "292",
            "@width": "564",
            "@_fa": "true",
            "$": "https://api.elsevier.com/content/object/eid/1-s2.0-S0926860X23000984-gr3.jpg?httpAccept=%2A%2F%2A",
            "@multimediatype": "JPEG image file",
            "@type": "IMAGE-DOWNSAMPLED",
            "@size": "28116",
            "@ref": "gr3",
            "@mimetype": "image/jpeg"
          },
          {
            "@category": "standard",
            "@height": "74",
            "@width": "78",
            "@_fa": "true",
            "$": "https://api.elsevier.com/content/object/eid/1-s2.0-S0926860X23000984-fx1.jpg?httpAccept=%2A%2F%2A",
            "@multimediatype": "JPEG image file",
            "@type": "IMAGE-DOWNSAMPLED",
            "@size": "1869",
            "@ref": "fx1",
            "@mimetype": "image/jpeg"
          },
          {
            "@category": "standard",
            "@height": "676",
            "@width": "758",
            "@_fa": "true",
            "$": "https://api.elsevier.com/content/object/eid/1-s2.0-S0926860X23000984-gr1b.jpg?httpAccept=%2A%2F%2A",
            "@multimediatype": "JPEG image file",
            "@type": "IMAGE-DOWNSAMPLED",
            "@size": "65338",
            "@ref": "gr1b",
            "@mimetype": "image/jpeg"
          },
          {
            "@category": "standard",
            "@height": "995",
            "@width": "752",
            "@_fa": "true",
            "$": "https://api.elsevier.com/content/object/eid/1-s2.0-S0926860X23000984-gr1a.jpg?httpAccept=%2A%2F%2A",
            "@multimediatype": "JPEG image file",
            "@type": "IMAGE-DOWNSAMPLED",
            "@size": "102170",
            "@ref": "gr1a",
            "@mimetype": "image/jpeg"
          },
          {
            "@category": "standard",
            "@height": "51",
            "@width": "186",
            "@_fa": "true",
            "$": "https://api.elsevier.com/content/object/eid/1-s2.0-S0926860X23000984-fx2.jpg?httpAccept=%2A%2F%2A",
            "@multimediatype": "JPEG image file",
            "@type": "IMAGE-DOWNSAMPLED",
            "@size": "2182",
            "@ref": "fx2",
            "@mimetype": "image/jpeg"
          },
          {
            "@category": "thumbnail",
            "@height": "114",
            "@width": "219",
            "@_fa": "true",
            "$": "https://api.elsevier.com/content/object/eid/1-s2.0-S0926860X23000984-gr5.sml?httpAccept=%2A%2F%2A",
            "@multimediatype": "GIF image file",
            "@type": "IMAGE-THUMBNAIL",
            "@size": "6536",
            "@ref": "gr5",
            "@mimetype": "image/gif"
          },
          {
            "@category": "thumbnail",
            "@height": "164",
            "@width": "185",
            "@_fa": "true",
            "$": "https://api.elsevier.com/content/object/eid/1-s2.0-S0926860X23000984-gr2.sml?httpAccept=%2A%2F%2A",
            "@multimediatype": "GIF image file",
            "@type": "IMAGE-THUMBNAIL",
            "@size": "6141",
            "@ref": "gr2",
            "@mimetype": "image/gif"
          },
          {
            "@category": "thumbnail",
            "@height": "164",
            "@width": "171",
            "@_fa": "true",
            "$": "https://api.elsevier.com/content/object/eid/1-s2.0-S0926860X23000984-ga1.sml?httpAccept=%2A%2F%2A",
            "@multimediatype": "GIF image file",
            "@type": "IMAGE-THUMBNAIL",
            "@size": "9745",
            "@ref": "ga1",
            "@mimetype": "image/gif"
          },
          {
            "@category": "thumbnail",
            "@height": "164",
            "@width": "183",
            "@_fa": "true",
            "$": "https://api.elsevier.com/content/object/eid/1-s2.0-S0926860X23000984-gr4.sml?httpAccept=%2A%2F%2A",
            "@multimediatype": "GIF image file",
            "@type": "IMAGE-THUMBNAIL",
            "@size": "6329",
            "@ref": "gr4",
            "@mimetype": "image/gif"
          },
          {
            "@category": "thumbnail",
            "@height": "114",
            "@width": "219",
            "@_fa": "true",
            "$": "https://api.elsevier.com/content/object/eid/1-s2.0-S0926860X23000984-gr3.sml?httpAccept=%2A%2F%2A",
            "@multimediatype": "GIF image file",
            "@type": "IMAGE-THUMBNAIL",
            "@size": "6561",
            "@ref": "gr3",
            "@mimetype": "image/gif"
          },
          {
            "@category": "thumbnail",
            "@height": "164",
            "@width": "173",
            "@_fa": "true",
            "$": "https://api.elsevier.com/content/object/eid/1-s2.0-S0926860X23000984-fx1.sml?httpAccept=%2A%2F%2A",
            "@multimediatype": "GIF image file",
            "@type": "IMAGE-THUMBNAIL",
            "@size": "4979",
            "@ref": "fx1",
            "@mimetype": "image/gif"
          },
          {
            "@category": "thumbnail",
            "@height": "164",
            "@width": "184",
            "@_fa": "true",
            "$": "https://api.elsevier.com/content/object/eid/1-s2.0-S0926860X23000984-gr1b.sml?httpAccept=%2A%2F%2A",
            "@multimediatype": "GIF image file",
            "@type": "IMAGE-THUMBNAIL",
            "@size": "4976",
            "@ref": "gr1b",
            "@mimetype": "image/gif"
          },
          {
            "@category": "thumbnail",
            "@height": "164",
            "@width": "124",
            "@_fa": "true",
            "$": "https://api.elsevier.com/content/object/eid/1-s2.0-S0926860X23000984-gr1a.sml?httpAccept=%2A%2F%2A",
            "@multimediatype": "GIF image file",
            "@type": "IMAGE-THUMBNAIL",
            "@size": "4050",
            "@ref": "gr1a",
            "@mimetype": "image/gif"
          },
          {
            "@category": "thumbnail",
            "@height": "60",
            "@width": "219",
            "@_fa": "true",
            "$": "https://api.elsevier.com/content/object/eid/1-s2.0-S0926860X23000984-fx2.sml?httpAccept=%2A%2F%2A",
            "@multimediatype": "GIF image file",
            "@type": "IMAGE-THUMBNAIL",
            "@size": "2260",
            "@ref": "fx2",
            "@mimetype": "image/gif"
          },
          {
            "@category": "high",
            "@height": "1303",
            "@width": "2498",
            "@_fa": "true",
            "$": "https://api.elsevier.com/content/object/eid/1-s2.0-S0926860X23000984-gr5_lrg.jpg?httpAccept=%2A%2F%2A",
            "@multimediatype": "JPEG image file",
            "@type": "IMAGE-HIGH-RES",
            "@size": "153216",
            "@ref": "gr5",
            "@mimetype": "image/jpeg"
          },
          {
            "@category": "high",
            "@height": "2581",
            "@width": "2910",
            "@_fa": "true",
            "$": "https://api.elsevier.com/content/object/eid/1-s2.0-S0926860X23000984-gr2_lrg.jpg?httpAccept=%2A%2F%2A",
            "@multimediatype": "JPEG image file",
            "@type": "IMAGE-HIGH-RES",
            "@size": "291462",
            "@ref": "gr2",
            "@mimetype": "image/jpeg"
          },
          {
            "@category": "high",
            "@height": "1085",
            "@width": "1130",
            "@_fa": "true",
            "$": "https://api.elsevier.com/content/object/eid/1-s2.0-S0926860X23000984-ga1_lrg.jpg?httpAccept=%2A%2F%2A",
            "@multimediatype": "JPEG image file",
            "@type": "IMAGE-HIGH-RES",
            "@size": "147255",
            "@ref": "ga1",
            "@mimetype": "image/jpeg"
          },
          {
            "@category": "high",
            "@height": "2611",
            "@width": "2910",
            "@_fa": "true",
            "$": "https://api.elsevier.com/content/object/eid/1-s2.0-S0926860X23000984-gr4_lrg.jpg?httpAccept=%2A%2F%2A",
            "@multimediatype": "JPEG image file",
            "@type": "IMAGE-HIGH-RES",
            "@size": "279920",
            "@ref": "gr4",
            "@mimetype": "image/jpeg"
          },
          {
            "@category": "high",
            "@height": "1295",
            "@width": "2498",
            "@_fa": "true",
            "$": "https://api.elsevier.com/content/object/eid/1-s2.0-S0926860X23000984-gr3_lrg.jpg?httpAccept=%2A%2F%2A",
            "@multimediatype": "JPEG image file",
            "@type": "IMAGE-HIGH-RES",
            "@size": "157279",
            "@ref": "gr3",
            "@mimetype": "image/jpeg"
          },
          {
            "@category": "high",
            "@height": "329",
            "@width": "347",
            "@_fa": "true",
            "$": "https://api.elsevier.com/content/object/eid/1-s2.0-S0926860X23000984-fx1_lrg.jpg?httpAccept=%2A%2F%2A",
            "@multimediatype": "JPEG image file",
            "@type": "IMAGE-HIGH-RES",
            "@size": "8504",
            "@ref": "fx1",
            "@mimetype": "image/jpeg"
          },
          {
            "@category": "high",
            "@height": "2986",
            "@width": "3348",
            "@_fa": "true",
            "$": "https://api.elsevier.com/content/object/eid/1-s2.0-S0926860X23000984-gr1b_lrg.jpg?httpAccept=%2A%2F%2A",
            "@multimediatype": "JPEG image file",
            "@type": "IMAGE-HIGH-RES",
            "@size": "393337",
            "@ref": "gr1b",
            "@mimetype": "image/jpeg"
          },
          {
            "@category": "high",
            "@height": "4407",
            "@width": "3331",
            "@_fa": "true",
            "$": "https://api.elsevier.com/content/object/eid/1-s2.0-S0926860X23000984-gr1a_lrg.jpg?httpAccept=%2A%2F%2A",
            "@multimediatype": "JPEG image file",
            "@type": "IMAGE-HIGH-RES",
            "@size": "619161",
            "@ref": "gr1a",
            "@mimetype": "image/jpeg"
          },
          {
            "@category": "high",
            "@height": "226",
            "@width": "825",
            "@_fa": "true",
            "$": "https://api.elsevier.com/content/object/eid/1-s2.0-S0926860X23000984-fx2_lrg.jpg?httpAccept=%2A%2F%2A",
            "@multimediatype": "JPEG image file",
            "@type": "IMAGE-HIGH-RES",
            "@size": "9355",
            "@ref": "fx2",
            "@mimetype": "image/jpeg"
          },
          {
            "@category": "thumbnail",
            "@_fa": "true",
            "$": "https://api.elsevier.com/content/object/eid/1-s2.0-S0926860X23000984-si0001.svg?httpAccept=%2A%2F%2A",
            "@multimediatype": "Scalable Vector Graphics file",
            "@type": "ALTIMG",
            "@size": "2694",
            "@ref": "si0001",
            "@mimetype": "image/svg+xml"
          },
          {
            "@category": "thumbnail",
            "@_fa": "true",
            "$": "https://api.elsevier.com/content/object/eid/1-s2.0-S0926860X23000984-si0002.svg?httpAccept=%2A%2F%2A",
            "@multimediatype": "Scalable Vector Graphics file",
            "@type": "ALTIMG",
            "@size": "2694",
            "@ref": "si0002",
            "@mimetype": "image/svg+xml"
          },
          {
            "@category": "thumbnail",
            "@_fa": "true",
            "$": "https://api.elsevier.com/content/object/eid/1-s2.0-S0926860X23000984-si0003.svg?httpAccept=%2A%2F%2A",
            "@multimediatype": "Scalable Vector Graphics file",
            "@type": "ALTIMG",
            "@size": "2998",
            "@ref": "si0003",
            "@mimetype": "image/svg+xml"
          },
          {
            "@category": "thumbnail",
            "@_fa": "true",
            "$": "https://api.elsevier.com/content/object/eid/1-s2.0-S0926860X23000984-si0004.svg?httpAccept=%2A%2F%2A",
            "@multimediatype": "Scalable Vector Graphics file",
            "@type": "ALTIMG",
            "@size": "2998",
            "@ref": "si0004",
            "@mimetype": "image/svg+xml"
          },
          {
            "@category": "thumbnail",
            "@_fa": "true",
            "$": "https://api.elsevier.com/content/object/eid/1-s2.0-S0926860X23000984-si0005.svg?httpAccept=%2A%2F%2A",
            "@multimediatype": "Scalable Vector Graphics file",
            "@type": "ALTIMG",
            "@size": "3164",
            "@ref": "si0005",
            "@mimetype": "image/svg+xml"
          },
          {
            "@category": "thumbnail",
            "@_fa": "true",
            "$": "https://api.elsevier.com/content/object/eid/1-s2.0-S0926860X23000984-si0006.svg?httpAccept=%2A%2F%2A",
            "@multimediatype": "Scalable Vector Graphics file",
            "@type": "ALTIMG",
            "@size": "3059",
            "@ref": "si0006",
            "@mimetype": "image/svg+xml"
          },
          {
            "@category": "thumbnail",
            "@_fa": "true",
            "$": "https://api.elsevier.com/content/object/eid/1-s2.0-S0926860X23000984-si0007.svg?httpAccept=%2A%2F%2A",
            "@multimediatype": "Scalable Vector Graphics file",
            "@type": "ALTIMG",
            "@size": "3756",
            "@ref": "si0007",
            "@mimetype": "image/svg+xml"
          },
          {
            "@category": "thumbnail",
            "@_fa": "true",
            "$": "https://api.elsevier.com/content/object/eid/1-s2.0-S0926860X23000984-si0008.svg?httpAccept=%2A%2F%2A",
            "@multimediatype": "Scalable Vector Graphics file",
            "@type": "ALTIMG",
            "@size": "4607",
            "@ref": "si0008",
            "@mimetype": "image/svg+xml"
          },
          {
            "@category": "thumbnail",
            "@_fa": "true",
            "$": "https://api.elsevier.com/content/object/eid/1-s2.0-S0926860X23000984-si0009.svg?httpAccept=%2A%2F%2A",
            "@multimediatype": "Scalable Vector Graphics file",
            "@type": "ALTIMG",
            "@size": "5580",
            "@ref": "si0009",
            "@mimetype": "image/svg+xml"
          },
          {
            "@category": "thumbnail",
            "@_fa": "true",
            "$": "https://api.elsevier.com/content/object/eid/1-s2.0-S0926860X23000984-si0010.svg?httpAccept=%2A%2F%2A",
            "@multimediatype": "Scalable Vector Graphics file",
            "@type": "ALTIMG",
            "@size": "2650",
            "@ref": "si0010",
            "@mimetype": "image/svg+xml"
          },
          {
            "@category": "thumbnail",
            "@_fa": "true",
            "$": "https://api.elsevier.com/content/object/eid/1-s2.0-S0926860X23000984-si0011.svg?httpAccept=%2A%2F%2A",
            "@multimediatype": "Scalable Vector Graphics file",
            "@type": "ALTIMG",
            "@size": "4915",
            "@ref": "si0011",
            "@mimetype": "image/svg+xml"
          },
          {
            "@category": "thumbnail",
            "@_fa": "true",
            "$": "https://api.elsevier.com/content/object/eid/1-s2.0-S0926860X23000984-si0012.svg?httpAccept=%2A%2F%2A",
            "@multimediatype": "Scalable Vector Graphics file",
            "@type": "ALTIMG",
            "@size": "3112",
            "@ref": "si0012",
            "@mimetype": "image/svg+xml"
          },
          {
            "@category": "thumbnail",
            "@_fa": "true",
            "$": "https://api.elsevier.com/content/object/eid/1-s2.0-S0926860X23000984-si0013.svg?httpAccept=%2A%2F%2A",
            "@multimediatype": "Scalable Vector Graphics file",
            "@type": "ALTIMG",
            "@size": "1693",
            "@ref": "si0013",
            "@mimetype": "image/svg+xml"
          },
          {
            "@category": "thumbnail",
            "@_fa": "true",
            "$": "https://api.elsevier.com/content/object/eid/1-s2.0-S0926860X23000984-si0014.svg?httpAccept=%2A%2F%2A",
            "@multimediatype": "Scalable Vector Graphics file",
            "@type": "ALTIMG",
            "@size": "2913",
            "@ref": "si0014",
            "@mimetype": "image/svg+xml"
          },
          {
            "@category": "thumbnail",
            "@_fa": "true",
            "$": "https://api.elsevier.com/content/object/eid/1-s2.0-S0926860X23000984-si0015.svg?httpAccept=%2A%2F%2A",
            "@multimediatype": "Scalable Vector Graphics file",
            "@type": "ALTIMG",
            "@size": "1916",
            "@ref": "si0015",
            "@mimetype": "image/svg+xml"
          },
          {
            "@category": "thumbnail",
            "@_fa": "true",
            "$": "https://api.elsevier.com/content/object/eid/1-s2.0-S0926860X23000984-si0016.svg?httpAccept=%2A%2F%2A",
            "@multimediatype": "Scalable Vector Graphics file",
            "@type": "ALTIMG",
            "@size": "3168",
            "@ref": "si0016",
            "@mimetype": "image/svg+xml"
          },
          {
            "@category": "thumbnail",
            "@_fa": "true",
            "$": "https://api.elsevier.com/content/object/eid/1-s2.0-S0926860X23000984-si0017.svg?httpAccept=%2A%2F%2A",
            "@multimediatype": "Scalable Vector Graphics file",
            "@type": "ALTIMG",
            "@size": "3112",
            "@ref": "si0017",
            "@mimetype": "image/svg+xml"
          },
          {
            "@category": "thumbnail",
            "@_fa": "true",
            "$": "https://api.elsevier.com/content/object/eid/1-s2.0-S0926860X23000984-si0018.svg?httpAccept=%2A%2F%2A",
            "@multimediatype": "Scalable Vector Graphics file",
            "@type": "ALTIMG",
            "@size": "2925",
            "@ref": "si0018",
            "@mimetype": "image/svg+xml"
          },
          {
            "@category": "thumbnail",
            "@_fa": "true",
            "$": "https://api.elsevier.com/content/object/eid/1-s2.0-S0926860X23000984-si0019.svg?httpAccept=%2A%2F%2A",
            "@multimediatype": "Scalable Vector Graphics file",
            "@type": "ALTIMG",
            "@size": "2200",
            "@ref": "si0019",
            "@mimetype": "image/svg+xml"
          },
          {
            "@category": "thumbnail",
            "@_fa": "true",
            "$": "https://api.elsevier.com/content/object/eid/1-s2.0-S0926860X23000984-si0020.svg?httpAccept=%2A%2F%2A",
            "@multimediatype": "Scalable Vector Graphics file",
            "@type": "ALTIMG",
            "@size": "1944",
            "@ref": "si0020",
            "@mimetype": "image/svg+xml"
          },
          {
            "@category": "thumbnail",
            "@_fa": "true",
            "$": "https://api.elsevier.com/content/object/eid/1-s2.0-S0926860X23000984-si0021.svg?httpAccept=%2A%2F%2A",
            "@multimediatype": "Scalable Vector Graphics file",
            "@type": "ALTIMG",
            "@size": "2179",
            "@ref": "si0021",
            "@mimetype": "image/svg+xml"
          },
          {
            "@category": "thumbnail",
            "@_fa": "true",
            "$": "https://api.elsevier.com/content/object/eid/1-s2.0-S0926860X23000984-si0022.svg?httpAccept=%2A%2F%2A",
            "@multimediatype": "Scalable Vector Graphics file",
            "@type": "ALTIMG",
            "@size": "1093",
            "@ref": "si0022",
            "@mimetype": "image/svg+xml"
          },
          {
            "@category": "thumbnail",
            "@_fa": "true",
            "$": "https://api.elsevier.com/content/object/eid/1-s2.0-S0926860X23000984-si0023.svg?httpAccept=%2A%2F%2A",
            "@multimediatype": "Scalable Vector Graphics file",
            "@type": "ALTIMG",
            "@size": "1150",
            "@ref": "si0023",
            "@mimetype": "image/svg+xml"
          },
          {
            "@category": "thumbnail",
            "@_fa": "true",
            "$": "https://api.elsevier.com/content/object/eid/1-s2.0-S0926860X23000984-si0024.svg?httpAccept=%2A%2F%2A",
            "@multimediatype": "Scalable Vector Graphics file",
            "@type": "ALTIMG",
            "@size": "1405",
            "@ref": "si0024",
            "@mimetype": "image/svg+xml"
          },
          {
            "@category": "thumbnail",
            "@_fa": "true",
            "$": "https://api.elsevier.com/content/object/eid/1-s2.0-S0926860X23000984-si0025.svg?httpAccept=%2A%2F%2A",
            "@multimediatype": "Scalable Vector Graphics file",
            "@type": "ALTIMG",
            "@size": "2179",
            "@ref": "si0025",
            "@mimetype": "image/svg+xml"
          },
          {
            "@category": "thumbnail",
            "@_fa": "true",
            "$": "https://api.elsevier.com/content/object/eid/1-s2.0-S0926860X23000984-si0026.svg?httpAccept=%2A%2F%2A",
            "@multimediatype": "Scalable Vector Graphics file",
            "@type": "ALTIMG",
            "@size": "2159",
            "@ref": "si0026",
            "@mimetype": "image/svg+xml"
          },
          {
            "@category": "thumbnail",
            "@_fa": "true",
            "$": "https://api.elsevier.com/content/object/eid/1-s2.0-S0926860X23000984-si0027.svg?httpAccept=%2A%2F%2A",
            "@multimediatype": "Scalable Vector Graphics file",
            "@type": "ALTIMG",
            "@size": "948",
            "@ref": "si0027",
            "@mimetype": "image/svg+xml"
          },
          {
            "@category": "thumbnail",
            "@_fa": "true",
            "$": "https://api.elsevier.com/content/object/eid/1-s2.0-S0926860X23000984-si0028.svg?httpAccept=%2A%2F%2A",
            "@multimediatype": "Scalable Vector Graphics file",
            "@type": "ALTIMG",
            "@size": "1053",
            "@ref": "si0028",
            "@mimetype": "image/svg+xml"
          },
          {
            "@category": "thumbnail",
            "@_fa": "true",
            "$": "https://api.elsevier.com/content/object/eid/1-s2.0-S0926860X23000984-si0029.svg?httpAccept=%2A%2F%2A",
            "@multimediatype": "Scalable Vector Graphics file",
            "@type": "ALTIMG",
            "@size": "1061",
            "@ref": "si0029",
            "@mimetype": "image/svg+xml"
          },
          {
            "@category": "thumbnail",
            "@_fa": "true",
            "$": "https://api.elsevier.com/content/object/eid/1-s2.0-S0926860X23000984-si0030.svg?httpAccept=%2A%2F%2A",
            "@multimediatype": "Scalable Vector Graphics file",
            "@type": "ALTIMG",
            "@size": "1195",
            "@ref": "si0030",
            "@mimetype": "image/svg+xml"
          },
          {
            "@category": "thumbnail",
            "@_fa": "true",
            "$": "https://api.elsevier.com/content/object/eid/1-s2.0-S0926860X23000984-si0031.svg?httpAccept=%2A%2F%2A",
            "@multimediatype": "Scalable Vector Graphics file",
            "@type": "ALTIMG",
            "@size": "1418",
            "@ref": "si0031",
            "@mimetype": "image/svg+xml"
          },
          {
            "@category": "thumbnail",
            "@_fa": "true",
            "$": "https://api.elsevier.com/content/object/eid/1-s2.0-S0926860X23000984-si0032.svg?httpAccept=%2A%2F%2A",
            "@multimediatype": "Scalable Vector Graphics file",
            "@type": "ALTIMG",
            "@size": "1296",
            "@ref": "si0032",
            "@mimetype": "image/svg+xml"
          },
          {
            "@category": "thumbnail",
            "@_fa": "true",
            "$": "https://api.elsevier.com/content/object/eid/1-s2.0-S0926860X23000984-si0033.svg?httpAccept=%2A%2F%2A",
            "@multimediatype": "Scalable Vector Graphics file",
            "@type": "ALTIMG",
            "@size": "1130",
            "@ref": "si0033",
            "@mimetype": "image/svg+xml"
          },
          {
            "@category": "thumbnail",
            "@_fa": "true",
            "$": "https://api.elsevier.com/content/object/eid/1-s2.0-S0926860X23000984-si0034.svg?httpAccept=%2A%2F%2A",
            "@multimediatype": "Scalable Vector Graphics file",
            "@type": "ALTIMG",
            "@size": "1065",
            "@ref": "si0034",
            "@mimetype": "image/svg+xml"
          },
          {
            "@category": "thumbnail",
            "@_fa": "true",
            "$": "https://api.elsevier.com/content/object/eid/1-s2.0-S0926860X23000984-si0035.svg?httpAccept=%2A%2F%2A",
            "@multimediatype": "Scalable Vector Graphics file",
            "@type": "ALTIMG",
            "@size": "1588",
            "@ref": "si0035",
            "@mimetype": "image/svg+xml"
          },
          {
            "@category": "thumbnail",
            "@_fa": "true",
            "$": "https://api.elsevier.com/content/object/eid/1-s2.0-S0926860X23000984-si0036.svg?httpAccept=%2A%2F%2A",
            "@multimediatype": "Scalable Vector Graphics file",
            "@type": "ALTIMG",
            "@size": "1357",
            "@ref": "si0036",
            "@mimetype": "image/svg+xml"
          },
          {
            "@category": "thumbnail",
            "@_fa": "true",
            "$": "https://api.elsevier.com/content/object/eid/1-s2.0-S0926860X23000984-si0037.svg?httpAccept=%2A%2F%2A",
            "@multimediatype": "Scalable Vector Graphics file",
            "@type": "ALTIMG",
            "@size": "1025",
            "@ref": "si0037",
            "@mimetype": "image/svg+xml"
          },
          {
            "@category": "thumbnail",
            "@_fa": "true",
            "$": "https://api.elsevier.com/content/object/eid/1-s2.0-S0926860X23000984-si0038.svg?httpAccept=%2A%2F%2A",
            "@multimediatype": "Scalable Vector Graphics file",
            "@type": "ALTIMG",
            "@size": "2289",
            "@ref": "si0038",
            "@mimetype": "image/svg+xml"
          },
          {
            "@category": "thumbnail",
            "@_fa": "true",
            "$": "https://api.elsevier.com/content/object/eid/1-s2.0-S0926860X23000984-si0039.svg?httpAccept=%2A%2F%2A",
            "@multimediatype": "Scalable Vector Graphics file",
            "@type": "ALTIMG",
            "@size": "2731",
            "@ref": "si0039",
            "@mimetype": "image/svg+xml"
          },
          {
            "@category": "thumbnail",
            "@_fa": "true",
            "$": "https://api.elsevier.com/content/object/eid/1-s2.0-S0926860X23000984-si0040.svg?httpAccept=%2A%2F%2A",
            "@multimediatype": "Scalable Vector Graphics file",
            "@type": "ALTIMG",
            "@size": "2905",
            "@ref": "si0040",
            "@mimetype": "image/svg+xml"
          },
          {
            "@category": "thumbnail",
            "@_fa": "true",
            "$": "https://api.elsevier.com/content/object/eid/1-s2.0-S0926860X23000984-si0041.svg?httpAccept=%2A%2F%2A",
            "@multimediatype": "Scalable Vector Graphics file",
            "@type": "ALTIMG",
            "@size": "3209",
            "@ref": "si0041",
            "@mimetype": "image/svg+xml"
          },
          {
            "@category": "thumbnail",
            "@_fa": "true",
            "$": "https://api.elsevier.com/content/object/eid/1-s2.0-S0926860X23000984-si0042.svg?httpAccept=%2A%2F%2A",
            "@multimediatype": "Scalable Vector Graphics file",
            "@type": "ALTIMG",
            "@size": "2868",
            "@ref": "si0042",
            "@mimetype": "image/svg+xml"
          },
          {
            "@category": "thumbnail",
            "@_fa": "true",
            "$": "https://api.elsevier.com/content/object/eid/1-s2.0-S0926860X23000984-si0043.svg?httpAccept=%2A%2F%2A",
            "@multimediatype": "Scalable Vector Graphics file",
            "@type": "ALTIMG",
            "@size": "2483",
            "@ref": "si0043",
            "@mimetype": "image/svg+xml"
          },
          {
            "@category": "thumbnail",
            "@_fa": "true",
            "$": "https://api.elsevier.com/content/object/eid/1-s2.0-S0926860X23000984-si0044.svg?httpAccept=%2A%2F%2A",
            "@multimediatype": "Scalable Vector Graphics file",
            "@type": "ALTIMG",
            "@size": "2297",
            "@ref": "si0044",
            "@mimetype": "image/svg+xml"
          },
          {
            "@category": "thumbnail",
            "@_fa": "true",
            "$": "https://api.elsevier.com/content/object/eid/1-s2.0-S0926860X23000984-si0045.svg?httpAccept=%2A%2F%2A",
            "@multimediatype": "Scalable Vector Graphics file",
            "@type": "ALTIMG",
            "@size": "2200",
            "@ref": "si0045",
            "@mimetype": "image/svg+xml"
          },
          {
            "@category": "thumbnail",
            "@_fa": "true",
            "$": "https://api.elsevier.com/content/object/eid/1-s2.0-S0926860X23000984-si0046.svg?httpAccept=%2A%2F%2A",
            "@multimediatype": "Scalable Vector Graphics file",
            "@type": "ALTIMG",
            "@size": "2317",
            "@ref": "si0046",
            "@mimetype": "image/svg+xml"
          },
          {
            "@category": "thumbnail",
            "@_fa": "true",
            "$": "https://api.elsevier.com/content/object/eid/1-s2.0-S0926860X23000984-si0047.svg?httpAccept=%2A%2F%2A",
            "@multimediatype": "Scalable Vector Graphics file",
            "@type": "ALTIMG",
            "@size": "3817",
            "@ref": "si0047",
            "@mimetype": "image/svg+xml"
          },
          {
            "@category": "thumbnail",
            "@_fa": "true",
            "$": "https://api.elsevier.com/content/object/eid/1-s2.0-S0926860X23000984-si0048.svg?httpAccept=%2A%2F%2A",
            "@multimediatype": "Scalable Vector Graphics file",
            "@type": "ALTIMG",
            "@size": "2467",
            "@ref": "si0048",
            "@mimetype": "image/svg+xml"
          },
          {
            "@category": "thumbnail",
            "@_fa": "true",
            "$": "https://api.elsevier.com/content/object/eid/1-s2.0-S0926860X23000984-si0049.svg?httpAccept=%2A%2F%2A",
            "@multimediatype": "Scalable Vector Graphics file",
            "@type": "ALTIMG",
            "@size": "2994",
            "@ref": "si0049",
            "@mimetype": "image/svg+xml"
          },
          {
            "@category": "thumbnail",
            "@_fa": "true",
            "$": "https://api.elsevier.com/content/object/eid/1-s2.0-S0926860X23000984-si0050.svg?httpAccept=%2A%2F%2A",
            "@multimediatype": "Scalable Vector Graphics file",
            "@type": "ALTIMG",
            "@size": "1746",
            "@ref": "si0050",
            "@mimetype": "image/svg+xml"
          },
          {
            "@category": "thumbnail",
            "@_fa": "true",
            "$": "https://api.elsevier.com/content/object/eid/1-s2.0-S0926860X23000984-si0051.svg?httpAccept=%2A%2F%2A",
            "@multimediatype": "Scalable Vector Graphics file",
            "@type": "ALTIMG",
            "@size": "1487",
            "@ref": "si0051",
            "@mimetype": "image/svg+xml"
          },
          {
            "@category": "thumbnail",
            "@_fa": "true",
            "$": "https://api.elsevier.com/content/object/eid/1-s2.0-S0926860X23000984-si0052.svg?httpAccept=%2A%2F%2A",
            "@multimediatype": "Scalable Vector Graphics file",
            "@type": "ALTIMG",
            "@size": "2877",
            "@ref": "si0052",
            "@mimetype": "image/svg+xml"
          },
          {
            "@category": "thumbnail",
            "@_fa": "true",
            "$": "https://api.elsevier.com/content/object/eid/1-s2.0-S0926860X23000984-si0053.svg?httpAccept=%2A%2F%2A",
            "@multimediatype": "Scalable Vector Graphics file",
            "@type": "ALTIMG",
            "@size": "2925",
            "@ref": "si0053",
            "@mimetype": "image/svg+xml"
          },
          {
            "@category": "standard",
            "@_fa": "true",
            "$": "https://api.elsevier.com/content/object/eid/1-s2.0-S0926860X23000984-am.pdf?httpAccept=%2A%2F%2A",
            "@multimediatype": "Acrobat PDF file",
            "@type": "AAM-PDF",
            "@size": "1946316",
            "@ref": "am",
            "@mimetype": "application/pdf"
          }
        ]
      },
      "link": {
        "@rel": "abstract",
        "@href": "https://api.elsevier.com/content/abstract/scopus_id/85151393253"
      }
    }
  }
}