{
  "metadata": {
    "title": "La effect on the long-term durability of Ni-Mg-Al<ce:inf loc=post>2</ce:inf>O<ce:inf loc=post>3</ce:inf> catalysts for syngas methanation",
    "authors": "; ; ",
    "journal": "Applied Catalysis A: General",
    "date": "2017-01-25",
    "doi": "10.1016/j.apcata.2016.11.002",
    "abstract": "",
    "uri": "https://api.elsevier.com/content/article/pii/S0926860X16305415",
    "pii": "S0926860X16305415"
  },
  "fulltext": {
    "full-text-retrieval-response": {
      "scopus-eid": "2-s2.0-84998879936",
      "originalText": "serial JL 271346 291210 291744 291809 31 Applied Catalysis A: General APPLIEDCATALYSISAGENERAL 2016-11-16 2016-11-16 2016-11-29 2016-11-29 2017-12-01T13:08:10 1-s2.0-S0926860X16305415 S0926-860X(16)30541-5 S0926860X16305415 10.1016/j.apcata.2016.11.002 S300 S300.2 FULL-TEXT 1-s2.0-S0926860X16X0018X 2025-07-16T14:33:53.326206Z 0 0 20170125 2017 2016-11-16T21:20:32.89807Z absattachment articleinfo articletitlenorm authfirstinitialnorm authfirstsurnamenorm cid cids contenttype copyright crossmark dateloaded dateloadedtxt datesearch datesort dateupdated dco docsubtype doctype doi eid ewtransactionid hubeid indexeddate issn issnnorm itemstage itemtransactionid itemweight openaccess openarchive pg pgfirst pglast pii piinorm pubdatestart pubdatetxt pubyr sortorder srctitle srctitlenorm srctype ssids alllist content subj subheadings suppl tomb volfirst volissue volumelist webpdf webpdfpagecount yearnav figure table body mmlmath acknowledge affil articletitle auth authfirstini authfull authkeywords authlast grantnumber grantsponsor highlightsabst primabst ref specialabst 0926-860X 0926860X true 530 530 C Volume 530 22 184 192 184 192 20170125 25 January 2017 2017-01-25 2017 article fla © 2016 Elsevier B.V. All rights reserved. LAEFFECTLONGTERMDURABILITYNIMGAL2O3CATALYSTSFORSYNGASMETHANATION SONG K 1 Introduction 2 Experimental 2.1 Catalysts preparation 2.2 Catalyst characterization 2.3 Reaction tests 3 Results and discussion 3.1 La effect for fresh catalysts 3.2 La effect for aged catalysts 4 Conclusion Acknowledgements References KOPYSCINSKI 2010 1763 J MONDAL 2011 1395 P KARELLAS 2012 183 S HOHLEIN 1981 125 B MILLS 1974 159 G VANVEEN 1978 143 G HWANG 2012 243 S GAO 2015 22759 J EREKSON 1981 91 E ROSTRUPNIELSEN 2007 134 J BAI 2014 437 X MACIVER 1963 485 D ARAI 1996 161 H CAI 2003 224104 S SCHAPER 1983 211 H OUDET 1988 112 F BEGUIN 1991 119 B OZAWA 1996 564 M ALVAREZ 1997 73 L TADANAGA 1998 230 K YAMAMOTO 2001 634 T CHEN 2001 159 X YAMAMOTO 2003 4830 T OZAWA 2004 397 M BARRERA 2007 640 A NISHIO 2009 546 Y ALPHONSE 2014 191 P GELSTHORPE 1984 253 M LANSINKROTGERINK 1988 239 H LANSINKROTGERINK 1988 257 H LANSINKROTGERINK 1988 281 H ZNAK 2005 65 L INUI 1979 p1495 T SCHAPER 1985 371 H HOU 2003 233 Y HOU 2004 35 Y ZHANG 2005 87 J NATESAKHAWAT 2005 133 S SANCHEZSANCHEZ 2007 336 M ROH 2008 239 H IRIONDO 2008 46 A LIU 2003 267 Z MARTINEZ 2004 139 R ZHAO 2011 p A KATHIRASER 2013 8120 Y SLAGTERN 1997 379 A PARK 2011 320 N HU 2012 4875 D STUCKLESS 1993 2202 J BARTHOLOMEW 1980 390 C MAZUMDER 2014 100 J XIE 1984 549 Y BETTMAN 1989 447 M ZIELINSKI 1982 157 J LI 1995 457 C PARMALIANA 1990 2663 A ANJANEYULU 2015 3633 C ZHANG 1992 p497 L CUI 2007 60 Y BERGERET 2008 G HANDBOOKHETEROGENEOUSCATALYSIS PARTICLESIZEDISPERSIONMEASUREMENTS GEYER 2012 160 R ZHANG 2008 121 J HAACK 1992 199 L WAGNER 1979 C HANDBOOKXRAYPHOTOELECTRONSPECTROSCOPYAREFERENCEBOOKSTANDARDDATAFORUSEINXRAYPHOTOELECTRONSPECTROSCOPY ALVERO 1987 45 R LEDFORD 1989 6770 J MICKEVICIUS 2006 107 S LUCREDIO 2010 77 A NATESAKHAWAT 2005 496 S TAUSTER 1978 170 S SPENCER 1985 216 M FLEISCH 1984 398 T HICKS 1984 498 R HICKS 1985 104 R DULUB 2000 3646 O TADA 2014 16 S CHOU 1995 53 T RIECK 1986 278 J FUJITA 1991 1146 S ANDERSSON 2008 6 M BARTHOLOMEW 2001 17 C BREY 1949 3637 W SCHAPER 1984 129 H ALPHONSE 2014 191 P KNOZINGER 1978 31 H SONGX2017X184 SONGX2017X184X192 SONGX2017X184XK SONGX2017X184X192XK 2018-11-29T00:00:00.000Z http://creativecommons.org/licenses/by-nc-nd/4.0/ © 2016 Elsevier B.V. All rights reserved. item S0926-860X(16)30541-5 S0926860X16305415 1-s2.0-S0926860X16305415 10.1016/j.apcata.2016.11.002 271346 2024-01-01T12:31:47.592716Z 2017-01-25 1-s2.0-S0926860X16305415-main.pdf https://s3-eu-west-1.amazonaws.com/prod-ucs-content-store-eu-west/content/pii:S0926860X16305415/MAIN/application/pdf/05b1918f1abbb23f6a8653234f08520a/main.pdf https://s3.amazonaws.com/prod-ucs-content-store-us-east/content/pii:S0926860X16305415/MAIN/application/pdf/05b1918f1abbb23f6a8653234f08520a/main.pdf main.pdf pdf true 1493692 MAIN 9 1-s2.0-S0926860X16305415-main_1.png https://s3-eu-west-1.amazonaws.com/prod-ucs-content-store-eu-west/content/pii:S0926860X16305415/PREVIEW/image/png/a2ccb8d1ac1ebd21429d184808e13fc1/main_1.png https://s3.amazonaws.com/prod-ucs-content-store-us-east/content/pii:S0926860X16305415/PREVIEW/image/png/a2ccb8d1ac1ebd21429d184808e13fc1/main_1.png main_1.png png 56394 849 656 IMAGE-WEB-PDF 1 1-s2.0-S0926860X16305415-fx1.sml https://s3-eu-west-1.amazonaws.com/prod-ucs-content-store-eu-west/content/pii:S0926860X16305415/fx1/THUMBNAIL/image/gif/30b2050ee7eb37025a4fcd251b8ce8f5/fx1.sml https://s3.amazonaws.com/prod-ucs-content-store-us-east/content/pii:S0926860X16305415/fx1/THUMBNAIL/image/gif/30b2050ee7eb37025a4fcd251b8ce8f5/fx1.sml fx1 true fx1.sml sml 12837 164 201 IMAGE-THUMBNAIL 1-s2.0-S0926860X16305415-gr1.sml https://s3-eu-west-1.amazonaws.com/prod-ucs-content-store-eu-west/content/pii:S0926860X16305415/gr1/THUMBNAIL/image/gif/18d11ac064804ce562d4ac089b3b2bdd/gr1.sml https://s3.amazonaws.com/prod-ucs-content-store-us-east/content/pii:S0926860X16305415/gr1/THUMBNAIL/image/gif/18d11ac064804ce562d4ac089b3b2bdd/gr1.sml gr1 gr1.sml sml 8007 163 197 IMAGE-THUMBNAIL 1-s2.0-S0926860X16305415-gr2.sml https://s3-eu-west-1.amazonaws.com/prod-ucs-content-store-eu-west/content/pii:S0926860X16305415/gr2/THUMBNAIL/image/gif/01e1287bf1fd5513f72f6144578ac74a/gr2.sml https://s3.amazonaws.com/prod-ucs-content-store-us-east/content/pii:S0926860X16305415/gr2/THUMBNAIL/image/gif/01e1287bf1fd5513f72f6144578ac74a/gr2.sml gr2 gr2.sml sml 5369 164 208 IMAGE-THUMBNAIL 1-s2.0-S0926860X16305415-gr3.sml https://s3-eu-west-1.amazonaws.com/prod-ucs-content-store-eu-west/content/pii:S0926860X16305415/gr3/THUMBNAIL/image/gif/b202de8b0988b855c2b239d4ba583cbf/gr3.sml https://s3.amazonaws.com/prod-ucs-content-store-us-east/content/pii:S0926860X16305415/gr3/THUMBNAIL/image/gif/b202de8b0988b855c2b239d4ba583cbf/gr3.sml gr3 gr3.sml sml 5111 136 219 IMAGE-THUMBNAIL 1-s2.0-S0926860X16305415-gr4.sml https://s3-eu-west-1.amazonaws.com/prod-ucs-content-store-eu-west/content/pii:S0926860X16305415/gr4/THUMBNAIL/image/gif/53f49b1270cff31ccee3b19999f6ef8d/gr4.sml https://s3.amazonaws.com/prod-ucs-content-store-us-east/content/pii:S0926860X16305415/gr4/THUMBNAIL/image/gif/53f49b1270cff31ccee3b19999f6ef8d/gr4.sml gr4 gr4.sml sml 5050 163 131 IMAGE-THUMBNAIL 1-s2.0-S0926860X16305415-gr5.sml https://s3-eu-west-1.amazonaws.com/prod-ucs-content-store-eu-west/content/pii:S0926860X16305415/gr5/THUMBNAIL/image/gif/c1b1c2089c8fb89115315afc88b52541/gr5.sml https://s3.amazonaws.com/prod-ucs-content-store-us-east/content/pii:S0926860X16305415/gr5/THUMBNAIL/image/gif/c1b1c2089c8fb89115315afc88b52541/gr5.sml gr5 gr5.sml sml 4846 89 219 IMAGE-THUMBNAIL 1-s2.0-S0926860X16305415-gr6.sml https://s3-eu-west-1.amazonaws.com/prod-ucs-content-store-eu-west/content/pii:S0926860X16305415/gr6/THUMBNAIL/image/gif/9e8ee8b760b8d18a8a00e1f8a97487de/gr6.sml https://s3.amazonaws.com/prod-ucs-content-store-us-east/content/pii:S0926860X16305415/gr6/THUMBNAIL/image/gif/9e8ee8b760b8d18a8a00e1f8a97487de/gr6.sml gr6 gr6.sml sml 11629 163 219 IMAGE-THUMBNAIL 1-s2.0-S0926860X16305415-gr7.sml https://s3-eu-west-1.amazonaws.com/prod-ucs-content-store-eu-west/content/pii:S0926860X16305415/gr7/THUMBNAIL/image/gif/67b5730c7bdec10479e2ec6552a2f00f/gr7.sml https://s3.amazonaws.com/prod-ucs-content-store-us-east/content/pii:S0926860X16305415/gr7/THUMBNAIL/image/gif/67b5730c7bdec10479e2ec6552a2f00f/gr7.sml gr7 gr7.sml sml 3638 164 197 IMAGE-THUMBNAIL 1-s2.0-S0926860X16305415-fx1.jpg https://s3-eu-west-1.amazonaws.com/prod-ucs-content-store-eu-west/content/pii:S0926860X16305415/fx1/DOWNSAMPLED/image/jpeg/9291bee57638cfe11f0b235889d6c655/fx1.jpg https://s3.amazonaws.com/prod-ucs-content-store-us-east/content/pii:S0926860X16305415/fx1/DOWNSAMPLED/image/jpeg/9291bee57638cfe11f0b235889d6c655/fx1.jpg fx1 true fx1.jpg jpg 21194 245 301 IMAGE-DOWNSAMPLED 1-s2.0-S0926860X16305415-gr1.jpg https://s3-eu-west-1.amazonaws.com/prod-ucs-content-store-eu-west/content/pii:S0926860X16305415/gr1/DOWNSAMPLED/image/jpeg/91934cc12f9494efbf7cb01139b5069a/gr1.jpg https://s3.amazonaws.com/prod-ucs-content-store-us-east/content/pii:S0926860X16305415/gr1/DOWNSAMPLED/image/jpeg/91934cc12f9494efbf7cb01139b5069a/gr1.jpg gr1 gr1.jpg jpg 32459 320 386 IMAGE-DOWNSAMPLED 1-s2.0-S0926860X16305415-gr2.jpg https://s3-eu-west-1.amazonaws.com/prod-ucs-content-store-eu-west/content/pii:S0926860X16305415/gr2/DOWNSAMPLED/image/jpeg/fd774acd159a60b77bee942a526f2200/gr2.jpg https://s3.amazonaws.com/prod-ucs-content-store-us-east/content/pii:S0926860X16305415/gr2/DOWNSAMPLED/image/jpeg/fd774acd159a60b77bee942a526f2200/gr2.jpg gr2 gr2.jpg jpg 23292 304 386 IMAGE-DOWNSAMPLED 1-s2.0-S0926860X16305415-gr3.jpg https://s3-eu-west-1.amazonaws.com/prod-ucs-content-store-eu-west/content/pii:S0926860X16305415/gr3/DOWNSAMPLED/image/jpeg/85ad9610d683514135b761652c7b6049/gr3.jpg https://s3.amazonaws.com/prod-ucs-content-store-us-east/content/pii:S0926860X16305415/gr3/DOWNSAMPLED/image/jpeg/85ad9610d683514135b761652c7b6049/gr3.jpg gr3 gr3.jpg jpg 33851 328 527 IMAGE-DOWNSAMPLED 1-s2.0-S0926860X16305415-gr4.jpg https://s3-eu-west-1.amazonaws.com/prod-ucs-content-store-eu-west/content/pii:S0926860X16305415/gr4/DOWNSAMPLED/image/jpeg/16a7c31946ad746c14db3475aa0ea3da/gr4.jpg https://s3.amazonaws.com/prod-ucs-content-store-us-east/content/pii:S0926860X16305415/gr4/DOWNSAMPLED/image/jpeg/16a7c31946ad746c14db3475aa0ea3da/gr4.jpg gr4 gr4.jpg jpg 60138 705 565 IMAGE-DOWNSAMPLED 1-s2.0-S0926860X16305415-gr5.jpg https://s3-eu-west-1.amazonaws.com/prod-ucs-content-store-eu-west/content/pii:S0926860X16305415/gr5/DOWNSAMPLED/image/jpeg/51b40f080bed51d70f69791c807df14d/gr5.jpg https://s3.amazonaws.com/prod-ucs-content-store-us-east/content/pii:S0926860X16305415/gr5/DOWNSAMPLED/image/jpeg/51b40f080bed51d70f69791c807df14d/gr5.jpg gr5 gr5.jpg jpg 35601 244 602 IMAGE-DOWNSAMPLED 1-s2.0-S0926860X16305415-gr6.jpg https://s3-eu-west-1.amazonaws.com/prod-ucs-content-store-eu-west/content/pii:S0926860X16305415/gr6/DOWNSAMPLED/image/jpeg/67d7b779373d172761fd2f9ee7b621b1/gr6.jpg https://s3.amazonaws.com/prod-ucs-content-store-us-east/content/pii:S0926860X16305415/gr6/DOWNSAMPLED/image/jpeg/67d7b779373d172761fd2f9ee7b621b1/gr6.jpg gr6 gr6.jpg jpg 40490 364 489 IMAGE-DOWNSAMPLED 1-s2.0-S0926860X16305415-gr7.jpg https://s3-eu-west-1.amazonaws.com/prod-ucs-content-store-eu-west/content/pii:S0926860X16305415/gr7/DOWNSAMPLED/image/jpeg/5d9fc7fd88530450caf6dde77b93cc0d/gr7.jpg https://s3.amazonaws.com/prod-ucs-content-store-us-east/content/pii:S0926860X16305415/gr7/DOWNSAMPLED/image/jpeg/5d9fc7fd88530450caf6dde77b93cc0d/gr7.jpg gr7 gr7.jpg jpg 14586 322 386 IMAGE-DOWNSAMPLED 1-s2.0-S0926860X16305415-fx1_lrg.jpg https://s3-eu-west-1.amazonaws.com/prod-ucs-content-store-eu-west/content/pii:S0926860X16305415/fx1/HIGHRES/image/jpeg/556100e382e2a729c586a8895f3c4126/fx1_lrg.jpg https://s3.amazonaws.com/prod-ucs-content-store-us-east/content/pii:S0926860X16305415/fx1/HIGHRES/image/jpeg/556100e382e2a729c586a8895f3c4126/fx1_lrg.jpg fx1 true fx1_lrg.jpg jpg 150960 1085 1333 IMAGE-HIGH-RES 1-s2.0-S0926860X16305415-gr1_lrg.jpg https://s3-eu-west-1.amazonaws.com/prod-ucs-content-store-eu-west/content/pii:S0926860X16305415/gr1/HIGHRES/image/jpeg/1f4ad86f414286ad3429f83e2f7df38e/gr1_lrg.jpg https://s3.amazonaws.com/prod-ucs-content-store-us-east/content/pii:S0926860X16305415/gr1/HIGHRES/image/jpeg/1f4ad86f414286ad3429f83e2f7df38e/gr1_lrg.jpg gr1 gr1_lrg.jpg jpg 280677 1417 1708 IMAGE-HIGH-RES 1-s2.0-S0926860X16305415-gr2_lrg.jpg https://s3-eu-west-1.amazonaws.com/prod-ucs-content-store-eu-west/content/pii:S0926860X16305415/gr2/HIGHRES/image/jpeg/d22df988f7749991a92bdcff417ef1b2/gr2_lrg.jpg https://s3.amazonaws.com/prod-ucs-content-store-us-east/content/pii:S0926860X16305415/gr2/HIGHRES/image/jpeg/d22df988f7749991a92bdcff417ef1b2/gr2_lrg.jpg gr2 gr2_lrg.jpg jpg 166032 1347 1708 IMAGE-HIGH-RES 1-s2.0-S0926860X16305415-gr3_lrg.jpg https://s3-eu-west-1.amazonaws.com/prod-ucs-content-store-eu-west/content/pii:S0926860X16305415/gr3/HIGHRES/image/jpeg/057f9e0f57be665ead23ea4fd11ecf46/gr3_lrg.jpg https://s3.amazonaws.com/prod-ucs-content-store-us-east/content/pii:S0926860X16305415/gr3/HIGHRES/image/jpeg/057f9e0f57be665ead23ea4fd11ecf46/gr3_lrg.jpg gr3 gr3_lrg.jpg jpg 251907 1451 2333 IMAGE-HIGH-RES 1-s2.0-S0926860X16305415-gr4_lrg.jpg https://s3-eu-west-1.amazonaws.com/prod-ucs-content-store-eu-west/content/pii:S0926860X16305415/gr4/HIGHRES/image/jpeg/88c006129840f6dcbc403db7a9444574/gr4_lrg.jpg https://s3.amazonaws.com/prod-ucs-content-store-us-east/content/pii:S0926860X16305415/gr4/HIGHRES/image/jpeg/88c006129840f6dcbc403db7a9444574/gr4_lrg.jpg gr4 gr4_lrg.jpg jpg 521918 3118 2500 IMAGE-HIGH-RES 1-s2.0-S0926860X16305415-gr5_lrg.jpg https://s3-eu-west-1.amazonaws.com/prod-ucs-content-store-eu-west/content/pii:S0926860X16305415/gr5/HIGHRES/image/jpeg/51af98597818ab2a8cedc81c9943981e/gr5_lrg.jpg https://s3.amazonaws.com/prod-ucs-content-store-us-east/content/pii:S0926860X16305415/gr5/HIGHRES/image/jpeg/51af98597818ab2a8cedc81c9943981e/gr5_lrg.jpg gr5 gr5_lrg.jpg jpg 289410 1083 2667 IMAGE-HIGH-RES 1-s2.0-S0926860X16305415-gr6_lrg.jpg https://s3-eu-west-1.amazonaws.com/prod-ucs-content-store-eu-west/content/pii:S0926860X16305415/gr6/HIGHRES/image/jpeg/c35d67625940b6910fcf2459a76f701b/gr6_lrg.jpg https://s3.amazonaws.com/prod-ucs-content-store-us-east/content/pii:S0926860X16305415/gr6/HIGHRES/image/jpeg/c35d67625940b6910fcf2459a76f701b/gr6_lrg.jpg gr6 gr6_lrg.jpg jpg 297825 1611 2167 IMAGE-HIGH-RES 1-s2.0-S0926860X16305415-gr7_lrg.jpg https://s3-eu-west-1.amazonaws.com/prod-ucs-content-store-eu-west/content/pii:S0926860X16305415/gr7/HIGHRES/image/jpeg/748123c847853eeb101bd4b9c777c103/gr7_lrg.jpg https://s3.amazonaws.com/prod-ucs-content-store-us-east/content/pii:S0926860X16305415/gr7/HIGHRES/image/jpeg/748123c847853eeb101bd4b9c777c103/gr7_lrg.jpg gr7 gr7_lrg.jpg jpg 96841 1424 1708 IMAGE-HIGH-RES 1-s2.0-S0926860X16305415-si1.gif https://s3-eu-west-1.amazonaws.com/prod-ucs-content-store-eu-west/content/pii:S0926860X16305415/STRIPIN/image/gif/67d18b7dcf934251a632924540f7ff64/si1.gif https://s3.amazonaws.com/prod-ucs-content-store-us-east/content/pii:S0926860X16305415/STRIPIN/image/gif/67d18b7dcf934251a632924540f7ff64/si1.gif si1 si1.gif gif 2875 62 398 ALTIMG APCATA 16050 S0926-860X(16)30541-5 10.1016/j.apcata.2016.11.002 Elsevier B.V. Fig. 1 XRD patterns of xLa-Ni-Mg-Al2O3 catalysts reduced at 700°C. Fig. 1 Fig. 2 TPR of the xLa-Ni-Mg-Al2O3 catalysts calcined at 500°C. Fig. 2 Fig. 3 Effect of La addition to fresh Ni-Mg-Al2O3 catalyst on catalytic performance of the CO methanation. (T: 320°C, GHSV=100,000h−1, CO:H2 =1:3 with 10% N2). Fig. 3 Fig. 4 XPS spectra of La 3d5/2 (a) and Ni 2p3/2 (b) for reduced xLa-Ni-Mg-Al2O3. Fig. 4 Fig. 5 Reaction tests with bench scale reactor packed with Ni-Mg-Al2O3 pellets (T: 335°C, P: 20bar, GHSV=10,000h−1, CO:H2 =1:3 with 20% N2). Fig. 5 Fig. 6 La effect on the change in the CO conversion during the ageing test (Reaction condition; T: 320°C, GHSV=100,000h−1, CO:H2 =1:3 with 10% N2; Ageing condition T: 850°C, GHSV=250,000h−1, 40% steam added). Fig. 6 Fig. 7 Effect of La addition on turnover frequency (TOF) for fresh and aged catalysts. Fig. 7 Table 1 Chemical composition and textural properties of calcined catalysts. Table 1 Sample (xLa-Ni-Mg-Al2O3) La (wt%) Atomic ratio a Textural properties La/Ni La/Al BET (m2/g) Pore Volume (cm3/g) b Pore Diameter (Å) c 0La – – – 156 0.475 96.27 1La 0.99 0.022 0.006 150 0.464 97.35 3La 2.98 0.065 0.019 141 0.422 97.58 5La 4.96 0.109 0.032 132 0.402 98.14 7La 6.85 0.150 0.045 123 0.329 108.20 10La 9.82 0.216 0.064 118 0.308 109.03 a Calculated ratio based on ICP-AES results. b Pore volume calculated from the desorption branch in the adsorption isotherm of N2. c BJH desorption average pore diameter. Table 2 Fractional area of the de-convoluted peaks in the TPR spectra. Table 2 Sample (xLa-Ni-Mg-Al) Fractional area of the de-convoluted peaks(%) α-type β-type γ-type 0La 4.3 84.8 10.9 1La 3.7 85.0 11.3 3La 5.9 83.4 10.7 5La 7.9 80.2 11.9 7La 9.7 78.4 11.9 10La 14.7 73.6 11.7 Table 3 Results of XRD, TEM, CO and H2 chemisorption for fresh catalysts. Table 3 Sample (xLa-Ni-Mg-Al2O3) Average Ni Particle Size by XRD (nm) Average Ni Particle size by TEM (nm) H2 (CO) chemisorption Number of exposed Ni sites (×1018 Ni atoms/gcat) Density of Ni sites (×1017 atoms/m2) Loss of Ni site density (A) (%) 0La 9.2 10 9.19 (8.73) 6.27 (5.96) 0 1La 8.1 9.0 10.2 (8.98) 6.13 (5.39) 2.3 3La 7.2 8.3 9.92 (8.38) 5.30 (4.47) 15.5 5La 7.2 8.3 9.49 (8.19) 5.07 (4.37) 19.2 7La 7.2 8.4 9.01 (7.69) 4.81 (4.11) 23.3 10La 7.3 8.4 7.83 (7.55) 4.24 (4.09) 32.4 Table 4 Results of BET, XRD, TEM, CO and H2 chemisorption for used catalysts after 40h of ageing. Table 4 Sample (xLa-Ni-Mg-Al2O3) BET surface area Ni particle size H2 (CO) chemisorption Loss of Ni site density (B) (%) Loss of Ni sites density during the ageing test (B-A) (%) Area (m2/g) Lost a (%) XRD (nm) TEM (nm) Sintering degree b (%) Number of exposed Ni sites (×1018 Ni atoms/gcat) Density of Ni sites (×1017 atoms/m2) 0La 43 72.4 19.3 33 210 (330) 2.08 (3.20) 2.98 (4.58) 52.5 52.5 1La 51 65.9 18.5 31 228 (344) 2.55 (3.63) 3.50 (4.98) 44.2 41.9 3La 50 64.7 17.6 29 244 (349) 3.0 (3.93) 3.89 (5.13) 37.6 22.1 5La 55 58.6 16.3 26 226 (313) 4.33 (5.61) 5.23 (6.78) 16.5 −2.7 7La 54 56.4 16.8 26 233 (310) 4.01 (5.01) 4.99 (6.24) 20.4 −2.9 10La 52 55.7 16.9 26 232 (310) 3.81 (5.07) 4.78 (6.35) 23.8 −8.6 0La (10h) 66 57.3 11.1 – 121 4.51 3.71 40.8 40.8 5La (10h) 75 43.3 9.3 – 129 7.32 5.05 19.5 0.3 5La (80h) 35 73.4 18.4 – 256 2.07 2.82 54.9 35.7 a [(BET of fresh catalyst-BET of aged catalyst)/(BET of fresh catalyst)]×100. b (Ni size of aged catalyst/that of fresh catalyst)×100 that is based on XRD and TEM (values in parenthesis). Table 5 The saturation concentration of dispersed La on alumina surface. Table 5 Ref. Calcination Temp. (°C) BET (m2/g of Al2O3) La/Al At. ratio Surface Density (μmol La/m2) La content a (wt% La/gcat) Analyzed by Xie [52] 800 141 0.13 17.20 21.26 XRD Bettman [53] 800 85.6 0.037 8.50 10.51 AES,CO2 Chemisorption Haack [63] 925 87.1 0.15 35.3 41.76 XPS Chen [22] 1150 48.3 0.02 8.12 10.04 BET, XRD, XPS Yamamoto [23] 800 153 0.051 8.2 10.14 XRD 0.025 3.45 4.26 EXAFS 1000 117 0.025 4.58 5.66 XRD 0.010 1.49 1.84 EXAFS Alvarez [19] – – – 4.98 – 3La atoms/nm2, b Knözinger [85] – – – 8.31 – 5La atoms/nm2, b a Converted La content to our catalysts by consideration of BET and La/Al ratio. b Theoretical value. Table 6 The density of La on the surface of Ni-Mg/Al2O3 catalyst. Table 6 Sample (xLa-Ni-Mg-Al2O3) Fresh catalysts μmol La/m2 of Al2O3 Aged catalysts μmol La/m2 of Al2O3 1La 0.63 1.86 3La 2.15 6.21 5La 3.73 8.92 7La 5.77 13.02 10La 8.37 18.87 La effect on the long-term durability of Ni-Mg-Al2O3 catalysts for syngas methanation Ki Hun Song a Xian Yan a Dong Jun Koh c Taewook Kim a Jong-Shik Chung a b ⁎ a Department of Chemical Engineering, Pohang University of Science and Technology (POSTECH), San 31, Hyoja-Dong, Nam-Gu,Pohang 790-784, Republic of Korea Department of Chemical Engineering Pohang University of Science and Technology (POSTECH) San 31 Hyoja-Dong Nam-Gu Pohang 790-784 Republic of Korea b Institute of New and Renewable Energy, Pohang University of Science and Technology (POSTECH), San 31, Hyoja-Dong, Nam-Gu,Pohang 790-784, Republic of Korea Institute of New and Renewable Energy Pohang University of Science and Technology (POSTECH) San 31 Hyoja-Dong Nam-Gu Pohang 790-784 Republic of Korea c Coal Chemical Processing Team, RIST, San 32, Hyoja-Dong, Nam-Gu, Pohang 790-330, Republic of Korea Coal Chemical Processing Team RIST San 32 Hyoja-Dong Nam-Gu Pohang 790-330 Republic of Korea ⁎ Corresponding author at: Department of Chemical Engineering, Pohang University of Science and Technology (POSTECH), San 31, Hyoja-Dong, Nam-Gu,Pohang 790-784, Republic of Korea. Department of Chemical Engineering Pohang University of Science and Technology (POSTECH) San 31 Hyoja-Dong Nam-Gu Pohang 790-784 Republic of Korea Graphical abstract Various contents of La (1–10wt.%) were added to Ni-Mg-Al2O3 catalyst to improve its catalytic activity and long-term stability for CO methanation. The optimum amount of La for the highest CO conversion is obtained at 1wt.% La addition for fresh catalysts, whereas at 5wt.% La for aged catalyst. During a long term ageing test at a high severity condition (850°C, space velocity=250,000h−1 and 40% steam in the feed), catalysts having 0–3wt% La rapidly lose their activity at the initial 10h period due to the sintering of Ni particles, and this is followed by slower degradation due to the thermal sintering of the support alumina. Catalysts having higher La contents (5–10wt.%) exhibit an increase in the CO conversion at a certain period, which is attributed to the uncovering effect of La on the Ni surface through the agglomeration of dispersed La into aggregates. For fresh catalysts, the CO conversion and turnover frequency are highest at 1wt.% La and 7wt.% La, respectively. For aged catalysts, both of these are highest at 5wt.% La. Keywords CO methanation Syngas Ni-Mg-Al2O3 catalyst La effect Thermal stability 1 Introduction The conversion of coal to synthetic natural gas (known as SNG) is a promising technology for the clean usage of coal [1–3]. The production of SNG is generally carried out via two steps: gasification of coal with steam and/or oxygen to generate syngas (synthetic gas, a mixture of H2 and CO) and methanation of CO with H2 (CO+3H2 →CH4 +H2O, ∆H298 0 =−206kJ/mol) Commercial scale production of SNG is carried out using an adiabatic multi-tubular reactor packed with an excess amount of catalyst at an inlet feed temperature of 300–350°C. Owing to the excessive exothermic nature of the reaction, however, the reaction temperature is known to increase to 800°C at a certain section of the reactor bed [4], and this hot zone gradually moves toward the downstream section with operation time. Moreover, the reaction mixture inside the reactor contains a significant amount of steam, which accelerates the thermal sintering of the catalyst. Therefore, for practical application of a catalyst, its durability under such high-severity conditions (high temperature with steam) is as important as the initial activity. Ni supported over γ-Al2O3 is often regarded as a preferable choice for large-scale production of SNG because of its comparable activity, high methane selectivity and relatively low cost [5–8]. However, it is not durable at high temperatures, especially in the presence of water vapor, because of the sintering of Ni particles [9–11]. High temperature also promotes a significant decrease in surface area of γ-alumina and/or the phase transformation to more stable phases of θ-, δ- and α-form, which results in the loss of catalytic activity [12–14]. Concerning the thermal sintering of the alumina support, it has been well known that La additive can retard both the sintering and phase transformation of γ-alumina [13,15–27]. The influence of various additives in Ni/Al2O3 catalysts has been widely explored to improve the activity and durability for the methanation of CO. Gelsthorpe et al. [28] reported that, through extensive screening tests with many additives, only La and Ce exhibited improvement in the catalytic activity whereas others such as Mg, Ca, Sr, Ba, Cu, Cr and Na had no effect or a negative effect. A later investigation by Rotgerink et al. with Ti [29], La [30], and Ce [31] and by Znak et al. [32] with Ce, La and Zr also proved the improvement in activity with La and Ce, which was explained by enhanced CO dissociation on the Ni surface. In addition to these, there have been many reports describing the effect of La as a physical promoter to improve the dispersion and reduction of Ni particles [33–41], and/or a chemical promoter to improve the catalytic activity for not only CO methanation but also hydrocarbon reforming reactions [30,42–46]. However, most works have mainly focused on the La effect on catalytic activity, and no investigation has focused on the long-term duration of Ni/alumina catalyst, especially under high-severity conditions (high temperature and high steam content) that exist in the industrial scale reactor. In this study, the effect of La addition to Mg-stabilized Ni/alumina was investigated for the methanation of CO with H2 [47,48], with a focus on both the activity and stability of the catalyst. The results of long-term ageing tests under high-severity conditions (850°C, space velocity=250,000h−1 and 40% steam in the feed) and various characterization on both fresh and aged catalysts have revealed that La acts as a chemical and physical promoter on both alumina and Ni to improve the activity and long-term stability of a catalyst. 2 Experimental 2.1 Catalysts preparation NiO-MgO-Al2O3 containing 20wt.% Ni and 10wt.% Mg was prepared by the co-precipitation method. Stoichiometric amounts of Ni(NO3)2·6H2O, Mg(NO3)2·6H2O and Al(NO3)3·9H2O were dissolved in distilled water. Under vigorous stirring at 80°C, aqueous potassium carbonate was added drop by drop until the solution pH reached 10. The solution containing precipitate was aged at 80°C for another 4h. It was then filtered thoroughly with distilled water until the pH of the filtered solution became 7. This was followed by drying at 100°C overnight and subsequent calcination at 500°C for 4h. It was then ground and sieved to a size of 200mesh to obtain the powder form of NiO-MgO-Al2O3 catalyst. It was further impregnated with aqueous solution with various contents of La(NO3)3·6H2O to incipient wetness, dried at 100°C overnight, and calcined at 500°C for 4h. The prepared catalysts were denoted as xLa, where x represented the La content (0–10wt.%) in the calcined samples of La-NiO-MgO-Al2O3. 2.2 Catalyst characterization N2 isotherms in both adsorption and desorption branches were obtained at liquid N2 temperature by using a Micromeritics ASAP 2020 analyzer. Prior to the analysis, the catalyst sample was degassed in vacuum at 250°C for 2h to remove any physically adsorbed molecules. The specific surface area was obtained using the BET (Brunauer–Emmett–Teller) equation. The pore diameter distribution curve was derived from the desorption branch by the Barrett–Joyner–Halenda (BJH) method assuming a cylindrical pore geometry. The X-ray diffraction (XRD) pattern was measured by using a Rigaku X-ray diffractometer. Cu Kα radiation (λ=0.15418nm) was used in the 2θ scanning range of 10° and 80° at a speed of 0.04°min−1. The samples were reduced at 700°C for 4h under a flow of 50% H2 in N2 prior to the characterization. The mean crystallite diameter of Ni was estimated from the line broadening with the Scherrer equation with the peak of Ni (200) plane (2θ=51.8°) in the XRD pattern. Transmission electron microscopy (TEM, JOEL JEM-2200FS) was used to observe the particle morphology and measure the particle size and particle size distribution. A small amount of sample was dispersed in ethanol solution using an ultrasonic bath. The solution was mounted on a carbon-coated copper grid (150mesh) and then dried in a vacuum oven at 80°C for 3h. The particle size was measured directly through a suitable magnification of the TEM in several regions randomly selected from the sample. EELS (electron energy loss spectroscopy) analysis was also conducted to recognize Ni metal particles. Several hundreds of particles were counted for the determination of average particle diameter. X-ray photoelectron spectroscopy (XPS) was performed using an ESCALAB 250 induced electron emission spectrometer with an Al Kα source (1486.8eV, 12mA, 20kV). The binding energy of La 3d and Ni 2p were calibrated with C 1s peak (BE=284.6eV) as a standard. Temperature-programmed reduction (TPR) and CO chemisorption were carried out using a chemisorption analyzer (Micromeritics Autochem II). For the TPR analysis, 100mg of catalyst sample charged in a tubular reactor was heated under a flow of 5% H2 in Ar from 50 to 850°C at a constant heating rate of 10°C/min. The hydrogen consumption was monitored with a thermal conductivity detector (TCD). For the CO chemisorption measurement, the catalyst sample in the reactor was reduced in a flow of 10% H2 in He at 700°C for 4h and then flushed in pure He flow at 700°C for 1h before being cooled to the adsorption temperature (50°C). The CO adsorption isotherm was obtained until the catalyst surface became saturated using 5% CO in He. To calculate the Ni dispersion, the adsorption stoichiometry of CO/Nis was assumed to be 1 with a simplified assumption that CO molecules are chemisorbed linearly only [49], and all the Ni particles are in hemi-spherical shape [49,50]. H2 chemisorption measured by the same procedure described above, using 5% H2 in Ar. The adsorption stoichiometry of H/Nis was assumed to be 1 [50]. 2.3 Reaction tests Measurement of catalytic activity was carried out in a quartz tubular reactor packed with 200mg of catalyst at atmospheric pressure. Reactant with an H2/CO ratio of 3 in 10% N2 was fed at a space velocity of 100,000h−1. The reactor temperature was controlled by using a programmable temperature controller and detected by a movable thermocouple, positioned near the catalytic bed. Another thermocouple (1/16inch in OD) inserted inside the catalyst bed measured the reaction temperature of the catalyst bed. The catalyst was pretreated in a flow of 50% H2 in N2 at 700°C for 4h before the reaction test. Pellets (3mm D×3mmL) of 0La catalyst (Ni-Mg-Al2O3 without La) were tested separately in a bench scale reactor (1inch OD) at 335°C and 20bar after the reactor was packed with catalyst pellets 10cm in length. Reactant with a mole ratio of CO/H2 =1/3 in 20% N2 was fed at a space velocity of 10,000h−1. Analysis of the reaction products was conducted by means of a gas chromatograph (Agilent 7890A) equipped with TCD and a column of a 60/80 Carboxen-1000 molecular sieve. The turnover frequency (TOF, s−1) was calculated by dividing the number of CO molecules reacted per second by the number of exposed Ni atoms on the surface that was titrated by CO chemisorption. 3 Results and discussion 3.1 La effect for fresh catalysts Table 1 shows the La effect on the textural properties (BET surface area, pore volume and average pore diameter) of fresh catalysts that were calcined at 500°C. As the La content increases, both BET and pore volume decrease gradually. When the La content exceeds 7wt.%, there exists a sudden drop in the pore volume with concomitant increase in the pore diameter, which is in agreement with previous report that at high content of La, La2O3 blocks smaller pores of alumina preferentially [42,51]. There have been many reports that La added to alumina behaves as a sintering inhibitor when alumina is exposed at high temperatures (i.e., 1000°C) [17,24,25,27]. The results in Table 1, however, have not shown any evidence that La acts as a sintering inhibitor. This is probably because our catalysts were calcined at a relatively low temperature of 500°C, not at 1000°C. Fig. 1 shows XRD peak patterns of La-added Ni-Mg-Al2O3 catalysts after reduction at 700°C. Any crystalline phase of La, such as La2O3 or LaAlO3, was undetected in all samples. La has been known to exist as a lanthana monolayer or a two-dimensional over-layer on the alumina surface, which cannot be distinguished by XRD when the surface density of La is kept low—8.2–17.2μmol/m2 alumina, depending on the report [26,52,53]. These values correspond to the La content of 10.14–21.26wt.% in our catalyst. Therefore, even the maximum 10wt.% La in our catalyst would not have the crystalline structure of La. A close look at XRD peaks in Fig. 1 reveals that, upon increasing the La addition, peak broadening occurs for all of the peaks: peaks at 51.6° and 76.1° correspond to metallic Ni, and those at 37.1° 43.1°, and 62.6° correspond to either NiMgO2 or NiAl2O4. With the assumption that NiAl2O4 will not change its size because of the strong interaction of Ni with the alumina support, it is established that the addition of La effectively retards the sintering of both NiO and NiMgO2 particles. Fig. 2 shows TPR patterns of La-added Ni-Mg-Al2O3 catalysts that were calcined at 500°C. The peak located in the low temperature region of 300–400°C (α-type) is generally accepted as free NiO species on the alumina support [48,54]: the one in the intermediate temperature range of 500–800°C (β-type) corresponds to NiO, which has stronger interaction with support [37,41,55], and the one at high temperatures above 800°C (γ-type) corresponds to an NiAl2O4 and/or NiMgO2 structure [40,56]. Thus, the metallic Ni formed after reduction at 700°C must have originated from α- and β-type species of NiO on the alumina support, not from either NiAl2O4 or NiMgO2. Upon increasing the La content, the α- and β-type peaks shift to a lower temperature, whereas the γ-type does not. For a qualitative analysis, the TPR profiles of the samples were de-convoluted, and the fractional area of each peaks are shown in Table 2 . After de-convoluting the three peaks, we have found that with increased La content, the peak area of the α-type peak (free NiO species) increases, whereas that of the β-type (Ni with a strong interaction with alumina) decreases. The results are in agreement with the previous observation that La weakens the interaction between NiO and Al2O3 by destroying partially metastable Ni-Al mixed oxide phase [37,57]. As expected, the area of γ-type that corresponds to NiAl2O4 is not influenced by the La addition because of the strong interaction between NiO and γ-Al2O3 [58]. The effect of the La addition on the particle size and surface properties of the Ni phase was investigated by means of XRD, TEM, chemisorption measurements of H2 and CO (the value in the parenthesis) as shown in Table 3 . The particle size of Ni measured by means of XRD is reduced with the addition of La. This decreasing effect is more pronounced at low La content (1–3wt.%), above which the size remains constant. The results of TEM show the same tendency as those of XRD, although the average size is slightly larger than that estimated by XRD. The enhancement of Ni dispersion by adding La has been observed in several studies. Cui et al. [59] and Gelsthorpe et al. [28] reported that the presence of the optimal amount of La increases the Ni dispersion. Zhang et al. [58] claimed that the enhancement of NiO dispersion can be achieved through the formation of La-Ni mixed oxide or separation of NiO micro-crystallites by the addition of La2O3. However, the addition of La may cover the Ni surface to decrease the number of Ni sites. The data in the 4th column of Table 3 represent the density of Ni sites per physical area of Ni surface. It was obtained by dividing the number of Ni sites measured by the H2 or CO chemisorption by the physical area obtained from XRD, which was calculated from mean crystallite diameter with the assumption of the hemispherical shape of Ni particles [60]. The value measured by using H2 chemisorption is slightly larger than that by CO chemisorption. It has been known that CO molecules adsorb on the Ni sites in both linear and bridged form. Our data of chemisorbed mole ratios of CO/H are in the range of 1.0 to 1.2, indicating that the majority of CO molecules are chemisorbed linearly as other authors adopted [50,61,62]. Anyhow, the data clearly show that, the addition of La decreases the density of Ni sites probably because La has covered the Ni surface. The loss of the Ni site density in the last column in Table 3 was defined as follows. L o s s o f N i s i t e d e n s i t y ( % ) = 1 − D e n s i t y o f N i s i t e s f o r L a − a d d e d c a t a l y s t D e n s i t y o f N i s i t e s f o r 0 L a × 100 This represents the percent of the Ni site density that is lost by the addition of La, after being compared to 0La. As we expect, the loss increases with increased La addition due to the covering of the Ni surface with La. The effect of La addition on the catalytic performance for the CO methanation is depicted in Fig. 3 . The selectivity to CH4 is independent of the La content, implying that the reaction pathway is unaffected by the La addition. The CO conversion shows a typical volcano type of curve, with a maximum value at 1La, which coincides with the largest number of exposed Ni sites per gram of catalyst observed at 1La in Table 3. The results establish that the H2 chemisorption site has a direct correspondence with the reaction site. The ignition temperature of the reaction was measured in the temperature range from 200°C to 300°C under the flow of diluted reactant (H2/CO ratio=3 in 50% N2 was fed at a space velocity of 120,000h−1). The ignition temperature exhibits an abrupt drop upon the addition of 1wt.% La (1La), and this is followed by a rather slow decrease upon further addition of La. The XPS measurements were conducted to determine the chemical state of La on Ni-Mg-Al2O3 catalysts, and the results are shown in Fig. 4 . The binding energy (BE) of La 3d5/2 in Fig. 4 (a) is found to be 835.0eV for catalysts having La content higher than 3wt%. This value is higher than the reported value of 834.3eV for La2O3 [22] and 833.8eV for LaAlO3 [63], with a much smaller ΔE value (3.4eV) between the primary and satellite peak than the reported value of 4.6eV for La2O3 [64]. The observed BE value of La 3d5/2 (835.0eV) is consistent with the values (835.3±4eV) reported by others [22,36,39,65,66]. who have suggested that La on the alumina surface exist as deficiently coordinated ‘dispersed La species’ acting as Lewis acid sites [65] at a low La content range (La/Al ratio ≤0.15). There have been reports that the dispersed La exist as hydroxide or carbonate-like species [22,24]. It is worthy to notice that no peak shift is observed for all the La contents, indicating that La exists in the form of ‘dispersed La species’ for all fresh samples. For the analysis of Ni 2p3/2 electron binding energy, deconvolution of the Ni 2p3/2 and La 3d3/2 was carefully conducted in the region of 845–870eV, and the results are depicted in Fig. 4(b). The La 3d3/2 spectra (dashed line in Fig. 4(b)) was estimated using the results of La 3d5/2 spectra (Fig. 4(a)) with the following assumptions: (i) identical shape, (ii) spin obit splitting value of 16.8eV, (iii) relative intensity ratio of 1.40 [67]. The Ni 2p3/2 spectra of 0La is composed of two different Ni species: one has BE at 852.7eV with a satellite peak at 860.1eV that is assigned to metallic Ni [41,68], and another has BE at 855.8eV with a satellite peak at 862.5eV that is assigned to Ni2+ [69]. The binding energy of Ni2+ (855.8eV) was higher than that of pure NiO (854.4eV [64]) and near that of NiAl2O4 (856.2eV [41,43]). It is generally accepted that the species with a higher binding energy value has the greater electronic interaction with support [68], which implies that the Ni species of 0La has a strong interaction with MgO and/or Al2O3, as suggested from TPR results. For the La-containing samples, there exists a clear peak shift to a lower value, suggesting the existence of La-Ni interaction. The BE of metallic Ni shifts negatively from 852.7 to 852.3eV with the addition of La, implying that La donated electrons to Ni because of the electropositive nature of La, thus Ni becomes more electron-rich state. Moreover, because La has a higher capacity to bind with electrons than Al [22], it could be suggested that Ni atoms surrounded by La becomes more dominant than Ni atoms surrounded by Al, which results in a weakened interaction between NiO and Al2O3 by the addition of La. The amount of shift is sensitive in the low range of La content (≤5wt.%) and becomes saturated at higher La content. Similar role of La as chemical promoter to modify the chemical state of metal has been reported for various noble metals such as Pt, Pd, and Ru [70–77]. Bell and coworkers observed negative shift of Pd 3d5/2 binding energy on their Pd/La2O3 system [72], and have suggested that small patches of partially reduced ‘LaOx species’ on the surface of metal crystallites weaken the strength of CO adsorption by the back-donation of electrons from metal to CO [73,78]. Moreover, Schaper et al. [34] found that, through kinetic measurement of Ni/Al2O3 catalyst, La reduced the heats of CO and H2 chemisorption. Znak et al. [32] also observed that CO dissociation rate on the Ni surface was considerably promoted on the presence of La. Since CO dissociation is generally accepted as a rate determining step in methantion reaction [50,79,80], La can increase the dissociation rate of CO on Ni-Mg-Al2O3 catalyst to enhance the methanation activity. 3.2 La effect for aged catalysts To investigate the effect of La on the catalyst degradation during the CO methanation, the reaction was carried out using a bench-scale tubular reactor (1in. in diameter) that contained a 10cm bed length of pellets (3mmL×3 mmD) of Ni-Mg-Al2O3 catalyst (0La). The reaction mixture (CO/H2 =1/3 with 20% N2) was fed at 335°C to the reactor, which was located inside a tubular furnace whose temperature was kept at 335°C. Fig. 5 (a) shows that the CO conversion and methane yield seem to be very stable during the 18days of operation with almost complete conversion of CO and 95% yield of methane. The temperature profile measured along the catalytic bed is presented in Fig. 5(b). As soon as the reactants enter the reactor, a sudden increase in temperature to 640°C is observed at the entrance of the reactor, after which the temperature decreases gradually along the reactor length to 370°C, indicating that the reaction occurs mostly at the entrance part because of its highly exothermic nature. After 18days of operation, the temperature at the entrance part decreases by 100°C, confirming that catalyst degradation has occurred at the entrance part because of the exposure at such a high temperature. Because this type of activity degradation is inevitable in a larger-scale commercial reactor, we focus on investigating the effect of La on the durability of Ni-Mg-Al2O3 catalyst in high-severity conditions. Fig. 6 shows the effect of La addition on the CO conversion upon repeated ageing test under a severe hydrothermal condition. To accelerate the catalyst degradation, the ageing test was conducted by the following procedure. At first, the initial activity of fresh catalyst was measured at the following reaction conditions: T=320°C, H2/CO=3:1 with 10% N2, space velocity=100,000h−1. The ageing test was then conducted under higher severity conditions (T=850°C, 40% steam added in the feed, space velocity=250,000h−1) for 10h. The steps of the ageing test and activity measurement were repeated 4 or 8 times depending on the catalyst sample. The introduction of 40% of steam in the feed was intended to suppress carbon deposition at high temperature [81] and to accelerate catalyst sintering [82,83]. The results in Fig. 6 show that the initial activity for fresh catalysts is in the order of 1La>3La>0La−5La>7La>10La. The highest activity observed for 1La has a direct correspondence to the largest number of Ni sites on the surface for 1La as seen in Fig. 3, above which the number of Ni sites decreases owing to the increased La covering although the physical area of Ni increases by the addition of La. Unlike fresh catalysts, however, the aged catalysts exhibit quite different degradation patterns. During the period of the 1st ageing test, a faster degradation rate is observed at relatively low La contents range of 0–3wt.% (0–3La), and a slightly slower degradation rate for those with 7La and 10La. Noteworthy is the degradation pattern of 5La, which exhibits an improvement in the CO conversion from the beginning. The same trend of the activity improvement can be noticed, although the magnitude is weak, for 7La and 10La at much later stages of 20–40h. The un-promoted catalyst (0La) becomes deactivated completely after 60h of the ageing test. Its lifetime is shortened by half if the space velocity of the feed is doubled, establishing that the loss rate of the activity is proportional to the amount of product converted in the feed. The data in Table 4 show that 0La has lost 72.4% of the BET area and 52.5% in the density of the Ni sites after the ageing test, whereas La added catalysts have smaller degrees of losses. Moreover, TGA measurements show approximately 70% of the weight loss for the completely deactivated catalyst of 0La, whereas 5La has a weight gain of 5% probably due to oxidation of Ni. Therefore, the complete deactivation of 0La is caused a combined effect of the loss of the Ni site density and severe coke deposition. The BET data in Table 4 conclude that the La addition inhibits the thermal sintering of alumina. Many researchers have studied the La effect on the stabilization of alumina support [13,15–27]. The main contributor for retarding alumina sintering was attributed to the formation of lanthanum aluminate surface layer to lower the surface energy of alumina [15,53,63] or the anchoring and nucleation of La containing compound to highly reactive unsaturated Al atoms (strong Lewis acid sites) which is known to be effect even at very low La content [16,17,19,23,84]. There exists a saturation point on the La coverage as a dispersed state on the alumina surface. La Above the saturation, La forms either precipitated La2O3 crystalline phase or LaAlO3 perovskite structure depending on temperature [22,53]. Many researchers investigated the saturation of La for the monolayer coverage on the alumina surface by employing various measuring methods, and the results are summarized in Table 5 . The saturation point shows a wide variation in terms of the La surface density, depending on calcination temperature and analytical method. In general, data measured by XRD [23,52] or XPS [22,63] show high values (8.12–35.3μmol/m2 of alumina), whereas those measured by EXAFS [21,23] show low values of 1.49μmol/m2 alumina after calcination at 1000°C and 3.45μmol/m2 alumina after calcination at 800°C. Interestingly, several authors observed crystallization of La (or transition of La surface state) around 8.2μmol/m2 of alumina [22,23,53], which are close to the theoretical value of 5 La atoms/nm2 (corresponding to 8.31μmol/m2 of alumina) if the monolayer coverage of LaOx be assumed [84,85]. For comparison, Table 6 shows the surface density of La in our fresh and aged Ni-Mg/Al2O3 catalysts, after assuming that La has an even distribution on the surface of alumina. We have shown that La exists as a dispersed state for all fresh samples in previous XRD and XPS results, even for 10La having the maximum La density of 8.37μmol/m2 of alumina. LaAlO3 formation was found from 3La after catalysts experienced 40h of ageing, suggesting that part of La species aren’t completely isolated at La densities higher than 3.73μmol/m2 of alumina. Yamamoto et al. [23] has reported similar observation that La exists as isolated La species at temperatures below 1000°C if the La density is less than 1.49μmol/m2 of alumina, above which some La forms aggregates locally. Fresh catalyst with 5wt.% La (5La) corresponds to the La surface density of 3.73μmol/m2 alumina, which is near the saturation point of 3.45μmol/m2 alumina at 800°C measured by EXAFS [23]. We thus assume that on fresh catalyst, La exists as isolated state, up to 5wt.% La, above which some of La begins to form aggregates locally. The data in the last column of Table 4 represents the loss of the Ni site density that occurs during the period of the 40h ageing test. 0La has the largest loss (52.5%) of the Ni site density and the largest loss of the BET area (72.4%). We assume that thermal sintering during the ageing test results in the blockage of the pores and collapse of structure in the alumina support to hinder the chemisorption of H2 or CO molecules to the Ni sites. The loss of the Ni site density decreases as La loading increases, and, from 5La, it is changed suddenly to minus value that corresponds to the gain of the Ni site. The results imply to us that the dispersed La undergoes agglomeration to three dimensional amorphous aggregates or crystallites to expose the La-covered Ni sites. Fig. 6 shows that 5La exhibits the increase of CO conversion at an early stage of the ageing period, whereas 7La and 10La at much later stages. This is reasonable because 5La has faster agglomeration rate with only monolayer La, whereas 7La and 10La must have slower agglomeration rate with more portion of 2-dimensional or 3-dimensional La owing to the oversaturation of La on the Ni surface. It has been known that La acts as a chemical promoter to donate electrons to Ni so that the dissociation of CO can be facilitated to improve catalytic activity for the CO methanation [32,50,75]. Therefore, the existence of more dispersed La species on the Ni surface will enhance the catalytic activity of the Ni sites. Fig. 7 shows differences in the TOF values between fresh and aged catalysts as a function of La content. For fresh catalysts, TOF continues to increase with increasing La content up to 7wt.% La (7La). This is in agreement with the point at which the loss of the Ni site density becomes saturated at 7La as seen in the last column of Table 3. In other words, the covering degree of La on the Ni surface becomes saturated at 7La. For aged catalyst, the saturation point of TOF shifts to 5La due to the uncovering effect of La. Moreover, all the aged catalysts exhibit lower TOF values comparing with their fresh catalysts. The results confirm that La particle size is another important factor for governing the catalytic activity. It has suggested that La donate electrons from the ‘contact perimeter’ of the La particle to the neighboring Ni as suggested by Bell et al. [72–74]. Therefore, smaller particles, especially dispersed La in the fresh catalysts will have more influence than La agglomerates in the aged catalysts. 4 Conclusion The influence of La addition to Ni-Mg-alumina catalysts for the CO methanation has been investigated. Through reaction tests and characterization of physical and chemical state of fresh and long-term aged catalysts at high severity conditions, the following conclusions are drawn. La inhibits the thermal sintering of alumina even at 1wt.% of La loading and the inhibition action increases up to 5wt.% La loading. La covers not only the alumina but the Ni surface, and the covering degree of Ni is kept increasing with increased La loading. La exists as dispersed state of monolayer up to 5wt% La (3.73μmol La/m2 of Al2O3). Upon ageing at 800°C for 40h, 0La catalyst experiences 72.4% loss of BET area, owing to the blockage of pores and collapse of the structure in the alumina support. Such a big loss of BET results in an appreciable loss (52.5%) in the density of the surface Ni sites that is defined by dividing the number of Ni atoms titrated with chemisorbed hydrogen by physical surface area of Ni. With the increased La addition, the density loss of the Ni sites during ageing test becomes less and less, and then an inversion of the loss (the gain) is observed from 5La, which is caused by the uncovering effect through agglomeration of the dispersed La to amorphous aggregates and crystallites. This kind of gain in the Ni sites with high La loadings leads an enhancement of the catalytic activity. Thus, the highest activity that is observed with 1La for fresh catalysts moves to 5La for aged catalysts. TOF for the CO methanation is higher with catalyst having smaller particle size of La than that having larger size, since La donates electrons to Ni through the perimeter of the La particle. Acknowledgements This work was financially supported by Energy Resource R&D program (2011T100200036) under the Ministry of Knowledge Economy, and International Collaborative Energy Technology R&D Program (20148520120150) of the Korea Institute of Energy Technology Evaluation and Planning (KETEP) under the Ministry of Trade, Industry & Energy, Republic of Korea. References [1] J. Kopyscinski T.J. Schildhauer S.M.A. Biollaz Fuel 89 2010 1763 [2] P. Mondal G.S. Dang M.O. Garg Fuel Process. Technol. 92 2011 1395 [3] S. Karellas K.D. Panopoulos G. Panousis A. Rigas J. Karl E. Kakaras Energy 45 2012 183 [4] B. Höhlein R. Menzer J. Range Appl. Catal. 1 1981 125 [5] G.A. Mills F.W. Steffgen Catal. Rev. 8 1974 159 [6] G. van Veen E.C. Kruissink E.B.M. Doesburg J.R.H. Ross L.L. van Reijen React. Kinet. Catal. Lett. 9 1978 143 [7] S.H. Hwang J.W. Lee U.G. Hong J.C. Jung D.J. Koh H.J. Lim C.D. Byun I.K. Song J. Ind. Eng. Chem. 18 2012 243 [8] J. Gao Q. Liu F. Gu B. Liu Z. Zhong F. Su RSC Adv. 5 2015 22759 [9] E.J. Erekson E.L. Sughrue C.H. Bartholomew Fuel Process. Technol. 5 1981 91 [10] J.R. Rostrup-Nielsen K. Pedersen J. Sehested Appl. Catal. A-Gen. 330 2007 134 [11] X. Bai S. Wang T. Sun S. Wang Reac. Kinet. Mech. Cat. 112 2014 437 [12] D.S. Maciver H.H. Tobin R.T. Barth J. Catal. 2 1963 485 [13] H. Arai M. Machida Appl. Catal. A-Gen. 138 1996 161 [14] S.-H. Cai S.N. Rashkeev S.T. Pantelides K. Sohlberg Phys. Rev. B 67 2003 224104 [15] H. Schaper E.B.M. Doesburg L.L. Van Reijen Appl. Catal. 7 1983 211 [16] F. Oudet P. Courtine A. Vejux J. Catal. 114 1988 112 [17] B. Béguin E. Garbowski M. Primet Appl. Catal. 75 1991 119 [18] M. Ozawa O. Kato S. Suzuki Y. Hattori M. Yamamura J. Mater. Sci. Lett. 15 1996 564 [19] L.J. Alvarez J.P. Jacobs J.F. Sanz J. Odriozola Solid State Ionics 95 1997 73 [20] K. Tadanaga H. Kobayashi T. Minami J. Non-Cryst. Solids 225 1998 230 [21] T. Yamamoto T. Tanaka T. Matsuyama T. Funabiki S. Yoshida J. Synchrotron Radiat. 8 2001 634 [22] X. Chen Y. Liu G. Niu Z. Yang M. Bian A. He Appl. Catal. A-Gen. 205 2001 159 [23] T. Yamamoto T. Hatsui T. Matsuyama T. Tanaka T. Funabiki Chem. Mater. 15 2003 4830 [24] M. Ozawa Y. Nishio J. Alloys Compd. 374 2004 397 [25] A. Barrera S. Fuentes M. Viniegra M. Avalos-Borja N. Bogdanchikova J. Campa-Molina Mater. Res. Bull. 42 2007 640 [26] Y. Nishio M. Ozawa J. Alloys Compd. 488 2009 546 [27] P. Alphonse B. Faure Microporous Mesoporous Mat. 196 2014 191 [28] M.R. Gelsthorpe K.B. Mok J.R.H. Ross R.M. Sambrook J. Mol. Catal. 25 1984 253 [29] H.G.J. Lansink Rotgerink P.D.L. Mercera J.G. van Ommen J.R.H. Ross Appl. Catal. 45 1988 239 [30] H.G.J. Lansink Rotgerink R.P.A.M. Paalman J.G. van Ommen J.R.H. Ross Appl. Catal. 45 1988 257 [31] H.G.J. Lansink Rotgerink J.C. Slaa J.G. van Ommen J.R.H. Ross Appl. Catal. 45 1988 281 [32] L. Znak K. Stołecki J. Zieliński Catal. Today 101 2005 65 [33] T. Inui K. Ueno M. Funabiki M. Suehiro T. Sezume Y. Takegami J. Chem. Soc. Faraday Trans. 75 1979 p1495 [34] H. Schaper E.B.M. Doesburg P.H.M. De Korte L.L. Van Reijen Appl. Catal. 14 1985 371 [35] Y. Hou Y. Wang W. Mi Z. Li S. Han Z. Mi W. Wu E. Min React. Kinet. Catal. Lett. 80 2003 233 [36] Y. Hou Y. Wang F. He W. Mi Z. Li Z. Mi W. Wu E. Min Appl. Catal. A-Gen. 259 2004 35 [37] J. Zhang H. Xu X. Jin Q. Ge W. Li Appl. Catal. A-Gen. 290 2005 87 [38] S. Natesakhawat O. Oktar U.S. Ozkan J. Mol. Catal. A: Chem. 241 2005 133 [39] M.C. Sánchez-Sánchez R.M. Navarro J.L.G. Fierro Catal. Today 129 2007 336 [40] H.S. Roh K.W. Jun Catal. Surv. Asia 12 2008 239 [41] A. Iriondo V.L. Barrio J.F. Cambra P.L. Arias M.B. Güemez R.M. Navarro M.C. Sánchez-Sánchez J.L.G. Fierro Top. Catal. 49 2008 46 [42] Z.W. Liu H.S. Roh K.W. Jun J. Ind. Eng. Chem. 9 2003 267 [43] R. Martı́nez E. Romero C. Guimon R. Bilbao Appl. Catal. A-Gen. 274 2004 139 [44] A. Zhao W. Ying H. Zhang H. Ma D. Fang World Acad. Sci. Eng. Technol. 59 2011 p [45] Y. Kathiraser W. Thitsartarn K. Sutthiumporn S. Kawi J. Phys. Chem. C 117 2013 8120 [46] Å. Slagtern U. Olsbye R. Blom I.M. Dahl H. Fjellvåg Appl. Catal. A-Gen. 165 1997 379 [47] N.K. Park S.K. Jang T.J. Lee D.J. Koh H.J. Lim C.D. Byun J. Nanoelectron. Optoelectron. 6 2011 320 [48] D. Hu J. Gao Y. Ping L. Jia P. Gunawan Z. Zhong G. Xu F. Gu F. Su Ind. Eng. Chem. Res. 51 2012 4875 [49] J.T. Stuckless N. Al-Sarraf C. Wartnaby D.A. King J. Chem. Phys. 99 1993 2202 [50] C.H. Bartholomew R.B. Pannell J. Catal. 65 1980 390 [51] J. Mazumder H.I. de Lasa Catal. Today 237 2014 100 [52] Y. Xie M. Qian Y. Tang Sci. Sin. Ser. B 6 1984 549 [53] M. Bettman R.E. Chase K. Otto W.H. Weber J. Catal. 117 1989 447 [54] J. Zieliński J. Catal. 76 1982 157 [55] C. Li Y.-W. Chen Thermochim. Acta 256 1995 457 [56] A. Parmaliana F. Arena F. Frusteri N. Giordano J. Chem. Soc. Faraday Trans. 86 1990 2663 [57] C. Anjaneyulu S. Naveen Kumar V. Vijay Kumar G. Naresh S.K. Bhargava K.V.R. Chary A. Venugopal Int. J. Hydrogen Energy 40 2015 3633 [58] L. Zhang J. Lin Y. Chen J. Chem. Soc. Faraday Trans. 88 1992 p497 [59] Y. Cui H. Zhang H. Xu W. Li Appl. Catal. A-Gen. 331 2007 60 [60] G. Bergeret P. Gallezot Particle size and dispersion measurements Handbook of Heterogeneous Catalysis 2008 Wiley-VCH Verlag GmbH & Co. KGaA [61] R. Geyer J. Hunold M. Keck P. Kraak A. Pachulski R. Schödel Chem. Ing. Tech. 84 2012 160 [62] J. Zhang H. Wang A.K. Dalai Appl. Catal. A-Gen. 339 2008 121 [63] L.P. Haack J.E. deVries K. Otto M.S. Chattha Appl. Catal. A-Gen. 82 1992 199 [64] C.D. Wagner G.E. Muilenberg Handbook of X-ray Photoelectron Spectroscopy: a Reference Book of Standard Data for Use in X-ray Photoelectron Spectroscopy 1979 Physical Electronics Division Perkin-Elmer Corp. [65] R. Alvero A. Bernal I. Carrizosa J.A. Odriozola Inorg. Chim. Acta 140 1987 45 [66] J.S. Ledford M. Houalla A. Proctor D.M. Hercules L. Petrakis J. Phys. Chem. 93 1989 6770 [67] S. Mickevičius S. Grebinskij V. Bondarenka B. Vengalis K. Šliužienė B.A. Orlowski V. Osinniy W. Drube J. Alloys Compd. 423 2006 107 [68] A.F. Lucrédio J.D.A. Bellido E.M. Assaf Appl. Catal. A-Gen. 388 2010 77 [69] S. Natesakhawat R.B. Watson X. Wang U.S. Ozkan J. Catal. 234 2005 496 [70] S.J. Tauster S.C. Fung R.L. Garten J. Am. Chem. Soc. 100 1978 170 [71] M.S. Spencer J. Catal. 93 1985 216 [72] T.H. Fleisch R.F. Hicks A.T. Bell J. Catal. 87 1984 398 [73] R.F. Hicks Q.-J. Yen A.T. Bell J. Catal. 89 1984 498 [74] R.F. Hicks A.T. Bell J. Catal. 91 1985 104 [75] O. Dulub W. Hebenstreit U. Diebold Phys. Rev. Lett. 84 2000 3646 [76] S. Tada R. Kikuchi A. Takagaki T. Sugawara S. Ted Oyama S. Satokawa Catal. Today 232 2014 16 [77] T.Y. Chou C.H. Leu C.T. Yeh Catal. Today 26 1995 53 [78] J.S. Rieck A.T. Bell J. Catal. 99 1986 278 [79] S. Fujita H. Terunuma M. Nakamura N. Takezawa Ind. Eng. Chem. Res. 30 1991 1146 [80] M.P. Andersson F. Abild-Pedersen I.N. Remediakis T. Bligaard G. Jones J. Engbæk O. Lytken S. Horch J.H. Nielsen J. Sehested J.R. Rostrup-Nielsen J.K. Nørskov I. Chorkendorff J. Catal. 255 2008 6 [81] C.H. Bartholomew Appl. Catal. A-Gen. 212 2001 17 [82] W.S. Brey Jr. K.A. Krieger J. Am. Chem. Soc. 71 1949 3637 [83] H. Schaper D.J. Amesz E.B.M. Doesburg L.L. Van Reijen Appl. Catal. 9 1984 129 [84] P. Alphonse B. Faure Microporous Mesoporous Mat. 196 2014 191 [85] H. Knözinger P. Ratnasamy Catal. Rev. 17 1978 31",
      "scopus-id": "84998879936",
      "coredata": {
        "eid": "1-s2.0-S0926860X16305415",
        "dc:description": "Various contents of La (1–10wt.%) were added to Ni-Mg-Al2O3 catalyst to improve its catalytic activity and long-term stability for CO methanation. The optimum amount of La for the highest CO conversion is obtained at 1wt.% La addition for fresh catalysts, whereas at 5wt.% La for aged catalyst. During a long term ageing test at a high severity condition (850°C, space velocity=250,000h−1 and 40% steam in the feed), catalysts having 0–3wt% La rapidly lose their activity at the initial 10h period due to the sintering of Ni particles, and this is followed by slower degradation due to the thermal sintering of the support alumina. Catalysts having higher La contents (5–10wt.%) exhibit an increase in the CO conversion at a certain period, which is attributed to the uncovering effect of La on the Ni surface through the agglomeration of dispersed La into aggregates. For fresh catalysts, the CO conversion and turnover frequency are highest at 1wt.% La and 7wt.% La, respectively. For aged catalysts, both of these are highest at 5wt.% La.",
        "openArchiveArticle": "false",
        "prism:coverDate": "2017-01-25",
        "openaccessUserLicense": null,
        "prism:aggregationType": "Journal",
        "prism:url": "https://api.elsevier.com/content/article/pii/S0926860X16305415",
        "dc:creator": [
          {
            "@_fa": "true",
            "$": "Song, Ki Hun"
          },
          {
            "@_fa": "true",
            "$": "Yan, Xian"
          },
          {
            "@_fa": "true",
            "$": "Koh, Dong Jun"
          },
          {
            "@_fa": "true",
            "$": "Kim, Taewook"
          },
          {
            "@_fa": "true",
            "$": "Chung, Jong-Shik"
          }
        ],
        "link": [
          {
            "@_fa": "true",
            "@rel": "self",
            "@href": "https://api.elsevier.com/content/article/pii/S0926860X16305415"
          },
          {
            "@_fa": "true",
            "@rel": "scidir",
            "@href": "https://www.sciencedirect.com/science/article/pii/S0926860X16305415"
          }
        ],
        "dc:format": "application/json",
        "openaccessType": null,
        "pii": "S0926-860X(16)30541-5",
        "prism:volume": "530",
        "prism:publisher": "Elsevier B.V.",
        "dc:title": "La effect on the long-term durability of Ni-Mg-Al2O3 catalysts for syngas methanation",
        "prism:copyright": "© 2016 Elsevier B.V. All rights reserved.",
        "openaccess": "0",
        "prism:issn": "0926860X",
        "dcterms:subject": [
          {
            "@_fa": "true",
            "$": "CO methanation"
          },
          {
            "@_fa": "true",
            "$": "Syngas"
          },
          {
            "@_fa": "true",
            "$": "Ni-Mg-Al2O3 catalyst"
          },
          {
            "@_fa": "true",
            "$": "La effect"
          },
          {
            "@_fa": "true",
            "$": "Thermal stability"
          }
        ],
        "openaccessArticle": "false",
        "prism:publicationName": "Applied Catalysis A: General",
        "openaccessSponsorType": null,
        "prism:pageRange": "184-192",
        "prism:endingPage": "192",
        "pubType": "fla",
        "prism:coverDisplayDate": "25 January 2017",
        "prism:doi": "10.1016/j.apcata.2016.11.002",
        "prism:startingPage": "184",
        "dc:identifier": "doi:10.1016/j.apcata.2016.11.002",
        "openaccessSponsorName": null
      },
      "objects": {
        "object": [
          {
            "@category": "thumbnail",
            "@height": "164",
            "@width": "201",
            "@_fa": "true",
            "$": "https://api.elsevier.com/content/object/eid/1-s2.0-S0926860X16305415-fx1.sml?httpAccept=%2A%2F%2A",
            "@multimediatype": "GIF image file",
            "@type": "IMAGE-THUMBNAIL",
            "@size": "12837",
            "@ref": "fx1",
            "@mimetype": "image/gif"
          },
          {
            "@category": "thumbnail",
            "@height": "163",
            "@width": "197",
            "@_fa": "true",
            "$": "https://api.elsevier.com/content/object/eid/1-s2.0-S0926860X16305415-gr1.sml?httpAccept=%2A%2F%2A",
            "@multimediatype": "GIF image file",
            "@type": "IMAGE-THUMBNAIL",
            "@size": "8007",
            "@ref": "gr1",
            "@mimetype": "image/gif"
          },
          {
            "@category": "thumbnail",
            "@height": "164",
            "@width": "208",
            "@_fa": "true",
            "$": "https://api.elsevier.com/content/object/eid/1-s2.0-S0926860X16305415-gr2.sml?httpAccept=%2A%2F%2A",
            "@multimediatype": "GIF image file",
            "@type": "IMAGE-THUMBNAIL",
            "@size": "5369",
            "@ref": "gr2",
            "@mimetype": "image/gif"
          },
          {
            "@category": "thumbnail",
            "@height": "136",
            "@width": "219",
            "@_fa": "true",
            "$": "https://api.elsevier.com/content/object/eid/1-s2.0-S0926860X16305415-gr3.sml?httpAccept=%2A%2F%2A",
            "@multimediatype": "GIF image file",
            "@type": "IMAGE-THUMBNAIL",
            "@size": "5111",
            "@ref": "gr3",
            "@mimetype": "image/gif"
          },
          {
            "@category": "thumbnail",
            "@height": "163",
            "@width": "131",
            "@_fa": "true",
            "$": "https://api.elsevier.com/content/object/eid/1-s2.0-S0926860X16305415-gr4.sml?httpAccept=%2A%2F%2A",
            "@multimediatype": "GIF image file",
            "@type": "IMAGE-THUMBNAIL",
            "@size": "5050",
            "@ref": "gr4",
            "@mimetype": "image/gif"
          },
          {
            "@category": "thumbnail",
            "@height": "89",
            "@width": "219",
            "@_fa": "true",
            "$": "https://api.elsevier.com/content/object/eid/1-s2.0-S0926860X16305415-gr5.sml?httpAccept=%2A%2F%2A",
            "@multimediatype": "GIF image file",
            "@type": "IMAGE-THUMBNAIL",
            "@size": "4846",
            "@ref": "gr5",
            "@mimetype": "image/gif"
          },
          {
            "@category": "thumbnail",
            "@height": "163",
            "@width": "219",
            "@_fa": "true",
            "$": "https://api.elsevier.com/content/object/eid/1-s2.0-S0926860X16305415-gr6.sml?httpAccept=%2A%2F%2A",
            "@multimediatype": "GIF image file",
            "@type": "IMAGE-THUMBNAIL",
            "@size": "11629",
            "@ref": "gr6",
            "@mimetype": "image/gif"
          },
          {
            "@category": "thumbnail",
            "@height": "164",
            "@width": "197",
            "@_fa": "true",
            "$": "https://api.elsevier.com/content/object/eid/1-s2.0-S0926860X16305415-gr7.sml?httpAccept=%2A%2F%2A",
            "@multimediatype": "GIF image file",
            "@type": "IMAGE-THUMBNAIL",
            "@size": "3638",
            "@ref": "gr7",
            "@mimetype": "image/gif"
          },
          {
            "@category": "standard",
            "@height": "245",
            "@width": "301",
            "@_fa": "true",
            "$": "https://api.elsevier.com/content/object/eid/1-s2.0-S0926860X16305415-fx1.jpg?httpAccept=%2A%2F%2A",
            "@multimediatype": "JPEG image file",
            "@type": "IMAGE-DOWNSAMPLED",
            "@size": "21194",
            "@ref": "fx1",
            "@mimetype": "image/jpeg"
          },
          {
            "@category": "standard",
            "@height": "320",
            "@width": "386",
            "@_fa": "true",
            "$": "https://api.elsevier.com/content/object/eid/1-s2.0-S0926860X16305415-gr1.jpg?httpAccept=%2A%2F%2A",
            "@multimediatype": "JPEG image file",
            "@type": "IMAGE-DOWNSAMPLED",
            "@size": "32459",
            "@ref": "gr1",
            "@mimetype": "image/jpeg"
          },
          {
            "@category": "standard",
            "@height": "304",
            "@width": "386",
            "@_fa": "true",
            "$": "https://api.elsevier.com/content/object/eid/1-s2.0-S0926860X16305415-gr2.jpg?httpAccept=%2A%2F%2A",
            "@multimediatype": "JPEG image file",
            "@type": "IMAGE-DOWNSAMPLED",
            "@size": "23292",
            "@ref": "gr2",
            "@mimetype": "image/jpeg"
          },
          {
            "@category": "standard",
            "@height": "328",
            "@width": "527",
            "@_fa": "true",
            "$": "https://api.elsevier.com/content/object/eid/1-s2.0-S0926860X16305415-gr3.jpg?httpAccept=%2A%2F%2A",
            "@multimediatype": "JPEG image file",
            "@type": "IMAGE-DOWNSAMPLED",
            "@size": "33851",
            "@ref": "gr3",
            "@mimetype": "image/jpeg"
          },
          {
            "@category": "standard",
            "@height": "705",
            "@width": "565",
            "@_fa": "true",
            "$": "https://api.elsevier.com/content/object/eid/1-s2.0-S0926860X16305415-gr4.jpg?httpAccept=%2A%2F%2A",
            "@multimediatype": "JPEG image file",
            "@type": "IMAGE-DOWNSAMPLED",
            "@size": "60138",
            "@ref": "gr4",
            "@mimetype": "image/jpeg"
          },
          {
            "@category": "standard",
            "@height": "244",
            "@width": "602",
            "@_fa": "true",
            "$": "https://api.elsevier.com/content/object/eid/1-s2.0-S0926860X16305415-gr5.jpg?httpAccept=%2A%2F%2A",
            "@multimediatype": "JPEG image file",
            "@type": "IMAGE-DOWNSAMPLED",
            "@size": "35601",
            "@ref": "gr5",
            "@mimetype": "image/jpeg"
          },
          {
            "@category": "standard",
            "@height": "364",
            "@width": "489",
            "@_fa": "true",
            "$": "https://api.elsevier.com/content/object/eid/1-s2.0-S0926860X16305415-gr6.jpg?httpAccept=%2A%2F%2A",
            "@multimediatype": "JPEG image file",
            "@type": "IMAGE-DOWNSAMPLED",
            "@size": "40490",
            "@ref": "gr6",
            "@mimetype": "image/jpeg"
          },
          {
            "@category": "standard",
            "@height": "322",
            "@width": "386",
            "@_fa": "true",
            "$": "https://api.elsevier.com/content/object/eid/1-s2.0-S0926860X16305415-gr7.jpg?httpAccept=%2A%2F%2A",
            "@multimediatype": "JPEG image file",
            "@type": "IMAGE-DOWNSAMPLED",
            "@size": "14586",
            "@ref": "gr7",
            "@mimetype": "image/jpeg"
          },
          {
            "@category": "high",
            "@height": "1085",
            "@width": "1333",
            "@_fa": "true",
            "$": "https://api.elsevier.com/content/object/eid/1-s2.0-S0926860X16305415-fx1_lrg.jpg?httpAccept=%2A%2F%2A",
            "@multimediatype": "JPEG image file",
            "@type": "IMAGE-HIGH-RES",
            "@size": "150960",
            "@ref": "fx1",
            "@mimetype": "image/jpeg"
          },
          {
            "@category": "high",
            "@height": "1417",
            "@width": "1708",
            "@_fa": "true",
            "$": "https://api.elsevier.com/content/object/eid/1-s2.0-S0926860X16305415-gr1_lrg.jpg?httpAccept=%2A%2F%2A",
            "@multimediatype": "JPEG image file",
            "@type": "IMAGE-HIGH-RES",
            "@size": "280677",
            "@ref": "gr1",
            "@mimetype": "image/jpeg"
          },
          {
            "@category": "high",
            "@height": "1347",
            "@width": "1708",
            "@_fa": "true",
            "$": "https://api.elsevier.com/content/object/eid/1-s2.0-S0926860X16305415-gr2_lrg.jpg?httpAccept=%2A%2F%2A",
            "@multimediatype": "JPEG image file",
            "@type": "IMAGE-HIGH-RES",
            "@size": "166032",
            "@ref": "gr2",
            "@mimetype": "image/jpeg"
          },
          {
            "@category": "high",
            "@height": "1451",
            "@width": "2333",
            "@_fa": "true",
            "$": "https://api.elsevier.com/content/object/eid/1-s2.0-S0926860X16305415-gr3_lrg.jpg?httpAccept=%2A%2F%2A",
            "@multimediatype": "JPEG image file",
            "@type": "IMAGE-HIGH-RES",
            "@size": "251907",
            "@ref": "gr3",
            "@mimetype": "image/jpeg"
          },
          {
            "@category": "high",
            "@height": "3118",
            "@width": "2500",
            "@_fa": "true",
            "$": "https://api.elsevier.com/content/object/eid/1-s2.0-S0926860X16305415-gr4_lrg.jpg?httpAccept=%2A%2F%2A",
            "@multimediatype": "JPEG image file",
            "@type": "IMAGE-HIGH-RES",
            "@size": "521918",
            "@ref": "gr4",
            "@mimetype": "image/jpeg"
          },
          {
            "@category": "high",
            "@height": "1083",
            "@width": "2667",
            "@_fa": "true",
            "$": "https://api.elsevier.com/content/object/eid/1-s2.0-S0926860X16305415-gr5_lrg.jpg?httpAccept=%2A%2F%2A",
            "@multimediatype": "JPEG image file",
            "@type": "IMAGE-HIGH-RES",
            "@size": "289410",
            "@ref": "gr5",
            "@mimetype": "image/jpeg"
          },
          {
            "@category": "high",
            "@height": "1611",
            "@width": "2167",
            "@_fa": "true",
            "$": "https://api.elsevier.com/content/object/eid/1-s2.0-S0926860X16305415-gr6_lrg.jpg?httpAccept=%2A%2F%2A",
            "@multimediatype": "JPEG image file",
            "@type": "IMAGE-HIGH-RES",
            "@size": "297825",
            "@ref": "gr6",
            "@mimetype": "image/jpeg"
          },
          {
            "@category": "high",
            "@height": "1424",
            "@width": "1708",
            "@_fa": "true",
            "$": "https://api.elsevier.com/content/object/eid/1-s2.0-S0926860X16305415-gr7_lrg.jpg?httpAccept=%2A%2F%2A",
            "@multimediatype": "JPEG image file",
            "@type": "IMAGE-HIGH-RES",
            "@size": "96841",
            "@ref": "gr7",
            "@mimetype": "image/jpeg"
          },
          {
            "@category": "thumbnail",
            "@height": "62",
            "@width": "398",
            "@_fa": "true",
            "$": "https://api.elsevier.com/content/object/eid/1-s2.0-S0926860X16305415-si1.gif?httpAccept=%2A%2F%2A",
            "@multimediatype": "GIF image file",
            "@type": "ALTIMG",
            "@size": "2875",
            "@ref": "si1",
            "@mimetype": "image/gif"
          }
        ]
      },
      "link": {
        "@rel": "abstract",
        "@href": "https://api.elsevier.com/content/abstract/scopus_id/84998879936"
      }
    }
  }
}