{
  "metadata": {
    "title": "Tunable products of 5-hydroxymethylfurfural oxidation by Zn/Co-ZIF derived catalysts",
    "authors": "; ; ",
    "journal": "Applied Catalysis A: General",
    "date": "2024-05-25",
    "doi": "10.1016/j.apcata.2024.119712",
    "abstract": "",
    "uri": "https://api.elsevier.com/content/article/pii/S0926860X2400156X",
    "pii": "S0926860X2400156X"
  },
  "fulltext": {
    "full-text-retrieval-response": {
      "scopus-eid": "2-s2.0-85189550786",
      "originalText": "serial JL 271346 291210 291744 291809 31 Applied Catalysis A: General APPLIEDCATALYSISAGENERAL 2024-04-03 2024-04-03 2024-04-04 2024-04-04 2024-04-18T16:52:59 1-s2.0-S0926860X2400156X S0926-860X(24)00156-X S0926860X2400156X 10.1016/j.apcata.2024.119712 S300 S300.1 FULL-TEXT 1-s2.0-S0926860X24X0006X 2024-05-20T11:55:39.319183Z 0 0 20240525 2024 2024-04-04T00:37:31.013917Z absattachment articleinfo articlenumber articletitlenorm authfirstinitialnorm authfirstsurnamenorm cid cids contenttype copyright crossmark dateloaded dateloadedtxt datesearch datesort dateupdated dco docsubtype doctype doi eid ewtransactionid hubeid indexeddate issn issnnorm itemstage itemtransactionid itemweight openaccess openarchive pg pgfirst pii piinorm pubdatestart pubdatetxt pubyr sortorder srctitle srctitlenorm srctype ssids alllist content subj subheadings suppl tomb volfirst volissue volumelist webpdf webpdfpagecount yearnav figure table e-component body mmlmath acknowledge affil appendices articletitle auth authfirstini authfull authkeywords authlast highlightsabst primabst ref specialabst 0926-860X 0926860X true 678 678 C Volume 678 3 119712 119712 119712 20240525 25 May 2024 2024-05-25 2024 article fla © 2024 Elsevier B.V. All rights reserved. TUNABLEPRODUCTS5HYDROXYMETHYLFURFURALOXIDATIONBYZNCOZIFDERIVEDCATALYSTS LI Y 1 Introduction 2 Experimental 2.1 Catalysts synthesis 2.2 Characterization 2.3 Catalytic performance and chemical analysis 2.4 Computational methods 3 Results and discussion 3.1 Characterization 3.1.1 Structure and morphology 3.1.2 XPS 3.2 Catalytic performance 3.2.1 Catalyst, solvent, base and reaction times 3.2.2 Temperature and O2 pressure 3.2.3 DFT calculation 3.2.4 Reaction mechanism 3.3 Universality of this reaction system 4 Conclusions CRediT authorship contribution statement Acknowledgements Appendix A Supplementary material References XU 2022 e202200352 H GAO 2023 106561 D HANSEN 2013 44 50 T WANG 2021 106147 Y CHEN 2018 1373 1382 H XU 2019 8 15 J ZHENG 2022 115168 X BORDEIASU 2023 119147 M SAXENA 2020 921 931 S RAO 2021 127063 K REN 2018 4946 4956 Y YAO 2023 106 116 W FENG 2020 570 578 Y GONG 2019 1808341 W ZHANG 2021 639 648 M NGUYEN 2016 5957 5961 C CHEN 2023 2300907 G ZHANG 2014 6590 6602 L XIE 2021 4823 C XU 2022 129149 C LIU 2023 123556 D GUO 2016 361 365 D YU 2022 1191 1198 L SUN 2019 1602 1608 K LIU 2020 4151 4158 H WU 2023 142472 J LI 2022 12882 12892 G ARANHA 2023 3053 3078 D LIN 2020 110695 Y SAMPATH 2017 75 80 G ARANHA 2023 3053 3078 D TAMIJI 2019 130 138 T CHEN 2018 16172 16181 G BIN 2018 1 9 Z ZHANG 2023 526 536 H ZHU 2021 2005 2008 J LV 2023 139816 G CHEN 2022 121281 Z ANTONYRAJ 2017 230 236 C YAN 2018 164 175 D YAN 2017 473 482 D ZHOU 2019 965 973 H QI 2021 119910 Y EISENBERG 2018 8618 8629 D HAN 2021 130461 Y ZHU 2022 8778 8787 P CUI 2023 14973 14985 X KUMAR 2022 e202201333 R ZHANG 2015 6563 6572 L SU 2017 811 818 H LIX2024X119712 LIX2024X119712XY 2026-04-04T00:00:00.000Z 2026-04-04T00:00:00.000Z http://creativecommons.org/licenses/by-nc-nd/4.0/ © 2024 Elsevier B.V. All rights reserved. https://doi.org/10.15223/policy-017 https://doi.org/10.15223/policy-037 https://doi.org/10.15223/policy-012 https://doi.org/10.15223/policy-029 https://doi.org/10.15223/policy-004 2024-04-25T11:47:14.336Z http://vtw.elsevier.com/data/voc/AddOnTypes/50.7/aggregated-refined State Key Laboratory of Coal Conversion SKLCC State Key Laboratory of Coal Conversion, Institute of Coal Chemistry, Chinese Academy of Sciences http://data.elsevier.com/vocabulary/SciValFunders/501100019044 http://sws.geonames.org/1814991/ Institute of Coal Chemistry, Chinese Academy of Sciences ICC Institute of Coal Chemistry, Chinese Academy of Sciences http://data.elsevier.com/vocabulary/SciValFunders/501100018804 http://sws.geonames.org/1814991/ X. Liao would like to thank Dr. Yan-Yan Chen (Work in State Key Laboratory of Coal Conversion, Institute of Coal Chemistry, Chinese Academy of Sciences) provide the DFT calculation software, and technical support. item S0926-860X(24)00156-X S0926860X2400156X 1-s2.0-S0926860X2400156X 10.1016/j.apcata.2024.119712 271346 2024-05-20T11:55:39.319183Z 2024-05-25 1-s2.0-S0926860X2400156X-main.pdf https://s3-eu-west-1.amazonaws.com/prod-ucs-content-store-eu-west/content/pii:S0926860X2400156X/MAIN/application/pdf/07a95fd918473c09310d55473d801888/main.pdf main.pdf pdf true 7315365 MAIN 10 1-s2.0-S0926860X2400156X-main_1.png https://s3-eu-west-1.amazonaws.com/prod-ucs-content-store-eu-west/content/pii:S0926860X2400156X/PREVIEW/image/png/3096e98a7675d03e4b04b2b87df0f4ca/main_1.png main_1.png png 57958 849 656 IMAGE-WEB-PDF 1 1-s2.0-S0926860X2400156X-gr7.jpg https://s3-eu-west-1.amazonaws.com/prod-ucs-content-store-eu-west/content/pii:S0926860X2400156X/gr7/DOWNSAMPLED/image/jpeg/b5d515bc3069c79a95eb1a783cfc037d/gr7.jpg gr7 gr7.jpg jpg 32545 240 695 IMAGE-DOWNSAMPLED 1-s2.0-S0926860X2400156X-gr8.jpg https://s3-eu-west-1.amazonaws.com/prod-ucs-content-store-eu-west/content/pii:S0926860X2400156X/gr8/DOWNSAMPLED/image/jpeg/26d81f1a26528fb008848c6f7ce27669/gr8.jpg gr8 gr8.jpg jpg 55419 402 695 IMAGE-DOWNSAMPLED 1-s2.0-S0926860X2400156X-ga1.jpg https://s3-eu-west-1.amazonaws.com/prod-ucs-content-store-eu-west/content/pii:S0926860X2400156X/ga1/DOWNSAMPLED/image/jpeg/9672aff5053547d03a248ad3403ff8cd/ga1.jpg ga1 true ga1.jpg jpg 19419 155 500 IMAGE-DOWNSAMPLED 1-s2.0-S0926860X2400156X-fx4.jpg https://s3-eu-west-1.amazonaws.com/prod-ucs-content-store-eu-west/content/pii:S0926860X2400156X/fx4/DOWNSAMPLED/image/jpeg/a5a40ea1dc972d9f35490351303b8418/fx4.jpg fx4 fx4.jpg jpg 1614 40 78 IMAGE-DOWNSAMPLED 1-s2.0-S0926860X2400156X-sc2.jpg https://s3-eu-west-1.amazonaws.com/prod-ucs-content-store-eu-west/content/pii:S0926860X2400156X/sc2/DOWNSAMPLED/image/jpeg/567f2f038e1ce983b768af61bd277c2c/sc2.jpg sc2 sc2.jpg jpg 25277 192 565 IMAGE-DOWNSAMPLED 1-s2.0-S0926860X2400156X-fx5.jpg https://s3-eu-west-1.amazonaws.com/prod-ucs-content-store-eu-west/content/pii:S0926860X2400156X/fx5/DOWNSAMPLED/image/jpeg/cb3efb9c33dd6ef5cb874acebf555cd8/fx5.jpg fx5 fx5.jpg jpg 1507 40 87 IMAGE-DOWNSAMPLED 1-s2.0-S0926860X2400156X-fx2.jpg https://s3-eu-west-1.amazonaws.com/prod-ucs-content-store-eu-west/content/pii:S0926860X2400156X/fx2/DOWNSAMPLED/image/jpeg/9720b8da5a29dc23925de7700f38fb5b/fx2.jpg fx2 fx2.jpg jpg 2022 39 106 IMAGE-DOWNSAMPLED 1-s2.0-S0926860X2400156X-fx3.jpg https://s3-eu-west-1.amazonaws.com/prod-ucs-content-store-eu-west/content/pii:S0926860X2400156X/fx3/DOWNSAMPLED/image/jpeg/6b8da7793aa9cc77010d1d6c7bd71bb6/fx3.jpg fx3 fx3.jpg jpg 1511 39 72 IMAGE-DOWNSAMPLED 1-s2.0-S0926860X2400156X-sc1.jpg https://s3-eu-west-1.amazonaws.com/prod-ucs-content-store-eu-west/content/pii:S0926860X2400156X/sc1/DOWNSAMPLED/image/jpeg/3a53a80545d8e2125b4609b702afc7dc/sc1.jpg sc1 sc1.jpg jpg 14808 171 659 IMAGE-DOWNSAMPLED 1-s2.0-S0926860X2400156X-fx1.jpg https://s3-eu-west-1.amazonaws.com/prod-ucs-content-store-eu-west/content/pii:S0926860X2400156X/fx1/DOWNSAMPLED/image/jpeg/3b19dbbba98710e4e097e9c71db7f270/fx1.jpg fx1 fx1.jpg jpg 2011 41 114 IMAGE-DOWNSAMPLED 1-s2.0-S0926860X2400156X-gr5.jpg https://s3-eu-west-1.amazonaws.com/prod-ucs-content-store-eu-west/content/pii:S0926860X2400156X/gr5/DOWNSAMPLED/image/jpeg/d79547b7428eb5230e030b7bad6d1c86/gr5.jpg gr5 gr5.jpg jpg 71644 488 715 IMAGE-DOWNSAMPLED 1-s2.0-S0926860X2400156X-gr6.jpg https://s3-eu-west-1.amazonaws.com/prod-ucs-content-store-eu-west/content/pii:S0926860X2400156X/gr6/DOWNSAMPLED/image/jpeg/b59f1425bc8a14e20104cbf938505ed4/gr6.jpg gr6 gr6.jpg jpg 54529 242 751 IMAGE-DOWNSAMPLED 1-s2.0-S0926860X2400156X-gr3.jpg https://s3-eu-west-1.amazonaws.com/prod-ucs-content-store-eu-west/content/pii:S0926860X2400156X/gr3/DOWNSAMPLED/image/jpeg/4fef0ac8fcf172d8118f73696eff2126/gr3.jpg gr3 gr3.jpg jpg 65940 508 678 IMAGE-DOWNSAMPLED 1-s2.0-S0926860X2400156X-gr4.jpg https://s3-eu-west-1.amazonaws.com/prod-ucs-content-store-eu-west/content/pii:S0926860X2400156X/gr4/DOWNSAMPLED/image/jpeg/ec6a64d75e464ee16f4d2e974c561af3/gr4.jpg gr4 gr4.jpg jpg 75630 495 695 IMAGE-DOWNSAMPLED 1-s2.0-S0926860X2400156X-fx8.jpg https://s3-eu-west-1.amazonaws.com/prod-ucs-content-store-eu-west/content/pii:S0926860X2400156X/fx8/DOWNSAMPLED/image/jpeg/406eae3f792cc0b6b6d62eb1f02a4e76/fx8.jpg fx8 fx8.jpg jpg 1795 41 89 IMAGE-DOWNSAMPLED 1-s2.0-S0926860X2400156X-gr1.jpg https://s3-eu-west-1.amazonaws.com/prod-ucs-content-store-eu-west/content/pii:S0926860X2400156X/gr1/DOWNSAMPLED/image/jpeg/88d374627e442d0f792ccff60dc24aba/gr1.jpg gr1 gr1.jpg jpg 36341 267 678 IMAGE-DOWNSAMPLED 1-s2.0-S0926860X2400156X-gr2.jpg https://s3-eu-west-1.amazonaws.com/prod-ucs-content-store-eu-west/content/pii:S0926860X2400156X/gr2/DOWNSAMPLED/image/jpeg/0ed632f2e8ba429ee6f7eb0580f32ca4/gr2.jpg gr2 gr2.jpg jpg 97475 327 791 IMAGE-DOWNSAMPLED 1-s2.0-S0926860X2400156X-fx6.jpg https://s3-eu-west-1.amazonaws.com/prod-ucs-content-store-eu-west/content/pii:S0926860X2400156X/fx6/DOWNSAMPLED/image/jpeg/ec6d3ebadc9c0df81235b471d36f932f/fx6.jpg fx6 fx6.jpg jpg 1645 41 81 IMAGE-DOWNSAMPLED 1-s2.0-S0926860X2400156X-fx7.jpg https://s3-eu-west-1.amazonaws.com/prod-ucs-content-store-eu-west/content/pii:S0926860X2400156X/fx7/DOWNSAMPLED/image/jpeg/f372457627c3514b1609d72136a09916/fx7.jpg fx7 fx7.jpg jpg 1648 40 84 IMAGE-DOWNSAMPLED 1-s2.0-S0926860X2400156X-gr7.sml https://s3-eu-west-1.amazonaws.com/prod-ucs-content-store-eu-west/content/pii:S0926860X2400156X/gr7/THUMBNAIL/image/gif/002fda6568ef29d2dd7959979df24e87/gr7.sml gr7 gr7.sml sml 5229 76 219 IMAGE-THUMBNAIL 1-s2.0-S0926860X2400156X-gr8.sml https://s3-eu-west-1.amazonaws.com/prod-ucs-content-store-eu-west/content/pii:S0926860X2400156X/gr8/THUMBNAIL/image/gif/872808b48b7efbbe13347eae4376d93b/gr8.sml gr8 gr8.sml sml 7273 127 219 IMAGE-THUMBNAIL 1-s2.0-S0926860X2400156X-ga1.sml https://s3-eu-west-1.amazonaws.com/prod-ucs-content-store-eu-west/content/pii:S0926860X2400156X/ga1/THUMBNAIL/image/gif/7bf4bb5ee881ede1c9453a61d7f6c8f8/ga1.sml ga1 true ga1.sml sml 4965 68 219 IMAGE-THUMBNAIL 1-s2.0-S0926860X2400156X-fx4.sml https://s3-eu-west-1.amazonaws.com/prod-ucs-content-store-eu-west/content/pii:S0926860X2400156X/fx4/THUMBNAIL/image/gif/72fdf7550e1e1bc352f38debbd06d11d/fx4.sml fx4 fx4.sml sml 7666 113 219 IMAGE-THUMBNAIL 1-s2.0-S0926860X2400156X-sc2.sml https://s3-eu-west-1.amazonaws.com/prod-ucs-content-store-eu-west/content/pii:S0926860X2400156X/sc2/THUMBNAIL/image/gif/027a7dec121480c85f3d2cc75051eb42/sc2.sml sc2 sc2.sml sml 5337 75 219 IMAGE-THUMBNAIL 1-s2.0-S0926860X2400156X-fx5.sml https://s3-eu-west-1.amazonaws.com/prod-ucs-content-store-eu-west/content/pii:S0926860X2400156X/fx5/THUMBNAIL/image/gif/295b79c4acebda28f6ed9c686bb527ad/fx5.sml fx5 fx5.sml sml 6004 102 219 IMAGE-THUMBNAIL 1-s2.0-S0926860X2400156X-fx2.sml https://s3-eu-west-1.amazonaws.com/prod-ucs-content-store-eu-west/content/pii:S0926860X2400156X/fx2/THUMBNAIL/image/gif/4c5244e5a47fd7bdd1715d503be89897/fx2.sml fx2 fx2.sml sml 5717 81 219 IMAGE-THUMBNAIL 1-s2.0-S0926860X2400156X-fx3.sml https://s3-eu-west-1.amazonaws.com/prod-ucs-content-store-eu-west/content/pii:S0926860X2400156X/fx3/THUMBNAIL/image/gif/5d6239fbc2b713ac21f560c5f226891d/fx3.sml fx3 fx3.sml sml 7141 118 219 IMAGE-THUMBNAIL 1-s2.0-S0926860X2400156X-sc1.sml https://s3-eu-west-1.amazonaws.com/prod-ucs-content-store-eu-west/content/pii:S0926860X2400156X/sc1/THUMBNAIL/image/gif/3ac92aa19efcee64d0016f69baf03265/sc1.sml sc1 sc1.sml sml 2407 57 219 IMAGE-THUMBNAIL 1-s2.0-S0926860X2400156X-fx1.sml https://s3-eu-west-1.amazonaws.com/prod-ucs-content-store-eu-west/content/pii:S0926860X2400156X/fx1/THUMBNAIL/image/gif/b671ccf68d5b7d5ad23a1554dc1a1b63/fx1.sml fx1 fx1.sml sml 5172 79 219 IMAGE-THUMBNAIL 1-s2.0-S0926860X2400156X-gr5.sml https://s3-eu-west-1.amazonaws.com/prod-ucs-content-store-eu-west/content/pii:S0926860X2400156X/gr5/THUMBNAIL/image/gif/a4d0a5b81795af436d652fafdaa591c3/gr5.sml gr5 gr5.sml sml 9863 150 219 IMAGE-THUMBNAIL 1-s2.0-S0926860X2400156X-gr6.sml https://s3-eu-west-1.amazonaws.com/prod-ucs-content-store-eu-west/content/pii:S0926860X2400156X/gr6/THUMBNAIL/image/gif/ae5ec3b16292cf0cc845efc8b1fcd3b7/gr6.sml gr6 gr6.sml sml 6993 71 219 IMAGE-THUMBNAIL 1-s2.0-S0926860X2400156X-gr3.sml https://s3-eu-west-1.amazonaws.com/prod-ucs-content-store-eu-west/content/pii:S0926860X2400156X/gr3/THUMBNAIL/image/gif/99df4206126304430ef3a4beceb27fc1/gr3.sml gr3 gr3.sml sml 10429 164 219 IMAGE-THUMBNAIL 1-s2.0-S0926860X2400156X-gr4.sml https://s3-eu-west-1.amazonaws.com/prod-ucs-content-store-eu-west/content/pii:S0926860X2400156X/gr4/THUMBNAIL/image/gif/df47087a2e4dd44fe866c05d4ae8b99f/gr4.sml gr4 gr4.sml sml 10850 156 219 IMAGE-THUMBNAIL 1-s2.0-S0926860X2400156X-fx8.sml https://s3-eu-west-1.amazonaws.com/prod-ucs-content-store-eu-west/content/pii:S0926860X2400156X/fx8/THUMBNAIL/image/gif/f7d6e3a69c004025f3246d9c8ad11e39/fx8.sml fx8 fx8.sml sml 6753 101 219 IMAGE-THUMBNAIL 1-s2.0-S0926860X2400156X-gr1.sml https://s3-eu-west-1.amazonaws.com/prod-ucs-content-store-eu-west/content/pii:S0926860X2400156X/gr1/THUMBNAIL/image/gif/0cd6a420ddf9d0672a80a8aa92294278/gr1.sml gr1 gr1.sml sml 5694 86 219 IMAGE-THUMBNAIL 1-s2.0-S0926860X2400156X-gr2.sml https://s3-eu-west-1.amazonaws.com/prod-ucs-content-store-eu-west/content/pii:S0926860X2400156X/gr2/THUMBNAIL/image/gif/d1643657fbec8ce01e9159cf77726e82/gr2.sml gr2 gr2.sml sml 16788 91 219 IMAGE-THUMBNAIL 1-s2.0-S0926860X2400156X-fx6.sml https://s3-eu-west-1.amazonaws.com/prod-ucs-content-store-eu-west/content/pii:S0926860X2400156X/fx6/THUMBNAIL/image/gif/f6d667b0ef4502a02385cf758f58e68b/fx6.sml fx6 fx6.sml sml 7092 110 219 IMAGE-THUMBNAIL 1-s2.0-S0926860X2400156X-fx7.sml https://s3-eu-west-1.amazonaws.com/prod-ucs-content-store-eu-west/content/pii:S0926860X2400156X/fx7/THUMBNAIL/image/gif/3d8181a780a85ddb04582334d28fe282/fx7.sml fx7 fx7.sml sml 6775 105 219 IMAGE-THUMBNAIL 1-s2.0-S0926860X2400156X-gr7_lrg.jpg https://s3-eu-west-1.amazonaws.com/prod-ucs-content-store-eu-west/content/pii:S0926860X2400156X/HIGHRES/image/jpeg/9d6da94f585a1eb4e8e5db35a4f367a3/gr7_lrg.jpg gr7 gr7_lrg.jpg jpg 177351 1061 3076 IMAGE-HIGH-RES 1-s2.0-S0926860X2400156X-gr8_lrg.jpg https://s3-eu-west-1.amazonaws.com/prod-ucs-content-store-eu-west/content/pii:S0926860X2400156X/HIGHRES/image/jpeg/fe9da648dcecc1178541debd00ac0937/gr8_lrg.jpg gr8 gr8_lrg.jpg jpg 234989 1779 3076 IMAGE-HIGH-RES 1-s2.0-S0926860X2400156X-ga1_lrg.jpg https://s3-eu-west-1.amazonaws.com/prod-ucs-content-store-eu-west/content/pii:S0926860X2400156X/HIGHRES/image/jpeg/652173c409e13b285f5cb564ecac4587/ga1_lrg.jpg ga1 true ga1_lrg.jpg jpg 119325 688 2213 IMAGE-HIGH-RES 1-s2.0-S0926860X2400156X-fx4_lrg.jpg https://s3-eu-west-1.amazonaws.com/prod-ucs-content-store-eu-west/content/pii:S0926860X2400156X/HIGHRES/image/jpeg/d1c81d770582668550b11f3a5c8b690a/fx4_lrg.jpg fx4 fx4_lrg.jpg jpg 6642 180 348 IMAGE-HIGH-RES 1-s2.0-S0926860X2400156X-sc2_lrg.jpg https://s3-eu-west-1.amazonaws.com/prod-ucs-content-store-eu-west/content/pii:S0926860X2400156X/HIGHRES/image/jpeg/ce89c52b704ba81c59f4967cb5539ee5/sc2_lrg.jpg sc2 sc2_lrg.jpg jpg 111604 849 2495 IMAGE-HIGH-RES 1-s2.0-S0926860X2400156X-fx5_lrg.jpg https://s3-eu-west-1.amazonaws.com/prod-ucs-content-store-eu-west/content/pii:S0926860X2400156X/HIGHRES/image/jpeg/4f574cfd07edfe729366193ebf1cf965/fx5_lrg.jpg fx5 fx5_lrg.jpg jpg 6015 182 392 IMAGE-HIGH-RES 1-s2.0-S0926860X2400156X-fx2_lrg.jpg https://s3-eu-west-1.amazonaws.com/prod-ucs-content-store-eu-west/content/pii:S0926860X2400156X/HIGHRES/image/jpeg/08ed58444b7f8fb2957fe7a15559b92c/fx2_lrg.jpg fx2 fx2_lrg.jpg jpg 8592 177 477 IMAGE-HIGH-RES 1-s2.0-S0926860X2400156X-fx3_lrg.jpg https://s3-eu-west-1.amazonaws.com/prod-ucs-content-store-eu-west/content/pii:S0926860X2400156X/HIGHRES/image/jpeg/c944f0b7e83fc03e8ef1b3aa320f10d5/fx3_lrg.jpg fx3 fx3_lrg.jpg jpg 5875 173 321 IMAGE-HIGH-RES 1-s2.0-S0926860X2400156X-sc1_lrg.jpg https://s3-eu-west-1.amazonaws.com/prod-ucs-content-store-eu-west/content/pii:S0926860X2400156X/HIGHRES/image/jpeg/18c883796ec44fec3455e18ac32bddba/sc1_lrg.jpg sc1 sc1_lrg.jpg jpg 63438 754 2911 IMAGE-HIGH-RES 1-s2.0-S0926860X2400156X-fx1_lrg.jpg https://s3-eu-west-1.amazonaws.com/prod-ucs-content-store-eu-west/content/pii:S0926860X2400156X/HIGHRES/image/jpeg/43d2ac94a71d50871cd7856e166fe873/fx1_lrg.jpg fx1 fx1_lrg.jpg jpg 8123 182 505 IMAGE-HIGH-RES 1-s2.0-S0926860X2400156X-gr5_lrg.jpg https://s3-eu-west-1.amazonaws.com/prod-ucs-content-store-eu-west/content/pii:S0926860X2400156X/HIGHRES/image/jpeg/ad6fbb0541992d807f6b62891b691206/gr5_lrg.jpg gr5 gr5_lrg.jpg jpg 404710 2158 3160 IMAGE-HIGH-RES 1-s2.0-S0926860X2400156X-gr6_lrg.jpg https://s3-eu-west-1.amazonaws.com/prod-ucs-content-store-eu-west/content/pii:S0926860X2400156X/HIGHRES/image/jpeg/7eb77bac55160df229c481a86f0244b4/gr6_lrg.jpg gr6 gr6_lrg.jpg jpg 232684 1073 3326 IMAGE-HIGH-RES 1-s2.0-S0926860X2400156X-gr3_lrg.jpg https://s3-eu-west-1.amazonaws.com/prod-ucs-content-store-eu-west/content/pii:S0926860X2400156X/HIGHRES/image/jpeg/2f646024860f40548da1073517bf17c8/gr3_lrg.jpg gr3 gr3_lrg.jpg jpg 396291 2245 2994 IMAGE-HIGH-RES 1-s2.0-S0926860X2400156X-gr4_lrg.jpg https://s3-eu-west-1.amazonaws.com/prod-ucs-content-store-eu-west/content/pii:S0926860X2400156X/HIGHRES/image/jpeg/f4af7a972d55d2734592f53982a03a4f/gr4_lrg.jpg gr4 gr4_lrg.jpg jpg 376249 2189 3076 IMAGE-HIGH-RES 1-s2.0-S0926860X2400156X-fx8_lrg.jpg https://s3-eu-west-1.amazonaws.com/prod-ucs-content-store-eu-west/content/pii:S0926860X2400156X/HIGHRES/image/jpeg/1a2007f17265241f3e43b30ac7b765ac/fx8_lrg.jpg fx8 fx8_lrg.jpg jpg 6826 182 396 IMAGE-HIGH-RES 1-s2.0-S0926860X2400156X-gr1_lrg.jpg https://s3-eu-west-1.amazonaws.com/prod-ucs-content-store-eu-west/content/pii:S0926860X2400156X/HIGHRES/image/jpeg/966abcccaaaeaab240783fd460538a2f/gr1_lrg.jpg gr1 gr1_lrg.jpg jpg 196164 1178 2994 IMAGE-HIGH-RES 1-s2.0-S0926860X2400156X-gr2_lrg.jpg https://s3-eu-west-1.amazonaws.com/prod-ucs-content-store-eu-west/content/pii:S0926860X2400156X/HIGHRES/image/jpeg/a82bac1072ede5244225423157fabe6b/gr2_lrg.jpg gr2 gr2_lrg.jpg jpg 626314 1444 3493 IMAGE-HIGH-RES 1-s2.0-S0926860X2400156X-fx6_lrg.jpg https://s3-eu-west-1.amazonaws.com/prod-ucs-content-store-eu-west/content/pii:S0926860X2400156X/HIGHRES/image/jpeg/a73aaca4addf91b511ebcd61f2bc3445/fx6_lrg.jpg fx6 fx6_lrg.jpg jpg 6357 182 361 IMAGE-HIGH-RES 1-s2.0-S0926860X2400156X-fx7_lrg.jpg https://s3-eu-west-1.amazonaws.com/prod-ucs-content-store-eu-west/content/pii:S0926860X2400156X/HIGHRES/image/jpeg/cb24a56fad3699de078737339eccba4e/fx7_lrg.jpg fx7 fx7_lrg.jpg jpg 6481 180 377 IMAGE-HIGH-RES 1-s2.0-S0926860X2400156X-mmc1.docx https://s3-eu-west-1.amazonaws.com/prod-ucs-content-store-eu-west/content/pii:S0926860X2400156X/mmc1/FP/application/vnd.openxmlformats-officedocument.wordprocessingml.document/2279a81dbda81d5b600293d4710bc304/mmc1.docx mmc1 mmc1.docx docx 1115279 APPLICATION 1-s2.0-S0926860X2400156X-si0001.svg https://s3-eu-west-1.amazonaws.com/prod-ucs-content-store-eu-west/content/pii:S0926860X2400156X/image/svg+xml/75f74e4b65f3cd7a09102ea7a8835f97/si0001.svg si0001 si0001.svg svg 4206 ALTIMG 1-s2.0-S0926860X2400156X-si0002.svg https://s3-eu-west-1.amazonaws.com/prod-ucs-content-store-eu-west/content/pii:S0926860X2400156X/image/svg+xml/587b11d54df8fe6de48697d6f51fa768/si0002.svg si0002 si0002.svg svg 3946 ALTIMG 1-s2.0-S0926860X2400156X-am.pdf am am.pdf pdf 1548982 AAM-PDF https://s3-eu-west-1.amazonaws.com/prod-ucs-content-store-eu-west/content/egi:10JPRS8PSNG/MAIN/application/pdf/f4ebe8d3224951c0f5cb463f5bd4badf/am.pdf APCATA 119712 119712 S0926-860X(24)00156-X 10.1016/j.apcata.2024.119712 Elsevier B.V. Fig. 1 (A) XRD patterns of ZIF-67/ ZIF-8 and (B) their derivatives. Fig. 1 Fig. 2 SEM images of ZIF-8 (A), NC (A1), ZIF-67 (B), Co@NC (B1) and EDS elemental mappings of Co@NC (B2-B5). Fig. 2 Fig. 3 XPS spectra: (A) survey scan, (B) N 1 s and (C) C1s of NC, (D) Co 2p3/2 of Co@NC. Fig. 3 Fig. 4 Effects of (A) catalyst, (B) solvent, (C) alkaline substance (D) time on HMF Oxidation Reaction. (Reaction conditions: 0.05 g samples, 0.5 mmol HMF, 1 mmol alkaline, 25 mL solvent, 130 °C, 0.6 MPa O2, 4 h). Fig. 4 Fig. 5 Effects of temperature and O2 pressure on oxidation reaction, (A,C) NC, (B,D) Co@NC. (Reaction conditions: 0.05 g samples, 0.5 mmol HMF, 1 mmol alkaline, 25 mL solvent, 20 h). Fig. 5 Fig. 6 (A) Differential charge density distribution (B) Bader charge analysis of O2 adsorbed on catalyst, (C) PDOS of NC and Co@NC, the p band center is marked by the black dashed line, and the Fermi level is set as zero. Fig. 6 Fig. 7 (A) The effect of scavengers oxidation of HMF; (B) ESR spectra. Fig. 7 Fig. 8 (A) Reactional pathways, (B) mechanism and (C) Potential Energy profiles of FDCA Generated by aerobic Oxidation of Different Catalysts, the numbers represent reaction barriers. Fig. 8 Scheme 1 Reaction path based on HMF. Scheme 1 Scheme 2 The synthesis process of (A) ZIF-8 and NC, (B) ZIF-67 and Co@NC. Scheme 2 Table 1 Performance comparison of different catalysts in aerobic oxidation of HMF. Table 1 Catalysts Oxidants Reaction conditions HMF Conv. (%) FFCA Select. (%) FDCA Select. (%) Ref.s NCSWC-4-800 TBHP 100 ℃ 92.3 90 1.9 [36] Pd@NC 0.5 MPa O2 100 ℃, 6 h 74.1 60 0.1 [37] FeMo6 O2 100 ℃, 8 h 80 91 -- [6] Pt/HAP air Room temperature 96 70 -- [38] NC 0.6 MPa O2 130 ℃, 20 h 99.9 95 4 This work 2 % AuPd(1:1)/IRA-743 1 MPa O2 100℃, 4 h 100 3.3 93.2 [39] Fe0.6Zr0.4O2 2 MPa O2 160 ℃, 24 h 99.7 -- 60 [40] Ce0.5Fe0.15Zr0.35O2 2 MPa O2 140 ℃, 24 h 99.9 -- 44 [41] Co4Mn1-L, DCA 0.1 MPa O2 85 ℃, 10 h 100 -- 61.8 [42] Co@NC 0.6 MPa O2 130 ℃, 20 h 99.9 2 98 This work Table 2 Catalytic oxidation of different biomass substrates on Co@NC. (Reaction conditions: 0.05 g Co@NC, 0.5 mmol Substrates, 1 mmol K2CO3, 130 °C, 0.6 MPa O2, 24 h). Table 2 Entry Substrates a Products b Conv. (%) Select. (%) 1 Image 1 HMF Image 2 FDCA 99 98 2 Image 3 FH Image 4 FAC 99 99 3 Image 5 FA Image 6 FAC 98 96 4 Image 7 MF Image 8 MFF 97 94 a FH: 2-Furaldehyde, FA: Furfuryl alcohol, MF: 5-Methylfurfural; b FAC: 2-Furoic acid, MFF: 5-Methyl-2-furoic acid. Tunable products of 5-hydroxymethylfurfural oxidation by Zn/Co-ZIF derived catalysts Yingjie Li Writing – review & editing Writing – original draft Methodology Investigation Data curation a Yuanyuan Wang Investigation a Hui Gao Investigation a Zhijie Zhang Investigation a Lungang Chen Methodology Funding acquisition b ⁎ Xiaoyuan Liao Writing – review & editing Supervision Project administration Methodology a ⁎ a College of Chemical Engineering and Materials Science, Tianjin University of Science and Technology, Tianjin, China College of Chemical Engineering and Materials Science, Tianjin University of Science and Technology Tianjin China College of Chemical Engineering and Materials Science, Tianjin University of Science and Technology, Tianjin, China b Key Laboratory of Energy Thermal Conversion and Control of Ministry of Education, School of Energy and Environment, Southeast University, Nanjing 210096, China Key Laboratory of Energy Thermal Conversion and Control of Ministry of Education, School of Energy and Environment, Southeast University Nanjing 210096 China Key Laboratory of Energy Thermal Conversion and Control of Ministry of Education, School of Energy and Environment, Southeast University, Nanjing 210096, China ⁎ Corresponding authors. As a bio-based platform compound, 5-hydroxymethylfurfural (HMF) can be effectively converted into other high value-added derivatives. Here we report two non-noble metal catalysts for the selective oxidation of HMF, NC and Co@NC are easily obtained by pyrolysis of ZIF-8 and ZIF-67, respectively. The NC and Co@NC catalysts oxidized HMF to FFCA (Select. 95 %) and FDCA (Select. 98 %), respectively, using O2 as oxidant. Experimental and theoretical studies show that pyridinic N and graphitic N in NC has high catalytic activity for the oxidation of carbonyl groups in HMF to FFCA, while the synergistic effect of Co-N in Co@NC can completely oxidize HMF to FDCA. DFT calculations show that, compared with NC, the Co@NC containing Co-N exhibits a lower energy barrier during the aerobic oxidation of HMF to FDCA. And Co-N leads to the conversion of electrons from N to Co and promotes the activation of O2 to form O2 -, and then oxidize HMF to FDCA. Interestingly, our reaction system is universal, and could achieve almost 100 % conversion of various furfural substrates to corresponding carboxylic acid. This study may provide a new/highly efficient catalysts for biomass conversion. Graphical Abstract Keywords HMF FDCA Co@NC Selective oxidation Biomass Data availability Data will be made available on request. 1 Introduction 5-Hydroxymethylfurfural (HMF) is recommended as some key platform molecules in the biorefinery process that can be used to generate a series of value-added derivatives [1], such as 2,5-diformylfuran (DFF), 5-hydroxymethyl-2-furancarboxylic acid (HMFCA), 5-formyl-2-furancarboxylic acid (FFCA) and 2,5-furandicarboxylic acid (FDCA) etc. ( Scheme 1). Among them, FFCA has good application prospects in fuels, chemical intermediates and drugs, especially in the preparation of surfactants and resins [2]. Especially, FDCA, prepared by oxidation, is listed by the US Department of Energy as one of the top 12 value-added chemicals in biomass as an effective replacement for terephthalic acid as a polymer monomer for the synthesis of polyethylene furanoate (PEF). The oxidation of HMF has been extensively investigated to date, and various materials have been used. Strong oxidants such as KMnO4 and Cr2O7 2- [3] were used for the oxidation of HMF, obviously this method releases a large amount of waste and is not sustainable. Nowadays, metal oxide and noble metal are two common catalysts studied for alcohol oxidation. The more abundant transition metal oxides such as Co3O4 and ZnO usually have fewer uncoordinated electrons or empty orbitals, making it difficult to coordinate or adsorb organic substrates [4,5], resulting in low catalytic activity, and often requiring the synergy of other noble metals to achieve good catalytic performance. Xu et al. proposed using NMP as solvent and FeMo6 as catalyst to oxidize HMF to FFCA under normal pressure [6]. Zheng et al. reported Pt/CeO2@C as a catalyst for the aerobic oxidation of HMF [7]. Bordeiasu et al. studied the catalytic oxidation of HMF on cobalt-based MOFs, and generated 89 % HMFCA selectivity in the presence of t-BuOOH oxidant and acetonitrile solvent [8]. Saxena et al. developed ultra-low amounts of precious metal nanoparticles loaded on hollow zeolite capsules (MCM-22 and ZSM-5), demonstrating that metal nanoparticles@zeolite can make the conversion of HMF > 90 % [9]. However, the high price of precious metals and the shortage of resources prevent them from being widely used. In recent years, nitrogen-doped carbon (NC) catalysts have been extensively investigated for their excellent performance, possibly due to the different atomic radii and bond lengths of the carbon and nitrogen atoms, resulting in the formation of surface defect sites in the carbon skeleton, which in turn facilitate the reaction through charge transfer [10]. Li et al. established a method for nitric acid to promote the catalytic oxidation of HMF in the presence of nitrogen-doped carbon materials [11]. In particular, the introduction of atomically dispersed metal atoms into the carrier as promoters is a new strategy to improve the catalytic performance of multiphase catalysts, and the nitrozeolite imidazole salt skeleton is an ideal precursor for the preparation of nitrogen-doped carbon-based catalysts [12,13]. Compared with traditional nanomaterials, ZIFs materials do not agglomerate during pyrolysis due to their tunable structure and ordered organic ligands, and the active centers are highly dispersed. This MOF template metal-carbon composite catalyst has been proved to have good application prospects in hydrogenation and aerobic oxidation. Zhao et al. used ZIF-67 as a template to prepare Co-Nx catalyst with excellent hydrogenation performance [14]. In this work, we have prepared low-cost and sustainable NC materials and Co@NC materials by pyrolysis of ZIF-8 and ZIF-67 under Ar, respectively. Among them, Co@NC contains metal Co and CoN4 components. Dispersion of cobalt nanoparticles on n-doped carbon carriers enhanced the catalytic activity and improved the stability of the catalyst. In the oxidation of HMF, NC and Co@NC were obtained by changing the precursor of ZIFs, so as to achieve highly selective generation of different target products FFCA and FDCA. This work would provide support in development of non-noble metal-based efficient and environmental-friendly catalyst for the application in HMF production. 2 Experimental 2.1 Catalysts synthesis As shown in Scheme 2, ZIFs are prepared according to our published procedure [15]: 2.910 g Co (NO3)2•6 H2O was dissolved in 25 mL of methanol as solution A and 6.568 g of 2-methylimidazole was dissolved in 25 mL of methanol as solution B. Then solution A was introduced into solution B and stirred thoroughly to encourage the reaction to occur. After the reaction was complete, the ZIF-67 is obtained after washed with methanol three times and drying and grinding. The synthesis method of ZIF-8 is similar, only the cobalt source is replaced by the zinc source. Then, ZIF-67 and ZIF-8 were pyrolyzed 5 h at 800°C in Ar atmosphere to synthesize Co@NC and NC, respectively. 2.2 Characterization Bruker AXS D8-Focus diffractometer with Cu Kα radiation (Germany) diffractometer was used to record X-ray powder diffraction (XRD) pattern. The XPS analyses were carried out with a Kratos AXIS Supra spectrometer using a monochromatic Al K(alpha) source (15 mA, 15 kV). A field emission microscope (Hitachi FESEM-4800) was used scanning electron microscope (SEM) images. Brunauer-Emmett-Teller (BET) surface areas were obtained by ASAP 2020 plus HD88 at a liquid nitrogen temperature of 77 K, and the pore size was derived from the adsorption branch of the N2 isotherm. Electron spin resonance (ESR) analysis of the catalysts was carried out on a Bruker A300 spectrometer. Temperature programmed desorption (TPD-CO2/NH3) were performed on the Quantachrome TPR Win v3.52, 50 mg samples were pretreated in He (120 mL/min) for 60 min at 300 °C to remove moisture from the catalyst pores, after cooling to 50 °C, purged in CO2 (NH3) stream for 30 min, treated in He for 60 min to remove physically adsorbed gas, then the sample was raised to 800 °C (10 °C/min), the signal by monitored by the TCD. 2.3 Catalytic performance and chemical analysis In a typical reaction, the aerobic oxidation of the HMF takes place in a batch-type Teflon-lined stainless-steel autoclave. The HMF methanol solution (20 mL), catalyst were mixed and sealed in a reaction vessel with O2 as oxidant 0.6 MPa and stirred at reaction temperature until the reaction was complete. Then the reaction kettle was cooled and centrifuged, and the products were analyzed by Agilent 1260 Infinity HPLC apparatus. The experimental results were analyzed according to the following formula: (1) Conv. (%) = n reactant , initial − n reactant , final n reactant , initial × 100 % (2) Select. (%) = n product n reactant , initial − n reactant , final × 100 % 2.4 Computational methods All Density Functional Theory (DFT) calculations were based on the generalized gradient method (GGA) and using the Perdew-Burke-Ernzerhof (PBE) function in the Materials Studio software. The energy cutoff was set to 400 eV. At least 15 Å vacuum layer was applied in z-direction of the slab models, preventing the vertical interactions between slabs. The transition state (TS) between the reactants and their products is determined by the nudge elastic band (NEB) method. 3 Results and discussion 3.1 Characterization 3.1.1 Structure and morphology The XRD profiles of synthesized ZIFs materials including ZIF-8 and ZIF-67 were consistent with previously reported results ( Fig. 1A) [15]. As seen in Fig. 1B, ZIF-8 pyrolysis-derived NC has a broad peak near 2θ = 24° and 44°, corresponding to the (002) plane of graphite carbon and (101) plane [11,16], respectively. The diffraction peak intensity of the (101) surface is low, indicating that sample has condensed in the layer and N atoms are doped in the graphite layer, which proves that NC was prepared successfully and no residual Zn in NC. The XRD pattern of Co@NC is shown in Fig. 1B. The presence of graphite carbon was found at 24°, and the diffraction peaks of metal Co were found at 44.3°, 51.5°, and 76.1°. The SEM images show that the average diameters of the catalysts are about 1 μm (Co@NC) and 240 nm (NC), respectively. In particular, compared to ZIFs ( Fig. 2A,B), there is still some shrinkage morphology of ZIF-67 in the Co@NC obtained after pyrolysis and carbonization (Fig. 2B1), and a polyhedral morphology with concave interior cavities and the rough surface. This is because during pyrolysis, the precursors of ZIFs contract in each direction, which also promotes the increase of surface area, thereby exposing more metal check points and accelerating mass charge transport [17]. The related energy dispersion X-ray spectroscopy (EDX) (Fig. 2B2-B5) shows that Co, N, C are uniformly dispersed, while the morphology of NC is irregular spherical due to the loss of Zn (Fig. 2A1). N2 adsorption/desorption test (Fig. S1) showed that both samples had obvious mesopores. Co@NC had a higher BET surface area (230.4 m2·g−1), while the BET surface area of NC was only 137.1 m2·g−1. The pore size distribution curves confirm that the average pore sizes of Co@NC and NC are 3.7 nm and 4.5 nm, respectively. Obviously, after the ZIFs material was pyrolyzed at high temperature, the two samples still maintained a high specific surface area with mesoporous, and for Co@NC, the high specific area also made most of the Co species well dispersed, which was conducive to exposure and mass transfer. 3.1.2 XPS As shown in Fig. 3A, the XPS survey scan spectrum of all samples showed that C1s peak, N1s peak and O1s peak were observed at 285 eV, 402 eV and 535 eV, respectively, where the O1s peak may be due to adsorbed oxygen or water in the air. And Co@NC sample has a Co2p peak centered on 780 eV. N atoms are particularly important in reactions involving NC catalysts, so N1s high-resolution spectra of NC is exhibited in Fig. 3B, which can be deconvolved into four sub-peaks around 398.4 eV, 400 eV, 401.2 eV and 402 eV, corresponding to pyridinic nitrogen (N1), pyrrolic nitrogen (N2), graphitic nitrogen (N3) and pyridine oxide nitrogen (N4), respectively [18]. And in the C1s deconvolution spectra, subpeaks of sp3 C−C (284.7 eV, C1), C-N (285.8 eV, C2) and graphitic carbon (288.8 eV, C3) were observed (Fig. 3C). The above results show the successful synthesis of nitrogen-doped carbon materials, agreeing with the XRD results [19,20]. In addition, we analyzed the XPS of the spent catalyst NC for analysis (Fig. S2A and Table S1) and found that N1, N2, N3 and N4 peaks are still retained, but pyridinic nitrogen and graphitic nitrogen decreased while pyrrolic nitrogen increased and pyridine oxide nitrogen, indicating that pyridinic nitrogen and graphitic nitrogen are key components in this reaction process [21,22]. Similarly, in order to further analyze the specific composition of Co element in Co@NC sample, the spectra were deconvolved into 3 peaks (Fig. 3D). The subpeak at 778.6 eV is attributable to metallic cobalt (Co0), 780.4 eV to Co-Nx, which is formed by doping the Co2 + species with N, and the peak at 786 eV is generally considered a satellite peak, attributed to Electron-deficient Co species (Co-O/Co-N) [23]. The high-resolution spectra of C1s can be deconvolved into 3 carbon species attributed to C-C (C1), C-N (C2), graphitic carbon (C3) and N1 s were deconvolved in pyridinic nitrogen (N1), pyrrolic nitrogen (N2), graphitic nitrogen (N3), pyridine oxide nitrogen (N4) (Fig. S3). Compared with NC, the N1 peak has a significant positive shift of 0.20 eV, confirming the presence of Co@NC metal pyridine N group, whose π electrons interact strongly with cobalt, preferentially nucleating cobalt at the sp2-N position, reducing the aggregation of cobalt nanoparticles [24], which is consistent with the previous characterization results. Obviously, the presence of Co and N species may be the key factors affecting the reactivity, and we further analyzed the XPS results of Co@NC catalysts before and after the reaction. Interestingly, the content of Co-Nx species decreased sharply from 74.29 % of fresh Co@NC to 26.97 % of Co@NC-re (Fig. S1B and Table S2), so Co-Nx was considered to be the activity check point of HMF catalytic conversion [25]. In addition, there are still four types of nitrogen species before and after the reaction of the Co@NC catalyst, among which pyridinic N (N1) is significantly reduced from 15.49 % to 6.50 % after the reaction (Fig. S3, S4 and Table S3), indicating that pyridine nitrogen plays a certain role in the reaction, which is consistent with the NC catalyst in the previous article, but the generation of FDCA is difficult to achieve only by relying on N species, and it needs to be fully realized by means of the Co-N coordination structure. Electronic interactions between N and embedded Co nanoparticles lead to the conversion of electrons from N to Co [26], forming electron-rich active metal species promotes to the activation of the reactants. Furthermore, CO2-TPD (Fig. S5A) reveals the presence of substantial basic sites on both catalysts, attributed to the Lewis basic sites provided by pyridine N and Co-Nx. Specifically, the desorption peaks observed for the Co@NC between 600 °C and 700 °C are indicative of CO2 interaction with highly basic sites [27]. NH3-TPD (Fig. S5B) reveals that the introduction of Co doping substantially elevates the acid sites of Co@NC. The acid and base sites facilitates the adsorption of alcohol O-H bonds and the activation of aldehydes, consequently enhancing the catalytic oxidation of HMF [28,29]. 3.2 Catalytic performance 3.2.1 Catalyst, solvent, base and reaction times The catalytic activity of different samples was evaluated after oxidizing HMF in methanol for 4 h with O2 as oxidant and K2CO3 as alkoxide. As shown in Fig. 4A, when NC is used as the catalyst, the selectivity of its main product FFCA (Select. % = 86) and FDCA is only about 4 %. However, Co@NC catalyst in the oxidation performance evaluation of HMF, the main product is FDCA (Select. % = 58), and the selectivity of FFCA is 30 %. These data show that NC catalysts can catalyze the oxidation of HMF to FFCA, but its catalytic activity is still insufficient for further oxidation to FDCA, and Co@NC catalysts have a significant effect on the conversion of HMF to FDCA, which may be because the Co-doped NC material enhances the oxidation activity of the catalyst. We optimized the reactions involving Co@NC in greater detail. Firstly, we examined the effects of several solvents. The order of HMF conversion in different solvents is Methanol (40 %) > H2O (38 %) > DMF (35 %) > DMSO (10 %). Specifically, seen in Fig. 4B, in the methanol, the main products of HMF catalytic oxidation are FFCA (Select.% =79) and FDCA (Select.% =16), which are significantly stronger than those in water (FDCA Select.% =7). The main product is DFF and no FDCA in DMSO and DMF. Obviously, methanol is the best choice and reduces the occurrence of side reactions. The reasons for these differences may be due to the different solubility of FDCA and oxygen in different solvents, and its solubility in methanol is higher than that of other solvents, which is highly consistent with previous studies [30]. In this work, when water is used as the solvent, the conversion rate of HMF is close to that of methanol, but the selectivity of its target product is significantly lower than that of methanol, when water is used as the solvent, the purity and selectivity of the FDCA will be affected, which may be due to the formation of its by-product glycolic acid [31]. In addition, the polarity of the solvent also affects the oxidation process of HMF [28,32]. As seen in Fig. 4C, no matter what kind of base is added in the methanol medium, the conversion rate of HMF and the selectivity of FDCA will be significantly improved compared with pure methanol. This may be because the alkali can promote alkoxide formation and C-H bond activation in alcohol oxidation [33], further promoting the generation of FDCA. In addition, the use of alkali can neutralize FDCA and avoid FDCA adsorption on the catalyst surface, affecting the stability of catalyst activity. It is also important to prevent metal leaching formed by carboxylic acids rather than free acids [34,35]. When the weak base NaHCO3 is added, the conversion rate of HMF increases from 40 % to 84 %, and the selectivity of FDCA increases from 16 % to 41 %. When the medium and strong bases K2CO3 and NaOH are added, the conversion rate of HMF can reach 99 %, and the selectivity of FDCA is 58 % and 62 %, respectively. Moreover, Fig. 4D shows the effect of reaction time on the catalytic oxidation of HMF (25 mL methanol, 2K2CO3), during the whole oxidation process, the intermediate of catalytic conversion was always HMFCA, and no DFF was found, which indicated that the aldehyde group was more prone to oxidation than the hydroxyl group and revealed that the reaction path is HMF-HMFCA-FFCA-FDCA. In the initial stage of the reaction, HMF is rapidly converted into HMFCA and FFCA, and the conversion rate of HMF can reach 99 % in about 2 h. Between 3 and 20 h, FFCA and HMFCA continued to decrease to around 2 %, and the selectivity of FDCA increases rapidly from 45 % to 98 %, which may be because the generated FFCA is further converted into FDCA. Through the screening and optimization of the reaction parameters, it is found that under the conditions of catalyst dosage of 5 mg, methanol as solvent, temperature of 130 ℃, 0.6 MPa O2, and reaction time of 20 h, the Co@NC catalyst has high selective catalytic oxidation of HMF to prepare FDCA efficiency. At the same time, we compared the reaction process of NC catalyst under the same conditions, the reaction path is the same as that of Co@NC catalyst, but the reaction product is FFCA, and the selectivity in 20 h is 95 % (Fig. S6). FFCA can be detected in the reaction process involving both catalysts, which indicates that HMFCA is rapidly converted to FFCA, and trace amounts of FDCA can be detected in the reaction involving the NC catalyst, which indicates that the conversion of FFCA to FDCA is slow and painstaking, whereas basically all of FFCA is converted to FDCA in the reaction process involving the Co@NC catalyst. 3.2.2 Temperature and O2 pressure The reaction temperature is a necessary condition to affect the activity of the catalyst, so choosing the appropriate reaction degree can significantly increase the reaction rate and improve the selectivity of the target product. As shown in Fig. 5A,B, with the increase of temperature, the conversion rate of HMF and the selectivity of products are significantly improved. Obviously, the increase in temperature is conducive to the oxidation of HMF, but the high temperature will cause deep oxidation and polycondensation of HMF. In this reaction evaluation, the selectivity of the target product decreases after the reaction temperature rises to 150 °C. Therefore, the most suitable temperature we choose is 130 °C. On the other hand, O2 pressure also has a certain impact on the oxidation process. As shown in the Fig. 5C,D, the selective oxidation of HMF cannot occur in the atmosphere of an oxygen-free source gas. The increase of O2 pressure will increase the dissolved oxygen content in the reaction solution, thereby promoting the conversion of intermediate products to the final product FDCA, but the increase of O2 pressure blindly decreases the target product. This is because in the reaction process, in addition to the reaction of the target product, other oxidation side reactions will also occur, such as the open epoxidation of furan rings to generate CO or CO2. The increase of dissolved oxygen will also lead to the acceleration of the side reaction and compete with the main reaction. Overall, the oxidation performance of these two catalysts for the conversion of HMF to FFCA and FDCA was better than that of previous studies ( Table 1). NC can achieve the oxidation effect of noble metal catalysts such as Pd@NC and Pt/HAP in previous studies, Co@NC can match the effect of polymetallic synergistic catalysts (2 % AuPd (1:1)/IRA-743, Ce0.5Fe0.15Zr0.35O2). In addition, reusability tests (Fig. S7) showed that NC and Co@NC maintained excellent catalytic performance after four consecutive runs, indicating that our catalysts were stable. 3.2.3 DFT calculation A series of DFT calculations were performed to understand the nature of the catalytic activity of the two catalysts. As seen in Fig. S8, pyridinic nitrogen has the highest adsorption energy for HMF (Eads= −0.60 eV), followed by graphite nitrogen (Eads= −0.54 eV) and pyrrole nitrogen (Eads= −0.24 eV) in NC adsorption configuration, and the adsorption energy of Co@NC to HMF is much higher than that of NC (ΔEads= 4.9 eV > 0.6 eV), indicating that the material containing Co-N is more conducive to the adsorption of HMF, which further confirms that the active sites of the two catalysts for catalytic oxidation of HMF. The differential charge density distributions analysis ( Fig. 6A) were also used to study the electronic properties and synergistic interactions, and both NC, Co@NC exhibit symmetric charge distribution. The charge accumulation in the Co@NC model structure is mainly concentrated around the Co atom, which is formed by the electron transfer between Co and coordination N, so that the Co active sites generates more electron-rich catalytic active sites, which is conducive to the adsorption and activation of O2 and generate superoxide radicals [43]. And Bader charge analysis (Fig. 6B) shows that the electron transfer from Co@NC to O2 is stronger (0.48 e-) compared to NC (0.30 e-), indicating that the embedded cobalt nanoparticles and doped nitrogen synergistically promote the activation of preabsorbed O2, and electrons are transferred from the Co 3d orbital to the 2P antibound orbital of adsorb O2, and generate superoxide radicals convert HMF to FDCA [19,44]. Fig. 6C shows the projected densities of states (PDOS) for catalysts, it is clear that the center of the p-band of Co@NC (-4.7896) has shifted up by 0.59 eV compared to NC (-5.3794), higher p-band center and the adsorbed oxygen intermediate occupy fewer antibound states [45], so Co@NC is more conducive to electron transfer, prefer to activate the reactants. We further carried out inhibition experiments to determine reactive oxygen species of HMF oxidation. Fig. 7A shows that, 1,4-benzoquinone scavenger could significantly suppress HMF oxidation for both reactions. EPR (Fig. 7B) further confirmed that O2 - is the main reactive oxygen species [46]. It can be found that the O2 - produced by Co@NC are significantly more than NC, which maybe the main reason of Co@NC could archived completely oxidization. 3.2.4 Reaction mechanism In summary, NC and Co@NC catalysts catalyzed the oxidation of HMF to produce different target products due to the embedding of Co nanoparticles in N-doped carbon. The surface adsorption properties and catalytic active sites of NC and Co@NC catalysts were systematically characterized and analyzed based above results, the reaction mechanisms of the two catalytic oxidation processes are depicted in Fig. 8A. Pyridinic nitrogen and graphitic N in NC can be used as a catalytic active sites for the selective oxidation of HMF to FFCA [10]. Among them, the Lewis base sites provided by pyridinic N can effectively oxidize the -OH of HMF to generate HMFCA, while when graphite N forms three σ-bonds and one π-bond with neighboring carbon atoms, an unpaired electron is formed on the p-orbital, which attracts O2 on the surface of NC. After accepting unpaired electrons, reactive oxygen species will be formed, and the hydroxyl group of HMFCA will be oxidized to the aldehyde group through the free radical mechanism to generate the final FFCA [47,48]. Comparatively, for Co@NC catalyst, its catalytic performance can be attributed to the coordination of CoNx to change the electronic state of Co and the synergistic effect of surrounding N atoms, in which Co-N plays a more important role in the catalytic conversion of HMF-FDCA. O2 is partially activated at the C-N sites [13], and then mostly O2 is at the Co sites, due to the rapid activation of electron transfer between Co-N to generate a large amount of O2 -, further oxidizing HMF to FDCA. Then, we propose the following possible reaction paths (Co@NC as an example), the aldehyde side chain of HMF forms a diol intermediate on the catalyst surface through adsorbed OH- in the first phase, and then oxidative dehydrogenation generates HMFCA. In the second phase, O2 is activated into superoxide on the Co-N structure, and then with the assistance of OH-, the β-C-H of the alcohol side group of HMFCA is extracted to generate an aldehyde (Fig. 8B) [49,50]. Obviously, O2 can act as an electron scavenger to remove protons from intermediates during the reaction and the oxidation process of FFCA-FDCA is similar to the first stage, with further oxidation. In particular, the barrier of FFCA-FDCA is 0.81 eV when Co@NC as a catalyst, while the barrier of NC as a catalyst is 1.84 eV (Fig. 8C), the higher potential causes NC to be unable to further oxidize FFCA to FDCA, and Co@NC can, which is also consistent with the results of superoxide radicals formed by the two catalysts, which also ensures that we can selectively oxidize HMF to generate FFCA (Select. 95 %, NC) and FDCA (Select. 98 %, Co@NC). 3.3 Universality of this reaction system The selective activation of the target bond of biomass-derived furfural or furfuryl alcohol is a huge challenge for biomass upgrading and inspired by Co@NC high catalytic activity for the oxidation of HMF to FDCA, we further investigated the catalytic oxidation of various substrates (such as FH, FA, MF) under the same reaction conditions ( Table 2). Obviously, Co@NC shows a good substrate suitability, the four substrates have been effectively catalyzed and oxidized, and the conversion rate has reached more than 97 %, and the –CO/–OH of the substrate can be further converted into –COOH, and the selectivity of the corresponding target product is more than 95 %, which shown that Co@NC catalyst has good universality for the catalytic activity of furfural/furfuryl alcohol activation –CO/–OH targeting to generate carboxyl group, which is conducive to further utilization in biomass conversion. 4 Conclusions In summary, two simple/non-noble metal-based catalysts were successfully derived from the pyrolysis of Zn/Co-ZIF, and the target product of HMF oxidation can be selectively obtained only by changing the ZIFs precursor. Under the optimal reaction conditions, the derived catalysts NC and Co@NC of ZIF-8 and ZIF-67 oxidized HMF to generate FFCA (Select. 95 %) and FDCA (Select. 98 %), respectively. The research analysis shows that pyridine nitrogen and graphite nitrogen in NC and Co@NC have a good preference for the conversion of HMF to FFCA, while the doping of Co-N structure in Co@NC can break the reaction barrier of FFCA-FDCA, further improve the catalyst performance, and generate FDCA with high selectivity. This is because the introduction of Co-N structure more effectively promotes the activation of O2 and generates more O2 -. In addition, the reaction system is versatile and can achieve almost 100% conversion of various furfural substrates to corresponding carboxylic acids. CRediT authorship contribution statement Xiaoyuan Liao: Writing – review & editing, Supervision, Project administration, Methodology. Lungang Chen: Methodology, Funding acquisition. Zhijie Zhang: Investigation. Yuanyuan Wang: Investigation. Hui Gao: Investigation. Yingjie Li: Writing – review & editing, Writing – original draft, Methodology, Investigation, Data curation. Declaration of Competing Interest The authors declare that they have no known competing financial interests or personal relationships that could have appeared to influence the work reported in this paper. Acknowledgements X. Liao would like to thank Dr. Yan-Yan Chen (Work in State Key Laboratory of Coal Conversion, Institute of Coal Chemistry, Chinese Academy of Sciences) provide the DFT calculation software, and technical support. Appendix A Supporting information Supplementary data associated with this article can be found in the online version at doi:10.1016/j.apcata.2024.119712. Appendix A Supplementary material Supplementary material References [1] H. Xu X. Li W. Hu Z. Yu H. Zhou Y. Zhu L. Lu C. Si Research progress of highly efficient noble metal catalysts for the oxidation of 5-hydroxymethylfurfural ChemSusChem 15 2022 e202200352 H. Xu, X. Li, W. Hu, Z. Yu, H. Zhou, Y. Zhu, L. Lu, C. Si, Research Progress of Highly Efficient Noble Metal Catalysts for the Oxidation of 5-Hydroxymethylfurfural, ChemSusChem, 15 (2022) e202200352. [2] D. Gao F. Han G.I. Waterhouse Y. Li L. Zhang A highly efficient iron phthalocyanine-intercalated CuFe-LDH catalyst for the selective oxidation of 5-hydroxymethylfurfural to 5-formyl-2-furanic acid Catal. Commun. 173 2023 106561 D. Gao, F. Han, G.I. Waterhouse, Y. Li, L. Zhang, A highly efficient iron phthalocyanine-intercalated CuFe-LDH catalyst for the selective oxidation of 5-hydroxymethylfurfural to 5-formyl-2-furanic acid, Catalysis Communications, 173 (2023) 106561. [3] T.S. Hansen I. Sádaba E.J. García-Suárez A. Riisager Cu catalyzed oxidation of 5-hydroxymethylfurfural to 2, 5-diformylfuran and 2, 5-furandicarboxylic acid under benign reaction conditions Appl. Catal. A: Gen. 456 2013 44 50 T.S. Hansen, I. Sádaba, E.J. García-Suárez, A. Riisager, Cu catalyzed oxidation of 5-hydroxymethylfurfural to 2, 5-diformylfuran and 2, 5-furandicarboxylic acid under benign reaction conditions, Applied Catalysis A: General, 456 (2013) 44-50. [4] Y. Wang Z. Li P. Zhang Y. Pan Y. Zhang Q. Cai S.R.P. Silva J. Liu G. Zhang X. Sun Flexible carbon nanofiber film with diatomic Fe-Co sites for efficient oxygen reduction and evolution reactions in wearable zinc-air batteries Nano Energy 87 2021 106147 Y. Wang, Z. Li, P. Zhang, Y. Pan, Y. Zhang, Q. Cai, S.R.P. Silva, J. Liu, G. Zhang, X. Sun, Flexible carbon nanofiber film with diatomic Fe-Co sites for efficient oxygen reduction and evolution reactions in wearable zinc-air batteries, Nano Energy, 87 (2021) 106147. [5] H. Chen L. Lin Y. Li R. Wang Z. Gong Y. Cui Y. Li Y. Liu X. Zhao W. Huang CO and H2 activation over g-ZnO layers and w-ZnO (0001) ACS Catal. 9 2018 1373 1382 H. Chen, L. Lin, Y. Li, R. Wang, Z. Gong, Y. Cui, Y. Li, Y. Liu, X. Zhao, W. Huang, CO and H2 activation over g-ZnO layers and w-ZnO (0001), ACS Catalysis, 9 (2018) 1373-1382. [6] J. Xu Z. Zhu Z. Yuan T. Su Y. Zhao W. Ren Z. Zhang H. Lü Selective oxidation of 5-hydroxymethylfurfural to 5-formyl-2-furancar-boxylic acid over a Fe-Anderson type catalyst J. Taiwan Inst. Chem. Eng. 104 2019 8 15 J. Xu, Z. Zhu, Z. Yuan, T. Su, Y. Zhao, W. Ren, Z. Zhang, H. Lü, Selective oxidation of 5-hydroxymethylfurfural to 5-formyl-2-furancar-boxylic acid over a Fe-Anderson type catalyst, Journal of the Taiwan Institute of Chemical Engineers, 104 (2019) 8-15. [7] X. Zheng C. Li H. Mao X. Liu Y. Guo Y. Wang Boosting 2, 5-Furandicarboxylic acid production via coating carbon over CeO2 in a Pt catalyst Ind. Crops Prod. 186 2022 115168 X. Zheng, C. Li, H. Mao, X. Liu, Y. Guo, Y. Wang, Boosting 2, 5-Furandicarboxylic acid production via coating carbon over CeO2 in a Pt catalyst, Industrial Crops and Products, 186 (2022) 115168. [8] M. Bordeiasu A. Ejsmont J. Goscianska B. Cojocaru V.I. Parvulescu S.M. Coman Catalytic oxidation of biomass-derived 5-hydroxymethylfurfural to 5-hydroxymethyl-2-furancarboxylic acid by Co-based MOFs Appl. Catal. A: Gen. 657 2023 119147 M. Bordeiasu, A. Ejsmont, J. Goscianska, B. Cojocaru, V.I. Parvulescu, S.M. Coman, Catalytic oxidation of biomass-derived 5-hydroxymethylfurfural to 5-hydroxymethyl-2-furancarboxylic acid by Co-based MOFs, Applied Catalysis A: General, 657 (2023) 119147. [9] S. Saxena D. Yadaw K. Tiwari V. Venkatesh S. Verma R.G.S. Pala S. Sivakumar Hollow zeolites encapsulating ultra-low noble metal nanoparticles for HMF oxidation Catal. Lett. 151 2020 921 931 S. Saxena, D. Yadaw, K. Tiwari, V. Venkatesh, S. Verma, R.G.S. Pala, S. Sivakumar, Hollow Zeolites Encapsulating Ultra-Low Noble Metal Nanoparticles for HMF Oxidation, Catalysis Letters, 151 (2020) 921-931. [10] K.T.V. Rao Y. Hu Z. Yuan Y. Zhang C.C. Xu Nitrogen-doped carbon: A metal-free catalyst for selective oxidation of crude 5-hydroxymethylfurfural obtained from high fructose corn syrup (HFCS-90) to 2, 5-furandicarboxylic acid (FDCA) Chem. Eng. J. 404 2021 127063 K.T.V. Rao, Y. Hu, Z. Yuan, Y. Zhang, C.C. Xu, Nitrogen-doped carbon: A metal-free catalyst for selective oxidation of crude 5-hydroxymethylfurfural obtained from high fructose corn syrup (HFCS-90) to 2, 5-furandicarboxylic acid (FDCA), Chemical Engineering Journal, 404 (2021) 127063. [11] Y. Ren Z. Yuan K. Lv J. Sun Z. Zhang Q. Chi Selective and metal-free oxidation of biomass-derived 5-hydroxymethylfurfural to 2,5-diformylfuran over nitrogen-doped carbon materials Green. Chem. 20 2018 4946 4956 Y. Ren, Z. Yuan, K. Lv, J. Sun, Z. Zhang, Q. Chi, Selective and metal-free oxidation of biomass-derived 5-hydroxymethylfurfural to 2,5-diformylfuran over nitrogen-doped carbon materials, Green Chemistry, 20 (2018) 4946-4956. [12] W. Yao C. Hu Y. Zhang H. Li F. Wang K. Shen L. Chen Y. Li Hierarchically ordered porous carbon with atomically dispersed cobalt for oxidative esterification of furfural Ind. Chem. Mater. 1 2023 106 116 W. Yao, C. Hu, Y. Zhang, H. Li, F. Wang, K. Shen, L. Chen, Y. Li, Hierarchically ordered porous carbon with atomically dispersed cobalt for oxidative esterification of furfural, Industrial Chemistry & Materials, 1 (2023) 106-116. [13] Y. Feng W. Jia G. Yan X. Zeng J. Sperry B. Xu Y. Sun X. Tang T. Lei L. Lin Insights into the active sites and catalytic mechanism of oxidative esterification of 5-hydroxymethylfurfural by metal-organic frameworks-derived N-doped carbon J. Catal. 381 2020 570 578 Y. Feng, W. Jia, G. Yan, X. Zeng, J. Sperry, B. Xu, Y. Sun, X. Tang, T. Lei, L. Lin, Insights into the active sites and catalytic mechanism of oxidative esterification of 5-hydroxymethylfurfural by metal-organic frameworks-derived N-doped carbon, J. Catal., 381 (2020) 570-578. [14] W. Gong Y. Lin C. Chen M. Al-Mamun H.S. Lu G. Wang H. Zhang H. Zhao Nitrogen-doped carbon nanotube confined Co–nx sites for selective hydrogenation of biomass-derived compounds Adv. Mater. 31 2019 1808341 W. Gong, Y. Lin, C. Chen, M. Al-Mamun, H.S. Lu, G. Wang, H. Zhang, H. Zhao, Nitrogen-doped carbon nanotube confined Co–nx sites for selective hydrogenation of biomass-derived compounds, Adv. Mater., 31 (2019) 1808341. [15] M. Zhang S. Ye J. Wang K. Yu J. Cao G. Li X. Liao In situ growth zeolite imidazole framework materials on chitosan for greatly enhanced antibacterial effect Int. J. Biol. Macromol. 186 2021 639 648 M. Zhang, S. Ye, J. Wang, K. Yu, J. Cao, G. Li, X. Liao, In situ growth zeolite imidazole framework materials on chitosan for greatly enhanced antibacterial effect, Int. J. Biol. Macromol., 186 (2021) 639-648. [16] C.V. Nguyen Y.-T. Liao T.-C. Kang J.E. Chen T. Yoshikawa Y. Nakasaka T. Masuda K.C.W. Wu A metal-free, high nitrogen-doped nanoporous graphitic carbon catalyst for an effective aerobic HMF-to-FDCA conversion Green. Chem. 18 2016 5957 5961 C.V. Nguyen, Y.-T. Liao, T.-C. Kang, J.E. Chen, T. Yoshikawa, Y. Nakasaka, T. Masuda, K.C.W. Wu, A metal-free, high nitrogen-doped nanoporous graphitic carbon catalyst for an effective aerobic HMF-to-FDCA conversion, Green Chemistry, 18 (2016) 5957-5961. [17] G. Chen R. Lu C. Li J. Yu X. Li L. Ni Q. Zhang G. Zhu S. Liu J. Zhang Hierarchically porous carbons with highly curved surfaces for hosting single metal FeN4 sites as outstanding oxygen reduction catalysts Adv. Mater. 2023 2300907 G. Chen, R. Lu, C. Li, J. Yu, X. Li, L. Ni, Q. Zhang, G. Zhu, S. Liu, J. Zhang, Hierarchically Porous Carbons with Highly Curved Surfaces for Hosting Single Metal FeN4 Sites as Outstanding Oxygen Reduction Catalysts, Adv. Mater., (2023) 2300907. [18] L. Zhang Z. Su F. Jiang L. Yang J. Qian Y. Zhou W. Li M. Hong Highly graphitized nitrogen-doped porous carbon nanopolyhedra derived from ZIF-8 nanocrystals as efficient electrocatalysts for oxygen reduction reactions Nanoscale 6 2014 6590 6602 L. Zhang, Z. Su, F. Jiang, L. Yang, J. Qian, Y. Zhou, W. Li, M. Hong, Highly graphitized nitrogen-doped porous carbon nanopolyhedra derived from ZIF-8 nanocrystals as efficient electrocatalysts for oxygen reduction reactions, Nanoscale, 6 (2014) 6590-6602. [19] C. Xie L. Lin L. Huang Z. Wang Z. Jiang Z. Zhang B. Han Zn-N(x) sites on N-doped carbon for aerobic oxidative cleavage and esterification of C(CO)-C bonds Nat. Commun. 12 2021 4823 C. Xie, L. Lin, L. Huang, Z. Wang, Z. Jiang, Z. Zhang, B. Han, Zn-N(x) sites on N-doped carbon for aerobic oxidative cleavage and esterification of C(CO)-C bonds, Nat Commun, 12 (2021) 4823. [20] C. Xu H. Wang Y. Shang B. Li D. Yu Y. Wang Highly efficient Cd(Ⅱ) removal using 3D N-doped carbon derived from MOFs: Performance and mechanisms J. Hazard. Mater. 436 2022 129149 C. Xu, H. Wang, Y. Shang, B. Li, D. Yu, Y. Wang, Highly efficient Cd(Ⅱ) removal using 3D N-doped carbon derived from MOFs: Performance and mechanisms, J. Hazard. Mater., 436 (2022) 129149. [21] D. Liu K. Li L. Zhou J. Lei L. Wang J. Zhang Y. Liu N, O co-doping enhanced the ability of carbon/Fe composites for peroxymonosulfate activation to degrade sulfadiazine: the advantages of nitrate saturated MOFs as precursors Sep. Purif. Technol. 314 2023 123556 D. Liu, K. Li, L. Zhou, J. Lei, L. Wang, J. Zhang, Y. Liu, N, O co-doping enhanced the ability of carbon/Fe composites for peroxymonosulfate activation to degrade sulfadiazine: The advantages of nitrate saturated MOFs as precursors, Separation and Purification Technology, 314 (2023) 123556. [22] D. Guo R. Shibuya C. Akiba S. Saji T. Kondo J. Nakamura Active sites of nitrogen-doped carbon materials for oxygen reduction reaction clarified using model catalysts Science 351 2016 361 365 D. Guo, R. Shibuya, C. Akiba, S. Saji, T. Kondo, J. Nakamura, Active sites of nitrogen-doped carbon materials for oxygen reduction reaction clarified using model catalysts, Science, 351 (2016) 361-365. [23] L. Yu S. Kasipandi H. Chen Y. Li X. Ma Z. Wen Y. Li N-Doped carbon nanotube encapsulated cobalt for efficient oxidative esterification of 5-hydroxymethylfurfural React. Chem. Eng. 7 2022 1191 1198 L. Yu, S. Kasipandi, H. Chen, Y. Li, X. Ma, Z. Wen, Y. Li, N-Doped carbon nanotube encapsulated cobalt for efficient oxidative esterification of 5-hydroxymethylfurfural, Reaction Chemistry & Engineering, 7 (2022) 1191-1198. [24] K.-k Sun S.-j Chen Z.-l Li G.-p Lu C. Cai Synthesis of a ZIF-derived hollow yolk-shell Co@CN catalyst for the oxidative esterification of 5-hydroxymethylfurfural Green. Chem. 21 2019 1602 1608 K.-k Sun, S.-j Chen, Z.-l Li, G.-p Lu, C. Cai, Synthesis of a ZIF-derived hollow yolk-shell Co@CN catalyst for the oxidative esterification of 5-hydroxymethylfurfural, Green Chemistry, 21 (2019) 1602-1608. [25] H. Liu N. Ding J. Wei X. Tang X. Zeng Y. Sun T. Lei H. Fang T. Li L. Lin Oxidative esterification of 5-hydroxymethylfurfural with an N-doped carbon-supported CoCu bimetallic catalyst ChemSusChem 13 2020 4151 4158 H. Liu, N. Ding, J. Wei, X. Tang, X. Zeng, Y. Sun, T. Lei, H. Fang, T. Li, L. Lin, Oxidative Esterification of 5-Hydroxymethylfurfural with an N-doped Carbon-supported CoCu Bimetallic Catalyst, ChemSusChem, 13 (2020) 4151-4158. [26] J. Wu M. Jin Y. Li J. Zhao T. Wang Y. Xie L. Liu C. Wang F. Li Earth-abundant Co nanoparticles encapsulated in N-doped hollow carbon sphere for highly selective hydrodeoxygenation of biomass-derived vanillin Chem. Eng. J. 463 2023 142472 J. Wu, M. Jin, Y. Li, J. Zhao, T. Wang, Y. Xie, L. Liu, C. Wang, F. Li, Earth-abundant Co nanoparticles encapsulated in N-doped hollow carbon sphere for highly selective hydrodeoxygenation of biomass-derived vanillin, Chemical Engineering Journal, 463 (2023) 142472. [27] G. Li H. Zhang X. Yu Z. Lei F. Yin X. He Highly efficient Co/NC catalyst derived from ZIF-67 for hydrogen generation through ammonia decomposition Int. J. Hydrogen Energy 47 2022 12882 12892 G. Li, H. Zhang, X. Yu, Z. Lei, F. Yin, X. He, Highly efficient Co/NC catalyst derived from ZIF-67 for hydrogen generation through ammonia decomposition, Int. J. Hydrogen Energy, 47 (2022) 12882-12892. [28] D.J. Aranha P.R. Gogate A review on green and efficient synthesis of 5-hydroxymethylfurfural (HMF) and 2,5-furandicarboxylic acid (FDCA) from sustainable biomass Ind. Eng. Chem. Res. 62 2023 3053 3078 D.J. Aranha, P.R. Gogate, A Review on Green and Efficient Synthesis of 5-Hydroxymethylfurfural (HMF) and 2,5-Furandicarboxylic Acid (FDCA) from Sustainable Biomass, Industrial & Engineering Chemistry Research, 62 (2023) 3053-3078. [29] Y. Lin G.-P. Lu X. Zhao X. Cao L. Yang B. Zhou Q. Zhong Z. Chen Porous cobalt@ N-doped carbon derived from chitosan for oxidative esterification of 5-Hydroxymethylfurfural: the roles of zinc in the synthetic and catalytic process Mol. Catal. 482 2020 110695 Y. Lin, G.-P. Lu, X. Zhao, X. Cao, L. Yang, B. Zhou, Q. Zhong, Z. Chen, Porous cobalt@ N-doped carbon derived from chitosan for oxidative esterification of 5-Hydroxymethylfurfural: The roles of zinc in the synthetic and catalytic process, Molecular Catalysis, 482 (2020) 110695. [30] G. Sampath K. Srinivasan Remarkable catalytic synergism of alumina, metal salt and solvent for conversion of biomass sugars to furan compounds Appl. Catal. A: Gen. 533 2017 75 80 G. Sampath, K. Srinivasan, Remarkable catalytic synergism of alumina, metal salt and solvent for conversion of biomass sugars to furan compounds, Applied Catalysis A: General, 533 (2017) 75-80. [31] D.J. Aranha P.R. Gogate A review on green and efficient synthesis of 5-hydroxymethylfurfural (HMF) and 2, 5-furandicarboxylic acid (FDCA) from sustainable biomass Ind. Eng. Chem. Res. 62 2023 3053 3078 D.J. Aranha, P.R. Gogate, A Review on Green and Efficient Synthesis of 5-Hydroxymethylfurfural (HMF) and 2, 5-Furandicarboxylic Acid (FDCA) from Sustainable Biomass, Industrial & Engineering Chemistry Research, 62 (2023) 3053-3078. [32] T. Tamiji A. Nezamzadeh-Ejhieh Electrocatalytic behavior of AgBr NPs as modifier of carbon past electrode in the presence of methanol and ethanol in aqueous solution: a kinetic study J. Taiwan Inst. Chem. Eng. 104 2019 130 138 T. Tamiji, A. Nezamzadeh-Ejhieh, Electrocatalytic behavior of AgBr NPs as modifier of carbon past electrode in the presence of methanol and ethanol in aqueous solution: a kinetic study, Journal of the Taiwan Institute of Chemical Engineers, 104 (2019) 130-138. [33] G. Chen L. Wu H. Fan B.-g Li Highly efficient two-step synthesis of 2,5-furandicarboxylic acid from fructose without 5-hydroxymethylfurfural (HMF) separation: in situ oxidation of HMF in alkaline aqueous H2O/DMSO mixed solvent under mild conditions Ind. Eng. Chem. Res. 57 2018 16172 16181 G. Chen, L. Wu, H. Fan, B.-g Li, Highly Efficient Two-Step Synthesis of 2,5-Furandicarboxylic Acid from Fructose without 5-Hydroxymethylfurfural (HMF) Separation: In Situ Oxidation of HMF in Alkaline Aqueous H2O/DMSO Mixed Solvent under Mild Conditions, Industrial & Engineering Chemistry Research, 57 (2018) 16172-16181. [34] Z. Bin C. Xueshan X. Jiaojiao Z. Cunshan Alkaline ionic liquid modified Pd/C catalyst as an efficient catalyst for oxidation of 5-hydroxymethylfurfural J. Chem. 2018 2018 1 9 Z. Bin, C. Xueshan, X. Jiaojiao, Z. Cunshan, Alkaline Ionic Liquid Modified Pd/C Catalyst as an Efficient Catalyst for Oxidation of 5-Hydroxymethylfurfural, Journal of Chemistry, 2018 (2018) 1-9. [35] H. Zhang Y. Wang Q. Zhang B. Gu Q. Tang Q. Cao K. Wei W. Fang Synergy in magnetic Ni Co1O oxides enables base-free selective oxidation of 5-hydroxymethylfurfural on loaded Au nanoparticles J. Energy Chem. 78 2023 526 536 H. Zhang, Y. Wang, Q. Zhang, B. Gu, Q. Tang, Q. Cao, K. Wei, W. Fang, Synergy in magnetic Ni Co1O oxides enables base-free selective oxidation of 5-hydroxymethylfurfural on loaded Au nanoparticles, Journal of Energy Chemistry, 78 (2023) 526-536. [36] J. Zhu C. Yao A. Maity J. Xu T. Zhan W. Liu M. Sun S. Wang V. Polshettiwar H. Tan Nitrogen doped carbon spheres with wrinkled cages for the selective oxidation of 5-hydroxymethylfurfural to 5-formyl-2-furancarboxylic acid Chem. Commun. (Camb.) 57 2021 2005 2008 J. Zhu, C. Yao, A. Maity, J. Xu, T. Zhan, W. Liu, M. Sun, S. Wang, V. Polshettiwar, H. Tan, Nitrogen doped carbon spheres with wrinkled cages for the selective oxidation of 5-hydroxymethylfurfural to 5-formyl-2-furancarboxylic acid, Chem Commun (Camb), 57 (2021) 2005-2008. [37] G. Lv Z. Zhang S. Liu F. Tao J. Wang Y. Meng Y. Yang Atom level revelation of the synergistic effect between Pd and Au atoms in PdAu nanoalloy catalyst for aerobic oxidation of 5-hydroxymethylfurfural Chem. Eng. J. 453 2023 139816 G. Lv, Z. Zhang, S. Liu, F. Tao, J. Wang, Y. Meng, Y. Yang, Atom level revelation of the synergistic effect between Pd and Au atoms in PdAu nanoalloy catalyst for aerobic oxidation of 5-hydroxymethylfurfural, Chemical Engineering Journal, 453 (2023) 139816. [38] Z. Chen H. Zhou F. Kong M. Wang Piezocatalytic oxidation of 5-hydroxymethylfurfural to 5-formyl-2-furancarboxylic acid over Pt decorated hydroxyapatite Appl. Catal. B: Environ. 309 2022 121281 Z. Chen, H. Zhou, F. Kong, M. Wang, Piezocatalytic oxidation of 5-hydroxymethylfurfural to 5-formyl-2-furancarboxylic acid over Pt decorated hydroxyapatite, Applied Catalysis B: Environmental, 309 (2022) 121281. [39] C.A. Antonyraj N.T.T. Huynh S.-K. Park S. Shin Y.J. Kim S. Kim K.-Y. Lee J.K. Cho Basic anion-exchange resin (AER)-supported Au-Pd alloy nanoparticles for the oxidation of 5-hydroxymethyl-2-furfural (HMF) into 2,5-furan dicarboxylic acid (FDCA) Appl. Catal. A: Gen. 547 2017 230 236 C.A. Antonyraj, N.T.T. Huynh, S.-K. Park, S. Shin, Y.J. Kim, S. Kim, K.-Y. Lee, J.K. Cho, Basic anion-exchange resin (AER)-supported Au-Pd alloy nanoparticles for the oxidation of 5-hydroxymethyl-2-furfural (HMF) into 2,5-furan dicarboxylic acid (FDCA), Applied Catalysis A: General, 547 (2017) 230-236. [40] D. Yan J. Xin Q. Zhao K. Gao X. Lu G. Wang S. Zhang Fe-Zr-O catalyzed base-free aerobic oxidation of 5-HMF to 2, 5-FDCA as a bio-based polyester monomer Catal. Sci. Technol. 8 2018 164 175 D. Yan, J. Xin, Q. Zhao, K. Gao, X. Lu, G. Wang, S. Zhang, Fe-Zr-O catalyzed base-free aerobic oxidation of 5-HMF to 2, 5-FDCA as a bio-based polyester monomer, Catalysis Science & Technology, 8 (2018) 164-175. [41] D. Yan J. Xin C. Shi X. Lu L. Ni G. Wang S. Zhang Base-free conversion of 5-hydroxymethylfurfural to 2, 5-furandicarboxylic acid in ionic liquids Chem. Eng. J. 323 2017 473 482 D. Yan, J. Xin, C. Shi, X. Lu, L. Ni, G. Wang, S. Zhang, Base-free conversion of 5-hydroxymethylfurfural to 2, 5-furandicarboxylic acid in ionic liquids, Chemical Engineering Journal, 323 (2017) 473-482. [42] H. Zhou H. Xu Y. Liu Aerobic oxidation of 5‑hydroxymethylfurfural to 2,5-furandicarboxylic acid over Co/Mn-lignin coordination complexes-derived catalysts Appl. Catal. B: Environ. 244 2019 965 973 H. Zhou, H. Xu, Y. Liu, Aerobic oxidation of 5‑hydroxymethylfurfural to 2,5-furandicarboxylic acid over Co/Mn-lignin coordination complexes-derived catalysts, Applied Catalysis B: Environmental, 244 (2019) 965-973. [43] Y. Qi J. Li Y. Zhang Q. Cao Y. Si Z. Wu M. Akram X. Xu Novel lignin-based single atom catalysts as peroxymonosulfate activator for pollutants degradation: role of single cobalt and electron transfer pathway Appl. Catal. B: Environ. 286 2021 119910 Y. Qi, J. Li, Y. Zhang, Q. Cao, Y. Si, Z. Wu, M. Akram, X. Xu, Novel lignin-based single atom catalysts as peroxymonosulfate activator for pollutants degradation: Role of single cobalt and electron transfer pathway, Applied Catalysis B: Environmental, 286 (2021) 119910. [44] D. Eisenberg T.K. Slot G. Rothenberg Understanding oxygen activation on metal- and nitrogen-codoped carbon catalysts ACS Catal. 8 2018 8618 8629 D. Eisenberg, T.K. Slot, G. Rothenberg, Understanding Oxygen Activation on Metal- and Nitrogen-Codoped Carbon Catalysts, ACS Catalysis, 8 (2018) 8618-8629. [45] Y. Han X. Chen C. Qian X. Zhang W. He H. Ren H. Li G. Diao M. Chen Co0.85Se nanoparticles armored by N-doped carbon layer with electronic structure regulation functions: an efficient oxygen evolution electrocatalyst Chem. Eng. J. 420 2021 130461 Y. Han, X. Chen, C. Qian, X. Zhang, W. He, H. Ren, H. Li, G. Diao, M. Chen, Co0.85Se nanoparticles armored by N-doped carbon layer with electronic structure regulation functions: An efficient oxygen evolution electrocatalyst, Chemical Engineering Journal, 420 (2021) 130461. [46] P. Zhu W. Zhang Q. Li H. Xia Visible-light-driven photocatalytic oxidation of 5-hydroxymethylfurfural to 2,5-furandicarboxylic acid over plasmonic Au/ZnO catalyst ACS Sustain. Chem. Eng. 10 2022 8778 8787 P. Zhu, W. Zhang, Q. Li, H. Xia, Visible-Light-Driven Photocatalytic Oxidation of 5-Hydroxymethylfurfural to 2,5-Furandicarboxylic Acid over Plasmonic Au/ZnO Catalyst, ACS Sustainable Chemistry & Engineering, 10 (2022) 8778-8787. [47] X. Cui L. Zheng Q. Li Y. Guo Nitrogen-doped and Pt–Pd-decorated porous carbon catalyst derived from biotar for 2, 5-furandicarboxylic acid production from selective oxidation of 5-hydroxymethylfurfural in an alkali-free environment Ind. Eng. Chem. Res. 62 2023 14973 14985 X. Cui, L. Zheng, Q. Li, Y. Guo, Nitrogen-Doped and Pt–Pd-Decorated Porous Carbon Catalyst Derived from Biotar for 2, 5-Furandicarboxylic Acid Production from Selective Oxidation of 5-Hydroxymethylfurfural in an Alkali-Free Environment, Industrial & Engineering Chemistry Research, 62 (2023) 14973-14985. [48] R. Kumar Z. Zhu C. Chen W. Cai J. Woon-Chung Wong J. Zhao Molten salt-assisted synthesis of Co/N-doped carbon hybrids for aqueous-phase aerobic oxidation of 5-hydroxymethylfurfural to 2, 5-furandicarboxylic acid ChemSusChem 15 2022 e202201333 R. Kumar, Z. Zhu, C. Chen, W. Cai, J. Woon-Chung Wong, J. Zhao, Molten Salt-Assisted Synthesis of Co/N-Doped Carbon Hybrids for Aqueous-Phase Aerobic Oxidation of 5-Hydroxymethylfurfural to 2, 5-Furandicarboxylic Acid, ChemSusChem, 15 (2022) e202201333. [49] L. Zhang A. Wang W. Wang Y. Huang X. Liu S. Miao J. Liu T. Zhang Co-N-C catalyst for C-C coupling reactions: on the catalytic performance and active sites ACS Catal. 5 2015 6563 6572 L. Zhang, A. Wang, W. Wang, Y. Huang, X. Liu, S. Miao, J. Liu, T. Zhang, Co-N-C Catalyst for C-C Coupling Reactions: On the Catalytic Performance and Active Sites, ACS Catalysis, 5 (2015) 6563-6572. [50] H. Su K.-X. Zhang B. Zhang H.-H. Wang Q.-Y. Yu X.-H. Li M. Antonietti J.-S. Chen Activating cobalt nanoparticles via the mott-schottky effect in nitrogen-rich carbon shells for base-free aerobic oxidation of alcohols to esters J. Am. Chem. Soc. 139 2017 811 818 H. Su, K.-X. Zhang, B. Zhang, H.-H. Wang, Q.-Y. Yu, X.-H. Li, M. Antonietti, J.-S. Chen, Activating Cobalt Nanoparticles via the Mott-Schottky Effect in Nitrogen-Rich Carbon Shells for Base-Free Aerobic Oxidation of Alcohols to Esters, Journal of the American Chemical Society, 139 (2017) 811-818.",
      "scopus-id": "85189550786",
      "coredata": {
        "eid": "1-s2.0-S0926860X2400156X",
        "dc:description": "As a bio-based platform compound, 5-hydroxymethylfurfural (HMF) can be effectively converted into other high value-added derivatives. Here we report two non-noble metal catalysts for the selective oxidation of HMF, NC and Co@NC are easily obtained by pyrolysis of ZIF-8 and ZIF-67, respectively. The NC and Co@NC catalysts oxidized HMF to FFCA (Select. 95 %) and FDCA (Select. 98 %), respectively, using O2 as oxidant. Experimental and theoretical studies show that pyridinic N and graphitic N in NC has high catalytic activity for the oxidation of carbonyl groups in HMF to FFCA, while the synergistic effect of Co-N in Co@NC can completely oxidize HMF to FDCA. DFT calculations show that, compared with NC, the Co@NC containing Co-N exhibits a lower energy barrier during the aerobic oxidation of HMF to FDCA. And Co-N leads to the conversion of electrons from N to Co and promotes the activation of O2 to form O2 -, and then oxidize HMF to FDCA. Interestingly, our reaction system is universal, and could achieve almost 100 % conversion of various furfural substrates to corresponding carboxylic acid. This study may provide a new/highly efficient catalysts for biomass conversion.",
        "openArchiveArticle": "false",
        "prism:coverDate": "2024-05-25",
        "openaccessUserLicense": null,
        "prism:aggregationType": "Journal",
        "prism:url": "https://api.elsevier.com/content/article/pii/S0926860X2400156X",
        "dc:creator": [
          {
            "@_fa": "true",
            "$": "Li, Yingjie"
          },
          {
            "@_fa": "true",
            "$": "Wang, Yuanyuan"
          },
          {
            "@_fa": "true",
            "$": "Gao, Hui"
          },
          {
            "@_fa": "true",
            "$": "Zhang, Zhijie"
          },
          {
            "@_fa": "true",
            "$": "Chen, Lungang"
          },
          {
            "@_fa": "true",
            "$": "Liao, Xiaoyuan"
          }
        ],
        "link": [
          {
            "@_fa": "true",
            "@rel": "self",
            "@href": "https://api.elsevier.com/content/article/pii/S0926860X2400156X"
          },
          {
            "@_fa": "true",
            "@rel": "scidir",
            "@href": "https://www.sciencedirect.com/science/article/pii/S0926860X2400156X"
          }
        ],
        "dc:format": "application/json",
        "openaccessType": null,
        "pii": "S0926-860X(24)00156-X",
        "prism:volume": "678",
        "articleNumber": "119712",
        "prism:publisher": "Elsevier B.V.",
        "dc:title": "Tunable products of 5-hydroxymethylfurfural oxidation by Zn/Co-ZIF derived catalysts",
        "prism:copyright": "© 2024 Elsevier B.V. All rights reserved.",
        "openaccess": "0",
        "prism:issn": "0926860X",
        "dcterms:subject": [
          {
            "@_fa": "true",
            "$": "HMF"
          },
          {
            "@_fa": "true",
            "$": "FDCA"
          },
          {
            "@_fa": "true",
            "$": "Co@NC"
          },
          {
            "@_fa": "true",
            "$": "Selective oxidation"
          },
          {
            "@_fa": "true",
            "$": "Biomass"
          }
        ],
        "openaccessArticle": "false",
        "prism:publicationName": "Applied Catalysis A: General",
        "openaccessSponsorType": null,
        "prism:pageRange": "119712",
        "pubType": "fla",
        "prism:coverDisplayDate": "25 May 2024",
        "prism:doi": "10.1016/j.apcata.2024.119712",
        "prism:startingPage": "119712",
        "dc:identifier": "doi:10.1016/j.apcata.2024.119712",
        "openaccessSponsorName": null
      },
      "objects": {
        "object": [
          {
            "@category": "standard",
            "@height": "240",
            "@width": "695",
            "@_fa": "true",
            "$": "https://api.elsevier.com/content/object/eid/1-s2.0-S0926860X2400156X-gr7.jpg?httpAccept=%2A%2F%2A",
            "@multimediatype": "JPEG image file",
            "@type": "IMAGE-DOWNSAMPLED",
            "@size": "32545",
            "@ref": "gr7",
            "@mimetype": "image/jpeg"
          },
          {
            "@category": "standard",
            "@height": "402",
            "@width": "695",
            "@_fa": "true",
            "$": "https://api.elsevier.com/content/object/eid/1-s2.0-S0926860X2400156X-gr8.jpg?httpAccept=%2A%2F%2A",
            "@multimediatype": "JPEG image file",
            "@type": "IMAGE-DOWNSAMPLED",
            "@size": "55419",
            "@ref": "gr8",
            "@mimetype": "image/jpeg"
          },
          {
            "@category": "standard",
            "@height": "155",
            "@width": "500",
            "@_fa": "true",
            "$": "https://api.elsevier.com/content/object/eid/1-s2.0-S0926860X2400156X-ga1.jpg?httpAccept=%2A%2F%2A",
            "@multimediatype": "JPEG image file",
            "@type": "IMAGE-DOWNSAMPLED",
            "@size": "19419",
            "@ref": "ga1",
            "@mimetype": "image/jpeg"
          },
          {
            "@category": "standard",
            "@height": "40",
            "@width": "78",
            "@_fa": "true",
            "$": "https://api.elsevier.com/content/object/eid/1-s2.0-S0926860X2400156X-fx4.jpg?httpAccept=%2A%2F%2A",
            "@multimediatype": "JPEG image file",
            "@type": "IMAGE-DOWNSAMPLED",
            "@size": "1614",
            "@ref": "fx4",
            "@mimetype": "image/jpeg"
          },
          {
            "@category": "standard",
            "@height": "192",
            "@width": "565",
            "@_fa": "true",
            "$": "https://api.elsevier.com/content/object/eid/1-s2.0-S0926860X2400156X-sc2.jpg?httpAccept=%2A%2F%2A",
            "@multimediatype": "JPEG image file",
            "@type": "IMAGE-DOWNSAMPLED",
            "@size": "25277",
            "@ref": "sc2",
            "@mimetype": "image/jpeg"
          },
          {
            "@category": "standard",
            "@height": "40",
            "@width": "87",
            "@_fa": "true",
            "$": "https://api.elsevier.com/content/object/eid/1-s2.0-S0926860X2400156X-fx5.jpg?httpAccept=%2A%2F%2A",
            "@multimediatype": "JPEG image file",
            "@type": "IMAGE-DOWNSAMPLED",
            "@size": "1507",
            "@ref": "fx5",
            "@mimetype": "image/jpeg"
          },
          {
            "@category": "standard",
            "@height": "39",
            "@width": "106",
            "@_fa": "true",
            "$": "https://api.elsevier.com/content/object/eid/1-s2.0-S0926860X2400156X-fx2.jpg?httpAccept=%2A%2F%2A",
            "@multimediatype": "JPEG image file",
            "@type": "IMAGE-DOWNSAMPLED",
            "@size": "2022",
            "@ref": "fx2",
            "@mimetype": "image/jpeg"
          },
          {
            "@category": "standard",
            "@height": "39",
            "@width": "72",
            "@_fa": "true",
            "$": "https://api.elsevier.com/content/object/eid/1-s2.0-S0926860X2400156X-fx3.jpg?httpAccept=%2A%2F%2A",
            "@multimediatype": "JPEG image file",
            "@type": "IMAGE-DOWNSAMPLED",
            "@size": "1511",
            "@ref": "fx3",
            "@mimetype": "image/jpeg"
          },
          {
            "@category": "standard",
            "@height": "171",
            "@width": "659",
            "@_fa": "true",
            "$": "https://api.elsevier.com/content/object/eid/1-s2.0-S0926860X2400156X-sc1.jpg?httpAccept=%2A%2F%2A",
            "@multimediatype": "JPEG image file",
            "@type": "IMAGE-DOWNSAMPLED",
            "@size": "14808",
            "@ref": "sc1",
            "@mimetype": "image/jpeg"
          },
          {
            "@category": "standard",
            "@height": "41",
            "@width": "114",
            "@_fa": "true",
            "$": "https://api.elsevier.com/content/object/eid/1-s2.0-S0926860X2400156X-fx1.jpg?httpAccept=%2A%2F%2A",
            "@multimediatype": "JPEG image file",
            "@type": "IMAGE-DOWNSAMPLED",
            "@size": "2011",
            "@ref": "fx1",
            "@mimetype": "image/jpeg"
          },
          {
            "@category": "standard",
            "@height": "488",
            "@width": "715",
            "@_fa": "true",
            "$": "https://api.elsevier.com/content/object/eid/1-s2.0-S0926860X2400156X-gr5.jpg?httpAccept=%2A%2F%2A",
            "@multimediatype": "JPEG image file",
            "@type": "IMAGE-DOWNSAMPLED",
            "@size": "71644",
            "@ref": "gr5",
            "@mimetype": "image/jpeg"
          },
          {
            "@category": "standard",
            "@height": "242",
            "@width": "751",
            "@_fa": "true",
            "$": "https://api.elsevier.com/content/object/eid/1-s2.0-S0926860X2400156X-gr6.jpg?httpAccept=%2A%2F%2A",
            "@multimediatype": "JPEG image file",
            "@type": "IMAGE-DOWNSAMPLED",
            "@size": "54529",
            "@ref": "gr6",
            "@mimetype": "image/jpeg"
          },
          {
            "@category": "standard",
            "@height": "508",
            "@width": "678",
            "@_fa": "true",
            "$": "https://api.elsevier.com/content/object/eid/1-s2.0-S0926860X2400156X-gr3.jpg?httpAccept=%2A%2F%2A",
            "@multimediatype": "JPEG image file",
            "@type": "IMAGE-DOWNSAMPLED",
            "@size": "65940",
            "@ref": "gr3",
            "@mimetype": "image/jpeg"
          },
          {
            "@category": "standard",
            "@height": "495",
            "@width": "695",
            "@_fa": "true",
            "$": "https://api.elsevier.com/content/object/eid/1-s2.0-S0926860X2400156X-gr4.jpg?httpAccept=%2A%2F%2A",
            "@multimediatype": "JPEG image file",
            "@type": "IMAGE-DOWNSAMPLED",
            "@size": "75630",
            "@ref": "gr4",
            "@mimetype": "image/jpeg"
          },
          {
            "@category": "standard",
            "@height": "41",
            "@width": "89",
            "@_fa": "true",
            "$": "https://api.elsevier.com/content/object/eid/1-s2.0-S0926860X2400156X-fx8.jpg?httpAccept=%2A%2F%2A",
            "@multimediatype": "JPEG image file",
            "@type": "IMAGE-DOWNSAMPLED",
            "@size": "1795",
            "@ref": "fx8",
            "@mimetype": "image/jpeg"
          },
          {
            "@category": "standard",
            "@height": "267",
            "@width": "678",
            "@_fa": "true",
            "$": "https://api.elsevier.com/content/object/eid/1-s2.0-S0926860X2400156X-gr1.jpg?httpAccept=%2A%2F%2A",
            "@multimediatype": "JPEG image file",
            "@type": "IMAGE-DOWNSAMPLED",
            "@size": "36341",
            "@ref": "gr1",
            "@mimetype": "image/jpeg"
          },
          {
            "@category": "standard",
            "@height": "327",
            "@width": "791",
            "@_fa": "true",
            "$": "https://api.elsevier.com/content/object/eid/1-s2.0-S0926860X2400156X-gr2.jpg?httpAccept=%2A%2F%2A",
            "@multimediatype": "JPEG image file",
            "@type": "IMAGE-DOWNSAMPLED",
            "@size": "97475",
            "@ref": "gr2",
            "@mimetype": "image/jpeg"
          },
          {
            "@category": "standard",
            "@height": "41",
            "@width": "81",
            "@_fa": "true",
            "$": "https://api.elsevier.com/content/object/eid/1-s2.0-S0926860X2400156X-fx6.jpg?httpAccept=%2A%2F%2A",
            "@multimediatype": "JPEG image file",
            "@type": "IMAGE-DOWNSAMPLED",
            "@size": "1645",
            "@ref": "fx6",
            "@mimetype": "image/jpeg"
          },
          {
            "@category": "standard",
            "@height": "40",
            "@width": "84",
            "@_fa": "true",
            "$": "https://api.elsevier.com/content/object/eid/1-s2.0-S0926860X2400156X-fx7.jpg?httpAccept=%2A%2F%2A",
            "@multimediatype": "JPEG image file",
            "@type": "IMAGE-DOWNSAMPLED",
            "@size": "1648",
            "@ref": "fx7",
            "@mimetype": "image/jpeg"
          },
          {
            "@category": "thumbnail",
            "@height": "76",
            "@width": "219",
            "@_fa": "true",
            "$": "https://api.elsevier.com/content/object/eid/1-s2.0-S0926860X2400156X-gr7.sml?httpAccept=%2A%2F%2A",
            "@multimediatype": "GIF image file",
            "@type": "IMAGE-THUMBNAIL",
            "@size": "5229",
            "@ref": "gr7",
            "@mimetype": "image/gif"
          },
          {
            "@category": "thumbnail",
            "@height": "127",
            "@width": "219",
            "@_fa": "true",
            "$": "https://api.elsevier.com/content/object/eid/1-s2.0-S0926860X2400156X-gr8.sml?httpAccept=%2A%2F%2A",
            "@multimediatype": "GIF image file",
            "@type": "IMAGE-THUMBNAIL",
            "@size": "7273",
            "@ref": "gr8",
            "@mimetype": "image/gif"
          },
          {
            "@category": "thumbnail",
            "@height": "68",
            "@width": "219",
            "@_fa": "true",
            "$": "https://api.elsevier.com/content/object/eid/1-s2.0-S0926860X2400156X-ga1.sml?httpAccept=%2A%2F%2A",
            "@multimediatype": "GIF image file",
            "@type": "IMAGE-THUMBNAIL",
            "@size": "4965",
            "@ref": "ga1",
            "@mimetype": "image/gif"
          },
          {
            "@category": "thumbnail",
            "@height": "113",
            "@width": "219",
            "@_fa": "true",
            "$": "https://api.elsevier.com/content/object/eid/1-s2.0-S0926860X2400156X-fx4.sml?httpAccept=%2A%2F%2A",
            "@multimediatype": "GIF image file",
            "@type": "IMAGE-THUMBNAIL",
            "@size": "7666",
            "@ref": "fx4",
            "@mimetype": "image/gif"
          },
          {
            "@category": "thumbnail",
            "@height": "75",
            "@width": "219",
            "@_fa": "true",
            "$": "https://api.elsevier.com/content/object/eid/1-s2.0-S0926860X2400156X-sc2.sml?httpAccept=%2A%2F%2A",
            "@multimediatype": "GIF image file",
            "@type": "IMAGE-THUMBNAIL",
            "@size": "5337",
            "@ref": "sc2",
            "@mimetype": "image/gif"
          },
          {
            "@category": "thumbnail",
            "@height": "102",
            "@width": "219",
            "@_fa": "true",
            "$": "https://api.elsevier.com/content/object/eid/1-s2.0-S0926860X2400156X-fx5.sml?httpAccept=%2A%2F%2A",
            "@multimediatype": "GIF image file",
            "@type": "IMAGE-THUMBNAIL",
            "@size": "6004",
            "@ref": "fx5",
            "@mimetype": "image/gif"
          },
          {
            "@category": "thumbnail",
            "@height": "81",
            "@width": "219",
            "@_fa": "true",
            "$": "https://api.elsevier.com/content/object/eid/1-s2.0-S0926860X2400156X-fx2.sml?httpAccept=%2A%2F%2A",
            "@multimediatype": "GIF image file",
            "@type": "IMAGE-THUMBNAIL",
            "@size": "5717",
            "@ref": "fx2",
            "@mimetype": "image/gif"
          },
          {
            "@category": "thumbnail",
            "@height": "118",
            "@width": "219",
            "@_fa": "true",
            "$": "https://api.elsevier.com/content/object/eid/1-s2.0-S0926860X2400156X-fx3.sml?httpAccept=%2A%2F%2A",
            "@multimediatype": "GIF image file",
            "@type": "IMAGE-THUMBNAIL",
            "@size": "7141",
            "@ref": "fx3",
            "@mimetype": "image/gif"
          },
          {
            "@category": "thumbnail",
            "@height": "57",
            "@width": "219",
            "@_fa": "true",
            "$": "https://api.elsevier.com/content/object/eid/1-s2.0-S0926860X2400156X-sc1.sml?httpAccept=%2A%2F%2A",
            "@multimediatype": "GIF image file",
            "@type": "IMAGE-THUMBNAIL",
            "@size": "2407",
            "@ref": "sc1",
            "@mimetype": "image/gif"
          },
          {
            "@category": "thumbnail",
            "@height": "79",
            "@width": "219",
            "@_fa": "true",
            "$": "https://api.elsevier.com/content/object/eid/1-s2.0-S0926860X2400156X-fx1.sml?httpAccept=%2A%2F%2A",
            "@multimediatype": "GIF image file",
            "@type": "IMAGE-THUMBNAIL",
            "@size": "5172",
            "@ref": "fx1",
            "@mimetype": "image/gif"
          },
          {
            "@category": "thumbnail",
            "@height": "150",
            "@width": "219",
            "@_fa": "true",
            "$": "https://api.elsevier.com/content/object/eid/1-s2.0-S0926860X2400156X-gr5.sml?httpAccept=%2A%2F%2A",
            "@multimediatype": "GIF image file",
            "@type": "IMAGE-THUMBNAIL",
            "@size": "9863",
            "@ref": "gr5",
            "@mimetype": "image/gif"
          },
          {
            "@category": "thumbnail",
            "@height": "71",
            "@width": "219",
            "@_fa": "true",
            "$": "https://api.elsevier.com/content/object/eid/1-s2.0-S0926860X2400156X-gr6.sml?httpAccept=%2A%2F%2A",
            "@multimediatype": "GIF image file",
            "@type": "IMAGE-THUMBNAIL",
            "@size": "6993",
            "@ref": "gr6",
            "@mimetype": "image/gif"
          },
          {
            "@category": "thumbnail",
            "@height": "164",
            "@width": "219",
            "@_fa": "true",
            "$": "https://api.elsevier.com/content/object/eid/1-s2.0-S0926860X2400156X-gr3.sml?httpAccept=%2A%2F%2A",
            "@multimediatype": "GIF image file",
            "@type": "IMAGE-THUMBNAIL",
            "@size": "10429",
            "@ref": "gr3",
            "@mimetype": "image/gif"
          },
          {
            "@category": "thumbnail",
            "@height": "156",
            "@width": "219",
            "@_fa": "true",
            "$": "https://api.elsevier.com/content/object/eid/1-s2.0-S0926860X2400156X-gr4.sml?httpAccept=%2A%2F%2A",
            "@multimediatype": "GIF image file",
            "@type": "IMAGE-THUMBNAIL",
            "@size": "10850",
            "@ref": "gr4",
            "@mimetype": "image/gif"
          },
          {
            "@category": "thumbnail",
            "@height": "101",
            "@width": "219",
            "@_fa": "true",
            "$": "https://api.elsevier.com/content/object/eid/1-s2.0-S0926860X2400156X-fx8.sml?httpAccept=%2A%2F%2A",
            "@multimediatype": "GIF image file",
            "@type": "IMAGE-THUMBNAIL",
            "@size": "6753",
            "@ref": "fx8",
            "@mimetype": "image/gif"
          },
          {
            "@category": "thumbnail",
            "@height": "86",
            "@width": "219",
            "@_fa": "true",
            "$": "https://api.elsevier.com/content/object/eid/1-s2.0-S0926860X2400156X-gr1.sml?httpAccept=%2A%2F%2A",
            "@multimediatype": "GIF image file",
            "@type": "IMAGE-THUMBNAIL",
            "@size": "5694",
            "@ref": "gr1",
            "@mimetype": "image/gif"
          },
          {
            "@category": "thumbnail",
            "@height": "91",
            "@width": "219",
            "@_fa": "true",
            "$": "https://api.elsevier.com/content/object/eid/1-s2.0-S0926860X2400156X-gr2.sml?httpAccept=%2A%2F%2A",
            "@multimediatype": "GIF image file",
            "@type": "IMAGE-THUMBNAIL",
            "@size": "16788",
            "@ref": "gr2",
            "@mimetype": "image/gif"
          },
          {
            "@category": "thumbnail",
            "@height": "110",
            "@width": "219",
            "@_fa": "true",
            "$": "https://api.elsevier.com/content/object/eid/1-s2.0-S0926860X2400156X-fx6.sml?httpAccept=%2A%2F%2A",
            "@multimediatype": "GIF image file",
            "@type": "IMAGE-THUMBNAIL",
            "@size": "7092",
            "@ref": "fx6",
            "@mimetype": "image/gif"
          },
          {
            "@category": "thumbnail",
            "@height": "105",
            "@width": "219",
            "@_fa": "true",
            "$": "https://api.elsevier.com/content/object/eid/1-s2.0-S0926860X2400156X-fx7.sml?httpAccept=%2A%2F%2A",
            "@multimediatype": "GIF image file",
            "@type": "IMAGE-THUMBNAIL",
            "@size": "6775",
            "@ref": "fx7",
            "@mimetype": "image/gif"
          },
          {
            "@category": "high",
            "@height": "1061",
            "@width": "3076",
            "@_fa": "true",
            "$": "https://api.elsevier.com/content/object/eid/1-s2.0-S0926860X2400156X-gr7_lrg.jpg?httpAccept=%2A%2F%2A",
            "@multimediatype": "JPEG image file",
            "@type": "IMAGE-HIGH-RES",
            "@size": "177351",
            "@ref": "gr7",
            "@mimetype": "image/jpeg"
          },
          {
            "@category": "high",
            "@height": "1779",
            "@width": "3076",
            "@_fa": "true",
            "$": "https://api.elsevier.com/content/object/eid/1-s2.0-S0926860X2400156X-gr8_lrg.jpg?httpAccept=%2A%2F%2A",
            "@multimediatype": "JPEG image file",
            "@type": "IMAGE-HIGH-RES",
            "@size": "234989",
            "@ref": "gr8",
            "@mimetype": "image/jpeg"
          },
          {
            "@category": "high",
            "@height": "688",
            "@width": "2213",
            "@_fa": "true",
            "$": "https://api.elsevier.com/content/object/eid/1-s2.0-S0926860X2400156X-ga1_lrg.jpg?httpAccept=%2A%2F%2A",
            "@multimediatype": "JPEG image file",
            "@type": "IMAGE-HIGH-RES",
            "@size": "119325",
            "@ref": "ga1",
            "@mimetype": "image/jpeg"
          },
          {
            "@category": "high",
            "@height": "180",
            "@width": "348",
            "@_fa": "true",
            "$": "https://api.elsevier.com/content/object/eid/1-s2.0-S0926860X2400156X-fx4_lrg.jpg?httpAccept=%2A%2F%2A",
            "@multimediatype": "JPEG image file",
            "@type": "IMAGE-HIGH-RES",
            "@size": "6642",
            "@ref": "fx4",
            "@mimetype": "image/jpeg"
          },
          {
            "@category": "high",
            "@height": "849",
            "@width": "2495",
            "@_fa": "true",
            "$": "https://api.elsevier.com/content/object/eid/1-s2.0-S0926860X2400156X-sc2_lrg.jpg?httpAccept=%2A%2F%2A",
            "@multimediatype": "JPEG image file",
            "@type": "IMAGE-HIGH-RES",
            "@size": "111604",
            "@ref": "sc2",
            "@mimetype": "image/jpeg"
          },
          {
            "@category": "high",
            "@height": "182",
            "@width": "392",
            "@_fa": "true",
            "$": "https://api.elsevier.com/content/object/eid/1-s2.0-S0926860X2400156X-fx5_lrg.jpg?httpAccept=%2A%2F%2A",
            "@multimediatype": "JPEG image file",
            "@type": "IMAGE-HIGH-RES",
            "@size": "6015",
            "@ref": "fx5",
            "@mimetype": "image/jpeg"
          },
          {
            "@category": "high",
            "@height": "177",
            "@width": "477",
            "@_fa": "true",
            "$": "https://api.elsevier.com/content/object/eid/1-s2.0-S0926860X2400156X-fx2_lrg.jpg?httpAccept=%2A%2F%2A",
            "@multimediatype": "JPEG image file",
            "@type": "IMAGE-HIGH-RES",
            "@size": "8592",
            "@ref": "fx2",
            "@mimetype": "image/jpeg"
          },
          {
            "@category": "high",
            "@height": "173",
            "@width": "321",
            "@_fa": "true",
            "$": "https://api.elsevier.com/content/object/eid/1-s2.0-S0926860X2400156X-fx3_lrg.jpg?httpAccept=%2A%2F%2A",
            "@multimediatype": "JPEG image file",
            "@type": "IMAGE-HIGH-RES",
            "@size": "5875",
            "@ref": "fx3",
            "@mimetype": "image/jpeg"
          },
          {
            "@category": "high",
            "@height": "754",
            "@width": "2911",
            "@_fa": "true",
            "$": "https://api.elsevier.com/content/object/eid/1-s2.0-S0926860X2400156X-sc1_lrg.jpg?httpAccept=%2A%2F%2A",
            "@multimediatype": "JPEG image file",
            "@type": "IMAGE-HIGH-RES",
            "@size": "63438",
            "@ref": "sc1",
            "@mimetype": "image/jpeg"
          },
          {
            "@category": "high",
            "@height": "182",
            "@width": "505",
            "@_fa": "true",
            "$": "https://api.elsevier.com/content/object/eid/1-s2.0-S0926860X2400156X-fx1_lrg.jpg?httpAccept=%2A%2F%2A",
            "@multimediatype": "JPEG image file",
            "@type": "IMAGE-HIGH-RES",
            "@size": "8123",
            "@ref": "fx1",
            "@mimetype": "image/jpeg"
          },
          {
            "@category": "high",
            "@height": "2158",
            "@width": "3160",
            "@_fa": "true",
            "$": "https://api.elsevier.com/content/object/eid/1-s2.0-S0926860X2400156X-gr5_lrg.jpg?httpAccept=%2A%2F%2A",
            "@multimediatype": "JPEG image file",
            "@type": "IMAGE-HIGH-RES",
            "@size": "404710",
            "@ref": "gr5",
            "@mimetype": "image/jpeg"
          },
          {
            "@category": "high",
            "@height": "1073",
            "@width": "3326",
            "@_fa": "true",
            "$": "https://api.elsevier.com/content/object/eid/1-s2.0-S0926860X2400156X-gr6_lrg.jpg?httpAccept=%2A%2F%2A",
            "@multimediatype": "JPEG image file",
            "@type": "IMAGE-HIGH-RES",
            "@size": "232684",
            "@ref": "gr6",
            "@mimetype": "image/jpeg"
          },
          {
            "@category": "high",
            "@height": "2245",
            "@width": "2994",
            "@_fa": "true",
            "$": "https://api.elsevier.com/content/object/eid/1-s2.0-S0926860X2400156X-gr3_lrg.jpg?httpAccept=%2A%2F%2A",
            "@multimediatype": "JPEG image file",
            "@type": "IMAGE-HIGH-RES",
            "@size": "396291",
            "@ref": "gr3",
            "@mimetype": "image/jpeg"
          },
          {
            "@category": "high",
            "@height": "2189",
            "@width": "3076",
            "@_fa": "true",
            "$": "https://api.elsevier.com/content/object/eid/1-s2.0-S0926860X2400156X-gr4_lrg.jpg?httpAccept=%2A%2F%2A",
            "@multimediatype": "JPEG image file",
            "@type": "IMAGE-HIGH-RES",
            "@size": "376249",
            "@ref": "gr4",
            "@mimetype": "image/jpeg"
          },
          {
            "@category": "high",
            "@height": "182",
            "@width": "396",
            "@_fa": "true",
            "$": "https://api.elsevier.com/content/object/eid/1-s2.0-S0926860X2400156X-fx8_lrg.jpg?httpAccept=%2A%2F%2A",
            "@multimediatype": "JPEG image file",
            "@type": "IMAGE-HIGH-RES",
            "@size": "6826",
            "@ref": "fx8",
            "@mimetype": "image/jpeg"
          },
          {
            "@category": "high",
            "@height": "1178",
            "@width": "2994",
            "@_fa": "true",
            "$": "https://api.elsevier.com/content/object/eid/1-s2.0-S0926860X2400156X-gr1_lrg.jpg?httpAccept=%2A%2F%2A",
            "@multimediatype": "JPEG image file",
            "@type": "IMAGE-HIGH-RES",
            "@size": "196164",
            "@ref": "gr1",
            "@mimetype": "image/jpeg"
          },
          {
            "@category": "high",
            "@height": "1444",
            "@width": "3493",
            "@_fa": "true",
            "$": "https://api.elsevier.com/content/object/eid/1-s2.0-S0926860X2400156X-gr2_lrg.jpg?httpAccept=%2A%2F%2A",
            "@multimediatype": "JPEG image file",
            "@type": "IMAGE-HIGH-RES",
            "@size": "626314",
            "@ref": "gr2",
            "@mimetype": "image/jpeg"
          },
          {
            "@category": "high",
            "@height": "182",
            "@width": "361",
            "@_fa": "true",
            "$": "https://api.elsevier.com/content/object/eid/1-s2.0-S0926860X2400156X-fx6_lrg.jpg?httpAccept=%2A%2F%2A",
            "@multimediatype": "JPEG image file",
            "@type": "IMAGE-HIGH-RES",
            "@size": "6357",
            "@ref": "fx6",
            "@mimetype": "image/jpeg"
          },
          {
            "@category": "high",
            "@height": "180",
            "@width": "377",
            "@_fa": "true",
            "$": "https://api.elsevier.com/content/object/eid/1-s2.0-S0926860X2400156X-fx7_lrg.jpg?httpAccept=%2A%2F%2A",
            "@multimediatype": "JPEG image file",
            "@type": "IMAGE-HIGH-RES",
            "@size": "6481",
            "@ref": "fx7",
            "@mimetype": "image/jpeg"
          },
          {
            "@category": "standard",
            "@_fa": "true",
            "$": "https://api.elsevier.com/content/object/eid/1-s2.0-S0926860X2400156X-mmc1.docx?httpAccept=%2A%2F%2A",
            "@multimediatype": "Microsoft Word file",
            "@type": "APPLICATION",
            "@size": "1115279",
            "@ref": "mmc1",
            "@mimetype": "application/word"
          },
          {
            "@category": "thumbnail",
            "@_fa": "true",
            "$": "https://api.elsevier.com/content/object/eid/1-s2.0-S0926860X2400156X-si0001.svg?httpAccept=%2A%2F%2A",
            "@multimediatype": "Scalable Vector Graphics file",
            "@type": "ALTIMG",
            "@size": "4206",
            "@ref": "si0001",
            "@mimetype": "image/svg+xml"
          },
          {
            "@category": "thumbnail",
            "@_fa": "true",
            "$": "https://api.elsevier.com/content/object/eid/1-s2.0-S0926860X2400156X-si0002.svg?httpAccept=%2A%2F%2A",
            "@multimediatype": "Scalable Vector Graphics file",
            "@type": "ALTIMG",
            "@size": "3946",
            "@ref": "si0002",
            "@mimetype": "image/svg+xml"
          },
          {
            "@category": "standard",
            "@_fa": "true",
            "$": "https://api.elsevier.com/content/object/eid/1-s2.0-S0926860X2400156X-am.pdf?httpAccept=%2A%2F%2A",
            "@multimediatype": "Acrobat PDF file",
            "@type": "AAM-PDF",
            "@size": "1548982",
            "@ref": "am",
            "@mimetype": "application/pdf"
          }
        ]
      },
      "link": {
        "@rel": "abstract",
        "@href": "https://api.elsevier.com/content/abstract/scopus_id/85189550786"
      }
    }
  }
}