{
  "metadata": {
    "title": "TiO<ce:inf loc=post>2</ce:inf>-doped Mn<ce:inf loc=post>2</ce:inf>O<ce:inf loc=post>3</ce:inf>-Na<ce:inf loc=post>2</ce:inf>WO<ce:inf loc=post>4</ce:inf>/SiO<ce:inf loc=post>2</ce:inf> catalyst for oxidative coupling of methane: Solution combustion synthesis and MnTiO<ce:inf loc=post>3</ce:inf>-dependent low-temperature activity improvement",
    "authors": "; ; ",
    "journal": "Applied Catalysis A: General",
    "date": "2017-08-25",
    "doi": "10.1016/j.apcata.2017.07.012",
    "abstract": "",
    "uri": "https://api.elsevier.com/content/article/pii/S0926860X17303125",
    "pii": "S0926860X17303125"
  },
  "fulltext": {
    "full-text-retrieval-response": {
      "scopus-eid": "2-s2.0-85023625942",
      "originalText": "serial JL 271346 291210 291744 291809 31 Applied Catalysis A: General APPLIEDCATALYSISAGENERAL 2017-07-11 2017-07-11 2017-07-14 2017-07-14 2017-08-01T17:23:03 1-s2.0-S0926860X17303125 S0926-860X(17)30312-5 S0926860X17303125 10.1016/j.apcata.2017.07.012 S300 S300.1 FULL-TEXT 1-s2.0-S0926860X17X00136 2024-01-01T12:31:47.592716Z 0 0 20170825 2017 2017-07-11T15:58:24.469907Z absattachment articleinfo articletitlenorm authfirstinitialnorm authfirstsurnamenorm cid cids contenttype copyright crossmark dateloaded dateloadedtxt datesearch datesort dateupdated dco docsubtype doctype doi eid ewtransactionid hubeid indexeddate issn issnnorm itemstage itemtransactionid itemweight openaccess openarchive pg pgfirst pglast pii piinorm pubdatestart pubdatetxt pubyr sortorder srctitle srctitlenorm srctype ssids alllist content subj subheadings suppl tomb volfirst volissue volumelist webpdf webpdfpagecount yearnav figure table e-component body acknowledge affil appendices articletitle auth authfirstini authfull authkeywords authlast footnotes grantnumber grantsponsor highlightsabst primabst pubtype ref specialabst 0926-860X 0926860X true 544 544 C Volume 544 11 77 83 77 83 20170825 25 August 2017 2017-08-25 2017 article fla © 2017 Elsevier B.V. All rights reserved. TIO2DOPEDMN2O3NA2WO4SIO2CATALYSTFOROXIDATIVECOUPLINGMETHANESOLUTIONCOMBUSTIONSYNTHESISMNTIO3DEPENDENTLOWTEMPERATUREACTIVITYIMPROVEMENT WANG P 1 Introduction 2 Experimental 2.1 Materials 2.2 Catalyst preparation 2.3 Catalyst characterization 2.4 Reactivity tests 3 Results and discussion 3.1 Catalyst characteristics 3.2 Catalytic OCM performance of TiO2-doped Mn2O3-Na2WO4/SiO2 catalyst 3.2.1 Effects of Ti precursors, ϕ, and calcination temperature 3.2.2 Effects of TiO2, Mn2O3, and Na2WO4 loadings 3.2.3 Effects of reaction variables 3.3 Insight into the TiO2-doping chemistry in low-temperature OCM catalysis: XRD and Raman studies 3.4 Stability 4 Conclusions Acknowledgments Appendix A Supplementary data References BOSWELL 2009 957 958 R MCFARLAND 2012 340 342 E FOX 1993 169 212 J KOEMPEL 2007 261 267 H TIAN 2015 1922 1938 P JIAO 2016 1065 1068 F ZHONG 2016 884 887 L DISSANAYAKE 1994 613 615 D DRISCOLL 1985 58 63 D BUYEVSKAYA 1994 71 80 O REYES 1993 167 180 S TONG 1989 2896 2898 Y YANG 1994 281 283 T LONG 1995 727 730 R VOSKRESENSKAYA 1995 101 143 E PAPA 2010 172 178 F YAGHOBI 2008 8 16 N ZHANG 2001 141 147 H AIKA 1991 165 171 K LUNSFORD 1995 970 980 J LUO 2017 57 61 L ITO 1985 721 722 T LEVAN 1990 395 400 T SUGIYAMA 1993 338 350 S FANG 1992 254 262 X ARNDT 2012 53 61 S WANG 2006 272 277 J VARMA 2016 14493 14586 A DESHPANDE 2004 4896 4904 K ARUNA 2008 44 50 S PATIL 2008 K CHEMISTRYNANOCRYSTALLINEOXIDEMATERIALSCOMBUSTIONSYNTHESIS JAIN 1981 71 79 S DESHPANDE 2003 1149 1154 K ERRI 2008 1243 1245 P GHOSE 2013 147 154 R GHOSE 2014 39 46 R CUI 2013 11385 11387 Y SCHWACH 2013 11381 11384 P YUNARTI 2017 3667 3674 R LANE 1988 144 163 G YAGHOBI 2009 39 44 N WANGX2017X77 WANGX2017X77X83 WANGX2017X77XP WANGX2017X77X83XP 2019-07-14T00:00:00.000Z UnderEmbargo http://creativecommons.org/licenses/by-nc-nd/4.0/ © 2017 Elsevier B.V. All rights reserved. 2022-06-09T07:34:08.943Z http://vtw.elsevier.com/data/voc/AddOnTypes/50.7/aggregated-refined NSF of China 21076083 21273075 21322307 21473057 U1462129 NSFC National Natural Science Foundation of China http://data.elsevier.com/vocabulary/SciValFunders/501100001809 http://sws.geonames.org/1814991/ MOST of China MOST Ministry of Science and Technology of the People&apos;s Republic of China http://data.elsevier.com/vocabulary/SciValFunders/501100002855 http://sws.geonames.org/1814991/ 973 program 2011CB201403 NKRDPC National Key Research and Development Program of China http://data.elsevier.com/vocabulary/SciValFunders/501100012166 http://sws.geonames.org/1814991/ This work has been funded by the NSF of China (21473057, U1462129, 21322307, 21273075, 21076083) and the “973 program” (2011CB201403) from the MOST of China. item S0926-860X(17)30312-5 S0926860X17303125 1-s2.0-S0926860X17303125 10.1016/j.apcata.2017.07.012 271346 2024-01-01T12:31:47.592716Z 2017-08-25 1-s2.0-S0926860X17303125-main.pdf https://s3-eu-west-1.amazonaws.com/prod-ucs-content-store-eu-west/content/pii:S0926860X17303125/MAIN/application/pdf/54145d392349a2a22f6955f38699f900/main.pdf https://s3.amazonaws.com/prod-ucs-content-store-us-east/content/pii:S0926860X17303125/MAIN/application/pdf/54145d392349a2a22f6955f38699f900/main.pdf main.pdf pdf true 971381 MAIN 7 1-s2.0-S0926860X17303125-main_1.png https://s3-eu-west-1.amazonaws.com/prod-ucs-content-store-eu-west/content/pii:S0926860X17303125/PREVIEW/image/png/ef908b5364024634fc48034871dc23ca/main_1.png https://s3.amazonaws.com/prod-ucs-content-store-us-east/content/pii:S0926860X17303125/PREVIEW/image/png/ef908b5364024634fc48034871dc23ca/main_1.png main_1.png png 54651 849 656 IMAGE-WEB-PDF 1 1-s2.0-S0926860X17303125-fx1.sml https://s3-eu-west-1.amazonaws.com/prod-ucs-content-store-eu-west/content/pii:S0926860X17303125/fx1/THUMBNAIL/image/gif/0bf7ee3b82c806223e5eb6101b060359/fx1.sml https://s3.amazonaws.com/prod-ucs-content-store-us-east/content/pii:S0926860X17303125/fx1/THUMBNAIL/image/gif/0bf7ee3b82c806223e5eb6101b060359/fx1.sml fx1 true fx1.sml sml 14317 101 219 IMAGE-THUMBNAIL 1-s2.0-S0926860X17303125-gr1.sml https://s3-eu-west-1.amazonaws.com/prod-ucs-content-store-eu-west/content/pii:S0926860X17303125/gr1/THUMBNAIL/image/gif/e7ad8b9c05bddbe1bb55e16cb0302525/gr1.sml https://s3.amazonaws.com/prod-ucs-content-store-us-east/content/pii:S0926860X17303125/gr1/THUMBNAIL/image/gif/e7ad8b9c05bddbe1bb55e16cb0302525/gr1.sml gr1 gr1.sml sml 15476 164 205 IMAGE-THUMBNAIL 1-s2.0-S0926860X17303125-gr2.sml https://s3-eu-west-1.amazonaws.com/prod-ucs-content-store-eu-west/content/pii:S0926860X17303125/gr2/THUMBNAIL/image/gif/7a1af01b596462a5a7d49122fbebd571/gr2.sml https://s3.amazonaws.com/prod-ucs-content-store-us-east/content/pii:S0926860X17303125/gr2/THUMBNAIL/image/gif/7a1af01b596462a5a7d49122fbebd571/gr2.sml gr2 gr2.sml sml 4189 48 219 IMAGE-THUMBNAIL 1-s2.0-S0926860X17303125-gr3.sml https://s3-eu-west-1.amazonaws.com/prod-ucs-content-store-eu-west/content/pii:S0926860X17303125/gr3/THUMBNAIL/image/gif/ba72b7597e0f59c69ab62b5d55da09db/gr3.sml https://s3.amazonaws.com/prod-ucs-content-store-us-east/content/pii:S0926860X17303125/gr3/THUMBNAIL/image/gif/ba72b7597e0f59c69ab62b5d55da09db/gr3.sml gr3 gr3.sml sml 5836 75 219 IMAGE-THUMBNAIL 1-s2.0-S0926860X17303125-gr4.sml https://s3-eu-west-1.amazonaws.com/prod-ucs-content-store-eu-west/content/pii:S0926860X17303125/gr4/THUMBNAIL/image/gif/f660350850676b57dbcff873703dbd30/gr4.sml https://s3.amazonaws.com/prod-ucs-content-store-us-east/content/pii:S0926860X17303125/gr4/THUMBNAIL/image/gif/f660350850676b57dbcff873703dbd30/gr4.sml gr4 gr4.sml sml 12152 147 219 IMAGE-THUMBNAIL 1-s2.0-S0926860X17303125-gr5.sml https://s3-eu-west-1.amazonaws.com/prod-ucs-content-store-eu-west/content/pii:S0926860X17303125/gr5/THUMBNAIL/image/gif/17c0ec635166537f85f03562b9086f50/gr5.sml https://s3.amazonaws.com/prod-ucs-content-store-us-east/content/pii:S0926860X17303125/gr5/THUMBNAIL/image/gif/17c0ec635166537f85f03562b9086f50/gr5.sml gr5 gr5.sml sml 9868 147 219 IMAGE-THUMBNAIL 1-s2.0-S0926860X17303125-gr6.sml https://s3-eu-west-1.amazonaws.com/prod-ucs-content-store-eu-west/content/pii:S0926860X17303125/gr6/THUMBNAIL/image/gif/fa65b4259af52f33b20a0441c82659a4/gr6.sml https://s3.amazonaws.com/prod-ucs-content-store-us-east/content/pii:S0926860X17303125/gr6/THUMBNAIL/image/gif/fa65b4259af52f33b20a0441c82659a4/gr6.sml gr6 gr6.sml sml 6805 58 219 IMAGE-THUMBNAIL 1-s2.0-S0926860X17303125-gr7.sml https://s3-eu-west-1.amazonaws.com/prod-ucs-content-store-eu-west/content/pii:S0926860X17303125/gr7/THUMBNAIL/image/gif/695d1d13d11dceb4b7ec5b33d6953126/gr7.sml https://s3.amazonaws.com/prod-ucs-content-store-us-east/content/pii:S0926860X17303125/gr7/THUMBNAIL/image/gif/695d1d13d11dceb4b7ec5b33d6953126/gr7.sml gr7 gr7.sml sml 6093 68 219 IMAGE-THUMBNAIL 1-s2.0-S0926860X17303125-gr8.sml https://s3-eu-west-1.amazonaws.com/prod-ucs-content-store-eu-west/content/pii:S0926860X17303125/gr8/THUMBNAIL/image/gif/6ea1cc63b68a35cd225aeb6d43252e9b/gr8.sml https://s3.amazonaws.com/prod-ucs-content-store-us-east/content/pii:S0926860X17303125/gr8/THUMBNAIL/image/gif/6ea1cc63b68a35cd225aeb6d43252e9b/gr8.sml gr8 gr8.sml sml 6086 66 219 IMAGE-THUMBNAIL 1-s2.0-S0926860X17303125-fx1.jpg https://s3-eu-west-1.amazonaws.com/prod-ucs-content-store-eu-west/content/pii:S0926860X17303125/fx1/DOWNSAMPLED/image/jpeg/910c3e7d12134c258ccc24f3ab8db9b4/fx1.jpg https://s3.amazonaws.com/prod-ucs-content-store-us-east/content/pii:S0926860X17303125/fx1/DOWNSAMPLED/image/jpeg/910c3e7d12134c258ccc24f3ab8db9b4/fx1.jpg fx1 true fx1.jpg jpg 29500 200 435 IMAGE-DOWNSAMPLED 1-s2.0-S0926860X17303125-gr1.jpg https://s3-eu-west-1.amazonaws.com/prod-ucs-content-store-eu-west/content/pii:S0926860X17303125/gr1/DOWNSAMPLED/image/jpeg/060e56e0da223176d8a07a241d94d1ad/gr1.jpg https://s3.amazonaws.com/prod-ucs-content-store-us-east/content/pii:S0926860X17303125/gr1/DOWNSAMPLED/image/jpeg/060e56e0da223176d8a07a241d94d1ad/gr1.jpg gr1 gr1.jpg jpg 87077 451 565 IMAGE-DOWNSAMPLED 1-s2.0-S0926860X17303125-gr2.jpg https://s3-eu-west-1.amazonaws.com/prod-ucs-content-store-eu-west/content/pii:S0926860X17303125/gr2/DOWNSAMPLED/image/jpeg/9435ea26adc9872913d8fd88e9409b3a/gr2.jpg https://s3.amazonaws.com/prod-ucs-content-store-us-east/content/pii:S0926860X17303125/gr2/DOWNSAMPLED/image/jpeg/9435ea26adc9872913d8fd88e9409b3a/gr2.jpg gr2 gr2.jpg jpg 29577 124 565 IMAGE-DOWNSAMPLED 1-s2.0-S0926860X17303125-gr3.jpg https://s3-eu-west-1.amazonaws.com/prod-ucs-content-store-eu-west/content/pii:S0926860X17303125/gr3/DOWNSAMPLED/image/jpeg/177e1b123cc346afb4275f66ca0175e1/gr3.jpg https://s3.amazonaws.com/prod-ucs-content-store-us-east/content/pii:S0926860X17303125/gr3/DOWNSAMPLED/image/jpeg/177e1b123cc346afb4275f66ca0175e1/gr3.jpg gr3 gr3.jpg jpg 31897 179 527 IMAGE-DOWNSAMPLED 1-s2.0-S0926860X17303125-gr4.jpg https://s3-eu-west-1.amazonaws.com/prod-ucs-content-store-eu-west/content/pii:S0926860X17303125/gr4/DOWNSAMPLED/image/jpeg/40c23f9df641db3feb17cb89966a50f9/gr4.jpg https://s3.amazonaws.com/prod-ucs-content-store-us-east/content/pii:S0926860X17303125/gr4/DOWNSAMPLED/image/jpeg/40c23f9df641db3feb17cb89966a50f9/gr4.jpg gr4 gr4.jpg jpg 76077 378 565 IMAGE-DOWNSAMPLED 1-s2.0-S0926860X17303125-gr5.jpg https://s3-eu-west-1.amazonaws.com/prod-ucs-content-store-eu-west/content/pii:S0926860X17303125/gr5/DOWNSAMPLED/image/jpeg/bb7ecfab3e3025dff05622cafb280c74/gr5.jpg https://s3.amazonaws.com/prod-ucs-content-store-us-east/content/pii:S0926860X17303125/gr5/DOWNSAMPLED/image/jpeg/bb7ecfab3e3025dff05622cafb280c74/gr5.jpg gr5 gr5.jpg jpg 25209 213 318 IMAGE-DOWNSAMPLED 1-s2.0-S0926860X17303125-gr6.jpg https://s3-eu-west-1.amazonaws.com/prod-ucs-content-store-eu-west/content/pii:S0926860X17303125/gr6/DOWNSAMPLED/image/jpeg/316fd15ae4b70db12c60a9392768944d/gr6.jpg https://s3.amazonaws.com/prod-ucs-content-store-us-east/content/pii:S0926860X17303125/gr6/DOWNSAMPLED/image/jpeg/316fd15ae4b70db12c60a9392768944d/gr6.jpg gr6 gr6.jpg jpg 33777 149 565 IMAGE-DOWNSAMPLED 1-s2.0-S0926860X17303125-gr7.jpg https://s3-eu-west-1.amazonaws.com/prod-ucs-content-store-eu-west/content/pii:S0926860X17303125/gr7/DOWNSAMPLED/image/jpeg/cf8c3161f246f2ffc13c055e251f1db0/gr7.jpg https://s3.amazonaws.com/prod-ucs-content-store-us-east/content/pii:S0926860X17303125/gr7/DOWNSAMPLED/image/jpeg/cf8c3161f246f2ffc13c055e251f1db0/gr7.jpg gr7 gr7.jpg jpg 37599 176 563 IMAGE-DOWNSAMPLED 1-s2.0-S0926860X17303125-gr8.jpg https://s3-eu-west-1.amazonaws.com/prod-ucs-content-store-eu-west/content/pii:S0926860X17303125/gr8/DOWNSAMPLED/image/jpeg/543eea1166291cb75579a4c7b572f7f2/gr8.jpg https://s3.amazonaws.com/prod-ucs-content-store-us-east/content/pii:S0926860X17303125/gr8/DOWNSAMPLED/image/jpeg/543eea1166291cb75579a4c7b572f7f2/gr8.jpg gr8 gr8.jpg jpg 37072 171 564 IMAGE-DOWNSAMPLED 1-s2.0-S0926860X17303125-fx1_lrg.jpg https://s3-eu-west-1.amazonaws.com/prod-ucs-content-store-eu-west/content/pii:S0926860X17303125/fx1/HIGHRES/image/jpeg/b4eb40a19dd820bca96d13cfec6adac4/fx1_lrg.jpg https://s3.amazonaws.com/prod-ucs-content-store-us-east/content/pii:S0926860X17303125/fx1/HIGHRES/image/jpeg/b4eb40a19dd820bca96d13cfec6adac4/fx1_lrg.jpg fx1 true fx1_lrg.jpg jpg 249439 886 1926 IMAGE-HIGH-RES 1-s2.0-S0926860X17303125-gr1_lrg.jpg https://s3-eu-west-1.amazonaws.com/prod-ucs-content-store-eu-west/content/pii:S0926860X17303125/gr1/HIGHRES/image/jpeg/0c0ef1f4f1679c2e1f3d330fc5a791c4/gr1_lrg.jpg https://s3.amazonaws.com/prod-ucs-content-store-us-east/content/pii:S0926860X17303125/gr1/HIGHRES/image/jpeg/0c0ef1f4f1679c2e1f3d330fc5a791c4/gr1_lrg.jpg gr1 gr1_lrg.jpg jpg 776247 1997 2500 IMAGE-HIGH-RES 1-s2.0-S0926860X17303125-gr2_lrg.jpg https://s3-eu-west-1.amazonaws.com/prod-ucs-content-store-eu-west/content/pii:S0926860X17303125/gr2/HIGHRES/image/jpeg/fc4113145e436ecaddef459703d2a6df/gr2_lrg.jpg https://s3.amazonaws.com/prod-ucs-content-store-us-east/content/pii:S0926860X17303125/gr2/HIGHRES/image/jpeg/fc4113145e436ecaddef459703d2a6df/gr2_lrg.jpg gr2 gr2_lrg.jpg jpg 219986 550 2500 IMAGE-HIGH-RES 1-s2.0-S0926860X17303125-gr3_lrg.jpg https://s3-eu-west-1.amazonaws.com/prod-ucs-content-store-eu-west/content/pii:S0926860X17303125/gr3/HIGHRES/image/jpeg/7ab01343e62199d46cc2405b766afdbf/gr3_lrg.jpg https://s3.amazonaws.com/prod-ucs-content-store-us-east/content/pii:S0926860X17303125/gr3/HIGHRES/image/jpeg/7ab01343e62199d46cc2405b766afdbf/gr3_lrg.jpg gr3 gr3_lrg.jpg jpg 228101 794 2333 IMAGE-HIGH-RES 1-s2.0-S0926860X17303125-gr4_lrg.jpg https://s3-eu-west-1.amazonaws.com/prod-ucs-content-store-eu-west/content/pii:S0926860X17303125/gr4/HIGHRES/image/jpeg/85b44a9270a61205ca6c927efeab09b6/gr4_lrg.jpg https://s3.amazonaws.com/prod-ucs-content-store-us-east/content/pii:S0926860X17303125/gr4/HIGHRES/image/jpeg/85b44a9270a61205ca6c927efeab09b6/gr4_lrg.jpg gr4 gr4_lrg.jpg jpg 560834 1674 2500 IMAGE-HIGH-RES 1-s2.0-S0926860X17303125-gr5_lrg.jpg https://s3-eu-west-1.amazonaws.com/prod-ucs-content-store-eu-west/content/pii:S0926860X17303125/gr5/HIGHRES/image/jpeg/5c9508bc330ea7f080dd813fe56f3d4f/gr5_lrg.jpg https://s3.amazonaws.com/prod-ucs-content-store-us-east/content/pii:S0926860X17303125/gr5/HIGHRES/image/jpeg/5c9508bc330ea7f080dd813fe56f3d4f/gr5_lrg.jpg gr5 gr5_lrg.jpg jpg 204159 945 1409 IMAGE-HIGH-RES 1-s2.0-S0926860X17303125-gr6_lrg.jpg https://s3-eu-west-1.amazonaws.com/prod-ucs-content-store-eu-west/content/pii:S0926860X17303125/gr6/HIGHRES/image/jpeg/ad3b10a369c3a644b3b7221611355e1a/gr6_lrg.jpg https://s3.amazonaws.com/prod-ucs-content-store-us-east/content/pii:S0926860X17303125/gr6/HIGHRES/image/jpeg/ad3b10a369c3a644b3b7221611355e1a/gr6_lrg.jpg gr6 gr6_lrg.jpg jpg 291503 661 2500 IMAGE-HIGH-RES 1-s2.0-S0926860X17303125-gr7_lrg.jpg https://s3-eu-west-1.amazonaws.com/prod-ucs-content-store-eu-west/content/pii:S0926860X17303125/gr7/HIGHRES/image/jpeg/989bb12d29b3140c4e4310d12b30ab1b/gr7_lrg.jpg https://s3.amazonaws.com/prod-ucs-content-store-us-east/content/pii:S0926860X17303125/gr7/HIGHRES/image/jpeg/989bb12d29b3140c4e4310d12b30ab1b/gr7_lrg.jpg gr7 gr7_lrg.jpg jpg 288310 779 2493 IMAGE-HIGH-RES 1-s2.0-S0926860X17303125-gr8_lrg.jpg https://s3-eu-west-1.amazonaws.com/prod-ucs-content-store-eu-west/content/pii:S0926860X17303125/gr8/HIGHRES/image/jpeg/a3907ff164d6b07333d512fdde476a36/gr8_lrg.jpg https://s3.amazonaws.com/prod-ucs-content-store-us-east/content/pii:S0926860X17303125/gr8/HIGHRES/image/jpeg/a3907ff164d6b07333d512fdde476a36/gr8_lrg.jpg gr8 gr8_lrg.jpg jpg 283545 755 2496 IMAGE-HIGH-RES 1-s2.0-S0926860X17303125-mmc1.docx https://s3-eu-west-1.amazonaws.com/prod-ucs-content-store-eu-west/content/pii:S0926860X17303125/mmc1/MAIN/application/msword/be8943822832bb3aa52cedffdb862812/mmc1.docx https://s3.amazonaws.com/prod-ucs-content-store-us-east/content/pii:S0926860X17303125/mmc1/MAIN/application/msword/be8943822832bb3aa52cedffdb862812/mmc1.docx mmc1 mmc1.docx docx 118842 APPLICATION APCATA 16317 S0926-860X(17)30312-5 10.1016/j.apcata.2017.07.012 Elsevier B.V. Fig. 1 SEM images of typical SCS-synthesized TiO2-doped catalyst before (A) and after (B) calcining at 800°C; (C) XRD pattern of calcined TiO2-doped catalyst; (D) Raman spectra: (a) the calcined TiO2-doped catalyst, (b) Mn2O3, (c) TiO2, (d) Na2WO4. Note of SCS preparation: titanium isopropoxide (Ti-I) as Ti precursor, ϕ of 2, and calcination temperature of 800°C; 6wt% TiO2, 6wt% Mn2O3 and 10wt% Na2WO4 in catalyst. Fig. 2 Effects of (A) Ti precursor, (B) fuel/oxidizer ratio, and (C) calcination temperature on the catalytic OCM performance of the Ti-doped Mn2O3-Na2WO4/SiO2 catalyst. Reaction conditions: 1.0g catalyst, 700°C, GHSV of 8000 mLgcat. −1 h−1, CH4/O2/N2 molar ratio of 5/1/4, atmospheric pressure. Note of catalyst activation: by undergoing OCM reaction at 800°C for 2h. Fig. 3 Effects of the loadings of (A) TiO2 plus Mn2O3 and (B) Na2WO4 on the catalytic OCM performance of the TiO2-I-Mn2O3-Na2WO4/SiO2-2-800 catalyst. Reaction conditions: 1.0g catalyst, 700°C, GHSV of 8000 mLgcat. −1 h−1, CH4/O2/N2 molar ratio of 5/1/4, atmospheric pressure. Note of catalyst activation: see that in Fig. 2. Fig. 4 CH4 conversion and C2-C3 selectivity for the OCM reaction against (A) CH4/O2 ratio at GHSV of 8000 mLgcat. −1 h−1 and (B) GHSV for feed gas of CH4/O2/N2 =5/1/4, using 6-TiO2-I-6-Mn2O3-10-Na2WO4/SiO2-2-800 catalyst. Reaction temperature (i.e., catalyst bed temperature) dependent CH4 conversion and C2-C3 selectivity for the OCM reaction for feed gas of CH4/O2/N2 =5/1/4 at GHSV of 8000 mLgcat. −1 h−1, using (C) 6-TiO2-I-6-Mn2O3-10-Na2WO4/SiO2-2-800 and (D) 6-Mn2O3-10-Na2WO4/SiO2-2-800 catalysts. Note of catalyst activation: see that in Fig. 2. Fig. 5 XRD patterns of fresh as-synthesized samples without (a) and with (b) TiO2-doping, catalysts after calcining at 800°C without (c) and with (d) TiO2-doping, used catalysts without (e) and with (f) TiO2-doping. Reaction conditions: 1.0g catalyst, 700°C, GHSV of 8000 mLgcat. −1 h−1, CH4/O2/N2 molar ratio of 5/1/4, atmospheric pressure. Note of SCS preparation: see that in Fig. 1. Note of catalyst activation: see that in Fig. 2. Fig. 6 (A) XRD patterns of the TiO2-I-Mn2O3-10-Na2WO4/SiO2-2-800 catalyst with various loadings of TiO2 plus Mn2O3 after undergoing the OCM reaction at 800°C for 2h and then at 700°C for 0.5h. (B) XRD patterns, CH4 conversion (CCH4) and C2-C3 selectivity (SC2-C3) for the 6-TiO2-I-6-Mn2O3-10-Na2WO4/SiO2-2-800 catalysts after undergoing the OCM reaction first directly at 700°C for 0.5h (top) and subsequently at 800°C for 2h then at 700°C for another 0.5h (bottom). Reaction conditions: 1.0g catalyst, GHSV of 8000 mLgcat. −1 h−1, CH4/O2/N2 molar ratio of 5/1/4, atmospheric pressure. Fig. 7 Raman spectra of the various samples. (A) Pure Mn2O3, MnWO4, and MnTiO3, (B) used 6-TiO2-I-6-Mn2O3-10-Na2WO4/SiO2-2-800 (a) and 6-Mn2O3-10-Na2WO4/SiO2-2-800 (b) catalysts after undergoing the OCM reaction at 800°C for 2h then at 700°C for another 0.5h. (C) 6-TiO2-I-6-Mn2O3-10-Na2WO4/SiO2-2-800 catalyst after undergoing the OCM reaction first directly at 700°C for 0.5h (top) and subsequently at 800°C for 2h then at 700°C for another 0.5h (bottom). Reaction conditions: 1.0g catalyst, GHSV of 8000 mLgcat. −1 h−1, CH4/O2/N2 molar ratio of 5/1/4, atmospheric pressure. Fig. 8 (A) CH4 conversion and C2-C3 selectivity for the OCM reaction against the time on stream at 700°C using the 6-TiO2-I-6-Mn2O3-10-Na2WO4/SiO2-2-800 catalyst. (B) XRD pattern and (C) Raman spectrum of the catalyst after 250h OCM reaction testing. Note of catalyst activation: see that in Fig. 2. Reaction conditions: catalyst of 1.0g, GHSV of 8000 mLgcat. −1 h−1, CH4/O2/N2 molar ratio of 5/1/4, atmospheric pressure. Table 1 SSA and real contents of Mn, W, Na, and Ti of the calcined catalysts. Catalyst SSA (m2/g) Pore Size (nm) Content a (wt%) Mn W Na Ti TiO2-Mn2O3 Na2WO4/SiO2 1.6 24.8 4.0 5.2 1.1 3.5 Mn2O3 Na2WO4/SiO2 1.4 23.2 3.9 4.9 1.0 0.0 a All contents were determined by AES-ICP measurements. Research paper TiO2-doped Mn2O3-Na2WO4/SiO2 catalyst for oxidative coupling of methane: Solution combustion synthesis and MnTiO3-dependent low-temperature activity improvement Pengwei Wang 1 Guofeng Zhao 1 ⁎ Ye Liu Yong Lu ⁎ Shanghai Key Laboratory of Green Chemistry and Chemical Processes, School of Chemistry and Molecular Engineering, East China Normal University, Shanghai,200062, China Shanghai Key Laboratory of Green Chemistry and Chemical Processes School of Chemistry and Molecular Engineering East China Normal University Shanghai 200062 China ⁎ Corresponding authors. 1 These authors contributed equally to this work. Graphical abstract The Mn2O3-Na2WO4/SiO2 catalyst is the most promising one among the enormous catalysts for the oxidative coupling of methane (OCM) but only at above 800°C. No doubt that lowering temperature of the OCM process is at the forefront of this catalysis field. A promising low-temperature active and selective TiO2-doped Mn2O3 Na2WO4/SiO2 catalyst, consisting of 6wt% TiO2, 6wt% Mn2O3, 10wt% Na2WO4 and SiO2 in balance, is developed by solution combustion synthesis (SCS) method. This catalyst is capable of converting 20% CH4 with 70% selectivity to C2-C3 hydrocarbons even at 700°C (catalyst bed temperature) and is stable for at least 250h without deactivation sign, for a feed gas of 50% CH4 in air using a gas hourly space velocity of 8000mLgcat. −1 h−1. In contrast, the non-TiO2-doped SCS catalyst is almost inactive at 700°C whereas it can achieve reactivity (∼24% CH4 conversion and ∼74% C2-C3 selectivity) comparable to the TiO2-doped one at 800°C. XRD and Raman results evidently reveal that the formation of MnTiO3 during the OCM process appears to be important for the low-temperature OCM activity improvement by TiO2-doping. Keywords Oxidative coupling of methane Solution combustion synthesis Ethylene MnTiO3 Low-temperature activity 1 Introduction With the ever-growing resource and world output of natural gas and shale gas, methane conversion into the value-added chemicals and fuels has received more and more attentions from the worldwide petrochemical and energy industries, in order to alleviate our strong dependence on depleting oil resource [1,2]. Particularly, light olefins, the key building blocks in modern chemical industry, need an urgent production shift from oil to methane. Up to now, methane has been industrially converted into olefins in an indirect route, where methane is firstly and forcibly broken into the syngas (i.e., CO and H2) through the catalytic steam or autothermal reforming at above 700°C, followed by large-scaled conversion to methanol and then to olefins [3–5]. Additionally, syngas could also be directly converted into olefins in the presence of solid catalysts, such as the very recently reported bifunctional ZnCrOx-SAPO catalyst [6] and the cobalt carbide nanoprisms [7] with outstanding selectivity under mild conditions. However, the syngas route is negatively energy-costing and such indirect manner causes low atom-utilization efficiency. Therefore, the direct methane conversion into olefins is highly desirable and a large number of researches have been dedicated for a couple of decays to achieving this goal. The oxidative coupling of methane (OCM) is considered to be a promising route to directly convert methane into C2-C3 hydrocarbon products in the presence of molecular oxygen. It has been well indicated from many studies that OCM is a sequential process combining the heterogeneous-catalysis and homogeneous-coupling to achieve the methane-to-olefins transformation [8–10]. The OCM catalysts aim to generate methyl radicals (CH3·) and avoid deep oxidation (i.e., to form CO, CO2, and H2O) over their surface [11,12]. Therefore, the most critical performance of OCM catalyst is able to generate selective surface oxygen radicals that act as the active sites for generating CH3· [13–15]. Great attempts have been making to setup a catalyst recipe with such properties from the simple and complex oxides of alkaline, alkaline earth, and rare-earth elements [16–20]. Hundreds of catalysts have been examined aiming to favor C2-C3 selectivity and suppress overoxidation, such as the representative Li/MgO [21,22] and La-based oxides catalysts [23,24]. Li in Li/MgO catalyst acts as a structural modifier to enhance the catalyst OCM performance [21], but suffers from its loss during the long-term running [22]; the La-based catalysts suffer from the relatively lower C2-C3 selectivity. Among these catalysts, the Mn2O3-Na2WO4/SiO2 is considered to be the most promising one, in terms of 20∼30% methane conversion with 60∼80%C2-C3 selectivity and in particular hundreds of hours stability [25]. However, this catalyst must be operated at above 800°C and the slight reduction of temperature to below 800°C will deteriorate sharply the catalyst activity even quench the OCM reaction [26]. In order to enhance the low-temperature performance of the Mn2O3-Na2WO4/SiO2 catalyst, enormous work has been carried out on catalyst preparation and additive modification. The Mn2O3-Na2WO4/SiO2 catalyst is usually prepared by the traditional methods such as incipient wetness impregnation, mixture slurry, and sol-gel methods [27]. Recently, solution combustion synthesis (SCS) strategy becomes more and more attractive to prepare homogeneous, high-purity, and complex nanostructured metal-oxides catalysts [28]. Compared to the traditional methods, SCS is a one-step method by self-propagating high-temperature synthesis with the raw materials mixed in liquid phase [29–31]. For example, the typical reaction between metal nitrate and glycine for the preparation of nanostructured La2O3 catalyst is shown by Eq. (1), where ϕ represents the fuel/oxidizer ratio: ϕ of 1 indicates the stoichiometric ratio that no more molecular oxygen is required; ϕ below 1 implies that molecular oxygen is generated; while ϕ above 1 means that molecular oxygen is needed [32]. Notably, modulating synthesis parameters such as fuel/oxidizer ratio and the property of fuels can tune the structure and texture of the as-synthesized catalyst [33,34]. Recently, the SCS method has been reported to be successfully applied to synthesize several promising OCM catalysts such as Sr-Al complex oxides, La2O3, La-Sr-Al complex oxides, and Mn2O3-Na2WO4/SiO2 [35], with improved C2-C3 yield. In particular, the SCS-prepared Mn2O3-Na2WO4/SiO2 catalyst successfully reduces the reaction temperature from above 800°C for the regularly-prepared counterparts to 750°C along with high C2-C3 yield of ca. 25% (for a feed gas of CH4:O2:N2 =2:1:0.63). In addition, Ce and La can also be easily introduced into the Mn2O3-Na2WO4/SiO2 catalyst by SCS method [35,36], which generates more reactive oxygen to further enhance the catalyst performance. 2La(NO3)3 +3.33ϕH2N(CH2)CO2H+7.5(ϕ−1)O2 → (1) La2O3 + ϕ(6.67CO2 +8.33H2O+1.67N2) + 3N2 Besides opening up new preparation method, additive modification is another aspect to promote the catalyst low-temperature performance [37–39]. As mentioned above, activating oxygen molecules into desirable reactive oxygen species on the catalyst surface is a critical step that induces the methane activation to produce CH3· and then C2-C3 products. Freund et al. [37] reported a highly ordered CaO film modified with Mo2+, and supposed that the generated superoxide anions (O2 −) attributes to methane activation. Trunschke et al. [38] provided the Fe and Cu co-doped polycrystalline MgO, which can effectively activate oxygen to produce peroxy (O2 2−) species for promoting the ethane or ethylene formation. Therefore, a question jumping out is whether the OCM reaction temperature is dominated by the O2 activation temperature. If so, making efforts to lower the O2 activation temperature by additive modification seems to be another key to improving the low-temperature activity for the Mn2O3-Na2WO4/SiO2 catalyst. In this paper, we present a strategy to introduce TiO2 into the Mn2O3-Na2WO4/SiO2 catalyst by SCS method to prepare TiO2-doped counterpart, with the aim to enhance the low-temperature catalytic activity and selectivity for the OCM process. The catalyst preparation parameters (including Ti-precursors, fuel/oxidizer ratio, calcination temperature, and active component loadings) and OCM reaction conditions (including CH4/O2 molar ratio, gas hourly space velocity (GHSV), and reaction temperature) were systematically investigated. Excitingly, the reaction temperature (the real catalyst bed temperature in present work) could be reduced from >800°C for the regular literature Mn2O3-Na2WO4/SiO2 catalyst to 700°C after TiO2-doping through the SCS method, achieving 20% CH4 conversion with 70% selectivity to C2-C3. Probings of catalyst phase and surface, using XRD and Raman, reveal that the in-situ formation of MnTiO3 is paramount for the enhancement of catalyst low-temperature activity for the OCM process. 2 Experimental 2.1 Materials All chemicals in this work were purchased from Sinopharm Chemical Reagent Co., Ltd, China: sodium tungstate dihydrate (AR), 50wt% manganese(II) nitrate aqueous solution (AR), tetraethyl orthosilicate (AR), tetrabutyl titanate (CP), titanium isopropoxide (CP), titanium n-propoxide (CP), and 65wt% nitric acid aqueous solution (AR). They were all used as received. 2.2 Catalyst preparation Regular Mn2O3-Na2WO4/SiO2 catalyst and the TiO2-doped Mn2O3-Na2WO4/SiO2 catalyst were prepared by the reported SCS method [35,36]. Mn(NO3)2 aqueous solution and Na2WO4 were employed as precursors for Mn-, Na- and W-containing components. Tetraethyl orthosilicate and titanate (titanium isopropoxide, titanium n-propoxide or tetrabutyl titanate) were the precursors for SiO2 and TiO2 compounds while serving as fuels in the SCS process. For the SCS method, HNO3 was used as oxidizer. The ϕ (i.e., fuel/oxidizer ratio) was tuned in the range from 1 to 3 by adding appropriate amount of 65wt% HNO3 aqueous solution. In brief, the Mn, Na, and W precursors were mixed together with the tetraethyl orthosilicate and titanate in deionized water in a ceramic bowl, and appropriate amount of HNO3 according to the ϕ vale was added subsequently. The mixture was then continuously stirred at 80°C until it was transformed into the sticky gel. Subsequently, the ceramic bowl with such gel was transferred into a muffle furnace. When heating the gel to 300°C, self-ignition combustion took place to form brown solid product. A stainless steel screen with 140mesh opening was used for covering the ceramic bowl to prevent the formed powders from escaping. All as-synthesized catalysts were calcined at 500–900°C in air for 4h, crashed and sieved to collect 100–120mesh fine particles for use in OCM reaction testing. The catalyst was denoted as a-TiO2-b-Mn2O3-c-Na2WO4/SiO2-ϕ-x (a, TiO2 loading; b, Mn2O3 loading; c, Na2WO4 loading; ϕ, fuel/oxidizer ratio; x, calcination temperature). 2.3 Catalyst characterization Catalysts were characterized by X-ray diffraction (XRD, Rigaku Uitima IV diffractometer with Cu Kα radiation (35kV and 25mA); Japan), scanning electron microscopy (SEM, Hitachi S-4800; Japan) equipped with an energy dispersive X-Ray fluorescence spectrometer (EDX, Oxford; UK) and inductively coupled plasma atomic emission spectrometry (ICP-AES, ICP Thermo IRIS Intrepid II XSP; USA). Specific surface area (SSA) was determined from N2 adsorption isotherm at −196°C using standard Brunauer-Emmett-Teller (BET) theory on a Quanta chrome Autosorb–3B instrument (USA). Raman measurements were carried out using a Raman spectrometer (Renishaw inVia) with a 532nm semiconductor laser as excitation and the samples were scanned from 800 to 2000cm−1. It is equipped with a charge coupled device (CCD) camera enabling microanalysis on a sample point. 2.4 Reactivity tests OCM reaction was performed in a fixed-bed quartz tube reactor (400mm length and 16mm inner diameter straight cylindrical tube) under atmospheric pressure. The catalyst of 1.0g was loaded in the reactor and the catalyst bed thickness was approximately 10mm in each OCM reaction testing. The reactants, methane (99.99%), oxygen (99.999%), and nitrogen (99.99%) as dilution, were co-fed into the reactor by three calibrated mass flow controllers. GHSV was varied in the range of 2000–15000 mLgcat. −1 h−1 and CH4:O2 molar ratio was investigated from 2 to 8. In our present work, reaction temperature is the catalyst bed temperature, which was monitored by a thermo-couple placed in the middle of the catalyst bed. The catalysts were activated by directly undergoing the OCM reaction at 800°C for 2h. After that, the catalyst bed reaction temperature was gradually reduced to 780, 760, 720, and 700°C, to investigate their temperature-dependent OCM performance. All data were collected after reaction at each temperature for at least 0.5h (ensure to reach steady-state). The effluent gas was analysed with an online gas chromatograph equipped with a thermal conductivity detector (TCD), using a 30m DM-Plot Q capillary column (for the separation of CO2, CH4, C2H4, C2H6, C3H6, and C3H8) and a 60m DM-Plot Msieve 5A column (for the separation of N2, O2, CO, and CH4) in parallel. 3 Results and discussion 3.1 Catalyst characteristics Fig. 1 and Table 1 show the characteristics of catalysts in terms of surface morphology, chemical composition, and textural and structural properties. Fig. 1A shows the SEM image of the typical as-synthesized TiO2-doped Mn2O3-Na2WO4/SiO2 catalyst by SCS method. It can be seen that the catalyst surface is rough and porous, which is the characteristic of sample prepared by SCS method [28]. After calcining at 800°C, the rough surface become smooth associated with serious pore collapse, being consistent with its small specific surface area (SSA) of 1.4m2 g−1 (Fig. 1B, Table 1). Contents of Mn, W and Na in our TiO2-doped Mn2O3-Na2WO4/SiO2 catalysts by SCS method are almost identical to those of the regular Mn2O3-Na2WO4/SiO2 catalyst while both of them show similar small SSA (1.2-1.4m2 g−1) (Table 1). Fig. 1C shows the XRD patterns of the as-calcined TiO2-doped catalyst. The phases of ɑ-cristobalite, Na2WO4 and Mn2O3 are clearly observed, which are critical for the regular Mn2O3-Na2WO4/SiO2 catalyst. What to be noted is that Mn2+ (from the Mn(NO3)2 precursor) is fully oxidized into Mn3+ because of the sufficient oxygen in the calcining environment, while the introduced Ti element is transformed into TiO2. The as-calcined catalyst was also characterized by Raman spectroscopy as well as the pure samples of Na2WO4, TiO2 and Mn2O3 for reference. Clearly, the as-calcined catalyst shows a very strong Mn2O3 Raman band compared to the bands to TiO2 and Na2WO4 (Fig. 1D). In combining this information with the fact that Mn2O3 shows the weaker XRD peak than TiO2 and Na2WO4, it is rational to infer that the Mn2O3 dominates the catalyst surface. 3.2 Catalytic OCM performance of TiO2-doped Mn2O3-Na2WO4/SiO2 catalyst 3.2.1 Effects of Ti precursors, ϕ, and calcination temperature As well known, the SCS preparation parameters including Ti precursors, ϕ, and calcination temperature, always play critical roles in tuning the catalyst performance [28]. The effect of Ti-precursors was studied on the OCM performance of our SCS catalysts, by employing the common isopropoxide (denoted as Ti-I), titanium n-propoxide (denoted as Ti-II), and tetrabutyl titanate (denoted as Ti-III). By setting TiO2, Mn2O3, and Na2WO4 loadings as 6, 6, and 10wt%, ϕ as 2, and calcination temperature as 800°C, three catalysts were obtained by SCS method and denoted as TiO2-I-Mn2O3-Na2WO4/SiO2, TiO2-II-Mn2O3-Na2WO4/SiO2, and TiO2-III-Mn2O3-Na2WO4/SiO2. These catalysts were tested in the OCM reaction at 700°C for a feed gas of CH4:O2:N2 =5:1:4, using a total GHSV of 8000 mLgcat. −1 h−1, with the results as shown in Fig. 2 A. Prior to testing experiments at 700°C, the catalysts were in situ activated by undergoing the OCM reaction at 800°C for 2h. Clearly, the TiO2-I-Mn2O3-Na2WO4/SiO2 catalyst achieves higher activity and selectivity compared to the TiO2-II-Mn2O3-Na2WO4/SiO2 and TiO2-III-Mn2O3-Na2WO4/SiO2. Over the TiO2-I-Mn2O3-Na2WO4/SiO2 catalyst, a high CH4 conversion of 20% is obtained with a high C2-C3 selectivity of 70%. Therefore, titanium isopropoxide (Ti-I) is selected to prepare the OCM catalysts by SCS method for follow-up studies. In addition, ϕ is another important parameter for the SCS catalysts. Its effect on the TiO2-I-Mn2O3-Na2WO4/SiO2 catalyst was investigated in a range from 1 to 3 (i.e., ϕ =1.0, 1.5, 2.0, 2.5, and 3.0, respectively) with the results as shown in Fig. 2B. At 700°C and a GHSV of 8000 mLgcat. −1 h−1, CH4 conversion and C2-C3 selectivity are improved from 14 to 20% and from 65 to 70% along with the increase of ϕ from 1.0 to 2.0, and then reaches a plateau with further increasing ϕ up to 3.0. Accordingly, the optimal value of ϕ is determined as 2.0. Moreover, the effect of calcination temperature was also studied on the OCM performance of the TiO2-I-Mn2O3-Na2WO4/SiO2 catalyst by fixing ϕ to 2.0. As shown in Fig. 2C, in the calcination temperature range studied from 500 to 900°C, a volcano-shaped CH4 conversion evolution is observed with a maxima of 20% at a calcination temperature of 800°C; while C2-C3 selectivity is increased from 66 to 70% with calcination temperature from 500 to 800°C but shows no alteration with further increasing the calcination temperature to 900°C. Clearly, the optimal calcination temperature is found to be 800°C for achieving a good SCS catalyst using titanium isopropoxide (Ti-I) as precursor at a ϕ of 2.0. 3.2.2 Effects of TiO2, Mn2O3, and Na2WO4 loadings Effects of TiO2, Mn2O3, and Na2WO4 loadings on the TiO2-I-Mn2O3 Na2WO4/SiO2 catalyst performance were systematically investigated at a GHSV of 8000 mLgcat. −1 h−1 for a feed gas of CH4:O2:N2 =5:1:4. What to be first noted is that Mn and Ti species could be combined and transformed into MnTiO3 in the real reaction stream, which is paramount for the improvement of low-temperature OCM activity of catalysts (detailed results and discussion given in the posterior sections of 3.4 and 3.5). The Mn:Ti ratios of 1:1.5, 1:2, 1.5:1 and 2:1 were also tested (Fig. S2). The results show that the catalytic performance with these Mn:Ti ratios is similar to that with Mn:Ti ratio of 1:1 (Fig. 3 A), indicating that the catalyst performance is mainly determined by MnTiO3 rather than the excessively-formed TiO2 (for the catalysts with Mn:Ti ratios of 1:1.5 and 1:2) or Mn2O3 (for the catalysts with Mn:Ti ratios of 1.5:1 and 2:1). Therefore, the loading of TiO2 plus Mn2O3 at a fixed Ti/Mn molar ratio of 1:1 was initially investigated from 4 to 20wt% with a constant Na2WO4 loading of 10wt%. CH4 conversion and C2-C3 selectivity against the loading of TiO2 plus Mn2O3 are shown in Fig. 3A. At 700°C, clearly, the CH4 conversion and C2-C3 selectivity are promoted from 15 to 20% and 55–70%, along with the increase in the loading of TiO2 plus Mn2O3 from 4 to 12wt%. Nevertheless, further increasing the loading of TiO2 plus Mn2O3 to 20wt% does not yield better CH4 conversion as well as C2-C3 selectivity. Subsequently, effect of Na2WO4 loading (from 5 to 20wt%) was investigated on the TiO2-I-Mn2O3-Na2WO4/SiO2 catalyst performance. To address this issue, the loading of TiO2 plus Mn2O3 was fixed at 12wt%. As seen in Fig. 3B, the CH4 conversion and C2-C3 selectivity are slightly increased from 18 to 20% and 68–70% with increasing the Na2WO4 loading from 5 to 10wt%, and then plateau with further increasing the Na2WO4 loading up to 20wt%. Based on the above systematic investigation and analysis, the catalyst preparation conditions can be optimized as following: titanium isopropoxide (Ti-1) as Ti precursor, ϕ of 2, TiO2 plus Mn2O3 loading of 12wt% with Mn/Ti molar ratio of 1:1 (i.e., 6wt% Mn2O3 and 6wt% TiO2), Na2WO4 loading of 10wt%, and calcination temperature of 800°C. This promising catalyst is denoted as 6-TiO2-I-6-Mn2O3-10-Na2WO4/SiO2-2-800. 3.2.3 Effects of reaction variables Fig. 4 shows the effect of reaction variables on the OCM performance over the 6-TiO2-I-6-Mn2O3-10-Na2WO4/SiO2-2-800 catalyst. Clearly, the CH4 conversion and C2-C3 selectivity are dependent on the CH4/O2 molar ratio, GHSV, and catalyst bed temperature. The CH4/O2 molar ratio is very critical to the CH4 conversion and especially the selectivity to C2-C3 products. As shown in Fig. 4A, use of low CH4/O2 molar ratio (i.e., high oxygen concentration in catalyst bed) results in a reduction of selectivity due to the facilitation of deep oxidation, whereas the high CH4/O2 molar ratio (i.e., low oxygen concentration) worsens the CH4 conversion other than the selectivity. Such observation is in accordance with the reported results [40]. At 700°C and a GHSV of 8000 mLgcat. −1 h−1, the CH4 conversion is monotonously decreased from 26.5 to 15.8% while the C2-C3 selectivity is inversely from 52.5 to 76.5% with the increase in CH4/O2 molar ratio from 2 to 8 (Fig. 4A). A volcano-shaped yield to C2-C3 is observed against the CH4/O2 molar ratio and a C2-C3 yield maxima of 14% appears at the CH4/O2 molar ratio of 5. In this case, the CH4 conversion of 20% is achieved with a high C2-C3 selectivity of 70%. Fig. 4B shows the GHSV dependent CH4 conversion and C2-C3 selectivity for a feed gas with CH4/O2 molar ratio of 5 at 700°C. With the increase in the GHSV from 2000 to 8000 mLgcat. −1 h−1, clearly, the CH4 conversion is decreased slightly from 24.8 to 20% whereas the selectivity to C2-C3 is inversely increased from 55 to 70% dramatically. With further increasing the GHSV up to 15000 mLgcat. −1 h−1, the CH4 conversion shows a big reduction to 12.8% and the selectivity to C2-C3 is improved further but slowly to 74.8%. Similar observation is consistent with the literature report [41]. Fig. 4C shows the CH4 conversion and C2-C3 selectivity against the reaction temperature using a feed gas of CH4:O2:N2 =5:1:4 at a GHSV of 8000 mLgcat. −1 h−1, showing that high temperature is favourable to improve not only the CH4 conversion but also the C2-C3 selectivity. At a high temperature of 800°C, a high CH4 conversion of 25% is achievable with a high C2-C3 selectivity to 74%. Most notably, the CH4 conversion and C2-C3 selectivity at this level (i.e. ∼20% conversion and ∼70% selectivity) is well sustained after decreasing the catalyst bed temperature to 700°C. Even at 680°C, an interesting CH4 conversion of 14% can still be achieved with a fair C2-C3 selectivity of 55%. For comparison, the non-TiO2-doped Mn2O3-6-Na2WO4-10/SiO2 (6wt% Mn2O3 and 10wt% Na2WO4 and without TiO2-doping) catalyst was also prepared by SCS method [35,36] under the optimum preparation conditions, and was examined in the OCM reaction under the identical reaction conditions. As shown in Fig. 4D, not surprisingly, this reference catalyst achieves a high CH4 conversion of 24% with a nice C2-C3 selectivity of 72% at 800°C, being comparable to those of our TiO2-doped SCS catalyst (Fig. 4C). However, at 700°C it almost loses the activity (less than 6% CH4 conversion) and achieves a poor C2-C3 selectivity of less than 30% (Fig. 4D). These distinct results solidly evidence that TiO2-doping remarkably enhances the low-temperature OCM activity/selectivity of the Mn2O3-Na2WO4/SiO2. In addition, the OCM product distributions (21.3%C2H6, 43.5% C2H4, 3.3% C3H8, and 2% C3H6) for the 6-TiO2-I-6-Mn2O3-10-Na2WO4/SiO2-2-800 catalyst at 700°C using a feed gas of CH4:O2:N2 =5:1:4 and a GHSV of 8000 mLgcat. −1 h−1 are shown in Fig. S1, and the effects of reaction conditions and catalyst preparation parameters on the product distributions are also investigated with the results as shown in Table S1 and Table S2. Clearly, the product distribution is sensitive to the reaction conditions (especially the reaction temperature and GHSV) but not to the catalyst preparation parameters studied. With the increase in either the reaction temperature or GHSV, ethylene formation is favourable thereby leading to an increase in the ratio of ethylene to ethane. Tuning the CH4/O2 ratio makes the product distributions changed a little, whereas the ratio of ethylene to ethane remains almost constant at ∼2 at 700°C in the whole CH4/O2 ratio investigated. 3.3 Insight into the TiO2-doping chemistry in low-temperature OCM catalysis: XRD and Raman studies To allow the above evidenced low-temperature activity improvement effect by TiO2-doping to be optimized and exploited more rationally in the future work, it is imperative to explore the TiO2-doping catalysis of the OCM reaction. To accomplish this goal, XRD and Raman techniques were employed to track the bulk and surface evolution behaviors of the 6-Mn2O3-10-Na2WO4/SiO2 catalysts before and after TiO2-doping. The used catalysts were particularly characterized and analyzed because of the inevitable reconstruction of the surface even bulk phase. The freshly-synthesized, calcined, and used samples of the 6-Mn2O3-10-Na2WO4/SiO2 and 6-TiO2-I-6-Mn2O3-10-Na2WO4/SiO2 catalysts were characterized by XRD, and their patterns are shown in Fig. 5 . For the freshly-synthesized samples (patterns a and b), no any characteristic diffraction peak of Ti-, Mn-, Na-, and/or W- containing compounds is observable but a dispersing peak for amorphous SiO2 at 2 theta of 23.3°, indicating the high dispersion of these species. After calcination at 800°C in air for 4h (patterns c and d), amorphous SiO2 is transformed into ɑ-cristobalite, tridymite and/or some quartz whereas phases of Na2WO4, Mn2O3 and MnWO4 appear; interestingly, XRD peaks of MnWO4 phase are stronger for the 6-Mn2O3-10-Na2WO4/SiO2 catalyst than for the 6-TiO2-I-6-Mn2O3-10-Na2WO4/SiO2 catalyst (patterns c and d), suggesting that the MnWO4 formation is more preferable in the former than in the latter during the calcination treatment at 800°C. After reaction (at 800°C for 2h and subsequently at 700°C for another 0.5h), no appearance of new compound phase is observable on the used 6-Mn2O3-10-Na2WO4/SiO2 catalyst whereas the MnWO4 phase peaks become stronger compared to the calcined one (patterns c and e); in contrast, on the used 6-TiO2-I-6-Mn2O3-10-Na2WO4/SiO2 catalyst, a new phase formation of MnTiO3 compound is evidently detectable by XRD while the peak intensity of MnWO4 is in turn weakened in comparison with the used 6-Mn2O3-10-Na2WO4/SiO2 catalyst (patterns e and f). Regarding the Na2WO4, its role in improving the selectivity and promoting the transformation from amorphous SiO2 to ɑ-cristobalite in the OCM reaction has been widely confirmed and accepted in a large number of studies [25,26]. In combining this information with the fact that the TiO2-doped catalyst achieved satisfying low-temperature OCM activity (e.g., at or even below 700°C), it is rational to infer that the formation of MnTiO3 is paramount for the dramatic improvement of the catalyst low-temperature activity. To further verify the promotion effect of MnTiO3 on the low-temperature activity, the catalysts with increased TiO2 plus Mn2O3 loading (Ti/Mn ratio of 1:1 to correspond to MnTiO3 formation) from 4 to 20wt%, after undergoing the OCM reaction as in the Section of 3.2.2, were also characterized by the XRD. The XRD patterns are shown in Fig. 6 A as well as the part of 2 theta from 30 to 40° magnified in Fig. 6B. Clearly, formation of MnTiO3 compound is observed on all these used catalysts and its peak intensity is monotonously increased with the increase in the TiO2 plus Mn2O3 loading from 4 to 20wt%. As show in Fig. 3A, at 700°C the CH4 conversion and C2-C3 selectivity are respectively promoted from 15 to 20% and 55–70% along with the increase in the TiO2 plus Mn2O3 loading from 4 to 12wt%, and then illustrate a plateau with further increasing it up to 20wt%. No doubt that the MnTiO3 formation is essential to improve the catalyst low-temperature activity but in a certain amount range. It is noted that, prior to reacting at 700°C for 0.5h, these catalysts all undergo OCM reaction at 800°C for 2h and therefore the MnTiO3 compounds are already formed. If directly reacting at 700°C, the 6-TiO2-I-6-Mn2O3-10-Na2WO4/SiO2 catalyst, quite similar to the non-TiO2-doped one (Fig. 4D), delivers a very low CH4 conversion (6%) with a C2-C3 selectivity of only 28% because no any MnTiO3 compound is formed (Fig. 6B). After elevating this TiO2-doped catalyst bed temperature to 800°C and running the OCM reaction for 2h, not surprisingly, the formation of MnTiO3 compound is clearly observed (Fig. 6B). Accompanied with the formation of MnTiO3 compound, interestingly, this TiO2-doped catalyst become highly active and selective at low temperature of 700°C, achieving a high CH4 conversion of 20% with a high C2 C3 selectivity of 70% (Fig. 6B). The Raman spectroscopy was also employed to monitor the catalyst surface. The Raman spectra for the pure MnTiO3, Mn2O3 and MnWO4 compounds were recorded as reference, which are displayed in Fig. 7 A. On the used 6-TiO2-I-6-Mn2O3-10-Na2WO4/SiO2 catalyst after reaction at 800°C for 2h and then at 700°C for another 0.5h, a MnTiO3-enriched surface is observed with some Na2WO4, TiO2 and α-cristobalite but no any Mn2O3 is detected (Fig. 7B, spectrum a). On the used 6-Mn2O3-10-Na2WO4/SiO2 catalyst, the surface is dominated by MnWO4 with detectable α-cristobalite and Na2WO4 (Fig. 7B, spectrum b). When directly running at 700°C, both catalysts with and without TiO2-doping show comparable but poor activity and selectivity, and meanwhile, similar Raman spectra are observed on their surfaces, which are very close to the pure Mn2O3 sample (Fig. 7C). After undergoing the OCM reaction at 800°C for 2h and then at 700°C for 0.5h, a MnTiO3-enriched surface appears on the 6-TiO2-I-6-Mn2O3-10-Na2WO4/SiO2 catalyst (Fig. 7C), associated with a sharp increase of CH4 conversion from 6% to 20% and C2-C3 selectivity 28% to 70% (Fig. 6B). The above Raman-indicated MnTiO3-enriched surface formation in correspondence to the high CH4 conversion and high C2-C3 selectivity solidly confirms again that MnTiO3 governs the low-temperature OCM activity for our TiO2-doped Mn2O3-10-Na2WO4/SiO2 catalysts. 3.4 Stability Stability is a very critical practical consideration for a heterogeneous catalyst. At 700°C and a total GHSV of 8000 mLgcat. −1 h−1, as shown in Fig. 8 A, the 6-TiO2-I-6-Mn2O3-10-Na2WO4/SiO2 catalyst is stable for at least 250h without deactivation sign for a feed gas of CH4:O2:N2 =5:1:4; the CH4 conversion remains at 19–21% throughout entire 250h testing while C2-C3 selectivity is retained at 68–72% with an ethylene/ethane ratio of 2. After 250h testing, the used catalyst was also characterized by XRD and Raman, with the results as shown in Fig. 8B,C. Clearly, the bulk phase and surface compositions almost maintain unchanged even after 250 testing, compared to those at the beginning (Fig. 5, XRD pattern a; Fig. 7B, Raman spectrum a). Most notably, the bulk phase of formed MnTiO3 is sustained with a MnTiO3-enriched surface throughout the 250h testing (Fig. 8B,C), which is critical to assure the promising activity/selectivity maintenance. 4 Conclusions Low-temperature active, selective and stable Ti-doped Mn2O3-Na2WO4/SiO2 catalyst has been developed through the SCS method for the OCM reaction. The most promising catalyst, with 6wt% TiO2, 6wt% Mn2O3 and 10wt%Na2WO4, is obtained using titanium isopropoxide (Ti-I) as Ti precursor, ϕ of 2 and calcination temperature of 800°C. This catalyst, activated by undergoing the OCM at 800°C for 2h, achieves a high CH4 conversion of ∼20% with a high C2-C3 selectivity of ∼70% and is stable for at least 250h at 700°C and GHSV of 8000 mLgcat. −1 h−1 for a feed gas of CH4:O2:N2 =5:1:4. Both XRD and Raman results consistently reveal that bulk MnTiO3 phase is formed during the OCM process in association with a derived MnTiO3-enriched catalyst surface, which appears to be important for the dramatic improvement of catalyst low-temperature activity for the OCM reaction. Acknowledgments This work has been funded by the NSF of China (21473057, U1462129, 21322307, 21273075, 21076083) and the “973 program” (2011CB201403) from the MOST of China. Appendix A Supplementary data Supplementary data associated with this article can be found, in the online version, at http://dx.doi.org/10.1016/j.apcata.2017.07.012 . Appendix A Supplementary data The following is Supplementary data to this article: References [1] R. Boswell Science 325 2009 957 958 [2] E. McFarland Science 338 2012 340 342 [3] J.M. Fox Catal. Rev. 35 1993 169 212 [4] H. Koempel W. Liebner Stud. Surf. Sci. Catal. 167 2007 261 267 [5] P. Tian Y. Wei M. Ye Z. Liu ACS Catal. 5 2015 1922 1938 [6] F. Jiao J. Li X. Pan J. Xiao H. Li H. Ma M. Wei Y. Pan Z. Zhou M. Li S. Miao J. Li Y. Zhu D. Xiao T. He J. Yang F. Qi Q. Fu X. Bao Science 351 2016 1065 1068 [7] L. Zhong F. Yu Y. An Y. Zhao Y. Sun Z. Li T. Lin Y. Lin X. Qi Y. Dai L. Gu J. Hu S. Jin Q. Shen H. Wang Nature 53 2016 884 887 [8] D. Dissanayake J.H. Lunsford M.P. Rosynek J. Catal. 146 1994 613 615 [9] D.J. Driscoll W. Martir J.X. Wang J.H. Lunsford J. Am. Chem. Soc. 107 1985 58 63 [10] O.V. Buyevskaya M. Rothaemel H.W. Zanthoff M. Baerns J. Catal. 150 1994 71 80 [11] S.C. Reyes C.P. Kelkar E. Iglesia Catal. Lett. 19 1993 167 180 [12] Y.D. Tong M.P. Rosynek J.H. Lunsford J. Phys. Chem. 93 1989 2896 2898 [13] T.L. Yang L.B. Feng R.L. Hou X.J. Ding S.K. Shen Nat. Gas Convers. II 81 1994 281 283 [14] R.Q. Long S.Q. Zhou Y.P. Huang H.Y. Wang H.L. Wan K.R. Tsai Chin. Chem. Lett. 6 1995 727 730 [15] E.N. Voskresenskaya V.G. Roguleva A.G. Anshits Catal. Rev. 37 1995 101 143 [16] F. Papa D. Gingasu L. Patron A. Miyazaki I. Balint Appl. Catal. A: Gen. 375 2010 172 178 [17] N. Yaghobi M.H.R. Ghoreishy J. Nat. Gas Chem. 17 2008 8 16 [18] H.B. Zhang G.D. Lin H.L. Wan Y.D. Liu W.Z. Weng J.X. Cai Y.F. Shen K.R. Tsai Catal. Lett. 73 2001 141 147 [19] K. Aika T. Nishiyama Stud. Surf. Sci. Catal. 61 1991 165 171 [20] J.H. Lunsford Angew. Chem. Int. Ed. 34 1995 970 980 [21] L. Luo Y. Jin H. Pan X. Zheng L. Wu R. You W. Huang J. Catal. 346 2017 57 61 [22] T. Ito J.H. Lunsford Nature 314 1985 721 722 [23] T. LeVan M. Chen M. Kermarec C. Louis J.M. Tatibouët Catal. Lett. 6 1990 395 400 [24] S. Sugiyama Y. Matsumura J.B. Moffat J. Catal. 139 1993 338 350 [25] X. Fang S. Li J. Lin J. Gu D. Yan J. Mol. Catal. (China) 6 1992 254 262 [26] S. Arndt T. Otremba U. Simon M. Yildiz H. Schubert R. Schomäcker Appl. Catal. A: Gen. 425–426 2012 53 61 [27] J. Wang L. Chou J. Mol. Catal. A: Chem. 245 2006 272 277 [28] A. Varma A.S. Mukasyan A.S. Rogachev K.V. Manukyan Chem. Rev. 116 2016 14493 14586 [29] K. Deshpande A. Mukasyan A. Varma Chem. Mater. 16 2004 4896 4904 [30] S.T. Aruna A.S. Mukasyan Curr. Sci. 12 2008 44 50 [31] K.C. Patil M.S. Hegde R. Tanu S.T. Aruna Chemistry of Nanocrystalline Oxide Materials-Combustion Synthesis 2008 World Scientific Publishing Co. Pvt. Ltd. Singapore [32] S.R. Jain K.C. Adiga Combust. Flame 40 1981 71 79 [33] K. Deshpande A. Mukasyan A. Varma J. Am. Ceram. Soc. 86 2003 1149 1154 [34] P. Erri J. Nader A. Varma Adv. Mater. 20 2008 1243 1245 [35] R. Ghose H.T. Hwang A. Varma Appl. Catal. A: Gen. 452 2013 147 154 [36] R. Ghose H.T. Hwang A. Varma Appl. Catal. A: Gen. 472 2014 39 46 [37] Y. Cui X. Shao M. Baldofski J. Sauer N. Nilius H. Freund Angew. Chem. Int. Ed. 52 2013 11385 11387 [38] P. Schwach M.G. Willinger A. Trunschke R. Schlögl Angew. Chem. Int. Ed. 52 2013 11381 11384 [39] R. Yunarti S. Gu J. Choi J. Jae D. Suh M. Ha ACS Sustain. Chem. Eng. 5 2017 3667 3674 [40] G.S. Lane E.E. Wolf J. Catal. 113 1988 144 163 [41] N. Yaghobi M.H.R. Ghoreishy J. Nat. Gas Chem. 18 2009 39 44",
      "scopus-id": "85023625942",
      "coredata": {
        "eid": "1-s2.0-S0926860X17303125",
        "dc:description": "The Mn2O3-Na2WO4/SiO2 catalyst is the most promising one among the enormous catalysts for the oxidative coupling of methane (OCM) but only at above 800°C. No doubt that lowering temperature of the OCM process is at the forefront of this catalysis field. A promising low-temperature active and selective TiO2-doped Mn2O3 Na2WO4/SiO2 catalyst, consisting of 6wt% TiO2, 6wt% Mn2O3, 10wt% Na2WO4 and SiO2 in balance, is developed by solution combustion synthesis (SCS) method. This catalyst is capable of converting 20% CH4 with 70% selectivity to C2-C3 hydrocarbons even at 700°C (catalyst bed temperature) and is stable for at least 250h without deactivation sign, for a feed gas of 50% CH4 in air using a gas hourly space velocity of 8000mLgcat. −1 h−1. In contrast, the non-TiO2-doped SCS catalyst is almost inactive at 700°C whereas it can achieve reactivity (∼24% CH4 conversion and ∼74% C2-C3 selectivity) comparable to the TiO2-doped one at 800°C. XRD and Raman results evidently reveal that the formation of MnTiO3 during the OCM process appears to be important for the low-temperature OCM activity improvement by TiO2-doping.",
        "openArchiveArticle": "false",
        "prism:coverDate": "2017-08-25",
        "openaccessUserLicense": null,
        "prism:aggregationType": "Journal",
        "prism:url": "https://api.elsevier.com/content/article/pii/S0926860X17303125",
        "dc:creator": [
          {
            "@_fa": "true",
            "$": "Wang, Pengwei"
          },
          {
            "@_fa": "true",
            "$": "Zhao, Guofeng"
          },
          {
            "@_fa": "true",
            "$": "Liu, Ye"
          },
          {
            "@_fa": "true",
            "$": "Lu, Yong"
          }
        ],
        "link": [
          {
            "@_fa": "true",
            "@rel": "self",
            "@href": "https://api.elsevier.com/content/article/pii/S0926860X17303125"
          },
          {
            "@_fa": "true",
            "@rel": "scidir",
            "@href": "https://www.sciencedirect.com/science/article/pii/S0926860X17303125"
          }
        ],
        "dc:format": "application/json",
        "openaccessType": null,
        "pii": "S0926-860X(17)30312-5",
        "prism:volume": "544",
        "prism:publisher": "Elsevier B.V.",
        "dc:title": "TiO2-doped Mn2O3-Na2WO4/SiO2 catalyst for oxidative coupling of methane: Solution combustion synthesis and MnTiO3-dependent low-temperature activity improvement",
        "prism:copyright": "© 2017 Elsevier B.V. All rights reserved.",
        "openaccess": "0",
        "prism:issn": "0926860X",
        "dcterms:subject": [
          {
            "@_fa": "true",
            "$": "Oxidative coupling of methane"
          },
          {
            "@_fa": "true",
            "$": "Solution combustion synthesis"
          },
          {
            "@_fa": "true",
            "$": "Ethylene"
          },
          {
            "@_fa": "true",
            "$": "MnTiO3"
          },
          {
            "@_fa": "true",
            "$": "Low-temperature activity"
          }
        ],
        "openaccessArticle": "false",
        "prism:publicationName": "Applied Catalysis A: General",
        "openaccessSponsorType": null,
        "prism:pageRange": "77-83",
        "prism:endingPage": "83",
        "pubType": "fla",
        "prism:coverDisplayDate": "25 August 2017",
        "prism:doi": "10.1016/j.apcata.2017.07.012",
        "prism:startingPage": "77",
        "dc:identifier": "doi:10.1016/j.apcata.2017.07.012",
        "openaccessSponsorName": null
      },
      "objects": {
        "object": [
          {
            "@category": "thumbnail",
            "@height": "101",
            "@width": "219",
            "@_fa": "true",
            "$": "https://api.elsevier.com/content/object/eid/1-s2.0-S0926860X17303125-fx1.sml?httpAccept=%2A%2F%2A",
            "@multimediatype": "GIF image file",
            "@type": "IMAGE-THUMBNAIL",
            "@size": "14317",
            "@ref": "fx1",
            "@mimetype": "image/gif"
          },
          {
            "@category": "thumbnail",
            "@height": "164",
            "@width": "205",
            "@_fa": "true",
            "$": "https://api.elsevier.com/content/object/eid/1-s2.0-S0926860X17303125-gr1.sml?httpAccept=%2A%2F%2A",
            "@multimediatype": "GIF image file",
            "@type": "IMAGE-THUMBNAIL",
            "@size": "15476",
            "@ref": "gr1",
            "@mimetype": "image/gif"
          },
          {
            "@category": "thumbnail",
            "@height": "48",
            "@width": "219",
            "@_fa": "true",
            "$": "https://api.elsevier.com/content/object/eid/1-s2.0-S0926860X17303125-gr2.sml?httpAccept=%2A%2F%2A",
            "@multimediatype": "GIF image file",
            "@type": "IMAGE-THUMBNAIL",
            "@size": "4189",
            "@ref": "gr2",
            "@mimetype": "image/gif"
          },
          {
            "@category": "thumbnail",
            "@height": "75",
            "@width": "219",
            "@_fa": "true",
            "$": "https://api.elsevier.com/content/object/eid/1-s2.0-S0926860X17303125-gr3.sml?httpAccept=%2A%2F%2A",
            "@multimediatype": "GIF image file",
            "@type": "IMAGE-THUMBNAIL",
            "@size": "5836",
            "@ref": "gr3",
            "@mimetype": "image/gif"
          },
          {
            "@category": "thumbnail",
            "@height": "147",
            "@width": "219",
            "@_fa": "true",
            "$": "https://api.elsevier.com/content/object/eid/1-s2.0-S0926860X17303125-gr4.sml?httpAccept=%2A%2F%2A",
            "@multimediatype": "GIF image file",
            "@type": "IMAGE-THUMBNAIL",
            "@size": "12152",
            "@ref": "gr4",
            "@mimetype": "image/gif"
          },
          {
            "@category": "thumbnail",
            "@height": "147",
            "@width": "219",
            "@_fa": "true",
            "$": "https://api.elsevier.com/content/object/eid/1-s2.0-S0926860X17303125-gr5.sml?httpAccept=%2A%2F%2A",
            "@multimediatype": "GIF image file",
            "@type": "IMAGE-THUMBNAIL",
            "@size": "9868",
            "@ref": "gr5",
            "@mimetype": "image/gif"
          },
          {
            "@category": "thumbnail",
            "@height": "58",
            "@width": "219",
            "@_fa": "true",
            "$": "https://api.elsevier.com/content/object/eid/1-s2.0-S0926860X17303125-gr6.sml?httpAccept=%2A%2F%2A",
            "@multimediatype": "GIF image file",
            "@type": "IMAGE-THUMBNAIL",
            "@size": "6805",
            "@ref": "gr6",
            "@mimetype": "image/gif"
          },
          {
            "@category": "thumbnail",
            "@height": "68",
            "@width": "219",
            "@_fa": "true",
            "$": "https://api.elsevier.com/content/object/eid/1-s2.0-S0926860X17303125-gr7.sml?httpAccept=%2A%2F%2A",
            "@multimediatype": "GIF image file",
            "@type": "IMAGE-THUMBNAIL",
            "@size": "6093",
            "@ref": "gr7",
            "@mimetype": "image/gif"
          },
          {
            "@category": "thumbnail",
            "@height": "66",
            "@width": "219",
            "@_fa": "true",
            "$": "https://api.elsevier.com/content/object/eid/1-s2.0-S0926860X17303125-gr8.sml?httpAccept=%2A%2F%2A",
            "@multimediatype": "GIF image file",
            "@type": "IMAGE-THUMBNAIL",
            "@size": "6086",
            "@ref": "gr8",
            "@mimetype": "image/gif"
          },
          {
            "@category": "standard",
            "@height": "200",
            "@width": "435",
            "@_fa": "true",
            "$": "https://api.elsevier.com/content/object/eid/1-s2.0-S0926860X17303125-fx1.jpg?httpAccept=%2A%2F%2A",
            "@multimediatype": "JPEG image file",
            "@type": "IMAGE-DOWNSAMPLED",
            "@size": "29500",
            "@ref": "fx1",
            "@mimetype": "image/jpeg"
          },
          {
            "@category": "standard",
            "@height": "451",
            "@width": "565",
            "@_fa": "true",
            "$": "https://api.elsevier.com/content/object/eid/1-s2.0-S0926860X17303125-gr1.jpg?httpAccept=%2A%2F%2A",
            "@multimediatype": "JPEG image file",
            "@type": "IMAGE-DOWNSAMPLED",
            "@size": "87077",
            "@ref": "gr1",
            "@mimetype": "image/jpeg"
          },
          {
            "@category": "standard",
            "@height": "124",
            "@width": "565",
            "@_fa": "true",
            "$": "https://api.elsevier.com/content/object/eid/1-s2.0-S0926860X17303125-gr2.jpg?httpAccept=%2A%2F%2A",
            "@multimediatype": "JPEG image file",
            "@type": "IMAGE-DOWNSAMPLED",
            "@size": "29577",
            "@ref": "gr2",
            "@mimetype": "image/jpeg"
          },
          {
            "@category": "standard",
            "@height": "179",
            "@width": "527",
            "@_fa": "true",
            "$": "https://api.elsevier.com/content/object/eid/1-s2.0-S0926860X17303125-gr3.jpg?httpAccept=%2A%2F%2A",
            "@multimediatype": "JPEG image file",
            "@type": "IMAGE-DOWNSAMPLED",
            "@size": "31897",
            "@ref": "gr3",
            "@mimetype": "image/jpeg"
          },
          {
            "@category": "standard",
            "@height": "378",
            "@width": "565",
            "@_fa": "true",
            "$": "https://api.elsevier.com/content/object/eid/1-s2.0-S0926860X17303125-gr4.jpg?httpAccept=%2A%2F%2A",
            "@multimediatype": "JPEG image file",
            "@type": "IMAGE-DOWNSAMPLED",
            "@size": "76077",
            "@ref": "gr4",
            "@mimetype": "image/jpeg"
          },
          {
            "@category": "standard",
            "@height": "213",
            "@width": "318",
            "@_fa": "true",
            "$": "https://api.elsevier.com/content/object/eid/1-s2.0-S0926860X17303125-gr5.jpg?httpAccept=%2A%2F%2A",
            "@multimediatype": "JPEG image file",
            "@type": "IMAGE-DOWNSAMPLED",
            "@size": "25209",
            "@ref": "gr5",
            "@mimetype": "image/jpeg"
          },
          {
            "@category": "standard",
            "@height": "149",
            "@width": "565",
            "@_fa": "true",
            "$": "https://api.elsevier.com/content/object/eid/1-s2.0-S0926860X17303125-gr6.jpg?httpAccept=%2A%2F%2A",
            "@multimediatype": "JPEG image file",
            "@type": "IMAGE-DOWNSAMPLED",
            "@size": "33777",
            "@ref": "gr6",
            "@mimetype": "image/jpeg"
          },
          {
            "@category": "standard",
            "@height": "176",
            "@width": "563",
            "@_fa": "true",
            "$": "https://api.elsevier.com/content/object/eid/1-s2.0-S0926860X17303125-gr7.jpg?httpAccept=%2A%2F%2A",
            "@multimediatype": "JPEG image file",
            "@type": "IMAGE-DOWNSAMPLED",
            "@size": "37599",
            "@ref": "gr7",
            "@mimetype": "image/jpeg"
          },
          {
            "@category": "standard",
            "@height": "171",
            "@width": "564",
            "@_fa": "true",
            "$": "https://api.elsevier.com/content/object/eid/1-s2.0-S0926860X17303125-gr8.jpg?httpAccept=%2A%2F%2A",
            "@multimediatype": "JPEG image file",
            "@type": "IMAGE-DOWNSAMPLED",
            "@size": "37072",
            "@ref": "gr8",
            "@mimetype": "image/jpeg"
          },
          {
            "@category": "high",
            "@height": "886",
            "@width": "1926",
            "@_fa": "true",
            "$": "https://api.elsevier.com/content/object/eid/1-s2.0-S0926860X17303125-fx1_lrg.jpg?httpAccept=%2A%2F%2A",
            "@multimediatype": "JPEG image file",
            "@type": "IMAGE-HIGH-RES",
            "@size": "249439",
            "@ref": "fx1",
            "@mimetype": "image/jpeg"
          },
          {
            "@category": "high",
            "@height": "1997",
            "@width": "2500",
            "@_fa": "true",
            "$": "https://api.elsevier.com/content/object/eid/1-s2.0-S0926860X17303125-gr1_lrg.jpg?httpAccept=%2A%2F%2A",
            "@multimediatype": "JPEG image file",
            "@type": "IMAGE-HIGH-RES",
            "@size": "776247",
            "@ref": "gr1",
            "@mimetype": "image/jpeg"
          },
          {
            "@category": "high",
            "@height": "550",
            "@width": "2500",
            "@_fa": "true",
            "$": "https://api.elsevier.com/content/object/eid/1-s2.0-S0926860X17303125-gr2_lrg.jpg?httpAccept=%2A%2F%2A",
            "@multimediatype": "JPEG image file",
            "@type": "IMAGE-HIGH-RES",
            "@size": "219986",
            "@ref": "gr2",
            "@mimetype": "image/jpeg"
          },
          {
            "@category": "high",
            "@height": "794",
            "@width": "2333",
            "@_fa": "true",
            "$": "https://api.elsevier.com/content/object/eid/1-s2.0-S0926860X17303125-gr3_lrg.jpg?httpAccept=%2A%2F%2A",
            "@multimediatype": "JPEG image file",
            "@type": "IMAGE-HIGH-RES",
            "@size": "228101",
            "@ref": "gr3",
            "@mimetype": "image/jpeg"
          },
          {
            "@category": "high",
            "@height": "1674",
            "@width": "2500",
            "@_fa": "true",
            "$": "https://api.elsevier.com/content/object/eid/1-s2.0-S0926860X17303125-gr4_lrg.jpg?httpAccept=%2A%2F%2A",
            "@multimediatype": "JPEG image file",
            "@type": "IMAGE-HIGH-RES",
            "@size": "560834",
            "@ref": "gr4",
            "@mimetype": "image/jpeg"
          },
          {
            "@category": "high",
            "@height": "945",
            "@width": "1409",
            "@_fa": "true",
            "$": "https://api.elsevier.com/content/object/eid/1-s2.0-S0926860X17303125-gr5_lrg.jpg?httpAccept=%2A%2F%2A",
            "@multimediatype": "JPEG image file",
            "@type": "IMAGE-HIGH-RES",
            "@size": "204159",
            "@ref": "gr5",
            "@mimetype": "image/jpeg"
          },
          {
            "@category": "high",
            "@height": "661",
            "@width": "2500",
            "@_fa": "true",
            "$": "https://api.elsevier.com/content/object/eid/1-s2.0-S0926860X17303125-gr6_lrg.jpg?httpAccept=%2A%2F%2A",
            "@multimediatype": "JPEG image file",
            "@type": "IMAGE-HIGH-RES",
            "@size": "291503",
            "@ref": "gr6",
            "@mimetype": "image/jpeg"
          },
          {
            "@category": "high",
            "@height": "779",
            "@width": "2493",
            "@_fa": "true",
            "$": "https://api.elsevier.com/content/object/eid/1-s2.0-S0926860X17303125-gr7_lrg.jpg?httpAccept=%2A%2F%2A",
            "@multimediatype": "JPEG image file",
            "@type": "IMAGE-HIGH-RES",
            "@size": "288310",
            "@ref": "gr7",
            "@mimetype": "image/jpeg"
          },
          {
            "@category": "high",
            "@height": "755",
            "@width": "2496",
            "@_fa": "true",
            "$": "https://api.elsevier.com/content/object/eid/1-s2.0-S0926860X17303125-gr8_lrg.jpg?httpAccept=%2A%2F%2A",
            "@multimediatype": "JPEG image file",
            "@type": "IMAGE-HIGH-RES",
            "@size": "283545",
            "@ref": "gr8",
            "@mimetype": "image/jpeg"
          },
          {
            "@category": "standard",
            "@_fa": "true",
            "$": "https://api.elsevier.com/content/object/eid/1-s2.0-S0926860X17303125-mmc1.docx?httpAccept=%2A%2F%2A",
            "@multimediatype": "Microsoft Word file",
            "@type": "APPLICATION",
            "@size": "118842",
            "@ref": "mmc1",
            "@mimetype": "application/word"
          }
        ]
      },
      "link": {
        "@rel": "abstract",
        "@href": "https://api.elsevier.com/content/abstract/scopus_id/85023625942"
      }
    }
  }
}