{
  "metadata": {
    "title": "Effect of ZrO<ce:inf loc=post>2</ce:inf>, Al<ce:inf loc=post>2</ce:inf>O<ce:inf loc=post>3</ce:inf> and La<ce:inf loc=post>2</ce:inf>O<ce:inf loc=post>3</ce:inf> on cobalt–copper catalysts for higher alcohols synthesis",
    "authors": "; ",
    "journal": "Applied Catalysis A: General",
    "date": "2015-10-25",
    "doi": "10.1016/j.apcata.2015.09.032",
    "abstract": "",
    "uri": "https://api.elsevier.com/content/article/pii/S0926860X15301654",
    "pii": "S0926860X15301654"
  },
  "fulltext": {
    "full-text-retrieval-response": {
      "scopus-eid": "2-s2.0-84943229993",
      "originalText": "serial JL 271346 291210 291744 291809 31 Applied Catalysis A: General APPLIEDCATALYSISAGENERAL 2015-09-26 2015-09-26 2015-10-06 2015-10-06 2019-10-26T16:43:45 1-s2.0-S0926860X15301654 S0926-860X(15)30165-4 S0926860X15301654 10.1016/j.apcata.2015.09.032 S300 S300.2 FULL-TEXT 1-s2.0-S0926860X15X00160 2024-01-01T12:30:29.635264Z 0 0 20151025 2015 2015-09-26T09:16:19.230857Z absattachment articleinfo articletitlenorm authfirstinitialnorm authfirstsurnamenorm cid cids contenttype copyright crossmark dateloaded dateloadedtxt datesearch datesort dateupdated dco docsubtype doctype doi eid ewtransactionid hubeid indexeddate issn issnnorm itemstage itemtransactionid itemweight openaccess openarchive pg pgfirst pglast pii piinorm pubdatestart pubdatetxt pubyr sectiontitle sortorder srctitle srctitlenorm srctype ssids alllist content subj subheadings suppl tomb volfirst volissue volumelist webpdf webpdfpagecount yearnav figure table body acknowledge affil articletitle auth authfirstini authfull authkeywords authlast grantnumber grantsponsor grantsponsorid highlightsabst orcid primabst ref specialabst 0926-860X 0926860X true 507 507 C Volume 507 10 75 81 75 81 20151025 25 October 2015 2015-10-25 2015 Articles article fla Copyright © 2015 Published by Elsevier B.V. EFFECTZRO2AL2O3LA2O3COBALTCOPPERCATALYSTSFORHIGHERALCOHOLSSYNTHESIS WANG Z 1 Introduction 2 Experimental 2.1 Catalyst preparation 2.2 Composition and surface area 2.3 Hydrogen temperature programmed reduction (H2-TPR) 2.4 In situ X-ray diffraction (XRD) 2.5 X-ray photoelectron spectroscopy (XPS) 2.6 Reaction studies 2.7 Temperature programmed oxidation (TPO) coupled with mass spectroscopic measurements on used catalysts 3 Results and discussion 3.1 Composition and surface area 3.2 TPR 3.3 In situ X-ray diffraction 3.4 XPS 3.5 Catalyst activity test 4 Conclusion Acknowledgements References GUPTA 2011 641 656 M SUBRAMANI 2008 814 839 V HOLY 1985 219 223 N GRONCHI 1994 115 126 P HU 2007 90 95 J HAN 2013 81 87 L FANG 2009 133 138 K COURTY 1982 241 254 P MOUADDIB 1989 3413 3424 N SMITH 2012 7931 7939 M XIANG 2013 7114 7117 Y PRIETO 2014 6397 6401 G SUBRAMANIAN 2009 100 106 N MOUADDIB 1994 63 72 N LEBARBIER 2011 17440 17451 V JACOBS 2002 215 226 G HILMEN 1999 169 188 A WANG 2012 51 61 J MOULDER 1992 J HANDBOOKXRAYPHOTOELECTRONSPECTROSCOPYAREFERENCEBOOKSTANDARDSPECTRAFORIDENTIFICATIONINTERPRETATIONXPSDATA SPIVEY 2007 1514 1528 J WANG 2013 1111 1122 J ICHIKAWA 1985 321 323 M XIANG 2014 2792 2800 Y VOLKOVA 2000 389 393 G KARACA 2011 14 26 H KWAK 2013 27 36 G CLAEYS 2014 193 202 M MOODLEY 2009 102 110 D LEE 1988 199 207 D SAIB 2010 271 282 A PENNLINE 1984 388 393 H PAN 2014 79 85 Z LUISETTO 2015 12 22 I ISHIDA 2013 145 154 T WANGX2015X75 WANGX2015X75X81 WANGX2015X75XZ WANGX2015X75X81XZ https://vtw.elsevier.com/content/oragreement/10131 CHU_DOE publishAcceptedManuscriptIndexable 2016-10-05T00:00:00Z http://www.elsevier.com/open-access/userlicense/1.0/ 2016-10-05T00:00:00Z http://creativecommons.org/licenses/by-nc-nd/4.0/ 2019-03-22T13:30:22.622Z http://vtw.elsevier.com/data/voc/AddOnTypes/50.7/nlp S0926860X15301654 Energy Frontier Research Center US Department of Energy Office of Basic Energy Sciences DE-SC0001058 Center for Atomic Level Catalyst Design division of Scientific User Facilities Oak Ridge National Laboratory Oak Ridge National Laboratory http://data.elsevier.com/vocabulary/SciValFunders/100006228 http://sws.geonames.org/6252001/ Office of Science Office of Science http://data.elsevier.com/vocabulary/SciValFunders/100006132 http://sws.geonames.org/6252001/ This material is based upon work supported as part of the Center for Atomic Level Catalyst Design, an Energy Frontier Research Center funded by the US Department of Energy, Office of Science, Office of Basic Energy Sciences under Award Number DE-SC0001058 . A part of this study was conducted at the Center for Nanophase Material Sciences, which is sponsored at Oak Ridge National Laboratory by the division of Scientific User Facilities, US Department of Energy . The authors are thankful to Dr. Viviane Schwartz and Dr. Jong Kahk Keum for setting up in situ XRD experiments. The help of Kimberly Hutchison from North Carolina State University, Department of Soil Science on ICP-OES analysis is gratefully acknowledged. https://doi.org/10.15223/policy-017 https://doi.org/10.15223/policy-037 https://doi.org/10.15223/policy-012 https://doi.org/10.15223/policy-029 https://doi.org/10.15223/policy-004 item S0926-860X(15)30165-4 S0926860X15301654 1-s2.0-S0926860X15301654 10.1016/j.apcata.2015.09.032 271346 2024-01-01T12:30:29.635264Z 2015-10-25 1-s2.0-S0926860X15301654-main.pdf https://s3.amazonaws.com/prod-ucs-content-store-us-east/content/pii:S0926860X15301654/MAIN/application/pdf/9a61069482bb389a89b65f038c0e74a0/main.pdf main.pdf pdf true 1298336 MAIN 7 1-s2.0-S0926860X15301654-main_1.png https://s3.amazonaws.com/prod-ucs-content-store-us-east/content/pii:S0926860X15301654/PREVIEW/image/png/e88dbb8ed2c228672399f19343d2d099/main_1.png main_1.png png 57208 849 656 IMAGE-WEB-PDF 1 1-s2.0-S0926860X15301654-fx1.sml https://s3.amazonaws.com/prod-ucs-content-store-us-east/content/pii:S0926860X15301654/fx1/THUMBNAIL/image/gif/1ac4989deb3a4a68bd9af1652dc29700/fx1.sml fx1 true fx1.sml sml 6008 88 219 IMAGE-THUMBNAIL 1-s2.0-S0926860X15301654-gr1.sml https://s3.amazonaws.com/prod-ucs-content-store-us-east/content/pii:S0926860X15301654/gr1/THUMBNAIL/image/gif/f0674bb36869e5c0f9b38467ec04a94d/gr1.sml gr1 gr1.sml sml 11440 164 203 IMAGE-THUMBNAIL 1-s2.0-S0926860X15301654-gr2.sml https://s3.amazonaws.com/prod-ucs-content-store-us-east/content/pii:S0926860X15301654/gr2/THUMBNAIL/image/gif/d578d7a62a4abf9383c9790020c8cccd/gr2.sml gr2 gr2.sml sml 19158 164 172 IMAGE-THUMBNAIL 1-s2.0-S0926860X15301654-gr3.sml https://s3.amazonaws.com/prod-ucs-content-store-us-east/content/pii:S0926860X15301654/gr3/THUMBNAIL/image/gif/d484888fd8e2812d00ba5ccd7607ebf7/gr3.sml gr3 gr3.sml sml 11991 129 219 IMAGE-THUMBNAIL 1-s2.0-S0926860X15301654-gr4.sml https://s3.amazonaws.com/prod-ucs-content-store-us-east/content/pii:S0926860X15301654/gr4/THUMBNAIL/image/gif/310c336578a706a2dcc6076c37e9a15b/gr4.sml gr4 gr4.sml sml 9346 162 53 IMAGE-THUMBNAIL 1-s2.0-S0926860X15301654-gr5.sml https://s3.amazonaws.com/prod-ucs-content-store-us-east/content/pii:S0926860X15301654/gr5/THUMBNAIL/image/gif/f7f0e21cfc7965671b96252a1c924b59/gr5.sml gr5 gr5.sml sml 9637 108 219 IMAGE-THUMBNAIL 1-s2.0-S0926860X15301654-fx1.jpg https://s3.amazonaws.com/prod-ucs-content-store-us-east/content/pii:S0926860X15301654/fx1/DOWNSAMPLED/image/jpeg/43259ea33d17edb39cd3c7f9b20cef74/fx1.jpg fx1 true fx1.jpg jpg 24631 200 500 IMAGE-DOWNSAMPLED 1-s2.0-S0926860X15301654-gr1.jpg https://s3.amazonaws.com/prod-ucs-content-store-us-east/content/pii:S0926860X15301654/gr1/DOWNSAMPLED/image/jpeg/b27f139e5dfc21db0d30c67ef005d0d7/gr1.jpg gr1 gr1.jpg jpg 40385 317 393 IMAGE-DOWNSAMPLED 1-s2.0-S0926860X15301654-gr2.jpg https://s3.amazonaws.com/prod-ucs-content-store-us-east/content/pii:S0926860X15301654/gr2/DOWNSAMPLED/image/jpeg/eaf2940e1f206441c33fa4b4a02de442/gr2.jpg gr2 gr2.jpg jpg 142623 717 753 IMAGE-DOWNSAMPLED 1-s2.0-S0926860X15301654-gr3.jpg https://s3.amazonaws.com/prod-ucs-content-store-us-east/content/pii:S0926860X15301654/gr3/DOWNSAMPLED/image/jpeg/9ad290f02ee43111ab5d898f54d75159/gr3.jpg gr3 gr3.jpg jpg 40577 231 393 IMAGE-DOWNSAMPLED 1-s2.0-S0926860X15301654-gr4.jpg https://s3.amazonaws.com/prod-ucs-content-store-us-east/content/pii:S0926860X15301654/gr4/DOWNSAMPLED/image/jpeg/ed477a32239f987200308bb1e7d79b84/gr4.jpg gr4 gr4.jpg jpg 85517 979 321 IMAGE-DOWNSAMPLED 1-s2.0-S0926860X15301654-gr5.jpg https://s3.amazonaws.com/prod-ucs-content-store-us-east/content/pii:S0926860X15301654/gr5/DOWNSAMPLED/image/jpeg/4543712e13dd29211dc419e13b154bae/gr5.jpg gr5 gr5.jpg jpg 37164 241 489 IMAGE-DOWNSAMPLED 1-s2.0-S0926860X15301654-fx1_lrg.jpg https://s3.amazonaws.com/prod-ucs-content-store-us-east/content/pii:S0926860X15301654/fx1/HIGHRES/image/jpeg/482f1fd73634073c36a78440f2a2ba54/fx1_lrg.jpg fx1 true fx1_lrg.jpg jpg 161781 886 2213 IMAGE-HIGH-RES 1-s2.0-S0926860X15301654-gr1_lrg.jpg https://s3.amazonaws.com/prod-ucs-content-store-us-east/content/pii:S0926860X15301654/gr1/HIGHRES/image/jpeg/2b52e4e9162c3fda6afd291ae5559d60/gr1_lrg.jpg gr1 gr1_lrg.jpg jpg 174101 1406 1742 IMAGE-HIGH-RES 1-s2.0-S0926860X15301654-gr2_lrg.jpg https://s3.amazonaws.com/prod-ucs-content-store-us-east/content/pii:S0926860X15301654/gr2/HIGHRES/image/jpeg/33ac5bba3bf512d3a1a12bed705b0683/gr2_lrg.jpg gr2 gr2_lrg.jpg jpg 838604 3173 3333 IMAGE-HIGH-RES 1-s2.0-S0926860X15301654-gr3_lrg.jpg https://s3.amazonaws.com/prod-ucs-content-store-us-east/content/pii:S0926860X15301654/gr3/HIGHRES/image/jpeg/0f0a8ca4e86713b018fc0571e649621e/gr3_lrg.jpg gr3 gr3_lrg.jpg jpg 165971 1026 1742 IMAGE-HIGH-RES 1-s2.0-S0926860X15301654-gr4_lrg.jpg https://s3.amazonaws.com/prod-ucs-content-store-us-east/content/pii:S0926860X15301654/gr4/HIGHRES/image/jpeg/9281e348055bf88362cba48ba258c430/gr4_lrg.jpg gr4 gr4_lrg.jpg jpg 480055 4333 1421 IMAGE-HIGH-RES 1-s2.0-S0926860X15301654-gr5_lrg.jpg https://s3.amazonaws.com/prod-ucs-content-store-us-east/content/pii:S0926860X15301654/gr5/HIGHRES/image/jpeg/1425708cfedf07e22add5c5195927ce7/gr5_lrg.jpg gr5 gr5_lrg.jpg jpg 188212 1069 2167 IMAGE-HIGH-RES 1-s2.0-S0926860X15301654-Zi_Wang_Metal_oxide_promoters_2015_P19.jpg https://s3-eu-west-1.amazonaws.com/prod-ucs-content-store-eu-west/content/egi:1095CP6HVQG/PAGE-IMAGE/image/jpg/1b0a7dea7be7b7eecb3e82fa3f20a5b5/Zi_Wang_Metal_oxide_promoters_2015_P19.jpg https://s3.amazonaws.com/prod-ucs-content-store-us-east/content/egi:1095CP6HVQG/PAGE-IMAGE/image/jpg/1b0a7dea7be7b7eecb3e82fa3f20a5b5/Zi_Wang_Metal_oxide_promoters_2015_P19.jpg https://ucs.elsevier.com/asset/7dac7269-1a9e-4ef6-83c3-e96175ade1f2 Zi_Wang_Metal_oxide_promoters_2015_P19 Zi_Wang_Metal_oxide_promoters_2015_P19.jpg jpg 195658 ALTIMG 1-s2.0-S0926860X15301654-Zi_Wang_Metal_oxide_promoters_2015_P05.jpg https://s3-eu-west-1.amazonaws.com/prod-ucs-content-store-eu-west/content/egi:1095CP6HVQG/PAGE-IMAGE/image/jpg/be68e3bad3d65e37881d9a500bfffd1f/Zi_Wang_Metal_oxide_promoters_2015_P05.jpg https://s3.amazonaws.com/prod-ucs-content-store-us-east/content/egi:1095CP6HVQG/PAGE-IMAGE/image/jpg/be68e3bad3d65e37881d9a500bfffd1f/Zi_Wang_Metal_oxide_promoters_2015_P05.jpg https://ucs.elsevier.com/asset/1632aca5-8abb-4234-a9c7-27bd4375891c Zi_Wang_Metal_oxide_promoters_2015_P05 Zi_Wang_Metal_oxide_promoters_2015_P05.jpg jpg 552560 ALTIMG 1-s2.0-S0926860X15301654-Zi_Wang_Metal_oxide_promoters_2015_P22.jpg https://s3-eu-west-1.amazonaws.com/prod-ucs-content-store-eu-west/content/egi:1095CP6HVQG/PAGE-IMAGE/image/jpg/2345be8edf268dd87975efc314ad941a/Zi_Wang_Metal_oxide_promoters_2015_P22.jpg https://s3.amazonaws.com/prod-ucs-content-store-us-east/content/egi:1095CP6HVQG/PAGE-IMAGE/image/jpg/2345be8edf268dd87975efc314ad941a/Zi_Wang_Metal_oxide_promoters_2015_P22.jpg https://ucs.elsevier.com/asset/94ed4da6-5a38-4b8c-bdd4-3db40f01ff97 Zi_Wang_Metal_oxide_promoters_2015_P22 Zi_Wang_Metal_oxide_promoters_2015_P22.jpg jpg 466531 ALTIMG 1-s2.0-S0926860X15301654-Zi_Wang_Metal_oxide_promoters_2015_P16.jpg https://s3-eu-west-1.amazonaws.com/prod-ucs-content-store-eu-west/content/egi:1095CP6HVQG/PAGE-IMAGE/image/jpg/d7300bc521d15f9f9114a591eeb871d9/Zi_Wang_Metal_oxide_promoters_2015_P16.jpg https://s3.amazonaws.com/prod-ucs-content-store-us-east/content/egi:1095CP6HVQG/PAGE-IMAGE/image/jpg/d7300bc521d15f9f9114a591eeb871d9/Zi_Wang_Metal_oxide_promoters_2015_P16.jpg https://ucs.elsevier.com/asset/6b2f1474-6e35-4f10-bce2-dd1fb8268050 Zi_Wang_Metal_oxide_promoters_2015_P16 Zi_Wang_Metal_oxide_promoters_2015_P16.jpg jpg 194968 ALTIMG 1-s2.0-S0926860X15301654-Zi_Wang_Metal_oxide_promoters_2015_P21.jpg https://s3-eu-west-1.amazonaws.com/prod-ucs-content-store-eu-west/content/egi:1095CP6HVQG/PAGE-IMAGE/image/jpg/c859f74c84c7de11c0dde52bac5d57bc/Zi_Wang_Metal_oxide_promoters_2015_P21.jpg https://s3.amazonaws.com/prod-ucs-content-store-us-east/content/egi:1095CP6HVQG/PAGE-IMAGE/image/jpg/c859f74c84c7de11c0dde52bac5d57bc/Zi_Wang_Metal_oxide_promoters_2015_P21.jpg https://ucs.elsevier.com/asset/47cabb25-5e86-4750-8b66-6e081b012178 Zi_Wang_Metal_oxide_promoters_2015_P21 Zi_Wang_Metal_oxide_promoters_2015_P21.jpg jpg 151161 ALTIMG 1-s2.0-S0926860X15301654-Zi_Wang_Metal_oxide_promoters_2015_P02.jpg https://s3-eu-west-1.amazonaws.com/prod-ucs-content-store-eu-west/content/egi:1095CP6HVQG/PAGE-IMAGE/image/jpg/da7dc5f8e80dd2d5307b87acb6ed2878/Zi_Wang_Metal_oxide_promoters_2015_P02.jpg https://s3.amazonaws.com/prod-ucs-content-store-us-east/content/egi:1095CP6HVQG/PAGE-IMAGE/image/jpg/da7dc5f8e80dd2d5307b87acb6ed2878/Zi_Wang_Metal_oxide_promoters_2015_P02.jpg https://ucs.elsevier.com/asset/95334624-6d67-4c18-9739-be404ac1c788 Zi_Wang_Metal_oxide_promoters_2015_P02 Zi_Wang_Metal_oxide_promoters_2015_P02.jpg jpg 545936 ALTIMG 1-s2.0-S0926860X15301654-Zi_Wang_Metal_oxide_promoters_2015_P20.jpg https://s3-eu-west-1.amazonaws.com/prod-ucs-content-store-eu-west/content/egi:1095CP6HVQG/PAGE-IMAGE/image/jpg/2a4efbc3e429f63c2f0793cfc010b702/Zi_Wang_Metal_oxide_promoters_2015_P20.jpg https://s3.amazonaws.com/prod-ucs-content-store-us-east/content/egi:1095CP6HVQG/PAGE-IMAGE/image/jpg/2a4efbc3e429f63c2f0793cfc010b702/Zi_Wang_Metal_oxide_promoters_2015_P20.jpg https://ucs.elsevier.com/asset/26a9d0e4-4bab-4ee5-a968-364fdcc166fa Zi_Wang_Metal_oxide_promoters_2015_P20 Zi_Wang_Metal_oxide_promoters_2015_P20.jpg jpg 227763 ALTIMG 1-s2.0-S0926860X15301654-Zi_Wang_Metal_oxide_promoters_2015_P11.jpg https://s3-eu-west-1.amazonaws.com/prod-ucs-content-store-eu-west/content/egi:1095CP6HVQG/PAGE-IMAGE/image/jpg/edaa18d4170af04f0de62a88c115dba7/Zi_Wang_Metal_oxide_promoters_2015_P11.jpg https://s3.amazonaws.com/prod-ucs-content-store-us-east/content/egi:1095CP6HVQG/PAGE-IMAGE/image/jpg/edaa18d4170af04f0de62a88c115dba7/Zi_Wang_Metal_oxide_promoters_2015_P11.jpg https://ucs.elsevier.com/asset/80e82a17-46bb-40a8-ad5c-c2ba190f672d Zi_Wang_Metal_oxide_promoters_2015_P11 Zi_Wang_Metal_oxide_promoters_2015_P11.jpg jpg 552132 ALTIMG 1-s2.0-S0926860X15301654-Zi_Wang_Metal_oxide_promoters_2015_P04.jpg https://s3-eu-west-1.amazonaws.com/prod-ucs-content-store-eu-west/content/egi:1095CP6HVQG/PAGE-IMAGE/image/jpg/e7e0fbee4dfa6dc3f42e780d87da4ac2/Zi_Wang_Metal_oxide_promoters_2015_P04.jpg https://s3.amazonaws.com/prod-ucs-content-store-us-east/content/egi:1095CP6HVQG/PAGE-IMAGE/image/jpg/e7e0fbee4dfa6dc3f42e780d87da4ac2/Zi_Wang_Metal_oxide_promoters_2015_P04.jpg https://ucs.elsevier.com/asset/e5bb6aa4-e647-4ae6-bd19-2ddf8ec33c0b Zi_Wang_Metal_oxide_promoters_2015_P04 Zi_Wang_Metal_oxide_promoters_2015_P04.jpg jpg 532397 ALTIMG 1-s2.0-S0926860X15301654-Zi_Wang_Metal_oxide_promoters_2015_P08.jpg https://s3-eu-west-1.amazonaws.com/prod-ucs-content-store-eu-west/content/egi:1095CP6HVQG/PAGE-IMAGE/image/jpg/e4818a006649a9a3f508bda8b50f54b2/Zi_Wang_Metal_oxide_promoters_2015_P08.jpg https://s3.amazonaws.com/prod-ucs-content-store-us-east/content/egi:1095CP6HVQG/PAGE-IMAGE/image/jpg/e4818a006649a9a3f508bda8b50f54b2/Zi_Wang_Metal_oxide_promoters_2015_P08.jpg https://ucs.elsevier.com/asset/5cb758c5-016c-4547-be23-948f486adc02 Zi_Wang_Metal_oxide_promoters_2015_P08 Zi_Wang_Metal_oxide_promoters_2015_P08.jpg jpg 546110 ALTIMG 1-s2.0-S0926860X15301654-Zi_Wang_Metal_oxide_promoters_2015_P18.jpg https://s3-eu-west-1.amazonaws.com/prod-ucs-content-store-eu-west/content/egi:1095CP6HVQG/PAGE-IMAGE/image/jpg/a19c2320acbca8713c616358ab5c3a6a/Zi_Wang_Metal_oxide_promoters_2015_P18.jpg https://s3.amazonaws.com/prod-ucs-content-store-us-east/content/egi:1095CP6HVQG/PAGE-IMAGE/image/jpg/a19c2320acbca8713c616358ab5c3a6a/Zi_Wang_Metal_oxide_promoters_2015_P18.jpg https://ucs.elsevier.com/asset/47ecae98-ed00-4995-bc0b-d9d8725c3974 Zi_Wang_Metal_oxide_promoters_2015_P18 Zi_Wang_Metal_oxide_promoters_2015_P18.jpg jpg 474502 ALTIMG 1-s2.0-S0926860X15301654-Zi_Wang_Metal_oxide_promoters_2015_P01.jpg https://s3-eu-west-1.amazonaws.com/prod-ucs-content-store-eu-west/content/egi:1095CP6HVQG/PAGE-IMAGE/image/jpg/da9251d33484abb895915d78168a38bb/Zi_Wang_Metal_oxide_promoters_2015_P01.jpg https://s3.amazonaws.com/prod-ucs-content-store-us-east/content/egi:1095CP6HVQG/PAGE-IMAGE/image/jpg/da9251d33484abb895915d78168a38bb/Zi_Wang_Metal_oxide_promoters_2015_P01.jpg https://ucs.elsevier.com/asset/874378cb-4e9b-4399-9b96-5a3c378500db Zi_Wang_Metal_oxide_promoters_2015_P01 Zi_Wang_Metal_oxide_promoters_2015_P01.jpg jpg 458171 ALTIMG 1-s2.0-S0926860X15301654-Zi_Wang_Metal_oxide_promoters_2015_P15.jpg https://s3-eu-west-1.amazonaws.com/prod-ucs-content-store-eu-west/content/egi:1095CP6HVQG/PAGE-IMAGE/image/jpg/cf73d263c8d87c5a89e9718bb870df8f/Zi_Wang_Metal_oxide_promoters_2015_P15.jpg https://s3.amazonaws.com/prod-ucs-content-store-us-east/content/egi:1095CP6HVQG/PAGE-IMAGE/image/jpg/cf73d263c8d87c5a89e9718bb870df8f/Zi_Wang_Metal_oxide_promoters_2015_P15.jpg https://ucs.elsevier.com/asset/763f0e2f-9730-4123-bbbf-7be09a13a797 Zi_Wang_Metal_oxide_promoters_2015_P15 Zi_Wang_Metal_oxide_promoters_2015_P15.jpg jpg 845624 ALTIMG 1-s2.0-S0926860X15301654-Zi_Wang_Metal_oxide_promoters_2015_P12.jpg https://s3-eu-west-1.amazonaws.com/prod-ucs-content-store-eu-west/content/egi:1095CP6HVQG/PAGE-IMAGE/image/jpg/f22bb6d9788099dc97bbf05df2cbb45b/Zi_Wang_Metal_oxide_promoters_2015_P12.jpg https://s3.amazonaws.com/prod-ucs-content-store-us-east/content/egi:1095CP6HVQG/PAGE-IMAGE/image/jpg/f22bb6d9788099dc97bbf05df2cbb45b/Zi_Wang_Metal_oxide_promoters_2015_P12.jpg https://ucs.elsevier.com/asset/7b4a7cac-5508-4782-8949-8ec60a0bd8d1 Zi_Wang_Metal_oxide_promoters_2015_P12 Zi_Wang_Metal_oxide_promoters_2015_P12.jpg jpg 555368 ALTIMG 1-s2.0-S0926860X15301654-Zi_Wang_Metal_oxide_promoters_2015_P10.jpg https://s3-eu-west-1.amazonaws.com/prod-ucs-content-store-eu-west/content/egi:1095CP6HVQG/PAGE-IMAGE/image/jpg/cc55051152475c2d2d8e0b16efc2407d/Zi_Wang_Metal_oxide_promoters_2015_P10.jpg https://s3.amazonaws.com/prod-ucs-content-store-us-east/content/egi:1095CP6HVQG/PAGE-IMAGE/image/jpg/cc55051152475c2d2d8e0b16efc2407d/Zi_Wang_Metal_oxide_promoters_2015_P10.jpg https://ucs.elsevier.com/asset/42dbc01c-7819-4d8c-a116-6a15a276bfea Zi_Wang_Metal_oxide_promoters_2015_P10 Zi_Wang_Metal_oxide_promoters_2015_P10.jpg jpg 556548 ALTIMG 1-s2.0-S0926860X15301654-Zi_Wang_Metal_oxide_promoters_2015_P14.jpg https://s3-eu-west-1.amazonaws.com/prod-ucs-content-store-eu-west/content/egi:1095CP6HVQG/PAGE-IMAGE/image/jpg/4ba182e24943a6e007010fc0e8e70a03/Zi_Wang_Metal_oxide_promoters_2015_P14.jpg https://s3.amazonaws.com/prod-ucs-content-store-us-east/content/egi:1095CP6HVQG/PAGE-IMAGE/image/jpg/4ba182e24943a6e007010fc0e8e70a03/Zi_Wang_Metal_oxide_promoters_2015_P14.jpg https://ucs.elsevier.com/asset/83fdbba1-03c5-46c5-95dc-2676f9aff1d0 Zi_Wang_Metal_oxide_promoters_2015_P14 Zi_Wang_Metal_oxide_promoters_2015_P14.jpg jpg 113299 ALTIMG 1-s2.0-S0926860X15301654-Zi_Wang_Metal_oxide_promoters_2015_P23.jpg https://s3-eu-west-1.amazonaws.com/prod-ucs-content-store-eu-west/content/egi:1095CP6HVQG/PAGE-IMAGE/image/jpg/818d3c261261a744cd21129882a8d800/Zi_Wang_Metal_oxide_promoters_2015_P23.jpg https://s3.amazonaws.com/prod-ucs-content-store-us-east/content/egi:1095CP6HVQG/PAGE-IMAGE/image/jpg/818d3c261261a744cd21129882a8d800/Zi_Wang_Metal_oxide_promoters_2015_P23.jpg https://ucs.elsevier.com/asset/0a6937ac-5bd1-441a-b070-d6f788240ed5 Zi_Wang_Metal_oxide_promoters_2015_P23 Zi_Wang_Metal_oxide_promoters_2015_P23.jpg jpg 297698 ALTIMG 1-s2.0-S0926860X15301654-Zi_Wang_Metal_oxide_promoters_2015_P03.jpg https://s3-eu-west-1.amazonaws.com/prod-ucs-content-store-eu-west/content/egi:1095CP6HVQG/PAGE-IMAGE/image/jpg/e9e0e668c99f1f46f520e9573b474f5f/Zi_Wang_Metal_oxide_promoters_2015_P03.jpg https://s3.amazonaws.com/prod-ucs-content-store-us-east/content/egi:1095CP6HVQG/PAGE-IMAGE/image/jpg/e9e0e668c99f1f46f520e9573b474f5f/Zi_Wang_Metal_oxide_promoters_2015_P03.jpg https://ucs.elsevier.com/asset/cfeae27c-a1c5-43de-b85c-9ec41b4f975e Zi_Wang_Metal_oxide_promoters_2015_P03 Zi_Wang_Metal_oxide_promoters_2015_P03.jpg jpg 571631 ALTIMG 1-s2.0-S0926860X15301654-Zi_Wang_Metal_oxide_promoters_2015_P06.jpg https://s3-eu-west-1.amazonaws.com/prod-ucs-content-store-eu-west/content/egi:1095CP6HVQG/PAGE-IMAGE/image/jpg/329de5e0bede81cd604739cb1a035d59/Zi_Wang_Metal_oxide_promoters_2015_P06.jpg https://s3.amazonaws.com/prod-ucs-content-store-us-east/content/egi:1095CP6HVQG/PAGE-IMAGE/image/jpg/329de5e0bede81cd604739cb1a035d59/Zi_Wang_Metal_oxide_promoters_2015_P06.jpg https://ucs.elsevier.com/asset/da40242d-83bd-4653-b324-4df1fabd26c9 Zi_Wang_Metal_oxide_promoters_2015_P06 Zi_Wang_Metal_oxide_promoters_2015_P06.jpg jpg 531676 ALTIMG 1-s2.0-S0926860X15301654-Zi_Wang_Metal_oxide_promoters_2015_P09.jpg https://s3-eu-west-1.amazonaws.com/prod-ucs-content-store-eu-west/content/egi:1095CP6HVQG/PAGE-IMAGE/image/jpg/a050b26beae3695b553aea10d500773a/Zi_Wang_Metal_oxide_promoters_2015_P09.jpg https://s3.amazonaws.com/prod-ucs-content-store-us-east/content/egi:1095CP6HVQG/PAGE-IMAGE/image/jpg/a050b26beae3695b553aea10d500773a/Zi_Wang_Metal_oxide_promoters_2015_P09.jpg https://ucs.elsevier.com/asset/8ffc6c7d-a2fa-44ba-b8a6-5479b547f4ba Zi_Wang_Metal_oxide_promoters_2015_P09 Zi_Wang_Metal_oxide_promoters_2015_P09.jpg jpg 487026 ALTIMG 1-s2.0-S0926860X15301654-Zi_Wang_Metal_oxide_promoters_2015_P17.jpg https://s3-eu-west-1.amazonaws.com/prod-ucs-content-store-eu-west/content/egi:1095CP6HVQG/PAGE-IMAGE/image/jpg/f7643ba035c350cbc8d8aa363757ff0b/Zi_Wang_Metal_oxide_promoters_2015_P17.jpg https://s3.amazonaws.com/prod-ucs-content-store-us-east/content/egi:1095CP6HVQG/PAGE-IMAGE/image/jpg/f7643ba035c350cbc8d8aa363757ff0b/Zi_Wang_Metal_oxide_promoters_2015_P17.jpg https://ucs.elsevier.com/asset/a75b8c8f-840d-45df-add9-11d2474b9e09 Zi_Wang_Metal_oxide_promoters_2015_P17 Zi_Wang_Metal_oxide_promoters_2015_P17.jpg jpg 162936 ALTIMG 1-s2.0-S0926860X15301654-Zi_Wang_Metal_oxide_promoters_2015_P07.jpg https://s3-eu-west-1.amazonaws.com/prod-ucs-content-store-eu-west/content/egi:1095CP6HVQG/PAGE-IMAGE/image/jpg/f575858fc05d8d5b3d7bdb5c9bcb6d38/Zi_Wang_Metal_oxide_promoters_2015_P07.jpg https://s3.amazonaws.com/prod-ucs-content-store-us-east/content/egi:1095CP6HVQG/PAGE-IMAGE/image/jpg/f575858fc05d8d5b3d7bdb5c9bcb6d38/Zi_Wang_Metal_oxide_promoters_2015_P07.jpg https://ucs.elsevier.com/asset/71ad749c-c23d-49cd-900c-5f9f663e1016 Zi_Wang_Metal_oxide_promoters_2015_P07 Zi_Wang_Metal_oxide_promoters_2015_P07.jpg jpg 530319 ALTIMG 1-s2.0-S0926860X15301654-Zi_Wang_Metal_oxide_promoters_2015_P13.jpg https://s3-eu-west-1.amazonaws.com/prod-ucs-content-store-eu-west/content/egi:1095CP6HVQG/PAGE-IMAGE/image/jpg/0a1c24223c89e78070336377d1a8b67b/Zi_Wang_Metal_oxide_promoters_2015_P13.jpg https://s3.amazonaws.com/prod-ucs-content-store-us-east/content/egi:1095CP6HVQG/PAGE-IMAGE/image/jpg/0a1c24223c89e78070336377d1a8b67b/Zi_Wang_Metal_oxide_promoters_2015_P13.jpg https://ucs.elsevier.com/asset/25af5924-ace7-449b-9c99-770d34ec8c7e Zi_Wang_Metal_oxide_promoters_2015_P13 Zi_Wang_Metal_oxide_promoters_2015_P13.jpg jpg 559443 ALTIMG 1-s2.0-S0926860X15301654-am.pdf am am.pdf pdf 923564 AAM-PDF https://s3-eu-west-1.amazonaws.com/prod-ucs-content-store-eu-west/content/egi:1095CP6HVQG/MAIN/application/pdf/d75888c22c27b56bba1031a0dfc25dce/am.pdf APCATA 15564 S0926-860X(15)30165-4 10.1016/j.apcata.2015.09.032 Fig. 1 TPR results for CuCOZrO2, CuCoAl2O3 and CuCoLa2O3 from 70°C to 550°C. Fig. 2 Characterization on calcined CuCoAl2O3, CuCoLa2O3 and CuCoZrO2 samples by XRD and XPS. (a) XRD patterns during reduction in 4% H2/He at indicated temperatures for CuCoAl2O3; (b) XRD patterns during reduction in 4% H2/He at indicated temperatures for CuCoLa2O3; (c) XRD patterns during reduction in 4% H2/He at indicated temperatures for CuCoZrO2; (d) XPS spectra of Co 2p region for CuCoAl2O3, CuCoLa2O3 and CuCoZrO2 sample (e) XPS spectra of Cu 2p region for CuCoAl2O3, CuCoLa2O3 and CuCoZrO2 sample. Fig. 3 CO conversion as a function of time on stream of CuCoLa2O3, CuCoZrO2 & CuCoAl2O3 at 250 oC, 30bar, and GHSV=36000scc/gcat/h. Fig. 4 Selectivity changes as a function of time on stream on CuCoLa2O3, CuCoZrO2 and CuCoAl2O3 during reaction at 250°C. Fig. 5 TPO of CuCoLa2O3, CuCoZrO2​ and CuCoAl2O3 after CO hydrogenation reaction at 250°C for 9h. Table 1 Catalyst composition by ICP-OES and BET surface area. a Catalyst Composition (wt%) Cu/Co molar ratio Surface area m2/g Co Cu CuCoAl2O3 26.6 32.0 1.11 94.1 CuCoLa2O3 18.8 23.3 1.14 49.7 CuCoZrO2 25.7 30.4 1.09 88.8 a The molar ratio of Cu:Co:metal oxide(Al2O3, La2O3 and ZrO2)=2:2:1. Table 2 Quantitative H2 consumption during TPR. a Catalyst H2 consumed (μmol/g) Expected consumption (μmol/g) Metal reduced% CuCoAl2O3 291±6 314 92.7±2.0 CuCoLa2O3 235±3 241 97.5±1.2 CuCoZrO2 294±5 305 96.4±1.6 a Errors in the H2 consumption values are within 95% confidence interval. Table 3 XPS binding energies and surface composition analysis. Catalyst Binding energies Cu/Co atomic ratio by XPS Cu/Co atomic ratio by ICP Cu 2p3/2 Co 2p3/2 CuCoAl2O3 933.8 779.7 1.17 1.11 CuCoLa2O3 933.6 779.5 1.23 1.14 CuCoZrO2 933.6 779.8 1.09 1.09 Table 4 Activity & products selectivity for CuCoAl2O3, CuCoLa2O3 and CuCoZrO2 at 250°C and 30bar. a Catalyst Carbon selectivity COconversion(%) Methane Methanol Ethanol C3–6 oxygenates C2–6 hydrocarbon CO2 CuCoAl2O3 35.63 5.02 5.66 2.38 26.06 23.25 1.93 CuCoLa2O3 31.37 16.92 10.46 7.47 14.45 18.03 0.76 CuCoZrO2 28.14 4.35 7.32 6.09 29.63 22.67 0.58 a Selectivity and CO conversion were taken at near steady state after 9h of reaction. Effect of ZrO2, Al2O3 and La2O3 on cobalt–copper catalysts for higher alcohols synthesis Zi Wang James J. Spivey ⁎ Department of Chemical Engineering, Louisiana State University, Baton Rouge, LA 70803, USA Department of Chemical Engineering Louisiana State University Baton Rouge LA 70803 USA ⁎ Corresponding author at: Department of Chemical Engineering, Louisiana State University, S. Stadium Drive, Baton Rouge, LA 70803, USA. Fax: +1 225 578 1476. Graphical abstract Three cobalt–copper catalysts singly promoted with La, Zr, or Al were studied for catalytic conversion of syngas to higher alcohols. The properties of the promoted catalysts have been characterized by TPR, XRD, XPS and BET. CO hydrogenation was carried out in a plug-flow reactor under 30bar, GHSV=36000 scc/gcat/h, H2/CO=2, and 250°C at differential conversions. The catalyst activity and selectivity to higher alcohols are greatest on CuCoLa2O​3: ethanol selectivity 10.5% at a conversion of 0.76%. During 9h of time-on-stream, CO conversion decreased on CuCoLa2O3​ while methanol and higher alcohol selectivity increased. The behaviors on CuCoZrO2 and CuCoAl2O3 were different. On these two catalysts, CO conversion and selectivity reached a near-steady state much more quickly than CuCoLa2O3. These results suggest changes on CuCoLa2O3 that increase the selectivity for oxygenates continue with time, at least over the time scale investigated here. Keywords Higher alcohols synthesis Syngas Cobalt Copper Metal oxide promoters Modified Fischer–Tropsch catalysts 1 Introduction Increasing demand has focused on renewable and environmentally benign energy sources for the catalytic conversion of biomass-, natural gas-, and coal-derived syngas to liquid fuel. An alternative to producing long-chain hydrocarbon products via Fischer–Tropsch (FT) synthesis is the conversion of syngas into more valuable higher alcohols. These higher carbon-number alcohols can be used as hydrogen carriers for fuel cells, or as additives directly blended into gasoline [1,2]. However, additional research is required before extrapolating lab-scale studies to industry-level application. Currently, it is difficult to commercialize this process due to relatively low activity, yield and stability of the catalysts. Rh-based catalysts have shown high yield to higher alcohols in CO hydrogenation, with net yields typically ranging from 10 to 20% [3–6]. However, the relatively high price of these catalysts has limited the development of more practical processes [7]. Among all the non-noble metal based catalysts, cobalt–copper modified Fischer Tropsch catalysts are promising substitutes for noble metal-based catalysts [8–11]. Recent studies have shown that promoters can increase the selectivity of Co–Cu catalysts to oxygenates. The Institut Francais du Petrole (IFP) filed a number of patents on the development of cobalt–copper based modified Fischer Tropsch catalysts for higher alcohols synthesis [8,12–16]. Under moderate operating conditions, the selectivity to higher alcohols ranged from 20% to 70%. The ethanol yield over Cu–Co-based catalysts ranged from 100 to 300mg/(gcat h), suggesting commercial interest in these catalysts. Following the IFP work, a wide range of studies on Co–Cu bimetallic catalysts are reported to further increase the selectivity to higher alcohols [10,17,18]. Researchers correlate the activity and selectivity of the catalysts with the type of synthesis method, the alkali promoters used, and physicochemical properties of the catalysts such as metal particle sizes, dispersions, and the atomic proximity of cobalt and copper. Specifically, metal oxide promoters such as ZrO2, La2O3 and Al2O3 greatly affect the reduction and product selectivity of cobalt–copper-based catalysts. For instance, ZrO2 assists the reduction of Co2+ species to metallic cobalt for CO hydrogenation, and ZrO2 promoted catalysts show increased selectivity to ethanol [19]. According to Lebarbier et al. [20], La2O3-supported cobalt catalyst reached almost complete cobalt reduction after H2 treatment, and cobalt dispersion on La2O3 supported catalyst was higher than those on activated carbon and Al2O3. Alumina-supported cobalt FT catalysts show greater stability, high activity and strong metal-support interactions comparing with TiO2 and MgO [21,22]. A study of alumina-supported copper–cobalt bimetallic catalysts for CO hydrogenation by Wang et al. [23] reported increased interaction between cobalt and copper particles on a γ-Al2O3 supported catalyst compared with unpromoted catalysts, which improved the selectivity of the catalysts to higher alcohols. Past work shows that the choice of the metal oxide promoters greatly influences catalyst morphology, cobalt–copper interaction, and reduction or reaction performance. These metal oxides also promote cobalt–copper catalysts in activity and selectivity to ethanol and other oxygenates. Therefore, the purpose of this work is to study zirconia, alumina and lanthana as metal oxide promoters for cobalt–copper higher alcohols synthesis catalysts. In the present study, cobalt and copper salts are coprecipitated with the third metal salt (Zr, Al or La) to synthesize three promoted catalysts, denoted as CuCoZrO2, CuCoAl2O3, and CuCoLa2O3. Coprecipitated metal oxides serve as supports to maintain highly dispersed metal clusters that contain both cobalt and copper particles. The promoting effects of these metal oxides are measured by H2 temperature-programmed reduction, X-ray diffraction, X-ray photoelectron spectroscopy, BET surface area, and CO hydrogenation activity studies. The aim of this study is to directly compare the promoting effects of the metal oxides on the activity, selectivity, and stability of these catalysts for higher alcohols synthesis. 2 Experimental 2.1 Catalyst preparation Catalysts were prepared by pH-coprecipitation method. In the coprecipitation method, cobalt nitrate, copper nitrate and corresponding metal salts (Al(NO)3·9H2O, ZrO(NO3)2, or La(NO3)3·6H2O) were dissolved together in deionized water. The molar ratio of Cu nitrite to Co nitrite to metal salts was kept at 2:2:1. The solution were titrated to 100ml water under magnetic stirring at 80°C. Meanwhile, a solution of ammonia carbonate was titrated in order to maintain the pH at 7.00±0.2. After the titration, the solution was aged at room temperature for 6h, then the solid was recovered by washing and filtration. Collected precipitates were dried at 90°C for 24h, then calcined at 500°C for 3h under air flow. The samples are denoted as CuCoAl2O3, CuCoLa2O3 and CuCoZrO2 to demonstrate the promoters used in the catalysts. 2.2 Composition and surface area The compositions of the calcined catalysts were determined by inductively coupled plasma optical emission spectrometry (ICP-OES) method using a PerkinElmer 2000 DV ICP-optical emission spectrometer. BET surface area of freshly calcined catalyst were determined by N2 adsorption at −196°C. Prior to analysis, the samples were treated in helium flow at 150°C for 30min to remove the moisture. A flow BET procedure using N2 concentrations of 10%, 20%, and 30% in a He carrier was used in an Altamira AMI-200 system. 2.3 Hydrogen temperature programmed reduction (H2-TPR) H2-TPR was done on 50mg of calcined catalyst in an Altamira AMI-200 system. 50mg of calcined catalysts were pretreated in Helium flow at 150°C for 30min to remove moisture. Reducing gas of 50sccm 10% H2/Ar flowed through the reactor as the temperature increased at 5°C/min to 550°C. A thermal conductivity detector (TCD) monitored the consumption of H2. A calibration using TPRs of 20, 35 and 50mg Ag2O allowed quantitative analysis of hydrogen uptake by the catalysts. 2.4 In situ X-ray diffraction (XRD) XRD measurements of the catalysts were done at the Center for Nanophase Materials Science at Oak Ridge National Laboratory. Catalyst Samples were loaded into an Anton Paar XRK900 reactor chamber. A 4% H2/He gas was flowed through the chamber to conduct the reduction process, and a PANalytical X’Pert Pro MPD diffractometer with Cu Kα radiation (λ =0.15406nm) was used to record XRD patterns at different temperatures. The spectra were collected from 15° to 70° with a step size of 0.0167°. X’pert HighScore Plus were used to identify phases by the Search & Match feature. 2.5 X-ray photoelectron spectroscopy (XPS) XPS experiments on calcined catalysts were performed on a Kratos AXIS 165 X-Ray Photoelectron Spectrometer using monochromatic Al Kα1 radiation (hν =1486.6eV, intrinsic linewidth 0.3eV). The pressure in the analysis chamber was kept between 10−8 and 10−9 Torr during the experiments. Survey spectra with a pass energy of 160eV were taken on each sample prior to the measurement to check correct sample alignment. High resolution scans of Co 2p, Cu 2p, C 1s, O 1s, Al 2p, La 3d and Zr 3d were recorded with a pass energy of 40eV. C 1s peak at 284.8eV were used as known standard to calibrate binding energy scale. 2.6 Reaction studies Reactions were carried out in an Altamira AMI-200R-HP system equipped with a 1/4-in. glass-lined stainless steel reactor tube. 50mg of calcined sample was reduced in a mixture of H2 and He for 3h at a standard temperature 400°C. After reduction, the reactor was cooled to room temperature in He, then pressurized to 30bar and heated to 250°C. At this point, He is switched by a simulated-syngas flow (space velocity=36000 scc/gcat/h, H2/CO=2). Products were analyzed in a Shimadzu GC2014 gas chromatograph with flame ionization and thermal conductivity detectors (FID and TCD). Reaction data was measured continuously until the results are steady. The reactions were carried out at differential conversion (CO conversion <3%). This minimizes deactivation as well as temperature and concentration gradients in the reactor. This also eliminates the need to capture and analyze a liquid, integral sample over extended periods of time, which does not measure any changes in the product composition with time. 2.7 Temperature programmed oxidation (TPO) coupled with mass spectroscopic measurements on used catalysts After the reaction, the samples were purged in He for 30min at 25°C. The reactor was then heated to 750°C at 15°C/min in 30sccm 10% O2/He flow. The profiles of CO2 evolution (m/z =44) were collected by an Ametek Quadrupole MS. 3 Results and discussion 3.1 Composition and surface area ICP-OES Sample composition and BET surface area results are listed in Table 1 . CuCoAl2O3 showed the highest surface area (94.1m2/g), while CuCoLa2O3 had the lowest surface area (49.7m2/g). Bulk Co and Cu composition by ICP-OES are shown in Table 1. Note that the molar ratios of Co:Cu:metal oxides are intentionally kept as 2:2:1 for all three catalysts. 3.2 TPR Temperature programmed reduction profiles obtained for the three catalysts are shown in Fig. 1 . All three catalysts displayed similar reduction behavior between 185°C and 250°C. For CuCoZrO2, the first shoulder at ∼190°C is attributed to the reduction of CuO to Cu0. The peak at around 200°C and the shoulder at 230°C correspond to the two-step reduction of Co3O4 to CoO and CoO to Co0. CuCoAl2O3 has a similar reduction behavior. The broad shoulder from 250°C to 350°C in both CuCoZrO2 and CuCoAl2O3 are due to the reduction of residual CoO to metallic cobalt. The CuCoLa2O3 reduction profile is somewhat different. Although the same reduction of copper at ∼190°C is seen, the feature at 215°C shows an asymmetric peak for CuCoLa2O3, which can be assigned as the combination of Co3O4 to CoO and CoO to Co0​ reduction. The broad shoulder above 250°C, associated with the extended reduction of cobalt due to less easily reduced cobalt for the Zr- and Al-promoted catalysts, is not seen on CuCoLa2O​3. This is probably because of higher dispersion of Cu–Co particles and stronger interaction between cobalt and copper in La-promoted catalysts, consistent with the literature. The promoting effect of H2 reduction by hydrogen spillover mechanism associated with La2O3 has been reported on lanthanum promoted cobalt catalysts before [20], therefore, the possibility that La2O3 promoted the reduction of cobalt in CuCoLa2O3 catalyst cannot be ruled out. Table 2 shows the experimental and expected hydrogen consumption during the TPR. Reduction of cobalt and copper is essentially complete up to 250°C on all three promoted catalysts, with CuCoAl2O3 being slightly less reduced (92.7±2.0) than for the other two (97.5±1.2 and 96.4±1.6). This is consistent with literature that ZrO2 and La2O3 facilitate H2 reduction of cobalt and copper oxides, leading to more complete reduction of the CuCoZrO2 and the CuCoLa2O3 than the CuCoAl2O3 catalyst [9,19]. 3.3 In situ X-ray diffraction XRD patterns of the three catalysts during H2- reduction are shown in Fig. 2 . For CuCoAl2O3, the fresh, calcined catalyst include Co3O4 and CuO (Fig. 2(a)). At 200°C, the intensity of the peaks for Co3O4 and CuO had decreased, and metallic phases at 43.2° and 50.3° begin to appear. Meanwhile, a peak at 61.8° emerged, which indicates the existence of a CoO phase was apparent at 300°C, but disappeared at 400°C. Only metallic phases are present at 400°C. The results of the in-situ XRD combined with the TPR patterns clearly show that reduction of CuO starts at ∼185°C. The expected reduction sequence of copper and cobalt oxides to reduced metals is apparent in the loss of the crystalline oxides and appearance of the reduced metals. The long shoulders from 250°C to 350°C in the CuCoZrO2 and CuCoAl2O3 that are seen in the TPR are not easily distinguished in the XRDs from the CuCoLa2O3. At 400°C, all three catalysts are fully reduced. Based on the width of the peaks of all three catalysts, copper clusters are more crystalline than cobalt clusters, which are quite amorphous. CuCoLa2O3 and CuCoZrO2 had reduction patterns similar to CuCoAl2O3. CuCoLa2O3 had a tilted background due to a higher dispersion of Co3O4 and CuO clusters (Fig. 2(b)). This is consistent with the TPR results, which did not show a broad shoulder above ∼250°C. CuCoZrO2 displayed minor CuO features below 200°C, which indicates the existence of both crystalline and amorphous copper oxide in the calcined catalyst. Significantly, there is no peak that could be directly attributed to cobalt aluminate or lanthanum cobalt oxides, but the possibility of forming cobalt-metal oxides in the catalysts cannot be ruled out. 3.4 XPS XPS studies of calcined samples were carried out in order to study the chemical state of the elements at catalyst surface, and determine surface metal compositions. The XPS spectra of the three fresh, calcined catalysts for Co (2p3/2) and Cu(2p3/2) are shown in Fig. 2(d) and (e), respectively. Co 2p3/2 peak located at 779.3eV for all three samples, which shows that cobalt is in the form of Co3O4 on the surface [18,19]. The Cu 2p3/2 main peak is positioned at 933.6eV with a shake-up satellite peak accompanied at 942eV, thus copper ions on the surface for all three catalysts are in the form of CuO [24], as expected. Table 3 summarizes copper and cobalt binding energies of the samples surfaces. Surface and bulk Cu/Co atomic ratios calculated by XPS and ICP respectively are also shown in Table 3. Although CuCoAl2O3 and CuCoLa2O3 show slightly higher Cu/Co atomic ratio on the surface than in the bulk, these results indicate that all three samples are composed of relatively uniform particles with a constant atomic ratio of cobalt and copper. 3.5 Catalyst activity test Fig. 3 shows the CO conversion as a function of time-on-stream at 250°C and 30bar. Note that all CO conversions are intentionally kept at differential CO conversion (<3%) to avoid condensation (Section 2.6). CuCoAl2O3 had highest activity under reaction condition. While CuCoZrO2 and CuCoLa2O3 had much lower activity. CuCoAl2O3 and CuCoZrO2 slightly lost activity in the first two hours of reaction, then reaching near steady-state after 2–3h of operation. For CuCoLa2O3 catalyst, however, CO conversion decreased with time over the 9h of operation. Fig. 4 shows the changes of product selectivity with time. For CuCoZrO2 and CuCoAl2O3, the selectivity to alcohols and C2+ products were relatively stable through 9h of reaction, whereas methane selectivity slightly increased with time. Nevertheless, CuCoLa2O3 displays more significant changes of the selectivity to C2+ products. The most striking fact is the increase of methanol and ethanol selectivity at 250°C with time. At this temperature, the selectivity to ethanol increased from 6.5% to 10.5% and the selectivity to methanol had increased from 5% to 16.9% after 9h on stream. The increased alcohols selectivity is associated with a small decrease of ethane and propane selectivity. CuCoLa2O3 shows increased selectivity of methanol and decreased selectivity of methane with time. Methane is synthesized from dissociated CO while methanol is formed from associatively adsorbed CO [25]. Therefore, the increase of methane and the decrease of methanol selectivity indicate the increase of associatively adsorbed CO and the decrease of dissociatively adsorbed CO with time. The product selectivity distribution for the three catalysts over 9h time-on-stream is shown in Table 4 . At 250°C, CuCoLa2O3 catalyst showed highest selectivity to ethanol among the three catalysts, CuCoZrO2 and CuCoAl2O3 had similar selectivity toward ethanol, C2+ oxygenates and C2+ hydrocarbons. Table 4 shows that CuCoLa2O3 is less selective to C2+ hydrocarbons, which means Fischer–Tropsch synthesis in the reaction is inhibited on CuCoLa2O3, leading to higher methanol and ethanol selectivity of CuCoLa2O3 catalyst. In general, CuCoAl2O3 has properties very similar to traditional Fischer–Tropsch catalysts, with a high selectivity to methane and C2+ hydrocarbons. CuCoZrO2 also favors C2+ hydrocarbons, but produces more C2+ oxygenates than CuCoAl2O3. This could be due to the reason that ZrO2 provide more basic sites than Al2O3, which suppress hydrocarbon selectivity and favor oxygenates formation [26]. CuCoLa2O3 shows significantly greater selectivity to methanol and C2+ oxygenates than CuCoZrO2 or CuCoAl2O3. There is a difference between the formation of methanol and C2+ oxygenates. Methanol is formed by the hydrogenation of associatively adsorbed CO, while C2+ oxygenates are formed by the hydrogenation of atomically adjacent sites, one of which is a CHx moiety produced from dissociatively adsorbed CO and one of which is formed by associatively adsorbed CO. These two moieties then form the first C-C bond, from which C2+ oxygenates are produced[2,27]. The relative rates of the formation of these two moieties produces the observed product selectivities––e.g. C2+ oxygenates. The relatively high methane selectivity is consistent with the mechanism in which hydrogenation of dissociatively adsorbed CO on cobalt sites is faster than C-C bond formation to C2+ oxygenates. From characterization results, there are no major differences in reduction behavior and surface distribution among the three catalysts. This suggests that change of selectivity with time is due to reconstruction of the surface on the CuCoLa2O3 catalyst that produces sites favorable to alcohols—both methanol and C2+ oxygenates. Such surface reconstruction of cobalt-copper particles in the presence of syngas has been reported by Xiang et al. [28], who showed major Co surface segregation of the Co–Cu particles took place during syngas exposure, and an “onion-like” graphitic carbon shell was observed on the particle surface. Lebarbier et al. [20] reported the effect of La2O3 on cobalt catalysts, claiming that exposure to CO leads to the formation of Co2C on the surface, thus Co exists in both metallic Co and Co2C phase. Reaction studies showed slightly increase in the alcohol selectivity was observed for the sample with highest Co2C/Co0 ratio on the surface. Furthermore, Volkova et al. [29] proposed that Co2C is able to activate CO associatively and insert CO into (CHx)ads species that lead to higher alcohols. On CuCoLa2O3 here (Fig. 4), the selectivity to C2+ hydrocarbons decreases while methanation rate increases, which could be caused by the formation of surface carbon or Co2C [30]. The formation of carbon or cobalt carbide will decrease catalyst activity and increase methane selectivity [31,32]. Fig. 5 shows the TPO results to measure any carbon deposition on used CuCoLa2O3, CuCoZrO2 and CuCoAl2O3 catalysts after 9h of reaction. The amount of carbon on the used CuCoZrO2 was much more than CuCoLa2O3 or CuCoAl2O3. This clearly suggests that the relative low activity of the CuCoZrO2 is due to carbon deposition. CuCoZrO2 and CuCoAl2O3 shows similar TPO peaks between 200°C and 295°C, but with much more of this carbon on CuCoZrO2, as measured by the area under the TPO peaks. CuCoLa2O3 shows a shoulder at 230°C, a larger peak at 320°C and another peak at 565°C. Literature attributes the peaks in the 200–300°C region to the oxidation of polymeric carbon species for all three catalysts [33–35]. Cobalt carbide decomposes above 300°C [36], therefore, the peak around 320°C on the CuCoLa2O3 catalyst can be assigned to the decomposition and oxidation of cobalt carbide. The CuCoLa2O3 peak at 565°C corresponds to the decomposition of graphitic carbon on the surface [37,38]. Lanthanum promoter in CuCoLa2O3 seems to play a vital role in promoting the surface reconstruction and changing the product selectivity to favor alcohols. More in-situ characterizations are required to study the mechanism of surface reconstruction and formation of intermediates during syngas exposure, which will help us to further increase higher alcohols selectivity in CO hydrogenation reaction. The selectivity to ethanol and higher alcohols can also be further increased by adjusting reaction conditions. For instance, changing the H2/CO ratio to 1/1 will decrease the methane and the methanol selectivity and favor the higher alcohols synthesis [1,25]. 4 Conclusion No major difference in the catalyst reduction behavior is observed for these promoted catalysts during the TPR. The reduction of cobalt and copper are completed for all the catalysts by 300°C, which is consistent with literature. XRD results show CuO and Co3O4 phases in the fresh, calcined catalysts. The samples show uniform particles which have the same Cu/Co ratios on the surface and in the bulk. In the activity tests, CuCoAl2O3 displayed highest CO conversion, while CuCoLa2O3 yielded much higher carbon selectivity to methanol (16.9%) ethanol (10.5%) than the other two tests. All three catalysts showed changes with time-on-stream, with more significant increases in methanation and methanol formation compared to other products. Increases in selectivity were particularly significant for CuCoLa2O3, suggesting the existence of surface reconstruction and intermediate formation on the surface during the exposure of syngas. Post-reaction TPO detected polymeric carbon on all used catalysts, while CuCoZrO2 showed highest polymeric carbon accumulation. TPO also showed the existence of cobalt carbide on spent CuCoLa2O3. The addition of the three metal promoter oxides leads to significant differences. Specifically, the C1–C6 alcohol selectivity for the CuCoLa2O3 (34.9%) is far greater than either CuCoAl2O3 (13.1%) or CuCoZrO​2 (17.8%). This suggests fundamental reasons for CuCoLa2O3, Perhaps the surface basicity is increased by lanthanum oxide to favor alcohols formation [39]. Another difference for CuCoLa2O3 is the hydrocarbon selectivity. The difference in C2–C6 hydrocarbon selectivity between the CuCoAl2O3 (26.0%) and CuCoZrO2 (29.6%) on one hand, and CuCoLa2O3 on the other hand (14.4%) appears to reflect that on CuCoLa2O3 the relative rates of the hydrogenation of surface CH x , to hydrocarbons is lower than the relatively rates of the hydrogenation of the COads-CH x bond to C2+ alcohols [2,17,25]. The metal promoter oxides studied here clearly affect the formation of the final products on the associative and dissociative adsorption sites, and La in particular promotes the selectivity to oxygenates versus hydrocarbons. Acknowledgements This material is based upon work supported as part of the Center for Atomic Level Catalyst Design, an Energy Frontier Research Center funded by the US Department of Energy, Office of Science, Office of Basic Energy Sciences under Award Number DE-SC0001058. A part of this study was conducted at the Center for Nanophase Material Sciences, which is sponsored at Oak Ridge National Laboratory by the division of Scientific User Facilities, US Department of Energy. The authors are thankful to Dr. Viviane Schwartz and Dr. Jong Kahk Keum for setting up in situ XRD experiments. The help of Kimberly Hutchison from North Carolina State University, Department of Soil Science on ICP-OES analysis is gratefully acknowledged. References [1] M. Gupta M.L. Smith J.J. Spivey ACS Catal. 1 2011 641 656 [2] V. Subramani S.K. Gangwal Energy Fuels 22 2008 814 839 [3] N.L. Holy T.F. Carey Jr. Appl. Catal. 19 1985 219 223 [4] P. Gronchi E. Tempesti C. Mazzocchia Appl. Catal. A: Gen. 120 1994 115 126 [5] J. Hu Y. Wang C. Cao D.C. Elliott D.J. Stevens J.F. White Catal. Today 120 2007 90 95 [6] L. Han D. Mao J. Yu Q. Guo G. Lu Appl. Catal. A: Gen. 454 2013 81 87 [7] K. Fang D. Li M. Lin M. Xiang W. Wei Y. Sun Catal. Today 147 2009 133 138 [8] P. Courty D. Durand E. Freund A. Sugier J. Mol. Catal. 17 1982 241 254 [9] N. Mouaddib V. Perrichon M. Primet J. Chem. Soc. Faraday Trans. 1 85 1989 3413 3424 [10] M.L. Smith N. Kumar J.J. Spivey J. Phys. Chem. C 116 2012 7931 7939 [11] Y. Xiang V. Chitry P. Liddicoat P. Felfer J. Cairney S. Ringer N. Kruse J. Am. Chem. Soc. 135 2013 7114 7117 [12] A. Sugier, E. Freund, U.S. Patent 4291,126 (September 1981). [13] A. Sugier, E. Freund, U.S. Patent 4122,110 (October 1978). [14] A. Sugier, E. Freund, J.L. Page, U.S. Patent 4346,179 (August 1982). [15] P. Courty, D. Durant, A. Sugier, E. Fremund, U.S. Patent 4,659,742. (April 1978). [16] A. Sugier, E. Freund, P. Courty, D. Durand, F. Edouard, U.S. Patent 4,659,742 April 1987 (April 1987). [17] G. Prieto S. Beijer M.L. Smith M. He Y. Au Z. Wang D.A. Bruce K.P. de Jong J.J. Spivey P.E. de Jongh Angew. Chem. Int. Ed. 53 2014 6397 6401 [18] N.D. Subramanian G. Balaji C.S.S.R. Kumar J.J. Spivey Catal. Today 147 2009 100 106 [19] N. Mouaddib V. Perrichon G.A. Martin Appl. Catal. A: Gen. 118 1994 63 72 [20] V.M. Lebarbier D. Mei D.H. Kim A. Andersen J.L. Male J.E. Holladay R. Rousseau Y. Wang J. Phys. Chem. C 115 2011 17440 17451 [21] G. Jacobs P.M. Patterson Y. Zhang T. Das J. Li B.H. Davis Appl. Catal. A: Gen. 233 2002 215 226 [22] A.M. Hilmen D. Schanke K.F. Hanssen A. Holmen Appl. Catal. A: Gen. 186 1999 169 188 [23] J. Wang P.A. Chernavskii A.Y. Khodakov Y. Wang J. Catal. 286 2012 51 61 [24] J.F. Moulder J. Chastain R.C. King Handbook of X-ray Photoelectron Spectroscopy: A Reference Book of Standard Spectra for Identification and Interpretation of XPS Data 1992 PerkinElmer Eden Prairie MN [25] J.J. Spivey A. Egbebi Chem. Soc. Rev. 36 2007 1514 1528 [26] J. Wang P.A. Chernavskii Y. Wang A.Y. Khodakov Fuel 103 2013 1111 1122 [27] M. Ichikawa T. Fukushima J. Chem. Soc. Chem. Commun. 1985 321 323 [28] Y. Xiang R. Barbosa N. Kruse ACS Catal. 4 2014 2792 2800 [29] G.G. Volkova T.M. Yurieva L.M. Plyasova M.I. Naumova V.I. Zaikovskii J. Mol. Catal. A Chem. 158 2000 389 393 [30] H. Karaca O.V. Safonova S. Chambrey P. Fongarland P. Roussel A. Griboval-Constant M. Lacroix A.Y. Khodakov J. Catal. 277 2011 14 26 [31] G. Kwak M.H. Woo S.C. Kang H.-G. Park Y.-J. Lee K.-W. Jun K.-S. Ha J. Catal. 307 2013 27 36 [32] M. Claeys M.E. Dry E. van Steen E. du Plessis P.J. van Berge A.M. Saib D.J. Moodley J. Catal. 318 2014 193 202 [33] D.J. Moodley J. van de Loosdrecht A.M. Saib M.J. Overett A.K. Datye J.W. Niemantsverdriet Appl. Catal. A: Gen. 354 2009 102 110 [34] D.-K. Lee J.-H. Lee S.-K. Ihm Appl. Catal. 36 1988 199 207 [35] A.M. Saib D.J. Moodley I.M. Ciobîcă M.M. Hauman B.H. Sigwebela C.J. Weststrate J.W. Niemantsverdriet J. van de Loosdrecht Catal. Today 154 2010 271 282 [36] H.W. Pennline R.J. Gormley R.R. Schehl Ind. Eng. Chem. Prod. Res. Dev. 23 1984 388 393 [37] Z. Pan M. Parvari D.B. Bukur Appl. Catal. A: Gen. 480 2014 79 85 [38] I. Luisetto S. Tuti C. Battocchio S. Lo Mastro A. Sodo Appl. Catal. A: Gen. 500 2015 12 22 [39] T. Ishida T. Yanagihara X. Liu H. Ohashi A. Hamasaki T. Honma H. Oji T. Yokoyama M. Tokunaga Appl. Catal. A: Gen. 458 2013 145 154",
      "scopus-id": "84943229993",
      "coredata": {
        "eid": "1-s2.0-S0926860X15301654",
        "dc:description": "Three cobalt–copper catalysts singly promoted with La, Zr, or Al were studied for catalytic conversion of syngas to higher alcohols. The properties of the promoted catalysts have been characterized by TPR, XRD, XPS and BET. CO hydrogenation was carried out in a plug-flow reactor under 30bar, GHSV=36000 scc/gcat/h, H2/CO=2, and 250°C at differential conversions. The catalyst activity and selectivity to higher alcohols are greatest on CuCoLa2O​3: ethanol selectivity 10.5% at a conversion of 0.76%. During 9h of time-on-stream, CO conversion decreased on CuCoLa2O3​ while methanol and higher alcohol selectivity increased. The behaviors on CuCoZrO2 and CuCoAl2O3 were different. On these two catalysts, CO conversion and selectivity reached a near-steady state much more quickly than CuCoLa2O3. These results suggest changes on CuCoLa2O3 that increase the selectivity for oxygenates continue with time, at least over the time scale investigated here.",
        "openArchiveArticle": "false",
        "prism:coverDate": "2015-10-25",
        "openaccessUserLicense": null,
        "prism:aggregationType": "Journal",
        "prism:url": "https://api.elsevier.com/content/article/pii/S0926860X15301654",
        "dc:creator": [
          {
            "@_fa": "true",
            "$": "Wang, Zi"
          },
          {
            "@_fa": "true",
            "$": "Spivey, James J."
          }
        ],
        "link": [
          {
            "@_fa": "true",
            "@rel": "self",
            "@href": "https://api.elsevier.com/content/article/pii/S0926860X15301654"
          },
          {
            "@_fa": "true",
            "@rel": "scidir",
            "@href": "https://www.sciencedirect.com/science/article/pii/S0926860X15301654"
          }
        ],
        "dc:format": "application/json",
        "openaccessType": null,
        "pii": "S0926-860X(15)30165-4",
        "prism:volume": "507",
        "prism:publisher": "Published by Elsevier B.V.",
        "dc:title": "Effect of ZrO2, Al2O3 and La2O3 on cobalt–copper catalysts for higher alcohols synthesis",
        "prism:copyright": "Copyright © 2015 Published by Elsevier B.V.",
        "openaccess": "0",
        "prism:issn": "0926860X",
        "dcterms:subject": [
          {
            "@_fa": "true",
            "$": "Higher alcohols synthesis"
          },
          {
            "@_fa": "true",
            "$": "Syngas"
          },
          {
            "@_fa": "true",
            "$": "Cobalt"
          },
          {
            "@_fa": "true",
            "$": "Copper"
          },
          {
            "@_fa": "true",
            "$": "Metal oxide promoters"
          },
          {
            "@_fa": "true",
            "$": "Modified Fischer–Tropsch catalysts"
          }
        ],
        "openaccessArticle": "false",
        "prism:publicationName": "Applied Catalysis A: General",
        "openaccessSponsorType": null,
        "prism:pageRange": "75-81",
        "prism:endingPage": "81",
        "pubType": "fla",
        "prism:coverDisplayDate": "25 October 2015",
        "prism:doi": "10.1016/j.apcata.2015.09.032",
        "prism:startingPage": "75",
        "dc:identifier": "doi:10.1016/j.apcata.2015.09.032",
        "openaccessSponsorName": null
      },
      "objects": {
        "object": [
          {
            "@category": "thumbnail",
            "@height": "88",
            "@width": "219",
            "@_fa": "true",
            "$": "https://api.elsevier.com/content/object/eid/1-s2.0-S0926860X15301654-fx1.sml?httpAccept=%2A%2F%2A",
            "@multimediatype": "GIF image file",
            "@type": "IMAGE-THUMBNAIL",
            "@size": "6008",
            "@ref": "fx1",
            "@mimetype": "image/gif"
          },
          {
            "@category": "thumbnail",
            "@height": "164",
            "@width": "203",
            "@_fa": "true",
            "$": "https://api.elsevier.com/content/object/eid/1-s2.0-S0926860X15301654-gr1.sml?httpAccept=%2A%2F%2A",
            "@multimediatype": "GIF image file",
            "@type": "IMAGE-THUMBNAIL",
            "@size": "11440",
            "@ref": "gr1",
            "@mimetype": "image/gif"
          },
          {
            "@category": "thumbnail",
            "@height": "164",
            "@width": "172",
            "@_fa": "true",
            "$": "https://api.elsevier.com/content/object/eid/1-s2.0-S0926860X15301654-gr2.sml?httpAccept=%2A%2F%2A",
            "@multimediatype": "GIF image file",
            "@type": "IMAGE-THUMBNAIL",
            "@size": "19158",
            "@ref": "gr2",
            "@mimetype": "image/gif"
          },
          {
            "@category": "thumbnail",
            "@height": "129",
            "@width": "219",
            "@_fa": "true",
            "$": "https://api.elsevier.com/content/object/eid/1-s2.0-S0926860X15301654-gr3.sml?httpAccept=%2A%2F%2A",
            "@multimediatype": "GIF image file",
            "@type": "IMAGE-THUMBNAIL",
            "@size": "11991",
            "@ref": "gr3",
            "@mimetype": "image/gif"
          },
          {
            "@category": "thumbnail",
            "@height": "162",
            "@width": "53",
            "@_fa": "true",
            "$": "https://api.elsevier.com/content/object/eid/1-s2.0-S0926860X15301654-gr4.sml?httpAccept=%2A%2F%2A",
            "@multimediatype": "GIF image file",
            "@type": "IMAGE-THUMBNAIL",
            "@size": "9346",
            "@ref": "gr4",
            "@mimetype": "image/gif"
          },
          {
            "@category": "thumbnail",
            "@height": "108",
            "@width": "219",
            "@_fa": "true",
            "$": "https://api.elsevier.com/content/object/eid/1-s2.0-S0926860X15301654-gr5.sml?httpAccept=%2A%2F%2A",
            "@multimediatype": "GIF image file",
            "@type": "IMAGE-THUMBNAIL",
            "@size": "9637",
            "@ref": "gr5",
            "@mimetype": "image/gif"
          },
          {
            "@category": "standard",
            "@height": "200",
            "@width": "500",
            "@_fa": "true",
            "$": "https://api.elsevier.com/content/object/eid/1-s2.0-S0926860X15301654-fx1.jpg?httpAccept=%2A%2F%2A",
            "@multimediatype": "JPEG image file",
            "@type": "IMAGE-DOWNSAMPLED",
            "@size": "24631",
            "@ref": "fx1",
            "@mimetype": "image/jpeg"
          },
          {
            "@category": "standard",
            "@height": "317",
            "@width": "393",
            "@_fa": "true",
            "$": "https://api.elsevier.com/content/object/eid/1-s2.0-S0926860X15301654-gr1.jpg?httpAccept=%2A%2F%2A",
            "@multimediatype": "JPEG image file",
            "@type": "IMAGE-DOWNSAMPLED",
            "@size": "40385",
            "@ref": "gr1",
            "@mimetype": "image/jpeg"
          },
          {
            "@category": "standard",
            "@height": "717",
            "@width": "753",
            "@_fa": "true",
            "$": "https://api.elsevier.com/content/object/eid/1-s2.0-S0926860X15301654-gr2.jpg?httpAccept=%2A%2F%2A",
            "@multimediatype": "JPEG image file",
            "@type": "IMAGE-DOWNSAMPLED",
            "@size": "142623",
            "@ref": "gr2",
            "@mimetype": "image/jpeg"
          },
          {
            "@category": "standard",
            "@height": "231",
            "@width": "393",
            "@_fa": "true",
            "$": "https://api.elsevier.com/content/object/eid/1-s2.0-S0926860X15301654-gr3.jpg?httpAccept=%2A%2F%2A",
            "@multimediatype": "JPEG image file",
            "@type": "IMAGE-DOWNSAMPLED",
            "@size": "40577",
            "@ref": "gr3",
            "@mimetype": "image/jpeg"
          },
          {
            "@category": "standard",
            "@height": "979",
            "@width": "321",
            "@_fa": "true",
            "$": "https://api.elsevier.com/content/object/eid/1-s2.0-S0926860X15301654-gr4.jpg?httpAccept=%2A%2F%2A",
            "@multimediatype": "JPEG image file",
            "@type": "IMAGE-DOWNSAMPLED",
            "@size": "85517",
            "@ref": "gr4",
            "@mimetype": "image/jpeg"
          },
          {
            "@category": "standard",
            "@height": "241",
            "@width": "489",
            "@_fa": "true",
            "$": "https://api.elsevier.com/content/object/eid/1-s2.0-S0926860X15301654-gr5.jpg?httpAccept=%2A%2F%2A",
            "@multimediatype": "JPEG image file",
            "@type": "IMAGE-DOWNSAMPLED",
            "@size": "37164",
            "@ref": "gr5",
            "@mimetype": "image/jpeg"
          },
          {
            "@category": "high",
            "@height": "886",
            "@width": "2213",
            "@_fa": "true",
            "$": "https://api.elsevier.com/content/object/eid/1-s2.0-S0926860X15301654-fx1_lrg.jpg?httpAccept=%2A%2F%2A",
            "@multimediatype": "JPEG image file",
            "@type": "IMAGE-HIGH-RES",
            "@size": "161781",
            "@ref": "fx1",
            "@mimetype": "image/jpeg"
          },
          {
            "@category": "high",
            "@height": "1406",
            "@width": "1742",
            "@_fa": "true",
            "$": "https://api.elsevier.com/content/object/eid/1-s2.0-S0926860X15301654-gr1_lrg.jpg?httpAccept=%2A%2F%2A",
            "@multimediatype": "JPEG image file",
            "@type": "IMAGE-HIGH-RES",
            "@size": "174101",
            "@ref": "gr1",
            "@mimetype": "image/jpeg"
          },
          {
            "@category": "high",
            "@height": "3173",
            "@width": "3333",
            "@_fa": "true",
            "$": "https://api.elsevier.com/content/object/eid/1-s2.0-S0926860X15301654-gr2_lrg.jpg?httpAccept=%2A%2F%2A",
            "@multimediatype": "JPEG image file",
            "@type": "IMAGE-HIGH-RES",
            "@size": "838604",
            "@ref": "gr2",
            "@mimetype": "image/jpeg"
          },
          {
            "@category": "high",
            "@height": "1026",
            "@width": "1742",
            "@_fa": "true",
            "$": "https://api.elsevier.com/content/object/eid/1-s2.0-S0926860X15301654-gr3_lrg.jpg?httpAccept=%2A%2F%2A",
            "@multimediatype": "JPEG image file",
            "@type": "IMAGE-HIGH-RES",
            "@size": "165971",
            "@ref": "gr3",
            "@mimetype": "image/jpeg"
          },
          {
            "@category": "high",
            "@height": "4333",
            "@width": "1421",
            "@_fa": "true",
            "$": "https://api.elsevier.com/content/object/eid/1-s2.0-S0926860X15301654-gr4_lrg.jpg?httpAccept=%2A%2F%2A",
            "@multimediatype": "JPEG image file",
            "@type": "IMAGE-HIGH-RES",
            "@size": "480055",
            "@ref": "gr4",
            "@mimetype": "image/jpeg"
          },
          {
            "@category": "high",
            "@height": "1069",
            "@width": "2167",
            "@_fa": "true",
            "$": "https://api.elsevier.com/content/object/eid/1-s2.0-S0926860X15301654-gr5_lrg.jpg?httpAccept=%2A%2F%2A",
            "@multimediatype": "JPEG image file",
            "@type": "IMAGE-HIGH-RES",
            "@size": "188212",
            "@ref": "gr5",
            "@mimetype": "image/jpeg"
          },
          {
            "@category": "thumbnail",
            "@_fa": "true",
            "$": "https://api.elsevier.com/content/object/eid/1-s2.0-S0926860X15301654-Zi_Wang_Metal_oxide_promoters_2015_P19.jpg?httpAccept=%2A%2F%2A",
            "@multimediatype": "JPEG image file",
            "@type": "ALTIMG",
            "@size": "195658",
            "@ref": "Zi_Wang_Metal_oxide_promoters_2015_P19",
            "@mimetype": "image/jpeg"
          },
          {
            "@category": "thumbnail",
            "@_fa": "true",
            "$": "https://api.elsevier.com/content/object/eid/1-s2.0-S0926860X15301654-Zi_Wang_Metal_oxide_promoters_2015_P05.jpg?httpAccept=%2A%2F%2A",
            "@multimediatype": "JPEG image file",
            "@type": "ALTIMG",
            "@size": "552560",
            "@ref": "Zi_Wang_Metal_oxide_promoters_2015_P05",
            "@mimetype": "image/jpeg"
          },
          {
            "@category": "thumbnail",
            "@_fa": "true",
            "$": "https://api.elsevier.com/content/object/eid/1-s2.0-S0926860X15301654-Zi_Wang_Metal_oxide_promoters_2015_P22.jpg?httpAccept=%2A%2F%2A",
            "@multimediatype": "JPEG image file",
            "@type": "ALTIMG",
            "@size": "466531",
            "@ref": "Zi_Wang_Metal_oxide_promoters_2015_P22",
            "@mimetype": "image/jpeg"
          },
          {
            "@category": "thumbnail",
            "@_fa": "true",
            "$": "https://api.elsevier.com/content/object/eid/1-s2.0-S0926860X15301654-Zi_Wang_Metal_oxide_promoters_2015_P16.jpg?httpAccept=%2A%2F%2A",
            "@multimediatype": "JPEG image file",
            "@type": "ALTIMG",
            "@size": "194968",
            "@ref": "Zi_Wang_Metal_oxide_promoters_2015_P16",
            "@mimetype": "image/jpeg"
          },
          {
            "@category": "thumbnail",
            "@_fa": "true",
            "$": "https://api.elsevier.com/content/object/eid/1-s2.0-S0926860X15301654-Zi_Wang_Metal_oxide_promoters_2015_P21.jpg?httpAccept=%2A%2F%2A",
            "@multimediatype": "JPEG image file",
            "@type": "ALTIMG",
            "@size": "151161",
            "@ref": "Zi_Wang_Metal_oxide_promoters_2015_P21",
            "@mimetype": "image/jpeg"
          },
          {
            "@category": "thumbnail",
            "@_fa": "true",
            "$": "https://api.elsevier.com/content/object/eid/1-s2.0-S0926860X15301654-Zi_Wang_Metal_oxide_promoters_2015_P02.jpg?httpAccept=%2A%2F%2A",
            "@multimediatype": "JPEG image file",
            "@type": "ALTIMG",
            "@size": "545936",
            "@ref": "Zi_Wang_Metal_oxide_promoters_2015_P02",
            "@mimetype": "image/jpeg"
          },
          {
            "@category": "thumbnail",
            "@_fa": "true",
            "$": "https://api.elsevier.com/content/object/eid/1-s2.0-S0926860X15301654-Zi_Wang_Metal_oxide_promoters_2015_P20.jpg?httpAccept=%2A%2F%2A",
            "@multimediatype": "JPEG image file",
            "@type": "ALTIMG",
            "@size": "227763",
            "@ref": "Zi_Wang_Metal_oxide_promoters_2015_P20",
            "@mimetype": "image/jpeg"
          },
          {
            "@category": "thumbnail",
            "@_fa": "true",
            "$": "https://api.elsevier.com/content/object/eid/1-s2.0-S0926860X15301654-Zi_Wang_Metal_oxide_promoters_2015_P11.jpg?httpAccept=%2A%2F%2A",
            "@multimediatype": "JPEG image file",
            "@type": "ALTIMG",
            "@size": "552132",
            "@ref": "Zi_Wang_Metal_oxide_promoters_2015_P11",
            "@mimetype": "image/jpeg"
          },
          {
            "@category": "thumbnail",
            "@_fa": "true",
            "$": "https://api.elsevier.com/content/object/eid/1-s2.0-S0926860X15301654-Zi_Wang_Metal_oxide_promoters_2015_P04.jpg?httpAccept=%2A%2F%2A",
            "@multimediatype": "JPEG image file",
            "@type": "ALTIMG",
            "@size": "532397",
            "@ref": "Zi_Wang_Metal_oxide_promoters_2015_P04",
            "@mimetype": "image/jpeg"
          },
          {
            "@category": "thumbnail",
            "@_fa": "true",
            "$": "https://api.elsevier.com/content/object/eid/1-s2.0-S0926860X15301654-Zi_Wang_Metal_oxide_promoters_2015_P08.jpg?httpAccept=%2A%2F%2A",
            "@multimediatype": "JPEG image file",
            "@type": "ALTIMG",
            "@size": "546110",
            "@ref": "Zi_Wang_Metal_oxide_promoters_2015_P08",
            "@mimetype": "image/jpeg"
          },
          {
            "@category": "thumbnail",
            "@_fa": "true",
            "$": "https://api.elsevier.com/content/object/eid/1-s2.0-S0926860X15301654-Zi_Wang_Metal_oxide_promoters_2015_P18.jpg?httpAccept=%2A%2F%2A",
            "@multimediatype": "JPEG image file",
            "@type": "ALTIMG",
            "@size": "474502",
            "@ref": "Zi_Wang_Metal_oxide_promoters_2015_P18",
            "@mimetype": "image/jpeg"
          },
          {
            "@category": "thumbnail",
            "@_fa": "true",
            "$": "https://api.elsevier.com/content/object/eid/1-s2.0-S0926860X15301654-Zi_Wang_Metal_oxide_promoters_2015_P01.jpg?httpAccept=%2A%2F%2A",
            "@multimediatype": "JPEG image file",
            "@type": "ALTIMG",
            "@size": "458171",
            "@ref": "Zi_Wang_Metal_oxide_promoters_2015_P01",
            "@mimetype": "image/jpeg"
          },
          {
            "@category": "thumbnail",
            "@_fa": "true",
            "$": "https://api.elsevier.com/content/object/eid/1-s2.0-S0926860X15301654-Zi_Wang_Metal_oxide_promoters_2015_P15.jpg?httpAccept=%2A%2F%2A",
            "@multimediatype": "JPEG image file",
            "@type": "ALTIMG",
            "@size": "845624",
            "@ref": "Zi_Wang_Metal_oxide_promoters_2015_P15",
            "@mimetype": "image/jpeg"
          },
          {
            "@category": "thumbnail",
            "@_fa": "true",
            "$": "https://api.elsevier.com/content/object/eid/1-s2.0-S0926860X15301654-Zi_Wang_Metal_oxide_promoters_2015_P12.jpg?httpAccept=%2A%2F%2A",
            "@multimediatype": "JPEG image file",
            "@type": "ALTIMG",
            "@size": "555368",
            "@ref": "Zi_Wang_Metal_oxide_promoters_2015_P12",
            "@mimetype": "image/jpeg"
          },
          {
            "@category": "thumbnail",
            "@_fa": "true",
            "$": "https://api.elsevier.com/content/object/eid/1-s2.0-S0926860X15301654-Zi_Wang_Metal_oxide_promoters_2015_P10.jpg?httpAccept=%2A%2F%2A",
            "@multimediatype": "JPEG image file",
            "@type": "ALTIMG",
            "@size": "556548",
            "@ref": "Zi_Wang_Metal_oxide_promoters_2015_P10",
            "@mimetype": "image/jpeg"
          },
          {
            "@category": "thumbnail",
            "@_fa": "true",
            "$": "https://api.elsevier.com/content/object/eid/1-s2.0-S0926860X15301654-Zi_Wang_Metal_oxide_promoters_2015_P14.jpg?httpAccept=%2A%2F%2A",
            "@multimediatype": "JPEG image file",
            "@type": "ALTIMG",
            "@size": "113299",
            "@ref": "Zi_Wang_Metal_oxide_promoters_2015_P14",
            "@mimetype": "image/jpeg"
          },
          {
            "@category": "thumbnail",
            "@_fa": "true",
            "$": "https://api.elsevier.com/content/object/eid/1-s2.0-S0926860X15301654-Zi_Wang_Metal_oxide_promoters_2015_P23.jpg?httpAccept=%2A%2F%2A",
            "@multimediatype": "JPEG image file",
            "@type": "ALTIMG",
            "@size": "297698",
            "@ref": "Zi_Wang_Metal_oxide_promoters_2015_P23",
            "@mimetype": "image/jpeg"
          },
          {
            "@category": "thumbnail",
            "@_fa": "true",
            "$": "https://api.elsevier.com/content/object/eid/1-s2.0-S0926860X15301654-Zi_Wang_Metal_oxide_promoters_2015_P03.jpg?httpAccept=%2A%2F%2A",
            "@multimediatype": "JPEG image file",
            "@type": "ALTIMG",
            "@size": "571631",
            "@ref": "Zi_Wang_Metal_oxide_promoters_2015_P03",
            "@mimetype": "image/jpeg"
          },
          {
            "@category": "thumbnail",
            "@_fa": "true",
            "$": "https://api.elsevier.com/content/object/eid/1-s2.0-S0926860X15301654-Zi_Wang_Metal_oxide_promoters_2015_P06.jpg?httpAccept=%2A%2F%2A",
            "@multimediatype": "JPEG image file",
            "@type": "ALTIMG",
            "@size": "531676",
            "@ref": "Zi_Wang_Metal_oxide_promoters_2015_P06",
            "@mimetype": "image/jpeg"
          },
          {
            "@category": "thumbnail",
            "@_fa": "true",
            "$": "https://api.elsevier.com/content/object/eid/1-s2.0-S0926860X15301654-Zi_Wang_Metal_oxide_promoters_2015_P09.jpg?httpAccept=%2A%2F%2A",
            "@multimediatype": "JPEG image file",
            "@type": "ALTIMG",
            "@size": "487026",
            "@ref": "Zi_Wang_Metal_oxide_promoters_2015_P09",
            "@mimetype": "image/jpeg"
          },
          {
            "@category": "thumbnail",
            "@_fa": "true",
            "$": "https://api.elsevier.com/content/object/eid/1-s2.0-S0926860X15301654-Zi_Wang_Metal_oxide_promoters_2015_P17.jpg?httpAccept=%2A%2F%2A",
            "@multimediatype": "JPEG image file",
            "@type": "ALTIMG",
            "@size": "162936",
            "@ref": "Zi_Wang_Metal_oxide_promoters_2015_P17",
            "@mimetype": "image/jpeg"
          },
          {
            "@category": "thumbnail",
            "@_fa": "true",
            "$": "https://api.elsevier.com/content/object/eid/1-s2.0-S0926860X15301654-Zi_Wang_Metal_oxide_promoters_2015_P07.jpg?httpAccept=%2A%2F%2A",
            "@multimediatype": "JPEG image file",
            "@type": "ALTIMG",
            "@size": "530319",
            "@ref": "Zi_Wang_Metal_oxide_promoters_2015_P07",
            "@mimetype": "image/jpeg"
          },
          {
            "@category": "thumbnail",
            "@_fa": "true",
            "$": "https://api.elsevier.com/content/object/eid/1-s2.0-S0926860X15301654-Zi_Wang_Metal_oxide_promoters_2015_P13.jpg?httpAccept=%2A%2F%2A",
            "@multimediatype": "JPEG image file",
            "@type": "ALTIMG",
            "@size": "559443",
            "@ref": "Zi_Wang_Metal_oxide_promoters_2015_P13",
            "@mimetype": "image/jpeg"
          },
          {
            "@category": "standard",
            "@_fa": "true",
            "$": "https://api.elsevier.com/content/object/eid/1-s2.0-S0926860X15301654-am.pdf?httpAccept=%2A%2F%2A",
            "@multimediatype": "Acrobat PDF file",
            "@type": "AAM-PDF",
            "@size": "923564",
            "@ref": "am",
            "@mimetype": "application/pdf"
          }
        ]
      },
      "link": {
        "@rel": "abstract",
        "@href": "https://api.elsevier.com/content/abstract/scopus_id/84943229993"
      }
    }
  }
}