{
  "metadata": {
    "title": "Effects of impregnation strategy on structure and performance of bimetallic CoFe/AC catalysts for higher alcohols synthesis from syngas",
    "authors": "; ; ",
    "journal": "Applied Catalysis A: General",
    "date": "2016-08-05",
    "doi": "10.1016/j.apcata.2016.06.022",
    "abstract": "",
    "uri": "https://api.elsevier.com/content/article/pii/S0926860X16303362",
    "pii": "S0926860X16303362"
  },
  "fulltext": {
    "full-text-retrieval-response": {
      "scopus-eid": "2-s2.0-84976288686",
      "originalText": "serial JL 271346 291210 291744 291809 31 Applied Catalysis A: General APPLIEDCATALYSISAGENERAL 2016-06-15 2016-06-15 2016-06-23 2016-06-23 2016-07-22T17:08:42 1-s2.0-S0926860X16303362 S0926-860X(16)30336-2 S0926860X16303362 10.1016/j.apcata.2016.06.022 S300 S300.1 FULL-TEXT 1-s2.0-S0926860X16X00105 2025-07-16T14:33:53.326206Z 0 0 20160805 2016 2016-06-15T07:15:34.418496Z absattachment articleinfo articletitlenorm authfirstinitialnorm authfirstsurnamenorm cid cids contenttype copyright crossmark dateloaded dateloadedtxt datesearch datesort dateupdated dco docsubtype doctype doi eid ewtransactionid hubeid indexeddate issn issnnorm itemstage itemtransactionid itemweight openaccess openarchive pg pgfirst pglast pii piinorm pubdatestart pubdatetxt pubyr sectiontitle sortorder srctitle srctitlenorm srctype ssids alllist content subj subheadings suppl tomb volfirst volissue volumelist webpdf webpdfpagecount yearnav figure table body mmlmath acknowledge affil articletitle auth authfirstini authfull authkeywords authlast grantnumber grantsponsor grantsponsorid highlightsabst primabst ref specialabst 0926-860X 0926860X true 523 523 C Volume 523 30 263 271 263 271 20160805 5 August 2016 2016-08-05 2016 Articles article fla © 2016 Elsevier B.V. All rights reserved. EFFECTSIMPREGNATIONSTRATEGYSTRUCTUREPERFORMANCEBIMETALLICCOFEACCATALYSTSFORHIGHERALCOHOLSSYNTHESISSYNGAS DU H 1 Introduction 2 Experimental 2.1 Catalyst preparation 2.2 Catalyst characterization 2.3 Catalytic performance evaluation 3 Results and discussion 3.1 Characterization 3.2 The performance of CO hydrogenation 4 Conclusions Acknowledgements References FANG 2009 133 138 K GUPTA 2011 641 656 M SURISETTY 2011 1 11 V XIANG 2013 7114 7117 Y WENDER 1953 3041 3042 I FREY 2014 5 7 G GNANAMANI 2016 40 47 M PRIETO 2014 6397 6401 G ISHIDA 2013 145 154 T ZAMAN 2012 41 132 S LIU 2015 99023 99027 Y ANTON 2016 175 186 J CHRISTENSEN 2009 29 43 J DU 2016 42 49 H PAN 2013 470 478 Z CHENG 2010 1085 1093 J VOLKOVA 2000 389 393 G FANG 2011 183 191 Y LIU 2014 10 18 G JIAO 2009 137 142 G PEI 2015 355 361 Y PEI 2015 3620 3624 Y NAKHAEIPOUR 2008 201 208 A LI 2013 10 19 J OSHEA 2003 123 128 V TAVASOLI 2009 1486 1494 A BRAGANCA 2012 146 153 L DUVENHAGE 1997 43 67 D LOGDBERG 2009 167 182 S MA 2009 232 236 X ALI 2011 68 S DAS 2012 20812 20819 T WANG 2012 95 104 L GRIBOVALCONSTANT 2014 116 126 A DLAMINI 2015 3000 3011 M BOUDEVILLE 1979 52 60 Y KHODAKOV 2002 230 241 A MA 2010 4099 4110 W FU 2014 1342 1350 T CHEN 2012 456 461 L LEBARBIER 2011 17440 17451 V LV 2014 1250 1255 Z JALAMA 2016 71 74 K QIN 2016 8 15 N KHODAKOV 2007 1692 1744 A TEJUCA 1988 301 316 L WANG 2006 47 52 T CORTES 1975 477 481 O PEI 2013 808 812 Y MATSUZAKI 1993 159 184 T MATSUZAKI 1997 311 324 T MATSUZAKI 1996 251 259 T DUX2016X263 DUX2016X263X271 DUX2016X263XH DUX2016X263X271XH 2018-06-23T00:00:00Z http://creativecommons.org/licenses/by-nc-nd/4.0/ © 2016 Elsevier B.V. All rights reserved. item S0926-860X(16)30336-2 S0926860X16303362 1-s2.0-S0926860X16303362 10.1016/j.apcata.2016.06.022 271346 2024-01-01T12:31:47.592716Z 2016-08-05 1-s2.0-S0926860X16303362-main.pdf https://s3-eu-west-1.amazonaws.com/prod-ucs-content-store-eu-west/content/pii:S0926860X16303362/MAIN/application/pdf/80423355591c3efc21a034356fbe58db/main.pdf https://s3.amazonaws.com/prod-ucs-content-store-us-east/content/pii:S0926860X16303362/MAIN/application/pdf/80423355591c3efc21a034356fbe58db/main.pdf main.pdf pdf true 2749383 MAIN 9 1-s2.0-S0926860X16303362-main_1.png https://s3-eu-west-1.amazonaws.com/prod-ucs-content-store-eu-west/content/pii:S0926860X16303362/PREVIEW/image/png/228f5788b1e8cc4a5f20c4e94e5a792f/main_1.png https://s3.amazonaws.com/prod-ucs-content-store-us-east/content/pii:S0926860X16303362/PREVIEW/image/png/228f5788b1e8cc4a5f20c4e94e5a792f/main_1.png main_1.png png 57822 849 656 IMAGE-WEB-PDF 1 1-s2.0-S0926860X16303362-fx1.sml https://s3-eu-west-1.amazonaws.com/prod-ucs-content-store-eu-west/content/pii:S0926860X16303362/fx1/THUMBNAIL/image/gif/8b8b81a7ef54d00d203047206812a9ae/fx1.sml https://s3.amazonaws.com/prod-ucs-content-store-us-east/content/pii:S0926860X16303362/fx1/THUMBNAIL/image/gif/8b8b81a7ef54d00d203047206812a9ae/fx1.sml fx1 true fx1.sml sml 4434 88 219 IMAGE-THUMBNAIL 1-s2.0-S0926860X16303362-gr1.sml https://s3-eu-west-1.amazonaws.com/prod-ucs-content-store-eu-west/content/pii:S0926860X16303362/gr1/THUMBNAIL/image/gif/381d0013ac14886a5d8b5e1cab3f70dc/gr1.sml https://s3.amazonaws.com/prod-ucs-content-store-us-east/content/pii:S0926860X16303362/gr1/THUMBNAIL/image/gif/381d0013ac14886a5d8b5e1cab3f70dc/gr1.sml gr1 gr1.sml sml 6225 164 213 IMAGE-THUMBNAIL 1-s2.0-S0926860X16303362-gr2.sml https://s3-eu-west-1.amazonaws.com/prod-ucs-content-store-eu-west/content/pii:S0926860X16303362/gr2/THUMBNAIL/image/gif/78296b00fe7e5fba77d30fc7007795a5/gr2.sml https://s3.amazonaws.com/prod-ucs-content-store-us-east/content/pii:S0926860X16303362/gr2/THUMBNAIL/image/gif/78296b00fe7e5fba77d30fc7007795a5/gr2.sml gr2 gr2.sml sml 4538 162 39 IMAGE-THUMBNAIL 1-s2.0-S0926860X16303362-gr3.sml https://s3-eu-west-1.amazonaws.com/prod-ucs-content-store-eu-west/content/pii:S0926860X16303362/gr3/THUMBNAIL/image/gif/6c679dbc4678de8843754c54a74b5134/gr3.sml https://s3.amazonaws.com/prod-ucs-content-store-us-east/content/pii:S0926860X16303362/gr3/THUMBNAIL/image/gif/6c679dbc4678de8843754c54a74b5134/gr3.sml gr3 gr3.sml sml 5957 164 105 IMAGE-THUMBNAIL 1-s2.0-S0926860X16303362-gr4.sml https://s3-eu-west-1.amazonaws.com/prod-ucs-content-store-eu-west/content/pii:S0926860X16303362/gr4/THUMBNAIL/image/gif/c3e4909735ed45ce35c1504878fe7b30/gr4.sml https://s3.amazonaws.com/prod-ucs-content-store-us-east/content/pii:S0926860X16303362/gr4/THUMBNAIL/image/gif/c3e4909735ed45ce35c1504878fe7b30/gr4.sml gr4 gr4.sml sml 7221 164 213 IMAGE-THUMBNAIL 1-s2.0-S0926860X16303362-gr5.sml https://s3-eu-west-1.amazonaws.com/prod-ucs-content-store-eu-west/content/pii:S0926860X16303362/gr5/THUMBNAIL/image/gif/53093b4aef738cbad36dd0dcc0c78bd3/gr5.sml https://s3.amazonaws.com/prod-ucs-content-store-us-east/content/pii:S0926860X16303362/gr5/THUMBNAIL/image/gif/53093b4aef738cbad36dd0dcc0c78bd3/gr5.sml gr5 gr5.sml sml 15414 164 164 IMAGE-THUMBNAIL 1-s2.0-S0926860X16303362-gr6.sml https://s3-eu-west-1.amazonaws.com/prod-ucs-content-store-eu-west/content/pii:S0926860X16303362/gr6/THUMBNAIL/image/gif/21aba049639e027405824ef65f78238d/gr6.sml https://s3.amazonaws.com/prod-ucs-content-store-us-east/content/pii:S0926860X16303362/gr6/THUMBNAIL/image/gif/21aba049639e027405824ef65f78238d/gr6.sml gr6 gr6.sml sml 5532 164 104 IMAGE-THUMBNAIL 1-s2.0-S0926860X16303362-gr7.sml https://s3-eu-west-1.amazonaws.com/prod-ucs-content-store-eu-west/content/pii:S0926860X16303362/gr7/THUMBNAIL/image/gif/f6126812f5d6613035c171b4c332343b/gr7.sml https://s3.amazonaws.com/prod-ucs-content-store-us-east/content/pii:S0926860X16303362/gr7/THUMBNAIL/image/gif/f6126812f5d6613035c171b4c332343b/gr7.sml gr7 gr7.sml sml 4930 164 208 IMAGE-THUMBNAIL 1-s2.0-S0926860X16303362-gr8.sml https://s3-eu-west-1.amazonaws.com/prod-ucs-content-store-eu-west/content/pii:S0926860X16303362/gr8/THUMBNAIL/image/gif/090926f1b3ba053bee8653fa97cd32c7/gr8.sml https://s3.amazonaws.com/prod-ucs-content-store-us-east/content/pii:S0926860X16303362/gr8/THUMBNAIL/image/gif/090926f1b3ba053bee8653fa97cd32c7/gr8.sml gr8 gr8.sml sml 5878 164 181 IMAGE-THUMBNAIL 1-s2.0-S0926860X16303362-fx1.jpg https://s3-eu-west-1.amazonaws.com/prod-ucs-content-store-eu-west/content/pii:S0926860X16303362/fx1/DOWNSAMPLED/image/jpeg/59f48c51288293138fabe6188daa225e/fx1.jpg https://s3.amazonaws.com/prod-ucs-content-store-us-east/content/pii:S0926860X16303362/fx1/DOWNSAMPLED/image/jpeg/59f48c51288293138fabe6188daa225e/fx1.jpg fx1 true fx1.jpg jpg 18114 200 500 IMAGE-DOWNSAMPLED 1-s2.0-S0926860X16303362-gr1.jpg https://s3-eu-west-1.amazonaws.com/prod-ucs-content-store-eu-west/content/pii:S0926860X16303362/gr1/DOWNSAMPLED/image/jpeg/020edd541fa3bc65b49ebf7c30352b34/gr1.jpg https://s3.amazonaws.com/prod-ucs-content-store-us-east/content/pii:S0926860X16303362/gr1/DOWNSAMPLED/image/jpeg/020edd541fa3bc65b49ebf7c30352b34/gr1.jpg gr1 gr1.jpg jpg 23509 290 376 IMAGE-DOWNSAMPLED 1-s2.0-S0926860X16303362-gr2.jpg https://s3-eu-west-1.amazonaws.com/prod-ucs-content-store-eu-west/content/pii:S0926860X16303362/gr2/DOWNSAMPLED/image/jpeg/b14170a2c235d676f1b87a890b6c8dff/gr2.jpg https://s3.amazonaws.com/prod-ucs-content-store-us-east/content/pii:S0926860X16303362/gr2/DOWNSAMPLED/image/jpeg/b14170a2c235d676f1b87a890b6c8dff/gr2.jpg gr2 gr2.jpg jpg 95429 977 235 IMAGE-DOWNSAMPLED 1-s2.0-S0926860X16303362-gr3.jpg https://s3-eu-west-1.amazonaws.com/prod-ucs-content-store-eu-west/content/pii:S0926860X16303362/gr3/DOWNSAMPLED/image/jpeg/5b2bf38e7afd449beb6f8ef6db7ea6d7/gr3.jpg https://s3.amazonaws.com/prod-ucs-content-store-us-east/content/pii:S0926860X16303362/gr3/DOWNSAMPLED/image/jpeg/5b2bf38e7afd449beb6f8ef6db7ea6d7/gr3.jpg gr3 gr3.jpg jpg 57901 586 376 IMAGE-DOWNSAMPLED 1-s2.0-S0926860X16303362-gr4.jpg https://s3-eu-west-1.amazonaws.com/prod-ucs-content-store-eu-west/content/pii:S0926860X16303362/gr4/DOWNSAMPLED/image/jpeg/ae9da8c4a0b9ceeb38c08055f3777d6a/gr4.jpg https://s3.amazonaws.com/prod-ucs-content-store-us-east/content/pii:S0926860X16303362/gr4/DOWNSAMPLED/image/jpeg/ae9da8c4a0b9ceeb38c08055f3777d6a/gr4.jpg gr4 gr4.jpg jpg 21127 290 376 IMAGE-DOWNSAMPLED 1-s2.0-S0926860X16303362-gr5.jpg https://s3-eu-west-1.amazonaws.com/prod-ucs-content-store-eu-west/content/pii:S0926860X16303362/gr5/DOWNSAMPLED/image/jpeg/c2b04365048ea05f6ce720ed5f972434/gr5.jpg https://s3.amazonaws.com/prod-ucs-content-store-us-east/content/pii:S0926860X16303362/gr5/DOWNSAMPLED/image/jpeg/c2b04365048ea05f6ce720ed5f972434/gr5.jpg gr5 gr5.jpg jpg 114950 565 565 IMAGE-DOWNSAMPLED 1-s2.0-S0926860X16303362-gr6.jpg https://s3-eu-west-1.amazonaws.com/prod-ucs-content-store-eu-west/content/pii:S0926860X16303362/gr6/DOWNSAMPLED/image/jpeg/10a02a3d488c881af14f71007c240fa3/gr6.jpg https://s3.amazonaws.com/prod-ucs-content-store-us-east/content/pii:S0926860X16303362/gr6/DOWNSAMPLED/image/jpeg/10a02a3d488c881af14f71007c240fa3/gr6.jpg gr6 gr6.jpg jpg 47441 594 376 IMAGE-DOWNSAMPLED 1-s2.0-S0926860X16303362-gr7.jpg https://s3-eu-west-1.amazonaws.com/prod-ucs-content-store-eu-west/content/pii:S0926860X16303362/gr7/DOWNSAMPLED/image/jpeg/f97bf1e81ed7d9c12e241e25854ed2b5/gr7.jpg https://s3.amazonaws.com/prod-ucs-content-store-us-east/content/pii:S0926860X16303362/gr7/DOWNSAMPLED/image/jpeg/f97bf1e81ed7d9c12e241e25854ed2b5/gr7.jpg gr7 gr7.jpg jpg 18306 296 376 IMAGE-DOWNSAMPLED 1-s2.0-S0926860X16303362-gr8.jpg https://s3-eu-west-1.amazonaws.com/prod-ucs-content-store-eu-west/content/pii:S0926860X16303362/gr8/DOWNSAMPLED/image/jpeg/b0b0d0905d976f99005b381f95222a68/gr8.jpg https://s3.amazonaws.com/prod-ucs-content-store-us-east/content/pii:S0926860X16303362/gr8/DOWNSAMPLED/image/jpeg/b0b0d0905d976f99005b381f95222a68/gr8.jpg gr8 gr8.jpg jpg 24693 340 376 IMAGE-DOWNSAMPLED 1-s2.0-S0926860X16303362-fx1_lrg.jpg https://s3-eu-west-1.amazonaws.com/prod-ucs-content-store-eu-west/content/pii:S0926860X16303362/fx1/HIGHRES/image/jpeg/35724bde44d71c199dedeb0bb64500a3/fx1_lrg.jpg https://s3.amazonaws.com/prod-ucs-content-store-us-east/content/pii:S0926860X16303362/fx1/HIGHRES/image/jpeg/35724bde44d71c199dedeb0bb64500a3/fx1_lrg.jpg fx1 true fx1_lrg.jpg jpg 184376 886 2213 IMAGE-HIGH-RES 1-s2.0-S0926860X16303362-gr1_lrg.jpg https://s3-eu-west-1.amazonaws.com/prod-ucs-content-store-eu-west/content/pii:S0926860X16303362/gr1/HIGHRES/image/jpeg/dd34a412df293a645b6cc42b54ad3293/gr1_lrg.jpg https://s3.amazonaws.com/prod-ucs-content-store-us-east/content/pii:S0926860X16303362/gr1/HIGHRES/image/jpeg/dd34a412df293a645b6cc42b54ad3293/gr1_lrg.jpg gr1 gr1_lrg.jpg jpg 187060 1285 1667 IMAGE-HIGH-RES 1-s2.0-S0926860X16303362-gr2_lrg.jpg https://s3-eu-west-1.amazonaws.com/prod-ucs-content-store-eu-west/content/pii:S0926860X16303362/gr2/HIGHRES/image/jpeg/401b008049b2ad8d49fe6942edc45b0c/gr2_lrg.jpg https://s3.amazonaws.com/prod-ucs-content-store-us-east/content/pii:S0926860X16303362/gr2/HIGHRES/image/jpeg/401b008049b2ad8d49fe6942edc45b0c/gr2_lrg.jpg gr2 gr2_lrg.jpg jpg 948649 4333 1042 IMAGE-HIGH-RES 1-s2.0-S0926860X16303362-gr3_lrg.jpg https://s3-eu-west-1.amazonaws.com/prod-ucs-content-store-eu-west/content/pii:S0926860X16303362/gr3/HIGHRES/image/jpeg/c0aa6c89e981e79b0be9ab3374a60bd0/gr3_lrg.jpg https://s3.amazonaws.com/prod-ucs-content-store-us-east/content/pii:S0926860X16303362/gr3/HIGHRES/image/jpeg/c0aa6c89e981e79b0be9ab3374a60bd0/gr3_lrg.jpg gr3 gr3_lrg.jpg jpg 503818 2597 1667 IMAGE-HIGH-RES 1-s2.0-S0926860X16303362-gr4_lrg.jpg https://s3-eu-west-1.amazonaws.com/prod-ucs-content-store-eu-west/content/pii:S0926860X16303362/gr4/HIGHRES/image/jpeg/5def7df5a78256c10427184dfe198a03/gr4_lrg.jpg https://s3.amazonaws.com/prod-ucs-content-store-us-east/content/pii:S0926860X16303362/gr4/HIGHRES/image/jpeg/5def7df5a78256c10427184dfe198a03/gr4_lrg.jpg gr4 gr4_lrg.jpg jpg 183661 1285 1667 IMAGE-HIGH-RES 1-s2.0-S0926860X16303362-gr5_lrg.jpg https://s3-eu-west-1.amazonaws.com/prod-ucs-content-store-eu-west/content/pii:S0926860X16303362/gr5/HIGHRES/image/jpeg/320a4e0935eeac143ed57bfe5c96b353/gr5_lrg.jpg https://s3.amazonaws.com/prod-ucs-content-store-us-east/content/pii:S0926860X16303362/gr5/HIGHRES/image/jpeg/320a4e0935eeac143ed57bfe5c96b353/gr5_lrg.jpg gr5 gr5_lrg.jpg jpg 1126309 2500 2500 IMAGE-HIGH-RES 1-s2.0-S0926860X16303362-gr6_lrg.jpg https://s3-eu-west-1.amazonaws.com/prod-ucs-content-store-eu-west/content/pii:S0926860X16303362/gr6/HIGHRES/image/jpeg/275a918ad0dcf8264d5973e5d11bed6e/gr6_lrg.jpg https://s3.amazonaws.com/prod-ucs-content-store-us-east/content/pii:S0926860X16303362/gr6/HIGHRES/image/jpeg/275a918ad0dcf8264d5973e5d11bed6e/gr6_lrg.jpg gr6 gr6_lrg.jpg jpg 432526 2632 1667 IMAGE-HIGH-RES 1-s2.0-S0926860X16303362-gr7_lrg.jpg https://s3-eu-west-1.amazonaws.com/prod-ucs-content-store-eu-west/content/pii:S0926860X16303362/gr7/HIGHRES/image/jpeg/291229867f67f58c3878ebdecd4f42de/gr7_lrg.jpg https://s3.amazonaws.com/prod-ucs-content-store-us-east/content/pii:S0926860X16303362/gr7/HIGHRES/image/jpeg/291229867f67f58c3878ebdecd4f42de/gr7_lrg.jpg gr7 gr7_lrg.jpg jpg 145367 1313 1667 IMAGE-HIGH-RES 1-s2.0-S0926860X16303362-gr8_lrg.jpg https://s3-eu-west-1.amazonaws.com/prod-ucs-content-store-eu-west/content/pii:S0926860X16303362/gr8/HIGHRES/image/jpeg/df5e2a621d2ddeefb3699ad570977213/gr8_lrg.jpg https://s3.amazonaws.com/prod-ucs-content-store-us-east/content/pii:S0926860X16303362/gr8/HIGHRES/image/jpeg/df5e2a621d2ddeefb3699ad570977213/gr8_lrg.jpg gr8 gr8_lrg.jpg jpg 162651 1507 1667 IMAGE-HIGH-RES 1-s2.0-S0926860X16303362-si1.gif https://s3-eu-west-1.amazonaws.com/prod-ucs-content-store-eu-west/content/pii:S0926860X16303362/STRIPIN/image/gif/9198ef57bd8ce2dc1bed4e8a1f1017e8/si1.gif https://s3.amazonaws.com/prod-ucs-content-store-us-east/content/pii:S0926860X16303362/STRIPIN/image/gif/9198ef57bd8ce2dc1bed4e8a1f1017e8/si1.gif si1 si1.gif gif 799 48 130 ALTIMG 1-s2.0-S0926860X16303362-si2.gif https://s3-eu-west-1.amazonaws.com/prod-ucs-content-store-eu-west/content/pii:S0926860X16303362/STRIPIN/image/gif/1f8b2a04d1e32b87db0eeb196d0c4f0f/si2.gif https://s3.amazonaws.com/prod-ucs-content-store-us-east/content/pii:S0926860X16303362/STRIPIN/image/gif/1f8b2a04d1e32b87db0eeb196d0c4f0f/si2.gif si2 si2.gif gif 1957 46 275 ALTIMG 1-s2.0-S0926860X16303362-si3.gif https://s3-eu-west-1.amazonaws.com/prod-ucs-content-store-eu-west/content/pii:S0926860X16303362/STRIPIN/image/gif/47ba0003397f6be5c7bcf8cbfec26503/si3.gif https://s3.amazonaws.com/prod-ucs-content-store-us-east/content/pii:S0926860X16303362/STRIPIN/image/gif/47ba0003397f6be5c7bcf8cbfec26503/si3.gif si3 si3.gif gif 716 35 187 ALTIMG 1-s2.0-S0926860X16303362-si4.gif https://s3-eu-west-1.amazonaws.com/prod-ucs-content-store-eu-west/content/pii:S0926860X16303362/STRIPIN/image/gif/f82d8828dfc44b635f1016d2af325f2c/si4.gif https://s3.amazonaws.com/prod-ucs-content-store-us-east/content/pii:S0926860X16303362/STRIPIN/image/gif/f82d8828dfc44b635f1016d2af325f2c/si4.gif si4 si4.gif gif 956 40 168 ALTIMG APCATA 15917 S0926-860X(16)30336-2 10.1016/j.apcata.2016.06.022 Elsevier B.V. Fig. 1 H2-TPR profiles of the monometallic and bimetallic catalysts. Fig. 1 Fig. 2 In-situ XRD patterns collected during the reduction process in a flow of H2 for (a) 15Co/AC, (b) 15Fe/AC, (c) 5Fe-15Co/AC, (d) 15Co5Fe/AC and (e) 15Co-5Fe/AC samples. Fig. 2 Fig. 3 XRD patterns of fresh (a) and spent (b) catalysts. Fig. 3 Fig. 4 XRD patterns of the used silica supported catalysts. Fig. 4 Fig. 5 HRTEM images of the bimetallic catalysts after CO hydrogenation: (a) 15Co-5Fe/AC; (b) 15Co5Fe/AC; and (c) 5Fe-15Co/AC. Fig. 5 Fig. 6 XPS spectra of Co 2p and Fe 2p for activated carbon supported catalysts. Fig. 6 Fig. 7 CO-TPD spectra of bimetallic catalysts prepared by difference impregnation sequence. Fig. 7 Fig. 8 Product distributions of the liquid phase products and corresponding CO conversion (Reaction conditions: T=493K, P=3.0MPa, GHSV=4L-syngas/g-cat.h). Fig. 8 Table 1 Textural property, CO Uptakes, metal dispersion and reducibility data of the CoFe/AC catalysts. Table 1 Catalyst a SBET (m2 g−1) b Vtotal(cm3 g−1) CO uptake c (μmol CO/g-catalyst) Dispersion degree d (%) Reduction degree e (%) Surface atomic ratio f Co/C Fe/C Co/Fe AC 1139 0.70 – – – – – – 15Co/AC 922 0.66 81.5 6.5 98.7 1.32% – – 15Fe/AC 832 0.52 43.1 4.9 68.8 – 1.56% – 15Co-5Fe/AC 777 0.48 85.4 7.7 64.9 1.27% 1.00% 1.26 15Co5Fe/AC 741 0.54 65.6 5.7 68.1 1.18% 1.10% 1.08 5Fe-15Co/AC 772 0.54 59.1 4.9 70.3 1.05% 1.50% 0.69 a The surface area (S BET) was calculated by the BET method. b The total pore volume (Vtotal) was obtained from the N2 amount adsorbed at a relative pressure close to unity. c Based on CO chemisorption. d Based on CO/Metal=1:1. e Based on H2 consumption in TPR. f Based on XPS quantitative analysis ( n i n j = I i I j × σ j σ i × E k j 0.5 E k i 0.5 ). Table 2 Performance of CO hydrogenation over the CoFe/AC catalysts a . Table 2 Samples CO Conv. (%) H2 Conv. (%) Selectivity (C%) Alcohols distribution (C%) Alcohols Yields(%) Selectivity (C%) c HC1–4 CO2 HC5+ ROH C1OH C2–5OH C6–18OH Hydrocarbon Alcohol CO2 15Co/AC 24.2 31.0 43.0 0.4 39.1 17.5 5.8 40.5 53.7 4.2 82.1 17.5 0.4 15Fe/AC 5.1 10.2 52.2 9.3 20.8 17.7 12.5 46.4 41.0 0.9 63.4 21.3 15.3 5Fe-15Co/AC 12.6 17.7 57.2 1.7 20.6 20.5 12.9 56.9 30.1 2.6 81.2 17.6 1.3 15Co5Fe/AC 16.4 22.3 57.8 1.6 20.0 20.6 12.8 59.5 27.7 3.4 78.8 19.9 1.3 15Co-5Fe/AC 30.9 37.2 59.6 1.5 20.8 18.1 11.4 57.5 31.0 5.6 80.4 18.1 1.5 15Co/SiO2 b 35.5 – 20.2 0.1 77.8 1.8 – – – 0.6 – – – 15Co5Fe/SiO2 b 34.6 – 43.1 0.9 49.0 7.0 – – – 2.4 – – – a Reaction conditions: T=493K, P=3.0MPa, GHSV=4L-syngas/g-cat.h. b Reaction conditions: T=483K, P=3.0MPa, GHSV=8L-syngas/g-cat.h. c Reaction conditions: T=493K, P=3.0MPa, GHSV adjusted to obtain a similar CO conversion level (28±4)%. Effects of impregnation strategy on structure and performance of bimetallic CoFe/AC catalysts for higher alcohols synthesis from syngas Hong Du a c Hejun Zhu a ⁎ Ziang Zhao a c Wenda Dong a Wenting Luo a c Wei Lu a Miao Jiang a Tao Liu a Yunjie Ding a b ⁎ a Dalian National Laboratory for Clean Energy, Dalian Institute of Chemical Physics, Chinese Academy of Sciences, Dalian, 116023, China Dalian National Laboratory for Clean Energy Dalian Institute of Chemical Physics Chinese Academy of Sciences Dalian 116023 China b State Key Laboratory of catalysis, Dalian Institute of Chemical Physics, Chinese Academy of Sciences, Dalian, 116023, China State Key Laboratory of catalysis Dalian Institute of Chemical Physics Chinese Academy of Sciences Dalian 116023 China c University of Chinese Academy of Sciences, Beijing 100039, China University of Chinese Academy of Sciences Beijing 100039 China ⁎ Corresponding authors at: Dalian National Laboratory for Clean Energy, Dalian Institute of Chemical Physics, Chinese Academy of Sciences, Dalian, 116023, China. Dalian National Laboratory for Clean Energy Dalian Institute of Chemical Physics Chinese Academy of Sciences Dalian 116023 China Graphical abstract Higher alcohols synthesis from syngas via Fischer-Tropsch reaction has been studied on activated carbon supported bimetallic CoFe (denoted as CoFe/AC) catalysts. The effect of impregnation strategy on the structure and performance of the catalysts was investigated by means of N2 adsorption, HRTEM, ex-situ/in-situ XRD, CO adsorption, CO-TPD, XPS and CO hydrogenation. The results showed that the sequentially impregnated 15Co-5Fe/AC catalyst prepared with iron precursor firstly and then cobalt precursor had the highest CO uptake, metal dispersion and the maximum cobalt surface content, resulting in the enhancement of CO hydrogenation activity as well as the yield of mixed alcohols. On the other hand, the selectivity towards higher alcohols (C2+) was hardly affected by the impregnation sequence. It was found that the activated carbon facilitated the formation of Co2C species and doping of Fe into the 15Co/AC catalyst promoted the formation of Co-Fe alloy species. Both of Co2C and Co-Fe alloy species were observed in all the co-impregnated and sequentially impregnated catalysts after reaction. It was inferred that Co/Co2C as well as Co-Fe alloy species might be responsible for the synthesis of alcohols via CO hydrogenation. Keywords Higher alcohols synthesis Bimetallic catalysts Impregnation strategy Cobalt Iron Activated carbon 1 Introduction The higher alcohols (CnH2n+1OH, n≥2) are a group of versatile additives widely used in modern petroleum industry and petro-chemistry [1,2]. For instance, the alcohols with lower carbon number (n=2–5) have been added into the fuels to improve the octane number of gasoline, promote the complete combustion or reduce the polluted emissions [3]. While the alcohols with higher carbon numbers (n36) are usually used as intermediates in the synthesis of plasticizers, detergents and lubricants [4]. Currently, higher alcohols are generally produced through two processes, i.e., (1) ALFOLÒ process based on the work of Dr. Ziegler [5], (2) Oxo process (hydroformylation process) [6]. These processes present some drawbacks, such as cumbersome steps and use of dangerous catalysts for ALFOLÒ process. Therefore, many attempts have been made to develop the new approach for higher alcohols synthesis [7,8]. Benefited from its short process, adequate raw materials and clean products, a new type of Fischer-Tropsch (F-T) reaction has received increasing attention, in which the high value mixed alcohols are directly obtained coupled with high quality fuels from syngas without unexpected sulfides and aromatics [9,10]. The catalysts engaged in this reaction are broadly divided into three groups, including modified methanol synthesis catalyst [11,12], alkali-modified molybdenum-based catalyst [10,13] and modified F-T synthesis catalysts [9,14]. Albemarle disclosed a group of Co-Mo sulfide catalysts, which exhibited inspiring results for the alcohols (C1-C5OH) synthesis from syngas [15–19]. The stability of the catalyst is related to the sulphur loss during the operation. The loss of sulphur resulted in the formation of the cobalt carbide and molybdenum carbide. These carbides led to the increase in the hydrocarbon selectivity and decline in selectivity towards alcohols. The supplement of sulphur during the operation would inhibit the formation of these carbides and then the performance of alcohol synthesis would remain stable over long periods of time. Pan et al. [20] and Cheng et al. [21] also reported that Co2C was active for CH4 formation. However, the role of Co2C in Cu-Co bimetallic higher alcohols synthesis catalysts was different from the patents by Albemarle. Volkova et al. [22] reported that cobalt carbide was able to activate CO non-dissociative and promoted the oxygenates synthesis. Liu et al. [23,24] demonstrated that higher alcohols synthesis over the meso-macroporous SiO2 and LaFeO3 supported Co-Cu catalysts were related to both the Co-Cu alloy and Co2C species. Davis et al. [7] deduced that the Co2C species could enhance the oxygenates selectivity in the F-T synthesis. Furthermore, it was found in our laboratory that Co/AC catalyst favored the production of longer chain alcohols (C2-C18) with higher added value [25,26]. Further research has revealed that the synergistic effect provided by the conjunction of Co and Co2C at their interfaces is more likely to be responsible for the generation of the alcohols instead of pure hydrocarbons [27]. Thus, it was inferred that Co2C in the Co/AC catalyst, which would intimately contact with metallic cobalt, was not associated with CH4 formation. These studies gave a clue that alcohols synthesis from syngas might be optimized by designing catalysts with more Co2C species intimately contacted with metallic Co to form the Co@Co2C dual active sites rather than the sole Co2C sites. Fe is another popular catalytic metal for the F-T synthesis, which possesses different hydrogenation activities from Co element [28,29]. So far, CoFe bimetallic catalysts have been extensively investigated for F-T synthesis [30–40], yet few reports have indicated that these bimetallic catalysts could produce mixed alcohols [30–32]. In the present work, the bimetallic CoFe/AC catalysts have been prepared with different impregnation strategies for the F-T synthesis. It was found that higher alcohols are successfully produced in considerable selectivity from syngas. The influence of different preparing methods on their structures, intrinsic properties, and catalytic performance is discussed here. It is suggested that the more quantity of strongly adsorbed CO, the more amount of surface active sites, appearance of the Co-Fe alloy, formation of Co2C during reaction as well as the activated carbon are responsible for the higher yield of mixed alcohols. 2 Experimental 2.1 Catalyst preparation The support employed here was activated carbon (labeled as AC, Brilliant Tech Co. Ltd.), which was made from coconut shells and then be treated as follows: the AC was treated with diluted hydrochloric acid, then washed by de-ionized water until pH=7, and calcined at 673K for 12h, finally crushed into 40–60mesh. The bimetallic catalysts with 15wt% Co and 5wt% Fe were prepared by incipient wetness impregnation techniques under three strategies. 5Fe-15Co/AC catalyst was prepared by sequential impregnation according to the following procedure. The Co(NO3)2 solution was impregnated on the AC firstly, the sample was dried in air at 333K for 12h and calcined at 623K for 6h in a flow of argon. Then the calcined Co/AC sample was impregnated by Fe(NO3)3 solution, as described above the sample was dried in air at 333K for 12h, then calcined at 623K for 6h in a flow of argon. 15Co-5Fe/AC catalyst was prepared by sequential impregnation using an analogous procedure of the 5Fe-15Co/AC catalyst but with a reverse sequence. Fe(NO3)3 solution was impregnated firstly and then Co(NO3)2 solution. 15Co5Fe/AC catalyst was prepared by co-impregnation according to the following procedure. The AC support was co-impregnated by incipient-wetness technique with an aqueous solution containing Co(NO3)2 and Fe(NO3)3. Then, the sample was dried in air at 333K for 12h and calcined at 623K for 6h in an argon flow. The 15Co5Fe/SiO2 catalyst was prepared using the same process as stated above for reference. The monometallic cobalt and iron catalysts were synthesized via incipient wetness impregnation as references. The AC was impregnated with an aqueous solution of Co(NO3)2 or Fe(NO3)3 at room temperature, respectively. After drying in air at 333K for 12h, the samples were calcined at 623K for 6h in an argon flow, and then the catalysts were denoted as 15Co/AC or 15Fe/AC. The 15Co/SiO2 was synthesized via the same procedures. 2.2 Catalyst characterization The specific surface area (SBET , BET method) and the total pore volume (Vtotal ) were determined by nitrogen physisorption at 77K on an Autosorb-1 instrument after degassing at 473K. 30mg of calcined sample was used for a test. High-resolution transmission electron microscopy (HRTEM) tests were performed on a Tecnai G2 F30 instrument. The electron microscope was operated at 300kV. The phase analysis of the AC, fresh samples and spent catalysts were studied by means of ex-situ X-Ray diffraction (ex-situ XRD, PANalytical X’Pert3) with Cu Kα radiation. The spectra were measured over a 2θ range between 30° and 60° at 40kV and 40mA. The JCPDS library was used as standards document. The in-situ X-Ray diffraction (in-situ XRD) experiments were performed on the same instrument for ex-situ XRD using the Anton Paar XRK 900 reaction chamber. The phase transformation was monitored for the activated carbon supported samples during the temperature programmed reduction (5K/min, from room temperature to 783K) in a flow of H2. The data were collected from 2θ ranging from 20° to 70°. The patterns were collected with a temperature interval of 20K. H2-TPR experiments were carried out on a Zeton Altramira AMI-300 unit. 100mg calcined sample was packed in a quartz reactor, flushed with argon at 393K for 1h and cooled to 323K. Subsequently, the sample was heated to 1173K (10K/min) in a flow of 10% H2/Ar mixture. The hydrogen consumption was detected by a thermal conductivity detector (TCD). Pulsed CO chemisorption experiments were carried out on the same equipment as TPR test. Calcined sample (100mg) was firstly in-situ reduced by 10% H2/Ar at 703K for 4h, purged with helium at the same temperature for 10min to remove adsorbed species from its surface and then cooled down to 323K. CO adsorption was carried out at 323K by means of pulse chemisorption with 10% CO/He until the TCD signal reached a constant value, signals of CO were detected by TCD. The dispersion is calculated by the formula below [33]. % dispersion = [ 1.175 × ( μ mol / g CO ) ] / [ ( % metal ) × ( reduction percentage ) ] CO-TPD experiments were carried out on a Zeton Altramira AMI-300 unit. 100mg of calcined sample was used for each test. The operations for CO adsorption were the same as the experiments of pulsed CO chemisorption. After the adsorption completed, the samples were purged with helium at 323K for 10min and heated to 1173K at a heating ramp rate of 10K/min under a helium flow at 30ml/min. The products of desorption experiments were simultaneously traced with an Omnistar 300 quadrupole mass spectrometer and TCD. The XPS tests were performed on Thermo Escalab250Xi instrument using X-ray source of Mg Kα with a power of 300W to measure the surface composition of the samples. The calcined powder samples were reduced by H2 (703K, 5h) in the quartz tube reactor, and then pressed onto the conductive double-tape attached to one sample holder in the glovebox. Finally, the sample holder was introduced into the measurement chamber for analysis. All spectra were corrected by referring the binding energy of the C1s neutral carbon peak at 284.6eV. The atomic surface compositions were calculated using the formula below [41]. n i n j = I i I j × σ j σ i × E k j 0.5 E k i 0.5 where, nx, Ekx, and σx are the number of atoms of element x, the kinetic energy value, and the cross-section calculated theoretically, respectively. I stand for the XPS line intensity. 2.3 Catalytic performance evaluation The performance tests were carried out in a stainless fixed-bed reactor (I.D., 9mm). Typically, 1.3g catalysts diluted by 3g quartz were packed in the reactor, in-situ reduced at 703K for 10h in a flow of H2 at atmospheric pressure. After the samples were cooled to 353K, the H2 flow was switched to syngas (H2/CO=2, GHSV=4L-syngas/g-cat.h), and the pressure was increased to 3.0MPa. Then, the furnace was heating to the reaction temperature in two stages, first from 353 to 473K, then to 493K with ramping rates of 2K/min and 0.1K/min, respectively. The reaction effluent passed through two traps for the collection of products, one maintained at 373K and the other at 273K. The moment when the reactor reached the desired temperature was taken as the starting time. The data were all taken after 44h of reaction, when a stationary activity had been reached. The tail gases were on-line analyzed by an Agilent 7890A GC with one packed column of Plot Q and TCD as a detector. The liquid organic products and the aqueous products were off-line analyzed on an Agilent 7890A GC with HP-5 capillary columns and FID as a detector. CO conversion and carbon selectivity were calculated by following formulas: X CO = F in , CO − F out , CO F in , CO × 100 S i = ( N i × n i ∑ ⁣ N i × n i ) × 100 where XCO stands for CO conversion, F indicates the molar flow, Si is the carbon selectivity toward a product i (including paraffin, olefin, CO2 and alcohol), Ni is the molar fraction of product i, ni is the carbon number of product i. 3 Results and discussion 3.1 Characterization The BET specific surface area (SBET ) and pore volume (Vtotal ) of the calcined catalysts as well as AC carrier are summarized in Table 1 . Compared with the AC support, the SBET of the 15Co/AC catalyst decreased by more than 20%, and a slight decrease in Vtotal was observed. The main reason for the loss of the SBET should be attributed to the “dilution effect” of the 15% cobalt incorporation [42]. Thus, it could be suggested that the pore blockage during the preparation procedures was another factor for the decrease in SBET [43]. The SBET and Vtotal of bimetallic catalysts are smaller than those of 15Co/AC due to the iron doping. The SBET of bimetallic catalysts decreased by larger than 30% compared to AC support, and the Vtotal also decreased by greater than 23%. However, the different preparation methods had little effect on the SBET and Vtotal of the bimetallic catalysts. The reducibility of monometallic cobalt and iron samples as well as bimetallic catalysts was assessed by H2-TPR experiments. The corresponding profiles are shown in Fig. 1 . Several hydrogen consumption peaks were observed in the TPR profiles of the catalysts. The TPR profile of 15Co/AC sample exhibited three major peaks of hydrogen consumption at 506K, 619K, and a broad one at 770K respectively. The low temperature peak at 506K could be attributed to the reduction of Co3O4 to CoO, while the peak at 619K was assigned to the subsequent reduction of CoO to Co [44]. The broad hydrogen consumption peak at 770K might be assigned to methanation of the AC support in the presence of metallic Co [45]. There are four major peaks of hydrogen consumption at 630K, 742K, 824K and a broad one at 865K for 15Fe/AC sample. The first three peaks could be assigned to the following consecutive reduction steps: α-Fe2O3 →Fe3O4 →FeO→Fe [31]. The fourth broad peak is related to the methanation of AC support, which is similar to the 15Co/AC catalyst. Especially, we studied the effect of iron doping with different methods on the reduction behaviors of catalysts. It can be seen that the reducibility of the bimetallic catalysts was similar to the 15Co/AC (Fig. 1). For all the samples, H2 consumption peaks attributed to the reductions of cobalt species as well as methanation of the AC support were detected. It was also observed that the cobalt species went through consecutive reduction consisting of Co3O4 →CoO→Co in bimetallic catalysts. Compared to Co/AC catalyst, the position of the reduction peak of Co3O4 to CoO and CoO to Co shifted to higher temperature for the 15Co5Fe/AC and 5Fe-15Co/AC catalysts, indicating that the iron doping suppressed the reduction of cobalt species. However, the reduction behavior of cobalt species in the 15Co-5Fe/AC sample was similar to the 15Co/AC. This result implied that the impregnation strategy of bimetallic CoFe/AC catalysts could influence the reduction of the cobalt species. The reduction degree of metal could be calculated based on the TPR profiles, which were summaried in Table 1. For 15Co/AC catalyst, the Co reduction degree reached 98.7%. In contrast, the metal reduction degree of the 15Co-5Fe/AC, 15Co5Fe/AC and 5Fe-15Co/AC catalysts were calculated to be 64.9%, 68.1% and 70.3%, respectively. This indicated that the reduction degree of Co and Fe was strongly reduced due to doping of Fe while showed little relationship with the impregnation strategy of catalysts. To access the phase transformation during the reduction in a H2 flow, in-situ XRD measurements were performed here. Fig. 2 shows in-situ XRD patterns of monometallic and bimetallic samples under reduction as a function of temperature. For the 15Co/AC sample, CoO was the dominant phase until 513K. The peak at 2θ=44.1° ascribed to fcc-Co (PDF No. 00-001-1259) was observed at reduction temperature of 533K. This suggested that the reduction of CoO into metallic Co started at about 513–533K. The peaks for CoO disappeared completely when the temperature was higher than 693K. The observation was consistent with the H2-TPR measurement. For the 15Fe/AC sample, Fe2O3 (2θ=24.1, 33.1, 35.6, 40.8, 49.4, 54.0, 57.5, 62.4 and 64.0°, PDF No. 00-024-0072) was the primary phase at low temperature (<513K). The reduction of Fe2O3 into Fe3O4 (2θ=30.0, 35.4, 37.1, 43.0, 53.5, 57.1 and 62.7°, PDF No. 01-075-0033) started at around 513–533K. Furthermore, the conversion of Fe3O4 to Fe (2θ=44.4 and 64.5°, PDF No. 01-085-1410) occurred at about 573–593K. In other words, the metallic iron phase could be obtained under the activation temperature used in this study (703K). The in-situ XRD patterns of bimetallic catalysts during reduction are also shown in Fig. 2(c–e). It is obvious that the Fe3O4 and CoO were predominant species in the bimetallic samples at low temperature. The peaks at 44.8 and 65.0° attributed to Co-Fe alloy (PDF No. 03-065-7519) were observed when the temperature was increased to 573K. This revealed that the iron doping suppressed the reduction of cobalt oxide species. The intensities of the peaks increased with the continuous increasing of temperature. The temperatures for the arising of Co-Fe alloy were similar for the all bimetallic catalysts (553–573K). This demonstrated that the methods for the doping of iron had a little effect on the reduction properties, which is in accordance with the results of the H2-TPR (Fig. 1 and Table 1). XRD patterns of the fresh monometallic catalysts are shown in Fig. 3 . Diffraction peak ascribed to fcc-Co (44.1°) was observed for the 15Co/AC catalyst. Besides, the peak at 36.8° attributed to cobalt oxide was also noticed. The cobalt oxide species might be produced during the passivation process. For the 15Fe/AC catalyst, diffraction peak at 44.4° was detected, which was ascribed to metallic Fe. The diffraction peak of Fe3O4 at 35.4° was also observed. Fig. 3 also shows the XRD patterns of the spent monometallic catalysts. The peaks attributed to fcc-Co, hcp-Co and Co2C species were detected in the spent 15Co/AC sample. In addition to the peaks of Fe3O4, characteristic peaks of Fe2C species at 39.3, 41.4 and 44.4°(PDF No. 00-003-1022) were observed in the pattern of the spent Fe/AC catalyst. The results revealed that the Co2C or Fe2C species formed during the progress of CO hydrogenation. Fig. 3 also shows the XRD patterns of the fresh and spent bimetallic catalysts prepared by different impregnation sequences. The peak at 2θ=44.8° assigned to Co-Fe alloy appeared in all of the fresh samples, but the diffraction peaks for metallic Co and Fe could not be detected. It might be because the peaks of Co and Fe species may overlap with those of the Co-Fe alloy. It could be concluded from Fig. 3 that the quantity of metallic cobalt sites in the 15Co-5Fe/AC sample was the maximum, while the 5Fe-15Co/AC catalyst had the fewest metallic cobalt sites. This result is in line with the quantitative XPS analysis results that are summarized in Table 1. As the report [39] uncovered that metallic cobalt sites showed higher activity of CO hydrogenation under the moderate conditions. Based on the above observation, it could be expected that the activity difference observed in our experiments were partly related to the available metallic cobalt sites of the catalysts. It could be seen from Fig. 3 that Co2C appeared in the spent catalysts. In addition, the XRD line width from Co-Fe alloy changed during the reaction. This suggested that the structure of the active sites changed during the CO hydrogenation reaction. This observation was in agreement with our previous results in which Co2C species was detected over the Ca or La promoted the Co/AC catalysts [14,25]. It is preferred that not only the dual active of metallic Co and Co2C but also the Co-Fe alloy may be responsible for the synthesis of alcohols in our catalysts. To see the role of the activated carbon used as support and the effect of the Co-Fe alloy as active sites on the synthesis of alcohols, the phase composition of the silica supported Co and CoFe catalysts were investigated. The XRD patterns of the used 15Co/SiO2 and 15Co5Fe/SiO2 catalysts are shown in Fig. 4 . The peak at 2θ=44.8° assigned to Co-Fe alloy was observed over the spent 15Co5Fe/SiO2 catalyst. Besides, fcc Co was observed both in the spent 15Co/SiO2 and 15Co5Fe/SiO2 catalysts. This suggested that the Co-Fe alloy was partly related to the alcohol formation. Based on the results of Table 2 , it could be seen that the activated carbon support was more suitable for the alcohol synthesis compared to SiO2. According to Wang et al. [46], the activated carbon facilitated the formation of Co2C species, while Al2O3 restricted it. And Pei et al. reported that the excess addition of SiO2 to Co/AC catalyst inhibited the Co2C formation [26]. Thus, the lower selectivity to alcohols over the Co/SiO2 catalyst was attributed to the inhibiting effect of SiO2 on the formation of Co2C. The crystalline structure of Co2C in the bimetallic catalysts was further confirmed by HRTEM measurements. Fig. 5 (a–c) display the HRTEM micrographs of the used 15Co-5Fe/AC, 15Co5Fe/AC and 5Fe-15Co/AC catalysts, respectively. The 15Co-5Fe/AC sample (Fig. 5a) showed the characteristic spacing of 2.39Å and 3.18Å as well as the angle of 70° between two lattice spacings for the Co2C (011) and Co2C (110) planes and their corresponding angle (according to PDF 01-072-1369). The particle with a measured lattice spacing of 2.03Å was assigned to (111) plane of fcc-Co in the image. Co2C (020) and Co2C (002) planes and the corresponding angle were observed in the spent 15Co5Fe/AC sample in Fig. 5b. Characteristic planes of Co2C (011) and Co2C (110) as well as their angle were detected in the used 5Fe-15Co/AC sample in Fig. 5c. These observations confirmed that the Co2C species were formed in the bimetallic catalysts during the CO hydrogenation, as shown by XRD results previously. Based on the previous investigations of our group [14,25–27] and other researchers [46,47] as well as the result of this work, the formation of Co2C during the reaction seems to be pivotal for the synthesis of alcohols over the activated carbon supported bimetallic catalysts. CO uptakes and metal dispersion of the catalysts are exhibited in Table 1. It is obvious that 15Co-5Fe/AC sample shows the maximum CO uptake as well as dispersion degree compared to the 15Co5Fe/AC and 5Fe-15Co/AC catalysts. This suggested that the 15Co-5Fe/AC catalyst had the largest quantity of surface active sites, which reinforced by the XPS analysis. Detailed XPS analysis in the region of Co 2p and Fe 2p is given in Fig. 6 , respectively. It could be seen that catalysts containing cobalt are characterized by Co 2p3/2 peaks at 780.7eV and Co 2p1/2 peaks at 796.3eV. Satellite peaks for Co 2p3/2 and Co 2p1/2 were also observed at 786.3 and 802.9eV respectively. These observations suggested that cobalt was present on catalyst surface as CoO [48]. Peaks for Fe 2p3/2 and Fe 2p1/2 were detected at 711.1 and 724.6eV respectively. These indicated that the surface iron was presented as Fe2O3 [49] . The oxide species appeared due to the sample transfer process, during which the sample probably contacted with air. Based on the XPS analysis, the content of Co on the surface decreased in the order of 15Co-5Fe/AC>15Co5Fe/AC>5Fe-15Co/AC, whereas the Fe content increased. As shown in Table 2, the 15Co/AC catalyst was more active than the 15Fe/AC catalyst under the present conditions. This demonstrated that the catalyst with more cobalt sites would be more active for CO hydrogenation. As we know, CO hydrogenation is favored by high metal dispersion and overall active sites [50]. Thus, the 15Co-5Fe/AC catalyst had the highest Co dispersion and the abundant Co active sites, which led to the highest catalytic activity among these CoFe bimetallic catalysts. CO-TPD was used to investigate the effect of impregnation strategy on the CO adsorption behavior of the CoFe bimetallic catalysts, as presented in Fig. 7 . Five CO desorption peaks were observed in each TPD profile. The desorption peak of CO at about 400K is due to desorption of CO adsorbed on Co2+ sites [51]. The peak appeared in high temperature at around 1100K might be assigned to the decomposition of organic species on surface of activated carbon [52]. The peak at 700K was ascribed to desorption of a weakly adsorbed CO, while the other two peaks situated between 800K and 1000K would arise from a strongly adsorbed CO [53,54]. It was found that using different impregnation strategy did not obviously impact on the position of desorption temperature of CO, indicating that the ability of the CoFe bimetallic catalysts for activation of CO was not influenced by the impregnation sequences. However, the areas of the desorption peaks, especially for the peak areas of the strong adsorbed CO sites, varied much with the different impregnation sequences. As we know, only strongly adsorbed CO species on Co sites was dissociative adsorption and further could be hydrogenated in F-T reaction. The amount of the CO capacity strongly adsorbed increased in the order of 5Fe-15Co/AC<15Co5Fe/AC<15Co-5Fe/AC. This means that the 15Co-5Fe/AC catalyst prepared by sequential impregnation with Fe precursor firstly and then Co precursor has the most of the quantity of the active sites for CO hydrogenation. On the basis of the above observations, it can be concluded that the activity of bimetallic catalysts are partly based on the quantity of cobalt sites for strongly adsorbed CO. 3.2 The performance of CO hydrogenation The results of F-T reaction are listed in Table 2. Both of the 15Co/AC and 15Fe/AC catalysts produced simultaneously hydrocarbons and alcohols, and the alcohols selectivity is around 17%. The selectivities to alcohols are 17.5% and 1.8% for 15Co/AC catalyst and 15Co/SiO2 catalyst, respectively. The lower selectivity to alcohols for 15Co/SiO2 catalyst is in accord with the results of studies using inorganic oxide supported monometallic cobalt catalyst with poor selectivity towards alcohols [30–32]. Whereas, it has been reported by Matsuzaki et al. that SiO2 supported cobalt catalyst is active for the alcohols formation [55–57]. They claimed that the alcohols formation was attributed to the highly dispersed metallic cobalt sites and corresponding bridged-CO species. However, the alcohols formation over the Co/AC catalyst is related to the promotion effect on the development of Co2C species from activated carbon. The formation of Co2C species and the intimate contact between Co2C species and Co sites was responsible for the alcohols synthesis [27]. The high selectivity towards alcohols of 15Fe/AC catalyst might result from the difficult dissociation of CO on the iron clusters. This implied that iron addition into cobalt catalysts might be beneficial for the alcohols synthesis. The performances of CO hydrogenation over the bimetallic catalysts are also presented in Table 2. Under the moderate reaction conditions, hydrocarbons, CO2 and alcohols were produced via F-T synthesis. It was found that the CO conversion decreased in the order of the 15Co-5Fe/AC>15Co5Fe/AC>5Fe-15Co/AC. The CO conversion of the 15Co-5Fe/AC catalyst is as high as 30.9%, which is nearly twice of the 15Co5Fe/AC and 5Fe-15CO/AC catalysts. Based on the results of the previous characterization, it was observed that different impregnation sequence modified the structure of the catalysts and resulted in the variety of CO adsorption capacity, reduction property and the quantity of the Co active sites on the surface of the bimetallic CoFe/AC catalysts, thus leading to the catalytic activity. The selectivity to alcohols of the activated carbon supported CoFe bimetallic catalysts were higher than that of the activated carbon supported Co-based or Fe-based monometallic catalysts, indicating that there were synergistic effect between Co and Fe species. According to the results of XRD, it might originate from the formation of Co-Fe alloy, confirmed by XRD measurements of the spent bimetallic catalysts, which was favorable to the synthesis of alcohols. However, it was observed that the selectivity towards alcohols was hardly affected by the impregnation sequence. It was also found that the iron doping into the silica supported cobalt catalyst led to the increase of the alcohols selectivity from 1.8 to 7.0%, but it was still far lower than that of the 15Co5Fe/AC catalyst (around 20%). It can be suggested that the iron doping on the 15Co/SiO2 catalysts favored the formation of Co-Fe alloy, which promoted the production of alcohols. This is in accord with the results reported by O’shea et al. [30], Dalai et al. [31] and Silva et al. [32]. Therefore, the existence of Co-Fe alloy was partly responsible for the alcohols synthesis for CoFe bimetallic catalysts. However, the relatively lower alcohols selectivity of SiO2 supported catalysts compared to the activated carbon supported catalysts mainly resulted from the absence of Co2C species. In combination with the previous phase analysis of the catalysts, it was deduced that the activated carbon promoted the formation of Co2C, while the silica suppressed the formation of Co2C. This deduction is in accordance with the result of Wang’s work [46]. They found that the doping with La onto activated carbon supported Co catalyst promoted the Co2C phase formation, whereas it is largely suppressed on alumina supported Co catalyst. And our previous research proved that the introduction of relatively abundant amount of silica into activated carbon supported cobalt catalyst significantly inhibited the formation of Co2C [26]. Based on the above analysis, the activated carbon promoted the Co2C development and thus facilitated the production of alcohols. Thus, it can be suggested that the alcohols synthesis with bimetallic catalysts under the test conditions is the combined catalytic action of Co/Co2C and Co-Fe alloy species. As shown in Table 2, the product selectivity of the AC supported monometallic Co, Fe and bimetallic CoFe catalysts were compared at a similar CO conversion level ((28±4)%). It could be observed that the selectivity of alcohol and hydrocarbon was almost the same under conditions of the different GHSV for each catalyst, indicating that the selectivity was not obviously influenced by CO conversion ranged from 10 to 30%. Table 2 also shows the alcohols distributions of the monometallic and bimetallic catalysts. The main alcohols products for all of the catalysts contained linear alcohols fell in the range of C1 to C18, which was same as our previous results [14,25], but was different from the conclusion of other groups’ reports [30–32] with the C1 to C5 alcohols as products. In the case of the bimetallic CoFe/AC catalysts, the fraction of C2-C5 alcohols reached ca. 60%. The product distribution and yields varied with the variation of the preparation method. The distributions of the liquid phase products, made up of fuels (C5+ hydrocarbons) and alcohols (methanol and C2+ alcohols) are given in Fig. 8 . It was found that alcohol fraction in the liquid phase product is up to around 65% over the bimetallic catalysts. In other words, nearly two-thirds of the liquid products are alcohols over the bimetallic catalysts. 4 Conclusions The activity, selectivity and product distributions of the bimetallic CoFe/AC catalysts were found to depend strongly on the impregnation strategy of the catalysts. The results showed that the linear alcohols (C1-C18OH) together with fuels can be directly synthesized from syngas over the bimetallic CoFe/AC catalysts under mild conditions, and the alcohols fraction in the liquid phase products reached up to 65%. The 15Co-5Fe/AC catalyst prepared with impregnation of Fe precursor firstly and then Co precursor exhibited the highest activity, which is attributed to the highest CO uptake and dispersion as well as the maximum content of cobalt active sites on the surface of the catalyst. The Co-Fe alloy was observed in the CoFe bimetallic catalysts. The activated carbon acted as a key factor in facilitating the formation of Co2C species and thus promoting higher alcohols synthesis in CO hydrogenation. Higher alcohol synthesis via CO hydrogenation over the activated carbon supported CoFe bimetallic catalysts is associated with the combined catalytic action of synergistic effect of Co with Co2C and Co with Fe species. Acknowledgements We greatly appreciate the financial support by the Young Scientist Fund of NSFC (21503218), the Strategic Priority Research Program of the Chinese Academy of Sciences (Grant No XDB17020400) and DICP DMTO201306 (Grant No DICP DMTO201306). References [1] K. Fang D. Li M. Lin M. Xiang W. Wei Y. Sun Catal. Today 147 2009 133 138 [2] M. Gupta M.L. Smith J.J. Spivey ACS Catal. 1 2011 641 656 [3] V.R. Surisetty A.K. Dalai J. Kozinski Appl. Catal. A: Gen. 404 2011 1 11 [4] Y. Xiang V. Chitry P. Liddicoat P. Felfer J. Cairney S. Ringer N. Kruse J. Am. Chem. Soc. 135 2013 7114 7117 [5] I. Wender H.W. Sternberg M. Orchin J. Am. Chem. Soc. 75 1953 3041 3042 [6] G.D. Frey J. Organomet. Chem. 754 2014 5 7 [7] M.K. Gnanamani G. Jacobs U.M. Graham M.C. Ribeiro F.B. Noronha W.D. Shafer B.H. Davis Catal. Today 261 2016 40 47 [8] G. Prieto S. Beijer M.L. Smith M. He Y. Au Z. Wang D.A. Bruce K.P. de Jong J.J. Spivey P.E. de Jongh Angew. Chem. Int. Ed. 53 2014 6397 6401 [9] T. Ishida T. Yanagihara X. Liu H. Ohashi A. Hamasaki T. Honma H. Oji T. Yokoyama M. Tokunaga Appl. Catal. A: Gen. 458 2013 145 154 [10] S. Zaman K.J. Smith Catal. Rev. 54 2012 41 132 [11] Y. Liu C. Liu X. Deng W. Huang RSC Adv. 5 2015 99023 99027 [12] J. Anton J. Nebel H. Song C. Froese P. Weide H. Ruland M. Muhler S. Kaluza J. Catal. 335 2016 175 186 [13] J.M. Christensen P.M. Mortensen R. Trane P.A. Jensen A.D. Jensen Appl. Catal. A: Gen. 366 2009 29 43 [14] H. Du H. Zhu X. Chen W. Dong W. Lu W. Luo M. Jiang T. Liu Y. Ding Fuel 182 2016 42 49 [15] K. Kharas, U.S. Patent 8, 586, 801 B2, 2013. [16] K. Kharas, W.A. May, U.S. Patent 8, 354, 357 B2, 2013. [17] K. Kharas, J.P. Durand, U.S. Patent 8, 399, 715 B2, 2013. [18] K. Kharas, J.P. Durand, W.A. May, U.S. Patent 8, 383, 691 B2, 2013. [19] K. Kharas, U.S. Patent 9, 146, 220 B2, 2015. [20] Z. Pan M. Parvari D.B. Bukur Top. Catal. 57 2013 470 478 [21] J. Cheng P. Hu P. Ellis S. French G. Kelly C.M. Lok J. Phys. Chem. C 114 2010 1085 1093 [22] G.G. Volkova T.M. Yurieva L.M. Plyasova M.I. Naumova V.I. Zaikovskii J. Mol. Catal. A: Chem. 158 2000 389 393 [23] Y.Z. Fang Y. Liu L.H. Zhang Appl. Catal. A: Gen. 397 2011 183 191 [24] G. Liu T. Niu D. Pan F. Liu Y. Liu Appl. Catal. A: Gen. 483 2014 10 18 [25] G. Jiao Y. Ding H. Zhu X. Li J. Li R. Lin W. Dong L. Gong Y. Pei Y. Lu Appl. Catal. A: Gen. 364 2009 137 142 [26] Y. Pei Y. Ding H. Zhu H. Du Chin. J. Catal. 36 2015 355 361 [27] Y. Pei J. Liu Y. Zhao Y. Ding T. Liu W. Dong H. Zhu H. Su L. Yan J. Li W. Li ACS Catal. 5 2015 3620 3624 [28] A. Nakhaei Pour S.M.K. Shahri H.R. Bozorgzadeh Y. Zamani A. Tavasoli M.A. Marvast Appl. Catal. A: Gen. 348 2008 201 208 [29] J. Li C. Zhang X. Cheng M. Qing J. Xu B. Wu Y. Yang Y. Li Appl. Catal. A: Gen. 464–465 2013 10 19 [30] V.A.d.l.P.a. O’shea N.N. Menéndez J.D. Tornero J.L.G. Fierro Catal. Lett. 88 2003 123 128 [31] A. Tavasoli M. Trépanier R.M. Malek Abbaslou A.K. Dalai N. Abatzoglou Fuel Process. Technol. 90 2009 1486 1494 [32] L.F.F.P.G. Bragança M. Ojeda J.L.G. Fierro M.I.P. da Silva Appl. Catal. A: Gen. 423–424 2012 146 153 [33] D.J. Duvenhage N.J. Coville Appl. Catal. A: Gen. 153 1997 43 67 [34] S. Lögdberg D. Tristantini Ø. Borg L. Ilver B. Gevert S. Järås E.A. Blekkan A. Holmen Appl. Catal. B: Environ. 89 2009 167 182 [35] X. Ma Q. Sun W. Ying D. Fang J. Nat. Gas Chem. 18 2009 232 236 [36] S. Ali N.A. Mohd Zabidi D. Subbarao Chem. Cent. J. 5 2011 68 [37] T. Das G. Deo J. Phys. Chem. C 116 2012 20812 20819 [38] L. Wang Y. Hisada M. Koike D. Li H. Watanabe Y. Nakagawa K. Tomishige Appl. Catal. B: Environ. 121–122 2012 95 104 [39] A. Griboval-Constant A. Butel V.V. Ordomsky P.A. Chernavskii A.Y. Khodakov Appl. Catal. A: Gen. 481 2014 116 126 [40] M.W. Dlamini D.O. Kumi T.N. Phaahlamohlaka A.S. Lyadov D.G. Billing L.L. Jewell N.J. Coville ChemCatChem 7 2015 3000 3011 [41] Yves Boudeville François Figueras Michel Forissier Jean-Louis Portefaix J.C. Vedrine J. Catal. 58 1979 52 60 [42] A.Y. Khodakov A. Griboval-Constant R. Bechara V.L. Zholobenko J. Catal. 206 2002 230 241 [43] W. Ma E.L. Kugler D.B. Dadyburjor Energy Fuels 24 2010 4099 4110 [44] T. Fu J. Lv Z. Li Ind. Eng. Chem. Res. 53 2014 1342 1350 [45] L. Chen G. Song Y. Fu J. Shen J. Colloid Interface Sci. 368 2012 456 461 [46] V.M. Lebarbier D. Mei D.H. Kim A. Andersen J.L. Male J.E. Holladay R. Rousseau Y. Wang J. Phys. Chem. C 115 2011 17440 17451 [47] Z. Lv H. Tang C. Liu H. Liu Chin. J. Catal. 32 2014 1250 1255 [48] K. Jalama Catal. Commun. 74 2016 71 74 [49] N. Qin Y. Zhang H. Zhou Z. Geng G. Liu Y. Zhang H. Zhao G. Wang J. Colloid Interface Sci. 472 2016 8 15 [50] A.Y. Khodakov W. Chu P. Fondarland Chem. Rev. 107 2007 1692 1744 [51] L.G. Tejuca A.T. Bell J.L.G. Fierro M.A. Pena Appl. Surf. Sci. 31 1988 301 316 [52] T. Wang Y. Ding J. Xiong L. Yan H. Zhu Y. Lu L. Lin Catal. Lett. 107 2006 47 52 [53] O. Cortes Serciodroguet J. Catal. 38 1975 477 481 [54] Y. Pei Y. Ding J. Zang X. Song W. Dong H. Zhu T. Wang W. Chen Chin. J. Catal. 33 2013 808 812 [55] T. Matsuzaki K. Takeuchi Taka-aki Hanaoka H. Arawaka Y. Sugi Appl. Catal. A: Gen. 105 1993 159 184 [56] T. Matsuzaki T.-a. Hanaoka K. Takeuchi H. Arakawa Y. Sugi K. Wei T. Dong M. Reinikainen Catal. Today 36 1997 311 324 [57] T. Matsuzaki K. Takeuchi T. Hanaoka H. Arakawa Y. Sugi Catal. Today 28 1996 251 259",
      "scopus-id": "84976288686",
      "coredata": {
        "eid": "1-s2.0-S0926860X16303362",
        "dc:description": "Higher alcohols synthesis from syngas via Fischer-Tropsch reaction has been studied on activated carbon supported bimetallic CoFe (denoted as CoFe/AC) catalysts. The effect of impregnation strategy on the structure and performance of the catalysts was investigated by means of N2 adsorption, HRTEM, ex-situ/in-situ XRD, CO adsorption, CO-TPD, XPS and CO hydrogenation. The results showed that the sequentially impregnated 15Co-5Fe/AC catalyst prepared with iron precursor firstly and then cobalt precursor had the highest CO uptake, metal dispersion and the maximum cobalt surface content, resulting in the enhancement of CO hydrogenation activity as well as the yield of mixed alcohols. On the other hand, the selectivity towards higher alcohols (C2+) was hardly affected by the impregnation sequence. It was found that the activated carbon facilitated the formation of Co2C species and doping of Fe into the 15Co/AC catalyst promoted the formation of Co-Fe alloy species. Both of Co2C and Co-Fe alloy species were observed in all the co-impregnated and sequentially impregnated catalysts after reaction. It was inferred that Co/Co2C as well as Co-Fe alloy species might be responsible for the synthesis of alcohols via CO hydrogenation.",
        "openArchiveArticle": "false",
        "prism:coverDate": "2016-08-05",
        "openaccessUserLicense": null,
        "prism:aggregationType": "Journal",
        "prism:url": "https://api.elsevier.com/content/article/pii/S0926860X16303362",
        "dc:creator": [
          {
            "@_fa": "true",
            "$": "Du, Hong"
          },
          {
            "@_fa": "true",
            "$": "Zhu, Hejun"
          },
          {
            "@_fa": "true",
            "$": "Zhao, Ziang"
          },
          {
            "@_fa": "true",
            "$": "Dong, Wenda"
          },
          {
            "@_fa": "true",
            "$": "Luo, Wenting"
          },
          {
            "@_fa": "true",
            "$": "Lu, Wei"
          },
          {
            "@_fa": "true",
            "$": "Jiang, Miao"
          },
          {
            "@_fa": "true",
            "$": "Liu, Tao"
          },
          {
            "@_fa": "true",
            "$": "Ding, Yunjie"
          }
        ],
        "link": [
          {
            "@_fa": "true",
            "@rel": "self",
            "@href": "https://api.elsevier.com/content/article/pii/S0926860X16303362"
          },
          {
            "@_fa": "true",
            "@rel": "scidir",
            "@href": "https://www.sciencedirect.com/science/article/pii/S0926860X16303362"
          }
        ],
        "dc:format": "application/json",
        "openaccessType": null,
        "pii": "S0926-860X(16)30336-2",
        "prism:volume": "523",
        "prism:publisher": "Elsevier B.V.",
        "dc:title": "Effects of impregnation strategy on structure and performance of bimetallic CoFe/AC catalysts for higher alcohols synthesis from syngas",
        "prism:copyright": "© 2016 Elsevier B.V. All rights reserved.",
        "openaccess": "0",
        "prism:issn": "0926860X",
        "dcterms:subject": [
          {
            "@_fa": "true",
            "$": "Higher alcohols synthesis"
          },
          {
            "@_fa": "true",
            "$": "Bimetallic catalysts"
          },
          {
            "@_fa": "true",
            "$": "Impregnation strategy"
          },
          {
            "@_fa": "true",
            "$": "Cobalt"
          },
          {
            "@_fa": "true",
            "$": "Iron"
          },
          {
            "@_fa": "true",
            "$": "Activated carbon"
          }
        ],
        "openaccessArticle": "false",
        "prism:publicationName": "Applied Catalysis A: General",
        "openaccessSponsorType": null,
        "prism:pageRange": "263-271",
        "prism:endingPage": "271",
        "pubType": "fla",
        "prism:coverDisplayDate": "5 August 2016",
        "prism:doi": "10.1016/j.apcata.2016.06.022",
        "prism:startingPage": "263",
        "dc:identifier": "doi:10.1016/j.apcata.2016.06.022",
        "openaccessSponsorName": null
      },
      "objects": {
        "object": [
          {
            "@category": "thumbnail",
            "@height": "88",
            "@width": "219",
            "@_fa": "true",
            "$": "https://api.elsevier.com/content/object/eid/1-s2.0-S0926860X16303362-fx1.sml?httpAccept=%2A%2F%2A",
            "@multimediatype": "GIF image file",
            "@type": "IMAGE-THUMBNAIL",
            "@size": "4434",
            "@ref": "fx1",
            "@mimetype": "image/gif"
          },
          {
            "@category": "thumbnail",
            "@height": "164",
            "@width": "213",
            "@_fa": "true",
            "$": "https://api.elsevier.com/content/object/eid/1-s2.0-S0926860X16303362-gr1.sml?httpAccept=%2A%2F%2A",
            "@multimediatype": "GIF image file",
            "@type": "IMAGE-THUMBNAIL",
            "@size": "6225",
            "@ref": "gr1",
            "@mimetype": "image/gif"
          },
          {
            "@category": "thumbnail",
            "@height": "162",
            "@width": "39",
            "@_fa": "true",
            "$": "https://api.elsevier.com/content/object/eid/1-s2.0-S0926860X16303362-gr2.sml?httpAccept=%2A%2F%2A",
            "@multimediatype": "GIF image file",
            "@type": "IMAGE-THUMBNAIL",
            "@size": "4538",
            "@ref": "gr2",
            "@mimetype": "image/gif"
          },
          {
            "@category": "thumbnail",
            "@height": "164",
            "@width": "105",
            "@_fa": "true",
            "$": "https://api.elsevier.com/content/object/eid/1-s2.0-S0926860X16303362-gr3.sml?httpAccept=%2A%2F%2A",
            "@multimediatype": "GIF image file",
            "@type": "IMAGE-THUMBNAIL",
            "@size": "5957",
            "@ref": "gr3",
            "@mimetype": "image/gif"
          },
          {
            "@category": "thumbnail",
            "@height": "164",
            "@width": "213",
            "@_fa": "true",
            "$": "https://api.elsevier.com/content/object/eid/1-s2.0-S0926860X16303362-gr4.sml?httpAccept=%2A%2F%2A",
            "@multimediatype": "GIF image file",
            "@type": "IMAGE-THUMBNAIL",
            "@size": "7221",
            "@ref": "gr4",
            "@mimetype": "image/gif"
          },
          {
            "@category": "thumbnail",
            "@height": "164",
            "@width": "164",
            "@_fa": "true",
            "$": "https://api.elsevier.com/content/object/eid/1-s2.0-S0926860X16303362-gr5.sml?httpAccept=%2A%2F%2A",
            "@multimediatype": "GIF image file",
            "@type": "IMAGE-THUMBNAIL",
            "@size": "15414",
            "@ref": "gr5",
            "@mimetype": "image/gif"
          },
          {
            "@category": "thumbnail",
            "@height": "164",
            "@width": "104",
            "@_fa": "true",
            "$": "https://api.elsevier.com/content/object/eid/1-s2.0-S0926860X16303362-gr6.sml?httpAccept=%2A%2F%2A",
            "@multimediatype": "GIF image file",
            "@type": "IMAGE-THUMBNAIL",
            "@size": "5532",
            "@ref": "gr6",
            "@mimetype": "image/gif"
          },
          {
            "@category": "thumbnail",
            "@height": "164",
            "@width": "208",
            "@_fa": "true",
            "$": "https://api.elsevier.com/content/object/eid/1-s2.0-S0926860X16303362-gr7.sml?httpAccept=%2A%2F%2A",
            "@multimediatype": "GIF image file",
            "@type": "IMAGE-THUMBNAIL",
            "@size": "4930",
            "@ref": "gr7",
            "@mimetype": "image/gif"
          },
          {
            "@category": "thumbnail",
            "@height": "164",
            "@width": "181",
            "@_fa": "true",
            "$": "https://api.elsevier.com/content/object/eid/1-s2.0-S0926860X16303362-gr8.sml?httpAccept=%2A%2F%2A",
            "@multimediatype": "GIF image file",
            "@type": "IMAGE-THUMBNAIL",
            "@size": "5878",
            "@ref": "gr8",
            "@mimetype": "image/gif"
          },
          {
            "@category": "standard",
            "@height": "200",
            "@width": "500",
            "@_fa": "true",
            "$": "https://api.elsevier.com/content/object/eid/1-s2.0-S0926860X16303362-fx1.jpg?httpAccept=%2A%2F%2A",
            "@multimediatype": "JPEG image file",
            "@type": "IMAGE-DOWNSAMPLED",
            "@size": "18114",
            "@ref": "fx1",
            "@mimetype": "image/jpeg"
          },
          {
            "@category": "standard",
            "@height": "290",
            "@width": "376",
            "@_fa": "true",
            "$": "https://api.elsevier.com/content/object/eid/1-s2.0-S0926860X16303362-gr1.jpg?httpAccept=%2A%2F%2A",
            "@multimediatype": "JPEG image file",
            "@type": "IMAGE-DOWNSAMPLED",
            "@size": "23509",
            "@ref": "gr1",
            "@mimetype": "image/jpeg"
          },
          {
            "@category": "standard",
            "@height": "977",
            "@width": "235",
            "@_fa": "true",
            "$": "https://api.elsevier.com/content/object/eid/1-s2.0-S0926860X16303362-gr2.jpg?httpAccept=%2A%2F%2A",
            "@multimediatype": "JPEG image file",
            "@type": "IMAGE-DOWNSAMPLED",
            "@size": "95429",
            "@ref": "gr2",
            "@mimetype": "image/jpeg"
          },
          {
            "@category": "standard",
            "@height": "586",
            "@width": "376",
            "@_fa": "true",
            "$": "https://api.elsevier.com/content/object/eid/1-s2.0-S0926860X16303362-gr3.jpg?httpAccept=%2A%2F%2A",
            "@multimediatype": "JPEG image file",
            "@type": "IMAGE-DOWNSAMPLED",
            "@size": "57901",
            "@ref": "gr3",
            "@mimetype": "image/jpeg"
          },
          {
            "@category": "standard",
            "@height": "290",
            "@width": "376",
            "@_fa": "true",
            "$": "https://api.elsevier.com/content/object/eid/1-s2.0-S0926860X16303362-gr4.jpg?httpAccept=%2A%2F%2A",
            "@multimediatype": "JPEG image file",
            "@type": "IMAGE-DOWNSAMPLED",
            "@size": "21127",
            "@ref": "gr4",
            "@mimetype": "image/jpeg"
          },
          {
            "@category": "standard",
            "@height": "565",
            "@width": "565",
            "@_fa": "true",
            "$": "https://api.elsevier.com/content/object/eid/1-s2.0-S0926860X16303362-gr5.jpg?httpAccept=%2A%2F%2A",
            "@multimediatype": "JPEG image file",
            "@type": "IMAGE-DOWNSAMPLED",
            "@size": "114950",
            "@ref": "gr5",
            "@mimetype": "image/jpeg"
          },
          {
            "@category": "standard",
            "@height": "594",
            "@width": "376",
            "@_fa": "true",
            "$": "https://api.elsevier.com/content/object/eid/1-s2.0-S0926860X16303362-gr6.jpg?httpAccept=%2A%2F%2A",
            "@multimediatype": "JPEG image file",
            "@type": "IMAGE-DOWNSAMPLED",
            "@size": "47441",
            "@ref": "gr6",
            "@mimetype": "image/jpeg"
          },
          {
            "@category": "standard",
            "@height": "296",
            "@width": "376",
            "@_fa": "true",
            "$": "https://api.elsevier.com/content/object/eid/1-s2.0-S0926860X16303362-gr7.jpg?httpAccept=%2A%2F%2A",
            "@multimediatype": "JPEG image file",
            "@type": "IMAGE-DOWNSAMPLED",
            "@size": "18306",
            "@ref": "gr7",
            "@mimetype": "image/jpeg"
          },
          {
            "@category": "standard",
            "@height": "340",
            "@width": "376",
            "@_fa": "true",
            "$": "https://api.elsevier.com/content/object/eid/1-s2.0-S0926860X16303362-gr8.jpg?httpAccept=%2A%2F%2A",
            "@multimediatype": "JPEG image file",
            "@type": "IMAGE-DOWNSAMPLED",
            "@size": "24693",
            "@ref": "gr8",
            "@mimetype": "image/jpeg"
          },
          {
            "@category": "high",
            "@height": "886",
            "@width": "2213",
            "@_fa": "true",
            "$": "https://api.elsevier.com/content/object/eid/1-s2.0-S0926860X16303362-fx1_lrg.jpg?httpAccept=%2A%2F%2A",
            "@multimediatype": "JPEG image file",
            "@type": "IMAGE-HIGH-RES",
            "@size": "184376",
            "@ref": "fx1",
            "@mimetype": "image/jpeg"
          },
          {
            "@category": "high",
            "@height": "1285",
            "@width": "1667",
            "@_fa": "true",
            "$": "https://api.elsevier.com/content/object/eid/1-s2.0-S0926860X16303362-gr1_lrg.jpg?httpAccept=%2A%2F%2A",
            "@multimediatype": "JPEG image file",
            "@type": "IMAGE-HIGH-RES",
            "@size": "187060",
            "@ref": "gr1",
            "@mimetype": "image/jpeg"
          },
          {
            "@category": "high",
            "@height": "4333",
            "@width": "1042",
            "@_fa": "true",
            "$": "https://api.elsevier.com/content/object/eid/1-s2.0-S0926860X16303362-gr2_lrg.jpg?httpAccept=%2A%2F%2A",
            "@multimediatype": "JPEG image file",
            "@type": "IMAGE-HIGH-RES",
            "@size": "948649",
            "@ref": "gr2",
            "@mimetype": "image/jpeg"
          },
          {
            "@category": "high",
            "@height": "2597",
            "@width": "1667",
            "@_fa": "true",
            "$": "https://api.elsevier.com/content/object/eid/1-s2.0-S0926860X16303362-gr3_lrg.jpg?httpAccept=%2A%2F%2A",
            "@multimediatype": "JPEG image file",
            "@type": "IMAGE-HIGH-RES",
            "@size": "503818",
            "@ref": "gr3",
            "@mimetype": "image/jpeg"
          },
          {
            "@category": "high",
            "@height": "1285",
            "@width": "1667",
            "@_fa": "true",
            "$": "https://api.elsevier.com/content/object/eid/1-s2.0-S0926860X16303362-gr4_lrg.jpg?httpAccept=%2A%2F%2A",
            "@multimediatype": "JPEG image file",
            "@type": "IMAGE-HIGH-RES",
            "@size": "183661",
            "@ref": "gr4",
            "@mimetype": "image/jpeg"
          },
          {
            "@category": "high",
            "@height": "2500",
            "@width": "2500",
            "@_fa": "true",
            "$": "https://api.elsevier.com/content/object/eid/1-s2.0-S0926860X16303362-gr5_lrg.jpg?httpAccept=%2A%2F%2A",
            "@multimediatype": "JPEG image file",
            "@type": "IMAGE-HIGH-RES",
            "@size": "1126309",
            "@ref": "gr5",
            "@mimetype": "image/jpeg"
          },
          {
            "@category": "high",
            "@height": "2632",
            "@width": "1667",
            "@_fa": "true",
            "$": "https://api.elsevier.com/content/object/eid/1-s2.0-S0926860X16303362-gr6_lrg.jpg?httpAccept=%2A%2F%2A",
            "@multimediatype": "JPEG image file",
            "@type": "IMAGE-HIGH-RES",
            "@size": "432526",
            "@ref": "gr6",
            "@mimetype": "image/jpeg"
          },
          {
            "@category": "high",
            "@height": "1313",
            "@width": "1667",
            "@_fa": "true",
            "$": "https://api.elsevier.com/content/object/eid/1-s2.0-S0926860X16303362-gr7_lrg.jpg?httpAccept=%2A%2F%2A",
            "@multimediatype": "JPEG image file",
            "@type": "IMAGE-HIGH-RES",
            "@size": "145367",
            "@ref": "gr7",
            "@mimetype": "image/jpeg"
          },
          {
            "@category": "high",
            "@height": "1507",
            "@width": "1667",
            "@_fa": "true",
            "$": "https://api.elsevier.com/content/object/eid/1-s2.0-S0926860X16303362-gr8_lrg.jpg?httpAccept=%2A%2F%2A",
            "@multimediatype": "JPEG image file",
            "@type": "IMAGE-HIGH-RES",
            "@size": "162651",
            "@ref": "gr8",
            "@mimetype": "image/jpeg"
          },
          {
            "@category": "thumbnail",
            "@height": "48",
            "@width": "130",
            "@_fa": "true",
            "$": "https://api.elsevier.com/content/object/eid/1-s2.0-S0926860X16303362-si1.gif?httpAccept=%2A%2F%2A",
            "@multimediatype": "GIF image file",
            "@type": "ALTIMG",
            "@size": "799",
            "@ref": "si1",
            "@mimetype": "image/gif"
          },
          {
            "@category": "thumbnail",
            "@height": "46",
            "@width": "275",
            "@_fa": "true",
            "$": "https://api.elsevier.com/content/object/eid/1-s2.0-S0926860X16303362-si2.gif?httpAccept=%2A%2F%2A",
            "@multimediatype": "GIF image file",
            "@type": "ALTIMG",
            "@size": "1957",
            "@ref": "si2",
            "@mimetype": "image/gif"
          },
          {
            "@category": "thumbnail",
            "@height": "35",
            "@width": "187",
            "@_fa": "true",
            "$": "https://api.elsevier.com/content/object/eid/1-s2.0-S0926860X16303362-si3.gif?httpAccept=%2A%2F%2A",
            "@multimediatype": "GIF image file",
            "@type": "ALTIMG",
            "@size": "716",
            "@ref": "si3",
            "@mimetype": "image/gif"
          },
          {
            "@category": "thumbnail",
            "@height": "40",
            "@width": "168",
            "@_fa": "true",
            "$": "https://api.elsevier.com/content/object/eid/1-s2.0-S0926860X16303362-si4.gif?httpAccept=%2A%2F%2A",
            "@multimediatype": "GIF image file",
            "@type": "ALTIMG",
            "@size": "956",
            "@ref": "si4",
            "@mimetype": "image/gif"
          }
        ]
      },
      "link": {
        "@rel": "abstract",
        "@href": "https://api.elsevier.com/content/abstract/scopus_id/84976288686"
      }
    }
  }
}