{
  "metadata": {
    "title": "NiMo catalysts supported on graphene-modified mesoporous TiO<ce:inf loc=post>2</ce:inf> toward highly efficient hydrodesulfurization of dibenzothiophene",
    "authors": "; ; ",
    "journal": "Applied Catalysis A: General",
    "date": "2015-08-05",
    "doi": "10.1016/j.apcata.2015.05.028",
    "abstract": "",
    "uri": "https://api.elsevier.com/content/article/pii/S0926860X15300065",
    "pii": "S0926860X15300065"
  },
  "fulltext": {
    "full-text-retrieval-response": {
      "scopus-eid": "2-s2.0-84934968155",
      "originalText": "serial JL 271346 291210 291744 291809 31 Applied Catalysis A: General APPLIEDCATALYSISAGENERAL 2015-06-06 2015-06-06 2015-06-23 2015-06-23 2019-04-29T05:44:28 1-s2.0-S0926860X15300065 S0926-860X(15)30006-5 S0926860X15300065 10.1016/j.apcata.2015.05.028 S300 S300.2 FULL-TEXT 1-s2.0-S0926860X15X00111 2024-01-01T12:30:29.635264Z 0 0 20150805 2015 2015-06-06T05:54:46.74032Z absattachment articleinfo articletitlenorm authfirstinitialnorm authfirstsurnamenorm cid cids contenttype copyright crossmark dateloaded dateloadedtxt datesearch datesort dateupdated dco docsubtype doctype doi eid ewtransactionid hubeid indexeddate issn issnnorm itemstage itemtransactionid itemweight openaccess openarchive pg pgfirst pglast pii piinorm pubdatestart pubdatetxt pubyr sectiontitle sortorder srctitle srctitlenorm srctype ssids alllist content subj subheadings suppl tomb volfirst volissue volumelist webpdf webpdfpagecount yearnav figure table body mmlmath acknowledge affil articletitle auth authfirstini authfull authkeywords authlast grantnumber grantsponsor highlightsabst primabst ref specialabst 0926-860X 0926860X true 502 502 C Volume 502 21 157 165 157 165 20150805 5 August 2015 2015-08-05 2015 Articles article fla Copyright © 2015 Elsevier B.V. All rights reserved. NIMOCATALYSTSSUPPORTEDGRAPHENEMODIFIEDMESOPOROUSTIO2TOWARDHIGHLYEFFICIENTHYDRODESULFURIZATIONDIBENZOTHIOPHENE WANG H 1 Introduction 2 Experimental 2.1 Materials 2.2 Preparation of GO, supports and catalysts 2.3 Characterization methods 2.4 Catalytic activities 3 Results and discussion 3.1 Textural properties 3.2 FT-IR 3.3 XRD 3.4 Raman 3.5 NH3-TPD and Pyridine FT-IR 3.6 H2-TPR 3.7 TEM and SEM 3.8 XPS 3.9 CO uptake 3.10 Hydrodesulfurization 4 Conclusions Acknowledgements References LI 2009 1354 H NASSREDDINE 2011 408 S BREYSSE 2003 129 M HO 2011 117 T SONG 2003 207 C FECHETE 2012 2 I FAN 2011 27 Y LUO 2014 2081 M TREJO 2012 163 F AMEZCUA 2005 578 J NINH 2011 29 T CASTILLOVILLALON 2009 39 P HE 2004 2202 M WANG 2010 245 H KLAEWKLA 2011 668 R MASSTRANSFERADVANCEDASPECTS WEI 2011 316 M LI 2012 11525 L LI 2011 75 H CUI 2015 F LI 2012 480 L CHABOT 2014 1564 V LI 2011 1717 N KAMAT 2011 242 P GAO 2012 4093 Y WANG 2009 889 Y ZHANG 2009 380 H NETHRAVATHI 2008 1994 C SARDHARBASHA 2006 91 S OYAMA 2008 393 S LI 2012 19 X SING 1985 603 K BLIN 2000 4229 J FERDOUS 2007 118 D MATSUMOTO 2011 19280 Y CAO 2014 19738 Z ZHANG 2006 927 J GMESTL 1998 451 DESIKAN 1991 10050 A LAPAROLA 2002 171 V BADOGA 2012 67 S WANG 2008 17265 Y LIU 1998 314 Z SIGURDSON 2008 30 S HUIRACHEACUNA 2009 168 R MENDOZANIETO 2013 268 J ZHU 2012 581 P LEWANDOWSKI 2000 487 M EIMER 2008 639 G SONG 2014 257 H DUAN 2009 232 X LOPEZCORDERO 2000 23 R CALDERONMAGDALENO 2014 78 M KLIMOVA 2013 29 T BECERRIL 2008 463 H TOPSOE 1983 386 N LAI 2013 80 W MERIDAROBLES 1999 169 J GUICHARD 2008 97 B BECCAT 1999 487 P DASILVA 2011 88 V PRINS 2012 2714 R WANGX2015X157 WANGX2015X157X165 WANGX2015X157XH WANGX2015X157X165XH 2017-06-23T00:00:00Z http://creativecommons.org/licenses/by-nc-nd/4.0/ item S0926-860X(15)30006-5 S0926860X15300065 1-s2.0-S0926860X15300065 10.1016/j.apcata.2015.05.028 271346 2024-01-01T12:30:29.635264Z 2015-08-05 1-s2.0-S0926860X15300065-main.pdf https://s3.amazonaws.com/prod-ucs-content-store-us-east/content/pii:S0926860X15300065/MAIN/application/pdf/c16eabf99c63bcac5b4e8bdb1bd95072/main.pdf main.pdf pdf true 2794511 MAIN 9 1-s2.0-S0926860X15300065-main_1.png https://s3.amazonaws.com/prod-ucs-content-store-us-east/content/pii:S0926860X15300065/PREVIEW/image/png/7b7e5f9deeae15a3c2cd5ddcfe39abc6/main_1.png main_1.png png 57704 849 656 IMAGE-WEB-PDF 1 1-s2.0-S0926860X15300065-fx1.sml https://s3.amazonaws.com/prod-ucs-content-store-us-east/content/pii:S0926860X15300065/fx1/THUMBNAIL/image/gif/4af296dc55e8c2cb0070835b440f273a/fx1.sml fx1 true fx1.sml sml 8085 88 219 IMAGE-THUMBNAIL 1-s2.0-S0926860X15300065-gr1.sml https://s3.amazonaws.com/prod-ucs-content-store-us-east/content/pii:S0926860X15300065/gr1/THUMBNAIL/image/gif/b09a793f06ca391140882eae56a5cc64/gr1.sml gr1 gr1.sml sml 10626 114 219 IMAGE-THUMBNAIL 1-s2.0-S0926860X15300065-gr10.sml https://s3.amazonaws.com/prod-ucs-content-store-us-east/content/pii:S0926860X15300065/gr10/THUMBNAIL/image/gif/3ff66d2d99662103016cf5cc9efaa552/gr10.sml gr10 gr10.sml sml 13231 96 219 IMAGE-THUMBNAIL 1-s2.0-S0926860X15300065-gr11.sml https://s3.amazonaws.com/prod-ucs-content-store-us-east/content/pii:S0926860X15300065/gr11/THUMBNAIL/image/gif/e49ae7dfca4be075c2bc42c29053be59/gr11.sml gr11 gr11.sml sml 20994 110 219 IMAGE-THUMBNAIL 1-s2.0-S0926860X15300065-gr2.sml https://s3.amazonaws.com/prod-ucs-content-store-us-east/content/pii:S0926860X15300065/gr2/THUMBNAIL/image/gif/ebd7cde01fa410dadb66ce868e3a9f8b/gr2.sml gr2 gr2.sml sml 15751 103 219 IMAGE-THUMBNAIL 1-s2.0-S0926860X15300065-gr3.sml https://s3.amazonaws.com/prod-ucs-content-store-us-east/content/pii:S0926860X15300065/gr3/THUMBNAIL/image/gif/137f0819d17861ed15f8e8a2bd12c3d7/gr3.sml gr3 gr3.sml sml 20990 164 187 IMAGE-THUMBNAIL 1-s2.0-S0926860X15300065-gr4.sml https://s3.amazonaws.com/prod-ucs-content-store-us-east/content/pii:S0926860X15300065/gr4/THUMBNAIL/image/gif/6cbc089d90367e75bfb82989beba9596/gr4.sml gr4 gr4.sml sml 19721 163 182 IMAGE-THUMBNAIL 1-s2.0-S0926860X15300065-gr5.sml https://s3.amazonaws.com/prod-ucs-content-store-us-east/content/pii:S0926860X15300065/gr5/THUMBNAIL/image/gif/9c9d660be1c3230a6a0a9e9975e4289c/gr5.sml gr5 gr5.sml sml 22541 164 175 IMAGE-THUMBNAIL 1-s2.0-S0926860X15300065-gr6.sml https://s3.amazonaws.com/prod-ucs-content-store-us-east/content/pii:S0926860X15300065/gr6/THUMBNAIL/image/gif/c131219fbb7d65ca054f52359317b822/gr6.sml gr6 gr6.sml sml 15193 103 219 IMAGE-THUMBNAIL 1-s2.0-S0926860X15300065-gr7.sml https://s3.amazonaws.com/prod-ucs-content-store-us-east/content/pii:S0926860X15300065/gr7/THUMBNAIL/image/gif/2fd74dc0145cb34c0105a057e58893e2/gr7.sml gr7 gr7.sml sml 17127 164 188 IMAGE-THUMBNAIL 1-s2.0-S0926860X15300065-gr8.sml https://s3.amazonaws.com/prod-ucs-content-store-us-east/content/pii:S0926860X15300065/gr8/THUMBNAIL/image/gif/8375d4674370d605e306553b1d76dcf8/gr8.sml gr8 gr8.sml sml 32084 164 170 IMAGE-THUMBNAIL 1-s2.0-S0926860X15300065-gr9.sml https://s3.amazonaws.com/prod-ucs-content-store-us-east/content/pii:S0926860X15300065/gr9/THUMBNAIL/image/gif/c3751a3dd2ebaf6ae3705d858ff4e67f/gr9.sml gr9 gr9.sml sml 12904 103 219 IMAGE-THUMBNAIL 1-s2.0-S0926860X15300065-fx1.jpg https://s3.amazonaws.com/prod-ucs-content-store-us-east/content/pii:S0926860X15300065/fx1/DOWNSAMPLED/image/jpeg/f2b74473a9c4efa1383eff1417e6fd84/fx1.jpg fx1 true fx1.jpg jpg 25836 200 500 IMAGE-DOWNSAMPLED 1-s2.0-S0926860X15300065-gr1.jpg https://s3.amazonaws.com/prod-ucs-content-store-us-east/content/pii:S0926860X15300065/gr1/DOWNSAMPLED/image/jpeg/3f340a5403076bc8203f36db4c25e113/gr1.jpg gr1 gr1.jpg jpg 36403 294 564 IMAGE-DOWNSAMPLED 1-s2.0-S0926860X15300065-gr10.jpg https://s3.amazonaws.com/prod-ucs-content-store-us-east/content/pii:S0926860X15300065/gr10/DOWNSAMPLED/image/jpeg/9521129481de96e9bae816e74f46c683/gr10.jpg gr10 gr10.jpg jpg 60379 301 688 IMAGE-DOWNSAMPLED 1-s2.0-S0926860X15300065-gr11.jpg https://s3.amazonaws.com/prod-ucs-content-store-us-east/content/pii:S0926860X15300065/gr11/DOWNSAMPLED/image/jpeg/ad068cb948615711bab8e3deea165730/gr11.jpg gr11 gr11.jpg jpg 90898 296 588 IMAGE-DOWNSAMPLED 1-s2.0-S0926860X15300065-gr2.jpg https://s3.amazonaws.com/prod-ucs-content-store-us-east/content/pii:S0926860X15300065/gr2/DOWNSAMPLED/image/jpeg/dbfdf3a622c24d372b1b5611a92db529/gr2.jpg gr2 gr2.jpg jpg 92101 335 714 IMAGE-DOWNSAMPLED 1-s2.0-S0926860X15300065-gr3.jpg https://s3.amazonaws.com/prod-ucs-content-store-us-east/content/pii:S0926860X15300065/gr3/DOWNSAMPLED/image/jpeg/7820ed6832de82641a3d4bba1c7d7116/gr3.jpg gr3 gr3.jpg jpg 54450 264 301 IMAGE-DOWNSAMPLED 1-s2.0-S0926860X15300065-gr4.jpg https://s3.amazonaws.com/prod-ucs-content-store-us-east/content/pii:S0926860X15300065/gr4/DOWNSAMPLED/image/jpeg/28e4671f9108402cb9540cf8f9bd18fb/gr4.jpg gr4 gr4.jpg jpg 48404 268 299 IMAGE-DOWNSAMPLED 1-s2.0-S0926860X15300065-gr5.jpg https://s3.amazonaws.com/prod-ucs-content-store-us-east/content/pii:S0926860X15300065/gr5/DOWNSAMPLED/image/jpeg/7762cf387c3e788707ebe977206303f6/gr5.jpg gr5 gr5.jpg jpg 60332 281 300 IMAGE-DOWNSAMPLED 1-s2.0-S0926860X15300065-gr6.jpg https://s3.amazonaws.com/prod-ucs-content-store-us-east/content/pii:S0926860X15300065/gr6/DOWNSAMPLED/image/jpeg/d98bf605b1cf5d196c44f0caac492c25/gr6.jpg gr6 gr6.jpg jpg 90015 336 715 IMAGE-DOWNSAMPLED 1-s2.0-S0926860X15300065-gr7.jpg https://s3.amazonaws.com/prod-ucs-content-store-us-east/content/pii:S0926860X15300065/gr7/DOWNSAMPLED/image/jpeg/264602ea313b2648c819b50c23ba3812/gr7.jpg gr7 gr7.jpg jpg 45130 262 301 IMAGE-DOWNSAMPLED 1-s2.0-S0926860X15300065-gr8.jpg https://s3.amazonaws.com/prod-ucs-content-store-us-east/content/pii:S0926860X15300065/gr8/DOWNSAMPLED/image/jpeg/03a099736b3a69c8403a2a5d353cf012/gr8.jpg gr8 gr8.jpg jpg 163015 652 678 IMAGE-DOWNSAMPLED 1-s2.0-S0926860X15300065-gr9.jpg https://s3.amazonaws.com/prod-ucs-content-store-us-east/content/pii:S0926860X15300065/gr9/DOWNSAMPLED/image/jpeg/84756ea3ec17600d22989a3b9c9102d1/gr9.jpg gr9 gr9.jpg jpg 60852 318 678 IMAGE-DOWNSAMPLED 1-s2.0-S0926860X15300065-fx1_lrg.jpg https://s3.amazonaws.com/prod-ucs-content-store-us-east/content/pii:S0926860X15300065/fx1/HIGHRES/image/jpeg/3e4604f2122d2a3734cfee3661a07e4a/fx1_lrg.jpg fx1 true fx1_lrg.jpg jpg 201249 886 2213 IMAGE-HIGH-RES 1-s2.0-S0926860X15300065-gr1_lrg.jpg https://s3.amazonaws.com/prod-ucs-content-store-us-east/content/pii:S0926860X15300065/gr1/HIGHRES/image/jpeg/7bc36a593d6e7105182bd133827e9e28/gr1_lrg.jpg gr1 gr1_lrg.jpg jpg 104854 780 1498 IMAGE-HIGH-RES 1-s2.0-S0926860X15300065-gr10_lrg.jpg https://s3.amazonaws.com/prod-ucs-content-store-us-east/content/pii:S0926860X15300065/gr10/HIGHRES/image/jpeg/ceb4b84c2db1a4e8a8ff8aa4c69bc0f7/gr10_lrg.jpg gr10 gr10_lrg.jpg jpg 175275 801 1829 IMAGE-HIGH-RES 1-s2.0-S0926860X15300065-gr11_lrg.jpg https://s3.amazonaws.com/prod-ucs-content-store-us-east/content/pii:S0926860X15300065/gr11/HIGHRES/image/jpeg/8fb2ea52c90ae1aed8a8919d07cb6db8/gr11_lrg.jpg gr11 gr11_lrg.jpg jpg 288381 786 1562 IMAGE-HIGH-RES 1-s2.0-S0926860X15300065-gr2_lrg.jpg https://s3.amazonaws.com/prod-ucs-content-store-us-east/content/pii:S0926860X15300065/gr2/HIGHRES/image/jpeg/df0fd5028d6d0392a60dd821f52959bb/gr2_lrg.jpg gr2 gr2_lrg.jpg jpg 289143 889 1897 IMAGE-HIGH-RES 1-s2.0-S0926860X15300065-gr3_lrg.jpg https://s3.amazonaws.com/prod-ucs-content-store-us-east/content/pii:S0926860X15300065/gr3/HIGHRES/image/jpeg/cd36c7378270d179464950a2070264c3/gr3_lrg.jpg gr3 gr3_lrg.jpg jpg 116479 701 800 IMAGE-HIGH-RES 1-s2.0-S0926860X15300065-gr4_lrg.jpg https://s3.amazonaws.com/prod-ucs-content-store-us-east/content/pii:S0926860X15300065/gr4/HIGHRES/image/jpeg/ab68340835e8a7ad6016fa0772d13d79/gr4_lrg.jpg gr4 gr4_lrg.jpg jpg 120166 713 794 IMAGE-HIGH-RES 1-s2.0-S0926860X15300065-gr5_lrg.jpg https://s3.amazonaws.com/prod-ucs-content-store-us-east/content/pii:S0926860X15300065/gr5/HIGHRES/image/jpeg/67ee2990c03c4e27cdee37988eaa3b95/gr5_lrg.jpg gr5 gr5_lrg.jpg jpg 151822 746 797 IMAGE-HIGH-RES 1-s2.0-S0926860X15300065-gr6_lrg.jpg https://s3.amazonaws.com/prod-ucs-content-store-us-east/content/pii:S0926860X15300065/gr6/HIGHRES/image/jpeg/e54efc1b3047cdfbc831178d8fc23fc7/gr6_lrg.jpg gr6 gr6_lrg.jpg jpg 264516 893 1900 IMAGE-HIGH-RES 1-s2.0-S0926860X15300065-gr7_lrg.jpg https://s3.amazonaws.com/prod-ucs-content-store-us-east/content/pii:S0926860X15300065/gr7/HIGHRES/image/jpeg/f7c5b30c2c4424e36a53abef4a3a1fa5/gr7_lrg.jpg gr7 gr7_lrg.jpg jpg 109132 697 800 IMAGE-HIGH-RES 1-s2.0-S0926860X15300065-gr8_lrg.jpg https://s3.amazonaws.com/prod-ucs-content-store-us-east/content/pii:S0926860X15300065/gr8/HIGHRES/image/jpeg/bb0fc48851d999162bf877fa30a98967/gr8_lrg.jpg gr8 gr8_lrg.jpg jpg 637665 1732 1800 IMAGE-HIGH-RES 1-s2.0-S0926860X15300065-gr9_lrg.jpg https://s3.amazonaws.com/prod-ucs-content-store-us-east/content/pii:S0926860X15300065/gr9/HIGHRES/image/jpeg/c7c0b5d0a8733fa63b7e3df583be642e/gr9_lrg.jpg gr9 gr9_lrg.jpg jpg 191159 844 1800 IMAGE-HIGH-RES 1-s2.0-S0926860X15300065-si1.gif https://s3.amazonaws.com/prod-ucs-content-store-us-east/content/pii:S0926860X15300065/STRIPIN/image/gif/bea841455fde4c2e0b33b9215fb9fd6b/si1.gif si1 si1.gif gif 1268 33 296 ALTIMG 1-s2.0-S0926860X15300065-si2.gif https://s3.amazonaws.com/prod-ucs-content-store-us-east/content/pii:S0926860X15300065/STRIPIN/image/gif/77400cfb69d1a926a2359fae6dc0c6d7/si2.gif si2 si2.gif gif 1339 34 292 ALTIMG 1-s2.0-S0926860X15300065-si3.gif https://s3.amazonaws.com/prod-ucs-content-store-us-east/content/pii:S0926860X15300065/STRIPIN/image/gif/7989e10a7806daef7bb6d349020f0a36/si3.gif si3 si3.gif gif 540 19 140 ALTIMG 1-s2.0-S0926860X15300065-si4.gif https://s3.amazonaws.com/prod-ucs-content-store-us-east/content/pii:S0926860X15300065/STRIPIN/image/gif/2292ea4735e10d2433d6f919e0b0bb3d/si4.gif si4 si4.gif gif 390 19 75 ALTIMG APCATA 15402 S0926-860X(15)30006-5 10.1016/j.apcata.2015.05.028 Elsevier B.V. Fig. 1 Experimental flow chart (1) dual piston micropump, (2) check valve, (3) Mass flowmeter, (4, 5, 14, 15) valve, (6) reducing valve, (7) open tubular resistance furnace, (8) catalyst layer, (9) quartz sand, 10 thermocouple, (11) temperature control, (12) liquid trap, (13) backpressure valve, (16) H2S detector tube. Fig. 2 Nitrogen adsorption–desorption isotherms and BJH pore size distributions of different catalysts. Fig. 3 FTIR spectra of GO and supports. Fig. 4 XRD patterns of catalysts-fresh. Fig. 5 Raman spectra of (a) NiMo/TiO2, (b) NiMo/TGC-0.25, (c) NiMo/TGC-0.5, (d) NiMo/TGC-1.0. Fig. 6 (a) NH3-TPD and (b) Pyridine FT-IR profiles of catalysts. Fig. 7 TPR profiles of different catalyst-fresh. Fig. 8 (a) TEM image of GO, (b) SEM image of TiO2, (c) SEM image of NiMo/TGC-0.5, (d) TEM image of NiMo/TiO2, (e) TEM image of NiMo/TGC-0.5, (f) TEM image of NiMo/TGC-0.5-spent, (g, h) HRTEM images of NiMo/TGC-0.5-spent. Fig. 9 XPS envelope of the Ni 2p and Mo 3d of sulfided NiMo/TiO2 and NiMo/TGC-0.5 Fig. 10 (a) HDS performance and selectivity of catalysts, (b) The long term stability of NiMo/TiO2 and NiMo/TGC-0.5. Fig. 11 Proposed mechanism for the HDS of NiMo/TGC-0.5 and H2S desorption rate (inset) detected by rapid gas detector tube. Table 1 BET surface area, pore volume and average pore diameter of different supports and catalysts. Sample S BET (m 2 g −1) V BJH (cm3 g−1) Average pore diameter (nm) Support TiO2 102.5 0.27 10.7 TGC-0.25 99.8 0.28 10.8 TGC-0.5 97.8 0.27 10.8 TGC-1.0 97.3 0.28 11.2 Catalyst NiMo/GO 39.7 0.10 8.9 NiMo/TiO2 99.5 0.29 10.4 NiMo/TGC-0.25 97.9 0.31 10.5 NiMo/TGC-0.5 95.6 0.29 11.0 NiMo/TGC-1.0 95.0 0.32 11.2 Table 2 Distribution of Brönsted and Lewis acidity of catalysts. Sample Brönsted acidity (mmolg−1) Lewis acidity (mmolg−1) Total acidity (mmolg−1) Catalyst NiMo/TiO2 0 0.008 0.008 NiMo/TGC-0.25 0 0.030 0.030 NiMo/TGC-0.5 0 0.050 0.050 NiMo/TGC-1.0 0.009 0.034 0.043 Table 3 HDS reaction rate constant (k HDS), CO uptake and TOF. Sample K HDS (mmolh−1 g−1) CO uptake (μmolg−1) TOF (10−3 s−1) NiMo/GO 0.20 – – NiMo/TiO2 0.26 61.0 36.8 NiMo/TGC-0.25 0.39 – – NiMo/TGC-0.5 0.76 16.3 172.8 NiMo/TGC-1.0 0.43 – – NiMo catalysts supported on graphene-modified mesoporous TiO2 toward highly efficient hydrodesulfurization of dibenzothiophene Huaiyuan Wang a ⁎ Bo Xiao a Xiaoshuang Cheng a Chijia Wang a Li Zhao a Yanji Zhu a Jiahua Zhu b Xiaohua Lu c a College of Chemistry and Chemical Engineering, Northeast Petroleum University, Daqing 163318, China College of Chemistry and Chemical Engineering Northeast Petroleum University Daqing 163318 China b Department of Chemical and Biomolecular Engineering, The University of Akron, Akron, OH 44221 USA Department of Chemical and Biomolecular Engineering The University of Akron Akron OH 44221 USA c State Key Lab of Material-Oriented Chemical Engineering, Nanjing University of Technology, Nanjing 210009, China State Key Lab of Material-Oriented Chemical Engineering Nanjing University of Technology Nanjing 210009 China ⁎ Corresponding author. Fax: +86 4596503498. Graphical abstract The graphene-covered mesoporous TiO2 (S BET >90m2 g−1) were successfully prepared by using graphene oxide (GO) as graphene source via one-step hydrothermal reduction, and then were prepared supported NiMo catalysts for hydrodesulfurization (HDS) of dibenzothiophene (DBT). The active species were incorporated by incipient impregnation. Compared with the unmodified NiMo/TiO2 catalyst, all modified catalysts exhibited higher HDS activity under mild conditions of 280°C, 2.0MPa, liquid hourly space velocity of 4h−1 and hydrogen/feed ratio of 400 (V/V). Among of them, the catalyst with the appropriate mass ratio of rGO/TiO2(0.5) showed the highest DBT conversion of 99.9%. The prepared catalysts were characterized by various techniques (N2 adsorption-desorption, XRD, Raman, Pyridine FT-IR, NH3-TPD, H2-TPR, CO uptake, SEM and TEM). The enhanced HDS activity can be ascribed to (i) The incorporation of rGO (reduced graphene oxide) induces proper enhanced Lewis acidity of the modified catalysts, which promotes the adsorption of DBT molecules and facilitates the hydrogenation route. (ii) The introduction of rGO changes the HDS product (H2S) desorption behaviors, accelerating H2S desorption rate from catalyst surface and promoting the efficiency of catalyst immediately. Keywords Mesoporous TiO2 Graphene oxide Hydrothermal reduction Hydrodesulfurization 1 Introduction Environmental concerns are forcing dramatic challenge in transportation fuel specifications as sulfur-containing compounds in motor fuel are closely related to the emission of SOx, which is the main reason of air pollution. To meet the increasing stringent environmental regulations, deep/ultra-deep desulfurization are in urgent demanding [1–4]. Hydrodesulfurization (HDS) is one of the most widely used techniques for removing sulfur-containing compounds from petroleum products in the refining industry, where HDS catalyst plays a vital role in the determining process. Therefore, developing highly efficient catalyst exerts particularly important [5–7]. The support of catalyst is one of the key factors that impact its catalytic performance [8–10]. Recently, TiO2 has been recognized as a new generation of active support because of the moderate acid properties and the relatively weak interaction with the active metals, which is capable of improving the dispersion and reducibility of the supported active species [11,12]. However, the low surface area and poor thermal stability of traditional TiO2 limit its application. To overcome the above drawbacks, a new type of mesoporous TiO2 (anatase) whisker with high thermal stability (convert to rutile at 900°C), good mechanical property (>16.4Nmm−1) and large surface area (>90m2 g−1) was developed in our previous work [13]. The HDS performance of corresponding catalyst NiMo/TiO2 is investigated, but the result is not satisfactory. Generally, the catalytic performance is mainly determined by two factors: active sites and mass transfer of reaction on catalyst surface [14,15]. However, most current studies are focused on enhancing the activity of reactive sites and catalytic reaction mechanisms. It should be pointed out that mass transfer is equally important for the catalyst efficiency. According to the our previous molecular dynamics simulation [16], the key HDS resultant H2S (polar molecule) was prone to be absorbed on catalyst surface, which decreased the transfer rate of molecules off interfacial layer drastically and influenced the efficiency of NiMo/TiO2 directly. In recent years, many studies have reported the carbon-modified supports to prepare supported active metals catalysts using different materials as carbon sources, including phenyl-phosphonic acid (PPA), citric acid (CA) and monocarboxylic acids [17–19]. It shows that carbon modification on the surface of supports is also an alternative and effective way besides the conventional methods [20]. To the best of our knowledge, there has been no research reporting on graphene-doped TiO2 by surface modification in HDS reaction. Graphene, as one of the advanced carbon nano-materials, is a 2-dimensional single sheet of carbon atoms arranged in a hexagonal network. It has attracted a great deal of scientific interest and possess potentially applications in various fields, such as composite materials, batteries, solar cells and catalysts, due to its distinct properties [21–23]. Inspired from the above studies, we intend to use graphene to modify the surface of TiO2 support. But the solubility of graphene is poor, which is unfavorable for our work. Unlike graphene, graphene oxide (GO) is soluble due to the hydrophilic functional groups on the sheet surface, which render GO a good substitute for synthesizing new composite materials in liquid phase [24]. Herein, we first fabricated a reduced graphene oxide (rGO) surface modification on TiO2 support via one-step hydrothermal reduction method. Through adjusting TiO2 surface adsorption toward H2S molecule, an optimization was realized between diffusion and HDS process. Besides, the effects of rGO on the acidity of catalysts were investigated. Compared with the unmodified catalyst of NiMo/TiO2, the conversion of dibenzothiophene (DBT) increases from 78.6% to 99.9% under mild conditions. 2 Experimental 2.1 Materials Graphite powder (180 mesh) was purchased from Qing-dao Black Dragon Reagent Co. Ltd., (Qing dao, China). (NH4)6Mo7O24·4H2O, Ni(NO3)2·6H2O and C2H5OH (A.R.) were supplied by Tianjin Yaohua Chemical Reagent Co. Ltd., (Tian jin, China). Decalin and CS2 (A.R. standard) were purchased from Sinopharm Chemical Reagent Co. Ltd., Dibenzothiophene (C10H8S, 99.9%) was purchased from Acros Organics. Rapid hydrogen sulfide gas detector tube (200–5000ppm) was purchased from Beijing Environmental Applied Technology Research Centre. All the reagents were used without further purification. 2.2 Preparation of GO, supports and catalysts GO was synthesized by the modified Hummers’ method [25]. TiO2 was synthesized by ion-exchange method described in the literature [13]. In short, K2Ti2O5 was firstly hydrolyzed to be titanate (H2Ti2O5) at the presence of hydrochloride (0.1M). Then, H2Ti2O5 was calcined in muffle oven at 500°C to obtain mesoporous TiO2 (anatase). TiO2-rGO composite (TGC) was synthesized via hydrothermal reduction based on modified Rajamathi's method [26,27]. Briefly, a desired mount of GO was placed in a mixed solvent of distilled water (20mL) and ethanol (10mL). After 1h ultrasonic, 2.0g TiO2 was added to the above GO solution and stirred for 2h to get a homogeneous suspension. Then the suspension was transferred to a 40mL Teflon-Sealed autoclave and maintained at 120°C in electric oven for 3h. Finally, the resulting composite was obtained by sedimentation, rinsed by deionized water for several times and dried at 60°C for 5h. The supports obtained were named as TGC-x (x represents the mass ratio of rGO/TiO2 in percentage, x =0.25, 0.5, 1.0). The active components were introduced by incipient impregnation with nickel nitrate hexahydrate (0.12g) and ammonium heptamolybdate (0.12g). Finally, the as-prepared powder was calcined at 500°C for 2h to obtain the NiMo/TGC catalyst loading with NiO(1.4wt.%)-MoO3(4.7wt.%), which was the precursor of the “Ni–Mo–S” active phase for HDS [28]. 2.3 Characterization methods Structural properties of samples were determined by N2 adsorption-desorption (at −196°C) in a Micromeritics Tristar II 3020M apparatus. And the average pore size was calculated by D≈4 V BJH/S BET. Fourier transform infrared (FT-IR) spectra were acquired using the Tensor 27 infrared spectrometer with dry KBr. The spectra were recorded from 400 to 4000cm−1 with a resolution of 2cm−1. Acidity of catalysts were analyzed by FT-IR of adsorbed pyridine using the Tensor 27. 10mg of a sample is pressed into a self-supporting wafer followed by evacuation at 350°C for 0.5h. After cooled down to 50°C, the background spectrum was recorded, the sample was exposed to 1μL pyridine for 0.5h until equilibration at the temperature of 50°C, after that the catalyst was heated in a linear rate of 10°C/min to 280°C. Subsequently, the samples were outgassed for 0.5h at 280°C. X-ray diffraction (XRD) patterns of the samples were obtained on a D/max-2200PC using Cu Kα radiation operated at 40kV, 30mA, and scan speed of 10°/min. Raman spectra were obtained using a Horiba HR 800 spectrometer, equipped with a charge coupled device (CCD) camera detector. Transmission electron microscope (TEM) was performed using a JEM-1010 instrument supplied by JEOL. The surface morphological details were studied by scanning electron microscope (SEM, JSM-5600LV). NH3-temperature programmed desorption (NH3-TPD) tests were carried out on a BELCAT-A apparatus (Ankersmid, Netherlands). The synthesized catalyst (0.33g, 20–40 mesh) was pretreated with a pure He flow from room temperature to 300°C at a rate of 10°C/min and then cooled down to room temperature. Then, NH3 adsorption was carried out at 35°C for 2h using a mixture gas of 5vol.% NH3/He, and subsequently purged by pure He to remove excessive and weakly adsorbed NH3. Finally, the catalyst was heated to 600°C at a rate of 10°C/min in pure He and desorption pattern was recorded. Temperature-programmed reduction (TPR) characterization was conducted on TP-5000 apparatus (Tianjin Xianquan Co., Ltd., China). 20mg sample was taken each time and the temperature was increased up to 900°C at a rate of 10°C/min, meanwhile, the gas mixture of 10vol.% H2/Ar was introduced at 20mL/min into the quartz reactor. Irreversible CO uptake measurements were used to estimate the active sites on the catalysts. Usually, 0.3g of sample was loaded into a quartz reactor and purged in He at 200°C for 3h. After cooling, pulses of CO in He carrier at 40cm3 (NTP)min−1 were injected at room temperature through a sampling valve. CO uptake was calculated by measuring the decrease in the peak areas caused by adsorption in comparison with the area of a calibrated volume. 2.4 Catalytic activities The DBT HDS activity tests were conducted in a continuous fixed-bed reactor with 0.7g catalyst. Prior to the reaction, all fresh catalysts were sulfided in a mixture of 2wt.% CS2-cyclohexane at 350°C for 4h under 3.0MPa H2 pressure. After sulfidation, the temperature and pressure were decreased to reaction conditions of 280°C and 2.0MPa, the DBT feedstock with a concentration of 1300ppm (decalin was used as solvent) was fed into reactor under conditions liquid hourly space velocity (LHSV) of 4h−1 and hydrogen/feed ratio 400 (V/V). 5h later, when the steady reaction conditions had been achieved, H2S detector tube was installed at the position (16th) in Fig. 1 to detect the density of H2S desorption in the next 5h, meanwhile, liquid samples were collected hourly and analyzed by gas chromatograph (GC-14C) installed with a flame ionization detector and a 30m KB-1 capillary column. The DBT molecules undergo HDS through two parallel reaction routes: direct desulfurization (DDS) and hydrogenation desulfurization (HYD) [29,30]. Biphenyl (BP) and cyclohexylbenzene (CHB) correspond to the main product of the above processes, respectively. In the experiment, the detected main products are BP and CHB, the HDS conversion and the selectivity for HYD path could be defined as shown in Eqs. (1) and (2): (1) Conversion of DBT= DBT in − DBT out DBT in × 100 % (2) HYD of selectivity= CHB DBT in − DBT out × 100 % 3 Results and discussion 3.1 Textural properties The nitrogen adsorption isotherms of the catalysts and their corresponding Barrett–Joyner–Halenda (BJH) pore size distributions determined from the adsorption branch are exhibited in Fig. 2 . The isotherm pattern of all catalysts present the typical adsorption characteristics of IUPAC V, the NiMo/GO shows obvious H4 type hysteresis loop due to layer structure. However, the other catalysts exhibit typical H3 type hysteresis loop at relative high pressure (0.8< P/P 0 <0.99), suggesting that the as-prepared material is sheet/virgate and possesses mesoporous structure [31,32]. Besides, compared with NiMo/TiO2, the modified catalysts show almost no vertical shifts between P/P 0 =0.8 and 0.99, which can be attributed to the pore structure changes slightly indicating that there is no blockage of the mesoporous TiO2 [33] and this is also verified in BET. BET surface area (S BET), pore volume (V BJH), and average pore diameter of different modified supports and catalyst are shown in Table 1 . The original TiO2 shows the largest S BET of 102.5m2 g−1. With the incorporation of rGO, the S BET of modified supports decrease slightly indicating that rGO has a good dispersion on TiO2. Moreover, after the impregnation of active component, the S BET of corresponding catalysts decrease in a limited extent. Compared with supports, the V BJH and pore size of the corresponding catalysts do not change obviously. These results show that the incorporation of active components do not affect the pore accessibility of all supports and block the pores [33]. 3.2 FT-IR FTIR spectra of GO and supports are shown in Fig. 3 . The characterization method is usually used to detect the changes of functional groups after materials modification. The broad absorptions below 1000cm−1 are attributed to the vibration of TiOTi, the absorptions at 974cm−1 for the modified supports are weaker than that for the pure TiO2, which is mainly due to the partially coverage of the surface of TiO2 by the rGO sheets. The absorption bonds (curve of modified supports and GO) appearing at 1365 and 1620cm−1 are ascribed to CC stretching vibrations. Moreover, the absorption at 1690cm−1 (curve GO) is assigned to the CO stretching vibration [34] and it is absent in all the other supports, which indicates that GO is entirely reduced to rGO during the hydrothermal process [26]. The above results confirm the coexistence of TiO2 and rGO in the composite. 3.3 XRD Fig. 4 shows the XRD patterns of catalysts-fresh. As shown in Fig. 4, the above four samples show diffraction peaks at 25.3°, 37.8°, 48°, 53.9°, 55.1°, 62.6° and 75.2°, which are ascribed to the diffraction of anatase TiO2 (JCPDS 21-1272). The bottom curve is NiMo/GO, the peak around 13° is assigned as diffraction of GO, and peak around 28° is attributed to the diffraction of graphite. No peaks of NiMo phases are observed in Fig. 4, which is due to the high dispersion of NiMo species on the supports and this is consistent with the Nitrogen adsorption–desorption results. Moreover, no diffraction peaks for graphene are exhibited in the curves of the modified catalysts, which is attributed to the low amount and relatively low diffraction intensity of graphene [25]. Furthermore, it can be concluded that the incorporation of rGO does not change the crystalline phase of TiO2. 3.4 Raman Raman spectroscopy is widely used to determine the state of oxide (Mo and Ni) loaded on the supports. As presented in Fig. 5 , typical anatase bonds at 395, 515, 640cm−1 are observed [35,36]. In the lower frequency region, the bands at 244cm−1 are assigned to the deformation vibration of the MoOMo bridges in polymolybdate surface while the bands around 300cm−1 are due to the bending vibrations of MoO in either Mo7O24 6− or Mo8O26 4− [37,38]. The NiMo oxide species emerge mainly at the higher frequency region, for all catalysts, the peaks arising at 750–1050cm−1 are attributed to Mo species [37]. The peaks at 800cm−1 are originated from the species of MoO4 2− [39]. The peaks at 948 and 958cm−1 are attributed to the symmetric and antisymmetric MoO terminal stretches of Mo7O24 6− and Mo8O26 4−, respectively [37,39,40]. However, the Mo7O24 6− peak at 948cm−1 is weaker, which implies that the amount of Mo7O24 6− is smaller than that of Mo8O26 4−. Moreover, the existence of some NiMoO4 species (Raman bands at 948 and 958cm−1) cannot be excluded [41,42]. Compared with the unmodified catalysts, the new peaks at 875cm−1 can be ascribed to the β-NiMoO4 phase, which is considered easier to be reduced than α-NiMoO4 and shows better catalytic properties [41]. Meanwhile, the well-defined bonds for crystalline MoO3 at 667, 818, 996cm−1 are not appeared, which imply that highly dispersion of Mo oxide species in the as-prepared NiMo/TGC catalysts [43–45]. And the results are consistent with the XRD characterization results. In addition, curve b, c and d show the presence of D and G bond of graphene indicating that the successful incorporation of rGO to the modified catalyst [46], and this is consistent with the FT-IR results. 3.5 NH3-TPD and Pyridine FT-IR NH3-TPD is widely used to measure the acidic properties of catalysts, as NH3 is a strong base and can interact with OH species on catalyst, which represent the acidity of samples. The absorption of NH3 can be divided into two models as the physical absorption and the chemical absorption. The effect of rGO on the acidity of catalysts is exhibited in Fig. 6 a, the desorbed NH3 below 105°C is attributed to the physically absorbed NH3 while the chemically absorbed NH3 is desorbed between 105 and 610°C. Based on the temperature at which adsorbed NH3 desorbs, the acid sites are classified as weak (<230°C), medium (230–430°C) and strong (>430°C) acid sites [47]. Obviously, an intensive desorption peak (marked in red circle) is observed in demonstrating the increase of medium acid sites and the type of acid will be discussed later. In order to investigate the acid types of catalysts, Pyridine FT-IR analysis is adopted. Generally, the adsorption of pyridine molecules are classified into three types: (i) the protonation of pyridine characterizes the Brönsted acid sites, showing adsorption bonds around 1540 and 1630cm−1; (ii) the coordination between pyridine molecules and the Lewis acid sites giving adsorption bonds at 1440–1460, 1575–1580, 1600–1620cm−1; (iii) the weak hydrogen bond between pyridine and hydroxy groups, which exhibits adsorption bonds around 1447 and 1590cm−1 [48]. As shown in Fig. 6b, NiMo/TGC-x show adsorption bands at 1447, 1490, 1558 and 1607cm−1. The bands at 1447 and 1607cm−1 are attributed to Lewis acid sites [49], with the increasing of x, the Lewis acid sites increase at first and reach a maximum at x =0.5 then decrease. Duan et al. [50] assigned the bond at 1490cm−1 to pyridine adsorption of both Lewis acid and Brönsted acid sites. The absorption bands at 1558cm−1 are due to Brönsted acid sites, which exhibit no significant changes with the increasing of x. In summary, NH3-TPD analysis shows the overall acidity of modified catalysts increase in different degree. Among of them, the acidity of NiMo/TGC-0.5 increases at a maximum, but NH3-TPD cannot give the types of the increased acid sites. Pyridine FT-IR exhibits that the acid sites increase mainly in the form of Lewis acid (Table 2 , column 3), which is likely to facilitate the DBT molecules adsorption on catalysts and promote the HYD route. 3.6 H2-TPR H2-TPR is adopted to inquire more characteristics into Ni and Mo oxide on the surface of catalyst and their changes with the composition of support. TPR characterization results are shown in Fig. 7 , all of catalysts exhibit reduction peak at 340–360°C, the temperature peak is usually assigned to the first step of reduction(Mo6+–Mo4+) of polymeric octahedral Mo species bonded to TiO2 surface weakly[51]. The higher temperature with a maxima 600–800°C is ascribed to the second step of reduction(Mo4+–Mo0) of polymeric octahedral Mo and isolated tetrahedral Mo species interacted with the support strongly[52,53]. It should be noted that with the catalyst modified with rGO, the reduction temperature in high temperature region declines at least 150°C. This indicates the incorporation of rGO can weaken the interaction between active component and support, thereby reduce the reduction temperature for active species. 3.7 TEM and SEM The microphotographs of GO, TiO2 support, NiMo/TiO2 and NiMo/TGC-0.5 are shown in Fig. 8 . The synthesized GO nanosheet is investigated by TEM in Fig. 8a, which shows a semitransparent micro-surface with a few thin ripples. As reported previously, the ripples are intrinsic properties of thin GO sheets [54], which are due to the extra thermodynamic stability of the 2D nanosheets arising from microscopic crumpling. The as-prepared TiO2 (Fig. 8b) possesses a length/diameter ratio of 20, which is also called whisker. This is accordance with the results of nitrogen adsorption–desorption isotherms. After the impregnation of Mo and Ni species, NiMo/TGC-0.5 maintains the whisker morphology (Fig. 8c), but the surface becomes rough. The TEM of fresh NiMo/TiO2 and NiMo/TGC-0.5 are shown in Fig. 8d and e, through careful observation, it can be obtained that the active species deposited on the modified catalyst shows better dispersion than NiMo/TiO2. Low-resolution TEM image of NiMo/TGC-0.5-spent is exhibited in Fig. 8f, which shows the diameter of matrix is around 50nm. Fig. 8g and 8h show the high-resolution TEM images of NiMo/TGC-0.5-spent. It can be observed (Fig. 8g) that, the active species arranges closely and has a good dispersion on the support, which is due to the weak interaction between active metals and support. In the high magnification TEM micrographs (Fig. 8h), the well-known NiMoS slabs (marked by arrows) are observed, exhibiting multilayer stacking structure, which are the true reaction active centers and considered to have a good deep HDS performance [55]. 3.8 XPS Fig. 9 a shows the XPS profiles of the Ni 2p region of sulfided NiMo/TiO2 and NiMo/TGC-0.5. The Ni 2p envelope is consist of a mixture with three substances (NiS, NiO and NiMoS) [56]. The binding energy of NiS for the two catalyst are around 875eV, the peak emerging at 861eV is attributed to NiO and the peak of NiMoS appears at 855eV [57,58]. It should be mentioned that the modified catalyst shows a higher peak of NiMoS. The Mo 3d XPS of sulfided NiMo/TiO2 and NiMo/TGC-0.5 are presented in Fig. 9b. Generally, the signals of Mo 3d include Mo4+(MoS2), Mo5+(oxysulfide) and Mo6+(oxide) [59], each of Mo species appears in pairs such as, Mo 3d5/2 and 3d3/2. The deconvolution peaks of Mo 3d5/2 for Mo4+, Mo5+ and Mo6+ are around 229eV, 230eV, 232.5eV, respectively. The binding energies values of Mo 3d3/2 are fixed 3.1eV more than those of Mo 3d5/2. Moreover, the peak appearing about 226eV is ascribed to the S 2s line. It is noted that the Mo4+ ratio of NiMo/TGC-0.5 catalyst is higher than that of NiMo/TiO2. In conclusion, an appropriate of rGO can promote the formation of active sites and enhance the efficiency of desulfurization. 3.9 CO uptake The k HDS, CO uptake and TOF of different catalysts are presented in Table 3 . Among of them,CO uptake is undertaken over the spent catalyst at room temperature to evaluate the active sites on catalyst. The k HDS and TOF are calculated by K HDS = − F W ln ( 1 − y ) and TOF = F W y M , respectively, where F is the rate of DBT fed into the reactor (μmols−1), w is mass of catalyst (g), y is the conversion of DBT and M is the active sites deposited on catalyst decided by CO uptake [49,60]. As can be seen in Table 3, the higher conversion of DBT corresponding to a higher value of K HDS, and the NiMo/TGC-0.5 catalyst shows the maximum of 0.76. The CO uptake amount of NiMo/TGC-0.5 is lower than that of NiMo/TiO2, however, and it possesses relatively higher TOF value, which indicates rGO sheets play an indispensable role in HDS reaction. 3.10 Hydrodesulfurization The activities of different catalysts were investigated under relative mild conditions (280°C, 2.0MPa). As shown in Fig. 10 a, the conversion of DBT increases with x and reaches a maximum conversion of 99.9% at x =0.5. With the further increase of x, the conversion of DBT decreases slightly, which may arise from the loss of synergistic effect between the support and active species due to the excess incorporation of rGO. Moreover, the selectivity of catalysts show a similar trend and this is attributed to the Lewis acid sites of NiMo/TGC change in different degree, as the Lewis acid site can serve as the DBT adsorption sites and improve the HYD route. 100h stability of NiMo/TiO2 and NiMo/TGC-0.5 catalyst are presented in Fig. 10b, samples are collected at the 5thh (starting time when pump is turned on). As shown in Fig. 10b, the HDS performance of NiMo/TGC-0.5 is stable at a value of 99.9% in the reaction 100h. As a comparison sample, NiMo/TiO2 is also considered in the long term stability experiment and exhibits a stable value of 78.8%. On the basis of the above experimental results and theoretical analyses, a possible catalytic mechanism of DBT on NiMo/TGC-0.5 is proposed and explain the increase in activity in two aspects. (i) During the HDS process, hydrogen molecules dissociate into hydrogen atoms on the active sites of the catalyst [61], and then transfer to adjacent surface of support by spillover and diffusion. Meanwhile, DBT molecules can be absorbed on active metal sites and Lewis acid sites. The former are assigned as DBTa and they undergo HDS via direct desulfurization (DDS). The latter are named as DBTb and they undergo HDS via hydrogenation (HYD). As the Lewis acid sites of NiMo/TGC-0.5 increase the most (Table 2, column 3), more DBTb are absorbed on the Lewis acid sites (Fig. 11 b) undergoing HDS via HYD. Finally, when the dissociative hydrogen atoms flow over the active sites, they participate in hydrogenation reaction and form the resultant of H2S, realizing deep desulfurization. (ii) As mentioned previously, our molecular dynamics simulation showed that polar molecule tended to be absorbed on mesoporous TiO2, which would influence the activity of catalysts definitely [16]. Li et al. [17] found that the surface of carbon-modified TiO2 possessed excellent hydrophobic property, which can weaken the adsorption of polar molecules and accelerate their transfer. This is beneficial to the reaction whose product is polar molecule, such as the HDS. Consequently, a graphene modification on TiO2 support is proposed to accelerate the desorption of product H2S, promote HDS reaction moving forward and enhance the HDS performance. The rapid gas (H2S) detector tube is used to measure the H2S desorption rate from catalysts, as exhibited the inset in Fig. 11 (under 5h steady-state of HDS reaction), the tube gives a value of 2000ppm for the unmodified catalyst, whereas the NiMo/TGC-0.5 is 4200ppm. The result indicates that the H2S desorption rate from catalyst surface is faster in the presence of rGO sheets. And this is also an important reason for improving the activity of the catalyst. 4 Conclusions In summary, we examined the influence of graphene heterogeneous surface modification on the HDS performance of TiO2-supported catalyst and found the improving effect of graphene addition for the first time. Through adjusting TiO2 surface adsorption toward H2S molecule, realizing an optimization between diffusion and HDS process. The presence of rGO changes the desorption behaviors of product H2S molecules-accelerating their transfer rate on catalysts, and promotes reaction moving forward. In addition, the incorporation of graphene induces an enhanced Lewis acid site, which facilitates the adsorption of DBT molecules and promotes the HYD route. When the mass ratio of rGO/TiO2 is 0.5 in percentage, the corresponding catalyst shows the best HDS activity. Compared with the unmodified catalyst, the DBT conversion of NiMo/TGC-0.5 increases from 78.6% to 99.9% under relative mild conditions of 280°C, 2.0MPa, LHSV 4h−1, and hydrogen/feed ratio of 400 (V/V). Our present work shows that the heterogeneous modification on the surface of materials is an effective and alternative way to open a new possibility in the investigation of TiO2-rGO composites and promote their practical application in addressing various environmental issues. Acknowledgements The research is financially supported by the National Young Top Talents Plan of China (2013042), National Science Foundation of China (Grant No.51175066), FANEDD (201164), New Century Excellent Talents in University (NCET-12-0704) and the Science Foundation for Distinguished Young Scholars of Heilongjiang Province (JC201403). References [1] H.M. Li L.N. He J.D. Lu W.S. Zhu X. Jiang Y. Wang Y.S. Yan Energy Fuels 23 2009 1354 [2] S. Nassreddine S. Casu J.L. Zotin C. Geantet L. Piccolo Catal. Sci. Technol. 1 2011 408 [3] M. Breysse G. Djega-Mariadassou S. Pessayre C. Geantet M. Vrinat G. Pérot Catal. Today 84 2003 129 [4] T.C. Ho J.M. McConnachie J. Catal. 277 2011 117 [5] C. Song X. Ma Appl. Catal. B 41 2003 207 [6] I. Fechete Y. Wang J.C. Védrine Catal. Today 189 2012 2 [7] Y. Fan H. Xiao G. Shi H.Y. Liu Y. Qian T.H. Wang J. Catal. 279 2011 27 [8] M.J. Luo Q.F. Wang G.Z. Li X.W. Zhang L. Wang T. Jiang Catal. Sci. Technol. 4 2014 2081 [9] F. Trejo M.S. Rana J. Ancheyta A. Rueda Fuel 100 2012 163 [10] J.C. Amezcua L. Lizama C. Salcedo I. Puente J.M. Domínguez T. Klimova Catal. Today 107 2005 578 [11] T.K.T. Ninh L. Massin D. Laurenti M. Vrinat Appl. Catal. A 407 2011 29 [12] P. Castillo-Villalón J. Ramírez J. Catal. 268 2009 39 [13] M. He X.H. Lu X. Feng L. Yu Z.H. Yang Chem. Commun. 19 2004 2202 [14] H.M. Wang E. Iglesia J. Catal. 273 2010 245 [15] R. Klaewkla M. Arend W.F. Hoelderich Mass Transfer-Advanced Aspects 2011 Intech Germany 668 [16] M.J. Wei J. Zhou X.H. Lu Y.D. Zhu W.J. Liu L.H. Lu L.Z. Zhang Fluid Phase Equilib. 302 2011 316 [17] L.C. Li Y.D. Zhu X.H. Lu M.J. Wei W. Zhuang Z.H. Yang Chem. Comun. 48 2012 11525 [18] H. Li M. Li Y. Chu F. Liu H. Nie Appl. Catal. A 403 2011 75 [19] F. Cui G.C. Li X.B. Li M.H. Lu M.S. Li Catal. Sci. Technol. 2015 10.1039/c4cy00814f [20] L. Li Y. Wang K. Shi S. Chen Z. Yang X. Lu Catal. Lett. 142 2012 480 [21] V. Chabot D. Higgins A. Yu Energy Environ. Sci. 7 2014 1564 [22] N. Li G. Liu C. Zhen Adv. Funct. Mater. 21 2011 1717 [23] P.V. Kamat J. Phys. Chem. Lett. 2 2011 242 [24] Y.Y. Gao X.P. Pu D.F. Zhang G.Q. Ding X. Shao J. Ma Carbon 50 2012 4093 [25] Y. Wang Y.M. Li L.H. Tang J. Lu J.H. Li Electrochem. Commun. 11 2009 889 [26] H. Zhang X.J. Lv Y.M. Li Y. Wang J.H. Li ACS Nano 4 2009 380 [27] C. Nethravathi M. Rajamathi Carbon 46 2008 1994 [28] S.J. SardharBasha N.R. Sasirekha R. Maheswari K. Shanthi Appl. Catal. A 308 2006 91 [29] S.T. Oyama Y.K. Lee J. Catal. 258 2008 393 [30] X. Li Z. Sun A. Wang X. Yang Y. Wang Appl. Catal. A 417 2012 19 [31] K.S.W. Sing D.H. Everett R.A.W. Haul L. Moscou R.A. Pierotti J. Rouquerol T. Siemieniewska Pure Appl. Chem. 57 1985 603 [32] J.L. Blin C. Otjacques G. Herrier B.L. Su Langmuir 16 2000 4229 [33] D. Ferdous N.N. Bakhshi A.K. Dalai J. Adjaye Appl. Catal. B 72 2007 118 [34] Y. Matsumoto M. Koinuma S. Ida S. Hayami T. Taniguchi K. Hatakeyama S. Amano J. Phys. Chem. C 115 2011 19280 [35] Z. Cao A. Duan Z. Zhao J. Li Y. Wei G. Jiang J. Liu J. Mater. Chem. A 2 2014 19738 [36] J. Zhang M. Li Z. Feng J. Chen C. Li J. Phys. Chem. B 110 2006 927 [37] GMESTL T.K.K. Srinivasan Catal. Rev. 40 1998 451 [38] A.N. Desikan L. Huang S.T. Oyama J. Phys. Chem. 95 1991 10050 [39] V. La Parola G. Deganello C.R. Tewell A.M. Venezia Appl. Catal. A 235 2002 171 [40] S. Badoga K.C. Mouli K.K. Soni A.K. Dalai J. Adjaye Appl. Catal. B 125 2012 67 [41] Y.G. Wang G. Xiong X. Liu X.C. Yu L.P. Liu J.Y. Wang Z.C. Feng C. Li J. Phys. Chem. B 112 2008 17265 [42] Z. Liu Y. Chen J. Catal. 177 1998 314 [43] S. Sigurdson V. Sundaramurthy A.K. Dalai J. Adjaye J. Mol. Catal. A 291 2008 30 [44] R. Huirache-Acuña B. Pawelec E. Rivera-Muñoz R. Nava J. Espino J.L.G. Fierro Appl. Catal. A 92 2009 168 [45] J.A. Mendoza-Nieto O. Vera-Vallejo L. Escobar-Alarcón D. Solís-Casados T. Klimova Fuel 110 2013 268 [46] P.N. Zhu N.A. Sreekumaran S.J. Peng S.Y. Yang R. Seeram ACS Appl. Mater. Interfaces 4 2012 581 [47] M. Lewandowski Z. Sarbak Fuel 79 2000 487 [48] G.A. Eimer S.G. Casuscelli C.A. Chanquia V. Elias M.E. Crivello E.R. Herrero Catal. Today 133 2008 639 [49] H. Song J. Wang Z.D. Wang H.L. Song F. Li Z.S. Jin J. Catal. 311 2014 257 [50] X. Duan Y. Teng A. Wang V.M. Kogan X. Li Y. Wang J. Catal. 261 2009 232 [51] R. López Cordero A. López Agudo Appl. Catal. A 175 2000 23 [52] M.Á. Calderón-Magdaleno J.A. Mendoza-Nieto T.E. Klimova Catal. Today 220 2014 78 [53] T.E. Klimova D. Valencia J.A. Mendoza-Nieto P. Hernández-Hipólito J. Catal. 304 2013 29 [54] H.A. Becerril J. Mao Z. Liu R.M. Stoltenberg Z. Bao Y.S. Chen ACS Nano 2 2008 463 [55] N.Y. Topsøe H. Topsøe J. Catal. 84 1983 386 [56] W.K. Lai W.J. Song L.Q. Pang Z.F. Wu N. Zheng J.J. Li J.B. Zheng X.D. Yi W.P. Fang J. Catal. 303 2013 80 [57] J. Mérida-Robles E. Rodrıguez-Castellón A. Jiménez-López J. Mol. Catal. A 145 1999 169 [58] B. Guichard M. Roy-Auberger E. Devers C. Legens P. Raybaud Catal. Today 130 2008 97 [59] P. Beccat P.D. Silva Y. Huiban S. Kasztelan Oil Gas Sci. Technol. 54 1999 487 [60] V.T. da Silva L.A. Sousa R.M. Amorim L. Andrini S.J.A. Figueroa F.G. Requejo F.C. Vicentini J. Catal. 279 2011 88 [61] R. Prins Chem. Rev. 112 2012 2714",
      "scopus-id": "84934968155",
      "coredata": {
        "eid": "1-s2.0-S0926860X15300065",
        "dc:description": "The graphene-covered mesoporous TiO2 (S BET >90m2 g−1) were successfully prepared by using graphene oxide (GO) as graphene source via one-step hydrothermal reduction, and then were prepared supported NiMo catalysts for hydrodesulfurization (HDS) of dibenzothiophene (DBT). The active species were incorporated by incipient impregnation. Compared with the unmodified NiMo/TiO2 catalyst, all modified catalysts exhibited higher HDS activity under mild conditions of 280°C, 2.0MPa, liquid hourly space velocity of 4h−1 and hydrogen/feed ratio of 400 (V/V). Among of them, the catalyst with the appropriate mass ratio of rGO/TiO2(0.5) showed the highest DBT conversion of 99.9%. The prepared catalysts were characterized by various techniques (N2 adsorption-desorption, XRD, Raman, Pyridine FT-IR, NH3-TPD, H2-TPR, CO uptake, SEM and TEM). The enhanced HDS activity can be ascribed to (i) The incorporation of rGO (reduced graphene oxide) induces proper enhanced Lewis acidity of the modified catalysts, which promotes the adsorption of DBT molecules and facilitates the hydrogenation route. (ii) The introduction of rGO changes the HDS product (H2S) desorption behaviors, accelerating H2S desorption rate from catalyst surface and promoting the efficiency of catalyst immediately.",
        "openArchiveArticle": "false",
        "prism:coverDate": "2015-08-05",
        "openaccessUserLicense": null,
        "prism:aggregationType": "Journal",
        "prism:url": "https://api.elsevier.com/content/article/pii/S0926860X15300065",
        "dc:creator": [
          {
            "@_fa": "true",
            "$": "Wang, Huaiyuan"
          },
          {
            "@_fa": "true",
            "$": "Xiao, Bo"
          },
          {
            "@_fa": "true",
            "$": "Cheng, Xiaoshuang"
          },
          {
            "@_fa": "true",
            "$": "Wang, Chijia"
          },
          {
            "@_fa": "true",
            "$": "Zhao, Li"
          },
          {
            "@_fa": "true",
            "$": "Zhu, Yanji"
          },
          {
            "@_fa": "true",
            "$": "Zhu, Jiahua"
          },
          {
            "@_fa": "true",
            "$": "Lu, Xiaohua"
          }
        ],
        "link": [
          {
            "@_fa": "true",
            "@rel": "self",
            "@href": "https://api.elsevier.com/content/article/pii/S0926860X15300065"
          },
          {
            "@_fa": "true",
            "@rel": "scidir",
            "@href": "https://www.sciencedirect.com/science/article/pii/S0926860X15300065"
          }
        ],
        "dc:format": "application/json",
        "openaccessType": null,
        "pii": "S0926-860X(15)30006-5",
        "prism:volume": "502",
        "prism:publisher": "Elsevier B.V.",
        "dc:title": "NiMo catalysts supported on graphene-modified mesoporous TiO2 toward highly efficient hydrodesulfurization of dibenzothiophene",
        "prism:copyright": "Copyright © 2015 Elsevier B.V. All rights reserved.",
        "openaccess": "0",
        "prism:issn": "0926860X",
        "dcterms:subject": [
          {
            "@_fa": "true",
            "$": "Mesoporous TiO2"
          },
          {
            "@_fa": "true",
            "$": "Graphene oxide"
          },
          {
            "@_fa": "true",
            "$": "Hydrothermal reduction"
          },
          {
            "@_fa": "true",
            "$": "Hydrodesulfurization"
          }
        ],
        "openaccessArticle": "false",
        "prism:publicationName": "Applied Catalysis A: General",
        "openaccessSponsorType": null,
        "prism:pageRange": "157-165",
        "prism:endingPage": "165",
        "pubType": "fla",
        "prism:coverDisplayDate": "5 August 2015",
        "prism:doi": "10.1016/j.apcata.2015.05.028",
        "prism:startingPage": "157",
        "dc:identifier": "doi:10.1016/j.apcata.2015.05.028",
        "openaccessSponsorName": null
      },
      "objects": {
        "object": [
          {
            "@category": "thumbnail",
            "@height": "88",
            "@width": "219",
            "@_fa": "true",
            "$": "https://api.elsevier.com/content/object/eid/1-s2.0-S0926860X15300065-fx1.sml?httpAccept=%2A%2F%2A",
            "@multimediatype": "GIF image file",
            "@type": "IMAGE-THUMBNAIL",
            "@size": "8085",
            "@ref": "fx1",
            "@mimetype": "image/gif"
          },
          {
            "@category": "thumbnail",
            "@height": "114",
            "@width": "219",
            "@_fa": "true",
            "$": "https://api.elsevier.com/content/object/eid/1-s2.0-S0926860X15300065-gr1.sml?httpAccept=%2A%2F%2A",
            "@multimediatype": "GIF image file",
            "@type": "IMAGE-THUMBNAIL",
            "@size": "10626",
            "@ref": "gr1",
            "@mimetype": "image/gif"
          },
          {
            "@category": "thumbnail",
            "@height": "96",
            "@width": "219",
            "@_fa": "true",
            "$": "https://api.elsevier.com/content/object/eid/1-s2.0-S0926860X15300065-gr10.sml?httpAccept=%2A%2F%2A",
            "@multimediatype": "GIF image file",
            "@type": "IMAGE-THUMBNAIL",
            "@size": "13231",
            "@ref": "gr10",
            "@mimetype": "image/gif"
          },
          {
            "@category": "thumbnail",
            "@height": "110",
            "@width": "219",
            "@_fa": "true",
            "$": "https://api.elsevier.com/content/object/eid/1-s2.0-S0926860X15300065-gr11.sml?httpAccept=%2A%2F%2A",
            "@multimediatype": "GIF image file",
            "@type": "IMAGE-THUMBNAIL",
            "@size": "20994",
            "@ref": "gr11",
            "@mimetype": "image/gif"
          },
          {
            "@category": "thumbnail",
            "@height": "103",
            "@width": "219",
            "@_fa": "true",
            "$": "https://api.elsevier.com/content/object/eid/1-s2.0-S0926860X15300065-gr2.sml?httpAccept=%2A%2F%2A",
            "@multimediatype": "GIF image file",
            "@type": "IMAGE-THUMBNAIL",
            "@size": "15751",
            "@ref": "gr2",
            "@mimetype": "image/gif"
          },
          {
            "@category": "thumbnail",
            "@height": "164",
            "@width": "187",
            "@_fa": "true",
            "$": "https://api.elsevier.com/content/object/eid/1-s2.0-S0926860X15300065-gr3.sml?httpAccept=%2A%2F%2A",
            "@multimediatype": "GIF image file",
            "@type": "IMAGE-THUMBNAIL",
            "@size": "20990",
            "@ref": "gr3",
            "@mimetype": "image/gif"
          },
          {
            "@category": "thumbnail",
            "@height": "163",
            "@width": "182",
            "@_fa": "true",
            "$": "https://api.elsevier.com/content/object/eid/1-s2.0-S0926860X15300065-gr4.sml?httpAccept=%2A%2F%2A",
            "@multimediatype": "GIF image file",
            "@type": "IMAGE-THUMBNAIL",
            "@size": "19721",
            "@ref": "gr4",
            "@mimetype": "image/gif"
          },
          {
            "@category": "thumbnail",
            "@height": "164",
            "@width": "175",
            "@_fa": "true",
            "$": "https://api.elsevier.com/content/object/eid/1-s2.0-S0926860X15300065-gr5.sml?httpAccept=%2A%2F%2A",
            "@multimediatype": "GIF image file",
            "@type": "IMAGE-THUMBNAIL",
            "@size": "22541",
            "@ref": "gr5",
            "@mimetype": "image/gif"
          },
          {
            "@category": "thumbnail",
            "@height": "103",
            "@width": "219",
            "@_fa": "true",
            "$": "https://api.elsevier.com/content/object/eid/1-s2.0-S0926860X15300065-gr6.sml?httpAccept=%2A%2F%2A",
            "@multimediatype": "GIF image file",
            "@type": "IMAGE-THUMBNAIL",
            "@size": "15193",
            "@ref": "gr6",
            "@mimetype": "image/gif"
          },
          {
            "@category": "thumbnail",
            "@height": "164",
            "@width": "188",
            "@_fa": "true",
            "$": "https://api.elsevier.com/content/object/eid/1-s2.0-S0926860X15300065-gr7.sml?httpAccept=%2A%2F%2A",
            "@multimediatype": "GIF image file",
            "@type": "IMAGE-THUMBNAIL",
            "@size": "17127",
            "@ref": "gr7",
            "@mimetype": "image/gif"
          },
          {
            "@category": "thumbnail",
            "@height": "164",
            "@width": "170",
            "@_fa": "true",
            "$": "https://api.elsevier.com/content/object/eid/1-s2.0-S0926860X15300065-gr8.sml?httpAccept=%2A%2F%2A",
            "@multimediatype": "GIF image file",
            "@type": "IMAGE-THUMBNAIL",
            "@size": "32084",
            "@ref": "gr8",
            "@mimetype": "image/gif"
          },
          {
            "@category": "thumbnail",
            "@height": "103",
            "@width": "219",
            "@_fa": "true",
            "$": "https://api.elsevier.com/content/object/eid/1-s2.0-S0926860X15300065-gr9.sml?httpAccept=%2A%2F%2A",
            "@multimediatype": "GIF image file",
            "@type": "IMAGE-THUMBNAIL",
            "@size": "12904",
            "@ref": "gr9",
            "@mimetype": "image/gif"
          },
          {
            "@category": "standard",
            "@height": "200",
            "@width": "500",
            "@_fa": "true",
            "$": "https://api.elsevier.com/content/object/eid/1-s2.0-S0926860X15300065-fx1.jpg?httpAccept=%2A%2F%2A",
            "@multimediatype": "JPEG image file",
            "@type": "IMAGE-DOWNSAMPLED",
            "@size": "25836",
            "@ref": "fx1",
            "@mimetype": "image/jpeg"
          },
          {
            "@category": "standard",
            "@height": "294",
            "@width": "564",
            "@_fa": "true",
            "$": "https://api.elsevier.com/content/object/eid/1-s2.0-S0926860X15300065-gr1.jpg?httpAccept=%2A%2F%2A",
            "@multimediatype": "JPEG image file",
            "@type": "IMAGE-DOWNSAMPLED",
            "@size": "36403",
            "@ref": "gr1",
            "@mimetype": "image/jpeg"
          },
          {
            "@category": "standard",
            "@height": "301",
            "@width": "688",
            "@_fa": "true",
            "$": "https://api.elsevier.com/content/object/eid/1-s2.0-S0926860X15300065-gr10.jpg?httpAccept=%2A%2F%2A",
            "@multimediatype": "JPEG image file",
            "@type": "IMAGE-DOWNSAMPLED",
            "@size": "60379",
            "@ref": "gr10",
            "@mimetype": "image/jpeg"
          },
          {
            "@category": "standard",
            "@height": "296",
            "@width": "588",
            "@_fa": "true",
            "$": "https://api.elsevier.com/content/object/eid/1-s2.0-S0926860X15300065-gr11.jpg?httpAccept=%2A%2F%2A",
            "@multimediatype": "JPEG image file",
            "@type": "IMAGE-DOWNSAMPLED",
            "@size": "90898",
            "@ref": "gr11",
            "@mimetype": "image/jpeg"
          },
          {
            "@category": "standard",
            "@height": "335",
            "@width": "714",
            "@_fa": "true",
            "$": "https://api.elsevier.com/content/object/eid/1-s2.0-S0926860X15300065-gr2.jpg?httpAccept=%2A%2F%2A",
            "@multimediatype": "JPEG image file",
            "@type": "IMAGE-DOWNSAMPLED",
            "@size": "92101",
            "@ref": "gr2",
            "@mimetype": "image/jpeg"
          },
          {
            "@category": "standard",
            "@height": "264",
            "@width": "301",
            "@_fa": "true",
            "$": "https://api.elsevier.com/content/object/eid/1-s2.0-S0926860X15300065-gr3.jpg?httpAccept=%2A%2F%2A",
            "@multimediatype": "JPEG image file",
            "@type": "IMAGE-DOWNSAMPLED",
            "@size": "54450",
            "@ref": "gr3",
            "@mimetype": "image/jpeg"
          },
          {
            "@category": "standard",
            "@height": "268",
            "@width": "299",
            "@_fa": "true",
            "$": "https://api.elsevier.com/content/object/eid/1-s2.0-S0926860X15300065-gr4.jpg?httpAccept=%2A%2F%2A",
            "@multimediatype": "JPEG image file",
            "@type": "IMAGE-DOWNSAMPLED",
            "@size": "48404",
            "@ref": "gr4",
            "@mimetype": "image/jpeg"
          },
          {
            "@category": "standard",
            "@height": "281",
            "@width": "300",
            "@_fa": "true",
            "$": "https://api.elsevier.com/content/object/eid/1-s2.0-S0926860X15300065-gr5.jpg?httpAccept=%2A%2F%2A",
            "@multimediatype": "JPEG image file",
            "@type": "IMAGE-DOWNSAMPLED",
            "@size": "60332",
            "@ref": "gr5",
            "@mimetype": "image/jpeg"
          },
          {
            "@category": "standard",
            "@height": "336",
            "@width": "715",
            "@_fa": "true",
            "$": "https://api.elsevier.com/content/object/eid/1-s2.0-S0926860X15300065-gr6.jpg?httpAccept=%2A%2F%2A",
            "@multimediatype": "JPEG image file",
            "@type": "IMAGE-DOWNSAMPLED",
            "@size": "90015",
            "@ref": "gr6",
            "@mimetype": "image/jpeg"
          },
          {
            "@category": "standard",
            "@height": "262",
            "@width": "301",
            "@_fa": "true",
            "$": "https://api.elsevier.com/content/object/eid/1-s2.0-S0926860X15300065-gr7.jpg?httpAccept=%2A%2F%2A",
            "@multimediatype": "JPEG image file",
            "@type": "IMAGE-DOWNSAMPLED",
            "@size": "45130",
            "@ref": "gr7",
            "@mimetype": "image/jpeg"
          },
          {
            "@category": "standard",
            "@height": "652",
            "@width": "678",
            "@_fa": "true",
            "$": "https://api.elsevier.com/content/object/eid/1-s2.0-S0926860X15300065-gr8.jpg?httpAccept=%2A%2F%2A",
            "@multimediatype": "JPEG image file",
            "@type": "IMAGE-DOWNSAMPLED",
            "@size": "163015",
            "@ref": "gr8",
            "@mimetype": "image/jpeg"
          },
          {
            "@category": "standard",
            "@height": "318",
            "@width": "678",
            "@_fa": "true",
            "$": "https://api.elsevier.com/content/object/eid/1-s2.0-S0926860X15300065-gr9.jpg?httpAccept=%2A%2F%2A",
            "@multimediatype": "JPEG image file",
            "@type": "IMAGE-DOWNSAMPLED",
            "@size": "60852",
            "@ref": "gr9",
            "@mimetype": "image/jpeg"
          },
          {
            "@category": "high",
            "@height": "886",
            "@width": "2213",
            "@_fa": "true",
            "$": "https://api.elsevier.com/content/object/eid/1-s2.0-S0926860X15300065-fx1_lrg.jpg?httpAccept=%2A%2F%2A",
            "@multimediatype": "JPEG image file",
            "@type": "IMAGE-HIGH-RES",
            "@size": "201249",
            "@ref": "fx1",
            "@mimetype": "image/jpeg"
          },
          {
            "@category": "high",
            "@height": "780",
            "@width": "1498",
            "@_fa": "true",
            "$": "https://api.elsevier.com/content/object/eid/1-s2.0-S0926860X15300065-gr1_lrg.jpg?httpAccept=%2A%2F%2A",
            "@multimediatype": "JPEG image file",
            "@type": "IMAGE-HIGH-RES",
            "@size": "104854",
            "@ref": "gr1",
            "@mimetype": "image/jpeg"
          },
          {
            "@category": "high",
            "@height": "801",
            "@width": "1829",
            "@_fa": "true",
            "$": "https://api.elsevier.com/content/object/eid/1-s2.0-S0926860X15300065-gr10_lrg.jpg?httpAccept=%2A%2F%2A",
            "@multimediatype": "JPEG image file",
            "@type": "IMAGE-HIGH-RES",
            "@size": "175275",
            "@ref": "gr10",
            "@mimetype": "image/jpeg"
          },
          {
            "@category": "high",
            "@height": "786",
            "@width": "1562",
            "@_fa": "true",
            "$": "https://api.elsevier.com/content/object/eid/1-s2.0-S0926860X15300065-gr11_lrg.jpg?httpAccept=%2A%2F%2A",
            "@multimediatype": "JPEG image file",
            "@type": "IMAGE-HIGH-RES",
            "@size": "288381",
            "@ref": "gr11",
            "@mimetype": "image/jpeg"
          },
          {
            "@category": "high",
            "@height": "889",
            "@width": "1897",
            "@_fa": "true",
            "$": "https://api.elsevier.com/content/object/eid/1-s2.0-S0926860X15300065-gr2_lrg.jpg?httpAccept=%2A%2F%2A",
            "@multimediatype": "JPEG image file",
            "@type": "IMAGE-HIGH-RES",
            "@size": "289143",
            "@ref": "gr2",
            "@mimetype": "image/jpeg"
          },
          {
            "@category": "high",
            "@height": "701",
            "@width": "800",
            "@_fa": "true",
            "$": "https://api.elsevier.com/content/object/eid/1-s2.0-S0926860X15300065-gr3_lrg.jpg?httpAccept=%2A%2F%2A",
            "@multimediatype": "JPEG image file",
            "@type": "IMAGE-HIGH-RES",
            "@size": "116479",
            "@ref": "gr3",
            "@mimetype": "image/jpeg"
          },
          {
            "@category": "high",
            "@height": "713",
            "@width": "794",
            "@_fa": "true",
            "$": "https://api.elsevier.com/content/object/eid/1-s2.0-S0926860X15300065-gr4_lrg.jpg?httpAccept=%2A%2F%2A",
            "@multimediatype": "JPEG image file",
            "@type": "IMAGE-HIGH-RES",
            "@size": "120166",
            "@ref": "gr4",
            "@mimetype": "image/jpeg"
          },
          {
            "@category": "high",
            "@height": "746",
            "@width": "797",
            "@_fa": "true",
            "$": "https://api.elsevier.com/content/object/eid/1-s2.0-S0926860X15300065-gr5_lrg.jpg?httpAccept=%2A%2F%2A",
            "@multimediatype": "JPEG image file",
            "@type": "IMAGE-HIGH-RES",
            "@size": "151822",
            "@ref": "gr5",
            "@mimetype": "image/jpeg"
          },
          {
            "@category": "high",
            "@height": "893",
            "@width": "1900",
            "@_fa": "true",
            "$": "https://api.elsevier.com/content/object/eid/1-s2.0-S0926860X15300065-gr6_lrg.jpg?httpAccept=%2A%2F%2A",
            "@multimediatype": "JPEG image file",
            "@type": "IMAGE-HIGH-RES",
            "@size": "264516",
            "@ref": "gr6",
            "@mimetype": "image/jpeg"
          },
          {
            "@category": "high",
            "@height": "697",
            "@width": "800",
            "@_fa": "true",
            "$": "https://api.elsevier.com/content/object/eid/1-s2.0-S0926860X15300065-gr7_lrg.jpg?httpAccept=%2A%2F%2A",
            "@multimediatype": "JPEG image file",
            "@type": "IMAGE-HIGH-RES",
            "@size": "109132",
            "@ref": "gr7",
            "@mimetype": "image/jpeg"
          },
          {
            "@category": "high",
            "@height": "1732",
            "@width": "1800",
            "@_fa": "true",
            "$": "https://api.elsevier.com/content/object/eid/1-s2.0-S0926860X15300065-gr8_lrg.jpg?httpAccept=%2A%2F%2A",
            "@multimediatype": "JPEG image file",
            "@type": "IMAGE-HIGH-RES",
            "@size": "637665",
            "@ref": "gr8",
            "@mimetype": "image/jpeg"
          },
          {
            "@category": "high",
            "@height": "844",
            "@width": "1800",
            "@_fa": "true",
            "$": "https://api.elsevier.com/content/object/eid/1-s2.0-S0926860X15300065-gr9_lrg.jpg?httpAccept=%2A%2F%2A",
            "@multimediatype": "JPEG image file",
            "@type": "IMAGE-HIGH-RES",
            "@size": "191159",
            "@ref": "gr9",
            "@mimetype": "image/jpeg"
          },
          {
            "@category": "thumbnail",
            "@height": "33",
            "@width": "296",
            "@_fa": "true",
            "$": "https://api.elsevier.com/content/object/eid/1-s2.0-S0926860X15300065-si1.gif?httpAccept=%2A%2F%2A",
            "@multimediatype": "GIF image file",
            "@type": "ALTIMG",
            "@size": "1268",
            "@ref": "si1",
            "@mimetype": "image/gif"
          },
          {
            "@category": "thumbnail",
            "@height": "34",
            "@width": "292",
            "@_fa": "true",
            "$": "https://api.elsevier.com/content/object/eid/1-s2.0-S0926860X15300065-si2.gif?httpAccept=%2A%2F%2A",
            "@multimediatype": "GIF image file",
            "@type": "ALTIMG",
            "@size": "1339",
            "@ref": "si2",
            "@mimetype": "image/gif"
          },
          {
            "@category": "thumbnail",
            "@height": "19",
            "@width": "140",
            "@_fa": "true",
            "$": "https://api.elsevier.com/content/object/eid/1-s2.0-S0926860X15300065-si3.gif?httpAccept=%2A%2F%2A",
            "@multimediatype": "GIF image file",
            "@type": "ALTIMG",
            "@size": "540",
            "@ref": "si3",
            "@mimetype": "image/gif"
          },
          {
            "@category": "thumbnail",
            "@height": "19",
            "@width": "75",
            "@_fa": "true",
            "$": "https://api.elsevier.com/content/object/eid/1-s2.0-S0926860X15300065-si4.gif?httpAccept=%2A%2F%2A",
            "@multimediatype": "GIF image file",
            "@type": "ALTIMG",
            "@size": "390",
            "@ref": "si4",
            "@mimetype": "image/gif"
          }
        ]
      },
      "link": {
        "@rel": "abstract",
        "@href": "https://api.elsevier.com/content/abstract/scopus_id/84934968155"
      }
    }
  }
}