{
  "metadata": {
    "title": "Methane dehydroaromatization over molybdenum supported on sulfated zirconia catalysts",
    "authors": "; ; ",
    "journal": "Applied Catalysis A: General",
    "date": "2019-04-05",
    "doi": "10.1016/j.apcata.2019.01.013",
    "abstract": "",
    "uri": "https://api.elsevier.com/content/article/pii/S0926860X19300328",
    "pii": "S0926860X19300328"
  },
  "fulltext": {
    "full-text-retrieval-response": {
      "scopus-eid": "2-s2.0-85061388861",
      "originalText": "serial JL 271346 291210 291744 291809 31 Applied Catalysis A: General APPLIEDCATALYSISAGENERAL 2019-02-01 2019-02-01 2019-02-14 2019-02-14 2019-03-13T08:52:49 1-s2.0-S0926860X19300328 S0926-860X(19)30032-8 S0926860X19300328 10.1016/j.apcata.2019.01.013 S300 S300.1 FULL-TEXT 1-s2.0-S0926860X19X00046 2024-01-01T12:33:10.553292Z 0 0 20190405 2019 2019-02-01T16:06:00.050885Z absattachment articleinfo articletitlenorm authfirstinitialnorm authfirstsurnamenorm cid cids contenttype copyright crossmark dateloaded dateloadedtxt datesearch datesort dateupdated dco docsubtype doctype doi eid ewtransactionid hubeid indexeddate issn issnnorm itemstage itemtransactionid itemweight openaccess openarchive pg pgfirst pglast pii piinorm pubdatestart pubdatetxt pubyr sectiontitle sortorder srctitle srctitlenorm srctype ssids alllist content subj subheadings suppl tomb volfirst volissue volumelist webpdf webpdfpagecount yearnav figure table e-component body mmlmath acknowledge affil appendices articletitle auth authfirstini authfull authkeywords authlast grantsponsor highlightsabst orcid primabst ref specialabst 0926-860X 0926860X true 575 575 C Volume 575 7 25 37 25 37 20190405 5 April 2019 2019-04-05 2019 Regular Papers article fla © 2019 Elsevier B.V. All rights reserved. METHANEDEHYDROAROMATIZATIONOVERMOLYBDENUMSUPPORTEDSULFATEDZIRCONIACATALYSTS KANITKAR S 1 Introduction 2 Experimental 2.1 Materials 2.2 Catalyst preparation 2.3 ICP-OES 2.4 BET 2.5 Raman spectroscopy 2.6 DRIFTS 2.7 Ammonia-TPD 2.8 SEM-EDS 2.9 HRTEM 2.10 XRD measurements 2.11 XPS 2.12 XANES 2.13 Carburization and dehydroaromatization (DHA) 3 Results and discussion 3.1 Physico-chemical properties of the catalyst 3.2 Raman spectroscopy 3.3 DRIFTS 3.4 NH3-TPD 3.5 XPS 3.6 XANES 3.7 HRTEM 4 Reaction data 4.1 Effect of Mo content 4.2 Effect of temperature 4.3 Effect of space velocity 4.4 Comparison with literature 4.5 Temperature programmed oxidation (TPO) 5 Conclusions Acknowledgements Appendix A Supplementary data References MIDDLETON 2017 88 95 R PRESS 2012 A KELLER 1982 9 19 G KUMAR 2016 1 7 N PAKHARE 2014 7813 7837 D OLAH 2013 648 650 G CHOUDHARY 2007 561 564 V CHRISTIANENGER 2008 1 27 B ZHANG 2011 2550 2555 A ZHU 2013 104 109 Q IULIANELLI 2016 1 35 A OLAH 1969 3261 3268 G OLAH 1968 2726 2727 G VASIREDDY 2011 785 787 S HUA 2001 201 207 W FRAENKEL 1999 123 125 D REZGUI 1998 1 2 S GUO 2014 616 619 X WANG 1996 289 297 D WANG 1993 35 41 L WANG 2000 276 283 L GABRIENKO 2017 1818 1830 A GABRIENKO 2015 24910 24918 A LI 2014 7793 7796 L ORO 1966 1393 J SPIVEY 2014 792 803 J ISMAGILOV 2008 526 541 Z SUN 2018 1768 1789 K VOLLMER 2019 39 52 I KUMAR 2018 15577 15582 A KOSINOV 2017 125 133 N AGOTEARAN 2019 473 480 M LEZCANOGONZALEZ 2016 5301 5305 I KOSINOV 2017 520 529 N LUO 2017 99 108 Y ARATAH 2011 K SOLIDSUPERACIDS REDDY 2009 2185 2208 B OLOYE 2016 341 352 F KATADA 2000 10321 10328 N ELSHARKAWY 2007 128 137 E BROWN 1999 109 113 A XIAO 2000 3896 3905 T FERRARI 2007 47 57 A SCHWAN 1996 440 447 J PARRY 1963 371 379 E CHEN 2006 111 120 W LI 2006 244 253 B LIU 1999 386 392 W PATTERSON 1976 1700 1708 T FLEISCH 1982 780 786 T SUZUKI 1981 283 287 K DING 2001 506 513 W ARITANI 2009 736 740 H MATUS 2007 4063 4074 E ISMAGILOV 2010 9 16 Z LIKITH 2018 1223 1233 S DELPORTE 1995 251 267 P MATUS 2009 59 67 E TEMPELMAN 2015 731 739 C HAN 2019 305 318 S SRINIVASAN 1995 123 130 R BI 1996 M THERMALSTUDIESMETALPROMOTEDSULFATEDZIRCONIA KARAKAYA 2016 9895 9906 C XU 2013 2769 2777 Y SKUTIL 2006 511 521 K MA 2003 143 146 H QUERINI 2004 166 209 C CATALYSIS COKECHARACTERIZATION DENARDIN 2019 1293 1300 F KANITKARX2019X25 KANITKARX2019X25X37 KANITKARX2019X25XS KANITKARX2019X25X37XS 2021-02-14T00:00:00.000Z 2021-02-14T00:00:00.000Z http://creativecommons.org/licenses/by-nc-nd/4.0/ © 2019 Elsevier B.V. All rights reserved. item S0926-860X(19)30032-8 S0926860X19300328 1-s2.0-S0926860X19300328 10.1016/j.apcata.2019.01.013 271346 2024-01-01T12:33:10.553292Z 2019-04-05 1-s2.0-S0926860X19300328-main.pdf https://s3.amazonaws.com/prod-ucs-content-store-us-east/content/pii:S0926860X19300328/MAIN/application/pdf/cc9af8dd1e6636563a6e1f169e6eb54d/main.pdf main.pdf pdf true 3672722 MAIN 13 1-s2.0-S0926860X19300328-main_1.png https://s3.amazonaws.com/prod-ucs-content-store-us-east/content/pii:S0926860X19300328/PREVIEW/image/png/ab79f72247771040ffa9e25572f9062a/main_1.png main_1.png png 51961 849 656 IMAGE-WEB-PDF 1 1-s2.0-S0926860X19300328-ga1.sml https://s3.amazonaws.com/prod-ucs-content-store-us-east/content/pii:S0926860X19300328/ga1/THUMBNAIL/image/gif/836bb0da6a2970eff767788d2ed0767f/ga1.sml ga1 true ga1.sml sml 7352 126 219 IMAGE-THUMBNAIL 1-s2.0-S0926860X19300328-gr1.sml https://s3.amazonaws.com/prod-ucs-content-store-us-east/content/pii:S0926860X19300328/gr1/THUMBNAIL/image/gif/a18d29fd538608788a12090e5ba3d869/gr1.sml gr1 gr1.sml sml 6544 123 219 IMAGE-THUMBNAIL 1-s2.0-S0926860X19300328-gr10.sml https://s3.amazonaws.com/prod-ucs-content-store-us-east/content/pii:S0926860X19300328/gr10/THUMBNAIL/image/gif/4e9d76b1bf023b410b91dff529697132/gr10.sml gr10 gr10.sml sml 23296 146 219 IMAGE-THUMBNAIL 1-s2.0-S0926860X19300328-gr11.sml https://s3.amazonaws.com/prod-ucs-content-store-us-east/content/pii:S0926860X19300328/gr11/THUMBNAIL/image/gif/d9b5ccb20cc13224a3d800aa65961afc/gr11.sml gr11 gr11.sml sml 7955 164 212 IMAGE-THUMBNAIL 1-s2.0-S0926860X19300328-gr12.sml https://s3.amazonaws.com/prod-ucs-content-store-us-east/content/pii:S0926860X19300328/gr12/THUMBNAIL/image/gif/5e047b4fb2099f5f32cd7c143141d9c2/gr12.sml gr12 gr12.sml sml 7840 164 212 IMAGE-THUMBNAIL 1-s2.0-S0926860X19300328-gr13.sml https://s3.amazonaws.com/prod-ucs-content-store-us-east/content/pii:S0926860X19300328/gr13/THUMBNAIL/image/gif/353b627d582d54b712ca0622361a4dbe/gr13.sml gr13 gr13.sml sml 5994 164 201 IMAGE-THUMBNAIL 1-s2.0-S0926860X19300328-gr14.sml https://s3.amazonaws.com/prod-ucs-content-store-us-east/content/pii:S0926860X19300328/gr14/THUMBNAIL/image/gif/57ce56d4793c362080b1eba055ad85b5/gr14.sml gr14 gr14.sml sml 6294 164 194 IMAGE-THUMBNAIL 1-s2.0-S0926860X19300328-gr15.sml https://s3.amazonaws.com/prod-ucs-content-store-us-east/content/pii:S0926860X19300328/gr15/THUMBNAIL/image/gif/2163007e65bb390312f2fce79b6ce2f1/gr15.sml gr15 gr15.sml sml 5587 164 200 IMAGE-THUMBNAIL 1-s2.0-S0926860X19300328-gr16.sml https://s3.amazonaws.com/prod-ucs-content-store-us-east/content/pii:S0926860X19300328/gr16/THUMBNAIL/image/gif/859302859ef3712974ac98690fcc280e/gr16.sml gr16 gr16.sml sml 6097 164 198 IMAGE-THUMBNAIL 1-s2.0-S0926860X19300328-gr17.sml https://s3.amazonaws.com/prod-ucs-content-store-us-east/content/pii:S0926860X19300328/gr17/THUMBNAIL/image/gif/76ab9c6171dbb7afa1e015ab8cf7aad7/gr17.sml gr17 gr17.sml sml 6466 164 198 IMAGE-THUMBNAIL 1-s2.0-S0926860X19300328-gr18.sml https://s3.amazonaws.com/prod-ucs-content-store-us-east/content/pii:S0926860X19300328/gr18/THUMBNAIL/image/gif/18e3237eb22f493fbcdf2886bac651e2/gr18.sml gr18 gr18.sml sml 7423 156 219 IMAGE-THUMBNAIL 1-s2.0-S0926860X19300328-gr2.sml https://s3.amazonaws.com/prod-ucs-content-store-us-east/content/pii:S0926860X19300328/gr2/THUMBNAIL/image/gif/ec7f7ae9f3cb04ebafe5e743fda18b59/gr2.sml gr2 gr2.sml sml 10212 151 219 IMAGE-THUMBNAIL 1-s2.0-S0926860X19300328-gr3.sml https://s3.amazonaws.com/prod-ucs-content-store-us-east/content/pii:S0926860X19300328/gr3/THUMBNAIL/image/gif/0fc2543ecf4c218ccb3b4f3bbf0b24b7/gr3.sml gr3 gr3.sml sml 10317 151 219 IMAGE-THUMBNAIL 1-s2.0-S0926860X19300328-gr4.sml https://s3.amazonaws.com/prod-ucs-content-store-us-east/content/pii:S0926860X19300328/gr4/THUMBNAIL/image/gif/257c9ed5da14685673d562ab67d5c685/gr4.sml gr4 gr4.sml sml 4910 154 219 IMAGE-THUMBNAIL 1-s2.0-S0926860X19300328-gr5.sml https://s3.amazonaws.com/prod-ucs-content-store-us-east/content/pii:S0926860X19300328/gr5/THUMBNAIL/image/gif/0c0905b8385548a05a840b50f40938c3/gr5.sml gr5 gr5.sml sml 9270 163 126 IMAGE-THUMBNAIL 1-s2.0-S0926860X19300328-gr6.sml https://s3.amazonaws.com/prod-ucs-content-store-us-east/content/pii:S0926860X19300328/gr6/THUMBNAIL/image/gif/4b7de91fe4a1daa582141999d619b51c/gr6.sml gr6 gr6.sml sml 5432 164 166 IMAGE-THUMBNAIL 1-s2.0-S0926860X19300328-gr7.sml https://s3.amazonaws.com/prod-ucs-content-store-us-east/content/pii:S0926860X19300328/gr7/THUMBNAIL/image/gif/077ad283c43d5daee202262d3675c562/gr7.sml gr7 gr7.sml sml 22578 146 219 IMAGE-THUMBNAIL 1-s2.0-S0926860X19300328-gr8.sml https://s3.amazonaws.com/prod-ucs-content-store-us-east/content/pii:S0926860X19300328/gr8/THUMBNAIL/image/gif/2f3fb810c91bb18cdbaeacd1945c8610/gr8.sml gr8 gr8.sml sml 21315 146 219 IMAGE-THUMBNAIL 1-s2.0-S0926860X19300328-gr9.sml https://s3.amazonaws.com/prod-ucs-content-store-us-east/content/pii:S0926860X19300328/gr9/THUMBNAIL/image/gif/4bcd4c3f79d8dd573af2bed9237acfee/gr9.sml gr9 gr9.sml sml 21918 146 219 IMAGE-THUMBNAIL 1-s2.0-S0926860X19300328-ga1.jpg https://s3.amazonaws.com/prod-ucs-content-store-us-east/content/pii:S0926860X19300328/ga1/DOWNSAMPLED/image/jpeg/aca6f81abf00c6d8d25a7a44614dbd2e/ga1.jpg ga1 true ga1.jpg jpg 18219 200 347 IMAGE-DOWNSAMPLED 1-s2.0-S0926860X19300328-gr1.jpg https://s3.amazonaws.com/prod-ucs-content-store-us-east/content/pii:S0926860X19300328/gr1/DOWNSAMPLED/image/jpeg/f098d53a5058790808bb0dafb8d760b3/gr1.jpg gr1 gr1.jpg jpg 30431 277 491 IMAGE-DOWNSAMPLED 1-s2.0-S0926860X19300328-gr10.jpg https://s3.amazonaws.com/prod-ucs-content-store-us-east/content/pii:S0926860X19300328/gr10/DOWNSAMPLED/image/jpeg/0ec77aa123177a976ace8d397bb08ba5/gr10.jpg gr10 gr10.jpg jpg 59852 327 491 IMAGE-DOWNSAMPLED 1-s2.0-S0926860X19300328-gr11.jpg https://s3.amazonaws.com/prod-ucs-content-store-us-east/content/pii:S0926860X19300328/gr11/DOWNSAMPLED/image/jpeg/2aa79a2ba358a2612633172b0e2933c2/gr11.jpg gr11 gr11.jpg jpg 24815 262 338 IMAGE-DOWNSAMPLED 1-s2.0-S0926860X19300328-gr12.jpg https://s3.amazonaws.com/prod-ucs-content-store-us-east/content/pii:S0926860X19300328/gr12/DOWNSAMPLED/image/jpeg/8e001bcbf96a3d2563609758e3565713/gr12.jpg gr12 gr12.jpg jpg 23809 261 339 IMAGE-DOWNSAMPLED 1-s2.0-S0926860X19300328-gr13.jpg https://s3.amazonaws.com/prod-ucs-content-store-us-east/content/pii:S0926860X19300328/gr13/DOWNSAMPLED/image/jpeg/af0d81179b06fedceca3d2ccbab26612/gr13.jpg gr13 gr13.jpg jpg 20199 277 339 IMAGE-DOWNSAMPLED 1-s2.0-S0926860X19300328-gr14.jpg https://s3.amazonaws.com/prod-ucs-content-store-us-east/content/pii:S0926860X19300328/gr14/DOWNSAMPLED/image/jpeg/599c7cda99c20c5ea57bf9ee774eff20/gr14.jpg gr14 gr14.jpg jpg 21685 286 339 IMAGE-DOWNSAMPLED 1-s2.0-S0926860X19300328-gr15.jpg https://s3.amazonaws.com/prod-ucs-content-store-us-east/content/pii:S0926860X19300328/gr15/DOWNSAMPLED/image/jpeg/d05052a4568e3f84cd44f55532fde739/gr15.jpg gr15 gr15.jpg jpg 19169 278 339 IMAGE-DOWNSAMPLED 1-s2.0-S0926860X19300328-gr16.jpg https://s3.amazonaws.com/prod-ucs-content-store-us-east/content/pii:S0926860X19300328/gr16/DOWNSAMPLED/image/jpeg/d753b2e2ee775c1df15bd1eec69b5fbc/gr16.jpg gr16 gr16.jpg jpg 20828 281 339 IMAGE-DOWNSAMPLED 1-s2.0-S0926860X19300328-gr17.jpg https://s3.amazonaws.com/prod-ucs-content-store-us-east/content/pii:S0926860X19300328/gr17/DOWNSAMPLED/image/jpeg/8b708d92f69036e95cbccb0da3e145a7/gr17.jpg gr17 gr17.jpg jpg 22041 280 339 IMAGE-DOWNSAMPLED 1-s2.0-S0926860X19300328-gr18.jpg https://s3.amazonaws.com/prod-ucs-content-store-us-east/content/pii:S0926860X19300328/gr18/DOWNSAMPLED/image/jpeg/aff1445bfd2b3b94da29d74bdb0a5a2a/gr18.jpg gr18 gr18.jpg jpg 24464 348 489 IMAGE-DOWNSAMPLED 1-s2.0-S0926860X19300328-gr2.jpg https://s3.amazonaws.com/prod-ucs-content-store-us-east/content/pii:S0926860X19300328/gr2/DOWNSAMPLED/image/jpeg/a8a9638785fcd5b6d0e376f8843e1d36/gr2.jpg gr2 gr2.jpg jpg 33493 339 490 IMAGE-DOWNSAMPLED 1-s2.0-S0926860X19300328-gr3.jpg https://s3.amazonaws.com/prod-ucs-content-store-us-east/content/pii:S0926860X19300328/gr3/DOWNSAMPLED/image/jpeg/151189dc8b0a5e00f70c7e565f784b6f/gr3.jpg gr3 gr3.jpg jpg 34914 334 486 IMAGE-DOWNSAMPLED 1-s2.0-S0926860X19300328-gr4.jpg https://s3.amazonaws.com/prod-ucs-content-store-us-east/content/pii:S0926860X19300328/gr4/DOWNSAMPLED/image/jpeg/dcc6f2983351976b20eda05ea43e0ad9/gr4.jpg gr4 gr4.jpg jpg 23331 344 489 IMAGE-DOWNSAMPLED 1-s2.0-S0926860X19300328-gr5.jpg https://s3.amazonaws.com/prod-ucs-content-store-us-east/content/pii:S0926860X19300328/gr5/DOWNSAMPLED/image/jpeg/1edec15a903736fd75e6148786ee4f9b/gr5.jpg gr5 gr5.jpg jpg 47447 439 339 IMAGE-DOWNSAMPLED 1-s2.0-S0926860X19300328-gr6.jpg https://s3.amazonaws.com/prod-ucs-content-store-us-east/content/pii:S0926860X19300328/gr6/DOWNSAMPLED/image/jpeg/1dad2106899bfbcfd4b85bce09064473/gr6.jpg gr6 gr6.jpg jpg 34124 484 490 IMAGE-DOWNSAMPLED 1-s2.0-S0926860X19300328-gr7.jpg https://s3.amazonaws.com/prod-ucs-content-store-us-east/content/pii:S0926860X19300328/gr7/DOWNSAMPLED/image/jpeg/7242c3c9eeb58c7006212edb8e584117/gr7.jpg gr7 gr7.jpg jpg 61235 328 491 IMAGE-DOWNSAMPLED 1-s2.0-S0926860X19300328-gr8.jpg https://s3.amazonaws.com/prod-ucs-content-store-us-east/content/pii:S0926860X19300328/gr8/DOWNSAMPLED/image/jpeg/91d35dab21a02fa0e930503b0e775706/gr8.jpg gr8 gr8.jpg jpg 47323 328 491 IMAGE-DOWNSAMPLED 1-s2.0-S0926860X19300328-gr9.jpg https://s3.amazonaws.com/prod-ucs-content-store-us-east/content/pii:S0926860X19300328/gr9/DOWNSAMPLED/image/jpeg/2502598e62a30d99353281585ad1b532/gr9.jpg gr9 gr9.jpg jpg 50582 328 491 IMAGE-DOWNSAMPLED 1-s2.0-S0926860X19300328-ga1_lrg.jpg https://s3.amazonaws.com/prod-ucs-content-store-us-east/content/pii:S0926860X19300328/ga1/HIGHRES/image/jpeg/2e31bfbb00f8e71bf95c41fb6320ca40/ga1_lrg.jpg ga1 true ga1_lrg.jpg jpg 121651 886 1536 IMAGE-HIGH-RES 1-s2.0-S0926860X19300328-gr1_lrg.jpg https://s3.amazonaws.com/prod-ucs-content-store-us-east/content/pii:S0926860X19300328/gr1/HIGHRES/image/jpeg/4d35afcbd39ac5d813417828b11a8065/gr1_lrg.jpg gr1 gr1_lrg.jpg jpg 249145 1226 2175 IMAGE-HIGH-RES 1-s2.0-S0926860X19300328-gr10_lrg.jpg https://s3.amazonaws.com/prod-ucs-content-store-us-east/content/pii:S0926860X19300328/gr10/HIGHRES/image/jpeg/f83ddce78f77f468f63a7829b2a2f57b/gr10_lrg.jpg gr10 gr10_lrg.jpg jpg 829091 1450 2175 IMAGE-HIGH-RES 1-s2.0-S0926860X19300328-gr11_lrg.jpg https://s3.amazonaws.com/prod-ucs-content-store-us-east/content/pii:S0926860X19300328/gr11/HIGHRES/image/jpeg/d132f2e362ea866d7cb5b72bfa6cb69b/gr11_lrg.jpg gr11 gr11_lrg.jpg jpg 191620 1161 1499 IMAGE-HIGH-RES 1-s2.0-S0926860X19300328-gr12_lrg.jpg https://s3.amazonaws.com/prod-ucs-content-store-us-east/content/pii:S0926860X19300328/gr12/HIGHRES/image/jpeg/b512f8ee2ecb16279bd9524d51d1bad1/gr12_lrg.jpg gr12 gr12_lrg.jpg jpg 183897 1157 1500 IMAGE-HIGH-RES 1-s2.0-S0926860X19300328-gr13_lrg.jpg https://s3.amazonaws.com/prod-ucs-content-store-us-east/content/pii:S0926860X19300328/gr13/HIGHRES/image/jpeg/035cc356e0e25b62251c1301874635c2/gr13_lrg.jpg gr13 gr13_lrg.jpg jpg 150652 1226 1502 IMAGE-HIGH-RES 1-s2.0-S0926860X19300328-gr14_lrg.jpg https://s3.amazonaws.com/prod-ucs-content-store-us-east/content/pii:S0926860X19300328/gr14/HIGHRES/image/jpeg/d0983bb94b30eb229323ab081d503c41/gr14_lrg.jpg gr14 gr14_lrg.jpg jpg 160893 1266 1502 IMAGE-HIGH-RES 1-s2.0-S0926860X19300328-gr15_lrg.jpg https://s3.amazonaws.com/prod-ucs-content-store-us-east/content/pii:S0926860X19300328/gr15/HIGHRES/image/jpeg/45a17abff7950849c1a33edab39ecdff/gr15_lrg.jpg gr15 gr15_lrg.jpg jpg 139693 1229 1500 IMAGE-HIGH-RES 1-s2.0-S0926860X19300328-gr16_lrg.jpg https://s3.amazonaws.com/prod-ucs-content-store-us-east/content/pii:S0926860X19300328/gr16/HIGHRES/image/jpeg/05a62afa26512335f4ac97e79ad1e12c/gr16_lrg.jpg gr16 gr16_lrg.jpg jpg 153167 1243 1501 IMAGE-HIGH-RES 1-s2.0-S0926860X19300328-gr17_lrg.jpg https://s3.amazonaws.com/prod-ucs-content-store-us-east/content/pii:S0926860X19300328/gr17/HIGHRES/image/jpeg/32aec0cb3abb3aeb37dec6d2e98f1bf6/gr17_lrg.jpg gr17 gr17_lrg.jpg jpg 159333 1241 1500 IMAGE-HIGH-RES 1-s2.0-S0926860X19300328-gr18_lrg.jpg https://s3.amazonaws.com/prod-ucs-content-store-us-east/content/pii:S0926860X19300328/gr18/HIGHRES/image/jpeg/055b36f7de356a2419264ce3061915cc/gr18_lrg.jpg gr18 gr18_lrg.jpg jpg 229368 1543 2167 IMAGE-HIGH-RES 1-s2.0-S0926860X19300328-gr2_lrg.jpg https://s3.amazonaws.com/prod-ucs-content-store-us-east/content/pii:S0926860X19300328/gr2/HIGHRES/image/jpeg/5cc4ef821f8dc2e3386dbea3db409da0/gr2_lrg.jpg gr2 gr2_lrg.jpg jpg 317638 1502 2172 IMAGE-HIGH-RES 1-s2.0-S0926860X19300328-gr3_lrg.jpg https://s3.amazonaws.com/prod-ucs-content-store-us-east/content/pii:S0926860X19300328/gr3/HIGHRES/image/jpeg/344138782015b1b31c757068a9753227/gr3_lrg.jpg gr3 gr3_lrg.jpg jpg 328385 1481 2152 IMAGE-HIGH-RES 1-s2.0-S0926860X19300328-gr4_lrg.jpg https://s3.amazonaws.com/prod-ucs-content-store-us-east/content/pii:S0926860X19300328/gr4/HIGHRES/image/jpeg/abd1eb11d954dc68fcc00b9506c3d9d3/gr4_lrg.jpg gr4 gr4_lrg.jpg jpg 180793 1523 2168 IMAGE-HIGH-RES 1-s2.0-S0926860X19300328-gr5_lrg.jpg https://s3.amazonaws.com/prod-ucs-content-store-us-east/content/pii:S0926860X19300328/gr5/HIGHRES/image/jpeg/48f8b2d0626d17ecf7fe84b1af211d02/gr5_lrg.jpg gr5 gr5_lrg.jpg jpg 453868 1946 1502 IMAGE-HIGH-RES 1-s2.0-S0926860X19300328-gr6_lrg.jpg https://s3.amazonaws.com/prod-ucs-content-store-us-east/content/pii:S0926860X19300328/gr6/HIGHRES/image/jpeg/8e0ede939ab7423e45bbc25c92a8de0d/gr6_lrg.jpg gr6 gr6_lrg.jpg jpg 263323 2144 2169 IMAGE-HIGH-RES 1-s2.0-S0926860X19300328-gr7_lrg.jpg https://s3.amazonaws.com/prod-ucs-content-store-us-east/content/pii:S0926860X19300328/gr7/HIGHRES/image/jpeg/671fe81874bdbd023274a74714ac5dc9/gr7_lrg.jpg gr7 gr7_lrg.jpg jpg 899193 1452 2175 IMAGE-HIGH-RES 1-s2.0-S0926860X19300328-gr8_lrg.jpg https://s3.amazonaws.com/prod-ucs-content-store-us-east/content/pii:S0926860X19300328/gr8/HIGHRES/image/jpeg/9c3919614fd00a0e6b93e797196ba715/gr8_lrg.jpg gr8 gr8_lrg.jpg jpg 735193 1452 2175 IMAGE-HIGH-RES 1-s2.0-S0926860X19300328-gr9_lrg.jpg https://s3.amazonaws.com/prod-ucs-content-store-us-east/content/pii:S0926860X19300328/gr9/HIGHRES/image/jpeg/ba0589963d5ecfee09be0b2c671acbee/gr9_lrg.jpg gr9 gr9_lrg.jpg jpg 616000 1451 2175 IMAGE-HIGH-RES 1-s2.0-S0926860X19300328-mmc1.docx https://s3.amazonaws.com/prod-ucs-content-store-us-east/content/pii:S0926860X19300328/mmc1/MAIN/application/vnd.openxmlformats-officedocument.wordprocessingml.document/2b33b01df2c981c982f9553a12ca8aa6/mmc1.docx mmc1 mmc1.docx docx 1930840 APPLICATION 1-s2.0-S0926860X19300328-si1.gif https://s3.amazonaws.com/prod-ucs-content-store-us-east/content/pii:S0926860X19300328/STRIPIN/image/gif/07067664f592662c46be710eff4dc0d8/si1.gif si1 si1.gif gif 1608 31 568 ALTIMG 1-s2.0-S0926860X19300328-si2.gif https://s3.amazonaws.com/prod-ucs-content-store-us-east/content/pii:S0926860X19300328/STRIPIN/image/gif/1d4461d244445472aa300c9368788b51/si2.gif si2 si2.gif gif 1130 43 365 ALTIMG 1-s2.0-S0926860X19300328-si3.gif https://s3.amazonaws.com/prod-ucs-content-store-us-east/content/pii:S0926860X19300328/STRIPIN/image/gif/9682bcd148cb671960bcb8e3abf6fae6/si3.gif si3 si3.gif gif 1182 46 376 ALTIMG 1-s2.0-S0926860X19300328-si4.gif https://s3.amazonaws.com/prod-ucs-content-store-us-east/content/pii:S0926860X19300328/STRIPIN/image/gif/0d05a48574336ba76fc7fd9aeb635fa2/si4.gif si4 si4.gif gif 1483 46 461 ALTIMG 1-s2.0-S0926860X19300328-am.pdf https://s3-eu-west-1.amazonaws.com/prod-ucs-content-store-eu-west/content/egi:10JT1FXDRQ3/MAIN/application/pdf/5e3b61638c68041b92378efb852754e6/am.pdf https://s3.amazonaws.com/prod-ucs-content-store-us-east/content/egi:10JT1FXDRQ3/MAIN/application/pdf/5e3b61638c68041b92378efb852754e6/am.pdf am am.pdf pdf false 3651642 AAM-PDF APCATA 16953 S0926-860X(19)30032-8 10.1016/j.apcata.2019.01.013 Elsevier B.V. Fig. 1 Oxidative conversion routes of methane to higher hydrocarbons. Fig. 1 Fig. 2 Raman spectra for samples at various treatment (a) base SZ, (b) fresh 5%Mo/SZ, (c) carburized 5%Mo/SZ, (d) spent 5%Mo/SZ. Fig. 2 Fig. 3 Comparison of SZ and Mo doped SZ catalysts after pyridine desorption at 100 °C (a) SZ, (b) 1% Mo/SZ, (c) 5% Mo/SZ, “B” = Brønsted, “L” = Lewis. Fig. 3 Fig. 4 NH3-TPD comparison for all the catalysts (a) SZ, (b) 1% Mo/SZ, and (c) 5% Mo/SZ. Values next to each curve represent quantity of NH3 desorbed per gram of catalyst. Fig. 4 Fig. 5 XPS comparison of Mo 3d for (a) MoO3 std., (b) Fresh 5%Mo/SZ (oxide form), (c) Carburized 5% Mo/SZ, (d) Spent 5%Mo/SZ (after reaction for 1000 min at 650 °C), (e) β-Mo2C std., (f) MoO2 std., (g) MoS2 std., (h) Mo metal powder std. Fig. 5 Fig. 6 K-edge XANES spectra for catalyst samples: (a) MoO3 – std., (b) Fresh 5%Mo/SZ (oxidized form), (c) Carburized 5%Mo/SZ, (d) Spent 5%Mo/SZ, (e) Mo2C-std. Fig. 6 Fig. 7 HRTEM for base sulfated zirconia (SZ). Fig. 7 Fig. 8 HRTEM for fresh 5% Mo/SZ catalyst. Fig. 8 Fig. 9 HRTEM for carburized 5% Mo/SZ catalyst. Fig. 9 Fig. 10 HRTEM for spent 5% Mo/SZ catalyst. Fig. 10 Fig. 11 Reaction data for methane DHA over 1% Mo/SZ catalyst (650 °C, 1 atm, 0.6 L gcat−1 h−1). *Npt = Naphthalene. Fig. 11 Fig. 12 Reaction data for methane DHA over 5% Mo/SZ catalyst (650 °C, 1 atm, 600 ml/gcat-h). Fig. 12 Fig. 13 Effect of temperature on ethylene selectivity over 5% Mo/SZ catalyst (0.6 L gcat−1 h−1, 1 atm). Fig. 13 Fig. 14 Effect of temperature on benzene selectivity over 5% Mo/SZ catalyst (1 atm, 0.6 L gcat−1 h−1). Fig. 14 Fig. 15 Effect of space velocity on CH4 conversion over 5% Mo/SZ catalyst (650 °C, 1 atm). Space velocity (SV) has units of L gcat−1 h−1. Fig. 15 Fig. 16 Effect of space velocity on ethylene selectivity over 5% Mo/SZ catalyst (650 °C, 1 atm). SV has units of L gcat−1 h−1. Fig. 16 Fig. 17 Effect of space velocity on benzene selectivity over 5% Mo/SZ catalyst (650 °C, 1 atm). SV has units of L gcat−1 h−1. Fig. 17 Fig. 18 TPO profiles for the two spent catalysts (after DHA reaction for 16 h at 650 °C, 0.6 L gcat−1 h−1, 1 atm). Fig. 18 Table 1 Physico-chemical properties of Mo/SZ. Table 1 Catalyst Mo loading, % (intended) Mo loading, wt%(ICP) Mo loading,wt%(EDS) S loading,wt%(ICP) BET Surface Area (m2/g) SZ 0 0 0 3.5 84 1%Mo/SZ 1 0.84 1.6 2.99 87 5% Mo/SZ 5 3.92 4.5 1.95 76 Table 2 Effect of temperature on CH4 DHA over 5% Mo/SZ catalyst (1 atm, 0.6 L gcat−1h−1). Results are at 2 h into the reaction. Table 2 Temperature (oC) CH4 conversion (%) Aromatics selectivity (%) Aliphatics selectivity (%) Naphthalene + coke selectivity (%) 600 5.43 16.0 16.3 67.6 650 17.0 14.0 9.4 76.6 700 20.2 11.0 10.7 78.2 Table 3 Comparison of reaction performance with literature. Table 3 Catalyst Mo content (wt%) Temperature(oC) Space velocity (L gcat−1 h−1) Max. Benzene yield (%) Reference Mo/H-ZSM-5 6 675 1.5 3 [63] Mo/H-ZSM-5 6 700 1.5 6 [63] Mo/H-ZSM-5 5 700 1.5 6 [60] Mo/H-ZSM-5 5 700 0.8 a 11 [31] Mo/H-Mordenite 5 700 2.0 a 0.5 [34] Mo/H-SSZ-13 5 700 2.0 a negligible [34] Mo/SZ 5 650 1.2 1.8 Current work Mo/SZ 5 700 0.6 3 Current work a Units of h−1. Table 4 Quantification of coke using TPO (after ˜ 16 h on stream at 650 °C, 1 atm). Table 4 Catalyst Amount of coke deposited (mmol/gcat) 1% Mo/SZ 5.80 5% Mo/SZ 10.5 Methane dehydroaromatization over molybdenum supported on sulfated zirconia catalysts Swarom Kanitkar Md Ashraful Abedin Srikar Bhattar James J. Spivey ⁎ Cain Department of Chemical Engineering, Louisiana State University, Baton Rouge, LA 70803, USA Cain Department of Chemical Engineering Louisiana State University Baton Rouge LA 70803 USA ⁎ Corresponding author. Graphical abstract The shale gas revolution has strongly impacted the world by providing a significant incentive for research in natural gas conversion. Natural gas is becoming an important feedstock for the production of valuable chemicals. Dehydroaromatization (DHA) is an important non-oxidative conversion route for methane conversion, and Mo doped on the H-ZSM-5 or H-MCM-22 have been well-studied for this reaction. In these catalysts, Mo sites activate CH4 to form dimeric species that are subsequently oligomerized on the strong Brønsted acid sites. In the present study, Mo is doped on solid sulfated zirconia (SZ) to create a catalyst similar to Mo/H-ZSM-5, but with a different solid acid. Despite the logic of using SZ as the acid, we are aware of no systematic study of Mo/SZ catalysts for this reaction. These catalysts were characterized using Raman, XPS, DRIFTS, SEM-EDS, HRTEM, XRD, XANES and other temperature programmed techniques. Raman spectra confirmed the formation of Mo = O and OMoO bonds on the surface of SZ support. DRIFTS confirmed that there was little difference in acid sites when Mo was doped on SZ, except at higher Mo loadings. XPS, XANES, and HRTEM analysis showed that MoO3 is converted to MoOxCy and is further converted to Mo2C as the reaction progresses. Further, these catalysts were evaluated for methane DHA reaction. All of these catalysts showed methane conversions of 5–20 % at temperatures of 600–700 °C. In each case, the catalysts deactivated steadily, attributable to strong coking on the surface, as confirmed with TPO. A comparison with literature showed that Mo/SZ has comparable activity to Mo/H-ZSM-5 at around 650 °C–675 °C temperature range. Further, Mo/SZ was more selective towards heavier aromatics such as naphthalene and coke as compared to Mo/H-ZSM-5 at 700 °C, which is more selective towards benzene. Keywords Dehydroaromatization Sulfated zirconia Natural gas Methane conversion 1 Introduction The conversion of methane into higher value chemicals is one of the grand challenges of 21st century. The shale gas revolution has made these immense, previously unattainable resources of natural gas accessible and economically competitive. Natural gas is considered to be a cleaner source than other conventional fuels such as coal and oil. This has helped some countries such as USA to reduce its CO2 emissions by direct application of natural gas in the power plants [1,2]. Conventional end-uses of natural gas include power generation or flaring, but it can also be used as a feedstock for the production of higher-value chemicals. Conversion of methane into higher-value chemicals has been long sought by researchers, but with limited success and generally with only incremental improvements. The principal processes for conversion of methane can be categorized into non-oxidative or oxidative. Examples of oxidative route are as shown in Fig. 1 . These include OCM (Oxidative Coupling of Methane) [3], Reforming (Dry/Bi/Oxy/Steam) [4–7], (PO) Partial Oxidation [8], Halogenation [9] or even Sulfidation [10]. Except for Steam Reforming of Methane (SRM) and Fisher Tropsch (FT), none of the other oxidative processes are commercialized and are often limited by the net yields of desired products. Though commercially practiced, SRM produces a syngas (CO+H2) mixture, which is subsequently converted into higher hydrocarbons, via processes such as Fisher Tropsch synthesis. Reforming processes produce commercially practical yields only at temperatures of 700–800 °C, which often results into high energy requirements and thus high costs [11]. On the contrary, non-oxidative conversion routes are based on a single step, thus requiring lesser energy and less cost. Some of the attempts involve use of what is known as superacids: HF-FSO3H [12,13], HF-SbF5 [12,13] or HBr-AlBr3 [14] or sulfated zirconia (SZ) [15–17]. Other significant recent attempts involved use of lattice confined single Fe sites [18], use of metal modified zeolites (Mo [19,20], Re [21], Ag [22], Zn [23]), or even recently using GaN nanowires under UV irradiation [24]. One of the potentially most important non-oxidative methane conversion process is dehydroaromatization (DHA), the oligomerization of methane to benzene and hydrogen. (1) 6 C H 4 ↔ C 6 H 6 ( g ) + 9 H 2 ↑ ( Δ G 298 K = + 433 k J / m o l , Δ H 298 K = + 530 k J / m o l ) DHA was first reported around 1966 in which methane was passed over silica gel at temperatures of around 1000 °C, with aromatic yields of 4–6 % [25]. It was not until 1990s that DHA attracted attention [19,20]. Molecular sieves such as H-ZSM-5 zeolite and H-MCM-22 have been shown to be the most active supports for this reaction [26–28]. Many reports based on doping of noble metals such as Mo, Re, or W into these supports for the aromatization of methane have also been reported [29]. Nevertheless, the literature shows that Mo-doped catalysts have been the most widely-studied catalysts for DHA. Despite a great deal of research, and significant improvements to the process, e.g., using membranes to separate hydrogen, DHA has not yet been commercialized [30–32]. It is widely accepted that active molybdenum oxycarbide or carbide species are generated in-situ under reducing reaction conditions and under the flow of methane [26,27]. These species can also be intentionally generated using other carbon sources (CO2/CO) under H2 flow [26,27]. Even though the nature of active species oxycarbidic/carbidic is not fully understood [29], it is commonly believed that exchanged molybdenum [33] species activate methane by activating one of the C–H bonds that lead to the formation of CHx species, forming a dimer: C2Hy. This dimer is then oligomerized and cyclized into higher hydrocarbons and aromatics on the Brønsted acid sites (BAS) of the molecular sieve. This mechanism has been opened for debate as to whether it is bifunctional or monofunctional, based on one study [34]. Regardless, this typical bifunctional mechanism can be depicted as shown in Eq. (2) (BAS = Brønsted acid site) [26]: (2) C H 4 ↔ M o s i t e C 2 H y ↔ B A S C 6 H 6 + C 7 H 8 + C 8 H 10 + H 2 There are a number of solid acids that could, in principle, catalyze the C2Hy species. For example, sulfated zirconia (SZ) is a well-known solid superacid that has been studied and a number of variations have been produced (mesoporous, nanosized, e.g.) [35–37]. SZ possesses strong BAS that can play a key role in the oligomerization of dimeric species. In principle, a similar bifunctional catalyst could be synthesized if Mo is doped onto a solid acid. Although doping of Mo on SZ is not novel [38]; to the best of our knowledge, no study has shown DHA of methane on these catalysts. The present work tests these Mo/SZ catalysts for DHA of methane and also the effect of Mo loading at reaction conditions of interest. For this purpose, 3 different catalysts were synthesized: SZ (w/o Mo), and two Mo loaded SZ catalysts with two different loadings of Mo (1%, 5%). These catalysts were further evaluated for DHA and were characterized using spectroscopic techniques including Raman, DRIFTS, XRD, SEM-EDS, XANES, HRTEM, XPS. The hypothesis is that an active DHA catalyst can be prepared based on Mo/SZ, incorporating the requisite metal and acid sites for this reaction. 2 Experimental 2.1 Materials Zirconium hydroxide, Zr(OH)4 (97%) and ammonium molybdate tetrahydrate (NH4)6Mo7O24.4H2O were both purchased from Sigma Aldrich Inc. H2SO4 (95–98.0 %) was purchased from Malinckrodt Chemicals Inc. Ultra-high purity grade H2, CH4, Ar, and 10% O2/He were all purchased from Airgas Inc. NH4-ZSM-5 (Si/Al = 50:1) was purchased from Alfa Aesar Inc. All Mo standards (Mo powder, MoS2, MoO3, MoO2, β-Mo2C) were purchased from Alfa Aesar Inc. with a purity of 99+%. 2.2 Catalyst preparation Sulfated zirconia was prepared based on literature methods [36]. In a typical preparation, about 35 g of Zr(OH)4 was mixed with 500 ml of 0.5 M H2SO4 solution and the mixture was stirred for 2 h, followed by vacuum filtration and subsequently dried overnight at 110 °C. The dried catalyst powder was then calcined at 550 °C for 4 h under static air to get the sulfated zirconia catalyst. Different loading of molybdenum were incorporated onto sulfated zirconia using standard impregnation method. In a typical preparation, known quantity of ammonium molybdate tetrahydrate was dissolved in 50 ml of water and to this solution, appropriate quantity of sulfated zirconia was added and the solution was stirred for 2 h after which a similar procedure of vacuum filtration, overnight drying (110 °C) and calcination at 550 °C for 4 h in static air was followed. This yielded the final Mo supported on sulfated zirconia catalysts. Similar procedure was also used for preparing Mo supported on H-ZSM-5 catalysts. For H-ZSM-5 preparation, as purchased NH4-ZSM-5 was calcined at 550 °C for 4 h under static air. 2.3 ICP-OES Inductively coupled plasma – optical emission spectroscopy (ICP-OES) was carried out using Varian-MPX spectrophotometer in Wetland Biogeochemical Lab at LSU Oceanography. The digestions of samples were carried out using a mixture of borate flux: Lithium Tetraborate (49.75 wt%), Lithium Metaborate (49.75 wt%), and Lithium Iodide (0.5 wt%). In a typical procedure, 0.2 g of catalyst sample was mixed with 2 g of borate flux mixture. This mixture was fused in a furnace at 1000 °C and subsequently dissolved in a warm 10% HNO3 solution. This solution was diluted subsequently and used for ICP-OES analysis. 2.4 BET Breauner Emmett Teller (BET) surface area analysis was done using Altamira AMI-200 catalyst characterization system using N2 monolayer adsorption. Three-point BET with 10%, 20% and 30% N2 concentrations in Helium was used to estimate the surface areas of these catalysts. 2.5 Raman spectroscopy Analysis by Raman spectroscopy for all catalyst samples was carried out using Renishaw inVia Raman microscope equipped with a 532 nm (green) laser. Spectra measurements were carried out at 10 mW power and with 50 μm slit aperture. 2.6 DRIFTS Diffuse Reflectance Infrared Fourier Transform Spectroscopy (DRIFTS) experiment using pyridine as a probe molecule was carried out in a Thermo Scientific Nicolet 6700 FTIR equipped with Harrick Praying Mantis reaction cell fitted with KBr windows. Spectra of all the samples were recorded with a spectral resolution of 4 cm−1 in region going from 4000 – 650 cm−1. In a typical experiment, IR cell was loaded with the catalyst sample inside the glovebox. Sample was then brought on stream and pretreated at 100 °C for 30 min under He flow to clean the surface of the catalyst from adsorbed impurities. After pretreatment, sample was cooled down to 25 °C and a background spectrum was recorded. At this temperature, catalyst was saturated with pyridine vapors for 3 h. Saturated sample was then treated under He flow for 30 min to remove physisorbed pyridine from the catalyst surface and from the cell chamber. Sample was then treated at 100 °C for 10 min under He flow and cooled back to room temperature and the actual spectrum was recorded. Similar spectra were recorded at room temperature after 10 min. treatments at 200 °C, 300 °C, and 400 °C to check the thermal stability of the acid sites on catalysts. 2.7 Ammonia-TPD Ammonia-TPD was carried out using Altamira AMI-200 reactor system in conjunction with Ametek Mass Spectrometer (MS). Typically 50 mg of catalyst was weighed and loaded in a quartz tube reactor. Catalyst was pretreated at 100 °C for 30 min under He flow to clean the catalyst surface. After pretreatment, sample was cooled down to 50 °C, and ammonia was adsorbed by flowing it through the catalyst bed for 1 h. Post ammonia adsorption, 25 sccm of He was flown for 40 min to remove any physisorbed/residual ammonia. At this time, Mass Spectrometer and TCD detector were turned on and the temperature was ramped up at 10 °C/min. from 50 °C to 500 °C. The TCD signal is usually a combination of signals from various gases that are generated or are being flowed in the system. In order to clearly distinguish various gases coming out, MS was used to track signals for following masses: 4, 16, 17, 18, 27, 32, and 82. Based on ammonia (m/e = 16) signals from MS with respect to temperature, amounts of ammonia desorbed and peak positions were calculated. 2.8 SEM-EDS SEM analysis of the samples was done at LSU Shared Instrument Facilities (SIF) using FEI quanta 3D FIB/SEM equipped with Ametek EDAX accessory. Samples were analyzed at a voltage of 5 kV and at a resolution of 3 μm. 2.9 HRTEM High Resolution Transmission Electron Microscopy (HRTEM) was used to study these type of catalysts. This was particularly useful in confirming the loading of Mo onto the sulfated zirconia sample and also to confirm the formation of Mo2C after carburization of the fresh catalysts was done. HRTEM scans of these catalysts were obtained using JEOL JEM-2011 Scanning TEM at an accelerating voltage of 200 kV. 2.10 XRD measurements X-ray diffraction (XRD) measurements for all the samples was carried out using PANAnalytical EMPYREAN diffractometer with Cu Kα radiation. Sample was collected by scanning the data from 5° to 90° with a step size of 0.026 sec/pt. Data analysis of XRD of all samples was done using PANAnalytical X’Pert software. 2.11 XPS X-ray Photoelectron Spectroscopy (XPS) for the samples was performed at Shared Instruments Facility (SIF) in LSU. All the analyses were performed on Scienta Omicron ESCA 2SR instrument with Mg as an X-ray source at 15 kV and at a pass energy of 40. Post processing of XPS data was performed using CasaXPS software. 2.12 XANES X-ray Absorption Near Edge Spectroscopy (XANES) studies of the catalyst were performed at the electron storage ring of J. Bennett Johnston, Sr., Center for Advanced Microstructures and Devices (CAMD) of Louisiana State University, Baton Rouge, Louisiana. CAMD operates the ring operating at 1.3 GeV with current between 100 mA to 50 mA. The Mo K edge measurements were made at the High Energy X-ray Spectroscopy (Hexas) beamline located on an 11-pole wiggler operating at 5.5 T. The LIII edge measurements were made at the Low Energy X-ray Absorption Spectroscopy (Lexas) beamline, a windowless beamline on a bending magnet with a 13 μm Kapton tape separating the ring from the beamline. Both beamlines use Lemonnier double crystal monochromator with design modifications made at the University of Bonn. At lower energy InSb 111 crystals (resolution ca. 0.5 eV) were used while at higher energy water-cooled Ge 422 crystals (resolution ca. 2 eV) were used. For Mo K edge measurement, the Hexas beamline was calibrated with a Mo Foil at 20 keV. The beamline has three ion chambers with a Mo foil in between the second and third chambers for monitoring the calibration. Mixtures of argon, and xenon gases were used to achieve 20%, 30% and 30% absorption in the first, second and third chamber, respectively. Mo standards used in the analysis were: MoO3 (99.9% metals basis, Alfa Aesar), Mo foil (−200 mesh, 99.9% metals basis, Alfa Aesar), and Mo2C (99.9% metals basis, Alfa Aesar). The standards were measured in transmission while the catalyst samples were placed on Kapton tape and scanned in fluorescence using a seven-element Ketek silicon drift detector with a total area of 560 mm2 and a resolution of ca. 135 eV. The low energy beamline was calibrated with the zinc sulfate white being at 2481.44 eV. The ion chambers used air as ionizing gas, the chamber being evacuated to 50 Torr. A single-element Ketek silicon drift detector with an active area of 150 mm2 was used for fluorescence signal detection. 2.13 Carburization and dehydroaromatization (DHA) MoOxCy or Mo2C, which are the active species for DHA reaction were generated in-situ. For this, a procedure from the literature [38] was followed. First, Mo catalyst (oxidized form) was reduced under H2 at 10 K/min ramp rate from room temperature to 650 °C. After 650 °C temperature was reached, CH4 gas was introduced into the reaction system for 4 h at a ratio of 1:4 (CH4:H2). This treatment led to carburization of the MoOx species. After 4 h, hydrogen and methane was turned off and the system was purged with argon. Subsequently pure CH4 was introduced at the desired reaction temperature to carry out DHA reaction. All of these sequences were carried out in an Altamira AMI 200HP reactor system equipped with a SGE glass lined SS tube. In a typical experiment, reactor tube would be loaded with (0.3–1) g of carburized catalyst and small quantities of CH4 (10 sccm) and Argon (5 sccm, internal standard) would be passed over the catalyst bed. Reaction products were analyzed downstream using Shimadzu GC2014 (FID, 2 TCD’s) equipped with Restek RT-Q-Bond column (30 m x 0.53 mm x 20 μm) in conjunction with Shimadzu QP2010 GCMS system. We would like to point out that we were not able to measure Naphthalene in our GC system. Also, estimating coke content at any point during reaction is a challenge. So, based on the products observed and the amount of methane converted, we estimated combined naphthalene and coke content at any time on stream. Following formulas were used for the activity calculation: % C H 4 c o n v e r s i o n = c o n c . C H 4 i n - c o n c . C H 4 o u t c o n c . C H 4 i n × 100 Selectivities were calculated based on observable products and naphthalene and coke content was estimated based on the amount of methane converted. % C s e l e c t i v i t y = c a r b o n n u m b e r i n t h e p r o d u c t × c o n c . P r o d u c t c o n c . C H 4 r e a c t e d × 100 3 Results and discussion 3.1 Physico-chemical properties of the catalyst Physical and chemical properties of the catalysts are listed in Table 1 . Base SZ catalysts in the literature are reported to have surface areas of 50-100 m2/g [39]. The present SZ catalyst has a surface area of 84 m2/g, well within the expected value. As the Mo was doped onto SZ, it lead to slight decrease in the surface area, as expected, due to blockage of pores from the loading of Mo [38,40]. However, in the case of 1% doping of Mo, there is no statistical difference between the BET surface areas. Table 1 shows the elemental Mo loading to be 0.84 and 3.92 wt% as compared to intended 1 and 5 wt% loading. We believe that it is quite possible that some of the Mo was lost during vacuum filtration while synthesis of the catalysts. S (sulfur) loading from ICP also is shown in Table 1. It shows that the base SZ had sulfur content of 3.5 wt%, which was reduced as Mo was doped into this catalyst. This decrease was proportional to the amount of Mo loaded. When 1 wt% Mo was loaded, it decreased slightly from 3.5 to 2.99 and further to 1.95 wt% when, 5 wt% Mo was loaded. This is quite possible because when Mo is impregnated onto this catalyst, it interacts with or replaces the SO4 2− species on the surface. This could be seen subsequently in Raman spectroscopy as well. 3.2 Raman spectroscopy Raman spectroscopy is used to detect non-IR specific bond vibrations and can be useful to analyze inorganic compounds which are not IR-active. Fig. 2 shows Raman spectra for a sulfated zirconia as a base sample (a) and a transition of 5% Mo/SZ catalyst from oxidized form (b) to a carburized one (c), and to a spent one (d). Common bands observed for sulfated zirconia include ˜ 270 cm−1, ˜ 320 cm−1, ˜ 460 cm−1, ˜ 650 cm−1 and 1025 cm−1. These bands below 700 cm−1 are attributed to tetragonal ZrO2 vibrations [36], while the band at 1025 cm−1 is attributed to vibrations from sulfate groups on ZrO2 surface. When Mo was introduced into this catalyst, two distinct new bands appear around ˜ 820 cm−1 and ˜ 970 cm−1 Raman shifts (shown in the box in Fig. 2). These bands are attributed to the Mo-O-Mo, and Mo = O vibrations [41] respectively. This confirms doping of Mo on the surface of sulfated zirconia. An attempt to measure the Raman spectra for spent catalyst samples, or even for a carburized fresh catalyst, was difficult because these samples were grey/dark, causing a strong absorption of the energy from the excitation source [42]. Similar difficulties were also experienced by the same authors [42] in obtaining FTIR spectra for carburized MoO3 samples. Despite of this, we made an attempt to focus on a different spot location and this provided a meaningful spectra for these samples. Moving from (b) to (c) and to (d), i.e. from an oxidized catalyst to a spent catalyst, most of the bands corresponding to t-ZrO2 show very little difference. Also, band corresponding to Mo-O-Mo vibration (˜ 820 cm−1) appears to be normal but the band corresponding to Mo = O vibration (˜ 970 cm−1) appears to have shifted higher (˜ 995 cm−1). This shift might indicate the presence of a carbidic form of molybdenum [38]. In addition to these differences, there are two new bands at 1340 cm−1 and 1600 cm−1 in the case of carburized and spent samples, which may be attributed to the D and G bands of graphitic carbon [43,44]. As expected, these bands were intense for the spent sample than the carburized one, indicative of more carbon deposited on the surface. Another noticeable change between these samples is the loss of intensity for the band at ˜ 1025 cm−1 corresponding to the sulfate groups, which may be due to the interaction between Mo and SO4 2- groups during the impregnation process and also probably due to volatility of SO4 2- species during the carburization and the DHA reaction [38]. 3.3 DRIFTS DRIFTS in conjunction with pyridine as a probe molecule was used to characterize the acid sites of the catalyst. Base SZ catalyst is known to have both Brønsted and Lewis strong acid sites [16,17,36]. This was confirmed by observing the shift in vibrations from adsorbed pyridine at ˜ 1445, 1610 cm−1 (co-ordinated pyridine), and ˜ 1540 cm−1, 1640 cm−1 (protonated pyridine) that are present in all the samples [45]. Bands at ˜ 1490 cm−1 correspond to pyridine adsorbed on both Lewis and Brønsted sites [45,46]. A comparison of DRIFTS spectra for catalysts with different loadings of Mo is presented in Fig. 3 . When Mo was doped in different amounts on the base SZ catalyst, the type of acid sites did not change. Both Brønsted and Lewis acid sites were still present and there was little qualitative difference in the concentration of acid sites. However, as the loading of the Mo increased, bands corresponding to both types of acid sites shifted slightly towards lower wavenumbers. This indicates a slight decrease in the strength of the acidic sites, possibly due to interaction of Mo oxides with the hydroxyl groups and oxygens on the surface of SZ [47]. Also, a qualitative slight increase in the concentration of Lewis acid sites could be seen. This could have been due to generation of MoO3 species that are Lewis acidic in nature [47,48]. The thermal stability of acid sites up to 400 °C was tested [shown in Supplementary Information (SI), 2.2]. Despite higher temperatures, all the catalysts maintained both types of acid sites and the pattern was quite similar for all. 3.4 NH3-TPD Ammonia TPD of all the catalysts showed strong acid sites. TPD results for Mo-doped catalysts followed a trend similar to that of base SZ catalyst. Several reports [36,37,46] suggest that beyond 600–700 °C, sulfates on the surface start to decompose (considering that the calcination temperature was 550 °C). This often generates a false signal in the TCD, but this signal can be correctly distinguished from the ammonia signal using a mass spectrometer as was done in the present case. A signal corresponding to (m/e = 32) started to appear beyond 630 °C, confirming the decomposition of sulfate species [46]. Fig. 4 shows a comparison of NH3-TPD curves for all four different catalysts: base SZ, and three Mo doped SZ catalysts (1%, and 5% doping). Sulfated zirconia typically has a desorption peak at around 160 °C and a long shoulder that decreases slowly down to ˜ 550 °C. As Mo was doped in increasing concentrations onto SZ, the low-temperature peaks (˜160 °C) are essentially the same as that of SZ alone. The shapes of the TPD are remarkably similar for lower Mo content, suggesting that the acidity is due to SZ alone. At higher loading, shapes of the curve slightly change indicating a reduction in acid sites. The total acidity, as measured by TPD, also decreases with loading. There are several explanations: one is that the high loading may cover the catalyst surface sufficiently to affect access to the acidic sites. Another is that the interaction between Mo and SO4 2−, as pointed out earlier. Finally, another could be the addition of Lewis acidic MoO3 species on the surface that may counteract the earlier and the net result is what we see (increase in acidity through Lewis acidic MoO3 and decrease in acidity due to possible replacement of some of the SO4 2− groups by Mo). 3.5 XPS Fig. 5 shows Mo 3d XPS spectra for 8 different catalysts, including 5 standards along with 3 samples of the most active catalyst (5% Mo/SZ) after various treatments. The first one (a) is MoO3 standard (thermodynamically most stable oxide of Mo), which shows standard 3d spin orbit coupling of 3d5/2 (BE = 233 eV) and 3d3/2,corresponding to a +6 oxidation state [49]. Sample (b) shows the fresh catalyst (oxidized form) without any treatment. This sample very closely resembles with that of (a), indicating the presence of MoO3 on the fresh sample. The third sample (c) is the fresh (oxidized form) carburized for 4 h under a flow of CH4:H2 at a ratio of (1:4) at 650 °C after reduction under H2. This sample shows peaks corresponding to MoO3 and another third peak at BE ˜ 229 eV. This peak likely corresponds to oxy-carbide phase of Mo (MoOxCy). The fourth sample (d) is the spent catalyst sample after running the carburized sample in the CH4 aromatization reaction at 650 °C for 1000 min on stream. This sample also shows three peaks with two resembling MoO3 and the third one slightly shifted towards right (BE ˜ 228.6 eV) as compared to carburized form. This more closely resembles the Mo2C phase. In order to verify this, standards directly purchased from the manufacturer were tested: β-Mo2C (e), MoO2 (f), MoS2 (g), Mo powder (h). Mo2C standard shows peaks corresponding to oxide phase and a small third peak at BE ˜ 228.4 eV. MoO2 is another form of Mo oxide which clearly shows three peaks: two corresponding to MoO3, however, the third one corresponds to +4 oxidation state (3d5/2) [50]. Since the catalysts of interest here involve Mo and S and especially Mo ‘3d’ and S ‘2s’ regions overlap, so to remove any doubt about formation of MoS2 or overlapping issues, the MoS2 sample (g) was tested. It shows two large peaks that correspond to 3d5/2 and 3d3/2 of Mo corresponding to +4 oxidation state [51] and a small peak at ˜226 eV, corresponding to S ‘2s’. Clearly, MoS2 contains substantial amount of sulfur and still S ‘2s’ peak is weak. Thus, in the samples of interest (Mo/SZ), S content being very small compared to the ‘S’ content from MoS2, we expect negligible influence due to S ‘2s’ peak and the peaks we observed correspond only to Mo 3d. Finally, the Mo powder standard (h) would be expected to be in reduced form, Mo (0). For this standard, we saw three peaks, two corresponding to Mo (+6), one shoulder that might correspond to some intermediate oxide phase (+5), and a small peak at ˜ 228.2 eV, which most likely corresponds to the reduced Mo (0) [50]. On the basis of these observations, the carburized sample is initially in the oxycarbide phase, then subsequently transformed into Mo2C under reaction conditions. Note that the samples were not run in-situ, so it is possible that part of the samples was oxidized due to exposure to room conditions, forming peaks corresponding to these oxidized parts of the catalyst, even in standards such as Mo2C, Mo powder, or MoO2, which show peaks corresponding to MoO3. 3.6 XANES Mo K-edge (Fig. 6 ) and LIII-edge XANES (shown in SI, 2.5) spectra provided the evidence for the formation of Mo2C or MoOxCy phases, which are generally believed to be the active sites for methane conversion. Fig. 6 shows K-edge XANES spectra for various Mo catalyst samples along with two reference samples of MoO3 and Mo2C. Spectra for MoO3, fresh catalyst (oxidized form), and carburized show a pre-edge feature that indicates the oxidation state of +6 and is attributable to the quadrupole/dipole transition from 1s to 4d orbital [33]. After the pre-edge region, the edge region indicates a sharp jump in the energy of absorption edge corresponding to 1 s to 5p dipole transition. Spectra for the fresh catalyst sample resembles MoO3 closely with a similar pre-edge feature that is commonly observed in the case of Mo/H-ZSM-5 catalysts [33,52,53]. For the carburized, and the spent sample, there is a reduction in the energy of absorption edge, indicating the reduced state of Mo in both these samples (carburized and spent). This reduction in edge energy from fresh (oxidized form) to spent (after reaction) was around ˜ 7 eV that corresponds well with the literature [33,52]. Mo2C reference and the spent catalyst sample have similar absorption edge energies. Also, for the carburized and the spent sample, the pre-edge peak disappears. This disappearance is apparent as pointed out by the arrow in Fig. 6. Since the absorption edge energies for carburized and spent catalysts are higher than Mo2C, it provides evidence for the existence of more oxidized species than Mo2C (Mo, +2), such as MoOxCy that disappear as the reaction progresses and spent catalyst closely resembles Mo2C [52,53]. Fig. 6 shows that the reference samples: MoO3 and Mo2C have stronger oscillations in the EXAFS region farther from the edge. However, 5% Mo/SZ samples with different treatments (fresh, carburization, and reaction) do not have these oscillations in the EXAFS region. This might be an indication that the well dispersed Mo species in the SZ matrix are without any long range order [33]. 3.7 HRTEM HRTEM was performed on all of the catalysts but the results for the 5% Mo/SZ are shown here since it has the highest activity (reaction data section). Four different images are shown for four different phases: SZ, 5% Mo/SZ (fresh - oxide form), 5% Mo/SZ (carburized form), and 5% Mo/SZ (spent form). All these images also have SADP (selected area diffraction pattern) images in the inset. There are two phases of ZrO2 in XRD (shown in SI, 2.4), monoclinic (m) and tetragonal (t), and tetragonal being the primary phase. In HRTEM analysis, primarily monoclinic (m-ZrO2) planes (111) were observed with few t-ZrO2 (011). Fig. 7 shows an image for the base SZ. Planes corresponding to m-ZrO2 and t-ZrO2 are seen. However, a bulk analysis of the sample shows rings corresponding to t-ZrO2 (011, 002, 020, 121, etc.) as shown in the inset of Fig. 7. This illustrates the SADP for a zoomed-out sample. This confirms the observations from XRD (shown in SI, 2.4) that the bulk phase of ZrO2 was tetragonal. When Mo was impregnated on SZ, new planes appear, corresponding to MoO3 species, as seen in Fig. 8 . Further, Mo appears finely dispersed in the SZ matrix [54,55] as seen in Fig. 8. Tetragonal zirconia (t-ZrO2) was also detected that often is the crystalline part of sulfated zirconia as detected in XRD [36]. For the carburized catalyst, in addition to ZrO2 planes, other planes were observed. Some of these planes correspond to MoO3. There are also planes that correspond to Mo2C and there are some that do not belong to either MoO3 or Mo2C, along with ZrO2. This could be due to the formation of an intermediate phase of MoOxCy [56,57]. Formation of Mo2C was also confirmed using HRTEM of carburized sample of 5%Mo loaded on SZ catalyst, as observed in Fig. 9 . A small portion on the carburized sample showed d spacing corresponding to (111, 201) plane of Mo2C. When this carburized sample is run further under DHA conditions for 16 h, there are changes in the lattice planes. Fig. 10 shows HRTEM of a spent 5% Mo/SZ catalyst sample. Greater amounts of carbon were observed and this carbon can be divided into two types: graphitic (primarily around the edges) and amorphous (over the entire sample). There are also 2–3 nm particles around the edges, which most likely correspond to Mo2C nanoparticles [54]. Surrounding these particles, there are few layers of graphitic carbon. Similar results can be observed in the literature [54,55,58,59], which confirmed the presence of Mo2C in H-ZSM-5. These results show that Mo is finely dispersed in SZ matrix and it also shows the state of Molybdenum through different phases of reaction and treatments: Fresh -> Carburized -> Spent. TEM analysis confirmed the conclusions drawn from other characterizations and explains this Mo transition from oxidized form into the oxycarbide form and finally into the carbidic form. TEM also supported the observations from XRD (shown in SI, 2.4) about the bulk phases of the sample. 4 Reaction data 4.1 Effect of Mo content Results of reaction runs from the Mo-doped SZ catalysts varied considerably (Figs. 11 and 12 ) albeit majority of the runs had naphthalene and coke as primary products. Among other products included ethylene, ethane, propylene, propane, and aromatics including benzene, toluene and xylenes along with hydrogen. There are several general trends of conversion and selectivity as a function of Mo loading and time. First, methane conversion decreases with time at all Mo loadings. This can be attributed to coke formation, which likely forms almost initially and accumulates with time-on-stream. Second, selectivity to aromatics is generally ˜ 10–15 % initially, but decreases rapidly with time. These compounds are believed to be the precursors for polynuclear aromatic compounds, which comprise coke. The rate at which methane conversion decreased varied slightly from catalyst to catalyst, depending on Mo loading. The 1% Mo/SZ showed a rapid drop in conversion of methane as compared to 5% Mo/SZ. For the 1% Mo/SZ catalyst, the conversion dropped from ˜ 14% to ˜ 5% in 16 h. However, 5% Mo loaded catalyst showed more gradual decrease in the conversion of methane, from ˜ 20% to 6.5%. For the 5% Mo/SZ catalyst, even the selectivity to non-coke products for this catalyst did not show a rapid drop as compared to the 1% Mo/SZ. Overall, 5% Mo loaded catalyst showed higher overall conversion compared to the other catalyst. Ethylene selectivity is a clear anomaly. For both catalysts, ethylene selectivity generally increased with time up to ˜ 10–12%. For the 1% Mo/SZ catalyst, ethylene selectivity does not significantly decrease with time after 600–700 min, even when methane conversion decreases. For the 5% Mo/SZ catalyst, there is some decrease in ethylene selectivity after 600–700 min. It is clear that the dimerization of methane is a primary product of methane conversion on both catalysts, and subsequent conversion to measurable products is relatively less selective. This supports the general observation that active Mo sites are responsible for the production of C2 dimers. Higher loadings of Mo contain more active sites, but these sites are of comparable selectivity. Over time, coke deposition starts to block the BAS, decreasing the rate of formation of aromatics and blocking access to the Mo active sites, though selectivity to ethylene is relatively steady beyond ˜700 min on stream. These results indicate that the coke deactivates BAS first and subsequently deactivates Mo active sites. Similar results have been observed in the literature [60] in which it was found that the rate of formation of C2-C3 hydrocarbons increased with decreasing benzene and naphthalene selectivity rates. The large amount of naphthalene and coke is likely due to high rates of cyclization and dimerization of olefinic C2 intermediates over strong acid sites from sulfated zirconia. Selectivity to higher aromatics such as ethylbenzene or xylenes (o, m, p) increased over time (not shown) but was negligible. During an initial period of several hours, there was no measurable formation of these compounds. Only benzene and toluene could be observed during these initial hours. As the methane conversion decreased, the formation of these higher aromatics increased. This trend was true for both the catalysts. Coke deposition is the most probable reason for deactivation of these catalysts, although loss of SO4 2− groups (SI, 3.2) from the surface of sulfated zirconia at high temperatures could also be responsible for deactivation [46]. This loss could not be ruled out because during NH3-TPD, starting at around 620 °C, the oxygen signal (m/z = 32) was detected, indicative of an oxide compound decomposition. ZrO2 being very stable compound (m.p. = 2715 °C), it is unlikely that Zr-O bonds would break down. Neither would any molybdenum oxide based compound because MoO3 sublimes at ˜ 1150 °C. The only remaining source of oxygen then could be from SO4 2− groups, which are co-ordinated on the surface of ZrO2. Similar decomposition of sulfated ZrO2 has been observed in the literature [61], indicating that O2 from the ZrO2 structure is highly unlikely, so the oxygen from SO4 -2 could be responsible for that signal. 4.2 Effect of temperature Since 5% Mo doped SZ activity/selectivity was representative of the other catalysts, the effect of reaction temperature was studied using this catalyst. Methane DHA has been typically studied in the temperature range of around 700 °C [27]. Sulfated zirconia is not stable beyond 700 °C, and starts to decompose at ˜ 620 °C [62]. Thus, the effect of temperature on 5% Mo doped SZ was studied at 600, 650, and 700 °C, spanning this temperature range of interest here. Table 2 shows that methane conversion increased with temperature, reaching ˜ 20% at 700 °C. The aliphatic and aromatic selectivities show no clear trend with temperature. The results in Figs. 13 and 14 are the net result of competing rates of reaction, deactivation, and the rate of sulfate decomposition from surface. The reaction rate increases with temperature while deactivation due to sulfate decomposition is more rapid as well. This has been observed on Mo/H-ZSM-5 catalysts as well [27,63], in which higher temperatures led to higher activity but faster deactivation because rate of naphthalene and coke formation also increases. This is apparent for Mo/SZ catalysts as seen in Table 2 as well. Fig. 13 shows that ethylene increases monotonically with time, reaching ˜8 - 9% selectivity at higher temperatures, then decreases. Selectivity goes through a maximum. In the case of higher temperatures, selectivity drops quickly. Activity decreases more rapidly at higher temperatures. This might be due to a faster rate of deactivation at higher temperatures. Except for lower temperature of 600 °C, selectivity continues to increase with time on stream. Benzene selectivity also goes through a maximum and then decreases constantly with time at each temperature (Fig. 14). A rise in ethylene selectivity and a drop in benzene selectivity suggests that the sites for conversion of the dimers to benzene are deactivated by coke deposition with time, and this trend is seen at all three temperatures tested here. But this does not mean that there is no deposition of coke on methane activation sites. Note that methane conversion is decreasing as well, so that the yield of ethylene is decreasing despite the fact that the selectivity is increasing. This indicates that coke is deposited on Mo sites as well, as shown by HRTEM that graphitic carbon layers around Mo particles (see Fig. 10). The main difference for the lower benzene selectivity at 650 °C and 700 °C, as compared to 600 °C, might be due to loss of BAS through loss of volatile SO4 2−. Similar conclusions can also be drawn from TPO (SI 3.1, Fig. S11) ran for these three spent catalyst samples. Catalyst ran at 700 °C showed highest amount of coke deposited only to be followed by catalyst ran at 650 °C and the least amount of coke was observed on the catalyst ran at 600 °C. 4.3 Effect of space velocity Figs. 15 16 and 17 show that higher space velocities over 5% Mo/SZ lead to both lower CH4 conversion (Fig. 15), and to lower benzene selectivity (Fig. 17). This is expected because often this reaction is not considered as mass transfer limited [63]. Fig. 16 shows that ethylene selectivity initially increases slowly, corresponding to high initial benzene production (Fig. 17). However, this changes very quickly with time-on-stream as ethylene selectivity goes through a maximum whereas, benzene selectivity decreases rapidly. This can be attributed to coke formation, which blocks BAS and limiting the aromatization of ethylene. Ethylene selectivity reaches a similar steady state in all three SVs (Fig. 16), but the maximum is reached at earlier times-on-stream as the space velocity is increased. The maxima in ethylene selectivity represents the result of two rates: ethylene formation from methane, and ethylene reaction leading to benzene. With time, benzene selectivities decrease to near-zero values, while ethylene selectivities reach a steady state. This means that although very little benzene is formed after ˜1000 min, active sites capable of reacting ethylene to products reach a quasi-steady state at the same SVs, at least at the times investigated here. Coking leads to blockage of BAS that in turn affects the production of benzene. Mo sites are also blocked but possibly at a slower rate than BAS. Thus, selectivity to ethylene reaches a steady state value although the methane conversion is still decreasing. TPO (SI 3.1, Fig. S12) results on the spent catalysts showed that the greatest coke deposition was observed on the lowest space velocity of 0.6 Lgcat−1h−1, while the lowest coke deposition was found on the catalyst ran at highest space velocity of 1.8 Lgcat−1h−1. This was surprising because the rate of decay in benzene formation (Fig. 17) and time to reach maximum ethylene selectivity (Fig. 16) was faster in the case of higher space velocity, whereas the amounts of coke at those space velocities were lower. This can be attributed to the preferential nature of coke formation near outer surface of catalyst particles [63,64]. Additionally, in these type of reactions benzene production is often associated with H2 generated in this reaction. Thus, in the case of lower space velocity, more H2 is generated than at higher space velocity. This additional hydrogen might be the answer to the disparity between amount of coke and corresponding activity for Mo/SZ catalysts similar to Mo/H-ZSM-5 [53,64–66]. 4.4 Comparison with literature A comparison of Mo/SZ with Mo supported on different supports from the literature is shown in Table 3 . This shows that benzene yield on Mo/SZ at 650 °C is comparable to Mo/H-ZSM-5 at 675 °C. At 700 °C, benzene and the overall aromatics yield for Mo/H-ZSM-5 are far greater compared to Mo/SZ. Compared to other acidic supports such as H-Mordenite or H-SSZ-13 that possess strong acidity, sulfated zirconia shows greater benzene yields (Table 3). Although, this is not a direct comparison because physical/chemical factors such as pretreatment, space velocity, Mo content can contribute to this difference. For example, the sulfate may not be stable at temperatures 700 °C, and the lack of shape selectivity [34] in sulfated zirconia, may affect the comparison of Mo/SZ and the literature. Although Mo/SZ has no shape selectivity, the strong acidity in SZ is sufficient to catalyze the aromatization reaction. The literature shows that benzene selectivities on Mo/H-ZSM-5 are 50–90% and thus, is more active for aromatization of methane to benzene than Mo/SZ. Mo/SZ is more selective for non-oxidative conversion of methane to heavier aromatics such as naphthalene and coke. 4.5 Temperature programmed oxidation (TPO) Fig. 18 shows TPO results for 1% and 5% Mo/SZ catalysts. There are distinct differences among the two spent catalysts, as expected due to different activities of methane DHA. Based on the TPO peak temperatures, the coke on both catalysts can be described as either amorphous or soft coke, corresponding to peak temperatures of ˜ 400 °C [67] or polymeric, and hard coke corresponding to peak temperatures of ˜ 500–600 °C [68]. This hard coke is often associated with deactivation of strong BAS. The TPO results for the 1% and 5% Mo/SZ catalysts showed similar pattern of peak TPO positions. For 1% Mo/SZ, there is one large peak at ˜ 590 °C while one at ˜510 °C for 5% Mo/SZ. Both can be attributed to polymeric coke. This shift in peak positions is attributable to the amount of acidity of the catalyst (NH3-TPD results). More acidity might correspond to higher peak oxidation temperature [68]. For 1% Mo/SZ, an identifiable small peak can be seen at ˜ 440 °C, which can be designated as amorphous coke [67]. Another small peak at ˜ 685 °C for the 5% Mo/SZ can be designated as graphitic coke. Overall, 5% Mo/SZ catalyst that showed greater activity in DHA but also greater amounts of coke (Table 4 ). 5 Conclusions Supported Mo/SZ catalyst is active for the DHA reaction. SEM-EDS and ICP-OES confirmed the actual loading of 1%, and 5% Mo on SZ. Pyridine-based DRIFTS and NH3-TPD analysis shows that both Brønsted and Lewis sites are present on these catalysts. Further analysis confirmed that Mo loading did not significantly affect acidity. At the higher 5% Mo loading, more Lewis acid sites were observed than SZ, however BAS were weakened by the addition of Mo, possibly due to interaction between sulfate and Mo. Higher loadings of Mo resulted in lower total acidity. The presence of the apparent active sites, MoOxCy were confirmed through XANES, XPS, and HRTEM. Mo loading strongly influenced the dispersion and number of available sites for methane activation. It appears that the loss of sulfate content and significant coking leads to deactivation of the catalysts. A literature comparison of benzene selectivities shows that Mo/H-ZSM-5 is far more active than Mo/SZ. Mo/SZ was found to be more selective for non-oxidative conversion of methane to heavier aromatics such as naphthalene and coke. Acknowledgements Authors would like to acknowledge financial support for this work from LSU’s Office of Research and Economic Development (ORED). Authors would like to thank Dr. Amitava Roy from LSU’s CAMD synchrotron source for help with Mo ‘K’ and ‘L’ edge experiments. Authors would also like to thank Dr. Clayton Loehn, and Dr. Dongmei Cao from LSU SIF for help with the characterization experiments (XPS, SEM, TEM, Raman). Authors would also like to thank Dr. Tommy Blanchard from LSU Oceanography and Ms. Wanda Leblanc from LSU Geology for help with ICP-OES analysis. Appendix A Supplementary data Supplementary material related to this article can be found, in the online version, at doi:https://doi.org/10.1016/j.apcata.2019.01.013. Appendix A Supplementary data The following is Supplementary data to this article: References [1] R.S. Middleton R. Gupta J.D. Hyman H.S. Viswanathan Appl. Energy 199 2017 88 95 [2] A. Press Politico 2012 [3] G.E. Keller M.M. Bhasin J. Catal. 73 1982 9 19 [4] N. Kumar Z. Wang S. Kanitkar J.J. Spivey Appl. Petrochem. Res. 2016 1 7 [5] D. Pakhare J. Spivey Chem. Soc. Rev. 43 2014 7813 7837 [6] G.A. Olah A. Goeppert M. Czaun G.K.S. Prakash J. Am. Chem. Soc. 135 2013 648 650 [7] V.R. Choudhary K.C. Mondal T.V. Choudhary Catal. Commun. 8 2007 561 564 [8] B. Christian Enger R. Lødeng A. Holmen Appl. Catal. A: Gen. 346 2008 1 27 [9] A. Zhang S. Sun Z.J.A. Komon N. Osterwalder S. Gadewar P. Stoimenov D.J. Auerbach G.D. Stucky E.W. McFarland Phys. Chem. Chem. Phys. 13 2011 2550 2555 [10] Q. Zhu S.L. Wegener C. Xie O. Uche M. Neurock T.J. Marks Nat. Chem. 5 2013 104 109 [11] A. Iulianelli S. Liguori J. Wilcox A. Basile Catal. Rev. 58 2016 1 35 [12] G.A. Olah G. Klopman R.H. Schlosberg J. Am. Chem. Soc. 91 1969 3261 3268 [13] G.A. Olah R.H. Schlosberg J. Am. Chem. Soc. 90 1968 2726 2727 [14] S. Vasireddy S. Ganguly J. Sauer W. Cook J.J. Spivey Chem. Commun. 47 2011 785 787 [15] W. Hua A. Goeppert J. Sommer Appl. Catal. A: Gen. 219 2001 201 207 [16] D. Fraenkel Catal. Lett. 58 1999 123 125 [17] S. Rezgui A. Liang T.K. Cheung B.C. Gates Catal. Lett. 53 1998 1 2 [18] X. Guo G. Fang G. Li H. Ma H. Fan L. Yu C. Ma X. Wu D. Deng M. Wei D. Tan R. Si S. Zhang J. Li L. Sun Z. Tang X. Pan X. Bao Science 344 2014 616 619 [19] D. Wang J.H. Lunsford M.P. Rosynek Top. Catal. 3 1996 289 297 [20] L. Wang L. Tao M. Xie G. Xu J. Huang Y. Xu Catal. Lett. 21 1993 35 41 [21] L. Wang R. Ohnishi M. Ichikawa J. Catal. 190 2000 276 283 [22] A.A. Gabrienko S.S. Arzumanov A.V. Toktarev I.G. Danilova I.P. Prosvirin V.V. Kriventsov V.I. Zaikovskii D. Freude A.G. Stepanov ACS Catal. 7 2017 1818 1830 [23] A.A. Gabrienko S.S. Arzumanov M.V. Luzgin A.G. Stepanov V.N. Parmon J. Phys. Chem. C 119 2015 24910 24918 [24] L. Li S. Fan X. Mu Z. Mi C.-J. Li J. Am. Chem. Soc. 136 2014 7793 7796 [25] J. Oró J. Han Science 153 1966 1393 [26] J.J. Spivey G. Hutchings Chem. Soc. Rev. 43 2014 792 803 [27] Z.R. Ismagilov E.V. Matus L.T. Tsikoza Energy Environ. Sci. 1 2008 526 541 [28] K. Sun D.M. Ginosar T. He Y. Zhang M. Fan R. Chen Ind. Eng. Chem. Res. 57 2018 1768 1789 [29] I. Vollmer I. Yarulina F. Kapteijn J. Gascon ChemCatChem 11 2019 39 52 [30] A. Kumar K. Song L. Liu Y. Han A. Bhan Angew. Chem. Int. Ed. 57 2018 15577 15582 [31] N. Kosinov F.J.A.G. Coumans G. Li E. Uslamin B. Mezari A.S.G. Wijpkema E.A. Pidko E.J.M. Hensen J. Catal. 346 2017 125 133 [32] M. Agote-Arán A.B. Kroner H.U. Islam W.A. Sławiński D.S. Wragg I. Lezcano-González A.M. Beale ChemCatChem 11 2019 473 480 [33] I. Lezcano-González R. Oord M. Rovezzi P. Glatzel S.W. Botchway B.M. Weckhuysen A.M. Beale Angew. Chem. 128 2016 5301 5305 [34] N. Kosinov F.J.A.G. Coumans E.A. Uslamin A.S.G. Wijpkema B. Mezari E.J.M. Hensen ACS Catal. 7 2017 520 529 [35] Y. Luo Z. Mei N. Liu H. Wang C. Han S. He Catal. Today 298 2017 99 108 [36] K.M. Arata H Solid Superacids 2011 Nova Science Publishers New York [37] B.M. Reddy M.K. Patil Chem. Rev. 109 2009 2185 2208 [38] F.F. Oloye A.J. McCue J.A. Anderson Appl. Petrochem. Res. 6 2016 341 352 [39] N. Katada J.-i. Endo K.-i. Notsu N. Yasunobu N. Naito M. Niwa J. Phys. Chem. B 104 2000 10321 10328 [40] E.A. El-Sharkawy A.S. Khder A.I. Ahmed Microporous Mesoporous Mater. 102 2007 128 137 [41] A.S.C. Brown J.S.J. Hargreaves S.H. Taylor Catal. Lett. 57 1999 109 113 [42] T.-c. Xiao A.P.E. York V.C. Williams H. Al-Megren A. Hanif X.-y. Zhou M.L.H. Green Chem. Mater. 12 2000 3896 3905 [43] A.C. Ferrari Solid State Commun. 143 2007 47 57 [44] J. Schwan S. Ulrich V. Batori H. Ehrhardt S.R.P. Silva J. Appl. Phys. 80 1996 440 447 [45] E.P. Parry J. Catal. 2 1963 371 379 [46] W.-H. Chen H.-H. Ko A. Sakthivel S.-J. Huang S.-H. Liu A.-Y. Lo T.-C. Tsai S.-B. Liu Catal. Today 116 2006 111 120 [47] B. Li S. Li N. Li H. Chen W. Zhang X. Bao B. Lin Microporous Mesoporous Mater. 88 2006 244 253 [48] W. Liu Y. Xu J. Catal. 185 1999 386 392 [49] T.A. Patterson J.C. Carver D.E. Leyden D.M. Hercules J. Phys. Chem. 80 1976 1700 1708 [50] T.H. Fleisch G.J. Mains J. Chem. Phys. 76 1982 780 786 [51] K. Suzuki M. Soma T. Onishi K. Tamaru J. Electron. Spectrosc. Relat. Phenom. 24 1981 283 287 [52] W. Ding S. Li G.D. Meitzner E. Iglesia J. Phys. Chem. B 105 2001 506 513 [53] H. Aritani H. Shibasaki H. Orihara A. Nakahira J. Environ. Sci. 21 2009 736 740 [54] E.V. Matus I.Z. Ismagilov O.B. Sukhova V.I. Zaikovskii L.T. Tsikoza Z.R. Ismagilov J.A. Moulijn Ind. Eng. Chem. Res. 46 2007 4063 4074 [55] Z.R. Ismagilov E.V. Matus I.Z. Ismagilov I.Z. Kerzhentsev V.I. Zailovskii K.D. Dosumov A.G. Mustafin Eurasian Chem. Technol. J. 12 2010 9 16 [56] S.R.J. Likith C.A. Farberow S. Manna A. Abdulslam V. Stevanović D.A. Ruddy J.A. Schaidle D.J. Robichaud C.V. Ciobanu J. Phys. Chem. C 122 2018 1223 1233 [57] P. Delporte Fdr. Meunier C. Pham-Huu P. Vennegues M.J. Ledoux J. Guille Catal. Today 23 1995 251 267 [58] E.V. Matus O.B. Sukhova I.Z. Ismagilov L.T. Tsikoza Z.R. Ismagilov React. Kinet. Catal. Lett. 98 2009 59 67 [59] C.H.L. Tempelman E.J.M. Hensen Appl. Catal. B: Environ. 176-177 2015 731 739 [60] S.J. Han S.K. Kim A. Hwang S. Kim D.-Y. Hong G. Kwak K.-W. Jun Y.T. Kim Appl. Catal. B: Environ. 241 2019 305 318 [61] R. Srinivasan R.A. Keogh D.R. Milburn B.H. Davis J. Catal. 153 1995 123 130 [62] M. Bi H. Li W.-P. Pan W.G. Lloyd Thermal Studies of Metal Promoted Sulfated Zirconia 1996 [63] C. Karakaya S.H. Morejudo H. Zhu R.J. Kee Ind. Eng. Chem. Res. 55 2016 9895 9906 [64] Y. Xu Y. Song Y. Suzuki Z.-G. Zhang Catal. Sci. Technol. 3 2013 2769 2777 [65] K. Skutil M. Taniewski Fuel Process. Technol. 87 2006 511 521 [66] H. Ma R. Ohnishi M. Ichikawa Catal. Lett. 89 2003 143 146 [67] C.A. Querini Coke characterization J.J. Spivey G.W. Roberts Catalysis 17 2004 The Royal Society of Chemistry 166 209 [68] F. Denardin O.W. Perez-Lopez Fuel 236 2019 1293 1300",
      "scopus-id": "85061388861",
      "coredata": {
        "eid": "1-s2.0-S0926860X19300328",
        "dc:description": "The shale gas revolution has strongly impacted the world by providing a significant incentive for research in natural gas conversion. Natural gas is becoming an important feedstock for the production of valuable chemicals. Dehydroaromatization (DHA) is an important non-oxidative conversion route for methane conversion, and Mo doped on the H-ZSM-5 or H-MCM-22 have been well-studied for this reaction. In these catalysts, Mo sites activate CH4 to form dimeric species that are subsequently oligomerized on the strong Brønsted acid sites. In the present study, Mo is doped on solid sulfated zirconia (SZ) to create a catalyst similar to Mo/H-ZSM-5, but with a different solid acid. Despite the logic of using SZ as the acid, we are aware of no systematic study of Mo/SZ catalysts for this reaction. These catalysts were characterized using Raman, XPS, DRIFTS, SEM-EDS, HRTEM, XRD, XANES and other temperature programmed techniques. Raman spectra confirmed the formation of Mo = O and OMoO bonds on the surface of SZ support. DRIFTS confirmed that there was little difference in acid sites when Mo was doped on SZ, except at higher Mo loadings. XPS, XANES, and HRTEM analysis showed that MoO3 is converted to MoOxCy and is further converted to Mo2C as the reaction progresses. Further, these catalysts were evaluated for methane DHA reaction. All of these catalysts showed methane conversions of 5–20 % at temperatures of 600–700 °C. In each case, the catalysts deactivated steadily, attributable to strong coking on the surface, as confirmed with TPO. A comparison with literature showed that Mo/SZ has comparable activity to Mo/H-ZSM-5 at around 650 °C–675 °C temperature range. Further, Mo/SZ was more selective towards heavier aromatics such as naphthalene and coke as compared to Mo/H-ZSM-5 at 700 °C, which is more selective towards benzene.",
        "openArchiveArticle": "false",
        "prism:coverDate": "2019-04-05",
        "openaccessUserLicense": null,
        "prism:aggregationType": "Journal",
        "prism:url": "https://api.elsevier.com/content/article/pii/S0926860X19300328",
        "dc:creator": [
          {
            "@_fa": "true",
            "$": "Kanitkar, Swarom"
          },
          {
            "@_fa": "true",
            "$": "Abedin, Md Ashraful"
          },
          {
            "@_fa": "true",
            "$": "Bhattar, Srikar"
          },
          {
            "@_fa": "true",
            "$": "Spivey, James J."
          }
        ],
        "link": [
          {
            "@_fa": "true",
            "@rel": "self",
            "@href": "https://api.elsevier.com/content/article/pii/S0926860X19300328"
          },
          {
            "@_fa": "true",
            "@rel": "scidir",
            "@href": "https://www.sciencedirect.com/science/article/pii/S0926860X19300328"
          }
        ],
        "dc:format": "application/json",
        "openaccessType": null,
        "pii": "S0926-860X(19)30032-8",
        "prism:volume": "575",
        "prism:publisher": "Elsevier B.V.",
        "dc:title": "Methane dehydroaromatization over molybdenum supported on sulfated zirconia catalysts",
        "prism:copyright": "© 2019 Elsevier B.V. All rights reserved.",
        "openaccess": "0",
        "prism:issn": "0926860X",
        "dcterms:subject": [
          {
            "@_fa": "true",
            "$": "Dehydroaromatization"
          },
          {
            "@_fa": "true",
            "$": "Sulfated zirconia"
          },
          {
            "@_fa": "true",
            "$": "Natural gas"
          },
          {
            "@_fa": "true",
            "$": "Methane conversion"
          }
        ],
        "openaccessArticle": "false",
        "prism:publicationName": "Applied Catalysis A: General",
        "openaccessSponsorType": null,
        "prism:pageRange": "25-37",
        "prism:endingPage": "37",
        "pubType": "fla",
        "prism:coverDisplayDate": "5 April 2019",
        "prism:doi": "10.1016/j.apcata.2019.01.013",
        "prism:startingPage": "25",
        "dc:identifier": "doi:10.1016/j.apcata.2019.01.013",
        "openaccessSponsorName": null
      },
      "objects": {
        "object": [
          {
            "@category": "thumbnail",
            "@height": "126",
            "@width": "219",
            "@_fa": "true",
            "$": "https://api.elsevier.com/content/object/eid/1-s2.0-S0926860X19300328-ga1.sml?httpAccept=%2A%2F%2A",
            "@multimediatype": "GIF image file",
            "@type": "IMAGE-THUMBNAIL",
            "@size": "7352",
            "@ref": "ga1",
            "@mimetype": "image/gif"
          },
          {
            "@category": "thumbnail",
            "@height": "123",
            "@width": "219",
            "@_fa": "true",
            "$": "https://api.elsevier.com/content/object/eid/1-s2.0-S0926860X19300328-gr1.sml?httpAccept=%2A%2F%2A",
            "@multimediatype": "GIF image file",
            "@type": "IMAGE-THUMBNAIL",
            "@size": "6544",
            "@ref": "gr1",
            "@mimetype": "image/gif"
          },
          {
            "@category": "thumbnail",
            "@height": "146",
            "@width": "219",
            "@_fa": "true",
            "$": "https://api.elsevier.com/content/object/eid/1-s2.0-S0926860X19300328-gr10.sml?httpAccept=%2A%2F%2A",
            "@multimediatype": "GIF image file",
            "@type": "IMAGE-THUMBNAIL",
            "@size": "23296",
            "@ref": "gr10",
            "@mimetype": "image/gif"
          },
          {
            "@category": "thumbnail",
            "@height": "164",
            "@width": "212",
            "@_fa": "true",
            "$": "https://api.elsevier.com/content/object/eid/1-s2.0-S0926860X19300328-gr11.sml?httpAccept=%2A%2F%2A",
            "@multimediatype": "GIF image file",
            "@type": "IMAGE-THUMBNAIL",
            "@size": "7955",
            "@ref": "gr11",
            "@mimetype": "image/gif"
          },
          {
            "@category": "thumbnail",
            "@height": "164",
            "@width": "212",
            "@_fa": "true",
            "$": "https://api.elsevier.com/content/object/eid/1-s2.0-S0926860X19300328-gr12.sml?httpAccept=%2A%2F%2A",
            "@multimediatype": "GIF image file",
            "@type": "IMAGE-THUMBNAIL",
            "@size": "7840",
            "@ref": "gr12",
            "@mimetype": "image/gif"
          },
          {
            "@category": "thumbnail",
            "@height": "164",
            "@width": "201",
            "@_fa": "true",
            "$": "https://api.elsevier.com/content/object/eid/1-s2.0-S0926860X19300328-gr13.sml?httpAccept=%2A%2F%2A",
            "@multimediatype": "GIF image file",
            "@type": "IMAGE-THUMBNAIL",
            "@size": "5994",
            "@ref": "gr13",
            "@mimetype": "image/gif"
          },
          {
            "@category": "thumbnail",
            "@height": "164",
            "@width": "194",
            "@_fa": "true",
            "$": "https://api.elsevier.com/content/object/eid/1-s2.0-S0926860X19300328-gr14.sml?httpAccept=%2A%2F%2A",
            "@multimediatype": "GIF image file",
            "@type": "IMAGE-THUMBNAIL",
            "@size": "6294",
            "@ref": "gr14",
            "@mimetype": "image/gif"
          },
          {
            "@category": "thumbnail",
            "@height": "164",
            "@width": "200",
            "@_fa": "true",
            "$": "https://api.elsevier.com/content/object/eid/1-s2.0-S0926860X19300328-gr15.sml?httpAccept=%2A%2F%2A",
            "@multimediatype": "GIF image file",
            "@type": "IMAGE-THUMBNAIL",
            "@size": "5587",
            "@ref": "gr15",
            "@mimetype": "image/gif"
          },
          {
            "@category": "thumbnail",
            "@height": "164",
            "@width": "198",
            "@_fa": "true",
            "$": "https://api.elsevier.com/content/object/eid/1-s2.0-S0926860X19300328-gr16.sml?httpAccept=%2A%2F%2A",
            "@multimediatype": "GIF image file",
            "@type": "IMAGE-THUMBNAIL",
            "@size": "6097",
            "@ref": "gr16",
            "@mimetype": "image/gif"
          },
          {
            "@category": "thumbnail",
            "@height": "164",
            "@width": "198",
            "@_fa": "true",
            "$": "https://api.elsevier.com/content/object/eid/1-s2.0-S0926860X19300328-gr17.sml?httpAccept=%2A%2F%2A",
            "@multimediatype": "GIF image file",
            "@type": "IMAGE-THUMBNAIL",
            "@size": "6466",
            "@ref": "gr17",
            "@mimetype": "image/gif"
          },
          {
            "@category": "thumbnail",
            "@height": "156",
            "@width": "219",
            "@_fa": "true",
            "$": "https://api.elsevier.com/content/object/eid/1-s2.0-S0926860X19300328-gr18.sml?httpAccept=%2A%2F%2A",
            "@multimediatype": "GIF image file",
            "@type": "IMAGE-THUMBNAIL",
            "@size": "7423",
            "@ref": "gr18",
            "@mimetype": "image/gif"
          },
          {
            "@category": "thumbnail",
            "@height": "151",
            "@width": "219",
            "@_fa": "true",
            "$": "https://api.elsevier.com/content/object/eid/1-s2.0-S0926860X19300328-gr2.sml?httpAccept=%2A%2F%2A",
            "@multimediatype": "GIF image file",
            "@type": "IMAGE-THUMBNAIL",
            "@size": "10212",
            "@ref": "gr2",
            "@mimetype": "image/gif"
          },
          {
            "@category": "thumbnail",
            "@height": "151",
            "@width": "219",
            "@_fa": "true",
            "$": "https://api.elsevier.com/content/object/eid/1-s2.0-S0926860X19300328-gr3.sml?httpAccept=%2A%2F%2A",
            "@multimediatype": "GIF image file",
            "@type": "IMAGE-THUMBNAIL",
            "@size": "10317",
            "@ref": "gr3",
            "@mimetype": "image/gif"
          },
          {
            "@category": "thumbnail",
            "@height": "154",
            "@width": "219",
            "@_fa": "true",
            "$": "https://api.elsevier.com/content/object/eid/1-s2.0-S0926860X19300328-gr4.sml?httpAccept=%2A%2F%2A",
            "@multimediatype": "GIF image file",
            "@type": "IMAGE-THUMBNAIL",
            "@size": "4910",
            "@ref": "gr4",
            "@mimetype": "image/gif"
          },
          {
            "@category": "thumbnail",
            "@height": "163",
            "@width": "126",
            "@_fa": "true",
            "$": "https://api.elsevier.com/content/object/eid/1-s2.0-S0926860X19300328-gr5.sml?httpAccept=%2A%2F%2A",
            "@multimediatype": "GIF image file",
            "@type": "IMAGE-THUMBNAIL",
            "@size": "9270",
            "@ref": "gr5",
            "@mimetype": "image/gif"
          },
          {
            "@category": "thumbnail",
            "@height": "164",
            "@width": "166",
            "@_fa": "true",
            "$": "https://api.elsevier.com/content/object/eid/1-s2.0-S0926860X19300328-gr6.sml?httpAccept=%2A%2F%2A",
            "@multimediatype": "GIF image file",
            "@type": "IMAGE-THUMBNAIL",
            "@size": "5432",
            "@ref": "gr6",
            "@mimetype": "image/gif"
          },
          {
            "@category": "thumbnail",
            "@height": "146",
            "@width": "219",
            "@_fa": "true",
            "$": "https://api.elsevier.com/content/object/eid/1-s2.0-S0926860X19300328-gr7.sml?httpAccept=%2A%2F%2A",
            "@multimediatype": "GIF image file",
            "@type": "IMAGE-THUMBNAIL",
            "@size": "22578",
            "@ref": "gr7",
            "@mimetype": "image/gif"
          },
          {
            "@category": "thumbnail",
            "@height": "146",
            "@width": "219",
            "@_fa": "true",
            "$": "https://api.elsevier.com/content/object/eid/1-s2.0-S0926860X19300328-gr8.sml?httpAccept=%2A%2F%2A",
            "@multimediatype": "GIF image file",
            "@type": "IMAGE-THUMBNAIL",
            "@size": "21315",
            "@ref": "gr8",
            "@mimetype": "image/gif"
          },
          {
            "@category": "thumbnail",
            "@height": "146",
            "@width": "219",
            "@_fa": "true",
            "$": "https://api.elsevier.com/content/object/eid/1-s2.0-S0926860X19300328-gr9.sml?httpAccept=%2A%2F%2A",
            "@multimediatype": "GIF image file",
            "@type": "IMAGE-THUMBNAIL",
            "@size": "21918",
            "@ref": "gr9",
            "@mimetype": "image/gif"
          },
          {
            "@category": "standard",
            "@height": "200",
            "@width": "347",
            "@_fa": "true",
            "$": "https://api.elsevier.com/content/object/eid/1-s2.0-S0926860X19300328-ga1.jpg?httpAccept=%2A%2F%2A",
            "@multimediatype": "JPEG image file",
            "@type": "IMAGE-DOWNSAMPLED",
            "@size": "18219",
            "@ref": "ga1",
            "@mimetype": "image/jpeg"
          },
          {
            "@category": "standard",
            "@height": "277",
            "@width": "491",
            "@_fa": "true",
            "$": "https://api.elsevier.com/content/object/eid/1-s2.0-S0926860X19300328-gr1.jpg?httpAccept=%2A%2F%2A",
            "@multimediatype": "JPEG image file",
            "@type": "IMAGE-DOWNSAMPLED",
            "@size": "30431",
            "@ref": "gr1",
            "@mimetype": "image/jpeg"
          },
          {
            "@category": "standard",
            "@height": "327",
            "@width": "491",
            "@_fa": "true",
            "$": "https://api.elsevier.com/content/object/eid/1-s2.0-S0926860X19300328-gr10.jpg?httpAccept=%2A%2F%2A",
            "@multimediatype": "JPEG image file",
            "@type": "IMAGE-DOWNSAMPLED",
            "@size": "59852",
            "@ref": "gr10",
            "@mimetype": "image/jpeg"
          },
          {
            "@category": "standard",
            "@height": "262",
            "@width": "338",
            "@_fa": "true",
            "$": "https://api.elsevier.com/content/object/eid/1-s2.0-S0926860X19300328-gr11.jpg?httpAccept=%2A%2F%2A",
            "@multimediatype": "JPEG image file",
            "@type": "IMAGE-DOWNSAMPLED",
            "@size": "24815",
            "@ref": "gr11",
            "@mimetype": "image/jpeg"
          },
          {
            "@category": "standard",
            "@height": "261",
            "@width": "339",
            "@_fa": "true",
            "$": "https://api.elsevier.com/content/object/eid/1-s2.0-S0926860X19300328-gr12.jpg?httpAccept=%2A%2F%2A",
            "@multimediatype": "JPEG image file",
            "@type": "IMAGE-DOWNSAMPLED",
            "@size": "23809",
            "@ref": "gr12",
            "@mimetype": "image/jpeg"
          },
          {
            "@category": "standard",
            "@height": "277",
            "@width": "339",
            "@_fa": "true",
            "$": "https://api.elsevier.com/content/object/eid/1-s2.0-S0926860X19300328-gr13.jpg?httpAccept=%2A%2F%2A",
            "@multimediatype": "JPEG image file",
            "@type": "IMAGE-DOWNSAMPLED",
            "@size": "20199",
            "@ref": "gr13",
            "@mimetype": "image/jpeg"
          },
          {
            "@category": "standard",
            "@height": "286",
            "@width": "339",
            "@_fa": "true",
            "$": "https://api.elsevier.com/content/object/eid/1-s2.0-S0926860X19300328-gr14.jpg?httpAccept=%2A%2F%2A",
            "@multimediatype": "JPEG image file",
            "@type": "IMAGE-DOWNSAMPLED",
            "@size": "21685",
            "@ref": "gr14",
            "@mimetype": "image/jpeg"
          },
          {
            "@category": "standard",
            "@height": "278",
            "@width": "339",
            "@_fa": "true",
            "$": "https://api.elsevier.com/content/object/eid/1-s2.0-S0926860X19300328-gr15.jpg?httpAccept=%2A%2F%2A",
            "@multimediatype": "JPEG image file",
            "@type": "IMAGE-DOWNSAMPLED",
            "@size": "19169",
            "@ref": "gr15",
            "@mimetype": "image/jpeg"
          },
          {
            "@category": "standard",
            "@height": "281",
            "@width": "339",
            "@_fa": "true",
            "$": "https://api.elsevier.com/content/object/eid/1-s2.0-S0926860X19300328-gr16.jpg?httpAccept=%2A%2F%2A",
            "@multimediatype": "JPEG image file",
            "@type": "IMAGE-DOWNSAMPLED",
            "@size": "20828",
            "@ref": "gr16",
            "@mimetype": "image/jpeg"
          },
          {
            "@category": "standard",
            "@height": "280",
            "@width": "339",
            "@_fa": "true",
            "$": "https://api.elsevier.com/content/object/eid/1-s2.0-S0926860X19300328-gr17.jpg?httpAccept=%2A%2F%2A",
            "@multimediatype": "JPEG image file",
            "@type": "IMAGE-DOWNSAMPLED",
            "@size": "22041",
            "@ref": "gr17",
            "@mimetype": "image/jpeg"
          },
          {
            "@category": "standard",
            "@height": "348",
            "@width": "489",
            "@_fa": "true",
            "$": "https://api.elsevier.com/content/object/eid/1-s2.0-S0926860X19300328-gr18.jpg?httpAccept=%2A%2F%2A",
            "@multimediatype": "JPEG image file",
            "@type": "IMAGE-DOWNSAMPLED",
            "@size": "24464",
            "@ref": "gr18",
            "@mimetype": "image/jpeg"
          },
          {
            "@category": "standard",
            "@height": "339",
            "@width": "490",
            "@_fa": "true",
            "$": "https://api.elsevier.com/content/object/eid/1-s2.0-S0926860X19300328-gr2.jpg?httpAccept=%2A%2F%2A",
            "@multimediatype": "JPEG image file",
            "@type": "IMAGE-DOWNSAMPLED",
            "@size": "33493",
            "@ref": "gr2",
            "@mimetype": "image/jpeg"
          },
          {
            "@category": "standard",
            "@height": "334",
            "@width": "486",
            "@_fa": "true",
            "$": "https://api.elsevier.com/content/object/eid/1-s2.0-S0926860X19300328-gr3.jpg?httpAccept=%2A%2F%2A",
            "@multimediatype": "JPEG image file",
            "@type": "IMAGE-DOWNSAMPLED",
            "@size": "34914",
            "@ref": "gr3",
            "@mimetype": "image/jpeg"
          },
          {
            "@category": "standard",
            "@height": "344",
            "@width": "489",
            "@_fa": "true",
            "$": "https://api.elsevier.com/content/object/eid/1-s2.0-S0926860X19300328-gr4.jpg?httpAccept=%2A%2F%2A",
            "@multimediatype": "JPEG image file",
            "@type": "IMAGE-DOWNSAMPLED",
            "@size": "23331",
            "@ref": "gr4",
            "@mimetype": "image/jpeg"
          },
          {
            "@category": "standard",
            "@height": "439",
            "@width": "339",
            "@_fa": "true",
            "$": "https://api.elsevier.com/content/object/eid/1-s2.0-S0926860X19300328-gr5.jpg?httpAccept=%2A%2F%2A",
            "@multimediatype": "JPEG image file",
            "@type": "IMAGE-DOWNSAMPLED",
            "@size": "47447",
            "@ref": "gr5",
            "@mimetype": "image/jpeg"
          },
          {
            "@category": "standard",
            "@height": "484",
            "@width": "490",
            "@_fa": "true",
            "$": "https://api.elsevier.com/content/object/eid/1-s2.0-S0926860X19300328-gr6.jpg?httpAccept=%2A%2F%2A",
            "@multimediatype": "JPEG image file",
            "@type": "IMAGE-DOWNSAMPLED",
            "@size": "34124",
            "@ref": "gr6",
            "@mimetype": "image/jpeg"
          },
          {
            "@category": "standard",
            "@height": "328",
            "@width": "491",
            "@_fa": "true",
            "$": "https://api.elsevier.com/content/object/eid/1-s2.0-S0926860X19300328-gr7.jpg?httpAccept=%2A%2F%2A",
            "@multimediatype": "JPEG image file",
            "@type": "IMAGE-DOWNSAMPLED",
            "@size": "61235",
            "@ref": "gr7",
            "@mimetype": "image/jpeg"
          },
          {
            "@category": "standard",
            "@height": "328",
            "@width": "491",
            "@_fa": "true",
            "$": "https://api.elsevier.com/content/object/eid/1-s2.0-S0926860X19300328-gr8.jpg?httpAccept=%2A%2F%2A",
            "@multimediatype": "JPEG image file",
            "@type": "IMAGE-DOWNSAMPLED",
            "@size": "47323",
            "@ref": "gr8",
            "@mimetype": "image/jpeg"
          },
          {
            "@category": "standard",
            "@height": "328",
            "@width": "491",
            "@_fa": "true",
            "$": "https://api.elsevier.com/content/object/eid/1-s2.0-S0926860X19300328-gr9.jpg?httpAccept=%2A%2F%2A",
            "@multimediatype": "JPEG image file",
            "@type": "IMAGE-DOWNSAMPLED",
            "@size": "50582",
            "@ref": "gr9",
            "@mimetype": "image/jpeg"
          },
          {
            "@category": "high",
            "@height": "886",
            "@width": "1536",
            "@_fa": "true",
            "$": "https://api.elsevier.com/content/object/eid/1-s2.0-S0926860X19300328-ga1_lrg.jpg?httpAccept=%2A%2F%2A",
            "@multimediatype": "JPEG image file",
            "@type": "IMAGE-HIGH-RES",
            "@size": "121651",
            "@ref": "ga1",
            "@mimetype": "image/jpeg"
          },
          {
            "@category": "high",
            "@height": "1226",
            "@width": "2175",
            "@_fa": "true",
            "$": "https://api.elsevier.com/content/object/eid/1-s2.0-S0926860X19300328-gr1_lrg.jpg?httpAccept=%2A%2F%2A",
            "@multimediatype": "JPEG image file",
            "@type": "IMAGE-HIGH-RES",
            "@size": "249145",
            "@ref": "gr1",
            "@mimetype": "image/jpeg"
          },
          {
            "@category": "high",
            "@height": "1450",
            "@width": "2175",
            "@_fa": "true",
            "$": "https://api.elsevier.com/content/object/eid/1-s2.0-S0926860X19300328-gr10_lrg.jpg?httpAccept=%2A%2F%2A",
            "@multimediatype": "JPEG image file",
            "@type": "IMAGE-HIGH-RES",
            "@size": "829091",
            "@ref": "gr10",
            "@mimetype": "image/jpeg"
          },
          {
            "@category": "high",
            "@height": "1161",
            "@width": "1499",
            "@_fa": "true",
            "$": "https://api.elsevier.com/content/object/eid/1-s2.0-S0926860X19300328-gr11_lrg.jpg?httpAccept=%2A%2F%2A",
            "@multimediatype": "JPEG image file",
            "@type": "IMAGE-HIGH-RES",
            "@size": "191620",
            "@ref": "gr11",
            "@mimetype": "image/jpeg"
          },
          {
            "@category": "high",
            "@height": "1157",
            "@width": "1500",
            "@_fa": "true",
            "$": "https://api.elsevier.com/content/object/eid/1-s2.0-S0926860X19300328-gr12_lrg.jpg?httpAccept=%2A%2F%2A",
            "@multimediatype": "JPEG image file",
            "@type": "IMAGE-HIGH-RES",
            "@size": "183897",
            "@ref": "gr12",
            "@mimetype": "image/jpeg"
          },
          {
            "@category": "high",
            "@height": "1226",
            "@width": "1502",
            "@_fa": "true",
            "$": "https://api.elsevier.com/content/object/eid/1-s2.0-S0926860X19300328-gr13_lrg.jpg?httpAccept=%2A%2F%2A",
            "@multimediatype": "JPEG image file",
            "@type": "IMAGE-HIGH-RES",
            "@size": "150652",
            "@ref": "gr13",
            "@mimetype": "image/jpeg"
          },
          {
            "@category": "high",
            "@height": "1266",
            "@width": "1502",
            "@_fa": "true",
            "$": "https://api.elsevier.com/content/object/eid/1-s2.0-S0926860X19300328-gr14_lrg.jpg?httpAccept=%2A%2F%2A",
            "@multimediatype": "JPEG image file",
            "@type": "IMAGE-HIGH-RES",
            "@size": "160893",
            "@ref": "gr14",
            "@mimetype": "image/jpeg"
          },
          {
            "@category": "high",
            "@height": "1229",
            "@width": "1500",
            "@_fa": "true",
            "$": "https://api.elsevier.com/content/object/eid/1-s2.0-S0926860X19300328-gr15_lrg.jpg?httpAccept=%2A%2F%2A",
            "@multimediatype": "JPEG image file",
            "@type": "IMAGE-HIGH-RES",
            "@size": "139693",
            "@ref": "gr15",
            "@mimetype": "image/jpeg"
          },
          {
            "@category": "high",
            "@height": "1243",
            "@width": "1501",
            "@_fa": "true",
            "$": "https://api.elsevier.com/content/object/eid/1-s2.0-S0926860X19300328-gr16_lrg.jpg?httpAccept=%2A%2F%2A",
            "@multimediatype": "JPEG image file",
            "@type": "IMAGE-HIGH-RES",
            "@size": "153167",
            "@ref": "gr16",
            "@mimetype": "image/jpeg"
          },
          {
            "@category": "high",
            "@height": "1241",
            "@width": "1500",
            "@_fa": "true",
            "$": "https://api.elsevier.com/content/object/eid/1-s2.0-S0926860X19300328-gr17_lrg.jpg?httpAccept=%2A%2F%2A",
            "@multimediatype": "JPEG image file",
            "@type": "IMAGE-HIGH-RES",
            "@size": "159333",
            "@ref": "gr17",
            "@mimetype": "image/jpeg"
          },
          {
            "@category": "high",
            "@height": "1543",
            "@width": "2167",
            "@_fa": "true",
            "$": "https://api.elsevier.com/content/object/eid/1-s2.0-S0926860X19300328-gr18_lrg.jpg?httpAccept=%2A%2F%2A",
            "@multimediatype": "JPEG image file",
            "@type": "IMAGE-HIGH-RES",
            "@size": "229368",
            "@ref": "gr18",
            "@mimetype": "image/jpeg"
          },
          {
            "@category": "high",
            "@height": "1502",
            "@width": "2172",
            "@_fa": "true",
            "$": "https://api.elsevier.com/content/object/eid/1-s2.0-S0926860X19300328-gr2_lrg.jpg?httpAccept=%2A%2F%2A",
            "@multimediatype": "JPEG image file",
            "@type": "IMAGE-HIGH-RES",
            "@size": "317638",
            "@ref": "gr2",
            "@mimetype": "image/jpeg"
          },
          {
            "@category": "high",
            "@height": "1481",
            "@width": "2152",
            "@_fa": "true",
            "$": "https://api.elsevier.com/content/object/eid/1-s2.0-S0926860X19300328-gr3_lrg.jpg?httpAccept=%2A%2F%2A",
            "@multimediatype": "JPEG image file",
            "@type": "IMAGE-HIGH-RES",
            "@size": "328385",
            "@ref": "gr3",
            "@mimetype": "image/jpeg"
          },
          {
            "@category": "high",
            "@height": "1523",
            "@width": "2168",
            "@_fa": "true",
            "$": "https://api.elsevier.com/content/object/eid/1-s2.0-S0926860X19300328-gr4_lrg.jpg?httpAccept=%2A%2F%2A",
            "@multimediatype": "JPEG image file",
            "@type": "IMAGE-HIGH-RES",
            "@size": "180793",
            "@ref": "gr4",
            "@mimetype": "image/jpeg"
          },
          {
            "@category": "high",
            "@height": "1946",
            "@width": "1502",
            "@_fa": "true",
            "$": "https://api.elsevier.com/content/object/eid/1-s2.0-S0926860X19300328-gr5_lrg.jpg?httpAccept=%2A%2F%2A",
            "@multimediatype": "JPEG image file",
            "@type": "IMAGE-HIGH-RES",
            "@size": "453868",
            "@ref": "gr5",
            "@mimetype": "image/jpeg"
          },
          {
            "@category": "high",
            "@height": "2144",
            "@width": "2169",
            "@_fa": "true",
            "$": "https://api.elsevier.com/content/object/eid/1-s2.0-S0926860X19300328-gr6_lrg.jpg?httpAccept=%2A%2F%2A",
            "@multimediatype": "JPEG image file",
            "@type": "IMAGE-HIGH-RES",
            "@size": "263323",
            "@ref": "gr6",
            "@mimetype": "image/jpeg"
          },
          {
            "@category": "high",
            "@height": "1452",
            "@width": "2175",
            "@_fa": "true",
            "$": "https://api.elsevier.com/content/object/eid/1-s2.0-S0926860X19300328-gr7_lrg.jpg?httpAccept=%2A%2F%2A",
            "@multimediatype": "JPEG image file",
            "@type": "IMAGE-HIGH-RES",
            "@size": "899193",
            "@ref": "gr7",
            "@mimetype": "image/jpeg"
          },
          {
            "@category": "high",
            "@height": "1452",
            "@width": "2175",
            "@_fa": "true",
            "$": "https://api.elsevier.com/content/object/eid/1-s2.0-S0926860X19300328-gr8_lrg.jpg?httpAccept=%2A%2F%2A",
            "@multimediatype": "JPEG image file",
            "@type": "IMAGE-HIGH-RES",
            "@size": "735193",
            "@ref": "gr8",
            "@mimetype": "image/jpeg"
          },
          {
            "@category": "high",
            "@height": "1451",
            "@width": "2175",
            "@_fa": "true",
            "$": "https://api.elsevier.com/content/object/eid/1-s2.0-S0926860X19300328-gr9_lrg.jpg?httpAccept=%2A%2F%2A",
            "@multimediatype": "JPEG image file",
            "@type": "IMAGE-HIGH-RES",
            "@size": "616000",
            "@ref": "gr9",
            "@mimetype": "image/jpeg"
          },
          {
            "@category": "standard",
            "@_fa": "true",
            "$": "https://api.elsevier.com/content/object/eid/1-s2.0-S0926860X19300328-mmc1.docx?httpAccept=%2A%2F%2A",
            "@multimediatype": "Microsoft Word file",
            "@type": "APPLICATION",
            "@size": "1930840",
            "@ref": "mmc1",
            "@mimetype": "application/word"
          },
          {
            "@category": "thumbnail",
            "@height": "31",
            "@width": "568",
            "@_fa": "true",
            "$": "https://api.elsevier.com/content/object/eid/1-s2.0-S0926860X19300328-si1.gif?httpAccept=%2A%2F%2A",
            "@multimediatype": "GIF image file",
            "@type": "ALTIMG",
            "@size": "1608",
            "@ref": "si1",
            "@mimetype": "image/gif"
          },
          {
            "@category": "thumbnail",
            "@height": "43",
            "@width": "365",
            "@_fa": "true",
            "$": "https://api.elsevier.com/content/object/eid/1-s2.0-S0926860X19300328-si2.gif?httpAccept=%2A%2F%2A",
            "@multimediatype": "GIF image file",
            "@type": "ALTIMG",
            "@size": "1130",
            "@ref": "si2",
            "@mimetype": "image/gif"
          },
          {
            "@category": "thumbnail",
            "@height": "46",
            "@width": "376",
            "@_fa": "true",
            "$": "https://api.elsevier.com/content/object/eid/1-s2.0-S0926860X19300328-si3.gif?httpAccept=%2A%2F%2A",
            "@multimediatype": "GIF image file",
            "@type": "ALTIMG",
            "@size": "1182",
            "@ref": "si3",
            "@mimetype": "image/gif"
          },
          {
            "@category": "thumbnail",
            "@height": "46",
            "@width": "461",
            "@_fa": "true",
            "$": "https://api.elsevier.com/content/object/eid/1-s2.0-S0926860X19300328-si4.gif?httpAccept=%2A%2F%2A",
            "@multimediatype": "GIF image file",
            "@type": "ALTIMG",
            "@size": "1483",
            "@ref": "si4",
            "@mimetype": "image/gif"
          },
          {
            "@category": "standard",
            "@_fa": "true",
            "$": "https://api.elsevier.com/content/object/eid/1-s2.0-S0926860X19300328-am.pdf?httpAccept=%2A%2F%2A",
            "@multimediatype": "Acrobat PDF file",
            "@type": "AAM-PDF",
            "@size": "3651642",
            "@ref": "am",
            "@mimetype": "application/pdf"
          }
        ]
      },
      "link": {
        "@rel": "abstract",
        "@href": "https://api.elsevier.com/content/abstract/scopus_id/85061388861"
      }
    }
  }
}