{
  "metadata": {
    "title": "Coordination number dependence of Pt catalysts for catalytic decomposition of aqueous hydroxylammonium nitrate (HAN)",
    "authors": "; ; ",
    "journal": "Applied Catalysis A: General",
    "date": "2025-09-25",
    "doi": "10.1016/j.apcata.2025.120457",
    "abstract": "",
    "uri": "https://api.elsevier.com/content/article/pii/S0926860X25003588",
    "pii": "S0926860X25003588"
  },
  "fulltext": {
    "full-text-retrieval-response": {
      "scopus-eid": "2-s2.0-105011159580",
      "originalText": "serial JL 271346 291210 291744 291809 31 Applied Catalysis A: General APPLIEDCATALYSISAGENERAL 2025-07-21 2025-07-21 2025-07-23 2025-07-23 2025-08-02T16:52:27 1-s2.0-S0926860X25003588 S0926-860X(25)00358-8 S0926860X25003588 10.1016/j.apcata.2025.120457 S300 S300.1 FULL-TEXT 1-s2.0-S0926860X25X00132 2025-08-02T15:56:28.147203Z 0 0 20250925 2025 2025-07-22T00:07:55.210785Z absattachment articleinfo articlenumber articletitlenorm authfirstinitialnorm authfirstsurnamenorm cid cids contenttype copyright crossmark dateloaded dateloadedtxt datesearch datesort dateupdated dco docsubtype doctype doi eid ewtransactionid hubeid indexeddate issn issnnorm itemstage itemtransactionid itemweight openaccess openarchive pg pgfirst pii piinorm pubdatestart pubdatetxt pubyr sortorder srctitle srctitlenorm srctype ssids alllist content subj subheadings suppl tomb volfirst volissue volumelist webpdf webpdfpagecount yearnav figure table e-component body mmlmath acknowledge affil appendices articletitle auth authfirstini authfull authkeywords authlast footnotes grantnumber grantsponsor grantsponsorid highlightsabst primabst ref specialabst 0926-860X 0926860X true 705 705 C Volume 705 27 120457 120457 120457 20250925 25 September 2025 2025-09-25 2025 article fla © 2025 Elsevier B.V. All rights are reserved, including those for text and data mining, AI training, and similar technologies. COORDINATIONNUMBERDEPENDENCEPTCATALYSTSFORCATALYTICDECOMPOSITIONAQUEOUSHYDROXYLAMMONIUMNITRATEHAN LIU S 1 Introduction 2 Experimental 2.1 Preparation of xPt/Al2O3 2.2 Performance evaluations 2.3 Characterization of xPt/Al2O3 2.4 Computational details 3 Results and discussion 3.1 Performance evaluation of xPt/Al2O3 3.2 Characterization of xPt/Al2O3 3.3 Discussion 4 Conclusions CRediT authorship contribution statement Acknowledgements Appendix A Supplementary material References FANG 2022 8730 J TAYLOR 2024 100083 N AMROUSSE 2015 2686 2692 R MASSE 2013 265 276 R MATYSHAK 2022 339 350 V CHAI 2022 194 214 W LEE 1997 3232 H OXLEY 1988 63 70 J AMROUSSE 2017 334 348 R HWANG 2014 1109 1116 C COURTHEOUX 2006 217 225 L CHAI 2022 285 305 W COURTHEOUX 2005 10 18 L COURTHEOUX 2004 113 119 L AMROUSSE 2013 64 68 R YOO 2024 166 D AGNIHOTRI 2020 110851 R AGNIHOTRI 2018 22293 22302 R HONG 2019 80 S AMARIEI 2007 165 174 D AMROUSSE 2013 71 88 R POPA 2005 543 554 A REN 2007 1 2 X LIU 2025 460 467 S KRESSE 1996 15 50 G BLOCHL 1994 17953 17979 P PERDEW 1996 3865 3868 J KRESSE 1999 1758 1775 G MONKHORST 1976 5188 5192 H GRIMME 2010 S HENKELMAN 2000 9901 9904 G HAN 2021 17276 17288 Y WANG 2022 138171 M BAZIN 2005 187 P LIU 2023 157781 S ALEKSANDROV 2016 22108 22121 H ZHANG 2024 2404792 W WINTER 2020 14763 14774 L LI 2023 1081 1090 X HUANG 2024 106 113 Y LIUX2025X120457 LIUX2025X120457XS 2027-07-23T00:00:00.000Z 2027-07-23T00:00:00.000Z http://creativecommons.org/licenses/by-nc-nd/4.0/ © 2025 Elsevier B.V. All rights are reserved, including those for text and data mining, AI training, and similar technologies. 2025-07-29T02:38:00.268Z http://vtw.elsevier.com/data/voc/AddOnTypes/50.7/aggregated-refined National Key Research and Development Program of China 2022YFB4602505 NKRDPC National Key Research and Development Program of China http://data.elsevier.com/vocabulary/SciValFunders/501100012166 http://sws.geonames.org/1814991/ http://sws.geonames.org/1814991 NSFC 22178337 22378387 NNSFC National Natural Science Foundation of China http://data.elsevier.com/vocabulary/SciValFunders/501100001809 http://sws.geonames.org/1814991/ This work was supported by the National Natural Science Foundation of China (NSFC) grants ( 22178337 and 22378387 ) and National Key Research and Development Program of China ( 2022YFB4602505 ). The authors sincerely thank Yang Su and Xiaoli Pan for their contributions to HRTEM characterization. https://doi.org/10.15223/policy-017 https://doi.org/10.15223/policy-037 https://doi.org/10.15223/policy-012 https://doi.org/10.15223/policy-029 https://doi.org/10.15223/policy-004 item S0926-860X(25)00358-8 S0926860X25003588 1-s2.0-S0926860X25003588 10.1016/j.apcata.2025.120457 271346 2025-08-02T15:56:28.147203Z 2025-09-25 1-s2.0-S0926860X25003588-main.pdf https://s3-eu-west-1.amazonaws.com/prod-ucs-content-store-eu-west/content/pii:S0926860X25003588/MAIN/application/pdf/39d15e5bc5ab3e3e7e0e0dff02a3c0e3/main.pdf main.pdf pdf true 7710544 MAIN 9 1-s2.0-S0926860X25003588-main_1.png https://s3-eu-west-1.amazonaws.com/prod-ucs-content-store-eu-west/content/pii:S0926860X25003588/PREVIEW/image/png/07e9adb71f11567f77be2760916cb928/main_1.png main_1.png png 58013 928 656 IMAGE-WEB-PDF 1 1-s2.0-S0926860X25003588-gr1.jpg https://s3-eu-west-1.amazonaws.com/prod-ucs-content-store-eu-west/content/pii:S0926860X25003588/gr1/DOWNSAMPLED/image/jpeg/706392b817dfd156eaf94e2a47db342c/gr1.jpg gr1 gr1.jpg jpg 31545 282 678 IMAGE-DOWNSAMPLED 1-s2.0-S0926860X25003588-gr9.jpg https://s3-eu-west-1.amazonaws.com/prod-ucs-content-store-eu-west/content/pii:S0926860X25003588/gr9/DOWNSAMPLED/image/jpeg/335cba5393cf2e82d332f19f4b343f83/gr9.jpg gr9 gr9.jpg jpg 22206 242 376 IMAGE-DOWNSAMPLED 1-s2.0-S0926860X25003588-gr8.jpg https://s3-eu-west-1.amazonaws.com/prod-ucs-content-store-eu-west/content/pii:S0926860X25003588/gr8/DOWNSAMPLED/image/jpeg/cd33c2e4cc581ca55148261fa9822941/gr8.jpg gr8 gr8.jpg jpg 91147 590 678 IMAGE-DOWNSAMPLED 1-s2.0-S0926860X25003588-gr7.jpg https://s3-eu-west-1.amazonaws.com/prod-ucs-content-store-eu-west/content/pii:S0926860X25003588/gr7/DOWNSAMPLED/image/jpeg/7ed2d10d3b6587c3681ee9378375cbea/gr7.jpg gr7 gr7.jpg jpg 101071 590 678 IMAGE-DOWNSAMPLED 1-s2.0-S0926860X25003588-gr6.jpg https://s3-eu-west-1.amazonaws.com/prod-ucs-content-store-eu-west/content/pii:S0926860X25003588/gr6/DOWNSAMPLED/image/jpeg/dd52c8d561be89b92e03976842b00ab5/gr6.jpg gr6 gr6.jpg jpg 85390 582 676 IMAGE-DOWNSAMPLED 1-s2.0-S0926860X25003588-gr5.jpg https://s3-eu-west-1.amazonaws.com/prod-ucs-content-store-eu-west/content/pii:S0926860X25003588/gr5/DOWNSAMPLED/image/jpeg/1156e76a1dbf2002b345a1babdcefe92/gr5.jpg gr5 gr5.jpg jpg 14805 236 282 IMAGE-DOWNSAMPLED 1-s2.0-S0926860X25003588-gr4.jpg https://s3-eu-west-1.amazonaws.com/prod-ucs-content-store-eu-west/content/pii:S0926860X25003588/gr4/DOWNSAMPLED/image/jpeg/3c579365496f06f22ed0279d30d03fc7/gr4.jpg gr4 gr4.jpg jpg 96000 398 788 IMAGE-DOWNSAMPLED 1-s2.0-S0926860X25003588-gr3.jpg https://s3-eu-west-1.amazonaws.com/prod-ucs-content-store-eu-west/content/pii:S0926860X25003588/gr3/DOWNSAMPLED/image/jpeg/df7e2a5fba75ffff3d01d0cb91e05834/gr3.jpg gr3 gr3.jpg jpg 26350 284 339 IMAGE-DOWNSAMPLED 1-s2.0-S0926860X25003588-gr2.jpg https://s3-eu-west-1.amazonaws.com/prod-ucs-content-store-eu-west/content/pii:S0926860X25003588/gr2/DOWNSAMPLED/image/jpeg/c562f83f3fbef0bb83e0265d8c16f728/gr2.jpg gr2 gr2.jpg jpg 60736 536 678 IMAGE-DOWNSAMPLED 1-s2.0-S0926860X25003588-ga1.jpg https://s3-eu-west-1.amazonaws.com/prod-ucs-content-store-eu-west/content/pii:S0926860X25003588/ga1/DOWNSAMPLED/image/jpeg/5fe733c839baa468f7195471eb38dd3a/ga1.jpg ga1 true ga1.jpg jpg 14375 200 261 IMAGE-DOWNSAMPLED 1-s2.0-S0926860X25003588-gr1.sml https://s3-eu-west-1.amazonaws.com/prod-ucs-content-store-eu-west/content/pii:S0926860X25003588/gr1/THUMBNAIL/image/gif/c5b75757a001068d46b71a47015531aa/gr1.sml gr1 gr1.sml sml 5238 91 219 IMAGE-THUMBNAIL 1-s2.0-S0926860X25003588-gr9.sml https://s3-eu-west-1.amazonaws.com/prod-ucs-content-store-eu-west/content/pii:S0926860X25003588/gr9/THUMBNAIL/image/gif/f9470ac6f2690d3674ebccc30d92eb74/gr9.sml gr9 gr9.sml sml 9242 141 219 IMAGE-THUMBNAIL 1-s2.0-S0926860X25003588-gr8.sml https://s3-eu-west-1.amazonaws.com/prod-ucs-content-store-eu-west/content/pii:S0926860X25003588/gr8/THUMBNAIL/image/gif/94f5513ad063e01a1ae72772bbb217f3/gr8.sml gr8 gr8.sml sml 12063 164 188 IMAGE-THUMBNAIL 1-s2.0-S0926860X25003588-gr7.sml https://s3-eu-west-1.amazonaws.com/prod-ucs-content-store-eu-west/content/pii:S0926860X25003588/gr7/THUMBNAIL/image/gif/69f0243400f53174737e0f5d503c4913/gr7.sml gr7 gr7.sml sml 12397 164 188 IMAGE-THUMBNAIL 1-s2.0-S0926860X25003588-gr6.sml https://s3-eu-west-1.amazonaws.com/prod-ucs-content-store-eu-west/content/pii:S0926860X25003588/gr6/THUMBNAIL/image/gif/5c25179fe0c8da08679f0ecd0c7d3598/gr6.sml gr6 gr6.sml sml 10559 163 190 IMAGE-THUMBNAIL 1-s2.0-S0926860X25003588-gr5.sml https://s3-eu-west-1.amazonaws.com/prod-ucs-content-store-eu-west/content/pii:S0926860X25003588/gr5/THUMBNAIL/image/gif/bcf2e5ba621d7c77eabf7ab9f5b462fd/gr5.sml gr5 gr5.sml sml 7942 164 196 IMAGE-THUMBNAIL 1-s2.0-S0926860X25003588-gr4.sml https://s3-eu-west-1.amazonaws.com/prod-ucs-content-store-eu-west/content/pii:S0926860X25003588/gr4/THUMBNAIL/image/gif/436400a928c8ae74a986122132538c0f/gr4.sml gr4 gr4.sml sml 15378 111 219 IMAGE-THUMBNAIL 1-s2.0-S0926860X25003588-gr3.sml https://s3-eu-west-1.amazonaws.com/prod-ucs-content-store-eu-west/content/pii:S0926860X25003588/gr3/THUMBNAIL/image/gif/7484c73a5d9114c869cbf51fc4669541/gr3.sml gr3 gr3.sml sml 9658 164 196 IMAGE-THUMBNAIL 1-s2.0-S0926860X25003588-gr2.sml https://s3-eu-west-1.amazonaws.com/prod-ucs-content-store-eu-west/content/pii:S0926860X2500359X/gr2/THUMBNAIL/image/gif/bb68ce686c555cfbf53c23e1415ef4fc/gr2.sml gr2 gr2.sml sml 14225 164 207 IMAGE-THUMBNAIL 1-s2.0-S0926860X25003588-ga1.sml https://s3-eu-west-1.amazonaws.com/prod-ucs-content-store-eu-west/content/pii:S0926860X25003588/ga1/THUMBNAIL/image/gif/50157481674f01fbac43f35f948f32bc/ga1.sml ga1 true ga1.sml sml 10778 164 214 IMAGE-THUMBNAIL 1-s2.0-S0926860X25003588-gr1_lrg.jpg https://s3-eu-west-1.amazonaws.com/prod-ucs-content-store-eu-west/content/pii:S0926860X25003588/HIGHRES/image/jpeg/e8a52783856b684111d13e73b8535486/gr1_lrg.jpg gr1 gr1_lrg.jpg jpg 138305 1244 2994 IMAGE-HIGH-RES 1-s2.0-S0926860X25003588-gr9_lrg.jpg https://s3-eu-west-1.amazonaws.com/prod-ucs-content-store-eu-west/content/pii:S0926860X25003588/HIGHRES/image/jpeg/d8c1fd859fb364e4946a3d69ebb6248c/gr9_lrg.jpg gr9 gr9_lrg.jpg jpg 121532 1070 1663 IMAGE-HIGH-RES 1-s2.0-S0926860X25003588-gr8_lrg.jpg https://s3-eu-west-1.amazonaws.com/prod-ucs-content-store-eu-west/content/pii:S0926860X25003588/HIGHRES/image/jpeg/4b15d35ed8e86e1240232e5f25f5216d/gr8_lrg.jpg gr8 gr8_lrg.jpg jpg 379852 2605 2994 IMAGE-HIGH-RES 1-s2.0-S0926860X25003588-gr7_lrg.jpg https://s3-eu-west-1.amazonaws.com/prod-ucs-content-store-eu-west/content/pii:S0926860X25003588/HIGHRES/image/jpeg/01505958e60fe2494e637e75d85b2018/gr7_lrg.jpg gr7 gr7_lrg.jpg jpg 415223 2604 2994 IMAGE-HIGH-RES 1-s2.0-S0926860X25003588-gr6_lrg.jpg https://s3-eu-west-1.amazonaws.com/prod-ucs-content-store-eu-west/content/pii:S0926860X25003588/HIGHRES/image/jpeg/f9bafc1f5bb840d21a3ab81986a4edff/gr6_lrg.jpg gr6 gr6_lrg.jpg jpg 368441 2574 2992 IMAGE-HIGH-RES 1-s2.0-S0926860X25003588-gr5_lrg.jpg https://s3-eu-west-1.amazonaws.com/prod-ucs-content-store-eu-west/content/pii:S0926860X25003588/HIGHRES/image/jpeg/bbb88e51a1ac15446938b54960e0e518/gr5_lrg.jpg gr5 gr5_lrg.jpg jpg 69557 1044 1247 IMAGE-HIGH-RES 1-s2.0-S0926860X25003588-gr4_lrg.jpg https://s3-eu-west-1.amazonaws.com/prod-ucs-content-store-eu-west/content/pii:S0926860X25003588/HIGHRES/image/jpeg/1d18b87f7d4ca1e33b28dac425f07f67/gr4_lrg.jpg gr4 gr4_lrg.jpg jpg 493421 1764 3491 IMAGE-HIGH-RES 1-s2.0-S0926860X25003588-gr3_lrg.jpg https://s3-eu-west-1.amazonaws.com/prod-ucs-content-store-eu-west/content/pii:S0926860X25003588/HIGHRES/image/jpeg/79095f6411d11ca8e5310d1210757b6c/gr3_lrg.jpg gr3 gr3_lrg.jpg jpg 116689 1252 1497 IMAGE-HIGH-RES 1-s2.0-S0926860X25003588-gr2_lrg.jpg https://s3-eu-west-1.amazonaws.com/prod-ucs-content-store-eu-west/content/pii:S0926860X2500359X/HIGHRES/image/jpeg/fcd3a35b4820470769d36d22e85e4e0d/gr2_lrg.jpg gr2 gr2_lrg.jpg jpg 236343 2366 2994 IMAGE-HIGH-RES 1-s2.0-S0926860X25003588-ga1_lrg.jpg https://s3-eu-west-1.amazonaws.com/prod-ucs-content-store-eu-west/content/pii:S0926860X2500359X/HIGHRES/image/jpeg/1e99f4330fca33970791f9a5417dedf4/ga1_lrg.jpg ga1 true ga1_lrg.jpg jpg 110946 886 1155 IMAGE-HIGH-RES 1-s2.0-S0926860X25003588-mmc1.docx https://s3-eu-west-1.amazonaws.com/prod-ucs-content-store-eu-west/content/pii:S0926860X25003588/mmc1/MAIN/application/vnd.openxmlformats-officedocument.wordprocessingml.document/a0bb7aead8897d3d461a6fb6e031ea36/mmc1.docx mmc1 mmc1.docx docx 1047550 APPLICATION 1-s2.0-S0926860X25003588-si0001.svg https://s3-eu-west-1.amazonaws.com/prod-ucs-content-store-eu-west/content/pii:S0926860X25003588/image/svg+xml/f7963b9e1fc6c2c5f65ded2275768c35/si0001.svg si0001 si0001.svg svg 4895 ALTIMG 1-s2.0-S0926860X25003588-si0002.svg https://s3-eu-west-1.amazonaws.com/prod-ucs-content-store-eu-west/content/pii:S0926860X25003588/image/svg+xml/9db8edb9ecc916c9fac0758e07547071/si0002.svg si0002 si0002.svg svg 4165 ALTIMG 1-s2.0-S0926860X25003588-si0003.svg https://s3-eu-west-1.amazonaws.com/prod-ucs-content-store-eu-west/content/pii:S0926860X25003588/image/svg+xml/66d08942ed3f3391be2624177e09d78e/si0003.svg si0003 si0003.svg svg 7703 ALTIMG 1-s2.0-S0926860X25003588-si0004.svg https://s3-eu-west-1.amazonaws.com/prod-ucs-content-store-eu-west/content/pii:S0926860X25003588/image/svg+xml/1865d630bac2d950c93a5110b8040f90/si0004.svg si0004 si0004.svg svg 7488 ALTIMG 1-s2.0-S0926860X25003588-si0005.svg https://s3-eu-west-1.amazonaws.com/prod-ucs-content-store-eu-west/content/pii:S0926860X25003588/image/svg+xml/10e3e1560ea642e71ea998b11dc95a25/si0005.svg si0005 si0005.svg svg 7638 ALTIMG 1-s2.0-S0926860X25003588-si0006.svg https://s3-eu-west-1.amazonaws.com/prod-ucs-content-store-eu-west/content/pii:S0926860X25003588/image/svg+xml/63be98eca3b6851f6d59502a9d433ddc/si0006.svg si0006 si0006.svg svg 7776 ALTIMG 1-s2.0-S0926860X25003588-si0007.svg https://s3-eu-west-1.amazonaws.com/prod-ucs-content-store-eu-west/content/pii:S0926860X25003588/image/svg+xml/a1bfabaaa0068b8c85eb6cb319f1a686/si0007.svg si0007 si0007.svg svg 2860 ALTIMG 1-s2.0-S0926860X25003588-si0008.svg https://s3-eu-west-1.amazonaws.com/prod-ucs-content-store-eu-west/content/pii:S0926860X25003588/image/svg+xml/75317ca499f5af2fbc17ea53bcf69040/si0008.svg si0008 si0008.svg svg 2435 ALTIMG APCATA 120457 120457 S0926-860X(25)00358-8 10.1016/j.apcata.2025.120457 Elsevier B.V. Fig. 1 The performance of xPt/Al2O3 (a) NH3OH+ conversion (b) NO3 - conversion. Fig. 1 Fig. 2 The selectivity over xPt/Al2O3 (a) 60℃; (b) 80℃; (c) 100℃; (d) 120℃. Fig. 2 Fig. 3 X-ray diffraction (XRD) patterns of xPt/Al2O3. Fig. 3 Fig. 4 (a, e) AC-TEM images of 0.1 Pt/ Al2O3 (b-d) HAADF-STEM images of (b) 0.5Pt/ Al2O3 (c)1Pt/ Al2O3 (d)2Pt/ Al2O3 (f, g) high-resolution TEM (HRTEM) of 2Pt/ Al2O3. Fig. 4 Fig. 5 H2-TPR profiles of xPt/ Al2O3. Fig. 5 Fig. 6 In-situ CO DRIFTs of xPt/ Al2O3 (a)0.1Pt/ Al2O3 (b) 0.5Pt/ Al2O3 (c) 1Pt/ Al2O3 (d) 2Pt/ Al2O3. Fig. 6 Fig. 7 DRIFTS of NH2OH at 20℃ on (a)0.1Pt/ Al2O3 (b) 0.5Pt/ Al2O3 (c) 1Pt/ Al2O3 (d) 2Pt/ Al2O3. Fig. 7 Fig. 8 DRIFTS of NH2OH at 60℃ on (a) 0.1Pt/ Al2O3 (b) 0.5Pt/ Al2O3 (c) 1Pt/ Al2O3 (d) 2Pt/ Al2O3. Fig. 8 Fig. 9 Potential energy profiles for HAN dissociation on Pt(111) surface. NH3OH’* represents the NH3OH* after rotation. TS1 and TS2 stand for transition states. The insets depict the optimized structural diagrams. Pt, O, N, and H atoms are represented by gray, red, light blue, and pink balls, respectively. Fig. 9 Table 1 Physical properties of xPt/Al2O3. Table 1 sample Pt loading a （wt%） SBET b (m2/g) Pt dispersion c (%) dTEM d (nm) TOF (s−1) 0.1Pt/ Al2O3 0.096 231.91 100 1.1 0.1 0.5Pt/ Al2O3 0.5 276.64 21 1.21 0.26 1Pt/ Al2O3 1 242.80 11 1.32 0.46 2Pt/ Al2O3 1.9 273.87 5.2 2.34 0.92 a Determined by ICP-AES; b Calculated from N2 adsorption/desorption experiments; c Determined by CO chemisorption at room temperature; d Characterized by TEM. Coordination number dependence of Pt catalysts for catalytic decomposition of aqueous hydroxylammonium nitrate (HAN) Shu Liu Formal analysis a b 1 Yujia Han Formal analysis a c 1 Teng Zong Methodology a b Chaojie Wang Investigation a Ming Tian Writing – original draft a ⁎ Lin Li Resources a Wansheng Zhang Resources a Wentao Wang Resources a Xiaodong Wang Writing – review & editing a ⁎ a CAS Key Laboratory of Science and Technology on Applied Catalysis, Dalian Institute of Chemical Physics, Chinese Academy of Sciences, 457 Zhongshan Road, Dalian 116023, China CAS Key Laboratory of Science and Technology on Applied Catalysis, Dalian Institute of Chemical Physics, Chinese Academy of Sciences 457 Zhongshan Road Dalian 116023 China CAS Key Laboratory of Science and Technology on Applied Catalysis, Dalian Institute of Chemical Physics, Chinese Academy of Sciences, 457 Zhongshan Road, Dalian 116023, People's Republic of China b University of Chinese Academy of Sciences, No.19(A) Yuquan Road, Shijingshan District, Beijing 100049, China University of Chinese Academy of Sciences No.19(A) Yuquan Road, Shijingshan District Beijing 100049 China University of Chinese Academy of Sciences, No.19(A) Yuquan Road, Shijingshan District, Beijing 100049, China c Suzhou Laboratory, Suzhou, China Suzhou Laboratory Suzhou China Suzhou Laboratory, Suzhou, China ⁎ Corresponding authors. 1 These authors contributed to this paper equally. To uncover the relation between active metals structure and the adsorption, activation as well as its decomposition performance of hydroxylamine nitrate (HAN) that has been considered to be a promising low-toxicity monopropellant for spacecrafts, the performance of xPt/Al2O3 with various Pt loadings (x = 0.1, 0.5, 1 and 2, indicates the mass percentage of Pt) was evaluated in the aqueous HAN (10 wt%) decomposition. It was found that the both the NH3OH+ conversion and the turnover frequency (TOF) enhanced as Pt loadings increased while NO3 - was hardly converted at the temperature of lower than 120 ℃ for xPt/Al2O3, and 2Pt/Al2O3 exhibited the best activity with almost 100 % NH3OH+ conversion, 20 % NH4 + selectivity and 80 % N2O selectivity at around 120 ℃, respectively. This originated from the increased Pt coordinated number of active sites with sufficiently continuous Pt sites caused by its enhanced particle size with loadings, which was beneficial to the cracking of N-O, O-H and N-H bonds together thus the activation and conversion of NH3OH+ to NH4 + and N2O. Graphical Abstract Keywords Coordination number dependence Hydroxylamine nitrate Catalytic performance Adsorption and activation Data availability Data will be made available on request. 1 Introduction The orbital and attitude control of aircrafts is achieved by the decomposition of propellants fed into the thruster to produce high-pressure and -temperature gases [1–3]. The market of monopropellant systems is being dominated by hydrazine thrusters for decades despite its toxic characteristics recognized [4,5]. As a result, it is of great significance to develop green monopropellant for safer handling and higher cost effectiveness compared with conventional hydrazine propellant in small spacecrafts and satellites. Hereinto, monopropellants based on an aqueous solution of hydroxylammonium nitrate (HAN) with chemical formula [NH3OH+][NO3 -] have received considerable attention due to their high energy density, a low freezing point, high solubility in aqueous media, green post combustion and chemical stability [6–8]. Compared with thermal decomposition that requires temperature > 130 ℃, catalytic decomposition is able to decrease the ignition temperature to less than 40 ℃ and exhibits higher reaction rate, which achieves higher decomposition efficiency with larger heat release, gas formation and without preheating catalysts [9–11]. At present, the study on the catalytic decomposition of HAN is less than that on thermal one and principally concentrates on the performance evaluation of catalysts including the supported metals and metal oxides [12]. The supported noble metals have been reported the most and it is generally accepted that Pt- [13,14] and Ir-based [15] catalysts exhibited higher decomposition activity with the onset temperature even at room temperature than the supported non-noble metals such as Cu-based [16] and the metal oxides such as cobalt-doped cerium oxides [17,18] and Mn-substituted Sr-based hexaaluminates[19]. In addition, the researchers studied the influence of various factors on the performance of supported Pt and Ir catalysts. For example, Si-doped Al2O3 supported Pt in the form of powder exhibited higher activity than its sphere counterpart due to a good contact between catalyst bed and monopropellant [20]. The similar behavior was also observed in supported Ir in which grain catalyst showed better performance compared with monolith one [21]. Besides the shape of catalysts, the influence of particle size of metals on the performance was also studied. Pt/Si-Al prepared by the impregnation presented higher activity than that prepared by the sol-gel due to smaller Pt particle size (2 nm vs. 50 nm) [22]. Ir/SiO2 with Ir particle size of around 2.4 nm exhibited higher activity than Ir/Al2O3 did with Ir particle size of about 1.3 nm [23]. To the best of our knowledge, the influence of particle size and electronic state of metals on the adsorption and activation of HAN as well as decomposition activity is still unknown. In the present work, the performance of xPt/Al2O3 with varied Pt loadings (x = 0.1, 0.5, 1 and 2 wt%) was evaluated for the decomposition of HAN aqueous solution (10 vol%). The results indicated that NH3OH+ conversion and turnover frequency (TOF) increased with Pt loadings and the former reached 100 % for 2Pt/Al2O3 at 120 ℃ with NH4 + selectivity of about 80 % and N2O selectivity of about 20 % while NO3 - was hardly converted below this temperature. A series of characterization results clarified that the coordinated number of Pt0 species enhanced due to the increased size of Pt nanoparticles with loadings, which facilitated the concurrent breakage of N-O, O-H and N-H bonds thus the activation and conversion of NH3OH+ to NH4 + and N2O. 2 Experimental 2.1 Preparation of xPt/Al2O3 All the xPt/Al2O3 samples, in which x indicated theoretical mass fraction of Pt, were prepared by equal volume wetness impregnation method. Typically, to prepared 2Pt/Al2O3, H2PtCl6·6 H2O (1 g) was dissolved in ultrapure water (100 mL) with stirring to obtain a yellow Pt solution (7.42 mg/mL). 0.5 g γ- Al2O3(<28 mesh, 220 m2·g−1) was placed in a 3 mL glass vial by slowly adding dropwise 1.347 mL H2PtCl6 solution with shaking vigorously. After standing at room temperature overnight, the sample was dried at 100 ℃ for 12 h and was in situ reduced by a H2/Ar (2:5, v/v; 70 mL·min−1) atmosphere at 350 ℃ for 2 h (heating rate: 5 ℃·min−1) in a quartz tube microreactor. 2.2 Performance evaluations The performance evaluations were carried out in a high-pressure continuous flow fixed-bed reactor [24]. The catalyst sample (0.5 g, ＜28 mesh) was diluted with 0.5 g quartz sand (16–26 mesh, Guoyao, China) and then fixed at the middle of a 316 L stainless steel tube (10 mm ID). At both ends of the catalyst, 2 mL quartz sands (20–40 mesh, Tianjin University) were used to obtain a uniform fluid flow. The reactor was placed in a vertical electrical furnace with two thermocouples outside the reactor and below the catalyst bed. The system pressure was raised to 1 MPa before reaction to increase the boiling point of water and ensure the reaction environment of the liquid phase. Then hydroxylamine nitrate (10 wt% HAN aqueous solution) was introduced into the reaction tube at a flow rate of 0.5 mL/min with Ar at gas hourly space velocity (GHSV) of 12000 mL/(g·h). Prior to measurement, the catalyst was reduced in situ in a H2/Ar atmosphere (2:5, v/v; 70 mL·min−1) at 350 ℃ for 2 h. The outlet gas was detected and quantified by using GAM200 quadrupole mass spectrometer (MS) while liquid effluent was collected in a cold trap, sampled every 20 min and then analyzed by potentiometric titration with KMnO4 for NH3OH+ and in an ion chromatograph for NH4 + and NO3 -. The details of the sampling and detection of the liquid effluent could be seen in the Supporting Information. The calculations of NH3OH+ conversion, NO3 - conversion, N2O selectivity, N2 selectivity, NO selectivity, NH4 + selectivity, and nitrogen balance were given as followed. X NH 3 OH + ( % ) = W NH 3 O H + , in − W NH 3 O H + , out W NH 3 O H + , in × 100 % X NO 3 − ( % ) = C NO 3 − , in − C NO 3 − , out C NO 3 − , in × 100 % S N 2 O ( % ) = F × ∫ 0 t y N 2 O , out dt 22.4 F × ∫ 0 t y N 2 O , out + y N 2 , out + y NO , out dt 22.4 + C NH 4 + , out × t * Q M NH 4 + × 100 % S N 2 ( % ) = F × ∫ 0 t y N 2 , out dt 22.4 F × ∫ 0 t y N 2 O , out + y N 2 , out + y NO , out dt 22.4 + C NH 4 + , out × t * Q M NH 4 + × 100 % S NO ( % ) = F × ∫ 0 t y NO , out dt 22.4 F × ∫ 0 t y N 2 O , out + y N 2 , out + y NO , out dt 22.4 + C NH 4 + , out × t * Q M NH 4 + × 100 % S NH 4 + ( % ) = C NH 4 + , out * t * Q M NH 4 + F × ∫ 0 t y N 2 O , out + y N 2 , out + y NO , out dt 22.4 + C NH 4 + , out × t * Q M NH 4 + × 100 % Where F represents the gas flow rate in reduction step, C is the corresponding concentration in the liquid, y is the corresponding gas concentration, M is the mass of the material, and Q is the liquid flow. WNH3OH+ is calculated by potentiometric titration with KMnO4, CNO3- and CNH4+ was obtained in an ion chromatograph. 2.3 Characterization of xPt/Al2O3 The crystal phases of the sample were measured by PANalytical X′Pert-Pro powder X-ray diffractometer with Cu Kα radiation of 0.1541 nm. The scanned 2θ range was 10–90° at 40 kV and 40 mA. The Brunauer–Emmett–Teller (BET) surface areas and the pore size distributions of xPt/Al2O3 were performed on a Micromeritics ASAP 2010 apparatus. The samples were degassed in a vacuum at 110 and 350 ℃ for 1 and 5 h before characterization, respectively. The adsorption–desorption isotherms were then measured at the temperature of liquid nitrogen (−196 ℃) using nitrogen as the adsorption gas. The specific surface areas were calculated by the Brunauer–Emmett–Teller (BET) method and the pore size distributions were given by the Barrett–Joyner–Halenda (BJH) model. The particle size and distribution of Pt in xPt/Al2O3 were identified by a field emission transmission electron microscope (JEOL JEM-2100F). The AC-HAADF-STEM analysis was performed on a JEOL JEM-ARM200F equipped with a CEOS probe corrector with a guaranteed resolution of 0.08 nm. The metal content of xPt/Al2O3 was determined using a PerkinElmer 7300DV ICP-OES spectrometer. Hydrogen temperature-programmed reduction (H2-TPR) and CO pulse chemisorption measurements were carried out on a Micromeritics Autochem II 2920. For the H2-TPR test, the sample (0.1 g) was firstly pretreated at 110 ℃ in Ar atmosphere for 30 min followed by cooled to 50 ℃. Then, the gas was switched to a 10 % H2/Ar (30 mL·min−1) and the temperature was increased from 50 to 600 ℃ with a heating rate of 10 ℃·min−1. For the CO-pulse experiment, 0.1 g of xPt/Al2O3 was pretreated in 10 % H2/Ar (30 mL·min−1) at a ramping rate of 10 ℃/min to 350 ℃ and maintained for 30 min. Then, Ar was purged into the tube with the rate of 30 mL·min−1 under 360 ℃ for 30 min to remove the surface adsorbed hydrogen. After cooling to 50 ℃, the CO pulse was injected every 6 min and its adsorption measurement was performed under this temperature. In-situ diffuse reflectance infrared Fourier transform spectroscopy (in-situ DRIFTS) was recorded on a Bruker EQUINOX 70 equipped with an in-situ DRIFTS cell and a mercury–cadmium–telluride (MCT) detector cooled by liquid N2. All of the samples were pretreated at 350 ℃ for 30 min under H2/He (2:5, v/v; 20 mL·min−1), followed by purging with He at 360 ℃ for 30 min, and then catalysts were cooled down to 20 ℃ under He. Each spectrum was performed by averaging 32 scans with a resolution of 4 cm−1 in the 4000–1000 cm−1 range under 20 ℃ to avoid background changes and temperature-induced features. For the in-situ CO-DRIFT test, after recording the background, the CO/He flow (1:4, v/v; 10 mL·min−1) was introduced into the cell, and the DRIFTS were collected every 1 min. When the adsorption was saturated, He (10 mL) entered into the cell and the spectra were collected every 1 min until the gas phase peak disappeared. For the in-situ DRIFTS with the introduction of NH2OH, a high purity He (10 mL·min−1) was feed into the reaction cell followed by the introduction of 10 wt% NH2OH aqueous solution after background data was recorded in 20 ℃ and 60 ℃, and the diffuse signals were collected every 1 min. 2.4 Computational details All first-principle calculations in this study were performed by the density functional theory (DFT) using the Vienna Ab-initio Simulation Package (VASP) code [25]. The generalized gradient approximation (GGA) with the exchange-correlation functional Perdew-Burke-Ernzerhof (PBE) was adopted to describe the electronic exchange and correlation effects [26–28]. The cutoff energy for the plane-wave basis was set to 500 eV in all the cases. To study the catalytic activity of metallic Pt, Pt(111) surface model was constructed based on our experiments and simulated by a p(3 ×3) slab consisting of 5 layers. During the geometric optimization, the top 2 layers together with the adsorbate were relaxed. A 15 Å vacuum layer was applied to separate the periodic model in the z-direction of the slab models. Numerical integration over the Brillouin zone was sampled with the Monkhorst-Pack grids with the density of one point per ∼0.03 Å−3 [29]. The convergence of geometric optimization was checked with the forces less than 0.03 eV Å−1 and the energy difference less than 10−6 eV. The D3 Grimme correction was adopted for the consideration of van der Waals (vdW) interactions in all reaction processes [30]. The nudged elastic band (NEB) combined with minimum-mode following dimer method was employed to obtain the transition state structure of the reaction [31]. Moreover, the calculations were considered converged when the maximum forces on all atoms were less than 0.05 eV Å−1. Meanwhile, the transition state was verified using the single imaginary frequency. The adsorption energy (E ads ) of HAN on Pt(111) surface is estimated by the following formula: Eads = EHAN+Pt(111) - EPt(111) - EHAN where E HAN+Pt(111) is the total energy of the Pt(111) adsorbed with HAN molecule, E Pt(111) is the total energy of Pt(111), and E HAN is the total energy of HAN molecule. The reaction energies (ΔE) of HAN on Pt(111) surface are estimated by the following formula: ΔE = E FS - E IS where E FS is the total energy of Pt(111) adsorbed with final species, E IS is the total energy of Pt(111) adsorbed with initial species. The activation energies (E a ) of HAN dissociation on Pt(111) surface are estimated by the following formula: E a = E TS - E IS where E TS is the total energy of transition state of HAN dissociated on Pt(111) surface, E IS is the total energy of Pt(111) adsorbed with initial species. 3 Results and discussion 3.1 Performance evaluation of xPt/Al2O3 The performance tests were carried out in the pressured continuous-flow fixed bed reactor and the results are shown in Fig. 1, Figs. S1 and 2. Fig. 1 shows the activity of HAN aqueous solution decomposition over xPt/Al2O3. It could be seen that the NH3OH+ conversion increased with Pt loadings and 2Pt/Al2O3 exhibited the best activity with almost 100 % conversion at around 120 ℃. The turnover frequency (TOF) was also listed in Table 1 wherein it also increased with Pt loadings, indicating that higher activity might be attributed to distinct structure of active sites rather than Pt amounts. In addition, the NO3 - could hardly be converted over 0.1Pt/Al2O3, 0.5Pt/Al2O3 and 1Pt/Al2O3 at temperature of lower than 120 ℃, and it began to be converted at temperature of higher than 100 ℃ and reached about 50 % at 120 ℃ over 2Pt/Al2O3 (Fig. 1b), indicating that NH3OH+ was more easily activated and converted than NO3 - over xPt/Al2O3. The distribution of products at various reaction temperature is shown in Fig. 2. All the catalysts exhibited similar selectivity of NH4 + and N2O of about 70 % and 30 %, respectively, at temperature of lower than 120 ℃ while N2O selectivity significantly increased to around 80 % with the decrease in NH4 + selectivity to about 20 % over 2Pt/Al2O3 at 120 ℃. Combined with conversion results (Fig. 1), it could be concluded that NH3OH+ alone decomposed to produce NH4 + and N2O nitrogen-containing products at relatively low temperature (<100 ℃), as presented in the following equation: 4 NH 3 OH + → 2 NH 4 + + N 2 O + 2 H + + 3 H 2 O and then NO3 - participated in the reaction leading to the formation of larger amount of N2O at higher temperature, as presented in the following equation: NH 4 + + NO 3 − → N 2 O + 2 H 2 O 3.2 Characterization of xPt/Al2O3 Table 1 shows the detailed properties of the xPt/Al2O3 catalysts. The actual loadings of Pt analyzed by ICP-AES were close to the nominal values and the surface areas of catalysts with different loadings were 232 −277 m2/g with a slight increase after Pt introduction (220 m2·g−1 for Al2O3). The Pt dispersions determined by CO chemisorption declined along with the increase in Pt loading. X-ray diffraction (XRD) patterns of xPt/Al2O3 are shown in Fig. 3. It could be observed that the peaks attributed to Al2O3 without those of Pt species could be detected due to high dispersion of Pt. HAADF-STEM and AC-TEM characterizations were carried out to study the particle sizes and distribution of Pt species. As shown in Fig. 4, small amount of Pt sub-nano clusters could be observed for 0.1Pt/Al2O3 with average particle size of about 1.1 nm (Fig. 4a, e, insets and Table 1). The number of Pt particles was few induced by low Pt loading (0.1 wt%), which might account for the discrepancy on Pt dispersion between TEM and CO chemisorption results. Following an increase of the Pt loadings, more Pt nanoparticles were detected with the increase in the average sizes to around 1.2 nm, 1.3 nm and 2.3 nm for 0.5Pt/Al2O3, 1Pt/Al2O3 and 2Pt/Al2O3, respectively (Fig. 4b-d, f, g, insets and Table 1), probably due to slight aggregation of Pt particles. Combined with the results of activity tests (Fig. 1), Pt nanoparticles with larger size should be favorable for NH3OH+ conversion. In-situ CO-DRIFT was employed to make sure the chemical state of Pt in xPt/Al2O3 after reduction under H2 atmosphere at 350 ℃ (Most of Pt in all the samples could be reduced at this temperature as shown in Fig. 5) and the results were shown in Fig. 6. The broad bands in the range between 1960 and 2100 cm−1 could be observed besides the two ones at 2176 cm−1 and 2112 cm−1 due to gaseous CO [32,33] for all the samples, which could be attributed to linear adsorption of CO on the metallic Pt sites [34,35], indicating that Pt was present in the form of metallic state. In addition, a new band at around 1820 cm−1 besides those between 1960 and 2100 cm−1 appeared with the increase in the Pt loadings, which could be assigned to bridged CO species adsorbed on neighboring Pt nanoparticles [36], indicating the presence of Pt with larger particle sizes in line with the results of HRTEM. In addition, blue-shift of the bands between 1960 and 2100 cm−1 occurred, which should be induced by the increase in the coordination number of Pt nanoparticle [34,36]. Such the well-coordinated Pt sites caused by the increase of particle size might be conductive to the adsorption and activation of NH3OH+ and thus its conversion. 3.3 Discussion At present, the study of catalytic decomposition of HAN principally focused on the performance evaluation of catalysts. To the best of our knowledge, the relationship between the adsorption and activation of bonds in HAN aqueous solution and activity has been rarely investigated, which was important for the design of catalysts with superior performance. Herein, in-situ DRIFT was employed to study the activation of bonds using hydroxylamine (10 wt% aqueous solution) as the probe molecule considering that the NO3 - was hardly converted at temperature lower than 100 ℃ (Fig. 1) in the present work. As shown in Fig. 7, a negative band at around 1100 cm−1 belonging to stretching vibration of N-O bonds in NH2OH [37] was observed for all the samples after feeding NH2OH aqueous solution for 20 min at 20 ℃ but its intensity increased with Pt loadings, which indicated the enhanced activation of N-O bonds. Moreover, three positive bands at about 1610 cm−1, 1565 cm−1 and 1450 cm−1 were detected for 0.1Pt/Al2O3, 0.5Pt/Al2O3 and 1Pt/Al2O3, which could be attributed to vibrational features of NH3 and NHx [38]. This indicated that NH3 should form by the activation and breakage of O-H bonds besides N-O ones on Pt sites. Distinct bands (1686 cm−1, 1390 cm−1 and 1270 cm−1) which were due to the vibration of NH4 + [39] were observed in 2Pt/Al2O3, indicating that O-H bonds could be activated more easily on 2Pt/Al2O3 leading to the formation of larger amount of NH3. In addition, an obvious band at about 1540 cm−1 was detected, which could be ascribed to HNO, a vital intermediate considered for the production of N2O [40]. This suggested that the N-H bonds which was reported to possess larger dissociation energy than N-O and O-H ones in NH2OH [41] also cracked except for the N-O and O-H ones. With the increase of the temperature to 60 ℃, all the samples exhibited similar bands at 1686 cm−1, 1480 cm−1, 1459 cm−1 and 1400 cm−1 attributed to the vibration of NH4 + accompanied with gaseous peaks of N2O (2240 cm−1 and 1280 cm−1), and two new bands at 1280 cm−1 and 1055 cm−1 ascribed to NH deformation adsorbed on metal sites [38] appeared on 2Pt/Al2O3 ( Fig. 8), indicating that the reaction extent became greater. However, their intensity increased with Pt loadings, which should be because the samples with larger Pt amount was more conductive to activating NH2OH. Combined with the characterization results (Fig. 6), it was speculated that the active sites with higher Pt coordinated number facilitated concurrent breakage of N-O, O-H and particular N-H bonds with larger dissociation energy and thus the activation and conversion of NH3OH+. To the best of our knowledge, the study on reaction mechanism mainly concentrated on thermal decomposition of HAN whereas that on catalytic decomposition whether experimental or theoretical has been seldom reported at present. Herein, we tried to calculate HAN adsorption and activation to form NH4* and O* on Pt(111), and the results are shown in Figs. 9 and S3. HAN adsorbed on two adjacent Pt sites in a bidentate bridging fashion via two O atoms from the NO3 - group. Then the N-O bond in NH3OH+ stretched and cleaved allowing the formation of OH* bridging adsorbed on two adjacent Pt sites and NH3*. As the H atom from OH moved closer to the N atom of NH3, the O-H bond broke leading to the formation of NH4 + and adsorbed O atom. This reaction was exothermic and the energy barrier of O-H bond breaking was higher than that of N-O doing (0.74 eV vs. 0.37 eV). The DFT calculations of reaction mechanism on the NO3 - conversion and N2O formation on the supported metal catalysts would be carried out combined with the development of efficient characterization techniques in the future work. 4 Conclusions In summary, NH3OH+ conversion and TOF increased with Pt loadings, and 2Pt/Al2O3 exhibited the best performance with NH3OH+ conversion of 100 %, NH4 + selectivity of about 20 % and N2O selectivity of about 80 % at 120 °C whereas NO3 - conversion was almost negligible below this temperature. This could be attributed to the enhancement of Pt coordination number with sufficiently continuous Pt ensemble as its loadings caused by the increase in the particle size, which improved the breakage of N-O, O-H and N-H bonds and thus the activation of NH3OH+. This work proposed a strategy to design highly efficient supported metals catalysts for aqueous HAN decomposition with suitable metal coordination number to promote the adsorption and activation for NH3OH+. CRediT authorship contribution statement Xiaodong Wang: Writing – review & editing. Wansheng Zhang: Resources. Wentao Wang: Resources. Teng Zong: Methodology. Chaojie Wang: Investigation. Ming Tian: Writing – original draft. Lin Li: Resources. Shu Liu: Formal analysis. Yujia Han: Formal analysis. Declaration of Competing Interest The authors declare that they have no known competing financial interests or personal relationships that could have appeared to influence the work reported in this paper. Acknowledgements This work was supported by the National Natural Science Foundation of China (NSFC) grants (22178337 and 22378387) and National Key Research and Development Program of China (2022YFB4602505). The authors sincerely thank Yang Su and Xiaoli Pan for their contributions to HRTEM characterization. Appendix A Supporting information Supplementary data associated with this article can be found in the online version at doi:10.1016/j.apcata.2025.120457. Appendix A Supplementary material Supplementary material References [1] J. Fang Z. Wang H. Yan H. Gao Z. Yao S. Li Experimental study on the catalytic ignition characteristics of a dual-mode ionic liquid propellant in model thrusters Energies 15 2022 8730 J. Fang, Z. Wang, H. Yan, H. Gao, Z. Yao, S. Li, Experimental Study on the Catalytic Ignition Characteristics of a Dual-Mode Ionic Liquid Propellant in Model Thrusters, Energies, 15 (2022) 8730. [2] N.R. Taylor M.H. Brummel M.M. Mooney T.V. Kerber K.M. Lemmer On the formation of ammonia from the thermal decomposition of hydroxylammonium nitrate vapor J. Ion. Liq. 4 2024 100083 N.R. Taylor, M.H. Brummel, M.M. Mooney, T.V. Kerber, K.M. Lemmer, On the formation of ammonia from the thermal decomposition of hydroxylammonium nitrate vapor, Journal of Ionic Liquids, 4 (2024) 100083. [3] R. Amrousse T. Katsumi N. Itouyama N. Azuma H. Kagawa K. Hatai H. Ikeda K. Hori New HAN-based mixtures for reaction control system and low toxic spacecraft propulsion subsystem: thermal decomposition and possible thruster applications Combust. Flame 162 2015 2686 2692 R. Amrousse, T. Katsumi, N. Itouyama, N. Azuma, H. Kagawa, K. Hatai, H. Ikeda, K. Hori, New HAN-based mixtures for reaction control system and low toxic spacecraft propulsion subsystem: Thermal decomposition and possible thruster applications, Combustion and Flame, 162 (2015) 2686-2692. [4] R.K. Masse R.L. Sackheim Green propulsion advancement - challenging the maturity of monopropellant hydrazine in: Proceedings of the Firty Ninth AIAA/ASME/SAE/ASEE Joint Propulsion Conference 2013 265 276 R.K. Masse, R.L. Sackheim, Green Propulsion Advancement - Challenging the Maturity of Monopropellant Hydrazine, 49th AIAA/ASME/SAE/ASEE Joint Propulsion Conference, 2013, pp. 265-276. [5] V.A. Matyshak O.N. Silchenkova Catalytic decomposition of hydrazine and hydrazine derivatives to produce hydrogen-containing gas mixtures: a review Kinet. Catal. 63 2022 339 350 V.A. Matyshak, O.N. Silchenkova, Catalytic Decomposition of Hydrazine and Hydrazine Derivatives to Produce Hydrogen-Containing Gas Mixtures: A Review, Kinetics and Catalysis, 63 (2022) 339-350. [6] W.S. Chai K.H. Cheah M.-H. Wu K.S. Koh D. Sun H. Meng A review on hydroxylammonium nitrate (HAN) decomposition techniques for propulsion application Acta Astronaut. 196 2022 194 214 W.S. Chai, K.H. Cheah, M.-H. Wu, K.S. Koh, D. Sun, H. Meng, A review on hydroxylammonium nitrate (HAN) decomposition techniques for propulsion application, Acta Astronautica, 196 (2022) 194-214. [7] H. Lee S. Thynell H. Lee S. Thynell Confined rapid thermolysis/FTIR spectroscopy of hydroxylammonium nitrate in: Proceedings of the Thirty Third Joint Propulsion Conference and Exhibit. 1997 3232 H. Lee, S. Thynell, H. Lee, S. Thynell, Confined rapid thermolysis/FTIR spectroscopy of hydroxylammonium nitrate, 33rd Joint Propulsion Conference and Exhibit, 1997, pp. 3232. [8] J.C. Oxley K.R. Brower Thermal decomposition of hydroxylamine nitrate Propulsion 872 1988 63 70 J.C. Oxley, K.R. Brower, Thermal decomposition of hydroxylamine nitrate, Propulsion, 872 (1988) 63-70. [9] R. Amrousse T. Katsumi N. Azuma K. Hori Hydroxylammonium nitrate (HAN)-based green propellant as alternative energy resource for potential hydrazine substitution: from lab scale to pilot plant scale-up Combust. Flame 176 2017 334 348 R. Amrousse, T. Katsumi, N. Azuma, K. Hori, Hydroxylammonium nitrate (HAN)-based green propellant as alternative energy resource for potential hydrazine substitution: From lab scale to pilot plant scale-up, Combustion and Flame, 176 (2017) 334-348. [10] C.H. Hwang S.W. Baek S.J. Cho Experimental investigation of decomposition and evaporation characteristics of HAN-based monopropellants Combust. Flame 161 2014 1109 1116 C.H. Hwang, S.W. Baek, S.J. Cho, Experimental investigation of decomposition and evaporation characteristics of HAN-based monopropellants, Combustion and Flame, 161 (2014) 1109-1116. [11] L. Courthéoux D. Amariei S. Rossignol C. Kappenstein Thermal and catalytic decomposition of HNF and HAN liquid ionic as propellants Appl. Catal. B Environ. 62 2006 217 225 L. Courthéoux, D. Amariei, S. Rossignol, C. Kappenstein, Thermal and catalytic decomposition of HNF and HAN liquid ionic as propellants, Applied Catalysis B: Environmental, 62 (2006) 217-225. [12] W.S. Chai K.S. Koh K.H. Cheah Hydroxylammonium nitrate—the next generation green propellant Space Micropropulsion for Nanosatellites 2022 285 305 W.S. Chai, K.S. Koh, K.H. Cheah, Hydroxylammonium nitrate—the next generation green propellant, Space Micropropulsion for Nanosatellites2022, pp. 285-305. [13] L. Courtheoux E. Gautron S. Rossignol C. Kappenstein Transformation of platinum supported on silicon-doped alumina during the catalytic decomposition of energetic ionic liquid J. Catal. 232 2005 10 18 L. Courtheoux, E. Gautron, S. Rossignol, C. Kappenstein, Transformation of platinum supported on silicon-doped alumina during the catalytic decomposition of energetic ionic liquid, Journal of Catalysis, 232 (2005) 10-18. [14] L. Courthéoux F. Popa E. Gautron S. Rossignol C. Kappenstein Platinum supported on doped alumina catalysts for propulsion applications. Xerogels versus aerogels J. Non Cryst. Solids 350 2004 113 119 L. Courthéoux, F. Popa, E. Gautron, S. Rossignol, C. Kappenstein, Platinum supported on doped alumina catalysts for propulsion applications. Xerogels versus aerogels, Journal of Non-Crystalline Solids, 350 (2004) 113-119. [15] R. Amrousse T. Katsumi Y. Niboshi N. Azuma A. Bachar K. Hori Performance and deactivation of Ir-based catalyst during hydroxylammonium nitrate catalytic decomposition Appl. Catal. A Gen. 452 2013 64 68 R. Amrousse, T. Katsumi, Y. Niboshi, N. Azuma, A. Bachar, K. Hori, Performance and deactivation of Ir-based catalyst during hydroxylammonium nitrate catalytic decomposition, Applied Catalysis A: General, 452 (2013) 64-68. [16] D. Yoo M. Kim S.K. Oh S. Hwang S. Kim W. Kim Y. Kwon Y. Jo J.-K. Jeon Synthesis of Hydroxylammonium nitrate and its decomposition over metal oxide/honeycomb catalysts Catalysts 14 2024 166 D. Yoo, M. Kim, S.K. Oh, S. Hwang, S. Kim, W. Kim, Y. Kwon, Y. Jo, J.-K. Jeon, Synthesis of Hydroxylammonium Nitrate and Its Decomposition over Metal Oxide/Honeycomb Catalysts, Catalysts, 14 (2024) 166. [17] R. Agnihotri C. Oommen Evaluation of hydroxylammonium nitrate (HAN) decomposition using bifunctional catalyst for thruster application Mol. Catal. 486 2020 110851 R. Agnihotri, C. Oommen, Evaluation of hydroxylammonium nitrate (HAN) decomposition using bifunctional catalyst for thruster application, Molecular Catalysis, 486 (2020) 110851. [18] R. Agnihotri C. Oommen Cerium oxide based active catalyst for hydroxylammonium nitrate (HAN) fueled monopropellant thrusters RSC Adv. 8 2018 22293 22302 R. Agnihotri, C. Oommen, Cerium oxide based active catalyst for hydroxylammonium nitrate (HAN) fueled monopropellant thrusters, RSC Advances, 8 (2018) 22293-22302. [19] S. Hong S. Heo W. Kim Y.M. Jo Y.-K. Park J.-K. Jeon Catalytic decomposition of an energetic ionic liquid solution over hexaaluminate catalysts Catalysts 9 2019 80 S. Hong, S. Heo, W. Kim, Y.M. Jo, Y.-K. Park, J.-K. Jeon, Catalytic Decomposition of an Energetic Ionic Liquid Solution over Hexaaluminate Catalysts, Catalysts, 9 (2019) 80. [20] D. Amariei L. Courthéoux S. Rossignol C. Kappenstein Catalytic and thermal decomposition of ionic liquid monopropellants using a dynamic reactor Chem. Eng. Process. Process.Intensif. 46 2007 165 174 D. Amariei, L. Courthéoux, S. Rossignol, C. Kappenstein, Catalytic and thermal decomposition of ionic liquid monopropellants using a dynamic reactor, Chemical Engineering and Processing: Process Intensification, 46 (2007) 165-174. [21] R. Amrousse T. Katsumi A. Bachar R. Brahmi M. Bensitel K. Hori Chemical engineering study for hydroxylammonium nitrate monopropellant decomposition over monolith and grain metal-based catalysts React. Kinet. Mech. Catal. 111 2013 71 88 R. Amrousse, T. Katsumi, A. Bachar, R. Brahmi, M. Bensitel, K. Hori, Chemical engineering study for hydroxylammonium nitrate monopropellant decomposition over monolith and grain metal-based catalysts, Reaction Kinetics, Mechanisms and Catalysis, 111 (2013) 71-88. [22] Aurelien F. Popa L. Courthéoux E. Gautron S. Rossignol C. Kappenstein Aerogel and xerogel catalysts based on θ-alumina doped with silicon for high temperature reactions Eur. J. Inorg. Chem. 2005 2005 543 554 Aurelien F. Popa, L. Courthéoux, E. Gautron, S. Rossignol, C. Kappenstein, Aerogel and Xerogel Catalysts Based on θ-Alumina Doped with Silicon for High Temperature Reactions, European Journal of Inorganic Chemistry, 2005 (2005) 543-554. [23] X. Ren M. Li A. Wang L. Li X. Wang T. Zhang Catalytic decomposition of hydroxyl ammonium nitrate at room temperature Chin. J. Catal. 28 2007 1 2 X. Ren, M. Li, A. Wang, L. Li, X. Wang, T. Zhang, Catalytic decomposition of hydroxyl ammonium nitrate at room temperature, Chinese Journal of Catalysis, 28 (2007) 1-2. [24] S. Liu C. Wang T. Zong M. Tian W. Zhang X. Wang Study on the catalytic decomposition of hydroxylammonium nitrate aqueous solution in a high-pressure continuous flow fixed bed reactor Chin. J. Explos. Propellants 48 2025 460 467 S. Liu, C. Wang, T. Zong, M. Tian, W. Zhang, X. Wang, Study on the catalytic decomposition of hydroxylammonium nitrate aqueous solution in a high-pressure continuous flow fixed bed reactor, Chinese Journal of Explosives & Propellants, 48 (2025) 460-467. [25] G. Kresse J. Furthmüller Efficiency of ab-initio total energy calculations for metals and semiconductors using a plane-wave basis set Comput. Mater. Sci. 6 1996 15 50 G. Kresse, J. Furthmüller, Efficiency of ab-initio total energy calculations for metals and semiconductors using a plane-wave basis set, Computational Materials Science, 6 (1996) 15-50. [26] P.E. Blöchl Projector augmented-wave method Phys. Rev. B 50 1994 17953 17979 P.E. Blöchl, Projector augmented-wave method, Physical Review B, 50 (1994) 17953-17979. [27] J.P. Perdew K. Burke M. Ernzerhof Generalized gradient approximation made simple Phys. Rev. Lett. 77 1996 3865 3868 J.P. Perdew, K. Burke, M. Ernzerhof, Generalized Gradient Approximation Made Simple, Physical Review Letters, 77 (1996) 3865-3868. [28] G. Kresse D. Joubert From ultrasoft pseudopotentials to the projector augmented-wave method Phys. Rev. B 59 1999 1758 1775 G. Kresse, D. Joubert, From ultrasoft pseudopotentials to the projector augmented-wave method, Physical Review B, 59 (1999) 1758-1775. [29] H.J. Monkhorst J.D. Pack Special points for Brillouin-zone integrations Phys. Rev. B 13 1976 5188 5192 H.J. Monkhorst, J.D. Pack, Special points for Brillouin-zone integrations, Physical Review B, 13 (1976) 5188-5192. [30] S. Grimme J. Antony S. Ehrlich H. Krieg A consistent and accurate ab initio parametrization of density functional dispersion correction (DFT-D) for the 94 elements H-Pu J. Chem. Phys. 132 2010 S. Grimme, J. Antony, S. Ehrlich, H. Krieg, A consistent and accurate ab initio parametrization of density functional dispersion correction (DFT-D) for the 94 elements H-Pu, The Journal of Chemical Physics, 132 (2010). [31] G. Henkelman B.P. Uberuaga H. Jónsson A climbing image nudged elastic band method for finding saddle points and minimum energy paths J. Chem. Phys. 113 2000 9901 9904 G. Henkelman, B.P. Uberuaga, H. Jónsson, A climbing image nudged elastic band method for finding saddle points and minimum energy paths, The Journal of Chemical Physics, 113 (2000) 9901-9904. [32] Y. Han M. Tian C. Wang Y. Kang L. Kang Y. Su C. Huang T. Zong J. Lin B. Hou X. Pan X. Wang Highly active and anticoke Ni/CeO2 with ultralow Ni loading in chemical looping dry reforming via the strong metal–support interaction ACS Sustain. Chem. Eng. 9 2021 17276 17288 Y. Han, M. Tian, C. Wang, Y. Kang, L. Kang, Y. Su, C. Huang, T. Zong, J. Lin, B. Hou, X. Pan, X. Wang, Highly Active and Anticoke Ni/CeO2 with Ultralow Ni Loading in Chemical Looping Dry Reforming via the Strong Metal–Support Interaction, ACS Sustainable Chemistry & Engineering, 9 (2021) 17276-17288. [33] M. Wang Y. Zhang Z. Wu Y. Zheng Z. Zhou W. Weng Redox dynamics of platinum species on CeO2 during CO oxidation reaction Chem. Eng. J. 450 2022 138171 M. Wang, Y. Zhang, Z. Wu, Y. Zheng, Z. Zhou, W. Weng, Redox dynamics of platinum species on CeO2 during CO oxidation reaction, Chemical Engineering Journal, 450 (2022) 138171. [34] P. Bazin O. Saur J.C. Lavalley M. Daturi G. Blanchard FT-IR study of CO adsorption on Pt/CeO2: characterisation and structural rearrangement of small Pt particles Phys. Chem. Chem. Phys. 7 2005 187 P. Bazin, O. Saur, J.C. Lavalley, M. Daturi, G. Blanchard, FT-IR study of CO adsorption on Pt/CeO2: characterisation and structural rearrangement of small Pt particles, Physical Chemistry Chemical Physics, 7 (2005) 187. [35] S. Liu T. Wang X. Wu Y. Ma R. Ran D. Weng S. Liu Sintering behavior of platinum and modification effect of ceria on silica-alumina supports for diesel soot oxidation Appl. Surf. Sci. 635 2023 157781 S. Liu, T. Wang, X. Wu, Y. Ma, R. Ran, D. Weng, S. Liu, Sintering behavior of platinum and modification effect of ceria on silica-alumina supports for diesel soot oxidation, Applied Surface Science, 635 (2023) 157781. [36] H.A. Aleksandrov K.M. Neyman K.I. Hadjiivanov G.N. Vayssilov Can the state of platinum species be unambiguously determined by the stretching frequency of an adsorbed CO probe molecule? Phys. Chem. Chem. Phys. 18 2016 22108 22121 H.A. Aleksandrov, K.M. Neyman, K.I. Hadjiivanov, G.N. Vayssilov, Can the state of platinum species be unambiguously determined by the stretching frequency of an adsorbed CO probe molecule?, Physical Chemistry Chemical Physics, 18 (2016) 22108-22121. [37] W. Zhang Y. Zhou Y. Zhu Y. Guo B. Zhang L.H. Zhang F. Li F. Yu Boosting electrochemical nitrate reduction at low concentrations through simultaneous electronic states regulation and proton provision Small 20 2024 2404792 W. Zhang, Y. Zhou, Y. Zhu, Y. Guo, B. Zhang, L.H. Zhang, F. Li, F. Yu, Boosting Electrochemical Nitrate Reduction at Low Concentrations Through Simultaneous Electronic States Regulation and Proton Provision, Small, 20 (2024) 2404792. [38] L.R. Winter B. Ashford J. Hong A.B. Murphy J.G. Chen Identifying surface reaction intermediates in plasma catalytic ammonia synthesis ACS Catal. 10 2020 14763 14774 L.R. Winter, B. Ashford, J. Hong, A.B. Murphy, J.G. Chen, Identifying Surface Reaction Intermediates in Plasma Catalytic Ammonia Synthesis, ACS Catalysis, 10 (2020) 14763-14774. [39] X. Li P. Shen X. Li D. Ma K. Chu Sub-nm RuOx clusters on pd metallene for synergistically enhanced nitrate electroreduction to ammonia ACS Nano 2023 1081 1090 X. Li, P. Shen, X. Li, D. Ma, K. Chu, Sub-nm RuOx Clusters on Pd Metallene for Synergistically Enhanced Nitrate Electroreduction to Ammonia, ACS Nano, (2023) 1081-1090. [40] Y. Huang X. Li X. Hu X. Zhou Molecular dynamics simulation of thermal decomposition mechanism for HAN based monopropellant J. Rocket Propuls. 50 2024 106 113 Y. Huang, X. Li, X. Hu, X. Zhou, Molecular dynamics simulation of thermal decomposition mechanism for HAN based monopropellant, Journal of Rocket Propulsion, 50 (2024) 106-113. [41] J. Yan, Study on Thermal Hazards and Decomposition Mechanisms of Three Hydroxylamine Compounds, Nanjing University of Science and Technology, (2015).",
      "scopus-id": "105011159580",
      "coredata": {
        "eid": "1-s2.0-S0926860X25003588",
        "dc:description": "To uncover the relation between active metals structure and the adsorption, activation as well as its decomposition performance of hydroxylamine nitrate (HAN) that has been considered to be a promising low-toxicity monopropellant for spacecrafts, the performance of xPt/Al2O3 with various Pt loadings (x = 0.1, 0.5, 1 and 2, indicates the mass percentage of Pt) was evaluated in the aqueous HAN (10 wt%) decomposition. It was found that the both the NH3OH+ conversion and the turnover frequency (TOF) enhanced as Pt loadings increased while NO3 - was hardly converted at the temperature of lower than 120 ℃ for xPt/Al2O3, and 2Pt/Al2O3 exhibited the best activity with almost 100 % NH3OH+ conversion, 20 % NH4 + selectivity and 80 % N2O selectivity at around 120 ℃, respectively. This originated from the increased Pt coordinated number of active sites with sufficiently continuous Pt sites caused by its enhanced particle size with loadings, which was beneficial to the cracking of N-O, O-H and N-H bonds together thus the activation and conversion of NH3OH+ to NH4 + and N2O.",
        "openArchiveArticle": "false",
        "prism:coverDate": "2025-09-25",
        "openaccessUserLicense": null,
        "prism:aggregationType": "Journal",
        "prism:url": "https://api.elsevier.com/content/article/pii/S0926860X25003588",
        "dc:creator": [
          {
            "@_fa": "true",
            "$": "Liu, Shu"
          },
          {
            "@_fa": "true",
            "$": "Han, Yujia"
          },
          {
            "@_fa": "true",
            "$": "Zong, Teng"
          },
          {
            "@_fa": "true",
            "$": "Wang, Chaojie"
          },
          {
            "@_fa": "true",
            "$": "Tian, Ming"
          },
          {
            "@_fa": "true",
            "$": "Li, Lin"
          },
          {
            "@_fa": "true",
            "$": "Zhang, Wansheng"
          },
          {
            "@_fa": "true",
            "$": "Wang, Wentao"
          },
          {
            "@_fa": "true",
            "$": "Wang, Xiaodong"
          }
        ],
        "link": [
          {
            "@_fa": "true",
            "@rel": "self",
            "@href": "https://api.elsevier.com/content/article/pii/S0926860X25003588"
          },
          {
            "@_fa": "true",
            "@rel": "scidir",
            "@href": "https://www.sciencedirect.com/science/article/pii/S0926860X25003588"
          }
        ],
        "dc:format": "application/json",
        "openaccessType": null,
        "pii": "S0926-860X(25)00358-8",
        "prism:volume": "705",
        "articleNumber": "120457",
        "prism:publisher": "Elsevier B.V. All rights are reserved, including those for text and data mining, AI training, and similar technologies.",
        "dc:title": "Coordination number dependence of Pt catalysts for catalytic decomposition of aqueous hydroxylammonium nitrate (HAN)",
        "prism:copyright": "© 2025 Elsevier B.V. All rights are reserved, including those for text and data mining, AI training, and similar technologies.",
        "openaccess": "0",
        "prism:issn": "0926860X",
        "dcterms:subject": [
          {
            "@_fa": "true",
            "$": "Coordination number dependence"
          },
          {
            "@_fa": "true",
            "$": "Hydroxylamine nitrate"
          },
          {
            "@_fa": "true",
            "$": "Catalytic performance"
          },
          {
            "@_fa": "true",
            "$": "Adsorption and activation"
          }
        ],
        "openaccessArticle": "false",
        "prism:publicationName": "Applied Catalysis A: General",
        "openaccessSponsorType": null,
        "prism:pageRange": "120457",
        "pubType": "fla",
        "prism:coverDisplayDate": "25 September 2025",
        "prism:doi": "10.1016/j.apcata.2025.120457",
        "prism:startingPage": "120457",
        "dc:identifier": "doi:10.1016/j.apcata.2025.120457",
        "openaccessSponsorName": null
      },
      "objects": {
        "object": [
          {
            "@category": "standard",
            "@height": "282",
            "@width": "678",
            "@_fa": "true",
            "$": "https://api.elsevier.com/content/object/eid/1-s2.0-S0926860X25003588-gr1.jpg?httpAccept=%2A%2F%2A",
            "@multimediatype": "JPEG image file",
            "@type": "IMAGE-DOWNSAMPLED",
            "@size": "31545",
            "@ref": "gr1",
            "@mimetype": "image/jpeg"
          },
          {
            "@category": "standard",
            "@height": "242",
            "@width": "376",
            "@_fa": "true",
            "$": "https://api.elsevier.com/content/object/eid/1-s2.0-S0926860X25003588-gr9.jpg?httpAccept=%2A%2F%2A",
            "@multimediatype": "JPEG image file",
            "@type": "IMAGE-DOWNSAMPLED",
            "@size": "22206",
            "@ref": "gr9",
            "@mimetype": "image/jpeg"
          },
          {
            "@category": "standard",
            "@height": "590",
            "@width": "678",
            "@_fa": "true",
            "$": "https://api.elsevier.com/content/object/eid/1-s2.0-S0926860X25003588-gr8.jpg?httpAccept=%2A%2F%2A",
            "@multimediatype": "JPEG image file",
            "@type": "IMAGE-DOWNSAMPLED",
            "@size": "91147",
            "@ref": "gr8",
            "@mimetype": "image/jpeg"
          },
          {
            "@category": "standard",
            "@height": "590",
            "@width": "678",
            "@_fa": "true",
            "$": "https://api.elsevier.com/content/object/eid/1-s2.0-S0926860X25003588-gr7.jpg?httpAccept=%2A%2F%2A",
            "@multimediatype": "JPEG image file",
            "@type": "IMAGE-DOWNSAMPLED",
            "@size": "101071",
            "@ref": "gr7",
            "@mimetype": "image/jpeg"
          },
          {
            "@category": "standard",
            "@height": "582",
            "@width": "676",
            "@_fa": "true",
            "$": "https://api.elsevier.com/content/object/eid/1-s2.0-S0926860X25003588-gr6.jpg?httpAccept=%2A%2F%2A",
            "@multimediatype": "JPEG image file",
            "@type": "IMAGE-DOWNSAMPLED",
            "@size": "85390",
            "@ref": "gr6",
            "@mimetype": "image/jpeg"
          },
          {
            "@category": "standard",
            "@height": "236",
            "@width": "282",
            "@_fa": "true",
            "$": "https://api.elsevier.com/content/object/eid/1-s2.0-S0926860X25003588-gr5.jpg?httpAccept=%2A%2F%2A",
            "@multimediatype": "JPEG image file",
            "@type": "IMAGE-DOWNSAMPLED",
            "@size": "14805",
            "@ref": "gr5",
            "@mimetype": "image/jpeg"
          },
          {
            "@category": "standard",
            "@height": "398",
            "@width": "788",
            "@_fa": "true",
            "$": "https://api.elsevier.com/content/object/eid/1-s2.0-S0926860X25003588-gr4.jpg?httpAccept=%2A%2F%2A",
            "@multimediatype": "JPEG image file",
            "@type": "IMAGE-DOWNSAMPLED",
            "@size": "96000",
            "@ref": "gr4",
            "@mimetype": "image/jpeg"
          },
          {
            "@category": "standard",
            "@height": "284",
            "@width": "339",
            "@_fa": "true",
            "$": "https://api.elsevier.com/content/object/eid/1-s2.0-S0926860X25003588-gr3.jpg?httpAccept=%2A%2F%2A",
            "@multimediatype": "JPEG image file",
            "@type": "IMAGE-DOWNSAMPLED",
            "@size": "26350",
            "@ref": "gr3",
            "@mimetype": "image/jpeg"
          },
          {
            "@category": "standard",
            "@height": "536",
            "@width": "678",
            "@_fa": "true",
            "$": "https://api.elsevier.com/content/object/eid/1-s2.0-S0926860X25003588-gr2.jpg?httpAccept=%2A%2F%2A",
            "@multimediatype": "JPEG image file",
            "@type": "IMAGE-DOWNSAMPLED",
            "@size": "60736",
            "@ref": "gr2",
            "@mimetype": "image/jpeg"
          },
          {
            "@category": "standard",
            "@height": "200",
            "@width": "261",
            "@_fa": "true",
            "$": "https://api.elsevier.com/content/object/eid/1-s2.0-S0926860X25003588-ga1.jpg?httpAccept=%2A%2F%2A",
            "@multimediatype": "JPEG image file",
            "@type": "IMAGE-DOWNSAMPLED",
            "@size": "14375",
            "@ref": "ga1",
            "@mimetype": "image/jpeg"
          },
          {
            "@category": "thumbnail",
            "@height": "91",
            "@width": "219",
            "@_fa": "true",
            "$": "https://api.elsevier.com/content/object/eid/1-s2.0-S0926860X25003588-gr1.sml?httpAccept=%2A%2F%2A",
            "@multimediatype": "GIF image file",
            "@type": "IMAGE-THUMBNAIL",
            "@size": "5238",
            "@ref": "gr1",
            "@mimetype": "image/gif"
          },
          {
            "@category": "thumbnail",
            "@height": "141",
            "@width": "219",
            "@_fa": "true",
            "$": "https://api.elsevier.com/content/object/eid/1-s2.0-S0926860X25003588-gr9.sml?httpAccept=%2A%2F%2A",
            "@multimediatype": "GIF image file",
            "@type": "IMAGE-THUMBNAIL",
            "@size": "9242",
            "@ref": "gr9",
            "@mimetype": "image/gif"
          },
          {
            "@category": "thumbnail",
            "@height": "164",
            "@width": "188",
            "@_fa": "true",
            "$": "https://api.elsevier.com/content/object/eid/1-s2.0-S0926860X25003588-gr8.sml?httpAccept=%2A%2F%2A",
            "@multimediatype": "GIF image file",
            "@type": "IMAGE-THUMBNAIL",
            "@size": "12063",
            "@ref": "gr8",
            "@mimetype": "image/gif"
          },
          {
            "@category": "thumbnail",
            "@height": "164",
            "@width": "188",
            "@_fa": "true",
            "$": "https://api.elsevier.com/content/object/eid/1-s2.0-S0926860X25003588-gr7.sml?httpAccept=%2A%2F%2A",
            "@multimediatype": "GIF image file",
            "@type": "IMAGE-THUMBNAIL",
            "@size": "12397",
            "@ref": "gr7",
            "@mimetype": "image/gif"
          },
          {
            "@category": "thumbnail",
            "@height": "163",
            "@width": "190",
            "@_fa": "true",
            "$": "https://api.elsevier.com/content/object/eid/1-s2.0-S0926860X25003588-gr6.sml?httpAccept=%2A%2F%2A",
            "@multimediatype": "GIF image file",
            "@type": "IMAGE-THUMBNAIL",
            "@size": "10559",
            "@ref": "gr6",
            "@mimetype": "image/gif"
          },
          {
            "@category": "thumbnail",
            "@height": "164",
            "@width": "196",
            "@_fa": "true",
            "$": "https://api.elsevier.com/content/object/eid/1-s2.0-S0926860X25003588-gr5.sml?httpAccept=%2A%2F%2A",
            "@multimediatype": "GIF image file",
            "@type": "IMAGE-THUMBNAIL",
            "@size": "7942",
            "@ref": "gr5",
            "@mimetype": "image/gif"
          },
          {
            "@category": "thumbnail",
            "@height": "111",
            "@width": "219",
            "@_fa": "true",
            "$": "https://api.elsevier.com/content/object/eid/1-s2.0-S0926860X25003588-gr4.sml?httpAccept=%2A%2F%2A",
            "@multimediatype": "GIF image file",
            "@type": "IMAGE-THUMBNAIL",
            "@size": "15378",
            "@ref": "gr4",
            "@mimetype": "image/gif"
          },
          {
            "@category": "thumbnail",
            "@height": "164",
            "@width": "196",
            "@_fa": "true",
            "$": "https://api.elsevier.com/content/object/eid/1-s2.0-S0926860X25003588-gr3.sml?httpAccept=%2A%2F%2A",
            "@multimediatype": "GIF image file",
            "@type": "IMAGE-THUMBNAIL",
            "@size": "9658",
            "@ref": "gr3",
            "@mimetype": "image/gif"
          },
          {
            "@category": "thumbnail",
            "@height": "164",
            "@width": "207",
            "@_fa": "true",
            "$": "https://api.elsevier.com/content/object/eid/1-s2.0-S0926860X25003588-gr2.sml?httpAccept=%2A%2F%2A",
            "@multimediatype": "GIF image file",
            "@type": "IMAGE-THUMBNAIL",
            "@size": "14225",
            "@ref": "gr2",
            "@mimetype": "image/gif"
          },
          {
            "@category": "thumbnail",
            "@height": "164",
            "@width": "214",
            "@_fa": "true",
            "$": "https://api.elsevier.com/content/object/eid/1-s2.0-S0926860X25003588-ga1.sml?httpAccept=%2A%2F%2A",
            "@multimediatype": "GIF image file",
            "@type": "IMAGE-THUMBNAIL",
            "@size": "10778",
            "@ref": "ga1",
            "@mimetype": "image/gif"
          },
          {
            "@category": "high",
            "@height": "1244",
            "@width": "2994",
            "@_fa": "true",
            "$": "https://api.elsevier.com/content/object/eid/1-s2.0-S0926860X25003588-gr1_lrg.jpg?httpAccept=%2A%2F%2A",
            "@multimediatype": "JPEG image file",
            "@type": "IMAGE-HIGH-RES",
            "@size": "138305",
            "@ref": "gr1",
            "@mimetype": "image/jpeg"
          },
          {
            "@category": "high",
            "@height": "1070",
            "@width": "1663",
            "@_fa": "true",
            "$": "https://api.elsevier.com/content/object/eid/1-s2.0-S0926860X25003588-gr9_lrg.jpg?httpAccept=%2A%2F%2A",
            "@multimediatype": "JPEG image file",
            "@type": "IMAGE-HIGH-RES",
            "@size": "121532",
            "@ref": "gr9",
            "@mimetype": "image/jpeg"
          },
          {
            "@category": "high",
            "@height": "2605",
            "@width": "2994",
            "@_fa": "true",
            "$": "https://api.elsevier.com/content/object/eid/1-s2.0-S0926860X25003588-gr8_lrg.jpg?httpAccept=%2A%2F%2A",
            "@multimediatype": "JPEG image file",
            "@type": "IMAGE-HIGH-RES",
            "@size": "379852",
            "@ref": "gr8",
            "@mimetype": "image/jpeg"
          },
          {
            "@category": "high",
            "@height": "2604",
            "@width": "2994",
            "@_fa": "true",
            "$": "https://api.elsevier.com/content/object/eid/1-s2.0-S0926860X25003588-gr7_lrg.jpg?httpAccept=%2A%2F%2A",
            "@multimediatype": "JPEG image file",
            "@type": "IMAGE-HIGH-RES",
            "@size": "415223",
            "@ref": "gr7",
            "@mimetype": "image/jpeg"
          },
          {
            "@category": "high",
            "@height": "2574",
            "@width": "2992",
            "@_fa": "true",
            "$": "https://api.elsevier.com/content/object/eid/1-s2.0-S0926860X25003588-gr6_lrg.jpg?httpAccept=%2A%2F%2A",
            "@multimediatype": "JPEG image file",
            "@type": "IMAGE-HIGH-RES",
            "@size": "368441",
            "@ref": "gr6",
            "@mimetype": "image/jpeg"
          },
          {
            "@category": "high",
            "@height": "1044",
            "@width": "1247",
            "@_fa": "true",
            "$": "https://api.elsevier.com/content/object/eid/1-s2.0-S0926860X25003588-gr5_lrg.jpg?httpAccept=%2A%2F%2A",
            "@multimediatype": "JPEG image file",
            "@type": "IMAGE-HIGH-RES",
            "@size": "69557",
            "@ref": "gr5",
            "@mimetype": "image/jpeg"
          },
          {
            "@category": "high",
            "@height": "1764",
            "@width": "3491",
            "@_fa": "true",
            "$": "https://api.elsevier.com/content/object/eid/1-s2.0-S0926860X25003588-gr4_lrg.jpg?httpAccept=%2A%2F%2A",
            "@multimediatype": "JPEG image file",
            "@type": "IMAGE-HIGH-RES",
            "@size": "493421",
            "@ref": "gr4",
            "@mimetype": "image/jpeg"
          },
          {
            "@category": "high",
            "@height": "1252",
            "@width": "1497",
            "@_fa": "true",
            "$": "https://api.elsevier.com/content/object/eid/1-s2.0-S0926860X25003588-gr3_lrg.jpg?httpAccept=%2A%2F%2A",
            "@multimediatype": "JPEG image file",
            "@type": "IMAGE-HIGH-RES",
            "@size": "116689",
            "@ref": "gr3",
            "@mimetype": "image/jpeg"
          },
          {
            "@category": "high",
            "@height": "2366",
            "@width": "2994",
            "@_fa": "true",
            "$": "https://api.elsevier.com/content/object/eid/1-s2.0-S0926860X25003588-gr2_lrg.jpg?httpAccept=%2A%2F%2A",
            "@multimediatype": "JPEG image file",
            "@type": "IMAGE-HIGH-RES",
            "@size": "236343",
            "@ref": "gr2",
            "@mimetype": "image/jpeg"
          },
          {
            "@category": "high",
            "@height": "886",
            "@width": "1155",
            "@_fa": "true",
            "$": "https://api.elsevier.com/content/object/eid/1-s2.0-S0926860X25003588-ga1_lrg.jpg?httpAccept=%2A%2F%2A",
            "@multimediatype": "JPEG image file",
            "@type": "IMAGE-HIGH-RES",
            "@size": "110946",
            "@ref": "ga1",
            "@mimetype": "image/jpeg"
          },
          {
            "@category": "standard",
            "@_fa": "true",
            "$": "https://api.elsevier.com/content/object/eid/1-s2.0-S0926860X25003588-mmc1.docx?httpAccept=%2A%2F%2A",
            "@multimediatype": "Microsoft Word file",
            "@type": "APPLICATION",
            "@size": "1047550",
            "@ref": "mmc1",
            "@mimetype": "application/word"
          },
          {
            "@category": "thumbnail",
            "@_fa": "true",
            "$": "https://api.elsevier.com/content/object/eid/1-s2.0-S0926860X25003588-si0001.svg?httpAccept=%2A%2F%2A",
            "@multimediatype": "Scalable Vector Graphics file",
            "@type": "ALTIMG",
            "@size": "4895",
            "@ref": "si0001",
            "@mimetype": "image/svg+xml"
          },
          {
            "@category": "thumbnail",
            "@_fa": "true",
            "$": "https://api.elsevier.com/content/object/eid/1-s2.0-S0926860X25003588-si0002.svg?httpAccept=%2A%2F%2A",
            "@multimediatype": "Scalable Vector Graphics file",
            "@type": "ALTIMG",
            "@size": "4165",
            "@ref": "si0002",
            "@mimetype": "image/svg+xml"
          },
          {
            "@category": "thumbnail",
            "@_fa": "true",
            "$": "https://api.elsevier.com/content/object/eid/1-s2.0-S0926860X25003588-si0003.svg?httpAccept=%2A%2F%2A",
            "@multimediatype": "Scalable Vector Graphics file",
            "@type": "ALTIMG",
            "@size": "7703",
            "@ref": "si0003",
            "@mimetype": "image/svg+xml"
          },
          {
            "@category": "thumbnail",
            "@_fa": "true",
            "$": "https://api.elsevier.com/content/object/eid/1-s2.0-S0926860X25003588-si0004.svg?httpAccept=%2A%2F%2A",
            "@multimediatype": "Scalable Vector Graphics file",
            "@type": "ALTIMG",
            "@size": "7488",
            "@ref": "si0004",
            "@mimetype": "image/svg+xml"
          },
          {
            "@category": "thumbnail",
            "@_fa": "true",
            "$": "https://api.elsevier.com/content/object/eid/1-s2.0-S0926860X25003588-si0005.svg?httpAccept=%2A%2F%2A",
            "@multimediatype": "Scalable Vector Graphics file",
            "@type": "ALTIMG",
            "@size": "7638",
            "@ref": "si0005",
            "@mimetype": "image/svg+xml"
          },
          {
            "@category": "thumbnail",
            "@_fa": "true",
            "$": "https://api.elsevier.com/content/object/eid/1-s2.0-S0926860X25003588-si0006.svg?httpAccept=%2A%2F%2A",
            "@multimediatype": "Scalable Vector Graphics file",
            "@type": "ALTIMG",
            "@size": "7776",
            "@ref": "si0006",
            "@mimetype": "image/svg+xml"
          },
          {
            "@category": "thumbnail",
            "@_fa": "true",
            "$": "https://api.elsevier.com/content/object/eid/1-s2.0-S0926860X25003588-si0007.svg?httpAccept=%2A%2F%2A",
            "@multimediatype": "Scalable Vector Graphics file",
            "@type": "ALTIMG",
            "@size": "2860",
            "@ref": "si0007",
            "@mimetype": "image/svg+xml"
          },
          {
            "@category": "thumbnail",
            "@_fa": "true",
            "$": "https://api.elsevier.com/content/object/eid/1-s2.0-S0926860X25003588-si0008.svg?httpAccept=%2A%2F%2A",
            "@multimediatype": "Scalable Vector Graphics file",
            "@type": "ALTIMG",
            "@size": "2435",
            "@ref": "si0008",
            "@mimetype": "image/svg+xml"
          }
        ]
      },
      "link": {
        "@rel": "abstract",
        "@href": "https://api.elsevier.com/content/abstract/scopus_id/105011159580"
      }
    }
  }
}