{
  "metadata": {
    "title": "Acetone synthesis from ethanol and the Mars and Van Krevelen mechanism using CeO<ce:inf loc=post>2</ce:inf> and AgCeO<ce:inf loc=post>2</ce:inf> nanostructured catalysts",
    "authors": "; ; ",
    "journal": "Applied Catalysis A: General",
    "date": "2021-02-05",
    "doi": "10.1016/j.apcata.2020.117949",
    "abstract": "",
    "uri": "https://api.elsevier.com/content/article/pii/S0926860X20305421",
    "pii": "S0926860X20305421"
  },
  "fulltext": {
    "full-text-retrieval-response": {
      "scopus-eid": "2-s2.0-85098546115",
      "originalText": "serial JL 271346 291210 291744 291809 31 Applied Catalysis A: General APPLIEDCATALYSISAGENERAL 2020-12-30 2020-12-30 2020-12-30 2020-12-30 2021-02-15T08:52:30 1-s2.0-S0926860X20305421 S0926-860X(20)30542-1 S0926860X20305421 10.1016/j.apcata.2020.117949 S300 S300.1 FULL-TEXT 1-s2.0-S0926860X20X00214 2024-01-01T12:34:28.416125Z 0 0 20210205 2021 2020-12-30T11:50:34.760505Z articleinfo articlenumber articletitlenorm authfirstinitialnorm authfirstsurnamenorm cid cids contenttype copyright crossmark dateloaded dateloadedtxt datesearch datesort dateupdated dco docsubtype doctype doi eid ewtransactionid hubeid indexeddate issn issnnorm itemstage itemtransactionid itemweight openaccess openarchive pg pgfirst pii piinorm pubdatestart pubdatetxt pubyr sortorder srctitle srctitlenorm srctype ssids alllist content subj subheadings suppl tomb volfirst volissue volumelist webpdf webpdfpagecount yearnav figure table e-component body acknowledge affil appendices articletitle auth authfirstini authfull authkeywords authlast grantsponsor grantsponsorid highlightsabst orcid primabst ref 0926-860X 0926860X true 611 611 C Volume 611 5 117949 117949 117949 20210205 5 February 2021 2021-02-05 2021 article fla © 2020 Elsevier B.V. All rights reserved. ACETONESYNTHESISETHANOLMARSVANKREVELENMECHANISMUSINGCEO2AGCEO2NANOSTRUCTUREDCATALYSTS DELIMA A 1 Introduction 2 Experimental 2.1 Catalysts preparation 2.2 Catalyst characterization 2.2.1 BET analysis 2.2.2 CO2 temperature-programmed desorption (CO2-TPD) 2.2.3 Isopropanol conversion 2.2.4 Transmission electron microscopy (TEM) 2.2.5 Raman spectroscopy 2.2.6 Ultraviolet-visible diffuse reflectance (UV–vis) 2.2.7 Electron paramagnetic resonance (EPR) 2.2.8 H2 temperature-programmed reduction (H2-TPR) 2.2.9 Ethanol temperature programmed desorption (ethanol-TPD) 2.2.10 Chemical analysis 2.3 Catalytic tests 3 Results and discussion 4 Conclusions CRediT authorship contribution statement Acknowledgements Appendix A Supplementary data References ICISCOM 2019 ACETONEPRICESMARKETSANALYSIS BRONSATO 2020 B NAKAJIMA 1987 394 395 T SREERAMAMURTHY 1988 298 302 R NAKAJIMA 1989 237 248 T IDRISS 2000 201 212 H RYBAK 2011 14 20 P NISHIGUCHI 2005 273 277 T DELIMA 2017 252 259 A DELRSILVACALPA 2017 264 272 L RODRIGUES 2013 111 118 C MATHEUS 2018 7667 7678 C ZONETTI 2019 4011 4020 P IWAMOTO 2014 3463 3469 M HAYASHI 2014 112 120 F GONZALEZ 2019 343 351 G LIU 2017 1 8 F YEE 1999 279 295 A RORRER 2019 10588 10604 J MIAO 2005 525 529 J PORQUERAS 2003 131 137 I CHEN 2013 7 10 Y HUANG 2005 19169 19174 P MAI 2005 24380 24385 H WU 2012 61 73 Z LOPEZ 2015 403 412 J CHANG 2012 195 204 S CHAGAS 2019 1 9 L TAUC 1972 569 585 J VIEZBICKE 2015 1700 1710 B BOUBAKER 2011 1 4 K POOLE 1996 C ELECTRONSPINRESONANCEACOMPREHENSIVETREATISEEXPERIMENTALTECHNIQUES GU 2006 84 93 X SPANIER 2001 1 8 J VEDRINE 2015 9387 9423 J MEHER 2012 46 56 S ELKHALIFI 2016 5045 5052 M PATEL 2020 V RADOVIC 2013 4929 4936 M THILL 2020 146860 A ANSARI 2014 16782 16791 S CHOUDHURY 2012 666 671 B ACKLAND 2018 1 39 K LETICHEVSKY 2005 203 210 S PERRICHON 1994 773 781 V MAYERNICK 2008 14955 14964 A MARCINIAK 2020 111053 A JING 2014 27597 27603 X NEGI 2019 20509 20517 K CHEN 2013 5800 5810 B DICOSIMO 1998 499 510 J GANDUGLIAPIROVANO 2015 20 32 M METIU 2012 10439 10450 H KUMAR 2018 16 49 R MCFARLAND 2013 4391 4427 E BRANDA 2010 1934 1941 M STUDENYAK 2014 76 83 I DELIMAX2021X117949 DELIMAX2021X117949XA 2022-12-30T00:00:00.000Z 2022-12-30T00:00:00.000Z http://creativecommons.org/licenses/by-nc-nd/4.0/ © 2020 Elsevier B.V. All rights reserved. 2022-06-11T15:45:52.248Z http://vtw.elsevier.com/data/voc/AddOnTypes/50.7/aggregated-refined FAPERJ FAPERJ Fundação Carlos Chagas Filho de Amparo à Pesquisa do Estado do Rio de Janeiro http://data.elsevier.com/vocabulary/SciValFunders/501100004586 http://sws.geonames.org/3469034/ Centro de Tecnologia Mineral CNPq CNPq Conselho Nacional de Desenvolvimento Científico e Tecnológico http://data.elsevier.com/vocabulary/SciValFunders/501100003593 http://sws.geonames.org/3469034/ The authors acknowledge the contribution of the LACAT/INT and CENANO staff for the characterization analyses. The authors are very thankful to Priscilla C. Zonetti for the experimental support. Adriana F.F. de Lima is very grateful to FAPERJ for the special scholarship. We are also very thankful to the Centro Brasileiro de Pesquisas Físicas (CBPF) where the HRTEM (LABNANO) and EPR measurements were carried out. The authors are indebted to Andrey Oliveira and also to the Coordenação de Analises Minerais of the Centro de Tecnologia Mineral (CETEM). LGA, FMZZ and RRA acknowledge the Conselho Nacional de Desenvolvimento Científico e Tecnológico, CNPq, for partial funding. The authors acknowledge the contribution of the LACAT/INT and CENANO staff for the characterization analyses. The authors are very thankful to Priscilla C. Zonetti for the experimental support. Adriana F.F. de Lima is very grateful to FAPERJ for the special scholarship. We are also very thankful to the Centro Brasileiro de Pesquisas Físicas (CBPF) where the HRTEM (LABNANO) and EPR measurements were carried out. The authors are indebted to Andrey Oliveira and also to the Coordenação de Analises Minerais of the Centro de Tecnologia Mineral (CETEM). LGA, FMZZ and RRA acknowledge the Conselho Nacional de Desenvolvimento Científico e Tecnológico, CNPq , for partial funding. item S0926-860X(20)30542-1 S0926860X20305421 1-s2.0-S0926860X20305421 10.1016/j.apcata.2020.117949 271346 2024-01-01T12:34:28.416125Z 2021-02-05 1-s2.0-S0926860X20305421-main.pdf https://s3-eu-west-1.amazonaws.com/prod-ucs-content-store-eu-west/content/pii:S0926860X20305421/MAIN/application/pdf/cadfd571bd3ddec9823704f273842a6f/main.pdf main.pdf pdf true 3849496 MAIN 10 1-s2.0-S0926860X20305421-main_1.png https://s3-eu-west-1.amazonaws.com/prod-ucs-content-store-eu-west/content/pii:S0926860X20305421/PREVIEW/image/png/9198c6b147f0cdfdfc850fd29b587f29/main_1.png main_1.png png 52401 849 656 IMAGE-WEB-PDF 1 1-s2.0-S0926860X20305421-gr1.jpg https://s3-eu-west-1.amazonaws.com/prod-ucs-content-store-eu-west/content/pii:S0926860X20305421/gr1/DOWNSAMPLED/image/jpeg/c3e47988753ee6bf5d0ee1c168dc9338/gr1.jpg gr1 gr1.jpg jpg 12804 239 150 IMAGE-DOWNSAMPLED 1-s2.0-S0926860X20305421-gr2.jpg https://s3-eu-west-1.amazonaws.com/prod-ucs-content-store-eu-west/content/pii:S0926860X20305421/gr2/DOWNSAMPLED/image/jpeg/4200d450ec55f761715b89d3e27ab722/gr2.jpg gr2 gr2.jpg jpg 182822 802 715 IMAGE-DOWNSAMPLED 1-s2.0-S0926860X20305421-gr3.jpg https://s3-eu-west-1.amazonaws.com/prod-ucs-content-store-eu-west/content/pii:S0926860X20305421/gr3/DOWNSAMPLED/image/jpeg/645c185a66e80c3676a13442e4704d3e/gr3.jpg gr3 gr3.jpg jpg 11365 241 152 IMAGE-DOWNSAMPLED 1-s2.0-S0926860X20305421-gr4.jpg https://s3-eu-west-1.amazonaws.com/prod-ucs-content-store-eu-west/content/pii:S0926860X20305421/gr4/DOWNSAMPLED/image/jpeg/41197feaf71875328b5ce997297aa860/gr4.jpg gr4 gr4.jpg jpg 9105 229 131 IMAGE-DOWNSAMPLED 1-s2.0-S0926860X20305421-gr5.jpg https://s3-eu-west-1.amazonaws.com/prod-ucs-content-store-eu-west/content/pii:S0926860X20305421/gr5/DOWNSAMPLED/image/jpeg/64e2e73c5a2b179ec5eda4c99759f32b/gr5.jpg gr5 gr5.jpg jpg 10655 238 152 IMAGE-DOWNSAMPLED 1-s2.0-S0926860X20305421-gr6.jpg https://s3-eu-west-1.amazonaws.com/prod-ucs-content-store-eu-west/content/pii:S0926860X20305421/gr6/DOWNSAMPLED/image/jpeg/b188758564987887d8c5e8c13938c308/gr6.jpg gr6 gr6.jpg jpg 11820 272 169 IMAGE-DOWNSAMPLED 1-s2.0-S0926860X20305421-sc1.jpg https://s3-eu-west-1.amazonaws.com/prod-ucs-content-store-eu-west/content/pii:S0926860X20305421/sc1/DOWNSAMPLED/image/jpeg/1cdb6a48bb8bdcc7ac47f325aed87214/sc1.jpg sc1 sc1.jpg jpg 24983 257 376 IMAGE-DOWNSAMPLED 1-s2.0-S0926860X20305421-sc2.jpg https://s3-eu-west-1.amazonaws.com/prod-ucs-content-store-eu-west/content/pii:S0926860X20305421/sc2/DOWNSAMPLED/image/jpeg/a04b5641fecc6c2ff2abe4811baa5438/sc2.jpg sc2 sc2.jpg jpg 29621 251 489 IMAGE-DOWNSAMPLED 1-s2.0-S0926860X20305421-gr1.sml https://s3-eu-west-1.amazonaws.com/prod-ucs-content-store-eu-west/content/pii:S0926860X20305421/gr1/THUMBNAIL/image/gif/3fa13ca2743bae118ec22366d14d2c1e/gr1.sml gr1 gr1.sml sml 9576 164 103 IMAGE-THUMBNAIL 1-s2.0-S0926860X20305421-gr2.sml https://s3-eu-west-1.amazonaws.com/prod-ucs-content-store-eu-west/content/pii:S0926860X20305421/gr2/THUMBNAIL/image/gif/ec26889b5e45c385396d56608842e215/gr2.sml gr2 gr2.sml sml 14885 164 146 IMAGE-THUMBNAIL 1-s2.0-S0926860X20305421-gr3.sml https://s3-eu-west-1.amazonaws.com/prod-ucs-content-store-eu-west/content/pii:S0926860X20305421/gr3/THUMBNAIL/image/gif/6064f079f98fdfb570add086a07d14ac/gr3.sml gr3 gr3.sml sml 5855 163 103 IMAGE-THUMBNAIL 1-s2.0-S0926860X20305421-gr4.sml https://s3-eu-west-1.amazonaws.com/prod-ucs-content-store-eu-west/content/pii:S0926860X20305421/gr4/THUMBNAIL/image/gif/33cd5d6207592f254e951bfe7dd8369d/gr4.sml gr4 gr4.sml sml 5498 164 94 IMAGE-THUMBNAIL 1-s2.0-S0926860X20305421-gr5.sml https://s3-eu-west-1.amazonaws.com/prod-ucs-content-store-eu-west/content/pii:S0926860X20305421/gr5/THUMBNAIL/image/gif/abfd6a95dbd70dfc8900f49f7107aab4/gr5.sml gr5 gr5.sml sml 5170 163 104 IMAGE-THUMBNAIL 1-s2.0-S0926860X20305421-gr6.sml https://s3-eu-west-1.amazonaws.com/prod-ucs-content-store-eu-west/content/pii:S0926860X20305421/gr6/THUMBNAIL/image/gif/c65c87a668977fcd9cb1107a9413bb9e/gr6.sml gr6 gr6.sml sml 4901 164 102 IMAGE-THUMBNAIL 1-s2.0-S0926860X20305421-sc1.sml https://s3-eu-west-1.amazonaws.com/prod-ucs-content-store-eu-west/content/pii:S0926860X20305421/sc1/THUMBNAIL/image/gif/4e9cf977358fd708c18567f8cd01f669/sc1.sml sc1 sc1.sml sml 11259 150 219 IMAGE-THUMBNAIL 1-s2.0-S0926860X20305421-sc2.sml https://s3-eu-west-1.amazonaws.com/prod-ucs-content-store-eu-west/content/pii:S0926860X20305421/sc2/THUMBNAIL/image/gif/a582f22b960f6e4f42ca1fc8e8cb3ac1/sc2.sml sc2 sc2.sml sml 9567 113 219 IMAGE-THUMBNAIL 1-s2.0-S0926860X20305421-gr1_lrg.jpg https://s3-eu-west-1.amazonaws.com/prod-ucs-content-store-eu-west/content/pii:S0926860X20305421/gr1/HIGHRES/image/jpeg/9da1bccb3f9a92962f4c519366f36534/gr1_lrg.jpg gr1 gr1_lrg.jpg jpg 175321 1063 667 IMAGE-HIGH-RES 1-s2.0-S0926860X20305421-gr2_lrg.jpg https://s3-eu-west-1.amazonaws.com/prod-ucs-content-store-eu-west/content/pii:S0926860X20305421/gr2/HIGHRES/image/jpeg/396fae2ae7cedd43d8374d383b71f447/gr2_lrg.jpg gr2 gr2_lrg.jpg jpg 2423667 3554 3167 IMAGE-HIGH-RES 1-s2.0-S0926860X20305421-gr3_lrg.jpg https://s3-eu-west-1.amazonaws.com/prod-ucs-content-store-eu-west/content/pii:S0926860X20305421/gr3/HIGHRES/image/jpeg/47dddb7ec2967127a59d455a6f9a7140/gr3_lrg.jpg gr3 gr3_lrg.jpg jpg 111986 1069 674 IMAGE-HIGH-RES 1-s2.0-S0926860X20305421-gr4_lrg.jpg https://s3-eu-west-1.amazonaws.com/prod-ucs-content-store-eu-west/content/pii:S0926860X20305421/gr4/HIGHRES/image/jpeg/f6ab6ad3b3b2a996bc9094f4bf9c6430/gr4_lrg.jpg gr4 gr4_lrg.jpg jpg 194908 1017 583 IMAGE-HIGH-RES 1-s2.0-S0926860X20305421-gr5_lrg.jpg https://s3-eu-west-1.amazonaws.com/prod-ucs-content-store-eu-west/content/pii:S0926860X20305421/gr5/HIGHRES/image/jpeg/b2c67f66b2665ab2f7367ee9cdc2d228/gr5_lrg.jpg gr5 gr5_lrg.jpg jpg 97569 1055 674 IMAGE-HIGH-RES 1-s2.0-S0926860X20305421-gr6_lrg.jpg https://s3-eu-west-1.amazonaws.com/prod-ucs-content-store-eu-west/content/pii:S0926860X20305421/gr6/HIGHRES/image/jpeg/280fe6b0eb1af80c907db55f3d21ec94/gr6_lrg.jpg gr6 gr6_lrg.jpg jpg 107792 1206 750 IMAGE-HIGH-RES 1-s2.0-S0926860X20305421-sc1_lrg.jpg https://s3-eu-west-1.amazonaws.com/prod-ucs-content-store-eu-west/content/pii:S0926860X20305421/sc1/HIGHRES/image/jpeg/4e7a2ea2a714acfd225ac81c85396868/sc1_lrg.jpg sc1 sc1_lrg.jpg jpg 202288 1140 1667 IMAGE-HIGH-RES 1-s2.0-S0926860X20305421-sc2_lrg.jpg https://s3-eu-west-1.amazonaws.com/prod-ucs-content-store-eu-west/content/pii:S0926860X20305421/sc2/HIGHRES/image/jpeg/cb3cc6938a1365051378cab88b4801c7/sc2_lrg.jpg sc2 sc2_lrg.jpg jpg 261223 1114 2167 IMAGE-HIGH-RES 1-s2.0-S0926860X20305421-mmc1.pdf https://s3-eu-west-1.amazonaws.com/prod-ucs-content-store-eu-west/content/pii:S0926860X20305421/mmc1/MAIN/application/pdf/93a9d253ad8714557c72611740389cde/mmc1.pdf mmc1 mmc1.pdf pdf false 946980 APPLICATION 1-s2.0-S0926860X20305421-am.pdf am am.pdf pdf 719117 AAM-PDF https://s3-eu-west-1.amazonaws.com/prod-ucs-content-store-eu-west/content/egi:106NQZZJC1P/MAIN/application/pdf/5e0ddf1632621fea97c43a7d746480f3/am.pdf APCATA 117949 117949 S0926-860X(20)30542-1 10.1016/j.apcata.2020.117949 Elsevier B.V. Scheme 1 Proposed mechanisms for the synthesis of acetone from ethanol. Scheme 1 Scheme 2 The acetone synthesis mechanism from ethanol. Scheme 2 Fig. 1 Ethanol conversions and selectivities of the catalysts. The flow rate, gas mixture molar composition, catalyst mass and reaction temperature are 50 mLmin−1, N2:H2O:C2H5OH = 91:8:1 % vol, 50 mg and 400 °C, respectively. Fig. 1 Fig. 2 TEM micrographs and particle sizes versus frequency of the catalysts. A) CeO2(ncb), B) CeO2(npl) and C) AgCeO2(npl). The small insets next to the main image show, on the top, high resolution (HRTEM) micrographs and on the bottom, electron diffraction for each prepared catalyst. Figures B and C also depict the Fourier transform of specific regions. Fig. 2 Fig. 3 Raman spectra of CeO2(ncb), black; CeO2(npl) grey and AgCeO2(npl), white. Fig. 3 Fig. 4 EPR spectra of the catalysts after reduction at 450 °C. Fig. 4 Fig. 5 H2-TPR profiles of the catalysts. Fig. 5 Fig. 6 Spectra of the ethanol-TPD on AgCeO2(npl). Fig. 6 Table 1 Ethanol consumption rate (-rethanol), acetone (racetone), acetaldehyde (racetaldehyde), ethylene (rethylene) formation rates at 400 °C, specific area (S) and microporous surface areas (Sm) and Ag concentration in the AgCeO2(npl) catalyst. Table 1 catalyst -rethanol racetone racetaldehyde rethylene S Sm Ag / μmol g cat−1 min−1 / m2 g−1 / wt.% CeO2(ncb) 217 32 66 5 66 5 0 CeO2(npl) 743 106 318 25 116 24 0 AgCeO2(npl) 1781 231 926 16 96 23 0.0136 ± 0.0021 Table 2 Number of weak and medium strength basic sites (Bw+m) and strong basic sites (BS), propene (rprop) and acetone (racetone) formation rates of the isopropanol decomposition reaction, H2 consumption (TPR) of the lowest temperature peak, direct band gap energy (Eg1), indirect band gap energy (Eg2) and EPR area related to vacancies concentration (A). Table 2 catalyst Bw+m Bs rprop racetone H2 consumption / mmol g−1 Eg1 Eg2 A / μmoles gcat −1 / μmoles gcat −1 min−1 / eV / a.u CeO2(ncb) 65 14 1.2 × 10−3 3.8 0.20 3.6 3.0 1088 CeO2(npl) 69 29 3.6 × 10−3 10.4 0.56 3.3 2.8 1484 AgCeO2(npl) 44 22 2.3 × 10−3 8.6 0.55 3.4 2.8 2544 Acetone synthesis from ethanol and the Mars and Van Krevelen mechanism using CeO2 and AgCeO2 nanostructured catalysts Adriana F.F. de Lima Writing - original draft Investigation Visualization Formal analysis a b Carla R. Moreira Investigation Visualization Writing - original draft c Odivaldo C. Alves Investigation Formal analysis d Roberto R. de Avillez Investigation Formal analysis Validation e Fatima M.Z. Zotin Supervision Methodology Validation Formal analysis Writing - review & editing b Lucia G. Appel Conceptualization Project administration Supervision Writing - review & editing a * a Divisão de Catálise e Processos Químicos, Instituto Nacional de Tecnologia, Av Venezuela 82, sala 518, Saúde, Rio de Janeiro, RJ, 20081-312, Brazil Divisão de Catálise e Processos Químicos Instituto Nacional de Tecnologia Av Venezuela 82 sala 518 Saúde, Rio de Janeiro RJ 20081-312 Brazil Divisão de Catálise e Processos Químicos, Instituto Nacional de Tecnologia, Av Venezuela 82, sala 518, Saúde, Rio de Janeiro, RJ, 20081-312, Brazil. b Programa de Pós-graduação em Engenharia Química, Instituto de Química, Universidade do Estado do Rio de Janeiro, Av. São Francisco Xavier, 524, Pavilhão Haroldo Lisboa da Cunha, Maracanã, Rio de Janeiro, RJ, 20550-900, Brazil Programa de Pós-graduação em Engenharia Química Instituto de Química Universidade do Estado do Rio de Janeiro Av. São Francisco Xavier 524, Pavilhão Haroldo Lisboa da Cunha, Maracanã Rio de Janeiro RJ 20550-900 Brazil Laboratório de Catálise, Petróleo e Meio Ambiente, Universidade do Estado do Rio de Janeiro, Av. São Francisco Xavier, 524, Pavilhão Haroldo Lisboa da Cunha, Maracanã, Rio de Janeiro, RJ, 20550-900, Brazil. c Centro de Caracterização em Nanotecnologia para Materiais e Catálise, Instituto Nacional de Tecnologia, Av Venezuela 82, anexo 3, Saúde, Rio de Janeiro, RJ, 20081-312, Brazil Centro de Caracterização em Nanotecnologia para Materiais e Catálise Instituto Nacional de Tecnologia Av Venezuela 82 anexo 3 Saúde, Rio de Janeiro RJ 20081-312 Brazil Centro de Caracterização em Nanotecnologia para Materiais e Catálise, Instituto Nacional de Tecnologia, Av Venezuela 82, anexo 3, Saúde, Rio de Janeiro, RJ, 20081-312, Brazil. d Instituto de Química, Universidade Federal Fluminense, Outeiro de São João Batista s/n, Campus do Valonguinho, Centro, Niterói, RJ, 24020-007, Brazil Instituto de Química Universidade Federal Fluminense Outeiro de São João Batista s/n Campus do Valonguinho Centro Niterói RJ 24020-007 Brazil Instituto de Química, Universidade Federal Fluminense, Campos de Valonginho, R. São João Batista 2-188, Centro, Niterói, RJ, 24020-007 (Brazil). e Departamento de Engenharia Química e de Materiais, Pontifícia Universidade Católica do Rio de Janeiro, PUC-Rio, Rua Marquês de São Vicente, 225, Gávea, Rio de Janeiro, RJ, 22451-900, Brazil Departamento de Engenharia Química e de Materiais Pontifícia Universidade Católica do Rio de Janeiro PUC-Rio Rua Marquês de São Vicente 225, Gávea Rio de Janeiro RJ 22451-900 Brazil Departamento de Engenharia Química e de Materiais, Pontifícia Universidade Católica do Rio de Janeiro, PUC-Rio, Rua Marquês de São Vicente, 225, Gávea, Rio de Janeiro, RJ, 22451-900, Brazil ⁎ Corresponding author. Nanostructured CeO2 based catalysts were employed as tools to shed light on the mechanism of the acetone synthesis from ethanol. The oxides were characterized using HRTEM, EPR, and other techniques. Rates of ethanol consumption and products formation were measured at differential conditions. The catalysts prepared employing Ce(NO3)3 generate nanocubes, whereas when (NH4)2Ce(NO3)6 is used, nanopolyhedral particles are synthesised. The later forms O vacancies more easily. This property enhances when Ag is added to the nanopolyhedral catalyst. The correlation between the catalytic behaviour and the nanocatalysts`s physicochemical properties showed that O vacancies participate as Brønsted basic sites in the acetaldehyde synthesis and that the easier the O vacancies generation, the higher the rate of the acetone synthesis is. The O abstraction from the CeO2 lattice by acetaldehyde (Mars and Van Krevelen mechanism) is the slowest step of the acetone synthesis from ethanol, showing that this synthesis exhibits a relevant redox characteristic. Keywords Ethanol Acetaldehyde Mars and Van Krevelen mechanism CeO2 Acetone 1 Introduction Acetone is an important chemical widely used in the syntheses of drugs and polymers. Its largest application is the manufacture of acetone cyanohydrin (ACH), which is the precursor of methyl methacrylate (MMA) and methacrylic acid. This ketone is also usually employed in the production of bisphenol-A (BPA), polycarbonate, and in the syntheses of many other chemicals, for instance, methyl isobutyl ketone (MIBK), isophorone and diacetone alcohol/hexylene glycol, and others [1]. Nowadays, acetone is mainly produced by the Cumene process from benzene and propylene. This synthesis generates acetone and phenol (0.62 ton of this ketone per ton of phenol). Thus, the acetone and phenol production via the Cumene process depends on the market conditions of both products. Ethanol, used as a fuel additive and gasoline substitute, is produced from sugarcane and corn. This alcohol is also a very special platform molecule. Many drop-in chemicals can be synthetised in one-pot processes from ethanol employing multifunctional catalysts [2]. According to the literature, the acetone synthesis from ethanol is technically feasible [3–8]. This synthesis also generates CO2 and H2 (eq. 1), which can both further react to generate CH4, DME, methanol, etc. Many different catalytic systems have been employed in this synthesis, for example ZnO-CaO [3], Fe2O3-ZnO [4], CuO/CeO2 [8], AgCeO2 [9], ZnxZryOz [10], Cu/ZnO/Al2O3+ZrO2 [11] and others. Propene and isobutene are very important chemicals which can be synthesised in one step from ethanol. Acetone is the main intermediate of both syntheses. In addition, the generation of acetone from ethanol is one of the steps of the cascade systems employed in the generation of these olefins. On the one hand, the propene synthesis from ethanol can be described as following: firstly, acetone is generated from ethanol; then, this ketone is hydrogenated to isopropanol; finally, propene is synthetized by the dehydration of the C3 alcohol. On the other hand, the isobutene synthesis can be depicted according the following steps: firstly, acetone is generated from ethanol; next, this ketone condenses (aldol condensation) forming the diacetone alcohol; then, this alcohol dehydrates to mesityl oxide which decomposes generating isobutene and acetaldehyde; finally, the aldehyde is oxidised by H2O to acetone and CO2 [12,13]. It is worth mentioning from the thermodynamic point of view, the main reaction between ethanol and water is the ethanol reforming. On the other hand, the generation isobutene, propene and acetone from the same reagents is related to the kinetic phenomenon [2]. (1) 2 CH3CH2OH + H2O → CH3COCH3 + CO2 + 4 H2 The first studies related to the acetone synthesis from ethanol were undertaken by the Tanabe group [3,5]. Employing the ZnFe2O4 and ZnO-CaO catalysts, they proposed that acetaldehyde is obtained by the dehydrogenation of ethanol. After that, this aldehyde is oxidized by superficial hydroxyl species generating acetate species, which then condense, producing acetone. They also suggested that the acetaldehyde oxidation is the rate limiting step (rls) of the acetone synthesis. Iwamoto et al. [14] studying the propene synthesis from ethanol employing Sc/In2O3, also proposed this same mechanism for the acetone generation. Afterwards, Hayashi et al. [15] suggested another mechanism employing Y2O3-CeO2, which can be described as following: firstly, acetaldehyde condenses leading to ethyl acetate; then, the ester is hydrolyzed to ethanol and acetate species; finally, the latter condenses and generates acetone. Recently, Gonzalez et al. [16] employing Cu/ZrO2/Al2O3 have proposed almost the same mechanism. In the late 1980s, Murthy et al. [4] employing the Fe-based catalyst, proposed the following mechanism: firstly, ethanol is dehydrogenated to acetaldehyde; next, this aldehyde undergoes an aldol condensation generating acetaldol (3-hydroxybutyraldehyde); then, this compound is dehydrogenated and decomposed generating acetic acid and acetaldehyde or acetone and formic acid; finally, the acetic acid is ketonized to acetone. Nishiguchi et al. [8], employing CuO/CeO2, also proposed the acetaldehyde condensation generating acetaldol. In this case, it was suggested that acetaldol is oxidized and decomposed producing acetone, CO2 and H2. The oxidant agent is the O of the CeO2 lattice. Recently, Liu et al. [17] studying the isobutene synthesis from ethanol employing the CrxZnyZrzOn catalyst have proposed that the generation of acetone, one of the intermediate specie of this synthesis, also occurs via the acetaldol decomposition. Idriss & Seebauer [6] and Yee et al. [18] suggested two different mechanisms according to the catalyst composition. In the presence of noble metals such as Pd, the acetyl species are synthetized from acetaldehyde, which then condenses generating acetone. When CeO2 is employed, firstly, acetaldehyde is generated from ethanol; then, this aldehyde is oxidized to acetate species by the O of the oxide surface; finally, the ketonization of the acetate species occurs. De Lima et al. [9], Silva-Calpa et al. [10] and Rodrigues et al. [11] employing AgCeO2, ZnxZryOz and Cu/ZnO/Al2O3+ZrO2, respectively, proposed the following mechanism: firstly, ethanol is dehydrogenated to acetaldehyde; next, this aldehyde is oxidized to acetate species by the O of the oxide lattice, generating vacancies; then, H2O dissociates on the vacancies and reoxidises the catalyst surface generating H2; finally, acetate species condenses and produces acetone and CO2. It is worth stressing that the oxidation of acetaldehyde to acetate species follows the Mars and Van Krevelen (MvK) mechanism, in which the O vacancy formation is the slowest step, i.e., the rate-limiting step (rls). Recently, Rorrer et al. [19] analysing the isobutene synthesis from ethanol employing ZnxZryOz have proposed a mechanism similar to the one mentioned last. As can be observed (Scheme 1 ), most of these mechanisms show the same first and last steps. The disagreement which exists among the authors is related to the acetate species or acetic acid generation from acetaldehyde. Without question, any mechanism depends on the physicochemical properties of the catalysts. Most of the proposed mechanisms are related to the acid and basic properties of the catalysts. In the case of systems which show redox properties, the MvK mechanism might be the most suitable one. Our group analysed the catalytic behaviour of CeO2 doped (0.5 wt%) with some metals (Ni, Fe, Zn, Mn, Nb, Mo, Zr, Ag, Cu e Co) in the acetone synthesis from ethanol. The Ag catalyst showed the best performance (Fig. S1). The CeO2 oxide can be synthetised according to the following morphologies: thin films, nanocubes, nanorods, nanospheres and nanooctahedron [20–23]. It is known that changing the oxides’ morphologies change the surface crystallographic planes as well. Moreover, the type of surface plane determine the energy related to the O vacancy surface formation [24–26]. Thus, when the O vacancy formation is relevant (redox mechanism), the CeO2 morphology might directly impacts the catalytic activity. According to Chang et al. [27], adding Ag to the nanostructured CeO2 oxide, the reducibility of this oxide is improved, i.e., it is easier to generate O vacancies. They observed that Ag improve the reduction of the CeO2 surface promoting the CO oxidation. Oxides can be very interesting and challenging catalysts. Their physicochemical properties and, consequently, the catalytic behaviour can be drastically changed or tunned using different preparation procedures. Adding dopants or single atoms to the oxide’s surfaces and synthetising oxides with specific morphologies are examples of these methodologies. Oxides can show acid, basic, redox and others properties, which make them multifunctional catalysts capable to promote cascade reactions [28]. Taking this piece of information into account, this work only employs oxides as catalysts. Therefore, the aim of this work is to describe the role of the O vacancies in acetone synthesis from ethanol in order to support the MvK mechanism as one of the steps of the acetone synthesis from ethanol. Two different morphologies of nano CeO2 catalysts, being one of them doped with Ag, are employed. The ethanol-TPD, UV–vis spectroscopy, CO2-TPD, EPR, Raman spectroscopy and also HRTEM characterizations are used in order to uphold the proposed mechanism. 2 Experimental 2.1 Catalysts preparation The nanocatalysts were synthesised by the hydrothermal method [27]. Firstly, the NaOH solution (CNaOH =6 mol L−1) was added dropwise to an aqueous solution of Ce(NO3)3.6H2O or (NH4)2Ce(NO3)6 and AgNO3 under continuous stirring at room temperature. The concentration of the Ce precursors in the solutions was 0.06 mol L−1. The amount of AgNO3 added to the (NH4)2Ce(NO3)6 solution was calculated to reach 0.02 wt.% of Ag in the final oxide. After precipitation, the suspension was stirred for 30 min and then transferred to a 200 mL stainless-steel vessel autoclave with an internal Teflon bottle. The system was heated at 180 °C for 24 h under autogenous pressure. After that, the solid was washed with distilled water up to neutral pH, centrifuged, dried at 80 °C overnight, and then calcined at 500 °C for 4 h (10 °C min−1) under air flow (30 mL min−1). The catalyst obtained employing Ce(NO3)3 was named CeO2(ncb), while the ones synthetised with (NH4)2Ce(NO3)6 as CeO2(npl) and AgCeO2(npl). 2.2 Catalyst characterization 2.2.1 BET analysis The Brunauer-Emmett-Teller (BET) specific area of the catalysts was measured by N2 adsorption at −196 °C employing a Micromeritics ASAP 2420. The samples were pretreated at 100 °C for 24 h, and then submitted to vacuum at 350 °C for 2 h. 2.2.2 CO2 temperature-programmed desorption (CO2-TPD) The CO2 temperature-programmed desorption was carried out using a TPR/TPD Micromeritics AutoChem 2920 system equipped with a thermal conductivity detector. The adsorption of CO2 was performed at room temperature for 1 h (20 mL min−1). The measurements were conducted at 20 °C min−1, under He flow (50 mLmin−1), up to 450 °C. In order to classify basic sites as weak, medium and strong strength, the TPD profiles were decomposed in Gaussian curves. The weak basic sites are assigned to a curve which exhibits a maximum at a temperature lower than 127 °C, medium basic sites between 127 °C and 307 °C, and strong basic sites above 307 °C. The samples were pretreated according the following procedure: firstly, the sample was dried at 130 °C under inert flow for 30 min; after that, reduced under 10 % H2/N2 (50 mL min−1) at 450 °C for 1 h; then, purged with N2 and oxidized for 30 min with synthetic air at the same temperature; finally, the catalyst was cooled to ambient temperature under inert gas flow. The pretreatment was carried out to remove carbonate species from the catalysts surface. 2.2.3 Isopropanol conversion The acidity and basicity of the CeO2 nanocatalysts were analysed employing the isopropanol conversion model reaction. A fixed-bed reactor monitored online by a gas chromatograph with flame ionization (FID) and thermal conductivity (TCD) detectors were employed. The catalysts were pretreated according the procedure described for the CO2-TPD. The tests were carried out at 200 °C, 1 atm and under differential conditions (∼10 % conversion). The isopropanol vapours were generated by passing N2 through a saturator at 10 °C. 2.2.4 Transmission electron microscopy (TEM) The size and the morphology of the CeO2 nanoparticles were investigated by transmission electron microscopy using a Tecnai G2-F20 (FEI/ThermoFisher) with an accelerating voltage of 200 kV. High-resolution (HRTEM) images were obtained in a200 kV 2.100 F equipment (JEOL). The samples were previously dispersed in isopropanol, sonicated for 15 min, and then supported on a holey carbon-coated copper grid (#200) for TEM analysis. 2.2.5 Raman spectroscopy Raman spectra were collected at ambient temperature employing a Horiba Jobin Yvon LabRAM HR800 UV spectrometer, equipped with a CCD detector at a −70 °C, with excitation by 632.8 nm from a He-Ne laser and the laser power limited to 20 mW. The scanning region was ranged from 100 to 1000 cm−1. The spectra were normalized to the highest energy intensity (465 cm−1). The samples were analysed without thermal treatment. 2.2.6 Ultraviolet-visible diffuse reflectance (UV–vis) The ultraviolet-visible diffuse reflectance spectra were collected employing a Varian Cary 500 spectrophotometer, at the range of 200−800 nm. The BaSO4 powder was used as a reference. The samples were analysed without thermal treatment. These spectra were employed to calculate the band gap values. Direct and indirect band gaps are estimated from Tauc plots [29,30]. The Urbach energy is estimated from the exponential fitting of the data below the bandgap [31]. 2.2.7 Electron paramagnetic resonance (EPR) Electron paramagnetic resonance spectra were collected using a Bruker ESP 300E spectrometer operating in the X-band (9.7 GHz). The following pre-treatment was employed: firstly, the catalysts were dried at 130 °C under He flow for 30 min; next, reduced under 20 % H2/Ar at 450 °C (10 °C min−1) for 1 h; finally, purged and cooled to ambient temperature under Ar flow. The spectra were collected at room temperature using a microwave power, amplitude modulation and frequency modulation of 20 mW, 5 G and 100 kHz, respectively. Room temperature ferromagnetism in CeO2 has been frequently associated to oxygen vacancies. EPR spectral areas are proportional to the amount of magnetic material, related to the amount of oxygen vacancies and can be calculated as Ym.(ΔH)2 where Ym and ΔH are intensity and linewidth of derivative curve, respectively [32]. Spectral deconvolutions were performed with derivatives of Lorentzian lines. 2.2.8 H2 temperature-programmed reduction (H2-TPR) The H2 temperature-programmed reduction experiments were performed after the same pretreatment employed in the case of the CO2-TPD and using a TPR/TPD Micromeritics AutoChem 2920 system equipped with a thermal conductivity detector. The H2-TPR was carried out under 10 % H2/N2 flow (30 mL min−1) and the temperature was increased up to 1000 °C at a heating rate of 10 °Cmin−1. 2.2.9 Ethanol temperature programmed desorption (ethanol-TPD) Ethanol temperature-programmed desorption was performed using a micro-reactor system coupled to a Pfeiffer Omni Star mass spectrometer. The samples were pretreated following the same steps of CO2-TPD. After that, the ethanol adsorption was conducted at 50 °C for 1 h. Ethanol vapours were obtained by passing He (20 mL min−1) through a saturator with ethanol at 30 °C. The desorption was carry out employing a He flow (80 mL min−1) at 20 °C min−1 from 50 °C to 450 °C and remaining at 450 °C for 30 min. The fragments m/z = 2 (H2), 44 (CO2), 18 (H2O), 26 (ethylene), 29 (acetaldehyde), 31 (ethanol), 39 (propene) and 43 (acetone) were monitored during the analyses. The intensities of these fragments were mathematically treated in order to eliminate contributions from more than one species. When a peak of the m/e=A spectrum is related to more than one compound (C and D), another m/e=B fragment, assigned only to C should be identified. The ratio between m/e=B and m/e=A peaks intensities is calculated. Considering this ratio, it is possible to calculate the C contribution in the m/e=A spectrum. Subtracting this contribution from m/e=A spectrum the signal related to D is obtained. 2.2.10 Chemical analysis The Ag content was determined using an inductively coupled plasma optical emission spectrometer (ICP-OES), Horiba Scientific, Ultima 2. 2.3 Catalytic tests The catalytic tests were performed using a conventional system with a fixed bed reactor at 1 atm. The N2:H2O:C2H5OH = 91:8:1 vol.% mixture employed was generated by ethanol and H2O vapours by passing N2 through two saturators, one at 5 °C and another at 52 °C, respectively. The CeO2 based catalysts were pretreated according to the following steps: firstly, the sample was dried at 130 °C for 30 min under N2 flow (90 mL min−1); next, reduced under 10 % H2/N2 flow (100 mL min−1) at 450 °C for 1 h; finally, cooled at inert atmosphere up to the temperature of the catalytic test. The performance of the catalysts analyzed at the same contact time was obtained at the following experimental conditions: flow rate, catalyst mass and reaction temperature were 50 mL min−1, 50 mg and 400 °C, respectively. The reaction rates were measured under differential conditions (conversion < 10 %) at 400 °C. The reaction products were analysed during 16 h on stream by gas chromatography using a CG Agilent 6890 equipped with two detectors (thermal conductivity and flame ionization), methanator and a Porapak-Q/60 ft column. The product’s selectivity is defined by the ratio between the number of the carbon moles consumed to synthesise a product to the total number of carbon moles consumed. Considering the acetone synthesis reaction (eq. 1), 75 % is the highest selectivity to acetone which can be reached. The ethanol conversion is defined as the ratio of the moles of ethanol consumed to the moles of ethanol in the reagent mixture. The selectivities and conversions values were calculated employing the data average obtained between 10 and 14 h in time on stream. 3 Results and discussion Fig. 1 exhibits the catalytic behaviour of the prepared catalysts employing the same experimental conditions. The main products are acetone, CO2, acetaldehyde, hydrogen (not shown) and ethylene. Methane, CO, propene and butene are also generated at very low selectivities. The carbon balance of the catalytic tests was around 94 %. A high H2O/ethanol ratio was employed in this reaction to promote the ethanol oxidation and avoid undesirable condensations. As can be observed, the CeO2(npl) and AgCeO2(npl) catalysts show the highest conversions when compared with CeO2(ncb). Adding Ag to CeO2(npl), this catalyst exhibits the highest selectivity to acetone. The CeO2 and AgCeO2 catalysts prepared by coprecipitation in previous work (∼70 m2 g−1 and similar Ag concentration) showed much lower conversions when compared with CeO2(npl) and AgCeO2(npl), employing the same experimental conditions [9]. The AgCeO2(npl) catalyst behaviour was observed in time on stream during 16 h (Fig. S2). The conversion decreases during the first hour, whereas the selectivities to acetone, CO2 and acetaldehyde do not change. Next, a slight decrease of the conversion can be observed, being the steady-state reached after 10 h. The CeO2(ncb) and CeO2(npl) catalysts show similar behaviour compared with the one of Ag promoted catalyst. Table 1 depicts the ethanol consumption rates, products’ formation rates and specific and microporous areas of the prepared catalysts. The CeO2(npl) and AgCeO2(npl) catalysts show higher values of the specific areas compared with CeO2(ncb). Adding Ag to CeO2(npl), there is a slight decrease in the specific area value of the oxide. Fig. S3 shows the pore size distributions of the catalysts. The nanopolyhedral oxides exhibits the pore sizes around 1 and 10 nm, while CeO2(ncb) shows much higher values than that. The catalysts synthesised with (NH4)2Ce(NO3)6 as precursor exhibit much higher rates of ethanol consumption and products’ formation than the CeO2(ncb) catalyst (Table 1). It is worth stressing that the lower rates values of CeO2(ncb) compared with CeO2(npl) and AgCeO2(npl) are not exclusively associated with their specific area values. Adding Ag to CeO2(npl), the ethanol consumption and products generation rates increase when compared with CeO2(npl) indicating that a very small amount of Ag can modify the catalytic behaviour (Table 1). These results are in line with the ones showed in Fig. 1. The CeO2(npl) catalyst exhibits the highest selectivity to ethene (Fig. 1) and also the highest rate of ethene formation (Table 1). Adding Ag to CeO2(npl), the generation of ethene is inhibited and more acetaldehyde is formed. It is interesting to observe that the acetaldehyde generation rate is always much higher than the one of acetone. Indeed, acetaldehyde is an intermediate of the acetone generation from ethanol [9,10]. This result suggests that the acetone formation from acetaldehyde seems to be the slowest step of this synthesis. The number of basic sites and profiles obtained by the CO2-TPD are displayed in Table 2 and Fig. S4, respectively. The CeO2(npl) catalyst shows the highest number of strong basic sites, whereas CeO2(ncb) the lowest one. Thus, the oxide morphology modifies the basicity of the oxides. Moreover, adding Ag to CeO2(npl), the number of strong basic sites of this oxide decreases. The isopropanol decomposition model reaction was employed to describe the acid and basic properties of the catalysts. The acetone and propene generation rates are associated with basicity and acidity of the catalysts, respectively [33]. Table 2 depicts the propene and acetone formation rates of the three CeO2 based catalysts. Very low propene formation rates can be observed on Table 2. Thus, it can be inferred the low acidity of the prepared catalysts. Indeed, the low acidity of the CeO2 oxide is well known [9]. On the other hand, the three catalysts’ dehydrogenation rates correlate with the number of strong basic sites obtained by CO2-TPD confirming the high basicity of the prepared catalysts. Despite the criticism that can be found in the literature related to this model reaction, in this case, this technique seems to work well [34,35]. The HRTEM images of CeO2(ncb), CeO2(npl) e AgCeO2(npl) are shown in Fig. 2 . Fig. 2A, related to CeO2(ncb), depicts small cubes, most of them with sizes varying around 3–15 nm. This sample shows the following edge planes: (111) and (100) corresponding to the 3.1 and 2.7 Å interplanar distances, respectively (see inset). The bottom inset of Fig. 2A also exhibits electron diffraction spots assigned to the fluorite cubic CeO2 crystallographic system (ICSD 72155). Fig. 2B shows the CeO2(npl) particles, which are not only much smaller than the ones of CeO2(ncb) but also exhibit a different morphology. They are similar to nanopolyhedra, with particles size varying around 2−6 nm. This CeO2 particle shape was also observed by Mai et al. [24] when using the same synthesis procedure. The CeO2(npl) catalyst exposes the (100) and (111) faces with interplanar distances of 2.7 and 3.1 Å, respectively. The (110) face (interplanar distance of 1,9 Å) is also observed in the micrograph inset (top) of this catalyst. This morphology exposes more planes than the cubic one. Diffraction rings assigned to small CeO2, randomly oriented polycrystals are depicted on the bottom inset of Fig. 2B. The AgCeO2(npl) catalyst is exhibited in Fig. 2C. Adding Ag to CeO2(npl), the morphology of CeO2(npl) does not change, whereas the particle size slightly increases, i.e., it is around 3−7 nm (see histogram). The polyhedron faces scheme evidence the edges planes (111) and (100) obtained through Fourier transform of a selected region, whereas the main micrograph shows the (110) face (interplanar distance of 1,9 Å). The AgCeO2(npl) catalyst depicts the same edge faces observed for CeO2(npl). Fig. 3 shows the Raman scattering spectra of the prepared catalysts. The band around 466 cm−1 is assigned to the F2g mode and corresponds to a symmetric Ce-O stretching vibration of the CeO2 fluorite structure. A shift to lower energies can be observed as the oxide particle size decreases (see the maxima of CeO2(ncb) and CeO2(npl)) [34]. This phenomenon is less intense in the presence of Ag. Fig. 3 inset depicts small peaks around 600 cm−1. These vibrations can be assigned to the presence of oxygen vacancies preferably located on the surface of the CeO2 oxide [27,36]. The CeO2(ncb) spectrum exhibits the lowest intensity absorption. Thus, the nanopolyhedral catalysts show much more superficial vacancies than CeO2(ncb). The CeO2 bandgap occurs between the top of the valence band mainly formed by O (2p) states and the bottom of the conduction band formed by Ce (4f) states as calculated with DFT by different authors [37,38]. Both direct and indirect bandgaps were proposed for CeO2, as pointed by Radovic et al. [39]. Recently, Patel et al. [38] calculated with DFT that bulk CeO2 had direct bandgap. However, two low index surfaces showed indirect bandgap. The band gap values (Eg) were calculated employing the UV–vis absorption spectra of the CeO2-based catalysts (Fig. S5). Table 2 presents the values for both direct and indirect bandgaps. Both bandgaps presented similar behaviour. The bandgap reduction is consistent with the particle size decrease observed by HRTEM. The smaller CeO2 particle size reduces the bandgap, possibly due to the increased amount of defects, Ce3+, and the O vacancies [40–42]. This result is in line with the ones of the Raman spectroscopy. The EPR spectra of the reduced catalysts are depicted in Figs. 4 and S6. All of them show broad signals around 3300 G, which are characteristic of the ferromagnetic ordering and can be assigned to O vacancies [43]. The CeO2(ncb) and AgCeO2(npl) catalysts depict ferromagnetic signals which reach low field values (less than zero, see white arrows, Fig. S6). The spectrum of the CeO2(npl) catalyst also shows this behaviour, however, at very low intensity. The EPR signals were fitted with completed and uncompleted Lorentzian curves with baseline definition at high field values (see the grey arrow, Fig. S6). The EPR measurable areas associated with the O vacancies are shown in Table 2. The AgCeO2(npl) catalyst exhibits the highest value compared with the other two catalysts (Fig S6). Considering the values depicted in Table 2 and also the low field signal of the AgCeO2(npl) spectra, it can be suggested that the Ag promoted catalyst shows a large amount of vacancies compared with CeO2(npl) when both are reduced. Indeed, Ackland & Coey [43] have proposed that the ferromagnetic ordering signal of CeO2 nanoparticles, at room temperature, is associated with O vacancies and depends on the size and morphology of the particles and the presence of dopants as well. The H2-TPR profiles of the catalysts are depicted in Fig. 5 . Two peaks can be observed for each sample [44]. The ones at low temperature are associated with the reduction of the oxide surfaces, whereas the peaks observed at high temperature to the bulk [45]. The maxima of the first peaks related to CeO2(ncb), CeO2(npl) and AgCeO2(npl) are at 485, 438 and 315 °C, respectively. The CeO2(ncb) catalyst shows the maximum of the peak assigned to bulk reduction at 860 °C, while CeO2(npl) and AgCeO2(npl) exhibit the same peak at 823 °C. Table 2 depicts the H2 consumption amount related to the first peaks of the prepared catalysts. The distinct profiles of CeO2(ncb) and CeO2(npl) shows that the catalyst reducibility changes with the morphology. Indeed, not only the first peak of CeO2(npl) occurs at a lower temperature compared with CeO2(ncb), but also the amount of H2 consumption is higher. Adding Ag to CeO2(npl) the maximum of the first peak shifts 123 °C towards low temperatures, whereas the H2 consumption is almost the same. Lima et al. [9] also observed this temperature shift when adding Ag to CeO2 prepared by coprecipitation. The TPR profiles of both nanopolyhedral catalysts show a negative peak at around 570 °C. According to Perrichon et al. [45], these peaks can be associated with the presence of micropores (Table 1). It is worth stressing that the reduction of CeO2 generates O vacancies and coordinatively unsaturated sites (cus) species. The Raman spectra and the band gap values based on the UV–vis absorption spectra of the oxidized catalysts show that CeO2(npl) and AgCeO2(npl) exhibit the same amount of vacancies, however, more than CeO2(ncb). The EPR spectra of the reduced Ag promoted catalyst show much more vacancies than CeO2(npl). Considering the TPR profiles, it can be inferred that around 400 °C (reaction temperature, see Fig. 5), the AgCeO2(npl) catalyst is much more reduced than CeO2(npl) and the latter more reduced than CeO2(ncb). Hence, the vacancies concentration ranking of the reduced and oxidized prepared catalysts are AgCeO2(npl) > CeO2(npl) > CeO2(ncb) and AgCeO2(npl) = CeO2(npl) > CeO2(ncb), respectively. According to Mayernick et al. [46] and Marciniak et al. [47], the O vacancy formation energy of the CeO2 crystallographic planes follows the sequence (110) < (100) < (111). In the case of the nanopolyhedral catalysts, the HRTEM analyses exhibit the plane (110), while for CeO2(ncb), as it is less frequent, was not observed. Thus, CeO2(npl) and AgCeO2(npl) can generate vacancies more easily than the CeO2(ncb) catalyst. Moreover, the TPR profiles and the EPR data show that the presence of Ag promotes the vacancies formation. This occurs due to the weakening of the Ce-O bond [48,49]. Indeed, the catalysts which show higher reducibility and lower O vacancy formation energy not only generate vacancies more easily, but also exhibit a higher number of these species when reduced. The AgCeO2(npl) > CeO2(npl) > CeO2(ncb) ranking can be considered for both the vacancies number and the facility in which the vacancies are formed. The second step of the acetone synthesis is related to the generation of this ketone from acetaldehyde (see introduction). According to the literature, many mechanisms have been suggested for this reaction. At this point, the redox mechanism will be selected. Then, the correlation between the acetone generation rates and the redox properties of the catalyst will be analysed in order to verify if this mechanism is able to describe the acetone generation from acetaldehyde. The ethanol-TPD on AgCeO2(npl) is depicted in Fig. 6 , which shows H2, CO2, H2O, ethylene, acetaldehyde, ethanol and acetone spectra. Ethanol, H2O and acetaldehyde desorption occur at the same temperature (170 °C). These data suggest that acetaldehyde is generated by the oxidative dehydrogenation of ethanol due to the simultaneous water synthesis. This reaction reduces the catalyst, i.e., generates O vacancies [9]. Increasing the temperature, ethylene and H2O are synthesised via the ethanol dehydration. Indeed, ethylene, H2O and H2 show bands with maxima around 298 °C. It can be suggested that H2O dissociates on the O vacancies of the catalyst generating H2 and oxidizing the catalyst [50]. At this same temperature (298 °C), the acetone peak emerges which might be formed by the acetaldehyde oxidation followed by the acetate condensation. At higher temperatures, the CO2 a by-product of the acetone synthesis is observed. The ethanol-TPD shows that the generation of acetaldehyde from ethanol is the first step of this acetone synthesis, which is in line with the data in Table 1 and previous works [9,10]. Therefore, the rate of ethanol consumption in this cascade reaction depends on the catalyst behaviour in the oxidative dehydrogenation reaction. The mechanism of the oxidative dehydrogenation of ethanol can be described as following: firstly, ethoxide is formed by the H abstraction from the ethanol OH; next, the aldehyde is generated by the α-H abstraction from the ethoxide species by strong basic sites; then, H2O is desorbed forming an O vacancy on the catalyst surface. The α-H abstraction step is identified as the rate limiting step (rls) of the ethanol oxidative dehydrogenation [51,52]. According to the literature [51,52], strong basic sites are relevant for the oxidative dehydrogenation reaction. Tables 1 and 2 show that when adding Ag to CeO2(npl), the number of these sites decreases, whereas the acetaldehyde synthesis rate increases. Thus, these sites might promote the dehydrogenation reaction. However, they are not the most important species. Indeed, it is well known that O vacancies are strong basic sites [53]. Recently, Chagas et al. [28] have proposed that O vacancies behave as strong Brønsted basic sites in the rls of the ethanol dehydrogenation. Indeed, the oxidative dehydrogenation reaction shows the same rls than the ethanol dehydrogenation. It can be observed that the higher the vacancies number (reduced, see the ranking), the higher the rate of acetaldehyde formation is (Table 1). Therefore, it can be suggested that O vacancies participate in the rls of the acetaldehyde generation. Moreover, when O vacancies are generated, cus species, which are acid sites, are also formed [28]. In addition, ethoxide species might adsorb on the cus sites. As a result, pairs of oxygen vacancies and cus species might be the sites where rls of the oxidative dehydrogenation reaction occurs. Taking ethanol-TPD (Fig. 6) results into account, it can be suggested that this ketone generation is the slowest step of this cascade synthesis as it is synthesised at the highest temperature (Scheme 2 ). Changing the morphology from nanocubic to nanopolyhedral and also adding Ag to the latter, the acetone generation rate increases (Table 1). There is also an increase in the tendency to generate vacancies. According to de Lima et al. [9], Silva-Calpa et al. [10] and Matheus et al. [12] this step can be described as following: firstly, acetaldehyde is oxidised to acetate species by the O of the oxide lattice generating O vacancies and cus species; then, these carboxilates condense and synthesise acetone and CO2; finally, H2O dissociates on the vacancies and reoxidizes the catalyst. Hence, acetate generation (acetaldehyde oxidation) might occurs by the MvK mechanism being H2O the oxidant agent. According to Kumar et al. [54] the acetate species condensation (ketonization) takes place on acid and basic sites being this reaction very fast at temperatures higher than 300 °C. Moreover, H2O dissociation is also a very fast step [9,16,50]. Thus, the slowest step of the acetone synthesis from acetaldehyde might be the aldehyde oxidation or acetate formation. According to McFarland et al. [55], the slowest step of the MvK oxidation is the oxygen abstraction from the oxide lattice and not the insertion of O in the molecules to be oxidized. As a consequence, the catalyst which generates vacancies more easily should be the one which is the most active for the acetate formation. These results are in line with the experimental results described above (Table 1). Indeed, the easier the vacancies generation on the CeO2 based catalysts is, the higher the acetone synthesis rate will be. This result suggests that the MvK mechanism hypothesis might be correct. The O abstraction from the oxide lattice is the slowest step of the acetone synthesis from acetaldehyde, which is the slowest step of the acetone synthesis from ethanol. Hence, it can be highlighted the relevance of the MvK mechanism in this reaction system. The rate of ethanol consumption and acetaldehyde generation increases as more O vacancies are generated. This mechanism exhibits that H (oxidative dehydrogenation) and also acetaldehyde are able to promote the generation of O vacancy, being the O abstraction much easier for the former (see Fig. 6). Most of the propositions related to the acetone synthesis mechanism are based on the acid and basic properties of the catalysts (see introduction). Comparing the acidity and basicity data (Table 2) of the CeO2 based catalysts with their acetone generation rates (Table 1), it can be inferred that there is no correlation between these properties and the catalytic behaviour. The main characteristic of the MvK mechanism is the use of the O from the oxide lattice (catalyst) as oxidant agent of intermediates species. Indeed, the correlation between the facility to provide O from the CeO2 lattice (be reduced) and the catalytic behaviour of this oxides in the acetone synthesis from ethanol shows the relevance of the MvK mechanism for this reaction system. The three prepared catalysts generate ethylene as a by-product of the acetone synthesis from ethanol. The competition between dehydrogenation and dehydration of ethanol occurs in many systems in which ethanol are employed as feedstock. Considering that these catalysts do not show strong acid sites and according to Di Cosimo et al. [51], ethylene can be synthesised employing pairs of strong basic and acid sites. On the one hand, it can be inferred that there is a linear correlation between the ethylene formation rate (Table 1) and the number of strong basic sites obtained by the CO2-TPD (Table 2). On the other hand, Table 1 shows that the Ag promoted catalyst generates less ethylene than CeO2(npl) despite its higher O vacancies concentration (which are also strong basic sites). Hence, it can be suggested that O vacancies are mainly associated with the acetone synthesis process and the strong basic sites (CO2-TPD) to ethanol dehydration. Two different Ce precursors, Ce(NO3)3 or (NH4)2Ce(NO3)6, were employed in the CeO2 synthesis. The (NH4)2Ce(NO3)6 aqueous solution shows a stable 12-coordinate icosahedron complex in which the six NO3− ligands are bounded to Ce4+ in its chelate mode by two oxygen atoms (Ce(NO3)6 2-), whereas Ce(NO3)3 in aqueous solution forms Ce3+. Thus, the chemical behaviour of these species during preparation might be distinct. Accordingly, these two cerium precursors generate oxides with different morphology, physicochemical properties and reactivity [44]. Branda et al. [56] used DFT to study the interaction of Ag, Au, and Cu atoms on the CeO2 (111) surface. They verified that Ag ions prefer 3-fold symmetry positions with an adsorption energy of -1.0 eV and a Bader net charge of +0.56. They also suggest that the Ag atoms are adsorbed as ions distributed over the surface, forming a periodic array. In order to describe the AgCeO2 (npl) catalyst, the Urbach energy [57] was calculated employing the UV–vis spectra (Fig. S5). The CeO2(npl) and AgCeO2 (npl) values obtained were 0.13 and 0.09 eV, respectively. Taking the Branda et al. [56] DFT study into account, the slightly smaller Urbach energy obtained for the AgCeO2(npl) compared to CeO2(npl) can be associated with the Ag1+ ions adsorbed on the CeO2 surface which favour surface reordering. Moreover, it can be suggested that Ag1+ species on CeO2 show electrophilic character (Bader net charge). Thus, during the acetone synthesis and also TPR experiments the Ag1+ species favour the O exit, also an electrophilic species, from the surface lattice promoting the formation of oxygen vacancies [55]. The AgCeO2(npl) catalyst is a promising system for the acetone synthesis from ethanol as it shows not only high activity and selectivity to acetone and but also low selectivity to ethene. Moreover, the nanostructured CeO2 catalysts are very useful tools for showing the relevance of the O vacancies and the redox character of the acetone synthesis mechanism. 4 Conclusions Three nanostructured CeO2 based catalysts were synthesised employing two different Ce precursors and Ag as a dopant. In spite of being promising catalysts for the acetone synthesis from ethanol they were employed as tools to describe the mechanism of this reaction. The catalysts prepared employing (NH4)2Ce(NO3)6 show nanopolyhedral particles whereas when Ce(NO3)3 is used nanocubes are synthesized. The former not only generate O vacancies more easily, but also exhibit a higher number of these species when reduced. Doping the nanopolyhedral oxide with Ag these properties are enhanced. The O vacancies participate as Brønsted basic sites in the rate limiting step of the ethanol oxidative dehydrogenation reaction, which is the first step of this cascade system. The O abstraction from the oxide lattice is the slowest step of the acetone synthesis from acetaldehyde, which is the slowest step of the acetone synthesis from ethanol. Indeed, the easier the vacancy generation, the higher the rate of the acetone synthesis is. This result is in line with the MvK mechanism, in which acetaldehyde abstracts O from CeO2 lattice forming acetate species and O vacancies. Considering the catalytic behaviour of these three catalysts, it can be proposed that the slowest step of the acetone synthesis from ethanol exhibits a relevant redox characteristic. The main characteristic of the MvK mechanism is the use of the O from the oxide lattice (catalyst) as an oxidant agent. The correlation between the CeO2 based catalysts facility to release O (be reduced) and these oxides catalytic behaviour in the acetone synthesis from ethanol shows the relevance of the MvK mechanism for this reaction system CRediT authorship contribution statement Adriana F.F. de Lima: Writing - original draft, Investigation, Visualization, Formal analysis. Carla R. Moreira: Investigation, Visualization, Writing - original draft. Odivaldo C. Alves: Investigation, Formal analysis. Roberto R. de Avillez: Investigation, Formal analysis, Validation. Fatima M.Z. Zotin: Supervision, Methodology, Validation, Formal analysis, Writing - review & editing. Lucia G. Appel: Conceptualization, Project administration, Supervision, Writing - review & editing. Declaration of Competing Interest The authors report no declarations of interest. Acknowledgements The authors acknowledge the contribution of the LACAT/INT and CENANO staff for the characterization analyses. The authors are very thankful to Priscilla C. Zonetti for the experimental support. Adriana F.F. de Lima is very grateful to FAPERJ for the special scholarship. We are also very thankful to the Centro Brasileiro de Pesquisas Físicas (CBPF) where the HRTEM (LABNANO) and EPR measurements were carried out. The authors are indebted to Andrey Oliveira and also to the Coordenação de Analises Minerais of the Centro de Tecnologia Mineral (CETEM). LGA, FMZZ and RRA acknowledge the Conselho Nacional de Desenvolvimento Científico e Tecnológico, CNPq, for partial funding. Appendix A Supplementary data Supplementary material related to this article can be found, in the online version, at doi:https://doi.org/10.1016/j.apcata.2020.117949. Appendix A Supplementary data The following is Supplementary data to this article: References [1] ICIS.com Acetone Prices, Markets & Analysis 2019 https://www.icis.com/explore/commodities/chemicals/acetone ICIS.com, Acetone prices, markets & analysis, https://www.icis.com/explore/commodities/chemicals/acetone, 2019 (accessed January 15, 2020). [2] B.J.S. Bronsato P. da C. Zonetti C.R. Moreira C.D. Mendonza M.E.H.M. da Costa O.C. Alves R.R. De Avillez L.G. Appel Catal. Today 2020 10.1016/j.cattod.2020.07.004 B.J.S. Bronsato, P. da C. Zonetti, C.R. Moreira, C.D. Mendonza, O.C. da Costa, M. E.H.M. Alves, R.R. De Avillez, L.G. Appel, Catal. Today (2020), 10.1016/j.cattod.2020.07.004. [3] T. Nakajima T. Yamaguchi K. Tanabe J. Chem. Soc. Chem. Commun. 1987 394 395 T. Nakajima, T. Yamaguchi, K. Tanabe, J. Chem. Soc. Chem. Commun. (1987) 394–395. [4] R. Sreerama Murthy P. Patnaik P. Sidheswaran M. Jayamani J. Catal. 109 1988 298 302 R. Sreerama Murthy, P. Patnaik, P. Sidheswaran, M. Jayamani, J. Catal. 109 (1988) 298–302. [5] T. Nakajima K. Tanabe T. Yamaguchi I. Matsuzaki S. Mishima Appl. Catal. 52 1989 237 248 T. Nakajima, K. Tanabe, T. Yamaguchi, I. Matsuzaki, S. Mishima, Appl. Catal. 52 (1989) 237–248. [6] H. Idriss E.G. Seebauer J. Mol. Catal. A Chem. 152 2000 201 212 H. Idriss, E.G. Seebauer, J. Mol. Catal. A Chem. 152 (2000) 201–212. [7] P. Rybak B. Tomaszewska A. MacHocki W. Grzegorczyk A. Denis Catal. Today 176 2011 14 20 P. Rybak, B. Tomaszewska, A. MacHocki, W. Grzegorczyk, A. Denis, Catal. Today 176 (2011) 14–20. [8] T. Nishiguchi T. Matsumoto H. Kanai K. Utani Y. Matsumura W.J. Shen S. Imamura Appl. Catal. A Gen. 279 2005 273 277 T. Nishiguchi, T. Matsumoto, H. Kanai, K. Utani, Y. Matsumura, W.J. Shen, S. Imamura, Appl. Catal. A Gen. 279 (2005) 273–277. [9] A.F.F. de Lima P.C. Zonetti C.P. Rodrigues L.G. Appel Catal. Today 279 2017 252 259 A.F.F. de Lima, P.C. Zonetti, C.P. Rodrigues, L.G. Appel, Catal. Today 279 (2017) 252–259. [10] L. del R. Silva-Calpa P.C. Zonetti D.C. de Oliveira R.R. de Avillez L.G. Appel Catal. Today 289 2017 264 272 L. del R. Silva-Calpa, P.C. Zonetti, D.C. de Oliveira, R.R. de Avillez, L.G. Appel, Catal. Today 289 (2017) 264–272. [11] C.P. Rodrigues P.C. Zonetti C.G. Silva A.B. Gaspar L.G. Appel Appl. Catal. A Gen. 458 2013 111 118 C.P. Rodrigues, P.C. Zonetti, C.G. Silva, A.B. Gaspar, L.G. Appel, Appl. Catal. A Gen. 458 (2013) 111–118. [12] C.R.V. Matheus L.H. Chagas G.G. Gonzalez E.F. Sousa-Aguiar L.G. Appel ACS Catal. 8 2018 7667 7678 C.R.V. Matheus, L.H. Chagas, G.G. Gonzalez, E.F. Sousa-Aguiar, L.G. Appel, ACS Catal. 8 (2018) 7667–7678. [13] P.C. Zonetti V.L. Bridi G.G. Gonzalez C.R. Moreira O.C. Alves R.R. de Avillez L.G. Appel ChemCatChem 11 2019 4011 4020 P.C. Zonetti, V.L. Bridi, G.G. Gonzalez, C.R. Moreira, O.C. Alves, R.R. de Avillez, L.G. Appel, ChemCatChem 11 (2019) 4011–4020. [14] M. Iwamoto M. Tanaka S. Hirakawa S. Mizuno M. Kurosawa ACS Catal. 4 2014 3463 3469 M. Iwamoto, M. Tanaka, S. Hirakawa, S. Mizuno, M. Kurosawa, ACS Catal. 4 (2014) 3463–3469. [15] F. Hayashi M. Tanaka D. Lin M. Iwamoto J. Catal. 316 2014 112 120 F. Hayashi, M. Tanaka, D. Lin, M. Iwamoto, J. Catal. 316 (2014) 112–120. [16] G.G. Gonzalez P.C. Zonetti E.B. Silveira F.M.T. Mendes R.R. de Avillez C.R.K. Rabello F.M.Z. Zotin L.G. Appel J. Catal. 380 2019 343 351 G.G. Gonzalez, P.C. Zonetti, E.B. Silveira, F.M.T. Mendes, R.R. de Avillez, C.R.K. Rabello, F.M.Z. Zotin, L.G. Appel, J. Catal. 380 (2019) 343–351. [17] F. Liu Y. Men J. Wang X. Huang Y. Wang W. An ChemCatChem Commun. 9 2017 1 8 F. Liu, Y. Men, J. Wang, X. Huang, Y. Wang, W. An, ChemCatChem Commun. 9 (2017) 1–8. [18] A. Yee S.J. Morrison H. Idriss J. Catal. 186 1999 279 295 A. Yee, S.J. Morrison, H. Idriss, J. Catal. 186 (1999) 279–295. [19] J.E. Rorrer F.D. Toste A.T. Bell ACS Catal. 9 2019 10588 10604 J.E. Rorrer, F.D. Toste, A.T. Bell, ACS Catal. 9 (2019) 10588–10604. [20] J.-J. Miao H. Wang Y.-R. Li J.-M. Zhu J.-J. Zhu J. Cryst. Growth 281 2005 525 529 J.-J. Miao, H. Wang, Y.-R. Li, J.-M. Zhu, J.-J. Zhu, J. Cryst. Growth 281 (2005) 525–529. [21] I. Porqueras C. Person C. Corbella M. Vives A. Pinyol E. Bertran Solid State Ion. 165 2003 131 137 I. Porqueras, C. Person, C. Corbella, M. Vives, A. Pinyol, E. Bertran, Solid State Ionics 165 (2003) 131–137. [22] Y. Chen T. Liu C. Chen R. Sun S. Lv M. Saito S. Tsukimoto Z. Wang Mater. Lett. 92 2013 7 10 Y. Chen, T. Liu, C. Chen, R. Sun, S. Lv, M. Saito, S. Tsukimoto, Z. Wang, Mater. Lett. 92 (2013) 7–10. [23] P.X. Huang F. Wu B.L. Zhu X.P. Gao H.Y. Zhu T.Y. Yan W.P. Huang S.H. Wu D.Y. Song J. Phys. Chem. B 109 2005 19169 19174 P.X. Huang, F. Wu, B.L. Zhu, X.P. Gao, H.Y. Zhu, T.Y. Yan, W.P. Huang, S.H. Wu, D.Y. Song, J. Phys. Chem. B 109 (2005) 19169–19174. [24] H.X. Mai L.D. Sun Y.W. Zhang R. Si W. Feng H.P. Zhang H.C. Liu C.H. Yan J. Phys. Chem. B 109 2005 24380 24385 H.X. Mai, L.D. Sun, Y.W. Zhang, R. Si, W. Feng, H.P. Zhang, H.C. Liu, C.H. Yan, J. Phys. Chem. B 109 (2005) 24380–24385. [25] Z. Wu M. Li S.H. Overbury J. Catal. 285 2012 61 73 Z. Wu, M. Li, S.H. Overbury, J. Catal. 285 (2012) 61–73. [26] J.M. López A.L. Gilbank T. García B. Solsona S. Agouram L. Torrente-Murciano Appl. Catal. B Environ. 174–175 2015 403 412 J.M. López, A.L. Gilbank, T. García, B. Solsona, S. Agouram, L. Torrente-Murciano, Appl. Catal. B Environ. 174–175 (2015) 403–412. [27] S. Chang M. Li Q. Hua L. Zhang Y. Ma B. Ye W. Huang J. Catal. 293 2012 195 204 S. Chang, M. Li, Q. Hua, L. Zhang, Y. Ma, B. Ye, W. Huang, J. Catal. 293 (2012) 195–204. [28] L.H. Chagas P.C. Zonetti C.R.V. Matheus C.R.K. Rabello O.C. Alves L.G. Appel ChemCatChem 11 2019 1 9 L.H. Chagas, P.C. Zonetti, C.R.V. Matheus, C.R.K. Rabello, O.C. Alves, L.G. Appel, ChemCatChem 11 (2019) 1–9. [29] J. Tauc A. Menth J. Non Cryst. Solids 8–10 1972 569 585 J. Tauc, A. Menth, J. Non. Cryst. Solids 8–10 (1972) 569–585. [30] B.D. Viezbicke S. Patel B.E. Davis D.P. Birnie Phys. Status Solidi Basic Res. 252 2015 1700 1710 B.D. Viezbicke, S. Patel, B.E. Davis, D.P. Birnie, Phys. Status Solidi Basic Res. 252 (2015) 1700–1710. [31] K. Boubaker Eur. Phys. J. Plus 126 2011 1 4 K. Boubaker, Eur. Phys. J. Plus 126 (2011) 1–4. [32] C.P. Poole Electron Spin Resonance: a Comprehensive Treatise on Experimental Techniques 2nd ed. 1996 Dover Publication New York C.P. Poole, Electron spin resonance: a comprehensive treatise on experimental techniques, second ed., Dover Publication, New York, 1996. [33] X. Gu J. Ge H. Zhang A. Auroux J. Shen Thermochim. Acta 451 2006 84 93 X. Gu, J. Ge, H. Zhang, A. Auroux, J. Shen, Thermochim. Acta 451 (2006) 84–93. [34] J.E. Spanier R.D. Robinson F. Zhang S.-W. Chan I.P. Herman Phys. Rev. B - Condens. Matter Mater. Phys. 64 2001 1 8 J.E. Spanier, R.D. Robinson, F. Zhang, S.-W. Chan, I.P. Herman, Phys. Rev. B - Condens. Matter Mater. Phys. 64 (2001) 1–8. [35] J.C. Védrine Res. Chem. Intermed. 41 2015 9387 9423 J.C. Védrine, Res. Chem. Intermed. 41 (2015) 9387–9423. [36] S.K. Meher G. Ranga Rao J. Colloid Interface Sci. 373 2012 46 56 S.K. Meher, G. Ranga Rao, J. Colloid Interface Sci. 373 (2012) 46–56. [37] M. El Khalifi F. Picaud M. Bizi Anal. Methods 8 2016 5045 5052 M. El Khalifi, F. Picaud, M. Bizi, Anal. Methods 8 (2016) 5045–5052. [38] V.R. Patel R.N. Somaiya S. Kansara D. Singh N. Prajapati Y. Sonvane P.B. Thakor S.K. Gupta Solid State Commun. 307 2020 10.1016/j.ssc.2019.113801 V.R. Patel, R.N. Somaiya, S. Kansara, D. Singh, N. Prajapati, Y. Sonvane, P.B. Thakor, S.K. Gupta, Solid State Commun. 307 (2020), 10.1016/j.ssc.2019.113801. [39] M. Radović Z. Dohcevic-Mitrovic A. Golubović V. Fruth S. Preda M. Šćepanović Z.V. Popović Ceram. Int. 39 2013 4929 4936 M. Radović, Z. Dohcevic-Mitrovic, A. Golubović, V. Fruth, S. Preda, M. Šćepanović, Z. V. Popović, Ceram. Int. 39 (2013) 4929–4936. [40] A.S. Thill F.O. Lobato M.O. Vaz W.P. Fernandes V.E. Carvalho E.A. Soares F. Poletto S.R. Teixeira F. Bernardi Appl. Surf. Sci. 528 2020 146860 A.S. Thill, F.O. Lobato, M.O. Vaz, W.P. Fernandes, V.E. Carvalho, E.A. Soares, F. Poletto, S.R. Teixeira, F. Bernardi, Appl. Surf. Sci. 528 (2020), Article 146860. [41] S.A. Ansari M.M. Khan M.O. Ansari S. Kalathil J. Lee M.H. Cho RSC Adv. 4 2014 16782 16791 S.A. Ansari, M.M. Khan, M.O. Ansari, S. Kalathil, J. Lee, M.H. Cho, RSC Adv. 4 (2014) 16782–16791. [42] B. Choudhury A. Choudhury Mater. Chem. Phys. 131 2012 666 671 B. Choudhury, A. Choudhury, Mater. Chem. Phys. 131 (2012) 666–671. [43] K. Ackland J.M.D. Coey Phys. Rep. 746 2018 1 39 K. Ackland, J.M.D. Coey, Phys. Rep. 746 (2018) 1–39. [44] S. Letichevsky C.A. Tellez R.R. De Avillez M.I.P. Da Silva M.A. Fraga L.G. Appel Appl. Catal. B Environ. 58 2005 203 210 S. Letichevsky, C.A. Tellez, R.R. De Avillez, M.I.P. Da Silva, M.A. Fraga, L.G. Appel, Appl. Catal. B Environ. 58 (2005) 203–210. [45] V. Perrichon A. Laachir G. Bergeret R. Fréty L. Tournayan O. Touret J. Chem. Soc. Faraday Trans. 90 1994 773 781 V. Perrichon, A. Laachir, G. Bergeret, R. Fréty, L. Tournayan, O. Touret, J. Chem. Soc. Faraday Trans. 90 (1994) 773–781. [46] A.D. Mayernick M.J. Janik J. Phys. Chem. C 112 2008 14955 14964 A.D. Mayernick, M.J. Janik, J. Phys. Chem. C 112 (2008) 14955–14964. [47] A.A. Marciniak F.J.F.S. Henrique A.F.F. de Lima O.C. Alves C.R. Moreira L.G. Appel C.J.A. Mota Mol. Catal. 493 2020 111053 A.A. Marciniak, F.J.F.S. Henrique, A.F.F. de Lima, O.C. Alves, C.R. Moreira, L.G. Appel, C.J.A. Mota, Mol. Catal. 493 (2020), Article 111053. [48] X. Jing H. Wang H. Chen J. Huang Q. Li D. Sun RSC Adv. 4 2014 27597 27603 X. Jing, H. Wang, H. Chen, J. Huang, Q. Li, D. Sun, RSC Adv. 4 (2014) 27597–27603. [49] K. Negi A. Umar M.S. Chauhan M.S. Akhtar Ceram. Int. 45 2019 20509 20517 K. Negi, A. Umar, M.S. Chauhan, M.S. Akhtar, Ceram. Int. 45 (2019) 20509–20517. [50] B. Chen Y. Ma L. Ding L. Xu Z. Wu Q. Yuan W. Huang J. Phys. Chem. C 117 2013 5800 5810 B. Chen, Y. Ma, L. Ding, L. Xu, Z. Wu, Q. Yuan, W. Huang, J. Phys. Chem. C 117 (2013) 5800–5810. [51] J.I. Di Cosimo V.K. Díez M. Xu E. Iglesia C.R. Apesteguía J. Catal. 178 1998 499 510 J.I. Di Cosimo, V.K. Díez, M. Xu, E. Iglesia, C.R. Apesteguía, J. Catal. 178 (1998) 499–510. [52] M.V. Ganduglia-Pirovano Catal. Today 253 2015 20 32 M.V. Ganduglia-Pirovano, Catal. Today 253 (2015) 20–32. [53] H. Metiu S. Chrétien Z. Hu B. Li X.Y. Sun J. Phys. Chem. C 116 2012 10439 10450 H. Metiu, S. Chrétien, Z. Hu, B. Li, X.Y. Sun, J. Phys. Chem. C 116 (2012) 10439–10450. [54] R. Kumar N. Enjamuri S. Shah A.S. Al-Fatesh J.J. Bravo-Suárez B. Chowdhury Catal. Today 302 2018 16 49 R. Kumar, N. Enjamuri, S. Shah, A.S. Al-Fatesh, J.J. Bravo-Suárez, B. Chowdhury, Catal. Today 302 (2018) 16–49. [55] E.W. McFarland H. Metiu Chem. Rev. 113 2013 4391 4427 E.W. McFarland, H. Metiu, Chem. Rev. 113 (2013) 4391–4427. [56] M.M. Branda N.C. Hernández J.F. Sanz F. Illas J. Phys. Chem. C 114 2010 1934 1941 M.M. Branda, N.C. Hernández, J.F. Sanz, F. Illas, J. Phys. Chem. C 114 (2010) 1934–1941. [57] I. Studenyak M. Kranj M. Kurik Int. J. Opt. Appl. 4 2014 76 83 I. Studenyak, M. Kranj, M. Kurik, Int. J. Opt. Appl. 4 (2014) 76–83.",
      "scopus-id": "85098546115",
      "coredata": {
        "eid": "1-s2.0-S0926860X20305421",
        "dc:description": "Nanostructured CeO2 based catalysts were employed as tools to shed light on the mechanism of the acetone synthesis from ethanol. The oxides were characterized using HRTEM, EPR, and other techniques. Rates of ethanol consumption and products formation were measured at differential conditions. The catalysts prepared employing Ce(NO3)3 generate nanocubes, whereas when (NH4)2Ce(NO3)6 is used, nanopolyhedral particles are synthesised. The later forms O vacancies more easily. This property enhances when Ag is added to the nanopolyhedral catalyst. The correlation between the catalytic behaviour and the nanocatalysts`s physicochemical properties showed that O vacancies participate as Brønsted basic sites in the acetaldehyde synthesis and that the easier the O vacancies generation, the higher the rate of the acetone synthesis is. The O abstraction from the CeO2 lattice by acetaldehyde (Mars and Van Krevelen mechanism) is the slowest step of the acetone synthesis from ethanol, showing that this synthesis exhibits a relevant redox characteristic.",
        "openArchiveArticle": "false",
        "prism:coverDate": "2021-02-05",
        "openaccessUserLicense": null,
        "prism:aggregationType": "Journal",
        "prism:url": "https://api.elsevier.com/content/article/pii/S0926860X20305421",
        "dc:creator": [
          {
            "@_fa": "true",
            "$": "de Lima, Adriana F.F."
          },
          {
            "@_fa": "true",
            "$": "Moreira, Carla R."
          },
          {
            "@_fa": "true",
            "$": "Alves, Odivaldo C."
          },
          {
            "@_fa": "true",
            "$": "de Avillez, Roberto R."
          },
          {
            "@_fa": "true",
            "$": "Zotin, Fatima M.Z."
          },
          {
            "@_fa": "true",
            "$": "Appel, Lucia G."
          }
        ],
        "link": [
          {
            "@_fa": "true",
            "@rel": "self",
            "@href": "https://api.elsevier.com/content/article/pii/S0926860X20305421"
          },
          {
            "@_fa": "true",
            "@rel": "scidir",
            "@href": "https://www.sciencedirect.com/science/article/pii/S0926860X20305421"
          }
        ],
        "dc:format": "application/json",
        "openaccessType": null,
        "pii": "S0926-860X(20)30542-1",
        "prism:volume": "611",
        "articleNumber": "117949",
        "prism:publisher": "Elsevier B.V.",
        "dc:title": "Acetone synthesis from ethanol and the Mars and Van Krevelen mechanism using CeO2 and AgCeO2 nanostructured catalysts",
        "prism:copyright": "© 2020 Elsevier B.V. All rights reserved.",
        "openaccess": "0",
        "prism:issn": "0926860X",
        "dcterms:subject": [
          {
            "@_fa": "true",
            "$": "Ethanol"
          },
          {
            "@_fa": "true",
            "$": "Acetaldehyde"
          },
          {
            "@_fa": "true",
            "$": "Mars and Van Krevelen mechanism"
          },
          {
            "@_fa": "true",
            "$": "CeO2"
          },
          {
            "@_fa": "true",
            "$": "Acetone"
          }
        ],
        "openaccessArticle": "false",
        "prism:publicationName": "Applied Catalysis A: General",
        "openaccessSponsorType": null,
        "prism:pageRange": "117949",
        "pubType": "fla",
        "prism:coverDisplayDate": "5 February 2021",
        "prism:doi": "10.1016/j.apcata.2020.117949",
        "prism:startingPage": "117949",
        "dc:identifier": "doi:10.1016/j.apcata.2020.117949",
        "openaccessSponsorName": null
      },
      "objects": {
        "object": [
          {
            "@category": "standard",
            "@height": "239",
            "@width": "150",
            "@_fa": "true",
            "$": "https://api.elsevier.com/content/object/eid/1-s2.0-S0926860X20305421-gr1.jpg?httpAccept=%2A%2F%2A",
            "@multimediatype": "JPEG image file",
            "@type": "IMAGE-DOWNSAMPLED",
            "@size": "12804",
            "@ref": "gr1",
            "@mimetype": "image/jpeg"
          },
          {
            "@category": "standard",
            "@height": "802",
            "@width": "715",
            "@_fa": "true",
            "$": "https://api.elsevier.com/content/object/eid/1-s2.0-S0926860X20305421-gr2.jpg?httpAccept=%2A%2F%2A",
            "@multimediatype": "JPEG image file",
            "@type": "IMAGE-DOWNSAMPLED",
            "@size": "182822",
            "@ref": "gr2",
            "@mimetype": "image/jpeg"
          },
          {
            "@category": "standard",
            "@height": "241",
            "@width": "152",
            "@_fa": "true",
            "$": "https://api.elsevier.com/content/object/eid/1-s2.0-S0926860X20305421-gr3.jpg?httpAccept=%2A%2F%2A",
            "@multimediatype": "JPEG image file",
            "@type": "IMAGE-DOWNSAMPLED",
            "@size": "11365",
            "@ref": "gr3",
            "@mimetype": "image/jpeg"
          },
          {
            "@category": "standard",
            "@height": "229",
            "@width": "131",
            "@_fa": "true",
            "$": "https://api.elsevier.com/content/object/eid/1-s2.0-S0926860X20305421-gr4.jpg?httpAccept=%2A%2F%2A",
            "@multimediatype": "JPEG image file",
            "@type": "IMAGE-DOWNSAMPLED",
            "@size": "9105",
            "@ref": "gr4",
            "@mimetype": "image/jpeg"
          },
          {
            "@category": "standard",
            "@height": "238",
            "@width": "152",
            "@_fa": "true",
            "$": "https://api.elsevier.com/content/object/eid/1-s2.0-S0926860X20305421-gr5.jpg?httpAccept=%2A%2F%2A",
            "@multimediatype": "JPEG image file",
            "@type": "IMAGE-DOWNSAMPLED",
            "@size": "10655",
            "@ref": "gr5",
            "@mimetype": "image/jpeg"
          },
          {
            "@category": "standard",
            "@height": "272",
            "@width": "169",
            "@_fa": "true",
            "$": "https://api.elsevier.com/content/object/eid/1-s2.0-S0926860X20305421-gr6.jpg?httpAccept=%2A%2F%2A",
            "@multimediatype": "JPEG image file",
            "@type": "IMAGE-DOWNSAMPLED",
            "@size": "11820",
            "@ref": "gr6",
            "@mimetype": "image/jpeg"
          },
          {
            "@category": "standard",
            "@height": "257",
            "@width": "376",
            "@_fa": "true",
            "$": "https://api.elsevier.com/content/object/eid/1-s2.0-S0926860X20305421-sc1.jpg?httpAccept=%2A%2F%2A",
            "@multimediatype": "JPEG image file",
            "@type": "IMAGE-DOWNSAMPLED",
            "@size": "24983",
            "@ref": "sc1",
            "@mimetype": "image/jpeg"
          },
          {
            "@category": "standard",
            "@height": "251",
            "@width": "489",
            "@_fa": "true",
            "$": "https://api.elsevier.com/content/object/eid/1-s2.0-S0926860X20305421-sc2.jpg?httpAccept=%2A%2F%2A",
            "@multimediatype": "JPEG image file",
            "@type": "IMAGE-DOWNSAMPLED",
            "@size": "29621",
            "@ref": "sc2",
            "@mimetype": "image/jpeg"
          },
          {
            "@category": "thumbnail",
            "@height": "164",
            "@width": "103",
            "@_fa": "true",
            "$": "https://api.elsevier.com/content/object/eid/1-s2.0-S0926860X20305421-gr1.sml?httpAccept=%2A%2F%2A",
            "@multimediatype": "GIF image file",
            "@type": "IMAGE-THUMBNAIL",
            "@size": "9576",
            "@ref": "gr1",
            "@mimetype": "image/gif"
          },
          {
            "@category": "thumbnail",
            "@height": "164",
            "@width": "146",
            "@_fa": "true",
            "$": "https://api.elsevier.com/content/object/eid/1-s2.0-S0926860X20305421-gr2.sml?httpAccept=%2A%2F%2A",
            "@multimediatype": "GIF image file",
            "@type": "IMAGE-THUMBNAIL",
            "@size": "14885",
            "@ref": "gr2",
            "@mimetype": "image/gif"
          },
          {
            "@category": "thumbnail",
            "@height": "163",
            "@width": "103",
            "@_fa": "true",
            "$": "https://api.elsevier.com/content/object/eid/1-s2.0-S0926860X20305421-gr3.sml?httpAccept=%2A%2F%2A",
            "@multimediatype": "GIF image file",
            "@type": "IMAGE-THUMBNAIL",
            "@size": "5855",
            "@ref": "gr3",
            "@mimetype": "image/gif"
          },
          {
            "@category": "thumbnail",
            "@height": "164",
            "@width": "94",
            "@_fa": "true",
            "$": "https://api.elsevier.com/content/object/eid/1-s2.0-S0926860X20305421-gr4.sml?httpAccept=%2A%2F%2A",
            "@multimediatype": "GIF image file",
            "@type": "IMAGE-THUMBNAIL",
            "@size": "5498",
            "@ref": "gr4",
            "@mimetype": "image/gif"
          },
          {
            "@category": "thumbnail",
            "@height": "163",
            "@width": "104",
            "@_fa": "true",
            "$": "https://api.elsevier.com/content/object/eid/1-s2.0-S0926860X20305421-gr5.sml?httpAccept=%2A%2F%2A",
            "@multimediatype": "GIF image file",
            "@type": "IMAGE-THUMBNAIL",
            "@size": "5170",
            "@ref": "gr5",
            "@mimetype": "image/gif"
          },
          {
            "@category": "thumbnail",
            "@height": "164",
            "@width": "102",
            "@_fa": "true",
            "$": "https://api.elsevier.com/content/object/eid/1-s2.0-S0926860X20305421-gr6.sml?httpAccept=%2A%2F%2A",
            "@multimediatype": "GIF image file",
            "@type": "IMAGE-THUMBNAIL",
            "@size": "4901",
            "@ref": "gr6",
            "@mimetype": "image/gif"
          },
          {
            "@category": "thumbnail",
            "@height": "150",
            "@width": "219",
            "@_fa": "true",
            "$": "https://api.elsevier.com/content/object/eid/1-s2.0-S0926860X20305421-sc1.sml?httpAccept=%2A%2F%2A",
            "@multimediatype": "GIF image file",
            "@type": "IMAGE-THUMBNAIL",
            "@size": "11259",
            "@ref": "sc1",
            "@mimetype": "image/gif"
          },
          {
            "@category": "thumbnail",
            "@height": "113",
            "@width": "219",
            "@_fa": "true",
            "$": "https://api.elsevier.com/content/object/eid/1-s2.0-S0926860X20305421-sc2.sml?httpAccept=%2A%2F%2A",
            "@multimediatype": "GIF image file",
            "@type": "IMAGE-THUMBNAIL",
            "@size": "9567",
            "@ref": "sc2",
            "@mimetype": "image/gif"
          },
          {
            "@category": "high",
            "@height": "1063",
            "@width": "667",
            "@_fa": "true",
            "$": "https://api.elsevier.com/content/object/eid/1-s2.0-S0926860X20305421-gr1_lrg.jpg?httpAccept=%2A%2F%2A",
            "@multimediatype": "JPEG image file",
            "@type": "IMAGE-HIGH-RES",
            "@size": "175321",
            "@ref": "gr1",
            "@mimetype": "image/jpeg"
          },
          {
            "@category": "high",
            "@height": "3554",
            "@width": "3167",
            "@_fa": "true",
            "$": "https://api.elsevier.com/content/object/eid/1-s2.0-S0926860X20305421-gr2_lrg.jpg?httpAccept=%2A%2F%2A",
            "@multimediatype": "JPEG image file",
            "@type": "IMAGE-HIGH-RES",
            "@size": "2423667",
            "@ref": "gr2",
            "@mimetype": "image/jpeg"
          },
          {
            "@category": "high",
            "@height": "1069",
            "@width": "674",
            "@_fa": "true",
            "$": "https://api.elsevier.com/content/object/eid/1-s2.0-S0926860X20305421-gr3_lrg.jpg?httpAccept=%2A%2F%2A",
            "@multimediatype": "JPEG image file",
            "@type": "IMAGE-HIGH-RES",
            "@size": "111986",
            "@ref": "gr3",
            "@mimetype": "image/jpeg"
          },
          {
            "@category": "high",
            "@height": "1017",
            "@width": "583",
            "@_fa": "true",
            "$": "https://api.elsevier.com/content/object/eid/1-s2.0-S0926860X20305421-gr4_lrg.jpg?httpAccept=%2A%2F%2A",
            "@multimediatype": "JPEG image file",
            "@type": "IMAGE-HIGH-RES",
            "@size": "194908",
            "@ref": "gr4",
            "@mimetype": "image/jpeg"
          },
          {
            "@category": "high",
            "@height": "1055",
            "@width": "674",
            "@_fa": "true",
            "$": "https://api.elsevier.com/content/object/eid/1-s2.0-S0926860X20305421-gr5_lrg.jpg?httpAccept=%2A%2F%2A",
            "@multimediatype": "JPEG image file",
            "@type": "IMAGE-HIGH-RES",
            "@size": "97569",
            "@ref": "gr5",
            "@mimetype": "image/jpeg"
          },
          {
            "@category": "high",
            "@height": "1206",
            "@width": "750",
            "@_fa": "true",
            "$": "https://api.elsevier.com/content/object/eid/1-s2.0-S0926860X20305421-gr6_lrg.jpg?httpAccept=%2A%2F%2A",
            "@multimediatype": "JPEG image file",
            "@type": "IMAGE-HIGH-RES",
            "@size": "107792",
            "@ref": "gr6",
            "@mimetype": "image/jpeg"
          },
          {
            "@category": "high",
            "@height": "1140",
            "@width": "1667",
            "@_fa": "true",
            "$": "https://api.elsevier.com/content/object/eid/1-s2.0-S0926860X20305421-sc1_lrg.jpg?httpAccept=%2A%2F%2A",
            "@multimediatype": "JPEG image file",
            "@type": "IMAGE-HIGH-RES",
            "@size": "202288",
            "@ref": "sc1",
            "@mimetype": "image/jpeg"
          },
          {
            "@category": "high",
            "@height": "1114",
            "@width": "2167",
            "@_fa": "true",
            "$": "https://api.elsevier.com/content/object/eid/1-s2.0-S0926860X20305421-sc2_lrg.jpg?httpAccept=%2A%2F%2A",
            "@multimediatype": "JPEG image file",
            "@type": "IMAGE-HIGH-RES",
            "@size": "261223",
            "@ref": "sc2",
            "@mimetype": "image/jpeg"
          },
          {
            "@category": "standard",
            "@_fa": "true",
            "$": "https://api.elsevier.com/content/object/eid/1-s2.0-S0926860X20305421-mmc1.pdf?httpAccept=%2A%2F%2A",
            "@multimediatype": "Acrobat PDF file",
            "@type": "APPLICATION",
            "@size": "946980",
            "@ref": "mmc1",
            "@mimetype": "application/pdf"
          },
          {
            "@category": "standard",
            "@_fa": "true",
            "$": "https://api.elsevier.com/content/object/eid/1-s2.0-S0926860X20305421-am.pdf?httpAccept=%2A%2F%2A",
            "@multimediatype": "Acrobat PDF file",
            "@type": "AAM-PDF",
            "@size": "719117",
            "@ref": "am",
            "@mimetype": "application/pdf"
          }
        ]
      },
      "link": {
        "@rel": "abstract",
        "@href": "https://api.elsevier.com/content/abstract/scopus_id/85098546115"
      }
    }
  }
}