{
  "metadata": {
    "title": "Influence of attrition milling on V/Ti catalysts for the selective oxidation of ammonia",
    "authors": "; ; ",
    "journal": "Applied Catalysis A: General",
    "date": "2015-09-25",
    "doi": "10.1016/j.apcata.2015.02.007",
    "abstract": "",
    "uri": "https://api.elsevier.com/content/article/pii/S0926860X15000794",
    "pii": "S0926860X15000794"
  },
  "fulltext": {
    "full-text-retrieval-response": {
      "scopus-eid": "2-s2.0-84944442223",
      "originalText": "serial JL 271346 291210 291744 291809 31 Applied Catalysis A: General APPLIEDCATALYSISAGENERAL 2015-02-13 2015-02-13 2015-11-10 2015-11-10 2017-01-12T09:23:15 1-s2.0-S0926860X15000794 S0926-860X(15)00079-4 S0926860X15000794 10.1016/j.apcata.2015.02.007 S300 S300.4 FULL-TEXT 1-s2.0-S0926860X15X00147 2025-07-16T14:33:53.326206Z 0 0 20150925 2015 2015-02-13T21:42:46.038962Z absattachment articleinfo articletitlenorm authfirstinitialnorm authfirstsurnamenorm cid cids contenttype copyright crossmark dateloaded dateloadedtxt datesearch datesort dateupdated dco docsubtype doctype doi eid ewtransactionid hubeid indexeddate issn issnnorm itemstage itemtransactionid itemweight openaccess openarchive pg pgfirst pglast pii piinorm pubdatestart pubdatetxt pubyr sectiontitle sortorder srctitle srctitlenorm srctype ssids alllist content subj subheadings suppl tomb volfirst volissue volumelist webpdf webpdfpagecount yearnav figure table body mmlmath affil articletitle auth authfirstini authfull authkeywords authlast highlightsabst primabst ref specialabst 0926-860X 0926860X true 505 505 C Volume 505 67 557 565 557 565 20150925 25 September 2015 2015-09-25 2015 Articles article fla Copyright © 2015 Elsevier B.V. All rights reserved. INFLUENCEATTRITIONMILLINGVTICATALYSTSFORSELECTIVEOXIDATIONAMMONIA KWON D 1 Introduction 2 Experiments 2.1 Preparation of catalysts 2.2 Catalyst characterization 2.3 Catalyst activity measurement 3 Results and discussion 3.1 SCO activity of catalysts prepared using different attrition milling times 3.2 BET surface area, XRD, and TEM analysis 3.3 Temperature programmed desorption (NH3-TPD) study 3.4 XPS study 3.5 H2-TPR study 4 Conclusions References HONG 2010 371 381 S ZHANG 2009 18 25 L LIPPITS 2008 446 452 M OLOFSSON 2004 4113 4123 G LEE 2003 1115 1122 J LIETTI 2000 187 195 L GANG 1999 100 109 L CHMIELARZ 2005 235 244 L AMORES 1997 45 58 J YUAN 2011 21218 21229 R DUEHANSEN 2009 803 806 J PANAGIOTOPOULOU 2004 327 336 P KIM 2012 100 107 S KIM 2012 100 108 S POURGHAHRAMANI 2008 9 21 P WANG 2014 13369 13374 K SHAN 2014 778 786 J JIANG 2014 307 312 S ZENG 2013 12830 12837 J KWON 2013 227 235 D ARFAOUI 2009 234 238 J KOBAYASHI 2005 173 179 M BOSCH 1988 369 379 H DUTTA 2003 868 877 H COSTE 2007 489 492 S JENTOFT 1997 167 182 F BUSCA 1998 1 36 G MARSHNEVA 1995 171 183 V WANG 2013 153 166 Z SHAN 2012 100 106 W DUPIN 2000 1319 1324 J FANG 2007 8952 8961 J WU 2008 2217 2220 Z LAPINA 1999 7599 7606 O SHUBIN 1999 3138 3144 A DALLACQUA 1998 1441 1446 L GIAKOUMELOU 2006 1 12 I MARTRA 2000 197 207 G KUSTROWSKI 2006 307 313 P KANERVO 2003 171 180 J PENA 2001 155 164 M BERNDT 2000 384 400 H DU 2008 74 90 G KWONX2015X557 KWONX2015X557X565 KWONX2015X557XD KWONX2015X557X565XD 2017-11-10T00:00:00Z http://creativecommons.org/licenses/by-nc-nd/4.0/ item S0926-860X(15)00079-4 S0926860X15000794 1-s2.0-S0926860X15000794 10.1016/j.apcata.2015.02.007 271346 2024-01-01T12:30:29.635264Z 2015-09-25 1-s2.0-S0926860X15000794-main.pdf https://s3-eu-west-1.amazonaws.com/prod-ucs-content-store-eu-west/content/pii:S0926860X15000794/MAIN/application/pdf/534abbc88e9ade9746078a40a2941a3a/main.pdf https://s3.amazonaws.com/prod-ucs-content-store-us-east/content/pii:S0926860X15000794/MAIN/application/pdf/534abbc88e9ade9746078a40a2941a3a/main.pdf main.pdf pdf true 3342493 MAIN 9 1-s2.0-S0926860X15000794-main_1.png https://s3-eu-west-1.amazonaws.com/prod-ucs-content-store-eu-west/content/pii:S0926860X15000794/PREVIEW/image/png/8c6ea6c32e826516edba710fcdaa95a2/main_1.png https://s3.amazonaws.com/prod-ucs-content-store-us-east/content/pii:S0926860X15000794/PREVIEW/image/png/8c6ea6c32e826516edba710fcdaa95a2/main_1.png main_1.png png 51982 849 656 IMAGE-WEB-PDF 1 1-s2.0-S0926860X15000794-fx1.sml https://s3-eu-west-1.amazonaws.com/prod-ucs-content-store-eu-west/content/pii:S0926860X15000794/fx1/THUMBNAIL/image/gif/eaa511f9d285d9ba27f5edd89b3ce683/fx1.sml https://s3.amazonaws.com/prod-ucs-content-store-us-east/content/pii:S0926860X15000794/fx1/THUMBNAIL/image/gif/eaa511f9d285d9ba27f5edd89b3ce683/fx1.sml fx1 true fx1.sml sml 6092 88 219 IMAGE-THUMBNAIL 1-s2.0-S0926860X15000794-gr1.sml https://s3-eu-west-1.amazonaws.com/prod-ucs-content-store-eu-west/content/pii:S0926860X15000794/gr1/THUMBNAIL/image/gif/28edfe12c5a253824adbec8f75373375/gr1.sml https://s3.amazonaws.com/prod-ucs-content-store-us-east/content/pii:S0926860X15000794/gr1/THUMBNAIL/image/gif/28edfe12c5a253824adbec8f75373375/gr1.sml gr1 gr1.sml sml 15762 164 106 IMAGE-THUMBNAIL 1-s2.0-S0926860X15000794-gr10.sml https://s3-eu-west-1.amazonaws.com/prod-ucs-content-store-eu-west/content/pii:S0926860X15000794/gr10/THUMBNAIL/image/gif/0ceb337c6728bf69abd1bdb0327aa357/gr10.sml https://s3.amazonaws.com/prod-ucs-content-store-us-east/content/pii:S0926860X15000794/gr10/THUMBNAIL/image/gif/0ceb337c6728bf69abd1bdb0327aa357/gr10.sml gr10 gr10.sml sml 20445 164 120 IMAGE-THUMBNAIL 1-s2.0-S0926860X15000794-gr11.sml https://s3-eu-west-1.amazonaws.com/prod-ucs-content-store-eu-west/content/pii:S0926860X15000794/gr11/THUMBNAIL/image/gif/0ad87429000f9ded41dcdb8aa196108c/gr11.sml https://s3.amazonaws.com/prod-ucs-content-store-us-east/content/pii:S0926860X15000794/gr11/THUMBNAIL/image/gif/0ad87429000f9ded41dcdb8aa196108c/gr11.sml gr11 gr11.sml sml 20393 164 123 IMAGE-THUMBNAIL 1-s2.0-S0926860X15000794-gr12.sml https://s3-eu-west-1.amazonaws.com/prod-ucs-content-store-eu-west/content/pii:S0926860X15000794/gr12/THUMBNAIL/image/gif/46173f7d2ad999a239cc754e11704d07/gr12.sml https://s3.amazonaws.com/prod-ucs-content-store-us-east/content/pii:S0926860X15000794/gr12/THUMBNAIL/image/gif/46173f7d2ad999a239cc754e11704d07/gr12.sml gr12 gr12.sml sml 16487 152 219 IMAGE-THUMBNAIL 1-s2.0-S0926860X15000794-gr13.sml https://s3-eu-west-1.amazonaws.com/prod-ucs-content-store-eu-west/content/pii:S0926860X15000794/gr13/THUMBNAIL/image/gif/bc543190b18d3a6be23425ef1476a45a/gr13.sml https://s3.amazonaws.com/prod-ucs-content-store-us-east/content/pii:S0926860X15000794/gr13/THUMBNAIL/image/gif/bc543190b18d3a6be23425ef1476a45a/gr13.sml gr13 gr13.sml sml 14715 164 214 IMAGE-THUMBNAIL 1-s2.0-S0926860X15000794-gr14.sml https://s3-eu-west-1.amazonaws.com/prod-ucs-content-store-eu-west/content/pii:S0926860X15000794/gr14/THUMBNAIL/image/gif/f6c81453f0c66168db9cab5eefe7ba14/gr14.sml https://s3.amazonaws.com/prod-ucs-content-store-us-east/content/pii:S0926860X15000794/gr14/THUMBNAIL/image/gif/f6c81453f0c66168db9cab5eefe7ba14/gr14.sml gr14 gr14.sml sml 18836 164 209 IMAGE-THUMBNAIL 1-s2.0-S0926860X15000794-gr2.sml https://s3-eu-west-1.amazonaws.com/prod-ucs-content-store-eu-west/content/pii:S0926860X15000794/gr2/THUMBNAIL/image/gif/ea9246139990696c00203bd71ace9fea/gr2.sml https://s3.amazonaws.com/prod-ucs-content-store-us-east/content/pii:S0926860X15000794/gr2/THUMBNAIL/image/gif/ea9246139990696c00203bd71ace9fea/gr2.sml gr2 gr2.sml sml 15708 164 106 IMAGE-THUMBNAIL 1-s2.0-S0926860X15000794-gr3.sml https://s3-eu-west-1.amazonaws.com/prod-ucs-content-store-eu-west/content/pii:S0926860X15000794/gr3/THUMBNAIL/image/gif/d49e230d346bab29e884ce2487a14e51/gr3.sml https://s3.amazonaws.com/prod-ucs-content-store-us-east/content/pii:S0926860X15000794/gr3/THUMBNAIL/image/gif/d49e230d346bab29e884ce2487a14e51/gr3.sml gr3 gr3.sml sml 13637 152 219 IMAGE-THUMBNAIL 1-s2.0-S0926860X15000794-gr4.sml https://s3-eu-west-1.amazonaws.com/prod-ucs-content-store-eu-west/content/pii:S0926860X15000794/gr4/THUMBNAIL/image/gif/e20f6161877ec14d3043f11803bfb77d/gr4.sml https://s3.amazonaws.com/prod-ucs-content-store-us-east/content/pii:S0926860X15000794/gr4/THUMBNAIL/image/gif/e20f6161877ec14d3043f11803bfb77d/gr4.sml gr4 gr4.sml sml 14018 163 115 IMAGE-THUMBNAIL 1-s2.0-S0926860X15000794-gr5.sml https://s3-eu-west-1.amazonaws.com/prod-ucs-content-store-eu-west/content/pii:S0926860X15000794/gr5/THUMBNAIL/image/gif/f63884654bdc9b605d4fa2abf5e62eca/gr5.sml https://s3.amazonaws.com/prod-ucs-content-store-us-east/content/pii:S0926860X15000794/gr5/THUMBNAIL/image/gif/f63884654bdc9b605d4fa2abf5e62eca/gr5.sml gr5 gr5.sml sml 23624 164 215 IMAGE-THUMBNAIL 1-s2.0-S0926860X15000794-gr6.sml https://s3-eu-west-1.amazonaws.com/prod-ucs-content-store-eu-west/content/pii:S0926860X15000794/gr6/THUMBNAIL/image/gif/248b6828c2d6af836626dc1e1e39f60b/gr6.sml https://s3.amazonaws.com/prod-ucs-content-store-us-east/content/pii:S0926860X15000794/gr6/THUMBNAIL/image/gif/248b6828c2d6af836626dc1e1e39f60b/gr6.sml gr6 gr6.sml sml 10040 164 213 IMAGE-THUMBNAIL 1-s2.0-S0926860X15000794-gr7.sml https://s3-eu-west-1.amazonaws.com/prod-ucs-content-store-eu-west/content/pii:S0926860X15000794/gr7/THUMBNAIL/image/gif/ef4c0d797a6bbcab2b03ac08c5933dc4/gr7.sml https://s3.amazonaws.com/prod-ucs-content-store-us-east/content/pii:S0926860X15000794/gr7/THUMBNAIL/image/gif/ef4c0d797a6bbcab2b03ac08c5933dc4/gr7.sml gr7 gr7.sml sml 15869 152 219 IMAGE-THUMBNAIL 1-s2.0-S0926860X15000794-gr8.sml https://s3-eu-west-1.amazonaws.com/prod-ucs-content-store-eu-west/content/pii:S0926860X15000794/gr8/THUMBNAIL/image/gif/47a42b16260f0daf159e2bfa9fec89bf/gr8.sml https://s3.amazonaws.com/prod-ucs-content-store-us-east/content/pii:S0926860X15000794/gr8/THUMBNAIL/image/gif/47a42b16260f0daf159e2bfa9fec89bf/gr8.sml gr8 gr8.sml sml 22414 163 108 IMAGE-THUMBNAIL 1-s2.0-S0926860X15000794-gr9.sml https://s3-eu-west-1.amazonaws.com/prod-ucs-content-store-eu-west/content/pii:S0926860X15000794/gr9/THUMBNAIL/image/gif/4c104028360b3a7708cdd42af6727c2e/gr9.sml https://s3.amazonaws.com/prod-ucs-content-store-us-east/content/pii:S0926860X15000794/gr9/THUMBNAIL/image/gif/4c104028360b3a7708cdd42af6727c2e/gr9.sml gr9 gr9.sml sml 16012 164 211 IMAGE-THUMBNAIL 1-s2.0-S0926860X15000794-fx1.jpg https://s3-eu-west-1.amazonaws.com/prod-ucs-content-store-eu-west/content/pii:S0926860X15000794/fx1/DOWNSAMPLED/image/jpeg/6f92b4222c1e87b9fe71a511c69e0abe/fx1.jpg https://s3.amazonaws.com/prod-ucs-content-store-us-east/content/pii:S0926860X15000794/fx1/DOWNSAMPLED/image/jpeg/6f92b4222c1e87b9fe71a511c69e0abe/fx1.jpg fx1 true fx1.jpg jpg 27559 200 500 IMAGE-DOWNSAMPLED 1-s2.0-S0926860X15000794-gr1.jpg https://s3-eu-west-1.amazonaws.com/prod-ucs-content-store-eu-west/content/pii:S0926860X15000794/gr1/DOWNSAMPLED/image/jpeg/58c9e3916275b69925a59ecb0ba09bed/gr1.jpg https://s3.amazonaws.com/prod-ucs-content-store-us-east/content/pii:S0926860X15000794/gr1/DOWNSAMPLED/image/jpeg/58c9e3916275b69925a59ecb0ba09bed/gr1.jpg gr1 gr1.jpg jpg 93125 581 376 IMAGE-DOWNSAMPLED 1-s2.0-S0926860X15000794-gr10.jpg https://s3-eu-west-1.amazonaws.com/prod-ucs-content-store-eu-west/content/pii:S0926860X15000794/gr10/DOWNSAMPLED/image/jpeg/07920dde023838361177e4d2c4487ba9/gr10.jpg https://s3.amazonaws.com/prod-ucs-content-store-us-east/content/pii:S0926860X15000794/gr10/DOWNSAMPLED/image/jpeg/07920dde023838361177e4d2c4487ba9/gr10.jpg gr10 gr10.jpg jpg 94852 514 376 IMAGE-DOWNSAMPLED 1-s2.0-S0926860X15000794-gr11.jpg https://s3-eu-west-1.amazonaws.com/prod-ucs-content-store-eu-west/content/pii:S0926860X15000794/gr11/DOWNSAMPLED/image/jpeg/baaeb7e5d5ce7e379402dccdab408be8/gr11.jpg https://s3.amazonaws.com/prod-ucs-content-store-us-east/content/pii:S0926860X15000794/gr11/DOWNSAMPLED/image/jpeg/baaeb7e5d5ce7e379402dccdab408be8/gr11.jpg gr11 gr11.jpg jpg 91475 501 376 IMAGE-DOWNSAMPLED 1-s2.0-S0926860X15000794-gr12.jpg https://s3-eu-west-1.amazonaws.com/prod-ucs-content-store-eu-west/content/pii:S0926860X15000794/gr12/DOWNSAMPLED/image/jpeg/7a905dde5ae89f142579049d57d56070/gr12.jpg https://s3.amazonaws.com/prod-ucs-content-store-us-east/content/pii:S0926860X15000794/gr12/DOWNSAMPLED/image/jpeg/7a905dde5ae89f142579049d57d56070/gr12.jpg gr12 gr12.jpg jpg 44375 272 393 IMAGE-DOWNSAMPLED 1-s2.0-S0926860X15000794-gr13.jpg https://s3-eu-west-1.amazonaws.com/prod-ucs-content-store-eu-west/content/pii:S0926860X15000794/gr13/DOWNSAMPLED/image/jpeg/5538e80d478e7d22de465755f3fe445b/gr13.jpg https://s3.amazonaws.com/prod-ucs-content-store-us-east/content/pii:S0926860X15000794/gr13/DOWNSAMPLED/image/jpeg/5538e80d478e7d22de465755f3fe445b/gr13.jpg gr13 gr13.jpg jpg 39903 301 393 IMAGE-DOWNSAMPLED 1-s2.0-S0926860X15000794-gr14.jpg https://s3-eu-west-1.amazonaws.com/prod-ucs-content-store-eu-west/content/pii:S0926860X15000794/gr14/DOWNSAMPLED/image/jpeg/9e3b2368dd9dc14f4ce8746c30a27e92/gr14.jpg https://s3.amazonaws.com/prod-ucs-content-store-us-east/content/pii:S0926860X15000794/gr14/DOWNSAMPLED/image/jpeg/9e3b2368dd9dc14f4ce8746c30a27e92/gr14.jpg gr14 gr14.jpg jpg 53270 295 376 IMAGE-DOWNSAMPLED 1-s2.0-S0926860X15000794-gr2.jpg https://s3-eu-west-1.amazonaws.com/prod-ucs-content-store-eu-west/content/pii:S0926860X15000794/gr2/DOWNSAMPLED/image/jpeg/0171607dd1b9fb5df4a00ae845d08ea3/gr2.jpg https://s3.amazonaws.com/prod-ucs-content-store-us-east/content/pii:S0926860X15000794/gr2/DOWNSAMPLED/image/jpeg/0171607dd1b9fb5df4a00ae845d08ea3/gr2.jpg gr2 gr2.jpg jpg 91910 581 376 IMAGE-DOWNSAMPLED 1-s2.0-S0926860X15000794-gr3.jpg https://s3-eu-west-1.amazonaws.com/prod-ucs-content-store-eu-west/content/pii:S0926860X15000794/gr3/DOWNSAMPLED/image/jpeg/44332d1919edc87b21515acb2d4a08c4/gr3.jpg https://s3.amazonaws.com/prod-ucs-content-store-us-east/content/pii:S0926860X15000794/gr3/DOWNSAMPLED/image/jpeg/44332d1919edc87b21515acb2d4a08c4/gr3.jpg gr3 gr3.jpg jpg 40870 272 393 IMAGE-DOWNSAMPLED 1-s2.0-S0926860X15000794-gr4.jpg https://s3-eu-west-1.amazonaws.com/prod-ucs-content-store-eu-west/content/pii:S0926860X15000794/gr4/DOWNSAMPLED/image/jpeg/efe13314c2c1a71b8a71f0ea3a84a2f0/gr4.jpg https://s3.amazonaws.com/prod-ucs-content-store-us-east/content/pii:S0926860X15000794/gr4/DOWNSAMPLED/image/jpeg/efe13314c2c1a71b8a71f0ea3a84a2f0/gr4.jpg gr4 gr4.jpg jpg 70071 534 376 IMAGE-DOWNSAMPLED 1-s2.0-S0926860X15000794-gr5.jpg https://s3-eu-west-1.amazonaws.com/prod-ucs-content-store-eu-west/content/pii:S0926860X15000794/gr5/DOWNSAMPLED/image/jpeg/87f19339a1333e23a3dab2a49c293bf2/gr5.jpg https://s3.amazonaws.com/prod-ucs-content-store-us-east/content/pii:S0926860X15000794/gr5/DOWNSAMPLED/image/jpeg/87f19339a1333e23a3dab2a49c293bf2/gr5.jpg gr5 gr5.jpg jpg 76976 287 376 IMAGE-DOWNSAMPLED 1-s2.0-S0926860X15000794-gr6.jpg https://s3-eu-west-1.amazonaws.com/prod-ucs-content-store-eu-west/content/pii:S0926860X15000794/gr6/DOWNSAMPLED/image/jpeg/14dcaf0f7d59f32a1a5dbe3fe688f84e/gr6.jpg https://s3.amazonaws.com/prod-ucs-content-store-us-east/content/pii:S0926860X15000794/gr6/DOWNSAMPLED/image/jpeg/14dcaf0f7d59f32a1a5dbe3fe688f84e/gr6.jpg gr6 gr6.jpg jpg 30672 290 376 IMAGE-DOWNSAMPLED 1-s2.0-S0926860X15000794-gr7.jpg https://s3-eu-west-1.amazonaws.com/prod-ucs-content-store-eu-west/content/pii:S0926860X15000794/gr7/DOWNSAMPLED/image/jpeg/2702153bc2eec5b95afdc982760fafe2/gr7.jpg https://s3.amazonaws.com/prod-ucs-content-store-us-east/content/pii:S0926860X15000794/gr7/DOWNSAMPLED/image/jpeg/2702153bc2eec5b95afdc982760fafe2/gr7.jpg gr7 gr7.jpg jpg 42696 272 393 IMAGE-DOWNSAMPLED 1-s2.0-S0926860X15000794-gr8.jpg https://s3-eu-west-1.amazonaws.com/prod-ucs-content-store-eu-west/content/pii:S0926860X15000794/gr8/DOWNSAMPLED/image/jpeg/94f1d2a6a888b738b30ce68f6987bdef/gr8.jpg https://s3.amazonaws.com/prod-ucs-content-store-us-east/content/pii:S0926860X15000794/gr8/DOWNSAMPLED/image/jpeg/94f1d2a6a888b738b30ce68f6987bdef/gr8.jpg gr8 gr8.jpg jpg 165803 854 565 IMAGE-DOWNSAMPLED 1-s2.0-S0926860X15000794-gr9.jpg https://s3-eu-west-1.amazonaws.com/prod-ucs-content-store-eu-west/content/pii:S0926860X15000794/gr9/DOWNSAMPLED/image/jpeg/63eabc82ec2fe3a912ee084d65437a98/gr9.jpg https://s3.amazonaws.com/prod-ucs-content-store-us-east/content/pii:S0926860X15000794/gr9/DOWNSAMPLED/image/jpeg/63eabc82ec2fe3a912ee084d65437a98/gr9.jpg gr9 gr9.jpg jpg 49045 291 376 IMAGE-DOWNSAMPLED 1-s2.0-S0926860X15000794-fx1_lrg.jpg https://s3-eu-west-1.amazonaws.com/prod-ucs-content-store-eu-west/content/pii:S0926860X15000794/fx1/HIGHRES/image/jpeg/e077c515725ec04ff0b76fa9365ab3d5/fx1_lrg.jpg https://s3.amazonaws.com/prod-ucs-content-store-us-east/content/pii:S0926860X15000794/fx1/HIGHRES/image/jpeg/e077c515725ec04ff0b76fa9365ab3d5/fx1_lrg.jpg fx1 true fx1_lrg.jpg jpg 184192 886 2213 IMAGE-HIGH-RES 1-s2.0-S0926860X15000794-gr1_lrg.jpg https://s3-eu-west-1.amazonaws.com/prod-ucs-content-store-eu-west/content/pii:S0926860X15000794/gr1/HIGHRES/image/jpeg/5f599cb31f80780ccf05d334d619c7b6/gr1_lrg.jpg https://s3.amazonaws.com/prod-ucs-content-store-us-east/content/pii:S0926860X15000794/gr1/HIGHRES/image/jpeg/5f599cb31f80780ccf05d334d619c7b6/gr1_lrg.jpg gr1 gr1_lrg.jpg jpg 537743 2577 1667 IMAGE-HIGH-RES 1-s2.0-S0926860X15000794-gr10_lrg.jpg https://s3-eu-west-1.amazonaws.com/prod-ucs-content-store-eu-west/content/pii:S0926860X15000794/gr10/HIGHRES/image/jpeg/e271db66399a2ed753be4fe13b7976a3/gr10_lrg.jpg https://s3.amazonaws.com/prod-ucs-content-store-us-east/content/pii:S0926860X15000794/gr10/HIGHRES/image/jpeg/e271db66399a2ed753be4fe13b7976a3/gr10_lrg.jpg gr10 gr10_lrg.jpg jpg 547749 2278 1667 IMAGE-HIGH-RES 1-s2.0-S0926860X15000794-gr11_lrg.jpg https://s3-eu-west-1.amazonaws.com/prod-ucs-content-store-eu-west/content/pii:S0926860X15000794/gr11/HIGHRES/image/jpeg/273df92043d2e5df90c57aeaf71ff64c/gr11_lrg.jpg https://s3.amazonaws.com/prod-ucs-content-store-us-east/content/pii:S0926860X15000794/gr11/HIGHRES/image/jpeg/273df92043d2e5df90c57aeaf71ff64c/gr11_lrg.jpg gr11 gr11_lrg.jpg jpg 487586 2223 1667 IMAGE-HIGH-RES 1-s2.0-S0926860X15000794-gr12_lrg.jpg https://s3-eu-west-1.amazonaws.com/prod-ucs-content-store-eu-west/content/pii:S0926860X15000794/gr12/HIGHRES/image/jpeg/73063405a9def0a06fdf2fb2991434e5/gr12_lrg.jpg https://s3.amazonaws.com/prod-ucs-content-store-us-east/content/pii:S0926860X15000794/gr12/HIGHRES/image/jpeg/73063405a9def0a06fdf2fb2991434e5/gr12_lrg.jpg gr12 gr12_lrg.jpg jpg 200353 1208 1743 IMAGE-HIGH-RES 1-s2.0-S0926860X15000794-gr13_lrg.jpg https://s3-eu-west-1.amazonaws.com/prod-ucs-content-store-eu-west/content/pii:S0926860X15000794/gr13/HIGHRES/image/jpeg/421fba1050e948e7eae0872b672c130e/gr13_lrg.jpg https://s3.amazonaws.com/prod-ucs-content-store-us-east/content/pii:S0926860X15000794/gr13/HIGHRES/image/jpeg/421fba1050e948e7eae0872b672c130e/gr13_lrg.jpg gr13 gr13_lrg.jpg jpg 157885 1333 1743 IMAGE-HIGH-RES 1-s2.0-S0926860X15000794-gr14_lrg.jpg https://s3-eu-west-1.amazonaws.com/prod-ucs-content-store-eu-west/content/pii:S0926860X15000794/gr14/HIGHRES/image/jpeg/53f764378bd642a93d6993186b560579/gr14_lrg.jpg https://s3.amazonaws.com/prod-ucs-content-store-us-east/content/pii:S0926860X15000794/gr14/HIGHRES/image/jpeg/53f764378bd642a93d6993186b560579/gr14_lrg.jpg gr14 gr14_lrg.jpg jpg 225736 1306 1667 IMAGE-HIGH-RES 1-s2.0-S0926860X15000794-gr2_lrg.jpg https://s3-eu-west-1.amazonaws.com/prod-ucs-content-store-eu-west/content/pii:S0926860X15000794/gr2/HIGHRES/image/jpeg/31e7e1619b6ea7b6fad77daed5a1a432/gr2_lrg.jpg https://s3.amazonaws.com/prod-ucs-content-store-us-east/content/pii:S0926860X15000794/gr2/HIGHRES/image/jpeg/31e7e1619b6ea7b6fad77daed5a1a432/gr2_lrg.jpg gr2 gr2_lrg.jpg jpg 545572 2577 1667 IMAGE-HIGH-RES 1-s2.0-S0926860X15000794-gr3_lrg.jpg https://s3-eu-west-1.amazonaws.com/prod-ucs-content-store-eu-west/content/pii:S0926860X15000794/gr3/HIGHRES/image/jpeg/0f2200f2f533aafab49177b7af4a1732/gr3_lrg.jpg https://s3.amazonaws.com/prod-ucs-content-store-us-east/content/pii:S0926860X15000794/gr3/HIGHRES/image/jpeg/0f2200f2f533aafab49177b7af4a1732/gr3_lrg.jpg gr3 gr3_lrg.jpg jpg 195461 1208 1743 IMAGE-HIGH-RES 1-s2.0-S0926860X15000794-gr4_lrg.jpg https://s3-eu-west-1.amazonaws.com/prod-ucs-content-store-eu-west/content/pii:S0926860X15000794/gr4/HIGHRES/image/jpeg/ca7d2fc1f994aa65eba9d0220bd62eeb/gr4_lrg.jpg https://s3.amazonaws.com/prod-ucs-content-store-us-east/content/pii:S0926860X15000794/gr4/HIGHRES/image/jpeg/ca7d2fc1f994aa65eba9d0220bd62eeb/gr4_lrg.jpg gr4 gr4_lrg.jpg jpg 394192 2368 1667 IMAGE-HIGH-RES 1-s2.0-S0926860X15000794-gr5_lrg.jpg https://s3-eu-west-1.amazonaws.com/prod-ucs-content-store-eu-west/content/pii:S0926860X15000794/gr5/HIGHRES/image/jpeg/57e0910712fd0623667219f86a6d5fb7/gr5_lrg.jpg https://s3.amazonaws.com/prod-ucs-content-store-us-east/content/pii:S0926860X15000794/gr5/HIGHRES/image/jpeg/57e0910712fd0623667219f86a6d5fb7/gr5_lrg.jpg gr5 gr5_lrg.jpg jpg 434093 1271 1667 IMAGE-HIGH-RES 1-s2.0-S0926860X15000794-gr6_lrg.jpg https://s3-eu-west-1.amazonaws.com/prod-ucs-content-store-eu-west/content/pii:S0926860X15000794/gr6/HIGHRES/image/jpeg/9a46b31360c120c1e79eaa31a91f04b8/gr6_lrg.jpg https://s3.amazonaws.com/prod-ucs-content-store-us-east/content/pii:S0926860X15000794/gr6/HIGHRES/image/jpeg/9a46b31360c120c1e79eaa31a91f04b8/gr6_lrg.jpg gr6 gr6_lrg.jpg jpg 127246 1285 1667 IMAGE-HIGH-RES 1-s2.0-S0926860X15000794-gr7_lrg.jpg https://s3-eu-west-1.amazonaws.com/prod-ucs-content-store-eu-west/content/pii:S0926860X15000794/gr7/HIGHRES/image/jpeg/83fba54f732285e95a22606806b5084c/gr7_lrg.jpg https://s3.amazonaws.com/prod-ucs-content-store-us-east/content/pii:S0926860X15000794/gr7/HIGHRES/image/jpeg/83fba54f732285e95a22606806b5084c/gr7_lrg.jpg gr7 gr7_lrg.jpg jpg 180289 1208 1743 IMAGE-HIGH-RES 1-s2.0-S0926860X15000794-gr8_lrg.jpg https://s3-eu-west-1.amazonaws.com/prod-ucs-content-store-eu-west/content/pii:S0926860X15000794/gr8/HIGHRES/image/jpeg/6a649b76ff9431194a2130131e37aa2c/gr8_lrg.jpg https://s3.amazonaws.com/prod-ucs-content-store-us-east/content/pii:S0926860X15000794/gr8/HIGHRES/image/jpeg/6a649b76ff9431194a2130131e37aa2c/gr8_lrg.jpg gr8 gr8_lrg.jpg jpg 1668386 3778 2500 IMAGE-HIGH-RES 1-s2.0-S0926860X15000794-gr9_lrg.jpg https://s3-eu-west-1.amazonaws.com/prod-ucs-content-store-eu-west/content/pii:S0926860X15000794/gr9/HIGHRES/image/jpeg/88ae886e66c1c88acfe86964452dc8db/gr9_lrg.jpg https://s3.amazonaws.com/prod-ucs-content-store-us-east/content/pii:S0926860X15000794/gr9/HIGHRES/image/jpeg/88ae886e66c1c88acfe86964452dc8db/gr9_lrg.jpg gr9 gr9_lrg.jpg jpg 237016 1292 1667 IMAGE-HIGH-RES 1-s2.0-S0926860X15000794-si1.gif https://s3-eu-west-1.amazonaws.com/prod-ucs-content-store-eu-west/content/pii:S0926860X15000794/STRIPIN/image/gif/67ce620b0775c90c4683e53821caf7bf/si1.gif https://s3.amazonaws.com/prod-ucs-content-store-us-east/content/pii:S0926860X15000794/STRIPIN/image/gif/67ce620b0775c90c4683e53821caf7bf/si1.gif si1 si1.gif gif 490 32 70 ALTIMG 1-s2.0-S0926860X15000794-si2.gif https://s3-eu-west-1.amazonaws.com/prod-ucs-content-store-eu-west/content/pii:S0926860X15000794/STRIPIN/image/gif/1db596155c1b7b33c1a58a07f2f460aa/si2.gif https://s3.amazonaws.com/prod-ucs-content-store-us-east/content/pii:S0926860X15000794/STRIPIN/image/gif/1db596155c1b7b33c1a58a07f2f460aa/si2.gif si2 si2.gif gif 1849 36 400 ALTIMG 1-s2.0-S0926860X15000794-si3.gif https://s3-eu-west-1.amazonaws.com/prod-ucs-content-store-eu-west/content/pii:S0926860X15000794/STRIPIN/image/gif/21e068f11362271371f610ea7f1d986c/si3.gif https://s3.amazonaws.com/prod-ucs-content-store-us-east/content/pii:S0926860X15000794/STRIPIN/image/gif/21e068f11362271371f610ea7f1d986c/si3.gif si3 si3.gif gif 2414 87 403 ALTIMG 1-s2.0-S0926860X15000794-si4.gif https://s3-eu-west-1.amazonaws.com/prod-ucs-content-store-eu-west/content/pii:S0926860X15000794/STRIPIN/image/gif/16a6f7ce09b3365b64c40f322b4fe66b/si4.gif https://s3.amazonaws.com/prod-ucs-content-store-us-east/content/pii:S0926860X15000794/STRIPIN/image/gif/16a6f7ce09b3365b64c40f322b4fe66b/si4.gif si4 si4.gif gif 476 32 87 ALTIMG 1-s2.0-S0926860X15000794-si5.gif https://s3-eu-west-1.amazonaws.com/prod-ucs-content-store-eu-west/content/pii:S0926860X15000794/STRIPIN/image/gif/caa6db16177af0cc464a0ee29ae9b62f/si5.gif https://s3.amazonaws.com/prod-ucs-content-store-us-east/content/pii:S0926860X15000794/STRIPIN/image/gif/caa6db16177af0cc464a0ee29ae9b62f/si5.gif si5 si5.gif gif 191 16 29 ALTIMG 1-s2.0-S0926860X15000794-si6.gif https://s3-eu-west-1.amazonaws.com/prod-ucs-content-store-eu-west/content/pii:S0926860X15000794/STRIPIN/image/gif/c694638ea1a5f4cbd51101382c9cef98/si6.gif https://s3.amazonaws.com/prod-ucs-content-store-us-east/content/pii:S0926860X15000794/STRIPIN/image/gif/c694638ea1a5f4cbd51101382c9cef98/si6.gif si6 si6.gif gif 173 16 19 ALTIMG 1-s2.0-S0926860X15000794-si7.gif https://s3-eu-west-1.amazonaws.com/prod-ucs-content-store-eu-west/content/pii:S0926860X15000794/STRIPIN/image/gif/1e38cb27569e47f22ac41baae761bca6/si7.gif https://s3.amazonaws.com/prod-ucs-content-store-us-east/content/pii:S0926860X15000794/STRIPIN/image/gif/1e38cb27569e47f22ac41baae761bca6/si7.gif si7 si7.gif gif 530 17 131 ALTIMG APCATA 15244 S0926-860X(15)00079-4 10.1016/j.apcata.2015.02.007 Elsevier B.V. Fig. 1 Effects of NH3 oxidation activities over VTi-Mixed, VTi-A.Mx, and VTi-Imp: (a) NH3 removal efficiency, (b) N2 yield (inlet NH3: 850ppm, O2: 3%, H2O: 6%, GHSV: 60,000h−1). Fig. 2 Effects of NH3 oxidation activities over xVTi-A.M3 and xVTi-Imp: (a) NH3 removal efficiency, (b) N2 yield (inlet NH3: 850ppm, O2: 3%, H2O: 6%, GHSV: 60,000h−1). Fig. 3 Effects of attrition milling time on conversion over V/Ti catalyst at 250°C (inlet NH3: 850ppm, O2: 3%, H2O: 6%, GHSV: 60,000h−1). Fig. 4 BJH pore size distributions of the TiO2 and V/Ti catalysts: (a) TiO2, (b) VTi-Mixed, (c) VTi-Imp, (d) VTi-A.M1, (e) VTi-A.M3, (f) VTi-A.M10. Fig. 5 XRD patterns of V/Ti catalysts: (a) VTi-Imp, (b) VTi-Mixed, (c) VTi-A.M1, (d) VTi-A.M3, (e) VTi-A.M10. Fig. 6 The effect of TiO2 crystallite size on N2 yield over V/Ti catalyst at 250°C (inlet NH3: 850ppm, O2: 3%, H2O: 6%, GHSV: 60,000h−1). Fig. 7 The effect of BET surface area on N2 yield and reaction rate over V/Ti catalyst at 250°C (inlet NH3: 850ppm, O2: 3%, H2O: 6%, GHSV: 60,000h−1). Fig. 8 TEM image of V/Ti catalysts: (a) VTi-Mixed, (b) VTi-Imp, (c) VTi-A.M1, (d) VTi-A.M3, (e) VTi-A.M10. Fig. 9 NH3-TPD spectrum of V/Ti catalysts: (a) VTi-Mixed, (b) VTi-Imp, (c) VTi-A.M1, (d) VTi-A.M3, (e) VTi-A.M10. Fig. 10 O 1s spectra of V/Ti catalysts by XPS analysis: (a) VTi-Mixed, (b) VTi-Imp, (c) VTi-A.M1, (d) VTi-A.M3, (e) VTi-A.M10. Fig. 11 V 2p spectra of V/Ti catalysts by XPS analysis: (a) VTi-Mixed, (b) VTi-Imp, (c) VTi-A.M1, (d) VTi-A.M3, (e) VTi-A.M10. Fig. 12 Correlation of the V5+ vanadium species ratio with N2 yield and reaction rate over V/Ti catalysts at 250°C (inlet NH3: 850ppm, O2: 3%, H2O: 6%, GHSV: 60,000h−1). Fig. 13 The effect of temperature on NO to N2 conversion of VTi-A.M3 and VTi-A.M10 (inlet NO: 800ppm, NH3/NO: 1.0, O2: 3%, H2O: 6%, GHSV: 60,000h−1). Fig. 14 H2-TPR profiles of V/Ti catalysts prepared by different methods. Experimental conditions: 300mg cat, pretreatment at 400°C for 30min with 5% O2/Ar 50cm3/min, 10% H2/Ar 50cm3/min reduction with heating rate 10°C/min, total flow rate 50cm3/min. Table 1 Surface area, physical properties, and crystallite size of TiO2. Sample Total pore volume (p/p 0 =0.990) (cm3 g−1) Average pore diameter (nm) S BET (m2/g) Crystallite size of TiO2 (101) (nm) TiO2 0.40 21 76 26 VTi-Mixed 0.37 18 84 22 VTi-A.M1 0.28 16 72 17 VTi-A.M3 0.14 16 43 16 VTi-A.M10 0.12 15 32 13 VTi-Imp 0.37 19 80 21 Table 2 Total acidity determined by NH3-TPD and valence states of V in V/Ti catalysts. Catalyst NH3-TPD total acidity (mmol/m2) V4+ +V3+ peak area ratio (by XPS analysis) VTi-Mixed 0.392 0 VTi-Imp 0.567 1.00 VTi-A.M1 0.566 1.38 VTi-A.M3 0.780 1.68 VTi-A.M10 0.609 1.75 Influence of attrition milling on V/Ti catalysts for the selective oxidation of ammonia Dong Wook Kwon Sang Moon Lee Sung Chang Hong ⁎ Department of Environmental Energy Systems Engineering, Graduate School of Kyonggi University, 94-6 San, Iui-dong, Youngtong-ku, Suwon-si, Gyeonggi-do, 443-760, Republic of Korea Department of Environmental Energy Systems Engineering, Graduate School of Kyonggi University 94-6 San, Iui-dong, Youngtong-ku, Suwon-si, Gyeonggi-do 443-760 Republic of Korea ⁎ Corresponding author. Tel.: +82 31 249 9733; fax: +82 31 254 4905. Graphical abstract Mechanochemical treatments can change the physicochemical characteristics of catalysts. Attrition milling was utilized in the preparation of catalysts from V2O5 and anatase TiO2, and the catalysts were applied for the study of selective catalytic oxidation (SCO). Catalysts comprising 2wt% V/Ti were prepared by mechanochemical methods using different milling times, and these catalysts were used for the SCO of NH3 to N2. The optimal calcination milling time was 3h. The 2wt% V/Ti catalyst prepared by attrition milling for 3h (VTi-A.M3; where A.M in the catalyst name denotes attrition milling, and 3 is the milling time applied) gave rise to the highest N2 yield (∼82%) at 250°C. The dry attrition milling method is a dry method for the synthesis of the SCO catalyst, involving a combination of V2O5 and TiO2 powder. The properties of the catalyst were studied using physiochemical analyses, including BET surface area, X-ray diffraction (XRD), transmission electron microscopy (TEM), NH3 temperature programmed desorption (NH3-TPD), X-ray photoelectron spectroscopy (XPS), and H2 temperature programmed reduction (H2-TPR). Anatase, which is a metastable phase, underwent transformation into TiO2(II) due to the milling effect. The highest N2 yield was achieved when the TiO2 crystallite size of the catalyst was 16nm. The content of pentavalent vanadium species increased due to the milling effect. A correlation was identified between the V5+ species and the catalyst N2 yield. VTi-A.M3 was found to lead to high-level selective catalytic oxidation of NH3, with active internal selective catalytic reduction (SCR) because of the presence of highly dispersed V5+ on the catalyst surface. The dry attrition milling method can be used to control the dispersion of vanadium on the catalyst surface, which can in turn improve the N2 yield activity by increasing the ratio of V5+ species. Keywords Vanadium/titania SCO Ammonia oxidation Dry milling Attrition milling 1 Introduction With the recent development of industrial technologies, increased atmospheric pollution has become a global social problem. Among the pollutants, NH3 emissions are generated from various chemical facilities, livestock operations, sewage treatment plants, and selective catalytic reduction (SCR). Certain techniques for removing NH3 have been developed such as adsorption, chemical treatment, catalytic decomposition, and selective catalytic oxidation (SCO). Techniques for removing NH3 via SCO using catalysts that convert NH3 into N2 are particularly attractive. In recent years, many studies have been carried out on SCO, and noble metal-based catalysts such as RuO2 [1], Ag/Al2O3 [2], Au/CeO2/Al2O3 [3], and Pt/CuO/Al2O3 [4] have been widely studied. These catalysts exhibit excellent performance for ammonia removal at 250°C. However, the cost of such systems is generally high, and the converted NH3 is oxidized into NO x (NO, NO2, and N2O), thereby posing the problem of generation of secondary pollutants. Studies on SCO reaction using metal oxide catalysts, such as MnO2 [5], MoO3 [6], CuO [7], Fe2O3 [8], and CoO3 [9], have reported high SCO activity at 400°C or higher; however, the catalytic activity of these metal oxides declines at lower temperatures. The V2O5-based catalyst, which is widely used in the SCR process, has also been applied to the conversion of NH3 into N2 [10]. The equation for the conversion of NH3 into N2 in the presence of oxygen can be expressed as follows: (1) NH3 →NH3 + +e− (2) NH3 + +O2 →NH3O2 (3) NH3O2 →H2NO2 +H+ (4) H2NO2 +H+ →H2NO2H+ (5) H2NO2H+ →HNOOH+H+ (6) HNOOH→NO+H2O (7) 4NO+4NH3 +O2 (internal SCR)→4N2 +6H2O The SCO reaction with V2O5-based catalysts is possible. However, because the reaction occurs at 400°C or higher and conversion of NH3 to NO x is likely [11], it is difficult to apply this reaction in practice. The development of a system with excellent NH3 removal efficiency at temperatures below 300°C, similar to noble metal catalysts that react at low temperature (at 250°C), and that concomitantly exhibits excellent N2 selectivity is thus required. Attempts have been made to increase the activity of catalysts by adjusting the primary crystallite size of the catalyst. Panagiotopoulou et al. [12] reported that the activity of Pt/TiO2 catalysts with various properties, applied to the water gas shift (WGS) reaction, was affected by the primary crystallite size of TiO2. Kim et al. [13,14] demonstrated that the primary crystallite size of the catalyst, determined via XRD analysis, was a major factor influencing the catalyst activity. With a smaller primary crystallite size, the turnover frequencies (TOFs) increased. Pourghahramani et al. [15] reported that as the primary crystallite size decreased, the density of hydroxyl groups increased as a result of the application of hematite in the milling process. Additionally, focus was placed on the effects of milling on the activity of catalysts used for oxidation–dehydrogenation [16,17] in hydrogen storage systems and the dehydration on mesoporous silica [18,19] in proton exchange membrane fuel cells (PEMFCs). Herein, we evaluate non-noble metal-based catalysts for achieving excellent NH3 removal efficiency and N2 selectivity at temperatures below 300°C. A mechanochemical method is utilized to adjust the primary crystallite size of the V2O5/TiO2 catalyst prepared by an attrition milling process via combination of V2O5 powder and anatase TiO2 powder under dry conditions. The dry attrition milling method is utilized to enhance the oxidative properties of the catalyst and promote the NH3 removal efficiency at low temperatures, i.e., below 300°C. Furthermore, the milling time is controlled to increase the N2 selectivity in the SCO reaction. Analyses of the physicochemical characteristics of the catalysts are performed to examine the changes in the characteristics of the catalysts based on milling time using XRD, TEM, BET, NH3-TPD, and XPS analyses. 2 Experiments 2.1 Preparation of catalysts VTi-Mixed catalysts were prepared by mortar mixing of V2O5 (Aldrich Chemical Co.), based on 2wt% vanadium, and anatase TiO2 powder (Millennium Chemical Co.). The mixture was calcined in air for 4h at 400°C [20]. VTi-A.M catalysts were prepared by dry attrition milling (where A.M in the catalyst name denotes attrition milling). Anatase TiO2 powder and V2O5 powder, based on 1–4wt% vanadium, were placed in the attrition milling equipment with a zirconium ball (5mm in diameter). Here, the ball-to-powder mass ratio (BPMR) was 50:1, the milling speed was 500rpm, and the samples were milled for 1, 2, 3, 5, or 10h. The mixture was calcined in air for 4h at 400°C. “VTi-A.M” refers to all catalysts prepared by dry attrition milling, and the number at the end of “VTi-A.Mx” is the milling time applied. The initial number in “yVTi A.M” indicates the vanadium content (wt%). When the initial number (y) is omitted, the vanadium content is 2wt%. VTi-Imp catalysts were prepared by a wet impregnation process using ammonium metavanadate (NH4VO3, Aldrich Chemical Co.), based on 1–4wt% vanadium, and anatase TiO2 powder. The calculated amount of NH4VO3 was dissolved in distilled water and heated to 60°C. Because the solubility of NH4VO3 is very low, small volumes of oxalic acid ((COOH)2, Aldrich Chemical Co.) were added slowly to the ammonium vanadium aqueous solution while stirring until pH 2.5 was reached. The calculated amount of TiO2 was added to the solution. The mixture was agitated in the slurry state for over 1h, the moisture was then evaporated at 70°C using a rotary vacuum evaporator, and the mixture was dried overnight at 110°C. Subsequently, the mixture was calcined in air for 4h at 400°C [20]. 2.2 Catalyst characterization The structure of the catalysts was examined by X-ray diffraction (PANalytical X’Pert Pro MPD diffractometer) using Cu Kα radiation. Diffraction peaks, which were recorded in the 2θ range of 10–80° (4°/min), were used to identify the structure of the sample. The primary crystallite size of TiO2 was calculated using the Scherrer equation: (8) d = 0.9 λ B cos θ where λ is the X-ray wavelength corresponding to Cu Kα radiation, B is the broadening of the anatase (101) reflection, and θ is the angle of diffraction corresponding to the peak broadening. The surface areas of the samples were measured by physical nitrogen adsorption at −196°C (Micrometrics, ASAP 2010). The specific surface area was analyzed using the Brunauer–Emmett–Teller (BET) model, and the average pore size was analyzed by using the Barrett–Joyner–Halenda (BJH) model. Prior to measurements, the catalysts (300mg) were degassed at 300°C for 2h. Field-emission transmission electron microscopy (FE-TEM) images were recorded with a JEM-2100F (JEOL) microscope, operated at an acceleration voltage of 200keV. Samples for FE-TEM measurements were prepared by suspending an ultrasonically treated catalyst powder sample in ethanol and placing a drop of the suspension onto a Cu grid. NH3 temperature programmed desorption (TPD) measurements were carried out with 300mg of the sample at a total flow rate of 50 cc/min. Prior to TPD measurements, the catalyst was pretreated in a flow of 5% O2/Ar at 400°C for 0.5h, followed by cooling to 50°C. The samples were then treated with 1% NH3/Ar for 1h. Surface NH3 was removed by sparging with Ar for 1h before starting the TPD experiments. During the TPD experiments, NH3 (m/z 15) was monitored continuously using a quadrupole mass spectrometer (QMS 422) while increasing the temperature to 600°C at a rate of 10°C/min. X-ray photoelectron spectroscopy (XPS) analysis was performed using an ESCALAB 210 (VG Scientific) instrument, and monochromated Al Kα (1486.6eV) was used as an excitation source. After complete removal of moisture contained in the samples by drying at around 100°C for 24h, the samples were analyzed without surface sputtering and etching to maintain the vacuum pressure of the XPS equipment at 10−6 Pa. The binding energy and intensity of V 2p, Ti 2p, O 1s, and C 1s in the specimens were analyzed based on a wide scanning spectrum. Sample charge effects were eliminated by correcting the observed spectra using the C 1s binding energy (BE) value of 284.6eV. The temperature programmed reduction (TPR) of H2 was measured using 10% H2/Ar and 300mg of the catalyst at a total flow rate of 50cm3/min. Prior to H2-TPR measurements, the catalyst was pretreated in a flow of 5% O2/Ar at 400°C for 0.5h, followed by cooling to 50°C. The catalyst was placed in dilute hydrogen, and the consumption of hydrogen was monitored with an Autochem 2920 (Micrometrics) instrument while increasing the temperature to 600°C at a rate of 10°C/min. 2.3 Catalyst activity measurement Measurements of the SCO activity were carried out in a fixed-bed quartz reactor (i.d.: 8mm, height: 650mm). The amount of gas supplied to the reactor was regulated using a mass flow controller (Mass Flow Controller, MKS Co.) with individual cylinders of Ar, O2, and NH3. The reaction conditions were as follows: 850ppm NH3, 3vol% O2, 6vol% H2O, balance Ar, and 600mL/min total flow rate. Water was supplied to the reactor in conjunction with Ar injection through a bubbler. The concentration of NO was measured using a non-dispersive infrared absorption (NDIR) gas analyzer (ZKJ-2; Fuji Electric Co., Ltd., Japan); N2O was measured using an Ultramat 6 (Siemens Co.) instrument before the gases were allowed to flow into the analyzers, and the NO2 (9L: NO2) and ammonia concentrations (3M, 3La, 3L: NH3) were measured using a detector tube (GASTEC Co., Japan). Moisture was removed by a moisture trap inside the chiller. All data were collected at 60min (steady state) at the selected temperature. From the concentration of the gases at steady state, the conversion and N2 yield were calculated according to the following equations: (9) NH 3 removal efficicency ( % ) = [ NH 3 ] in − [ NH 3 ] out [ NH 3 ] in × 100 (10) N 2 yield ( % ) = [ NH 3 ] in − [ NH 3 ] out − [ NO ] out − [ NO 2 ] out − 2 [ N 2 O ] out [ NH 3 ] in × 100 In addition, reaction rates were calculated using the following expression: (11) r = X × F NH 3 W where r is the reaction rate of NH3 (μmol/s/g cat), F NH 3 is the total flow rate (μmol/s), W is the mass of catalyst (g), and X is the N2 yield of NH3, respectively. 3 Results and discussion 3.1 SCO activity of catalysts prepared using different attrition milling times The NH3 removal efficiency and N2 yield achieved with VTi-A.Mx prepared by attrition milling based on different times, mortar-mixed VTi-Mixed, and VTi-Imp, prepared by a wet impregnation method, were evaluated. As shown in Fig. 1(a), the NH3 removal efficiency achieved with the VTi-Mixed catalyst was very low at a space velocity of 60,000h−1. The catalysts could be ranked in the following order based on the NH3 removal efficiency at 250°C: VTi-A.M10>VTi-A.M5>VTi-A.M3>VTi-A.M2>VTi-A.M1>VTi-Imp>VTi-Mixed. However, as shown in Fig. 1(b), based on the N2 yield at 250°C, the order was: VTi-A.M3>VTi-A.M5>VTi-A.M10>VTi-A.M2>VTi-A.M1>VTi-Imp>VTi-Mixed. Thus, the SCO reaction activity of the catalysts prepared by attrition milling was superior to that of the catalysts prepared by mortar mixing and the wet impregnation method. The NH3 removal efficiency and N2 yield of the xVTi-A.M3 samples with different vanadium loadings prepared by attrition milling was also compared. As shown in Fig. 2(a), the NH3 removal efficiency increased until the amount of vanadium reached 4wt% in xVTi-A.My and xVTi-Imp catalysts, at a space velocity of 60,000h−1. xVTi-Imp indicates a low NH3 removal efficiency compared to the xVTi-A.M3 at the same vanadium loading. On the other hand, as shown in Fig. 2(b), the catalysts could be ranked in the following order based on the N2 yield at 250°C: 2VTi-A.M3>3VTi-A.M3>4VTi-A.M3>1VTi-A.M3>4VTi-Imp≈3VTi-Imp>2VTi-Imp>1VTi-Imp. The catalyst prepared by attrition milling with a vanadium loading of 2wt% gave rise to the highest N2 yield at 250–300°C. Fig. 3 shows the NH3 removal efficiency and N2 yield obtained with the catalysts prepared using various milling times at 250°C. The NH3 removal efficiency achieved with the catalysts increased with increasing attrition milling time. However, the highest N2 yield of 82% was obtained with the catalyst milled for 3h; the N2 yield decreased when the milling time was further increased. Thus, the optimal milling time for maximizing the N2 yield was determined to be 3h. 3.2 BET surface area, XRD, and TEM analysis Generally, the reactivity of a catalyst is determined by the surface properties of the catalyst. The mechanochemical treatment is a milling process/method that changes the characteristics of the catalyst. This method is in fact used to prepare nanocrystalline materials, and reportedly has a significant impact on the structure and reactivity due to high energy transfer to the material [21–24]. Table 1 shows the total pore volume, average pore diameter, surface area, and the crystallite size of TiO2 in the VTi-Mixed, VTi-A.Mx, and VTi-Imp samples. The total pore volume and average pore diameter of VTi-A.Mx generally declined due to the attrition milling effect. Fig. 4 shows the BJH pore size distributions of TiO2, VTi-Mixed, VTi-A.Mx, and VTi-Imp. The pore size distributions of TiO2, VTi-Mixed, and VTi-Imp were centered around 10nm. In the case of VTi-A.M1 where milling was applied, the pore size distribution was centered around 10–15nm. No prominent peaks were found in the pore size distributions of VTi-A.M3 and VTi-A.M10. The structural characteristics of the catalysts were analyzed by means of XRD. Fig. 5 shows the XRD patterns of VTi-Imp, VTi-Mixed, and VTi-A.Mx. The intensity of the anatase (101) peak was clearly reduced with increased milling time (standard material was catalyst mixed with YSZ (111) at 10wt%). Due to occurrence of phase transition in the case of VTi-A.M1, a peak corresponding to TiO2(II) was observed. Coste et al. [25] noted that anatase had a tendency to undergo transition to TiO2(II) and rutile, which are more stable towards external stimuli, because anatase is a metastable phase. V2O5 peaks (20.3, 26.1°) were observed in the XRD pattern of VTi-Mixed due to incomplete reaction of the V2O5 powder and TiO2. However, because no V2O5 peak was observed for the sample subjected to 1h of milling, it was deduced that V2O5 on the surface of the catalyst was dispersed on TiO2. The crystallite size of TiO2 (101) was calculated from the XRD data (Table 1), and indicated a clear reduction with increased milling time. Fig. 6 shows the relationship between the N2 yield and the size of the TiO2 crystallites in the V/Ti catalysts. The size of the TiO2 crystallites in the VTi-Mixed sample was 22nm. As the crystallite size was gradually reduced, the N2 yield increased. The maximal activity in terms of N2 yield was achieved with the V/Ti catalyst having an optimal TiO2 crystallite size of 16nm. The N2 yield tended to decrease when the TiO2 crystallite size was smaller than 16nm. In addition, the surface area clearly tended to decline with the attrition milling effect. The relationship between the NH3 removal efficiency and N2 yield versus the surface area is shown in Fig. 7 . The NH3 removal efficiency increased with a decrease of the surface area. The N2 yield gradually increased with a decrease of the surface area, but tended to decrease when the surface area was less than 43m2/g. The reaction rate showed the excellent value of 1.14μmol/s/g in the surface area of 43m2/g, and gradually decreased when the surface area was more than 43m2/g. Generally, because the particle size decreases in conjunction with the reduction of the crystallite size due to milling, the surface area also increases [15]. However, the crystallite size and the surface area of VTi-A.Mx were concomitantly reduced with increased milling time. As documented by Jentoft et al. [26], anatase TiO2 undergoes phase transition and the surface area is reduced with increased milling time. Thus, it is proposed that the crystallite size and surface area were reduced in this study as a result of the phase transition from anatase to TiO2(II). High-energy milling induced changes in the physical characteristics of the catalyst, such as the surface area and crystallite size of TiO2 (101), due to disruption of anatase TiO2. TEM images of VTi-Mixed, VTi-Imp, VTi-A.M1, VTi-A.M3, and VTi-A.M10 are presented in Fig. 8(a–e). The morphology of these oxides seems to be configured by a stack of spherical particles. TEM analysis shows that the particle size of VTi-Mixed and VTi-Imp was similar. The particle size declined gradually with increasing milling time. From the TEM analysis, the catalysts could be ranked in the following order based on the particle size: VTi-Mixed≈VTi-Imp>VTi-A.M1>VTi-A.M3>VTi-A.M1. This tendency was consistent with the evaluation (Table 1) of the crystallite size of TiO2 (101). 3.3 Temperature programmed desorption (NH3-TPD) study The first step in performing the SCO reaction involves adsorption of atmospheric NH3 on the acid sites of the catalyst surface. The adsorption amount and adsorption pattern of NH3 are considered to be important. To investigate the variation in the strength of the acidic sites and the properties of NH3 adsorption on the catalysts with attrition milling time, NH3 temperature-programmed desorption experiments were performed using mass spectrometry. NH3 was monitored at m/z =15 during the NH3 TPD experiments. The results of the NH3-TPD analyses using VTi-Mixed, VTi-Imp, and VTi-A.Mx are shown in Fig. 9 . The profiles for all of the catalysts contained two broad NH3 desorption peaks at 80–200 and 230–400°C, attributed to the Brönsted and Lewis acid sites, respectively. It is known that ammonia adsorbed on Brönsted acid sites is desorbed at lower temperatures than that on Lewis acid sites [9,27]. For V2O5/TiO2 catalysts, ammonia is reportedly desorbed from the Brönsted acid sites with an activation energy of 12–14kcal/mol and from the Lewis acid sites with an activation energy of 24–27kcal/mol [28]. The present NH3-TPD analysis shows that the NH3 desorption peak was the largest in the temperature range of 80–400°C for the sample prepared using an attrition milling time of 3h. It appears that milling induced an increase in the number of Brönsted and Lewis acid sites on the catalyst surface with the use of a milling time of up to 3h. The total acidity (mmol/m2) was calculated from the desorption peak to compare the amount of NH3 adsorbed on the acid sites of the catalysts; the results are shown in Table 2 . From these results, the VTi-A.M3 catalyst had the highest acidity, indicating that vanadium was dispersed on the catalyst surface by milling. Kwon et al. [20] reported an increase in the V/Ti ratio of the catalyst surface due to milling, which means that the acid sites increase as vanadium becomes more highly dispersed on the catalyst surface due to attrition milling. Wang et al. [29] demonstrated that a high intensity peak is generated in the NH3-TPD profile of finely dispersed metal oxide species on the catalyst surface, and that the finely dispersed metal oxide species are the main sites of adsorption of NH3 molecules. The amount of ammonia adsorbed is related to the active sites exposed on the surface and the surface area of the catalyst. Although, the areas of the desorption peaks for the VTi-Imp and VTi-A.M1 catalysts were calculated to be similar, the VTi-A.M1 catalyst had better SCO reactivity than the VTi-Imp catalyst. An increase in the area of the desorption peak had a positive effect on the SCO reaction, but was not directly correlated with the N2 yield. 3.4 XPS study X-ray photoelectron spectroscopy (XPS) analysis was performed to investigate the correlation between the SCO activity and the valence state characteristics of the V2O5/TiO2 catalysts. The binding energies of atoms have distinct values, and the valence states of atoms such as V, Ti, O, and C can be determined from the binding energy peaks in the range of 0–1480eV. Representative peaks of the atoms were detected using a narrow scan and the peaks were analyzed to determine the characteristics of each atom. Fig. 10 shows the deconvoluted O 1s spectra of the VTi-Mixed, VTi-Imp, VTi-A.M1, VTi-A.M3, and VTi-A.M10 catalysts. The O 1s peak was fitted into sub-bands by searching for the optimum combination of Gaussian bands. The sub-bands at 529.5–530.0eV are attributable to lattice O2− oxygen (expressed as Oβ) [30]. The two bands at 531.0–531.6eV and 532.8–533.0eV are respectively assigned to surface-adsorbed oxygen (Oα), such as O2 2− and O−, associated with chemisorbed water (expressed as O ′ α ) [31,32]. The percentage of Oα species increased with application of attrition milling. The VTi-Mixed (26.8%) sample had the lowest Oα ratio, and increasingly higher ratios were observed for VTi-Imp (33.6%), VTi-A.M1 (40.4%), VTi-A.M3 (45.3%), and VTi-A.M10 (48.4%). Wu et al. [33] reported that surface-chemisorbed oxygen (Oα) is the most active oxygen species, and is highly active in the oxidation reaction due to its higher mobility. Thus, the increase in surface chemisorbed oxygen (Oα) was closely associated with NH3 oxidation, and was consistent with the NH3 removal efficiency of the catalysts presented in Fig. 1(a). Thus, the increase in the O α / ( O α + O ′ α + O β ) ratio was correlated to the increase in NH3 oxidation in the SCO reaction, but was not associated with the N2 yield. Fig. 11 shows the deconvoluted V 2p spectra for the VTi-Mixed, VTi-Imp, VTi-A.M1, VTi-A.M3, and VTi-A.M10 catalysts. From the V 2p peak of the VTi-Mixed catalyst, vanadium apparently existed only in the V5+ state. However, vanadium was present in the VTi-Imp and VTi-AM catalysts as V5+, V4 +, and V3+. As shown in Table 2, the peak area ratio of V5+ in the V/Ti catalyst varied based on the milling time. The highest V5+ peak area ratio was observed for VTi-A.M3. High-energy impact was generated in the course of catalyst preparation by the dry attrition milling method. Thus, the increase in V5+ species on the catalyst surface indicates that V2O5 is highly dispersed by milling. In the case of VTi-A.M10, fewer V5+ vanadium species were present relative to that in VTi-A.M3. It is proposed that there was a change in the valence state of vanadium from V5+ to V4+ or V3+ induced by high-energy milling. The (V4+ +V3+) peak area ratio of the V/Ti catalysts determined by XPS is shown in Table 2. The content of V4+ and V3+ species (from V2O5/TiO2) on the catalyst surface increased due to mechanochemical milling [34–36]. The reduction in the valence state of the vanadium species plausibly occurs by excision of the oxygen bond due to V2O5 and TiO2 disruption by the attrition milling effect. The correlation between V5+ on the catalyst surface and the SCO activity was evaluated based on the N2 yield and reaction rate as shown in Fig. 12 . The higher the content of V5+ vanadium species on the catalyst surface, the higher the N2 yield and reaction rate. According to Yuan et al. [10], the presence of oxygen in V2O5 (010) promotes the internal SCR reaction due to oxidation of NH3 to NO via SCO mechanisms. In the case of VTi-A.M3, the observed excellent selective catalytic oxidation of NH3 was attributed to active internal SCR reaction given that V5+ species are highly dispersed on the catalyst surface. Operation of the internal SCR effect was investigated for VTi-A.M3 and VTi-A.M10, which show excellent activity in terms of the NH3 removal efficiency and N2 yield in the SCO reaction. As shown in Fig. 13 , NO to N2 conversion was observed with VTi-A.M3 and VTi-A.M10 at 200–300°C (GHSV=60,000h−1). The VTi-A.M10 catalyst exhibited extremely low SCR activity where NH3 used as the reductant in the SCR reaction was oxidized to NO x . Furthermore, VTi-A.M3 exhibited superior SCR activity relative to VTi-A.M10, which implies that the SCR reaction of NO+NH3 +O2 proceeds on the catalyst surface. Therefore, VTi-A.M3 exhibited excellent activity for the SCO reaction as indicated by the internal SCR reaction effect. Thus, the dry attrition milling method can be used to control the dispersion of vanadium on the surface, thereby improving the N2 yield and reaction rate by increasing the content of V5+ species. Additionally, the increased ratio of V5+ was the rate-determining parameter in the selective oxidation reaction of ammonia. 3.5 H2-TPR study H2-TPR experiments were performed to investigate the oxidation state of vanadium oxides and the reducibility of the catalysts. Fig. 14 shows the H2-TPR profile of the TiO2 and V/Ti catalysts. The maximum temperature of hydrogen consumption (T max) of TiO2 was 512.10°C. The peak temperature of hydrogen consumption for VTi-Mixed was 504.68°C, which is slightly lower than that of TiO2. The vanadium species of VTi-Mixed are present in the V5+ state based on the XPS results. Although the peak area corresponding to V5+ species in the XPS profiles was rather small, the occurrence of T max at high temperature was attributed to the observation of the original peak of V2O5 or TiO2 due to imperfect union of V2O5 and TiO2. This peak may be a low intensity reduction peak for conversion of Ti4+ to Ti3+ in TiO2 after bulk V2O5 on the surface had been reduced by hydrogen. In previous studies reported in the literature, the high-temperature reduction peak is generally attributed to the reduction of vanadium in polymeric and bulk-like V2O5 species [37–40]. The T max occurred at 376.88, 388.28, 417.12, and 413.25°C, respectively, with VTi-Imp, VTi-A.M1, VTi-A.M3, and VTi-A.M10. Comparison of the reduction properties of the V/Ti catalyst and pure TiO2 shows a shift of the reduction temperature of the V/Ti catalyst to lower temperature, plausibly due to the interaction between V2O5 and TiO2. The T max of the V/Ti catalysts appeared at high temperature, consistent with the order of the V5+ peak area from XPS analysis as follows: (V5+ peak area ratio by XPS analysis): VTi-A.M3 (1.17)>VTi-A.M10 (1.09)>VTi-A.M1 (1.05)>VTi-Imp (1.00). In addition, the low temperature reduction peak has been shown to represent monomeric species or highly dispersed vanadium species [41–43]. The observed decrease in T max (from H2-TPR analysis) with increasing attrition milling time is attributed to transformation of the crystallite V2O5 species into monomeric species during ball milling due to the interaction between V2O5 and TiO2. In the case of VTi-A.M1 and VTi-A.M3, H2 consumption occurred at a relatively lower temperature due to the increase in the content of V4+ and V3+ species. Furthermore, H2 consumption was detected at 100–280°C with the use of VTi-A.M10, which is possibly caused by phase transition of anatase type TiO2 to TiO2(II). Due to this phenomenon, excellent oxidation efficiency was achieved at low temperature. The V/Ti catalysts can be ranked as follows based on H2 consumption: VTi-A.M3 (847μmol/g)>VTi-A.M10 (758μmol/g)>VTi-A.M1 (486μmol/g)>VTi-Imp (481μmol/g)>VTi-Mixed (441μmol/g). The VTi-A.M3 catalyst gave rise to an excellent N2 yield with the highest value of 847μmol/g. In contrast, the lowest H2 consumption of 441μmol/g was observed with the VTi-Mixed catalyst. For this reason, oxygen release from VTi-Mixed was more difficult. In brief, the interaction between V2O5 and TiO2 has a significant influence on the catalyst reducibility, and the catalyst reducibility largely depends on the attrition milling time. The VTi-A.M3 catalysts possessed many surface oxygen species combined with vanadium species. The results revealed that high oxygen mobility was an important factor in the SCO reaction. 4 Conclusions Metal oxide catalysts generally exhibit adequate NH3 removal efficiency at temperatures higher than 400°C. Herein, the dry attrition milling method was applied to enhance catalytic oxidation, and excellent NH3 removal efficiency was achieved at 250°C. By controlling the milling time, the N2 selectivity of the catalysts in the SCO reaction was enhanced. An excellent SCO catalyst with an N2 yield of 82% at 250°C was developed. From evaluation of the effects of the crystalline structure and valence state of vanadium in the catalysts prepared by the dry attrition milling method on the SCO reaction, the ensuing deductions could be made. Unlike the VTi-Mixed catalyst, no V2O5 peak was observed in the XRD analysis of the VTi-A.M catalyst processed using attrition milling. Phase transition from anatase TiO2 to TiO2(II) was observed with increased milling time, and the crystallite size of TiO2 (101) decreased. The highest N2 yield was achieved with the catalyst having a TiO2 crystallite size of 16nm. Based on NH3-TPD analysis, the VTi-A.M3 catalyst had the highest acidity. XPS analysis demonstrated an increase of the surface-adsorbed oxygen species and V5+ vanadium species, and the presence of reduced vanadium species, due to attrition milling. The increase in the content of V5+ species and the N2 yield are directly related. The increased content of V5+ species was the rate-determining parameter in the selective oxidation reaction of ammonia. Accordingly, dry attrition milling can be applied as a dry synthesis method for the preparation of SCO catalysts using V2O5 and TiO2 in the powder phase. References [1] S. Hong A. Karim T.S. Rahman K. Jacobi G. Ertl J. Catal. 276 2010 371 381 [2] L. Zhang H. He J. Catal. 268 2009 18 25 [3] M.J. Lippits A.C. Gluhoi B.E. Nieuwenhuys Catal. Today 137 2008 446 452 [4] G. Olofsson A. Hinz A. Andersson Chem. Eng. Sci. 59 2004 4113 4123 [5] J.Y. Lee S.B. Kim S.C. Hong Chemosphere 50 2003 1115 1122 [6] L. Lietti G. Ramis G. Busca F. Bregani P. Forzatti Catal. Today 61 2000 187 195 [7] L. Gang J. van Grondelle B.G. Anderson R.A. van Santen J. Catal. 186 1999 100 109 [8] L. Chmielarz P. Kuśtrowski A. Rafalska-Łasocha R. Dziembaj Appl. Catal. B: Environ. 58 2005 235 244 [9] J.G. Amores V.S. Escribano G. Ramis G. Busca Appl. Catal. B: Environ. 13 1997 45 58 [10] R.-M. Yuan G. Fu X. Xu H.-L. Wan J. Phys. Chem. C 115 2011 21218 21229 [11] J. Due-Hansen A.L. Kustov C.H. Christensen R. Fehrmann Catal. Commun. 10 2009 803 806 [12] P. Panagiotopoulou D.I. Kondarides J. Catal. 225 2004 327 336 [13] S.S. Kim H.H. Lee S.C. Hong Appl. Catal. A: Gen. 423–424 2012 100 107 [14] S.S. Kim H.H. Lee S.C. Hong Appl. Catal. B: Environ. 119/120 2012 100 108 [15] P. Pourghahramani E. Altin M.R. Mallembakam W. Peukert E. Forssberg Powder Technol. 186 2008 9 21 [16] K. Wang X. Kang Y. Zhong C. Hu P. Wang Int. J. Hydrog. Energy 39 2014 13369 13374 [17] J. Shan P. Li Q. Wan F. Zhai J. Zhang Z. Li Z. Liu A.A. Volinsky X. Qu J. Power Sourc. 268 2014 778 786 [18] S.P. Jiang Solid State Ionics 262 2014 307 312 [19] J. Zeng B. Jin P.K. Shen B. He K. Lamb R.D. Marco S.P. Jiang Int. J. Hydrog. Energy 38 2013 12830 12837 [20] D.W. Kwon K.H. Park S.C. Hong Appl. Catal. A: Gen. 451 2013 227 235 [21] J. Arfaoui L.K. Boudali A. Ghorbel G. Delahay Catal. Today 142 2009 234 238 [22] M. Kobayashi R. Kuma S. Masaki N. Sugishima Appl. Catal. B: Environ. 60 2005 173 179 [23] H. Bosch F. Janssen Catal. Today 2 1988 369 379 [24] H. Dutta S.K. Pradhan Mater. Chem. Phys. 77 2003 868 877 [25] S. Coste G. Bertrand C. Coddet E. Gaffet H. Hahn H. Sieger J. Alloys Compd. 434–435 2007 489 492 [26] F.C. Jentoft H. Schmelz H. Knözinger Appl. Catal. A: Gen. 161 1997 167 182 [27] G. Busca L. Lietti G. Ramis F. Berti Appl. Catal. B: Environ. 18 1998 1 36 [28] V.I. Marshneva E.M. Slavinskaya O.V. Kalinkina G.V. Odegova E.M. Moroz G.V. Lavrova A.N. Salanov J. Catal. 155 1995 171 183 [29] Z. Wang Z. Qu X. Quan Z. Li H. Wang R. Fan Appl. Catal. B: Environ. 134/135 2013 153 166 [30] W. Shan F. Liu H. He X. Shi C. Zhang Appl. Catal. B: Environ. 115/116 2012 100 106 [31] J.-C. Dupin D. Gonbeau P. Vinatier A. Levasseur Phys. Chem. Chem. Phys. 2 2000 1319 1324 [32] J. Fang X. Bi D. Si Z. Jiang W. Huang Appl. Surf. Sci. 253 2007 8952 8961 [33] Z. Wu R. Jin Y. Liu H. Wang Catal. Commun. 9 2008 2217 2220 [34] O.B. Lapina A.A. Shubin A.V. Nosov J. Phys. Chem. B 103 1999 7599 7606 [35] A.A. Shubin O.B. Lapina E. Bosch J. Spengler H. Kno1zinger J. Phys. Chem. B 103 1999 3138 3144 [36] L. Dall’Acqua M. Baricco A.F. Berti L. Lietti E. Giamello J. Mater. Chem. 8 1998 1441 1446 [37] I. Giakoumelou C. Fountzoula C. Kordulis S. Boghosian J. Catal. 239 2006 1 12 [38] G. Martra F. Arena S. Coluccia F. Frusteri A. Parmaliana Catal. Today 63 2000 197 207 [39] P. Kustrowski Y. Segura L. Chmielarz J. Surman R. Dziembaj P. Cool E.F. Vansant Catal. Today 114 2006 307 313 [40] J.M. Kanervo M.E. Harlin A.O.I. Krause M.A. Banares Catal. Today 78 2003 171 180 [41] M.L. Pena A. Dejoz V. Fornes E. Rey M.I. Vazquez J.M.L. Nieto Appl. Catal. A: Gen. 209 2001 155 164 [42] H. Berndt A. Martin A. Bruckner E. Schreier D. Muller H. Kosslick G.U. Wolf B. Lucke J. Catal. 191 2000 384 400 [43] G. Du S. Lim M. Pinault C. Wang F. Fang L. Pfefferle G.L. Haller J. Catal. 253 2008 74 90",
      "scopus-id": "84944442223",
      "coredata": {
        "eid": "1-s2.0-S0926860X15000794",
        "dc:description": "Mechanochemical treatments can change the physicochemical characteristics of catalysts. Attrition milling was utilized in the preparation of catalysts from V2O5 and anatase TiO2, and the catalysts were applied for the study of selective catalytic oxidation (SCO). Catalysts comprising 2wt% V/Ti were prepared by mechanochemical methods using different milling times, and these catalysts were used for the SCO of NH3 to N2. The optimal calcination milling time was 3h. The 2wt% V/Ti catalyst prepared by attrition milling for 3h (VTi-A.M3; where A.M in the catalyst name denotes attrition milling, and 3 is the milling time applied) gave rise to the highest N2 yield (∼82%) at 250°C. The dry attrition milling method is a dry method for the synthesis of the SCO catalyst, involving a combination of V2O5 and TiO2 powder. The properties of the catalyst were studied using physiochemical analyses, including BET surface area, X-ray diffraction (XRD), transmission electron microscopy (TEM), NH3 temperature programmed desorption (NH3-TPD), X-ray photoelectron spectroscopy (XPS), and H2 temperature programmed reduction (H2-TPR). Anatase, which is a metastable phase, underwent transformation into TiO2(II) due to the milling effect. The highest N2 yield was achieved when the TiO2 crystallite size of the catalyst was 16nm. The content of pentavalent vanadium species increased due to the milling effect. A correlation was identified between the V5+ species and the catalyst N2 yield. VTi-A.M3 was found to lead to high-level selective catalytic oxidation of NH3, with active internal selective catalytic reduction (SCR) because of the presence of highly dispersed V5+ on the catalyst surface. The dry attrition milling method can be used to control the dispersion of vanadium on the catalyst surface, which can in turn improve the N2 yield activity by increasing the ratio of V5+ species.",
        "openArchiveArticle": "false",
        "prism:coverDate": "2015-09-25",
        "openaccessUserLicense": null,
        "prism:aggregationType": "Journal",
        "prism:url": "https://api.elsevier.com/content/article/pii/S0926860X15000794",
        "dc:creator": [
          {
            "@_fa": "true",
            "$": "Kwon, Dong Wook"
          },
          {
            "@_fa": "true",
            "$": "Lee, Sang Moon"
          },
          {
            "@_fa": "true",
            "$": "Hong, Sung Chang"
          }
        ],
        "link": [
          {
            "@_fa": "true",
            "@rel": "self",
            "@href": "https://api.elsevier.com/content/article/pii/S0926860X15000794"
          },
          {
            "@_fa": "true",
            "@rel": "scidir",
            "@href": "https://www.sciencedirect.com/science/article/pii/S0926860X15000794"
          }
        ],
        "dc:format": "application/json",
        "openaccessType": null,
        "pii": "S0926-860X(15)00079-4",
        "prism:volume": "505",
        "prism:publisher": "Elsevier B.V.",
        "dc:title": "Influence of attrition milling on V/Ti catalysts for the selective oxidation of ammonia",
        "prism:copyright": "Copyright © 2015 Elsevier B.V. All rights reserved.",
        "openaccess": "0",
        "prism:issn": "0926860X",
        "dcterms:subject": [
          {
            "@_fa": "true",
            "$": "Vanadium/titania"
          },
          {
            "@_fa": "true",
            "$": "SCO"
          },
          {
            "@_fa": "true",
            "$": "Ammonia oxidation"
          },
          {
            "@_fa": "true",
            "$": "Dry milling"
          },
          {
            "@_fa": "true",
            "$": "Attrition milling"
          }
        ],
        "openaccessArticle": "false",
        "prism:publicationName": "Applied Catalysis A: General",
        "openaccessSponsorType": null,
        "prism:pageRange": "557-565",
        "prism:endingPage": "565",
        "pubType": "fla",
        "prism:coverDisplayDate": "25 September 2015",
        "prism:doi": "10.1016/j.apcata.2015.02.007",
        "prism:startingPage": "557",
        "dc:identifier": "doi:10.1016/j.apcata.2015.02.007",
        "openaccessSponsorName": null
      },
      "objects": {
        "object": [
          {
            "@category": "thumbnail",
            "@height": "88",
            "@width": "219",
            "@_fa": "true",
            "$": "https://api.elsevier.com/content/object/eid/1-s2.0-S0926860X15000794-fx1.sml?httpAccept=%2A%2F%2A",
            "@multimediatype": "GIF image file",
            "@type": "IMAGE-THUMBNAIL",
            "@size": "6092",
            "@ref": "fx1",
            "@mimetype": "image/gif"
          },
          {
            "@category": "thumbnail",
            "@height": "164",
            "@width": "106",
            "@_fa": "true",
            "$": "https://api.elsevier.com/content/object/eid/1-s2.0-S0926860X15000794-gr1.sml?httpAccept=%2A%2F%2A",
            "@multimediatype": "GIF image file",
            "@type": "IMAGE-THUMBNAIL",
            "@size": "15762",
            "@ref": "gr1",
            "@mimetype": "image/gif"
          },
          {
            "@category": "thumbnail",
            "@height": "164",
            "@width": "120",
            "@_fa": "true",
            "$": "https://api.elsevier.com/content/object/eid/1-s2.0-S0926860X15000794-gr10.sml?httpAccept=%2A%2F%2A",
            "@multimediatype": "GIF image file",
            "@type": "IMAGE-THUMBNAIL",
            "@size": "20445",
            "@ref": "gr10",
            "@mimetype": "image/gif"
          },
          {
            "@category": "thumbnail",
            "@height": "164",
            "@width": "123",
            "@_fa": "true",
            "$": "https://api.elsevier.com/content/object/eid/1-s2.0-S0926860X15000794-gr11.sml?httpAccept=%2A%2F%2A",
            "@multimediatype": "GIF image file",
            "@type": "IMAGE-THUMBNAIL",
            "@size": "20393",
            "@ref": "gr11",
            "@mimetype": "image/gif"
          },
          {
            "@category": "thumbnail",
            "@height": "152",
            "@width": "219",
            "@_fa": "true",
            "$": "https://api.elsevier.com/content/object/eid/1-s2.0-S0926860X15000794-gr12.sml?httpAccept=%2A%2F%2A",
            "@multimediatype": "GIF image file",
            "@type": "IMAGE-THUMBNAIL",
            "@size": "16487",
            "@ref": "gr12",
            "@mimetype": "image/gif"
          },
          {
            "@category": "thumbnail",
            "@height": "164",
            "@width": "214",
            "@_fa": "true",
            "$": "https://api.elsevier.com/content/object/eid/1-s2.0-S0926860X15000794-gr13.sml?httpAccept=%2A%2F%2A",
            "@multimediatype": "GIF image file",
            "@type": "IMAGE-THUMBNAIL",
            "@size": "14715",
            "@ref": "gr13",
            "@mimetype": "image/gif"
          },
          {
            "@category": "thumbnail",
            "@height": "164",
            "@width": "209",
            "@_fa": "true",
            "$": "https://api.elsevier.com/content/object/eid/1-s2.0-S0926860X15000794-gr14.sml?httpAccept=%2A%2F%2A",
            "@multimediatype": "GIF image file",
            "@type": "IMAGE-THUMBNAIL",
            "@size": "18836",
            "@ref": "gr14",
            "@mimetype": "image/gif"
          },
          {
            "@category": "thumbnail",
            "@height": "164",
            "@width": "106",
            "@_fa": "true",
            "$": "https://api.elsevier.com/content/object/eid/1-s2.0-S0926860X15000794-gr2.sml?httpAccept=%2A%2F%2A",
            "@multimediatype": "GIF image file",
            "@type": "IMAGE-THUMBNAIL",
            "@size": "15708",
            "@ref": "gr2",
            "@mimetype": "image/gif"
          },
          {
            "@category": "thumbnail",
            "@height": "152",
            "@width": "219",
            "@_fa": "true",
            "$": "https://api.elsevier.com/content/object/eid/1-s2.0-S0926860X15000794-gr3.sml?httpAccept=%2A%2F%2A",
            "@multimediatype": "GIF image file",
            "@type": "IMAGE-THUMBNAIL",
            "@size": "13637",
            "@ref": "gr3",
            "@mimetype": "image/gif"
          },
          {
            "@category": "thumbnail",
            "@height": "163",
            "@width": "115",
            "@_fa": "true",
            "$": "https://api.elsevier.com/content/object/eid/1-s2.0-S0926860X15000794-gr4.sml?httpAccept=%2A%2F%2A",
            "@multimediatype": "GIF image file",
            "@type": "IMAGE-THUMBNAIL",
            "@size": "14018",
            "@ref": "gr4",
            "@mimetype": "image/gif"
          },
          {
            "@category": "thumbnail",
            "@height": "164",
            "@width": "215",
            "@_fa": "true",
            "$": "https://api.elsevier.com/content/object/eid/1-s2.0-S0926860X15000794-gr5.sml?httpAccept=%2A%2F%2A",
            "@multimediatype": "GIF image file",
            "@type": "IMAGE-THUMBNAIL",
            "@size": "23624",
            "@ref": "gr5",
            "@mimetype": "image/gif"
          },
          {
            "@category": "thumbnail",
            "@height": "164",
            "@width": "213",
            "@_fa": "true",
            "$": "https://api.elsevier.com/content/object/eid/1-s2.0-S0926860X15000794-gr6.sml?httpAccept=%2A%2F%2A",
            "@multimediatype": "GIF image file",
            "@type": "IMAGE-THUMBNAIL",
            "@size": "10040",
            "@ref": "gr6",
            "@mimetype": "image/gif"
          },
          {
            "@category": "thumbnail",
            "@height": "152",
            "@width": "219",
            "@_fa": "true",
            "$": "https://api.elsevier.com/content/object/eid/1-s2.0-S0926860X15000794-gr7.sml?httpAccept=%2A%2F%2A",
            "@multimediatype": "GIF image file",
            "@type": "IMAGE-THUMBNAIL",
            "@size": "15869",
            "@ref": "gr7",
            "@mimetype": "image/gif"
          },
          {
            "@category": "thumbnail",
            "@height": "163",
            "@width": "108",
            "@_fa": "true",
            "$": "https://api.elsevier.com/content/object/eid/1-s2.0-S0926860X15000794-gr8.sml?httpAccept=%2A%2F%2A",
            "@multimediatype": "GIF image file",
            "@type": "IMAGE-THUMBNAIL",
            "@size": "22414",
            "@ref": "gr8",
            "@mimetype": "image/gif"
          },
          {
            "@category": "thumbnail",
            "@height": "164",
            "@width": "211",
            "@_fa": "true",
            "$": "https://api.elsevier.com/content/object/eid/1-s2.0-S0926860X15000794-gr9.sml?httpAccept=%2A%2F%2A",
            "@multimediatype": "GIF image file",
            "@type": "IMAGE-THUMBNAIL",
            "@size": "16012",
            "@ref": "gr9",
            "@mimetype": "image/gif"
          },
          {
            "@category": "standard",
            "@height": "200",
            "@width": "500",
            "@_fa": "true",
            "$": "https://api.elsevier.com/content/object/eid/1-s2.0-S0926860X15000794-fx1.jpg?httpAccept=%2A%2F%2A",
            "@multimediatype": "JPEG image file",
            "@type": "IMAGE-DOWNSAMPLED",
            "@size": "27559",
            "@ref": "fx1",
            "@mimetype": "image/jpeg"
          },
          {
            "@category": "standard",
            "@height": "581",
            "@width": "376",
            "@_fa": "true",
            "$": "https://api.elsevier.com/content/object/eid/1-s2.0-S0926860X15000794-gr1.jpg?httpAccept=%2A%2F%2A",
            "@multimediatype": "JPEG image file",
            "@type": "IMAGE-DOWNSAMPLED",
            "@size": "93125",
            "@ref": "gr1",
            "@mimetype": "image/jpeg"
          },
          {
            "@category": "standard",
            "@height": "514",
            "@width": "376",
            "@_fa": "true",
            "$": "https://api.elsevier.com/content/object/eid/1-s2.0-S0926860X15000794-gr10.jpg?httpAccept=%2A%2F%2A",
            "@multimediatype": "JPEG image file",
            "@type": "IMAGE-DOWNSAMPLED",
            "@size": "94852",
            "@ref": "gr10",
            "@mimetype": "image/jpeg"
          },
          {
            "@category": "standard",
            "@height": "501",
            "@width": "376",
            "@_fa": "true",
            "$": "https://api.elsevier.com/content/object/eid/1-s2.0-S0926860X15000794-gr11.jpg?httpAccept=%2A%2F%2A",
            "@multimediatype": "JPEG image file",
            "@type": "IMAGE-DOWNSAMPLED",
            "@size": "91475",
            "@ref": "gr11",
            "@mimetype": "image/jpeg"
          },
          {
            "@category": "standard",
            "@height": "272",
            "@width": "393",
            "@_fa": "true",
            "$": "https://api.elsevier.com/content/object/eid/1-s2.0-S0926860X15000794-gr12.jpg?httpAccept=%2A%2F%2A",
            "@multimediatype": "JPEG image file",
            "@type": "IMAGE-DOWNSAMPLED",
            "@size": "44375",
            "@ref": "gr12",
            "@mimetype": "image/jpeg"
          },
          {
            "@category": "standard",
            "@height": "301",
            "@width": "393",
            "@_fa": "true",
            "$": "https://api.elsevier.com/content/object/eid/1-s2.0-S0926860X15000794-gr13.jpg?httpAccept=%2A%2F%2A",
            "@multimediatype": "JPEG image file",
            "@type": "IMAGE-DOWNSAMPLED",
            "@size": "39903",
            "@ref": "gr13",
            "@mimetype": "image/jpeg"
          },
          {
            "@category": "standard",
            "@height": "295",
            "@width": "376",
            "@_fa": "true",
            "$": "https://api.elsevier.com/content/object/eid/1-s2.0-S0926860X15000794-gr14.jpg?httpAccept=%2A%2F%2A",
            "@multimediatype": "JPEG image file",
            "@type": "IMAGE-DOWNSAMPLED",
            "@size": "53270",
            "@ref": "gr14",
            "@mimetype": "image/jpeg"
          },
          {
            "@category": "standard",
            "@height": "581",
            "@width": "376",
            "@_fa": "true",
            "$": "https://api.elsevier.com/content/object/eid/1-s2.0-S0926860X15000794-gr2.jpg?httpAccept=%2A%2F%2A",
            "@multimediatype": "JPEG image file",
            "@type": "IMAGE-DOWNSAMPLED",
            "@size": "91910",
            "@ref": "gr2",
            "@mimetype": "image/jpeg"
          },
          {
            "@category": "standard",
            "@height": "272",
            "@width": "393",
            "@_fa": "true",
            "$": "https://api.elsevier.com/content/object/eid/1-s2.0-S0926860X15000794-gr3.jpg?httpAccept=%2A%2F%2A",
            "@multimediatype": "JPEG image file",
            "@type": "IMAGE-DOWNSAMPLED",
            "@size": "40870",
            "@ref": "gr3",
            "@mimetype": "image/jpeg"
          },
          {
            "@category": "standard",
            "@height": "534",
            "@width": "376",
            "@_fa": "true",
            "$": "https://api.elsevier.com/content/object/eid/1-s2.0-S0926860X15000794-gr4.jpg?httpAccept=%2A%2F%2A",
            "@multimediatype": "JPEG image file",
            "@type": "IMAGE-DOWNSAMPLED",
            "@size": "70071",
            "@ref": "gr4",
            "@mimetype": "image/jpeg"
          },
          {
            "@category": "standard",
            "@height": "287",
            "@width": "376",
            "@_fa": "true",
            "$": "https://api.elsevier.com/content/object/eid/1-s2.0-S0926860X15000794-gr5.jpg?httpAccept=%2A%2F%2A",
            "@multimediatype": "JPEG image file",
            "@type": "IMAGE-DOWNSAMPLED",
            "@size": "76976",
            "@ref": "gr5",
            "@mimetype": "image/jpeg"
          },
          {
            "@category": "standard",
            "@height": "290",
            "@width": "376",
            "@_fa": "true",
            "$": "https://api.elsevier.com/content/object/eid/1-s2.0-S0926860X15000794-gr6.jpg?httpAccept=%2A%2F%2A",
            "@multimediatype": "JPEG image file",
            "@type": "IMAGE-DOWNSAMPLED",
            "@size": "30672",
            "@ref": "gr6",
            "@mimetype": "image/jpeg"
          },
          {
            "@category": "standard",
            "@height": "272",
            "@width": "393",
            "@_fa": "true",
            "$": "https://api.elsevier.com/content/object/eid/1-s2.0-S0926860X15000794-gr7.jpg?httpAccept=%2A%2F%2A",
            "@multimediatype": "JPEG image file",
            "@type": "IMAGE-DOWNSAMPLED",
            "@size": "42696",
            "@ref": "gr7",
            "@mimetype": "image/jpeg"
          },
          {
            "@category": "standard",
            "@height": "854",
            "@width": "565",
            "@_fa": "true",
            "$": "https://api.elsevier.com/content/object/eid/1-s2.0-S0926860X15000794-gr8.jpg?httpAccept=%2A%2F%2A",
            "@multimediatype": "JPEG image file",
            "@type": "IMAGE-DOWNSAMPLED",
            "@size": "165803",
            "@ref": "gr8",
            "@mimetype": "image/jpeg"
          },
          {
            "@category": "standard",
            "@height": "291",
            "@width": "376",
            "@_fa": "true",
            "$": "https://api.elsevier.com/content/object/eid/1-s2.0-S0926860X15000794-gr9.jpg?httpAccept=%2A%2F%2A",
            "@multimediatype": "JPEG image file",
            "@type": "IMAGE-DOWNSAMPLED",
            "@size": "49045",
            "@ref": "gr9",
            "@mimetype": "image/jpeg"
          },
          {
            "@category": "high",
            "@height": "886",
            "@width": "2213",
            "@_fa": "true",
            "$": "https://api.elsevier.com/content/object/eid/1-s2.0-S0926860X15000794-fx1_lrg.jpg?httpAccept=%2A%2F%2A",
            "@multimediatype": "JPEG image file",
            "@type": "IMAGE-HIGH-RES",
            "@size": "184192",
            "@ref": "fx1",
            "@mimetype": "image/jpeg"
          },
          {
            "@category": "high",
            "@height": "2577",
            "@width": "1667",
            "@_fa": "true",
            "$": "https://api.elsevier.com/content/object/eid/1-s2.0-S0926860X15000794-gr1_lrg.jpg?httpAccept=%2A%2F%2A",
            "@multimediatype": "JPEG image file",
            "@type": "IMAGE-HIGH-RES",
            "@size": "537743",
            "@ref": "gr1",
            "@mimetype": "image/jpeg"
          },
          {
            "@category": "high",
            "@height": "2278",
            "@width": "1667",
            "@_fa": "true",
            "$": "https://api.elsevier.com/content/object/eid/1-s2.0-S0926860X15000794-gr10_lrg.jpg?httpAccept=%2A%2F%2A",
            "@multimediatype": "JPEG image file",
            "@type": "IMAGE-HIGH-RES",
            "@size": "547749",
            "@ref": "gr10",
            "@mimetype": "image/jpeg"
          },
          {
            "@category": "high",
            "@height": "2223",
            "@width": "1667",
            "@_fa": "true",
            "$": "https://api.elsevier.com/content/object/eid/1-s2.0-S0926860X15000794-gr11_lrg.jpg?httpAccept=%2A%2F%2A",
            "@multimediatype": "JPEG image file",
            "@type": "IMAGE-HIGH-RES",
            "@size": "487586",
            "@ref": "gr11",
            "@mimetype": "image/jpeg"
          },
          {
            "@category": "high",
            "@height": "1208",
            "@width": "1743",
            "@_fa": "true",
            "$": "https://api.elsevier.com/content/object/eid/1-s2.0-S0926860X15000794-gr12_lrg.jpg?httpAccept=%2A%2F%2A",
            "@multimediatype": "JPEG image file",
            "@type": "IMAGE-HIGH-RES",
            "@size": "200353",
            "@ref": "gr12",
            "@mimetype": "image/jpeg"
          },
          {
            "@category": "high",
            "@height": "1333",
            "@width": "1743",
            "@_fa": "true",
            "$": "https://api.elsevier.com/content/object/eid/1-s2.0-S0926860X15000794-gr13_lrg.jpg?httpAccept=%2A%2F%2A",
            "@multimediatype": "JPEG image file",
            "@type": "IMAGE-HIGH-RES",
            "@size": "157885",
            "@ref": "gr13",
            "@mimetype": "image/jpeg"
          },
          {
            "@category": "high",
            "@height": "1306",
            "@width": "1667",
            "@_fa": "true",
            "$": "https://api.elsevier.com/content/object/eid/1-s2.0-S0926860X15000794-gr14_lrg.jpg?httpAccept=%2A%2F%2A",
            "@multimediatype": "JPEG image file",
            "@type": "IMAGE-HIGH-RES",
            "@size": "225736",
            "@ref": "gr14",
            "@mimetype": "image/jpeg"
          },
          {
            "@category": "high",
            "@height": "2577",
            "@width": "1667",
            "@_fa": "true",
            "$": "https://api.elsevier.com/content/object/eid/1-s2.0-S0926860X15000794-gr2_lrg.jpg?httpAccept=%2A%2F%2A",
            "@multimediatype": "JPEG image file",
            "@type": "IMAGE-HIGH-RES",
            "@size": "545572",
            "@ref": "gr2",
            "@mimetype": "image/jpeg"
          },
          {
            "@category": "high",
            "@height": "1208",
            "@width": "1743",
            "@_fa": "true",
            "$": "https://api.elsevier.com/content/object/eid/1-s2.0-S0926860X15000794-gr3_lrg.jpg?httpAccept=%2A%2F%2A",
            "@multimediatype": "JPEG image file",
            "@type": "IMAGE-HIGH-RES",
            "@size": "195461",
            "@ref": "gr3",
            "@mimetype": "image/jpeg"
          },
          {
            "@category": "high",
            "@height": "2368",
            "@width": "1667",
            "@_fa": "true",
            "$": "https://api.elsevier.com/content/object/eid/1-s2.0-S0926860X15000794-gr4_lrg.jpg?httpAccept=%2A%2F%2A",
            "@multimediatype": "JPEG image file",
            "@type": "IMAGE-HIGH-RES",
            "@size": "394192",
            "@ref": "gr4",
            "@mimetype": "image/jpeg"
          },
          {
            "@category": "high",
            "@height": "1271",
            "@width": "1667",
            "@_fa": "true",
            "$": "https://api.elsevier.com/content/object/eid/1-s2.0-S0926860X15000794-gr5_lrg.jpg?httpAccept=%2A%2F%2A",
            "@multimediatype": "JPEG image file",
            "@type": "IMAGE-HIGH-RES",
            "@size": "434093",
            "@ref": "gr5",
            "@mimetype": "image/jpeg"
          },
          {
            "@category": "high",
            "@height": "1285",
            "@width": "1667",
            "@_fa": "true",
            "$": "https://api.elsevier.com/content/object/eid/1-s2.0-S0926860X15000794-gr6_lrg.jpg?httpAccept=%2A%2F%2A",
            "@multimediatype": "JPEG image file",
            "@type": "IMAGE-HIGH-RES",
            "@size": "127246",
            "@ref": "gr6",
            "@mimetype": "image/jpeg"
          },
          {
            "@category": "high",
            "@height": "1208",
            "@width": "1743",
            "@_fa": "true",
            "$": "https://api.elsevier.com/content/object/eid/1-s2.0-S0926860X15000794-gr7_lrg.jpg?httpAccept=%2A%2F%2A",
            "@multimediatype": "JPEG image file",
            "@type": "IMAGE-HIGH-RES",
            "@size": "180289",
            "@ref": "gr7",
            "@mimetype": "image/jpeg"
          },
          {
            "@category": "high",
            "@height": "3778",
            "@width": "2500",
            "@_fa": "true",
            "$": "https://api.elsevier.com/content/object/eid/1-s2.0-S0926860X15000794-gr8_lrg.jpg?httpAccept=%2A%2F%2A",
            "@multimediatype": "JPEG image file",
            "@type": "IMAGE-HIGH-RES",
            "@size": "1668386",
            "@ref": "gr8",
            "@mimetype": "image/jpeg"
          },
          {
            "@category": "high",
            "@height": "1292",
            "@width": "1667",
            "@_fa": "true",
            "$": "https://api.elsevier.com/content/object/eid/1-s2.0-S0926860X15000794-gr9_lrg.jpg?httpAccept=%2A%2F%2A",
            "@multimediatype": "JPEG image file",
            "@type": "IMAGE-HIGH-RES",
            "@size": "237016",
            "@ref": "gr9",
            "@mimetype": "image/jpeg"
          },
          {
            "@category": "thumbnail",
            "@height": "32",
            "@width": "70",
            "@_fa": "true",
            "$": "https://api.elsevier.com/content/object/eid/1-s2.0-S0926860X15000794-si1.gif?httpAccept=%2A%2F%2A",
            "@multimediatype": "GIF image file",
            "@type": "ALTIMG",
            "@size": "490",
            "@ref": "si1",
            "@mimetype": "image/gif"
          },
          {
            "@category": "thumbnail",
            "@height": "36",
            "@width": "400",
            "@_fa": "true",
            "$": "https://api.elsevier.com/content/object/eid/1-s2.0-S0926860X15000794-si2.gif?httpAccept=%2A%2F%2A",
            "@multimediatype": "GIF image file",
            "@type": "ALTIMG",
            "@size": "1849",
            "@ref": "si2",
            "@mimetype": "image/gif"
          },
          {
            "@category": "thumbnail",
            "@height": "87",
            "@width": "403",
            "@_fa": "true",
            "$": "https://api.elsevier.com/content/object/eid/1-s2.0-S0926860X15000794-si3.gif?httpAccept=%2A%2F%2A",
            "@multimediatype": "GIF image file",
            "@type": "ALTIMG",
            "@size": "2414",
            "@ref": "si3",
            "@mimetype": "image/gif"
          },
          {
            "@category": "thumbnail",
            "@height": "32",
            "@width": "87",
            "@_fa": "true",
            "$": "https://api.elsevier.com/content/object/eid/1-s2.0-S0926860X15000794-si4.gif?httpAccept=%2A%2F%2A",
            "@multimediatype": "GIF image file",
            "@type": "ALTIMG",
            "@size": "476",
            "@ref": "si4",
            "@mimetype": "image/gif"
          },
          {
            "@category": "thumbnail",
            "@height": "16",
            "@width": "29",
            "@_fa": "true",
            "$": "https://api.elsevier.com/content/object/eid/1-s2.0-S0926860X15000794-si5.gif?httpAccept=%2A%2F%2A",
            "@multimediatype": "GIF image file",
            "@type": "ALTIMG",
            "@size": "191",
            "@ref": "si5",
            "@mimetype": "image/gif"
          },
          {
            "@category": "thumbnail",
            "@height": "16",
            "@width": "19",
            "@_fa": "true",
            "$": "https://api.elsevier.com/content/object/eid/1-s2.0-S0926860X15000794-si6.gif?httpAccept=%2A%2F%2A",
            "@multimediatype": "GIF image file",
            "@type": "ALTIMG",
            "@size": "173",
            "@ref": "si6",
            "@mimetype": "image/gif"
          },
          {
            "@category": "thumbnail",
            "@height": "17",
            "@width": "131",
            "@_fa": "true",
            "$": "https://api.elsevier.com/content/object/eid/1-s2.0-S0926860X15000794-si7.gif?httpAccept=%2A%2F%2A",
            "@multimediatype": "GIF image file",
            "@type": "ALTIMG",
            "@size": "530",
            "@ref": "si7",
            "@mimetype": "image/gif"
          }
        ]
      },
      "link": {
        "@rel": "abstract",
        "@href": "https://api.elsevier.com/content/abstract/scopus_id/84944442223"
      }
    }
  }
}