{
  "metadata": {
    "title": "Effects of promoters on the performance of a VO<ce:italic><ce:inf loc=post>x</ce:inf></ce:italic>/SiO<ce:inf loc=post>2</ce:inf> catalyst for the oxidation of methane to formaldehyde",
    "authors": "; ",
    "journal": "Applied Catalysis A: General",
    "date": "2019-05-05",
    "doi": "10.1016/j.apcata.2019.03.014",
    "abstract": "",
    "uri": "https://api.elsevier.com/content/article/pii/S0926860X19301292",
    "pii": "S0926860X19301292"
  },
  "fulltext": {
    "full-text-retrieval-response": {
      "scopus-eid": "2-s2.0-85063324063",
      "originalText": "serial JL 271346 291210 291744 291809 31 Applied Catalysis A: General APPLIEDCATALYSISAGENERAL 2019-03-21 2019-03-21 2019-03-28 2019-03-28 2019-04-08T20:52:56 1-s2.0-S0926860X19301292 S0926-860X(19)30129-2 S0926860X19301292 10.1016/j.apcata.2019.03.014 S300 S300.1 FULL-TEXT 1-s2.0-S0926860X19X0006X 2024-01-01T12:33:10.553292Z 0 0 20190505 2019 2019-03-21T18:11:09.216158Z absattachment articleinfo articletitlenorm authfirstinitialnorm authfirstsurnamenorm cid cids contenttype copyright crossmark dateloaded dateloadedtxt datesearch datesort dateupdated dco docsubtype doctype doi eid ewtransactionid hubeid indexeddate issn issnnorm itemstage itemtransactionid itemweight openaccess openarchive pg pgfirst pglast pii piinorm pubdatestart pubdatetxt pubyr sectiontitle sortorder srctitle srctitlenorm srctype ssids alllist content subj subheadings suppl tomb volfirst volissue volumelist webpdf webpdfpagecount yearnav figure table e-component body acknowledge affil appendices articletitle auth authfirstini authfull authkeywords authlast highlightsabst orcid primabst ref specialabst 0926-860X 0926860X true 577 577 C Volume 577 8 44 51 44 51 20190505 5 May 2019 2019-05-05 2019 Regular Papers article fla © 2019 Elsevier B.V. All rights reserved. EFFECTSPROMOTERSPERFORMANCEAVOXSIO2CATALYSTFOROXIDATIONMETHANEFORMALDEHYDE SHIMURA K 1 Introduction 2 Experimental 2.1 Catalyst preparation 2.2 Catalyst characterization 2.3 Typical procedures for catalytic reactions 3 Results and discussion 3.1 Effect of additive type on V/SiO2 activity 3.2 Optimization of the V/Ga/SiO2 catalyst 3.3 Kinetics of partial oxidation catalyzed by V(2)/Ga(0.3)/SiO2 3.4 Characterization of V/Ga/SiO2 catalysts and role of the Ga2O3 promoter 4 Conclusions Acknowledgements Appendix A Supplementary data References HORN 2015 23 39 R GHARIBI 2012 8 26 M SILVA 2016 42 61 M OTSUKA 2001 145 161 K ARENA 2003 867 875 F GUO 2014 3480 3524 Z KONDRATENKO 2017 366 381 E TANG 2014 2580 2591 P SPIVEY 2014 792 803 J KORANNE 1994 388 391 M PARMALIANA 1997 57 65 A SUN 1997 91 101 Q ARENA 1997 66 76 F BERNDT 2000 384 400 H LIN 2003 860 861 B FORNES 2003 345 354 V WALLIS 2016 120 126 P WANG 2003 321 333 C ZHANG 2005 223 234 Q DU 2006 48 61 G RUDDY 2006 277 285 D NGUYEN 2006 38 48 L PIROVANO 2012 20 27 C LORICERA 2017 1129 1139 C DANG 2018 56 59 T WALLIS 2015 69509 69513 P SPENCER 1989 399 406 N MCCORMICK 2002 129 138 R KORANNE 1994 369 377 M SOKOLOVSKII 1998 238 242 V LAUNAY 2007 390 398 H SHIMURAX2019X44 SHIMURAX2019X44X51 SHIMURAX2019X44XK SHIMURAX2019X44X51XK 2021-03-28T00:00:00.000Z 2021-03-28T00:00:00.000Z http://creativecommons.org/licenses/by-nc-nd/4.0/ © 2019 Elsevier B.V. All rights reserved. item S0926-860X(19)30129-2 S0926860X19301292 1-s2.0-S0926860X19301292 10.1016/j.apcata.2019.03.014 271346 2024-01-01T12:33:10.553292Z 2019-05-05 1-s2.0-S0926860X19301292-main.pdf https://s3.amazonaws.com/prod-ucs-content-store-us-east/content/pii:S0926860X19301292/MAIN/application/pdf/bbed09f8ffcc0713ed69548a79a7bb4a/main.pdf main.pdf pdf true 1281066 MAIN 8 1-s2.0-S0926860X19301292-main_1.png https://s3.amazonaws.com/prod-ucs-content-store-us-east/content/pii:S0926860X19301292/PREVIEW/image/png/996f9621d3e8ec86d60f4efe6b4bdd93/main_1.png main_1.png png 52915 849 656 IMAGE-WEB-PDF 1 1-s2.0-S0926860X19301292-ga1.sml https://s3.amazonaws.com/prod-ucs-content-store-us-east/content/pii:S0926860X19301292/ga1/THUMBNAIL/image/gif/7928e17ee9555bb4172d4710b9a8dd23/ga1.sml ga1 true ga1.sml sml 7678 164 190 IMAGE-THUMBNAIL 1-s2.0-S0926860X19301292-gr1.sml https://s3.amazonaws.com/prod-ucs-content-store-us-east/content/pii:S0926860X19301292/gr1/THUMBNAIL/image/gif/b53a90e987b9b86e6d8cbb99c82cbf06/gr1.sml gr1 gr1.sml sml 6917 141 219 IMAGE-THUMBNAIL 1-s2.0-S0926860X19301292-gr10.sml https://s3.amazonaws.com/prod-ucs-content-store-us-east/content/pii:S0926860X19301292/gr10/THUMBNAIL/image/gif/618442f961bc98b5ae1fac1e28e1d057/gr10.sml gr10 gr10.sml sml 3787 163 98 IMAGE-THUMBNAIL 1-s2.0-S0926860X19301292-gr2.sml https://s3.amazonaws.com/prod-ucs-content-store-us-east/content/pii:S0926860X19301292/gr2/THUMBNAIL/image/gif/e2a6547502910679876eccf82545de14/gr2.sml gr2 gr2.sml sml 5943 141 219 IMAGE-THUMBNAIL 1-s2.0-S0926860X19301292-gr3.sml https://s3.amazonaws.com/prod-ucs-content-store-us-east/content/pii:S0926860X19301292/gr3/THUMBNAIL/image/gif/e3abf8c463eb1a0877d7675f597c7729/gr3.sml gr3 gr3.sml sml 4034 163 103 IMAGE-THUMBNAIL 1-s2.0-S0926860X19301292-gr4.sml https://s3.amazonaws.com/prod-ucs-content-store-us-east/content/pii:S0926860X19301292/gr4/THUMBNAIL/image/gif/a96b168cab4e3c62bfc00e74787546cd/gr4.sml gr4 gr4.sml sml 4069 164 103 IMAGE-THUMBNAIL 1-s2.0-S0926860X19301292-gr5.sml https://s3.amazonaws.com/prod-ucs-content-store-us-east/content/pii:S0926860X19301292/gr5/THUMBNAIL/image/gif/e3340f5c3455f62b49f73d9abc0200bc/gr5.sml gr5 gr5.sml sml 7128 138 219 IMAGE-THUMBNAIL 1-s2.0-S0926860X19301292-gr6.sml https://s3.amazonaws.com/prod-ucs-content-store-us-east/content/pii:S0926860X19301292/gr6/THUMBNAIL/image/gif/32facb9e03af4999ffda9ab5a5799b51/gr6.sml gr6 gr6.sml sml 5537 164 208 IMAGE-THUMBNAIL 1-s2.0-S0926860X19301292-gr7.sml https://s3.amazonaws.com/prod-ucs-content-store-us-east/content/pii:S0926860X19301292/gr7/THUMBNAIL/image/gif/8fe8d41591cdc1f73911b8b5f438b208/gr7.sml gr7 gr7.sml sml 5579 163 208 IMAGE-THUMBNAIL 1-s2.0-S0926860X19301292-gr8.sml https://s3.amazonaws.com/prod-ucs-content-store-us-east/content/pii:S0926860X19301292/gr8/THUMBNAIL/image/gif/9bb8145775c0eb43f865b7368a9a2b9b/gr8.sml gr8 gr8.sml sml 6581 163 113 IMAGE-THUMBNAIL 1-s2.0-S0926860X19301292-gr9.sml https://s3.amazonaws.com/prod-ucs-content-store-us-east/content/pii:S0926860X19301292/gr9/THUMBNAIL/image/gif/ad9767aa0a3bbb46d7dbbd12240d2a20/gr9.sml gr9 gr9.sml sml 4160 164 68 IMAGE-THUMBNAIL 1-s2.0-S0926860X19301292-ga1.jpg https://s3.amazonaws.com/prod-ucs-content-store-us-east/content/pii:S0926860X19301292/ga1/DOWNSAMPLED/image/jpeg/ff1294d49d72e04a5f654d80ef04e306/ga1.jpg ga1 true ga1.jpg jpg 14160 200 232 IMAGE-DOWNSAMPLED 1-s2.0-S0926860X19301292-gr1.jpg https://s3.amazonaws.com/prod-ucs-content-store-us-east/content/pii:S0926860X19301292/gr1/DOWNSAMPLED/image/jpeg/129042c95c46e8bd9fef84ec81a8cd14/gr1.jpg gr1 gr1.jpg jpg 14907 182 282 IMAGE-DOWNSAMPLED 1-s2.0-S0926860X19301292-gr10.jpg https://s3.amazonaws.com/prod-ucs-content-store-us-east/content/pii:S0926860X19301292/gr10/DOWNSAMPLED/image/jpeg/c8ac3e8ed72a97eef593c7f7ee69d34e/gr10.jpg gr10 gr10.jpg jpg 25048 470 282 IMAGE-DOWNSAMPLED 1-s2.0-S0926860X19301292-gr2.jpg https://s3.amazonaws.com/prod-ucs-content-store-us-east/content/pii:S0926860X19301292/gr2/DOWNSAMPLED/image/jpeg/f6b3882bc5d0d5861cfc4ffa699f5eb5/gr2.jpg gr2 gr2.jpg jpg 13323 182 282 IMAGE-DOWNSAMPLED 1-s2.0-S0926860X19301292-gr3.jpg https://s3.amazonaws.com/prod-ucs-content-store-us-east/content/pii:S0926860X19301292/gr3/DOWNSAMPLED/image/jpeg/f0bb0ced9ecd39f2e05f2900590ee439/gr3.jpg gr3 gr3.jpg jpg 24377 447 282 IMAGE-DOWNSAMPLED 1-s2.0-S0926860X19301292-gr4.jpg https://s3.amazonaws.com/prod-ucs-content-store-us-east/content/pii:S0926860X19301292/gr4/DOWNSAMPLED/image/jpeg/eb00a94ff61d4b41a8c1033757f6eeab/gr4.jpg gr4 gr4.jpg jpg 25065 449 282 IMAGE-DOWNSAMPLED 1-s2.0-S0926860X19301292-gr5.jpg https://s3.amazonaws.com/prod-ucs-content-store-us-east/content/pii:S0926860X19301292/gr5/DOWNSAMPLED/image/jpeg/75e4972ffb5b3bc337b3147067e46021/gr5.jpg gr5 gr5.jpg jpg 15661 178 282 IMAGE-DOWNSAMPLED 1-s2.0-S0926860X19301292-gr6.jpg https://s3.amazonaws.com/prod-ucs-content-store-us-east/content/pii:S0926860X19301292/gr6/DOWNSAMPLED/image/jpeg/3b1d5e22d375105e0609bd6912b28500/gr6.jpg gr6 gr6.jpg jpg 13870 222 282 IMAGE-DOWNSAMPLED 1-s2.0-S0926860X19301292-gr7.jpg https://s3.amazonaws.com/prod-ucs-content-store-us-east/content/pii:S0926860X19301292/gr7/DOWNSAMPLED/image/jpeg/4d4b607040213bed4db98215a1331497/gr7.jpg gr7 gr7.jpg jpg 13678 222 282 IMAGE-DOWNSAMPLED 1-s2.0-S0926860X19301292-gr8.jpg https://s3.amazonaws.com/prod-ucs-content-store-us-east/content/pii:S0926860X19301292/gr8/DOWNSAMPLED/image/jpeg/615ca750793b31e8d130e2f2e1241d6a/gr8.jpg gr8 gr8.jpg jpg 38823 407 282 IMAGE-DOWNSAMPLED 1-s2.0-S0926860X19301292-gr9.jpg https://s3.amazonaws.com/prod-ucs-content-store-us-east/content/pii:S0926860X19301292/gr9/DOWNSAMPLED/image/jpeg/9c7ab93ce7aeec00cac793d5f9e4647f/gr9.jpg gr9 gr9.jpg jpg 51714 679 282 IMAGE-DOWNSAMPLED 1-s2.0-S0926860X19301292-ga1_lrg.jpg https://s3.amazonaws.com/prod-ucs-content-store-us-east/content/pii:S0926860X19301292/ga1/HIGHRES/image/jpeg/d9bc8d84c55d73d89cc80dc54424d3f9/ga1_lrg.jpg ga1 true ga1_lrg.jpg jpg 98476 886 1029 IMAGE-HIGH-RES 1-s2.0-S0926860X19301292-gr1_lrg.jpg https://s3.amazonaws.com/prod-ucs-content-store-us-east/content/pii:S0926860X19301292/gr1/HIGHRES/image/jpeg/5fe6dde9c676a1db925684348f71f95c/gr1_lrg.jpg gr1 gr1_lrg.jpg jpg 107135 807 1250 IMAGE-HIGH-RES 1-s2.0-S0926860X19301292-gr10_lrg.jpg https://s3.amazonaws.com/prod-ucs-content-store-us-east/content/pii:S0926860X19301292/gr10/HIGHRES/image/jpeg/be4b07ab64f05e8da7bc56405d743228/gr10_lrg.jpg gr10 gr10_lrg.jpg jpg 176111 2083 1250 IMAGE-HIGH-RES 1-s2.0-S0926860X19301292-gr2_lrg.jpg https://s3.amazonaws.com/prod-ucs-content-store-us-east/content/pii:S0926860X19301292/gr2/HIGHRES/image/jpeg/92a1058626925ea08155d7edbafde07d/gr2_lrg.jpg gr2 gr2_lrg.jpg jpg 94522 807 1250 IMAGE-HIGH-RES 1-s2.0-S0926860X19301292-gr3_lrg.jpg https://s3.amazonaws.com/prod-ucs-content-store-us-east/content/pii:S0926860X19301292/gr3/HIGHRES/image/jpeg/74eaf34743c18def0b452dfb5f7e9eee/gr3_lrg.jpg gr3 gr3_lrg.jpg jpg 170751 1980 1250 IMAGE-HIGH-RES 1-s2.0-S0926860X19301292-gr4_lrg.jpg https://s3.amazonaws.com/prod-ucs-content-store-us-east/content/pii:S0926860X19301292/gr4/HIGHRES/image/jpeg/54dd85005a8a7bd9ef9bd60759edc28c/gr4_lrg.jpg gr4 gr4_lrg.jpg jpg 172258 1991 1250 IMAGE-HIGH-RES 1-s2.0-S0926860X19301292-gr5_lrg.jpg https://s3.amazonaws.com/prod-ucs-content-store-us-east/content/pii:S0926860X19301292/gr5/HIGHRES/image/jpeg/c65178bbe4688597eff5bd04ab1d6d51/gr5_lrg.jpg gr5 gr5_lrg.jpg jpg 114995 789 1250 IMAGE-HIGH-RES 1-s2.0-S0926860X19301292-gr6_lrg.jpg https://s3.amazonaws.com/prod-ucs-content-store-us-east/content/pii:S0926860X19301292/gr6/HIGHRES/image/jpeg/3652e3b9b5d98ac6d417c283fcc21dd7/gr6_lrg.jpg gr6 gr6_lrg.jpg jpg 95054 987 1252 IMAGE-HIGH-RES 1-s2.0-S0926860X19301292-gr7_lrg.jpg https://s3.amazonaws.com/prod-ucs-content-store-us-east/content/pii:S0926860X19301292/gr7/HIGHRES/image/jpeg/c3ebb2cc6f0032133b26775886f0c41d/gr7_lrg.jpg gr7 gr7_lrg.jpg jpg 96343 984 1252 IMAGE-HIGH-RES 1-s2.0-S0926860X19301292-gr8_lrg.jpg https://s3.amazonaws.com/prod-ucs-content-store-us-east/content/pii:S0926860X19301292/gr8/HIGHRES/image/jpeg/08e188592d2a793996a03a2b0885c828/gr8_lrg.jpg gr8 gr8_lrg.jpg jpg 308601 1803 1250 IMAGE-HIGH-RES 1-s2.0-S0926860X19301292-gr9_lrg.jpg https://s3.amazonaws.com/prod-ucs-content-store-us-east/content/pii:S0926860X19301292/gr9/HIGHRES/image/jpeg/694d70964ee1a2e63ffd856bd11da527/gr9_lrg.jpg gr9 gr9_lrg.jpg jpg 382743 3010 1250 IMAGE-HIGH-RES 1-s2.0-S0926860X19301292-mmc1.docx https://s3.amazonaws.com/prod-ucs-content-store-us-east/content/pii:S0926860X19301292/mmc1/MAIN/application/vnd.openxmlformats-officedocument.wordprocessingml.document/87165d0db5b30be1dacc3a2543ba33dd/mmc1.docx mmc1 mmc1.docx docx 147032 APPLICATION 1-s2.0-S0926860X19301292-am.pdf am am.pdf pdf 406636 AAM-PDF https://s3-eu-west-1.amazonaws.com/prod-ucs-content-store-eu-west/content/egi:10J33KFRSB8/MAIN/application/pdf/04041b9c4fcff047e69034165a513f41/am.pdf https://s3.amazonaws.com/prod-ucs-content-store-us-east/content/egi:10J33KFRSB8/MAIN/application/pdf/04041b9c4fcff047e69034165a513f41/am.pdf APCATA 17019 S0926-860X(19)30129-2 10.1016/j.apcata.2019.03.014 Elsevier B.V. Fig. 1 Effects of V loading on the catalytic performances of (A) V/SiO2 and (B) V/Ga(0.5)/SiO2: (●) CH4 conversion, (■) HCHO selectivity, and (△) HCHO yield. Fig. 1 Fig. 2 Effects of Ga loading on the catalytic performance of V(2)/Ga/SiO2: (○) CH4 conversion, (■) HCHO selectivity, and (▲) HCHO yield. Fig. 2 Fig. 3 Effects of CH4 concentration on (A) CH4 conversion rate (V CH4) and (B) product selectivity over the V(2)/Ga(0.3)/SiO2 catalyst. Reaction conditions: temperature, 590 °C; total flow rate, 100 mL min−1; O2 concentration, 20%; catalyst weight, 0.10 g. Fig. 3 Fig. 4 Effects of O2 concentration on (A) CH4 conversion rate (V CH4) and (B) product selectivity over the V(2)/Ga(0.3)/SiO2 catalyst. Reaction conditions: temperature, 590 °C; total flow rate, 100 mL min−1; CH4 concentration, 40%; catalyst weight, 0.10 g. Fig. 4 Fig. 5 Effects of reaction temperature (T) on the performances of the (A) V(2)/SiO2 and (B) V(2)/Ga(0.3)/SiO2 catalysts: (○) CH4 conversion, (■) HCHO selectivity, and (▲) HCHO yield. Reaction conditions: total flow rate, 100 mL min−1; CH4 concentration, 40%; O2 concentration, 20%; catalyst weight, 0.10 g. Fig. 5 Fig. 6 Plots of HCHO selectivity versus CH4 conversion for reactions over the V(2)/SiO2 and V(2)/Ga(0.3)/SiO2 catalysts. Reaction conditions: temperature, 562–628 °C; total flow rate, 100 mL min−1; CH4 concentration, 40%; O2 concentration, 20%; catalyst weight, 0.10 g. Fig. 6 Fig. 7 Arrhenius plots for reactions over the V(2)/SiO2 and V(2)/Ga(0.3)/SiO2 catalysts. Reaction conditions: temperature, 562–628 °C; total flow rate, 100 mL min−1; CH4 concentration, 40%; O2 concentration, 20%; catalyst weight, 0.10 g. Fig. 7 Fig. 8 XRD patterns of the V(5)/SiO2 and V(5)/M(1)/SiO2 catalysts: (●) V2O5, (▼) VO2, and (■) La2O3. Fig. 8 Fig. 9 H2-TPR profiles of the (A) V(5)/M(1)/SiO2 and (B) V(2)/Ga/SiO2 catalysts. Fig. 9 Fig. 10 Plots of CH4 conversion versus (A) temperature for reduction of active VO x species and (B) VO x dispersion of V(5)/M(1)/SiO2 catalysts. Fig. 10 Table 1 Catalytic performances of SiO2, V(5)/SiO2, V(5)/M(1)/SiO2, and Ga(1)/SiO2 for partial oxidation of CH4 with O2. Table 1 Entry Catalyst CH4 conversion (%) Selectivity (%) HCHO yield (%) VO x dispersion a (%) HCHO CO CO2 1 SiO2 0.1 100 0 0 0.08 ‒ b 2 V(5)/SiO2 0.9 41 59 0 0.37 74 3 V(5)/Ga(1)/SiO2 3.8 17 80 3 0.66 81 4 V(5)/In(1)/SiO2 1.8 28 68 4 0.51 ‒ b 5 V(5)/Y(1)/SiO2 1.7 31 68 1 0.55 69 6 V(5)/Al(1)/SiO2 1.5 31 66 3 0.46 57 7 V(5)/Bi(1)/SiO2 1.2 39 61 0 0.49 ‒ b 8 V(5)/Zr(1)/SiO2 1.2 37 63 0 0.42 70 9 V(5)/La(1)/SiO2 1.1 40 59 1 0.44 83 10 V(5)/Zn(1)/SiO2 0.8 51 49 0 0.42 ‒ b 11 V(5)/W(1)/SiO2 0.7 51 49 0 0.34 ‒ b 12 V(5)/Mg(1)/SiO2 0.2 86 14 0 0.17 82 13 V(5)/Mo(1)/SiO2 0.1 100 0 0 0.12 ‒ b 14 V(5)/Ti(1)/SiO2 0.1 100 0 0 0.11 ‒ b 15 V(5)/Ce(1)/SiO2 0.1 100 0 0 0.08 ‒ b 16 V(5)/Ca(1)/SiO2 0.1 100 0 0 0.07 81 17 Ga(1)/SiO2 0.1 100 0 0 0.11 ‒ b a Measured by H2-TPR. b Not measured. Table 2 Influence of Ga loading method on the activity of the Ga(0.5)-modified V(2)/SiO2 catalysts. Table 2 Catalyst Ga loading method CH4 conversion (%) Selectivity (%) HCHO yield (%) HCHO CO CO2 V(2)/SiO2 Impregnation 0.4 88 12 0 0.38 V(2)/Ga(0.5)/SiO2 Sequential impregnation(Ga loaded first and then V) 3.1 32 65 3 0.99 V(2)+Ga(0.5)/SiO2 Co-impregnation 2.1 39 59 2 0.83 Ga(0.5)/V(2)/SiO2 Reverse sequential impregnation(V loaded first and then Ga) 2.2 39 59 2 0.87 Table 3 Partial oxidation of methane to formaldehyde over the V(2)/Ga(0.3)/SiO2 catalyst under various reaction conditions. Table 3 Entry T a (°C) Concentration (%) CH4 conversion Selectivity (%) V CH4 b CH4 O2 (%) HCHO CO CO2 (mmol g−1 h−1) 1 590 19 20 2.9 36 59 5 14.6 2 29 2.5 40 55 5 19.4 3 33 2.8 38 57 5 24.6 4 39 2.8 40 55 5 28.5 5 43 2.9 37 58 5 33.9 6 48 2.7 37 58 5 35.0 7 590 40 4 2.4 44 52 4 25.0 8 6 2.8 42 55 4 27.8 9 9 3.4 38 57 5 34.6 10 13 3.4 40 55 5 33.8 11 19 2.8 40 55 5 28.5 12 23 2.4 41 55 5 24.2 13 597 40 20 4.0 30 64 6 41.1 14 590 2.8 40 55 5 28.5 15 580 1.7 53 42 5 17.2 16 570 0.8 82 18 0 8.6 17 562 0.5 96 4 0 5.6 a Reaction temperature. b CH4 conversion rate. Table 4 Physicochemical properties of SiO2, V/SiO2, and V/Ga(1)/SiO2 catalysts. Table 4 Catalyst BET specific surface area (m2 g−1) Pore volume (cm3 g−1) Average pore size (nm) SiO2 475 1.7 7.1 V(2)/SiO2 461 1.2 5.7 V(2)/Ga(1)/SiO2 472 1.5 6.5 V(5)/SiO2 386 1.1 5.8 V(5)/Ga(1)/SiO2 395 1.1 5.8 Effects of promoters on the performance of a VO x /SiO2 catalyst for the oxidation of methane to formaldehyde Katsuya Shimura ⁎ Tadahiro Fujitani Interdisciplinary Research Center for Catalytic Chemistry, National Institute of Advanced Industrial Science and Technology (AIST), 1-1-1 Higashi, Tsukuba, Ibaraki, 305-8565, Japan Interdisciplinary Research Center for Catalytic Chemistry National Institute of Advanced Industrial Science and Technology (AIST) 1-1-1 Higashi Tsukuba Ibaraki 305-8565 Japan ⁎ Corresponding author. Graphical abstract The effects of promoters on the performance of a VO x /SiO2 catalyst were investigated with the goal of increasing its catalytic activity for the oxidation of methane to formaldehyde. Fourteen types of metal oxides (MO x , M = Ga, In, Y, Al, Bi, Zr, La, Zn, W, Mg, Mo, Ti, Ce, and Ca) were tested as promoters. Among them, Ga2O3, In2O3, Y2O3, and Al2O3 substantially increased the methane conversion rate and the formaldehyde yield, whereas MgO, MoO x , TiO2, CeO2, and CaO were less effective as promoters. The catalytic activity also depended on the amount of the promoter and the method by which it was loaded onto the support. The highest activity was obtained over VO x /Ga2O3/SiO2 (V loading, 2–3 wt%; Ga loading, 0.1–0.5 wt%) prepared by a sequential impregnation method (Ga loaded first and then V): under the standard reaction conditions (reaction temperature, 590 °C; gas hourly space velocity, 60,000 L kg−1 h−1; CH4/O2 ratio, 2), the formaldehyde yield over this catalyst was 2.1 times that over bare VO x /SiO2. Reactions over the VO x /Ga2O3/SiO2 catalyst and the bare VO x /SiO2 catalyst showed different kinetics, indicating that Ga2O3 altered the properties of the active VO x sites. Catalyst characterization by means of X-ray diffraction and temperature-programmed reduction under H2 suggested that the high activity of VO x /Ga2O3/SiO2 was due to the promoter’s having increased the reducibility of the active VO x species without decreasing their dispersion. Keywords Methane Partial oxidation Formaldehyde synthesis Vanadium oxide catalyst Promoter 1 Introduction Because of growing concerns about the environment and energy sustainability, the development of alternatives to oil is highly desirable. Methane (CH4) is one possibility. Methane is an abundant natural resource [1], and its combustion produces less CO2, NO x , and SO x than combustion of oil or coal. Furthermore, CH4 is the main component of biogas, which is a renewable resource [1]. Although CH4 is a promising alternative to oil, its use as a chemical feedstock is limited and more than 90% of the CH4 is burned to create the thermal energy and the electricity [1]. Methane is very stable, and activation of its CH bond requires considerable energy input (high temperature and pressure). Furthermore, because the target products are generally more reactive than CH4, suppressing reactions of the products is difficult. Current technology for producing fuels and chemicals from CH4 involves an energy-intensive, uneconomical multistep process [2,3]. First, CH4 is converted into syngas (a mixture of H2 and CO) by steam reforming over a heterogeneous Ni catalyst. Steam reforming of CH4 is thermodynamically unfavorable and typically requires temperatures exceeding 800 °C even in the presence of catalysts, and therefore the reforming reaction accounts for 60–70% of the capital cost of the multistep process [3]. Next, syngas is transformed into methanol and a mixture of hydrocarbons by methanol synthesis and Fischer–Tropsch synthesis at high pressures (2–10 MPa). To promote the utilization of CH4 as a chemical feedstock, we must develop a more efficient and economical process for CH4 conversion. Direct conversion of CH4 into liquid fuels and chemicals is one promising method because the energy-intensive steam reforming step can be avoided. For this purpose, various reactions have been explored, including partial oxidation of CH4 to oxygenated products (e.g., methanol and formaldehyde) [4–7], oxidative coupling of CH4 to C2 compounds [7,8], and CH4 aromatization [8,9]. However, these reactions are inefficient, and none of them are practical enough for industrial applications. Therefore, the development of highly active catalysts that can selectively convert CH4 into the desired products under mild conditions is necessary for the commercialization of processes for direct CH4 conversion. Direct conversion of CH4 to formaldehyde (HCHO) with O2 is an attractive option, and various catalysts, such as SiO2-supported metal oxides (e.g., VO x /SiO2, MoO x /SiO2, and FeO x /SiO2) and composite metal oxides (e.g., FePO4 and Fe2(MnO4)3), have been developed for this purpose [4–7]. Among them, VO x /SiO2 and MoO x /SiO2 show relatively high activity. As the support of VO x and MoO x catalysts, the inert SiO2 support has been reported to be more suitable than acidic or basic supports (e.g., Al2O3, TiO2, and SnO2) [10–12]. In addition, highly dispersed active metal oxide species are necessary for selective formation of HCHO because aggregated species promote oxidation of HCHO to CO and CO2 [13]. Thus, two main approaches have been used for the development of highly active catalysts. One approach involves the use of mesoporous SiO2 with a large surface area and a well-ordered pore structure (e.g., MCM-41 and SBA-15) instead of amorphous SiO2 as the support material [14–17]. The other involves improvement in the method for catalyst preparation (e.g., the use of sol–gel, ion exchange, and grafting methods), because the conventional impregnation method is not always effective for isolating the active species [18–25]. However, the HCHO yield is still only 3–4% at best, which is far from practical [1]. Therefore, new approaches must also be considered. In the present study, we examined the effects of promoter addition on the performance of a VO x /SiO2 catalyst for the oxidation of CH4 to HCHO by oxygen. The addition of a metal oxide as a second component is known to improve the activity of various supported metal and metal oxide catalysts. However, as far as we know, there have been only a few studies of the effects of promoter addition on catalysts for partial oxidation of CH4 [26]. Here, we report that the catalytic activity of VO x /SiO2 was greatly improved by the addition of a small amount of Ga2O3 as a promoter. We systematically examined the catalytic behavior of the VO x /Ga2O3/SiO2 catalyst, as well as the kinetics of the oxidation reaction, and we discuss the role of the Ga2O3 promoter in detail. 2 Experimental 2.1 Catalyst preparation Using a sequential impregnation method, we prepared promoter-modified VO x /SiO2 catalysts, designated V(a)/M(b)/SiO2, where M, a, and b designate the metal oxide promoter, the V loading (wt%), and the metal oxide promoter loading (wt%), respectively. First, M/SiO2 was prepared from SiO2 (P-6, Fuji Silysia) powders and an aqueous solution of metal ion M by an impregnation method. The precursors of the metal oxide promoters were Ga(NO3)3·nH2O (Ga content, 18.9%), In(NO3)3·3H2O, Y(NO3)3·6H2O, Al(NO3)3·9H2O, Bi(NO3)3·5H2O, ZrO(NO3)2·2H2O, La(NO3)3·6H2O, Zn(NO3)2·6H2O, (NH4)10W12O41·5H2O, Mg(NO3)2·6H2O, (NH4)6Mo7O24·4H2O, Ti(C3H7O)2(C5H7O2)2, Ce(NO3)3·6H2O, and Ca(NO3)2·4H2O. The purity of these chemicals was greater than 98%. The loading of each metal was typically 1 wt%. The impregnated powders were dried at 110 °C for 12 h and calcined in air at 600 °C for 4 h. Then V was loaded onto the M/SiO2 by means of an impregnation method using NH4VO3 (99.5%, Wako) as the V precursor. The V loading was varied from 1 to 5 wt%. Finally, the obtained powders were dried at 110 °C for 12 h and calcined in air at 600 °C for 4 h. V/SiO2 catalysts modified with the Ga2O3 promoter were also prepared by a reverse sequential impregnation method and by a co-impregnation method. For the former, catalysts were prepared by means of the procedure described above for sequential impregnation except that impregnation with V was the first step and impregnation with Ga was the second step. In the co-impregnation method, the SiO2 was impregnated simultaneously with V and Ga. The resulting powders were dried at 110 °C for 12 h and calcined in air at 600 °C for 4 h. The catalysts prepared by reverse sequential impregnation and co-impregnation are designated as Ga/V/SiO2 and V + Ga/SiO2, respectively. 2.2 Catalyst characterization N2 adsorption/desorption isotherms of the catalysts were measured at −196 °C with an ASAP 2020 system (Micromeritics). Prior to the measurements, the samples (0.15 g) were out-gassed at 400 °C for 4 h under vacuum. Specific surface areas were obtained by applying the Brunauer–Emmett–Teller (BET) model for adsorption in a relative pressure range of 0.05–0.30. Total pore volumes were calculated from the amount of N2 vapor adsorbed at a relative pressure of 0.99. The pore size distributions of the catalysts were determined by means of the Barrett–Joyner–Halenda model from the desorption branches of the nitrogen isotherms. Powder X-ray diffraction (XRD) patterns were recorded at room temperature on a D8 ADVANCE diffractometer (Bruker AXS) with Cu Kα radiation (40 kV, 40 mA). Temperature-programmed reduction under H2 (H2-TPR) was carried out with a BELCAT-B chemisorption analyzer (BEL Japan Inc.). Calcined catalyst (0.10 g) was mounted in a quartz cell and heated to 800 °C in a flow of 5% H2/Ar (30 mL min−1) at a heating rate of 5 °C min−1. The effluent gas was passed through a trap containing 5A molecular sieves to remove the produced water before the gas reached the thermal conductivity detector. 2.3 Typical procedures for catalytic reactions Catalytic reactions were performed in a fixed-bed down-flow quartz reactor operated at atmosphere pressure. Catalyst (0.10 g) was loaded into the reactor along with quartz wool, which was placed before and after the catalyst bed. Prior to the reaction, the catalyst was pretreated in a flow of 20% O2/He (50 mL min−1) at 500 °C for 30 min and then purged with He (50 mL min−1) for 30 min. The reaction was initiated by introducing the reaction gas mixture at a fixed temperature. Typically, the reaction was carried out at 590 °C for 6 h. The reaction gas mixture was composed of CH4 (40%), O2 (20%), and He (40%), and the total flow rate was 100 mL min−1. The effluent gas (containing CH4, O2, CO, and CO2) was analyzed by online gas chromatography (GC) on an instrument equipped with a thermal conductivity detector (TCD) and a column of 5A molecular sieves. The liquid products (methanol and HCHO) were collected in a water-filled trap at 0 °C and analyzed by GC-TCD on an instrument equipped with a Porapak T column. We conducted multiple catalytic reaction tests on each sample and confirmed the reproducibility of the experiment. Experimental error of product yield was typically smaller than 0.05%. The carbon mass balance exceeded 95% for all experiments. No obvious deactivation was observed for any of the catalysts. Results obtained 6 h after the start of the reaction were used for the discussion below. 3 Results and discussion 3.1 Effect of additive type on V/SiO2 activity We prepared 14 types of V(5)/M(1)/SiO2 catalysts, each modified with a different promoter, and we compared their catalytic activities for the oxidation of CH4 to HCHO under the standard reaction condition (reaction temperature, 590 °C; total flow rate, 100 mL min−1; reactant gas composition, 2:1:2 CH4/O2/He; catalyst weight, 0.10 g). We obtained HCHO, CO, and CO2 as the main products regardless of the type of catalyst and reaction conditions, and the yields of methanol and C2 compounds were less than 0.01%. We also confirmed that the catalytic activity did not decrease for 10 h, although we have not conducted the further long-time catalytic reaction test. When bare SiO2 was used as the catalyst, oxidation of CH4 to HCHO proceeded selectively, but the yield of HCHO was quite low (<0.1%; Table 1 , entry 1). Adding 5 wt% V to the SiO2 support increased both CH4 conversion and HCHO yield (entry 2): the HCHO yield over V(5)/SiO2 was 4.7 times that over the SiO2 support. The activities of the V(5)/M(1)/SiO2 catalysts varied substantially depending on the promoter. When Ga2O3, In2O3, Y2O3, Al2O3, BiO x , ZrO2, or La2O3 was used as the promoter, both CH4 conversion and HCHO yield were higher than the corresponding yields for V(5)/SiO2 (entries 3–9). In contrast, the addition of MgO, MoO x , TiO2, CeO2, or CaO resulted in markedly lower catalytic activities compared with that of V(5)/SiO2 (entries 12–16). The activities of V/Zn/SiO2 and V/W/SiO2 were almost the same as that of the bare V/SiO2 catalyst (entries 10 and 11). The highest activity was obtained with V(5)/Ga(1)/SiO2 (entry 3), the use of which resulted in a HCHO yield that was 1.8 times that with bare V(5)/SiO2. It should be noted that the activity of V(5)/Ga(1)/SiO2 catalyst was greater than the sum of the activities of V(5)/SiO2 and Ga(1)/SiO2 catalysts. This shows that high activity of V/Ga/SiO2 catalyst is due to the synergy effect of VO x and Ga2O3. Ga2O3 did not show the negligible activity for the partial oxidation of methane but it could greatly improve the catalytic activity of VO x . The results in Table 1 also show that as CH4 conversion increased, HCHO selectivity decreased and CO x selectivity increased. This is because CO x was produced by the oxidation of HCHO, as previously proposed by various research groups [10–14 27]. In other words, as CH4 conversion increased, oxidation of HCHO was promoted, resulting in the decrease in HCHO selectivity. 3.2 Optimization of the V/Ga/SiO2 catalyst Next, we optimized the conditions for preparation of the V/Ga/SiO2 catalyst, which was the most active of the catalysts listed in Table 1. We investigated the influence of V loading on CH4 conversion, HCHO selectivity, and HCHO yield over the V/SiO2 and V/Ga(0.5)/SiO2 catalysts (Fig. 1 ). As the V loading on V/SiO2 was increased from 0 to 5 wt%, CH4 conversion increased until the loading reached 3 wt%, and then the conversion remained unchanged as the loading was increased further (Fig. 1A). In contrast, over V/Ga(0.5)/SiO2, the dependence of CH4 conversion on V loading showed volcano-type behavior, with maximum CH4 conversion at a V loading of 3 wt% (Fig. 1B). In contrast, for both series of catalysts, HCHO selectivity decreased monotonically with increasing V loading. HCHO yield also showed volcano-type dependence, with the highest value being obtained at a V loading of 3 wt%. The decrease in HCHO yield at loadings from 3 to 5 wt% was probably due to a decrease in the number of active sites resulting from the aggregation of VO x species. In addition, the presence of VO x aggregates can be expected to have promoted oxidation of HCHO, resulting in a decrease in HCHO selectivity [13]. The HCHO yield over the best catalyst, V(3)/Ga(0.5)/SiO2, was 2 times that over the bare V(3)/SiO2 catalyst. We also investigated the influence of Ga loading on CH4 conversion, HCHO selectivity, and HCHO yield over the V(2)/Ga/SiO2 catalyst (Fig. 2 ). As the Ga loading was increased from 0 to 1 wt%, CH4 conversion increased sharply until a loading of 0.1 wt%, was nearly constant in the range from 0.1 to 0.5 wt%, and then decreased again above 0.5 wt%. HCHO selectivity decreased with increasing Ga loading up to 0.1 wt% and then remained nearly constant as the loading was increased further. The HCHO yield showed volcano-type dependence, and the highest value was obtained over the V(2)/Ga(0.3)/SiO2 catalyst. On the basis of these results, we propose that a low Ga loading improved the properties of the active sites without decreasing their number, and thereby increased the catalytic activity. However, addition of too much of the Ga2O3 promoter covered the surface of the active VO x species, resulting in a decrease of catalytic activity. We also used three different methods to prepare Ga(0.5)-doped V(2)/SiO2 catalysts and then compared the activities of the resulting catalysts for oxidation of CH4 to HCHO: specifically, a V(2)/Ga(0.5)/SiO2 catalyst was prepared by the sequential impregnation method (Ga was loaded first and then V); a V(2)+Ga(0.5)/SiO2 catalyst was prepared by the co-impregnation method; and a Ga(0.5)/V(2)/SiO2 catalyst was prepared by the reverse sequential impregnation method (V was loaded first step and then Ga). All three catalysts showed higher catalytic activity than the bare V(2)/SiO2 catalyst (Table 2 ), but the activity depended on the preparation method. The V(2)/Ga(0.5)/SiO2 catalyst showed the highest activity, and the activity of the V(2)+Ga(0.5)/SiO2 catalyst was almost the same as that of the Ga(0.5)/V(2)/SiO2 catalyst. The relatively low activity of the latter two catalysts was probably due to coverage of portions of the surface of the VO x species by the Ga2O3 promoter. The results of these experiments also suggest that the active sites of the V/Ga/SiO2 catalyst were surface VO x species and that the Ga2O3 promoter improved their properties, such as their dispersion and redox activity. Eventually, the V(2)/Ga(0.3)/SiO2 catalyst showed the highest HCHO yield (1.10%) among the catalysts examined. This value was 2.1 times that over the bare V/SiO2 catalyst (0.53%). 3.3 Kinetics of partial oxidation catalyzed by V(2)/Ga(0.3)/SiO2 To clarify the role of the Ga2O3 promoter, we studied the kinetics of reactions catalyzed by V(2)/Ga(0.3)/SiO2 (Table 3 and Figs. 3–5 ). First, we examined the effects of CH4 concentration on CH4 conversion rate and product selectivity when the other reaction conditions were kept constant (reaction temperature, 590 °C; total flow rate, 100 mL min−1; 20% O2; catalyst weight, 0.10 g). The CH4 conversion rate increased linearly with increasing CH4 concentration, suggesting that the reaction order with respect to CH4 was 1.0 (Fig. 3A). This result is consistent with previously reported results for VO x /SiO2 and VO x /mesoporous SiO2 catalysts [5,14,22,27,28]. The product selectivity was independent of CH4 concentration and was nearly constant in the CH4 concentration range of 20–50% (Fig. 3B). This result is reasonable because CH4 conversion was essentially unchanged in this concentration range (Table 3, entries 1–6). Next, we examined the effects of O2 concentration on CH4 conversion rate and product selectivity. We found that the CH4 conversion rate increased at O2 concentrations of <10% and then decreased as the concentration was increased further (Fig. 4A and Table 3, entries 7–12). The reaction order was estimated to be 0.5 at low O2 concentrations (<10%) and −0.7 at high O2 concentrations (>10%). This result differs from previously reported results for VO x /SiO2 and VO x /mesoporous SiO2 catalysts; that is, the CH4 conversion rates over these catalysts remain almost unchanged when the O2 concentration is increased, and the reaction order with respect to O2 is 0–0.3 [5,14,22,27,28]. The mechanism of the oxidation of CH4 to HCHO over VO x /SiO2 is generally accepted to involve initial oxidation of CH4 by the lattice oxygen atoms of active VO x species followed by replenishment of the lattice oxygen by O2. This replenishment is very fast, and the rate-determining step of this reaction is the activation of CH4 by active oxygen species [5]. Therefore, variation of the CH4 conversion rate with O2 concentration over VO x /SiO2 catalysts is typically minimal. However, we found that the activity of the V/Ga/SiO2 catalyst depended strongly on O2 concentration (Fig. 4A). It is particularly surprising that at high O2 concentrations, the reaction order was negative despite the fact that the reaction was an oxidative one. We suggest that the Ga2O3 promoter may have changed the adsorption behavior of reactants at the active sites. That is, Ga2O3 may have excessively promoted the adsorption of O2 and inhibited CH4 adsorption, resulting in the decrease of catalytic activity at high O2 concentrations. Another possibility is that O2 concentration may have influenced the electronic state of Ga2O3. At an O2 concentration of around 10%, the electronic state of Ga2O3 may be optimal for producing the maximum promotional effect. In contrast, O2 concentration had little influence on product selectivity (Fig. 4B), although the HCHO selectivity was slightly lower and the CO selectivity slightly higher when the CH4 conversion rate was high. This behavior was attributed to promotion of HCHO oxidation at higher CH4 conversion rates, as mentioned above. We also examined the effects of temperature on CH4 oxidation reactions over V(2)/SiO2 and V(2)/Ga(0.3)/SiO2. For both catalysts, CH4 conversion increased, HCHO selectivity decreased, and HCHO yield increased as the reaction temperature was increased (Fig. 5 and Table 3, entries 13–17). HCHO selectivity decreased by about 60% at the temperature rise of 35–38 °C. This is because oxidation of HCHO was promoted at higher CH4 conversion rates. However, the HCHO yield over the V(2)/Ga(0.3)/SiO2 catalyst was much higher than that over the V(2)/SiO2 catalyst. For example, the HCHO yield over V(2)/Ga(0.3)/SiO2 was 1.22% at 597 °C, whereas that over V(2)/SiO2 was 0.68% at 628 °C. We also evaluated the relationship between HCHO selectivity and CH4 conversion (Fig. 6 ) and found that the V(2)/Ga(0.3)/SiO2 catalyst exhibited higher HCHO selectivity than the V(2)/SiO2 catalyst at the same CH4 conversion. This result clearly shows that Ga2O3 improved HCHO selectivity as well as CH4 conversion. Arrhenius plots showed linear relationships for both catalysts in the examined temperature range (Fig. 7 ), and the activation energy for the reaction over the V(2)/SiO2 catalyst was calculated to be 274 kJ mol−1, which is similar to previously reported values for reactions over VO x /SiO2 and VOx/mesoporous SiO2 catalysts (227–281 kJ mol−1) [5,14,22,27]. However, the activation energy over the V(2)/Ga(0.3)/SiO2 catalyst (350 kJ mol−1) differed from that over the bare V(2)/SiO2 catalyst, which clearly shows that Ga2O3 altered the properties of the active sites. 3.4 Characterization of V/Ga/SiO2 catalysts and role of the Ga2O3 promoter To gain further insight into the role of Ga2O3, we characterized the V/M/SiO2 catalysts by means of N2 adsorption, XRD, and H2-TPR. BET specific surface areas, pore volumes, and average pore sizes for SiO2, V/SiO2, and V/Ga(1)/SiO2 are listed in Table 4 . All three parameters tended to decrease with increasing V loading. In particular, the BET specific surface area decreased considerably when the V loading was increased from 2 to 5 wt%, probably because aggregated VO x particles blocked the entrances to the pores of the SiO2 support. In contrast, the pore structures of the V/SiO2 catalysts were essentially the same before and after addition of Ga2O3, indicating that the promoter had little influence on the mass transfer of the reactants and products. In other words, the promoter mainly influenced the structure of the active VO x species. We also measured the BET specific surface areas, pore volumes, and average pore sizes of the Ga(0.5)-modified V(2)/SiO2 catalysts, which were prepared by three different method (Table S1). BET specific surface of the Ga(0.5)/V(2)/SiO2 catalyst was a little lower than that of the V(2)/Ga(0.5)/SiO2 and V(2)+Ga(0.5)/SiO2 catalysts. Among the catalysts listed in Table 1, V(5)/SiO2 and seven of the V(5)/M(1)/SiO2 catalysts (M = Ga, Y, Al, Zr, La, Mg, Ca) were subjected to XRD analysis (Fig. 8 ). As mentioned above, the activities of these V(5)/M(1)/SiO2 catalysts and the bare catalyst decreased in the following order: Ga > Y > Al > Zr > La > bare > Mg > Ca. The XRD patterns of V/Ga/SiO2, V/SiO2, V/Mg/SiO2, and V/Ca/SiO2 showed only a broad peak characteristic of amorphous SiO2, indicating that both the VO x species and the promoter were highly dispersed on the SiO2 support. The XRD pattern of the V/La/SiO2 catalyst showed peaks for La2O3, although no peaks for V compounds were observed. In the XRD patterns of V/Y/SiO2, V/Al/SiO2, and V/Zr/SiO2, peaks for V compounds such as VO2 and V2O5 were observed, suggesting that the dispersions of VO x species over these three catalysts were lower than that over the other V/M/SiO2 catalysts. The XRD results show that the addition of a small amount of a metal oxide promoter had a large influence on the dispersion of VO x species. It is interesting to note that the highly active catalysts, such as V/Y/SiO2 and V/Al/SiO2, had aggregated VO x particles, whereas catalysts with low activity, such as V/Mg/SiO2 and V/Ca/SiO2, had highly dispersed VO x species. This result seems inconsistent with the general consensus that the active sites of VO x /SiO2 catalysts for partial oxidation of CH4 are highly dispersed VO x species [5–7]. This inconsistency suggests that other factors influenced the catalytic activity. The H2-TPR profiles of the V(5)/M(1)/SiO2 and V(2)/Ga/SiO2 catalysts are shown in Fig. 9 . The peak shapes and positions varied considerably depending on the type of additive and its loading. In the H2 profiles of the V(5)/SiO2 catalysts, an intense main peak was observed at approximately 510 °C, and small shoulder peaks were observed at 550–750 °C (Fig. 9A). It is generally accepted that the main peak originates from the reduction of highly dispersed monomeric and/or low-oligomeric VO x species and that the shoulder peaks at the higher temperature side are due to the reduction of polymeric VO x species [13,14,16,22,24,29,30]. The positions of the main peak for the V/SiO2 catalysts modified with Y2O3, ZrO2, and La2O3 were almost the same as that for the bare V/SiO2 catalyst. However, the positions of the peak for the V/Ga/SiO2 and V/Al/SiO2 catalysts were observed at lower temperature than that for the bare V/SiO2 catalyst. This difference indicates that Ga2O3 and Al2O3 promoted the reduction of active VO x species. Furthermore, in the H2-TPR profiles of the V(2)/Ga/SiO2 catalysts, the position of the main reduction peak shifted to lower temperature with increasing Ga loading (Fig. 9B). In contrast, the addition of MgO or CaO shifted the main peak to higher temperature, indicating that MgO and CaO hampered reduction of the active VO x species. H2-TPR profiles of VO x /SiO2 catalysts can also be used to estimate the dispersion of VO x species. The calculation of VO x dispersion using H2-TPR was proposed by Koranne et al. in 1994 [29] and has been used in various research papers [10,13,22,31]. In this method, VO x dispersion can be easily calculated by dividing the area of the low-temperature peak corresponding to the highly dispersed VO x species by the total area of the H2-TPR profile. Furthermore, it was confirmed that VO x dispersion measured by H2-TPR well consisted with that measured by other techniques such as high temperature oxygen chemisorption [13,29]. In this way, the dispersions of VO x species for the V(5)/M(1)/SiO2 catalysts were estimated to be 57–83% (Table 1). The VO x dispersions of the V(5)/SiO2 catalysts modified with Y2O3, Al2O3, and ZrO2 were lower than that of the bare V(5)/SiO2 catalyst. This difference is consistent with the XRD results (Fig. 8). In contrast, the VO x dispersions of the V(5)/SiO2 catalysts modified with Ga2O3, La2O3, MgO, and CaO were higher than that of the bare V(5)/SiO2 catalyst. The VO x dispersions of the V(2)/Ga/SiO2 (Ga loading, 0–1 wt%) catalysts were calculated to be 76–85% and did not vary with Ga loading. The H2-TPR results show that Ga2O3 improved both the dispersion and the reducibility of the active VO x species. We also measured the H2-TPR profiles of the Ga(0.5)-modified V(2)/SiO2 catalysts, which were prepared by three different method. The preparation method influenced the reducibility and dispersion of active VO x species (Fig. S1 and Table S1). VO x dispersion of the Ga(0.5)/V(2)/SiO2 catalyst was obviously lower than that of the V(2)/Ga(0.5)/SiO2 and V(2)+Ga(0.5)/SiO2 catalysts. We will now discuss the relationship between the structure of the active VO x species and the activity of the V/M/SiO2 catalyst, on the basis of the H2-TPR results. CH4 conversion over the V(5)/M(1)/SiO2 catalyst was plotted against the temperature for reduction of the highly dispersed VO x species, which was estimated from the peak top temperature in the H2-TPR profile (Fig. 9A). CH4 conversion tended to increase with decreasing reduction temperature (Fig. 10 A). A plot of CH4 conversion against VO x dispersion (Fig. 10B) shows no clear correlation. Therefore, we suggest that the high activity of the V/Ga/SiO2 catalyst can be attributed to an increase in the reducibility of active VO x species rather than to the enhancement of VO x dispersion. As described above, the mechanism of the oxidation of CH4 to HCHO over VO x /SiO2 involves oxidation of CH4 by the lattice oxygen atoms of active VO x species and subsequent oxidation of the reduced VO x species by O2 in the next step. Addition of Ga2O3 likely enhanced the reactivity of the lattice oxygen atoms of the active VO x species and promoted CH4 oxidation in the first step, resulting in the high overall catalytic activity. Further studies are now being carried out in our laboratory to clarify the role of the Ga2O3 promoter and to prepare more-active V/Ga/SiO2 catalysts. 4 Conclusions The effects of promoter addition on the performance of a VO x /SiO2 catalyst for the oxidation of CH4 to HCHO by O2 were studied. Fourteen types of metal oxides (MO x , M = Ga, In, Y, Al, Bi, Zr, La, Zn, W, Mg, Mo, Ti, Ce, and Ca) were employed as promoters. Of these, Ga2O3, In2O3, Y2O3, and Al2O3 markedly increased CH4 conversion and HCHO yield, whereas MgO, MoO x , TiO2, CeO2, and CaO decreased the catalytic activity. Catalytic activity was also influenced by the loading of the promoter and the method by which it was added to the catalyst; a catalyst prepared by the sequential impregnation method (promoter loaded first and then V) showed higher activity than catalysts prepared by co-impregnation and reverse sequential impregnation (V loaded first and then the promoter). The optimum promoter loading was as low as 0.1–0.5 wt%. These results indicate that promoters should be deposited in such a way that they do not cover the surface of the active VO x species. The HCHO yield obtained with the best catalyst, V(2–3 wt%)/Ga(0.1–0.5 wt%)/SiO2, was 2.1 times that obtained with bare VO x /SiO2 under the standard reaction conditions (reaction temperature, 590 °C; gas hourly space velocity, 60,000 L kg−1 h−1; CH4/O2 ratio, 2). Kinetics studies and characterization of the catalysts suggest that Ga2O3 increased the reducibility of the active VO x species without reducing their dispersion, resulting in the high catalytic activity of the V/Ga/SiO2 catalyst. Acknowledgements This research did not receive any specific grant from funding agencies in the public, commercial, or not-for-profit sectors. Appendix A Supplementary data Supplementary material related to this article can be found, in the online version, at doi:https://doi.org/10.1016/j.apcata.2019.03.014. Appendix A Supplementary data The following is Supplementary data to this article: References [1] R. Horn R. Schlögl Catal. Lett. 145 2015 23 39 [2] M. Gharibi F.T. Zangeneh F. Yaripour S. Sahebdelfar Appl. Catal. A Gen. 443–444 2012 8 26 [3] M. Silva Fuel Process. Technol. 145 2016 42 61 [4] K. Otsuka Y. Wang Appl. Catal. A Gen. 222 2001 145 161 [5] F. Arena A. Parmaliana Acc. Chem. Res. 36 2003 867 875 [6] Z. Guo B. Liu Q. Zhang W. Deng Y. Wang Y. Yang Chem. Soc. Rev. 43 2014 3480 3524 [7] E.V. Kondratenko T. Peppel D. Seeburg V.A. Kondratenko N. Kalevaru A. Martin S. Wohlrab Catal. Sci. Technol. 7 2017 366 381 [8] P. Tang Q. Zhu Z. Wu D. Ma Energy Environ. Sci. 7 2014 2580 2591 [9] J.J. Spivey G. Hutchings Chem. Soc. Rev. 43 2014 792 803 [10] M.M. Koranne J.G. Goodwin Jr. G. Marcelin J. Catal. 148 1994 388 391 [11] A. Parmaliana F. Arena J. Catal. 167 1997 57 65 [12] Q. Sun J. Jehng H. Hu R.G. Herman I.E. Wachs K. Klier J. Catal. 165 1997 91 101 [13] F. Arena N. Giordano A. Parmaliana J. Catal. 167 1997 66 76 [14] H. Berndt A. Martin A. Brückner E. Schreier D. Müller H. Kosslick G.-U. Wolf B. Lücke J. Catal. 191 2000 384 400 [15] B. Lin X. Wang Q. Guo W. Yang Q. Zhang Y. Wang Chem. Lett. 32 2003 860 861 [16] V. Fornés C. López H.H. López A. Martínez Appl. Catal. A Gen. 249 2003 345 354 [17] P. Wallis S. Wohlrab V.N. Kalevaru M. Frank A. Martin Catal. Today 278 2016 120 126 [18] C. Wang R.G. Herman C. Shi Q. Sun J.E. Roberts Appl. Catal. A Gen. 247 2003 321 333 [19] Q. Zhang W. Yang X. Wang Y. Wang T. Shishido K. Takehira Microporous Mesoporous Mater. 77 2005 223 234 [20] G. Du S. Lim Y. Yang C. Wang L. Pfefferle G.L. Haller Appl. Catal. A Gen. 302 2006 48 61 [21] D.A. Ruddy N.L. Ohler A.T. Bell T.D. Tilley J. Catal. 238 2006 277 285 [22] L.D. Nguyen S. Loridant H. Launay A. Pigamo J.L. Dubois J.M.M. Millet J. Catal. 237 2006 38 48 [23] C. Pirovano E. Schönborn S. Wohlrab V.N. Kalevaru A. Martin Catal. Today 192 2012 20 27 [24] C.V. Loricera M.C. Alvarez-Galvan R. Guil-Lopez A.A. Ismail S.A. Al-Sayari J.L.G. Fierro Top. Catal. 60 2017 1129 1139 [25] T.T.H. Dang D. Seeburg J. Radnik C. Kreyenschulte H. Atia T.T.H. Vu S. Wohlrab Catal. Commun. 103 2018 56 59 [26] P. Wallis E. Schönborn V.N. Kalevaru A. Martin S. Wohlrab RSC Adv. 5 2015 69509 69513 [27] N.D. Spencer C.J. Pereira J. Catal. 116 1989 399 406 [28] R.L. McCormick M.B. Al-Sahali G.O. Alptekin Appl. Catal. A Gen. 226 2002 129 138 [29] M.M. Koranne J.G. Goodwin Jr. G. Marcelin J. Catal. 148 1994 369 377 [30] V. Sokolovskii F. Arena S. Coluccia A. Parmaliana J. Catal. 173 1998 238 242 [31] H. Launay S. Loridant A. Pigamo J.L. Dubois J.M.M. Millet J. Catal. 246 2007 390 398",
      "scopus-id": "85063324063",
      "coredata": {
        "eid": "1-s2.0-S0926860X19301292",
        "dc:description": "The effects of promoters on the performance of a VO x /SiO2 catalyst were investigated with the goal of increasing its catalytic activity for the oxidation of methane to formaldehyde. Fourteen types of metal oxides (MO x , M = Ga, In, Y, Al, Bi, Zr, La, Zn, W, Mg, Mo, Ti, Ce, and Ca) were tested as promoters. Among them, Ga2O3, In2O3, Y2O3, and Al2O3 substantially increased the methane conversion rate and the formaldehyde yield, whereas MgO, MoO x , TiO2, CeO2, and CaO were less effective as promoters. The catalytic activity also depended on the amount of the promoter and the method by which it was loaded onto the support. The highest activity was obtained over VO x /Ga2O3/SiO2 (V loading, 2–3 wt%; Ga loading, 0.1–0.5 wt%) prepared by a sequential impregnation method (Ga loaded first and then V): under the standard reaction conditions (reaction temperature, 590 °C; gas hourly space velocity, 60,000 L kg−1 h−1; CH4/O2 ratio, 2), the formaldehyde yield over this catalyst was 2.1 times that over bare VO x /SiO2. Reactions over the VO x /Ga2O3/SiO2 catalyst and the bare VO x /SiO2 catalyst showed different kinetics, indicating that Ga2O3 altered the properties of the active VO x sites. Catalyst characterization by means of X-ray diffraction and temperature-programmed reduction under H2 suggested that the high activity of VO x /Ga2O3/SiO2 was due to the promoter’s having increased the reducibility of the active VO x species without decreasing their dispersion.",
        "openArchiveArticle": "false",
        "prism:coverDate": "2019-05-05",
        "openaccessUserLicense": null,
        "prism:aggregationType": "Journal",
        "prism:url": "https://api.elsevier.com/content/article/pii/S0926860X19301292",
        "dc:creator": [
          {
            "@_fa": "true",
            "$": "Shimura, Katsuya"
          },
          {
            "@_fa": "true",
            "$": "Fujitani, Tadahiro"
          }
        ],
        "link": [
          {
            "@_fa": "true",
            "@rel": "self",
            "@href": "https://api.elsevier.com/content/article/pii/S0926860X19301292"
          },
          {
            "@_fa": "true",
            "@rel": "scidir",
            "@href": "https://www.sciencedirect.com/science/article/pii/S0926860X19301292"
          }
        ],
        "dc:format": "application/json",
        "openaccessType": null,
        "pii": "S0926-860X(19)30129-2",
        "prism:volume": "577",
        "prism:publisher": "Elsevier B.V.",
        "dc:title": "Effects of promoters on the performance of a VO x /SiO2 catalyst for the oxidation of methane to formaldehyde",
        "prism:copyright": "© 2019 Elsevier B.V. All rights reserved.",
        "openaccess": "0",
        "prism:issn": "0926860X",
        "dcterms:subject": [
          {
            "@_fa": "true",
            "$": "Methane"
          },
          {
            "@_fa": "true",
            "$": "Partial oxidation"
          },
          {
            "@_fa": "true",
            "$": "Formaldehyde synthesis"
          },
          {
            "@_fa": "true",
            "$": "Vanadium oxide catalyst"
          },
          {
            "@_fa": "true",
            "$": "Promoter"
          }
        ],
        "openaccessArticle": "false",
        "prism:publicationName": "Applied Catalysis A: General",
        "openaccessSponsorType": null,
        "prism:pageRange": "44-51",
        "prism:endingPage": "51",
        "pubType": "fla",
        "prism:coverDisplayDate": "5 May 2019",
        "prism:doi": "10.1016/j.apcata.2019.03.014",
        "prism:startingPage": "44",
        "dc:identifier": "doi:10.1016/j.apcata.2019.03.014",
        "openaccessSponsorName": null
      },
      "objects": {
        "object": [
          {
            "@category": "thumbnail",
            "@height": "164",
            "@width": "190",
            "@_fa": "true",
            "$": "https://api.elsevier.com/content/object/eid/1-s2.0-S0926860X19301292-ga1.sml?httpAccept=%2A%2F%2A",
            "@multimediatype": "GIF image file",
            "@type": "IMAGE-THUMBNAIL",
            "@size": "7678",
            "@ref": "ga1",
            "@mimetype": "image/gif"
          },
          {
            "@category": "thumbnail",
            "@height": "141",
            "@width": "219",
            "@_fa": "true",
            "$": "https://api.elsevier.com/content/object/eid/1-s2.0-S0926860X19301292-gr1.sml?httpAccept=%2A%2F%2A",
            "@multimediatype": "GIF image file",
            "@type": "IMAGE-THUMBNAIL",
            "@size": "6917",
            "@ref": "gr1",
            "@mimetype": "image/gif"
          },
          {
            "@category": "thumbnail",
            "@height": "163",
            "@width": "98",
            "@_fa": "true",
            "$": "https://api.elsevier.com/content/object/eid/1-s2.0-S0926860X19301292-gr10.sml?httpAccept=%2A%2F%2A",
            "@multimediatype": "GIF image file",
            "@type": "IMAGE-THUMBNAIL",
            "@size": "3787",
            "@ref": "gr10",
            "@mimetype": "image/gif"
          },
          {
            "@category": "thumbnail",
            "@height": "141",
            "@width": "219",
            "@_fa": "true",
            "$": "https://api.elsevier.com/content/object/eid/1-s2.0-S0926860X19301292-gr2.sml?httpAccept=%2A%2F%2A",
            "@multimediatype": "GIF image file",
            "@type": "IMAGE-THUMBNAIL",
            "@size": "5943",
            "@ref": "gr2",
            "@mimetype": "image/gif"
          },
          {
            "@category": "thumbnail",
            "@height": "163",
            "@width": "103",
            "@_fa": "true",
            "$": "https://api.elsevier.com/content/object/eid/1-s2.0-S0926860X19301292-gr3.sml?httpAccept=%2A%2F%2A",
            "@multimediatype": "GIF image file",
            "@type": "IMAGE-THUMBNAIL",
            "@size": "4034",
            "@ref": "gr3",
            "@mimetype": "image/gif"
          },
          {
            "@category": "thumbnail",
            "@height": "164",
            "@width": "103",
            "@_fa": "true",
            "$": "https://api.elsevier.com/content/object/eid/1-s2.0-S0926860X19301292-gr4.sml?httpAccept=%2A%2F%2A",
            "@multimediatype": "GIF image file",
            "@type": "IMAGE-THUMBNAIL",
            "@size": "4069",
            "@ref": "gr4",
            "@mimetype": "image/gif"
          },
          {
            "@category": "thumbnail",
            "@height": "138",
            "@width": "219",
            "@_fa": "true",
            "$": "https://api.elsevier.com/content/object/eid/1-s2.0-S0926860X19301292-gr5.sml?httpAccept=%2A%2F%2A",
            "@multimediatype": "GIF image file",
            "@type": "IMAGE-THUMBNAIL",
            "@size": "7128",
            "@ref": "gr5",
            "@mimetype": "image/gif"
          },
          {
            "@category": "thumbnail",
            "@height": "164",
            "@width": "208",
            "@_fa": "true",
            "$": "https://api.elsevier.com/content/object/eid/1-s2.0-S0926860X19301292-gr6.sml?httpAccept=%2A%2F%2A",
            "@multimediatype": "GIF image file",
            "@type": "IMAGE-THUMBNAIL",
            "@size": "5537",
            "@ref": "gr6",
            "@mimetype": "image/gif"
          },
          {
            "@category": "thumbnail",
            "@height": "163",
            "@width": "208",
            "@_fa": "true",
            "$": "https://api.elsevier.com/content/object/eid/1-s2.0-S0926860X19301292-gr7.sml?httpAccept=%2A%2F%2A",
            "@multimediatype": "GIF image file",
            "@type": "IMAGE-THUMBNAIL",
            "@size": "5579",
            "@ref": "gr7",
            "@mimetype": "image/gif"
          },
          {
            "@category": "thumbnail",
            "@height": "163",
            "@width": "113",
            "@_fa": "true",
            "$": "https://api.elsevier.com/content/object/eid/1-s2.0-S0926860X19301292-gr8.sml?httpAccept=%2A%2F%2A",
            "@multimediatype": "GIF image file",
            "@type": "IMAGE-THUMBNAIL",
            "@size": "6581",
            "@ref": "gr8",
            "@mimetype": "image/gif"
          },
          {
            "@category": "thumbnail",
            "@height": "164",
            "@width": "68",
            "@_fa": "true",
            "$": "https://api.elsevier.com/content/object/eid/1-s2.0-S0926860X19301292-gr9.sml?httpAccept=%2A%2F%2A",
            "@multimediatype": "GIF image file",
            "@type": "IMAGE-THUMBNAIL",
            "@size": "4160",
            "@ref": "gr9",
            "@mimetype": "image/gif"
          },
          {
            "@category": "standard",
            "@height": "200",
            "@width": "232",
            "@_fa": "true",
            "$": "https://api.elsevier.com/content/object/eid/1-s2.0-S0926860X19301292-ga1.jpg?httpAccept=%2A%2F%2A",
            "@multimediatype": "JPEG image file",
            "@type": "IMAGE-DOWNSAMPLED",
            "@size": "14160",
            "@ref": "ga1",
            "@mimetype": "image/jpeg"
          },
          {
            "@category": "standard",
            "@height": "182",
            "@width": "282",
            "@_fa": "true",
            "$": "https://api.elsevier.com/content/object/eid/1-s2.0-S0926860X19301292-gr1.jpg?httpAccept=%2A%2F%2A",
            "@multimediatype": "JPEG image file",
            "@type": "IMAGE-DOWNSAMPLED",
            "@size": "14907",
            "@ref": "gr1",
            "@mimetype": "image/jpeg"
          },
          {
            "@category": "standard",
            "@height": "470",
            "@width": "282",
            "@_fa": "true",
            "$": "https://api.elsevier.com/content/object/eid/1-s2.0-S0926860X19301292-gr10.jpg?httpAccept=%2A%2F%2A",
            "@multimediatype": "JPEG image file",
            "@type": "IMAGE-DOWNSAMPLED",
            "@size": "25048",
            "@ref": "gr10",
            "@mimetype": "image/jpeg"
          },
          {
            "@category": "standard",
            "@height": "182",
            "@width": "282",
            "@_fa": "true",
            "$": "https://api.elsevier.com/content/object/eid/1-s2.0-S0926860X19301292-gr2.jpg?httpAccept=%2A%2F%2A",
            "@multimediatype": "JPEG image file",
            "@type": "IMAGE-DOWNSAMPLED",
            "@size": "13323",
            "@ref": "gr2",
            "@mimetype": "image/jpeg"
          },
          {
            "@category": "standard",
            "@height": "447",
            "@width": "282",
            "@_fa": "true",
            "$": "https://api.elsevier.com/content/object/eid/1-s2.0-S0926860X19301292-gr3.jpg?httpAccept=%2A%2F%2A",
            "@multimediatype": "JPEG image file",
            "@type": "IMAGE-DOWNSAMPLED",
            "@size": "24377",
            "@ref": "gr3",
            "@mimetype": "image/jpeg"
          },
          {
            "@category": "standard",
            "@height": "449",
            "@width": "282",
            "@_fa": "true",
            "$": "https://api.elsevier.com/content/object/eid/1-s2.0-S0926860X19301292-gr4.jpg?httpAccept=%2A%2F%2A",
            "@multimediatype": "JPEG image file",
            "@type": "IMAGE-DOWNSAMPLED",
            "@size": "25065",
            "@ref": "gr4",
            "@mimetype": "image/jpeg"
          },
          {
            "@category": "standard",
            "@height": "178",
            "@width": "282",
            "@_fa": "true",
            "$": "https://api.elsevier.com/content/object/eid/1-s2.0-S0926860X19301292-gr5.jpg?httpAccept=%2A%2F%2A",
            "@multimediatype": "JPEG image file",
            "@type": "IMAGE-DOWNSAMPLED",
            "@size": "15661",
            "@ref": "gr5",
            "@mimetype": "image/jpeg"
          },
          {
            "@category": "standard",
            "@height": "222",
            "@width": "282",
            "@_fa": "true",
            "$": "https://api.elsevier.com/content/object/eid/1-s2.0-S0926860X19301292-gr6.jpg?httpAccept=%2A%2F%2A",
            "@multimediatype": "JPEG image file",
            "@type": "IMAGE-DOWNSAMPLED",
            "@size": "13870",
            "@ref": "gr6",
            "@mimetype": "image/jpeg"
          },
          {
            "@category": "standard",
            "@height": "222",
            "@width": "282",
            "@_fa": "true",
            "$": "https://api.elsevier.com/content/object/eid/1-s2.0-S0926860X19301292-gr7.jpg?httpAccept=%2A%2F%2A",
            "@multimediatype": "JPEG image file",
            "@type": "IMAGE-DOWNSAMPLED",
            "@size": "13678",
            "@ref": "gr7",
            "@mimetype": "image/jpeg"
          },
          {
            "@category": "standard",
            "@height": "407",
            "@width": "282",
            "@_fa": "true",
            "$": "https://api.elsevier.com/content/object/eid/1-s2.0-S0926860X19301292-gr8.jpg?httpAccept=%2A%2F%2A",
            "@multimediatype": "JPEG image file",
            "@type": "IMAGE-DOWNSAMPLED",
            "@size": "38823",
            "@ref": "gr8",
            "@mimetype": "image/jpeg"
          },
          {
            "@category": "standard",
            "@height": "679",
            "@width": "282",
            "@_fa": "true",
            "$": "https://api.elsevier.com/content/object/eid/1-s2.0-S0926860X19301292-gr9.jpg?httpAccept=%2A%2F%2A",
            "@multimediatype": "JPEG image file",
            "@type": "IMAGE-DOWNSAMPLED",
            "@size": "51714",
            "@ref": "gr9",
            "@mimetype": "image/jpeg"
          },
          {
            "@category": "high",
            "@height": "886",
            "@width": "1029",
            "@_fa": "true",
            "$": "https://api.elsevier.com/content/object/eid/1-s2.0-S0926860X19301292-ga1_lrg.jpg?httpAccept=%2A%2F%2A",
            "@multimediatype": "JPEG image file",
            "@type": "IMAGE-HIGH-RES",
            "@size": "98476",
            "@ref": "ga1",
            "@mimetype": "image/jpeg"
          },
          {
            "@category": "high",
            "@height": "807",
            "@width": "1250",
            "@_fa": "true",
            "$": "https://api.elsevier.com/content/object/eid/1-s2.0-S0926860X19301292-gr1_lrg.jpg?httpAccept=%2A%2F%2A",
            "@multimediatype": "JPEG image file",
            "@type": "IMAGE-HIGH-RES",
            "@size": "107135",
            "@ref": "gr1",
            "@mimetype": "image/jpeg"
          },
          {
            "@category": "high",
            "@height": "2083",
            "@width": "1250",
            "@_fa": "true",
            "$": "https://api.elsevier.com/content/object/eid/1-s2.0-S0926860X19301292-gr10_lrg.jpg?httpAccept=%2A%2F%2A",
            "@multimediatype": "JPEG image file",
            "@type": "IMAGE-HIGH-RES",
            "@size": "176111",
            "@ref": "gr10",
            "@mimetype": "image/jpeg"
          },
          {
            "@category": "high",
            "@height": "807",
            "@width": "1250",
            "@_fa": "true",
            "$": "https://api.elsevier.com/content/object/eid/1-s2.0-S0926860X19301292-gr2_lrg.jpg?httpAccept=%2A%2F%2A",
            "@multimediatype": "JPEG image file",
            "@type": "IMAGE-HIGH-RES",
            "@size": "94522",
            "@ref": "gr2",
            "@mimetype": "image/jpeg"
          },
          {
            "@category": "high",
            "@height": "1980",
            "@width": "1250",
            "@_fa": "true",
            "$": "https://api.elsevier.com/content/object/eid/1-s2.0-S0926860X19301292-gr3_lrg.jpg?httpAccept=%2A%2F%2A",
            "@multimediatype": "JPEG image file",
            "@type": "IMAGE-HIGH-RES",
            "@size": "170751",
            "@ref": "gr3",
            "@mimetype": "image/jpeg"
          },
          {
            "@category": "high",
            "@height": "1991",
            "@width": "1250",
            "@_fa": "true",
            "$": "https://api.elsevier.com/content/object/eid/1-s2.0-S0926860X19301292-gr4_lrg.jpg?httpAccept=%2A%2F%2A",
            "@multimediatype": "JPEG image file",
            "@type": "IMAGE-HIGH-RES",
            "@size": "172258",
            "@ref": "gr4",
            "@mimetype": "image/jpeg"
          },
          {
            "@category": "high",
            "@height": "789",
            "@width": "1250",
            "@_fa": "true",
            "$": "https://api.elsevier.com/content/object/eid/1-s2.0-S0926860X19301292-gr5_lrg.jpg?httpAccept=%2A%2F%2A",
            "@multimediatype": "JPEG image file",
            "@type": "IMAGE-HIGH-RES",
            "@size": "114995",
            "@ref": "gr5",
            "@mimetype": "image/jpeg"
          },
          {
            "@category": "high",
            "@height": "987",
            "@width": "1252",
            "@_fa": "true",
            "$": "https://api.elsevier.com/content/object/eid/1-s2.0-S0926860X19301292-gr6_lrg.jpg?httpAccept=%2A%2F%2A",
            "@multimediatype": "JPEG image file",
            "@type": "IMAGE-HIGH-RES",
            "@size": "95054",
            "@ref": "gr6",
            "@mimetype": "image/jpeg"
          },
          {
            "@category": "high",
            "@height": "984",
            "@width": "1252",
            "@_fa": "true",
            "$": "https://api.elsevier.com/content/object/eid/1-s2.0-S0926860X19301292-gr7_lrg.jpg?httpAccept=%2A%2F%2A",
            "@multimediatype": "JPEG image file",
            "@type": "IMAGE-HIGH-RES",
            "@size": "96343",
            "@ref": "gr7",
            "@mimetype": "image/jpeg"
          },
          {
            "@category": "high",
            "@height": "1803",
            "@width": "1250",
            "@_fa": "true",
            "$": "https://api.elsevier.com/content/object/eid/1-s2.0-S0926860X19301292-gr8_lrg.jpg?httpAccept=%2A%2F%2A",
            "@multimediatype": "JPEG image file",
            "@type": "IMAGE-HIGH-RES",
            "@size": "308601",
            "@ref": "gr8",
            "@mimetype": "image/jpeg"
          },
          {
            "@category": "high",
            "@height": "3010",
            "@width": "1250",
            "@_fa": "true",
            "$": "https://api.elsevier.com/content/object/eid/1-s2.0-S0926860X19301292-gr9_lrg.jpg?httpAccept=%2A%2F%2A",
            "@multimediatype": "JPEG image file",
            "@type": "IMAGE-HIGH-RES",
            "@size": "382743",
            "@ref": "gr9",
            "@mimetype": "image/jpeg"
          },
          {
            "@category": "standard",
            "@_fa": "true",
            "$": "https://api.elsevier.com/content/object/eid/1-s2.0-S0926860X19301292-mmc1.docx?httpAccept=%2A%2F%2A",
            "@multimediatype": "Microsoft Word file",
            "@type": "APPLICATION",
            "@size": "147032",
            "@ref": "mmc1",
            "@mimetype": "application/word"
          },
          {
            "@category": "standard",
            "@_fa": "true",
            "$": "https://api.elsevier.com/content/object/eid/1-s2.0-S0926860X19301292-am.pdf?httpAccept=%2A%2F%2A",
            "@multimediatype": "Acrobat PDF file",
            "@type": "AAM-PDF",
            "@size": "406636",
            "@ref": "am",
            "@mimetype": "application/pdf"
          }
        ]
      },
      "link": {
        "@rel": "abstract",
        "@href": "https://api.elsevier.com/content/abstract/scopus_id/85063324063"
      }
    }
  }
}