{
  "metadata": {
    "title": "Highly ordered mesoporous MnO<ce:inf loc=post>x</ce:inf> catalyst for the NH<ce:inf loc=post>3</ce:inf>-SCR of NO<ce:inf loc=post>x</ce:inf> at low temperatures",
    "authors": "; ; ",
    "journal": "Applied Catalysis A: General",
    "date": "2023-01-05",
    "doi": "10.1016/j.apcata.2022.118966",
    "abstract": "",
    "uri": "https://api.elsevier.com/content/article/pii/S0926860X22004896",
    "pii": "S0926860X22004896"
  },
  "fulltext": {
    "full-text-retrieval-response": {
      "scopus-eid": "2-s2.0-85142756631",
      "originalText": "serial JL 271346 291210 291744 291809 31 Applied Catalysis A: General APPLIEDCATALYSISAGENERAL 2022-11-17 2022-11-17 2022-11-25 2022-11-25 2022-12-14T20:52:52 1-s2.0-S0926860X22004896 S0926-860X(22)00489-6 S0926860X22004896 10.1016/j.apcata.2022.118966 S300 S300.1 FULL-TEXT 1-s2.0-S0926860X22X00203 2024-01-01T12:34:28.416125Z 0 0 20230105 2023 2022-11-17T08:39:35.205968Z absattachment articleinfo articlenumber articletitlenorm authfirstinitialnorm authfirstsurnamenorm cid cids contenttype copyright crossmark dateloaded dateloadedtxt datesearch datesort dateupdated dco docsubtype doctype doi eid ewtransactionid hubeid indexeddate issn issnnorm itemstage itemtransactionid itemweight openaccess openarchive pg pgfirst pii piinorm pubdatestart pubdatetxt pubyr sortorder srctitle srctitlenorm srctype ssids alllist content subj subheadings suppl tomb volfirst volissue volumelist webpdf webpdfpagecount yearnav figure table e-component body mmlmath acknowledge affil appendices articletitle auth authfirstini authfull authkeywords authlast grantnumber grantsponsor grantsponsorid highlightsabst primabst ref specialabst 0926-860X 0926860X true 649 649 C Volume 649 21 118966 118966 118966 20230105 5 January 2023 2023-01-05 2023 article fla © 2022 Elsevier B.V. All rights reserved. HIGHLYORDEREDMESOPOROUSMNOXCATALYSTFORNH3SCRNOXLOWTEMPERATURES XU S 1 Introduction 2 Experimental section 2.1 Catalyst preparation 2.2 Catalyst characterization 2.3 Catalytic performance evaluation 3 Results and discussion 3.1 Catalytic NH3-SCR performance 3.2 XRD, N2 adsorption and Raman analysis 3.3 XPS analysis 3.4 H2-TPR 3.5 NH3-TPD 3.6 In situ DRIFTS study 3.6.1 NH3-adsorption 3.6.2 Adsorption of NO + O2 3.6.3 Reactivity of adsorbed species 4 Conclusions CRediT authorship contribution statement Acknowledgments Appendix A Supplementary material References ZHOU 2021 15472 15478 Z YAO 2014 315 329 X LIU 2006 43 89 Z KIM 2022 118770 D XU 2021 7052 7080 G ZHOU 2022 118796 Q LIU 2014 14500 14508 Z HAN 2019 10916 10976 L YAN 2016 2267 2278 L BUSCA 1998 1 36 G LU 2020 4865 4873 Q MENG 2015 5973 5983 D XUE 2013 56 64 J WANG 2022 134729 C LIU 2022 L LIU 2016 54 69 C TANG 2007 329 334 X TIAN 2011 105 109 W CHEN 2022 118754 R ZHOU 2014 53 63 G XU 2019 122023 S KLEITZ 2003 2136 2137 F LI 2018 924 932 C DENG 2016 5807 5815 S LIU 2020 118731 Z LIU 2021 127833 X GE 2022 122261 Z ZHAO 2019 122100 P CHEN 2018 35878 35887 X ZHANG 2022 116170 W PIREZ 2012 1607 1614 C FENG 2020 16381 16388 J FANG 2013 9199 9207 C SONG 2020 12017 12030 I SALEHIRAD 2021 1453 1461 A GUAYAQUILSOSA 2017 337 348 J ZHANG 2014 1753 1763 L QIAO 2021 118128 T YANG 2020 4394 4401 C HU 2015 6069 6077 H ZHANG 2019 6776 6783 J YAO 2017 208 217 X SHI 2018 1 11 J WANG 2013 253 259 Z KAPTEIJN 1994 173 189 F FANG 2015 23 30 D WANG 2022 134892 X ZHANG 2013 1127 1136 D QIU 2015 2568 2577 M ZHANG 2022 1341 1351 S LIU 2018 289 301 J LIU 2016 1044 1050 Z LIU 2016 6688 6696 Z LIU 2018 526 533 Z WU 2020 118419 X WU 2021 105426 H WANG 2021 222 228 Z ZHANG 2015 2188 2196 L GENG 2021 124223 Y XUX2023X118966 XUX2023X118966XS 2023-11-17T00:00:00.000Z http://www.elsevier.com/open-access/userlicense/1.0/ https://vtw.elsevier.com/content/oragreement/10137 CHU_NIST publishAcceptedManuscriptIndexable 2023-11-17T00:00:00.000Z http://creativecommons.org/licenses/by-nc-nd/4.0/ © 2022 Elsevier B.V. All rights reserved. 2022-12-01T08:54:40.711Z http://vtw.elsevier.com/data/voc/AddOnTypes/50.7/aggregated-refined 0 https://doi.org/10.15223/policy-017 https://doi.org/10.15223/policy-037 https://doi.org/10.15223/policy-012 https://doi.org/10.15223/policy-029 https://doi.org/10.15223/policy-004 item S0926-860X(22)00489-6 S0926860X22004896 1-s2.0-S0926860X22004896 10.1016/j.apcata.2022.118966 271346 2024-01-01T12:34:28.416125Z 2023-01-05 1-s2.0-S0926860X22004896-main.pdf https://s3-eu-west-1.amazonaws.com/prod-ucs-content-store-eu-west/content/pii:S0926860X22004896/MAIN/application/pdf/e8cf2e53467e3d4c213b757b9fdec308/main.pdf main.pdf pdf true 3211794 MAIN 8 1-s2.0-S0926860X22004896-main_1.png https://s3-eu-west-1.amazonaws.com/prod-ucs-content-store-eu-west/content/pii:S0926860X22004896/PREVIEW/image/png/a24b3bf109f38a3c172518ddb13c6d3e/main_1.png main_1.png png 59415 849 656 IMAGE-WEB-PDF 1 1-s2.0-S0926860X22004896-gr7.jpg https://s3-eu-west-1.amazonaws.com/prod-ucs-content-store-eu-west/content/pii:S0926860X22004896/gr7/DOWNSAMPLED/image/jpeg/2dcdc9c140f4e1ca88635d218fc724cb/gr7.jpg gr7 gr7.jpg jpg 40417 443 282 IMAGE-DOWNSAMPLED 1-s2.0-S0926860X22004896-gr6.jpg https://s3-eu-west-1.amazonaws.com/prod-ucs-content-store-eu-west/content/pii:S0926860X22004896/gr6/DOWNSAMPLED/image/jpeg/e2e605838c6d34e1cdde7eb20d02b7a6/gr6.jpg gr6 gr6.jpg jpg 15017 225 282 IMAGE-DOWNSAMPLED 1-s2.0-S0926860X22004896-gr9.jpg https://s3-eu-west-1.amazonaws.com/prod-ucs-content-store-eu-west/content/pii:S0926860X22004896/gr9/DOWNSAMPLED/image/jpeg/90afef17b11f825d68b8ff639b82b20c/gr9.jpg gr9 gr9.jpg jpg 27317 452 282 IMAGE-DOWNSAMPLED 1-s2.0-S0926860X22004896-gr8.jpg https://s3-eu-west-1.amazonaws.com/prod-ucs-content-store-eu-west/content/pii:S0926860X22004896/gr8/DOWNSAMPLED/image/jpeg/055bfb44bf619a5ceea1acd5fd270cde/gr8.jpg gr8 gr8.jpg jpg 16811 224 282 IMAGE-DOWNSAMPLED 1-s2.0-S0926860X22004896-gr10.jpg https://s3-eu-west-1.amazonaws.com/prod-ucs-content-store-eu-west/content/pii:S0926860X22004896/gr10/DOWNSAMPLED/image/jpeg/d770dabfdd7cf726494f623a3ad0f297/gr10.jpg gr10 gr10.jpg jpg 56086 663 282 IMAGE-DOWNSAMPLED 1-s2.0-S0926860X22004896-gr12.jpg https://s3-eu-west-1.amazonaws.com/prod-ucs-content-store-eu-west/content/pii:S0926860X22004896/gr12/DOWNSAMPLED/image/jpeg/b284b0f30504a1e3927e1ca300952b30/gr12.jpg gr12 gr12.jpg jpg 42958 451 282 IMAGE-DOWNSAMPLED 1-s2.0-S0926860X22004896-gr11.jpg https://s3-eu-west-1.amazonaws.com/prod-ucs-content-store-eu-west/content/pii:S0926860X22004896/gr11/DOWNSAMPLED/image/jpeg/a9a12a095c8ec84a76b6384a335fe8f2/gr11.jpg gr11 gr11.jpg jpg 49873 669 282 IMAGE-DOWNSAMPLED 1-s2.0-S0926860X22004896-gr1.jpg https://s3-eu-west-1.amazonaws.com/prod-ucs-content-store-eu-west/content/pii:S0926860X22004896/gr1/DOWNSAMPLED/image/jpeg/95d493d4ee6b86973a8f6749419c52e2/gr1.jpg gr1 gr1.jpg jpg 42020 526 339 IMAGE-DOWNSAMPLED 1-s2.0-S0926860X22004896-gr3.jpg https://s3-eu-west-1.amazonaws.com/prod-ucs-content-store-eu-west/content/pii:S0926860X22004896/gr3/DOWNSAMPLED/image/jpeg/22474d88169478189c35a084990bb1d1/gr3.jpg gr3 gr3.jpg jpg 13058 207 282 IMAGE-DOWNSAMPLED 1-s2.0-S0926860X22004896-gr2.jpg https://s3-eu-west-1.amazonaws.com/prod-ucs-content-store-eu-west/content/pii:S0926860X22004896/gr2/DOWNSAMPLED/image/jpeg/b034922c8da756e48eed17b1c0d83cc4/gr2.jpg gr2 gr2.jpg jpg 22354 215 282 IMAGE-DOWNSAMPLED 1-s2.0-S0926860X22004896-gr5.jpg https://s3-eu-west-1.amazonaws.com/prod-ucs-content-store-eu-west/content/pii:S0926860X22004896/gr5/DOWNSAMPLED/image/jpeg/bb211d3d2e6669c770cdf7c2419a780b/gr5.jpg gr5 gr5.jpg jpg 32753 457 282 IMAGE-DOWNSAMPLED 1-s2.0-S0926860X22004896-gr4.jpg https://s3-eu-west-1.amazonaws.com/prod-ucs-content-store-eu-west/content/pii:S0926860X22004896/gr4/DOWNSAMPLED/image/jpeg/d90d7699ee87c71dee0f58ceea777cec/gr4.jpg gr4 gr4.jpg jpg 33429 459 282 IMAGE-DOWNSAMPLED 1-s2.0-S0926860X22004896-ga1.jpg https://s3-eu-west-1.amazonaws.com/prod-ucs-content-store-eu-west/content/pii:S0926860X22004896/ga1/DOWNSAMPLED/image/jpeg/a8b5468c6c5eee8f53e6a9cf2aa90439/ga1.jpg ga1 true ga1.jpg jpg 16613 200 264 IMAGE-DOWNSAMPLED 1-s2.0-S0926860X22004896-gr7.sml https://s3-eu-west-1.amazonaws.com/prod-ucs-content-store-eu-west/content/pii:S0926860X22004896/gr7/THUMBNAIL/image/gif/b3e378639f69b061bb7ae168c41c5573/gr7.sml gr7 gr7.sml sml 6801 164 104 IMAGE-THUMBNAIL 1-s2.0-S0926860X22004896-gr6.sml https://s3-eu-west-1.amazonaws.com/prod-ucs-content-store-eu-west/content/pii:S0926860X22004896/gr6/THUMBNAIL/image/gif/307917213c58774879a282851f82a551/gr6.sml gr6 gr6.sml sml 6235 164 205 IMAGE-THUMBNAIL 1-s2.0-S0926860X22004896-gr9.sml https://s3-eu-west-1.amazonaws.com/prod-ucs-content-store-eu-west/content/pii:S0926860X22004896/gr9/THUMBNAIL/image/gif/0c57dbb925b1e76db5f81cbd99e0d861/gr9.sml gr9 gr9.sml sml 4232 163 102 IMAGE-THUMBNAIL 1-s2.0-S0926860X22004896-gr8.sml https://s3-eu-west-1.amazonaws.com/prod-ucs-content-store-eu-west/content/pii:S0926860X22004896/gr8/THUMBNAIL/image/gif/2af4b9d6e3e563448450fc40b446a24f/gr8.sml gr8 gr8.sml sml 7388 164 206 IMAGE-THUMBNAIL 1-s2.0-S0926860X22004896-gr10.sml https://s3-eu-west-1.amazonaws.com/prod-ucs-content-store-eu-west/content/pii:S0926860X22004896/gr10/THUMBNAIL/image/gif/cac9cfab6f7fcf7c1a4532896e74b3e4/gr10.sml gr10 gr10.sml sml 4630 162 69 IMAGE-THUMBNAIL 1-s2.0-S0926860X22004896-gr12.sml https://s3-eu-west-1.amazonaws.com/prod-ucs-content-store-eu-west/content/pii:S0926860X22004896/gr12/THUMBNAIL/image/gif/abf3e17edf7fbcf57d60e70e8e1b46d6/gr12.sml gr12 gr12.sml sml 6221 163 102 IMAGE-THUMBNAIL 1-s2.0-S0926860X22004896-gr11.sml https://s3-eu-west-1.amazonaws.com/prod-ucs-content-store-eu-west/content/pii:S0926860X22004896/gr11/THUMBNAIL/image/gif/89d694eebb3818fe2bd5924bd5b909da/gr11.sml gr11 gr11.sml sml 4124 164 69 IMAGE-THUMBNAIL 1-s2.0-S0926860X22004896-gr1.sml https://s3-eu-west-1.amazonaws.com/prod-ucs-content-store-eu-west/content/pii:S0926860X22004896/gr1/THUMBNAIL/image/gif/6e8a625797fd442d71e1dfa8eb1c9311/gr1.sml gr1 gr1.sml sml 4581 163 105 IMAGE-THUMBNAIL 1-s2.0-S0926860X22004896-gr3.sml https://s3-eu-west-1.amazonaws.com/prod-ucs-content-store-eu-west/content/pii:S0926860X22004896/gr3/THUMBNAIL/image/gif/601749ac4c23129600fc651d5173c16e/gr3.sml gr3 gr3.sml sml 5913 161 219 IMAGE-THUMBNAIL 1-s2.0-S0926860X22004896-gr2.sml https://s3-eu-west-1.amazonaws.com/prod-ucs-content-store-eu-west/content/pii:S0926860X22004896/gr2/THUMBNAIL/image/gif/25461b009e8af81e1b473943a22b2cc4/gr2.sml gr2 gr2.sml sml 9901 164 215 IMAGE-THUMBNAIL 1-s2.0-S0926860X22004896-gr5.sml https://s3-eu-west-1.amazonaws.com/prod-ucs-content-store-eu-west/content/pii:S0926860X22004896/gr5/THUMBNAIL/image/gif/e0c4bc0cde832b590278873d85ea1210/gr5.sml gr5 gr5.sml sml 4703 164 101 IMAGE-THUMBNAIL 1-s2.0-S0926860X22004896-gr4.sml https://s3-eu-west-1.amazonaws.com/prod-ucs-content-store-eu-west/content/pii:S0926860X22004896/gr4/THUMBNAIL/image/gif/58db981c6db8edb1b1a51c23728f2c0d/gr4.sml gr4 gr4.sml sml 4852 163 100 IMAGE-THUMBNAIL 1-s2.0-S0926860X22004896-ga1.sml https://s3-eu-west-1.amazonaws.com/prod-ucs-content-store-eu-west/content/pii:S0926860X22004896/ga1/THUMBNAIL/image/gif/5458ae0279cfa507a5a5ba394ee20f0a/ga1.sml ga1 true ga1.sml sml 11032 164 217 IMAGE-THUMBNAIL 1-s2.0-S0926860X22004896-gr7_lrg.jpg https://s3-eu-west-1.amazonaws.com/prod-ucs-content-store-eu-west/content/pii:S0926860X22004896/HIGHRES/image/jpeg/68bb5f1f996a4d83cee7a6f50560caa9/gr7_lrg.jpg gr7 gr7_lrg.jpg jpg 282682 1961 1247 IMAGE-HIGH-RES 1-s2.0-S0926860X22004896-gr6_lrg.jpg https://s3-eu-west-1.amazonaws.com/prod-ucs-content-store-eu-west/content/pii:S0926860X22004896/HIGHRES/image/jpeg/23f35ffb879a3afd5cbf87f0c036324d/gr6_lrg.jpg gr6 gr6_lrg.jpg jpg 98298 996 1247 IMAGE-HIGH-RES 1-s2.0-S0926860X22004896-gr9_lrg.jpg https://s3-eu-west-1.amazonaws.com/prod-ucs-content-store-eu-west/content/pii:S0926860X22004896/HIGHRES/image/jpeg/f00aafcb10132342e1ecf5fd821320ef/gr9_lrg.jpg gr9 gr9_lrg.jpg jpg 160286 1997 1247 IMAGE-HIGH-RES 1-s2.0-S0926860X22004896-gr8_lrg.jpg https://s3-eu-west-1.amazonaws.com/prod-ucs-content-store-eu-west/content/pii:S0926860X22004896/HIGHRES/image/jpeg/e4790548f2c320e5664d0e959d392d6e/gr8_lrg.jpg gr8 gr8_lrg.jpg jpg 103742 991 1247 IMAGE-HIGH-RES 1-s2.0-S0926860X22004896-gr10_lrg.jpg https://s3-eu-west-1.amazonaws.com/prod-ucs-content-store-eu-west/content/pii:S0926860X22004896/HIGHRES/image/jpeg/91ea481a6b48d0be51e2779700d994b3/gr10_lrg.jpg gr10 gr10_lrg.jpg jpg 362553 2932 1247 IMAGE-HIGH-RES 1-s2.0-S0926860X22004896-gr12_lrg.jpg https://s3-eu-west-1.amazonaws.com/prod-ucs-content-store-eu-west/content/pii:S0926860X22004896/HIGHRES/image/jpeg/5b33303223814ac57e34417164e7ad9b/gr12_lrg.jpg gr12 gr12_lrg.jpg jpg 281792 1995 1247 IMAGE-HIGH-RES 1-s2.0-S0926860X22004896-gr11_lrg.jpg https://s3-eu-west-1.amazonaws.com/prod-ucs-content-store-eu-west/content/pii:S0926860X22004896/HIGHRES/image/jpeg/06e96e181f6af84786cee47955ba2b74/gr11_lrg.jpg gr11 gr11_lrg.jpg jpg 319137 2958 1247 IMAGE-HIGH-RES 1-s2.0-S0926860X22004896-gr1_lrg.jpg https://s3-eu-west-1.amazonaws.com/prod-ucs-content-store-eu-west/content/pii:S0926860X22004896/HIGHRES/image/jpeg/8db8d3d7acda274e073437e4dfdc50b4/gr1_lrg.jpg gr1 gr1_lrg.jpg jpg 246986 2323 1497 IMAGE-HIGH-RES 1-s2.0-S0926860X22004896-gr3_lrg.jpg https://s3-eu-west-1.amazonaws.com/prod-ucs-content-store-eu-west/content/pii:S0926860X22004896/HIGHRES/image/jpeg/9a1cb0ed78f4b895d702c520b8ffdfd7/gr3_lrg.jpg gr3 gr3_lrg.jpg jpg 71342 917 1247 IMAGE-HIGH-RES 1-s2.0-S0926860X22004896-gr2_lrg.jpg https://s3-eu-west-1.amazonaws.com/prod-ucs-content-store-eu-west/content/pii:S0926860X22004896/HIGHRES/image/jpeg/887c525858f2235aaa26d6c6788e36c8/gr2_lrg.jpg gr2 gr2_lrg.jpg jpg 134935 951 1247 IMAGE-HIGH-RES 1-s2.0-S0926860X22004896-gr5_lrg.jpg https://s3-eu-west-1.amazonaws.com/prod-ucs-content-store-eu-west/content/pii:S0926860X22004896/HIGHRES/image/jpeg/a3addf3fc559ecf429c014c472ffa7b3/gr5_lrg.jpg gr5 gr5_lrg.jpg jpg 200900 2030 1252 IMAGE-HIGH-RES 1-s2.0-S0926860X22004896-gr4_lrg.jpg https://s3-eu-west-1.amazonaws.com/prod-ucs-content-store-eu-west/content/pii:S0926860X22004896/HIGHRES/image/jpeg/22585525728fc3cb7846b45e56b5d0c3/gr4_lrg.jpg gr4 gr4_lrg.jpg jpg 229164 2028 1247 IMAGE-HIGH-RES 1-s2.0-S0926860X22004896-ga1_lrg.jpg https://s3-eu-west-1.amazonaws.com/prod-ucs-content-store-eu-west/content/pii:S0926860X22004896/HIGHRES/image/jpeg/d6f50456bb1451ac2e3cf02a9e69b909/ga1_lrg.jpg ga1 true ga1_lrg.jpg jpg 121926 886 1172 IMAGE-HIGH-RES 1-s2.0-S0926860X22004896-mmc1.docx https://s3-eu-west-1.amazonaws.com/prod-ucs-content-store-eu-west/content/pii:S0926860X22004896/mmc1/MAIN/application/vnd.openxmlformats-officedocument.wordprocessingml.document/33c63f584048f0c14d5a6762d826570a/mmc1.docx mmc1 mmc1.docx docx 46411 APPLICATION 1-s2.0-S0926860X22004896-am.pdf https://s3-eu-west-1.amazonaws.com/prod-ucs-content-store-eu-west/content/egi:10WRK1T53P3/MAIN/application/pdf/8ea4181a74f03c088e1df5b32c3ad830/am.pdf am am.pdf pdf false 790874 AAM-PDF APCATA 118966 118966 S0926-860X(22)00489-6 10.1016/j.apcata.2022.118966 Elsevier B.V. Fig. 1 (a) NOx conversion and (b) N2 selectivity of NH3-SCR over Mn-HT catalysts. Reaction conditions: [NO] = [NH3] = 500 ppm, [O2] = 5%, N2 balance, and GHSV = 140,000 h−1. Fig. 1 Fig. 2 Effect of H2O on the activities of Mn-HT catalysts. Reaction conditions: [NO] = [NH3] = 500 ppm, [O2] = 5%, [H2O] = 5%, N2 balance, and GHSV = 140,000 h−1. Fig. 2 Fig. 3 Arrhenius plots for the conversion rate of NOx over Mn-HT catalysts in NH3-SCR reaction. Fig. 3 Fig. 4 Low-angle (a) and wide angle (b) XRD patterns of Mn-HT catalysts. Fig. 4 Fig. 5 (a) N2 adsorption-desorption isotherms, and (b) pore size distribution of the Mn-HT catalysts. Fig. 5 Fig. 6 Raman spectra of Mn-HT catalysts. Fig. 6 Fig. 7 XPS spectra of Mn 2p (a) and O1s (b) of Mn-HT catalysts. Fig. 7 Fig. 8 H2-TPR profiles of the Mn-HT catalysts. Fig. 8 Fig. 9 NH3-TPD profiles (a) and normalized desorbed NH3 (b) over different Mn-HT catalysts. Fig. 9 Fig. 10 In-situ DRIFTS of NH3 adsorption on Mn-100 (a), Mn-140 (b) and Mn-180 (c) at different temperatures. Fig. 10 Fig. 11 In situ DRIFTS of NO + O2 adsorption on (a) Mn-100, (b) Mn-140 and (c) Mn-180 at different temperatures. Fig. 11 Fig. 12 Dynamic changes of the in situ DRIFT spectra over Mn-140 catalyst. (a) in a flow of NH3 after pre-exposure to NO + O2 for 60 min at 125 °C; (b) in a flow of NO + O2 after pre-exposure to NH3 for 60 min at 125 °C. Fig. 12 Table 1 Textual properties of Mn-HT catalysts. Table 1 Catalyst Specific surface area(m2/g) Pore diameter(nm) Pore volume (cm3/g) Mn-100 169 3.82 0.22 Mn-140 180 4.87 0.32 Mn-180 171 9.61 0.51 Highly ordered mesoporous MnOx catalyst for the NH3-SCR of NOx at low temperatures Shiyu Xu Investigation Writing – original draft a b Jiawei Chen Investigation a b Zhenguo Li Formal analysis c Zhiming Liu Conceptualization Writing – review & editing Supervision Project administration a b ⁎ a State Key Laboratory of Chemical Resource Engineering, Beijing University of Chemical Technology, Beijing 100029, China State Key Laboratory of Chemical Resource Engineering, Beijing University of Chemical Technology Beijing 100029 China State Key Laboratory of Chemical Resource Engineering, Beijing University of Chemical Technology, Beijing 100029, China b Beijing Key Laboratory of Energy Environmental Catalysis, Beijing University of Chemical Technology, Beijing 100029, China Beijing Key Laboratory of Energy Environmental Catalysis, Beijing University of Chemical Technology Beijing 100029 China Beijing Key Laboratory of Energy Environmental Catalysis, Beijing University of Chemical Technology, Beijing 100029, China c National Engineering Laboratory for Mobile Source Emission Control Technology, China Automotive Technology & Research Center, Tianjin 300300, China National Engineering Laboratory for Mobile Source Emission Control Technology, China Automotive Technology & Research Center Tianjin 300300 China National Engineering Laboratory for Mobile Source Emission Control Technology, China Automotive Technology & Research Center, Tianjin 300300, China ⁎ Corresponding author at: State Key Laboratory of Chemical Resource Engineering, Beijing University of Chemical Technology, Beijing 100029, China. State Key Laboratory of Chemical Resource Engineering, Beijing University of Chemical Technology Beijing 100029 China MnOx catalysts with 3D structure (Mn-HT) were prepared by the hard-template method using KIT-6 as a template, and the catalytic performance for the selective catalytic reduction of NOx by NH3 (NH3-SCR) at low temperatures was investigated. The template KIT-6 prepared by the different hydrothermal temperatures can exert significant effect on the catalytic performance of Mn-HT catalysts. Among the Mn-HT catalyst, the catalyst prepared using the template obtained at the hydrothermal temperature of 140 °C (Mn-140) exhibited the highest catalytic performance. Characterizations showed that Mn-140 catalyst possesses high reducibility with abundant surface oxygen species and Mn4+ species. NH3-TPD and in situ DRIFTS demonstrated that there are more Lewis acid sites and Brønsted acid sites on the surface of Mn-140 catalyst, both of which would promote the adsorption and activation of NH3, leading to the reduction of NOx efficiently to proceed mainly by the Eley-Rideal(E-R) mechanism, accompanied by the Langmuir-Hinshelwood (L-H) mechanism. Graphical Abstract ga1 Keywords Nitrogen oxides NH3-SCR MnOx Reaction mechanism Data availability Data will be made available on request. 1 Introduction The massive emission of nitrogen oxide (NOx) from stationary sources and mobile sources can cause serious environmental problems [1–4]. The high concentration of NOx in atmosphere will not only cause acid rain, ozone depletion and photochemical smog, but also lead to a series of health problems [5,6]. With the rapid development of economy and the improvement of people’s living standards, the regulations for the NOx emissions have become more and more stringent. Thus, the NOx emission needs to be controlled urgently. Among the different technologies for the control of NOx, selective catalytic reduction of NOx by NH3 (NH3-SCR) has been proved to be an efficient and reliable way [7,8]. V2O5/TiO2 promoted by WO3 or MoO3 catalyst is widely used for the removal of NOx from stationary sources [8–11]. However, this catalyst is usually placed before the dust-extraction unit due to the requirement of the high operating temperature (300–400 °C). In order to reduce the negative influence of dust on the catalytic performance of the NH3-SCR catalyst to prolong its lifetime, one effective way is to place NH3-SCR unit after the precipitator and desulfurizer. In this case, the temperature is low (< 200 °C) and the development of highly active low-temperature NH3-SCR catalyst is desirable [12]. Considerable efforts have been devoted to developing active low-temperature NH3-SCR catalysts, such as metal-ion exchanged molecular sieves and Mn-based catalysts [13–15]. Among these catalysts, Mn-based catalysts have attracted much attention for their good redox properties and environmental friendliness [14,15]. The de-NOx performance of MnOx catalyst can be influenced by many factors [16]. The crystallinity of MnOx is closely related to the preparation methods and calcination treatment [17]. The amorphous MnOx prepared by solid phase reaction (SP) and co-precipitation (CP) methods exhibited higher activity in comparison with the highly crystallized MnOx prepared by citric acid (CA) method, due to the amorphous phase promoted proton insertion and releasing, resulting in more active sites for the reaction. In addition, the activity of MnOx catalyst is also influenced by the catalyst structure [6]. Tian et al. [18] compared the de-NOx performance over different morphology of MnO2 nanotubes, nanorods and nanoparticles, and found that MnO2 nanorods showed the highest de-NOx efficiency (above 90%) at temperature of 250–300 °C due to its high NH3 adsorption ability. Recently, we found that the porous MOF-derived MnOx catalyst showed high activity due to crystalline defects and abundant acid sites [19]. The hard-template method for preparing catalyst can effectively obtain well-developed mesoporous material with high specific surface area [20,21]. KIT-6 is a nanomaterial with 3D symmetrical ordered mesoporous structure, which can be as a template to prepare catalysts with the similar structure by hard-template method [22]. The 3D structure with larger specific surface area and well-developed pore structure is more conducive to the formation of active sites for the NH3-SCR reaction [5]. Hence, the MnOx catalyst with 3D structure prepared using KIT-6 as a template has great potential for NH3-SCR. To date, little research on 3D MnOx NH3-SCR catalyst prepared by hard-template using KIT-6 has been reported. Therefore, a deep understanding about the application of the 3D MnOx catalysts in NH3-SCR has not been obtained yet. In this study, a novel 3D MnOx catalyst with different pore size and mesoporous structure was prepared by hard-template method using KIT-6 as the template, and its catalytic performance for the low-temperature NH3-SCR of NOx has been investigated. The physical and chemical properties of the prepared catalysts were characterized by the X-ray diffraction (XRD), N2 adsorption, Raman, hydrogen temperature -programmed reduction (H2-TPR), temperature-programmed desorption of NH3 (NH3-TPD) and X-ray photoelectron spectroscopy (XPS). The reaction mechanism of NH3-SCR over Mn-HT catalyst was also revealed by In-situ DRIFTs. 2 Experimental section 2.1 Catalyst preparation MnOx catalyst was prepared by the hard-template method. First, the KIT-6 template was synthesized according to the method described previously [22]. Three different KIT-6 were obtained by varying the hydrothermal temperature (100, 140 and 180 °C). A proper amount of Mn(CH3COO)2·4 H2O and KIT-6 obtained at different hydrothermal temperatures were dissolved in 20 mL ethanol, the mixture was stirred at room temperature until the dry powder was obtained. The powder was dried at 100 °C for 12 h. The impregnation procedure was repeated, followed by drying and calcinating at 300 °C for 4 h in air. The resulting sample was treated with 1 M NaOH to remove the silica template. Afterwards, the sample was centrifuged, washed several times with deionized water to neutral, and then dried at 100 °C overnight to obtain MnOx catalyst (Mn-HT). MnOx prepared using the different KIT-6 obtained at the hydrothermal temperature of 100, 140 and 180 °C are denoted as Mn-100, Mn-140 and Mn-180, respectively. The Mn-D catalyst was also prepared by direct decomposition of Mn(CH3COO)2·4 H2O at 300 °C for 4 h in air. 2.2 Catalyst characterization XRD patterns were recorded on a Bruker D8 ADVANCE system with Cu Kα radiation. The diffraction patterns were collected from 10° to 80° at a rate of 10 °/min. The N2 adsorption-desorption isotherms and the pore size distributions were measured using Quantachrome Nova Automated Gas Sorption System. The specific surface area was calculated by the BET equation and the pore size was derived from the desorption branch of the isotherms by BJH method. The Raman measurement was performed using micro-Raman spectroscopy (Renisaw, InVia) under the 532 nm−1 excitation laser light. XPS was carried on the electron spectrometer (VG Scientific, ESCALab220i-XL) with Mg Kα radiation, in which C 1 s signal (284.8 eV) was used as the reference. H2-TPR and NH3-TPD were conducted on a Micrometrics ChemiSorb 2720 analyzer, and recorded continuously by TCD detector. The sample was first pretreated in N2 flow at 300 °C for 1 h, then cooled down to room temperature. Subsequently, H2-TPR was carried out by heating the sample at a rate of 10 °C·min−1 in 10% H2/N2 flow (50 mL min−1). For NH3-TPD, the temperature was raised to 750 °C at a rate of 10 °C·min−1 in N2 flow after the catalyst was saturated by NH3/N2 flow at 100 °C. In-situ DRIFTS was recorded on a Nicolet iS50 FTIR spectrometer. The sample was first pretreated in N2 flow at 300 °C for 1 h, then take the background spectrum at the desired temperature. The sample spectrum was obtained by subtracting the corresponding background spectrum. The feeding gas concentration is as follows: 500 ppm NH3 or 500 ppm NO and 5% O2. For the NH3 (or NO + O2) adsorption, the catalyst was exposed to a flow of NH3 (or NO + O2) for 1 h at each temperature, then the spectra were taken. For the transient studies, the sample was first pre-exposure to a flow of NH3 (or NO + O2) for 1 h at 125 °C, then purged with N2 for 30 min, followed by switching to NO + O2 (or NH3) to record the dynamic changes of the spectra. 2.3 Catalytic performance evaluation The catalytic performance was tested in a fixed-bed quartz reactor with 0.12 g catalyst. The reaction gas consists of 500 ppm NO, 500 ppm NH3, 5% O2, 5% H2O (when used), and N2 balance. The gas flow rate is 300 cm3·min−1, corresponding to the gaseous hourly space velocity (GHSV) of 140,000 h−1. The concentrations of the effluent gases were analyzed online by chemiluminescence NO/NO2 analyzer (Thermo Scientific, model 42i-HL) and a FITR spectrometer (Gasmet FTIR DX4000). The NOx conversion and N2 selectivity were calculated as follows: NO x conversion= NO x in - NO x out [NO x ] in × 100 % N 2 selectivity = NO x in + NH 3 in - NO x out - NH 3 out - 2 N 2 O out NO x in - NO x out + NH 3 in - NH 3 out × 100 % 3 Results and discussion 3.1 Catalytic NH3-SCR performance The NH3-SCR activities of the Mn-HT catalysts were tested and shown in Fig. 1(a). It can be seen that the catalytic activity is decreased in the order of Mn-140 > Mn-100 > Mn-180, and Mn-140 catalyst showed the best catalytic activity in the whole test temperature range, especially below 200 °C. Over Mn-140 catalyst, more than 90% NOx conversion can be achieved between 100 and 200 °C, and the maximum conversion reached 98% at 125 °C. Evidently, the activities of Mn-100 and Mn-180 catalysts were much lower than that of Mn-140 catalyst, and Mn-180 is the least active one, over which the maximum NOx conversion was only 73%. As illustrated in Fig. S1. The NH3-SCR activity of Mn-D catalyst is much lower than those of Mn-100 and Mn-140 catalysts in the temperature range of 75–250 °C. It indicated that the Mn-HT catalyst prepared by the hard template method is superior to the Mn-D catalyst prepared by the traditional method. The N2 selectivities of Mn-HT catalysts were shown in Fig. 1(b), which follows the order of Mn-140 > Mn-100 > Mn-180, and the N2 selectivity was decreased with the increase of temperature, similar to the previous report [19,23]. With increasing temperature, more N2O would be produced by the reaction between NO and activated NH3 species, thus leading to the decreased N2 selectivity [24–26]. Mn-140 catalyst showed the highest N2 selectivity, and more than 82% N2 selectivity can be obtained in the temperature range of 75–200 °C. This comparison suggests that the preparation temperature of the template KIT-6 significantly affects the NH3-SCR catalytic performance of the Mn-HT catalysts. In the practical application, the existence of H2O cannot be excluded. Therefore, the NH3-SCR activity was also tested in the presence of 5% H2O. As shown in Fig. 2, the activities of Mn-HT catalysts are just slightly decreased in the presence of H2O. The inhibition of H2O could be due to the competitive adsorption between H2O and the reactants [27,28]. This indicated that Mn-HT catalysts exhibited high tolerance to H2O, which is very important for the practical application. Fig. 3 shows the Arrhenius plots for the conversion rate of NOx over Mn-HT catalysts. The apparent activation energies (Ea) for Mn-100, Mn-140 and Mn-180 catalysts are 14.6, 16.0 and 16.6 kJ/mol, respectively. The activation energy is similar, however, the preexponential factor (A) of the three catalysts are significantly different. The preexponential factor follows the order of Mn-140 (A= 39,535) > Mn-100 (A=8646) > Mn-180 (A=3729), which is consistent with the catalytic performance order. This fact indicates that over Mn-140 catalyst there are much more active sites than those of Mn-100 and Mn-180 catalysts [19]. Therefore, Mn-140 catalyst exhibited the highest NH3-SCR activity. 3.2 XRD, N2 adsorption and Raman analysis The low-angle and wide-angle XRD patterns of the Mn-HT catalysts are shown in Fig. 4. As illustrated in Fig. 4(a), an obvious diffraction peak at 2θ = 0.97°, which corresponds to the {211} plane, can be observed over all the Mn-HT catalysts. This demonstrates that Mn-HT catalysts are of the ordered mesoporous structure, which successfully replicates the cubic Ia3d structure of KIT-6 [20]. As shown in Fig. 4(b), the peaks assigned to the crystalline phase of MnO2 (28.88°) (PDF#50–0866) and Mn3O4 (18.00°, 31.02°, 32.32°, 36.09°, 36.45° and 37.98°) (PDF#24–0734) appeared over Mn-100, Mn-140 and Mn-180 catalysts [29,30]. From the intensity of the XRD peaks and full width at half maximum, the Mn-140 catalyst is of the smallest crystal size and the lowest crystallinity compared with the other two Mn-HT catalysts. As reported previously [22,31], the hydrothermal temperature of preparing KIT-6 would affect its mesoporous pore size. The appropriate pore size of corresponding KIT-6 could be obtained as the hydrothermal temperature is 140 °C. The appropriate pore structure could promote the dispersion of Mn precursor in the pores and contribute to its reconstruction during the calcination process, thus resulting in the smallest crystallite size formed. The smallest crystallite makes Mn-140 catalyst possess the most active sites. The N2 adsorption-desorption test was performed over the Mn-HT catalysts. Fig. 5(a) is the N2 isotherm adsorption-desorption curves. Based on the IUPAC classification, the curves showed type IV isotherms with H2 hysteresis loop [32], showing that the prepared Mn-HT catalyst possessed ordered mesoporous structure, which is consistent with the result of low-angle XRD. The textural properties are shown in Table 1. Obviously, the BET specific surface areas of Mn-100, Mn-140 and Mn-180 were 169, 180 and 171 m2/g, respectively. This result showed that the Mn-HT catalysts possessed large surface areas, which is due to the successful anti-replication of the ordered mesoporous structure from KIT-6 template. The large specific surface area of Mn-HT catalysts would be beneficial to the NH3-SCR reaction [5,14,33]. Previous reports also proposed that the large specific surface area would contribute to the NH3-SCR activity of MnOx [17,19,34], and the reported surface areas are 51, 72, and 96 m2/g, which are much lower than those in this study. The pore size and pore volume of the Mn-HT catalysts increase with increasing the hydrothermal temperature of KIT-6 template. The suitable pore size can increase the possibility and efficiency of the collision between reactant molecules and active sites over the Mn-HT catalysts, and can facilitate the diffusion and migration of the product molecules in the pore structure, thus promoting the SCR reaction [35,36]. Raman analysis is also conducted to further understand the nature of the manganese species of the Mn-HT catalyst. As exhibited in Fig. 6, there is a distinct characteristic band at 650 cm−1, which can be attributed to the characteristic of Mn-O (A1 g) lattice vibrations of Mn3O4 [14,32]. The band intensity of Mn-140 catalyst is the weakest, indicating that manganese oxide is of low crystallinity, which is consistent with the result of XRD. 3.3 XPS analysis The surface composition and the chemical state of the elements on the surface of the Mn-HT catalysts were studied by XPS. Fig. 7(a) exhibits the Mn 2p XPS spectra of Mn-HT catalysts, two main peaks centered at about 642.0 and 653.0 eV are observed, which are attributed to Mn 2p3/2 and Mn 2p1/2, respectively. The two typical characteristic peaks could be deconvoluted into six peaks: the peaks centered at ∼640.9 and 652.1 eV, 642.2 and 653.8 eV, 644.2 and 655.9 eV correspond to the Mn2+, Mn3+ and Mn4+ species, respectively [14,37,38]. According to the XPS analysis, the ratio of Mn4+/Mn over Mn-140 catalyst is higher than those of Mn-100 and Mn-180 catalysts (as shown in Fig. 7(a)). It has been reported that the NH3-SCR activity of Mn oxides decreased in the order of MnO2 > Mn5O8 > Mn2O3 > Mn3O4 > MnO [18], Mn4+ species and their redox process are responsible for the high activity of the NH3-SCR reaction at low temperature [33]. Besides, abundant Mn4+ would promote the oxidation of NO to NO2 [14,39], which was favorable for the NH3-SCR reaction to proceed. Thus, the higher concentration of Mn4+ would play a vital role in the high low-temperature de-NOx activity of Mn-140 catalyst. For O1s spectra (see Fig. 7(b)), the XPS peaks at around 529.9 eV and 531.3 eV are corresponding to the lattice oxygen (Oβ) and surface oxygen (Oα), respectively [40,41]. As shown in Fig. 7(b), the Oα/(Oα + Oβ) ratio of Mn-140 catalyst is remarkably higher than those of the other two Mn-HT catalysts. It is generally recognized that the Oα species exhibits higher activity than Oβ due to its high mobility [14]. More Oα would also contribute to the oxidation of NO to NO2, which is beneficial to the SCR reaction on the catalyst. As discussed in the XRD analysis, the decrease of the crystallization of MnOx can inhibit the diffusion of Mnn+ and O2- ions and result in abundant Mn4+ and surface oxygen (Oα) on the catalyst surface [12]. As shown in Fig. S2, the highest conversion of NO to NO2 was obtained over Mn-140 catalyst, indicating that Mn-140 catalyst possessed the highest NO oxidation ability. Combined with the above analysis, the highest contents of Mn4+ and Oα over Mn − 140 are both beneficial to the oxidation of NO to NO2, and further improve the catalytic activity through the “Fast-SCR” pathway [42,43]. 3.4 H2-TPR It is well known that the reduction behavior of the catalyst is an important factor influencing the NH3-SCR activity [1]. Fig. 8 shows the H2-TPR profiles of Mn-HT catalysts. It can be seen that the Mn-HT catalysts exhibited two reduction peaks at about 246–282 °C and 475 °C, which are mainly attributed to the stepwise reduction of MnO2 to Mn3O4, and Mn3O4 to MnO, respectively [42,44–46]. Compared with Mn-100 and Mn-180 catalysts, the former peak over Mn-140 catalyst evidently shifted to lower temperature and the peak intensity is also higher. This indicates more Mn4+ existed over Mn-140 and it possessed higher redox property and oxygen mobility, which is consistent with the XPS analysis, and would be beneficial to improving the catalytic performance for low-temperature NH3-SCR reaction [14,47,48]. Furthermore, the area of the reduction peak is positively correlated with the consumed amount of H2. It could be seen that Mn-140 exhibited the largest H2 consumption among three catalysts, indicating that more reducible species were exposed over Mn-140, which might result from its 3D ordered mesoporous structure with large surface area [49]. 3.5 NH3-TPD The adsorption and activation of NH3 on the active sites of the catalyst surface play a key role in the NH3-SCR reaction [1]. Therefore, the surface acid amount and strength of the Mn-HT catalysts were evaluated by NH3-TPD, the corresponding profiles of the three catalysts are depicted in Fig. 9(a). From Fig. 9(a), the NH3 desorption profiles of Mn-100 and Mn-140 present three distinct desorption processes from 100° to 750°C due to the adsorbed NH3 species with different thermal stability. The desorption peak below 200 °C is assigned to weak acid sites, while the desorption peak above 600 °C is associated with strong acid sites, and the peak at about 400 °C could be related to medium acid sites [19,50]. Different from the Mn-100 and Mn-140, the Mn-180 only displays two desorption peaks ascribed to the weak and medium acid sites, lack of the peak of strong acid sites. In addition, we found that the desorption peak of Mn-140 was shifted to the high temperature region, suggesting the presence of stronger acid sites. The normalized desorbed NH3 of the catalysts was calculated, as shown in Fig. 9(b), the total amount of the acid sites over Mn-140 is remarkably higher than those on the other two catalysts. The higher amount of acid sites could be attributed to its ordered 3D mesoporous structure with large specific surface area, which contributes to the adsorption and activation of NH3. 3.6 In situ DRIFTS study 3.6.1 NH3-adsorption In-situ DRIFTS of NH3 adsorption on Mn-HT catalysts was carried out, and the corresponding results are displayed in Fig. 10. Over both Mn-100 and Mn-140 catalysts, four bands at about 1608, 1454, 1402 and 1258 cm−1 can be observed. The bands located at ∼ 1608 and 1258 cm−1 are correlated to NH3 coordinated to Lewis (L) acid sites [14,42], while the bands at 1446 and 1402 cm−1 can be ascribed to the NH4 + species on Brønsted (B) acid sites [51,52]. It is obvious that the intensities of NH3 adsorption bands on the Mn-140 catalyst are significantly stronger than those on the Mn-100 catalyst, indicating that the total amount of the B acid and L acid sites over Mn-140 catalyst is apparently higher than that of Mn-100, as also confirmed by NH3-TPD results. During the heating process, the band intensity of L acid weakens with the increase of temperature, but it is still strong even at 250 °C. Whereas over Mn-180 catalyst, it showed extremely weak peaks at 1256 (L acid), 1402 (B acid) and 1608 (L acid) cm−1, which indicates that there are very few acid sites on its surface. With the increase of temperature, the peaks signal gradually weakens and disappears at 200 °C. More L and B acid sites over Mn-140 catalyst would contribute to the adsorption and activation of NH3, thus leading to the high activity for the low-temperature NH3-SCR reaction. 3.6.2 Adsorption of NO + O2 Fig. 11 exhibited the in-situ DRIFTS of NO + O2 adsorption on the Mn-HT catalysts at different temperatures. Over Mn-100 and Mn-140 catalysts, it can be seen two bands located at about 1300 and 1500 cm−1, which are attributed to monodentate nitrate and bidentate nitrate, respectively [53–56]. The intensities of those two bands increased as the temperature increased from 100 to 150 °C. While further increasing the temperature from 150 to 250°C, the two bands were weakened but not disappeared, which was due to the desorption/decomposition/transformation during the heating process. It is noted that the intensities of the peaks over Mn-140 are weaker than those over Mn-100. Over Mn-180 catalyst, the bands are different from the Mn-100 and Mn-140 catalysts, which are located at about 1358 cm−1 (monodentate nitrate), 1422 cm−1 (trans-N2O2 2−), and 1630 cm−1 (bridging nitrate) [54,57]. It is well known that there is competitive adsorption occurred between nitrate species and gaseous NH3 [58]. Therefore, the weak adsorption of NOx over Mn-140 catalyst can leave more active sites available for the adsorption of NH3, which is a key step in the NH3-SCR of NOx [1,7]. 3.6.3 Reactivity of adsorbed species In situ DRIFT spectra changes as a function of time in NH3 flow over Mn-140 catalyst after pre-exposure to NO + O2 at 125 °C are shown in Fig. 12(a). After adsorption of NO + O2, the monodentate nitrate (1300 cm−1) and bidentate nitrate (1475 cm−1) are appeared [53,59]. As the flow was switched from NO + O2 to NH3, the intensities of the peaks assigned to monodentate nitrate and bidentate nitrate just decreased slightly, indicating that NH3-SCR reaction could occur following the Langmuir-Hinshelwood (L-H) mechanism over Mn-140 catalyst. The reactivity of adsorbed NH3 over Mn-140 catalyst was further studied and the results are shown in Fig. 12(b). After adsorbing NH3, three bands attributed to the N-H stretching modes of coordinated NH3 to L acid sites (1246 and 1608 cm−1), and the NH4 + species on B acid sites (1402 cm−1) are observed [42,51,52]. Upon subsequently switching to NO + O2, the bands ascribed to adsorbed NH3 species decreased quickly and disappeared in 5 min, indicating both the adsorbed NH3 on L and B acid sites are reactive species. As the time prolonged, the peaks assigned to monodentate nitrate (1300 and 1377 cm−1) and bidentate nitrate (1475 cm−1) appeared [53,54]. Therefore, NH3-SCR of NOx over Mn-140 mainly proceeds following the Eley-Rideal (E-R) mechanism, accompanied by the L-H mechanism [15]. As described above, Mn-140 catalyst possessed the most active sites among the three MnOx catalysts. Moreover, less NOx species with low activity were adsorbed over Mn-140 catalyst, thus leaving more active sites for the adsorption of highly reactive NH3 species (see Fig. 10). Consequently, Mn-140 exhibited the highest low-temperature activity for the reduction of NOx by NH3. 4 Conclusions A novel MnOx catalyst with 3D structure and mesoporous structure has been successfully fabricated. The Mn-140 catalyst showed superior low-temperature NH3-SCR activity, over which more than 90% NOx conversion and 82% N2 selectivity were achieved between 100 and 200 °C. The ordered mesoporous structure with appropriate pore size and large specific surface area contributed to the high redox property and high contents of surface oxygen species, Mn4+ active species and acid sites, which resulted in its excellent catalytic activity. Besides, the reaction pathway on the Mn-140 catalyst is proved to be dominated by the E-R mechanism, accompanied by the L-H mechanism. This work provides new insights into the effect of 3D structure with different pore size on catalyst performance and new idea for designing low-temperature NH3-SCR catalyst. CRediT authorship contribution statement Shiyu Xu: Investigation, Writing – original draft. Jiawei Chen: Investigation. Zhenguo Li: Formal analysis. Zhiming Liu: Conceptualization, Writing – review & editing, Supervision, Project administration. Declaration of Competing Interest The authors declare that they have no known competing financial interests or personal relationships that could have appeared to influence the work reported in this paper. Acknowledgments This work was financially supported by the National Natural Science Foundation of China (22276010, 21876009), National Engineering Laboratory for Mobile Source Emission Control Technology (NELMS2019A18), and the Fundamental Research Funds for the Central Universities (PY2103, JD2110). Appendix A Supplementary material Supplementary data associated with this article can be found in the online version at doi:10.1016/j.apcata.2022.118966. Appendix A Supplementary material Supplementary material . References [1] Z. Zhou W. Li Z. Liu Ind. Eng. Chem. Res. 60 2021 15472 15478 10.1021/acs.iecr.1c02977 Z. Zhou, W. Li, Z. Liu, Ind. Eng. Chem. Res. 60 (2021) 15472–15478. https://doi.org/10.1021/acs.iecr.1c02977. [2] X. Yao L. Zhang L. Li L. Liu Y. Cao X. Dong F. Gao Y. Deng C. Tang Z. Chen L. Dong Y. Chen Appl. Catal. B 150–151 2014 315 329 10.1016/j.apcatb.2013.12.007 X. Yao, L. Zhang, L. Li, L. Liu, Y. Cao, X. Dong, F. Gao, Y. Deng, C. Tang, Z. Chen, L. Dong, Y. Chen, Appl. Catal., B 150–151 (2014) 315–329. https://doi.org/10.1016/j.apcatb.2013.12.007. [3] Z. Liu S.I. Woo Catal. Rev. 48 2006 43 89 10.1080/01614940500439891 Z. Liu, S.Ihl Woo, Catalysis Reviews 48 (2006) 43–89. https://doi.org/10.1080/01614940500439891. [4] D.H. Kim Y.J. Park K.-Y. Lee H.P. Ha D.W. Kwon Appl. Catal. A 643 2022 118770 10.1016/j.apcata.2022.118770 D.H. Kim, Y.J. Park, K.-Y. Lee, H.P. Ha, D.W. Kwon, Appl. Catal., A 643 (2022) 118770. https://doi.org/10.1016/j.apcata.2022.118770. [5] G. Xu X. Guo X. Cheng J. Yu B. Fang Nanoscale 13 2021 7052 7080 10.1039/D1NR00248A G. Xu, X. Guo, X. Cheng, J. Yu, B. Fang, Nanoscale 13 (2021) 7052–7080. https://doi.org/10.1039/D1NR00248A. [6] Q. Zhou K. He X. Wang K.H. Lim P. Liu W. Wang Q. Wang Appl. Catal. A 643 2022 118796 10.1016/j.apcata.2022.118796 Q. Zhou, K. He, X. Wang, K.H. Lim, P. Liu, W. Wang, Q. Wang, Appl. Catal., A 643 (2022) 118796. https://doi.org/10.1016/j.apcata.2022.118796. [7] Z. Liu J. Zhu J. Li L. Ma S.I. Woo ACS Appl. Mater. Interfaces 6 2014 14500 14508 10.1021/am5038164 Z. Liu, J. Zhu, J. Li, L. Ma, S.I. Woo, ACS Appl. Mater. Interfaces 6 (2014) 14500–14508. https://doi.org/10.1021/am5038164. [8] L. Han S. Cai M. Gao J. Hasegawa P. Wang J. Zhang L. Shi D. Zhang Chem. Rev. 119 2019 10916 10976 10.1021/acs.chemrev.9b00202 L. Han, S. Cai, M. Gao, J.-y. Hasegawa, P. Wang, J. Zhang, L. Shi, D. Zhang, Chem. Rev. 119 (2019) 10916–10976. https://doi.org/10.1021/acs.chemrev.9b00202. [9] L. Yan Y. Liu H. Hu H. Li L. Shi D. Zhang ChemCatChem 8 2016 2267 2278 10.1002/cctc.201600332 L. Yan, Y. Liu, H. Hu, H. Li, L. Shi, D. Zhang, ChemCatChem 8 (2016) 2267–2278. https://doi.org/10.1002/cctc.201600332. [10] G. Busca L. Lietti G. Ramis F. Berti Appl. Catal. B 18 1998 1 36 10.1016/S0926-3373(98)00040-X G. Busca, L. Lietti, G. Ramis, F. Berti, Appl. Catal., B 18 (1998) 1–36. https://doi.org/10.1016/S0926–3373(98)00040-X. [11] Q. Lu X. Pei Y. Wu M. Xu D. Liu L. Zhao Energy Fuels 34 2020 4865 4873 10.1021/acs.energyfuels.0c00066 Q. Lu, X.-q Pei, Y.-w Wu, M.-x Xu, D.-j Liu, L. Zhao, Energy Fuels 34 (2020) 4865–4873. https://doi.org/10.1021/acs.energyfuels.0c00066. [12] D. Meng W. Zhan Y. Guo Y. Guo L. Wang G. Lu ACS Catal. 5 2015 5973 5983 10.1021/acscatal.5b00747 D. Meng, W. Zhan, Y. Guo, Y. Guo, L. Wang, G. Lu, ACS Catal. 5 (2015) 5973–5983. https://doi.org/10.1021/acscatal.5b00747. [13] J. Xue X. Wang G. Qi J. Wang M. Shen W. Li J. Catal. 297 2013 56 64 10.1016/j.jcat.2012.09.020 J. Xue, X. Wang, G. Qi, J. Wang, M. Shen, W. Li, J. Catal. 297 (2013) 56–64. https://doi.org/10.1016/j.jcat.2012.09.020. [14] C. Wang F. Gao S. Ko H. Liu H. Yi X. Tang Chem. Eng. J. 434 2022 134729 10.1016/j.cej.2022.134729 C. Wang, F. Gao, S. Ko, H. Liu, H. Yi, X. Tang, Chem. Eng. J. 434 (2022) 134729. https://doi.org/10.1016/j.cej.2022.134729. [15] L.J. Liu S. Su D.Z. Chen T. Shu X.T. Zheng J.Y. Yu Y. Feng Y. Wang S. Hu J. Xiang Fuel 307 2022 10.1016/j.fuel.2021.121805 L.J. Liu, S. Su, D.Z. Chen, T. Shu, X.T. Zheng, J.Y. Yu, Y. Feng, Y. Wang, S. Hu, J. Xiang, FUEL 307 (2022). https://doi.org/10.1016/j.fuel.2021.121805. [16] C. Liu J.-W. Shi C. Gao C. Niu Appl. Catal. A 522 2016 54 69 10.1016/j.apcata.2016.04.023 C. Liu, J.-W. Shi, C. Gao, C. Niu, Appl. Catal., A 522 (2016) 54–69. https://doi.org/10.1016/j.apcata.2016.04.023. [17] X. Tang J. Hao W. Xu J. Li Catal. Commun. 8 2007 329 334 10.1016/j.catcom.2006.06.025 X. Tang, J. Hao, W. Xu, J. Li, Catal. Commun. 8 (2007) 329–334. https://doi.org/10.1016/j.catcom.2006.06.025. [18] W. Tian H. Yang X. Fan X. Zhang J. Hazard. Mater. 188 2011 105 109 10.1016/j.jhazmat.2011.01.078 W. Tian, H. Yang, X. Fan, X. Zhang, J. Hazard. Mater. 188 (2011) 105–109. https://doi.org/10.1016/j.jhazmat.2011.01.078. [19] R. Chen X. Fang Z. Li Z. Liu Appl. Catal. A 643 2022 118754 10.1016/j.apcata.2022.118754 R. Chen, X. Fang, Z. Li, Z. Liu, Appl. Catal., A 643 (2022) 118754. https://doi.org/10.1016/j.apcata.2022.118754. [20] G. Zhou H. Lan T. Gao H. Xie Chem. Eng. J. 246 2014 53 63 10.1016/j.cej.2014.02.059 G. Zhou, H. Lan, T. Gao, H. Xie, Chem. Eng. J. 246 (2014) 53–63. https://doi.org/10.1016/j.cej.2014.02.059. [21] S. Xu F. Xie H. Xie G. Zhou X. Liu Chem. Eng. J. 375 2019 122023 10.1016/j.cej.2019.122023 S. Xu, F. Xie, H. Xie, G. Zhou, X. Liu, Chem. Eng. J. 375 (2019) 122023. https://doi.org/10.1016/j.cej.2019.122023. [22] F. Kleitz S. Hei Choi R. Ryoo Chem. Commun. 2003 2136 2137 10.1039/B306504A F. Kleitz, S. Hei Choi, R. Ryoo, Chem. Commun. (2003) 2136–2137. https://doi.org/10.1039/B306504A. [23] C. Li X. Tang H. Yi L. Wang X. Cui C. Chu J. Li R. Zhang Q. Yu Appl. Surf. Sci. 428 2018 924 932 10.1016/j.apsusc.2017.09.131 C. Li, X. Tang, H. Yi, L. Wang, X. Cui, C. Chu, J. Li, R. Zhang, Q. Yu, Appl. Surf. Sci. 428 (2018) 924–932. https://doi.org/10.1016/j.apsusc.2017.09.131. [24] S. Deng T. Meng B. Xu F. Gao Y. Ding L. Yu Y. Fan ACS Catal. 6 2016 5807 5815 10.1021/acscatal.6b01121 S. Deng, T. Meng, B. Xu, F. Gao, Y. Ding, L. Yu, Y. Fan, A.C.S. Catal. 6 (2016) 5807–5815. https://doi.org/10.1021/acscatal.6b01121. [25] Z. Liu M. Wang S. Liu Z. Chen L. Yang K. Sun Y. Chen L. Zeng W. Wang J. Zhao G. Sun B. Liu Y. Pan Y. Liu C. Liu Appl. Catal. B 269 2020 118731 10.1016/j.apcatb.2020.118731 Z. Liu, M. Wang, S. Liu, Z. Chen, L. Yang, K. Sun, Y. Chen, L. Zeng, W. Wang, J. Zhao, G. Sun, B. Liu, Y. Pan, Y. Liu, C. Liu, Appl. Catal., B 269 (2020) 118731. https://doi.org/10.1016/j.apcatb.2020.118731. [26] X. Liu P. Jiang Y. Chen Y. Wang Q. Ding Z. Sui H. Chen Z. Shen X. Wu Chem. Eng. J. 421 2021 127833 10.1016/j.cej.2020.127833 X. Liu, P. Jiang, Y. Chen, Y. Wang, Q. Ding, Z. Sui, H. Chen, Z. Shen, X. Wu, Chem. Eng. J. 421 (2021) 127833. https://doi.org/10.1016/j.cej.2020.127833. [27] Z. Ge Y. Shen S. Gu Fuel 310 2022 122261 10.1016/j.fuel.2021.122261 Z. Ge, Y. Shen, S. Gu, Fuel 310 (2022) 122261. https://doi.org/10.1016/j.fuel.2021.122261. [28] P. Zhao M. Guo Q. Liu L. Fan J. Han C. Liu N. Ji C. Song D. Ma Z. Li Chem. Eng. J. 378 2019 122100 10.1016/j.cej.2019.122100 P. Zhao, M. Guo, Q. Liu, L. Fan, J. Han, C. Liu, N. Ji, C. Song, D. Ma, Z. Li, Chem. Eng. J. 378 (2019) 122100. https://doi.org/10.1016/j.cej.2019.122100. [29] X. Chen C. Chen T. Xu Y. Xu W. Liu W. Yang P. Yang RSC Adv. 8 2018 35878 35887 10.1039/C8RA06989A X. Chen, C. Chen, T. Xu, Y. Xu, W. Liu, W. Yang, P. Yang, R.S.C. Adv. 8 (2018) 35878–35887. https://doi.org/10.1039/C8RA06989A. [30] W. Zhang X. Guo J. Zhao Y. Zheng H. Xie Z. Zhang S. Wang Q. Xu Q. Fu T. Zhang J. Electroanal. Chem. 910 2022 116170 10.1016/j.jelechem.2022.116170 W. Zhang, X. Guo, J. Zhao, Y. Zheng, H. Xie, Z. Zhang, S. Wang, Q. Xu, Q. Fu, T. Zhang, J. Electroanal. Chem. 910 (2022) 116170. https://doi.org/10.1016/j.jelechem.2022.116170. [31] C. Pirez J.-M. Caderon J.-P. Dacquin A.F. Lee K. Wilson ACS Catal. 2 2012 1607 1614 10.1021/cs300161a C. Pirez, J.-M. Caderon, J.-P. Dacquin, A.F. Lee, K. Wilson, A.C.S. Catal. 2 (2012) 1607–1614. https://doi.org/10.1021/cs300161a. [32] J. Feng Y. Wang D. Gao B. Kang S. Li C. Li G. Chen Nanoscale 12 2020 16381 16388 10.1039/D0NR03028G J. Feng, Y. Wang, D. Gao, B. Kang, S. Li, C. Li, G. Chen, Nanoscale 12 (2020) 16381–16388. https://doi.org/10.1039/D0NR03028G. [33] C. Fang D. Zhang S. Cai L. Zhang L. Huang H. Li P. Maitarad L. Shi R. Gao J. Zhang Nanoscale 5 2013 9199 9207 10.1039/C3NR02631K C. Fang, D. Zhang, S. Cai, L. Zhang, L. Huang, H. Li, P. Maitarad, L. Shi, R. Gao, J. Zhang, Nanoscale 5 (2013) 9199–9207. https://doi.org/10.1039/C3NR02631K. [34] I. Song H. Lee S.W. Jeon D.H. Kim ACS Catal. 10 2020 12017 12030 10.1021/acscatal.0c03154 I. Song, H. Lee, S.W. Jeon, D.H. Kim, A.C.S. Catal. 10 (2020) 12017–12030. https://doi.org/10.1021/acscatal.0c03154. [35] A. Salehirad S.M. Latifi V. Zabihi J. Aust. Ceram. Soc. 57 2021 1453 1461 10.1007/s41779-021-00650-w A. Salehirad, S.M. Latifi, V. Zabihi, J. Aust. Ceram. Soc. 57 (2021) 1453–1461. https://doi.org/10.1007/s41779–021-00650-w. [36] J.F. Guayaquil-Sosa B. Serrano-Rosales P.J. Valadés-Pelayo H. de Lasa Appl. Catal. B 211 2017 337 348 10.1016/j.apcatb.2017.04.029 J.F. Guayaquil-Sosa, B. Serrano-Rosales, P.J. Valadés-Pelayo, H. de Lasa, Appl. Catal., B 211 (2017) 337–348. https://doi.org/10.1016/j.apcatb.2017.04.029. [37] L. Zhang L. Shi L. Huang J. Zhang R. Gao D. Zhang ACS Catal. 4 2014 1753 1763 10.1021/cs401185c L. Zhang, L. Shi, L. Huang, J. Zhang, R. Gao, D. Zhang, A.C.S. Catal. 4 (2014) 1753–1763. https://doi.org/10.1021/cs401185c. [38] T. Qiao Z. Liu C. Liu W. Meng H. Sun Y. Lu Appl. Catal. A 617 2021 118128 10.1016/j.apcata.2021.118128 T. Qiao, Z. Liu, C. Liu, W. Meng, H. Sun, Y. Lu, Appl. Catal., A 617 (2021) 118128. https://doi.org/10.1016/j.apcata.2021.118128. [39] C. Yang J. Yang Q. Jiao D. Zhao Y. Zhang L. Liu G. Hu J. Li Ceram. Int. 46 2020 4394 4401 10.1016/j.ceramint.2019.10.163 C. Yang, J. Yang, Q. Jiao, D. Zhao, Y. Zhang, L. Liu, G. Hu, J. Li, Ceram. Int. 46 (2020) 4394–4401. https://doi.org/10.1016/j.ceramint.2019.10.163. [40] H. Hu S. Cai H. Li L. Huang L. Shi D. Zhang ACS Catal. 5 2015 6069 6077 10.1021/acscatal.5b01039 H. Hu, S. Cai, H. Li, L. Huang, L. Shi, D. Zhang, A.C.S. Catal. 5 (2015) 6069–6077. https://doi.org/10.1021/acscatal.5b01039. [41] J. Zhang T. Li C.-A. Wang J.-L. Luo Nanoscale 11 2019 6776 6783 10.1039/C9NR01737B J. Zhang, T. Li, C.-A. Wang, J.-L. Luo, Nanoscale 11 (2019) 6776–6783. https://doi.org/10.1039/C9NR01737B. [42] X. Yao T. Kong S. Yu L. Li F. Yang L. Dong Appl. Surf. Sci. 402 2017 208 217 10.1016/j.apsusc.2017.01.081 X. Yao, T. Kong, S. Yu, L. Li, F. Yang, L. Dong, Appl. Surf. Sci. 402 (2017) 208–217. https://doi.org/10.1016/j.apsusc.2017.01.081. [43] J.-W. Shi G. Gao Z. Fan C. Gao B. Wang Y. Wang Z. Li C. He C. Niu Appl. Catal. A 560 2018 1 11 10.1016/j.apcata.2018.04.033 J.-W. Shi, G. Gao, Z. Fan, C. Gao, B. Wang, Y. Wang, Z. Li, C. He, C. Niu, Appl. Catal., A 560 (2018) 1–11. https://doi.org/10.1016/j.apcata.2018.04.033. [44] Z. Wang G. Shen J. Li H. Liu Q. Wang Y. Chen Appl. Catal. B 138–139 2013 253 259 10.1016/j.apcatb.2013.02.030 Z. Wang, G. Shen, J. Li, H. Liu, Q. Wang, Y. Chen, Appl. Catal., B 138–139 (2013) 253–259. https://doi.org/10.1016/j.apcatb.2013.02.030. [45] F. Kapteijn L. Singoredjo A. Andreini J.A. Moulijn Appl. Catal. B 3 1994 173 189 10.1016/0926-3373(93)E0034-9 F. Kapteijn, L. Singoredjo, A. Andreini, J.A. Moulijn, Appl. Catal., B 3 (1994) 173–189. https://doi.org/10.1016/0926–3373(93)E0034–9. [46] D. Fang J. Xie H. Hu H. Yang F. He Z. Fu Chem. Eng. J. 271 2015 23 30 10.1016/j.cej.2015.02.072 D. Fang, J. Xie, H. Hu, H. Yang, F. He, Z. Fu, Chem. Eng. J. 271 (2015) 23–30. https://doi.org/10.1016/j.cej.2015.02.072. [47] X. Wang H. Ma B. Li Y. Wang S. Zhang W. Li S. Li Chem. Eng. J. 435 2022 134892 10.1016/j.cej.2022.134892 X. Wang, H. Ma, B. Li, Y. Wang, S. Zhang, W. Li, S. Li, Chem. Eng. J. 435 (2022) 134892. https://doi.org/10.1016/j.cej.2022.134892. [48] D. Zhang L. Zhang L. Shi C. Fang H. Li R. Gao L. Huang J. Zhang Nanoscale 5 2013 1127 1136 10.1039/C2NR33006G D. Zhang, L. Zhang, L. Shi, C. Fang, H. Li, R. Gao, L. Huang, J. Zhang, Nanoscale 5 (2013) 1127–1136. https://doi.org/10.1039/C2NR33006G. [49] M. Qiu S. Zhan H. Yu D. Zhu S. Wang Nanoscale 7 2015 2568 2577 10.1039/C4NR06451H M. Qiu, S. Zhan, H. Yu, D. Zhu, S. Wang, Nanoscale 7 (2015) 2568–2577. https://doi.org/10.1039/C4NR06451H. [50] S. Zhang H. Li A. Zhang Z. Sun X. Zhang C. Yang L. Jin Z. Song RSC Adv. 12 2022 1341 1351 10.1039/D1RA08800A S. Zhang, H. Li, A. Zhang, Z. Sun, X. Zhang, C. Yang, L. Jin, Z. Song, R.S.C. Adv. 12 (2022) 1341–1351. https://doi.org/10.1039/D1RA08800A. [51] J. Liu X. Li R. Li Q. Zhao J. Ke H. Xiao L. Wang S. Liu M. Tadé S. Wang Appl. Catal. A 549 2018 289 301 10.1016/j.apcata.2017.10.010 J. Liu, X. Li, R. Li, Q. Zhao, J. Ke, H. Xiao, L. Wang, S. Liu, M. Tadé, S. Wang, Appl. Catal., A 549 (2018) 289–301. https://doi.org/10.1016/j.apcata.2017.10.010. [52] Z. Liu Y. Liu Y. Li H. Su L. Ma Chem. Eng. J. 283 2016 1044 1050 10.1016/j.cej.2015.08.040 Z. Liu, Y. Liu, Y. Li, H. Su, L. Ma, Chem. Eng. J. 283 (2016) 1044–1050. https://doi.org/10.1016/j.cej.2015.08.040. [53] Z. Liu Y. Liu B. Chen T. Zhu L. Ma Catal. Sci. Technol. 6 2016 6688 6696 10.1039/C5CY02278A Z. Liu, Y. Liu, B. Chen, T. Zhu, L. Ma, Catal. Sci. Technol. 6 (2016) 6688–6696. https://doi.org/10.1039/C5CY02278A. [54] Z. Liu X. Feng Z. Zhou Y. Feng J. Li Appl. Surf. Sci. 428 2018 526 533 10.1016/j.apsusc.2017.09.175 Z. Liu, X. Feng, Z. Zhou, Y. Feng, J. Li, Appl. Surf. Sci. 428 (2018) 526–533. https://doi.org/10.1016/j.apsusc.2017.09.175. [55] X. Wu X. Yu Z. Huang H. Shen G. Jing Appl. Catal. B 268 2020 118419 10.1016/j.apcatb.2019.118419 X. Wu, X. Yu, Z. Huang, H. Shen, G. Jing, Appl. Catal., B 268 (2020) 118419. https://doi.org/10.1016/j.apcatb.2019.118419. [56] H. Wu M. He W. Liu L. Jiang J. Cao C. Yang J. Yang J. Peng Y. Liu Q. Liu J. Environ. Chem. Eng. 9 2021 105426 10.1016/j.jece.2021.105426 H. Wu, M. He, W. Liu, L. Jiang, J. Cao, C. Yang, J. Yang, J. Peng, Y. Liu, Q. Liu, J. Environ. Chem. Eng. 9 (2021) 105426. https://doi.org/10.1016/j.jece.2021.105426. [57] Z. Wang J. Lan M. Haneda Z. Liu Catal. Today 376 2021 222 228 10.1016/j.cattod.2020.05.040 Z. Wang, J. Lan, M. Haneda, Z. Liu, Catal. Today 376 (2021) 222–228. https://doi.org/10.1016/j.cattod.2020.05.040. [58] L. Zhang L. Li Y. Cao Y. Xiong S. Wu J. Sun C. Tang F. Gao L. Dong Catal. Sci. Technol. 5 2015 2188 2196 10.1039/C4CY01412J L. Zhang, L. Li, Y. Cao, Y. Xiong, S. Wu, J. Sun, C. Tang, F. Gao, L. Dong, Catal. Sci. Technol. 5 (2015) 2188–2196. https://doi.org/10.1039/C4CY01412J. [59] Y. Geng W. Shan F. Liu S. Yang J. Hazard. Mater. 405 2021 124223 10.1016/j.jhazmat.2020.124223 Y. Geng, W. Shan, F. Liu, S. Yang, J. Hazard. Mater. 405 (2021) 124223. https://doi.org/10.1016/j.jhazmat.2020.124223.",
      "scopus-id": "85142756631",
      "coredata": {
        "eid": "1-s2.0-S0926860X22004896",
        "dc:description": "MnOx catalysts with 3D structure (Mn-HT) were prepared by the hard-template method using KIT-6 as a template, and the catalytic performance for the selective catalytic reduction of NOx by NH3 (NH3-SCR) at low temperatures was investigated. The template KIT-6 prepared by the different hydrothermal temperatures can exert significant effect on the catalytic performance of Mn-HT catalysts. Among the Mn-HT catalyst, the catalyst prepared using the template obtained at the hydrothermal temperature of 140 °C (Mn-140) exhibited the highest catalytic performance. Characterizations showed that Mn-140 catalyst possesses high reducibility with abundant surface oxygen species and Mn4+ species. NH3-TPD and in situ DRIFTS demonstrated that there are more Lewis acid sites and Brønsted acid sites on the surface of Mn-140 catalyst, both of which would promote the adsorption and activation of NH3, leading to the reduction of NOx efficiently to proceed mainly by the Eley-Rideal(E-R) mechanism, accompanied by the Langmuir-Hinshelwood (L-H) mechanism.",
        "openArchiveArticle": "false",
        "prism:coverDate": "2023-01-05",
        "openaccessUserLicense": null,
        "prism:aggregationType": "Journal",
        "prism:url": "https://api.elsevier.com/content/article/pii/S0926860X22004896",
        "dc:creator": [
          {
            "@_fa": "true",
            "$": "Xu, Shiyu"
          },
          {
            "@_fa": "true",
            "$": "Chen, Jiawei"
          },
          {
            "@_fa": "true",
            "$": "Li, Zhenguo"
          },
          {
            "@_fa": "true",
            "$": "Liu, Zhiming"
          }
        ],
        "link": [
          {
            "@_fa": "true",
            "@rel": "self",
            "@href": "https://api.elsevier.com/content/article/pii/S0926860X22004896"
          },
          {
            "@_fa": "true",
            "@rel": "scidir",
            "@href": "https://www.sciencedirect.com/science/article/pii/S0926860X22004896"
          }
        ],
        "dc:format": "application/json",
        "openaccessType": null,
        "pii": "S0926-860X(22)00489-6",
        "prism:volume": "649",
        "articleNumber": "118966",
        "prism:publisher": "Elsevier B.V.",
        "dc:title": "Highly ordered mesoporous MnOx catalyst for the NH3-SCR of NOx at low temperatures",
        "prism:copyright": "© 2022 Elsevier B.V. All rights reserved.",
        "openaccess": "0",
        "prism:issn": "0926860X",
        "dcterms:subject": [
          {
            "@_fa": "true",
            "$": "Nitrogen oxides"
          },
          {
            "@_fa": "true",
            "$": "NH3-SCR"
          },
          {
            "@_fa": "true",
            "$": "MnOx"
          },
          {
            "@_fa": "true",
            "$": "Reaction mechanism"
          }
        ],
        "openaccessArticle": "false",
        "prism:publicationName": "Applied Catalysis A: General",
        "openaccessSponsorType": null,
        "prism:pageRange": "118966",
        "pubType": "fla",
        "prism:coverDisplayDate": "5 January 2023",
        "prism:doi": "10.1016/j.apcata.2022.118966",
        "prism:startingPage": "118966",
        "dc:identifier": "doi:10.1016/j.apcata.2022.118966",
        "openaccessSponsorName": null
      },
      "objects": {
        "object": [
          {
            "@category": "standard",
            "@height": "443",
            "@width": "282",
            "@_fa": "true",
            "$": "https://api.elsevier.com/content/object/eid/1-s2.0-S0926860X22004896-gr7.jpg?httpAccept=%2A%2F%2A",
            "@multimediatype": "JPEG image file",
            "@type": "IMAGE-DOWNSAMPLED",
            "@size": "40417",
            "@ref": "gr7",
            "@mimetype": "image/jpeg"
          },
          {
            "@category": "standard",
            "@height": "225",
            "@width": "282",
            "@_fa": "true",
            "$": "https://api.elsevier.com/content/object/eid/1-s2.0-S0926860X22004896-gr6.jpg?httpAccept=%2A%2F%2A",
            "@multimediatype": "JPEG image file",
            "@type": "IMAGE-DOWNSAMPLED",
            "@size": "15017",
            "@ref": "gr6",
            "@mimetype": "image/jpeg"
          },
          {
            "@category": "standard",
            "@height": "452",
            "@width": "282",
            "@_fa": "true",
            "$": "https://api.elsevier.com/content/object/eid/1-s2.0-S0926860X22004896-gr9.jpg?httpAccept=%2A%2F%2A",
            "@multimediatype": "JPEG image file",
            "@type": "IMAGE-DOWNSAMPLED",
            "@size": "27317",
            "@ref": "gr9",
            "@mimetype": "image/jpeg"
          },
          {
            "@category": "standard",
            "@height": "224",
            "@width": "282",
            "@_fa": "true",
            "$": "https://api.elsevier.com/content/object/eid/1-s2.0-S0926860X22004896-gr8.jpg?httpAccept=%2A%2F%2A",
            "@multimediatype": "JPEG image file",
            "@type": "IMAGE-DOWNSAMPLED",
            "@size": "16811",
            "@ref": "gr8",
            "@mimetype": "image/jpeg"
          },
          {
            "@category": "standard",
            "@height": "663",
            "@width": "282",
            "@_fa": "true",
            "$": "https://api.elsevier.com/content/object/eid/1-s2.0-S0926860X22004896-gr10.jpg?httpAccept=%2A%2F%2A",
            "@multimediatype": "JPEG image file",
            "@type": "IMAGE-DOWNSAMPLED",
            "@size": "56086",
            "@ref": "gr10",
            "@mimetype": "image/jpeg"
          },
          {
            "@category": "standard",
            "@height": "451",
            "@width": "282",
            "@_fa": "true",
            "$": "https://api.elsevier.com/content/object/eid/1-s2.0-S0926860X22004896-gr12.jpg?httpAccept=%2A%2F%2A",
            "@multimediatype": "JPEG image file",
            "@type": "IMAGE-DOWNSAMPLED",
            "@size": "42958",
            "@ref": "gr12",
            "@mimetype": "image/jpeg"
          },
          {
            "@category": "standard",
            "@height": "669",
            "@width": "282",
            "@_fa": "true",
            "$": "https://api.elsevier.com/content/object/eid/1-s2.0-S0926860X22004896-gr11.jpg?httpAccept=%2A%2F%2A",
            "@multimediatype": "JPEG image file",
            "@type": "IMAGE-DOWNSAMPLED",
            "@size": "49873",
            "@ref": "gr11",
            "@mimetype": "image/jpeg"
          },
          {
            "@category": "standard",
            "@height": "526",
            "@width": "339",
            "@_fa": "true",
            "$": "https://api.elsevier.com/content/object/eid/1-s2.0-S0926860X22004896-gr1.jpg?httpAccept=%2A%2F%2A",
            "@multimediatype": "JPEG image file",
            "@type": "IMAGE-DOWNSAMPLED",
            "@size": "42020",
            "@ref": "gr1",
            "@mimetype": "image/jpeg"
          },
          {
            "@category": "standard",
            "@height": "207",
            "@width": "282",
            "@_fa": "true",
            "$": "https://api.elsevier.com/content/object/eid/1-s2.0-S0926860X22004896-gr3.jpg?httpAccept=%2A%2F%2A",
            "@multimediatype": "JPEG image file",
            "@type": "IMAGE-DOWNSAMPLED",
            "@size": "13058",
            "@ref": "gr3",
            "@mimetype": "image/jpeg"
          },
          {
            "@category": "standard",
            "@height": "215",
            "@width": "282",
            "@_fa": "true",
            "$": "https://api.elsevier.com/content/object/eid/1-s2.0-S0926860X22004896-gr2.jpg?httpAccept=%2A%2F%2A",
            "@multimediatype": "JPEG image file",
            "@type": "IMAGE-DOWNSAMPLED",
            "@size": "22354",
            "@ref": "gr2",
            "@mimetype": "image/jpeg"
          },
          {
            "@category": "standard",
            "@height": "457",
            "@width": "282",
            "@_fa": "true",
            "$": "https://api.elsevier.com/content/object/eid/1-s2.0-S0926860X22004896-gr5.jpg?httpAccept=%2A%2F%2A",
            "@multimediatype": "JPEG image file",
            "@type": "IMAGE-DOWNSAMPLED",
            "@size": "32753",
            "@ref": "gr5",
            "@mimetype": "image/jpeg"
          },
          {
            "@category": "standard",
            "@height": "459",
            "@width": "282",
            "@_fa": "true",
            "$": "https://api.elsevier.com/content/object/eid/1-s2.0-S0926860X22004896-gr4.jpg?httpAccept=%2A%2F%2A",
            "@multimediatype": "JPEG image file",
            "@type": "IMAGE-DOWNSAMPLED",
            "@size": "33429",
            "@ref": "gr4",
            "@mimetype": "image/jpeg"
          },
          {
            "@category": "standard",
            "@height": "200",
            "@width": "264",
            "@_fa": "true",
            "$": "https://api.elsevier.com/content/object/eid/1-s2.0-S0926860X22004896-ga1.jpg?httpAccept=%2A%2F%2A",
            "@multimediatype": "JPEG image file",
            "@type": "IMAGE-DOWNSAMPLED",
            "@size": "16613",
            "@ref": "ga1",
            "@mimetype": "image/jpeg"
          },
          {
            "@category": "thumbnail",
            "@height": "164",
            "@width": "104",
            "@_fa": "true",
            "$": "https://api.elsevier.com/content/object/eid/1-s2.0-S0926860X22004896-gr7.sml?httpAccept=%2A%2F%2A",
            "@multimediatype": "GIF image file",
            "@type": "IMAGE-THUMBNAIL",
            "@size": "6801",
            "@ref": "gr7",
            "@mimetype": "image/gif"
          },
          {
            "@category": "thumbnail",
            "@height": "164",
            "@width": "205",
            "@_fa": "true",
            "$": "https://api.elsevier.com/content/object/eid/1-s2.0-S0926860X22004896-gr6.sml?httpAccept=%2A%2F%2A",
            "@multimediatype": "GIF image file",
            "@type": "IMAGE-THUMBNAIL",
            "@size": "6235",
            "@ref": "gr6",
            "@mimetype": "image/gif"
          },
          {
            "@category": "thumbnail",
            "@height": "163",
            "@width": "102",
            "@_fa": "true",
            "$": "https://api.elsevier.com/content/object/eid/1-s2.0-S0926860X22004896-gr9.sml?httpAccept=%2A%2F%2A",
            "@multimediatype": "GIF image file",
            "@type": "IMAGE-THUMBNAIL",
            "@size": "4232",
            "@ref": "gr9",
            "@mimetype": "image/gif"
          },
          {
            "@category": "thumbnail",
            "@height": "164",
            "@width": "206",
            "@_fa": "true",
            "$": "https://api.elsevier.com/content/object/eid/1-s2.0-S0926860X22004896-gr8.sml?httpAccept=%2A%2F%2A",
            "@multimediatype": "GIF image file",
            "@type": "IMAGE-THUMBNAIL",
            "@size": "7388",
            "@ref": "gr8",
            "@mimetype": "image/gif"
          },
          {
            "@category": "thumbnail",
            "@height": "162",
            "@width": "69",
            "@_fa": "true",
            "$": "https://api.elsevier.com/content/object/eid/1-s2.0-S0926860X22004896-gr10.sml?httpAccept=%2A%2F%2A",
            "@multimediatype": "GIF image file",
            "@type": "IMAGE-THUMBNAIL",
            "@size": "4630",
            "@ref": "gr10",
            "@mimetype": "image/gif"
          },
          {
            "@category": "thumbnail",
            "@height": "163",
            "@width": "102",
            "@_fa": "true",
            "$": "https://api.elsevier.com/content/object/eid/1-s2.0-S0926860X22004896-gr12.sml?httpAccept=%2A%2F%2A",
            "@multimediatype": "GIF image file",
            "@type": "IMAGE-THUMBNAIL",
            "@size": "6221",
            "@ref": "gr12",
            "@mimetype": "image/gif"
          },
          {
            "@category": "thumbnail",
            "@height": "164",
            "@width": "69",
            "@_fa": "true",
            "$": "https://api.elsevier.com/content/object/eid/1-s2.0-S0926860X22004896-gr11.sml?httpAccept=%2A%2F%2A",
            "@multimediatype": "GIF image file",
            "@type": "IMAGE-THUMBNAIL",
            "@size": "4124",
            "@ref": "gr11",
            "@mimetype": "image/gif"
          },
          {
            "@category": "thumbnail",
            "@height": "163",
            "@width": "105",
            "@_fa": "true",
            "$": "https://api.elsevier.com/content/object/eid/1-s2.0-S0926860X22004896-gr1.sml?httpAccept=%2A%2F%2A",
            "@multimediatype": "GIF image file",
            "@type": "IMAGE-THUMBNAIL",
            "@size": "4581",
            "@ref": "gr1",
            "@mimetype": "image/gif"
          },
          {
            "@category": "thumbnail",
            "@height": "161",
            "@width": "219",
            "@_fa": "true",
            "$": "https://api.elsevier.com/content/object/eid/1-s2.0-S0926860X22004896-gr3.sml?httpAccept=%2A%2F%2A",
            "@multimediatype": "GIF image file",
            "@type": "IMAGE-THUMBNAIL",
            "@size": "5913",
            "@ref": "gr3",
            "@mimetype": "image/gif"
          },
          {
            "@category": "thumbnail",
            "@height": "164",
            "@width": "215",
            "@_fa": "true",
            "$": "https://api.elsevier.com/content/object/eid/1-s2.0-S0926860X22004896-gr2.sml?httpAccept=%2A%2F%2A",
            "@multimediatype": "GIF image file",
            "@type": "IMAGE-THUMBNAIL",
            "@size": "9901",
            "@ref": "gr2",
            "@mimetype": "image/gif"
          },
          {
            "@category": "thumbnail",
            "@height": "164",
            "@width": "101",
            "@_fa": "true",
            "$": "https://api.elsevier.com/content/object/eid/1-s2.0-S0926860X22004896-gr5.sml?httpAccept=%2A%2F%2A",
            "@multimediatype": "GIF image file",
            "@type": "IMAGE-THUMBNAIL",
            "@size": "4703",
            "@ref": "gr5",
            "@mimetype": "image/gif"
          },
          {
            "@category": "thumbnail",
            "@height": "163",
            "@width": "100",
            "@_fa": "true",
            "$": "https://api.elsevier.com/content/object/eid/1-s2.0-S0926860X22004896-gr4.sml?httpAccept=%2A%2F%2A",
            "@multimediatype": "GIF image file",
            "@type": "IMAGE-THUMBNAIL",
            "@size": "4852",
            "@ref": "gr4",
            "@mimetype": "image/gif"
          },
          {
            "@category": "thumbnail",
            "@height": "164",
            "@width": "217",
            "@_fa": "true",
            "$": "https://api.elsevier.com/content/object/eid/1-s2.0-S0926860X22004896-ga1.sml?httpAccept=%2A%2F%2A",
            "@multimediatype": "GIF image file",
            "@type": "IMAGE-THUMBNAIL",
            "@size": "11032",
            "@ref": "ga1",
            "@mimetype": "image/gif"
          },
          {
            "@category": "high",
            "@height": "1961",
            "@width": "1247",
            "@_fa": "true",
            "$": "https://api.elsevier.com/content/object/eid/1-s2.0-S0926860X22004896-gr7_lrg.jpg?httpAccept=%2A%2F%2A",
            "@multimediatype": "JPEG image file",
            "@type": "IMAGE-HIGH-RES",
            "@size": "282682",
            "@ref": "gr7",
            "@mimetype": "image/jpeg"
          },
          {
            "@category": "high",
            "@height": "996",
            "@width": "1247",
            "@_fa": "true",
            "$": "https://api.elsevier.com/content/object/eid/1-s2.0-S0926860X22004896-gr6_lrg.jpg?httpAccept=%2A%2F%2A",
            "@multimediatype": "JPEG image file",
            "@type": "IMAGE-HIGH-RES",
            "@size": "98298",
            "@ref": "gr6",
            "@mimetype": "image/jpeg"
          },
          {
            "@category": "high",
            "@height": "1997",
            "@width": "1247",
            "@_fa": "true",
            "$": "https://api.elsevier.com/content/object/eid/1-s2.0-S0926860X22004896-gr9_lrg.jpg?httpAccept=%2A%2F%2A",
            "@multimediatype": "JPEG image file",
            "@type": "IMAGE-HIGH-RES",
            "@size": "160286",
            "@ref": "gr9",
            "@mimetype": "image/jpeg"
          },
          {
            "@category": "high",
            "@height": "991",
            "@width": "1247",
            "@_fa": "true",
            "$": "https://api.elsevier.com/content/object/eid/1-s2.0-S0926860X22004896-gr8_lrg.jpg?httpAccept=%2A%2F%2A",
            "@multimediatype": "JPEG image file",
            "@type": "IMAGE-HIGH-RES",
            "@size": "103742",
            "@ref": "gr8",
            "@mimetype": "image/jpeg"
          },
          {
            "@category": "high",
            "@height": "2932",
            "@width": "1247",
            "@_fa": "true",
            "$": "https://api.elsevier.com/content/object/eid/1-s2.0-S0926860X22004896-gr10_lrg.jpg?httpAccept=%2A%2F%2A",
            "@multimediatype": "JPEG image file",
            "@type": "IMAGE-HIGH-RES",
            "@size": "362553",
            "@ref": "gr10",
            "@mimetype": "image/jpeg"
          },
          {
            "@category": "high",
            "@height": "1995",
            "@width": "1247",
            "@_fa": "true",
            "$": "https://api.elsevier.com/content/object/eid/1-s2.0-S0926860X22004896-gr12_lrg.jpg?httpAccept=%2A%2F%2A",
            "@multimediatype": "JPEG image file",
            "@type": "IMAGE-HIGH-RES",
            "@size": "281792",
            "@ref": "gr12",
            "@mimetype": "image/jpeg"
          },
          {
            "@category": "high",
            "@height": "2958",
            "@width": "1247",
            "@_fa": "true",
            "$": "https://api.elsevier.com/content/object/eid/1-s2.0-S0926860X22004896-gr11_lrg.jpg?httpAccept=%2A%2F%2A",
            "@multimediatype": "JPEG image file",
            "@type": "IMAGE-HIGH-RES",
            "@size": "319137",
            "@ref": "gr11",
            "@mimetype": "image/jpeg"
          },
          {
            "@category": "high",
            "@height": "2323",
            "@width": "1497",
            "@_fa": "true",
            "$": "https://api.elsevier.com/content/object/eid/1-s2.0-S0926860X22004896-gr1_lrg.jpg?httpAccept=%2A%2F%2A",
            "@multimediatype": "JPEG image file",
            "@type": "IMAGE-HIGH-RES",
            "@size": "246986",
            "@ref": "gr1",
            "@mimetype": "image/jpeg"
          },
          {
            "@category": "high",
            "@height": "917",
            "@width": "1247",
            "@_fa": "true",
            "$": "https://api.elsevier.com/content/object/eid/1-s2.0-S0926860X22004896-gr3_lrg.jpg?httpAccept=%2A%2F%2A",
            "@multimediatype": "JPEG image file",
            "@type": "IMAGE-HIGH-RES",
            "@size": "71342",
            "@ref": "gr3",
            "@mimetype": "image/jpeg"
          },
          {
            "@category": "high",
            "@height": "951",
            "@width": "1247",
            "@_fa": "true",
            "$": "https://api.elsevier.com/content/object/eid/1-s2.0-S0926860X22004896-gr2_lrg.jpg?httpAccept=%2A%2F%2A",
            "@multimediatype": "JPEG image file",
            "@type": "IMAGE-HIGH-RES",
            "@size": "134935",
            "@ref": "gr2",
            "@mimetype": "image/jpeg"
          },
          {
            "@category": "high",
            "@height": "2030",
            "@width": "1252",
            "@_fa": "true",
            "$": "https://api.elsevier.com/content/object/eid/1-s2.0-S0926860X22004896-gr5_lrg.jpg?httpAccept=%2A%2F%2A",
            "@multimediatype": "JPEG image file",
            "@type": "IMAGE-HIGH-RES",
            "@size": "200900",
            "@ref": "gr5",
            "@mimetype": "image/jpeg"
          },
          {
            "@category": "high",
            "@height": "2028",
            "@width": "1247",
            "@_fa": "true",
            "$": "https://api.elsevier.com/content/object/eid/1-s2.0-S0926860X22004896-gr4_lrg.jpg?httpAccept=%2A%2F%2A",
            "@multimediatype": "JPEG image file",
            "@type": "IMAGE-HIGH-RES",
            "@size": "229164",
            "@ref": "gr4",
            "@mimetype": "image/jpeg"
          },
          {
            "@category": "high",
            "@height": "886",
            "@width": "1172",
            "@_fa": "true",
            "$": "https://api.elsevier.com/content/object/eid/1-s2.0-S0926860X22004896-ga1_lrg.jpg?httpAccept=%2A%2F%2A",
            "@multimediatype": "JPEG image file",
            "@type": "IMAGE-HIGH-RES",
            "@size": "121926",
            "@ref": "ga1",
            "@mimetype": "image/jpeg"
          },
          {
            "@category": "standard",
            "@_fa": "true",
            "$": "https://api.elsevier.com/content/object/eid/1-s2.0-S0926860X22004896-mmc1.docx?httpAccept=%2A%2F%2A",
            "@multimediatype": "Microsoft Word file",
            "@type": "APPLICATION",
            "@size": "46411",
            "@ref": "mmc1",
            "@mimetype": "application/word"
          },
          {
            "@category": "standard",
            "@_fa": "true",
            "$": "https://api.elsevier.com/content/object/eid/1-s2.0-S0926860X22004896-am.pdf?httpAccept=%2A%2F%2A",
            "@multimediatype": "Acrobat PDF file",
            "@type": "AAM-PDF",
            "@size": "790874",
            "@ref": "am",
            "@mimetype": "application/pdf"
          }
        ]
      },
      "link": {
        "@rel": "abstract",
        "@href": "https://api.elsevier.com/content/abstract/scopus_id/85142756631"
      }
    }
  }
}