{
  "metadata": {
    "title": "Enhancing propane oxidation with CTAB-modified ZIF-67-derived hollow Co<ce:inf loc=post>3</ce:inf>O<ce:inf loc=post>4</ce:inf>-CNTs catalysts through reduction-oxidation treatment",
    "authors": "; ; ",
    "journal": "Applied Catalysis A: General",
    "date": "2025-06-05",
    "doi": "10.1016/j.apcata.2025.120253",
    "abstract": "",
    "uri": "https://api.elsevier.com/content/article/pii/S0926860X25001541",
    "pii": "S0926860X25001541"
  },
  "fulltext": {
    "full-text-retrieval-response": {
      "scopus-eid": "2-s2.0-105001710654",
      "originalText": "serial JL 271346 291210 291744 291809 31 Applied Catalysis A: General APPLIEDCATALYSISAGENERAL 2025-04-01 2025-04-01 2025-04-06 2025-04-06 2025-04-22T04:52:45 1-s2.0-S0926860X25001541 S0926-860X(25)00154-1 S0926860X25001541 10.1016/j.apcata.2025.120253 S300 S300.1 FULL-TEXT 1-s2.0-S0926860X25X00077 2025-04-22T03:58:04.924833Z 0 0 20250605 2025 2025-04-01T22:56:00.83945Z absattachment articleinfo articlenumber articletitlenorm authfirstinitialnorm authfirstsurnamenorm cid cids contenttype copyright crossmark dateloaded dateloadedtxt datesearch datesort dateupdated dco docsubtype doctype doi eid ewtransactionid hubeid indexeddate issn issnnorm itemstage itemtransactionid itemweight openaccess openarchive pg pgfirst pii piinorm pubdatestart pubdatetxt pubyr sortorder srctitle srctitlenorm srctype ssids alllist content subj subheadings suppl tomb volfirst volissue volumelist webpdf webpdfpagecount yearnav figure table e-component body acknowledge affil appendices articletitle auth authfirstini authfull authkeywords authlast grantnumber grantsponsor grantsponsorid highlightsabst orcid primabst ref specialabst 0926-860X 0926860X true 699 699 C Volume 699 5 120253 120253 120253 20250605 5 June 2025 2025-06-05 2025 article fla © 2025 Published by Elsevier B.V. ENHANCINGPROPANEOXIDATIONCTABMODIFIEDZIF67DERIVEDHOLLOWCO3O4CNTSCATALYSTSTHROUGHREDUCTIONOXIDATIONTREATMENT LI X 1 Introduction 2 Materials and methods 2.1 Catalyst preparation 2.1.1 Preparation of cobalt oxide-CNTs catalysts 2.2 Characterization of catalyst 2.3 Catalytic activity 3 Results and discussion 3.1 Catalyst characterization 3.2 Catalyst performance 3.3 The reaction mechanism over 300 A 4 Conclusions CRediT authorship contribution statement Acknowledgments Appendix A Supplementary material References HE 2019 4471 4568 C GUO 2021 119447 Y GUO 2004 1363 1372 H ZHANG 2016 270 278 Z ZHANG 2023 122908 W LIANG 2022 112762 S PUERTOLAS 2013 547 558 B DERIVAS 2011 88 97 B GARCIA 2010 16 27 T SALEK 2014 1 7 G GILBARBARIN 2023 109841 A ZHU 2022 150 162 W DING 2023 6067 6075 J ZHOU 2024 8216 8219 Q YANG 2024 114792 J ZHANG 2023 122407 M HU 2022 8172 8177 Y HUANG 2023 66 78 Y CHEN 2015 5010 5016 Y ZHAO 2019 77 86 J KONG 2018 161 168 W QIN 2024 113811 Y ZHANG 2024 345703 J YANG 2018 330 335 J CAI 2020 125071 T MEJIA 2018 4459 C ZHANG 2018 754 763 H CAI 2017 1 13 J LI 2019 439 446 Y BAHLAWANE 2009 9224 N DAI 2018 4314 4331 Y LI 2016 29788 D JOHAN 2014 450 454 M WU 2014 1932 1938 R LI 2023 237 247 G WANG 2017 392 402 C HU 2023 105002 C SONG 2014 4629 4639 W LUO 2008 310 324 J MA 2020 125911 L ZHANG 2021 15143 15158 W LIU 2022 112297 C HUANG 2022 17278 17287 Z PENG 2022 295 H LI 2021 119512 G ZHANG 2020 7269 7282 T TAO 2022 134884 J OBRIEN 2017 1 8 C HU 2018 9531 9541 Z LIAO 2020 442 453 W JIAN 2021 119657 Y LIX2025X120253 LIX2025X120253XX 2027-04-06T00:00:00.000Z 2027-04-06T00:00:00.000Z http://creativecommons.org/licenses/by-nc-nd/4.0/ © 2025 Published by Elsevier B.V. 2025-04-08T03:27:23.263Z http://vtw.elsevier.com/data/voc/AddOnTypes/50.7/aggregated-refined Shanghai Rising-Star Program 17QB1402800 Shanghai Rising-Star Program http://data.elsevier.com/vocabulary/SciValFunders/501100013105 http://sws.geonames.org/1814991/ National Natural Science Foundation of China 21607098 22376143 NSFC National Natural Science Foundation of China http://data.elsevier.com/vocabulary/SciValFunders/501100001809 http://sws.geonames.org/1814991/ This work was supported by National Natural Science Foundation of China (grant number 21607098, 22376143), Shanghai Rising-Star Program (grant number 17QB1402800). https://doi.org/10.15223/policy-017 https://doi.org/10.15223/policy-037 https://doi.org/10.15223/policy-012 https://doi.org/10.15223/policy-029 https://doi.org/10.15223/policy-004 item S0926-860X(25)00154-1 S0926860X25001541 1-s2.0-S0926860X25001541 10.1016/j.apcata.2025.120253 271346 2025-04-22T03:58:04.924833Z 2025-06-05 1-s2.0-S0926860X25001541-main.pdf https://s3-eu-west-1.amazonaws.com/prod-ucs-content-store-eu-west/content/pii:S0926860X25001541/MAIN/application/pdf/bbf0425e938901b065d2db2a802fe1b2/main.pdf main.pdf pdf true 6520275 MAIN 10 1-s2.0-S0926860X25001541-main_1.png https://s3-eu-west-1.amazonaws.com/prod-ucs-content-store-eu-west/content/pii:S0926860X25001541/PREVIEW/image/png/b431c1271d74d6ec23f22e0b3e5f72ef/main_1.png main_1.png png 59597 849 656 IMAGE-WEB-PDF 1 1-s2.0-S0926860X25001541-gr1.jpg https://s3-eu-west-1.amazonaws.com/prod-ucs-content-store-eu-west/content/pii:S0926860X25001541/gr1/DOWNSAMPLED/image/jpeg/5b3ba23ae6d3f3d7253a5b39de3c5b49/gr1.jpg gr1 gr1.jpg jpg 37704 251 565 IMAGE-DOWNSAMPLED 1-s2.0-S0926860X25001541-gr2.jpg https://s3-eu-west-1.amazonaws.com/prod-ucs-content-store-eu-west/content/pii:S0926860X25001541/gr2/DOWNSAMPLED/image/jpeg/824f1ad4775ba793995489de9c5ba900/gr2.jpg gr2 gr2.jpg jpg 115953 394 791 IMAGE-DOWNSAMPLED 1-s2.0-S0926860X25001541-ga1.jpg https://s3-eu-west-1.amazonaws.com/prod-ucs-content-store-eu-west/content/pii:S0926860X25001541/ga1/DOWNSAMPLED/image/jpeg/97f39bde5093a7ae7aab2f179945502a/ga1.jpg ga1 true ga1.jpg jpg 25098 200 372 IMAGE-DOWNSAMPLED 1-s2.0-S0926860X25001541-gr7.jpg https://s3-eu-west-1.amazonaws.com/prod-ucs-content-store-eu-west/content/pii:S0926860X25001541/gr7/DOWNSAMPLED/image/jpeg/cdad3e2dca2b362b5e6ad78332993a38/gr7.jpg gr7 gr7.jpg jpg 98866 433 791 IMAGE-DOWNSAMPLED 1-s2.0-S0926860X25001541-gr3.jpg https://s3-eu-west-1.amazonaws.com/prod-ucs-content-store-eu-west/content/pii:S0926860X25001541/gr3/DOWNSAMPLED/image/jpeg/ae7616c37705a66d8470de530f62e393/gr3.jpg gr3 gr3.jpg jpg 161883 576 791 IMAGE-DOWNSAMPLED 1-s2.0-S0926860X25001541-gr4.jpg https://s3-eu-west-1.amazonaws.com/prod-ucs-content-store-eu-west/content/pii:S0926860X25001541/gr4/DOWNSAMPLED/image/jpeg/46c81d7e763b8583bc9e4717f898ae58/gr4.jpg gr4 gr4.jpg jpg 63493 474 565 IMAGE-DOWNSAMPLED 1-s2.0-S0926860X25001541-gr5.jpg https://s3-eu-west-1.amazonaws.com/prod-ucs-content-store-eu-west/content/pii:S0926860X25001541/gr5/DOWNSAMPLED/image/jpeg/e4c3c5ebc46d8cdb38262be0d6ac1900/gr5.jpg gr5 gr5.jpg jpg 19901 264 339 IMAGE-DOWNSAMPLED 1-s2.0-S0926860X25001541-gr6.jpg https://s3-eu-west-1.amazonaws.com/prod-ucs-content-store-eu-west/content/pii:S0926860X25001541/gr6/DOWNSAMPLED/image/jpeg/74ad9b1a3b8b52f36aae4bbb3e8cc91b/gr6.jpg gr6 gr6.jpg jpg 42516 408 565 IMAGE-DOWNSAMPLED 1-s2.0-S0926860X25001541-gr1.sml https://s3-eu-west-1.amazonaws.com/prod-ucs-content-store-eu-west/content/pii:S0926860X25001541/gr1/THUMBNAIL/image/gif/73364f1b9cd5e9b29d7a0ece533bdb47/gr1.sml gr1 gr1.sml sml 7204 97 219 IMAGE-THUMBNAIL 1-s2.0-S0926860X25001541-gr2.sml https://s3-eu-west-1.amazonaws.com/prod-ucs-content-store-eu-west/content/pii:S0926860X25001541/gr2/THUMBNAIL/image/gif/5eb92052dd071f2532adf0203a94abd9/gr2.sml gr2 gr2.sml sml 17774 109 219 IMAGE-THUMBNAIL 1-s2.0-S0926860X25001541-ga1.sml https://s3-eu-west-1.amazonaws.com/prod-ucs-content-store-eu-west/content/pii:S0926860X25001541/ga1/THUMBNAIL/image/gif/13f4dce6c209b1b92b21dd497284097a/ga1.sml ga1 true ga1.sml sml 13888 118 219 IMAGE-THUMBNAIL 1-s2.0-S0926860X25001541-gr7.sml https://s3-eu-west-1.amazonaws.com/prod-ucs-content-store-eu-west/content/pii:S0926860X25001541/gr7/THUMBNAIL/image/gif/63b810ebe8e69c5b398ee410ffc8b198/gr7.sml gr7 gr7.sml sml 11314 120 219 IMAGE-THUMBNAIL 1-s2.0-S0926860X25001541-gr3.sml https://s3-eu-west-1.amazonaws.com/prod-ucs-content-store-eu-west/content/pii:S0926860X25001541/gr3/THUMBNAIL/image/gif/b190b722fd85cc68d6049970db1bed42/gr3.sml gr3 gr3.sml sml 25856 160 219 IMAGE-THUMBNAIL 1-s2.0-S0926860X25001541-gr4.sml https://s3-eu-west-1.amazonaws.com/prod-ucs-content-store-eu-west/content/pii:S0926860X25001541/gr4/THUMBNAIL/image/gif/4ed2b497b79ac659e7e3d5c490804846/gr4.sml gr4 gr4.sml sml 11203 164 195 IMAGE-THUMBNAIL 1-s2.0-S0926860X25001541-gr5.sml https://s3-eu-west-1.amazonaws.com/prod-ucs-content-store-eu-west/content/pii:S0926860X25001541/gr5/THUMBNAIL/image/gif/83da76f159ba76d378c483721673c9fc/gr5.sml gr5 gr5.sml sml 7898 164 211 IMAGE-THUMBNAIL 1-s2.0-S0926860X25001541-gr6.sml https://s3-eu-west-1.amazonaws.com/prod-ucs-content-store-eu-west/content/pii:S0926860X25001784/gr6/THUMBNAIL/image/gif/696529d489662582cb3604aad4e54ea7/gr6.sml gr6 gr6.sml sml 7733 158 219 IMAGE-THUMBNAIL 1-s2.0-S0926860X25001541-gr1_lrg.jpg https://s3-eu-west-1.amazonaws.com/prod-ucs-content-store-eu-west/content/pii:S0926860X25001541/HIGHRES/image/jpeg/3e742f53755922646bd4f7174286db24/gr1_lrg.jpg gr1 gr1_lrg.jpg jpg 191624 1109 2495 IMAGE-HIGH-RES 1-s2.0-S0926860X25001541-gr2_lrg.jpg https://s3-eu-west-1.amazonaws.com/prod-ucs-content-store-eu-west/content/pii:S0926860X25001541/HIGHRES/image/jpeg/a7e67c42d4469ca849e16f234a437b01/gr2_lrg.jpg gr2 gr2_lrg.jpg jpg 534223 1739 3493 IMAGE-HIGH-RES 1-s2.0-S0926860X25001541-ga1_lrg.jpg https://s3-eu-west-1.amazonaws.com/prod-ucs-content-store-eu-west/content/pii:S0926860X25001541/HIGHRES/image/jpeg/86b71cbf61cca32840f56545207369f4/ga1_lrg.jpg ga1 true ga1_lrg.jpg jpg 192143 886 1648 IMAGE-HIGH-RES 1-s2.0-S0926860X25001541-gr7_lrg.jpg https://s3-eu-west-1.amazonaws.com/prod-ucs-content-store-eu-west/content/pii:S0926860X25001541/HIGHRES/image/jpeg/1df2516a4f2a4af1180cd4bed9db9653/gr7_lrg.jpg gr7 gr7_lrg.jpg jpg 510244 1914 3493 IMAGE-HIGH-RES 1-s2.0-S0926860X25001541-gr3_lrg.jpg https://s3-eu-west-1.amazonaws.com/prod-ucs-content-store-eu-west/content/pii:S0926860X25001541/HIGHRES/image/jpeg/4c71f12c4d4795df8ec6923101d9f9df/gr3_lrg.jpg gr3 gr3_lrg.jpg jpg 911557 2544 3493 IMAGE-HIGH-RES 1-s2.0-S0926860X25001541-gr4_lrg.jpg https://s3-eu-west-1.amazonaws.com/prod-ucs-content-store-eu-west/content/pii:S0926860X25001541/HIGHRES/image/jpeg/7dc40aa42005535c86c24ad45f9492c8/gr4_lrg.jpg gr4 gr4_lrg.jpg jpg 347459 2094 2495 IMAGE-HIGH-RES 1-s2.0-S0926860X25001541-gr5_lrg.jpg https://s3-eu-west-1.amazonaws.com/prod-ucs-content-store-eu-west/content/pii:S0926860X25001541/HIGHRES/image/jpeg/24a61b548a22498b4bec74c349298557/gr5_lrg.jpg gr5 gr5_lrg.jpg jpg 107836 1164 1497 IMAGE-HIGH-RES 1-s2.0-S0926860X25001541-gr6_lrg.jpg https://s3-eu-west-1.amazonaws.com/prod-ucs-content-store-eu-west/content/pii:S0926860X25001784/HIGHRES/image/jpeg/edbc9e661769a6b3b5014ae6c4fb024f/gr6_lrg.jpg gr6 gr6_lrg.jpg jpg 216419 1802 2495 IMAGE-HIGH-RES 1-s2.0-S0926860X25001541-mmc1.docx https://s3-eu-west-1.amazonaws.com/prod-ucs-content-store-eu-west/content/pii:S0926860X25001541/mmc1/MAIN/application/vnd.openxmlformats-officedocument.wordprocessingml.document/561d6890fa2ef266170b06eae10aa7d7/mmc1.docx mmc1 mmc1.docx docx 50428199 APPLICATION APCATA 120253 120253 S0926-860X(25)00154-1 10.1016/j.apcata.2025.120253 Fig. 1 (a) XRD patterns and (b) Raman spectra of CTAB-ZIF-67, 800 H and 300A-900A catalysts. Fig. 1 Fig. 2 FESEM images of (a) CTAB-ZIF-67; (b-c) 800 H; (d) 300 A; (e) 450 A; (f) 600 A and (g) 900 A. Fig. 2 Fig. 3 (a, b, d, e, g, h, i) TEM images and (c, f) HRTEM images of the prepared samples (top: 800 H; middle: 300 A; bottle: 450 A (g), 600 A (h) and 900 A(i)). Fig. 3 Fig. 4 (a) Nitrogen adsorption-desorption isotherm, (b) Pore diameter distribution, (c) Co 2p and (d) O 1 s XPS spectrum of 300 A-900 A catalysts. Fig. 4 Fig. 5 H2-TPR profiles of 300 A-900 A catalysts. Fig. 5 Fig. 6 (a) Activity chart of 300A-900A catalysts for propane combustion (propane concentration 0.1 vol%, GHSV = 30,000 mL/(gcat·h); (b) Stability test of propane combustion (sample: 300 A, reaction conditions: propane concentration 0.1 vol%, GHSV=30,000 mL/(gcat·h), T = 220 °C); (c) Arrhenius plots of ln (r * 106) verses 1000/T for 300A-900A catalysts; (d) The relationship curve between the intrinsic rates of 300A-900A catalysts at 164 °C and their initial reduction temperatures as well as their Osur/Olatt ratio. Fig. 6 Fig. 7 In situ DRIFTS spectra of (a-c) 0.1 vol% C3H8 + N2 feed gas was adsorbed at 50 °C for 30 mins and then was oxidized in air at 50–300 °C, (d) Probable propane oxidation mechanism on 300 A catalyst. Fig. 7 Table 1 The physicochemical properties and XPS data of 300A-900A catalysts. Table 1 Catalysts Crystalline size of Co3O4 a (nm) BET Surface area (m2/g) Average pore diameterb (nm) Pore volumec) (cm3/g) Osur/Olatt Co3+/Co2+ 300 A 11 106 8.65 0.25 1.11 0.47 450 A 19 56 12.9 0.19 0.94 0.50 600 A 28 20 24 0.12 0.89 0.50 900 A 66 10 5.31 0.04 0.62 0.79 Notes: a) Obtained by XRD; b) BJH adsorption average pore diameter; c) BJH adsorption cumulative volume. Table 2 The activity data of 300 A-900 A catalysts. Table 2 Catalysts T10 % (°C) T90 % (°C) Specific rate (μmolC3/(gcat·h))a r * 1000 (μmol/(m2⋅s)) Ea (kJ/mol) 300 A 147 230 259.29 0.68 82 450 A 166 254 97.77 0.48 92 600 A 187 278 17.01 0.24 85 900 A 256 354 0 0 135 Notes: a) The specific rates, calculated based on the mole of propane transformed per hour and per unit mass catalyst according to the conversion at 164 °C showed in Fig. 6a. Table 3 Comparisons of the catalytic activity of 300 A with those reported catalysts in literatures. Table 3 Catalysts Reaction conditions Space velocity (mL/(gcat·h)) T90 % (°C) Ref. 300 A 0.1 % C3H8, 18 % O2 30,000 230 This work Co3O4 0.1 % C3H8, 10 % O2 240,000 251 [40] 25Co3O4/ZSM−5-A 0.2 % C3H8, 2 % O2 80,000 281 [42] 10 %Co/MCM−22(50)-A 0.1 % C3H8, 21 % O2 60,000 295 [41] Pt/Nb2O5 0.2 % C3H8, 2 % O2 30,000 231 [43] Pd@IM-S−1 0.2 % C3H8, 10 % O2/N2 36,000 284 [44] Enhancing propane oxidation with CTAB-modified ZIF-67-derived hollow Co3O4-CNTs catalysts through reduction-oxidation treatment Xiang Li Writing – review & editing Writing – original draft a Zhe Liu Methodology Investigation b Jing Yuan Writing – review & editing Supervision Project administration Methodology Funding acquisition a ⁎ Sen Liang Investigation Formal analysis a Zhenmin Xu Funding acquisition a XiaoJun Hu Resources a ⁎ a School of Chemical and Environmental Engineering, Shanghai Institute of Technology, Shanghai 201418, PR China School of Chemical and Environmental Engineering, Shanghai Institute of Technology Shanghai 201418 PR China School of Chemical and Environmental Engineering, Shanghai Institute of Technology, Shanghai 201418, PR China b School of Materials Science and Engineering, Shanghai Jiao Tong University, Shanghai 200240, PR China School of Materials Science and Engineering, Shanghai Jiao Tong University Shanghai 200240 PR China School of Materials Science and Engineering, Shanghai Jiao Tong University, Shanghai 200240, PR China ⁎ Corresponding authors. Co3O4 is an effective catalyst for propane total oxidation, and ZIF-67 pyrolysis is usually used to produce cobalt-based catalysts. However, high-temperature pyrolysis often leads to structural collapse and reduced cobalt activity. This study presents a CTAB-modified ZIF-67-derived hollow Co3O4-CNTs catalyst for enhanced propane total oxidation. The catalyst was synthesized through H2/Ar reduction at 800 °C and subsequent air oxidation at 300 °C. This process preserved the cubic structure of ZIF-67 and produced abundant CNTs, which limited Co3O4 growth and resulted in superior catalytic activity, with a T90 % of 230 °C-lower than that of noble metal catalysts. Increasing the oxidation temperature led to a decrease in CNTs, growth of Co3O4 particles, and structural collapse. The 300 °C calcined catalyst (300 A) showed the best performance due to its smallest Co3O4 particles and excellent reducibility, while higher temperatures led to particle agglomeration and decreased activity. Graphical Abstract Keywords VOCs Co3O4 Reduction-oxidation treatment Propane total oxidation Data availability Data will be made available on request. 1 Introduction Volatile organic compounds (VOCs), emitted from industrial processes and automobile exhaust, pose significant risks to the environment and human health due to their toxicity and volatility [1–3]. Low-temperature catalytic oxidation has emerged as the leading technology for the elimination of VOCs, offering an economical and efficient solution [4]. Propane, a stable VOC, is commonly used as a model pollutant for developing catalysts with high activity, durability, and affordability [5,6]. Transition metal oxides, such as Co₃O₄, are preferred over noble metal catalysts due to their lower cost, thermal stability, and reducibility [1,2]. Co3O4, with its spinel structure, is particularly effective for propane oxidation because of its low Co-O bond energy and unsaturated d6 and d7 orbitals [5,7]. Smaller Co3O4 particles are more effective due to their higher surface area and greater exposure of reactive species [8–10]. Advanced cobalt-based catalysts, including those with high surface area, special morphology, and dopants such as Ca, Ce, Mn, Fe, and Ni, have been developed to enhance the performance of Co3O4 [11,12]. Nowadays, the pyrolysis of metal-organic frameworks (MOFs) has garnered widespread attention for producing efficient catalysts, owing to their well-defined, adjustable, and abundant porous structures [13–17]. Through pyrolysis, MOFs are transformed into carbon-based/nitrogen-metal composites for the catalytic combustion of VOCs [18]. Zeolitic Imidazolate Frameworks (ZIFs) are commonly used to synthesize efficient carbon-based cobalt catalysts due to their thermal stability. For instance, Chen et al. developed P-CNCo-20 catalysts by calcining bimetallic Zn/Co BMZIFs in an N2 atmosphere and introducing phosphorus (P) post-annealing, which exhibited excellent performance in the oxygen reduction reaction (ORR) [19]. Zhao et al. obtained a series of hollow Co3O4 nanoparticles by in-situ pyrolysis of ZIF-67 with varying sizes in an air atmosphere, and applied them to the catalytic oxidation of toluene to study the size-dependent effects [20]. Kong et al. prepared unique hollow Co-Ni layered double oxides (HLDO) nanocages by pyrolyzing ZIF-67 in an air atmosphere, achieving successful low-temperature catalytic oxidation of CO (T100 % = 118 °C) [21]. Qin et al. obtained Co3O4 catalysts with exceptional toluene catalytic activity by pyrolyzing ZIF-67 after tannic acid etching, with Co3O4-1–15 demonstrating the best catalytic activity (T90 % = 219 °C) [22]. Most research has focused on the pyrolysis of MOFs in either an inert or oxidizing atmosphere to prepare catalysts. However, direct high-temperature pyrolysis often leads to the collapse of the original regular structure of ZIF-67 and/or a decrease in active cobalt species, thereby reducing the activity. Different from direct pyrolysis in an inert or oxidizing atmosphere, the reduction-oxidation (RO) strategy first subjects the precursor or final material to high-temperature treatment in a reducing atmosphere, followed by treatment in an oxidizing atmosphere. This approach is beneficial for maintaining or enhancing the material's original structure [19,23], increasing particle dispersion [24], and regulating interfacial interactions [25,26], thereby boosting the material's performance in various reactions. The RO treatment of catalysts has been proven to be an effective strategy for improving the performance of the treated catalysts. Su et al. [27] discovered that RO treatment can reshape CuO, enhance its structure and surface properties, alter the Cu content, and modify the synergistic effect between copper and cerium, thereby promoting the preferential oxidation of CO. Ding et al. [24] found that RO pretreatment reduces the grain size of Co3O4 supported on Al2O3 and enhances the catalytic performance of Co3O4/Al2O3 for CO oxidation. Our team regulated the Co-Al interaction through RO pretreatment of Co3O4/γ-Al2O3, producing more active cobalt species with smaller particle sizes, which significantly improved its propane combustion activity [25]. The present research focuses on the structural and performance improvements of traditional bulk and supported catalysts in various reactions such as the oxygen evolution reaction [23], CO oxidation [24] and Fischer-Tropsch synthesis [28]. However, few studies have applied the RO strategy to the synthesis of MOF-derived catalysts through pyrolysis. Although Li et al. reported that reducing ZIF-67 at 800 °C followed by rapid oxidation at 360 °C improved the conductivity and Li+ storage in lithium-ion batteries, this improvement was attributed to the formation of carbon nanotubes and a hollow Co-Co3O4 structure during the RO treatment [29]. To the best of our knowledge, such RO-treated ZIF-derived catalysts have not been utilized in high-temperature catalytic oxidation reactions. Moreover, the detailed changes in the ZIF-67 skeleton, the Co state, the structure, and the catalytic performance of the derived Co-based catalysts after RO treatment remain unclear. Therefore, it is highly desirable to gain a fundamental understanding of the performance enhancement and structural evolution of ZIF-67 under reducing and oxidizing atmospheres at high temperatures. Herein, we primarily focused on investigating the structural evolution of ZIF-67 during reduction-oxidation (RO) treatment, which could account for their catalytic performance. A series of Co-based catalysts were obtained by pyrolyzing CTAB-modified ZIF-67, under an H2/Ar atmosphere at 800 °C, followed by calcination in air at temperatures ranging from 300 °C to 900 °C. The influences of the oxidation temperature on the structural evolution and the catalytic performance for propane oxidation were explored in detail. The results showed that the 800 °C H2/Ar reduction led to Co generation and promoted carbon nanotubes (CNTs) formation, while the subsequent oxidation in air generated hollow Co3O4 structures that were entwined by in-situ formed CNTs. The reduction-oxidation treatment effectively prevented the agglomeration of nanoparticles. The catalyst derived from 800 °C H2/Ar reduction and 300 °C air oxidation, denoted as 300 A, exhibited a uniform hollow cubic structure, smaller nanoparticles, and abundant CNTs, thus showing the best catalytic activity. 2 Materials and methods 2.1 Catalyst preparation 2.1.1 Preparation of cobalt oxide-CNTs catalysts The CTAB-ZIF-67 was firstly prepared according to the literature [29]. The dried CTAB-ZIF-67 was placed in a tube-type atmosphere furnace and was calcined at 800 °C for 2 h under a hydrogen-argon gas (5 % H2/Ar). Subsequently, the obtained product was calcined in a muffle furnace for 2 h at 300 °C, 450 °C, 600 °C and 900 °C, respectively. The catalysts obtained at these temperatures were designated as 300 A, 450 A, 600 A and 900 A. The selection of 800 °C as the pyrolysis temperature for ZIF-67 in a 5 % H2/Ar atmosphere was based on thermogravimetric (TG) analysis, which indicated that at this temperature, all Co2+ could be reduced, and the majority of the organic framework of ZIF-67 could be carbonized (Fig. S1a). The TG analysis of 800 H in air revealed a slight weight gain between 200 and 300 °C, a significant weight loss between 300 and 450 °C, and a stabilization of weight at 600 °C, followed by a sharp decrease at 900 °C (Fig. S1b). Therefore, according to the results of TG, we selected 300 °C, 450 °C, 600 °C, and 900 °C as the representative oxidation temperatures to explore the impact of oxidation temperature on the structural transformation of 800 H and to assess its catalytic performance for the total oxidation of propane. 2.2 Characterization of catalyst Thermogravimetric (TG) curves were obtained using a synchronous thermal analyzer (LINSEIS STA PT1600) under air atmosphere, with a temperature span of 30 °C to 1000 °C (10 °C /min). The powder X-ray diffraction (XRD) data for the samples were collected on a Rigaku D/max 2600PC instrument equipped with a Cu Kα radiation source, operating at 40 kV and 20 mA, with a wavelength (λ) of 0.15418 nm. The measurements were taken over a 2θ range from 10° to 90°. Raman spectral measurements were conducted using an Invia-reflex Laser Raman spectrometer. The instrument was excited with the 532 nm and 785 nm emission lines from an Ar ion laser. The spectral acquisition range spanned from 100 to 3200 cm−1. All Raman spectral data were essentially repeated three times to ensure reliability. The morphology of all catalysts was described using scanning electron microscope (SEM, S-4800, Hitachi) and transmission electron microscopy and high-resolution transmission electron microscope at 200 kV (TEM and HRTEM, JEOL JEM-2100F). The N2 adsorption-desorption measurement was carried out on automated gas sorption analyzer (Micromeritics ASAP 2010) at 77 K. The BET specific surface areas, the pore size distribution and pore volume of samples were obtained. X-ray photoelectron spectroscopy (XPS) analyses were performed using an Axis Ultra DLD spectrometer from Shimadzu Corporation, Japan. The XPS measurements utilized Al Kα radiation at 1486.6 eV as the excitation source and the binding energy correction for all samples were based on C1s = 284.8 eV. Hydrogen temperature programmed reduction (H2-TPR) experiment was performed on a Micromeritics Auto Chem II chemisorption 2920 analyzer equipped with a thermal conductive detector (TCD). 100 mg granular catalyst was obtained by pressing the tablet and placed in the quartz reaction tube (8 mm ID). H2-TPR, 100 mg of the catalyst was firstly pretreated in a He flow (30 mL/min) for 1 h at 250 °C to eliminate surface contaminants. After cooling to 50 °C, the temperature was increased to 750 °C with a rate of 10 °C /min. Then, 10 % H2/Ar mixture (30 mL/min) was flowed to pass through the catalyst to obtain H2-TPR profiles. In situ diffuse reflectance infrared Fourier transform spectroscopy (DRIFTS) were recorded using an FTIR spectrometer (Thermo Fisher Nicolet iS50) equipped with an MCT/A detector and a Harrick in situ cell. The infrared spectrum was recorded in the wavenumber 600–4000 cm−1 with 64 scans at resolution of 4 cm−1. Typically, prior to each test, the sample was pretreated under N2 flow for 30 min at 300 °C to eliminate surface water and then regulated to the target temperature to obtain a background spectrum which should be deducted from the sample spectra. Firstly, C3H8 adsorption experiment lasted for 30 mins at 50 °C under the flow of 0.1 vol% C3H8 + N2, while the oxidation of C3H8 experiment was performed at 50–300 °C in air. In addition, to further determine the reaction path of propane, high temperature adsorption in 0.1 vol% C3H8 + N2 and oxidation in air at 300 °C was conducted and the temperature-rising desorption of propane was carried out at 50–300 °C in 0.1 vol% C3H8 + Air. 2.3 Catalytic activity A continuous flow micro-reactor was used for the catalytic activity evaluation. Approximately 100 mg catalyst, sieved to a 40–60 mesh size, was placed inside a quartz tube reactor with an inner diameter of 8 mm. The reactor was fed with a gas mixture containing 0.1 vol percent of propane (C3H8) and 18 vol percent of oxygen (O2), with the balance being pure air. The mixture was introduced into the reactor at a rate of 50 mL/min, corresponding to a gas hourly space velocity (GHSV) of 30,000 mL/(gcat·h). Temperature measurements were taken using a thermocouple positioned at the catalyst bed within the reactor. The concentration of propane in the inlet and outlet were analyzed in real-time at specified temperatures, which were held constant for 20 min, using a GC (Varian GC-450) equipped with a flame ionization detector (FID). Catalytic activity was evaluated over a temperature range of 50–400 °C, with conversion data being derived from the difference in propane concentrations at the reactor's inlet and outlet. For assessing the stability of the catalytic reactions, measurements were conducted under identical conditions but at a fixed temperature of 210 °C. 3 Results and discussion 3.1 Catalyst characterization Fig. 1(a) shows the XRD patterns of CTAB-ZIF-67, 800 H and 300A-900A catalysts. The XRD pattern of CTAB-ZIF-67 matches those reported in the literature [29], indicating the successful preparation of CTAB-modified ZIF-67. After reduction at 800 °C under an H2/Ar atmosphere, the diffraction peaks belonging to ZIF-67 disappeared, and new peaks emerged at 44.3°, 51.4° and 75.8°, corresponding to the (111), (200) and (220) crystal planes of Co, respectively. This indicates that the Co2+ in ZIF-67 was successfully reduced to Co nanoparticles. Additionally, a broad peak at 21° is attributed to amorphous carbon, suggesting that the organic carbon framework was transformed into amorphous carbon after the 800 °C H2/Ar treatment. After further oxidation in air at different temperatures, six distinct diffraction peaks appeared at 19.1°, 31.3°, 36.9°, 44.8°, 59.4° and 65.3° which correspond to the (111), (220), (311), (400), (511), (440) crystal planes of Co3O4, respectively. This indicates that metallic Co was oxidized to Co3O4. Meanwhile, the peak attributed to amorphous carbon (21°) gradually diminishes, indicating a decrease in the amorphous carbon content. As the oxidation temperature increases, the characteristic peaks of Co3O4 become more intense, and the crystalline size of Co3O4 follows the order of 900 A > 600 A > 450 A > 300 A ( Table 1), suggesting that a larger amount of Co3O4 is produced or the particles size of Co3O4 gradually increases. Fig. 1(b) presents the Raman spectra of the 800 H and 300 A-900 A catalysts. In the Raman spectra of 300 A, 450 A, 600 A and 900 A, the peaks around 468 cm−1, 510 cm−1 and 671 cm−1 correspond to the characteristic vibration frequency of the Co-O-Co bond in Co3O4 [30]. Specifically, the Raman band at 671 cm−1 is attributed to the characteristic vibration frequency of the octahedral site (CoO6), which matches with the A1 g species of the crystalline Co3O4 phase. The peaks at 510 cm−1 (F2 g) and 468 cm−1 (Eg) correspond to the vibration of tetrahedral and octahedral site. Additionally, the peak near 192 cm−1 is attributed to the characteristic vibration frequency of the tetrahedral site (CoO4), which matches the symmetrical F1 2 g mode, while the weak peak at 611 cm−1 is related to the F2 2 g symmetry [31]. Furthermore, the peaks of the carbon nanotubes (CNTs) were clearly observed at 1348−1 and 1596−1 in all samples except 900 A, which correspond to the D and G peak, respectively [32]. The D peak can be attributed to the vibration of carbon atoms with dangling bonds in the disordered graphite structure, which is related to defects in the hexagonal graphite layer, while the G peak can be attributed to the in-plane vibration mode of Raman activity E2 g, which is similar to the vibration of sp2 bond in carbon atoms in a two-dimensional hexagonal lattice [33]. It is worth noting that with the increase in oxidation temperature, the peaks of Co3O4 gradually increase, while the peaks of CNTs decrease and completely disappear at 900 °C, indicating that the CNTs are oxidized [29]. Thus, the Raman results indicate that the particle size of Co3O4 increases, while the content of CNTs decreases with the increase in oxidation temperature. The morphology of a series of Co-based catalysts was investigated using field-emission scanning electron microscopy (FESEM), as shown in Fig. 2. After pyrolysis of ZIF-67 at high temperatures, the main elements of the derived 300 A-900 A catalysts are C, O and Co (Fig. S2). CTAB-ZIF-67 exhibits a unique cubic morphology with a very smooth surface, and its particle size is approximately 0.5 µm (Fig. 2a). After reduction in an H2/Ar atmosphere, 800 H retains the cubic framework of CTAB-ZIF-67 but shows slight shrinkage (Fig. 2b). The slight shrinkage may be due to the carbonization of the carbon framework. The surface becomes rough, and CNTs can be clearly seen (Fig. 2c), which is consistent with the Raman spectroscopy results. After further oxidizing 800 H in air, the obtained samples exhibited varied morphologies at 300–900 °C (Fig. 2(d-g)). The 300 A sample still maintains a cubic morphology similar to 800 H, but its surface becomes rougher, and the surface structure is very fluffy with an abundance of CNTs around it. After oxidation at 300 °C, Co0 is oxidized to Co3O4 in air, and the formed small Co3O4 particles assemble to form a surface with voids. These results indicate that the oxidation at 300 °C converts the Co0 in 800 H to Co3O4 without altering its original cubic morphology. When the temperature rises to 450 °C, the cubic morphology gradually transitions to a spherical shape, and its surface structure becomes more compact. Only a few CNTs are observed. But the framework of ZIF begins to collapse at higher oxidation temperatures, and simultaneously, Co3O4 starts to grow, which destroys the original cubic morphology and the voided surface. At the same time, the content of CNTs decreases due to oxidation at high temperatures. These phenomena are further confirmed by the morphological structures of 600 A and 900 A. As shown in Fig. 2(f-g), Co3O4 gradually grow into larger particles and no longer exhibits a relatively uniform spherical particle morphology. The void gaps on its surface are almost invisible. CNTs gradually disappear in 600 A, and no CNTs can be observed in 900 A. All these observations are in accordance with the Raman results. Fig. 3 presents the TEM and HRTEM images of the prepared samples. The TEM images of 800 H show spherical particles and CNTs structures (Fig. 3(a-b)). After oxidation at 300 °C in air, the TEM images of 300 A reveal a clear cubic structure (Fig. 3d). Additionally, many hollow nanostructures appear on the spherical particles due to the Kirkendall effect [34], and CNTs are still present (Fig. 3(d-e) and Fig. S3(a-b)). The HRTEM images of 800 H (Fig. 3c) show lattice spacings of 0.204 nm and 0.333 nm, which are attributed to the (111) crystal plane of Co (JCPDS NO. 15–0806) and the (002) crystal plane of CNTs, respectively. The HRTEM images of 300 A show lattice spacings of 0.465 nm, 0.245 nm, 0.203 nm, and 0.285 nm, corresponding to the (111), (311), (400), and (220) crystal planes of Co3O4 (JCPDS NO. 43–1003), and a spacing of 0.333 nm ascribed to CNTs (Fig. 3 f and Fig. S3c). Therefore, the HRTEM images of 800 H and 300 A demonstrate that Co or Co3O4 is entwined by CNTs. These results indicate that Co is oxidized to hollow Co3O4 after oxidation at 300 °C, and 300 A is a composite consisting of Co3O4 and CNTs. As the oxidation temperature increases to 450 °C and 600 °C, as shown in Fig. 3(g-h), the Co3O4 particle size gradually increases. When the oxidation temperature reaches 900 °C, significant agglomeration of Co3O4 particles occurs (Fig. 3i). The TEM/HRTEM results are consistent with the finding from Raman and SEM analyses. The nitrogen adsorption-desorption isotherms and the BJH pore size distribution are shown in Fig. 4. Their BET specific surface areas, average pore volumes and pore diameters are listed in Table 1. Except for 900 A, the nitrogen adsorption-desorption isotherms of 300 A, 450 A and 600 A correspond to type IV isotherm with H3 hysteresis loop (Fig. 4a), and they all exhibit wide pore size distributions (Fig. 4b), indicating their irregular pore structures. According to Fig. 4, 900 A has almost no pores. It is worth noting that the pore size distribution of 450 A and 600 A are more symmetrical than that of 300 A, especially for 450 A, but 300 A exhibits a smaller average pore diameter than 450 A and 600 A (Table 1). Their pore sizes are 8.65 nm for 300 A, 12.9 nm for 450 A and 24.0 nm for 600 A, respectively (Table 1). This is probably because, on one hand, more CNTs contribute to the pore structure of 300 A compared to 450 A and 600 A. On the other hand, 300 A has much smaller particle sizes, which assemble to form the pores, and the hollow structure contributes to its small pore size. At 450 °C, the skeleton structure of ZIF is completely carbonized, forming Co3O4 particles with uniform particle distribution, which makes the pore size distribution relatively uniform and symmetrical. At 600 °C, Co3O4 particles begin to aggregate and grow, which leads to the poor symmetry of the curve of 600 A compared to that of 450 A. The richer and smaller pore size makes 300 A show the largest specific surface area (106 m2/g) and pore volume (0.25 cm3/g), followed by 450 A (56 m2/g and 0.19 cm3/g) because of its relatively uniform particle size and 600 A (20 m2/g and 0.12 cm3/g). 900 A, which has almost no pores, only shows a specific surface area of 10 m2/g and a pore volume of 0.04 cm3/g. The XPS analysis of the Co 2p and O 1 s spectra for the samples was conducted to discern the chemical states of the elements and the types of surface oxygen species, as depicted in Fig. 4(c-d). Characteristic peaks attributed to Co3O4 were observed in all samples' XPS spectra. Specifically, peaks at 780.3 eV and 795.2 eV, along with a satellite peak at 788.0 eV, are associated with the Co3+ species. Meanwhile, peaks at 781.4–781.6 eV and 796.7 eV, accompanied by a satellite peak at 802.9 eV, are indicative of Co2+ species [35]. The 300A-600A catalysts exhibit the similar Co3+/Co2+ ratio (0.47–0.50), but the ratio sharply increases to 0.79 for the 900 A catalyst (Table 1), signifying a reduction in the relative content of Co2+ at a much higher temperature. The O 1 s XPS spectrum of catalysts 300 A-900 A (Fig. 4d) reveals three distinct peaks. The peaks at binding energies of 529.7 eV, 531.1 eV, and 533.2 eV correspond to surface lattice oxygen (Olatt), surface oxygen species related to defects or low coordination (Osur), and adsorbed oxygen (Oads) from surface hydroxyl groups or adsorbed water species, respectively [35]. The Osur/Olatt ratio (Table 1), which reflects the relative amount of oxygen vacancies on the surface, decreases with an increase in oxidation temperature. The XPS data indicate that lower oxidation temperatures (300–600 °C) favor the production of Co2+ and oxygen vacancies, while higher temperatures promote the formation of Co3+ and a more perfect crystal structure. It has been documented that the activation of VOCs typically takes place on Co2+ sites, and oxygen vacancies facilitate the adsorption and activation of oxygen [36], both of which are beneficial to the propane oxidation reaction. In other words, lower temperatures enhance the formation of an active catalyst with a rich presence of active Co2+ and surface-active oxygen species. Therefore, samples 300 A-600 A, which have a higher content of surface Co2+ and active oxygen species than 900 A, are likely to demonstrate superior catalytic performance. Fig. 5 presents the H2-TPR profiles of 300A-900A catalysts. Since carbon does not reduce in this temperature range, the reduction peaks in the figure are all attributed to cobalt oxide. Except for 900 A, the samples exhibit two distinct reduction peaks below 450 °C, corresponding to the two-step reduction of Co3O4, Co3+→Co2+ and Co2+→Co [25]. Additionally, 300 A shows a broad peak at 507 °C, which is due to the methanation of carbon nanotubes after 500 °C [37]. The 900 A exhibits a single-step reduction process, which is different from that of 300A-600A, because of its large particle size of Co3O4 [38,39]. As the oxidation temperature increases from 300 °C to 600 °C, the reduction peak temperature of the sample gradually moves to higher temperatures. This is because the Co3O4 particles gradually become larger. Due to the hydrogen spillover [38,39], the H2-TPR curve of 900 A moves to a lower temperature. It is worth noting that the reduction peak temperature of 300 A is 84 °C lower than that of 450 A, and the initial reduction temperature of 300 A (201 °C) is significantly lower than that of 450 A (258 °C) and 600 A (300 °C). This is attributed to 300 A (11 nm) having smaller Co3O4 particles and containing CNTs, which improve the dispersion of Co3O4. However, as the temperature increases, Co3O4 particles agglomerate, the particle size becomes larger, and CNTs gradually decrease or even disappear, which is consistent with Raman and TEM results. 3.2 Catalyst performance Fig. 6(a) illustrates the catalytic performance of the 300A-900A catalysts in the total oxidation of propane. The main reaction product for all catalysts was CO2. The intrinsic reaction rates (r, normalized by the BET specific surface area) were also calculated to assess their intrinsic activities at 164 °C when the propane conversion was less than 20 % and are presented in Table 2. As depicted in Fig. 6(a) and Table 2, the propane conversion rate increases with the rise in reaction temperature. Conversely, the reaction activity gradually decreases with the increase in oxidation temperature, following the order of 300 A > 450 A > 600 A > 900 A (Fig. 6a), which is consistent with their intrinsic activities (Table 2). Notably, the 300 A catalyst demonstrated the highest catalytic performance. It exhibits much higher activity than the single Co3O4 and supported Co3O4 catalysts reported before [40–42], and even outperforms noble metal catalysts (Pt/Nb2O5, Pd@IM-S-1) [43,44] ( Table 3). To examine the catalytic stability of 300 A for propane oxidation, the 100 h on-stream reaction experiment was conducted at a high level of propane at 220 °C, with the result shown in Fig. 6(b). After 5 h of reaction, the conversion rate of propane significantly increased from 85 % to 97.5 % and remained stable for the following 10 h. Then, the conversion rate experienced a slight decline, fluctuating around 95 %, and finally stabilized at 95 %, showing no change for at least 40 h. The presence of CNTs restricts the growth of Co3O4, leading to smaller Co3O4 particle sizes, which promotes enhanced activity. Long-term stability tests indicate that the catalytic performance of 300 A in propane combustion can be further enhanced and it also exhibits good durability. To further investigate the intrinsic catalytic activity of the samples, we calculated the apparent activation energy (assuming no obvious change in reactant concentration within 20 % conversion rate) for propane oxidation using the Arrhenius plot (Ea) for the 300A-900A samples (as shown in Fig. 6c and Table 2). It was found that 300 A-600 A have similar apparent activation energy (Ea=82–92 kJ/mol), while the activation energy for 900 A significantly increases (Ea=135 kJ/mol), indicating that 300 A-600 A possess the same activation capability for propane total oxidation. According to the XPS results, they have similar ratios of Co3+/Co2+, suggesting that the active centers of 300 A-600 A are similar. However, 300 A (0.68 μmol/(m2⋅s) exhibits greater intrinsic activity than 450 A (0.48 μmol/(m2⋅s)) and 600 A (0.24 μmol/(m2⋅s)). Integrating the above characterization results, the excellent performance of 300 A is attributed to its smaller particle size and abundant CNTs, which result in a larger BET specific surface area. The particle size of 300 A (11 nm) is significantly smaller than that of 450 A (19 nm) and 600 A (28 nm) (XRD). 300 A retains the original cubic structure of ZIF-67, which limits the growth of Co3O4 (SEM and TEM). However, with the increase of temperature, the cubic morphology gradually transitions to a spherical shape. 450 A and 600 A still grows relatively evenly, but 900 A exhibits significant agglomeration of Co3O4 particles. This results in a rapid increase in particle size with temperature, with 900 A (66 nm) being 55 nm larger than 300 A. In addition, 300 A contains abundant CNTs, which expand its specific surface area (106 m2/g) and enhance the dispersion of Co3O4 (Raman and BET). The abundant CNTs also restricts the growth and agglomeration of Co3O4 particles. This is mainly because that the high aspect ratio and entangled network structure of CNTs physically isolate the Co3O4 particles, preventing particle-to-particle contact and Ostwald ripening. Furthermore, we plotted the relationship between the intrinsic rates of the catalysts at 164 °C and their initial reduction temperatures as well as the Osur/Olatt ratio, as shown in Fig. 6(d). The results reveal a strong correlation between the intrinsic activities and the initial reduction temperatures as well as the Osur/Olatt ratio for all samples. 300 A exhibits the best redox performance and most abundant oxygen vacancy, which is attributed to its small Co3O4 particles and higher dispersion. 3.3 The reaction mechanism over 300 A In-situ DRIFTS exploration experiments were further carried out to provide possible reaction pathways. As shown in Fig. 7(a), when a feed gas of 0.1 vol% C3H8 + N2 was adsorbed on 300 A at 50 °C for 30 mins, it was found that only the vibration peak of propane (2964 and 2876 cm−1) was enhanced, reaching adsorption saturation after 5 mins [45–47], indicating that propane can be effectively adsorbed on the catalyst surface at 50 °C. No intermediates were observed (Fig. S4a), indicating that almost no propane was oxidized during the low-temperature adsorption process. Furthermore, we introduced air to the feed gas. It is found that from Fig. 7(b-c) that, as the temperature increased, the characteristic peak of C3H8 (2964 and 2876 cm−1) weakened and disappeared at 150 °C (Fig. 7b), indicating that C3H8 can be oxidized at 150 °C, which is consistent with the activity test results. At the same time, new adsorption peaks attributed to νₐₛ(CO) of acetone and aliphatic ester (1700 and 1751 cm) and νₐₛ(COO)of acetate species (1463, 1511 and 1548 cm−1) [44,48–50] began to appear at 150 °C and strengthened first and then weakened until disappeared finally. Then, the adsorption band at 1650 cm−1 belonging to νₐₛ(OCO) of bicarbonate species were significantly enhanced and disappeared at 300 °C [44,47], showing that bicarbonate is the last intermediate in propane oxidation process. In order to better understand the mechanism of propane oxidation, high temperature adsorption in 0.1 vol% C3H8 + N2 and oxidation in air at 300 °C for 30 mins was conducted with results shown in Fig. S4b-e. The adsorption of propane reached saturation in 10 min at 300 °C. After introducing air, the desorption is complete in 5 min. During the process of propane adsorption, the vibration peaks of acetone and acetate have already appeared, which shows that propane reacts with lattice oxygen on the catalyst surface. It means that the mechanism of propane total oxidation over Co3O4-CNTs follows the Mars-van Krevelen (MVK) pathway. Further, real-time monitoring of temperature-programmed oxidation of propane with the temperature rising from 50 °C to 300 °C using a feed gas of 0.1 vol% C3H8 + Air (Fig. S4f-g) confirms the adsorption behavior and reaction process similar to that shown in Fig. 7(a). As the temperature increases, the absorption bands at 2800–3000 cm−1, characteristics of propane, gradually weaken, while the peaks at 1300–1800 cm−1, attributed to acetone, aliphatic ester, acetate and bicarbonate species, increase first and then weakened [51]. Additionally, the in-situ DFIFTs test on the samples 450 A and 600 A were also carried out, and the results were shown in Fig. S5 and Fig. S6. They all showed the similar adsorption behaviors as sample 300 A. The difference is that higher temperatures are required on 450 A and 600 A to convert propane into intermediate products and achieve complete conversion. Based on the above results, the proposed reaction pathway for propane oxidation over the 300 A (as an example) is illustrated in Fig. 7(d). Gaseous propane is firstly adsorbed onto the catalyst surface at low temperatures, forming activated propane. As the temperature rises, propane undergoes partial oxidation on the catalyst surface to produce acetone and aliphatic ester. With further increase in temperature, surface oxygen species react with the adsorbed intermediates, leading to further oxidation of acetone to form acetate and bicarbonate. Finally, all intermediates are completely oxidized to CO2 and H2O. 4 Conclusions In conclusion, a series of cobalt-based catalysts derived from ZIF-67 were synthesized via pyrolysis under reducing and oxidizing conditions (RO treatment). The structural changes of the catalysts with increasing oxidation temperature and their performance in propane total oxidation were studied. Reduction at 800 °C in an H2/Ar atmosphere facilitated the formation of CNTs, while oxidation at 300 °C in air led to the creation of hollow Co3O4 entwined by CNTs. As the oxidation temperature rose from 300 °C to 900 °C, the catalysts' morphology transitioned from cubic to spherical, with corresponding increases in particle size. The 300 °C-treated catalyst (300 A) maintained ZIF-67's cubic structure and was rich in CNTs, resulting in hollow Co3O4 nanoparticles measuring just 11 nm with a large specific surface area of 106 m²/g, which contributes to its excellent catalytic activity in propane oxidation. 300 A achieved a 90 % propane conversion rate at 230 °C, significantly lower than that of reported noble metal catalysts. In contrast, catalysts treated at higher temperatures (450 A-900 A) experienced structural collapse, with a decrease in CNTs and a substantial increase in particle size, leading to reduced activity. The particle size and reducibility, influenced by CNTs and the cubic structure, are crucial determinants of catalytic performance. CRediT authorship contribution statement Hu Xiaojun: Resources. Xu Zhenmin: Funding acquisition. Liang Sen: Investigation, Formal analysis. Yuan Jing: Writing – review & editing, Supervision, Project administration, Methodology, Funding acquisition. Liu Zhe: Methodology, Investigation. Li Xiang: Writing – review & editing, Writing – original draft. Declaration of Competing Interest The authors declare that they have no known competing financial interests or personal relationships that could have appeared to influence the work reported in this paper. Acknowledgments This work was supported by National Natural Science Foundation of China (grant number 21607098, 22376143), Shanghai Rising-Star Program (grant number 17QB1402800). Appendix A Supporting information Supplementary data associated with this article can be found in the online version at doi:10.1016/j.apcata.2025.120253. Appendix A Supplementary material Supplementary material References [1] C. He J. Cheng X. Zhang M. Douthwaite S. Pattisson Z.P. Hao Recent advances in the catalytic oxidation of volatile organic compounds: a review based on pollutant sorts and sources Chem. Rev. 119 2019 4471 4568 10.1021/acs.chemrev.8b00408 C. He, J. Cheng, X. Zhang, M. Douthwaite, S. Pattisson, Z.P. Hao, Recent Advances in the Catalytic Oxidation of Volatile Organic Compounds: A Review Based on Pollutant Sorts and Sources. Chem. Rev. 119 (2019) 4471–4568, https://doi.org/10.1021/acs.chemrev.8b00408 [2] Y.L. Guo M.C. Wen G.Y. Li T.C. An Recent advances in VOC elimination by catalytic oxidation technology onto various nanoparticles catalysts: a critical review Appl. Catal. B: Environ. 281 2021 119447 10.1016/j.apcatb.2020.119447 Y.L. Guo, M.C. Wen, G.Y. Li, T.C. An, Recent advances in VOC elimination by catalytic oxidation technology onto various nanoparticles catalysts: a critical review. Appl. Catal. B: Environ. 281 (2021) 119447, https://doi.org/10.1016/j.apcatb.2020.119447 [3] H. Guo S.C. Lee P.K.K. Louie K.F. Ho Characterization of hydrocarbons, halocarbons and carbonyls in the atmosphere of Hong Kong Chemosphere 57 2004 1363 1372 10.1016/j.chemosphere.2004.07.055 H. Guo, S.C. Lee, P.K.K. Louie, K.F. Ho, Characterization of hydrocarbons, halocarbons and carbonyls in the atmosphere of Hong Kong. Chemosphere 57 (2004) 1363–1372. https://doi.org/10.1016/j.chemosphere.2004.07.055 [4] Z.X. Zhang Z. Jiang W.F. Shangguan Low-temperature catalysis for VOCs removal in technology and application: a state-of-the-art review Catal. Today 264 2016 270 278 10.1016/j.cattod.2015.10.040 Z.X. Zhang, Z. Jiang, W.F. Shangguan, Low-temperature catalysis for VOCs removal in technology and application: A state-of-the-art review. Catal. Today 264 (2016) 270–278. https://doi.org/10.1016/j.cattod.2015.10.040 [5] W.D. Zhang J.L. Valverde A. Giroir-Fendler Co3O4-based catalysts for propane total oxidation: a state-of-the-art minireview Appl. Catal. B: Environ. 337 2023 122908 10.1016/j.apcatb.2023.122908 W.D. Zhang, J.L. Valverde, A. Giroir-Fendler, Co3O4-based catalysts for propane total oxidation: A state-of-the-art minireview. Appl. Catal. B: Environ. 337 (2023) 122908. https://doi.org/10.1016/j.apcatb.2023.122908 [6] S. Liang T. Cai J. Yuan Q. Tong X.J. Hu Promoting effect of reduction-oxidation strategy on the Co3O4/γ-Al2O3 catalysts for propane total oxidation Mol. Catal. 533 2022 112762 10.1016/j.mcat.2022.112762 S. Liang, T. Cai, J. Yuan, Q. Tong, X.J. Hu, Promoting effect of reduction-oxidation strategy on the Co3O4/γ-Al2O3 catalysts for propane total oxidation. Mol. Catal 533 (2022) 112762. https://doi.org/10.1016/j.mcat.2022.112762 [7] B. Puértolas A. Smith I. Vázquez A. Dejoz A. Moragues T. Garcia B. Solsona The different catalytic behaviour in the propane total oxidation of cobalt and manganese oxides prepared by a wet combustion procedure Chem. Eng. J. 229 2013 547 558 10.1016/j.cej.2013.06.041 B. Puértolas, A. Smith, I. Vázquez, A. Dejoz, A. Moragues, T. Garcia, B. Solsona, The different catalytic behaviour in the propane total oxidation of cobalt and manganese oxides prepared by a wet combustion procedure. Chem. Eng. J. 229 (2013) 547–558. https://doi.org/10.1016/j.cej.2013.06.041 [8] B. De Rivas R. López-Fonseca C. Jiménez-González J.I. Gutiérrez-Ortiz Synthesis, characterisation and catalytic performance of nanocrystalline Co3O4 for gas-phase chlorinated VOC abatement J. Catal. 281 2011 88 97 10.1016/j.jcat.2011.04.005 B. De Rivas, R. López-Fonseca, C. Jiménez-González, J.I. Gutiérrez-Ortiz, Synthesis, characterisation and catalytic performance of nanocrystalline Co3O4 for gas-phase chlorinated VOC abatement. J. Catal. 281 (2011) 88–97. https://doi.org/10.1016/j.jcat.2011.04.005 [9] T. Garcia S. Agouram J.F. Sánchez-Royo R. Murillo A.M. Mastral A. Aranda I. Vázquez A. Dejoz B. Solsona Deep oxidation of volatile organic compounds using ordered cobalt oxides prepared by a nanocasting route Appl. Catal. A-Gen. 386 2010 16 27 10.1016/j.apcata.2010.07.018 T. Garcia, S. Agouram, J.F. Sánchez-Royo, R. Murillo, A.M. Mastral, A. Aranda, I. Vázquez, A. Dejoz, B. Solsona, Deep oxidation of volatile organic compounds using ordered cobalt oxides prepared by a nanocasting route. Appl. Catal. A-Gen. 386 (2010) 16–27. https://doi.org/10.1016/j.apcata.2010.07.018 [10] G. Salek P. Alphonse P. Dufour S. Guillemet-Fritsch C. Tenailleau Low-temperature carbon monoxide and propane total oxidation by nanocrystalline cobalt oxides Appl. Catal. B: Environ. 147 2014 1 7 10.1016/j.apcatb.2013.08.015 G. Salek, P. Alphonse, P. Dufour, S. Guillemet-Fritsch, C. Tenailleau, Low-temperature carbon monoxide and propane total oxidation by nanocrystalline cobalt oxides. Appl. Catal. B: Environ. 147 (2014) 1–7. https://doi.org/10.1016/j.apcatb.2013.08.015 [11] A. Gil-Barbarin J.I. Gutiérrez-Ortiz R. López-Fonseca B. De Rivas Co3O4 hollow nanotubes for the catalytic oxidation of C2-chlorinated VOCs J. Environ. Chem. Eng. 11 2023 109841 10.1016/j.jece.2023.109841 A. Gil-Barbarin, J.I. Gutiérrez-Ortiz, R. López-Fonseca, B. De Rivas, Co3O4 hollow nanotubes for the catalytic oxidation of C2-chlorinated VOCs. J. Environ. Chem. Eng. 11 (2023)109841. https://doi.org/10.1016/j.jece.2023.109841 [12] W.J. Zhu X.B. Wang C. Li X. Chen W.Y. Li Z.M. Liu C.H. Liang Defect engineering over Co3O4 catalyst for surface lattice oxygen activation and boosted propane total oxidation J. Catal. 413 2022 150 162 10.1016/j.jcat.2022.06.024 W.J. Zhu, X.B. Wang, C. Li, X. Chen, W.Y. Li, Z.M. Liu, C.H. Liang, Defect engineering over Co3O4 catalyst for surface lattice oxygen activation and boosted propane total oxidation. J. Catal. 413 (2022) 150–162. https://doi.org/10.1016/j.jcat.2022.06.024 [13] J.T. Ding D.Y. Guo A.Q. Hu X.F. Yang K. Shen L.Y. Chen Y.W. Li Resisting metal aggregation in pyrolysis of MOFs towards high-density metal nanocatalysts for efficient hydrazine assisted hydrogen production Nano Res. 16 2023 6067 6075 10.1007/s12274-022-4777-5 J.T. Ding, D.Y. Guo, A.Q. Hu, X.F. Yang, K. Shen, L.Y. Chen, Y.W. Li, Resisting metal aggregation in pyrolysis of MOFs towards high-density metal nanocatalysts for efficient hydrazine assisted hydrogen production. Nano Res. 16 (2023) 6067-6075. https://doi.org/10.1007/s12274-022-4777-5 [14] Q.F. Zhou R.Q. Yan Y. Zhang C.H. Lei Cobalt and zinc nanoparticles from pyrolysis of their MOF precursors exhibiting potent organophosphorus hydrolase-mimicking activities Chem. Commun. 60 2024 8216 8219 10.1039/D4CC02170C Q.F. Zhou, R.Q. Yan, Y. Zhang, C.H. Lei, Cobalt and zinc nanoparticles from pyrolysis of their MOF precursors exhibiting potent organophosphorus hydrolase-mimicking activities. Chem Comm. 60 (2024) 8216–8219. https://doi.org/10.1039/D4CC02170C [15] J.P. Yang Y.P. Jiang P.Q. Chu L.K. Lv J.X. Tao Z.W. Wang Y.X. Liu H.X. Dai J.G. Deng Catalytic combustion of toluene over highly dispersed Pt NPs embedded in porous TiO2 via in situ pyrolysis of MOFs Catal. Today 437 2024 114792 10.1016/j.cattod.2024.114792 J.P. Yang, Y.P. Jiang, P.Q. Chu, L.K. Lv, J.X. Tao, Z.W. Wang, Y.X. Liu, H.X. Dai, J.G. Deng, Catalytic combustion of toluene over highly dispersed Pt NPs embedded in porous TiO2 via in situ pyrolysis of MOFs. Catal. Today, 437 (2024) 114792. https://doi.org/10.1016/j.cattod.2024.114792 [16] M. Zhang Z.L. Chen J.Q. Ruan W.Z. Shao W.X. Wei W.X. Zhang W.C. Qiao J.S. Li Functional polymers-assisted confined pyrolysis strategy to transform MOF into hierarchical Co/N-doped carbon for peroxymonosulfate advanced oxidation processes Sep. Purif. Technol. 305 2023 122407 10.1016/j.seppur.2022.122407 M. Zhang, Z.L. Chen, J.Q. Ruan, W.Z. Shao, W.X. Wei, W.X. Zhang, W.C. Qiao, J.S. Li, Functional polymers-assisted confined pyrolysis strategy to transform MOF into hierarchical Co/N-doped carbon for peroxymonosulfate advanced oxidation processes. Sep. Purif. Technol. 305 (2023) 122407. https://doi.org/10.1016/j.seppur.2022.122407 [17] Y.T. Hu C. Song C.J. Li J. Wang Two-step pyrolysis of Mn MIL-100 MOF into MnO nanoclusters/carbon and the effect of N-doping J. Mater. Chem. A 10 2022 8172 8177 10.1039/D1TA10590F Y.T. Hu, C. Song, C.J. Li, J. Wang, Two-step pyrolysis of Mn MIL-100 MOF into MnO nanoclusters/carbon and the effect of N-doping. J. Mater. Chem. A 10 (2022) 8172-8177. https://doi.org/10.1039/D1TA10590F [18] Y. Huang Y.C. Chen M.J. Xu A. Ly A. Gili E. Murphy T. Asset Y.C. Liu V.D. Andrade C.U. Segre A.L. Deriy F.D. Carlo M. Kunz A. Gurlo X.Q. Pan P. Atanassov I.V. Zenyuk Catalysts by pyrolysis: transforming metal-organic frameworks (MOFs) precursors into metal-nitrogen-carbon (M-N-C) materials Mater. Today 69 2023 66 78 10.1016/j.mattod.2023.08.007 Y. Huang, Y.C. Chen, M.J. Xu, A. Ly, A. Gili, E. Murphy, T. Asset, Y.C. Liu, V.D. Andrade, C.U. Segre, A.L. Deriy, F.D. Carlo, M. Kunz, A. Gurlo, X.Q. Pan, P. Atanassov, I.V. Zenyuk, Catalysts by pyrolysis: Transforming metal-organic frameworks (MOFs) precursors into metal-nitrogen-carbon (M-N-C) materials. Mater. Today. 69 (2023) 66-78. https://doi.org/10.1016/j.mattod.2023.08.007 [19] Y.Z. Chen C.M. Wang Z.Y. Wu Y.J. Xiong Q. Xu S.H. Yu H.L. Jiang From bimetallic metal-organic framework to porous carbon: high surface area and multicomponent active dopants for excellent electrocatalysis Adv. Mater. 27 2015 5010 5016 10.1002/adma.201502315 Y.Z. Chen, C.M. Wang, Z.Y. Wu, Y.J. Xiong, Q. Xu, S.H. Yu, H.L. Jiang, From Bimetallic Metal-Organic Framework to Porous Carbon: High Surface Area and Multicomponent Active Dopants for Excellent Electrocatalysis. Adv. Mater. 27 (2015) 5010–5016. https://doi.org/10.1002/adma.201502315 [20] J.H. Zhao Z.C. Tang F. Dong J.Y. Zhang Controlled porous hollow Co3O4 polyhedral nanocages derived from metal-organic frameworks (MOFs) for toluene catalytic oxidation Mol. Catal. 463 2019 77 86 10.1016/j.mcat.2018.10.020 J.H. Zhao, Z.C. Tang, F. Dong, J.Y. Zhang, Controlled porous hollow Co3O4 polyhedral nanocages derived from metal-organic frameworks (MOFs) for toluene catalytic oxidation. Mol. Catal. 463 (2019) 77–86. https://doi.org/10.1016/j.mcat.2018.10.020 [21] W.P. Kong J. Li Y. Chen Y.Q. Ren Y.H. Guo S.L. Niu Y.Z. Yang ZIF-67-derived hollow nanocages with layered double oxides shell as high-efficiency catalysts for CO oxidation Appl. Surf. Sci. 437 2018 161 168 10.1016/j.apsusc.2017.12.158 W.P. Kong, J. Li, Y. Chen, Y.Q. Ren, Y.H. Guo, S.L. Niu, Y.Z. Yang, ZIF-67-derived hollow nanocages with layered double oxides shell as high-Efficiency catalysts for CO oxidation. Appl. Surf. Sci. 437 (2018) 161–168. https://doi.org/10.1016/j.apsusc.2017.12.158 [22] Y. Qin Y. Ma N. Su Y. Zhao Nanoarchitectonics of hollow Co3O4 through tannic acid etching of ZIF-67 for catalysis of toluene oxidation J. Environ. Chem. Eng. 12 2024 113811 10.1016/j.jece.2024.113811 Y. Qin, Ma. Y., Su. N., Zhao. Y., Nanoarchitectonics of hollow Co3O4 through tannic acid etching of ZIF-67 for catalysis of toluene oxidation. J. Environ. Chem. Eng. 12 (2024) 113811. https://doi.org/10.1016/j.jece.2024.113811 [23] J.J. Zhang Y. Song W.W. Liu Q. Zheng Y. Liu T.L. Wu T. Li Enhancing the acidic oxygen evolution reaction performance of RuO2-TiO2 by a reduction-oxidation process Nanotechnology 35 2024 345703 10.1088/1361-6528/ad501d J.J. Zhang, Y. Song, W.W. Liu, Q. Zheng, Y. Liu, T.L. Wu, T. Li, Enhancing the acidic oxygen evolution reaction performance of RuO2-TiO2 by a reduction-oxidation process. Nanotechnol. 35 (2024) 345703. https://doi.org/10.1088/1361-6528/ad501d [24] J. Yang J. Guo Y.B. Wang T. Wang J. Gu L.M. Peng N.H. Xue Y. Zhu X.F. Guo W.P. Ding Reduction-oxidation pretreatment enhanced catalytic performance of Co3O4/Al2O3 over CO oxidation Appl. Surf. Sci. 453 2018 330 335 10.1016/j.apsusc.2018.05.103 J. Yang, J. Guo, Y.B. Wang, T. Wang, J. Gu, L.M. Peng, N.H. Xue, Y. Zhu, X.F. Guo, W.P. Ding, Reduction-oxidation pretreatment enhanced catalytic performance of Co3O4/Al2O3 over CO oxidation. Appl. Surf. Sci. 453 (2018) 330-335. https://doi.org/10.1016/j.apsusc.2018.05.103. [25] T. Cai W. Deng P. Xu J. Yuan Z. Liu K.F. Zhao Q. Tong D.N. He Great activity enhancement of Co3O4/γ-Al2O3 catalyst for propane combustion by structural modulation Chem. Eng. J. 395 2020 125071 10.1016/j.cej.2020.125071 T. Cai, W. Deng, P. Xu, J. Yuan, Z. Liu, K.F. Zhao, Q. Tong, D.N. He, Great activity enhancement of Co3O4/γ-Al2O3 catalyst for propane combustion by structural modulation. Chem. Eng. J. 395 (2020) 125071. https://doi.org/10.1016/j.cej.2020.125071 [26] C.H. Mejía T.W. van Deelen K.P. de Jong Activity enhancement of cobalt catalysts by tuning metal-support interactions Nat. Commun. 9 2018 4459 10.1038/s41467-018-06903-w C.H. Mejía, T.W. van Deelen, K.P. de Jong, Activity enhancement of cobalt catalysts by tuning metal-support interactions. Nat. Commun. 9 (2018) 4459. https://doi.org/10.1038/s41467-018-06903-w [27] H. Zhang X.Z. Zhao S. Wang S.H. Zeng H.Q. Su Change of Cu+ species and synergistic effect of copper and cerium during reduction-oxidation treatment for preferential CO oxidation Appl. Surf. Sci. 441 2018 754 763 10.1016/j.apsusc.2018.01.244 H. Zhang, X.Z. Zhao, S. Wang, S.H. Zeng, H.Q. Su, Change of Cu+ species and synergistic effect of copper and cerium during reduction-oxidation treatment for preferential CO oxidation. Appl. Surf. Sci. 441 (2018) 754-763. https://doi.org/10.1016/j.apsusc.2018.01.244 [28] J. Cai F. Jiang X.H. Liu Exploring pretreatment effects in Co/SiO2 Fischer-Tropsch catalysts: different oxidizing gases applied to oxidation-reduction process Appl. Catal. B: Environ. 210 2017 1 13 10.1016/j.apcatb.2017.03.036 J. Cai, F. Jiang, X.H. Liu, Exploring pretreatment effects in Co/SiO2 Fischer-Tropsch catalysts: Different oxidizing gases applied to oxidation-reduction process. Appl. Catal. B: Environ. 210 (2017) 1-13. https://doi.org/10.1016/j.apcatb.2017.03.036 [29] Y.F. Li Y.Y. Fu W.B. Liu Y.H. Song L. Wang Hollow Co-Co3O4@CNTs derived from ZIF-67 for lithium ion batteries J. Alloy Compd. 784 2019 439 446 10.1016/j.jallcom.2019.01.085 Y.F. Li, Y.Y. Fu, W.B. Liu, Y.H. Song, L. Wang, Hollow Co-Co3O4@CNTs derived from ZIF-67 for lithium ion batteries. J. Alloy Compd, 784 (2019) 439-446. https://doi.org/10.1016/j.jallcom.2019.01.085 [30] N. Bahlawane P.H.T. Ngamou V. Vannier T. Kottke J. Heberle K. Kohse-Höinghaus Tailoring the properties and the reactivity of the spinel cobalt oxide Phys. Chem. Chem. Phys. 11 2009 9224 10.1039/b910707j N. Bahlawane, P.H.T. Ngamou, V. Vannier, T. Kottke, J. Heberle, K. Kohse-Höinghaus, Tailoring the properties and the reactivity of the spinel cobalt oxide. Phys. Chem. Chem. Phys. 11 (2009) 9224. https://doi.org/10.1039/b910707j [31] Y.Q. Dai P. Lu Z.M. Cao C.T. Campbell Y.N. Xia The physical chemistry and materials science behind sinter-resistant catalysts Chem. Soc. Rev. 47 2018 4314 4331 10.1039/C7CS00650K Y.Q. Dai, P. Lu, Z.M. Cao, C.T. Campbell, Y.N. Xia, The physical chemistry and materials science behind sinter-resistant catalysts. Chem. Soc. Rev. 47 (2018) 4314–4331. https://doi.org/10.1039/C7CS00650K [32] D.L. Li Y.N. Gong C.X. Pan Facile synthesis of hybrid CNTs/NiCo2S4 composite for high performance supercapacitors Sci. Rep. 6 2016 29788 10.1038/srep29788 D.L. Li, Y.N. Gong, C.X. Pan, Facile synthesis of hybrid CNTs/NiCo2S4 composite for high performance supercapacitors. Sci. Rep. 6 (2016) 29788. https://doi.org/10.1038/srep29788 [33] M.R. Johan S.H. Meriam Suhaimy Y. Yusof Physico-chemical studies of cuprous oxide (Cu2O) nanoparticles coated on amorphous carbon nanotubes (α-CNTs) Appl. Surf. Sci. 289 2014 450 454 10.1016/j.apsusc.2013.11.002 M.R. Johan, S.H. Meriam Suhaimy, Y. Yusof, Physico-chemical studies of cuprous oxide (Cu2O) nanoparticles coated on amorphous carbon nanotubes (α-CNTs). Appl. Surf. Sci. 289 (2014) 450–454. https://doi.org/10.1016/j.apsusc.2013.11.002 [34] R. Wu X.K. Qian X.H. Rui H. Liu B. Yadian K. Zhou J. Wei Q.Y. Yan X.Q. Feng Y. Long L.Y. Wang Y.Z. Huang Zeolitic imidazolate framework 67-derived high symmetric porous Co3O4 hollow dodecahedra with highly enhanced lithium storage capability Small 10 2014 1932 1938 10.1002/smll.201303520 R. Wu, X.K. Qian, X.H. Rui, H. Liu, B. Yadian, K. Zhou, J. Wei, Q.Y. Yan, X.Q. Feng, Y. Long, L.Y. Wang, Y.Z. Huang, Zeolitic Imidazolate Framework 67-Derived High Symmetric Porous Co3O4 Hollow Dodecahedra with Highly Enhanced Lithium Storage Capability. Small 10 (2014) 1932–1938. https://doi.org/10.1002/smll.201303520 [35] G.G. Li Z.Y. Shui X.X. Duan H.L. Yang Z.Y. Zhao T. Zhao Z.S. Zhang G.X. Jiang H.N. Ren J. Cheng Z.P. Hao Unveiling the balance between catalytic activity and water resistance over Co3O4 catalysts for propane oxidation: the role of crystal facet and oxygen vacancy ACS Catal. 13 2023 237 247 10.1021/acscatal.2c05640 G.G. Li, Z.Y. Shui, X.X. Duan, H.L. Yang, Z.Y. Zhao, T. Zhao, Z.S. Zhang, G.X. Jiang, H.N. Ren, J. Cheng, Z.P. Hao, Unveiling the Balance between Catalytic Activity and Water Resistance over Co3O4 Catalysts for Propane Oxidation: The Role of Crystal Facet and Oxygen Vacancy. ACS Catal. 13 (2023) 237–247. https://doi.org/10.1021/acscatal.2c05640 [36] C. Wang C.H. Zhang W.C. Hua Y.L. Guo G.Z. Lu S. Gil A. Giroir-Fendler Catalytic oxidation of vinyl chloride emissions over Co-Ce composite oxide catalysts Chem. Eng. J. 315 2017 392 402 10.1016/j.cej.2017.01.007 C. Wang, C.H. Zhang, W.C. Hua, Y.L. Guo, G.Z. Lu, S. Gil, A. Giroir-Fendler, Catalytic oxidation of vinyl chloride emissions over Co-Ce composite oxide catalysts. Chem. Eng. J. 315 (2017) 392–402. https://doi.org/10.1016/j.cej.2017.01.007 [37] C.Z. Hu H.P. Zhang Y. Yan Toluene combustion over Co3O4-CNTs/PSSF catalysts and investigation of the effects of acid treatment on catalytic activity J. Taiwan Inst. Chem. Eng. 149 2023 105002 10.1016/j.jtice.2023.105002 C.Z. Hu, H.P. Zhang, Y. Yan, Toluene combustion over Co3O4-CNTs/PSSF catalysts and investigation of the effects of acid treatment on catalytic activity. J. Taiwan Inst. Chem. Eng. 149 (2023) 105002. https://doi.org/10.1016/j.jtice.2023.105002 [38] W.Q. Song A.S. Poyraz Y.T. Meng Z. Ren S.Y. Chen S.L. Suib Mesoporous Co3O4 with controlled porosity: inverse micelle synthesis and high-performance catalytic CO oxidation at −60 °C Chem. Mater. 26 2014 4629 4639 10.1021/cm502106v W.Q. Song, A.S. Poyraz, Y.T. Meng, Z. Ren, S.Y. Chen, S.L. Suib, Mesoporous Co3O4 with Controlled Porosity: Inverse Micelle Synthesis and High-Performance Catalytic CO Oxidation at −60 °C. Chem. Mater. 26 (2014) 4629–4639. https://doi.org/10.1021/cm502106v [39] J.Y. Luo M. Meng X. Li X.G. Li Y.Q. Zha T.D. Hu Y.N. Xie J. Zhang Mesoporous Co3O4–CeO2 and Pd/Co3O4–CeO2 catalysts: synthesis, characterization and mechanistic study of their catalytic properties for low-temperature CO oxidation J. Catal. 254 2008 310 324 10.1016/j.jcat.2008.01.007 J.Y. Luo, M. Meng, X. Li, X.G. Li, Y.Q. Zha, T.D. Hu, Y.N. Xie, J. Zhang, Mesoporous Co3O4–CeO2 and Pd/Co3O4–CeO2 catalysts: Synthesis, characterization and mechanistic study of their catalytic properties for low-temperature CO oxidation. J. Catal. 254 (2008) 310–324. https://doi.org/10.1016/j.jcat.2008.01.007 [40] L. Ma Y. Geng X.Y. Chen N.Q. Yan J.H. Li J.W. Schwank Reaction mechanism of propane oxidation over Co3O4 nanorods as rivals of platinum catalysts Chem. Eng. J. 402 2020 125911 10.1016/j.cej.2020.125911 L. Ma, Y. Geng, X.Y. Chen, N.Q. Yan, J.H. Li, J.W. Schwank, Reaction mechanism of propane oxidation over Co3O4 nanorods as rivals of platinum catalysts. Chem. Eng. J. 402 (2020) 125911. https://doi.org/10.1016/j.cej.2020.125911 [41] W.D. Zhang Y. Zhou M. Shamzhy S. Molitorisová M. Opanasenko A. Giroir-Fendler Total oxidation of toluene and propane over supported Co3O4 catalysts: effect of structure/acidity of MWW zeolite and cobalt loading ACS Appl. Mater. Interfaces 13 2021 15143 15158 10.1021/acsami.0c21999 W.D. Zhang, Y. Zhou, M. Shamzhy, S. Molitorisová, M. Opanasenko, A. Giroir-Fendler, Total Oxidation of Toluene and Propane over Supported Co3O4 Catalysts: Effect of Structure/Acidity of MWW Zeolite and Cobalt Loading. ACS Appl. Mater. Interfaces 13 (2021) 15143–15158. https://doi.org/10.1021/acsami.0c21999 [42] C.F. Liu L.C. He X.F. Wang J. Chen J.Q. Lu M.F. Luo Tailoring Co3O4 active species to promote propane combustion over Co3O4/ZSM-5 catalyst Mol. Catal. 524 2022 112297 10.1016/j.mcat.2022.112297 C.F. Liu, L.C. He, X.F. Wang, J. Chen, J.Q. Lu, M.F. Luo, Tailoring Co3O4 active species to promote propane combustion over Co3O4/ZSM-5 catalyst. Mol. Catal. 524 (2022) 112297. https://doi.org/10.1016/j.mcat.2022.112297 [43] Z.P. Huang J.J. Ding X.W. Yang H. Liu P.Y. Song Y.L. Guo Y. Guo L. Wang W.C. Zhan Highly efficient oxidation of propane at low temperature over a pt-based catalyst by optimization support Environ. Sci. Technol. 56 2022 17278 17287 10.1021/acs.est.2c05599 Z.P. Huang, J.J. Ding, X.W. Yang, H. Liu, P.Y. Song, Y.L. Guo, Y. Guo, L. Wang, W.C. Zhan. Highly Efficient Oxidation of Propane at Low Temperature over a Pt-Based Catalyst by Optimization Support. Environ. Sci. Technol. 56 (2022) 17278–17287. https://doi.org/10.1021/acs.est.2c05599 [44] H.G. Peng T. Dong S.Y. Yang H. Chen Z.Z. Yang W.M. Liu C. He P. Wu J.S. Tian Y. Peng X.F. Chu D.S. Wu T.C. An Y. Wang S. Dai Intra-crystalline mesoporous zeolite encapsulation-derived thermally robust metal nanocatalyst in deep oxidation of light alkanes Nat. Commun. 13 2022 295 10.1038/s41467-021-27828-x H.G. Peng, T. Dong, S.Y. Yang, H. Chen, Z.Z. Yang, W.M. Liu, C. He, P. Wu, J.S. Tian, Y. Peng, X.F. Chu, D.S. Wu, T.C. An, Y. Wang, S. Dai, Intra-crystalline mesoporous zeolite encapsulation-derived thermally robust metal nanocatalyst in deep oxidation of light alkanes. Nat. Commun. 13 (2022) 295. https://doi.org/10.1038/s41467-021-27828-x [45] G.G. Li N. Li Y.G. Sun Y.M. Qu Z.Y. Jiang Z.Y. Zhao Z.S. Zhang J. Cheng Z.P. Hao Efficient defect engineering in Co-Mn binary oxides for low-temperature propane oxidation Appl. Catal. B: Environ. 282 2021 119512 10.1016/j.apcatb.2020.119512 G.G. Li, N. Li, Y.G. Sun, Y.M. Qu, Z.Y. Jiang, Z.Y. Zhao, Z.S. Zhang, J. Cheng, Z.P. Hao, Efficient defect engineering in Co-Mn binary oxides for low-temperature propane oxidation. Appl. Catal. B: Environ. 282 (2021) 119512. https://doi.org/10.1016/j.apcatb.2020.119512 [46] T. Zhang X.Y. Lang A.Q. Dong X. Wan S. Gao L. Wang L.X. Wang W.C. Wang Difference of oxidation mechanism between light C3–C4 alkane and alkene over mullite YMn2O5 oxides’ catalyst ACS Catal. 10 2020 7269 7282 10.1021/acscatal.0c00703 T. Zhang, X.Y. Lang, A.Q. Dong, X. Wan, S. Gao, L. Wang, L.X. Wang, W.C. Wang, Difference of Oxidation Mechanism between Light C3–C4 Alkane and Alkene over Mullite YMn2O5 Oxides’ Catalyst. ACS Catal. 10 (2020) 7269–7282. https://doi.org/10.1021/acscatal.0c00703 [47] J.X. Tao Q.L. Zhang Y.H. Zhao H.N. Chen W.M. Liu Y.Z. He Y.N. Yin T.Y. He J. Chen X.Y. Wang D.S. Wu H.G. Peng Elucidating the role of confinement and shielding effect over zeolite enveloped Ru catalysts for propane low temperature degradation Chemosphere 302 2022 134884 10.1016/j.chemosphere.2022.134884 J.X. Tao, Q.L. Zhang, Y.H. Zhao, H.N. Chen, W.M. Liu, Y.Z. He, Y.N. Yin, T.Y. He, J. Chen, X.Y. Wang, D.S. Wu, H.G. Peng, Elucidating the role of confinement and shielding effect over zeolite enveloped Ru catalysts for propane low temperature degradation. Chemosphere 302 (2022) 134884. https://doi.org/10.1016/j.chemosphere.2022.134884 [48] C.P. O’Brien I.C. Lee A detailed spectroscopic analysis of the growth of oxy-carbon species on the surface of Pt/Al2O3 during propane oxidation J. Catal. 347 2017 1 8 C.P. O’Brien, I.C. Lee. A detailed spectroscopic analysis of the growth of oxy-carbon species on the surface of Pt/Al2O3 during propane oxidation. J. Catal. 347 (2017) 1–8. [49] Z. Hu Z. Wang Y. Guo L. Wang Y.L. Guo J.S. Zhang W.C. Zhan Total oxidation of propane over a Ru/CeO2 catalyst at low temperature Environ. Sci. Technol. 52 2018 9531 9541 10.1021/acs.est.8b03448 Z. Hu, Z. Wang, Y. Guo, L. Wang, Y.L. Guo, J.S. Zhang, W.C. Zhan, Total Oxidation of Propane over a Ru/CeO2 Catalyst at Low Temperature. Environ. Sci. Technol. 52 (2018) 9531–9541. https://doi.org/10.1021/acs.est.8b03448 [50] W.M. Liao P.P. Zhao B.H. Cen A.P. Jia J.Q. Lu M.F. Luo Co–Cr–O mixed oxides for low–temperature total oxidation of propane: structural effects, kinetics, and spectroscopic investigation Chin. J. Catal. 41 2020 442 453 10.1016/s1872-2067(19)63480-7 W.M. Liao, P.P. Zhao, B.H. Cen, A.P. Jia, J.Q. Lu, M.F. Luo, Co–Cr–O mixed oxides for low–temperature total oxidation of propane: Structural effects, kinetics, and spectroscopic investigation. Chinese J. Catal. 41 (2020) 442–453. https://doi.org/10.1016/s1872-2067(19)63480-7 [51] Y.F. Jian M.J. Tian C. He J.C. Xiong Z.Y. Jiang H. Jin L.R. Zheng R. Albilali J.W. Shi Efficient propane low-temperature destruction by Co3O4 crystal facets engineering: unveiling the decisive role of lattice and oxygen defects and surface acid-base pairs Appl. Catal. B: Environ. 283 2021 119657 10.1016/j.apcatb.2020.119657 Y.F. Jian, M.J. Tian, C. He, J.C. Xiong, Z.Y. Jiang, H. Jin, L.R. Zheng, R. Albilali, J.W. Shi, Efficient propane low-temperature destruction by Co3O4 crystal facets engineering: Unveiling the decisive role of lattice and oxygen defects and surface acid-base pairs. Appl. Catal. B: Environ. 283 (2021) 119657. https://doi.org/10.1016/j.apcatb.2020.119657",
      "scopus-id": "105001710654",
      "coredata": {
        "eid": "1-s2.0-S0926860X25001541",
        "dc:description": "Co3O4 is an effective catalyst for propane total oxidation, and ZIF-67 pyrolysis is usually used to produce cobalt-based catalysts. However, high-temperature pyrolysis often leads to structural collapse and reduced cobalt activity. This study presents a CTAB-modified ZIF-67-derived hollow Co3O4-CNTs catalyst for enhanced propane total oxidation. The catalyst was synthesized through H2/Ar reduction at 800 °C and subsequent air oxidation at 300 °C. This process preserved the cubic structure of ZIF-67 and produced abundant CNTs, which limited Co3O4 growth and resulted in superior catalytic activity, with a T90 % of 230 °C-lower than that of noble metal catalysts. Increasing the oxidation temperature led to a decrease in CNTs, growth of Co3O4 particles, and structural collapse. The 300 °C calcined catalyst (300 A) showed the best performance due to its smallest Co3O4 particles and excellent reducibility, while higher temperatures led to particle agglomeration and decreased activity.",
        "openArchiveArticle": "false",
        "prism:coverDate": "2025-06-05",
        "openaccessUserLicense": null,
        "prism:aggregationType": "Journal",
        "prism:url": "https://api.elsevier.com/content/article/pii/S0926860X25001541",
        "dc:creator": [
          {
            "@_fa": "true",
            "$": "Li, Xiang"
          },
          {
            "@_fa": "true",
            "$": "Liu, Zhe"
          },
          {
            "@_fa": "true",
            "$": "Yuan, Jing"
          },
          {
            "@_fa": "true",
            "$": "Liang, Sen"
          },
          {
            "@_fa": "true",
            "$": "Xu, Zhenmin"
          },
          {
            "@_fa": "true",
            "$": "Hu, XiaoJun"
          }
        ],
        "link": [
          {
            "@_fa": "true",
            "@rel": "self",
            "@href": "https://api.elsevier.com/content/article/pii/S0926860X25001541"
          },
          {
            "@_fa": "true",
            "@rel": "scidir",
            "@href": "https://www.sciencedirect.com/science/article/pii/S0926860X25001541"
          }
        ],
        "dc:format": "application/json",
        "openaccessType": null,
        "pii": "S0926-860X(25)00154-1",
        "prism:volume": "699",
        "articleNumber": "120253",
        "prism:publisher": "Published by Elsevier B.V.",
        "dc:title": "Enhancing propane oxidation with CTAB-modified ZIF-67-derived hollow Co3O4-CNTs catalysts through reduction-oxidation treatment",
        "prism:copyright": "© 2025 Published by Elsevier B.V.",
        "openaccess": "0",
        "prism:issn": "0926860X",
        "dcterms:subject": [
          {
            "@_fa": "true",
            "$": "VOCs"
          },
          {
            "@_fa": "true",
            "$": "Co3O4"
          },
          {
            "@_fa": "true",
            "$": "Reduction-oxidation treatment"
          },
          {
            "@_fa": "true",
            "$": "Propane total oxidation"
          }
        ],
        "openaccessArticle": "false",
        "prism:publicationName": "Applied Catalysis A: General",
        "openaccessSponsorType": null,
        "prism:pageRange": "120253",
        "pubType": "fla",
        "prism:coverDisplayDate": "5 June 2025",
        "prism:doi": "10.1016/j.apcata.2025.120253",
        "prism:startingPage": "120253",
        "dc:identifier": "doi:10.1016/j.apcata.2025.120253",
        "openaccessSponsorName": null
      },
      "objects": {
        "object": [
          {
            "@category": "standard",
            "@height": "251",
            "@width": "565",
            "@_fa": "true",
            "$": "https://api.elsevier.com/content/object/eid/1-s2.0-S0926860X25001541-gr1.jpg?httpAccept=%2A%2F%2A",
            "@multimediatype": "JPEG image file",
            "@type": "IMAGE-DOWNSAMPLED",
            "@size": "37704",
            "@ref": "gr1",
            "@mimetype": "image/jpeg"
          },
          {
            "@category": "standard",
            "@height": "394",
            "@width": "791",
            "@_fa": "true",
            "$": "https://api.elsevier.com/content/object/eid/1-s2.0-S0926860X25001541-gr2.jpg?httpAccept=%2A%2F%2A",
            "@multimediatype": "JPEG image file",
            "@type": "IMAGE-DOWNSAMPLED",
            "@size": "115953",
            "@ref": "gr2",
            "@mimetype": "image/jpeg"
          },
          {
            "@category": "standard",
            "@height": "200",
            "@width": "372",
            "@_fa": "true",
            "$": "https://api.elsevier.com/content/object/eid/1-s2.0-S0926860X25001541-ga1.jpg?httpAccept=%2A%2F%2A",
            "@multimediatype": "JPEG image file",
            "@type": "IMAGE-DOWNSAMPLED",
            "@size": "25098",
            "@ref": "ga1",
            "@mimetype": "image/jpeg"
          },
          {
            "@category": "standard",
            "@height": "433",
            "@width": "791",
            "@_fa": "true",
            "$": "https://api.elsevier.com/content/object/eid/1-s2.0-S0926860X25001541-gr7.jpg?httpAccept=%2A%2F%2A",
            "@multimediatype": "JPEG image file",
            "@type": "IMAGE-DOWNSAMPLED",
            "@size": "98866",
            "@ref": "gr7",
            "@mimetype": "image/jpeg"
          },
          {
            "@category": "standard",
            "@height": "576",
            "@width": "791",
            "@_fa": "true",
            "$": "https://api.elsevier.com/content/object/eid/1-s2.0-S0926860X25001541-gr3.jpg?httpAccept=%2A%2F%2A",
            "@multimediatype": "JPEG image file",
            "@type": "IMAGE-DOWNSAMPLED",
            "@size": "161883",
            "@ref": "gr3",
            "@mimetype": "image/jpeg"
          },
          {
            "@category": "standard",
            "@height": "474",
            "@width": "565",
            "@_fa": "true",
            "$": "https://api.elsevier.com/content/object/eid/1-s2.0-S0926860X25001541-gr4.jpg?httpAccept=%2A%2F%2A",
            "@multimediatype": "JPEG image file",
            "@type": "IMAGE-DOWNSAMPLED",
            "@size": "63493",
            "@ref": "gr4",
            "@mimetype": "image/jpeg"
          },
          {
            "@category": "standard",
            "@height": "264",
            "@width": "339",
            "@_fa": "true",
            "$": "https://api.elsevier.com/content/object/eid/1-s2.0-S0926860X25001541-gr5.jpg?httpAccept=%2A%2F%2A",
            "@multimediatype": "JPEG image file",
            "@type": "IMAGE-DOWNSAMPLED",
            "@size": "19901",
            "@ref": "gr5",
            "@mimetype": "image/jpeg"
          },
          {
            "@category": "standard",
            "@height": "408",
            "@width": "565",
            "@_fa": "true",
            "$": "https://api.elsevier.com/content/object/eid/1-s2.0-S0926860X25001541-gr6.jpg?httpAccept=%2A%2F%2A",
            "@multimediatype": "JPEG image file",
            "@type": "IMAGE-DOWNSAMPLED",
            "@size": "42516",
            "@ref": "gr6",
            "@mimetype": "image/jpeg"
          },
          {
            "@category": "thumbnail",
            "@height": "97",
            "@width": "219",
            "@_fa": "true",
            "$": "https://api.elsevier.com/content/object/eid/1-s2.0-S0926860X25001541-gr1.sml?httpAccept=%2A%2F%2A",
            "@multimediatype": "GIF image file",
            "@type": "IMAGE-THUMBNAIL",
            "@size": "7204",
            "@ref": "gr1",
            "@mimetype": "image/gif"
          },
          {
            "@category": "thumbnail",
            "@height": "109",
            "@width": "219",
            "@_fa": "true",
            "$": "https://api.elsevier.com/content/object/eid/1-s2.0-S0926860X25001541-gr2.sml?httpAccept=%2A%2F%2A",
            "@multimediatype": "GIF image file",
            "@type": "IMAGE-THUMBNAIL",
            "@size": "17774",
            "@ref": "gr2",
            "@mimetype": "image/gif"
          },
          {
            "@category": "thumbnail",
            "@height": "118",
            "@width": "219",
            "@_fa": "true",
            "$": "https://api.elsevier.com/content/object/eid/1-s2.0-S0926860X25001541-ga1.sml?httpAccept=%2A%2F%2A",
            "@multimediatype": "GIF image file",
            "@type": "IMAGE-THUMBNAIL",
            "@size": "13888",
            "@ref": "ga1",
            "@mimetype": "image/gif"
          },
          {
            "@category": "thumbnail",
            "@height": "120",
            "@width": "219",
            "@_fa": "true",
            "$": "https://api.elsevier.com/content/object/eid/1-s2.0-S0926860X25001541-gr7.sml?httpAccept=%2A%2F%2A",
            "@multimediatype": "GIF image file",
            "@type": "IMAGE-THUMBNAIL",
            "@size": "11314",
            "@ref": "gr7",
            "@mimetype": "image/gif"
          },
          {
            "@category": "thumbnail",
            "@height": "160",
            "@width": "219",
            "@_fa": "true",
            "$": "https://api.elsevier.com/content/object/eid/1-s2.0-S0926860X25001541-gr3.sml?httpAccept=%2A%2F%2A",
            "@multimediatype": "GIF image file",
            "@type": "IMAGE-THUMBNAIL",
            "@size": "25856",
            "@ref": "gr3",
            "@mimetype": "image/gif"
          },
          {
            "@category": "thumbnail",
            "@height": "164",
            "@width": "195",
            "@_fa": "true",
            "$": "https://api.elsevier.com/content/object/eid/1-s2.0-S0926860X25001541-gr4.sml?httpAccept=%2A%2F%2A",
            "@multimediatype": "GIF image file",
            "@type": "IMAGE-THUMBNAIL",
            "@size": "11203",
            "@ref": "gr4",
            "@mimetype": "image/gif"
          },
          {
            "@category": "thumbnail",
            "@height": "164",
            "@width": "211",
            "@_fa": "true",
            "$": "https://api.elsevier.com/content/object/eid/1-s2.0-S0926860X25001541-gr5.sml?httpAccept=%2A%2F%2A",
            "@multimediatype": "GIF image file",
            "@type": "IMAGE-THUMBNAIL",
            "@size": "7898",
            "@ref": "gr5",
            "@mimetype": "image/gif"
          },
          {
            "@category": "thumbnail",
            "@height": "158",
            "@width": "219",
            "@_fa": "true",
            "$": "https://api.elsevier.com/content/object/eid/1-s2.0-S0926860X25001541-gr6.sml?httpAccept=%2A%2F%2A",
            "@multimediatype": "GIF image file",
            "@type": "IMAGE-THUMBNAIL",
            "@size": "7733",
            "@ref": "gr6",
            "@mimetype": "image/gif"
          },
          {
            "@category": "high",
            "@height": "1109",
            "@width": "2495",
            "@_fa": "true",
            "$": "https://api.elsevier.com/content/object/eid/1-s2.0-S0926860X25001541-gr1_lrg.jpg?httpAccept=%2A%2F%2A",
            "@multimediatype": "JPEG image file",
            "@type": "IMAGE-HIGH-RES",
            "@size": "191624",
            "@ref": "gr1",
            "@mimetype": "image/jpeg"
          },
          {
            "@category": "high",
            "@height": "1739",
            "@width": "3493",
            "@_fa": "true",
            "$": "https://api.elsevier.com/content/object/eid/1-s2.0-S0926860X25001541-gr2_lrg.jpg?httpAccept=%2A%2F%2A",
            "@multimediatype": "JPEG image file",
            "@type": "IMAGE-HIGH-RES",
            "@size": "534223",
            "@ref": "gr2",
            "@mimetype": "image/jpeg"
          },
          {
            "@category": "high",
            "@height": "886",
            "@width": "1648",
            "@_fa": "true",
            "$": "https://api.elsevier.com/content/object/eid/1-s2.0-S0926860X25001541-ga1_lrg.jpg?httpAccept=%2A%2F%2A",
            "@multimediatype": "JPEG image file",
            "@type": "IMAGE-HIGH-RES",
            "@size": "192143",
            "@ref": "ga1",
            "@mimetype": "image/jpeg"
          },
          {
            "@category": "high",
            "@height": "1914",
            "@width": "3493",
            "@_fa": "true",
            "$": "https://api.elsevier.com/content/object/eid/1-s2.0-S0926860X25001541-gr7_lrg.jpg?httpAccept=%2A%2F%2A",
            "@multimediatype": "JPEG image file",
            "@type": "IMAGE-HIGH-RES",
            "@size": "510244",
            "@ref": "gr7",
            "@mimetype": "image/jpeg"
          },
          {
            "@category": "high",
            "@height": "2544",
            "@width": "3493",
            "@_fa": "true",
            "$": "https://api.elsevier.com/content/object/eid/1-s2.0-S0926860X25001541-gr3_lrg.jpg?httpAccept=%2A%2F%2A",
            "@multimediatype": "JPEG image file",
            "@type": "IMAGE-HIGH-RES",
            "@size": "911557",
            "@ref": "gr3",
            "@mimetype": "image/jpeg"
          },
          {
            "@category": "high",
            "@height": "2094",
            "@width": "2495",
            "@_fa": "true",
            "$": "https://api.elsevier.com/content/object/eid/1-s2.0-S0926860X25001541-gr4_lrg.jpg?httpAccept=%2A%2F%2A",
            "@multimediatype": "JPEG image file",
            "@type": "IMAGE-HIGH-RES",
            "@size": "347459",
            "@ref": "gr4",
            "@mimetype": "image/jpeg"
          },
          {
            "@category": "high",
            "@height": "1164",
            "@width": "1497",
            "@_fa": "true",
            "$": "https://api.elsevier.com/content/object/eid/1-s2.0-S0926860X25001541-gr5_lrg.jpg?httpAccept=%2A%2F%2A",
            "@multimediatype": "JPEG image file",
            "@type": "IMAGE-HIGH-RES",
            "@size": "107836",
            "@ref": "gr5",
            "@mimetype": "image/jpeg"
          },
          {
            "@category": "high",
            "@height": "1802",
            "@width": "2495",
            "@_fa": "true",
            "$": "https://api.elsevier.com/content/object/eid/1-s2.0-S0926860X25001541-gr6_lrg.jpg?httpAccept=%2A%2F%2A",
            "@multimediatype": "JPEG image file",
            "@type": "IMAGE-HIGH-RES",
            "@size": "216419",
            "@ref": "gr6",
            "@mimetype": "image/jpeg"
          },
          {
            "@category": "standard",
            "@_fa": "true",
            "$": "https://api.elsevier.com/content/object/eid/1-s2.0-S0926860X25001541-mmc1.docx?httpAccept=%2A%2F%2A",
            "@multimediatype": "Microsoft Word file",
            "@type": "APPLICATION",
            "@size": "50428199",
            "@ref": "mmc1",
            "@mimetype": "application/word"
          }
        ]
      },
      "link": {
        "@rel": "abstract",
        "@href": "https://api.elsevier.com/content/abstract/scopus_id/105001710654"
      }
    }
  }
}