{
  "metadata": {
    "title": "Pd/K/Co-oxide catalyst for water gas shift",
    "authors": "; ; ",
    "journal": "Applied Catalysis A: General",
    "date": "2015-01-31",
    "doi": "10.1016/j.apcata.2014.10.016",
    "abstract": "",
    "uri": "https://api.elsevier.com/content/article/pii/S0926860X14006292",
    "pii": "S0926860X14006292"
  },
  "fulltext": {
    "full-text-retrieval-response": {
      "scopus-eid": "2-s2.0-84912558017",
      "originalText": "serial JL 271346 291210 291744 291809 31 Applied Catalysis A: General APPLIEDCATALYSISAGENERAL 2014-11-03 2014-11-03 2019-10-30T03:10:36 1-s2.0-S0926860X14006292 S0926-860X(14)00629-2 S0926860X14006292 10.1016/j.apcata.2014.10.016 S300 S300.2 FULL-TEXT 1-s2.0-S0926860X14X00207 2024-01-01T12:30:29.635264Z 0 0 20150101 20150131 2015 2014-11-03T07:50:02.465232Z absattachment articleinfo articletitlenorm authfirstinitialnorm authfirstsurnamenorm cid cids contenttype copyright crossmark dateloaded dateloadedtxt datesearch datesort dateupdated dco docsubtype doctype doi eid ewtransactionid hubeid indexeddate issn issnnorm itemstage itemtransactionid itemweight openaccess openarchive pg pgfirst pglast pii piinorm pubdateend pubdatestart pubdatetxt pubyr sectiontitle sortorder srctitle srctitlenorm srctype ssids alllist content subj subheadings suppl tomb volfirst volissue volumelist webpdf webpdfpagecount yearnav figure table body affil articletitle auth authfirstini authfull authkeywords authlast highlightsabst primabst ref specialabst 0926-860X 0926860X true 489 489 C Volume 489 32 247 254 247 254 201501 January 2015 2015-01-01 2015-01-31 2015 Articles article fla Copyright © 2014 Elsevier B.V. All rights reserved. PDKCOOXIDECATALYSTFORWATERGASSHIFT KONO E 1 Introduction 2 Experimental 2.1 Catalyst preparation method 2.2 Catalytic activity tests 2.3 Characterization of catalysts 2.4 Transient response experiment 2.5 DRIFT measurements 3 Results and discussion 3.1 Relation to catalytic activity, preparation method and reducibility of cobalt oxide over Pd/K/Co3O4 catalysts 3.2 Characterization of catalysts 3.3 Reaction mechanism over Pd/K/Co3O4 4 Conclusion References RATNASAMY 2009 325 440 C MENDES 2009 111 137 D LADEBECK 2010 1 12 J NEWSOME 1980 275 318 D TWIGG 2001 161 174 M HARUTA 1993 175 192 M ANDREEVA 1996 275 283 D BASINSKA 1999 241 246 A BUNLUESIN 1998 107 114 T LUENGNARUEMITCHAI 2003 215 221 A ANDREEVA 2002 82 88 D PIGOS 2007 14 26 J EVIN 2008 9 19 H PANAGIOTOPOULOU 2009 57 66 P ZHU 2009 135 141 X ZHAI 2010 1633 1636 Y SEKINE 2010 184 188 Y WATANABE 2013 1 11 R YAMAMURO 2013 339 344 K DIEHL 2009 11 24 F CABALLERO 1996 253 265 A MIYAKOSHI 2001 249 258 A ASANO 2008 242 249 K BRUN 1999 55 60 M PEKIRIDIS 2011 1135 1142 G CARLSSON 2003 778 785 A KRAWCZYK 2004 49 52 M ZHANG 2007 3088 3094 L KHASSIN 2001 189 204 A PETITTO 2008 49 58 S MA 2011 757 767 W MIERZWA 1999 93 97 B WANG 2013 4149 4158 H SCHNEIDER 1984 4593 4599 R SUVANTO 1997 91 96 S MORALES 2007 91 99 F ZHU 2005 41 50 H OLYMPIOU 2007 304 318 G SHIDO 1993 71 81 T KONDARIDES 2000 147 164 D XU 2003 12643 12649 R JACOBS 2003 107 118 G KONOX2015X247 KONOX2015X247X254 KONOX2015X247XE KONOX2015X247X254XE 2017-12-18T07:20:39.242Z http://vtw.elsevier.com/data/voc/AddOnTypes/50.7/nlp item S0926-860X(14)00629-2 S0926860X14006292 1-s2.0-S0926860X14006292 10.1016/j.apcata.2014.10.016 271346 2024-01-01T12:30:29.635264Z 2015-01-01 2015-01-31 1-s2.0-S0926860X14006292-main.pdf https://s3.amazonaws.com/prod-ucs-content-store-us-east/content/pii:S0926860X14006292/MAIN/application/pdf/34e22f067c60cc7f986c6ea968df5a50/main.pdf main.pdf pdf true 1247499 MAIN 8 1-s2.0-S0926860X14006292-main_1.png https://s3.amazonaws.com/prod-ucs-content-store-us-east/content/pii:S0926860X14006292/PREVIEW/image/png/86b0e225a15f46ef453a07fe89f89707/main_1.png main_1.png png 58550 849 656 IMAGE-WEB-PDF 1 1-s2.0-S0926860X14006292-fx1.sml https://s3.amazonaws.com/prod-ucs-content-store-us-east/content/pii:S0926860X14006292/fx1/THUMBNAIL/image/gif/d3b76152e1eab1b39105579d5268266c/fx1.sml fx1 true fx1.sml sml 6817 164 162 IMAGE-THUMBNAIL 1-s2.0-S0926860X14006292-gr1.sml https://s3.amazonaws.com/prod-ucs-content-store-us-east/content/pii:S0926860X14006292/gr1/THUMBNAIL/image/gif/bcb5cf0ba52933b20a8c5fd5b8336751/gr1.sml gr1 gr1.sml sml 5383 164 167 IMAGE-THUMBNAIL 1-s2.0-S0926860X14006292-gr10.sml https://s3.amazonaws.com/prod-ucs-content-store-us-east/content/pii:S0926860X14006292/gr10/THUMBNAIL/image/gif/557fbb866fcdc6fc0dc839a59b9d32ee/gr10.sml gr10 gr10.sml sml 9154 164 184 IMAGE-THUMBNAIL 1-s2.0-S0926860X14006292-gr11.sml https://s3.amazonaws.com/prod-ucs-content-store-us-east/content/pii:S0926860X14006292/gr11/THUMBNAIL/image/gif/9d6cddaf4a0dca72cdeaa59a06d8fde4/gr11.sml gr11 gr11.sml sml 7694 164 159 IMAGE-THUMBNAIL 1-s2.0-S0926860X14006292-gr12.sml https://s3.amazonaws.com/prod-ucs-content-store-us-east/content/pii:S0926860X14006292/gr12/THUMBNAIL/image/gif/6b5b0a6cebdd0ac0e77083dd4935d002/gr12.sml gr12 gr12.sml sml 5097 164 159 IMAGE-THUMBNAIL 1-s2.0-S0926860X14006292-gr2.sml https://s3.amazonaws.com/prod-ucs-content-store-us-east/content/pii:S0926860X14006292/gr2/THUMBNAIL/image/gif/490c9f29a7fd048620f0f2af03ecc917/gr2.sml gr2 gr2.sml sml 5166 163 170 IMAGE-THUMBNAIL 1-s2.0-S0926860X14006292-gr3.sml https://s3.amazonaws.com/prod-ucs-content-store-us-east/content/pii:S0926860X14006292/gr3/THUMBNAIL/image/gif/5197e2d4ed218eaf0e0872f3ca6085d3/gr3.sml gr3 gr3.sml sml 6770 164 193 IMAGE-THUMBNAIL 1-s2.0-S0926860X14006292-gr4.sml https://s3.amazonaws.com/prod-ucs-content-store-us-east/content/pii:S0926860X14006292/gr4/THUMBNAIL/image/gif/e302996a441b5a68435e95f7b93d2db5/gr4.sml gr4 gr4.sml sml 6430 164 193 IMAGE-THUMBNAIL 1-s2.0-S0926860X14006292-gr5.sml https://s3.amazonaws.com/prod-ucs-content-store-us-east/content/pii:S0926860X14006292/gr5/THUMBNAIL/image/gif/6ac4d5069187fefc78aa4fe9ae7b97a6/gr5.sml gr5 gr5.sml sml 5281 164 150 IMAGE-THUMBNAIL 1-s2.0-S0926860X14006292-gr6.sml https://s3.amazonaws.com/prod-ucs-content-store-us-east/content/pii:S0926860X14006292/gr6/THUMBNAIL/image/gif/91748d1ba029e3a3cb34b42510ae6dac/gr6.sml gr6 gr6.sml sml 5525 164 144 IMAGE-THUMBNAIL 1-s2.0-S0926860X14006292-gr7.sml https://s3.amazonaws.com/prod-ucs-content-store-us-east/content/pii:S0926860X14006292/gr7/THUMBNAIL/image/gif/ba27114ad801169b77ec07d9a545156d/gr7.sml gr7 gr7.sml sml 6490 164 146 IMAGE-THUMBNAIL 1-s2.0-S0926860X14006292-gr8.sml https://s3.amazonaws.com/prod-ucs-content-store-us-east/content/pii:S0926860X14006292/gr8/THUMBNAIL/image/gif/4b5e8abb79be29f7cf0c3d920abba051/gr8.sml gr8 gr8.sml sml 3841 164 146 IMAGE-THUMBNAIL 1-s2.0-S0926860X14006292-gr9.sml https://s3.amazonaws.com/prod-ucs-content-store-us-east/content/pii:S0926860X14006292/gr9/THUMBNAIL/image/gif/0b293bc661fd701a21dd2055efa7835d/gr9.sml gr9 gr9.sml sml 5783 164 161 IMAGE-THUMBNAIL 1-s2.0-S0926860X14006292-fx1.jpg https://s3.amazonaws.com/prod-ucs-content-store-us-east/content/pii:S0926860X14006292/fx1/DOWNSAMPLED/image/jpeg/34a9fe227ebded5c831be41876f9d182/fx1.jpg fx1 true fx1.jpg jpg 12557 199 197 IMAGE-DOWNSAMPLED 1-s2.0-S0926860X14006292-gr1.jpg https://s3.amazonaws.com/prod-ucs-content-store-us-east/content/pii:S0926860X14006292/gr1/DOWNSAMPLED/image/jpeg/ab435b355b578f0d2a526658a6e39f96/gr1.jpg gr1 gr1.jpg jpg 17616 271 277 IMAGE-DOWNSAMPLED 1-s2.0-S0926860X14006292-gr10.jpg https://s3.amazonaws.com/prod-ucs-content-store-us-east/content/pii:S0926860X14006292/gr10/DOWNSAMPLED/image/jpeg/4237a61a5e224bce5fe763f62d7ee78c/gr10.jpg gr10 gr10.jpg jpg 32279 296 333 IMAGE-DOWNSAMPLED 1-s2.0-S0926860X14006292-gr11.jpg https://s3.amazonaws.com/prod-ucs-content-store-us-east/content/pii:S0926860X14006292/gr11/DOWNSAMPLED/image/jpeg/4c9a32cc564e30e3fe69ca83c5384810/gr11.jpg gr11 gr11.jpg jpg 27755 311 301 IMAGE-DOWNSAMPLED 1-s2.0-S0926860X14006292-gr12.jpg https://s3.amazonaws.com/prod-ucs-content-store-us-east/content/pii:S0926860X14006292/gr12/DOWNSAMPLED/image/jpeg/140a66031f95382204ca4b23aa57ebb6/gr12.jpg gr12 gr12.jpg jpg 15629 260 253 IMAGE-DOWNSAMPLED 1-s2.0-S0926860X14006292-gr2.jpg https://s3.amazonaws.com/prod-ucs-content-store-us-east/content/pii:S0926860X14006292/gr2/DOWNSAMPLED/image/jpeg/5c3c8ffcb57d5d7842f669e51ca37ef9/gr2.jpg gr2 gr2.jpg jpg 19544 289 301 IMAGE-DOWNSAMPLED 1-s2.0-S0926860X14006292-gr3.jpg https://s3.amazonaws.com/prod-ucs-content-store-us-east/content/pii:S0926860X14006292/gr3/DOWNSAMPLED/image/jpeg/be66d388e445ca1ac01549e653d88519/gr3.jpg gr3 gr3.jpg jpg 19563 266 314 IMAGE-DOWNSAMPLED 1-s2.0-S0926860X14006292-gr4.jpg https://s3.amazonaws.com/prod-ucs-content-store-us-east/content/pii:S0926860X14006292/gr4/DOWNSAMPLED/image/jpeg/4eefdf88e79d6fcdcbd20ebbfb937f3b/gr4.jpg gr4 gr4.jpg jpg 20657 266 314 IMAGE-DOWNSAMPLED 1-s2.0-S0926860X14006292-gr5.jpg https://s3.amazonaws.com/prod-ucs-content-store-us-east/content/pii:S0926860X14006292/gr5/DOWNSAMPLED/image/jpeg/bc5624a853c024a6c50dc5a2b925791a/gr5.jpg gr5 gr5.jpg jpg 23430 329 301 IMAGE-DOWNSAMPLED 1-s2.0-S0926860X14006292-gr6.jpg https://s3.amazonaws.com/prod-ucs-content-store-us-east/content/pii:S0926860X14006292/gr6/DOWNSAMPLED/image/jpeg/085754e2b34717c85b47aeeec319796b/gr6.jpg gr6 gr6.jpg jpg 23207 297 260 IMAGE-DOWNSAMPLED 1-s2.0-S0926860X14006292-gr7.jpg https://s3.amazonaws.com/prod-ucs-content-store-us-east/content/pii:S0926860X14006292/gr7/DOWNSAMPLED/image/jpeg/84ca7ff0cf79f59a29041a507ddbf722/gr7.jpg gr7 gr7.jpg jpg 29232 337 300 IMAGE-DOWNSAMPLED 1-s2.0-S0926860X14006292-gr8.jpg https://s3.amazonaws.com/prod-ucs-content-store-us-east/content/pii:S0926860X14006292/gr8/DOWNSAMPLED/image/jpeg/da888db31294c4c27d30446815825457/gr8.jpg gr8 gr8.jpg jpg 22335 358 318 IMAGE-DOWNSAMPLED 1-s2.0-S0926860X14006292-gr9.jpg https://s3.amazonaws.com/prod-ucs-content-store-us-east/content/pii:S0926860X14006292/gr9/DOWNSAMPLED/image/jpeg/75c636b4b9b06322dfd0e1a54d2f1d2e/gr9.jpg gr9 gr9.jpg jpg 24013 306 301 IMAGE-DOWNSAMPLED 1-s2.0-S0926860X14006292-fx1_lrg.jpg https://s3.amazonaws.com/prod-ucs-content-store-us-east/content/pii:S0926860X14006292/fx1/HIGHRES/image/jpeg/d78803538c78ab3bb009e6359e2c2f84/fx1_lrg.jpg fx1 true fx1_lrg.jpg jpg 93245 886 875 IMAGE-HIGH-RES 1-s2.0-S0926860X14006292-gr1_lrg.jpg https://s3.amazonaws.com/prod-ucs-content-store-us-east/content/pii:S0926860X14006292/gr1/HIGHRES/image/jpeg/db53fb7552863eb7e260a1fadfbc6a9a/gr1_lrg.jpg gr1 gr1_lrg.jpg jpg 143373 1204 1229 IMAGE-HIGH-RES 1-s2.0-S0926860X14006292-gr10_lrg.jpg https://s3.amazonaws.com/prod-ucs-content-store-us-east/content/pii:S0926860X14006292/gr10/HIGHRES/image/jpeg/b42ad0714af89d1829a32b1ba91ee18b/gr10_lrg.jpg gr10 gr10_lrg.jpg jpg 286044 1313 1477 IMAGE-HIGH-RES 1-s2.0-S0926860X14006292-gr11_lrg.jpg https://s3.amazonaws.com/prod-ucs-content-store-us-east/content/pii:S0926860X14006292/gr11/HIGHRES/image/jpeg/6fd404e2976a112bead9174472830db4/gr11_lrg.jpg gr11 gr11_lrg.jpg jpg 224011 1377 1333 IMAGE-HIGH-RES 1-s2.0-S0926860X14006292-gr12_lrg.jpg https://s3.amazonaws.com/prod-ucs-content-store-us-east/content/pii:S0926860X14006292/gr12/HIGHRES/image/jpeg/9e23283a7e4de7dbaba8610c940719f9/gr12_lrg.jpg gr12 gr12_lrg.jpg jpg 119919 1155 1122 IMAGE-HIGH-RES 1-s2.0-S0926860X14006292-gr2_lrg.jpg https://s3.amazonaws.com/prod-ucs-content-store-us-east/content/pii:S0926860X14006292/gr2/HIGHRES/image/jpeg/24c7cddb36ca1198c1eab78407bbb77b/gr2_lrg.jpg gr2 gr2_lrg.jpg jpg 164014 1281 1333 IMAGE-HIGH-RES 1-s2.0-S0926860X14006292-gr3_lrg.jpg https://s3.amazonaws.com/prod-ucs-content-store-us-east/content/pii:S0926860X14006292/gr3/HIGHRES/image/jpeg/c2106a73a3fe12dea7f178a3ff73fc5b/gr3_lrg.jpg gr3 gr3_lrg.jpg jpg 168425 1179 1390 IMAGE-HIGH-RES 1-s2.0-S0926860X14006292-gr4_lrg.jpg https://s3.amazonaws.com/prod-ucs-content-store-us-east/content/pii:S0926860X14006292/gr4/HIGHRES/image/jpeg/3ab143e910b333cb689ad9f23ddac95a/gr4_lrg.jpg gr4 gr4_lrg.jpg jpg 163560 1179 1390 IMAGE-HIGH-RES 1-s2.0-S0926860X14006292-gr5_lrg.jpg https://s3.amazonaws.com/prod-ucs-content-store-us-east/content/pii:S0926860X14006292/gr5/HIGHRES/image/jpeg/dcc0826d5caf58571795429ec2bfed00/gr5_lrg.jpg gr5 gr5_lrg.jpg jpg 165087 1457 1332 IMAGE-HIGH-RES 1-s2.0-S0926860X14006292-gr6_lrg.jpg https://s3.amazonaws.com/prod-ucs-content-store-us-east/content/pii:S0926860X14006292/gr6/HIGHRES/image/jpeg/f114629ef5ffb28ffeb3089a44780a7f/gr6_lrg.jpg gr6 gr6_lrg.jpg jpg 170351 1314 1152 IMAGE-HIGH-RES 1-s2.0-S0926860X14006292-gr7_lrg.jpg https://s3.amazonaws.com/prod-ucs-content-store-us-east/content/pii:S0926860X14006292/gr7/HIGHRES/image/jpeg/313fc65d857ace33846b180a55dfef5b/gr7_lrg.jpg gr7 gr7_lrg.jpg jpg 224785 1496 1331 IMAGE-HIGH-RES 1-s2.0-S0926860X14006292-gr8_lrg.jpg https://s3.amazonaws.com/prod-ucs-content-store-us-east/content/pii:S0926860X14006292/gr8/HIGHRES/image/jpeg/c159906bd17b20a686dc3025fa01a8e4/gr8_lrg.jpg gr8 gr8_lrg.jpg jpg 178387 1585 1409 IMAGE-HIGH-RES 1-s2.0-S0926860X14006292-gr9_lrg.jpg https://s3.amazonaws.com/prod-ucs-content-store-us-east/content/pii:S0926860X14006292/gr9/HIGHRES/image/jpeg/ea226be960ddbade1a8006a5eff02d92/gr9_lrg.jpg gr9 gr9_lrg.jpg jpg 175016 1357 1333 IMAGE-HIGH-RES APCATA 15048 S0926-860X(14)00629-2 10.1016/j.apcata.2014.10.016 Elsevier B.V. Fig. 1 Effects of catalyst preparation for various Pd–K–Co3O4 catalysts with loading amounts: Pd was 1.1wt%; K was 0.78wt%; ○, Pd/K/Co3O4; ●, K/Pd/Co3O4; ♢, physical mixture in 2-propanol of Pd/Co3O4 and K/Co3O4; ♦, physical mixture of Pd/Co3O4 and K/Co3O4; ▾, Pd/Co3O4; ▴, K/Co3O4;□, Co3O4. Fig. 2 Effect of pre-reduction for Pd/K/Co3O4: Pd, 1.1wt%; K, 0.78wt%. Fig. 3 TG profiles of various Pd/K/Co3O4 catalysts reduced by the simulated reaction gas: gray line, catalysts prepared using a physical mixture; black line, catalysts prepared using an impregnation method. Fig. 4 TG profiles for Pd/K/Co3O4 reduced using various conditions: Pd, 1.1wt%; K, 0.78wt%; gray line, catalysts reduced by CO gas; black line, catalysts reduced by H2 gas. Fig. 5 XPS K 2p spectra of Pd/K/Co3O4 and K/Co3O4: (a) K/Co3O4 (as made), (b) Pd/K/Co3O4 (as made), (c) K/Co3O4 (after reaction), (d) Pd/K/Co3O4 (after reaction), and (e) Pd/K/Co3O4 (H2 reduction). Fig. 6 XPS Pd 3d spectra of Pd/K/Co3O4 and Pd/Co3O4: (a) Pd/K/Co3O4 (as made), (b) Pd/K/Co3O4 (after reaction), (c) Pd/K/Co3O4 (H2 reduction), (d) Pd/Co3O4 (as made), (e) Pd/Co3O4 (after reaction), and (f) Pd/Co3O4 (H2 reduction). Fig. 7 XPS Co 2p spectra of Pd/K/Co3O4, Pd/Co3O4, Pd/Co3O4, and Co3O4: (a) Co3O4 (as made), (b) K/Co3O4 (as made), (c) Pd/Co3O4 (as made), (d) Pd/K/Co3O4 (as made), (e) Co3O4 (after reaction), (f) K/Co3O4 (after reaction), (g) Pd/Co3O4 (after reaction), and (h) Pd/K/Co3O4 (after reaction). Fig. 8 XANES spectra for Pd K-edge of Pd/K/Co3O4 and Pd/Co3O4: (a) Pd foil, (b) PdO, (c) 0.53wt%Pd/Co3O4, (d) 0.53wt%Pd/K/Co3O4, (e) 1.1wt%Pd/Co3O4, (f) 1.1wt%Pd/K/Co3O4, (g) 2.1wt%Pd/Co3O4, (h) 2.1wt%Pd/K/Co3O4. Fig. 9 EXAFS spectra for Pd K-edge of Pd/K/Co3O4 and Pd/Co3O4: (a) 2.1wt%Pd/K/Co3O4, (b) 2.1wt%Pd/Co3O4, (c) 1.1wt%Pd/K/Co3O4, (d) 1.1wt%Pd/Co3O4, (e) 0.53wt%Pd/K/Co3O4, (f) 0.53wt%Pd/Co3O4. Fig. 10 DRIFT spectra of flowing CO gas at 573K over Pd/K/Co3O4: dotted line, DRIFT spectra of CO adsorption at 298K over Pd/K/Co3O4. Fig. 11 DRIFT spectra of CO adsorbed at 298K over Pd/K/Co3O4, Pd/Co3O4, K/Co3O4, and Co3O4: (a) Pd/K/Co3O4, (b) K/Co3O4, (c) Pd/Co3O4, and (d) Co3O4. Fig. 12 DRIFT spectra of exposed in H2O or D2O after CO adsorption at 298K over Pd/K/Co3O4: (a) exposed in H2O and (b) exposed in D2O. Table 1 Results of CO chemisorption of various catalysts. Pd loading (wt%) Adsorption per unit (cm3 g−1) Pd dispersion (%) Pd only 0.27 0.521 91.7 0.53 0.518 46.4 1.1 0.471 20.3 2.1 0.563 12.7 Pd and K 0.27 1.241 218.3 0.53 0.983 89.2 1.1 1.468 63.4 2.1 1.462 32.9 K/Co3O4 0.065 – Co3O4 0 – Table 2 Binding energies of various catalysts. Binding energy (eV) Pd/K/Co3O4 Pd/Co3O4 K/Co3O4 Co3O4 As made af. RUN H2 red As made af. RUN H2 red As made af. RUN As made af. RUN Co 2p 3/2 779.4 781.1 780.7 780.2 781.5 779.8 779.8 780.5 780.4 780.3 – 778.3 – – 778.5 – – – – – O 1s – 531.9 531.1 – 531.9 531.0 – – – – 529.8 – – 530.2 – 529.4 529.1 529.6 530.3 529.7 Pd 3d 3/2 342.2 340.8 340.3 342.9 341.7 340.6 – – – – Pd 3d 5/2 336.7 335.7 335.0 337.5 336.1 335.3 – – – – K 2p 1/2 295.0 295.9 295.5 – – – 294.8 295.3 – – K 2p 3/2 292.4 293.2 292.8 – – – 292.1 292.7 – – C 1s 284.8 284.8 284.8 284.7 284.8 284.8 284.8 284.8 284.8 284.8 Table 3 Amount of initial products after flowing various gases containing H2 18O. The amount of the initial products (mmol) Gas composition H2 H2O H2 18O CO C18O (×104) Ar CO2 C16O18O(×103) C18O2 (×105) H2 18O 3.03 2.92 0.13 0.10 2.41 1.19 0.17 0.03 – Reaction gas containing H2 18O 4.01 1.58 0.11 0.09 2.68 0.59 0.19 1.66 6.95 Pd/K/Co-oxide catalyst for water gas shift Eugene Kono Sakurako Tamura Keisuke Yamamuro Shuhei Ogo Yasushi Sekine ⁎ Applied Chemistry, Waseda University, 3-4-1, Okubo, Shinjuku, Tokyo, Japan Applied Chemistry, Waseda University 3-4-1, Okubo, Shinjuku Tokyo Japan ⁎ Corresponding author. Tel.: +81 3 5286 3114; fax: +81 3 5286 3114. Graphical abstract Various Co3O4 catalysts were investigated for the water gas shift (WGS) reaction for hydrogen production. Although the catalyst supporting only palladium (Pd/Co3O4) showed low catalytic activity and higher selectivity to methanation, Pd/K/Co3O4 catalyst, with loading of potassium exceeding 0.78wt%, showed high catalytic activity for the WGS reaction. Catalysts on which Pd and K exist closely showed high activity, as confirmed using various preparation methods. Results of XPS measurements for Pd/K/Co3O4 revealed that supported potassium donated electrons to Pd and Co. The state of CO adsorption species was affected by the potassium loading, resulting in high catalytic activity for the Pd/K/Co3O4 catalyst. These effects gave the Pd/K/Co3O4 catalyst high catalytic activity for the WGS reaction. That reaction over Pd/K/Co3O4 proceeds via surface cobalt carbonyl and then formate intermediates, as revealed by the TG and isotope exchange measurements using H2 18O and DRIFT. Keywords Water gas shift Cobalt catalyst Potassium addition In situ IR 1 Introduction Hydrogen energy society has attracted attention in recent years. Fuel cells that can function at a low temperature like as a polymer electrolyte membrane fuel cell (PEMFC), requires high-purity hydrogen in the reformed gas because CO deactivates Pt electrodes. Therefore, the CO concentration in the reformed gas must be decreased [1–3]. Water–gas shift (WGS) (Eq. (1)) is an important reaction for obtaining hydrogen rich gas from the reformate. Additionally, this reaction is used for controlling the H2/CO ratio of synthesis gas in C1 chemistry. (1) CO+H2O ↔ CO2 +H2 ΔH 0 298.15 =− 41.2kJmol−1 This reaction is exothermic. For that reason, lower temperatures are favorable for high CO conversion because of the thermodynamic equilibrium limitation of WGS reaction. In a typical industrial process, the WGS reaction proceeds through two stages to achieve high CO conversion: a high-temperature shift (HTS) and a low-temperature shift (LTS). The first stage, using HTS catalyst like as Fe2O3–Cr2O3 catalyst, operates at 593–723K [4]. Fe2O3–Cr2O3 catalyst reduces the CO concentration in the reformate to 1–5%. The Fe2O3–Cr2O3 catalyst is inexpensive, but CO conversion is low because of the thermodynamic equilibrium caused by the higher working temperature. Thermal sintering of the iron crystallites easily deactivates Fe2O3–Cr2O3 [1]. The LTS reaction, using Cu/ZnO/Al2O3 catalyst, operates at 363–523K to reduce the CO concentration below 0.5%. Cu/ZnO/Al2O3 catalyst is deactivated easily by sintering of copper and poisoning by sulfur [1,5]. Therefore, a catalyst that can be operated through a one-step process at moderate temperatures and which has a suitable high activity is eagerly sought for use with the WGS reaction. Catalysts operated at mid-range temperatures have been investigated by many researchers. Numerous reports describe catalysts using noble metal on metal oxide for the WGS reaction [6–10]. Several are Pt, Pd, and Rh on CeO2 [8] and Au-supported metal oxide (Fe2O3, Co3O4, TiO2, ZrO2) [11]. Those reports describe that the reaction over these catalysts proceeded through a redox mechanism, in which the adsorbed CO on noble metal was oxidized to CO2 by the lattice oxygen on the support. The oxygen vacancy of the support was oxidized by H2O. The promotion effect of alkali metal or alkaline-earth metal on noble metal catalysts for the WGS reaction at middle temperature has been investigated in many studies [12–16]. Zhai et al. reported that Na impregnation on Pt–SiO2 showed higher WGS activity than non-promoted Pt-SiO2. The addition of alkali metal strengthened the interaction between Pt and the support, and suitable active sites were created [16]. Panagiotopoulou and Kondarides reported that alkali metal interacts strongly with the TiO2 surface and new active sites that consist of oxygen defect vacancy, noble metal, and support are created at the metal–support interface for the WGS reaction [14]. Our previous study revealed that Pd/K/Fe2O3 catalyst showed high activity for the WGS reaction at the moderate temperature of 573K [17]. We demonstrated that the impregnation of Pd and K enhanced the redox properties of Fe2O3 and increased the WGS activity. The addition of Pd and K promoted the reduction of the metal oxide and the re-oxidation of the lattice oxygen by H2O [18]. The Pd/K/Co3O4 catalyst showed higher activity than the Pd/K/Fe2O3 catalysts [19]. Additionally, the activities did not depend on the Pd loading weight. Catalysts that load potassium exceeding 0.78wt% have high activity for the WGS reaction. Furthermore, the addition of potassium inhibited methane formation. Pd/K/Co3O4 shows a different trend from that of Pd/K/Fe2O3. We investigated the reasons why the Pd/K/Co3O4 catalyst has high activity for the WGS reaction by catalytic activity tests and characterization including TPR, XPS, and XAFS. The reaction mechanism was ascertained using Q-Mass and DRIFTS. 2 Experimental 2.1 Catalyst preparation method The Pd/K/Co3O4 catalysts were prepared using an impregnation method. A commercial Co3O4 (Kanto Chemical Co. Inc.) was used as a catalyst support. Potassium-supported catalysts were prepared by impregnation with an aqueous solution of precursor salt, K2CO3 (Kanto Chemical Co. Inc.). The resulting slurry was dried on a hot plate under continuous stirring with subsequent calcination at 773K for 1h. Following that, Pd was impregnated on potassium-supported catalysts with an acetone solution of Pd (OCOCH3)2 (Kanto Chemical Co. Inc.). The resulting slurry was dried on a hot plate under continuous stirring with subsequent calcination at 773K for 1h. The loading amount of potassium was fixed to 0.78wt%. The loading of Pd was 0.27, 0.53, 1.1, or 2.1wt%. For the standard impregnation, potassium was impregnated first and then Pd was impregnated. For reverse impregnation, Pd was impregnated first. To investigate the structure of K and Pd as active sites, other catalysts were prepared using a physical mixture of 2.2wt%Pd/Co3O4 and 1.56wt%K/Co3O4. Each was prepared using the impregnation method, and mixed together at a 1:1 ratio using a planetary ball mill in a dry condition, or in 2-propanol solvent. 2.2 Catalytic activity tests Catalytic activity tests were performed in a fixed bed flow reactor at atmospheric pressure. A Pyrex glass tube with 8mm outer diameter and 6mm inner diameter was used as a reactor. The catalyst (250–500μm particle size) with an amount of 40 or 80mg, was charged in the reactor. Reaction conditions were the following: H2O:CO:H2:N2:Ar=30:6:42:13:9; total flow rate=178mLmin−1; W/F =1.50 or 2.99g-cathmol−1; reaction temperature at 573K. The product gas was analyzed using a GC-FID/TCD (GC-8A; Shimadzu Corp.). 2.3 Characterization of catalysts The oxidation–reduction property of catalysts during reaction was investigated using thermogravimetry (TG; TGA-50; Shimadzu Corp.). The catalyst weight loss was measured under heating to 573K, which is the reaction temperature (20Kmin−1, in Ar purge). When the temperature reached 573K, hydrogen, CO or a simulated reaction gas (H2O:CO:H2:Ar=7.2:2.4:16.8:73.6; total flow rate=100mLmin−1) was supplied. The catalyst weight was 20mg for each case. Metal dispersions of Pd were measured using CO chemisorption (BEL-CAT-55; BEL Japan Inc.). The stoichiometric factor of CO/Pd was assumed as 1.0 for the calculation of metal dispersion. All catalysts were reduced in hydrogen at 473K for 30min and cooled to 323K in He flow. Then, 10% CO/He was dosed 20 times in He flow. X-ray photoelectron spectroscopy (XPS) measurements were conducted using a PHI-5000 VersaProbe II (ULVAC-Phi Inc.), with 25W Al Kα emission as the X-ray source, to measure each electron state on the catalyst surface. After reaction, the catalysts were treated in the reaction condition for 185min and cooled to room temperature in Ar purge. After reaction, the samples were carried by a transfer-vessel filled with N2 to avoid air exposure. Binding energies were calibrated with a C 1s peak at 284.8eV. To observe the fine structures of Pd, K, and Co, the X-ray absorption fine structure (XAFS) measurement was conducted at the BL14B2 station at SPring-8 (Hyogo, Japan). Each edge was measured using a transmission method. The catalyst was pressed into a pellet (7mmϕ). Pellets used for measuring Co K-edge were diluted with BN, treated in the reaction condition (H2O:CO:H2:N2:Ar=30:6:42:13:9) for 65min and cooled to room temperature in Ar purge. Then, the pellet was packed into a gas-barrier bag in N2 atmosphere. XAFS data were analyzed using software (REX2000; Rigaku Corp.). Fourier transformation of k 3-weighted EXAFS spectra was obtained in the k-range of 0.3–1.2nm. 2.4 Transient response experiment Transient response experiments were conducted using a quadrupole mass spectroscopy (Q-Mass; QGA; Hiden Analytical Ltd.). The gas compositions were the following: reaction gas, H2O:CO:H2:He:Ar=16.7:3.3:23.3:48.9:7.8, total flow rate of 300mLmin−1; purge gas, He:Ar=276.6:23.3, total flow rate of 300mLmin−1. Isotope exchange reaction experiments were conducted to determine the contribution of lattice oxygen to the WGS reaction. After heating of the catalyst to 573K (5Kmin−1) in He purge, the reaction gas was supplied at 573K for 1h. Then, 30% H2 18O (purity 98%; Taiyo Nippon Sanso Corp.) was supplied for 10min to exchange the lattice oxygen in/on the catalyst. The reaction gas was supplied again to detect the product gas. To observe the lattice oxygen behavior during reaction, the reaction gas containing H2 18O (H2 16O:H2 18O:CO:H2:He:Ar=11.2:5.5:3.3:23.3:48.9:7.8, total flow rate of 300mLmin−1) was supplied at 573K for 1h. The product gas was detected using a Q-Mass. Nine parent peaks were scanned using a mass spectrometer: m/e =2 (H2), 15 (CH4), 18 (H2O), 20 (H2 18O), 28 (C16O), 30 (C18O), 44 (C16O2), 46 (C16O18O), and 48 (C18O2). 2.5 DRIFT measurements Adsorption species and reaction intermediates were investigated using diffuse reflectance infrared Fourier transform spectroscopy (DRIFT; FT/IR-4200; Jasco Corp.). The experiment conditions were 600–4000cm−1 measurement range, 1cm−1 measurement interval, 4cm−1 limit of resolution, and 64 times cumulated numbers. A peak that appeared from 3500–4000cm−1 was attributed to H2O. This peak was corrected with a background peak that was measured before CO intake. The total gas flow was 100mLmin−1. All catalysts were pre-reduced. The catalysts were heated to 673K for 1h in Ar purge, and were reduced by 10% H2 for 30min at 473K. The spectrum for CO adsorption was measured to observe on the surface adsorbed species of the catalyst. After the catalyst was reduced, 3% CO gas was supplied at 298K. Then the spectrum was measured. The spectrum was measured until no spectrum change was observed. To identify the peaks in each spectrum, H–D exchange measurements were conducted. After the catalyst was reduced and cooled to 298K, the spectrum was measured under 3% CO gas flow for 30min. Then, 4% H2O or D2O was supplied for 30min at 573K and cooled to 298K to observe the spectrum. 3 Results and discussion 3.1 Relation to catalytic activity, preparation method and reducibility of cobalt oxide over Pd/K/Co3O4 catalysts We demonstrated earlier that Pd/K/Co3O4 on which K loading had exceeded 0.78wt% showed high catalytic activity for the WGS reaction and that the activity was independent of the Pd loading amount [19]. Based on that report, the influence of the preparation methods was investigated to ascertain the role of supported Pd and K. Fig. 1 presents results of activity tests over Pd/K/Co3O4 (Pd: 1.1wt%, K: 0.78wt%) prepared using various methods including different impregnation orders and physical mixture methods. We prepared Pd/K/Co3O4 using normal order impregnation, K/Pd/Co3O4 by reverse order impregnation, Pd/Co3O4 +K/Co3O4 by physical mixture (dry process) and physical mixture (wet process). The catalyst weight was 40mg for each catalyst to avoid reaching the thermodynamic equilibrium. In Fig. 1, results show that the steady state activities on Pd/K/Co3O4 and K/Pd/Co3O4 are higher than those of other catalysts. The physical mixture catalysts (Pd/Co3O4 +K/Co3O4) showed moderate activity. These four catalysts (Pd/K/Co3O4, K/Pd/Co3O4, two catalysts by physical mixture of Pd/Co3O4 and K/Co3O4) showed >99% CO2 selectivity, and methanation occurred only slightly. The initial activity of the catalyst by the physical mixture method was lower than that of the catalyst by the impregnation method because the supported Pd and K are more isolated over the catalyst prepared using the physical mixture method. Pd/Co3O4, K/Co3O4, and bare Co3O4 showed little or no catalytic activity for WGS. These data show that close contact between Pd, K, and Co is extremely important. Although the Pd/K/Co3O4 showed high initial activity, the activity decreased over the course of time. Carbon deposition was negligibly small and did not influence the catalytic activity for the WGS reaction. The difference in activities at 5 and 185min of the reaction suggests that the structure and/or state of Pd, K, and Co before and after the reaction changed in the reducing atmosphere (i.e. reaction gas includes CO). Therefore, the activity tests of pre-reduced Pd/K/Co3O4 by H2 or CO before the reaction were performed to observe the relation to the reduction property of support and the catalytic activity. Fig. 2 portrays the results of activity tests over pre-reduced Pd/K/Co3O4 (Pd: 1.1wt%, K: 0.78wt%) catalysts. Various pre-reduction conditions were investigated: 10% H2 at 573K for 30min, 10% H2 at 473K for 30min, 10% H2 at 473K for 10min, and 10% CO at 573K for 200min. The catalyst weight was 80mg for each catalyst. In Fig. 2, the catalyst which was reduced strongly by 10% H2 for 30min at 573K showed the lowest activity. Results suggest that the activity of the catalyst which was reduced strongly was low because the catalyst support was reduced completely to form Co metal. CO conversion at 185min of the catalyst was reduced slightly by about 10% H2 at 473K for 30min, which was low compared to the catalyst without pre-reduction. On the other hand, the catalyst after reduction by CO gas showed higher activity at 5min compared to the catalytic activity without reduction, and showed >99% CO2 selectivity. The reduction behavior of the catalyst was investigated using isothermal-TG (thermogravimetry) analyses at 573K, the same as the reaction temperature, by supplying a simulated reaction gas to observe the reduction behavior of the support (Co3O4). Fig. 3 shows isothermal-TG profiles in the simulated reaction gas at 573K over Co3O4, K/Co3O4, Pd/Co3O4 and Pd/K/Co3O4 (Pd: 1.1wt%, K: 0.78wt%). If the entire weight loss is attributable to the reduction of lattice oxygen in Co3O4, then the weight loss of −6.6wt% is attributable to the reduction of Co3O4 to CoO, and −26.6wt% is the reduction to Co metal. Although Co3O4 and K/Co3O4 on which Pd was not supported, were reduced to CoO, Pd/Co3O4 and Pd/K/Co3O4 were reduced to Co metal. Diehl and Khodakov have shown from TPR results that most noble metals can enhance the reduction of cobalt oxides [20]. Therefore, the reduction of cobalt oxide was promoted by the presence of Pd in this case as well. As a result of comparing the weight losses of Pd/K/Co3O4 catalysts prepared by the impregnation method and by the physical mixture method for 0–60min, Pd/K/Co3O4 catalysts prepared using the impregnation method were more reducible than Pd/K/Co3O4 catalysts prepared using the physical mixture method. According to the result, the mutual proximity between Pd and K was important for the reducibility of cobalt oxide. Next we conducted isothermal-TG analyses in an H2 or CO atmosphere. Fig. 4 presents results of TG profiles over Pd/K/Co3O4 catalyst (Pd: 1.1wt%, K: 0.78wt%) during reduction by H2 or CO under the constant temperature condition (i.e. 573K, the same temperature as the reaction). In Fig. 4, the catalyst reduced by H2 showed a decrease in weight to −26.6wt%. Therefore, the support was reduced to Co metal by H2 reduction. However, the catalyst reduced by CO showed decreased weight to −14wt%. This reduction might result from the adsorption of CO on the catalyst surface. To measure the amount of CO adsorption and metal dispersion of Pd, CO chemisorption was investigated. Table 1 presents results of CO chemisorption. Measurements were investigated after reduction by 30mLmin−1 H2 at 473K for 30min of pre-reduction because the reaction condition was a reducing atmosphere. In Table 1, the CO adsorption amounts are shown to be independent of the Pd loading weight. Assuming the stoichiometric factor of CO/Pd as 1.0 for the calculation of metal dispersion and CO adsorbed only on Pd, the Pd dispersion of 0.27wt%Pd/K/Co3O4 exceeded 100% dispersion, as shown in Table 1. This result indicates that CO adsorbed not only Pd but also Co support. However, CO could not be adsorbed onto Co3O4 and K/Co3O4. These results suggest that Pd over Pd/K/Co3O4 had some influence on the state of cobalt oxide. The amount of CO adsorption over Pd/K/Co3O4 catalysts increased compared to Pd/Co3O4. Therefore, it is estimated that CO adsorbed even onto Co because the electron state of Co was changed by the addition of potassium. From these three experiments, i.e. catalytic activities after the reduction by CO, isothermal-TG profile in CO atmosphere, and CO-adsorption; we assume the reason why the catalyst pre-reduced by CO showed high WGS activity, because CO reduced the catalyst surface, adsorbed onto the catalytic surface, and the adsorbed CO produced active intermediates on the catalyst. This phenomenon was confirmed by results of DRIFT measurements presented in Section 3.3. 3.2 Characterization of catalysts To clarify the effect of the electronic state of the catalyst surface on the activity and formation of adsorption intermediate, XPS measurements were conducted. Table 2 shows the binding energies of respective peaks for Pd/K/Co3O4, Pd/Co3O4, K/Co3O4, and Co3O4 (Pd: 1.1wt%, K: 0.78wt%). Fig. 5 shows the K 2p spectra of respective catalysts. The peak around 292.5–292.8eV is attributable to K 2p3/2. The peak around 292.5eV is attributable to K 2p1/2 [21,22]. In Fig. 5, the K 2p3/2 peaks on Pd/K/Co3O4 shifted to higher binding energy during the reaction, perhaps because of the decreasing electron density of the potassium site. Asano et al. reported that the K 2p3/2 peak shifted slightly toward the high binding energy side with increasing potassium loading, and reported that the electronic state of potassium changed on K/Co3O4 [23]. Fig. 6 shows Pd 3d spectra of respective catalysts. The peak at 335.5eV is attributed to Pd metal. The peak at 336.8eV is attributable to PdO [24]. The Pd 3d5/2 peak on Pd/K/Co3O4 catalysts shifted to lower binding energy compared to that of Pd/Co3O4 catalysts, irrespective of whether they were measured before and after the reaction. Previously, Pekiridis et al. reported that the Pd 3d5/2 peak shifted to lower binding energies along with increasing K loading because the enhanced electron density of Pd sites for potassium promoted Pd/Al2O3 [25]. In our case, the higher electron density on Pd over Pd/K/Co3O4 catalyst was observed because of the electric donation from potassium to Pd. In addition, because the peak shift of Pd/K/Co3O4 catalyst appeared before reaction, the electric donation by potassium to Pd was known to have occurred during calcination. The 3d5/2 peak over Pd/K/Co3O4 after reaction showed 0.7–0.8eV higher binding energy than that of Pd metal. The XPS spectra of Pd–Co alloy were reported previously. The Pd 3d5/2 peak of Pd–Co alloy shifted to 0.4–0.6eV higher binding energy compared to that of Pd metal [26–28]. Therefore, Pd and Co became alloyed during the reaction, whether potassium was present or not, because both Pd/K/Co3O4 and Pd/Co3O4 shifted to higher binding energy compared to Pd metal. Fig. 7 presents Co 2p spectra of respective catalysts. The peak at 774–784eV is attributable to Co 2p3/2. The Co 2p3/2 peak at 777.5–780eV is attributable to Co0, and the peak at 780.3–781.8eV is attributable to CoO [29,30]. In Fig. 7, the Co 2p3/2 peak of K/Co3O4 and Pd/K/Co3O4 before the reaction shifted to lower binding energy than that of Co3O4 before the reaction. In addition, the Co 2p3/2 peak of Pd/K/Co3O4 after the reaction shifted to lower binding energy than that of Pd/Co3O4 after the reaction. According to these results, the addition of potassium increased the electron density of Co and cobalt accepted electrons from potassium whether Pd was present or not. For Co3O4 with loading of a small amount of potassium, the Co 2p3/2 peak shifted similarly to the lower binding energy side because of the changing electronic state of cobalt [23]. Consequently, these XPS results suggest that potassium donated electrons to Pd and Co, and suggest that Pd and Co became alloyed during the reaction. To clarify the fine structure of Pd, XAFS measurements were investigated. Fig. 8 shows XANES spectra of Pd K-edge. Fig. 9 shows EXAFS spectra of Pd and Co K-edge. PdO, Pd foil, and Co foil were used as reference samples. Pd/K/Co3O4 and Pd/Co3O4 after reaction, with various Pd loading weights, were measured. In Fig. 8, the XANES spectra of Pd/K/Co3O4 catalyst or Pd/Co3O4 catalyst did not match the spectra of reference samples. This result shows that the fine structure of Pd over Pd/K/Co3O4 catalysts was neither PdO nor Pd metal. In Fig. 9, the EXAFS spectra of Pd/K/Co3O4 for Pd K-edge resembled the spectra of Co foil for Co K-edge. Formation of Pd–Co alloy was confirmed from this result, which is consistent with previous results obtained by several authors [31–33]. In their report, they have claimed that K-edge spectra of platinum group elements such as Pd, Ru, shifts towards a shorter atomic length due to the formation of a Co alloy. In our case, the loading amount of Pd is very little compared to the Co3O4 support; hence the Pd K-edge peak shifts nearly close to the peak of Co foil. 3.3 Reaction mechanism over Pd/K/Co3O4 As reaction mechanisms for the WGS reaction, two options are proposed: a redox mechanism and Langmuir–Hinshelwood mechanism. The reaction for the redox mechanism includes CO oxidation to CO2 by the lattice oxygen and lattice oxygen regeneration by H2O. The Langmuir–Hinshelwood mechanism proceeds via surface intermediates such as formate produced by adsorbed CO and H2O on the catalyst surface [1]. We investigated which reaction mechanism proceeds over Pd/K/Co3O4 by steady state isotope kinetic analysis using H2 18O and Q-Mass, and DRIFT measurements. To observe the lattice oxygen behavior during reaction over Pd/K/Co3O4 catalyst, isotope transient experiments over Pd/K/Co3O4 catalyst (Pd, 1.1wt%; K, 0.78wt%) were conducted using H2 18O and Q-Mass. Table 3 shows the results. After the reaction gas was supplied for an hour, H2 18O gas or the reaction gas containing H2 18O was supplied. Then, the reaction gas was flowed and the signal was observed by Q-Mass. Table 3 shows the total amounts of the first 10 signal products after switching the reaction gas after isotope exchange. If the reaction proceeds via the redox mechanism, then the lattice oxygen, which is replaced by isotope 18O, can react with the supplied gas, thereby producing C16O18O and C18O2. In Table 3, the amounts of C16O18O and C18O2 produced after isotope exchange were very small compared to the C16O2 produced after isotope exchange. Therefore, the lattice oxygen did not play an important role during the WGS reaction over Pd/K/Co3O4 catalyst. The reaction over Pd/K/Co3O4 proceeds not via the redox mechanism but via the Langmuir–Hinshelwood mechanism. DRIFT measurements were investigated to ascertain the adsorbed species in detail. First, DRIFT spectra were observed by supplying 10%CO gas at 573K after measuring the background at 298K to reveal the reason why Pd/K/Co3O4 catalyst that had been pre-reduced by CO showed high catalytic activity even at the initial stage of WGS. Fig. 10 presents spectra during CO supplying over Pd/K/Co3O4 catalyst (Pd: 1.1wt%, K: 0.78wt%) over the course of time. In Fig. 10, the spectrum around 1800cm−1, which was not observed on the pre-reduced catalyst by H2 (as shown later in Fig. 11 ), was observed over the pre-reduced catalyst by CO. The peak at 1800cm−1 is attributable to cobalt carbonyl, which includes 2–4 molecules of CO per adsorption site of Co [34–36]. The peak intensity then increased over the course of time, which means the increase of the amount of adsorbed CO. Results suggest that CO adsorbed over metallic Co on the catalyst surface after pre-reduction, and that cobalt metal and CO produced the carbonyl intermediate. We presume that the initial high activity of pre-reduced catalyst by CO derived from the formation of cobalt carbonyl intermediate produced on the catalyst surface. Fig. 11 shows DRIFT spectra for CO adsorption over various catalysts; Pd/K/Co3O4, Pd/Co3O4, K/Co3O4, Co3O4 (Pd: 1.1wt%, K: 0.78wt%). DRIFT measurements were conducted after reduction because the reaction gas was a reducing atmosphere. In Fig. 11, CO adsorption species around 2000–2200cm−1 were gas-phase CO. The peak at 1985cm−1 was observed for the spectra on Pd/Co3O4, which showed low catalytic activity, but the peak was not observed for that on Pd/K/Co3O4, which showed high catalytic activity. This peak at 1985cm−1 is attributable to linear CO adsorption on Pd0 [37,38]. Therefore, it is estimated that CO was adsorbed onto Pd metal over Pd/Co3O4, but no adsorption on Pd0 as the linear form CO was observed over Pd/K/Co3O4. The linear form CO on Pd might have low activity because Pd/Co3O4 showed low catalytic activity. Over K/Co3O4, the peaks derived from carbonate species were observed at around 1300 and 1700cm−1 [12,38–41]. The peak at around 1500cm−1 was not observed over K/Co3O4, and the peak at 1561cm−1 observed on K/Co3O4 was derived from v(C=O) of bidentate carbonate [39]. Over Co3O4, a slight peak was observed at 1207cm−1, which derives from CO adsorbed on Co3O4 as carbonate species. The adsorbed site is most likely Co. The peak at 1236cm−1 observed on Pd/Co3O4 is attributed to v(OCO) of carbonate species. It is estimated that the adsorbed carbonate species on K/Co3O4 and Co3O4 has difficulty reacting with H2O because K/Co3O4 and Co3O4 showed no WGS activity. The carbonate species observed at 1236cm−1 over Pd/Co3O4, which showed low catalytic activity, also has low reactivity. Based on these results, the addition of potassium was inferred to promote the formation of carbonyl intermediate, and immediately converted to formate species. DRIFT measurements were taken with H2O or D2O after CO flow over Pd/K/Co3O4 catalyst (Pd: 1.1wt%, K: 0.78wt%). Fig. 12 portrays results for the H–D exchange spectra. It was confirmed that the reaction proceeds via a Langmuir–Hinshelwood mechanism through formate, which contains H. The reaction for redox mechanism does not proceed through formate. In Fig. 12, compared to each spectrum after exposing H2O, each spectrum of adsorption species after exposing D2O was shifted to a lower wave number, from 1663 to 1650cm−1, from 1540 to 1519cm−1, and from 1337 to 1309cm−1. From these results, these spectra were attributable to adsorbed species including H. Then, the peak at 1663cm−1 was attributed to the absorbed H2O [38], the peak at 1540cm−1 was attributed to v as(OCO) of bidentate formate, and the peak at 1337cm−1 was attributed to v s(OCO) of bidentate formate [39,42]. Therefore, the reaction over Pd/K/Co3O4 catalyst proceeded through cobalt–carbonyl by CO adsorption, then it was converted to formate species immediately by the Langmuir–Hinshelwood mechanism. 4 Conclusion We investigated the effects of Pd and K addition and the reaction mechanism over Pd/K/Co3O4 catalyst for the WGS reaction. It is important for a catalyst showing high catalytic activity that Pd and K exist nearby because Pd/K/Co3O4 catalysts prepared using impregnation showed higher initial catalytic activity than the catalysts prepared by physical mixture. TG measurements under the simulated reaction condition revealed that the structure of the support during the reaction was reduced to Co metal and that the reducibility of the support was promoted by the addition of Pd. EXAFS analyses showed the formation of Pd–Co alloy on Pd/K/Co3O4, and supported potassium donated electrons to Pd–Co alloy which enhanced the electron density of Pd and Co. The CO adsorption state over Pd and Co was changed by electron donation from K, and carbonyl and formate intermediate was observed on Pd/K/Co3O4 catalyst by in situ DRIFT. Pre-reduced Pd/K/Co3O4 catalyst by CO showed high catalytic activity for the WGS reaction by virtue of the formation of cobalt carbonyl and then formate intermediate. The intermediate plays an important role in the high catalytic activity on Pd/K/Co3O4 catalyst for the WGS reaction. References [1] C. Ratnasamy J.P. Wagner Catal. Rev. 51 2009 325 440 [2] D. Mendes A. Mendes L.M. Madeira A. Iulianelli J.M. Sousa A. Basile Asia-Pac. J. Chem. Eng. 5 2009 111 137 [3] J.R. Ladebeck J.P. Wagner Handbook Fuel Cells—Fundamentals, Technol. Appl. 2010 1 12 [4] D.S. Newsome P. Kellogg Catal. Rev. Sci. Eng. 21 1980 275 318 [5] M.V. Twigg M.S. Spencer Appl. Catal. A: Gen. 212 2001 161 174 [6] M. Haruta S. Tsubota T. Kobayashi H. Kageyama M.J. Genet B. Delmon J. Catal. 144 1993 175 192 [7] D. Andreeva V. Idakiev T. Tabakova A. Andreev R. Giovanoli Appl. Catal. A: Gen. 134 1996 275 283 [8] A. Basinska F. Domka Appl. Catal. A: Gen. 179 1999 241 246 [9] T. Bunluesin R.J. Gorte G.W. Graham Appl. Catal. B: Environ. 15 1998 107 114 [10] A. Luengnaruemitchai S. Osuwan E. Gulari Catal. Commun. 4 2003 215 221 [11] D. Andreeva Gold Bull. 35 2002 82 88 [12] J.M. Pigos C.J. Brooks G. Jacobs H. Davis Appl. Catal. A: Gen. 328 2007 14 26 [13] H.N. Evin G. Jacobs J. Ruiz-Martinez U.M. Graham A. Dozier G. Thomas B.H. Davis Catal. Lett. 122 2008 9 19 [14] P. Panagiotopoulou D.I. Kondarides J. Catal. 267 2009 57 66 [15] X. Zhu T. Hoang L.L. Lobban R.G. Mallinson Catal. Lett. 129 2009 135 141 [16] Y. Zhai D. Pierre R. Si A. Deng P. Ferrin A.U. Nilekar G. Peng J.A. Herron D.C. Bell H. Saltsburg M. Mavrikakis M. Flytzani-Stephanopopoulos Science 329 2010 1633 1636 [17] Y. Sekine T. Chihara R. Watanabe Y. Sakamoto M. Matsukata E. Kikuchi Catal. Lett. 140 2010 184 188 [18] R. Watanabe Y. Sakamoto K. Yamamuro S. Tamura E. Kikuchi Y. Sekine Appl. Catal. A: Gen. 457 2013 1 11 [19] K. Yamamuro S. Tamura R. Watanabe Y. Sekine Catal. Lett. 143 2013 339 344 [20] F. Diehl A.Y. Khodakov Oil Gas Sci. Technol. 64 2009 11 24 [21] A. Caballero J.P. Espinós A. Fernández L. Soriano A.R. González-Elipe Surf. Sci. 364 1996 253 265 [22] A. Miyakoshi A. Ueno M. Ichikawa Appl. Catal. A: Gen. 219 2001 249 258 [23] K. Asano C. Ohnishi S. Iwamoto Y. Shioya M. Inoue Appl. Catal. B: Environ. 78 2008 242 249 [24] M. Brun A. Berthet J.C. Bertolini J. Electron. Spectrosc. Relat. Phenom. 104 1999 55 60 [25] G. Pekiridis K. Kaklidis M. Konsolakis E.F. Iliopoulou I.V. Yentekakis G.E. Marnellos Top. Catal. 54 2011 1135 1142 [26] A.F. Carlsson M. Naschitzki M. Bäumer H.-J. Freund J. Phys. Chem. B 107 2003 778 785 [27] M. Krawczyk J.W. Sobczak Appl. Surf. Sci. 235 2004 49 52 [28] L. Zhang K. Lee J. Zhang Electrochim. Acta 52 2007 3088 3094 [29] A.A. Khassin T.M. Yurieva V.V. Kaichev V.I. Bukhtiyarov A.A. Budneva E.A. Paukshtis V.N. Parmon J. Mol. Catal. A: Chem. 175 2001 189 204 [30] S.C. Petitto E.M. Marsh G.A. Carson M.A. Langell J. Mol. Catal. A: Chem. 281 2008 49 58 [31] W. Ma G. Jacobs Y. Ji T. Bhatelia D.B. Bukur S. Khalid B.H. Davis Top. Catal. 54 2011 757 767 [32] B. Mierzwa Z. Kaszkur B. Moraweck J. Pielaszek J. Alloys Compd. 286 1999 93 97 [33] H. Wang W. Zhou J-X. Liu R. Si G. Sun M-Q. Zhong H-Y. Su H-B. Zhao J.A. Rodriguez S.J. Pennycook J-C. Idrobo W-X. Li Y. Kou D. Ma J. Am. Chem. Soc. 135 2013 4149 4158 [34] R.L. Schneider R.F. Howe K.L. Watters Inorg. Chem. 23 1984 4593 4599 [35] S. Suvanto T.A. Pakkanen J. Mol. Catal. A: Chem. 125 1997 91 96 [36] F. Morales E. Smit F.M.F. Groot T. Visser B.M. Weckhuysen J. Catal. 246 2007 91 99 [37] H. Zhu Z. Qin W. Shan W. Shen J. Wang J. Catal. 233 2005 41 50 [38] G.G. Olympiou C.M. Kalamaras C.D. Zeinalipour-Yazdi A.M. Efstathiou Catal. Today 127 2007 304 318 [39] T. Shido Y. Iwasawa J. Catal. 141 1993 71 81 [40] D.I. Kondarides T. Chafik X.E. Verykios J. Catal. 191 2000 147 164 [41] R. Xu H.C. Zeng J. Phys. Chem. B 107 2003 12643 12649 [42] G. Jacobs L. Williams U. Graham G.A. Thomas D.E. Sparks B.H. Davis Appl. Catal. A: Gen. 252 2003 107 118",
      "scopus-id": "84912558017",
      "coredata": {
        "eid": "1-s2.0-S0926860X14006292",
        "dc:description": "Various Co3O4 catalysts were investigated for the water gas shift (WGS) reaction for hydrogen production. Although the catalyst supporting only palladium (Pd/Co3O4) showed low catalytic activity and higher selectivity to methanation, Pd/K/Co3O4 catalyst, with loading of potassium exceeding 0.78wt%, showed high catalytic activity for the WGS reaction. Catalysts on which Pd and K exist closely showed high activity, as confirmed using various preparation methods. Results of XPS measurements for Pd/K/Co3O4 revealed that supported potassium donated electrons to Pd and Co. The state of CO adsorption species was affected by the potassium loading, resulting in high catalytic activity for the Pd/K/Co3O4 catalyst. These effects gave the Pd/K/Co3O4 catalyst high catalytic activity for the WGS reaction. That reaction over Pd/K/Co3O4 proceeds via surface cobalt carbonyl and then formate intermediates, as revealed by the TG and isotope exchange measurements using H2 18O and DRIFT.",
        "openArchiveArticle": "false",
        "prism:coverDate": "2015-01-31",
        "openaccessUserLicense": null,
        "prism:aggregationType": "Journal",
        "prism:url": "https://api.elsevier.com/content/article/pii/S0926860X14006292",
        "dc:creator": [
          {
            "@_fa": "true",
            "$": "Kono, Eugene"
          },
          {
            "@_fa": "true",
            "$": "Tamura, Sakurako"
          },
          {
            "@_fa": "true",
            "$": "Yamamuro, Keisuke"
          },
          {
            "@_fa": "true",
            "$": "Ogo, Shuhei"
          },
          {
            "@_fa": "true",
            "$": "Sekine, Yasushi"
          }
        ],
        "link": [
          {
            "@_fa": "true",
            "@rel": "self",
            "@href": "https://api.elsevier.com/content/article/pii/S0926860X14006292"
          },
          {
            "@_fa": "true",
            "@rel": "scidir",
            "@href": "https://www.sciencedirect.com/science/article/pii/S0926860X14006292"
          }
        ],
        "dc:format": "application/json",
        "openaccessType": null,
        "pii": "S0926-860X(14)00629-2",
        "prism:volume": "489",
        "prism:publisher": "Elsevier B.V.",
        "dc:title": "Pd/K/Co-oxide catalyst for water gas shift",
        "prism:copyright": "Copyright © 2014 Elsevier B.V. All rights reserved.",
        "openaccess": "0",
        "prism:issn": "0926860X",
        "dcterms:subject": [
          {
            "@_fa": "true",
            "$": "Water gas shift"
          },
          {
            "@_fa": "true",
            "$": "Cobalt catalyst"
          },
          {
            "@_fa": "true",
            "$": "Potassium addition"
          },
          {
            "@_fa": "true",
            "$": "In situ IR"
          }
        ],
        "openaccessArticle": "false",
        "prism:publicationName": "Applied Catalysis A: General",
        "openaccessSponsorType": null,
        "prism:pageRange": "247-254",
        "prism:endingPage": "254",
        "pubType": "fla",
        "prism:coverDisplayDate": "January 2015",
        "prism:doi": "10.1016/j.apcata.2014.10.016",
        "prism:startingPage": "247",
        "dc:identifier": "doi:10.1016/j.apcata.2014.10.016",
        "openaccessSponsorName": null
      },
      "objects": {
        "object": [
          {
            "@category": "thumbnail",
            "@height": "164",
            "@width": "162",
            "@_fa": "true",
            "$": "https://api.elsevier.com/content/object/eid/1-s2.0-S0926860X14006292-fx1.sml?httpAccept=%2A%2F%2A",
            "@multimediatype": "GIF image file",
            "@type": "IMAGE-THUMBNAIL",
            "@size": "6817",
            "@ref": "fx1",
            "@mimetype": "image/gif"
          },
          {
            "@category": "thumbnail",
            "@height": "164",
            "@width": "167",
            "@_fa": "true",
            "$": "https://api.elsevier.com/content/object/eid/1-s2.0-S0926860X14006292-gr1.sml?httpAccept=%2A%2F%2A",
            "@multimediatype": "GIF image file",
            "@type": "IMAGE-THUMBNAIL",
            "@size": "5383",
            "@ref": "gr1",
            "@mimetype": "image/gif"
          },
          {
            "@category": "thumbnail",
            "@height": "164",
            "@width": "184",
            "@_fa": "true",
            "$": "https://api.elsevier.com/content/object/eid/1-s2.0-S0926860X14006292-gr10.sml?httpAccept=%2A%2F%2A",
            "@multimediatype": "GIF image file",
            "@type": "IMAGE-THUMBNAIL",
            "@size": "9154",
            "@ref": "gr10",
            "@mimetype": "image/gif"
          },
          {
            "@category": "thumbnail",
            "@height": "164",
            "@width": "159",
            "@_fa": "true",
            "$": "https://api.elsevier.com/content/object/eid/1-s2.0-S0926860X14006292-gr11.sml?httpAccept=%2A%2F%2A",
            "@multimediatype": "GIF image file",
            "@type": "IMAGE-THUMBNAIL",
            "@size": "7694",
            "@ref": "gr11",
            "@mimetype": "image/gif"
          },
          {
            "@category": "thumbnail",
            "@height": "164",
            "@width": "159",
            "@_fa": "true",
            "$": "https://api.elsevier.com/content/object/eid/1-s2.0-S0926860X14006292-gr12.sml?httpAccept=%2A%2F%2A",
            "@multimediatype": "GIF image file",
            "@type": "IMAGE-THUMBNAIL",
            "@size": "5097",
            "@ref": "gr12",
            "@mimetype": "image/gif"
          },
          {
            "@category": "thumbnail",
            "@height": "163",
            "@width": "170",
            "@_fa": "true",
            "$": "https://api.elsevier.com/content/object/eid/1-s2.0-S0926860X14006292-gr2.sml?httpAccept=%2A%2F%2A",
            "@multimediatype": "GIF image file",
            "@type": "IMAGE-THUMBNAIL",
            "@size": "5166",
            "@ref": "gr2",
            "@mimetype": "image/gif"
          },
          {
            "@category": "thumbnail",
            "@height": "164",
            "@width": "193",
            "@_fa": "true",
            "$": "https://api.elsevier.com/content/object/eid/1-s2.0-S0926860X14006292-gr3.sml?httpAccept=%2A%2F%2A",
            "@multimediatype": "GIF image file",
            "@type": "IMAGE-THUMBNAIL",
            "@size": "6770",
            "@ref": "gr3",
            "@mimetype": "image/gif"
          },
          {
            "@category": "thumbnail",
            "@height": "164",
            "@width": "193",
            "@_fa": "true",
            "$": "https://api.elsevier.com/content/object/eid/1-s2.0-S0926860X14006292-gr4.sml?httpAccept=%2A%2F%2A",
            "@multimediatype": "GIF image file",
            "@type": "IMAGE-THUMBNAIL",
            "@size": "6430",
            "@ref": "gr4",
            "@mimetype": "image/gif"
          },
          {
            "@category": "thumbnail",
            "@height": "164",
            "@width": "150",
            "@_fa": "true",
            "$": "https://api.elsevier.com/content/object/eid/1-s2.0-S0926860X14006292-gr5.sml?httpAccept=%2A%2F%2A",
            "@multimediatype": "GIF image file",
            "@type": "IMAGE-THUMBNAIL",
            "@size": "5281",
            "@ref": "gr5",
            "@mimetype": "image/gif"
          },
          {
            "@category": "thumbnail",
            "@height": "164",
            "@width": "144",
            "@_fa": "true",
            "$": "https://api.elsevier.com/content/object/eid/1-s2.0-S0926860X14006292-gr6.sml?httpAccept=%2A%2F%2A",
            "@multimediatype": "GIF image file",
            "@type": "IMAGE-THUMBNAIL",
            "@size": "5525",
            "@ref": "gr6",
            "@mimetype": "image/gif"
          },
          {
            "@category": "thumbnail",
            "@height": "164",
            "@width": "146",
            "@_fa": "true",
            "$": "https://api.elsevier.com/content/object/eid/1-s2.0-S0926860X14006292-gr7.sml?httpAccept=%2A%2F%2A",
            "@multimediatype": "GIF image file",
            "@type": "IMAGE-THUMBNAIL",
            "@size": "6490",
            "@ref": "gr7",
            "@mimetype": "image/gif"
          },
          {
            "@category": "thumbnail",
            "@height": "164",
            "@width": "146",
            "@_fa": "true",
            "$": "https://api.elsevier.com/content/object/eid/1-s2.0-S0926860X14006292-gr8.sml?httpAccept=%2A%2F%2A",
            "@multimediatype": "GIF image file",
            "@type": "IMAGE-THUMBNAIL",
            "@size": "3841",
            "@ref": "gr8",
            "@mimetype": "image/gif"
          },
          {
            "@category": "thumbnail",
            "@height": "164",
            "@width": "161",
            "@_fa": "true",
            "$": "https://api.elsevier.com/content/object/eid/1-s2.0-S0926860X14006292-gr9.sml?httpAccept=%2A%2F%2A",
            "@multimediatype": "GIF image file",
            "@type": "IMAGE-THUMBNAIL",
            "@size": "5783",
            "@ref": "gr9",
            "@mimetype": "image/gif"
          },
          {
            "@category": "standard",
            "@height": "199",
            "@width": "197",
            "@_fa": "true",
            "$": "https://api.elsevier.com/content/object/eid/1-s2.0-S0926860X14006292-fx1.jpg?httpAccept=%2A%2F%2A",
            "@multimediatype": "JPEG image file",
            "@type": "IMAGE-DOWNSAMPLED",
            "@size": "12557",
            "@ref": "fx1",
            "@mimetype": "image/jpeg"
          },
          {
            "@category": "standard",
            "@height": "271",
            "@width": "277",
            "@_fa": "true",
            "$": "https://api.elsevier.com/content/object/eid/1-s2.0-S0926860X14006292-gr1.jpg?httpAccept=%2A%2F%2A",
            "@multimediatype": "JPEG image file",
            "@type": "IMAGE-DOWNSAMPLED",
            "@size": "17616",
            "@ref": "gr1",
            "@mimetype": "image/jpeg"
          },
          {
            "@category": "standard",
            "@height": "296",
            "@width": "333",
            "@_fa": "true",
            "$": "https://api.elsevier.com/content/object/eid/1-s2.0-S0926860X14006292-gr10.jpg?httpAccept=%2A%2F%2A",
            "@multimediatype": "JPEG image file",
            "@type": "IMAGE-DOWNSAMPLED",
            "@size": "32279",
            "@ref": "gr10",
            "@mimetype": "image/jpeg"
          },
          {
            "@category": "standard",
            "@height": "311",
            "@width": "301",
            "@_fa": "true",
            "$": "https://api.elsevier.com/content/object/eid/1-s2.0-S0926860X14006292-gr11.jpg?httpAccept=%2A%2F%2A",
            "@multimediatype": "JPEG image file",
            "@type": "IMAGE-DOWNSAMPLED",
            "@size": "27755",
            "@ref": "gr11",
            "@mimetype": "image/jpeg"
          },
          {
            "@category": "standard",
            "@height": "260",
            "@width": "253",
            "@_fa": "true",
            "$": "https://api.elsevier.com/content/object/eid/1-s2.0-S0926860X14006292-gr12.jpg?httpAccept=%2A%2F%2A",
            "@multimediatype": "JPEG image file",
            "@type": "IMAGE-DOWNSAMPLED",
            "@size": "15629",
            "@ref": "gr12",
            "@mimetype": "image/jpeg"
          },
          {
            "@category": "standard",
            "@height": "289",
            "@width": "301",
            "@_fa": "true",
            "$": "https://api.elsevier.com/content/object/eid/1-s2.0-S0926860X14006292-gr2.jpg?httpAccept=%2A%2F%2A",
            "@multimediatype": "JPEG image file",
            "@type": "IMAGE-DOWNSAMPLED",
            "@size": "19544",
            "@ref": "gr2",
            "@mimetype": "image/jpeg"
          },
          {
            "@category": "standard",
            "@height": "266",
            "@width": "314",
            "@_fa": "true",
            "$": "https://api.elsevier.com/content/object/eid/1-s2.0-S0926860X14006292-gr3.jpg?httpAccept=%2A%2F%2A",
            "@multimediatype": "JPEG image file",
            "@type": "IMAGE-DOWNSAMPLED",
            "@size": "19563",
            "@ref": "gr3",
            "@mimetype": "image/jpeg"
          },
          {
            "@category": "standard",
            "@height": "266",
            "@width": "314",
            "@_fa": "true",
            "$": "https://api.elsevier.com/content/object/eid/1-s2.0-S0926860X14006292-gr4.jpg?httpAccept=%2A%2F%2A",
            "@multimediatype": "JPEG image file",
            "@type": "IMAGE-DOWNSAMPLED",
            "@size": "20657",
            "@ref": "gr4",
            "@mimetype": "image/jpeg"
          },
          {
            "@category": "standard",
            "@height": "329",
            "@width": "301",
            "@_fa": "true",
            "$": "https://api.elsevier.com/content/object/eid/1-s2.0-S0926860X14006292-gr5.jpg?httpAccept=%2A%2F%2A",
            "@multimediatype": "JPEG image file",
            "@type": "IMAGE-DOWNSAMPLED",
            "@size": "23430",
            "@ref": "gr5",
            "@mimetype": "image/jpeg"
          },
          {
            "@category": "standard",
            "@height": "297",
            "@width": "260",
            "@_fa": "true",
            "$": "https://api.elsevier.com/content/object/eid/1-s2.0-S0926860X14006292-gr6.jpg?httpAccept=%2A%2F%2A",
            "@multimediatype": "JPEG image file",
            "@type": "IMAGE-DOWNSAMPLED",
            "@size": "23207",
            "@ref": "gr6",
            "@mimetype": "image/jpeg"
          },
          {
            "@category": "standard",
            "@height": "337",
            "@width": "300",
            "@_fa": "true",
            "$": "https://api.elsevier.com/content/object/eid/1-s2.0-S0926860X14006292-gr7.jpg?httpAccept=%2A%2F%2A",
            "@multimediatype": "JPEG image file",
            "@type": "IMAGE-DOWNSAMPLED",
            "@size": "29232",
            "@ref": "gr7",
            "@mimetype": "image/jpeg"
          },
          {
            "@category": "standard",
            "@height": "358",
            "@width": "318",
            "@_fa": "true",
            "$": "https://api.elsevier.com/content/object/eid/1-s2.0-S0926860X14006292-gr8.jpg?httpAccept=%2A%2F%2A",
            "@multimediatype": "JPEG image file",
            "@type": "IMAGE-DOWNSAMPLED",
            "@size": "22335",
            "@ref": "gr8",
            "@mimetype": "image/jpeg"
          },
          {
            "@category": "standard",
            "@height": "306",
            "@width": "301",
            "@_fa": "true",
            "$": "https://api.elsevier.com/content/object/eid/1-s2.0-S0926860X14006292-gr9.jpg?httpAccept=%2A%2F%2A",
            "@multimediatype": "JPEG image file",
            "@type": "IMAGE-DOWNSAMPLED",
            "@size": "24013",
            "@ref": "gr9",
            "@mimetype": "image/jpeg"
          },
          {
            "@category": "high",
            "@height": "886",
            "@width": "875",
            "@_fa": "true",
            "$": "https://api.elsevier.com/content/object/eid/1-s2.0-S0926860X14006292-fx1_lrg.jpg?httpAccept=%2A%2F%2A",
            "@multimediatype": "JPEG image file",
            "@type": "IMAGE-HIGH-RES",
            "@size": "93245",
            "@ref": "fx1",
            "@mimetype": "image/jpeg"
          },
          {
            "@category": "high",
            "@height": "1204",
            "@width": "1229",
            "@_fa": "true",
            "$": "https://api.elsevier.com/content/object/eid/1-s2.0-S0926860X14006292-gr1_lrg.jpg?httpAccept=%2A%2F%2A",
            "@multimediatype": "JPEG image file",
            "@type": "IMAGE-HIGH-RES",
            "@size": "143373",
            "@ref": "gr1",
            "@mimetype": "image/jpeg"
          },
          {
            "@category": "high",
            "@height": "1313",
            "@width": "1477",
            "@_fa": "true",
            "$": "https://api.elsevier.com/content/object/eid/1-s2.0-S0926860X14006292-gr10_lrg.jpg?httpAccept=%2A%2F%2A",
            "@multimediatype": "JPEG image file",
            "@type": "IMAGE-HIGH-RES",
            "@size": "286044",
            "@ref": "gr10",
            "@mimetype": "image/jpeg"
          },
          {
            "@category": "high",
            "@height": "1377",
            "@width": "1333",
            "@_fa": "true",
            "$": "https://api.elsevier.com/content/object/eid/1-s2.0-S0926860X14006292-gr11_lrg.jpg?httpAccept=%2A%2F%2A",
            "@multimediatype": "JPEG image file",
            "@type": "IMAGE-HIGH-RES",
            "@size": "224011",
            "@ref": "gr11",
            "@mimetype": "image/jpeg"
          },
          {
            "@category": "high",
            "@height": "1155",
            "@width": "1122",
            "@_fa": "true",
            "$": "https://api.elsevier.com/content/object/eid/1-s2.0-S0926860X14006292-gr12_lrg.jpg?httpAccept=%2A%2F%2A",
            "@multimediatype": "JPEG image file",
            "@type": "IMAGE-HIGH-RES",
            "@size": "119919",
            "@ref": "gr12",
            "@mimetype": "image/jpeg"
          },
          {
            "@category": "high",
            "@height": "1281",
            "@width": "1333",
            "@_fa": "true",
            "$": "https://api.elsevier.com/content/object/eid/1-s2.0-S0926860X14006292-gr2_lrg.jpg?httpAccept=%2A%2F%2A",
            "@multimediatype": "JPEG image file",
            "@type": "IMAGE-HIGH-RES",
            "@size": "164014",
            "@ref": "gr2",
            "@mimetype": "image/jpeg"
          },
          {
            "@category": "high",
            "@height": "1179",
            "@width": "1390",
            "@_fa": "true",
            "$": "https://api.elsevier.com/content/object/eid/1-s2.0-S0926860X14006292-gr3_lrg.jpg?httpAccept=%2A%2F%2A",
            "@multimediatype": "JPEG image file",
            "@type": "IMAGE-HIGH-RES",
            "@size": "168425",
            "@ref": "gr3",
            "@mimetype": "image/jpeg"
          },
          {
            "@category": "high",
            "@height": "1179",
            "@width": "1390",
            "@_fa": "true",
            "$": "https://api.elsevier.com/content/object/eid/1-s2.0-S0926860X14006292-gr4_lrg.jpg?httpAccept=%2A%2F%2A",
            "@multimediatype": "JPEG image file",
            "@type": "IMAGE-HIGH-RES",
            "@size": "163560",
            "@ref": "gr4",
            "@mimetype": "image/jpeg"
          },
          {
            "@category": "high",
            "@height": "1457",
            "@width": "1332",
            "@_fa": "true",
            "$": "https://api.elsevier.com/content/object/eid/1-s2.0-S0926860X14006292-gr5_lrg.jpg?httpAccept=%2A%2F%2A",
            "@multimediatype": "JPEG image file",
            "@type": "IMAGE-HIGH-RES",
            "@size": "165087",
            "@ref": "gr5",
            "@mimetype": "image/jpeg"
          },
          {
            "@category": "high",
            "@height": "1314",
            "@width": "1152",
            "@_fa": "true",
            "$": "https://api.elsevier.com/content/object/eid/1-s2.0-S0926860X14006292-gr6_lrg.jpg?httpAccept=%2A%2F%2A",
            "@multimediatype": "JPEG image file",
            "@type": "IMAGE-HIGH-RES",
            "@size": "170351",
            "@ref": "gr6",
            "@mimetype": "image/jpeg"
          },
          {
            "@category": "high",
            "@height": "1496",
            "@width": "1331",
            "@_fa": "true",
            "$": "https://api.elsevier.com/content/object/eid/1-s2.0-S0926860X14006292-gr7_lrg.jpg?httpAccept=%2A%2F%2A",
            "@multimediatype": "JPEG image file",
            "@type": "IMAGE-HIGH-RES",
            "@size": "224785",
            "@ref": "gr7",
            "@mimetype": "image/jpeg"
          },
          {
            "@category": "high",
            "@height": "1585",
            "@width": "1409",
            "@_fa": "true",
            "$": "https://api.elsevier.com/content/object/eid/1-s2.0-S0926860X14006292-gr8_lrg.jpg?httpAccept=%2A%2F%2A",
            "@multimediatype": "JPEG image file",
            "@type": "IMAGE-HIGH-RES",
            "@size": "178387",
            "@ref": "gr8",
            "@mimetype": "image/jpeg"
          },
          {
            "@category": "high",
            "@height": "1357",
            "@width": "1333",
            "@_fa": "true",
            "$": "https://api.elsevier.com/content/object/eid/1-s2.0-S0926860X14006292-gr9_lrg.jpg?httpAccept=%2A%2F%2A",
            "@multimediatype": "JPEG image file",
            "@type": "IMAGE-HIGH-RES",
            "@size": "175016",
            "@ref": "gr9",
            "@mimetype": "image/jpeg"
          }
        ]
      },
      "link": {
        "@rel": "abstract",
        "@href": "https://api.elsevier.com/content/abstract/scopus_id/84912558017"
      }
    }
  }
}