{
  "metadata": {
    "title": "Performance and kinetic investigations on the CeO<ce:inf loc=post>2</ce:inf> catalyzed direct synthesis of dimethyl carbonate from CO<ce:inf loc=post>2</ce:inf> and methanol in dual supercritical conditions",
    "authors": "; ; ",
    "journal": "Applied Catalysis A: General",
    "date": "2023-07-25",
    "doi": "10.1016/j.apcata.2023.119272",
    "abstract": "",
    "uri": "https://api.elsevier.com/content/article/pii/S0926860X23002521",
    "pii": "S0926860X23002521"
  },
  "fulltext": {
    "full-text-retrieval-response": {
      "scopus-eid": "2-s2.0-85160516801",
      "originalText": "serial JL 271346 291210 291744 291809 31 Applied Catalysis A: General APPLIEDCATALYSISAGENERAL 2023-05-26 2023-05-26 2023-05-30 2023-05-30 2023-06-10T00:53:12 1-s2.0-S0926860X23002521 S0926-860X(23)00252-1 S0926860X23002521 10.1016/j.apcata.2023.119272 S300 S300.1 FULL-TEXT 1-s2.0-S0926860X23X00131 2024-01-01T12:35:59.692098Z 0 0 20230725 2023 2023-05-26T01:19:45.019289Z absattachment articleinfo articlenumber articletitlenorm authfirstinitialnorm authfirstsurnamenorm cid cids contenttype copyright crossmark dateloaded dateloadedtxt datesearch datesort dateupdated dco docsubtype doctype doi eid ewtransactionid hubeid indexeddate issn issnnorm itemstage itemtransactionid itemweight openaccess openarchive pg pgfirst pii piinorm pubdatestart pubdatetxt pubyr sortorder srctitle srctitlenorm srctype ssids alllist content subj subheadings suppl tomb volfirst volissue volumelist webpdf webpdfpagecount yearnav figure table e-component body mmlmath acknowledge affil appendices articletitle auth authfirstini authfull authkeywords authlast footnotes grantnumber grantsponsor grantsponsorid highlightsabst primabst ref specialabst 0926-860X 0926860X true 662 662 C Volume 662 12 119272 119272 119272 20230725 25 July 2023 2023-07-25 2023 article fla © 2023 Elsevier B.V. All rights reserved. PERFORMANCEKINETICINVESTIGATIONSCEO2CATALYZEDDIRECTSYNTHESISDIMETHYLCARBONATECO2METHANOLINDUALSUPERCRITICALCONDITIONS GUO W 1 Introduction 2 Materials and methods 2.1 Catalyst preparation 2.2 Catalyst characterizations 2.3 Catalyst evaluation 3 Results and discussion 3.1 Catalyst morphologies analysis 3.2 XRD analysis of prepared catalyst 3.3 Acid-base site detection by NH3/CO2-TPD 3.4 Confirmation of oxygen species by XPS and H2-TPR analysis 3.5 Catalytic activity evaluation 3.6 Dual supercritical conditions comprehensive performance evaluation 4 Reaction mechanism and kinetic analysis 4.1 The proposed catalytic mechanism for synthesis DMC 4.2 Kinetic model establishment and analysis 4.3 Determination of rate-controlling step and model parameters 5 Conclusion CRediT authorship contribution statement Acknowledgements Appendix A Supplementary material References LIU 2017 43 49 H OMAE 2012 1384 1405 I HONDA 2014 2830 2845 M SANTOS 2014 214 229 B HUANG 2015 3079 3116 S HE 2013 20 23 X JI 2013 11606 11611 Y LINGLING 2013 1467 1478 L HADBA 2011 27 35 A WU 2013 1125 1130 D OHNO 2021 457 469 H KUMAR 2017 13 21 P LIU 2018 10446 10456 B SCHAFFNER 2010 4554 4581 B ZHANG 2006 1379 1394 S SUN 2022 W HUO 2021 L KUMAR 2015 2664 2675 P KUMAR 2015 27 31 P MARCINIAK 2020 A TAN 2018 2 12 H CHEN 2019 Y JOE 2012 1018 1022 W ZHOU 2012 Y SANTOS 2013 219 226 B SAADA 2015 353 362 R WANG 2009 323 328 W WANG 2015 1096 1100 S LA 2007 41 45 K SCHNEIDER 2011 776 784 J WANG 2013 5582 5588 S PU 2018 27216 27226 Y PRYMAK 2018 391 394 I FU 2018 198 207 Z BALLIVETTKATCHENKO 2006 80 87 D AOUISSI 2010 1343 1351 A CAI 2009 605 609 Q LIM 2014 1823 1826 Y SUN 2020 4281 4290 W TONG 2015 5581 5588 X BRUNNER 1987 273 291 E CHANG 1998 223 237 C WANG 2019 e1800592 Z MARIN 2016 295 301 C GHOSH 2020 17594 17604 D YANG 2008 638 641 H GONG 2020 Z LI 2017 33 39 A LIU 2017 12231 12240 B JUNG 2001 339 347 K LA 2007 41 45 K KUMAR 2021 P KELLER 2010 1 18 N ZHAO 2017 65 69 S WANG 2019 210 221 X ZHANG 2019 767 775 Y ZHU 2014 383 395 L YE 2013 1296 1306 J WANG 2015 177 186 F WANG 2012 X LIU 2022 H WU 2015 7340 7350 Z METIU 2012 10439 10450 H JOMJAREE 2021 234 244 T TEO 2015 243 250 S GARCIAMARTINEZ 2017 99 108 N ANDERSON 2005 117 124 S ASAHI 1998 63 67 N DOLAN 2008 418 425 J ZHANG 2018 17076 17085 G BAI 2019 379 385 Y LI 2023 1032 1048 Y WADA 2013 8 S KUAN 2022 W CUI 2016 29 36 Z ARESTA 2008 125 131 M LIU 2018 140 143 X WANG 2016 6298 6305 F FRONZI 2016 240 249 M ETA 2011 V GUOX2023X119272 GUOX2023X119272XW 2025-05-30T00:00:00.000Z 2025-05-30T00:00:00.000Z http://creativecommons.org/licenses/by-nc-nd/4.0/ © 2023 Elsevier B.V. All rights reserved. 2023-06-06T14:18:39.028Z http://vtw.elsevier.com/data/voc/AddOnTypes/50.7/aggregated-refined https://doi.org/10.15223/policy-017 https://doi.org/10.15223/policy-037 https://doi.org/10.15223/policy-012 https://doi.org/10.15223/policy-029 https://doi.org/10.15223/policy-004 item S0926-860X(23)00252-1 S0926860X23002521 1-s2.0-S0926860X23002521 10.1016/j.apcata.2023.119272 271346 2024-01-01T12:35:59.692098Z 2023-07-25 1-s2.0-S0926860X23002521-main.pdf https://s3-eu-west-1.amazonaws.com/prod-ucs-content-store-eu-west/content/pii:S0926860X23002521/MAIN/application/pdf/316c6d42444da77f0d6c979efa0ac04f/main.pdf main.pdf pdf true 5919808 MAIN 12 1-s2.0-S0926860X23002521-main_1.png https://s3-eu-west-1.amazonaws.com/prod-ucs-content-store-eu-west/content/pii:S0926860X23002521/PREVIEW/image/png/ce07a2e0787432e13f40f4e49a5066be/main_1.png main_1.png png 53579 849 656 IMAGE-WEB-PDF 1 1-s2.0-S0926860X23002521-gr1.jpg https://s3-eu-west-1.amazonaws.com/prod-ucs-content-store-eu-west/content/pii:S0926860X23002521/gr1/DOWNSAMPLED/image/jpeg/b545bccacc698912cbce96d1781328ca/gr1.jpg gr1 gr1.jpg jpg 26775 267 565 IMAGE-DOWNSAMPLED 1-s2.0-S0926860X23002521-gr3.jpg https://s3-eu-west-1.amazonaws.com/prod-ucs-content-store-eu-west/content/pii:S0926860X23002521/gr3/DOWNSAMPLED/image/jpeg/ba8f92de2958476889e79f2b2377c0c6/gr3.jpg gr3 gr3.jpg jpg 21679 295 376 IMAGE-DOWNSAMPLED 1-s2.0-S0926860X23002521-gr2.jpg https://s3-eu-west-1.amazonaws.com/prod-ucs-content-store-eu-west/content/pii:S0926860X23002521/gr2/DOWNSAMPLED/image/jpeg/6f883aab2eaedee0d692bda54eea4f4e/gr2.jpg gr2 gr2.jpg jpg 183234 677 678 IMAGE-DOWNSAMPLED 1-s2.0-S0926860X23002521-ga1.jpg https://s3-eu-west-1.amazonaws.com/prod-ucs-content-store-eu-west/content/pii:S0926860X23002521/ga1/DOWNSAMPLED/image/jpeg/c77bdb0c987b1a125c94d5e54f28fde4/ga1.jpg ga1 true ga1.jpg jpg 19412 245 253 IMAGE-DOWNSAMPLED 1-s2.0-S0926860X23002521-gr10.jpg https://s3-eu-west-1.amazonaws.com/prod-ucs-content-store-eu-west/content/pii:S0926860X23002521/gr10/DOWNSAMPLED/image/jpeg/2c12826ecf3af2d332a88f72b24bac2f/gr10.jpg gr10 gr10.jpg jpg 61588 456 565 IMAGE-DOWNSAMPLED 1-s2.0-S0926860X23002521-gr9.jpg https://s3-eu-west-1.amazonaws.com/prod-ucs-content-store-eu-west/content/pii:S0926860X23002521/gr9/DOWNSAMPLED/image/jpeg/6f1d1be9bdcd3c49ed5867b4442bcc96/gr9.jpg gr9 gr9.jpg jpg 29064 295 565 IMAGE-DOWNSAMPLED 1-s2.0-S0926860X23002521-gr8.jpg https://s3-eu-west-1.amazonaws.com/prod-ucs-content-store-eu-west/content/pii:S0926860X23002521/gr8/DOWNSAMPLED/image/jpeg/ccdd9416fd74a7b678d012093491b67d/gr8.jpg gr8 gr8.jpg jpg 28800 198 565 IMAGE-DOWNSAMPLED 1-s2.0-S0926860X23002521-gr5.jpg https://s3-eu-west-1.amazonaws.com/prod-ucs-content-store-eu-west/content/pii:S0926860X23002521/gr5/DOWNSAMPLED/image/jpeg/61b1ee40e86ecf16555e2313d7d07c0e/gr5.jpg gr5 gr5.jpg jpg 51131 411 565 IMAGE-DOWNSAMPLED 1-s2.0-S0926860X23002521-gr4.jpg https://s3-eu-west-1.amazonaws.com/prod-ucs-content-store-eu-west/content/pii:S0926860X23002521/gr4/DOWNSAMPLED/image/jpeg/3fca3b94511ac6e1c5b27f16905b1940/gr4.jpg gr4 gr4.jpg jpg 34092 238 565 IMAGE-DOWNSAMPLED 1-s2.0-S0926860X23002521-gr7.jpg https://s3-eu-west-1.amazonaws.com/prod-ucs-content-store-eu-west/content/pii:S0926860X23002521/gr7/DOWNSAMPLED/image/jpeg/fc9bbf97f0582ac13f97f8929532a8af/gr7.jpg gr7 gr7.jpg jpg 28252 235 565 IMAGE-DOWNSAMPLED 1-s2.0-S0926860X23002521-gr6.jpg https://s3-eu-west-1.amazonaws.com/prod-ucs-content-store-eu-west/content/pii:S0926860X23002521/gr6/DOWNSAMPLED/image/jpeg/3a8212a595707dded9e7fbb35124542a/gr6.jpg gr6 gr6.jpg jpg 25630 297 376 IMAGE-DOWNSAMPLED 1-s2.0-S0926860X23002521-gr1.sml https://s3-eu-west-1.amazonaws.com/prod-ucs-content-store-eu-west/content/pii:S0926860X23002521/gr1/THUMBNAIL/image/gif/2ae89b24b8450936ea9133380c8a1e3a/gr1.sml gr1 gr1.sml sml 6836 103 219 IMAGE-THUMBNAIL 1-s2.0-S0926860X23002521-gr3.sml https://s3-eu-west-1.amazonaws.com/prod-ucs-content-store-eu-west/content/pii:S0926860X23002521/gr3/THUMBNAIL/image/gif/5db407ab80896c22188d5747a9a8b0fc/gr3.sml gr3 gr3.sml sml 7176 164 209 IMAGE-THUMBNAIL 1-s2.0-S0926860X23002521-gr2.sml https://s3-eu-west-1.amazonaws.com/prod-ucs-content-store-eu-west/content/pii:S0926860X23002521/gr2/THUMBNAIL/image/gif/d1f657a0b530217be7c3caead5b315fb/gr2.sml gr2 gr2.sml sml 17141 164 164 IMAGE-THUMBNAIL 1-s2.0-S0926860X23002521-ga1.sml https://s3-eu-west-1.amazonaws.com/prod-ucs-content-store-eu-west/content/pii:S0926860X23002521/ga1/THUMBNAIL/image/gif/539a232b1df2694b491069ed51fecbf7/ga1.sml ga1 true ga1.sml sml 13276 163 169 IMAGE-THUMBNAIL 1-s2.0-S0926860X23002521-gr10.sml https://s3-eu-west-1.amazonaws.com/prod-ucs-content-store-eu-west/content/pii:S0926860X23002521/gr10/THUMBNAIL/image/gif/8c200c272c5785443f73c2e3547f2d60/gr10.sml gr10 gr10.sml sml 9892 164 203 IMAGE-THUMBNAIL 1-s2.0-S0926860X23002521-gr9.sml https://s3-eu-west-1.amazonaws.com/prod-ucs-content-store-eu-west/content/pii:S0926860X23002521/gr9/THUMBNAIL/image/gif/9b3b98f7cd62b3a8211b7da8b2b17e62/gr9.sml gr9 gr9.sml sml 5067 114 219 IMAGE-THUMBNAIL 1-s2.0-S0926860X23002521-gr8.sml https://s3-eu-west-1.amazonaws.com/prod-ucs-content-store-eu-west/content/pii:S0926860X23002521/gr8/THUMBNAIL/image/gif/e0a30ce43fa09c6b68e90ea010d22252/gr8.sml gr8 gr8.sml sml 6616 77 219 IMAGE-THUMBNAIL 1-s2.0-S0926860X23002521-gr5.sml https://s3-eu-west-1.amazonaws.com/prod-ucs-content-store-eu-west/content/pii:S0926860X23002521/gr5/THUMBNAIL/image/gif/7cb9cd9a31c7d83575313972416a1284/gr5.sml gr5 gr5.sml sml 11317 159 219 IMAGE-THUMBNAIL 1-s2.0-S0926860X23002521-gr4.sml https://s3-eu-west-1.amazonaws.com/prod-ucs-content-store-eu-west/content/pii:S0926860X23002521/gr4/THUMBNAIL/image/gif/359f4ac222991fb494270dc94a0a7ced/gr4.sml gr4 gr4.sml sml 5998 92 219 IMAGE-THUMBNAIL 1-s2.0-S0926860X23002521-gr7.sml https://s3-eu-west-1.amazonaws.com/prod-ucs-content-store-eu-west/content/pii:S0926860X23002521/gr7/THUMBNAIL/image/gif/5d1da82ef3f7fa55e1c08c302b5c7b21/gr7.sml gr7 gr7.sml sml 5615 91 219 IMAGE-THUMBNAIL 1-s2.0-S0926860X23002521-gr6.sml https://s3-eu-west-1.amazonaws.com/prod-ucs-content-store-eu-west/content/pii:S0926860X23002521/gr6/THUMBNAIL/image/gif/3e03752a48d051a49fb1fcb5270e4775/gr6.sml gr6 gr6.sml sml 7039 164 208 IMAGE-THUMBNAIL 1-s2.0-S0926860X23002521-gr1_lrg.jpg https://s3-eu-west-1.amazonaws.com/prod-ucs-content-store-eu-west/content/pii:S0926860X23002521/HIGHRES/image/jpeg/0c430a7c70d3cb46ba2802cc2b0b7d52/gr1_lrg.jpg gr1 gr1_lrg.jpg jpg 131987 1179 2495 IMAGE-HIGH-RES 1-s2.0-S0926860X23002521-gr3_lrg.jpg https://s3-eu-west-1.amazonaws.com/prod-ucs-content-store-eu-west/content/pii:S0926860X23002521/HIGHRES/image/jpeg/6b90f696ef2eddeac5f995374c7f65a0/gr3_lrg.jpg gr3 gr3_lrg.jpg jpg 124520 1304 1663 IMAGE-HIGH-RES 1-s2.0-S0926860X23002521-gr2_lrg.jpg https://s3-eu-west-1.amazonaws.com/prod-ucs-content-store-eu-west/content/pii:S0926860X23002521/HIGHRES/image/jpeg/1a88ae9b839c72d77262649edd1da0c7/gr2_lrg.jpg gr2 gr2_lrg.jpg jpg 1009454 2988 2994 IMAGE-HIGH-RES 1-s2.0-S0926860X23002521-ga1_lrg.jpg https://s3-eu-west-1.amazonaws.com/prod-ucs-content-store-eu-west/content/pii:S0926860X23002521/HIGHRES/image/jpeg/7f341081fb51235b26800438756d58af/ga1_lrg.jpg ga1 true ga1_lrg.jpg jpg 144827 1085 1122 IMAGE-HIGH-RES 1-s2.0-S0926860X23002521-gr10_lrg.jpg https://s3-eu-west-1.amazonaws.com/prod-ucs-content-store-eu-west/content/pii:S0926860X23002521/HIGHRES/image/jpeg/d6cc0c4392d6fa2b9fc63d5298d7f2e9/gr10_lrg.jpg gr10 gr10_lrg.jpg jpg 343381 2014 2495 IMAGE-HIGH-RES 1-s2.0-S0926860X23002521-gr9_lrg.jpg https://s3-eu-west-1.amazonaws.com/prod-ucs-content-store-eu-west/content/pii:S0926860X23002521/HIGHRES/image/jpeg/60db64de4342ff3d207d803ac040f4cf/gr9_lrg.jpg gr9 gr9_lrg.jpg jpg 149244 1303 2495 IMAGE-HIGH-RES 1-s2.0-S0926860X23002521-gr8_lrg.jpg https://s3-eu-west-1.amazonaws.com/prod-ucs-content-store-eu-west/content/pii:S0926860X23002521/HIGHRES/image/jpeg/618f777c9a2039b0899b06baf3809dd1/gr8_lrg.jpg gr8 gr8_lrg.jpg jpg 148293 876 2495 IMAGE-HIGH-RES 1-s2.0-S0926860X23002521-gr5_lrg.jpg https://s3-eu-west-1.amazonaws.com/prod-ucs-content-store-eu-west/content/pii:S0926860X23002521/HIGHRES/image/jpeg/699cfc887c0fde87c0a47f74738ed0f1/gr5_lrg.jpg gr5 gr5_lrg.jpg jpg 290833 1814 2495 IMAGE-HIGH-RES 1-s2.0-S0926860X23002521-gr4_lrg.jpg https://s3-eu-west-1.amazonaws.com/prod-ucs-content-store-eu-west/content/pii:S0926860X23002521/HIGHRES/image/jpeg/681960bcaa4ee19e33e54c82bdeabc1b/gr4_lrg.jpg gr4 gr4_lrg.jpg jpg 179814 1050 2495 IMAGE-HIGH-RES 1-s2.0-S0926860X23002521-gr7_lrg.jpg https://s3-eu-west-1.amazonaws.com/prod-ucs-content-store-eu-west/content/pii:S0926860X23002521/HIGHRES/image/jpeg/ad63aea88d99c0fe852054bfb2bb8547/gr7_lrg.jpg gr7 gr7_lrg.jpg jpg 150716 1037 2495 IMAGE-HIGH-RES 1-s2.0-S0926860X23002521-gr6_lrg.jpg https://s3-eu-west-1.amazonaws.com/prod-ucs-content-store-eu-west/content/pii:S0926860X23002521/HIGHRES/image/jpeg/67ffb0c3305fff9611391de1d153e3b7/gr6_lrg.jpg gr6 gr6_lrg.jpg jpg 122406 1312 1663 IMAGE-HIGH-RES 1-s2.0-S0926860X23002521-mmc1.docx https://s3-eu-west-1.amazonaws.com/prod-ucs-content-store-eu-west/content/pii:S0926860X23002521/mmc1/MAIN/application/vnd.openxmlformats-officedocument.wordprocessingml.document/5815d75c1241baa95f58fa6aa57d4c82/mmc1.docx mmc1 mmc1.docx docx 1138055 APPLICATION 1-s2.0-S0926860X23002521-si0001.svg https://s3-eu-west-1.amazonaws.com/prod-ucs-content-store-eu-west/content/pii:S0926860X23002521/image/svg+xml/96118e5c923845f8b49c0bcba6e273dd/si0001.svg si0001 si0001.svg svg 1572 ALTIMG 1-s2.0-S0926860X23002521-si0002.svg https://s3-eu-west-1.amazonaws.com/prod-ucs-content-store-eu-west/content/pii:S0926860X23002521/image/svg+xml/37eb0ff07b7b3a37bc07f7647abc44b2/si0002.svg si0002 si0002.svg svg 1547 ALTIMG 1-s2.0-S0926860X23002521-si0003.svg https://s3-eu-west-1.amazonaws.com/prod-ucs-content-store-eu-west/content/pii:S0926860X23002521/image/svg+xml/3e54977eb9f0f8dd42f99c3454f084a7/si0003.svg si0003 si0003.svg svg 1499 ALTIMG 1-s2.0-S0926860X23002521-si0004.svg https://s3-eu-west-1.amazonaws.com/prod-ucs-content-store-eu-west/content/pii:S0926860X23002521/image/svg+xml/a2d8100192b5c85f4bbdf1f89f504580/si0004.svg si0004 si0004.svg svg 1584 ALTIMG 1-s2.0-S0926860X23002521-si0005.svg https://s3-eu-west-1.amazonaws.com/prod-ucs-content-store-eu-west/content/pii:S0926860X23002521/image/svg+xml/492dffaaebff9f0afee4e785a8c07275/si0005.svg si0005 si0005.svg svg 1636 ALTIMG 1-s2.0-S0926860X23002521-si0006.svg https://s3-eu-west-1.amazonaws.com/prod-ucs-content-store-eu-west/content/pii:S0926860X23002521/image/svg+xml/a3cbbd03baa2e12a43b4e9af827a1c27/si0006.svg si0006 si0006.svg svg 1482 ALTIMG 1-s2.0-S0926860X23002521-si0007.svg https://s3-eu-west-1.amazonaws.com/prod-ucs-content-store-eu-west/content/pii:S0926860X23002521/image/svg+xml/41f19d48669e1dfafe65d896623e87fc/si0007.svg si0007 si0007.svg svg 1466 ALTIMG 1-s2.0-S0926860X23002521-si0008.svg https://s3-eu-west-1.amazonaws.com/prod-ucs-content-store-eu-west/content/pii:S0926860X23002521/image/svg+xml/7759ff5ef512765812ec403add438719/si0008.svg si0008 si0008.svg svg 1401 ALTIMG 1-s2.0-S0926860X23002521-si0009.svg https://s3-eu-west-1.amazonaws.com/prod-ucs-content-store-eu-west/content/pii:S0926860X23002521/image/svg+xml/decd4885d69391a48b5258f49f173a90/si0009.svg si0009 si0009.svg svg 1450 ALTIMG 1-s2.0-S0926860X23002521-si0010.svg https://s3-eu-west-1.amazonaws.com/prod-ucs-content-store-eu-west/content/pii:S0926860X23002521/image/svg+xml/6207c96b556e58699b98908c4f8aad2d/si0010.svg si0010 si0010.svg svg 1551 ALTIMG 1-s2.0-S0926860X23002521-si0011.svg https://s3-eu-west-1.amazonaws.com/prod-ucs-content-store-eu-west/content/pii:S0926860X23002521/image/svg+xml/061304853fc00df171998752bbaff629/si0011.svg si0011 si0011.svg svg 1462 ALTIMG 1-s2.0-S0926860X23002521-si0012.svg https://s3-eu-west-1.amazonaws.com/prod-ucs-content-store-eu-west/content/pii:S0926860X23002521/image/svg+xml/3e0642e505759e6f7e4111ed1de358a7/si0012.svg si0012 si0012.svg svg 1527 ALTIMG 1-s2.0-S0926860X23002521-si0013.svg https://s3-eu-west-1.amazonaws.com/prod-ucs-content-store-eu-west/content/pii:S0926860X23002521/image/svg+xml/b7a84eabd8b38c3297d0f1dcfefa234c/si0013.svg si0013 si0013.svg svg 2897 ALTIMG 1-s2.0-S0926860X23002521-si0014.svg https://s3-eu-west-1.amazonaws.com/prod-ucs-content-store-eu-west/content/pii:S0926860X23002521/image/svg+xml/89f7f0072e2913efb9f7afb363f1d6f2/si0014.svg si0014 si0014.svg svg 4951 ALTIMG 1-s2.0-S0926860X23002521-si0015.svg https://s3-eu-west-1.amazonaws.com/prod-ucs-content-store-eu-west/content/pii:S0926860X23002521/image/svg+xml/95c9c506a9f4819a575426fbe078694f/si0015.svg si0015 si0015.svg svg 5255 ALTIMG 1-s2.0-S0926860X23002521-si0016.svg https://s3-eu-west-1.amazonaws.com/prod-ucs-content-store-eu-west/content/pii:S0926860X23002521/image/svg+xml/b2fccb588b4dc165ec099ce21644a03f/si0016.svg si0016 si0016.svg svg 3521 ALTIMG 1-s2.0-S0926860X23002521-si0017.svg https://s3-eu-west-1.amazonaws.com/prod-ucs-content-store-eu-west/content/pii:S0926860X23002521/image/svg+xml/10011f0df7107f887bd4dededa6f7724/si0017.svg si0017 si0017.svg svg 1855 ALTIMG 1-s2.0-S0926860X23002521-si0018.svg https://s3-eu-west-1.amazonaws.com/prod-ucs-content-store-eu-west/content/pii:S0926860X23002521/image/svg+xml/4ebbe7969cdcb26111cf636fbd4a1eaf/si0018.svg si0018 si0018.svg svg 2435 ALTIMG 1-s2.0-S0926860X23002521-si0019.svg https://s3-eu-west-1.amazonaws.com/prod-ucs-content-store-eu-west/content/pii:S0926860X23002521/image/svg+xml/b96850087e37c76da155f213255e7568/si0019.svg si0019 si0019.svg svg 1381 ALTIMG 1-s2.0-S0926860X23002521-si0020.svg https://s3-eu-west-1.amazonaws.com/prod-ucs-content-store-eu-west/content/pii:S0926860X23002521/image/svg+xml/b14cb1d5ab396e397ff393f8384cf2a0/si0020.svg si0020 si0020.svg svg 1353 ALTIMG 1-s2.0-S0926860X23002521-si0021.svg https://s3-eu-west-1.amazonaws.com/prod-ucs-content-store-eu-west/content/pii:S0926860X23002521/image/svg+xml/cc302d8ad22fa05c20561efec335e64f/si0021.svg si0021 si0021.svg svg 3322 ALTIMG 1-s2.0-S0926860X23002521-si0022.svg https://s3-eu-west-1.amazonaws.com/prod-ucs-content-store-eu-west/content/pii:S0926860X23002521/image/svg+xml/09156fed4c3f9210a8b1a461eab9a0b5/si0022.svg si0022 si0022.svg svg 1235 ALTIMG 1-s2.0-S0926860X23002521-si0023.svg https://s3-eu-west-1.amazonaws.com/prod-ucs-content-store-eu-west/content/pii:S0926860X23002521/image/svg+xml/7d084a1ef78cec843576ca8a04fb89bf/si0023.svg si0023 si0023.svg svg 1284 ALTIMG 1-s2.0-S0926860X23002521-si0024.svg https://s3-eu-west-1.amazonaws.com/prod-ucs-content-store-eu-west/content/pii:S0926860X23002521/image/svg+xml/84010e2214c9d231efe7debacfdec5e5/si0024.svg si0024 si0024.svg svg 1292 ALTIMG 1-s2.0-S0926860X23002521-si0025.svg https://s3-eu-west-1.amazonaws.com/prod-ucs-content-store-eu-west/content/pii:S0926860X23002521/image/svg+xml/a34129b5ffa0c480a9cd4e5a8bca360d/si0025.svg si0025 si0025.svg svg 1564 ALTIMG 1-s2.0-S0926860X23002521-si0026.svg https://s3-eu-west-1.amazonaws.com/prod-ucs-content-store-eu-west/content/pii:S0926860X23002521/image/svg+xml/5dd6e090bd404cb135e7bb5fe31d394a/si0026.svg si0026 si0026.svg svg 1183 ALTIMG 1-s2.0-S0926860X23002521-si0027.svg https://s3-eu-west-1.amazonaws.com/prod-ucs-content-store-eu-west/content/pii:S0926860X23002521/image/svg+xml/162c31a55a19ead41c4575a73aa76ddc/si0027.svg si0027 si0027.svg svg 2820 ALTIMG 1-s2.0-S0926860X23002521-si0028.svg https://s3-eu-west-1.amazonaws.com/prod-ucs-content-store-eu-west/content/pii:S0926860X23002521/image/svg+xml/d94bb00b367f2021b628bca4edaedb5c/si0028.svg si0028 si0028.svg svg 10953 ALTIMG 1-s2.0-S0926860X23002521-si0029.svg https://s3-eu-west-1.amazonaws.com/prod-ucs-content-store-eu-west/content/pii:S0926860X23002521/image/svg+xml/d4006bac843021428082e578752f4bb1/si0029.svg si0029 si0029.svg svg 1576 ALTIMG 1-s2.0-S0926860X23002521-si0030.svg https://s3-eu-west-1.amazonaws.com/prod-ucs-content-store-eu-west/content/pii:S0926860X23002521/image/svg+xml/8acba0c12ac65c1b63efca94ebbeeff4/si0030.svg si0030 si0030.svg svg 2735 ALTIMG 1-s2.0-S0926860X23002521-si0031.svg https://s3-eu-west-1.amazonaws.com/prod-ucs-content-store-eu-west/content/pii:S0926860X23002521/image/svg+xml/300ef03ac429a2873f8b10d9256a2c21/si0031.svg si0031 si0031.svg svg 2030 ALTIMG 1-s2.0-S0926860X23002521-si0032.svg https://s3-eu-west-1.amazonaws.com/prod-ucs-content-store-eu-west/content/pii:S0926860X23002521/image/svg+xml/8228756e4e1d52e5857fb37704b433c0/si0032.svg si0032 si0032.svg svg 1231 ALTIMG 1-s2.0-S0926860X23002521-si0033.svg https://s3-eu-west-1.amazonaws.com/prod-ucs-content-store-eu-west/content/pii:S0926860X23002521/image/svg+xml/c30cf3e7e4a1a608b082b92f480ed6b8/si0033.svg si0033 si0033.svg svg 1944 ALTIMG 1-s2.0-S0926860X23002521-si0034.svg https://s3-eu-west-1.amazonaws.com/prod-ucs-content-store-eu-west/content/pii:S0926860X23002521/image/svg+xml/5f995e832e389393c24b996901c3f408/si0034.svg si0034 si0034.svg svg 1134 ALTIMG 1-s2.0-S0926860X23002521-si0035.svg https://s3-eu-west-1.amazonaws.com/prod-ucs-content-store-eu-west/content/pii:S0926860X23002521/image/svg+xml/91934b034f50258f29cbe349463f0f1e/si0035.svg si0035 si0035.svg svg 1150 ALTIMG 1-s2.0-S0926860X23002521-si0036.svg https://s3-eu-west-1.amazonaws.com/prod-ucs-content-store-eu-west/content/pii:S0926860X23002521/image/svg+xml/061100ca48b2eb97f8519e22f7df6b46/si0036.svg si0036 si0036.svg svg 2702 ALTIMG 1-s2.0-S0926860X23002521-si0037.svg https://s3-eu-west-1.amazonaws.com/prod-ucs-content-store-eu-west/content/pii:S0926860X23002521/image/svg+xml/b743492eed5e504c0e9e8efb508c097b/si0037.svg si0037 si0037.svg svg 4615 ALTIMG 1-s2.0-S0926860X23002521-si0038.svg https://s3-eu-west-1.amazonaws.com/prod-ucs-content-store-eu-west/content/pii:S0926860X23002521/image/svg+xml/70de935c44ca7ddfc2c92df4af7e4b36/si0038.svg si0038 si0038.svg svg 2800 ALTIMG 1-s2.0-S0926860X23002521-am.pdf https://s3-eu-west-1.amazonaws.com/prod-ucs-content-store-eu-west/content/egi:10L1V51VJQN/MAIN/application/pdf/761ca6cf326be43f5422114c285a4b0e/am.pdf am am.pdf pdf false 2051271 AAM-PDF APCATA 119272 119272 S0926-860X(23)00252-1 10.1016/j.apcata.2023.119272 Elsevier B.V. Fig. 1 Schematic diagram of the catalytic evaluation system for the direct synthesis of DMC. Fig. 1 Fig. 2 (a) SEM images of CeO2, (b) TEM images of CeO2, (c) HRTEM images of CeO2, (d) SEM images of CeO2-R, (e) TEM images of CeO2-R, (f) HRTEM images of CeO2-R, (g) SEM images of CeO2-F, (h) TEM images of CeO2-F and (i) HRTEM images of CeO2-F. Fig. 2 Fig. 3 XRD patterns of CeO2 with different morphologies. Fig. 3 Fig. 4 (a) NH3-TPD and (b) CO2-TPD profiles of CeO2 with different morphologies. Fig. 4 Fig. 5 (a)Ce 3d and (b)O 1 s XPS spectra of CeO2 with different morphologies. Fig. 5 Fig. 6 H2-TPR profiles of CeO2 with different morphologies. Fig. 6 Fig. 7 The DMC yields of CeO2-F at different reaction temperature and time, (a) dual supercritical conditions (16 MPa, 742 mmol methanol, 1 g catalyst), (b) supercritical CO2 phase (8 MPa, 625 mmol methanol, 1 g catalyst). Fig. 7 Fig. 8 (a) catalytic activities and methanol conversions of the as-prepared CeO2 samples under different supercritical conditions. (b) recycle experiments of CeO2 with different morphologies. Fig. 8 Fig. 9 The catalytic mechanism of surface oxygen vacancy on CeO2 during DMC synthesis. Fig. 9 Fig. 10 (a) the fitted curves of apparent activation energy and (b - d) reaction orders of DMC synthesis kinetics. Fig. 10 Table 1 Preparation conditions for different morphologies catalysts (T: hydrothermal temperature; t: hydrothermal time). Table 1 Catalysts Ce (NO3)3·6 H2O (g) ethylene glycol (mL) NaOH (g) H2O (mL) T (℃) t (h) CeO2-F 2.604 60 - 10 180 24 CeO2-R 3.0 - 6.4 70 100 24 CeO2 5 - - - - - Table 2 Textural properties (BET), crystallite size and crystallinity (XRD) of CeO2 with different morphologies. Table 2 Sample SBET (m2/g) Vpore (cm3/g) Average crystallite size (nm) Crystallinity CeO2 46.6 0.19 13.2 86.8% CeO2-F 84.1 0.17 7.6 61.9% CeO2-R 78.1 0.20 11.7 76.1% Table 3 Quantification of the NH3-TPD profiles of CeO2 with different morphologies. Table 3 Sample Weakly Moderately Strongly T (℃) Amount (mmol/gcat.) T (℃) Amount (mmol/gcat.) T (℃) Amount (mmol/gcat.) CeO2-F 130 0.344 240 0.285 685 0.275 CeO2-R 125 0.240 220 0.151 730 0.268 CeO2 125 0.301 240 0.055 750 0.230 Table 4 Quantification of the CO2-TPD profiles of CeO2 with different morphologies. Table 4 Sample Weakly Moderately Strongly T (℃) Amount (mmol/gcat.) T (℃) Amount (mmol/gcat.) T (℃) Amount (mmol/gcat.) CeO2-F 140 0.445 240 0.198 450 0.087 CeO2-R 130 0.373 220 0.146 445 0.054 CeO2 128 0.307 258 0.098 460 0.059 Table 5 The ratios of Ce3+ to total Ce ions and the surface concentration of oxygen vacancy based on XPS and H2-TPR (a: XPS spectrum analysis results. b: H2-TPR profile analysis results). Table 5 catalyst CeO2-F CeO2-R CeO2 surface content of Ce3+ (%)a 17.99 ± 0.32 17.03 ± 0.15 5.58 ± 0.21 surface content of OV (%)a 16.62 ± 0.38 13.56 ± 0.24 3.22 ± 0.31 surface content of OV (mmol/g)b 0.14 ± 0.002 0.11 ± 0.003 0.07 ± 0.002 surface content of OL (mmol/g)b 0.52 ± 0.004 0.44 ± 0.002 0.42 ± 0.003 Table 6 Elementary mechanistic steps for the synthesis DMC from CO2 and methanol by Langmuir–Hinshelwood (LH) and Eley–Rideal (ER) mechanism. Table 6 LH mechanism ER mechanism Step 1 CO2 + * ⇌ CO2*Rate = k [*] [CO2] CH3OH + * ⇌ CH3OH *Rate= k [*] [CH3OH] Step 2 CH3OH + * ⇌ CH3OH*Rate = k [*] [CH3OH] CH3OH * + CO2 ⇌ MC*Rate = k [*] [CH3OH] [CO2] Step 3 2CH3OH* + CO2* ⇌ DMC* + H2O*Rate = k [*]3 [CH3OH]2 [CO2] MC* + CH3OH * ⇌ DMC + H2O + *Rate = k [*]2 [CH3OH]2 [CO2] Step 4 DMC* ⇌ DMC + *Rate = k [*] [CH3OH] [CO2]1/2 Step 5 H2O*+DMC* ⇌ CO2 +2CH3OH + 2*Rate = k [*]2 [CH3OH]2 [CO2] Performance and kinetic investigations on the CeO2 catalyzed direct synthesis of dimethyl carbonate from CO2 and methanol in dual supercritical conditions Wenzhao Guo Conceptualization Methodology Data curation Writing – original draft Writing – review & editing a 1 Lan Zheng Methodology Supervision a 1 Xiong Gao Data curation b Wenhui Yang Data curation b Yanan Li Investigation a Wen Sun Investigation a Shuqin Gao Resources a Yuqi Wang Methodology Conceptualization Visualization Supervision Writing – review & editing a ⁎ Xin Ding Methodology Software a Le Wu Software a Tao Fang Conceptualization c a School of Chemical Engineering, Northwest University, Xi’an 710069, China School of Chemical Engineering, Northwest University Xi’an 710069 China School of Chemical Engineering, Northwest University, Xi’an 710069, China b Shaanxi Yanchang Petroleum Northwest Rubber Co., Ltd., Xianyang 712023, China Shaanxi Yanchang Petroleum Northwest Rubber Co., Ltd Xianyang 712023 China Shaanxi Yanchang Petroleum Northwest Rubber Co., Ltd., Xianyang, 712023, China c School of Chemical Engineering and Technology, Xi’an Jiaotong University, Xi’an 710049, China School of Chemical Engineering and Technology, Xi’an Jiaotong University Xi’an 710049 China School of Chemical Engineering and Technology, Xi’an Jiaotong University, Xi’an 710049, China ⁎ Corresponding author. 1 These authors contributed equally to this work and should be considered co-first authors. In this study, the direct synthesis conditions of dimethyl carbonate (DMC) from methanol and CO2 were controlled under the dual supercritical conditions, whose temperature was higher than the maximal critical temperature of CO2 and methanol (>239 ℃), and the partial pressure for each reactant was larger than its partial critical pressure (PCO2 > 7.4 MPa and Pmethanol > 8.1 MPa). A series of CeO2 catalysts with different morphologies including traditional nanorod, amorphous and flower structures were synthesized by hydrothermal method. The prepared catalysts were characterized by the BET, XRD, SEM, NH3/CO2-TPD, XPS, and H2-TPR, and the results indicated that flower CeO2 performed the largest acid-base sites and oxygen vacancies as expected, proving its superior physicochemical properties and catalytic activity. Moreover, the catalytic activity synthesis of DMC from CO2 and methanol was investigated, confirming that the flower CeO2 owned the highest catalytic performance, and the maximum yield of DMC was 3.11 mmol/gcat. under the reaction conditions (16 MPa, 250 °C, reaction time of 1 h without stirring). Importantly, the synthesis kinetic mechanism of DMC in dual supercritical systems was experimentally studied using the synthetic CeO2 catalysts, and the flower CeO2 catalyst possessed the lowest apparent activation energy of 45.9 kJ/mol, meanwhile, the initial reaction rate equation obtained from the experiment can be represented as: Rate = k [*] [CH3OH] [CO2]1/2, which was consistent with the reaction mechanism of Langmuir–Hinshelwood type. Graphical Abstract ga1 Keywords Dual supercritical conditions CO2 conversion Dimethyl carbonate Kinetic mechanism CeO2 morphology Data Availability Data will be made available on request. 1 Introduction Climate change has become a global issue due to the increasing amount of carbon dioxide (CO2) emissions into the atmosphere. Being the main component of greenhouse gas, CO2 is a non-toxic, abundant, inexpensive C1 renewable resource. Hence, the government attaches great attention to the reduction and utilization of CO2, and a lot of scientific researchers focus on the conversion of CO2 into high added-value chemicals. Unfortunately, CO2 is a very stable compound because of its highly oxidized state and thermodynamical stability, and the conversion and utilization of CO2 generally demand large energy input, that is, highly active reactants and catalysts are required to provide the necessary energy or depress the activation energy barrier [1,2]. For the typical CO2 transformation and utilization, the reductive transformation products may be methanol, formates, methane, while the organic carbonates, carbamates, ureas, carboxylates, polyurethanes, and polycarbonates could be gained through the non-reductive transformation. Since the non-reductive transformation need less energy than that of the reductive conversion, the conversion of CO2 to organic carbonate tends to be one of the economically non-reductive transformations, is desirable and promising [1], [3]. As the simplest and most industrially important organic carbonate, dimethyl carbonate (DMC) has been widely used in agrochemical and pharmaceutical industries because of its low toxicity and bioaccumulation, excellent biodegradability and solubility [4,5]. The DMC molecule contains several organic functional groups including methoxy, carbonyl and methyl groups, which could be used as a potential building block in the methylation [6–8] and carbonylation [9,10] reactions for replacing toxic precursors such as dimethyl sulfate (DMS) and phosgene [11]. Moreover, DMC may serve as a fuel additive to reduce CO, SOx and NOx emissions due to its high octane number (105) and oxygen content (53%) [12,13], and as an electrolyte in lithium-ion batteries for its low viscosity and eminent solubility [14,15]. DMC can be synthesized by various methods such as phosgenation, methanol oxidative carbonylation with CO, transesterification of propylene carbonate/ethylene carbonate with methanol, urea methanolysis and direct synthesis from CO2 and methanol [16–23]. Notably, the direct synthesis of DMC from CO2 and methanol was the most preferred route as it adheres to green chemistry principles [24]. This may actualize both the high-value utilization and chemical fixation of CO2, thereby alleviating the greenhouse effect. If DMC is produced via the direct synthesis route, some thermodynamics and kinetics constrain the synthesis process and industrial application of DMC [3,25]. In order to surmount these obstacles during the DMC synthesis, various highly active catalysts were prepared to promote the reaction system, and both the homogeneous and non-homogeneous catalysts were used for this reaction, such as K2CO3, KOH, n-Bu2Sn(OMe)2, ionic liquid, ZrO2, cerium-zirconium solid solution, CeO2-CaO, Y2O3, FexY1−xOy, Cu/CeO2, Co1.5PW12O40, and many other catalysts [12,16,17,20,26–39]. Meanwhile, CeO2 possesses a high density of Lewis acid-base sites and a corrugated surface atomic structure, which might enhance the reaction rate of CO2 and monohydric alcohols to organic carbonates by providing selectively catalytic sites to activate CO2 and forming energetically favorable carbonate intermediate [40]. Moreover, CeO2 has been synthesized with different morphologies including nanorod, nanocube, and nanooctahedron for use as catalyst or support. Based on the amount of acid-base active sites and oxygen vacancies, the activity order of C-O oxidation reactions on the CeO2 nanocrystal surface should obey nanorod > nanocube > nanooctahedron, and the CeO2 nanorods exhibited the highest reaction activity among all the prepared samples [13,41]. Currently, the direct synthesis DMC from CO2 and methanol under traditional conditions is generally hindered by the unfavorable solubility of CO2 in methanol, resulting in insufficient contact and activation between CO2 and the prepared catalyst. It is reported that the CO2 solubility in methanol tends to grow with increasing reaction pressure [42,43], and the CO2 solubility in methanol could obtain larger increasement when the reaction pressure exceeds its critical pressure, which can be easily calculated from the experimental data in Ref. [42]. Therefore, we proposed a dual supercritical condition for the direct DMC synthesis from CO2 and methanol. Meanwhile, the actual reaction partial pressures of CO2 and methanol surpass their critical pressures (7.1 MPa and 8.1 MPa). Since the supercritical fluids have strong solubility and excellent diffusion property, the dual supercritical conditions will undoubtedly increase the CO2 solubility in methanol, which can potentially facilitate the contact between CO2 and methanol and thus improve the reaction efficiency as expected. In our previous study [16], a dual supercritical conditions strategy was proposed to facilitate the synthesis of dimethyl carbonate (DMC) from CO2 and methanol, and the dual supercritical conditions were defined as: the synthesis temperature was higher than the critical temperatures of each reactant (>239 ℃), and the partial pressure for each reactant constituent was larger than its partial critical pressure (PCO2 > 7.4 MPa and Pmethanol > 8.1 MPa), respectively. However, direct synthesis DMC using CeO2 catalysts under dual supercritical conditions has not been reported. Moreover, the nanostructures of the CeO2 catalysts may become less stable and tend to sinter or dissolve under the high operation temperature restricted by the stringent dual supercritical states (>239 ℃). And the micro/nanostructured CeO2 was found to enhance the stability, reusability and may simplify the processing procedures without losing its instinct merits derived from basic units [44], this will prompt us to conduct this study. In this study, the CeO2 catalysts with different morphologies were designed and prepared for directly synthesizing DMC under the dual supercritical conditions. We using hydrothermal synthesis methods to prepare CeO2 catalysts with flower morphology, and also compared with amorphous and nanorod CeO2 catalysts for the experiment. The effects of catalyst surface acidity and the number of oxygen vacancies on the reaction performance of DMC synthesis from CO2 and methanol in the dual supercritical system were investigated through the experimental characterizations. In addition, the kinetic model of the direct synthesis DMC under dual supercritical conditions can provide some theoretical basis, so we have derived and discussed the kinetic model based on the Langmuir-Hinshelwood and used it to investigate the reaction mechanism of the direct DMC synthesis. 2 Materials and methods 2.1 Catalyst preparation Different methods were used to for the prepare CeO2 catalysts with different morphologies, meanwhile the amorphous CeO2 catalyst was directly calcined from cerium nitrate hexahydrate (Ce(NO3)3·6 H2O, Sinopharm Chemical Reagent Co., Ltd, AR) at 550 °C for 4 h in air, and Ceria-flower (CeO2-F) and Ceria-nanorod (CeO2-R) were synthesized by the hydrothermal methods. Firstly, Ce(NO3)3·6 H2O of 2.604 g was filled in a beaker, added with 60 mL ethylene glycol (Sinopharm Chemical Reagent Co., Ltd, AR) and 10 mL deionized water and stirred at room temperature for 30 min. Next the mixture was transferred to a 100 mL Teflon bottle for 1 h ultrasonic processing, and put into a stainless steel autoclave and sealed. Then the autoclave was placed in an electric blast drying oven at 180 ℃ for 24 h. After cooled and vacuum filtered, the sample was washed with deionized water and ethanol three times, and placed in an electric blast drying oven at 100 ℃ for 12 h. Eventually, the dried powder was calcined in a muffle furnace at 500 °C for 3 h to obtain the expected CeO2-F catalyst. For the preparation of CeO2-R, first dissolved 6.4 g NaOH and 3.0 g Ce(NO3)3·6 H2O in 40 mL and 30 mL deionized water, respectively. After stirring separately for 10 min, the two solutions were mixed slowly to gain a purple slurry. Next the slurry was stirred at room temperature for 30 min, after 1 h ultrasonic processing, and then transferred to a 100 mL Teflon bottle. Similarly sealed in an autoclave and placed in an electric blast drying oven at 100 °C for 24 h. After cooling, the powder was filtered under vacuum and washed three times with deionized water and ethanol, and dried in an electric blast drying oven at 100 ℃ for 12 h, and then calcined at 600 ℃ for 5 h to get the CeO2-R sample. The synthesis conditions of the catalysts with different morphologies were listed in Table 1. 2.2 Catalyst characterizations The powder X-ray diffraction patterns for the prepared catalysts were analyzed by a X-ray diffractometer (Rigaku Smart LAB SE, Japan) with Cu Kα radiation. Meanwhile the 2θ range was 15°− 85°, and the scan speed and step size were set as 5°/min and 0.02°, respectively. The crystalline grain size of the samples was calculated and estimated by the Scherrer equation. The particle size and appearance for different CeO2 catalysts were observed by scanning electron microscope (SEM) (Zeiss Sigma 300, Germany) at an accelerating voltage of 5.00 kV. The morphology micrographs of the CeO2 samples were taken by transmission electron microscope (TEM) (FEI Tecnai G2 F20) by using an accelerating voltage of 200 kV. The N2 adsorption-desorption experiment was conducted on ASAP 2460 (Quantachrome Instrument, USA). Before the test, the samples were pretreated at 200 ℃ for 8 h under vacuum to remove the surface contaminants. Using the standard Brunauer-Emmett-Teller (BET) and Brunauer-Joyner-Hallenda (BJH) methods, the specific surface area and pore size ( Table 2) of the catalysts were acquired at − 196 ℃, and the pore size distribution was shown in Fig. S1 in the Supporting information. X-ray photoelectron spectroscopy (XPS) was detected on a Thermo ESCALAB 250Xi (Thermo Fisher Scientific, USA) spectrometer under a vacuum atmosphere with monochromatic Al Kα (1486.8 eV) as the source, and the XPS curves at 100 eV and 30 eV were recorded for the full spectrum and elemental high-resolution spectrum, respectively. The C1s line (284.8 eV) was taken as a reference to correct for electrostatic charging. H2 temperature-programmed reduction (H2-TPR) was measured with Quantachrome CBT-1 (Quantachrome Instrument, USA) to investigate the redox property of CeO2 samples, and the thermal conductivity detector (TCD) in this instrument was exploited to monitor the H2 consumption. Typically, about 50 mg of sample was placed into the U-shaped quartz tube and pretreated at 400 ℃ under He atmosphere, after maintaining this temperature for 30 min, the U-shaped quartz tube was cooled down to 50 ℃. Afterwards the H2 was introduced for 30 min, and then the sample was heated from 50 ℃ to 900 ℃ with a ramp rate of 10 ℃/min. Temperature-programmed desorption of NH3(NH3-TPD) was conducted on the MicrotracBEL-BELCAT II (MicrotracBEL, Japan) to determine the acidity amounts of the CeO2 catalysts. Meanwhile the 50 mg sample was heated to 500 °C for 30 min in He atmosphere and then cooled to 50 °C. Next the sample was adsorbed by 7.5% NH3/He for 60 min and then purged with He for 30 min. Finally, the sample was desorbed by heating up to 950 °C at a heating rate of 10 °C/min. Temperature programmed desorption of CO2 (CO2-TPD) was carried out on the MicrotracBEL-BELCAT II (MicrotracBEL, Japan) to detect the basic amounts of the CeO2 catalysts. The operation procedure was the same with NH3-TPD. 2.3 Catalyst evaluation All reactions for the direct synthesis DMC were carried out in a 100 mL autoclave equipped with an electromagnetic stirrer and thermocouple, and the temperature and stirring speed were regulated by a controller. Firstly, added 1 g prepared catalyst and 30 mL methanol (Sinopharm Chemical Reagent Co., Ltd, AR) into the autoclave (In our tests, about 30 mL (743 mmol) methanol added in the 100 mL autoclave could get the supercritical condition), then sealed the reactor and replaced the air with CO2 three times. After heating the system to the desired temperature, CO2 was gradually introduced into the reactor to increase the desired pressure. When the temperature and pressure in the autoclave were stable, the heater was turned off after the reaction proceeded for a period of time. Next the autoclave was cooled to room temperature and fully decompressed after the direct synthesis reaction completed, and the liquid phase product was quantified by adding 1 g 1-Butanol (Sinopharm Chemical Reagent Co., Ltd, AR) as an internal standard and stirred thoroughly. A capillary column KB-1701 (30 m × 0.32 mm × 0.50 µm) was employed to separate the liquid phase samples, and a Gas chromatograph with a flame ionization detector could actualize the analysis for methanol and DMC. The related experimental procedure was depicted in Fig. 1. The equation for DMC synthesis from CO2 and methanol as reactants was described as follows: (1) 2 CH 3 OH + CO 2 ⇌ CH 3 O 2 CO + H 2 O Meanwhile, the DMC yield was calculated using the following equation: (2) DMC yield mmol g ∙ catalyst = DMC produced mmol Catalyst g By using GC-MS for the sample analysis, the results manifested that only small impurity peaks could be observed, and the total peak area of these impurities is less than 3% that of the DMC (see the added carbon balance data in Supporting information Table S1). The methanol conversion could be expressed based on the equation below: (3) Methanol conversion % = 2 × DMC produced ( mmol ) Initial methanol ( mmol ) × 100 3 Results and discussion 3.1 Catalyst morphologies analysis The CeO2 catalysts with different morphologies were observed by SEM and TEM, and the images were shown in Fig. 2. In Fig. 2(a) - (b), the CeO2 sample calcined from cerium nitrate (Ce(NO3)3·6 H2O) displayed a blocky structure with irregular shape surface, CeO2 (HRTEM image in Fig. 2(c) was (111) planes with an interplanar spacing of 0.31 nm calculated from the FFT pattern (Fig. 2(c)), and the selected area electron diffraction (SAED) pattern showed concentric circles. Fig. 2(d) - (e) disclosed the synthesized CeO2 nanorods with clustered structure. Even when the prepared nanorods gathered together, the resulting agglomerate still remained porous instead of close packed (Fig. 2(d)) [45], leading to the increased specific surface area of CeO2-R. The HRTEM image (Fig. 2(f)) revealed that the nanorod exposed a large amount of (110) planes with an interplanar spacing of 0.19 nm, and the selected area electron diffraction (SAED) pattern showed concentric circles, this means that it was polycrystalline. It was evident from Fig. 2(g) that the sectional view of the prepared CeO2-F (flower) exhibited as a layered accumulation, and the top view of CeO2-F appeared a distinct defection in the central area, indicating that the formation process of flower morphology could be explained as a triangular flake assembly [46]. TEM analysis was carried out to obtain the microstructure of a few selected samples. Fig. 2(h) presents the TEM image of the spheres, which shows a much darker and brighter contrast in the periphery and central part, respectively, confirming their hollow characteristics. CeO2-F HRTEM image in Fig. 2(i) was (110) planes with an interplanar spacing of 0.19 nm calculated from the FFT pattern. The selected area electron diffraction (SAED) pattern showed spots, different of the concentric circles obtained from CeO2, indicating the presence of single crystal CeO2. Since inorganic single crystals have highly reactive surfaces [47] and regular and periodic arrangement of the inner particles. CeO2-F may expose more (110) planes. And the literature also shows that [20] the CeO2 (110) planes exhibits the lowest energy of formation of oxygen vacancy (+43.8 kcal·mol−1). This may result in higher concentration of oxygen vacancies and allow CeO2-F to have superior catalytic properties. 3.2 XRD analysis of prepared catalyst The XRD patterns of all synthesized catalysts were shown in Fig. 3. It can be seen from the figure that the characteristic peaks for CeO2 appeared at 28.6°、33.1°、47.6°、56.6°、59.2°、69.6°、76.8°, and 79.3°, which could be ascribed to (111), (200), (220), (311), (222), (400), (331), and (420) planes, respectively. This might be attributed to the cubic fluorite structure (unit cell parameter: a = 0.540 nm, space group of Fm−3m of CeO2. As a result, CeO2-F presented the weakest and broadest peak among all the prepared catalysts, signifying the existence of the smallest average crystallite size (7.6 nm), while the directly calcined CeO2 exhibited the sharpest peak with the highest intensity, indicating its largest average crystallite size accordingly. Table 2 summarized the average crystallite sizes (determined from the full width at half maximum) and crystallinity (determined from the peak intensity) of the prepared CeO2 with various morphologies [41], whose order was CeO2 >CeO2-R>CeO2-F, and the average crystallite sizes for CeO2-F and CeO2-R were close to those reported in the literature [46,48]. And CeO2-F has the largest specific surface area, surface area is related to crystal size of oxide, the smaller the crystal size, the higher surface area [1], this is also proved by the XRD calculation results. 3.3 Acid-base site detection by NH3/CO2-TPD It was reported that the weak and moderate basic-acidic sites of the catalysts as the key factors affecting the yield of DMC [49–51]. To further explore the acid-base properties of the surface, the NH3-TPD and CO2-TPD were employed to investigate the acidity and basicity of the prepared CeO2 samples with different morphologies, and the results were shown in Fig. 4. From Fig. 4(a) we can find that the desorption peaks of NH3-TPD at 50 – 200 ℃, 200 – 400 ℃ and > 400 ℃ belonged to the weak, medium and strong acidic sites, respectively, which were consistent with the desorption peaks of CO2-TPD. From the amount of NH3 desorbed at these acidic sites listed in Table 3, the weakly acidic behavior sites exhibited relatively large concentration in all three morphologies of CeO2, and the acidic sites were CeO2-F>CeO2-R>CeO2 in order, whose NH3 adsorption intensity (weak, medium, and strong) was in accordance with the trends of total acidity contents. The basic sites played a crucial role in the CO2 conversion and DMC formation [51,52], and the CO2-TPD characterization results were shown in Fig. 4(b) and Table 4. It could be revealed that CeO2-F possessed the largest number of weak and medium basic sites that followed the order of CeO2-F>CeO2-R>CeO2. Notably, the weak and medium basic sites were responsible for the activation of CO2 and contributed to the formation of methoxy groups in the DMC synthesis process, whereas the desorption for the product was difficult from the strong basic sites of the catalyst, and thus the DMC preparation may possibly occur at the weak and moderate basic sites [53]. Based on Lewis acid-base catalytic mechanism for the DMC synthesis, methanol and CO2 were activated by adsorption on Lewis acid-base sites, forming the active intermediates and then interact with each other to produce DMC and H2O [54]. During the reaction, the H atoms in the methanol can combine with the lattice oxygen on the catalyst surface, eventually the methanol dissociated into the adsorbed states -OCH3 and -H [55], while the CO2 adsorbed on the catalyst surface may be accomplished by the combined action of Lewis acidic and basic sites. Moreover, the unsaturated lattice oxygen on the coordination surface might provide electrons to the C-atoms in CO2 as Lewis basic sites, and CO2 could be adsorbed on the acid-base sites in a bidentate adsorption state. Meanwhile the C-O bond distance of CO2 in this adsorption state increases and the O-C-O bond angle decreases, this activates the CO2 molecule [56]. Therefore, the content of surface acid-base sites for the catalyst manifested its great influence on the DMC yield, and the CeO2-F catalyst was proved to own eminent acid-base active sites by characterization results, which may to the benefit of its prominent catalytic activity under the dual supercritical conditions. 3.4 Confirmation of oxygen species by XPS and H2-TPR analysis The surface oxygen species for CeO2 catalysts with different morphologies were detected and investigate by XPS, and the XPS spectra of Ce 3d and O 1 s were shown in Fig. 5. Fig. 5(a) depicted the Ce 3d spectra of the prepared catalysts, which can be fitted to eight peaks: V(∼882.2 eV), V′(∼884.2 eV), V″(∼888.5 eV), V‴(∼898.1 eV), U(∼900.6 eV), U′(∼902.4 eV), U″(∼907.2 eV), U‴ (∼916.4 eV), meanwhile the 4 U and 4 V bands represent the Ce 3d3/2 and Ce 3d5/2, respectively. Importantly, the 3d104f0 state of Ce4+ species were labeled as U‴, U″, U, V‴, V″ and V, whereas the 3d104f1 state of Ce3+ species were represented as U′ and V′ [13,57]. In addition, the V′ and U′ peaks can be used to quantitatively estimate the concentration ratio of Ce3+ to total Ce ions by calculating the area ratio between the V′, U′ peaks and the overall area of eight peaks based on the following equation: (4) C Ce 3 + % = A Ce 3 + A Ce 3 + + A Ce 4 + × 100 % where A Ce 3 + = A V ' + A U ' ; A Ce 4 + = A V + A V '' + A V ''' + A U + A U '' + A U ''' . A Ce 3 + : Peaks areas of Ce3+. A Ce 4 + : Peaks areas of Ce4+. In Table 5, the Ce3+ concentrations for the CeO2, CeO2-R and CeO2-F catalysts were 5.58% ± 0.21, 17.03% ± 0.15% and 17.99% ± 0.32, respectively. The presence of Ce3+ could generate oxygen vacancies on the catalyst surface, and the oxygen vacancy concentration would grow as Ce3+ concentration increases [13], which was also testified by the XPS analysis results in Table 5. Moreover, the formation of oxygen vacancies may produce two unpaired electrons, encouraging the transformation from Ce4+ to Ce3+. Among the prepared CeO2 catalysts with different morphologies, the CeO2-F sample had the largest Ce3+ content and thus possessed the highest concentration of oxygen vacancies. Significantly, some scholars reported that oxygen vacancies were beneficial to the chemisorption of oxygen [58], thus the CeO2 rich in Ce3+ may have better absorption capacity for oxygen-containing species. And the oxygen vacancies on the CeO2 surface can enhance the conversion and activation of CO2 according to DFT calculation results [59,60]. Fig. 5(b) depicted the O 1 s spectra of the synthesized catalysts, exhibiting three oxygen species on the catalyst surface. The binding energy peaks at ∼529.2 eV and 530.2 eV were attributed to the surface lattice oxygen (OL) and O component associated with the O2− in surface oxygen vacancies (OV), respectively. The binding energy peaks at ∼531.5 eV could be ascribed to the surface chemisorbed oxygen (OC) including OH-, CO3 2- and O2-, etc [61,62]. Meanwhile, the oxygen vacancy concentration can be calculated by the peak area integration using the following Eq. (5), and the content of each oxygen species in the catalysts after the split-peak fitting calculation was tabulated in Table 5. (5) C O V % = A O V A O V + A O L + A O C × 100 % Where A O L , A O V and A O C represent the peak areas of lattice oxygen, surface oxygen vacancies and chemisorbed oxygen. From the table we can see that the oxygen vacancy concentrations in the prepared catalysts including CeO2, CeO2-R and CeO2-F were 3.22% ± 0.31, 13.56% ± 0.24% and 16.62% ± 0.38, respectively, which was coincident with the XPS results of Ce3+ content, further revealing that the reduction process of Ce4+ to Ce3+ might facilitate the unpaired electrons to create surface oxygen vacancies [63,64]. Moreover, the oxygen storage capacity (OSC) of the CeO2 with different morphologies was studied and analyzed by H2-TPR, and the results were shown in Fig. 6. Since CeO2 is a typical rare earth material and the element Ce has unfilled 4 f orbitals, under oxidation or reduction process, there is a rapid transition between Ce3+ and Ce4+ to form oxygen vacancies, and with the free electrons gather in the oxygen vacancies will promote the adsorption and activation of molecular oxygen, and finally improve the oxygen storage and release capacity of the catalyst. From Fig. 6 we observed that two obvious reduction peaks appeared at 300 ℃− 600 ℃, which can be divided into α and β peaks according to the literature [65]. Meanwhile the α and β peaks were considered to be caused by the oxygen vacancies and lattice oxygen reductions on the CeO2 surface, respectively. According to the quantitative analysis results tabulated in Table 5, the oxygen vacancy contents on the surfaces of CeO2, CeO2-R and CeO2-F were 0.07 ± 0.002 mmol/g, 0.11 ± 0.003 mmol/g and 0.14 ± 0.002 mmol/g, and the lattice oxygen concentrations were 0.42 ± 0.003 mmol/g, 0.44 ± 0.002 mmol/g and 0.52 ± 0.004 mmol/g, respectively, which was in reasonable agreement with the results of XPS analysis. Therefore, CeO2-F owned the higher OSC and reduction ability with the largest peak area (α + β) due to the decreased crystallite size [65]. The characterization results reveal that the three prepared catalysts are pure CeO2 phases without any impure atom dopant. Additionally, SAED results illustrate that only CeO2-F has single crystals diffraction spots, while the rest catalysts are polycrystalline. The FFT patterns reveal that both CeO2-F and CeO2-R expose (110) planes, but CeO2 is (111) planes. Many literatures convince that the CeO2 (110) surface exhibits the lowest formation energy of oxygen vacancy (+43.8 kcal·mol−1) [20], which may facilitate more oxygen vacancies generation. Moreover, the oxygen species were measured by XPS, and the results confirm that the oxygen vacancy concentrations obey the order: CeO2-F>CeO2-R>CeO2. Moreover, the oxygen species were measured by XPS, and the results confirm that the oxygen vacancy concentrations obey the order: CeO2-F>CeO2-R>CeO2. Since inorganic single crystals have highly reactive surfaces [47] and regular and periodic arrangement of the inner particles. CeO2-F may expose more (110) planes, resulting in higher concentration of oxygen vacancies. Furthermore, the N2-TPD and NH3/CO2-TPD results confirmed the same trend (CeO2-F>CeO2-R>CeO2) in terms of specific surface area and acid-base site concentration, respectively. 3.5 Catalytic activity evaluation Due to the unique characteristics in the supercritical fluids, several dual supercritical conditions were attempted to be employed in extraction and transesterification reactions [66,67]. Nevertheless, few scholars reported the supercritical methanol condition that participated in the DMC synthesis. According to our previous studies [16], the DMC synthesis yield using dual supercritical conditions could be significantly improved compared to that of the supercritical CO2 conditions, and thus we still use the dual supercritical conditions (T > 239 ℃, PCO2 > 7.4 MPa and Pmethanol > 8.1 MPa) to evaluate the catalytic performance of the prepared CeO2 samples. As a result, the catalytic performances of CeO2 with different morphologies were measured based on DMC yield, and the experimental results were illustrated in Fig. 7. In Fig. 7(a), the DMC yield grew as the reaction time extended at initial stage (within 1 h) under the setting reaction temperature and pressure, while the DMC yield dropped sharply after the reaction time exceeding 1 h, and the highest DMC yield for CeO2-F could achieve 3.11 mmol/gcat. at 250 °C. The reason for the rapid decrease of DMC yield after 1 h may be attributed to its hydrolytic at high temperatures [68]. By analyzing the samples after 1 h, the amount of methanol increased when the reaction exceeded 1 h, which further confirmed the assumptions. In Fig. 7(b), the catalytic performance of the prepared CeO2-F under supercritical CO2 conditions was also estimated, revealing the highest DMC yield was 1.48 mmol/gcat. at 110 °C for 6 h. Moreover, a few catalytic performance assessments on CeO2 with different morphologies were experimentally investigated, and the results were depicted in Fig. 8(a). It can be found from the figure that both CeO2-F and CeO2-R displayed good catalytic activity under the supercritical CO2 phase, whose maximal yield of DMC (both CeO2-F and CeO2-R) may reach 1.48 mmol/gcat., and the DMC yield for the amorphous CeO2 was only 1.05 mmol/gcat. Under dual supercritical conditions at 250 °C for 1 h, CeO2-F exhibited the top catalytic activity as expected, and the DMC yield and methanol conversion can achieve 3.11 mmol/gcat. and 0.84% respectively, which were 2.11 and 1.75 times than those under single supercritical CO2, verifying the eminent promotion of dual supercritical conditions in catalytic performance accordingly. For the prepared CeO2-R in Fig. 8(a), the DMC yield was 2.88 mmol/gcat. in dual supercritical fluids, indicating CeO2-F outperformed CeO2-R in the reaction, and the detailed experimental data were available in Fig. S2-S3 (Supporting information). Unfortunately for the amorphous CeO2 catalyst, its DMC yield and methanol conversion were respectively 2.27 mmol/gcat. and 0.61% under dual supercritical conditions, and the DMC yield in single supercritical CO2 could only reach 1.05 mmol/gcat., gaining approximate 1/3 yield and methanol conversion of CeO2-F under dual supercritical conditions (3.11 mmol/gcat. and 0.84%). Therefore, the CeO2-F catalyst can significantly improve both DMC yield and methanol conversion compared with the amorphous CeO2, proving its predominant catalytic performances, which was also in reasonable agreement with the characterization results of the prepared catalysts. This might be because CeO2-F owned the largest oxygen vacancy concentration (Table 5) and acid-base active sites (Tables 3 and 4), which tended to stimulate the adsorption activation of methanol and CO2. Since CO2 and methanol in the supercritical conditions had excellent solubility and diffusivity, the number of hydrogen bonding in methanol might decline under the supercritical state, which could isolate methanol as the individual molecule to react with CO2 and more easily adsorb on the catalyst surface [69], resulting in a more favorable interaction with each other. In addition, we also compared with some literatures and the results such as Table S2, we can see that relatively long reaction times were required to obtain high DMC yields, regardless of the CeO2 catalyst or other types of catalyst, and the maximum yield of DMC was 2.92 mmol/gcat. (T = 120 °C, P = 15 MPa, T = 24 h), which is a high yield obtained under prolonged high pressure conditions, but we achieved DMC yield was 3.11 mmol/gcat. in only 1 h under dual supercritical conditions. If the industrialization process to maintain high temperature and pressure conditions for a long time required more stringent experimental equipment, which was a serious disadvantage for industrialization. According to our theoretical and experimental studies, not only the reaction time is significantly reduced, the higher DMC yield can be achieved in only 1 h under dual supercritical conditions, it also does not require stir equipment. This may solve the problem of batch production in the future and bring more possibilities to industrialization. Under the same conditions (P = 16 MPa, T = 250 °C, reaction time 1 h), the repeated use experiments of three consecutive cycles for the as-prepared CeO2 samples were performed to estimate the stability of the catalysts. After each run, the catalyst was separated from the product, and reused for the next cycle when the desiccation and calcination processes were completed. In Fig. 8(b), the cycle test results showed that the catalytic activities for CeO2-F, CeO2-R and CeO2 decreased 4.8%, 8.7% and 13.9% respectively, signifying that CeO2-F catalyst behaved an outstanding recycle stability with less than 5% performance degradation. Moreover, the XRD pattern of the as-prepared CeO2 after the cycling test (Fig. S4) can disclose the reason. Meanwhile, both the spent CeO2-R and CeO2 exhibited sharp peaks with relatively high intensities, indicating their average crystallite sizes increased compared to the fresh catalysts. As shown in Fig. S5, the SEM images of CeO2-F presented an insignificantly morphology change before and after DMC reaction, whereas the overall morphology of CeO2-R became more compacted and gathered much tighter, which may be due to the high operation temperature restricted by the stringent dual supercritical states. In brief, these recycle use results convinced the relatively stable catalytic activity for the CeO2-F catalyst as desired. In addition, the amounts of reactants and products are carefully measured to ensure the material balance. 3.6 Dual supercritical conditions comprehensive performance evaluation Direct synthesis of DMC from CO2 and methanol using dual supercritical conditions has shown satisfactory results, while to compare and analyze the real benefit of dual supercritical conditions, a lot of factors need to be included, such as reaction time, temperature, pressure, DMC yield, conversion of methanol and equipment investment, etc. A multi-element valued model [70] was applied to achieve the performance comparison and assessment of 4 different reaction conditions. The synthesis methods for non-supercritical, supercritical methanol, supercritical CO2 and dual supercritical conditions being assessed were denoted as R= [C1, C2, C3, C4]. The main evaluation indices were P1-operating cycle time/h, P2-operating temperature/°C, P3-operating pressure/MPa, P4-DMC yield/mmol, P5-conversion of methanol/% and P6-equipment investment/CNY. The respective indices were used to form the dimensionless matrix was R, the detailed data was available in the Table S3 of Supporting information. Based on analytic hierarchy process (AHP) [71], The judgment of importance f uj u i between coupled factors were shown in the Table S4 of Supporting information, the assessment matrix B ij was formulated as the follows: (6) B ij = f uj u i f ui u j , i , j = 1 ∼ 6 So, the assessment matrix which was used to judge the weight of the target scheme was given as B. The data in matrix R were taken from our experimental results (Table S3), where the rows of R indicate the different evaluation indicators and columns indicate the different schemes. Matrix B represents the comparison of importance between different evaluation indicators (Eq. (6)), whose results were referenced to the firm’s production costs. R = [ 0.200 0.200 0.167 1.000 1.000 0.458 1.000 0.440 1.000 0.444 0.500 0.250 0.300 0.431 0.476 1.000 0.345 0.429 0.560 1.000 1.000 0.500 0.395 0.286 ] B = [ 1 2 2 1 / 2 1 1 / 2 1 / 2 1 1 1 / 5 1 / 2 1 / 5 1 / 2 1 1 1 / 5 1 / 2 1 / 5 2 5 5 1 2 1 1 2 2 1 / 2 1 1 / 2 2 5 5 1 2 1 ] The maximal eigenvalue of B is λ max = 6.0111 , the dimension n is 6, the coincidence indicator is: (7) CI = λ max − n n − 1 = 6.0111 - 6 6 − 1 = 0.00222 The average random coincidence indicator RI for 6 × 6 matrix is 1.24, and the ratio CR is it’s coincidence indicator, CR = CI / RI = 0.0018 < 0.1 , it means the assessment matrix B formed is consistent and acceptable. The eigenvalue corresponding λ max is accordingly the weight of indices, the normalized result is: (8) D= [0·1382 0·0641 0·0641 0·2177 0·1382 0·2977] According to the weight of the model, the objective function X j was given out, and the integrate superiority for schemes were expressed as follows: (9) X j = ∑ i = 1 6 D i R ij where X j is the integrate superiority of the j-th scheme, Di is the weight for the i-th index and R ij is the i-th index for the j-th scheme. The calculated integrate superiority of the 4 schemes ware C1 = 0.5906, C2 = 0.4219, C3 = 0.4559, C4 = 0.7034, where the integrate superiority of C4 is significantly higher than the other schemes. The results of the superiority calculations show that the dual supercritical conditions have relatively advantageous and worth considering, and provide an important theoretical basis for future research. 4 Reaction mechanism and kinetic analysis 4.1 The proposed catalytic mechanism for synthesis DMC Based on our previous study [72–74], the catalytic mechanism of direct synthesis DMC from CO2 and methanol under dual supercritical states was proposed after deep analysis and discussion. As shown in Fig. 9, the catalytic reaction for DMC synthesis proceeded as follows: firstly, an O atom from CO2 may enter an oxygen vacancy in the CeO2 and was adsorbed on the catalyst surface, then a bridging carbonate or bidentate carbonate structure was formed after the C atom in the CO2 interacting with the lattice oxygen on the catalyst surface [13]. During the next procedure, Lewis acid site on the catalyst surface would adsorb the O atom in the methanol, while the H atom from the methanol could also combine with the lattice oxygen on the catalyst surface, afterwards the methanol dissociates into the adsorbed active intermediate, completing the activation of the reactant molecule [55]. Next, the obtained active intermediates of CO2 and methanol further react to form the methyl carbonate, which subsequently combines with the activated methanol to produce the desirable DMC, and the former O atom inserted into the oxygen vacancy becomes the lattice oxygen on the CeO2 surface, replacing the original oxygen vacancy that lost before. Finally, the H+ atom dissociated from methanol interacts with the lattice oxygen on the CeO2 surface to produce H2O molecule, generating another oxygen vacancy simultaneously [75,76]. The H2-TPR and XPS characterization results (Table 5) confirmed that the prepared CeO2 samples was rich in oxygen vacancies and lattice oxygen on the catalysts surface, and the concentrations of both oxygen vacancies and lattice oxygen could affect the formation of DMC [77,78]. Meanwhile, Ce3+ and Ce4+ in the CeO2 behaved the advantages of rapid and reversible transformation, thus facilitated the generation of a certain number of oxygen vacancies on its surface of metal oxides, which will promote the activation of CO2 [79,80] and was further verified by DFT calculation results in the literature [81], signifying that the C-O bond cleavage on oxygen vacancies required lower activation potential energy than that of on the metal cations. Consequently, the oxygen vacancies on the CeO2 surface were considered to serve as the active center for catalyzing direct synthesis DMC from CO2 and methanol, which further promoting the activation of CO2 and reaction rate. 4.2 Kinetic model establishment and analysis The kinetic mechanism with its models are generally used to describe and predict the actual reaction process of direct synthesis DMC from CO2 and methanol, whose theoretical elucidation and model parameters can be obtained and testified by the experimental data. According to our proposed synthesis mechanism of DMC, both activation and reaction processes of all substances occur on the catalyst surface, which may provide the essential place for the occurance of rate-controlling step during the reaction. This is consistent with the Langmuir-Hinshelwood (LH) and Eley-Rideal (ER) mechanisms proposed in the literatures [25,45,62,82]. Theoretically, the LH mechanism assumes that CO2 and methanol could be interacted with the prepared catalyst in the corresponding step 1 and 2 respectively, meanwhile the CO2 adsorption and activation rates may possibly determine the DMC yield [45]. While the ER mechanism ignores the CO2 activation process on the catalyst surface, supposing that CO2 reacts directly with the activated CH3OH adsorbed on the catalyst surface, and the CH3OH adsorption seems to be much stronger with the CH3OH* and CO2 combination as the rate-determining step [34]. Accordingly, we have reason to suspect that the ER mechanism is not sufficient to account for the kinetic process of catalytic synthesis DMC in the dual supercritical conditions, which is mainly due to ignoring the adsorption and activation of CO2 on the catalyst surface even if they are much weaker than those of methanol. For the model establishment and deduction in this study, we firstly hypothesized each reaction step as the rate-determining step, suggesting that other steps preceded very quickly, and the reaction rate of each deduced step can be expressed in terms of the concentrations of reactants and catalysts. After meticulous deduction and calculation procedures(in the Supporting information), we can acquire the rate equations under various rate-determining steps by using LH and ER mechanisms, and the results were tabulated in Table 6. Since few related kinetic investigation on the direct synthesis DMC from CO2 and methanol under dual supercritical conditions is reported, it is vital significance to investigate and determine the rate-controlling step and model parameters, which can precisely describe and predict the direct DMC synthesis process, expecting to improve the DMC yield and methanol conversion effectively, and providing data for future industrialization. 4.3 Determination of rate-controlling step and model parameters To explore the kinetic mechanism of direct synthesis DMC from CO2 and methanol under dual supercritical conditions, we experimentally studied and determined the rate equation and model parameters for the prepared CeO2-F, CeO2-R and CeO2 catalysts. Due to the discontinuous detection and varying reaction pressure inside the intermittent reactor, the kinetic experiments were conducted to measure the reaction rate based on the DMC yield within the prescribed time, using the ice water bath for instant cooling of the DMC samples inside the autoclave. According to the experimental results (Fig. S6 in the Supporting information), the reaction rate (dCDMC/dt) was calculated on the basis of the DMC yields at 30 min (reaction time) for different catalysts, and the apparent activation energies of CeO2 with different morphologies were obtained according to the fitting lines of Arrhenius equation ( Fig. 10(a)). Meanwhile, the apparent activation energies under dual supercritical conditions of CeO2-F, CeO2-R and CeO2 were 45.9 kJ/mol, 48.3 kJ/mol and 66.9 kJ/mol respectively, suggesting that the CeO2-F structure can boost the catalytic activity of ceria beyond its improvement in surface area. Although the reaction rate constant was essentially controlled by temperature, pressure and activation energy, the overall reaction rate was also affected by the reactant concentration and catalyst loading [45]. Generally, the kinetic equation for evaluating the DMC conversion could be expressed as: (10) Rate = k * a CH 3 OH b CO 2 c Where k is the rate constant for the overall reaction; [*] denotes the active site concentration for the prepared catalyst, calculated on the unit mass of the added catalyst; a, b and c represent the reaction order determined by experimental data. Due to the micron/nanostructural catalyst particles used in DMC synthesis, the internal diffusion can be neglected during the reaction process. Since the external diffusion was closely related to the turbulence degree of the reactants, the effect of stir speed on the DMC yield was studied and the results were listed in the Table S5. It can be concluded from the table that the DMC yield almost remained unchanged with various stir speed, even without stir, implying that the external diffusion effect was negligible under the dual supercritical conditions. Afterwards, a few experiments with different reactant concentrations and the amount of catalyst were carried out, and the corresponding kinetic curves were plotted in double logarithmic coordinates. As shown in Fig. 10(b-d), the slopes of the fitted lines can be employed to gain the reaction order values of a, b and c, and the detailed data were summarized in Table S6-S9 in the Supporting information. In Fig. 10(b), there was a positive correlation between the amount of catalyst (0.25–1 g) and the reaction rate, which might because the increasing addition of the catalyst may promote the active sites, leading to the concentration improvement of the activated reactants and the subsequent increase in reaction rate. Importantly, from the fitted lines in Fig. 10(b) we can witness that the catalyst reaction orders (a in Eq. (10)) for the CeO2-F, CeO2-R and CeO2 catalysts were 0.89, 0.92 and 0.76 respectively, presenting approximately + 1 order reaction for the three prepared catalysts. Moreover, when the amount of catalyst was over 1 g, no significant increase of the DMC yield could be observed, implying that the optimal the amount of CeO2 catalyst in this reaction was 1 g. For the methanol dosage in Fig. 10(c), we can see the similarly positive correlation tendency in the direct DMC synthesis under dual supercritical conditions, owing to the concentration increase of reactant (methanol) as usual. It was apparent from Fig. 10(c) that the methanol reaction orders (b in Eq. (10)) of CeO2-F, CeO2-R and CeO2 corresponded to 0.88, 0.92 and 1.15, also can be regarded as + 1 order in DMC reaction. Fig. 10(d) also displayed the logarithmic relationship between CO2 pressure and DMC synthesis rate, and the experimental results revealed that the CO2 pressure was positively correlated with the reaction rate. According to the slopes obtained from the fitted lines in the figure, CeO2-F, CeO2-R and CeO2 corresponded to the reaction orders (c in Eq. (10)) of 0.53, 0.57 and 0.62, which can be seen as the reaction order of + 1/2. In summary, the rate equations for the direct DMC synthesis from CO2 and methanol under dual supercritical conditions were formulated as: (11) Rate = k * 0.76 ∼ 0.92 CH 3 OH 0.88 ∼ 1.15 CO 2 0.53 ∼ 0.62 According to our proposed catalytic mechanism for DMC synthesis, CO2 could be activated in the oxygen vacancies on the catalyst surface, while the adsorption and activation site of methanol may occur on the lattice oxygen of the catalyst, and thus the contents of oxygen vacancies and hydroxyl groups on the catalyst surface would directly affect the synthesis rate of DMC [62]. Moreover, the XPS and H2-TPR characterization results (Table 5) discovered that the lattice oxygen concentration was much larger than that of the oxygen vacancies on the catalyst surface, signifying that methanol could be activated more sufficiently on the catalyst surface than that of CO2. This would limit the generation rate of direct DMC synthesis from CO2 and methanol under dual supercritical conditions, which might be the reason for the low CO2 reaction order (c=0.53–0.62) in the rate Eq. (11). Substantially, the crucial assumption in the LH kinetic model considered the CO2 and methanol adsorption and activation processes occur independently at different sites of the catalyst, further validating the rationality of our proposed DMC synthesis mechanism in dual supercritical conditions. As a result, the rate equation for the direct DMC synthesis under dual supercritical conditions can be expressed based on the fitted results of experimental data. As formulated in Eq. (12), this was in agreement with the derivated rate equation in LH model using step 4 (generation of DMC) as the rate-controlling step (Table 6), confirming our correct hypothesis that the ER mechanistic model is unsuitable for describing the direct synthesis DMC under dual supercritical conditions. (12) Rate = k * 1 CH 3 OH 1 CO 2 1 / 2 To further develop the prepared CeO2-F with excellent catalytic performance, we calculated and obtained the related model parameters based on the experimental data and fitting results, and the detail kinetic model can be expressed as follows: (13) Rate = k[*](0·89) [CH3OH](0·88) [CO2](0·53) Where k is 0.0013 (250 ℃) according to the calculation results. Therefore, the obtained kinetic model can precisely describe and predict the direct DMC synthesis process, expecting to improve the DMC yield and methanol conversion effectively. 5 Conclusion The experiment and kinetic mechanism were studied for the direct synthesis DMC from CO2 and methanol in dual supercritical conditions over different CeO2 catalysts, and the results showed that the prepared CeO2-F sample owned an outstanding catalytic activity, with the highest DMC yield of 3.11 mmol/gcat. at 250 °C and 16 MPa (dual supercritical conditions) in 1 h. Meanwhile, the activation energy for the prepared CeO2-F catalyst was calculated as 45.9 kJ/mol after the fitting line based on the experimental data, which was substantially lower than the previously reported CeO2 catalysts[25]. Moreover, the kinetic model and mechanism were built and analyzed, and the generation of DMC was determined as the rate-controlling step, which was consistent with the rate equation in the LH mechanism model. Eventually, the kinetic model for the prepared CeO2-F catalyst using in the direct synthesis DMC from CO2 and methanol under dual supercritical conditions was calculated and achieved by the experimental and fitting results, whose rate equation can be expressed as: Rate= 0.0013[*](0.89) [CH3OH](0.88) [CO2](0.53). This study may be beneficial to improve the DMC yield and methanol conversion, and is bound to have a promising application and development in the near future. CRediT authorship contribution statement Wenzhao Guo: Conceptualization, Methodology,Data curation, Writing – original draft, Writing – review & editing. Lan Zheng: Methodology, Supervision. Xiong Gao, Wenhui Yang: Data curation. Yanan Li, Wen Sun: Investigation. Shuqin Gao: Resources. Yuqi Wang: Methodology, Conceptualization, Visualization, Supervision, Writing – review & editing. Xin Ding: Methodology, Software. Le Wu: Software. Tao Fang: Conceptualization. Declaration of Competing Interest The authors declare that they have no known competing financial interests or personal relationships that could have appeared to influence the work reported in this paper. Acknowledgements This work was financially supported by the National Natural Science Foundation of China (22078262, 22108228), the Key R&D Project of Shaanxi Province (2022GY-194), National College Student Innovation and Entrepreneurship Training Program (No. 202210697122), the Xi'an Key Lab of Green Hydrogen Energy Production, Storage & Application Integration Technology, and the cooperative R&D Project from Shaanxi Yanchang Petroleum Northwest Rubber Co., Ltd. (2022610002005308). is also greatly acknowledged. We thanks eceshi (www.eceshi.com) for CO2-TPD, and thank Shiyanjia laboratory (www. shiyanjia. com) for XPS analysis. Special thanks to Ruotong Long for her contribution to the data collation of this paper. Appendix A Supporting information Supplementary data associated with this article can be found in the online version at doi:10.1016/j.apcata.2023.119272. Appendix A Supplementary material Supplementary material . References [1] H. Liu W. Zou X. Xu X. Zhang Y. Yang H. Yue Y. Yu G. Tian S. Feng J. CO2 Util. 17 2017 43 49 H. Liu, W. Zou, X. Xu, X. Zhang, Y. Yang, H. Yue, Y. Yu, G. Tian, S. Feng, J. CO2 Util., 17 (2017) 43–49. [2] I. Omae Coord. Chem. Rev. 256 2012 1384 1405 I. Omae, Coordin. Chem. Rev. 256 (2012) 1384–1405. [3] M. Honda M. Tamura Y. Nakagawa K. Tomishige Catal. Sci. Technol. 4 2014 2830 2845 M. Honda, M. Tamura, Y. Nakagawa, K. Tomishige, Catal. Sci. Technol. 4 (2014) 2830–2845. [4] B.A.V. Santos V.M.T.M. Silva J.M. Loureiro A.E. Rodrigues ChemBioEng Rev. 1 2014 214 229 B.A.V. Santos, V.M.T.M. Silva, J.M. Loureiro, A.E. Rodrigues, ChemBioEng Rev. 1 (2014) 214–229. [5] S. Huang B. Yan S. Wang X. Ma Chem. Soc. Rev. 44 2015 3079 3116 S. Huang, B. Yan, S. Wang, X. Ma, Chem. Soc. Rev. 44 (2015) 3079–3116. [6] X. He Z. Li K. Su B. Cheng J. Ming Catal. Commun. 33 2013 20 23 X. He, Z. Li, K. Su, B. Cheng, J. Ming, Catal. Commun. 33 (2013) 20–23. [7] Y. Ji J. Sweeney J. Zoglio D.J. Gorin J. Org. Chem. 78 2013 11606 11611 Y. Ji, J. Sweeney, J. Zoglio, D.J. Gorin, J. Org. Chem. 78 (2013) 11606–11611. [8] L.I. Ling-Ling J.J. Michael N.I.E. Xiao-Wa S. Chun-Shan G.U.O. Xin-Wen Acta Phys. -Chim. Sin. 29 2013 1467 1478 L.I. Ling-Ling, J.J. Michael, N.I.E. Xiao-Wa, S. Chun-Shan, G.U.O. Xin-Wen, Acta Phys-Chim. Sin. 29 (2013) 1467–1478. [9] A.R. Hadba N. Belcheva F. Jones F. Abuzaina A. Calabrese M. Kapiamba W. Skalla J.L. Taylor G. Rodeheaver J. Kennedy J. Biomed Mater. Res. B Appl. Biomater. 99 2011 27 35 A.R. Hadba, N. Belcheva, F. Jones, F. Abuzaina, A. Calabrese, M. Kapiamba, W. Skalla, J.L. Taylor, G. Rodeheaver, J. Kennedy, J. Biomed Mater. Res. B Appl. Biomater 99 (2011) 27–35. [10] D. Wu Z. Chen Chem. Eng. Technol. 36 2013 1125 1130 D. Wu, Z. Chen, Chem. Eng. Technol. 36 (2013) 1125–1130. [11] H. Ohno M. Ikhlayel M. Tamura K. Nakao K. Suzuki K. Morita Y. Kato K. Tomishige Y. Fukushima Green. Chem. 23 2021 457 469 H. Ohno, M. Ikhlayel, M. Tamura, K. Nakao, K. Suzuki, K. Morita, Y. Kato, K. Tomishige, Y. Fukushima, Green Chem. 23 (2021) 457–469. [12] P. Kumar V.C. Srivastava R. Gläser P. With I.M. Mishra Powder Technol. 309 2017 13 21 P. Kumar, V.C. Srivastava, R. Gläser, P. With, I.M. Mishra, Powder Technol. 309 (2017) 13–21. [13] B. Liu C. Li G. Zhang X. Yao S.S.C. Chuang Z. Li ACS Catal. 8 2018 10446 10456 B. Liu, C. Li, G. Zhang, X. Yao, S.S.C. Chuang, Z. Li, ACS Catal. 8 (2018) 10446–10456. [14] B. Schäffner F. Schäffner S.P. Verevkin A. Börner Chem. Rev. 110 2010 4554 4581 B. Schäffner, F. Schäffner, S.P. Verevkin, A. Börner, Chem. Rev. 110 (2010) 4554–4581. [15] S.S. Zhang J. Power Sources 162 2006 1379 1394 S.S. Zhang, J. Power Sources 162 (2006) 1379–1394. [16] W. Sun L. Zheng Y. Wang W. Jia W. Guo Z. Liu X. Ding L. Wu T. Fang J. CO2 Util. 58 2022 W. Sun, L. Zheng, Y. Wang, W. Jia, W. Guo, Z. Liu, X. Ding, L. Wu, T. Fang, J. CO2 Util. 58 (2022). [17] L. Huo T. Wang K. Xuan L. Li Y. Pu C. Li C. Qiao H. Yang Y. Bai Catalysts 11 2021 L. Huo, T. Wang, K. Xuan, L. Li, Y. Pu, C. Li, C. Qiao, H. Yang, Y. Bai, Catalysts, 11 (2021). [18] P. Kumar V.C. Srivastava I.M. Mishra Energy Fuels 29 2015 2664 2675 P. Kumar, V.C. Srivastava, I.M. Mishra, Energy & Fuels, 29 (2015) 2664–2675. [19] P. Kumar V.C. Srivastava I.M. Mishra Catal. Commun. 60 2015 27 31 P. Kumar, V.C. Srivastava, I.M. Mishra, Catal. Commun. 60 (2015) 27–31. [20] A.A. Marciniak F.J.F.S. Henrique A.F.F. de Lima O.C. Alves C.R. Moreira L.G. Appel C.J.A. Mota Mol. Catal. 493 2020 A.A. Marciniak, F.J.F.S. Henrique, A.F.F. de Lima, O.C. Alves, C.R. Moreira, L.G. Appel, C.J.A. Mota, Mol. Catal. 493 (2020). [21] H.-Z. Tan Z.-Q. Wang Z.-N. Xu J. Sun Y.-P. Xu Q.-S. Chen Y. Chen G.-C. Guo Catal. Today 316 2018 2 12 H.-Z. Tan, Z.-Q. Wang, Z.-N. Xu, J. Sun, Y.-P. Xu, Q.-S. Chen, Y. Chen, G.-C. Guo, Catal. Today 316 (2018) 2–12. [22] Y. Chen Y. Yang S. Tian Z. Ye Q. Tang L. Ye G. Li Appl. Catal. A: Gen. 587 2019 Y. Chen, Y. Yang, S. Tian, Z. Ye, Q. Tang, L. Ye, G. Li, Appl. Catal. A: Gen. 587 (2019). [23] W. Joe H.J. Lee U.G. Hong Y.S. Ahn C.J. Song B.J. Kwon I.K. Song J. Ind. Eng. Chem. 18 2012 1018 1022 W. Joe, H.J. Lee, U.G. Hong, Y.S. Ahn, C.J. Song, B.J. Kwon, I.K. Song, J. Ind. Eng. Chem. 18 (2012) 1018–1022. [24] Y. Zhou S. Wang M. Xiao D. Han Y. Lu Y. Meng RSC Adv. 2 2012 Y. Zhou, S. Wang, M. Xiao, D. Han, Y. Lu, Y. Meng, RSC Adv. 2 (2012). [25] B.A.V. Santos C.S.M. Pereira V.M.T.M. Silva J.M. Loureiro A.E. Rodrigues Appl. Catal. A: Gen. 455 2013 219 226 B.A.V. Santos, C.S.M. Pereira, V.M.T.M. Silva, J.M. Loureiro, A.E. Rodrigues, Appl. Catal. A: Gen. 455 (2013) 219–226. [26] R. Saada S. Kellici T. Heil D. Morgan B. Saha Appl. Catal. B: Environ. 168–169 2015 353 362 R. Saada, S. Kellici, T. Heil, D. Morgan, B. Saha, Appl. Catal. B: Environ. 168–169 (2015) 353–362. [27] W. Wang S. Wang X. Ma J. Gong Catal. Today 148 2009 323 328 W. Wang, S. Wang, X. Ma, J. Gong, Catal.Today, 148 (2009) 323–328. [28] S.-P. Wang J.-J. Zhou S.-Y. Zhao Y.-J. Zhao X.-B. Ma Chin. Chem. Lett. 26 2015 1096 1100 S.-P. Wang, J.-J. Zhou, S.-Y. Zhao, Y.-J. Zhao, X.-B. Ma, Chinese Chem. Lett. 26 (2015) 1096–1100. [29] K.W. La J.C. Jung H. Kim S.-H. Baeck I.K. Song J. Mol. Catal. A: Chem. 269 2007 41 45 K.W. La, J.C. Jung, H. Kim, S.-H. Baeck, I.K. Song, J. Mol. Catal. A: Chem. 269 (2007) 41–45. [30] J.J. Schneider M. Naumann C. Schafer A. Brandner H.J. Hofmann P. Claus Beilstein J. Nanotechnol. 2 2011 776 784 J.J. Schneider, M. Naumann, C. Schafer, A. Brandner, H.J. Hofmann, P. Claus, Beilstein J Nanotechnol 2 (2011) 776–784. [31] S. Wang L. Zhao W. Wang Y. Zhao G. Zhang X. Ma J. Gong Nanoscale 5 2013 5582 5588 S. Wang, L. Zhao, W. Wang, Y. Zhao, G. Zhang, X. Ma, J. Gong, Nanoscale 5 (2013) 5582–5588. [32] Y. Pu K. Xuan F. Wang A. Li N. Zhao F. Xiao RSC Adv. 8 2018 27216 27226 Y. Pu, K. Xuan, F. Wang, A. Li, N. Zhao, F. Xiao, RSC Adv. 8 (2018) 27216–27226. [33] I. Prymak O. Prymak J. Wang V.N. Kalevaru A. Martin U. Bentrup S. Wohlrab ChemCatChem 10 2018 391 394 I. Prymak, O. Prymak, J. Wang, V.N. Kalevaru, A. Martin, U. Bentrup, S. Wohlrab, ChemCatChem, 10 (2018) 391–394. [34] Z. Fu Y. Zhong Y. Yu L. Long M. Xiao D. Han S. Wang Y. Meng ACS Omega 3 2018 198 207 Z. Fu, Y. Zhong, Y. Yu, L. Long, M. Xiao, D. Han, S. Wang, Y. Meng, ACS Omega, 3 (2018) 198–207. [35] D. Ballivet-Tkatchenko S. Chambrey R. Keiski R. Ligabue L. Plasseraud P. Richard H. Turunen Catal. Today 115 2006 80 87 D. Ballivet-Tkatchenko, S. Chambrey, R. Keiski, R. Ligabue, L. Plasseraud, P. Richard, H. Turunen, Catal. Today 115 (2006) 80–87. [36] A. Aouissi Z.A. Al-Othman A. Al-Amro Int. J. Mol. Sci. 11 2010 1343 1351 A. Aouissi, Z.A. Al-Othman, A. Al-Amro, Int. J. Mol. Sci. 11 (2010) 1343–1351. [37] Q. Cai B. Lu L. Guo Y. Shan Catal. Commun. 10 2009 605 609 Q. Cai, B. Lu, L. Guo, Y. Shan, Catal. Commun. 10 (2009) 605–609. [38] Y.N. Lim C. Lee H.-Y. Jang Eur. J. Org. Chem. 2014 2014 1823 1826 Y.N. Lim, C. Lee, H.-Y. Jang, Eur. J. Org. Chem. 2014 (2014) 1823–1826. [39] W. Sun L. Zheng Y. Wang D. Li Z. Liu L. Wu T. Fang J. Wu Ind. Eng. Chem. Res. 59 2020 4281 4290 W. Sun, L. Zheng, Y. Wang, D. Li, Z. Liu, L. Wu, T. Fang, J. Wu, Ind. & Eng. Chem. Res. 59 (2020) 4281–4290. [40] X. Tong T. Luo X. Meng H. Wu J. Li X. Liu X. Ji J. Wang C. Chen Z. Zhan Small 11 2015 5581 5588 X. Tong, T. Luo, X. Meng, H. Wu, J. Li, X. Liu, X. Ji, J. Wang, C. Chen, Z. Zhan, Small, 11 (2015) 5581–5588. [41] U. P, S. Darbha, J. Chem. Sci. 128 (2016) 957–965. [42] E. Brunner W. Hültenschmidt G. Schlichthärle J. Chem. Thermodyn. 19 1987 273 291 E. Brunner, W. Hültenschmidt, G. Schlichthärle, J. Chem. Thermodyn. 19 (1987) 273–291. [43] C.J. Chang K.-L. Chiu C.-Y. Day J. Supercrit. Fluid 12 1998 223 237 C.J. Chang, K.-L. Chiu, C.-Y. Day, J. Supercrit. Fluid 12 (1998) 223–237. [44] Z. Wang R. Yu Adv. Mater. 31 2019 e1800592 Z. Wang, R. Yu, Adv. Mater. 31 (2019) e1800592. [45] C.M. Marin L. Li A. Bhalkikar J.E. Doyle X.C. Zeng C.L. Cheung J. Catal. 340 2016 295 301 C.M. Marin, L. Li, A. Bhalkikar, J.E. Doyle, X.C. Zeng, C.L. Cheung, J. Catal. 340 (2016) 295–301. [46] D. Ghosh S. Parwaiz P. Mohanty D. Pradhan Dalton T 49 2020 17594 17604 D. Ghosh, S. Parwaiz, P. Mohanty, D. Pradhan, Dalton T. 49 (2020) 17594–17604. [47] H.G. Yang C.H. Sun S.Z. Qiao J. Zou G. Liu S.C. Smith H.M. Cheng G.Q. Lu Nature 453 2008 638 641 H.G. Yang, C.H. Sun, S.Z. Qiao, J. Zou, G. Liu, S.C. Smith, H.M. Cheng, G.Q. Lu, Nature, 453 (2008) 638–641. [48] Z.-J. Gong Y.-R. Li H.-L. Wu S.D. Lin W.-Y. Yu Appl. Catal. B: Environ. 265 2020 Z.-J. Gong, Y.-R. Li, H.-L. Wu, S.D. Lin, W.-Y. Yu, Appl. Catal. B: Environ. 265 (2020). [49] A. Li Y. Pu F. Li J. Luo N. Zhao F. Xiao J. CO2 Util. 19 2017 33 39 A. Li, Y. Pu, F. Li, J. Luo, N. Zhao, F. Xiao, J. CO2 Util. 19 (2017) 33–39. [50] B. Liu C. Li G. Zhang L. Yan Z. Li N. J. Chem. 41 2017 12231 12240 B. Liu, C. Li, G. Zhang, L. Yan, Z. Li, New J. Chem. 41 (2017) 12231–12240. [51] K.T. Jung A.T. Bell J. Catal. 204 2001 339 347 K.T. Jung, A.T. Bell, J. Catal. 204 (2001) 339–347. [52] K.W. La J.C. Jung H. Kim S.-H. Baeck I.K. Song J. Mol. Catal. A: Chem. 269 2007 41 45 K.W. La, J.C. Jung, H. Kim, S.-H. Baeck, I.K. Song, J. Mol. Catal. A: Chem. 269 (2007) 41–45. [53] P. Kumar L. Matoh R. Kaur U.L. Štangar Fuel 285 2021 P. Kumar, L. Matoh, R. Kaur, U.L. Štangar, Fuel, 285 (2021). [54] N. Keller G. Rebmann V. Keller J. Mol. Catal. A: Chem. 317 2010 1 18 N. Keller, G. Rebmann, V. Keller, J. Mol. Catal. A: Chem. 317 (2010) 1–18. [55] S.-Y. Zhao S.-P. Wang Y.-J. Zhao X.-B. Ma Chin. Chem. Lett. 28 2017 65 69 S.-Y. Zhao, S.-P. Wang, Y.-J. Zhao, X.-B. Ma, Chinese Chem. Lett. 28 (2017) 65–69. [56] X. Wang J. Zhao W. Sun Y. Pei J. An Z. Li J. Ren Com. Mater. Sci. 159 2019 210 221 X. Wang, J. Zhao, W. Sun, Y. Pei, J. An, Z. Li, J. Ren, Com. Mater. Sci. 159 (2019) 210–221. [57] Y. Zhang F. Yang R. Gao W.-L. Dai Appl. Surf. Sci. 471 2019 767 775 Y. Zhang, F. Yang, R. Gao, W.-L. Dai, Appl. Surf. Sci. 471 (2019) 767–775. [58] L. Zhu X. Wang React. Kinet., Mech. Cat. 112 2014 383 395 L. Zhu, X. Wang, Reaction Kinetics, Mech. Cat. 112 (2014) 383–395. [59] J. Ye C. Liu D. Mei Q. Ge ACS Catal. 3 2013 1296 1306 J. Ye, C. Liu, D. Mei, Q. Ge, ACS Catal. 3 (2013) 1296–1306. [60] F. Wang C. Li X. Zhang M. Wei D.G. Evans X. Duan J. Catal. 329 2015 177 186 F. Wang, C. Li, X. Zhang, M. Wei, D.G. Evans, X. Duan, J. Catal. 329 (2015) 177–186. [61] X. Wang Z. Jiang B. Zheng Z. Xie L. Zheng CrystEngComm 14 2012 X. Wang, Z. Jiang, B. Zheng, Z. Xie, L. Zheng, CrystEngComm, 14 (2012). [62] H. Liu D. Zhu B. Jia Y. Huang Y. Cheng X. Luo Z. Liang Chem. Eng. Sci. 254 2022 H. Liu, D. Zhu, B. Jia, Y. Huang, Y. Cheng, X. Luo, Z. Liang, Chem. Eng. Sci. 254 (2022). [63] Z. Wu A.K.P. Mann M. Li S.H. Overbury J. Phys. Chem. 119 2015 7340 7350 Z. Wu, A.K.P. Mann, M. Li, S.H. Overbury, J. Phys. Chem. 119 (2015) 7340–7350. [64] H. Metiu S. Chrétien Z. Hu B. Li X. Sun J. Phys. Chem. C. 116 2012 10439 10450 H. Metiu, S. Chrétien, Z. Hu, B. Li, X. Sun, J. Phys. Chem. C 116 (2012) 10439–10450. [65] T. Jomjaree P. Sintuya A. Srifa W. Koo-amornpattana S. Kiatphuengporn S. Assabumrungrat M. Sudoh R. Watanabe C. Fukuhara S. Ratchahat Catal. Today 375 2021 234 244 T. Jomjaree, P. Sintuya, A. Srifa, W. Koo-amornpattana, S. Kiatphuengporn, S. Assabumrungrat, M. Sudoh, R. Watanabe, C. Fukuhara, S. Ratchahat, Catal. Today, 375 (2021) 234–244. [66] S.H. Teo M. Goto Y.H. Taufiq-Yap J. Supercrit. Fluid 104 2015 243 250 S.H. Teo, M. Goto, Y.H. Taufiq-Yap, J. Supercrit. Fluid 104 (2015) 243–250. [67] N. García-Martínez P. Andreo-Martínez J. Quesada-Medina A.P. de los Ríos A. Chica R. Beneito-Ruiz J. Carratalá-Abril Energ. Convers. Manag. 131 2017 99 108 N. García-Martínez, P. Andreo-Martínez, J. Quesada-Medina, A.P. de los Ríos, A. Chica, R. Beneito-Ruiz, J. Carratalá-Abril, Energ. Convers. Manage. 131 (2017) 99–108. [68] S.A. Anderson S. Manthata T.W. Root Appl. Catal. A: Gen. 280 2005 117 124 S.A. Anderson, S. Manthata, T.W. Root, Appl. Catal. A: Gen. 280 (2005) 117–124. [69] N. Asahi Y. Nakamura Chem. Phys. Lett. 290 1998 63 67 N. Asahi, Y. Nakamura, Chem. Phys. Lett. 290 (1998) 63–67. [70] Cho, C.-J.J.J.o.E. Management, 56 (1999) 119–119. [71] J.G. Dolan Patient Educ. Couns. 73 3 2008 418 425 J.G. Dolan, Patient Educ. Couns. 2008 Dec;73(3):418–425. [72] G. Zhang Y. Wang X. Li Y. Bai L. Zheng L. Wu X. Han Ind. Eng. Chem. Res. 57 2018 17076 17085 G. Zhang, Y. Wang, X. Li, Y. Bai, L. Zheng, L. Wu, X. Han, Ind. Eng. Chem. Res. 57 (2018) 17076–17085. [73] Y. Bai Y. Wang W. Yuan W. Sun G. Zhang L. Zheng X. Han L. Zhou Chin. J. Chem. Eng. 27 2019 379 385 Y. Bai, Y. Wang, W. Yuan, W. Sun, G. Zhang, L. Zheng, X. Han, L. Zhou, Chinese J. Chem. Eng. 27 (2019) 379–385. [74] Y. Li X. Zhang S. Gao W. Guo Z. Liu L. Wu L. Zheng X. Ding H. Yan Y. Wang J. Phys. Chem. C. 127 2023 1032 1048 Y. Li, X. Zhang, S. Gao, W. Guo, Z. Liu, L. Wu, L. Zheng, X. Ding, H. Yan, Y. Wang, J. Phys. Chem. C 127 (2023) 1032–1048. [75] S. Wada K. Oka K. Watanabe Y. Izumi Front. Chem. 1 2013 8 S. Wada, K. Oka, K. Watanabe, Y. Izumi, Front. Chem. 1 (2013) 8. [76] W.-F. Kuan W.-Y. Yu F.-Y. Tu C.-H. Chung Y.-C. Chang M.M. Lin T.-H. Yu L.-J. Chen Chem. Eng. J. 430 2022 W.-F. Kuan, W.-Y. Yu, F.-Y. Tu, C.-H. Chung, Y.-C. Chang, M.M. Lin, T.-H. Yu, L.-J. Chen, Chem. Eng. J. 430 (2022). [77] Z. Cui J. Fan H. Duan J. Zhang Y. Xue Y. Tan Korean J. Chem. Eng. 34 2016 29 36 Z. Cui, J. Fan, H. Duan, J. Zhang, Y. Xue, Y. Tan, Korean J. Chem. Eng. 34 (2016) 29–36. [78] M. Aresta A. Dibenedetto C. Pastore C. Cuocci B. Aresta S. Cometa E. Degiglio Catal. Today 137 2008 125 131 M. Aresta, A. Dibenedetto, C. Pastore, C. Cuocci, B. Aresta, S. Cometa, E. Degiglio, Catal. Today 137 (2008) 125–131. [79] X. Liu M. Wang C. Zhou W. Zhou K. Cheng J. Kang Q. Zhang W. Deng Y. Wang Chem. Commun. (Camb. ) 54 2018 140 143 X. Liu, M. Wang, C. Zhou, W. Zhou, K. Cheng, J. Kang, Q. Zhang, W. Deng, Y. Wang, Chem. Commun. (Camb), 54 (2018) 140–143. [80] F. Wang S. He H. Chen B. Wang L. Zheng M. Wei D.G. Evans X. Duan J. Am. Chem. Soc. 138 2016 6298 6305 F. Wang, S. He, H. Chen, B. Wang, L. Zheng, M. Wei, D.G. Evans, X. Duan, J. Am. Chem. Soc. 138 (2016) 6298–6305. [81] M. Fronzi W. Daly M. Nolan Appl. Catal. A: Gen. 521 2016 240 249 M. Fronzi, W. Daly, M. Nolan, Appl. Catal. A: Gen. 521 (2016) 240–249. [82] V. Eta P. Mäki-Arvela J. Wärnå T. Salmi J.-P. Mikkola D.Y. Murzin Appl. Catal. A: Gen. 2011 V. Eta, P. Mäki-Arvela, J. Wärnå, T. Salmi, J.-P. Mikkola, D.Y. Murzin, Appl. Catal. A: Gen. (2011).",
      "scopus-id": "85160516801",
      "coredata": {
        "eid": "1-s2.0-S0926860X23002521",
        "dc:description": "In this study, the direct synthesis conditions of dimethyl carbonate (DMC) from methanol and CO2 were controlled under the dual supercritical conditions, whose temperature was higher than the maximal critical temperature of CO2 and methanol (>239 ℃), and the partial pressure for each reactant was larger than its partial critical pressure (PCO2 > 7.4 MPa and Pmethanol > 8.1 MPa). A series of CeO2 catalysts with different morphologies including traditional nanorod, amorphous and flower structures were synthesized by hydrothermal method. The prepared catalysts were characterized by the BET, XRD, SEM, NH3/CO2-TPD, XPS, and H2-TPR, and the results indicated that flower CeO2 performed the largest acid-base sites and oxygen vacancies as expected, proving its superior physicochemical properties and catalytic activity. Moreover, the catalytic activity synthesis of DMC from CO2 and methanol was investigated, confirming that the flower CeO2 owned the highest catalytic performance, and the maximum yield of DMC was 3.11 mmol/gcat. under the reaction conditions (16 MPa, 250 °C, reaction time of 1 h without stirring). Importantly, the synthesis kinetic mechanism of DMC in dual supercritical systems was experimentally studied using the synthetic CeO2 catalysts, and the flower CeO2 catalyst possessed the lowest apparent activation energy of 45.9 kJ/mol, meanwhile, the initial reaction rate equation obtained from the experiment can be represented as: Rate = k [*] [CH3OH] [CO2]1/2, which was consistent with the reaction mechanism of Langmuir–Hinshelwood type.",
        "openArchiveArticle": "false",
        "prism:coverDate": "2023-07-25",
        "openaccessUserLicense": null,
        "prism:aggregationType": "Journal",
        "prism:url": "https://api.elsevier.com/content/article/pii/S0926860X23002521",
        "dc:creator": [
          {
            "@_fa": "true",
            "$": "Guo, Wenzhao"
          },
          {
            "@_fa": "true",
            "$": "Zheng, Lan"
          },
          {
            "@_fa": "true",
            "$": "Gao, Xiong"
          },
          {
            "@_fa": "true",
            "$": "Yang, Wenhui"
          },
          {
            "@_fa": "true",
            "$": "Li, Yanan"
          },
          {
            "@_fa": "true",
            "$": "Sun, Wen"
          },
          {
            "@_fa": "true",
            "$": "Gao, Shuqin"
          },
          {
            "@_fa": "true",
            "$": "Wang, Yuqi"
          },
          {
            "@_fa": "true",
            "$": "Ding, Xin"
          },
          {
            "@_fa": "true",
            "$": "Wu, Le"
          },
          {
            "@_fa": "true",
            "$": "Fang, Tao"
          }
        ],
        "link": [
          {
            "@_fa": "true",
            "@rel": "self",
            "@href": "https://api.elsevier.com/content/article/pii/S0926860X23002521"
          },
          {
            "@_fa": "true",
            "@rel": "scidir",
            "@href": "https://www.sciencedirect.com/science/article/pii/S0926860X23002521"
          }
        ],
        "dc:format": "application/json",
        "openaccessType": null,
        "pii": "S0926-860X(23)00252-1",
        "prism:volume": "662",
        "articleNumber": "119272",
        "prism:publisher": "Elsevier B.V.",
        "dc:title": "Performance and kinetic investigations on the CeO2 catalyzed direct synthesis of dimethyl carbonate from CO2 and methanol in dual supercritical conditions",
        "prism:copyright": "© 2023 Elsevier B.V. All rights reserved.",
        "openaccess": "0",
        "prism:issn": "0926860X",
        "dcterms:subject": [
          {
            "@_fa": "true",
            "$": "Dual supercritical conditions"
          },
          {
            "@_fa": "true",
            "$": "CO2 conversion"
          },
          {
            "@_fa": "true",
            "$": "Dimethyl carbonate"
          },
          {
            "@_fa": "true",
            "$": "Kinetic mechanism"
          },
          {
            "@_fa": "true",
            "$": "CeO2 morphology"
          }
        ],
        "openaccessArticle": "false",
        "prism:publicationName": "Applied Catalysis A: General",
        "openaccessSponsorType": null,
        "prism:pageRange": "119272",
        "pubType": "fla",
        "prism:coverDisplayDate": "25 July 2023",
        "prism:doi": "10.1016/j.apcata.2023.119272",
        "prism:startingPage": "119272",
        "dc:identifier": "doi:10.1016/j.apcata.2023.119272",
        "openaccessSponsorName": null
      },
      "objects": {
        "object": [
          {
            "@category": "standard",
            "@height": "267",
            "@width": "565",
            "@_fa": "true",
            "$": "https://api.elsevier.com/content/object/eid/1-s2.0-S0926860X23002521-gr1.jpg?httpAccept=%2A%2F%2A",
            "@multimediatype": "JPEG image file",
            "@type": "IMAGE-DOWNSAMPLED",
            "@size": "26775",
            "@ref": "gr1",
            "@mimetype": "image/jpeg"
          },
          {
            "@category": "standard",
            "@height": "295",
            "@width": "376",
            "@_fa": "true",
            "$": "https://api.elsevier.com/content/object/eid/1-s2.0-S0926860X23002521-gr3.jpg?httpAccept=%2A%2F%2A",
            "@multimediatype": "JPEG image file",
            "@type": "IMAGE-DOWNSAMPLED",
            "@size": "21679",
            "@ref": "gr3",
            "@mimetype": "image/jpeg"
          },
          {
            "@category": "standard",
            "@height": "677",
            "@width": "678",
            "@_fa": "true",
            "$": "https://api.elsevier.com/content/object/eid/1-s2.0-S0926860X23002521-gr2.jpg?httpAccept=%2A%2F%2A",
            "@multimediatype": "JPEG image file",
            "@type": "IMAGE-DOWNSAMPLED",
            "@size": "183234",
            "@ref": "gr2",
            "@mimetype": "image/jpeg"
          },
          {
            "@category": "standard",
            "@height": "245",
            "@width": "253",
            "@_fa": "true",
            "$": "https://api.elsevier.com/content/object/eid/1-s2.0-S0926860X23002521-ga1.jpg?httpAccept=%2A%2F%2A",
            "@multimediatype": "JPEG image file",
            "@type": "IMAGE-DOWNSAMPLED",
            "@size": "19412",
            "@ref": "ga1",
            "@mimetype": "image/jpeg"
          },
          {
            "@category": "standard",
            "@height": "456",
            "@width": "565",
            "@_fa": "true",
            "$": "https://api.elsevier.com/content/object/eid/1-s2.0-S0926860X23002521-gr10.jpg?httpAccept=%2A%2F%2A",
            "@multimediatype": "JPEG image file",
            "@type": "IMAGE-DOWNSAMPLED",
            "@size": "61588",
            "@ref": "gr10",
            "@mimetype": "image/jpeg"
          },
          {
            "@category": "standard",
            "@height": "295",
            "@width": "565",
            "@_fa": "true",
            "$": "https://api.elsevier.com/content/object/eid/1-s2.0-S0926860X23002521-gr9.jpg?httpAccept=%2A%2F%2A",
            "@multimediatype": "JPEG image file",
            "@type": "IMAGE-DOWNSAMPLED",
            "@size": "29064",
            "@ref": "gr9",
            "@mimetype": "image/jpeg"
          },
          {
            "@category": "standard",
            "@height": "198",
            "@width": "565",
            "@_fa": "true",
            "$": "https://api.elsevier.com/content/object/eid/1-s2.0-S0926860X23002521-gr8.jpg?httpAccept=%2A%2F%2A",
            "@multimediatype": "JPEG image file",
            "@type": "IMAGE-DOWNSAMPLED",
            "@size": "28800",
            "@ref": "gr8",
            "@mimetype": "image/jpeg"
          },
          {
            "@category": "standard",
            "@height": "411",
            "@width": "565",
            "@_fa": "true",
            "$": "https://api.elsevier.com/content/object/eid/1-s2.0-S0926860X23002521-gr5.jpg?httpAccept=%2A%2F%2A",
            "@multimediatype": "JPEG image file",
            "@type": "IMAGE-DOWNSAMPLED",
            "@size": "51131",
            "@ref": "gr5",
            "@mimetype": "image/jpeg"
          },
          {
            "@category": "standard",
            "@height": "238",
            "@width": "565",
            "@_fa": "true",
            "$": "https://api.elsevier.com/content/object/eid/1-s2.0-S0926860X23002521-gr4.jpg?httpAccept=%2A%2F%2A",
            "@multimediatype": "JPEG image file",
            "@type": "IMAGE-DOWNSAMPLED",
            "@size": "34092",
            "@ref": "gr4",
            "@mimetype": "image/jpeg"
          },
          {
            "@category": "standard",
            "@height": "235",
            "@width": "565",
            "@_fa": "true",
            "$": "https://api.elsevier.com/content/object/eid/1-s2.0-S0926860X23002521-gr7.jpg?httpAccept=%2A%2F%2A",
            "@multimediatype": "JPEG image file",
            "@type": "IMAGE-DOWNSAMPLED",
            "@size": "28252",
            "@ref": "gr7",
            "@mimetype": "image/jpeg"
          },
          {
            "@category": "standard",
            "@height": "297",
            "@width": "376",
            "@_fa": "true",
            "$": "https://api.elsevier.com/content/object/eid/1-s2.0-S0926860X23002521-gr6.jpg?httpAccept=%2A%2F%2A",
            "@multimediatype": "JPEG image file",
            "@type": "IMAGE-DOWNSAMPLED",
            "@size": "25630",
            "@ref": "gr6",
            "@mimetype": "image/jpeg"
          },
          {
            "@category": "thumbnail",
            "@height": "103",
            "@width": "219",
            "@_fa": "true",
            "$": "https://api.elsevier.com/content/object/eid/1-s2.0-S0926860X23002521-gr1.sml?httpAccept=%2A%2F%2A",
            "@multimediatype": "GIF image file",
            "@type": "IMAGE-THUMBNAIL",
            "@size": "6836",
            "@ref": "gr1",
            "@mimetype": "image/gif"
          },
          {
            "@category": "thumbnail",
            "@height": "164",
            "@width": "209",
            "@_fa": "true",
            "$": "https://api.elsevier.com/content/object/eid/1-s2.0-S0926860X23002521-gr3.sml?httpAccept=%2A%2F%2A",
            "@multimediatype": "GIF image file",
            "@type": "IMAGE-THUMBNAIL",
            "@size": "7176",
            "@ref": "gr3",
            "@mimetype": "image/gif"
          },
          {
            "@category": "thumbnail",
            "@height": "164",
            "@width": "164",
            "@_fa": "true",
            "$": "https://api.elsevier.com/content/object/eid/1-s2.0-S0926860X23002521-gr2.sml?httpAccept=%2A%2F%2A",
            "@multimediatype": "GIF image file",
            "@type": "IMAGE-THUMBNAIL",
            "@size": "17141",
            "@ref": "gr2",
            "@mimetype": "image/gif"
          },
          {
            "@category": "thumbnail",
            "@height": "163",
            "@width": "169",
            "@_fa": "true",
            "$": "https://api.elsevier.com/content/object/eid/1-s2.0-S0926860X23002521-ga1.sml?httpAccept=%2A%2F%2A",
            "@multimediatype": "GIF image file",
            "@type": "IMAGE-THUMBNAIL",
            "@size": "13276",
            "@ref": "ga1",
            "@mimetype": "image/gif"
          },
          {
            "@category": "thumbnail",
            "@height": "164",
            "@width": "203",
            "@_fa": "true",
            "$": "https://api.elsevier.com/content/object/eid/1-s2.0-S0926860X23002521-gr10.sml?httpAccept=%2A%2F%2A",
            "@multimediatype": "GIF image file",
            "@type": "IMAGE-THUMBNAIL",
            "@size": "9892",
            "@ref": "gr10",
            "@mimetype": "image/gif"
          },
          {
            "@category": "thumbnail",
            "@height": "114",
            "@width": "219",
            "@_fa": "true",
            "$": "https://api.elsevier.com/content/object/eid/1-s2.0-S0926860X23002521-gr9.sml?httpAccept=%2A%2F%2A",
            "@multimediatype": "GIF image file",
            "@type": "IMAGE-THUMBNAIL",
            "@size": "5067",
            "@ref": "gr9",
            "@mimetype": "image/gif"
          },
          {
            "@category": "thumbnail",
            "@height": "77",
            "@width": "219",
            "@_fa": "true",
            "$": "https://api.elsevier.com/content/object/eid/1-s2.0-S0926860X23002521-gr8.sml?httpAccept=%2A%2F%2A",
            "@multimediatype": "GIF image file",
            "@type": "IMAGE-THUMBNAIL",
            "@size": "6616",
            "@ref": "gr8",
            "@mimetype": "image/gif"
          },
          {
            "@category": "thumbnail",
            "@height": "159",
            "@width": "219",
            "@_fa": "true",
            "$": "https://api.elsevier.com/content/object/eid/1-s2.0-S0926860X23002521-gr5.sml?httpAccept=%2A%2F%2A",
            "@multimediatype": "GIF image file",
            "@type": "IMAGE-THUMBNAIL",
            "@size": "11317",
            "@ref": "gr5",
            "@mimetype": "image/gif"
          },
          {
            "@category": "thumbnail",
            "@height": "92",
            "@width": "219",
            "@_fa": "true",
            "$": "https://api.elsevier.com/content/object/eid/1-s2.0-S0926860X23002521-gr4.sml?httpAccept=%2A%2F%2A",
            "@multimediatype": "GIF image file",
            "@type": "IMAGE-THUMBNAIL",
            "@size": "5998",
            "@ref": "gr4",
            "@mimetype": "image/gif"
          },
          {
            "@category": "thumbnail",
            "@height": "91",
            "@width": "219",
            "@_fa": "true",
            "$": "https://api.elsevier.com/content/object/eid/1-s2.0-S0926860X23002521-gr7.sml?httpAccept=%2A%2F%2A",
            "@multimediatype": "GIF image file",
            "@type": "IMAGE-THUMBNAIL",
            "@size": "5615",
            "@ref": "gr7",
            "@mimetype": "image/gif"
          },
          {
            "@category": "thumbnail",
            "@height": "164",
            "@width": "208",
            "@_fa": "true",
            "$": "https://api.elsevier.com/content/object/eid/1-s2.0-S0926860X23002521-gr6.sml?httpAccept=%2A%2F%2A",
            "@multimediatype": "GIF image file",
            "@type": "IMAGE-THUMBNAIL",
            "@size": "7039",
            "@ref": "gr6",
            "@mimetype": "image/gif"
          },
          {
            "@category": "high",
            "@height": "1179",
            "@width": "2495",
            "@_fa": "true",
            "$": "https://api.elsevier.com/content/object/eid/1-s2.0-S0926860X23002521-gr1_lrg.jpg?httpAccept=%2A%2F%2A",
            "@multimediatype": "JPEG image file",
            "@type": "IMAGE-HIGH-RES",
            "@size": "131987",
            "@ref": "gr1",
            "@mimetype": "image/jpeg"
          },
          {
            "@category": "high",
            "@height": "1304",
            "@width": "1663",
            "@_fa": "true",
            "$": "https://api.elsevier.com/content/object/eid/1-s2.0-S0926860X23002521-gr3_lrg.jpg?httpAccept=%2A%2F%2A",
            "@multimediatype": "JPEG image file",
            "@type": "IMAGE-HIGH-RES",
            "@size": "124520",
            "@ref": "gr3",
            "@mimetype": "image/jpeg"
          },
          {
            "@category": "high",
            "@height": "2988",
            "@width": "2994",
            "@_fa": "true",
            "$": "https://api.elsevier.com/content/object/eid/1-s2.0-S0926860X23002521-gr2_lrg.jpg?httpAccept=%2A%2F%2A",
            "@multimediatype": "JPEG image file",
            "@type": "IMAGE-HIGH-RES",
            "@size": "1009454",
            "@ref": "gr2",
            "@mimetype": "image/jpeg"
          },
          {
            "@category": "high",
            "@height": "1085",
            "@width": "1122",
            "@_fa": "true",
            "$": "https://api.elsevier.com/content/object/eid/1-s2.0-S0926860X23002521-ga1_lrg.jpg?httpAccept=%2A%2F%2A",
            "@multimediatype": "JPEG image file",
            "@type": "IMAGE-HIGH-RES",
            "@size": "144827",
            "@ref": "ga1",
            "@mimetype": "image/jpeg"
          },
          {
            "@category": "high",
            "@height": "2014",
            "@width": "2495",
            "@_fa": "true",
            "$": "https://api.elsevier.com/content/object/eid/1-s2.0-S0926860X23002521-gr10_lrg.jpg?httpAccept=%2A%2F%2A",
            "@multimediatype": "JPEG image file",
            "@type": "IMAGE-HIGH-RES",
            "@size": "343381",
            "@ref": "gr10",
            "@mimetype": "image/jpeg"
          },
          {
            "@category": "high",
            "@height": "1303",
            "@width": "2495",
            "@_fa": "true",
            "$": "https://api.elsevier.com/content/object/eid/1-s2.0-S0926860X23002521-gr9_lrg.jpg?httpAccept=%2A%2F%2A",
            "@multimediatype": "JPEG image file",
            "@type": "IMAGE-HIGH-RES",
            "@size": "149244",
            "@ref": "gr9",
            "@mimetype": "image/jpeg"
          },
          {
            "@category": "high",
            "@height": "876",
            "@width": "2495",
            "@_fa": "true",
            "$": "https://api.elsevier.com/content/object/eid/1-s2.0-S0926860X23002521-gr8_lrg.jpg?httpAccept=%2A%2F%2A",
            "@multimediatype": "JPEG image file",
            "@type": "IMAGE-HIGH-RES",
            "@size": "148293",
            "@ref": "gr8",
            "@mimetype": "image/jpeg"
          },
          {
            "@category": "high",
            "@height": "1814",
            "@width": "2495",
            "@_fa": "true",
            "$": "https://api.elsevier.com/content/object/eid/1-s2.0-S0926860X23002521-gr5_lrg.jpg?httpAccept=%2A%2F%2A",
            "@multimediatype": "JPEG image file",
            "@type": "IMAGE-HIGH-RES",
            "@size": "290833",
            "@ref": "gr5",
            "@mimetype": "image/jpeg"
          },
          {
            "@category": "high",
            "@height": "1050",
            "@width": "2495",
            "@_fa": "true",
            "$": "https://api.elsevier.com/content/object/eid/1-s2.0-S0926860X23002521-gr4_lrg.jpg?httpAccept=%2A%2F%2A",
            "@multimediatype": "JPEG image file",
            "@type": "IMAGE-HIGH-RES",
            "@size": "179814",
            "@ref": "gr4",
            "@mimetype": "image/jpeg"
          },
          {
            "@category": "high",
            "@height": "1037",
            "@width": "2495",
            "@_fa": "true",
            "$": "https://api.elsevier.com/content/object/eid/1-s2.0-S0926860X23002521-gr7_lrg.jpg?httpAccept=%2A%2F%2A",
            "@multimediatype": "JPEG image file",
            "@type": "IMAGE-HIGH-RES",
            "@size": "150716",
            "@ref": "gr7",
            "@mimetype": "image/jpeg"
          },
          {
            "@category": "high",
            "@height": "1312",
            "@width": "1663",
            "@_fa": "true",
            "$": "https://api.elsevier.com/content/object/eid/1-s2.0-S0926860X23002521-gr6_lrg.jpg?httpAccept=%2A%2F%2A",
            "@multimediatype": "JPEG image file",
            "@type": "IMAGE-HIGH-RES",
            "@size": "122406",
            "@ref": "gr6",
            "@mimetype": "image/jpeg"
          },
          {
            "@category": "standard",
            "@_fa": "true",
            "$": "https://api.elsevier.com/content/object/eid/1-s2.0-S0926860X23002521-mmc1.docx?httpAccept=%2A%2F%2A",
            "@multimediatype": "Microsoft Word file",
            "@type": "APPLICATION",
            "@size": "1138055",
            "@ref": "mmc1",
            "@mimetype": "application/word"
          },
          {
            "@category": "thumbnail",
            "@_fa": "true",
            "$": "https://api.elsevier.com/content/object/eid/1-s2.0-S0926860X23002521-si0001.svg?httpAccept=%2A%2F%2A",
            "@multimediatype": "Scalable Vector Graphics file",
            "@type": "ALTIMG",
            "@size": "1572",
            "@ref": "si0001",
            "@mimetype": "image/svg+xml"
          },
          {
            "@category": "thumbnail",
            "@_fa": "true",
            "$": "https://api.elsevier.com/content/object/eid/1-s2.0-S0926860X23002521-si0002.svg?httpAccept=%2A%2F%2A",
            "@multimediatype": "Scalable Vector Graphics file",
            "@type": "ALTIMG",
            "@size": "1547",
            "@ref": "si0002",
            "@mimetype": "image/svg+xml"
          },
          {
            "@category": "thumbnail",
            "@_fa": "true",
            "$": "https://api.elsevier.com/content/object/eid/1-s2.0-S0926860X23002521-si0003.svg?httpAccept=%2A%2F%2A",
            "@multimediatype": "Scalable Vector Graphics file",
            "@type": "ALTIMG",
            "@size": "1499",
            "@ref": "si0003",
            "@mimetype": "image/svg+xml"
          },
          {
            "@category": "thumbnail",
            "@_fa": "true",
            "$": "https://api.elsevier.com/content/object/eid/1-s2.0-S0926860X23002521-si0004.svg?httpAccept=%2A%2F%2A",
            "@multimediatype": "Scalable Vector Graphics file",
            "@type": "ALTIMG",
            "@size": "1584",
            "@ref": "si0004",
            "@mimetype": "image/svg+xml"
          },
          {
            "@category": "thumbnail",
            "@_fa": "true",
            "$": "https://api.elsevier.com/content/object/eid/1-s2.0-S0926860X23002521-si0005.svg?httpAccept=%2A%2F%2A",
            "@multimediatype": "Scalable Vector Graphics file",
            "@type": "ALTIMG",
            "@size": "1636",
            "@ref": "si0005",
            "@mimetype": "image/svg+xml"
          },
          {
            "@category": "thumbnail",
            "@_fa": "true",
            "$": "https://api.elsevier.com/content/object/eid/1-s2.0-S0926860X23002521-si0006.svg?httpAccept=%2A%2F%2A",
            "@multimediatype": "Scalable Vector Graphics file",
            "@type": "ALTIMG",
            "@size": "1482",
            "@ref": "si0006",
            "@mimetype": "image/svg+xml"
          },
          {
            "@category": "thumbnail",
            "@_fa": "true",
            "$": "https://api.elsevier.com/content/object/eid/1-s2.0-S0926860X23002521-si0007.svg?httpAccept=%2A%2F%2A",
            "@multimediatype": "Scalable Vector Graphics file",
            "@type": "ALTIMG",
            "@size": "1466",
            "@ref": "si0007",
            "@mimetype": "image/svg+xml"
          },
          {
            "@category": "thumbnail",
            "@_fa": "true",
            "$": "https://api.elsevier.com/content/object/eid/1-s2.0-S0926860X23002521-si0008.svg?httpAccept=%2A%2F%2A",
            "@multimediatype": "Scalable Vector Graphics file",
            "@type": "ALTIMG",
            "@size": "1401",
            "@ref": "si0008",
            "@mimetype": "image/svg+xml"
          },
          {
            "@category": "thumbnail",
            "@_fa": "true",
            "$": "https://api.elsevier.com/content/object/eid/1-s2.0-S0926860X23002521-si0009.svg?httpAccept=%2A%2F%2A",
            "@multimediatype": "Scalable Vector Graphics file",
            "@type": "ALTIMG",
            "@size": "1450",
            "@ref": "si0009",
            "@mimetype": "image/svg+xml"
          },
          {
            "@category": "thumbnail",
            "@_fa": "true",
            "$": "https://api.elsevier.com/content/object/eid/1-s2.0-S0926860X23002521-si0010.svg?httpAccept=%2A%2F%2A",
            "@multimediatype": "Scalable Vector Graphics file",
            "@type": "ALTIMG",
            "@size": "1551",
            "@ref": "si0010",
            "@mimetype": "image/svg+xml"
          },
          {
            "@category": "thumbnail",
            "@_fa": "true",
            "$": "https://api.elsevier.com/content/object/eid/1-s2.0-S0926860X23002521-si0011.svg?httpAccept=%2A%2F%2A",
            "@multimediatype": "Scalable Vector Graphics file",
            "@type": "ALTIMG",
            "@size": "1462",
            "@ref": "si0011",
            "@mimetype": "image/svg+xml"
          },
          {
            "@category": "thumbnail",
            "@_fa": "true",
            "$": "https://api.elsevier.com/content/object/eid/1-s2.0-S0926860X23002521-si0012.svg?httpAccept=%2A%2F%2A",
            "@multimediatype": "Scalable Vector Graphics file",
            "@type": "ALTIMG",
            "@size": "1527",
            "@ref": "si0012",
            "@mimetype": "image/svg+xml"
          },
          {
            "@category": "thumbnail",
            "@_fa": "true",
            "$": "https://api.elsevier.com/content/object/eid/1-s2.0-S0926860X23002521-si0013.svg?httpAccept=%2A%2F%2A",
            "@multimediatype": "Scalable Vector Graphics file",
            "@type": "ALTIMG",
            "@size": "2897",
            "@ref": "si0013",
            "@mimetype": "image/svg+xml"
          },
          {
            "@category": "thumbnail",
            "@_fa": "true",
            "$": "https://api.elsevier.com/content/object/eid/1-s2.0-S0926860X23002521-si0014.svg?httpAccept=%2A%2F%2A",
            "@multimediatype": "Scalable Vector Graphics file",
            "@type": "ALTIMG",
            "@size": "4951",
            "@ref": "si0014",
            "@mimetype": "image/svg+xml"
          },
          {
            "@category": "thumbnail",
            "@_fa": "true",
            "$": "https://api.elsevier.com/content/object/eid/1-s2.0-S0926860X23002521-si0015.svg?httpAccept=%2A%2F%2A",
            "@multimediatype": "Scalable Vector Graphics file",
            "@type": "ALTIMG",
            "@size": "5255",
            "@ref": "si0015",
            "@mimetype": "image/svg+xml"
          },
          {
            "@category": "thumbnail",
            "@_fa": "true",
            "$": "https://api.elsevier.com/content/object/eid/1-s2.0-S0926860X23002521-si0016.svg?httpAccept=%2A%2F%2A",
            "@multimediatype": "Scalable Vector Graphics file",
            "@type": "ALTIMG",
            "@size": "3521",
            "@ref": "si0016",
            "@mimetype": "image/svg+xml"
          },
          {
            "@category": "thumbnail",
            "@_fa": "true",
            "$": "https://api.elsevier.com/content/object/eid/1-s2.0-S0926860X23002521-si0017.svg?httpAccept=%2A%2F%2A",
            "@multimediatype": "Scalable Vector Graphics file",
            "@type": "ALTIMG",
            "@size": "1855",
            "@ref": "si0017",
            "@mimetype": "image/svg+xml"
          },
          {
            "@category": "thumbnail",
            "@_fa": "true",
            "$": "https://api.elsevier.com/content/object/eid/1-s2.0-S0926860X23002521-si0018.svg?httpAccept=%2A%2F%2A",
            "@multimediatype": "Scalable Vector Graphics file",
            "@type": "ALTIMG",
            "@size": "2435",
            "@ref": "si0018",
            "@mimetype": "image/svg+xml"
          },
          {
            "@category": "thumbnail",
            "@_fa": "true",
            "$": "https://api.elsevier.com/content/object/eid/1-s2.0-S0926860X23002521-si0019.svg?httpAccept=%2A%2F%2A",
            "@multimediatype": "Scalable Vector Graphics file",
            "@type": "ALTIMG",
            "@size": "1381",
            "@ref": "si0019",
            "@mimetype": "image/svg+xml"
          },
          {
            "@category": "thumbnail",
            "@_fa": "true",
            "$": "https://api.elsevier.com/content/object/eid/1-s2.0-S0926860X23002521-si0020.svg?httpAccept=%2A%2F%2A",
            "@multimediatype": "Scalable Vector Graphics file",
            "@type": "ALTIMG",
            "@size": "1353",
            "@ref": "si0020",
            "@mimetype": "image/svg+xml"
          },
          {
            "@category": "thumbnail",
            "@_fa": "true",
            "$": "https://api.elsevier.com/content/object/eid/1-s2.0-S0926860X23002521-si0021.svg?httpAccept=%2A%2F%2A",
            "@multimediatype": "Scalable Vector Graphics file",
            "@type": "ALTIMG",
            "@size": "3322",
            "@ref": "si0021",
            "@mimetype": "image/svg+xml"
          },
          {
            "@category": "thumbnail",
            "@_fa": "true",
            "$": "https://api.elsevier.com/content/object/eid/1-s2.0-S0926860X23002521-si0022.svg?httpAccept=%2A%2F%2A",
            "@multimediatype": "Scalable Vector Graphics file",
            "@type": "ALTIMG",
            "@size": "1235",
            "@ref": "si0022",
            "@mimetype": "image/svg+xml"
          },
          {
            "@category": "thumbnail",
            "@_fa": "true",
            "$": "https://api.elsevier.com/content/object/eid/1-s2.0-S0926860X23002521-si0023.svg?httpAccept=%2A%2F%2A",
            "@multimediatype": "Scalable Vector Graphics file",
            "@type": "ALTIMG",
            "@size": "1284",
            "@ref": "si0023",
            "@mimetype": "image/svg+xml"
          },
          {
            "@category": "thumbnail",
            "@_fa": "true",
            "$": "https://api.elsevier.com/content/object/eid/1-s2.0-S0926860X23002521-si0024.svg?httpAccept=%2A%2F%2A",
            "@multimediatype": "Scalable Vector Graphics file",
            "@type": "ALTIMG",
            "@size": "1292",
            "@ref": "si0024",
            "@mimetype": "image/svg+xml"
          },
          {
            "@category": "thumbnail",
            "@_fa": "true",
            "$": "https://api.elsevier.com/content/object/eid/1-s2.0-S0926860X23002521-si0025.svg?httpAccept=%2A%2F%2A",
            "@multimediatype": "Scalable Vector Graphics file",
            "@type": "ALTIMG",
            "@size": "1564",
            "@ref": "si0025",
            "@mimetype": "image/svg+xml"
          },
          {
            "@category": "thumbnail",
            "@_fa": "true",
            "$": "https://api.elsevier.com/content/object/eid/1-s2.0-S0926860X23002521-si0026.svg?httpAccept=%2A%2F%2A",
            "@multimediatype": "Scalable Vector Graphics file",
            "@type": "ALTIMG",
            "@size": "1183",
            "@ref": "si0026",
            "@mimetype": "image/svg+xml"
          },
          {
            "@category": "thumbnail",
            "@_fa": "true",
            "$": "https://api.elsevier.com/content/object/eid/1-s2.0-S0926860X23002521-si0027.svg?httpAccept=%2A%2F%2A",
            "@multimediatype": "Scalable Vector Graphics file",
            "@type": "ALTIMG",
            "@size": "2820",
            "@ref": "si0027",
            "@mimetype": "image/svg+xml"
          },
          {
            "@category": "thumbnail",
            "@_fa": "true",
            "$": "https://api.elsevier.com/content/object/eid/1-s2.0-S0926860X23002521-si0028.svg?httpAccept=%2A%2F%2A",
            "@multimediatype": "Scalable Vector Graphics file",
            "@type": "ALTIMG",
            "@size": "10953",
            "@ref": "si0028",
            "@mimetype": "image/svg+xml"
          },
          {
            "@category": "thumbnail",
            "@_fa": "true",
            "$": "https://api.elsevier.com/content/object/eid/1-s2.0-S0926860X23002521-si0029.svg?httpAccept=%2A%2F%2A",
            "@multimediatype": "Scalable Vector Graphics file",
            "@type": "ALTIMG",
            "@size": "1576",
            "@ref": "si0029",
            "@mimetype": "image/svg+xml"
          },
          {
            "@category": "thumbnail",
            "@_fa": "true",
            "$": "https://api.elsevier.com/content/object/eid/1-s2.0-S0926860X23002521-si0030.svg?httpAccept=%2A%2F%2A",
            "@multimediatype": "Scalable Vector Graphics file",
            "@type": "ALTIMG",
            "@size": "2735",
            "@ref": "si0030",
            "@mimetype": "image/svg+xml"
          },
          {
            "@category": "thumbnail",
            "@_fa": "true",
            "$": "https://api.elsevier.com/content/object/eid/1-s2.0-S0926860X23002521-si0031.svg?httpAccept=%2A%2F%2A",
            "@multimediatype": "Scalable Vector Graphics file",
            "@type": "ALTIMG",
            "@size": "2030",
            "@ref": "si0031",
            "@mimetype": "image/svg+xml"
          },
          {
            "@category": "thumbnail",
            "@_fa": "true",
            "$": "https://api.elsevier.com/content/object/eid/1-s2.0-S0926860X23002521-si0032.svg?httpAccept=%2A%2F%2A",
            "@multimediatype": "Scalable Vector Graphics file",
            "@type": "ALTIMG",
            "@size": "1231",
            "@ref": "si0032",
            "@mimetype": "image/svg+xml"
          },
          {
            "@category": "thumbnail",
            "@_fa": "true",
            "$": "https://api.elsevier.com/content/object/eid/1-s2.0-S0926860X23002521-si0033.svg?httpAccept=%2A%2F%2A",
            "@multimediatype": "Scalable Vector Graphics file",
            "@type": "ALTIMG",
            "@size": "1944",
            "@ref": "si0033",
            "@mimetype": "image/svg+xml"
          },
          {
            "@category": "thumbnail",
            "@_fa": "true",
            "$": "https://api.elsevier.com/content/object/eid/1-s2.0-S0926860X23002521-si0034.svg?httpAccept=%2A%2F%2A",
            "@multimediatype": "Scalable Vector Graphics file",
            "@type": "ALTIMG",
            "@size": "1134",
            "@ref": "si0034",
            "@mimetype": "image/svg+xml"
          },
          {
            "@category": "thumbnail",
            "@_fa": "true",
            "$": "https://api.elsevier.com/content/object/eid/1-s2.0-S0926860X23002521-si0035.svg?httpAccept=%2A%2F%2A",
            "@multimediatype": "Scalable Vector Graphics file",
            "@type": "ALTIMG",
            "@size": "1150",
            "@ref": "si0035",
            "@mimetype": "image/svg+xml"
          },
          {
            "@category": "thumbnail",
            "@_fa": "true",
            "$": "https://api.elsevier.com/content/object/eid/1-s2.0-S0926860X23002521-si0036.svg?httpAccept=%2A%2F%2A",
            "@multimediatype": "Scalable Vector Graphics file",
            "@type": "ALTIMG",
            "@size": "2702",
            "@ref": "si0036",
            "@mimetype": "image/svg+xml"
          },
          {
            "@category": "thumbnail",
            "@_fa": "true",
            "$": "https://api.elsevier.com/content/object/eid/1-s2.0-S0926860X23002521-si0037.svg?httpAccept=%2A%2F%2A",
            "@multimediatype": "Scalable Vector Graphics file",
            "@type": "ALTIMG",
            "@size": "4615",
            "@ref": "si0037",
            "@mimetype": "image/svg+xml"
          },
          {
            "@category": "thumbnail",
            "@_fa": "true",
            "$": "https://api.elsevier.com/content/object/eid/1-s2.0-S0926860X23002521-si0038.svg?httpAccept=%2A%2F%2A",
            "@multimediatype": "Scalable Vector Graphics file",
            "@type": "ALTIMG",
            "@size": "2800",
            "@ref": "si0038",
            "@mimetype": "image/svg+xml"
          },
          {
            "@category": "standard",
            "@_fa": "true",
            "$": "https://api.elsevier.com/content/object/eid/1-s2.0-S0926860X23002521-am.pdf?httpAccept=%2A%2F%2A",
            "@multimediatype": "Acrobat PDF file",
            "@type": "AAM-PDF",
            "@size": "2051271",
            "@ref": "am",
            "@mimetype": "application/pdf"
          }
        ]
      },
      "link": {
        "@rel": "abstract",
        "@href": "https://api.elsevier.com/content/abstract/scopus_id/85160516801"
      }
    }
  }
}