{
  "metadata": {
    "title": "Crystalline niobia with tailored porosity as support for cobalt catalysts for the Fischer–Tropsch synthesis",
    "authors": "; ; ",
    "journal": "Applied Catalysis A: General",
    "date": "2017-11-25",
    "doi": "10.1016/j.apcata.2017.07.016",
    "abstract": "",
    "uri": "https://api.elsevier.com/content/article/pii/S0926860X17303162",
    "pii": "S0926860X17303162"
  },
  "fulltext": {
    "full-text-retrieval-response": {
      "scopus-eid": "2-s2.0-85025674219",
      "originalText": "serial JL 271346 291210 291744 291809 31 90 Applied Catalysis A: General APPLIEDCATALYSISAGENERAL 2017-07-18 2017-07-18 2017-10-25 2017-10-25 2018-07-10T20:59:54 1-s2.0-S0926860X17303162 S0926-860X(17)30316-2 S0926860X17303162 10.1016/j.apcata.2017.07.016 S300 S300.2 FULL-TEXT 1-s2.0-S0926860X17X00173 2024-01-01T12:31:47.592716Z 0 0 20171125 2017 2017-07-18T15:57:59.485064Z absattachment articleinfo articletitlenorm authfirstinitialnorm authfirstsurnamenorm cid cids confeditor contenttype copyright crossmark dateloaded dateloadedtxt datesearch datesort dateupdated dco docsubtype doctype doi eid ewtransactionid fundingbodyid hubeid indexeddate issn issnnorm itemstage itemtransactionid itemweight oauserlicense openaccess openarchive pg pgfirst pglast pii piinorm pubdatestart pubdatetxt pubyr sortorder sponsoredaccesstype srctitle srctitlenorm srctype ssids alllist content oa subj subheadings suppl tomb vol volfirst volissue volumelist webpdf webpdfpagecount yearnav figure table e-component body acknowledge affil appendices articletitle auth authfirstini authfull authkeywords authlast grantsponsor highlightsabst primabst ref specialabst 0926-860X 0926860X UNLIMITED VSNUGOLD true 548 548 C Volume 548 21 143 149 143 149 20171125 25 November 2017 2017-11-25 2017 Special issue in honor of Prof. Martin Schmal José Maria Correa Bueno Fabio B. Passos article fla © 2017 The Author(s). Published by Elsevier B.V. CRYSTALLINENIOBIATAILOREDPOROSITYSUPPORTFORCOBALTCATALYSTSFORFISCHERTROPSCHSYNTHESIS HERNANDEZMEJIA C 1 Introduction 2 Experimental 2.1 Catalyst preparation 2.2 Characterization 2.3 Catalytic testing 3 Results and discussion 3.1 Niobium oxide hydrate thermal treatment 3.2 Modified niobia crystallization 3.3 Cobalt deposition 3.4 Catalytic testing 4 Conclusions Acknowledgments Appendix A Supplementary data References KHODAKOV 2007 1692 1744 A SOARES 1993 361 370 R SILVA 1993 3975 3980 R FRYDMAN 1993 2797 2800 A DENOTTER 2013 445 450 J DENOTTER 2016 1616 1623 J DENOTTER 2016 270 275 J DENOTTER 2016 J PHDTHESISNIOBIASUPPORTEDCOBALTCATALYSTSFORFISCHERTROPSCHSYNTHESIS NOWAK 1999 3603 3624 I CHEN 2007 8500 8506 X KIM 2017 S LEE 2002 11256 11257 B LEITE 2006 18088 18090 E MURAYAMA 2014 4250 4257 T LEITE 2006 18088 18090 E CHAI 2007 342 349 S FREVEL 1955 1329 1330 L SCHAFER 1966 40 52 H NORONHA 1999 2861 2867 F SEXTON 1986 390 406 B JACOBS 2007 177 191 G DENBREEJEN 2011 768 777 J HERNANDEZMEJIAX2017X143 HERNANDEZMEJIAX2017X143X149 HERNANDEZMEJIAX2017X143XC HERNANDEZMEJIAX2017X143X149XC Full 2017-07-16T21:11:11Z FundingBody VSNU http://creativecommons.org/licenses/by/4.0/ 2019-10-25T00:00:00.000Z UnderEmbargo http://creativecommons.org/licenses/by-nc-nd/4.0/ This is an open access article under the CC BY license. © 2017 The Author(s). Published by Elsevier B.V. item S0926-860X(17)30316-2 S0926860X17303162 1-s2.0-S0926860X17303162 10.1016/j.apcata.2017.07.016 271346 2024-01-01T12:31:47.592716Z 2017-11-25 UNLIMITED VSNUGOLD 1-s2.0-S0926860X17303162-main.pdf https://s3-eu-west-1.amazonaws.com/prod-ucs-content-store-eu-west/content/pii:S0926860X17303162/MAIN/application/pdf/9d5f637c124ad3bd4c6691dc69c01685/main.pdf https://s3.amazonaws.com/prod-ucs-content-store-us-east/content/pii:S0926860X17303162/MAIN/application/pdf/9d5f637c124ad3bd4c6691dc69c01685/main.pdf main.pdf pdf true 1299874 MAIN 7 1-s2.0-S0926860X17303162-main_1.png https://s3-eu-west-1.amazonaws.com/prod-ucs-content-store-eu-west/content/pii:S0926860X17303162/PREVIEW/image/png/456f3598474086541af53f87b335bac5/main_1.png https://s3.amazonaws.com/prod-ucs-content-store-us-east/content/pii:S0926860X17303162/PREVIEW/image/png/456f3598474086541af53f87b335bac5/main_1.png main_1.png png 54938 849 656 IMAGE-WEB-PDF 1 1-s2.0-S0926860X17303162-fx1.sml https://s3-eu-west-1.amazonaws.com/prod-ucs-content-store-eu-west/content/pii:S0926860X17303162/fx1/THUMBNAIL/image/gif/e2a17c931b735217443ab9ed16c8c1b8/fx1.sml https://s3.amazonaws.com/prod-ucs-content-store-us-east/content/pii:S0926860X17303162/fx1/THUMBNAIL/image/gif/e2a17c931b735217443ab9ed16c8c1b8/fx1.sml fx1 true fx1.sml sml 6012 78 219 IMAGE-THUMBNAIL 1-s2.0-S0926860X17303162-fx2.sml https://s3-eu-west-1.amazonaws.com/prod-ucs-content-store-eu-west/content/pii:S0926860X17303162/fx2/THUMBNAIL/image/gif/4f4ed8801b480add3e3830edf513c6a6/fx2.sml https://s3.amazonaws.com/prod-ucs-content-store-us-east/content/pii:S0926860X17303162/fx2/THUMBNAIL/image/gif/4f4ed8801b480add3e3830edf513c6a6/fx2.sml fx2 fx2.sml sml 1589 41 43 IMAGE-THUMBNAIL 1-s2.0-S0926860X17303162-fx3.sml https://s3-eu-west-1.amazonaws.com/prod-ucs-content-store-eu-west/content/pii:S0926860X17303162/fx3/THUMBNAIL/image/gif/ae26dae229e3e2890dcb50813bdeea4a/fx3.sml https://s3.amazonaws.com/prod-ucs-content-store-us-east/content/pii:S0926860X17303162/fx3/THUMBNAIL/image/gif/ae26dae229e3e2890dcb50813bdeea4a/fx3.sml fx3 fx3.sml sml 1186 44 45 IMAGE-THUMBNAIL 1-s2.0-S0926860X17303162-fx4.sml https://s3-eu-west-1.amazonaws.com/prod-ucs-content-store-eu-west/content/pii:S0926860X17303162/fx4/THUMBNAIL/image/gif/dbd09081603214ccc2abe31fb3f046bf/fx4.sml https://s3.amazonaws.com/prod-ucs-content-store-us-east/content/pii:S0926860X17303162/fx4/THUMBNAIL/image/gif/dbd09081603214ccc2abe31fb3f046bf/fx4.sml fx4 fx4.sml sml 1532 47 47 IMAGE-THUMBNAIL 1-s2.0-S0926860X17303162-gr1.sml https://s3-eu-west-1.amazonaws.com/prod-ucs-content-store-eu-west/content/pii:S0926860X17303162/gr1/THUMBNAIL/image/gif/c1803c206e60b2d56d377d768d6d3dc4/gr1.sml https://s3.amazonaws.com/prod-ucs-content-store-us-east/content/pii:S0926860X17303162/gr1/THUMBNAIL/image/gif/c1803c206e60b2d56d377d768d6d3dc4/gr1.sml gr1 gr1.sml sml 6104 113 219 IMAGE-THUMBNAIL 1-s2.0-S0926860X17303162-gr10.sml https://s3-eu-west-1.amazonaws.com/prod-ucs-content-store-eu-west/content/pii:S0926860X17303162/gr10/THUMBNAIL/image/gif/c9490825e222dd5f0fc11ffc3398769c/gr10.sml https://s3.amazonaws.com/prod-ucs-content-store-us-east/content/pii:S0926860X17303162/gr10/THUMBNAIL/image/gif/c9490825e222dd5f0fc11ffc3398769c/gr10.sml gr10 gr10.sml sml 5559 85 219 IMAGE-THUMBNAIL 1-s2.0-S0926860X17303162-gr2.sml https://s3-eu-west-1.amazonaws.com/prod-ucs-content-store-eu-west/content/pii:S0926860X17303162/gr2/THUMBNAIL/image/gif/8599ffef47928374a8d9ac33ce74d745/gr2.sml https://s3.amazonaws.com/prod-ucs-content-store-us-east/content/pii:S0926860X17303162/gr2/THUMBNAIL/image/gif/8599ffef47928374a8d9ac33ce74d745/gr2.sml gr2 gr2.sml sml 6586 150 219 IMAGE-THUMBNAIL 1-s2.0-S0926860X17303162-gr3.sml https://s3-eu-west-1.amazonaws.com/prod-ucs-content-store-eu-west/content/pii:S0926860X17303162/gr3/THUMBNAIL/image/gif/c74d894bd5f6a32f6635b65926d13b89/gr3.sml https://s3.amazonaws.com/prod-ucs-content-store-us-east/content/pii:S0926860X17303162/gr3/THUMBNAIL/image/gif/c74d894bd5f6a32f6635b65926d13b89/gr3.sml gr3 gr3.sml sml 4250 75 219 IMAGE-THUMBNAIL 1-s2.0-S0926860X17303162-gr4.sml https://s3-eu-west-1.amazonaws.com/prod-ucs-content-store-eu-west/content/pii:S0926860X17303162/gr4/THUMBNAIL/image/gif/b8cf082b3dc4eac169830e6d209d848a/gr4.sml https://s3.amazonaws.com/prod-ucs-content-store-us-east/content/pii:S0926860X17303162/gr4/THUMBNAIL/image/gif/b8cf082b3dc4eac169830e6d209d848a/gr4.sml gr4 gr4.sml sml 6317 127 219 IMAGE-THUMBNAIL 1-s2.0-S0926860X17303162-gr5.sml https://s3-eu-west-1.amazonaws.com/prod-ucs-content-store-eu-west/content/pii:S0926860X17303162/gr5/THUMBNAIL/image/gif/374e1078ca2e07f9876f39aae7b9dacc/gr5.sml https://s3.amazonaws.com/prod-ucs-content-store-us-east/content/pii:S0926860X17303162/gr5/THUMBNAIL/image/gif/374e1078ca2e07f9876f39aae7b9dacc/gr5.sml gr5 gr5.sml sml 14088 107 219 IMAGE-THUMBNAIL 1-s2.0-S0926860X17303162-gr6.sml https://s3-eu-west-1.amazonaws.com/prod-ucs-content-store-eu-west/content/pii:S0926860X17303162/gr6/THUMBNAIL/image/gif/f8a81d404428ee1371834d5e38295161/gr6.sml https://s3.amazonaws.com/prod-ucs-content-store-us-east/content/pii:S0926860X17303162/gr6/THUMBNAIL/image/gif/f8a81d404428ee1371834d5e38295161/gr6.sml gr6 gr6.sml sml 4705 60 219 IMAGE-THUMBNAIL 1-s2.0-S0926860X17303162-gr7.sml https://s3-eu-west-1.amazonaws.com/prod-ucs-content-store-eu-west/content/pii:S0926860X17303162/gr7/THUMBNAIL/image/gif/da1449b79bea7b26e8cf1f6256ae0521/gr7.sml https://s3.amazonaws.com/prod-ucs-content-store-us-east/content/pii:S0926860X17303162/gr7/THUMBNAIL/image/gif/da1449b79bea7b26e8cf1f6256ae0521/gr7.sml gr7 gr7.sml sml 5646 113 219 IMAGE-THUMBNAIL 1-s2.0-S0926860X17303162-gr8.sml https://s3-eu-west-1.amazonaws.com/prod-ucs-content-store-eu-west/content/pii:S0926860X17303162/gr8/THUMBNAIL/image/gif/ed14c3740e0e2e8886af80b735e7f75b/gr8.sml https://s3.amazonaws.com/prod-ucs-content-store-us-east/content/pii:S0926860X17303162/gr8/THUMBNAIL/image/gif/ed14c3740e0e2e8886af80b735e7f75b/gr8.sml gr8 gr8.sml sml 5472 162 42 IMAGE-THUMBNAIL 1-s2.0-S0926860X17303162-gr9.sml https://s3-eu-west-1.amazonaws.com/prod-ucs-content-store-eu-west/content/pii:S0926860X17303162/gr9/THUMBNAIL/image/gif/1422f0279110911105453db0b00ac1e1/gr9.sml https://s3.amazonaws.com/prod-ucs-content-store-us-east/content/pii:S0926860X17303162/gr9/THUMBNAIL/image/gif/1422f0279110911105453db0b00ac1e1/gr9.sml gr9 gr9.sml sml 4888 151 219 IMAGE-THUMBNAIL 1-s2.0-S0926860X17303162-fx1.jpg https://s3-eu-west-1.amazonaws.com/prod-ucs-content-store-eu-west/content/pii:S0926860X17303162/fx1/DOWNSAMPLED/image/jpeg/9b46f479346d72232f5410e32ecc526d/fx1.jpg https://s3.amazonaws.com/prod-ucs-content-store-us-east/content/pii:S0926860X17303162/fx1/DOWNSAMPLED/image/jpeg/9b46f479346d72232f5410e32ecc526d/fx1.jpg fx1 true fx1.jpg jpg 26233 178 500 IMAGE-DOWNSAMPLED 1-s2.0-S0926860X17303162-fx2.jpg https://s3-eu-west-1.amazonaws.com/prod-ucs-content-store-eu-west/content/pii:S0926860X17303162/fx2/DOWNSAMPLED/image/jpeg/e7e8764a3e26f31b0d3259a01a812f08/fx2.jpg https://s3.amazonaws.com/prod-ucs-content-store-us-east/content/pii:S0926860X17303162/fx2/DOWNSAMPLED/image/jpeg/e7e8764a3e26f31b0d3259a01a812f08/fx2.jpg fx2 fx2.jpg jpg 420 9 9 IMAGE-DOWNSAMPLED 1-s2.0-S0926860X17303162-fx3.jpg https://s3-eu-west-1.amazonaws.com/prod-ucs-content-store-eu-west/content/pii:S0926860X17303162/fx3/DOWNSAMPLED/image/jpeg/2ccf417a17d1bd912144d7bc614ae395/fx3.jpg https://s3.amazonaws.com/prod-ucs-content-store-us-east/content/pii:S0926860X17303162/fx3/DOWNSAMPLED/image/jpeg/2ccf417a17d1bd912144d7bc614ae395/fx3.jpg fx3 fx3.jpg jpg 444 10 10 IMAGE-DOWNSAMPLED 1-s2.0-S0926860X17303162-fx4.jpg https://s3-eu-west-1.amazonaws.com/prod-ucs-content-store-eu-west/content/pii:S0926860X17303162/fx4/DOWNSAMPLED/image/jpeg/75fbca073b65a4d6427822bbd78d6ded/fx4.jpg https://s3.amazonaws.com/prod-ucs-content-store-us-east/content/pii:S0926860X17303162/fx4/DOWNSAMPLED/image/jpeg/75fbca073b65a4d6427822bbd78d6ded/fx4.jpg fx4 fx4.jpg jpg 454 10 10 IMAGE-DOWNSAMPLED 1-s2.0-S0926860X17303162-gr1.jpg https://s3-eu-west-1.amazonaws.com/prod-ucs-content-store-eu-west/content/pii:S0926860X17303162/gr1/DOWNSAMPLED/image/jpeg/cb02d2798cc87170e27539efd0564ffb/gr1.jpg https://s3.amazonaws.com/prod-ucs-content-store-us-east/content/pii:S0926860X17303162/gr1/DOWNSAMPLED/image/jpeg/cb02d2798cc87170e27539efd0564ffb/gr1.jpg gr1 gr1.jpg jpg 13813 145 282 IMAGE-DOWNSAMPLED 1-s2.0-S0926860X17303162-gr10.jpg https://s3-eu-west-1.amazonaws.com/prod-ucs-content-store-eu-west/content/pii:S0926860X17303162/gr10/DOWNSAMPLED/image/jpeg/a8167ad156e4a10beeb4f51a1bb0a0c0/gr10.jpg https://s3.amazonaws.com/prod-ucs-content-store-us-east/content/pii:S0926860X17303162/gr10/DOWNSAMPLED/image/jpeg/a8167ad156e4a10beeb4f51a1bb0a0c0/gr10.jpg gr10 gr10.jpg jpg 32856 218 565 IMAGE-DOWNSAMPLED 1-s2.0-S0926860X17303162-gr2.jpg https://s3-eu-west-1.amazonaws.com/prod-ucs-content-store-eu-west/content/pii:S0926860X17303162/gr2/DOWNSAMPLED/image/jpeg/063141a44ce53f16fac241215a631a15/gr2.jpg https://s3.amazonaws.com/prod-ucs-content-store-us-east/content/pii:S0926860X17303162/gr2/DOWNSAMPLED/image/jpeg/063141a44ce53f16fac241215a631a15/gr2.jpg gr2 gr2.jpg jpg 18990 232 339 IMAGE-DOWNSAMPLED 1-s2.0-S0926860X17303162-gr3.jpg https://s3-eu-west-1.amazonaws.com/prod-ucs-content-store-eu-west/content/pii:S0926860X17303162/gr3/DOWNSAMPLED/image/jpeg/7789580e3533c652dd67b5147e16d9c0/gr3.jpg https://s3.amazonaws.com/prod-ucs-content-store-us-east/content/pii:S0926860X17303162/gr3/DOWNSAMPLED/image/jpeg/7789580e3533c652dd67b5147e16d9c0/gr3.jpg gr3 gr3.jpg jpg 22430 193 565 IMAGE-DOWNSAMPLED 1-s2.0-S0926860X17303162-gr4.jpg https://s3-eu-west-1.amazonaws.com/prod-ucs-content-store-eu-west/content/pii:S0926860X17303162/gr4/DOWNSAMPLED/image/jpeg/c83a2e0fbcbe188948835bbd6cae7fc1/gr4.jpg https://s3.amazonaws.com/prod-ucs-content-store-us-east/content/pii:S0926860X17303162/gr4/DOWNSAMPLED/image/jpeg/c83a2e0fbcbe188948835bbd6cae7fc1/gr4.jpg gr4 gr4.jpg jpg 18335 219 376 IMAGE-DOWNSAMPLED 1-s2.0-S0926860X17303162-gr5.jpg https://s3-eu-west-1.amazonaws.com/prod-ucs-content-store-eu-west/content/pii:S0926860X17303162/gr5/DOWNSAMPLED/image/jpeg/21ecb179f9f3bfa2f00755cb7ebe4142/gr5.jpg https://s3.amazonaws.com/prod-ucs-content-store-us-east/content/pii:S0926860X17303162/gr5/DOWNSAMPLED/image/jpeg/21ecb179f9f3bfa2f00755cb7ebe4142/gr5.jpg gr5 gr5.jpg jpg 30475 248 508 IMAGE-DOWNSAMPLED 1-s2.0-S0926860X17303162-gr6.jpg https://s3-eu-west-1.amazonaws.com/prod-ucs-content-store-eu-west/content/pii:S0926860X17303162/gr6/DOWNSAMPLED/image/jpeg/1f2ee62f38b832c8bef72ff1d236d4e2/gr6.jpg https://s3.amazonaws.com/prod-ucs-content-store-us-east/content/pii:S0926860X17303162/gr6/DOWNSAMPLED/image/jpeg/1f2ee62f38b832c8bef72ff1d236d4e2/gr6.jpg gr6 gr6.jpg jpg 37970 179 659 IMAGE-DOWNSAMPLED 1-s2.0-S0926860X17303162-gr7.jpg https://s3-eu-west-1.amazonaws.com/prod-ucs-content-store-eu-west/content/pii:S0926860X17303162/gr7/DOWNSAMPLED/image/jpeg/82387c1c88e9654850e7667f3c4f8135/gr7.jpg https://s3.amazonaws.com/prod-ucs-content-store-us-east/content/pii:S0926860X17303162/gr7/DOWNSAMPLED/image/jpeg/82387c1c88e9654850e7667f3c4f8135/gr7.jpg gr7 gr7.jpg jpg 19417 194 376 IMAGE-DOWNSAMPLED 1-s2.0-S0926860X17303162-gr8.jpg https://s3-eu-west-1.amazonaws.com/prod-ucs-content-store-eu-west/content/pii:S0926860X17303162/gr8/DOWNSAMPLED/image/jpeg/b7776931370e28c16b7baa925e7e780e/gr8.jpg https://s3.amazonaws.com/prod-ucs-content-store-us-east/content/pii:S0926860X17303162/gr8/DOWNSAMPLED/image/jpeg/b7776931370e28c16b7baa925e7e780e/gr8.jpg gr8 gr8.jpg jpg 53986 941 244 IMAGE-DOWNSAMPLED 1-s2.0-S0926860X17303162-gr9.jpg https://s3-eu-west-1.amazonaws.com/prod-ucs-content-store-eu-west/content/pii:S0926860X17303162/gr9/DOWNSAMPLED/image/jpeg/f57f4c849ab2d2e0a02f31221b5b90f9/gr9.jpg https://s3.amazonaws.com/prod-ucs-content-store-us-east/content/pii:S0926860X17303162/gr9/DOWNSAMPLED/image/jpeg/f57f4c849ab2d2e0a02f31221b5b90f9/gr9.jpg gr9 gr9.jpg jpg 14101 221 320 IMAGE-DOWNSAMPLED 1-s2.0-S0926860X17303162-fx1_lrg.jpg https://s3-eu-west-1.amazonaws.com/prod-ucs-content-store-eu-west/content/pii:S0926860X17303162/fx1/HIGHRES/image/jpeg/a3955f6875323ad5dc56707b15fdf703/fx1_lrg.jpg https://s3.amazonaws.com/prod-ucs-content-store-us-east/content/pii:S0926860X17303162/fx1/HIGHRES/image/jpeg/a3955f6875323ad5dc56707b15fdf703/fx1_lrg.jpg fx1 true fx1_lrg.jpg jpg 173236 788 2213 IMAGE-HIGH-RES 1-s2.0-S0926860X17303162-fx2_lrg.jpg https://s3-eu-west-1.amazonaws.com/prod-ucs-content-store-eu-west/content/pii:S0926860X17303162/fx2/HIGHRES/image/jpeg/e6a08f46a9d27fc2294df89cd0739310/fx2_lrg.jpg https://s3.amazonaws.com/prod-ucs-content-store-us-east/content/pii:S0926860X17303162/fx2/HIGHRES/image/jpeg/e6a08f46a9d27fc2294df89cd0739310/fx2_lrg.jpg fx2 fx2_lrg.jpg jpg 1289 41 43 IMAGE-HIGH-RES 1-s2.0-S0926860X17303162-fx3_lrg.jpg https://s3-eu-west-1.amazonaws.com/prod-ucs-content-store-eu-west/content/pii:S0926860X17303162/fx3/HIGHRES/image/jpeg/72fb5917a005dab6269302c2d229f3e2/fx3_lrg.jpg https://s3.amazonaws.com/prod-ucs-content-store-us-east/content/pii:S0926860X17303162/fx3/HIGHRES/image/jpeg/72fb5917a005dab6269302c2d229f3e2/fx3_lrg.jpg fx3 fx3_lrg.jpg jpg 1067 44 45 IMAGE-HIGH-RES 1-s2.0-S0926860X17303162-fx4_lrg.jpg https://s3-eu-west-1.amazonaws.com/prod-ucs-content-store-eu-west/content/pii:S0926860X17303162/fx4/HIGHRES/image/jpeg/1732d85f94a427735386d2db7cf2e601/fx4_lrg.jpg https://s3.amazonaws.com/prod-ucs-content-store-us-east/content/pii:S0926860X17303162/fx4/HIGHRES/image/jpeg/1732d85f94a427735386d2db7cf2e601/fx4_lrg.jpg fx4 fx4_lrg.jpg jpg 1116 47 47 IMAGE-HIGH-RES 1-s2.0-S0926860X17303162-gr1_lrg.jpg https://s3-eu-west-1.amazonaws.com/prod-ucs-content-store-eu-west/content/pii:S0926860X17303162/gr1/HIGHRES/image/jpeg/51342681504834a213ce82053d9da674/gr1_lrg.jpg https://s3.amazonaws.com/prod-ucs-content-store-us-east/content/pii:S0926860X17303162/gr1/HIGHRES/image/jpeg/51342681504834a213ce82053d9da674/gr1_lrg.jpg gr1 gr1_lrg.jpg jpg 109448 644 1250 IMAGE-HIGH-RES 1-s2.0-S0926860X17303162-gr10_lrg.jpg https://s3-eu-west-1.amazonaws.com/prod-ucs-content-store-eu-west/content/pii:S0926860X17303162/gr10/HIGHRES/image/jpeg/a99c1e4863d68e57b1e57469ef2da437/gr10_lrg.jpg https://s3.amazonaws.com/prod-ucs-content-store-us-east/content/pii:S0926860X17303162/gr10/HIGHRES/image/jpeg/a99c1e4863d68e57b1e57469ef2da437/gr10_lrg.jpg gr10 gr10_lrg.jpg jpg 241462 966 2501 IMAGE-HIGH-RES 1-s2.0-S0926860X17303162-gr2_lrg.jpg https://s3-eu-west-1.amazonaws.com/prod-ucs-content-store-eu-west/content/pii:S0926860X17303162/gr2/HIGHRES/image/jpeg/6b86504163b5bfa934616a11af8b5465/gr2_lrg.jpg https://s3.amazonaws.com/prod-ucs-content-store-us-east/content/pii:S0926860X17303162/gr2/HIGHRES/image/jpeg/6b86504163b5bfa934616a11af8b5465/gr2_lrg.jpg gr2 gr2_lrg.jpg jpg 129436 1027 1501 IMAGE-HIGH-RES 1-s2.0-S0926860X17303162-gr3_lrg.jpg https://s3-eu-west-1.amazonaws.com/prod-ucs-content-store-eu-west/content/pii:S0926860X17303162/gr3/HIGHRES/image/jpeg/83dd597d3d0d64d75b8708e5671375cc/gr3_lrg.jpg https://s3.amazonaws.com/prod-ucs-content-store-us-east/content/pii:S0926860X17303162/gr3/HIGHRES/image/jpeg/83dd597d3d0d64d75b8708e5671375cc/gr3_lrg.jpg gr3 gr3_lrg.jpg jpg 186401 852 2500 IMAGE-HIGH-RES 1-s2.0-S0926860X17303162-gr4_lrg.jpg https://s3-eu-west-1.amazonaws.com/prod-ucs-content-store-eu-west/content/pii:S0926860X17303162/gr4/HIGHRES/image/jpeg/b925d916806ffbfcb07b25660405e8d0/gr4_lrg.jpg https://s3.amazonaws.com/prod-ucs-content-store-us-east/content/pii:S0926860X17303162/gr4/HIGHRES/image/jpeg/b925d916806ffbfcb07b25660405e8d0/gr4_lrg.jpg gr4 gr4_lrg.jpg jpg 130958 969 1667 IMAGE-HIGH-RES 1-s2.0-S0926860X17303162-gr5_lrg.jpg https://s3-eu-west-1.amazonaws.com/prod-ucs-content-store-eu-west/content/pii:S0926860X17303162/gr5/HIGHRES/image/jpeg/d8992879604223123cf3d71be82bf80c/gr5_lrg.jpg https://s3.amazonaws.com/prod-ucs-content-store-us-east/content/pii:S0926860X17303162/gr5/HIGHRES/image/jpeg/d8992879604223123cf3d71be82bf80c/gr5_lrg.jpg gr5 gr5_lrg.jpg jpg 335580 1100 2250 IMAGE-HIGH-RES 1-s2.0-S0926860X17303162-gr6_lrg.jpg https://s3-eu-west-1.amazonaws.com/prod-ucs-content-store-eu-west/content/pii:S0926860X17303162/gr6/HIGHRES/image/jpeg/a51b47d83066c310d76dd564d150ee93/gr6_lrg.jpg https://s3.amazonaws.com/prod-ucs-content-store-us-east/content/pii:S0926860X17303162/gr6/HIGHRES/image/jpeg/a51b47d83066c310d76dd564d150ee93/gr6_lrg.jpg gr6 gr6_lrg.jpg jpg 299636 793 2917 IMAGE-HIGH-RES 1-s2.0-S0926860X17303162-gr7_lrg.jpg https://s3-eu-west-1.amazonaws.com/prod-ucs-content-store-eu-west/content/pii:S0926860X17303162/gr7/HIGHRES/image/jpeg/3fd82cb50fcacad0ad26269f9ce89029/gr7_lrg.jpg https://s3.amazonaws.com/prod-ucs-content-store-us-east/content/pii:S0926860X17303162/gr7/HIGHRES/image/jpeg/3fd82cb50fcacad0ad26269f9ce89029/gr7_lrg.jpg gr7 gr7_lrg.jpg jpg 136907 859 1667 IMAGE-HIGH-RES 1-s2.0-S0926860X17303162-gr8_lrg.jpg https://s3-eu-west-1.amazonaws.com/prod-ucs-content-store-eu-west/content/pii:S0926860X17303162/gr8/HIGHRES/image/jpeg/2722f62ff79b38e31c747fd5b8dd3c9d/gr8_lrg.jpg https://s3.amazonaws.com/prod-ucs-content-store-us-east/content/pii:S0926860X17303162/gr8/HIGHRES/image/jpeg/2722f62ff79b38e31c747fd5b8dd3c9d/gr8_lrg.jpg gr8 gr8_lrg.jpg jpg 570271 4178 1083 IMAGE-HIGH-RES 1-s2.0-S0926860X17303162-gr9_lrg.jpg https://s3-eu-west-1.amazonaws.com/prod-ucs-content-store-eu-west/content/pii:S0926860X17303162/gr9/HIGHRES/image/jpeg/1d66e84ed2d36269f9df10679c48fc22/gr9_lrg.jpg https://s3.amazonaws.com/prod-ucs-content-store-us-east/content/pii:S0926860X17303162/gr9/HIGHRES/image/jpeg/1d66e84ed2d36269f9df10679c48fc22/gr9_lrg.jpg gr9 gr9_lrg.jpg jpg 94140 978 1417 IMAGE-HIGH-RES 1-s2.0-S0926860X17303162-mmc1.docx https://s3-eu-west-1.amazonaws.com/prod-ucs-content-store-eu-west/content/pii:S0926860X17303162/mmc1/MAIN/application/vnd.openxmlformats-officedocument.wordprocessingml.document/7582eb4a7befe447489e96bd9e3dbb61/mmc1.docx https://s3.amazonaws.com/prod-ucs-content-store-us-east/content/pii:S0926860X17303162/mmc1/MAIN/application/vnd.openxmlformats-officedocument.wordprocessingml.document/7582eb4a7befe447489e96bd9e3dbb61/mmc1.docx mmc1 mmc1.docx docx 617112 APPLICATION APCATA 16321 S0926-860X(17)30316-2 10.1016/j.apcata.2017.07.016 The Author(s) Fig. 1 X-ray diffractograms for Niobium oxide hydrate calcined in stagnant air at 400, 500, 700 and 900°C. Fig. 1 Fig. 2 Decrease in specific surface area (black circles) and specific pore volume (blue squares) of niobium oxide hydrate upon temperature increase. Fig. 2 Fig. 3 N2-physisorption isotherms and pore size distributions for niobium oxide hydrate treated in the temperature range 120–600°C. Fig. 3 Fig. 4 Pore size distribution for the initial material (niobium oxide hydrate, black) and the crystalline materials: Nb2O5 calcined at 600°C (blue) and Nb2O5–MC (red). (For interpretation of the references to colour in this figure legend, the reader is referred to the web version of this article.) Fig. 4 Fig. 5 Dark field STEM images of the crystalline materials: (A) dense Nb2O5 obtained by calcination at 600 °C and (B) porous Nb2O5–MC obtained by sucrose impregnation, pyrolysis and calcination. Fig. 5 Fig. 6 X-ray diffractograms of the calcined cobalt catalysts supported on amorphous niobium oxide hydrate (A) or crystalline niobia pretreated at 600°C (B). indicate Co3O4, indicate Nb2O5 (T-phase) and indicate Co0. Fig. 6 Fig. 7 Temperature programmed reduction profiles for two catalysts after impregnation, drying and calcination: 5wt.% cobalt supported on crystalline niobia (treated at 600 °C) and 10wt.% cobalt supported on amorphous niobium oxide hydrate (treated at 120 °C). Fig. 7 Fig. 8 STEM-EDX mapping images of cobalt catalysts after reduction and passivation, cobalt is shown in red and the support in grey. Nb2O5–MC supported catalysts with 6 wt.% Co (A) and 10wt.% Co (B). 6wt.% Co catalyst supported on niobia pretreated at 600 °C (C). Histogram from the particle size measurement (D). (For interpretation of the references to colour in this figure legend, the reader is referred to the web version of this article.) Fig. 8 Fig. 9 Cobalt-weight normalized activity (CTY) and C5+ selectivity for the Fischer–Tropsch reaction (1bar, 220°C and H2/CO=2). Cobalt was deposited by multiple impregnations (loadings≥10wt.%) on crystalline niobia pretreated at 600 °C. Fig. 9 Fig. 10 Catalytic activity up to 100h on stream for Co supported on crystalline niobia. (A) Activity normalized per catalyst weight (Weight Time Yield, WTY) and (B) activity per unit weight of cobalt (Cobalt Time Yield, CTY). Fig. 10 Table 1 Summary of the characterization results for niobia after the different treatments. SABET: specific surface area, PV: specific mesopore volume and PD: pore diameter. Table 1 Crystallization conditions Crystal phase SABET (m2 g−1) PV (cm3 g−1) PD (nm) Niobium oxide hydrate thermal treatment 120°C, stagnant air muffle oven amorphous 173 0.19 2–5 400°C, muffle oven amorphous 86 0.12 2–7 600°C, stagnant air, muffle oven Pseudo-hexagonal TT 9 0.05 >50 700°C, stagnant air, muffle oven Hexagonal T 6 0.01 >50 900°C, stagnant air, muffle oven Monoclinic H 1 <0.01 >50 Modified niobia crystallization 600°C, stagnant air, quartz reactor Pseudo-hexagonal TT 25 0.11 5–60 600°C, air flow, quartz reactor Pseudo-hexagonal TT 22 0.06 5–25 600°C, N2 flow, quartz reactor Pseudo-hexagonal TT 22 0.06 5–25 Nb2O5–MC Pseudo-hexagonal TT 56 0.16 2–12 Table 2 Summary of the catalytic results for the Fischer–Tropsch reaction at 1 or 20bar, 220 °C and H2/CO=2. Table 2 Support a Number of impregnations Co loading (wt.%) Cobalt-Time-Yield b (10−5 molCOgCo −1s−1) C5+ selectivity (wt.%) Amorphous Nb2O5 ·nH2O (120°C) 2 10 <0.3 45 Amorphous Nb2O5 ·nH2O (400°C) 1 5 0.5 49 Crystalline Nb2O5 (600°C) 1 5 3.0 70 2 10 2.5 64 3 15 2.2 60 4 17 1.5 55 4 21 2.1 42 1 6 4.5 (20bar) 80 (20bar) Nb2O5–MC 1 6 4.2 (20bar) 80 (20bar) 2.1 (1bar) 64 (1bar) 1 10 3.7 (20bar) 81 (20bar) 2.0 (1bar) 65 (1bar) a In brackets the calcination temperature of the support. b Catalysts tested at 20bar are indicated and the value reported is after 100h TOS, if not indicated catalysts were tested at 1bar, 40h TOS. Crystalline niobia with tailored porosity as support for cobalt catalysts for the Fischer–Tropsch synthesis C. Hernández Mejía J.H. den Otter J.L. Weber K.P. de Jong ⁎ Inorganic Chemistry and Catalysis, Debye Institute for Nanomaterials Science, Utrecht University, Universiteitsweg 99, 3584 CG Utrecht, The Netherlands Inorganic Chemistry and Catalysis Debye Institute for Nanomaterials Science Utrecht University Universiteitsweg 99 Utrecht 3584 CG The Netherlands ⁎ Corresponding author. Graphical abstract Structure and catalytic performance of niobia-supported cobalt catalysts were studied based on crystal phase, porosity and cobalt loading. Crystalline niobia as support proved to be a prerequisite to obtain highly active and selective Co/niobia Fischer–Tropsch catalysts, whereas amorphous niobia showed minimal activity. Crystallization changed the porous morphology of Nb2O5·nH2O resulting in a dense material with low specific pore volume and specific surface area. Multiple impregnations on crystalline Nb2O5 were necessary to achieve cobalt loadings higher than 6wt.%; this led to larger cobalt particles, diminished interaction of cobalt with niobia and therefore decreased activity per unit weight of cobalt and C5+ selectivity. Carbon deposition via sucrose pyrolysis was employed in order to partly maintain the porosity during crystallization. The obtained porous crystalline niobia was used as support for cobalt catalysts with higher metal loadings. STEM-EDX mapping characterization of the catalysts provided unique information for this kind of materials, e.g. cobalt distribution and particle size. The catalysts showed high cobalt-normalized catalytic activity and C5+ selectivity for the Fischer–Tropsch synthesis under industrially relevant conditions. Moreover, higher cobalt loadings led to an increased catalyst-weight normalized catalytic activity. Keywords Niobia Fischer-Tropsch Synthesis gas Cobalt catalysts Niobium oxide 1 Introduction Fischer–Tropsch synthesis involves the transformation of synthesis gas (a mixture of H2 and CO) to chemicals and ultra-clean fuels. Particularly, cobalt-based catalysts are industrially relevant for the production of long-chain hydrocarbons (C5+). These catalysts offer high selectivity, activity and stability, especially when promoted with noble metals and/or transition metal oxides [1]. Since the first reports by Schmal et al. [2–4], cobalt supported on niobia (Nb2O5) has gained considerable interest due to its notably high selectivity towards C5+. Furthermore, the Co/Nb2O5 system shows great activity per unit weight of cobalt and markedly increases turnover frequencies upon noble metal promotion [5–8]. Niobia as support has been reported to be effective for cobalt Fischer–Tropsch catalysts solely in the crystalline form. Generally, this crystalline niobia has a very low specific pore structure compared to typical Fischer–Tropsch supports (e.g. SiO2 and γ-Al2O3), limiting the application of high metal loadings. Therefore, crystalline niobia with higher porosity would allow higher cobalt loadings and dispersion. Several methods have been reported for the synthesis of porous Nb2O5 [9]. However, despite the higher porosity obtained, most of these methods have basic disadvantages to be applied in large-scale support synthesis. Expensive and highly reactive precursors were involved (e.g. NbCl5, Nb(OEt)5, copolymers) [10–12] or the resulting Nb2O5 had low crystallinity and high acidity [13–15]. In order to be used as Fischer–Tropsch support material, where large quantities are necessary, a simple and efficient method is required. Contrary to the common Nb2O5 crystalline form, amorphous niobium oxide hydrate (Nb2O5·nH2O) has a mesoporous structure with relatively high specific pore volume and specific surface area. However, due to its acidic properties, niobium oxide hydrate is reactive towards cobalt salts during catalyst preparation, leading to formation of inactive species for Fischer–Tropsch synthesis. Niobium oxide hydrate can be effectively used as precursor for niobia via thermal crystallization at temperatures greater than 500 °C as has been shown by Schmal and co-workers [2–4]. This thermal treatment however decreases considerably porosity and specific surface area. Here we report the influence of niobia crystal phase, porosity and cobalt loading on the catalysts’ structure and performance in Fischer–Tropsch synthesis. Sucrose impregnation, polymerization and pyrolysis over the niobium oxide hydrate surface was employed in order to maintain the porosity during crystallization. This facile method resulted in a crystalline niobia material which preserved a great fraction of the mesoporous structure of the niobium oxide hydrate. The material was used as support to prepare cobalt catalysts and tested for the Fischer–Tropsch synthesis. These catalysts showed high cobalt-specific catalytic activity and good C5+ selectivity, furthermore due to the higher cobalt loading the catalyst weight-based activity was markedly higher. 2 Experimental 2.1 Catalyst preparation Niobium oxide hydrate (Nb2O5·nH2O, HY-340, AD/4465) was obtained from Companhia Brasileira de Metalurgia e Mineração − CBMM. Thermal treatment of niobium oxide hydrate was performed in stagnant air, air flow or N2 flow. Mesoporous crystalline niobia (Nb2O5-MC): The support was prepared starting from niobium oxide hydrate (Nb2O5·nH2O, HY-340, AD/4465, 75–150μm), which was firstly dried under dynamic vacuum. Thereafter it was impregnated with a sucrose aqueous solution (0.25gcm−3), using equal amounts of sucrose and Nb2O5 ·nH2O (m/m). In order to polymerize and pyrolize the sucrose, the impregnated niobium oxide hydrate was heated in a tubular furnace under N2 flow at 150°C for 2h (5°Cmin−1). The sample was then heated to 600°C for 2h (20°Cmin−1) under N2 flow. The obtained sample, a black uniform powder, was left to cool down to room temperature. Finally, the carbon was burned off at 400°C for 4h (5°Cmin−1) in 30vol.% O2/N2 flow. The cobalt catalysts were prepared using incipient wetness impregnation of niobium oxide hydrate calcined at temperatures between 120°C and 600°C or Nb2O5-MC. Prior to impregnation the supports (75–150μm grains) were dried under vacuum at 80°C for 1h. The impregnation was performed with aqueous solution of Co(NO3)2·6H2O (Acros, 99%), where the concentration depended on the pore volume of the support used and the target metal loading. Multiple impregnations were necessary to achieve Co loadings larger than 6 wt.% for niobia with low specific pore volume. In the next step, the catalysts were dried for 12h at 60°C in stagnant air and subsequently calcined for 2h at 350 °C (3°Cmin−1) in a fixed bed reactor under N2 flow. Metal loadings were defined as the mass of metallic cobalt per gram of reduced catalyst. 2.2 Characterization Powder X-ray diffractograms were measured using a Bruker-AXS D2 Phaser X-ray diffractometer, Co-Kα radiation (λ=1.789Å). For calcined catalysts Co3O4 crystallite size was calculated using the Scherrer equation (k=0.9) to the (311) diffraction line at 2θ=43.0° or (220) diffraction line at 2θ=36.5°⋅ In situ XRD was measured using a Bruker-AXS D8 Advance X-ray diffractometer, Co-Kα radiation (λ=1.789Å). The sample was heated to 350°C (2h, 5°Cmin−1) in 25vol% H2/He. A micromeritics TriStar 3000 apparatus was used to perform N2-physisorption at −196°C. Prior to analysis the sample was dried at either at 120 or 200°C for 16h in N2 flow. Specific surface area was calculated using the BET theory for p/p0 =0.06–0.25. The pore size distribution was determined using the BJH theory applied to the adsorption branch. The specific mesopore volume was calculated using single point at p/p0 =0.98. Thermogravimetric analysis was performed using a TGA Q50 equipment, around 20mg of sample were placed in a platinum crucible under 60cm3 min−1 air flow and heated until 400°C (15°Cmin−1) for 4h thereafter heated until 1000°C (15°Cmin−1), 40cm3 min−1 N2 flow was used as reference. Temperature programmed reduction (TPR) analyses were performed using a Micromeritics Autochem 2990 instrument, where 100mg sample were dried at 120°C for 1h in Ar flow followed by reduction from room temperature up to 1000°C (10°Cmin−1) in a 5vol% H2/Ar flow. Bright field transmission electron microscopy (TEM) imaging was performed using a Tecnai 12 operated at 120kV. Scanning transmission electron microscopy (STEM-EDX) images were acquired with a Philips Tecnai-20 FEG (200kV) microscope equipped with an energy dispersive X-ray (EDX) and high-angle annular dark-field (HAADF) detector. 2.3 Catalytic testing Low pressure catalytic testing was performed in a quartz glass plug-flow reactor, typicallyloaded with 15–20mg catalyst (38–150μm) diluted with 200mg SiC. Typically, the catalysts were reduced in situ at 350°C (5°Cmin−1, 2h) in a 20/40mLmin−1 H2/Ar flow. Fischer-Tropsch catalysis was performed at 220°C, 1bar, H2/CO=2.0v/v, GHSV=24000–48000h−1, CO conversion <5%. C1–C18 products were analyzed by online gas chromatography (Varian 430 GC, CP sil-5 column). Activity and selectivities were reported after at least 40h on stream. High pressure catalytic testing was performed using an Avantium Flowrence 16 parallel, continuous flow, fixed bed reactor system. Typically, 100mg catalyst (38–150μm) were diluted with 300mg SiC and loaded in a stainless-steel reactor. The catalysts were reduced in situ at atmospheric pressure in a 25vol% H2/He flow, for 8h at 350°C (heating rate of 1°Cmin−1). Thereafter, reactors were cooled down to 180°C and the gas stream was switched to synthesis gas, H2/CO=2.0v/v, GHSV 4500h−1. Reactors were pressurized to 20bar and subsequently heated to reaction temperature 220°C (1°Cmin−1), CO conversion was maintained at 15–25%. Products up to C9 were analyzed using online gas chromatography. GHSV was defined as total gas flow divided by the catalyst volume. 3 Results and discussion 3.1 Niobium oxide hydrate thermal treatment Niobium oxide hydrate was characterized by powder X-ray diffraction (XRD) and N2-physisorption after the different thermal treatments. Niobium oxide hydrate remained amorphous after stagnant air calcination in a muffle oven up to 400°C (Fig. 1 ). Crystallization started after calcination at 500°C, transforming the material into low-crystalline pseudo-hexagonal Nb2O5 TT-phase. Calcination at temperatures above 600°C led to the orthorhombic Nb2O5 T-phase, as indicated by the splitting of the peaks at 2θ=33° and 42° ⋅ Monoclinic Nb2O5 phase was observed after calcination at 900°C [16–18]. Increase in calcination temperature changed as well the niobia morphology (Fig. 2 ). Niobium oxide hydrate after drying at 120°C had a BET specific surface area and specific mesopore volume of 173 m2 g−1 and 0.19cm3 g−1 respectively, as determined by N2-physisorption. Upon increasing calcination temperature these values decreased. In particular, after crystallization at 600°C the specific surface dropped to 9m2 g−1 and the specific mesopore volume to 0.05cm3 g−1. The porosity of niobium oxide hydrate after drying at 120°C consisted mainly of 2–5nm mesopores as indicated by the hysteresis at p/p0 =0.4–0.7 (Fig. 3 ) and TEM images (Fig. S1), these mesopores were maintained up to 400°C. After crystallization at 600 °C most of the mesopores had collapsed and only hysteresis at p/p0 =0.9 was observed, indicative for larger pores (>50nm). These macropores originated from the Nb2O5 interparticle space. Table 1 summarizes the characterization results for the different materials. 3.2 Modified niobia crystallization Stagnant air, air flow or N2 flow were used during niobia crystallization at 600°C to study the effect of different gas atmospheres and hydrodynamics. For all cases, pseudo-hexagonal niobia TT-phase was obtained with BET specific surface areas of 22–25m2 g−1 (Table 1). Calcination in stagnant air led to a higher specific mesopore volume (0.11cm3 g−1) than after calcination in N2 or air flow (0.06cm3 g−1). In order to inhibit porosity loss during crystallization, the niobium oxide hydrate pores were filled with sucrose as carbon precursor prior thermal treatment. Niobium oxide hydrate was impregnated with a sucrose solution, which polymerized by the acidic properties of the oxide and thermal treatment at 150 °C. After pyrolysis and crystallization at 600 °C, the obtained black powder showed the pseudo-hexagonal Nb2O5 TT-phase (Fig. S2) and a decrease in specific mesopore volume (0.08cm3 g−1) which might indicate a blockage of the niobia pores by carbon. Thermogravimetric analysis (TGA) in air of this material shows most of the weight loss after 4h at 400°C (Fig. S3), indicating that carbon can be effectively removed under these conditions. After carbon was burned off the obtained crystalline material has a mesopore volume of 0.16cm3 g−1 with a specific surface area of 56m2 g−1. Fig. 4 shows the pore size distribution of niobium oxide hydrate dried at 120 °C, crystallized at 600 °C and the mesoporous crystalline niobia (Nb2O5–MC). Despite the template used not all of the mesopores from niobium oxide hydrate could be maintained during the treatment; however their collapse was retarded compared to normal crystallization at 600°C. Dark field STEM images of these two crystalline materials are shown in Fig. 5 . Clearly the niobia crystallized at 600°C without template has a dense structure whereas for Nb2O5–MC a more porous structure is observed. 3.3 Cobalt deposition Deposition of cobalt on the support was performed by incipient wetness impregnation method. Niobium oxide hydrate calcined at 120°C or 600°C was used as support and deposition of cobalt was performed by single or multiple impregnation (4–21 Co wt.%) followed by drying and calcination at 350°C. XRD showed no crystalline cobalt species up to 10wt.% independently of the support used, i.e. amorphous or crystalline niobia. Co3O4 was observed only on the calcined samples with >13wt.% Co (Fig. 6 ). Furthermore, samples supported on crystalline niobia were reduced in situ (25 vol.% H2/He, 350 °C) and still no cobalt species were observed for the low loadings (Fig. 6B). This indicates that for low cobalt loadings poorly crystalline cobalt species, very small crystallite sizes or Co-Nb oxide species were formed independently of the niobia pretreatment, in line with previous reports [19]. The support used, amorphous or crystalline niobia, had a strong impact on the reduction of the cobalt species as shown by the temperature programmed reduction profiles (Fig. 7 ). The reduction on crystalline niobia proceeded in two steps as previously reported: from Co3O4 to CoO and from CoO to metallic Co [19–21]. The reduction temperature is significantly lower if compared with γ-alumina- or silica-supported cobalt catalysts, therefore reduction can be effectively performed at temperatures lower than 400 °C without noble metal promotion. In contrast, cobalt supported on amorphous Nb2O5•nH2O showed no distinctive reduction peaks until temperatures greater than 450°C (Fig. 7). A continuous H2 consumption is observed throughout temperature increase, attributed to reduction of the support. This different reduction profile can be attributed to a stronger interaction between cobalt and niobium oxide hydrate. Most likely no Co3O4 was formed after impregnation and calcination but rather Co-Nb oxide species which cannot be easily reduced. The mesoporous crystalline niobia (Nb2O5-MC) was used as support for 6 and 10 wt.% Co, prepared by incipient wetness impregnation. Due to the larger specific pore volume of Nb2O5–MC, a higher metal loading could be achieved in a single impregnation step. In general, characterization of niobia-supported catalysts using TEM in the dark or bright field has the challenge of phase distinction between Co3O4 and Nb2O5 due to their similar electron density. Therefore, electron microscopy combined with EDX mapping is an important and powerful technique for the characterization of this kind of materials. Fig. 8 shows the STEM-EDX mapping images of the Nb2O5–MC-supported catalysts and for comparison purposes a 6 wt.% Co supported on pretreated Nb2O5 at 600 °C. STEM-EDX mapping images were taken after reduction at 350 °C and passivation. A comparison of the Nb2O5–MC-supported catalysts (Fig. 4A, B) shows that the 6wt.% Co catalyst had smaller particles (9.7±3.3) than the 10wt.% Co (13.9±6.5), which is expected for higher metal loadings. Still these two catalysts show a smaller particle size if compared to the one supported on the dense niobia calcined at 600 °C (15.6±4.3, Fig. 4C). The porous morphology of Nb2O5–MC is suggested to restrict particle growth during reduction. 3.4 Catalytic testing Prepared catalysts were investigated for the Fischer–Tropsch reaction at 1bar, 220 °C and H2/CO=2 to obtain activity and selectivity data (Table 2 ). 5wt.% Co supported on crystalline niobia (pretreated at 600°C) was reduced prior to reaction conditions at 350 °C, cobalt-weight normalized activity (Cobalt-Time-Yield: 3×10−5 molCOgCo −1 s−1) and C5+ selectivity (∼70 wt.%) were observed after 40h on stream similar to results observed previously for promoted Co/SiO2 catalysts [22]. Reduction at 500°C prior to reaction led to 10 times decrease in CTY. Since niobia is a reducible support, SMSI effects by reducing at higher temperatures are expected and have been observed previously by Silva et al. [3]. Catalysts supported on amorphous niobium oxide hydrate showed low catalytic activity (Table 2), this might be due to formation of irreducible cobalt species on this support as shown by TPR. Encapsulation of cobalt in the mesopores (2–5nm) of this material during catalyst preparation or catalytic testing might have also led to inaccessibility of the active sites. The amorphous form of niobia appears too reactive thereby inhibiting activation of cobalt for the Fischer–Tropsch reaction and thus crystalline niobia is required to obtain active cobalt catalysts. Catalysts prepared by multiple impregnations showed a decrease in CTY and C5+ selectivity by increasing the cobalt loading (Fig. 9 ). Considering the low specific surface area of the support, small interparticle distance at higher cobalt loadings can lead to particle growth and sintering. In a similar way, larger particles lead to a decreased Co-Nb2O5 interface, where the chain growth probability is larger, therefore decreasing the C5+ selectivity [5]. Nb2O5–MC supported catalysts were tested both at 1 and at 20bar, 220°C and H2/CO=2. Results are shown on Table 2. For comparison purposes, a 6wt.% cobalt catalyst with niobia treated at 600°C as support was also tested at high pressure. The catalytic activity normalized per catalyst weight (Weight Time Yield, WTY) tested at 20bar is shown in Fig. 10 A. Clearly the 10wt.% Co/Nb2O5–MC catalyst (blue triangles) outperforms the 6 wt.% Co catalysts because of the higher metal content. The 6wt.% Co/Nb2O5–MC catalyst (purple circles) shows a slightly lower WTY than the 6wt.% Co/Nb2O5 (pretreated at 600°C, pink squares) at the initial hours of the experiment, however after 70h on stream its steady deactivation leads to the same activity as the Nb2O5–MC supported catalyst. Fig. 10B shows the CTY, the three catalysts reach virtually the same value after 100h on stream. The catalyst supported on Nb2O5 treated at 600°C shows a more pronounced deactivation throughout time compared with the Nb2O5–MC supported catalysts. One of the main causes of deactivation for cobalt Fischer–Tropsch catalysts is particle sintering. It is possible to think that the porous structure of the Nb2O5–MC support has retarded the cobalt particles from sintering, leading to more stable catalysts during long time on stream. In contrast, the flat surface of Nb2O5 treated at 600 °C allows particle growth and decrease in catalytic activity with time. The three catalysts showed a similar C5+ selectivity of ∼80 % during the catalytic experiments (Table S1). 4 Conclusions The pore structure of amorphous niobium oxide hydrate was determined to be intricate with 2–5nm mesopores giving rise to high specific surface and pore volume. Collapse of this pore structure during thermal treatment led to a drastic decrease in specific surface area and specific mesopore volume. For the synthesis of active cobalt Fischer–Tropsch catalysts, niobia crystallization at temperatures above 400°C prior to cobalt deposition was found necessary to allow formation of reducible cobalt oxide species. Consequently, no activity was observed for the Fischer–Tropsch synthesis using amorphous niobia as support. Contrastingly, cobalt supported on crystalline niobia prepared by impregnation and reduced at 350°C prior reaction conditions showed remarkably high activity per unit weight of cobalt and C5+ selectivity, previously only observed for promoted Co catalysts. Higher reduction temperature (500°C) significantly decreased the catalyst activity, probably due to coverage of the cobalt surface sites due to SMSI effects. The maximum cobalt loading achievable in a single impregnation was 6wt.% by using crystalline niobia as support. A decrease in activity per unit weight of cobalt was observed by increasing the cobalt loading using multiple impregnations, due to formation of larger cobalt particles and decreased interaction of cobalt with the support. Additionally, this decreased cobalt-support interaction suppressed the beneficial effect of niobia on C5+ selectivity. A facile carbon deposition method was used to restrict the collapse of the niobium oxide hydrate porous structure during crystallization. The carbon on the surface acted as structural template at the high temperatures needed to obtain crystalline niobia. The resulting crystalline niobia displayed an important fraction of the mesopores from the niobium oxide hydrate. The porous niobia was used as support to prepare cobalt catalysts and further tested in industrially relevant conditions for the Fischer–Tropsch synthesis. These catalysts proved to be highly active and selective. The porous structure allowed higher cobalt loadings leading to an increased weight-normalized catalytic activity. Furthermore, this porosity prevented the cobalt particles from sintering, resulting in very stable catalysts. STEM-EDX mapping characterization made possible to determine cobalt particle size and distribution in the catalysts, this technique demonstrated to be a powerful tool to study systems where phase distinction between its components is difficult due to similar electron density. Acknowledgments Companhia Brasileira de Metalurgia e Mineração − CBMM is thanked for financial support. Dr. Robson Monteiro and Mr. Rogério Ribas (CBMM) are acknowledged for useful discussions and supplying niobia. Mr. Wouter Lamme (STEM-EDX), Mr. Tom van Deelen (High pressure catalytic testing), Dr. Peter Munnik (TEM), Mrs. Marjan Versluijs-Helder (XRD), Dr. Carlo Angelici (TPR), Dr. Thomas Eschemann (TPR), Dr. Korneel Cats (TPR) and Mr. Gang Wang (TPR) are acknowledged for assistance and execution of indicated analyses. KPdeJ acknowledges the European Research Council, EU FP7 ERC Advanced Grant no. 338846. Appendix A Supplementary data Supplementary data associated with this article can be found, in the online version, at http://dx.doi.org/10.1016/j.apcata.2017.07.016. Appendix A Supplementary data The following is Supplementary data to this article: References [1] A.Y. Khodakov W. Chu P. Fongarland Chem. Rev. 107 2007 1692 1744 [2] R.R. Soares A. Frydman M. Schmal Catal. Today 16 1993 361 370 [3] R.R.C.M. Silva M. Schmal R. Frety J.A. Dalmon Chem. Soc. Faraday Trans. 89 1993 3975 3980 [4] A. Frydman R.R. Soares M. Schmal Proceedings of the 10th International Congress on Catalysis 1993 2797 2800 [5] J.H. den Otter K.P. de Jong Top. Catal. 57 2013 445 450 [6] J.H. den Otter S.R. Nijveld K.P. de Jong ACS Catal. 6 2016 1616 1623 [7] J.H. den Otter H. Yoshida C. Ledesma D. Chen K.P. de Jong J. Catal. 340 2016 270 275 [8] J.H. den Otter PhD thesis, Niobia-supported Cobalt Catalysts for Fischer-Tropsch Synthesis 2016 Utrecht University 2016 [9] I. Nowak M. Ziolek Chem. Rev. 99 1999 3603 3624 [10] X. Chen T. Yu X. Fan H. Zhang Z. Li J. Ye Z. Zou Appl. Surf. Sci. 253 2007 8500 8506 [11] S. Kim I. Jeong J. Hwang M.J. Ko J. Lee Chem. Commun. 2017 10.1039/C7CC01400G [12] B. Lee D. Lu J.N. Kondo K.J. Domen J. Am. Chem. Soc. 124 2002 11256 11257 [13] E.R. Leite C. Vila J. Bettini E. Longo J. Phys. Chem. B 110 2006 18088 18090 [14] T. Murayama J. Chen J. Hirata K. Matsumoto W. Ueda Catal. Sci. Technol. 4 2014 4250 4257 [15] E.R. Leite C. Vila J. Bettini E. Longo J. Phys. Chem. B 110 2006 18088 18090 [16] S. Chai H.P. Wang Y. Liang B.Q. Xu J. Catal. 250 2007 342 349 [17] L.K. Frevel H.W. Rinn Anal. Chem. 27 1955 1329 1330 [18] H. Schäfer R. Gruehn F. Schulte Angew. Chem. Int. Ed. 5 1966 40 52 [19] F.B. Noronha C.A. Perez R. Frety Phys. Chem. Chem. Phys. 1 1999 2861 2867 [20] B. Sexton J. Catal. 97 1986 390 406 [21] G. Jacobs Y. Ji B.H. Davis D. Cronauer A.J. Kropf C.L. Marshall Appl. Catal. A 333 2007 177 191 [22] J.P. den Breejen A.M. Frey J. Yang A. Holmen M.M. Schooneveld F.M.F. Groot O. Stephan J.H. Bitter K.P. de Jong Top. Catal. 54 2011 768 777",
      "scopus-id": "85025674219",
      "coredata": {
        "eid": "1-s2.0-S0926860X17303162",
        "dc:description": "Structure and catalytic performance of niobia-supported cobalt catalysts were studied based on crystal phase, porosity and cobalt loading. Crystalline niobia as support proved to be a prerequisite to obtain highly active and selective Co/niobia Fischer–Tropsch catalysts, whereas amorphous niobia showed minimal activity. Crystallization changed the porous morphology of Nb2O5·nH2O resulting in a dense material with low specific pore volume and specific surface area. Multiple impregnations on crystalline Nb2O5 were necessary to achieve cobalt loadings higher than 6wt.%; this led to larger cobalt particles, diminished interaction of cobalt with niobia and therefore decreased activity per unit weight of cobalt and C5+ selectivity. Carbon deposition via sucrose pyrolysis was employed in order to partly maintain the porosity during crystallization. The obtained porous crystalline niobia was used as support for cobalt catalysts with higher metal loadings. STEM-EDX mapping characterization of the catalysts provided unique information for this kind of materials, e.g. cobalt distribution and particle size. The catalysts showed high cobalt-normalized catalytic activity and C5+ selectivity for the Fischer–Tropsch synthesis under industrially relevant conditions. Moreover, higher cobalt loadings led to an increased catalyst-weight normalized catalytic activity.",
        "openArchiveArticle": "false",
        "prism:coverDate": "2017-11-25",
        "openaccessUserLicense": "http://creativecommons.org/licenses/by/4.0/",
        "prism:aggregationType": "Journal",
        "prism:url": "https://api.elsevier.com/content/article/pii/S0926860X17303162",
        "dc:creator": [
          {
            "@_fa": "true",
            "$": "Hernández Mejía, C."
          },
          {
            "@_fa": "true",
            "$": "den Otter, J.H."
          },
          {
            "@_fa": "true",
            "$": "Weber, J.L."
          },
          {
            "@_fa": "true",
            "$": "de Jong, K.P."
          }
        ],
        "link": [
          {
            "@_fa": "true",
            "@rel": "self",
            "@href": "https://api.elsevier.com/content/article/pii/S0926860X17303162"
          },
          {
            "@_fa": "true",
            "@rel": "scidir",
            "@href": "https://www.sciencedirect.com/science/article/pii/S0926860X17303162"
          }
        ],
        "dc:format": "application/json",
        "openaccessType": "Full",
        "pii": "S0926-860X(17)30316-2",
        "prism:volume": "548",
        "prism:publisher": "The Author(s). Published by Elsevier B.V.",
        "dc:title": "Crystalline niobia with tailored porosity as support for cobalt catalysts for the Fischer–Tropsch synthesis",
        "prism:copyright": "© 2017 The Author(s). Published by Elsevier B.V.",
        "prism:issueName": "Special issue in honor of Prof. Martin Schmal",
        "openaccess": "1",
        "prism:issn": "0926860X",
        "dcterms:subject": [
          {
            "@_fa": "true",
            "$": "Niobia"
          },
          {
            "@_fa": "true",
            "$": "Fischer-Tropsch"
          },
          {
            "@_fa": "true",
            "$": "Synthesis gas"
          },
          {
            "@_fa": "true",
            "$": "Cobalt catalysts"
          },
          {
            "@_fa": "true",
            "$": "Niobium oxide"
          }
        ],
        "openaccessArticle": "true",
        "prism:publicationName": "Applied Catalysis A: General",
        "openaccessSponsorType": "FundingBody",
        "prism:pageRange": "143-149",
        "prism:endingPage": "149",
        "pubType": "fla",
        "prism:coverDisplayDate": "25 November 2017",
        "prism:doi": "10.1016/j.apcata.2017.07.016",
        "prism:startingPage": "143",
        "dc:identifier": "doi:10.1016/j.apcata.2017.07.016",
        "openaccessSponsorName": "VSNU"
      },
      "objects": {
        "object": [
          {
            "@category": "thumbnail",
            "@height": "78",
            "@width": "219",
            "@_fa": "true",
            "$": "https://api.elsevier.com/content/object/eid/1-s2.0-S0926860X17303162-fx1.sml?httpAccept=%2A%2F%2A",
            "@multimediatype": "GIF image file",
            "@type": "IMAGE-THUMBNAIL",
            "@size": "6012",
            "@ref": "fx1",
            "@mimetype": "image/gif"
          },
          {
            "@category": "thumbnail",
            "@height": "41",
            "@width": "43",
            "@_fa": "true",
            "$": "https://api.elsevier.com/content/object/eid/1-s2.0-S0926860X17303162-fx2.sml?httpAccept=%2A%2F%2A",
            "@multimediatype": "GIF image file",
            "@type": "IMAGE-THUMBNAIL",
            "@size": "1589",
            "@ref": "fx2",
            "@mimetype": "image/gif"
          },
          {
            "@category": "thumbnail",
            "@height": "44",
            "@width": "45",
            "@_fa": "true",
            "$": "https://api.elsevier.com/content/object/eid/1-s2.0-S0926860X17303162-fx3.sml?httpAccept=%2A%2F%2A",
            "@multimediatype": "GIF image file",
            "@type": "IMAGE-THUMBNAIL",
            "@size": "1186",
            "@ref": "fx3",
            "@mimetype": "image/gif"
          },
          {
            "@category": "thumbnail",
            "@height": "47",
            "@width": "47",
            "@_fa": "true",
            "$": "https://api.elsevier.com/content/object/eid/1-s2.0-S0926860X17303162-fx4.sml?httpAccept=%2A%2F%2A",
            "@multimediatype": "GIF image file",
            "@type": "IMAGE-THUMBNAIL",
            "@size": "1532",
            "@ref": "fx4",
            "@mimetype": "image/gif"
          },
          {
            "@category": "thumbnail",
            "@height": "113",
            "@width": "219",
            "@_fa": "true",
            "$": "https://api.elsevier.com/content/object/eid/1-s2.0-S0926860X17303162-gr1.sml?httpAccept=%2A%2F%2A",
            "@multimediatype": "GIF image file",
            "@type": "IMAGE-THUMBNAIL",
            "@size": "6104",
            "@ref": "gr1",
            "@mimetype": "image/gif"
          },
          {
            "@category": "thumbnail",
            "@height": "85",
            "@width": "219",
            "@_fa": "true",
            "$": "https://api.elsevier.com/content/object/eid/1-s2.0-S0926860X17303162-gr10.sml?httpAccept=%2A%2F%2A",
            "@multimediatype": "GIF image file",
            "@type": "IMAGE-THUMBNAIL",
            "@size": "5559",
            "@ref": "gr10",
            "@mimetype": "image/gif"
          },
          {
            "@category": "thumbnail",
            "@height": "150",
            "@width": "219",
            "@_fa": "true",
            "$": "https://api.elsevier.com/content/object/eid/1-s2.0-S0926860X17303162-gr2.sml?httpAccept=%2A%2F%2A",
            "@multimediatype": "GIF image file",
            "@type": "IMAGE-THUMBNAIL",
            "@size": "6586",
            "@ref": "gr2",
            "@mimetype": "image/gif"
          },
          {
            "@category": "thumbnail",
            "@height": "75",
            "@width": "219",
            "@_fa": "true",
            "$": "https://api.elsevier.com/content/object/eid/1-s2.0-S0926860X17303162-gr3.sml?httpAccept=%2A%2F%2A",
            "@multimediatype": "GIF image file",
            "@type": "IMAGE-THUMBNAIL",
            "@size": "4250",
            "@ref": "gr3",
            "@mimetype": "image/gif"
          },
          {
            "@category": "thumbnail",
            "@height": "127",
            "@width": "219",
            "@_fa": "true",
            "$": "https://api.elsevier.com/content/object/eid/1-s2.0-S0926860X17303162-gr4.sml?httpAccept=%2A%2F%2A",
            "@multimediatype": "GIF image file",
            "@type": "IMAGE-THUMBNAIL",
            "@size": "6317",
            "@ref": "gr4",
            "@mimetype": "image/gif"
          },
          {
            "@category": "thumbnail",
            "@height": "107",
            "@width": "219",
            "@_fa": "true",
            "$": "https://api.elsevier.com/content/object/eid/1-s2.0-S0926860X17303162-gr5.sml?httpAccept=%2A%2F%2A",
            "@multimediatype": "GIF image file",
            "@type": "IMAGE-THUMBNAIL",
            "@size": "14088",
            "@ref": "gr5",
            "@mimetype": "image/gif"
          },
          {
            "@category": "thumbnail",
            "@height": "60",
            "@width": "219",
            "@_fa": "true",
            "$": "https://api.elsevier.com/content/object/eid/1-s2.0-S0926860X17303162-gr6.sml?httpAccept=%2A%2F%2A",
            "@multimediatype": "GIF image file",
            "@type": "IMAGE-THUMBNAIL",
            "@size": "4705",
            "@ref": "gr6",
            "@mimetype": "image/gif"
          },
          {
            "@category": "thumbnail",
            "@height": "113",
            "@width": "219",
            "@_fa": "true",
            "$": "https://api.elsevier.com/content/object/eid/1-s2.0-S0926860X17303162-gr7.sml?httpAccept=%2A%2F%2A",
            "@multimediatype": "GIF image file",
            "@type": "IMAGE-THUMBNAIL",
            "@size": "5646",
            "@ref": "gr7",
            "@mimetype": "image/gif"
          },
          {
            "@category": "thumbnail",
            "@height": "162",
            "@width": "42",
            "@_fa": "true",
            "$": "https://api.elsevier.com/content/object/eid/1-s2.0-S0926860X17303162-gr8.sml?httpAccept=%2A%2F%2A",
            "@multimediatype": "GIF image file",
            "@type": "IMAGE-THUMBNAIL",
            "@size": "5472",
            "@ref": "gr8",
            "@mimetype": "image/gif"
          },
          {
            "@category": "thumbnail",
            "@height": "151",
            "@width": "219",
            "@_fa": "true",
            "$": "https://api.elsevier.com/content/object/eid/1-s2.0-S0926860X17303162-gr9.sml?httpAccept=%2A%2F%2A",
            "@multimediatype": "GIF image file",
            "@type": "IMAGE-THUMBNAIL",
            "@size": "4888",
            "@ref": "gr9",
            "@mimetype": "image/gif"
          },
          {
            "@category": "standard",
            "@height": "178",
            "@width": "500",
            "@_fa": "true",
            "$": "https://api.elsevier.com/content/object/eid/1-s2.0-S0926860X17303162-fx1.jpg?httpAccept=%2A%2F%2A",
            "@multimediatype": "JPEG image file",
            "@type": "IMAGE-DOWNSAMPLED",
            "@size": "26233",
            "@ref": "fx1",
            "@mimetype": "image/jpeg"
          },
          {
            "@category": "standard",
            "@height": "9",
            "@width": "9",
            "@_fa": "true",
            "$": "https://api.elsevier.com/content/object/eid/1-s2.0-S0926860X17303162-fx2.jpg?httpAccept=%2A%2F%2A",
            "@multimediatype": "JPEG image file",
            "@type": "IMAGE-DOWNSAMPLED",
            "@size": "420",
            "@ref": "fx2",
            "@mimetype": "image/jpeg"
          },
          {
            "@category": "standard",
            "@height": "10",
            "@width": "10",
            "@_fa": "true",
            "$": "https://api.elsevier.com/content/object/eid/1-s2.0-S0926860X17303162-fx3.jpg?httpAccept=%2A%2F%2A",
            "@multimediatype": "JPEG image file",
            "@type": "IMAGE-DOWNSAMPLED",
            "@size": "444",
            "@ref": "fx3",
            "@mimetype": "image/jpeg"
          },
          {
            "@category": "standard",
            "@height": "10",
            "@width": "10",
            "@_fa": "true",
            "$": "https://api.elsevier.com/content/object/eid/1-s2.0-S0926860X17303162-fx4.jpg?httpAccept=%2A%2F%2A",
            "@multimediatype": "JPEG image file",
            "@type": "IMAGE-DOWNSAMPLED",
            "@size": "454",
            "@ref": "fx4",
            "@mimetype": "image/jpeg"
          },
          {
            "@category": "standard",
            "@height": "145",
            "@width": "282",
            "@_fa": "true",
            "$": "https://api.elsevier.com/content/object/eid/1-s2.0-S0926860X17303162-gr1.jpg?httpAccept=%2A%2F%2A",
            "@multimediatype": "JPEG image file",
            "@type": "IMAGE-DOWNSAMPLED",
            "@size": "13813",
            "@ref": "gr1",
            "@mimetype": "image/jpeg"
          },
          {
            "@category": "standard",
            "@height": "218",
            "@width": "565",
            "@_fa": "true",
            "$": "https://api.elsevier.com/content/object/eid/1-s2.0-S0926860X17303162-gr10.jpg?httpAccept=%2A%2F%2A",
            "@multimediatype": "JPEG image file",
            "@type": "IMAGE-DOWNSAMPLED",
            "@size": "32856",
            "@ref": "gr10",
            "@mimetype": "image/jpeg"
          },
          {
            "@category": "standard",
            "@height": "232",
            "@width": "339",
            "@_fa": "true",
            "$": "https://api.elsevier.com/content/object/eid/1-s2.0-S0926860X17303162-gr2.jpg?httpAccept=%2A%2F%2A",
            "@multimediatype": "JPEG image file",
            "@type": "IMAGE-DOWNSAMPLED",
            "@size": "18990",
            "@ref": "gr2",
            "@mimetype": "image/jpeg"
          },
          {
            "@category": "standard",
            "@height": "193",
            "@width": "565",
            "@_fa": "true",
            "$": "https://api.elsevier.com/content/object/eid/1-s2.0-S0926860X17303162-gr3.jpg?httpAccept=%2A%2F%2A",
            "@multimediatype": "JPEG image file",
            "@type": "IMAGE-DOWNSAMPLED",
            "@size": "22430",
            "@ref": "gr3",
            "@mimetype": "image/jpeg"
          },
          {
            "@category": "standard",
            "@height": "219",
            "@width": "376",
            "@_fa": "true",
            "$": "https://api.elsevier.com/content/object/eid/1-s2.0-S0926860X17303162-gr4.jpg?httpAccept=%2A%2F%2A",
            "@multimediatype": "JPEG image file",
            "@type": "IMAGE-DOWNSAMPLED",
            "@size": "18335",
            "@ref": "gr4",
            "@mimetype": "image/jpeg"
          },
          {
            "@category": "standard",
            "@height": "248",
            "@width": "508",
            "@_fa": "true",
            "$": "https://api.elsevier.com/content/object/eid/1-s2.0-S0926860X17303162-gr5.jpg?httpAccept=%2A%2F%2A",
            "@multimediatype": "JPEG image file",
            "@type": "IMAGE-DOWNSAMPLED",
            "@size": "30475",
            "@ref": "gr5",
            "@mimetype": "image/jpeg"
          },
          {
            "@category": "standard",
            "@height": "179",
            "@width": "659",
            "@_fa": "true",
            "$": "https://api.elsevier.com/content/object/eid/1-s2.0-S0926860X17303162-gr6.jpg?httpAccept=%2A%2F%2A",
            "@multimediatype": "JPEG image file",
            "@type": "IMAGE-DOWNSAMPLED",
            "@size": "37970",
            "@ref": "gr6",
            "@mimetype": "image/jpeg"
          },
          {
            "@category": "standard",
            "@height": "194",
            "@width": "376",
            "@_fa": "true",
            "$": "https://api.elsevier.com/content/object/eid/1-s2.0-S0926860X17303162-gr7.jpg?httpAccept=%2A%2F%2A",
            "@multimediatype": "JPEG image file",
            "@type": "IMAGE-DOWNSAMPLED",
            "@size": "19417",
            "@ref": "gr7",
            "@mimetype": "image/jpeg"
          },
          {
            "@category": "standard",
            "@height": "941",
            "@width": "244",
            "@_fa": "true",
            "$": "https://api.elsevier.com/content/object/eid/1-s2.0-S0926860X17303162-gr8.jpg?httpAccept=%2A%2F%2A",
            "@multimediatype": "JPEG image file",
            "@type": "IMAGE-DOWNSAMPLED",
            "@size": "53986",
            "@ref": "gr8",
            "@mimetype": "image/jpeg"
          },
          {
            "@category": "standard",
            "@height": "221",
            "@width": "320",
            "@_fa": "true",
            "$": "https://api.elsevier.com/content/object/eid/1-s2.0-S0926860X17303162-gr9.jpg?httpAccept=%2A%2F%2A",
            "@multimediatype": "JPEG image file",
            "@type": "IMAGE-DOWNSAMPLED",
            "@size": "14101",
            "@ref": "gr9",
            "@mimetype": "image/jpeg"
          },
          {
            "@category": "high",
            "@height": "788",
            "@width": "2213",
            "@_fa": "true",
            "$": "https://api.elsevier.com/content/object/eid/1-s2.0-S0926860X17303162-fx1_lrg.jpg?httpAccept=%2A%2F%2A",
            "@multimediatype": "JPEG image file",
            "@type": "IMAGE-HIGH-RES",
            "@size": "173236",
            "@ref": "fx1",
            "@mimetype": "image/jpeg"
          },
          {
            "@category": "high",
            "@height": "41",
            "@width": "43",
            "@_fa": "true",
            "$": "https://api.elsevier.com/content/object/eid/1-s2.0-S0926860X17303162-fx2_lrg.jpg?httpAccept=%2A%2F%2A",
            "@multimediatype": "JPEG image file",
            "@type": "IMAGE-HIGH-RES",
            "@size": "1289",
            "@ref": "fx2",
            "@mimetype": "image/jpeg"
          },
          {
            "@category": "high",
            "@height": "44",
            "@width": "45",
            "@_fa": "true",
            "$": "https://api.elsevier.com/content/object/eid/1-s2.0-S0926860X17303162-fx3_lrg.jpg?httpAccept=%2A%2F%2A",
            "@multimediatype": "JPEG image file",
            "@type": "IMAGE-HIGH-RES",
            "@size": "1067",
            "@ref": "fx3",
            "@mimetype": "image/jpeg"
          },
          {
            "@category": "high",
            "@height": "47",
            "@width": "47",
            "@_fa": "true",
            "$": "https://api.elsevier.com/content/object/eid/1-s2.0-S0926860X17303162-fx4_lrg.jpg?httpAccept=%2A%2F%2A",
            "@multimediatype": "JPEG image file",
            "@type": "IMAGE-HIGH-RES",
            "@size": "1116",
            "@ref": "fx4",
            "@mimetype": "image/jpeg"
          },
          {
            "@category": "high",
            "@height": "644",
            "@width": "1250",
            "@_fa": "true",
            "$": "https://api.elsevier.com/content/object/eid/1-s2.0-S0926860X17303162-gr1_lrg.jpg?httpAccept=%2A%2F%2A",
            "@multimediatype": "JPEG image file",
            "@type": "IMAGE-HIGH-RES",
            "@size": "109448",
            "@ref": "gr1",
            "@mimetype": "image/jpeg"
          },
          {
            "@category": "high",
            "@height": "966",
            "@width": "2501",
            "@_fa": "true",
            "$": "https://api.elsevier.com/content/object/eid/1-s2.0-S0926860X17303162-gr10_lrg.jpg?httpAccept=%2A%2F%2A",
            "@multimediatype": "JPEG image file",
            "@type": "IMAGE-HIGH-RES",
            "@size": "241462",
            "@ref": "gr10",
            "@mimetype": "image/jpeg"
          },
          {
            "@category": "high",
            "@height": "1027",
            "@width": "1501",
            "@_fa": "true",
            "$": "https://api.elsevier.com/content/object/eid/1-s2.0-S0926860X17303162-gr2_lrg.jpg?httpAccept=%2A%2F%2A",
            "@multimediatype": "JPEG image file",
            "@type": "IMAGE-HIGH-RES",
            "@size": "129436",
            "@ref": "gr2",
            "@mimetype": "image/jpeg"
          },
          {
            "@category": "high",
            "@height": "852",
            "@width": "2500",
            "@_fa": "true",
            "$": "https://api.elsevier.com/content/object/eid/1-s2.0-S0926860X17303162-gr3_lrg.jpg?httpAccept=%2A%2F%2A",
            "@multimediatype": "JPEG image file",
            "@type": "IMAGE-HIGH-RES",
            "@size": "186401",
            "@ref": "gr3",
            "@mimetype": "image/jpeg"
          },
          {
            "@category": "high",
            "@height": "969",
            "@width": "1667",
            "@_fa": "true",
            "$": "https://api.elsevier.com/content/object/eid/1-s2.0-S0926860X17303162-gr4_lrg.jpg?httpAccept=%2A%2F%2A",
            "@multimediatype": "JPEG image file",
            "@type": "IMAGE-HIGH-RES",
            "@size": "130958",
            "@ref": "gr4",
            "@mimetype": "image/jpeg"
          },
          {
            "@category": "high",
            "@height": "1100",
            "@width": "2250",
            "@_fa": "true",
            "$": "https://api.elsevier.com/content/object/eid/1-s2.0-S0926860X17303162-gr5_lrg.jpg?httpAccept=%2A%2F%2A",
            "@multimediatype": "JPEG image file",
            "@type": "IMAGE-HIGH-RES",
            "@size": "335580",
            "@ref": "gr5",
            "@mimetype": "image/jpeg"
          },
          {
            "@category": "high",
            "@height": "793",
            "@width": "2917",
            "@_fa": "true",
            "$": "https://api.elsevier.com/content/object/eid/1-s2.0-S0926860X17303162-gr6_lrg.jpg?httpAccept=%2A%2F%2A",
            "@multimediatype": "JPEG image file",
            "@type": "IMAGE-HIGH-RES",
            "@size": "299636",
            "@ref": "gr6",
            "@mimetype": "image/jpeg"
          },
          {
            "@category": "high",
            "@height": "859",
            "@width": "1667",
            "@_fa": "true",
            "$": "https://api.elsevier.com/content/object/eid/1-s2.0-S0926860X17303162-gr7_lrg.jpg?httpAccept=%2A%2F%2A",
            "@multimediatype": "JPEG image file",
            "@type": "IMAGE-HIGH-RES",
            "@size": "136907",
            "@ref": "gr7",
            "@mimetype": "image/jpeg"
          },
          {
            "@category": "high",
            "@height": "4178",
            "@width": "1083",
            "@_fa": "true",
            "$": "https://api.elsevier.com/content/object/eid/1-s2.0-S0926860X17303162-gr8_lrg.jpg?httpAccept=%2A%2F%2A",
            "@multimediatype": "JPEG image file",
            "@type": "IMAGE-HIGH-RES",
            "@size": "570271",
            "@ref": "gr8",
            "@mimetype": "image/jpeg"
          },
          {
            "@category": "high",
            "@height": "978",
            "@width": "1417",
            "@_fa": "true",
            "$": "https://api.elsevier.com/content/object/eid/1-s2.0-S0926860X17303162-gr9_lrg.jpg?httpAccept=%2A%2F%2A",
            "@multimediatype": "JPEG image file",
            "@type": "IMAGE-HIGH-RES",
            "@size": "94140",
            "@ref": "gr9",
            "@mimetype": "image/jpeg"
          },
          {
            "@category": "standard",
            "@_fa": "true",
            "$": "https://api.elsevier.com/content/object/eid/1-s2.0-S0926860X17303162-mmc1.docx?httpAccept=%2A%2F%2A",
            "@multimediatype": "Microsoft Word file",
            "@type": "APPLICATION",
            "@size": "617112",
            "@ref": "mmc1",
            "@mimetype": "application/word"
          }
        ]
      },
      "link": {
        "@rel": "abstract",
        "@href": "https://api.elsevier.com/content/abstract/scopus_id/85025674219"
      }
    }
  }
}