{
  "metadata": {
    "title": "Carbon nanotubes as advanced catalysts and catalytic supports for the liquid-phase aerobic oxidation of hydrocarbons: A review",
    "authors": "; ",
    "journal": "Applied Catalysis A: General",
    "date": "2023-11-25",
    "doi": "10.1016/j.apcata.2023.119465",
    "abstract": "",
    "uri": "https://api.elsevier.com/content/article/pii/S0926860X23004453",
    "pii": "S0926860X23004453"
  },
  "fulltext": {
    "full-text-retrieval-response": {
      "scopus-eid": "2-s2.0-85175034333",
      "originalText": "serial JL 271346 291210 291744 291809 31 Applied Catalysis A: General APPLIEDCATALYSISAGENERAL 2023-10-20 2023-10-20 2023-10-27 2023-10-27 2023-11-15T12:57:37 1-s2.0-S0926860X23004453 S0926-860X(23)00445-3 S0926860X23004453 10.1016/j.apcata.2023.119465 S300 S300.1 FULL-TEXT 1-s2.0-S0926860X23X00192 2024-01-01T12:35:59.692098Z 0 0 20231125 2023 2023-10-20T15:18:33.769595Z absattachment articleinfo articlenumber articletitlenorm authfirstinitialnorm authfirstsurnamenorm cid cids contenttype copyright crossmark dateloaded dateloadedtxt datesearch datesort dateupdated dco docsubtype doctype doi eid ewtransactionid hubeid indexeddate issn issnnorm itemstage itemtransactionid itemweight openaccess openarchive pg pgfirst pii piinorm pubdatestart pubdatetxt pubyr sortorder srctitle srctitlenorm srctype ssids alllist content subj subheadings suppl tomb volfirst volissue volumelist webpdf webpdfpagecount yearnav figure table body mmlmath acknowledge affil articletitle auth authfirstini authfull authkeywords authlast grantnumber grantsponsor grantsponsorid highlightsabst otherkwds primabst ref specialabst 0926-860X 0926860X true 668 668 C Volume 668 7 119465 119465 119465 20231125 25 November 2023 2023-11-25 2023 article rev © 2023 Elsevier B.V. All rights reserved. CARBONNANOTUBESADVANCEDCATALYSTSCATALYTICSUPPORTSFORLIQUIDPHASEAEROBICOXIDATIONOFHYDROCARBONSAREVIEW AZAM S 1 Introduction 2 Reaction mechanism 2.1 General reaction mechanism 2.2 Reaction mechanism over CNTs 3 Pristine CNTs as metal-free catalysts 4 Functionalized CNTs as catalysts and catalytic supports 4.1 Heteroatom-doped CNTs as metal-free catalysts 4.2 Oxygenated CNTs 4.3 Metal, metal oxides, and complex functionalized CNTs 5 Effect of CNTs purity on liquid phase oxidation of hydrocarbons 6 Prospects of CNTs in catalysis for hydrocarbon oxidation 7 Conclusion Acknowledgments References SHELDON 2012 R METALCATALYZEDOXIDATIONSORGANICCOMPOUNDSMECHANISTICPRINCIPLESSYNTHETICMETHODOLOGYINCLUDINGBIOCHEMICALPROCESSES SU 2023 Y SPEIGHT 2019 J HANDBOOKPETROCHEMICALPROCESSES SHELDON 1995 R CATALYTICOXIDATIONPRINCIPLESAPPLICATIONS DENISOV 2005 E OXIDATIONANTIOXIDANTSINORGANICCHEMISTRY MUZART 1992 113 140 J BINSAIMAN 2012 5981 5985 M WANG 2010 3356 3359 Y ZHOU 2012 6954 6956 H WASER 2005 187 193 M HONE 2020 67 110 C HABIBI 2013 888 896 D CHEN 2015 14684 14690 A NANDANWAR 2021 2116 2131 S LU 2022 118441 Q YAN 2015 3295 3346 Y ROCHA 2016 17 R JOHN 2012 515 539 J SCHNORR 2011 646 657 J ROCHA 2020 189 196 R YANG 2008 445 452 S ROCHA 2017 62 70 R JING 2016 S1208 S1213 G RINALDI 2010 254 260 A LIU 2019 117982 W QI 2013 14224 14228 W SHEN 2015 61 69 Y GARCIAGARCIA 2010 267 276 F CHEN 2010 404 410 J ZHANG 2018 907 915 H NIA 2016 125 137 A MU 2015 8893 8899 M XING 2013 24 28 C ZHANG 2009 9241 9249 H ZHANG 2023 1888 1904 H WANG 2020 6389 6401 S OOSTHUIZEN 2011 154 169 R YANG 2010 131 137 X LUO 2012 98 106 J MALEKI 2018 460 464 A HU 2019 5274 5283 X LUO 2013 1578 1586 J LIAO 2014 1 8 S CAO 2013 433 442 Y ZEYNALOV 2019 245 251 E FU 2019 129 137 H RATHINAVEL 2021 115095 S EATEMADI 2014 1 13 A PRASEK 2011 15872 15884 J VAIRAVAPANDIAN 2008 119 129 D SERP 2010 41 47 P HERMANS 2006 4229 4240 I HERMANS 2007 754 761 I DENG 2014 333 339 W BHATTACHARYA 2008 308 319 A LE 2021 6955 6967 M SUN 2017 202 210 W LIN 2017 2164 2173 X MA 2007 104 108 H XIONG 2021 2418 2423 Y JINWEI 2011 1342 1348 Q LIAO 2014 555 560 S YANG 2017 4431 4436 X YANG 2010 699 707 J HERMANS 2007 3057 3064 I YANG 2013 9818 9824 X CAO 2013 2654 2660 Y YU 2011 4064 4068 H DUAN 2015 553 559 X LI 2014 1261 1266 W TANG 2016 6948 6958 P MARTINMARTINEZ 2016 2068 2078 M CAO 2014 1617 1625 Y GAO 2013 2109 2113 Y MU 2018 391 398 C SU 2021 646 655 Y WANG 2012 781 794 H MA 2016 1976 1982 Z HE 2016 12582 12594 L LONG 2012 622 631 J GUO 2016 361 365 D CAO 2015 3935 3944 Y AZAM 2023 141207 S LIU 2017 1382 1395 M FU 2016 5577 5580 L TUSAR 2011 166 171 N DAPURKAR 2009 1025 1028 S ZHAO 2004 904 905 R HEREIJGERS 2010 16 25 B CAI 2010 197 201 Z XU 2007 202 205 L YIN 2009 440 443 C HUANG 2012 4964 4967 H DAPURKAR 2008 112 116 S NOWACKA 2019 7708 7715 A CHAKRABARTY 2007 845 848 R THOMAS 1999 829 830 J MAKSIMCHUK 2008 315 323 N SHENG 2021 1438 1468 J QI 2018 640 648 W MARFORIO 2019 499 505 T LIU 2018 1 7 W ZHANG 2008 73 77 J LIU 2008 547 549 X CHI 2016 2396 2402 Y REN 2011 395 410 X CHO 2008 2899 2905 H LIAO 2008 160 165 Q ONYESTYAK 2004 1508 1514 G YANG 2012 1213 1217 X SU 2022 Y LUO 2014 77 81 J FU 2016 398 404 L PECKH 2021 2314 K FENG 2020 623 Y WANG 2018 7374 7382 Z MACHADO 2014 17475 17482 K MOGHADAM 2009 3816 3822 M ORLINSKA 2011 670 676 B ULITIN 2023 119044 N ULITIN 2021 111886 N TUROVSKIJ 2020 121371 N SRIVASTAVA 1975 317 323 R PAN 2011 553 562 X TRANGNGUYEN 2013 3595 3603 T CHEN 2023 5773 5781 Z CHEN 2016 1782 1787 Y XIANG 2021 85 91 G PAN 2008 6271 6281 X MINERS 2016 4727 4746 S SHI 2014 81 87 Z MA 2014 7409 7413 T WANG 2012 4209 4212 S YANG 2015 1436 1439 W ZHAO 2019 1278 L SU 2023 e18007 Y GONG 2017 222 232 C CHEN 1998 317 325 C GAO 2001 209 215 Y ZHOU 2016 1946 1952 P CHEN 2019 27212 27216 B GAO 2007 620 625 J SKLIRI 2017 136 143 E BISWAL 2011 15440 15448 M DENG 2022 136666 Y OVEJERO 2006 2206 2212 G CHEN 2021 e26780 Z DENG 2020 2523 2530 J ROSCA 2005 3124 3131 I ROS 2002 1151 1162 T SEZER 2019 1 8 N HOU 2008 2003 2025 P MELCHIONNA 2015 3859 3875 M CHARLIER 1996 11108 J HE 2009 297 306 H AZAMX2023X119465 AZAMX2023X119465XS 2025-10-27T00:00:00.000Z 2025-10-27T00:00:00.000Z http://creativecommons.org/licenses/by-nc-nd/4.0/ © 2023 Elsevier B.V. All rights reserved. 2023-11-01T07:27:02.230Z http://vtw.elsevier.com/data/voc/AddOnTypes/50.7/aggregated-refined Silesian University of Technology BKM-555/RCH5/2023 SUT Silesian University of Technology http://data.elsevier.com/vocabulary/SciValFunders/501100007835 http://sws.geonames.org/798544/ Polish National Agency for Academic Exchange BPI/PST/2021/1/00039 NAWA Narodowa Agencja Wymiany Akademickiej http://data.elsevier.com/vocabulary/SciValFunders/501100014434 http://sws.geonames.org/798544/ This work was funded by the Silesian University of Technology, Poland (grants No. BKM-555/RCH5/2023 ). The authors would also like to thank the Polish National Agency for Academic Exchange for realization of the project ( BPI/PST/2021/1/00039 ). This work was funded by the Silesian University of Technology, Poland (grants No. BKM-555/RCH5/2023). The authors would also like to thank the Polish National Agency for Academic Exchange for realization of the project (BPI/PST/2021/1/00039). https://doi.org/10.15223/policy-017 https://doi.org/10.15223/policy-037 https://doi.org/10.15223/policy-012 https://doi.org/10.15223/policy-029 https://doi.org/10.15223/policy-004 item S0926-860X(23)00445-3 S0926860X23004453 1-s2.0-S0926860X23004453 10.1016/j.apcata.2023.119465 271346 2024-01-01T12:35:59.692098Z 2023-11-25 1-s2.0-S0926860X23004453-main.pdf https://s3-eu-west-1.amazonaws.com/prod-ucs-content-store-eu-west/content/pii:S0926860X23004453/MAIN/application/pdf/e2b502fea67e0cb777155eb807461d6b/main.pdf main.pdf pdf true 6969613 MAIN 16 1-s2.0-S0926860X23004453-main_1.png https://s3-eu-west-1.amazonaws.com/prod-ucs-content-store-eu-west/content/pii:S0926860X23004453/PREVIEW/image/png/1318f5247df2783ec763da13a4e998c8/main_1.png main_1.png png 56556 849 656 IMAGE-WEB-PDF 1 1-s2.0-S0926860X23004453-gr3.jpg https://s3-eu-west-1.amazonaws.com/prod-ucs-content-store-eu-west/content/pii:S0926860X23004453/gr3/DOWNSAMPLED/image/jpeg/0cb61fb0052a425505a9fbe706a2f42c/gr3.jpg gr3 gr3.jpg jpg 45753 379 376 IMAGE-DOWNSAMPLED 1-s2.0-S0926860X23004453-ga1.jpg https://s3-eu-west-1.amazonaws.com/prod-ucs-content-store-eu-west/content/pii:S0926860X23004453/ga1/DOWNSAMPLED/image/jpeg/29ad6d6ce5b057dc0ab4085ba827097f/ga1.jpg ga1 true ga1.jpg jpg 30103 200 489 IMAGE-DOWNSAMPLED 1-s2.0-S0926860X23004453-gr7.jpg https://s3-eu-west-1.amazonaws.com/prod-ucs-content-store-eu-west/content/pii:S0926860X23004453/gr7/DOWNSAMPLED/image/jpeg/df121b9649c1bf677bea2f97646673df/gr7.jpg gr7 gr7.jpg jpg 144041 723 791 IMAGE-DOWNSAMPLED 1-s2.0-S0926860X23004453-gr6.jpg https://s3-eu-west-1.amazonaws.com/prod-ucs-content-store-eu-west/content/pii:S0926860X23004453/gr6/DOWNSAMPLED/image/jpeg/31a8a79a9b0bd456ba40f13a79d6ee96/gr6.jpg gr6 gr6.jpg jpg 110605 550 791 IMAGE-DOWNSAMPLED 1-s2.0-S0926860X23004453-sc1.jpg https://s3-eu-west-1.amazonaws.com/prod-ucs-content-store-eu-west/content/pii:S0926860X23004453/sc1/DOWNSAMPLED/image/jpeg/3f1ddd1e8aaf21a99b7bc7e14f1aede1/sc1.jpg sc1 sc1.jpg jpg 17848 153 565 IMAGE-DOWNSAMPLED 1-s2.0-S0926860X23004453-gr2.jpg https://s3-eu-west-1.amazonaws.com/prod-ucs-content-store-eu-west/content/pii:S0926860X23004453/gr2/DOWNSAMPLED/image/jpeg/f0ac8fa606d7185cbee22c30902f849a/gr2.jpg gr2 gr2.jpg jpg 16012 236 334 IMAGE-DOWNSAMPLED 1-s2.0-S0926860X23004453-gr1.jpg https://s3-eu-west-1.amazonaws.com/prod-ucs-content-store-eu-west/content/pii:S0926860X23004453/gr1/DOWNSAMPLED/image/jpeg/770208bf3cf520b5c86ffcf7ea8515d4/gr1.jpg gr1 gr1.jpg jpg 10857 131 339 IMAGE-DOWNSAMPLED 1-s2.0-S0926860X23004453-gr5.jpg https://s3-eu-west-1.amazonaws.com/prod-ucs-content-store-eu-west/content/pii:S0926860X23004453/gr5/DOWNSAMPLED/image/jpeg/cb8cc88921912aecb9135f433c564d39/gr5.jpg gr5 gr5.jpg jpg 111872 562 565 IMAGE-DOWNSAMPLED 1-s2.0-S0926860X23004453-gr4.jpg https://s3-eu-west-1.amazonaws.com/prod-ucs-content-store-eu-west/content/pii:S0926860X23004453/gr4/DOWNSAMPLED/image/jpeg/ab200705b692f40e8d0eafa402529cc2/gr4.jpg gr4 gr4.jpg jpg 12290 150 188 IMAGE-DOWNSAMPLED 1-s2.0-S0926860X23004453-sc2.jpg https://s3-eu-west-1.amazonaws.com/prod-ucs-content-store-eu-west/content/pii:S0926860X23004453/sc2/DOWNSAMPLED/image/jpeg/da739fd14b7dc95a7b9738c93e309232/sc2.jpg sc2 sc2.jpg jpg 76491 549 678 IMAGE-DOWNSAMPLED 1-s2.0-S0926860X23004453-gr3.sml https://s3-eu-west-1.amazonaws.com/prod-ucs-content-store-eu-west/content/pii:S0926860X23004453/gr3/THUMBNAIL/image/gif/9af5f9d0015b9098d3dd5cb734d531be/gr3.sml gr3 gr3.sml sml 10390 163 162 IMAGE-THUMBNAIL 1-s2.0-S0926860X23004453-ga1.sml https://s3-eu-west-1.amazonaws.com/prod-ucs-content-store-eu-west/content/pii:S0926860X23004453/ga1/THUMBNAIL/image/gif/ea442c7f10e1b2b1ec1c6335509cbae1/ga1.sml ga1 true ga1.sml sml 7510 90 219 IMAGE-THUMBNAIL 1-s2.0-S0926860X23004453-gr7.sml https://s3-eu-west-1.amazonaws.com/prod-ucs-content-store-eu-west/content/pii:S0926860X23004453/gr7/THUMBNAIL/image/gif/ac47f5dd9dd5329405255099243f86d8/gr7.sml gr7 gr7.sml sml 14815 164 179 IMAGE-THUMBNAIL 1-s2.0-S0926860X23004453-gr6.sml https://s3-eu-west-1.amazonaws.com/prod-ucs-content-store-eu-west/content/pii:S0926860X23004453/gr6/THUMBNAIL/image/gif/9c9f65e4263f3c079d2aa6cbe16ac997/gr6.sml gr6 gr6.sml sml 20975 152 219 IMAGE-THUMBNAIL 1-s2.0-S0926860X23004453-sc1.sml https://s3-eu-west-1.amazonaws.com/prod-ucs-content-store-eu-west/content/pii:S0926860X23004453/sc1/THUMBNAIL/image/gif/2ad897f975b4c6826263cd397822f145/sc1.sml sc1 sc1.sml sml 3314 59 219 IMAGE-THUMBNAIL 1-s2.0-S0926860X23004453-gr2.sml https://s3-eu-west-1.amazonaws.com/prod-ucs-content-store-eu-west/content/pii:S0926860X23004453/gr2/THUMBNAIL/image/gif/29e79b20058d09b3700042568442f101/gr2.sml gr2 gr2.sml sml 5841 155 219 IMAGE-THUMBNAIL 1-s2.0-S0926860X23004453-gr1.sml https://s3-eu-west-1.amazonaws.com/prod-ucs-content-store-eu-west/content/pii:S0926860X23004453/gr1/THUMBNAIL/image/gif/ba0be6d723c1dc1f8ae42f23c6677f5a/gr1.sml gr1 gr1.sml sml 6632 85 219 IMAGE-THUMBNAIL 1-s2.0-S0926860X23004453-gr5.sml https://s3-eu-west-1.amazonaws.com/prod-ucs-content-store-eu-west/content/pii:S0926860X23004453/gr5/THUMBNAIL/image/gif/8f44e996e352e586aa29c716a3a91eca/gr5.sml gr5 gr5.sml sml 16101 164 165 IMAGE-THUMBNAIL 1-s2.0-S0926860X23004453-gr4.sml https://s3-eu-west-1.amazonaws.com/prod-ucs-content-store-eu-west/content/pii:S0926860X23004453/gr4/THUMBNAIL/image/gif/45f59f0db3e776df14901c363770a721/gr4.sml gr4 gr4.sml sml 12626 164 205 IMAGE-THUMBNAIL 1-s2.0-S0926860X23004453-sc2.sml https://s3-eu-west-1.amazonaws.com/prod-ucs-content-store-eu-west/content/pii:S0926860X23004453/sc2/THUMBNAIL/image/gif/b20bbcfda485ae1901281e2f72b5c2d2/sc2.sml sc2 sc2.sml sml 7022 164 202 IMAGE-THUMBNAIL 1-s2.0-S0926860X23004453-gr3_lrg.jpg https://s3-eu-west-1.amazonaws.com/prod-ucs-content-store-eu-west/content/pii:S0926860X23004453/HIGHRES/image/jpeg/c1fa0f546925b4fc315c74def3720faf/gr3_lrg.jpg gr3 gr3_lrg.jpg jpg 216120 1676 1663 IMAGE-HIGH-RES 1-s2.0-S0926860X23004453-ga1_lrg.jpg https://s3-eu-west-1.amazonaws.com/prod-ucs-content-store-eu-west/content/pii:S0926860X23004453/HIGHRES/image/jpeg/a9d4c938705422e8a8b4f19ae877b333/ga1_lrg.jpg ga1 true ga1_lrg.jpg jpg 246956 886 2164 IMAGE-HIGH-RES 1-s2.0-S0926860X23004453-gr7_lrg.jpg https://s3-eu-west-1.amazonaws.com/prod-ucs-content-store-eu-west/content/pii:S0926860X23004453/HIGHRES/image/jpeg/45c5a136c88d12c1eaeb46db5a601e6a/gr7_lrg.jpg gr7 gr7_lrg.jpg jpg 910513 3192 3493 IMAGE-HIGH-RES 1-s2.0-S0926860X23004453-gr6_lrg.jpg https://s3-eu-west-1.amazonaws.com/prod-ucs-content-store-eu-west/content/pii:S0926860X23004453/HIGHRES/image/jpeg/3b25c71a845eca94348138ff035b6a39/gr6_lrg.jpg gr6 gr6_lrg.jpg jpg 519449 2427 3493 IMAGE-HIGH-RES 1-s2.0-S0926860X23004453-sc1_lrg.jpg https://s3-eu-west-1.amazonaws.com/prod-ucs-content-store-eu-west/content/pii:S0926860X23004453/HIGHRES/image/jpeg/d934d0e9b388500dcc3389217d03366e/sc1_lrg.jpg sc1 sc1_lrg.jpg jpg 116373 676 2495 IMAGE-HIGH-RES 1-s2.0-S0926860X23004453-gr2_lrg.jpg https://s3-eu-west-1.amazonaws.com/prod-ucs-content-store-eu-west/content/pii:S0926860X23004453/HIGHRES/image/jpeg/9c3e89a8258f4c5247ceaf372cc9e225/gr2_lrg.jpg gr2 gr2_lrg.jpg jpg 109310 1048 1482 IMAGE-HIGH-RES 1-s2.0-S0926860X23004453-gr1_lrg.jpg https://s3-eu-west-1.amazonaws.com/prod-ucs-content-store-eu-west/content/pii:S0926860X23004453/HIGHRES/image/jpeg/289fa073c750e3ce97387e2630af2124/gr1_lrg.jpg gr1 gr1_lrg.jpg jpg 117645 580 1497 IMAGE-HIGH-RES 1-s2.0-S0926860X23004453-gr5_lrg.jpg https://s3-eu-west-1.amazonaws.com/prod-ucs-content-store-eu-west/content/pii:S0926860X23004453/HIGHRES/image/jpeg/5cf4377a1c2b82ced4c786628fcb6807/gr5_lrg.jpg gr5 gr5_lrg.jpg jpg 684508 2481 2495 IMAGE-HIGH-RES 1-s2.0-S0926860X23004453-gr4_lrg.jpg https://s3-eu-west-1.amazonaws.com/prod-ucs-content-store-eu-west/content/pii:S0926860X23004453/HIGHRES/image/jpeg/70753eb3c33890f522b64ea634b52adb/gr4_lrg.jpg gr4 gr4_lrg.jpg jpg 92662 664 831 IMAGE-HIGH-RES 1-s2.0-S0926860X23004453-sc2_lrg.jpg https://s3-eu-west-1.amazonaws.com/prod-ucs-content-store-eu-west/content/pii:S0926860X23004453/HIGHRES/image/jpeg/5d4627c945b3b2ce410023082ac6e4da/sc2_lrg.jpg sc2 sc2_lrg.jpg jpg 583941 2425 2994 IMAGE-HIGH-RES 1-s2.0-S0926860X23004453-si0001.svg https://s3-eu-west-1.amazonaws.com/prod-ucs-content-store-eu-west/content/pii:S0926860X23004453/image/svg+xml/2a3df2bea5211eedda201795ecea7dc3/si0001.svg si0001 si0001.svg svg 3221 ALTIMG 1-s2.0-S0926860X23004453-si0002.svg https://s3-eu-west-1.amazonaws.com/prod-ucs-content-store-eu-west/content/pii:S0926860X23004453/image/svg+xml/f9f5163c90ac0650d93e45ada72bf715/si0002.svg si0002 si0002.svg svg 2771 ALTIMG 1-s2.0-S0926860X23004453-si0003.svg https://s3-eu-west-1.amazonaws.com/prod-ucs-content-store-eu-west/content/pii:S0926860X23004453/image/svg+xml/6825eb0ddccf92da5ff2dcad493b1202/si0003.svg si0003 si0003.svg svg 2070 ALTIMG 1-s2.0-S0926860X23004453-si0004.svg https://s3-eu-west-1.amazonaws.com/prod-ucs-content-store-eu-west/content/pii:S0926860X23004453/image/svg+xml/1465e90f4aa9e2102af077f750ba35f1/si0004.svg si0004 si0004.svg svg 2078 ALTIMG 1-s2.0-S0926860X23004453-si0005.svg https://s3-eu-west-1.amazonaws.com/prod-ucs-content-store-eu-west/content/pii:S0926860X23004453/image/svg+xml/adda06043f0eab42e056ad9e4083fe3e/si0005.svg si0005 si0005.svg svg 2119 ALTIMG 1-s2.0-S0926860X23004453-si0006.svg https://s3-eu-west-1.amazonaws.com/prod-ucs-content-store-eu-west/content/pii:S0926860X23004453/image/svg+xml/171c8001d1a56671ba208b1009cf9c82/si0006.svg si0006 si0006.svg svg 2179 ALTIMG 1-s2.0-S0926860X23004453-si0007.svg https://s3-eu-west-1.amazonaws.com/prod-ucs-content-store-eu-west/content/pii:S0926860X23004453/image/svg+xml/4abf44b7f70ef680269ecb869ec2bc5c/si0007.svg si0007 si0007.svg svg 3241 ALTIMG 1-s2.0-S0926860X23004453-si0008.svg https://s3-eu-west-1.amazonaws.com/prod-ucs-content-store-eu-west/content/pii:S0926860X23004453/image/svg+xml/5de1d98d13e134785fa5abfc859e95c9/si0008.svg si0008 si0008.svg svg 2127 ALTIMG 1-s2.0-S0926860X23004453-si0009.svg https://s3-eu-west-1.amazonaws.com/prod-ucs-content-store-eu-west/content/pii:S0926860X23004453/image/svg+xml/41d009ef3bfca6932e127a50338aa546/si0009.svg si0009 si0009.svg svg 1519 ALTIMG 1-s2.0-S0926860X23004453-si0010.svg https://s3-eu-west-1.amazonaws.com/prod-ucs-content-store-eu-west/content/pii:S0926860X23004453/image/svg+xml/56cb12c3ea2c2fe23750d7df3de9ac5c/si0010.svg si0010 si0010.svg svg 2727 ALTIMG 1-s2.0-S0926860X23004453-si0011.svg https://s3-eu-west-1.amazonaws.com/prod-ucs-content-store-eu-west/content/pii:S0926860X23004453/image/svg+xml/9ec71c670da40e3929be0125f15319db/si0011.svg si0011 si0011.svg svg 2941 ALTIMG 1-s2.0-S0926860X23004453-si0012.svg https://s3-eu-west-1.amazonaws.com/prod-ucs-content-store-eu-west/content/pii:S0926860X23004453/image/svg+xml/73000c6b1ccf8e8dd1a2056102b79809/si0012.svg si0012 si0012.svg svg 4084 ALTIMG 1-s2.0-S0926860X23004453-si0013.svg https://s3-eu-west-1.amazonaws.com/prod-ucs-content-store-eu-west/content/pii:S0926860X23004453/image/svg+xml/19f8b02c97432d5ec0650cced652f650/si0013.svg si0013 si0013.svg svg 960 ALTIMG 1-s2.0-S0926860X23004453-si0014.svg https://s3-eu-west-1.amazonaws.com/prod-ucs-content-store-eu-west/content/pii:S0926860X23004453/image/svg+xml/b2aa390878dafca52b14aec196b7f48c/si0014.svg si0014 si0014.svg svg 960 ALTIMG 1-s2.0-S0926860X23004453-am.pdf https://s3-eu-west-1.amazonaws.com/prod-ucs-content-store-eu-west/content/egi:10C5J9GLD46/MAIN/application/pdf/ab2cce290d2fffe34091a0d872dabc5d/am.pdf am am.pdf pdf false 3623669 AAM-PDF APCATA 119465 119465 S0926-860X(23)00445-3 10.1016/j.apcata.2023.119465 Elsevier B.V. Fig. 1 Scheme of the formation of SWCNTs and MWCNTs from graphene sheets. Fig. 1 Fig. 2 Schematic illustration of the bonding configurations of nitrogen that can be linked to CNTs. Fig. 2 Fig. 3 Diagrammatic representation of surface-oxidized CNTs with possible functional groups containing oxygen. Fig. 3 Reproduced from Ref. [16] with permission from the Royal Society of Chemistry. Fig. 4 Schematic diagram of a metal nanoparticle encapsulated/confined in SWCNT. Fig. 4 Fig. 5 TEM images of (a) Co@CNTs (in), (b) Co@CNTs (out), (c) recycle of Co@CNTs (in), and (d) recycle of Co@CNTs (out) [131]. By permission from Elsevier, copyright 2014. Fig. 5 Fig. 6 HRTEM (a-d), HAADF image, and elemental mappings (e) of cobalt encapsulated CGNs. Fig. 6 Reproduced from Ref. [58] with permission from the Royal Society of Chemistry. Fig. 7 TEM image with EDS analysis of (a) IGMWCNT-COOH (b) IGMWCNT-COO-Cu (c) IGMWCNT-COO-Cu@ 2([emim][OcOSO3]) + NHPI [83]. By permission from Elsevier, copyright 2023. Fig. 7 Scheme 1 Oxidation products of ethylbenzene. Redrawn from Ref. [42]. Scheme 1 Scheme 2 Plausible reaction mechanism of ethylbenzene oxidation over CNTs using dioxygen as an oxidant. Redrawn from Ref. [42,58]. Scheme 2 Table 1 Comparison of the catalytic performance of CNTs, heteroatom-doped CNTs, and metal-based catalysts for the liquid-phase oxidation of hydrocarbons with molecular oxygen as an oxidant. Table 1 Entry Catalyst BET(m2/g) Oxidant Solvent T(oC) P(MPa) t(h) Substrate conversion (%) rw a (mmol g−1 h−1) rs b (mmol m−2 h−1) Product selectivity (%) Ref. Ethylbenzene AcPO PEA PEHP BA BzA 1 CNTs 138 O2 Acetonitrile 155 1.5 4 38.2 37.2 0.027 60.9 9.8 2.3 7.5 19.5 [42] 2 CoAc(Co(OAc)2.4 H2O - O2 Acetonitrile 155 1.5 4 5.5 - - 43.1 42.8 1.5 12.6 - 3 CoAc(Co(OAc)2.4 H2O - O2 Acetic acid 155 1.5 4 40.7 - - 77.5 8.7 0.1 4.5 9.2 4 CNTs - O2 - 80 0.1 6 5.2 - - 4.9 51.3 43.8 - - [83] 5 CNTs 178 O2 Acetonitrile 155 1.5 4 22 42 0.3 25 12 41 - - [76] 6 N-CNTs 133 O2 Acetonitrile 155 1.5 4 23 286 1.4 45 13 30 - - 7 MnOx/HTS O2 - 150 0.6 1 37.1 - - 68.6 20.4 3.5 3.4 - [84] 8 Mn-N-C@SiO2 310.9 O2 - 120 0.8 5 15.7 - - 73.6 19 7.4 - [85] 9 Co(OAc)2 - O2 - 120 1 6 9.2 - - 27.5 12.9 78.6 - - [59] 10 Co3O4 - O2 - 120 1 6 7.1 - - 43.7 9.5 46.9 - - 11 Co/SBA-15 - O2 - 150 1 9 70.1 - - 83.7 4.1 0.1 - 12.1 12 MnMCM - O2 - 110 1 6 34 - - 88 - - - - [86] 13 CrMCM-141 - O2 - 95 1 24 66 - - 90 - - - - [87] Cyclohexane K A CHHP AA HHA 14 N-CNTs 49.3 O2 Acetone 125 1.5 2.5 6.7 148.1 3 25.6 31.7 2.5 31.1 14.8 [44] 15 P-CNTs 4 O2 Acetone 125 1.5 5 10.2 113.5 28 22 23.4 3.9 31.3 11.7 16 B-CNTs 53.9 O2 Acetone 125 1.5 2.5 2.8 61.1 1.1 25.1 32.9 7.2 13.4 13.9 17 CNTs 127.8 O2 Acetone 125 1.5 8 34.3 373 2.9 40.4 c - 52.4 - [68] 18 N-CNTs 155.1 O2 Acetone 125 1.5 8 45.3 879 5.7 26.7 c - 59.7 - 19 Au/ZSM5 421 O2 - 150 1 3 15 185 - 68 24 - - - [88] 20 Co2+ O2 - 150 1.2–1.5 0.77 4 - - 17 48 17 - - [89] 21 Au/SBA-15 O2 - 150 1.2–1.5 1.53 4 - - 28 43 7 - - 22 Au/Al2O3 O2 - 150 1.2–1.5 1.92 4 - - 18 42 19 - - 23 Au/TiO2 O2 - 150 1.2–1.5 2 4 - - 20 45 15 - - Cyclohexene Cy-one Cy-ol Cy-HP Ep-Cy Cy-diol 24 CNTs 127.8 O2 Acetonitrile 80 1 4 21 95.9 0.8 8.1 7.1 62.9 2.2 1.2 [73] 25 N-CNTs 155.1 O2 Acetonitrile 80 1 4 59 620.1 4 41.1 11.2 27.3 5.9 0.18 26 Au/La-OMS - O2 - 80 0.4 24 48 19.7 - 44.4 40.3 - 2.5 - [90] 27 Au/Al2O3 258 O2 - 150 1.5 3 12 16.5 0.06 32.1 52.6 - - - [91] 28 Co-MCM-41 O2 - 70 0.1 7 ∼100 - - 15.5 20.1 - - - [92] 29 Cobalt resinate O2 - 70 0.1 7 94.5 16.2 - 44.4 40.2 - - - 30 Au-graphene 186.1 O2 - 60 0.1 24 55.5 - - 7.24 30.2 - 0.7 61.6 [93] 31 CrMCM-41 1150 O2 - 60 0.1 24 52.2 0.4 0.0003 71.2 11.2 14.2 3.4 - [94] Cumene - - AcPO BP CHP - - 32 CNTs 85.3 O2 - 80 0.1 8 24.1 - - 1.6 10 88.4 - - [43] 33 CuO - O2 - 80 0.1 8 38.5 - - 5.7 21.1 73.2 - - 34 CuO - O2 - 80 0.1 8 31.6 - - 2.7 14.2 83.1 - - 35 CNTs 20.9 O2 - 80 0.1 8 16.1 14.1 0.673 1.6 8.4 90 - - [62] 36 NCNTs-0.31 d 35.1 O2 - 80 0.1 8 30.7 30.6 0.874 5.1 23.9 71 - - 37 NCNTs-2.21 d 48.9 O2 - 80 0.1 8 53.9 116.2 2.378 27.1 57.2 15.7 - - 38 NCNTs-3.33 d 72.6 O2 - 80 0.1 8 74.7 147 2.026 40.8 56.1 3.1 - - 39 NCNTs-4.36 d 52.4 O2 - 80 0.1 8 72.1 157.5 3 40.5 56.2 3.3 - - 40 Co-BTC - O2 - 90 0.4 7 49 - - - - 69 - - [95] 41 Co5Ni-BTC - O2 - 90 0.4 7 30 - - - - 91 - - α-pinene V-one V-ol V-HP α-p-O - 42 CNTs 127.8 O2 Acetonitrile 80 1.5 4 24.6 43 0.34 7.9 6.1 37.9 33.8 - [82] 43 NCNTs 155.1 O2 Acetonitrile 80 1.5 4 54.5 272.4 1.76 14.1 17.5 15.3 37.8 - 44 Co(III)-HMS 1071 O2 - 80 0.1 24 34.2 3.6 0.3 22 16 - 34 - [96] 45 MnAIPO-36 - O2 - 50 3 8 59 75.8 - - - - 91 - [97] 46 Co-POM/MIL-101 2050 O2 Acetonitrile 50 0.1 2 45 1.6 0.08 27 29 - - - [98] a Initial rate of substrate consumption per gram of catalyst. b Initial rate of substrate consumption per m2 of catalyst surface. c KA oil (Mixture of cyclohexanone and cyclohexanol). d (N/N+C) atom%. Table 2 Effect of oxygen-containing function groups on the catalytic activities of CNTs and heteroatom-doped CNTs. Table 2 Entry Catalyst Oxidant Solvent BET(m2 g−1) T(oC) P(MPa) t(h) Surface oxygen-containing functional groups Substrate conversion (%) Product selectivity (%) Ref. -OH -CO -COOH Ethylbenzene AcPO PEA PEHP BA BzA 1 CNTs -HNO3-5a O2 Acetonitrile 159 155 1.5 4 9.6c 5.9c 4.1c 30.5 53.4 15.9 25.4 8.6 16.6 [42] 2 CNTs-HNO3-9a O2 Acetonitrile 165 155 1.5 4 8.7c 5.1c 4.6c 25.7 42.1 26.5 10.2 12.8 8.4 3 CNTs-HNO3-15a O2 Acetonitrile 209 155 1.5 4 9.7c 6.9c 7.2c 6.7 30.6 26.3 23.2 19.9 0.0 4 CNTs-HNO3-15a-600b O2 Acetonitrile 259 155 1.5 4 - - - 14.6 36.1 28.3 17.7 14.0 3.9 5 CNTs-HNO3-15a-900b O2 Acetonitrile 229 155 1.5 4 - - - 17.7 49.6 18.7 13.4 9.4 8.9 Cyclohexane A K - - AA 6 CNTs-HNO3-0a O2 Acetone 127.8 125 1.5 8 0.30d 0.18d 0.12d 34.3 40.4e - - 52.4 [68] 7 CNTs-HNO3-0.5a O2 Acetone 130.8 125 1.5 8 0.52d 0.72d 0.33d 32.6 33.1e - - 48.5 8 CNTs-HNO3-4a O2 Acetone 136 125 1.5 8 0.66d 1.10d 0.55d 23.8 36.9e - - 47.5 9 CNTs-HNO3-8a O2 Acetone 149.4 125 1.5 8 0.59d 1.13d 0.97d 15.8 39.2e - - 46.7 10 CNTs-HNO3-8a-900b O2 Acetone - 125 1.5 8 - - - 22.4 32.6e - - 55.5 11 CNTs-HNO3-8a-1100b O2 Acetone - 125 1.5 8 - - - 25.8 33.5e - - 47.7 Cyclohexene Cy-one Cy-ol Cy-HP Ep-Cy Cy-diol 12 N-CNTs-HNO3-0a O2 Acetonitrile 88.3 80 1 4 0.26d 0.19d 0.10d 59.0 41.1 11.2 27.3 5.9 1.3 [73] 13 N-CNTs-HNO3-0.5a O2 Acetonitrile 153.9 80 1 4 0.47d 0.69d 0.34d 52.6 31.6 9 31.1 5.0 0.7 14 N-CNTs-HNO3-4a O2 Acetonitrile 176.8 80 1 4 0.73d 1.15d 0.65d 44.9 32.1 8.1 45.5 4.8 1.5 15 N-CNTs-HNO3-7a O2 Acetonitrile 179.7 80 1 4 0.74d 1.22d 1.03d 35.6 30 7.8 43.1 4.6 1.5 16 N-CNTs-HNO3-7a-900b O2 Acetonitrile 207.1 80 1 4 - - - 52.1 34.2 7.3 36.2 6.1 1.6 17 N-CNTs-HNO3-7a-1100b O2 Acetonitrile 248.7 80 1 4 - - - 55.6 36.8 6.6 37.8 5.8 1.6 Cumene - - CHP - - 18 CNTs-HNO3-2a O2 - 104.2 80 0.1 8 4.3c 7.3c 4.9c 1.2 - - 91.1 - - [43] 19 CNTs-HNO3-4a O2 - 116 80 0.1 8 13.3c 5.9c 5.2c 0.8 - - 90.2 - - 20 CNTs-HNO3-2a-600b O2 - 122.3 80 0.1 8 - - - 13.1 - - 88.0 - - 21 CNTs-HNO3-2a-900b O2 - 141.5 80 0.1 8 - - - 21.6 - - 86.0 - - α-pinene V-one V-ol V-HP α-p-O - 22 N-CNTs-HNO3-0a-60b O2 Acetonitrile 88.3 80 1.5 4 0.26c 0.19c 0.10c 54.5 14.2 17.5 15.3 37.8 - [82] 23 N-CNTs-HNO3-7a-60b O2 Acetonitrile 179.7 80 1.5 4 0.74c 1.22c 1.03c 51.0 17.1 13.8 16.4 40.6 - 24 N-CNTs-HNO3-7a-900b O2 Acetonitrile 207.1 80 1.5 4 - - - 61.4 18.7 13.4 15.9 41.1 - a Refluxed time (h) in HNO3. b Annealed temperature (°C) of oxygenated CNTs. c Data collected using XPS analysis (%). d Data collected using Boehm titration (mmol g−1). e KA oil (Mixture of cyclohexanone and cyclohexanol). Table 3 Comparison of the catalytic activities of CNTs with those of metal-functionalized CNTs. Table 3 Entry Catalyst MetalContent (wt%) BET(m2 g−1) Oxidant Solvent T(oC) P(MPa) t(h) Substrate conversion (%) rw a (mmol g−1 h−1) rs b (mmol m−2 h−1) Product selectivity (%) Ref. Cyclohexane K A CHHP AA - 1 CNTs 5.3 34.8 O2 Acetone 125 1.5 8 19.1 - 4.58 17.7 24.6 - 46.3 - [110] 2 Fe-filled CNTs 12.3 34.9 O2 Acetone 125 1.5 8 25.2 - 5.05 11 19.3 - 58.6 - 3 Fe-filled CNTs 19 32.7 O2 Acetone 125 1.5 8 36.7 - 9.24 9.9 19.1 - 60.5 - 4 Fe-filled CNTs 19.7 26.9 O2 Acetone 125 1.5 8 14.7 - 3.45 17.1 21.3 - 49.1 - 5 SWCNTs - - O2 - 150 1 6 11.63 - - 82.54 c - - - [117] 6 SWCNTs/Pd - - O2 - 150 1 6 22.86 - - 93.27 c - - - 7 SWCNTs/Pt - - O2 - 150 1 6 20.70 - - 95.17 c - - - Ethylbenzene AcPO PEA PEHP BA BzA 8 CNTs 0 145.6 O2 - 150 2 3 13.3 252.36 1.73 14.7 16.6 67.8 - - [111] 9 Co@C/CNTs 10 156.19 O2 - 150 2 3 51.7 912.64 5.84 79.6 14.8 0.5 - - 10 Co@C/SiO2 - 26.73 O2 - 150 2 3 14.7 276.45 10.34 26.2 12.7 60.2 - - 11 Co@C/Al2O3 - 124.79 O2 - 150 2 3 11.3 214.92 1.72 19.0 13.4 66.8 - - 12 Co@C/AC - 278.01 O2 - 150 2 3 11.5 218.33 0.79 18.8 23.4 56.8 - - 13 Fe@CNTs 12.8 30.1 O2 Acetonitrile 155 1.5 3 31.8 - 0.16 59.8 5.4 0.8 11.8 22.7 [112] 14 Fe@CNTs 17.3 25.9 O2 Acetonitrile 155 1.5 3 36.8 - 0.25 60.2 5.9 0.6 12.2 21.1 15 Fe@CNTs 21.8 18.5 O2 Acetonitrile 155 1.5 3 25.2 - 0.18 53.5 11.2 5.9 12.9 16.5 16 Fe@CNTs (6th cycle) 16.9 - O2 Acetonitrile 155 1.5 3 36.7 - 0.69 59.5 7.8 0.2 9.8 22.7 17 Co - - O2 - 120 0.8 5 22.3 - - 80.9 17 - 2.1 - [58] 18 CNTs - O2 - 120 0.8 5 12.7 - - 87.4 12 - 0.6 - 19 Co@N-CNTs - 232 O2 - 120 0.8 5 68.1 - - 93.2 6.8 - - - 20 Fe/CNTs - - O2 - 120 0.8 5 16.2 - - 72.8 24.8 - 2.4 - 21 Ni/CNTs - - O2 - 120 0.8 5 12.4 - - 83 17 - - - 22 Co/C - - O2 - 120 0.8 5 49.7 - - 84.7 14.8 - 0.5 - 23 Co@N-CNTs 220 O2 - 120 0.8 5 65.9 - - 92.2 - - - - [128] 24 MWCNT-COOH - - O2 - 80 0.1 6 6 - - 65 17 - 18 - [114] 25 MWCNT-COO-Co - - O2 - 80 0.1 6 18 - - 69 30 - 1 - 26 MWCNT-COO-Cu - - O2 - 80 0.1 6 27 - - 66 28 - 6 - 27 MWCNT-COO-Mn - - O2 - 80 0.1 6 13 - - 66 27 - 7 - 28 MWCNTs - - O2 - 80 0.1 6 6.3 - - 3.9 4.9 91.2 - - [83] 29 MWCNT-COOH - 105.03 O2 - 80 0.1 6 4.7 - - - 27.3 72.7 - - 30 MWCNT-COO-Cu - 114.2 O2 - 80 0.1 6 26.3 - - 60.7 13.4 24.6 1.2 - 31 MWCNT-COO-Cu@ 2([emim][OcOSO3]) - - O2 - 80 0.1 6 10.9 - - 74.4 20.2 4.5 1 - 32 MWCNT-COO-Cu@ 2([emim][OcOSO3])+NHPI - 4.85 O2 - 80 0.1 6 26.6 - - 72.7 14.8 9.4 3.1 - Toluene - BAL - BA BzA 33 Co@N/Co-CNTs - 419 O2 - 140 3 15 28 - - - 0.2 - 9.8 90 [141] 34 Co@N/Co-CNTs - 419 O2 - 140 3 24 33.5 - - - - - - 91.6 35 CNTs - 341 O2 - 90 15 d 12 0.65 - - - 41.56 - 58.44 - [115] 36 Mn3O4 - - O2 - 90 15 d 12 3.54 - - - 40.47 - 58.51 - 37 Mn3O4/CNTs - 269 O2 - 90 15 d 12 24.63 - - - 43.51 - 46.98 - Cumene - - AcPO PP CHP - - 38 CNTs - 166.59 O2 - 80 25 d 7 26.8 - - 2.32 17.68 80 - - [145] 39 MnO2/CNTs - 222.29 O2 - 80 25 d 7 73.44 - - 30.63 59.06 10.3 - - 40 MnO2/CNTs (5th cycle) - - O2 - 80 25 d 7 62.55 - - 6.58 39.62 53.79 - - a Initial rate of substrate consumption per gram of catalyst. b Initial rate of substrate consumption per m2 of catalyst surface. c KA oil (Mixture of cyclohexanone and cyclohexanol). d Oxygen flowrate in mL min-1. Carbon nanotubes as advanced catalysts and catalytic supports for the liquid-phase aerobic oxidation of hydrocarbons: A review Shakir Ul Azam ⁎ Orlinska Beata Orlińska Department of Chemical Organic Technology and Petrochemistry, Silesian University of Technology, 44–100 Gliwice, Poland Department of Chemical Organic Technology and Petrochemistry, Silesian University of Technology Gliwice 44–100 Poland Department of Chemical Organic Technology and Petrochemistry, Silesian University of Technology, 44–100 Gliwice ⁎ Corresponding author. The liquid-phase aerobic oxidation of hydrocarbons to more valuable oxygenized compounds is among the most crucial industrial processes. Traditionally, these processes were executed by using a stoichiometric amount of various toxic oxidants with homogeneous catalysts of transition-metal salts and complexes, which results in the production of a gigantic amount of corrosive and noxious waste. Recently, carbon nanotubes have gained momentous importance as catalysts and catalytic support in various chemical processes because of their unprecedented properties. Few researchers have actually employed carbon nanotubes and functionalized carbon nanotubes as catalysts and catalytic support for the liquid-phase aerobic oxidation of hydrocarbons. This review specifically focused on the use of carbon nanotubes and functionalized carbon nanotubes as catalysts and catalytic supports in the liquid-phase aerobic oxidation of hydrocarbons. A plausible mechanism of the reaction has also been drawn while thoroughly reviewing the previously reported data. The impact of impurities in carbon nanotubes on their catalytic activity for the liquid-phase aerobic oxidation of hydrocarbons has also been discussed. It is observed from the literature that oxygenated carbon nanotubes have a negative effect on their catalytic activity for the liquid-phase aerobic oxidation of hydrocarbons, while nitrogen doping and/or metal nanoparticle immobilization, the surface electron transfer between the modified carbon nanotubes and radicals enhanced and improved the catalytic activity. Furthermore, the nitrogen-doped and/or metal-nanoparticle-incorporated carbon nanotubes accelerate the decomposition of hydroperoxides, which are key intermediates in the liquid-phase aerobic oxidation of hydrocarbons, thereby improving the overall catalytic activity. Graphical Abstract ga1 Abbreviations CNTs Carbon nanotubes SWCNTs Single-walled carbon nanotubes MWCNTs Multiwalled carbon nanotubes N-CNTs Nitrogen doped CNTs P-CNTs phosphorus doped CNTs CVD Chemical vapor deposition TBHP Tert-butyl hydroperoxide NHPI N-hydroxyphthalimide AIBN Azobisisobutyronitrile AcPO Acetophenone PEA 1-phenylethyl alcohol PEHP 1-phenylethyl hydroperoxide BA Benzaldehyde BzA Benzoic acid, AA, Adipic acid K Cyclohexanone A Cyclohexanol CHHP Cyclohexyl hydroperoxide HHA hydroxyl hexylic acid Cy-one 2-cyclohexen-1-one Cy-ol 2-cyclohexen-1-ol Cy-HP Cyclohexenyl hydroperoxide Ep-Cy Epoxycyclohexane Cy-diol 1,2-cyclohexanediol BP 2-benzyl-2-propanol CHP Cumene hydroperoxide V-one Verbenone, V-ol, Verbenol V-HP Verbenyl-hydroperoxide α-p-O α-pinene oxide BAL Benzyl Alcohol, PP, 2-phenyl-2-propanol IL Ionic liquid [emim][OcOSO3] 1-ethyl-3-methylimidazolium octylsulfate SCILL Solid catalyst with an ionic liquid layer SILP Supported ionic liquid phase Keywords Carbon nanotubes Metal-free catalysts Heterogeneous catalysts Hydrocarbon oxidations Liquid-phase aerobic oxidation Data availability Data will be made available on request. 1 Introduction The production of higher-valued oxygenated compounds, for example, hydroperoxides, ketones, alcohols, aldehydes, carboxylic acids, and epoxides, by selective oxidation of hydrocarbons, is one of the most essential industrial processes [1]. Toluene, ethylbenzene, and p-xylene, for instance, oxidize to their respective oxygenated products at the rates of around 9 × 104, 5 × 106, and 3 × 107 tons per year, respectively [2]. The oxidation-based products from hydrocarbon oxidation can later be used in the production of adhesives, cosmetics, paints, rubber, fabrics, detergents, and agrochemicals [3]. Transition-metal salts and complexes [4,5] have been employed as catalysts in these processes, however, the conditions required are harsh and have poor selectivity. Furthermore, caustic promoters such as bromide anions were sometimes also used in addition to the catalyst. These techniques also have several drawbacks, such as the difficulty in separating homogeneous catalysts and the fact that the catalysts are nonreusable and the processes produce huge amounts of waste. Traditional toxic metal oxides [6], peroxides such as tert-butylhydroperoxide [7] or hydrogen peroxide [8,9], and ozone [10] are used as an oxidant in the oxidation processes. However, molecular oxygen is an atom-economical and greener alternative compared to these oxidants [11]. In addition, organic solvents are also often introduced into reaction systems, which pose major challenges with product separation and catalyst recovery, as well as substantially increasing the cost [12–15]. Consequently, a more economical, environmentally friendly, and effective heterogeneous catalytic system using dioxygen as an oxidant is desired without the use of toxic solvents. In recent times, carbon nanotubes (CNTs) have emerged as a promising substitute to traditional catalysts and catalytic supports owing to their remarkable properties, for example, elevated chemical, thermal and mechanical stability, high specific surface area, excellent electrical conductivity, tunable metal-support interaction, tunable chemical functionality (such as nitrogen or boron doped), corrosion resistance, economical, and environmental friendliness [16–18]. CNTs are a one-dimensional material and an allotropic form of carbon that exhibits sp2 hybridization. They differ from other allotropes of carbon, such as two-dimensional graphene and three-dimensional fullerenes and buckyballs, in both structural configuration and properties. CNTs are rolled-up sheets of graphene and can vary in size and structure by the number of graphene sheets on their side walls. Therefore, CNTs can be single-walled (SWCNTs) consisting of a single graphene nanotube or multiwalled (MWCNTs) consisting of several concentric interlinked graphene nanotubes ( Fig. 1) and can have a length-to-diameter ratio greater than 1000,00 [19]. The catalytic activity of pristine and functionalized CNTs has been extensively studied for various reactions including wet air oxidation [20–23], oxidative dehydrogenation [24–26], decomposition [27–30], Friedel-Crafts [31,32], Fischer-Tropsch [33–35], dehydrogenation [36,37], and oxidation of alcohols [38–41] and hydrocarbons [42–46]. Several review articles have focused on the synthesis of CNTs [47–49], functionalization and their catalytic activity [16,50,51], but to date, none of the reviews specifically focused on solvent and/or solvent-free aerobic oxidation of hydrocarbons catalyzed by CNTs and modified CNTs. This review will spotlight the mechanism and catalytic activity of pristine and functionalized CNTs for the liquid-phase solvent and/or solvent-free oxidation of hydrocarbons while focusing on the green oxidation reactions where molecular oxygen has been used as an oxidant. 2 Reaction mechanism 2.1 General reaction mechanism The liquid-phase aerobic oxidation of hydrocarbons involved a radical chain reaction mechanism and followed the following reactions from 1 to 9 [4,52,53]. (1) Initiation : RH + initiator → R • + H − initiator (2) Propagation : R • + O 2 → ROO • (3) ROO • + RH → ROOH + R • (4) ROOH → RO • + OH • (5) RO • + RH → ROH + R • (6) • OH + RH → H 2 O + R • (7) Termination : ROO • + ROO • → ROH + R ′ = O + O 2 (8) ROO • + R • → ROOR (9) R • + R • → R − R The variable valence metal catalysts, for example, iron, copper, cobalt, and manganese, promote the oxidation reactions by accelerating the homolytic decomposition of hydroperoxides into radicals that initiate the chain reactions (10 and 11) [4]. (10) ROOH + Co II → RO • + Co III + HO − (11) ROOH + Co III → ROO • + Co II + H + (12) Net Reaction : ROOH → Co II / Co III RO • + ROO • + H 2 O 2.2 Reaction mechanism over CNTs The aerobic oxidation of hydrocarbons in the liquid phase, for example, ethylbenzene over CNTs as a catalyst produces 1-phenylethyl hydroperoxide (PEHP), acetophenone (AcPO), 1-phenylethyl alcohol (PEA), benzaldehyde (BA), and benzoic acid (BzA) ( Scheme 1). Hydrocarbon oxidation in the presence of oxygen as an oxidant, induced a free radical chain reaction mechanism [54–57], as did ethylbenzene [42,58–61]. The plausible reaction mechanism for the liquid-phase aerobic oxidation of ethylbenzene using CNTs as a catalyst in the presence of dioxygen as an oxidant has been developed and presented in Scheme 2. Initially, ethylbenzene was adsorbed on CNTs' surface and possibly activated by weakening the α-C-H bond in ethylbenzene due to the π-π interaction among CNTs and ethylbenzene. Subsequently, a nearby adsorbed O2 molecule abstracts a weakly bounded α-H atom in ethylbenzene, producing the phenylethyl radical (PE) and the HOO• radical [42]. Some data from the literature suggested that oxygen is involved in oxidation reactions in a simple molecular form (O2) [2,42,62], while others implied that it gets an electron to form the superoxide radical anion (•O2 -) with the help of CNTs [58,63]. In this mechanism, molecular oxygen is considered in the reaction, so in the next step, the produced PE reacts quickly with nearby O2 to produce the 1-phenylethylperoxyl radical (PEPO). PEPO can abstract a hydrogen atom from the α-H bond of ethylbenzene, producing 1-phenylethyl hydroperoxide and PE, where 1-phenylethyl hydroperoxide is the key intermediate in ethylbenzene oxidation and the main chain propagator [42]. This is a cyclic process according to Lin et al. [58], as illustrated in Scheme 2, as the produced PE reacts again with O2 and produces PEPO, and the cycle continues. According to Luo et al. [42] in the next step, PEPO removes the weak α-H atom of 1-phenylethyl hydroperoxide due to the greater reactivity of the C-H bond in 1-phenylethyl hydroperoxide than the secondary C-H bond of ethylbenzene. At the same time, 1-phenylethyl hydroperoxide rapidly converts to acetophenone via the production of hydroxyl radicals (•OH) on CNTs. The produced •OH radicals can abstract the α-H atom of adjacent ethylbenzene and produce fresh PE, which can then be combined with O2 to produce PEPO. PEPO interacts quickly with nearby 1-phenylethyl hydroperoxide again, producing acetophenone and the •OH radical, and the cycle repeats. 1-phenylethyl hydroperoxide can also react with PE, producing 1-phenylethyl alcohol and 1-phenylethyloxy radical (PEO). Benzaldehyde is formed due to subsequent cleavage of β-C-C in PEO and benzaldehyde can further react with O2 to produce benzoic acid [64,65]. 3 Pristine CNTs as metal-free catalysts Pristine CNTs, both SWCNTs, and MWCNTs have proven to be intensely active, selective, and robust metal-free catalysts for hydrocarbon oxidation reactions. CNTs play a vital role in hydrocarbon oxidation reactions via propagating radical chain reactions. CNTs can efficiently promote the reaction flux in solvent cages, leading to increased efficiency in the formation of ketone and alcohol products. CNTs can facilitate electron transfer among radicals and themselves at the solid-liquid interface, augmenting the efficiency of the cage reaction [66]. Studies revealed that sp2 carbons such as graphene and CNTs exhibited superior catalytic activity compared to sp3 carbons (diamond). The superior activity of sp2 carbons was attributed to their capability to catalyze the decomposition of intermediate peroxides, which ultimately enhanced hydrocarbon oxidation reactions [67]. Electron transfer in graphene sheets is a crucial factor in determining the catalytic activity of CNTs in the liquid phase oxidation of hydrocarbons. In pristine CNTs, the delocalized electrons on the surface of graphene sheets facilitate a π-π interaction among radicals and peroxides with themselves [68] and therefore accelerate the decomposition of intermediate peroxides into free radicals. For example, Luo et al. [42] demonstrated that CNTs exhibited an exceptional metal-free catalyst in the liquid phase selective oxidation of ethylbenzene to acetophenone employing dioxygen as an oxidant. Their results indicated that the decomposition of 1-phenylethyl hydroperoxide to acetophenone was facilitated by π-π interactions among peroxide radicals and graphene layers of CNTs. The conversion of ethylbenzene was 38.2% with a selectivity of 60.9% to acetophenone. The activity was comparable to that of other metal-based catalysts under the same conditions. Furthermore, the CNTs were found to be recyclable and retained their activity for all six cycles without any changes in morphology. In a later study, researchers explored the use of commercial-grade CNTs as a catalyst for low-temperature aerobic oxidation of cumene [43]. After optimizing the reaction conditions, they achieved an impressive conversion of cumene (24.1%) with a selectivity of 88.4% for cumene hydroperoxide (CHP). Their finding suggested that the elevated activity of the CNTs was attributed to the delocalized electrons on graphene sheets of CNTs and their capability to catalyze the intermediate cumene hydroperoxide to free radicals. To test the recyclability of CNTs, they separated the CNTs after each run from the reaction mixture and washed them repeatedly with deionized water and ethanol. The results showed that cumene conversion and cumene hydroperoxide selectivity remained consistent over five cycles, indicating that the CNTs were stable and recyclable. The catalytic activities of pristine CNTs have been compared with functionalized CNTs and metal-based catalysts in Table 1. 4 Functionalized CNTs as catalysts and catalytic supports 4.1 Heteroatom-doped CNTs as metal-free catalysts The surface chemistry of CNTs plays a crucial role in many chemical reactions, including hydrocarbon oxidation reactions. The electrical properties of CNTs can be modified and enhanced via heteroatom doping, such as oxygen, nitrogen, phosphorus, sulfur, or boron, which can change their catalytic activity. Doping heteroatoms, for example, nitrogen in CNTs improves the interaction between intermediate radicals and surface carbon, which enhances their catalytic performance [66,69–71]. Furthermore, nitrogen (N) doping can also accelerate the decomposition of intermediate peroxides, ultimately enhancing the catalytic activity [44,72,73]. For instance, Gao et al. concluded that nitrogen incorporated into sp2-hybridized carbon was a crucial factor for the activation of the C-H bond in the reaction. Doped nitrogen did not contribute to the reactant activation; rather, it altered the electronic structure of the neighboring carbon atoms and enhanced their reactivity. This was the major factor that the N-dopant catalyst performed quite well in the oxidation reactions. Furthermore, an increase in the amount of nitrogen at the graphitic sites of the catalysts was noted to increase subsequent catalytic performance [74]. Yu et al. [68] reported the remarkable performance of MWCNTs and nitrogen-doped CNTs (N-CNTs) in the liquid phase aerobic oxidation of cyclohexane. Notably, their results showed that the activity of CNTs synthesized via the chemical vapor deposition (CVD) method was superior even without post-treatment, resulting in a reduction of the practical catalyst cost. The cyclohexane conversion was 34.3% with 52.4% selectivity towards adipic acid. N-CNTs were prepared using the CVD method with aniline as the source of nitrogen and carbon. The nitrogen content and proportion of pyridinic nitrogen increased during the formation of N-CNTs in an ammonia atmosphere, which may have contributed to the enhanced catalytic performance. The produced N-CNTs had a nitrogen-to-carbon ratio of 4.5% after being purified with HCl, and their shape resembled bamboo nanofilament. The BET surface area of the N-doped CNTs was 2–2.4 times greater than that of the undoped CNTs. The catalytic activities of the pristine CNTs and N-CNTs were assessed under the same reaction conditions. The N-CNTs displayed elevated catalytic activity with 45.3% cyclohexane conversion and were more selective toward adipic acid (59.7%) compared to pristine CNTs because the doped nitrogen facilitated electron transfer in the graphene sheet. The catalytic activity of the N-CNTs was higher than that of the metal-based catalysts even at a lower temperature (125 °C). Furthermore, the N-CNTs were recyclable and remained active for all five cycles. The comparison of the catalytic activities of heteroatom-doped CNTs with pristine CNTs and metal-based catalysts is made in Table 1. Cao et al. [44] studied the catalytic activity of CNTs doped with nitrogen (N), phosphorus (P), and boron (B) for the aerobic oxidation of cyclohexane in the liquid phase. All three heteroatom-doped CNTs were synthesized using the CVD method with xylene as the carbon source. Aniline-NH3, triphenylphosphine, and triethyl borate were used as precursors for N, P, and B, respectively. The N content of the synthesized N-CNTs ranged from 0% to 4.46%, while the P content of the synthesized P-CNTs ranged from 0.55% to 5.14%. The authors observed that N-CNTs and P-CNTs were active catalysts, while B-doped CNTs were not active catalysts for cyclohexane oxidation. The highest mass normalized activity was obtained for N-CNT (761 mmol g−2 h−1) for the N-CNTs produced aniline in an NH3 environment, while the highest surface area normalized activity was obtained for P-CNTs (28 mmol m−2 h−1) for the CNTs produced from triphenylphosphine in an argon atmosphere. The authors also studied the work function as an indicator of electron donation on carbon and observed that the specific activity of N- and P-doped CNTs relied exponentially on the work function. This suggests that surface electron transfer on CNTs plays a crucial role in cyclohexane oxidation. The catalytic activities of N-CNTs and P-CNTs were higher than some of the metal-based catalysts. Yang et al. [63] unveiled the interaction between radicals and CNTs in cyclohexane oxidation by utilizing in situ electron paramagnetic resonance (EPR). The authors technically confirmed the C6H11 •, C6H11OO•, and O2 • radicals for the first time. The efficient formation of active radicals at the preliminary stage of the reaction was observed over the N-doped MWCNTs, depicting that N-doped MWCNTs were much more effective catalysts than pristine MWCNTs. CNTs and N-CNTs have been studied as metal-free catalysts for the aerobic oxidation of cyclohexene in the liquid phase (80 °C, 1 MPa, 4 h). N-doped CNTs were produced by employing the CVD technique using aniline as the carbon source and xylene as the nitrogen source. N-doped CNTs exhibited exceptional performance for cyclohexane oxidation with 59% conversion and 620.1 mm g−1 h−1 mass-normalized activity. The rate of conversion of cyclohexene per gram of catalyst over N-CNTs was almost six times higher than pristine CNTs while competing with many state-of-the-art metal catalysts. The elevated catalytic performance of N-CNTs was attributed to their capability to promote chain propagation. Recyclability data showed that N-CNTs were stable and recyclable [73]. Liao et al. researched the use of CNTs and N-CNTs for the oxidation of cumene in the liquid phase employing dioxygen as an oxidant. They discovered that N-CNTs significantly accelerated the decomposition of cumene hydroperoxide, consequently increasing the cumene conversion with higher selectivities towards acetophenone and 2-benzyl-2-propanol. The cumene conversion over N-CNTs with 3.33 atom% of nitrogen was almost 4.6 times higher (74.7%) compared to pristine CNTs (16.1%) under similar reaction conditions (80 °C, 0.101 MPa, and 8 h). The nitrogen content in the N-CNTs was also studied by increasing the atom percent of nitrogen. The conversion of the N-CNTs increased as the nitrogen atom percent was increased up to 3.33 atom% above this loading the conversion decreased marking it as the optimal loading. The doping of nitrogen into the CNTs modified the surface electron structure, which finely tuned the reactivity and selectivity. Furthermore, N-CNTs were found to be recyclable for up to four cycles [62]. Mu et al. [75] performed a kinetic study on the utilization of CNTs and N-CNTs in the aerobic oxidation of cumene to investigate the impact of N-doping. The authors thoroughly analyzed the observed time-dependent concentration profiles, developed a kinetic model depending on the mechanism of radical reactions, and produced rate constants and activation energies for each elementary reaction involved in the oxidation process. When the kinetic properties of CNTs and N-CNTs were examined, N-CNTs significantly boosted all elementary reactions, particularly the breakdown of peroxides into active radicals such as RO• and HO•. Furthermore, N-CNTs increased the rate of cumene oxidation and improved the interaction between O2, RO•, RO2 •, and catalyst. Their study also showed that N-CNTs enhanced the production of ketones and alcohols with more alcohol obtained over N-CNTs compared to CNTs. Su et al. [76] researched the effect of N-CNTs dose on their catalytic performance for ethylbenzene aerobic oxidation (155 °C, 1.5 MPa, 4 h). N-CNT activity was increased at lower doses but decreased at higher levels. Mechanistic studies and DFT calculations indicated that doping N atoms into the CNTs impedes the concept of α-H from ethylbenzene molecules, which halts the preliminary radical propagation stage and reduces overall activity. Tert-butyl hydroperoxide (TBHP) was utilized as a dual oxidant to boost the catalytic activity of N-CNTs by eliminating the preliminary propagation stage. When TBHP was combined with O2 as an oxidant and a modest dose of N-CNTs, the maximum conversion (46%) was achieved with a selectivity of 72% to acetophenone. However, the authors believe that more investigation is required to properly understand the influence of N-CNTs on ethylbenzene oxidation. Nitrogen atoms that are linked to carbons can have different bonding configurations, for example, pyrrolic N, pyridinic N, graphitic N, and N-oxides species [77–79], as shown in Fig. 2. As a result, it is crucial to recognize the active sites of nitrogen-linked to carbons to better understand the catalytic processes that occur over them. For example, graphitic N-carbons are effective in the aerobic selective oxidation of benzylic alcohols under moderate conditions [80], whereas pyridinic N-carbons are suitable for cathodic oxygen reduction reactions under acidic conditions [81]. Fu et al. [46] studied the activity of N-CNTs to oxidize styrene employing tert-butyl hydroperoxide as an oxidant. They found that the oxidation reaction was enhanced when the N content in the N-CNTs was below 3.51%. However, for a higher N content, a decrease in activity was observed. Surprisingly, the catalytic activity was even worse with a N content increased up to 7.51% compared to the 0.98% N content in the CNTs. Through DFT calculations, the researchers discovered that graphitic N and pyrrolic N can have different functions. For example, graphitic N was an active site for the oxidation reaction of styrene, while pyrrolic N was more effective in producing active oxygen species (HOO•). Cao et al. studied the performance of CNTs and N-CNTs as metal-free catalysts for the epoxidation of α-pinene utilizing dioxygen as a terminal oxidant (80 °C, 1.5 MPa, 4 h). Epoxidation of α-pinene was significantly improved over CNTs with the highest epoxidation/allylic product ratio. The performance of N-CNTs was exceptional, showing 54.5% conversion of α-pinene and a normalized mass activity of 272.4 mmol g−1 h−1, comparable to metal catalysts. The conversion of α-pinene was almost 2.2 times higher than the pristine CNTs. The catalytic stability of N-CNTs was evaluated over five cycles. The N-CNTs were washed repeatedly with deionized water and acetone and then dried after each cycle. Recyclability data showed that N-CNTs were stable and recyclable, as no significant changes were observed for both conversion and product distributions [82]. 4.2 Oxygenated CNTs CNT surface structure has a considerable impact on oxidation reactions. The introduction of oxygen-containing functional groups onto the surface of CNTs, such as carboxyl group, phenol, ketone, ether, lactone, acid anhydride, and so on ( Fig. 3), enables research the effect of these groups on the catalytic activities of CNTs and CNTs-based catalysts in hydrocarbon oxidation processes. Recent research has demonstrated that functionalized CNTs containing oxygen-functional groups exhibit significant activity in the oxidative dehydrogenation of light alkanes [99,100] and ethylbenzene [101,102]. Other studies have postulated that ketonic functional groups (CO) and hydroxyl/quinone functional groups in CNTs could serve as active sites for hydrocarbon oxidative dehydrogenation processes [103,104]. However, because liquid-phase hydrocarbon oxidation processes are more complex than oxidative dehydrogenation reactions, the catalytic activity of CNTs functionalized with oxygen-containing functional groups remains equivocal. Yu et al. studied the activity of oxidized CNTs in the aerobic oxidation of cyclohexane and found that introducing oxygenated functional groups into CNTs negatively affects their catalytic activity. This decrease in activity could be attributed to electron localization caused by the incorporation of oxygenated groups in the CNTs. This localization of electrons is detrimental to the π-π interaction among radicals and graphene layers of oxidized CNTs, which hinders their catalytic performance [68]. Subsequent research studies also demonstrated that these oxygenated groups harmed the catalytic performance of aerobic oxidation of hydrocarbons such as ethylbenzene to acetophenone [42], cumene to cumene hydroperoxide [43] and cyclohexane to cyclohexanone [73]. Chi et al. examined the impact of surface defects and oxygen-containing functional groups on CNTs on the aerobic oxidation of cumene. The authors discovered that oxidized CNTs inhibited cumene oxidation by disclosing the associated mechanism. The oxygenated CNTs might operate as free radical quenchers, trapping the reaction's free radical intermediates, preventing the transfer of the free radical chain, and diminishing the reaction's overall performance. However, surface defects in CNTs are found to have less impact on their catalytic activity compared to functional groups containing oxygen [105]. Other reasons that make the oxygen-containing functional groups on CNTs unsuitable for aerobic oxidation of hydrocarbons in the liquid phase are, (i) the presence of these functional groups alters the surface wettability of the CNTs, rendering them more polar and hydrophilic. Consequently, they become unsuitable for hydrocarbon adsorptions, which are inherently nonpolar in nature [106,107]. (ii) These functional groups could increase diffusion resistance; as a result, the availability and affinity of CNTs surfaces are reduced for organic molecules [107–109]. Table 2 compares the catalytic activity of oxygenated CNTs for the liquid-phase aerobic oxidation of various hydrocarbons. It is observed that increasing the amount of different oxygen-containing functional groups on the surface of CNTs reduces their catalytic activity. However, annealing these oxygenated CNTs can decompose the oxygen-containing functional groups and repair the defects while restoring their catalytic activity. 4.3 Metal, metal oxides, and complex functionalized CNTs The catalytic activity of a catalyst in the liquid-phase hydrocarbon oxidation reactions is usually dominated by the surface electron transfer of the solid catalysts [44,110]. The catalytic performance of CNTs in hydrocarbon oxidation reactions can be further improved by improving electron transfer through the incorporation of metals, for example, Fe, Co, Mn, etc. [111–113]. Furthermore, metallic salts of Cu(II), Co(II), Mn(II) [114], metal oxides such as Mn3O4 [115], MnO2 [116], and metal complexes such as Pt and Pd pincer complexes [117], Mn (III) porphyrins [118], among others, can also be used to improve catalytic activity. These metals, metallic salts, metal oxides, and complexes can be incorporated with CNTs covalently or noncovalently. It is also known that these metals and metallic compounds in the hydrocarbon oxidation reaction accelerate the decomposition of hydroperoxides, which are the key intermediates in the hydrocarbon oxidation reactions, to alcohols and ketones, thereby increasing the catalytic activity [119–123]. Moreover, some research work reported that catalytic activity increased substantially due to the incorporation of metal nanoparticles within CNTs as shown in Fig. 4, so-called encapsulated or confined metal nanoparticles in CNTs [124,125] or bonding to carbons via metal-nitrogen-carbon (M-N-C) bond [113,126,127]. Further research suggested that there is a synergistic effect between metal nanoparticles and CNTs [58,128]. The catalytic activities of CNTs and N-CNTs with metal-modified CNTs have been tabulated in Table 3. The graphene layers in CNTs create nanochannels that range in diameter from less than one nanometer to one hundred nanometers. These unique channels provide a highly confined environment for catalytic reactions and nanocatalysts [129]. The confinement of metal nanoparticles in CNTs has already been recognized as an excellent catalyst in many reactions, including hydrocarbon oxidation reactions [130]. The enhancement in the catalytic performance was due to the confinement of metal nanocatalysts in the CNTs, leading to a unique interaction between metal and the CNTs, thanks to the deformed sp2 hybridization electronic configuration of graphene walls. This peculiarity from planarity causes a shift in π-electron density from the concave inner to the convex outer surface, consequently, an electron-deficient interior and an electron-enriched exterior while leaving the outer surface area unchanged [124]. Studies have revealed that increasing the mobility of electrons in CNTs improves their catalytic activity [68]. Taking into account the aforementioned strategy, Yang et al. [110] investigated the catalytic activity of confined iron (Fe) nanowires in CNTs for cyclohexane aerobic oxidation. Their Fe-filled CNTs have proved an effective catalyst in oxidation reactions with unprecedented performance for a 19.0 wt% loading of Fe. Above this loading surface defects were formed that hinder electron transfer and reduced the activity. Additionally, they studied the dependency of the specific activity of the oxidation reaction over the Fe encapsulated CNTs on the work function, which revealed that a decrease in work function exponentially increase the specific activity. Because of the confined Fe in CNTs, they exhibit high magnetic saturation, facilitating easy separation from the reaction mixture. Their recyclability experiment revealed that the Fe-filled CNTs were stable and could be recycled without loss in the activity. Luo et al. [112] also demonstrated that iron nanowire-filled CNTs (Fe@CNTs) as an active catalyst for the selective aerobic oxidation of ethylbenzene to acetophenone in the liquid phase. The augmented activity was due to the improved electron transfer that arose from the confinement of nanowires in the CNTs. An exceptional activity was obtained with 17.3 wt% of CNTs filled with Fe nanowires. However, with an increase in Fe content from 17.3 wt% to 21.8 wt%, activity was reduced, indicating that an increase in Fe loading in CNTs could create defects that reduce conductivity or an increase in the Fe@CNTs work function, suppressing charge transfer. Furthermore, their results indicated that Fe@CNTs accelerated the decomposition of hydroperoxides to acetophenone due to the improved electron transfer from Fe nanowires to CNTs, which ultimately enhanced the conversion rate. Fe@CNTs were effortlessly retrieved from the reaction system by simply employing an external magnet and reused. The results confirmed that Fe@CNTs were active and stable in all six cycles with no substantial loss in the catalytic activity. Researchers have indicated that encapsulated metal nanoparticles could accelerate the decomposition of hydroperoxides, which is a crucial intermediate product, into acetophenone and certainly contribute to a substantial improvement in catalyst performance by augmenting the electron transfer from metal nanoparticles to CNTs [111]. Furthermore, it has been observed that this electron transport in CNTs might result in a high electron density and a drop in local work functions on the carbon surface [110,112], therefore, accelerating hydroperoxides decomposition through π–π interaction among hydroperoxides and graphene sheets, thus improving the overall conversion rate. Shi et al. researched the catalytic activity of cobalt nanoparticles filled into CNTs as nanoreactors for styrene epoxidation utilizing dioxygen as an oxidant (100 °C, 0.101 MPa, 1 h). For comparison, they also adsorbed cobalt on the surface of the nanotubes ( Fig. 5) and tested the activity for the same reaction. The nanoreactors (Co@CNTs(in)) demonstrated remarkable catalytic performance in the epoxidation of styrene with a conversion rate of over 99% and an epoxide selectivity of 93% during a one-hour reaction. The product yield of the nanoreactors was 93%, compared to a yield of only 50% for Co adsorbed on CNTs surface ((Co@CNTs(out)). Additionally, they used an external magnet to separate the nanoreactors and recycled them for up to three cycles. Nanoreactors performed remarkably well throughout the cycles without diminishing their catalytic activity [131]. Cobalt encapsulated in graphitic N-doped CNT (Co@CGNs) has also been demonstrated to have efficient catalytic activity in the solvent-free aerobic oxidation of ethylbenzene ( Fig. 6). The optimized catalyst demonstrated remarkable activity, converting 68.1% of ethylbenzene with a selectivity of 93.2% acetophenone. Furthermore, the catalyst performed remarkably well in the oxidation of various arylalkane substrates. The increase in catalytic activity was credited to the synergistic effect between metallic Co and graphitic N-doped CNTs [58]. Xiang et al. investigated the effect of nitrogen doping on the catalytic activity of cobalt-encapsulated CNTs for the selective oxidation of arylalkanes. The synthesized catalyst achieved dramatic catalytic activity for ethylbenzene, displaying 78.3% conversion and 93.8% selectivity toward acetophenone. The catalyst also performed exceptionally well in the oxidation of other alkyl aromatic hydrocarbons. Their results showed that the nitrogen source is crucial for the growth of bamboo-shaped CNTs, and Co-Nx in Co@NCNTs-X were the active sites, owing to the synergetic effect between pyridinic N and metallic cobalt [128]. The enhanced catalytic activity of cobalt-encapsulated N-CNTs can be credited to the formation of a coordination structure between Co and pyridinic N (Co-Nx). This coordination structure stabilizes the cobalt nanoparticles and impedes their agglomeration, thereby facilitating their dispersion. Furthermore, the interaction of Co nanoparticles with the pyridinic N of N-CNTs alters the spin, charge, and π state densities of carbon atoms, activating additional carbon atoms and producing more active sites. Consequently, facilitate the adsorption and desorption of intermediates thereby improving the catalytic activity [132–135]. The reaction mechanism for ethylbenzene oxidation, catalyzed by CNTs and cobalt confined within CNTs (Co@CNTs), was elucidated through empirical and kinetic modeling. Co@CNTs showed higher activity in the oxidation reaction compared to pristine CNTs because of their enhanced interfacial charge transfer. The homolytic cleavage of phenylethyl hydroperoxide was discovered to be the rate-determining and fundamental step in the synthesis of acetophenone, which was augmented over Co@CNTs. The simulation results of ethylbenzene oxidation revealed that acetophenone production dominated the reaction route because the addition of acetophenone into the reaction system had very little effect on the reaction rate. While the inclusion of phenylethyl alcohol diminished the oxidation process, apparently due to the prevention of the generation of RO• and phenylethyl alcohol. This restricted hydroperoxide decomposition and reduced overall catalytic performance [136]. Alcohol additives impede the radical process of aerobic oxidation of hydrocarbons, as has been seen in other reactions, as alcohol quenches radicals and prevents their propagation [137–140]. Peckh et al. [114] studied the catalytic activity of transition metal salts of cobalt (Co(II)), copper (Cu(II)), and manganese (Mn(II)) on carboxylated MWCNTs for solvent-free aerobic oxidation of ethylbenzene. The cocatalyst was N-hydroxyphthalimide (NHPI), while the radical initiator was azobisisobutyronitrile (AIBN). The Cu(II) immobilized carboxylated MWCNTs exhibited the highest activity (27% conversion to ethylbenzene, 66% selectivity toward acetophenone) compared to those Co(II) and Mn(II) functionalized CNTs. Chen et al. synthesized a Co@N/Co-CNT catalyst for the liquid phase solvent-free selective aerobic oxidation of toluene to benzoic acid. The catalyst consisted of cobalt-encapsulated and atomically scattered CoN4 species inserted in N-CNTs. The catalyst performed remarkably with 33.5% toluene conversion and 91.6% selectivity toward benzoic acid. Reactions were performed without the addition of a radical initiator, while CoN4 species were recognized as active sites in the catalyst [141]. Machado et al. incorporated Pt and Pd pincer complexes on superparamagnetic CNTs and investigated their catalytic activity for solvent-free aerobic oxidation of cyclohexane. The Pt and Pd pincer complexes were covalently immobilized on magnetic SWCNTs functionalized with NH2. Maximum catalytic activity was obtained for the Pd pincer complex-based catalyst with 22.86% conversion and 93.3% selectivity [117]. The catalytic activity of transition metal oxides (TMOs), for example, MnO2, Fe2O3, Cr2O3 [123], MnCO3 [142], Mn3O4 [143,144], and MnO2 [116], has been investigated for liquid oxidation processes. Their variable valence electron pair contributes to their elevated catalytic activity and reducibility. Feng et al. immobilized Mn3O4 nanoparticles in CNTs and investigated their activity for the oxidation of toluene to benzyl alcohol and benzaldehyde in solvent free environment while using dioxygen as an oxidant, and tert-butyl hydroperoxide radical initiator. Their results showed that the immobilized Mn3O4 nanoparticles in the CNTs performed quite well with 24.63% toluene conversion and 90.49% selectivity towards benzyl alcohol and benzaldehyde. The activity was higher compared to both Mn3O4 and CNTs. Furthermore, the catalyst was stable and recyclable [115]. Deng et al. used CNTs as a support for MnO2 nanoparticles to combine the synergistic effect of CNTs and metal oxides for the aerobic oxidation of cumene. A conversion of 73.44% for cumene was achieved with a 59.06% selectivity towards 2-phenyl-2-propanol (PP) using 21.23-MnO2/CNTs. This is considerably greater than the catalytic activity obtained for CNTs and MnO2 separately. The introduction of MnO2 nanoparticles in CNTs improved the decomposition of cumene hydroperoxide, which was further confirmed by DFT calculations [145]. It has been elucidated from the literature that the oxygen-containing functional groups in CNTs harm their catalytic activity due to the localization of electrons following the introduction of oxygenated functional groups and defects [68,73,105]. Nevertheless, the evidence for the high catalytic activity of TMOs immobilized on CNTs could be endorsed by the specific interaction among the nanoparticles of metal oxides and CNTs. Recently, we functionalized industrial-grade carboxylated multiwalled CNTs (IGMWCNT-COOH) with copper(II) ions. Cu(II) functionalized CNTs (IGMWCNT-COO-Cu) were then coated with a mixture of N-hydroxyphthalimide (NHPI) and ionic liquid (IL) 1-ethyl-3-methylimidazolium octylsulfate ([emim][OcOSO3]). The resultant catalyst was a blend of the solid catalyst with an ionic liquid layer (SCILL) and a supported ionic liquid phase (SILP) catalytic system. Hence, it was termed a SCILL-SILP hybrid catalytic system. The SCILL system was also synthesized by coating the [emim][OcOSO3] on IGMWCNT-COO-Cu. The catalytic activities of the produced systems were explored for the liquid-phase aerobic oxidation of ethylbenzene. For comparison, oxidation reactions were also performed for MWCNTs, IGMWCNT-COOH, and IGMWCNT-COO-Cu. The catalytic activity of IGMWCNT-COOH was lower than that of MWCNTs due to the presence of the carboxyl group, which harms the catalytic performance of CNTs in the reaction. After Cu(II) functionalization, the catalytic activity of industrial-grade carboxylated MWCNTs increased dramatically to 26.3% with NHPI as a co-catalyst. The increase in the catalytic activity of IGMWCNT-COO-Cu was credited to the metal ions, which accelerated the decomposition of hydroperoxides. The coating of ionic liquid over the IGMWCNT-COO-Cu, as in the SCILL system, covered the active sites and dramatically reduced the activity due to the high viscosity of the IL, which hampered radical production. The SCILL-SILP hybrid catalyst showed remarkable performance with a 27% conversion of ethylbenzene and 77% acetophenone selectivity. The higher selectivity towards acetophenone could be attributed to the solvent cage effect in the ionic liquid [83]. 5 Effect of CNTs purity on liquid phase oxidation of hydrocarbons Typical CNTs synthesis procedures yield randomly oriented, closed-ended structures, and the majority of these processes require high temperatures (>700 °C), resulting in considerable impurities in the final product [146]. These impurities affect the catalytic activity of CNTs. As a result, these impurities must be evaluated and removed or reduced from the produced CNTs. The influence of impurities of CNTs on the aerobic oxidation of hydrocarbons in the liquid phase was investigated by Zeynalov et al. [45]. The researchers synthesized MWCNTs using thermal pyrolysis of cyclohexane and examined their catalytic activity for cumene oxidation. The presence of metallic compounds within the structure of MWCNTs is responsible for stimulating the oxidation process, as determined through kinetic analysis. These metallic impurities were the residues of metal catalysts employed during the synthesis. These metals are typically converted into metal carbides, which are difficult to remove by employing mineral acids treatment. Consequently, due to the presence of these impurities in the MWCNTs, parallel reactions could occur according to the authors, with two processes occurring at the same time, MWCNTs + R• (RO2 •) → •MWCNTs-R (RO2) and ROOH + M@MWCNTs → RO• radicals (RO2 •). The branching of chain processes implies hydroperoxides inhibit alkyl and peroxide radicals from attaching to the carbon cage structure of CNTs, resulting in an autocatalytic mode of reaction. The aerobic oxidation of hydrocarbons in the liquid phase is extremely sensitive; even a trace amount of contaminant can prevent radical production or act as a free radical quencher and/or accelerate the oxidation process. For example, a modicum of Zn compounds (ZnCl2 and ZnBr2) completely inhibited cumene oxidation (10 mL cumene, 25 mL min−1 O2, 80 °C, 8 h.) catalyzed by CNTs (100 mg) [147]. Zn2+ inhibited catalytic oxidation in two possible ways, according to the mechanistic investigation. Initially, Zn2+ may strongly coordinate reactive oxygen species triggered by CNTs, raising the reaction's energy barrier. Next, the interaction between Zn2+ and radicals (RO• and ROO•) hinders the propagation events of the free radical chain. Conversely, the oxidation of cumene (80 °C, 8 h) was accelerated by utilizing a trace amount of Cu(OAc)2 (1 ppm of CNTs) in the presence of CNTs (100 mg) as a catalyst and oxygen as an oxidant (25 mL min−1) [148]. Cumene conversion increased from 38.5% to 54.2%, and alcohol selectivity increased from 25.1% to 44.7%, demonstrating that small amounts of Cu(OAc)2 could considerably alter the CNTs' reactivity and product selectivity. The promising effect was caused by the presence of adsorbed chlorine (Cl) on the surface of CNTs, which was adsorbed during the HCl washing process. Before using CNTs, HCl washing is a popular pretreatment technique. During the oxidation reaction, the adsorbed Cl on the CNTs surface became extremely unstable and reacted with Cu(OAc)2 to generate the Cu-Cl component, accelerating the decomposition of peroxides and modifying the activity and selectivity of the reaction. There are various recommended procedures for purifying CNTs, but acid treatment is widely accepted [149–151]. In this purification method, CNTs are oxidized with concentrated acids such as HNO3 or HNO3-H2SO4. The main drawbacks of this approach are that it frequently opens the ends of the nanotubes, cuts CNTs, damages a surface structure, and inserts oxygenated functional groups (-OH, -COOH, and -CO) into CNTs [152]. As stated above, these oxygenated functional groups have a deleterious impact on the catalytic activity of CNTs in the aerobic oxidation of hydrocarbons. 6 Prospects of CNTs in catalysis for hydrocarbon oxidation Pristine CNTs have shown remarkable performance in catalysis, including hydrocarbon oxidation reactions because of their unprecedented properties. Thanks to their elevated conductivity, which facilitates the electron transfer between radicals and themselves at the solid-liquid interface and enhances the rate of the reaction. The CNTs' conductivity can be further improved by doping a heteroatom such as nitrogen. The N-doping of CNTs can further accelerate the electron transfer between the intermediate radicals and surface carbon, thereby significantly enhancing the catalytic activity. The N-CNTs also accelerate the decomposition of peroxides, which are the key intermediates in hydrocarbon oxidation reactions, again increasing the catalytic performance. From the literature data, it can be deduced that a certain optimal loading of N in the CNTs increases the catalytic activity, and above that threshold limit the catalytic activity decreased. The type of doped N can also affect the catalytic function of the CNTs; for example, graphitic N is more effective for styrene oxidation, while pyrrolic N is more effective in producing active oxygen species. Nevertheless, N doping boosts the electrical properties of the CNTs, which is among the crucial factors that augment the catalytic activity of the CNTs, but still, at a higher amount of N in the CNTs, the catalytic activity decreases, which needs to be elaborated. Furthermore, the impact of the type of N doping in CNTs on their catalytic activity for oxidation reactions needs to be elaborated. The activity of other heteroatoms, for example, boron, phosphorus, etc., doped CNTs is also unexplored in hydrocarbon oxidation reactions. The surface functionalization of CNTs by the incorporation of various functional groups is another opportunity to modify the surface properties of CNTs to enhance the hydrophilicity or hydrophobicity. Attached surface functional groups can host other active catalysts or nanoparticles. The catalytic performance of the surface oxygenated groups for the hydrocarbon oxidation reactions is still ambiguous. The mechanism and negative catalytic activity of surface oxygenated functional groups for the liquid-phase hydrocarbon oxidation reactions need to be explored. Furthermore, various transition-metal-based catalysts, metal oxides, and other active catalysts can be linked with the surface functional groups and applied for liquid-phase hydrocarbon oxidation reactions in order to explore more effective catalysts. The elevated surface area and nanochannels of the CNTs provide another opportunity to tailor the catalytic properties. This is again an unexplored area in the liquid-phase aerobic hydrocarbon oxidation reactions. The high surface area has the capability to provide excellent support for other active catalysts. The nanochannels can encapsulate nanoparticles or other active catalysts. Thanks to the remarkable corrosion-resistant properties of CNTs which can protect the encapsulated metal nanocatalysts. Additionally, the use of confined metal nanoparticles in the CNTs as a catalyst will disperse homogenously in the reaction mixture without agglomerating, which ultimately enhances the catalytic activity. Furthermore, it is possible to combine the incredible properties of CNTs and the active catalyst to impart a synergistic effect to the resultant catalytic system. In our latest work [83], we have utilized Cu(II) modified CNTs as a catalyst and catalytic support for IL (SCILL system) and a mixture of IL and NHPI (SCILL-SILP hybrid catalytic system). We have combined the incredible properties of CNTs, NHPI, and IL to impart a synergistic effect to the resultant catalytic system. The TEM images with EDS analyses have been shown in Fig. 7, and the coating of the mixture of IL and NHPI over the CNTs (SCILL-SILP hybrid catalytic system) can be observed in Fig. 7 (C). Such a system can be produced by coating other ionic liquids with NHPI or other active catalysts, and the catalytic activity of the resultant system can be investigated. SILP and SCILL catalytic systems can also be produced by using CNTs and functionalized CNTs, which provide another path to investigate active catalytic systems for the aerobic oxidation of hydrocarbons in the liquid phase. CNTs and functionalized CNTs can be tailored to make them selective toward certain products in the hydrocarbon oxidation processes. For example, in our previous work, pristine CNTs were more selective toward hydroperoxides and after Cu(II) modification the CNTs were more selective toward acetophenone [83]. Similarly, Liao et al. found that pristine CNTs were more selective toward cumene hydroperoxide in cumene oxidation, while after N doping, N-CNTs were more selective towards benzyl propanol and acetophenone [62]. In the same way, certain functionalization of CNTs makes them more selective toward a specific oxidation product. Therefore, an investigation can also be carried out on the product distribution and effectiveness of functionalized CNTs in the liquid-phase hydrocarbon oxidation reactions in order to produce a task-specific catalyst. There are certain limitations regarding the industrialization of CNTs as a catalyst for the liquid-phase aerobic oxidation of hydrocarbons. For example, the production of high-quality CNTs on an industrial scale is still a costly and intricate process. Metal catalysts are used for the synthesis of CNTs, therefore, some of the metal impurities remain in CNTs [153]. As discussed earlier, even a trace amount of impurity can act as a free radical scavenger and halt the free radical oxidation reactions. Surface defects on the CNTs are also among the crucial drawbacks and realistic CNTs are not defect-free, containing several structural defects formed during their growth. The presence of these surface defects can influence the physical and chemical properties of the CNTs [154,155]. The other challenges in the production of homogeneous CNTs on large scales are, it is difficult to produce CNTs with the same diameter and length, and the batch-wise variation of CNTs during their production [153]. Nevertheless, CNTs are a greener alternative to the traditional homogeneous catalyst, providing many doors for future researchers to employ them as metal-free catalysts, functionalize them, or employ them as a support for other active catalysts for the liquid-phase aerobic hydrocarbon oxidation processes. 7 Conclusion CNTs as metal-free catalysts have shown elevated catalytic activity for the liquid-phase aerobic oxidation of hydrocarbons. Thanks to their elevated conductivity which augments the electron transfer among radicals and themselves at the solid-liquid interface to boost up the reaction rate. Their conductivity can be further enhanced by doping heteroatoms like nitrogen. Pristine CNTs are more selective towards hydroperoxides while after N-doping and or metal nanoparticles immobilization, their selectivity shifts towards AcPO. N-doped CNTs and metal-functionalized CNTs accelerate the decomposition of hydroperoxides and improve the catalytic activity. CNTs have proved to be an active and stable catalyst while being easily separable from the reaction mixture and reusable for multiple cycles. CNTs can be functionalized and or used as a support for other active catalysts to enhance the catalytic activity. Thanks to their robust metal support interaction, which enables them to combine with metal nanoparticles to synthesize the nanocomposite or nanohybrid catalyst. Furthermore, CNTs can be used to prepare SCILL, SILP, or combined SCILL-SILP hybrid catalytic systems for the oxidation of hydrocarbons in the liquid phase. Declaration of Competing Interest The authors declare that they have no known competing financial interests or personal relationships that could have appeared to influence the work reported in this paper. Acknowledgments This work was funded by the Silesian University of Technology, Poland (grants No. BKM-555/RCH5/2023). The authors would also like to thank the Polish National Agency for Academic Exchange for realization of the project (BPI/PST/2021/1/00039). References [1] R. Sheldon Metal-catalyzed oxidations of organic compounds, mechanistic principles and synthetic methodology including biochemical processes 2012 Elsevier Sheldon, R., Metal-catalyzed oxidations of organic compounds, mechanistic principles and synthetic methodology including biochemical processes. 2012, Elsevier. [2] Y. Su Elucidating mechanism of ethylbenzene oxidation catalyzed by carbon‐based catalysts with kinetic modeling AIChE J. 69 5 2023 p. e18007 Su, Y., et al., Elucidating mechanism of ethylbenzene oxidation catalyzed by carbon‐based catalysts with kinetic modeling. AIChE Journal, 2023. 69(5), p. e18007. [3] J.G. Speight Handbook of Petrochemical Processes 2019 CRC Press Speight, J.G., Handbook of petrochemical Processes. 2019, CRC Press. [4] R.A. Sheldon R.A. Van Santen Catalytic Oxidation Principles and Applications 1995 World Scientific Sheldon, R.A. and R.A. Van Santen, Catalytic Oxidation, Principles And Applications-A Course Of The Netherlands Institute For Catalysis Research (Niok). 1995, World Scientific. [5] E.T. Denisov I.B. Afanas’ ev Oxidation and Antioxidants in Organic Chemistry 2005 Denisov, E.T. and I.B. Afanas' ev, Oxidation and antioxidants in organic chemistry and biology. 2005. [6] J. Muzart Chromium-catalyzed oxidations in organic synthesis Chem. Rev. 92 1 1992 113 140 Muzart, J., Chromium-catalyzed oxidations in organic synthesis. Chemical Reviews, 1992. 92(1), p. 113–140. [7] M.I. bin Saiman Involvement of surface‐bound radicals in the oxidation of toluene using supported Au‐Pd nanoparticles Angew. Chem. Int. Ed. 24 51 2012 5981 5985 bin Saiman, M.I., et al., Involvement of surface‐bound radicals in the oxidation of toluene using supported Au‐Pd nanoparticles. Angewandte Chemie International Edition, 2012. 24(51), p. 5981–5985. [8] Y. Wang Boron‐and fluorine‐containing mesoporous carbon nitride polymers, metal‐free catalysts for cyclohexane oxidation Angew. Chem. Int. Ed. 49 19 2010 3356 3359 Wang, Y., et al., Boron‐and fluorine‐containing mesoporous carbon nitride polymers, metal‐free catalysts for cyclohexane oxidation. Angewandte Chemie International Edition, 2010. 49(19), p. 3356–3359. [9] H. Zhou Defect-less, layered organo-titanosilicate with superhydrophobicity and its catalytic activity in room-temperature olefin epoxidation Chem. Commun. 48 55 2012 6954 6956 Zhou, H., et al., Defect-less, layered organo-titanosilicate with superhydrophobicity and its catalytic activity in room-temperature olefin epoxidation. Chemical Communications, 2012. 48(55), p. 6954–6956. [10] M. Waser Concerning chemistry, reactivity, and mechanism of transition metal catalysed oxidation of benzylic compounds by means of ozone J. Mol. Catal. A, Chem. 236 1–2 2005 187 193 Waser, M., et al., Concerning chemistry, reactivity, and mechanism of transition metal catalysed oxidation of benzylic compounds by means of ozone. Journal of Molecular Catalysis A, Chemical, 2005. 236(1–2), p. 187–193. [11] C.A. Hone C.O. Kappe The use of molecular oxygen for liquid phase aerobic oxidations in continuous flow Acc. Sustain. Flow. Chem. 2020 67 110 Hone, C.A. and C.O. Kappe, The use of molecular oxygen for liquid phase aerobic oxidations in continuous flow. Accounts on Sustainable Flow Chemistry, 2020, p. 67–110. [12] D. Habibi A.R. Faraji Preparation, characterization and catalytic activity of a nano-Co (II)-catalyst as a high efficient heterogeneous catalyst for the selective oxidation of ethylbenzene, cyclohexene, and benzyl alcohol Comptes Rendus Chim. 16 10 2013 888 896 Habibi, D. and A.R. Faraji, Preparation, characterization and catalytic activity of a nano-Co (II)-catalyst as a high efficient heterogeneous catalyst for the selective oxidation of ethylbenzene, cyclohexene, and benzyl alcohol. Comptes Rendus Chimie, 2013. 16(10), p. 888–896. [13] A. Chen Nitrogen-doped dual mesoporous carbon for the selective oxidation of ethylbenzene Nanoscale 7 35 2015 14684 14690 Chen, A., et al., Nitrogen-doped dual mesoporous carbon for the selective oxidation of ethylbenzene. Nanoscale, 2015. 7(35), p. 14684–14690. [14] S.U. Nandanwar A review on selective production of acetophenone from oxidation of ethylbenzene over heterogeneous catalysts in a decade Catal. Lett. 151 2021 2116 2131 Nandanwar, S.U., et al., A review on selective production of acetophenone from oxidation of ethylbenzene over heterogeneous catalysts in a decade. Catalysis Letters, 2021. 151, p. 2116–2131. [15] Q. Lu A highly efficient transformation from cumene to cumyl hydroperoxide via catalytic aerobic oxidation at room temperature and investigations into solvent effects, reaction networks and mechanisms Appl. Catal. A, Gen. 630 2022 118441 Lu, Q., et al., A highly efficient transformation from cumene to cumyl hydroperoxide via catalytic aerobic oxidation at room temperature and investigations into solvent effects, reaction networks and mechanisms. Applied Catalysis A, General, 2022. 630, p. 118441. [16] Y. Yan Carbon nanotube catalysts, recent advances in synthesis, characterization and applications Chem. Soc. Rev. 44 10 2015 3295 3346 Yan, Y., et al., Carbon nanotube catalysts, recent advances in synthesis, characterization and applications. Chemical Society Reviews, 2015. 44(10), p. 3295–3346. [17] R.P. Rocha Tuning CNT properties for metal-free environmental catalytic applications C 2 3 2016 17 Rocha, R.P., et al., Tuning CNT properties for metal-free environmental catalytic applications. C, 2016. 2(3), p. 17. [18] J. John Advances in carbon nanotube-noble metal catalyzed organic transformations Nanotechnol. Rev. 1 6 2012 515 539 John, J., et al., Advances in carbon nanotube-noble metal catalyzed organic transformations. Nanotechnology Reviews, 2012. 1(6), p. 515–539. [19] J.M. Schnorr T.M. Swager Emerging applications of carbon nanotubes Chem. Mater. 23 3 2011 646 657 Schnorr, J.M. and T.M. Swager, Emerging applications of carbon nanotubes. Chemistry of Materials, 2011. 23(3), p. 646–657. [20] R.P. Rocha M.F.R. Pereira J.L. Figueiredo Metal-free carbon materials as catalysts for wet air oxidation Catal. Today 356 2020 189 196 Rocha, R.P., M.F.R. Pereira, and J.L. Figueiredo, Metal-free carbon materials as catalysts for wet air oxidation. Catalysis Today, 2020. 356, p. 189–196. [21] S. Yang Catalytic activity, stability and structure of multi-walled carbon nanotubes in the wet air oxidation of phenol Carbon 46 3 2008 445 452 Yang, S., et al., Catalytic activity, stability and structure of multi-walled carbon nanotubes in the wet air oxidation of phenol. Carbon, 2008. 46(3), p. 445–452. [22] R.P. Rocha Different methodologies for synthesis of nitrogen doped carbon nanotubes and their use in catalytic wet air oxidation Appl. Catal. A, Gen. 548 2017 62 70 Rocha, R.P., et al., Different methodologies for synthesis of nitrogen doped carbon nanotubes and their use in catalytic wet air oxidation. Applied Catalysis A, General, 2017. 548, p. 62–70. [23] G. Jing M. Luan T. Chen Progress of catalytic wet air oxidation technology Arab. J. Chem. 9 2016 S1208 S1213 Jing, G., M. Luan, and T. Chen, Progress of catalytic wet air oxidation technology. Arabian journal of Chemistry, 2016. 9, p. S1208-S1213. [24] A. Rinaldi Oxidative purification of carbon nanotubes and its impact on catalytic performance in oxidative dehydrogenation reactions. ChemSusChem Chem. Sustain. Energy Mater. 3 2 2010 254 260 Rinaldi, A., et al., Oxidative purification of carbon nanotubes and its impact on catalytic performance in oxidative dehydrogenation reactions. ChemSusChem, Chemistry & Sustainability Energy & Materials, 2010. 3(2), p. 254–260. [25] W. Liu Oxidative dehydrogenation on nanocarbon, effect of heteroatom doping Appl. Catal. B, Environ. 258 2019 117982 Liu, W., et al., Oxidative dehydrogenation on nanocarbon, Effect of heteroatom doping. Applied Catalysis B, Environmental, 2019. 258, p. 117982. [26] W. Qi Oxidative dehydrogenation on nanocarbon, identification and quantification of active sites by chemical titration Angew. Chem. Int. Ed. 52 52 2013 14224 14228 Qi, W., et al., Oxidative dehydrogenation on nanocarbon, identification and quantification of active sites by chemical titration. Angewandte Chemie International Edition, 2013. 52(52), p. 14224–14228. [27] Y. Shen A.C. Lua Synthesis of Ni and Ni–Cu supported on carbon nanotubes for hydrogen and carbon production by catalytic decomposition of methane Appl. Catal. B, Environ. 164 2015 61 69 Shen, Y. and A.C. Lua, Synthesis of Ni and Ni–Cu supported on carbon nanotubes for hydrogen and carbon production by catalytic decomposition of methane. Applied Catalysis B, Environmental, 2015. 164, p. 61–69. [28] F. García-García The use of carbon nanotubes with and without nitrogen doping as support for ruthenium catalysts in the ammonia decomposition reaction Carbon 48 1 2010 267 276 García-García, F., et al., The use of carbon nanotubes with and without nitrogen doping as support for ruthenium catalysts in the ammonia decomposition reaction. Carbon, 2010. 48(1), p. 267–276. [29] J. Chen Effects of nitrogen doping on the structure of carbon nanotubes (CNTs) and activity of Ru/CNTs in ammonia decomposition Chem. Eng. J. 156 2 2010 404 410 Chen, J., et al., Effects of nitrogen doping on the structure of carbon nanotubes (CNTs) and activity of Ru/CNTs in ammonia decomposition. Chemical Engineering Journal, 2010. 156(2), p. 404–410. [30] H. Zhang Implication of iron nitride species to enhance the catalytic activity and stability of carbon nanotubes supported Fe catalysts for carbon-free hydrogen production via low-temperature ammonia decomposition Catal. Sci. Technol. 8 3 2018 907 915 Zhang, H., et al., Implication of iron nitride species to enhance the catalytic activity and stability of carbon nanotubes supported Fe catalysts for carbon-free hydrogen production via low-temperature ammonia decomposition. Catalysis Science & Technology, 2018. 8(3), p. 907–915. [31] A.H. Nia A facile Friedel–Crafts acylation for the synthesis of polyethylenimine-grafted multi-walled carbon nanotubes as efficient gene delivery vectors Int. J. Pharm. 502 1–2 2016 125 137 Nia, A.H., et al., A facile Friedel–Crafts acylation for the synthesis of polyethylenimine-grafted multi-walled carbon nanotubes as efficient gene delivery vectors. International journal of pharmaceutics, 2016. 502(1–2), p. 125–137. [32] M. Mu Iron (III)-modified tungstophosphoric acid supported on titania catalyst, synthesis, characterization, and friedel–craft acylation of m-xylene Ind. Eng. Chem. Res. 54 36 2015 8893 8899 Mu, M., et al., Iron (III)-Modified Tungstophosphoric Acid Supported on Titania Catalyst, Synthesis, Characterization, and Friedel–Craft Acylation of m-Xylene. Industrial & Engineering Chemistry Research, 2015. 54(36), p. 8893–8899. [33] C. Xing Controllable encapsulation of cobalt clusters inside carbon nanotubes as effective catalysts for Fischer–Tropsch synthesis Catal. Today 215 2013 24 28 Xing, C., et al., Controllable encapsulation of cobalt clusters inside carbon nanotubes as effective catalysts for Fischer–Tropsch synthesis. Catalysis today, 2013. 215, p. 24–28. [34] H. Zhang The nature of cobalt species in carbon nanotubes and their catalytic performance in Fischer–Tropsch reaction J. Mater. Chem. 19 48 2009 9241 9249 Zhang, H., et al., The nature of cobalt species in carbon nanotubes and their catalytic performance in Fischer–Tropsch reaction. Journal of Materials Chemistry, 2009. 19(48), p. 9241–9249. [35] H. Zhang Hydrogen spillover effects in the Fischer–Tropsch reaction over carbon nanotube supported cobalt catalysts Catal. Sci. Technol. 13 6 2023 1888 1904 Zhang, H., et al., Hydrogen spillover effects in the Fischer–Tropsch reaction over carbon nanotube supported cobalt catalysts. Catalysis Science & Technology, 2023. 13(6), p. 1888–1904. [36] S. Wang Iron–potassium on single-walled carbon nanotubes as efficient catalyst for CO2 hydrogenation to heavy olefins ACS Catal. 10 11 2020 6389 6401 Wang, S., et al., Iron–potassium on single-walled carbon nanotubes as efficient catalyst for CO2 hydrogenation to heavy olefins. ACS Catalysis, 2020. 10(11), p. 6389–6401. [37] R. Oosthuizen V. Nyamori Carbon nanotubes as supports for palladium and bimetallic catalysts for use in hydrogenation reactions Platin. Met. Rev. 55 3 2011 154 169 Oosthuizen, R. and V. Nyamori, Carbon nanotubes as supports for palladium and bimetallic catalysts for use in hydrogenation reactions. Platinum Metals Review, 2011. 55(3), p. 154–169. [38] X. Yang X. Wang J. Qiu Aerobic oxidation of alcohols over carbon nanotube-supported Ru catalysts assembled at the interfaces of emulsion droplets Appl. Catal. A, Gen. 382 1 2010 131 137 Yang, X., X. Wang, and J. Qiu, Aerobic oxidation of alcohols over carbon nanotube-supported Ru catalysts assembled at the interfaces of emulsion droplets. Applied Catalysis A, General, 2010. 382(1), p. 131–137. [39] J. Luo Selective liquid phase oxidation of benzyl alcohol catalyzed by carbon nanotubes Chem. Eng. J. 204 2012 98 106 Luo, J., et al., Selective liquid phase oxidation of benzyl alcohol catalyzed by carbon nanotubes. Chemical engineering journal, 2012. 204, p. 98–106. [40] A. Maleki Green oxidation protocol, Selective conversions of alcohols and alkenes to aldehydes, ketones and epoxides by using a new multiwall carbon nanotube-based hybrid nanocatalyst via ultrasound irradiation Ultrason. Sonochem. 40 2018 460 464 Maleki, A., Green oxidation protocol, Selective conversions of alcohols and alkenes to aldehydes, ketones and epoxides by using a new multiwall carbon nanotube-based hybrid nanocatalyst via ultrasound irradiation. Ultrasonics Sonochemistry, 2018. 40, p. 460–464. [41] X. Hu Biomass-derived phosphorus-doped carbon materials as efficient metal-free catalysts for selective aerobic oxidation of alcohols Green. Chem. 21 19 2019 5274 5283 Hu, X., et al., Biomass-derived phosphorus-doped carbon materials as efficient metal-free catalysts for selective aerobic oxidation of alcohols. Green Chemistry, 2019. 21(19), p. 5274–5283. [42] J. Luo Aerobic liquid‐phase oxidation of ethylbenzene to acetophenone catalyzed by carbon nanotubes ChemCatChem 5 6 2013 1578 1586 Luo, J., et al., Aerobic liquid‐phase oxidation of ethylbenzene to acetophenone catalyzed by carbon nanotubes. ChemCatChem, 2013. 5(6), p. 1578–1586. [43] S. Liao Carbon nanotubes as catalyst for the aerobic oxidation of cumene to cumene hydroperoxide Appl. Catal. A, Gen. 478 2014 1 8 Liao, S., et al., Carbon nanotubes as catalyst for the aerobic oxidation of cumene to cumene hydroperoxide. Applied Catalysis A, General, 2014. 478, p. 1–8. [44] Y. Cao Nitrogen-, phosphorous-and boron-doped carbon nanotubes as catalysts for the aerobic oxidation of cyclohexane Carbon 57 2013 433 442 Cao, Y., et al., Nitrogen-, phosphorous-and boron-doped carbon nanotubes as catalysts for the aerobic oxidation of cyclohexane. Carbon, 2013. 57, p. 433–442. [45] E. Zeynalov Carbon nanotubes catalysis in liquid-phase aerobic oxidation of hydrocarbons, Influence of nanotube impurities J. Phys. Chem. Solids 127 2019 245 251 Zeynalov, E., et al., Carbon nanotubes catalysis in liquid-phase aerobic oxidation of hydrocarbons, Influence of nanotube impurities. Journal of Physics and Chemistry of Solids, 2019. 127, p. 245–251. [46] H. Fu Synergistic effect of nitrogen dopants on carbon nanotubes on the catalytic selective epoxidation of styrene ACS Catal. 10 1 2019 129 137 Fu, H., et al., Synergistic effect of nitrogen dopants on carbon nanotubes on the catalytic selective epoxidation of styrene. ACS Catalysis, 2019. 10(1), p. 129–137. [47] S. Rathinavel K. Priyadharshini D. Panda A review on carbon nanotube, An overview of synthesis, properties, functionalization, characterization, and the application Mater. Sci. Eng., B 268 2021 115095 Rathinavel, S., K. Priyadharshini, and D. Panda, A review on carbon nanotube, An overview of synthesis, properties, functionalization, characterization, and the application. Materials Science and Engineering, B, 2021. 268, p. 115095. [48] A. Eatemadi Carbon nanotubes, properties, synthesis, purification, and medical applications Nanoscale Res. Lett. 9 1 2014 1 13 Eatemadi, A., et al., Carbon nanotubes, properties, synthesis, purification, and medical applications. Nanoscale research letters, 2014. 9(1), p. 1–13. [49] J. Prasek Methods for carbon nanotubes synthesis. J. Mater. Chem. 21 40 2011 15872 15884 Prasek, J., et al., Methods for carbon nanotubes synthesis. Journal of Materials Chemistry, 2011. 21(40), p. 15872–15884. [50] D. Vairavapandian P. Vichchulada M.D. Lay Preparation and modification of carbon nanotubes, Review of recent advances and applications in catalysis and sensing Anal. Chim. Acta 626 2 2008 119 129 Vairavapandian, D., P. Vichchulada, and M.D. Lay, Preparation and modification of carbon nanotubes, Review of recent advances and applications in catalysis and sensing. Analytica chimica acta, 2008. 626(2), p. 119–129. [51] P. Serp E. Castillejos Catalysis in carbon nanotubes ChemCatChem 2 1 2010 41 47 Serp, P. and E. Castillejos, Catalysis in carbon nanotubes. ChemCatChem, 2010. 2(1), p. 41–47. [52] I. Hermans P.A. Jacobs J. Peeters To the core of autocatalysis in cyclohexane autoxidation Chem. Eur. J. 12 16 2006 4229 4240 Hermans, I., P.A. Jacobs, and J. Peeters, To the core of autocatalysis in cyclohexane autoxidation. Chemistry–A European Journal, 2006. 12(16), p. 4229–4240. [53] I. Hermans P. Jacobs J. Peeters The formation of byproducts in the autoxidation of cyclohexane Chem. Eur. J. 13 3 2007 754 761 Hermans, I., P. Jacobs, and J. Peeters, The formation of byproducts in the autoxidation of cyclohexane. Chemistry–A European Journal, 2007. 13(3), p. 754–761. [54] W. Deng Solvent-free aerobic oxidation of toluene over metalloporphyrin/NHPI/CTAB, synergy and mechanism Catal. Lett. 144 2014 333 339 Deng, W., et al., Solvent-free aerobic oxidation of toluene over metalloporphyrin/NHPI/CTAB, synergy and mechanism. Catalysis letters, 2014. 144, p. 333–339. [55] A. Bhattacharya Kinetic modeling of liquid phase autoxidation of cumene Chem. Eng. J. 137 2 2008 308 319 Bhattacharya, A., Kinetic modeling of liquid phase autoxidation of cumene. Chemical Engineering Journal, 2008. 137(2), p. 308–319. [56] M. Le Development of a detailed kinetic model for the oxidation of n-butane in the liquid phase J. Phys. Chem. B 125 25 2021 6955 6967 Le, M., et al., Development of a Detailed Kinetic Model for the Oxidation of n-Butane in the Liquid Phase. The Journal of Physical Chemistry B, 2021. 125(25), p. 6955–6967. [57] W. Sun Modeling the liquid phase autoxidation of cyclohexylbenzene to hydroperoxide Chem. Eng. Res. Des. 124 2017 202 210 Sun, W., et al., Modeling the liquid phase autoxidation of cyclohexylbenzene to hydroperoxide. Chemical Engineering Research and Design, 2017. 124, p. 202–210. [58] X. Lin Nitrogen-doped carbon nanotubes encapsulate cobalt nanoparticles as efficient catalysts for aerobic and solvent-free selective oxidation of hydrocarbons Green. Chem. 19 9 2017 2164 2173 Lin, X., et al., Nitrogen-doped carbon nanotubes encapsulate cobalt nanoparticles as efficient catalysts for aerobic and solvent-free selective oxidation of hydrocarbons. Green Chemistry, 2017. 19(9), p. 2164–2173. [59] H. Ma Catalytic aerobic oxidation of ethylbenzene over Co/SBA-15 Catal. Lett. 113 2007 104 108 Ma, H., et al., Catalytic aerobic oxidation of ethylbenzene over Co/SBA-15. Catalysis letters, 2007. 113, p. 104–108. [60] Y. Xiong Cobalt single atom site catalysts with ultrahigh metal loading for enhanced aerobic oxidation of ethylbenzene Nano Res. 14 2021 2418 2423 Xiong, Y., et al., Cobalt single atom site catalysts with ultrahigh metal loading for enhanced aerobic oxidation of ethylbenzene. Nano Research, 2021. 14, p. 2418–2423. [61] Q. Jinwei Aerobic oxidation of ethylbenzene Co-catalyzed by N-hydroxyphthalimide and oxobis (8-quinolinolato) vanadium (IV) complexes Chin. J. Catal. 32 6–8 2011 1342 1348 Jinwei, Q., et al., Aerobic oxidation of ethylbenzene Co-catalyzed by N-hydroxyphthalimide and oxobis (8-quinolinolato) vanadium (IV) complexes. Chinese Journal of Catalysis, 2011. 32(6–8), p. 1342–1348. [62] S. Liao Tuning the selectivity in the aerobic oxidation of cumene catalyzed by nitrogen‐doped carbon nanotubes ChemCatChem 6 2 2014 555 560 Liao, S., et al., Tuning the selectivity in the aerobic oxidation of cumene catalyzed by nitrogen‐doped carbon nanotubes. ChemCatChem, 2014. 6(2), p. 555–560. [63] X. Yang Unravelling the radical transition during the carbon-catalyzed oxidation of cyclohexane by in situ electron paramagnetic resonance in the liquid phase Catal. Sci. Technol. 7 19 2017 4431 4436 Yang, X., et al., Unravelling the radical transition during the carbon-catalyzed oxidation of cyclohexane by in situ electron paramagnetic resonance in the liquid phase. Catalysis Science & Technology, 2017. 7(19), p. 4431–4436. [64] J.C. Yang Assessment of adequate sodium hypochlorite concentration for pre‐oxidization of multi‐walled carbon nanotubes J. Chem. Technol. Biotechnol. 85 5 2010 699 707 Yang, J.C., et al., Assessment of adequate sodium hypochlorite concentration for pre‐oxidization of multi‐walled carbon nanotubes. Journal of Chemical Technology & Biotechnology, 2010. 85(5), p. 699–707. [65] I. Hermans J. Peeters P.A. Jacobs Autoxidation of ethylbenzene, The mechanism elucidated J. Org. Chem. 72 8 2007 3057 3064 Hermans, I., J. Peeters, and P.A. Jacobs, Autoxidation of ethylbenzene, The mechanism elucidated. The Journal of organic chemistry, 2007. 72(8), p. 3057–3064. [66] X. Yang Mechanistic insight into the catalytic oxidation of cyclohexane over carbon nanotubes, kinetic and in situ spectroscopic evidence Chem. Eur. J. 19 30 2013 9818 9824 Yang, X., et al., Mechanistic insight into the catalytic oxidation of cyclohexane over carbon nanotubes, kinetic and in situ spectroscopic evidence. Chemistry–A European Journal, 2013. 19(30), p. 9818–9824. [67] Y. Cao sp 2-and sp 3-hybridized carbon materials as catalysts for aerobic oxidation of cyclohexane Catal. Sci. Technol. 3 10 2013 2654 2660 Cao, Y., et al., sp 2-and sp 3-hybridized carbon materials as catalysts for aerobic oxidation of cyclohexane. Catalysis Science & Technology, 2013. 3(10), p. 2654–2660. [68] H. Yu Selective catalysis of the aerobic oxidation of cyclohexane in the liquid phase by carbon nanotubes Angew. Chem. 123 17 2011 4064 4068 Yu, H., et al., Selective catalysis of the aerobic oxidation of cyclohexane in the liquid phase by carbon nanotubes. Angewandte Chemie, 2011. 17(123), p. 4064–4068. [69] X. Duan N-doping-induced nonradical reaction on single-walled carbon nanotubes for catalytic phenol oxidation ACS Catal. 5 2 2015 553 559 Duan, X., et al., N-doping-induced nonradical reaction on single-walled carbon nanotubes for catalytic phenol oxidation. Acs Catalysis, 2015. 5(2), p. 553–559. [70] W. Li Catalytic epoxidation reaction over N-containing sp2 carbon catalysts ACS Catal. 4 5 2014 1261 1266 Li, W., et al., Catalytic epoxidation reaction over N-containing sp2 carbon catalysts. Acs Catalysis, 2014. 4(5), p. 1261–1266. [71] P. Tang Graphene-based metal-free catalysts for catalytic reactions in the liquid phase ACS Catal. 6 10 2016 6948 6958 Tang, P., et al., Graphene-based metal-free catalysts for catalytic reactions in the liquid phase. ACS Catalysis, 2016. 6(10), p. 6948–6958. [72] M. Martin‐Martinez Role of nitrogen doping on the performance of carbon nanotube catalysts, a catalytic wet peroxide oxidation application ChemCatChem 8 12 2016 2068 2078 Martin‐Martinez, M., et al., Role of nitrogen doping on the performance of carbon nanotube catalysts, a catalytic wet peroxide oxidation application. ChemCatChem, 2016. 8(12), p. 2068–2078. [73] Y. Cao Selective allylic oxidation of cyclohexene catalyzed by nitrogen-doped carbon nanotubes ACS Catal. 4 5 2014 1617 1625 Cao, Y., et al., Selective allylic oxidation of cyclohexene catalyzed by nitrogen-doped carbon nanotubes. ACS Catalysis, 2014. 4(5), p. 1617–1625. [74] Y. Gao Nitrogen‐doped sp2–hybridized carbon as a superior catalyst for selective oxidation Angew. Chem. Int. Ed. 52 7 2013 2109 2113 Gao, Y., et al., Nitrogen‐doped sp2–hybridized carbon as a superior catalyst for selective oxidation. Angewandte Chemie International Edition, 2013. 52(7), p. 2109–2113. [75] C. Mu A kinetics study on cumene oxidation catalyzed by carbon nanotubes, effect of N-doping Chem. Eng. Sci. 177 2018 391 398 Mu, C., et al., A kinetics study on cumene oxidation catalyzed by carbon nanotubes, effect of N-doping. Chemical Engineering Science, 2018. 177, p. 391–398. [76] Y. Su New understanding of selective aerobic oxidation of ethylbenzene catalyzed by nitrogen‐doped carbon nanotubes ChemCatChem 13 2 2021 646 655 Su, Y., et al., New Understanding of Selective Aerobic Oxidation of Ethylbenzene Catalyzed by Nitrogen‐doped Carbon Nanotubes. ChemCatChem, 2021. 13(2), p. 646–655. [77] H. Wang T. Maiyalagan X. Wang Review on recent progress in nitrogen-doped graphene, synthesis, characterization, and its potential applications ACS Catal. 2 5 2012 781 794 Wang, H., T. Maiyalagan, and X. Wang, Review on recent progress in nitrogen-doped graphene, synthesis, characterization, and its potential applications. AcS catalysis, 2012. 2(5), p. 781–794. [78] Z. Ma Mesoporous nitrogen-doped carbons with high nitrogen contents and ultrahigh surface areas, synthesis and applications in catalysis Green. Chem. 18 7 2016 1976 1982 Ma, Z., et al., Mesoporous nitrogen-doped carbons with high nitrogen contents and ultrahigh surface areas, synthesis and applications in catalysis. Green Chemistry, 2016. 18(7), p. 1976–1982. [79] L. He Synthesis, characterization, and application of metal nanoparticles supported on nitrogen‐doped carbon, catalysis beyond electrochemistry Angew. Chem. Int. Ed. 55 41 2016 12582 12594 He, L., et al., Synthesis, characterization, and application of metal nanoparticles supported on nitrogen‐doped carbon, catalysis beyond electrochemistry. Angewandte Chemie International Edition, 2016. 55(41), p. 12582–12594. [80] J. Long Nitrogen-doped graphene nanosheets as metal-free catalysts for aerobic selective oxidation of benzylic alcohols ACS Catal. 2 4 2012 622 631 Long, J., et al., Nitrogen-doped graphene nanosheets as metal-free catalysts for aerobic selective oxidation of benzylic alcohols. Acs Catalysis, 2012. 2(4), p. 622–631. [81] D. Guo Active sites of nitrogen-doped carbon materials for oxygen reduction reaction clarified using model catalysts Science 351 6271 2016 361 365 Guo, D., et al., Active sites of nitrogen-doped carbon materials for oxygen reduction reaction clarified using model catalysts. Science, 2016. 351(6271), p. 361–365. [82] Y. Cao Aerobic oxidation of α-pinene catalyzed by carbon nanotubes Catal. Sci. Technol. 5 8 2015 3935 3944 Cao, Y., et al., Aerobic oxidation of α-pinene catalyzed by carbon nanotubes. Catalysis Science & Technology, 2015. 5(8), p. 3935–3944. [83] S.U. Azam K. Peckh B. Orlińska SCILL-SILP hybrid catalytic system by employing carbon nanotubes as a support for the selective oxidation of ethylbenzene to acetophenone Chem. Eng. J. 457 2023 141207 Azam, S.U., K. Peckh, and B. Orlińska, SCILL-SILP hybrid catalytic system by employing carbon nanotubes as a support for the selective oxidation of ethylbenzene to acetophenone. Chemical Engineering Journal, 2023. 457, p. 141207. [84] M. Liu Manganese-containing hollow TS-1, Description of the catalytic sites and surface properties for solvent-free oxidation of ethylbenzene Chem. Eng. J. 313 2017 1382 1395 Liu, M., et al., Manganese-containing hollow TS-1, Description of the catalytic sites and surface properties for solvent-free oxidation of ethylbenzene. Chemical Engineering Journal, 2017. 313, p. 1382–1395. [85] L. Fu One-pot synthesis of mesoporous silica hollow spheres with Mn–N–C integrated into the framework for ethylbenzene oxidation Chem. Commun. 52 32 2016 5577 5580 Fu, L., et al., One-pot synthesis of mesoporous silica hollow spheres with Mn–N–C integrated into the framework for ethylbenzene oxidation. Chemical Communications, 2016. 52(32), p. 5577–5580. [86] N.N. Tušar Mn-containing porous silicates as catalysts for the solvent-free selective oxidation of alkyl aromatics to aromatic ketones with molecular oxygen Microporous Mesoporous Mater. 146 1–3 2011 166 171 Tušar, N.N., et al., Mn-containing porous silicates as catalysts for the solvent-free selective oxidation of alkyl aromatics to aromatic ketones with molecular oxygen. Microporous and mesoporous materials, 2011. 146(1–3), p. 166–171. [87] S.E. Dapurkar Solvent-free selective oxidation of benzylic compounds over chromium containing mesoporous molecular sieve catalyst at 1 atm O2 Catal. Commun. 10 6 2009 1025 1028 Dapurkar, S.E., et al., Solvent-free selective oxidation of benzylic compounds over chromium containing mesoporous molecular sieve catalyst at 1 atm O2. Catalysis Communications, 2009. 10(6), p. 1025–1028. [88] R. Zhao A highly efficient oxidation of cyclohexane over Au/ZSM-5 molecular sieve catalyst with oxygen as oxidant Chem. Commun. 7 2004 904 905 Zhao, R., et al., A highly efficient oxidation of cyclohexane over Au/ZSM-5 molecular sieve catalyst with oxygen as oxidant. Chemical Communications, 2004(7), p. 904–905. [89] B.P. Hereijgers B.M. Weckhuysen Aerobic oxidation of cyclohexane by gold-based catalysts, New mechanistic insight by thorough product analysis J. Catal. 270 1 2010 16 25 Hereijgers, B.P. and B.M. Weckhuysen, Aerobic oxidation of cyclohexane by gold-based catalysts, New mechanistic insight by thorough product analysis. Journal of Catalysis, 2010. 270(1), p. 16–25. [90] Z.-Y. Cai Solvent-free oxidation of cyclohexene over catalysts Au/OMS-2 and Au/La-OMS-2 with molecular oxygen Catal. Commun. 12 3 2010 197 201 Cai, Z.-Y., et al., Solvent-free oxidation of cyclohexene over catalysts Au/OMS-2 and Au/La-OMS-2 with molecular oxygen. Catalysis Communications, 2010. 12(3), p. 197–201. [91] L.-X. Xu A highly active Au/Al 2 O 3 catalyst for cyclohexane oxidation using molecular oxygen Catal. Lett. 114 2007 202 205 Xu, L.-X., et al., A highly active Au/Al 2 O 3 catalyst for cyclohexane oxidation using molecular oxygen. Catalysis Letters, 2007. 114, p. 202–205. [92] C. Yin Allylic oxidation of cyclohexene with molecular oxygen using cobalt resinate as catalyst Catal. Lett. 131 2009 440 443 Yin, C., et al., Allylic oxidation of cyclohexene with molecular oxygen using cobalt resinate as catalyst. Catalysis letters, 2009. 131, p. 440–443. [93] H. Huang Tunable synthesis of metal–graphene complex nanostructures and their catalytic ability for solvent-free cyclohexene oxidation in air Nanoscale 4 16 2012 4964 4967 Huang, H., et al., Tunable synthesis of metal–graphene complex nanostructures and their catalytic ability for solvent-free cyclohexene oxidation in air. Nanoscale, 2012. 4(16), p. 4964–4967. [94] S.E. Dapurkar Solvent-free allylic oxidation of cycloolefins over mesoporous CrMCM-41 molecular sieve catalyst at 1 atm dioxygen Appl. Catal. A, Gen. 346 1–2 2008 112 116 Dapurkar, S.E., et al., Solvent-free allylic oxidation of cycloolefins over mesoporous CrMCM-41 molecular sieve catalyst at 1 atm dioxygen. Applied Catalysis A, General, 2008. 346(1–2), p. 112–116. [95] A. Nowacka Selective aerobic oxidation of cumene to cumene hydroperoxide over mono-and bimetallic trimesate metal–organic frameworks prepared by a facile “green” aqueous synthesis ACS Sustain. Chem. Eng. 7 8 2019 7708 7715 Nowacka, A., et al., Selective aerobic oxidation of cumene to cumene hydroperoxide over mono-and bimetallic trimesate metal–organic frameworks prepared by a facile “green” aqueous synthesis. ACS Sustainable Chemistry & Engineering, 2019. 7(8), p. 7708–7715. [96] R. Chakrabarty B.K. Das J.H. Clark Enhanced selectivity in green catalytic epoxidation using a supported cobalt complex Green. Chem. 9 8 2007 845 848 Chakrabarty, R., B.K. Das, and J.H. Clark, Enhanced selectivity in green catalytic epoxidation using a supported cobalt complex. Green Chemistry, 2007. 9(8), p. 845–848. [97] J. Thomas New catalysts for the aerobic selective oxidation of hydrocarbons, Mn (III)-and Co (III)-containing molecular sieves for the epoxidation of alkenes Chem. Commun. 9 1999 829 830 Thomas, J., New catalysts for the aerobic selective oxidation of hydrocarbons, Mn (III)-and Co (III)-containing molecular sieves for the epoxidation of alkenes. Chemical Communications, 1999(9), p. 829–830. [98] N. Maksimchuk Heterogeneous selective oxidation catalysts based on coordination polymer MIL-101 and transition metal-substituted polyoxometalates J. Catal. 257 2 2008 315 323 Maksimchuk, N., et al., Heterogeneous selective oxidation catalysts based on coordination polymer MIL-101 and transition metal-substituted polyoxometalates. Journal of Catalysis, 2008. 257(2), p. 315–323. [99] J. Sheng Oxidative dehydrogenation of light alkanes to olefins on metal-free catalysts Chem. Soc. Rev. 50 2 2021 1438 1468 Sheng, J., et al., Oxidative dehydrogenation of light alkanes to olefins on metal-free catalysts. Chemical Society Reviews, 2021. 50(2), p. 1438–1468. [100] W. Qi P. Yan D.S. Su Oxidative dehydrogenation on nanocarbon, Insights into the reaction mechanism and kinetics via in situ experimental methods Acc. Chem. Res. 51 3 2018 640 648 Qi, W., P. Yan, and D.S. Su, Oxidative dehydrogenation on nanocarbon, Insights into the reaction mechanism and kinetics via in situ experimental methods. Accounts of Chemical Research, 2018. 51(3), p. 640–648. [101] T.D. Marforio CNT‐catalyzed oxidative dehydrogenation of ethylbenzene to styrene, DFT calculations disclose the pathways ChemNanoMat 5 4 2019 499 505 Marforio, T.D., et al., CNT‐Catalyzed Oxidative Dehydrogenation of Ethylbenzene to Styrene, DFT Calculations Disclose the Pathways. ChemNanoMat, 2019. 5(4), p. 499–505. [102] W. Liu Oxidative dehydrogenation of ethylbenzene on nanocarbon, Kinetics and reaction mechanism J. Catal. 368 2018 1 7 Liu, W., et al., Oxidative dehydrogenation of ethylbenzene on nanocarbon, Kinetics and reaction mechanism. Journal of Catalysis, 2018. 368, p. 1–7. [103] J. Zhang Surface-modified carbon nanotubes catalyze oxidative dehydrogenation of n-butane Science 322 5898 2008 73 77 Zhang, J., et al., Surface-modified carbon nanotubes catalyze oxidative dehydrogenation of n-butane. science, 2008. 322(5898), p. 73–77. [104] X. Liu D.S. Su R. Schlögl Oxidative dehydrogenation of 1-butene to butadiene over carbon nanotube catalysts Carbon 46 3 2008 547 549 Liu, X., D.S. Su, and R. Schlögl, Oxidative dehydrogenation of 1-butene to butadiene over carbon nanotube catalysts. Carbon, 2008. 46(3), p. 547–549. [105] Y. Chi The effect of surface oxygenated groups of carbon nanotubes on liquid phase catalytic oxidation of cumene Catal. Sci. Technol. 6 7 2016 2396 2402 Chi, Y., et al., The effect of surface oxygenated groups of carbon nanotubes on liquid phase catalytic oxidation of cumene. Catalysis Science & Technology, 2016. 6(7), p. 2396–2402. [106] X. Ren Carbon nanotubes as adsorbents in environmental pollution management, A review Chem. Eng. J. 170 2–3 2011 395 410 Ren, X., et al., Carbon nanotubes as adsorbents in environmental pollution management, a review. Chemical Engineering Journal, 2011. 170(2–3), p. 395–410. [107] H.-H. Cho Influence of surface oxides on the adsorption of naphthalene onto multiwalled carbon nanotubes Environ. Sci. Technol. 42 8 2008 2899 2905 Cho, H.-H., et al., Influence of surface oxides on the adsorption of naphthalene onto multiwalled carbon nanotubes. Environmental science & technology, 2008. 42(8), p. 2899–2905. [108] Q. Liao J. Sun L. Gao The adsorption of resorcinol from water using multi-walled carbon nanotubes Colloids Surf. A, Physicochem. Eng. Asp. 312 2–3 2008 160 165 Liao, Q., J. Sun, and L. Gao, The adsorption of resorcinol from water using multi-walled carbon nanotubes. Colloids and Surfaces A, Physicochemical and Engineering Aspects, 2008. 312(2–3), p. 160–165. [109] G. Onyestyák Acetylene sorption dynamics in carbon nanotubes Helv. Chim. Acta 87 6 2004 1508 1514 Onyestyák, G., et al., Acetylene sorption dynamics in carbon nanotubes. Helvetica chimica acta, 2004. 87(6), p. 1508–1514. [110] X. Yang Confined iron nanowires enhance the catalytic activity of carbon nanotubes in the aerobic oxidation of cyclohexane ChemSusChem 5 7 2012 1213 1217 Yang, X., et al., Confined iron nanowires enhance the catalytic activity of carbon nanotubes in the aerobic oxidation of cyclohexane. ChemSusChem, 2012. 5(7), p. 1213–1217. [111] Y. Su Confined cobalt on carbon nanotubes in solvent‐free aerobic oxidation of ethylbenzene, enhanced interfacial charge transfer ChemCatChem 14 2 2022 e202101378 Su, Y., et al., Confined Cobalt on Carbon Nanotubes in Solvent‐free Aerobic Oxidation of Ethylbenzene, Enhanced Interfacial Charge Transfer. ChemCatChem, 2022. 14(2), p. e202101378. [112] J. Luo Enhancing the catalytic activity of carbon nanotubes by filled iron nanowires for selective oxidation of ethylbenzene Catal. Commun. 51 2014 77 81 Luo, J., et al., Enhancing the catalytic activity of carbon nanotubes by filled iron nanowires for selective oxidation of ethylbenzene. Catalysis Communications, 2014. 51, p. 77–81. [113] L. Fu Influence of the metal sites of MNC (M= Co, Fe, Mn) catalysts derived from metalloporphyrins in ethylbenzene oxidation Chin. J. Catal. 37 3 2016 398 404 Fu, L., et al., Influence of the metal sites of MNC (M= Co, Fe, Mn) catalysts derived from metalloporphyrins in ethylbenzene oxidation. Chinese Journal of Catalysis, 2016. 37(3), p. 398–404. [114] K. Peckh B. Orlińska Transition metal salts of carboxylated multiwalled carbon nanotubes in combination with N-hydroxyphthalimide as catalytic systems for hydrocarbon oxidation Materials 14 9 2021 2314 Peckh, K. and B. Orlińska, Transition Metal Salts of Carboxylated Multiwalled Carbon Nanotubes in Combination with N-hydroxyphthalimide as Catalytic Systems for Hydrocarbon Oxidation. Materials, 2021. 14(9), p. 2314. [115] Y. Feng A. Zeng Selective liquid-phase oxidation of toluene with molecular oxygen catalyzed by Mn3O4 nanoparticles immobilized on CNTs under solvent-free conditions Catalysts 10 6 2020 623 Feng, Y. and A. Zeng, Selective liquid-phase oxidation of toluene with molecular oxygen catalyzed by Mn3O4 nanoparticles immobilized on CNTs under solvent-free conditions. Catalysts, 2020. 10(6), p. 623. [116] Z. Wang Mesoporous silica-supported manganese oxides for complete oxidation of volatile organic compounds, Influence of mesostructure, redox properties, and hydrocarbon dimension Ind. Eng. Chem. Res. 57 22 2018 7374 7382 Wang, Z., et al., Mesoporous silica-supported manganese oxides for complete oxidation of volatile organic compounds, Influence of mesostructure, redox properties, and hydrocarbon dimension. Industrial & Engineering Chemistry Research, 2018. 57(22), p. 7374–7382. [117] K. Machado Synthesis of superparamagnetic carbon nanotubes immobilized Pt and Pd pincer complexes, highly active and selective catalysts towards cyclohexane oxidation with dioxygen Dalton Trans. 43 46 2014 17475 17482 Machado, K., et al., Synthesis of superparamagnetic carbon nanotubes immobilized Pt and Pd pincer complexes, highly active and selective catalysts towards cyclohexane oxidation with dioxygen. Dalton Transactions, 2014. 43(46), p. 17475–17482. [118] M. Moghadam Manganese (III) porphyrin supported on multi-wall carbon nanotubes, A highly efficient and reusable biomimetic catalyst for epoxidation of alkenes with sodium periodate Polyhedron 28 17 2009 3816 3822 Moghadam, M., et al., Manganese (III) porphyrin supported on multi-wall carbon nanotubes, A highly efficient and reusable biomimetic catalyst for epoxidation of alkenes with sodium periodate. Polyhedron, 2009. 28(17), p. 3816–3822. [119] B. Orlińska I. Romanowska N-Hydroxyphthalimide and transition metal salts as catalysts of the liquid-phase oxidation of 1-methoxy-4-(1-methylethyl) benzene with oxygen Open Chem. 9 4 2011 670 676 Orlińska, B. and I. Romanowska, N-Hydroxyphthalimide and transition metal salts as catalysts of the liquid-phase oxidation of 1-methoxy-4-(1-methylethyl) benzene with oxygen. Open Chemistry, 2011. 9(4), p. 670–676. [120] N.V. Ulitin Catalytic properties of metals of the 2nd AND 12th groups in cumene oxidation Appl. Catal. A, Gen. 2023 119044 Ulitin, N.V., et al., CATALYTIC PROPERTIES OF METALS OF THE 2nd AND 12th GROUPS IN CUMENE OXIDATION. Applied Catalysis A, General, 2023, p. 119044. [121] N. Ulitin The cumene oxidation and cumene hydroperoxide decomposition in the presence of Zn, Cd or Hg 2-ethylhexanoate, Kinetic model and analysis of its sensitivity Mol. Catal. 515 2021 111886 Ulitin, N., et al., The cumene oxidation and cumene hydroperoxide decomposition in the presence of Zn, Cd or Hg 2-ethylhexanoate, Kinetic model and analysis of its sensitivity. Molecular Catalysis, 2021. 515, p. 111886. [122] N. Тurovskij Anion effect on the cumene hydroperoxide decomposition in the presence of Cu (II) 1, 10-phenanthrolinates J. Organomet. Chem. 922 2020 121371 Тurovskij, N., et al., Anion effect on the cumene hydroperoxide decomposition in the presence of Cu (II) 1, 10-phenanthrolinates. Journal of Organometallic Chemistry, 2020. 922, p. 121371. [123] R. Srivastava R. Srivastava Kinetics of liquid phase oxidation of cumene with Cr2O3, MnO2 and Fe2O3 catalysts J. Catal. 39 3 1975 317 323 Srivastava, R. and R. Srivastava, Kinetics of liquid phase oxidation of cumene with Cr2O3, MnO2 and Fe2O3 catalysts. Journal of Catalysis, 1975. 39(3), p. 317–323. [124] X. Pan X. Bao The effects of confinement inside carbon nanotubes on catalysis Acc. Chem. Res. 44 8 2011 553 562 Pan, X. and X. Bao, The effects of confinement inside carbon nanotubes on catalysis. Accounts of chemical research, 2011. 44(8), p. 553–562. [125] T. Trang Nguyen P. Serp Confinement of metal nanoparticles in carbon nanotubes ChemCatChem 5 12 2013 3595 3603 Trang Nguyen, T. and P. Serp, Confinement of metal nanoparticles in carbon nanotubes. ChemCatChem, 2013. 5(12), p. 3595–3603. [126] Z. Chen Understanding of cumene oxidation catalyzed by metal–nitrogen–carbon through theoretical simulations and kinetic validation ACS Sustain. Chem. Eng. 11 14 2023 5773 5781 Z. Chen, et al., Understanding of Cumene Oxidation Catalyzed by Metal–Nitrogen–Carbon through Theoretical Simulations and Kinetic Validation, ACS Sustainable Chemistry & Engineering 11 (14) (2023) 5773–5781. [127] Y. Chen Ionic‐liquid‐derived boron‐doped cobalt‐coordinating nitrogen‐doped carbon materials for enhanced catalytic activity ChemCatChem 8 10 2016 1782 1787 Chen, Y., et al., Ionic‐Liquid‐Derived Boron‐Doped Cobalt‐Coordinating Nitrogen‐Doped Carbon Materials for Enhanced Catalytic Activity. ChemCatChem, 2016. 8(10), p. 1782–1787. [128] G. Xiang Influence of doping nitrogen on the catalytic performance of carbon nanotubes encapsulating cobalt for selective oxidation of arylalkanes Particuology 58 2021 85 91 Xiang, G., et al., Influence of doping nitrogen on the catalytic performance of carbon nanotubes encapsulating cobalt for selective oxidation of arylalkanes. Particuology, 2021. 58, p. 85–91. [129] X. Pan X. Bao Reactions over catalysts confined in carbon nanotubes Chem. Commun. 47 2008 6271 6281 Pan, X. and X. Bao, Reactions over catalysts confined in carbon nanotubes. Chemical communications, 2008(47), p. 6271–6281. [130] S.A. Miners G.A. Rance A.N. Khlobystov Chemical reactions confined within carbon nanotubes Chem. Soc. Rev. 45 17 2016 4727 4746 Miners, S.A., G.A. Rance, and A.N. Khlobystov, Chemical reactions confined within carbon nanotubes. Chemical Society Reviews, 2016. 45(17), p. 4727–4746. [131] Z.-Q. Shi Filled cobalt nanoparticles into carbon nanotubes as a rapid and high-efficiency catalyst for selective epoxidation of styrene with molecular oxygen Chem. Eng. J. 237 2014 81 87 Shi, Z.-Q., et al., Filled cobalt nanoparticles into carbon nanotubes as a rapid and high-efficiency catalyst for selective epoxidation of styrene with molecular oxygen. Chemical Engineering Journal, 2014. 237, p. 81–87. [132] T.Y. Ma Graphitic carbon nitride nanosheet–carbon nanotube three‐dimensional porous composites as high‐performance oxygen evolution electrocatalysts Angew. Chem. 126 28 2014 7409 7413 Ma, T.Y., et al., Graphitic carbon nitride nanosheet–carbon nanotube three‐dimensional porous composites as high‐performance oxygen evolution electrocatalysts. Angewandte Chemie, 2014. 126(28), p. 7409–7413. [133] S. Wang BCN graphene as efficient metal‐free electrocatalyst for the oxygen reduction reaction Angew. Chem. Int. Ed. 51 17 2012 4209 4212 Wang, S., et al., BCN graphene as efficient metal‐free electrocatalyst for the oxygen reduction reaction. Angewandte Chemie International Edition, 2012. 51(17), p. 4209–4212. [134] W. Yang Bamboo-like carbon nanotube/Fe3C nanoparticle hybrids and their highly efficient catalysis for oxygen reduction J. Am. Chem. Soc. 137 4 2015 1436 1439 Yang, W., et al., Bamboo-like carbon nanotube/Fe3C nanoparticle hybrids and their highly efficient catalysis for oxygen reduction. Journal of the American Chemical Society, 2015. 137(4), p. 1436–1439. [135] L. Zhao Cascade anchoring strategy for general mass production of high-loading single-atomic metal-nitrogen catalysts Nat. Commun. 10 1 2019 1278 Zhao, L., et al., Cascade anchoring strategy for general mass production of high-loading single-atomic metal-nitrogen catalysts. Nature communications, 2019. 10(1), p. 1278. [136] Y. Su Elucidating mechanism of ethylbenzene oxidation catalyzed by carbon‐based catalysts with kinetic modeling AIChE J. 69 5 2023 e18007 Y. Su et al. Elucidating mechanism of ethylbenzene oxidation catalyzed by carbon‐based catalysts with kinetic modeling AIChE J. 69 5 2023 e18007. [137] C. Gong Heterogeneous activation of peroxymonosulfate by Fe-Co layered doubled hydroxide for efficient catalytic degradation of Rhoadmine B Chem. Eng. J. 321 2017 222 232 Gong, C., et al., Heterogeneous activation of peroxymonosulfate by Fe-Co layered doubled hydroxide for efficient catalytic degradation of Rhoadmine B. Chemical engineering journal, 2017. 321, p. 222–232. [138] C. Chen Temperature effect on quenching of CH (A2Δ) Chem. Phys. 230 2–3 1998 317 325 Chen, C., et al., Temperature effect on quenching of CH (A2Δ). Chemical physics, 1998. 230(2–3), p. 317–325. [139] Y. Gao Collisional quenching of CCl2 radicals in the A1B1 (0, 4, 0) and a3B1 states by alcohols Chem. Phys. Lett. 339 3–4 2001 209 215 Gao, Y., et al., Collisional quenching of CCl2 radicals in the A1B1 (0, 4, 0) and a3B1 states by alcohols. Chemical physics letters, 2001. 339(3–4), p. 209–215. [140] P. Zhou Radicals induced from peroxomonosulfate by nanoscale zero-valent copper in the acidic solution Water Sci. Technol. 74 8 2016 1946 1952 Zhou, P., et al., Radicals induced from peroxomonosulfate by nanoscale zero-valent copper in the acidic solution. Water Science and Technology, 2016. 74(8), p. 1946–1952. [141] B. Chen Aerobic selective oxidation of methylaromatics to benzoic acids over Co@ N/Co-CNTs with high loading CoN 4 species J. Mater. Chem. A 7 48 2019 27212 27216 Chen, B., et al., Aerobic selective oxidation of methylaromatics to benzoic acids over Co@ N/Co-CNTs with high loading CoN 4 species. Journal of Materials Chemistry A, 2019. 7(48), p. 27212–27216. [142] J. Gao The efficient liquid‐phase oxidation of aromatic hydrocarbons by molecular oxygen in the presence of MnCO3 J. Chem. Technol. Biotechnol., Int. Res. Process, Environ. Clean. Technol. 82 7 2007 620 625 Gao, J., et al., The efficient liquid‐phase oxidation of aromatic hydrocarbons by molecular oxygen in the presence of MnCO3. Journal of Chemical Technology & Biotechnology, International Research in Process, Environmental & Clean Technology, 2007. 82(7), p. 620–625. [143] E. Skliri Mesoporous assembled Mn3O4 nanoparticle networks as efficient catalysts for selective oxidation of alkenes and aryl alkanes ChemPlusChem 82 1 2017 136 143 Skliri, E., et al., Mesoporous assembled Mn3O4 nanoparticle networks as efficient catalysts for selective oxidation of alkenes and aryl alkanes. ChemPlusChem, 2017. 82(1), p. 136–143. [144] M. Biswal Selectivity tailoring in liquid phase oxidation over MWNT-Mn3O4 nanocomposite catalysts J. Phys. Chem. C. 115 31 2011 15440 15448 Biswal, M., et al., Selectivity tailoring in liquid phase oxidation over MWNT-Mn3O4 nanocomposite catalysts. The Journal of Physical Chemistry C, 2011. 115(31), p. 15440–15448. [145] Y. Deng MnO2 nanoparticles supported on CNTs for cumene oxidation, synergistic effect and kinetic modelling Chem. Eng. J. 444 2022 136666 Deng, Y., et al., MnO2 nanoparticles supported on CNTs for cumene oxidation, Synergistic effect and kinetic modelling. Chemical Engineering Journal, 2022. 444, p. 136666. [146] G. Ovejero Multiwalled carbon nanotubes for liquid-phase oxidation Funct., Charact., Catal. Act. Ind. Eng. Chem. Res. 45 7 2006 2206 2212 Ovejero, G., et al., Multiwalled carbon nanotubes for liquid-phase oxidation. Functionalization, characterization, and catalytic activity. Industrial & engineering chemistry research, 2006. 45(7), p. 2206–2212. [147] Z. Chen Inhibitory effect of Zn2+ on the chain‐initiation process of cumene oxidation Int. J. Quantum Chem. 121 21 2021 e26780 Chen, Z., et al., Inhibitory effect of Zn2+ on the chain‐initiation process of cumene oxidation. International Journal of Quantum Chemistry, 2021. 121(21), p. e26780. [148] J. Deng Trace amounts of Cu (OAc) 2 boost the efficiency of cumene oxidation catalyzed by carbon nanotubes washed with HCl Catal. Sci. Technol. 10 8 2020 2523 2530 Deng, J., et al., Trace amounts of Cu (OAc) 2 boost the efficiency of cumene oxidation catalyzed by carbon nanotubes washed with HCl. Catalysis Science & Technology, 2020. 10(8), p. 2523–2530. [149] I.D. Rosca Oxidation of multiwalled carbon nanotubes by nitric acid Carbon 43 15 2005 3124 3131 Rosca, I.D., et al., Oxidation of multiwalled carbon nanotubes by nitric acid. Carbon, 2005. 43(15), p. 3124–3131. [150] T.G. Ros Surface oxidation of carbon nanofibres Chem. Eur. J. 8 5 2002 1151 1162 Ros, T.G., et al., Surface oxidation of carbon nanofibres. Chemistry–A European Journal, 2002. 8(5), p. 1151–1162. [151] N. Sezer M. Koç Oxidative acid treatment of carbon nanotubes Surf. Interfaces 14 2019 1 8 Sezer, N. and M. Koç, Oxidative acid treatment of carbon nanotubes. Surfaces and Interfaces, 2019. 14, p. 1–8. [152] P.-X. Hou C. Liu H.-M. Cheng Purification of carbon nanotubes Carbon 46 15 2008 2003 2025 Hou, P.-X., C. Liu, and H.-M. Cheng, Purification of carbon nanotubes. carbon, 2008. 46(15), p. 2003–2025. [153] M. Melchionna Carbon nanotubes and catalysis, the many facets of a successful marriage Catal. Sci. Technol. 5 8 2015 3859 3875 Melchionna, M., et al., Carbon nanotubes and catalysis, the many facets of a successful marriage. Catalysis Science & Technology, 2015. 5(8), p. 3859–3875. [154] J.-C. Charlier T. Ebbesen P. Lambin Structural and electronic properties of pentagon-heptagon pair defects in carbon nanotubes Phys. Rev. B 53 16 1996 11108 Charlier, J.-C., T. Ebbesen, and P. Lambin, Structural and electronic properties of pentagon-heptagon pair defects in carbon nanotubes. Physical Review B, 1996. 53(16), p. 11108. [155] H.-y He B.-c Pan Studies on structural defects in carbon nanotubes Front. Phys. China 4 2009 297 306 He, H.-y. and B.-c. Pan, Studies on structural defects in carbon nanotubes. Frontiers of Physics in China, 2009. 4, p. 297–306.",
      "scopus-id": "85175034333",
      "coredata": {
        "eid": "1-s2.0-S0926860X23004453",
        "dc:description": "The liquid-phase aerobic oxidation of hydrocarbons to more valuable oxygenized compounds is among the most crucial industrial processes. Traditionally, these processes were executed by using a stoichiometric amount of various toxic oxidants with homogeneous catalysts of transition-metal salts and complexes, which results in the production of a gigantic amount of corrosive and noxious waste. Recently, carbon nanotubes have gained momentous importance as catalysts and catalytic support in various chemical processes because of their unprecedented properties. Few researchers have actually employed carbon nanotubes and functionalized carbon nanotubes as catalysts and catalytic support for the liquid-phase aerobic oxidation of hydrocarbons. This review specifically focused on the use of carbon nanotubes and functionalized carbon nanotubes as catalysts and catalytic supports in the liquid-phase aerobic oxidation of hydrocarbons. A plausible mechanism of the reaction has also been drawn while thoroughly reviewing the previously reported data. The impact of impurities in carbon nanotubes on their catalytic activity for the liquid-phase aerobic oxidation of hydrocarbons has also been discussed. It is observed from the literature that oxygenated carbon nanotubes have a negative effect on their catalytic activity for the liquid-phase aerobic oxidation of hydrocarbons, while nitrogen doping and/or metal nanoparticle immobilization, the surface electron transfer between the modified carbon nanotubes and radicals enhanced and improved the catalytic activity. Furthermore, the nitrogen-doped and/or metal-nanoparticle-incorporated carbon nanotubes accelerate the decomposition of hydroperoxides, which are key intermediates in the liquid-phase aerobic oxidation of hydrocarbons, thereby improving the overall catalytic activity.",
        "openArchiveArticle": "false",
        "prism:coverDate": "2023-11-25",
        "openaccessUserLicense": null,
        "prism:aggregationType": "Journal",
        "prism:url": "https://api.elsevier.com/content/article/pii/S0926860X23004453",
        "dc:creator": [
          {
            "@_fa": "true",
            "$": "Azam, Shakir Ul"
          },
          {
            "@_fa": "true",
            "$": "Orlińska, Beata"
          }
        ],
        "link": [
          {
            "@_fa": "true",
            "@rel": "self",
            "@href": "https://api.elsevier.com/content/article/pii/S0926860X23004453"
          },
          {
            "@_fa": "true",
            "@rel": "scidir",
            "@href": "https://www.sciencedirect.com/science/article/pii/S0926860X23004453"
          }
        ],
        "dc:format": "application/json",
        "openaccessType": null,
        "pii": "S0926-860X(23)00445-3",
        "prism:volume": "668",
        "articleNumber": "119465",
        "prism:publisher": "Elsevier B.V.",
        "dc:title": "Carbon nanotubes as advanced catalysts and catalytic supports for the liquid-phase aerobic oxidation of hydrocarbons: A review",
        "prism:copyright": "© 2023 Elsevier B.V. All rights reserved.",
        "openaccess": "0",
        "prism:issn": "0926860X",
        "dcterms:subject": [
          {
            "@_fa": "true",
            "$": "Carbon nanotubes"
          },
          {
            "@_fa": "true",
            "$": "Metal-free catalysts"
          },
          {
            "@_fa": "true",
            "$": "Heterogeneous catalysts"
          },
          {
            "@_fa": "true",
            "$": "Hydrocarbon oxidations"
          },
          {
            "@_fa": "true",
            "$": "Liquid-phase aerobic oxidation"
          }
        ],
        "openaccessArticle": "false",
        "prism:publicationName": "Applied Catalysis A: General",
        "openaccessSponsorType": null,
        "prism:pageRange": "119465",
        "pubType": "rev",
        "prism:coverDisplayDate": "25 November 2023",
        "prism:doi": "10.1016/j.apcata.2023.119465",
        "prism:startingPage": "119465",
        "dc:identifier": "doi:10.1016/j.apcata.2023.119465",
        "openaccessSponsorName": null
      },
      "objects": {
        "object": [
          {
            "@category": "standard",
            "@height": "379",
            "@width": "376",
            "@_fa": "true",
            "$": "https://api.elsevier.com/content/object/eid/1-s2.0-S0926860X23004453-gr3.jpg?httpAccept=%2A%2F%2A",
            "@multimediatype": "JPEG image file",
            "@type": "IMAGE-DOWNSAMPLED",
            "@size": "45753",
            "@ref": "gr3",
            "@mimetype": "image/jpeg"
          },
          {
            "@category": "standard",
            "@height": "200",
            "@width": "489",
            "@_fa": "true",
            "$": "https://api.elsevier.com/content/object/eid/1-s2.0-S0926860X23004453-ga1.jpg?httpAccept=%2A%2F%2A",
            "@multimediatype": "JPEG image file",
            "@type": "IMAGE-DOWNSAMPLED",
            "@size": "30103",
            "@ref": "ga1",
            "@mimetype": "image/jpeg"
          },
          {
            "@category": "standard",
            "@height": "723",
            "@width": "791",
            "@_fa": "true",
            "$": "https://api.elsevier.com/content/object/eid/1-s2.0-S0926860X23004453-gr7.jpg?httpAccept=%2A%2F%2A",
            "@multimediatype": "JPEG image file",
            "@type": "IMAGE-DOWNSAMPLED",
            "@size": "144041",
            "@ref": "gr7",
            "@mimetype": "image/jpeg"
          },
          {
            "@category": "standard",
            "@height": "550",
            "@width": "791",
            "@_fa": "true",
            "$": "https://api.elsevier.com/content/object/eid/1-s2.0-S0926860X23004453-gr6.jpg?httpAccept=%2A%2F%2A",
            "@multimediatype": "JPEG image file",
            "@type": "IMAGE-DOWNSAMPLED",
            "@size": "110605",
            "@ref": "gr6",
            "@mimetype": "image/jpeg"
          },
          {
            "@category": "standard",
            "@height": "153",
            "@width": "565",
            "@_fa": "true",
            "$": "https://api.elsevier.com/content/object/eid/1-s2.0-S0926860X23004453-sc1.jpg?httpAccept=%2A%2F%2A",
            "@multimediatype": "JPEG image file",
            "@type": "IMAGE-DOWNSAMPLED",
            "@size": "17848",
            "@ref": "sc1",
            "@mimetype": "image/jpeg"
          },
          {
            "@category": "standard",
            "@height": "236",
            "@width": "334",
            "@_fa": "true",
            "$": "https://api.elsevier.com/content/object/eid/1-s2.0-S0926860X23004453-gr2.jpg?httpAccept=%2A%2F%2A",
            "@multimediatype": "JPEG image file",
            "@type": "IMAGE-DOWNSAMPLED",
            "@size": "16012",
            "@ref": "gr2",
            "@mimetype": "image/jpeg"
          },
          {
            "@category": "standard",
            "@height": "131",
            "@width": "339",
            "@_fa": "true",
            "$": "https://api.elsevier.com/content/object/eid/1-s2.0-S0926860X23004453-gr1.jpg?httpAccept=%2A%2F%2A",
            "@multimediatype": "JPEG image file",
            "@type": "IMAGE-DOWNSAMPLED",
            "@size": "10857",
            "@ref": "gr1",
            "@mimetype": "image/jpeg"
          },
          {
            "@category": "standard",
            "@height": "562",
            "@width": "565",
            "@_fa": "true",
            "$": "https://api.elsevier.com/content/object/eid/1-s2.0-S0926860X23004453-gr5.jpg?httpAccept=%2A%2F%2A",
            "@multimediatype": "JPEG image file",
            "@type": "IMAGE-DOWNSAMPLED",
            "@size": "111872",
            "@ref": "gr5",
            "@mimetype": "image/jpeg"
          },
          {
            "@category": "standard",
            "@height": "150",
            "@width": "188",
            "@_fa": "true",
            "$": "https://api.elsevier.com/content/object/eid/1-s2.0-S0926860X23004453-gr4.jpg?httpAccept=%2A%2F%2A",
            "@multimediatype": "JPEG image file",
            "@type": "IMAGE-DOWNSAMPLED",
            "@size": "12290",
            "@ref": "gr4",
            "@mimetype": "image/jpeg"
          },
          {
            "@category": "standard",
            "@height": "549",
            "@width": "678",
            "@_fa": "true",
            "$": "https://api.elsevier.com/content/object/eid/1-s2.0-S0926860X23004453-sc2.jpg?httpAccept=%2A%2F%2A",
            "@multimediatype": "JPEG image file",
            "@type": "IMAGE-DOWNSAMPLED",
            "@size": "76491",
            "@ref": "sc2",
            "@mimetype": "image/jpeg"
          },
          {
            "@category": "thumbnail",
            "@height": "163",
            "@width": "162",
            "@_fa": "true",
            "$": "https://api.elsevier.com/content/object/eid/1-s2.0-S0926860X23004453-gr3.sml?httpAccept=%2A%2F%2A",
            "@multimediatype": "GIF image file",
            "@type": "IMAGE-THUMBNAIL",
            "@size": "10390",
            "@ref": "gr3",
            "@mimetype": "image/gif"
          },
          {
            "@category": "thumbnail",
            "@height": "90",
            "@width": "219",
            "@_fa": "true",
            "$": "https://api.elsevier.com/content/object/eid/1-s2.0-S0926860X23004453-ga1.sml?httpAccept=%2A%2F%2A",
            "@multimediatype": "GIF image file",
            "@type": "IMAGE-THUMBNAIL",
            "@size": "7510",
            "@ref": "ga1",
            "@mimetype": "image/gif"
          },
          {
            "@category": "thumbnail",
            "@height": "164",
            "@width": "179",
            "@_fa": "true",
            "$": "https://api.elsevier.com/content/object/eid/1-s2.0-S0926860X23004453-gr7.sml?httpAccept=%2A%2F%2A",
            "@multimediatype": "GIF image file",
            "@type": "IMAGE-THUMBNAIL",
            "@size": "14815",
            "@ref": "gr7",
            "@mimetype": "image/gif"
          },
          {
            "@category": "thumbnail",
            "@height": "152",
            "@width": "219",
            "@_fa": "true",
            "$": "https://api.elsevier.com/content/object/eid/1-s2.0-S0926860X23004453-gr6.sml?httpAccept=%2A%2F%2A",
            "@multimediatype": "GIF image file",
            "@type": "IMAGE-THUMBNAIL",
            "@size": "20975",
            "@ref": "gr6",
            "@mimetype": "image/gif"
          },
          {
            "@category": "thumbnail",
            "@height": "59",
            "@width": "219",
            "@_fa": "true",
            "$": "https://api.elsevier.com/content/object/eid/1-s2.0-S0926860X23004453-sc1.sml?httpAccept=%2A%2F%2A",
            "@multimediatype": "GIF image file",
            "@type": "IMAGE-THUMBNAIL",
            "@size": "3314",
            "@ref": "sc1",
            "@mimetype": "image/gif"
          },
          {
            "@category": "thumbnail",
            "@height": "155",
            "@width": "219",
            "@_fa": "true",
            "$": "https://api.elsevier.com/content/object/eid/1-s2.0-S0926860X23004453-gr2.sml?httpAccept=%2A%2F%2A",
            "@multimediatype": "GIF image file",
            "@type": "IMAGE-THUMBNAIL",
            "@size": "5841",
            "@ref": "gr2",
            "@mimetype": "image/gif"
          },
          {
            "@category": "thumbnail",
            "@height": "85",
            "@width": "219",
            "@_fa": "true",
            "$": "https://api.elsevier.com/content/object/eid/1-s2.0-S0926860X23004453-gr1.sml?httpAccept=%2A%2F%2A",
            "@multimediatype": "GIF image file",
            "@type": "IMAGE-THUMBNAIL",
            "@size": "6632",
            "@ref": "gr1",
            "@mimetype": "image/gif"
          },
          {
            "@category": "thumbnail",
            "@height": "164",
            "@width": "165",
            "@_fa": "true",
            "$": "https://api.elsevier.com/content/object/eid/1-s2.0-S0926860X23004453-gr5.sml?httpAccept=%2A%2F%2A",
            "@multimediatype": "GIF image file",
            "@type": "IMAGE-THUMBNAIL",
            "@size": "16101",
            "@ref": "gr5",
            "@mimetype": "image/gif"
          },
          {
            "@category": "thumbnail",
            "@height": "164",
            "@width": "205",
            "@_fa": "true",
            "$": "https://api.elsevier.com/content/object/eid/1-s2.0-S0926860X23004453-gr4.sml?httpAccept=%2A%2F%2A",
            "@multimediatype": "GIF image file",
            "@type": "IMAGE-THUMBNAIL",
            "@size": "12626",
            "@ref": "gr4",
            "@mimetype": "image/gif"
          },
          {
            "@category": "thumbnail",
            "@height": "164",
            "@width": "202",
            "@_fa": "true",
            "$": "https://api.elsevier.com/content/object/eid/1-s2.0-S0926860X23004453-sc2.sml?httpAccept=%2A%2F%2A",
            "@multimediatype": "GIF image file",
            "@type": "IMAGE-THUMBNAIL",
            "@size": "7022",
            "@ref": "sc2",
            "@mimetype": "image/gif"
          },
          {
            "@category": "high",
            "@height": "1676",
            "@width": "1663",
            "@_fa": "true",
            "$": "https://api.elsevier.com/content/object/eid/1-s2.0-S0926860X23004453-gr3_lrg.jpg?httpAccept=%2A%2F%2A",
            "@multimediatype": "JPEG image file",
            "@type": "IMAGE-HIGH-RES",
            "@size": "216120",
            "@ref": "gr3",
            "@mimetype": "image/jpeg"
          },
          {
            "@category": "high",
            "@height": "886",
            "@width": "2164",
            "@_fa": "true",
            "$": "https://api.elsevier.com/content/object/eid/1-s2.0-S0926860X23004453-ga1_lrg.jpg?httpAccept=%2A%2F%2A",
            "@multimediatype": "JPEG image file",
            "@type": "IMAGE-HIGH-RES",
            "@size": "246956",
            "@ref": "ga1",
            "@mimetype": "image/jpeg"
          },
          {
            "@category": "high",
            "@height": "3192",
            "@width": "3493",
            "@_fa": "true",
            "$": "https://api.elsevier.com/content/object/eid/1-s2.0-S0926860X23004453-gr7_lrg.jpg?httpAccept=%2A%2F%2A",
            "@multimediatype": "JPEG image file",
            "@type": "IMAGE-HIGH-RES",
            "@size": "910513",
            "@ref": "gr7",
            "@mimetype": "image/jpeg"
          },
          {
            "@category": "high",
            "@height": "2427",
            "@width": "3493",
            "@_fa": "true",
            "$": "https://api.elsevier.com/content/object/eid/1-s2.0-S0926860X23004453-gr6_lrg.jpg?httpAccept=%2A%2F%2A",
            "@multimediatype": "JPEG image file",
            "@type": "IMAGE-HIGH-RES",
            "@size": "519449",
            "@ref": "gr6",
            "@mimetype": "image/jpeg"
          },
          {
            "@category": "high",
            "@height": "676",
            "@width": "2495",
            "@_fa": "true",
            "$": "https://api.elsevier.com/content/object/eid/1-s2.0-S0926860X23004453-sc1_lrg.jpg?httpAccept=%2A%2F%2A",
            "@multimediatype": "JPEG image file",
            "@type": "IMAGE-HIGH-RES",
            "@size": "116373",
            "@ref": "sc1",
            "@mimetype": "image/jpeg"
          },
          {
            "@category": "high",
            "@height": "1048",
            "@width": "1482",
            "@_fa": "true",
            "$": "https://api.elsevier.com/content/object/eid/1-s2.0-S0926860X23004453-gr2_lrg.jpg?httpAccept=%2A%2F%2A",
            "@multimediatype": "JPEG image file",
            "@type": "IMAGE-HIGH-RES",
            "@size": "109310",
            "@ref": "gr2",
            "@mimetype": "image/jpeg"
          },
          {
            "@category": "high",
            "@height": "580",
            "@width": "1497",
            "@_fa": "true",
            "$": "https://api.elsevier.com/content/object/eid/1-s2.0-S0926860X23004453-gr1_lrg.jpg?httpAccept=%2A%2F%2A",
            "@multimediatype": "JPEG image file",
            "@type": "IMAGE-HIGH-RES",
            "@size": "117645",
            "@ref": "gr1",
            "@mimetype": "image/jpeg"
          },
          {
            "@category": "high",
            "@height": "2481",
            "@width": "2495",
            "@_fa": "true",
            "$": "https://api.elsevier.com/content/object/eid/1-s2.0-S0926860X23004453-gr5_lrg.jpg?httpAccept=%2A%2F%2A",
            "@multimediatype": "JPEG image file",
            "@type": "IMAGE-HIGH-RES",
            "@size": "684508",
            "@ref": "gr5",
            "@mimetype": "image/jpeg"
          },
          {
            "@category": "high",
            "@height": "664",
            "@width": "831",
            "@_fa": "true",
            "$": "https://api.elsevier.com/content/object/eid/1-s2.0-S0926860X23004453-gr4_lrg.jpg?httpAccept=%2A%2F%2A",
            "@multimediatype": "JPEG image file",
            "@type": "IMAGE-HIGH-RES",
            "@size": "92662",
            "@ref": "gr4",
            "@mimetype": "image/jpeg"
          },
          {
            "@category": "high",
            "@height": "2425",
            "@width": "2994",
            "@_fa": "true",
            "$": "https://api.elsevier.com/content/object/eid/1-s2.0-S0926860X23004453-sc2_lrg.jpg?httpAccept=%2A%2F%2A",
            "@multimediatype": "JPEG image file",
            "@type": "IMAGE-HIGH-RES",
            "@size": "583941",
            "@ref": "sc2",
            "@mimetype": "image/jpeg"
          },
          {
            "@category": "thumbnail",
            "@_fa": "true",
            "$": "https://api.elsevier.com/content/object/eid/1-s2.0-S0926860X23004453-si0001.svg?httpAccept=%2A%2F%2A",
            "@multimediatype": "Scalable Vector Graphics file",
            "@type": "ALTIMG",
            "@size": "3221",
            "@ref": "si0001",
            "@mimetype": "image/svg+xml"
          },
          {
            "@category": "thumbnail",
            "@_fa": "true",
            "$": "https://api.elsevier.com/content/object/eid/1-s2.0-S0926860X23004453-si0002.svg?httpAccept=%2A%2F%2A",
            "@multimediatype": "Scalable Vector Graphics file",
            "@type": "ALTIMG",
            "@size": "2771",
            "@ref": "si0002",
            "@mimetype": "image/svg+xml"
          },
          {
            "@category": "thumbnail",
            "@_fa": "true",
            "$": "https://api.elsevier.com/content/object/eid/1-s2.0-S0926860X23004453-si0003.svg?httpAccept=%2A%2F%2A",
            "@multimediatype": "Scalable Vector Graphics file",
            "@type": "ALTIMG",
            "@size": "2070",
            "@ref": "si0003",
            "@mimetype": "image/svg+xml"
          },
          {
            "@category": "thumbnail",
            "@_fa": "true",
            "$": "https://api.elsevier.com/content/object/eid/1-s2.0-S0926860X23004453-si0004.svg?httpAccept=%2A%2F%2A",
            "@multimediatype": "Scalable Vector Graphics file",
            "@type": "ALTIMG",
            "@size": "2078",
            "@ref": "si0004",
            "@mimetype": "image/svg+xml"
          },
          {
            "@category": "thumbnail",
            "@_fa": "true",
            "$": "https://api.elsevier.com/content/object/eid/1-s2.0-S0926860X23004453-si0005.svg?httpAccept=%2A%2F%2A",
            "@multimediatype": "Scalable Vector Graphics file",
            "@type": "ALTIMG",
            "@size": "2119",
            "@ref": "si0005",
            "@mimetype": "image/svg+xml"
          },
          {
            "@category": "thumbnail",
            "@_fa": "true",
            "$": "https://api.elsevier.com/content/object/eid/1-s2.0-S0926860X23004453-si0006.svg?httpAccept=%2A%2F%2A",
            "@multimediatype": "Scalable Vector Graphics file",
            "@type": "ALTIMG",
            "@size": "2179",
            "@ref": "si0006",
            "@mimetype": "image/svg+xml"
          },
          {
            "@category": "thumbnail",
            "@_fa": "true",
            "$": "https://api.elsevier.com/content/object/eid/1-s2.0-S0926860X23004453-si0007.svg?httpAccept=%2A%2F%2A",
            "@multimediatype": "Scalable Vector Graphics file",
            "@type": "ALTIMG",
            "@size": "3241",
            "@ref": "si0007",
            "@mimetype": "image/svg+xml"
          },
          {
            "@category": "thumbnail",
            "@_fa": "true",
            "$": "https://api.elsevier.com/content/object/eid/1-s2.0-S0926860X23004453-si0008.svg?httpAccept=%2A%2F%2A",
            "@multimediatype": "Scalable Vector Graphics file",
            "@type": "ALTIMG",
            "@size": "2127",
            "@ref": "si0008",
            "@mimetype": "image/svg+xml"
          },
          {
            "@category": "thumbnail",
            "@_fa": "true",
            "$": "https://api.elsevier.com/content/object/eid/1-s2.0-S0926860X23004453-si0009.svg?httpAccept=%2A%2F%2A",
            "@multimediatype": "Scalable Vector Graphics file",
            "@type": "ALTIMG",
            "@size": "1519",
            "@ref": "si0009",
            "@mimetype": "image/svg+xml"
          },
          {
            "@category": "thumbnail",
            "@_fa": "true",
            "$": "https://api.elsevier.com/content/object/eid/1-s2.0-S0926860X23004453-si0010.svg?httpAccept=%2A%2F%2A",
            "@multimediatype": "Scalable Vector Graphics file",
            "@type": "ALTIMG",
            "@size": "2727",
            "@ref": "si0010",
            "@mimetype": "image/svg+xml"
          },
          {
            "@category": "thumbnail",
            "@_fa": "true",
            "$": "https://api.elsevier.com/content/object/eid/1-s2.0-S0926860X23004453-si0011.svg?httpAccept=%2A%2F%2A",
            "@multimediatype": "Scalable Vector Graphics file",
            "@type": "ALTIMG",
            "@size": "2941",
            "@ref": "si0011",
            "@mimetype": "image/svg+xml"
          },
          {
            "@category": "thumbnail",
            "@_fa": "true",
            "$": "https://api.elsevier.com/content/object/eid/1-s2.0-S0926860X23004453-si0012.svg?httpAccept=%2A%2F%2A",
            "@multimediatype": "Scalable Vector Graphics file",
            "@type": "ALTIMG",
            "@size": "4084",
            "@ref": "si0012",
            "@mimetype": "image/svg+xml"
          },
          {
            "@category": "thumbnail",
            "@_fa": "true",
            "$": "https://api.elsevier.com/content/object/eid/1-s2.0-S0926860X23004453-si0013.svg?httpAccept=%2A%2F%2A",
            "@multimediatype": "Scalable Vector Graphics file",
            "@type": "ALTIMG",
            "@size": "960",
            "@ref": "si0013",
            "@mimetype": "image/svg+xml"
          },
          {
            "@category": "thumbnail",
            "@_fa": "true",
            "$": "https://api.elsevier.com/content/object/eid/1-s2.0-S0926860X23004453-si0014.svg?httpAccept=%2A%2F%2A",
            "@multimediatype": "Scalable Vector Graphics file",
            "@type": "ALTIMG",
            "@size": "960",
            "@ref": "si0014",
            "@mimetype": "image/svg+xml"
          },
          {
            "@category": "standard",
            "@_fa": "true",
            "$": "https://api.elsevier.com/content/object/eid/1-s2.0-S0926860X23004453-am.pdf?httpAccept=%2A%2F%2A",
            "@multimediatype": "Acrobat PDF file",
            "@type": "AAM-PDF",
            "@size": "3623669",
            "@ref": "am",
            "@mimetype": "application/pdf"
          }
        ]
      },
      "link": {
        "@rel": "abstract",
        "@href": "https://api.elsevier.com/content/abstract/scopus_id/85175034333"
      }
    }
  }
}